STDOUT:
Results will be saved in /home/philip/projects/ltspice_examples_code_repo/Circuit-Completion-Using-GNNs/component_classification_with_link_prediction_head/evaluation/FEGIN/results/model_FEGIN_dataset_ltspice_demos
Command line input: python main.py --data ltspice_demos --representation component_net --model FEGIN --layers 4 --hiddens 32 --batch_size 128 --lr 0.01 --emb_size 250 --epochs 100 --save_appendix component_net_L4_H32_BS128_LR0.01_E250 --no_val
 is saved.
-----
ltspice_demos - FEGIN
Using 4 layers, 32 hidden units, h = 2
Loading component_net representation dataset
ENTERED
Training FEGIN on component_net representation
Train: 1565, Test: 383
##################ITERATION #0 ****************************************
 epoch: 0, train_loss: 1.2392, test_loss: 1.3018, test_f1: 0.2281
 epoch: 1, train_loss: 1.1110, test_loss: 1.2559, test_f1: 0.2281
 epoch: 2, train_loss: 1.0361, test_loss: 1.2040, test_f1: 0.4030
 epoch: 3, train_loss: 1.0204, test_loss: 1.1772, test_f1: 0.4374
 epoch: 4, train_loss: 1.0070, test_loss: 1.2641, test_f1: 0.3682
 epoch: 5, train_loss: 0.9837, test_loss: 1.3842, test_f1: 0.3345
 epoch: 6, train_loss: 0.9324, test_loss: 1.1762, test_f1: 0.4515
 epoch: 7, train_loss: 0.9397, test_loss: 1.1807, test_f1: 0.5490
 epoch: 8, train_loss: 0.9275, test_loss: 1.0924, test_f1: 0.5213
 epoch: 9, train_loss: 0.9137, test_loss: 1.1516, test_f1: 0.4840
 epoch: 10, train_loss: 0.9061, test_loss: 1.0660, test_f1: 0.5111
 epoch: 11, train_loss: 0.9322, test_loss: 1.3034, test_f1: 0.5350
 epoch: 12, train_loss: 0.9029, test_loss: 1.1030, test_f1: 0.5267
 epoch: 13, train_loss: 0.8854, test_loss: 1.1365, test_f1: 0.5955
 epoch: 14, train_loss: 0.8837, test_loss: 1.0353, test_f1: 0.4786
 epoch: 15, train_loss: 0.8723, test_loss: 1.0852, test_f1: 0.5120
 epoch: 16, train_loss: 0.8425, test_loss: 1.0306, test_f1: 0.6021
 epoch: 17, train_loss: 0.8572, test_loss: 1.0503, test_f1: 0.6140
 epoch: 18, train_loss: 0.8467, test_loss: 1.0351, test_f1: 0.4824
 epoch: 19, train_loss: 0.8497, test_loss: 1.1112, test_f1: 0.5566
 epoch: 20, train_loss: 0.8629, test_loss: 1.0838, test_f1: 0.5606
 epoch: 21, train_loss: 0.8340, test_loss: 1.1070, test_f1: 0.6036
 epoch: 22, train_loss: 0.8218, test_loss: 1.2025, test_f1: 0.5228
 epoch: 23, train_loss: 0.8141, test_loss: 1.2705, test_f1: 0.5843
 epoch: 24, train_loss: 0.8176, test_loss: 1.0836, test_f1: 0.5706
 epoch: 25, train_loss: 0.8166, test_loss: 1.0884, test_f1: 0.5906
 epoch: 26, train_loss: 0.8075, test_loss: 1.2457, test_f1: 0.5766
 epoch: 27, train_loss: 0.7884, test_loss: 1.1518, test_f1: 0.5747
 epoch: 28, train_loss: 0.7693, test_loss: 1.2805, test_f1: 0.6005
 epoch: 29, train_loss: 0.7825, test_loss: 1.4468, test_f1: 0.5916
 epoch: 30, train_loss: 0.7932, test_loss: 1.1673, test_f1: 0.4773
 epoch: 31, train_loss: 0.7550, test_loss: 1.1239, test_f1: 0.5698
 epoch: 32, train_loss: 0.7391, test_loss: 1.2728, test_f1: 0.5322
 epoch: 33, train_loss: 0.7456, test_loss: 1.1361, test_f1: 0.5774
 epoch: 34, train_loss: 0.7255, test_loss: 1.4493, test_f1: 0.5303
 epoch: 35, train_loss: 0.7305, test_loss: 1.2440, test_f1: 0.5851
 epoch: 36, train_loss: 0.7307, test_loss: 1.1942, test_f1: 0.5324
 epoch: 37, train_loss: 0.7268, test_loss: 1.1231, test_f1: 0.4977
 epoch: 38, train_loss: 0.7367, test_loss: 1.1633, test_f1: 0.5869
 epoch: 39, train_loss: 0.7136, test_loss: 1.4123, test_f1: 0.5602
 epoch: 40, train_loss: 0.7023, test_loss: 1.4209, test_f1: 0.5711
 epoch: 41, train_loss: 0.6993, test_loss: 1.6721, test_f1: 0.3965
 epoch: 42, train_loss: 0.6907, test_loss: 1.3534, test_f1: 0.5679
 epoch: 43, train_loss: 0.6798, test_loss: 1.1222, test_f1: 0.5849
 epoch: 44, train_loss: 0.7057, test_loss: 1.6812, test_f1: 0.5106
 epoch: 45, train_loss: 0.6888, test_loss: 1.5291, test_f1: 0.5367
 epoch: 46, train_loss: 0.6953, test_loss: 1.7544, test_f1: 0.5105
 epoch: 47, train_loss: 0.6540, test_loss: 1.2218, test_f1: 0.5154
 epoch: 48, train_loss: 0.6570, test_loss: 1.3613, test_f1: 0.5758
 epoch: 49, train_loss: 0.6461, test_loss: 1.1906, test_f1: 0.6076
 epoch: 50, train_loss: 0.6565, test_loss: 1.2878, test_f1: 0.5956
 epoch: 51, train_loss: 0.6361, test_loss: 1.2839, test_f1: 0.5868
 epoch: 52, train_loss: 0.5923, test_loss: 1.2482, test_f1: 0.6153
 epoch: 53, train_loss: 0.6088, test_loss: 1.4807, test_f1: 0.5814
 epoch: 54, train_loss: 0.5823, test_loss: 1.2758, test_f1: 0.6271
 epoch: 55, train_loss: 0.5648, test_loss: 1.3797, test_f1: 0.6309
 epoch: 56, train_loss: 0.5629, test_loss: 1.5267, test_f1: 0.6229
 epoch: 57, train_loss: 0.5895, test_loss: 1.3749, test_f1: 0.6103
 epoch: 58, train_loss: 0.5523, test_loss: 1.4727, test_f1: 0.6054
 epoch: 59, train_loss: 0.5377, test_loss: 1.6194, test_f1: 0.5891
 epoch: 60, train_loss: 0.5393, test_loss: 1.5977, test_f1: 0.5833
 epoch: 61, train_loss: 0.5490, test_loss: 1.3645, test_f1: 0.5744
 epoch: 62, train_loss: 0.5437, test_loss: 1.5911, test_f1: 0.6092
 epoch: 63, train_loss: 0.5403, test_loss: 1.6192, test_f1: 0.5984
 epoch: 64, train_loss: 0.5441, test_loss: 1.4969, test_f1: 0.6163
 epoch: 65, train_loss: 0.5371, test_loss: 1.6800, test_f1: 0.6121
 epoch: 66, train_loss: 0.5329, test_loss: 1.5610, test_f1: 0.6017
 epoch: 67, train_loss: 0.5069, test_loss: 1.9199, test_f1: 0.5867
 epoch: 68, train_loss: 0.5052, test_loss: 1.8545, test_f1: 0.5902
 epoch: 69, train_loss: 0.5416, test_loss: 2.2380, test_f1: 0.5572
 epoch: 70, train_loss: 0.5287, test_loss: 1.6861, test_f1: 0.5859
 epoch: 71, train_loss: 0.4975, test_loss: 1.7284, test_f1: 0.6146
 epoch: 72, train_loss: 0.5440, test_loss: 1.6635, test_f1: 0.5964
 epoch: 73, train_loss: 0.5338, test_loss: 1.5898, test_f1: 0.6185
 epoch: 74, train_loss: 0.5446, test_loss: 2.0887, test_f1: 0.5277
 epoch: 75, train_loss: 0.5147, test_loss: 1.5806, test_f1: 0.6163
 epoch: 76, train_loss: 0.4902, test_loss: 1.8189, test_f1: 0.6031
 epoch: 77, train_loss: 0.4765, test_loss: 1.7109, test_f1: 0.6387
 epoch: 78, train_loss: 0.4765, test_loss: 1.7181, test_f1: 0.5700
 epoch: 79, train_loss: 0.4993, test_loss: 1.7119, test_f1: 0.6301
 epoch: 80, train_loss: 0.4795, test_loss: 1.8282, test_f1: 0.5483
 epoch: 81, train_loss: 0.4687, test_loss: 2.0795, test_f1: 0.5972
 epoch: 82, train_loss: 0.4576, test_loss: 1.8432, test_f1: 0.6027
 epoch: 83, train_loss: 0.5036, test_loss: 1.9534, test_f1: 0.6231
 epoch: 84, train_loss: 0.4478, test_loss: 1.7066, test_f1: 0.5837
 epoch: 85, train_loss: 0.4653, test_loss: 1.7455, test_f1: 0.5855
 epoch: 86, train_loss: 0.4559, test_loss: 1.8802, test_f1: 0.6114
 epoch: 87, train_loss: 0.5005, test_loss: 1.9346, test_f1: 0.6138
 epoch: 88, train_loss: 0.4535, test_loss: 1.8641, test_f1: 0.6148
 epoch: 89, train_loss: 0.4433, test_loss: 2.1970, test_f1: 0.6025
 epoch: 90, train_loss: 0.4927, test_loss: 2.0149, test_f1: 0.5826
 epoch: 91, train_loss: 0.4872, test_loss: 1.9639, test_f1: 0.6058
 epoch: 92, train_loss: 0.4770, test_loss: 1.8243, test_f1: 0.5966
 epoch: 93, train_loss: 0.4255, test_loss: 1.9314, test_f1: 0.6073
 epoch: 94, train_loss: 0.4404, test_loss: 1.9364, test_f1: 0.6237
 epoch: 95, train_loss: 0.4385, test_loss: 1.8986, test_f1: 0.5975
 epoch: 96, train_loss: 0.4166, test_loss: 2.2213, test_f1: 0.5837
 epoch: 97, train_loss: 0.4226, test_loss: 2.2159, test_f1: 0.6056
 epoch: 98, train_loss: 0.4357, test_loss: 2.0701, test_f1: 0.6042
 epoch: 99, train_loss: 0.4159, test_loss: 2.0377, test_f1: 0.6066
##################ITERATION #1 ****************************************
 epoch: 0, train_loss: 1.2119, test_loss: 1.3509, test_f1: 0.3307
 epoch: 1, train_loss: 1.0701, test_loss: 1.2186, test_f1: 0.3333
 epoch: 2, train_loss: 1.0100, test_loss: 1.0890, test_f1: 0.4031
 epoch: 3, train_loss: 0.9798, test_loss: 1.1230, test_f1: 0.4280
 epoch: 4, train_loss: 0.9590, test_loss: 1.2435, test_f1: 0.4351
 epoch: 5, train_loss: 0.9427, test_loss: 1.0570, test_f1: 0.4824
 epoch: 6, train_loss: 0.9424, test_loss: 1.0319, test_f1: 0.5088
 epoch: 7, train_loss: 0.9319, test_loss: 1.0376, test_f1: 0.5162
 epoch: 8, train_loss: 0.9241, test_loss: 1.1175, test_f1: 0.4609
 epoch: 9, train_loss: 0.9109, test_loss: 1.0439, test_f1: 0.5231
 epoch: 10, train_loss: 0.9000, test_loss: 1.0383, test_f1: 0.5344
 epoch: 11, train_loss: 0.9167, test_loss: 1.0721, test_f1: 0.5441
 epoch: 12, train_loss: 0.8938, test_loss: 1.1829, test_f1: 0.5209
 epoch: 13, train_loss: 0.8958, test_loss: 1.1107, test_f1: 0.4928
 epoch: 14, train_loss: 0.8841, test_loss: 1.3205, test_f1: 0.5034
 epoch: 15, train_loss: 0.8997, test_loss: 1.0088, test_f1: 0.5394
 epoch: 16, train_loss: 0.8728, test_loss: 1.0782, test_f1: 0.5149
 epoch: 17, train_loss: 0.8821, test_loss: 1.1081, test_f1: 0.5124
 epoch: 18, train_loss: 0.8694, test_loss: 1.1557, test_f1: 0.5261
 epoch: 19, train_loss: 0.8625, test_loss: 1.4724, test_f1: 0.4007
 epoch: 20, train_loss: 0.8605, test_loss: 1.0995, test_f1: 0.5438
 epoch: 21, train_loss: 0.8270, test_loss: 1.1710, test_f1: 0.4911
 epoch: 22, train_loss: 0.8101, test_loss: 1.0023, test_f1: 0.5614
 epoch: 23, train_loss: 0.8331, test_loss: 1.0318, test_f1: 0.5851
 epoch: 24, train_loss: 0.7883, test_loss: 1.5268, test_f1: 0.5154
 epoch: 25, train_loss: 0.7774, test_loss: 1.1358, test_f1: 0.5540
 epoch: 26, train_loss: 0.7857, test_loss: 0.9745, test_f1: 0.6000
 epoch: 27, train_loss: 0.7706, test_loss: 1.1144, test_f1: 0.6169
 epoch: 28, train_loss: 0.7460, test_loss: 1.1289, test_f1: 0.5670
 epoch: 29, train_loss: 0.7706, test_loss: 1.2501, test_f1: 0.5562
 epoch: 30, train_loss: 0.7655, test_loss: 1.1329, test_f1: 0.5781
 epoch: 31, train_loss: 0.7447, test_loss: 1.1260, test_f1: 0.5831
 epoch: 32, train_loss: 0.7360, test_loss: 1.1214, test_f1: 0.5687
 epoch: 33, train_loss: 0.7084, test_loss: 1.6361, test_f1: 0.4567
 epoch: 34, train_loss: 0.7231, test_loss: 1.2018, test_f1: 0.5145
 epoch: 35, train_loss: 0.7251, test_loss: 1.1945, test_f1: 0.5375
 epoch: 36, train_loss: 0.7072, test_loss: 1.4339, test_f1: 0.5741
 epoch: 37, train_loss: 0.6893, test_loss: 1.2431, test_f1: 0.5555
 epoch: 38, train_loss: 0.6923, test_loss: 1.1846, test_f1: 0.5667
 epoch: 39, train_loss: 0.6968, test_loss: 1.3286, test_f1: 0.5337
 epoch: 40, train_loss: 0.6833, test_loss: 1.3067, test_f1: 0.5516
 epoch: 41, train_loss: 0.6586, test_loss: 1.7949, test_f1: 0.4858
 epoch: 42, train_loss: 0.6845, test_loss: 1.3989, test_f1: 0.5511
 epoch: 43, train_loss: 0.6531, test_loss: 1.5028, test_f1: 0.5887
 epoch: 44, train_loss: 0.6632, test_loss: 1.6727, test_f1: 0.6053
 epoch: 45, train_loss: 0.6740, test_loss: 1.4981, test_f1: 0.5032
 epoch: 46, train_loss: 0.6827, test_loss: 1.3779, test_f1: 0.4888
 epoch: 47, train_loss: 0.6411, test_loss: 1.5634, test_f1: 0.5076
 epoch: 48, train_loss: 0.6364, test_loss: 1.3006, test_f1: 0.6022
 epoch: 49, train_loss: 0.6436, test_loss: 1.2672, test_f1: 0.5394
 epoch: 50, train_loss: 0.6105, test_loss: 1.2711, test_f1: 0.5995
 epoch: 51, train_loss: 0.5850, test_loss: 1.2976, test_f1: 0.5478
 epoch: 52, train_loss: 0.5541, test_loss: 1.3796, test_f1: 0.5839
 epoch: 53, train_loss: 0.5586, test_loss: 1.4065, test_f1: 0.5970
 epoch: 54, train_loss: 0.5451, test_loss: 1.5278, test_f1: 0.5897
 epoch: 55, train_loss: 0.5274, test_loss: 1.4358, test_f1: 0.5976
 epoch: 56, train_loss: 0.5071, test_loss: 1.5990, test_f1: 0.6239
 epoch: 57, train_loss: 0.5071, test_loss: 1.4929, test_f1: 0.6201
 epoch: 58, train_loss: 0.5278, test_loss: 1.5010, test_f1: 0.6014
 epoch: 59, train_loss: 0.5420, test_loss: 1.4355, test_f1: 0.5695
 epoch: 60, train_loss: 0.5066, test_loss: 1.4246, test_f1: 0.6174
 epoch: 61, train_loss: 0.4990, test_loss: 1.7303, test_f1: 0.5858
 epoch: 62, train_loss: 0.5296, test_loss: 1.5664, test_f1: 0.5928
 epoch: 63, train_loss: 0.5194, test_loss: 1.4113, test_f1: 0.6017
 epoch: 64, train_loss: 0.4990, test_loss: 1.6111, test_f1: 0.5555
 epoch: 65, train_loss: 0.5158, test_loss: 1.8743, test_f1: 0.5843
 epoch: 66, train_loss: 0.5181, test_loss: 1.6840, test_f1: 0.6101
 epoch: 67, train_loss: 0.4937, test_loss: 1.6424, test_f1: 0.5819
 epoch: 68, train_loss: 0.5191, test_loss: 1.7493, test_f1: 0.6076
 epoch: 69, train_loss: 0.4971, test_loss: 1.8912, test_f1: 0.5522
 epoch: 70, train_loss: 0.4992, test_loss: 1.5045, test_f1: 0.6360
 epoch: 71, train_loss: 0.5064, test_loss: 1.6260, test_f1: 0.6121
 epoch: 72, train_loss: 0.4982, test_loss: 2.3075, test_f1: 0.5908
 epoch: 73, train_loss: 0.5002, test_loss: 1.6419, test_f1: 0.5728
 epoch: 74, train_loss: 0.5123, test_loss: 2.0364, test_f1: 0.5475
 epoch: 75, train_loss: 0.5083, test_loss: 1.3948, test_f1: 0.5952
 epoch: 76, train_loss: 0.4825, test_loss: 1.6867, test_f1: 0.5826
 epoch: 77, train_loss: 0.4378, test_loss: 1.7283, test_f1: 0.6167
 epoch: 78, train_loss: 0.4858, test_loss: 1.8877, test_f1: 0.5707
 epoch: 79, train_loss: 0.4903, test_loss: 1.6289, test_f1: 0.6010
 epoch: 80, train_loss: 0.4820, test_loss: 1.7171, test_f1: 0.6037
 epoch: 81, train_loss: 0.4442, test_loss: 1.7049, test_f1: 0.6112
 epoch: 82, train_loss: 0.4545, test_loss: 1.8930, test_f1: 0.5609
 epoch: 83, train_loss: 0.4406, test_loss: 1.8909, test_f1: 0.5830
 epoch: 84, train_loss: 0.4529, test_loss: 2.0785, test_f1: 0.5438
 epoch: 85, train_loss: 0.4412, test_loss: 2.0270, test_f1: 0.6001
 epoch: 86, train_loss: 0.4356, test_loss: 1.9111, test_f1: 0.5860
 epoch: 87, train_loss: 0.4002, test_loss: 2.0061, test_f1: 0.6035
 epoch: 88, train_loss: 0.4186, test_loss: 1.9880, test_f1: 0.6301
 epoch: 89, train_loss: 0.4641, test_loss: 2.3824, test_f1: 0.5221
 epoch: 90, train_loss: 0.4297, test_loss: 1.9401, test_f1: 0.5839
 epoch: 91, train_loss: 0.3986, test_loss: 1.7970, test_f1: 0.6455
 epoch: 92, train_loss: 0.4260, test_loss: 2.1136, test_f1: 0.5889
 epoch: 93, train_loss: 0.4281, test_loss: 2.2578, test_f1: 0.6105
 epoch: 94, train_loss: 0.4490, test_loss: 1.9077, test_f1: 0.6364
 epoch: 95, train_loss: 0.4306, test_loss: 1.7457, test_f1: 0.6290
 epoch: 96, train_loss: 0.4354, test_loss: 1.7835, test_f1: 0.6175
 epoch: 97, train_loss: 0.3881, test_loss: 2.3189, test_f1: 0.5523
 epoch: 98, train_loss: 0.4350, test_loss: 1.9072, test_f1: 0.5875
 epoch: 99, train_loss: 0.4409, test_loss: 1.9278, test_f1: 0.6277
##################ITERATION #2 ****************************************
 epoch: 0, train_loss: 1.2798, test_loss: 1.4200, test_f1: 0.2281
 epoch: 1, train_loss: 1.0727, test_loss: 1.2719, test_f1: 0.3476
 epoch: 2, train_loss: 1.0030, test_loss: 1.1337, test_f1: 0.4285
 epoch: 3, train_loss: 0.9958, test_loss: 1.1244, test_f1: 0.4370
 epoch: 4, train_loss: 0.9555, test_loss: 1.1183, test_f1: 0.3758
 epoch: 5, train_loss: 0.9959, test_loss: 1.1079, test_f1: 0.3981
 epoch: 6, train_loss: 0.9827, test_loss: 1.0600, test_f1: 0.5104
 epoch: 7, train_loss: 0.9570, test_loss: 1.0368, test_f1: 0.5304
 epoch: 8, train_loss: 0.9111, test_loss: 1.0479, test_f1: 0.5487
 epoch: 9, train_loss: 0.9150, test_loss: 1.0993, test_f1: 0.4736
 epoch: 10, train_loss: 0.8868, test_loss: 1.0457, test_f1: 0.5267
 epoch: 11, train_loss: 0.8712, test_loss: 1.0343, test_f1: 0.4870
 epoch: 12, train_loss: 0.8869, test_loss: 1.0764, test_f1: 0.5490
 epoch: 13, train_loss: 0.8559, test_loss: 1.1012, test_f1: 0.5144
 epoch: 14, train_loss: 0.8679, test_loss: 1.0840, test_f1: 0.5147
 epoch: 15, train_loss: 0.8622, test_loss: 1.0217, test_f1: 0.5705
 epoch: 16, train_loss: 0.8437, test_loss: 1.0763, test_f1: 0.4669
 epoch: 17, train_loss: 0.8411, test_loss: 1.0971, test_f1: 0.5155
 epoch: 18, train_loss: 0.8218, test_loss: 1.0909, test_f1: 0.5748
 epoch: 19, train_loss: 0.8949, test_loss: 1.0590, test_f1: 0.5492
 epoch: 20, train_loss: 0.8579, test_loss: 1.0221, test_f1: 0.5413
 epoch: 21, train_loss: 0.8356, test_loss: 1.1278, test_f1: 0.5157
 epoch: 22, train_loss: 0.8365, test_loss: 1.0401, test_f1: 0.5866
 epoch: 23, train_loss: 0.8224, test_loss: 1.1072, test_f1: 0.5068
 epoch: 24, train_loss: 0.8109, test_loss: 1.1265, test_f1: 0.5434
 epoch: 25, train_loss: 0.8203, test_loss: 1.1652, test_f1: 0.4352
 epoch: 26, train_loss: 0.8234, test_loss: 1.0583, test_f1: 0.5423
 epoch: 27, train_loss: 0.8062, test_loss: 1.0566, test_f1: 0.5723
 epoch: 28, train_loss: 0.7957, test_loss: 1.1396, test_f1: 0.5576
 epoch: 29, train_loss: 0.7826, test_loss: 1.1650, test_f1: 0.5143
 epoch: 30, train_loss: 0.7613, test_loss: 1.0171, test_f1: 0.5541
 epoch: 31, train_loss: 0.7387, test_loss: 1.0530, test_f1: 0.6009
 epoch: 32, train_loss: 0.7423, test_loss: 1.0621, test_f1: 0.6233
 epoch: 33, train_loss: 0.7244, test_loss: 1.2222, test_f1: 0.5187
 epoch: 34, train_loss: 0.7180, test_loss: 1.1900, test_f1: 0.5989
 epoch: 35, train_loss: 0.7224, test_loss: 1.2125, test_f1: 0.4735
 epoch: 36, train_loss: 0.7372, test_loss: 1.1829, test_f1: 0.5698
 epoch: 37, train_loss: 0.7420, test_loss: 1.0897, test_f1: 0.5770
 epoch: 38, train_loss: 0.7293, test_loss: 5.1142, test_f1: 0.4208
 epoch: 39, train_loss: 0.7194, test_loss: 1.2282, test_f1: 0.5617
 epoch: 40, train_loss: 0.7318, test_loss: 1.1712, test_f1: 0.5960
 epoch: 41, train_loss: 0.7175, test_loss: 1.0123, test_f1: 0.5578
 epoch: 42, train_loss: 0.6965, test_loss: 0.9803, test_f1: 0.5391
 epoch: 43, train_loss: 0.7234, test_loss: 1.0988, test_f1: 0.5891
 epoch: 44, train_loss: 0.6847, test_loss: 1.1110, test_f1: 0.5772
 epoch: 45, train_loss: 0.6523, test_loss: 1.2927, test_f1: 0.5641
 epoch: 46, train_loss: 0.6671, test_loss: 1.2008, test_f1: 0.5610
 epoch: 47, train_loss: 0.6695, test_loss: 1.2888, test_f1: 0.6078
 epoch: 48, train_loss: 0.6621, test_loss: 1.2056, test_f1: 0.5919
 epoch: 49, train_loss: 0.6771, test_loss: 1.2177, test_f1: 0.4541
 epoch: 50, train_loss: 0.6480, test_loss: 1.3365, test_f1: 0.5643
 epoch: 51, train_loss: 0.6364, test_loss: 1.2358, test_f1: 0.5382
 epoch: 52, train_loss: 0.6126, test_loss: 1.1512, test_f1: 0.6016
 epoch: 53, train_loss: 0.5967, test_loss: 1.2699, test_f1: 0.5980
 epoch: 54, train_loss: 0.5795, test_loss: 1.3051, test_f1: 0.6175
 epoch: 55, train_loss: 0.5514, test_loss: 1.3957, test_f1: 0.5870
 epoch: 56, train_loss: 0.5470, test_loss: 1.5377, test_f1: 0.5939
 epoch: 57, train_loss: 0.5630, test_loss: 1.5046, test_f1: 0.5186
 epoch: 58, train_loss: 0.5390, test_loss: 1.3767, test_f1: 0.5854
 epoch: 59, train_loss: 0.5134, test_loss: 1.4994, test_f1: 0.5041
 epoch: 60, train_loss: 0.5253, test_loss: 1.5049, test_f1: 0.5812
 epoch: 61, train_loss: 0.5187, test_loss: 1.6318, test_f1: 0.5005
 epoch: 62, train_loss: 0.5447, test_loss: 1.9851, test_f1: 0.5651
 epoch: 63, train_loss: 0.5407, test_loss: 1.5347, test_f1: 0.6056
 epoch: 64, train_loss: 0.5261, test_loss: 1.3786, test_f1: 0.5081
 epoch: 65, train_loss: 0.5115, test_loss: 1.5491, test_f1: 0.6388
 epoch: 66, train_loss: 0.5416, test_loss: 1.4057, test_f1: 0.6081
 epoch: 67, train_loss: 0.5386, test_loss: 1.5974, test_f1: 0.5757
 epoch: 68, train_loss: 0.5395, test_loss: 1.4874, test_f1: 0.5578
 epoch: 69, train_loss: 0.5182, test_loss: 1.5905, test_f1: 0.5646
 epoch: 70, train_loss: 0.5051, test_loss: 1.4697, test_f1: 0.5901
 epoch: 71, train_loss: 0.4904, test_loss: 1.4953, test_f1: 0.6128
 epoch: 72, train_loss: 0.5000, test_loss: 1.4536, test_f1: 0.5339
 epoch: 73, train_loss: 0.4969, test_loss: 1.4295, test_f1: 0.6041
 epoch: 74, train_loss: 0.5052, test_loss: 1.4432, test_f1: 0.5851
 epoch: 75, train_loss: 0.5328, test_loss: 1.7280, test_f1: 0.5285
 epoch: 76, train_loss: 0.5595, test_loss: 1.5578, test_f1: 0.6247
 epoch: 77, train_loss: 0.5149, test_loss: 1.2757, test_f1: 0.5805
 epoch: 78, train_loss: 0.4855, test_loss: 1.5442, test_f1: 0.5994
 epoch: 79, train_loss: 0.4484, test_loss: 1.3855, test_f1: 0.5785
 epoch: 80, train_loss: 0.4512, test_loss: 1.4410, test_f1: 0.5831
 epoch: 81, train_loss: 0.4711, test_loss: 1.4994, test_f1: 0.5869
 epoch: 82, train_loss: 0.4661, test_loss: 1.6121, test_f1: 0.5276
 epoch: 83, train_loss: 0.4909, test_loss: 1.3597, test_f1: 0.5703
 epoch: 84, train_loss: 0.4475, test_loss: 1.5476, test_f1: 0.5625
 epoch: 85, train_loss: 0.4262, test_loss: 1.9021, test_f1: 0.5606
 epoch: 86, train_loss: 0.4597, test_loss: 1.3724, test_f1: 0.6428
 epoch: 87, train_loss: 0.4756, test_loss: 1.9883, test_f1: 0.6185
 epoch: 88, train_loss: 0.4734, test_loss: 1.4835, test_f1: 0.6032
 epoch: 89, train_loss: 0.4326, test_loss: 1.3699, test_f1: 0.6207
 epoch: 90, train_loss: 0.4434, test_loss: 1.6804, test_f1: 0.5838
 epoch: 91, train_loss: 0.4301, test_loss: 1.6892, test_f1: 0.6052
 epoch: 92, train_loss: 0.4073, test_loss: 1.6227, test_f1: 0.5657
 epoch: 93, train_loss: 0.4543, test_loss: 2.2136, test_f1: 0.5464
 epoch: 94, train_loss: 0.4013, test_loss: 1.6867, test_f1: 0.5534
 epoch: 95, train_loss: 0.4410, test_loss: 2.2054, test_f1: 0.5674
 epoch: 96, train_loss: 0.4335, test_loss: 1.6778, test_f1: 0.5484
 epoch: 97, train_loss: 0.4544, test_loss: 1.7425, test_f1: 0.5968
 epoch: 98, train_loss: 0.3996, test_loss: 1.7310, test_f1: 0.6198
 epoch: 99, train_loss: 0.4066, test_loss: 1.8721, test_f1: 0.5372
##################ITERATION #3 ****************************************
 epoch: 0, train_loss: 1.3059, test_loss: 1.4613, test_f1: 0.2809
 epoch: 1, train_loss: 1.1094, test_loss: 1.2794, test_f1: 0.3214
 epoch: 2, train_loss: 1.0543, test_loss: 1.1559, test_f1: 0.4668
 epoch: 3, train_loss: 1.0007, test_loss: 1.1550, test_f1: 0.4812
 epoch: 4, train_loss: 0.9733, test_loss: 1.1523, test_f1: 0.5079
 epoch: 5, train_loss: 0.9752, test_loss: 1.2681, test_f1: 0.4554
 epoch: 6, train_loss: 0.9573, test_loss: 1.0984, test_f1: 0.4989
 epoch: 7, train_loss: 0.9470, test_loss: 1.0854, test_f1: 0.5450
 epoch: 8, train_loss: 0.9293, test_loss: 1.1230, test_f1: 0.5302
 epoch: 9, train_loss: 0.9175, test_loss: 1.1701, test_f1: 0.5329
 epoch: 10, train_loss: 0.9116, test_loss: 1.1254, test_f1: 0.5202
 epoch: 11, train_loss: 0.9099, test_loss: 1.1272, test_f1: 0.5247
 epoch: 12, train_loss: 0.8836, test_loss: 1.0692, test_f1: 0.5452
 epoch: 13, train_loss: 0.9152, test_loss: 1.1133, test_f1: 0.5165
 epoch: 14, train_loss: 0.8703, test_loss: 1.2291, test_f1: 0.4893
 epoch: 15, train_loss: 0.8876, test_loss: 1.1075, test_f1: 0.5479
 epoch: 16, train_loss: 0.8657, test_loss: 1.1047, test_f1: 0.5337
 epoch: 17, train_loss: 0.8558, test_loss: 1.0750, test_f1: 0.5603
 epoch: 18, train_loss: 0.8428, test_loss: 1.1172, test_f1: 0.5048
 epoch: 19, train_loss: 0.8438, test_loss: 1.2193, test_f1: 0.5566
 epoch: 20, train_loss: 0.8610, test_loss: 1.1360, test_f1: 0.5054
 epoch: 21, train_loss: 0.8619, test_loss: 1.1808, test_f1: 0.5186
 epoch: 22, train_loss: 0.8360, test_loss: 1.0779, test_f1: 0.4924
 epoch: 23, train_loss: 0.8086, test_loss: 1.2054, test_f1: 0.4511
 epoch: 24, train_loss: 0.8161, test_loss: 1.2115, test_f1: 0.5106
 epoch: 25, train_loss: 0.7975, test_loss: 1.3456, test_f1: 0.4767
 epoch: 26, train_loss: 0.8030, test_loss: 2.1170, test_f1: 0.3908
 epoch: 27, train_loss: 0.7721, test_loss: 1.2279, test_f1: 0.5294
 epoch: 28, train_loss: 0.7733, test_loss: 1.2073, test_f1: 0.4989
 epoch: 29, train_loss: 0.7676, test_loss: 1.3000, test_f1: 0.4264
 epoch: 30, train_loss: 0.8110, test_loss: 1.0115, test_f1: 0.5546
 epoch: 31, train_loss: 0.7515, test_loss: 1.2058, test_f1: 0.5118
 epoch: 32, train_loss: 0.7346, test_loss: 1.0374, test_f1: 0.5855
 epoch: 33, train_loss: 0.7253, test_loss: 1.0463, test_f1: 0.5877
 epoch: 34, train_loss: 0.7225, test_loss: 1.0604, test_f1: 0.5804
 epoch: 35, train_loss: 0.7374, test_loss: 1.2600, test_f1: 0.5159
 epoch: 36, train_loss: 0.7307, test_loss: 1.2068, test_f1: 0.5410
 epoch: 37, train_loss: 0.7268, test_loss: 1.1931, test_f1: 0.5257
 epoch: 38, train_loss: 0.7263, test_loss: 1.1689, test_f1: 0.5354
 epoch: 39, train_loss: 0.7183, test_loss: 1.2583, test_f1: 0.5502
 epoch: 40, train_loss: 0.7039, test_loss: 1.1127, test_f1: 0.5763
 epoch: 41, train_loss: 0.6649, test_loss: 1.0642, test_f1: 0.5959
 epoch: 42, train_loss: 0.6594, test_loss: 1.2469, test_f1: 0.5315
 epoch: 43, train_loss: 0.6564, test_loss: 1.3513, test_f1: 0.4990
 epoch: 44, train_loss: 0.6497, test_loss: 1.5278, test_f1: 0.5685
 epoch: 45, train_loss: 0.6577, test_loss: 1.5640, test_f1: 0.5427
 epoch: 46, train_loss: 0.7149, test_loss: 1.2624, test_f1: 0.5525
 epoch: 47, train_loss: 0.7296, test_loss: 1.5686, test_f1: 0.5258
 epoch: 48, train_loss: 0.7140, test_loss: 1.2583, test_f1: 0.5283
 epoch: 49, train_loss: 0.6828, test_loss: 1.2082, test_f1: 0.5667
 epoch: 50, train_loss: 0.7229, test_loss: 1.2823, test_f1: 0.5446
 epoch: 51, train_loss: 0.6512, test_loss: 1.2023, test_f1: 0.5579
 epoch: 52, train_loss: 0.6325, test_loss: 1.1148, test_f1: 0.5908
 epoch: 53, train_loss: 0.6115, test_loss: 1.1906, test_f1: 0.5774
 epoch: 54, train_loss: 0.5966, test_loss: 1.1315, test_f1: 0.6268
 epoch: 55, train_loss: 0.5893, test_loss: 1.1399, test_f1: 0.6248
 epoch: 56, train_loss: 0.5719, test_loss: 1.1161, test_f1: 0.5944
 epoch: 57, train_loss: 0.5869, test_loss: 1.1625, test_f1: 0.5892
 epoch: 58, train_loss: 0.5761, test_loss: 1.2850, test_f1: 0.6079
 epoch: 59, train_loss: 0.5972, test_loss: 1.2544, test_f1: 0.5868
 epoch: 60, train_loss: 0.5813, test_loss: 1.2770, test_f1: 0.5842
 epoch: 61, train_loss: 0.5812, test_loss: 1.1835, test_f1: 0.5605
 epoch: 62, train_loss: 0.5761, test_loss: 1.2831, test_f1: 0.5954
 epoch: 63, train_loss: 0.5512, test_loss: 1.2857, test_f1: 0.5838
 epoch: 64, train_loss: 0.5477, test_loss: 1.2648, test_f1: 0.5947
 epoch: 65, train_loss: 0.5610, test_loss: 1.3186, test_f1: 0.5847
 epoch: 66, train_loss: 0.5618, test_loss: 1.2779, test_f1: 0.5805
 epoch: 67, train_loss: 0.5421, test_loss: 1.4123, test_f1: 0.5554
 epoch: 68, train_loss: 0.5361, test_loss: 1.2887, test_f1: 0.5969
 epoch: 69, train_loss: 0.5403, test_loss: 1.2845, test_f1: 0.5636
 epoch: 70, train_loss: 0.5295, test_loss: 1.3590, test_f1: 0.6201
 epoch: 71, train_loss: 0.5116, test_loss: 1.3705, test_f1: 0.5851
 epoch: 72, train_loss: 0.5422, test_loss: 1.5328, test_f1: 0.5931
 epoch: 73, train_loss: 0.5002, test_loss: 1.5588, test_f1: 0.5788
 epoch: 74, train_loss: 0.4948, test_loss: 1.4601, test_f1: 0.5969
 epoch: 75, train_loss: 0.4977, test_loss: 1.3956, test_f1: 0.6054
 epoch: 76, train_loss: 0.4966, test_loss: 1.6727, test_f1: 0.5928
 epoch: 77, train_loss: 0.5013, test_loss: 1.6432, test_f1: 0.5285
 epoch: 78, train_loss: 0.5431, test_loss: 1.4331, test_f1: 0.5917
 epoch: 79, train_loss: 0.5068, test_loss: 1.4027, test_f1: 0.5796
 epoch: 80, train_loss: 0.4886, test_loss: 1.5895, test_f1: 0.5821
 epoch: 81, train_loss: 0.4519, test_loss: 1.6415, test_f1: 0.6113
 epoch: 82, train_loss: 0.4936, test_loss: 1.7688, test_f1: 0.5617
 epoch: 83, train_loss: 0.5278, test_loss: 1.6409, test_f1: 0.5802
 epoch: 84, train_loss: 0.4960, test_loss: 1.6010, test_f1: 0.5406
 epoch: 85, train_loss: 0.4690, test_loss: 1.7083, test_f1: 0.5500
 epoch: 86, train_loss: 0.4684, test_loss: 1.4076, test_f1: 0.5792
 epoch: 87, train_loss: 0.4644, test_loss: 1.5428, test_f1: 0.5877
 epoch: 88, train_loss: 0.4779, test_loss: 1.4182, test_f1: 0.6294
 epoch: 89, train_loss: 0.4980, test_loss: 1.5081, test_f1: 0.5673
 epoch: 90, train_loss: 0.4507, test_loss: 1.6165, test_f1: 0.5872
 epoch: 91, train_loss: 0.4365, test_loss: 1.9603, test_f1: 0.5601
 epoch: 92, train_loss: 0.4545, test_loss: 1.7763, test_f1: 0.5957
 epoch: 93, train_loss: 0.4526, test_loss: 1.7203, test_f1: 0.5980
 epoch: 94, train_loss: 0.4550, test_loss: 1.7053, test_f1: 0.5818
 epoch: 95, train_loss: 0.4898, test_loss: 1.9722, test_f1: 0.5665
 epoch: 96, train_loss: 0.4762, test_loss: 1.6591, test_f1: 0.6152
 epoch: 97, train_loss: 0.4560, test_loss: 1.5879, test_f1: 0.5796
 epoch: 98, train_loss: 0.4474, test_loss: 1.8251, test_f1: 0.5683
 epoch: 99, train_loss: 0.4048, test_loss: 1.7914, test_f1: 0.5893
##################ITERATION #4 ****************************************
 epoch: 0, train_loss: 1.3171, test_loss: 1.3500, test_f1: 0.3007
 epoch: 1, train_loss: 1.1025, test_loss: 1.2160, test_f1: 0.3279
 epoch: 2, train_loss: 1.0313, test_loss: 1.1340, test_f1: 0.4583
 epoch: 3, train_loss: 1.0285, test_loss: 1.1150, test_f1: 0.4958
 epoch: 4, train_loss: 0.9966, test_loss: 1.1319, test_f1: 0.5016
 epoch: 5, train_loss: 0.9613, test_loss: 1.1542, test_f1: 0.4889
 epoch: 6, train_loss: 0.9572, test_loss: 1.0882, test_f1: 0.5078
 epoch: 7, train_loss: 0.9192, test_loss: 1.1142, test_f1: 0.4847
 epoch: 8, train_loss: 0.9217, test_loss: 1.2660, test_f1: 0.4373
 epoch: 9, train_loss: 0.8977, test_loss: 1.0756, test_f1: 0.5259
 epoch: 10, train_loss: 0.9010, test_loss: 1.0756, test_f1: 0.5188
 epoch: 11, train_loss: 0.8984, test_loss: 1.0088, test_f1: 0.5655
 epoch: 12, train_loss: 0.8911, test_loss: 1.0998, test_f1: 0.5306
 epoch: 13, train_loss: 0.8582, test_loss: 1.1483, test_f1: 0.5207
 epoch: 14, train_loss: 0.8452, test_loss: 1.1134, test_f1: 0.5714
 epoch: 15, train_loss: 0.8227, test_loss: 1.1497, test_f1: 0.5279
 epoch: 16, train_loss: 0.8284, test_loss: 1.2200, test_f1: 0.4817
 epoch: 17, train_loss: 0.8372, test_loss: 1.1110, test_f1: 0.5375
 epoch: 18, train_loss: 0.8796, test_loss: 1.2388, test_f1: 0.4928
 epoch: 19, train_loss: 0.8198, test_loss: 1.2676, test_f1: 0.5187
 epoch: 20, train_loss: 0.8014, test_loss: 1.1651, test_f1: 0.5077
 epoch: 21, train_loss: 0.7767, test_loss: 1.1722, test_f1: 0.5188
 epoch: 22, train_loss: 0.7799, test_loss: 1.2277, test_f1: 0.5571
 epoch: 23, train_loss: 0.8020, test_loss: 1.0567, test_f1: 0.5731
 epoch: 24, train_loss: 0.7865, test_loss: 1.0265, test_f1: 0.6025
 epoch: 25, train_loss: 0.7745, test_loss: 1.0645, test_f1: 0.5833
 epoch: 26, train_loss: 0.7499, test_loss: 1.0639, test_f1: 0.5958
 epoch: 27, train_loss: 0.7634, test_loss: 1.1186, test_f1: 0.5679
 epoch: 28, train_loss: 0.7260, test_loss: 1.0605, test_f1: 0.5909
 epoch: 29, train_loss: 0.7413, test_loss: 1.2337, test_f1: 0.5060
 epoch: 30, train_loss: 0.7133, test_loss: 1.1665, test_f1: 0.5341
 epoch: 31, train_loss: 0.7191, test_loss: 1.1063, test_f1: 0.5522
 epoch: 32, train_loss: 0.7084, test_loss: 1.0184, test_f1: 0.5800
 epoch: 33, train_loss: 0.7091, test_loss: 1.0448, test_f1: 0.6223
 epoch: 34, train_loss: 0.6589, test_loss: 1.2466, test_f1: 0.5510
 epoch: 35, train_loss: 0.6886, test_loss: 1.1050, test_f1: 0.5019
 epoch: 36, train_loss: 0.6840, test_loss: 1.2890, test_f1: 0.5859
 epoch: 37, train_loss: 0.6676, test_loss: 1.0776, test_f1: 0.5863
 epoch: 38, train_loss: 0.6785, test_loss: 1.2951, test_f1: 0.4669
 epoch: 39, train_loss: 0.7341, test_loss: 1.2080, test_f1: 0.5442
 epoch: 40, train_loss: 0.6897, test_loss: 1.2945, test_f1: 0.4956
 epoch: 41, train_loss: 0.6694, test_loss: 1.1001, test_f1: 0.5792
 epoch: 42, train_loss: 0.6681, test_loss: 1.1148, test_f1: 0.5993
 epoch: 43, train_loss: 0.6283, test_loss: 1.2672, test_f1: 0.5148
 epoch: 44, train_loss: 0.6207, test_loss: 1.1385, test_f1: 0.5779
 epoch: 45, train_loss: 0.6294, test_loss: 1.1427, test_f1: 0.5437
 epoch: 46, train_loss: 0.6592, test_loss: 1.0817, test_f1: 0.5969
 epoch: 47, train_loss: 0.6192, test_loss: 1.0453, test_f1: 0.6243
 epoch: 48, train_loss: 0.6367, test_loss: 1.0861, test_f1: 0.5854
 epoch: 49, train_loss: 0.6448, test_loss: 1.2980, test_f1: 0.5561
 epoch: 50, train_loss: 0.6081, test_loss: 1.0788, test_f1: 0.6003
 epoch: 51, train_loss: 0.6038, test_loss: 1.1420, test_f1: 0.5683
 epoch: 52, train_loss: 0.5740, test_loss: 1.1197, test_f1: 0.5854
 epoch: 53, train_loss: 0.5402, test_loss: 1.2031, test_f1: 0.5702
 epoch: 54, train_loss: 0.5410, test_loss: 1.1694, test_f1: 0.5893
 epoch: 55, train_loss: 0.5513, test_loss: 1.1052, test_f1: 0.5761
 epoch: 56, train_loss: 0.5262, test_loss: 1.3238, test_f1: 0.5874
 epoch: 57, train_loss: 0.5337, test_loss: 1.2301, test_f1: 0.6083
 epoch: 58, train_loss: 0.5117, test_loss: 1.1894, test_f1: 0.5917
 epoch: 59, train_loss: 0.5240, test_loss: 1.1986, test_f1: 0.6133
 epoch: 60, train_loss: 0.5114, test_loss: 1.0733, test_f1: 0.5906
 epoch: 61, train_loss: 0.5216, test_loss: 1.1654, test_f1: 0.6271
 epoch: 62, train_loss: 0.5170, test_loss: 1.3561, test_f1: 0.5648
 epoch: 63, train_loss: 0.5264, test_loss: 1.1861, test_f1: 0.5669
 epoch: 64, train_loss: 0.5044, test_loss: 1.1649, test_f1: 0.5851
 epoch: 65, train_loss: 0.4987, test_loss: 1.2506, test_f1: 0.6035
 epoch: 66, train_loss: 0.4694, test_loss: 1.2424, test_f1: 0.5810
 epoch: 67, train_loss: 0.4804, test_loss: 1.2387, test_f1: 0.5997
 epoch: 68, train_loss: 0.4641, test_loss: 1.2892, test_f1: 0.5824
 epoch: 69, train_loss: 0.4932, test_loss: 1.2466, test_f1: 0.5905
 epoch: 70, train_loss: 0.4596, test_loss: 1.3502, test_f1: 0.5812
 epoch: 71, train_loss: 0.4979, test_loss: 1.3952, test_f1: 0.5929
 epoch: 72, train_loss: 0.4613, test_loss: 1.2226, test_f1: 0.6000
 epoch: 73, train_loss: 0.4842, test_loss: 1.2271, test_f1: 0.5957
 epoch: 74, train_loss: 0.4961, test_loss: 1.3611, test_f1: 0.5354
 epoch: 75, train_loss: 0.4607, test_loss: 1.3580, test_f1: 0.5773
 epoch: 76, train_loss: 0.4529, test_loss: 1.2837, test_f1: 0.5797
 epoch: 77, train_loss: 0.4772, test_loss: 1.3963, test_f1: 0.5819
 epoch: 78, train_loss: 0.4972, test_loss: 1.4757, test_f1: 0.5456
 epoch: 79, train_loss: 0.5292, test_loss: 1.2521, test_f1: 0.5520
 epoch: 80, train_loss: 0.4770, test_loss: 1.1913, test_f1: 0.5996
 epoch: 81, train_loss: 0.4848, test_loss: 1.3008, test_f1: 0.5786
 epoch: 82, train_loss: 0.4777, test_loss: 1.3737, test_f1: 0.5718
 epoch: 83, train_loss: 0.4355, test_loss: 1.3264, test_f1: 0.6141
 epoch: 84, train_loss: 0.4582, test_loss: 1.3059, test_f1: 0.6003
 epoch: 85, train_loss: 0.4665, test_loss: 1.2206, test_f1: 0.6009
 epoch: 86, train_loss: 0.4671, test_loss: 1.1879, test_f1: 0.5882
 epoch: 87, train_loss: 0.4419, test_loss: 1.3987, test_f1: 0.5562
 epoch: 88, train_loss: 0.4144, test_loss: 1.3181, test_f1: 0.5813
 epoch: 89, train_loss: 0.4459, test_loss: 1.2185, test_f1: 0.6088
 epoch: 90, train_loss: 0.4925, test_loss: 1.6016, test_f1: 0.5437
 epoch: 91, train_loss: 0.4341, test_loss: 1.5040, test_f1: 0.5675
 epoch: 92, train_loss: 0.4196, test_loss: 1.4578, test_f1: 0.5504
 epoch: 93, train_loss: 0.4422, test_loss: 1.3564, test_f1: 0.5566
 epoch: 94, train_loss: 0.4101, test_loss: 1.4060, test_f1: 0.5620
 epoch: 95, train_loss: 0.3829, test_loss: 1.2530, test_f1: 0.5871
 epoch: 96, train_loss: 0.4209, test_loss: 1.3865, test_f1: 0.5769
 epoch: 97, train_loss: 0.3752, test_loss: 1.5209, test_f1: 0.5843
 epoch: 98, train_loss: 0.3929, test_loss: 1.4483, test_f1: 0.5535
 epoch: 99, train_loss: 0.4410, test_loss: 1.4556, test_f1: 0.5890
##################ITERATION #5 ****************************************
 epoch: 0, train_loss: 1.3496, test_loss: 1.4081, test_f1: 0.3431
 epoch: 1, train_loss: 1.1186, test_loss: 1.1889, test_f1: 0.2670
 epoch: 2, train_loss: 1.0732, test_loss: 1.1107, test_f1: 0.3862
 epoch: 3, train_loss: 1.0291, test_loss: 1.1380, test_f1: 0.4479
 epoch: 4, train_loss: 1.0077, test_loss: 1.1389, test_f1: 0.4650
 epoch: 5, train_loss: 1.0023, test_loss: 1.1646, test_f1: 0.4039
 epoch: 6, train_loss: 0.9511, test_loss: 1.1059, test_f1: 0.4915
 epoch: 7, train_loss: 0.9500, test_loss: 1.0621, test_f1: 0.5312
 epoch: 8, train_loss: 0.9330, test_loss: 1.0252, test_f1: 0.5304
 epoch: 9, train_loss: 0.9334, test_loss: 1.1777, test_f1: 0.5130
 epoch: 10, train_loss: 0.9167, test_loss: 1.1649, test_f1: 0.5222
 epoch: 11, train_loss: 0.9284, test_loss: 1.0825, test_f1: 0.5387
 epoch: 12, train_loss: 0.9001, test_loss: 1.1273, test_f1: 0.5415
 epoch: 13, train_loss: 0.9203, test_loss: 1.1609, test_f1: 0.5043
 epoch: 14, train_loss: 0.8965, test_loss: 1.1896, test_f1: 0.4825
 epoch: 15, train_loss: 0.9536, test_loss: 1.1035, test_f1: 0.5416
 epoch: 16, train_loss: 0.8903, test_loss: 1.1487, test_f1: 0.5181
 epoch: 17, train_loss: 0.8833, test_loss: 1.0049, test_f1: 0.5711
 epoch: 18, train_loss: 0.8638, test_loss: 1.0913, test_f1: 0.5395
 epoch: 19, train_loss: 0.8558, test_loss: 1.0544, test_f1: 0.5448
 epoch: 20, train_loss: 0.8370, test_loss: 0.9995, test_f1: 0.5963
 epoch: 21, train_loss: 0.8253, test_loss: 1.0513, test_f1: 0.5747
 epoch: 22, train_loss: 0.8126, test_loss: 1.1141, test_f1: 0.5494
 epoch: 23, train_loss: 0.8179, test_loss: 1.0634, test_f1: 0.5893
 epoch: 24, train_loss: 0.7956, test_loss: 1.0824, test_f1: 0.5177
 epoch: 25, train_loss: 0.7686, test_loss: 1.1059, test_f1: 0.5266
 epoch: 26, train_loss: 0.7913, test_loss: 1.2057, test_f1: 0.5158
 epoch: 27, train_loss: 0.7745, test_loss: 1.2363, test_f1: 0.5659
 epoch: 28, train_loss: 0.7889, test_loss: 1.1338, test_f1: 0.5218
 epoch: 29, train_loss: 0.7721, test_loss: 1.1204, test_f1: 0.5588
 epoch: 30, train_loss: 0.7606, test_loss: 1.1696, test_f1: 0.5537
 epoch: 31, train_loss: 0.7524, test_loss: 1.1625, test_f1: 0.5525
 epoch: 32, train_loss: 0.7383, test_loss: 1.3207, test_f1: 0.5048
 epoch: 33, train_loss: 0.7525, test_loss: 1.0378, test_f1: 0.5960
 epoch: 34, train_loss: 0.7599, test_loss: 1.3153, test_f1: 0.5582
 epoch: 35, train_loss: 0.7071, test_loss: 1.1904, test_f1: 0.5555
 epoch: 36, train_loss: 0.7211, test_loss: 1.3275, test_f1: 0.5640
 epoch: 37, train_loss: 0.7556, test_loss: 1.2833, test_f1: 0.5623
 epoch: 38, train_loss: 0.7215, test_loss: 1.0811, test_f1: 0.5895
 epoch: 39, train_loss: 0.6944, test_loss: 1.1058, test_f1: 0.5762
 epoch: 40, train_loss: 0.6982, test_loss: 1.3816, test_f1: 0.5376
 epoch: 41, train_loss: 0.7160, test_loss: 1.5892, test_f1: 0.5533
 epoch: 42, train_loss: 0.7019, test_loss: 1.2951, test_f1: 0.5421
 epoch: 43, train_loss: 0.6897, test_loss: 1.2232, test_f1: 0.5756
 epoch: 44, train_loss: 0.6807, test_loss: 1.2992, test_f1: 0.5717
 epoch: 45, train_loss: 0.6755, test_loss: 1.1570, test_f1: 0.5415
 epoch: 46, train_loss: 0.6890, test_loss: 1.0760, test_f1: 0.5550
 epoch: 47, train_loss: 0.6858, test_loss: 1.4454, test_f1: 0.5569
 epoch: 48, train_loss: 0.6583, test_loss: 1.3494, test_f1: 0.5632
 epoch: 49, train_loss: 0.6447, test_loss: 1.5199, test_f1: 0.5152
 epoch: 50, train_loss: 0.6169, test_loss: 1.1447, test_f1: 0.5786
 epoch: 51, train_loss: 0.6349, test_loss: 1.1773, test_f1: 0.5709
 epoch: 52, train_loss: 0.5791, test_loss: 1.2200, test_f1: 0.5919
 epoch: 53, train_loss: 0.5758, test_loss: 1.2755, test_f1: 0.5970
 epoch: 54, train_loss: 0.5815, test_loss: 1.1508, test_f1: 0.5617
 epoch: 55, train_loss: 0.5611, test_loss: 1.3008, test_f1: 0.5582
 epoch: 56, train_loss: 0.5586, test_loss: 1.2789, test_f1: 0.6153
 epoch: 57, train_loss: 0.5443, test_loss: 1.3053, test_f1: 0.5998
 epoch: 58, train_loss: 0.5375, test_loss: 1.3799, test_f1: 0.6074
 epoch: 59, train_loss: 0.5464, test_loss: 1.3261, test_f1: 0.5883
 epoch: 60, train_loss: 0.5438, test_loss: 1.2895, test_f1: 0.5871
 epoch: 61, train_loss: 0.5214, test_loss: 1.3631, test_f1: 0.6272
 epoch: 62, train_loss: 0.5223, test_loss: 1.4120, test_f1: 0.6101
 epoch: 63, train_loss: 0.5203, test_loss: 1.3646, test_f1: 0.5650
 epoch: 64, train_loss: 0.5228, test_loss: 1.3347, test_f1: 0.5985
 epoch: 65, train_loss: 0.5616, test_loss: 1.4839, test_f1: 0.5499
 epoch: 66, train_loss: 0.5016, test_loss: 1.2649, test_f1: 0.6062
 epoch: 67, train_loss: 0.5115, test_loss: 1.3187, test_f1: 0.5563
 epoch: 68, train_loss: 0.5149, test_loss: 1.3965, test_f1: 0.5893
 epoch: 69, train_loss: 0.5047, test_loss: 1.3873, test_f1: 0.5621
 epoch: 70, train_loss: 0.5406, test_loss: 1.3017, test_f1: 0.6019
 epoch: 71, train_loss: 0.4916, test_loss: 1.3490, test_f1: 0.6002
 epoch: 72, train_loss: 0.4762, test_loss: 1.4174, test_f1: 0.5759
 epoch: 73, train_loss: 0.4648, test_loss: 1.4959, test_f1: 0.6230
 epoch: 74, train_loss: 0.4795, test_loss: 1.4532, test_f1: 0.5746
 epoch: 75, train_loss: 0.4513, test_loss: 1.4656, test_f1: 0.5999
 epoch: 76, train_loss: 0.4402, test_loss: 1.6850, test_f1: 0.6139
 epoch: 77, train_loss: 0.4433, test_loss: 1.6096, test_f1: 0.5411
 epoch: 78, train_loss: 0.4874, test_loss: 1.7131, test_f1: 0.6234
 epoch: 79, train_loss: 0.4602, test_loss: 1.4043, test_f1: 0.6002
 epoch: 80, train_loss: 0.4858, test_loss: 1.5821, test_f1: 0.6128
 epoch: 81, train_loss: 0.4900, test_loss: 1.5032, test_f1: 0.6198
 epoch: 82, train_loss: 0.4639, test_loss: 1.4966, test_f1: 0.6002
 epoch: 83, train_loss: 0.4460, test_loss: 1.5498, test_f1: 0.5975
 epoch: 84, train_loss: 0.3992, test_loss: 1.8011, test_f1: 0.6185
 epoch: 85, train_loss: 0.4523, test_loss: 1.6669, test_f1: 0.6096
 epoch: 86, train_loss: 0.4724, test_loss: 1.7480, test_f1: 0.5863
 epoch: 87, train_loss: 0.4278, test_loss: 1.5962, test_f1: 0.6191
 epoch: 88, train_loss: 0.4875, test_loss: 1.5918, test_f1: 0.5693
 epoch: 89, train_loss: 0.4689, test_loss: 1.6069, test_f1: 0.5768
 epoch: 90, train_loss: 0.4356, test_loss: 1.5498, test_f1: 0.5592
 epoch: 91, train_loss: 0.4249, test_loss: 1.5905, test_f1: 0.5919
 epoch: 92, train_loss: 0.4053, test_loss: 1.7290, test_f1: 0.5615
 epoch: 93, train_loss: 0.4598, test_loss: 1.8625, test_f1: 0.5966
 epoch: 94, train_loss: 0.4552, test_loss: 1.6486, test_f1: 0.6173
 epoch: 95, train_loss: 0.4254, test_loss: 1.5723, test_f1: 0.6216
 epoch: 96, train_loss: 0.4831, test_loss: 2.0285, test_f1: 0.5942
 epoch: 97, train_loss: 0.4408, test_loss: 1.5287, test_f1: 0.5774
 epoch: 98, train_loss: 0.4106, test_loss: 1.5840, test_f1: 0.5964
 epoch: 99, train_loss: 0.4135, test_loss: 1.7818, test_f1: 0.5454
##################ITERATION #6 ****************************************
 epoch: 0, train_loss: 1.2923, test_loss: 1.4571, test_f1: 0.2702
 epoch: 1, train_loss: 1.0966, test_loss: 1.3147, test_f1: 0.2611
 epoch: 2, train_loss: 1.0359, test_loss: 1.1439, test_f1: 0.4434
 epoch: 3, train_loss: 1.0010, test_loss: 1.0894, test_f1: 0.5196
 epoch: 4, train_loss: 0.9867, test_loss: 1.0474, test_f1: 0.5084
 epoch: 5, train_loss: 0.9648, test_loss: 1.0669, test_f1: 0.5304
 epoch: 6, train_loss: 0.9274, test_loss: 1.1273, test_f1: 0.5278
 epoch: 7, train_loss: 0.9349, test_loss: 1.0255, test_f1: 0.5596
 epoch: 8, train_loss: 0.9392, test_loss: 1.1320, test_f1: 0.5079
 epoch: 9, train_loss: 0.9206, test_loss: 1.0264, test_f1: 0.5388
 epoch: 10, train_loss: 0.9038, test_loss: 1.0942, test_f1: 0.5396
 epoch: 11, train_loss: 0.9046, test_loss: 1.0326, test_f1: 0.5285
 epoch: 12, train_loss: 0.8667, test_loss: 1.1758, test_f1: 0.4327
 epoch: 13, train_loss: 0.8907, test_loss: 1.0804, test_f1: 0.4264
 epoch: 14, train_loss: 0.9323, test_loss: 1.2290, test_f1: 0.5420
 epoch: 15, train_loss: 0.8833, test_loss: 1.0912, test_f1: 0.5316
 epoch: 16, train_loss: 0.8599, test_loss: 1.1536, test_f1: 0.5131
 epoch: 17, train_loss: 0.8671, test_loss: 1.1719, test_f1: 0.4737
 epoch: 18, train_loss: 0.8432, test_loss: 1.1334, test_f1: 0.5045
 epoch: 19, train_loss: 0.8597, test_loss: 0.9955, test_f1: 0.5641
 epoch: 20, train_loss: 0.8501, test_loss: 1.0587, test_f1: 0.5630
 epoch: 21, train_loss: 0.8446, test_loss: 1.1762, test_f1: 0.4108
 epoch: 22, train_loss: 0.8331, test_loss: 1.0439, test_f1: 0.5658
 epoch: 23, train_loss: 0.8108, test_loss: 1.2072, test_f1: 0.5366
 epoch: 24, train_loss: 0.8039, test_loss: 1.1697, test_f1: 0.5557
 epoch: 25, train_loss: 0.8004, test_loss: 1.2736, test_f1: 0.4357
 epoch: 26, train_loss: 0.8064, test_loss: 1.1062, test_f1: 0.5501
 epoch: 27, train_loss: 0.7973, test_loss: 1.0599, test_f1: 0.6081
 epoch: 28, train_loss: 0.7960, test_loss: 1.0528, test_f1: 0.5727
 epoch: 29, train_loss: 0.8244, test_loss: 1.0932, test_f1: 0.5699
 epoch: 30, train_loss: 0.7799, test_loss: 1.0688, test_f1: 0.5246
 epoch: 31, train_loss: 0.7474, test_loss: 1.1703, test_f1: 0.5256
 epoch: 32, train_loss: 0.7556, test_loss: 1.0808, test_f1: 0.5932
 epoch: 33, train_loss: 0.7768, test_loss: 1.1970, test_f1: 0.4828
 epoch: 34, train_loss: 0.7758, test_loss: 1.1676, test_f1: 0.4762
 epoch: 35, train_loss: 0.7274, test_loss: 1.1393, test_f1: 0.5866
 epoch: 36, train_loss: 0.7063, test_loss: 1.0677, test_f1: 0.5698
 epoch: 37, train_loss: 0.7414, test_loss: 1.3598, test_f1: 0.4594
 epoch: 38, train_loss: 0.7356, test_loss: 1.1405, test_f1: 0.5356
 epoch: 39, train_loss: 0.7092, test_loss: 1.1274, test_f1: 0.5136
 epoch: 40, train_loss: 0.6797, test_loss: 1.1662, test_f1: 0.5323
 epoch: 41, train_loss: 0.6686, test_loss: 1.1173, test_f1: 0.5733
 epoch: 42, train_loss: 0.6716, test_loss: 1.1176, test_f1: 0.5829
 epoch: 43, train_loss: 0.6702, test_loss: 1.2377, test_f1: 0.5205
 epoch: 44, train_loss: 0.6592, test_loss: 1.2142, test_f1: 0.5987
 epoch: 45, train_loss: 0.6718, test_loss: 1.2013, test_f1: 0.5782
 epoch: 46, train_loss: 0.6483, test_loss: 1.3984, test_f1: 0.4961
 epoch: 47, train_loss: 0.6746, test_loss: 1.3223, test_f1: 0.4499
 epoch: 48, train_loss: 0.6881, test_loss: 1.1851, test_f1: 0.5820
 epoch: 49, train_loss: 0.6433, test_loss: 1.1754, test_f1: 0.5658
 epoch: 50, train_loss: 0.6217, test_loss: 1.1285, test_f1: 0.5996
 epoch: 51, train_loss: 0.6043, test_loss: 1.0857, test_f1: 0.6186
 epoch: 52, train_loss: 0.5692, test_loss: 1.1824, test_f1: 0.5758
 epoch: 53, train_loss: 0.5605, test_loss: 1.1901, test_f1: 0.6037
 epoch: 54, train_loss: 0.5619, test_loss: 1.2077, test_f1: 0.5978
 epoch: 55, train_loss: 0.5715, test_loss: 1.2636, test_f1: 0.6061
 epoch: 56, train_loss: 0.5820, test_loss: 1.1022, test_f1: 0.6199
 epoch: 57, train_loss: 0.5453, test_loss: 1.2229, test_f1: 0.6315
 epoch: 58, train_loss: 0.5351, test_loss: 1.1970, test_f1: 0.6258
 epoch: 59, train_loss: 0.5474, test_loss: 1.2577, test_f1: 0.6153
 epoch: 60, train_loss: 0.5587, test_loss: 1.2744, test_f1: 0.5884
 epoch: 61, train_loss: 0.5489, test_loss: 1.1757, test_f1: 0.6307
 epoch: 62, train_loss: 0.5603, test_loss: 1.2619, test_f1: 0.5922
 epoch: 63, train_loss: 0.5799, test_loss: 1.2844, test_f1: 0.6169
 epoch: 64, train_loss: 0.5644, test_loss: 1.2049, test_f1: 0.6188
 epoch: 65, train_loss: 0.5279, test_loss: 1.2221, test_f1: 0.6190
 epoch: 66, train_loss: 0.5105, test_loss: 1.2604, test_f1: 0.6340
 epoch: 67, train_loss: 0.5391, test_loss: 1.3408, test_f1: 0.5993
 epoch: 68, train_loss: 0.5245, test_loss: 1.2850, test_f1: 0.6188
 epoch: 69, train_loss: 0.5157, test_loss: 1.2744, test_f1: 0.6129
 epoch: 70, train_loss: 0.4910, test_loss: 1.3427, test_f1: 0.6357
 epoch: 71, train_loss: 0.5039, test_loss: 1.3005, test_f1: 0.6329
 epoch: 72, train_loss: 0.5066, test_loss: 1.3838, test_f1: 0.6240
 epoch: 73, train_loss: 0.4858, test_loss: 1.3906, test_f1: 0.5780
 epoch: 74, train_loss: 0.4971, test_loss: 1.3021, test_f1: 0.6259
 epoch: 75, train_loss: 0.5083, test_loss: 1.4103, test_f1: 0.6019
 epoch: 76, train_loss: 0.4897, test_loss: 1.2033, test_f1: 0.6414
 epoch: 77, train_loss: 0.4883, test_loss: 1.2425, test_f1: 0.6456
 epoch: 78, train_loss: 0.5445, test_loss: 1.2755, test_f1: 0.6269
 epoch: 79, train_loss: 0.5039, test_loss: 1.3192, test_f1: 0.6184
 epoch: 80, train_loss: 0.5055, test_loss: 1.3761, test_f1: 0.6000
 epoch: 81, train_loss: 0.4722, test_loss: 1.3145, test_f1: 0.5973
 epoch: 82, train_loss: 0.4904, test_loss: 1.2938, test_f1: 0.6065
 epoch: 83, train_loss: 0.5299, test_loss: 1.3732, test_f1: 0.5927
 epoch: 84, train_loss: 0.5205, test_loss: 1.3611, test_f1: 0.6135
 epoch: 85, train_loss: 0.5019, test_loss: 1.3263, test_f1: 0.6405
 epoch: 86, train_loss: 0.4538, test_loss: 1.3686, test_f1: 0.6191
 epoch: 87, train_loss: 0.4430, test_loss: 1.3882, test_f1: 0.6203
 epoch: 88, train_loss: 0.4437, test_loss: 1.5640, test_f1: 0.5945
 epoch: 89, train_loss: 0.4326, test_loss: 1.4427, test_f1: 0.6242
 epoch: 90, train_loss: 0.4405, test_loss: 1.4197, test_f1: 0.5949
 epoch: 91, train_loss: 0.4518, test_loss: 1.6350, test_f1: 0.5525
 epoch: 92, train_loss: 0.4501, test_loss: 1.4250, test_f1: 0.6103
 epoch: 93, train_loss: 0.4309, test_loss: 1.3342, test_f1: 0.6258
 epoch: 94, train_loss: 0.4457, test_loss: 1.3790, test_f1: 0.6040
 epoch: 95, train_loss: 0.4351, test_loss: 1.4747, test_f1: 0.6052
 epoch: 96, train_loss: 0.4293, test_loss: 1.3938, test_f1: 0.6297
 epoch: 97, train_loss: 0.4156, test_loss: 1.5079, test_f1: 0.5747
 epoch: 98, train_loss: 0.3971, test_loss: 1.4958, test_f1: 0.6075
 epoch: 99, train_loss: 0.3838, test_loss: 1.5156, test_f1: 0.6020
##################ITERATION #7 ****************************************
 epoch: 0, train_loss: 1.2882, test_loss: 1.2742, test_f1: 0.3512
 epoch: 1, train_loss: 1.1101, test_loss: 1.1969, test_f1: 0.2926
 epoch: 2, train_loss: 1.0250, test_loss: 1.1257, test_f1: 0.4925
 epoch: 3, train_loss: 0.9917, test_loss: 1.3039, test_f1: 0.4066
 epoch: 4, train_loss: 0.9667, test_loss: 1.1705, test_f1: 0.4590
 epoch: 5, train_loss: 0.9487, test_loss: 1.1050, test_f1: 0.5176
 epoch: 6, train_loss: 0.9379, test_loss: 1.1056, test_f1: 0.4778
 epoch: 7, train_loss: 0.9454, test_loss: 1.1997, test_f1: 0.4759
 epoch: 8, train_loss: 0.9281, test_loss: 1.1116, test_f1: 0.4581
 epoch: 9, train_loss: 0.9542, test_loss: 1.1304, test_f1: 0.5110
 epoch: 10, train_loss: 0.9258, test_loss: 1.1810, test_f1: 0.4870
 epoch: 11, train_loss: 0.9291, test_loss: 1.1176, test_f1: 0.4637
 epoch: 12, train_loss: 0.9286, test_loss: 1.1868, test_f1: 0.4495
 epoch: 13, train_loss: 0.8996, test_loss: 1.1965, test_f1: 0.5227
 epoch: 14, train_loss: 0.8835, test_loss: 1.0724, test_f1: 0.5342
 epoch: 15, train_loss: 0.8929, test_loss: 1.1341, test_f1: 0.5118
 epoch: 16, train_loss: 0.9047, test_loss: 1.3182, test_f1: 0.4671
 epoch: 17, train_loss: 0.8900, test_loss: 1.0841, test_f1: 0.5132
 epoch: 18, train_loss: 0.8681, test_loss: 1.1194, test_f1: 0.4933
 epoch: 19, train_loss: 0.8647, test_loss: 1.1594, test_f1: 0.4891
 epoch: 20, train_loss: 0.9086, test_loss: 0.9987, test_f1: 0.5776
 epoch: 21, train_loss: 0.8699, test_loss: 1.0840, test_f1: 0.5292
 epoch: 22, train_loss: 0.8582, test_loss: 1.1175, test_f1: 0.4711
 epoch: 23, train_loss: 0.8357, test_loss: 1.0873, test_f1: 0.5423
 epoch: 24, train_loss: 0.8359, test_loss: 1.1856, test_f1: 0.5201
 epoch: 25, train_loss: 0.8231, test_loss: 1.0987, test_f1: 0.5941
 epoch: 26, train_loss: 0.8288, test_loss: 1.3025, test_f1: 0.5236
 epoch: 27, train_loss: 0.8167, test_loss: 1.0713, test_f1: 0.5695
 epoch: 28, train_loss: 0.8090, test_loss: 1.2903, test_f1: 0.4446
 epoch: 29, train_loss: 0.8097, test_loss: 1.1442, test_f1: 0.5491
 epoch: 30, train_loss: 0.8115, test_loss: 1.2416, test_f1: 0.5561
 epoch: 31, train_loss: 0.7986, test_loss: 1.0801, test_f1: 0.5576
 epoch: 32, train_loss: 0.7868, test_loss: 1.1308, test_f1: 0.5414
 epoch: 33, train_loss: 0.8064, test_loss: 3.6050, test_f1: 0.2455
 epoch: 34, train_loss: 0.8094, test_loss: 1.0669, test_f1: 0.5917
 epoch: 35, train_loss: 0.7771, test_loss: 1.2516, test_f1: 0.5279
 epoch: 36, train_loss: 0.7671, test_loss: 1.0750, test_f1: 0.6137
 epoch: 37, train_loss: 0.7526, test_loss: 1.1571, test_f1: 0.5594
 epoch: 38, train_loss: 0.7516, test_loss: 1.1771, test_f1: 0.5582
 epoch: 39, train_loss: 0.7588, test_loss: 1.0288, test_f1: 0.5763
 epoch: 40, train_loss: 0.7301, test_loss: 1.0092, test_f1: 0.6189
 epoch: 41, train_loss: 0.7354, test_loss: 1.1188, test_f1: 0.5952
 epoch: 42, train_loss: 0.7121, test_loss: 1.2907, test_f1: 0.4833
 epoch: 43, train_loss: 0.7278, test_loss: 1.1397, test_f1: 0.5778
 epoch: 44, train_loss: 0.7294, test_loss: 1.1131, test_f1: 0.6051
 epoch: 45, train_loss: 0.6971, test_loss: 1.0809, test_f1: 0.5583
 epoch: 46, train_loss: 0.6793, test_loss: 1.2942, test_f1: 0.5628
 epoch: 47, train_loss: 0.6881, test_loss: 1.6918, test_f1: 0.4493
 epoch: 48, train_loss: 0.6846, test_loss: 1.0741, test_f1: 0.5953
 epoch: 49, train_loss: 0.6632, test_loss: 1.3326, test_f1: 0.5615
 epoch: 50, train_loss: 0.6579, test_loss: 1.3058, test_f1: 0.4999
 epoch: 51, train_loss: 0.6544, test_loss: 1.3224, test_f1: 0.5885
 epoch: 52, train_loss: 0.6276, test_loss: 1.1793, test_f1: 0.6092
 epoch: 53, train_loss: 0.6270, test_loss: 1.1879, test_f1: 0.5975
 epoch: 54, train_loss: 0.6509, test_loss: 1.3412, test_f1: 0.6005
 epoch: 55, train_loss: 0.6511, test_loss: 1.1038, test_f1: 0.5768
 epoch: 56, train_loss: 0.6367, test_loss: 1.3615, test_f1: 0.6145
 epoch: 57, train_loss: 0.6098, test_loss: 1.2532, test_f1: 0.6234
 epoch: 58, train_loss: 0.5866, test_loss: 1.2155, test_f1: 0.5809
 epoch: 59, train_loss: 0.5674, test_loss: 1.1825, test_f1: 0.6126
 epoch: 60, train_loss: 0.5588, test_loss: 1.1843, test_f1: 0.5974
 epoch: 61, train_loss: 0.5817, test_loss: 1.2854, test_f1: 0.6260
 epoch: 62, train_loss: 0.5783, test_loss: 1.3333, test_f1: 0.5952
 epoch: 63, train_loss: 0.5793, test_loss: 1.2088, test_f1: 0.6003
 epoch: 64, train_loss: 0.5775, test_loss: 1.4915, test_f1: 0.5233
 epoch: 65, train_loss: 0.5744, test_loss: 1.2874, test_f1: 0.5714
 epoch: 66, train_loss: 0.5494, test_loss: 1.2696, test_f1: 0.6131
 epoch: 67, train_loss: 0.5682, test_loss: 1.2531, test_f1: 0.6151
 epoch: 68, train_loss: 0.5352, test_loss: 1.3018, test_f1: 0.5845
 epoch: 69, train_loss: 0.5673, test_loss: 1.2752, test_f1: 0.5977
 epoch: 70, train_loss: 0.5890, test_loss: 1.1526, test_f1: 0.6237
 epoch: 71, train_loss: 0.5680, test_loss: 1.3945, test_f1: 0.6043
 epoch: 72, train_loss: 0.5481, test_loss: 1.2600, test_f1: 0.5864
 epoch: 73, train_loss: 0.5536, test_loss: 1.3050, test_f1: 0.5979
 epoch: 74, train_loss: 0.5158, test_loss: 1.2917, test_f1: 0.5917
 epoch: 75, train_loss: 0.5251, test_loss: 1.3180, test_f1: 0.6243
 epoch: 76, train_loss: 0.5088, test_loss: 1.3644, test_f1: 0.6181
 epoch: 77, train_loss: 0.5073, test_loss: 1.5278, test_f1: 0.5996
 epoch: 78, train_loss: 0.4967, test_loss: 1.4781, test_f1: 0.6110
 epoch: 79, train_loss: 0.5284, test_loss: 1.6624, test_f1: 0.5680
 epoch: 80, train_loss: 0.5102, test_loss: 1.4412, test_f1: 0.5832
 epoch: 81, train_loss: 0.5064, test_loss: 1.3909, test_f1: 0.6137
 epoch: 82, train_loss: 0.5213, test_loss: 1.5717, test_f1: 0.5889
 epoch: 83, train_loss: 0.5783, test_loss: 1.9724, test_f1: 0.4856
 epoch: 84, train_loss: 0.5270, test_loss: 1.5418, test_f1: 0.5737
 epoch: 85, train_loss: 0.5465, test_loss: 1.3931, test_f1: 0.6193
 epoch: 86, train_loss: 0.5156, test_loss: 1.5938, test_f1: 0.5724
 epoch: 87, train_loss: 0.5176, test_loss: 1.7293, test_f1: 0.5659
 epoch: 88, train_loss: 0.5247, test_loss: 1.4767, test_f1: 0.5764
 epoch: 89, train_loss: 0.4910, test_loss: 1.5244, test_f1: 0.6071
 epoch: 90, train_loss: 0.5006, test_loss: 1.5804, test_f1: 0.6373
 epoch: 91, train_loss: 0.4804, test_loss: 1.4766, test_f1: 0.6384
 epoch: 92, train_loss: 0.4854, test_loss: 1.5859, test_f1: 0.5776
 epoch: 93, train_loss: 0.4561, test_loss: 1.6944, test_f1: 0.6056
 epoch: 94, train_loss: 0.4899, test_loss: 1.6426, test_f1: 0.5912
 epoch: 95, train_loss: 0.4923, test_loss: 1.7659, test_f1: 0.5790
 epoch: 96, train_loss: 0.5084, test_loss: 1.4404, test_f1: 0.6359
 epoch: 97, train_loss: 0.4939, test_loss: 1.4792, test_f1: 0.5679
 epoch: 98, train_loss: 0.5279, test_loss: 1.3756, test_f1: 0.5870
 epoch: 99, train_loss: 0.5025, test_loss: 1.4599, test_f1: 0.5818
##################ITERATION #8 ****************************************
 epoch: 0, train_loss: 1.2993, test_loss: 1.4655, test_f1: 0.3275
 epoch: 1, train_loss: 1.0829, test_loss: 1.4099, test_f1: 0.2569
 epoch: 2, train_loss: 1.0162, test_loss: 1.1199, test_f1: 0.4478
 epoch: 3, train_loss: 0.9849, test_loss: 1.2435, test_f1: 0.4699
 epoch: 4, train_loss: 0.9745, test_loss: 1.1219, test_f1: 0.5117
 epoch: 5, train_loss: 0.9649, test_loss: 1.1639, test_f1: 0.5165
 epoch: 6, train_loss: 0.9577, test_loss: 1.0978, test_f1: 0.5417
 epoch: 7, train_loss: 0.9235, test_loss: 1.1257, test_f1: 0.5177
 epoch: 8, train_loss: 0.9121, test_loss: 1.0503, test_f1: 0.5432
 epoch: 9, train_loss: 0.8979, test_loss: 1.1100, test_f1: 0.5553
 epoch: 10, train_loss: 0.8800, test_loss: 1.2261, test_f1: 0.5167
 epoch: 11, train_loss: 0.8945, test_loss: 1.0695, test_f1: 0.5916
 epoch: 12, train_loss: 0.8742, test_loss: 1.1125, test_f1: 0.5302
 epoch: 13, train_loss: 0.8791, test_loss: 1.1174, test_f1: 0.5236
 epoch: 14, train_loss: 0.8710, test_loss: 1.0758, test_f1: 0.5353
 epoch: 15, train_loss: 0.8632, test_loss: 1.1199, test_f1: 0.5434
 epoch: 16, train_loss: 0.8616, test_loss: 1.0592, test_f1: 0.5418
 epoch: 17, train_loss: 0.8863, test_loss: 1.0694, test_f1: 0.5259
 epoch: 18, train_loss: 0.8762, test_loss: 1.0648, test_f1: 0.5881
 epoch: 19, train_loss: 0.8785, test_loss: 1.0788, test_f1: 0.5440
 epoch: 20, train_loss: 0.8519, test_loss: 1.0403, test_f1: 0.5280
 epoch: 21, train_loss: 0.8258, test_loss: 1.1244, test_f1: 0.5625
 epoch: 22, train_loss: 0.8392, test_loss: 1.1627, test_f1: 0.5436
 epoch: 23, train_loss: 0.8241, test_loss: 1.2052, test_f1: 0.4818
 epoch: 24, train_loss: 0.8148, test_loss: 1.0911, test_f1: 0.5636
 epoch: 25, train_loss: 0.8050, test_loss: 1.2974, test_f1: 0.5275
 epoch: 26, train_loss: 0.8188, test_loss: 1.1687, test_f1: 0.5317
 epoch: 27, train_loss: 0.8090, test_loss: 1.1080, test_f1: 0.5932
 epoch: 28, train_loss: 0.8017, test_loss: 1.1546, test_f1: 0.5854
 epoch: 29, train_loss: 0.7880, test_loss: 1.1903, test_f1: 0.5305
 epoch: 30, train_loss: 0.7600, test_loss: 0.9900, test_f1: 0.5813
 epoch: 31, train_loss: 0.7655, test_loss: 1.0753, test_f1: 0.6288
 epoch: 32, train_loss: 0.7408, test_loss: 1.0639, test_f1: 0.5819
 epoch: 33, train_loss: 0.7376, test_loss: 1.2226, test_f1: 0.4738
 epoch: 34, train_loss: 0.7355, test_loss: 1.0585, test_f1: 0.5838
 epoch: 35, train_loss: 0.7336, test_loss: 1.1229, test_f1: 0.5492
 epoch: 36, train_loss: 0.7124, test_loss: 1.1182, test_f1: 0.5829
 epoch: 37, train_loss: 0.7104, test_loss: 1.2038, test_f1: 0.5614
 epoch: 38, train_loss: 0.7576, test_loss: 1.0250, test_f1: 0.5976
 epoch: 39, train_loss: 0.7541, test_loss: 1.0780, test_f1: 0.5689
 epoch: 40, train_loss: 0.7221, test_loss: 1.0766, test_f1: 0.5820
 epoch: 41, train_loss: 0.6961, test_loss: 1.1292, test_f1: 0.5970
 epoch: 42, train_loss: 0.7025, test_loss: 1.0936, test_f1: 0.5953
 epoch: 43, train_loss: 0.6806, test_loss: 0.9949, test_f1: 0.6069
 epoch: 44, train_loss: 0.6799, test_loss: 1.1591, test_f1: 0.5814
 epoch: 45, train_loss: 0.7138, test_loss: 1.0567, test_f1: 0.6015
 epoch: 46, train_loss: 0.7182, test_loss: 1.1510, test_f1: 0.4673
 epoch: 47, train_loss: 0.6623, test_loss: 1.1645, test_f1: 0.5612
 epoch: 48, train_loss: 0.6922, test_loss: 1.1685, test_f1: 0.5740
 epoch: 49, train_loss: 0.6409, test_loss: 1.1659, test_f1: 0.5617
 epoch: 50, train_loss: 0.6443, test_loss: 1.3354, test_f1: 0.5565
 epoch: 51, train_loss: 0.6094, test_loss: 1.2715, test_f1: 0.5385
 epoch: 52, train_loss: 0.5859, test_loss: 1.1387, test_f1: 0.5844
 epoch: 53, train_loss: 0.5902, test_loss: 1.1915, test_f1: 0.5885
 epoch: 54, train_loss: 0.5931, test_loss: 1.2968, test_f1: 0.5977
 epoch: 55, train_loss: 0.5941, test_loss: 1.2124, test_f1: 0.5669
 epoch: 56, train_loss: 0.5965, test_loss: 1.1935, test_f1: 0.6160
 epoch: 57, train_loss: 0.5650, test_loss: 1.3173, test_f1: 0.5864
 epoch: 58, train_loss: 0.5745, test_loss: 1.2343, test_f1: 0.5943
 epoch: 59, train_loss: 0.5621, test_loss: 1.2538, test_f1: 0.5819
 epoch: 60, train_loss: 0.5531, test_loss: 1.2855, test_f1: 0.5688
 epoch: 61, train_loss: 0.5675, test_loss: 1.3451, test_f1: 0.5883
 epoch: 62, train_loss: 0.5533, test_loss: 1.2676, test_f1: 0.5667
 epoch: 63, train_loss: 0.5448, test_loss: 1.2995, test_f1: 0.5747
 epoch: 64, train_loss: 0.5517, test_loss: 1.3042, test_f1: 0.5803
 epoch: 65, train_loss: 0.5532, test_loss: 1.3280, test_f1: 0.5986
 epoch: 66, train_loss: 0.5293, test_loss: 1.2761, test_f1: 0.6082
 epoch: 67, train_loss: 0.5196, test_loss: 1.4023, test_f1: 0.5624
 epoch: 68, train_loss: 0.5291, test_loss: 1.4554, test_f1: 0.5655
 epoch: 69, train_loss: 0.5408, test_loss: 1.4139, test_f1: 0.5497
 epoch: 70, train_loss: 0.5739, test_loss: 1.3566, test_f1: 0.5653
 epoch: 71, train_loss: 0.5646, test_loss: 1.2035, test_f1: 0.5811
 epoch: 72, train_loss: 0.5224, test_loss: 1.2451, test_f1: 0.6080
 epoch: 73, train_loss: 0.5058, test_loss: 1.3881, test_f1: 0.5649
 epoch: 74, train_loss: 0.5554, test_loss: 1.2245, test_f1: 0.5913
 epoch: 75, train_loss: 0.5416, test_loss: 1.5097, test_f1: 0.5473
 epoch: 76, train_loss: 0.5067, test_loss: 1.3388, test_f1: 0.5608
 epoch: 77, train_loss: 0.5337, test_loss: 1.4571, test_f1: 0.5853
 epoch: 78, train_loss: 0.4957, test_loss: 1.5561, test_f1: 0.5737
 epoch: 79, train_loss: 0.5271, test_loss: 1.3521, test_f1: 0.5824
 epoch: 80, train_loss: 0.5224, test_loss: 1.4498, test_f1: 0.5755
 epoch: 81, train_loss: 0.4841, test_loss: 1.3801, test_f1: 0.5899
 epoch: 82, train_loss: 0.4943, test_loss: 1.3465, test_f1: 0.5873
 epoch: 83, train_loss: 0.4524, test_loss: 1.4820, test_f1: 0.5708
 epoch: 84, train_loss: 0.4874, test_loss: 1.6569, test_f1: 0.5550
 epoch: 85, train_loss: 0.4596, test_loss: 1.3935, test_f1: 0.5911
 epoch: 86, train_loss: 0.4694, test_loss: 1.5599, test_f1: 0.5954
 epoch: 87, train_loss: 0.5682, test_loss: 1.6205, test_f1: 0.5285
 epoch: 88, train_loss: 0.5474, test_loss: 1.3527, test_f1: 0.5490
 epoch: 89, train_loss: 0.5098, test_loss: 1.4323, test_f1: 0.5600
 epoch: 90, train_loss: 0.4722, test_loss: 1.3594, test_f1: 0.5923
 epoch: 91, train_loss: 0.4551, test_loss: 1.4366, test_f1: 0.5897
 epoch: 92, train_loss: 0.4503, test_loss: 1.4637, test_f1: 0.5965
 epoch: 93, train_loss: 0.4731, test_loss: 1.3984, test_f1: 0.5845
 epoch: 94, train_loss: 0.4687, test_loss: 1.4139, test_f1: 0.5860
 epoch: 95, train_loss: 0.4759, test_loss: 1.3962, test_f1: 0.5879
 epoch: 96, train_loss: 0.4562, test_loss: 1.5297, test_f1: 0.5732
 epoch: 97, train_loss: 0.5082, test_loss: 1.4912, test_f1: 0.5878
 epoch: 98, train_loss: 0.4951, test_loss: 1.5407, test_f1: 0.5370
 epoch: 99, train_loss: 0.5047, test_loss: 1.4537, test_f1: 0.5805
##################ITERATION #9 ****************************************
 epoch: 0, train_loss: 1.3217, test_loss: 1.3162, test_f1: 0.3170
 epoch: 1, train_loss: 1.1207, test_loss: 1.2553, test_f1: 0.2722
 epoch: 2, train_loss: 1.0797, test_loss: 1.1602, test_f1: 0.3947
 epoch: 3, train_loss: 1.0291, test_loss: 1.1075, test_f1: 0.4817
 epoch: 4, train_loss: 0.9978, test_loss: 1.1304, test_f1: 0.4797
 epoch: 5, train_loss: 0.9960, test_loss: 1.1040, test_f1: 0.4625
 epoch: 6, train_loss: 0.9641, test_loss: 1.1809, test_f1: 0.3764
 epoch: 7, train_loss: 0.9215, test_loss: 1.1665, test_f1: 0.4970
 epoch: 8, train_loss: 0.9371, test_loss: 1.0886, test_f1: 0.5299
 epoch: 9, train_loss: 0.9124, test_loss: 1.1665, test_f1: 0.5249
 epoch: 10, train_loss: 0.9180, test_loss: 1.2479, test_f1: 0.4892
 epoch: 11, train_loss: 0.8955, test_loss: 1.1046, test_f1: 0.4713
 epoch: 12, train_loss: 0.9136, test_loss: 1.5004, test_f1: 0.4128
 epoch: 13, train_loss: 0.8835, test_loss: 1.2048, test_f1: 0.5120
 epoch: 14, train_loss: 0.8749, test_loss: 1.1265, test_f1: 0.5597
 epoch: 15, train_loss: 0.8593, test_loss: 1.1538, test_f1: 0.5779
 epoch: 16, train_loss: 0.8506, test_loss: 1.2529, test_f1: 0.5349
 epoch: 17, train_loss: 0.8389, test_loss: 1.1264, test_f1: 0.5353
 epoch: 18, train_loss: 0.8440, test_loss: 1.1486, test_f1: 0.5712
 epoch: 19, train_loss: 0.8172, test_loss: 1.2334, test_f1: 0.5041
 epoch: 20, train_loss: 0.8508, test_loss: 1.1500, test_f1: 0.5781
 epoch: 21, train_loss: 0.8848, test_loss: 1.2642, test_f1: 0.4928
 epoch: 22, train_loss: 0.8744, test_loss: 1.1415, test_f1: 0.5439
 epoch: 23, train_loss: 0.8615, test_loss: 1.2041, test_f1: 0.4991
 epoch: 24, train_loss: 0.8120, test_loss: 1.1010, test_f1: 0.5387
 epoch: 25, train_loss: 0.7914, test_loss: 1.2662, test_f1: 0.4740
 epoch: 26, train_loss: 0.8075, test_loss: 1.1018, test_f1: 0.5679
 epoch: 27, train_loss: 0.7864, test_loss: 1.0859, test_f1: 0.5758
 epoch: 28, train_loss: 0.7753, test_loss: 1.1952, test_f1: 0.5366
 epoch: 29, train_loss: 0.7558, test_loss: 1.2626, test_f1: 0.5658
 epoch: 30, train_loss: 0.7906, test_loss: 1.3386, test_f1: 0.5317
 epoch: 31, train_loss: 0.7515, test_loss: 1.2276, test_f1: 0.5193
 epoch: 32, train_loss: 0.7213, test_loss: 1.2125, test_f1: 0.5610
 epoch: 33, train_loss: 0.7543, test_loss: 1.3293, test_f1: 0.4996
 epoch: 34, train_loss: 0.7773, test_loss: 1.1018, test_f1: 0.6048
 epoch: 35, train_loss: 0.7480, test_loss: 1.0691, test_f1: 0.5303
 epoch: 36, train_loss: 0.7036, test_loss: 1.1956, test_f1: 0.5369
 epoch: 37, train_loss: 0.7442, test_loss: 1.1775, test_f1: 0.5827
 epoch: 38, train_loss: 0.7109, test_loss: 1.3339, test_f1: 0.5311
 epoch: 39, train_loss: 0.7065, test_loss: 1.5033, test_f1: 0.5184
 epoch: 40, train_loss: 0.6840, test_loss: 1.2715, test_f1: 0.5336
 epoch: 41, train_loss: 0.6561, test_loss: 1.1318, test_f1: 0.5908
 epoch: 42, train_loss: 0.6629, test_loss: 1.4086, test_f1: 0.5497
 epoch: 43, train_loss: 0.6579, test_loss: 1.4674, test_f1: 0.5781
 epoch: 44, train_loss: 0.7007, test_loss: 1.3240, test_f1: 0.5131
 epoch: 45, train_loss: 0.6981, test_loss: 1.2699, test_f1: 0.5131
 epoch: 46, train_loss: 0.7119, test_loss: 1.3316, test_f1: 0.5408
 epoch: 47, train_loss: 0.6688, test_loss: 1.1888, test_f1: 0.6024
 epoch: 48, train_loss: 0.6779, test_loss: 1.2382, test_f1: 0.5262
 epoch: 49, train_loss: 0.7000, test_loss: 1.2549, test_f1: 0.5356
 epoch: 50, train_loss: 0.6796, test_loss: 1.1974, test_f1: 0.5847
 epoch: 51, train_loss: 0.6349, test_loss: 1.1374, test_f1: 0.6007
 epoch: 52, train_loss: 0.6219, test_loss: 1.3453, test_f1: 0.5173
 epoch: 53, train_loss: 0.6033, test_loss: 1.2453, test_f1: 0.5879
 epoch: 54, train_loss: 0.5929, test_loss: 1.2320, test_f1: 0.5695
 epoch: 55, train_loss: 0.5709, test_loss: 1.3420, test_f1: 0.5573
 epoch: 56, train_loss: 0.5730, test_loss: 1.3734, test_f1: 0.5671
 epoch: 57, train_loss: 0.5554, test_loss: 1.4105, test_f1: 0.5176
 epoch: 58, train_loss: 0.5686, test_loss: 1.4055, test_f1: 0.5303
 epoch: 59, train_loss: 0.5765, test_loss: 1.3461, test_f1: 0.5863
 epoch: 60, train_loss: 0.5345, test_loss: 1.3494, test_f1: 0.5641
 epoch: 61, train_loss: 0.5294, test_loss: 1.4741, test_f1: 0.5638
 epoch: 62, train_loss: 0.5093, test_loss: 1.4587, test_f1: 0.5843
 epoch: 63, train_loss: 0.5195, test_loss: 1.4294, test_f1: 0.5585
 epoch: 64, train_loss: 0.5202, test_loss: 1.4657, test_f1: 0.5315
 epoch: 65, train_loss: 0.5490, test_loss: 1.4513, test_f1: 0.5707
 epoch: 66, train_loss: 0.5405, test_loss: 1.3256, test_f1: 0.5629
 epoch: 67, train_loss: 0.5380, test_loss: 1.4310, test_f1: 0.6069
 epoch: 68, train_loss: 0.5328, test_loss: 1.4291, test_f1: 0.5797
 epoch: 69, train_loss: 0.5188, test_loss: 1.5981, test_f1: 0.5565
 epoch: 70, train_loss: 0.5088, test_loss: 1.5781, test_f1: 0.5622
 epoch: 71, train_loss: 0.4853, test_loss: 1.6945, test_f1: 0.5359
 epoch: 72, train_loss: 0.5038, test_loss: 1.5099, test_f1: 0.5768
 epoch: 73, train_loss: 0.4891, test_loss: 1.5100, test_f1: 0.5656
 epoch: 74, train_loss: 0.5053, test_loss: 1.5659, test_f1: 0.5157
 epoch: 75, train_loss: 0.5084, test_loss: 1.5588, test_f1: 0.5498
 epoch: 76, train_loss: 0.5230, test_loss: 1.6781, test_f1: 0.5798
 epoch: 77, train_loss: 0.5092, test_loss: 1.2620, test_f1: 0.5864
 epoch: 78, train_loss: 0.4988, test_loss: 1.5285, test_f1: 0.5720
 epoch: 79, train_loss: 0.4834, test_loss: 1.5218, test_f1: 0.5895
 epoch: 80, train_loss: 0.5212, test_loss: 1.6899, test_f1: 0.5591
 epoch: 81, train_loss: 0.4987, test_loss: 1.7292, test_f1: 0.5588
 epoch: 82, train_loss: 0.5207, test_loss: 1.5068, test_f1: 0.5763
 epoch: 83, train_loss: 0.4868, test_loss: 1.5807, test_f1: 0.5494
 epoch: 84, train_loss: 0.4583, test_loss: 1.5201, test_f1: 0.5616
 epoch: 85, train_loss: 0.4437, test_loss: 1.5637, test_f1: 0.5812
 epoch: 86, train_loss: 0.4418, test_loss: 1.7432, test_f1: 0.5598
 epoch: 87, train_loss: 0.4338, test_loss: 1.6493, test_f1: 0.5153
 epoch: 88, train_loss: 0.4646, test_loss: 1.6302, test_f1: 0.4841
 epoch: 89, train_loss: 0.4957, test_loss: 1.6646, test_f1: 0.5612
 epoch: 90, train_loss: 0.4766, test_loss: 1.6976, test_f1: 0.5933
 epoch: 91, train_loss: 0.4556, test_loss: 1.5770, test_f1: 0.5501
 epoch: 92, train_loss: 0.4423, test_loss: 1.4641, test_f1: 0.5844
 epoch: 93, train_loss: 0.4555, test_loss: 1.5268, test_f1: 0.6019
 epoch: 94, train_loss: 0.4414, test_loss: 1.7462, test_f1: 0.5786
 epoch: 95, train_loss: 0.4199, test_loss: 1.7666, test_f1: 0.5706
 epoch: 96, train_loss: 0.4537, test_loss: 1.6838, test_f1: 0.5458
 epoch: 97, train_loss: 0.4586, test_loss: 1.9165, test_f1: 0.5478
 epoch: 98, train_loss: 0.4295, test_loss: 1.5636, test_f1: 0.5925
 epoch: 99, train_loss: 0.4230, test_loss: 1.6710, test_f1: 0.6156

Training completed in 346.47 seconds
Best F1: 0.6456 at epoch 77
Mean F1 across iterations: 0.6339  0.0093
========================FINAL RESULTS================================
FEGIN weighted F1: 0.6456  0.0093
python main.py --data ltspice_demos --representation component_net --model FEGIN --layers 4 --hiddens 32 --batch_size 128 --lr 0.01 --emb_size 250 --epochs 100 --save_appendix component_net_L4_H32_BS128_LR0.01_E250 --no_val
-----



STDERR:
  File "main.py", line 370, in <module>
    main()
  File "main.py", line 254, in main
    dataset = dataset_class(
  File "/home/philip/projects/ltspice_examples_code_repo/Circuit-Completion-Using-GNNs/component_classification_with_link_prediction_head/evaluation/FEGIN/kernel/circuit_datasets.py", line 15, in __init__
    self.data, self.slices = torch.load(self.processed_paths[0])
  File "/home/philip/.local/lib/python3.8/site-packages/torch/serialization.py", line 1040, in load
    warnings.warn(
  File "/usr/lib/python3.8/warnings.py", line 109, in _showwarnmsg
    sw(msg.message, msg.category, msg.filename, msg.lineno,
  File "main.py", line 47, in warn_with_traceback
    traceback.print_stack(file=log)
/home/philip/projects/ltspice_examples_code_repo/Circuit-Completion-Using-GNNs/component_classification_with_link_prediction_head/evaluation/FEGIN/kernel/circuit_datasets.py:15: FutureWarning: You are using `torch.load` with `weights_only=False` (the current default value), which uses the default pickle module implicitly. It is possible to construct malicious pickle data which will execute arbitrary code during unpickling (See https://github.com/pytorch/pytorch/blob/main/SECURITY.md#untrusted-models for more details). In a future release, the default value for `weights_only` will be flipped to `True`. This limits the functions that could be executed during unpickling. Arbitrary objects will no longer be allowed to be loaded via this mode unless they are explicitly allowlisted by the user via `torch.serialization.add_safe_globals`. We recommend you start setting `weights_only=True` for any use case where you don't have full control of the loaded file. Please open an issue on GitHub for any issues related to this experimental feature.
  self.data, self.slices = torch.load(self.processed_paths[0])
