STDOUT:
Results will be saved in /home/philip/projects/ltspice_examples_code_repo/Circuit-Completion-Using-GNNs/component_classification_with_link_prediction_head/evaluation/FEGIN/results/model_FEGIN_dataset_ltspice_examples
Command line input: python main.py --data ltspice_examples --representation component_net --model FEGIN --layers 3 --hiddens 16 --batch_size 256 --lr 0.01 --emb_size 250 --epochs 100 --save_appendix component_net_L3_H16_BS256_LR0.01_E250 --no_val
 is saved.
-----
ltspice_examples - FEGIN
Using 3 layers, 16 hidden units, h = 2
Loading component_net representation dataset
ENTERED
Training FEGIN on component_net representation
Train: 3558, Test: 846
##################ITERATION #0 ****************************************
 epoch: 0, train_loss: 1.3074, test_loss: 1.2986, test_f1: 0.2270
 epoch: 1, train_loss: 1.2222, test_loss: 1.2345, test_f1: 0.2270
 epoch: 2, train_loss: 1.1824, test_loss: 1.1868, test_f1: 0.2270
 epoch: 3, train_loss: 1.1456, test_loss: 1.1542, test_f1: 0.2270
 epoch: 4, train_loss: 1.1173, test_loss: 1.1040, test_f1: 0.3935
 epoch: 5, train_loss: 1.0763, test_loss: 1.0426, test_f1: 0.4528
 epoch: 6, train_loss: 1.0304, test_loss: 1.0177, test_f1: 0.4392
 epoch: 7, train_loss: 0.9897, test_loss: 0.9805, test_f1: 0.4426
 epoch: 8, train_loss: 0.9670, test_loss: 0.9662, test_f1: 0.4908
 epoch: 9, train_loss: 0.9449, test_loss: 0.9950, test_f1: 0.4868
 epoch: 10, train_loss: 0.9459, test_loss: 0.9566, test_f1: 0.4707
 epoch: 11, train_loss: 0.9480, test_loss: 1.0776, test_f1: 0.4959
 epoch: 12, train_loss: 0.9356, test_loss: 0.9520, test_f1: 0.5191
 epoch: 13, train_loss: 0.9152, test_loss: 0.9595, test_f1: 0.5185
 epoch: 14, train_loss: 0.9073, test_loss: 0.9103, test_f1: 0.5084
 epoch: 15, train_loss: 0.9172, test_loss: 0.9444, test_f1: 0.5319
 epoch: 16, train_loss: 0.9039, test_loss: 0.9377, test_f1: 0.4859
 epoch: 17, train_loss: 0.8868, test_loss: 1.1422, test_f1: 0.4305
 epoch: 18, train_loss: 0.8969, test_loss: 0.9965, test_f1: 0.5106
 epoch: 19, train_loss: 0.8921, test_loss: 0.8985, test_f1: 0.5190
 epoch: 20, train_loss: 0.8805, test_loss: 0.9990, test_f1: 0.4908
 epoch: 21, train_loss: 0.8892, test_loss: 1.1260, test_f1: 0.4533
 epoch: 22, train_loss: 0.8942, test_loss: 1.0324, test_f1: 0.5032
 epoch: 23, train_loss: 0.8853, test_loss: 0.9555, test_f1: 0.5041
 epoch: 24, train_loss: 0.8734, test_loss: 0.9258, test_f1: 0.5150
 epoch: 25, train_loss: 0.8611, test_loss: 1.0342, test_f1: 0.4821
 epoch: 26, train_loss: 0.8638, test_loss: 1.0503, test_f1: 0.4920
 epoch: 27, train_loss: 0.8625, test_loss: 0.9161, test_f1: 0.5177
 epoch: 28, train_loss: 0.8651, test_loss: 0.9876, test_f1: 0.5684
 epoch: 29, train_loss: 0.8524, test_loss: 0.9293, test_f1: 0.5148
 epoch: 30, train_loss: 0.8723, test_loss: 0.9483, test_f1: 0.5208
 epoch: 31, train_loss: 0.8680, test_loss: 1.0287, test_f1: 0.4935
 epoch: 32, train_loss: 0.8551, test_loss: 0.9138, test_f1: 0.5241
 epoch: 33, train_loss: 0.8643, test_loss: 0.9491, test_f1: 0.5195
 epoch: 34, train_loss: 0.8544, test_loss: 0.9680, test_f1: 0.5264
 epoch: 35, train_loss: 0.8510, test_loss: 0.9685, test_f1: 0.5388
 epoch: 36, train_loss: 0.8348, test_loss: 0.9996, test_f1: 0.5531
 epoch: 37, train_loss: 0.8541, test_loss: 0.9231, test_f1: 0.5560
 epoch: 38, train_loss: 0.8394, test_loss: 1.0594, test_f1: 0.4876
 epoch: 39, train_loss: 0.8189, test_loss: 0.9731, test_f1: 0.5313
 epoch: 40, train_loss: 0.8203, test_loss: 0.8986, test_f1: 0.5700
 epoch: 41, train_loss: 0.8183, test_loss: 0.9636, test_f1: 0.5669
 epoch: 42, train_loss: 0.8342, test_loss: 0.9812, test_f1: 0.5019
 epoch: 43, train_loss: 0.8397, test_loss: 0.9793, test_f1: 0.4992
 epoch: 44, train_loss: 0.8234, test_loss: 0.9365, test_f1: 0.5069
 epoch: 45, train_loss: 0.8270, test_loss: 0.9678, test_f1: 0.5129
 epoch: 46, train_loss: 0.8387, test_loss: 1.0119, test_f1: 0.4863
 epoch: 47, train_loss: 0.8083, test_loss: 0.9377, test_f1: 0.5307
 epoch: 48, train_loss: 0.8116, test_loss: 0.9421, test_f1: 0.5265
 epoch: 49, train_loss: 0.8191, test_loss: 0.9673, test_f1: 0.5185
 epoch: 50, train_loss: 0.8261, test_loss: 0.9654, test_f1: 0.5117
 epoch: 51, train_loss: 0.7953, test_loss: 0.9277, test_f1: 0.5613
 epoch: 52, train_loss: 0.7831, test_loss: 0.9338, test_f1: 0.5525
 epoch: 53, train_loss: 0.7967, test_loss: 0.9410, test_f1: 0.5660
 epoch: 54, train_loss: 0.7852, test_loss: 0.9307, test_f1: 0.5456
 epoch: 55, train_loss: 0.7856, test_loss: 0.9521, test_f1: 0.5351
 epoch: 56, train_loss: 0.7858, test_loss: 0.9351, test_f1: 0.5324
 epoch: 57, train_loss: 0.7831, test_loss: 1.0149, test_f1: 0.5154
 epoch: 58, train_loss: 0.7904, test_loss: 0.9261, test_f1: 0.5548
 epoch: 59, train_loss: 0.7835, test_loss: 0.9504, test_f1: 0.5296
 epoch: 60, train_loss: 0.7738, test_loss: 0.9461, test_f1: 0.5592
 epoch: 61, train_loss: 0.7872, test_loss: 0.9225, test_f1: 0.5294
 epoch: 62, train_loss: 0.7790, test_loss: 0.9222, test_f1: 0.5470
 epoch: 63, train_loss: 0.7809, test_loss: 0.9285, test_f1: 0.5474
 epoch: 64, train_loss: 0.7799, test_loss: 1.0081, test_f1: 0.5176
 epoch: 65, train_loss: 0.7722, test_loss: 0.9090, test_f1: 0.5455
 epoch: 66, train_loss: 0.7836, test_loss: 0.9363, test_f1: 0.5535
 epoch: 67, train_loss: 0.7601, test_loss: 0.9342, test_f1: 0.5497
 epoch: 68, train_loss: 0.7643, test_loss: 0.9293, test_f1: 0.5427
 epoch: 69, train_loss: 0.7655, test_loss: 1.0263, test_f1: 0.5060
 epoch: 70, train_loss: 0.7544, test_loss: 0.9221, test_f1: 0.5490
 epoch: 71, train_loss: 0.7517, test_loss: 0.9404, test_f1: 0.5541
 epoch: 72, train_loss: 0.7680, test_loss: 0.9820, test_f1: 0.5338
 epoch: 73, train_loss: 0.7706, test_loss: 0.9383, test_f1: 0.5357
 epoch: 74, train_loss: 0.7609, test_loss: 0.9361, test_f1: 0.5669
 epoch: 75, train_loss: 0.7697, test_loss: 0.9688, test_f1: 0.5298
 epoch: 76, train_loss: 0.7597, test_loss: 0.9262, test_f1: 0.5362
 epoch: 77, train_loss: 0.7567, test_loss: 0.9229, test_f1: 0.5590
 epoch: 78, train_loss: 0.7677, test_loss: 0.9321, test_f1: 0.5364
 epoch: 79, train_loss: 0.7614, test_loss: 0.9207, test_f1: 0.5707
 epoch: 80, train_loss: 0.7454, test_loss: 0.9488, test_f1: 0.5725
 epoch: 81, train_loss: 0.7486, test_loss: 0.9536, test_f1: 0.5477
 epoch: 82, train_loss: 0.7690, test_loss: 0.9700, test_f1: 0.5319
 epoch: 83, train_loss: 0.7673, test_loss: 0.9866, test_f1: 0.5434
 epoch: 84, train_loss: 0.7596, test_loss: 0.9715, test_f1: 0.5489
 epoch: 85, train_loss: 0.7527, test_loss: 0.9528, test_f1: 0.5315
 epoch: 86, train_loss: 0.7464, test_loss: 0.9833, test_f1: 0.5467
 epoch: 87, train_loss: 0.7507, test_loss: 0.9730, test_f1: 0.5422
 epoch: 88, train_loss: 0.7533, test_loss: 0.9630, test_f1: 0.5452
 epoch: 89, train_loss: 0.7396, test_loss: 0.9508, test_f1: 0.5455
 epoch: 90, train_loss: 0.7467, test_loss: 0.9589, test_f1: 0.5470
 epoch: 91, train_loss: 0.7534, test_loss: 1.0887, test_f1: 0.5594
 epoch: 92, train_loss: 0.7548, test_loss: 0.9465, test_f1: 0.5418
 epoch: 93, train_loss: 0.7669, test_loss: 0.9578, test_f1: 0.5367
 epoch: 94, train_loss: 0.7592, test_loss: 0.9990, test_f1: 0.5299
 epoch: 95, train_loss: 0.7447, test_loss: 0.9245, test_f1: 0.5525
 epoch: 96, train_loss: 0.7416, test_loss: 0.9881, test_f1: 0.5642
 epoch: 97, train_loss: 0.7494, test_loss: 0.9519, test_f1: 0.5479
 epoch: 98, train_loss: 0.7415, test_loss: 1.0505, test_f1: 0.5016
 epoch: 99, train_loss: 0.7542, test_loss: 0.9702, test_f1: 0.5313
##################ITERATION #1 ****************************************
 epoch: 0, train_loss: 1.3086, test_loss: 1.2966, test_f1: 0.2270
 epoch: 1, train_loss: 1.1518, test_loss: 1.2023, test_f1: 0.3334
 epoch: 2, train_loss: 1.0901, test_loss: 1.0892, test_f1: 0.3573
 epoch: 3, train_loss: 1.0513, test_loss: 1.1111, test_f1: 0.3717
 epoch: 4, train_loss: 1.0181, test_loss: 1.0391, test_f1: 0.4520
 epoch: 5, train_loss: 0.9891, test_loss: 1.0638, test_f1: 0.4366
 epoch: 6, train_loss: 0.9802, test_loss: 1.0069, test_f1: 0.4803
 epoch: 7, train_loss: 0.9584, test_loss: 1.0068, test_f1: 0.4369
 epoch: 8, train_loss: 0.9477, test_loss: 1.0225, test_f1: 0.4803
 epoch: 9, train_loss: 0.9608, test_loss: 0.9936, test_f1: 0.4718
 epoch: 10, train_loss: 0.9386, test_loss: 0.9645, test_f1: 0.5004
 epoch: 11, train_loss: 0.9279, test_loss: 1.0253, test_f1: 0.5055
 epoch: 12, train_loss: 0.9183, test_loss: 0.9774, test_f1: 0.5393
 epoch: 13, train_loss: 0.9212, test_loss: 0.9509, test_f1: 0.4984
 epoch: 14, train_loss: 0.9163, test_loss: 1.0028, test_f1: 0.5151
 epoch: 15, train_loss: 0.8995, test_loss: 1.0217, test_f1: 0.4739
 epoch: 16, train_loss: 0.9056, test_loss: 1.0232, test_f1: 0.4612
 epoch: 17, train_loss: 0.8934, test_loss: 0.9859, test_f1: 0.4955
 epoch: 18, train_loss: 0.8929, test_loss: 1.0393, test_f1: 0.4712
 epoch: 19, train_loss: 0.9013, test_loss: 0.9468, test_f1: 0.5041
 epoch: 20, train_loss: 0.8944, test_loss: 0.9545, test_f1: 0.5228
 epoch: 21, train_loss: 0.8899, test_loss: 0.9945, test_f1: 0.4827
 epoch: 22, train_loss: 0.8952, test_loss: 0.9227, test_f1: 0.5343
 epoch: 23, train_loss: 0.8759, test_loss: 1.0115, test_f1: 0.4964
 epoch: 24, train_loss: 0.8743, test_loss: 0.9801, test_f1: 0.5113
 epoch: 25, train_loss: 0.8775, test_loss: 1.0299, test_f1: 0.5203
 epoch: 26, train_loss: 0.8768, test_loss: 1.0267, test_f1: 0.4709
 epoch: 27, train_loss: 0.8698, test_loss: 0.9745, test_f1: 0.5221
 epoch: 28, train_loss: 0.8688, test_loss: 1.0221, test_f1: 0.5236
 epoch: 29, train_loss: 0.8665, test_loss: 1.0075, test_f1: 0.5051
 epoch: 30, train_loss: 0.8833, test_loss: 0.9350, test_f1: 0.5206
 epoch: 31, train_loss: 0.8621, test_loss: 0.9752, test_f1: 0.5236
 epoch: 32, train_loss: 0.8634, test_loss: 0.9657, test_f1: 0.5173
 epoch: 33, train_loss: 0.8710, test_loss: 0.9836, test_f1: 0.5391
 epoch: 34, train_loss: 0.8554, test_loss: 1.0138, test_f1: 0.5232
 epoch: 35, train_loss: 0.8576, test_loss: 0.9653, test_f1: 0.5018
 epoch: 36, train_loss: 0.8607, test_loss: 1.0287, test_f1: 0.5021
 epoch: 37, train_loss: 0.8487, test_loss: 0.9857, test_f1: 0.5272
 epoch: 38, train_loss: 0.8627, test_loss: 0.9486, test_f1: 0.5208
 epoch: 39, train_loss: 0.8698, test_loss: 0.9254, test_f1: 0.5263
 epoch: 40, train_loss: 0.8541, test_loss: 1.0113, test_f1: 0.5220
 epoch: 41, train_loss: 0.8546, test_loss: 1.0089, test_f1: 0.5233
 epoch: 42, train_loss: 0.8528, test_loss: 0.9036, test_f1: 0.5511
 epoch: 43, train_loss: 0.8480, test_loss: 0.9697, test_f1: 0.5255
 epoch: 44, train_loss: 0.8435, test_loss: 1.0766, test_f1: 0.5124
 epoch: 45, train_loss: 0.8540, test_loss: 0.8813, test_f1: 0.5610
 epoch: 46, train_loss: 0.8581, test_loss: 0.9938, test_f1: 0.5085
 epoch: 47, train_loss: 0.8550, test_loss: 1.1396, test_f1: 0.4903
 epoch: 48, train_loss: 0.8404, test_loss: 0.9692, test_f1: 0.5284
 epoch: 49, train_loss: 0.8372, test_loss: 0.9302, test_f1: 0.5704
 epoch: 50, train_loss: 0.8403, test_loss: 1.1345, test_f1: 0.4812
 epoch: 51, train_loss: 0.8385, test_loss: 0.9595, test_f1: 0.5267
 epoch: 52, train_loss: 0.8240, test_loss: 1.0028, test_f1: 0.5228
 epoch: 53, train_loss: 0.8216, test_loss: 0.9287, test_f1: 0.5460
 epoch: 54, train_loss: 0.8106, test_loss: 0.9613, test_f1: 0.5456
 epoch: 55, train_loss: 0.8008, test_loss: 0.9553, test_f1: 0.5760
 epoch: 56, train_loss: 0.8019, test_loss: 0.8988, test_f1: 0.5531
 epoch: 57, train_loss: 0.7952, test_loss: 0.9538, test_f1: 0.5376
 epoch: 58, train_loss: 0.7975, test_loss: 0.9934, test_f1: 0.5527
 epoch: 59, train_loss: 0.8040, test_loss: 1.0178, test_f1: 0.5112
 epoch: 60, train_loss: 0.8082, test_loss: 0.9596, test_f1: 0.5282
 epoch: 61, train_loss: 0.8044, test_loss: 1.0043, test_f1: 0.5058
 epoch: 62, train_loss: 0.8028, test_loss: 0.9707, test_f1: 0.5674
 epoch: 63, train_loss: 0.7959, test_loss: 0.9759, test_f1: 0.5494
 epoch: 64, train_loss: 0.7770, test_loss: 0.9359, test_f1: 0.5400
 epoch: 65, train_loss: 0.7876, test_loss: 1.0182, test_f1: 0.5413
 epoch: 66, train_loss: 0.7927, test_loss: 0.9789, test_f1: 0.5522
 epoch: 67, train_loss: 0.7818, test_loss: 0.9844, test_f1: 0.5380
 epoch: 68, train_loss: 0.7828, test_loss: 0.9553, test_f1: 0.5438
 epoch: 69, train_loss: 0.7731, test_loss: 0.9342, test_f1: 0.5383
 epoch: 70, train_loss: 0.7778, test_loss: 0.9917, test_f1: 0.5329
 epoch: 71, train_loss: 0.7772, test_loss: 0.9828, test_f1: 0.5490
 epoch: 72, train_loss: 0.7813, test_loss: 0.9551, test_f1: 0.5456
 epoch: 73, train_loss: 0.7901, test_loss: 1.0348, test_f1: 0.5422
 epoch: 74, train_loss: 0.7705, test_loss: 0.9972, test_f1: 0.5465
 epoch: 75, train_loss: 0.7740, test_loss: 0.9431, test_f1: 0.5482
 epoch: 76, train_loss: 0.7661, test_loss: 0.9398, test_f1: 0.5529
 epoch: 77, train_loss: 0.7809, test_loss: 1.2192, test_f1: 0.5177
 epoch: 78, train_loss: 0.7830, test_loss: 0.9620, test_f1: 0.5161
 epoch: 79, train_loss: 0.7653, test_loss: 0.9578, test_f1: 0.5581
 epoch: 80, train_loss: 0.7672, test_loss: 0.9604, test_f1: 0.5530
 epoch: 81, train_loss: 0.7549, test_loss: 0.9321, test_f1: 0.5517
 epoch: 82, train_loss: 0.7630, test_loss: 1.0413, test_f1: 0.5542
 epoch: 83, train_loss: 0.7750, test_loss: 0.9659, test_f1: 0.5240
 epoch: 84, train_loss: 0.7696, test_loss: 0.9209, test_f1: 0.5529
 epoch: 85, train_loss: 0.7601, test_loss: 1.0756, test_f1: 0.4887
 epoch: 86, train_loss: 0.7766, test_loss: 1.0071, test_f1: 0.5746
 epoch: 87, train_loss: 0.7696, test_loss: 0.9783, test_f1: 0.5477
 epoch: 88, train_loss: 0.7643, test_loss: 0.9643, test_f1: 0.5205
 epoch: 89, train_loss: 0.7625, test_loss: 0.9865, test_f1: 0.5613
 epoch: 90, train_loss: 0.7672, test_loss: 1.0014, test_f1: 0.5807
 epoch: 91, train_loss: 0.7676, test_loss: 0.9754, test_f1: 0.5036
 epoch: 92, train_loss: 0.7729, test_loss: 1.0710, test_f1: 0.5176
 epoch: 93, train_loss: 0.7570, test_loss: 0.9738, test_f1: 0.5708
 epoch: 94, train_loss: 0.7568, test_loss: 1.0149, test_f1: 0.5500
 epoch: 95, train_loss: 0.7474, test_loss: 0.9542, test_f1: 0.5583
 epoch: 96, train_loss: 0.7541, test_loss: 0.9740, test_f1: 0.5460
 epoch: 97, train_loss: 0.7478, test_loss: 0.9749, test_f1: 0.5980
 epoch: 98, train_loss: 0.7577, test_loss: 1.0523, test_f1: 0.5441
 epoch: 99, train_loss: 0.7807, test_loss: 1.0089, test_f1: 0.5377
##################ITERATION #2 ****************************************
 epoch: 0, train_loss: 1.2413, test_loss: 1.2914, test_f1: 0.2270
 epoch: 1, train_loss: 1.0933, test_loss: 1.1071, test_f1: 0.3468
 epoch: 2, train_loss: 1.0719, test_loss: 1.0750, test_f1: 0.3469
 epoch: 3, train_loss: 1.0524, test_loss: 1.0750, test_f1: 0.3542
 epoch: 4, train_loss: 1.0367, test_loss: 1.4786, test_f1: 0.2978
 epoch: 5, train_loss: 1.0345, test_loss: 1.1790, test_f1: 0.3274
 epoch: 6, train_loss: 1.0158, test_loss: 1.1670, test_f1: 0.3911
 epoch: 7, train_loss: 0.9928, test_loss: 1.0828, test_f1: 0.4308
 epoch: 8, train_loss: 1.0032, test_loss: 1.0872, test_f1: 0.4715
 epoch: 9, train_loss: 0.9786, test_loss: 1.0480, test_f1: 0.4496
 epoch: 10, train_loss: 0.9692, test_loss: 0.9710, test_f1: 0.4873
 epoch: 11, train_loss: 0.9524, test_loss: 1.0106, test_f1: 0.4890
 epoch: 12, train_loss: 0.9479, test_loss: 0.9979, test_f1: 0.4823
 epoch: 13, train_loss: 0.9396, test_loss: 0.9861, test_f1: 0.4782
 epoch: 14, train_loss: 0.9461, test_loss: 1.0965, test_f1: 0.4267
 epoch: 15, train_loss: 0.9336, test_loss: 0.9667, test_f1: 0.4934
 epoch: 16, train_loss: 0.9381, test_loss: 0.9543, test_f1: 0.5181
 epoch: 17, train_loss: 0.9281, test_loss: 0.9548, test_f1: 0.5278
 epoch: 18, train_loss: 0.9486, test_loss: 1.0719, test_f1: 0.4302
 epoch: 19, train_loss: 0.9319, test_loss: 0.9669, test_f1: 0.5180
 epoch: 20, train_loss: 0.9249, test_loss: 0.9503, test_f1: 0.5036
 epoch: 21, train_loss: 0.9231, test_loss: 1.0102, test_f1: 0.5103
 epoch: 22, train_loss: 0.9118, test_loss: 0.9475, test_f1: 0.5016
 epoch: 23, train_loss: 0.9101, test_loss: 1.0788, test_f1: 0.4788
 epoch: 24, train_loss: 0.9219, test_loss: 0.9891, test_f1: 0.5194
 epoch: 25, train_loss: 0.9145, test_loss: 0.9303, test_f1: 0.5555
 epoch: 26, train_loss: 0.9017, test_loss: 0.9235, test_f1: 0.5195
 epoch: 27, train_loss: 0.9086, test_loss: 1.0374, test_f1: 0.4785
 epoch: 28, train_loss: 0.9077, test_loss: 0.9730, test_f1: 0.5058
 epoch: 29, train_loss: 0.9086, test_loss: 1.0104, test_f1: 0.4852
 epoch: 30, train_loss: 0.9000, test_loss: 1.0095, test_f1: 0.4807
 epoch: 31, train_loss: 0.8945, test_loss: 1.0042, test_f1: 0.4991
 epoch: 32, train_loss: 0.9065, test_loss: 0.9407, test_f1: 0.5260
 epoch: 33, train_loss: 0.8982, test_loss: 0.9525, test_f1: 0.5015
 epoch: 34, train_loss: 0.9043, test_loss: 0.9536, test_f1: 0.5035
 epoch: 35, train_loss: 0.8911, test_loss: 0.9120, test_f1: 0.4979
 epoch: 36, train_loss: 0.8805, test_loss: 0.9530, test_f1: 0.5075
 epoch: 37, train_loss: 0.8801, test_loss: 1.0053, test_f1: 0.4990
 epoch: 38, train_loss: 0.8729, test_loss: 0.9540, test_f1: 0.5230
 epoch: 39, train_loss: 0.8620, test_loss: 0.9908, test_f1: 0.5498
 epoch: 40, train_loss: 0.8820, test_loss: 0.9720, test_f1: 0.5105
 epoch: 41, train_loss: 0.8739, test_loss: 1.2824, test_f1: 0.4036
 epoch: 42, train_loss: 0.8695, test_loss: 1.0035, test_f1: 0.5394
 epoch: 43, train_loss: 0.8629, test_loss: 1.0568, test_f1: 0.4789
 epoch: 44, train_loss: 0.8757, test_loss: 0.9363, test_f1: 0.5245
 epoch: 45, train_loss: 0.8708, test_loss: 1.2591, test_f1: 0.4286
 epoch: 46, train_loss: 0.8641, test_loss: 0.9688, test_f1: 0.5338
 epoch: 47, train_loss: 0.8654, test_loss: 0.9734, test_f1: 0.5088
 epoch: 48, train_loss: 0.8672, test_loss: 0.9949, test_f1: 0.5421
 epoch: 49, train_loss: 0.8825, test_loss: 1.3375, test_f1: 0.3764
 epoch: 50, train_loss: 0.8722, test_loss: 0.9341, test_f1: 0.5351
 epoch: 51, train_loss: 0.8492, test_loss: 0.9580, test_f1: 0.5279
 epoch: 52, train_loss: 0.8345, test_loss: 0.9899, test_f1: 0.5066
 epoch: 53, train_loss: 0.8383, test_loss: 0.9369, test_f1: 0.5529
 epoch: 54, train_loss: 0.8330, test_loss: 0.9265, test_f1: 0.5642
 epoch: 55, train_loss: 0.8320, test_loss: 1.0589, test_f1: 0.5033
 epoch: 56, train_loss: 0.8343, test_loss: 0.9499, test_f1: 0.5451
 epoch: 57, train_loss: 0.8303, test_loss: 0.9597, test_f1: 0.5334
 epoch: 58, train_loss: 0.8304, test_loss: 0.9541, test_f1: 0.5447
 epoch: 59, train_loss: 0.8202, test_loss: 0.9361, test_f1: 0.5700
 epoch: 60, train_loss: 0.8293, test_loss: 0.9571, test_f1: 0.5312
 epoch: 61, train_loss: 0.8212, test_loss: 0.9804, test_f1: 0.5180
 epoch: 62, train_loss: 0.8329, test_loss: 0.9652, test_f1: 0.5673
 epoch: 63, train_loss: 0.8163, test_loss: 0.9801, test_f1: 0.5343
 epoch: 64, train_loss: 0.8119, test_loss: 0.9850, test_f1: 0.5398
 epoch: 65, train_loss: 0.8127, test_loss: 0.9569, test_f1: 0.5446
 epoch: 66, train_loss: 0.8093, test_loss: 0.9662, test_f1: 0.5412
 epoch: 67, train_loss: 0.8051, test_loss: 0.9724, test_f1: 0.5351
 epoch: 68, train_loss: 0.8037, test_loss: 0.9792, test_f1: 0.5350
 epoch: 69, train_loss: 0.8083, test_loss: 0.9835, test_f1: 0.5587
 epoch: 70, train_loss: 0.8083, test_loss: 0.9397, test_f1: 0.5742
 epoch: 71, train_loss: 0.7995, test_loss: 0.9664, test_f1: 0.5477
 epoch: 72, train_loss: 0.7940, test_loss: 0.9545, test_f1: 0.5619
 epoch: 73, train_loss: 0.8025, test_loss: 1.0302, test_f1: 0.5251
 epoch: 74, train_loss: 0.8118, test_loss: 0.9565, test_f1: 0.5620
 epoch: 75, train_loss: 0.8009, test_loss: 1.0939, test_f1: 0.5067
 epoch: 76, train_loss: 0.8057, test_loss: 0.9595, test_f1: 0.5647
 epoch: 77, train_loss: 0.7876, test_loss: 0.9525, test_f1: 0.5541
 epoch: 78, train_loss: 0.7929, test_loss: 0.9951, test_f1: 0.5384
 epoch: 79, train_loss: 0.7971, test_loss: 0.9701, test_f1: 0.5576
 epoch: 80, train_loss: 0.7972, test_loss: 1.0311, test_f1: 0.5452
 epoch: 81, train_loss: 0.7965, test_loss: 1.0071, test_f1: 0.5353
 epoch: 82, train_loss: 0.7880, test_loss: 1.0823, test_f1: 0.5162
 epoch: 83, train_loss: 0.7955, test_loss: 0.9651, test_f1: 0.5420
 epoch: 84, train_loss: 0.7834, test_loss: 1.0682, test_f1: 0.5117
 epoch: 85, train_loss: 0.7863, test_loss: 0.9581, test_f1: 0.5466
 epoch: 86, train_loss: 0.7878, test_loss: 1.0688, test_f1: 0.5304
 epoch: 87, train_loss: 0.7948, test_loss: 0.9822, test_f1: 0.5485
 epoch: 88, train_loss: 0.7900, test_loss: 0.9828, test_f1: 0.5436
 epoch: 89, train_loss: 0.8047, test_loss: 0.9861, test_f1: 0.5437
 epoch: 90, train_loss: 0.7914, test_loss: 0.9767, test_f1: 0.5517
 epoch: 91, train_loss: 0.7778, test_loss: 1.0807, test_f1: 0.5070
 epoch: 92, train_loss: 0.7869, test_loss: 1.0396, test_f1: 0.5275
 epoch: 93, train_loss: 0.7795, test_loss: 0.9867, test_f1: 0.5635
 epoch: 94, train_loss: 0.7779, test_loss: 1.0990, test_f1: 0.5275
 epoch: 95, train_loss: 0.7920, test_loss: 0.9713, test_f1: 0.5415
 epoch: 96, train_loss: 0.7862, test_loss: 1.0380, test_f1: 0.5304
 epoch: 97, train_loss: 0.7764, test_loss: 1.0397, test_f1: 0.5316
 epoch: 98, train_loss: 0.7801, test_loss: 1.0557, test_f1: 0.5334
 epoch: 99, train_loss: 0.7756, test_loss: 1.0007, test_f1: 0.5494
##################ITERATION #3 ****************************************
 epoch: 0, train_loss: 1.3494, test_loss: 1.3114, test_f1: 0.2270
 epoch: 1, train_loss: 1.2176, test_loss: 1.2792, test_f1: 0.2270
 epoch: 2, train_loss: 1.1750, test_loss: 1.1686, test_f1: 0.3175
 epoch: 3, train_loss: 1.1108, test_loss: 1.1029, test_f1: 0.3638
 epoch: 4, train_loss: 1.0764, test_loss: 1.0856, test_f1: 0.3614
 epoch: 5, train_loss: 1.0566, test_loss: 1.0758, test_f1: 0.4125
 epoch: 6, train_loss: 1.0360, test_loss: 1.3116, test_f1: 0.3150
 epoch: 7, train_loss: 1.0315, test_loss: 1.0575, test_f1: 0.3386
 epoch: 8, train_loss: 1.0266, test_loss: 1.1191, test_f1: 0.3478
 epoch: 9, train_loss: 1.0222, test_loss: 1.0697, test_f1: 0.4240
 epoch: 10, train_loss: 1.0270, test_loss: 1.0770, test_f1: 0.4206
 epoch: 11, train_loss: 1.0044, test_loss: 1.0840, test_f1: 0.4376
 epoch: 12, train_loss: 1.0051, test_loss: 1.0919, test_f1: 0.4130
 epoch: 13, train_loss: 0.9852, test_loss: 1.0382, test_f1: 0.4597
 epoch: 14, train_loss: 0.9743, test_loss: 1.0261, test_f1: 0.4751
 epoch: 15, train_loss: 0.9676, test_loss: 1.0423, test_f1: 0.4880
 epoch: 16, train_loss: 0.9612, test_loss: 1.0369, test_f1: 0.4703
 epoch: 17, train_loss: 0.9397, test_loss: 1.0839, test_f1: 0.4486
 epoch: 18, train_loss: 0.9293, test_loss: 1.0039, test_f1: 0.4656
 epoch: 19, train_loss: 0.9204, test_loss: 1.0933, test_f1: 0.4280
 epoch: 20, train_loss: 0.9199, test_loss: 1.0043, test_f1: 0.4958
 epoch: 21, train_loss: 0.9218, test_loss: 1.0380, test_f1: 0.5068
 epoch: 22, train_loss: 0.9165, test_loss: 0.9877, test_f1: 0.4877
 epoch: 23, train_loss: 0.8946, test_loss: 1.0466, test_f1: 0.4736
 epoch: 24, train_loss: 0.8971, test_loss: 0.9532, test_f1: 0.4965
 epoch: 25, train_loss: 0.8905, test_loss: 1.0727, test_f1: 0.4842
 epoch: 26, train_loss: 0.8983, test_loss: 0.9383, test_f1: 0.4693
 epoch: 27, train_loss: 0.8951, test_loss: 1.0474, test_f1: 0.5140
 epoch: 28, train_loss: 0.8897, test_loss: 0.9904, test_f1: 0.5067
 epoch: 29, train_loss: 0.8782, test_loss: 1.0122, test_f1: 0.4938
 epoch: 30, train_loss: 0.8868, test_loss: 1.0390, test_f1: 0.4915
 epoch: 31, train_loss: 0.8822, test_loss: 1.0331, test_f1: 0.4915
 epoch: 32, train_loss: 0.8832, test_loss: 1.1061, test_f1: 0.5208
 epoch: 33, train_loss: 0.8682, test_loss: 1.0729, test_f1: 0.4776
 epoch: 34, train_loss: 0.8780, test_loss: 1.0407, test_f1: 0.5328
 epoch: 35, train_loss: 0.8672, test_loss: 1.0842, test_f1: 0.4891
 epoch: 36, train_loss: 0.8638, test_loss: 1.0465, test_f1: 0.5506
 epoch: 37, train_loss: 0.8633, test_loss: 1.0750, test_f1: 0.4909
 epoch: 38, train_loss: 0.8508, test_loss: 1.0934, test_f1: 0.4667
 epoch: 39, train_loss: 0.8566, test_loss: 1.0258, test_f1: 0.5557
 epoch: 40, train_loss: 0.8682, test_loss: 1.1765, test_f1: 0.4871
 epoch: 41, train_loss: 0.8528, test_loss: 1.1414, test_f1: 0.4828
 epoch: 42, train_loss: 0.8424, test_loss: 1.0420, test_f1: 0.5098
 epoch: 43, train_loss: 0.8475, test_loss: 1.0643, test_f1: 0.5077
 epoch: 44, train_loss: 0.8489, test_loss: 1.1793, test_f1: 0.4444
 epoch: 45, train_loss: 0.8345, test_loss: 1.0801, test_f1: 0.5046
 epoch: 46, train_loss: 0.8330, test_loss: 1.0969, test_f1: 0.4837
 epoch: 47, train_loss: 0.8386, test_loss: 1.1106, test_f1: 0.4929
 epoch: 48, train_loss: 0.8353, test_loss: 1.0673, test_f1: 0.5040
 epoch: 49, train_loss: 0.8311, test_loss: 1.1508, test_f1: 0.4863
 epoch: 50, train_loss: 0.8241, test_loss: 1.0982, test_f1: 0.4850
 epoch: 51, train_loss: 0.8078, test_loss: 1.0962, test_f1: 0.4917
 epoch: 52, train_loss: 0.8025, test_loss: 1.0786, test_f1: 0.5015
 epoch: 53, train_loss: 0.7856, test_loss: 1.1160, test_f1: 0.4838
 epoch: 54, train_loss: 0.7983, test_loss: 1.1067, test_f1: 0.5000
 epoch: 55, train_loss: 0.7823, test_loss: 1.1191, test_f1: 0.4941
 epoch: 56, train_loss: 0.7935, test_loss: 1.1056, test_f1: 0.4991
 epoch: 57, train_loss: 0.7779, test_loss: 1.0775, test_f1: 0.5032
 epoch: 58, train_loss: 0.7866, test_loss: 1.0704, test_f1: 0.5181
 epoch: 59, train_loss: 0.7758, test_loss: 1.0494, test_f1: 0.5338
 epoch: 60, train_loss: 0.7815, test_loss: 1.0688, test_f1: 0.4964
 epoch: 61, train_loss: 0.7747, test_loss: 1.0850, test_f1: 0.5186
 epoch: 62, train_loss: 0.7830, test_loss: 1.0862, test_f1: 0.5068
 epoch: 63, train_loss: 0.7806, test_loss: 1.1113, test_f1: 0.4919
 epoch: 64, train_loss: 0.7766, test_loss: 1.0373, test_f1: 0.5334
 epoch: 65, train_loss: 0.7725, test_loss: 1.0559, test_f1: 0.5181
 epoch: 66, train_loss: 0.7718, test_loss: 1.0682, test_f1: 0.5309
 epoch: 67, train_loss: 0.7674, test_loss: 1.0900, test_f1: 0.5025
 epoch: 68, train_loss: 0.7798, test_loss: 1.1171, test_f1: 0.5028
 epoch: 69, train_loss: 0.7699, test_loss: 1.1121, test_f1: 0.5027
 epoch: 70, train_loss: 0.7825, test_loss: 1.1055, test_f1: 0.5325
 epoch: 71, train_loss: 0.7637, test_loss: 1.0930, test_f1: 0.5157
 epoch: 72, train_loss: 0.7610, test_loss: 1.0849, test_f1: 0.5096
 epoch: 73, train_loss: 0.7478, test_loss: 1.0733, test_f1: 0.5099
 epoch: 74, train_loss: 0.7705, test_loss: 1.0725, test_f1: 0.5420
 epoch: 75, train_loss: 0.7596, test_loss: 1.0702, test_f1: 0.5001
 epoch: 76, train_loss: 0.7717, test_loss: 1.0998, test_f1: 0.5063
 epoch: 77, train_loss: 0.7499, test_loss: 1.0472, test_f1: 0.5631
 epoch: 78, train_loss: 0.7632, test_loss: 1.0585, test_f1: 0.5206
 epoch: 79, train_loss: 0.7549, test_loss: 1.0756, test_f1: 0.5043
 epoch: 80, train_loss: 0.7455, test_loss: 1.0845, test_f1: 0.5200
 epoch: 81, train_loss: 0.7569, test_loss: 1.0991, test_f1: 0.5448
 epoch: 82, train_loss: 0.7529, test_loss: 1.0735, test_f1: 0.5384
 epoch: 83, train_loss: 0.7485, test_loss: 1.0548, test_f1: 0.5912
 epoch: 84, train_loss: 0.7547, test_loss: 1.0898, test_f1: 0.5320
 epoch: 85, train_loss: 0.7422, test_loss: 1.0730, test_f1: 0.5167
 epoch: 86, train_loss: 0.7357, test_loss: 1.0736, test_f1: 0.5446
 epoch: 87, train_loss: 0.7527, test_loss: 1.0454, test_f1: 0.5325
 epoch: 88, train_loss: 0.7357, test_loss: 1.0871, test_f1: 0.5239
 epoch: 89, train_loss: 0.7408, test_loss: 1.0858, test_f1: 0.5024
 epoch: 90, train_loss: 0.7417, test_loss: 1.1133, test_f1: 0.5263
 epoch: 91, train_loss: 0.7471, test_loss: 1.0883, test_f1: 0.5560
 epoch: 92, train_loss: 0.7364, test_loss: 1.0083, test_f1: 0.5358
 epoch: 93, train_loss: 0.7372, test_loss: 0.9823, test_f1: 0.5403
 epoch: 94, train_loss: 0.7289, test_loss: 1.0062, test_f1: 0.5791
 epoch: 95, train_loss: 0.7580, test_loss: 1.0691, test_f1: 0.5553
 epoch: 96, train_loss: 0.7351, test_loss: 1.0468, test_f1: 0.5445
 epoch: 97, train_loss: 0.7353, test_loss: 1.0872, test_f1: 0.5411
 epoch: 98, train_loss: 0.7241, test_loss: 1.1528, test_f1: 0.4895
 epoch: 99, train_loss: 0.7262, test_loss: 1.0527, test_f1: 0.5833
##################ITERATION #4 ****************************************
 epoch: 0, train_loss: 1.4833, test_loss: 1.4209, test_f1: 0.2270
 epoch: 1, train_loss: 1.2215, test_loss: 1.2443, test_f1: 0.2270
 epoch: 2, train_loss: 1.1757, test_loss: 1.1959, test_f1: 0.3473
 epoch: 3, train_loss: 1.1440, test_loss: 1.1570, test_f1: 0.3669
 epoch: 4, train_loss: 1.1145, test_loss: 1.0775, test_f1: 0.4350
 epoch: 5, train_loss: 1.0900, test_loss: 1.0409, test_f1: 0.4335
 epoch: 6, train_loss: 1.0629, test_loss: 1.0330, test_f1: 0.4120
 epoch: 7, train_loss: 1.0227, test_loss: 1.0134, test_f1: 0.4442
 epoch: 8, train_loss: 0.9993, test_loss: 1.0130, test_f1: 0.4365
 epoch: 9, train_loss: 0.9836, test_loss: 0.9919, test_f1: 0.4638
 epoch: 10, train_loss: 0.9770, test_loss: 1.0188, test_f1: 0.4152
 epoch: 11, train_loss: 0.9603, test_loss: 1.1060, test_f1: 0.4161
 epoch: 12, train_loss: 0.9696, test_loss: 0.9571, test_f1: 0.5188
 epoch: 13, train_loss: 0.9483, test_loss: 1.0585, test_f1: 0.4712
 epoch: 14, train_loss: 0.9480, test_loss: 0.9237, test_f1: 0.4703
 epoch: 15, train_loss: 0.9364, test_loss: 1.0349, test_f1: 0.4772
 epoch: 16, train_loss: 0.9344, test_loss: 0.9168, test_f1: 0.5096
 epoch: 17, train_loss: 0.9210, test_loss: 1.0041, test_f1: 0.4815
 epoch: 18, train_loss: 0.9174, test_loss: 0.9811, test_f1: 0.5085
 epoch: 19, train_loss: 0.9267, test_loss: 0.9689, test_f1: 0.4748
 epoch: 20, train_loss: 0.9195, test_loss: 0.9435, test_f1: 0.5148
 epoch: 21, train_loss: 0.9089, test_loss: 1.0546, test_f1: 0.4687
 epoch: 22, train_loss: 0.9045, test_loss: 1.0471, test_f1: 0.4905
 epoch: 23, train_loss: 0.9001, test_loss: 0.9340, test_f1: 0.5119
 epoch: 24, train_loss: 0.8843, test_loss: 1.0002, test_f1: 0.4679
 epoch: 25, train_loss: 0.8841, test_loss: 0.9177, test_f1: 0.5386
 epoch: 26, train_loss: 0.8810, test_loss: 0.9888, test_f1: 0.4739
 epoch: 27, train_loss: 0.8795, test_loss: 1.0577, test_f1: 0.4580
 epoch: 28, train_loss: 0.8776, test_loss: 1.0117, test_f1: 0.5276
 epoch: 29, train_loss: 0.9076, test_loss: 1.1754, test_f1: 0.4428
 epoch: 30, train_loss: 0.8766, test_loss: 0.9768, test_f1: 0.4809
 epoch: 31, train_loss: 0.8674, test_loss: 0.9973, test_f1: 0.5070
 epoch: 32, train_loss: 0.8632, test_loss: 0.9962, test_f1: 0.4898
 epoch: 33, train_loss: 0.8625, test_loss: 1.0362, test_f1: 0.4630
 epoch: 34, train_loss: 0.8629, test_loss: 1.0483, test_f1: 0.4507
 epoch: 35, train_loss: 0.8624, test_loss: 1.0096, test_f1: 0.5149
 epoch: 36, train_loss: 0.8528, test_loss: 0.9673, test_f1: 0.5359
 epoch: 37, train_loss: 0.8534, test_loss: 0.9598, test_f1: 0.5140
 epoch: 38, train_loss: 0.8535, test_loss: 1.0639, test_f1: 0.4786
 epoch: 39, train_loss: 0.8598, test_loss: 0.9403, test_f1: 0.5040
 epoch: 40, train_loss: 0.8523, test_loss: 0.9398, test_f1: 0.5589
 epoch: 41, train_loss: 0.8345, test_loss: 0.9747, test_f1: 0.5013
 epoch: 42, train_loss: 0.8321, test_loss: 1.0121, test_f1: 0.5011
 epoch: 43, train_loss: 0.8155, test_loss: 1.0151, test_f1: 0.4864
 epoch: 44, train_loss: 0.8253, test_loss: 0.9318, test_f1: 0.5316
 epoch: 45, train_loss: 0.8281, test_loss: 0.9414, test_f1: 0.5514
 epoch: 46, train_loss: 0.8154, test_loss: 0.9925, test_f1: 0.5400
 epoch: 47, train_loss: 0.8166, test_loss: 0.9052, test_f1: 0.5585
 epoch: 48, train_loss: 0.8238, test_loss: 0.9353, test_f1: 0.5453
 epoch: 49, train_loss: 0.8105, test_loss: 0.9599, test_f1: 0.5015
 epoch: 50, train_loss: 0.8143, test_loss: 0.9489, test_f1: 0.5485
 epoch: 51, train_loss: 0.8031, test_loss: 0.9355, test_f1: 0.5387
 epoch: 52, train_loss: 0.7909, test_loss: 0.9572, test_f1: 0.5088
 epoch: 53, train_loss: 0.7841, test_loss: 0.9273, test_f1: 0.5662
 epoch: 54, train_loss: 0.7714, test_loss: 0.8844, test_f1: 0.5627
 epoch: 55, train_loss: 0.7733, test_loss: 0.8946, test_f1: 0.5726
 epoch: 56, train_loss: 0.7797, test_loss: 0.9283, test_f1: 0.5604
 epoch: 57, train_loss: 0.7803, test_loss: 0.9317, test_f1: 0.5600
 epoch: 58, train_loss: 0.7694, test_loss: 0.9147, test_f1: 0.5588
 epoch: 59, train_loss: 0.7678, test_loss: 0.9115, test_f1: 0.5897
 epoch: 60, train_loss: 0.7652, test_loss: 0.9526, test_f1: 0.5595
 epoch: 61, train_loss: 0.7584, test_loss: 0.9539, test_f1: 0.5785
 epoch: 62, train_loss: 0.7556, test_loss: 0.9379, test_f1: 0.5227
 epoch: 63, train_loss: 0.7663, test_loss: 0.8967, test_f1: 0.5584
 epoch: 64, train_loss: 0.7571, test_loss: 0.9162, test_f1: 0.5647
 epoch: 65, train_loss: 0.7538, test_loss: 0.9193, test_f1: 0.5604
 epoch: 66, train_loss: 0.7687, test_loss: 0.9481, test_f1: 0.5607
 epoch: 67, train_loss: 0.7625, test_loss: 0.9221, test_f1: 0.5490
 epoch: 68, train_loss: 0.7572, test_loss: 0.9093, test_f1: 0.5635
 epoch: 69, train_loss: 0.7575, test_loss: 0.9085, test_f1: 0.5716
 epoch: 70, train_loss: 0.7506, test_loss: 0.9430, test_f1: 0.5349
 epoch: 71, train_loss: 0.7578, test_loss: 0.9473, test_f1: 0.5623
 epoch: 72, train_loss: 0.7449, test_loss: 0.9773, test_f1: 0.5653
 epoch: 73, train_loss: 0.7526, test_loss: 0.9218, test_f1: 0.5831
 epoch: 74, train_loss: 0.7465, test_loss: 0.8337, test_f1: 0.5760
 epoch: 75, train_loss: 0.7492, test_loss: 0.9437, test_f1: 0.5414
 epoch: 76, train_loss: 0.7575, test_loss: 0.8838, test_f1: 0.5510
 epoch: 77, train_loss: 0.7480, test_loss: 0.9150, test_f1: 0.5732
 epoch: 78, train_loss: 0.7544, test_loss: 0.9256, test_f1: 0.5455
 epoch: 79, train_loss: 0.7603, test_loss: 0.9329, test_f1: 0.5598
 epoch: 80, train_loss: 0.7507, test_loss: 0.9446, test_f1: 0.5534
 epoch: 81, train_loss: 0.7504, test_loss: 0.9341, test_f1: 0.5690
 epoch: 82, train_loss: 0.7446, test_loss: 0.9175, test_f1: 0.5695
 epoch: 83, train_loss: 0.7431, test_loss: 0.9188, test_f1: 0.5840
 epoch: 84, train_loss: 0.7290, test_loss: 0.9328, test_f1: 0.5697
 epoch: 85, train_loss: 0.7455, test_loss: 0.9390, test_f1: 0.5628
 epoch: 86, train_loss: 0.7462, test_loss: 0.9138, test_f1: 0.5845
 epoch: 87, train_loss: 0.7343, test_loss: 0.9574, test_f1: 0.5324
 epoch: 88, train_loss: 0.7312, test_loss: 0.9347, test_f1: 0.5845
 epoch: 89, train_loss: 0.7301, test_loss: 0.9625, test_f1: 0.5556
 epoch: 90, train_loss: 0.7345, test_loss: 0.9303, test_f1: 0.5918
 epoch: 91, train_loss: 0.7349, test_loss: 0.9484, test_f1: 0.5790
 epoch: 92, train_loss: 0.7210, test_loss: 0.9224, test_f1: 0.5626
 epoch: 93, train_loss: 0.7241, test_loss: 0.9060, test_f1: 0.5377
 epoch: 94, train_loss: 0.7251, test_loss: 0.9292, test_f1: 0.5773
 epoch: 95, train_loss: 0.7227, test_loss: 1.0434, test_f1: 0.5712
 epoch: 96, train_loss: 0.7107, test_loss: 0.9511, test_f1: 0.5600
 epoch: 97, train_loss: 0.7256, test_loss: 0.9459, test_f1: 0.5641
 epoch: 98, train_loss: 0.7372, test_loss: 0.9135, test_f1: 0.5697
 epoch: 99, train_loss: 0.7259, test_loss: 0.9574, test_f1: 0.5639
##################ITERATION #5 ****************************************
 epoch: 0, train_loss: 1.2944, test_loss: 1.3113, test_f1: 0.2270
 epoch: 1, train_loss: 1.1578, test_loss: 1.2429, test_f1: 0.3886
 epoch: 2, train_loss: 1.1024, test_loss: 1.5887, test_f1: 0.2341
 epoch: 3, train_loss: 1.0614, test_loss: 1.4633, test_f1: 0.3331
 epoch: 4, train_loss: 1.0253, test_loss: 1.0979, test_f1: 0.4787
 epoch: 5, train_loss: 1.0118, test_loss: 1.0874, test_f1: 0.4074
 epoch: 6, train_loss: 0.9947, test_loss: 1.0839, test_f1: 0.4359
 epoch: 7, train_loss: 0.9743, test_loss: 1.1281, test_f1: 0.4592
 epoch: 8, train_loss: 0.9748, test_loss: 1.1633, test_f1: 0.4127
 epoch: 9, train_loss: 0.9590, test_loss: 1.0479, test_f1: 0.4702
 epoch: 10, train_loss: 0.9537, test_loss: 1.1074, test_f1: 0.4433
 epoch: 11, train_loss: 0.9390, test_loss: 0.9320, test_f1: 0.5113
 epoch: 12, train_loss: 0.9363, test_loss: 0.9214, test_f1: 0.4588
 epoch: 13, train_loss: 0.9371, test_loss: 1.0392, test_f1: 0.4871
 epoch: 14, train_loss: 0.9245, test_loss: 0.8860, test_f1: 0.5014
 epoch: 15, train_loss: 0.9272, test_loss: 0.9163, test_f1: 0.4899
 epoch: 16, train_loss: 0.9102, test_loss: 0.9800, test_f1: 0.5062
 epoch: 17, train_loss: 0.9033, test_loss: 1.2743, test_f1: 0.4272
 epoch: 18, train_loss: 0.9090, test_loss: 1.3030, test_f1: 0.4247
 epoch: 19, train_loss: 0.8996, test_loss: 0.8728, test_f1: 0.5038
 epoch: 20, train_loss: 0.8897, test_loss: 1.0657, test_f1: 0.4778
 epoch: 21, train_loss: 0.8880, test_loss: 1.0330, test_f1: 0.5190
 epoch: 22, train_loss: 0.8763, test_loss: 1.0311, test_f1: 0.4843
 epoch: 23, train_loss: 0.8784, test_loss: 1.2113, test_f1: 0.4760
 epoch: 24, train_loss: 0.8773, test_loss: 0.9600, test_f1: 0.4829
 epoch: 25, train_loss: 0.8730, test_loss: 1.0477, test_f1: 0.4826
 epoch: 26, train_loss: 0.8588, test_loss: 1.0636, test_f1: 0.4838
 epoch: 27, train_loss: 0.8604, test_loss: 1.0300, test_f1: 0.5117
 epoch: 28, train_loss: 0.8569, test_loss: 1.0807, test_f1: 0.4750
 epoch: 29, train_loss: 0.8663, test_loss: 1.0600, test_f1: 0.4970
 epoch: 30, train_loss: 0.8701, test_loss: 1.1457, test_f1: 0.4691
 epoch: 31, train_loss: 0.8613, test_loss: 1.0061, test_f1: 0.4959
 epoch: 32, train_loss: 0.8570, test_loss: 1.0052, test_f1: 0.5264
 epoch: 33, train_loss: 0.8625, test_loss: 1.2168, test_f1: 0.4838
 epoch: 34, train_loss: 0.8464, test_loss: 1.0626, test_f1: 0.5021
 epoch: 35, train_loss: 0.8393, test_loss: 0.9322, test_f1: 0.5200
 epoch: 36, train_loss: 0.8474, test_loss: 1.0185, test_f1: 0.4874
 epoch: 37, train_loss: 0.8647, test_loss: 1.0732, test_f1: 0.4660
 epoch: 38, train_loss: 0.8469, test_loss: 1.0288, test_f1: 0.5025
 epoch: 39, train_loss: 0.8420, test_loss: 1.0384, test_f1: 0.5025
 epoch: 40, train_loss: 0.8394, test_loss: 1.0142, test_f1: 0.4703
 epoch: 41, train_loss: 0.8437, test_loss: 1.0314, test_f1: 0.4990
 epoch: 42, train_loss: 0.8481, test_loss: 1.3585, test_f1: 0.4332
 epoch: 43, train_loss: 0.8378, test_loss: 1.2201, test_f1: 0.4798
 epoch: 44, train_loss: 0.8246, test_loss: 1.0220, test_f1: 0.5055
 epoch: 45, train_loss: 0.8201, test_loss: 1.0802, test_f1: 0.4853
 epoch: 46, train_loss: 0.8237, test_loss: 1.0335, test_f1: 0.5197
 epoch: 47, train_loss: 0.8339, test_loss: 1.3508, test_f1: 0.4686
 epoch: 48, train_loss: 0.8224, test_loss: 0.9947, test_f1: 0.5102
 epoch: 49, train_loss: 0.8270, test_loss: 1.0192, test_f1: 0.4788
 epoch: 50, train_loss: 0.8400, test_loss: 1.0271, test_f1: 0.5276
 epoch: 51, train_loss: 0.8078, test_loss: 1.1741, test_f1: 0.4949
 epoch: 52, train_loss: 0.7927, test_loss: 1.0161, test_f1: 0.5264
 epoch: 53, train_loss: 0.8008, test_loss: 1.1012, test_f1: 0.4885
 epoch: 54, train_loss: 0.7964, test_loss: 1.0773, test_f1: 0.5174
 epoch: 55, train_loss: 0.7880, test_loss: 1.1471, test_f1: 0.5175
 epoch: 56, train_loss: 0.7821, test_loss: 1.0823, test_f1: 0.4997
 epoch: 57, train_loss: 0.7734, test_loss: 1.0251, test_f1: 0.5485
 epoch: 58, train_loss: 0.7936, test_loss: 1.0076, test_f1: 0.5264
 epoch: 59, train_loss: 0.7895, test_loss: 1.0538, test_f1: 0.4927
 epoch: 60, train_loss: 0.7841, test_loss: 1.0320, test_f1: 0.5547
 epoch: 61, train_loss: 0.7784, test_loss: 1.0256, test_f1: 0.5187
 epoch: 62, train_loss: 0.7733, test_loss: 1.1852, test_f1: 0.5117
 epoch: 63, train_loss: 0.7915, test_loss: 1.0188, test_f1: 0.5346
 epoch: 64, train_loss: 0.7710, test_loss: 1.0430, test_f1: 0.5340
 epoch: 65, train_loss: 0.7674, test_loss: 1.0452, test_f1: 0.5510
 epoch: 66, train_loss: 0.7786, test_loss: 1.0188, test_f1: 0.5259
 epoch: 67, train_loss: 0.7706, test_loss: 1.0450, test_f1: 0.5054
 epoch: 68, train_loss: 0.7662, test_loss: 1.0553, test_f1: 0.5478
 epoch: 69, train_loss: 0.7650, test_loss: 0.9709, test_f1: 0.5458
 epoch: 70, train_loss: 0.7591, test_loss: 1.0090, test_f1: 0.5258
 epoch: 71, train_loss: 0.7477, test_loss: 1.0350, test_f1: 0.5565
 epoch: 72, train_loss: 0.7510, test_loss: 1.0714, test_f1: 0.5302
 epoch: 73, train_loss: 0.7466, test_loss: 0.9123, test_f1: 0.5487
 epoch: 74, train_loss: 0.7407, test_loss: 1.0318, test_f1: 0.5387
 epoch: 75, train_loss: 0.7508, test_loss: 0.9922, test_f1: 0.5563
 epoch: 76, train_loss: 0.7654, test_loss: 0.9976, test_f1: 0.5745
 epoch: 77, train_loss: 0.7563, test_loss: 1.0272, test_f1: 0.5366
 epoch: 78, train_loss: 0.7414, test_loss: 1.1617, test_f1: 0.5433
 epoch: 79, train_loss: 0.7376, test_loss: 0.9585, test_f1: 0.5617
 epoch: 80, train_loss: 0.7533, test_loss: 1.0252, test_f1: 0.5391
 epoch: 81, train_loss: 0.7551, test_loss: 1.0307, test_f1: 0.5492
 epoch: 82, train_loss: 0.7503, test_loss: 1.0150, test_f1: 0.5303
 epoch: 83, train_loss: 0.7489, test_loss: 1.0856, test_f1: 0.5462
 epoch: 84, train_loss: 0.7667, test_loss: 1.1381, test_f1: 0.5436
 epoch: 85, train_loss: 0.7368, test_loss: 1.0157, test_f1: 0.5553
 epoch: 86, train_loss: 0.7341, test_loss: 1.0996, test_f1: 0.5299
 epoch: 87, train_loss: 0.7473, test_loss: 0.9787, test_f1: 0.5759
 epoch: 88, train_loss: 0.7375, test_loss: 1.1033, test_f1: 0.5468
 epoch: 89, train_loss: 0.7215, test_loss: 1.0378, test_f1: 0.5538
 epoch: 90, train_loss: 0.7340, test_loss: 1.0073, test_f1: 0.5864
 epoch: 91, train_loss: 0.7363, test_loss: 1.0236, test_f1: 0.5284
 epoch: 92, train_loss: 0.7312, test_loss: 1.0723, test_f1: 0.5515
 epoch: 93, train_loss: 0.7186, test_loss: 1.0761, test_f1: 0.5659
 epoch: 94, train_loss: 0.7170, test_loss: 1.1553, test_f1: 0.5394
 epoch: 95, train_loss: 0.7241, test_loss: 1.0771, test_f1: 0.5553
 epoch: 96, train_loss: 0.7200, test_loss: 1.1098, test_f1: 0.5722
 epoch: 97, train_loss: 0.7277, test_loss: 1.1846, test_f1: 0.5078
 epoch: 98, train_loss: 0.7256, test_loss: 1.0153, test_f1: 0.5836
 epoch: 99, train_loss: 0.7340, test_loss: 0.9889, test_f1: 0.5712
##################ITERATION #6 ****************************************
 epoch: 0, train_loss: 1.6093, test_loss: 1.3132, test_f1: 0.2270
 epoch: 1, train_loss: 1.2565, test_loss: 1.2462, test_f1: 0.2320
 epoch: 2, train_loss: 1.1984, test_loss: 1.1593, test_f1: 0.3164
 epoch: 3, train_loss: 1.1602, test_loss: 1.1212, test_f1: 0.3530
 epoch: 4, train_loss: 1.1091, test_loss: 1.0618, test_f1: 0.4192
 epoch: 5, train_loss: 1.0732, test_loss: 1.0791, test_f1: 0.4106
 epoch: 6, train_loss: 1.0282, test_loss: 0.9837, test_f1: 0.4420
 epoch: 7, train_loss: 1.0168, test_loss: 1.0516, test_f1: 0.4413
 epoch: 8, train_loss: 0.9924, test_loss: 1.0096, test_f1: 0.4234
 epoch: 9, train_loss: 0.9823, test_loss: 0.9887, test_f1: 0.4468
 epoch: 10, train_loss: 0.9619, test_loss: 0.9286, test_f1: 0.4991
 epoch: 11, train_loss: 0.9590, test_loss: 1.0061, test_f1: 0.5266
 epoch: 12, train_loss: 0.9589, test_loss: 0.9605, test_f1: 0.4545
 epoch: 13, train_loss: 0.9500, test_loss: 0.9694, test_f1: 0.4749
 epoch: 14, train_loss: 0.9397, test_loss: 1.0559, test_f1: 0.4212
 epoch: 15, train_loss: 0.9691, test_loss: 1.0734, test_f1: 0.4375
 epoch: 16, train_loss: 0.9433, test_loss: 1.0150, test_f1: 0.4713
 epoch: 17, train_loss: 0.9317, test_loss: 0.9726, test_f1: 0.4803
 epoch: 18, train_loss: 0.9217, test_loss: 1.0296, test_f1: 0.4703
 epoch: 19, train_loss: 0.9215, test_loss: 0.9774, test_f1: 0.4919
 epoch: 20, train_loss: 0.9096, test_loss: 0.9884, test_f1: 0.5094
 epoch: 21, train_loss: 0.9175, test_loss: 0.9752, test_f1: 0.4990
 epoch: 22, train_loss: 0.9021, test_loss: 0.9860, test_f1: 0.4921
 epoch: 23, train_loss: 0.8959, test_loss: 0.9945, test_f1: 0.4908
 epoch: 24, train_loss: 0.8862, test_loss: 0.9987, test_f1: 0.5245
 epoch: 25, train_loss: 0.8965, test_loss: 0.9679, test_f1: 0.5516
 epoch: 26, train_loss: 0.8855, test_loss: 1.0014, test_f1: 0.4733
 epoch: 27, train_loss: 0.8984, test_loss: 1.0669, test_f1: 0.4911
 epoch: 28, train_loss: 0.8930, test_loss: 1.0142, test_f1: 0.5037
 epoch: 29, train_loss: 0.8949, test_loss: 0.9705, test_f1: 0.5128
 epoch: 30, train_loss: 0.8950, test_loss: 1.0034, test_f1: 0.5159
 epoch: 31, train_loss: 0.8950, test_loss: 1.0213, test_f1: 0.4936
 epoch: 32, train_loss: 0.8883, test_loss: 0.9870, test_f1: 0.5314
 epoch: 33, train_loss: 0.8802, test_loss: 0.9632, test_f1: 0.5128
 epoch: 34, train_loss: 0.8818, test_loss: 0.9597, test_f1: 0.5372
 epoch: 35, train_loss: 0.8753, test_loss: 0.9945, test_f1: 0.5277
 epoch: 36, train_loss: 0.8736, test_loss: 0.9457, test_f1: 0.5255
 epoch: 37, train_loss: 0.8705, test_loss: 1.2410, test_f1: 0.4834
 epoch: 38, train_loss: 0.8597, test_loss: 0.9362, test_f1: 0.4942
 epoch: 39, train_loss: 0.8659, test_loss: 1.0191, test_f1: 0.5430
 epoch: 40, train_loss: 0.8577, test_loss: 0.9898, test_f1: 0.5656
 epoch: 41, train_loss: 0.8542, test_loss: 1.0057, test_f1: 0.5262
 epoch: 42, train_loss: 0.8423, test_loss: 0.9710, test_f1: 0.5607
 epoch: 43, train_loss: 0.8482, test_loss: 0.9155, test_f1: 0.5238
 epoch: 44, train_loss: 0.8558, test_loss: 0.9567, test_f1: 0.5696
 epoch: 45, train_loss: 0.8469, test_loss: 0.9703, test_f1: 0.5243
 epoch: 46, train_loss: 0.8369, test_loss: 1.1172, test_f1: 0.5414
 epoch: 47, train_loss: 0.8325, test_loss: 0.9458, test_f1: 0.5496
 epoch: 48, train_loss: 0.8401, test_loss: 1.0142, test_f1: 0.4995
 epoch: 49, train_loss: 0.8438, test_loss: 0.9441, test_f1: 0.5842
 epoch: 50, train_loss: 0.8269, test_loss: 0.9615, test_f1: 0.5456
 epoch: 51, train_loss: 0.8206, test_loss: 0.9243, test_f1: 0.5556
 epoch: 52, train_loss: 0.8200, test_loss: 0.9239, test_f1: 0.6103
 epoch: 53, train_loss: 0.8126, test_loss: 0.9312, test_f1: 0.5731
 epoch: 54, train_loss: 0.8093, test_loss: 0.9713, test_f1: 0.5790
 epoch: 55, train_loss: 0.7931, test_loss: 0.9082, test_f1: 0.6170
 epoch: 56, train_loss: 0.7930, test_loss: 0.9371, test_f1: 0.5703
 epoch: 57, train_loss: 0.7954, test_loss: 0.9497, test_f1: 0.5883
 epoch: 58, train_loss: 0.7882, test_loss: 0.9381, test_f1: 0.5705
 epoch: 59, train_loss: 0.7904, test_loss: 0.9341, test_f1: 0.5952
 epoch: 60, train_loss: 0.7928, test_loss: 0.9222, test_f1: 0.6025
 epoch: 61, train_loss: 0.7778, test_loss: 0.9032, test_f1: 0.6098
 epoch: 62, train_loss: 0.7866, test_loss: 0.9808, test_f1: 0.5870
 epoch: 63, train_loss: 0.8036, test_loss: 0.8969, test_f1: 0.5780
 epoch: 64, train_loss: 0.8046, test_loss: 0.9282, test_f1: 0.6001
 epoch: 65, train_loss: 0.7929, test_loss: 0.9500, test_f1: 0.6059
 epoch: 66, train_loss: 0.7614, test_loss: 0.9454, test_f1: 0.5777
 epoch: 67, train_loss: 0.7842, test_loss: 0.9353, test_f1: 0.5982
 epoch: 68, train_loss: 0.7911, test_loss: 0.9982, test_f1: 0.5525
 epoch: 69, train_loss: 0.7773, test_loss: 0.9191, test_f1: 0.6098
 epoch: 70, train_loss: 0.7834, test_loss: 0.9272, test_f1: 0.6105
 epoch: 71, train_loss: 0.7705, test_loss: 0.9268, test_f1: 0.5538
 epoch: 72, train_loss: 0.7575, test_loss: 0.9125, test_f1: 0.5812
 epoch: 73, train_loss: 0.7702, test_loss: 0.9163, test_f1: 0.5993
 epoch: 74, train_loss: 0.7733, test_loss: 0.9245, test_f1: 0.5742
 epoch: 75, train_loss: 0.7552, test_loss: 0.9536, test_f1: 0.5866
 epoch: 76, train_loss: 0.7672, test_loss: 0.9024, test_f1: 0.6108
 epoch: 77, train_loss: 0.7624, test_loss: 0.9570, test_f1: 0.6024
 epoch: 78, train_loss: 0.7782, test_loss: 0.9297, test_f1: 0.5696
 epoch: 79, train_loss: 0.7743, test_loss: 0.9187, test_f1: 0.5753
 epoch: 80, train_loss: 0.7799, test_loss: 0.9271, test_f1: 0.5736
 epoch: 81, train_loss: 0.7625, test_loss: 0.9482, test_f1: 0.5998
 epoch: 82, train_loss: 0.7643, test_loss: 0.8963, test_f1: 0.5731
 epoch: 83, train_loss: 0.7482, test_loss: 0.9254, test_f1: 0.5879
 epoch: 84, train_loss: 0.7397, test_loss: 0.9274, test_f1: 0.6012
 epoch: 85, train_loss: 0.7453, test_loss: 0.9259, test_f1: 0.5966
 epoch: 86, train_loss: 0.7563, test_loss: 0.9382, test_f1: 0.5813
 epoch: 87, train_loss: 0.7369, test_loss: 0.8997, test_f1: 0.5942
 epoch: 88, train_loss: 0.7437, test_loss: 0.9940, test_f1: 0.5606
 epoch: 89, train_loss: 0.7458, test_loss: 0.9098, test_f1: 0.5998
 epoch: 90, train_loss: 0.7426, test_loss: 1.0175, test_f1: 0.5751
 epoch: 91, train_loss: 0.7593, test_loss: 0.8708, test_f1: 0.6047
 epoch: 92, train_loss: 0.7277, test_loss: 0.9075, test_f1: 0.6239
 epoch: 93, train_loss: 0.7294, test_loss: 0.8860, test_f1: 0.6200
 epoch: 94, train_loss: 0.7428, test_loss: 0.9316, test_f1: 0.5820
 epoch: 95, train_loss: 0.7378, test_loss: 0.8834, test_f1: 0.5765
 epoch: 96, train_loss: 0.7361, test_loss: 0.9143, test_f1: 0.5964
 epoch: 97, train_loss: 0.7250, test_loss: 0.9410, test_f1: 0.5814
 epoch: 98, train_loss: 0.7310, test_loss: 0.8938, test_f1: 0.6277
 epoch: 99, train_loss: 0.7461, test_loss: 0.8600, test_f1: 0.5841
##################ITERATION #7 ****************************************
 epoch: 0, train_loss: 1.2810, test_loss: 1.4829, test_f1: 0.2270
 epoch: 1, train_loss: 1.1169, test_loss: 1.2668, test_f1: 0.2320
 epoch: 2, train_loss: 1.0556, test_loss: 1.0434, test_f1: 0.3583
 epoch: 3, train_loss: 1.0365, test_loss: 1.0183, test_f1: 0.3971
 epoch: 4, train_loss: 1.0069, test_loss: 1.0298, test_f1: 0.4527
 epoch: 5, train_loss: 0.9923, test_loss: 1.0169, test_f1: 0.4376
 epoch: 6, train_loss: 0.9797, test_loss: 1.0080, test_f1: 0.4777
 epoch: 7, train_loss: 0.9702, test_loss: 1.0548, test_f1: 0.4355
 epoch: 8, train_loss: 0.9773, test_loss: 1.0031, test_f1: 0.4643
 epoch: 9, train_loss: 0.9664, test_loss: 1.0315, test_f1: 0.4729
 epoch: 10, train_loss: 0.9487, test_loss: 0.9838, test_f1: 0.4844
 epoch: 11, train_loss: 0.9374, test_loss: 1.0714, test_f1: 0.4560
 epoch: 12, train_loss: 0.9429, test_loss: 1.0038, test_f1: 0.4478
 epoch: 13, train_loss: 0.9527, test_loss: 0.9766, test_f1: 0.5127
 epoch: 14, train_loss: 0.9290, test_loss: 0.9756, test_f1: 0.5018
 epoch: 15, train_loss: 0.9232, test_loss: 1.0864, test_f1: 0.4021
 epoch: 16, train_loss: 0.9474, test_loss: 1.0061, test_f1: 0.4771
 epoch: 17, train_loss: 0.9149, test_loss: 1.1619, test_f1: 0.4183
 epoch: 18, train_loss: 0.9129, test_loss: 0.9543, test_f1: 0.5153
 epoch: 19, train_loss: 0.9148, test_loss: 0.9902, test_f1: 0.4963
 epoch: 20, train_loss: 0.9124, test_loss: 0.9878, test_f1: 0.5337
 epoch: 21, train_loss: 0.9114, test_loss: 1.0017, test_f1: 0.4919
 epoch: 22, train_loss: 0.9008, test_loss: 0.9904, test_f1: 0.5332
 epoch: 23, train_loss: 0.9001, test_loss: 1.2239, test_f1: 0.4231
 epoch: 24, train_loss: 0.9032, test_loss: 0.9827, test_f1: 0.5736
 epoch: 25, train_loss: 0.8865, test_loss: 1.0596, test_f1: 0.4516
 epoch: 26, train_loss: 0.8792, test_loss: 1.0069, test_f1: 0.5333
 epoch: 27, train_loss: 0.8832, test_loss: 1.0085, test_f1: 0.5055
 epoch: 28, train_loss: 0.8949, test_loss: 0.9949, test_f1: 0.5097
 epoch: 29, train_loss: 0.8830, test_loss: 0.9981, test_f1: 0.5541
 epoch: 30, train_loss: 0.8818, test_loss: 0.9859, test_f1: 0.5256
 epoch: 31, train_loss: 0.8813, test_loss: 0.9878, test_f1: 0.5350
 epoch: 32, train_loss: 0.8717, test_loss: 0.9622, test_f1: 0.5201
 epoch: 33, train_loss: 0.8592, test_loss: 0.9989, test_f1: 0.5490
 epoch: 34, train_loss: 0.8663, test_loss: 0.8690, test_f1: 0.5121
 epoch: 35, train_loss: 0.8660, test_loss: 0.9709, test_f1: 0.5339
 epoch: 36, train_loss: 0.8614, test_loss: 0.9612, test_f1: 0.5251
 epoch: 37, train_loss: 0.8615, test_loss: 0.9892, test_f1: 0.5214
 epoch: 38, train_loss: 0.8685, test_loss: 0.9199, test_f1: 0.5390
 epoch: 39, train_loss: 0.8748, test_loss: 0.9673, test_f1: 0.5370
 epoch: 40, train_loss: 0.8545, test_loss: 0.9982, test_f1: 0.5387
 epoch: 41, train_loss: 0.8615, test_loss: 1.0890, test_f1: 0.4838
 epoch: 42, train_loss: 0.8551, test_loss: 1.1986, test_f1: 0.4495
 epoch: 43, train_loss: 0.8433, test_loss: 0.9587, test_f1: 0.5260
 epoch: 44, train_loss: 0.8469, test_loss: 1.2172, test_f1: 0.5073
 epoch: 45, train_loss: 0.8441, test_loss: 1.0144, test_f1: 0.5350
 epoch: 46, train_loss: 0.8548, test_loss: 0.9484, test_f1: 0.5439
 epoch: 47, train_loss: 0.8488, test_loss: 0.9827, test_f1: 0.5227
 epoch: 48, train_loss: 0.8469, test_loss: 1.0453, test_f1: 0.5193
 epoch: 49, train_loss: 0.8465, test_loss: 0.9587, test_f1: 0.5686
 epoch: 50, train_loss: 0.8480, test_loss: 0.9890, test_f1: 0.5526
 epoch: 51, train_loss: 0.8395, test_loss: 0.9375, test_f1: 0.5564
 epoch: 52, train_loss: 0.8176, test_loss: 0.9577, test_f1: 0.5563
 epoch: 53, train_loss: 0.8124, test_loss: 1.0363, test_f1: 0.5187
 epoch: 54, train_loss: 0.8094, test_loss: 0.9470, test_f1: 0.5699
 epoch: 55, train_loss: 0.8035, test_loss: 0.9566, test_f1: 0.5513
 epoch: 56, train_loss: 0.8092, test_loss: 0.9303, test_f1: 0.5790
 epoch: 57, train_loss: 0.8279, test_loss: 0.9553, test_f1: 0.5861
 epoch: 58, train_loss: 0.8136, test_loss: 0.9282, test_f1: 0.6060
 epoch: 59, train_loss: 0.8076, test_loss: 1.0736, test_f1: 0.5302
 epoch: 60, train_loss: 0.8119, test_loss: 0.9534, test_f1: 0.5521
 epoch: 61, train_loss: 0.8116, test_loss: 0.9399, test_f1: 0.5694
 epoch: 62, train_loss: 0.7979, test_loss: 0.9671, test_f1: 0.5636
 epoch: 63, train_loss: 0.8080, test_loss: 0.9554, test_f1: 0.5666
 epoch: 64, train_loss: 0.7934, test_loss: 0.9829, test_f1: 0.5755
 epoch: 65, train_loss: 0.7983, test_loss: 0.9374, test_f1: 0.5824
 epoch: 66, train_loss: 0.7977, test_loss: 1.0036, test_f1: 0.5600
 epoch: 67, train_loss: 0.7868, test_loss: 0.9599, test_f1: 0.5845
 epoch: 68, train_loss: 0.8017, test_loss: 0.9451, test_f1: 0.6170
 epoch: 69, train_loss: 0.7931, test_loss: 0.9632, test_f1: 0.5797
 epoch: 70, train_loss: 0.7841, test_loss: 0.9543, test_f1: 0.5943
 epoch: 71, train_loss: 0.7800, test_loss: 1.0027, test_f1: 0.5481
 epoch: 72, train_loss: 0.7827, test_loss: 0.9673, test_f1: 0.5943
 epoch: 73, train_loss: 0.7720, test_loss: 0.9475, test_f1: 0.6066
 epoch: 74, train_loss: 0.7878, test_loss: 0.9631, test_f1: 0.5890
 epoch: 75, train_loss: 0.7702, test_loss: 0.9560, test_f1: 0.5556
 epoch: 76, train_loss: 0.7874, test_loss: 1.0036, test_f1: 0.5626
 epoch: 77, train_loss: 0.7942, test_loss: 0.9521, test_f1: 0.6033
 epoch: 78, train_loss: 0.7845, test_loss: 0.9654, test_f1: 0.5800
 epoch: 79, train_loss: 0.7822, test_loss: 0.9535, test_f1: 0.5832
 epoch: 80, train_loss: 0.7632, test_loss: 1.0428, test_f1: 0.5412
 epoch: 81, train_loss: 0.7667, test_loss: 0.9683, test_f1: 0.5868
 epoch: 82, train_loss: 0.7791, test_loss: 0.9420, test_f1: 0.6092
 epoch: 83, train_loss: 0.7790, test_loss: 0.9550, test_f1: 0.6081
 epoch: 84, train_loss: 0.7723, test_loss: 1.0086, test_f1: 0.5635
 epoch: 85, train_loss: 0.7700, test_loss: 0.9797, test_f1: 0.5861
 epoch: 86, train_loss: 0.7770, test_loss: 0.9748, test_f1: 0.5829
 epoch: 87, train_loss: 0.7589, test_loss: 0.9470, test_f1: 0.5918
 epoch: 88, train_loss: 0.7668, test_loss: 0.9367, test_f1: 0.6275
 epoch: 89, train_loss: 0.7668, test_loss: 0.9601, test_f1: 0.6114
 epoch: 90, train_loss: 0.7665, test_loss: 0.9933, test_f1: 0.5845
 epoch: 91, train_loss: 0.7559, test_loss: 0.9465, test_f1: 0.6164
 epoch: 92, train_loss: 0.7577, test_loss: 0.9312, test_f1: 0.6231
 epoch: 93, train_loss: 0.7596, test_loss: 0.9790, test_f1: 0.5778
 epoch: 94, train_loss: 0.7602, test_loss: 0.9789, test_f1: 0.5972
 epoch: 95, train_loss: 0.7426, test_loss: 0.9180, test_f1: 0.6276
 epoch: 96, train_loss: 0.7572, test_loss: 0.9592, test_f1: 0.6047
 epoch: 97, train_loss: 0.7531, test_loss: 0.9442, test_f1: 0.5947
 epoch: 98, train_loss: 0.7548, test_loss: 0.9316, test_f1: 0.6227
 epoch: 99, train_loss: 0.7477, test_loss: 0.9310, test_f1: 0.6388
##################ITERATION #8 ****************************************
 epoch: 0, train_loss: 1.3159, test_loss: 1.4837, test_f1: 0.2270
 epoch: 1, train_loss: 1.1111, test_loss: 1.1366, test_f1: 0.3347
 epoch: 2, train_loss: 1.0795, test_loss: 1.0533, test_f1: 0.3451
 epoch: 3, train_loss: 1.0494, test_loss: 1.1076, test_f1: 0.3594
 epoch: 4, train_loss: 1.0427, test_loss: 1.0153, test_f1: 0.3587
 epoch: 5, train_loss: 1.0301, test_loss: 1.0918, test_f1: 0.3827
 epoch: 6, train_loss: 1.0133, test_loss: 1.0943, test_f1: 0.4411
 epoch: 7, train_loss: 1.0048, test_loss: 1.0221, test_f1: 0.4542
 epoch: 8, train_loss: 0.9921, test_loss: 0.9707, test_f1: 0.4817
 epoch: 9, train_loss: 0.9799, test_loss: 1.0211, test_f1: 0.4797
 epoch: 10, train_loss: 0.9812, test_loss: 1.1594, test_f1: 0.4391
 epoch: 11, train_loss: 0.9950, test_loss: 1.0258, test_f1: 0.5191
 epoch: 12, train_loss: 0.9903, test_loss: 0.9783, test_f1: 0.4494
 epoch: 13, train_loss: 0.9644, test_loss: 0.9394, test_f1: 0.5205
 epoch: 14, train_loss: 0.9569, test_loss: 0.9466, test_f1: 0.4710
 epoch: 15, train_loss: 0.9558, test_loss: 0.9330, test_f1: 0.5126
 epoch: 16, train_loss: 0.9383, test_loss: 1.0029, test_f1: 0.4840
 epoch: 17, train_loss: 0.9600, test_loss: 1.1263, test_f1: 0.4525
 epoch: 18, train_loss: 0.9349, test_loss: 0.9949, test_f1: 0.5275
 epoch: 19, train_loss: 0.9374, test_loss: 0.9372, test_f1: 0.5057
 epoch: 20, train_loss: 0.9196, test_loss: 0.9241, test_f1: 0.5156
 epoch: 21, train_loss: 0.9244, test_loss: 0.9207, test_f1: 0.5192
 epoch: 22, train_loss: 0.9200, test_loss: 0.9929, test_f1: 0.4788
 epoch: 23, train_loss: 0.9106, test_loss: 0.9411, test_f1: 0.5140
 epoch: 24, train_loss: 0.9061, test_loss: 0.9942, test_f1: 0.4908
 epoch: 25, train_loss: 0.9189, test_loss: 0.9892, test_f1: 0.5262
 epoch: 26, train_loss: 0.9104, test_loss: 0.9772, test_f1: 0.4753
 epoch: 27, train_loss: 0.9002, test_loss: 0.9022, test_f1: 0.5334
 epoch: 28, train_loss: 0.9187, test_loss: 1.0342, test_f1: 0.4800
 epoch: 29, train_loss: 0.9019, test_loss: 0.9026, test_f1: 0.5270
 epoch: 30, train_loss: 0.8798, test_loss: 0.8801, test_f1: 0.5362
 epoch: 31, train_loss: 0.8785, test_loss: 0.9578, test_f1: 0.5021
 epoch: 32, train_loss: 0.9250, test_loss: 0.9724, test_f1: 0.5000
 epoch: 33, train_loss: 0.9229, test_loss: 0.9433, test_f1: 0.5230
 epoch: 34, train_loss: 0.9122, test_loss: 1.0433, test_f1: 0.4541
 epoch: 35, train_loss: 0.8816, test_loss: 0.9879, test_f1: 0.5124
 epoch: 36, train_loss: 0.8731, test_loss: 0.9258, test_f1: 0.5091
 epoch: 37, train_loss: 0.8581, test_loss: 0.8919, test_f1: 0.5371
 epoch: 38, train_loss: 0.8672, test_loss: 0.8866, test_f1: 0.5274
 epoch: 39, train_loss: 0.8782, test_loss: 1.4349, test_f1: 0.4314
 epoch: 40, train_loss: 0.8901, test_loss: 0.9169, test_f1: 0.5160
 epoch: 41, train_loss: 0.8681, test_loss: 0.9230, test_f1: 0.5067
 epoch: 42, train_loss: 0.8619, test_loss: 0.9838, test_f1: 0.5332
 epoch: 43, train_loss: 0.8504, test_loss: 0.9052, test_f1: 0.5262
 epoch: 44, train_loss: 0.8548, test_loss: 0.8873, test_f1: 0.5551
 epoch: 45, train_loss: 0.8569, test_loss: 0.8883, test_f1: 0.5162
 epoch: 46, train_loss: 0.8541, test_loss: 0.9362, test_f1: 0.5185
 epoch: 47, train_loss: 0.8563, test_loss: 0.8991, test_f1: 0.4995
 epoch: 48, train_loss: 0.8531, test_loss: 0.9646, test_f1: 0.5129
 epoch: 49, train_loss: 0.8244, test_loss: 0.9011, test_f1: 0.5365
 epoch: 50, train_loss: 0.8257, test_loss: 0.9038, test_f1: 0.5008
 epoch: 51, train_loss: 0.8347, test_loss: 0.8467, test_f1: 0.5696
 epoch: 52, train_loss: 0.8143, test_loss: 0.8526, test_f1: 0.5813
 epoch: 53, train_loss: 0.8042, test_loss: 0.8408, test_f1: 0.5482
 epoch: 54, train_loss: 0.8078, test_loss: 0.8794, test_f1: 0.5501
 epoch: 55, train_loss: 0.7898, test_loss: 0.9198, test_f1: 0.5518
 epoch: 56, train_loss: 0.8012, test_loss: 0.8258, test_f1: 0.5539
 epoch: 57, train_loss: 0.7977, test_loss: 0.9531, test_f1: 0.5455
 epoch: 58, train_loss: 0.7803, test_loss: 0.9087, test_f1: 0.5510
 epoch: 59, train_loss: 0.7821, test_loss: 0.8288, test_f1: 0.5822
 epoch: 60, train_loss: 0.7888, test_loss: 0.8637, test_f1: 0.5375
 epoch: 61, train_loss: 0.7891, test_loss: 0.8517, test_f1: 0.5635
 epoch: 62, train_loss: 0.7899, test_loss: 0.8446, test_f1: 0.5620
 epoch: 63, train_loss: 0.7921, test_loss: 0.9734, test_f1: 0.5258
 epoch: 64, train_loss: 0.7855, test_loss: 0.8561, test_f1: 0.5643
 epoch: 65, train_loss: 0.7973, test_loss: 1.0294, test_f1: 0.5020
 epoch: 66, train_loss: 0.7820, test_loss: 0.9105, test_f1: 0.5788
 epoch: 67, train_loss: 0.7826, test_loss: 0.8389, test_f1: 0.5622
 epoch: 68, train_loss: 0.7911, test_loss: 0.8819, test_f1: 0.5449
 epoch: 69, train_loss: 0.7699, test_loss: 0.8387, test_f1: 0.5484
 epoch: 70, train_loss: 0.7703, test_loss: 0.9164, test_f1: 0.5308
 epoch: 71, train_loss: 0.7734, test_loss: 0.9066, test_f1: 0.5475
 epoch: 72, train_loss: 0.7706, test_loss: 0.9533, test_f1: 0.5492
 epoch: 73, train_loss: 0.7782, test_loss: 0.9462, test_f1: 0.5412
 epoch: 74, train_loss: 0.7770, test_loss: 0.9182, test_f1: 0.5523
 epoch: 75, train_loss: 0.7665, test_loss: 0.8395, test_f1: 0.5655
 epoch: 76, train_loss: 0.7676, test_loss: 1.0240, test_f1: 0.5200
 epoch: 77, train_loss: 0.7625, test_loss: 0.8394, test_f1: 0.5665
 epoch: 78, train_loss: 0.7555, test_loss: 0.8896, test_f1: 0.5524
 epoch: 79, train_loss: 0.7572, test_loss: 0.8487, test_f1: 0.5486
 epoch: 80, train_loss: 0.7628, test_loss: 0.8264, test_f1: 0.5693
 epoch: 81, train_loss: 0.7560, test_loss: 0.8861, test_f1: 0.5754
 epoch: 82, train_loss: 0.7615, test_loss: 0.8920, test_f1: 0.5766
 epoch: 83, train_loss: 0.7493, test_loss: 1.0172, test_f1: 0.5432
 epoch: 84, train_loss: 0.7574, test_loss: 0.8678, test_f1: 0.5515
 epoch: 85, train_loss: 0.7527, test_loss: 0.9561, test_f1: 0.5504
 epoch: 86, train_loss: 0.7424, test_loss: 0.9287, test_f1: 0.6025
 epoch: 87, train_loss: 0.7446, test_loss: 1.1276, test_f1: 0.5287
 epoch: 88, train_loss: 0.7575, test_loss: 0.8936, test_f1: 0.5448
 epoch: 89, train_loss: 0.7467, test_loss: 1.2888, test_f1: 0.5148
 epoch: 90, train_loss: 0.7667, test_loss: 0.8109, test_f1: 0.6035
 epoch: 91, train_loss: 0.7631, test_loss: 0.8670, test_f1: 0.5819
 epoch: 92, train_loss: 0.7385, test_loss: 0.8705, test_f1: 0.5492
 epoch: 93, train_loss: 0.7444, test_loss: 0.8872, test_f1: 0.5481
 epoch: 94, train_loss: 0.7441, test_loss: 1.0294, test_f1: 0.5378
 epoch: 95, train_loss: 0.7489, test_loss: 1.1120, test_f1: 0.5393
 epoch: 96, train_loss: 0.7518, test_loss: 0.9301, test_f1: 0.5512
 epoch: 97, train_loss: 0.7365, test_loss: 1.0938, test_f1: 0.5601
 epoch: 98, train_loss: 0.7423, test_loss: 0.8920, test_f1: 0.5946
 epoch: 99, train_loss: 0.7405, test_loss: 0.8572, test_f1: 0.5819
##################ITERATION #9 ****************************************
 epoch: 0, train_loss: 1.3679, test_loss: 1.3370, test_f1: 0.2270
 epoch: 1, train_loss: 1.1441, test_loss: 1.2719, test_f1: 0.2270
 epoch: 2, train_loss: 1.0807, test_loss: 1.1140, test_f1: 0.3294
 epoch: 3, train_loss: 1.0542, test_loss: 1.0216, test_f1: 0.4011
 epoch: 4, train_loss: 1.0261, test_loss: 1.0506, test_f1: 0.4104
 epoch: 5, train_loss: 1.0154, test_loss: 1.0485, test_f1: 0.4451
 epoch: 6, train_loss: 1.0088, test_loss: 1.0086, test_f1: 0.4411
 epoch: 7, train_loss: 0.9712, test_loss: 1.0526, test_f1: 0.4435
 epoch: 8, train_loss: 0.9711, test_loss: 0.9660, test_f1: 0.4609
 epoch: 9, train_loss: 0.9708, test_loss: 0.9909, test_f1: 0.4716
 epoch: 10, train_loss: 0.9547, test_loss: 1.0094, test_f1: 0.4498
 epoch: 11, train_loss: 0.9596, test_loss: 0.9890, test_f1: 0.4590
 epoch: 12, train_loss: 0.9658, test_loss: 0.9856, test_f1: 0.4923
 epoch: 13, train_loss: 0.9435, test_loss: 0.9696, test_f1: 0.4737
 epoch: 14, train_loss: 0.9354, test_loss: 1.0178, test_f1: 0.4971
 epoch: 15, train_loss: 0.9322, test_loss: 1.0763, test_f1: 0.4599
 epoch: 16, train_loss: 0.9370, test_loss: 0.9617, test_f1: 0.5085
 epoch: 17, train_loss: 0.9282, test_loss: 0.9791, test_f1: 0.5128
 epoch: 18, train_loss: 0.9212, test_loss: 0.9333, test_f1: 0.4948
 epoch: 19, train_loss: 0.9028, test_loss: 0.9636, test_f1: 0.5112
 epoch: 20, train_loss: 0.8996, test_loss: 0.9946, test_f1: 0.5174
 epoch: 21, train_loss: 0.8926, test_loss: 0.9495, test_f1: 0.5296
 epoch: 22, train_loss: 0.8909, test_loss: 1.0109, test_f1: 0.5421
 epoch: 23, train_loss: 0.8967, test_loss: 1.0082, test_f1: 0.5098
 epoch: 24, train_loss: 0.8967, test_loss: 0.9655, test_f1: 0.5020
 epoch: 25, train_loss: 0.8873, test_loss: 0.9734, test_f1: 0.5367
 epoch: 26, train_loss: 0.8787, test_loss: 0.9376, test_f1: 0.5204
 epoch: 27, train_loss: 0.8940, test_loss: 0.9518, test_f1: 0.5244
 epoch: 28, train_loss: 0.8753, test_loss: 1.0196, test_f1: 0.5266
 epoch: 29, train_loss: 0.8788, test_loss: 0.9398, test_f1: 0.5289
 epoch: 30, train_loss: 0.8650, test_loss: 0.9999, test_f1: 0.5108
 epoch: 31, train_loss: 0.8817, test_loss: 0.8952, test_f1: 0.5401
 epoch: 32, train_loss: 0.8740, test_loss: 0.8739, test_f1: 0.5368
 epoch: 33, train_loss: 0.8688, test_loss: 0.8786, test_f1: 0.5373
 epoch: 34, train_loss: 0.8523, test_loss: 0.9533, test_f1: 0.5148
 epoch: 35, train_loss: 0.8577, test_loss: 0.8591, test_f1: 0.5392
 epoch: 36, train_loss: 0.8633, test_loss: 0.8638, test_f1: 0.5363
 epoch: 37, train_loss: 0.8577, test_loss: 0.9261, test_f1: 0.5464
 epoch: 38, train_loss: 0.8518, test_loss: 1.0014, test_f1: 0.5400
 epoch: 39, train_loss: 0.8609, test_loss: 1.0127, test_f1: 0.5030
 epoch: 40, train_loss: 0.8508, test_loss: 0.9474, test_f1: 0.5513
 epoch: 41, train_loss: 0.8341, test_loss: 0.9253, test_f1: 0.5312
 epoch: 42, train_loss: 0.8376, test_loss: 0.9407, test_f1: 0.5482
 epoch: 43, train_loss: 0.8459, test_loss: 0.9604, test_f1: 0.5486
 epoch: 44, train_loss: 0.8417, test_loss: 0.9181, test_f1: 0.5299
 epoch: 45, train_loss: 0.8213, test_loss: 0.9564, test_f1: 0.5309
 epoch: 46, train_loss: 0.8467, test_loss: 0.9859, test_f1: 0.5180
 epoch: 47, train_loss: 0.8359, test_loss: 0.9913, test_f1: 0.5327
 epoch: 48, train_loss: 0.8443, test_loss: 0.9851, test_f1: 0.5238
 epoch: 49, train_loss: 0.8418, test_loss: 0.9717, test_f1: 0.4925
 epoch: 50, train_loss: 0.8561, test_loss: 0.8568, test_f1: 0.5509
 epoch: 51, train_loss: 0.8359, test_loss: 0.9046, test_f1: 0.5453
 epoch: 52, train_loss: 0.8144, test_loss: 0.9059, test_f1: 0.5485
 epoch: 53, train_loss: 0.8115, test_loss: 0.9186, test_f1: 0.5472
 epoch: 54, train_loss: 0.7981, test_loss: 1.0119, test_f1: 0.5137
 epoch: 55, train_loss: 0.7885, test_loss: 0.9176, test_f1: 0.5550
 epoch: 56, train_loss: 0.7874, test_loss: 0.9371, test_f1: 0.5440
 epoch: 57, train_loss: 0.7982, test_loss: 0.9342, test_f1: 0.5480
 epoch: 58, train_loss: 0.7821, test_loss: 0.9446, test_f1: 0.5300
 epoch: 59, train_loss: 0.7974, test_loss: 0.9396, test_f1: 0.5443
 epoch: 60, train_loss: 0.7839, test_loss: 0.9254, test_f1: 0.5423
 epoch: 61, train_loss: 0.7998, test_loss: 0.9684, test_f1: 0.5292
 epoch: 62, train_loss: 0.7956, test_loss: 0.9419, test_f1: 0.5470
 epoch: 63, train_loss: 0.7871, test_loss: 0.9255, test_f1: 0.5426
 epoch: 64, train_loss: 0.7815, test_loss: 0.9348, test_f1: 0.5462
 epoch: 65, train_loss: 0.7802, test_loss: 0.9382, test_f1: 0.5408
 epoch: 66, train_loss: 0.7849, test_loss: 0.9252, test_f1: 0.5456
 epoch: 67, train_loss: 0.7858, test_loss: 0.9366, test_f1: 0.5297
 epoch: 68, train_loss: 0.7793, test_loss: 0.9264, test_f1: 0.5362
 epoch: 69, train_loss: 0.7827, test_loss: 0.9322, test_f1: 0.5401
 epoch: 70, train_loss: 0.7783, test_loss: 0.9423, test_f1: 0.5282
 epoch: 71, train_loss: 0.7840, test_loss: 0.9313, test_f1: 0.5486
 epoch: 72, train_loss: 0.7739, test_loss: 0.9403, test_f1: 0.5271
 epoch: 73, train_loss: 0.7820, test_loss: 0.9098, test_f1: 0.5489
 epoch: 74, train_loss: 0.7761, test_loss: 0.9634, test_f1: 0.5247
 epoch: 75, train_loss: 0.7762, test_loss: 0.9100, test_f1: 0.5508
 epoch: 76, train_loss: 0.7762, test_loss: 0.9166, test_f1: 0.5647
 epoch: 77, train_loss: 0.7858, test_loss: 0.9573, test_f1: 0.5286
 epoch: 78, train_loss: 0.7809, test_loss: 0.9202, test_f1: 0.5630
 epoch: 79, train_loss: 0.7709, test_loss: 0.9332, test_f1: 0.5576
 epoch: 80, train_loss: 0.7780, test_loss: 0.9181, test_f1: 0.5487
 epoch: 81, train_loss: 0.7604, test_loss: 0.9210, test_f1: 0.5654
 epoch: 82, train_loss: 0.7654, test_loss: 0.9500, test_f1: 0.5439
 epoch: 83, train_loss: 0.7802, test_loss: 0.9293, test_f1: 0.5650
 epoch: 84, train_loss: 0.7678, test_loss: 0.9223, test_f1: 0.5557
 epoch: 85, train_loss: 0.7576, test_loss: 0.9150, test_f1: 0.5563
 epoch: 86, train_loss: 0.7545, test_loss: 0.9947, test_f1: 0.5254
 epoch: 87, train_loss: 0.7655, test_loss: 0.9202, test_f1: 0.5519
 epoch: 88, train_loss: 0.7591, test_loss: 0.9315, test_f1: 0.5550
 epoch: 89, train_loss: 0.7581, test_loss: 0.9273, test_f1: 0.5562
 epoch: 90, train_loss: 0.7461, test_loss: 0.9456, test_f1: 0.5470
 epoch: 91, train_loss: 0.7555, test_loss: 0.9235, test_f1: 0.5651
 epoch: 92, train_loss: 0.7516, test_loss: 0.9317, test_f1: 0.5569
 epoch: 93, train_loss: 0.7477, test_loss: 0.8991, test_f1: 0.5688
 epoch: 94, train_loss: 0.7363, test_loss: 0.9214, test_f1: 0.5537
 epoch: 95, train_loss: 0.7539, test_loss: 0.9542, test_f1: 0.5449
 epoch: 96, train_loss: 0.7494, test_loss: 0.9393, test_f1: 0.5570
 epoch: 97, train_loss: 0.7491, test_loss: 0.9420, test_f1: 0.5464
 epoch: 98, train_loss: 0.7446, test_loss: 0.9148, test_f1: 0.5586
 epoch: 99, train_loss: 0.7480, test_loss: 0.9013, test_f1: 0.5590

Training completed in 392.68 seconds
Best F1: 0.6388 at epoch 99
Mean F1 across iterations: 0.5953  0.0219
========================FINAL RESULTS================================
FEGIN weighted F1: 0.6388  0.0219
python main.py --data ltspice_examples --representation component_net --model FEGIN --layers 3 --hiddens 16 --batch_size 256 --lr 0.01 --emb_size 250 --epochs 100 --save_appendix component_net_L3_H16_BS256_LR0.01_E250 --no_val
-----



STDERR:
  File "main.py", line 370, in <module>
    main()
  File "main.py", line 254, in main
    dataset = dataset_class(
  File "/home/philip/projects/ltspice_examples_code_repo/Circuit-Completion-Using-GNNs/component_classification_with_link_prediction_head/evaluation/FEGIN/kernel/circuit_datasets.py", line 15, in __init__
    self.data, self.slices = torch.load(self.processed_paths[0])
  File "/home/philip/.local/lib/python3.8/site-packages/torch/serialization.py", line 1040, in load
    warnings.warn(
  File "/usr/lib/python3.8/warnings.py", line 109, in _showwarnmsg
    sw(msg.message, msg.category, msg.filename, msg.lineno,
  File "main.py", line 47, in warn_with_traceback
    traceback.print_stack(file=log)
/home/philip/projects/ltspice_examples_code_repo/Circuit-Completion-Using-GNNs/component_classification_with_link_prediction_head/evaluation/FEGIN/kernel/circuit_datasets.py:15: FutureWarning: You are using `torch.load` with `weights_only=False` (the current default value), which uses the default pickle module implicitly. It is possible to construct malicious pickle data which will execute arbitrary code during unpickling (See https://github.com/pytorch/pytorch/blob/main/SECURITY.md#untrusted-models for more details). In a future release, the default value for `weights_only` will be flipped to `True`. This limits the functions that could be executed during unpickling. Arbitrary objects will no longer be allowed to be loaded via this mode unless they are explicitly allowlisted by the user via `torch.serialization.add_safe_globals`. We recommend you start setting `weights_only=True` for any use case where you don't have full control of the loaded file. Please open an issue on GitHub for any issues related to this experimental feature.
  self.data, self.slices = torch.load(self.processed_paths[0])
