STDOUT:
Results will be saved in /home/philip/projects/ltspice_examples_code_repo/Circuit-Completion-Using-GNNs/component_classification_with_link_prediction_head/evaluation/FEGIN/results/model_FEGIN_dataset_ltspice_examples
Command line input: python main.py --data ltspice_examples --representation component_pin_net --model FEGIN --layers 6 --hiddens 128 --batch_size 128 --lr 0.01 --emb_size 250 --epochs 100 --save_appendix component_pin_net_L6_H128_BS128_LR0.01_E250 --no_val
 is saved.
-----
ltspice_examples - FEGIN
Using 6 layers, 128 hidden units, h = 2
Loading component_pin_net representation dataset
ENTERED
Training FEGIN on component_pin_net representation
Train: 3558, Test: 846
##################ITERATION #0 ****************************************
 epoch: 0, train_loss: 1.1947, test_loss: 1.1409, test_f1: 0.3265
 epoch: 1, train_loss: 1.0181, test_loss: 0.9899, test_f1: 0.4422
 epoch: 2, train_loss: 0.9698, test_loss: 0.9216, test_f1: 0.4993
 epoch: 3, train_loss: 0.9409, test_loss: 0.9296, test_f1: 0.5035
 epoch: 4, train_loss: 0.9291, test_loss: 1.0082, test_f1: 0.5042
 epoch: 5, train_loss: 0.9220, test_loss: 0.9001, test_f1: 0.4924
 epoch: 6, train_loss: 0.8883, test_loss: 1.3846, test_f1: 0.3716
 epoch: 7, train_loss: 0.8759, test_loss: 1.0785, test_f1: 0.5264
 epoch: 8, train_loss: 0.8312, test_loss: 1.0118, test_f1: 0.5240
 epoch: 9, train_loss: 0.8502, test_loss: 0.9862, test_f1: 0.5865
 epoch: 10, train_loss: 0.8268, test_loss: 1.1979, test_f1: 0.4722
 epoch: 11, train_loss: 0.8180, test_loss: 0.9299, test_f1: 0.5609
 epoch: 12, train_loss: 0.8286, test_loss: 0.8710, test_f1: 0.5944
 epoch: 13, train_loss: 0.7784, test_loss: 0.9758, test_f1: 0.5731
 epoch: 14, train_loss: 0.7546, test_loss: 0.9847, test_f1: 0.6033
 epoch: 15, train_loss: 0.7672, test_loss: 0.9367, test_f1: 0.6084
 epoch: 16, train_loss: 0.7600, test_loss: 0.9256, test_f1: 0.5669
 epoch: 17, train_loss: 0.7467, test_loss: 0.8897, test_f1: 0.5625
 epoch: 18, train_loss: 0.7368, test_loss: 1.0438, test_f1: 0.5849
 epoch: 19, train_loss: 0.7250, test_loss: 1.3906, test_f1: 0.5073
 epoch: 20, train_loss: 0.7362, test_loss: 1.0528, test_f1: 0.5441
 epoch: 21, train_loss: 0.6914, test_loss: 1.0759, test_f1: 0.5655
 epoch: 22, train_loss: 0.7100, test_loss: 1.0012, test_f1: 0.5824
 epoch: 23, train_loss: 0.6911, test_loss: 0.9508, test_f1: 0.6176
 epoch: 24, train_loss: 0.6703, test_loss: 1.1000, test_f1: 0.5869
 epoch: 25, train_loss: 0.6429, test_loss: 1.1864, test_f1: 0.5463
 epoch: 26, train_loss: 0.7107, test_loss: 1.0282, test_f1: 0.5382
 epoch: 27, train_loss: 0.7057, test_loss: 0.9049, test_f1: 0.5890
 epoch: 28, train_loss: 0.6913, test_loss: 0.9527, test_f1: 0.6266
 epoch: 29, train_loss: 0.6637, test_loss: 0.8815, test_f1: 0.6045
 epoch: 30, train_loss: 0.6694, test_loss: 0.8981, test_f1: 0.6293
 epoch: 31, train_loss: 0.6416, test_loss: 0.8720, test_f1: 0.5849
 epoch: 32, train_loss: 0.6184, test_loss: 0.9910, test_f1: 0.5862
 epoch: 33, train_loss: 0.6346, test_loss: 0.9981, test_f1: 0.6380
 epoch: 34, train_loss: 0.6273, test_loss: 0.9546, test_f1: 0.5970
 epoch: 35, train_loss: 0.6070, test_loss: 0.9019, test_f1: 0.6530
 epoch: 36, train_loss: 0.6227, test_loss: 0.9510, test_f1: 0.6232
 epoch: 37, train_loss: 0.6070, test_loss: 0.9461, test_f1: 0.6433
 epoch: 38, train_loss: 0.5962, test_loss: 0.9528, test_f1: 0.6304
 epoch: 39, train_loss: 0.6018, test_loss: 0.8756, test_f1: 0.6591
 epoch: 40, train_loss: 0.5845, test_loss: 0.8082, test_f1: 0.6695
 epoch: 41, train_loss: 0.6231, test_loss: 1.1580, test_f1: 0.5956
 epoch: 42, train_loss: 0.6280, test_loss: 0.9436, test_f1: 0.6280
 epoch: 43, train_loss: 0.6187, test_loss: 1.0273, test_f1: 0.6290
 epoch: 44, train_loss: 0.5864, test_loss: 0.9771, test_f1: 0.5838
 epoch: 45, train_loss: 0.5809, test_loss: 1.3967, test_f1: 0.5476
 epoch: 46, train_loss: 0.5782, test_loss: 1.0110, test_f1: 0.6320
 epoch: 47, train_loss: 0.5987, test_loss: 0.8938, test_f1: 0.6436
 epoch: 48, train_loss: 0.5567, test_loss: 0.9959, test_f1: 0.6488
 epoch: 49, train_loss: 0.5685, test_loss: 1.0056, test_f1: 0.6604
 epoch: 50, train_loss: 0.5469, test_loss: 0.9436, test_f1: 0.6627
 epoch: 51, train_loss: 0.5089, test_loss: 1.0474, test_f1: 0.6466
 epoch: 52, train_loss: 0.4687, test_loss: 1.0408, test_f1: 0.6475
 epoch: 53, train_loss: 0.4665, test_loss: 0.9554, test_f1: 0.6676
 epoch: 54, train_loss: 0.4527, test_loss: 1.0653, test_f1: 0.6677
 epoch: 55, train_loss: 0.4405, test_loss: 1.0424, test_f1: 0.6762
 epoch: 56, train_loss: 0.4550, test_loss: 1.0444, test_f1: 0.6454
 epoch: 57, train_loss: 0.4509, test_loss: 0.9865, test_f1: 0.6500
 epoch: 58, train_loss: 0.4548, test_loss: 1.0252, test_f1: 0.6626
 epoch: 59, train_loss: 0.4227, test_loss: 1.2061, test_f1: 0.6580
 epoch: 60, train_loss: 0.4423, test_loss: 1.1309, test_f1: 0.6788
 epoch: 61, train_loss: 0.4348, test_loss: 1.1819, test_f1: 0.6648
 epoch: 62, train_loss: 0.4215, test_loss: 1.0398, test_f1: 0.6731
 epoch: 63, train_loss: 0.4204, test_loss: 1.1397, test_f1: 0.6537
 epoch: 64, train_loss: 0.4089, test_loss: 1.2414, test_f1: 0.6667
 epoch: 65, train_loss: 0.4108, test_loss: 1.0704, test_f1: 0.6795
 epoch: 66, train_loss: 0.3992, test_loss: 1.1984, test_f1: 0.6334
 epoch: 67, train_loss: 0.4026, test_loss: 1.2348, test_f1: 0.6755
 epoch: 68, train_loss: 0.4170, test_loss: 1.0915, test_f1: 0.6446
 epoch: 69, train_loss: 0.3822, test_loss: 1.1377, test_f1: 0.6869
 epoch: 70, train_loss: 0.3879, test_loss: 1.2215, test_f1: 0.6492
 epoch: 71, train_loss: 0.3868, test_loss: 1.0443, test_f1: 0.6861
 epoch: 72, train_loss: 0.3646, test_loss: 1.1046, test_f1: 0.6873
 epoch: 73, train_loss: 0.3567, test_loss: 1.1922, test_f1: 0.6757
 epoch: 74, train_loss: 0.3740, test_loss: 1.3385, test_f1: 0.6332
 epoch: 75, train_loss: 0.3557, test_loss: 1.2996, test_f1: 0.6746
 epoch: 76, train_loss: 0.3389, test_loss: 1.3770, test_f1: 0.6647
 epoch: 77, train_loss: 0.3536, test_loss: 1.3618, test_f1: 0.6424
 epoch: 78, train_loss: 0.3683, test_loss: 1.2041, test_f1: 0.6818
 epoch: 79, train_loss: 0.3545, test_loss: 1.1899, test_f1: 0.6493
 epoch: 80, train_loss: 0.3444, test_loss: 1.1570, test_f1: 0.6751
 epoch: 81, train_loss: 0.3389, test_loss: 1.2745, test_f1: 0.6680
 epoch: 82, train_loss: 0.3476, test_loss: 1.6994, test_f1: 0.6526
 epoch: 83, train_loss: 0.3118, test_loss: 1.1728, test_f1: 0.6598
 epoch: 84, train_loss: 0.3382, test_loss: 1.3472, test_f1: 0.6804
 epoch: 85, train_loss: 0.3295, test_loss: 1.5813, test_f1: 0.6563
 epoch: 86, train_loss: 0.3317, test_loss: 1.2352, test_f1: 0.6840
 epoch: 87, train_loss: 0.3102, test_loss: 1.4921, test_f1: 0.6539
 epoch: 88, train_loss: 0.3242, test_loss: 1.4964, test_f1: 0.6461
 epoch: 89, train_loss: 0.3274, test_loss: 1.3471, test_f1: 0.6748
 epoch: 90, train_loss: 0.2936, test_loss: 1.3918, test_f1: 0.6757
 epoch: 91, train_loss: 0.3030, test_loss: 1.4362, test_f1: 0.6683
 epoch: 92, train_loss: 0.3177, test_loss: 1.3405, test_f1: 0.6338
 epoch: 93, train_loss: 0.3035, test_loss: 1.1829, test_f1: 0.6725
 epoch: 94, train_loss: 0.2943, test_loss: 1.3517, test_f1: 0.6927
 epoch: 95, train_loss: 0.3050, test_loss: 1.2983, test_f1: 0.6713
 epoch: 96, train_loss: 0.2934, test_loss: 1.4349, test_f1: 0.6623
 epoch: 97, train_loss: 0.2927, test_loss: 1.4047, test_f1: 0.6365
 epoch: 98, train_loss: 0.2874, test_loss: 1.4153, test_f1: 0.6817
 epoch: 99, train_loss: 0.2539, test_loss: 1.5329, test_f1: 0.6784
##################ITERATION #1 ****************************************
 epoch: 0, train_loss: 1.2024, test_loss: 1.1655, test_f1: 0.3524
 epoch: 1, train_loss: 0.9962, test_loss: 0.9410, test_f1: 0.5126
 epoch: 2, train_loss: 0.9604, test_loss: 0.9839, test_f1: 0.4835
 epoch: 3, train_loss: 0.9545, test_loss: 1.0091, test_f1: 0.4742
 epoch: 4, train_loss: 0.9396, test_loss: 0.9283, test_f1: 0.4913
 epoch: 5, train_loss: 0.9231, test_loss: 0.8927, test_f1: 0.4971
 epoch: 6, train_loss: 0.9110, test_loss: 0.9400, test_f1: 0.5456
 epoch: 7, train_loss: 0.8921, test_loss: 1.1141, test_f1: 0.4841
 epoch: 8, train_loss: 0.8764, test_loss: 0.8615, test_f1: 0.5458
 epoch: 9, train_loss: 0.8573, test_loss: 0.8589, test_f1: 0.5674
 epoch: 10, train_loss: 0.8640, test_loss: 0.8334, test_f1: 0.5498
 epoch: 11, train_loss: 0.8742, test_loss: 0.8484, test_f1: 0.5686
 epoch: 12, train_loss: 0.8206, test_loss: 1.0684, test_f1: 0.5486
 epoch: 13, train_loss: 0.7962, test_loss: 0.8181, test_f1: 0.5432
 epoch: 14, train_loss: 0.8094, test_loss: 0.8931, test_f1: 0.5683
 epoch: 15, train_loss: 0.7922, test_loss: 0.8363, test_f1: 0.5550
 epoch: 16, train_loss: 0.7875, test_loss: 0.8329, test_f1: 0.6014
 epoch: 17, train_loss: 0.7823, test_loss: 0.7711, test_f1: 0.6367
 epoch: 18, train_loss: 0.7565, test_loss: 1.0436, test_f1: 0.5444
 epoch: 19, train_loss: 0.7641, test_loss: 0.8143, test_f1: 0.6137
 epoch: 20, train_loss: 0.7542, test_loss: 0.8501, test_f1: 0.5839
 epoch: 21, train_loss: 0.7247, test_loss: 0.8217, test_f1: 0.6004
 epoch: 22, train_loss: 0.7284, test_loss: 0.8240, test_f1: 0.5992
 epoch: 23, train_loss: 0.7209, test_loss: 0.9078, test_f1: 0.5781
 epoch: 24, train_loss: 0.7063, test_loss: 0.7916, test_f1: 0.5962
 epoch: 25, train_loss: 0.6838, test_loss: 0.7958, test_f1: 0.6061
 epoch: 26, train_loss: 0.7204, test_loss: 0.8361, test_f1: 0.5705
 epoch: 27, train_loss: 0.6805, test_loss: 0.9357, test_f1: 0.5944
 epoch: 28, train_loss: 0.6760, test_loss: 0.9693, test_f1: 0.5942
 epoch: 29, train_loss: 0.6969, test_loss: 0.8206, test_f1: 0.5882
 epoch: 30, train_loss: 0.6345, test_loss: 0.8646, test_f1: 0.5856
 epoch: 31, train_loss: 0.6338, test_loss: 0.8148, test_f1: 0.6055
 epoch: 32, train_loss: 0.6271, test_loss: 0.7267, test_f1: 0.6567
 epoch: 33, train_loss: 0.6410, test_loss: 0.7579, test_f1: 0.6177
 epoch: 34, train_loss: 0.6206, test_loss: 0.7121, test_f1: 0.6764
 epoch: 35, train_loss: 0.6258, test_loss: 0.7580, test_f1: 0.6234
 epoch: 36, train_loss: 0.6174, test_loss: 0.7575, test_f1: 0.6210
 epoch: 37, train_loss: 0.6032, test_loss: 0.8771, test_f1: 0.6036
 epoch: 38, train_loss: 0.6110, test_loss: 0.7278, test_f1: 0.6764
 epoch: 39, train_loss: 0.5838, test_loss: 0.9303, test_f1: 0.6312
 epoch: 40, train_loss: 0.6055, test_loss: 0.7159, test_f1: 0.6339
 epoch: 41, train_loss: 0.5793, test_loss: 0.8156, test_f1: 0.6329
 epoch: 42, train_loss: 0.5724, test_loss: 0.7817, test_f1: 0.6524
 epoch: 43, train_loss: 0.5727, test_loss: 0.7322, test_f1: 0.6476
 epoch: 44, train_loss: 0.5767, test_loss: 0.7766, test_f1: 0.6424
 epoch: 45, train_loss: 0.5590, test_loss: 0.7602, test_f1: 0.6530
 epoch: 46, train_loss: 0.5430, test_loss: 0.9622, test_f1: 0.5813
 epoch: 47, train_loss: 0.5519, test_loss: 0.8754, test_f1: 0.6374
 epoch: 48, train_loss: 0.5560, test_loss: 0.7337, test_f1: 0.6392
 epoch: 49, train_loss: 0.5515, test_loss: 0.8251, test_f1: 0.6346
 epoch: 50, train_loss: 0.5166, test_loss: 0.7744, test_f1: 0.6468
 epoch: 51, train_loss: 0.4824, test_loss: 0.6853, test_f1: 0.6965
 epoch: 52, train_loss: 0.4631, test_loss: 0.8097, test_f1: 0.6415
 epoch: 53, train_loss: 0.4519, test_loss: 0.7152, test_f1: 0.6832
 epoch: 54, train_loss: 0.4490, test_loss: 0.7056, test_f1: 0.7158
 epoch: 55, train_loss: 0.4470, test_loss: 0.6948, test_f1: 0.7237
 epoch: 56, train_loss: 0.4353, test_loss: 0.7234, test_f1: 0.6886
 epoch: 57, train_loss: 0.4270, test_loss: 0.7011, test_f1: 0.6837
 epoch: 58, train_loss: 0.4309, test_loss: 0.7288, test_f1: 0.6869
 epoch: 59, train_loss: 0.4206, test_loss: 0.7093, test_f1: 0.7119
 epoch: 60, train_loss: 0.4136, test_loss: 0.7415, test_f1: 0.6899
 epoch: 61, train_loss: 0.4004, test_loss: 0.7305, test_f1: 0.6837
 epoch: 62, train_loss: 0.4082, test_loss: 0.7927, test_f1: 0.6686
 epoch: 63, train_loss: 0.4055, test_loss: 0.7641, test_f1: 0.6745
 epoch: 64, train_loss: 0.3932, test_loss: 0.9834, test_f1: 0.6341
 epoch: 65, train_loss: 0.4001, test_loss: 0.7256, test_f1: 0.6974
 epoch: 66, train_loss: 0.3706, test_loss: 0.7798, test_f1: 0.6845
 epoch: 67, train_loss: 0.3870, test_loss: 0.7588, test_f1: 0.6904
 epoch: 68, train_loss: 0.3675, test_loss: 0.7727, test_f1: 0.6917
 epoch: 69, train_loss: 0.3998, test_loss: 0.7589, test_f1: 0.6782
 epoch: 70, train_loss: 0.3868, test_loss: 0.8106, test_f1: 0.6926
 epoch: 71, train_loss: 0.3839, test_loss: 0.8877, test_f1: 0.6648
 epoch: 72, train_loss: 0.3813, test_loss: 0.7827, test_f1: 0.7016
 epoch: 73, train_loss: 0.3952, test_loss: 0.8924, test_f1: 0.6431
 epoch: 74, train_loss: 0.3774, test_loss: 0.7921, test_f1: 0.6916
 epoch: 75, train_loss: 0.3569, test_loss: 0.7271, test_f1: 0.7081
 epoch: 76, train_loss: 0.3459, test_loss: 0.7696, test_f1: 0.6943
 epoch: 77, train_loss: 0.3629, test_loss: 0.8584, test_f1: 0.6622
 epoch: 78, train_loss: 0.4075, test_loss: 0.6943, test_f1: 0.6917
 epoch: 79, train_loss: 0.3676, test_loss: 0.8477, test_f1: 0.6677
 epoch: 80, train_loss: 0.3636, test_loss: 0.7415, test_f1: 0.7071
 epoch: 81, train_loss: 0.3661, test_loss: 0.8049, test_f1: 0.6846
 epoch: 82, train_loss: 0.3549, test_loss: 0.7326, test_f1: 0.7100
 epoch: 83, train_loss: 0.3417, test_loss: 0.8082, test_f1: 0.6669
 epoch: 84, train_loss: 0.3688, test_loss: 0.8541, test_f1: 0.6658
 epoch: 85, train_loss: 0.3420, test_loss: 0.7674, test_f1: 0.6880
 epoch: 86, train_loss: 0.3472, test_loss: 0.7912, test_f1: 0.6931
 epoch: 87, train_loss: 0.3272, test_loss: 0.7739, test_f1: 0.6921
 epoch: 88, train_loss: 0.3174, test_loss: 0.8060, test_f1: 0.6751
 epoch: 89, train_loss: 0.3283, test_loss: 0.8221, test_f1: 0.6917
 epoch: 90, train_loss: 0.3137, test_loss: 0.8297, test_f1: 0.6774
 epoch: 91, train_loss: 0.3605, test_loss: 0.7710, test_f1: 0.6966
 epoch: 92, train_loss: 0.3022, test_loss: 0.8142, test_f1: 0.6699
 epoch: 93, train_loss: 0.2942, test_loss: 0.7680, test_f1: 0.7083
 epoch: 94, train_loss: 0.3269, test_loss: 0.7989, test_f1: 0.6862
 epoch: 95, train_loss: 0.3044, test_loss: 0.8322, test_f1: 0.7162
 epoch: 96, train_loss: 0.2889, test_loss: 0.9064, test_f1: 0.6783
 epoch: 97, train_loss: 0.3060, test_loss: 0.8341, test_f1: 0.6888
 epoch: 98, train_loss: 0.3030, test_loss: 0.9545, test_f1: 0.6787
 epoch: 99, train_loss: 0.3116, test_loss: 1.0125, test_f1: 0.6362
##################ITERATION #2 ****************************************
 epoch: 0, train_loss: 1.2272, test_loss: 1.0830, test_f1: 0.3744
 epoch: 1, train_loss: 0.9973, test_loss: 1.0471, test_f1: 0.4338
 epoch: 2, train_loss: 0.9735, test_loss: 0.9945, test_f1: 0.5020
 epoch: 3, train_loss: 0.9546, test_loss: 1.0091, test_f1: 0.4417
 epoch: 4, train_loss: 0.9646, test_loss: 0.9428, test_f1: 0.5303
 epoch: 5, train_loss: 0.9171, test_loss: 0.9423, test_f1: 0.4996
 epoch: 6, train_loss: 0.9055, test_loss: 0.9931, test_f1: 0.4957
 epoch: 7, train_loss: 0.8767, test_loss: 0.9369, test_f1: 0.4729
 epoch: 8, train_loss: 0.8584, test_loss: 1.0418, test_f1: 0.5033
 epoch: 9, train_loss: 0.8703, test_loss: 0.9651, test_f1: 0.5140
 epoch: 10, train_loss: 0.8433, test_loss: 0.9458, test_f1: 0.5552
 epoch: 11, train_loss: 0.8335, test_loss: 0.9940, test_f1: 0.5544
 epoch: 12, train_loss: 0.8103, test_loss: 0.9282, test_f1: 0.5209
 epoch: 13, train_loss: 0.7916, test_loss: 0.9209, test_f1: 0.5273
 epoch: 14, train_loss: 0.7875, test_loss: 1.0128, test_f1: 0.4851
 epoch: 15, train_loss: 0.7831, test_loss: 1.0172, test_f1: 0.5743
 epoch: 16, train_loss: 0.7594, test_loss: 0.9491, test_f1: 0.5849
 epoch: 17, train_loss: 0.7518, test_loss: 0.8326, test_f1: 0.6108
 epoch: 18, train_loss: 0.7402, test_loss: 1.0232, test_f1: 0.5173
 epoch: 19, train_loss: 0.7285, test_loss: 0.9678, test_f1: 0.6028
 epoch: 20, train_loss: 0.7275, test_loss: 0.9476, test_f1: 0.5657
 epoch: 21, train_loss: 0.6966, test_loss: 0.8847, test_f1: 0.5828
 epoch: 22, train_loss: 0.7278, test_loss: 0.8295, test_f1: 0.5715
 epoch: 23, train_loss: 0.7094, test_loss: 1.0117, test_f1: 0.5421
 epoch: 24, train_loss: 0.6974, test_loss: 0.9342, test_f1: 0.5859
 epoch: 25, train_loss: 0.6772, test_loss: 0.8940, test_f1: 0.6085
 epoch: 26, train_loss: 0.6875, test_loss: 0.9381, test_f1: 0.6268
 epoch: 27, train_loss: 0.6605, test_loss: 0.8741, test_f1: 0.6010
 epoch: 28, train_loss: 0.6652, test_loss: 1.0036, test_f1: 0.5973
 epoch: 29, train_loss: 0.6549, test_loss: 0.8749, test_f1: 0.6099
 epoch: 30, train_loss: 0.6405, test_loss: 1.0267, test_f1: 0.6099
 epoch: 31, train_loss: 0.6193, test_loss: 0.9594, test_f1: 0.6064
 epoch: 32, train_loss: 0.6145, test_loss: 0.9975, test_f1: 0.6208
 epoch: 33, train_loss: 0.6197, test_loss: 0.9036, test_f1: 0.6160
 epoch: 34, train_loss: 0.6196, test_loss: 0.9133, test_f1: 0.6312
 epoch: 35, train_loss: 0.6047, test_loss: 0.9062, test_f1: 0.5995
 epoch: 36, train_loss: 0.6252, test_loss: 1.0203, test_f1: 0.5925
 epoch: 37, train_loss: 0.6230, test_loss: 0.9353, test_f1: 0.6298
 epoch: 38, train_loss: 0.6060, test_loss: 1.0489, test_f1: 0.6045
 epoch: 39, train_loss: 0.6066, test_loss: 0.9243, test_f1: 0.6050
 epoch: 40, train_loss: 0.6114, test_loss: 0.9507, test_f1: 0.6197
 epoch: 41, train_loss: 0.5817, test_loss: 0.8950, test_f1: 0.6394
 epoch: 42, train_loss: 0.5726, test_loss: 0.9288, test_f1: 0.6322
 epoch: 43, train_loss: 0.5612, test_loss: 1.0621, test_f1: 0.6096
 epoch: 44, train_loss: 0.5962, test_loss: 0.8577, test_f1: 0.6175
 epoch: 45, train_loss: 0.5640, test_loss: 0.9748, test_f1: 0.6021
 epoch: 46, train_loss: 0.5674, test_loss: 0.9314, test_f1: 0.6666
 epoch: 47, train_loss: 0.5696, test_loss: 1.0443, test_f1: 0.5893
 epoch: 48, train_loss: 0.5565, test_loss: 0.9486, test_f1: 0.5752
 epoch: 49, train_loss: 0.5570, test_loss: 0.9449, test_f1: 0.5909
 epoch: 50, train_loss: 0.5384, test_loss: 0.9912, test_f1: 0.6340
 epoch: 51, train_loss: 0.5418, test_loss: 0.9537, test_f1: 0.6064
 epoch: 52, train_loss: 0.4530, test_loss: 0.9334, test_f1: 0.6649
 epoch: 53, train_loss: 0.4575, test_loss: 0.9806, test_f1: 0.6660
 epoch: 54, train_loss: 0.4577, test_loss: 0.9449, test_f1: 0.6757
 epoch: 55, train_loss: 0.4349, test_loss: 0.9745, test_f1: 0.6542
 epoch: 56, train_loss: 0.4460, test_loss: 0.9570, test_f1: 0.6711
 epoch: 57, train_loss: 0.4347, test_loss: 0.9902, test_f1: 0.6359
 epoch: 58, train_loss: 0.4352, test_loss: 1.0497, test_f1: 0.6572
 epoch: 59, train_loss: 0.4278, test_loss: 1.0195, test_f1: 0.6730
 epoch: 60, train_loss: 0.4064, test_loss: 1.0173, test_f1: 0.6550
 epoch: 61, train_loss: 0.4225, test_loss: 0.9337, test_f1: 0.6647
 epoch: 62, train_loss: 0.4112, test_loss: 1.0083, test_f1: 0.6505
 epoch: 63, train_loss: 0.3983, test_loss: 1.0177, test_f1: 0.6555
 epoch: 64, train_loss: 0.3973, test_loss: 1.1981, test_f1: 0.6244
 epoch: 65, train_loss: 0.3804, test_loss: 0.9750, test_f1: 0.6492
 epoch: 66, train_loss: 0.3920, test_loss: 1.0418, test_f1: 0.6771
 epoch: 67, train_loss: 0.4036, test_loss: 1.0221, test_f1: 0.6558
 epoch: 68, train_loss: 0.3884, test_loss: 1.1928, test_f1: 0.5940
 epoch: 69, train_loss: 0.4059, test_loss: 1.0690, test_f1: 0.6339
 epoch: 70, train_loss: 0.4059, test_loss: 1.1211, test_f1: 0.6507
 epoch: 71, train_loss: 0.3710, test_loss: 1.1943, test_f1: 0.6395
 epoch: 72, train_loss: 0.3817, test_loss: 1.1459, test_f1: 0.6564
 epoch: 73, train_loss: 0.3931, test_loss: 1.0481, test_f1: 0.6479
 epoch: 74, train_loss: 0.3897, test_loss: 1.3339, test_f1: 0.6294
 epoch: 75, train_loss: 0.3832, test_loss: 1.1887, test_f1: 0.6303
 epoch: 76, train_loss: 0.3661, test_loss: 1.1346, test_f1: 0.6464
 epoch: 77, train_loss: 0.3705, test_loss: 1.1246, test_f1: 0.6607
 epoch: 78, train_loss: 0.3938, test_loss: 1.0990, test_f1: 0.6302
 epoch: 79, train_loss: 0.3590, test_loss: 1.0271, test_f1: 0.6641
 epoch: 80, train_loss: 0.3409, test_loss: 1.1287, test_f1: 0.6352
 epoch: 81, train_loss: 0.3440, test_loss: 1.2407, test_f1: 0.6482
 epoch: 82, train_loss: 0.3445, test_loss: 1.1559, test_f1: 0.6432
 epoch: 83, train_loss: 0.3418, test_loss: 1.1157, test_f1: 0.6641
 epoch: 84, train_loss: 0.3176, test_loss: 1.1185, test_f1: 0.6592
 epoch: 85, train_loss: 0.3423, test_loss: 1.2747, test_f1: 0.6467
 epoch: 86, train_loss: 0.3248, test_loss: 1.0740, test_f1: 0.6446
 epoch: 87, train_loss: 0.3294, test_loss: 1.1270, test_f1: 0.6518
 epoch: 88, train_loss: 0.3217, test_loss: 1.1516, test_f1: 0.6161
 epoch: 89, train_loss: 0.3149, test_loss: 1.0998, test_f1: 0.6616
 epoch: 90, train_loss: 0.3576, test_loss: 1.0564, test_f1: 0.6527
 epoch: 91, train_loss: 0.3469, test_loss: 1.0759, test_f1: 0.6512
 epoch: 92, train_loss: 0.3245, test_loss: 1.2719, test_f1: 0.6401
 epoch: 93, train_loss: 0.3350, test_loss: 1.0964, test_f1: 0.6531
 epoch: 94, train_loss: 0.3103, test_loss: 1.2365, test_f1: 0.6041
 epoch: 95, train_loss: 0.3447, test_loss: 1.0996, test_f1: 0.6581
 epoch: 96, train_loss: 0.3083, test_loss: 1.2195, test_f1: 0.6066
 epoch: 97, train_loss: 0.3101, test_loss: 1.2142, test_f1: 0.6691
 epoch: 98, train_loss: 0.2928, test_loss: 1.1958, test_f1: 0.6428
 epoch: 99, train_loss: 0.3155, test_loss: 1.2551, test_f1: 0.6608
##################ITERATION #3 ****************************************
 epoch: 0, train_loss: 1.1629, test_loss: 1.9612, test_f1: 0.3372
 epoch: 1, train_loss: 1.0018, test_loss: 1.1014, test_f1: 0.5022
 epoch: 2, train_loss: 0.9761, test_loss: 1.1070, test_f1: 0.4484
 epoch: 3, train_loss: 0.9471, test_loss: 0.9496, test_f1: 0.4873
 epoch: 4, train_loss: 0.9366, test_loss: 1.0663, test_f1: 0.5062
 epoch: 5, train_loss: 0.9308, test_loss: 0.9871, test_f1: 0.4368
 epoch: 6, train_loss: 0.8956, test_loss: 0.9141, test_f1: 0.4887
 epoch: 7, train_loss: 0.8978, test_loss: 0.9907, test_f1: 0.5054
 epoch: 8, train_loss: 0.8933, test_loss: 1.2290, test_f1: 0.4161
 epoch: 9, train_loss: 0.8744, test_loss: 0.9122, test_f1: 0.5289
 epoch: 10, train_loss: 0.8554, test_loss: 1.0457, test_f1: 0.4650
 epoch: 11, train_loss: 0.8496, test_loss: 1.0140, test_f1: 0.4690
 epoch: 12, train_loss: 0.8169, test_loss: 1.0361, test_f1: 0.5296
 epoch: 13, train_loss: 0.8234, test_loss: 0.9308, test_f1: 0.5310
 epoch: 14, train_loss: 0.8189, test_loss: 0.9281, test_f1: 0.5329
 epoch: 15, train_loss: 0.7900, test_loss: 1.0033, test_f1: 0.5249
 epoch: 16, train_loss: 0.8012, test_loss: 1.2854, test_f1: 0.4724
 epoch: 17, train_loss: 0.8133, test_loss: 0.9941, test_f1: 0.5393
 epoch: 18, train_loss: 0.7790, test_loss: 0.8688, test_f1: 0.5752
 epoch: 19, train_loss: 0.7605, test_loss: 0.9188, test_f1: 0.5761
 epoch: 20, train_loss: 0.7721, test_loss: 0.9088, test_f1: 0.5467
 epoch: 21, train_loss: 0.7536, test_loss: 0.8650, test_f1: 0.5593
 epoch: 22, train_loss: 0.7348, test_loss: 0.8799, test_f1: 0.5846
 epoch: 23, train_loss: 0.7074, test_loss: 0.9676, test_f1: 0.5052
 epoch: 24, train_loss: 0.7275, test_loss: 0.8864, test_f1: 0.6087
 epoch: 25, train_loss: 0.7077, test_loss: 0.8851, test_f1: 0.6037
 epoch: 26, train_loss: 0.7072, test_loss: 0.8798, test_f1: 0.5557
 epoch: 27, train_loss: 0.6813, test_loss: 1.0086, test_f1: 0.6270
 epoch: 28, train_loss: 0.7122, test_loss: 0.8782, test_f1: 0.5948
 epoch: 29, train_loss: 0.6722, test_loss: 0.8038, test_f1: 0.5764
 epoch: 30, train_loss: 0.6797, test_loss: 0.9257, test_f1: 0.6010
 epoch: 31, train_loss: 0.6725, test_loss: 0.9365, test_f1: 0.5379
 epoch: 32, train_loss: 0.6646, test_loss: 0.9582, test_f1: 0.6072
 epoch: 33, train_loss: 0.6580, test_loss: 0.8297, test_f1: 0.6154
 epoch: 34, train_loss: 0.6470, test_loss: 0.8931, test_f1: 0.5839
 epoch: 35, train_loss: 0.6480, test_loss: 0.8061, test_f1: 0.6240
 epoch: 36, train_loss: 0.6315, test_loss: 0.8910, test_f1: 0.6286
 epoch: 37, train_loss: 0.6132, test_loss: 1.0210, test_f1: 0.5935
 epoch: 38, train_loss: 0.6222, test_loss: 1.0811, test_f1: 0.6021
 epoch: 39, train_loss: 0.6064, test_loss: 0.7631, test_f1: 0.6446
 epoch: 40, train_loss: 0.6013, test_loss: 0.7964, test_f1: 0.6671
 epoch: 41, train_loss: 0.6350, test_loss: 1.1109, test_f1: 0.5409
 epoch: 42, train_loss: 0.6080, test_loss: 0.7680, test_f1: 0.6124
 epoch: 43, train_loss: 0.6006, test_loss: 1.1417, test_f1: 0.5712
 epoch: 44, train_loss: 0.5679, test_loss: 0.8838, test_f1: 0.6256
 epoch: 45, train_loss: 0.5730, test_loss: 0.8964, test_f1: 0.6152
 epoch: 46, train_loss: 0.5774, test_loss: 0.9353, test_f1: 0.6200
 epoch: 47, train_loss: 0.5631, test_loss: 1.5136, test_f1: 0.5429
 epoch: 48, train_loss: 0.5617, test_loss: 1.2429, test_f1: 0.5760
 epoch: 49, train_loss: 0.5852, test_loss: 1.3387, test_f1: 0.5723
 epoch: 50, train_loss: 0.5831, test_loss: 0.8866, test_f1: 0.5724
 epoch: 51, train_loss: 0.5283, test_loss: 0.8864, test_f1: 0.6348
 epoch: 52, train_loss: 0.4926, test_loss: 0.9460, test_f1: 0.6248
 epoch: 53, train_loss: 0.4711, test_loss: 0.9994, test_f1: 0.6497
 epoch: 54, train_loss: 0.4761, test_loss: 0.9698, test_f1: 0.6580
 epoch: 55, train_loss: 0.4478, test_loss: 0.9490, test_f1: 0.6701
 epoch: 56, train_loss: 0.4536, test_loss: 1.0668, test_f1: 0.5936
 epoch: 57, train_loss: 0.4577, test_loss: 1.0151, test_f1: 0.6709
 epoch: 58, train_loss: 0.4564, test_loss: 0.9936, test_f1: 0.6603
 epoch: 59, train_loss: 0.4498, test_loss: 1.1162, test_f1: 0.6442
 epoch: 60, train_loss: 0.4141, test_loss: 1.0732, test_f1: 0.6414
 epoch: 61, train_loss: 0.4193, test_loss: 1.1103, test_f1: 0.6567
 epoch: 62, train_loss: 0.4242, test_loss: 1.0723, test_f1: 0.6651
 epoch: 63, train_loss: 0.4223, test_loss: 0.9322, test_f1: 0.6628
 epoch: 64, train_loss: 0.4258, test_loss: 0.9050, test_f1: 0.6727
 epoch: 65, train_loss: 0.4424, test_loss: 1.1006, test_f1: 0.6532
 epoch: 66, train_loss: 0.4010, test_loss: 1.0205, test_f1: 0.6600
 epoch: 67, train_loss: 0.3941, test_loss: 1.0229, test_f1: 0.6906
 epoch: 68, train_loss: 0.3812, test_loss: 1.1198, test_f1: 0.6480
 epoch: 69, train_loss: 0.3844, test_loss: 1.1148, test_f1: 0.6517
 epoch: 70, train_loss: 0.3925, test_loss: 1.1095, test_f1: 0.6646
 epoch: 71, train_loss: 0.3835, test_loss: 1.1045, test_f1: 0.6510
 epoch: 72, train_loss: 0.3746, test_loss: 1.0547, test_f1: 0.6815
 epoch: 73, train_loss: 0.3767, test_loss: 0.9853, test_f1: 0.6609
 epoch: 74, train_loss: 0.3769, test_loss: 1.0144, test_f1: 0.6671
 epoch: 75, train_loss: 0.3766, test_loss: 1.1378, test_f1: 0.6580
 epoch: 76, train_loss: 0.3509, test_loss: 1.0248, test_f1: 0.6845
 epoch: 77, train_loss: 0.3965, test_loss: 1.0657, test_f1: 0.6645
 epoch: 78, train_loss: 0.3646, test_loss: 1.1763, test_f1: 0.6841
 epoch: 79, train_loss: 0.3547, test_loss: 1.2750, test_f1: 0.6665
 epoch: 80, train_loss: 0.3565, test_loss: 1.1584, test_f1: 0.6444
 epoch: 81, train_loss: 0.3566, test_loss: 1.2767, test_f1: 0.6564
 epoch: 82, train_loss: 0.3506, test_loss: 1.3193, test_f1: 0.6510
 epoch: 83, train_loss: 0.3382, test_loss: 1.2142, test_f1: 0.6523
 epoch: 84, train_loss: 0.3597, test_loss: 1.2061, test_f1: 0.6813
 epoch: 85, train_loss: 0.3566, test_loss: 1.3843, test_f1: 0.6106
 epoch: 86, train_loss: 0.3129, test_loss: 1.3469, test_f1: 0.6548
 epoch: 87, train_loss: 0.3299, test_loss: 1.2477, test_f1: 0.6666
 epoch: 88, train_loss: 0.3040, test_loss: 1.6302, test_f1: 0.6402
 epoch: 89, train_loss: 0.3224, test_loss: 1.2497, test_f1: 0.6544
 epoch: 90, train_loss: 0.3004, test_loss: 1.1671, test_f1: 0.6716
 epoch: 91, train_loss: 0.3055, test_loss: 1.2131, test_f1: 0.6512
 epoch: 92, train_loss: 0.3268, test_loss: 1.2812, test_f1: 0.6390
 epoch: 93, train_loss: 0.3186, test_loss: 1.2352, test_f1: 0.6842
 epoch: 94, train_loss: 0.2986, test_loss: 1.3966, test_f1: 0.6562
 epoch: 95, train_loss: 0.3205, test_loss: 1.3738, test_f1: 0.6501
 epoch: 96, train_loss: 0.2998, test_loss: 1.4871, test_f1: 0.6747
 epoch: 97, train_loss: 0.3034, test_loss: 1.3260, test_f1: 0.6860
 epoch: 98, train_loss: 0.3142, test_loss: 1.3784, test_f1: 0.6770
 epoch: 99, train_loss: 0.2945, test_loss: 1.3965, test_f1: 0.6579
##################ITERATION #4 ****************************************
 epoch: 0, train_loss: 1.1985, test_loss: 1.2811, test_f1: 0.3570
 epoch: 1, train_loss: 0.9725, test_loss: 0.9387, test_f1: 0.4807
 epoch: 2, train_loss: 0.9410, test_loss: 0.9486, test_f1: 0.5125
 epoch: 3, train_loss: 0.9338, test_loss: 0.9069, test_f1: 0.4980
 epoch: 4, train_loss: 0.9048, test_loss: 0.8914, test_f1: 0.4970
 epoch: 5, train_loss: 0.9117, test_loss: 1.0319, test_f1: 0.4820
 epoch: 6, train_loss: 0.8743, test_loss: 0.8397, test_f1: 0.5168
 epoch: 7, train_loss: 0.8474, test_loss: 0.9057, test_f1: 0.5118
 epoch: 8, train_loss: 0.8384, test_loss: 1.0148, test_f1: 0.4658
 epoch: 9, train_loss: 0.8230, test_loss: 0.8248, test_f1: 0.5816
 epoch: 10, train_loss: 0.8058, test_loss: 0.8512, test_f1: 0.5509
 epoch: 11, train_loss: 0.7872, test_loss: 0.8704, test_f1: 0.5569
 epoch: 12, train_loss: 0.7869, test_loss: 0.9271, test_f1: 0.5315
 epoch: 13, train_loss: 0.7821, test_loss: 0.8283, test_f1: 0.5531
 epoch: 14, train_loss: 0.7746, test_loss: 0.9119, test_f1: 0.5334
 epoch: 15, train_loss: 0.7621, test_loss: 1.1404, test_f1: 0.4412
 epoch: 16, train_loss: 0.7700, test_loss: 0.8221, test_f1: 0.5461
 epoch: 17, train_loss: 0.7540, test_loss: 0.7411, test_f1: 0.6222
 epoch: 18, train_loss: 0.7222, test_loss: 0.8200, test_f1: 0.6121
 epoch: 19, train_loss: 0.7060, test_loss: 0.8205, test_f1: 0.6081
 epoch: 20, train_loss: 0.7232, test_loss: 0.7729, test_f1: 0.5923
 epoch: 21, train_loss: 0.7061, test_loss: 0.7778, test_f1: 0.6224
 epoch: 22, train_loss: 0.7342, test_loss: 0.7952, test_f1: 0.5829
 epoch: 23, train_loss: 0.7028, test_loss: 0.8321, test_f1: 0.5938
 epoch: 24, train_loss: 0.6772, test_loss: 0.7894, test_f1: 0.5946
 epoch: 25, train_loss: 0.6832, test_loss: 0.9451, test_f1: 0.5683
 epoch: 26, train_loss: 0.6475, test_loss: 0.8782, test_f1: 0.6092
 epoch: 27, train_loss: 0.6684, test_loss: 0.8667, test_f1: 0.5951
 epoch: 28, train_loss: 0.6718, test_loss: 0.7463, test_f1: 0.6181
 epoch: 29, train_loss: 0.6615, test_loss: 0.7519, test_f1: 0.6236
 epoch: 30, train_loss: 0.6305, test_loss: 0.8007, test_f1: 0.5935
 epoch: 31, train_loss: 0.6323, test_loss: 0.7405, test_f1: 0.6730
 epoch: 32, train_loss: 0.6535, test_loss: 0.7793, test_f1: 0.6459
 epoch: 33, train_loss: 0.6351, test_loss: 0.8421, test_f1: 0.6136
 epoch: 34, train_loss: 0.6273, test_loss: 1.0522, test_f1: 0.5541
 epoch: 35, train_loss: 0.6112, test_loss: 0.8478, test_f1: 0.6267
 epoch: 36, train_loss: 0.6052, test_loss: 0.7671, test_f1: 0.5914
 epoch: 37, train_loss: 0.6147, test_loss: 0.8172, test_f1: 0.6112
 epoch: 38, train_loss: 0.5827, test_loss: 0.7999, test_f1: 0.6161
 epoch: 39, train_loss: 0.5946, test_loss: 0.8369, test_f1: 0.6282
 epoch: 40, train_loss: 0.6041, test_loss: 0.7680, test_f1: 0.6557
 epoch: 41, train_loss: 0.6054, test_loss: 0.8870, test_f1: 0.5984
 epoch: 42, train_loss: 0.5678, test_loss: 0.7657, test_f1: 0.6417
 epoch: 43, train_loss: 0.5592, test_loss: 0.7709, test_f1: 0.6543
 epoch: 44, train_loss: 0.5707, test_loss: 0.7191, test_f1: 0.6454
 epoch: 45, train_loss: 0.5568, test_loss: 0.7277, test_f1: 0.6490
 epoch: 46, train_loss: 0.5687, test_loss: 0.7770, test_f1: 0.6299
 epoch: 47, train_loss: 0.5449, test_loss: 0.8636, test_f1: 0.6787
 epoch: 48, train_loss: 0.5532, test_loss: 0.7903, test_f1: 0.6550
 epoch: 49, train_loss: 0.5696, test_loss: 0.8010, test_f1: 0.6529
 epoch: 50, train_loss: 0.5565, test_loss: 1.0939, test_f1: 0.5419
 epoch: 51, train_loss: 0.5275, test_loss: 0.7240, test_f1: 0.6339
 epoch: 52, train_loss: 0.4747, test_loss: 0.7470, test_f1: 0.6561
 epoch: 53, train_loss: 0.4738, test_loss: 0.7424, test_f1: 0.6641
 epoch: 54, train_loss: 0.4480, test_loss: 0.7895, test_f1: 0.6392
 epoch: 55, train_loss: 0.4472, test_loss: 0.7583, test_f1: 0.6918
 epoch: 56, train_loss: 0.4214, test_loss: 0.8929, test_f1: 0.6401
 epoch: 57, train_loss: 0.4408, test_loss: 0.7675, test_f1: 0.6618
 epoch: 58, train_loss: 0.4188, test_loss: 0.8341, test_f1: 0.6835
 epoch: 59, train_loss: 0.4283, test_loss: 0.8727, test_f1: 0.6308
 epoch: 60, train_loss: 0.4253, test_loss: 0.7903, test_f1: 0.6473
 epoch: 61, train_loss: 0.4086, test_loss: 0.8768, test_f1: 0.6675
 epoch: 62, train_loss: 0.4178, test_loss: 0.7240, test_f1: 0.6562
 epoch: 63, train_loss: 0.4020, test_loss: 0.8645, test_f1: 0.6383
 epoch: 64, train_loss: 0.4002, test_loss: 0.8907, test_f1: 0.6596
 epoch: 65, train_loss: 0.3917, test_loss: 0.8511, test_f1: 0.6758
 epoch: 66, train_loss: 0.4165, test_loss: 0.8239, test_f1: 0.6815
 epoch: 67, train_loss: 0.4139, test_loss: 0.8582, test_f1: 0.6262
 epoch: 68, train_loss: 0.3976, test_loss: 0.8777, test_f1: 0.6312
 epoch: 69, train_loss: 0.3808, test_loss: 0.8826, test_f1: 0.6684
 epoch: 70, train_loss: 0.3959, test_loss: 0.8764, test_f1: 0.6763
 epoch: 71, train_loss: 0.3864, test_loss: 0.8657, test_f1: 0.6973
 epoch: 72, train_loss: 0.3723, test_loss: 0.9474, test_f1: 0.6343
 epoch: 73, train_loss: 0.3700, test_loss: 0.9041, test_f1: 0.6596
 epoch: 74, train_loss: 0.3594, test_loss: 0.9459, test_f1: 0.6340
 epoch: 75, train_loss: 0.3681, test_loss: 0.8390, test_f1: 0.6555
 epoch: 76, train_loss: 0.3628, test_loss: 0.8572, test_f1: 0.6631
 epoch: 77, train_loss: 0.3494, test_loss: 0.8338, test_f1: 0.6807
 epoch: 78, train_loss: 0.3455, test_loss: 0.8613, test_f1: 0.6465
 epoch: 79, train_loss: 0.3515, test_loss: 0.8636, test_f1: 0.6421
 epoch: 80, train_loss: 0.3528, test_loss: 0.8730, test_f1: 0.6637
 epoch: 81, train_loss: 0.3424, test_loss: 1.0074, test_f1: 0.6407
 epoch: 82, train_loss: 0.3385, test_loss: 0.9719, test_f1: 0.6497
 epoch: 83, train_loss: 0.3437, test_loss: 1.0922, test_f1: 0.6250
 epoch: 84, train_loss: 0.3564, test_loss: 1.0184, test_f1: 0.6293
 epoch: 85, train_loss: 0.3425, test_loss: 0.8994, test_f1: 0.6568
 epoch: 86, train_loss: 0.3171, test_loss: 1.1149, test_f1: 0.6334
 epoch: 87, train_loss: 0.3208, test_loss: 1.1126, test_f1: 0.6460
 epoch: 88, train_loss: 0.3441, test_loss: 0.9391, test_f1: 0.6744
 epoch: 89, train_loss: 0.3350, test_loss: 0.9706, test_f1: 0.6299
 epoch: 90, train_loss: 0.3238, test_loss: 1.0277, test_f1: 0.6448
 epoch: 91, train_loss: 0.3403, test_loss: 0.9077, test_f1: 0.6488
 epoch: 92, train_loss: 0.3242, test_loss: 0.9591, test_f1: 0.6834
 epoch: 93, train_loss: 0.3306, test_loss: 0.8929, test_f1: 0.6272
 epoch: 94, train_loss: 0.3007, test_loss: 1.0115, test_f1: 0.6536
 epoch: 95, train_loss: 0.2931, test_loss: 1.0277, test_f1: 0.6581
 epoch: 96, train_loss: 0.3094, test_loss: 1.0148, test_f1: 0.6300
 epoch: 97, train_loss: 0.3557, test_loss: 1.0123, test_f1: 0.6369
 epoch: 98, train_loss: 0.3125, test_loss: 1.1116, test_f1: 0.6324
 epoch: 99, train_loss: 0.3314, test_loss: 0.9275, test_f1: 0.6558
##################ITERATION #5 ****************************************
 epoch: 0, train_loss: 1.3324, test_loss: 1.2198, test_f1: 0.3217
 epoch: 1, train_loss: 1.0106, test_loss: 1.0479, test_f1: 0.4467
 epoch: 2, train_loss: 0.9519, test_loss: 0.9601, test_f1: 0.4781
 epoch: 3, train_loss: 0.9445, test_loss: 0.9238, test_f1: 0.4925
 epoch: 4, train_loss: 0.9291, test_loss: 0.9229, test_f1: 0.4964
 epoch: 5, train_loss: 0.9183, test_loss: 1.0741, test_f1: 0.4686
 epoch: 6, train_loss: 0.8997, test_loss: 1.1908, test_f1: 0.4533
 epoch: 7, train_loss: 0.8877, test_loss: 0.9557, test_f1: 0.5060
 epoch: 8, train_loss: 0.8598, test_loss: 0.9306, test_f1: 0.5118
 epoch: 9, train_loss: 0.8429, test_loss: 0.9313, test_f1: 0.5228
 epoch: 10, train_loss: 0.8275, test_loss: 0.9338, test_f1: 0.5346
 epoch: 11, train_loss: 0.8191, test_loss: 0.8007, test_f1: 0.5744
 epoch: 12, train_loss: 0.8005, test_loss: 0.8539, test_f1: 0.5479
 epoch: 13, train_loss: 0.7966, test_loss: 0.8226, test_f1: 0.5854
 epoch: 14, train_loss: 0.7912, test_loss: 0.8756, test_f1: 0.5437
 epoch: 15, train_loss: 0.7531, test_loss: 0.9737, test_f1: 0.5501
 epoch: 16, train_loss: 0.7749, test_loss: 0.8516, test_f1: 0.5745
 epoch: 17, train_loss: 0.7636, test_loss: 0.9356, test_f1: 0.5399
 epoch: 18, train_loss: 0.7310, test_loss: 0.7887, test_f1: 0.6031
 epoch: 19, train_loss: 0.7241, test_loss: 0.8077, test_f1: 0.6146
 epoch: 20, train_loss: 0.7111, test_loss: 0.7891, test_f1: 0.6260
 epoch: 21, train_loss: 0.7079, test_loss: 0.8249, test_f1: 0.5905
 epoch: 22, train_loss: 0.7162, test_loss: 1.0691, test_f1: 0.5355
 epoch: 23, train_loss: 0.7032, test_loss: 0.8532, test_f1: 0.5798
 epoch: 24, train_loss: 0.6970, test_loss: 0.9099, test_f1: 0.5879
 epoch: 25, train_loss: 0.6758, test_loss: 0.8054, test_f1: 0.5896
 epoch: 26, train_loss: 0.6660, test_loss: 1.2116, test_f1: 0.2776
 epoch: 27, train_loss: 0.6622, test_loss: 0.8467, test_f1: 0.6257
 epoch: 28, train_loss: 0.6597, test_loss: 0.8891, test_f1: 0.6106
 epoch: 29, train_loss: 0.6439, test_loss: 0.9707, test_f1: 0.5924
 epoch: 30, train_loss: 0.6456, test_loss: 0.9539, test_f1: 0.5525
 epoch: 31, train_loss: 0.6298, test_loss: 0.8476, test_f1: 0.6246
 epoch: 32, train_loss: 0.6391, test_loss: 0.9962, test_f1: 0.5667
 epoch: 33, train_loss: 0.6367, test_loss: 0.8843, test_f1: 0.6065
 epoch: 34, train_loss: 0.6049, test_loss: 0.9278, test_f1: 0.6302
 epoch: 35, train_loss: 0.6342, test_loss: 0.9113, test_f1: 0.6012
 epoch: 36, train_loss: 0.6281, test_loss: 0.8671, test_f1: 0.5863
 epoch: 37, train_loss: 0.6152, test_loss: 0.8103, test_f1: 0.6421
 epoch: 38, train_loss: 0.5982, test_loss: 1.0463, test_f1: 0.5788
 epoch: 39, train_loss: 0.6055, test_loss: 0.8474, test_f1: 0.6012
 epoch: 40, train_loss: 0.5994, test_loss: 0.9429, test_f1: 0.6276
 epoch: 41, train_loss: 0.5966, test_loss: 0.9549, test_f1: 0.6449
 epoch: 42, train_loss: 0.5795, test_loss: 0.9145, test_f1: 0.6291
 epoch: 43, train_loss: 0.5854, test_loss: 0.9505, test_f1: 0.6482
 epoch: 44, train_loss: 0.5897, test_loss: 0.8175, test_f1: 0.6180
 epoch: 45, train_loss: 0.5666, test_loss: 0.8105, test_f1: 0.6567
 epoch: 46, train_loss: 0.5579, test_loss: 1.0685, test_f1: 0.5536
 epoch: 47, train_loss: 0.5785, test_loss: 0.7977, test_f1: 0.6328
 epoch: 48, train_loss: 0.5670, test_loss: 0.9494, test_f1: 0.6214
 epoch: 49, train_loss: 0.5536, test_loss: 1.0192, test_f1: 0.6429
 epoch: 50, train_loss: 0.5288, test_loss: 0.8200, test_f1: 0.6504
 epoch: 51, train_loss: 0.4981, test_loss: 0.8860, test_f1: 0.6721
 epoch: 52, train_loss: 0.4758, test_loss: 0.8802, test_f1: 0.6726
 epoch: 53, train_loss: 0.4768, test_loss: 0.9959, test_f1: 0.6810
 epoch: 54, train_loss: 0.4554, test_loss: 0.8804, test_f1: 0.6919
 epoch: 55, train_loss: 0.4280, test_loss: 0.9861, test_f1: 0.6631
 epoch: 56, train_loss: 0.4276, test_loss: 1.0511, test_f1: 0.6723
 epoch: 57, train_loss: 0.4273, test_loss: 0.9345, test_f1: 0.6677
 epoch: 58, train_loss: 0.4334, test_loss: 0.9932, test_f1: 0.6652
 epoch: 59, train_loss: 0.4372, test_loss: 0.9774, test_f1: 0.6817
 epoch: 60, train_loss: 0.4082, test_loss: 1.0407, test_f1: 0.6586
 epoch: 61, train_loss: 0.4252, test_loss: 1.1300, test_f1: 0.6663
 epoch: 62, train_loss: 0.4137, test_loss: 0.9507, test_f1: 0.6706
 epoch: 63, train_loss: 0.4207, test_loss: 1.0196, test_f1: 0.6794
 epoch: 64, train_loss: 0.4137, test_loss: 1.1093, test_f1: 0.6752
 epoch: 65, train_loss: 0.4189, test_loss: 1.0448, test_f1: 0.6707
 epoch: 66, train_loss: 0.4112, test_loss: 1.0448, test_f1: 0.6954
 epoch: 67, train_loss: 0.3857, test_loss: 1.0613, test_f1: 0.6775
 epoch: 68, train_loss: 0.3906, test_loss: 1.1297, test_f1: 0.6792
 epoch: 69, train_loss: 0.3853, test_loss: 1.1322, test_f1: 0.6699
 epoch: 70, train_loss: 0.3844, test_loss: 1.2743, test_f1: 0.6850
 epoch: 71, train_loss: 0.3775, test_loss: 1.1859, test_f1: 0.6720
 epoch: 72, train_loss: 0.3815, test_loss: 1.0945, test_f1: 0.6559
 epoch: 73, train_loss: 0.3605, test_loss: 1.3499, test_f1: 0.6845
 epoch: 74, train_loss: 0.3609, test_loss: 1.1453, test_f1: 0.6718
 epoch: 75, train_loss: 0.3748, test_loss: 1.0879, test_f1: 0.7121
 epoch: 76, train_loss: 0.3915, test_loss: 0.9766, test_f1: 0.6761
 epoch: 77, train_loss: 0.3793, test_loss: 1.0746, test_f1: 0.6849
 epoch: 78, train_loss: 0.3601, test_loss: 1.1978, test_f1: 0.6772
 epoch: 79, train_loss: 0.3565, test_loss: 1.2213, test_f1: 0.7003
 epoch: 80, train_loss: 0.3531, test_loss: 1.2301, test_f1: 0.6770
 epoch: 81, train_loss: 0.3488, test_loss: 1.1973, test_f1: 0.6596
 epoch: 82, train_loss: 0.3681, test_loss: 1.1811, test_f1: 0.6482
 epoch: 83, train_loss: 0.3459, test_loss: 1.1902, test_f1: 0.6691
 epoch: 84, train_loss: 0.3495, test_loss: 1.2351, test_f1: 0.6678
 epoch: 85, train_loss: 0.3556, test_loss: 1.2361, test_f1: 0.6379
 epoch: 86, train_loss: 0.3427, test_loss: 1.3279, test_f1: 0.6750
 epoch: 87, train_loss: 0.3417, test_loss: 1.2800, test_f1: 0.6644
 epoch: 88, train_loss: 0.3312, test_loss: 1.2872, test_f1: 0.6273
 epoch: 89, train_loss: 0.3255, test_loss: 1.2702, test_f1: 0.6557
 epoch: 90, train_loss: 0.3160, test_loss: 1.3711, test_f1: 0.6466
 epoch: 91, train_loss: 0.3276, test_loss: 1.3446, test_f1: 0.6521
 epoch: 92, train_loss: 0.3211, test_loss: 1.4229, test_f1: 0.6255
 epoch: 93, train_loss: 0.3183, test_loss: 1.6260, test_f1: 0.6260
 epoch: 94, train_loss: 0.3171, test_loss: 1.2315, test_f1: 0.6690
 epoch: 95, train_loss: 0.3233, test_loss: 1.4664, test_f1: 0.6675
 epoch: 96, train_loss: 0.3471, test_loss: 1.3116, test_f1: 0.6732
 epoch: 97, train_loss: 0.3021, test_loss: 1.2898, test_f1: 0.6499
 epoch: 98, train_loss: 0.3091, test_loss: 1.6581, test_f1: 0.6231
 epoch: 99, train_loss: 0.3097, test_loss: 1.5166, test_f1: 0.6468
##################ITERATION #6 ****************************************
 epoch: 0, train_loss: 1.3332, test_loss: 1.4193, test_f1: 0.3565
 epoch: 1, train_loss: 1.0046, test_loss: 1.0328, test_f1: 0.5091
 epoch: 2, train_loss: 0.9644, test_loss: 0.9190, test_f1: 0.5284
 epoch: 3, train_loss: 0.9389, test_loss: 0.8908, test_f1: 0.5173
 epoch: 4, train_loss: 0.9208, test_loss: 0.9038, test_f1: 0.5118
 epoch: 5, train_loss: 0.9110, test_loss: 1.0920, test_f1: 0.4715
 epoch: 6, train_loss: 0.9201, test_loss: 0.8982, test_f1: 0.5413
 epoch: 7, train_loss: 0.8669, test_loss: 1.0323, test_f1: 0.5019
 epoch: 8, train_loss: 0.8609, test_loss: 0.8825, test_f1: 0.5198
 epoch: 9, train_loss: 0.8272, test_loss: 0.8869, test_f1: 0.5473
 epoch: 10, train_loss: 0.8194, test_loss: 0.8698, test_f1: 0.5429
 epoch: 11, train_loss: 0.7961, test_loss: 1.0192, test_f1: 0.5090
 epoch: 12, train_loss: 0.7975, test_loss: 0.8158, test_f1: 0.5814
 epoch: 13, train_loss: 0.7774, test_loss: 0.9112, test_f1: 0.5432
 epoch: 14, train_loss: 0.7584, test_loss: 0.8631, test_f1: 0.6026
 epoch: 15, train_loss: 0.7731, test_loss: 0.8003, test_f1: 0.5963
 epoch: 16, train_loss: 0.7560, test_loss: 0.9391, test_f1: 0.5732
 epoch: 17, train_loss: 0.7524, test_loss: 0.8213, test_f1: 0.5475
 epoch: 18, train_loss: 0.7333, test_loss: 0.8122, test_f1: 0.5924
 epoch: 19, train_loss: 0.7238, test_loss: 0.8333, test_f1: 0.5878
 epoch: 20, train_loss: 0.7223, test_loss: 0.9483, test_f1: 0.5519
 epoch: 21, train_loss: 0.7147, test_loss: 0.9024, test_f1: 0.5553
 epoch: 22, train_loss: 0.7009, test_loss: 0.8430, test_f1: 0.6169
 epoch: 23, train_loss: 0.7047, test_loss: 0.7460, test_f1: 0.6078
 epoch: 24, train_loss: 0.6797, test_loss: 0.9758, test_f1: 0.5405
 epoch: 25, train_loss: 0.6860, test_loss: 0.8300, test_f1: 0.5961
 epoch: 26, train_loss: 0.7023, test_loss: 0.9480, test_f1: 0.5641
 epoch: 27, train_loss: 0.7180, test_loss: 0.8981, test_f1: 0.5796
 epoch: 28, train_loss: 0.6914, test_loss: 0.8791, test_f1: 0.5384
 epoch: 29, train_loss: 0.6874, test_loss: 0.8079, test_f1: 0.5954
 epoch: 30, train_loss: 0.6632, test_loss: 0.8814, test_f1: 0.5750
 epoch: 31, train_loss: 0.6648, test_loss: 0.8432, test_f1: 0.5533
 epoch: 32, train_loss: 0.6725, test_loss: 0.8673, test_f1: 0.6010
 epoch: 33, train_loss: 0.6688, test_loss: 0.9615, test_f1: 0.6033
 epoch: 34, train_loss: 0.6415, test_loss: 0.8631, test_f1: 0.6020
 epoch: 35, train_loss: 0.6503, test_loss: 0.7238, test_f1: 0.6198
 epoch: 36, train_loss: 0.6414, test_loss: 0.8532, test_f1: 0.5969
 epoch: 37, train_loss: 0.6461, test_loss: 0.8226, test_f1: 0.6085
 epoch: 38, train_loss: 0.6300, test_loss: 0.7696, test_f1: 0.6348
 epoch: 39, train_loss: 0.6333, test_loss: 0.9424, test_f1: 0.5825
 epoch: 40, train_loss: 0.5982, test_loss: 0.7186, test_f1: 0.6782
 epoch: 41, train_loss: 0.6105, test_loss: 0.8948, test_f1: 0.5990
 epoch: 42, train_loss: 0.5963, test_loss: 0.7996, test_f1: 0.5823
 epoch: 43, train_loss: 0.5814, test_loss: 0.9583, test_f1: 0.5770
 epoch: 44, train_loss: 0.5823, test_loss: 0.7612, test_f1: 0.6372
 epoch: 45, train_loss: 0.5927, test_loss: 0.8649, test_f1: 0.5991
 epoch: 46, train_loss: 0.5930, test_loss: 0.8095, test_f1: 0.6707
 epoch: 47, train_loss: 0.5794, test_loss: 0.8448, test_f1: 0.5973
 epoch: 48, train_loss: 0.5975, test_loss: 0.7953, test_f1: 0.6437
 epoch: 49, train_loss: 0.5767, test_loss: 0.7622, test_f1: 0.6167
 epoch: 50, train_loss: 0.5868, test_loss: 0.8480, test_f1: 0.5960
 epoch: 51, train_loss: 0.5405, test_loss: 0.8160, test_f1: 0.6174
 epoch: 52, train_loss: 0.5016, test_loss: 0.7777, test_f1: 0.6231
 epoch: 53, train_loss: 0.5033, test_loss: 0.7877, test_f1: 0.6556
 epoch: 54, train_loss: 0.5122, test_loss: 0.8195, test_f1: 0.6510
 epoch: 55, train_loss: 0.4876, test_loss: 0.7611, test_f1: 0.6283
 epoch: 56, train_loss: 0.4764, test_loss: 0.8015, test_f1: 0.6518
 epoch: 57, train_loss: 0.4634, test_loss: 0.8330, test_f1: 0.6564
 epoch: 58, train_loss: 0.4394, test_loss: 0.8299, test_f1: 0.6447
 epoch: 59, train_loss: 0.4491, test_loss: 0.8271, test_f1: 0.6295
 epoch: 60, train_loss: 0.4758, test_loss: 0.8191, test_f1: 0.6300
 epoch: 61, train_loss: 0.4631, test_loss: 0.7881, test_f1: 0.6226
 epoch: 62, train_loss: 0.4532, test_loss: 0.7761, test_f1: 0.6264
 epoch: 63, train_loss: 0.4539, test_loss: 0.7615, test_f1: 0.6452
 epoch: 64, train_loss: 0.4249, test_loss: 0.7588, test_f1: 0.6544
 epoch: 65, train_loss: 0.4174, test_loss: 0.8843, test_f1: 0.6488
 epoch: 66, train_loss: 0.4180, test_loss: 0.8822, test_f1: 0.5973
 epoch: 67, train_loss: 0.4216, test_loss: 0.8275, test_f1: 0.6447
 epoch: 68, train_loss: 0.4268, test_loss: 0.9260, test_f1: 0.6290
 epoch: 69, train_loss: 0.4604, test_loss: 0.8703, test_f1: 0.6672
 epoch: 70, train_loss: 0.4340, test_loss: 0.8317, test_f1: 0.6674
 epoch: 71, train_loss: 0.4181, test_loss: 0.9340, test_f1: 0.6399
 epoch: 72, train_loss: 0.4124, test_loss: 0.8332, test_f1: 0.6553
 epoch: 73, train_loss: 0.4104, test_loss: 0.8573, test_f1: 0.6151
 epoch: 74, train_loss: 0.4290, test_loss: 0.8790, test_f1: 0.6527
 epoch: 75, train_loss: 0.4309, test_loss: 0.8833, test_f1: 0.6348
 epoch: 76, train_loss: 0.4159, test_loss: 0.9129, test_f1: 0.6580
 epoch: 77, train_loss: 0.4230, test_loss: 0.8423, test_f1: 0.6684
 epoch: 78, train_loss: 0.3962, test_loss: 0.8353, test_f1: 0.6372
 epoch: 79, train_loss: 0.4384, test_loss: 0.9733, test_f1: 0.6519
 epoch: 80, train_loss: 0.3990, test_loss: 0.9138, test_f1: 0.6551
 epoch: 81, train_loss: 0.3990, test_loss: 0.8966, test_f1: 0.6637
 epoch: 82, train_loss: 0.3979, test_loss: 1.5653, test_f1: 0.5648
 epoch: 83, train_loss: 0.4119, test_loss: 0.9347, test_f1: 0.6334
 epoch: 84, train_loss: 0.3845, test_loss: 1.0875, test_f1: 0.6521
 epoch: 85, train_loss: 0.3899, test_loss: 1.0541, test_f1: 0.6650
 epoch: 86, train_loss: 0.4166, test_loss: 0.8574, test_f1: 0.6652
 epoch: 87, train_loss: 0.3805, test_loss: 1.0243, test_f1: 0.6577
 epoch: 88, train_loss: 0.3573, test_loss: 0.8965, test_f1: 0.6680
 epoch: 89, train_loss: 0.3636, test_loss: 1.0284, test_f1: 0.5870
 epoch: 90, train_loss: 0.3582, test_loss: 0.8801, test_f1: 0.6463
 epoch: 91, train_loss: 0.3747, test_loss: 1.0066, test_f1: 0.6576
 epoch: 92, train_loss: 0.3702, test_loss: 0.9903, test_f1: 0.6559
 epoch: 93, train_loss: 0.3599, test_loss: 0.9245, test_f1: 0.6591
 epoch: 94, train_loss: 0.3665, test_loss: 0.9564, test_f1: 0.6333
 epoch: 95, train_loss: 0.3365, test_loss: 0.9456, test_f1: 0.6317
 epoch: 96, train_loss: 0.3592, test_loss: 0.9623, test_f1: 0.6419
 epoch: 97, train_loss: 0.3627, test_loss: 1.1168, test_f1: 0.6647
 epoch: 98, train_loss: 0.3470, test_loss: 1.0522, test_f1: 0.6037
 epoch: 99, train_loss: 0.3299, test_loss: 1.1491, test_f1: 0.6239
##################ITERATION #7 ****************************************
 epoch: 0, train_loss: 1.3153, test_loss: 1.2295, test_f1: 0.3409
 epoch: 1, train_loss: 1.0027, test_loss: 1.0752, test_f1: 0.4641
 epoch: 2, train_loss: 0.9668, test_loss: 1.0914, test_f1: 0.4330
 epoch: 3, train_loss: 0.9381, test_loss: 1.1003, test_f1: 0.4686
 epoch: 4, train_loss: 0.9126, test_loss: 0.9748, test_f1: 0.5363
 epoch: 5, train_loss: 0.8851, test_loss: 0.9799, test_f1: 0.4921
 epoch: 6, train_loss: 0.8658, test_loss: 0.8837, test_f1: 0.5306
 epoch: 7, train_loss: 0.8520, test_loss: 0.9566, test_f1: 0.4981
 epoch: 8, train_loss: 0.8488, test_loss: 0.9864, test_f1: 0.5589
 epoch: 9, train_loss: 0.8220, test_loss: 0.9289, test_f1: 0.5169
 epoch: 10, train_loss: 0.7989, test_loss: 1.5206, test_f1: 0.4100
 epoch: 11, train_loss: 0.8015, test_loss: 0.9352, test_f1: 0.5745
 epoch: 12, train_loss: 0.7701, test_loss: 0.8659, test_f1: 0.5627
 epoch: 13, train_loss: 0.7739, test_loss: 0.9096, test_f1: 0.5948
 epoch: 14, train_loss: 0.7430, test_loss: 0.8798, test_f1: 0.5654
 epoch: 15, train_loss: 0.7544, test_loss: 0.8484, test_f1: 0.5460
 epoch: 16, train_loss: 0.7260, test_loss: 0.9940, test_f1: 0.5495
 epoch: 17, train_loss: 0.7353, test_loss: 0.7939, test_f1: 0.6264
 epoch: 18, train_loss: 0.7390, test_loss: 0.8168, test_f1: 0.5642
 epoch: 19, train_loss: 0.6998, test_loss: 1.0760, test_f1: 0.5390
 epoch: 20, train_loss: 0.6889, test_loss: 0.9188, test_f1: 0.6048
 epoch: 21, train_loss: 0.7005, test_loss: 1.1641, test_f1: 0.4846
 epoch: 22, train_loss: 0.6978, test_loss: 1.1109, test_f1: 0.5626
 epoch: 23, train_loss: 0.6856, test_loss: 0.8446, test_f1: 0.5894
 epoch: 24, train_loss: 0.6654, test_loss: 1.3000, test_f1: 0.6087
 epoch: 25, train_loss: 0.6623, test_loss: 0.8819, test_f1: 0.5921
 epoch: 26, train_loss: 0.6391, test_loss: 1.0488, test_f1: 0.5687
 epoch: 27, train_loss: 0.6433, test_loss: 0.9296, test_f1: 0.6248
 epoch: 28, train_loss: 0.6480, test_loss: 1.0795, test_f1: 0.5946
 epoch: 29, train_loss: 0.6507, test_loss: 0.9000, test_f1: 0.5655
 epoch: 30, train_loss: 0.6298, test_loss: 1.0836, test_f1: 0.6119
 epoch: 31, train_loss: 0.6395, test_loss: 0.7895, test_f1: 0.6221
 epoch: 32, train_loss: 0.6278, test_loss: 1.0178, test_f1: 0.6291
 epoch: 33, train_loss: 0.6388, test_loss: 0.8481, test_f1: 0.5851
 epoch: 34, train_loss: 0.6169, test_loss: 0.8036, test_f1: 0.6158
 epoch: 35, train_loss: 0.6146, test_loss: 0.8567, test_f1: 0.6392
 epoch: 36, train_loss: 0.6124, test_loss: 1.0112, test_f1: 0.5866
 epoch: 37, train_loss: 0.6246, test_loss: 0.9117, test_f1: 0.6326
 epoch: 38, train_loss: 0.6159, test_loss: 0.8698, test_f1: 0.6042
 epoch: 39, train_loss: 0.5989, test_loss: 0.8611, test_f1: 0.6364
 epoch: 40, train_loss: 0.5815, test_loss: 0.8640, test_f1: 0.6025
 epoch: 41, train_loss: 0.5739, test_loss: 1.0241, test_f1: 0.5737
 epoch: 42, train_loss: 0.5937, test_loss: 0.9287, test_f1: 0.5896
 epoch: 43, train_loss: 0.5681, test_loss: 0.9231, test_f1: 0.6279
 epoch: 44, train_loss: 0.5614, test_loss: 0.9195, test_f1: 0.6627
 epoch: 45, train_loss: 0.5802, test_loss: 1.0099, test_f1: 0.6483
 epoch: 46, train_loss: 0.5672, test_loss: 1.0244, test_f1: 0.6311
 epoch: 47, train_loss: 0.5632, test_loss: 0.8135, test_f1: 0.6494
 epoch: 48, train_loss: 0.5525, test_loss: 0.8740, test_f1: 0.6012
 epoch: 49, train_loss: 0.5201, test_loss: 0.8284, test_f1: 0.6555
 epoch: 50, train_loss: 0.5334, test_loss: 0.9262, test_f1: 0.6239
 epoch: 51, train_loss: 0.5057, test_loss: 0.9172, test_f1: 0.6304
 epoch: 52, train_loss: 0.4711, test_loss: 0.9443, test_f1: 0.6879
 epoch: 53, train_loss: 0.4336, test_loss: 0.9700, test_f1: 0.6702
 epoch: 54, train_loss: 0.4341, test_loss: 0.9890, test_f1: 0.6706
 epoch: 55, train_loss: 0.4316, test_loss: 1.1764, test_f1: 0.6312
 epoch: 56, train_loss: 0.4442, test_loss: 1.0255, test_f1: 0.6479
 epoch: 57, train_loss: 0.4155, test_loss: 1.0788, test_f1: 0.6759
 epoch: 58, train_loss: 0.4557, test_loss: 1.0193, test_f1: 0.6583
 epoch: 59, train_loss: 0.4364, test_loss: 1.1682, test_f1: 0.6491
 epoch: 60, train_loss: 0.4246, test_loss: 1.1788, test_f1: 0.6538
 epoch: 61, train_loss: 0.4190, test_loss: 1.0857, test_f1: 0.6158
 epoch: 62, train_loss: 0.4327, test_loss: 0.9907, test_f1: 0.6549
 epoch: 63, train_loss: 0.4198, test_loss: 1.1563, test_f1: 0.6504
 epoch: 64, train_loss: 0.3889, test_loss: 1.0673, test_f1: 0.6697
 epoch: 65, train_loss: 0.3904, test_loss: 1.0738, test_f1: 0.6566
 epoch: 66, train_loss: 0.4040, test_loss: 0.9262, test_f1: 0.6630
 epoch: 67, train_loss: 0.3902, test_loss: 1.0405, test_f1: 0.6470
 epoch: 68, train_loss: 0.4106, test_loss: 0.9940, test_f1: 0.6583
 epoch: 69, train_loss: 0.3737, test_loss: 1.1015, test_f1: 0.6357
 epoch: 70, train_loss: 0.3980, test_loss: 1.0248, test_f1: 0.6634
 epoch: 71, train_loss: 0.3812, test_loss: 1.1224, test_f1: 0.6596
 epoch: 72, train_loss: 0.3988, test_loss: 1.2605, test_f1: 0.6515
 epoch: 73, train_loss: 0.3826, test_loss: 1.0730, test_f1: 0.6734
 epoch: 74, train_loss: 0.3785, test_loss: 1.0598, test_f1: 0.6555
 epoch: 75, train_loss: 0.3601, test_loss: 1.0976, test_f1: 0.6471
 epoch: 76, train_loss: 0.3659, test_loss: 0.9942, test_f1: 0.6713
 epoch: 77, train_loss: 0.3800, test_loss: 0.8858, test_f1: 0.6608
 epoch: 78, train_loss: 0.3669, test_loss: 0.9590, test_f1: 0.6557
 epoch: 79, train_loss: 0.3424, test_loss: 1.0760, test_f1: 0.6591
 epoch: 80, train_loss: 0.3421, test_loss: 0.9195, test_f1: 0.6675
 epoch: 81, train_loss: 0.3355, test_loss: 1.0117, test_f1: 0.6510
 epoch: 82, train_loss: 0.3192, test_loss: 1.1248, test_f1: 0.6471
 epoch: 83, train_loss: 0.3409, test_loss: 0.9688, test_f1: 0.6490
 epoch: 84, train_loss: 0.3692, test_loss: 0.9660, test_f1: 0.6447
 epoch: 85, train_loss: 0.3645, test_loss: 1.0371, test_f1: 0.6235
 epoch: 86, train_loss: 0.3514, test_loss: 1.1037, test_f1: 0.6715
 epoch: 87, train_loss: 0.3478, test_loss: 1.1552, test_f1: 0.6600
 epoch: 88, train_loss: 0.3468, test_loss: 1.0486, test_f1: 0.6371
 epoch: 89, train_loss: 0.3209, test_loss: 1.4361, test_f1: 0.6351
 epoch: 90, train_loss: 0.3107, test_loss: 1.2154, test_f1: 0.6331
 epoch: 91, train_loss: 0.3113, test_loss: 1.2565, test_f1: 0.6529
 epoch: 92, train_loss: 0.3039, test_loss: 1.2043, test_f1: 0.6532
 epoch: 93, train_loss: 0.2883, test_loss: 1.2677, test_f1: 0.6104
 epoch: 94, train_loss: 0.3036, test_loss: 1.4287, test_f1: 0.6518
 epoch: 95, train_loss: 0.3170, test_loss: 1.3447, test_f1: 0.6605
 epoch: 96, train_loss: 0.3199, test_loss: 1.2168, test_f1: 0.6672
 epoch: 97, train_loss: 0.2874, test_loss: 1.3269, test_f1: 0.6487
 epoch: 98, train_loss: 0.2889, test_loss: 1.3875, test_f1: 0.6579
 epoch: 99, train_loss: 0.2996, test_loss: 1.1736, test_f1: 0.6574
##################ITERATION #8 ****************************************
 epoch: 0, train_loss: 1.2491, test_loss: 1.3926, test_f1: 0.3490
 epoch: 1, train_loss: 0.9800, test_loss: 0.9560, test_f1: 0.4488
 epoch: 2, train_loss: 0.9381, test_loss: 0.9522, test_f1: 0.4833
 epoch: 3, train_loss: 0.9341, test_loss: 1.0097, test_f1: 0.4537
 epoch: 4, train_loss: 0.9134, test_loss: 0.9328, test_f1: 0.4925
 epoch: 5, train_loss: 0.9173, test_loss: 0.9795, test_f1: 0.5542
 epoch: 6, train_loss: 0.8777, test_loss: 0.9234, test_f1: 0.5113
 epoch: 7, train_loss: 0.8534, test_loss: 0.9657, test_f1: 0.5762
 epoch: 8, train_loss: 0.8360, test_loss: 0.8949, test_f1: 0.5100
 epoch: 9, train_loss: 0.8200, test_loss: 0.9366, test_f1: 0.5321
 epoch: 10, train_loss: 0.8233, test_loss: 0.8140, test_f1: 0.5854
 epoch: 11, train_loss: 0.7953, test_loss: 0.8909, test_f1: 0.5529
 epoch: 12, train_loss: 0.7945, test_loss: 0.8337, test_f1: 0.5873
 epoch: 13, train_loss: 0.7879, test_loss: 0.8421, test_f1: 0.5802
 epoch: 14, train_loss: 0.7574, test_loss: 0.8987, test_f1: 0.5086
 epoch: 15, train_loss: 0.7649, test_loss: 0.7974, test_f1: 0.5955
 epoch: 16, train_loss: 0.7507, test_loss: 0.8206, test_f1: 0.5900
 epoch: 17, train_loss: 0.7280, test_loss: 0.7785, test_f1: 0.5675
 epoch: 18, train_loss: 0.7125, test_loss: 0.9298, test_f1: 0.5827
 epoch: 19, train_loss: 0.7173, test_loss: 0.7356, test_f1: 0.6499
 epoch: 20, train_loss: 0.7324, test_loss: 1.4459, test_f1: 0.4304
 epoch: 21, train_loss: 0.7405, test_loss: 0.8049, test_f1: 0.5825
 epoch: 22, train_loss: 0.7227, test_loss: 0.9656, test_f1: 0.5286
 epoch: 23, train_loss: 0.6855, test_loss: 0.8205, test_f1: 0.6121
 epoch: 24, train_loss: 0.7080, test_loss: 0.9595, test_f1: 0.5185
 epoch: 25, train_loss: 0.7116, test_loss: 0.9285, test_f1: 0.5849
 epoch: 26, train_loss: 0.7156, test_loss: 0.9233, test_f1: 0.5476
 epoch: 27, train_loss: 0.7217, test_loss: 1.0075, test_f1: 0.4891
 epoch: 28, train_loss: 0.7249, test_loss: 0.8569, test_f1: 0.5898
 epoch: 29, train_loss: 0.6972, test_loss: 0.7825, test_f1: 0.6171
 epoch: 30, train_loss: 0.6755, test_loss: 0.7753, test_f1: 0.6387
 epoch: 31, train_loss: 0.6539, test_loss: 0.7677, test_f1: 0.6434
 epoch: 32, train_loss: 0.6348, test_loss: 0.7713, test_f1: 0.6169
 epoch: 33, train_loss: 0.6312, test_loss: 0.8690, test_f1: 0.5837
 epoch: 34, train_loss: 0.6464, test_loss: 0.9211, test_f1: 0.5599
 epoch: 35, train_loss: 0.6313, test_loss: 0.7638, test_f1: 0.6141
 epoch: 36, train_loss: 0.6102, test_loss: 0.8026, test_f1: 0.6056
 epoch: 37, train_loss: 0.6272, test_loss: 0.7581, test_f1: 0.6519
 epoch: 38, train_loss: 0.5970, test_loss: 0.7730, test_f1: 0.6430
 epoch: 39, train_loss: 0.6223, test_loss: 0.8313, test_f1: 0.6218
 epoch: 40, train_loss: 0.6075, test_loss: 0.8804, test_f1: 0.6130
 epoch: 41, train_loss: 0.6030, test_loss: 0.8162, test_f1: 0.6484
 epoch: 42, train_loss: 0.5793, test_loss: 0.7926, test_f1: 0.6471
 epoch: 43, train_loss: 0.5846, test_loss: 0.8558, test_f1: 0.6118
 epoch: 44, train_loss: 0.5840, test_loss: 0.8586, test_f1: 0.6239
 epoch: 45, train_loss: 0.6069, test_loss: 0.8577, test_f1: 0.6205
 epoch: 46, train_loss: 0.5938, test_loss: 0.7774, test_f1: 0.6565
 epoch: 47, train_loss: 0.5752, test_loss: 0.8383, test_f1: 0.6330
 epoch: 48, train_loss: 0.5580, test_loss: 0.8760, test_f1: 0.5810
 epoch: 49, train_loss: 0.5454, test_loss: 0.8673, test_f1: 0.6492
 epoch: 50, train_loss: 0.5428, test_loss: 0.8313, test_f1: 0.6405
 epoch: 51, train_loss: 0.5275, test_loss: 0.8766, test_f1: 0.6351
 epoch: 52, train_loss: 0.4777, test_loss: 0.8181, test_f1: 0.6585
 epoch: 53, train_loss: 0.4596, test_loss: 0.8277, test_f1: 0.6677
 epoch: 54, train_loss: 0.4694, test_loss: 0.9840, test_f1: 0.6275
 epoch: 55, train_loss: 0.4556, test_loss: 0.8240, test_f1: 0.6634
 epoch: 56, train_loss: 0.4632, test_loss: 0.9956, test_f1: 0.6198
 epoch: 57, train_loss: 0.4507, test_loss: 0.8243, test_f1: 0.6788
 epoch: 58, train_loss: 0.4603, test_loss: 0.8394, test_f1: 0.6653
 epoch: 59, train_loss: 0.4617, test_loss: 1.0243, test_f1: 0.6417
 epoch: 60, train_loss: 0.4437, test_loss: 1.0415, test_f1: 0.6634
 epoch: 61, train_loss: 0.4477, test_loss: 0.8487, test_f1: 0.6427
 epoch: 62, train_loss: 0.4601, test_loss: 0.8330, test_f1: 0.6821
 epoch: 63, train_loss: 0.4246, test_loss: 0.8382, test_f1: 0.6961
 epoch: 64, train_loss: 0.4279, test_loss: 1.0129, test_f1: 0.6325
 epoch: 65, train_loss: 0.4082, test_loss: 0.8215, test_f1: 0.6919
 epoch: 66, train_loss: 0.4220, test_loss: 0.8337, test_f1: 0.6740
 epoch: 67, train_loss: 0.4089, test_loss: 0.8854, test_f1: 0.6643
 epoch: 68, train_loss: 0.3941, test_loss: 0.9884, test_f1: 0.6574
 epoch: 69, train_loss: 0.4171, test_loss: 1.0316, test_f1: 0.6735
 epoch: 70, train_loss: 0.4017, test_loss: 1.0861, test_f1: 0.6695
 epoch: 71, train_loss: 0.3991, test_loss: 1.1092, test_f1: 0.6767
 epoch: 72, train_loss: 0.4030, test_loss: 1.0394, test_f1: 0.6578
 epoch: 73, train_loss: 0.3956, test_loss: 1.1088, test_f1: 0.6764
 epoch: 74, train_loss: 0.3944, test_loss: 1.0106, test_f1: 0.6574
 epoch: 75, train_loss: 0.3964, test_loss: 0.9707, test_f1: 0.6839
 epoch: 76, train_loss: 0.3626, test_loss: 0.9583, test_f1: 0.6846
 epoch: 77, train_loss: 0.3686, test_loss: 0.9456, test_f1: 0.6513
 epoch: 78, train_loss: 0.3779, test_loss: 1.1133, test_f1: 0.6852
 epoch: 79, train_loss: 0.3885, test_loss: 1.3102, test_f1: 0.6467
 epoch: 80, train_loss: 0.3719, test_loss: 1.0433, test_f1: 0.6243
 epoch: 81, train_loss: 0.3607, test_loss: 1.0068, test_f1: 0.6761
 epoch: 82, train_loss: 0.3761, test_loss: 1.0500, test_f1: 0.6712
 epoch: 83, train_loss: 0.3693, test_loss: 1.2717, test_f1: 0.6541
 epoch: 84, train_loss: 0.3570, test_loss: 1.0936, test_f1: 0.6517
 epoch: 85, train_loss: 0.3627, test_loss: 1.1182, test_f1: 0.6705
 epoch: 86, train_loss: 0.3601, test_loss: 1.1747, test_f1: 0.6643
 epoch: 87, train_loss: 0.3422, test_loss: 1.3617, test_f1: 0.6141
 epoch: 88, train_loss: 0.3562, test_loss: 1.1843, test_f1: 0.6604
 epoch: 89, train_loss: 0.3379, test_loss: 1.2661, test_f1: 0.6141
 epoch: 90, train_loss: 0.3373, test_loss: 1.0694, test_f1: 0.6463
 epoch: 91, train_loss: 0.3591, test_loss: 1.2038, test_f1: 0.6501
 epoch: 92, train_loss: 0.3394, test_loss: 1.0333, test_f1: 0.6558
 epoch: 93, train_loss: 0.3256, test_loss: 1.3116, test_f1: 0.5890
 epoch: 94, train_loss: 0.3330, test_loss: 1.1675, test_f1: 0.6601
 epoch: 95, train_loss: 0.3751, test_loss: 1.1509, test_f1: 0.6926
 epoch: 96, train_loss: 0.3800, test_loss: 1.2152, test_f1: 0.6120
 epoch: 97, train_loss: 0.3449, test_loss: 1.0537, test_f1: 0.6371
 epoch: 98, train_loss: 0.3449, test_loss: 1.0123, test_f1: 0.6737
 epoch: 99, train_loss: 0.3428, test_loss: 0.9571, test_f1: 0.6736
##################ITERATION #9 ****************************************
 epoch: 0, train_loss: 1.3549, test_loss: 1.4106, test_f1: 0.3578
 epoch: 1, train_loss: 0.9960, test_loss: 0.9550, test_f1: 0.4451
 epoch: 2, train_loss: 0.9574, test_loss: 1.0740, test_f1: 0.4874
 epoch: 3, train_loss: 0.9354, test_loss: 0.9481, test_f1: 0.5295
 epoch: 4, train_loss: 0.9051, test_loss: 0.9325, test_f1: 0.4874
 epoch: 5, train_loss: 0.8752, test_loss: 0.8598, test_f1: 0.5486
 epoch: 6, train_loss: 0.8657, test_loss: 0.9965, test_f1: 0.4330
 epoch: 7, train_loss: 0.8602, test_loss: 1.0012, test_f1: 0.5407
 epoch: 8, train_loss: 0.8359, test_loss: 0.8091, test_f1: 0.6153
 epoch: 9, train_loss: 0.7971, test_loss: 0.8532, test_f1: 0.5937
 epoch: 10, train_loss: 0.8096, test_loss: 0.8108, test_f1: 0.5707
 epoch: 11, train_loss: 0.7853, test_loss: 0.7899, test_f1: 0.6206
 epoch: 12, train_loss: 0.7863, test_loss: 0.8942, test_f1: 0.5785
 epoch: 13, train_loss: 0.7732, test_loss: 1.1037, test_f1: 0.5304
 epoch: 14, train_loss: 0.7881, test_loss: 0.9468, test_f1: 0.5616
 epoch: 15, train_loss: 0.7644, test_loss: 0.8458, test_f1: 0.5809
 epoch: 16, train_loss: 0.7672, test_loss: 0.8819, test_f1: 0.6074
 epoch: 17, train_loss: 0.7384, test_loss: 0.8355, test_f1: 0.5956
 epoch: 18, train_loss: 0.7294, test_loss: 1.0720, test_f1: 0.5231
 epoch: 19, train_loss: 0.6949, test_loss: 0.8130, test_f1: 0.5842
 epoch: 20, train_loss: 0.7068, test_loss: 1.0109, test_f1: 0.5844
 epoch: 21, train_loss: 0.7111, test_loss: 1.0309, test_f1: 0.5329
 epoch: 22, train_loss: 0.7045, test_loss: 0.9017, test_f1: 0.5858
 epoch: 23, train_loss: 0.6974, test_loss: 0.9178, test_f1: 0.5772
 epoch: 24, train_loss: 0.7250, test_loss: 0.7418, test_f1: 0.6465
 epoch: 25, train_loss: 0.7059, test_loss: 0.8364, test_f1: 0.6396
 epoch: 26, train_loss: 0.6838, test_loss: 0.8564, test_f1: 0.6051
 epoch: 27, train_loss: 0.6739, test_loss: 0.8973, test_f1: 0.5913
 epoch: 28, train_loss: 0.6810, test_loss: 0.8931, test_f1: 0.5932
 epoch: 29, train_loss: 0.6687, test_loss: 0.8302, test_f1: 0.6323
 epoch: 30, train_loss: 0.6742, test_loss: 0.8322, test_f1: 0.6214
 epoch: 31, train_loss: 0.6541, test_loss: 0.8003, test_f1: 0.6235
 epoch: 32, train_loss: 0.6374, test_loss: 0.7605, test_f1: 0.6458
 epoch: 33, train_loss: 0.6146, test_loss: 0.9264, test_f1: 0.6634
 epoch: 34, train_loss: 0.6308, test_loss: 0.9762, test_f1: 0.5788
 epoch: 35, train_loss: 0.6175, test_loss: 0.8441, test_f1: 0.6158
 epoch: 36, train_loss: 0.6056, test_loss: 0.7617, test_f1: 0.6511
 epoch: 37, train_loss: 0.6293, test_loss: 1.0082, test_f1: 0.6496
 epoch: 38, train_loss: 0.6235, test_loss: 0.8408, test_f1: 0.6267
 epoch: 39, train_loss: 0.6024, test_loss: 0.9059, test_f1: 0.6316
 epoch: 40, train_loss: 0.6314, test_loss: 1.0109, test_f1: 0.6105
 epoch: 41, train_loss: 0.6072, test_loss: 0.8787, test_f1: 0.6651
 epoch: 42, train_loss: 0.6123, test_loss: 0.8003, test_f1: 0.6373
 epoch: 43, train_loss: 0.5892, test_loss: 0.8954, test_f1: 0.6103
 epoch: 44, train_loss: 0.5684, test_loss: 0.8329, test_f1: 0.6296
 epoch: 45, train_loss: 0.5777, test_loss: 0.8601, test_f1: 0.6194
 epoch: 46, train_loss: 0.5559, test_loss: 0.9385, test_f1: 0.5925
 epoch: 47, train_loss: 0.5870, test_loss: 0.9417, test_f1: 0.6440
 epoch: 48, train_loss: 0.5871, test_loss: 0.8437, test_f1: 0.6374
 epoch: 49, train_loss: 0.5706, test_loss: 0.8470, test_f1: 0.6423
 epoch: 50, train_loss: 0.5879, test_loss: 0.9471, test_f1: 0.6228
 epoch: 51, train_loss: 0.5680, test_loss: 0.7533, test_f1: 0.6589
 epoch: 52, train_loss: 0.5091, test_loss: 0.8238, test_f1: 0.6258
 epoch: 53, train_loss: 0.4883, test_loss: 0.8686, test_f1: 0.6532
 epoch: 54, train_loss: 0.4766, test_loss: 0.8859, test_f1: 0.6537
 epoch: 55, train_loss: 0.4746, test_loss: 0.7863, test_f1: 0.6781
 epoch: 56, train_loss: 0.4664, test_loss: 0.8000, test_f1: 0.6661
 epoch: 57, train_loss: 0.4408, test_loss: 0.9667, test_f1: 0.6522
 epoch: 58, train_loss: 0.4645, test_loss: 0.8896, test_f1: 0.6702
 epoch: 59, train_loss: 0.4404, test_loss: 1.1430, test_f1: 0.6525
 epoch: 60, train_loss: 0.4191, test_loss: 1.0688, test_f1: 0.6600
 epoch: 61, train_loss: 0.4604, test_loss: 1.0172, test_f1: 0.6443
 epoch: 62, train_loss: 0.4417, test_loss: 1.0501, test_f1: 0.6539
 epoch: 63, train_loss: 0.4557, test_loss: 0.8825, test_f1: 0.6737
 epoch: 64, train_loss: 0.4157, test_loss: 1.0779, test_f1: 0.6523
 epoch: 65, train_loss: 0.4167, test_loss: 1.0648, test_f1: 0.6590
 epoch: 66, train_loss: 0.4114, test_loss: 0.9283, test_f1: 0.6784
 epoch: 67, train_loss: 0.4335, test_loss: 1.0740, test_f1: 0.6621
 epoch: 68, train_loss: 0.4185, test_loss: 0.9353, test_f1: 0.6704
 epoch: 69, train_loss: 0.4356, test_loss: 0.8275, test_f1: 0.6703
 epoch: 70, train_loss: 0.3894, test_loss: 1.1542, test_f1: 0.6223
 epoch: 71, train_loss: 0.3988, test_loss: 1.0586, test_f1: 0.6638
 epoch: 72, train_loss: 0.4232, test_loss: 1.0649, test_f1: 0.6567
 epoch: 73, train_loss: 0.4035, test_loss: 1.2104, test_f1: 0.6561
 epoch: 74, train_loss: 0.3920, test_loss: 1.1518, test_f1: 0.6651
 epoch: 75, train_loss: 0.3882, test_loss: 0.9405, test_f1: 0.6683
 epoch: 76, train_loss: 0.3833, test_loss: 1.0078, test_f1: 0.6675
 epoch: 77, train_loss: 0.3718, test_loss: 1.1314, test_f1: 0.6621
 epoch: 78, train_loss: 0.3736, test_loss: 1.1279, test_f1: 0.6421
 epoch: 79, train_loss: 0.3811, test_loss: 1.3027, test_f1: 0.6551
 epoch: 80, train_loss: 0.3538, test_loss: 1.1418, test_f1: 0.6557
 epoch: 81, train_loss: 0.3603, test_loss: 1.2509, test_f1: 0.6540
 epoch: 82, train_loss: 0.3672, test_loss: 1.2380, test_f1: 0.6578
 epoch: 83, train_loss: 0.3470, test_loss: 1.3193, test_f1: 0.6401
 epoch: 84, train_loss: 0.3902, test_loss: 1.1257, test_f1: 0.6669
 epoch: 85, train_loss: 0.3553, test_loss: 1.0352, test_f1: 0.6709
 epoch: 86, train_loss: 0.3352, test_loss: 1.1068, test_f1: 0.6556
 epoch: 87, train_loss: 0.3643, test_loss: 1.0869, test_f1: 0.6669
 epoch: 88, train_loss: 0.3646, test_loss: 1.4162, test_f1: 0.6215
 epoch: 89, train_loss: 0.3594, test_loss: 1.2649, test_f1: 0.6558
 epoch: 90, train_loss: 0.3427, test_loss: 1.2482, test_f1: 0.6762
 epoch: 91, train_loss: 0.3290, test_loss: 1.1700, test_f1: 0.6722
 epoch: 92, train_loss: 0.3415, test_loss: 1.6164, test_f1: 0.6259
 epoch: 93, train_loss: 0.3494, test_loss: 1.3067, test_f1: 0.6758
 epoch: 94, train_loss: 0.3341, test_loss: 1.2327, test_f1: 0.6810
 epoch: 95, train_loss: 0.3220, test_loss: 1.3059, test_f1: 0.6258
 epoch: 96, train_loss: 0.3704, test_loss: 1.1885, test_f1: 0.6663
 epoch: 97, train_loss: 0.3705, test_loss: 1.1370, test_f1: 0.6522
 epoch: 98, train_loss: 0.3374, test_loss: 1.2810, test_f1: 0.6641
 epoch: 99, train_loss: 0.3456, test_loss: 1.3085, test_f1: 0.6549

Training completed in 613.76 seconds
Best F1: 0.7237 at epoch 55
Mean F1 across iterations: 0.6937  0.0141
========================FINAL RESULTS================================
FEGIN weighted F1: 0.7237  0.0141
python main.py --data ltspice_examples --representation component_pin_net --model FEGIN --layers 6 --hiddens 128 --batch_size 128 --lr 0.01 --emb_size 250 --epochs 100 --save_appendix component_pin_net_L6_H128_BS128_LR0.01_E250 --no_val
-----



STDERR:
  File "main.py", line 370, in <module>
    main()
  File "main.py", line 254, in main
    dataset = dataset_class(
  File "/home/philip/projects/ltspice_examples_code_repo/Circuit-Completion-Using-GNNs/component_classification_with_link_prediction_head/evaluation/FEGIN/kernel/circuit_datasets.py", line 15, in __init__
    self.data, self.slices = torch.load(self.processed_paths[0])
  File "/home/philip/.local/lib/python3.8/site-packages/torch/serialization.py", line 1040, in load
    warnings.warn(
  File "/usr/lib/python3.8/warnings.py", line 109, in _showwarnmsg
    sw(msg.message, msg.category, msg.filename, msg.lineno,
  File "main.py", line 47, in warn_with_traceback
    traceback.print_stack(file=log)
/home/philip/projects/ltspice_examples_code_repo/Circuit-Completion-Using-GNNs/component_classification_with_link_prediction_head/evaluation/FEGIN/kernel/circuit_datasets.py:15: FutureWarning: You are using `torch.load` with `weights_only=False` (the current default value), which uses the default pickle module implicitly. It is possible to construct malicious pickle data which will execute arbitrary code during unpickling (See https://github.com/pytorch/pytorch/blob/main/SECURITY.md#untrusted-models for more details). In a future release, the default value for `weights_only` will be flipped to `True`. This limits the functions that could be executed during unpickling. Arbitrary objects will no longer be allowed to be loaded via this mode unless they are explicitly allowlisted by the user via `torch.serialization.add_safe_globals`. We recommend you start setting `weights_only=True` for any use case where you don't have full control of the loaded file. Please open an issue on GitHub for any issues related to this experimental feature.
  self.data, self.slices = torch.load(self.processed_paths[0])
