STDOUT:
Results will be saved in /home/philip/projects/llm_inference_code_repo/Circuit-Completion-Using-GNNs/component_classification_with_link_prediction_head/evaluation/FEGIN/results/model_FEGIN_dataset_ltspice_examples
Command line input: python main.py --data ltspice_examples --representation component_pin --model FEGIN --layers 6 --hiddens 32 --batch_size 64 --lr 0.01 --emb_size 250 --epochs 100 --save_appendix component_pin_L6_H32_BS64_LR0.01_E250 --no_val
 is saved.
-----
ltspice_examples - FEGIN
Using 6 layers, 32 hidden units, h = 2
Loading component_pin representation dataset
ENTERED
Training FEGIN on component_pin representation
Train: 3560, Test: 848
##################ITERATION #0 ****************************************
 epoch: 0, train_loss: 1.1887, test_loss: 1.3353, test_f1: 0.2899
 epoch: 1, train_loss: 1.0689, test_loss: 1.2616, test_f1: 0.3251
 epoch: 2, train_loss: 1.0460, test_loss: 1.0812, test_f1: 0.4108
 epoch: 3, train_loss: 1.0136, test_loss: 1.1353, test_f1: 0.4031
 epoch: 4, train_loss: 0.9922, test_loss: 1.0246, test_f1: 0.3923
 epoch: 5, train_loss: 0.9689, test_loss: 0.9927, test_f1: 0.4818
 epoch: 6, train_loss: 0.9635, test_loss: 0.9525, test_f1: 0.5172
 epoch: 7, train_loss: 0.9336, test_loss: 0.9234, test_f1: 0.5060
 epoch: 8, train_loss: 0.9140, test_loss: 0.9965, test_f1: 0.5104
 epoch: 9, train_loss: 0.9053, test_loss: 1.0676, test_f1: 0.4195
 epoch: 10, train_loss: 0.9034, test_loss: 0.9132, test_f1: 0.5385
 epoch: 11, train_loss: 0.8971, test_loss: 1.1552, test_f1: 0.4193
 epoch: 12, train_loss: 0.8793, test_loss: 0.9286, test_f1: 0.4699
 epoch: 13, train_loss: 0.8578, test_loss: 0.8388, test_f1: 0.5270
 epoch: 14, train_loss: 0.8671, test_loss: 0.9086, test_f1: 0.5147
 epoch: 15, train_loss: 0.8464, test_loss: 0.9497, test_f1: 0.4862
 epoch: 16, train_loss: 0.8426, test_loss: 0.8443, test_f1: 0.5384
 epoch: 17, train_loss: 0.8076, test_loss: 0.9025, test_f1: 0.5539
 epoch: 18, train_loss: 0.8059, test_loss: 0.8372, test_f1: 0.5522
 epoch: 19, train_loss: 0.8117, test_loss: 0.8418, test_f1: 0.6073
 epoch: 20, train_loss: 0.8038, test_loss: 0.8246, test_f1: 0.5114
 epoch: 21, train_loss: 0.7971, test_loss: 0.7976, test_f1: 0.5566
 epoch: 22, train_loss: 0.7884, test_loss: 1.3339, test_f1: 0.3892
 epoch: 23, train_loss: 0.8052, test_loss: 0.8330, test_f1: 0.5643
 epoch: 24, train_loss: 0.7813, test_loss: 0.8253, test_f1: 0.5646
 epoch: 25, train_loss: 0.7855, test_loss: 0.8565, test_f1: 0.6142
 epoch: 26, train_loss: 0.7680, test_loss: 0.8498, test_f1: 0.5531
 epoch: 27, train_loss: 0.7643, test_loss: 0.8908, test_f1: 0.5276
 epoch: 28, train_loss: 0.7450, test_loss: 0.8152, test_f1: 0.5736
 epoch: 29, train_loss: 0.7363, test_loss: 0.7997, test_f1: 0.5548
 epoch: 30, train_loss: 0.7452, test_loss: 0.7697, test_f1: 0.5940
 epoch: 31, train_loss: 0.7577, test_loss: 0.7791, test_f1: 0.5848
 epoch: 32, train_loss: 0.7426, test_loss: 0.8544, test_f1: 0.5910
 epoch: 33, train_loss: 0.7516, test_loss: 0.8298, test_f1: 0.5845
 epoch: 34, train_loss: 0.7329, test_loss: 1.0594, test_f1: 0.4870
 epoch: 35, train_loss: 0.7347, test_loss: 0.7878, test_f1: 0.6113
 epoch: 36, train_loss: 0.7316, test_loss: 0.9120, test_f1: 0.5657
 epoch: 37, train_loss: 0.7237, test_loss: 0.9168, test_f1: 0.5617
 epoch: 38, train_loss: 0.7236, test_loss: 0.7528, test_f1: 0.6138
 epoch: 39, train_loss: 0.7103, test_loss: 0.8082, test_f1: 0.5800
 epoch: 40, train_loss: 0.7261, test_loss: 0.8620, test_f1: 0.5673
 epoch: 41, train_loss: 0.7374, test_loss: 0.8898, test_f1: 0.5819
 epoch: 42, train_loss: 0.7218, test_loss: 0.8253, test_f1: 0.6052
 epoch: 43, train_loss: 0.7049, test_loss: 0.7655, test_f1: 0.6210
 epoch: 44, train_loss: 0.7143, test_loss: 0.9329, test_f1: 0.6006
 epoch: 45, train_loss: 0.7165, test_loss: 0.9830, test_f1: 0.5520
 epoch: 46, train_loss: 0.7099, test_loss: 0.8213, test_f1: 0.5923
 epoch: 47, train_loss: 0.6948, test_loss: 0.8791, test_f1: 0.5619
 epoch: 48, train_loss: 0.7010, test_loss: 0.7996, test_f1: 0.6092
 epoch: 49, train_loss: 0.7045, test_loss: 0.8980, test_f1: 0.5563
 epoch: 50, train_loss: 0.6771, test_loss: 0.7557, test_f1: 0.6079
 epoch: 51, train_loss: 0.6554, test_loss: 0.8138, test_f1: 0.6312
 epoch: 52, train_loss: 0.6447, test_loss: 0.7951, test_f1: 0.6284
 epoch: 53, train_loss: 0.6512, test_loss: 0.7641, test_f1: 0.6500
 epoch: 54, train_loss: 0.6356, test_loss: 0.7811, test_f1: 0.6198
 epoch: 55, train_loss: 0.6267, test_loss: 0.8071, test_f1: 0.6434
 epoch: 56, train_loss: 0.6179, test_loss: 0.8252, test_f1: 0.6362
 epoch: 57, train_loss: 0.6209, test_loss: 0.7919, test_f1: 0.6475
 epoch: 58, train_loss: 0.6209, test_loss: 0.7659, test_f1: 0.6617
 epoch: 59, train_loss: 0.6104, test_loss: 0.7729, test_f1: 0.6487
 epoch: 60, train_loss: 0.6226, test_loss: 0.7740, test_f1: 0.6447
 epoch: 61, train_loss: 0.6115, test_loss: 0.8263, test_f1: 0.6378
 epoch: 62, train_loss: 0.5974, test_loss: 0.8094, test_f1: 0.6355
 epoch: 63, train_loss: 0.6023, test_loss: 0.8810, test_f1: 0.6168
 epoch: 64, train_loss: 0.5940, test_loss: 0.8159, test_f1: 0.6261
 epoch: 65, train_loss: 0.6045, test_loss: 0.8601, test_f1: 0.6356
 epoch: 66, train_loss: 0.5927, test_loss: 0.7686, test_f1: 0.6751
 epoch: 67, train_loss: 0.5993, test_loss: 0.7989, test_f1: 0.6636
 epoch: 68, train_loss: 0.5940, test_loss: 0.9337, test_f1: 0.6039
 epoch: 69, train_loss: 0.6053, test_loss: 0.8252, test_f1: 0.6276
 epoch: 70, train_loss: 0.5872, test_loss: 0.9455, test_f1: 0.6173
 epoch: 71, train_loss: 0.5781, test_loss: 0.8670, test_f1: 0.6352
 epoch: 72, train_loss: 0.5895, test_loss: 0.9636, test_f1: 0.6202
 epoch: 73, train_loss: 0.5783, test_loss: 0.8199, test_f1: 0.6444
 epoch: 74, train_loss: 0.5845, test_loss: 0.8660, test_f1: 0.6189
 epoch: 75, train_loss: 0.5863, test_loss: 0.8789, test_f1: 0.6381
 epoch: 76, train_loss: 0.5824, test_loss: 0.8334, test_f1: 0.6350
 epoch: 77, train_loss: 0.5575, test_loss: 0.8304, test_f1: 0.6189
 epoch: 78, train_loss: 0.5801, test_loss: 0.8376, test_f1: 0.6247
 epoch: 79, train_loss: 0.5583, test_loss: 0.8208, test_f1: 0.6364
 epoch: 80, train_loss: 0.5835, test_loss: 0.8600, test_f1: 0.6409
 epoch: 81, train_loss: 0.5835, test_loss: 0.7854, test_f1: 0.6388
 epoch: 82, train_loss: 0.5492, test_loss: 0.8408, test_f1: 0.6486
 epoch: 83, train_loss: 0.5585, test_loss: 0.8671, test_f1: 0.6352
 epoch: 84, train_loss: 0.5613, test_loss: 0.8830, test_f1: 0.6110
 epoch: 85, train_loss: 0.5612, test_loss: 0.8478, test_f1: 0.6162
 epoch: 86, train_loss: 0.5607, test_loss: 0.9678, test_f1: 0.5962
 epoch: 87, train_loss: 0.5623, test_loss: 0.9171, test_f1: 0.6090
 epoch: 88, train_loss: 0.5326, test_loss: 0.9191, test_f1: 0.6361
 epoch: 89, train_loss: 0.5435, test_loss: 0.8908, test_f1: 0.6113
 epoch: 90, train_loss: 0.5559, test_loss: 0.8396, test_f1: 0.6363
 epoch: 91, train_loss: 0.5615, test_loss: 0.9553, test_f1: 0.6094
 epoch: 92, train_loss: 0.5502, test_loss: 0.8883, test_f1: 0.6310
 epoch: 93, train_loss: 0.5396, test_loss: 0.8493, test_f1: 0.6505
 epoch: 94, train_loss: 0.5456, test_loss: 0.9665, test_f1: 0.6032
 epoch: 95, train_loss: 0.5541, test_loss: 0.8456, test_f1: 0.6424
 epoch: 96, train_loss: 0.5190, test_loss: 0.9610, test_f1: 0.6417
 epoch: 97, train_loss: 0.5377, test_loss: 0.9734, test_f1: 0.6126
 epoch: 98, train_loss: 0.5357, test_loss: 0.9175, test_f1: 0.6464
 epoch: 99, train_loss: 0.5376, test_loss: 0.8734, test_f1: 0.6665
##################ITERATION #1 ****************************************
 epoch: 0, train_loss: 1.1548, test_loss: 1.0666, test_f1: 0.4432
 epoch: 1, train_loss: 1.0239, test_loss: 1.1893, test_f1: 0.4032
 epoch: 2, train_loss: 1.0201, test_loss: 1.0460, test_f1: 0.4377
 epoch: 3, train_loss: 1.0012, test_loss: 1.1198, test_f1: 0.4208
 epoch: 4, train_loss: 0.9764, test_loss: 0.9958, test_f1: 0.4498
 epoch: 5, train_loss: 0.9409, test_loss: 0.9729, test_f1: 0.5259
 epoch: 6, train_loss: 0.9264, test_loss: 1.1947, test_f1: 0.3929
 epoch: 7, train_loss: 0.9141, test_loss: 1.0047, test_f1: 0.4731
 epoch: 8, train_loss: 0.9132, test_loss: 0.9451, test_f1: 0.4843
 epoch: 9, train_loss: 0.9094, test_loss: 0.9048, test_f1: 0.5285
 epoch: 10, train_loss: 0.8737, test_loss: 1.0570, test_f1: 0.5330
 epoch: 11, train_loss: 0.8733, test_loss: 0.8800, test_f1: 0.5384
 epoch: 12, train_loss: 0.8338, test_loss: 0.9081, test_f1: 0.5929
 epoch: 13, train_loss: 0.8425, test_loss: 0.9637, test_f1: 0.4718
 epoch: 14, train_loss: 0.8322, test_loss: 0.9212, test_f1: 0.5294
 epoch: 15, train_loss: 0.8282, test_loss: 0.7927, test_f1: 0.5454
 epoch: 16, train_loss: 0.8231, test_loss: 0.8639, test_f1: 0.5628
 epoch: 17, train_loss: 0.8145, test_loss: 0.8493, test_f1: 0.5420
 epoch: 18, train_loss: 0.8147, test_loss: 0.8782, test_f1: 0.5133
 epoch: 19, train_loss: 0.8112, test_loss: 0.8241, test_f1: 0.5418
 epoch: 20, train_loss: 0.7886, test_loss: 0.8685, test_f1: 0.5328
 epoch: 21, train_loss: 0.7814, test_loss: 0.8274, test_f1: 0.5368
 epoch: 22, train_loss: 0.7747, test_loss: 0.8076, test_f1: 0.5344
 epoch: 23, train_loss: 0.7781, test_loss: 0.8400, test_f1: 0.5433
 epoch: 24, train_loss: 0.7618, test_loss: 0.8365, test_f1: 0.5930
 epoch: 25, train_loss: 0.7556, test_loss: 0.8727, test_f1: 0.5412
 epoch: 26, train_loss: 0.7590, test_loss: 0.9285, test_f1: 0.5739
 epoch: 27, train_loss: 0.7592, test_loss: 0.8093, test_f1: 0.5483
 epoch: 28, train_loss: 0.7700, test_loss: 0.8590, test_f1: 0.5557
 epoch: 29, train_loss: 0.7545, test_loss: 1.0821, test_f1: 0.5426
 epoch: 30, train_loss: 0.7444, test_loss: 0.9022, test_f1: 0.5549
 epoch: 31, train_loss: 0.7603, test_loss: 0.9390, test_f1: 0.5974
 epoch: 32, train_loss: 0.7293, test_loss: 0.9066, test_f1: 0.5871
 epoch: 33, train_loss: 0.7137, test_loss: 0.9506, test_f1: 0.5698
 epoch: 34, train_loss: 0.7335, test_loss: 0.9559, test_f1: 0.5205
 epoch: 35, train_loss: 0.7156, test_loss: 0.8326, test_f1: 0.5603
 epoch: 36, train_loss: 0.7198, test_loss: 0.8419, test_f1: 0.5696
 epoch: 37, train_loss: 0.7121, test_loss: 0.9734, test_f1: 0.5573
 epoch: 38, train_loss: 0.7581, test_loss: 0.8293, test_f1: 0.6041
 epoch: 39, train_loss: 0.7300, test_loss: 0.8455, test_f1: 0.5618
 epoch: 40, train_loss: 0.7629, test_loss: 0.8569, test_f1: 0.5307
 epoch: 41, train_loss: 0.7572, test_loss: 0.9018, test_f1: 0.5572
 epoch: 42, train_loss: 0.7315, test_loss: 0.8315, test_f1: 0.5590
 epoch: 43, train_loss: 0.7207, test_loss: 0.8731, test_f1: 0.6247
 epoch: 44, train_loss: 0.6949, test_loss: 0.8699, test_f1: 0.5515
 epoch: 45, train_loss: 0.7010, test_loss: 0.9236, test_f1: 0.5488
 epoch: 46, train_loss: 0.7112, test_loss: 0.8998, test_f1: 0.5380
 epoch: 47, train_loss: 0.6963, test_loss: 0.8119, test_f1: 0.6329
 epoch: 48, train_loss: 0.6764, test_loss: 0.8128, test_f1: 0.6377
 epoch: 49, train_loss: 0.6663, test_loss: 0.8101, test_f1: 0.5693
 epoch: 50, train_loss: 0.6921, test_loss: 0.8465, test_f1: 0.5697
 epoch: 51, train_loss: 0.6641, test_loss: 0.9322, test_f1: 0.6182
 epoch: 52, train_loss: 0.6506, test_loss: 0.8857, test_f1: 0.6428
 epoch: 53, train_loss: 0.6283, test_loss: 0.9558, test_f1: 0.5637
 epoch: 54, train_loss: 0.6323, test_loss: 0.8919, test_f1: 0.6355
 epoch: 55, train_loss: 0.6291, test_loss: 0.8518, test_f1: 0.5646
 epoch: 56, train_loss: 0.6223, test_loss: 0.8751, test_f1: 0.6499
 epoch: 57, train_loss: 0.6184, test_loss: 0.9920, test_f1: 0.6142
 epoch: 58, train_loss: 0.6341, test_loss: 0.9084, test_f1: 0.6047
 epoch: 59, train_loss: 0.6287, test_loss: 0.9181, test_f1: 0.5890
 epoch: 60, train_loss: 0.6129, test_loss: 0.9230, test_f1: 0.5922
 epoch: 61, train_loss: 0.6130, test_loss: 1.0269, test_f1: 0.5827
 epoch: 62, train_loss: 0.6252, test_loss: 0.8704, test_f1: 0.6467
 epoch: 63, train_loss: 0.6089, test_loss: 0.9349, test_f1: 0.5833
 epoch: 64, train_loss: 0.6004, test_loss: 0.9238, test_f1: 0.6087
 epoch: 65, train_loss: 0.5922, test_loss: 0.9049, test_f1: 0.6041
 epoch: 66, train_loss: 0.6018, test_loss: 0.8261, test_f1: 0.5950
 epoch: 67, train_loss: 0.5935, test_loss: 1.0189, test_f1: 0.6463
 epoch: 68, train_loss: 0.5899, test_loss: 0.9789, test_f1: 0.6474
 epoch: 69, train_loss: 0.5990, test_loss: 1.0172, test_f1: 0.6452
 epoch: 70, train_loss: 0.6000, test_loss: 0.9287, test_f1: 0.6294
 epoch: 71, train_loss: 0.5839, test_loss: 0.9955, test_f1: 0.6338
 epoch: 72, train_loss: 0.5970, test_loss: 0.9744, test_f1: 0.6510
 epoch: 73, train_loss: 0.5979, test_loss: 1.0811, test_f1: 0.5814
 epoch: 74, train_loss: 0.5740, test_loss: 1.0169, test_f1: 0.6399
 epoch: 75, train_loss: 0.5918, test_loss: 0.9500, test_f1: 0.6409
 epoch: 76, train_loss: 0.5837, test_loss: 0.9502, test_f1: 0.6900
 epoch: 77, train_loss: 0.5833, test_loss: 0.9974, test_f1: 0.6634
 epoch: 78, train_loss: 0.5913, test_loss: 0.9304, test_f1: 0.6519
 epoch: 79, train_loss: 0.5857, test_loss: 0.9488, test_f1: 0.6354
 epoch: 80, train_loss: 0.5913, test_loss: 0.8899, test_f1: 0.6466
 epoch: 81, train_loss: 0.5738, test_loss: 1.0061, test_f1: 0.6783
 epoch: 82, train_loss: 0.5814, test_loss: 0.9709, test_f1: 0.6366
 epoch: 83, train_loss: 0.5747, test_loss: 0.9517, test_f1: 0.6459
 epoch: 84, train_loss: 0.5683, test_loss: 1.0119, test_f1: 0.6374
 epoch: 85, train_loss: 0.5704, test_loss: 0.9282, test_f1: 0.6245
 epoch: 86, train_loss: 0.5640, test_loss: 1.0643, test_f1: 0.6372
 epoch: 87, train_loss: 0.5719, test_loss: 1.0037, test_f1: 0.6729
 epoch: 88, train_loss: 0.5636, test_loss: 1.1014, test_f1: 0.6575
 epoch: 89, train_loss: 0.5733, test_loss: 1.1267, test_f1: 0.6918
 epoch: 90, train_loss: 0.5699, test_loss: 0.9452, test_f1: 0.6747
 epoch: 91, train_loss: 0.5442, test_loss: 0.9051, test_f1: 0.6733
 epoch: 92, train_loss: 0.5762, test_loss: 0.9951, test_f1: 0.6725
 epoch: 93, train_loss: 0.5484, test_loss: 0.8700, test_f1: 0.6477
 epoch: 94, train_loss: 0.5552, test_loss: 1.0260, test_f1: 0.6774
 epoch: 95, train_loss: 0.5612, test_loss: 1.0259, test_f1: 0.6259
 epoch: 96, train_loss: 0.5504, test_loss: 0.9238, test_f1: 0.6442
 epoch: 97, train_loss: 0.5510, test_loss: 0.9662, test_f1: 0.6746
 epoch: 98, train_loss: 0.5552, test_loss: 0.9152, test_f1: 0.6760
 epoch: 99, train_loss: 0.5564, test_loss: 0.9203, test_f1: 0.6478
##################ITERATION #2 ****************************************
 epoch: 0, train_loss: 1.1508, test_loss: 1.0762, test_f1: 0.3686
 epoch: 1, train_loss: 1.0359, test_loss: 1.1296, test_f1: 0.4615
 epoch: 2, train_loss: 0.9955, test_loss: 1.0010, test_f1: 0.4342
 epoch: 3, train_loss: 0.9839, test_loss: 1.0398, test_f1: 0.4447
 epoch: 4, train_loss: 0.9830, test_loss: 0.9157, test_f1: 0.5508
 epoch: 5, train_loss: 0.9509, test_loss: 1.0136, test_f1: 0.4855
 epoch: 6, train_loss: 0.9384, test_loss: 0.9971, test_f1: 0.4982
 epoch: 7, train_loss: 0.9203, test_loss: 1.0181, test_f1: 0.4578
 epoch: 8, train_loss: 0.9196, test_loss: 0.8574, test_f1: 0.5077
 epoch: 9, train_loss: 0.9109, test_loss: 0.9969, test_f1: 0.4825
 epoch: 10, train_loss: 0.9340, test_loss: 1.0846, test_f1: 0.4067
 epoch: 11, train_loss: 0.9087, test_loss: 0.9370, test_f1: 0.5147
 epoch: 12, train_loss: 0.8980, test_loss: 0.9539, test_f1: 0.5315
 epoch: 13, train_loss: 0.8696, test_loss: 0.9138, test_f1: 0.5625
 epoch: 14, train_loss: 0.8697, test_loss: 0.8980, test_f1: 0.5136
 epoch: 15, train_loss: 0.8790, test_loss: 0.8623, test_f1: 0.5301
 epoch: 16, train_loss: 0.8711, test_loss: 1.1671, test_f1: 0.4269
 epoch: 17, train_loss: 0.8520, test_loss: 0.9356, test_f1: 0.5418
 epoch: 18, train_loss: 0.8440, test_loss: 0.9464, test_f1: 0.5164
 epoch: 19, train_loss: 0.8379, test_loss: 0.9853, test_f1: 0.4435
 epoch: 20, train_loss: 0.8359, test_loss: 0.9670, test_f1: 0.5769
 epoch: 21, train_loss: 0.8397, test_loss: 0.9511, test_f1: 0.4958
 epoch: 22, train_loss: 0.8153, test_loss: 0.8774, test_f1: 0.5568
 epoch: 23, train_loss: 0.8227, test_loss: 0.9390, test_f1: 0.5909
 epoch: 24, train_loss: 0.8508, test_loss: 0.9178, test_f1: 0.5256
 epoch: 25, train_loss: 0.8031, test_loss: 1.0695, test_f1: 0.5522
 epoch: 26, train_loss: 0.8035, test_loss: 1.0360, test_f1: 0.4904
 epoch: 27, train_loss: 0.8166, test_loss: 0.9002, test_f1: 0.5469
 epoch: 28, train_loss: 0.7874, test_loss: 0.9536, test_f1: 0.5620
 epoch: 29, train_loss: 0.7981, test_loss: 0.8855, test_f1: 0.5658
 epoch: 30, train_loss: 0.7897, test_loss: 1.1957, test_f1: 0.4895
 epoch: 31, train_loss: 0.7685, test_loss: 1.1229, test_f1: 0.5233
 epoch: 32, train_loss: 0.7887, test_loss: 0.9232, test_f1: 0.5462
 epoch: 33, train_loss: 0.7532, test_loss: 0.9504, test_f1: 0.5545
 epoch: 34, train_loss: 0.7700, test_loss: 1.0090, test_f1: 0.5426
 epoch: 35, train_loss: 0.7722, test_loss: 1.0333, test_f1: 0.5174
 epoch: 36, train_loss: 0.7476, test_loss: 0.8995, test_f1: 0.5112
 epoch: 37, train_loss: 0.7463, test_loss: 1.0011, test_f1: 0.5224
 epoch: 38, train_loss: 0.7867, test_loss: 1.0945, test_f1: 0.5227
 epoch: 39, train_loss: 0.7548, test_loss: 0.9378, test_f1: 0.5817
 epoch: 40, train_loss: 0.7673, test_loss: 0.9492, test_f1: 0.5470
 epoch: 41, train_loss: 0.7498, test_loss: 0.9306, test_f1: 0.5376
 epoch: 42, train_loss: 0.7487, test_loss: 0.9097, test_f1: 0.5470
 epoch: 43, train_loss: 0.7274, test_loss: 1.0485, test_f1: 0.5061
 epoch: 44, train_loss: 0.7462, test_loss: 0.8991, test_f1: 0.5736
 epoch: 45, train_loss: 0.7413, test_loss: 0.8842, test_f1: 0.5608
 epoch: 46, train_loss: 0.7292, test_loss: 0.8563, test_f1: 0.6157
 epoch: 47, train_loss: 0.7073, test_loss: 0.9334, test_f1: 0.5494
 epoch: 48, train_loss: 0.7162, test_loss: 0.8664, test_f1: 0.5891
 epoch: 49, train_loss: 0.7184, test_loss: 0.9147, test_f1: 0.5748
 epoch: 50, train_loss: 0.7214, test_loss: 0.8803, test_f1: 0.5838
 epoch: 51, train_loss: 0.6825, test_loss: 0.9570, test_f1: 0.5741
 epoch: 52, train_loss: 0.6683, test_loss: 0.9845, test_f1: 0.6087
 epoch: 53, train_loss: 0.6591, test_loss: 0.9738, test_f1: 0.5924
 epoch: 54, train_loss: 0.6639, test_loss: 0.9459, test_f1: 0.6290
 epoch: 55, train_loss: 0.6542, test_loss: 0.9849, test_f1: 0.5717
 epoch: 56, train_loss: 0.6578, test_loss: 0.9568, test_f1: 0.6350
 epoch: 57, train_loss: 0.6545, test_loss: 0.9789, test_f1: 0.6096
 epoch: 58, train_loss: 0.6494, test_loss: 1.0327, test_f1: 0.5601
 epoch: 59, train_loss: 0.6433, test_loss: 1.0065, test_f1: 0.5838
 epoch: 60, train_loss: 0.6495, test_loss: 0.9429, test_f1: 0.6259
 epoch: 61, train_loss: 0.6261, test_loss: 0.9617, test_f1: 0.6189
 epoch: 62, train_loss: 0.6397, test_loss: 1.0525, test_f1: 0.6017
 epoch: 63, train_loss: 0.6384, test_loss: 0.9971, test_f1: 0.6041
 epoch: 64, train_loss: 0.6382, test_loss: 1.1016, test_f1: 0.6419
 epoch: 65, train_loss: 0.6460, test_loss: 0.9638, test_f1: 0.6106
 epoch: 66, train_loss: 0.6308, test_loss: 0.9340, test_f1: 0.6474
 epoch: 67, train_loss: 0.6302, test_loss: 1.0154, test_f1: 0.6191
 epoch: 68, train_loss: 0.6258, test_loss: 1.0507, test_f1: 0.6197
 epoch: 69, train_loss: 0.6193, test_loss: 1.0454, test_f1: 0.6093
 epoch: 70, train_loss: 0.6219, test_loss: 0.9959, test_f1: 0.6129
 epoch: 71, train_loss: 0.6207, test_loss: 0.9614, test_f1: 0.6318
 epoch: 72, train_loss: 0.6162, test_loss: 1.0492, test_f1: 0.6257
 epoch: 73, train_loss: 0.6029, test_loss: 1.0291, test_f1: 0.6167
 epoch: 74, train_loss: 0.6328, test_loss: 1.0985, test_f1: 0.6336
 epoch: 75, train_loss: 0.6086, test_loss: 1.0282, test_f1: 0.6120
 epoch: 76, train_loss: 0.6113, test_loss: 0.9881, test_f1: 0.6142
 epoch: 77, train_loss: 0.5994, test_loss: 1.0100, test_f1: 0.6186
 epoch: 78, train_loss: 0.6121, test_loss: 1.0617, test_f1: 0.5856
 epoch: 79, train_loss: 0.6073, test_loss: 1.0979, test_f1: 0.6109
 epoch: 80, train_loss: 0.5916, test_loss: 1.1154, test_f1: 0.6089
 epoch: 81, train_loss: 0.5879, test_loss: 1.1354, test_f1: 0.6261
 epoch: 82, train_loss: 0.5977, test_loss: 1.1541, test_f1: 0.6269
 epoch: 83, train_loss: 0.5808, test_loss: 1.0668, test_f1: 0.6404
 epoch: 84, train_loss: 0.5794, test_loss: 1.0571, test_f1: 0.6276
 epoch: 85, train_loss: 0.5945, test_loss: 1.0462, test_f1: 0.6861
 epoch: 86, train_loss: 0.5886, test_loss: 0.9759, test_f1: 0.6374
 epoch: 87, train_loss: 0.5921, test_loss: 1.0616, test_f1: 0.6033
 epoch: 88, train_loss: 0.5975, test_loss: 1.0255, test_f1: 0.6268
 epoch: 89, train_loss: 0.5956, test_loss: 1.0875, test_f1: 0.6409
 epoch: 90, train_loss: 0.5850, test_loss: 0.9745, test_f1: 0.6319
 epoch: 91, train_loss: 0.5739, test_loss: 1.0123, test_f1: 0.6729
 epoch: 92, train_loss: 0.5693, test_loss: 1.0292, test_f1: 0.6705
 epoch: 93, train_loss: 0.5743, test_loss: 1.0488, test_f1: 0.5985
 epoch: 94, train_loss: 0.6121, test_loss: 1.1325, test_f1: 0.6535
 epoch: 95, train_loss: 0.6232, test_loss: 0.9694, test_f1: 0.6407
 epoch: 96, train_loss: 0.6012, test_loss: 0.9613, test_f1: 0.6589
 epoch: 97, train_loss: 0.5720, test_loss: 1.0436, test_f1: 0.6434
 epoch: 98, train_loss: 0.5696, test_loss: 1.1065, test_f1: 0.6110
 epoch: 99, train_loss: 0.5719, test_loss: 1.0627, test_f1: 0.6302
##################ITERATION #3 ****************************************
 epoch: 0, train_loss: 1.1817, test_loss: 1.5694, test_f1: 0.2821
 epoch: 1, train_loss: 1.0438, test_loss: 1.0592, test_f1: 0.4748
 epoch: 2, train_loss: 1.0103, test_loss: 1.1728, test_f1: 0.4436
 epoch: 3, train_loss: 0.9969, test_loss: 1.0667, test_f1: 0.4810
 epoch: 4, train_loss: 1.0016, test_loss: 1.0777, test_f1: 0.5041
 epoch: 5, train_loss: 0.9816, test_loss: 1.0192, test_f1: 0.4834
 epoch: 6, train_loss: 0.9616, test_loss: 1.0321, test_f1: 0.5130
 epoch: 7, train_loss: 0.9572, test_loss: 1.0528, test_f1: 0.5165
 epoch: 8, train_loss: 0.9248, test_loss: 1.0216, test_f1: 0.5003
 epoch: 9, train_loss: 0.9078, test_loss: 1.0107, test_f1: 0.5160
 epoch: 10, train_loss: 0.9044, test_loss: 1.0319, test_f1: 0.5118
 epoch: 11, train_loss: 0.8878, test_loss: 1.0426, test_f1: 0.4820
 epoch: 12, train_loss: 0.9006, test_loss: 0.9151, test_f1: 0.5239
 epoch: 13, train_loss: 0.8914, test_loss: 0.9201, test_f1: 0.5254
 epoch: 14, train_loss: 0.8542, test_loss: 0.9569, test_f1: 0.5440
 epoch: 15, train_loss: 0.8490, test_loss: 1.0117, test_f1: 0.5006
 epoch: 16, train_loss: 0.8621, test_loss: 0.8948, test_f1: 0.5329
 epoch: 17, train_loss: 0.8450, test_loss: 0.9129, test_f1: 0.5229
 epoch: 18, train_loss: 0.8498, test_loss: 0.9534, test_f1: 0.4913
 epoch: 19, train_loss: 0.8158, test_loss: 0.9926, test_f1: 0.5031
 epoch: 20, train_loss: 0.8157, test_loss: 0.9886, test_f1: 0.5493
 epoch: 21, train_loss: 0.8208, test_loss: 0.9867, test_f1: 0.5036
 epoch: 22, train_loss: 0.8180, test_loss: 1.0493, test_f1: 0.5142
 epoch: 23, train_loss: 0.8258, test_loss: 0.9190, test_f1: 0.6225
 epoch: 24, train_loss: 0.7970, test_loss: 0.9335, test_f1: 0.5872
 epoch: 25, train_loss: 0.7917, test_loss: 0.9735, test_f1: 0.5611
 epoch: 26, train_loss: 0.7724, test_loss: 1.0341, test_f1: 0.5426
 epoch: 27, train_loss: 0.7859, test_loss: 0.9380, test_f1: 0.5863
 epoch: 28, train_loss: 0.7944, test_loss: 0.8939, test_f1: 0.5432
 epoch: 29, train_loss: 0.7773, test_loss: 0.9390, test_f1: 0.5310
 epoch: 30, train_loss: 0.7873, test_loss: 0.9470, test_f1: 0.5823
 epoch: 31, train_loss: 0.7651, test_loss: 1.0110, test_f1: 0.5874
 epoch: 32, train_loss: 0.7592, test_loss: 1.1050, test_f1: 0.5834
 epoch: 33, train_loss: 0.7556, test_loss: 1.0604, test_f1: 0.5406
 epoch: 34, train_loss: 0.7779, test_loss: 1.0250, test_f1: 0.5909
 epoch: 35, train_loss: 0.7563, test_loss: 1.0007, test_f1: 0.5413
 epoch: 36, train_loss: 0.7630, test_loss: 0.9477, test_f1: 0.5647
 epoch: 37, train_loss: 0.7627, test_loss: 1.0490, test_f1: 0.5251
 epoch: 38, train_loss: 0.7473, test_loss: 1.0259, test_f1: 0.5697
 epoch: 39, train_loss: 0.7364, test_loss: 0.8893, test_f1: 0.5956
 epoch: 40, train_loss: 0.7319, test_loss: 0.9751, test_f1: 0.5996
 epoch: 41, train_loss: 0.7400, test_loss: 0.9132, test_f1: 0.5997
 epoch: 42, train_loss: 0.7306, test_loss: 0.9089, test_f1: 0.6010
 epoch: 43, train_loss: 0.7241, test_loss: 1.1108, test_f1: 0.5771
 epoch: 44, train_loss: 0.7278, test_loss: 0.9404, test_f1: 0.6078
 epoch: 45, train_loss: 0.7337, test_loss: 0.9623, test_f1: 0.5829
 epoch: 46, train_loss: 0.7228, test_loss: 0.9188, test_f1: 0.5939
 epoch: 47, train_loss: 0.7409, test_loss: 0.8754, test_f1: 0.6107
 epoch: 48, train_loss: 0.7177, test_loss: 0.9328, test_f1: 0.6380
 epoch: 49, train_loss: 0.7338, test_loss: 1.0104, test_f1: 0.5817
 epoch: 50, train_loss: 0.7188, test_loss: 0.8288, test_f1: 0.6055
 epoch: 51, train_loss: 0.6813, test_loss: 0.8380, test_f1: 0.6392
 epoch: 52, train_loss: 0.6600, test_loss: 0.8224, test_f1: 0.6325
 epoch: 53, train_loss: 0.6493, test_loss: 0.8328, test_f1: 0.6276
 epoch: 54, train_loss: 0.6506, test_loss: 0.9562, test_f1: 0.6056
 epoch: 55, train_loss: 0.6740, test_loss: 0.9396, test_f1: 0.6096
 epoch: 56, train_loss: 0.6404, test_loss: 0.9540, test_f1: 0.6037
 epoch: 57, train_loss: 0.6494, test_loss: 0.9195, test_f1: 0.6240
 epoch: 58, train_loss: 0.6437, test_loss: 0.9593, test_f1: 0.6378
 epoch: 59, train_loss: 0.6347, test_loss: 0.9656, test_f1: 0.5941
 epoch: 60, train_loss: 0.6148, test_loss: 0.9858, test_f1: 0.6372
 epoch: 61, train_loss: 0.6394, test_loss: 0.9501, test_f1: 0.6247
 epoch: 62, train_loss: 0.6381, test_loss: 0.9585, test_f1: 0.6284
 epoch: 63, train_loss: 0.6296, test_loss: 1.0031, test_f1: 0.6417
 epoch: 64, train_loss: 0.6329, test_loss: 0.9778, test_f1: 0.6263
 epoch: 65, train_loss: 0.6301, test_loss: 1.0568, test_f1: 0.6060
 epoch: 66, train_loss: 0.6374, test_loss: 0.9889, test_f1: 0.6327
 epoch: 67, train_loss: 0.6227, test_loss: 1.1072, test_f1: 0.5969
 epoch: 68, train_loss: 0.6236, test_loss: 1.0305, test_f1: 0.6387
 epoch: 69, train_loss: 0.6120, test_loss: 0.9967, test_f1: 0.6211
 epoch: 70, train_loss: 0.6102, test_loss: 0.9530, test_f1: 0.6232
 epoch: 71, train_loss: 0.6068, test_loss: 1.0756, test_f1: 0.6362
 epoch: 72, train_loss: 0.6176, test_loss: 1.0317, test_f1: 0.6395
 epoch: 73, train_loss: 0.6100, test_loss: 0.9283, test_f1: 0.6228
 epoch: 74, train_loss: 0.6187, test_loss: 1.0438, test_f1: 0.6124
 epoch: 75, train_loss: 0.6091, test_loss: 0.9271, test_f1: 0.6237
 epoch: 76, train_loss: 0.6050, test_loss: 1.0105, test_f1: 0.6056
 epoch: 77, train_loss: 0.6229, test_loss: 0.9624, test_f1: 0.6378
 epoch: 78, train_loss: 0.5866, test_loss: 0.8550, test_f1: 0.6305
 epoch: 79, train_loss: 0.5959, test_loss: 1.0351, test_f1: 0.6172
 epoch: 80, train_loss: 0.5905, test_loss: 0.9603, test_f1: 0.6165
 epoch: 81, train_loss: 0.5958, test_loss: 1.0740, test_f1: 0.6320
 epoch: 82, train_loss: 0.5791, test_loss: 1.0055, test_f1: 0.6390
 epoch: 83, train_loss: 0.6025, test_loss: 1.0059, test_f1: 0.6092
 epoch: 84, train_loss: 0.5801, test_loss: 0.9417, test_f1: 0.6248
 epoch: 85, train_loss: 0.5995, test_loss: 0.9292, test_f1: 0.6084
 epoch: 86, train_loss: 0.5822, test_loss: 0.9725, test_f1: 0.6154
 epoch: 87, train_loss: 0.5709, test_loss: 0.9807, test_f1: 0.6367
 epoch: 88, train_loss: 0.5677, test_loss: 1.1271, test_f1: 0.6165
 epoch: 89, train_loss: 0.5705, test_loss: 0.9734, test_f1: 0.6388
 epoch: 90, train_loss: 0.5727, test_loss: 0.9751, test_f1: 0.6218
 epoch: 91, train_loss: 0.5853, test_loss: 1.0081, test_f1: 0.6107
 epoch: 92, train_loss: 0.5807, test_loss: 0.9520, test_f1: 0.6542
 epoch: 93, train_loss: 0.5827, test_loss: 1.0825, test_f1: 0.5883
 epoch: 94, train_loss: 0.6008, test_loss: 1.0827, test_f1: 0.5851
 epoch: 95, train_loss: 0.5663, test_loss: 0.9748, test_f1: 0.6335
 epoch: 96, train_loss: 0.5670, test_loss: 1.0303, test_f1: 0.6304
 epoch: 97, train_loss: 0.5687, test_loss: 1.0432, test_f1: 0.6081
 epoch: 98, train_loss: 0.5762, test_loss: 1.0493, test_f1: 0.6143
 epoch: 99, train_loss: 0.5849, test_loss: 1.0475, test_f1: 0.6057
##################ITERATION #4 ****************************************
 epoch: 0, train_loss: 1.1981, test_loss: 1.1230, test_f1: 0.3704
 epoch: 1, train_loss: 1.0479, test_loss: 1.1081, test_f1: 0.4331
 epoch: 2, train_loss: 1.0299, test_loss: 1.0635, test_f1: 0.3962
 epoch: 3, train_loss: 0.9929, test_loss: 1.0431, test_f1: 0.4448
 epoch: 4, train_loss: 0.9856, test_loss: 1.1307, test_f1: 0.4492
 epoch: 5, train_loss: 0.9481, test_loss: 0.9797, test_f1: 0.4977
 epoch: 6, train_loss: 0.9688, test_loss: 1.1328, test_f1: 0.4604
 epoch: 7, train_loss: 0.9459, test_loss: 1.0185, test_f1: 0.4823
 epoch: 8, train_loss: 0.9310, test_loss: 1.0104, test_f1: 0.4845
 epoch: 9, train_loss: 0.9149, test_loss: 1.0153, test_f1: 0.4876
 epoch: 10, train_loss: 0.8879, test_loss: 0.9957, test_f1: 0.4947
 epoch: 11, train_loss: 0.8810, test_loss: 0.8914, test_f1: 0.5281
 epoch: 12, train_loss: 0.8783, test_loss: 0.9963, test_f1: 0.4672
 epoch: 13, train_loss: 0.8714, test_loss: 0.8829, test_f1: 0.5538
 epoch: 14, train_loss: 0.8649, test_loss: 1.0066, test_f1: 0.5025
 epoch: 15, train_loss: 0.8521, test_loss: 0.9717, test_f1: 0.5440
 epoch: 16, train_loss: 0.8638, test_loss: 0.9812, test_f1: 0.5087
 epoch: 17, train_loss: 0.8753, test_loss: 1.0947, test_f1: 0.4089
 epoch: 18, train_loss: 0.8527, test_loss: 0.9581, test_f1: 0.5345
 epoch: 19, train_loss: 0.8722, test_loss: 0.9434, test_f1: 0.5218
 epoch: 20, train_loss: 0.8156, test_loss: 0.9408, test_f1: 0.5050
 epoch: 21, train_loss: 0.8216, test_loss: 0.8808, test_f1: 0.5257
 epoch: 22, train_loss: 0.8225, test_loss: 0.9105, test_f1: 0.5734
 epoch: 23, train_loss: 0.8251, test_loss: 0.9571, test_f1: 0.5135
 epoch: 24, train_loss: 0.8278, test_loss: 0.9158, test_f1: 0.5130
 epoch: 25, train_loss: 0.8216, test_loss: 0.8544, test_f1: 0.5646
 epoch: 26, train_loss: 0.8094, test_loss: 0.8951, test_f1: 0.5812
 epoch: 27, train_loss: 0.7949, test_loss: 0.8773, test_f1: 0.5546
 epoch: 28, train_loss: 0.8130, test_loss: 0.9190, test_f1: 0.5239
 epoch: 29, train_loss: 0.7856, test_loss: 0.8768, test_f1: 0.5492
 epoch: 30, train_loss: 0.8127, test_loss: 1.0357, test_f1: 0.5406
 epoch: 31, train_loss: 0.7981, test_loss: 0.9278, test_f1: 0.5493
 epoch: 32, train_loss: 0.8164, test_loss: 0.9448, test_f1: 0.5363
 epoch: 33, train_loss: 0.7947, test_loss: 0.9474, test_f1: 0.5176
 epoch: 34, train_loss: 0.8171, test_loss: 0.9416, test_f1: 0.5391
 epoch: 35, train_loss: 0.7919, test_loss: 0.9090, test_f1: 0.5289
 epoch: 36, train_loss: 0.7838, test_loss: 0.8652, test_f1: 0.5195
 epoch: 37, train_loss: 0.7657, test_loss: 0.8867, test_f1: 0.6001
 epoch: 38, train_loss: 0.7600, test_loss: 0.9848, test_f1: 0.5392
 epoch: 39, train_loss: 0.7667, test_loss: 0.9182, test_f1: 0.5364
 epoch: 40, train_loss: 0.7767, test_loss: 0.9129, test_f1: 0.5822
 epoch: 41, train_loss: 0.7664, test_loss: 0.8641, test_f1: 0.5531
 epoch: 42, train_loss: 0.7470, test_loss: 0.9129, test_f1: 0.5565
 epoch: 43, train_loss: 0.7596, test_loss: 0.8968, test_f1: 0.5715
 epoch: 44, train_loss: 0.7477, test_loss: 0.9245, test_f1: 0.5687
 epoch: 45, train_loss: 0.7440, test_loss: 0.8481, test_f1: 0.5772
 epoch: 46, train_loss: 0.7765, test_loss: 0.8897, test_f1: 0.6060
 epoch: 47, train_loss: 0.7532, test_loss: 1.0746, test_f1: 0.5340
 epoch: 48, train_loss: 0.7359, test_loss: 1.0150, test_f1: 0.5769
 epoch: 49, train_loss: 0.7334, test_loss: 1.0076, test_f1: 0.5905
 epoch: 50, train_loss: 0.7270, test_loss: 1.0753, test_f1: 0.5170
 epoch: 51, train_loss: 0.6988, test_loss: 0.8852, test_f1: 0.6115
 epoch: 52, train_loss: 0.7064, test_loss: 0.9396, test_f1: 0.6147
 epoch: 53, train_loss: 0.6956, test_loss: 0.9357, test_f1: 0.6009
 epoch: 54, train_loss: 0.6839, test_loss: 0.8755, test_f1: 0.6207
 epoch: 55, train_loss: 0.6870, test_loss: 0.8747, test_f1: 0.6328
 epoch: 56, train_loss: 0.6826, test_loss: 0.9134, test_f1: 0.6096
 epoch: 57, train_loss: 0.6745, test_loss: 0.9362, test_f1: 0.5983
 epoch: 58, train_loss: 0.6670, test_loss: 0.9615, test_f1: 0.6168
 epoch: 59, train_loss: 0.6706, test_loss: 0.9655, test_f1: 0.5845
 epoch: 60, train_loss: 0.6669, test_loss: 0.9896, test_f1: 0.6098
 epoch: 61, train_loss: 0.6719, test_loss: 0.9267, test_f1: 0.6188
 epoch: 62, train_loss: 0.6548, test_loss: 0.9250, test_f1: 0.6161
 epoch: 63, train_loss: 0.6484, test_loss: 0.9533, test_f1: 0.6220
 epoch: 64, train_loss: 0.6613, test_loss: 0.9203, test_f1: 0.5981
 epoch: 65, train_loss: 0.6531, test_loss: 0.8653, test_f1: 0.6380
 epoch: 66, train_loss: 0.6570, test_loss: 0.9559, test_f1: 0.5949
 epoch: 67, train_loss: 0.6472, test_loss: 0.9041, test_f1: 0.6318
 epoch: 68, train_loss: 0.6569, test_loss: 0.9149, test_f1: 0.6379
 epoch: 69, train_loss: 0.6558, test_loss: 0.9947, test_f1: 0.6100
 epoch: 70, train_loss: 0.6457, test_loss: 0.9602, test_f1: 0.6084
 epoch: 71, train_loss: 0.6506, test_loss: 0.9107, test_f1: 0.6339
 epoch: 72, train_loss: 0.6550, test_loss: 1.0330, test_f1: 0.6065
 epoch: 73, train_loss: 0.6443, test_loss: 1.0060, test_f1: 0.6027
 epoch: 74, train_loss: 0.6643, test_loss: 0.9373, test_f1: 0.6507
 epoch: 75, train_loss: 0.6429, test_loss: 0.8952, test_f1: 0.6275
 epoch: 76, train_loss: 0.6516, test_loss: 0.9443, test_f1: 0.6308
 epoch: 77, train_loss: 0.6411, test_loss: 0.9899, test_f1: 0.6123
 epoch: 78, train_loss: 0.6357, test_loss: 0.9399, test_f1: 0.6392
 epoch: 79, train_loss: 0.6276, test_loss: 0.9669, test_f1: 0.6428
 epoch: 80, train_loss: 0.6271, test_loss: 0.9805, test_f1: 0.6373
 epoch: 81, train_loss: 0.6249, test_loss: 0.9888, test_f1: 0.6342
 epoch: 82, train_loss: 0.6227, test_loss: 0.9623, test_f1: 0.6262
 epoch: 83, train_loss: 0.6219, test_loss: 0.9954, test_f1: 0.6166
 epoch: 84, train_loss: 0.6260, test_loss: 0.9628, test_f1: 0.6200
 epoch: 85, train_loss: 0.6438, test_loss: 0.9357, test_f1: 0.6204
 epoch: 86, train_loss: 0.6196, test_loss: 0.9178, test_f1: 0.6552
 epoch: 87, train_loss: 0.6220, test_loss: 0.9359, test_f1: 0.6403
 epoch: 88, train_loss: 0.6037, test_loss: 0.9115, test_f1: 0.6394
 epoch: 89, train_loss: 0.6174, test_loss: 0.9164, test_f1: 0.6380
 epoch: 90, train_loss: 0.6135, test_loss: 0.9967, test_f1: 0.6335
 epoch: 91, train_loss: 0.6053, test_loss: 0.9966, test_f1: 0.6447
 epoch: 92, train_loss: 0.6116, test_loss: 0.9412, test_f1: 0.6318
 epoch: 93, train_loss: 0.6306, test_loss: 0.9394, test_f1: 0.6445
 epoch: 94, train_loss: 0.6192, test_loss: 0.9524, test_f1: 0.6630
 epoch: 95, train_loss: 0.5898, test_loss: 1.0033, test_f1: 0.6459
 epoch: 96, train_loss: 0.6058, test_loss: 0.8888, test_f1: 0.6632
 epoch: 97, train_loss: 0.5917, test_loss: 0.9153, test_f1: 0.6761
 epoch: 98, train_loss: 0.6033, test_loss: 0.8961, test_f1: 0.6214
 epoch: 99, train_loss: 0.6185, test_loss: 0.8432, test_f1: 0.6418
##################ITERATION #5 ****************************************
 epoch: 0, train_loss: 1.1603, test_loss: 1.2194, test_f1: 0.3310
 epoch: 1, train_loss: 1.0532, test_loss: 1.0974, test_f1: 0.4347
 epoch: 2, train_loss: 1.0084, test_loss: 1.0697, test_f1: 0.4728
 epoch: 3, train_loss: 0.9774, test_loss: 0.9968, test_f1: 0.5238
 epoch: 4, train_loss: 0.9482, test_loss: 0.9616, test_f1: 0.5093
 epoch: 5, train_loss: 0.9427, test_loss: 0.9254, test_f1: 0.4939
 epoch: 6, train_loss: 0.9449, test_loss: 1.0522, test_f1: 0.4890
 epoch: 7, train_loss: 0.9028, test_loss: 0.8420, test_f1: 0.5331
 epoch: 8, train_loss: 0.8983, test_loss: 1.0369, test_f1: 0.4492
 epoch: 9, train_loss: 0.8867, test_loss: 0.8611, test_f1: 0.5168
 epoch: 10, train_loss: 0.8734, test_loss: 1.0963, test_f1: 0.4518
 epoch: 11, train_loss: 0.8537, test_loss: 0.8514, test_f1: 0.5526
 epoch: 12, train_loss: 0.8445, test_loss: 0.9836, test_f1: 0.4964
 epoch: 13, train_loss: 0.8384, test_loss: 0.9516, test_f1: 0.4776
 epoch: 14, train_loss: 0.8283, test_loss: 0.8428, test_f1: 0.5217
 epoch: 15, train_loss: 0.8290, test_loss: 0.9278, test_f1: 0.5079
 epoch: 16, train_loss: 0.8364, test_loss: 0.9576, test_f1: 0.5469
 epoch: 17, train_loss: 0.8105, test_loss: 1.0015, test_f1: 0.5016
 epoch: 18, train_loss: 0.8116, test_loss: 1.0644, test_f1: 0.5114
 epoch: 19, train_loss: 0.8063, test_loss: 0.7772, test_f1: 0.5966
 epoch: 20, train_loss: 0.7889, test_loss: 1.0140, test_f1: 0.4987
 epoch: 21, train_loss: 0.8077, test_loss: 0.8963, test_f1: 0.5132
 epoch: 22, train_loss: 0.7874, test_loss: 0.9827, test_f1: 0.5117
 epoch: 23, train_loss: 0.7788, test_loss: 0.9550, test_f1: 0.5419
 epoch: 24, train_loss: 0.7803, test_loss: 0.9291, test_f1: 0.5763
 epoch: 25, train_loss: 0.7775, test_loss: 1.0379, test_f1: 0.4995
 epoch: 26, train_loss: 0.7628, test_loss: 1.0521, test_f1: 0.4940
 epoch: 27, train_loss: 0.7709, test_loss: 0.7720, test_f1: 0.5388
 epoch: 28, train_loss: 0.7620, test_loss: 1.0143, test_f1: 0.4822
 epoch: 29, train_loss: 0.7576, test_loss: 1.2737, test_f1: 0.4192
 epoch: 30, train_loss: 0.7745, test_loss: 1.0752, test_f1: 0.5064
 epoch: 31, train_loss: 0.7642, test_loss: 0.9109, test_f1: 0.5677
 epoch: 32, train_loss: 0.7651, test_loss: 0.8573, test_f1: 0.5579
 epoch: 33, train_loss: 0.7561, test_loss: 0.9062, test_f1: 0.5425
 epoch: 34, train_loss: 0.7484, test_loss: 0.7325, test_f1: 0.6395
 epoch: 35, train_loss: 0.7617, test_loss: 0.8671, test_f1: 0.6027
 epoch: 36, train_loss: 0.7566, test_loss: 0.8017, test_f1: 0.5727
 epoch: 37, train_loss: 0.7307, test_loss: 0.9229, test_f1: 0.5692
 epoch: 38, train_loss: 0.7150, test_loss: 0.7936, test_f1: 0.5593
 epoch: 39, train_loss: 0.7164, test_loss: 0.7866, test_f1: 0.5658
 epoch: 40, train_loss: 0.7338, test_loss: 0.8299, test_f1: 0.6125
 epoch: 41, train_loss: 0.7260, test_loss: 0.8061, test_f1: 0.5678
 epoch: 42, train_loss: 0.7251, test_loss: 0.9283, test_f1: 0.5604
 epoch: 43, train_loss: 0.7068, test_loss: 0.8398, test_f1: 0.5931
 epoch: 44, train_loss: 0.7113, test_loss: 0.8865, test_f1: 0.5546
 epoch: 45, train_loss: 0.7152, test_loss: 0.8109, test_f1: 0.5629
 epoch: 46, train_loss: 0.7096, test_loss: 0.9174, test_f1: 0.5972
 epoch: 47, train_loss: 0.7146, test_loss: 0.8422, test_f1: 0.6109
 epoch: 48, train_loss: 0.7122, test_loss: 0.8875, test_f1: 0.5962
 epoch: 49, train_loss: 0.7203, test_loss: 0.8093, test_f1: 0.6036
 epoch: 50, train_loss: 0.7191, test_loss: 1.0323, test_f1: 0.5002
 epoch: 51, train_loss: 0.6902, test_loss: 0.8715, test_f1: 0.6152
 epoch: 52, train_loss: 0.6784, test_loss: 0.8353, test_f1: 0.6320
 epoch: 53, train_loss: 0.6524, test_loss: 0.8389, test_f1: 0.6399
 epoch: 54, train_loss: 0.6619, test_loss: 0.8645, test_f1: 0.6236
 epoch: 55, train_loss: 0.6527, test_loss: 0.7758, test_f1: 0.6443
 epoch: 56, train_loss: 0.6381, test_loss: 0.8880, test_f1: 0.6133
 epoch: 57, train_loss: 0.6564, test_loss: 0.8973, test_f1: 0.6389
 epoch: 58, train_loss: 0.6538, test_loss: 0.9308, test_f1: 0.6380
 epoch: 59, train_loss: 0.6445, test_loss: 0.9065, test_f1: 0.6339
 epoch: 60, train_loss: 0.6256, test_loss: 0.9027, test_f1: 0.6329
 epoch: 61, train_loss: 0.6395, test_loss: 0.8984, test_f1: 0.6348
 epoch: 62, train_loss: 0.6278, test_loss: 0.9804, test_f1: 0.6141
 epoch: 63, train_loss: 0.6275, test_loss: 0.9805, test_f1: 0.6158
 epoch: 64, train_loss: 0.6380, test_loss: 0.9266, test_f1: 0.6196
 epoch: 65, train_loss: 0.6294, test_loss: 0.9145, test_f1: 0.6096
 epoch: 66, train_loss: 0.6194, test_loss: 0.9309, test_f1: 0.6173
 epoch: 67, train_loss: 0.6327, test_loss: 0.8481, test_f1: 0.6369
 epoch: 68, train_loss: 0.6204, test_loss: 0.9301, test_f1: 0.6255
 epoch: 69, train_loss: 0.6329, test_loss: 0.8718, test_f1: 0.6386
 epoch: 70, train_loss: 0.6256, test_loss: 0.8406, test_f1: 0.6266
 epoch: 71, train_loss: 0.6274, test_loss: 0.9474, test_f1: 0.6199
 epoch: 72, train_loss: 0.6169, test_loss: 0.9998, test_f1: 0.6141
 epoch: 73, train_loss: 0.6160, test_loss: 0.9545, test_f1: 0.6298
 epoch: 74, train_loss: 0.6270, test_loss: 0.9230, test_f1: 0.6027
 epoch: 75, train_loss: 0.6194, test_loss: 0.9523, test_f1: 0.6249
 epoch: 76, train_loss: 0.6217, test_loss: 0.9624, test_f1: 0.6138
 epoch: 77, train_loss: 0.6043, test_loss: 0.9687, test_f1: 0.6323
 epoch: 78, train_loss: 0.5991, test_loss: 0.9390, test_f1: 0.6204
 epoch: 79, train_loss: 0.6166, test_loss: 0.9826, test_f1: 0.5881
 epoch: 80, train_loss: 0.6089, test_loss: 0.9306, test_f1: 0.6228
 epoch: 81, train_loss: 0.5941, test_loss: 0.9851, test_f1: 0.6048
 epoch: 82, train_loss: 0.5867, test_loss: 1.0168, test_f1: 0.6140
 epoch: 83, train_loss: 0.6051, test_loss: 0.8859, test_f1: 0.6555
 epoch: 84, train_loss: 0.6019, test_loss: 0.9744, test_f1: 0.6212
 epoch: 85, train_loss: 0.5939, test_loss: 0.9390, test_f1: 0.6404
 epoch: 86, train_loss: 0.5988, test_loss: 0.8887, test_f1: 0.6386
 epoch: 87, train_loss: 0.5907, test_loss: 0.8887, test_f1: 0.6492
 epoch: 88, train_loss: 0.6035, test_loss: 1.1036, test_f1: 0.6090
 epoch: 89, train_loss: 0.5976, test_loss: 1.0625, test_f1: 0.6039
 epoch: 90, train_loss: 0.6067, test_loss: 0.8233, test_f1: 0.6061
 epoch: 91, train_loss: 0.5979, test_loss: 0.9867, test_f1: 0.5942
 epoch: 92, train_loss: 0.5799, test_loss: 0.9335, test_f1: 0.6033
 epoch: 93, train_loss: 0.5873, test_loss: 0.9594, test_f1: 0.6028
 epoch: 94, train_loss: 0.5752, test_loss: 1.0311, test_f1: 0.6058
 epoch: 95, train_loss: 0.5820, test_loss: 1.0175, test_f1: 0.6151
 epoch: 96, train_loss: 0.5905, test_loss: 0.9761, test_f1: 0.6249
 epoch: 97, train_loss: 0.5577, test_loss: 0.9427, test_f1: 0.6265
 epoch: 98, train_loss: 0.5943, test_loss: 0.9223, test_f1: 0.6379
 epoch: 99, train_loss: 0.5852, test_loss: 1.1449, test_f1: 0.5889
##################ITERATION #6 ****************************************
 epoch: 0, train_loss: 1.1613, test_loss: 1.0881, test_f1: 0.4725
 epoch: 1, train_loss: 1.0314, test_loss: 1.0792, test_f1: 0.5183
 epoch: 2, train_loss: 1.0131, test_loss: 1.0555, test_f1: 0.5141
 epoch: 3, train_loss: 0.9844, test_loss: 1.0501, test_f1: 0.4285
 epoch: 4, train_loss: 0.9660, test_loss: 1.0312, test_f1: 0.5025
 epoch: 5, train_loss: 0.9302, test_loss: 0.9703, test_f1: 0.5073
 epoch: 6, train_loss: 0.9135, test_loss: 0.9704, test_f1: 0.5177
 epoch: 7, train_loss: 0.9110, test_loss: 0.9785, test_f1: 0.5349
 epoch: 8, train_loss: 0.9252, test_loss: 0.9987, test_f1: 0.5039
 epoch: 9, train_loss: 0.9143, test_loss: 1.2107, test_f1: 0.4193
 epoch: 10, train_loss: 0.9164, test_loss: 0.9159, test_f1: 0.5098
 epoch: 11, train_loss: 0.9146, test_loss: 0.9537, test_f1: 0.4767
 epoch: 12, train_loss: 0.8718, test_loss: 1.0165, test_f1: 0.4941
 epoch: 13, train_loss: 0.8941, test_loss: 0.9826, test_f1: 0.5222
 epoch: 14, train_loss: 0.8661, test_loss: 0.9119, test_f1: 0.5194
 epoch: 15, train_loss: 0.8564, test_loss: 0.9411, test_f1: 0.4915
 epoch: 16, train_loss: 0.8551, test_loss: 1.3407, test_f1: 0.4473
 epoch: 17, train_loss: 0.8489, test_loss: 0.9209, test_f1: 0.5316
 epoch: 18, train_loss: 0.8451, test_loss: 0.8983, test_f1: 0.5633
 epoch: 19, train_loss: 0.8410, test_loss: 1.0852, test_f1: 0.4459
 epoch: 20, train_loss: 0.8521, test_loss: 0.9140, test_f1: 0.5432
 epoch: 21, train_loss: 0.8342, test_loss: 0.9623, test_f1: 0.6195
 epoch: 22, train_loss: 0.8043, test_loss: 0.9898, test_f1: 0.5535
 epoch: 23, train_loss: 0.8284, test_loss: 0.8849, test_f1: 0.5400
 epoch: 24, train_loss: 0.8113, test_loss: 0.8834, test_f1: 0.6083
 epoch: 25, train_loss: 0.7968, test_loss: 0.8939, test_f1: 0.5612
 epoch: 26, train_loss: 0.8020, test_loss: 0.9759, test_f1: 0.5254
 epoch: 27, train_loss: 0.8032, test_loss: 0.9146, test_f1: 0.6172
 epoch: 28, train_loss: 0.7895, test_loss: 0.9377, test_f1: 0.6021
 epoch: 29, train_loss: 0.7896, test_loss: 1.0113, test_f1: 0.5352
 epoch: 30, train_loss: 0.7881, test_loss: 1.0557, test_f1: 0.5481
 epoch: 31, train_loss: 0.7903, test_loss: 0.9831, test_f1: 0.6147
 epoch: 32, train_loss: 0.7808, test_loss: 0.8829, test_f1: 0.5496
 epoch: 33, train_loss: 0.7788, test_loss: 0.9189, test_f1: 0.6248
 epoch: 34, train_loss: 0.7582, test_loss: 0.9111, test_f1: 0.5592
 epoch: 35, train_loss: 0.7597, test_loss: 0.8759, test_f1: 0.6375
 epoch: 36, train_loss: 0.7772, test_loss: 0.9769, test_f1: 0.5489
 epoch: 37, train_loss: 0.7451, test_loss: 0.8748, test_f1: 0.6137
 epoch: 38, train_loss: 0.7583, test_loss: 0.9561, test_f1: 0.5846
 epoch: 39, train_loss: 0.7605, test_loss: 0.8998, test_f1: 0.5859
 epoch: 40, train_loss: 0.7530, test_loss: 0.8724, test_f1: 0.6407
 epoch: 41, train_loss: 0.7488, test_loss: 0.8760, test_f1: 0.5662
 epoch: 42, train_loss: 0.7424, test_loss: 0.9127, test_f1: 0.6234
 epoch: 43, train_loss: 0.7566, test_loss: 0.8762, test_f1: 0.6124
 epoch: 44, train_loss: 0.7442, test_loss: 0.9122, test_f1: 0.5653
 epoch: 45, train_loss: 0.7403, test_loss: 0.8561, test_f1: 0.6025
 epoch: 46, train_loss: 0.7354, test_loss: 0.9727, test_f1: 0.6038
 epoch: 47, train_loss: 0.7394, test_loss: 0.9456, test_f1: 0.5823
 epoch: 48, train_loss: 0.7186, test_loss: 0.9796, test_f1: 0.5865
 epoch: 49, train_loss: 0.7277, test_loss: 0.8943, test_f1: 0.5758
 epoch: 50, train_loss: 0.7222, test_loss: 0.8844, test_f1: 0.6015
 epoch: 51, train_loss: 0.6820, test_loss: 0.9162, test_f1: 0.6427
 epoch: 52, train_loss: 0.6812, test_loss: 0.9186, test_f1: 0.6262
 epoch: 53, train_loss: 0.6702, test_loss: 0.9424, test_f1: 0.6339
 epoch: 54, train_loss: 0.6788, test_loss: 0.8791, test_f1: 0.6657
 epoch: 55, train_loss: 0.6655, test_loss: 0.8832, test_f1: 0.6427
 epoch: 56, train_loss: 0.6582, test_loss: 0.8742, test_f1: 0.6607
 epoch: 57, train_loss: 0.6508, test_loss: 0.8917, test_f1: 0.6204
 epoch: 58, train_loss: 0.6658, test_loss: 0.8783, test_f1: 0.6708
 epoch: 59, train_loss: 0.6550, test_loss: 0.8602, test_f1: 0.6337
 epoch: 60, train_loss: 0.6456, test_loss: 0.9610, test_f1: 0.6361
 epoch: 61, train_loss: 0.6493, test_loss: 0.9986, test_f1: 0.6269
 epoch: 62, train_loss: 0.6659, test_loss: 0.8946, test_f1: 0.6582
 epoch: 63, train_loss: 0.6571, test_loss: 0.9507, test_f1: 0.6442
 epoch: 64, train_loss: 0.6458, test_loss: 0.9910, test_f1: 0.6234
 epoch: 65, train_loss: 0.6294, test_loss: 0.8880, test_f1: 0.6385
 epoch: 66, train_loss: 0.6410, test_loss: 0.8392, test_f1: 0.6294
 epoch: 67, train_loss: 0.6492, test_loss: 0.9472, test_f1: 0.6257
 epoch: 68, train_loss: 0.6438, test_loss: 0.8373, test_f1: 0.6654
 epoch: 69, train_loss: 0.6351, test_loss: 0.8642, test_f1: 0.6691
 epoch: 70, train_loss: 0.6384, test_loss: 0.9165, test_f1: 0.6425
 epoch: 71, train_loss: 0.6248, test_loss: 0.8595, test_f1: 0.6233
 epoch: 72, train_loss: 0.6443, test_loss: 0.9678, test_f1: 0.6320
 epoch: 73, train_loss: 0.6499, test_loss: 0.8472, test_f1: 0.6540
 epoch: 74, train_loss: 0.6286, test_loss: 0.9368, test_f1: 0.6253
 epoch: 75, train_loss: 0.6302, test_loss: 0.9301, test_f1: 0.6292
 epoch: 76, train_loss: 0.6293, test_loss: 0.8768, test_f1: 0.6638
 epoch: 77, train_loss: 0.6144, test_loss: 0.9246, test_f1: 0.6441
 epoch: 78, train_loss: 0.6235, test_loss: 0.8636, test_f1: 0.6417
 epoch: 79, train_loss: 0.6277, test_loss: 0.8631, test_f1: 0.6548
 epoch: 80, train_loss: 0.6119, test_loss: 0.9052, test_f1: 0.6319
 epoch: 81, train_loss: 0.6044, test_loss: 0.8670, test_f1: 0.6483
 epoch: 82, train_loss: 0.6042, test_loss: 0.9380, test_f1: 0.6356
 epoch: 83, train_loss: 0.6018, test_loss: 0.9425, test_f1: 0.6564
 epoch: 84, train_loss: 0.6060, test_loss: 0.9301, test_f1: 0.6482
 epoch: 85, train_loss: 0.6167, test_loss: 0.9047, test_f1: 0.6457
 epoch: 86, train_loss: 0.5947, test_loss: 0.9997, test_f1: 0.6308
 epoch: 87, train_loss: 0.6062, test_loss: 0.9933, test_f1: 0.6306
 epoch: 88, train_loss: 0.6083, test_loss: 0.9517, test_f1: 0.6380
 epoch: 89, train_loss: 0.5850, test_loss: 0.9734, test_f1: 0.6532
 epoch: 90, train_loss: 0.6039, test_loss: 1.2031, test_f1: 0.5649
 epoch: 91, train_loss: 0.6210, test_loss: 0.9520, test_f1: 0.6363
 epoch: 92, train_loss: 0.6106, test_loss: 0.9381, test_f1: 0.6384
 epoch: 93, train_loss: 0.6048, test_loss: 1.0174, test_f1: 0.6285
 epoch: 94, train_loss: 0.5772, test_loss: 0.9839, test_f1: 0.6328
 epoch: 95, train_loss: 0.5890, test_loss: 0.9364, test_f1: 0.6351
 epoch: 96, train_loss: 0.5877, test_loss: 0.8846, test_f1: 0.6512
 epoch: 97, train_loss: 0.5832, test_loss: 0.9449, test_f1: 0.6337
 epoch: 98, train_loss: 0.5803, test_loss: 1.0055, test_f1: 0.6524
 epoch: 99, train_loss: 0.5793, test_loss: 0.9565, test_f1: 0.6472
##################ITERATION #7 ****************************************
 epoch: 0, train_loss: 1.1525, test_loss: 1.0725, test_f1: 0.4160
 epoch: 1, train_loss: 1.0385, test_loss: 1.0890, test_f1: 0.4204
 epoch: 2, train_loss: 1.0044, test_loss: 1.0407, test_f1: 0.4603
 epoch: 3, train_loss: 0.9736, test_loss: 1.0289, test_f1: 0.4881
 epoch: 4, train_loss: 0.9535, test_loss: 1.0194, test_f1: 0.4747
 epoch: 5, train_loss: 0.9521, test_loss: 0.9603, test_f1: 0.5597
 epoch: 6, train_loss: 0.9331, test_loss: 1.0506, test_f1: 0.4754
 epoch: 7, train_loss: 0.9358, test_loss: 1.0461, test_f1: 0.4274
 epoch: 8, train_loss: 0.9108, test_loss: 1.0630, test_f1: 0.4765
 epoch: 9, train_loss: 0.9183, test_loss: 0.9888, test_f1: 0.5147
 epoch: 10, train_loss: 0.9210, test_loss: 0.9376, test_f1: 0.5194
 epoch: 11, train_loss: 0.8854, test_loss: 0.9569, test_f1: 0.5096
 epoch: 12, train_loss: 0.8888, test_loss: 1.0955, test_f1: 0.4717
 epoch: 13, train_loss: 0.8648, test_loss: 0.9531, test_f1: 0.5101
 epoch: 14, train_loss: 0.8323, test_loss: 1.0964, test_f1: 0.5095
 epoch: 15, train_loss: 0.8429, test_loss: 1.0214, test_f1: 0.5318
 epoch: 16, train_loss: 0.8544, test_loss: 1.0007, test_f1: 0.5315
 epoch: 17, train_loss: 0.8527, test_loss: 0.9138, test_f1: 0.5145
 epoch: 18, train_loss: 0.8223, test_loss: 0.9024, test_f1: 0.5360
 epoch: 19, train_loss: 0.8291, test_loss: 0.9478, test_f1: 0.5247
 epoch: 20, train_loss: 0.8209, test_loss: 0.9633, test_f1: 0.5428
 epoch: 21, train_loss: 0.8104, test_loss: 1.0882, test_f1: 0.4955
 epoch: 22, train_loss: 0.8117, test_loss: 0.9640, test_f1: 0.5063
 epoch: 23, train_loss: 0.8024, test_loss: 1.0450, test_f1: 0.4984
 epoch: 24, train_loss: 0.7895, test_loss: 1.0142, test_f1: 0.5660
 epoch: 25, train_loss: 0.7838, test_loss: 0.9769, test_f1: 0.5268
 epoch: 26, train_loss: 0.7916, test_loss: 0.9673, test_f1: 0.5512
 epoch: 27, train_loss: 0.7981, test_loss: 1.0951, test_f1: 0.5128
 epoch: 28, train_loss: 0.7885, test_loss: 0.9339, test_f1: 0.5761
 epoch: 29, train_loss: 0.7967, test_loss: 1.0486, test_f1: 0.5317
 epoch: 30, train_loss: 0.7844, test_loss: 0.9026, test_f1: 0.5418
 epoch: 31, train_loss: 0.7778, test_loss: 0.9557, test_f1: 0.5668
 epoch: 32, train_loss: 0.7593, test_loss: 0.9936, test_f1: 0.5284
 epoch: 33, train_loss: 0.7558, test_loss: 0.9561, test_f1: 0.5599
 epoch: 34, train_loss: 0.7621, test_loss: 0.9216, test_f1: 0.5854
 epoch: 35, train_loss: 0.7414, test_loss: 0.9435, test_f1: 0.5922
 epoch: 36, train_loss: 0.7349, test_loss: 0.9291, test_f1: 0.6174
 epoch: 37, train_loss: 0.7270, test_loss: 0.9577, test_f1: 0.5549
 epoch: 38, train_loss: 0.7550, test_loss: 0.9985, test_f1: 0.5338
 epoch: 39, train_loss: 0.7312, test_loss: 0.9755, test_f1: 0.5585
 epoch: 40, train_loss: 0.7454, test_loss: 0.9200, test_f1: 0.5423
 epoch: 41, train_loss: 0.7412, test_loss: 1.0508, test_f1: 0.5029
 epoch: 42, train_loss: 0.7355, test_loss: 0.9145, test_f1: 0.5755
 epoch: 43, train_loss: 0.7293, test_loss: 0.9921, test_f1: 0.6023
 epoch: 44, train_loss: 0.7138, test_loss: 0.9728, test_f1: 0.5738
 epoch: 45, train_loss: 0.7268, test_loss: 1.0167, test_f1: 0.5602
 epoch: 46, train_loss: 0.7292, test_loss: 0.9800, test_f1: 0.5197
 epoch: 47, train_loss: 0.7225, test_loss: 0.8415, test_f1: 0.6258
 epoch: 48, train_loss: 0.7003, test_loss: 0.9395, test_f1: 0.5203
 epoch: 49, train_loss: 0.7017, test_loss: 0.9849, test_f1: 0.5588
 epoch: 50, train_loss: 0.6928, test_loss: 0.9041, test_f1: 0.5902
 epoch: 51, train_loss: 0.6803, test_loss: 0.8924, test_f1: 0.5594
 epoch: 52, train_loss: 0.6671, test_loss: 0.9198, test_f1: 0.6550
 epoch: 53, train_loss: 0.6493, test_loss: 0.9523, test_f1: 0.6255
 epoch: 54, train_loss: 0.6609, test_loss: 0.9345, test_f1: 0.6235
 epoch: 55, train_loss: 0.6515, test_loss: 0.9168, test_f1: 0.6192
 epoch: 56, train_loss: 0.6432, test_loss: 0.9545, test_f1: 0.5590
 epoch: 57, train_loss: 0.6602, test_loss: 0.9825, test_f1: 0.5661
 epoch: 58, train_loss: 0.6401, test_loss: 0.9780, test_f1: 0.6037
 epoch: 59, train_loss: 0.6427, test_loss: 1.1062, test_f1: 0.5537
 epoch: 60, train_loss: 0.6645, test_loss: 1.0303, test_f1: 0.5883
 epoch: 61, train_loss: 0.6317, test_loss: 0.9794, test_f1: 0.6086
 epoch: 62, train_loss: 0.6428, test_loss: 1.1009, test_f1: 0.5210
 epoch: 63, train_loss: 0.6311, test_loss: 0.9991, test_f1: 0.6079
 epoch: 64, train_loss: 0.6204, test_loss: 0.9380, test_f1: 0.6092
 epoch: 65, train_loss: 0.6242, test_loss: 1.0125, test_f1: 0.6083
 epoch: 66, train_loss: 0.6095, test_loss: 1.0091, test_f1: 0.6137
 epoch: 67, train_loss: 0.6214, test_loss: 1.0894, test_f1: 0.6067
 epoch: 68, train_loss: 0.6156, test_loss: 1.1141, test_f1: 0.5875
 epoch: 69, train_loss: 0.6180, test_loss: 1.0285, test_f1: 0.6147
 epoch: 70, train_loss: 0.6140, test_loss: 1.0151, test_f1: 0.6159
 epoch: 71, train_loss: 0.6305, test_loss: 1.0626, test_f1: 0.6099
 epoch: 72, train_loss: 0.6274, test_loss: 0.9908, test_f1: 0.6301
 epoch: 73, train_loss: 0.6342, test_loss: 0.9939, test_f1: 0.6353
 epoch: 74, train_loss: 0.6143, test_loss: 0.9883, test_f1: 0.6541
 epoch: 75, train_loss: 0.6105, test_loss: 1.0471, test_f1: 0.6477
 epoch: 76, train_loss: 0.6097, test_loss: 1.0040, test_f1: 0.6229
 epoch: 77, train_loss: 0.6172, test_loss: 1.0778, test_f1: 0.6175
 epoch: 78, train_loss: 0.6069, test_loss: 0.9939, test_f1: 0.6465
 epoch: 79, train_loss: 0.6109, test_loss: 1.0860, test_f1: 0.6254
 epoch: 80, train_loss: 0.5999, test_loss: 1.1008, test_f1: 0.6024
 epoch: 81, train_loss: 0.6053, test_loss: 1.0346, test_f1: 0.6221
 epoch: 82, train_loss: 0.6029, test_loss: 1.2038, test_f1: 0.5859
 epoch: 83, train_loss: 0.6017, test_loss: 1.0965, test_f1: 0.6381
 epoch: 84, train_loss: 0.5997, test_loss: 1.0821, test_f1: 0.6159
 epoch: 85, train_loss: 0.5854, test_loss: 1.0634, test_f1: 0.6146
 epoch: 86, train_loss: 0.5982, test_loss: 1.1519, test_f1: 0.5906
 epoch: 87, train_loss: 0.5935, test_loss: 1.1433, test_f1: 0.6212
 epoch: 88, train_loss: 0.5842, test_loss: 1.1674, test_f1: 0.6109
 epoch: 89, train_loss: 0.5772, test_loss: 1.1141, test_f1: 0.6283
 epoch: 90, train_loss: 0.6053, test_loss: 1.1957, test_f1: 0.5996
 epoch: 91, train_loss: 0.5868, test_loss: 1.0815, test_f1: 0.6487
 epoch: 92, train_loss: 0.5837, test_loss: 1.0895, test_f1: 0.6446
 epoch: 93, train_loss: 0.5843, test_loss: 1.1105, test_f1: 0.5896
 epoch: 94, train_loss: 0.5888, test_loss: 1.1202, test_f1: 0.6081
 epoch: 95, train_loss: 0.5817, test_loss: 1.3135, test_f1: 0.5887
 epoch: 96, train_loss: 0.5803, test_loss: 1.1169, test_f1: 0.6036
 epoch: 97, train_loss: 0.5917, test_loss: 1.1717, test_f1: 0.6018
 epoch: 98, train_loss: 0.5826, test_loss: 1.1817, test_f1: 0.6098
 epoch: 99, train_loss: 0.5830, test_loss: 1.0935, test_f1: 0.6517
##################ITERATION #8 ****************************************
 epoch: 0, train_loss: 1.1831, test_loss: 1.1082, test_f1: 0.4027
 epoch: 1, train_loss: 1.0545, test_loss: 1.0861, test_f1: 0.4573
 epoch: 2, train_loss: 0.9995, test_loss: 0.9990, test_f1: 0.4511
 epoch: 3, train_loss: 0.9966, test_loss: 1.1870, test_f1: 0.4372
 epoch: 4, train_loss: 0.9853, test_loss: 0.9750, test_f1: 0.4727
 epoch: 5, train_loss: 0.9856, test_loss: 1.0406, test_f1: 0.4618
 epoch: 6, train_loss: 0.9831, test_loss: 1.0311, test_f1: 0.4522
 epoch: 7, train_loss: 0.9426, test_loss: 0.9604, test_f1: 0.4989
 epoch: 8, train_loss: 0.9339, test_loss: 0.9381, test_f1: 0.4629
 epoch: 9, train_loss: 0.9145, test_loss: 0.8889, test_f1: 0.4877
 epoch: 10, train_loss: 0.9000, test_loss: 1.0209, test_f1: 0.4904
 epoch: 11, train_loss: 0.9031, test_loss: 0.9441, test_f1: 0.5003
 epoch: 12, train_loss: 0.8836, test_loss: 1.1187, test_f1: 0.4159
 epoch: 13, train_loss: 0.8844, test_loss: 0.8951, test_f1: 0.5394
 epoch: 14, train_loss: 0.8690, test_loss: 0.8702, test_f1: 0.5852
 epoch: 15, train_loss: 0.8692, test_loss: 1.0206, test_f1: 0.5490
 epoch: 16, train_loss: 0.8711, test_loss: 0.9126, test_f1: 0.5203
 epoch: 17, train_loss: 0.8505, test_loss: 0.8679, test_f1: 0.5937
 epoch: 18, train_loss: 0.8359, test_loss: 0.9628, test_f1: 0.5753
 epoch: 19, train_loss: 0.8358, test_loss: 1.8384, test_f1: 0.3902
 epoch: 20, train_loss: 0.8411, test_loss: 0.8678, test_f1: 0.5965
 epoch: 21, train_loss: 0.8253, test_loss: 0.9028, test_f1: 0.5208
 epoch: 22, train_loss: 0.8329, test_loss: 0.8737, test_f1: 0.5205
 epoch: 23, train_loss: 0.8204, test_loss: 0.8665, test_f1: 0.6055
 epoch: 24, train_loss: 0.8222, test_loss: 0.8509, test_f1: 0.6126
 epoch: 25, train_loss: 0.8141, test_loss: 0.8662, test_f1: 0.5983
 epoch: 26, train_loss: 0.8098, test_loss: 0.9879, test_f1: 0.4976
 epoch: 27, train_loss: 0.8155, test_loss: 0.8089, test_f1: 0.5392
 epoch: 28, train_loss: 0.8127, test_loss: 1.0421, test_f1: 0.4719
 epoch: 29, train_loss: 0.7987, test_loss: 0.8602, test_f1: 0.5645
 epoch: 30, train_loss: 0.7962, test_loss: 0.8074, test_f1: 0.5777
 epoch: 31, train_loss: 0.7981, test_loss: 0.9063, test_f1: 0.6107
 epoch: 32, train_loss: 0.7841, test_loss: 0.8759, test_f1: 0.5430
 epoch: 33, train_loss: 0.7784, test_loss: 0.9141, test_f1: 0.5530
 epoch: 34, train_loss: 0.7605, test_loss: 0.9898, test_f1: 0.5458
 epoch: 35, train_loss: 0.7777, test_loss: 0.8956, test_f1: 0.5556
 epoch: 36, train_loss: 0.7725, test_loss: 0.8559, test_f1: 0.5878
 epoch: 37, train_loss: 0.7645, test_loss: 0.8923, test_f1: 0.5986
 epoch: 38, train_loss: 0.7819, test_loss: 0.9287, test_f1: 0.5348
 epoch: 39, train_loss: 0.7684, test_loss: 0.8868, test_f1: 0.5790
 epoch: 40, train_loss: 0.7548, test_loss: 0.8455, test_f1: 0.6266
 epoch: 41, train_loss: 0.7436, test_loss: 0.9137, test_f1: 0.5884
 epoch: 42, train_loss: 0.7670, test_loss: 0.8340, test_f1: 0.6329
 epoch: 43, train_loss: 0.7757, test_loss: 0.8764, test_f1: 0.5957
 epoch: 44, train_loss: 0.7388, test_loss: 1.0266, test_f1: 0.4857
 epoch: 45, train_loss: 0.7571, test_loss: 0.8489, test_f1: 0.5685
 epoch: 46, train_loss: 0.7322, test_loss: 0.9102, test_f1: 0.5723
 epoch: 47, train_loss: 0.7373, test_loss: 0.8424, test_f1: 0.6462
 epoch: 48, train_loss: 0.7498, test_loss: 0.8161, test_f1: 0.5804
 epoch: 49, train_loss: 0.7575, test_loss: 0.8581, test_f1: 0.5454
 epoch: 50, train_loss: 0.7543, test_loss: 0.9019, test_f1: 0.5221
 epoch: 51, train_loss: 0.7164, test_loss: 0.7864, test_f1: 0.6313
 epoch: 52, train_loss: 0.6979, test_loss: 0.8052, test_f1: 0.5853
 epoch: 53, train_loss: 0.6887, test_loss: 0.8016, test_f1: 0.6327
 epoch: 54, train_loss: 0.6808, test_loss: 0.8318, test_f1: 0.6321
 epoch: 55, train_loss: 0.6885, test_loss: 0.8357, test_f1: 0.6102
 epoch: 56, train_loss: 0.6737, test_loss: 0.7978, test_f1: 0.6390
 epoch: 57, train_loss: 0.6783, test_loss: 0.8255, test_f1: 0.6423
 epoch: 58, train_loss: 0.6569, test_loss: 0.9142, test_f1: 0.6098
 epoch: 59, train_loss: 0.6729, test_loss: 0.8189, test_f1: 0.6558
 epoch: 60, train_loss: 0.6779, test_loss: 0.8257, test_f1: 0.6614
 epoch: 61, train_loss: 0.6755, test_loss: 0.8547, test_f1: 0.6402
 epoch: 62, train_loss: 0.6789, test_loss: 0.8622, test_f1: 0.6388
 epoch: 63, train_loss: 0.6851, test_loss: 0.8548, test_f1: 0.5548
 epoch: 64, train_loss: 0.6726, test_loss: 0.8282, test_f1: 0.6414
 epoch: 65, train_loss: 0.6605, test_loss: 0.8323, test_f1: 0.6011
 epoch: 66, train_loss: 0.6515, test_loss: 0.8970, test_f1: 0.5725
 epoch: 67, train_loss: 0.6693, test_loss: 0.8245, test_f1: 0.6308
 epoch: 68, train_loss: 0.6424, test_loss: 0.8497, test_f1: 0.6356
 epoch: 69, train_loss: 0.6342, test_loss: 0.8639, test_f1: 0.6223
 epoch: 70, train_loss: 0.6648, test_loss: 0.8629, test_f1: 0.6206
 epoch: 71, train_loss: 0.6633, test_loss: 0.8981, test_f1: 0.6478
 epoch: 72, train_loss: 0.6522, test_loss: 0.8399, test_f1: 0.6505
 epoch: 73, train_loss: 0.6369, test_loss: 0.8160, test_f1: 0.6435
 epoch: 74, train_loss: 0.6518, test_loss: 0.8738, test_f1: 0.6501
 epoch: 75, train_loss: 0.6357, test_loss: 0.8356, test_f1: 0.6412
 epoch: 76, train_loss: 0.6275, test_loss: 0.8828, test_f1: 0.6419
 epoch: 77, train_loss: 0.6224, test_loss: 0.8485, test_f1: 0.6681
 epoch: 78, train_loss: 0.6330, test_loss: 0.9055, test_f1: 0.6195
 epoch: 79, train_loss: 0.6329, test_loss: 0.8652, test_f1: 0.6284
 epoch: 80, train_loss: 0.6396, test_loss: 0.8261, test_f1: 0.6571
 epoch: 81, train_loss: 0.6344, test_loss: 0.9040, test_f1: 0.5895
 epoch: 82, train_loss: 0.6216, test_loss: 1.0606, test_f1: 0.5600
 epoch: 83, train_loss: 0.6358, test_loss: 0.8512, test_f1: 0.6707
 epoch: 84, train_loss: 0.6230, test_loss: 0.8604, test_f1: 0.6450
 epoch: 85, train_loss: 0.6214, test_loss: 0.8475, test_f1: 0.6277
 epoch: 86, train_loss: 0.6124, test_loss: 0.8638, test_f1: 0.6687
 epoch: 87, train_loss: 0.6061, test_loss: 0.8803, test_f1: 0.6581
 epoch: 88, train_loss: 0.6234, test_loss: 0.8529, test_f1: 0.6712
 epoch: 89, train_loss: 0.6109, test_loss: 0.9472, test_f1: 0.6368
 epoch: 90, train_loss: 0.6064, test_loss: 0.8696, test_f1: 0.6659
 epoch: 91, train_loss: 0.6183, test_loss: 0.8506, test_f1: 0.6652
 epoch: 92, train_loss: 0.6260, test_loss: 0.8903, test_f1: 0.6320
 epoch: 93, train_loss: 0.6110, test_loss: 0.8998, test_f1: 0.6585
 epoch: 94, train_loss: 0.6107, test_loss: 0.8657, test_f1: 0.6526
 epoch: 95, train_loss: 0.6052, test_loss: 0.8883, test_f1: 0.6581
 epoch: 96, train_loss: 0.5936, test_loss: 0.9988, test_f1: 0.6525
 epoch: 97, train_loss: 0.6047, test_loss: 0.9366, test_f1: 0.6670
 epoch: 98, train_loss: 0.6008, test_loss: 0.9071, test_f1: 0.6450
 epoch: 99, train_loss: 0.5876, test_loss: 0.9192, test_f1: 0.6295
##################ITERATION #9 ****************************************
 epoch: 0, train_loss: 1.1392, test_loss: 1.1166, test_f1: 0.4210
 epoch: 1, train_loss: 1.0294, test_loss: 1.1079, test_f1: 0.4492
 epoch: 2, train_loss: 1.0159, test_loss: 1.0890, test_f1: 0.5142
 epoch: 3, train_loss: 0.9912, test_loss: 1.0365, test_f1: 0.4857
 epoch: 4, train_loss: 0.9675, test_loss: 0.9875, test_f1: 0.4614
 epoch: 5, train_loss: 0.9442, test_loss: 0.9991, test_f1: 0.4729
 epoch: 6, train_loss: 0.9393, test_loss: 0.9676, test_f1: 0.5239
 epoch: 7, train_loss: 0.9332, test_loss: 0.9758, test_f1: 0.4815
 epoch: 8, train_loss: 0.9054, test_loss: 0.9701, test_f1: 0.4983
 epoch: 9, train_loss: 0.8780, test_loss: 1.0208, test_f1: 0.4607
 epoch: 10, train_loss: 0.8796, test_loss: 0.9266, test_f1: 0.5184
 epoch: 11, train_loss: 0.8850, test_loss: 1.0030, test_f1: 0.4972
 epoch: 12, train_loss: 0.8638, test_loss: 1.0148, test_f1: 0.5520
 epoch: 13, train_loss: 0.8770, test_loss: 0.9485, test_f1: 0.5289
 epoch: 14, train_loss: 0.8450, test_loss: 0.9662, test_f1: 0.5585
 epoch: 15, train_loss: 0.8476, test_loss: 0.9341, test_f1: 0.5332
 epoch: 16, train_loss: 0.8627, test_loss: 0.9285, test_f1: 0.5377
 epoch: 17, train_loss: 0.8455, test_loss: 0.9676, test_f1: 0.5256
 epoch: 18, train_loss: 0.8259, test_loss: 0.9029, test_f1: 0.5335
 epoch: 19, train_loss: 0.8159, test_loss: 0.9072, test_f1: 0.5832
 epoch: 20, train_loss: 0.8282, test_loss: 0.9329, test_f1: 0.5354
 epoch: 21, train_loss: 0.8054, test_loss: 0.9387, test_f1: 0.5255
 epoch: 22, train_loss: 0.8273, test_loss: 1.0126, test_f1: 0.5045
 epoch: 23, train_loss: 0.7936, test_loss: 0.9391, test_f1: 0.5899
 epoch: 24, train_loss: 0.7997, test_loss: 0.8993, test_f1: 0.6137
 epoch: 25, train_loss: 0.7891, test_loss: 0.9000, test_f1: 0.5325
 epoch: 26, train_loss: 0.8131, test_loss: 0.9131, test_f1: 0.5513
 epoch: 27, train_loss: 0.7871, test_loss: 0.9737, test_f1: 0.5104
 epoch: 28, train_loss: 0.8031, test_loss: 0.9439, test_f1: 0.5364
 epoch: 29, train_loss: 0.7825, test_loss: 1.0928, test_f1: 0.4962
 epoch: 30, train_loss: 0.7942, test_loss: 0.9110, test_f1: 0.5700
 epoch: 31, train_loss: 0.7884, test_loss: 1.0306, test_f1: 0.5195
 epoch: 32, train_loss: 0.7814, test_loss: 1.0185, test_f1: 0.5312
 epoch: 33, train_loss: 0.7799, test_loss: 0.9483, test_f1: 0.5608
 epoch: 34, train_loss: 0.7596, test_loss: 1.0377, test_f1: 0.5556
 epoch: 35, train_loss: 0.7425, test_loss: 0.9045, test_f1: 0.5791
 epoch: 36, train_loss: 0.7530, test_loss: 0.8702, test_f1: 0.5936
 epoch: 37, train_loss: 0.7504, test_loss: 0.9175, test_f1: 0.5633
 epoch: 38, train_loss: 0.7494, test_loss: 0.8864, test_f1: 0.6295
 epoch: 39, train_loss: 0.7591, test_loss: 0.9632, test_f1: 0.5792
 epoch: 40, train_loss: 0.7659, test_loss: 0.9003, test_f1: 0.5778
 epoch: 41, train_loss: 0.7448, test_loss: 0.8630, test_f1: 0.5500
 epoch: 42, train_loss: 0.7398, test_loss: 0.9405, test_f1: 0.5607
 epoch: 43, train_loss: 0.7211, test_loss: 0.9356, test_f1: 0.5155
 epoch: 44, train_loss: 0.7446, test_loss: 0.8712, test_f1: 0.6422
 epoch: 45, train_loss: 0.7430, test_loss: 0.8496, test_f1: 0.5812
 epoch: 46, train_loss: 0.7102, test_loss: 0.8836, test_f1: 0.6096
 epoch: 47, train_loss: 0.7397, test_loss: 0.9947, test_f1: 0.5628
 epoch: 48, train_loss: 0.7298, test_loss: 0.9457, test_f1: 0.5971
 epoch: 49, train_loss: 0.7253, test_loss: 0.9240, test_f1: 0.5891
 epoch: 50, train_loss: 0.7316, test_loss: 0.9064, test_f1: 0.5963
 epoch: 51, train_loss: 0.6913, test_loss: 0.9047, test_f1: 0.5764
 epoch: 52, train_loss: 0.6663, test_loss: 0.8943, test_f1: 0.5982
 epoch: 53, train_loss: 0.6558, test_loss: 0.9599, test_f1: 0.6056
 epoch: 54, train_loss: 0.6501, test_loss: 0.9459, test_f1: 0.5994
 epoch: 55, train_loss: 0.6423, test_loss: 0.9257, test_f1: 0.5856
 epoch: 56, train_loss: 0.6518, test_loss: 0.9562, test_f1: 0.5734
 epoch: 57, train_loss: 0.6433, test_loss: 0.9173, test_f1: 0.6149
 epoch: 58, train_loss: 0.6556, test_loss: 0.9356, test_f1: 0.5773
 epoch: 59, train_loss: 0.6431, test_loss: 0.9575, test_f1: 0.6049
 epoch: 60, train_loss: 0.6371, test_loss: 0.9490, test_f1: 0.5991
 epoch: 61, train_loss: 0.6296, test_loss: 0.9536, test_f1: 0.6290
 epoch: 62, train_loss: 0.6537, test_loss: 0.9283, test_f1: 0.5910
 epoch: 63, train_loss: 0.6239, test_loss: 1.0104, test_f1: 0.6218
 epoch: 64, train_loss: 0.6783, test_loss: 0.9573, test_f1: 0.6139
 epoch: 65, train_loss: 0.6370, test_loss: 0.9988, test_f1: 0.5973
 epoch: 66, train_loss: 0.6310, test_loss: 0.9358, test_f1: 0.6212
 epoch: 67, train_loss: 0.6328, test_loss: 0.8858, test_f1: 0.6093
 epoch: 68, train_loss: 0.6232, test_loss: 0.9303, test_f1: 0.6152
 epoch: 69, train_loss: 0.6068, test_loss: 0.9463, test_f1: 0.6225
 epoch: 70, train_loss: 0.6120, test_loss: 1.0394, test_f1: 0.6464
 epoch: 71, train_loss: 0.6144, test_loss: 0.9343, test_f1: 0.6336
 epoch: 72, train_loss: 0.5984, test_loss: 0.9701, test_f1: 0.6135
 epoch: 73, train_loss: 0.6179, test_loss: 0.9350, test_f1: 0.6435
 epoch: 74, train_loss: 0.6153, test_loss: 0.9687, test_f1: 0.6285
 epoch: 75, train_loss: 0.6249, test_loss: 0.9767, test_f1: 0.6215
 epoch: 76, train_loss: 0.6258, test_loss: 0.9904, test_f1: 0.6188
 epoch: 77, train_loss: 0.6129, test_loss: 0.9523, test_f1: 0.6209
 epoch: 78, train_loss: 0.6023, test_loss: 0.9476, test_f1: 0.6377
 epoch: 79, train_loss: 0.5901, test_loss: 0.9767, test_f1: 0.6263
 epoch: 80, train_loss: 0.5963, test_loss: 0.9546, test_f1: 0.6333
 epoch: 81, train_loss: 0.5987, test_loss: 1.0334, test_f1: 0.6265
 epoch: 82, train_loss: 0.6020, test_loss: 1.0429, test_f1: 0.6218
 epoch: 83, train_loss: 0.5797, test_loss: 1.0207, test_f1: 0.6459
 epoch: 84, train_loss: 0.5796, test_loss: 1.0988, test_f1: 0.6252
 epoch: 85, train_loss: 0.5836, test_loss: 1.0321, test_f1: 0.6154
 epoch: 86, train_loss: 0.6190, test_loss: 1.0742, test_f1: 0.6041
 epoch: 87, train_loss: 0.6021, test_loss: 1.1646, test_f1: 0.6405
 epoch: 88, train_loss: 0.5786, test_loss: 1.0794, test_f1: 0.6304
 epoch: 89, train_loss: 0.5733, test_loss: 1.1391, test_f1: 0.6286
 epoch: 90, train_loss: 0.5947, test_loss: 1.1667, test_f1: 0.6138
 epoch: 91, train_loss: 0.5725, test_loss: 1.1512, test_f1: 0.6305
 epoch: 92, train_loss: 0.6037, test_loss: 1.1251, test_f1: 0.6091
 epoch: 93, train_loss: 0.5985, test_loss: 1.0437, test_f1: 0.6169
 epoch: 94, train_loss: 0.5778, test_loss: 1.0954, test_f1: 0.5997
 epoch: 95, train_loss: 0.5977, test_loss: 1.0629, test_f1: 0.5756
 epoch: 96, train_loss: 0.5995, test_loss: 1.0743, test_f1: 0.6276
 epoch: 97, train_loss: 0.5691, test_loss: 0.9896, test_f1: 0.6154
 epoch: 98, train_loss: 0.5785, test_loss: 1.0851, test_f1: 0.6170
 epoch: 99, train_loss: 0.5702, test_loss: 1.0513, test_f1: 0.6003

Training completed in 1145.70 seconds
Best F1: 0.6918 at epoch 89
Mean F1 across iterations: 0.6682  0.0142
========================FINAL RESULTS================================
FEGIN weighted F1: 0.6918  0.0142
python main.py --data ltspice_examples --representation component_pin --model FEGIN --layers 6 --hiddens 32 --batch_size 64 --lr 0.01 --emb_size 250 --epochs 100 --save_appendix component_pin_L6_H32_BS64_LR0.01_E250 --no_val
-----



STDERR:
  File "main.py", line 370, in <module>
    main()
  File "main.py", line 254, in main
    dataset = dataset_class(
  File "/home/philip/projects/llm_inference_code_repo/Circuit-Completion-Using-GNNs/component_classification_with_link_prediction_head/evaluation/FEGIN/kernel/circuit_datasets.py", line 15, in __init__
    self.data, self.slices = torch.load(self.processed_paths[0])
  File "/home/philip/.local/lib/python3.8/site-packages/torch/serialization.py", line 1040, in load
    warnings.warn(
  File "/usr/lib/python3.8/warnings.py", line 109, in _showwarnmsg
    sw(msg.message, msg.category, msg.filename, msg.lineno,
  File "main.py", line 47, in warn_with_traceback
    traceback.print_stack(file=log)
/home/philip/projects/llm_inference_code_repo/Circuit-Completion-Using-GNNs/component_classification_with_link_prediction_head/evaluation/FEGIN/kernel/circuit_datasets.py:15: FutureWarning: You are using `torch.load` with `weights_only=False` (the current default value), which uses the default pickle module implicitly. It is possible to construct malicious pickle data which will execute arbitrary code during unpickling (See https://github.com/pytorch/pytorch/blob/main/SECURITY.md#untrusted-models for more details). In a future release, the default value for `weights_only` will be flipped to `True`. This limits the functions that could be executed during unpickling. Arbitrary objects will no longer be allowed to be loaded via this mode unless they are explicitly allowlisted by the user via `torch.serialization.add_safe_globals`. We recommend you start setting `weights_only=True` for any use case where you don't have full control of the loaded file. Please open an issue on GitHub for any issues related to this experimental feature.
  self.data, self.slices = torch.load(self.processed_paths[0])
