STDOUT:
Results will be saved in /home/philip/projects/ltspice_examples_code_repo/Circuit-Completion-Using-GNNs/component_classification_with_link_prediction_head/evaluation/FEGIN/results/model_FEGIN_dataset_ltspice_demos
Command line input: python main.py --data ltspice_demos --representation component_pin --model FEGIN --layers 6 --hiddens 128 --batch_size 64 --lr 0.0001 --emb_size 512 --epochs 100 --save_appendix component_pin_L6_H128_BS64_LR0.0001_E512 --no_val
 is saved.
-----
ltspice_demos - FEGIN
Using 6 layers, 128 hidden units, h = 2
Loading component_pin representation dataset
ENTERED
Training FEGIN on component_pin representation
Train: 1565, Test: 383
##################ITERATION #0 ****************************************
 epoch: 0, train_loss: 1.3718, test_loss: 1.3675, test_f1: 0.2281
 epoch: 1, train_loss: 1.3487, test_loss: 1.3529, test_f1: 0.2281
 epoch: 2, train_loss: 1.3238, test_loss: 1.3316, test_f1: 0.2281
 epoch: 3, train_loss: 1.2865, test_loss: 1.2962, test_f1: 0.2585
 epoch: 4, train_loss: 1.2405, test_loss: 1.2636, test_f1: 0.2732
 epoch: 5, train_loss: 1.1944, test_loss: 1.2333, test_f1: 0.3426
 epoch: 6, train_loss: 1.1572, test_loss: 1.2038, test_f1: 0.3426
 epoch: 7, train_loss: 1.1256, test_loss: 1.1708, test_f1: 0.4238
 epoch: 8, train_loss: 1.0973, test_loss: 1.1441, test_f1: 0.4451
 epoch: 9, train_loss: 1.0599, test_loss: 1.1051, test_f1: 0.4736
 epoch: 10, train_loss: 1.0259, test_loss: 1.0789, test_f1: 0.4759
 epoch: 11, train_loss: 0.9852, test_loss: 1.0486, test_f1: 0.4745
 epoch: 12, train_loss: 0.9481, test_loss: 1.0439, test_f1: 0.4781
 epoch: 13, train_loss: 0.9202, test_loss: 1.0113, test_f1: 0.5280
 epoch: 14, train_loss: 0.8981, test_loss: 1.0052, test_f1: 0.5564
 epoch: 15, train_loss: 0.8686, test_loss: 0.9826, test_f1: 0.5883
 epoch: 16, train_loss: 0.8579, test_loss: 0.9845, test_f1: 0.5945
 epoch: 17, train_loss: 0.8318, test_loss: 0.9763, test_f1: 0.5652
 epoch: 18, train_loss: 0.8103, test_loss: 1.0001, test_f1: 0.5897
 epoch: 19, train_loss: 0.7970, test_loss: 0.9759, test_f1: 0.5939
 epoch: 20, train_loss: 0.7810, test_loss: 0.9984, test_f1: 0.5877
 epoch: 21, train_loss: 0.7531, test_loss: 0.9910, test_f1: 0.6223
 epoch: 22, train_loss: 0.7430, test_loss: 1.0018, test_f1: 0.5962
 epoch: 23, train_loss: 0.7236, test_loss: 1.0460, test_f1: 0.5589
 epoch: 24, train_loss: 0.7161, test_loss: 1.0690, test_f1: 0.5488
 epoch: 25, train_loss: 0.7110, test_loss: 0.9999, test_f1: 0.6274
 epoch: 26, train_loss: 0.6897, test_loss: 0.9870, test_f1: 0.6120
 epoch: 27, train_loss: 0.6616, test_loss: 1.0725, test_f1: 0.5822
 epoch: 28, train_loss: 0.6567, test_loss: 1.0415, test_f1: 0.5629
 epoch: 29, train_loss: 0.6466, test_loss: 1.0320, test_f1: 0.5852
 epoch: 30, train_loss: 0.6472, test_loss: 1.0558, test_f1: 0.6008
 epoch: 31, train_loss: 0.6352, test_loss: 1.0545, test_f1: 0.5784
 epoch: 32, train_loss: 0.6359, test_loss: 1.0899, test_f1: 0.5595
 epoch: 33, train_loss: 0.6150, test_loss: 1.0806, test_f1: 0.5803
 epoch: 34, train_loss: 0.6072, test_loss: 1.1071, test_f1: 0.5756
 epoch: 35, train_loss: 0.5940, test_loss: 1.1919, test_f1: 0.5534
 epoch: 36, train_loss: 0.6020, test_loss: 1.1879, test_f1: 0.5522
 epoch: 37, train_loss: 0.5911, test_loss: 1.1347, test_f1: 0.5704
 epoch: 38, train_loss: 0.5953, test_loss: 1.1344, test_f1: 0.5956
 epoch: 39, train_loss: 0.5763, test_loss: 1.0637, test_f1: 0.6326
 epoch: 40, train_loss: 0.5601, test_loss: 1.1153, test_f1: 0.6011
 epoch: 41, train_loss: 0.5661, test_loss: 1.1820, test_f1: 0.5940
 epoch: 42, train_loss: 0.5588, test_loss: 1.1193, test_f1: 0.5956
 epoch: 43, train_loss: 0.5368, test_loss: 1.1773, test_f1: 0.5790
 epoch: 44, train_loss: 0.5535, test_loss: 1.1153, test_f1: 0.5846
 epoch: 45, train_loss: 0.5313, test_loss: 1.1942, test_f1: 0.5712
 epoch: 46, train_loss: 0.5240, test_loss: 1.1595, test_f1: 0.5905
 epoch: 47, train_loss: 0.5247, test_loss: 1.1453, test_f1: 0.5719
 epoch: 48, train_loss: 0.5192, test_loss: 1.2162, test_f1: 0.5695
 epoch: 49, train_loss: 0.5189, test_loss: 1.1750, test_f1: 0.5606
 epoch: 50, train_loss: 0.5032, test_loss: 1.2130, test_f1: 0.5787
 epoch: 51, train_loss: 0.4739, test_loss: 1.2237, test_f1: 0.5803
 epoch: 52, train_loss: 0.4900, test_loss: 1.2083, test_f1: 0.6012
 epoch: 53, train_loss: 0.4792, test_loss: 1.2379, test_f1: 0.5674
 epoch: 54, train_loss: 0.4762, test_loss: 1.2522, test_f1: 0.5888
 epoch: 55, train_loss: 0.4479, test_loss: 1.2618, test_f1: 0.5846
 epoch: 56, train_loss: 0.4585, test_loss: 1.2695, test_f1: 0.5729
 epoch: 57, train_loss: 0.4425, test_loss: 1.2395, test_f1: 0.5725
 epoch: 58, train_loss: 0.4425, test_loss: 1.2798, test_f1: 0.5746
 epoch: 59, train_loss: 0.4447, test_loss: 1.3084, test_f1: 0.5896
 epoch: 60, train_loss: 0.4352, test_loss: 1.3129, test_f1: 0.5646
 epoch: 61, train_loss: 0.4333, test_loss: 1.3243, test_f1: 0.5804
 epoch: 62, train_loss: 0.4292, test_loss: 1.3403, test_f1: 0.5728
 epoch: 63, train_loss: 0.4300, test_loss: 1.3878, test_f1: 0.5497
 epoch: 64, train_loss: 0.4088, test_loss: 1.3437, test_f1: 0.5699
 epoch: 65, train_loss: 0.4292, test_loss: 1.3731, test_f1: 0.5628
 epoch: 66, train_loss: 0.4248, test_loss: 1.3454, test_f1: 0.5680
 epoch: 67, train_loss: 0.3896, test_loss: 1.3503, test_f1: 0.5721
 epoch: 68, train_loss: 0.4043, test_loss: 1.3791, test_f1: 0.5508
 epoch: 69, train_loss: 0.4029, test_loss: 1.4018, test_f1: 0.5747
 epoch: 70, train_loss: 0.3913, test_loss: 1.3777, test_f1: 0.5766
 epoch: 71, train_loss: 0.3869, test_loss: 1.4150, test_f1: 0.5576
 epoch: 72, train_loss: 0.3968, test_loss: 1.4790, test_f1: 0.5416
 epoch: 73, train_loss: 0.3934, test_loss: 1.4614, test_f1: 0.5532
 epoch: 74, train_loss: 0.3933, test_loss: 1.4351, test_f1: 0.5742
 epoch: 75, train_loss: 0.4063, test_loss: 1.4882, test_f1: 0.5504
 epoch: 76, train_loss: 0.3790, test_loss: 1.4344, test_f1: 0.5558
 epoch: 77, train_loss: 0.3751, test_loss: 1.4803, test_f1: 0.5618
 epoch: 78, train_loss: 0.3673, test_loss: 1.4955, test_f1: 0.5501
 epoch: 79, train_loss: 0.3708, test_loss: 1.5661, test_f1: 0.5622
 epoch: 80, train_loss: 0.3787, test_loss: 1.5277, test_f1: 0.5406
 epoch: 81, train_loss: 0.3574, test_loss: 1.5266, test_f1: 0.5497
 epoch: 82, train_loss: 0.3573, test_loss: 1.5938, test_f1: 0.5603
 epoch: 83, train_loss: 0.3404, test_loss: 1.4911, test_f1: 0.5621
 epoch: 84, train_loss: 0.3551, test_loss: 1.5016, test_f1: 0.5640
 epoch: 85, train_loss: 0.3378, test_loss: 1.5942, test_f1: 0.5507
 epoch: 86, train_loss: 0.3397, test_loss: 1.5491, test_f1: 0.5632
 epoch: 87, train_loss: 0.3251, test_loss: 1.6133, test_f1: 0.5496
 epoch: 88, train_loss: 0.3213, test_loss: 1.6151, test_f1: 0.5358
 epoch: 89, train_loss: 0.3332, test_loss: 1.6760, test_f1: 0.5609
 epoch: 90, train_loss: 0.3345, test_loss: 1.6810, test_f1: 0.5332
 epoch: 91, train_loss: 0.3227, test_loss: 1.6806, test_f1: 0.5431
 epoch: 92, train_loss: 0.3223, test_loss: 1.6876, test_f1: 0.5681
 epoch: 93, train_loss: 0.3372, test_loss: 1.6600, test_f1: 0.5749
 epoch: 94, train_loss: 0.3069, test_loss: 1.6770, test_f1: 0.5609
 epoch: 95, train_loss: 0.3210, test_loss: 1.6822, test_f1: 0.5716
 epoch: 96, train_loss: 0.3173, test_loss: 1.7144, test_f1: 0.5686
 epoch: 97, train_loss: 0.2898, test_loss: 1.7014, test_f1: 0.5510
 epoch: 98, train_loss: 0.3007, test_loss: 1.8088, test_f1: 0.5490
 epoch: 99, train_loss: 0.2942, test_loss: 1.7250, test_f1: 0.5682
##################ITERATION #1 ****************************************
 epoch: 0, train_loss: 1.3082, test_loss: 1.3157, test_f1: 0.2281
 epoch: 1, train_loss: 1.2302, test_loss: 1.2904, test_f1: 0.2281
 epoch: 2, train_loss: 1.1887, test_loss: 1.2426, test_f1: 0.2588
 epoch: 3, train_loss: 1.1480, test_loss: 1.1974, test_f1: 0.3350
 epoch: 4, train_loss: 1.1073, test_loss: 1.1592, test_f1: 0.4199
 epoch: 5, train_loss: 1.0705, test_loss: 1.1207, test_f1: 0.4626
 epoch: 6, train_loss: 1.0316, test_loss: 1.0723, test_f1: 0.5091
 epoch: 7, train_loss: 0.9922, test_loss: 1.0485, test_f1: 0.5274
 epoch: 8, train_loss: 0.9587, test_loss: 1.0292, test_f1: 0.5502
 epoch: 9, train_loss: 0.9209, test_loss: 1.0188, test_f1: 0.5930
 epoch: 10, train_loss: 0.9068, test_loss: 1.0114, test_f1: 0.5461
 epoch: 11, train_loss: 0.8663, test_loss: 1.0027, test_f1: 0.5751
 epoch: 12, train_loss: 0.8503, test_loss: 1.0101, test_f1: 0.5660
 epoch: 13, train_loss: 0.8238, test_loss: 1.0006, test_f1: 0.5718
 epoch: 14, train_loss: 0.8107, test_loss: 1.0074, test_f1: 0.5697
 epoch: 15, train_loss: 0.7863, test_loss: 1.0058, test_f1: 0.5542
 epoch: 16, train_loss: 0.7825, test_loss: 0.9953, test_f1: 0.5881
 epoch: 17, train_loss: 0.7584, test_loss: 0.9762, test_f1: 0.6308
 epoch: 18, train_loss: 0.7425, test_loss: 0.9467, test_f1: 0.6157
 epoch: 19, train_loss: 0.7149, test_loss: 0.9780, test_f1: 0.6261
 epoch: 20, train_loss: 0.7166, test_loss: 1.0288, test_f1: 0.6248
 epoch: 21, train_loss: 0.7122, test_loss: 0.9878, test_f1: 0.6064
 epoch: 22, train_loss: 0.6938, test_loss: 0.9711, test_f1: 0.6519
 epoch: 23, train_loss: 0.6698, test_loss: 1.0403, test_f1: 0.5799
 epoch: 24, train_loss: 0.6691, test_loss: 0.9855, test_f1: 0.5712
 epoch: 25, train_loss: 0.6568, test_loss: 0.9832, test_f1: 0.5743
 epoch: 26, train_loss: 0.6380, test_loss: 1.0333, test_f1: 0.5819
 epoch: 27, train_loss: 0.6424, test_loss: 1.0525, test_f1: 0.6128
 epoch: 28, train_loss: 0.6192, test_loss: 0.9740, test_f1: 0.6224
 epoch: 29, train_loss: 0.6076, test_loss: 1.0672, test_f1: 0.6042
 epoch: 30, train_loss: 0.5893, test_loss: 0.9858, test_f1: 0.6162
 epoch: 31, train_loss: 0.5938, test_loss: 1.0292, test_f1: 0.5976
 epoch: 32, train_loss: 0.5710, test_loss: 1.0801, test_f1: 0.5884
 epoch: 33, train_loss: 0.5836, test_loss: 1.0405, test_f1: 0.5878
 epoch: 34, train_loss: 0.5724, test_loss: 1.0960, test_f1: 0.5721
 epoch: 35, train_loss: 0.5766, test_loss: 1.0434, test_f1: 0.6166
 epoch: 36, train_loss: 0.5676, test_loss: 1.1405, test_f1: 0.5764
 epoch: 37, train_loss: 0.5465, test_loss: 1.0852, test_f1: 0.6063
 epoch: 38, train_loss: 0.5422, test_loss: 1.1256, test_f1: 0.5651
 epoch: 39, train_loss: 0.5192, test_loss: 1.1381, test_f1: 0.5952
 epoch: 40, train_loss: 0.5071, test_loss: 1.0954, test_f1: 0.6064
 epoch: 41, train_loss: 0.5072, test_loss: 1.0444, test_f1: 0.6154
 epoch: 42, train_loss: 0.5109, test_loss: 1.2445, test_f1: 0.5820
 epoch: 43, train_loss: 0.4952, test_loss: 1.1101, test_f1: 0.6231
 epoch: 44, train_loss: 0.5012, test_loss: 1.3386, test_f1: 0.6036
 epoch: 45, train_loss: 0.4879, test_loss: 1.1180, test_f1: 0.5893
 epoch: 46, train_loss: 0.4897, test_loss: 1.1840, test_f1: 0.6117
 epoch: 47, train_loss: 0.4647, test_loss: 1.0890, test_f1: 0.5819
 epoch: 48, train_loss: 0.4746, test_loss: 1.1395, test_f1: 0.6082
 epoch: 49, train_loss: 0.4646, test_loss: 1.1098, test_f1: 0.5737
 epoch: 50, train_loss: 0.4693, test_loss: 1.2834, test_f1: 0.5975
 epoch: 51, train_loss: 0.4331, test_loss: 1.1341, test_f1: 0.5982
 epoch: 52, train_loss: 0.4131, test_loss: 1.1369, test_f1: 0.5894
 epoch: 53, train_loss: 0.4075, test_loss: 1.2335, test_f1: 0.5556
 epoch: 54, train_loss: 0.4147, test_loss: 1.1516, test_f1: 0.6193
 epoch: 55, train_loss: 0.4071, test_loss: 1.2778, test_f1: 0.5562
 epoch: 56, train_loss: 0.3937, test_loss: 1.2416, test_f1: 0.5723
 epoch: 57, train_loss: 0.3814, test_loss: 1.2011, test_f1: 0.5876
 epoch: 58, train_loss: 0.3924, test_loss: 1.1886, test_f1: 0.6009
 epoch: 59, train_loss: 0.3692, test_loss: 1.2402, test_f1: 0.5807
 epoch: 60, train_loss: 0.3730, test_loss: 1.2781, test_f1: 0.5745
 epoch: 61, train_loss: 0.3737, test_loss: 1.1989, test_f1: 0.5874
 epoch: 62, train_loss: 0.3610, test_loss: 1.2635, test_f1: 0.5694
 epoch: 63, train_loss: 0.3671, test_loss: 1.1602, test_f1: 0.6046
 epoch: 64, train_loss: 0.3538, test_loss: 1.3048, test_f1: 0.5883
 epoch: 65, train_loss: 0.3526, test_loss: 1.1577, test_f1: 0.5930
 epoch: 66, train_loss: 0.3667, test_loss: 1.2776, test_f1: 0.6142
 epoch: 67, train_loss: 0.3509, test_loss: 1.2573, test_f1: 0.6008
 epoch: 68, train_loss: 0.3554, test_loss: 1.4039, test_f1: 0.5882
 epoch: 69, train_loss: 0.3434, test_loss: 1.3469, test_f1: 0.6013
 epoch: 70, train_loss: 0.3589, test_loss: 1.3248, test_f1: 0.5802
 epoch: 71, train_loss: 0.3442, test_loss: 1.3550, test_f1: 0.5689
 epoch: 72, train_loss: 0.3220, test_loss: 1.3791, test_f1: 0.5724
 epoch: 73, train_loss: 0.3313, test_loss: 1.3358, test_f1: 0.5882
 epoch: 74, train_loss: 0.3271, test_loss: 1.4502, test_f1: 0.5944
 epoch: 75, train_loss: 0.3362, test_loss: 1.3426, test_f1: 0.5663
 epoch: 76, train_loss: 0.3252, test_loss: 1.2959, test_f1: 0.5749
 epoch: 77, train_loss: 0.3207, test_loss: 1.3339, test_f1: 0.5876
 epoch: 78, train_loss: 0.3253, test_loss: 1.3854, test_f1: 0.5877
 epoch: 79, train_loss: 0.3148, test_loss: 1.2921, test_f1: 0.6091
 epoch: 80, train_loss: 0.3088, test_loss: 1.3650, test_f1: 0.5711
 epoch: 81, train_loss: 0.3064, test_loss: 1.5028, test_f1: 0.5688
 epoch: 82, train_loss: 0.3038, test_loss: 1.3977, test_f1: 0.5664
 epoch: 83, train_loss: 0.2924, test_loss: 1.3090, test_f1: 0.6120
 epoch: 84, train_loss: 0.2846, test_loss: 1.3633, test_f1: 0.6039
 epoch: 85, train_loss: 0.2818, test_loss: 1.3085, test_f1: 0.6013
 epoch: 86, train_loss: 0.2696, test_loss: 1.4172, test_f1: 0.5816
 epoch: 87, train_loss: 0.2846, test_loss: 1.4535, test_f1: 0.5705
 epoch: 88, train_loss: 0.2761, test_loss: 1.5123, test_f1: 0.5558
 epoch: 89, train_loss: 0.2755, test_loss: 1.4828, test_f1: 0.5827
 epoch: 90, train_loss: 0.2557, test_loss: 1.3871, test_f1: 0.5619
 epoch: 91, train_loss: 0.2485, test_loss: 1.3651, test_f1: 0.6247
 epoch: 92, train_loss: 0.2551, test_loss: 1.4400, test_f1: 0.6014
 epoch: 93, train_loss: 0.2729, test_loss: 1.3561, test_f1: 0.5998
 epoch: 94, train_loss: 0.2631, test_loss: 1.4941, test_f1: 0.5631
 epoch: 95, train_loss: 0.2717, test_loss: 1.6816, test_f1: 0.5674
 epoch: 96, train_loss: 0.2629, test_loss: 1.5173, test_f1: 0.5882
 epoch: 97, train_loss: 0.2632, test_loss: 1.6399, test_f1: 0.5941
 epoch: 98, train_loss: 0.2347, test_loss: 1.5765, test_f1: 0.5678
 epoch: 99, train_loss: 0.2594, test_loss: 1.5739, test_f1: 0.5927
##################ITERATION #2 ****************************************
 epoch: 0, train_loss: 1.2745, test_loss: 1.3030, test_f1: 0.2281
 epoch: 1, train_loss: 1.2022, test_loss: 1.2744, test_f1: 0.2795
 epoch: 2, train_loss: 1.1639, test_loss: 1.2253, test_f1: 0.3625
 epoch: 3, train_loss: 1.1249, test_loss: 1.1783, test_f1: 0.4095
 epoch: 4, train_loss: 1.0895, test_loss: 1.1311, test_f1: 0.4323
 epoch: 5, train_loss: 1.0525, test_loss: 1.0964, test_f1: 0.5261
 epoch: 6, train_loss: 1.0145, test_loss: 1.0709, test_f1: 0.5199
 epoch: 7, train_loss: 0.9859, test_loss: 1.0365, test_f1: 0.5527
 epoch: 8, train_loss: 0.9534, test_loss: 1.0066, test_f1: 0.5671
 epoch: 9, train_loss: 0.9169, test_loss: 1.0051, test_f1: 0.5792
 epoch: 10, train_loss: 0.8900, test_loss: 0.9879, test_f1: 0.6001
 epoch: 11, train_loss: 0.8784, test_loss: 0.9989, test_f1: 0.5735
 epoch: 12, train_loss: 0.8570, test_loss: 0.9785, test_f1: 0.5927
 epoch: 13, train_loss: 0.8286, test_loss: 0.9655, test_f1: 0.5625
 epoch: 14, train_loss: 0.8101, test_loss: 0.9858, test_f1: 0.5308
 epoch: 15, train_loss: 0.7841, test_loss: 0.9736, test_f1: 0.5980
 epoch: 16, train_loss: 0.7756, test_loss: 0.9822, test_f1: 0.6052
 epoch: 17, train_loss: 0.7568, test_loss: 1.0076, test_f1: 0.5769
 epoch: 18, train_loss: 0.7449, test_loss: 0.9928, test_f1: 0.5977
 epoch: 19, train_loss: 0.7227, test_loss: 0.9774, test_f1: 0.5909
 epoch: 20, train_loss: 0.7161, test_loss: 0.9751, test_f1: 0.5862
 epoch: 21, train_loss: 0.6860, test_loss: 1.0072, test_f1: 0.5856
 epoch: 22, train_loss: 0.6720, test_loss: 1.0310, test_f1: 0.5733
 epoch: 23, train_loss: 0.6736, test_loss: 1.0214, test_f1: 0.6326
 epoch: 24, train_loss: 0.6465, test_loss: 1.0259, test_f1: 0.6200
 epoch: 25, train_loss: 0.6322, test_loss: 1.0441, test_f1: 0.6068
 epoch: 26, train_loss: 0.6321, test_loss: 1.0543, test_f1: 0.6000
 epoch: 27, train_loss: 0.6218, test_loss: 1.0429, test_f1: 0.6221
 epoch: 28, train_loss: 0.5871, test_loss: 1.0447, test_f1: 0.6086
 epoch: 29, train_loss: 0.5920, test_loss: 1.0860, test_f1: 0.5896
 epoch: 30, train_loss: 0.5772, test_loss: 1.0251, test_f1: 0.6367
 epoch: 31, train_loss: 0.5724, test_loss: 1.0621, test_f1: 0.6243
 epoch: 32, train_loss: 0.5647, test_loss: 1.0686, test_f1: 0.6105
 epoch: 33, train_loss: 0.5331, test_loss: 1.1829, test_f1: 0.5617
 epoch: 34, train_loss: 0.5331, test_loss: 1.1597, test_f1: 0.5995
 epoch: 35, train_loss: 0.5213, test_loss: 1.1491, test_f1: 0.5819
 epoch: 36, train_loss: 0.5160, test_loss: 1.1876, test_f1: 0.5658
 epoch: 37, train_loss: 0.4967, test_loss: 1.1102, test_f1: 0.6272
 epoch: 38, train_loss: 0.4918, test_loss: 1.2601, test_f1: 0.5860
 epoch: 39, train_loss: 0.4845, test_loss: 1.1395, test_f1: 0.6357
 epoch: 40, train_loss: 0.4831, test_loss: 1.0958, test_f1: 0.6308
 epoch: 41, train_loss: 0.4563, test_loss: 1.2724, test_f1: 0.5653
 epoch: 42, train_loss: 0.4657, test_loss: 1.2007, test_f1: 0.6167
 epoch: 43, train_loss: 0.4520, test_loss: 1.2210, test_f1: 0.5943
 epoch: 44, train_loss: 0.4454, test_loss: 1.2442, test_f1: 0.6099
 epoch: 45, train_loss: 0.4382, test_loss: 1.1997, test_f1: 0.6330
 epoch: 46, train_loss: 0.4456, test_loss: 1.3905, test_f1: 0.5818
 epoch: 47, train_loss: 0.4066, test_loss: 1.3843, test_f1: 0.6076
 epoch: 48, train_loss: 0.4131, test_loss: 1.3362, test_f1: 0.5933
 epoch: 49, train_loss: 0.3992, test_loss: 1.3404, test_f1: 0.6191
 epoch: 50, train_loss: 0.4014, test_loss: 1.3303, test_f1: 0.6207
 epoch: 51, train_loss: 0.3852, test_loss: 1.2860, test_f1: 0.6415
 epoch: 52, train_loss: 0.3683, test_loss: 1.3566, test_f1: 0.6328
 epoch: 53, train_loss: 0.3760, test_loss: 1.3667, test_f1: 0.6192
 epoch: 54, train_loss: 0.3524, test_loss: 1.3110, test_f1: 0.6369
 epoch: 55, train_loss: 0.3379, test_loss: 1.3396, test_f1: 0.6361
 epoch: 56, train_loss: 0.3377, test_loss: 1.3509, test_f1: 0.6364
 epoch: 57, train_loss: 0.3333, test_loss: 1.3725, test_f1: 0.6491
 epoch: 58, train_loss: 0.3225, test_loss: 1.4006, test_f1: 0.6261
 epoch: 59, train_loss: 0.3285, test_loss: 1.3944, test_f1: 0.6062
 epoch: 60, train_loss: 0.3300, test_loss: 1.4276, test_f1: 0.6334
 epoch: 61, train_loss: 0.3134, test_loss: 1.4230, test_f1: 0.6442
 epoch: 62, train_loss: 0.3061, test_loss: 1.4810, test_f1: 0.6191
 epoch: 63, train_loss: 0.3204, test_loss: 1.4241, test_f1: 0.6144
 epoch: 64, train_loss: 0.3121, test_loss: 1.4838, test_f1: 0.6337
 epoch: 65, train_loss: 0.3038, test_loss: 1.5097, test_f1: 0.6200
 epoch: 66, train_loss: 0.3240, test_loss: 1.5133, test_f1: 0.6259
 epoch: 67, train_loss: 0.3024, test_loss: 1.5480, test_f1: 0.6022
 epoch: 68, train_loss: 0.2890, test_loss: 1.4915, test_f1: 0.6148
 epoch: 69, train_loss: 0.2972, test_loss: 1.5428, test_f1: 0.6122
 epoch: 70, train_loss: 0.2833, test_loss: 1.5684, test_f1: 0.6005
 epoch: 71, train_loss: 0.3006, test_loss: 1.6016, test_f1: 0.6089
 epoch: 72, train_loss: 0.2945, test_loss: 1.5736, test_f1: 0.6214
 epoch: 73, train_loss: 0.2873, test_loss: 1.6933, test_f1: 0.5908
 epoch: 74, train_loss: 0.2894, test_loss: 1.6913, test_f1: 0.5991
 epoch: 75, train_loss: 0.2722, test_loss: 1.5863, test_f1: 0.6129
 epoch: 76, train_loss: 0.2512, test_loss: 1.6872, test_f1: 0.5965
 epoch: 77, train_loss: 0.2589, test_loss: 1.6527, test_f1: 0.5885
 epoch: 78, train_loss: 0.2575, test_loss: 1.6923, test_f1: 0.6140
 epoch: 79, train_loss: 0.2615, test_loss: 1.7261, test_f1: 0.6152
 epoch: 80, train_loss: 0.2623, test_loss: 1.7204, test_f1: 0.6126
 epoch: 81, train_loss: 0.2641, test_loss: 1.7458, test_f1: 0.5943
 epoch: 82, train_loss: 0.2450, test_loss: 1.7809, test_f1: 0.6070
 epoch: 83, train_loss: 0.2638, test_loss: 1.7337, test_f1: 0.6182
 epoch: 84, train_loss: 0.2406, test_loss: 1.6821, test_f1: 0.6106
 epoch: 85, train_loss: 0.2341, test_loss: 1.7501, test_f1: 0.5938
 epoch: 86, train_loss: 0.2497, test_loss: 1.7273, test_f1: 0.6145
 epoch: 87, train_loss: 0.2379, test_loss: 1.8089, test_f1: 0.5870
 epoch: 88, train_loss: 0.2343, test_loss: 1.8390, test_f1: 0.5942
 epoch: 89, train_loss: 0.2451, test_loss: 1.7330, test_f1: 0.6236
 epoch: 90, train_loss: 0.2290, test_loss: 1.8839, test_f1: 0.5966
 epoch: 91, train_loss: 0.2531, test_loss: 1.8142, test_f1: 0.6203
 epoch: 92, train_loss: 0.2412, test_loss: 1.9149, test_f1: 0.5856
 epoch: 93, train_loss: 0.2238, test_loss: 1.8674, test_f1: 0.6019
 epoch: 94, train_loss: 0.2433, test_loss: 2.0271, test_f1: 0.6060
 epoch: 95, train_loss: 0.2452, test_loss: 1.9076, test_f1: 0.5766
 epoch: 96, train_loss: 0.2224, test_loss: 1.9802, test_f1: 0.5924
 epoch: 97, train_loss: 0.2036, test_loss: 1.8050, test_f1: 0.6081
 epoch: 98, train_loss: 0.2029, test_loss: 1.8869, test_f1: 0.6082
 epoch: 99, train_loss: 0.2203, test_loss: 1.9577, test_f1: 0.6351
##################ITERATION #3 ****************************************
 epoch: 0, train_loss: 1.2449, test_loss: 1.3107, test_f1: 0.2281
 epoch: 1, train_loss: 1.1515, test_loss: 1.2784, test_f1: 0.3148
 epoch: 2, train_loss: 1.1091, test_loss: 1.1856, test_f1: 0.4205
 epoch: 3, train_loss: 1.0679, test_loss: 1.1371, test_f1: 0.4561
 epoch: 4, train_loss: 1.0285, test_loss: 1.1241, test_f1: 0.5135
 epoch: 5, train_loss: 0.9789, test_loss: 1.0680, test_f1: 0.5085
 epoch: 6, train_loss: 0.9533, test_loss: 1.0356, test_f1: 0.5524
 epoch: 7, train_loss: 0.9247, test_loss: 1.0296, test_f1: 0.5617
 epoch: 8, train_loss: 0.8913, test_loss: 1.0085, test_f1: 0.6046
 epoch: 9, train_loss: 0.8702, test_loss: 1.0147, test_f1: 0.6267
 epoch: 10, train_loss: 0.8537, test_loss: 0.9944, test_f1: 0.5945
 epoch: 11, train_loss: 0.8360, test_loss: 0.9925, test_f1: 0.6092
 epoch: 12, train_loss: 0.8000, test_loss: 0.9696, test_f1: 0.6172
 epoch: 13, train_loss: 0.7866, test_loss: 0.9548, test_f1: 0.6287
 epoch: 14, train_loss: 0.7699, test_loss: 0.9670, test_f1: 0.6015
 epoch: 15, train_loss: 0.7278, test_loss: 0.9609, test_f1: 0.5892
 epoch: 16, train_loss: 0.7323, test_loss: 0.9756, test_f1: 0.5977
 epoch: 17, train_loss: 0.7205, test_loss: 1.0017, test_f1: 0.6215
 epoch: 18, train_loss: 0.6966, test_loss: 1.0241, test_f1: 0.5681
 epoch: 19, train_loss: 0.6735, test_loss: 1.0240, test_f1: 0.5696
 epoch: 20, train_loss: 0.6837, test_loss: 1.0487, test_f1: 0.5798
 epoch: 21, train_loss: 0.6469, test_loss: 1.0883, test_f1: 0.5612
 epoch: 22, train_loss: 0.6315, test_loss: 1.0297, test_f1: 0.5576
 epoch: 23, train_loss: 0.6270, test_loss: 1.1032, test_f1: 0.5891
 epoch: 24, train_loss: 0.6250, test_loss: 1.0527, test_f1: 0.6152
 epoch: 25, train_loss: 0.5991, test_loss: 1.0457, test_f1: 0.5758
 epoch: 26, train_loss: 0.6103, test_loss: 0.9984, test_f1: 0.5946
 epoch: 27, train_loss: 0.5914, test_loss: 1.1122, test_f1: 0.5834
 epoch: 28, train_loss: 0.5573, test_loss: 1.1681, test_f1: 0.5655
 epoch: 29, train_loss: 0.5461, test_loss: 1.2032, test_f1: 0.5461
 epoch: 30, train_loss: 0.5436, test_loss: 1.1760, test_f1: 0.5708
 epoch: 31, train_loss: 0.5575, test_loss: 1.1332, test_f1: 0.5731
 epoch: 32, train_loss: 0.5271, test_loss: 1.0934, test_f1: 0.5947
 epoch: 33, train_loss: 0.5126, test_loss: 1.2346, test_f1: 0.5805
 epoch: 34, train_loss: 0.5167, test_loss: 1.1381, test_f1: 0.5867
 epoch: 35, train_loss: 0.5193, test_loss: 1.1870, test_f1: 0.5580
 epoch: 36, train_loss: 0.5120, test_loss: 1.1339, test_f1: 0.5904
 epoch: 37, train_loss: 0.4735, test_loss: 1.2058, test_f1: 0.5897
 epoch: 38, train_loss: 0.4870, test_loss: 1.2773, test_f1: 0.5642
 epoch: 39, train_loss: 0.4588, test_loss: 1.2014, test_f1: 0.5812
 epoch: 40, train_loss: 0.4700, test_loss: 1.2086, test_f1: 0.6071
 epoch: 41, train_loss: 0.4439, test_loss: 1.2417, test_f1: 0.5889
 epoch: 42, train_loss: 0.4375, test_loss: 1.3419, test_f1: 0.5672
 epoch: 43, train_loss: 0.4230, test_loss: 1.2271, test_f1: 0.6063
 epoch: 44, train_loss: 0.4345, test_loss: 1.2769, test_f1: 0.5616
 epoch: 45, train_loss: 0.4095, test_loss: 1.2781, test_f1: 0.5990
 epoch: 46, train_loss: 0.3733, test_loss: 1.3472, test_f1: 0.5873
 epoch: 47, train_loss: 0.3865, test_loss: 1.3994, test_f1: 0.5905
 epoch: 48, train_loss: 0.3887, test_loss: 1.3614, test_f1: 0.5909
 epoch: 49, train_loss: 0.3546, test_loss: 1.3818, test_f1: 0.5926
 epoch: 50, train_loss: 0.3758, test_loss: 1.3826, test_f1: 0.5795
 epoch: 51, train_loss: 0.3562, test_loss: 1.3967, test_f1: 0.5931
 epoch: 52, train_loss: 0.3291, test_loss: 1.3781, test_f1: 0.6045
 epoch: 53, train_loss: 0.3295, test_loss: 1.3875, test_f1: 0.6057
 epoch: 54, train_loss: 0.3102, test_loss: 1.4296, test_f1: 0.6039
 epoch: 55, train_loss: 0.3135, test_loss: 1.4593, test_f1: 0.6015
 epoch: 56, train_loss: 0.2940, test_loss: 1.4316, test_f1: 0.6109
 epoch: 57, train_loss: 0.3020, test_loss: 1.4524, test_f1: 0.6063
 epoch: 58, train_loss: 0.2944, test_loss: 1.4949, test_f1: 0.6045
 epoch: 59, train_loss: 0.3057, test_loss: 1.5744, test_f1: 0.5946
 epoch: 60, train_loss: 0.2899, test_loss: 1.5281, test_f1: 0.5934
 epoch: 61, train_loss: 0.2832, test_loss: 1.5544, test_f1: 0.5958
 epoch: 62, train_loss: 0.2941, test_loss: 1.4941, test_f1: 0.6045
 epoch: 63, train_loss: 0.2884, test_loss: 1.5970, test_f1: 0.5894
 epoch: 64, train_loss: 0.2783, test_loss: 1.5196, test_f1: 0.6005
 epoch: 65, train_loss: 0.2672, test_loss: 1.6825, test_f1: 0.5827
 epoch: 66, train_loss: 0.2720, test_loss: 1.5613, test_f1: 0.5952
 epoch: 67, train_loss: 0.2691, test_loss: 1.5502, test_f1: 0.5986
 epoch: 68, train_loss: 0.2598, test_loss: 1.5707, test_f1: 0.6013
 epoch: 69, train_loss: 0.2643, test_loss: 1.6200, test_f1: 0.5957
 epoch: 70, train_loss: 0.2537, test_loss: 1.6312, test_f1: 0.5971
 epoch: 71, train_loss: 0.2668, test_loss: 1.6951, test_f1: 0.5712
 epoch: 72, train_loss: 0.2460, test_loss: 1.6192, test_f1: 0.6057
 epoch: 73, train_loss: 0.2465, test_loss: 1.7091, test_f1: 0.5682
 epoch: 74, train_loss: 0.2422, test_loss: 1.6731, test_f1: 0.6166
 epoch: 75, train_loss: 0.2422, test_loss: 1.6298, test_f1: 0.6122
 epoch: 76, train_loss: 0.2267, test_loss: 1.6896, test_f1: 0.5943
 epoch: 77, train_loss: 0.2342, test_loss: 1.7523, test_f1: 0.6074
 epoch: 78, train_loss: 0.2477, test_loss: 1.7271, test_f1: 0.6009
 epoch: 79, train_loss: 0.2503, test_loss: 1.7473, test_f1: 0.5904
 epoch: 80, train_loss: 0.2438, test_loss: 1.7904, test_f1: 0.5864
 epoch: 81, train_loss: 0.2457, test_loss: 1.8669, test_f1: 0.5826
 epoch: 82, train_loss: 0.2335, test_loss: 1.8003, test_f1: 0.5969
 epoch: 83, train_loss: 0.2312, test_loss: 1.7768, test_f1: 0.5985
 epoch: 84, train_loss: 0.2219, test_loss: 1.7183, test_f1: 0.6015
 epoch: 85, train_loss: 0.2098, test_loss: 1.8177, test_f1: 0.5785
 epoch: 86, train_loss: 0.2134, test_loss: 1.8647, test_f1: 0.5771
 epoch: 87, train_loss: 0.2309, test_loss: 1.7847, test_f1: 0.5868
 epoch: 88, train_loss: 0.2211, test_loss: 1.8211, test_f1: 0.5854
 epoch: 89, train_loss: 0.2342, test_loss: 1.7922, test_f1: 0.5942
 epoch: 90, train_loss: 0.2029, test_loss: 1.8536, test_f1: 0.6133
 epoch: 91, train_loss: 0.1906, test_loss: 1.8317, test_f1: 0.5971
 epoch: 92, train_loss: 0.1943, test_loss: 1.9311, test_f1: 0.6081
 epoch: 93, train_loss: 0.2145, test_loss: 1.9034, test_f1: 0.5883
 epoch: 94, train_loss: 0.2050, test_loss: 1.8564, test_f1: 0.5865
 epoch: 95, train_loss: 0.2037, test_loss: 1.9370, test_f1: 0.5907
 epoch: 96, train_loss: 0.1869, test_loss: 1.8627, test_f1: 0.5741
 epoch: 97, train_loss: 0.2061, test_loss: 2.0013, test_f1: 0.5909
 epoch: 98, train_loss: 0.1964, test_loss: 2.0540, test_f1: 0.5740
 epoch: 99, train_loss: 0.2049, test_loss: 1.9986, test_f1: 0.5744
##################ITERATION #4 ****************************************
 epoch: 0, train_loss: 1.2400, test_loss: 1.2865, test_f1: 0.2585
 epoch: 1, train_loss: 1.1455, test_loss: 1.2324, test_f1: 0.2599
 epoch: 2, train_loss: 1.1018, test_loss: 1.1666, test_f1: 0.4153
 epoch: 3, train_loss: 1.0716, test_loss: 1.1343, test_f1: 0.4506
 epoch: 4, train_loss: 1.0283, test_loss: 1.1141, test_f1: 0.5122
 epoch: 5, train_loss: 1.0031, test_loss: 1.0861, test_f1: 0.5188
 epoch: 6, train_loss: 0.9791, test_loss: 1.0678, test_f1: 0.5607
 epoch: 7, train_loss: 0.9450, test_loss: 1.0745, test_f1: 0.5316
 epoch: 8, train_loss: 0.9312, test_loss: 1.0434, test_f1: 0.5471
 epoch: 9, train_loss: 0.9034, test_loss: 1.0333, test_f1: 0.5368
 epoch: 10, train_loss: 0.8925, test_loss: 1.0286, test_f1: 0.5511
 epoch: 11, train_loss: 0.8647, test_loss: 1.0093, test_f1: 0.5249
 epoch: 12, train_loss: 0.8433, test_loss: 1.0037, test_f1: 0.5641
 epoch: 13, train_loss: 0.8324, test_loss: 0.9860, test_f1: 0.5808
 epoch: 14, train_loss: 0.8147, test_loss: 1.0048, test_f1: 0.5963
 epoch: 15, train_loss: 0.8005, test_loss: 0.9631, test_f1: 0.6167
 epoch: 16, train_loss: 0.7696, test_loss: 1.0080, test_f1: 0.5840
 epoch: 17, train_loss: 0.7451, test_loss: 0.9976, test_f1: 0.5723
 epoch: 18, train_loss: 0.7230, test_loss: 0.9995, test_f1: 0.5899
 epoch: 19, train_loss: 0.7238, test_loss: 0.9700, test_f1: 0.6179
 epoch: 20, train_loss: 0.7341, test_loss: 0.9252, test_f1: 0.6437
 epoch: 21, train_loss: 0.6923, test_loss: 0.9748, test_f1: 0.6271
 epoch: 22, train_loss: 0.6835, test_loss: 0.9847, test_f1: 0.6276
 epoch: 23, train_loss: 0.6655, test_loss: 0.9822, test_f1: 0.6076
 epoch: 24, train_loss: 0.6728, test_loss: 1.0181, test_f1: 0.5874
 epoch: 25, train_loss: 0.6414, test_loss: 1.0286, test_f1: 0.5916
 epoch: 26, train_loss: 0.6361, test_loss: 1.0426, test_f1: 0.6205
 epoch: 27, train_loss: 0.6106, test_loss: 1.0620, test_f1: 0.5924
 epoch: 28, train_loss: 0.6001, test_loss: 1.0171, test_f1: 0.6175
 epoch: 29, train_loss: 0.5971, test_loss: 1.0377, test_f1: 0.6332
 epoch: 30, train_loss: 0.5780, test_loss: 1.0169, test_f1: 0.6048
 epoch: 31, train_loss: 0.5744, test_loss: 1.0315, test_f1: 0.6397
 epoch: 32, train_loss: 0.5716, test_loss: 0.9902, test_f1: 0.6474
 epoch: 33, train_loss: 0.5856, test_loss: 1.1085, test_f1: 0.5834
 epoch: 34, train_loss: 0.5494, test_loss: 1.0311, test_f1: 0.5924
 epoch: 35, train_loss: 0.5535, test_loss: 1.1231, test_f1: 0.5949
 epoch: 36, train_loss: 0.5465, test_loss: 1.0534, test_f1: 0.6157
 epoch: 37, train_loss: 0.5191, test_loss: 1.0586, test_f1: 0.6328
 epoch: 38, train_loss: 0.5147, test_loss: 1.0869, test_f1: 0.6174
 epoch: 39, train_loss: 0.5019, test_loss: 1.1308, test_f1: 0.6188
 epoch: 40, train_loss: 0.5146, test_loss: 1.0885, test_f1: 0.6125
 epoch: 41, train_loss: 0.4808, test_loss: 1.2235, test_f1: 0.5734
 epoch: 42, train_loss: 0.4807, test_loss: 1.1456, test_f1: 0.6284
 epoch: 43, train_loss: 0.4776, test_loss: 1.2392, test_f1: 0.6055
 epoch: 44, train_loss: 0.4721, test_loss: 1.2081, test_f1: 0.6161
 epoch: 45, train_loss: 0.4637, test_loss: 1.2507, test_f1: 0.6311
 epoch: 46, train_loss: 0.4407, test_loss: 1.1213, test_f1: 0.6143
 epoch: 47, train_loss: 0.4495, test_loss: 1.2888, test_f1: 0.6057
 epoch: 48, train_loss: 0.4311, test_loss: 1.1696, test_f1: 0.6821
 epoch: 49, train_loss: 0.4464, test_loss: 1.2749, test_f1: 0.6533
 epoch: 50, train_loss: 0.4347, test_loss: 1.2907, test_f1: 0.6229
 epoch: 51, train_loss: 0.4136, test_loss: 1.2636, test_f1: 0.6037
 epoch: 52, train_loss: 0.3879, test_loss: 1.2407, test_f1: 0.6437
 epoch: 53, train_loss: 0.3608, test_loss: 1.2588, test_f1: 0.6309
 epoch: 54, train_loss: 0.3733, test_loss: 1.3227, test_f1: 0.6210
 epoch: 55, train_loss: 0.3737, test_loss: 1.2528, test_f1: 0.6313
 epoch: 56, train_loss: 0.3639, test_loss: 1.2631, test_f1: 0.6541
 epoch: 57, train_loss: 0.3479, test_loss: 1.3319, test_f1: 0.6365
 epoch: 58, train_loss: 0.3612, test_loss: 1.3470, test_f1: 0.6250
 epoch: 59, train_loss: 0.3544, test_loss: 1.3753, test_f1: 0.6313
 epoch: 60, train_loss: 0.3484, test_loss: 1.3353, test_f1: 0.6390
 epoch: 61, train_loss: 0.3363, test_loss: 1.4025, test_f1: 0.6443
 epoch: 62, train_loss: 0.3427, test_loss: 1.4124, test_f1: 0.6274
 epoch: 63, train_loss: 0.3451, test_loss: 1.4151, test_f1: 0.6158
 epoch: 64, train_loss: 0.3351, test_loss: 1.3492, test_f1: 0.6346
 epoch: 65, train_loss: 0.3249, test_loss: 1.3946, test_f1: 0.6176
 epoch: 66, train_loss: 0.3121, test_loss: 1.4415, test_f1: 0.6231
 epoch: 67, train_loss: 0.3184, test_loss: 1.4601, test_f1: 0.5930
 epoch: 68, train_loss: 0.3202, test_loss: 1.4084, test_f1: 0.6373
 epoch: 69, train_loss: 0.3116, test_loss: 1.4657, test_f1: 0.5983
 epoch: 70, train_loss: 0.3050, test_loss: 1.4484, test_f1: 0.6028
 epoch: 71, train_loss: 0.2989, test_loss: 1.4234, test_f1: 0.6283
 epoch: 72, train_loss: 0.3061, test_loss: 1.4747, test_f1: 0.5996
 epoch: 73, train_loss: 0.2935, test_loss: 1.4959, test_f1: 0.6099
 epoch: 74, train_loss: 0.2936, test_loss: 1.4848, test_f1: 0.6142
 epoch: 75, train_loss: 0.2804, test_loss: 1.4723, test_f1: 0.6224
 epoch: 76, train_loss: 0.2899, test_loss: 1.5399, test_f1: 0.6162
 epoch: 77, train_loss: 0.2769, test_loss: 1.5244, test_f1: 0.5940
 epoch: 78, train_loss: 0.2765, test_loss: 1.5554, test_f1: 0.6304
 epoch: 79, train_loss: 0.2668, test_loss: 1.5175, test_f1: 0.6300
 epoch: 80, train_loss: 0.2821, test_loss: 1.5618, test_f1: 0.6102
 epoch: 81, train_loss: 0.2613, test_loss: 1.5393, test_f1: 0.5989
 epoch: 82, train_loss: 0.2423, test_loss: 1.6245, test_f1: 0.6143
 epoch: 83, train_loss: 0.2590, test_loss: 1.5697, test_f1: 0.6207
 epoch: 84, train_loss: 0.2749, test_loss: 1.6907, test_f1: 0.5819
 epoch: 85, train_loss: 0.2605, test_loss: 1.5795, test_f1: 0.6127
 epoch: 86, train_loss: 0.2501, test_loss: 1.6199, test_f1: 0.6037
 epoch: 87, train_loss: 0.2641, test_loss: 1.6378, test_f1: 0.6035
 epoch: 88, train_loss: 0.2512, test_loss: 1.5700, test_f1: 0.6089
 epoch: 89, train_loss: 0.2368, test_loss: 1.6806, test_f1: 0.6175
 epoch: 90, train_loss: 0.2425, test_loss: 1.6386, test_f1: 0.6035
 epoch: 91, train_loss: 0.2531, test_loss: 1.6631, test_f1: 0.5931
 epoch: 92, train_loss: 0.2223, test_loss: 1.7430, test_f1: 0.6170
 epoch: 93, train_loss: 0.2552, test_loss: 1.7255, test_f1: 0.6180
 epoch: 94, train_loss: 0.2397, test_loss: 1.6700, test_f1: 0.6032
 epoch: 95, train_loss: 0.2177, test_loss: 1.6505, test_f1: 0.5943
 epoch: 96, train_loss: 0.2333, test_loss: 1.7617, test_f1: 0.5935
 epoch: 97, train_loss: 0.2401, test_loss: 1.7834, test_f1: 0.6027
 epoch: 98, train_loss: 0.2222, test_loss: 1.7779, test_f1: 0.5868
 epoch: 99, train_loss: 0.2396, test_loss: 1.7754, test_f1: 0.6034
##################ITERATION #5 ****************************************
 epoch: 0, train_loss: 1.2259, test_loss: 1.2883, test_f1: 0.3290
 epoch: 1, train_loss: 1.1258, test_loss: 1.2914, test_f1: 0.3914
 epoch: 2, train_loss: 1.0755, test_loss: 1.1995, test_f1: 0.4958
 epoch: 3, train_loss: 1.0345, test_loss: 1.1342, test_f1: 0.5170
 epoch: 4, train_loss: 1.0051, test_loss: 1.1085, test_f1: 0.5114
 epoch: 5, train_loss: 0.9664, test_loss: 1.0559, test_f1: 0.5608
 epoch: 6, train_loss: 0.9423, test_loss: 1.0653, test_f1: 0.5774
 epoch: 7, train_loss: 0.9301, test_loss: 1.0494, test_f1: 0.6012
 epoch: 8, train_loss: 0.8917, test_loss: 1.0663, test_f1: 0.5871
 epoch: 9, train_loss: 0.8632, test_loss: 1.0196, test_f1: 0.5721
 epoch: 10, train_loss: 0.8455, test_loss: 1.0225, test_f1: 0.6209
 epoch: 11, train_loss: 0.8162, test_loss: 1.0138, test_f1: 0.5935
 epoch: 12, train_loss: 0.7980, test_loss: 1.0290, test_f1: 0.6019
 epoch: 13, train_loss: 0.7994, test_loss: 0.9991, test_f1: 0.6066
 epoch: 14, train_loss: 0.7727, test_loss: 1.0383, test_f1: 0.5935
 epoch: 15, train_loss: 0.7722, test_loss: 1.0543, test_f1: 0.5740
 epoch: 16, train_loss: 0.7396, test_loss: 1.0506, test_f1: 0.6037
 epoch: 17, train_loss: 0.7176, test_loss: 0.9992, test_f1: 0.6025
 epoch: 18, train_loss: 0.7199, test_loss: 1.0253, test_f1: 0.6070
 epoch: 19, train_loss: 0.6798, test_loss: 1.0247, test_f1: 0.6213
 epoch: 20, train_loss: 0.6764, test_loss: 1.0754, test_f1: 0.6187
 epoch: 21, train_loss: 0.6640, test_loss: 1.0681, test_f1: 0.6061
 epoch: 22, train_loss: 0.6670, test_loss: 1.0450, test_f1: 0.6042
 epoch: 23, train_loss: 0.6534, test_loss: 1.0968, test_f1: 0.5981
 epoch: 24, train_loss: 0.6254, test_loss: 1.1285, test_f1: 0.6092
 epoch: 25, train_loss: 0.6300, test_loss: 1.2162, test_f1: 0.5411
 epoch: 26, train_loss: 0.6105, test_loss: 1.1464, test_f1: 0.6116
 epoch: 27, train_loss: 0.6010, test_loss: 1.0642, test_f1: 0.6228
 epoch: 28, train_loss: 0.5923, test_loss: 1.1535, test_f1: 0.5484
 epoch: 29, train_loss: 0.5650, test_loss: 1.2257, test_f1: 0.5713
 epoch: 30, train_loss: 0.5747, test_loss: 1.1841, test_f1: 0.5822
 epoch: 31, train_loss: 0.5751, test_loss: 1.2456, test_f1: 0.5968
 epoch: 32, train_loss: 0.5368, test_loss: 1.1796, test_f1: 0.6175
 epoch: 33, train_loss: 0.5199, test_loss: 1.2787, test_f1: 0.5980
 epoch: 34, train_loss: 0.5086, test_loss: 1.4291, test_f1: 0.5948
 epoch: 35, train_loss: 0.5042, test_loss: 1.3154, test_f1: 0.5924
 epoch: 36, train_loss: 0.4955, test_loss: 1.3503, test_f1: 0.6115
 epoch: 37, train_loss: 0.4983, test_loss: 1.3533, test_f1: 0.5963
 epoch: 38, train_loss: 0.4864, test_loss: 1.4829, test_f1: 0.5913
 epoch: 39, train_loss: 0.4865, test_loss: 1.5102, test_f1: 0.5684
 epoch: 40, train_loss: 0.4547, test_loss: 1.4143, test_f1: 0.5988
 epoch: 41, train_loss: 0.4674, test_loss: 1.3851, test_f1: 0.5953
 epoch: 42, train_loss: 0.4541, test_loss: 1.5538, test_f1: 0.5779
 epoch: 43, train_loss: 0.4616, test_loss: 1.4560, test_f1: 0.5741
 epoch: 44, train_loss: 0.4426, test_loss: 1.5072, test_f1: 0.5941
 epoch: 45, train_loss: 0.4266, test_loss: 1.4661, test_f1: 0.6147
 epoch: 46, train_loss: 0.4096, test_loss: 1.5623, test_f1: 0.5882
 epoch: 47, train_loss: 0.4184, test_loss: 1.4252, test_f1: 0.6095
 epoch: 48, train_loss: 0.4303, test_loss: 1.6141, test_f1: 0.6310
 epoch: 49, train_loss: 0.3822, test_loss: 1.5701, test_f1: 0.5905
 epoch: 50, train_loss: 0.3641, test_loss: 1.7098, test_f1: 0.6263
 epoch: 51, train_loss: 0.3716, test_loss: 1.6743, test_f1: 0.6206
 epoch: 52, train_loss: 0.3461, test_loss: 1.6202, test_f1: 0.6233
 epoch: 53, train_loss: 0.3385, test_loss: 1.6623, test_f1: 0.6072
 epoch: 54, train_loss: 0.3352, test_loss: 1.6517, test_f1: 0.5936
 epoch: 55, train_loss: 0.3279, test_loss: 1.6351, test_f1: 0.5861
 epoch: 56, train_loss: 0.3273, test_loss: 1.6689, test_f1: 0.5994
 epoch: 57, train_loss: 0.3259, test_loss: 1.7557, test_f1: 0.5668
 epoch: 58, train_loss: 0.3383, test_loss: 1.7547, test_f1: 0.6364
 epoch: 59, train_loss: 0.3076, test_loss: 1.6983, test_f1: 0.5963
 epoch: 60, train_loss: 0.3119, test_loss: 1.7613, test_f1: 0.6067
 epoch: 61, train_loss: 0.3129, test_loss: 1.7204, test_f1: 0.5881
 epoch: 62, train_loss: 0.3090, test_loss: 1.8679, test_f1: 0.6124
 epoch: 63, train_loss: 0.2945, test_loss: 1.8420, test_f1: 0.5945
 epoch: 64, train_loss: 0.2965, test_loss: 1.9573, test_f1: 0.5986
 epoch: 65, train_loss: 0.3035, test_loss: 1.9191, test_f1: 0.6197
 epoch: 66, train_loss: 0.2836, test_loss: 1.8841, test_f1: 0.6092
 epoch: 67, train_loss: 0.2760, test_loss: 1.9435, test_f1: 0.5854
 epoch: 68, train_loss: 0.2718, test_loss: 1.9638, test_f1: 0.6046
 epoch: 69, train_loss: 0.2837, test_loss: 1.9987, test_f1: 0.6044
 epoch: 70, train_loss: 0.2813, test_loss: 1.9014, test_f1: 0.5954
 epoch: 71, train_loss: 0.2875, test_loss: 1.9503, test_f1: 0.5760
 epoch: 72, train_loss: 0.2879, test_loss: 1.9766, test_f1: 0.5933
 epoch: 73, train_loss: 0.2603, test_loss: 2.0184, test_f1: 0.5887
 epoch: 74, train_loss: 0.2775, test_loss: 2.1879, test_f1: 0.5760
 epoch: 75, train_loss: 0.2761, test_loss: 2.2685, test_f1: 0.5895
 epoch: 76, train_loss: 0.2603, test_loss: 2.2749, test_f1: 0.5718
 epoch: 77, train_loss: 0.2537, test_loss: 2.1958, test_f1: 0.5713
 epoch: 78, train_loss: 0.2453, test_loss: 1.9139, test_f1: 0.6157
 epoch: 79, train_loss: 0.2475, test_loss: 2.0240, test_f1: 0.5699
 epoch: 80, train_loss: 0.2456, test_loss: 2.2925, test_f1: 0.5934
 epoch: 81, train_loss: 0.2249, test_loss: 2.3091, test_f1: 0.5945
 epoch: 82, train_loss: 0.2583, test_loss: 2.1293, test_f1: 0.5911
 epoch: 83, train_loss: 0.2273, test_loss: 2.3772, test_f1: 0.5893
 epoch: 84, train_loss: 0.2329, test_loss: 2.7651, test_f1: 0.5866
 epoch: 85, train_loss: 0.2460, test_loss: 2.4652, test_f1: 0.5824
 epoch: 86, train_loss: 0.2364, test_loss: 2.4431, test_f1: 0.5459
 epoch: 87, train_loss: 0.2319, test_loss: 2.3566, test_f1: 0.5995
 epoch: 88, train_loss: 0.2313, test_loss: 2.3386, test_f1: 0.5918
 epoch: 89, train_loss: 0.2390, test_loss: 2.2983, test_f1: 0.5943
 epoch: 90, train_loss: 0.2177, test_loss: 2.2776, test_f1: 0.5926
 epoch: 91, train_loss: 0.2182, test_loss: 2.5980, test_f1: 0.6020
 epoch: 92, train_loss: 0.2265, test_loss: 2.3293, test_f1: 0.5785
 epoch: 93, train_loss: 0.2098, test_loss: 2.4534, test_f1: 0.5942
 epoch: 94, train_loss: 0.2126, test_loss: 2.5163, test_f1: 0.5915
 epoch: 95, train_loss: 0.2165, test_loss: 2.5057, test_f1: 0.6018
 epoch: 96, train_loss: 0.2159, test_loss: 2.4079, test_f1: 0.6093
 epoch: 97, train_loss: 0.2057, test_loss: 2.5221, test_f1: 0.5873
 epoch: 98, train_loss: 0.2009, test_loss: 2.3550, test_f1: 0.6044
 epoch: 99, train_loss: 0.2041, test_loss: 2.3964, test_f1: 0.5860
##################ITERATION #6 ****************************************
 epoch: 0, train_loss: 1.2271, test_loss: 1.2828, test_f1: 0.2242
 epoch: 1, train_loss: 1.1236, test_loss: 1.2203, test_f1: 0.3142
 epoch: 2, train_loss: 1.0565, test_loss: 1.1415, test_f1: 0.4865
 epoch: 3, train_loss: 1.0254, test_loss: 1.1149, test_f1: 0.5127
 epoch: 4, train_loss: 0.9900, test_loss: 1.0785, test_f1: 0.5617
 epoch: 5, train_loss: 0.9411, test_loss: 1.0562, test_f1: 0.5614
 epoch: 6, train_loss: 0.9207, test_loss: 1.0742, test_f1: 0.5734
 epoch: 7, train_loss: 0.8973, test_loss: 1.0387, test_f1: 0.5697
 epoch: 8, train_loss: 0.8733, test_loss: 1.0020, test_f1: 0.5815
 epoch: 9, train_loss: 0.8598, test_loss: 1.0375, test_f1: 0.5707
 epoch: 10, train_loss: 0.8313, test_loss: 1.0176, test_f1: 0.5722
 epoch: 11, train_loss: 0.8106, test_loss: 1.0499, test_f1: 0.5919
 epoch: 12, train_loss: 0.7928, test_loss: 1.0165, test_f1: 0.5790
 epoch: 13, train_loss: 0.7758, test_loss: 0.9959, test_f1: 0.5796
 epoch: 14, train_loss: 0.7465, test_loss: 0.9909, test_f1: 0.6007
 epoch: 15, train_loss: 0.7317, test_loss: 1.0210, test_f1: 0.5946
 epoch: 16, train_loss: 0.7284, test_loss: 1.0007, test_f1: 0.6112
 epoch: 17, train_loss: 0.7098, test_loss: 1.0548, test_f1: 0.5789
 epoch: 18, train_loss: 0.6992, test_loss: 1.0712, test_f1: 0.5262
 epoch: 19, train_loss: 0.6879, test_loss: 0.9877, test_f1: 0.6114
 epoch: 20, train_loss: 0.6763, test_loss: 1.0647, test_f1: 0.5973
 epoch: 21, train_loss: 0.6513, test_loss: 1.0544, test_f1: 0.6089
 epoch: 22, train_loss: 0.6379, test_loss: 0.9935, test_f1: 0.6086
 epoch: 23, train_loss: 0.6259, test_loss: 1.0992, test_f1: 0.5590
 epoch: 24, train_loss: 0.6405, test_loss: 1.0664, test_f1: 0.5768
 epoch: 25, train_loss: 0.6091, test_loss: 1.0635, test_f1: 0.5655
 epoch: 26, train_loss: 0.6163, test_loss: 0.9931, test_f1: 0.6012
 epoch: 27, train_loss: 0.5991, test_loss: 1.0321, test_f1: 0.5898
 epoch: 28, train_loss: 0.5716, test_loss: 0.9800, test_f1: 0.6091
 epoch: 29, train_loss: 0.5750, test_loss: 1.1442, test_f1: 0.5719
 epoch: 30, train_loss: 0.5572, test_loss: 1.1398, test_f1: 0.5678
 epoch: 31, train_loss: 0.5375, test_loss: 1.1031, test_f1: 0.6125
 epoch: 32, train_loss: 0.5473, test_loss: 1.0960, test_f1: 0.6031
 epoch: 33, train_loss: 0.5177, test_loss: 1.1739, test_f1: 0.5991
 epoch: 34, train_loss: 0.5232, test_loss: 1.2071, test_f1: 0.5868
 epoch: 35, train_loss: 0.5219, test_loss: 1.1359, test_f1: 0.5954
 epoch: 36, train_loss: 0.5211, test_loss: 1.1913, test_f1: 0.6249
 epoch: 37, train_loss: 0.5049, test_loss: 1.1800, test_f1: 0.5770
 epoch: 38, train_loss: 0.5050, test_loss: 1.1313, test_f1: 0.6142
 epoch: 39, train_loss: 0.4884, test_loss: 1.3526, test_f1: 0.6115
 epoch: 40, train_loss: 0.4933, test_loss: 1.3198, test_f1: 0.5713
 epoch: 41, train_loss: 0.4644, test_loss: 1.2060, test_f1: 0.5973
 epoch: 42, train_loss: 0.4618, test_loss: 1.4620, test_f1: 0.6083
 epoch: 43, train_loss: 0.4727, test_loss: 1.3713, test_f1: 0.6117
 epoch: 44, train_loss: 0.4450, test_loss: 1.3582, test_f1: 0.5813
 epoch: 45, train_loss: 0.4588, test_loss: 1.3368, test_f1: 0.5775
 epoch: 46, train_loss: 0.4361, test_loss: 1.4010, test_f1: 0.5886
 epoch: 47, train_loss: 0.4254, test_loss: 1.4607, test_f1: 0.5627
 epoch: 48, train_loss: 0.4284, test_loss: 1.5799, test_f1: 0.5636
 epoch: 49, train_loss: 0.4229, test_loss: 1.4062, test_f1: 0.6179
 epoch: 50, train_loss: 0.3984, test_loss: 1.6496, test_f1: 0.6039
 epoch: 51, train_loss: 0.3766, test_loss: 1.5270, test_f1: 0.5856
 epoch: 52, train_loss: 0.3773, test_loss: 1.6360, test_f1: 0.5681
 epoch: 53, train_loss: 0.3906, test_loss: 1.5725, test_f1: 0.5791
 epoch: 54, train_loss: 0.3583, test_loss: 1.5274, test_f1: 0.6055
 epoch: 55, train_loss: 0.3540, test_loss: 1.6159, test_f1: 0.6057
 epoch: 56, train_loss: 0.3631, test_loss: 1.5665, test_f1: 0.5795
 epoch: 57, train_loss: 0.3651, test_loss: 1.6870, test_f1: 0.5876
 epoch: 58, train_loss: 0.3423, test_loss: 1.6953, test_f1: 0.5975
 epoch: 59, train_loss: 0.3651, test_loss: 1.6535, test_f1: 0.5641
 epoch: 60, train_loss: 0.3382, test_loss: 1.6504, test_f1: 0.5528
 epoch: 61, train_loss: 0.3594, test_loss: 1.6642, test_f1: 0.5778
 epoch: 62, train_loss: 0.3471, test_loss: 1.6450, test_f1: 0.5604
 epoch: 63, train_loss: 0.3291, test_loss: 1.6594, test_f1: 0.5780
 epoch: 64, train_loss: 0.3338, test_loss: 1.7235, test_f1: 0.5967
 epoch: 65, train_loss: 0.3097, test_loss: 1.7477, test_f1: 0.5934
 epoch: 66, train_loss: 0.3101, test_loss: 1.7409, test_f1: 0.5934
 epoch: 67, train_loss: 0.3084, test_loss: 2.0008, test_f1: 0.5702
 epoch: 68, train_loss: 0.3164, test_loss: 1.7435, test_f1: 0.5782
 epoch: 69, train_loss: 0.3255, test_loss: 1.8329, test_f1: 0.5783
 epoch: 70, train_loss: 0.3013, test_loss: 1.7698, test_f1: 0.5873
 epoch: 71, train_loss: 0.2996, test_loss: 1.9081, test_f1: 0.5792
 epoch: 72, train_loss: 0.3014, test_loss: 1.8001, test_f1: 0.5992
 epoch: 73, train_loss: 0.3049, test_loss: 1.8796, test_f1: 0.5783
 epoch: 74, train_loss: 0.3056, test_loss: 1.7967, test_f1: 0.5867
 epoch: 75, train_loss: 0.3015, test_loss: 1.8918, test_f1: 0.5986
 epoch: 76, train_loss: 0.2860, test_loss: 2.0012, test_f1: 0.5807
 epoch: 77, train_loss: 0.2997, test_loss: 1.8448, test_f1: 0.5733
 epoch: 78, train_loss: 0.2867, test_loss: 1.8616, test_f1: 0.5787
 epoch: 79, train_loss: 0.2866, test_loss: 1.9242, test_f1: 0.5558
 epoch: 80, train_loss: 0.2950, test_loss: 1.8875, test_f1: 0.5756
 epoch: 81, train_loss: 0.2727, test_loss: 1.8592, test_f1: 0.5673
 epoch: 82, train_loss: 0.2858, test_loss: 1.7957, test_f1: 0.5839
 epoch: 83, train_loss: 0.2883, test_loss: 1.9067, test_f1: 0.5716
 epoch: 84, train_loss: 0.3074, test_loss: 2.0196, test_f1: 0.5642
 epoch: 85, train_loss: 0.2631, test_loss: 1.9185, test_f1: 0.5726
 epoch: 86, train_loss: 0.2663, test_loss: 1.9975, test_f1: 0.5630
 epoch: 87, train_loss: 0.2690, test_loss: 1.9710, test_f1: 0.5762
 epoch: 88, train_loss: 0.2572, test_loss: 2.1522, test_f1: 0.5779
 epoch: 89, train_loss: 0.2500, test_loss: 1.9007, test_f1: 0.5648
 epoch: 90, train_loss: 0.2561, test_loss: 1.9525, test_f1: 0.5715
 epoch: 91, train_loss: 0.2589, test_loss: 2.0903, test_f1: 0.5669
 epoch: 92, train_loss: 0.2279, test_loss: 2.1909, test_f1: 0.5590
 epoch: 93, train_loss: 0.2359, test_loss: 2.1569, test_f1: 0.5663
 epoch: 94, train_loss: 0.2518, test_loss: 2.1775, test_f1: 0.5682
 epoch: 95, train_loss: 0.2488, test_loss: 2.1617, test_f1: 0.5604
 epoch: 96, train_loss: 0.2412, test_loss: 2.2138, test_f1: 0.5668
 epoch: 97, train_loss: 0.2447, test_loss: 2.2200, test_f1: 0.5693
 epoch: 98, train_loss: 0.2246, test_loss: 2.2336, test_f1: 0.5576
 epoch: 99, train_loss: 0.2102, test_loss: 2.2946, test_f1: 0.5777
##################ITERATION #7 ****************************************
 epoch: 0, train_loss: 1.2474, test_loss: 1.3345, test_f1: 0.2571
 epoch: 1, train_loss: 1.1014, test_loss: 1.2682, test_f1: 0.2921
 epoch: 2, train_loss: 1.0486, test_loss: 1.1319, test_f1: 0.4448
 epoch: 3, train_loss: 1.0022, test_loss: 1.0890, test_f1: 0.4841
 epoch: 4, train_loss: 0.9726, test_loss: 1.0418, test_f1: 0.5223
 epoch: 5, train_loss: 0.9424, test_loss: 1.0380, test_f1: 0.5190
 epoch: 6, train_loss: 0.9158, test_loss: 1.0228, test_f1: 0.5592
 epoch: 7, train_loss: 0.8874, test_loss: 1.0170, test_f1: 0.5157
 epoch: 8, train_loss: 0.8756, test_loss: 0.9985, test_f1: 0.5933
 epoch: 9, train_loss: 0.8439, test_loss: 1.0052, test_f1: 0.5868
 epoch: 10, train_loss: 0.8455, test_loss: 0.9946, test_f1: 0.5886
 epoch: 11, train_loss: 0.8237, test_loss: 0.9807, test_f1: 0.6336
 epoch: 12, train_loss: 0.8100, test_loss: 0.9871, test_f1: 0.6256
 epoch: 13, train_loss: 0.7974, test_loss: 0.9740, test_f1: 0.6044
 epoch: 14, train_loss: 0.7880, test_loss: 0.9898, test_f1: 0.6307
 epoch: 15, train_loss: 0.7469, test_loss: 0.9971, test_f1: 0.6154
 epoch: 16, train_loss: 0.7508, test_loss: 0.9915, test_f1: 0.6318
 epoch: 17, train_loss: 0.7438, test_loss: 0.9909, test_f1: 0.6445
 epoch: 18, train_loss: 0.7227, test_loss: 1.0249, test_f1: 0.5779
 epoch: 19, train_loss: 0.7094, test_loss: 1.0111, test_f1: 0.6447
 epoch: 20, train_loss: 0.7037, test_loss: 1.0024, test_f1: 0.6407
 epoch: 21, train_loss: 0.6758, test_loss: 1.0115, test_f1: 0.6581
 epoch: 22, train_loss: 0.6701, test_loss: 1.0231, test_f1: 0.6121
 epoch: 23, train_loss: 0.6356, test_loss: 1.0056, test_f1: 0.6621
 epoch: 24, train_loss: 0.6538, test_loss: 0.9787, test_f1: 0.6691
 epoch: 25, train_loss: 0.6394, test_loss: 1.0189, test_f1: 0.6509
 epoch: 26, train_loss: 0.6372, test_loss: 1.0168, test_f1: 0.6807
 epoch: 27, train_loss: 0.6254, test_loss: 1.0847, test_f1: 0.6172
 epoch: 28, train_loss: 0.6017, test_loss: 1.0131, test_f1: 0.6464
 epoch: 29, train_loss: 0.6204, test_loss: 1.0564, test_f1: 0.6146
 epoch: 30, train_loss: 0.6034, test_loss: 1.0257, test_f1: 0.6551
 epoch: 31, train_loss: 0.5836, test_loss: 1.0933, test_f1: 0.6543
 epoch: 32, train_loss: 0.5637, test_loss: 1.1290, test_f1: 0.6188
 epoch: 33, train_loss: 0.5673, test_loss: 1.1549, test_f1: 0.6103
 epoch: 34, train_loss: 0.5350, test_loss: 1.1488, test_f1: 0.6195
 epoch: 35, train_loss: 0.5247, test_loss: 1.1015, test_f1: 0.6397
 epoch: 36, train_loss: 0.5307, test_loss: 1.1115, test_f1: 0.6408
 epoch: 37, train_loss: 0.5265, test_loss: 1.1775, test_f1: 0.6104
 epoch: 38, train_loss: 0.5184, test_loss: 1.1346, test_f1: 0.6451
 epoch: 39, train_loss: 0.4915, test_loss: 1.1586, test_f1: 0.6506
 epoch: 40, train_loss: 0.4928, test_loss: 1.1561, test_f1: 0.6412
 epoch: 41, train_loss: 0.4776, test_loss: 1.2534, test_f1: 0.6213
 epoch: 42, train_loss: 0.4556, test_loss: 1.1968, test_f1: 0.6161
 epoch: 43, train_loss: 0.4819, test_loss: 1.1613, test_f1: 0.6283
 epoch: 44, train_loss: 0.4740, test_loss: 1.1606, test_f1: 0.6502
 epoch: 45, train_loss: 0.4520, test_loss: 1.1412, test_f1: 0.6499
 epoch: 46, train_loss: 0.4615, test_loss: 1.2319, test_f1: 0.6362
 epoch: 47, train_loss: 0.4280, test_loss: 1.2028, test_f1: 0.6286
 epoch: 48, train_loss: 0.4223, test_loss: 1.2016, test_f1: 0.6052
 epoch: 49, train_loss: 0.4268, test_loss: 1.2762, test_f1: 0.6382
 epoch: 50, train_loss: 0.4149, test_loss: 1.3446, test_f1: 0.6287
 epoch: 51, train_loss: 0.3979, test_loss: 1.2702, test_f1: 0.6110
 epoch: 52, train_loss: 0.3717, test_loss: 1.2627, test_f1: 0.6375
 epoch: 53, train_loss: 0.3560, test_loss: 1.2742, test_f1: 0.6382
 epoch: 54, train_loss: 0.3782, test_loss: 1.3269, test_f1: 0.6410
 epoch: 55, train_loss: 0.3806, test_loss: 1.2948, test_f1: 0.6512
 epoch: 56, train_loss: 0.3619, test_loss: 1.3174, test_f1: 0.6232
 epoch: 57, train_loss: 0.3507, test_loss: 1.4027, test_f1: 0.6349
 epoch: 58, train_loss: 0.3403, test_loss: 1.3918, test_f1: 0.6091
 epoch: 59, train_loss: 0.3412, test_loss: 1.3483, test_f1: 0.6366
 epoch: 60, train_loss: 0.3492, test_loss: 1.3741, test_f1: 0.6143
 epoch: 61, train_loss: 0.3341, test_loss: 1.3873, test_f1: 0.6450
 epoch: 62, train_loss: 0.3438, test_loss: 1.3895, test_f1: 0.6345
 epoch: 63, train_loss: 0.3318, test_loss: 1.3378, test_f1: 0.6583
 epoch: 64, train_loss: 0.3583, test_loss: 1.4337, test_f1: 0.6469
 epoch: 65, train_loss: 0.3298, test_loss: 1.3621, test_f1: 0.6397
 epoch: 66, train_loss: 0.3101, test_loss: 1.3556, test_f1: 0.6289
 epoch: 67, train_loss: 0.3108, test_loss: 1.4252, test_f1: 0.6318
 epoch: 68, train_loss: 0.2915, test_loss: 1.4861, test_f1: 0.6287
 epoch: 69, train_loss: 0.3067, test_loss: 1.4363, test_f1: 0.6493
 epoch: 70, train_loss: 0.3012, test_loss: 1.4561, test_f1: 0.6211
 epoch: 71, train_loss: 0.2858, test_loss: 1.4831, test_f1: 0.6328
 epoch: 72, train_loss: 0.3101, test_loss: 1.5007, test_f1: 0.6150
 epoch: 73, train_loss: 0.3256, test_loss: 1.4375, test_f1: 0.6170
 epoch: 74, train_loss: 0.3047, test_loss: 1.4833, test_f1: 0.6420
 epoch: 75, train_loss: 0.3015, test_loss: 1.4545, test_f1: 0.6215
 epoch: 76, train_loss: 0.3124, test_loss: 1.5235, test_f1: 0.6139
 epoch: 77, train_loss: 0.3157, test_loss: 1.5801, test_f1: 0.6185
 epoch: 78, train_loss: 0.2856, test_loss: 1.5390, test_f1: 0.6157
 epoch: 79, train_loss: 0.2710, test_loss: 1.6247, test_f1: 0.6077
 epoch: 80, train_loss: 0.2660, test_loss: 1.5758, test_f1: 0.5942
 epoch: 81, train_loss: 0.2704, test_loss: 1.5104, test_f1: 0.6240
 epoch: 82, train_loss: 0.2755, test_loss: 1.5976, test_f1: 0.6160
 epoch: 83, train_loss: 0.2562, test_loss: 1.5989, test_f1: 0.6119
 epoch: 84, train_loss: 0.2535, test_loss: 1.5315, test_f1: 0.6250
 epoch: 85, train_loss: 0.2750, test_loss: 1.5473, test_f1: 0.6402
 epoch: 86, train_loss: 0.2453, test_loss: 1.5969, test_f1: 0.6318
 epoch: 87, train_loss: 0.2458, test_loss: 1.6882, test_f1: 0.6293
 epoch: 88, train_loss: 0.2468, test_loss: 1.6286, test_f1: 0.6100
 epoch: 89, train_loss: 0.2695, test_loss: 1.6591, test_f1: 0.6354
 epoch: 90, train_loss: 0.2520, test_loss: 1.5660, test_f1: 0.6190
 epoch: 91, train_loss: 0.2388, test_loss: 1.6814, test_f1: 0.6168
 epoch: 92, train_loss: 0.2543, test_loss: 1.6239, test_f1: 0.6220
 epoch: 93, train_loss: 0.2538, test_loss: 1.6377, test_f1: 0.6293
 epoch: 94, train_loss: 0.2368, test_loss: 1.5929, test_f1: 0.6071
 epoch: 95, train_loss: 0.2262, test_loss: 1.7329, test_f1: 0.6030
 epoch: 96, train_loss: 0.2319, test_loss: 1.7183, test_f1: 0.6101
 epoch: 97, train_loss: 0.2369, test_loss: 1.8241, test_f1: 0.5861
 epoch: 98, train_loss: 0.2253, test_loss: 1.8704, test_f1: 0.6114
 epoch: 99, train_loss: 0.2320, test_loss: 1.6674, test_f1: 0.6149
##################ITERATION #8 ****************************************
 epoch: 0, train_loss: 1.2447, test_loss: 1.3043, test_f1: 0.2281
 epoch: 1, train_loss: 1.1278, test_loss: 1.2693, test_f1: 0.3542
 epoch: 2, train_loss: 1.0679, test_loss: 1.1664, test_f1: 0.4203
 epoch: 3, train_loss: 1.0271, test_loss: 1.0879, test_f1: 0.4964
 epoch: 4, train_loss: 1.0131, test_loss: 1.0621, test_f1: 0.5313
 epoch: 5, train_loss: 0.9593, test_loss: 1.0490, test_f1: 0.5535
 epoch: 6, train_loss: 0.9401, test_loss: 1.0318, test_f1: 0.5501
 epoch: 7, train_loss: 0.9129, test_loss: 1.0212, test_f1: 0.5514
 epoch: 8, train_loss: 0.8804, test_loss: 1.0102, test_f1: 0.5568
 epoch: 9, train_loss: 0.8709, test_loss: 1.0195, test_f1: 0.5679
 epoch: 10, train_loss: 0.8416, test_loss: 1.0036, test_f1: 0.5438
 epoch: 11, train_loss: 0.8486, test_loss: 1.0236, test_f1: 0.5289
 epoch: 12, train_loss: 0.8125, test_loss: 1.0557, test_f1: 0.5597
 epoch: 13, train_loss: 0.8018, test_loss: 1.0119, test_f1: 0.5766
 epoch: 14, train_loss: 0.7901, test_loss: 1.0482, test_f1: 0.5782
 epoch: 15, train_loss: 0.7783, test_loss: 1.0612, test_f1: 0.5420
 epoch: 16, train_loss: 0.7669, test_loss: 1.0486, test_f1: 0.5834
 epoch: 17, train_loss: 0.7510, test_loss: 1.0985, test_f1: 0.5760
 epoch: 18, train_loss: 0.7362, test_loss: 1.0614, test_f1: 0.5839
 epoch: 19, train_loss: 0.7141, test_loss: 1.0287, test_f1: 0.5592
 epoch: 20, train_loss: 0.6932, test_loss: 1.0828, test_f1: 0.5448
 epoch: 21, train_loss: 0.7066, test_loss: 1.1801, test_f1: 0.5865
 epoch: 22, train_loss: 0.6801, test_loss: 1.0745, test_f1: 0.5869
 epoch: 23, train_loss: 0.6703, test_loss: 1.0982, test_f1: 0.5574
 epoch: 24, train_loss: 0.6539, test_loss: 1.2307, test_f1: 0.5771
 epoch: 25, train_loss: 0.6340, test_loss: 1.1020, test_f1: 0.5824
 epoch: 26, train_loss: 0.6336, test_loss: 1.1797, test_f1: 0.5847
 epoch: 27, train_loss: 0.6201, test_loss: 1.2259, test_f1: 0.5673
 epoch: 28, train_loss: 0.5954, test_loss: 1.1588, test_f1: 0.6034
 epoch: 29, train_loss: 0.5848, test_loss: 1.2373, test_f1: 0.5422
 epoch: 30, train_loss: 0.5964, test_loss: 1.1180, test_f1: 0.5816
 epoch: 31, train_loss: 0.6011, test_loss: 1.1835, test_f1: 0.5833
 epoch: 32, train_loss: 0.5652, test_loss: 1.2535, test_f1: 0.5662
 epoch: 33, train_loss: 0.5663, test_loss: 1.2139, test_f1: 0.5994
 epoch: 34, train_loss: 0.5492, test_loss: 1.1479, test_f1: 0.5997
 epoch: 35, train_loss: 0.5428, test_loss: 1.1699, test_f1: 0.5935
 epoch: 36, train_loss: 0.5547, test_loss: 1.3415, test_f1: 0.5595
 epoch: 37, train_loss: 0.5302, test_loss: 1.2136, test_f1: 0.6094
 epoch: 38, train_loss: 0.5138, test_loss: 1.2862, test_f1: 0.6073
 epoch: 39, train_loss: 0.5020, test_loss: 1.1718, test_f1: 0.5867
 epoch: 40, train_loss: 0.5103, test_loss: 1.2556, test_f1: 0.5911
 epoch: 41, train_loss: 0.4907, test_loss: 1.2767, test_f1: 0.5820
 epoch: 42, train_loss: 0.4906, test_loss: 1.3747, test_f1: 0.5808
 epoch: 43, train_loss: 0.4676, test_loss: 1.2558, test_f1: 0.5745
 epoch: 44, train_loss: 0.4696, test_loss: 1.4388, test_f1: 0.5492
 epoch: 45, train_loss: 0.4564, test_loss: 1.3128, test_f1: 0.6389
 epoch: 46, train_loss: 0.4560, test_loss: 1.3919, test_f1: 0.6116
 epoch: 47, train_loss: 0.4485, test_loss: 1.3259, test_f1: 0.5868
 epoch: 48, train_loss: 0.4484, test_loss: 1.4273, test_f1: 0.5675
 epoch: 49, train_loss: 0.4198, test_loss: 1.4559, test_f1: 0.5565
 epoch: 50, train_loss: 0.4269, test_loss: 1.2559, test_f1: 0.5703
 epoch: 51, train_loss: 0.3944, test_loss: 1.3595, test_f1: 0.5948
 epoch: 52, train_loss: 0.3867, test_loss: 1.3936, test_f1: 0.5612
 epoch: 53, train_loss: 0.3858, test_loss: 1.4365, test_f1: 0.5529
 epoch: 54, train_loss: 0.3992, test_loss: 1.3700, test_f1: 0.5861
 epoch: 55, train_loss: 0.3760, test_loss: 1.3630, test_f1: 0.5755
 epoch: 56, train_loss: 0.3701, test_loss: 1.4014, test_f1: 0.5593
 epoch: 57, train_loss: 0.3621, test_loss: 1.3494, test_f1: 0.5668
 epoch: 58, train_loss: 0.3446, test_loss: 1.4013, test_f1: 0.5693
 epoch: 59, train_loss: 0.3776, test_loss: 1.4733, test_f1: 0.5578
 epoch: 60, train_loss: 0.3636, test_loss: 1.4082, test_f1: 0.5835
 epoch: 61, train_loss: 0.3573, test_loss: 1.4115, test_f1: 0.5682
 epoch: 62, train_loss: 0.3450, test_loss: 1.4669, test_f1: 0.5711
 epoch: 63, train_loss: 0.3346, test_loss: 1.4674, test_f1: 0.5860
 epoch: 64, train_loss: 0.3717, test_loss: 1.3861, test_f1: 0.5788
 epoch: 65, train_loss: 0.3488, test_loss: 1.4259, test_f1: 0.5752
 epoch: 66, train_loss: 0.3229, test_loss: 1.5166, test_f1: 0.5668
 epoch: 67, train_loss: 0.3413, test_loss: 1.4402, test_f1: 0.5890
 epoch: 68, train_loss: 0.3224, test_loss: 1.4854, test_f1: 0.5879
 epoch: 69, train_loss: 0.2937, test_loss: 1.5219, test_f1: 0.5799
 epoch: 70, train_loss: 0.3165, test_loss: 1.4770, test_f1: 0.5614
 epoch: 71, train_loss: 0.3131, test_loss: 1.5647, test_f1: 0.5778
 epoch: 72, train_loss: 0.3285, test_loss: 1.5530, test_f1: 0.5904
 epoch: 73, train_loss: 0.3139, test_loss: 1.5377, test_f1: 0.5939
 epoch: 74, train_loss: 0.3102, test_loss: 1.5009, test_f1: 0.6184
 epoch: 75, train_loss: 0.3172, test_loss: 1.5453, test_f1: 0.5900
 epoch: 76, train_loss: 0.3107, test_loss: 1.5138, test_f1: 0.6059
 epoch: 77, train_loss: 0.2933, test_loss: 1.5786, test_f1: 0.5775
 epoch: 78, train_loss: 0.2816, test_loss: 1.6108, test_f1: 0.5813
 epoch: 79, train_loss: 0.2816, test_loss: 1.5307, test_f1: 0.5830
 epoch: 80, train_loss: 0.2865, test_loss: 1.5131, test_f1: 0.6027
 epoch: 81, train_loss: 0.2870, test_loss: 1.6868, test_f1: 0.5697
 epoch: 82, train_loss: 0.2885, test_loss: 1.7558, test_f1: 0.5717
 epoch: 83, train_loss: 0.2613, test_loss: 1.6494, test_f1: 0.5882
 epoch: 84, train_loss: 0.2941, test_loss: 1.6683, test_f1: 0.6024
 epoch: 85, train_loss: 0.2726, test_loss: 1.6825, test_f1: 0.5912
 epoch: 86, train_loss: 0.2748, test_loss: 1.5786, test_f1: 0.6039
 epoch: 87, train_loss: 0.2620, test_loss: 1.6639, test_f1: 0.5753
 epoch: 88, train_loss: 0.2819, test_loss: 1.7015, test_f1: 0.5817
 epoch: 89, train_loss: 0.2818, test_loss: 1.7486, test_f1: 0.5784
 epoch: 90, train_loss: 0.2605, test_loss: 1.7637, test_f1: 0.6088
 epoch: 91, train_loss: 0.2613, test_loss: 1.6554, test_f1: 0.6196
 epoch: 92, train_loss: 0.2637, test_loss: 1.6727, test_f1: 0.6076
 epoch: 93, train_loss: 0.2557, test_loss: 1.7458, test_f1: 0.5869
 epoch: 94, train_loss: 0.2557, test_loss: 1.7961, test_f1: 0.5863
 epoch: 95, train_loss: 0.2629, test_loss: 1.8092, test_f1: 0.5880
 epoch: 96, train_loss: 0.2577, test_loss: 1.7067, test_f1: 0.6207
 epoch: 97, train_loss: 0.2532, test_loss: 1.8932, test_f1: 0.5884
 epoch: 98, train_loss: 0.2379, test_loss: 1.7307, test_f1: 0.6253
 epoch: 99, train_loss: 0.2485, test_loss: 1.8400, test_f1: 0.5888
##################ITERATION #9 ****************************************
 epoch: 0, train_loss: 1.2940, test_loss: 1.3064, test_f1: 0.2289
 epoch: 1, train_loss: 1.1365, test_loss: 1.3354, test_f1: 0.3068
 epoch: 2, train_loss: 1.0868, test_loss: 1.2188, test_f1: 0.4989
 epoch: 3, train_loss: 1.0497, test_loss: 1.2182, test_f1: 0.5370
 epoch: 4, train_loss: 1.0138, test_loss: 1.1677, test_f1: 0.5063
 epoch: 5, train_loss: 0.9662, test_loss: 1.1595, test_f1: 0.5254
 epoch: 6, train_loss: 0.9592, test_loss: 1.1436, test_f1: 0.5335
 epoch: 7, train_loss: 0.9057, test_loss: 1.1059, test_f1: 0.5492
 epoch: 8, train_loss: 0.9026, test_loss: 1.1370, test_f1: 0.5724
 epoch: 9, train_loss: 0.8757, test_loss: 1.0883, test_f1: 0.5738
 epoch: 10, train_loss: 0.8556, test_loss: 1.0614, test_f1: 0.5591
 epoch: 11, train_loss: 0.8433, test_loss: 1.0924, test_f1: 0.5635
 epoch: 12, train_loss: 0.8102, test_loss: 1.0593, test_f1: 0.5726
 epoch: 13, train_loss: 0.8093, test_loss: 1.0869, test_f1: 0.5905
 epoch: 14, train_loss: 0.7837, test_loss: 1.0805, test_f1: 0.5783
 epoch: 15, train_loss: 0.7779, test_loss: 1.0792, test_f1: 0.5674
 epoch: 16, train_loss: 0.7649, test_loss: 1.0888, test_f1: 0.5775
 epoch: 17, train_loss: 0.7548, test_loss: 1.0557, test_f1: 0.6017
 epoch: 18, train_loss: 0.7239, test_loss: 1.1110, test_f1: 0.5943
 epoch: 19, train_loss: 0.7111, test_loss: 1.0643, test_f1: 0.6137
 epoch: 20, train_loss: 0.7049, test_loss: 1.0916, test_f1: 0.5795
 epoch: 21, train_loss: 0.6921, test_loss: 1.0782, test_f1: 0.6075
 epoch: 22, train_loss: 0.6973, test_loss: 1.0478, test_f1: 0.6210
 epoch: 23, train_loss: 0.6868, test_loss: 1.0833, test_f1: 0.6048
 epoch: 24, train_loss: 0.6459, test_loss: 1.0866, test_f1: 0.6265
 epoch: 25, train_loss: 0.6482, test_loss: 1.0854, test_f1: 0.6099
 epoch: 26, train_loss: 0.6251, test_loss: 1.1057, test_f1: 0.6040
 epoch: 27, train_loss: 0.6138, test_loss: 1.1066, test_f1: 0.5938
 epoch: 28, train_loss: 0.6272, test_loss: 1.1191, test_f1: 0.5979
 epoch: 29, train_loss: 0.5827, test_loss: 1.1613, test_f1: 0.5526
 epoch: 30, train_loss: 0.6040, test_loss: 1.1610, test_f1: 0.5606
 epoch: 31, train_loss: 0.5781, test_loss: 1.1695, test_f1: 0.5820
 epoch: 32, train_loss: 0.5619, test_loss: 1.1786, test_f1: 0.5894
 epoch: 33, train_loss: 0.5716, test_loss: 1.1998, test_f1: 0.6006
 epoch: 34, train_loss: 0.5600, test_loss: 1.2597, test_f1: 0.5555
 epoch: 35, train_loss: 0.5491, test_loss: 1.2912, test_f1: 0.5711
 epoch: 36, train_loss: 0.5366, test_loss: 1.1746, test_f1: 0.5948
 epoch: 37, train_loss: 0.5364, test_loss: 1.2437, test_f1: 0.5901
 epoch: 38, train_loss: 0.5344, test_loss: 1.1742, test_f1: 0.6116
 epoch: 39, train_loss: 0.5103, test_loss: 1.2240, test_f1: 0.6190
 epoch: 40, train_loss: 0.4912, test_loss: 1.3416, test_f1: 0.5700
 epoch: 41, train_loss: 0.5088, test_loss: 1.2189, test_f1: 0.6209
 epoch: 42, train_loss: 0.4694, test_loss: 1.2862, test_f1: 0.5998
 epoch: 43, train_loss: 0.4664, test_loss: 1.2041, test_f1: 0.6156
 epoch: 44, train_loss: 0.4480, test_loss: 1.3164, test_f1: 0.5599
 epoch: 45, train_loss: 0.4701, test_loss: 1.3915, test_f1: 0.5930
 epoch: 46, train_loss: 0.4455, test_loss: 1.3485, test_f1: 0.5965
 epoch: 47, train_loss: 0.4373, test_loss: 1.3188, test_f1: 0.6138
 epoch: 48, train_loss: 0.4318, test_loss: 1.3941, test_f1: 0.5671
 epoch: 49, train_loss: 0.4232, test_loss: 1.3633, test_f1: 0.5937
 epoch: 50, train_loss: 0.4281, test_loss: 1.4280, test_f1: 0.5963
 epoch: 51, train_loss: 0.3911, test_loss: 1.3674, test_f1: 0.5935
 epoch: 52, train_loss: 0.3772, test_loss: 1.3996, test_f1: 0.5965
 epoch: 53, train_loss: 0.3602, test_loss: 1.4427, test_f1: 0.5809
 epoch: 54, train_loss: 0.3679, test_loss: 1.4409, test_f1: 0.5938
 epoch: 55, train_loss: 0.3705, test_loss: 1.3556, test_f1: 0.6140
 epoch: 56, train_loss: 0.3543, test_loss: 1.4135, test_f1: 0.5996
 epoch: 57, train_loss: 0.3603, test_loss: 1.4194, test_f1: 0.6161
 epoch: 58, train_loss: 0.3723, test_loss: 1.4248, test_f1: 0.6311
 epoch: 59, train_loss: 0.3426, test_loss: 1.3933, test_f1: 0.6194
 epoch: 60, train_loss: 0.3576, test_loss: 1.5164, test_f1: 0.5875
 epoch: 61, train_loss: 0.3503, test_loss: 1.4539, test_f1: 0.5951
 epoch: 62, train_loss: 0.3285, test_loss: 1.4277, test_f1: 0.6238
 epoch: 63, train_loss: 0.3329, test_loss: 1.4116, test_f1: 0.6083
 epoch: 64, train_loss: 0.3390, test_loss: 1.4854, test_f1: 0.6055
 epoch: 65, train_loss: 0.3255, test_loss: 1.3984, test_f1: 0.6122
 epoch: 66, train_loss: 0.3386, test_loss: 1.4620, test_f1: 0.6205
 epoch: 67, train_loss: 0.3158, test_loss: 1.4812, test_f1: 0.6120
 epoch: 68, train_loss: 0.3077, test_loss: 1.5395, test_f1: 0.6010
 epoch: 69, train_loss: 0.3231, test_loss: 1.4888, test_f1: 0.6050
 epoch: 70, train_loss: 0.2906, test_loss: 1.4581, test_f1: 0.6105
 epoch: 71, train_loss: 0.3017, test_loss: 1.4841, test_f1: 0.6164
 epoch: 72, train_loss: 0.3002, test_loss: 1.4796, test_f1: 0.6197
 epoch: 73, train_loss: 0.2967, test_loss: 1.5597, test_f1: 0.6116
 epoch: 74, train_loss: 0.2971, test_loss: 1.5463, test_f1: 0.6010
 epoch: 75, train_loss: 0.2774, test_loss: 1.5906, test_f1: 0.5986
 epoch: 76, train_loss: 0.2900, test_loss: 1.6554, test_f1: 0.5888
 epoch: 77, train_loss: 0.2797, test_loss: 1.6405, test_f1: 0.5942
 epoch: 78, train_loss: 0.2720, test_loss: 1.5601, test_f1: 0.5936
 epoch: 79, train_loss: 0.2754, test_loss: 1.6030, test_f1: 0.6134
 epoch: 80, train_loss: 0.2894, test_loss: 1.6154, test_f1: 0.6049
 epoch: 81, train_loss: 0.2703, test_loss: 1.6374, test_f1: 0.5842
 epoch: 82, train_loss: 0.2617, test_loss: 1.7225, test_f1: 0.5729
 epoch: 83, train_loss: 0.2610, test_loss: 1.6782, test_f1: 0.5767
 epoch: 84, train_loss: 0.2525, test_loss: 1.7149, test_f1: 0.5830
 epoch: 85, train_loss: 0.2551, test_loss: 1.6942, test_f1: 0.5885
 epoch: 86, train_loss: 0.2792, test_loss: 1.6852, test_f1: 0.5971
 epoch: 87, train_loss: 0.2716, test_loss: 1.7263, test_f1: 0.6029
 epoch: 88, train_loss: 0.2505, test_loss: 1.6715, test_f1: 0.5963
 epoch: 89, train_loss: 0.2493, test_loss: 1.6816, test_f1: 0.5722
 epoch: 90, train_loss: 0.2454, test_loss: 1.6420, test_f1: 0.6106
 epoch: 91, train_loss: 0.2385, test_loss: 1.8807, test_f1: 0.5814
 epoch: 92, train_loss: 0.2440, test_loss: 1.8005, test_f1: 0.5666
 epoch: 93, train_loss: 0.2418, test_loss: 1.7699, test_f1: 0.5609
 epoch: 94, train_loss: 0.2378, test_loss: 1.8421, test_f1: 0.5498
 epoch: 95, train_loss: 0.2415, test_loss: 1.7132, test_f1: 0.5715
 epoch: 96, train_loss: 0.2407, test_loss: 1.7272, test_f1: 0.5902
 epoch: 97, train_loss: 0.2189, test_loss: 1.7834, test_f1: 0.5903
 epoch: 98, train_loss: 0.2587, test_loss: 1.7820, test_f1: 0.5841
 epoch: 99, train_loss: 0.2306, test_loss: 1.8079, test_f1: 0.5514

Training completed in 755.43 seconds
Best F1: 0.6821 at epoch 48
Mean F1 across iterations: 0.6456  0.0196
========================FINAL RESULTS================================
FEGIN weighted F1: 0.6821  0.0196
python main.py --data ltspice_demos --representation component_pin --model FEGIN --layers 6 --hiddens 128 --batch_size 64 --lr 0.0001 --emb_size 512 --epochs 100 --save_appendix component_pin_L6_H128_BS64_LR0.0001_E512 --no_val
-----



STDERR:
  File "main.py", line 370, in <module>
    main()
  File "main.py", line 254, in main
    dataset = dataset_class(
  File "/home/philip/projects/ltspice_examples_code_repo/Circuit-Completion-Using-GNNs/component_classification_with_link_prediction_head/evaluation/FEGIN/kernel/circuit_datasets.py", line 15, in __init__
    self.data, self.slices = torch.load(self.processed_paths[0])
  File "/home/philip/.local/lib/python3.8/site-packages/torch/serialization.py", line 1040, in load
    warnings.warn(
  File "/usr/lib/python3.8/warnings.py", line 109, in _showwarnmsg
    sw(msg.message, msg.category, msg.filename, msg.lineno,
  File "main.py", line 47, in warn_with_traceback
    traceback.print_stack(file=log)
/home/philip/projects/ltspice_examples_code_repo/Circuit-Completion-Using-GNNs/component_classification_with_link_prediction_head/evaluation/FEGIN/kernel/circuit_datasets.py:15: FutureWarning: You are using `torch.load` with `weights_only=False` (the current default value), which uses the default pickle module implicitly. It is possible to construct malicious pickle data which will execute arbitrary code during unpickling (See https://github.com/pytorch/pytorch/blob/main/SECURITY.md#untrusted-models for more details). In a future release, the default value for `weights_only` will be flipped to `True`. This limits the functions that could be executed during unpickling. Arbitrary objects will no longer be allowed to be loaded via this mode unless they are explicitly allowlisted by the user via `torch.serialization.add_safe_globals`. We recommend you start setting `weights_only=True` for any use case where you don't have full control of the loaded file. Please open an issue on GitHub for any issues related to this experimental feature.
  self.data, self.slices = torch.load(self.processed_paths[0])
