STDOUT:
Results will be saved in /home/philip/projects/ltspice_examples_code_repo/Circuit-Completion-Using-GNNs/component_classification_with_link_prediction_head/evaluation/FEGIN/results/model_FEGIN_dataset_ltspice_examples
Command line input: python main.py --data ltspice_examples --representation component_net --model FEGIN --layers 2 --hiddens 128 --batch_size 32 --lr 0.0001 --emb_size 128 --epochs 100 --save_appendix component_net_L2_H128_BS32_LR0.0001_E128 --no_val
 is saved.
-----
ltspice_examples - FEGIN
Using 2 layers, 128 hidden units, h = 2
Loading component_net representation dataset
ENTERED
Training FEGIN on component_net representation
Train: 3558, Test: 846
##################ITERATION #0 ****************************************
 epoch: 0, train_loss: 1.3299, test_loss: 1.2616, test_f1: 0.2270
 epoch: 1, train_loss: 1.2372, test_loss: 1.1999, test_f1: 0.2783
 epoch: 2, train_loss: 1.1879, test_loss: 1.1252, test_f1: 0.3589
 epoch: 3, train_loss: 1.1297, test_loss: 1.0635, test_f1: 0.4044
 epoch: 4, train_loss: 1.0644, test_loss: 1.0130, test_f1: 0.4350
 epoch: 5, train_loss: 1.0245, test_loss: 0.9973, test_f1: 0.4714
 epoch: 6, train_loss: 0.9909, test_loss: 0.9676, test_f1: 0.4590
 epoch: 7, train_loss: 0.9725, test_loss: 0.9464, test_f1: 0.4975
 epoch: 8, train_loss: 0.9567, test_loss: 0.9273, test_f1: 0.4985
 epoch: 9, train_loss: 0.9494, test_loss: 0.9376, test_f1: 0.4897
 epoch: 10, train_loss: 0.9336, test_loss: 0.9213, test_f1: 0.5029
 epoch: 11, train_loss: 0.9292, test_loss: 0.9284, test_f1: 0.4820
 epoch: 12, train_loss: 0.9183, test_loss: 0.9101, test_f1: 0.5010
 epoch: 13, train_loss: 0.9049, test_loss: 0.9118, test_f1: 0.5261
 epoch: 14, train_loss: 0.9047, test_loss: 0.9300, test_f1: 0.5025
 epoch: 15, train_loss: 0.8939, test_loss: 0.9169, test_f1: 0.5165
 epoch: 16, train_loss: 0.8777, test_loss: 0.9075, test_f1: 0.5296
 epoch: 17, train_loss: 0.8766, test_loss: 0.8947, test_f1: 0.5219
 epoch: 18, train_loss: 0.8723, test_loss: 0.9263, test_f1: 0.5187
 epoch: 19, train_loss: 0.8674, test_loss: 0.9191, test_f1: 0.5086
 epoch: 20, train_loss: 0.8564, test_loss: 0.9036, test_f1: 0.5153
 epoch: 21, train_loss: 0.8572, test_loss: 0.8906, test_f1: 0.5227
 epoch: 22, train_loss: 0.8351, test_loss: 0.8793, test_f1: 0.5149
 epoch: 23, train_loss: 0.8388, test_loss: 0.9053, test_f1: 0.5331
 epoch: 24, train_loss: 0.8382, test_loss: 0.9158, test_f1: 0.5205
 epoch: 25, train_loss: 0.8383, test_loss: 0.8771, test_f1: 0.5365
 epoch: 26, train_loss: 0.8228, test_loss: 0.9296, test_f1: 0.5407
 epoch: 27, train_loss: 0.8231, test_loss: 0.9010, test_f1: 0.5355
 epoch: 28, train_loss: 0.8098, test_loss: 0.8478, test_f1: 0.5436
 epoch: 29, train_loss: 0.8114, test_loss: 0.9246, test_f1: 0.5271
 epoch: 30, train_loss: 0.7956, test_loss: 0.8879, test_f1: 0.5461
 epoch: 31, train_loss: 0.8040, test_loss: 0.8916, test_f1: 0.5462
 epoch: 32, train_loss: 0.8010, test_loss: 0.9141, test_f1: 0.5267
 epoch: 33, train_loss: 0.7976, test_loss: 0.8978, test_f1: 0.5319
 epoch: 34, train_loss: 0.8014, test_loss: 0.8830, test_f1: 0.5578
 epoch: 35, train_loss: 0.7758, test_loss: 0.8858, test_f1: 0.5426
 epoch: 36, train_loss: 0.7810, test_loss: 0.8975, test_f1: 0.5320
 epoch: 37, train_loss: 0.7725, test_loss: 0.9136, test_f1: 0.5685
 epoch: 38, train_loss: 0.7710, test_loss: 0.9068, test_f1: 0.5443
 epoch: 39, train_loss: 0.7674, test_loss: 0.8989, test_f1: 0.5422
 epoch: 40, train_loss: 0.7595, test_loss: 0.8822, test_f1: 0.5654
 epoch: 41, train_loss: 0.7606, test_loss: 0.8767, test_f1: 0.5591
 epoch: 42, train_loss: 0.7557, test_loss: 0.9188, test_f1: 0.5510
 epoch: 43, train_loss: 0.7568, test_loss: 0.8990, test_f1: 0.5396
 epoch: 44, train_loss: 0.7570, test_loss: 0.9229, test_f1: 0.5243
 epoch: 45, train_loss: 0.7452, test_loss: 0.9287, test_f1: 0.5520
 epoch: 46, train_loss: 0.7352, test_loss: 0.9093, test_f1: 0.5775
 epoch: 47, train_loss: 0.7407, test_loss: 0.9004, test_f1: 0.6002
 epoch: 48, train_loss: 0.7416, test_loss: 0.9088, test_f1: 0.5939
 epoch: 49, train_loss: 0.7268, test_loss: 0.9222, test_f1: 0.5512
 epoch: 50, train_loss: 0.7276, test_loss: 0.8961, test_f1: 0.5778
 epoch: 51, train_loss: 0.7187, test_loss: 0.9013, test_f1: 0.5988
 epoch: 52, train_loss: 0.7170, test_loss: 0.9187, test_f1: 0.5771
 epoch: 53, train_loss: 0.7196, test_loss: 0.9030, test_f1: 0.5955
 epoch: 54, train_loss: 0.6981, test_loss: 0.9008, test_f1: 0.6038
 epoch: 55, train_loss: 0.7088, test_loss: 0.9037, test_f1: 0.5928
 epoch: 56, train_loss: 0.6997, test_loss: 0.9157, test_f1: 0.5808
 epoch: 57, train_loss: 0.6983, test_loss: 0.9005, test_f1: 0.6154
 epoch: 58, train_loss: 0.7008, test_loss: 0.9481, test_f1: 0.5991
 epoch: 59, train_loss: 0.7034, test_loss: 0.9361, test_f1: 0.5949
 epoch: 60, train_loss: 0.7049, test_loss: 0.9189, test_f1: 0.5958
 epoch: 61, train_loss: 0.6907, test_loss: 0.9466, test_f1: 0.5805
 epoch: 62, train_loss: 0.6909, test_loss: 0.9226, test_f1: 0.6026
 epoch: 63, train_loss: 0.6948, test_loss: 0.9334, test_f1: 0.5822
 epoch: 64, train_loss: 0.6998, test_loss: 0.9105, test_f1: 0.6103
 epoch: 65, train_loss: 0.6940, test_loss: 0.9008, test_f1: 0.6138
 epoch: 66, train_loss: 0.6857, test_loss: 0.9154, test_f1: 0.6100
 epoch: 67, train_loss: 0.6822, test_loss: 0.9127, test_f1: 0.6242
 epoch: 68, train_loss: 0.6818, test_loss: 0.9384, test_f1: 0.5966
 epoch: 69, train_loss: 0.6933, test_loss: 0.9378, test_f1: 0.5988
 epoch: 70, train_loss: 0.6856, test_loss: 0.9335, test_f1: 0.6106
 epoch: 71, train_loss: 0.6834, test_loss: 0.9139, test_f1: 0.6285
 epoch: 72, train_loss: 0.6733, test_loss: 0.9141, test_f1: 0.6149
 epoch: 73, train_loss: 0.6764, test_loss: 0.9327, test_f1: 0.6304
 epoch: 74, train_loss: 0.6758, test_loss: 0.9172, test_f1: 0.6278
 epoch: 75, train_loss: 0.6725, test_loss: 0.9361, test_f1: 0.6269
 epoch: 76, train_loss: 0.6718, test_loss: 0.9102, test_f1: 0.6220
 epoch: 77, train_loss: 0.6733, test_loss: 0.9344, test_f1: 0.5958
 epoch: 78, train_loss: 0.6721, test_loss: 0.9431, test_f1: 0.6060
 epoch: 79, train_loss: 0.6705, test_loss: 0.9611, test_f1: 0.6081
 epoch: 80, train_loss: 0.6705, test_loss: 0.9453, test_f1: 0.6093
 epoch: 81, train_loss: 0.6568, test_loss: 0.9380, test_f1: 0.6117
 epoch: 82, train_loss: 0.6718, test_loss: 0.9489, test_f1: 0.6043
 epoch: 83, train_loss: 0.6565, test_loss: 0.9157, test_f1: 0.6240
 epoch: 84, train_loss: 0.6600, test_loss: 0.9140, test_f1: 0.6173
 epoch: 85, train_loss: 0.6613, test_loss: 0.9360, test_f1: 0.6004
 epoch: 86, train_loss: 0.6643, test_loss: 0.9432, test_f1: 0.6122
 epoch: 87, train_loss: 0.6592, test_loss: 0.9398, test_f1: 0.6243
 epoch: 88, train_loss: 0.6525, test_loss: 0.9565, test_f1: 0.6068
 epoch: 89, train_loss: 0.6385, test_loss: 0.9326, test_f1: 0.6253
 epoch: 90, train_loss: 0.6562, test_loss: 0.9505, test_f1: 0.6371
 epoch: 91, train_loss: 0.6446, test_loss: 0.9148, test_f1: 0.6495
 epoch: 92, train_loss: 0.6477, test_loss: 0.9477, test_f1: 0.6073
 epoch: 93, train_loss: 0.6444, test_loss: 0.9419, test_f1: 0.6302
 epoch: 94, train_loss: 0.6304, test_loss: 0.9664, test_f1: 0.6272
 epoch: 95, train_loss: 0.6426, test_loss: 0.9421, test_f1: 0.6246
 epoch: 96, train_loss: 0.6541, test_loss: 0.9598, test_f1: 0.6269
 epoch: 97, train_loss: 0.6363, test_loss: 0.9435, test_f1: 0.6298
 epoch: 98, train_loss: 0.6212, test_loss: 0.9463, test_f1: 0.6213
 epoch: 99, train_loss: 0.6377, test_loss: 0.9381, test_f1: 0.6235
##################ITERATION #1 ****************************************
 epoch: 0, train_loss: 1.2285, test_loss: 1.1124, test_f1: 0.3812
 epoch: 1, train_loss: 1.1112, test_loss: 1.0361, test_f1: 0.4496
 epoch: 2, train_loss: 1.0497, test_loss: 0.9856, test_f1: 0.4656
 epoch: 3, train_loss: 1.0075, test_loss: 0.9668, test_f1: 0.4959
 epoch: 4, train_loss: 0.9812, test_loss: 0.9468, test_f1: 0.4977
 epoch: 5, train_loss: 0.9583, test_loss: 0.9475, test_f1: 0.5161
 epoch: 6, train_loss: 0.9395, test_loss: 0.9359, test_f1: 0.5112
 epoch: 7, train_loss: 0.9208, test_loss: 0.9244, test_f1: 0.5192
 epoch: 8, train_loss: 0.9100, test_loss: 0.9141, test_f1: 0.5240
 epoch: 9, train_loss: 0.8984, test_loss: 0.9079, test_f1: 0.5246
 epoch: 10, train_loss: 0.8829, test_loss: 0.8965, test_f1: 0.5478
 epoch: 11, train_loss: 0.8810, test_loss: 0.8745, test_f1: 0.5540
 epoch: 12, train_loss: 0.8737, test_loss: 0.8755, test_f1: 0.5473
 epoch: 13, train_loss: 0.8552, test_loss: 0.8939, test_f1: 0.5584
 epoch: 14, train_loss: 0.8568, test_loss: 0.8689, test_f1: 0.5557
 epoch: 15, train_loss: 0.8472, test_loss: 0.9062, test_f1: 0.5468
 epoch: 16, train_loss: 0.8394, test_loss: 0.9149, test_f1: 0.5517
 epoch: 17, train_loss: 0.8337, test_loss: 0.8797, test_f1: 0.5538
 epoch: 18, train_loss: 0.8279, test_loss: 0.8951, test_f1: 0.5648
 epoch: 19, train_loss: 0.8108, test_loss: 0.8848, test_f1: 0.5684
 epoch: 20, train_loss: 0.8034, test_loss: 0.8835, test_f1: 0.5720
 epoch: 21, train_loss: 0.8112, test_loss: 0.8802, test_f1: 0.5994
 epoch: 22, train_loss: 0.8098, test_loss: 0.8995, test_f1: 0.5602
 epoch: 23, train_loss: 0.7934, test_loss: 0.8797, test_f1: 0.5706
 epoch: 24, train_loss: 0.7954, test_loss: 0.8746, test_f1: 0.5781
 epoch: 25, train_loss: 0.7890, test_loss: 0.8862, test_f1: 0.5795
 epoch: 26, train_loss: 0.7787, test_loss: 0.8806, test_f1: 0.5966
 epoch: 27, train_loss: 0.7855, test_loss: 0.8584, test_f1: 0.5927
 epoch: 28, train_loss: 0.7766, test_loss: 0.8591, test_f1: 0.6250
 epoch: 29, train_loss: 0.7746, test_loss: 0.8911, test_f1: 0.5917
 epoch: 30, train_loss: 0.7666, test_loss: 0.8888, test_f1: 0.6045
 epoch: 31, train_loss: 0.7576, test_loss: 0.8925, test_f1: 0.5962
 epoch: 32, train_loss: 0.7629, test_loss: 0.8861, test_f1: 0.6061
 epoch: 33, train_loss: 0.7566, test_loss: 0.8913, test_f1: 0.6076
 epoch: 34, train_loss: 0.7458, test_loss: 0.9230, test_f1: 0.6053
 epoch: 35, train_loss: 0.7456, test_loss: 0.9134, test_f1: 0.6078
 epoch: 36, train_loss: 0.7417, test_loss: 0.9014, test_f1: 0.6145
 epoch: 37, train_loss: 0.7307, test_loss: 0.8938, test_f1: 0.6043
 epoch: 38, train_loss: 0.7287, test_loss: 0.9182, test_f1: 0.6084
 epoch: 39, train_loss: 0.7243, test_loss: 0.9059, test_f1: 0.6110
 epoch: 40, train_loss: 0.7129, test_loss: 0.8842, test_f1: 0.6394
 epoch: 41, train_loss: 0.7148, test_loss: 0.9228, test_f1: 0.6224
 epoch: 42, train_loss: 0.7106, test_loss: 0.9055, test_f1: 0.6069
 epoch: 43, train_loss: 0.7140, test_loss: 0.9122, test_f1: 0.6230
 epoch: 44, train_loss: 0.7074, test_loss: 0.8919, test_f1: 0.6157
 epoch: 45, train_loss: 0.6976, test_loss: 0.9168, test_f1: 0.6565
 epoch: 46, train_loss: 0.6946, test_loss: 0.9032, test_f1: 0.6471
 epoch: 47, train_loss: 0.6942, test_loss: 0.9116, test_f1: 0.6357
 epoch: 48, train_loss: 0.7000, test_loss: 0.9234, test_f1: 0.6276
 epoch: 49, train_loss: 0.6993, test_loss: 0.9289, test_f1: 0.6330
 epoch: 50, train_loss: 0.6795, test_loss: 0.9065, test_f1: 0.6260
 epoch: 51, train_loss: 0.6825, test_loss: 0.9339, test_f1: 0.6385
 epoch: 52, train_loss: 0.6686, test_loss: 0.9087, test_f1: 0.6421
 epoch: 53, train_loss: 0.6594, test_loss: 0.8989, test_f1: 0.6265
 epoch: 54, train_loss: 0.6534, test_loss: 0.9387, test_f1: 0.6454
 epoch: 55, train_loss: 0.6585, test_loss: 0.9221, test_f1: 0.6426
 epoch: 56, train_loss: 0.6626, test_loss: 0.9343, test_f1: 0.6460
 epoch: 57, train_loss: 0.6606, test_loss: 0.9387, test_f1: 0.6330
 epoch: 58, train_loss: 0.6582, test_loss: 0.9122, test_f1: 0.6687
 epoch: 59, train_loss: 0.6502, test_loss: 0.9195, test_f1: 0.6389
 epoch: 60, train_loss: 0.6600, test_loss: 0.9083, test_f1: 0.6526
 epoch: 61, train_loss: 0.6563, test_loss: 0.9541, test_f1: 0.6259
 epoch: 62, train_loss: 0.6480, test_loss: 0.9367, test_f1: 0.6425
 epoch: 63, train_loss: 0.6390, test_loss: 0.9398, test_f1: 0.6471
 epoch: 64, train_loss: 0.6469, test_loss: 0.9230, test_f1: 0.6458
 epoch: 65, train_loss: 0.6332, test_loss: 0.9426, test_f1: 0.6456
 epoch: 66, train_loss: 0.6398, test_loss: 0.9316, test_f1: 0.6501
 epoch: 67, train_loss: 0.6476, test_loss: 0.9207, test_f1: 0.6557
 epoch: 68, train_loss: 0.6425, test_loss: 0.9398, test_f1: 0.6510
 epoch: 69, train_loss: 0.6221, test_loss: 0.9263, test_f1: 0.6677
 epoch: 70, train_loss: 0.6322, test_loss: 0.9471, test_f1: 0.6511
 epoch: 71, train_loss: 0.6216, test_loss: 0.9451, test_f1: 0.6485
 epoch: 72, train_loss: 0.6180, test_loss: 0.9497, test_f1: 0.6592
 epoch: 73, train_loss: 0.6218, test_loss: 0.9419, test_f1: 0.6705
 epoch: 74, train_loss: 0.6197, test_loss: 0.9292, test_f1: 0.6480
 epoch: 75, train_loss: 0.6141, test_loss: 0.9655, test_f1: 0.6402
 epoch: 76, train_loss: 0.6167, test_loss: 0.9668, test_f1: 0.6465
 epoch: 77, train_loss: 0.6207, test_loss: 0.9357, test_f1: 0.6778
 epoch: 78, train_loss: 0.6231, test_loss: 0.9560, test_f1: 0.6617
 epoch: 79, train_loss: 0.6132, test_loss: 0.9380, test_f1: 0.6514
 epoch: 80, train_loss: 0.6077, test_loss: 0.9660, test_f1: 0.6646
 epoch: 81, train_loss: 0.6131, test_loss: 0.9780, test_f1: 0.6649
 epoch: 82, train_loss: 0.6274, test_loss: 0.9866, test_f1: 0.6543
 epoch: 83, train_loss: 0.6130, test_loss: 0.9768, test_f1: 0.6640
 epoch: 84, train_loss: 0.6084, test_loss: 0.9622, test_f1: 0.6579
 epoch: 85, train_loss: 0.6072, test_loss: 0.9506, test_f1: 0.6573
 epoch: 86, train_loss: 0.5984, test_loss: 0.9955, test_f1: 0.6542
 epoch: 87, train_loss: 0.6094, test_loss: 0.9745, test_f1: 0.6559
 epoch: 88, train_loss: 0.6005, test_loss: 0.9696, test_f1: 0.6553
 epoch: 89, train_loss: 0.6033, test_loss: 0.9725, test_f1: 0.6540
 epoch: 90, train_loss: 0.6006, test_loss: 0.9721, test_f1: 0.6669
 epoch: 91, train_loss: 0.6012, test_loss: 0.9860, test_f1: 0.6533
 epoch: 92, train_loss: 0.6042, test_loss: 0.9681, test_f1: 0.6565
 epoch: 93, train_loss: 0.5910, test_loss: 0.9624, test_f1: 0.6651
 epoch: 94, train_loss: 0.5913, test_loss: 0.9950, test_f1: 0.6544
 epoch: 95, train_loss: 0.5955, test_loss: 0.9862, test_f1: 0.6611
 epoch: 96, train_loss: 0.5952, test_loss: 0.9712, test_f1: 0.6572
 epoch: 97, train_loss: 0.5910, test_loss: 0.9425, test_f1: 0.6595
 epoch: 98, train_loss: 0.5796, test_loss: 0.9412, test_f1: 0.6656
 epoch: 99, train_loss: 0.5805, test_loss: 0.9490, test_f1: 0.6597
##################ITERATION #2 ****************************************
 epoch: 0, train_loss: 1.2006, test_loss: 1.0482, test_f1: 0.4686
 epoch: 1, train_loss: 1.0732, test_loss: 0.9947, test_f1: 0.4825
 epoch: 2, train_loss: 1.0306, test_loss: 0.9757, test_f1: 0.4830
 epoch: 3, train_loss: 0.9900, test_loss: 0.9699, test_f1: 0.4844
 epoch: 4, train_loss: 0.9738, test_loss: 0.9307, test_f1: 0.5040
 epoch: 5, train_loss: 0.9577, test_loss: 0.9212, test_f1: 0.5152
 epoch: 6, train_loss: 0.9399, test_loss: 0.9173, test_f1: 0.5175
 epoch: 7, train_loss: 0.9328, test_loss: 0.9180, test_f1: 0.5165
 epoch: 8, train_loss: 0.9148, test_loss: 0.8957, test_f1: 0.5149
 epoch: 9, train_loss: 0.9066, test_loss: 0.8935, test_f1: 0.5447
 epoch: 10, train_loss: 0.8924, test_loss: 0.8786, test_f1: 0.5727
 epoch: 11, train_loss: 0.8906, test_loss: 0.8645, test_f1: 0.5556
 epoch: 12, train_loss: 0.8784, test_loss: 0.8734, test_f1: 0.5389
 epoch: 13, train_loss: 0.8675, test_loss: 0.8612, test_f1: 0.5537
 epoch: 14, train_loss: 0.8635, test_loss: 0.8534, test_f1: 0.5551
 epoch: 15, train_loss: 0.8563, test_loss: 0.8804, test_f1: 0.5737
 epoch: 16, train_loss: 0.8433, test_loss: 0.8928, test_f1: 0.5785
 epoch: 17, train_loss: 0.8343, test_loss: 0.8819, test_f1: 0.5569
 epoch: 18, train_loss: 0.8256, test_loss: 0.8822, test_f1: 0.5458
 epoch: 19, train_loss: 0.8228, test_loss: 0.8898, test_f1: 0.5598
 epoch: 20, train_loss: 0.8100, test_loss: 0.8701, test_f1: 0.5659
 epoch: 21, train_loss: 0.8011, test_loss: 0.8896, test_f1: 0.5755
 epoch: 22, train_loss: 0.8011, test_loss: 0.8954, test_f1: 0.5471
 epoch: 23, train_loss: 0.7976, test_loss: 0.8646, test_f1: 0.5467
 epoch: 24, train_loss: 0.7911, test_loss: 0.8859, test_f1: 0.5820
 epoch: 25, train_loss: 0.7874, test_loss: 0.9088, test_f1: 0.5845
 epoch: 26, train_loss: 0.7937, test_loss: 0.8756, test_f1: 0.6107
 epoch: 27, train_loss: 0.7767, test_loss: 0.8870, test_f1: 0.5883
 epoch: 28, train_loss: 0.7794, test_loss: 0.8583, test_f1: 0.5892
 epoch: 29, train_loss: 0.7693, test_loss: 0.8388, test_f1: 0.5935
 epoch: 30, train_loss: 0.7660, test_loss: 0.8930, test_f1: 0.5938
 epoch: 31, train_loss: 0.7599, test_loss: 0.9097, test_f1: 0.5842
 epoch: 32, train_loss: 0.7591, test_loss: 0.8997, test_f1: 0.6268
 epoch: 33, train_loss: 0.7392, test_loss: 0.8860, test_f1: 0.5830
 epoch: 34, train_loss: 0.7427, test_loss: 0.9041, test_f1: 0.5930
 epoch: 35, train_loss: 0.7447, test_loss: 0.9053, test_f1: 0.5966
 epoch: 36, train_loss: 0.7328, test_loss: 0.9046, test_f1: 0.6120
 epoch: 37, train_loss: 0.7290, test_loss: 0.8872, test_f1: 0.6065
 epoch: 38, train_loss: 0.7325, test_loss: 0.9048, test_f1: 0.6111
 epoch: 39, train_loss: 0.7333, test_loss: 0.9135, test_f1: 0.6103
 epoch: 40, train_loss: 0.7290, test_loss: 0.8842, test_f1: 0.6374
 epoch: 41, train_loss: 0.7232, test_loss: 0.9079, test_f1: 0.6072
 epoch: 42, train_loss: 0.7067, test_loss: 0.8909, test_f1: 0.6078
 epoch: 43, train_loss: 0.7059, test_loss: 0.8572, test_f1: 0.6335
 epoch: 44, train_loss: 0.7047, test_loss: 0.9119, test_f1: 0.6160
 epoch: 45, train_loss: 0.7042, test_loss: 0.9554, test_f1: 0.6045
 epoch: 46, train_loss: 0.7019, test_loss: 0.9085, test_f1: 0.6439
 epoch: 47, train_loss: 0.6868, test_loss: 0.8987, test_f1: 0.6473
 epoch: 48, train_loss: 0.6849, test_loss: 0.9355, test_f1: 0.6138
 epoch: 49, train_loss: 0.6861, test_loss: 0.9656, test_f1: 0.6272
 epoch: 50, train_loss: 0.6838, test_loss: 0.9561, test_f1: 0.6348
 epoch: 51, train_loss: 0.6710, test_loss: 0.9204, test_f1: 0.6497
 epoch: 52, train_loss: 0.6595, test_loss: 0.9448, test_f1: 0.6231
 epoch: 53, train_loss: 0.6639, test_loss: 0.9590, test_f1: 0.6472
 epoch: 54, train_loss: 0.6570, test_loss: 0.9384, test_f1: 0.6349
 epoch: 55, train_loss: 0.6509, test_loss: 0.9499, test_f1: 0.6335
 epoch: 56, train_loss: 0.6587, test_loss: 0.9471, test_f1: 0.6570
 epoch: 57, train_loss: 0.6568, test_loss: 0.9487, test_f1: 0.6313
 epoch: 58, train_loss: 0.6465, test_loss: 0.9381, test_f1: 0.6425
 epoch: 59, train_loss: 0.6525, test_loss: 0.9542, test_f1: 0.6487
 epoch: 60, train_loss: 0.6381, test_loss: 0.9851, test_f1: 0.6664
 epoch: 61, train_loss: 0.6460, test_loss: 0.9343, test_f1: 0.6472
 epoch: 62, train_loss: 0.6335, test_loss: 0.9902, test_f1: 0.6344
 epoch: 63, train_loss: 0.6453, test_loss: 0.9955, test_f1: 0.6521
 epoch: 64, train_loss: 0.6457, test_loss: 0.9469, test_f1: 0.6334
 epoch: 65, train_loss: 0.6381, test_loss: 0.9705, test_f1: 0.6377
 epoch: 66, train_loss: 0.6345, test_loss: 0.9778, test_f1: 0.6533
 epoch: 67, train_loss: 0.6374, test_loss: 0.9445, test_f1: 0.6417
 epoch: 68, train_loss: 0.6210, test_loss: 0.9603, test_f1: 0.6561
 epoch: 69, train_loss: 0.6406, test_loss: 0.9558, test_f1: 0.6322
 epoch: 70, train_loss: 0.6198, test_loss: 0.9320, test_f1: 0.6521
 epoch: 71, train_loss: 0.6202, test_loss: 0.9664, test_f1: 0.6595
 epoch: 72, train_loss: 0.6241, test_loss: 0.9444, test_f1: 0.6385
 epoch: 73, train_loss: 0.6169, test_loss: 0.9587, test_f1: 0.6672
 epoch: 74, train_loss: 0.6269, test_loss: 0.9628, test_f1: 0.6612
 epoch: 75, train_loss: 0.6302, test_loss: 0.9578, test_f1: 0.6521
 epoch: 76, train_loss: 0.6160, test_loss: 0.9513, test_f1: 0.6710
 epoch: 77, train_loss: 0.6256, test_loss: 0.9744, test_f1: 0.6687
 epoch: 78, train_loss: 0.6238, test_loss: 0.9610, test_f1: 0.6675
 epoch: 79, train_loss: 0.6216, test_loss: 0.9727, test_f1: 0.6651
 epoch: 80, train_loss: 0.6008, test_loss: 0.9791, test_f1: 0.6577
 epoch: 81, train_loss: 0.6056, test_loss: 0.9629, test_f1: 0.6424
 epoch: 82, train_loss: 0.6114, test_loss: 0.9861, test_f1: 0.6595
 epoch: 83, train_loss: 0.6213, test_loss: 0.9794, test_f1: 0.6496
 epoch: 84, train_loss: 0.5971, test_loss: 0.9520, test_f1: 0.6490
 epoch: 85, train_loss: 0.6060, test_loss: 0.9650, test_f1: 0.6608
 epoch: 86, train_loss: 0.5948, test_loss: 0.9818, test_f1: 0.6643
 epoch: 87, train_loss: 0.5987, test_loss: 0.9749, test_f1: 0.6574
 epoch: 88, train_loss: 0.5990, test_loss: 1.0009, test_f1: 0.6553
 epoch: 89, train_loss: 0.6009, test_loss: 0.9927, test_f1: 0.6720
 epoch: 90, train_loss: 0.5958, test_loss: 0.9822, test_f1: 0.6636
 epoch: 91, train_loss: 0.5961, test_loss: 1.0123, test_f1: 0.6552
 epoch: 92, train_loss: 0.5971, test_loss: 0.9926, test_f1: 0.6485
 epoch: 93, train_loss: 0.5991, test_loss: 0.9771, test_f1: 0.6502
 epoch: 94, train_loss: 0.5827, test_loss: 0.9929, test_f1: 0.6838
 epoch: 95, train_loss: 0.5832, test_loss: 1.0134, test_f1: 0.6616
 epoch: 96, train_loss: 0.5945, test_loss: 1.0374, test_f1: 0.6676
 epoch: 97, train_loss: 0.5979, test_loss: 1.0328, test_f1: 0.6544
 epoch: 98, train_loss: 0.5799, test_loss: 1.0324, test_f1: 0.6566
 epoch: 99, train_loss: 0.5787, test_loss: 0.9953, test_f1: 0.6612
##################ITERATION #3 ****************************************
 epoch: 0, train_loss: 1.1929, test_loss: 1.0304, test_f1: 0.4923
 epoch: 1, train_loss: 1.0678, test_loss: 0.9857, test_f1: 0.4916
 epoch: 2, train_loss: 1.0319, test_loss: 0.9713, test_f1: 0.4891
 epoch: 3, train_loss: 0.9929, test_loss: 0.9614, test_f1: 0.5305
 epoch: 4, train_loss: 0.9810, test_loss: 0.9454, test_f1: 0.5271
 epoch: 5, train_loss: 0.9566, test_loss: 0.9267, test_f1: 0.5145
 epoch: 6, train_loss: 0.9427, test_loss: 0.9294, test_f1: 0.5392
 epoch: 7, train_loss: 0.9254, test_loss: 0.9280, test_f1: 0.5481
 epoch: 8, train_loss: 0.9204, test_loss: 0.9213, test_f1: 0.5421
 epoch: 9, train_loss: 0.9108, test_loss: 0.9143, test_f1: 0.5156
 epoch: 10, train_loss: 0.8863, test_loss: 0.9156, test_f1: 0.5678
 epoch: 11, train_loss: 0.8888, test_loss: 0.9149, test_f1: 0.5469
 epoch: 12, train_loss: 0.8873, test_loss: 0.9081, test_f1: 0.5583
 epoch: 13, train_loss: 0.8631, test_loss: 0.8932, test_f1: 0.5508
 epoch: 14, train_loss: 0.8517, test_loss: 0.9038, test_f1: 0.5522
 epoch: 15, train_loss: 0.8544, test_loss: 0.9054, test_f1: 0.5674
 epoch: 16, train_loss: 0.8534, test_loss: 0.8764, test_f1: 0.5747
 epoch: 17, train_loss: 0.8362, test_loss: 0.8623, test_f1: 0.5678
 epoch: 18, train_loss: 0.8265, test_loss: 0.9115, test_f1: 0.5505
 epoch: 19, train_loss: 0.8324, test_loss: 0.8716, test_f1: 0.5878
 epoch: 20, train_loss: 0.8286, test_loss: 0.8868, test_f1: 0.5816
 epoch: 21, train_loss: 0.8126, test_loss: 0.8973, test_f1: 0.5973
 epoch: 22, train_loss: 0.8168, test_loss: 0.9154, test_f1: 0.5714
 epoch: 23, train_loss: 0.8042, test_loss: 0.9018, test_f1: 0.5661
 epoch: 24, train_loss: 0.7969, test_loss: 0.8779, test_f1: 0.6014
 epoch: 25, train_loss: 0.7942, test_loss: 0.8549, test_f1: 0.6116
 epoch: 26, train_loss: 0.7924, test_loss: 0.8952, test_f1: 0.5673
 epoch: 27, train_loss: 0.7875, test_loss: 0.8907, test_f1: 0.5698
 epoch: 28, train_loss: 0.7815, test_loss: 0.8826, test_f1: 0.5981
 epoch: 29, train_loss: 0.7826, test_loss: 0.8949, test_f1: 0.6044
 epoch: 30, train_loss: 0.7801, test_loss: 0.9052, test_f1: 0.5969
 epoch: 31, train_loss: 0.7666, test_loss: 0.8569, test_f1: 0.5675
 epoch: 32, train_loss: 0.7669, test_loss: 0.9074, test_f1: 0.6047
 epoch: 33, train_loss: 0.7568, test_loss: 0.9124, test_f1: 0.6121
 epoch: 34, train_loss: 0.7525, test_loss: 0.8968, test_f1: 0.5968
 epoch: 35, train_loss: 0.7581, test_loss: 0.8952, test_f1: 0.5877
 epoch: 36, train_loss: 0.7566, test_loss: 0.8903, test_f1: 0.6090
 epoch: 37, train_loss: 0.7514, test_loss: 0.8971, test_f1: 0.6014
 epoch: 38, train_loss: 0.7322, test_loss: 0.8962, test_f1: 0.6314
 epoch: 39, train_loss: 0.7307, test_loss: 0.8771, test_f1: 0.6109
 epoch: 40, train_loss: 0.7339, test_loss: 0.8859, test_f1: 0.6255
 epoch: 41, train_loss: 0.7386, test_loss: 0.8908, test_f1: 0.6191
 epoch: 42, train_loss: 0.7337, test_loss: 0.8989, test_f1: 0.6286
 epoch: 43, train_loss: 0.7365, test_loss: 0.9160, test_f1: 0.6294
 epoch: 44, train_loss: 0.7209, test_loss: 0.8890, test_f1: 0.6209
 epoch: 45, train_loss: 0.7181, test_loss: 0.9129, test_f1: 0.6303
 epoch: 46, train_loss: 0.7140, test_loss: 0.9035, test_f1: 0.6384
 epoch: 47, train_loss: 0.7241, test_loss: 0.8988, test_f1: 0.6428
 epoch: 48, train_loss: 0.7163, test_loss: 0.9017, test_f1: 0.6460
 epoch: 49, train_loss: 0.7125, test_loss: 0.9109, test_f1: 0.6568
 epoch: 50, train_loss: 0.7014, test_loss: 0.8806, test_f1: 0.6202
 epoch: 51, train_loss: 0.6896, test_loss: 0.8965, test_f1: 0.6613
 epoch: 52, train_loss: 0.6877, test_loss: 0.9234, test_f1: 0.6283
 epoch: 53, train_loss: 0.6859, test_loss: 0.9215, test_f1: 0.6360
 epoch: 54, train_loss: 0.6876, test_loss: 0.9280, test_f1: 0.6400
 epoch: 55, train_loss: 0.6803, test_loss: 0.9227, test_f1: 0.6368
 epoch: 56, train_loss: 0.6748, test_loss: 0.9309, test_f1: 0.6254
 epoch: 57, train_loss: 0.6743, test_loss: 0.9154, test_f1: 0.6423
 epoch: 58, train_loss: 0.6588, test_loss: 0.8989, test_f1: 0.6428
 epoch: 59, train_loss: 0.6866, test_loss: 0.9377, test_f1: 0.6414
 epoch: 60, train_loss: 0.6733, test_loss: 0.9124, test_f1: 0.6236
 epoch: 61, train_loss: 0.6681, test_loss: 0.9011, test_f1: 0.6413
 epoch: 62, train_loss: 0.6676, test_loss: 0.9000, test_f1: 0.6353
 epoch: 63, train_loss: 0.6661, test_loss: 0.9159, test_f1: 0.6355
 epoch: 64, train_loss: 0.6578, test_loss: 0.9002, test_f1: 0.6404
 epoch: 65, train_loss: 0.6683, test_loss: 0.9044, test_f1: 0.6575
 epoch: 66, train_loss: 0.6639, test_loss: 0.9254, test_f1: 0.6423
 epoch: 67, train_loss: 0.6635, test_loss: 0.9108, test_f1: 0.6531
 epoch: 68, train_loss: 0.6683, test_loss: 0.9239, test_f1: 0.6593
 epoch: 69, train_loss: 0.6480, test_loss: 0.9220, test_f1: 0.6609
 epoch: 70, train_loss: 0.6580, test_loss: 0.9180, test_f1: 0.6599
 epoch: 71, train_loss: 0.6533, test_loss: 0.9122, test_f1: 0.6512
 epoch: 72, train_loss: 0.6563, test_loss: 0.9383, test_f1: 0.6612
 epoch: 73, train_loss: 0.6513, test_loss: 0.9123, test_f1: 0.6750
 epoch: 74, train_loss: 0.6493, test_loss: 0.9283, test_f1: 0.6496
 epoch: 75, train_loss: 0.6441, test_loss: 0.9292, test_f1: 0.6663
 epoch: 76, train_loss: 0.6516, test_loss: 0.9333, test_f1: 0.6881
 epoch: 77, train_loss: 0.6385, test_loss: 0.9194, test_f1: 0.6538
 epoch: 78, train_loss: 0.6413, test_loss: 0.9136, test_f1: 0.6746
 epoch: 79, train_loss: 0.6492, test_loss: 0.9213, test_f1: 0.6619
 epoch: 80, train_loss: 0.6390, test_loss: 0.9158, test_f1: 0.6576
 epoch: 81, train_loss: 0.6398, test_loss: 0.9080, test_f1: 0.6539
 epoch: 82, train_loss: 0.6278, test_loss: 0.9081, test_f1: 0.6740
 epoch: 83, train_loss: 0.6343, test_loss: 0.9187, test_f1: 0.6520
 epoch: 84, train_loss: 0.6301, test_loss: 0.9404, test_f1: 0.6547
 epoch: 85, train_loss: 0.6324, test_loss: 0.9471, test_f1: 0.6535
 epoch: 86, train_loss: 0.6280, test_loss: 0.9533, test_f1: 0.6652
 epoch: 87, train_loss: 0.6239, test_loss: 0.9254, test_f1: 0.6861
 epoch: 88, train_loss: 0.6144, test_loss: 0.9471, test_f1: 0.6780
 epoch: 89, train_loss: 0.6237, test_loss: 0.9464, test_f1: 0.6537
 epoch: 90, train_loss: 0.6143, test_loss: 0.9429, test_f1: 0.6605
 epoch: 91, train_loss: 0.6225, test_loss: 0.9194, test_f1: 0.6645
 epoch: 92, train_loss: 0.6101, test_loss: 0.9548, test_f1: 0.6541
 epoch: 93, train_loss: 0.6189, test_loss: 0.9490, test_f1: 0.6402
 epoch: 94, train_loss: 0.6120, test_loss: 0.9312, test_f1: 0.6791
 epoch: 95, train_loss: 0.6043, test_loss: 0.9966, test_f1: 0.6764
 epoch: 96, train_loss: 0.6140, test_loss: 0.9576, test_f1: 0.6671
 epoch: 97, train_loss: 0.6138, test_loss: 0.9547, test_f1: 0.6580
 epoch: 98, train_loss: 0.6089, test_loss: 0.9399, test_f1: 0.6654
 epoch: 99, train_loss: 0.6028, test_loss: 0.9805, test_f1: 0.6561
##################ITERATION #4 ****************************************
 epoch: 0, train_loss: 1.2117, test_loss: 1.0345, test_f1: 0.4482
 epoch: 1, train_loss: 1.0643, test_loss: 0.9766, test_f1: 0.5004
 epoch: 2, train_loss: 1.0224, test_loss: 0.9476, test_f1: 0.4926
 epoch: 3, train_loss: 1.0019, test_loss: 0.9391, test_f1: 0.5057
 epoch: 4, train_loss: 0.9685, test_loss: 0.9318, test_f1: 0.5462
 epoch: 5, train_loss: 0.9526, test_loss: 0.9214, test_f1: 0.5380
 epoch: 6, train_loss: 0.9460, test_loss: 0.9111, test_f1: 0.5337
 epoch: 7, train_loss: 0.9338, test_loss: 0.9075, test_f1: 0.5581
 epoch: 8, train_loss: 0.9146, test_loss: 0.9090, test_f1: 0.5292
 epoch: 9, train_loss: 0.9084, test_loss: 0.8845, test_f1: 0.5343
 epoch: 10, train_loss: 0.8993, test_loss: 0.8755, test_f1: 0.5178
 epoch: 11, train_loss: 0.8853, test_loss: 0.8785, test_f1: 0.5294
 epoch: 12, train_loss: 0.8886, test_loss: 0.8688, test_f1: 0.5451
 epoch: 13, train_loss: 0.8716, test_loss: 0.8708, test_f1: 0.5364
 epoch: 14, train_loss: 0.8704, test_loss: 0.8730, test_f1: 0.5227
 epoch: 15, train_loss: 0.8682, test_loss: 0.8685, test_f1: 0.5328
 epoch: 16, train_loss: 0.8659, test_loss: 0.8496, test_f1: 0.5586
 epoch: 17, train_loss: 0.8403, test_loss: 0.8200, test_f1: 0.5492
 epoch: 18, train_loss: 0.8491, test_loss: 0.8326, test_f1: 0.5547
 epoch: 19, train_loss: 0.8359, test_loss: 0.8616, test_f1: 0.5595
 epoch: 20, train_loss: 0.8379, test_loss: 0.8450, test_f1: 0.5841
 epoch: 21, train_loss: 0.8270, test_loss: 0.8548, test_f1: 0.5806
 epoch: 22, train_loss: 0.8159, test_loss: 0.8600, test_f1: 0.5526
 epoch: 23, train_loss: 0.8150, test_loss: 0.8551, test_f1: 0.5697
 epoch: 24, train_loss: 0.8019, test_loss: 0.8367, test_f1: 0.6079
 epoch: 25, train_loss: 0.8067, test_loss: 0.8196, test_f1: 0.5805
 epoch: 26, train_loss: 0.8010, test_loss: 0.8114, test_f1: 0.5905
 epoch: 27, train_loss: 0.7936, test_loss: 0.8307, test_f1: 0.5930
 epoch: 28, train_loss: 0.7841, test_loss: 0.8287, test_f1: 0.5778
 epoch: 29, train_loss: 0.7856, test_loss: 0.8413, test_f1: 0.5874
 epoch: 30, train_loss: 0.7774, test_loss: 0.8469, test_f1: 0.6113
 epoch: 31, train_loss: 0.7840, test_loss: 0.8243, test_f1: 0.5779
 epoch: 32, train_loss: 0.7733, test_loss: 0.8391, test_f1: 0.6134
 epoch: 33, train_loss: 0.7621, test_loss: 0.8111, test_f1: 0.5951
 epoch: 34, train_loss: 0.7603, test_loss: 0.8645, test_f1: 0.6081
 epoch: 35, train_loss: 0.7535, test_loss: 0.8302, test_f1: 0.6222
 epoch: 36, train_loss: 0.7593, test_loss: 0.8278, test_f1: 0.6132
 epoch: 37, train_loss: 0.7500, test_loss: 0.8183, test_f1: 0.5724
 epoch: 38, train_loss: 0.7369, test_loss: 0.8353, test_f1: 0.6152
 epoch: 39, train_loss: 0.7384, test_loss: 0.8566, test_f1: 0.5764
 epoch: 40, train_loss: 0.7420, test_loss: 0.8406, test_f1: 0.6165
 epoch: 41, train_loss: 0.7315, test_loss: 0.8455, test_f1: 0.6500
 epoch: 42, train_loss: 0.7304, test_loss: 0.8468, test_f1: 0.6072
 epoch: 43, train_loss: 0.7219, test_loss: 0.8439, test_f1: 0.6089
 epoch: 44, train_loss: 0.7294, test_loss: 0.8109, test_f1: 0.6156
 epoch: 45, train_loss: 0.7208, test_loss: 0.8503, test_f1: 0.6216
 epoch: 46, train_loss: 0.7134, test_loss: 0.8148, test_f1: 0.5912
 epoch: 47, train_loss: 0.7163, test_loss: 0.8257, test_f1: 0.6216
 epoch: 48, train_loss: 0.7120, test_loss: 0.8213, test_f1: 0.6326
 epoch: 49, train_loss: 0.7089, test_loss: 0.7854, test_f1: 0.6221
 epoch: 50, train_loss: 0.6945, test_loss: 0.8120, test_f1: 0.6295
 epoch: 51, train_loss: 0.6872, test_loss: 0.8098, test_f1: 0.6218
 epoch: 52, train_loss: 0.6792, test_loss: 0.8430, test_f1: 0.6423
 epoch: 53, train_loss: 0.6732, test_loss: 0.7781, test_f1: 0.6237
 epoch: 54, train_loss: 0.6872, test_loss: 0.8244, test_f1: 0.6344
 epoch: 55, train_loss: 0.6762, test_loss: 0.8294, test_f1: 0.6537
 epoch: 56, train_loss: 0.6779, test_loss: 0.8438, test_f1: 0.6498
 epoch: 57, train_loss: 0.6730, test_loss: 0.8691, test_f1: 0.6326
 epoch: 58, train_loss: 0.6755, test_loss: 0.8116, test_f1: 0.6609
 epoch: 59, train_loss: 0.6520, test_loss: 0.8527, test_f1: 0.6490
 epoch: 60, train_loss: 0.6576, test_loss: 0.8243, test_f1: 0.6428
 epoch: 61, train_loss: 0.6726, test_loss: 0.8299, test_f1: 0.6530
 epoch: 62, train_loss: 0.6590, test_loss: 0.8190, test_f1: 0.6375
 epoch: 63, train_loss: 0.6528, test_loss: 0.8388, test_f1: 0.6386
 epoch: 64, train_loss: 0.6528, test_loss: 0.8227, test_f1: 0.6534
 epoch: 65, train_loss: 0.6510, test_loss: 0.8258, test_f1: 0.6530
 epoch: 66, train_loss: 0.6493, test_loss: 0.8480, test_f1: 0.6381
 epoch: 67, train_loss: 0.6491, test_loss: 0.8562, test_f1: 0.6408
 epoch: 68, train_loss: 0.6352, test_loss: 0.8289, test_f1: 0.6439
 epoch: 69, train_loss: 0.6383, test_loss: 0.8367, test_f1: 0.6456
 epoch: 70, train_loss: 0.6405, test_loss: 0.8406, test_f1: 0.6227
 epoch: 71, train_loss: 0.6492, test_loss: 0.8595, test_f1: 0.6382
 epoch: 72, train_loss: 0.6288, test_loss: 0.8014, test_f1: 0.6608
 epoch: 73, train_loss: 0.6302, test_loss: 0.8613, test_f1: 0.6494
 epoch: 74, train_loss: 0.6277, test_loss: 0.8543, test_f1: 0.6466
 epoch: 75, train_loss: 0.6176, test_loss: 0.8814, test_f1: 0.6551
 epoch: 76, train_loss: 0.6329, test_loss: 0.8528, test_f1: 0.6521
 epoch: 77, train_loss: 0.6196, test_loss: 0.8312, test_f1: 0.6447
 epoch: 78, train_loss: 0.6224, test_loss: 0.8235, test_f1: 0.6444
 epoch: 79, train_loss: 0.6151, test_loss: 0.8249, test_f1: 0.6665
 epoch: 80, train_loss: 0.6019, test_loss: 0.8177, test_f1: 0.6395
 epoch: 81, train_loss: 0.6188, test_loss: 0.8124, test_f1: 0.6674
 epoch: 82, train_loss: 0.6113, test_loss: 0.7942, test_f1: 0.6669
 epoch: 83, train_loss: 0.6107, test_loss: 0.8211, test_f1: 0.6523
 epoch: 84, train_loss: 0.6173, test_loss: 0.8929, test_f1: 0.6528
 epoch: 85, train_loss: 0.6038, test_loss: 0.8349, test_f1: 0.6388
 epoch: 86, train_loss: 0.6017, test_loss: 0.8326, test_f1: 0.6551
 epoch: 87, train_loss: 0.6025, test_loss: 0.8354, test_f1: 0.6457
 epoch: 88, train_loss: 0.5922, test_loss: 0.8404, test_f1: 0.6384
 epoch: 89, train_loss: 0.5997, test_loss: 0.8404, test_f1: 0.6539
 epoch: 90, train_loss: 0.5990, test_loss: 0.8066, test_f1: 0.6531
 epoch: 91, train_loss: 0.5904, test_loss: 0.8448, test_f1: 0.6578
 epoch: 92, train_loss: 0.6059, test_loss: 0.8667, test_f1: 0.6587
 epoch: 93, train_loss: 0.5963, test_loss: 0.8458, test_f1: 0.6532
 epoch: 94, train_loss: 0.5983, test_loss: 0.8177, test_f1: 0.6751
 epoch: 95, train_loss: 0.5835, test_loss: 0.8189, test_f1: 0.6475
 epoch: 96, train_loss: 0.5922, test_loss: 0.8570, test_f1: 0.6547
 epoch: 97, train_loss: 0.5893, test_loss: 0.9146, test_f1: 0.6608
 epoch: 98, train_loss: 0.5950, test_loss: 0.8753, test_f1: 0.6480
 epoch: 99, train_loss: 0.5843, test_loss: 0.9258, test_f1: 0.6464
##################ITERATION #5 ****************************************
 epoch: 0, train_loss: 1.2154, test_loss: 1.0081, test_f1: 0.4980
 epoch: 1, train_loss: 1.0671, test_loss: 0.9765, test_f1: 0.4868
 epoch: 2, train_loss: 1.0336, test_loss: 0.9640, test_f1: 0.5177
 epoch: 3, train_loss: 1.0042, test_loss: 0.9547, test_f1: 0.4777
 epoch: 4, train_loss: 0.9786, test_loss: 0.9409, test_f1: 0.4957
 epoch: 5, train_loss: 0.9676, test_loss: 0.9266, test_f1: 0.5134
 epoch: 6, train_loss: 0.9510, test_loss: 0.9177, test_f1: 0.5262
 epoch: 7, train_loss: 0.9473, test_loss: 0.9103, test_f1: 0.5326
 epoch: 8, train_loss: 0.9351, test_loss: 0.9252, test_f1: 0.5241
 epoch: 9, train_loss: 0.9258, test_loss: 0.8936, test_f1: 0.5323
 epoch: 10, train_loss: 0.9094, test_loss: 0.9067, test_f1: 0.5317
 epoch: 11, train_loss: 0.9014, test_loss: 0.9080, test_f1: 0.5301
 epoch: 12, train_loss: 0.8970, test_loss: 0.9159, test_f1: 0.5431
 epoch: 13, train_loss: 0.8958, test_loss: 0.8938, test_f1: 0.5433
 epoch: 14, train_loss: 0.8819, test_loss: 0.9002, test_f1: 0.5563
 epoch: 15, train_loss: 0.8794, test_loss: 0.8825, test_f1: 0.5649
 epoch: 16, train_loss: 0.8664, test_loss: 0.8888, test_f1: 0.5441
 epoch: 17, train_loss: 0.8549, test_loss: 0.8874, test_f1: 0.5358
 epoch: 18, train_loss: 0.8467, test_loss: 0.9198, test_f1: 0.5354
 epoch: 19, train_loss: 0.8432, test_loss: 0.8747, test_f1: 0.5474
 epoch: 20, train_loss: 0.8500, test_loss: 0.8776, test_f1: 0.5518
 epoch: 21, train_loss: 0.8331, test_loss: 0.8713, test_f1: 0.5655
 epoch: 22, train_loss: 0.8374, test_loss: 0.8790, test_f1: 0.5832
 epoch: 23, train_loss: 0.8275, test_loss: 0.8707, test_f1: 0.5890
 epoch: 24, train_loss: 0.8349, test_loss: 0.8837, test_f1: 0.5943
 epoch: 25, train_loss: 0.8175, test_loss: 0.8657, test_f1: 0.5867
 epoch: 26, train_loss: 0.8040, test_loss: 0.8866, test_f1: 0.5740
 epoch: 27, train_loss: 0.8047, test_loss: 0.9165, test_f1: 0.5451
 epoch: 28, train_loss: 0.7946, test_loss: 0.8839, test_f1: 0.5963
 epoch: 29, train_loss: 0.8018, test_loss: 0.8544, test_f1: 0.5942
 epoch: 30, train_loss: 0.7961, test_loss: 0.9187, test_f1: 0.5547
 epoch: 31, train_loss: 0.7913, test_loss: 0.8629, test_f1: 0.6166
 epoch: 32, train_loss: 0.7932, test_loss: 0.8730, test_f1: 0.6070
 epoch: 33, train_loss: 0.7781, test_loss: 0.8548, test_f1: 0.5709
 epoch: 34, train_loss: 0.7783, test_loss: 0.9153, test_f1: 0.5804
 epoch: 35, train_loss: 0.7776, test_loss: 0.8781, test_f1: 0.6018
 epoch: 36, train_loss: 0.7775, test_loss: 0.9114, test_f1: 0.5889
 epoch: 37, train_loss: 0.7601, test_loss: 0.8858, test_f1: 0.6142
 epoch: 38, train_loss: 0.7713, test_loss: 0.9045, test_f1: 0.5835
 epoch: 39, train_loss: 0.7552, test_loss: 0.8663, test_f1: 0.5895
 epoch: 40, train_loss: 0.7588, test_loss: 0.8559, test_f1: 0.6218
 epoch: 41, train_loss: 0.7443, test_loss: 0.8752, test_f1: 0.6206
 epoch: 42, train_loss: 0.7459, test_loss: 0.9246, test_f1: 0.6103
 epoch: 43, train_loss: 0.7478, test_loss: 0.8965, test_f1: 0.6424
 epoch: 44, train_loss: 0.7390, test_loss: 0.9095, test_f1: 0.6093
 epoch: 45, train_loss: 0.7473, test_loss: 0.9422, test_f1: 0.6091
 epoch: 46, train_loss: 0.7280, test_loss: 0.9105, test_f1: 0.6101
 epoch: 47, train_loss: 0.7275, test_loss: 0.9244, test_f1: 0.6036
 epoch: 48, train_loss: 0.7176, test_loss: 0.9280, test_f1: 0.6017
 epoch: 49, train_loss: 0.7321, test_loss: 0.9355, test_f1: 0.6399
 epoch: 50, train_loss: 0.7144, test_loss: 0.9428, test_f1: 0.6198
 epoch: 51, train_loss: 0.7058, test_loss: 0.9190, test_f1: 0.6261
 epoch: 52, train_loss: 0.7134, test_loss: 0.9178, test_f1: 0.6472
 epoch: 53, train_loss: 0.6964, test_loss: 0.9254, test_f1: 0.6357
 epoch: 54, train_loss: 0.6969, test_loss: 0.9266, test_f1: 0.6324
 epoch: 55, train_loss: 0.6939, test_loss: 0.9386, test_f1: 0.6343
 epoch: 56, train_loss: 0.6986, test_loss: 0.9140, test_f1: 0.6385
 epoch: 57, train_loss: 0.6969, test_loss: 0.9375, test_f1: 0.6207
 epoch: 58, train_loss: 0.6973, test_loss: 0.9531, test_f1: 0.6183
 epoch: 59, train_loss: 0.6749, test_loss: 0.9262, test_f1: 0.6624
 epoch: 60, train_loss: 0.6734, test_loss: 0.9766, test_f1: 0.6123
 epoch: 61, train_loss: 0.6853, test_loss: 0.9523, test_f1: 0.6379
 epoch: 62, train_loss: 0.6790, test_loss: 0.9387, test_f1: 0.6281
 epoch: 63, train_loss: 0.6768, test_loss: 0.9603, test_f1: 0.6461
 epoch: 64, train_loss: 0.6757, test_loss: 0.9335, test_f1: 0.6522
 epoch: 65, train_loss: 0.6706, test_loss: 0.9313, test_f1: 0.6452
 epoch: 66, train_loss: 0.6633, test_loss: 0.9116, test_f1: 0.6535
 epoch: 67, train_loss: 0.6755, test_loss: 0.9159, test_f1: 0.6245
 epoch: 68, train_loss: 0.6617, test_loss: 0.9268, test_f1: 0.6609
 epoch: 69, train_loss: 0.6693, test_loss: 0.9482, test_f1: 0.6126
 epoch: 70, train_loss: 0.6611, test_loss: 0.9374, test_f1: 0.6310
 epoch: 71, train_loss: 0.6683, test_loss: 0.9626, test_f1: 0.6436
 epoch: 72, train_loss: 0.6653, test_loss: 0.9418, test_f1: 0.6556
 epoch: 73, train_loss: 0.6675, test_loss: 0.9206, test_f1: 0.6245
 epoch: 74, train_loss: 0.6633, test_loss: 0.9384, test_f1: 0.6577
 epoch: 75, train_loss: 0.6582, test_loss: 0.9400, test_f1: 0.6580
 epoch: 76, train_loss: 0.6479, test_loss: 0.9377, test_f1: 0.6496
 epoch: 77, train_loss: 0.6523, test_loss: 0.9625, test_f1: 0.6083
 epoch: 78, train_loss: 0.6570, test_loss: 0.9352, test_f1: 0.6685
 epoch: 79, train_loss: 0.6516, test_loss: 0.9534, test_f1: 0.6432
 epoch: 80, train_loss: 0.6465, test_loss: 0.9557, test_f1: 0.6429
 epoch: 81, train_loss: 0.6453, test_loss: 0.9316, test_f1: 0.6463
 epoch: 82, train_loss: 0.6567, test_loss: 0.9359, test_f1: 0.6472
 epoch: 83, train_loss: 0.6368, test_loss: 0.9426, test_f1: 0.6645
 epoch: 84, train_loss: 0.6333, test_loss: 0.9655, test_f1: 0.6354
 epoch: 85, train_loss: 0.6519, test_loss: 0.9443, test_f1: 0.6214
 epoch: 86, train_loss: 0.6479, test_loss: 0.9690, test_f1: 0.6329
 epoch: 87, train_loss: 0.6415, test_loss: 0.9874, test_f1: 0.6349
 epoch: 88, train_loss: 0.6349, test_loss: 0.9821, test_f1: 0.6462
 epoch: 89, train_loss: 0.6300, test_loss: 0.9942, test_f1: 0.6669
 epoch: 90, train_loss: 0.6335, test_loss: 1.0134, test_f1: 0.6584
 epoch: 91, train_loss: 0.6326, test_loss: 0.9656, test_f1: 0.6334
 epoch: 92, train_loss: 0.6302, test_loss: 0.9858, test_f1: 0.6164
 epoch: 93, train_loss: 0.6215, test_loss: 0.9765, test_f1: 0.6262
 epoch: 94, train_loss: 0.6256, test_loss: 0.9762, test_f1: 0.6428
 epoch: 95, train_loss: 0.6119, test_loss: 0.9761, test_f1: 0.6657
 epoch: 96, train_loss: 0.6062, test_loss: 1.0170, test_f1: 0.6193
 epoch: 97, train_loss: 0.6104, test_loss: 1.0029, test_f1: 0.6450
 epoch: 98, train_loss: 0.6358, test_loss: 1.0150, test_f1: 0.6579
 epoch: 99, train_loss: 0.6209, test_loss: 1.0016, test_f1: 0.6462
##################ITERATION #6 ****************************************
 epoch: 0, train_loss: 1.2366, test_loss: 1.0094, test_f1: 0.4404
 epoch: 1, train_loss: 1.0647, test_loss: 0.9643, test_f1: 0.5099
 epoch: 2, train_loss: 1.0307, test_loss: 0.9551, test_f1: 0.4998
 epoch: 3, train_loss: 1.0065, test_loss: 0.9615, test_f1: 0.4933
 epoch: 4, train_loss: 0.9764, test_loss: 0.9211, test_f1: 0.5111
 epoch: 5, train_loss: 0.9691, test_loss: 0.9284, test_f1: 0.5088
 epoch: 6, train_loss: 0.9523, test_loss: 0.9152, test_f1: 0.5418
 epoch: 7, train_loss: 0.9342, test_loss: 0.9231, test_f1: 0.5123
 epoch: 8, train_loss: 0.9263, test_loss: 0.9030, test_f1: 0.5211
 epoch: 9, train_loss: 0.9174, test_loss: 0.9063, test_f1: 0.5357
 epoch: 10, train_loss: 0.9089, test_loss: 0.9024, test_f1: 0.5168
 epoch: 11, train_loss: 0.8941, test_loss: 0.9052, test_f1: 0.5394
 epoch: 12, train_loss: 0.8911, test_loss: 0.8804, test_f1: 0.5394
 epoch: 13, train_loss: 0.8849, test_loss: 0.9104, test_f1: 0.5309
 epoch: 14, train_loss: 0.8842, test_loss: 0.9159, test_f1: 0.5259
 epoch: 15, train_loss: 0.8779, test_loss: 0.8928, test_f1: 0.5475
 epoch: 16, train_loss: 0.8666, test_loss: 0.8862, test_f1: 0.5534
 epoch: 17, train_loss: 0.8693, test_loss: 0.9016, test_f1: 0.5329
 epoch: 18, train_loss: 0.8536, test_loss: 0.8826, test_f1: 0.5365
 epoch: 19, train_loss: 0.8533, test_loss: 0.8741, test_f1: 0.5386
 epoch: 20, train_loss: 0.8466, test_loss: 0.8801, test_f1: 0.5363
 epoch: 21, train_loss: 0.8303, test_loss: 0.8862, test_f1: 0.5568
 epoch: 22, train_loss: 0.8285, test_loss: 0.8806, test_f1: 0.5598
 epoch: 23, train_loss: 0.8241, test_loss: 0.8765, test_f1: 0.5552
 epoch: 24, train_loss: 0.8405, test_loss: 0.8860, test_f1: 0.5577
 epoch: 25, train_loss: 0.8236, test_loss: 0.9048, test_f1: 0.5539
 epoch: 26, train_loss: 0.8190, test_loss: 0.8681, test_f1: 0.5561
 epoch: 27, train_loss: 0.8093, test_loss: 0.8634, test_f1: 0.5663
 epoch: 28, train_loss: 0.8037, test_loss: 0.8957, test_f1: 0.5565
 epoch: 29, train_loss: 0.8020, test_loss: 0.9053, test_f1: 0.5545
 epoch: 30, train_loss: 0.8076, test_loss: 0.8867, test_f1: 0.5563
 epoch: 31, train_loss: 0.7933, test_loss: 0.8700, test_f1: 0.5787
 epoch: 32, train_loss: 0.7849, test_loss: 0.8915, test_f1: 0.5792
 epoch: 33, train_loss: 0.7790, test_loss: 0.9077, test_f1: 0.5752
 epoch: 34, train_loss: 0.7769, test_loss: 0.8837, test_f1: 0.5833
 epoch: 35, train_loss: 0.7719, test_loss: 0.9039, test_f1: 0.5785
 epoch: 36, train_loss: 0.7771, test_loss: 0.9111, test_f1: 0.5861
 epoch: 37, train_loss: 0.7724, test_loss: 0.8933, test_f1: 0.5709
 epoch: 38, train_loss: 0.7505, test_loss: 0.8745, test_f1: 0.5816
 epoch: 39, train_loss: 0.7650, test_loss: 0.8698, test_f1: 0.5997
 epoch: 40, train_loss: 0.7507, test_loss: 0.8953, test_f1: 0.5777
 epoch: 41, train_loss: 0.7529, test_loss: 0.8913, test_f1: 0.5934
 epoch: 42, train_loss: 0.7584, test_loss: 0.8941, test_f1: 0.5877
 epoch: 43, train_loss: 0.7429, test_loss: 0.8936, test_f1: 0.5870
 epoch: 44, train_loss: 0.7423, test_loss: 0.8943, test_f1: 0.5854
 epoch: 45, train_loss: 0.7319, test_loss: 0.9121, test_f1: 0.5811
 epoch: 46, train_loss: 0.7340, test_loss: 0.9322, test_f1: 0.5944
 epoch: 47, train_loss: 0.7314, test_loss: 0.9110, test_f1: 0.5978
 epoch: 48, train_loss: 0.7299, test_loss: 0.9343, test_f1: 0.5843
 epoch: 49, train_loss: 0.7299, test_loss: 0.9045, test_f1: 0.6182
 epoch: 50, train_loss: 0.7178, test_loss: 0.8918, test_f1: 0.5869
 epoch: 51, train_loss: 0.7105, test_loss: 0.9050, test_f1: 0.5915
 epoch: 52, train_loss: 0.6998, test_loss: 0.9000, test_f1: 0.6171
 epoch: 53, train_loss: 0.7054, test_loss: 0.9055, test_f1: 0.6176
 epoch: 54, train_loss: 0.6992, test_loss: 0.8998, test_f1: 0.6038
 epoch: 55, train_loss: 0.7051, test_loss: 0.9256, test_f1: 0.5978
 epoch: 56, train_loss: 0.6895, test_loss: 0.8931, test_f1: 0.6145
 epoch: 57, train_loss: 0.6918, test_loss: 0.9127, test_f1: 0.6129
 epoch: 58, train_loss: 0.6876, test_loss: 0.8991, test_f1: 0.6224
 epoch: 59, train_loss: 0.6893, test_loss: 0.9383, test_f1: 0.6167
 epoch: 60, train_loss: 0.6868, test_loss: 0.9191, test_f1: 0.6260
 epoch: 61, train_loss: 0.6919, test_loss: 0.9259, test_f1: 0.6113
 epoch: 62, train_loss: 0.6825, test_loss: 0.9005, test_f1: 0.6166
 epoch: 63, train_loss: 0.6756, test_loss: 0.9135, test_f1: 0.6131
 epoch: 64, train_loss: 0.6841, test_loss: 0.9117, test_f1: 0.6218
 epoch: 65, train_loss: 0.6765, test_loss: 0.9097, test_f1: 0.6407
 epoch: 66, train_loss: 0.6710, test_loss: 0.9067, test_f1: 0.6432
 epoch: 67, train_loss: 0.6794, test_loss: 0.9046, test_f1: 0.6226
 epoch: 68, train_loss: 0.6730, test_loss: 0.9331, test_f1: 0.6096
 epoch: 69, train_loss: 0.6660, test_loss: 0.9083, test_f1: 0.6404
 epoch: 70, train_loss: 0.6625, test_loss: 0.9146, test_f1: 0.6404
 epoch: 71, train_loss: 0.6796, test_loss: 0.9396, test_f1: 0.6052
 epoch: 72, train_loss: 0.6610, test_loss: 0.9208, test_f1: 0.6507
 epoch: 73, train_loss: 0.6670, test_loss: 0.9272, test_f1: 0.6177
 epoch: 74, train_loss: 0.6585, test_loss: 0.9340, test_f1: 0.6430
 epoch: 75, train_loss: 0.6685, test_loss: 0.9264, test_f1: 0.6368
 epoch: 76, train_loss: 0.6477, test_loss: 0.9079, test_f1: 0.6492
 epoch: 77, train_loss: 0.6574, test_loss: 0.9135, test_f1: 0.6271
 epoch: 78, train_loss: 0.6524, test_loss: 0.9134, test_f1: 0.6453
 epoch: 79, train_loss: 0.6439, test_loss: 0.9310, test_f1: 0.5995
 epoch: 80, train_loss: 0.6522, test_loss: 0.9243, test_f1: 0.6012
 epoch: 81, train_loss: 0.6471, test_loss: 0.9373, test_f1: 0.6454
 epoch: 82, train_loss: 0.6571, test_loss: 0.9183, test_f1: 0.6324
 epoch: 83, train_loss: 0.6444, test_loss: 0.9396, test_f1: 0.6171
 epoch: 84, train_loss: 0.6372, test_loss: 0.9341, test_f1: 0.6330
 epoch: 85, train_loss: 0.6388, test_loss: 0.9379, test_f1: 0.6399
 epoch: 86, train_loss: 0.6396, test_loss: 0.9435, test_f1: 0.6359
 epoch: 87, train_loss: 0.6381, test_loss: 0.9266, test_f1: 0.6235
 epoch: 88, train_loss: 0.6505, test_loss: 0.9528, test_f1: 0.6140
 epoch: 89, train_loss: 0.6348, test_loss: 0.9394, test_f1: 0.6323
 epoch: 90, train_loss: 0.6265, test_loss: 0.9137, test_f1: 0.6267
 epoch: 91, train_loss: 0.6319, test_loss: 0.9661, test_f1: 0.6089
 epoch: 92, train_loss: 0.6277, test_loss: 0.9342, test_f1: 0.6604
 epoch: 93, train_loss: 0.6388, test_loss: 0.9436, test_f1: 0.6182
 epoch: 94, train_loss: 0.6397, test_loss: 0.9103, test_f1: 0.6751
 epoch: 95, train_loss: 0.6244, test_loss: 0.9458, test_f1: 0.6370
 epoch: 96, train_loss: 0.6195, test_loss: 0.9403, test_f1: 0.6529
 epoch: 97, train_loss: 0.6109, test_loss: 0.9428, test_f1: 0.6570
 epoch: 98, train_loss: 0.6111, test_loss: 0.9339, test_f1: 0.6554
 epoch: 99, train_loss: 0.6155, test_loss: 0.9594, test_f1: 0.6345
##################ITERATION #7 ****************************************
 epoch: 0, train_loss: 1.2571, test_loss: 0.9988, test_f1: 0.4702
 epoch: 1, train_loss: 1.0931, test_loss: 0.9576, test_f1: 0.4566
 epoch: 2, train_loss: 1.0290, test_loss: 0.9388, test_f1: 0.4617
 epoch: 3, train_loss: 1.0028, test_loss: 0.9232, test_f1: 0.4734
 epoch: 4, train_loss: 0.9799, test_loss: 0.9033, test_f1: 0.4861
 epoch: 5, train_loss: 0.9584, test_loss: 0.9135, test_f1: 0.4763
 epoch: 6, train_loss: 0.9498, test_loss: 0.8999, test_f1: 0.4873
 epoch: 7, train_loss: 0.9211, test_loss: 0.9192, test_f1: 0.5258
 epoch: 8, train_loss: 0.9170, test_loss: 0.9014, test_f1: 0.4925
 epoch: 9, train_loss: 0.9121, test_loss: 0.8720, test_f1: 0.5349
 epoch: 10, train_loss: 0.8967, test_loss: 0.8773, test_f1: 0.5273
 epoch: 11, train_loss: 0.8789, test_loss: 0.8838, test_f1: 0.5361
 epoch: 12, train_loss: 0.8710, test_loss: 0.8901, test_f1: 0.5521
 epoch: 13, train_loss: 0.8677, test_loss: 0.8873, test_f1: 0.5258
 epoch: 14, train_loss: 0.8648, test_loss: 0.8756, test_f1: 0.5543
 epoch: 15, train_loss: 0.8464, test_loss: 0.8619, test_f1: 0.5337
 epoch: 16, train_loss: 0.8351, test_loss: 0.8537, test_f1: 0.5602
 epoch: 17, train_loss: 0.8355, test_loss: 0.9010, test_f1: 0.5413
 epoch: 18, train_loss: 0.8257, test_loss: 0.8780, test_f1: 0.5583
 epoch: 19, train_loss: 0.8225, test_loss: 0.8843, test_f1: 0.5745
 epoch: 20, train_loss: 0.8190, test_loss: 0.8686, test_f1: 0.5609
 epoch: 21, train_loss: 0.8020, test_loss: 0.8459, test_f1: 0.5595
 epoch: 22, train_loss: 0.8054, test_loss: 0.8787, test_f1: 0.5829
 epoch: 23, train_loss: 0.7925, test_loss: 0.8571, test_f1: 0.5900
 epoch: 24, train_loss: 0.7901, test_loss: 0.8619, test_f1: 0.5811
 epoch: 25, train_loss: 0.7906, test_loss: 0.8609, test_f1: 0.5659
 epoch: 26, train_loss: 0.7757, test_loss: 0.8629, test_f1: 0.5648
 epoch: 27, train_loss: 0.7767, test_loss: 0.8679, test_f1: 0.5650
 epoch: 28, train_loss: 0.7591, test_loss: 0.8435, test_f1: 0.5802
 epoch: 29, train_loss: 0.7625, test_loss: 0.8433, test_f1: 0.5722
 epoch: 30, train_loss: 0.7678, test_loss: 0.8583, test_f1: 0.5881
 epoch: 31, train_loss: 0.7555, test_loss: 0.8583, test_f1: 0.5885
 epoch: 32, train_loss: 0.7554, test_loss: 0.8767, test_f1: 0.5938
 epoch: 33, train_loss: 0.7433, test_loss: 0.8466, test_f1: 0.5817
 epoch: 34, train_loss: 0.7407, test_loss: 0.8462, test_f1: 0.5925
 epoch: 35, train_loss: 0.7371, test_loss: 0.8671, test_f1: 0.5902
 epoch: 36, train_loss: 0.7453, test_loss: 0.8841, test_f1: 0.5760
 epoch: 37, train_loss: 0.7232, test_loss: 0.8782, test_f1: 0.6086
 epoch: 38, train_loss: 0.7319, test_loss: 0.8461, test_f1: 0.6230
 epoch: 39, train_loss: 0.7258, test_loss: 0.8701, test_f1: 0.6023
 epoch: 40, train_loss: 0.7105, test_loss: 0.8422, test_f1: 0.6003
 epoch: 41, train_loss: 0.7071, test_loss: 0.8598, test_f1: 0.5954
 epoch: 42, train_loss: 0.7150, test_loss: 0.8711, test_f1: 0.5988
 epoch: 43, train_loss: 0.7111, test_loss: 0.8651, test_f1: 0.6043
 epoch: 44, train_loss: 0.7154, test_loss: 0.8716, test_f1: 0.6161
 epoch: 45, train_loss: 0.6996, test_loss: 0.8891, test_f1: 0.6131
 epoch: 46, train_loss: 0.6877, test_loss: 0.9005, test_f1: 0.5922
 epoch: 47, train_loss: 0.6998, test_loss: 0.8951, test_f1: 0.5903
 epoch: 48, train_loss: 0.6898, test_loss: 0.8651, test_f1: 0.6200
 epoch: 49, train_loss: 0.6756, test_loss: 0.8530, test_f1: 0.6386
 epoch: 50, train_loss: 0.6913, test_loss: 0.8849, test_f1: 0.6115
 epoch: 51, train_loss: 0.6679, test_loss: 0.8730, test_f1: 0.6276
 epoch: 52, train_loss: 0.6483, test_loss: 0.8663, test_f1: 0.6345
 epoch: 53, train_loss: 0.6590, test_loss: 0.8591, test_f1: 0.6221
 epoch: 54, train_loss: 0.6652, test_loss: 0.8819, test_f1: 0.6297
 epoch: 55, train_loss: 0.6474, test_loss: 0.8637, test_f1: 0.6192
 epoch: 56, train_loss: 0.6383, test_loss: 0.8477, test_f1: 0.6405
 epoch: 57, train_loss: 0.6548, test_loss: 0.8884, test_f1: 0.6172
 epoch: 58, train_loss: 0.6497, test_loss: 0.8759, test_f1: 0.6264
 epoch: 59, train_loss: 0.6449, test_loss: 0.8657, test_f1: 0.6377
 epoch: 60, train_loss: 0.6469, test_loss: 0.8804, test_f1: 0.6294
 epoch: 61, train_loss: 0.6454, test_loss: 0.8465, test_f1: 0.6160
 epoch: 62, train_loss: 0.6384, test_loss: 0.8646, test_f1: 0.6531
 epoch: 63, train_loss: 0.6293, test_loss: 0.8540, test_f1: 0.6456
 epoch: 64, train_loss: 0.6257, test_loss: 0.8382, test_f1: 0.6451
 epoch: 65, train_loss: 0.6393, test_loss: 0.8676, test_f1: 0.6284
 epoch: 66, train_loss: 0.6265, test_loss: 0.8555, test_f1: 0.6445
 epoch: 67, train_loss: 0.6337, test_loss: 0.8600, test_f1: 0.6424
 epoch: 68, train_loss: 0.6267, test_loss: 0.8682, test_f1: 0.6522
 epoch: 69, train_loss: 0.6258, test_loss: 0.8571, test_f1: 0.6699
 epoch: 70, train_loss: 0.6214, test_loss: 0.8810, test_f1: 0.6469
 epoch: 71, train_loss: 0.6170, test_loss: 0.8753, test_f1: 0.6583
 epoch: 72, train_loss: 0.6067, test_loss: 0.8815, test_f1: 0.6591
 epoch: 73, train_loss: 0.6202, test_loss: 0.8734, test_f1: 0.6570
 epoch: 74, train_loss: 0.6059, test_loss: 0.8806, test_f1: 0.6490
 epoch: 75, train_loss: 0.6134, test_loss: 0.8943, test_f1: 0.6395
 epoch: 76, train_loss: 0.6043, test_loss: 0.8994, test_f1: 0.6393
 epoch: 77, train_loss: 0.6108, test_loss: 0.9137, test_f1: 0.6336
 epoch: 78, train_loss: 0.6001, test_loss: 0.9236, test_f1: 0.6649
 epoch: 79, train_loss: 0.6111, test_loss: 0.8745, test_f1: 0.6534
 epoch: 80, train_loss: 0.6087, test_loss: 0.8829, test_f1: 0.6511
 epoch: 81, train_loss: 0.6098, test_loss: 0.8711, test_f1: 0.6659
 epoch: 82, train_loss: 0.6083, test_loss: 0.9148, test_f1: 0.6429
 epoch: 83, train_loss: 0.6004, test_loss: 0.8660, test_f1: 0.6671
 epoch: 84, train_loss: 0.5930, test_loss: 0.8819, test_f1: 0.6687
 epoch: 85, train_loss: 0.5868, test_loss: 0.9041, test_f1: 0.6685
 epoch: 86, train_loss: 0.5946, test_loss: 0.8964, test_f1: 0.6583
 epoch: 87, train_loss: 0.5783, test_loss: 0.8936, test_f1: 0.6634
 epoch: 88, train_loss: 0.6011, test_loss: 0.9277, test_f1: 0.6362
 epoch: 89, train_loss: 0.5739, test_loss: 0.8807, test_f1: 0.6625
 epoch: 90, train_loss: 0.5770, test_loss: 0.9031, test_f1: 0.6532
 epoch: 91, train_loss: 0.5706, test_loss: 0.8843, test_f1: 0.6815
 epoch: 92, train_loss: 0.5785, test_loss: 0.8799, test_f1: 0.6594
 epoch: 93, train_loss: 0.5898, test_loss: 0.8695, test_f1: 0.6587
 epoch: 94, train_loss: 0.5752, test_loss: 0.8826, test_f1: 0.6644
 epoch: 95, train_loss: 0.5808, test_loss: 0.9164, test_f1: 0.6726
 epoch: 96, train_loss: 0.5693, test_loss: 0.9236, test_f1: 0.6640
 epoch: 97, train_loss: 0.5808, test_loss: 0.9326, test_f1: 0.6475
 epoch: 98, train_loss: 0.5714, test_loss: 0.9249, test_f1: 0.6857
 epoch: 99, train_loss: 0.5715, test_loss: 0.8759, test_f1: 0.6823
##################ITERATION #8 ****************************************
 epoch: 0, train_loss: 1.2483, test_loss: 1.0422, test_f1: 0.4955
 epoch: 1, train_loss: 1.0955, test_loss: 1.0179, test_f1: 0.4908
 epoch: 2, train_loss: 1.0312, test_loss: 0.9842, test_f1: 0.4887
 epoch: 3, train_loss: 1.0259, test_loss: 0.9614, test_f1: 0.4954
 epoch: 4, train_loss: 0.9938, test_loss: 0.9623, test_f1: 0.5198
 epoch: 5, train_loss: 0.9730, test_loss: 0.9597, test_f1: 0.5087
 epoch: 6, train_loss: 0.9621, test_loss: 0.9490, test_f1: 0.5086
 epoch: 7, train_loss: 0.9449, test_loss: 0.9365, test_f1: 0.5191
 epoch: 8, train_loss: 0.9365, test_loss: 0.9472, test_f1: 0.5156
 epoch: 9, train_loss: 0.9309, test_loss: 0.9390, test_f1: 0.5087
 epoch: 10, train_loss: 0.9116, test_loss: 0.9351, test_f1: 0.5305
 epoch: 11, train_loss: 0.8982, test_loss: 0.9222, test_f1: 0.5710
 epoch: 12, train_loss: 0.8933, test_loss: 0.9301, test_f1: 0.5106
 epoch: 13, train_loss: 0.8864, test_loss: 0.9185, test_f1: 0.5642
 epoch: 14, train_loss: 0.8772, test_loss: 0.9129, test_f1: 0.5332
 epoch: 15, train_loss: 0.8663, test_loss: 0.9032, test_f1: 0.5500
 epoch: 16, train_loss: 0.8588, test_loss: 0.9134, test_f1: 0.5588
 epoch: 17, train_loss: 0.8561, test_loss: 0.9174, test_f1: 0.5571
 epoch: 18, train_loss: 0.8531, test_loss: 0.9198, test_f1: 0.5534
 epoch: 19, train_loss: 0.8449, test_loss: 0.9158, test_f1: 0.5704
 epoch: 20, train_loss: 0.8352, test_loss: 0.9005, test_f1: 0.5534
 epoch: 21, train_loss: 0.8217, test_loss: 0.9123, test_f1: 0.5716
 epoch: 22, train_loss: 0.8333, test_loss: 0.8815, test_f1: 0.5703
 epoch: 23, train_loss: 0.8154, test_loss: 0.8862, test_f1: 0.5754
 epoch: 24, train_loss: 0.8158, test_loss: 0.9084, test_f1: 0.5701
 epoch: 25, train_loss: 0.8205, test_loss: 0.9025, test_f1: 0.5780
 epoch: 26, train_loss: 0.8116, test_loss: 0.8835, test_f1: 0.5639
 epoch: 27, train_loss: 0.8011, test_loss: 0.8785, test_f1: 0.5736
 epoch: 28, train_loss: 0.8051, test_loss: 0.8976, test_f1: 0.5662
 epoch: 29, train_loss: 0.7982, test_loss: 0.8825, test_f1: 0.5695
 epoch: 30, train_loss: 0.7898, test_loss: 0.8532, test_f1: 0.5789
 epoch: 31, train_loss: 0.7821, test_loss: 0.8617, test_f1: 0.6072
 epoch: 32, train_loss: 0.7761, test_loss: 0.8698, test_f1: 0.5766
 epoch: 33, train_loss: 0.7604, test_loss: 0.8768, test_f1: 0.5905
 epoch: 34, train_loss: 0.7580, test_loss: 0.8814, test_f1: 0.6030
 epoch: 35, train_loss: 0.7552, test_loss: 0.8692, test_f1: 0.6000
 epoch: 36, train_loss: 0.7528, test_loss: 0.9019, test_f1: 0.6090
 epoch: 37, train_loss: 0.7540, test_loss: 0.8408, test_f1: 0.5973
 epoch: 38, train_loss: 0.7412, test_loss: 0.8740, test_f1: 0.5992
 epoch: 39, train_loss: 0.7517, test_loss: 0.8935, test_f1: 0.6050
 epoch: 40, train_loss: 0.7402, test_loss: 0.8954, test_f1: 0.6229
 epoch: 41, train_loss: 0.7378, test_loss: 0.8605, test_f1: 0.6146
 epoch: 42, train_loss: 0.7263, test_loss: 0.8952, test_f1: 0.6296
 epoch: 43, train_loss: 0.7328, test_loss: 0.8908, test_f1: 0.6299
 epoch: 44, train_loss: 0.7227, test_loss: 0.8746, test_f1: 0.6232
 epoch: 45, train_loss: 0.7195, test_loss: 0.8741, test_f1: 0.6326
 epoch: 46, train_loss: 0.7174, test_loss: 0.8743, test_f1: 0.6427
 epoch: 47, train_loss: 0.7025, test_loss: 0.8641, test_f1: 0.6273
 epoch: 48, train_loss: 0.6927, test_loss: 0.8889, test_f1: 0.6268
 epoch: 49, train_loss: 0.7033, test_loss: 0.9017, test_f1: 0.6162
 epoch: 50, train_loss: 0.7108, test_loss: 0.8686, test_f1: 0.6230
 epoch: 51, train_loss: 0.6982, test_loss: 0.8824, test_f1: 0.6435
 epoch: 52, train_loss: 0.6780, test_loss: 0.8823, test_f1: 0.6460
 epoch: 53, train_loss: 0.6683, test_loss: 0.8849, test_f1: 0.6380
 epoch: 54, train_loss: 0.6775, test_loss: 0.8869, test_f1: 0.6501
 epoch: 55, train_loss: 0.6739, test_loss: 0.8877, test_f1: 0.6410
 epoch: 56, train_loss: 0.6720, test_loss: 0.8830, test_f1: 0.6318
 epoch: 57, train_loss: 0.6853, test_loss: 0.8992, test_f1: 0.6371
 epoch: 58, train_loss: 0.6654, test_loss: 0.8913, test_f1: 0.6489
 epoch: 59, train_loss: 0.6590, test_loss: 0.9101, test_f1: 0.6223
 epoch: 60, train_loss: 0.6668, test_loss: 0.8926, test_f1: 0.6319
 epoch: 61, train_loss: 0.6674, test_loss: 0.9041, test_f1: 0.6406
 epoch: 62, train_loss: 0.6604, test_loss: 0.8978, test_f1: 0.6501
 epoch: 63, train_loss: 0.6586, test_loss: 0.9082, test_f1: 0.6427
 epoch: 64, train_loss: 0.6630, test_loss: 0.8852, test_f1: 0.6452
 epoch: 65, train_loss: 0.6475, test_loss: 0.8756, test_f1: 0.6423
 epoch: 66, train_loss: 0.6460, test_loss: 0.8870, test_f1: 0.6460
 epoch: 67, train_loss: 0.6561, test_loss: 0.9029, test_f1: 0.6400
 epoch: 68, train_loss: 0.6451, test_loss: 0.9033, test_f1: 0.6536
 epoch: 69, train_loss: 0.6612, test_loss: 0.9096, test_f1: 0.6394
 epoch: 70, train_loss: 0.6373, test_loss: 0.9076, test_f1: 0.6344
 epoch: 71, train_loss: 0.6413, test_loss: 0.9065, test_f1: 0.6583
 epoch: 72, train_loss: 0.6357, test_loss: 0.9050, test_f1: 0.6405
 epoch: 73, train_loss: 0.6389, test_loss: 0.9047, test_f1: 0.6400
 epoch: 74, train_loss: 0.6315, test_loss: 0.9234, test_f1: 0.6475
 epoch: 75, train_loss: 0.6304, test_loss: 0.9274, test_f1: 0.6232
 epoch: 76, train_loss: 0.6462, test_loss: 0.9304, test_f1: 0.6491
 epoch: 77, train_loss: 0.6346, test_loss: 0.9229, test_f1: 0.6349
 epoch: 78, train_loss: 0.6193, test_loss: 0.9251, test_f1: 0.6549
 epoch: 79, train_loss: 0.6282, test_loss: 0.8900, test_f1: 0.6621
 epoch: 80, train_loss: 0.6204, test_loss: 0.8829, test_f1: 0.6421
 epoch: 81, train_loss: 0.6138, test_loss: 0.9203, test_f1: 0.6593
 epoch: 82, train_loss: 0.6168, test_loss: 0.9031, test_f1: 0.6413
 epoch: 83, train_loss: 0.6226, test_loss: 0.9055, test_f1: 0.6494
 epoch: 84, train_loss: 0.6304, test_loss: 0.9037, test_f1: 0.6462
 epoch: 85, train_loss: 0.6148, test_loss: 0.9229, test_f1: 0.6485
 epoch: 86, train_loss: 0.6043, test_loss: 0.9094, test_f1: 0.6576
 epoch: 87, train_loss: 0.6032, test_loss: 0.9260, test_f1: 0.6550
 epoch: 88, train_loss: 0.5990, test_loss: 0.9369, test_f1: 0.6394
 epoch: 89, train_loss: 0.6032, test_loss: 0.9401, test_f1: 0.6440
 epoch: 90, train_loss: 0.6094, test_loss: 0.9337, test_f1: 0.6314
 epoch: 91, train_loss: 0.6012, test_loss: 0.9474, test_f1: 0.6356
 epoch: 92, train_loss: 0.5999, test_loss: 0.9238, test_f1: 0.6334
 epoch: 93, train_loss: 0.6027, test_loss: 0.9286, test_f1: 0.6527
 epoch: 94, train_loss: 0.5963, test_loss: 0.9172, test_f1: 0.6489
 epoch: 95, train_loss: 0.6030, test_loss: 0.9247, test_f1: 0.6465
 epoch: 96, train_loss: 0.6084, test_loss: 0.9304, test_f1: 0.6410
 epoch: 97, train_loss: 0.5983, test_loss: 0.9594, test_f1: 0.6155
 epoch: 98, train_loss: 0.5831, test_loss: 0.9384, test_f1: 0.6449
 epoch: 99, train_loss: 0.5848, test_loss: 0.9883, test_f1: 0.6354
##################ITERATION #9 ****************************************
 epoch: 0, train_loss: 1.3162, test_loss: 1.0315, test_f1: 0.4762
 epoch: 1, train_loss: 1.1186, test_loss: 0.9784, test_f1: 0.4879
 epoch: 2, train_loss: 1.0638, test_loss: 0.9798, test_f1: 0.4917
 epoch: 3, train_loss: 1.0322, test_loss: 0.9508, test_f1: 0.5123
 epoch: 4, train_loss: 1.0062, test_loss: 0.9413, test_f1: 0.5046
 epoch: 5, train_loss: 0.9856, test_loss: 0.9300, test_f1: 0.4984
 epoch: 6, train_loss: 0.9656, test_loss: 0.9186, test_f1: 0.5099
 epoch: 7, train_loss: 0.9451, test_loss: 0.9152, test_f1: 0.5186
 epoch: 8, train_loss: 0.9391, test_loss: 0.9058, test_f1: 0.5298
 epoch: 9, train_loss: 0.9258, test_loss: 0.9076, test_f1: 0.5195
 epoch: 10, train_loss: 0.9229, test_loss: 0.9039, test_f1: 0.5143
 epoch: 11, train_loss: 0.9056, test_loss: 0.9006, test_f1: 0.5311
 epoch: 12, train_loss: 0.8946, test_loss: 0.9205, test_f1: 0.5223
 epoch: 13, train_loss: 0.8914, test_loss: 0.9283, test_f1: 0.5144
 epoch: 14, train_loss: 0.8870, test_loss: 0.9114, test_f1: 0.5275
 epoch: 15, train_loss: 0.8810, test_loss: 0.9146, test_f1: 0.5376
 epoch: 16, train_loss: 0.8633, test_loss: 0.8969, test_f1: 0.5401
 epoch: 17, train_loss: 0.8574, test_loss: 0.9015, test_f1: 0.5334
 epoch: 18, train_loss: 0.8510, test_loss: 0.8968, test_f1: 0.5587
 epoch: 19, train_loss: 0.8433, test_loss: 0.9112, test_f1: 0.5628
 epoch: 20, train_loss: 0.8419, test_loss: 0.9011, test_f1: 0.5653
 epoch: 21, train_loss: 0.8435, test_loss: 0.8876, test_f1: 0.5525
 epoch: 22, train_loss: 0.8410, test_loss: 0.8912, test_f1: 0.5489
 epoch: 23, train_loss: 0.8369, test_loss: 0.8944, test_f1: 0.5687
 epoch: 24, train_loss: 0.8286, test_loss: 0.8890, test_f1: 0.5605
 epoch: 25, train_loss: 0.8136, test_loss: 0.9135, test_f1: 0.5500
 epoch: 26, train_loss: 0.8244, test_loss: 0.9017, test_f1: 0.5706
 epoch: 27, train_loss: 0.8026, test_loss: 0.8874, test_f1: 0.5677
 epoch: 28, train_loss: 0.8044, test_loss: 0.9024, test_f1: 0.5699
 epoch: 29, train_loss: 0.8006, test_loss: 0.8832, test_f1: 0.5533
 epoch: 30, train_loss: 0.8009, test_loss: 0.8885, test_f1: 0.5687
 epoch: 31, train_loss: 0.7851, test_loss: 0.8775, test_f1: 0.5754
 epoch: 32, train_loss: 0.7878, test_loss: 0.8907, test_f1: 0.6209
 epoch: 33, train_loss: 0.7842, test_loss: 0.8783, test_f1: 0.5797
 epoch: 34, train_loss: 0.7763, test_loss: 0.8788, test_f1: 0.5962
 epoch: 35, train_loss: 0.7596, test_loss: 0.8928, test_f1: 0.5733
 epoch: 36, train_loss: 0.7699, test_loss: 0.8732, test_f1: 0.6108
 epoch: 37, train_loss: 0.7522, test_loss: 0.8942, test_f1: 0.5997
 epoch: 38, train_loss: 0.7543, test_loss: 0.8723, test_f1: 0.5732
 epoch: 39, train_loss: 0.7560, test_loss: 0.8850, test_f1: 0.6004
 epoch: 40, train_loss: 0.7543, test_loss: 0.9050, test_f1: 0.5791
 epoch: 41, train_loss: 0.7478, test_loss: 0.9051, test_f1: 0.5994
 epoch: 42, train_loss: 0.7440, test_loss: 0.8776, test_f1: 0.6201
 epoch: 43, train_loss: 0.7353, test_loss: 0.8800, test_f1: 0.6123
 epoch: 44, train_loss: 0.7484, test_loss: 0.8993, test_f1: 0.5863
 epoch: 45, train_loss: 0.7369, test_loss: 0.8784, test_f1: 0.6045
 epoch: 46, train_loss: 0.7352, test_loss: 0.8783, test_f1: 0.6114
 epoch: 47, train_loss: 0.7238, test_loss: 0.9024, test_f1: 0.5923
 epoch: 48, train_loss: 0.7315, test_loss: 0.8661, test_f1: 0.5911
 epoch: 49, train_loss: 0.7171, test_loss: 0.8874, test_f1: 0.6006
 epoch: 50, train_loss: 0.7102, test_loss: 0.8941, test_f1: 0.6145
 epoch: 51, train_loss: 0.7039, test_loss: 0.8999, test_f1: 0.6175
 epoch: 52, train_loss: 0.7091, test_loss: 0.9234, test_f1: 0.6065
 epoch: 53, train_loss: 0.6851, test_loss: 0.8848, test_f1: 0.6117
 epoch: 54, train_loss: 0.6953, test_loss: 0.8902, test_f1: 0.6008
 epoch: 55, train_loss: 0.6902, test_loss: 0.9086, test_f1: 0.6108
 epoch: 56, train_loss: 0.6776, test_loss: 0.8856, test_f1: 0.6055
 epoch: 57, train_loss: 0.6854, test_loss: 0.9073, test_f1: 0.6018
 epoch: 58, train_loss: 0.6866, test_loss: 0.8980, test_f1: 0.6121
 epoch: 59, train_loss: 0.6905, test_loss: 0.8889, test_f1: 0.6220
 epoch: 60, train_loss: 0.6878, test_loss: 0.8948, test_f1: 0.6053
 epoch: 61, train_loss: 0.6954, test_loss: 0.9189, test_f1: 0.6150
 epoch: 62, train_loss: 0.6821, test_loss: 0.9050, test_f1: 0.6230
 epoch: 63, train_loss: 0.6842, test_loss: 0.9061, test_f1: 0.6073
 epoch: 64, train_loss: 0.6675, test_loss: 0.9076, test_f1: 0.6058
 epoch: 65, train_loss: 0.6778, test_loss: 0.8987, test_f1: 0.6106
 epoch: 66, train_loss: 0.6680, test_loss: 0.9180, test_f1: 0.6242
 epoch: 67, train_loss: 0.6749, test_loss: 0.9054, test_f1: 0.6085
 epoch: 68, train_loss: 0.6788, test_loss: 0.9373, test_f1: 0.6118
 epoch: 69, train_loss: 0.6566, test_loss: 0.9018, test_f1: 0.6240
 epoch: 70, train_loss: 0.6621, test_loss: 0.9254, test_f1: 0.6018
 epoch: 71, train_loss: 0.6660, test_loss: 0.9015, test_f1: 0.6139
 epoch: 72, train_loss: 0.6794, test_loss: 0.9289, test_f1: 0.6104
 epoch: 73, train_loss: 0.6498, test_loss: 0.9483, test_f1: 0.6098
 epoch: 74, train_loss: 0.6578, test_loss: 0.8950, test_f1: 0.6251
 epoch: 75, train_loss: 0.6633, test_loss: 0.9193, test_f1: 0.6181
 epoch: 76, train_loss: 0.6561, test_loss: 0.9530, test_f1: 0.6169
 epoch: 77, train_loss: 0.6517, test_loss: 0.9285, test_f1: 0.6225
 epoch: 78, train_loss: 0.6561, test_loss: 0.9343, test_f1: 0.6153
 epoch: 79, train_loss: 0.6499, test_loss: 0.9056, test_f1: 0.6423
 epoch: 80, train_loss: 0.6527, test_loss: 0.9282, test_f1: 0.6104
 epoch: 81, train_loss: 0.6478, test_loss: 0.9498, test_f1: 0.6246
 epoch: 82, train_loss: 0.6479, test_loss: 0.9682, test_f1: 0.5991
 epoch: 83, train_loss: 0.6536, test_loss: 0.9322, test_f1: 0.6167
 epoch: 84, train_loss: 0.6309, test_loss: 0.9331, test_f1: 0.6096
 epoch: 85, train_loss: 0.6520, test_loss: 0.9434, test_f1: 0.6125
 epoch: 86, train_loss: 0.6452, test_loss: 0.9240, test_f1: 0.6228
 epoch: 87, train_loss: 0.6487, test_loss: 0.9401, test_f1: 0.6184
 epoch: 88, train_loss: 0.6371, test_loss: 0.9624, test_f1: 0.6248
 epoch: 89, train_loss: 0.6320, test_loss: 0.9574, test_f1: 0.6098
 epoch: 90, train_loss: 0.6467, test_loss: 0.9455, test_f1: 0.6208
 epoch: 91, train_loss: 0.6237, test_loss: 0.9519, test_f1: 0.6157
 epoch: 92, train_loss: 0.6254, test_loss: 0.9164, test_f1: 0.6213
 epoch: 93, train_loss: 0.6247, test_loss: 0.9624, test_f1: 0.6216
 epoch: 94, train_loss: 0.6294, test_loss: 0.9352, test_f1: 0.6229
 epoch: 95, train_loss: 0.6154, test_loss: 0.9466, test_f1: 0.6298
 epoch: 96, train_loss: 0.6336, test_loss: 0.9557, test_f1: 0.6248
 epoch: 97, train_loss: 0.6051, test_loss: 0.9466, test_f1: 0.6271
 epoch: 98, train_loss: 0.6100, test_loss: 0.9326, test_f1: 0.6330
 epoch: 99, train_loss: 0.6190, test_loss: 0.9259, test_f1: 0.6219

Training completed in 801.76 seconds
Best F1: 0.6881 at epoch 76
Mean F1 across iterations: 0.6708  0.0146
========================FINAL RESULTS================================
FEGIN weighted F1: 0.6881  0.0146
python main.py --data ltspice_examples --representation component_net --model FEGIN --layers 2 --hiddens 128 --batch_size 32 --lr 0.0001 --emb_size 128 --epochs 100 --save_appendix component_net_L2_H128_BS32_LR0.0001_E128 --no_val
-----



STDERR:
  File "main.py", line 370, in <module>
    main()
  File "main.py", line 254, in main
    dataset = dataset_class(
  File "/home/philip/projects/ltspice_examples_code_repo/Circuit-Completion-Using-GNNs/component_classification_with_link_prediction_head/evaluation/FEGIN/kernel/circuit_datasets.py", line 15, in __init__
    self.data, self.slices = torch.load(self.processed_paths[0])
  File "/home/philip/.local/lib/python3.8/site-packages/torch/serialization.py", line 1040, in load
    warnings.warn(
  File "/usr/lib/python3.8/warnings.py", line 109, in _showwarnmsg
    sw(msg.message, msg.category, msg.filename, msg.lineno,
  File "main.py", line 47, in warn_with_traceback
    traceback.print_stack(file=log)
/home/philip/projects/ltspice_examples_code_repo/Circuit-Completion-Using-GNNs/component_classification_with_link_prediction_head/evaluation/FEGIN/kernel/circuit_datasets.py:15: FutureWarning: You are using `torch.load` with `weights_only=False` (the current default value), which uses the default pickle module implicitly. It is possible to construct malicious pickle data which will execute arbitrary code during unpickling (See https://github.com/pytorch/pytorch/blob/main/SECURITY.md#untrusted-models for more details). In a future release, the default value for `weights_only` will be flipped to `True`. This limits the functions that could be executed during unpickling. Arbitrary objects will no longer be allowed to be loaded via this mode unless they are explicitly allowlisted by the user via `torch.serialization.add_safe_globals`. We recommend you start setting `weights_only=True` for any use case where you don't have full control of the loaded file. Please open an issue on GitHub for any issues related to this experimental feature.
  self.data, self.slices = torch.load(self.processed_paths[0])
