STDOUT:
Results will be saved in /home/philip/projects/ltspice_examples_code_repo/Circuit-Completion-Using-GNNs/component_classification_with_link_prediction_head/evaluation/FEGIN/results/model_FEGIN_dataset_ltspice_demos
Command line input: python main.py --data ltspice_demos --representation component_net --model FEGIN --layers 2 --hiddens 128 --batch_size 32 --lr 0.0001 --emb_size 128 --epochs 100 --save_appendix component_net_L2_H128_BS32_LR0.0001_E128 --no_val
 is saved.
-----
ltspice_demos - FEGIN
Using 2 layers, 128 hidden units, h = 2
Loading component_net representation dataset
ENTERED
Training FEGIN on component_net representation
Train: 1565, Test: 383
##################ITERATION #0 ****************************************
 epoch: 0, train_loss: 1.3545, test_loss: 1.3498, test_f1: 0.2281
 epoch: 1, train_loss: 1.2905, test_loss: 1.2971, test_f1: 0.2281
 epoch: 2, train_loss: 1.2280, test_loss: 1.2563, test_f1: 0.2281
 epoch: 3, train_loss: 1.1855, test_loss: 1.2331, test_f1: 0.2832
 epoch: 4, train_loss: 1.1556, test_loss: 1.2157, test_f1: 0.2936
 epoch: 5, train_loss: 1.1284, test_loss: 1.2000, test_f1: 0.3333
 epoch: 6, train_loss: 1.1037, test_loss: 1.1906, test_f1: 0.3940
 epoch: 7, train_loss: 1.0812, test_loss: 1.1675, test_f1: 0.4045
 epoch: 8, train_loss: 1.0621, test_loss: 1.1582, test_f1: 0.4047
 epoch: 9, train_loss: 1.0382, test_loss: 1.1394, test_f1: 0.4166
 epoch: 10, train_loss: 1.0133, test_loss: 1.1276, test_f1: 0.4224
 epoch: 11, train_loss: 1.0007, test_loss: 1.0995, test_f1: 0.4463
 epoch: 12, train_loss: 0.9809, test_loss: 1.0846, test_f1: 0.4535
 epoch: 13, train_loss: 0.9686, test_loss: 1.0780, test_f1: 0.4565
 epoch: 14, train_loss: 0.9479, test_loss: 1.0640, test_f1: 0.4691
 epoch: 15, train_loss: 0.9333, test_loss: 1.0541, test_f1: 0.4760
 epoch: 16, train_loss: 0.9267, test_loss: 1.0716, test_f1: 0.5124
 epoch: 17, train_loss: 0.9170, test_loss: 1.0535, test_f1: 0.4952
 epoch: 18, train_loss: 0.9069, test_loss: 1.0490, test_f1: 0.5205
 epoch: 19, train_loss: 0.8985, test_loss: 1.0510, test_f1: 0.5251
 epoch: 20, train_loss: 0.8885, test_loss: 1.0619, test_f1: 0.5321
 epoch: 21, train_loss: 0.8777, test_loss: 1.0393, test_f1: 0.5411
 epoch: 22, train_loss: 0.8803, test_loss: 1.0295, test_f1: 0.5137
 epoch: 23, train_loss: 0.8683, test_loss: 1.0375, test_f1: 0.5491
 epoch: 24, train_loss: 0.8549, test_loss: 1.0952, test_f1: 0.5240
 epoch: 25, train_loss: 0.8473, test_loss: 1.0871, test_f1: 0.5506
 epoch: 26, train_loss: 0.8479, test_loss: 1.0648, test_f1: 0.5651
 epoch: 27, train_loss: 0.8339, test_loss: 1.0527, test_f1: 0.5343
 epoch: 28, train_loss: 0.8379, test_loss: 1.0615, test_f1: 0.5488
 epoch: 29, train_loss: 0.8239, test_loss: 1.0497, test_f1: 0.5629
 epoch: 30, train_loss: 0.8219, test_loss: 1.0604, test_f1: 0.5512
 epoch: 31, train_loss: 0.8151, test_loss: 1.0601, test_f1: 0.5719
 epoch: 32, train_loss: 0.8148, test_loss: 1.0345, test_f1: 0.5946
 epoch: 33, train_loss: 0.7967, test_loss: 1.0524, test_f1: 0.5551
 epoch: 34, train_loss: 0.8031, test_loss: 1.0196, test_f1: 0.5826
 epoch: 35, train_loss: 0.7856, test_loss: 1.0490, test_f1: 0.5677
 epoch: 36, train_loss: 0.7820, test_loss: 1.0514, test_f1: 0.5822
 epoch: 37, train_loss: 0.7788, test_loss: 1.0224, test_f1: 0.5555
 epoch: 38, train_loss: 0.7818, test_loss: 1.0752, test_f1: 0.5615
 epoch: 39, train_loss: 0.7503, test_loss: 1.0463, test_f1: 0.5552
 epoch: 40, train_loss: 0.7583, test_loss: 1.0426, test_f1: 0.5721
 epoch: 41, train_loss: 0.7496, test_loss: 1.0784, test_f1: 0.5830
 epoch: 42, train_loss: 0.7466, test_loss: 1.0578, test_f1: 0.5743
 epoch: 43, train_loss: 0.7303, test_loss: 1.0968, test_f1: 0.5540
 epoch: 44, train_loss: 0.7246, test_loss: 1.1085, test_f1: 0.5469
 epoch: 45, train_loss: 0.7260, test_loss: 1.0397, test_f1: 0.5667
 epoch: 46, train_loss: 0.7199, test_loss: 1.0468, test_f1: 0.5723
 epoch: 47, train_loss: 0.7004, test_loss: 1.1196, test_f1: 0.5441
 epoch: 48, train_loss: 0.7184, test_loss: 1.1090, test_f1: 0.5455
 epoch: 49, train_loss: 0.6939, test_loss: 1.0401, test_f1: 0.6130
 epoch: 50, train_loss: 0.6879, test_loss: 1.0310, test_f1: 0.5863
 epoch: 51, train_loss: 0.6901, test_loss: 1.0868, test_f1: 0.5696
 epoch: 52, train_loss: 0.6681, test_loss: 1.0579, test_f1: 0.5849
 epoch: 53, train_loss: 0.6647, test_loss: 1.0683, test_f1: 0.5999
 epoch: 54, train_loss: 0.6627, test_loss: 1.0304, test_f1: 0.6018
 epoch: 55, train_loss: 0.6448, test_loss: 1.0732, test_f1: 0.5655
 epoch: 56, train_loss: 0.6520, test_loss: 1.0737, test_f1: 0.5651
 epoch: 57, train_loss: 0.6601, test_loss: 1.0842, test_f1: 0.5961
 epoch: 58, train_loss: 0.6424, test_loss: 1.1014, test_f1: 0.5947
 epoch: 59, train_loss: 0.6545, test_loss: 1.0874, test_f1: 0.5957
 epoch: 60, train_loss: 0.6439, test_loss: 1.0958, test_f1: 0.5872
 epoch: 61, train_loss: 0.6439, test_loss: 1.0883, test_f1: 0.5886
 epoch: 62, train_loss: 0.6296, test_loss: 1.1358, test_f1: 0.5641
 epoch: 63, train_loss: 0.6500, test_loss: 1.0724, test_f1: 0.6014
 epoch: 64, train_loss: 0.6282, test_loss: 1.1143, test_f1: 0.5824
 epoch: 65, train_loss: 0.6252, test_loss: 1.1420, test_f1: 0.5821
 epoch: 66, train_loss: 0.6107, test_loss: 1.1069, test_f1: 0.5889
 epoch: 67, train_loss: 0.6186, test_loss: 1.1282, test_f1: 0.6019
 epoch: 68, train_loss: 0.6057, test_loss: 1.1523, test_f1: 0.6018
 epoch: 69, train_loss: 0.6036, test_loss: 1.1078, test_f1: 0.6081
 epoch: 70, train_loss: 0.6082, test_loss: 1.1437, test_f1: 0.6044
 epoch: 71, train_loss: 0.6083, test_loss: 1.1248, test_f1: 0.6134
 epoch: 72, train_loss: 0.6013, test_loss: 1.1213, test_f1: 0.6021
 epoch: 73, train_loss: 0.6044, test_loss: 1.1419, test_f1: 0.6030
 epoch: 74, train_loss: 0.5954, test_loss: 1.1598, test_f1: 0.5862
 epoch: 75, train_loss: 0.5828, test_loss: 1.1775, test_f1: 0.5799
 epoch: 76, train_loss: 0.5983, test_loss: 1.1529, test_f1: 0.6024
 epoch: 77, train_loss: 0.5694, test_loss: 1.2260, test_f1: 0.5869
 epoch: 78, train_loss: 0.5819, test_loss: 1.1670, test_f1: 0.6148
 epoch: 79, train_loss: 0.5904, test_loss: 1.1928, test_f1: 0.5970
 epoch: 80, train_loss: 0.5566, test_loss: 1.1857, test_f1: 0.6067
 epoch: 81, train_loss: 0.5801, test_loss: 1.1966, test_f1: 0.6009
 epoch: 82, train_loss: 0.5784, test_loss: 1.2335, test_f1: 0.5644
 epoch: 83, train_loss: 0.5685, test_loss: 1.2453, test_f1: 0.5847
 epoch: 84, train_loss: 0.5693, test_loss: 1.2055, test_f1: 0.5923
 epoch: 85, train_loss: 0.5526, test_loss: 1.2641, test_f1: 0.5838
 epoch: 86, train_loss: 0.5625, test_loss: 1.2360, test_f1: 0.5991
 epoch: 87, train_loss: 0.5450, test_loss: 1.3233, test_f1: 0.5807
 epoch: 88, train_loss: 0.5462, test_loss: 1.2869, test_f1: 0.5876
 epoch: 89, train_loss: 0.5490, test_loss: 1.2378, test_f1: 0.5811
 epoch: 90, train_loss: 0.5428, test_loss: 1.2954, test_f1: 0.5936
 epoch: 91, train_loss: 0.5432, test_loss: 1.2864, test_f1: 0.5775
 epoch: 92, train_loss: 0.5402, test_loss: 1.2703, test_f1: 0.6054
 epoch: 93, train_loss: 0.5427, test_loss: 1.2797, test_f1: 0.6142
 epoch: 94, train_loss: 0.5393, test_loss: 1.2632, test_f1: 0.6306
 epoch: 95, train_loss: 0.5433, test_loss: 1.2711, test_f1: 0.6333
 epoch: 96, train_loss: 0.5241, test_loss: 1.3184, test_f1: 0.5966
 epoch: 97, train_loss: 0.5180, test_loss: 1.3819, test_f1: 0.6236
 epoch: 98, train_loss: 0.5130, test_loss: 1.3151, test_f1: 0.6170
 epoch: 99, train_loss: 0.5087, test_loss: 1.3449, test_f1: 0.6245
##################ITERATION #1 ****************************************
 epoch: 0, train_loss: 1.2619, test_loss: 1.2752, test_f1: 0.2468
 epoch: 1, train_loss: 1.1565, test_loss: 1.2162, test_f1: 0.3316
 epoch: 2, train_loss: 1.1159, test_loss: 1.1810, test_f1: 0.3419
 epoch: 3, train_loss: 1.0900, test_loss: 1.1542, test_f1: 0.4185
 epoch: 4, train_loss: 1.0537, test_loss: 1.1276, test_f1: 0.4484
 epoch: 5, train_loss: 1.0300, test_loss: 1.1017, test_f1: 0.4653
 epoch: 6, train_loss: 1.0112, test_loss: 1.0879, test_f1: 0.4889
 epoch: 7, train_loss: 0.9793, test_loss: 1.0781, test_f1: 0.4990
 epoch: 8, train_loss: 0.9594, test_loss: 1.0575, test_f1: 0.5075
 epoch: 9, train_loss: 0.9356, test_loss: 1.0479, test_f1: 0.5201
 epoch: 10, train_loss: 0.9232, test_loss: 1.0378, test_f1: 0.5144
 epoch: 11, train_loss: 0.9199, test_loss: 1.0342, test_f1: 0.5260
 epoch: 12, train_loss: 0.9034, test_loss: 1.0286, test_f1: 0.5241
 epoch: 13, train_loss: 0.8884, test_loss: 1.0236, test_f1: 0.5481
 epoch: 14, train_loss: 0.8744, test_loss: 1.0346, test_f1: 0.5549
 epoch: 15, train_loss: 0.8664, test_loss: 1.0294, test_f1: 0.5339
 epoch: 16, train_loss: 0.8637, test_loss: 1.0437, test_f1: 0.5448
 epoch: 17, train_loss: 0.8373, test_loss: 1.0423, test_f1: 0.5465
 epoch: 18, train_loss: 0.8448, test_loss: 1.0458, test_f1: 0.5564
 epoch: 19, train_loss: 0.8295, test_loss: 1.0345, test_f1: 0.5447
 epoch: 20, train_loss: 0.8132, test_loss: 1.0369, test_f1: 0.5589
 epoch: 21, train_loss: 0.8148, test_loss: 1.0232, test_f1: 0.5488
 epoch: 22, train_loss: 0.8127, test_loss: 1.0271, test_f1: 0.5663
 epoch: 23, train_loss: 0.8128, test_loss: 1.0176, test_f1: 0.5374
 epoch: 24, train_loss: 0.7861, test_loss: 1.0335, test_f1: 0.5693
 epoch: 25, train_loss: 0.7702, test_loss: 1.0383, test_f1: 0.5669
 epoch: 26, train_loss: 0.7814, test_loss: 1.0942, test_f1: 0.5693
 epoch: 27, train_loss: 0.7592, test_loss: 1.0253, test_f1: 0.5947
 epoch: 28, train_loss: 0.7610, test_loss: 1.0276, test_f1: 0.6206
 epoch: 29, train_loss: 0.7539, test_loss: 1.0037, test_f1: 0.6194
 epoch: 30, train_loss: 0.7493, test_loss: 1.0396, test_f1: 0.6069
 epoch: 31, train_loss: 0.7463, test_loss: 1.0540, test_f1: 0.6070
 epoch: 32, train_loss: 0.7387, test_loss: 1.0473, test_f1: 0.6167
 epoch: 33, train_loss: 0.7200, test_loss: 1.0320, test_f1: 0.6074
 epoch: 34, train_loss: 0.7162, test_loss: 1.0618, test_f1: 0.6025
 epoch: 35, train_loss: 0.7052, test_loss: 1.0230, test_f1: 0.6152
 epoch: 36, train_loss: 0.7150, test_loss: 1.0537, test_f1: 0.6188
 epoch: 37, train_loss: 0.7083, test_loss: 1.0458, test_f1: 0.5955
 epoch: 38, train_loss: 0.6904, test_loss: 1.0918, test_f1: 0.6109
 epoch: 39, train_loss: 0.6829, test_loss: 1.0441, test_f1: 0.6124
 epoch: 40, train_loss: 0.6629, test_loss: 1.0453, test_f1: 0.6121
 epoch: 41, train_loss: 0.6651, test_loss: 1.0705, test_f1: 0.6186
 epoch: 42, train_loss: 0.6719, test_loss: 1.0981, test_f1: 0.6128
 epoch: 43, train_loss: 0.6539, test_loss: 1.0835, test_f1: 0.6152
 epoch: 44, train_loss: 0.6506, test_loss: 1.0367, test_f1: 0.6207
 epoch: 45, train_loss: 0.6553, test_loss: 1.1209, test_f1: 0.5881
 epoch: 46, train_loss: 0.6648, test_loss: 1.1274, test_f1: 0.6187
 epoch: 47, train_loss: 0.6320, test_loss: 1.0723, test_f1: 0.5973
 epoch: 48, train_loss: 0.6480, test_loss: 1.0269, test_f1: 0.6236
 epoch: 49, train_loss: 0.6289, test_loss: 1.1205, test_f1: 0.6263
 epoch: 50, train_loss: 0.6320, test_loss: 1.0741, test_f1: 0.6362
 epoch: 51, train_loss: 0.6065, test_loss: 1.0670, test_f1: 0.6205
 epoch: 52, train_loss: 0.6012, test_loss: 1.1143, test_f1: 0.6183
 epoch: 53, train_loss: 0.5975, test_loss: 1.0967, test_f1: 0.6209
 epoch: 54, train_loss: 0.5885, test_loss: 1.0953, test_f1: 0.6299
 epoch: 55, train_loss: 0.5846, test_loss: 1.0667, test_f1: 0.6366
 epoch: 56, train_loss: 0.5893, test_loss: 1.0719, test_f1: 0.6149
 epoch: 57, train_loss: 0.5827, test_loss: 1.0975, test_f1: 0.6081
 epoch: 58, train_loss: 0.5799, test_loss: 1.1211, test_f1: 0.6000
 epoch: 59, train_loss: 0.5788, test_loss: 1.1050, test_f1: 0.6209
 epoch: 60, train_loss: 0.5783, test_loss: 1.1217, test_f1: 0.6317
 epoch: 61, train_loss: 0.5638, test_loss: 1.1138, test_f1: 0.6254
 epoch: 62, train_loss: 0.5569, test_loss: 1.1171, test_f1: 0.6176
 epoch: 63, train_loss: 0.5584, test_loss: 1.1277, test_f1: 0.6129
 epoch: 64, train_loss: 0.5488, test_loss: 1.1373, test_f1: 0.6253
 epoch: 65, train_loss: 0.5546, test_loss: 1.1204, test_f1: 0.6203
 epoch: 66, train_loss: 0.5554, test_loss: 1.1472, test_f1: 0.6106
 epoch: 67, train_loss: 0.5481, test_loss: 1.1292, test_f1: 0.6237
 epoch: 68, train_loss: 0.5484, test_loss: 1.1588, test_f1: 0.6131
 epoch: 69, train_loss: 0.5483, test_loss: 1.1402, test_f1: 0.6193
 epoch: 70, train_loss: 0.5541, test_loss: 1.1263, test_f1: 0.6198
 epoch: 71, train_loss: 0.5303, test_loss: 1.1776, test_f1: 0.6102
 epoch: 72, train_loss: 0.5425, test_loss: 1.1648, test_f1: 0.6127
 epoch: 73, train_loss: 0.5191, test_loss: 1.1778, test_f1: 0.6023
 epoch: 74, train_loss: 0.5112, test_loss: 1.1192, test_f1: 0.6391
 epoch: 75, train_loss: 0.5308, test_loss: 1.1644, test_f1: 0.6081
 epoch: 76, train_loss: 0.5337, test_loss: 1.1658, test_f1: 0.6235
 epoch: 77, train_loss: 0.5418, test_loss: 1.1059, test_f1: 0.6489
 epoch: 78, train_loss: 0.5251, test_loss: 1.1690, test_f1: 0.6225
 epoch: 79, train_loss: 0.5182, test_loss: 1.1739, test_f1: 0.6438
 epoch: 80, train_loss: 0.5239, test_loss: 1.1563, test_f1: 0.6424
 epoch: 81, train_loss: 0.5117, test_loss: 1.1829, test_f1: 0.6526
 epoch: 82, train_loss: 0.5087, test_loss: 1.1545, test_f1: 0.6471
 epoch: 83, train_loss: 0.5075, test_loss: 1.1751, test_f1: 0.6392
 epoch: 84, train_loss: 0.5180, test_loss: 1.1546, test_f1: 0.6290
 epoch: 85, train_loss: 0.5013, test_loss: 1.1609, test_f1: 0.6368
 epoch: 86, train_loss: 0.5123, test_loss: 1.1752, test_f1: 0.6609
 epoch: 87, train_loss: 0.5074, test_loss: 1.2213, test_f1: 0.6386
 epoch: 88, train_loss: 0.4848, test_loss: 1.2433, test_f1: 0.6185
 epoch: 89, train_loss: 0.4984, test_loss: 1.1559, test_f1: 0.6564
 epoch: 90, train_loss: 0.4965, test_loss: 1.1982, test_f1: 0.6386
 epoch: 91, train_loss: 0.4795, test_loss: 1.1817, test_f1: 0.6511
 epoch: 92, train_loss: 0.4730, test_loss: 1.1909, test_f1: 0.6444
 epoch: 93, train_loss: 0.4865, test_loss: 1.2071, test_f1: 0.6520
 epoch: 94, train_loss: 0.4751, test_loss: 1.2647, test_f1: 0.6495
 epoch: 95, train_loss: 0.4762, test_loss: 1.2210, test_f1: 0.6218
 epoch: 96, train_loss: 0.4892, test_loss: 1.2177, test_f1: 0.6453
 epoch: 97, train_loss: 0.4799, test_loss: 1.2197, test_f1: 0.6374
 epoch: 98, train_loss: 0.4892, test_loss: 1.2838, test_f1: 0.6368
 epoch: 99, train_loss: 0.4745, test_loss: 1.2442, test_f1: 0.6544
##################ITERATION #2 ****************************************
 epoch: 0, train_loss: 1.2138, test_loss: 1.2339, test_f1: 0.3581
 epoch: 1, train_loss: 1.1065, test_loss: 1.1686, test_f1: 0.4415
 epoch: 2, train_loss: 1.0668, test_loss: 1.1399, test_f1: 0.4747
 epoch: 3, train_loss: 1.0304, test_loss: 1.1176, test_f1: 0.4878
 epoch: 4, train_loss: 1.0173, test_loss: 1.0991, test_f1: 0.4883
 epoch: 5, train_loss: 0.9937, test_loss: 1.0882, test_f1: 0.4946
 epoch: 6, train_loss: 0.9697, test_loss: 1.0841, test_f1: 0.5043
 epoch: 7, train_loss: 0.9583, test_loss: 1.0784, test_f1: 0.5179
 epoch: 8, train_loss: 0.9497, test_loss: 1.0634, test_f1: 0.5160
 epoch: 9, train_loss: 0.9362, test_loss: 1.0546, test_f1: 0.5225
 epoch: 10, train_loss: 0.9202, test_loss: 1.0507, test_f1: 0.5091
 epoch: 11, train_loss: 0.9107, test_loss: 1.0493, test_f1: 0.5355
 epoch: 12, train_loss: 0.8846, test_loss: 1.0454, test_f1: 0.5458
 epoch: 13, train_loss: 0.8846, test_loss: 1.0623, test_f1: 0.5334
 epoch: 14, train_loss: 0.8687, test_loss: 1.0585, test_f1: 0.5545
 epoch: 15, train_loss: 0.8714, test_loss: 1.0547, test_f1: 0.5537
 epoch: 16, train_loss: 0.8455, test_loss: 1.0659, test_f1: 0.5484
 epoch: 17, train_loss: 0.8474, test_loss: 1.0553, test_f1: 0.5579
 epoch: 18, train_loss: 0.8312, test_loss: 1.0551, test_f1: 0.5988
 epoch: 19, train_loss: 0.8176, test_loss: 1.0663, test_f1: 0.5748
 epoch: 20, train_loss: 0.8127, test_loss: 1.0587, test_f1: 0.5718
 epoch: 21, train_loss: 0.7964, test_loss: 1.0527, test_f1: 0.5953
 epoch: 22, train_loss: 0.7825, test_loss: 1.0569, test_f1: 0.5664
 epoch: 23, train_loss: 0.7746, test_loss: 1.0622, test_f1: 0.5944
 epoch: 24, train_loss: 0.7647, test_loss: 1.0696, test_f1: 0.5653
 epoch: 25, train_loss: 0.7634, test_loss: 1.0415, test_f1: 0.6142
 epoch: 26, train_loss: 0.7530, test_loss: 1.0841, test_f1: 0.5766
 epoch: 27, train_loss: 0.7518, test_loss: 1.0686, test_f1: 0.6190
 epoch: 28, train_loss: 0.7364, test_loss: 1.0610, test_f1: 0.6060
 epoch: 29, train_loss: 0.7428, test_loss: 1.0487, test_f1: 0.5829
 epoch: 30, train_loss: 0.7186, test_loss: 1.0580, test_f1: 0.5968
 epoch: 31, train_loss: 0.7321, test_loss: 1.0985, test_f1: 0.5517
 epoch: 32, train_loss: 0.7243, test_loss: 1.0776, test_f1: 0.5541
 epoch: 33, train_loss: 0.7131, test_loss: 1.0267, test_f1: 0.6206
 epoch: 34, train_loss: 0.6983, test_loss: 1.0733, test_f1: 0.5945
 epoch: 35, train_loss: 0.6785, test_loss: 1.0730, test_f1: 0.6260
 epoch: 36, train_loss: 0.6706, test_loss: 1.0549, test_f1: 0.6035
 epoch: 37, train_loss: 0.6734, test_loss: 1.0767, test_f1: 0.5963
 epoch: 38, train_loss: 0.6660, test_loss: 1.0630, test_f1: 0.5699
 epoch: 39, train_loss: 0.6650, test_loss: 1.0702, test_f1: 0.6124
 epoch: 40, train_loss: 0.6453, test_loss: 1.0485, test_f1: 0.5880
 epoch: 41, train_loss: 0.6297, test_loss: 1.0463, test_f1: 0.6293
 epoch: 42, train_loss: 0.6514, test_loss: 1.1068, test_f1: 0.6097
 epoch: 43, train_loss: 0.6266, test_loss: 1.1070, test_f1: 0.6100
 epoch: 44, train_loss: 0.6240, test_loss: 1.0738, test_f1: 0.6327
 epoch: 45, train_loss: 0.6183, test_loss: 1.0807, test_f1: 0.6290
 epoch: 46, train_loss: 0.6227, test_loss: 1.1071, test_f1: 0.6052
 epoch: 47, train_loss: 0.6047, test_loss: 1.1036, test_f1: 0.6311
 epoch: 48, train_loss: 0.6039, test_loss: 1.1253, test_f1: 0.6222
 epoch: 49, train_loss: 0.5977, test_loss: 1.1213, test_f1: 0.5871
 epoch: 50, train_loss: 0.5972, test_loss: 1.1135, test_f1: 0.6280
 epoch: 51, train_loss: 0.5623, test_loss: 1.1065, test_f1: 0.6274
 epoch: 52, train_loss: 0.5636, test_loss: 1.1050, test_f1: 0.6314
 epoch: 53, train_loss: 0.5673, test_loss: 1.1457, test_f1: 0.6136
 epoch: 54, train_loss: 0.5532, test_loss: 1.1242, test_f1: 0.6175
 epoch: 55, train_loss: 0.5552, test_loss: 1.1850, test_f1: 0.5979
 epoch: 56, train_loss: 0.5654, test_loss: 1.1528, test_f1: 0.6112
 epoch: 57, train_loss: 0.5386, test_loss: 1.1457, test_f1: 0.6249
 epoch: 58, train_loss: 0.5208, test_loss: 1.1639, test_f1: 0.6110
 epoch: 59, train_loss: 0.5356, test_loss: 1.1469, test_f1: 0.6231
 epoch: 60, train_loss: 0.5305, test_loss: 1.1684, test_f1: 0.6209
 epoch: 61, train_loss: 0.5144, test_loss: 1.1744, test_f1: 0.5963
 epoch: 62, train_loss: 0.5162, test_loss: 1.1631, test_f1: 0.6158
 epoch: 63, train_loss: 0.5141, test_loss: 1.2010, test_f1: 0.6157
 epoch: 64, train_loss: 0.5280, test_loss: 1.1990, test_f1: 0.6036
 epoch: 65, train_loss: 0.5047, test_loss: 1.2095, test_f1: 0.6182
 epoch: 66, train_loss: 0.5180, test_loss: 1.1960, test_f1: 0.6100
 epoch: 67, train_loss: 0.4853, test_loss: 1.2465, test_f1: 0.6142
 epoch: 68, train_loss: 0.5140, test_loss: 1.2418, test_f1: 0.6255
 epoch: 69, train_loss: 0.5109, test_loss: 1.2421, test_f1: 0.6362
 epoch: 70, train_loss: 0.5113, test_loss: 1.2406, test_f1: 0.6039
 epoch: 71, train_loss: 0.5050, test_loss: 1.1958, test_f1: 0.6255
 epoch: 72, train_loss: 0.5168, test_loss: 1.2225, test_f1: 0.6282
 epoch: 73, train_loss: 0.4971, test_loss: 1.2219, test_f1: 0.6165
 epoch: 74, train_loss: 0.4743, test_loss: 1.2085, test_f1: 0.6414
 epoch: 75, train_loss: 0.5017, test_loss: 1.2480, test_f1: 0.6228
 epoch: 76, train_loss: 0.4689, test_loss: 1.2337, test_f1: 0.6217
 epoch: 77, train_loss: 0.4666, test_loss: 1.2546, test_f1: 0.6168
 epoch: 78, train_loss: 0.4788, test_loss: 1.2744, test_f1: 0.6385
 epoch: 79, train_loss: 0.4696, test_loss: 1.2317, test_f1: 0.6303
 epoch: 80, train_loss: 0.4815, test_loss: 1.2820, test_f1: 0.6163
 epoch: 81, train_loss: 0.4745, test_loss: 1.2778, test_f1: 0.6288
 epoch: 82, train_loss: 0.4517, test_loss: 1.3077, test_f1: 0.6381
 epoch: 83, train_loss: 0.4622, test_loss: 1.3175, test_f1: 0.6082
 epoch: 84, train_loss: 0.4423, test_loss: 1.2415, test_f1: 0.6411
 epoch: 85, train_loss: 0.4603, test_loss: 1.2887, test_f1: 0.6319
 epoch: 86, train_loss: 0.4676, test_loss: 1.2954, test_f1: 0.6196
 epoch: 87, train_loss: 0.4603, test_loss: 1.3510, test_f1: 0.6279
 epoch: 88, train_loss: 0.4570, test_loss: 1.3229, test_f1: 0.6010
 epoch: 89, train_loss: 0.4411, test_loss: 1.3125, test_f1: 0.6117
 epoch: 90, train_loss: 0.4439, test_loss: 1.3237, test_f1: 0.6131
 epoch: 91, train_loss: 0.4391, test_loss: 1.3374, test_f1: 0.6217
 epoch: 92, train_loss: 0.4446, test_loss: 1.3473, test_f1: 0.6115
 epoch: 93, train_loss: 0.4318, test_loss: 1.3621, test_f1: 0.6248
 epoch: 94, train_loss: 0.4126, test_loss: 1.3124, test_f1: 0.6199
 epoch: 95, train_loss: 0.4045, test_loss: 1.3969, test_f1: 0.6125
 epoch: 96, train_loss: 0.4373, test_loss: 1.3838, test_f1: 0.6272
 epoch: 97, train_loss: 0.4199, test_loss: 1.3904, test_f1: 0.6223
 epoch: 98, train_loss: 0.4283, test_loss: 1.3378, test_f1: 0.6209
 epoch: 99, train_loss: 0.4260, test_loss: 1.3567, test_f1: 0.6439
##################ITERATION #3 ****************************************
 epoch: 0, train_loss: 1.1712, test_loss: 1.2172, test_f1: 0.3654
 epoch: 1, train_loss: 1.0834, test_loss: 1.1253, test_f1: 0.4681
 epoch: 2, train_loss: 1.0382, test_loss: 1.1040, test_f1: 0.4656
 epoch: 3, train_loss: 1.0197, test_loss: 1.0841, test_f1: 0.4788
 epoch: 4, train_loss: 0.9995, test_loss: 1.0577, test_f1: 0.5009
 epoch: 5, train_loss: 0.9825, test_loss: 1.0470, test_f1: 0.4983
 epoch: 6, train_loss: 0.9727, test_loss: 1.0367, test_f1: 0.5156
 epoch: 7, train_loss: 0.9478, test_loss: 1.0394, test_f1: 0.5090
 epoch: 8, train_loss: 0.9169, test_loss: 1.0241, test_f1: 0.5203
 epoch: 9, train_loss: 0.9201, test_loss: 1.0321, test_f1: 0.5130
 epoch: 10, train_loss: 0.8984, test_loss: 1.0265, test_f1: 0.5068
 epoch: 11, train_loss: 0.8898, test_loss: 1.0332, test_f1: 0.5328
 epoch: 12, train_loss: 0.8875, test_loss: 1.0189, test_f1: 0.5283
 epoch: 13, train_loss: 0.8752, test_loss: 1.0122, test_f1: 0.5430
 epoch: 14, train_loss: 0.8652, test_loss: 1.0380, test_f1: 0.5349
 epoch: 15, train_loss: 0.8461, test_loss: 1.0161, test_f1: 0.5423
 epoch: 16, train_loss: 0.8437, test_loss: 1.0327, test_f1: 0.5776
 epoch: 17, train_loss: 0.8365, test_loss: 1.0147, test_f1: 0.5602
 epoch: 18, train_loss: 0.8221, test_loss: 1.0236, test_f1: 0.5607
 epoch: 19, train_loss: 0.8129, test_loss: 1.0207, test_f1: 0.5654
 epoch: 20, train_loss: 0.8161, test_loss: 1.0281, test_f1: 0.5827
 epoch: 21, train_loss: 0.8136, test_loss: 1.0381, test_f1: 0.5940
 epoch: 22, train_loss: 0.7927, test_loss: 1.0458, test_f1: 0.5611
 epoch: 23, train_loss: 0.7674, test_loss: 1.0379, test_f1: 0.5757
 epoch: 24, train_loss: 0.7817, test_loss: 1.0862, test_f1: 0.5864
 epoch: 25, train_loss: 0.7717, test_loss: 1.0305, test_f1: 0.5933
 epoch: 26, train_loss: 0.7643, test_loss: 1.0860, test_f1: 0.5959
 epoch: 27, train_loss: 0.7510, test_loss: 1.0760, test_f1: 0.6074
 epoch: 28, train_loss: 0.7530, test_loss: 1.0482, test_f1: 0.5982
 epoch: 29, train_loss: 0.7574, test_loss: 1.0447, test_f1: 0.5766
 epoch: 30, train_loss: 0.7372, test_loss: 1.0499, test_f1: 0.5992
 epoch: 31, train_loss: 0.7308, test_loss: 1.0701, test_f1: 0.5893
 epoch: 32, train_loss: 0.7208, test_loss: 1.0756, test_f1: 0.5959
 epoch: 33, train_loss: 0.7293, test_loss: 1.0725, test_f1: 0.6170
 epoch: 34, train_loss: 0.7358, test_loss: 1.1095, test_f1: 0.5893
 epoch: 35, train_loss: 0.7115, test_loss: 1.0636, test_f1: 0.6208
 epoch: 36, train_loss: 0.7159, test_loss: 1.0921, test_f1: 0.6014
 epoch: 37, train_loss: 0.7077, test_loss: 1.1158, test_f1: 0.6074
 epoch: 38, train_loss: 0.6983, test_loss: 1.0924, test_f1: 0.6229
 epoch: 39, train_loss: 0.6934, test_loss: 1.1331, test_f1: 0.5711
 epoch: 40, train_loss: 0.6719, test_loss: 1.1139, test_f1: 0.6112
 epoch: 41, train_loss: 0.6798, test_loss: 1.0954, test_f1: 0.6331
 epoch: 42, train_loss: 0.6647, test_loss: 1.1345, test_f1: 0.6000
 epoch: 43, train_loss: 0.6549, test_loss: 1.1405, test_f1: 0.6034
 epoch: 44, train_loss: 0.6619, test_loss: 1.1254, test_f1: 0.6103
 epoch: 45, train_loss: 0.6603, test_loss: 1.1449, test_f1: 0.6077
 epoch: 46, train_loss: 0.6506, test_loss: 1.1170, test_f1: 0.6186
 epoch: 47, train_loss: 0.6436, test_loss: 1.1700, test_f1: 0.6191
 epoch: 48, train_loss: 0.6266, test_loss: 1.1685, test_f1: 0.6428
 epoch: 49, train_loss: 0.6422, test_loss: 1.1354, test_f1: 0.6169
 epoch: 50, train_loss: 0.6298, test_loss: 1.1830, test_f1: 0.6110
 epoch: 51, train_loss: 0.6035, test_loss: 1.1447, test_f1: 0.6407
 epoch: 52, train_loss: 0.5920, test_loss: 1.1963, test_f1: 0.6271
 epoch: 53, train_loss: 0.5925, test_loss: 1.1602, test_f1: 0.6155
 epoch: 54, train_loss: 0.6125, test_loss: 1.1444, test_f1: 0.6189
 epoch: 55, train_loss: 0.5882, test_loss: 1.1605, test_f1: 0.6230
 epoch: 56, train_loss: 0.6052, test_loss: 1.1793, test_f1: 0.6313
 epoch: 57, train_loss: 0.5874, test_loss: 1.1957, test_f1: 0.6117
 epoch: 58, train_loss: 0.6039, test_loss: 1.1722, test_f1: 0.6473
 epoch: 59, train_loss: 0.5835, test_loss: 1.1935, test_f1: 0.6475
 epoch: 60, train_loss: 0.5853, test_loss: 1.1771, test_f1: 0.6479
 epoch: 61, train_loss: 0.5752, test_loss: 1.1820, test_f1: 0.6540
 epoch: 62, train_loss: 0.5932, test_loss: 1.1829, test_f1: 0.6314
 epoch: 63, train_loss: 0.5833, test_loss: 1.1858, test_f1: 0.6382
 epoch: 64, train_loss: 0.5751, test_loss: 1.1772, test_f1: 0.6440
 epoch: 65, train_loss: 0.5664, test_loss: 1.2076, test_f1: 0.6263
 epoch: 66, train_loss: 0.5493, test_loss: 1.1898, test_f1: 0.6279
 epoch: 67, train_loss: 0.5551, test_loss: 1.2387, test_f1: 0.6313
 epoch: 68, train_loss: 0.5481, test_loss: 1.2386, test_f1: 0.6283
 epoch: 69, train_loss: 0.5459, test_loss: 1.2410, test_f1: 0.6514
 epoch: 70, train_loss: 0.5536, test_loss: 1.2484, test_f1: 0.6473
 epoch: 71, train_loss: 0.5460, test_loss: 1.2173, test_f1: 0.6591
 epoch: 72, train_loss: 0.5483, test_loss: 1.2288, test_f1: 0.6453
 epoch: 73, train_loss: 0.5414, test_loss: 1.2302, test_f1: 0.6514
 epoch: 74, train_loss: 0.5469, test_loss: 1.2382, test_f1: 0.6408
 epoch: 75, train_loss: 0.5475, test_loss: 1.2818, test_f1: 0.6584
 epoch: 76, train_loss: 0.5372, test_loss: 1.2748, test_f1: 0.6044
 epoch: 77, train_loss: 0.5392, test_loss: 1.3053, test_f1: 0.6041
 epoch: 78, train_loss: 0.5354, test_loss: 1.2680, test_f1: 0.6507
 epoch: 79, train_loss: 0.5291, test_loss: 1.2853, test_f1: 0.6176
 epoch: 80, train_loss: 0.5248, test_loss: 1.2960, test_f1: 0.6074
 epoch: 81, train_loss: 0.5143, test_loss: 1.3068, test_f1: 0.6087
 epoch: 82, train_loss: 0.5190, test_loss: 1.3077, test_f1: 0.6241
 epoch: 83, train_loss: 0.5396, test_loss: 1.2946, test_f1: 0.6580
 epoch: 84, train_loss: 0.5184, test_loss: 1.3038, test_f1: 0.6321
 epoch: 85, train_loss: 0.4832, test_loss: 1.3095, test_f1: 0.6357
 epoch: 86, train_loss: 0.5220, test_loss: 1.3349, test_f1: 0.5961
 epoch: 87, train_loss: 0.5000, test_loss: 1.3485, test_f1: 0.6330
 epoch: 88, train_loss: 0.4901, test_loss: 1.3492, test_f1: 0.6438
 epoch: 89, train_loss: 0.5038, test_loss: 1.3536, test_f1: 0.6291
 epoch: 90, train_loss: 0.5001, test_loss: 1.3289, test_f1: 0.6012
 epoch: 91, train_loss: 0.5115, test_loss: 1.3696, test_f1: 0.6288
 epoch: 92, train_loss: 0.4963, test_loss: 1.3952, test_f1: 0.6072
 epoch: 93, train_loss: 0.5138, test_loss: 1.3639, test_f1: 0.6151
 epoch: 94, train_loss: 0.4929, test_loss: 1.3822, test_f1: 0.6383
 epoch: 95, train_loss: 0.4569, test_loss: 1.3882, test_f1: 0.6424
 epoch: 96, train_loss: 0.5023, test_loss: 1.4144, test_f1: 0.6274
 epoch: 97, train_loss: 0.4876, test_loss: 1.3801, test_f1: 0.6247
 epoch: 98, train_loss: 0.4821, test_loss: 1.4101, test_f1: 0.6099
 epoch: 99, train_loss: 0.5108, test_loss: 1.4188, test_f1: 0.6282
##################ITERATION #4 ****************************************
 epoch: 0, train_loss: 1.1886, test_loss: 1.1915, test_f1: 0.4244
 epoch: 1, train_loss: 1.0877, test_loss: 1.0985, test_f1: 0.4770
 epoch: 2, train_loss: 1.0311, test_loss: 1.0799, test_f1: 0.4925
 epoch: 3, train_loss: 1.0166, test_loss: 1.0603, test_f1: 0.5005
 epoch: 4, train_loss: 0.9944, test_loss: 1.0660, test_f1: 0.5119
 epoch: 5, train_loss: 0.9537, test_loss: 1.0537, test_f1: 0.5406
 epoch: 6, train_loss: 0.9680, test_loss: 1.0244, test_f1: 0.5495
 epoch: 7, train_loss: 0.9463, test_loss: 1.0332, test_f1: 0.5441
 epoch: 8, train_loss: 0.9264, test_loss: 1.0195, test_f1: 0.5571
 epoch: 9, train_loss: 0.9042, test_loss: 1.0214, test_f1: 0.5667
 epoch: 10, train_loss: 0.8862, test_loss: 1.0166, test_f1: 0.5762
 epoch: 11, train_loss: 0.8688, test_loss: 1.0246, test_f1: 0.5639
 epoch: 12, train_loss: 0.8719, test_loss: 1.0294, test_f1: 0.5631
 epoch: 13, train_loss: 0.8458, test_loss: 1.0384, test_f1: 0.5631
 epoch: 14, train_loss: 0.8539, test_loss: 0.9938, test_f1: 0.5829
 epoch: 15, train_loss: 0.8334, test_loss: 1.0027, test_f1: 0.5825
 epoch: 16, train_loss: 0.8347, test_loss: 1.0049, test_f1: 0.5837
 epoch: 17, train_loss: 0.8138, test_loss: 1.0142, test_f1: 0.6068
 epoch: 18, train_loss: 0.8102, test_loss: 0.9901, test_f1: 0.6022
 epoch: 19, train_loss: 0.7987, test_loss: 0.9920, test_f1: 0.6183
 epoch: 20, train_loss: 0.8050, test_loss: 1.0026, test_f1: 0.6346
 epoch: 21, train_loss: 0.7899, test_loss: 1.0201, test_f1: 0.6287
 epoch: 22, train_loss: 0.7788, test_loss: 0.9857, test_f1: 0.6384
 epoch: 23, train_loss: 0.7746, test_loss: 1.0026, test_f1: 0.6161
 epoch: 24, train_loss: 0.7738, test_loss: 1.0009, test_f1: 0.6134
 epoch: 25, train_loss: 0.7718, test_loss: 1.0383, test_f1: 0.6121
 epoch: 26, train_loss: 0.7403, test_loss: 1.0146, test_f1: 0.6121
 epoch: 27, train_loss: 0.7461, test_loss: 1.0110, test_f1: 0.6115
 epoch: 28, train_loss: 0.7262, test_loss: 0.9926, test_f1: 0.6350
 epoch: 29, train_loss: 0.7344, test_loss: 1.0620, test_f1: 0.6292
 epoch: 30, train_loss: 0.7254, test_loss: 1.0419, test_f1: 0.6220
 epoch: 31, train_loss: 0.6979, test_loss: 1.0732, test_f1: 0.6006
 epoch: 32, train_loss: 0.7027, test_loss: 1.0655, test_f1: 0.6127
 epoch: 33, train_loss: 0.6953, test_loss: 1.0543, test_f1: 0.6234
 epoch: 34, train_loss: 0.6836, test_loss: 1.1123, test_f1: 0.5846
 epoch: 35, train_loss: 0.6874, test_loss: 1.0689, test_f1: 0.6157
 epoch: 36, train_loss: 0.6698, test_loss: 1.1259, test_f1: 0.6137
 epoch: 37, train_loss: 0.6740, test_loss: 1.0794, test_f1: 0.5936
 epoch: 38, train_loss: 0.6521, test_loss: 1.0734, test_f1: 0.6224
 epoch: 39, train_loss: 0.6631, test_loss: 1.0747, test_f1: 0.6085
 epoch: 40, train_loss: 0.6433, test_loss: 1.0755, test_f1: 0.6236
 epoch: 41, train_loss: 0.6415, test_loss: 1.0858, test_f1: 0.6314
 epoch: 42, train_loss: 0.6365, test_loss: 1.1077, test_f1: 0.6048
 epoch: 43, train_loss: 0.6245, test_loss: 1.0969, test_f1: 0.6148
 epoch: 44, train_loss: 0.6444, test_loss: 1.1510, test_f1: 0.6125
 epoch: 45, train_loss: 0.6188, test_loss: 1.1643, test_f1: 0.6090
 epoch: 46, train_loss: 0.6267, test_loss: 1.1042, test_f1: 0.6154
 epoch: 47, train_loss: 0.6039, test_loss: 1.1486, test_f1: 0.6266
 epoch: 48, train_loss: 0.5934, test_loss: 1.1574, test_f1: 0.6203
 epoch: 49, train_loss: 0.6096, test_loss: 1.1654, test_f1: 0.6032
 epoch: 50, train_loss: 0.6016, test_loss: 1.1699, test_f1: 0.6382
 epoch: 51, train_loss: 0.5878, test_loss: 1.1585, test_f1: 0.6271
 epoch: 52, train_loss: 0.5718, test_loss: 1.1793, test_f1: 0.6362
 epoch: 53, train_loss: 0.5804, test_loss: 1.2034, test_f1: 0.6246
 epoch: 54, train_loss: 0.5809, test_loss: 1.2071, test_f1: 0.6465
 epoch: 55, train_loss: 0.5675, test_loss: 1.1815, test_f1: 0.6474
 epoch: 56, train_loss: 0.5651, test_loss: 1.1751, test_f1: 0.6138
 epoch: 57, train_loss: 0.5532, test_loss: 1.2083, test_f1: 0.6252
 epoch: 58, train_loss: 0.5681, test_loss: 1.2335, test_f1: 0.6207
 epoch: 59, train_loss: 0.5625, test_loss: 1.2141, test_f1: 0.6287
 epoch: 60, train_loss: 0.5500, test_loss: 1.2177, test_f1: 0.6293
 epoch: 61, train_loss: 0.5479, test_loss: 1.2118, test_f1: 0.6165
 epoch: 62, train_loss: 0.5337, test_loss: 1.2105, test_f1: 0.6337
 epoch: 63, train_loss: 0.5422, test_loss: 1.2211, test_f1: 0.6176
 epoch: 64, train_loss: 0.5388, test_loss: 1.1930, test_f1: 0.6264
 epoch: 65, train_loss: 0.5447, test_loss: 1.2212, test_f1: 0.6426
 epoch: 66, train_loss: 0.5322, test_loss: 1.2383, test_f1: 0.6355
 epoch: 67, train_loss: 0.5260, test_loss: 1.2585, test_f1: 0.6342
 epoch: 68, train_loss: 0.5430, test_loss: 1.2557, test_f1: 0.6343
 epoch: 69, train_loss: 0.5177, test_loss: 1.2746, test_f1: 0.6256
 epoch: 70, train_loss: 0.5060, test_loss: 1.2916, test_f1: 0.6315
 epoch: 71, train_loss: 0.5048, test_loss: 1.2323, test_f1: 0.6653
 epoch: 72, train_loss: 0.4903, test_loss: 1.2804, test_f1: 0.6296
 epoch: 73, train_loss: 0.5145, test_loss: 1.2528, test_f1: 0.6450
 epoch: 74, train_loss: 0.5221, test_loss: 1.2713, test_f1: 0.6569
 epoch: 75, train_loss: 0.5081, test_loss: 1.3402, test_f1: 0.6488
 epoch: 76, train_loss: 0.5171, test_loss: 1.2874, test_f1: 0.6409
 epoch: 77, train_loss: 0.5215, test_loss: 1.2923, test_f1: 0.6282
 epoch: 78, train_loss: 0.4931, test_loss: 1.2816, test_f1: 0.6415
 epoch: 79, train_loss: 0.4714, test_loss: 1.3694, test_f1: 0.6333
 epoch: 80, train_loss: 0.4749, test_loss: 1.3144, test_f1: 0.6443
 epoch: 81, train_loss: 0.4917, test_loss: 1.3427, test_f1: 0.6397
 epoch: 82, train_loss: 0.4841, test_loss: 1.3588, test_f1: 0.6499
 epoch: 83, train_loss: 0.5049, test_loss: 1.3427, test_f1: 0.6343
 epoch: 84, train_loss: 0.4883, test_loss: 1.2779, test_f1: 0.6499
 epoch: 85, train_loss: 0.4838, test_loss: 1.3436, test_f1: 0.6436
 epoch: 86, train_loss: 0.4803, test_loss: 1.3356, test_f1: 0.6357
 epoch: 87, train_loss: 0.5065, test_loss: 1.3493, test_f1: 0.6466
 epoch: 88, train_loss: 0.4740, test_loss: 1.3682, test_f1: 0.6447
 epoch: 89, train_loss: 0.4804, test_loss: 1.3316, test_f1: 0.6517
 epoch: 90, train_loss: 0.4366, test_loss: 1.3705, test_f1: 0.6376
 epoch: 91, train_loss: 0.4732, test_loss: 1.3761, test_f1: 0.6446
 epoch: 92, train_loss: 0.4727, test_loss: 1.3229, test_f1: 0.6394
 epoch: 93, train_loss: 0.4715, test_loss: 1.3549, test_f1: 0.6366
 epoch: 94, train_loss: 0.4622, test_loss: 1.3362, test_f1: 0.6523
 epoch: 95, train_loss: 0.4443, test_loss: 1.3821, test_f1: 0.6754
 epoch: 96, train_loss: 0.4612, test_loss: 1.3686, test_f1: 0.6634
 epoch: 97, train_loss: 0.4559, test_loss: 1.4482, test_f1: 0.6447
 epoch: 98, train_loss: 0.4523, test_loss: 1.3487, test_f1: 0.6615
 epoch: 99, train_loss: 0.4541, test_loss: 1.4017, test_f1: 0.6595
##################ITERATION #5 ****************************************
 epoch: 0, train_loss: 1.2007, test_loss: 1.2032, test_f1: 0.4550
 epoch: 1, train_loss: 1.1080, test_loss: 1.1385, test_f1: 0.4939
 epoch: 2, train_loss: 1.0652, test_loss: 1.1209, test_f1: 0.4900
 epoch: 3, train_loss: 1.0294, test_loss: 1.1024, test_f1: 0.4807
 epoch: 4, train_loss: 0.9946, test_loss: 1.1047, test_f1: 0.4875
 epoch: 5, train_loss: 0.9947, test_loss: 1.1032, test_f1: 0.5090
 epoch: 6, train_loss: 0.9749, test_loss: 1.0818, test_f1: 0.5069
 epoch: 7, train_loss: 0.9474, test_loss: 1.0612, test_f1: 0.5229
 epoch: 8, train_loss: 0.9479, test_loss: 1.0610, test_f1: 0.5045
 epoch: 9, train_loss: 0.9220, test_loss: 1.0404, test_f1: 0.5457
 epoch: 10, train_loss: 0.9134, test_loss: 1.0400, test_f1: 0.5395
 epoch: 11, train_loss: 0.9138, test_loss: 1.0427, test_f1: 0.5518
 epoch: 12, train_loss: 0.8981, test_loss: 1.0494, test_f1: 0.5518
 epoch: 13, train_loss: 0.8652, test_loss: 1.0098, test_f1: 0.5871
 epoch: 14, train_loss: 0.8632, test_loss: 1.0239, test_f1: 0.5571
 epoch: 15, train_loss: 0.8603, test_loss: 1.0170, test_f1: 0.5814
 epoch: 16, train_loss: 0.8496, test_loss: 1.0326, test_f1: 0.5375
 epoch: 17, train_loss: 0.8422, test_loss: 1.0169, test_f1: 0.5739
 epoch: 18, train_loss: 0.8394, test_loss: 1.0257, test_f1: 0.5745
 epoch: 19, train_loss: 0.8290, test_loss: 1.0184, test_f1: 0.5791
 epoch: 20, train_loss: 0.8115, test_loss: 1.0440, test_f1: 0.5918
 epoch: 21, train_loss: 0.8201, test_loss: 1.0249, test_f1: 0.5725
 epoch: 22, train_loss: 0.8066, test_loss: 1.0406, test_f1: 0.5785
 epoch: 23, train_loss: 0.7814, test_loss: 1.0362, test_f1: 0.5807
 epoch: 24, train_loss: 0.8051, test_loss: 1.0410, test_f1: 0.6048
 epoch: 25, train_loss: 0.7898, test_loss: 1.0242, test_f1: 0.6283
 epoch: 26, train_loss: 0.7930, test_loss: 1.0272, test_f1: 0.6052
 epoch: 27, train_loss: 0.7693, test_loss: 1.0510, test_f1: 0.5920
 epoch: 28, train_loss: 0.7721, test_loss: 1.0011, test_f1: 0.6134
 epoch: 29, train_loss: 0.7588, test_loss: 1.0325, test_f1: 0.6058
 epoch: 30, train_loss: 0.7498, test_loss: 1.0491, test_f1: 0.6176
 epoch: 31, train_loss: 0.7354, test_loss: 1.0652, test_f1: 0.5919
 epoch: 32, train_loss: 0.7346, test_loss: 1.0428, test_f1: 0.6165
 epoch: 33, train_loss: 0.7257, test_loss: 1.0365, test_f1: 0.6269
 epoch: 34, train_loss: 0.7111, test_loss: 1.0259, test_f1: 0.5940
 epoch: 35, train_loss: 0.7146, test_loss: 1.0443, test_f1: 0.6102
 epoch: 36, train_loss: 0.6944, test_loss: 1.0507, test_f1: 0.5959
 epoch: 37, train_loss: 0.7074, test_loss: 1.0341, test_f1: 0.5928
 epoch: 38, train_loss: 0.6848, test_loss: 1.0274, test_f1: 0.6267
 epoch: 39, train_loss: 0.6966, test_loss: 1.0568, test_f1: 0.6232
 epoch: 40, train_loss: 0.6601, test_loss: 1.0543, test_f1: 0.6578
 epoch: 41, train_loss: 0.6810, test_loss: 1.0883, test_f1: 0.6097
 epoch: 42, train_loss: 0.6769, test_loss: 1.0455, test_f1: 0.6003
 epoch: 43, train_loss: 0.6637, test_loss: 1.1095, test_f1: 0.6107
 epoch: 44, train_loss: 0.6707, test_loss: 1.0692, test_f1: 0.6318
 epoch: 45, train_loss: 0.6752, test_loss: 1.0913, test_f1: 0.6029
 epoch: 46, train_loss: 0.6477, test_loss: 1.1474, test_f1: 0.6112
 epoch: 47, train_loss: 0.6364, test_loss: 1.1219, test_f1: 0.6040
 epoch: 48, train_loss: 0.6351, test_loss: 1.2117, test_f1: 0.5936
 epoch: 49, train_loss: 0.6383, test_loss: 1.2008, test_f1: 0.6260
 epoch: 50, train_loss: 0.6334, test_loss: 1.2055, test_f1: 0.5757
 epoch: 51, train_loss: 0.6194, test_loss: 1.1826, test_f1: 0.5971
 epoch: 52, train_loss: 0.6121, test_loss: 1.2268, test_f1: 0.5970
 epoch: 53, train_loss: 0.6031, test_loss: 1.2115, test_f1: 0.6004
 epoch: 54, train_loss: 0.6037, test_loss: 1.1926, test_f1: 0.6212
 epoch: 55, train_loss: 0.5996, test_loss: 1.2072, test_f1: 0.5949
 epoch: 56, train_loss: 0.5932, test_loss: 1.2062, test_f1: 0.6407
 epoch: 57, train_loss: 0.5980, test_loss: 1.1794, test_f1: 0.6024
 epoch: 58, train_loss: 0.5851, test_loss: 1.2334, test_f1: 0.6157
 epoch: 59, train_loss: 0.5826, test_loss: 1.2295, test_f1: 0.6138
 epoch: 60, train_loss: 0.5831, test_loss: 1.2715, test_f1: 0.6178
 epoch: 61, train_loss: 0.5752, test_loss: 1.2044, test_f1: 0.6133
 epoch: 62, train_loss: 0.5703, test_loss: 1.2392, test_f1: 0.5986
 epoch: 63, train_loss: 0.5769, test_loss: 1.1803, test_f1: 0.6053
 epoch: 64, train_loss: 0.5601, test_loss: 1.2732, test_f1: 0.5950
 epoch: 65, train_loss: 0.5736, test_loss: 1.2530, test_f1: 0.6068
 epoch: 66, train_loss: 0.5639, test_loss: 1.2109, test_f1: 0.5994
 epoch: 67, train_loss: 0.5551, test_loss: 1.2281, test_f1: 0.6060
 epoch: 68, train_loss: 0.5531, test_loss: 1.2607, test_f1: 0.5842
 epoch: 69, train_loss: 0.5521, test_loss: 1.2702, test_f1: 0.6020
 epoch: 70, train_loss: 0.5540, test_loss: 1.2731, test_f1: 0.6180
 epoch: 71, train_loss: 0.5439, test_loss: 1.3242, test_f1: 0.5999
 epoch: 72, train_loss: 0.5595, test_loss: 1.2261, test_f1: 0.5976
 epoch: 73, train_loss: 0.5532, test_loss: 1.2250, test_f1: 0.5957
 epoch: 74, train_loss: 0.5464, test_loss: 1.2828, test_f1: 0.6050
 epoch: 75, train_loss: 0.5271, test_loss: 1.2827, test_f1: 0.5975
 epoch: 76, train_loss: 0.5378, test_loss: 1.2891, test_f1: 0.6325
 epoch: 77, train_loss: 0.5363, test_loss: 1.3039, test_f1: 0.6110
 epoch: 78, train_loss: 0.5344, test_loss: 1.2818, test_f1: 0.6004
 epoch: 79, train_loss: 0.5410, test_loss: 1.2862, test_f1: 0.6027
 epoch: 80, train_loss: 0.5303, test_loss: 1.3467, test_f1: 0.5915
 epoch: 81, train_loss: 0.5328, test_loss: 1.3228, test_f1: 0.5996
 epoch: 82, train_loss: 0.5378, test_loss: 1.2916, test_f1: 0.6076
 epoch: 83, train_loss: 0.5299, test_loss: 1.3044, test_f1: 0.6049
 epoch: 84, train_loss: 0.5124, test_loss: 1.3224, test_f1: 0.6136
 epoch: 85, train_loss: 0.5039, test_loss: 1.3732, test_f1: 0.6101
 epoch: 86, train_loss: 0.5159, test_loss: 1.3401, test_f1: 0.6317
 epoch: 87, train_loss: 0.5126, test_loss: 1.3403, test_f1: 0.5866
 epoch: 88, train_loss: 0.5049, test_loss: 1.3500, test_f1: 0.6081
 epoch: 89, train_loss: 0.5201, test_loss: 1.3313, test_f1: 0.6189
 epoch: 90, train_loss: 0.5011, test_loss: 1.3451, test_f1: 0.5977
 epoch: 91, train_loss: 0.4978, test_loss: 1.3671, test_f1: 0.5853
 epoch: 92, train_loss: 0.4879, test_loss: 1.4061, test_f1: 0.5952
 epoch: 93, train_loss: 0.5041, test_loss: 1.3737, test_f1: 0.5997
 epoch: 94, train_loss: 0.5010, test_loss: 1.4191, test_f1: 0.6022
 epoch: 95, train_loss: 0.4793, test_loss: 1.4564, test_f1: 0.6230
 epoch: 96, train_loss: 0.4947, test_loss: 1.4149, test_f1: 0.6079
 epoch: 97, train_loss: 0.4910, test_loss: 1.4411, test_f1: 0.6210
 epoch: 98, train_loss: 0.4797, test_loss: 1.4209, test_f1: 0.6236
 epoch: 99, train_loss: 0.4728, test_loss: 1.4624, test_f1: 0.6023
##################ITERATION #6 ****************************************
 epoch: 0, train_loss: 1.2417, test_loss: 1.2199, test_f1: 0.3244
 epoch: 1, train_loss: 1.0918, test_loss: 1.1565, test_f1: 0.4724
 epoch: 2, train_loss: 1.0496, test_loss: 1.1318, test_f1: 0.4593
 epoch: 3, train_loss: 1.0314, test_loss: 1.1242, test_f1: 0.5043
 epoch: 4, train_loss: 1.0025, test_loss: 1.1164, test_f1: 0.4839
 epoch: 5, train_loss: 0.9919, test_loss: 1.1020, test_f1: 0.4920
 epoch: 6, train_loss: 0.9727, test_loss: 1.0753, test_f1: 0.5107
 epoch: 7, train_loss: 0.9384, test_loss: 1.0832, test_f1: 0.5237
 epoch: 8, train_loss: 0.9240, test_loss: 1.0550, test_f1: 0.5148
 epoch: 9, train_loss: 0.9180, test_loss: 1.0661, test_f1: 0.5174
 epoch: 10, train_loss: 0.9102, test_loss: 1.0645, test_f1: 0.5407
 epoch: 11, train_loss: 0.8970, test_loss: 1.0441, test_f1: 0.5504
 epoch: 12, train_loss: 0.8828, test_loss: 1.0408, test_f1: 0.5730
 epoch: 13, train_loss: 0.8790, test_loss: 1.0463, test_f1: 0.5654
 epoch: 14, train_loss: 0.8657, test_loss: 1.0471, test_f1: 0.5753
 epoch: 15, train_loss: 0.8501, test_loss: 1.0424, test_f1: 0.5887
 epoch: 16, train_loss: 0.8585, test_loss: 1.0362, test_f1: 0.5901
 epoch: 17, train_loss: 0.8295, test_loss: 1.0382, test_f1: 0.5372
 epoch: 18, train_loss: 0.8265, test_loss: 1.0168, test_f1: 0.6105
 epoch: 19, train_loss: 0.8238, test_loss: 0.9949, test_f1: 0.6074
 epoch: 20, train_loss: 0.8187, test_loss: 1.0258, test_f1: 0.6194
 epoch: 21, train_loss: 0.7931, test_loss: 1.0265, test_f1: 0.6054
 epoch: 22, train_loss: 0.7998, test_loss: 1.0089, test_f1: 0.6052
 epoch: 23, train_loss: 0.7979, test_loss: 1.0181, test_f1: 0.6456
 epoch: 24, train_loss: 0.7705, test_loss: 1.0356, test_f1: 0.6276
 epoch: 25, train_loss: 0.7654, test_loss: 1.0299, test_f1: 0.5940
 epoch: 26, train_loss: 0.7612, test_loss: 1.0155, test_f1: 0.6327
 epoch: 27, train_loss: 0.7543, test_loss: 1.0143, test_f1: 0.6103
 epoch: 28, train_loss: 0.7474, test_loss: 1.0072, test_f1: 0.6191
 epoch: 29, train_loss: 0.7460, test_loss: 1.0259, test_f1: 0.5968
 epoch: 30, train_loss: 0.7277, test_loss: 1.0272, test_f1: 0.6149
 epoch: 31, train_loss: 0.7316, test_loss: 1.0272, test_f1: 0.6475
 epoch: 32, train_loss: 0.7204, test_loss: 1.0210, test_f1: 0.6390
 epoch: 33, train_loss: 0.7201, test_loss: 1.0312, test_f1: 0.5993
 epoch: 34, train_loss: 0.7101, test_loss: 1.0484, test_f1: 0.6305
 epoch: 35, train_loss: 0.7142, test_loss: 1.0716, test_f1: 0.5978
 epoch: 36, train_loss: 0.6943, test_loss: 1.0676, test_f1: 0.5986
 epoch: 37, train_loss: 0.7139, test_loss: 1.0352, test_f1: 0.6505
 epoch: 38, train_loss: 0.6847, test_loss: 1.0554, test_f1: 0.6153
 epoch: 39, train_loss: 0.6988, test_loss: 1.0570, test_f1: 0.5998
 epoch: 40, train_loss: 0.6614, test_loss: 1.0433, test_f1: 0.6352
 epoch: 41, train_loss: 0.6564, test_loss: 1.0415, test_f1: 0.6345
 epoch: 42, train_loss: 0.6775, test_loss: 1.0567, test_f1: 0.6205
 epoch: 43, train_loss: 0.6504, test_loss: 1.0601, test_f1: 0.6397
 epoch: 44, train_loss: 0.6379, test_loss: 1.0436, test_f1: 0.6510
 epoch: 45, train_loss: 0.6517, test_loss: 1.0839, test_f1: 0.6341
 epoch: 46, train_loss: 0.6253, test_loss: 1.1122, test_f1: 0.6253
 epoch: 47, train_loss: 0.6244, test_loss: 1.0642, test_f1: 0.6419
 epoch: 48, train_loss: 0.6446, test_loss: 1.1021, test_f1: 0.6449
 epoch: 49, train_loss: 0.6316, test_loss: 1.1020, test_f1: 0.6453
 epoch: 50, train_loss: 0.6092, test_loss: 1.0796, test_f1: 0.6382
 epoch: 51, train_loss: 0.5975, test_loss: 1.0925, test_f1: 0.6580
 epoch: 52, train_loss: 0.5838, test_loss: 1.1053, test_f1: 0.6557
 epoch: 53, train_loss: 0.5883, test_loss: 1.1254, test_f1: 0.6479
 epoch: 54, train_loss: 0.5948, test_loss: 1.1267, test_f1: 0.6558
 epoch: 55, train_loss: 0.5744, test_loss: 1.1030, test_f1: 0.6422
 epoch: 56, train_loss: 0.5935, test_loss: 1.1248, test_f1: 0.6426
 epoch: 57, train_loss: 0.5756, test_loss: 1.1221, test_f1: 0.6423
 epoch: 58, train_loss: 0.5751, test_loss: 1.1320, test_f1: 0.6503
 epoch: 59, train_loss: 0.5638, test_loss: 1.1389, test_f1: 0.6745
 epoch: 60, train_loss: 0.5745, test_loss: 1.1513, test_f1: 0.6551
 epoch: 61, train_loss: 0.5798, test_loss: 1.1661, test_f1: 0.6484
 epoch: 62, train_loss: 0.5568, test_loss: 1.1635, test_f1: 0.6342
 epoch: 63, train_loss: 0.5675, test_loss: 1.1744, test_f1: 0.6240
 epoch: 64, train_loss: 0.5464, test_loss: 1.1880, test_f1: 0.6359
 epoch: 65, train_loss: 0.5530, test_loss: 1.1896, test_f1: 0.6313
 epoch: 66, train_loss: 0.5416, test_loss: 1.2056, test_f1: 0.6103
 epoch: 67, train_loss: 0.5552, test_loss: 1.1938, test_f1: 0.5991
 epoch: 68, train_loss: 0.5576, test_loss: 1.1914, test_f1: 0.6287
 epoch: 69, train_loss: 0.5437, test_loss: 1.1848, test_f1: 0.6419
 epoch: 70, train_loss: 0.5539, test_loss: 1.1916, test_f1: 0.6512
 epoch: 71, train_loss: 0.5208, test_loss: 1.2193, test_f1: 0.6379
 epoch: 72, train_loss: 0.5422, test_loss: 1.2305, test_f1: 0.6233
 epoch: 73, train_loss: 0.5439, test_loss: 1.2232, test_f1: 0.6484
 epoch: 74, train_loss: 0.5075, test_loss: 1.2157, test_f1: 0.6333
 epoch: 75, train_loss: 0.5351, test_loss: 1.2518, test_f1: 0.6059
 epoch: 76, train_loss: 0.5313, test_loss: 1.2180, test_f1: 0.6242
 epoch: 77, train_loss: 0.5188, test_loss: 1.2510, test_f1: 0.6187
 epoch: 78, train_loss: 0.5104, test_loss: 1.2403, test_f1: 0.6398
 epoch: 79, train_loss: 0.4915, test_loss: 1.2597, test_f1: 0.6456
 epoch: 80, train_loss: 0.4965, test_loss: 1.2590, test_f1: 0.6191
 epoch: 81, train_loss: 0.5195, test_loss: 1.2795, test_f1: 0.6281
 epoch: 82, train_loss: 0.5038, test_loss: 1.2957, test_f1: 0.6272
 epoch: 83, train_loss: 0.5059, test_loss: 1.2798, test_f1: 0.6461
 epoch: 84, train_loss: 0.4881, test_loss: 1.2792, test_f1: 0.6167
 epoch: 85, train_loss: 0.4819, test_loss: 1.2509, test_f1: 0.6330
 epoch: 86, train_loss: 0.5006, test_loss: 1.2507, test_f1: 0.6482
 epoch: 87, train_loss: 0.5142, test_loss: 1.3087, test_f1: 0.6252
 epoch: 88, train_loss: 0.5036, test_loss: 1.2808, test_f1: 0.6288
 epoch: 89, train_loss: 0.4774, test_loss: 1.2969, test_f1: 0.6362
 epoch: 90, train_loss: 0.4733, test_loss: 1.3077, test_f1: 0.6223
 epoch: 91, train_loss: 0.4738, test_loss: 1.3020, test_f1: 0.6191
 epoch: 92, train_loss: 0.4891, test_loss: 1.3126, test_f1: 0.6332
 epoch: 93, train_loss: 0.4713, test_loss: 1.3550, test_f1: 0.6314
 epoch: 94, train_loss: 0.4758, test_loss: 1.3699, test_f1: 0.6602
 epoch: 95, train_loss: 0.4828, test_loss: 1.3483, test_f1: 0.6304
 epoch: 96, train_loss: 0.4665, test_loss: 1.3670, test_f1: 0.6359
 epoch: 97, train_loss: 0.4702, test_loss: 1.3543, test_f1: 0.6328
 epoch: 98, train_loss: 0.4785, test_loss: 1.3815, test_f1: 0.6735
 epoch: 99, train_loss: 0.4732, test_loss: 1.4177, test_f1: 0.6193
##################ITERATION #7 ****************************************
 epoch: 0, train_loss: 1.2775, test_loss: 1.2246, test_f1: 0.3758
 epoch: 1, train_loss: 1.1036, test_loss: 1.1663, test_f1: 0.4825
 epoch: 2, train_loss: 1.0508, test_loss: 1.1315, test_f1: 0.5200
 epoch: 3, train_loss: 1.0290, test_loss: 1.1264, test_f1: 0.5039
 epoch: 4, train_loss: 1.0338, test_loss: 1.1242, test_f1: 0.5162
 epoch: 5, train_loss: 0.9776, test_loss: 1.1189, test_f1: 0.5353
 epoch: 6, train_loss: 0.9876, test_loss: 1.1110, test_f1: 0.5527
 epoch: 7, train_loss: 0.9524, test_loss: 1.0850, test_f1: 0.5603
 epoch: 8, train_loss: 0.9520, test_loss: 1.0803, test_f1: 0.5602
 epoch: 9, train_loss: 0.9381, test_loss: 1.0915, test_f1: 0.5461
 epoch: 10, train_loss: 0.9265, test_loss: 1.0581, test_f1: 0.5607
 epoch: 11, train_loss: 0.9195, test_loss: 1.0558, test_f1: 0.5622
 epoch: 12, train_loss: 0.9065, test_loss: 1.0662, test_f1: 0.5362
 epoch: 13, train_loss: 0.8865, test_loss: 1.0651, test_f1: 0.5552
 epoch: 14, train_loss: 0.8643, test_loss: 1.0439, test_f1: 0.5341
 epoch: 15, train_loss: 0.8641, test_loss: 1.0491, test_f1: 0.5327
 epoch: 16, train_loss: 0.8704, test_loss: 1.0341, test_f1: 0.5770
 epoch: 17, train_loss: 0.8472, test_loss: 1.0260, test_f1: 0.5767
 epoch: 18, train_loss: 0.8539, test_loss: 1.0176, test_f1: 0.5717
 epoch: 19, train_loss: 0.8325, test_loss: 1.0249, test_f1: 0.5782
 epoch: 20, train_loss: 0.8380, test_loss: 1.0246, test_f1: 0.5651
 epoch: 21, train_loss: 0.8206, test_loss: 1.0362, test_f1: 0.5694
 epoch: 22, train_loss: 0.8333, test_loss: 1.0130, test_f1: 0.5653
 epoch: 23, train_loss: 0.8098, test_loss: 1.0021, test_f1: 0.5736
 epoch: 24, train_loss: 0.8007, test_loss: 1.0298, test_f1: 0.5660
 epoch: 25, train_loss: 0.8005, test_loss: 0.9792, test_f1: 0.5940
 epoch: 26, train_loss: 0.8089, test_loss: 0.9733, test_f1: 0.6167
 epoch: 27, train_loss: 0.7743, test_loss: 1.0050, test_f1: 0.6145
 epoch: 28, train_loss: 0.7867, test_loss: 1.0113, test_f1: 0.6102
 epoch: 29, train_loss: 0.7704, test_loss: 1.0132, test_f1: 0.6044
 epoch: 30, train_loss: 0.7801, test_loss: 1.0198, test_f1: 0.5954
 epoch: 31, train_loss: 0.7663, test_loss: 1.0209, test_f1: 0.5933
 epoch: 32, train_loss: 0.7643, test_loss: 1.0058, test_f1: 0.6256
 epoch: 33, train_loss: 0.7519, test_loss: 1.0259, test_f1: 0.5996
 epoch: 34, train_loss: 0.7385, test_loss: 1.0488, test_f1: 0.6323
 epoch: 35, train_loss: 0.7179, test_loss: 1.0329, test_f1: 0.6268
 epoch: 36, train_loss: 0.7365, test_loss: 1.0075, test_f1: 0.6125
 epoch: 37, train_loss: 0.7199, test_loss: 1.0144, test_f1: 0.6144
 epoch: 38, train_loss: 0.7237, test_loss: 1.0106, test_f1: 0.6413
 epoch: 39, train_loss: 0.7318, test_loss: 1.0525, test_f1: 0.6205
 epoch: 40, train_loss: 0.7055, test_loss: 1.0513, test_f1: 0.6001
 epoch: 41, train_loss: 0.6889, test_loss: 1.0390, test_f1: 0.6194
 epoch: 42, train_loss: 0.6921, test_loss: 1.0459, test_f1: 0.6161
 epoch: 43, train_loss: 0.6894, test_loss: 1.0008, test_f1: 0.6176
 epoch: 44, train_loss: 0.6749, test_loss: 1.0373, test_f1: 0.6241
 epoch: 45, train_loss: 0.6770, test_loss: 1.0351, test_f1: 0.6316
 epoch: 46, train_loss: 0.6458, test_loss: 1.0494, test_f1: 0.6373
 epoch: 47, train_loss: 0.6649, test_loss: 1.0861, test_f1: 0.6206
 epoch: 48, train_loss: 0.6461, test_loss: 1.0618, test_f1: 0.6274
 epoch: 49, train_loss: 0.6387, test_loss: 1.0991, test_f1: 0.6165
 epoch: 50, train_loss: 0.6233, test_loss: 1.0417, test_f1: 0.6117
 epoch: 51, train_loss: 0.6258, test_loss: 1.0427, test_f1: 0.6377
 epoch: 52, train_loss: 0.6292, test_loss: 1.0850, test_f1: 0.6219
 epoch: 53, train_loss: 0.6062, test_loss: 1.1091, test_f1: 0.6219
 epoch: 54, train_loss: 0.6057, test_loss: 1.1185, test_f1: 0.6189
 epoch: 55, train_loss: 0.6072, test_loss: 1.0944, test_f1: 0.6145
 epoch: 56, train_loss: 0.6045, test_loss: 1.0979, test_f1: 0.6222
 epoch: 57, train_loss: 0.5909, test_loss: 1.1313, test_f1: 0.6068
 epoch: 58, train_loss: 0.5995, test_loss: 1.1277, test_f1: 0.6241
 epoch: 59, train_loss: 0.5838, test_loss: 1.1533, test_f1: 0.6089
 epoch: 60, train_loss: 0.5979, test_loss: 1.1309, test_f1: 0.6240
 epoch: 61, train_loss: 0.5899, test_loss: 1.1374, test_f1: 0.6113
 epoch: 62, train_loss: 0.5846, test_loss: 1.1426, test_f1: 0.6093
 epoch: 63, train_loss: 0.5935, test_loss: 1.1414, test_f1: 0.6091
 epoch: 64, train_loss: 0.5971, test_loss: 1.1136, test_f1: 0.6144
 epoch: 65, train_loss: 0.5696, test_loss: 1.1522, test_f1: 0.6324
 epoch: 66, train_loss: 0.5673, test_loss: 1.1356, test_f1: 0.6120
 epoch: 67, train_loss: 0.5795, test_loss: 1.1332, test_f1: 0.6114
 epoch: 68, train_loss: 0.5740, test_loss: 1.1641, test_f1: 0.6237
 epoch: 69, train_loss: 0.5776, test_loss: 1.2230, test_f1: 0.6330
 epoch: 70, train_loss: 0.5878, test_loss: 1.1643, test_f1: 0.6275
 epoch: 71, train_loss: 0.5729, test_loss: 1.1905, test_f1: 0.6148
 epoch: 72, train_loss: 0.5552, test_loss: 1.2089, test_f1: 0.6306
 epoch: 73, train_loss: 0.5623, test_loss: 1.1764, test_f1: 0.6244
 epoch: 74, train_loss: 0.5457, test_loss: 1.2282, test_f1: 0.6135
 epoch: 75, train_loss: 0.5727, test_loss: 1.2189, test_f1: 0.6104
 epoch: 76, train_loss: 0.5568, test_loss: 1.2280, test_f1: 0.6137
 epoch: 77, train_loss: 0.5404, test_loss: 1.2238, test_f1: 0.6081
 epoch: 78, train_loss: 0.5508, test_loss: 1.2389, test_f1: 0.6221
 epoch: 79, train_loss: 0.5664, test_loss: 1.2051, test_f1: 0.6265
 epoch: 80, train_loss: 0.5550, test_loss: 1.2601, test_f1: 0.6121
 epoch: 81, train_loss: 0.5431, test_loss: 1.2177, test_f1: 0.6069
 epoch: 82, train_loss: 0.5372, test_loss: 1.2595, test_f1: 0.6044
 epoch: 83, train_loss: 0.5262, test_loss: 1.2775, test_f1: 0.6196
 epoch: 84, train_loss: 0.5219, test_loss: 1.2649, test_f1: 0.6214
 epoch: 85, train_loss: 0.5279, test_loss: 1.2151, test_f1: 0.6251
 epoch: 86, train_loss: 0.5410, test_loss: 1.2387, test_f1: 0.6172
 epoch: 87, train_loss: 0.5110, test_loss: 1.2451, test_f1: 0.6091
 epoch: 88, train_loss: 0.5198, test_loss: 1.2331, test_f1: 0.6415
 epoch: 89, train_loss: 0.5103, test_loss: 1.2512, test_f1: 0.6139
 epoch: 90, train_loss: 0.5084, test_loss: 1.2539, test_f1: 0.6336
 epoch: 91, train_loss: 0.5153, test_loss: 1.3368, test_f1: 0.6170
 epoch: 92, train_loss: 0.5122, test_loss: 1.2644, test_f1: 0.6421
 epoch: 93, train_loss: 0.4958, test_loss: 1.3399, test_f1: 0.6317
 epoch: 94, train_loss: 0.5035, test_loss: 1.3144, test_f1: 0.6323
 epoch: 95, train_loss: 0.4972, test_loss: 1.3274, test_f1: 0.5917
 epoch: 96, train_loss: 0.5043, test_loss: 1.3595, test_f1: 0.5985
 epoch: 97, train_loss: 0.4965, test_loss: 1.3506, test_f1: 0.6224
 epoch: 98, train_loss: 0.4917, test_loss: 1.3147, test_f1: 0.6399
 epoch: 99, train_loss: 0.4926, test_loss: 1.3254, test_f1: 0.6360
##################ITERATION #8 ****************************************
 epoch: 0, train_loss: 1.2870, test_loss: 1.2037, test_f1: 0.4113
 epoch: 1, train_loss: 1.1164, test_loss: 1.1114, test_f1: 0.5176
 epoch: 2, train_loss: 1.0876, test_loss: 1.1119, test_f1: 0.5372
 epoch: 3, train_loss: 1.0479, test_loss: 1.0924, test_f1: 0.5331
 epoch: 4, train_loss: 1.0222, test_loss: 1.0774, test_f1: 0.5315
 epoch: 5, train_loss: 1.0040, test_loss: 1.0624, test_f1: 0.5465
 epoch: 6, train_loss: 0.9785, test_loss: 1.0502, test_f1: 0.5587
 epoch: 7, train_loss: 0.9538, test_loss: 1.0482, test_f1: 0.5632
 epoch: 8, train_loss: 0.9427, test_loss: 1.0367, test_f1: 0.5733
 epoch: 9, train_loss: 0.9401, test_loss: 1.0290, test_f1: 0.5825
 epoch: 10, train_loss: 0.9116, test_loss: 1.0339, test_f1: 0.5999
 epoch: 11, train_loss: 0.9044, test_loss: 1.0297, test_f1: 0.6040
 epoch: 12, train_loss: 0.9009, test_loss: 1.0104, test_f1: 0.6171
 epoch: 13, train_loss: 0.8791, test_loss: 1.0170, test_f1: 0.6031
 epoch: 14, train_loss: 0.8731, test_loss: 1.0214, test_f1: 0.6078
 epoch: 15, train_loss: 0.8473, test_loss: 1.0207, test_f1: 0.6241
 epoch: 16, train_loss: 0.8570, test_loss: 1.0345, test_f1: 0.6031
 epoch: 17, train_loss: 0.8291, test_loss: 1.0135, test_f1: 0.6117
 epoch: 18, train_loss: 0.8345, test_loss: 1.0185, test_f1: 0.6342
 epoch: 19, train_loss: 0.8171, test_loss: 1.0198, test_f1: 0.6399
 epoch: 20, train_loss: 0.8008, test_loss: 0.9924, test_f1: 0.6290
 epoch: 21, train_loss: 0.7900, test_loss: 0.9957, test_f1: 0.6263
 epoch: 22, train_loss: 0.7867, test_loss: 0.9907, test_f1: 0.6292
 epoch: 23, train_loss: 0.7905, test_loss: 1.0295, test_f1: 0.6333
 epoch: 24, train_loss: 0.7852, test_loss: 1.0276, test_f1: 0.6511
 epoch: 25, train_loss: 0.7838, test_loss: 1.0392, test_f1: 0.6239
 epoch: 26, train_loss: 0.7673, test_loss: 0.9984, test_f1: 0.6508
 epoch: 27, train_loss: 0.7644, test_loss: 0.9927, test_f1: 0.6486
 epoch: 28, train_loss: 0.7531, test_loss: 1.0525, test_f1: 0.6327
 epoch: 29, train_loss: 0.7460, test_loss: 0.9967, test_f1: 0.6141
 epoch: 30, train_loss: 0.7480, test_loss: 1.0670, test_f1: 0.6217
 epoch: 31, train_loss: 0.7264, test_loss: 1.0188, test_f1: 0.6464
 epoch: 32, train_loss: 0.7321, test_loss: 1.0552, test_f1: 0.5915
 epoch: 33, train_loss: 0.7401, test_loss: 1.0390, test_f1: 0.6226
 epoch: 34, train_loss: 0.7099, test_loss: 1.0393, test_f1: 0.6227
 epoch: 35, train_loss: 0.6917, test_loss: 1.0840, test_f1: 0.6221
 epoch: 36, train_loss: 0.7016, test_loss: 1.0531, test_f1: 0.6384
 epoch: 37, train_loss: 0.6939, test_loss: 1.0668, test_f1: 0.6323
 epoch: 38, train_loss: 0.6992, test_loss: 1.0886, test_f1: 0.6370
 epoch: 39, train_loss: 0.6783, test_loss: 1.0529, test_f1: 0.6153
 epoch: 40, train_loss: 0.6826, test_loss: 1.0295, test_f1: 0.6370
 epoch: 41, train_loss: 0.6860, test_loss: 1.1087, test_f1: 0.6206
 epoch: 42, train_loss: 0.6666, test_loss: 1.0765, test_f1: 0.6336
 epoch: 43, train_loss: 0.6642, test_loss: 1.0944, test_f1: 0.6399
 epoch: 44, train_loss: 0.6602, test_loss: 1.0594, test_f1: 0.6468
 epoch: 45, train_loss: 0.6567, test_loss: 1.0662, test_f1: 0.6333
 epoch: 46, train_loss: 0.6501, test_loss: 1.0407, test_f1: 0.6456
 epoch: 47, train_loss: 0.6356, test_loss: 1.0938, test_f1: 0.6276
 epoch: 48, train_loss: 0.6357, test_loss: 1.0669, test_f1: 0.6321
 epoch: 49, train_loss: 0.6309, test_loss: 1.0946, test_f1: 0.6171
 epoch: 50, train_loss: 0.6192, test_loss: 1.1200, test_f1: 0.6503
 epoch: 51, train_loss: 0.6089, test_loss: 1.1099, test_f1: 0.6517
 epoch: 52, train_loss: 0.5932, test_loss: 1.0919, test_f1: 0.6566
 epoch: 53, train_loss: 0.5913, test_loss: 1.0861, test_f1: 0.6497
 epoch: 54, train_loss: 0.5782, test_loss: 1.0839, test_f1: 0.6634
 epoch: 55, train_loss: 0.5839, test_loss: 1.1187, test_f1: 0.6514
 epoch: 56, train_loss: 0.5725, test_loss: 1.1481, test_f1: 0.6171
 epoch: 57, train_loss: 0.5849, test_loss: 1.1413, test_f1: 0.6293
 epoch: 58, train_loss: 0.5705, test_loss: 1.1366, test_f1: 0.6329
 epoch: 59, train_loss: 0.5713, test_loss: 1.1469, test_f1: 0.6363
 epoch: 60, train_loss: 0.5648, test_loss: 1.1240, test_f1: 0.6413
 epoch: 61, train_loss: 0.5898, test_loss: 1.1163, test_f1: 0.6524
 epoch: 62, train_loss: 0.5621, test_loss: 1.1696, test_f1: 0.6401
 epoch: 63, train_loss: 0.5890, test_loss: 1.1213, test_f1: 0.6489
 epoch: 64, train_loss: 0.5597, test_loss: 1.1412, test_f1: 0.6319
 epoch: 65, train_loss: 0.5570, test_loss: 1.1628, test_f1: 0.6271
 epoch: 66, train_loss: 0.5438, test_loss: 1.1396, test_f1: 0.6434
 epoch: 67, train_loss: 0.5718, test_loss: 1.1728, test_f1: 0.6547
 epoch: 68, train_loss: 0.5416, test_loss: 1.1246, test_f1: 0.6488
 epoch: 69, train_loss: 0.5440, test_loss: 1.2173, test_f1: 0.6334
 epoch: 70, train_loss: 0.5439, test_loss: 1.1671, test_f1: 0.6391
 epoch: 71, train_loss: 0.5557, test_loss: 1.1753, test_f1: 0.6442
 epoch: 72, train_loss: 0.5347, test_loss: 1.1821, test_f1: 0.6349
 epoch: 73, train_loss: 0.5245, test_loss: 1.1780, test_f1: 0.6401
 epoch: 74, train_loss: 0.5145, test_loss: 1.1866, test_f1: 0.6498
 epoch: 75, train_loss: 0.5372, test_loss: 1.2265, test_f1: 0.6246
 epoch: 76, train_loss: 0.5276, test_loss: 1.1984, test_f1: 0.6398
 epoch: 77, train_loss: 0.5208, test_loss: 1.1981, test_f1: 0.6450
 epoch: 78, train_loss: 0.5153, test_loss: 1.2471, test_f1: 0.6352
 epoch: 79, train_loss: 0.4989, test_loss: 1.2081, test_f1: 0.6337
 epoch: 80, train_loss: 0.4953, test_loss: 1.2292, test_f1: 0.6262
 epoch: 81, train_loss: 0.5148, test_loss: 1.2113, test_f1: 0.6415
 epoch: 82, train_loss: 0.5094, test_loss: 1.1945, test_f1: 0.6558
 epoch: 83, train_loss: 0.5073, test_loss: 1.2358, test_f1: 0.6424
 epoch: 84, train_loss: 0.4950, test_loss: 1.2160, test_f1: 0.6479
 epoch: 85, train_loss: 0.5096, test_loss: 1.2647, test_f1: 0.6420
 epoch: 86, train_loss: 0.4940, test_loss: 1.2563, test_f1: 0.6502
 epoch: 87, train_loss: 0.5196, test_loss: 1.2500, test_f1: 0.6294
 epoch: 88, train_loss: 0.5016, test_loss: 1.2559, test_f1: 0.6531
 epoch: 89, train_loss: 0.4902, test_loss: 1.3104, test_f1: 0.6458
 epoch: 90, train_loss: 0.4850, test_loss: 1.2464, test_f1: 0.6399
 epoch: 91, train_loss: 0.4994, test_loss: 1.2122, test_f1: 0.6700
 epoch: 92, train_loss: 0.4974, test_loss: 1.2169, test_f1: 0.6352
 epoch: 93, train_loss: 0.4879, test_loss: 1.2817, test_f1: 0.6288
 epoch: 94, train_loss: 0.4775, test_loss: 1.2548, test_f1: 0.6321
 epoch: 95, train_loss: 0.4790, test_loss: 1.2703, test_f1: 0.6486
 epoch: 96, train_loss: 0.4644, test_loss: 1.2874, test_f1: 0.6394
 epoch: 97, train_loss: 0.4727, test_loss: 1.3241, test_f1: 0.6495
 epoch: 98, train_loss: 0.4604, test_loss: 1.2686, test_f1: 0.6466
 epoch: 99, train_loss: 0.4744, test_loss: 1.3082, test_f1: 0.6482
##################ITERATION #9 ****************************************
 epoch: 0, train_loss: 1.2902, test_loss: 1.2167, test_f1: 0.3919
 epoch: 1, train_loss: 1.0965, test_loss: 1.1313, test_f1: 0.4675
 epoch: 2, train_loss: 1.0693, test_loss: 1.0967, test_f1: 0.5164
 epoch: 3, train_loss: 1.0116, test_loss: 1.0903, test_f1: 0.5461
 epoch: 4, train_loss: 1.0182, test_loss: 1.0692, test_f1: 0.5372
 epoch: 5, train_loss: 0.9922, test_loss: 1.0416, test_f1: 0.5253
 epoch: 6, train_loss: 0.9659, test_loss: 1.0603, test_f1: 0.5569
 epoch: 7, train_loss: 0.9588, test_loss: 1.0405, test_f1: 0.5436
 epoch: 8, train_loss: 0.9259, test_loss: 1.0529, test_f1: 0.5570
 epoch: 9, train_loss: 0.9204, test_loss: 1.0401, test_f1: 0.5467
 epoch: 10, train_loss: 0.8962, test_loss: 1.0307, test_f1: 0.5646
 epoch: 11, train_loss: 0.9077, test_loss: 1.0483, test_f1: 0.5577
 epoch: 12, train_loss: 0.8912, test_loss: 1.0251, test_f1: 0.5647
 epoch: 13, train_loss: 0.8873, test_loss: 1.0283, test_f1: 0.5893
 epoch: 14, train_loss: 0.8700, test_loss: 1.0315, test_f1: 0.5830
 epoch: 15, train_loss: 0.8652, test_loss: 1.0217, test_f1: 0.5755
 epoch: 16, train_loss: 0.8429, test_loss: 1.0106, test_f1: 0.5774
 epoch: 17, train_loss: 0.8566, test_loss: 1.0097, test_f1: 0.5866
 epoch: 18, train_loss: 0.8405, test_loss: 1.0264, test_f1: 0.5772
 epoch: 19, train_loss: 0.8271, test_loss: 1.0314, test_f1: 0.5585
 epoch: 20, train_loss: 0.7987, test_loss: 1.0189, test_f1: 0.5962
 epoch: 21, train_loss: 0.8399, test_loss: 1.0486, test_f1: 0.6173
 epoch: 22, train_loss: 0.7910, test_loss: 1.0362, test_f1: 0.5996
 epoch: 23, train_loss: 0.8151, test_loss: 1.0331, test_f1: 0.6105
 epoch: 24, train_loss: 0.8022, test_loss: 1.0080, test_f1: 0.6412
 epoch: 25, train_loss: 0.8059, test_loss: 1.0384, test_f1: 0.5983
 epoch: 26, train_loss: 0.7680, test_loss: 1.0200, test_f1: 0.5914
 epoch: 27, train_loss: 0.7735, test_loss: 1.0068, test_f1: 0.6197
 epoch: 28, train_loss: 0.7764, test_loss: 1.0216, test_f1: 0.5934
 epoch: 29, train_loss: 0.7665, test_loss: 1.0180, test_f1: 0.6318
 epoch: 30, train_loss: 0.7596, test_loss: 0.9714, test_f1: 0.6261
 epoch: 31, train_loss: 0.7534, test_loss: 1.0128, test_f1: 0.6213
 epoch: 32, train_loss: 0.7368, test_loss: 1.0234, test_f1: 0.6107
 epoch: 33, train_loss: 0.7385, test_loss: 1.0244, test_f1: 0.6100
 epoch: 34, train_loss: 0.7299, test_loss: 1.0105, test_f1: 0.6232
 epoch: 35, train_loss: 0.7289, test_loss: 1.0215, test_f1: 0.6350
 epoch: 36, train_loss: 0.7137, test_loss: 1.0144, test_f1: 0.6335
 epoch: 37, train_loss: 0.7113, test_loss: 1.0258, test_f1: 0.6163
 epoch: 38, train_loss: 0.7168, test_loss: 1.0246, test_f1: 0.6176
 epoch: 39, train_loss: 0.6862, test_loss: 1.0454, test_f1: 0.6070
 epoch: 40, train_loss: 0.6910, test_loss: 1.0527, test_f1: 0.6394
 epoch: 41, train_loss: 0.6991, test_loss: 1.0080, test_f1: 0.6315
 epoch: 42, train_loss: 0.6696, test_loss: 1.0562, test_f1: 0.6290
 epoch: 43, train_loss: 0.6842, test_loss: 1.0315, test_f1: 0.6339
 epoch: 44, train_loss: 0.6521, test_loss: 1.0582, test_f1: 0.6336
 epoch: 45, train_loss: 0.6483, test_loss: 1.0436, test_f1: 0.6478
 epoch: 46, train_loss: 0.6595, test_loss: 1.0787, test_f1: 0.6412
 epoch: 47, train_loss: 0.6535, test_loss: 1.0481, test_f1: 0.6460
 epoch: 48, train_loss: 0.6596, test_loss: 1.0899, test_f1: 0.6592
 epoch: 49, train_loss: 0.6565, test_loss: 1.0369, test_f1: 0.6520
 epoch: 50, train_loss: 0.6286, test_loss: 1.1014, test_f1: 0.6347
 epoch: 51, train_loss: 0.6140, test_loss: 1.0587, test_f1: 0.6547
 epoch: 52, train_loss: 0.6240, test_loss: 1.0710, test_f1: 0.6609
 epoch: 53, train_loss: 0.6205, test_loss: 1.0853, test_f1: 0.6664
 epoch: 54, train_loss: 0.5920, test_loss: 1.1083, test_f1: 0.6489
 epoch: 55, train_loss: 0.5948, test_loss: 1.0775, test_f1: 0.6544
 epoch: 56, train_loss: 0.5940, test_loss: 1.1178, test_f1: 0.6445
 epoch: 57, train_loss: 0.5927, test_loss: 1.0941, test_f1: 0.6642
 epoch: 58, train_loss: 0.6028, test_loss: 1.1008, test_f1: 0.6357
 epoch: 59, train_loss: 0.6079, test_loss: 1.0778, test_f1: 0.6648
 epoch: 60, train_loss: 0.5953, test_loss: 1.0745, test_f1: 0.6505
 epoch: 61, train_loss: 0.5884, test_loss: 1.0967, test_f1: 0.6475
 epoch: 62, train_loss: 0.5766, test_loss: 1.0984, test_f1: 0.6385
 epoch: 63, train_loss: 0.5882, test_loss: 1.0922, test_f1: 0.6486
 epoch: 64, train_loss: 0.5755, test_loss: 1.1204, test_f1: 0.6363
 epoch: 65, train_loss: 0.5676, test_loss: 1.1151, test_f1: 0.6404
 epoch: 66, train_loss: 0.5593, test_loss: 1.1431, test_f1: 0.6500
 epoch: 67, train_loss: 0.5585, test_loss: 1.1637, test_f1: 0.6496
 epoch: 68, train_loss: 0.5514, test_loss: 1.1652, test_f1: 0.6461
 epoch: 69, train_loss: 0.5674, test_loss: 1.1634, test_f1: 0.6405
 epoch: 70, train_loss: 0.5561, test_loss: 1.1330, test_f1: 0.6458
 epoch: 71, train_loss: 0.5473, test_loss: 1.1215, test_f1: 0.6460
 epoch: 72, train_loss: 0.5513, test_loss: 1.1484, test_f1: 0.6727
 epoch: 73, train_loss: 0.5522, test_loss: 1.1816, test_f1: 0.6457
 epoch: 74, train_loss: 0.5550, test_loss: 1.1911, test_f1: 0.6288
 epoch: 75, train_loss: 0.5567, test_loss: 1.1928, test_f1: 0.6484
 epoch: 76, train_loss: 0.5424, test_loss: 1.1608, test_f1: 0.6507
 epoch: 77, train_loss: 0.5617, test_loss: 1.1671, test_f1: 0.6452
 epoch: 78, train_loss: 0.5248, test_loss: 1.2093, test_f1: 0.6215
 epoch: 79, train_loss: 0.5408, test_loss: 1.2038, test_f1: 0.6249
 epoch: 80, train_loss: 0.5398, test_loss: 1.1816, test_f1: 0.6488
 epoch: 81, train_loss: 0.5317, test_loss: 1.1942, test_f1: 0.6448
 epoch: 82, train_loss: 0.5259, test_loss: 1.1903, test_f1: 0.6587
 epoch: 83, train_loss: 0.5260, test_loss: 1.2257, test_f1: 0.6459
 epoch: 84, train_loss: 0.5278, test_loss: 1.2104, test_f1: 0.6240
 epoch: 85, train_loss: 0.5169, test_loss: 1.2125, test_f1: 0.6621
 epoch: 86, train_loss: 0.5002, test_loss: 1.2052, test_f1: 0.6345
 epoch: 87, train_loss: 0.4900, test_loss: 1.1792, test_f1: 0.6672
 epoch: 88, train_loss: 0.5259, test_loss: 1.1784, test_f1: 0.6460
 epoch: 89, train_loss: 0.5224, test_loss: 1.2476, test_f1: 0.6252
 epoch: 90, train_loss: 0.5131, test_loss: 1.2772, test_f1: 0.6047
 epoch: 91, train_loss: 0.5092, test_loss: 1.2389, test_f1: 0.6614
 epoch: 92, train_loss: 0.4918, test_loss: 1.2331, test_f1: 0.6439
 epoch: 93, train_loss: 0.5008, test_loss: 1.3010, test_f1: 0.6518
 epoch: 94, train_loss: 0.4971, test_loss: 1.2258, test_f1: 0.6624
 epoch: 95, train_loss: 0.4895, test_loss: 1.2598, test_f1: 0.6379
 epoch: 96, train_loss: 0.4895, test_loss: 1.2348, test_f1: 0.6674
 epoch: 97, train_loss: 0.4669, test_loss: 1.2539, test_f1: 0.6327
 epoch: 98, train_loss: 0.4906, test_loss: 1.2817, test_f1: 0.6337
 epoch: 99, train_loss: 0.4662, test_loss: 1.2897, test_f1: 0.6287

Training completed in 506.14 seconds
Best F1: 0.6754 at epoch 95
Mean F1 across iterations: 0.6590  0.0141
========================FINAL RESULTS================================
FEGIN weighted F1: 0.6754  0.0141
python main.py --data ltspice_demos --representation component_net --model FEGIN --layers 2 --hiddens 128 --batch_size 32 --lr 0.0001 --emb_size 128 --epochs 100 --save_appendix component_net_L2_H128_BS32_LR0.0001_E128 --no_val
-----



STDERR:
  File "main.py", line 370, in <module>
    main()
  File "main.py", line 254, in main
    dataset = dataset_class(
  File "/home/philip/projects/ltspice_examples_code_repo/Circuit-Completion-Using-GNNs/component_classification_with_link_prediction_head/evaluation/FEGIN/kernel/circuit_datasets.py", line 15, in __init__
    self.data, self.slices = torch.load(self.processed_paths[0])
  File "/home/philip/.local/lib/python3.8/site-packages/torch/serialization.py", line 1040, in load
    warnings.warn(
  File "/usr/lib/python3.8/warnings.py", line 109, in _showwarnmsg
    sw(msg.message, msg.category, msg.filename, msg.lineno,
  File "main.py", line 47, in warn_with_traceback
    traceback.print_stack(file=log)
/home/philip/projects/ltspice_examples_code_repo/Circuit-Completion-Using-GNNs/component_classification_with_link_prediction_head/evaluation/FEGIN/kernel/circuit_datasets.py:15: FutureWarning: You are using `torch.load` with `weights_only=False` (the current default value), which uses the default pickle module implicitly. It is possible to construct malicious pickle data which will execute arbitrary code during unpickling (See https://github.com/pytorch/pytorch/blob/main/SECURITY.md#untrusted-models for more details). In a future release, the default value for `weights_only` will be flipped to `True`. This limits the functions that could be executed during unpickling. Arbitrary objects will no longer be allowed to be loaded via this mode unless they are explicitly allowlisted by the user via `torch.serialization.add_safe_globals`. We recommend you start setting `weights_only=True` for any use case where you don't have full control of the loaded file. Please open an issue on GitHub for any issues related to this experimental feature.
  self.data, self.slices = torch.load(self.processed_paths[0])
