STDOUT:
Results will be saved in /home/philip/projects/ltspice_examples_code_repo/Circuit-Completion-Using-GNNs/component_classification_with_link_prediction_head/evaluation/FEGIN/results/model_FEGIN_dataset_ltspice_demos
Command line input: python main.py --data ltspice_demos --representation component_pin --model FEGIN --layers 3 --hiddens 64 --batch_size 256 --lr 0.01 --emb_size 250 --epochs 100 --save_appendix component_pin_L3_H64_BS256_LR0.01_E250 --no_val
 is saved.
-----
ltspice_demos - FEGIN
Using 3 layers, 64 hidden units, h = 2
Loading component_pin representation dataset
ENTERED
Training FEGIN on component_pin representation
Train: 1565, Test: 383
##################ITERATION #0 ****************************************
 epoch: 0, train_loss: 1.2932, test_loss: 1.3505, test_f1: 0.1365
 epoch: 1, train_loss: 1.1641, test_loss: 1.5215, test_f1: 0.3319
 epoch: 2, train_loss: 1.0982, test_loss: 1.9926, test_f1: 0.1365
 epoch: 3, train_loss: 1.0306, test_loss: 1.7209, test_f1: 0.3389
 epoch: 4, train_loss: 0.9692, test_loss: 1.8972, test_f1: 0.3023
 epoch: 5, train_loss: 0.9281, test_loss: 1.5342, test_f1: 0.3544
 epoch: 6, train_loss: 0.9095, test_loss: 1.1731, test_f1: 0.4689
 epoch: 7, train_loss: 0.9053, test_loss: 1.1587, test_f1: 0.4965
 epoch: 8, train_loss: 0.8689, test_loss: 1.0256, test_f1: 0.5320
 epoch: 9, train_loss: 0.8641, test_loss: 1.3639, test_f1: 0.3267
 epoch: 10, train_loss: 0.8308, test_loss: 1.2683, test_f1: 0.4751
 epoch: 11, train_loss: 0.8179, test_loss: 2.0557, test_f1: 0.3882
 epoch: 12, train_loss: 0.8228, test_loss: 1.2760, test_f1: 0.3726
 epoch: 13, train_loss: 0.7899, test_loss: 1.1623, test_f1: 0.5537
 epoch: 14, train_loss: 0.7599, test_loss: 0.9406, test_f1: 0.5891
 epoch: 15, train_loss: 0.7370, test_loss: 1.2890, test_f1: 0.5053
 epoch: 16, train_loss: 0.7544, test_loss: 1.1055, test_f1: 0.5866
 epoch: 17, train_loss: 0.7262, test_loss: 0.9273, test_f1: 0.5759
 epoch: 18, train_loss: 0.7302, test_loss: 1.0767, test_f1: 0.5591
 epoch: 19, train_loss: 0.7331, test_loss: 1.2464, test_f1: 0.4389
 epoch: 20, train_loss: 0.6928, test_loss: 1.1319, test_f1: 0.5478
 epoch: 21, train_loss: 0.7063, test_loss: 1.1908, test_f1: 0.5677
 epoch: 22, train_loss: 0.7016, test_loss: 1.1623, test_f1: 0.5280
 epoch: 23, train_loss: 0.7093, test_loss: 1.0955, test_f1: 0.4339
 epoch: 24, train_loss: 0.7911, test_loss: 5.8490, test_f1: 0.1279
 epoch: 25, train_loss: 0.7798, test_loss: 1.4249, test_f1: 0.3967
 epoch: 26, train_loss: 0.7275, test_loss: 1.3514, test_f1: 0.4792
 epoch: 27, train_loss: 0.6976, test_loss: 1.2101, test_f1: 0.5748
 epoch: 28, train_loss: 0.6815, test_loss: 1.2274, test_f1: 0.6147
 epoch: 29, train_loss: 0.6698, test_loss: 0.9435, test_f1: 0.6550
 epoch: 30, train_loss: 0.6569, test_loss: 1.4880, test_f1: 0.5160
 epoch: 31, train_loss: 0.6641, test_loss: 2.0415, test_f1: 0.5118
 epoch: 32, train_loss: 0.6896, test_loss: 0.9811, test_f1: 0.6321
 epoch: 33, train_loss: 0.6898, test_loss: 1.2682, test_f1: 0.5914
 epoch: 34, train_loss: 0.6588, test_loss: 1.3993, test_f1: 0.5137
 epoch: 35, train_loss: 0.6817, test_loss: 1.4469, test_f1: 0.6015
 epoch: 36, train_loss: 0.6777, test_loss: 1.3416, test_f1: 0.4670
 epoch: 37, train_loss: 0.6856, test_loss: 1.3952, test_f1: 0.5827
 epoch: 38, train_loss: 0.6577, test_loss: 1.1093, test_f1: 0.5606
 epoch: 39, train_loss: 0.6535, test_loss: 1.3614, test_f1: 0.5405
 epoch: 40, train_loss: 0.6569, test_loss: 1.2917, test_f1: 0.5507
 epoch: 41, train_loss: 0.6436, test_loss: 1.1029, test_f1: 0.4801
 epoch: 42, train_loss: 0.6281, test_loss: 1.0726, test_f1: 0.5908
 epoch: 43, train_loss: 0.6148, test_loss: 1.3550, test_f1: 0.5423
 epoch: 44, train_loss: 0.6252, test_loss: 1.1545, test_f1: 0.5606
 epoch: 45, train_loss: 0.6064, test_loss: 1.5744, test_f1: 0.5085
 epoch: 46, train_loss: 0.6073, test_loss: 1.1425, test_f1: 0.6105
 epoch: 47, train_loss: 0.6134, test_loss: 1.2906, test_f1: 0.4454
 epoch: 48, train_loss: 0.6004, test_loss: 1.2713, test_f1: 0.4972
 epoch: 49, train_loss: 0.5843, test_loss: 1.4673, test_f1: 0.4589
 epoch: 50, train_loss: 0.5746, test_loss: 1.2793, test_f1: 0.5296
 epoch: 51, train_loss: 0.5645, test_loss: 1.3617, test_f1: 0.5414
 epoch: 52, train_loss: 0.5581, test_loss: 1.6139, test_f1: 0.5447
 epoch: 53, train_loss: 0.5333, test_loss: 1.3124, test_f1: 0.5870
 epoch: 54, train_loss: 0.5583, test_loss: 1.2376, test_f1: 0.5452
 epoch: 55, train_loss: 0.5673, test_loss: 1.0573, test_f1: 0.6369
 epoch: 56, train_loss: 0.5471, test_loss: 1.5198, test_f1: 0.5658
 epoch: 57, train_loss: 0.5441, test_loss: 1.2151, test_f1: 0.6177
 epoch: 58, train_loss: 0.5378, test_loss: 1.2361, test_f1: 0.5767
 epoch: 59, train_loss: 0.5061, test_loss: 1.1783, test_f1: 0.6505
 epoch: 60, train_loss: 0.5078, test_loss: 1.3027, test_f1: 0.6182
 epoch: 61, train_loss: 0.5109, test_loss: 1.3814, test_f1: 0.5856
 epoch: 62, train_loss: 0.5070, test_loss: 1.5844, test_f1: 0.5802
 epoch: 63, train_loss: 0.5309, test_loss: 1.1592, test_f1: 0.6426
 epoch: 64, train_loss: 0.5183, test_loss: 1.1900, test_f1: 0.5838
 epoch: 65, train_loss: 0.4889, test_loss: 1.3143, test_f1: 0.5699
 epoch: 66, train_loss: 0.4932, test_loss: 1.2078, test_f1: 0.6170
 epoch: 67, train_loss: 0.4790, test_loss: 1.3832, test_f1: 0.6267
 epoch: 68, train_loss: 0.4528, test_loss: 1.6452, test_f1: 0.5899
 epoch: 69, train_loss: 0.4576, test_loss: 1.2667, test_f1: 0.6573
 epoch: 70, train_loss: 0.4809, test_loss: 1.3480, test_f1: 0.5746
 epoch: 71, train_loss: 0.4725, test_loss: 1.1585, test_f1: 0.6471
 epoch: 72, train_loss: 0.4800, test_loss: 1.5792, test_f1: 0.5679
 epoch: 73, train_loss: 0.4461, test_loss: 1.2468, test_f1: 0.6444
 epoch: 74, train_loss: 0.4544, test_loss: 1.3376, test_f1: 0.6407
 epoch: 75, train_loss: 0.4580, test_loss: 1.5479, test_f1: 0.6616
 epoch: 76, train_loss: 0.5541, test_loss: 2.6357, test_f1: 0.5330
 epoch: 77, train_loss: 0.4922, test_loss: 1.6791, test_f1: 0.5401
 epoch: 78, train_loss: 0.4770, test_loss: 1.3745, test_f1: 0.6367
 epoch: 79, train_loss: 0.4844, test_loss: 1.1855, test_f1: 0.5369
 epoch: 80, train_loss: 0.4876, test_loss: 1.3244, test_f1: 0.5312
 epoch: 81, train_loss: 0.4479, test_loss: 1.2491, test_f1: 0.6341
 epoch: 82, train_loss: 0.4246, test_loss: 1.1558, test_f1: 0.6193
 epoch: 83, train_loss: 0.4345, test_loss: 1.1159, test_f1: 0.6293
 epoch: 84, train_loss: 0.4467, test_loss: 1.3986, test_f1: 0.6438
 epoch: 85, train_loss: 0.4408, test_loss: 1.2291, test_f1: 0.6376
 epoch: 86, train_loss: 0.4391, test_loss: 1.3206, test_f1: 0.6133
 epoch: 87, train_loss: 0.4321, test_loss: 1.5763, test_f1: 0.5948
 epoch: 88, train_loss: 0.4205, test_loss: 1.5674, test_f1: 0.6303
 epoch: 89, train_loss: 0.4237, test_loss: 1.4450, test_f1: 0.6395
 epoch: 90, train_loss: 0.4176, test_loss: 1.8448, test_f1: 0.5754
 epoch: 91, train_loss: 0.4100, test_loss: 1.6958, test_f1: 0.6232
 epoch: 92, train_loss: 0.4161, test_loss: 1.9420, test_f1: 0.5637
 epoch: 93, train_loss: 0.4046, test_loss: 1.6885, test_f1: 0.6434
 epoch: 94, train_loss: 0.3777, test_loss: 1.4320, test_f1: 0.6741
 epoch: 95, train_loss: 0.3741, test_loss: 1.3783, test_f1: 0.5818
 epoch: 96, train_loss: 0.4011, test_loss: 1.6828, test_f1: 0.5531
 epoch: 97, train_loss: 0.4256, test_loss: 1.5370, test_f1: 0.5944
 epoch: 98, train_loss: 0.4485, test_loss: 1.4457, test_f1: 0.6285
 epoch: 99, train_loss: 0.3978, test_loss: 1.5239, test_f1: 0.6120
##################ITERATION #1 ****************************************
 epoch: 0, train_loss: 1.1829, test_loss: 1.4180, test_f1: 0.2390
 epoch: 1, train_loss: 1.0310, test_loss: 1.4072, test_f1: 0.1925
 epoch: 2, train_loss: 0.9302, test_loss: 1.4603, test_f1: 0.2433
 epoch: 3, train_loss: 0.8778, test_loss: 1.4345, test_f1: 0.3980
 epoch: 4, train_loss: 0.8299, test_loss: 1.4978, test_f1: 0.3751
 epoch: 5, train_loss: 0.8042, test_loss: 1.3457, test_f1: 0.4720
 epoch: 6, train_loss: 0.7944, test_loss: 1.3713, test_f1: 0.4821
 epoch: 7, train_loss: 0.7939, test_loss: 1.3975, test_f1: 0.5231
 epoch: 8, train_loss: 0.7858, test_loss: 2.9176, test_f1: 0.3039
 epoch: 9, train_loss: 0.7634, test_loss: 1.5100, test_f1: 0.4944
 epoch: 10, train_loss: 0.7745, test_loss: 1.2272, test_f1: 0.5021
 epoch: 11, train_loss: 0.7435, test_loss: 1.0689, test_f1: 0.5594
 epoch: 12, train_loss: 0.7314, test_loss: 2.4429, test_f1: 0.3899
 epoch: 13, train_loss: 0.7270, test_loss: 2.0771, test_f1: 0.4116
 epoch: 14, train_loss: 0.7369, test_loss: 1.0484, test_f1: 0.6241
 epoch: 15, train_loss: 0.7378, test_loss: 1.2433, test_f1: 0.5815
 epoch: 16, train_loss: 0.7409, test_loss: 1.1914, test_f1: 0.4392
 epoch: 17, train_loss: 0.7172, test_loss: 1.0239, test_f1: 0.5258
 epoch: 18, train_loss: 0.7273, test_loss: 1.8789, test_f1: 0.4263
 epoch: 19, train_loss: 0.7106, test_loss: 1.2007, test_f1: 0.4790
 epoch: 20, train_loss: 0.6914, test_loss: 1.0034, test_f1: 0.5831
 epoch: 21, train_loss: 0.6771, test_loss: 1.2342, test_f1: 0.5844
 epoch: 22, train_loss: 0.6710, test_loss: 1.2601, test_f1: 0.5494
 epoch: 23, train_loss: 0.6332, test_loss: 1.3204, test_f1: 0.6446
 epoch: 24, train_loss: 0.6858, test_loss: 1.1121, test_f1: 0.6058
 epoch: 25, train_loss: 0.6300, test_loss: 1.0771, test_f1: 0.6049
 epoch: 26, train_loss: 0.6525, test_loss: 1.2629, test_f1: 0.5596
 epoch: 27, train_loss: 0.6500, test_loss: 1.3454, test_f1: 0.5514
 epoch: 28, train_loss: 0.6544, test_loss: 1.8491, test_f1: 0.3860
 epoch: 29, train_loss: 0.6481, test_loss: 1.9917, test_f1: 0.4631
 epoch: 30, train_loss: 0.6362, test_loss: 1.1271, test_f1: 0.5888
 epoch: 31, train_loss: 0.6479, test_loss: 1.2320, test_f1: 0.6520
 epoch: 32, train_loss: 0.6134, test_loss: 1.5707, test_f1: 0.5505
 epoch: 33, train_loss: 0.6022, test_loss: 1.1088, test_f1: 0.6338
 epoch: 34, train_loss: 0.5958, test_loss: 1.3900, test_f1: 0.6325
 epoch: 35, train_loss: 0.5682, test_loss: 1.3507, test_f1: 0.5909
 epoch: 36, train_loss: 0.5918, test_loss: 1.3707, test_f1: 0.5670
 epoch: 37, train_loss: 0.5717, test_loss: 1.1413, test_f1: 0.5704
 epoch: 38, train_loss: 0.6126, test_loss: 1.0486, test_f1: 0.6021
 epoch: 39, train_loss: 0.6255, test_loss: 1.0790, test_f1: 0.5437
 epoch: 40, train_loss: 0.6046, test_loss: 1.0712, test_f1: 0.6656
 epoch: 41, train_loss: 0.5811, test_loss: 1.3833, test_f1: 0.5555
 epoch: 42, train_loss: 0.5580, test_loss: 1.3040, test_f1: 0.5829
 epoch: 43, train_loss: 0.5602, test_loss: 1.2196, test_f1: 0.5498
 epoch: 44, train_loss: 0.6205, test_loss: 1.3893, test_f1: 0.5186
 epoch: 45, train_loss: 0.5975, test_loss: 1.0011, test_f1: 0.6434
 epoch: 46, train_loss: 0.5995, test_loss: 1.1671, test_f1: 0.5945
 epoch: 47, train_loss: 0.5850, test_loss: 1.1874, test_f1: 0.5883
 epoch: 48, train_loss: 0.6036, test_loss: 1.2178, test_f1: 0.5912
 epoch: 49, train_loss: 0.5334, test_loss: 1.3330, test_f1: 0.6139
 epoch: 50, train_loss: 0.5186, test_loss: 1.2983, test_f1: 0.6427
 epoch: 51, train_loss: 0.4853, test_loss: 1.5213, test_f1: 0.6169
 epoch: 52, train_loss: 0.4733, test_loss: 1.4967, test_f1: 0.5985
 epoch: 53, train_loss: 0.4608, test_loss: 1.3308, test_f1: 0.6422
 epoch: 54, train_loss: 0.4553, test_loss: 1.3052, test_f1: 0.5888
 epoch: 55, train_loss: 0.4341, test_loss: 1.3557, test_f1: 0.6038
 epoch: 56, train_loss: 0.4532, test_loss: 1.5253, test_f1: 0.5873
 epoch: 57, train_loss: 0.4464, test_loss: 1.4160, test_f1: 0.6229
 epoch: 58, train_loss: 0.4341, test_loss: 1.5335, test_f1: 0.6039
 epoch: 59, train_loss: 0.4330, test_loss: 1.5042, test_f1: 0.5928
 epoch: 60, train_loss: 0.4387, test_loss: 1.5543, test_f1: 0.6491
 epoch: 61, train_loss: 0.4253, test_loss: 1.6794, test_f1: 0.5878
 epoch: 62, train_loss: 0.4201, test_loss: 1.9216, test_f1: 0.5933
 epoch: 63, train_loss: 0.4129, test_loss: 1.6765, test_f1: 0.6026
 epoch: 64, train_loss: 0.4057, test_loss: 1.5589, test_f1: 0.6146
 epoch: 65, train_loss: 0.3904, test_loss: 1.7013, test_f1: 0.5916
 epoch: 66, train_loss: 0.4063, test_loss: 1.5027, test_f1: 0.5708
 epoch: 67, train_loss: 0.3915, test_loss: 1.8071, test_f1: 0.5773
 epoch: 68, train_loss: 0.4160, test_loss: 1.8159, test_f1: 0.5943
 epoch: 69, train_loss: 0.3749, test_loss: 1.5500, test_f1: 0.6040
 epoch: 70, train_loss: 0.3769, test_loss: 1.3299, test_f1: 0.6234
 epoch: 71, train_loss: 0.3865, test_loss: 1.9068, test_f1: 0.5882
 epoch: 72, train_loss: 0.3985, test_loss: 2.1628, test_f1: 0.5888
 epoch: 73, train_loss: 0.3879, test_loss: 1.5502, test_f1: 0.6346
 epoch: 74, train_loss: 0.3705, test_loss: 1.3556, test_f1: 0.6311
 epoch: 75, train_loss: 0.3988, test_loss: 1.5338, test_f1: 0.6012
 epoch: 76, train_loss: 0.3515, test_loss: 1.6337, test_f1: 0.5853
 epoch: 77, train_loss: 0.3875, test_loss: 1.4773, test_f1: 0.6105
 epoch: 78, train_loss: 0.3838, test_loss: 1.6782, test_f1: 0.5915
 epoch: 79, train_loss: 0.4160, test_loss: 2.0421, test_f1: 0.5224
 epoch: 80, train_loss: 0.4710, test_loss: 1.4115, test_f1: 0.6371
 epoch: 81, train_loss: 0.4555, test_loss: 1.5707, test_f1: 0.5910
 epoch: 82, train_loss: 0.4138, test_loss: 1.6577, test_f1: 0.6026
 epoch: 83, train_loss: 0.3787, test_loss: 1.4131, test_f1: 0.6085
 epoch: 84, train_loss: 0.3693, test_loss: 1.6007, test_f1: 0.6342
 epoch: 85, train_loss: 0.3501, test_loss: 1.7113, test_f1: 0.6291
 epoch: 86, train_loss: 0.3170, test_loss: 1.6322, test_f1: 0.6080
 epoch: 87, train_loss: 0.4164, test_loss: 1.8133, test_f1: 0.5618
 epoch: 88, train_loss: 0.4323, test_loss: 1.5756, test_f1: 0.5825
 epoch: 89, train_loss: 0.4061, test_loss: 1.8109, test_f1: 0.6136
 epoch: 90, train_loss: 0.3863, test_loss: 1.6251, test_f1: 0.6430
 epoch: 91, train_loss: 0.3453, test_loss: 1.5265, test_f1: 0.5602
 epoch: 92, train_loss: 0.3755, test_loss: 1.4894, test_f1: 0.5692
 epoch: 93, train_loss: 0.3615, test_loss: 1.3792, test_f1: 0.6153
 epoch: 94, train_loss: 0.3909, test_loss: 1.4276, test_f1: 0.6072
 epoch: 95, train_loss: 0.3615, test_loss: 2.1040, test_f1: 0.5452
 epoch: 96, train_loss: 0.3511, test_loss: 1.5772, test_f1: 0.6197
 epoch: 97, train_loss: 0.3517, test_loss: 1.9287, test_f1: 0.5730
 epoch: 98, train_loss: 0.3507, test_loss: 1.8375, test_f1: 0.6289
 epoch: 99, train_loss: 0.3121, test_loss: 1.7213, test_f1: 0.6014
##################ITERATION #2 ****************************************
 epoch: 0, train_loss: 1.2795, test_loss: 1.5257, test_f1: 0.2543
 epoch: 1, train_loss: 1.0446, test_loss: 1.2966, test_f1: 0.3228
 epoch: 2, train_loss: 0.9802, test_loss: 1.2041, test_f1: 0.3698
 epoch: 3, train_loss: 0.9158, test_loss: 1.1888, test_f1: 0.4620
 epoch: 4, train_loss: 0.8787, test_loss: 1.2786, test_f1: 0.4266
 epoch: 5, train_loss: 0.8602, test_loss: 1.2417, test_f1: 0.4608
 epoch: 6, train_loss: 0.8423, test_loss: 1.1226, test_f1: 0.5269
 epoch: 7, train_loss: 0.8032, test_loss: 1.1512, test_f1: 0.5329
 epoch: 8, train_loss: 0.7959, test_loss: 1.1941, test_f1: 0.5272
 epoch: 9, train_loss: 0.7664, test_loss: 1.6151, test_f1: 0.4028
 epoch: 10, train_loss: 0.7771, test_loss: 1.1694, test_f1: 0.5081
 epoch: 11, train_loss: 0.7636, test_loss: 1.1798, test_f1: 0.5506
 epoch: 12, train_loss: 0.7485, test_loss: 1.1977, test_f1: 0.4420
 epoch: 13, train_loss: 0.7307, test_loss: 1.3570, test_f1: 0.5253
 epoch: 14, train_loss: 0.7148, test_loss: 1.0573, test_f1: 0.5820
 epoch: 15, train_loss: 0.7194, test_loss: 0.9956, test_f1: 0.6008
 epoch: 16, train_loss: 0.7343, test_loss: 0.9260, test_f1: 0.6315
 epoch: 17, train_loss: 0.7368, test_loss: 2.8164, test_f1: 0.3188
 epoch: 18, train_loss: 0.7453, test_loss: 2.8285, test_f1: 0.3108
 epoch: 19, train_loss: 0.7456, test_loss: 1.1446, test_f1: 0.5286
 epoch: 20, train_loss: 0.7431, test_loss: 1.2257, test_f1: 0.5218
 epoch: 21, train_loss: 0.7139, test_loss: 2.7944, test_f1: 0.5396
 epoch: 22, train_loss: 0.7293, test_loss: 1.3349, test_f1: 0.5248
 epoch: 23, train_loss: 0.7169, test_loss: 1.5861, test_f1: 0.5280
 epoch: 24, train_loss: 0.7168, test_loss: 2.1539, test_f1: 0.4483
 epoch: 25, train_loss: 0.7729, test_loss: 1.7306, test_f1: 0.4859
 epoch: 26, train_loss: 0.7077, test_loss: 1.2314, test_f1: 0.5451
 epoch: 27, train_loss: 0.7051, test_loss: 1.2627, test_f1: 0.5604
 epoch: 28, train_loss: 0.7228, test_loss: 1.3141, test_f1: 0.5173
 epoch: 29, train_loss: 0.7125, test_loss: 1.0942, test_f1: 0.5732
 epoch: 30, train_loss: 0.7035, test_loss: 0.9921, test_f1: 0.6216
 epoch: 31, train_loss: 0.6831, test_loss: 1.3358, test_f1: 0.5550
 epoch: 32, train_loss: 0.7133, test_loss: 1.2987, test_f1: 0.5893
 epoch: 33, train_loss: 0.6902, test_loss: 1.0329, test_f1: 0.5948
 epoch: 34, train_loss: 0.7034, test_loss: 1.1222, test_f1: 0.5040
 epoch: 35, train_loss: 0.6774, test_loss: 1.0351, test_f1: 0.5463
 epoch: 36, train_loss: 0.6623, test_loss: 1.0980, test_f1: 0.5769
 epoch: 37, train_loss: 0.6468, test_loss: 1.2427, test_f1: 0.5886
 epoch: 38, train_loss: 0.6238, test_loss: 0.8948, test_f1: 0.6465
 epoch: 39, train_loss: 0.6728, test_loss: 1.0682, test_f1: 0.5466
 epoch: 40, train_loss: 0.6605, test_loss: 1.1164, test_f1: 0.5908
 epoch: 41, train_loss: 0.6426, test_loss: 1.4645, test_f1: 0.4717
 epoch: 42, train_loss: 0.6225, test_loss: 1.0806, test_f1: 0.6030
 epoch: 43, train_loss: 0.6162, test_loss: 1.4173, test_f1: 0.5303
 epoch: 44, train_loss: 0.6420, test_loss: 1.3175, test_f1: 0.5254
 epoch: 45, train_loss: 0.6070, test_loss: 1.4031, test_f1: 0.5573
 epoch: 46, train_loss: 0.5750, test_loss: 1.0295, test_f1: 0.6042
 epoch: 47, train_loss: 0.5780, test_loss: 1.4237, test_f1: 0.5967
 epoch: 48, train_loss: 0.5553, test_loss: 1.3360, test_f1: 0.5990
 epoch: 49, train_loss: 0.5436, test_loss: 1.4372, test_f1: 0.5563
 epoch: 50, train_loss: 0.5374, test_loss: 1.2873, test_f1: 0.5407
 epoch: 51, train_loss: 0.5316, test_loss: 1.4486, test_f1: 0.4716
 epoch: 52, train_loss: 0.5139, test_loss: 1.3793, test_f1: 0.6160
 epoch: 53, train_loss: 0.5271, test_loss: 1.2749, test_f1: 0.6112
 epoch: 54, train_loss: 0.5179, test_loss: 1.3818, test_f1: 0.6001
 epoch: 55, train_loss: 0.5498, test_loss: 1.2366, test_f1: 0.6292
 epoch: 56, train_loss: 0.5157, test_loss: 1.2116, test_f1: 0.6280
 epoch: 57, train_loss: 0.5069, test_loss: 1.2280, test_f1: 0.5576
 epoch: 58, train_loss: 0.4862, test_loss: 1.2249, test_f1: 0.5787
 epoch: 59, train_loss: 0.4662, test_loss: 1.3283, test_f1: 0.5695
 epoch: 60, train_loss: 0.4617, test_loss: 1.2988, test_f1: 0.5615
 epoch: 61, train_loss: 0.4609, test_loss: 1.6373, test_f1: 0.5939
 epoch: 62, train_loss: 0.4532, test_loss: 1.5605, test_f1: 0.6206
 epoch: 63, train_loss: 0.4416, test_loss: 1.3773, test_f1: 0.5515
 epoch: 64, train_loss: 0.4583, test_loss: 1.5497, test_f1: 0.5836
 epoch: 65, train_loss: 0.4387, test_loss: 1.7588, test_f1: 0.5877
 epoch: 66, train_loss: 0.4326, test_loss: 1.4188, test_f1: 0.6148
 epoch: 67, train_loss: 0.4067, test_loss: 1.4342, test_f1: 0.5741
 epoch: 68, train_loss: 0.4301, test_loss: 1.5086, test_f1: 0.6355
 epoch: 69, train_loss: 0.4438, test_loss: 1.5181, test_f1: 0.5867
 epoch: 70, train_loss: 0.4513, test_loss: 1.7933, test_f1: 0.5618
 epoch: 71, train_loss: 0.4307, test_loss: 1.5318, test_f1: 0.5831
 epoch: 72, train_loss: 0.4437, test_loss: 1.5253, test_f1: 0.5860
 epoch: 73, train_loss: 0.4065, test_loss: 1.8854, test_f1: 0.6355
 epoch: 74, train_loss: 0.4289, test_loss: 1.9733, test_f1: 0.5643
 epoch: 75, train_loss: 0.4339, test_loss: 1.6465, test_f1: 0.5738
 epoch: 76, train_loss: 0.4228, test_loss: 1.4974, test_f1: 0.5916
 epoch: 77, train_loss: 0.4427, test_loss: 1.4399, test_f1: 0.6026
 epoch: 78, train_loss: 0.4783, test_loss: 1.7195, test_f1: 0.5173
 epoch: 79, train_loss: 0.4824, test_loss: 1.7343, test_f1: 0.5512
 epoch: 80, train_loss: 0.4597, test_loss: 1.3416, test_f1: 0.6525
 epoch: 81, train_loss: 0.4285, test_loss: 1.4520, test_f1: 0.6040
 epoch: 82, train_loss: 0.4083, test_loss: 1.4764, test_f1: 0.6333
 epoch: 83, train_loss: 0.3879, test_loss: 1.4335, test_f1: 0.5602
 epoch: 84, train_loss: 0.3770, test_loss: 1.7094, test_f1: 0.6252
 epoch: 85, train_loss: 0.3870, test_loss: 1.4768, test_f1: 0.6480
 epoch: 86, train_loss: 0.3814, test_loss: 1.5148, test_f1: 0.6609
 epoch: 87, train_loss: 0.3503, test_loss: 1.9080, test_f1: 0.6053
 epoch: 88, train_loss: 0.3589, test_loss: 1.6829, test_f1: 0.6017
 epoch: 89, train_loss: 0.3417, test_loss: 1.8713, test_f1: 0.5479
 epoch: 90, train_loss: 0.3513, test_loss: 2.1533, test_f1: 0.5994
 epoch: 91, train_loss: 0.3432, test_loss: 1.9444, test_f1: 0.5992
 epoch: 92, train_loss: 0.3443, test_loss: 1.9756, test_f1: 0.6495
 epoch: 93, train_loss: 0.3502, test_loss: 1.8565, test_f1: 0.6082
 epoch: 94, train_loss: 0.3494, test_loss: 1.8067, test_f1: 0.6069
 epoch: 95, train_loss: 0.3698, test_loss: 1.7337, test_f1: 0.6008
 epoch: 96, train_loss: 0.3542, test_loss: 1.8199, test_f1: 0.6128
 epoch: 97, train_loss: 0.3531, test_loss: 1.9480, test_f1: 0.5923
 epoch: 98, train_loss: 0.3396, test_loss: 1.8745, test_f1: 0.5717
 epoch: 99, train_loss: 0.3345, test_loss: 1.7657, test_f1: 0.6702
##################ITERATION #3 ****************************************
 epoch: 0, train_loss: 1.4001, test_loss: 1.7961, test_f1: 0.2977
 epoch: 1, train_loss: 1.0639, test_loss: 1.3865, test_f1: 0.3275
 epoch: 2, train_loss: 1.0171, test_loss: 1.1533, test_f1: 0.4741
 epoch: 3, train_loss: 0.9509, test_loss: 1.0611, test_f1: 0.5488
 epoch: 4, train_loss: 0.9145, test_loss: 1.0681, test_f1: 0.5086
 epoch: 5, train_loss: 0.8783, test_loss: 1.0153, test_f1: 0.5299
 epoch: 6, train_loss: 0.8405, test_loss: 1.0592, test_f1: 0.5417
 epoch: 7, train_loss: 0.8289, test_loss: 1.0329, test_f1: 0.5152
 epoch: 8, train_loss: 0.8143, test_loss: 1.0518, test_f1: 0.5692
 epoch: 9, train_loss: 0.8028, test_loss: 1.3993, test_f1: 0.4717
 epoch: 10, train_loss: 0.7705, test_loss: 1.0402, test_f1: 0.5151
 epoch: 11, train_loss: 0.7882, test_loss: 1.2696, test_f1: 0.6123
 epoch: 12, train_loss: 0.8188, test_loss: 1.2285, test_f1: 0.4581
 epoch: 13, train_loss: 0.7853, test_loss: 1.2193, test_f1: 0.4913
 epoch: 14, train_loss: 0.7964, test_loss: 1.0622, test_f1: 0.5300
 epoch: 15, train_loss: 0.7636, test_loss: 1.1460, test_f1: 0.5025
 epoch: 16, train_loss: 0.7636, test_loss: 1.2601, test_f1: 0.4675
 epoch: 17, train_loss: 0.7303, test_loss: 1.1789, test_f1: 0.4669
 epoch: 18, train_loss: 0.7443, test_loss: 1.2633, test_f1: 0.4459
 epoch: 19, train_loss: 0.7145, test_loss: 0.9349, test_f1: 0.6159
 epoch: 20, train_loss: 0.6942, test_loss: 1.2501, test_f1: 0.5269
 epoch: 21, train_loss: 0.7126, test_loss: 1.0740, test_f1: 0.5606
 epoch: 22, train_loss: 0.7221, test_loss: 1.1972, test_f1: 0.5050
 epoch: 23, train_loss: 0.6923, test_loss: 1.1995, test_f1: 0.5377
 epoch: 24, train_loss: 0.6821, test_loss: 1.1966, test_f1: 0.5946
 epoch: 25, train_loss: 0.6701, test_loss: 1.0055, test_f1: 0.6323
 epoch: 26, train_loss: 0.6341, test_loss: 1.0604, test_f1: 0.5868
 epoch: 27, train_loss: 0.6424, test_loss: 1.0798, test_f1: 0.5658
 epoch: 28, train_loss: 0.6503, test_loss: 1.1424, test_f1: 0.5332
 epoch: 29, train_loss: 0.6355, test_loss: 1.1956, test_f1: 0.5568
 epoch: 30, train_loss: 0.6343, test_loss: 1.2719, test_f1: 0.5080
 epoch: 31, train_loss: 0.6307, test_loss: 1.0745, test_f1: 0.5698
 epoch: 32, train_loss: 0.6122, test_loss: 1.3243, test_f1: 0.4661
 epoch: 33, train_loss: 0.6276, test_loss: 1.2380, test_f1: 0.5905
 epoch: 34, train_loss: 0.6409, test_loss: 1.2812, test_f1: 0.5532
 epoch: 35, train_loss: 0.6264, test_loss: 1.0949, test_f1: 0.5729
 epoch: 36, train_loss: 0.6589, test_loss: 1.0200, test_f1: 0.5691
 epoch: 37, train_loss: 0.6365, test_loss: 1.2011, test_f1: 0.5068
 epoch: 38, train_loss: 0.6157, test_loss: 1.2248, test_f1: 0.5964
 epoch: 39, train_loss: 0.6298, test_loss: 1.4870, test_f1: 0.4593
 epoch: 40, train_loss: 0.6461, test_loss: 1.1437, test_f1: 0.5386
 epoch: 41, train_loss: 0.6488, test_loss: 1.0762, test_f1: 0.5442
 epoch: 42, train_loss: 0.6114, test_loss: 1.0235, test_f1: 0.6012
 epoch: 43, train_loss: 0.6264, test_loss: 0.9909, test_f1: 0.6890
 epoch: 44, train_loss: 0.5802, test_loss: 1.1181, test_f1: 0.5500
 epoch: 45, train_loss: 0.5657, test_loss: 1.1803, test_f1: 0.5841
 epoch: 46, train_loss: 0.5672, test_loss: 1.4003, test_f1: 0.5426
 epoch: 47, train_loss: 0.5689, test_loss: 1.2981, test_f1: 0.5284
 epoch: 48, train_loss: 0.6158, test_loss: 1.2565, test_f1: 0.5510
 epoch: 49, train_loss: 0.5835, test_loss: 1.0145, test_f1: 0.6457
 epoch: 50, train_loss: 0.5523, test_loss: 1.1376, test_f1: 0.5839
 epoch: 51, train_loss: 0.5414, test_loss: 1.0909, test_f1: 0.6101
 epoch: 52, train_loss: 0.5022, test_loss: 1.1722, test_f1: 0.5761
 epoch: 53, train_loss: 0.5002, test_loss: 1.2495, test_f1: 0.5795
 epoch: 54, train_loss: 0.4481, test_loss: 1.1245, test_f1: 0.6233
 epoch: 55, train_loss: 0.4535, test_loss: 1.0599, test_f1: 0.6323
 epoch: 56, train_loss: 0.4740, test_loss: 1.2193, test_f1: 0.5853
 epoch: 57, train_loss: 0.4615, test_loss: 1.1753, test_f1: 0.6090
 epoch: 58, train_loss: 0.4503, test_loss: 1.3610, test_f1: 0.5391
 epoch: 59, train_loss: 0.4464, test_loss: 1.3762, test_f1: 0.5761
 epoch: 60, train_loss: 0.4359, test_loss: 1.4020, test_f1: 0.5903
 epoch: 61, train_loss: 0.4365, test_loss: 1.2308, test_f1: 0.6310
 epoch: 62, train_loss: 0.4196, test_loss: 1.2437, test_f1: 0.6282
 epoch: 63, train_loss: 0.3996, test_loss: 1.3184, test_f1: 0.6093
 epoch: 64, train_loss: 0.4772, test_loss: 1.3694, test_f1: 0.5884
 epoch: 65, train_loss: 0.4266, test_loss: 1.1324, test_f1: 0.6375
 epoch: 66, train_loss: 0.4431, test_loss: 1.2253, test_f1: 0.6233
 epoch: 67, train_loss: 0.4921, test_loss: 1.0820, test_f1: 0.6288
 epoch: 68, train_loss: 0.4718, test_loss: 1.3571, test_f1: 0.5753
 epoch: 69, train_loss: 0.4660, test_loss: 1.1837, test_f1: 0.5935
 epoch: 70, train_loss: 0.4666, test_loss: 1.0500, test_f1: 0.5805
 epoch: 71, train_loss: 0.4295, test_loss: 1.1957, test_f1: 0.5780
 epoch: 72, train_loss: 0.4548, test_loss: 1.3966, test_f1: 0.5493
 epoch: 73, train_loss: 0.4284, test_loss: 1.2913, test_f1: 0.5820
 epoch: 74, train_loss: 0.3767, test_loss: 1.3423, test_f1: 0.5781
 epoch: 75, train_loss: 0.3934, test_loss: 1.3899, test_f1: 0.5716
 epoch: 76, train_loss: 0.3795, test_loss: 1.4810, test_f1: 0.5640
 epoch: 77, train_loss: 0.3955, test_loss: 1.4373, test_f1: 0.6043
 epoch: 78, train_loss: 0.3768, test_loss: 1.3501, test_f1: 0.5981
 epoch: 79, train_loss: 0.3758, test_loss: 1.3434, test_f1: 0.5879
 epoch: 80, train_loss: 0.3621, test_loss: 1.1442, test_f1: 0.6081
 epoch: 81, train_loss: 0.3735, test_loss: 1.1655, test_f1: 0.5797
 epoch: 82, train_loss: 0.3721, test_loss: 1.0790, test_f1: 0.6608
 epoch: 83, train_loss: 0.3812, test_loss: 1.3084, test_f1: 0.6319
 epoch: 84, train_loss: 0.3654, test_loss: 1.5206, test_f1: 0.5632
 epoch: 85, train_loss: 0.4295, test_loss: 1.3517, test_f1: 0.5968
 epoch: 86, train_loss: 0.3908, test_loss: 1.3826, test_f1: 0.5734
 epoch: 87, train_loss: 0.3619, test_loss: 1.5415, test_f1: 0.5281
 epoch: 88, train_loss: 0.3935, test_loss: 1.2731, test_f1: 0.5579
 epoch: 89, train_loss: 0.3723, test_loss: 1.3510, test_f1: 0.6130
 epoch: 90, train_loss: 0.3902, test_loss: 1.4015, test_f1: 0.6166
 epoch: 91, train_loss: 0.3645, test_loss: 1.3204, test_f1: 0.6153
 epoch: 92, train_loss: 0.3522, test_loss: 1.4662, test_f1: 0.5670
 epoch: 93, train_loss: 0.4008, test_loss: 1.5081, test_f1: 0.5977
 epoch: 94, train_loss: 0.3968, test_loss: 1.4522, test_f1: 0.6073
 epoch: 95, train_loss: 0.3949, test_loss: 1.3619, test_f1: 0.6270
 epoch: 96, train_loss: 0.3594, test_loss: 1.4045, test_f1: 0.5965
 epoch: 97, train_loss: 0.3635, test_loss: 1.6008, test_f1: 0.6264
 epoch: 98, train_loss: 0.3454, test_loss: 1.5746, test_f1: 0.6253
 epoch: 99, train_loss: 0.3239, test_loss: 1.3387, test_f1: 0.6066
##################ITERATION #4 ****************************************
 epoch: 0, train_loss: 1.5623, test_loss: 1.7208, test_f1: 0.3115
 epoch: 1, train_loss: 1.1253, test_loss: 1.4735, test_f1: 0.3383
 epoch: 2, train_loss: 1.0266, test_loss: 1.4660, test_f1: 0.3388
 epoch: 3, train_loss: 0.9887, test_loss: 1.4509, test_f1: 0.3386
 epoch: 4, train_loss: 0.9395, test_loss: 1.4634, test_f1: 0.4040
 epoch: 5, train_loss: 0.8915, test_loss: 1.4381, test_f1: 0.2994
 epoch: 6, train_loss: 0.8985, test_loss: 1.3671, test_f1: 0.4040
 epoch: 7, train_loss: 0.8415, test_loss: 1.5379, test_f1: 0.3601
 epoch: 8, train_loss: 0.8458, test_loss: 1.6661, test_f1: 0.3234
 epoch: 9, train_loss: 0.7957, test_loss: 1.6059, test_f1: 0.3685
 epoch: 10, train_loss: 0.7899, test_loss: 1.0334, test_f1: 0.5205
 epoch: 11, train_loss: 0.7667, test_loss: 1.0490, test_f1: 0.5739
 epoch: 12, train_loss: 0.7713, test_loss: 1.3481, test_f1: 0.4389
 epoch: 13, train_loss: 0.7729, test_loss: 1.0282, test_f1: 0.5881
 epoch: 14, train_loss: 0.7510, test_loss: 1.1144, test_f1: 0.5036
 epoch: 15, train_loss: 0.7300, test_loss: 1.0033, test_f1: 0.5508
 epoch: 16, train_loss: 0.6780, test_loss: 1.0852, test_f1: 0.5366
 epoch: 17, train_loss: 0.6842, test_loss: 1.0131, test_f1: 0.6483
 epoch: 18, train_loss: 0.6584, test_loss: 1.0986, test_f1: 0.4709
 epoch: 19, train_loss: 0.6811, test_loss: 1.1910, test_f1: 0.5567
 epoch: 20, train_loss: 0.7172, test_loss: 1.2542, test_f1: 0.5832
 epoch: 21, train_loss: 0.6827, test_loss: 1.1863, test_f1: 0.5511
 epoch: 22, train_loss: 0.7019, test_loss: 1.3290, test_f1: 0.5053
 epoch: 23, train_loss: 0.6687, test_loss: 1.0524, test_f1: 0.6117
 epoch: 24, train_loss: 0.6731, test_loss: 1.4585, test_f1: 0.5123
 epoch: 25, train_loss: 0.6864, test_loss: 4.1235, test_f1: 0.2703
 epoch: 26, train_loss: 0.6893, test_loss: 1.2349, test_f1: 0.4357
 epoch: 27, train_loss: 0.6544, test_loss: 1.1283, test_f1: 0.4690
 epoch: 28, train_loss: 0.6917, test_loss: 1.2034, test_f1: 0.5094
 epoch: 29, train_loss: 0.6790, test_loss: 1.0986, test_f1: 0.5633
 epoch: 30, train_loss: 0.6573, test_loss: 1.8349, test_f1: 0.3972
 epoch: 31, train_loss: 0.6605, test_loss: 1.1830, test_f1: 0.4906
 epoch: 32, train_loss: 0.6268, test_loss: 1.7555, test_f1: 0.4496
 epoch: 33, train_loss: 0.6203, test_loss: 1.1206, test_f1: 0.6529
 epoch: 34, train_loss: 0.5927, test_loss: 1.1406, test_f1: 0.5814
 epoch: 35, train_loss: 0.5813, test_loss: 1.1444, test_f1: 0.5535
 epoch: 36, train_loss: 0.5613, test_loss: 1.0421, test_f1: 0.6288
 epoch: 37, train_loss: 0.5332, test_loss: 1.1012, test_f1: 0.6022
 epoch: 38, train_loss: 0.5295, test_loss: 2.4398, test_f1: 0.5109
 epoch: 39, train_loss: 0.6072, test_loss: 1.1053, test_f1: 0.6116
 epoch: 40, train_loss: 0.5934, test_loss: 1.2846, test_f1: 0.5091
 epoch: 41, train_loss: 0.6226, test_loss: 1.2804, test_f1: 0.5078
 epoch: 42, train_loss: 0.6179, test_loss: 1.1418, test_f1: 0.6044
 epoch: 43, train_loss: 0.5941, test_loss: 1.3500, test_f1: 0.5322
 epoch: 44, train_loss: 0.6421, test_loss: 1.0525, test_f1: 0.5733
 epoch: 45, train_loss: 0.6057, test_loss: 1.3014, test_f1: 0.5136
 epoch: 46, train_loss: 0.5827, test_loss: 1.0052, test_f1: 0.6105
 epoch: 47, train_loss: 0.5571, test_loss: 1.0580, test_f1: 0.5904
 epoch: 48, train_loss: 0.5507, test_loss: 1.0133, test_f1: 0.6013
 epoch: 49, train_loss: 0.4993, test_loss: 1.2410, test_f1: 0.5445
 epoch: 50, train_loss: 0.5054, test_loss: 1.0993, test_f1: 0.5795
 epoch: 51, train_loss: 0.4795, test_loss: 1.1509, test_f1: 0.5536
 epoch: 52, train_loss: 0.4723, test_loss: 1.1475, test_f1: 0.5952
 epoch: 53, train_loss: 0.4469, test_loss: 1.1581, test_f1: 0.5867
 epoch: 54, train_loss: 0.4509, test_loss: 1.1933, test_f1: 0.5437
 epoch: 55, train_loss: 0.4400, test_loss: 1.3118, test_f1: 0.5610
 epoch: 56, train_loss: 0.4539, test_loss: 1.2811, test_f1: 0.5812
 epoch: 57, train_loss: 0.4402, test_loss: 1.2489, test_f1: 0.5882
 epoch: 58, train_loss: 0.4260, test_loss: 1.4702, test_f1: 0.4999
 epoch: 59, train_loss: 0.4063, test_loss: 1.2404, test_f1: 0.5890
 epoch: 60, train_loss: 0.4490, test_loss: 1.4082, test_f1: 0.5680
 epoch: 61, train_loss: 0.4281, test_loss: 1.3222, test_f1: 0.5702
 epoch: 62, train_loss: 0.4323, test_loss: 1.4926, test_f1: 0.5755
 epoch: 63, train_loss: 0.4422, test_loss: 1.4069, test_f1: 0.5451
 epoch: 64, train_loss: 0.4569, test_loss: 1.3027, test_f1: 0.5540
 epoch: 65, train_loss: 0.4608, test_loss: 1.3457, test_f1: 0.5250
 epoch: 66, train_loss: 0.4307, test_loss: 1.4522, test_f1: 0.5498
 epoch: 67, train_loss: 0.4029, test_loss: 1.3113, test_f1: 0.5911
 epoch: 68, train_loss: 0.3773, test_loss: 1.3608, test_f1: 0.5539
 epoch: 69, train_loss: 0.4140, test_loss: 1.4362, test_f1: 0.5489
 epoch: 70, train_loss: 0.4872, test_loss: 1.6270, test_f1: 0.5003
 epoch: 71, train_loss: 0.5195, test_loss: 1.3493, test_f1: 0.5499
 epoch: 72, train_loss: 0.4764, test_loss: 1.1995, test_f1: 0.5971
 epoch: 73, train_loss: 0.4476, test_loss: 1.3662, test_f1: 0.5598
 epoch: 74, train_loss: 0.4057, test_loss: 1.1355, test_f1: 0.6067
 epoch: 75, train_loss: 0.4096, test_loss: 1.1818, test_f1: 0.5452
 epoch: 76, train_loss: 0.3882, test_loss: 1.1864, test_f1: 0.6075
 epoch: 77, train_loss: 0.3852, test_loss: 1.2582, test_f1: 0.6048
 epoch: 78, train_loss: 0.3688, test_loss: 1.3073, test_f1: 0.6163
 epoch: 79, train_loss: 0.3605, test_loss: 1.4853, test_f1: 0.6183
 epoch: 80, train_loss: 0.4008, test_loss: 1.4419, test_f1: 0.5542
 epoch: 81, train_loss: 0.3965, test_loss: 1.4270, test_f1: 0.5916
 epoch: 82, train_loss: 0.3906, test_loss: 1.3164, test_f1: 0.5678
 epoch: 83, train_loss: 0.3791, test_loss: 1.3553, test_f1: 0.5760
 epoch: 84, train_loss: 0.3581, test_loss: 1.4210, test_f1: 0.5810
 epoch: 85, train_loss: 0.3366, test_loss: 1.4926, test_f1: 0.5596
 epoch: 86, train_loss: 0.3775, test_loss: 1.2825, test_f1: 0.5712
 epoch: 87, train_loss: 0.3511, test_loss: 1.2984, test_f1: 0.5891
 epoch: 88, train_loss: 0.3310, test_loss: 1.4505, test_f1: 0.6337
 epoch: 89, train_loss: 0.3334, test_loss: 1.6548, test_f1: 0.6004
 epoch: 90, train_loss: 0.3263, test_loss: 1.6728, test_f1: 0.5767
 epoch: 91, train_loss: 0.3672, test_loss: 1.5548, test_f1: 0.5778
 epoch: 92, train_loss: 0.3484, test_loss: 1.5093, test_f1: 0.6128
 epoch: 93, train_loss: 0.3321, test_loss: 1.2869, test_f1: 0.6599
 epoch: 94, train_loss: 0.3087, test_loss: 1.6936, test_f1: 0.5660
 epoch: 95, train_loss: 0.3293, test_loss: 1.5605, test_f1: 0.5599
 epoch: 96, train_loss: 0.3256, test_loss: 1.5002, test_f1: 0.5989
 epoch: 97, train_loss: 0.3102, test_loss: 1.4431, test_f1: 0.6145
 epoch: 98, train_loss: 0.3087, test_loss: 1.4511, test_f1: 0.6314
 epoch: 99, train_loss: 0.2975, test_loss: 1.7493, test_f1: 0.5923
##################ITERATION #5 ****************************************
 epoch: 0, train_loss: 1.8241, test_loss: 1.7568, test_f1: 0.3388
 epoch: 1, train_loss: 1.0856, test_loss: 1.5200, test_f1: 0.3106
 epoch: 2, train_loss: 1.0429, test_loss: 1.2749, test_f1: 0.3017
 epoch: 3, train_loss: 0.9885, test_loss: 1.1713, test_f1: 0.4415
 epoch: 4, train_loss: 0.9507, test_loss: 1.1853, test_f1: 0.4639
 epoch: 5, train_loss: 0.9326, test_loss: 1.1343, test_f1: 0.4849
 epoch: 6, train_loss: 0.8727, test_loss: 1.0830, test_f1: 0.5180
 epoch: 7, train_loss: 0.8697, test_loss: 1.2418, test_f1: 0.3491
 epoch: 8, train_loss: 0.8550, test_loss: 1.0558, test_f1: 0.5137
 epoch: 9, train_loss: 0.8283, test_loss: 1.6305, test_f1: 0.3140
 epoch: 10, train_loss: 0.8073, test_loss: 1.2348, test_f1: 0.4463
 epoch: 11, train_loss: 0.7893, test_loss: 1.0350, test_f1: 0.5375
 epoch: 12, train_loss: 0.7670, test_loss: 1.1516, test_f1: 0.5584
 epoch: 13, train_loss: 0.7738, test_loss: 1.0381, test_f1: 0.5942
 epoch: 14, train_loss: 0.7489, test_loss: 1.1295, test_f1: 0.5486
 epoch: 15, train_loss: 0.7413, test_loss: 1.2012, test_f1: 0.5163
 epoch: 16, train_loss: 0.7639, test_loss: 1.1477, test_f1: 0.4874
 epoch: 17, train_loss: 0.7468, test_loss: 1.0506, test_f1: 0.5348
 epoch: 18, train_loss: 0.7010, test_loss: 1.0641, test_f1: 0.5284
 epoch: 19, train_loss: 0.6975, test_loss: 1.2894, test_f1: 0.4538
 epoch: 20, train_loss: 0.7132, test_loss: 1.3493, test_f1: 0.4655
 epoch: 21, train_loss: 0.7200, test_loss: 2.1660, test_f1: 0.3055
 epoch: 22, train_loss: 0.7385, test_loss: 1.4701, test_f1: 0.3127
 epoch: 23, train_loss: 0.7054, test_loss: 1.1198, test_f1: 0.4860
 epoch: 24, train_loss: 0.6862, test_loss: 0.9545, test_f1: 0.5905
 epoch: 25, train_loss: 0.6515, test_loss: 0.9703, test_f1: 0.6131
 epoch: 26, train_loss: 0.6344, test_loss: 1.4109, test_f1: 0.4795
 epoch: 27, train_loss: 0.6179, test_loss: 1.1656, test_f1: 0.5035
 epoch: 28, train_loss: 0.6121, test_loss: 1.1196, test_f1: 0.5989
 epoch: 29, train_loss: 0.6506, test_loss: 1.4741, test_f1: 0.5286
 epoch: 30, train_loss: 0.6320, test_loss: 1.1379, test_f1: 0.4894
 epoch: 31, train_loss: 0.6283, test_loss: 1.0099, test_f1: 0.5429
 epoch: 32, train_loss: 0.6380, test_loss: 1.1623, test_f1: 0.5061
 epoch: 33, train_loss: 0.6300, test_loss: 1.3216, test_f1: 0.4679
 epoch: 34, train_loss: 0.6447, test_loss: 1.5108, test_f1: 0.4385
 epoch: 35, train_loss: 0.6614, test_loss: 1.0223, test_f1: 0.6032
 epoch: 36, train_loss: 0.6428, test_loss: 1.2430, test_f1: 0.5242
 epoch: 37, train_loss: 0.6531, test_loss: 1.2838, test_f1: 0.5346
 epoch: 38, train_loss: 0.6221, test_loss: 1.5372, test_f1: 0.5408
 epoch: 39, train_loss: 0.5964, test_loss: 1.4158, test_f1: 0.4933
 epoch: 40, train_loss: 0.6009, test_loss: 1.6576, test_f1: 0.4314
 epoch: 41, train_loss: 0.6095, test_loss: 1.1845, test_f1: 0.4793
 epoch: 42, train_loss: 0.5969, test_loss: 1.0596, test_f1: 0.5963
 epoch: 43, train_loss: 0.5642, test_loss: 1.1035, test_f1: 0.5962
 epoch: 44, train_loss: 0.5630, test_loss: 1.1281, test_f1: 0.5776
 epoch: 45, train_loss: 0.5709, test_loss: 1.1969, test_f1: 0.6331
 epoch: 46, train_loss: 0.5515, test_loss: 1.2223, test_f1: 0.5942
 epoch: 47, train_loss: 0.5550, test_loss: 1.3587, test_f1: 0.5670
 epoch: 48, train_loss: 0.5618, test_loss: 1.1566, test_f1: 0.5927
 epoch: 49, train_loss: 0.5745, test_loss: 1.4410, test_f1: 0.5773
 epoch: 50, train_loss: 0.5461, test_loss: 1.5716, test_f1: 0.5896
 epoch: 51, train_loss: 0.5045, test_loss: 1.1809, test_f1: 0.5999
 epoch: 52, train_loss: 0.4834, test_loss: 1.4261, test_f1: 0.5586
 epoch: 53, train_loss: 0.4564, test_loss: 1.2351, test_f1: 0.5845
 epoch: 54, train_loss: 0.4715, test_loss: 1.1470, test_f1: 0.5827
 epoch: 55, train_loss: 0.4702, test_loss: 1.1599, test_f1: 0.6143
 epoch: 56, train_loss: 0.4678, test_loss: 1.2549, test_f1: 0.5710
 epoch: 57, train_loss: 0.4689, test_loss: 1.1956, test_f1: 0.5819
 epoch: 58, train_loss: 0.4359, test_loss: 1.1535, test_f1: 0.6085
 epoch: 59, train_loss: 0.4033, test_loss: 1.2624, test_f1: 0.5653
 epoch: 60, train_loss: 0.4163, test_loss: 1.5614, test_f1: 0.5313
 epoch: 61, train_loss: 0.4252, test_loss: 1.5783, test_f1: 0.5416
 epoch: 62, train_loss: 0.4274, test_loss: 1.5221, test_f1: 0.5355
 epoch: 63, train_loss: 0.4309, test_loss: 1.4473, test_f1: 0.5525
 epoch: 64, train_loss: 0.4726, test_loss: 1.3863, test_f1: 0.5855
 epoch: 65, train_loss: 0.4206, test_loss: 1.5650, test_f1: 0.6041
 epoch: 66, train_loss: 0.3983, test_loss: 1.5416, test_f1: 0.5923
 epoch: 67, train_loss: 0.4143, test_loss: 1.6226, test_f1: 0.5586
 epoch: 68, train_loss: 0.4796, test_loss: 1.5885, test_f1: 0.4999
 epoch: 69, train_loss: 0.5406, test_loss: 1.4767, test_f1: 0.5809
 epoch: 70, train_loss: 0.5212, test_loss: 1.3323, test_f1: 0.5698
 epoch: 71, train_loss: 0.4729, test_loss: 1.5361, test_f1: 0.6073
 epoch: 72, train_loss: 0.4304, test_loss: 1.8620, test_f1: 0.5769
 epoch: 73, train_loss: 0.4036, test_loss: 1.4881, test_f1: 0.6074
 epoch: 74, train_loss: 0.4110, test_loss: 1.6515, test_f1: 0.6271
 epoch: 75, train_loss: 0.3975, test_loss: 1.7784, test_f1: 0.6074
 epoch: 76, train_loss: 0.3731, test_loss: 1.6060, test_f1: 0.6084
 epoch: 77, train_loss: 0.3895, test_loss: 1.6815, test_f1: 0.6266
 epoch: 78, train_loss: 0.3990, test_loss: 2.0901, test_f1: 0.5632
 epoch: 79, train_loss: 0.4100, test_loss: 1.8421, test_f1: 0.6186
 epoch: 80, train_loss: 0.4621, test_loss: 1.8207, test_f1: 0.5584
 epoch: 81, train_loss: 0.4276, test_loss: 1.6387, test_f1: 0.5814
 epoch: 82, train_loss: 0.4450, test_loss: 1.3771, test_f1: 0.5959
 epoch: 83, train_loss: 0.4011, test_loss: 1.6575, test_f1: 0.5884
 epoch: 84, train_loss: 0.4178, test_loss: 1.6310, test_f1: 0.6086
 epoch: 85, train_loss: 0.4412, test_loss: 1.6735, test_f1: 0.5843
 epoch: 86, train_loss: 0.4158, test_loss: 1.2029, test_f1: 0.6081
 epoch: 87, train_loss: 0.3970, test_loss: 1.4063, test_f1: 0.5668
 epoch: 88, train_loss: 0.3898, test_loss: 1.7252, test_f1: 0.5819
 epoch: 89, train_loss: 0.3521, test_loss: 1.6104, test_f1: 0.5791
 epoch: 90, train_loss: 0.3654, test_loss: 1.7317, test_f1: 0.5939
 epoch: 91, train_loss: 0.3599, test_loss: 1.6329, test_f1: 0.5700
 epoch: 92, train_loss: 0.3182, test_loss: 1.4919, test_f1: 0.6002
 epoch: 93, train_loss: 0.3293, test_loss: 1.4588, test_f1: 0.5964
 epoch: 94, train_loss: 0.3210, test_loss: 1.5629, test_f1: 0.5817
 epoch: 95, train_loss: 0.3170, test_loss: 1.7926, test_f1: 0.5992
 epoch: 96, train_loss: 0.3487, test_loss: 2.0566, test_f1: 0.5689
 epoch: 97, train_loss: 0.3318, test_loss: 1.6092, test_f1: 0.6327
 epoch: 98, train_loss: 0.3381, test_loss: 1.4504, test_f1: 0.6092
 epoch: 99, train_loss: 0.3530, test_loss: 1.3482, test_f1: 0.6220
##################ITERATION #6 ****************************************
 epoch: 0, train_loss: 1.4285, test_loss: 1.4273, test_f1: 0.3369
 epoch: 1, train_loss: 1.0794, test_loss: 1.4824, test_f1: 0.3132
 epoch: 2, train_loss: 0.9747, test_loss: 1.4548, test_f1: 0.2860
 epoch: 3, train_loss: 0.9213, test_loss: 1.1390, test_f1: 0.4744
 epoch: 4, train_loss: 0.8788, test_loss: 1.3981, test_f1: 0.3260
 epoch: 5, train_loss: 0.8360, test_loss: 1.6453, test_f1: 0.2474
 epoch: 6, train_loss: 0.8267, test_loss: 1.7933, test_f1: 0.2012
 epoch: 7, train_loss: 0.8032, test_loss: 1.2598, test_f1: 0.4415
 epoch: 8, train_loss: 0.7763, test_loss: 0.9804, test_f1: 0.6168
 epoch: 9, train_loss: 0.7779, test_loss: 1.0331, test_f1: 0.6056
 epoch: 10, train_loss: 0.7715, test_loss: 1.1086, test_f1: 0.5223
 epoch: 11, train_loss: 0.7645, test_loss: 1.0334, test_f1: 0.5589
 epoch: 12, train_loss: 0.7563, test_loss: 1.0708, test_f1: 0.5482
 epoch: 13, train_loss: 0.7550, test_loss: 0.9698, test_f1: 0.5785
 epoch: 14, train_loss: 0.7489, test_loss: 1.0463, test_f1: 0.5750
 epoch: 15, train_loss: 0.7291, test_loss: 1.2241, test_f1: 0.5352
 epoch: 16, train_loss: 0.7410, test_loss: 1.1801, test_f1: 0.5331
 epoch: 17, train_loss: 0.7351, test_loss: 1.0491, test_f1: 0.5885
 epoch: 18, train_loss: 0.7310, test_loss: 1.1039, test_f1: 0.5868
 epoch: 19, train_loss: 0.7321, test_loss: 0.9792, test_f1: 0.5952
 epoch: 20, train_loss: 0.7075, test_loss: 1.1664, test_f1: 0.5455
 epoch: 21, train_loss: 0.6825, test_loss: 1.0025, test_f1: 0.5891
 epoch: 22, train_loss: 0.6953, test_loss: 1.2710, test_f1: 0.5846
 epoch: 23, train_loss: 0.6585, test_loss: 1.0848, test_f1: 0.5943
 epoch: 24, train_loss: 0.6522, test_loss: 1.0052, test_f1: 0.6440
 epoch: 25, train_loss: 0.6376, test_loss: 1.1406, test_f1: 0.5560
 epoch: 26, train_loss: 0.6337, test_loss: 1.2387, test_f1: 0.5311
 epoch: 27, train_loss: 0.6991, test_loss: 1.2342, test_f1: 0.5036
 epoch: 28, train_loss: 0.7024, test_loss: 1.3951, test_f1: 0.4994
 epoch: 29, train_loss: 0.7044, test_loss: 1.2323, test_f1: 0.5478
 epoch: 30, train_loss: 0.6913, test_loss: 1.2241, test_f1: 0.5319
 epoch: 31, train_loss: 0.6494, test_loss: 1.0383, test_f1: 0.6014
 epoch: 32, train_loss: 0.6325, test_loss: 1.0049, test_f1: 0.5667
 epoch: 33, train_loss: 0.6046, test_loss: 1.0326, test_f1: 0.6362
 epoch: 34, train_loss: 0.5851, test_loss: 1.0690, test_f1: 0.5980
 epoch: 35, train_loss: 0.5964, test_loss: 1.4509, test_f1: 0.5400
 epoch: 36, train_loss: 0.5945, test_loss: 1.3479, test_f1: 0.5373
 epoch: 37, train_loss: 0.5946, test_loss: 1.1662, test_f1: 0.5883
 epoch: 38, train_loss: 0.5688, test_loss: 1.3060, test_f1: 0.5485
 epoch: 39, train_loss: 0.5683, test_loss: 1.3824, test_f1: 0.5333
 epoch: 40, train_loss: 0.6117, test_loss: 0.9890, test_f1: 0.6545
 epoch: 41, train_loss: 0.6114, test_loss: 1.2411, test_f1: 0.6004
 epoch: 42, train_loss: 0.5914, test_loss: 1.2319, test_f1: 0.5989
 epoch: 43, train_loss: 0.5757, test_loss: 1.1619, test_f1: 0.5651
 epoch: 44, train_loss: 0.5535, test_loss: 1.3447, test_f1: 0.5506
 epoch: 45, train_loss: 0.5360, test_loss: 1.0372, test_f1: 0.5989
 epoch: 46, train_loss: 0.5067, test_loss: 1.1967, test_f1: 0.6019
 epoch: 47, train_loss: 0.4770, test_loss: 1.3391, test_f1: 0.6131
 epoch: 48, train_loss: 0.4439, test_loss: 1.2952, test_f1: 0.6056
 epoch: 49, train_loss: 0.5295, test_loss: 1.2959, test_f1: 0.6029
 epoch: 50, train_loss: 0.5003, test_loss: 1.1179, test_f1: 0.6179
 epoch: 51, train_loss: 0.4861, test_loss: 1.0934, test_f1: 0.6465
 epoch: 52, train_loss: 0.4689, test_loss: 1.1218, test_f1: 0.5886
 epoch: 53, train_loss: 0.4555, test_loss: 1.2310, test_f1: 0.6188
 epoch: 54, train_loss: 0.4709, test_loss: 1.1975, test_f1: 0.6115
 epoch: 55, train_loss: 0.4335, test_loss: 1.3384, test_f1: 0.5697
 epoch: 56, train_loss: 0.4432, test_loss: 1.2201, test_f1: 0.6094
 epoch: 57, train_loss: 0.4196, test_loss: 1.1688, test_f1: 0.6296
 epoch: 58, train_loss: 0.4105, test_loss: 1.1895, test_f1: 0.6357
 epoch: 59, train_loss: 0.4297, test_loss: 1.1519, test_f1: 0.6382
 epoch: 60, train_loss: 0.3948, test_loss: 1.2387, test_f1: 0.6370
 epoch: 61, train_loss: 0.4107, test_loss: 1.2206, test_f1: 0.6353
 epoch: 62, train_loss: 0.3980, test_loss: 1.4677, test_f1: 0.6092
 epoch: 63, train_loss: 0.3913, test_loss: 1.2789, test_f1: 0.5976
 epoch: 64, train_loss: 0.4090, test_loss: 1.2289, test_f1: 0.5707
 epoch: 65, train_loss: 0.4178, test_loss: 1.1558, test_f1: 0.6118
 epoch: 66, train_loss: 0.4195, test_loss: 1.1515, test_f1: 0.6284
 epoch: 67, train_loss: 0.4057, test_loss: 1.0997, test_f1: 0.6365
 epoch: 68, train_loss: 0.3900, test_loss: 1.2040, test_f1: 0.6440
 epoch: 69, train_loss: 0.3900, test_loss: 1.2262, test_f1: 0.6518
 epoch: 70, train_loss: 0.4325, test_loss: 1.2284, test_f1: 0.5887
 epoch: 71, train_loss: 0.3767, test_loss: 1.3947, test_f1: 0.6198
 epoch: 72, train_loss: 0.3802, test_loss: 1.4231, test_f1: 0.6399
 epoch: 73, train_loss: 0.3397, test_loss: 1.5563, test_f1: 0.6129
 epoch: 74, train_loss: 0.3806, test_loss: 1.5608, test_f1: 0.6054
 epoch: 75, train_loss: 0.3732, test_loss: 1.5836, test_f1: 0.5941
 epoch: 76, train_loss: 0.4267, test_loss: 1.5389, test_f1: 0.6073
 epoch: 77, train_loss: 0.4228, test_loss: 1.2594, test_f1: 0.6373
 epoch: 78, train_loss: 0.3896, test_loss: 1.2665, test_f1: 0.6257
 epoch: 79, train_loss: 0.3965, test_loss: 1.6056, test_f1: 0.5798
 epoch: 80, train_loss: 0.3522, test_loss: 1.4176, test_f1: 0.5945
 epoch: 81, train_loss: 0.3606, test_loss: 1.2804, test_f1: 0.6295
 epoch: 82, train_loss: 0.3256, test_loss: 1.4606, test_f1: 0.6365
 epoch: 83, train_loss: 0.3264, test_loss: 1.4492, test_f1: 0.6508
 epoch: 84, train_loss: 0.3072, test_loss: 1.6534, test_f1: 0.6216
 epoch: 85, train_loss: 0.3149, test_loss: 1.5349, test_f1: 0.6184
 epoch: 86, train_loss: 0.3155, test_loss: 1.5474, test_f1: 0.6330
 epoch: 87, train_loss: 0.3020, test_loss: 1.4323, test_f1: 0.6409
 epoch: 88, train_loss: 0.3258, test_loss: 1.5259, test_f1: 0.6134
 epoch: 89, train_loss: 0.3092, test_loss: 1.5424, test_f1: 0.6350
 epoch: 90, train_loss: 0.3420, test_loss: 1.2090, test_f1: 0.6291
 epoch: 91, train_loss: 0.3492, test_loss: 1.4239, test_f1: 0.5967
 epoch: 92, train_loss: 0.3318, test_loss: 1.3566, test_f1: 0.6300
 epoch: 93, train_loss: 0.3531, test_loss: 1.5558, test_f1: 0.5989
 epoch: 94, train_loss: 0.3552, test_loss: 1.6630, test_f1: 0.6128
 epoch: 95, train_loss: 0.3328, test_loss: 1.7330, test_f1: 0.5824
 epoch: 96, train_loss: 0.3455, test_loss: 1.5546, test_f1: 0.6102
 epoch: 97, train_loss: 0.3315, test_loss: 1.9883, test_f1: 0.5484
 epoch: 98, train_loss: 0.3128, test_loss: 1.8613, test_f1: 0.6113
 epoch: 99, train_loss: 0.4205, test_loss: 1.6225, test_f1: 0.5914
##################ITERATION #7 ****************************************
 epoch: 0, train_loss: 1.3770, test_loss: 1.5138, test_f1: 0.3350
 epoch: 1, train_loss: 1.1074, test_loss: 1.3792, test_f1: 0.3054
 epoch: 2, train_loss: 0.9909, test_loss: 1.3125, test_f1: 0.3104
 epoch: 3, train_loss: 0.9371, test_loss: 1.1632, test_f1: 0.4377
 epoch: 4, train_loss: 0.8841, test_loss: 1.0902, test_f1: 0.5403
 epoch: 5, train_loss: 0.8583, test_loss: 1.0304, test_f1: 0.5396
 epoch: 6, train_loss: 0.8254, test_loss: 1.1367, test_f1: 0.5096
 epoch: 7, train_loss: 0.8113, test_loss: 1.2221, test_f1: 0.4438
 epoch: 8, train_loss: 0.7750, test_loss: 1.2112, test_f1: 0.5111
 epoch: 9, train_loss: 0.7780, test_loss: 1.3695, test_f1: 0.4518
 epoch: 10, train_loss: 0.7554, test_loss: 1.9697, test_f1: 0.3644
 epoch: 11, train_loss: 0.7626, test_loss: 1.0212, test_f1: 0.5698
 epoch: 12, train_loss: 0.7488, test_loss: 1.1008, test_f1: 0.5643
 epoch: 13, train_loss: 0.7471, test_loss: 2.2828, test_f1: 0.3396
 epoch: 14, train_loss: 0.7409, test_loss: 1.6547, test_f1: 0.4612
 epoch: 15, train_loss: 0.7338, test_loss: 0.9623, test_f1: 0.6294
 epoch: 16, train_loss: 0.7153, test_loss: 1.0492, test_f1: 0.5837
 epoch: 17, train_loss: 0.6780, test_loss: 1.0109, test_f1: 0.6191
 epoch: 18, train_loss: 0.6999, test_loss: 1.0115, test_f1: 0.6519
 epoch: 19, train_loss: 0.6983, test_loss: 1.0413, test_f1: 0.5970
 epoch: 20, train_loss: 0.6811, test_loss: 1.7730, test_f1: 0.4878
 epoch: 21, train_loss: 0.6739, test_loss: 1.2881, test_f1: 0.5449
 epoch: 22, train_loss: 0.7162, test_loss: 1.1715, test_f1: 0.5482
 epoch: 23, train_loss: 0.6805, test_loss: 1.0045, test_f1: 0.5978
 epoch: 24, train_loss: 0.6750, test_loss: 1.3416, test_f1: 0.4909
 epoch: 25, train_loss: 0.6988, test_loss: 1.3848, test_f1: 0.4346
 epoch: 26, train_loss: 0.6983, test_loss: 1.2080, test_f1: 0.5933
 epoch: 27, train_loss: 0.6634, test_loss: 1.2147, test_f1: 0.5401
 epoch: 28, train_loss: 0.6460, test_loss: 1.0827, test_f1: 0.6067
 epoch: 29, train_loss: 0.6844, test_loss: 1.0263, test_f1: 0.5765
 epoch: 30, train_loss: 0.6177, test_loss: 1.1587, test_f1: 0.5180
 epoch: 31, train_loss: 0.6394, test_loss: 0.9878, test_f1: 0.5875
 epoch: 32, train_loss: 0.5945, test_loss: 1.0057, test_f1: 0.6377
 epoch: 33, train_loss: 0.6334, test_loss: 1.1503, test_f1: 0.5937
 epoch: 34, train_loss: 0.6262, test_loss: 1.0531, test_f1: 0.5475
 epoch: 35, train_loss: 0.6186, test_loss: 1.2788, test_f1: 0.4759
 epoch: 36, train_loss: 0.6123, test_loss: 1.1628, test_f1: 0.5719
 epoch: 37, train_loss: 0.6032, test_loss: 1.2584, test_f1: 0.5417
 epoch: 38, train_loss: 0.6020, test_loss: 1.2176, test_f1: 0.5983
 epoch: 39, train_loss: 0.5834, test_loss: 1.0145, test_f1: 0.6250
 epoch: 40, train_loss: 0.5868, test_loss: 1.6191, test_f1: 0.5186
 epoch: 41, train_loss: 0.5882, test_loss: 1.5819, test_f1: 0.4857
 epoch: 42, train_loss: 0.6010, test_loss: 1.0162, test_f1: 0.6558
 epoch: 43, train_loss: 0.5707, test_loss: 1.1355, test_f1: 0.5854
 epoch: 44, train_loss: 0.5482, test_loss: 1.4204, test_f1: 0.6006
 epoch: 45, train_loss: 0.5431, test_loss: 1.1300, test_f1: 0.6037
 epoch: 46, train_loss: 0.5771, test_loss: 1.1467, test_f1: 0.6277
 epoch: 47, train_loss: 0.5296, test_loss: 1.1070, test_f1: 0.6312
 epoch: 48, train_loss: 0.5227, test_loss: 1.1528, test_f1: 0.6440
 epoch: 49, train_loss: 0.5102, test_loss: 1.1416, test_f1: 0.5510
 epoch: 50, train_loss: 0.6176, test_loss: 1.2224, test_f1: 0.5166
 epoch: 51, train_loss: 0.5440, test_loss: 1.0139, test_f1: 0.6228
 epoch: 52, train_loss: 0.5116, test_loss: 1.1001, test_f1: 0.6706
 epoch: 53, train_loss: 0.4723, test_loss: 1.2602, test_f1: 0.6525
 epoch: 54, train_loss: 0.4696, test_loss: 1.2211, test_f1: 0.6211
 epoch: 55, train_loss: 0.4579, test_loss: 1.3644, test_f1: 0.6267
 epoch: 56, train_loss: 0.4694, test_loss: 1.1699, test_f1: 0.6427
 epoch: 57, train_loss: 0.4744, test_loss: 1.0659, test_f1: 0.6680
 epoch: 58, train_loss: 0.4557, test_loss: 1.2977, test_f1: 0.6084
 epoch: 59, train_loss: 0.4346, test_loss: 1.3148, test_f1: 0.6237
 epoch: 60, train_loss: 0.4270, test_loss: 1.1866, test_f1: 0.6608
 epoch: 61, train_loss: 0.4072, test_loss: 1.3426, test_f1: 0.6349
 epoch: 62, train_loss: 0.4095, test_loss: 1.3617, test_f1: 0.6399
 epoch: 63, train_loss: 0.3767, test_loss: 1.1936, test_f1: 0.6854
 epoch: 64, train_loss: 0.3992, test_loss: 1.3204, test_f1: 0.6680
 epoch: 65, train_loss: 0.4764, test_loss: 1.3691, test_f1: 0.5892
 epoch: 66, train_loss: 0.4358, test_loss: 1.1440, test_f1: 0.6429
 epoch: 67, train_loss: 0.4257, test_loss: 1.1334, test_f1: 0.6482
 epoch: 68, train_loss: 0.4022, test_loss: 1.3038, test_f1: 0.6224
 epoch: 69, train_loss: 0.4058, test_loss: 1.2098, test_f1: 0.6728
 epoch: 70, train_loss: 0.3944, test_loss: 1.2219, test_f1: 0.6254
 epoch: 71, train_loss: 0.4098, test_loss: 1.7782, test_f1: 0.5247
 epoch: 72, train_loss: 0.4039, test_loss: 1.3754, test_f1: 0.6198
 epoch: 73, train_loss: 0.3594, test_loss: 1.7320, test_f1: 0.5730
 epoch: 74, train_loss: 0.3684, test_loss: 1.6932, test_f1: 0.5801
 epoch: 75, train_loss: 0.3563, test_loss: 1.6801, test_f1: 0.6193
 epoch: 76, train_loss: 0.3654, test_loss: 1.6017, test_f1: 0.6070
 epoch: 77, train_loss: 0.3607, test_loss: 1.5488, test_f1: 0.6138
 epoch: 78, train_loss: 0.3390, test_loss: 1.4925, test_f1: 0.6086
 epoch: 79, train_loss: 0.3537, test_loss: 1.4916, test_f1: 0.6268
 epoch: 80, train_loss: 0.3599, test_loss: 1.6176, test_f1: 0.5576
 epoch: 81, train_loss: 0.3936, test_loss: 1.4535, test_f1: 0.6009
 epoch: 82, train_loss: 0.4128, test_loss: 1.2611, test_f1: 0.6085
 epoch: 83, train_loss: 0.4149, test_loss: 1.3135, test_f1: 0.6166
 epoch: 84, train_loss: 0.3820, test_loss: 1.3159, test_f1: 0.6761
 epoch: 85, train_loss: 0.4352, test_loss: 1.4385, test_f1: 0.6027
 epoch: 86, train_loss: 0.3984, test_loss: 1.4419, test_f1: 0.5765
 epoch: 87, train_loss: 0.3776, test_loss: 1.2514, test_f1: 0.6462
 epoch: 88, train_loss: 0.3913, test_loss: 1.3291, test_f1: 0.6390
 epoch: 89, train_loss: 0.3381, test_loss: 1.5406, test_f1: 0.6166
 epoch: 90, train_loss: 0.3110, test_loss: 1.5848, test_f1: 0.6368
 epoch: 91, train_loss: 0.3407, test_loss: 1.7145, test_f1: 0.6459
 epoch: 92, train_loss: 0.5155, test_loss: 1.9083, test_f1: 0.6064
 epoch: 93, train_loss: 0.5061, test_loss: 1.5751, test_f1: 0.5813
 epoch: 94, train_loss: 0.4432, test_loss: 1.4503, test_f1: 0.6399
 epoch: 95, train_loss: 0.4327, test_loss: 1.3804, test_f1: 0.6416
 epoch: 96, train_loss: 0.4173, test_loss: 1.4542, test_f1: 0.6143
 epoch: 97, train_loss: 0.4313, test_loss: 1.4087, test_f1: 0.6444
 epoch: 98, train_loss: 0.4031, test_loss: 1.3441, test_f1: 0.6916
 epoch: 99, train_loss: 0.3700, test_loss: 1.3267, test_f1: 0.6542
##################ITERATION #8 ****************************************
 epoch: 0, train_loss: 1.8402, test_loss: 1.6254, test_f1: 0.3139
 epoch: 1, train_loss: 1.0965, test_loss: 1.3852, test_f1: 0.3432
 epoch: 2, train_loss: 1.0113, test_loss: 1.3798, test_f1: 0.3486
 epoch: 3, train_loss: 0.9815, test_loss: 1.3708, test_f1: 0.3970
 epoch: 4, train_loss: 0.9626, test_loss: 1.2982, test_f1: 0.4275
 epoch: 5, train_loss: 0.9225, test_loss: 1.1214, test_f1: 0.4249
 epoch: 6, train_loss: 0.9023, test_loss: 1.0742, test_f1: 0.5046
 epoch: 7, train_loss: 0.8694, test_loss: 1.0408, test_f1: 0.5180
 epoch: 8, train_loss: 0.8530, test_loss: 1.1041, test_f1: 0.5226
 epoch: 9, train_loss: 0.8132, test_loss: 1.0409, test_f1: 0.5631
 epoch: 10, train_loss: 0.7934, test_loss: 1.0680, test_f1: 0.4650
 epoch: 11, train_loss: 0.7701, test_loss: 1.1213, test_f1: 0.4504
 epoch: 12, train_loss: 0.7851, test_loss: 2.4578, test_f1: 0.2835
 epoch: 13, train_loss: 0.7816, test_loss: 1.1677, test_f1: 0.4977
 epoch: 14, train_loss: 0.7759, test_loss: 1.0014, test_f1: 0.5805
 epoch: 15, train_loss: 0.7652, test_loss: 0.9964, test_f1: 0.6151
 epoch: 16, train_loss: 0.7793, test_loss: 0.9013, test_f1: 0.6581
 epoch: 17, train_loss: 0.7530, test_loss: 0.9835, test_f1: 0.6295
 epoch: 18, train_loss: 0.7770, test_loss: 1.0540, test_f1: 0.5497
 epoch: 19, train_loss: 0.7677, test_loss: 1.2134, test_f1: 0.4799
 epoch: 20, train_loss: 0.7435, test_loss: 1.3717, test_f1: 0.4555
 epoch: 21, train_loss: 0.7134, test_loss: 1.1724, test_f1: 0.5059
 epoch: 22, train_loss: 0.7224, test_loss: 1.4250, test_f1: 0.4478
 epoch: 23, train_loss: 0.6688, test_loss: 1.0161, test_f1: 0.6347
 epoch: 24, train_loss: 0.6650, test_loss: 1.3109, test_f1: 0.5827
 epoch: 25, train_loss: 0.6613, test_loss: 1.3107, test_f1: 0.5021
 epoch: 26, train_loss: 0.6508, test_loss: 1.0027, test_f1: 0.5950
 epoch: 27, train_loss: 0.6713, test_loss: 2.2888, test_f1: 0.3377
 epoch: 28, train_loss: 0.6779, test_loss: 1.3184, test_f1: 0.4303
 epoch: 29, train_loss: 0.6485, test_loss: 1.1385, test_f1: 0.5859
 epoch: 30, train_loss: 0.6373, test_loss: 1.1488, test_f1: 0.5829
 epoch: 31, train_loss: 0.6165, test_loss: 1.4121, test_f1: 0.5249
 epoch: 32, train_loss: 0.6228, test_loss: 1.1097, test_f1: 0.6635
 epoch: 33, train_loss: 0.6355, test_loss: 1.2284, test_f1: 0.6221
 epoch: 34, train_loss: 0.6135, test_loss: 1.1775, test_f1: 0.6228
 epoch: 35, train_loss: 0.6114, test_loss: 2.3963, test_f1: 0.4898
 epoch: 36, train_loss: 0.6038, test_loss: 1.4322, test_f1: 0.5919
 epoch: 37, train_loss: 0.6005, test_loss: 1.4409, test_f1: 0.6092
 epoch: 38, train_loss: 0.6393, test_loss: 1.4063, test_f1: 0.5713
 epoch: 39, train_loss: 0.6102, test_loss: 1.7909, test_f1: 0.6289
 epoch: 40, train_loss: 0.6036, test_loss: 1.2308, test_f1: 0.6389
 epoch: 41, train_loss: 0.6498, test_loss: 1.2361, test_f1: 0.5509
 epoch: 42, train_loss: 0.6462, test_loss: 1.4787, test_f1: 0.5800
 epoch: 43, train_loss: 0.5887, test_loss: 1.2127, test_f1: 0.6294
 epoch: 44, train_loss: 0.5563, test_loss: 1.1243, test_f1: 0.6433
 epoch: 45, train_loss: 0.5901, test_loss: 1.0281, test_f1: 0.6697
 epoch: 46, train_loss: 0.5667, test_loss: 1.1246, test_f1: 0.5931
 epoch: 47, train_loss: 0.6071, test_loss: 1.1449, test_f1: 0.4930
 epoch: 48, train_loss: 0.5655, test_loss: 1.3564, test_f1: 0.5577
 epoch: 49, train_loss: 0.5746, test_loss: 1.0552, test_f1: 0.6021
 epoch: 50, train_loss: 0.5508, test_loss: 1.1094, test_f1: 0.5801
 epoch: 51, train_loss: 0.5296, test_loss: 1.0376, test_f1: 0.6726
 epoch: 52, train_loss: 0.5008, test_loss: 1.1260, test_f1: 0.6612
 epoch: 53, train_loss: 0.4793, test_loss: 1.1427, test_f1: 0.6564
 epoch: 54, train_loss: 0.4841, test_loss: 1.3142, test_f1: 0.6210
 epoch: 55, train_loss: 0.4930, test_loss: 1.3419, test_f1: 0.6237
 epoch: 56, train_loss: 0.5104, test_loss: 1.2301, test_f1: 0.6274
 epoch: 57, train_loss: 0.4770, test_loss: 1.3619, test_f1: 0.5873
 epoch: 58, train_loss: 0.4680, test_loss: 1.1644, test_f1: 0.6569
 epoch: 59, train_loss: 0.4431, test_loss: 1.3476, test_f1: 0.5901
 epoch: 60, train_loss: 0.4518, test_loss: 1.2074, test_f1: 0.6169
 epoch: 61, train_loss: 0.4376, test_loss: 1.1724, test_f1: 0.6274
 epoch: 62, train_loss: 0.4446, test_loss: 1.2812, test_f1: 0.6310
 epoch: 63, train_loss: 0.4272, test_loss: 1.2573, test_f1: 0.6243
 epoch: 64, train_loss: 0.4459, test_loss: 1.0522, test_f1: 0.6608
 epoch: 65, train_loss: 0.4409, test_loss: 1.3038, test_f1: 0.5827
 epoch: 66, train_loss: 0.4441, test_loss: 1.3777, test_f1: 0.5685
 epoch: 67, train_loss: 0.4269, test_loss: 1.4891, test_f1: 0.6005
 epoch: 68, train_loss: 0.3993, test_loss: 1.3305, test_f1: 0.6322
 epoch: 69, train_loss: 0.4421, test_loss: 1.8611, test_f1: 0.5892
 epoch: 70, train_loss: 0.4712, test_loss: 1.4096, test_f1: 0.5950
 epoch: 71, train_loss: 0.4714, test_loss: 1.2628, test_f1: 0.6283
 epoch: 72, train_loss: 0.4294, test_loss: 1.0815, test_f1: 0.6289
 epoch: 73, train_loss: 0.4283, test_loss: 1.2165, test_f1: 0.6123
 epoch: 74, train_loss: 0.3953, test_loss: 1.2294, test_f1: 0.6547
 epoch: 75, train_loss: 0.3977, test_loss: 1.3177, test_f1: 0.6315
 epoch: 76, train_loss: 0.3613, test_loss: 1.2426, test_f1: 0.6472
 epoch: 77, train_loss: 0.3908, test_loss: 1.3712, test_f1: 0.6160
 epoch: 78, train_loss: 0.3459, test_loss: 1.3397, test_f1: 0.6356
 epoch: 79, train_loss: 0.3476, test_loss: 1.3371, test_f1: 0.6516
 epoch: 80, train_loss: 0.3578, test_loss: 1.2936, test_f1: 0.6643
 epoch: 81, train_loss: 0.4136, test_loss: 1.3847, test_f1: 0.6296
 epoch: 82, train_loss: 0.4491, test_loss: 1.4533, test_f1: 0.6159
 epoch: 83, train_loss: 0.4626, test_loss: 1.3961, test_f1: 0.6070
 epoch: 84, train_loss: 0.4421, test_loss: 1.4321, test_f1: 0.5517
 epoch: 85, train_loss: 0.4398, test_loss: 1.3530, test_f1: 0.6056
 epoch: 86, train_loss: 0.4079, test_loss: 1.6631, test_f1: 0.5720
 epoch: 87, train_loss: 0.3920, test_loss: 1.2777, test_f1: 0.6218
 epoch: 88, train_loss: 0.3887, test_loss: 1.1607, test_f1: 0.6657
 epoch: 89, train_loss: 0.3499, test_loss: 1.2489, test_f1: 0.6706
 epoch: 90, train_loss: 0.3372, test_loss: 1.4109, test_f1: 0.6103
 epoch: 91, train_loss: 0.3267, test_loss: 1.5335, test_f1: 0.6505
 epoch: 92, train_loss: 0.3270, test_loss: 1.5082, test_f1: 0.6640
 epoch: 93, train_loss: 0.3333, test_loss: 1.4170, test_f1: 0.6526
 epoch: 94, train_loss: 0.3346, test_loss: 1.6986, test_f1: 0.6197
 epoch: 95, train_loss: 0.3220, test_loss: 1.4709, test_f1: 0.6166
 epoch: 96, train_loss: 0.3673, test_loss: 1.6855, test_f1: 0.5821
 epoch: 97, train_loss: 0.3840, test_loss: 1.4036, test_f1: 0.6493
 epoch: 98, train_loss: 0.3526, test_loss: 1.4898, test_f1: 0.6430
 epoch: 99, train_loss: 0.3439, test_loss: 1.5322, test_f1: 0.6347
##################ITERATION #9 ****************************************
 epoch: 0, train_loss: 1.3938, test_loss: 1.6337, test_f1: 0.3164
 epoch: 1, train_loss: 1.0421, test_loss: 1.4127, test_f1: 0.2723
 epoch: 2, train_loss: 0.9735, test_loss: 1.2830, test_f1: 0.3521
 epoch: 3, train_loss: 0.9290, test_loss: 1.2765, test_f1: 0.4256
 epoch: 4, train_loss: 0.8969, test_loss: 1.1055, test_f1: 0.4930
 epoch: 5, train_loss: 0.8467, test_loss: 1.0702, test_f1: 0.5063
 epoch: 6, train_loss: 0.8214, test_loss: 1.4130, test_f1: 0.3727
 epoch: 7, train_loss: 0.8044, test_loss: 1.0448, test_f1: 0.4673
 epoch: 8, train_loss: 0.7987, test_loss: 1.1068, test_f1: 0.5180
 epoch: 9, train_loss: 0.7613, test_loss: 1.0883, test_f1: 0.5156
 epoch: 10, train_loss: 0.8000, test_loss: 4.5490, test_f1: 0.2038
 epoch: 11, train_loss: 0.7837, test_loss: 1.5589, test_f1: 0.4298
 epoch: 12, train_loss: 0.7846, test_loss: 1.1094, test_f1: 0.5365
 epoch: 13, train_loss: 0.7462, test_loss: 0.9696, test_f1: 0.5516
 epoch: 14, train_loss: 0.7431, test_loss: 1.0496, test_f1: 0.5044
 epoch: 15, train_loss: 0.7369, test_loss: 1.1159, test_f1: 0.5970
 epoch: 16, train_loss: 0.7207, test_loss: 1.0954, test_f1: 0.5038
 epoch: 17, train_loss: 0.7321, test_loss: 1.1633, test_f1: 0.4916
 epoch: 18, train_loss: 0.7398, test_loss: 1.0844, test_f1: 0.5968
 epoch: 19, train_loss: 0.6953, test_loss: 1.4139, test_f1: 0.5215
 epoch: 20, train_loss: 0.6740, test_loss: 1.5154, test_f1: 0.4649
 epoch: 21, train_loss: 0.6640, test_loss: 1.3672, test_f1: 0.5814
 epoch: 22, train_loss: 0.6424, test_loss: 1.1458, test_f1: 0.6047
 epoch: 23, train_loss: 0.6463, test_loss: 1.1942, test_f1: 0.4767
 epoch: 24, train_loss: 0.6618, test_loss: 1.4669, test_f1: 0.4738
 epoch: 25, train_loss: 0.6425, test_loss: 1.1832, test_f1: 0.5417
 epoch: 26, train_loss: 0.6747, test_loss: 1.5517, test_f1: 0.4832
 epoch: 27, train_loss: 0.6484, test_loss: 1.0462, test_f1: 0.5720
 epoch: 28, train_loss: 0.6148, test_loss: 1.1136, test_f1: 0.5221
 epoch: 29, train_loss: 0.6321, test_loss: 1.1757, test_f1: 0.5875
 epoch: 30, train_loss: 0.6398, test_loss: 1.2465, test_f1: 0.5874
 epoch: 31, train_loss: 0.6138, test_loss: 1.2662, test_f1: 0.5664
 epoch: 32, train_loss: 0.6146, test_loss: 1.0461, test_f1: 0.5783
 epoch: 33, train_loss: 0.6140, test_loss: 1.1186, test_f1: 0.5586
 epoch: 34, train_loss: 0.6107, test_loss: 1.0207, test_f1: 0.5319
 epoch: 35, train_loss: 0.7034, test_loss: 0.9307, test_f1: 0.6045
 epoch: 36, train_loss: 0.6760, test_loss: 0.9101, test_f1: 0.6072
 epoch: 37, train_loss: 0.6628, test_loss: 1.1121, test_f1: 0.5717
 epoch: 38, train_loss: 0.6195, test_loss: 0.9952, test_f1: 0.6284
 epoch: 39, train_loss: 0.5948, test_loss: 1.2924, test_f1: 0.5482
 epoch: 40, train_loss: 0.5976, test_loss: 1.2017, test_f1: 0.6197
 epoch: 41, train_loss: 0.5868, test_loss: 1.0697, test_f1: 0.5856
 epoch: 42, train_loss: 0.5799, test_loss: 1.0723, test_f1: 0.5567
 epoch: 43, train_loss: 0.5877, test_loss: 0.9881, test_f1: 0.6302
 epoch: 44, train_loss: 0.5451, test_loss: 1.0830, test_f1: 0.6018
 epoch: 45, train_loss: 0.5731, test_loss: 0.9651, test_f1: 0.6319
 epoch: 46, train_loss: 0.5404, test_loss: 1.0250, test_f1: 0.5918
 epoch: 47, train_loss: 0.5618, test_loss: 1.2394, test_f1: 0.5422
 epoch: 48, train_loss: 0.5657, test_loss: 1.2883, test_f1: 0.6232
 epoch: 49, train_loss: 0.5623, test_loss: 1.1382, test_f1: 0.5860
 epoch: 50, train_loss: 0.5638, test_loss: 1.4444, test_f1: 0.5579
 epoch: 51, train_loss: 0.5677, test_loss: 1.2464, test_f1: 0.5679
 epoch: 52, train_loss: 0.5354, test_loss: 1.0681, test_f1: 0.5815
 epoch: 53, train_loss: 0.5131, test_loss: 1.1128, test_f1: 0.6325
 epoch: 54, train_loss: 0.4885, test_loss: 1.2051, test_f1: 0.5927
 epoch: 55, train_loss: 0.4839, test_loss: 1.3796, test_f1: 0.5737
 epoch: 56, train_loss: 0.4554, test_loss: 1.0854, test_f1: 0.6198
 epoch: 57, train_loss: 0.4987, test_loss: 1.1331, test_f1: 0.6137
 epoch: 58, train_loss: 0.4587, test_loss: 1.2144, test_f1: 0.5708
 epoch: 59, train_loss: 0.4534, test_loss: 1.2999, test_f1: 0.5965
 epoch: 60, train_loss: 0.4214, test_loss: 1.5001, test_f1: 0.5939
 epoch: 61, train_loss: 0.4094, test_loss: 1.4779, test_f1: 0.5900
 epoch: 62, train_loss: 0.4287, test_loss: 1.2812, test_f1: 0.6274
 epoch: 63, train_loss: 0.4228, test_loss: 1.2698, test_f1: 0.5866
 epoch: 64, train_loss: 0.4091, test_loss: 1.4666, test_f1: 0.6050
 epoch: 65, train_loss: 0.4336, test_loss: 1.3967, test_f1: 0.6303
 epoch: 66, train_loss: 0.4079, test_loss: 1.3690, test_f1: 0.5968
 epoch: 67, train_loss: 0.3836, test_loss: 1.4382, test_f1: 0.5471
 epoch: 68, train_loss: 0.4139, test_loss: 1.9675, test_f1: 0.5573
 epoch: 69, train_loss: 0.4086, test_loss: 1.6817, test_f1: 0.5552
 epoch: 70, train_loss: 0.4287, test_loss: 1.3723, test_f1: 0.6009
 epoch: 71, train_loss: 0.4180, test_loss: 1.1829, test_f1: 0.6191
 epoch: 72, train_loss: 0.4003, test_loss: 1.1821, test_f1: 0.6228
 epoch: 73, train_loss: 0.3795, test_loss: 1.3357, test_f1: 0.6315
 epoch: 74, train_loss: 0.3825, test_loss: 1.4928, test_f1: 0.6051
 epoch: 75, train_loss: 0.3816, test_loss: 1.6155, test_f1: 0.6138
 epoch: 76, train_loss: 0.3678, test_loss: 1.5506, test_f1: 0.5916
 epoch: 77, train_loss: 0.3830, test_loss: 1.5514, test_f1: 0.5687
 epoch: 78, train_loss: 0.3891, test_loss: 1.7071, test_f1: 0.5532
 epoch: 79, train_loss: 0.3934, test_loss: 1.2361, test_f1: 0.6182
 epoch: 80, train_loss: 0.4187, test_loss: 1.4460, test_f1: 0.5774
 epoch: 81, train_loss: 0.3953, test_loss: 1.4264, test_f1: 0.6336
 epoch: 82, train_loss: 0.4295, test_loss: 1.3297, test_f1: 0.5495
 epoch: 83, train_loss: 0.4161, test_loss: 1.4436, test_f1: 0.6035
 epoch: 84, train_loss: 0.4328, test_loss: 1.5362, test_f1: 0.5923
 epoch: 85, train_loss: 0.4005, test_loss: 1.6049, test_f1: 0.5563
 epoch: 86, train_loss: 0.3870, test_loss: 1.5388, test_f1: 0.6083
 epoch: 87, train_loss: 0.3989, test_loss: 1.2096, test_f1: 0.6546
 epoch: 88, train_loss: 0.4087, test_loss: 1.4668, test_f1: 0.5885
 epoch: 89, train_loss: 0.3953, test_loss: 1.5568, test_f1: 0.6076
 epoch: 90, train_loss: 0.3818, test_loss: 1.4568, test_f1: 0.5774
 epoch: 91, train_loss: 0.3683, test_loss: 1.3731, test_f1: 0.5838
 epoch: 92, train_loss: 0.3534, test_loss: 1.5596, test_f1: 0.5955
 epoch: 93, train_loss: 0.3277, test_loss: 1.4538, test_f1: 0.6209
 epoch: 94, train_loss: 0.3184, test_loss: 1.4932, test_f1: 0.6380
 epoch: 95, train_loss: 0.3196, test_loss: 1.6043, test_f1: 0.6253
 epoch: 96, train_loss: 0.3350, test_loss: 1.6459, test_f1: 0.5885
 epoch: 97, train_loss: 0.3187, test_loss: 1.4660, test_f1: 0.6135
 epoch: 98, train_loss: 0.3805, test_loss: 1.3058, test_f1: 0.5895
 epoch: 99, train_loss: 0.3554, test_loss: 1.6220, test_f1: 0.5557

Training completed in 306.20 seconds
Best F1: 0.6916 at epoch 98
Mean F1 across iterations: 0.6665  0.0164
========================FINAL RESULTS================================
FEGIN weighted F1: 0.6916  0.0164
python main.py --data ltspice_demos --representation component_pin --model FEGIN --layers 3 --hiddens 64 --batch_size 256 --lr 0.01 --emb_size 250 --epochs 100 --save_appendix component_pin_L3_H64_BS256_LR0.01_E250 --no_val
-----



STDERR:
  File "main.py", line 370, in <module>
    main()
  File "main.py", line 254, in main
    dataset = dataset_class(
  File "/home/philip/projects/ltspice_examples_code_repo/Circuit-Completion-Using-GNNs/component_classification_with_link_prediction_head/evaluation/FEGIN/kernel/circuit_datasets.py", line 15, in __init__
    self.data, self.slices = torch.load(self.processed_paths[0])
  File "/home/philip/.local/lib/python3.8/site-packages/torch/serialization.py", line 1040, in load
    warnings.warn(
  File "/usr/lib/python3.8/warnings.py", line 109, in _showwarnmsg
    sw(msg.message, msg.category, msg.filename, msg.lineno,
  File "main.py", line 47, in warn_with_traceback
    traceback.print_stack(file=log)
/home/philip/projects/ltspice_examples_code_repo/Circuit-Completion-Using-GNNs/component_classification_with_link_prediction_head/evaluation/FEGIN/kernel/circuit_datasets.py:15: FutureWarning: You are using `torch.load` with `weights_only=False` (the current default value), which uses the default pickle module implicitly. It is possible to construct malicious pickle data which will execute arbitrary code during unpickling (See https://github.com/pytorch/pytorch/blob/main/SECURITY.md#untrusted-models for more details). In a future release, the default value for `weights_only` will be flipped to `True`. This limits the functions that could be executed during unpickling. Arbitrary objects will no longer be allowed to be loaded via this mode unless they are explicitly allowlisted by the user via `torch.serialization.add_safe_globals`. We recommend you start setting `weights_only=True` for any use case where you don't have full control of the loaded file. Please open an issue on GitHub for any issues related to this experimental feature.
  self.data, self.slices = torch.load(self.processed_paths[0])
