STDOUT:
Results will be saved in /home/philip/projects/ltspice_examples_code_repo/Circuit-Completion-Using-GNNs/component_classification_with_link_prediction_head/evaluation/FEGIN/results/model_FEGIN_dataset_ltspice_examples
Command line input: python main.py --data ltspice_examples --representation component_net --model FEGIN --layers 4 --hiddens 32 --batch_size 256 --lr 0.0001 --emb_size 512 --epochs 100 --save_appendix component_net_L4_H32_BS256_LR0.0001_E512 --no_val
 is saved.
-----
ltspice_examples - FEGIN
Using 4 layers, 32 hidden units, h = 2
Loading component_net representation dataset
ENTERED
Training FEGIN on component_net representation
Train: 3558, Test: 846
##################ITERATION #0 ****************************************
 epoch: 0, train_loss: 1.3614, test_loss: 1.3607, test_f1: 0.2270
 epoch: 1, train_loss: 1.3572, test_loss: 1.3602, test_f1: 0.2270
 epoch: 2, train_loss: 1.3550, test_loss: 1.3598, test_f1: 0.2270
 epoch: 3, train_loss: 1.3517, test_loss: 1.3572, test_f1: 0.2270
 epoch: 4, train_loss: 1.3491, test_loss: 1.3531, test_f1: 0.2270
 epoch: 5, train_loss: 1.3461, test_loss: 1.3482, test_f1: 0.2270
 epoch: 6, train_loss: 1.3441, test_loss: 1.3439, test_f1: 0.2270
 epoch: 7, train_loss: 1.3394, test_loss: 1.3402, test_f1: 0.2270
 epoch: 8, train_loss: 1.3359, test_loss: 1.3356, test_f1: 0.2270
 epoch: 9, train_loss: 1.3329, test_loss: 1.3318, test_f1: 0.2270
 epoch: 10, train_loss: 1.3287, test_loss: 1.3280, test_f1: 0.2270
 epoch: 11, train_loss: 1.3254, test_loss: 1.3249, test_f1: 0.2270
 epoch: 12, train_loss: 1.3213, test_loss: 1.3200, test_f1: 0.2270
 epoch: 13, train_loss: 1.3177, test_loss: 1.3155, test_f1: 0.2270
 epoch: 14, train_loss: 1.3138, test_loss: 1.3116, test_f1: 0.2270
 epoch: 15, train_loss: 1.3090, test_loss: 1.3081, test_f1: 0.2320
 epoch: 16, train_loss: 1.3060, test_loss: 1.3041, test_f1: 0.2320
 epoch: 17, train_loss: 1.3005, test_loss: 1.3001, test_f1: 0.2344
 epoch: 18, train_loss: 1.2974, test_loss: 1.2960, test_f1: 0.2461
 epoch: 19, train_loss: 1.2939, test_loss: 1.2922, test_f1: 0.2484
 epoch: 20, train_loss: 1.2894, test_loss: 1.2893, test_f1: 0.2549
 epoch: 21, train_loss: 1.2830, test_loss: 1.2842, test_f1: 0.2591
 epoch: 22, train_loss: 1.2813, test_loss: 1.2805, test_f1: 0.2677
 epoch: 23, train_loss: 1.2763, test_loss: 1.2757, test_f1: 0.2737
 epoch: 24, train_loss: 1.2712, test_loss: 1.2711, test_f1: 0.2806
 epoch: 25, train_loss: 1.2671, test_loss: 1.2670, test_f1: 0.2841
 epoch: 26, train_loss: 1.2611, test_loss: 1.2622, test_f1: 0.2892
 epoch: 27, train_loss: 1.2588, test_loss: 1.2569, test_f1: 0.3003
 epoch: 28, train_loss: 1.2542, test_loss: 1.2522, test_f1: 0.3105
 epoch: 29, train_loss: 1.2464, test_loss: 1.2474, test_f1: 0.3255
 epoch: 30, train_loss: 1.2431, test_loss: 1.2413, test_f1: 0.3271
 epoch: 31, train_loss: 1.2374, test_loss: 1.2358, test_f1: 0.3343
 epoch: 32, train_loss: 1.2318, test_loss: 1.2299, test_f1: 0.3447
 epoch: 33, train_loss: 1.2289, test_loss: 1.2239, test_f1: 0.3467
 epoch: 34, train_loss: 1.2216, test_loss: 1.2175, test_f1: 0.3601
 epoch: 35, train_loss: 1.2169, test_loss: 1.2107, test_f1: 0.3636
 epoch: 36, train_loss: 1.2146, test_loss: 1.2027, test_f1: 0.3761
 epoch: 37, train_loss: 1.2045, test_loss: 1.1957, test_f1: 0.3787
 epoch: 38, train_loss: 1.1985, test_loss: 1.1887, test_f1: 0.3831
 epoch: 39, train_loss: 1.1935, test_loss: 1.1806, test_f1: 0.3880
 epoch: 40, train_loss: 1.1871, test_loss: 1.1738, test_f1: 0.4006
 epoch: 41, train_loss: 1.1783, test_loss: 1.1646, test_f1: 0.3989
 epoch: 42, train_loss: 1.1716, test_loss: 1.1574, test_f1: 0.4076
 epoch: 43, train_loss: 1.1613, test_loss: 1.1499, test_f1: 0.4073
 epoch: 44, train_loss: 1.1553, test_loss: 1.1422, test_f1: 0.4140
 epoch: 45, train_loss: 1.1472, test_loss: 1.1326, test_f1: 0.4218
 epoch: 46, train_loss: 1.1466, test_loss: 1.1267, test_f1: 0.4230
 epoch: 47, train_loss: 1.1335, test_loss: 1.1169, test_f1: 0.4282
 epoch: 48, train_loss: 1.1267, test_loss: 1.1095, test_f1: 0.4301
 epoch: 49, train_loss: 1.1243, test_loss: 1.1027, test_f1: 0.4307
 epoch: 50, train_loss: 1.1169, test_loss: 1.0957, test_f1: 0.4393
 epoch: 51, train_loss: 1.1160, test_loss: 1.0912, test_f1: 0.4397
 epoch: 52, train_loss: 1.1105, test_loss: 1.0887, test_f1: 0.4420
 epoch: 53, train_loss: 1.1036, test_loss: 1.0825, test_f1: 0.4454
 epoch: 54, train_loss: 1.1004, test_loss: 1.0792, test_f1: 0.4471
 epoch: 55, train_loss: 1.1023, test_loss: 1.0760, test_f1: 0.4577
 epoch: 56, train_loss: 1.0960, test_loss: 1.0722, test_f1: 0.4495
 epoch: 57, train_loss: 1.0915, test_loss: 1.0686, test_f1: 0.4625
 epoch: 58, train_loss: 1.0852, test_loss: 1.0656, test_f1: 0.4619
 epoch: 59, train_loss: 1.0845, test_loss: 1.0610, test_f1: 0.4600
 epoch: 60, train_loss: 1.0795, test_loss: 1.0587, test_f1: 0.4673
 epoch: 61, train_loss: 1.0796, test_loss: 1.0549, test_f1: 0.4696
 epoch: 62, train_loss: 1.0736, test_loss: 1.0513, test_f1: 0.4678
 epoch: 63, train_loss: 1.0741, test_loss: 1.0487, test_f1: 0.4741
 epoch: 64, train_loss: 1.0718, test_loss: 1.0451, test_f1: 0.4758
 epoch: 65, train_loss: 1.0621, test_loss: 1.0425, test_f1: 0.4779
 epoch: 66, train_loss: 1.0563, test_loss: 1.0382, test_f1: 0.4809
 epoch: 67, train_loss: 1.0618, test_loss: 1.0360, test_f1: 0.4900
 epoch: 68, train_loss: 1.0603, test_loss: 1.0344, test_f1: 0.4908
 epoch: 69, train_loss: 1.0557, test_loss: 1.0297, test_f1: 0.4931
 epoch: 70, train_loss: 1.0550, test_loss: 1.0283, test_f1: 0.4941
 epoch: 71, train_loss: 1.0536, test_loss: 1.0240, test_f1: 0.4907
 epoch: 72, train_loss: 1.0523, test_loss: 1.0212, test_f1: 0.4889
 epoch: 73, train_loss: 1.0412, test_loss: 1.0195, test_f1: 0.4887
 epoch: 74, train_loss: 1.0397, test_loss: 1.0163, test_f1: 0.4938
 epoch: 75, train_loss: 1.0392, test_loss: 1.0149, test_f1: 0.4925
 epoch: 76, train_loss: 1.0376, test_loss: 1.0106, test_f1: 0.4946
 epoch: 77, train_loss: 1.0342, test_loss: 1.0073, test_f1: 0.4948
 epoch: 78, train_loss: 1.0299, test_loss: 1.0044, test_f1: 0.4957
 epoch: 79, train_loss: 1.0242, test_loss: 1.0019, test_f1: 0.4960
 epoch: 80, train_loss: 1.0257, test_loss: 1.0024, test_f1: 0.4889
 epoch: 81, train_loss: 1.0288, test_loss: 1.0013, test_f1: 0.4811
 epoch: 82, train_loss: 1.0214, test_loss: 0.9968, test_f1: 0.4932
 epoch: 83, train_loss: 1.0188, test_loss: 0.9927, test_f1: 0.5084
 epoch: 84, train_loss: 1.0144, test_loss: 0.9919, test_f1: 0.4951
 epoch: 85, train_loss: 1.0149, test_loss: 0.9898, test_f1: 0.4955
 epoch: 86, train_loss: 1.0058, test_loss: 0.9853, test_f1: 0.5029
 epoch: 87, train_loss: 1.0117, test_loss: 0.9842, test_f1: 0.5084
 epoch: 88, train_loss: 1.0059, test_loss: 0.9820, test_f1: 0.5062
 epoch: 89, train_loss: 1.0087, test_loss: 0.9828, test_f1: 0.5080
 epoch: 90, train_loss: 0.9994, test_loss: 0.9802, test_f1: 0.5069
 epoch: 91, train_loss: 0.9980, test_loss: 0.9778, test_f1: 0.5019
 epoch: 92, train_loss: 0.9970, test_loss: 0.9786, test_f1: 0.5046
 epoch: 93, train_loss: 0.9926, test_loss: 0.9755, test_f1: 0.5064
 epoch: 94, train_loss: 0.9959, test_loss: 0.9734, test_f1: 0.5071
 epoch: 95, train_loss: 0.9880, test_loss: 0.9721, test_f1: 0.5107
 epoch: 96, train_loss: 0.9878, test_loss: 0.9692, test_f1: 0.5120
 epoch: 97, train_loss: 0.9788, test_loss: 0.9695, test_f1: 0.5112
 epoch: 98, train_loss: 0.9844, test_loss: 0.9667, test_f1: 0.5095
 epoch: 99, train_loss: 0.9809, test_loss: 0.9641, test_f1: 0.5103
##################ITERATION #1 ****************************************
 epoch: 0, train_loss: 1.3271, test_loss: 1.3358, test_f1: 0.2270
 epoch: 1, train_loss: 1.3197, test_loss: 1.3309, test_f1: 0.2270
 epoch: 2, train_loss: 1.3161, test_loss: 1.3250, test_f1: 0.2270
 epoch: 3, train_loss: 1.3111, test_loss: 1.3184, test_f1: 0.2270
 epoch: 4, train_loss: 1.3064, test_loss: 1.3133, test_f1: 0.2270
 epoch: 5, train_loss: 1.3005, test_loss: 1.3069, test_f1: 0.2270
 epoch: 6, train_loss: 1.2966, test_loss: 1.3012, test_f1: 0.2270
 epoch: 7, train_loss: 1.2908, test_loss: 1.2953, test_f1: 0.2270
 epoch: 8, train_loss: 1.2837, test_loss: 1.2894, test_f1: 0.2270
 epoch: 9, train_loss: 1.2801, test_loss: 1.2833, test_f1: 0.2270
 epoch: 10, train_loss: 1.2756, test_loss: 1.2777, test_f1: 0.2270
 epoch: 11, train_loss: 1.2676, test_loss: 1.2718, test_f1: 0.2270
 epoch: 12, train_loss: 1.2652, test_loss: 1.2657, test_f1: 0.2270
 epoch: 13, train_loss: 1.2599, test_loss: 1.2595, test_f1: 0.2270
 epoch: 14, train_loss: 1.2535, test_loss: 1.2536, test_f1: 0.2270
 epoch: 15, train_loss: 1.2495, test_loss: 1.2474, test_f1: 0.2270
 epoch: 16, train_loss: 1.2417, test_loss: 1.2412, test_f1: 0.2295
 epoch: 17, train_loss: 1.2371, test_loss: 1.2354, test_f1: 0.2506
 epoch: 18, train_loss: 1.2348, test_loss: 1.2290, test_f1: 0.2611
 epoch: 19, train_loss: 1.2269, test_loss: 1.2238, test_f1: 0.2728
 epoch: 20, train_loss: 1.2261, test_loss: 1.2186, test_f1: 0.2765
 epoch: 21, train_loss: 1.2205, test_loss: 1.2130, test_f1: 0.2801
 epoch: 22, train_loss: 1.2163, test_loss: 1.2076, test_f1: 0.2861
 epoch: 23, train_loss: 1.2118, test_loss: 1.2024, test_f1: 0.2921
 epoch: 24, train_loss: 1.2022, test_loss: 1.1952, test_f1: 0.3157
 epoch: 25, train_loss: 1.1977, test_loss: 1.1897, test_f1: 0.3336
 epoch: 26, train_loss: 1.1951, test_loss: 1.1837, test_f1: 0.3492
 epoch: 27, train_loss: 1.1921, test_loss: 1.1782, test_f1: 0.3624
 epoch: 28, train_loss: 1.1856, test_loss: 1.1722, test_f1: 0.3828
 epoch: 29, train_loss: 1.1822, test_loss: 1.1657, test_f1: 0.3935
 epoch: 30, train_loss: 1.1719, test_loss: 1.1596, test_f1: 0.4060
 epoch: 31, train_loss: 1.1664, test_loss: 1.1527, test_f1: 0.4091
 epoch: 32, train_loss: 1.1628, test_loss: 1.1465, test_f1: 0.4152
 epoch: 33, train_loss: 1.1609, test_loss: 1.1387, test_f1: 0.4254
 epoch: 34, train_loss: 1.1556, test_loss: 1.1310, test_f1: 0.4286
 epoch: 35, train_loss: 1.1407, test_loss: 1.1235, test_f1: 0.4475
 epoch: 36, train_loss: 1.1378, test_loss: 1.1170, test_f1: 0.4540
 epoch: 37, train_loss: 1.1357, test_loss: 1.1095, test_f1: 0.4615
 epoch: 38, train_loss: 1.1244, test_loss: 1.1016, test_f1: 0.4652
 epoch: 39, train_loss: 1.1187, test_loss: 1.0967, test_f1: 0.4654
 epoch: 40, train_loss: 1.1108, test_loss: 1.0875, test_f1: 0.4691
 epoch: 41, train_loss: 1.1140, test_loss: 1.0843, test_f1: 0.4625
 epoch: 42, train_loss: 1.1011, test_loss: 1.0743, test_f1: 0.4737
 epoch: 43, train_loss: 1.0933, test_loss: 1.0678, test_f1: 0.4787
 epoch: 44, train_loss: 1.0874, test_loss: 1.0628, test_f1: 0.4757
 epoch: 45, train_loss: 1.0806, test_loss: 1.0566, test_f1: 0.4863
 epoch: 46, train_loss: 1.0761, test_loss: 1.0498, test_f1: 0.4816
 epoch: 47, train_loss: 1.0666, test_loss: 1.0460, test_f1: 0.4861
 epoch: 48, train_loss: 1.0632, test_loss: 1.0360, test_f1: 0.4913
 epoch: 49, train_loss: 1.0565, test_loss: 1.0343, test_f1: 0.4840
 epoch: 50, train_loss: 1.0518, test_loss: 1.0277, test_f1: 0.4893
 epoch: 51, train_loss: 1.0449, test_loss: 1.0231, test_f1: 0.4868
 epoch: 52, train_loss: 1.0398, test_loss: 1.0218, test_f1: 0.4832
 epoch: 53, train_loss: 1.0360, test_loss: 1.0203, test_f1: 0.4810
 epoch: 54, train_loss: 1.0379, test_loss: 1.0149, test_f1: 0.4878
 epoch: 55, train_loss: 1.0290, test_loss: 1.0142, test_f1: 0.4854
 epoch: 56, train_loss: 1.0316, test_loss: 1.0118, test_f1: 0.4844
 epoch: 57, train_loss: 1.0303, test_loss: 1.0115, test_f1: 0.4818
 epoch: 58, train_loss: 1.0222, test_loss: 1.0076, test_f1: 0.4857
 epoch: 59, train_loss: 1.0213, test_loss: 1.0040, test_f1: 0.4851
 epoch: 60, train_loss: 1.0113, test_loss: 1.0041, test_f1: 0.4821
 epoch: 61, train_loss: 1.0115, test_loss: 1.0010, test_f1: 0.4823
 epoch: 62, train_loss: 1.0139, test_loss: 1.0001, test_f1: 0.4792
 epoch: 63, train_loss: 1.0013, test_loss: 0.9984, test_f1: 0.4908
 epoch: 64, train_loss: 1.0077, test_loss: 0.9944, test_f1: 0.4897
 epoch: 65, train_loss: 0.9969, test_loss: 0.9891, test_f1: 0.4894
 epoch: 66, train_loss: 0.9984, test_loss: 0.9893, test_f1: 0.4894
 epoch: 67, train_loss: 0.9996, test_loss: 0.9872, test_f1: 0.4856
 epoch: 68, train_loss: 0.9994, test_loss: 0.9885, test_f1: 0.4915
 epoch: 69, train_loss: 0.9967, test_loss: 0.9879, test_f1: 0.4852
 epoch: 70, train_loss: 0.9927, test_loss: 0.9852, test_f1: 0.4830
 epoch: 71, train_loss: 0.9892, test_loss: 0.9826, test_f1: 0.4851
 epoch: 72, train_loss: 0.9863, test_loss: 0.9834, test_f1: 0.4961
 epoch: 73, train_loss: 0.9784, test_loss: 0.9822, test_f1: 0.4946
 epoch: 74, train_loss: 0.9772, test_loss: 0.9804, test_f1: 0.4845
 epoch: 75, train_loss: 0.9859, test_loss: 0.9862, test_f1: 0.4840
 epoch: 76, train_loss: 0.9761, test_loss: 0.9827, test_f1: 0.4879
 epoch: 77, train_loss: 0.9782, test_loss: 0.9755, test_f1: 0.4860
 epoch: 78, train_loss: 0.9826, test_loss: 0.9749, test_f1: 0.4845
 epoch: 79, train_loss: 0.9715, test_loss: 0.9707, test_f1: 0.4878
 epoch: 80, train_loss: 0.9763, test_loss: 0.9698, test_f1: 0.4918
 epoch: 81, train_loss: 0.9699, test_loss: 0.9741, test_f1: 0.4901
 epoch: 82, train_loss: 0.9687, test_loss: 0.9670, test_f1: 0.4905
 epoch: 83, train_loss: 0.9572, test_loss: 0.9705, test_f1: 0.4897
 epoch: 84, train_loss: 0.9668, test_loss: 0.9685, test_f1: 0.4881
 epoch: 85, train_loss: 0.9659, test_loss: 0.9724, test_f1: 0.4907
 epoch: 86, train_loss: 0.9616, test_loss: 0.9690, test_f1: 0.4794
 epoch: 87, train_loss: 0.9650, test_loss: 0.9611, test_f1: 0.4861
 epoch: 88, train_loss: 0.9574, test_loss: 0.9591, test_f1: 0.4872
 epoch: 89, train_loss: 0.9571, test_loss: 0.9618, test_f1: 0.4846
 epoch: 90, train_loss: 0.9511, test_loss: 0.9585, test_f1: 0.4878
 epoch: 91, train_loss: 0.9546, test_loss: 0.9571, test_f1: 0.4898
 epoch: 92, train_loss: 0.9437, test_loss: 0.9633, test_f1: 0.4835
 epoch: 93, train_loss: 0.9518, test_loss: 0.9654, test_f1: 0.4818
 epoch: 94, train_loss: 0.9468, test_loss: 0.9568, test_f1: 0.4853
 epoch: 95, train_loss: 0.9411, test_loss: 0.9506, test_f1: 0.4920
 epoch: 96, train_loss: 0.9437, test_loss: 0.9515, test_f1: 0.4870
 epoch: 97, train_loss: 0.9461, test_loss: 0.9471, test_f1: 0.4853
 epoch: 98, train_loss: 0.9398, test_loss: 0.9468, test_f1: 0.4861
 epoch: 99, train_loss: 0.9388, test_loss: 0.9496, test_f1: 0.4905
##################ITERATION #2 ****************************************
 epoch: 0, train_loss: 1.3190, test_loss: 1.3268, test_f1: 0.2270
 epoch: 1, train_loss: 1.3081, test_loss: 1.3249, test_f1: 0.2270
 epoch: 2, train_loss: 1.2991, test_loss: 1.3161, test_f1: 0.2270
 epoch: 3, train_loss: 1.2876, test_loss: 1.3044, test_f1: 0.2270
 epoch: 4, train_loss: 1.2840, test_loss: 1.2933, test_f1: 0.2270
 epoch: 5, train_loss: 1.2770, test_loss: 1.2819, test_f1: 0.2741
 epoch: 6, train_loss: 1.2706, test_loss: 1.2616, test_f1: 0.3134
 epoch: 7, train_loss: 1.2603, test_loss: 1.2454, test_f1: 0.3230
 epoch: 8, train_loss: 1.2560, test_loss: 1.2347, test_f1: 0.3281
 epoch: 9, train_loss: 1.2472, test_loss: 1.2283, test_f1: 0.3352
 epoch: 10, train_loss: 1.2395, test_loss: 1.2198, test_f1: 0.3374
 epoch: 11, train_loss: 1.2366, test_loss: 1.2121, test_f1: 0.3480
 epoch: 12, train_loss: 1.2304, test_loss: 1.2062, test_f1: 0.3542
 epoch: 13, train_loss: 1.2242, test_loss: 1.2003, test_f1: 0.3630
 epoch: 14, train_loss: 1.2176, test_loss: 1.1952, test_f1: 0.3627
 epoch: 15, train_loss: 1.2179, test_loss: 1.1892, test_f1: 0.3644
 epoch: 16, train_loss: 1.2089, test_loss: 1.1835, test_f1: 0.3636
 epoch: 17, train_loss: 1.2040, test_loss: 1.1765, test_f1: 0.3661
 epoch: 18, train_loss: 1.1952, test_loss: 1.1711, test_f1: 0.3694
 epoch: 19, train_loss: 1.1966, test_loss: 1.1671, test_f1: 0.3711
 epoch: 20, train_loss: 1.1866, test_loss: 1.1624, test_f1: 0.3774
 epoch: 21, train_loss: 1.1813, test_loss: 1.1551, test_f1: 0.3797
 epoch: 22, train_loss: 1.1830, test_loss: 1.1507, test_f1: 0.3781
 epoch: 23, train_loss: 1.1730, test_loss: 1.1468, test_f1: 0.3797
 epoch: 24, train_loss: 1.1715, test_loss: 1.1459, test_f1: 0.3835
 epoch: 25, train_loss: 1.1626, test_loss: 1.1410, test_f1: 0.3951
 epoch: 26, train_loss: 1.1603, test_loss: 1.1353, test_f1: 0.4093
 epoch: 27, train_loss: 1.1557, test_loss: 1.1299, test_f1: 0.4092
 epoch: 28, train_loss: 1.1521, test_loss: 1.1271, test_f1: 0.4112
 epoch: 29, train_loss: 1.1525, test_loss: 1.1227, test_f1: 0.4173
 epoch: 30, train_loss: 1.1408, test_loss: 1.1175, test_f1: 0.4256
 epoch: 31, train_loss: 1.1392, test_loss: 1.1123, test_f1: 0.4324
 epoch: 32, train_loss: 1.1308, test_loss: 1.1069, test_f1: 0.4372
 epoch: 33, train_loss: 1.1235, test_loss: 1.1031, test_f1: 0.4378
 epoch: 34, train_loss: 1.1217, test_loss: 1.0992, test_f1: 0.4447
 epoch: 35, train_loss: 1.1213, test_loss: 1.0951, test_f1: 0.4493
 epoch: 36, train_loss: 1.1206, test_loss: 1.0912, test_f1: 0.4479
 epoch: 37, train_loss: 1.1163, test_loss: 1.0822, test_f1: 0.4572
 epoch: 38, train_loss: 1.1120, test_loss: 1.0786, test_f1: 0.4598
 epoch: 39, train_loss: 1.1074, test_loss: 1.0763, test_f1: 0.4633
 epoch: 40, train_loss: 1.1003, test_loss: 1.0704, test_f1: 0.4619
 epoch: 41, train_loss: 1.0940, test_loss: 1.0652, test_f1: 0.4617
 epoch: 42, train_loss: 1.0869, test_loss: 1.0607, test_f1: 0.4710
 epoch: 43, train_loss: 1.0820, test_loss: 1.0572, test_f1: 0.4726
 epoch: 44, train_loss: 1.0815, test_loss: 1.0509, test_f1: 0.4721
 epoch: 45, train_loss: 1.0776, test_loss: 1.0475, test_f1: 0.4736
 epoch: 46, train_loss: 1.0689, test_loss: 1.0425, test_f1: 0.4726
 epoch: 47, train_loss: 1.0695, test_loss: 1.0428, test_f1: 0.4714
 epoch: 48, train_loss: 1.0596, test_loss: 1.0398, test_f1: 0.4657
 epoch: 49, train_loss: 1.0568, test_loss: 1.0362, test_f1: 0.4719
 epoch: 50, train_loss: 1.0567, test_loss: 1.0328, test_f1: 0.4666
 epoch: 51, train_loss: 1.0468, test_loss: 1.0298, test_f1: 0.4676
 epoch: 52, train_loss: 1.0504, test_loss: 1.0290, test_f1: 0.4699
 epoch: 53, train_loss: 1.0464, test_loss: 1.0277, test_f1: 0.4733
 epoch: 54, train_loss: 1.0433, test_loss: 1.0256, test_f1: 0.4754
 epoch: 55, train_loss: 1.0442, test_loss: 1.0244, test_f1: 0.4740
 epoch: 56, train_loss: 1.0386, test_loss: 1.0244, test_f1: 0.4777
 epoch: 57, train_loss: 1.0348, test_loss: 1.0224, test_f1: 0.4668
 epoch: 58, train_loss: 1.0365, test_loss: 1.0212, test_f1: 0.4738
 epoch: 59, train_loss: 1.0359, test_loss: 1.0209, test_f1: 0.4783
 epoch: 60, train_loss: 1.0297, test_loss: 1.0188, test_f1: 0.4738
 epoch: 61, train_loss: 1.0276, test_loss: 1.0177, test_f1: 0.4784
 epoch: 62, train_loss: 1.0270, test_loss: 1.0174, test_f1: 0.4777
 epoch: 63, train_loss: 1.0294, test_loss: 1.0159, test_f1: 0.4775
 epoch: 64, train_loss: 1.0238, test_loss: 1.0154, test_f1: 0.4759
 epoch: 65, train_loss: 1.0185, test_loss: 1.0138, test_f1: 0.4689
 epoch: 66, train_loss: 1.0189, test_loss: 1.0133, test_f1: 0.4748
 epoch: 67, train_loss: 1.0164, test_loss: 1.0123, test_f1: 0.4745
 epoch: 68, train_loss: 1.0168, test_loss: 1.0103, test_f1: 0.4818
 epoch: 69, train_loss: 1.0191, test_loss: 1.0096, test_f1: 0.4843
 epoch: 70, train_loss: 1.0128, test_loss: 1.0084, test_f1: 0.4838
 epoch: 71, train_loss: 1.0060, test_loss: 1.0074, test_f1: 0.4835
 epoch: 72, train_loss: 1.0097, test_loss: 1.0077, test_f1: 0.4845
 epoch: 73, train_loss: 1.0056, test_loss: 1.0058, test_f1: 0.4821
 epoch: 74, train_loss: 1.0040, test_loss: 1.0054, test_f1: 0.4780
 epoch: 75, train_loss: 1.0049, test_loss: 1.0046, test_f1: 0.4850
 epoch: 76, train_loss: 1.0031, test_loss: 1.0038, test_f1: 0.4842
 epoch: 77, train_loss: 1.0038, test_loss: 1.0028, test_f1: 0.4739
 epoch: 78, train_loss: 0.9975, test_loss: 1.0025, test_f1: 0.4833
 epoch: 79, train_loss: 1.0071, test_loss: 0.9999, test_f1: 0.4844
 epoch: 80, train_loss: 0.9939, test_loss: 0.9998, test_f1: 0.4865
 epoch: 81, train_loss: 0.9953, test_loss: 0.9994, test_f1: 0.4854
 epoch: 82, train_loss: 0.9955, test_loss: 0.9989, test_f1: 0.4918
 epoch: 83, train_loss: 0.9889, test_loss: 0.9989, test_f1: 0.4907
 epoch: 84, train_loss: 0.9930, test_loss: 0.9977, test_f1: 0.4834
 epoch: 85, train_loss: 0.9811, test_loss: 0.9957, test_f1: 0.4898
 epoch: 86, train_loss: 0.9928, test_loss: 0.9949, test_f1: 0.4896
 epoch: 87, train_loss: 0.9868, test_loss: 0.9934, test_f1: 0.4891
 epoch: 88, train_loss: 0.9878, test_loss: 0.9921, test_f1: 0.4890
 epoch: 89, train_loss: 0.9854, test_loss: 0.9921, test_f1: 0.4900
 epoch: 90, train_loss: 0.9793, test_loss: 0.9936, test_f1: 0.4812
 epoch: 91, train_loss: 0.9830, test_loss: 0.9936, test_f1: 0.4799
 epoch: 92, train_loss: 0.9824, test_loss: 0.9914, test_f1: 0.4888
 epoch: 93, train_loss: 0.9841, test_loss: 0.9897, test_f1: 0.4920
 epoch: 94, train_loss: 0.9799, test_loss: 0.9880, test_f1: 0.4937
 epoch: 95, train_loss: 0.9791, test_loss: 0.9889, test_f1: 0.4917
 epoch: 96, train_loss: 0.9841, test_loss: 0.9868, test_f1: 0.4929
 epoch: 97, train_loss: 0.9742, test_loss: 0.9872, test_f1: 0.4889
 epoch: 98, train_loss: 0.9729, test_loss: 0.9868, test_f1: 0.4851
 epoch: 99, train_loss: 0.9728, test_loss: 0.9850, test_f1: 0.4870
##################ITERATION #3 ****************************************
 epoch: 0, train_loss: 1.3123, test_loss: 1.3197, test_f1: 0.2270
 epoch: 1, train_loss: 1.2941, test_loss: 1.3191, test_f1: 0.2270
 epoch: 2, train_loss: 1.2852, test_loss: 1.3094, test_f1: 0.2270
 epoch: 3, train_loss: 1.2763, test_loss: 1.2902, test_f1: 0.2270
 epoch: 4, train_loss: 1.2662, test_loss: 1.2712, test_f1: 0.2270
 epoch: 5, train_loss: 1.2599, test_loss: 1.2523, test_f1: 0.2295
 epoch: 6, train_loss: 1.2507, test_loss: 1.2367, test_f1: 0.2509
 epoch: 7, train_loss: 1.2416, test_loss: 1.2263, test_f1: 0.2698
 epoch: 8, train_loss: 1.2358, test_loss: 1.2190, test_f1: 0.2737
 epoch: 9, train_loss: 1.2287, test_loss: 1.2114, test_f1: 0.2869
 epoch: 10, train_loss: 1.2212, test_loss: 1.2044, test_f1: 0.3113
 epoch: 11, train_loss: 1.2133, test_loss: 1.1961, test_f1: 0.3253
 epoch: 12, train_loss: 1.2072, test_loss: 1.1889, test_f1: 0.3545
 epoch: 13, train_loss: 1.2021, test_loss: 1.1790, test_f1: 0.3685
 epoch: 14, train_loss: 1.1911, test_loss: 1.1710, test_f1: 0.3844
 epoch: 15, train_loss: 1.1841, test_loss: 1.1633, test_f1: 0.3987
 epoch: 16, train_loss: 1.1758, test_loss: 1.1547, test_f1: 0.4119
 epoch: 17, train_loss: 1.1662, test_loss: 1.1480, test_f1: 0.4199
 epoch: 18, train_loss: 1.1631, test_loss: 1.1392, test_f1: 0.4239
 epoch: 19, train_loss: 1.1595, test_loss: 1.1311, test_f1: 0.4312
 epoch: 20, train_loss: 1.1499, test_loss: 1.1235, test_f1: 0.4290
 epoch: 21, train_loss: 1.1427, test_loss: 1.1173, test_f1: 0.4338
 epoch: 22, train_loss: 1.1313, test_loss: 1.1088, test_f1: 0.4429
 epoch: 23, train_loss: 1.1282, test_loss: 1.1015, test_f1: 0.4489
 epoch: 24, train_loss: 1.1176, test_loss: 1.0925, test_f1: 0.4488
 epoch: 25, train_loss: 1.1138, test_loss: 1.0842, test_f1: 0.4507
 epoch: 26, train_loss: 1.1069, test_loss: 1.0785, test_f1: 0.4482
 epoch: 27, train_loss: 1.0995, test_loss: 1.0711, test_f1: 0.4464
 epoch: 28, train_loss: 1.0953, test_loss: 1.0644, test_f1: 0.4350
 epoch: 29, train_loss: 1.0862, test_loss: 1.0581, test_f1: 0.4438
 epoch: 30, train_loss: 1.0814, test_loss: 1.0520, test_f1: 0.4439
 epoch: 31, train_loss: 1.0733, test_loss: 1.0450, test_f1: 0.4456
 epoch: 32, train_loss: 1.0679, test_loss: 1.0402, test_f1: 0.4473
 epoch: 33, train_loss: 1.0658, test_loss: 1.0360, test_f1: 0.4466
 epoch: 34, train_loss: 1.0559, test_loss: 1.0313, test_f1: 0.4514
 epoch: 35, train_loss: 1.0511, test_loss: 1.0204, test_f1: 0.4514
 epoch: 36, train_loss: 1.0417, test_loss: 1.0201, test_f1: 0.4562
 epoch: 37, train_loss: 1.0400, test_loss: 1.0153, test_f1: 0.4561
 epoch: 38, train_loss: 1.0239, test_loss: 1.0069, test_f1: 0.4616
 epoch: 39, train_loss: 1.0241, test_loss: 1.0033, test_f1: 0.4558
 epoch: 40, train_loss: 1.0202, test_loss: 1.0034, test_f1: 0.4700
 epoch: 41, train_loss: 1.0099, test_loss: 1.0017, test_f1: 0.4684
 epoch: 42, train_loss: 1.0131, test_loss: 0.9967, test_f1: 0.4665
 epoch: 43, train_loss: 1.0096, test_loss: 0.9929, test_f1: 0.4795
 epoch: 44, train_loss: 0.9931, test_loss: 0.9885, test_f1: 0.4763
 epoch: 45, train_loss: 0.9987, test_loss: 0.9849, test_f1: 0.4688
 epoch: 46, train_loss: 0.9891, test_loss: 0.9848, test_f1: 0.4715
 epoch: 47, train_loss: 0.9899, test_loss: 0.9809, test_f1: 0.4767
 epoch: 48, train_loss: 0.9898, test_loss: 0.9763, test_f1: 0.4767
 epoch: 49, train_loss: 0.9779, test_loss: 0.9746, test_f1: 0.4765
 epoch: 50, train_loss: 0.9759, test_loss: 0.9707, test_f1: 0.4853
 epoch: 51, train_loss: 0.9763, test_loss: 0.9708, test_f1: 0.4813
 epoch: 52, train_loss: 0.9728, test_loss: 0.9706, test_f1: 0.4821
 epoch: 53, train_loss: 0.9689, test_loss: 0.9699, test_f1: 0.4871
 epoch: 54, train_loss: 0.9631, test_loss: 0.9712, test_f1: 0.4859
 epoch: 55, train_loss: 0.9601, test_loss: 0.9688, test_f1: 0.4884
 epoch: 56, train_loss: 0.9731, test_loss: 0.9683, test_f1: 0.4884
 epoch: 57, train_loss: 0.9608, test_loss: 0.9687, test_f1: 0.4834
 epoch: 58, train_loss: 0.9641, test_loss: 0.9682, test_f1: 0.4882
 epoch: 59, train_loss: 0.9588, test_loss: 0.9658, test_f1: 0.4861
 epoch: 60, train_loss: 0.9586, test_loss: 0.9629, test_f1: 0.4894
 epoch: 61, train_loss: 0.9591, test_loss: 0.9618, test_f1: 0.4894
 epoch: 62, train_loss: 0.9610, test_loss: 0.9599, test_f1: 0.4844
 epoch: 63, train_loss: 0.9546, test_loss: 0.9624, test_f1: 0.4872
 epoch: 64, train_loss: 0.9504, test_loss: 0.9627, test_f1: 0.4907
 epoch: 65, train_loss: 0.9461, test_loss: 0.9613, test_f1: 0.4854
 epoch: 66, train_loss: 0.9503, test_loss: 0.9593, test_f1: 0.4830
 epoch: 67, train_loss: 0.9457, test_loss: 0.9563, test_f1: 0.4918
 epoch: 68, train_loss: 0.9498, test_loss: 0.9595, test_f1: 0.4868
 epoch: 69, train_loss: 0.9392, test_loss: 0.9622, test_f1: 0.4926
 epoch: 70, train_loss: 0.9437, test_loss: 0.9599, test_f1: 0.4945
 epoch: 71, train_loss: 0.9354, test_loss: 0.9583, test_f1: 0.4870
 epoch: 72, train_loss: 0.9414, test_loss: 0.9628, test_f1: 0.4826
 epoch: 73, train_loss: 0.9406, test_loss: 0.9597, test_f1: 0.4800
 epoch: 74, train_loss: 0.9409, test_loss: 0.9621, test_f1: 0.4855
 epoch: 75, train_loss: 0.9437, test_loss: 0.9572, test_f1: 0.4895
 epoch: 76, train_loss: 0.9384, test_loss: 0.9601, test_f1: 0.4867
 epoch: 77, train_loss: 0.9315, test_loss: 0.9593, test_f1: 0.4916
 epoch: 78, train_loss: 0.9384, test_loss: 0.9561, test_f1: 0.4901
 epoch: 79, train_loss: 0.9301, test_loss: 0.9584, test_f1: 0.4990
 epoch: 80, train_loss: 0.9296, test_loss: 0.9553, test_f1: 0.4992
 epoch: 81, train_loss: 0.9322, test_loss: 0.9573, test_f1: 0.4981
 epoch: 82, train_loss: 0.9245, test_loss: 0.9534, test_f1: 0.4994
 epoch: 83, train_loss: 0.9298, test_loss: 0.9547, test_f1: 0.5025
 epoch: 84, train_loss: 0.9213, test_loss: 0.9543, test_f1: 0.4969
 epoch: 85, train_loss: 0.9162, test_loss: 0.9561, test_f1: 0.4983
 epoch: 86, train_loss: 0.9143, test_loss: 0.9536, test_f1: 0.5014
 epoch: 87, train_loss: 0.9136, test_loss: 0.9510, test_f1: 0.5011
 epoch: 88, train_loss: 0.9195, test_loss: 0.9536, test_f1: 0.5029
 epoch: 89, train_loss: 0.9133, test_loss: 0.9485, test_f1: 0.5033
 epoch: 90, train_loss: 0.9157, test_loss: 0.9508, test_f1: 0.5013
 epoch: 91, train_loss: 0.9251, test_loss: 0.9566, test_f1: 0.5023
 epoch: 92, train_loss: 0.9156, test_loss: 0.9564, test_f1: 0.5023
 epoch: 93, train_loss: 0.9173, test_loss: 0.9536, test_f1: 0.5035
 epoch: 94, train_loss: 0.9120, test_loss: 0.9532, test_f1: 0.5035
 epoch: 95, train_loss: 0.9150, test_loss: 0.9538, test_f1: 0.5045
 epoch: 96, train_loss: 0.9058, test_loss: 0.9527, test_f1: 0.5091
 epoch: 97, train_loss: 0.9063, test_loss: 0.9503, test_f1: 0.5072
 epoch: 98, train_loss: 0.9042, test_loss: 0.9529, test_f1: 0.5044
 epoch: 99, train_loss: 0.9072, test_loss: 0.9510, test_f1: 0.5065
##################ITERATION #4 ****************************************
 epoch: 0, train_loss: 1.3037, test_loss: 1.3163, test_f1: 0.2270
 epoch: 1, train_loss: 1.2781, test_loss: 1.3069, test_f1: 0.2270
 epoch: 2, train_loss: 1.2650, test_loss: 1.2896, test_f1: 0.2270
 epoch: 3, train_loss: 1.2573, test_loss: 1.2657, test_f1: 0.2270
 epoch: 4, train_loss: 1.2465, test_loss: 1.2440, test_f1: 0.2374
 epoch: 5, train_loss: 1.2408, test_loss: 1.2206, test_f1: 0.2721
 epoch: 6, train_loss: 1.2361, test_loss: 1.2053, test_f1: 0.2912
 epoch: 7, train_loss: 1.2259, test_loss: 1.1957, test_f1: 0.3044
 epoch: 8, train_loss: 1.2205, test_loss: 1.1876, test_f1: 0.3084
 epoch: 9, train_loss: 1.2154, test_loss: 1.1790, test_f1: 0.3115
 epoch: 10, train_loss: 1.2095, test_loss: 1.1712, test_f1: 0.3252
 epoch: 11, train_loss: 1.2055, test_loss: 1.1633, test_f1: 0.3368
 epoch: 12, train_loss: 1.1932, test_loss: 1.1575, test_f1: 0.3500
 epoch: 13, train_loss: 1.1915, test_loss: 1.1503, test_f1: 0.3690
 epoch: 14, train_loss: 1.1855, test_loss: 1.1420, test_f1: 0.3772
 epoch: 15, train_loss: 1.1713, test_loss: 1.1345, test_f1: 0.3810
 epoch: 16, train_loss: 1.1602, test_loss: 1.1304, test_f1: 0.4083
 epoch: 17, train_loss: 1.1598, test_loss: 1.1234, test_f1: 0.4139
 epoch: 18, train_loss: 1.1569, test_loss: 1.1153, test_f1: 0.4085
 epoch: 19, train_loss: 1.1433, test_loss: 1.1059, test_f1: 0.4130
 epoch: 20, train_loss: 1.1426, test_loss: 1.0993, test_f1: 0.4095
 epoch: 21, train_loss: 1.1363, test_loss: 1.0921, test_f1: 0.4268
 epoch: 22, train_loss: 1.1267, test_loss: 1.0865, test_f1: 0.4275
 epoch: 23, train_loss: 1.1211, test_loss: 1.0788, test_f1: 0.4303
 epoch: 24, train_loss: 1.1159, test_loss: 1.0720, test_f1: 0.4456
 epoch: 25, train_loss: 1.1124, test_loss: 1.0672, test_f1: 0.4544
 epoch: 26, train_loss: 1.0976, test_loss: 1.0604, test_f1: 0.4464
 epoch: 27, train_loss: 1.0928, test_loss: 1.0556, test_f1: 0.4525
 epoch: 28, train_loss: 1.0922, test_loss: 1.0485, test_f1: 0.4552
 epoch: 29, train_loss: 1.0831, test_loss: 1.0444, test_f1: 0.4583
 epoch: 30, train_loss: 1.0790, test_loss: 1.0377, test_f1: 0.4602
 epoch: 31, train_loss: 1.0626, test_loss: 1.0336, test_f1: 0.4585
 epoch: 32, train_loss: 1.0606, test_loss: 1.0239, test_f1: 0.4682
 epoch: 33, train_loss: 1.0557, test_loss: 1.0194, test_f1: 0.4692
 epoch: 34, train_loss: 1.0465, test_loss: 1.0173, test_f1: 0.4653
 epoch: 35, train_loss: 1.0402, test_loss: 1.0110, test_f1: 0.4614
 epoch: 36, train_loss: 1.0402, test_loss: 1.0045, test_f1: 0.4691
 epoch: 37, train_loss: 1.0318, test_loss: 0.9998, test_f1: 0.4652
 epoch: 38, train_loss: 1.0290, test_loss: 0.9947, test_f1: 0.4681
 epoch: 39, train_loss: 1.0236, test_loss: 0.9906, test_f1: 0.4675
 epoch: 40, train_loss: 1.0227, test_loss: 0.9912, test_f1: 0.4732
 epoch: 41, train_loss: 1.0201, test_loss: 0.9846, test_f1: 0.4728
 epoch: 42, train_loss: 1.0127, test_loss: 0.9783, test_f1: 0.4708
 epoch: 43, train_loss: 0.9995, test_loss: 0.9743, test_f1: 0.4740
 epoch: 44, train_loss: 1.0031, test_loss: 0.9688, test_f1: 0.4775
 epoch: 45, train_loss: 0.9997, test_loss: 0.9702, test_f1: 0.4797
 epoch: 46, train_loss: 0.9940, test_loss: 0.9673, test_f1: 0.4882
 epoch: 47, train_loss: 0.9823, test_loss: 0.9630, test_f1: 0.4848
 epoch: 48, train_loss: 0.9885, test_loss: 0.9622, test_f1: 0.4788
 epoch: 49, train_loss: 0.9787, test_loss: 0.9611, test_f1: 0.4897
 epoch: 50, train_loss: 0.9779, test_loss: 0.9663, test_f1: 0.4851
 epoch: 51, train_loss: 0.9738, test_loss: 0.9559, test_f1: 0.4887
 epoch: 52, train_loss: 0.9804, test_loss: 0.9559, test_f1: 0.4929
 epoch: 53, train_loss: 0.9683, test_loss: 0.9554, test_f1: 0.4903
 epoch: 54, train_loss: 0.9556, test_loss: 0.9543, test_f1: 0.4890
 epoch: 55, train_loss: 0.9731, test_loss: 0.9519, test_f1: 0.4945
 epoch: 56, train_loss: 0.9705, test_loss: 0.9512, test_f1: 0.4914
 epoch: 57, train_loss: 0.9638, test_loss: 0.9467, test_f1: 0.4852
 epoch: 58, train_loss: 0.9624, test_loss: 0.9525, test_f1: 0.4889
 epoch: 59, train_loss: 0.9574, test_loss: 0.9489, test_f1: 0.4916
 epoch: 60, train_loss: 0.9541, test_loss: 0.9483, test_f1: 0.4871
 epoch: 61, train_loss: 0.9573, test_loss: 0.9503, test_f1: 0.4939
 epoch: 62, train_loss: 0.9557, test_loss: 0.9507, test_f1: 0.4903
 epoch: 63, train_loss: 0.9625, test_loss: 0.9522, test_f1: 0.4932
 epoch: 64, train_loss: 0.9503, test_loss: 0.9481, test_f1: 0.4902
 epoch: 65, train_loss: 0.9500, test_loss: 0.9520, test_f1: 0.4887
 epoch: 66, train_loss: 0.9483, test_loss: 0.9460, test_f1: 0.4946
 epoch: 67, train_loss: 0.9447, test_loss: 0.9459, test_f1: 0.4935
 epoch: 68, train_loss: 0.9538, test_loss: 0.9489, test_f1: 0.4884
 epoch: 69, train_loss: 0.9502, test_loss: 0.9504, test_f1: 0.4866
 epoch: 70, train_loss: 0.9356, test_loss: 0.9459, test_f1: 0.4948
 epoch: 71, train_loss: 0.9432, test_loss: 0.9481, test_f1: 0.4899
 epoch: 72, train_loss: 0.9387, test_loss: 0.9467, test_f1: 0.4951
 epoch: 73, train_loss: 0.9384, test_loss: 0.9429, test_f1: 0.5041
 epoch: 74, train_loss: 0.9443, test_loss: 0.9458, test_f1: 0.4968
 epoch: 75, train_loss: 0.9324, test_loss: 0.9445, test_f1: 0.5010
 epoch: 76, train_loss: 0.9442, test_loss: 0.9430, test_f1: 0.5034
 epoch: 77, train_loss: 0.9276, test_loss: 0.9441, test_f1: 0.5006
 epoch: 78, train_loss: 0.9333, test_loss: 0.9452, test_f1: 0.4972
 epoch: 79, train_loss: 0.9259, test_loss: 0.9438, test_f1: 0.4978
 epoch: 80, train_loss: 0.9335, test_loss: 0.9469, test_f1: 0.4924
 epoch: 81, train_loss: 0.9326, test_loss: 0.9489, test_f1: 0.4939
 epoch: 82, train_loss: 0.9268, test_loss: 0.9457, test_f1: 0.4974
 epoch: 83, train_loss: 0.9260, test_loss: 0.9462, test_f1: 0.4996
 epoch: 84, train_loss: 0.9292, test_loss: 0.9453, test_f1: 0.4969
 epoch: 85, train_loss: 0.9229, test_loss: 0.9480, test_f1: 0.4983
 epoch: 86, train_loss: 0.9226, test_loss: 0.9512, test_f1: 0.4901
 epoch: 87, train_loss: 0.9169, test_loss: 0.9493, test_f1: 0.4915
 epoch: 88, train_loss: 0.9129, test_loss: 0.9474, test_f1: 0.4966
 epoch: 89, train_loss: 0.9230, test_loss: 0.9475, test_f1: 0.4966
 epoch: 90, train_loss: 0.9203, test_loss: 0.9548, test_f1: 0.4969
 epoch: 91, train_loss: 0.9131, test_loss: 0.9524, test_f1: 0.4948
 epoch: 92, train_loss: 0.9180, test_loss: 0.9459, test_f1: 0.5066
 epoch: 93, train_loss: 0.9160, test_loss: 0.9459, test_f1: 0.5111
 epoch: 94, train_loss: 0.9127, test_loss: 0.9475, test_f1: 0.5038
 epoch: 95, train_loss: 0.9056, test_loss: 0.9469, test_f1: 0.5042
 epoch: 96, train_loss: 0.9191, test_loss: 0.9452, test_f1: 0.5096
 epoch: 97, train_loss: 0.9149, test_loss: 0.9514, test_f1: 0.5037
 epoch: 98, train_loss: 0.9063, test_loss: 0.9552, test_f1: 0.5052
 epoch: 99, train_loss: 0.9059, test_loss: 0.9556, test_f1: 0.5033
##################ITERATION #5 ****************************************
 epoch: 0, train_loss: 1.3079, test_loss: 1.3312, test_f1: 0.2270
 epoch: 1, train_loss: 1.2760, test_loss: 1.3314, test_f1: 0.2270
 epoch: 2, train_loss: 1.2669, test_loss: 1.3282, test_f1: 0.2270
 epoch: 3, train_loss: 1.2510, test_loss: 1.3272, test_f1: 0.2270
 epoch: 4, train_loss: 1.2366, test_loss: 1.3072, test_f1: 0.2526
 epoch: 5, train_loss: 1.2276, test_loss: 1.2414, test_f1: 0.2601
 epoch: 6, train_loss: 1.2202, test_loss: 1.1966, test_f1: 0.2950
 epoch: 7, train_loss: 1.2154, test_loss: 1.1803, test_f1: 0.3097
 epoch: 8, train_loss: 1.2033, test_loss: 1.1692, test_f1: 0.3127
 epoch: 9, train_loss: 1.1941, test_loss: 1.1600, test_f1: 0.3315
 epoch: 10, train_loss: 1.1874, test_loss: 1.1517, test_f1: 0.3451
 epoch: 11, train_loss: 1.1856, test_loss: 1.1432, test_f1: 0.3592
 epoch: 12, train_loss: 1.1716, test_loss: 1.1353, test_f1: 0.3702
 epoch: 13, train_loss: 1.1735, test_loss: 1.1292, test_f1: 0.3915
 epoch: 14, train_loss: 1.1579, test_loss: 1.1207, test_f1: 0.4074
 epoch: 15, train_loss: 1.1552, test_loss: 1.1098, test_f1: 0.4161
 epoch: 16, train_loss: 1.1477, test_loss: 1.1056, test_f1: 0.4239
 epoch: 17, train_loss: 1.1431, test_loss: 1.0981, test_f1: 0.4282
 epoch: 18, train_loss: 1.1374, test_loss: 1.0927, test_f1: 0.4417
 epoch: 19, train_loss: 1.1297, test_loss: 1.0854, test_f1: 0.4462
 epoch: 20, train_loss: 1.1253, test_loss: 1.0814, test_f1: 0.4443
 epoch: 21, train_loss: 1.1147, test_loss: 1.0719, test_f1: 0.4574
 epoch: 22, train_loss: 1.1079, test_loss: 1.0640, test_f1: 0.4593
 epoch: 23, train_loss: 1.1077, test_loss: 1.0578, test_f1: 0.4600
 epoch: 24, train_loss: 1.0998, test_loss: 1.0549, test_f1: 0.4712
 epoch: 25, train_loss: 1.0995, test_loss: 1.0518, test_f1: 0.4767
 epoch: 26, train_loss: 1.0936, test_loss: 1.0449, test_f1: 0.4760
 epoch: 27, train_loss: 1.0795, test_loss: 1.0387, test_f1: 0.4767
 epoch: 28, train_loss: 1.0793, test_loss: 1.0328, test_f1: 0.4740
 epoch: 29, train_loss: 1.0752, test_loss: 1.0261, test_f1: 0.4801
 epoch: 30, train_loss: 1.0690, test_loss: 1.0195, test_f1: 0.4837
 epoch: 31, train_loss: 1.0626, test_loss: 1.0179, test_f1: 0.4779
 epoch: 32, train_loss: 1.0607, test_loss: 1.0143, test_f1: 0.4780
 epoch: 33, train_loss: 1.0516, test_loss: 1.0098, test_f1: 0.4749
 epoch: 34, train_loss: 1.0454, test_loss: 1.0043, test_f1: 0.4770
 epoch: 35, train_loss: 1.0389, test_loss: 1.0000, test_f1: 0.4732
 epoch: 36, train_loss: 1.0340, test_loss: 0.9999, test_f1: 0.4689
 epoch: 37, train_loss: 1.0326, test_loss: 0.9932, test_f1: 0.4808
 epoch: 38, train_loss: 1.0296, test_loss: 0.9874, test_f1: 0.4773
 epoch: 39, train_loss: 1.0294, test_loss: 0.9882, test_f1: 0.4710
 epoch: 40, train_loss: 1.0222, test_loss: 0.9838, test_f1: 0.4772
 epoch: 41, train_loss: 1.0138, test_loss: 0.9815, test_f1: 0.4735
 epoch: 42, train_loss: 1.0171, test_loss: 0.9788, test_f1: 0.4829
 epoch: 43, train_loss: 1.0174, test_loss: 0.9744, test_f1: 0.4780
 epoch: 44, train_loss: 1.0023, test_loss: 0.9716, test_f1: 0.4759
 epoch: 45, train_loss: 0.9975, test_loss: 0.9731, test_f1: 0.4795
 epoch: 46, train_loss: 0.9965, test_loss: 0.9742, test_f1: 0.4802
 epoch: 47, train_loss: 0.9910, test_loss: 0.9680, test_f1: 0.4808
 epoch: 48, train_loss: 0.9966, test_loss: 0.9670, test_f1: 0.4857
 epoch: 49, train_loss: 0.9960, test_loss: 0.9611, test_f1: 0.4833
 epoch: 50, train_loss: 0.9837, test_loss: 0.9645, test_f1: 0.4887
 epoch: 51, train_loss: 0.9836, test_loss: 0.9641, test_f1: 0.4851
 epoch: 52, train_loss: 0.9812, test_loss: 0.9639, test_f1: 0.4918
 epoch: 53, train_loss: 0.9781, test_loss: 0.9608, test_f1: 0.4964
 epoch: 54, train_loss: 0.9784, test_loss: 0.9619, test_f1: 0.4912
 epoch: 55, train_loss: 0.9876, test_loss: 0.9568, test_f1: 0.4940
 epoch: 56, train_loss: 0.9615, test_loss: 0.9561, test_f1: 0.4929
 epoch: 57, train_loss: 0.9781, test_loss: 0.9545, test_f1: 0.4904
 epoch: 58, train_loss: 0.9720, test_loss: 0.9511, test_f1: 0.4979
 epoch: 59, train_loss: 0.9596, test_loss: 0.9533, test_f1: 0.4971
 epoch: 60, train_loss: 0.9716, test_loss: 0.9508, test_f1: 0.4993
 epoch: 61, train_loss: 0.9677, test_loss: 0.9532, test_f1: 0.5045
 epoch: 62, train_loss: 0.9646, test_loss: 0.9474, test_f1: 0.5006
 epoch: 63, train_loss: 0.9607, test_loss: 0.9470, test_f1: 0.4914
 epoch: 64, train_loss: 0.9587, test_loss: 0.9493, test_f1: 0.4985
 epoch: 65, train_loss: 0.9630, test_loss: 0.9479, test_f1: 0.5060
 epoch: 66, train_loss: 0.9619, test_loss: 0.9480, test_f1: 0.5018
 epoch: 67, train_loss: 0.9621, test_loss: 0.9427, test_f1: 0.4940
 epoch: 68, train_loss: 0.9548, test_loss: 0.9443, test_f1: 0.4945
 epoch: 69, train_loss: 0.9627, test_loss: 0.9536, test_f1: 0.4863
 epoch: 70, train_loss: 0.9550, test_loss: 0.9431, test_f1: 0.4983
 epoch: 71, train_loss: 0.9634, test_loss: 0.9402, test_f1: 0.4943
 epoch: 72, train_loss: 0.9535, test_loss: 0.9439, test_f1: 0.4921
 epoch: 73, train_loss: 0.9507, test_loss: 0.9400, test_f1: 0.4933
 epoch: 74, train_loss: 0.9529, test_loss: 0.9384, test_f1: 0.4951
 epoch: 75, train_loss: 0.9449, test_loss: 0.9403, test_f1: 0.4937
 epoch: 76, train_loss: 0.9404, test_loss: 0.9387, test_f1: 0.4996
 epoch: 77, train_loss: 0.9384, test_loss: 0.9401, test_f1: 0.4990
 epoch: 78, train_loss: 0.9469, test_loss: 0.9403, test_f1: 0.5026
 epoch: 79, train_loss: 0.9394, test_loss: 0.9455, test_f1: 0.4997
 epoch: 80, train_loss: 0.9423, test_loss: 0.9427, test_f1: 0.4998
 epoch: 81, train_loss: 0.9476, test_loss: 0.9358, test_f1: 0.4921
 epoch: 82, train_loss: 0.9433, test_loss: 0.9364, test_f1: 0.4976
 epoch: 83, train_loss: 0.9399, test_loss: 0.9385, test_f1: 0.4950
 epoch: 84, train_loss: 0.9356, test_loss: 0.9385, test_f1: 0.4969
 epoch: 85, train_loss: 0.9386, test_loss: 0.9370, test_f1: 0.4954
 epoch: 86, train_loss: 0.9393, test_loss: 0.9327, test_f1: 0.5048
 epoch: 87, train_loss: 0.9366, test_loss: 0.9434, test_f1: 0.5011
 epoch: 88, train_loss: 0.9352, test_loss: 0.9367, test_f1: 0.5039
 epoch: 89, train_loss: 0.9297, test_loss: 0.9415, test_f1: 0.5024
 epoch: 90, train_loss: 0.9350, test_loss: 0.9387, test_f1: 0.5047
 epoch: 91, train_loss: 0.9334, test_loss: 0.9364, test_f1: 0.5044
 epoch: 92, train_loss: 0.9311, test_loss: 0.9319, test_f1: 0.5005
 epoch: 93, train_loss: 0.9275, test_loss: 0.9326, test_f1: 0.5001
 epoch: 94, train_loss: 0.9337, test_loss: 0.9294, test_f1: 0.5055
 epoch: 95, train_loss: 0.9263, test_loss: 0.9345, test_f1: 0.5068
 epoch: 96, train_loss: 0.9317, test_loss: 0.9302, test_f1: 0.5063
 epoch: 97, train_loss: 0.9323, test_loss: 0.9380, test_f1: 0.5065
 epoch: 98, train_loss: 0.9276, test_loss: 0.9287, test_f1: 0.5104
 epoch: 99, train_loss: 0.9212, test_loss: 0.9369, test_f1: 0.5085
##################ITERATION #6 ****************************************
 epoch: 0, train_loss: 1.3258, test_loss: 1.3126, test_f1: 0.2270
 epoch: 1, train_loss: 1.2820, test_loss: 1.3125, test_f1: 0.2270
 epoch: 2, train_loss: 1.2673, test_loss: 1.2958, test_f1: 0.2270
 epoch: 3, train_loss: 1.2452, test_loss: 1.2671, test_f1: 0.2270
 epoch: 4, train_loss: 1.2345, test_loss: 1.2248, test_f1: 0.2677
 epoch: 5, train_loss: 1.2296, test_loss: 1.1954, test_f1: 0.2765
 epoch: 6, train_loss: 1.2163, test_loss: 1.1766, test_f1: 0.2929
 epoch: 7, train_loss: 1.2062, test_loss: 1.1654, test_f1: 0.3054
 epoch: 8, train_loss: 1.1955, test_loss: 1.1540, test_f1: 0.3221
 epoch: 9, train_loss: 1.1909, test_loss: 1.1474, test_f1: 0.3252
 epoch: 10, train_loss: 1.1840, test_loss: 1.1386, test_f1: 0.3564
 epoch: 11, train_loss: 1.1787, test_loss: 1.1327, test_f1: 0.3617
 epoch: 12, train_loss: 1.1690, test_loss: 1.1243, test_f1: 0.3597
 epoch: 13, train_loss: 1.1632, test_loss: 1.1175, test_f1: 0.3707
 epoch: 14, train_loss: 1.1502, test_loss: 1.1086, test_f1: 0.3995
 epoch: 15, train_loss: 1.1473, test_loss: 1.0999, test_f1: 0.4050
 epoch: 16, train_loss: 1.1449, test_loss: 1.0929, test_f1: 0.4202
 epoch: 17, train_loss: 1.1375, test_loss: 1.0867, test_f1: 0.4284
 epoch: 18, train_loss: 1.1281, test_loss: 1.0789, test_f1: 0.4374
 epoch: 19, train_loss: 1.1228, test_loss: 1.0706, test_f1: 0.4388
 epoch: 20, train_loss: 1.1268, test_loss: 1.0650, test_f1: 0.4389
 epoch: 21, train_loss: 1.1075, test_loss: 1.0599, test_f1: 0.4355
 epoch: 22, train_loss: 1.1079, test_loss: 1.0549, test_f1: 0.4403
 epoch: 23, train_loss: 1.1043, test_loss: 1.0472, test_f1: 0.4467
 epoch: 24, train_loss: 1.0928, test_loss: 1.0420, test_f1: 0.4498
 epoch: 25, train_loss: 1.0903, test_loss: 1.0382, test_f1: 0.4648
 epoch: 26, train_loss: 1.0785, test_loss: 1.0327, test_f1: 0.4662
 epoch: 27, train_loss: 1.0855, test_loss: 1.0251, test_f1: 0.4646
 epoch: 28, train_loss: 1.0793, test_loss: 1.0214, test_f1: 0.4609
 epoch: 29, train_loss: 1.0660, test_loss: 1.0195, test_f1: 0.4646
 epoch: 30, train_loss: 1.0606, test_loss: 1.0157, test_f1: 0.4713
 epoch: 31, train_loss: 1.0583, test_loss: 1.0102, test_f1: 0.4712
 epoch: 32, train_loss: 1.0518, test_loss: 1.0075, test_f1: 0.4725
 epoch: 33, train_loss: 1.0534, test_loss: 1.0038, test_f1: 0.4786
 epoch: 34, train_loss: 1.0482, test_loss: 1.0013, test_f1: 0.4784
 epoch: 35, train_loss: 1.0538, test_loss: 0.9968, test_f1: 0.4676
 epoch: 36, train_loss: 1.0401, test_loss: 0.9913, test_f1: 0.4692
 epoch: 37, train_loss: 1.0344, test_loss: 0.9882, test_f1: 0.4667
 epoch: 38, train_loss: 1.0362, test_loss: 0.9862, test_f1: 0.4653
 epoch: 39, train_loss: 1.0273, test_loss: 0.9848, test_f1: 0.4612
 epoch: 40, train_loss: 1.0260, test_loss: 0.9807, test_f1: 0.4683
 epoch: 41, train_loss: 1.0195, test_loss: 0.9783, test_f1: 0.4741
 epoch: 42, train_loss: 1.0149, test_loss: 0.9765, test_f1: 0.4669
 epoch: 43, train_loss: 1.0182, test_loss: 0.9717, test_f1: 0.4665
 epoch: 44, train_loss: 1.0053, test_loss: 0.9673, test_f1: 0.4722
 epoch: 45, train_loss: 1.0066, test_loss: 0.9650, test_f1: 0.4693
 epoch: 46, train_loss: 0.9979, test_loss: 0.9629, test_f1: 0.4741
 epoch: 47, train_loss: 0.9948, test_loss: 0.9620, test_f1: 0.4858
 epoch: 48, train_loss: 0.9945, test_loss: 0.9556, test_f1: 0.4960
 epoch: 49, train_loss: 0.9977, test_loss: 0.9537, test_f1: 0.5003
 epoch: 50, train_loss: 0.9889, test_loss: 0.9496, test_f1: 0.5050
 epoch: 51, train_loss: 0.9956, test_loss: 0.9479, test_f1: 0.5108
 epoch: 52, train_loss: 0.9803, test_loss: 0.9461, test_f1: 0.5020
 epoch: 53, train_loss: 0.9821, test_loss: 0.9465, test_f1: 0.5102
 epoch: 54, train_loss: 0.9829, test_loss: 0.9445, test_f1: 0.5102
 epoch: 55, train_loss: 0.9864, test_loss: 0.9447, test_f1: 0.5145
 epoch: 56, train_loss: 0.9781, test_loss: 0.9415, test_f1: 0.5169
 epoch: 57, train_loss: 0.9824, test_loss: 0.9414, test_f1: 0.5142
 epoch: 58, train_loss: 0.9816, test_loss: 0.9385, test_f1: 0.5129
 epoch: 59, train_loss: 0.9789, test_loss: 0.9395, test_f1: 0.5124
 epoch: 60, train_loss: 0.9812, test_loss: 0.9375, test_f1: 0.5196
 epoch: 61, train_loss: 0.9842, test_loss: 0.9383, test_f1: 0.5171
 epoch: 62, train_loss: 0.9775, test_loss: 0.9357, test_f1: 0.5188
 epoch: 63, train_loss: 0.9681, test_loss: 0.9364, test_f1: 0.5163
 epoch: 64, train_loss: 0.9673, test_loss: 0.9367, test_f1: 0.5173
 epoch: 65, train_loss: 0.9677, test_loss: 0.9339, test_f1: 0.5219
 epoch: 66, train_loss: 0.9647, test_loss: 0.9341, test_f1: 0.5218
 epoch: 67, train_loss: 0.9634, test_loss: 0.9318, test_f1: 0.5177
 epoch: 68, train_loss: 0.9634, test_loss: 0.9317, test_f1: 0.5173
 epoch: 69, train_loss: 0.9599, test_loss: 0.9338, test_f1: 0.5111
 epoch: 70, train_loss: 0.9699, test_loss: 0.9318, test_f1: 0.5226
 epoch: 71, train_loss: 0.9641, test_loss: 0.9305, test_f1: 0.5219
 epoch: 72, train_loss: 0.9559, test_loss: 0.9250, test_f1: 0.5218
 epoch: 73, train_loss: 0.9628, test_loss: 0.9242, test_f1: 0.5203
 epoch: 74, train_loss: 0.9612, test_loss: 0.9250, test_f1: 0.5245
 epoch: 75, train_loss: 0.9517, test_loss: 0.9247, test_f1: 0.5266
 epoch: 76, train_loss: 0.9625, test_loss: 0.9229, test_f1: 0.5265
 epoch: 77, train_loss: 0.9506, test_loss: 0.9197, test_f1: 0.5265
 epoch: 78, train_loss: 0.9542, test_loss: 0.9198, test_f1: 0.5292
 epoch: 79, train_loss: 0.9526, test_loss: 0.9174, test_f1: 0.5341
 epoch: 80, train_loss: 0.9411, test_loss: 0.9177, test_f1: 0.5282
 epoch: 81, train_loss: 0.9446, test_loss: 0.9178, test_f1: 0.5214
 epoch: 82, train_loss: 0.9441, test_loss: 0.9150, test_f1: 0.5289
 epoch: 83, train_loss: 0.9444, test_loss: 0.9139, test_f1: 0.5240
 epoch: 84, train_loss: 0.9479, test_loss: 0.9129, test_f1: 0.5247
 epoch: 85, train_loss: 0.9448, test_loss: 0.9150, test_f1: 0.5284
 epoch: 86, train_loss: 0.9433, test_loss: 0.9140, test_f1: 0.5259
 epoch: 87, train_loss: 0.9438, test_loss: 0.9141, test_f1: 0.5251
 epoch: 88, train_loss: 0.9382, test_loss: 0.9116, test_f1: 0.5275
 epoch: 89, train_loss: 0.9325, test_loss: 0.9122, test_f1: 0.5282
 epoch: 90, train_loss: 0.9457, test_loss: 0.9126, test_f1: 0.5262
 epoch: 91, train_loss: 0.9358, test_loss: 0.9107, test_f1: 0.5281
 epoch: 92, train_loss: 0.9374, test_loss: 0.9100, test_f1: 0.5307
 epoch: 93, train_loss: 0.9330, test_loss: 0.9112, test_f1: 0.5274
 epoch: 94, train_loss: 0.9375, test_loss: 0.9130, test_f1: 0.5274
 epoch: 95, train_loss: 0.9299, test_loss: 0.9132, test_f1: 0.5308
 epoch: 96, train_loss: 0.9252, test_loss: 0.9163, test_f1: 0.5180
 epoch: 97, train_loss: 0.9325, test_loss: 0.9121, test_f1: 0.5209
 epoch: 98, train_loss: 0.9310, test_loss: 0.9102, test_f1: 0.5272
 epoch: 99, train_loss: 0.9228, test_loss: 0.9102, test_f1: 0.5210
##################ITERATION #7 ****************************************
 epoch: 0, train_loss: 1.3638, test_loss: 1.3367, test_f1: 0.2270
 epoch: 1, train_loss: 1.3130, test_loss: 1.3200, test_f1: 0.2270
 epoch: 2, train_loss: 1.2810, test_loss: 1.3123, test_f1: 0.2270
 epoch: 3, train_loss: 1.2735, test_loss: 1.2856, test_f1: 0.2270
 epoch: 4, train_loss: 1.2525, test_loss: 1.2446, test_f1: 0.2270
 epoch: 5, train_loss: 1.2362, test_loss: 1.2187, test_f1: 0.2439
 epoch: 6, train_loss: 1.2285, test_loss: 1.2062, test_f1: 0.2646
 epoch: 7, train_loss: 1.2210, test_loss: 1.1955, test_f1: 0.2813
 epoch: 8, train_loss: 1.2110, test_loss: 1.1855, test_f1: 0.3193
 epoch: 9, train_loss: 1.1971, test_loss: 1.1764, test_f1: 0.3403
 epoch: 10, train_loss: 1.1913, test_loss: 1.1678, test_f1: 0.3512
 epoch: 11, train_loss: 1.1844, test_loss: 1.1566, test_f1: 0.3673
 epoch: 12, train_loss: 1.1807, test_loss: 1.1482, test_f1: 0.3810
 epoch: 13, train_loss: 1.1790, test_loss: 1.1386, test_f1: 0.4007
 epoch: 14, train_loss: 1.1609, test_loss: 1.1307, test_f1: 0.4118
 epoch: 15, train_loss: 1.1565, test_loss: 1.1227, test_f1: 0.4224
 epoch: 16, train_loss: 1.1482, test_loss: 1.1149, test_f1: 0.4268
 epoch: 17, train_loss: 1.1337, test_loss: 1.1059, test_f1: 0.4335
 epoch: 18, train_loss: 1.1274, test_loss: 1.0948, test_f1: 0.4347
 epoch: 19, train_loss: 1.1175, test_loss: 1.0858, test_f1: 0.4389
 epoch: 20, train_loss: 1.1150, test_loss: 1.0782, test_f1: 0.4396
 epoch: 21, train_loss: 1.1050, test_loss: 1.0710, test_f1: 0.4428
 epoch: 22, train_loss: 1.0971, test_loss: 1.0635, test_f1: 0.4481
 epoch: 23, train_loss: 1.0846, test_loss: 1.0544, test_f1: 0.4530
 epoch: 24, train_loss: 1.0862, test_loss: 1.0464, test_f1: 0.4585
 epoch: 25, train_loss: 1.0837, test_loss: 1.0408, test_f1: 0.4582
 epoch: 26, train_loss: 1.0734, test_loss: 1.0324, test_f1: 0.4648
 epoch: 27, train_loss: 1.0698, test_loss: 1.0270, test_f1: 0.4632
 epoch: 28, train_loss: 1.0601, test_loss: 1.0199, test_f1: 0.4635
 epoch: 29, train_loss: 1.0584, test_loss: 1.0144, test_f1: 0.4635
 epoch: 30, train_loss: 1.0502, test_loss: 1.0098, test_f1: 0.4704
 epoch: 31, train_loss: 1.0515, test_loss: 1.0062, test_f1: 0.4726
 epoch: 32, train_loss: 1.0400, test_loss: 1.0014, test_f1: 0.4732
 epoch: 33, train_loss: 1.0328, test_loss: 0.9953, test_f1: 0.4742
 epoch: 34, train_loss: 1.0274, test_loss: 0.9914, test_f1: 0.4752
 epoch: 35, train_loss: 1.0276, test_loss: 0.9882, test_f1: 0.4767
 epoch: 36, train_loss: 1.0153, test_loss: 0.9897, test_f1: 0.4781
 epoch: 37, train_loss: 1.0157, test_loss: 0.9867, test_f1: 0.4799
 epoch: 38, train_loss: 1.0101, test_loss: 0.9785, test_f1: 0.4716
 epoch: 39, train_loss: 1.0032, test_loss: 0.9746, test_f1: 0.4767
 epoch: 40, train_loss: 1.0080, test_loss: 0.9732, test_f1: 0.4795
 epoch: 41, train_loss: 0.9921, test_loss: 0.9767, test_f1: 0.4832
 epoch: 42, train_loss: 1.0014, test_loss: 0.9735, test_f1: 0.4861
 epoch: 43, train_loss: 0.9886, test_loss: 0.9722, test_f1: 0.4870
 epoch: 44, train_loss: 0.9856, test_loss: 0.9751, test_f1: 0.4860
 epoch: 45, train_loss: 0.9816, test_loss: 0.9743, test_f1: 0.4873
 epoch: 46, train_loss: 0.9820, test_loss: 0.9698, test_f1: 0.4893
 epoch: 47, train_loss: 0.9786, test_loss: 0.9684, test_f1: 0.4977
 epoch: 48, train_loss: 0.9747, test_loss: 0.9606, test_f1: 0.4979
 epoch: 49, train_loss: 0.9745, test_loss: 0.9571, test_f1: 0.5027
 epoch: 50, train_loss: 0.9661, test_loss: 0.9587, test_f1: 0.5087
 epoch: 51, train_loss: 0.9589, test_loss: 0.9573, test_f1: 0.5101
 epoch: 52, train_loss: 0.9710, test_loss: 0.9615, test_f1: 0.5069
 epoch: 53, train_loss: 0.9719, test_loss: 0.9615, test_f1: 0.5033
 epoch: 54, train_loss: 0.9621, test_loss: 0.9624, test_f1: 0.5077
 epoch: 55, train_loss: 0.9608, test_loss: 0.9628, test_f1: 0.5076
 epoch: 56, train_loss: 0.9556, test_loss: 0.9597, test_f1: 0.5117
 epoch: 57, train_loss: 0.9598, test_loss: 0.9591, test_f1: 0.5100
 epoch: 58, train_loss: 0.9503, test_loss: 0.9562, test_f1: 0.5096
 epoch: 59, train_loss: 0.9568, test_loss: 0.9581, test_f1: 0.5093
 epoch: 60, train_loss: 0.9582, test_loss: 0.9631, test_f1: 0.5093
 epoch: 61, train_loss: 0.9539, test_loss: 0.9592, test_f1: 0.5099
 epoch: 62, train_loss: 0.9544, test_loss: 0.9574, test_f1: 0.5150
 epoch: 63, train_loss: 0.9626, test_loss: 0.9561, test_f1: 0.5127
 epoch: 64, train_loss: 0.9576, test_loss: 0.9626, test_f1: 0.5139
 epoch: 65, train_loss: 0.9558, test_loss: 0.9640, test_f1: 0.5127
 epoch: 66, train_loss: 0.9515, test_loss: 0.9605, test_f1: 0.5101
 epoch: 67, train_loss: 0.9522, test_loss: 0.9567, test_f1: 0.5109
 epoch: 68, train_loss: 0.9467, test_loss: 0.9573, test_f1: 0.5111
 epoch: 69, train_loss: 0.9487, test_loss: 0.9579, test_f1: 0.5107
 epoch: 70, train_loss: 0.9413, test_loss: 0.9656, test_f1: 0.5106
 epoch: 71, train_loss: 0.9490, test_loss: 0.9615, test_f1: 0.5123
 epoch: 72, train_loss: 0.9422, test_loss: 0.9635, test_f1: 0.5113
 epoch: 73, train_loss: 0.9434, test_loss: 0.9607, test_f1: 0.5091
 epoch: 74, train_loss: 0.9433, test_loss: 0.9612, test_f1: 0.5092
 epoch: 75, train_loss: 0.9433, test_loss: 0.9557, test_f1: 0.5116
 epoch: 76, train_loss: 0.9354, test_loss: 0.9622, test_f1: 0.5121
 epoch: 77, train_loss: 0.9381, test_loss: 0.9652, test_f1: 0.5119
 epoch: 78, train_loss: 0.9330, test_loss: 0.9592, test_f1: 0.5112
 epoch: 79, train_loss: 0.9366, test_loss: 0.9601, test_f1: 0.5033
 epoch: 80, train_loss: 0.9327, test_loss: 0.9661, test_f1: 0.5044
 epoch: 81, train_loss: 0.9406, test_loss: 0.9670, test_f1: 0.5070
 epoch: 82, train_loss: 0.9371, test_loss: 0.9622, test_f1: 0.5079
 epoch: 83, train_loss: 0.9331, test_loss: 0.9661, test_f1: 0.5046
 epoch: 84, train_loss: 0.9328, test_loss: 0.9608, test_f1: 0.5074
 epoch: 85, train_loss: 0.9336, test_loss: 0.9641, test_f1: 0.5046
 epoch: 86, train_loss: 0.9340, test_loss: 0.9616, test_f1: 0.5115
 epoch: 87, train_loss: 0.9234, test_loss: 0.9629, test_f1: 0.5119
 epoch: 88, train_loss: 0.9204, test_loss: 0.9679, test_f1: 0.5106
 epoch: 89, train_loss: 0.9397, test_loss: 0.9667, test_f1: 0.5080
 epoch: 90, train_loss: 0.9319, test_loss: 0.9680, test_f1: 0.5065
 epoch: 91, train_loss: 0.9191, test_loss: 0.9662, test_f1: 0.5099
 epoch: 92, train_loss: 0.9310, test_loss: 0.9624, test_f1: 0.5144
 epoch: 93, train_loss: 0.9320, test_loss: 0.9709, test_f1: 0.5066
 epoch: 94, train_loss: 0.9253, test_loss: 0.9680, test_f1: 0.5122
 epoch: 95, train_loss: 0.9216, test_loss: 0.9702, test_f1: 0.5060
 epoch: 96, train_loss: 0.9194, test_loss: 0.9681, test_f1: 0.5062
 epoch: 97, train_loss: 0.9173, test_loss: 0.9672, test_f1: 0.5066
 epoch: 98, train_loss: 0.9130, test_loss: 0.9653, test_f1: 0.5072
 epoch: 99, train_loss: 0.9199, test_loss: 0.9630, test_f1: 0.5067
##################ITERATION #8 ****************************************
 epoch: 0, train_loss: 1.3424, test_loss: 1.3134, test_f1: 0.2270
 epoch: 1, train_loss: 1.2740, test_loss: 1.2967, test_f1: 0.2270
 epoch: 2, train_loss: 1.2497, test_loss: 1.2826, test_f1: 0.2270
 epoch: 3, train_loss: 1.2282, test_loss: 1.2528, test_f1: 0.2521
 epoch: 4, train_loss: 1.2198, test_loss: 1.2104, test_f1: 0.2587
 epoch: 5, train_loss: 1.2080, test_loss: 1.1699, test_f1: 0.3369
 epoch: 6, train_loss: 1.2029, test_loss: 1.1531, test_f1: 0.3526
 epoch: 7, train_loss: 1.1896, test_loss: 1.1397, test_f1: 0.3715
 epoch: 8, train_loss: 1.1772, test_loss: 1.1294, test_f1: 0.3922
 epoch: 9, train_loss: 1.1749, test_loss: 1.1211, test_f1: 0.4023
 epoch: 10, train_loss: 1.1616, test_loss: 1.1125, test_f1: 0.4180
 epoch: 11, train_loss: 1.1569, test_loss: 1.1047, test_f1: 0.4276
 epoch: 12, train_loss: 1.1492, test_loss: 1.0971, test_f1: 0.4328
 epoch: 13, train_loss: 1.1378, test_loss: 1.0917, test_f1: 0.4336
 epoch: 14, train_loss: 1.1319, test_loss: 1.0847, test_f1: 0.4496
 epoch: 15, train_loss: 1.1374, test_loss: 1.0790, test_f1: 0.4549
 epoch: 16, train_loss: 1.1260, test_loss: 1.0699, test_f1: 0.4553
 epoch: 17, train_loss: 1.1144, test_loss: 1.0643, test_f1: 0.4553
 epoch: 18, train_loss: 1.1074, test_loss: 1.0564, test_f1: 0.4576
 epoch: 19, train_loss: 1.0973, test_loss: 1.0499, test_f1: 0.4612
 epoch: 20, train_loss: 1.0990, test_loss: 1.0435, test_f1: 0.4697
 epoch: 21, train_loss: 1.0817, test_loss: 1.0364, test_f1: 0.4723
 epoch: 22, train_loss: 1.0862, test_loss: 1.0301, test_f1: 0.4762
 epoch: 23, train_loss: 1.0883, test_loss: 1.0260, test_f1: 0.4749
 epoch: 24, train_loss: 1.0740, test_loss: 1.0194, test_f1: 0.4828
 epoch: 25, train_loss: 1.0590, test_loss: 1.0134, test_f1: 0.4781
 epoch: 26, train_loss: 1.0645, test_loss: 1.0093, test_f1: 0.4824
 epoch: 27, train_loss: 1.0577, test_loss: 1.0042, test_f1: 0.4789
 epoch: 28, train_loss: 1.0508, test_loss: 1.0006, test_f1: 0.4807
 epoch: 29, train_loss: 1.0453, test_loss: 0.9960, test_f1: 0.4835
 epoch: 30, train_loss: 1.0404, test_loss: 0.9926, test_f1: 0.4877
 epoch: 31, train_loss: 1.0313, test_loss: 0.9886, test_f1: 0.4837
 epoch: 32, train_loss: 1.0353, test_loss: 0.9850, test_f1: 0.4845
 epoch: 33, train_loss: 1.0246, test_loss: 0.9792, test_f1: 0.4851
 epoch: 34, train_loss: 1.0216, test_loss: 0.9763, test_f1: 0.4867
 epoch: 35, train_loss: 1.0177, test_loss: 0.9707, test_f1: 0.4876
 epoch: 36, train_loss: 1.0094, test_loss: 0.9701, test_f1: 0.4790
 epoch: 37, train_loss: 1.0021, test_loss: 0.9696, test_f1: 0.4814
 epoch: 38, train_loss: 1.0029, test_loss: 0.9656, test_f1: 0.4841
 epoch: 39, train_loss: 1.0001, test_loss: 0.9605, test_f1: 0.4816
 epoch: 40, train_loss: 1.0009, test_loss: 0.9577, test_f1: 0.4798
 epoch: 41, train_loss: 0.9873, test_loss: 0.9572, test_f1: 0.4790
 epoch: 42, train_loss: 0.9885, test_loss: 0.9570, test_f1: 0.4802
 epoch: 43, train_loss: 0.9869, test_loss: 0.9587, test_f1: 0.4850
 epoch: 44, train_loss: 0.9882, test_loss: 0.9539, test_f1: 0.4859
 epoch: 45, train_loss: 0.9791, test_loss: 0.9539, test_f1: 0.4843
 epoch: 46, train_loss: 0.9891, test_loss: 0.9514, test_f1: 0.4807
 epoch: 47, train_loss: 0.9744, test_loss: 0.9523, test_f1: 0.4886
 epoch: 48, train_loss: 0.9692, test_loss: 0.9498, test_f1: 0.5016
 epoch: 49, train_loss: 0.9750, test_loss: 0.9521, test_f1: 0.4950
 epoch: 50, train_loss: 0.9639, test_loss: 0.9500, test_f1: 0.4983
 epoch: 51, train_loss: 0.9667, test_loss: 0.9523, test_f1: 0.4948
 epoch: 52, train_loss: 0.9630, test_loss: 0.9508, test_f1: 0.5006
 epoch: 53, train_loss: 0.9493, test_loss: 0.9509, test_f1: 0.4979
 epoch: 54, train_loss: 0.9599, test_loss: 0.9510, test_f1: 0.4972
 epoch: 55, train_loss: 0.9556, test_loss: 0.9473, test_f1: 0.5018
 epoch: 56, train_loss: 0.9562, test_loss: 0.9477, test_f1: 0.5031
 epoch: 57, train_loss: 0.9608, test_loss: 0.9520, test_f1: 0.5042
 epoch: 58, train_loss: 0.9530, test_loss: 0.9489, test_f1: 0.5030
 epoch: 59, train_loss: 0.9449, test_loss: 0.9485, test_f1: 0.5030
 epoch: 60, train_loss: 0.9483, test_loss: 0.9470, test_f1: 0.5040
 epoch: 61, train_loss: 0.9506, test_loss: 0.9443, test_f1: 0.5039
 epoch: 62, train_loss: 0.9423, test_loss: 0.9466, test_f1: 0.5006
 epoch: 63, train_loss: 0.9523, test_loss: 0.9466, test_f1: 0.5012
 epoch: 64, train_loss: 0.9441, test_loss: 0.9503, test_f1: 0.5037
 epoch: 65, train_loss: 0.9457, test_loss: 0.9487, test_f1: 0.5025
 epoch: 66, train_loss: 0.9425, test_loss: 0.9426, test_f1: 0.5019
 epoch: 67, train_loss: 0.9475, test_loss: 0.9407, test_f1: 0.5030
 epoch: 68, train_loss: 0.9426, test_loss: 0.9412, test_f1: 0.5072
 epoch: 69, train_loss: 0.9515, test_loss: 0.9421, test_f1: 0.5068
 epoch: 70, train_loss: 0.9370, test_loss: 0.9457, test_f1: 0.5051
 epoch: 71, train_loss: 0.9383, test_loss: 0.9455, test_f1: 0.5043
 epoch: 72, train_loss: 0.9413, test_loss: 0.9444, test_f1: 0.5052
 epoch: 73, train_loss: 0.9313, test_loss: 0.9490, test_f1: 0.5085
 epoch: 74, train_loss: 0.9306, test_loss: 0.9428, test_f1: 0.5095
 epoch: 75, train_loss: 0.9325, test_loss: 0.9424, test_f1: 0.5058
 epoch: 76, train_loss: 0.9264, test_loss: 0.9400, test_f1: 0.5034
 epoch: 77, train_loss: 0.9294, test_loss: 0.9434, test_f1: 0.5095
 epoch: 78, train_loss: 0.9303, test_loss: 0.9449, test_f1: 0.5110
 epoch: 79, train_loss: 0.9339, test_loss: 0.9478, test_f1: 0.5084
 epoch: 80, train_loss: 0.9317, test_loss: 0.9437, test_f1: 0.5122
 epoch: 81, train_loss: 0.9271, test_loss: 0.9421, test_f1: 0.5138
 epoch: 82, train_loss: 0.9321, test_loss: 0.9430, test_f1: 0.5143
 epoch: 83, train_loss: 0.9206, test_loss: 0.9443, test_f1: 0.5150
 epoch: 84, train_loss: 0.9236, test_loss: 0.9411, test_f1: 0.5096
 epoch: 85, train_loss: 0.9257, test_loss: 0.9438, test_f1: 0.5098
 epoch: 86, train_loss: 0.9183, test_loss: 0.9442, test_f1: 0.5070
 epoch: 87, train_loss: 0.9268, test_loss: 0.9426, test_f1: 0.5109
 epoch: 88, train_loss: 0.9194, test_loss: 0.9412, test_f1: 0.5117
 epoch: 89, train_loss: 0.9224, test_loss: 0.9420, test_f1: 0.5139
 epoch: 90, train_loss: 0.9179, test_loss: 0.9398, test_f1: 0.5150
 epoch: 91, train_loss: 0.9163, test_loss: 0.9402, test_f1: 0.5146
 epoch: 92, train_loss: 0.9196, test_loss: 0.9413, test_f1: 0.5120
 epoch: 93, train_loss: 0.9139, test_loss: 0.9420, test_f1: 0.5155
 epoch: 94, train_loss: 0.9236, test_loss: 0.9421, test_f1: 0.5124
 epoch: 95, train_loss: 0.9165, test_loss: 0.9423, test_f1: 0.5102
 epoch: 96, train_loss: 0.9154, test_loss: 0.9459, test_f1: 0.5102
 epoch: 97, train_loss: 0.9092, test_loss: 0.9418, test_f1: 0.5140
 epoch: 98, train_loss: 0.9102, test_loss: 0.9404, test_f1: 0.5175
 epoch: 99, train_loss: 0.9118, test_loss: 0.9425, test_f1: 0.5160
##################ITERATION #9 ****************************************
 epoch: 0, train_loss: 1.4073, test_loss: 1.3738, test_f1: 0.2270
 epoch: 1, train_loss: 1.3305, test_loss: 1.3604, test_f1: 0.2270
 epoch: 2, train_loss: 1.2875, test_loss: 1.3314, test_f1: 0.2270
 epoch: 3, train_loss: 1.2656, test_loss: 1.2727, test_f1: 0.2560
 epoch: 4, train_loss: 1.2517, test_loss: 1.2200, test_f1: 0.3273
 epoch: 5, train_loss: 1.2327, test_loss: 1.1920, test_f1: 0.3447
 epoch: 6, train_loss: 1.2197, test_loss: 1.1758, test_f1: 0.3483
 epoch: 7, train_loss: 1.2076, test_loss: 1.1658, test_f1: 0.3496
 epoch: 8, train_loss: 1.1937, test_loss: 1.1555, test_f1: 0.3600
 epoch: 9, train_loss: 1.1877, test_loss: 1.1456, test_f1: 0.3637
 epoch: 10, train_loss: 1.1763, test_loss: 1.1361, test_f1: 0.3679
 epoch: 11, train_loss: 1.1663, test_loss: 1.1267, test_f1: 0.3903
 epoch: 12, train_loss: 1.1560, test_loss: 1.1157, test_f1: 0.4016
 epoch: 13, train_loss: 1.1552, test_loss: 1.1049, test_f1: 0.4227
 epoch: 14, train_loss: 1.1464, test_loss: 1.0967, test_f1: 0.4258
 epoch: 15, train_loss: 1.1329, test_loss: 1.0865, test_f1: 0.4302
 epoch: 16, train_loss: 1.1253, test_loss: 1.0797, test_f1: 0.4381
 epoch: 17, train_loss: 1.1134, test_loss: 1.0721, test_f1: 0.4388
 epoch: 18, train_loss: 1.1111, test_loss: 1.0650, test_f1: 0.4400
 epoch: 19, train_loss: 1.1044, test_loss: 1.0570, test_f1: 0.4467
 epoch: 20, train_loss: 1.0949, test_loss: 1.0516, test_f1: 0.4466
 epoch: 21, train_loss: 1.0922, test_loss: 1.0436, test_f1: 0.4475
 epoch: 22, train_loss: 1.0773, test_loss: 1.0368, test_f1: 0.4533
 epoch: 23, train_loss: 1.0742, test_loss: 1.0320, test_f1: 0.4503
 epoch: 24, train_loss: 1.0636, test_loss: 1.0266, test_f1: 0.4554
 epoch: 25, train_loss: 1.0642, test_loss: 1.0190, test_f1: 0.4673
 epoch: 26, train_loss: 1.0581, test_loss: 1.0204, test_f1: 0.4617
 epoch: 27, train_loss: 1.0550, test_loss: 1.0156, test_f1: 0.4653
 epoch: 28, train_loss: 1.0532, test_loss: 1.0102, test_f1: 0.4621
 epoch: 29, train_loss: 1.0372, test_loss: 1.0051, test_f1: 0.4658
 epoch: 30, train_loss: 1.0282, test_loss: 1.0020, test_f1: 0.4659
 epoch: 31, train_loss: 1.0280, test_loss: 0.9983, test_f1: 0.4797
 epoch: 32, train_loss: 1.0250, test_loss: 0.9944, test_f1: 0.4760
 epoch: 33, train_loss: 1.0297, test_loss: 0.9913, test_f1: 0.4882
 epoch: 34, train_loss: 1.0149, test_loss: 0.9910, test_f1: 0.4875
 epoch: 35, train_loss: 1.0123, test_loss: 0.9841, test_f1: 0.4831
 epoch: 36, train_loss: 1.0079, test_loss: 0.9835, test_f1: 0.4850
 epoch: 37, train_loss: 1.0062, test_loss: 0.9814, test_f1: 0.4852
 epoch: 38, train_loss: 1.0065, test_loss: 0.9768, test_f1: 0.4897
 epoch: 39, train_loss: 1.0016, test_loss: 0.9776, test_f1: 0.4909
 epoch: 40, train_loss: 0.9980, test_loss: 0.9764, test_f1: 0.4868
 epoch: 41, train_loss: 0.9930, test_loss: 0.9765, test_f1: 0.4758
 epoch: 42, train_loss: 0.9862, test_loss: 0.9722, test_f1: 0.4858
 epoch: 43, train_loss: 0.9901, test_loss: 0.9711, test_f1: 0.4873
 epoch: 44, train_loss: 0.9866, test_loss: 0.9703, test_f1: 0.4891
 epoch: 45, train_loss: 0.9740, test_loss: 0.9681, test_f1: 0.4952
 epoch: 46, train_loss: 0.9875, test_loss: 0.9698, test_f1: 0.5058
 epoch: 47, train_loss: 0.9712, test_loss: 0.9697, test_f1: 0.5066
 epoch: 48, train_loss: 0.9716, test_loss: 0.9686, test_f1: 0.4977
 epoch: 49, train_loss: 0.9717, test_loss: 0.9668, test_f1: 0.4906
 epoch: 50, train_loss: 0.9586, test_loss: 0.9674, test_f1: 0.5006
 epoch: 51, train_loss: 0.9649, test_loss: 0.9671, test_f1: 0.4955
 epoch: 52, train_loss: 0.9625, test_loss: 0.9649, test_f1: 0.4946
 epoch: 53, train_loss: 0.9579, test_loss: 0.9618, test_f1: 0.4999
 epoch: 54, train_loss: 0.9572, test_loss: 0.9626, test_f1: 0.4979
 epoch: 55, train_loss: 0.9550, test_loss: 0.9625, test_f1: 0.5050
 epoch: 56, train_loss: 0.9563, test_loss: 0.9620, test_f1: 0.5027
 epoch: 57, train_loss: 0.9497, test_loss: 0.9589, test_f1: 0.5035
 epoch: 58, train_loss: 0.9498, test_loss: 0.9574, test_f1: 0.5048
 epoch: 59, train_loss: 0.9429, test_loss: 0.9598, test_f1: 0.4999
 epoch: 60, train_loss: 0.9438, test_loss: 0.9571, test_f1: 0.4973
 epoch: 61, train_loss: 0.9439, test_loss: 0.9569, test_f1: 0.5017
 epoch: 62, train_loss: 0.9523, test_loss: 0.9571, test_f1: 0.5010
 epoch: 63, train_loss: 0.9480, test_loss: 0.9565, test_f1: 0.5099
 epoch: 64, train_loss: 0.9432, test_loss: 0.9568, test_f1: 0.5011
 epoch: 65, train_loss: 0.9433, test_loss: 0.9574, test_f1: 0.5037
 epoch: 66, train_loss: 0.9346, test_loss: 0.9579, test_f1: 0.4936
 epoch: 67, train_loss: 0.9424, test_loss: 0.9542, test_f1: 0.5040
 epoch: 68, train_loss: 0.9353, test_loss: 0.9530, test_f1: 0.5102
 epoch: 69, train_loss: 0.9364, test_loss: 0.9513, test_f1: 0.5035
 epoch: 70, train_loss: 0.9373, test_loss: 0.9540, test_f1: 0.4983
 epoch: 71, train_loss: 0.9327, test_loss: 0.9548, test_f1: 0.4956
 epoch: 72, train_loss: 0.9307, test_loss: 0.9549, test_f1: 0.4987
 epoch: 73, train_loss: 0.9355, test_loss: 0.9554, test_f1: 0.4958
 epoch: 74, train_loss: 0.9284, test_loss: 0.9529, test_f1: 0.4949
 epoch: 75, train_loss: 0.9318, test_loss: 0.9530, test_f1: 0.5011
 epoch: 76, train_loss: 0.9310, test_loss: 0.9533, test_f1: 0.4985
 epoch: 77, train_loss: 0.9219, test_loss: 0.9518, test_f1: 0.5014
 epoch: 78, train_loss: 0.9349, test_loss: 0.9491, test_f1: 0.5017
 epoch: 79, train_loss: 0.9214, test_loss: 0.9500, test_f1: 0.5001
 epoch: 80, train_loss: 0.9215, test_loss: 0.9503, test_f1: 0.4992
 epoch: 81, train_loss: 0.9164, test_loss: 0.9498, test_f1: 0.5070
 epoch: 82, train_loss: 0.9224, test_loss: 0.9473, test_f1: 0.4949
 epoch: 83, train_loss: 0.9207, test_loss: 0.9484, test_f1: 0.4905
 epoch: 84, train_loss: 0.9212, test_loss: 0.9454, test_f1: 0.4940
 epoch: 85, train_loss: 0.9213, test_loss: 0.9498, test_f1: 0.4962
 epoch: 86, train_loss: 0.9194, test_loss: 0.9454, test_f1: 0.4955
 epoch: 87, train_loss: 0.9217, test_loss: 0.9453, test_f1: 0.5092
 epoch: 88, train_loss: 0.9162, test_loss: 0.9459, test_f1: 0.5045
 epoch: 89, train_loss: 0.9088, test_loss: 0.9451, test_f1: 0.4910
 epoch: 90, train_loss: 0.9125, test_loss: 0.9482, test_f1: 0.5162
 epoch: 91, train_loss: 0.9111, test_loss: 0.9458, test_f1: 0.5004
 epoch: 92, train_loss: 0.9028, test_loss: 0.9440, test_f1: 0.4996
 epoch: 93, train_loss: 0.9121, test_loss: 0.9453, test_f1: 0.5015
 epoch: 94, train_loss: 0.9046, test_loss: 0.9444, test_f1: 0.5122
 epoch: 95, train_loss: 0.9034, test_loss: 0.9454, test_f1: 0.5125
 epoch: 96, train_loss: 0.9205, test_loss: 0.9440, test_f1: 0.4981
 epoch: 97, train_loss: 0.9044, test_loss: 0.9441, test_f1: 0.5143
 epoch: 98, train_loss: 0.9058, test_loss: 0.9453, test_f1: 0.5158
 epoch: 99, train_loss: 0.9048, test_loss: 0.9436, test_f1: 0.5037

Training completed in 398.11 seconds
Best F1: 0.5341 at epoch 79
Mean F1 across iterations: 0.5115  0.0107
========================FINAL RESULTS================================
FEGIN weighted F1: 0.5341  0.0107
python main.py --data ltspice_examples --representation component_net --model FEGIN --layers 4 --hiddens 32 --batch_size 256 --lr 0.0001 --emb_size 512 --epochs 100 --save_appendix component_net_L4_H32_BS256_LR0.0001_E512 --no_val
-----



STDERR:
  File "main.py", line 370, in <module>
    main()
  File "main.py", line 254, in main
    dataset = dataset_class(
  File "/home/philip/projects/ltspice_examples_code_repo/Circuit-Completion-Using-GNNs/component_classification_with_link_prediction_head/evaluation/FEGIN/kernel/circuit_datasets.py", line 15, in __init__
    self.data, self.slices = torch.load(self.processed_paths[0])
  File "/home/philip/.local/lib/python3.8/site-packages/torch/serialization.py", line 1040, in load
    warnings.warn(
  File "/usr/lib/python3.8/warnings.py", line 109, in _showwarnmsg
    sw(msg.message, msg.category, msg.filename, msg.lineno,
  File "main.py", line 47, in warn_with_traceback
    traceback.print_stack(file=log)
/home/philip/projects/ltspice_examples_code_repo/Circuit-Completion-Using-GNNs/component_classification_with_link_prediction_head/evaluation/FEGIN/kernel/circuit_datasets.py:15: FutureWarning: You are using `torch.load` with `weights_only=False` (the current default value), which uses the default pickle module implicitly. It is possible to construct malicious pickle data which will execute arbitrary code during unpickling (See https://github.com/pytorch/pytorch/blob/main/SECURITY.md#untrusted-models for more details). In a future release, the default value for `weights_only` will be flipped to `True`. This limits the functions that could be executed during unpickling. Arbitrary objects will no longer be allowed to be loaded via this mode unless they are explicitly allowlisted by the user via `torch.serialization.add_safe_globals`. We recommend you start setting `weights_only=True` for any use case where you don't have full control of the loaded file. Please open an issue on GitHub for any issues related to this experimental feature.
  self.data, self.slices = torch.load(self.processed_paths[0])
