STDOUT:
Results will be saved in /home/philip/projects/ltspice_examples_code_repo/Circuit-Completion-Using-GNNs/component_classification_with_link_prediction_head/evaluation/FEGIN/results/model_FEGIN_dataset_ltspice_demos
Command line input: python main.py --data ltspice_demos --representation component_net --model FEGIN --layers 3 --hiddens 16 --batch_size 256 --lr 0.01 --emb_size 250 --epochs 100 --save_appendix component_net_L3_H16_BS256_LR0.01_E250 --no_val
 is saved.
-----
ltspice_demos - FEGIN
Using 3 layers, 16 hidden units, h = 2
Loading component_net representation dataset
ENTERED
Training FEGIN on component_net representation
Train: 1565, Test: 383
##################ITERATION #0 ****************************************
 epoch: 0, train_loss: 1.3172, test_loss: 1.3115, test_f1: 0.1365
 epoch: 1, train_loss: 1.1944, test_loss: 1.3415, test_f1: 0.1365
 epoch: 2, train_loss: 1.1629, test_loss: 1.3683, test_f1: 0.2415
 epoch: 3, train_loss: 1.1506, test_loss: 1.3513, test_f1: 0.3285
 epoch: 4, train_loss: 1.1236, test_loss: 1.3923, test_f1: 0.2890
 epoch: 5, train_loss: 1.1163, test_loss: 1.2717, test_f1: 0.3193
 epoch: 6, train_loss: 1.1067, test_loss: 1.2724, test_f1: 0.3033
 epoch: 7, train_loss: 1.0819, test_loss: 1.2229, test_f1: 0.4274
 epoch: 8, train_loss: 1.0608, test_loss: 1.2253, test_f1: 0.4022
 epoch: 9, train_loss: 1.0471, test_loss: 1.1630, test_f1: 0.4544
 epoch: 10, train_loss: 1.0402, test_loss: 1.3066, test_f1: 0.4232
 epoch: 11, train_loss: 1.0172, test_loss: 1.2375, test_f1: 0.4174
 epoch: 12, train_loss: 0.9925, test_loss: 1.3386, test_f1: 0.4191
 epoch: 13, train_loss: 0.9758, test_loss: 1.1457, test_f1: 0.4427
 epoch: 14, train_loss: 0.9784, test_loss: 1.1591, test_f1: 0.4787
 epoch: 15, train_loss: 0.9669, test_loss: 1.2937, test_f1: 0.4547
 epoch: 16, train_loss: 0.9650, test_loss: 1.1481, test_f1: 0.4373
 epoch: 17, train_loss: 0.9452, test_loss: 1.0953, test_f1: 0.5229
 epoch: 18, train_loss: 0.9384, test_loss: 1.2635, test_f1: 0.4240
 epoch: 19, train_loss: 0.9456, test_loss: 1.0455, test_f1: 0.5098
 epoch: 20, train_loss: 0.9315, test_loss: 1.0658, test_f1: 0.5101
 epoch: 21, train_loss: 0.9148, test_loss: 1.2508, test_f1: 0.5051
 epoch: 22, train_loss: 0.8999, test_loss: 1.1578, test_f1: 0.5288
 epoch: 23, train_loss: 0.9039, test_loss: 1.1066, test_f1: 0.4441
 epoch: 24, train_loss: 0.9249, test_loss: 1.1165, test_f1: 0.5069
 epoch: 25, train_loss: 0.9208, test_loss: 1.2200, test_f1: 0.5382
 epoch: 26, train_loss: 0.9044, test_loss: 1.1355, test_f1: 0.4743
 epoch: 27, train_loss: 0.8929, test_loss: 1.0835, test_f1: 0.5134
 epoch: 28, train_loss: 0.8990, test_loss: 1.0531, test_f1: 0.5328
 epoch: 29, train_loss: 0.8836, test_loss: 1.0445, test_f1: 0.5232
 epoch: 30, train_loss: 0.8819, test_loss: 1.1108, test_f1: 0.5014
 epoch: 31, train_loss: 0.8968, test_loss: 1.1272, test_f1: 0.5034
 epoch: 32, train_loss: 0.9266, test_loss: 1.0583, test_f1: 0.5343
 epoch: 33, train_loss: 0.8983, test_loss: 1.0511, test_f1: 0.4745
 epoch: 34, train_loss: 0.9149, test_loss: 1.1291, test_f1: 0.5035
 epoch: 35, train_loss: 0.8871, test_loss: 1.0502, test_f1: 0.5346
 epoch: 36, train_loss: 0.8949, test_loss: 1.0875, test_f1: 0.5397
 epoch: 37, train_loss: 0.8777, test_loss: 1.1049, test_f1: 0.5023
 epoch: 38, train_loss: 0.8889, test_loss: 1.0730, test_f1: 0.5288
 epoch: 39, train_loss: 0.8884, test_loss: 1.4056, test_f1: 0.5168
 epoch: 40, train_loss: 0.8606, test_loss: 1.1661, test_f1: 0.5143
 epoch: 41, train_loss: 0.8650, test_loss: 1.0723, test_f1: 0.5321
 epoch: 42, train_loss: 0.8694, test_loss: 1.1466, test_f1: 0.5302
 epoch: 43, train_loss: 0.8641, test_loss: 1.0680, test_f1: 0.5560
 epoch: 44, train_loss: 0.8594, test_loss: 1.0585, test_f1: 0.5732
 epoch: 45, train_loss: 0.8630, test_loss: 1.1259, test_f1: 0.5370
 epoch: 46, train_loss: 0.8627, test_loss: 1.0986, test_f1: 0.5282
 epoch: 47, train_loss: 0.8551, test_loss: 1.1266, test_f1: 0.5295
 epoch: 48, train_loss: 0.8550, test_loss: 1.0095, test_f1: 0.5344
 epoch: 49, train_loss: 0.8483, test_loss: 1.0097, test_f1: 0.5511
 epoch: 50, train_loss: 0.8317, test_loss: 1.1978, test_f1: 0.5554
 epoch: 51, train_loss: 0.8288, test_loss: 1.2544, test_f1: 0.5383
 epoch: 52, train_loss: 0.8303, test_loss: 1.1946, test_f1: 0.5565
 epoch: 53, train_loss: 0.8200, test_loss: 1.0656, test_f1: 0.5577
 epoch: 54, train_loss: 0.8285, test_loss: 1.1233, test_f1: 0.5696
 epoch: 55, train_loss: 0.8221, test_loss: 1.1556, test_f1: 0.5727
 epoch: 56, train_loss: 0.8349, test_loss: 1.4638, test_f1: 0.5370
 epoch: 57, train_loss: 0.8716, test_loss: 1.5060, test_f1: 0.5117
 epoch: 58, train_loss: 0.8543, test_loss: 1.2279, test_f1: 0.4836
 epoch: 59, train_loss: 0.8561, test_loss: 1.1598, test_f1: 0.5127
 epoch: 60, train_loss: 0.8368, test_loss: 1.1153, test_f1: 0.5278
 epoch: 61, train_loss: 0.8392, test_loss: 1.1148, test_f1: 0.5240
 epoch: 62, train_loss: 0.8278, test_loss: 1.1354, test_f1: 0.5477
 epoch: 63, train_loss: 0.8301, test_loss: 1.0865, test_f1: 0.5503
 epoch: 64, train_loss: 0.8271, test_loss: 1.0760, test_f1: 0.5536
 epoch: 65, train_loss: 0.8129, test_loss: 1.0833, test_f1: 0.5271
 epoch: 66, train_loss: 0.8036, test_loss: 1.0487, test_f1: 0.5591
 epoch: 67, train_loss: 0.8026, test_loss: 1.0706, test_f1: 0.5548
 epoch: 68, train_loss: 0.7949, test_loss: 1.0573, test_f1: 0.5704
 epoch: 69, train_loss: 0.8033, test_loss: 1.1173, test_f1: 0.5644
 epoch: 70, train_loss: 0.7994, test_loss: 1.0950, test_f1: 0.5624
 epoch: 71, train_loss: 0.7971, test_loss: 1.1029, test_f1: 0.5557
 epoch: 72, train_loss: 0.7947, test_loss: 1.1414, test_f1: 0.5692
 epoch: 73, train_loss: 0.7832, test_loss: 1.1133, test_f1: 0.5673
 epoch: 74, train_loss: 0.7817, test_loss: 1.0480, test_f1: 0.5676
 epoch: 75, train_loss: 0.8067, test_loss: 1.0774, test_f1: 0.5092
 epoch: 76, train_loss: 0.7954, test_loss: 1.2270, test_f1: 0.5478
 epoch: 77, train_loss: 0.7957, test_loss: 1.3029, test_f1: 0.5604
 epoch: 78, train_loss: 0.8078, test_loss: 1.1970, test_f1: 0.5535
 epoch: 79, train_loss: 0.7974, test_loss: 1.2299, test_f1: 0.5501
 epoch: 80, train_loss: 0.8057, test_loss: 1.1162, test_f1: 0.5859
 epoch: 81, train_loss: 0.7893, test_loss: 1.0892, test_f1: 0.5379
 epoch: 82, train_loss: 0.7869, test_loss: 1.1076, test_f1: 0.5536
 epoch: 83, train_loss: 0.7907, test_loss: 1.1788, test_f1: 0.5223
 epoch: 84, train_loss: 0.7747, test_loss: 1.3473, test_f1: 0.5532
 epoch: 85, train_loss: 0.7762, test_loss: 1.2921, test_f1: 0.5745
 epoch: 86, train_loss: 0.7708, test_loss: 1.3238, test_f1: 0.5458
 epoch: 87, train_loss: 0.7835, test_loss: 1.3431, test_f1: 0.5530
 epoch: 88, train_loss: 0.7785, test_loss: 1.3801, test_f1: 0.5793
 epoch: 89, train_loss: 0.7995, test_loss: 1.3633, test_f1: 0.5735
 epoch: 90, train_loss: 0.7978, test_loss: 1.4447, test_f1: 0.5185
 epoch: 91, train_loss: 0.7780, test_loss: 1.2786, test_f1: 0.5535
 epoch: 92, train_loss: 0.7683, test_loss: 1.1076, test_f1: 0.5407
 epoch: 93, train_loss: 0.7795, test_loss: 1.0710, test_f1: 0.5296
 epoch: 94, train_loss: 0.7481, test_loss: 1.2351, test_f1: 0.5123
 epoch: 95, train_loss: 0.7570, test_loss: 1.1604, test_f1: 0.5717
 epoch: 96, train_loss: 0.7764, test_loss: 1.3191, test_f1: 0.5435
 epoch: 97, train_loss: 0.7719, test_loss: 1.3326, test_f1: 0.5375
 epoch: 98, train_loss: 0.7629, test_loss: 1.2792, test_f1: 0.5558
 epoch: 99, train_loss: 0.7436, test_loss: 1.2986, test_f1: 0.5775
##################ITERATION #1 ****************************************
 epoch: 0, train_loss: 1.2940, test_loss: 1.3109, test_f1: 0.2281
 epoch: 1, train_loss: 1.1716, test_loss: 1.3573, test_f1: 0.2281
 epoch: 2, train_loss: 1.1263, test_loss: 1.4271, test_f1: 0.2281
 epoch: 3, train_loss: 1.0862, test_loss: 1.4276, test_f1: 0.2992
 epoch: 4, train_loss: 1.0569, test_loss: 1.4260, test_f1: 0.2888
 epoch: 5, train_loss: 1.0483, test_loss: 1.2379, test_f1: 0.3562
 epoch: 6, train_loss: 1.0319, test_loss: 1.1980, test_f1: 0.4169
 epoch: 7, train_loss: 1.0305, test_loss: 1.0851, test_f1: 0.5028
 epoch: 8, train_loss: 0.9940, test_loss: 1.1443, test_f1: 0.3579
 epoch: 9, train_loss: 0.9892, test_loss: 1.0607, test_f1: 0.4747
 epoch: 10, train_loss: 0.9711, test_loss: 1.0772, test_f1: 0.4556
 epoch: 11, train_loss: 0.9712, test_loss: 1.1754, test_f1: 0.3747
 epoch: 12, train_loss: 0.9432, test_loss: 1.0987, test_f1: 0.5467
 epoch: 13, train_loss: 0.9411, test_loss: 1.0629, test_f1: 0.5543
 epoch: 14, train_loss: 0.9160, test_loss: 1.1851, test_f1: 0.3748
 epoch: 15, train_loss: 0.9225, test_loss: 1.2159, test_f1: 0.3782
 epoch: 16, train_loss: 0.9456, test_loss: 1.2127, test_f1: 0.4115
 epoch: 17, train_loss: 0.9351, test_loss: 1.1845, test_f1: 0.3543
 epoch: 18, train_loss: 0.9118, test_loss: 1.0819, test_f1: 0.5198
 epoch: 19, train_loss: 0.9060, test_loss: 1.1086, test_f1: 0.4639
 epoch: 20, train_loss: 0.9017, test_loss: 1.1209, test_f1: 0.4056
 epoch: 21, train_loss: 0.8856, test_loss: 1.1496, test_f1: 0.5349
 epoch: 22, train_loss: 0.9048, test_loss: 1.1274, test_f1: 0.4601
 epoch: 23, train_loss: 0.8938, test_loss: 1.0789, test_f1: 0.4055
 epoch: 24, train_loss: 0.9117, test_loss: 1.1050, test_f1: 0.4250
 epoch: 25, train_loss: 0.9127, test_loss: 1.2748, test_f1: 0.4926
 epoch: 26, train_loss: 0.9107, test_loss: 1.2387, test_f1: 0.3589
 epoch: 27, train_loss: 0.8880, test_loss: 1.1100, test_f1: 0.4238
 epoch: 28, train_loss: 0.8877, test_loss: 1.1776, test_f1: 0.5427
 epoch: 29, train_loss: 0.8855, test_loss: 1.2237, test_f1: 0.4961
 epoch: 30, train_loss: 0.8890, test_loss: 1.2547, test_f1: 0.4191
 epoch: 31, train_loss: 0.8694, test_loss: 1.1265, test_f1: 0.5662
 epoch: 32, train_loss: 0.8717, test_loss: 1.1366, test_f1: 0.5552
 epoch: 33, train_loss: 0.8596, test_loss: 1.0749, test_f1: 0.5216
 epoch: 34, train_loss: 0.8562, test_loss: 1.0607, test_f1: 0.5830
 epoch: 35, train_loss: 0.8586, test_loss: 1.0976, test_f1: 0.4230
 epoch: 36, train_loss: 0.8536, test_loss: 1.0717, test_f1: 0.4300
 epoch: 37, train_loss: 0.8641, test_loss: 1.0768, test_f1: 0.4816
 epoch: 38, train_loss: 0.8461, test_loss: 1.1430, test_f1: 0.4462
 epoch: 39, train_loss: 0.8744, test_loss: 1.3092, test_f1: 0.5080
 epoch: 40, train_loss: 0.8794, test_loss: 1.2299, test_f1: 0.4884
 epoch: 41, train_loss: 0.8982, test_loss: 1.9151, test_f1: 0.3975
 epoch: 42, train_loss: 0.8927, test_loss: 1.0777, test_f1: 0.5257
 epoch: 43, train_loss: 0.8803, test_loss: 1.0412, test_f1: 0.4939
 epoch: 44, train_loss: 0.8584, test_loss: 1.0430, test_f1: 0.4975
 epoch: 45, train_loss: 0.8557, test_loss: 1.1976, test_f1: 0.5127
 epoch: 46, train_loss: 0.8548, test_loss: 1.1425, test_f1: 0.4060
 epoch: 47, train_loss: 0.8313, test_loss: 1.1325, test_f1: 0.5293
 epoch: 48, train_loss: 0.8278, test_loss: 1.1233, test_f1: 0.5545
 epoch: 49, train_loss: 0.8218, test_loss: 1.1781, test_f1: 0.5505
 epoch: 50, train_loss: 0.8025, test_loss: 1.2318, test_f1: 0.4727
 epoch: 51, train_loss: 0.8186, test_loss: 1.1184, test_f1: 0.5454
 epoch: 52, train_loss: 0.8034, test_loss: 1.1460, test_f1: 0.5653
 epoch: 53, train_loss: 0.7990, test_loss: 1.2177, test_f1: 0.5114
 epoch: 54, train_loss: 0.7898, test_loss: 1.1896, test_f1: 0.5200
 epoch: 55, train_loss: 0.7963, test_loss: 1.1547, test_f1: 0.5589
 epoch: 56, train_loss: 0.8108, test_loss: 1.1781, test_f1: 0.5631
 epoch: 57, train_loss: 0.7929, test_loss: 1.2072, test_f1: 0.5347
 epoch: 58, train_loss: 0.7845, test_loss: 1.1412, test_f1: 0.4599
 epoch: 59, train_loss: 0.8080, test_loss: 1.2332, test_f1: 0.5296
 epoch: 60, train_loss: 0.8153, test_loss: 1.2378, test_f1: 0.5694
 epoch: 61, train_loss: 0.7872, test_loss: 1.3081, test_f1: 0.5478
 epoch: 62, train_loss: 0.7839, test_loss: 1.3030, test_f1: 0.5466
 epoch: 63, train_loss: 0.8286, test_loss: 1.1519, test_f1: 0.5476
 epoch: 64, train_loss: 0.8157, test_loss: 1.1993, test_f1: 0.5563
 epoch: 65, train_loss: 0.8161, test_loss: 1.2457, test_f1: 0.5661
 epoch: 66, train_loss: 0.7838, test_loss: 1.2133, test_f1: 0.4393
 epoch: 67, train_loss: 0.7864, test_loss: 1.1643, test_f1: 0.5380
 epoch: 68, train_loss: 0.7754, test_loss: 1.1906, test_f1: 0.5666
 epoch: 69, train_loss: 0.7745, test_loss: 1.2510, test_f1: 0.5286
 epoch: 70, train_loss: 0.7728, test_loss: 1.2390, test_f1: 0.5761
 epoch: 71, train_loss: 0.7598, test_loss: 1.2996, test_f1: 0.5707
 epoch: 72, train_loss: 0.7714, test_loss: 1.3859, test_f1: 0.4896
 epoch: 73, train_loss: 0.7498, test_loss: 1.2283, test_f1: 0.5482
 epoch: 74, train_loss: 0.7565, test_loss: 1.2167, test_f1: 0.5764
 epoch: 75, train_loss: 0.7475, test_loss: 1.2343, test_f1: 0.5852
 epoch: 76, train_loss: 0.7693, test_loss: 1.2782, test_f1: 0.4997
 epoch: 77, train_loss: 0.7538, test_loss: 1.3857, test_f1: 0.4195
 epoch: 78, train_loss: 0.7673, test_loss: 1.1563, test_f1: 0.5608
 epoch: 79, train_loss: 0.7822, test_loss: 1.3593, test_f1: 0.5614
 epoch: 80, train_loss: 0.7743, test_loss: 1.3554, test_f1: 0.5522
 epoch: 81, train_loss: 0.7791, test_loss: 1.2797, test_f1: 0.5904
 epoch: 82, train_loss: 0.7550, test_loss: 1.2177, test_f1: 0.5546
 epoch: 83, train_loss: 0.7544, test_loss: 1.1903, test_f1: 0.4851
 epoch: 84, train_loss: 0.7407, test_loss: 1.1818, test_f1: 0.5546
 epoch: 85, train_loss: 0.7486, test_loss: 1.2487, test_f1: 0.5192
 epoch: 86, train_loss: 0.7513, test_loss: 1.2386, test_f1: 0.5833
 epoch: 87, train_loss: 0.7356, test_loss: 1.3361, test_f1: 0.5572
 epoch: 88, train_loss: 0.7235, test_loss: 1.2600, test_f1: 0.5518
 epoch: 89, train_loss: 0.7298, test_loss: 1.3561, test_f1: 0.5169
 epoch: 90, train_loss: 0.7589, test_loss: 1.6378, test_f1: 0.4439
 epoch: 91, train_loss: 0.7288, test_loss: 1.7029, test_f1: 0.4452
 epoch: 92, train_loss: 0.7612, test_loss: 1.2523, test_f1: 0.5839
 epoch: 93, train_loss: 0.7407, test_loss: 1.3139, test_f1: 0.5569
 epoch: 94, train_loss: 0.7447, test_loss: 1.4040, test_f1: 0.5498
 epoch: 95, train_loss: 0.7449, test_loss: 1.5283, test_f1: 0.5001
 epoch: 96, train_loss: 0.7168, test_loss: 1.3452, test_f1: 0.5499
 epoch: 97, train_loss: 0.7233, test_loss: 1.2337, test_f1: 0.5824
 epoch: 98, train_loss: 0.7070, test_loss: 1.4164, test_f1: 0.5539
 epoch: 99, train_loss: 0.7034, test_loss: 1.2917, test_f1: 0.5168
##################ITERATION #2 ****************************************
 epoch: 0, train_loss: 1.2275, test_loss: 1.3348, test_f1: 0.2281
 epoch: 1, train_loss: 1.1349, test_loss: 1.2831, test_f1: 0.2281
 epoch: 2, train_loss: 1.0887, test_loss: 1.2490, test_f1: 0.2281
 epoch: 3, train_loss: 1.0561, test_loss: 1.2126, test_f1: 0.3262
 epoch: 4, train_loss: 1.0362, test_loss: 1.2066, test_f1: 0.3682
 epoch: 5, train_loss: 1.0117, test_loss: 1.1698, test_f1: 0.3202
 epoch: 6, train_loss: 0.9943, test_loss: 1.1610, test_f1: 0.3356
 epoch: 7, train_loss: 0.9758, test_loss: 1.1351, test_f1: 0.3398
 epoch: 8, train_loss: 0.9969, test_loss: 1.1771, test_f1: 0.4202
 epoch: 9, train_loss: 0.9739, test_loss: 1.1107, test_f1: 0.4639
 epoch: 10, train_loss: 0.9582, test_loss: 1.1477, test_f1: 0.3990
 epoch: 11, train_loss: 0.9449, test_loss: 1.1698, test_f1: 0.4308
 epoch: 12, train_loss: 0.9317, test_loss: 1.1253, test_f1: 0.4395
 epoch: 13, train_loss: 0.9411, test_loss: 1.1182, test_f1: 0.4865
 epoch: 14, train_loss: 0.9122, test_loss: 1.1234, test_f1: 0.5062
 epoch: 15, train_loss: 0.9313, test_loss: 1.0435, test_f1: 0.5474
 epoch: 16, train_loss: 0.9163, test_loss: 1.0771, test_f1: 0.5036
 epoch: 17, train_loss: 0.9324, test_loss: 1.0799, test_f1: 0.4940
 epoch: 18, train_loss: 0.9213, test_loss: 1.1791, test_f1: 0.4808
 epoch: 19, train_loss: 0.8985, test_loss: 1.1306, test_f1: 0.4798
 epoch: 20, train_loss: 0.8881, test_loss: 1.0854, test_f1: 0.5028
 epoch: 21, train_loss: 0.8902, test_loss: 1.2034, test_f1: 0.4919
 epoch: 22, train_loss: 0.8868, test_loss: 1.1324, test_f1: 0.4885
 epoch: 23, train_loss: 0.8974, test_loss: 1.1662, test_f1: 0.4933
 epoch: 24, train_loss: 0.8841, test_loss: 1.1931, test_f1: 0.4920
 epoch: 25, train_loss: 0.8820, test_loss: 1.0924, test_f1: 0.4936
 epoch: 26, train_loss: 0.8900, test_loss: 1.0894, test_f1: 0.4988
 epoch: 27, train_loss: 0.8679, test_loss: 1.0615, test_f1: 0.5294
 epoch: 28, train_loss: 0.8710, test_loss: 1.1080, test_f1: 0.5368
 epoch: 29, train_loss: 0.8610, test_loss: 1.3137, test_f1: 0.4972
 epoch: 30, train_loss: 0.8628, test_loss: 1.2098, test_f1: 0.5220
 epoch: 31, train_loss: 0.8540, test_loss: 1.1357, test_f1: 0.5346
 epoch: 32, train_loss: 0.8411, test_loss: 1.1595, test_f1: 0.5470
 epoch: 33, train_loss: 0.8304, test_loss: 1.1527, test_f1: 0.5282
 epoch: 34, train_loss: 0.8492, test_loss: 1.2506, test_f1: 0.4886
 epoch: 35, train_loss: 0.8592, test_loss: 1.3324, test_f1: 0.4820
 epoch: 36, train_loss: 0.8947, test_loss: 1.8143, test_f1: 0.2772
 epoch: 37, train_loss: 0.8876, test_loss: 1.6483, test_f1: 0.2494
 epoch: 38, train_loss: 0.8966, test_loss: 1.2844, test_f1: 0.4278
 epoch: 39, train_loss: 0.8752, test_loss: 1.1788, test_f1: 0.5210
 epoch: 40, train_loss: 0.8677, test_loss: 1.1745, test_f1: 0.5085
 epoch: 41, train_loss: 0.8587, test_loss: 1.1321, test_f1: 0.4941
 epoch: 42, train_loss: 0.8652, test_loss: 1.1255, test_f1: 0.5434
 epoch: 43, train_loss: 0.8457, test_loss: 1.0750, test_f1: 0.5454
 epoch: 44, train_loss: 0.8526, test_loss: 1.1325, test_f1: 0.5243
 epoch: 45, train_loss: 0.8571, test_loss: 1.2034, test_f1: 0.5189
 epoch: 46, train_loss: 0.8375, test_loss: 1.2064, test_f1: 0.5104
 epoch: 47, train_loss: 0.8331, test_loss: 1.1767, test_f1: 0.5028
 epoch: 48, train_loss: 0.8290, test_loss: 1.0551, test_f1: 0.5278
 epoch: 49, train_loss: 0.8161, test_loss: 1.1013, test_f1: 0.5320
 epoch: 50, train_loss: 0.8248, test_loss: 1.0927, test_f1: 0.5555
 epoch: 51, train_loss: 0.8138, test_loss: 1.1204, test_f1: 0.5664
 epoch: 52, train_loss: 0.8101, test_loss: 1.0948, test_f1: 0.5892
 epoch: 53, train_loss: 0.7914, test_loss: 1.0868, test_f1: 0.5623
 epoch: 54, train_loss: 0.8024, test_loss: 1.0961, test_f1: 0.5556
 epoch: 55, train_loss: 0.7946, test_loss: 1.1016, test_f1: 0.5616
 epoch: 56, train_loss: 0.7981, test_loss: 1.1004, test_f1: 0.5588
 epoch: 57, train_loss: 0.8074, test_loss: 1.0921, test_f1: 0.5386
 epoch: 58, train_loss: 0.8190, test_loss: 1.0849, test_f1: 0.5533
 epoch: 59, train_loss: 0.7967, test_loss: 1.0431, test_f1: 0.5546
 epoch: 60, train_loss: 0.7827, test_loss: 1.1646, test_f1: 0.5120
 epoch: 61, train_loss: 0.7807, test_loss: 1.1364, test_f1: 0.5562
 epoch: 62, train_loss: 0.7615, test_loss: 1.0674, test_f1: 0.5558
 epoch: 63, train_loss: 0.7448, test_loss: 1.0702, test_f1: 0.5643
 epoch: 64, train_loss: 0.7428, test_loss: 1.0967, test_f1: 0.5922
 epoch: 65, train_loss: 0.7516, test_loss: 1.0601, test_f1: 0.5678
 epoch: 66, train_loss: 0.7681, test_loss: 1.0569, test_f1: 0.5636
 epoch: 67, train_loss: 0.7534, test_loss: 1.1187, test_f1: 0.5530
 epoch: 68, train_loss: 0.7531, test_loss: 1.1654, test_f1: 0.5549
 epoch: 69, train_loss: 0.7558, test_loss: 1.2720, test_f1: 0.5586
 epoch: 70, train_loss: 0.7491, test_loss: 1.1008, test_f1: 0.5867
 epoch: 71, train_loss: 0.7317, test_loss: 1.1567, test_f1: 0.5189
 epoch: 72, train_loss: 0.7345, test_loss: 1.1912, test_f1: 0.5388
 epoch: 73, train_loss: 0.7404, test_loss: 1.1421, test_f1: 0.5801
 epoch: 74, train_loss: 0.7165, test_loss: 1.1460, test_f1: 0.5386
 epoch: 75, train_loss: 0.7275, test_loss: 1.0809, test_f1: 0.5743
 epoch: 76, train_loss: 0.7293, test_loss: 1.0904, test_f1: 0.5850
 epoch: 77, train_loss: 0.7052, test_loss: 1.1313, test_f1: 0.5556
 epoch: 78, train_loss: 0.7457, test_loss: 1.0525, test_f1: 0.5632
 epoch: 79, train_loss: 0.7259, test_loss: 1.0206, test_f1: 0.6005
 epoch: 80, train_loss: 0.7068, test_loss: 1.0170, test_f1: 0.5836
 epoch: 81, train_loss: 0.7018, test_loss: 1.0470, test_f1: 0.5748
 epoch: 82, train_loss: 0.7016, test_loss: 1.1121, test_f1: 0.5789
 epoch: 83, train_loss: 0.7124, test_loss: 1.1565, test_f1: 0.5526
 epoch: 84, train_loss: 0.7031, test_loss: 1.1105, test_f1: 0.5840
 epoch: 85, train_loss: 0.7119, test_loss: 1.0359, test_f1: 0.6069
 epoch: 86, train_loss: 0.6974, test_loss: 1.0595, test_f1: 0.6449
 epoch: 87, train_loss: 0.7046, test_loss: 1.1009, test_f1: 0.5990
 epoch: 88, train_loss: 0.6884, test_loss: 1.2382, test_f1: 0.5533
 epoch: 89, train_loss: 0.6886, test_loss: 1.2104, test_f1: 0.5504
 epoch: 90, train_loss: 0.6844, test_loss: 1.1963, test_f1: 0.5819
 epoch: 91, train_loss: 0.6732, test_loss: 1.1164, test_f1: 0.6057
 epoch: 92, train_loss: 0.6827, test_loss: 1.1421, test_f1: 0.5628
 epoch: 93, train_loss: 0.6637, test_loss: 1.1571, test_f1: 0.5998
 epoch: 94, train_loss: 0.6898, test_loss: 1.1324, test_f1: 0.5905
 epoch: 95, train_loss: 0.6719, test_loss: 1.2393, test_f1: 0.6072
 epoch: 96, train_loss: 0.6690, test_loss: 1.2311, test_f1: 0.5990
 epoch: 97, train_loss: 0.6587, test_loss: 1.1702, test_f1: 0.5948
 epoch: 98, train_loss: 0.7098, test_loss: 1.3116, test_f1: 0.5428
 epoch: 99, train_loss: 0.7011, test_loss: 1.1609, test_f1: 0.6220
##################ITERATION #3 ****************************************
 epoch: 0, train_loss: 1.2730, test_loss: 1.5200, test_f1: 0.2281
 epoch: 1, train_loss: 1.1581, test_loss: 1.4073, test_f1: 0.3160
 epoch: 2, train_loss: 1.0892, test_loss: 1.3299, test_f1: 0.3376
 epoch: 3, train_loss: 1.0519, test_loss: 1.2938, test_f1: 0.2491
 epoch: 4, train_loss: 1.0274, test_loss: 1.2471, test_f1: 0.2718
 epoch: 5, train_loss: 1.0059, test_loss: 1.1741, test_f1: 0.3152
 epoch: 6, train_loss: 1.0004, test_loss: 1.1809, test_f1: 0.3755
 epoch: 7, train_loss: 0.9845, test_loss: 1.1701, test_f1: 0.3715
 epoch: 8, train_loss: 0.9674, test_loss: 1.1255, test_f1: 0.3801
 epoch: 9, train_loss: 0.9483, test_loss: 1.2090, test_f1: 0.3881
 epoch: 10, train_loss: 0.9496, test_loss: 1.1463, test_f1: 0.4359
 epoch: 11, train_loss: 0.9453, test_loss: 1.0873, test_f1: 0.4972
 epoch: 12, train_loss: 0.9328, test_loss: 1.1355, test_f1: 0.4148
 epoch: 13, train_loss: 0.9211, test_loss: 1.0705, test_f1: 0.4582
 epoch: 14, train_loss: 0.9236, test_loss: 1.1363, test_f1: 0.4214
 epoch: 15, train_loss: 0.8896, test_loss: 1.0921, test_f1: 0.4500
 epoch: 16, train_loss: 0.9386, test_loss: 1.2402, test_f1: 0.4349
 epoch: 17, train_loss: 0.8833, test_loss: 1.0961, test_f1: 0.4995
 epoch: 18, train_loss: 0.8952, test_loss: 1.2871, test_f1: 0.4669
 epoch: 19, train_loss: 0.8952, test_loss: 1.4824, test_f1: 0.3447
 epoch: 20, train_loss: 0.9880, test_loss: 1.8788, test_f1: 0.2503
 epoch: 21, train_loss: 0.9607, test_loss: 1.4677, test_f1: 0.3551
 epoch: 22, train_loss: 0.9383, test_loss: 1.2042, test_f1: 0.4624
 epoch: 23, train_loss: 0.9341, test_loss: 1.0787, test_f1: 0.3823
 epoch: 24, train_loss: 0.8977, test_loss: 1.0938, test_f1: 0.4567
 epoch: 25, train_loss: 0.9003, test_loss: 1.0875, test_f1: 0.4414
 epoch: 26, train_loss: 0.8940, test_loss: 1.1852, test_f1: 0.4337
 epoch: 27, train_loss: 0.8843, test_loss: 1.3125, test_f1: 0.4418
 epoch: 28, train_loss: 0.8795, test_loss: 1.2375, test_f1: 0.4982
 epoch: 29, train_loss: 0.8636, test_loss: 1.3288, test_f1: 0.4382
 epoch: 30, train_loss: 0.8506, test_loss: 1.3417, test_f1: 0.4341
 epoch: 31, train_loss: 0.8465, test_loss: 1.1075, test_f1: 0.5289
 epoch: 32, train_loss: 0.8402, test_loss: 1.0662, test_f1: 0.4709
 epoch: 33, train_loss: 0.8529, test_loss: 1.1582, test_f1: 0.4682
 epoch: 34, train_loss: 0.8680, test_loss: 1.1343, test_f1: 0.5600
 epoch: 35, train_loss: 0.8475, test_loss: 1.1316, test_f1: 0.5796
 epoch: 36, train_loss: 0.8540, test_loss: 1.2975, test_f1: 0.5366
 epoch: 37, train_loss: 0.8550, test_loss: 1.2519, test_f1: 0.4649
 epoch: 38, train_loss: 0.8481, test_loss: 1.2260, test_f1: 0.5057
 epoch: 39, train_loss: 0.8328, test_loss: 1.1904, test_f1: 0.5074
 epoch: 40, train_loss: 0.8305, test_loss: 1.0780, test_f1: 0.5657
 epoch: 41, train_loss: 0.8181, test_loss: 1.1624, test_f1: 0.5427
 epoch: 42, train_loss: 0.8217, test_loss: 1.1625, test_f1: 0.5598
 epoch: 43, train_loss: 0.8253, test_loss: 1.0986, test_f1: 0.5331
 epoch: 44, train_loss: 0.7884, test_loss: 1.1439, test_f1: 0.5196
 epoch: 45, train_loss: 0.8211, test_loss: 1.0787, test_f1: 0.5175
 epoch: 46, train_loss: 0.8149, test_loss: 1.0263, test_f1: 0.5590
 epoch: 47, train_loss: 0.7972, test_loss: 1.1927, test_f1: 0.4819
 epoch: 48, train_loss: 0.8132, test_loss: 1.1191, test_f1: 0.4898
 epoch: 49, train_loss: 0.7994, test_loss: 1.3976, test_f1: 0.4719
 epoch: 50, train_loss: 0.8056, test_loss: 1.2394, test_f1: 0.4864
 epoch: 51, train_loss: 0.7958, test_loss: 1.1002, test_f1: 0.5499
 epoch: 52, train_loss: 0.7807, test_loss: 1.1709, test_f1: 0.5487
 epoch: 53, train_loss: 0.7558, test_loss: 1.1594, test_f1: 0.5560
 epoch: 54, train_loss: 0.7506, test_loss: 1.1810, test_f1: 0.5245
 epoch: 55, train_loss: 0.7517, test_loss: 1.1358, test_f1: 0.5378
 epoch: 56, train_loss: 0.7463, test_loss: 1.1348, test_f1: 0.5278
 epoch: 57, train_loss: 0.7441, test_loss: 1.1249, test_f1: 0.5764
 epoch: 58, train_loss: 0.7478, test_loss: 1.1677, test_f1: 0.5446
 epoch: 59, train_loss: 0.7321, test_loss: 1.2027, test_f1: 0.5619
 epoch: 60, train_loss: 0.7332, test_loss: 1.1368, test_f1: 0.6008
 epoch: 61, train_loss: 0.7289, test_loss: 1.1928, test_f1: 0.5672
 epoch: 62, train_loss: 0.7025, test_loss: 1.1353, test_f1: 0.5548
 epoch: 63, train_loss: 0.7183, test_loss: 1.1770, test_f1: 0.5642
 epoch: 64, train_loss: 0.7091, test_loss: 1.2206, test_f1: 0.5806
 epoch: 65, train_loss: 0.7110, test_loss: 1.2738, test_f1: 0.5317
 epoch: 66, train_loss: 0.7161, test_loss: 1.3957, test_f1: 0.5058
 epoch: 67, train_loss: 0.7271, test_loss: 1.1405, test_f1: 0.5386
 epoch: 68, train_loss: 0.7249, test_loss: 1.1658, test_f1: 0.5237
 epoch: 69, train_loss: 0.7324, test_loss: 1.3389, test_f1: 0.5349
 epoch: 70, train_loss: 0.7213, test_loss: 1.2595, test_f1: 0.5672
 epoch: 71, train_loss: 0.7188, test_loss: 1.2091, test_f1: 0.5864
 epoch: 72, train_loss: 0.6993, test_loss: 1.2025, test_f1: 0.5902
 epoch: 73, train_loss: 0.7194, test_loss: 1.3416, test_f1: 0.5394
 epoch: 74, train_loss: 0.7130, test_loss: 1.2273, test_f1: 0.5686
 epoch: 75, train_loss: 0.7673, test_loss: 1.1811, test_f1: 0.5059
 epoch: 76, train_loss: 0.7565, test_loss: 1.1959, test_f1: 0.5833
 epoch: 77, train_loss: 0.7284, test_loss: 1.2163, test_f1: 0.5597
 epoch: 78, train_loss: 0.7038, test_loss: 1.3508, test_f1: 0.5849
 epoch: 79, train_loss: 0.7145, test_loss: 1.2774, test_f1: 0.5809
 epoch: 80, train_loss: 0.7034, test_loss: 1.2110, test_f1: 0.5143
 epoch: 81, train_loss: 0.7224, test_loss: 1.4197, test_f1: 0.5188
 epoch: 82, train_loss: 0.6888, test_loss: 1.3875, test_f1: 0.5959
 epoch: 83, train_loss: 0.6958, test_loss: 1.2920, test_f1: 0.5785
 epoch: 84, train_loss: 0.6642, test_loss: 1.2348, test_f1: 0.5918
 epoch: 85, train_loss: 0.6643, test_loss: 1.3263, test_f1: 0.5855
 epoch: 86, train_loss: 0.6957, test_loss: 1.3261, test_f1: 0.5173
 epoch: 87, train_loss: 0.6805, test_loss: 1.2691, test_f1: 0.5608
 epoch: 88, train_loss: 0.6768, test_loss: 1.3097, test_f1: 0.5036
 epoch: 89, train_loss: 0.6666, test_loss: 1.1947, test_f1: 0.5907
 epoch: 90, train_loss: 0.6740, test_loss: 1.1973, test_f1: 0.5642
 epoch: 91, train_loss: 0.6715, test_loss: 1.2245, test_f1: 0.6216
 epoch: 92, train_loss: 0.6809, test_loss: 1.3805, test_f1: 0.5669
 epoch: 93, train_loss: 0.6609, test_loss: 1.2558, test_f1: 0.5941
 epoch: 94, train_loss: 0.6573, test_loss: 1.2554, test_f1: 0.6038
 epoch: 95, train_loss: 0.6614, test_loss: 1.2748, test_f1: 0.5541
 epoch: 96, train_loss: 0.6542, test_loss: 1.2423, test_f1: 0.6046
 epoch: 97, train_loss: 0.6551, test_loss: 1.5916, test_f1: 0.4625
 epoch: 98, train_loss: 0.6343, test_loss: 1.3477, test_f1: 0.5424
 epoch: 99, train_loss: 0.6308, test_loss: 1.2398, test_f1: 0.6135
##################ITERATION #4 ****************************************
 epoch: 0, train_loss: 1.2471, test_loss: 1.3054, test_f1: 0.2281
 epoch: 1, train_loss: 1.1215, test_loss: 1.2627, test_f1: 0.2281
 epoch: 2, train_loss: 1.0774, test_loss: 1.3032, test_f1: 0.3449
 epoch: 3, train_loss: 1.0559, test_loss: 1.3015, test_f1: 0.2925
 epoch: 4, train_loss: 1.0391, test_loss: 1.1886, test_f1: 0.4429
 epoch: 5, train_loss: 1.0243, test_loss: 1.1176, test_f1: 0.5089
 epoch: 6, train_loss: 0.9860, test_loss: 1.1115, test_f1: 0.5024
 epoch: 7, train_loss: 0.9728, test_loss: 1.1109, test_f1: 0.4961
 epoch: 8, train_loss: 0.9646, test_loss: 1.1200, test_f1: 0.5156
 epoch: 9, train_loss: 0.9394, test_loss: 1.1211, test_f1: 0.4711
 epoch: 10, train_loss: 0.9282, test_loss: 1.1804, test_f1: 0.5217
 epoch: 11, train_loss: 0.9332, test_loss: 1.1172, test_f1: 0.5144
 epoch: 12, train_loss: 0.9397, test_loss: 1.1835, test_f1: 0.4746
 epoch: 13, train_loss: 0.9264, test_loss: 1.2050, test_f1: 0.4687
 epoch: 14, train_loss: 0.9007, test_loss: 1.1253, test_f1: 0.5391
 epoch: 15, train_loss: 0.9000, test_loss: 1.1764, test_f1: 0.5109
 epoch: 16, train_loss: 0.9259, test_loss: 1.1738, test_f1: 0.4983
 epoch: 17, train_loss: 0.8926, test_loss: 1.2262, test_f1: 0.4895
 epoch: 18, train_loss: 0.8808, test_loss: 1.0588, test_f1: 0.5705
 epoch: 19, train_loss: 0.8730, test_loss: 1.1131, test_f1: 0.5331
 epoch: 20, train_loss: 0.8708, test_loss: 1.1234, test_f1: 0.5145
 epoch: 21, train_loss: 0.8440, test_loss: 1.1036, test_f1: 0.5813
 epoch: 22, train_loss: 0.8463, test_loss: 1.1323, test_f1: 0.5163
 epoch: 23, train_loss: 0.8641, test_loss: 1.4223, test_f1: 0.4739
 epoch: 24, train_loss: 0.8437, test_loss: 1.1119, test_f1: 0.5048
 epoch: 25, train_loss: 0.8524, test_loss: 1.3177, test_f1: 0.4782
 epoch: 26, train_loss: 0.8346, test_loss: 1.2240, test_f1: 0.5395
 epoch: 27, train_loss: 0.8237, test_loss: 1.2152, test_f1: 0.4834
 epoch: 28, train_loss: 0.8216, test_loss: 1.1766, test_f1: 0.5473
 epoch: 29, train_loss: 0.7987, test_loss: 1.2268, test_f1: 0.4737
 epoch: 30, train_loss: 0.7898, test_loss: 1.2095, test_f1: 0.5094
 epoch: 31, train_loss: 0.7902, test_loss: 1.0867, test_f1: 0.5910
 epoch: 32, train_loss: 0.8290, test_loss: 1.3854, test_f1: 0.4739
 epoch: 33, train_loss: 0.8333, test_loss: 1.1349, test_f1: 0.5395
 epoch: 34, train_loss: 0.8033, test_loss: 1.1089, test_f1: 0.5523
 epoch: 35, train_loss: 0.7929, test_loss: 1.0513, test_f1: 0.5425
 epoch: 36, train_loss: 0.7839, test_loss: 1.0743, test_f1: 0.5358
 epoch: 37, train_loss: 0.7763, test_loss: 1.2161, test_f1: 0.5416
 epoch: 38, train_loss: 0.7748, test_loss: 1.3029, test_f1: 0.5500
 epoch: 39, train_loss: 0.7746, test_loss: 1.0631, test_f1: 0.5808
 epoch: 40, train_loss: 0.7561, test_loss: 1.1306, test_f1: 0.5311
 epoch: 41, train_loss: 0.7832, test_loss: 1.0250, test_f1: 0.6122
 epoch: 42, train_loss: 0.7840, test_loss: 1.3401, test_f1: 0.5298
 epoch: 43, train_loss: 0.7703, test_loss: 1.2286, test_f1: 0.5046
 epoch: 44, train_loss: 0.7463, test_loss: 1.0561, test_f1: 0.5245
 epoch: 45, train_loss: 0.7504, test_loss: 1.0016, test_f1: 0.6091
 epoch: 46, train_loss: 0.7208, test_loss: 1.0950, test_f1: 0.5578
 epoch: 47, train_loss: 0.7339, test_loss: 1.0991, test_f1: 0.5600
 epoch: 48, train_loss: 0.7499, test_loss: 1.0572, test_f1: 0.6014
 epoch: 49, train_loss: 0.7371, test_loss: 1.1086, test_f1: 0.5828
 epoch: 50, train_loss: 0.8144, test_loss: 1.3775, test_f1: 0.5310
 epoch: 51, train_loss: 0.7856, test_loss: 1.2881, test_f1: 0.5336
 epoch: 52, train_loss: 0.7593, test_loss: 1.3309, test_f1: 0.5254
 epoch: 53, train_loss: 0.7409, test_loss: 1.2065, test_f1: 0.5147
 epoch: 54, train_loss: 0.7303, test_loss: 1.1209, test_f1: 0.5930
 epoch: 55, train_loss: 0.7257, test_loss: 1.0442, test_f1: 0.5663
 epoch: 56, train_loss: 0.7224, test_loss: 1.0277, test_f1: 0.5839
 epoch: 57, train_loss: 0.7262, test_loss: 0.9799, test_f1: 0.6366
 epoch: 58, train_loss: 0.6959, test_loss: 1.0532, test_f1: 0.5838
 epoch: 59, train_loss: 0.6974, test_loss: 1.1074, test_f1: 0.5659
 epoch: 60, train_loss: 0.6867, test_loss: 1.1074, test_f1: 0.5828
 epoch: 61, train_loss: 0.7090, test_loss: 1.0642, test_f1: 0.6368
 epoch: 62, train_loss: 0.6749, test_loss: 1.1108, test_f1: 0.6221
 epoch: 63, train_loss: 0.7068, test_loss: 1.1539, test_f1: 0.5588
 epoch: 64, train_loss: 0.6859, test_loss: 1.1220, test_f1: 0.6012
 epoch: 65, train_loss: 0.6841, test_loss: 1.1222, test_f1: 0.5763
 epoch: 66, train_loss: 0.6693, test_loss: 1.1275, test_f1: 0.5794
 epoch: 67, train_loss: 0.6934, test_loss: 1.2336, test_f1: 0.5433
 epoch: 68, train_loss: 0.6788, test_loss: 1.2757, test_f1: 0.5613
 epoch: 69, train_loss: 0.6880, test_loss: 1.1381, test_f1: 0.5501
 epoch: 70, train_loss: 0.6857, test_loss: 1.1214, test_f1: 0.5845
 epoch: 71, train_loss: 0.6818, test_loss: 1.1473, test_f1: 0.6017
 epoch: 72, train_loss: 0.6887, test_loss: 1.1882, test_f1: 0.5719
 epoch: 73, train_loss: 0.6639, test_loss: 1.2280, test_f1: 0.6030
 epoch: 74, train_loss: 0.6661, test_loss: 1.2391, test_f1: 0.6041
 epoch: 75, train_loss: 0.6744, test_loss: 1.1924, test_f1: 0.5637
 epoch: 76, train_loss: 0.6949, test_loss: 1.2138, test_f1: 0.5729
 epoch: 77, train_loss: 0.6787, test_loss: 1.2278, test_f1: 0.5956
 epoch: 78, train_loss: 0.6914, test_loss: 1.2137, test_f1: 0.6090
 epoch: 79, train_loss: 0.6810, test_loss: 1.1476, test_f1: 0.5739
 epoch: 80, train_loss: 0.6699, test_loss: 1.1758, test_f1: 0.5582
 epoch: 81, train_loss: 0.6643, test_loss: 1.2042, test_f1: 0.5782
 epoch: 82, train_loss: 0.6520, test_loss: 1.1892, test_f1: 0.5992
 epoch: 83, train_loss: 0.6560, test_loss: 1.1245, test_f1: 0.6004
 epoch: 84, train_loss: 0.6753, test_loss: 1.1391, test_f1: 0.5722
 epoch: 85, train_loss: 0.6726, test_loss: 1.1448, test_f1: 0.5737
 epoch: 86, train_loss: 0.6796, test_loss: 1.2671, test_f1: 0.5578
 epoch: 87, train_loss: 0.6741, test_loss: 1.3950, test_f1: 0.5481
 epoch: 88, train_loss: 0.6551, test_loss: 1.4022, test_f1: 0.5567
 epoch: 89, train_loss: 0.6728, test_loss: 1.1339, test_f1: 0.5721
 epoch: 90, train_loss: 0.6314, test_loss: 1.2707, test_f1: 0.5794
 epoch: 91, train_loss: 0.6412, test_loss: 1.4066, test_f1: 0.5312
 epoch: 92, train_loss: 0.6631, test_loss: 1.2385, test_f1: 0.5809
 epoch: 93, train_loss: 0.6647, test_loss: 1.3391, test_f1: 0.5756
 epoch: 94, train_loss: 0.6434, test_loss: 1.3704, test_f1: 0.5811
 epoch: 95, train_loss: 0.6603, test_loss: 1.1975, test_f1: 0.5814
 epoch: 96, train_loss: 0.6643, test_loss: 1.2212, test_f1: 0.5043
 epoch: 97, train_loss: 0.6732, test_loss: 1.1778, test_f1: 0.5496
 epoch: 98, train_loss: 0.6802, test_loss: 1.3307, test_f1: 0.5612
 epoch: 99, train_loss: 0.6775, test_loss: 1.3469, test_f1: 0.5803
##################ITERATION #5 ****************************************
 epoch: 0, train_loss: 1.4661, test_loss: 1.4857, test_f1: 0.2583
 epoch: 1, train_loss: 1.1676, test_loss: 1.4050, test_f1: 0.2722
 epoch: 2, train_loss: 1.1010, test_loss: 1.3024, test_f1: 0.3232
 epoch: 3, train_loss: 1.0614, test_loss: 1.2123, test_f1: 0.3777
 epoch: 4, train_loss: 1.0470, test_loss: 1.1496, test_f1: 0.4391
 epoch: 5, train_loss: 1.0200, test_loss: 1.0927, test_f1: 0.4477
 epoch: 6, train_loss: 1.0109, test_loss: 1.0799, test_f1: 0.5083
 epoch: 7, train_loss: 0.9956, test_loss: 1.1764, test_f1: 0.4698
 epoch: 8, train_loss: 0.9926, test_loss: 1.0534, test_f1: 0.5145
 epoch: 9, train_loss: 0.9746, test_loss: 1.0939, test_f1: 0.4865
 epoch: 10, train_loss: 0.9566, test_loss: 1.0715, test_f1: 0.4945
 epoch: 11, train_loss: 0.9555, test_loss: 1.0983, test_f1: 0.5229
 epoch: 12, train_loss: 0.9591, test_loss: 1.0785, test_f1: 0.5075
 epoch: 13, train_loss: 0.9378, test_loss: 1.0801, test_f1: 0.4726
 epoch: 14, train_loss: 0.9324, test_loss: 1.1609, test_f1: 0.4706
 epoch: 15, train_loss: 0.9246, test_loss: 1.0436, test_f1: 0.5224
 epoch: 16, train_loss: 0.9095, test_loss: 1.2525, test_f1: 0.3925
 epoch: 17, train_loss: 0.9337, test_loss: 1.2408, test_f1: 0.4022
 epoch: 18, train_loss: 0.9276, test_loss: 1.1325, test_f1: 0.4839
 epoch: 19, train_loss: 0.9300, test_loss: 1.1270, test_f1: 0.4865
 epoch: 20, train_loss: 0.9240, test_loss: 1.0761, test_f1: 0.5126
 epoch: 21, train_loss: 0.9169, test_loss: 1.1551, test_f1: 0.4984
 epoch: 22, train_loss: 0.9045, test_loss: 1.2010, test_f1: 0.5352
 epoch: 23, train_loss: 0.9183, test_loss: 1.0477, test_f1: 0.5201
 epoch: 24, train_loss: 0.9055, test_loss: 1.0237, test_f1: 0.5320
 epoch: 25, train_loss: 0.8945, test_loss: 1.1770, test_f1: 0.4555
 epoch: 26, train_loss: 0.9168, test_loss: 1.1769, test_f1: 0.4615
 epoch: 27, train_loss: 0.8860, test_loss: 1.1463, test_f1: 0.4644
 epoch: 28, train_loss: 0.8917, test_loss: 1.1094, test_f1: 0.5419
 epoch: 29, train_loss: 0.8614, test_loss: 1.1186, test_f1: 0.5468
 epoch: 30, train_loss: 0.8630, test_loss: 1.0209, test_f1: 0.6018
 epoch: 31, train_loss: 0.8615, test_loss: 1.0574, test_f1: 0.5556
 epoch: 32, train_loss: 0.8426, test_loss: 1.0624, test_f1: 0.5186
 epoch: 33, train_loss: 0.8775, test_loss: 1.0841, test_f1: 0.5717
 epoch: 34, train_loss: 0.8755, test_loss: 1.0337, test_f1: 0.4665
 epoch: 35, train_loss: 0.8642, test_loss: 1.1925, test_f1: 0.4932
 epoch: 36, train_loss: 0.8667, test_loss: 1.1589, test_f1: 0.5292
 epoch: 37, train_loss: 0.8647, test_loss: 1.1084, test_f1: 0.5353
 epoch: 38, train_loss: 0.8558, test_loss: 1.0940, test_f1: 0.5359
 epoch: 39, train_loss: 0.8357, test_loss: 1.0891, test_f1: 0.5562
 epoch: 40, train_loss: 0.8394, test_loss: 1.0011, test_f1: 0.5652
 epoch: 41, train_loss: 0.8464, test_loss: 1.0277, test_f1: 0.5459
 epoch: 42, train_loss: 0.8259, test_loss: 1.0233, test_f1: 0.5490
 epoch: 43, train_loss: 0.8299, test_loss: 1.1207, test_f1: 0.5469
 epoch: 44, train_loss: 0.8373, test_loss: 1.1598, test_f1: 0.4956
 epoch: 45, train_loss: 0.8617, test_loss: 1.1334, test_f1: 0.4512
 epoch: 46, train_loss: 0.8541, test_loss: 1.1958, test_f1: 0.5636
 epoch: 47, train_loss: 0.8342, test_loss: 1.0346, test_f1: 0.5528
 epoch: 48, train_loss: 0.8145, test_loss: 1.4427, test_f1: 0.4864
 epoch: 49, train_loss: 0.8148, test_loss: 1.2996, test_f1: 0.5117
 epoch: 50, train_loss: 0.8596, test_loss: 1.2820, test_f1: 0.5344
 epoch: 51, train_loss: 0.8724, test_loss: 0.9954, test_f1: 0.5747
 epoch: 52, train_loss: 0.8379, test_loss: 1.0133, test_f1: 0.5638
 epoch: 53, train_loss: 0.8035, test_loss: 1.0726, test_f1: 0.5286
 epoch: 54, train_loss: 0.7938, test_loss: 1.1032, test_f1: 0.5815
 epoch: 55, train_loss: 0.7749, test_loss: 1.1040, test_f1: 0.5698
 epoch: 56, train_loss: 0.7947, test_loss: 1.0851, test_f1: 0.5352
 epoch: 57, train_loss: 0.8069, test_loss: 1.0286, test_f1: 0.5585
 epoch: 58, train_loss: 0.7849, test_loss: 1.2770, test_f1: 0.5095
 epoch: 59, train_loss: 0.7816, test_loss: 1.1746, test_f1: 0.5422
 epoch: 60, train_loss: 0.7659, test_loss: 1.0374, test_f1: 0.5603
 epoch: 61, train_loss: 0.7907, test_loss: 1.0831, test_f1: 0.4695
 epoch: 62, train_loss: 0.7900, test_loss: 1.2274, test_f1: 0.5665
 epoch: 63, train_loss: 0.7866, test_loss: 1.1684, test_f1: 0.5803
 epoch: 64, train_loss: 0.7675, test_loss: 1.1731, test_f1: 0.5876
 epoch: 65, train_loss: 0.7695, test_loss: 1.0979, test_f1: 0.5835
 epoch: 66, train_loss: 0.7494, test_loss: 1.0974, test_f1: 0.5562
 epoch: 67, train_loss: 0.7781, test_loss: 1.2514, test_f1: 0.5757
 epoch: 68, train_loss: 0.7684, test_loss: 1.1460, test_f1: 0.5472
 epoch: 69, train_loss: 0.7510, test_loss: 1.1056, test_f1: 0.5406
 epoch: 70, train_loss: 0.7633, test_loss: 1.2820, test_f1: 0.5590
 epoch: 71, train_loss: 0.7665, test_loss: 1.2121, test_f1: 0.5568
 epoch: 72, train_loss: 0.7597, test_loss: 1.0641, test_f1: 0.5780
 epoch: 73, train_loss: 0.7684, test_loss: 1.0200, test_f1: 0.5790
 epoch: 74, train_loss: 0.7602, test_loss: 1.0538, test_f1: 0.5732
 epoch: 75, train_loss: 0.7473, test_loss: 1.1461, test_f1: 0.5436
 epoch: 76, train_loss: 0.7401, test_loss: 1.1525, test_f1: 0.5315
 epoch: 77, train_loss: 0.7353, test_loss: 1.0686, test_f1: 0.5492
 epoch: 78, train_loss: 0.7297, test_loss: 1.1018, test_f1: 0.5496
 epoch: 79, train_loss: 0.7599, test_loss: 1.1565, test_f1: 0.5135
 epoch: 80, train_loss: 0.7889, test_loss: 1.1338, test_f1: 0.5210
 epoch: 81, train_loss: 0.7855, test_loss: 1.2306, test_f1: 0.5732
 epoch: 82, train_loss: 0.7817, test_loss: 1.2870, test_f1: 0.5610
 epoch: 83, train_loss: 0.7491, test_loss: 1.1411, test_f1: 0.5795
 epoch: 84, train_loss: 0.7663, test_loss: 1.1439, test_f1: 0.5667
 epoch: 85, train_loss: 0.7757, test_loss: 1.1117, test_f1: 0.5671
 epoch: 86, train_loss: 0.7701, test_loss: 1.1223, test_f1: 0.5124
 epoch: 87, train_loss: 0.7615, test_loss: 1.0825, test_f1: 0.4892
 epoch: 88, train_loss: 0.7501, test_loss: 1.1228, test_f1: 0.5436
 epoch: 89, train_loss: 0.7573, test_loss: 1.0920, test_f1: 0.5861
 epoch: 90, train_loss: 0.7439, test_loss: 1.3773, test_f1: 0.5166
 epoch: 91, train_loss: 0.7541, test_loss: 1.3358, test_f1: 0.5241
 epoch: 92, train_loss: 0.7430, test_loss: 1.1029, test_f1: 0.6007
 epoch: 93, train_loss: 0.7403, test_loss: 1.1336, test_f1: 0.5893
 epoch: 94, train_loss: 0.7442, test_loss: 1.2017, test_f1: 0.5804
 epoch: 95, train_loss: 0.7292, test_loss: 1.1867, test_f1: 0.5783
 epoch: 96, train_loss: 0.7437, test_loss: 1.1688, test_f1: 0.5445
 epoch: 97, train_loss: 0.7316, test_loss: 1.1611, test_f1: 0.5484
 epoch: 98, train_loss: 0.7599, test_loss: 1.2029, test_f1: 0.5545
 epoch: 99, train_loss: 0.7800, test_loss: 1.2347, test_f1: 0.5876
##################ITERATION #6 ****************************************
 epoch: 0, train_loss: 1.2985, test_loss: 1.5055, test_f1: 0.1365
 epoch: 1, train_loss: 1.1963, test_loss: 1.2311, test_f1: 0.3335
 epoch: 2, train_loss: 1.1248, test_loss: 1.2278, test_f1: 0.2281
 epoch: 3, train_loss: 1.0746, test_loss: 1.1865, test_f1: 0.2949
 epoch: 4, train_loss: 1.0390, test_loss: 1.1533, test_f1: 0.4082
 epoch: 5, train_loss: 1.0099, test_loss: 1.1530, test_f1: 0.4159
 epoch: 6, train_loss: 1.0056, test_loss: 1.2510, test_f1: 0.4409
 epoch: 7, train_loss: 0.9879, test_loss: 1.1421, test_f1: 0.4830
 epoch: 8, train_loss: 0.9866, test_loss: 1.1667, test_f1: 0.4493
 epoch: 9, train_loss: 0.9700, test_loss: 1.0367, test_f1: 0.4144
 epoch: 10, train_loss: 0.9523, test_loss: 1.0258, test_f1: 0.4532
 epoch: 11, train_loss: 0.9549, test_loss: 1.0216, test_f1: 0.5116
 epoch: 12, train_loss: 0.9404, test_loss: 0.9916, test_f1: 0.4807
 epoch: 13, train_loss: 0.9305, test_loss: 0.9990, test_f1: 0.4688
 epoch: 14, train_loss: 0.9415, test_loss: 1.0341, test_f1: 0.4964
 epoch: 15, train_loss: 0.9290, test_loss: 1.0686, test_f1: 0.5266
 epoch: 16, train_loss: 0.9253, test_loss: 1.1276, test_f1: 0.5362
 epoch: 17, train_loss: 0.9227, test_loss: 1.0774, test_f1: 0.4859
 epoch: 18, train_loss: 0.9124, test_loss: 1.0327, test_f1: 0.5337
 epoch: 19, train_loss: 0.9124, test_loss: 1.0263, test_f1: 0.5196
 epoch: 20, train_loss: 0.9139, test_loss: 1.0295, test_f1: 0.5422
 epoch: 21, train_loss: 0.9183, test_loss: 1.1658, test_f1: 0.5302
 epoch: 22, train_loss: 0.9169, test_loss: 1.0925, test_f1: 0.5823
 epoch: 23, train_loss: 0.9131, test_loss: 1.1572, test_f1: 0.5300
 epoch: 24, train_loss: 0.9152, test_loss: 1.0630, test_f1: 0.4564
 epoch: 25, train_loss: 0.9150, test_loss: 1.0941, test_f1: 0.4103
 epoch: 26, train_loss: 0.9112, test_loss: 1.0654, test_f1: 0.5305
 epoch: 27, train_loss: 0.8972, test_loss: 1.0332, test_f1: 0.5541
 epoch: 28, train_loss: 0.9181, test_loss: 1.0825, test_f1: 0.4993
 epoch: 29, train_loss: 0.8940, test_loss: 1.1970, test_f1: 0.4870
 epoch: 30, train_loss: 0.8995, test_loss: 1.1254, test_f1: 0.5173
 epoch: 31, train_loss: 0.8707, test_loss: 1.0212, test_f1: 0.4449
 epoch: 32, train_loss: 0.8584, test_loss: 1.0378, test_f1: 0.4500
 epoch: 33, train_loss: 0.8608, test_loss: 1.1155, test_f1: 0.5169
 epoch: 34, train_loss: 0.8872, test_loss: 1.1354, test_f1: 0.4460
 epoch: 35, train_loss: 0.8741, test_loss: 1.0280, test_f1: 0.5600
 epoch: 36, train_loss: 0.8714, test_loss: 1.0666, test_f1: 0.5220
 epoch: 37, train_loss: 0.8742, test_loss: 1.1326, test_f1: 0.5437
 epoch: 38, train_loss: 0.8636, test_loss: 1.0210, test_f1: 0.5482
 epoch: 39, train_loss: 0.8534, test_loss: 1.0208, test_f1: 0.5368
 epoch: 40, train_loss: 0.8410, test_loss: 1.0686, test_f1: 0.4951
 epoch: 41, train_loss: 0.8460, test_loss: 0.9972, test_f1: 0.5568
 epoch: 42, train_loss: 0.8371, test_loss: 1.0287, test_f1: 0.5070
 epoch: 43, train_loss: 0.8294, test_loss: 1.0202, test_f1: 0.5095
 epoch: 44, train_loss: 0.8204, test_loss: 1.1312, test_f1: 0.5759
 epoch: 45, train_loss: 0.8365, test_loss: 1.0246, test_f1: 0.5203
 epoch: 46, train_loss: 0.8316, test_loss: 1.2493, test_f1: 0.5571
 epoch: 47, train_loss: 0.8352, test_loss: 1.3069, test_f1: 0.5166
 epoch: 48, train_loss: 0.8340, test_loss: 1.0813, test_f1: 0.4784
 epoch: 49, train_loss: 0.8240, test_loss: 1.0265, test_f1: 0.5364
 epoch: 50, train_loss: 0.8159, test_loss: 1.1973, test_f1: 0.4936
 epoch: 51, train_loss: 0.8051, test_loss: 1.1578, test_f1: 0.5360
 epoch: 52, train_loss: 0.8150, test_loss: 1.1410, test_f1: 0.4575
 epoch: 53, train_loss: 0.8044, test_loss: 1.1495, test_f1: 0.4555
 epoch: 54, train_loss: 0.8013, test_loss: 1.0389, test_f1: 0.4920
 epoch: 55, train_loss: 0.8046, test_loss: 1.0598, test_f1: 0.5698
 epoch: 56, train_loss: 0.7959, test_loss: 1.1015, test_f1: 0.4689
 epoch: 57, train_loss: 0.8053, test_loss: 1.1859, test_f1: 0.4636
 epoch: 58, train_loss: 0.7865, test_loss: 1.1284, test_f1: 0.5561
 epoch: 59, train_loss: 0.7830, test_loss: 1.1401, test_f1: 0.4981
 epoch: 60, train_loss: 0.7820, test_loss: 1.1981, test_f1: 0.4706
 epoch: 61, train_loss: 0.7925, test_loss: 1.1643, test_f1: 0.5408
 epoch: 62, train_loss: 0.7947, test_loss: 1.2279, test_f1: 0.5503
 epoch: 63, train_loss: 0.7822, test_loss: 1.2455, test_f1: 0.5667
 epoch: 64, train_loss: 0.7821, test_loss: 1.1884, test_f1: 0.5584
 epoch: 65, train_loss: 0.7642, test_loss: 1.0974, test_f1: 0.5909
 epoch: 66, train_loss: 0.7795, test_loss: 1.1344, test_f1: 0.5783
 epoch: 67, train_loss: 0.7891, test_loss: 1.1981, test_f1: 0.5646
 epoch: 68, train_loss: 0.7764, test_loss: 1.1829, test_f1: 0.5402
 epoch: 69, train_loss: 0.7655, test_loss: 1.0705, test_f1: 0.5564
 epoch: 70, train_loss: 0.8287, test_loss: 1.1148, test_f1: 0.5430
 epoch: 71, train_loss: 0.7749, test_loss: 1.0864, test_f1: 0.5553
 epoch: 72, train_loss: 0.7845, test_loss: 1.1067, test_f1: 0.5672
 epoch: 73, train_loss: 0.7674, test_loss: 1.0505, test_f1: 0.5147
 epoch: 74, train_loss: 0.7629, test_loss: 1.0334, test_f1: 0.5788
 epoch: 75, train_loss: 0.7575, test_loss: 1.1003, test_f1: 0.6026
 epoch: 76, train_loss: 0.7826, test_loss: 1.0977, test_f1: 0.5605
 epoch: 77, train_loss: 0.7641, test_loss: 0.9644, test_f1: 0.6039
 epoch: 78, train_loss: 0.7732, test_loss: 1.1276, test_f1: 0.5694
 epoch: 79, train_loss: 0.7527, test_loss: 1.2319, test_f1: 0.5578
 epoch: 80, train_loss: 0.7571, test_loss: 1.2227, test_f1: 0.5479
 epoch: 81, train_loss: 0.7497, test_loss: 1.0843, test_f1: 0.5843
 epoch: 82, train_loss: 0.7451, test_loss: 1.1313, test_f1: 0.5769
 epoch: 83, train_loss: 0.7455, test_loss: 1.1465, test_f1: 0.5628
 epoch: 84, train_loss: 0.7300, test_loss: 1.0909, test_f1: 0.5983
 epoch: 85, train_loss: 0.7217, test_loss: 1.0578, test_f1: 0.5954
 epoch: 86, train_loss: 0.7439, test_loss: 1.0933, test_f1: 0.5745
 epoch: 87, train_loss: 0.7363, test_loss: 1.1609, test_f1: 0.5732
 epoch: 88, train_loss: 0.7389, test_loss: 1.1469, test_f1: 0.5811
 epoch: 89, train_loss: 0.7432, test_loss: 1.1753, test_f1: 0.5570
 epoch: 90, train_loss: 0.7258, test_loss: 1.3524, test_f1: 0.5400
 epoch: 91, train_loss: 0.7397, test_loss: 1.1198, test_f1: 0.5735
 epoch: 92, train_loss: 0.7358, test_loss: 1.1047, test_f1: 0.6071
 epoch: 93, train_loss: 0.7210, test_loss: 1.0972, test_f1: 0.6038
 epoch: 94, train_loss: 0.7216, test_loss: 1.0875, test_f1: 0.5944
 epoch: 95, train_loss: 0.7273, test_loss: 1.0317, test_f1: 0.6228
 epoch: 96, train_loss: 0.7214, test_loss: 1.1357, test_f1: 0.5608
 epoch: 97, train_loss: 0.7284, test_loss: 1.1126, test_f1: 0.5593
 epoch: 98, train_loss: 0.7249, test_loss: 1.0739, test_f1: 0.5749
 epoch: 99, train_loss: 0.7055, test_loss: 1.1104, test_f1: 0.5613
##################ITERATION #7 ****************************************
 epoch: 0, train_loss: 1.3249, test_loss: 1.3785, test_f1: 0.2281
 epoch: 1, train_loss: 1.1641, test_loss: 1.3249, test_f1: 0.2281
 epoch: 2, train_loss: 1.1248, test_loss: 1.3028, test_f1: 0.2583
 epoch: 3, train_loss: 1.0886, test_loss: 1.3041, test_f1: 0.2433
 epoch: 4, train_loss: 1.0668, test_loss: 1.2796, test_f1: 0.3113
 epoch: 5, train_loss: 1.0378, test_loss: 1.1872, test_f1: 0.4190
 epoch: 6, train_loss: 1.0286, test_loss: 1.2494, test_f1: 0.4046
 epoch: 7, train_loss: 0.9968, test_loss: 1.2050, test_f1: 0.4474
 epoch: 8, train_loss: 0.9878, test_loss: 1.2363, test_f1: 0.4495
 epoch: 9, train_loss: 0.9609, test_loss: 1.1712, test_f1: 0.4492
 epoch: 10, train_loss: 0.9594, test_loss: 1.1526, test_f1: 0.4921
 epoch: 11, train_loss: 0.9437, test_loss: 1.1695, test_f1: 0.4848
 epoch: 12, train_loss: 0.9242, test_loss: 1.1355, test_f1: 0.4780
 epoch: 13, train_loss: 0.9545, test_loss: 1.2807, test_f1: 0.5267
 epoch: 14, train_loss: 0.9382, test_loss: 1.2267, test_f1: 0.4056
 epoch: 15, train_loss: 0.9341, test_loss: 1.1588, test_f1: 0.5326
 epoch: 16, train_loss: 0.9426, test_loss: 1.1419, test_f1: 0.4903
 epoch: 17, train_loss: 0.9339, test_loss: 1.1151, test_f1: 0.4756
 epoch: 18, train_loss: 0.9199, test_loss: 1.1229, test_f1: 0.5223
 epoch: 19, train_loss: 0.9182, test_loss: 1.1302, test_f1: 0.5157
 epoch: 20, train_loss: 0.9056, test_loss: 1.1031, test_f1: 0.5607
 epoch: 21, train_loss: 0.9183, test_loss: 1.2082, test_f1: 0.5101
 epoch: 22, train_loss: 0.9105, test_loss: 1.1530, test_f1: 0.5379
 epoch: 23, train_loss: 0.8856, test_loss: 1.1330, test_f1: 0.4453
 epoch: 24, train_loss: 0.8885, test_loss: 1.1263, test_f1: 0.4967
 epoch: 25, train_loss: 0.8798, test_loss: 1.2213, test_f1: 0.5201
 epoch: 26, train_loss: 0.8798, test_loss: 1.1215, test_f1: 0.5159
 epoch: 27, train_loss: 0.8670, test_loss: 1.1282, test_f1: 0.5106
 epoch: 28, train_loss: 0.8623, test_loss: 1.1624, test_f1: 0.4772
 epoch: 29, train_loss: 0.8694, test_loss: 1.1626, test_f1: 0.5680
 epoch: 30, train_loss: 0.8504, test_loss: 1.1765, test_f1: 0.5001
 epoch: 31, train_loss: 0.8667, test_loss: 1.1448, test_f1: 0.5208
 epoch: 32, train_loss: 0.8602, test_loss: 1.0604, test_f1: 0.5363
 epoch: 33, train_loss: 0.8566, test_loss: 1.1120, test_f1: 0.4935
 epoch: 34, train_loss: 0.8670, test_loss: 1.1741, test_f1: 0.4695
 epoch: 35, train_loss: 0.8591, test_loss: 1.2073, test_f1: 0.4706
 epoch: 36, train_loss: 0.8715, test_loss: 1.2316, test_f1: 0.5352
 epoch: 37, train_loss: 0.8427, test_loss: 1.0972, test_f1: 0.5235
 epoch: 38, train_loss: 0.8389, test_loss: 1.2324, test_f1: 0.5024
 epoch: 39, train_loss: 0.8409, test_loss: 1.2847, test_f1: 0.4448
 epoch: 40, train_loss: 0.8532, test_loss: 1.3468, test_f1: 0.4398
 epoch: 41, train_loss: 0.8450, test_loss: 1.1495, test_f1: 0.5437
 epoch: 42, train_loss: 0.8359, test_loss: 1.1610, test_f1: 0.5588
 epoch: 43, train_loss: 0.8238, test_loss: 1.2361, test_f1: 0.5444
 epoch: 44, train_loss: 0.8255, test_loss: 1.1621, test_f1: 0.5532
 epoch: 45, train_loss: 0.8326, test_loss: 1.1644, test_f1: 0.5234
 epoch: 46, train_loss: 0.8303, test_loss: 1.1507, test_f1: 0.5225
 epoch: 47, train_loss: 0.8195, test_loss: 1.2185, test_f1: 0.5440
 epoch: 48, train_loss: 0.8441, test_loss: 1.2222, test_f1: 0.5602
 epoch: 49, train_loss: 0.8156, test_loss: 1.1820, test_f1: 0.5658
 epoch: 50, train_loss: 0.8148, test_loss: 1.1629, test_f1: 0.5265
 epoch: 51, train_loss: 0.7848, test_loss: 1.1484, test_f1: 0.5962
 epoch: 52, train_loss: 0.7804, test_loss: 1.2035, test_f1: 0.5869
 epoch: 53, train_loss: 0.7799, test_loss: 1.1640, test_f1: 0.5566
 epoch: 54, train_loss: 0.8084, test_loss: 1.1555, test_f1: 0.5758
 epoch: 55, train_loss: 0.8033, test_loss: 1.1997, test_f1: 0.5636
 epoch: 56, train_loss: 0.7903, test_loss: 1.2563, test_f1: 0.5218
 epoch: 57, train_loss: 0.7789, test_loss: 1.1479, test_f1: 0.5691
 epoch: 58, train_loss: 0.7696, test_loss: 1.1150, test_f1: 0.5830
 epoch: 59, train_loss: 0.7790, test_loss: 1.2290, test_f1: 0.5419
 epoch: 60, train_loss: 0.7706, test_loss: 1.2518, test_f1: 0.5581
 epoch: 61, train_loss: 0.7603, test_loss: 1.2489, test_f1: 0.5314
 epoch: 62, train_loss: 0.7520, test_loss: 1.1675, test_f1: 0.5589
 epoch: 63, train_loss: 0.7357, test_loss: 1.1466, test_f1: 0.5656
 epoch: 64, train_loss: 0.7599, test_loss: 1.1283, test_f1: 0.5719
 epoch: 65, train_loss: 0.7600, test_loss: 1.1635, test_f1: 0.5925
 epoch: 66, train_loss: 0.7554, test_loss: 1.1882, test_f1: 0.5932
 epoch: 67, train_loss: 0.7586, test_loss: 1.2171, test_f1: 0.6020
 epoch: 68, train_loss: 0.7577, test_loss: 1.2474, test_f1: 0.5928
 epoch: 69, train_loss: 0.7689, test_loss: 1.0806, test_f1: 0.5805
 epoch: 70, train_loss: 0.7713, test_loss: 1.2817, test_f1: 0.5404
 epoch: 71, train_loss: 0.7509, test_loss: 1.1669, test_f1: 0.5763
 epoch: 72, train_loss: 0.7496, test_loss: 1.1771, test_f1: 0.5628
 epoch: 73, train_loss: 0.7336, test_loss: 1.2323, test_f1: 0.5847
 epoch: 74, train_loss: 0.7202, test_loss: 1.1975, test_f1: 0.6018
 epoch: 75, train_loss: 0.7335, test_loss: 1.2733, test_f1: 0.5569
 epoch: 76, train_loss: 0.7302, test_loss: 1.2905, test_f1: 0.5235
 epoch: 77, train_loss: 0.7235, test_loss: 1.3980, test_f1: 0.5967
 epoch: 78, train_loss: 0.7187, test_loss: 1.3944, test_f1: 0.5689
 epoch: 79, train_loss: 0.7289, test_loss: 1.2729, test_f1: 0.5852
 epoch: 80, train_loss: 0.7036, test_loss: 1.1774, test_f1: 0.5776
 epoch: 81, train_loss: 0.6975, test_loss: 1.1986, test_f1: 0.5489
 epoch: 82, train_loss: 0.7019, test_loss: 1.3118, test_f1: 0.5334
 epoch: 83, train_loss: 0.7012, test_loss: 1.2291, test_f1: 0.5313
 epoch: 84, train_loss: 0.6942, test_loss: 1.2284, test_f1: 0.5682
 epoch: 85, train_loss: 0.7178, test_loss: 1.3083, test_f1: 0.5777
 epoch: 86, train_loss: 0.7235, test_loss: 1.3565, test_f1: 0.5741
 epoch: 87, train_loss: 0.7064, test_loss: 1.3266, test_f1: 0.5123
 epoch: 88, train_loss: 0.6927, test_loss: 1.2619, test_f1: 0.5516
 epoch: 89, train_loss: 0.6908, test_loss: 1.2672, test_f1: 0.5311
 epoch: 90, train_loss: 0.7025, test_loss: 1.1743, test_f1: 0.5649
 epoch: 91, train_loss: 0.6986, test_loss: 1.2677, test_f1: 0.5525
 epoch: 92, train_loss: 0.6936, test_loss: 1.3919, test_f1: 0.5331
 epoch: 93, train_loss: 0.7201, test_loss: 1.2923, test_f1: 0.5368
 epoch: 94, train_loss: 0.7008, test_loss: 1.3660, test_f1: 0.5259
 epoch: 95, train_loss: 0.6861, test_loss: 1.2427, test_f1: 0.5584
 epoch: 96, train_loss: 0.6877, test_loss: 1.2781, test_f1: 0.5482
 epoch: 97, train_loss: 0.6836, test_loss: 1.3569, test_f1: 0.5204
 epoch: 98, train_loss: 0.6782, test_loss: 1.3903, test_f1: 0.5354
 epoch: 99, train_loss: 0.6887, test_loss: 1.3345, test_f1: 0.5513
##################ITERATION #8 ****************************************
 epoch: 0, train_loss: 1.3365, test_loss: 1.3134, test_f1: 0.2281
 epoch: 1, train_loss: 1.2024, test_loss: 1.2975, test_f1: 0.2281
 epoch: 2, train_loss: 1.1552, test_loss: 1.3115, test_f1: 0.2281
 epoch: 3, train_loss: 1.1248, test_loss: 1.3173, test_f1: 0.2458
 epoch: 4, train_loss: 1.0985, test_loss: 1.2589, test_f1: 0.3340
 epoch: 5, train_loss: 1.0796, test_loss: 1.1849, test_f1: 0.4330
 epoch: 6, train_loss: 1.0524, test_loss: 1.1455, test_f1: 0.3744
 epoch: 7, train_loss: 1.0374, test_loss: 1.0777, test_f1: 0.5051
 epoch: 8, train_loss: 1.0188, test_loss: 1.1215, test_f1: 0.4982
 epoch: 9, train_loss: 0.9956, test_loss: 1.0688, test_f1: 0.5210
 epoch: 10, train_loss: 0.9751, test_loss: 1.0826, test_f1: 0.4913
 epoch: 11, train_loss: 0.9570, test_loss: 1.1352, test_f1: 0.4678
 epoch: 12, train_loss: 0.9684, test_loss: 1.1103, test_f1: 0.4860
 epoch: 13, train_loss: 0.9864, test_loss: 1.0841, test_f1: 0.5072
 epoch: 14, train_loss: 0.9718, test_loss: 1.1033, test_f1: 0.5005
 epoch: 15, train_loss: 0.9670, test_loss: 1.1702, test_f1: 0.5097
 epoch: 16, train_loss: 0.9559, test_loss: 1.0523, test_f1: 0.5064
 epoch: 17, train_loss: 0.9336, test_loss: 1.0801, test_f1: 0.5074
 epoch: 18, train_loss: 0.9355, test_loss: 1.2118, test_f1: 0.5049
 epoch: 19, train_loss: 0.9173, test_loss: 1.0630, test_f1: 0.5157
 epoch: 20, train_loss: 0.9103, test_loss: 1.0753, test_f1: 0.5242
 epoch: 21, train_loss: 0.9201, test_loss: 1.1345, test_f1: 0.5274
 epoch: 22, train_loss: 0.9006, test_loss: 1.3170, test_f1: 0.4799
 epoch: 23, train_loss: 0.9036, test_loss: 1.2007, test_f1: 0.5001
 epoch: 24, train_loss: 0.8931, test_loss: 1.1276, test_f1: 0.4396
 epoch: 25, train_loss: 0.9085, test_loss: 1.0109, test_f1: 0.5205
 epoch: 26, train_loss: 0.9220, test_loss: 0.9926, test_f1: 0.5202
 epoch: 27, train_loss: 0.9053, test_loss: 1.2072, test_f1: 0.5158
 epoch: 28, train_loss: 0.9006, test_loss: 1.0371, test_f1: 0.5540
 epoch: 29, train_loss: 0.8919, test_loss: 1.0051, test_f1: 0.5483
 epoch: 30, train_loss: 0.8699, test_loss: 0.9611, test_f1: 0.5417
 epoch: 31, train_loss: 0.8711, test_loss: 0.9770, test_f1: 0.4795
 epoch: 32, train_loss: 0.8661, test_loss: 0.9376, test_f1: 0.5914
 epoch: 33, train_loss: 0.8599, test_loss: 1.0423, test_f1: 0.5662
 epoch: 34, train_loss: 0.8848, test_loss: 1.1212, test_f1: 0.5188
 epoch: 35, train_loss: 0.8998, test_loss: 1.1613, test_f1: 0.5237
 epoch: 36, train_loss: 0.8669, test_loss: 1.0777, test_f1: 0.5444
 epoch: 37, train_loss: 0.8720, test_loss: 1.0969, test_f1: 0.5442
 epoch: 38, train_loss: 0.8876, test_loss: 0.9724, test_f1: 0.5659
 epoch: 39, train_loss: 0.8750, test_loss: 1.0124, test_f1: 0.5346
 epoch: 40, train_loss: 0.9015, test_loss: 1.1347, test_f1: 0.5315
 epoch: 41, train_loss: 0.8665, test_loss: 1.0415, test_f1: 0.5377
 epoch: 42, train_loss: 0.8716, test_loss: 1.0559, test_f1: 0.5433
 epoch: 43, train_loss: 0.8627, test_loss: 1.1548, test_f1: 0.4841
 epoch: 44, train_loss: 0.8595, test_loss: 1.2172, test_f1: 0.5311
 epoch: 45, train_loss: 0.8543, test_loss: 1.0865, test_f1: 0.5751
 epoch: 46, train_loss: 0.8551, test_loss: 1.0197, test_f1: 0.5801
 epoch: 47, train_loss: 0.8463, test_loss: 0.9520, test_f1: 0.5699
 epoch: 48, train_loss: 0.8262, test_loss: 0.9798, test_f1: 0.5634
 epoch: 49, train_loss: 0.8276, test_loss: 1.0475, test_f1: 0.5288
 epoch: 50, train_loss: 0.8249, test_loss: 1.0557, test_f1: 0.5201
 epoch: 51, train_loss: 0.8123, test_loss: 1.0109, test_f1: 0.5611
 epoch: 52, train_loss: 0.8170, test_loss: 1.1013, test_f1: 0.5704
 epoch: 53, train_loss: 0.8071, test_loss: 1.1721, test_f1: 0.5005
 epoch: 54, train_loss: 0.8089, test_loss: 1.0393, test_f1: 0.5382
 epoch: 55, train_loss: 0.7816, test_loss: 1.0330, test_f1: 0.5671
 epoch: 56, train_loss: 0.7947, test_loss: 1.0434, test_f1: 0.5709
 epoch: 57, train_loss: 0.7980, test_loss: 1.0183, test_f1: 0.5668
 epoch: 58, train_loss: 0.7954, test_loss: 1.0479, test_f1: 0.5716
 epoch: 59, train_loss: 0.7767, test_loss: 1.0033, test_f1: 0.5893
 epoch: 60, train_loss: 0.7834, test_loss: 1.0147, test_f1: 0.5563
 epoch: 61, train_loss: 0.7910, test_loss: 1.1023, test_f1: 0.5420
 epoch: 62, train_loss: 0.7866, test_loss: 1.0462, test_f1: 0.5503
 epoch: 63, train_loss: 0.7893, test_loss: 1.1447, test_f1: 0.5495
 epoch: 64, train_loss: 0.7910, test_loss: 1.0756, test_f1: 0.5583
 epoch: 65, train_loss: 0.7865, test_loss: 1.0136, test_f1: 0.5703
 epoch: 66, train_loss: 0.7700, test_loss: 1.0481, test_f1: 0.5611
 epoch: 67, train_loss: 0.7825, test_loss: 1.0172, test_f1: 0.5642
 epoch: 68, train_loss: 0.7706, test_loss: 1.0725, test_f1: 0.5772
 epoch: 69, train_loss: 0.7699, test_loss: 1.0835, test_f1: 0.5652
 epoch: 70, train_loss: 0.7772, test_loss: 1.0874, test_f1: 0.5670
 epoch: 71, train_loss: 0.7992, test_loss: 1.0156, test_f1: 0.5690
 epoch: 72, train_loss: 0.7556, test_loss: 1.0038, test_f1: 0.5625
 epoch: 73, train_loss: 0.7528, test_loss: 1.1764, test_f1: 0.5574
 epoch: 74, train_loss: 0.7602, test_loss: 1.1067, test_f1: 0.5675
 epoch: 75, train_loss: 0.7842, test_loss: 1.1979, test_f1: 0.5282
 epoch: 76, train_loss: 0.7811, test_loss: 1.0280, test_f1: 0.5825
 epoch: 77, train_loss: 0.7577, test_loss: 1.0778, test_f1: 0.5849
 epoch: 78, train_loss: 0.7633, test_loss: 1.0861, test_f1: 0.5657
 epoch: 79, train_loss: 0.7676, test_loss: 1.0701, test_f1: 0.6012
 epoch: 80, train_loss: 0.7638, test_loss: 0.9565, test_f1: 0.5985
 epoch: 81, train_loss: 0.7596, test_loss: 0.9631, test_f1: 0.5788
 epoch: 82, train_loss: 0.7274, test_loss: 1.0214, test_f1: 0.5641
 epoch: 83, train_loss: 0.7462, test_loss: 1.1415, test_f1: 0.5697
 epoch: 84, train_loss: 0.7975, test_loss: 1.2639, test_f1: 0.5563
 epoch: 85, train_loss: 0.7932, test_loss: 1.0497, test_f1: 0.5873
 epoch: 86, train_loss: 0.7832, test_loss: 1.1368, test_f1: 0.4962
 epoch: 87, train_loss: 0.7532, test_loss: 1.0388, test_f1: 0.5762
 epoch: 88, train_loss: 0.7854, test_loss: 0.9867, test_f1: 0.6040
 epoch: 89, train_loss: 0.7736, test_loss: 1.0306, test_f1: 0.5324
 epoch: 90, train_loss: 0.7737, test_loss: 1.0454, test_f1: 0.5750
 epoch: 91, train_loss: 0.7489, test_loss: 1.2199, test_f1: 0.5379
 epoch: 92, train_loss: 0.7798, test_loss: 1.0738, test_f1: 0.5466
 epoch: 93, train_loss: 0.8104, test_loss: 1.2415, test_f1: 0.4769
 epoch: 94, train_loss: 0.7804, test_loss: 1.0132, test_f1: 0.5651
 epoch: 95, train_loss: 0.7617, test_loss: 1.0395, test_f1: 0.5881
 epoch: 96, train_loss: 0.7519, test_loss: 1.1352, test_f1: 0.5911
 epoch: 97, train_loss: 0.7343, test_loss: 1.1352, test_f1: 0.5600
 epoch: 98, train_loss: 0.7274, test_loss: 1.1424, test_f1: 0.5221
 epoch: 99, train_loss: 0.7185, test_loss: 1.0773, test_f1: 0.5969
##################ITERATION #9 ****************************************
 epoch: 0, train_loss: 1.4407, test_loss: 1.6072, test_f1: 0.1374
 epoch: 1, train_loss: 1.1582, test_loss: 1.4624, test_f1: 0.3192
 epoch: 2, train_loss: 1.0932, test_loss: 1.4107, test_f1: 0.3454
 epoch: 3, train_loss: 1.0984, test_loss: 1.3306, test_f1: 0.3240
 epoch: 4, train_loss: 1.0631, test_loss: 1.2260, test_f1: 0.3250
 epoch: 5, train_loss: 1.0441, test_loss: 1.1661, test_f1: 0.3646
 epoch: 6, train_loss: 1.0336, test_loss: 1.1625, test_f1: 0.4055
 epoch: 7, train_loss: 1.0032, test_loss: 1.1080, test_f1: 0.4750
 epoch: 8, train_loss: 0.9941, test_loss: 1.0752, test_f1: 0.5060
 epoch: 9, train_loss: 0.9734, test_loss: 1.0926, test_f1: 0.4026
 epoch: 10, train_loss: 0.9856, test_loss: 1.0643, test_f1: 0.4722
 epoch: 11, train_loss: 0.9576, test_loss: 1.0654, test_f1: 0.4833
 epoch: 12, train_loss: 0.9486, test_loss: 1.0433, test_f1: 0.5537
 epoch: 13, train_loss: 0.9618, test_loss: 1.0875, test_f1: 0.5333
 epoch: 14, train_loss: 0.9322, test_loss: 1.0396, test_f1: 0.5193
 epoch: 15, train_loss: 0.9433, test_loss: 1.1169, test_f1: 0.5069
 epoch: 16, train_loss: 0.9391, test_loss: 1.0695, test_f1: 0.5398
 epoch: 17, train_loss: 0.9464, test_loss: 1.0978, test_f1: 0.5433
 epoch: 18, train_loss: 0.9084, test_loss: 1.0562, test_f1: 0.5164
 epoch: 19, train_loss: 0.9514, test_loss: 1.2642, test_f1: 0.3783
 epoch: 20, train_loss: 0.9552, test_loss: 1.1144, test_f1: 0.5007
 epoch: 21, train_loss: 0.9284, test_loss: 1.1436, test_f1: 0.5225
 epoch: 22, train_loss: 0.9056, test_loss: 1.1454, test_f1: 0.5238
 epoch: 23, train_loss: 0.9088, test_loss: 1.1094, test_f1: 0.5092
 epoch: 24, train_loss: 0.9148, test_loss: 1.1287, test_f1: 0.4604
 epoch: 25, train_loss: 0.9536, test_loss: 1.0745, test_f1: 0.4595
 epoch: 26, train_loss: 0.9197, test_loss: 1.6963, test_f1: 0.3574
 epoch: 27, train_loss: 0.9235, test_loss: 1.1799, test_f1: 0.4405
 epoch: 28, train_loss: 0.8942, test_loss: 1.1728, test_f1: 0.4850
 epoch: 29, train_loss: 0.9153, test_loss: 1.1949, test_f1: 0.5061
 epoch: 30, train_loss: 0.8983, test_loss: 1.1134, test_f1: 0.5677
 epoch: 31, train_loss: 0.8806, test_loss: 1.1171, test_f1: 0.5395
 epoch: 32, train_loss: 0.8632, test_loss: 1.0975, test_f1: 0.5487
 epoch: 33, train_loss: 0.8572, test_loss: 1.0391, test_f1: 0.5710
 epoch: 34, train_loss: 0.8634, test_loss: 1.0564, test_f1: 0.5375
 epoch: 35, train_loss: 0.8500, test_loss: 1.0432, test_f1: 0.5632
 epoch: 36, train_loss: 0.8633, test_loss: 1.0355, test_f1: 0.5316
 epoch: 37, train_loss: 0.8414, test_loss: 1.1500, test_f1: 0.5259
 epoch: 38, train_loss: 0.8491, test_loss: 1.1344, test_f1: 0.5639
 epoch: 39, train_loss: 0.8265, test_loss: 1.2295, test_f1: 0.5167
 epoch: 40, train_loss: 0.8442, test_loss: 1.1316, test_f1: 0.5553
 epoch: 41, train_loss: 0.8446, test_loss: 1.1253, test_f1: 0.5453
 epoch: 42, train_loss: 0.8663, test_loss: 1.2231, test_f1: 0.4825
 epoch: 43, train_loss: 0.9239, test_loss: 1.1678, test_f1: 0.4198
 epoch: 44, train_loss: 0.9053, test_loss: 1.5343, test_f1: 0.3096
 epoch: 45, train_loss: 0.8623, test_loss: 1.3525, test_f1: 0.3731
 epoch: 46, train_loss: 0.8671, test_loss: 1.0473, test_f1: 0.5822
 epoch: 47, train_loss: 0.8624, test_loss: 1.0783, test_f1: 0.5660
 epoch: 48, train_loss: 0.8698, test_loss: 1.1287, test_f1: 0.5407
 epoch: 49, train_loss: 0.8369, test_loss: 1.1099, test_f1: 0.5651
 epoch: 50, train_loss: 0.8237, test_loss: 1.1159, test_f1: 0.5401
 epoch: 51, train_loss: 0.8201, test_loss: 1.1116, test_f1: 0.5269
 epoch: 52, train_loss: 0.8078, test_loss: 1.0807, test_f1: 0.5699
 epoch: 53, train_loss: 0.8173, test_loss: 1.0590, test_f1: 0.5879
 epoch: 54, train_loss: 0.8041, test_loss: 1.0201, test_f1: 0.6055
 epoch: 55, train_loss: 0.7958, test_loss: 1.0256, test_f1: 0.5987
 epoch: 56, train_loss: 0.8111, test_loss: 1.0472, test_f1: 0.5478
 epoch: 57, train_loss: 0.8016, test_loss: 1.0344, test_f1: 0.5815
 epoch: 58, train_loss: 0.7952, test_loss: 1.1453, test_f1: 0.5233
 epoch: 59, train_loss: 0.7820, test_loss: 1.1306, test_f1: 0.5356
 epoch: 60, train_loss: 0.7923, test_loss: 1.0757, test_f1: 0.5979
 epoch: 61, train_loss: 0.7700, test_loss: 1.0857, test_f1: 0.5897
 epoch: 62, train_loss: 0.7686, test_loss: 1.0527, test_f1: 0.5979
 epoch: 63, train_loss: 0.7621, test_loss: 1.1067, test_f1: 0.5846
 epoch: 64, train_loss: 0.7696, test_loss: 1.1452, test_f1: 0.5714
 epoch: 65, train_loss: 0.7729, test_loss: 1.1922, test_f1: 0.5366
 epoch: 66, train_loss: 0.7685, test_loss: 1.0523, test_f1: 0.6041
 epoch: 67, train_loss: 0.7626, test_loss: 1.1207, test_f1: 0.5602
 epoch: 68, train_loss: 0.7597, test_loss: 1.0887, test_f1: 0.5454
 epoch: 69, train_loss: 0.7693, test_loss: 1.0731, test_f1: 0.5925
 epoch: 70, train_loss: 0.7454, test_loss: 1.0801, test_f1: 0.5999
 epoch: 71, train_loss: 0.7546, test_loss: 1.1432, test_f1: 0.5471
 epoch: 72, train_loss: 0.7633, test_loss: 1.1297, test_f1: 0.5697
 epoch: 73, train_loss: 0.7622, test_loss: 1.1610, test_f1: 0.5658
 epoch: 74, train_loss: 0.7477, test_loss: 1.1197, test_f1: 0.5668
 epoch: 75, train_loss: 0.7403, test_loss: 1.1324, test_f1: 0.5853
 epoch: 76, train_loss: 0.7589, test_loss: 1.1410, test_f1: 0.5823
 epoch: 77, train_loss: 0.7648, test_loss: 1.1974, test_f1: 0.5210
 epoch: 78, train_loss: 0.7792, test_loss: 1.1751, test_f1: 0.5344
 epoch: 79, train_loss: 0.7624, test_loss: 1.0264, test_f1: 0.5661
 epoch: 80, train_loss: 0.7668, test_loss: 1.1226, test_f1: 0.5974
 epoch: 81, train_loss: 0.7627, test_loss: 1.1163, test_f1: 0.5822
 epoch: 82, train_loss: 0.7399, test_loss: 1.1674, test_f1: 0.4966
 epoch: 83, train_loss: 0.7452, test_loss: 1.1176, test_f1: 0.5220
 epoch: 84, train_loss: 0.7198, test_loss: 1.1556, test_f1: 0.5714
 epoch: 85, train_loss: 0.7263, test_loss: 1.0887, test_f1: 0.5905
 epoch: 86, train_loss: 0.7445, test_loss: 1.1016, test_f1: 0.5846
 epoch: 87, train_loss: 0.7353, test_loss: 1.1015, test_f1: 0.5838
 epoch: 88, train_loss: 0.7315, test_loss: 1.1332, test_f1: 0.5620
 epoch: 89, train_loss: 0.7315, test_loss: 1.1088, test_f1: 0.5460
 epoch: 90, train_loss: 0.7235, test_loss: 1.0886, test_f1: 0.5711
 epoch: 91, train_loss: 0.7205, test_loss: 1.0402, test_f1: 0.5825
 epoch: 92, train_loss: 0.7406, test_loss: 1.0758, test_f1: 0.5858
 epoch: 93, train_loss: 0.7343, test_loss: 1.2183, test_f1: 0.5442
 epoch: 94, train_loss: 0.7317, test_loss: 1.1788, test_f1: 0.5680
 epoch: 95, train_loss: 0.7179, test_loss: 1.2017, test_f1: 0.5759
 epoch: 96, train_loss: 0.7209, test_loss: 1.2453, test_f1: 0.5638
 epoch: 97, train_loss: 0.7129, test_loss: 1.2438, test_f1: 0.5669
 epoch: 98, train_loss: 0.7228, test_loss: 1.1709, test_f1: 0.6007
 epoch: 99, train_loss: 0.7283, test_loss: 1.2101, test_f1: 0.5600

Training completed in 353.49 seconds
Best F1: 0.6449 at epoch 86
Mean F1 across iterations: 0.6116  0.0183
========================FINAL RESULTS================================
FEGIN weighted F1: 0.6449  0.0183
python main.py --data ltspice_demos --representation component_net --model FEGIN --layers 3 --hiddens 16 --batch_size 256 --lr 0.01 --emb_size 250 --epochs 100 --save_appendix component_net_L3_H16_BS256_LR0.01_E250 --no_val
-----



STDERR:
  File "main.py", line 370, in <module>
    main()
  File "main.py", line 254, in main
    dataset = dataset_class(
  File "/home/philip/projects/ltspice_examples_code_repo/Circuit-Completion-Using-GNNs/component_classification_with_link_prediction_head/evaluation/FEGIN/kernel/circuit_datasets.py", line 15, in __init__
    self.data, self.slices = torch.load(self.processed_paths[0])
  File "/home/philip/.local/lib/python3.8/site-packages/torch/serialization.py", line 1040, in load
    warnings.warn(
  File "/usr/lib/python3.8/warnings.py", line 109, in _showwarnmsg
    sw(msg.message, msg.category, msg.filename, msg.lineno,
  File "main.py", line 47, in warn_with_traceback
    traceback.print_stack(file=log)
/home/philip/projects/ltspice_examples_code_repo/Circuit-Completion-Using-GNNs/component_classification_with_link_prediction_head/evaluation/FEGIN/kernel/circuit_datasets.py:15: FutureWarning: You are using `torch.load` with `weights_only=False` (the current default value), which uses the default pickle module implicitly. It is possible to construct malicious pickle data which will execute arbitrary code during unpickling (See https://github.com/pytorch/pytorch/blob/main/SECURITY.md#untrusted-models for more details). In a future release, the default value for `weights_only` will be flipped to `True`. This limits the functions that could be executed during unpickling. Arbitrary objects will no longer be allowed to be loaded via this mode unless they are explicitly allowlisted by the user via `torch.serialization.add_safe_globals`. We recommend you start setting `weights_only=True` for any use case where you don't have full control of the loaded file. Please open an issue on GitHub for any issues related to this experimental feature.
  self.data, self.slices = torch.load(self.processed_paths[0])
