STDOUT:
Results will be saved in /home/philip/projects/ltspice_examples_code_repo/Circuit-Completion-Using-GNNs/component_classification_with_link_prediction_head/evaluation/FEGIN/results/model_FEGIN_dataset_ltspice_demos
Command line input: python main.py --data ltspice_demos --representation component_pin_net --model FEGIN --layers 2 --hiddens 64 --batch_size 256 --lr 0.1 --emb_size 512 --epochs 100 --save_appendix component_pin_net_L2_H64_BS256_LR0.1_E512 --no_val
 is saved.
-----
ltspice_demos - FEGIN
Using 2 layers, 64 hidden units, h = 2
Loading component_pin_net representation dataset
ENTERED
Training FEGIN on component_pin_net representation
Train: 1565, Test: 383
##################ITERATION #0 ****************************************
 epoch: 0, train_loss: 5.0268, test_loss: 1.3044, test_f1: 0.2281
 epoch: 1, train_loss: 1.2973, test_loss: 1.3097, test_f1: 0.2281
 epoch: 2, train_loss: 1.2586, test_loss: 1.3161, test_f1: 0.2281
 epoch: 3, train_loss: 1.2539, test_loss: 1.3065, test_f1: 0.2281
 epoch: 4, train_loss: 1.2540, test_loss: 1.3029, test_f1: 0.2281
 epoch: 5, train_loss: 1.2536, test_loss: 1.3049, test_f1: 0.2281
 epoch: 6, train_loss: 1.2522, test_loss: 1.3059, test_f1: 0.2281
 epoch: 7, train_loss: 1.2545, test_loss: 1.3098, test_f1: 0.2281
 epoch: 8, train_loss: 1.2544, test_loss: 1.3112, test_f1: 0.2281
 epoch: 9, train_loss: 1.2540, test_loss: 1.3068, test_f1: 0.2281
 epoch: 10, train_loss: 1.2533, test_loss: 1.3015, test_f1: 0.2281
 epoch: 11, train_loss: 1.2539, test_loss: 1.3051, test_f1: 0.2281
 epoch: 12, train_loss: 1.2547, test_loss: 1.3005, test_f1: 0.2281
 epoch: 13, train_loss: 1.2536, test_loss: 1.3166, test_f1: 0.2281
 epoch: 14, train_loss: 1.2546, test_loss: 1.3043, test_f1: 0.2281
 epoch: 15, train_loss: 1.2528, test_loss: 1.2998, test_f1: 0.2281
 epoch: 16, train_loss: 1.2544, test_loss: 1.3037, test_f1: 0.2281
 epoch: 17, train_loss: 1.2528, test_loss: 1.3094, test_f1: 0.2281
 epoch: 18, train_loss: 1.2548, test_loss: 1.3090, test_f1: 0.2281
 epoch: 19, train_loss: 1.2541, test_loss: 1.2982, test_f1: 0.2281
 epoch: 20, train_loss: 1.2557, test_loss: 1.3042, test_f1: 0.2281
 epoch: 21, train_loss: 1.2556, test_loss: 1.3122, test_f1: 0.2281
 epoch: 22, train_loss: 1.2548, test_loss: 1.3119, test_f1: 0.2281
 epoch: 23, train_loss: 1.2535, test_loss: 1.3085, test_f1: 0.2281
 epoch: 24, train_loss: 1.2525, test_loss: 1.3061, test_f1: 0.2281
 epoch: 25, train_loss: 1.2533, test_loss: 1.3033, test_f1: 0.2281
 epoch: 26, train_loss: 1.2528, test_loss: 1.3049, test_f1: 0.2281
 epoch: 27, train_loss: 1.2519, test_loss: 1.3090, test_f1: 0.2281
 epoch: 28, train_loss: 1.2544, test_loss: 1.3055, test_f1: 0.2281
 epoch: 29, train_loss: 1.2528, test_loss: 1.3077, test_f1: 0.2281
 epoch: 30, train_loss: 1.2529, test_loss: 1.3086, test_f1: 0.2281
 epoch: 31, train_loss: 1.2544, test_loss: 1.3127, test_f1: 0.2281
 epoch: 32, train_loss: 1.2545, test_loss: 1.3083, test_f1: 0.2281
 epoch: 33, train_loss: 1.2534, test_loss: 1.3065, test_f1: 0.2281
 epoch: 34, train_loss: 1.2541, test_loss: 1.3143, test_f1: 0.2281
 epoch: 35, train_loss: 1.2543, test_loss: 1.3031, test_f1: 0.2281
 epoch: 36, train_loss: 1.2527, test_loss: 1.3083, test_f1: 0.2281
 epoch: 37, train_loss: 1.2534, test_loss: 1.3110, test_f1: 0.2281
 epoch: 38, train_loss: 1.2527, test_loss: 1.3052, test_f1: 0.2281
 epoch: 39, train_loss: 1.2529, test_loss: 1.3031, test_f1: 0.2281
 epoch: 40, train_loss: 1.2541, test_loss: 1.3064, test_f1: 0.2281
 epoch: 41, train_loss: 1.2531, test_loss: 1.3000, test_f1: 0.2281
 epoch: 42, train_loss: 1.2551, test_loss: 1.2992, test_f1: 0.2281
 epoch: 43, train_loss: 1.2536, test_loss: 1.3072, test_f1: 0.2281
 epoch: 44, train_loss: 1.2522, test_loss: 1.3093, test_f1: 0.2281
 epoch: 45, train_loss: 1.2543, test_loss: 1.3088, test_f1: 0.2281
 epoch: 46, train_loss: 1.2558, test_loss: 1.2993, test_f1: 0.2281
 epoch: 47, train_loss: 1.2537, test_loss: 1.3081, test_f1: 0.2281
 epoch: 48, train_loss: 1.2546, test_loss: 1.3075, test_f1: 0.2281
 epoch: 49, train_loss: 1.2537, test_loss: 1.3071, test_f1: 0.2281
 epoch: 50, train_loss: 1.2533, test_loss: 1.3103, test_f1: 0.2281
 epoch: 51, train_loss: 1.2545, test_loss: 1.3102, test_f1: 0.2281
 epoch: 52, train_loss: 1.2532, test_loss: 1.3042, test_f1: 0.2281
 epoch: 53, train_loss: 1.2538, test_loss: 1.3014, test_f1: 0.2281
 epoch: 54, train_loss: 1.2593, test_loss: 1.3014, test_f1: 0.2281
 epoch: 55, train_loss: 1.2562, test_loss: 1.3039, test_f1: 0.2281
 epoch: 56, train_loss: 1.2524, test_loss: 1.3121, test_f1: 0.2281
 epoch: 57, train_loss: 1.2547, test_loss: 1.3160, test_f1: 0.2281
 epoch: 58, train_loss: 1.2545, test_loss: 1.3078, test_f1: 0.2281
 epoch: 59, train_loss: 1.2527, test_loss: 1.3008, test_f1: 0.2281
 epoch: 60, train_loss: 1.2525, test_loss: 1.3024, test_f1: 0.2281
 epoch: 61, train_loss: 1.2526, test_loss: 1.3053, test_f1: 0.2281
 epoch: 62, train_loss: 1.2532, test_loss: 1.3067, test_f1: 0.2281
 epoch: 63, train_loss: 1.2525, test_loss: 1.3038, test_f1: 0.2281
 epoch: 64, train_loss: 1.2529, test_loss: 1.3001, test_f1: 0.2281
 epoch: 65, train_loss: 1.2526, test_loss: 1.3024, test_f1: 0.2281
 epoch: 66, train_loss: 1.2528, test_loss: 1.3062, test_f1: 0.2281
 epoch: 67, train_loss: 1.2536, test_loss: 1.3075, test_f1: 0.2281
 epoch: 68, train_loss: 1.2535, test_loss: 1.3068, test_f1: 0.2281
 epoch: 69, train_loss: 1.2525, test_loss: 1.3047, test_f1: 0.2281
 epoch: 70, train_loss: 1.2525, test_loss: 1.3073, test_f1: 0.2281
 epoch: 71, train_loss: 1.2526, test_loss: 1.3081, test_f1: 0.2281
 epoch: 72, train_loss: 1.2523, test_loss: 1.3057, test_f1: 0.2281
 epoch: 73, train_loss: 1.2521, test_loss: 1.3063, test_f1: 0.2281
 epoch: 74, train_loss: 1.2526, test_loss: 1.3106, test_f1: 0.2281
 epoch: 75, train_loss: 1.2535, test_loss: 1.3140, test_f1: 0.2281
 epoch: 76, train_loss: 1.2535, test_loss: 1.3089, test_f1: 0.2281
 epoch: 77, train_loss: 1.2529, test_loss: 1.3068, test_f1: 0.2281
 epoch: 78, train_loss: 1.2525, test_loss: 1.3030, test_f1: 0.2281
 epoch: 79, train_loss: 1.2522, test_loss: 1.3043, test_f1: 0.2281
 epoch: 80, train_loss: 1.2526, test_loss: 1.3070, test_f1: 0.2281
 epoch: 81, train_loss: 1.2525, test_loss: 1.3044, test_f1: 0.2281
 epoch: 82, train_loss: 1.2525, test_loss: 1.3020, test_f1: 0.2281
 epoch: 83, train_loss: 1.2527, test_loss: 1.3044, test_f1: 0.2281
 epoch: 84, train_loss: 1.2523, test_loss: 1.3039, test_f1: 0.2281
 epoch: 85, train_loss: 1.2523, test_loss: 1.3061, test_f1: 0.2281
 epoch: 86, train_loss: 1.2523, test_loss: 1.3067, test_f1: 0.2281
 epoch: 87, train_loss: 1.2526, test_loss: 1.3051, test_f1: 0.2281
 epoch: 88, train_loss: 1.2527, test_loss: 1.3031, test_f1: 0.2281
 epoch: 89, train_loss: 1.2525, test_loss: 1.3030, test_f1: 0.2281
 epoch: 90, train_loss: 1.2529, test_loss: 1.3066, test_f1: 0.2281
 epoch: 91, train_loss: 1.2527, test_loss: 1.3098, test_f1: 0.2281
 epoch: 92, train_loss: 1.2532, test_loss: 1.3100, test_f1: 0.2281
 epoch: 93, train_loss: 1.2524, test_loss: 1.3043, test_f1: 0.2281
 epoch: 94, train_loss: 1.2529, test_loss: 1.3032, test_f1: 0.2281
 epoch: 95, train_loss: 1.2528, test_loss: 1.3044, test_f1: 0.2281
 epoch: 96, train_loss: 1.2525, test_loss: 1.3032, test_f1: 0.2281
 epoch: 97, train_loss: 1.2523, test_loss: 1.3040, test_f1: 0.2281
 epoch: 98, train_loss: 1.2527, test_loss: 1.3043, test_f1: 0.2281
 epoch: 99, train_loss: 1.2525, test_loss: 1.3072, test_f1: 0.2281
##################ITERATION #1 ****************************************
 epoch: 0, train_loss: 10.1998, test_loss: 22.8455, test_f1: 0.0507
 epoch: 1, train_loss: 1.6716, test_loss: 1.7154, test_f1: 0.2350
 epoch: 2, train_loss: 1.2611, test_loss: 1.2715, test_f1: 0.2763
 epoch: 3, train_loss: 1.1896, test_loss: 1.1639, test_f1: 0.3267
 epoch: 4, train_loss: 1.1203, test_loss: 1.1430, test_f1: 0.3344
 epoch: 5, train_loss: 1.0742, test_loss: 1.1513, test_f1: 0.3290
 epoch: 6, train_loss: 1.0577, test_loss: 1.2058, test_f1: 0.3234
 epoch: 7, train_loss: 1.0499, test_loss: 1.1700, test_f1: 0.3262
 epoch: 8, train_loss: 1.0451, test_loss: 1.1413, test_f1: 0.3290
 epoch: 9, train_loss: 1.0411, test_loss: 1.1504, test_f1: 0.3290
 epoch: 10, train_loss: 1.0512, test_loss: 1.1610, test_f1: 0.2394
 epoch: 11, train_loss: 1.0538, test_loss: 1.1465, test_f1: 0.3317
 epoch: 12, train_loss: 1.0413, test_loss: 1.1385, test_f1: 0.3490
 epoch: 13, train_loss: 1.0535, test_loss: 1.1549, test_f1: 0.3446
 epoch: 14, train_loss: 1.0720, test_loss: 1.1519, test_f1: 0.3344
 epoch: 15, train_loss: 1.0503, test_loss: 1.0823, test_f1: 0.4450
 epoch: 16, train_loss: 1.0367, test_loss: 1.0829, test_f1: 0.3536
 epoch: 17, train_loss: 1.0171, test_loss: 1.0840, test_f1: 0.3560
 epoch: 18, train_loss: 1.0267, test_loss: 1.0899, test_f1: 0.3420
 epoch: 19, train_loss: 1.0378, test_loss: 1.1341, test_f1: 0.3344
 epoch: 20, train_loss: 1.0303, test_loss: 1.0971, test_f1: 0.3395
 epoch: 21, train_loss: 1.0185, test_loss: 47.4197, test_f1: 0.2293
 epoch: 22, train_loss: 1.0263, test_loss: 1.0916, test_f1: 0.3459
 epoch: 23, train_loss: 1.0194, test_loss: 1.1010, test_f1: 0.4012
 epoch: 24, train_loss: 1.0287, test_loss: 1.1232, test_f1: 0.3353
 epoch: 25, train_loss: 1.0097, test_loss: 1.1296, test_f1: 0.3353
 epoch: 26, train_loss: 1.0106, test_loss: 1.1633, test_f1: 0.4376
 epoch: 27, train_loss: 0.9955, test_loss: 1.1202, test_f1: 0.5006
 epoch: 28, train_loss: 1.1288, test_loss: 1.1498, test_f1: 0.3202
 epoch: 29, train_loss: 1.1341, test_loss: 1.0756, test_f1: 0.3876
 epoch: 30, train_loss: 1.1012, test_loss: 1.0569, test_f1: 0.4102
 epoch: 31, train_loss: 1.0743, test_loss: 1.1007, test_f1: 0.3686
 epoch: 32, train_loss: 1.0313, test_loss: 1.0385, test_f1: 0.4207
 epoch: 33, train_loss: 0.9930, test_loss: 1.0610, test_f1: 0.4153
 epoch: 34, train_loss: 0.9726, test_loss: 1.0983, test_f1: 0.4060
 epoch: 35, train_loss: 1.0057, test_loss: 1.1490, test_f1: 0.3750
 epoch: 36, train_loss: 0.9794, test_loss: 1.0936, test_f1: 0.4040
 epoch: 37, train_loss: 0.9604, test_loss: 1.1272, test_f1: 0.3973
 epoch: 38, train_loss: 0.9563, test_loss: 1.0885, test_f1: 0.3346
 epoch: 39, train_loss: 0.9988, test_loss: 1.0667, test_f1: 0.4181
 epoch: 40, train_loss: 0.9779, test_loss: 1.0230, test_f1: 0.4279
 epoch: 41, train_loss: 0.9637, test_loss: 1.3012, test_f1: 0.4061
 epoch: 42, train_loss: 1.1006, test_loss: 1.6140, test_f1: 0.2949
 epoch: 43, train_loss: 1.0508, test_loss: 1.1523, test_f1: 0.3326
 epoch: 44, train_loss: 1.0336, test_loss: 1.1086, test_f1: 0.3370
 epoch: 45, train_loss: 1.0158, test_loss: 1.0952, test_f1: 0.3421
 epoch: 46, train_loss: 0.9940, test_loss: 1.0480, test_f1: 0.4126
 epoch: 47, train_loss: 1.0116, test_loss: 1.1145, test_f1: 0.3538
 epoch: 48, train_loss: 1.0094, test_loss: 1.1089, test_f1: 0.3708
 epoch: 49, train_loss: 0.9842, test_loss: 1.0326, test_f1: 0.4088
 epoch: 50, train_loss: 0.9860, test_loss: 1.0872, test_f1: 0.4628
 epoch: 51, train_loss: 0.9736, test_loss: 1.1015, test_f1: 0.3974
 epoch: 52, train_loss: 0.9740, test_loss: 1.0876, test_f1: 0.4015
 epoch: 53, train_loss: 0.9644, test_loss: 1.0611, test_f1: 0.4055
 epoch: 54, train_loss: 0.9688, test_loss: 1.0678, test_f1: 0.4944
 epoch: 55, train_loss: 0.9673, test_loss: 1.0880, test_f1: 0.4733
 epoch: 56, train_loss: 0.9609, test_loss: 1.0054, test_f1: 0.5570
 epoch: 57, train_loss: 0.9607, test_loss: 1.0307, test_f1: 0.4063
 epoch: 58, train_loss: 0.9564, test_loss: 0.9998, test_f1: 0.4192
 epoch: 59, train_loss: 0.9336, test_loss: 0.9997, test_f1: 0.4276
 epoch: 60, train_loss: 0.9392, test_loss: 1.0128, test_f1: 0.5088
 epoch: 61, train_loss: 0.9395, test_loss: 0.9811, test_f1: 0.5556
 epoch: 62, train_loss: 0.9438, test_loss: 0.9952, test_f1: 0.5509
 epoch: 63, train_loss: 0.9549, test_loss: 1.0436, test_f1: 0.4607
 epoch: 64, train_loss: 0.9518, test_loss: 1.0504, test_f1: 0.4234
 epoch: 65, train_loss: 0.9557, test_loss: 1.0164, test_f1: 0.4296
 epoch: 66, train_loss: 0.9559, test_loss: 1.0809, test_f1: 0.4213
 epoch: 67, train_loss: 0.9366, test_loss: 1.0595, test_f1: 0.4992
 epoch: 68, train_loss: 0.9212, test_loss: 1.0210, test_f1: 0.5393
 epoch: 69, train_loss: 0.9269, test_loss: 0.9962, test_f1: 0.4286
 epoch: 70, train_loss: 0.9292, test_loss: 0.9994, test_f1: 0.4221
 epoch: 71, train_loss: 0.9377, test_loss: 0.9981, test_f1: 0.4263
 epoch: 72, train_loss: 0.9340, test_loss: 1.0107, test_f1: 0.4236
 epoch: 73, train_loss: 0.9394, test_loss: 1.0451, test_f1: 0.4207
 epoch: 74, train_loss: 0.9250, test_loss: 1.1328, test_f1: 0.4186
 epoch: 75, train_loss: 0.9172, test_loss: 1.1399, test_f1: 0.4693
 epoch: 76, train_loss: 0.9422, test_loss: 1.0806, test_f1: 0.5467
 epoch: 77, train_loss: 0.9339, test_loss: 1.0468, test_f1: 0.5398
 epoch: 78, train_loss: 0.9152, test_loss: 1.0041, test_f1: 0.4285
 epoch: 79, train_loss: 0.9189, test_loss: 1.0973, test_f1: 0.4207
 epoch: 80, train_loss: 0.9489, test_loss: 1.1861, test_f1: 0.3783
 epoch: 81, train_loss: 0.9378, test_loss: 1.0768, test_f1: 0.4821
 epoch: 82, train_loss: 0.9450, test_loss: 0.9978, test_f1: 0.5392
 epoch: 83, train_loss: 0.9356, test_loss: 1.0711, test_f1: 0.5120
 epoch: 84, train_loss: 0.9397, test_loss: 1.1612, test_f1: 0.4448
 epoch: 85, train_loss: 0.9383, test_loss: 1.0007, test_f1: 0.4158
 epoch: 86, train_loss: 0.9303, test_loss: 0.9775, test_f1: 0.4249
 epoch: 87, train_loss: 0.9234, test_loss: 0.9902, test_f1: 0.5575
 epoch: 88, train_loss: 0.9237, test_loss: 0.9855, test_f1: 0.5587
 epoch: 89, train_loss: 0.9300, test_loss: 1.0778, test_f1: 0.4148
 epoch: 90, train_loss: 0.9443, test_loss: 1.0439, test_f1: 0.5057
 epoch: 91, train_loss: 0.9364, test_loss: 1.0279, test_f1: 0.4912
 epoch: 92, train_loss: 0.9322, test_loss: 1.0007, test_f1: 0.4937
 epoch: 93, train_loss: 0.9284, test_loss: 1.0592, test_f1: 0.4966
 epoch: 94, train_loss: 0.9296, test_loss: 1.0163, test_f1: 0.5334
 epoch: 95, train_loss: 0.9313, test_loss: 0.9823, test_f1: 0.5031
 epoch: 96, train_loss: 0.9451, test_loss: 1.0490, test_f1: 0.4303
 epoch: 97, train_loss: 0.9301, test_loss: 0.9892, test_f1: 0.5226
 epoch: 98, train_loss: 0.9285, test_loss: 0.9847, test_f1: 0.4334
 epoch: 99, train_loss: 0.9475, test_loss: 1.0758, test_f1: 0.4207
##################ITERATION #2 ****************************************
 epoch: 0, train_loss: 9.0873, test_loss: 13.4760, test_f1: 0.1365
 epoch: 1, train_loss: 1.3456, test_loss: 1.3823, test_f1: 0.2281
 epoch: 2, train_loss: 1.3007, test_loss: 1.3105, test_f1: 0.2281
 epoch: 3, train_loss: 1.1915, test_loss: 1.3333, test_f1: 0.2302
 epoch: 4, train_loss: 1.1260, test_loss: 1.3154, test_f1: 0.2285
 epoch: 5, train_loss: 1.1050, test_loss: 1.2134, test_f1: 0.3205
 epoch: 6, train_loss: 1.0750, test_loss: 1.2016, test_f1: 0.3262
 epoch: 7, train_loss: 1.0819, test_loss: 1.1936, test_f1: 0.3205
 epoch: 8, train_loss: 1.0975, test_loss: 1.1201, test_f1: 0.3395
 epoch: 9, train_loss: 1.0994, test_loss: 1.1365, test_f1: 0.3290
 epoch: 10, train_loss: 1.0867, test_loss: 1.1250, test_f1: 0.3395
 epoch: 11, train_loss: 1.0990, test_loss: 1.1244, test_f1: 0.3395
 epoch: 12, train_loss: 1.1006, test_loss: 1.1170, test_f1: 0.3395
 epoch: 13, train_loss: 1.0845, test_loss: 1.1005, test_f1: 0.3468
 epoch: 14, train_loss: 1.0760, test_loss: 1.1077, test_f1: 0.3444
 epoch: 15, train_loss: 1.0747, test_loss: 1.1283, test_f1: 0.3344
 epoch: 16, train_loss: 1.0978, test_loss: 1.1848, test_f1: 0.3176
 epoch: 17, train_loss: 1.0882, test_loss: 1.2650, test_f1: 0.2799
 epoch: 18, train_loss: 1.0743, test_loss: 1.2230, test_f1: 0.3051
 epoch: 19, train_loss: 1.0635, test_loss: 1.1584, test_f1: 0.3290
 epoch: 20, train_loss: 1.0699, test_loss: 1.1649, test_f1: 0.3092
 epoch: 21, train_loss: 1.0864, test_loss: 1.3490, test_f1: 0.2862
 epoch: 22, train_loss: 1.0563, test_loss: 1.1464, test_f1: 0.3145
 epoch: 23, train_loss: 1.0536, test_loss: 1.0888, test_f1: 0.3377
 epoch: 24, train_loss: 1.0747, test_loss: 1.0938, test_f1: 0.3468
 epoch: 25, train_loss: 1.0561, test_loss: 1.0987, test_f1: 0.3420
 epoch: 26, train_loss: 1.0639, test_loss: 1.1408, test_f1: 0.3317
 epoch: 27, train_loss: 1.0710, test_loss: 1.1539, test_f1: 0.3317
 epoch: 28, train_loss: 1.1048, test_loss: 1.3412, test_f1: 0.2441
 epoch: 29, train_loss: 1.0985, test_loss: 1.1875, test_f1: 0.3146
 epoch: 30, train_loss: 1.0654, test_loss: 1.1523, test_f1: 0.3317
 epoch: 31, train_loss: 1.0882, test_loss: 1.1050, test_f1: 0.3354
 epoch: 32, train_loss: 1.1323, test_loss: 1.2017, test_f1: 0.3083
 epoch: 33, train_loss: 1.0913, test_loss: 1.1336, test_f1: 0.3317
 epoch: 34, train_loss: 1.0739, test_loss: 1.1128, test_f1: 0.3414
 epoch: 35, train_loss: 1.0780, test_loss: 1.0831, test_f1: 0.3514
 epoch: 36, train_loss: 1.0581, test_loss: 1.0915, test_f1: 0.3403
 epoch: 37, train_loss: 1.0622, test_loss: 1.1105, test_f1: 0.3395
 epoch: 38, train_loss: 1.0682, test_loss: 1.1101, test_f1: 0.3395
 epoch: 39, train_loss: 1.0621, test_loss: 1.1151, test_f1: 0.3395
 epoch: 40, train_loss: 1.0374, test_loss: 1.1480, test_f1: 0.3317
 epoch: 41, train_loss: 1.0800, test_loss: 1.2325, test_f1: 0.3056
 epoch: 42, train_loss: 1.1162, test_loss: 1.1813, test_f1: 0.3146
 epoch: 43, train_loss: 1.0535, test_loss: 1.1419, test_f1: 0.3344
 epoch: 44, train_loss: 1.0626, test_loss: 1.1467, test_f1: 0.3344
 epoch: 45, train_loss: 1.0786, test_loss: 1.1302, test_f1: 0.3395
 epoch: 46, train_loss: 1.0451, test_loss: 1.1085, test_f1: 0.3421
 epoch: 47, train_loss: 1.0552, test_loss: 1.1580, test_f1: 0.3317
 epoch: 48, train_loss: 1.0484, test_loss: 1.1433, test_f1: 0.3317
 epoch: 49, train_loss: 1.0728, test_loss: 1.1107, test_f1: 0.3461
 epoch: 50, train_loss: 1.0477, test_loss: 1.1244, test_f1: 0.3395
 epoch: 51, train_loss: 1.0541, test_loss: 1.1314, test_f1: 0.3344
 epoch: 52, train_loss: 1.0487, test_loss: 1.1272, test_f1: 0.3344
 epoch: 53, train_loss: 1.0196, test_loss: 1.1505, test_f1: 0.3322
 epoch: 54, train_loss: 1.0252, test_loss: 1.1351, test_f1: 0.3344
 epoch: 55, train_loss: 1.0393, test_loss: 1.1113, test_f1: 0.3370
 epoch: 56, train_loss: 1.0574, test_loss: 1.1088, test_f1: 0.3312
 epoch: 57, train_loss: 1.0657, test_loss: 1.1018, test_f1: 0.3397
 epoch: 58, train_loss: 1.0645, test_loss: 1.1417, test_f1: 0.3317
 epoch: 59, train_loss: 1.0480, test_loss: 1.1253, test_f1: 0.3372
 epoch: 60, train_loss: 1.0470, test_loss: 1.1268, test_f1: 0.3346
 epoch: 61, train_loss: 1.0253, test_loss: 1.1138, test_f1: 0.3346
 epoch: 62, train_loss: 1.0399, test_loss: 1.1039, test_f1: 0.3346
 epoch: 63, train_loss: 1.0340, test_loss: 1.1178, test_f1: 0.3346
 epoch: 64, train_loss: 1.0286, test_loss: 1.1030, test_f1: 0.3365
 epoch: 65, train_loss: 1.0318, test_loss: 1.1084, test_f1: 0.3346
 epoch: 66, train_loss: 1.0242, test_loss: 1.1081, test_f1: 0.3346
 epoch: 67, train_loss: 1.0136, test_loss: 1.1180, test_f1: 0.3321
 epoch: 68, train_loss: 1.0253, test_loss: 1.1234, test_f1: 0.3321
 epoch: 69, train_loss: 1.0345, test_loss: 1.1117, test_f1: 0.3340
 epoch: 70, train_loss: 1.0233, test_loss: 1.1085, test_f1: 0.3414
 epoch: 71, train_loss: 1.0297, test_loss: 1.1048, test_f1: 0.3376
 epoch: 72, train_loss: 1.0303, test_loss: 1.1086, test_f1: 0.3392
 epoch: 73, train_loss: 1.0208, test_loss: 1.0993, test_f1: 0.3461
 epoch: 74, train_loss: 1.0136, test_loss: 1.1150, test_f1: 0.3346
 epoch: 75, train_loss: 1.0143, test_loss: 1.1029, test_f1: 0.3397
 epoch: 76, train_loss: 1.0144, test_loss: 1.1027, test_f1: 0.3414
 epoch: 77, train_loss: 1.0105, test_loss: 1.1255, test_f1: 0.3370
 epoch: 78, train_loss: 1.0263, test_loss: 1.1109, test_f1: 0.3414
 epoch: 79, train_loss: 1.0181, test_loss: 1.0964, test_f1: 0.3500
 epoch: 80, train_loss: 1.0205, test_loss: 1.0974, test_f1: 0.3461
 epoch: 81, train_loss: 1.0304, test_loss: 1.1132, test_f1: 0.3454
 epoch: 82, train_loss: 1.0303, test_loss: 1.1048, test_f1: 0.3481
 epoch: 83, train_loss: 1.0325, test_loss: 1.1129, test_f1: 0.3372
 epoch: 84, train_loss: 1.0138, test_loss: 1.0956, test_f1: 0.3491
 epoch: 85, train_loss: 1.0900, test_loss: 1.1705, test_f1: 0.3262
 epoch: 86, train_loss: 1.0646, test_loss: 1.1838, test_f1: 0.3205
 epoch: 87, train_loss: 1.0358, test_loss: 1.1200, test_f1: 0.3370
 epoch: 88, train_loss: 1.0213, test_loss: 1.1215, test_f1: 0.3365
 epoch: 89, train_loss: 1.0292, test_loss: 1.1300, test_f1: 0.3370
 epoch: 90, train_loss: 1.0180, test_loss: 1.1295, test_f1: 0.3370
 epoch: 91, train_loss: 1.0189, test_loss: 1.1419, test_f1: 0.3344
 epoch: 92, train_loss: 1.0465, test_loss: 1.1137, test_f1: 0.3372
 epoch: 93, train_loss: 1.0202, test_loss: 1.1143, test_f1: 0.3421
 epoch: 94, train_loss: 1.0044, test_loss: 1.1383, test_f1: 0.3171
 epoch: 95, train_loss: 1.0221, test_loss: 1.1403, test_f1: 0.3247
 epoch: 96, train_loss: 1.0269, test_loss: 1.2383, test_f1: 0.2965
 epoch: 97, train_loss: 1.0286, test_loss: 1.0890, test_f1: 0.3507
 epoch: 98, train_loss: 1.0205, test_loss: 1.0877, test_f1: 0.3484
 epoch: 99, train_loss: 1.0321, test_loss: 1.1388, test_f1: 0.3344
##################ITERATION #3 ****************************************
 epoch: 0, train_loss: 1.3397, test_loss: 1.3682, test_f1: 0.2281
 epoch: 1, train_loss: 1.2033, test_loss: 1.2047, test_f1: 0.3266
 epoch: 2, train_loss: 1.1253, test_loss: 1.3696, test_f1: 0.3033
 epoch: 3, train_loss: 1.0810, test_loss: 1.1000, test_f1: 0.3425
 epoch: 4, train_loss: 1.0816, test_loss: 1.1474, test_f1: 0.3290
 epoch: 5, train_loss: 1.0741, test_loss: 1.1259, test_f1: 0.3370
 epoch: 6, train_loss: 1.0749, test_loss: 1.1339, test_f1: 0.3370
 epoch: 7, train_loss: 1.0822, test_loss: 1.1610, test_f1: 0.3267
 epoch: 8, train_loss: 1.0656, test_loss: 1.1549, test_f1: 0.3290
 epoch: 9, train_loss: 1.0647, test_loss: 1.1495, test_f1: 0.3290
 epoch: 10, train_loss: 1.0655, test_loss: 1.1463, test_f1: 0.3290
 epoch: 11, train_loss: 1.0727, test_loss: 1.1240, test_f1: 0.3370
 epoch: 12, train_loss: 1.0568, test_loss: 1.1680, test_f1: 0.3239
 epoch: 13, train_loss: 1.0708, test_loss: 1.1085, test_f1: 0.3444
 epoch: 14, train_loss: 1.0481, test_loss: 1.1249, test_f1: 0.3395
 epoch: 15, train_loss: 1.0601, test_loss: 1.1668, test_f1: 0.3234
 epoch: 16, train_loss: 1.0581, test_loss: 1.1243, test_f1: 0.3374
 epoch: 17, train_loss: 1.0594, test_loss: 1.1924, test_f1: 0.3176
 epoch: 18, train_loss: 1.0445, test_loss: 1.3440, test_f1: 0.2500
 epoch: 19, train_loss: 1.0781, test_loss: 1.1423, test_f1: 0.3322
 epoch: 20, train_loss: 1.0690, test_loss: 1.1319, test_f1: 0.3317
 epoch: 21, train_loss: 1.0676, test_loss: 1.1216, test_f1: 0.3395
 epoch: 22, train_loss: 1.0673, test_loss: 1.1225, test_f1: 0.3395
 epoch: 23, train_loss: 1.0644, test_loss: 1.1159, test_f1: 0.3395
 epoch: 24, train_loss: 1.0635, test_loss: 1.1255, test_f1: 0.3344
 epoch: 25, train_loss: 1.0684, test_loss: 1.1215, test_f1: 0.3370
 epoch: 26, train_loss: 1.0569, test_loss: 1.1229, test_f1: 0.3344
 epoch: 27, train_loss: 1.0603, test_loss: 1.1296, test_f1: 0.3344
 epoch: 28, train_loss: 1.0684, test_loss: 1.1191, test_f1: 0.3395
 epoch: 29, train_loss: 1.0659, test_loss: 1.1654, test_f1: 0.3262
 epoch: 30, train_loss: 1.0709, test_loss: 1.1627, test_f1: 0.3262
 epoch: 31, train_loss: 1.0670, test_loss: 1.1521, test_f1: 0.3290
 epoch: 32, train_loss: 1.0915, test_loss: 1.1503, test_f1: 0.3290
 epoch: 33, train_loss: 1.0718, test_loss: 1.1528, test_f1: 0.3290
 epoch: 34, train_loss: 1.0716, test_loss: 1.1530, test_f1: 0.3290
 epoch: 35, train_loss: 1.0705, test_loss: 1.1467, test_f1: 0.3290
 epoch: 36, train_loss: 1.0700, test_loss: 1.1466, test_f1: 0.3290
 epoch: 37, train_loss: 1.0716, test_loss: 1.1480, test_f1: 0.3290
 epoch: 38, train_loss: 1.0713, test_loss: 1.1535, test_f1: 0.3290
 epoch: 39, train_loss: 1.0605, test_loss: 2.1422, test_f1: 0.3262
 epoch: 40, train_loss: 1.4410, test_loss: 1.3596, test_f1: 0.2281
 epoch: 41, train_loss: 1.2564, test_loss: 1.3173, test_f1: 0.2281
 epoch: 42, train_loss: 1.2337, test_loss: 1.3044, test_f1: 0.2281
 epoch: 43, train_loss: 1.2305, test_loss: 1.3002, test_f1: 0.2281
 epoch: 44, train_loss: 1.2190, test_loss: 1.3032, test_f1: 0.2281
 epoch: 45, train_loss: 1.2704, test_loss: 1.2999, test_f1: 0.2390
 epoch: 46, train_loss: 1.2496, test_loss: 1.3131, test_f1: 0.2281
 epoch: 47, train_loss: 1.2553, test_loss: 1.3081, test_f1: 0.2281
 epoch: 48, train_loss: 1.2544, test_loss: 1.3087, test_f1: 0.2281
 epoch: 49, train_loss: 1.2536, test_loss: 1.3041, test_f1: 0.2281
 epoch: 50, train_loss: 1.2555, test_loss: 1.3041, test_f1: 0.2281
 epoch: 51, train_loss: 1.2544, test_loss: 1.3018, test_f1: 0.2281
 epoch: 52, train_loss: 1.2526, test_loss: 1.3035, test_f1: 0.2281
 epoch: 53, train_loss: 1.2524, test_loss: 1.3044, test_f1: 0.2281
 epoch: 54, train_loss: 1.2522, test_loss: 1.3050, test_f1: 0.2281
 epoch: 55, train_loss: 1.2525, test_loss: 1.3080, test_f1: 0.2281
 epoch: 56, train_loss: 1.2526, test_loss: 1.3099, test_f1: 0.2281
 epoch: 57, train_loss: 1.2528, test_loss: 1.3091, test_f1: 0.2281
 epoch: 58, train_loss: 1.2523, test_loss: 1.3061, test_f1: 0.2281
 epoch: 59, train_loss: 1.2523, test_loss: 1.3044, test_f1: 0.2281
 epoch: 60, train_loss: 1.2525, test_loss: 1.3024, test_f1: 0.2281
 epoch: 61, train_loss: 1.2524, test_loss: 1.3021, test_f1: 0.2281
 epoch: 62, train_loss: 1.2523, test_loss: 1.3038, test_f1: 0.2281
 epoch: 63, train_loss: 1.2523, test_loss: 1.3042, test_f1: 0.2281
 epoch: 64, train_loss: 1.2523, test_loss: 1.3061, test_f1: 0.2281
 epoch: 65, train_loss: 1.2523, test_loss: 1.3066, test_f1: 0.2281
 epoch: 66, train_loss: 1.2528, test_loss: 1.3049, test_f1: 0.2281
 epoch: 67, train_loss: 1.2525, test_loss: 1.3068, test_f1: 0.2281
 epoch: 68, train_loss: 1.2524, test_loss: 1.3074, test_f1: 0.2281
 epoch: 69, train_loss: 1.2520, test_loss: 1.3067, test_f1: 0.2281
 epoch: 70, train_loss: 1.2526, test_loss: 1.3051, test_f1: 0.2281
 epoch: 71, train_loss: 1.2526, test_loss: 1.3031, test_f1: 0.2281
 epoch: 72, train_loss: 1.2525, test_loss: 1.3025, test_f1: 0.2281
 epoch: 73, train_loss: 1.2522, test_loss: 1.3039, test_f1: 0.2281
 epoch: 74, train_loss: 1.2522, test_loss: 1.3055, test_f1: 0.2281
 epoch: 75, train_loss: 1.2521, test_loss: 1.3047, test_f1: 0.2281
 epoch: 76, train_loss: 1.2528, test_loss: 1.3012, test_f1: 0.2281
 epoch: 77, train_loss: 1.2529, test_loss: 1.3001, test_f1: 0.2281
 epoch: 78, train_loss: 1.2532, test_loss: 1.3023, test_f1: 0.2281
 epoch: 79, train_loss: 1.2525, test_loss: 1.3032, test_f1: 0.2281
 epoch: 80, train_loss: 1.2519, test_loss: 1.3050, test_f1: 0.2281
 epoch: 81, train_loss: 1.2531, test_loss: 1.3081, test_f1: 0.2281
 epoch: 82, train_loss: 1.2533, test_loss: 1.3106, test_f1: 0.2281
 epoch: 83, train_loss: 1.2527, test_loss: 1.3075, test_f1: 0.2281
 epoch: 84, train_loss: 1.2530, test_loss: 1.3040, test_f1: 0.2281
 epoch: 85, train_loss: 1.2529, test_loss: 1.3021, test_f1: 0.2281
 epoch: 86, train_loss: 1.2525, test_loss: 1.3034, test_f1: 0.2281
 epoch: 87, train_loss: 1.2533, test_loss: 1.3052, test_f1: 0.2281
 epoch: 88, train_loss: 1.2534, test_loss: 1.3066, test_f1: 0.2281
 epoch: 89, train_loss: 1.2526, test_loss: 1.3056, test_f1: 0.2281
 epoch: 90, train_loss: 1.2528, test_loss: 1.3053, test_f1: 0.2281
 epoch: 91, train_loss: 1.2525, test_loss: 1.3049, test_f1: 0.2281
 epoch: 92, train_loss: 1.2529, test_loss: 1.3039, test_f1: 0.2281
 epoch: 93, train_loss: 1.2534, test_loss: 1.3049, test_f1: 0.2281
 epoch: 94, train_loss: 1.2522, test_loss: 1.3058, test_f1: 0.2281
 epoch: 95, train_loss: 1.2524, test_loss: 1.3048, test_f1: 0.2281
 epoch: 96, train_loss: 1.2529, test_loss: 1.3028, test_f1: 0.2281
 epoch: 97, train_loss: 1.2527, test_loss: 1.3030, test_f1: 0.2281
 epoch: 98, train_loss: 1.2526, test_loss: 1.3042, test_f1: 0.2281
 epoch: 99, train_loss: 1.2526, test_loss: 1.3067, test_f1: 0.2281
##################ITERATION #4 ****************************************
 epoch: 0, train_loss: 1.2721, test_loss: 1.3000, test_f1: 0.2281
 epoch: 1, train_loss: 1.2530, test_loss: 1.3044, test_f1: 0.2281
 epoch: 2, train_loss: 1.2530, test_loss: 1.3058, test_f1: 0.2281
 epoch: 3, train_loss: 1.2525, test_loss: 1.3064, test_f1: 0.2281
 epoch: 4, train_loss: 1.2528, test_loss: 1.3056, test_f1: 0.2281
 epoch: 5, train_loss: 1.2540, test_loss: 1.3071, test_f1: 0.2281
 epoch: 6, train_loss: 1.2523, test_loss: 1.3054, test_f1: 0.2281
 epoch: 7, train_loss: 1.2524, test_loss: 1.3044, test_f1: 0.2281
 epoch: 8, train_loss: 1.2516, test_loss: 1.3059, test_f1: 0.2281
 epoch: 9, train_loss: 1.2533, test_loss: 1.3091, test_f1: 0.2281
 epoch: 10, train_loss: 1.2527, test_loss: 1.3048, test_f1: 0.2281
 epoch: 11, train_loss: 1.2525, test_loss: 1.3026, test_f1: 0.2281
 epoch: 12, train_loss: 1.2530, test_loss: 1.3037, test_f1: 0.2281
 epoch: 13, train_loss: 1.2529, test_loss: 1.3050, test_f1: 0.2281
 epoch: 14, train_loss: 1.2535, test_loss: 1.3125, test_f1: 0.2281
 epoch: 15, train_loss: 1.2529, test_loss: 1.3074, test_f1: 0.2281
 epoch: 16, train_loss: 1.2538, test_loss: 1.3069, test_f1: 0.2281
 epoch: 17, train_loss: 1.2537, test_loss: 1.3005, test_f1: 0.2281
 epoch: 18, train_loss: 1.2533, test_loss: 1.3024, test_f1: 0.2281
 epoch: 19, train_loss: 1.2529, test_loss: 1.3035, test_f1: 0.2281
 epoch: 20, train_loss: 1.2527, test_loss: 1.3062, test_f1: 0.2281
 epoch: 21, train_loss: 1.2531, test_loss: 1.3095, test_f1: 0.2281
 epoch: 22, train_loss: 1.2523, test_loss: 1.3057, test_f1: 0.2281
 epoch: 23, train_loss: 1.2526, test_loss: 1.3027, test_f1: 0.2281
 epoch: 24, train_loss: 1.2529, test_loss: 1.3040, test_f1: 0.2281
 epoch: 25, train_loss: 1.2528, test_loss: 1.3083, test_f1: 0.2281
 epoch: 26, train_loss: 1.2528, test_loss: 1.3065, test_f1: 0.2281
 epoch: 27, train_loss: 1.2530, test_loss: 1.3044, test_f1: 0.2281
 epoch: 28, train_loss: 1.2526, test_loss: 1.3108, test_f1: 0.2281
 epoch: 29, train_loss: 1.2547, test_loss: 1.3121, test_f1: 0.1365
 epoch: 30, train_loss: 1.2555, test_loss: 1.3123, test_f1: 0.2281
 epoch: 31, train_loss: 1.2528, test_loss: 1.3075, test_f1: 0.2281
 epoch: 32, train_loss: 1.2547, test_loss: 1.3037, test_f1: 0.2281
 epoch: 33, train_loss: 1.2536, test_loss: 1.3046, test_f1: 0.2281
 epoch: 34, train_loss: 1.2528, test_loss: 1.3071, test_f1: 0.2281
 epoch: 35, train_loss: 1.2536, test_loss: 1.3088, test_f1: 0.2281
 epoch: 36, train_loss: 1.2534, test_loss: 1.3068, test_f1: 0.2281
 epoch: 37, train_loss: 1.2530, test_loss: 1.3034, test_f1: 0.2281
 epoch: 38, train_loss: 1.2526, test_loss: 1.3081, test_f1: 0.2281
 epoch: 39, train_loss: 1.2522, test_loss: 1.3068, test_f1: 0.2281
 epoch: 40, train_loss: 1.2523, test_loss: 1.3046, test_f1: 0.2281
 epoch: 41, train_loss: 1.2523, test_loss: 1.3065, test_f1: 0.2281
 epoch: 42, train_loss: 1.2553, test_loss: 1.3103, test_f1: 0.2281
 epoch: 43, train_loss: 1.2534, test_loss: 1.3100, test_f1: 0.2281
 epoch: 44, train_loss: 1.2539, test_loss: 1.3047, test_f1: 0.2281
 epoch: 45, train_loss: 1.2542, test_loss: 1.3002, test_f1: 0.2281
 epoch: 46, train_loss: 1.2529, test_loss: 1.3039, test_f1: 0.2281
 epoch: 47, train_loss: 1.2524, test_loss: 1.3108, test_f1: 0.2281
 epoch: 48, train_loss: 1.2529, test_loss: 1.3074, test_f1: 0.2281
 epoch: 49, train_loss: 1.2525, test_loss: 1.3045, test_f1: 0.2281
 epoch: 50, train_loss: 1.2527, test_loss: 1.3055, test_f1: 0.2281
 epoch: 51, train_loss: 1.2531, test_loss: 1.3062, test_f1: 0.2281
 epoch: 52, train_loss: 1.2524, test_loss: 1.3084, test_f1: 0.2281
 epoch: 53, train_loss: 1.2528, test_loss: 1.3092, test_f1: 0.2281
 epoch: 54, train_loss: 1.2533, test_loss: 1.3057, test_f1: 0.2281
 epoch: 55, train_loss: 1.2525, test_loss: 1.3047, test_f1: 0.2281
 epoch: 56, train_loss: 1.2524, test_loss: 1.3036, test_f1: 0.2281
 epoch: 57, train_loss: 1.2522, test_loss: 1.3041, test_f1: 0.2281
 epoch: 58, train_loss: 1.2521, test_loss: 1.3041, test_f1: 0.2281
 epoch: 59, train_loss: 1.2524, test_loss: 1.3046, test_f1: 0.2281
 epoch: 60, train_loss: 1.2522, test_loss: 1.3030, test_f1: 0.2281
 epoch: 61, train_loss: 1.2525, test_loss: 1.3068, test_f1: 0.2281
 epoch: 62, train_loss: 1.2526, test_loss: 1.3083, test_f1: 0.2281
 epoch: 63, train_loss: 1.2524, test_loss: 1.3087, test_f1: 0.2281
 epoch: 64, train_loss: 1.2525, test_loss: 1.3090, test_f1: 0.2281
 epoch: 65, train_loss: 1.2531, test_loss: 1.3079, test_f1: 0.2281
 epoch: 66, train_loss: 1.2528, test_loss: 1.3048, test_f1: 0.2281
 epoch: 67, train_loss: 1.2519, test_loss: 1.3036, test_f1: 0.2281
 epoch: 68, train_loss: 1.2528, test_loss: 1.3032, test_f1: 0.2281
 epoch: 69, train_loss: 1.2523, test_loss: 1.3023, test_f1: 0.2281
 epoch: 70, train_loss: 1.2529, test_loss: 1.3041, test_f1: 0.2281
 epoch: 71, train_loss: 1.2529, test_loss: 1.3046, test_f1: 0.2281
 epoch: 72, train_loss: 1.2521, test_loss: 1.3059, test_f1: 0.2281
 epoch: 73, train_loss: 1.2528, test_loss: 1.3092, test_f1: 0.2281
 epoch: 74, train_loss: 1.2532, test_loss: 1.3083, test_f1: 0.2281
 epoch: 75, train_loss: 1.2520, test_loss: 1.3061, test_f1: 0.2281
 epoch: 76, train_loss: 1.2522, test_loss: 1.3036, test_f1: 0.2281
 epoch: 77, train_loss: 1.2521, test_loss: 1.3019, test_f1: 0.2281
 epoch: 78, train_loss: 1.2522, test_loss: 1.3016, test_f1: 0.2281
 epoch: 79, train_loss: 1.2525, test_loss: 1.3013, test_f1: 0.2281
 epoch: 80, train_loss: 1.2526, test_loss: 1.3032, test_f1: 0.2281
 epoch: 81, train_loss: 1.2526, test_loss: 1.3029, test_f1: 0.2281
 epoch: 82, train_loss: 1.2521, test_loss: 1.3030, test_f1: 0.2281
 epoch: 83, train_loss: 1.2528, test_loss: 1.3029, test_f1: 0.2281
 epoch: 84, train_loss: 1.2522, test_loss: 1.3052, test_f1: 0.2281
 epoch: 85, train_loss: 1.2525, test_loss: 1.3060, test_f1: 0.2281
 epoch: 86, train_loss: 1.2521, test_loss: 1.3041, test_f1: 0.2281
 epoch: 87, train_loss: 1.2527, test_loss: 1.3062, test_f1: 0.2281
 epoch: 88, train_loss: 1.2522, test_loss: 1.3054, test_f1: 0.2281
 epoch: 89, train_loss: 1.2535, test_loss: 1.3057, test_f1: 0.2281
 epoch: 90, train_loss: 1.2529, test_loss: 1.3051, test_f1: 0.2281
 epoch: 91, train_loss: 1.2527, test_loss: 1.3083, test_f1: 0.2281
 epoch: 92, train_loss: 1.2524, test_loss: 1.3066, test_f1: 0.2281
 epoch: 93, train_loss: 1.2524, test_loss: 1.3040, test_f1: 0.2281
 epoch: 94, train_loss: 1.2520, test_loss: 1.3037, test_f1: 0.2281
 epoch: 95, train_loss: 1.2523, test_loss: 1.3039, test_f1: 0.2281
 epoch: 96, train_loss: 1.2522, test_loss: 1.3034, test_f1: 0.2281
 epoch: 97, train_loss: 1.2523, test_loss: 1.3047, test_f1: 0.2281
 epoch: 98, train_loss: 1.2532, test_loss: 1.3050, test_f1: 0.2281
 epoch: 99, train_loss: 1.2524, test_loss: 1.3079, test_f1: 0.2281
##################ITERATION #5 ****************************************
 epoch: 0, train_loss: 1.2573, test_loss: 1.3110, test_f1: 0.2281
 epoch: 1, train_loss: 1.2641, test_loss: 1.3297, test_f1: 0.2281
 epoch: 2, train_loss: 1.2582, test_loss: 1.3058, test_f1: 0.2281
 epoch: 3, train_loss: 1.2537, test_loss: 1.3014, test_f1: 0.2281
 epoch: 4, train_loss: 1.2542, test_loss: 1.3057, test_f1: 0.2281
 epoch: 5, train_loss: 1.2527, test_loss: 1.3053, test_f1: 0.2281
 epoch: 6, train_loss: 1.2553, test_loss: 1.3126, test_f1: 0.2281
 epoch: 7, train_loss: 1.2549, test_loss: 1.3084, test_f1: 0.2281
 epoch: 8, train_loss: 1.2539, test_loss: 1.3025, test_f1: 0.2281
 epoch: 9, train_loss: 1.2526, test_loss: 1.3005, test_f1: 0.2281
 epoch: 10, train_loss: 1.2547, test_loss: 1.3003, test_f1: 0.2281
 epoch: 11, train_loss: 1.2528, test_loss: 1.3095, test_f1: 0.2281
 epoch: 12, train_loss: 1.2538, test_loss: 1.3082, test_f1: 0.2281
 epoch: 13, train_loss: 1.2523, test_loss: 1.3023, test_f1: 0.2281
 epoch: 14, train_loss: 1.2533, test_loss: 1.3015, test_f1: 0.2281
 epoch: 15, train_loss: 1.2566, test_loss: 1.3047, test_f1: 0.2281
 epoch: 16, train_loss: 1.2533, test_loss: 1.3093, test_f1: 0.2281
 epoch: 17, train_loss: 1.2534, test_loss: 1.3123, test_f1: 0.2281
 epoch: 18, train_loss: 1.2530, test_loss: 1.3058, test_f1: 0.2281
 epoch: 19, train_loss: 1.2524, test_loss: 1.3054, test_f1: 0.2281
 epoch: 20, train_loss: 1.2522, test_loss: 1.3046, test_f1: 0.2281
 epoch: 21, train_loss: 1.2528, test_loss: 1.3056, test_f1: 0.2281
 epoch: 22, train_loss: 1.2523, test_loss: 1.3066, test_f1: 0.2281
 epoch: 23, train_loss: 1.2527, test_loss: 1.3027, test_f1: 0.2281
 epoch: 24, train_loss: 1.2523, test_loss: 1.3028, test_f1: 0.2281
 epoch: 25, train_loss: 1.2520, test_loss: 1.3063, test_f1: 0.2281
 epoch: 26, train_loss: 1.2527, test_loss: 1.3023, test_f1: 0.2281
 epoch: 27, train_loss: 1.2526, test_loss: 1.3038, test_f1: 0.2281
 epoch: 28, train_loss: 1.2534, test_loss: 1.3086, test_f1: 0.2281
 epoch: 29, train_loss: 1.2549, test_loss: 1.3114, test_f1: 0.2281
 epoch: 30, train_loss: 1.2529, test_loss: 1.3028, test_f1: 0.2281
 epoch: 31, train_loss: 1.2527, test_loss: 1.3019, test_f1: 0.2281
 epoch: 32, train_loss: 1.2531, test_loss: 1.3033, test_f1: 0.2281
 epoch: 33, train_loss: 1.2532, test_loss: 1.3057, test_f1: 0.2281
 epoch: 34, train_loss: 1.2522, test_loss: 1.3044, test_f1: 0.2281
 epoch: 35, train_loss: 1.2522, test_loss: 1.3032, test_f1: 0.2281
 epoch: 36, train_loss: 1.2529, test_loss: 1.3039, test_f1: 0.2281
 epoch: 37, train_loss: 1.2528, test_loss: 1.3050, test_f1: 0.2281
 epoch: 38, train_loss: 1.2528, test_loss: 1.3015, test_f1: 0.2281
 epoch: 39, train_loss: 1.2537, test_loss: 1.3053, test_f1: 0.2281
 epoch: 40, train_loss: 1.2528, test_loss: 1.3044, test_f1: 0.2281
 epoch: 41, train_loss: 1.2521, test_loss: 1.3040, test_f1: 0.2281
 epoch: 42, train_loss: 1.2525, test_loss: 1.3033, test_f1: 0.2281
 epoch: 43, train_loss: 1.2530, test_loss: 1.3038, test_f1: 0.2281
 epoch: 44, train_loss: 1.2529, test_loss: 1.3070, test_f1: 0.2281
 epoch: 45, train_loss: 1.2533, test_loss: 1.3116, test_f1: 0.2281
 epoch: 46, train_loss: 1.2534, test_loss: 1.3050, test_f1: 0.2281
 epoch: 47, train_loss: 1.2528, test_loss: 1.3046, test_f1: 0.2281
 epoch: 48, train_loss: 1.2519, test_loss: 1.3071, test_f1: 0.2281
 epoch: 49, train_loss: 1.2526, test_loss: 1.3057, test_f1: 0.2281
 epoch: 50, train_loss: 1.2530, test_loss: 1.3028, test_f1: 0.2281
 epoch: 51, train_loss: 1.2536, test_loss: 1.3036, test_f1: 0.2281
 epoch: 52, train_loss: 1.2528, test_loss: 1.3040, test_f1: 0.2281
 epoch: 53, train_loss: 1.2521, test_loss: 1.3034, test_f1: 0.2281
 epoch: 54, train_loss: 1.2523, test_loss: 1.3011, test_f1: 0.2281
 epoch: 55, train_loss: 1.2531, test_loss: 1.3005, test_f1: 0.2281
 epoch: 56, train_loss: 1.2528, test_loss: 1.3012, test_f1: 0.2281
 epoch: 57, train_loss: 1.2521, test_loss: 1.3029, test_f1: 0.2281
 epoch: 58, train_loss: 1.2527, test_loss: 1.3062, test_f1: 0.2281
 epoch: 59, train_loss: 1.2530, test_loss: 1.3078, test_f1: 0.2281
 epoch: 60, train_loss: 1.2531, test_loss: 1.3107, test_f1: 0.2281
 epoch: 61, train_loss: 1.2530, test_loss: 1.3096, test_f1: 0.2281
 epoch: 62, train_loss: 1.2529, test_loss: 1.3072, test_f1: 0.2281
 epoch: 63, train_loss: 1.2527, test_loss: 1.3036, test_f1: 0.2281
 epoch: 64, train_loss: 1.2524, test_loss: 1.3032, test_f1: 0.2281
 epoch: 65, train_loss: 1.2523, test_loss: 1.3031, test_f1: 0.2281
 epoch: 66, train_loss: 1.2525, test_loss: 1.3046, test_f1: 0.2281
 epoch: 67, train_loss: 1.2525, test_loss: 1.3061, test_f1: 0.2281
 epoch: 68, train_loss: 1.2523, test_loss: 1.3048, test_f1: 0.2281
 epoch: 69, train_loss: 1.2521, test_loss: 1.3053, test_f1: 0.2281
 epoch: 70, train_loss: 1.2522, test_loss: 1.3059, test_f1: 0.2281
 epoch: 71, train_loss: 1.2527, test_loss: 1.3081, test_f1: 0.2281
 epoch: 72, train_loss: 1.2523, test_loss: 1.3071, test_f1: 0.2281
 epoch: 73, train_loss: 1.2523, test_loss: 1.3046, test_f1: 0.2281
 epoch: 74, train_loss: 1.2521, test_loss: 1.3030, test_f1: 0.2281
 epoch: 75, train_loss: 1.2520, test_loss: 1.3036, test_f1: 0.2281
 epoch: 76, train_loss: 1.2522, test_loss: 1.3047, test_f1: 0.2281
 epoch: 77, train_loss: 1.2523, test_loss: 1.3039, test_f1: 0.2281
 epoch: 78, train_loss: 1.2524, test_loss: 1.3050, test_f1: 0.2281
 epoch: 79, train_loss: 1.2530, test_loss: 1.3061, test_f1: 0.2281
 epoch: 80, train_loss: 1.2535, test_loss: 1.3082, test_f1: 0.2281
 epoch: 81, train_loss: 1.2532, test_loss: 1.3066, test_f1: 0.2281
 epoch: 82, train_loss: 1.2529, test_loss: 1.3047, test_f1: 0.2281
 epoch: 83, train_loss: 1.2523, test_loss: 1.3058, test_f1: 0.2281
 epoch: 84, train_loss: 1.2528, test_loss: 1.3054, test_f1: 0.2281
 epoch: 85, train_loss: 1.2521, test_loss: 1.3058, test_f1: 0.2281
 epoch: 86, train_loss: 1.2521, test_loss: 1.3044, test_f1: 0.2281
 epoch: 87, train_loss: 1.2525, test_loss: 1.3038, test_f1: 0.2281
 epoch: 88, train_loss: 1.2525, test_loss: 1.3041, test_f1: 0.2281
 epoch: 89, train_loss: 1.2521, test_loss: 1.3074, test_f1: 0.2281
 epoch: 90, train_loss: 1.2530, test_loss: 1.3110, test_f1: 0.2281
 epoch: 91, train_loss: 1.2533, test_loss: 1.3083, test_f1: 0.2281
 epoch: 92, train_loss: 1.2525, test_loss: 1.3060, test_f1: 0.2281
 epoch: 93, train_loss: 1.2527, test_loss: 1.3042, test_f1: 0.2281
 epoch: 94, train_loss: 1.2526, test_loss: 1.3048, test_f1: 0.2281
 epoch: 95, train_loss: 1.2529, test_loss: 1.3041, test_f1: 0.2281
 epoch: 96, train_loss: 1.2524, test_loss: 1.3067, test_f1: 0.2281
 epoch: 97, train_loss: 1.2534, test_loss: 1.3081, test_f1: 0.2281
 epoch: 98, train_loss: 1.2528, test_loss: 1.3073, test_f1: 0.2281
 epoch: 99, train_loss: 1.2523, test_loss: 1.3062, test_f1: 0.2281
##################ITERATION #6 ****************************************
 epoch: 0, train_loss: 1.2562, test_loss: 1.3063, test_f1: 0.2281
 epoch: 1, train_loss: 1.2545, test_loss: 1.3130, test_f1: 0.2281
 epoch: 2, train_loss: 1.2535, test_loss: 1.3081, test_f1: 0.2281
 epoch: 3, train_loss: 1.2526, test_loss: 1.3055, test_f1: 0.2281
 epoch: 4, train_loss: 1.2529, test_loss: 1.3056, test_f1: 0.2281
 epoch: 5, train_loss: 1.2523, test_loss: 1.3032, test_f1: 0.2281
 epoch: 6, train_loss: 1.2530, test_loss: 1.3050, test_f1: 0.2281
 epoch: 7, train_loss: 1.2530, test_loss: 1.3035, test_f1: 0.2281
 epoch: 8, train_loss: 1.2523, test_loss: 1.3043, test_f1: 0.2281
 epoch: 9, train_loss: 1.2521, test_loss: 1.3066, test_f1: 0.2281
 epoch: 10, train_loss: 1.2529, test_loss: 1.3049, test_f1: 0.2281
 epoch: 11, train_loss: 1.2531, test_loss: 1.3059, test_f1: 0.2281
 epoch: 12, train_loss: 1.2544, test_loss: 1.3095, test_f1: 0.2281
 epoch: 13, train_loss: 1.2550, test_loss: 1.3091, test_f1: 0.2281
 epoch: 14, train_loss: 1.2537, test_loss: 1.3053, test_f1: 0.2281
 epoch: 15, train_loss: 1.2529, test_loss: 1.3023, test_f1: 0.2281
 epoch: 16, train_loss: 1.2527, test_loss: 1.3039, test_f1: 0.2281
 epoch: 17, train_loss: 1.2532, test_loss: 1.3046, test_f1: 0.2281
 epoch: 18, train_loss: 1.2534, test_loss: 1.3048, test_f1: 0.2281
 epoch: 19, train_loss: 1.2527, test_loss: 1.3043, test_f1: 0.2281
 epoch: 20, train_loss: 1.2536, test_loss: 1.3039, test_f1: 0.2281
 epoch: 21, train_loss: 1.2528, test_loss: 1.3010, test_f1: 0.2281
 epoch: 22, train_loss: 1.2526, test_loss: 1.3071, test_f1: 0.2281
 epoch: 23, train_loss: 1.2524, test_loss: 1.3094, test_f1: 0.2281
 epoch: 24, train_loss: 1.2528, test_loss: 1.3066, test_f1: 0.2281
 epoch: 25, train_loss: 1.2529, test_loss: 1.3030, test_f1: 0.2281
 epoch: 26, train_loss: 1.2521, test_loss: 1.3062, test_f1: 0.2281
 epoch: 27, train_loss: 1.2546, test_loss: 1.3091, test_f1: 0.2281
 epoch: 28, train_loss: 1.2527, test_loss: 1.2995, test_f1: 0.2281
 epoch: 29, train_loss: 1.2559, test_loss: 1.3035, test_f1: 0.2281
 epoch: 30, train_loss: 1.2537, test_loss: 1.3041, test_f1: 0.2281
 epoch: 31, train_loss: 1.2533, test_loss: 1.3030, test_f1: 0.2281
 epoch: 32, train_loss: 1.2526, test_loss: 1.3074, test_f1: 0.2281
 epoch: 33, train_loss: 1.2529, test_loss: 1.3114, test_f1: 0.2281
 epoch: 34, train_loss: 1.2541, test_loss: 1.3075, test_f1: 0.2281
 epoch: 35, train_loss: 1.2530, test_loss: 1.3037, test_f1: 0.2281
 epoch: 36, train_loss: 1.2526, test_loss: 1.3041, test_f1: 0.2281
 epoch: 37, train_loss: 1.2522, test_loss: 1.3047, test_f1: 0.2281
 epoch: 38, train_loss: 1.2522, test_loss: 1.3098, test_f1: 0.2281
 epoch: 39, train_loss: 1.2539, test_loss: 1.3126, test_f1: 0.2281
 epoch: 40, train_loss: 1.2534, test_loss: 1.3069, test_f1: 0.2281
 epoch: 41, train_loss: 1.2535, test_loss: 1.3021, test_f1: 0.2281
 epoch: 42, train_loss: 1.2540, test_loss: 1.3044, test_f1: 0.2281
 epoch: 43, train_loss: 1.2522, test_loss: 1.3060, test_f1: 0.2281
 epoch: 44, train_loss: 1.2534, test_loss: 1.3117, test_f1: 0.2281
 epoch: 45, train_loss: 1.2536, test_loss: 1.3092, test_f1: 0.2281
 epoch: 46, train_loss: 1.2531, test_loss: 1.3064, test_f1: 0.2281
 epoch: 47, train_loss: 1.2525, test_loss: 1.3057, test_f1: 0.2281
 epoch: 48, train_loss: 1.2528, test_loss: 1.3000, test_f1: 0.2281
 epoch: 49, train_loss: 1.2528, test_loss: 1.3023, test_f1: 0.2281
 epoch: 50, train_loss: 1.2520, test_loss: 1.3074, test_f1: 0.2281
 epoch: 51, train_loss: 1.2522, test_loss: 1.3059, test_f1: 0.2281
 epoch: 52, train_loss: 1.2524, test_loss: 1.3038, test_f1: 0.2281
 epoch: 53, train_loss: 1.2529, test_loss: 1.3027, test_f1: 0.2281
 epoch: 54, train_loss: 1.2529, test_loss: 1.3032, test_f1: 0.2281
 epoch: 55, train_loss: 1.2526, test_loss: 1.3029, test_f1: 0.2281
 epoch: 56, train_loss: 1.2522, test_loss: 1.3038, test_f1: 0.2281
 epoch: 57, train_loss: 1.2521, test_loss: 1.3064, test_f1: 0.2281
 epoch: 58, train_loss: 1.2525, test_loss: 1.3084, test_f1: 0.2281
 epoch: 59, train_loss: 1.2529, test_loss: 1.3083, test_f1: 0.2281
 epoch: 60, train_loss: 1.2525, test_loss: 1.3090, test_f1: 0.2281
 epoch: 61, train_loss: 1.2528, test_loss: 1.3081, test_f1: 0.2281
 epoch: 62, train_loss: 1.2523, test_loss: 1.3053, test_f1: 0.2281
 epoch: 63, train_loss: 1.2519, test_loss: 1.3036, test_f1: 0.2281
 epoch: 64, train_loss: 1.2522, test_loss: 1.3037, test_f1: 0.2281
 epoch: 65, train_loss: 1.2521, test_loss: 1.3052, test_f1: 0.2281
 epoch: 66, train_loss: 1.2524, test_loss: 1.3053, test_f1: 0.2281
 epoch: 67, train_loss: 1.2524, test_loss: 1.3072, test_f1: 0.2281
 epoch: 68, train_loss: 1.2528, test_loss: 1.3078, test_f1: 0.2281
 epoch: 69, train_loss: 1.2532, test_loss: 1.3044, test_f1: 0.2281
 epoch: 70, train_loss: 1.2527, test_loss: 1.3044, test_f1: 0.2281
 epoch: 71, train_loss: 1.2529, test_loss: 1.3040, test_f1: 0.2281
 epoch: 72, train_loss: 1.2536, test_loss: 1.3014, test_f1: 0.2281
 epoch: 73, train_loss: 1.2538, test_loss: 1.3024, test_f1: 0.2281
 epoch: 74, train_loss: 1.2538, test_loss: 1.3034, test_f1: 0.2281
 epoch: 75, train_loss: 1.2524, test_loss: 1.3030, test_f1: 0.2281
 epoch: 76, train_loss: 1.2523, test_loss: 1.3043, test_f1: 0.2281
 epoch: 77, train_loss: 1.2521, test_loss: 1.3048, test_f1: 0.2281
 epoch: 78, train_loss: 1.2538, test_loss: 1.3049, test_f1: 0.2281
 epoch: 79, train_loss: 1.2532, test_loss: 1.3052, test_f1: 0.2281
 epoch: 80, train_loss: 1.2523, test_loss: 1.3042, test_f1: 0.2281
 epoch: 81, train_loss: 1.2524, test_loss: 1.3021, test_f1: 0.2281
 epoch: 82, train_loss: 1.2520, test_loss: 1.3040, test_f1: 0.2281
 epoch: 83, train_loss: 1.2523, test_loss: 1.3066, test_f1: 0.2281
 epoch: 84, train_loss: 1.2533, test_loss: 1.3081, test_f1: 0.2281
 epoch: 85, train_loss: 1.2528, test_loss: 1.3056, test_f1: 0.2281
 epoch: 86, train_loss: 1.2521, test_loss: 1.3050, test_f1: 0.2281
 epoch: 87, train_loss: 1.2523, test_loss: 1.3063, test_f1: 0.2281
 epoch: 88, train_loss: 1.2524, test_loss: 1.3073, test_f1: 0.2281
 epoch: 89, train_loss: 1.2522, test_loss: 1.3061, test_f1: 0.2281
 epoch: 90, train_loss: 1.2525, test_loss: 1.3043, test_f1: 0.2281
 epoch: 91, train_loss: 1.2529, test_loss: 1.3033, test_f1: 0.2281
 epoch: 92, train_loss: 1.2523, test_loss: 1.3040, test_f1: 0.2281
 epoch: 93, train_loss: 1.2525, test_loss: 1.3074, test_f1: 0.2281
 epoch: 94, train_loss: 1.2530, test_loss: 1.3081, test_f1: 0.2281
 epoch: 95, train_loss: 1.2525, test_loss: 1.3049, test_f1: 0.2281
 epoch: 96, train_loss: 1.2522, test_loss: 1.3024, test_f1: 0.2281
 epoch: 97, train_loss: 1.2527, test_loss: 1.3013, test_f1: 0.2281
 epoch: 98, train_loss: 1.2527, test_loss: 1.3015, test_f1: 0.2281
 epoch: 99, train_loss: 1.2527, test_loss: 1.3027, test_f1: 0.2281
##################ITERATION #7 ****************************************
 epoch: 0, train_loss: 1.2560, test_loss: 1.3139, test_f1: 0.2281
 epoch: 1, train_loss: 1.2534, test_loss: 1.3111, test_f1: 0.2281
 epoch: 2, train_loss: 1.2560, test_loss: 1.3032, test_f1: 0.2281
 epoch: 3, train_loss: 1.2533, test_loss: 1.3071, test_f1: 0.2281
 epoch: 4, train_loss: 1.2549, test_loss: 1.3055, test_f1: 0.2281
 epoch: 5, train_loss: 1.2531, test_loss: 1.3036, test_f1: 0.2281
 epoch: 6, train_loss: 1.2541, test_loss: 1.3025, test_f1: 0.2281
 epoch: 7, train_loss: 1.2538, test_loss: 1.3057, test_f1: 0.2281
 epoch: 8, train_loss: 1.2533, test_loss: 1.3075, test_f1: 0.2281
 epoch: 9, train_loss: 1.2534, test_loss: 1.3128, test_f1: 0.2281
 epoch: 10, train_loss: 1.2537, test_loss: 1.3072, test_f1: 0.2281
 epoch: 11, train_loss: 1.2528, test_loss: 1.3063, test_f1: 0.2281
 epoch: 12, train_loss: 1.2530, test_loss: 1.3038, test_f1: 0.2281
 epoch: 13, train_loss: 1.2527, test_loss: 1.3046, test_f1: 0.2281
 epoch: 14, train_loss: 1.2530, test_loss: 1.3047, test_f1: 0.2281
 epoch: 15, train_loss: 1.2528, test_loss: 1.3080, test_f1: 0.2281
 epoch: 16, train_loss: 1.2532, test_loss: 1.3051, test_f1: 0.2281
 epoch: 17, train_loss: 1.2530, test_loss: 1.3033, test_f1: 0.2281
 epoch: 18, train_loss: 1.2523, test_loss: 1.3068, test_f1: 0.2281
 epoch: 19, train_loss: 1.2525, test_loss: 1.3057, test_f1: 0.2281
 epoch: 20, train_loss: 1.2528, test_loss: 1.3055, test_f1: 0.2281
 epoch: 21, train_loss: 1.2538, test_loss: 1.3003, test_f1: 0.2281
 epoch: 22, train_loss: 1.2553, test_loss: 1.3058, test_f1: 0.2281
 epoch: 23, train_loss: 1.2537, test_loss: 1.3058, test_f1: 0.2281
 epoch: 24, train_loss: 1.2522, test_loss: 1.3064, test_f1: 0.2281
 epoch: 25, train_loss: 1.2536, test_loss: 1.3048, test_f1: 0.2281
 epoch: 26, train_loss: 1.2531, test_loss: 1.3022, test_f1: 0.2281
 epoch: 27, train_loss: 1.2535, test_loss: 1.2999, test_f1: 0.2281
 epoch: 28, train_loss: 1.2524, test_loss: 1.3047, test_f1: 0.2281
 epoch: 29, train_loss: 1.2523, test_loss: 1.3055, test_f1: 0.2281
 epoch: 30, train_loss: 1.2527, test_loss: 1.3037, test_f1: 0.2281
 epoch: 31, train_loss: 1.2522, test_loss: 1.3029, test_f1: 0.2281
 epoch: 32, train_loss: 1.2530, test_loss: 1.3076, test_f1: 0.2281
 epoch: 33, train_loss: 1.2537, test_loss: 1.3045, test_f1: 0.2281
 epoch: 34, train_loss: 1.2526, test_loss: 1.3035, test_f1: 0.2281
 epoch: 35, train_loss: 1.2543, test_loss: 1.3039, test_f1: 0.2281
 epoch: 36, train_loss: 1.2522, test_loss: 1.3019, test_f1: 0.2281
 epoch: 37, train_loss: 1.2530, test_loss: 1.3025, test_f1: 0.2281
 epoch: 38, train_loss: 1.2534, test_loss: 1.3020, test_f1: 0.2281
 epoch: 39, train_loss: 1.2535, test_loss: 1.3081, test_f1: 0.2281
 epoch: 40, train_loss: 1.2539, test_loss: 1.3105, test_f1: 0.2281
 epoch: 41, train_loss: 1.2528, test_loss: 1.3047, test_f1: 0.2281
 epoch: 42, train_loss: 1.2526, test_loss: 1.3014, test_f1: 0.2281
 epoch: 43, train_loss: 1.2533, test_loss: 1.3016, test_f1: 0.2281
 epoch: 44, train_loss: 1.2523, test_loss: 1.3065, test_f1: 0.2281
 epoch: 45, train_loss: 1.2556, test_loss: 1.3017, test_f1: 0.2281
 epoch: 46, train_loss: 1.2553, test_loss: 1.3027, test_f1: 0.2281
 epoch: 47, train_loss: 1.2551, test_loss: 1.3030, test_f1: 0.2281
 epoch: 48, train_loss: 1.2533, test_loss: 1.3035, test_f1: 0.2281
 epoch: 49, train_loss: 1.2522, test_loss: 1.3071, test_f1: 0.2281
 epoch: 50, train_loss: 1.2529, test_loss: 1.3077, test_f1: 0.2281
 epoch: 51, train_loss: 1.2530, test_loss: 1.3049, test_f1: 0.2281
 epoch: 52, train_loss: 1.2526, test_loss: 1.3046, test_f1: 0.2281
 epoch: 53, train_loss: 1.2521, test_loss: 1.3078, test_f1: 0.2281
 epoch: 54, train_loss: 1.2523, test_loss: 1.3086, test_f1: 0.2281
 epoch: 55, train_loss: 1.2528, test_loss: 1.3085, test_f1: 0.2281
 epoch: 56, train_loss: 1.2524, test_loss: 1.3035, test_f1: 0.2281
 epoch: 57, train_loss: 1.2519, test_loss: 1.3010, test_f1: 0.2281
 epoch: 58, train_loss: 1.2533, test_loss: 1.3033, test_f1: 0.2281
 epoch: 59, train_loss: 1.2544, test_loss: 1.3016, test_f1: 0.2281
 epoch: 60, train_loss: 1.2536, test_loss: 1.3014, test_f1: 0.2281
 epoch: 61, train_loss: 1.2532, test_loss: 1.3031, test_f1: 0.2281
 epoch: 62, train_loss: 1.2523, test_loss: 1.3052, test_f1: 0.2281
 epoch: 63, train_loss: 1.2523, test_loss: 1.3066, test_f1: 0.2281
 epoch: 64, train_loss: 1.2526, test_loss: 1.3074, test_f1: 0.2281
 epoch: 65, train_loss: 1.2523, test_loss: 1.3058, test_f1: 0.2281
 epoch: 66, train_loss: 1.2522, test_loss: 1.3058, test_f1: 0.2281
 epoch: 67, train_loss: 1.2522, test_loss: 1.3043, test_f1: 0.2281
 epoch: 68, train_loss: 1.2519, test_loss: 1.3032, test_f1: 0.2281
 epoch: 69, train_loss: 1.2523, test_loss: 1.3037, test_f1: 0.2281
 epoch: 70, train_loss: 1.2524, test_loss: 1.3045, test_f1: 0.2281
 epoch: 71, train_loss: 1.2521, test_loss: 1.3079, test_f1: 0.2281
 epoch: 72, train_loss: 1.2524, test_loss: 1.3115, test_f1: 0.2281
 epoch: 73, train_loss: 1.2530, test_loss: 1.3106, test_f1: 0.2281
 epoch: 74, train_loss: 1.2527, test_loss: 1.3070, test_f1: 0.2281
 epoch: 75, train_loss: 1.2520, test_loss: 1.3041, test_f1: 0.2281
 epoch: 76, train_loss: 1.2520, test_loss: 1.3024, test_f1: 0.2281
 epoch: 77, train_loss: 1.2525, test_loss: 1.3015, test_f1: 0.2281
 epoch: 78, train_loss: 1.2525, test_loss: 1.3022, test_f1: 0.2281
 epoch: 79, train_loss: 1.2526, test_loss: 1.3022, test_f1: 0.2281
 epoch: 80, train_loss: 1.2524, test_loss: 1.3031, test_f1: 0.2281
 epoch: 81, train_loss: 1.2522, test_loss: 1.3069, test_f1: 0.2281
 epoch: 82, train_loss: 1.2523, test_loss: 1.3099, test_f1: 0.2281
 epoch: 83, train_loss: 1.2527, test_loss: 1.3096, test_f1: 0.2281
 epoch: 84, train_loss: 1.2527, test_loss: 1.3083, test_f1: 0.2281
 epoch: 85, train_loss: 1.2526, test_loss: 1.3044, test_f1: 0.2281
 epoch: 86, train_loss: 1.2528, test_loss: 1.3043, test_f1: 0.2281
 epoch: 87, train_loss: 1.2521, test_loss: 1.3034, test_f1: 0.2281
 epoch: 88, train_loss: 1.2521, test_loss: 1.3034, test_f1: 0.2281
 epoch: 89, train_loss: 1.2523, test_loss: 1.3058, test_f1: 0.2281
 epoch: 90, train_loss: 1.2525, test_loss: 1.3060, test_f1: 0.2281
 epoch: 91, train_loss: 1.2524, test_loss: 1.3031, test_f1: 0.2281
 epoch: 92, train_loss: 1.2525, test_loss: 1.3020, test_f1: 0.2281
 epoch: 93, train_loss: 1.2524, test_loss: 1.3051, test_f1: 0.2281
 epoch: 94, train_loss: 1.2528, test_loss: 1.3077, test_f1: 0.2281
 epoch: 95, train_loss: 1.2525, test_loss: 1.3070, test_f1: 0.2281
 epoch: 96, train_loss: 1.2526, test_loss: 1.3072, test_f1: 0.2281
 epoch: 97, train_loss: 1.2526, test_loss: 1.3074, test_f1: 0.2281
 epoch: 98, train_loss: 1.2528, test_loss: 1.3070, test_f1: 0.2281
 epoch: 99, train_loss: 1.2523, test_loss: 1.3066, test_f1: 0.2281
##################ITERATION #8 ****************************************
 epoch: 0, train_loss: 1.2561, test_loss: 1.3075, test_f1: 0.2281
 epoch: 1, train_loss: 1.2536, test_loss: 1.3076, test_f1: 0.2281
 epoch: 2, train_loss: 1.2527, test_loss: 1.3044, test_f1: 0.2281
 epoch: 3, train_loss: 1.2525, test_loss: 1.3040, test_f1: 0.2281
 epoch: 4, train_loss: 1.2528, test_loss: 1.3068, test_f1: 0.2281
 epoch: 5, train_loss: 1.2549, test_loss: 1.3102, test_f1: 0.2281
 epoch: 6, train_loss: 1.2546, test_loss: 1.3052, test_f1: 0.2281
 epoch: 7, train_loss: 1.2520, test_loss: 1.3060, test_f1: 0.2281
 epoch: 8, train_loss: 1.2541, test_loss: 1.3091, test_f1: 0.2281
 epoch: 9, train_loss: 1.2534, test_loss: 1.3099, test_f1: 0.2281
 epoch: 10, train_loss: 1.2522, test_loss: 1.3044, test_f1: 0.2281
 epoch: 11, train_loss: 1.2526, test_loss: 1.3033, test_f1: 0.2281
 epoch: 12, train_loss: 1.2533, test_loss: 1.3059, test_f1: 0.2281
 epoch: 13, train_loss: 1.2521, test_loss: 1.3062, test_f1: 0.2281
 epoch: 14, train_loss: 1.2525, test_loss: 1.3047, test_f1: 0.2281
 epoch: 15, train_loss: 1.2538, test_loss: 1.2986, test_f1: 0.2281
 epoch: 16, train_loss: 1.2544, test_loss: 1.2999, test_f1: 0.2281
 epoch: 17, train_loss: 1.2529, test_loss: 1.3105, test_f1: 0.2281
 epoch: 18, train_loss: 1.2544, test_loss: 1.3154, test_f1: 0.2281
 epoch: 19, train_loss: 1.2548, test_loss: 1.3136, test_f1: 0.2281
 epoch: 20, train_loss: 1.2531, test_loss: 1.3068, test_f1: 0.2281
 epoch: 21, train_loss: 1.2522, test_loss: 1.3064, test_f1: 0.2281
 epoch: 22, train_loss: 1.2530, test_loss: 1.3106, test_f1: 0.2281
 epoch: 23, train_loss: 1.2543, test_loss: 1.3064, test_f1: 0.2281
 epoch: 24, train_loss: 1.2540, test_loss: 1.3066, test_f1: 0.2281
 epoch: 25, train_loss: 1.2540, test_loss: 1.3067, test_f1: 0.2281
 epoch: 26, train_loss: 1.2527, test_loss: 1.3043, test_f1: 0.2281
 epoch: 27, train_loss: 1.2526, test_loss: 1.3073, test_f1: 0.2281
 epoch: 28, train_loss: 1.2526, test_loss: 1.3083, test_f1: 0.2281
 epoch: 29, train_loss: 1.2528, test_loss: 1.3055, test_f1: 0.2281
 epoch: 30, train_loss: 1.2532, test_loss: 1.3022, test_f1: 0.2281
 epoch: 31, train_loss: 1.2534, test_loss: 1.3025, test_f1: 0.2281
 epoch: 32, train_loss: 1.2538, test_loss: 1.3088, test_f1: 0.2281
 epoch: 33, train_loss: 1.2540, test_loss: 1.3113, test_f1: 0.2281
 epoch: 34, train_loss: 1.2537, test_loss: 1.3109, test_f1: 0.2281
 epoch: 35, train_loss: 1.2531, test_loss: 1.3079, test_f1: 0.2281
 epoch: 36, train_loss: 1.2523, test_loss: 1.3073, test_f1: 0.2281
 epoch: 37, train_loss: 1.2537, test_loss: 1.3095, test_f1: 0.2281
 epoch: 38, train_loss: 1.2530, test_loss: 1.3058, test_f1: 0.2281
 epoch: 39, train_loss: 1.2525, test_loss: 1.3034, test_f1: 0.2281
 epoch: 40, train_loss: 1.2532, test_loss: 1.3031, test_f1: 0.2281
 epoch: 41, train_loss: 1.2527, test_loss: 1.3040, test_f1: 0.2281
 epoch: 42, train_loss: 1.2532, test_loss: 1.3062, test_f1: 0.2281
 epoch: 43, train_loss: 1.2527, test_loss: 1.3084, test_f1: 0.2281
 epoch: 44, train_loss: 1.2524, test_loss: 1.3074, test_f1: 0.2281
 epoch: 45, train_loss: 1.2524, test_loss: 1.3079, test_f1: 0.2281
 epoch: 46, train_loss: 1.2526, test_loss: 1.3042, test_f1: 0.2281
 epoch: 47, train_loss: 1.2526, test_loss: 1.3035, test_f1: 0.2281
 epoch: 48, train_loss: 1.2524, test_loss: 1.3024, test_f1: 0.2281
 epoch: 49, train_loss: 1.2522, test_loss: 1.3042, test_f1: 0.2281
 epoch: 50, train_loss: 1.2529, test_loss: 1.3067, test_f1: 0.2281
 epoch: 51, train_loss: 1.2525, test_loss: 1.3048, test_f1: 0.2281
 epoch: 52, train_loss: 1.2523, test_loss: 1.3055, test_f1: 0.2281
 epoch: 53, train_loss: 1.2525, test_loss: 1.3086, test_f1: 0.2281
 epoch: 54, train_loss: 1.2534, test_loss: 1.3097, test_f1: 0.2281
 epoch: 55, train_loss: 1.2528, test_loss: 1.3072, test_f1: 0.2281
 epoch: 56, train_loss: 1.2535, test_loss: 1.3092, test_f1: 0.2281
 epoch: 57, train_loss: 1.2534, test_loss: 1.3086, test_f1: 0.2281
 epoch: 58, train_loss: 1.2524, test_loss: 1.3044, test_f1: 0.2281
 epoch: 59, train_loss: 1.2520, test_loss: 1.3037, test_f1: 0.2281
 epoch: 60, train_loss: 1.2523, test_loss: 1.3017, test_f1: 0.2281
 epoch: 61, train_loss: 1.2529, test_loss: 1.2995, test_f1: 0.2281
 epoch: 62, train_loss: 1.2534, test_loss: 1.3001, test_f1: 0.2281
 epoch: 63, train_loss: 1.2534, test_loss: 1.3022, test_f1: 0.2281
 epoch: 64, train_loss: 1.2529, test_loss: 1.3052, test_f1: 0.2281
 epoch: 65, train_loss: 1.2524, test_loss: 1.3054, test_f1: 0.2281
 epoch: 66, train_loss: 1.2522, test_loss: 1.3036, test_f1: 0.2281
 epoch: 67, train_loss: 1.2523, test_loss: 1.3049, test_f1: 0.2281
 epoch: 68, train_loss: 1.2525, test_loss: 1.3080, test_f1: 0.2281
 epoch: 69, train_loss: 1.2524, test_loss: 1.3064, test_f1: 0.2281
 epoch: 70, train_loss: 1.2522, test_loss: 1.3037, test_f1: 0.2281
 epoch: 71, train_loss: 1.2525, test_loss: 1.3012, test_f1: 0.2281
 epoch: 72, train_loss: 1.2524, test_loss: 1.3031, test_f1: 0.2281
 epoch: 73, train_loss: 1.2522, test_loss: 1.3061, test_f1: 0.2281
 epoch: 74, train_loss: 1.2524, test_loss: 1.3066, test_f1: 0.2281
 epoch: 75, train_loss: 1.2517, test_loss: 1.3033, test_f1: 0.2281
 epoch: 76, train_loss: 1.2523, test_loss: 1.3036, test_f1: 0.2281
 epoch: 77, train_loss: 1.2527, test_loss: 1.3066, test_f1: 0.2281
 epoch: 78, train_loss: 1.2523, test_loss: 1.3061, test_f1: 0.2281
 epoch: 79, train_loss: 1.2522, test_loss: 1.3050, test_f1: 0.2281
 epoch: 80, train_loss: 1.2520, test_loss: 1.3033, test_f1: 0.2281
 epoch: 81, train_loss: 1.2525, test_loss: 1.3044, test_f1: 0.2281
 epoch: 82, train_loss: 1.2525, test_loss: 1.3054, test_f1: 0.2281
 epoch: 83, train_loss: 1.2528, test_loss: 1.3046, test_f1: 0.2281
 epoch: 84, train_loss: 1.2523, test_loss: 1.3056, test_f1: 0.2281
 epoch: 85, train_loss: 1.2523, test_loss: 1.3070, test_f1: 0.2281
 epoch: 86, train_loss: 1.2524, test_loss: 1.3047, test_f1: 0.2281
 epoch: 87, train_loss: 1.2522, test_loss: 1.3032, test_f1: 0.2281
 epoch: 88, train_loss: 1.2524, test_loss: 1.3037, test_f1: 0.2281
 epoch: 89, train_loss: 1.2525, test_loss: 1.3041, test_f1: 0.2281
 epoch: 90, train_loss: 1.2522, test_loss: 1.3056, test_f1: 0.2281
 epoch: 91, train_loss: 1.2521, test_loss: 1.3042, test_f1: 0.2281
 epoch: 92, train_loss: 1.2521, test_loss: 1.3043, test_f1: 0.2281
 epoch: 93, train_loss: 1.2519, test_loss: 1.3071, test_f1: 0.2281
 epoch: 94, train_loss: 1.2525, test_loss: 1.3084, test_f1: 0.2281
 epoch: 95, train_loss: 1.2524, test_loss: 1.3075, test_f1: 0.2281
 epoch: 96, train_loss: 1.2523, test_loss: 1.3066, test_f1: 0.2281
 epoch: 97, train_loss: 1.2522, test_loss: 1.3060, test_f1: 0.2281
 epoch: 98, train_loss: 1.2521, test_loss: 1.3046, test_f1: 0.2281
 epoch: 99, train_loss: 1.2522, test_loss: 1.3044, test_f1: 0.2281
##################ITERATION #9 ****************************************
 epoch: 0, train_loss: 1.2561, test_loss: 1.3084, test_f1: 0.2281
 epoch: 1, train_loss: 1.2560, test_loss: 1.3015, test_f1: 0.2281
 epoch: 2, train_loss: 1.2531, test_loss: 1.3025, test_f1: 0.2281
 epoch: 3, train_loss: 1.2529, test_loss: 1.3067, test_f1: 0.2281
 epoch: 4, train_loss: 1.2531, test_loss: 1.3073, test_f1: 0.2281
 epoch: 5, train_loss: 1.2525, test_loss: 1.3078, test_f1: 0.2281
 epoch: 6, train_loss: 1.2529, test_loss: 1.3073, test_f1: 0.2281
 epoch: 7, train_loss: 1.2530, test_loss: 1.3090, test_f1: 0.2281
 epoch: 8, train_loss: 1.2528, test_loss: 1.3088, test_f1: 0.2281
 epoch: 9, train_loss: 1.2528, test_loss: 1.3089, test_f1: 0.2281
 epoch: 10, train_loss: 1.2534, test_loss: 1.3035, test_f1: 0.2281
 epoch: 11, train_loss: 1.2536, test_loss: 1.3022, test_f1: 0.2281
 epoch: 12, train_loss: 1.2536, test_loss: 1.3000, test_f1: 0.2281
 epoch: 13, train_loss: 1.2535, test_loss: 1.3058, test_f1: 0.2281
 epoch: 14, train_loss: 1.2535, test_loss: 1.3136, test_f1: 0.2281
 epoch: 15, train_loss: 1.2540, test_loss: 1.3110, test_f1: 0.2281
 epoch: 16, train_loss: 1.2538, test_loss: 1.3038, test_f1: 0.2281
 epoch: 17, train_loss: 1.2534, test_loss: 1.2996, test_f1: 0.2281
 epoch: 18, train_loss: 1.2534, test_loss: 1.3032, test_f1: 0.2281
 epoch: 19, train_loss: 1.2532, test_loss: 1.3057, test_f1: 0.2281
 epoch: 20, train_loss: 1.2526, test_loss: 1.3035, test_f1: 0.2281
 epoch: 21, train_loss: 1.2527, test_loss: 1.3039, test_f1: 0.2281
 epoch: 22, train_loss: 1.2525, test_loss: 1.3054, test_f1: 0.2281
 epoch: 23, train_loss: 1.2525, test_loss: 1.3016, test_f1: 0.2281
 epoch: 24, train_loss: 1.2544, test_loss: 1.3031, test_f1: 0.2281
 epoch: 25, train_loss: 1.2526, test_loss: 1.3052, test_f1: 0.2281
 epoch: 26, train_loss: 1.2522, test_loss: 1.3054, test_f1: 0.2281
 epoch: 27, train_loss: 1.2534, test_loss: 1.3074, test_f1: 0.2281
 epoch: 28, train_loss: 1.2525, test_loss: 1.3103, test_f1: 0.2281
 epoch: 29, train_loss: 1.2533, test_loss: 1.3050, test_f1: 0.2281
 epoch: 30, train_loss: 1.2521, test_loss: 1.3044, test_f1: 0.2281
 epoch: 31, train_loss: 1.2545, test_loss: 1.3048, test_f1: 0.2281
 epoch: 32, train_loss: 1.2547, test_loss: 1.3055, test_f1: 0.2281
 epoch: 33, train_loss: 1.2521, test_loss: 1.3078, test_f1: 0.2281
 epoch: 34, train_loss: 1.2544, test_loss: 1.3104, test_f1: 0.2281
 epoch: 35, train_loss: 1.2534, test_loss: 1.3052, test_f1: 0.2281
 epoch: 36, train_loss: 1.2524, test_loss: 1.3031, test_f1: 0.2281
 epoch: 37, train_loss: 1.2528, test_loss: 1.3057, test_f1: 0.2281
 epoch: 38, train_loss: 1.2529, test_loss: 1.3053, test_f1: 0.2281
 epoch: 39, train_loss: 1.2531, test_loss: 1.3024, test_f1: 0.2281
 epoch: 40, train_loss: 1.2523, test_loss: 1.3050, test_f1: 0.2281
 epoch: 41, train_loss: 1.2525, test_loss: 1.3033, test_f1: 0.2281
 epoch: 42, train_loss: 1.2535, test_loss: 1.3045, test_f1: 0.2281
 epoch: 43, train_loss: 1.2523, test_loss: 1.3067, test_f1: 0.2281
 epoch: 44, train_loss: 1.2526, test_loss: 1.3082, test_f1: 0.2281
 epoch: 45, train_loss: 1.2525, test_loss: 1.3067, test_f1: 0.2281
 epoch: 46, train_loss: 1.2521, test_loss: 1.3038, test_f1: 0.2281
 epoch: 47, train_loss: 1.2549, test_loss: 1.3048, test_f1: 0.2281
 epoch: 48, train_loss: 1.2521, test_loss: 1.3052, test_f1: 0.2281
 epoch: 49, train_loss: 1.2538, test_loss: 1.3086, test_f1: 0.2281
 epoch: 50, train_loss: 1.2533, test_loss: 1.3043, test_f1: 0.2281
 epoch: 51, train_loss: 1.2529, test_loss: 1.3036, test_f1: 0.2281
 epoch: 52, train_loss: 1.2528, test_loss: 1.3048, test_f1: 0.2281
 epoch: 53, train_loss: 1.2520, test_loss: 1.3049, test_f1: 0.2281
 epoch: 54, train_loss: 1.2523, test_loss: 1.3055, test_f1: 0.2281
 epoch: 55, train_loss: 1.2524, test_loss: 1.3052, test_f1: 0.2281
 epoch: 56, train_loss: 1.2524, test_loss: 1.3047, test_f1: 0.2281
 epoch: 57, train_loss: 1.2525, test_loss: 1.3037, test_f1: 0.2281
 epoch: 58, train_loss: 1.2521, test_loss: 1.3035, test_f1: 0.2281
 epoch: 59, train_loss: 1.2526, test_loss: 1.3041, test_f1: 0.2281
 epoch: 60, train_loss: 1.2526, test_loss: 1.3035, test_f1: 0.2281
 epoch: 61, train_loss: 1.2528, test_loss: 1.3067, test_f1: 0.2281
 epoch: 62, train_loss: 1.2533, test_loss: 1.3102, test_f1: 0.2281
 epoch: 63, train_loss: 1.2540, test_loss: 1.3107, test_f1: 0.2281
 epoch: 64, train_loss: 1.2531, test_loss: 1.3058, test_f1: 0.2281
 epoch: 65, train_loss: 1.2522, test_loss: 1.3028, test_f1: 0.2281
 epoch: 66, train_loss: 1.2527, test_loss: 1.3040, test_f1: 0.2281
 epoch: 67, train_loss: 1.2526, test_loss: 1.3057, test_f1: 0.2281
 epoch: 68, train_loss: 1.2522, test_loss: 1.3045, test_f1: 0.2281
 epoch: 69, train_loss: 1.2521, test_loss: 1.3049, test_f1: 0.2281
 epoch: 70, train_loss: 1.2526, test_loss: 1.3045, test_f1: 0.2281
 epoch: 71, train_loss: 1.2521, test_loss: 1.3039, test_f1: 0.2281
 epoch: 72, train_loss: 1.2521, test_loss: 1.3049, test_f1: 0.2281
 epoch: 73, train_loss: 1.2529, test_loss: 1.3066, test_f1: 0.2281
 epoch: 74, train_loss: 1.2526, test_loss: 1.3041, test_f1: 0.2281
 epoch: 75, train_loss: 1.2523, test_loss: 1.3057, test_f1: 0.2281
 epoch: 76, train_loss: 1.2530, test_loss: 1.3097, test_f1: 0.2281
 epoch: 77, train_loss: 1.2524, test_loss: 1.3077, test_f1: 0.2281
 epoch: 78, train_loss: 1.2525, test_loss: 1.3062, test_f1: 0.2281
 epoch: 79, train_loss: 1.2528, test_loss: 1.3057, test_f1: 0.2281
 epoch: 80, train_loss: 1.2527, test_loss: 1.3074, test_f1: 0.2281
 epoch: 81, train_loss: 1.2524, test_loss: 1.3068, test_f1: 0.2281
 epoch: 82, train_loss: 1.2522, test_loss: 1.3047, test_f1: 0.2281
 epoch: 83, train_loss: 1.2523, test_loss: 1.3033, test_f1: 0.2281
 epoch: 84, train_loss: 1.2522, test_loss: 1.3040, test_f1: 0.2281
 epoch: 85, train_loss: 1.2530, test_loss: 1.3058, test_f1: 0.2281
 epoch: 86, train_loss: 1.2531, test_loss: 1.3052, test_f1: 0.2281
 epoch: 87, train_loss: 1.2518, test_loss: 1.3043, test_f1: 0.2281
 epoch: 88, train_loss: 1.2523, test_loss: 1.3054, test_f1: 0.2281
 epoch: 89, train_loss: 1.2539, test_loss: 1.3031, test_f1: 0.2281
 epoch: 90, train_loss: 1.2531, test_loss: 1.3021, test_f1: 0.2281
 epoch: 91, train_loss: 1.2523, test_loss: 1.3037, test_f1: 0.2281
 epoch: 92, train_loss: 1.2525, test_loss: 1.3055, test_f1: 0.2281
 epoch: 93, train_loss: 1.2527, test_loss: 1.3053, test_f1: 0.2281
 epoch: 94, train_loss: 1.2534, test_loss: 1.3071, test_f1: 0.2281
 epoch: 95, train_loss: 1.2521, test_loss: 1.3068, test_f1: 0.2281
 epoch: 96, train_loss: 1.2527, test_loss: 1.3065, test_f1: 0.2281
 epoch: 97, train_loss: 1.2540, test_loss: 1.3052, test_f1: 0.2281
 epoch: 98, train_loss: 1.2527, test_loss: 1.3060, test_f1: 0.2281
 epoch: 99, train_loss: 1.2522, test_loss: 1.3071, test_f1: 0.2281

Training completed in 364.71 seconds
Best F1: 0.5587 at epoch 88
Mean F1 across iterations: 0.2851  0.1027
========================FINAL RESULTS================================
FEGIN weighted F1: 0.5587  0.1027
python main.py --data ltspice_demos --representation component_pin_net --model FEGIN --layers 2 --hiddens 64 --batch_size 256 --lr 0.1 --emb_size 512 --epochs 100 --save_appendix component_pin_net_L2_H64_BS256_LR0.1_E512 --no_val
-----



STDERR:
  File "main.py", line 370, in <module>
    main()
  File "main.py", line 254, in main
    dataset = dataset_class(
  File "/home/philip/projects/ltspice_examples_code_repo/Circuit-Completion-Using-GNNs/component_classification_with_link_prediction_head/evaluation/FEGIN/kernel/circuit_datasets.py", line 15, in __init__
    self.data, self.slices = torch.load(self.processed_paths[0])
  File "/home/philip/.local/lib/python3.8/site-packages/torch/serialization.py", line 1040, in load
    warnings.warn(
  File "/usr/lib/python3.8/warnings.py", line 109, in _showwarnmsg
    sw(msg.message, msg.category, msg.filename, msg.lineno,
  File "main.py", line 47, in warn_with_traceback
    traceback.print_stack(file=log)
/home/philip/projects/ltspice_examples_code_repo/Circuit-Completion-Using-GNNs/component_classification_with_link_prediction_head/evaluation/FEGIN/kernel/circuit_datasets.py:15: FutureWarning: You are using `torch.load` with `weights_only=False` (the current default value), which uses the default pickle module implicitly. It is possible to construct malicious pickle data which will execute arbitrary code during unpickling (See https://github.com/pytorch/pytorch/blob/main/SECURITY.md#untrusted-models for more details). In a future release, the default value for `weights_only` will be flipped to `True`. This limits the functions that could be executed during unpickling. Arbitrary objects will no longer be allowed to be loaded via this mode unless they are explicitly allowlisted by the user via `torch.serialization.add_safe_globals`. We recommend you start setting `weights_only=True` for any use case where you don't have full control of the loaded file. Please open an issue on GitHub for any issues related to this experimental feature.
  self.data, self.slices = torch.load(self.processed_paths[0])
