STDOUT:
Results will be saved in /home/philip/projects/ltspice_examples_code_repo/Circuit-Completion-Using-GNNs/component_classification_with_link_prediction_head/evaluation/FEGIN/results/model_FEGIN_dataset_ltspice_examples
Command line input: python main.py --data ltspice_examples --representation component_pin --model FEGIN --layers 6 --hiddens 64 --batch_size 64 --lr 0.01 --emb_size 250 --epochs 100 --save_appendix component_pin_L6_H64_BS64_LR0.01_E250 --no_val
 is saved.
-----
ltspice_examples - FEGIN
Using 6 layers, 64 hidden units, h = 2
Loading component_pin representation dataset
ENTERED
Training FEGIN on component_pin representation
Train: 3560, Test: 848
##################ITERATION #0 ****************************************
 epoch: 0, train_loss: 1.1918, test_loss: 1.0972, test_f1: 0.3940
 epoch: 1, train_loss: 1.0798, test_loss: 1.0818, test_f1: 0.3918
 epoch: 2, train_loss: 1.0137, test_loss: 1.0116, test_f1: 0.4524
 epoch: 3, train_loss: 0.9811, test_loss: 1.0239, test_f1: 0.4875
 epoch: 4, train_loss: 0.9507, test_loss: 1.0101, test_f1: 0.4778
 epoch: 5, train_loss: 0.9265, test_loss: 0.9211, test_f1: 0.5005
 epoch: 6, train_loss: 0.9064, test_loss: 1.1905, test_f1: 0.4600
 epoch: 7, train_loss: 0.9096, test_loss: 0.9474, test_f1: 0.5292
 epoch: 8, train_loss: 0.8839, test_loss: 1.0147, test_f1: 0.4913
 epoch: 9, train_loss: 0.8789, test_loss: 0.9841, test_f1: 0.5068
 epoch: 10, train_loss: 0.8692, test_loss: 1.0046, test_f1: 0.4604
 epoch: 11, train_loss: 0.8395, test_loss: 1.0706, test_f1: 0.4730
 epoch: 12, train_loss: 0.8314, test_loss: 0.9811, test_f1: 0.5175
 epoch: 13, train_loss: 0.8207, test_loss: 0.8822, test_f1: 0.5482
 epoch: 14, train_loss: 0.8024, test_loss: 0.8819, test_f1: 0.5566
 epoch: 15, train_loss: 0.7792, test_loss: 0.8324, test_f1: 0.5805
 epoch: 16, train_loss: 0.7897, test_loss: 0.9662, test_f1: 0.5289
 epoch: 17, train_loss: 0.7906, test_loss: 0.8865, test_f1: 0.5462
 epoch: 18, train_loss: 0.7984, test_loss: 0.8520, test_f1: 0.5609
 epoch: 19, train_loss: 0.7721, test_loss: 0.9280, test_f1: 0.5517
 epoch: 20, train_loss: 0.7624, test_loss: 0.8886, test_f1: 0.5614
 epoch: 21, train_loss: 0.7625, test_loss: 0.8871, test_f1: 0.5404
 epoch: 22, train_loss: 0.7492, test_loss: 0.8753, test_f1: 0.5925
 epoch: 23, train_loss: 0.7308, test_loss: 1.0200, test_f1: 0.5542
 epoch: 24, train_loss: 0.7443, test_loss: 0.9088, test_f1: 0.6168
 epoch: 25, train_loss: 0.7552, test_loss: 0.9132, test_f1: 0.5909
 epoch: 26, train_loss: 0.7230, test_loss: 0.8180, test_f1: 0.5502
 epoch: 27, train_loss: 0.7191, test_loss: 1.1182, test_f1: 0.5393
 epoch: 28, train_loss: 0.7437, test_loss: 0.9794, test_f1: 0.6164
 epoch: 29, train_loss: 0.7236, test_loss: 1.3643, test_f1: 0.4400
 epoch: 30, train_loss: 0.7162, test_loss: 0.8736, test_f1: 0.5775
 epoch: 31, train_loss: 0.7359, test_loss: 0.8667, test_f1: 0.5237
 epoch: 32, train_loss: 0.7162, test_loss: 0.8248, test_f1: 0.6079
 epoch: 33, train_loss: 0.7052, test_loss: 0.9324, test_f1: 0.6002
 epoch: 34, train_loss: 0.7023, test_loss: 0.8645, test_f1: 0.5627
 epoch: 35, train_loss: 0.6913, test_loss: 0.8590, test_f1: 0.5529
 epoch: 36, train_loss: 0.6772, test_loss: 1.0527, test_f1: 0.5602
 epoch: 37, train_loss: 0.6838, test_loss: 1.0177, test_f1: 0.5741
 epoch: 38, train_loss: 0.6546, test_loss: 0.8970, test_f1: 0.5857
 epoch: 39, train_loss: 0.6843, test_loss: 1.1088, test_f1: 0.5895
 epoch: 40, train_loss: 0.6781, test_loss: 0.9618, test_f1: 0.5788
 epoch: 41, train_loss: 0.6604, test_loss: 0.9686, test_f1: 0.6084
 epoch: 42, train_loss: 0.6652, test_loss: 0.9559, test_f1: 0.5986
 epoch: 43, train_loss: 0.6475, test_loss: 0.8316, test_f1: 0.6331
 epoch: 44, train_loss: 0.6374, test_loss: 0.8602, test_f1: 0.5994
 epoch: 45, train_loss: 0.6495, test_loss: 0.9669, test_f1: 0.5899
 epoch: 46, train_loss: 0.6422, test_loss: 0.7739, test_f1: 0.5863
 epoch: 47, train_loss: 0.6431, test_loss: 0.9026, test_f1: 0.6270
 epoch: 48, train_loss: 0.6382, test_loss: 0.9913, test_f1: 0.6157
 epoch: 49, train_loss: 0.6384, test_loss: 1.1234, test_f1: 0.5782
 epoch: 50, train_loss: 0.6304, test_loss: 0.8663, test_f1: 0.5935
 epoch: 51, train_loss: 0.6050, test_loss: 0.8530, test_f1: 0.6372
 epoch: 52, train_loss: 0.5692, test_loss: 0.9158, test_f1: 0.6176
 epoch: 53, train_loss: 0.5720, test_loss: 0.9740, test_f1: 0.6204
 epoch: 54, train_loss: 0.5632, test_loss: 0.8734, test_f1: 0.6283
 epoch: 55, train_loss: 0.5481, test_loss: 0.9197, test_f1: 0.6237
 epoch: 56, train_loss: 0.5346, test_loss: 0.9737, test_f1: 0.6332
 epoch: 57, train_loss: 0.5415, test_loss: 0.9603, test_f1: 0.6233
 epoch: 58, train_loss: 0.5347, test_loss: 0.8620, test_f1: 0.6458
 epoch: 59, train_loss: 0.5481, test_loss: 0.9713, test_f1: 0.6399
 epoch: 60, train_loss: 0.5336, test_loss: 0.9052, test_f1: 0.6311
 epoch: 61, train_loss: 0.5291, test_loss: 0.8875, test_f1: 0.6475
 epoch: 62, train_loss: 0.5269, test_loss: 0.9250, test_f1: 0.6380
 epoch: 63, train_loss: 0.5307, test_loss: 1.0318, test_f1: 0.6276
 epoch: 64, train_loss: 0.5251, test_loss: 0.9624, test_f1: 0.6323
 epoch: 65, train_loss: 0.5264, test_loss: 1.0504, test_f1: 0.5982
 epoch: 66, train_loss: 0.5270, test_loss: 1.1761, test_f1: 0.5952
 epoch: 67, train_loss: 0.5245, test_loss: 0.9297, test_f1: 0.6488
 epoch: 68, train_loss: 0.5138, test_loss: 1.0189, test_f1: 0.6240
 epoch: 69, train_loss: 0.5245, test_loss: 0.8984, test_f1: 0.6253
 epoch: 70, train_loss: 0.4994, test_loss: 0.9059, test_f1: 0.6317
 epoch: 71, train_loss: 0.5119, test_loss: 1.0245, test_f1: 0.6306
 epoch: 72, train_loss: 0.5221, test_loss: 0.9725, test_f1: 0.6359
 epoch: 73, train_loss: 0.4934, test_loss: 0.9512, test_f1: 0.6401
 epoch: 74, train_loss: 0.4936, test_loss: 1.1732, test_f1: 0.6287
 epoch: 75, train_loss: 0.4858, test_loss: 0.9417, test_f1: 0.6268
 epoch: 76, train_loss: 0.4923, test_loss: 0.8919, test_f1: 0.6589
 epoch: 77, train_loss: 0.4963, test_loss: 1.0487, test_f1: 0.6477
 epoch: 78, train_loss: 0.5064, test_loss: 0.8794, test_f1: 0.6394
 epoch: 79, train_loss: 0.4769, test_loss: 0.9049, test_f1: 0.6567
 epoch: 80, train_loss: 0.4705, test_loss: 0.9150, test_f1: 0.6544
 epoch: 81, train_loss: 0.4806, test_loss: 1.2518, test_f1: 0.6033
 epoch: 82, train_loss: 0.4675, test_loss: 1.0987, test_f1: 0.6494
 epoch: 83, train_loss: 0.4620, test_loss: 1.0316, test_f1: 0.6477
 epoch: 84, train_loss: 0.4862, test_loss: 1.1806, test_f1: 0.6276
 epoch: 85, train_loss: 0.4491, test_loss: 1.0408, test_f1: 0.6584
 epoch: 86, train_loss: 0.4658, test_loss: 1.0749, test_f1: 0.6619
 epoch: 87, train_loss: 0.4689, test_loss: 1.1901, test_f1: 0.6234
 epoch: 88, train_loss: 0.4472, test_loss: 1.0734, test_f1: 0.6449
 epoch: 89, train_loss: 0.4649, test_loss: 1.1428, test_f1: 0.6585
 epoch: 90, train_loss: 0.4652, test_loss: 1.0487, test_f1: 0.6516
 epoch: 91, train_loss: 0.4439, test_loss: 0.8709, test_f1: 0.6493
 epoch: 92, train_loss: 0.4568, test_loss: 1.0309, test_f1: 0.6354
 epoch: 93, train_loss: 0.4510, test_loss: 1.1992, test_f1: 0.6561
 epoch: 94, train_loss: 0.4567, test_loss: 1.1827, test_f1: 0.6405
 epoch: 95, train_loss: 0.4434, test_loss: 1.2843, test_f1: 0.6642
 epoch: 96, train_loss: 0.4400, test_loss: 1.5683, test_f1: 0.5414
 epoch: 97, train_loss: 0.4362, test_loss: 1.2499, test_f1: 0.6292
 epoch: 98, train_loss: 0.4340, test_loss: 1.2427, test_f1: 0.6077
 epoch: 99, train_loss: 0.4376, test_loss: 1.0946, test_f1: 0.6688
##################ITERATION #1 ****************************************
 epoch: 0, train_loss: 1.1733, test_loss: 1.2279, test_f1: 0.4257
 epoch: 1, train_loss: 1.0738, test_loss: 1.1305, test_f1: 0.3721
 epoch: 2, train_loss: 1.0260, test_loss: 1.1449, test_f1: 0.3502
 epoch: 3, train_loss: 1.0066, test_loss: 1.0706, test_f1: 0.4184
 epoch: 4, train_loss: 0.9802, test_loss: 1.0164, test_f1: 0.4717
 epoch: 5, train_loss: 0.9677, test_loss: 0.9902, test_f1: 0.4654
 epoch: 6, train_loss: 0.9455, test_loss: 0.9575, test_f1: 0.5059
 epoch: 7, train_loss: 0.9155, test_loss: 0.9490, test_f1: 0.5012
 epoch: 8, train_loss: 0.8914, test_loss: 0.8574, test_f1: 0.5234
 epoch: 9, train_loss: 0.8954, test_loss: 0.9114, test_f1: 0.5102
 epoch: 10, train_loss: 0.8625, test_loss: 0.9239, test_f1: 0.4979
 epoch: 11, train_loss: 0.8567, test_loss: 1.1932, test_f1: 0.4245
 epoch: 12, train_loss: 0.8591, test_loss: 0.9554, test_f1: 0.4946
 epoch: 13, train_loss: 0.8658, test_loss: 0.8854, test_f1: 0.5434
 epoch: 14, train_loss: 0.8256, test_loss: 0.8330, test_f1: 0.5738
 epoch: 15, train_loss: 0.8074, test_loss: 0.8661, test_f1: 0.4786
 epoch: 16, train_loss: 0.8152, test_loss: 0.8778, test_f1: 0.6024
 epoch: 17, train_loss: 0.8058, test_loss: 0.8478, test_f1: 0.5278
 epoch: 18, train_loss: 0.8024, test_loss: 0.8254, test_f1: 0.5359
 epoch: 19, train_loss: 0.7932, test_loss: 0.8074, test_f1: 0.5809
 epoch: 20, train_loss: 0.7690, test_loss: 0.8880, test_f1: 0.5691
 epoch: 21, train_loss: 0.7677, test_loss: 0.8321, test_f1: 0.5720
 epoch: 22, train_loss: 0.7509, test_loss: 0.8891, test_f1: 0.5924
 epoch: 23, train_loss: 0.7396, test_loss: 0.8771, test_f1: 0.5716
 epoch: 24, train_loss: 0.7617, test_loss: 0.8726, test_f1: 0.5470
 epoch: 25, train_loss: 0.7395, test_loss: 0.8292, test_f1: 0.5649
 epoch: 26, train_loss: 0.7347, test_loss: 0.8870, test_f1: 0.5524
 epoch: 27, train_loss: 0.7322, test_loss: 0.8592, test_f1: 0.5931
 epoch: 28, train_loss: 0.7291, test_loss: 0.8315, test_f1: 0.5700
 epoch: 29, train_loss: 0.7562, test_loss: 0.9298, test_f1: 0.5456
 epoch: 30, train_loss: 0.6998, test_loss: 1.0482, test_f1: 0.5904
 epoch: 31, train_loss: 0.7164, test_loss: 0.9513, test_f1: 0.6021
 epoch: 32, train_loss: 0.7200, test_loss: 1.0351, test_f1: 0.4702
 epoch: 33, train_loss: 0.7017, test_loss: 0.9456, test_f1: 0.6309
 epoch: 34, train_loss: 0.6981, test_loss: 0.9697, test_f1: 0.5488
 epoch: 35, train_loss: 0.6838, test_loss: 1.0646, test_f1: 0.5694
 epoch: 36, train_loss: 0.6782, test_loss: 0.9168, test_f1: 0.5813
 epoch: 37, train_loss: 0.6700, test_loss: 0.9822, test_f1: 0.5312
 epoch: 38, train_loss: 0.6687, test_loss: 0.9494, test_f1: 0.6460
 epoch: 39, train_loss: 0.6721, test_loss: 0.8891, test_f1: 0.6125
 epoch: 40, train_loss: 0.6904, test_loss: 0.8830, test_f1: 0.6162
 epoch: 41, train_loss: 0.6586, test_loss: 0.9358, test_f1: 0.6477
 epoch: 42, train_loss: 0.6685, test_loss: 1.0275, test_f1: 0.6087
 epoch: 43, train_loss: 0.6696, test_loss: 0.9119, test_f1: 0.6222
 epoch: 44, train_loss: 0.6339, test_loss: 0.8816, test_f1: 0.6487
 epoch: 45, train_loss: 0.6375, test_loss: 1.1076, test_f1: 0.6387
 epoch: 46, train_loss: 0.6332, test_loss: 0.9958, test_f1: 0.5852
 epoch: 47, train_loss: 0.6421, test_loss: 0.9574, test_f1: 0.6257
 epoch: 48, train_loss: 0.6150, test_loss: 1.0060, test_f1: 0.6156
 epoch: 49, train_loss: 0.6257, test_loss: 0.8723, test_f1: 0.6359
 epoch: 50, train_loss: 0.6240, test_loss: 0.7908, test_f1: 0.6424
 epoch: 51, train_loss: 0.5720, test_loss: 0.9682, test_f1: 0.6465
 epoch: 52, train_loss: 0.5700, test_loss: 0.9467, test_f1: 0.6383
 epoch: 53, train_loss: 0.5679, test_loss: 0.9862, test_f1: 0.6504
 epoch: 54, train_loss: 0.5564, test_loss: 1.0093, test_f1: 0.6209
 epoch: 55, train_loss: 0.5386, test_loss: 1.0783, test_f1: 0.6330
 epoch: 56, train_loss: 0.5341, test_loss: 0.9445, test_f1: 0.6302
 epoch: 57, train_loss: 0.5398, test_loss: 0.9758, test_f1: 0.6356
 epoch: 58, train_loss: 0.5398, test_loss: 1.0550, test_f1: 0.6346
 epoch: 59, train_loss: 0.5334, test_loss: 0.9182, test_f1: 0.6304
 epoch: 60, train_loss: 0.5185, test_loss: 1.2380, test_f1: 0.6445
 epoch: 61, train_loss: 0.5143, test_loss: 1.1184, test_f1: 0.6506
 epoch: 62, train_loss: 0.5206, test_loss: 1.1039, test_f1: 0.6602
 epoch: 63, train_loss: 0.5127, test_loss: 1.1835, test_f1: 0.6420
 epoch: 64, train_loss: 0.5175, test_loss: 1.1257, test_f1: 0.6508
 epoch: 65, train_loss: 0.5072, test_loss: 1.1674, test_f1: 0.6507
 epoch: 66, train_loss: 0.5204, test_loss: 1.0131, test_f1: 0.6753
 epoch: 67, train_loss: 0.5073, test_loss: 1.0058, test_f1: 0.6426
 epoch: 68, train_loss: 0.4910, test_loss: 1.1573, test_f1: 0.6407
 epoch: 69, train_loss: 0.4798, test_loss: 1.1635, test_f1: 0.6464
 epoch: 70, train_loss: 0.4712, test_loss: 1.2116, test_f1: 0.6353
 epoch: 71, train_loss: 0.4795, test_loss: 1.1836, test_f1: 0.6204
 epoch: 72, train_loss: 0.4799, test_loss: 1.0968, test_f1: 0.6700
 epoch: 73, train_loss: 0.4886, test_loss: 1.1231, test_f1: 0.6390
 epoch: 74, train_loss: 0.4940, test_loss: 1.0349, test_f1: 0.6482
 epoch: 75, train_loss: 0.4834, test_loss: 0.9961, test_f1: 0.6525
 epoch: 76, train_loss: 0.4661, test_loss: 1.0830, test_f1: 0.6594
 epoch: 77, train_loss: 0.4544, test_loss: 1.1049, test_f1: 0.6191
 epoch: 78, train_loss: 0.4477, test_loss: 1.1028, test_f1: 0.6468
 epoch: 79, train_loss: 0.4539, test_loss: 1.2411, test_f1: 0.6313
 epoch: 80, train_loss: 0.4575, test_loss: 1.1525, test_f1: 0.6385
 epoch: 81, train_loss: 0.4604, test_loss: 1.2652, test_f1: 0.6649
 epoch: 82, train_loss: 0.4714, test_loss: 1.1075, test_f1: 0.6661
 epoch: 83, train_loss: 0.4668, test_loss: 1.1870, test_f1: 0.6460
 epoch: 84, train_loss: 0.4868, test_loss: 1.0784, test_f1: 0.6433
 epoch: 85, train_loss: 0.4485, test_loss: 1.1596, test_f1: 0.6669
 epoch: 86, train_loss: 0.4409, test_loss: 1.3147, test_f1: 0.6634
 epoch: 87, train_loss: 0.4447, test_loss: 1.0918, test_f1: 0.6694
 epoch: 88, train_loss: 0.4592, test_loss: 1.1464, test_f1: 0.6658
 epoch: 89, train_loss: 0.4365, test_loss: 1.1761, test_f1: 0.6507
 epoch: 90, train_loss: 0.4368, test_loss: 1.1683, test_f1: 0.6527
 epoch: 91, train_loss: 0.4154, test_loss: 1.3947, test_f1: 0.6482
 epoch: 92, train_loss: 0.4319, test_loss: 1.2181, test_f1: 0.6635
 epoch: 93, train_loss: 0.4425, test_loss: 1.4838, test_f1: 0.6699
 epoch: 94, train_loss: 0.4314, test_loss: 1.4964, test_f1: 0.6356
 epoch: 95, train_loss: 0.4252, test_loss: 1.2194, test_f1: 0.6758
 epoch: 96, train_loss: 0.4393, test_loss: 1.4737, test_f1: 0.6311
 epoch: 97, train_loss: 0.4123, test_loss: 1.1660, test_f1: 0.6558
 epoch: 98, train_loss: 0.4234, test_loss: 1.3090, test_f1: 0.6497
 epoch: 99, train_loss: 0.4263, test_loss: 1.1124, test_f1: 0.6707
##################ITERATION #2 ****************************************
 epoch: 0, train_loss: 1.1620, test_loss: 1.1112, test_f1: 0.4251
 epoch: 1, train_loss: 1.0457, test_loss: 1.1248, test_f1: 0.4631
 epoch: 2, train_loss: 1.0250, test_loss: 1.0339, test_f1: 0.4812
 epoch: 3, train_loss: 0.9654, test_loss: 1.0514, test_f1: 0.4799
 epoch: 4, train_loss: 0.9612, test_loss: 1.0007, test_f1: 0.4842
 epoch: 5, train_loss: 0.9562, test_loss: 1.0830, test_f1: 0.4670
 epoch: 6, train_loss: 0.9413, test_loss: 1.0070, test_f1: 0.4851
 epoch: 7, train_loss: 0.9308, test_loss: 0.9889, test_f1: 0.4768
 epoch: 8, train_loss: 0.9302, test_loss: 0.9404, test_f1: 0.5254
 epoch: 9, train_loss: 0.8964, test_loss: 0.8878, test_f1: 0.5339
 epoch: 10, train_loss: 0.9152, test_loss: 1.0388, test_f1: 0.4763
 epoch: 11, train_loss: 0.8962, test_loss: 1.0938, test_f1: 0.4583
 epoch: 12, train_loss: 0.8746, test_loss: 0.9001, test_f1: 0.5168
 epoch: 13, train_loss: 0.8569, test_loss: 0.9920, test_f1: 0.4899
 epoch: 14, train_loss: 0.8639, test_loss: 0.9006, test_f1: 0.5504
 epoch: 15, train_loss: 0.8410, test_loss: 0.9020, test_f1: 0.5316
 epoch: 16, train_loss: 0.8334, test_loss: 0.9100, test_f1: 0.5327
 epoch: 17, train_loss: 0.8219, test_loss: 0.9989, test_f1: 0.5242
 epoch: 18, train_loss: 0.8076, test_loss: 0.9507, test_f1: 0.5305
 epoch: 19, train_loss: 0.8136, test_loss: 0.8895, test_f1: 0.5452
 epoch: 20, train_loss: 0.8105, test_loss: 0.9685, test_f1: 0.5507
 epoch: 21, train_loss: 0.7928, test_loss: 0.8838, test_f1: 0.5351
 epoch: 22, train_loss: 0.8013, test_loss: 1.0182, test_f1: 0.5188
 epoch: 23, train_loss: 0.7863, test_loss: 0.8938, test_f1: 0.5384
 epoch: 24, train_loss: 0.7834, test_loss: 1.1499, test_f1: 0.5417
 epoch: 25, train_loss: 0.8016, test_loss: 0.8321, test_f1: 0.5283
 epoch: 26, train_loss: 0.7565, test_loss: 1.1024, test_f1: 0.5470
 epoch: 27, train_loss: 0.7603, test_loss: 0.8482, test_f1: 0.5840
 epoch: 28, train_loss: 0.7571, test_loss: 0.8907, test_f1: 0.5114
 epoch: 29, train_loss: 0.7678, test_loss: 0.9564, test_f1: 0.5115
 epoch: 30, train_loss: 0.7256, test_loss: 0.9565, test_f1: 0.4908
 epoch: 31, train_loss: 0.7535, test_loss: 0.9186, test_f1: 0.5277
 epoch: 32, train_loss: 0.7286, test_loss: 0.8155, test_f1: 0.5513
 epoch: 33, train_loss: 0.7180, test_loss: 0.8009, test_f1: 0.5504
 epoch: 34, train_loss: 0.7062, test_loss: 0.7834, test_f1: 0.6328
 epoch: 35, train_loss: 0.7120, test_loss: 0.7992, test_f1: 0.5561
 epoch: 36, train_loss: 0.7027, test_loss: 0.7855, test_f1: 0.6197
 epoch: 37, train_loss: 0.7106, test_loss: 0.8168, test_f1: 0.6197
 epoch: 38, train_loss: 0.6989, test_loss: 0.7765, test_f1: 0.6120
 epoch: 39, train_loss: 0.6865, test_loss: 0.8422, test_f1: 0.5719
 epoch: 40, train_loss: 0.6778, test_loss: 0.7557, test_f1: 0.6266
 epoch: 41, train_loss: 0.6720, test_loss: 0.9469, test_f1: 0.5916
 epoch: 42, train_loss: 0.6985, test_loss: 0.8826, test_f1: 0.6347
 epoch: 43, train_loss: 0.6583, test_loss: 0.9081, test_f1: 0.6208
 epoch: 44, train_loss: 0.6809, test_loss: 0.9306, test_f1: 0.5509
 epoch: 45, train_loss: 0.6863, test_loss: 0.9032, test_f1: 0.6010
 epoch: 46, train_loss: 0.6536, test_loss: 0.8024, test_f1: 0.6484
 epoch: 47, train_loss: 0.6487, test_loss: 0.8319, test_f1: 0.5933
 epoch: 48, train_loss: 0.6420, test_loss: 0.8591, test_f1: 0.6159
 epoch: 49, train_loss: 0.6279, test_loss: 0.7696, test_f1: 0.6449
 epoch: 50, train_loss: 0.6477, test_loss: 0.8383, test_f1: 0.6096
 epoch: 51, train_loss: 0.6075, test_loss: 0.8769, test_f1: 0.6157
 epoch: 52, train_loss: 0.5927, test_loss: 0.8382, test_f1: 0.6423
 epoch: 53, train_loss: 0.5753, test_loss: 0.8107, test_f1: 0.6378
 epoch: 54, train_loss: 0.5718, test_loss: 0.8163, test_f1: 0.6477
 epoch: 55, train_loss: 0.5762, test_loss: 0.8455, test_f1: 0.6471
 epoch: 56, train_loss: 0.5483, test_loss: 0.8583, test_f1: 0.6542
 epoch: 57, train_loss: 0.5589, test_loss: 0.9452, test_f1: 0.6218
 epoch: 58, train_loss: 0.5359, test_loss: 0.8614, test_f1: 0.6494
 epoch: 59, train_loss: 0.5305, test_loss: 0.8909, test_f1: 0.6585
 epoch: 60, train_loss: 0.5404, test_loss: 0.8797, test_f1: 0.6373
 epoch: 61, train_loss: 0.5325, test_loss: 0.9094, test_f1: 0.6358
 epoch: 62, train_loss: 0.5345, test_loss: 0.9577, test_f1: 0.6320
 epoch: 63, train_loss: 0.5353, test_loss: 1.0010, test_f1: 0.6479
 epoch: 64, train_loss: 0.5255, test_loss: 0.9366, test_f1: 0.6449
 epoch: 65, train_loss: 0.5324, test_loss: 0.8909, test_f1: 0.6514
 epoch: 66, train_loss: 0.4897, test_loss: 0.9888, test_f1: 0.6440
 epoch: 67, train_loss: 0.5061, test_loss: 0.9283, test_f1: 0.6476
 epoch: 68, train_loss: 0.5058, test_loss: 0.8898, test_f1: 0.6455
 epoch: 69, train_loss: 0.5023, test_loss: 0.9171, test_f1: 0.6402
 epoch: 70, train_loss: 0.5120, test_loss: 0.8442, test_f1: 0.6659
 epoch: 71, train_loss: 0.5086, test_loss: 0.9783, test_f1: 0.6158
 epoch: 72, train_loss: 0.5046, test_loss: 0.9013, test_f1: 0.6684
 epoch: 73, train_loss: 0.5092, test_loss: 0.8589, test_f1: 0.6582
 epoch: 74, train_loss: 0.5131, test_loss: 0.9351, test_f1: 0.6580
 epoch: 75, train_loss: 0.5185, test_loss: 0.8879, test_f1: 0.6485
 epoch: 76, train_loss: 0.4802, test_loss: 0.9099, test_f1: 0.6312
 epoch: 77, train_loss: 0.4819, test_loss: 0.9770, test_f1: 0.6579
 epoch: 78, train_loss: 0.4828, test_loss: 0.8748, test_f1: 0.6309
 epoch: 79, train_loss: 0.4796, test_loss: 0.9404, test_f1: 0.6258
 epoch: 80, train_loss: 0.4691, test_loss: 0.9971, test_f1: 0.6360
 epoch: 81, train_loss: 0.4692, test_loss: 0.8995, test_f1: 0.6542
 epoch: 82, train_loss: 0.4687, test_loss: 0.9304, test_f1: 0.6530
 epoch: 83, train_loss: 0.4571, test_loss: 0.8861, test_f1: 0.6852
 epoch: 84, train_loss: 0.4785, test_loss: 0.8721, test_f1: 0.6775
 epoch: 85, train_loss: 0.4593, test_loss: 1.0407, test_f1: 0.6622
 epoch: 86, train_loss: 0.4568, test_loss: 1.0917, test_f1: 0.6120
 epoch: 87, train_loss: 0.4482, test_loss: 1.1858, test_f1: 0.6532
 epoch: 88, train_loss: 0.4599, test_loss: 0.9563, test_f1: 0.6708
 epoch: 89, train_loss: 0.4652, test_loss: 0.9164, test_f1: 0.6650
 epoch: 90, train_loss: 0.4666, test_loss: 1.0585, test_f1: 0.6384
 epoch: 91, train_loss: 0.4485, test_loss: 1.0350, test_f1: 0.6471
 epoch: 92, train_loss: 0.4483, test_loss: 1.0381, test_f1: 0.6120
 epoch: 93, train_loss: 0.4430, test_loss: 1.0591, test_f1: 0.6458
 epoch: 94, train_loss: 0.4725, test_loss: 1.0550, test_f1: 0.6552
 epoch: 95, train_loss: 0.4447, test_loss: 0.9361, test_f1: 0.6560
 epoch: 96, train_loss: 0.4457, test_loss: 1.0118, test_f1: 0.6760
 epoch: 97, train_loss: 0.4262, test_loss: 1.0333, test_f1: 0.6515
 epoch: 98, train_loss: 0.4413, test_loss: 0.9877, test_f1: 0.6593
 epoch: 99, train_loss: 0.4197, test_loss: 1.0624, test_f1: 0.6463
##################ITERATION #3 ****************************************
 epoch: 0, train_loss: 1.1516, test_loss: 1.0587, test_f1: 0.4839
 epoch: 1, train_loss: 0.9952, test_loss: 1.0222, test_f1: 0.5087
 epoch: 2, train_loss: 0.9661, test_loss: 1.0305, test_f1: 0.4580
 epoch: 3, train_loss: 0.9369, test_loss: 1.0899, test_f1: 0.4093
 epoch: 4, train_loss: 0.9255, test_loss: 0.9653, test_f1: 0.5185
 epoch: 5, train_loss: 0.8957, test_loss: 1.1983, test_f1: 0.4619
 epoch: 6, train_loss: 0.9299, test_loss: 0.9386, test_f1: 0.5011
 epoch: 7, train_loss: 0.8826, test_loss: 0.8559, test_f1: 0.5409
 epoch: 8, train_loss: 0.8573, test_loss: 0.9077, test_f1: 0.5236
 epoch: 9, train_loss: 0.8541, test_loss: 0.8839, test_f1: 0.5350
 epoch: 10, train_loss: 0.8427, test_loss: 0.9388, test_f1: 0.5081
 epoch: 11, train_loss: 0.8550, test_loss: 1.0887, test_f1: 0.4991
 epoch: 12, train_loss: 0.8198, test_loss: 0.8949, test_f1: 0.5634
 epoch: 13, train_loss: 0.8050, test_loss: 0.8179, test_f1: 0.6069
 epoch: 14, train_loss: 0.8063, test_loss: 0.8913, test_f1: 0.5626
 epoch: 15, train_loss: 0.8064, test_loss: 0.8129, test_f1: 0.5913
 epoch: 16, train_loss: 0.8063, test_loss: 0.8900, test_f1: 0.5516
 epoch: 17, train_loss: 0.7918, test_loss: 0.8333, test_f1: 0.6175
 epoch: 18, train_loss: 0.7808, test_loss: 0.8070, test_f1: 0.6014
 epoch: 19, train_loss: 0.7964, test_loss: 0.9877, test_f1: 0.5241
 epoch: 20, train_loss: 0.7742, test_loss: 1.1358, test_f1: 0.4911
 epoch: 21, train_loss: 0.7498, test_loss: 0.9435, test_f1: 0.5880
 epoch: 22, train_loss: 0.7695, test_loss: 0.8338, test_f1: 0.6008
 epoch: 23, train_loss: 0.7453, test_loss: 1.1974, test_f1: 0.4280
 epoch: 24, train_loss: 0.7370, test_loss: 0.8382, test_f1: 0.5481
 epoch: 25, train_loss: 0.7352, test_loss: 0.7831, test_f1: 0.5922
 epoch: 26, train_loss: 0.7317, test_loss: 0.8472, test_f1: 0.5757
 epoch: 27, train_loss: 0.7325, test_loss: 0.8552, test_f1: 0.6244
 epoch: 28, train_loss: 0.7180, test_loss: 0.7945, test_f1: 0.5839
 epoch: 29, train_loss: 0.7060, test_loss: 0.7865, test_f1: 0.5875
 epoch: 30, train_loss: 0.6982, test_loss: 0.8260, test_f1: 0.5844
 epoch: 31, train_loss: 0.6892, test_loss: 0.7933, test_f1: 0.6224
 epoch: 32, train_loss: 0.6778, test_loss: 0.8366, test_f1: 0.5884
 epoch: 33, train_loss: 0.6804, test_loss: 0.8344, test_f1: 0.6024
 epoch: 34, train_loss: 0.6755, test_loss: 0.8891, test_f1: 0.5354
 epoch: 35, train_loss: 0.6889, test_loss: 1.0709, test_f1: 0.5425
 epoch: 36, train_loss: 0.6691, test_loss: 0.8433, test_f1: 0.6216
 epoch: 37, train_loss: 0.6647, test_loss: 0.8832, test_f1: 0.6252
 epoch: 38, train_loss: 0.6379, test_loss: 0.8838, test_f1: 0.6183
 epoch: 39, train_loss: 0.6846, test_loss: 0.9369, test_f1: 0.5937
 epoch: 40, train_loss: 0.6704, test_loss: 0.7691, test_f1: 0.6333
 epoch: 41, train_loss: 0.6615, test_loss: 0.8242, test_f1: 0.6195
 epoch: 42, train_loss: 0.6517, test_loss: 0.7872, test_f1: 0.6424
 epoch: 43, train_loss: 0.6288, test_loss: 0.8755, test_f1: 0.6096
 epoch: 44, train_loss: 0.6200, test_loss: 0.9573, test_f1: 0.5983
 epoch: 45, train_loss: 0.6241, test_loss: 0.8877, test_f1: 0.6213
 epoch: 46, train_loss: 0.6361, test_loss: 0.9662, test_f1: 0.5750
 epoch: 47, train_loss: 0.6258, test_loss: 0.8954, test_f1: 0.6072
 epoch: 48, train_loss: 0.6241, test_loss: 0.7905, test_f1: 0.6206
 epoch: 49, train_loss: 0.6042, test_loss: 0.9811, test_f1: 0.6150
 epoch: 50, train_loss: 0.5985, test_loss: 1.0414, test_f1: 0.5912
 epoch: 51, train_loss: 0.5714, test_loss: 1.0377, test_f1: 0.6194
 epoch: 52, train_loss: 0.5501, test_loss: 1.0110, test_f1: 0.6202
 epoch: 53, train_loss: 0.5358, test_loss: 0.8253, test_f1: 0.6346
 epoch: 54, train_loss: 0.5437, test_loss: 1.0631, test_f1: 0.6519
 epoch: 55, train_loss: 0.5300, test_loss: 1.0578, test_f1: 0.6343
 epoch: 56, train_loss: 0.5260, test_loss: 0.9244, test_f1: 0.6258
 epoch: 57, train_loss: 0.5073, test_loss: 0.9955, test_f1: 0.6407
 epoch: 58, train_loss: 0.5129, test_loss: 0.9491, test_f1: 0.6354
 epoch: 59, train_loss: 0.5185, test_loss: 1.0285, test_f1: 0.6388
 epoch: 60, train_loss: 0.5184, test_loss: 0.9496, test_f1: 0.6678
 epoch: 61, train_loss: 0.5267, test_loss: 1.1136, test_f1: 0.6315
 epoch: 62, train_loss: 0.5279, test_loss: 1.0497, test_f1: 0.6152
 epoch: 63, train_loss: 0.5003, test_loss: 0.9828, test_f1: 0.6363
 epoch: 64, train_loss: 0.4862, test_loss: 0.9271, test_f1: 0.6490
 epoch: 65, train_loss: 0.4946, test_loss: 0.9532, test_f1: 0.6683
 epoch: 66, train_loss: 0.4894, test_loss: 0.9254, test_f1: 0.6486
 epoch: 67, train_loss: 0.4979, test_loss: 1.1371, test_f1: 0.6539
 epoch: 68, train_loss: 0.4896, test_loss: 1.1389, test_f1: 0.6244
 epoch: 69, train_loss: 0.4942, test_loss: 0.9269, test_f1: 0.6437
 epoch: 70, train_loss: 0.4785, test_loss: 1.1566, test_f1: 0.6373
 epoch: 71, train_loss: 0.4821, test_loss: 1.0985, test_f1: 0.6494
 epoch: 72, train_loss: 0.4656, test_loss: 1.0800, test_f1: 0.6463
 epoch: 73, train_loss: 0.4761, test_loss: 1.1126, test_f1: 0.6432
 epoch: 74, train_loss: 0.4621, test_loss: 1.2336, test_f1: 0.6349
 epoch: 75, train_loss: 0.4654, test_loss: 0.9804, test_f1: 0.6415
 epoch: 76, train_loss: 0.4601, test_loss: 1.0470, test_f1: 0.6539
 epoch: 77, train_loss: 0.4684, test_loss: 1.0553, test_f1: 0.6307
 epoch: 78, train_loss: 0.4572, test_loss: 1.0827, test_f1: 0.6477
 epoch: 79, train_loss: 0.4529, test_loss: 1.1552, test_f1: 0.6482
 epoch: 80, train_loss: 0.4490, test_loss: 1.0455, test_f1: 0.6462
 epoch: 81, train_loss: 0.4405, test_loss: 1.0348, test_f1: 0.6695
 epoch: 82, train_loss: 0.4605, test_loss: 1.1523, test_f1: 0.6656
 epoch: 83, train_loss: 0.4407, test_loss: 1.1401, test_f1: 0.6443
 epoch: 84, train_loss: 0.4579, test_loss: 1.0287, test_f1: 0.6763
 epoch: 85, train_loss: 0.4554, test_loss: 1.2084, test_f1: 0.6356
 epoch: 86, train_loss: 0.4381, test_loss: 0.9356, test_f1: 0.6692
 epoch: 87, train_loss: 0.4210, test_loss: 0.9963, test_f1: 0.6558
 epoch: 88, train_loss: 0.4212, test_loss: 1.0819, test_f1: 0.6524
 epoch: 89, train_loss: 0.4518, test_loss: 0.9663, test_f1: 0.6543
 epoch: 90, train_loss: 0.4325, test_loss: 1.0988, test_f1: 0.6661
 epoch: 91, train_loss: 0.4470, test_loss: 1.1073, test_f1: 0.6557
 epoch: 92, train_loss: 0.4415, test_loss: 0.9942, test_f1: 0.6686
 epoch: 93, train_loss: 0.4116, test_loss: 1.1539, test_f1: 0.5996
 epoch: 94, train_loss: 0.4131, test_loss: 1.1993, test_f1: 0.6468
 epoch: 95, train_loss: 0.4317, test_loss: 1.1531, test_f1: 0.6594
 epoch: 96, train_loss: 0.4180, test_loss: 1.2112, test_f1: 0.6401
 epoch: 97, train_loss: 0.3901, test_loss: 1.0232, test_f1: 0.6534
 epoch: 98, train_loss: 0.4123, test_loss: 1.1635, test_f1: 0.6297
 epoch: 99, train_loss: 0.4362, test_loss: 1.0541, test_f1: 0.6662
##################ITERATION #4 ****************************************
 epoch: 0, train_loss: 1.1670, test_loss: 1.0865, test_f1: 0.3809
 epoch: 1, train_loss: 1.0104, test_loss: 1.0646, test_f1: 0.4530
 epoch: 2, train_loss: 0.9879, test_loss: 1.0140, test_f1: 0.5039
 epoch: 3, train_loss: 0.9625, test_loss: 1.0255, test_f1: 0.4905
 epoch: 4, train_loss: 0.9374, test_loss: 1.1155, test_f1: 0.4794
 epoch: 5, train_loss: 0.9295, test_loss: 1.0599, test_f1: 0.4539
 epoch: 6, train_loss: 0.9128, test_loss: 0.8995, test_f1: 0.5088
 epoch: 7, train_loss: 0.9039, test_loss: 0.9375, test_f1: 0.5224
 epoch: 8, train_loss: 0.9056, test_loss: 0.9092, test_f1: 0.5226
 epoch: 9, train_loss: 0.8672, test_loss: 1.2833, test_f1: 0.4692
 epoch: 10, train_loss: 0.8719, test_loss: 0.8126, test_f1: 0.5613
 epoch: 11, train_loss: 0.8602, test_loss: 0.8573, test_f1: 0.5654
 epoch: 12, train_loss: 0.8497, test_loss: 0.9968, test_f1: 0.4905
 epoch: 13, train_loss: 0.8525, test_loss: 1.0093, test_f1: 0.5170
 epoch: 14, train_loss: 0.8505, test_loss: 0.9210, test_f1: 0.5922
 epoch: 15, train_loss: 0.8328, test_loss: 1.3336, test_f1: 0.4574
 epoch: 16, train_loss: 0.8266, test_loss: 1.0404, test_f1: 0.4891
 epoch: 17, train_loss: 0.8064, test_loss: 1.0387, test_f1: 0.5200
 epoch: 18, train_loss: 0.8042, test_loss: 0.8827, test_f1: 0.5413
 epoch: 19, train_loss: 0.7885, test_loss: 1.0151, test_f1: 0.5288
 epoch: 20, train_loss: 0.7847, test_loss: 0.8608, test_f1: 0.5431
 epoch: 21, train_loss: 0.7666, test_loss: 0.9320, test_f1: 0.5262
 epoch: 22, train_loss: 0.7825, test_loss: 0.8867, test_f1: 0.5609
 epoch: 23, train_loss: 0.7767, test_loss: 0.9214, test_f1: 0.5784
 epoch: 24, train_loss: 0.7735, test_loss: 0.8819, test_f1: 0.5571
 epoch: 25, train_loss: 0.7712, test_loss: 0.8776, test_f1: 0.6027
 epoch: 26, train_loss: 0.7606, test_loss: 0.9406, test_f1: 0.5439
 epoch: 27, train_loss: 0.7513, test_loss: 0.9071, test_f1: 0.5802
 epoch: 28, train_loss: 0.7398, test_loss: 0.9518, test_f1: 0.5395
 epoch: 29, train_loss: 0.7410, test_loss: 0.8083, test_f1: 0.5558
 epoch: 30, train_loss: 0.7187, test_loss: 0.8724, test_f1: 0.5494
 epoch: 31, train_loss: 0.7343, test_loss: 0.8570, test_f1: 0.6011
 epoch: 32, train_loss: 0.7364, test_loss: 0.8840, test_f1: 0.5643
 epoch: 33, train_loss: 0.7317, test_loss: 0.8910, test_f1: 0.5540
 epoch: 34, train_loss: 0.6998, test_loss: 0.9450, test_f1: 0.6119
 epoch: 35, train_loss: 0.7111, test_loss: 0.9628, test_f1: 0.6009
 epoch: 36, train_loss: 0.7185, test_loss: 0.9512, test_f1: 0.5666
 epoch: 37, train_loss: 0.7133, test_loss: 0.9873, test_f1: 0.5853
 epoch: 38, train_loss: 0.7000, test_loss: 0.8927, test_f1: 0.6228
 epoch: 39, train_loss: 0.6876, test_loss: 1.0298, test_f1: 0.5565
 epoch: 40, train_loss: 0.6955, test_loss: 0.8625, test_f1: 0.6126
 epoch: 41, train_loss: 0.6727, test_loss: 0.9477, test_f1: 0.6316
 epoch: 42, train_loss: 0.6788, test_loss: 0.9128, test_f1: 0.5982
 epoch: 43, train_loss: 0.6763, test_loss: 0.9562, test_f1: 0.6178
 epoch: 44, train_loss: 0.6736, test_loss: 1.0717, test_f1: 0.5784
 epoch: 45, train_loss: 0.6684, test_loss: 0.9609, test_f1: 0.6388
 epoch: 46, train_loss: 0.6653, test_loss: 1.0730, test_f1: 0.5500
 epoch: 47, train_loss: 0.6979, test_loss: 0.8899, test_f1: 0.6113
 epoch: 48, train_loss: 0.6841, test_loss: 0.9133, test_f1: 0.6497
 epoch: 49, train_loss: 0.6578, test_loss: 0.9074, test_f1: 0.6389
 epoch: 50, train_loss: 0.6612, test_loss: 0.9737, test_f1: 0.6079
 epoch: 51, train_loss: 0.6234, test_loss: 0.9523, test_f1: 0.5634
 epoch: 52, train_loss: 0.5995, test_loss: 0.9522, test_f1: 0.6156
 epoch: 53, train_loss: 0.5984, test_loss: 1.0125, test_f1: 0.6417
 epoch: 54, train_loss: 0.5816, test_loss: 0.9680, test_f1: 0.6545
 epoch: 55, train_loss: 0.5867, test_loss: 1.0003, test_f1: 0.6446
 epoch: 56, train_loss: 0.5876, test_loss: 1.0058, test_f1: 0.6617
 epoch: 57, train_loss: 0.5686, test_loss: 1.0186, test_f1: 0.6263
 epoch: 58, train_loss: 0.5791, test_loss: 0.9411, test_f1: 0.6468
 epoch: 59, train_loss: 0.5807, test_loss: 1.0574, test_f1: 0.6507
 epoch: 60, train_loss: 0.5726, test_loss: 1.0627, test_f1: 0.6207
 epoch: 61, train_loss: 0.5612, test_loss: 1.1066, test_f1: 0.6106
 epoch: 62, train_loss: 0.5543, test_loss: 1.0465, test_f1: 0.6598
 epoch: 63, train_loss: 0.5566, test_loss: 1.0517, test_f1: 0.6699
 epoch: 64, train_loss: 0.5673, test_loss: 0.9885, test_f1: 0.6538
 epoch: 65, train_loss: 0.5849, test_loss: 1.0352, test_f1: 0.6119
 epoch: 66, train_loss: 0.5506, test_loss: 0.9867, test_f1: 0.6868
 epoch: 67, train_loss: 0.5538, test_loss: 1.0137, test_f1: 0.6680
 epoch: 68, train_loss: 0.5635, test_loss: 1.0172, test_f1: 0.6316
 epoch: 69, train_loss: 0.5425, test_loss: 0.9791, test_f1: 0.6311
 epoch: 70, train_loss: 0.5541, test_loss: 1.0973, test_f1: 0.6159
 epoch: 71, train_loss: 0.5230, test_loss: 1.0513, test_f1: 0.6467
 epoch: 72, train_loss: 0.5282, test_loss: 0.9597, test_f1: 0.6336
 epoch: 73, train_loss: 0.5445, test_loss: 1.0364, test_f1: 0.6508
 epoch: 74, train_loss: 0.5168, test_loss: 1.1654, test_f1: 0.6546
 epoch: 75, train_loss: 0.5314, test_loss: 1.0736, test_f1: 0.6811
 epoch: 76, train_loss: 0.5360, test_loss: 1.0087, test_f1: 0.6633
 epoch: 77, train_loss: 0.5202, test_loss: 1.0543, test_f1: 0.6348
 epoch: 78, train_loss: 0.5145, test_loss: 1.0136, test_f1: 0.6820
 epoch: 79, train_loss: 0.5191, test_loss: 1.1535, test_f1: 0.6664
 epoch: 80, train_loss: 0.5252, test_loss: 1.2143, test_f1: 0.6296
 epoch: 81, train_loss: 0.5242, test_loss: 1.1087, test_f1: 0.6549
 epoch: 82, train_loss: 0.5138, test_loss: 1.0897, test_f1: 0.6479
 epoch: 83, train_loss: 0.5093, test_loss: 1.1177, test_f1: 0.6512
 epoch: 84, train_loss: 0.5197, test_loss: 1.1389, test_f1: 0.6385
 epoch: 85, train_loss: 0.4888, test_loss: 1.1905, test_f1: 0.6151
 epoch: 86, train_loss: 0.5077, test_loss: 1.1135, test_f1: 0.6484
 epoch: 87, train_loss: 0.5008, test_loss: 1.0557, test_f1: 0.6499
 epoch: 88, train_loss: 0.5083, test_loss: 1.0654, test_f1: 0.6377
 epoch: 89, train_loss: 0.4798, test_loss: 1.0917, test_f1: 0.6244
 epoch: 90, train_loss: 0.4708, test_loss: 1.0846, test_f1: 0.6492
 epoch: 91, train_loss: 0.4918, test_loss: 1.1014, test_f1: 0.6439
 epoch: 92, train_loss: 0.4915, test_loss: 1.0642, test_f1: 0.6699
 epoch: 93, train_loss: 0.4715, test_loss: 1.1655, test_f1: 0.6466
 epoch: 94, train_loss: 0.4817, test_loss: 1.0457, test_f1: 0.6552
 epoch: 95, train_loss: 0.4471, test_loss: 1.1484, test_f1: 0.6341
 epoch: 96, train_loss: 0.4698, test_loss: 1.2595, test_f1: 0.6180
 epoch: 97, train_loss: 0.4740, test_loss: 1.0026, test_f1: 0.6467
 epoch: 98, train_loss: 0.4733, test_loss: 1.0739, test_f1: 0.6430
 epoch: 99, train_loss: 0.4781, test_loss: 1.1184, test_f1: 0.6424
##################ITERATION #5 ****************************************
 epoch: 0, train_loss: 1.1428, test_loss: 1.1706, test_f1: 0.4183
 epoch: 1, train_loss: 0.9941, test_loss: 1.0288, test_f1: 0.4630
 epoch: 2, train_loss: 0.9766, test_loss: 0.9980, test_f1: 0.4587
 epoch: 3, train_loss: 0.9335, test_loss: 0.9248, test_f1: 0.5271
 epoch: 4, train_loss: 0.9180, test_loss: 0.9546, test_f1: 0.4568
 epoch: 5, train_loss: 0.8940, test_loss: 0.8963, test_f1: 0.5438
 epoch: 6, train_loss: 0.8899, test_loss: 0.8937, test_f1: 0.5174
 epoch: 7, train_loss: 0.8865, test_loss: 0.8353, test_f1: 0.5172
 epoch: 8, train_loss: 0.8802, test_loss: 0.9664, test_f1: 0.4818
 epoch: 9, train_loss: 0.8681, test_loss: 0.9161, test_f1: 0.5281
 epoch: 10, train_loss: 0.8429, test_loss: 0.9351, test_f1: 0.4890
 epoch: 11, train_loss: 0.8343, test_loss: 0.8944, test_f1: 0.5312
 epoch: 12, train_loss: 0.8348, test_loss: 0.9101, test_f1: 0.5084
 epoch: 13, train_loss: 0.8456, test_loss: 0.8733, test_f1: 0.5326
 epoch: 14, train_loss: 0.8282, test_loss: 0.9390, test_f1: 0.5056
 epoch: 15, train_loss: 0.8075, test_loss: 0.9653, test_f1: 0.4865
 epoch: 16, train_loss: 0.7905, test_loss: 0.8780, test_f1: 0.5786
 epoch: 17, train_loss: 0.7866, test_loss: 0.9581, test_f1: 0.5382
 epoch: 18, train_loss: 0.7784, test_loss: 0.8751, test_f1: 0.5552
 epoch: 19, train_loss: 0.7905, test_loss: 0.8657, test_f1: 0.6067
 epoch: 20, train_loss: 0.7739, test_loss: 0.7805, test_f1: 0.5812
 epoch: 21, train_loss: 0.7546, test_loss: 0.8713, test_f1: 0.5824
 epoch: 22, train_loss: 0.7543, test_loss: 0.8129, test_f1: 0.5400
 epoch: 23, train_loss: 0.7512, test_loss: 0.9294, test_f1: 0.5291
 epoch: 24, train_loss: 0.7553, test_loss: 0.9138, test_f1: 0.5544
 epoch: 25, train_loss: 0.7393, test_loss: 0.8057, test_f1: 0.5757
 epoch: 26, train_loss: 0.7280, test_loss: 0.8248, test_f1: 0.6254
 epoch: 27, train_loss: 0.7330, test_loss: 0.8538, test_f1: 0.6340
 epoch: 28, train_loss: 0.7248, test_loss: 0.8447, test_f1: 0.6121
 epoch: 29, train_loss: 0.7157, test_loss: 0.8802, test_f1: 0.6098
 epoch: 30, train_loss: 0.7092, test_loss: 0.8535, test_f1: 0.5914
 epoch: 31, train_loss: 0.7059, test_loss: 0.8784, test_f1: 0.5786
 epoch: 32, train_loss: 0.7016, test_loss: 0.7943, test_f1: 0.6286
 epoch: 33, train_loss: 0.7062, test_loss: 0.8284, test_f1: 0.6497
 epoch: 34, train_loss: 0.7230, test_loss: 1.1110, test_f1: 0.4878
 epoch: 35, train_loss: 0.7067, test_loss: 0.8390, test_f1: 0.6160
 epoch: 36, train_loss: 0.7004, test_loss: 0.8158, test_f1: 0.6059
 epoch: 37, train_loss: 0.6837, test_loss: 0.8924, test_f1: 0.6130
 epoch: 38, train_loss: 0.6999, test_loss: 0.7788, test_f1: 0.6145
 epoch: 39, train_loss: 0.6681, test_loss: 0.8871, test_f1: 0.6007
 epoch: 40, train_loss: 0.6740, test_loss: 0.8605, test_f1: 0.6259
 epoch: 41, train_loss: 0.6519, test_loss: 0.8166, test_f1: 0.6477
 epoch: 42, train_loss: 0.6503, test_loss: 1.0619, test_f1: 0.5675
 epoch: 43, train_loss: 0.6374, test_loss: 0.8721, test_f1: 0.6397
 epoch: 44, train_loss: 0.6685, test_loss: 1.0422, test_f1: 0.5901
 epoch: 45, train_loss: 0.6388, test_loss: 0.8829, test_f1: 0.6082
 epoch: 46, train_loss: 0.6379, test_loss: 0.8145, test_f1: 0.6176
 epoch: 47, train_loss: 0.6139, test_loss: 0.8948, test_f1: 0.6210
 epoch: 48, train_loss: 0.6544, test_loss: 0.8493, test_f1: 0.6053
 epoch: 49, train_loss: 0.6269, test_loss: 0.8065, test_f1: 0.6313
 epoch: 50, train_loss: 0.6206, test_loss: 0.8126, test_f1: 0.6462
 epoch: 51, train_loss: 0.5718, test_loss: 0.8565, test_f1: 0.6490
 epoch: 52, train_loss: 0.5557, test_loss: 0.8741, test_f1: 0.6421
 epoch: 53, train_loss: 0.5471, test_loss: 0.8651, test_f1: 0.6614
 epoch: 54, train_loss: 0.5453, test_loss: 0.9061, test_f1: 0.6466
 epoch: 55, train_loss: 0.5283, test_loss: 0.9529, test_f1: 0.6157
 epoch: 56, train_loss: 0.5327, test_loss: 0.9268, test_f1: 0.6445
 epoch: 57, train_loss: 0.5147, test_loss: 0.9641, test_f1: 0.6422
 epoch: 58, train_loss: 0.5125, test_loss: 0.9498, test_f1: 0.6574
 epoch: 59, train_loss: 0.5249, test_loss: 0.8472, test_f1: 0.6659
 epoch: 60, train_loss: 0.5151, test_loss: 0.9099, test_f1: 0.6397
 epoch: 61, train_loss: 0.5214, test_loss: 0.9175, test_f1: 0.6504
 epoch: 62, train_loss: 0.5070, test_loss: 0.9089, test_f1: 0.6485
 epoch: 63, train_loss: 0.5135, test_loss: 0.8825, test_f1: 0.6591
 epoch: 64, train_loss: 0.4917, test_loss: 0.9530, test_f1: 0.6646
 epoch: 65, train_loss: 0.5004, test_loss: 0.9038, test_f1: 0.6468
 epoch: 66, train_loss: 0.4880, test_loss: 0.9033, test_f1: 0.6363
 epoch: 67, train_loss: 0.5058, test_loss: 0.9249, test_f1: 0.6421
 epoch: 68, train_loss: 0.5062, test_loss: 0.9478, test_f1: 0.6443
 epoch: 69, train_loss: 0.4949, test_loss: 1.0069, test_f1: 0.6351
 epoch: 70, train_loss: 0.4664, test_loss: 1.0016, test_f1: 0.6283
 epoch: 71, train_loss: 0.4731, test_loss: 0.9225, test_f1: 0.6438
 epoch: 72, train_loss: 0.4806, test_loss: 0.9222, test_f1: 0.6453
 epoch: 73, train_loss: 0.4731, test_loss: 0.9533, test_f1: 0.6379
 epoch: 74, train_loss: 0.4728, test_loss: 0.9110, test_f1: 0.6447
 epoch: 75, train_loss: 0.4715, test_loss: 0.9180, test_f1: 0.6425
 epoch: 76, train_loss: 0.4566, test_loss: 0.8949, test_f1: 0.6792
 epoch: 77, train_loss: 0.4544, test_loss: 0.9931, test_f1: 0.6760
 epoch: 78, train_loss: 0.4476, test_loss: 0.9631, test_f1: 0.6392
 epoch: 79, train_loss: 0.4676, test_loss: 0.9853, test_f1: 0.6300
 epoch: 80, train_loss: 0.4731, test_loss: 0.9638, test_f1: 0.6662
 epoch: 81, train_loss: 0.4392, test_loss: 1.0468, test_f1: 0.6566
 epoch: 82, train_loss: 0.4601, test_loss: 0.9666, test_f1: 0.6385
 epoch: 83, train_loss: 0.4462, test_loss: 1.0152, test_f1: 0.6633
 epoch: 84, train_loss: 0.4354, test_loss: 0.9106, test_f1: 0.6841
 epoch: 85, train_loss: 0.4310, test_loss: 0.9896, test_f1: 0.6537
 epoch: 86, train_loss: 0.4441, test_loss: 0.9759, test_f1: 0.6515
 epoch: 87, train_loss: 0.4485, test_loss: 0.9761, test_f1: 0.6740
 epoch: 88, train_loss: 0.4186, test_loss: 1.0497, test_f1: 0.6498
 epoch: 89, train_loss: 0.4383, test_loss: 0.9870, test_f1: 0.6514
 epoch: 90, train_loss: 0.4232, test_loss: 1.1193, test_f1: 0.6465
 epoch: 91, train_loss: 0.4325, test_loss: 0.9242, test_f1: 0.6594
 epoch: 92, train_loss: 0.4188, test_loss: 0.8923, test_f1: 0.6890
 epoch: 93, train_loss: 0.4147, test_loss: 0.9555, test_f1: 0.6739
 epoch: 94, train_loss: 0.4277, test_loss: 0.9391, test_f1: 0.6665
 epoch: 95, train_loss: 0.4265, test_loss: 1.0024, test_f1: 0.6641
 epoch: 96, train_loss: 0.4155, test_loss: 1.0418, test_f1: 0.6759
 epoch: 97, train_loss: 0.3995, test_loss: 0.9454, test_f1: 0.6765
 epoch: 98, train_loss: 0.4156, test_loss: 1.0450, test_f1: 0.6747
 epoch: 99, train_loss: 0.4195, test_loss: 1.0699, test_f1: 0.6502
##################ITERATION #6 ****************************************
 epoch: 0, train_loss: 1.1888, test_loss: 1.0855, test_f1: 0.3531
 epoch: 1, train_loss: 1.0476, test_loss: 1.1313, test_f1: 0.4082
 epoch: 2, train_loss: 1.0126, test_loss: 1.1128, test_f1: 0.5336
 epoch: 3, train_loss: 0.9945, test_loss: 1.0020, test_f1: 0.4808
 epoch: 4, train_loss: 0.9684, test_loss: 1.0387, test_f1: 0.4725
 epoch: 5, train_loss: 0.9518, test_loss: 0.9620, test_f1: 0.4845
 epoch: 6, train_loss: 0.9466, test_loss: 1.2054, test_f1: 0.4332
 epoch: 7, train_loss: 0.9281, test_loss: 0.9371, test_f1: 0.4913
 epoch: 8, train_loss: 0.9177, test_loss: 1.4360, test_f1: 0.3427
 epoch: 9, train_loss: 0.8999, test_loss: 0.9083, test_f1: 0.5013
 epoch: 10, train_loss: 0.8837, test_loss: 0.9155, test_f1: 0.5432
 epoch: 11, train_loss: 0.8641, test_loss: 1.0274, test_f1: 0.5141
 epoch: 12, train_loss: 0.8563, test_loss: 0.8766, test_f1: 0.5255
 epoch: 13, train_loss: 0.8458, test_loss: 0.8565, test_f1: 0.5933
 epoch: 14, train_loss: 0.8606, test_loss: 0.8730, test_f1: 0.5436
 epoch: 15, train_loss: 0.8439, test_loss: 0.9265, test_f1: 0.6028
 epoch: 16, train_loss: 0.8196, test_loss: 0.9377, test_f1: 0.5140
 epoch: 17, train_loss: 0.8180, test_loss: 0.9890, test_f1: 0.5093
 epoch: 18, train_loss: 0.8189, test_loss: 0.9209, test_f1: 0.5570
 epoch: 19, train_loss: 0.8129, test_loss: 0.8469, test_f1: 0.5412
 epoch: 20, train_loss: 0.7874, test_loss: 0.9756, test_f1: 0.5319
 epoch: 21, train_loss: 0.8108, test_loss: 0.9374, test_f1: 0.5368
 epoch: 22, train_loss: 0.7924, test_loss: 0.9181, test_f1: 0.5426
 epoch: 23, train_loss: 0.7753, test_loss: 0.8795, test_f1: 0.5377
 epoch: 24, train_loss: 0.7644, test_loss: 0.9451, test_f1: 0.5426
 epoch: 25, train_loss: 0.7663, test_loss: 0.8366, test_f1: 0.5752
 epoch: 26, train_loss: 0.7569, test_loss: 0.8265, test_f1: 0.5925
 epoch: 27, train_loss: 0.7545, test_loss: 0.8878, test_f1: 0.6116
 epoch: 28, train_loss: 0.7447, test_loss: 0.9316, test_f1: 0.5166
 epoch: 29, train_loss: 0.7501, test_loss: 0.8853, test_f1: 0.5432
 epoch: 30, train_loss: 0.7235, test_loss: 0.8946, test_f1: 0.6273
 epoch: 31, train_loss: 0.7276, test_loss: 1.0025, test_f1: 0.5589
 epoch: 32, train_loss: 0.7142, test_loss: 0.8374, test_f1: 0.5873
 epoch: 33, train_loss: 0.7089, test_loss: 0.7773, test_f1: 0.6261
 epoch: 34, train_loss: 0.7145, test_loss: 0.8922, test_f1: 0.5751
 epoch: 35, train_loss: 0.6942, test_loss: 0.9840, test_f1: 0.5768
 epoch: 36, train_loss: 0.7328, test_loss: 1.0378, test_f1: 0.6038
 epoch: 37, train_loss: 0.7029, test_loss: 1.0729, test_f1: 0.5814
 epoch: 38, train_loss: 0.7047, test_loss: 0.9668, test_f1: 0.6571
 epoch: 39, train_loss: 0.6878, test_loss: 0.9985, test_f1: 0.5381
 epoch: 40, train_loss: 0.6706, test_loss: 0.9632, test_f1: 0.5862
 epoch: 41, train_loss: 0.6740, test_loss: 1.2193, test_f1: 0.5826
 epoch: 42, train_loss: 0.6591, test_loss: 1.1294, test_f1: 0.6060
 epoch: 43, train_loss: 0.6672, test_loss: 0.9224, test_f1: 0.6377
 epoch: 44, train_loss: 0.6562, test_loss: 1.0658, test_f1: 0.6049
 epoch: 45, train_loss: 0.6607, test_loss: 0.9248, test_f1: 0.6426
 epoch: 46, train_loss: 0.6628, test_loss: 0.8141, test_f1: 0.6618
 epoch: 47, train_loss: 0.6705, test_loss: 0.9559, test_f1: 0.5919
 epoch: 48, train_loss: 0.6450, test_loss: 0.9028, test_f1: 0.6143
 epoch: 49, train_loss: 0.6406, test_loss: 1.2762, test_f1: 0.5983
 epoch: 50, train_loss: 0.6288, test_loss: 0.9940, test_f1: 0.6442
 epoch: 51, train_loss: 0.6091, test_loss: 0.9610, test_f1: 0.6583
 epoch: 52, train_loss: 0.5910, test_loss: 0.9422, test_f1: 0.6852
 epoch: 53, train_loss: 0.5678, test_loss: 0.8066, test_f1: 0.6772
 epoch: 54, train_loss: 0.5843, test_loss: 0.9439, test_f1: 0.6628
 epoch: 55, train_loss: 0.5701, test_loss: 0.9380, test_f1: 0.6712
 epoch: 56, train_loss: 0.5727, test_loss: 0.9811, test_f1: 0.6391
 epoch: 57, train_loss: 0.5593, test_loss: 0.9206, test_f1: 0.6788
 epoch: 58, train_loss: 0.5498, test_loss: 0.9823, test_f1: 0.6704
 epoch: 59, train_loss: 0.5540, test_loss: 0.9206, test_f1: 0.6671
 epoch: 60, train_loss: 0.5539, test_loss: 1.0164, test_f1: 0.6727
 epoch: 61, train_loss: 0.5313, test_loss: 1.0502, test_f1: 0.6437
 epoch: 62, train_loss: 0.5499, test_loss: 0.9381, test_f1: 0.6544
 epoch: 63, train_loss: 0.5294, test_loss: 1.0630, test_f1: 0.6618
 epoch: 64, train_loss: 0.5321, test_loss: 1.0245, test_f1: 0.6675
 epoch: 65, train_loss: 0.5382, test_loss: 0.9848, test_f1: 0.6697
 epoch: 66, train_loss: 0.5405, test_loss: 0.8647, test_f1: 0.6629
 epoch: 67, train_loss: 0.5506, test_loss: 1.1353, test_f1: 0.6273
 epoch: 68, train_loss: 0.5332, test_loss: 0.9882, test_f1: 0.6515
 epoch: 69, train_loss: 0.5119, test_loss: 0.9335, test_f1: 0.6739
 epoch: 70, train_loss: 0.5167, test_loss: 0.9920, test_f1: 0.6824
 epoch: 71, train_loss: 0.5032, test_loss: 1.0623, test_f1: 0.6812
 epoch: 72, train_loss: 0.5210, test_loss: 0.8592, test_f1: 0.6850
 epoch: 73, train_loss: 0.5030, test_loss: 0.9993, test_f1: 0.6924
 epoch: 74, train_loss: 0.5017, test_loss: 0.7985, test_f1: 0.6777
 epoch: 75, train_loss: 0.4940, test_loss: 0.9931, test_f1: 0.6575
 epoch: 76, train_loss: 0.4893, test_loss: 0.9406, test_f1: 0.6951
 epoch: 77, train_loss: 0.4965, test_loss: 0.8290, test_f1: 0.6849
 epoch: 78, train_loss: 0.5021, test_loss: 0.8906, test_f1: 0.6873
 epoch: 79, train_loss: 0.4880, test_loss: 1.0296, test_f1: 0.6988
 epoch: 80, train_loss: 0.4902, test_loss: 1.2675, test_f1: 0.6565
 epoch: 81, train_loss: 0.5005, test_loss: 1.0315, test_f1: 0.6857
 epoch: 82, train_loss: 0.4961, test_loss: 1.0392, test_f1: 0.6900
 epoch: 83, train_loss: 0.4769, test_loss: 1.0982, test_f1: 0.6677
 epoch: 84, train_loss: 0.4847, test_loss: 1.0399, test_f1: 0.6856
 epoch: 85, train_loss: 0.4651, test_loss: 1.2137, test_f1: 0.6816
 epoch: 86, train_loss: 0.4680, test_loss: 1.0909, test_f1: 0.6789
 epoch: 87, train_loss: 0.4633, test_loss: 0.9374, test_f1: 0.6750
 epoch: 88, train_loss: 0.4631, test_loss: 1.0194, test_f1: 0.6715
 epoch: 89, train_loss: 0.4741, test_loss: 1.1341, test_f1: 0.6542
 epoch: 90, train_loss: 0.4770, test_loss: 1.1677, test_f1: 0.6626
 epoch: 91, train_loss: 0.4636, test_loss: 1.0659, test_f1: 0.6665
 epoch: 92, train_loss: 0.4646, test_loss: 1.0891, test_f1: 0.6874
 epoch: 93, train_loss: 0.4550, test_loss: 1.1234, test_f1: 0.6686
 epoch: 94, train_loss: 0.4760, test_loss: 1.2424, test_f1: 0.6340
 epoch: 95, train_loss: 0.4686, test_loss: 1.1290, test_f1: 0.6745
 epoch: 96, train_loss: 0.4394, test_loss: 1.1580, test_f1: 0.7088
 epoch: 97, train_loss: 0.4749, test_loss: 1.3741, test_f1: 0.6517
 epoch: 98, train_loss: 0.4688, test_loss: 1.0997, test_f1: 0.6731
 epoch: 99, train_loss: 0.4533, test_loss: 1.0641, test_f1: 0.6891
##################ITERATION #7 ****************************************
 epoch: 0, train_loss: 1.2083, test_loss: 1.0978, test_f1: 0.4369
 epoch: 1, train_loss: 1.0453, test_loss: 1.0205, test_f1: 0.4272
 epoch: 2, train_loss: 1.0162, test_loss: 1.0047, test_f1: 0.4655
 epoch: 3, train_loss: 0.9713, test_loss: 1.0208, test_f1: 0.4925
 epoch: 4, train_loss: 0.9670, test_loss: 0.9242, test_f1: 0.5038
 epoch: 5, train_loss: 0.9247, test_loss: 0.9348, test_f1: 0.5091
 epoch: 6, train_loss: 0.9227, test_loss: 0.9453, test_f1: 0.4830
 epoch: 7, train_loss: 0.8999, test_loss: 1.0008, test_f1: 0.4947
 epoch: 8, train_loss: 0.8980, test_loss: 0.9049, test_f1: 0.5093
 epoch: 9, train_loss: 0.8864, test_loss: 0.9093, test_f1: 0.5596
 epoch: 10, train_loss: 0.8858, test_loss: 1.0077, test_f1: 0.5069
 epoch: 11, train_loss: 0.8794, test_loss: 0.9086, test_f1: 0.5792
 epoch: 12, train_loss: 0.8574, test_loss: 0.9325, test_f1: 0.5214
 epoch: 13, train_loss: 0.8672, test_loss: 0.9180, test_f1: 0.5525
 epoch: 14, train_loss: 0.8343, test_loss: 0.9615, test_f1: 0.5456
 epoch: 15, train_loss: 0.8204, test_loss: 0.9283, test_f1: 0.5322
 epoch: 16, train_loss: 0.8377, test_loss: 1.0470, test_f1: 0.5035
 epoch: 17, train_loss: 0.8158, test_loss: 1.1038, test_f1: 0.4789
 epoch: 18, train_loss: 0.8089, test_loss: 0.8837, test_f1: 0.5194
 epoch: 19, train_loss: 0.8276, test_loss: 0.8318, test_f1: 0.5505
 epoch: 20, train_loss: 0.7785, test_loss: 0.9809, test_f1: 0.5321
 epoch: 21, train_loss: 0.7805, test_loss: 0.9342, test_f1: 0.5358
 epoch: 22, train_loss: 0.7777, test_loss: 0.9917, test_f1: 0.5024
 epoch: 23, train_loss: 0.7721, test_loss: 0.9294, test_f1: 0.5483
 epoch: 24, train_loss: 0.8082, test_loss: 0.9478, test_f1: 0.4855
 epoch: 25, train_loss: 0.7659, test_loss: 0.8928, test_f1: 0.5442
 epoch: 26, train_loss: 0.7618, test_loss: 0.9152, test_f1: 0.5647
 epoch: 27, train_loss: 0.8215, test_loss: 0.8808, test_f1: 0.5525
 epoch: 28, train_loss: 0.8168, test_loss: 0.8922, test_f1: 0.5314
 epoch: 29, train_loss: 0.7859, test_loss: 0.9071, test_f1: 0.5460
 epoch: 30, train_loss: 0.7647, test_loss: 0.9353, test_f1: 0.5353
 epoch: 31, train_loss: 0.7517, test_loss: 0.8765, test_f1: 0.5634
 epoch: 32, train_loss: 0.7594, test_loss: 0.9571, test_f1: 0.5397
 epoch: 33, train_loss: 0.7459, test_loss: 0.9205, test_f1: 0.5438
 epoch: 34, train_loss: 0.7531, test_loss: 0.9138, test_f1: 0.5533
 epoch: 35, train_loss: 0.7437, test_loss: 0.9209, test_f1: 0.6180
 epoch: 36, train_loss: 0.7242, test_loss: 0.8724, test_f1: 0.5644
 epoch: 37, train_loss: 0.7240, test_loss: 0.9150, test_f1: 0.5718
 epoch: 38, train_loss: 0.7280, test_loss: 0.9914, test_f1: 0.4951
 epoch: 39, train_loss: 0.7378, test_loss: 0.8786, test_f1: 0.5666
 epoch: 40, train_loss: 0.7135, test_loss: 0.8633, test_f1: 0.5796
 epoch: 41, train_loss: 0.7139, test_loss: 0.8614, test_f1: 0.6175
 epoch: 42, train_loss: 0.7128, test_loss: 0.9139, test_f1: 0.5621
 epoch: 43, train_loss: 0.6908, test_loss: 0.8488, test_f1: 0.5825
 epoch: 44, train_loss: 0.7240, test_loss: 1.0195, test_f1: 0.5492
 epoch: 45, train_loss: 0.7114, test_loss: 0.8694, test_f1: 0.5879
 epoch: 46, train_loss: 0.6937, test_loss: 0.9444, test_f1: 0.5666
 epoch: 47, train_loss: 0.6746, test_loss: 0.9751, test_f1: 0.5699
 epoch: 48, train_loss: 0.6786, test_loss: 0.8666, test_f1: 0.6089
 epoch: 49, train_loss: 0.6728, test_loss: 0.9509, test_f1: 0.5673
 epoch: 50, train_loss: 0.6591, test_loss: 0.8829, test_f1: 0.5957
 epoch: 51, train_loss: 0.6386, test_loss: 0.9595, test_f1: 0.5965
 epoch: 52, train_loss: 0.6212, test_loss: 0.8883, test_f1: 0.6115
 epoch: 53, train_loss: 0.6300, test_loss: 0.8877, test_f1: 0.6067
 epoch: 54, train_loss: 0.6250, test_loss: 0.8917, test_f1: 0.6358
 epoch: 55, train_loss: 0.6013, test_loss: 0.8536, test_f1: 0.6249
 epoch: 56, train_loss: 0.6151, test_loss: 0.8996, test_f1: 0.5960
 epoch: 57, train_loss: 0.5983, test_loss: 0.8981, test_f1: 0.6231
 epoch: 58, train_loss: 0.5947, test_loss: 0.9002, test_f1: 0.6080
 epoch: 59, train_loss: 0.5901, test_loss: 0.9049, test_f1: 0.6236
 epoch: 60, train_loss: 0.5893, test_loss: 1.0162, test_f1: 0.5842
 epoch: 61, train_loss: 0.6016, test_loss: 0.9646, test_f1: 0.5456
 epoch: 62, train_loss: 0.5810, test_loss: 1.0265, test_f1: 0.6024
 epoch: 63, train_loss: 0.5860, test_loss: 0.9544, test_f1: 0.5934
 epoch: 64, train_loss: 0.5896, test_loss: 0.9930, test_f1: 0.6021
 epoch: 65, train_loss: 0.5994, test_loss: 0.9900, test_f1: 0.5837
 epoch: 66, train_loss: 0.5929, test_loss: 0.9751, test_f1: 0.6372
 epoch: 67, train_loss: 0.5852, test_loss: 0.9799, test_f1: 0.6240
 epoch: 68, train_loss: 0.5632, test_loss: 0.9791, test_f1: 0.5996
 epoch: 69, train_loss: 0.5417, test_loss: 0.9892, test_f1: 0.6308
 epoch: 70, train_loss: 0.5570, test_loss: 0.9704, test_f1: 0.6443
 epoch: 71, train_loss: 0.5760, test_loss: 0.9955, test_f1: 0.6035
 epoch: 72, train_loss: 0.5674, test_loss: 1.0755, test_f1: 0.5920
 epoch: 73, train_loss: 0.5574, test_loss: 0.9193, test_f1: 0.6179
 epoch: 74, train_loss: 0.5682, test_loss: 1.0183, test_f1: 0.6138
 epoch: 75, train_loss: 0.5364, test_loss: 1.0586, test_f1: 0.6005
 epoch: 76, train_loss: 0.5669, test_loss: 1.0911, test_f1: 0.6009
 epoch: 77, train_loss: 0.5666, test_loss: 0.9637, test_f1: 0.6271
 epoch: 78, train_loss: 0.5441, test_loss: 1.0944, test_f1: 0.6048
 epoch: 79, train_loss: 0.5625, test_loss: 0.9034, test_f1: 0.6613
 epoch: 80, train_loss: 0.5430, test_loss: 1.2074, test_f1: 0.5858
 epoch: 81, train_loss: 0.5547, test_loss: 0.8939, test_f1: 0.6480
 epoch: 82, train_loss: 0.5327, test_loss: 1.0032, test_f1: 0.6239
 epoch: 83, train_loss: 0.5243, test_loss: 1.0455, test_f1: 0.6139
 epoch: 84, train_loss: 0.5380, test_loss: 1.0235, test_f1: 0.6108
 epoch: 85, train_loss: 0.5142, test_loss: 1.0623, test_f1: 0.6134
 epoch: 86, train_loss: 0.5203, test_loss: 0.9342, test_f1: 0.6569
 epoch: 87, train_loss: 0.5283, test_loss: 1.1127, test_f1: 0.6086
 epoch: 88, train_loss: 0.5309, test_loss: 0.9583, test_f1: 0.6209
 epoch: 89, train_loss: 0.5113, test_loss: 0.9593, test_f1: 0.6127
 epoch: 90, train_loss: 0.5265, test_loss: 0.9157, test_f1: 0.6444
 epoch: 91, train_loss: 0.5135, test_loss: 1.0427, test_f1: 0.6484
 epoch: 92, train_loss: 0.5312, test_loss: 1.0230, test_f1: 0.6284
 epoch: 93, train_loss: 0.5184, test_loss: 0.9966, test_f1: 0.6188
 epoch: 94, train_loss: 0.5280, test_loss: 0.9335, test_f1: 0.6491
 epoch: 95, train_loss: 0.5224, test_loss: 0.8902, test_f1: 0.6320
 epoch: 96, train_loss: 0.5055, test_loss: 0.9749, test_f1: 0.6314
 epoch: 97, train_loss: 0.4981, test_loss: 0.9396, test_f1: 0.6373
 epoch: 98, train_loss: 0.5061, test_loss: 0.9610, test_f1: 0.6325
 epoch: 99, train_loss: 0.4969, test_loss: 1.0166, test_f1: 0.6272
##################ITERATION #8 ****************************************
 epoch: 0, train_loss: 1.1644, test_loss: 1.1279, test_f1: 0.4409
 epoch: 1, train_loss: 1.0290, test_loss: 1.0590, test_f1: 0.4148
 epoch: 2, train_loss: 0.9838, test_loss: 1.0075, test_f1: 0.5280
 epoch: 3, train_loss: 0.9458, test_loss: 0.9917, test_f1: 0.5169
 epoch: 4, train_loss: 0.9275, test_loss: 1.1693, test_f1: 0.4995
 epoch: 5, train_loss: 0.9300, test_loss: 0.9535, test_f1: 0.5226
 epoch: 6, train_loss: 0.9076, test_loss: 0.9441, test_f1: 0.4962
 epoch: 7, train_loss: 0.8863, test_loss: 0.8959, test_f1: 0.5093
 epoch: 8, train_loss: 0.8860, test_loss: 0.8704, test_f1: 0.4946
 epoch: 9, train_loss: 0.8782, test_loss: 0.9179, test_f1: 0.5320
 epoch: 10, train_loss: 0.8671, test_loss: 0.8225, test_f1: 0.5315
 epoch: 11, train_loss: 0.8481, test_loss: 0.8326, test_f1: 0.5835
 epoch: 12, train_loss: 0.8314, test_loss: 0.8428, test_f1: 0.5373
 epoch: 13, train_loss: 0.8302, test_loss: 0.8045, test_f1: 0.5465
 epoch: 14, train_loss: 0.8349, test_loss: 0.8816, test_f1: 0.5466
 epoch: 15, train_loss: 0.8105, test_loss: 0.9038, test_f1: 0.5429
 epoch: 16, train_loss: 0.7888, test_loss: 0.8186, test_f1: 0.5649
 epoch: 17, train_loss: 0.8057, test_loss: 0.8587, test_f1: 0.5447
 epoch: 18, train_loss: 0.7679, test_loss: 0.9032, test_f1: 0.5277
 epoch: 19, train_loss: 0.7788, test_loss: 0.9171, test_f1: 0.5687
 epoch: 20, train_loss: 0.7721, test_loss: 1.0123, test_f1: 0.5001
 epoch: 21, train_loss: 0.7739, test_loss: 1.1909, test_f1: 0.4746
 epoch: 22, train_loss: 0.7522, test_loss: 0.8695, test_f1: 0.5380
 epoch: 23, train_loss: 0.7366, test_loss: 0.8852, test_f1: 0.6137
 epoch: 24, train_loss: 0.7592, test_loss: 0.8688, test_f1: 0.6088
 epoch: 25, train_loss: 0.7642, test_loss: 0.8274, test_f1: 0.5525
 epoch: 26, train_loss: 0.7525, test_loss: 0.8298, test_f1: 0.6332
 epoch: 27, train_loss: 0.7539, test_loss: 0.8155, test_f1: 0.5357
 epoch: 28, train_loss: 0.7398, test_loss: 0.9537, test_f1: 0.5353
 epoch: 29, train_loss: 0.7426, test_loss: 0.9704, test_f1: 0.5256
 epoch: 30, train_loss: 0.7267, test_loss: 0.9220, test_f1: 0.5644
 epoch: 31, train_loss: 0.7198, test_loss: 0.8710, test_f1: 0.5662
 epoch: 32, train_loss: 0.7163, test_loss: 0.7631, test_f1: 0.5841
 epoch: 33, train_loss: 0.7103, test_loss: 0.8691, test_f1: 0.5603
 epoch: 34, train_loss: 0.7231, test_loss: 0.9200, test_f1: 0.5156
 epoch: 35, train_loss: 0.6878, test_loss: 0.8568, test_f1: 0.5391
 epoch: 36, train_loss: 0.6881, test_loss: 0.8114, test_f1: 0.6144
 epoch: 37, train_loss: 0.6759, test_loss: 0.8764, test_f1: 0.5894
 epoch: 38, train_loss: 0.6992, test_loss: 0.8038, test_f1: 0.5594
 epoch: 39, train_loss: 0.6836, test_loss: 0.9038, test_f1: 0.5898
 epoch: 40, train_loss: 0.6798, test_loss: 0.8045, test_f1: 0.6338
 epoch: 41, train_loss: 0.6729, test_loss: 0.8782, test_f1: 0.5718
 epoch: 42, train_loss: 0.6629, test_loss: 0.8724, test_f1: 0.5928
 epoch: 43, train_loss: 0.6660, test_loss: 0.7503, test_f1: 0.6584
 epoch: 44, train_loss: 0.6631, test_loss: 0.7546, test_f1: 0.6774
 epoch: 45, train_loss: 0.6647, test_loss: 0.8750, test_f1: 0.5949
 epoch: 46, train_loss: 0.6363, test_loss: 0.8461, test_f1: 0.6396
 epoch: 47, train_loss: 0.6506, test_loss: 0.9852, test_f1: 0.5767
 epoch: 48, train_loss: 0.6721, test_loss: 0.9650, test_f1: 0.5821
 epoch: 49, train_loss: 0.6623, test_loss: 0.9400, test_f1: 0.6038
 epoch: 50, train_loss: 0.6385, test_loss: 0.8903, test_f1: 0.5968
 epoch: 51, train_loss: 0.5979, test_loss: 0.8417, test_f1: 0.6116
 epoch: 52, train_loss: 0.5806, test_loss: 0.8995, test_f1: 0.6487
 epoch: 53, train_loss: 0.5708, test_loss: 0.9531, test_f1: 0.6462
 epoch: 54, train_loss: 0.5649, test_loss: 0.9266, test_f1: 0.6308
 epoch: 55, train_loss: 0.5680, test_loss: 0.9440, test_f1: 0.6651
 epoch: 56, train_loss: 0.5521, test_loss: 0.8480, test_f1: 0.6407
 epoch: 57, train_loss: 0.5385, test_loss: 1.0023, test_f1: 0.6639
 epoch: 58, train_loss: 0.5403, test_loss: 0.8353, test_f1: 0.6696
 epoch: 59, train_loss: 0.5610, test_loss: 0.9552, test_f1: 0.6509
 epoch: 60, train_loss: 0.5360, test_loss: 0.9597, test_f1: 0.6240
 epoch: 61, train_loss: 0.5397, test_loss: 0.9720, test_f1: 0.6514
 epoch: 62, train_loss: 0.5302, test_loss: 0.8899, test_f1: 0.6563
 epoch: 63, train_loss: 0.5297, test_loss: 0.9015, test_f1: 0.6519
 epoch: 64, train_loss: 0.5385, test_loss: 0.9247, test_f1: 0.6455
 epoch: 65, train_loss: 0.5275, test_loss: 1.0738, test_f1: 0.6156
 epoch: 66, train_loss: 0.5235, test_loss: 1.1049, test_f1: 0.6442
 epoch: 67, train_loss: 0.5201, test_loss: 1.0005, test_f1: 0.6401
 epoch: 68, train_loss: 0.5037, test_loss: 0.8354, test_f1: 0.6667
 epoch: 69, train_loss: 0.5128, test_loss: 1.0168, test_f1: 0.6251
 epoch: 70, train_loss: 0.5217, test_loss: 0.9017, test_f1: 0.6564
 epoch: 71, train_loss: 0.5135, test_loss: 0.8990, test_f1: 0.6692
 epoch: 72, train_loss: 0.5107, test_loss: 0.9149, test_f1: 0.6432
 epoch: 73, train_loss: 0.5053, test_loss: 0.9836, test_f1: 0.6560
 epoch: 74, train_loss: 0.4993, test_loss: 0.9612, test_f1: 0.6628
 epoch: 75, train_loss: 0.5096, test_loss: 1.0908, test_f1: 0.6355
 epoch: 76, train_loss: 0.5023, test_loss: 1.1340, test_f1: 0.6481
 epoch: 77, train_loss: 0.4769, test_loss: 1.1800, test_f1: 0.6660
 epoch: 78, train_loss: 0.4828, test_loss: 1.1704, test_f1: 0.6479
 epoch: 79, train_loss: 0.4804, test_loss: 1.0370, test_f1: 0.6667
 epoch: 80, train_loss: 0.4848, test_loss: 1.1908, test_f1: 0.6355
 epoch: 81, train_loss: 0.4738, test_loss: 1.2040, test_f1: 0.6391
 epoch: 82, train_loss: 0.4823, test_loss: 1.2185, test_f1: 0.6420
 epoch: 83, train_loss: 0.4700, test_loss: 1.0149, test_f1: 0.6783
 epoch: 84, train_loss: 0.4596, test_loss: 0.9917, test_f1: 0.6625
 epoch: 85, train_loss: 0.4764, test_loss: 1.1206, test_f1: 0.6412
 epoch: 86, train_loss: 0.4650, test_loss: 1.2565, test_f1: 0.6540
 epoch: 87, train_loss: 0.5084, test_loss: 1.0575, test_f1: 0.6527
 epoch: 88, train_loss: 0.4826, test_loss: 1.0831, test_f1: 0.6470
 epoch: 89, train_loss: 0.4566, test_loss: 1.1788, test_f1: 0.6268
 epoch: 90, train_loss: 0.4739, test_loss: 1.0233, test_f1: 0.6724
 epoch: 91, train_loss: 0.4461, test_loss: 1.1447, test_f1: 0.6447
 epoch: 92, train_loss: 0.4362, test_loss: 1.1539, test_f1: 0.6762
 epoch: 93, train_loss: 0.4593, test_loss: 0.9133, test_f1: 0.6648
 epoch: 94, train_loss: 0.4625, test_loss: 1.2085, test_f1: 0.6420
 epoch: 95, train_loss: 0.4791, test_loss: 1.0725, test_f1: 0.6612
 epoch: 96, train_loss: 0.4487, test_loss: 1.1690, test_f1: 0.6441
 epoch: 97, train_loss: 0.4351, test_loss: 1.1948, test_f1: 0.6449
 epoch: 98, train_loss: 0.4371, test_loss: 1.1231, test_f1: 0.6585
 epoch: 99, train_loss: 0.4497, test_loss: 1.1371, test_f1: 0.6455
##################ITERATION #9 ****************************************
 epoch: 0, train_loss: 1.1744, test_loss: 1.1537, test_f1: 0.3978
 epoch: 1, train_loss: 1.0531, test_loss: 1.0164, test_f1: 0.4429
 epoch: 2, train_loss: 1.0197, test_loss: 0.9861, test_f1: 0.4563
 epoch: 3, train_loss: 0.9855, test_loss: 1.0768, test_f1: 0.4996
 epoch: 4, train_loss: 0.9804, test_loss: 0.9435, test_f1: 0.4836
 epoch: 5, train_loss: 0.9771, test_loss: 0.9647, test_f1: 0.5030
 epoch: 6, train_loss: 0.9393, test_loss: 1.0026, test_f1: 0.5201
 epoch: 7, train_loss: 0.9322, test_loss: 0.9626, test_f1: 0.5546
 epoch: 8, train_loss: 0.9169, test_loss: 1.0213, test_f1: 0.5467
 epoch: 9, train_loss: 0.8841, test_loss: 1.0155, test_f1: 0.5338
 epoch: 10, train_loss: 0.8865, test_loss: 0.9549, test_f1: 0.5251
 epoch: 11, train_loss: 0.8678, test_loss: 0.9566, test_f1: 0.4953
 epoch: 12, train_loss: 0.8630, test_loss: 0.9847, test_f1: 0.5359
 epoch: 13, train_loss: 0.8443, test_loss: 1.1271, test_f1: 0.4259
 epoch: 14, train_loss: 0.8487, test_loss: 0.9948, test_f1: 0.5744
 epoch: 15, train_loss: 0.8297, test_loss: 1.0689, test_f1: 0.5604
 epoch: 16, train_loss: 0.8284, test_loss: 0.9705, test_f1: 0.5193
 epoch: 17, train_loss: 0.8015, test_loss: 1.0374, test_f1: 0.5172
 epoch: 18, train_loss: 0.8056, test_loss: 0.9531, test_f1: 0.5159
 epoch: 19, train_loss: 0.7815, test_loss: 0.9738, test_f1: 0.5447
 epoch: 20, train_loss: 0.7679, test_loss: 0.9214, test_f1: 0.5920
 epoch: 21, train_loss: 0.7895, test_loss: 0.8788, test_f1: 0.5488
 epoch: 22, train_loss: 0.7622, test_loss: 0.9536, test_f1: 0.5443
 epoch: 23, train_loss: 0.7768, test_loss: 1.0307, test_f1: 0.5128
 epoch: 24, train_loss: 0.8003, test_loss: 0.9367, test_f1: 0.5314
 epoch: 25, train_loss: 0.7795, test_loss: 1.0593, test_f1: 0.5221
 epoch: 26, train_loss: 0.7506, test_loss: 1.0163, test_f1: 0.5417
 epoch: 27, train_loss: 0.7441, test_loss: 1.0322, test_f1: 0.5446
 epoch: 28, train_loss: 0.7227, test_loss: 1.1652, test_f1: 0.5476
 epoch: 29, train_loss: 0.7269, test_loss: 1.0016, test_f1: 0.5438
 epoch: 30, train_loss: 0.7445, test_loss: 0.9746, test_f1: 0.5470
 epoch: 31, train_loss: 0.7226, test_loss: 1.0538, test_f1: 0.5768
 epoch: 32, train_loss: 0.7191, test_loss: 0.9284, test_f1: 0.5713
 epoch: 33, train_loss: 0.7006, test_loss: 0.9732, test_f1: 0.5848
 epoch: 34, train_loss: 0.7157, test_loss: 0.9961, test_f1: 0.6019
 epoch: 35, train_loss: 0.7049, test_loss: 1.1626, test_f1: 0.5126
 epoch: 36, train_loss: 0.7150, test_loss: 0.9726, test_f1: 0.5485
 epoch: 37, train_loss: 0.7055, test_loss: 0.8992, test_f1: 0.6054
 epoch: 38, train_loss: 0.6880, test_loss: 0.9800, test_f1: 0.5555
 epoch: 39, train_loss: 0.6673, test_loss: 1.0389, test_f1: 0.5600
 epoch: 40, train_loss: 0.6881, test_loss: 1.1111, test_f1: 0.5781
 epoch: 41, train_loss: 0.6712, test_loss: 1.0383, test_f1: 0.5339
 epoch: 42, train_loss: 0.6605, test_loss: 1.1652, test_f1: 0.6158
 epoch: 43, train_loss: 0.6547, test_loss: 1.1598, test_f1: 0.5488
 epoch: 44, train_loss: 0.6860, test_loss: 1.1709, test_f1: 0.5552
 epoch: 45, train_loss: 0.6614, test_loss: 1.2557, test_f1: 0.5763
 epoch: 46, train_loss: 0.6922, test_loss: 1.1980, test_f1: 0.6069
 epoch: 47, train_loss: 0.6670, test_loss: 1.2977, test_f1: 0.5033
 epoch: 48, train_loss: 0.6608, test_loss: 1.0844, test_f1: 0.6178
 epoch: 49, train_loss: 0.6492, test_loss: 1.1513, test_f1: 0.5549
 epoch: 50, train_loss: 0.6580, test_loss: 0.9204, test_f1: 0.5856
 epoch: 51, train_loss: 0.6090, test_loss: 1.0007, test_f1: 0.6198
 epoch: 52, train_loss: 0.5827, test_loss: 1.0701, test_f1: 0.6179
 epoch: 53, train_loss: 0.5912, test_loss: 1.0095, test_f1: 0.5813
 epoch: 54, train_loss: 0.5793, test_loss: 1.0162, test_f1: 0.6086
 epoch: 55, train_loss: 0.5733, test_loss: 1.1037, test_f1: 0.6138
 epoch: 56, train_loss: 0.5507, test_loss: 1.0211, test_f1: 0.6089
 epoch: 57, train_loss: 0.5623, test_loss: 1.1261, test_f1: 0.6241
 epoch: 58, train_loss: 0.5698, test_loss: 1.1481, test_f1: 0.6014
 epoch: 59, train_loss: 0.5678, test_loss: 0.9987, test_f1: 0.6451
 epoch: 60, train_loss: 0.5569, test_loss: 1.0138, test_f1: 0.6155
 epoch: 61, train_loss: 0.5516, test_loss: 1.1847, test_f1: 0.5995
 epoch: 62, train_loss: 0.5586, test_loss: 1.0159, test_f1: 0.6117
 epoch: 63, train_loss: 0.5536, test_loss: 1.1248, test_f1: 0.6121
 epoch: 64, train_loss: 0.5488, test_loss: 0.9916, test_f1: 0.6202
 epoch: 65, train_loss: 0.5495, test_loss: 1.0307, test_f1: 0.6541
 epoch: 66, train_loss: 0.5258, test_loss: 1.0791, test_f1: 0.6483
 epoch: 67, train_loss: 0.5301, test_loss: 1.0935, test_f1: 0.6679
 epoch: 68, train_loss: 0.5116, test_loss: 1.0776, test_f1: 0.6887
 epoch: 69, train_loss: 0.5192, test_loss: 1.1260, test_f1: 0.6174
 epoch: 70, train_loss: 0.5225, test_loss: 1.1797, test_f1: 0.6254
 epoch: 71, train_loss: 0.5327, test_loss: 1.2033, test_f1: 0.6059
 epoch: 72, train_loss: 0.5042, test_loss: 1.1807, test_f1: 0.6405
 epoch: 73, train_loss: 0.5043, test_loss: 1.0847, test_f1: 0.6395
 epoch: 74, train_loss: 0.5037, test_loss: 1.0924, test_f1: 0.6089
 epoch: 75, train_loss: 0.5151, test_loss: 1.2946, test_f1: 0.6318
 epoch: 76, train_loss: 0.4949, test_loss: 1.0619, test_f1: 0.6682
 epoch: 77, train_loss: 0.5060, test_loss: 1.0703, test_f1: 0.6462
 epoch: 78, train_loss: 0.4950, test_loss: 1.0813, test_f1: 0.6416
 epoch: 79, train_loss: 0.4874, test_loss: 1.0848, test_f1: 0.6358
 epoch: 80, train_loss: 0.4776, test_loss: 1.1999, test_f1: 0.6283
 epoch: 81, train_loss: 0.4782, test_loss: 1.1646, test_f1: 0.6169
 epoch: 82, train_loss: 0.4840, test_loss: 1.2534, test_f1: 0.6264
 epoch: 83, train_loss: 0.5049, test_loss: 1.1051, test_f1: 0.6420
 epoch: 84, train_loss: 0.4798, test_loss: 1.1671, test_f1: 0.6448
 epoch: 85, train_loss: 0.4706, test_loss: 1.0505, test_f1: 0.6552
 epoch: 86, train_loss: 0.4795, test_loss: 1.0940, test_f1: 0.6518
 epoch: 87, train_loss: 0.4754, test_loss: 1.0925, test_f1: 0.6461
 epoch: 88, train_loss: 0.4871, test_loss: 1.1384, test_f1: 0.6311
 epoch: 89, train_loss: 0.4719, test_loss: 1.1903, test_f1: 0.6541
 epoch: 90, train_loss: 0.4847, test_loss: 1.0628, test_f1: 0.6374
 epoch: 91, train_loss: 0.4630, test_loss: 1.0277, test_f1: 0.6737
 epoch: 92, train_loss: 0.4559, test_loss: 1.0865, test_f1: 0.6468
 epoch: 93, train_loss: 0.4395, test_loss: 1.0248, test_f1: 0.6376
 epoch: 94, train_loss: 0.4517, test_loss: 1.1497, test_f1: 0.6405
 epoch: 95, train_loss: 0.4826, test_loss: 1.1235, test_f1: 0.6439
 epoch: 96, train_loss: 0.4519, test_loss: 1.0607, test_f1: 0.6641
 epoch: 97, train_loss: 0.4294, test_loss: 1.2014, test_f1: 0.6748
 epoch: 98, train_loss: 0.4643, test_loss: 1.2249, test_f1: 0.6484
 epoch: 99, train_loss: 0.4463, test_loss: 1.2001, test_f1: 0.6205

Training completed in 878.31 seconds
Best F1: 0.7088 at epoch 96
Mean F1 across iterations: 0.6819  0.0124
========================FINAL RESULTS================================
FEGIN weighted F1: 0.7088  0.0124
python main.py --data ltspice_examples --representation component_pin --model FEGIN --layers 6 --hiddens 64 --batch_size 64 --lr 0.01 --emb_size 250 --epochs 100 --save_appendix component_pin_L6_H64_BS64_LR0.01_E250 --no_val
-----



STDERR:
  File "main.py", line 370, in <module>
    main()
  File "main.py", line 254, in main
    dataset = dataset_class(
  File "/home/philip/projects/ltspice_examples_code_repo/Circuit-Completion-Using-GNNs/component_classification_with_link_prediction_head/evaluation/FEGIN/kernel/circuit_datasets.py", line 15, in __init__
    self.data, self.slices = torch.load(self.processed_paths[0])
  File "/home/philip/.local/lib/python3.8/site-packages/torch/serialization.py", line 1040, in load
    warnings.warn(
  File "/usr/lib/python3.8/warnings.py", line 109, in _showwarnmsg
    sw(msg.message, msg.category, msg.filename, msg.lineno,
  File "main.py", line 47, in warn_with_traceback
    traceback.print_stack(file=log)
/home/philip/projects/ltspice_examples_code_repo/Circuit-Completion-Using-GNNs/component_classification_with_link_prediction_head/evaluation/FEGIN/kernel/circuit_datasets.py:15: FutureWarning: You are using `torch.load` with `weights_only=False` (the current default value), which uses the default pickle module implicitly. It is possible to construct malicious pickle data which will execute arbitrary code during unpickling (See https://github.com/pytorch/pytorch/blob/main/SECURITY.md#untrusted-models for more details). In a future release, the default value for `weights_only` will be flipped to `True`. This limits the functions that could be executed during unpickling. Arbitrary objects will no longer be allowed to be loaded via this mode unless they are explicitly allowlisted by the user via `torch.serialization.add_safe_globals`. We recommend you start setting `weights_only=True` for any use case where you don't have full control of the loaded file. Please open an issue on GitHub for any issues related to this experimental feature.
  self.data, self.slices = torch.load(self.processed_paths[0])
