STDOUT:
Results will be saved in /home/philip/projects/ltspice_examples_code_repo/Circuit-Completion-Using-GNNs/component_classification_with_link_prediction_head/evaluation/FEGIN/results/model_FEGIN_dataset_ltspice_demos
Command line input: python main.py --data ltspice_demos --representation component_pin --model FEGIN --layers 3 --hiddens 32 --batch_size 128 --lr 0.01 --emb_size 128 --epochs 100 --save_appendix component_pin_L3_H32_BS128_LR0.01_E128 --no_val
 is saved.
-----
ltspice_demos - FEGIN
Using 3 layers, 32 hidden units, h = 2
Loading component_pin representation dataset
ENTERED
Training FEGIN on component_pin representation
Train: 1565, Test: 383
##################ITERATION #0 ****************************************
 epoch: 0, train_loss: 1.2588, test_loss: 1.3439, test_f1: 0.2357
 epoch: 1, train_loss: 1.1400, test_loss: 1.5085, test_f1: 0.3198
 epoch: 2, train_loss: 1.0726, test_loss: 1.2779, test_f1: 0.3349
 epoch: 3, train_loss: 1.0011, test_loss: 1.2282, test_f1: 0.3446
 epoch: 4, train_loss: 0.9508, test_loss: 1.1891, test_f1: 0.5214
 epoch: 5, train_loss: 0.8950, test_loss: 1.8065, test_f1: 0.3549
 epoch: 6, train_loss: 0.8814, test_loss: 1.0272, test_f1: 0.5017
 epoch: 7, train_loss: 0.8258, test_loss: 1.1166, test_f1: 0.4170
 epoch: 8, train_loss: 0.8210, test_loss: 1.2654, test_f1: 0.3814
 epoch: 9, train_loss: 0.8108, test_loss: 1.2253, test_f1: 0.4616
 epoch: 10, train_loss: 0.7938, test_loss: 0.9933, test_f1: 0.4976
 epoch: 11, train_loss: 0.7697, test_loss: 1.1022, test_f1: 0.5052
 epoch: 12, train_loss: 0.7736, test_loss: 0.9837, test_f1: 0.6029
 epoch: 13, train_loss: 0.7570, test_loss: 0.9656, test_f1: 0.5916
 epoch: 14, train_loss: 0.7459, test_loss: 0.9811, test_f1: 0.4779
 epoch: 15, train_loss: 0.7409, test_loss: 0.9661, test_f1: 0.5845
 epoch: 16, train_loss: 0.7492, test_loss: 0.9191, test_f1: 0.5121
 epoch: 17, train_loss: 0.7465, test_loss: 1.7641, test_f1: 0.4492
 epoch: 18, train_loss: 0.7546, test_loss: 1.0354, test_f1: 0.5755
 epoch: 19, train_loss: 0.7324, test_loss: 1.1240, test_f1: 0.5996
 epoch: 20, train_loss: 0.7236, test_loss: 1.2100, test_f1: 0.5664
 epoch: 21, train_loss: 0.7064, test_loss: 1.3055, test_f1: 0.5287
 epoch: 22, train_loss: 0.7218, test_loss: 1.0573, test_f1: 0.5762
 epoch: 23, train_loss: 0.7126, test_loss: 1.1263, test_f1: 0.5656
 epoch: 24, train_loss: 0.7051, test_loss: 1.1059, test_f1: 0.6074
 epoch: 25, train_loss: 0.7056, test_loss: 1.1841, test_f1: 0.5270
 epoch: 26, train_loss: 0.7015, test_loss: 1.1233, test_f1: 0.5280
 epoch: 27, train_loss: 0.7214, test_loss: 0.8602, test_f1: 0.6463
 epoch: 28, train_loss: 0.7028, test_loss: 1.1711, test_f1: 0.5963
 epoch: 29, train_loss: 0.6985, test_loss: 1.1287, test_f1: 0.5447
 epoch: 30, train_loss: 0.6673, test_loss: 1.0077, test_f1: 0.6604
 epoch: 31, train_loss: 0.6522, test_loss: 1.0200, test_f1: 0.6152
 epoch: 32, train_loss: 0.6846, test_loss: 1.1520, test_f1: 0.5684
 epoch: 33, train_loss: 0.6816, test_loss: 1.0359, test_f1: 0.5783
 epoch: 34, train_loss: 0.7103, test_loss: 1.0074, test_f1: 0.5801
 epoch: 35, train_loss: 0.6998, test_loss: 1.1993, test_f1: 0.5278
 epoch: 36, train_loss: 0.6785, test_loss: 1.3732, test_f1: 0.5303
 epoch: 37, train_loss: 0.6764, test_loss: 1.0154, test_f1: 0.5907
 epoch: 38, train_loss: 0.6899, test_loss: 1.4223, test_f1: 0.4143
 epoch: 39, train_loss: 0.6687, test_loss: 1.2500, test_f1: 0.5387
 epoch: 40, train_loss: 0.6570, test_loss: 1.1465, test_f1: 0.5867
 epoch: 41, train_loss: 0.6251, test_loss: 1.1870, test_f1: 0.5868
 epoch: 42, train_loss: 0.6234, test_loss: 1.1916, test_f1: 0.5389
 epoch: 43, train_loss: 0.6474, test_loss: 1.0187, test_f1: 0.5977
 epoch: 44, train_loss: 0.6125, test_loss: 1.2304, test_f1: 0.5775
 epoch: 45, train_loss: 0.5836, test_loss: 1.2179, test_f1: 0.6002
 epoch: 46, train_loss: 0.6089, test_loss: 1.1564, test_f1: 0.6084
 epoch: 47, train_loss: 0.6063, test_loss: 1.4460, test_f1: 0.5674
 epoch: 48, train_loss: 0.5910, test_loss: 1.3220, test_f1: 0.5825
 epoch: 49, train_loss: 0.5928, test_loss: 1.3484, test_f1: 0.5640
 epoch: 50, train_loss: 0.5776, test_loss: 1.7598, test_f1: 0.5260
 epoch: 51, train_loss: 0.5577, test_loss: 1.3250, test_f1: 0.6386
 epoch: 52, train_loss: 0.5400, test_loss: 1.3841, test_f1: 0.6212
 epoch: 53, train_loss: 0.5472, test_loss: 1.2497, test_f1: 0.6475
 epoch: 54, train_loss: 0.5398, test_loss: 1.2698, test_f1: 0.6269
 epoch: 55, train_loss: 0.5444, test_loss: 1.2350, test_f1: 0.6615
 epoch: 56, train_loss: 0.5236, test_loss: 1.5434, test_f1: 0.5727
 epoch: 57, train_loss: 0.5340, test_loss: 1.4992, test_f1: 0.6391
 epoch: 58, train_loss: 0.5323, test_loss: 1.3172, test_f1: 0.6207
 epoch: 59, train_loss: 0.5174, test_loss: 1.5659, test_f1: 0.5449
 epoch: 60, train_loss: 0.5095, test_loss: 1.2395, test_f1: 0.6030
 epoch: 61, train_loss: 0.5002, test_loss: 1.3926, test_f1: 0.6122
 epoch: 62, train_loss: 0.4825, test_loss: 1.5283, test_f1: 0.6129
 epoch: 63, train_loss: 0.4755, test_loss: 1.7781, test_f1: 0.6267
 epoch: 64, train_loss: 0.5313, test_loss: 1.3617, test_f1: 0.5956
 epoch: 65, train_loss: 0.5148, test_loss: 1.2692, test_f1: 0.5979
 epoch: 66, train_loss: 0.5085, test_loss: 1.6483, test_f1: 0.5950
 epoch: 67, train_loss: 0.4968, test_loss: 1.3659, test_f1: 0.5990
 epoch: 68, train_loss: 0.4853, test_loss: 1.5939, test_f1: 0.6073
 epoch: 69, train_loss: 0.4649, test_loss: 1.3417, test_f1: 0.6239
 epoch: 70, train_loss: 0.5208, test_loss: 1.2377, test_f1: 0.6417
 epoch: 71, train_loss: 0.5435, test_loss: 1.4642, test_f1: 0.6241
 epoch: 72, train_loss: 0.4811, test_loss: 1.3348, test_f1: 0.5966
 epoch: 73, train_loss: 0.4635, test_loss: 1.5297, test_f1: 0.6099
 epoch: 74, train_loss: 0.5806, test_loss: 1.4299, test_f1: 0.6110
 epoch: 75, train_loss: 0.5514, test_loss: 1.2432, test_f1: 0.5910
 epoch: 76, train_loss: 0.4981, test_loss: 1.3092, test_f1: 0.6263
 epoch: 77, train_loss: 0.4619, test_loss: 1.2776, test_f1: 0.6179
 epoch: 78, train_loss: 0.4845, test_loss: 1.2866, test_f1: 0.6088
 epoch: 79, train_loss: 0.4739, test_loss: 1.3579, test_f1: 0.6307
 epoch: 80, train_loss: 0.4826, test_loss: 1.3724, test_f1: 0.6109
 epoch: 81, train_loss: 0.4562, test_loss: 1.3774, test_f1: 0.6186
 epoch: 82, train_loss: 0.4431, test_loss: 1.3245, test_f1: 0.6769
 epoch: 83, train_loss: 0.4495, test_loss: 1.4194, test_f1: 0.6107
 epoch: 84, train_loss: 0.4736, test_loss: 1.5585, test_f1: 0.5538
 epoch: 85, train_loss: 0.4589, test_loss: 1.3885, test_f1: 0.6412
 epoch: 86, train_loss: 0.4552, test_loss: 1.6128, test_f1: 0.5998
 epoch: 87, train_loss: 0.4551, test_loss: 1.6690, test_f1: 0.6080
 epoch: 88, train_loss: 0.4453, test_loss: 1.4376, test_f1: 0.6019
 epoch: 89, train_loss: 0.4514, test_loss: 1.5397, test_f1: 0.6033
 epoch: 90, train_loss: 0.4475, test_loss: 1.5902, test_f1: 0.6132
 epoch: 91, train_loss: 0.4535, test_loss: 1.4427, test_f1: 0.6352
 epoch: 92, train_loss: 0.4501, test_loss: 1.6623, test_f1: 0.5974
 epoch: 93, train_loss: 0.4577, test_loss: 1.6074, test_f1: 0.5997
 epoch: 94, train_loss: 0.4009, test_loss: 1.5368, test_f1: 0.5968
 epoch: 95, train_loss: 0.4334, test_loss: 1.7631, test_f1: 0.6296
 epoch: 96, train_loss: 0.4025, test_loss: 1.7970, test_f1: 0.6379
 epoch: 97, train_loss: 0.3984, test_loss: 1.9844, test_f1: 0.5965
 epoch: 98, train_loss: 0.3822, test_loss: 1.8663, test_f1: 0.6115
 epoch: 99, train_loss: 0.3991, test_loss: 1.7875, test_f1: 0.6227
##################ITERATION #1 ****************************************
 epoch: 0, train_loss: 1.1486, test_loss: 1.4848, test_f1: 0.2281
 epoch: 1, train_loss: 1.0111, test_loss: 1.1954, test_f1: 0.3960
 epoch: 2, train_loss: 0.9466, test_loss: 1.1602, test_f1: 0.4094
 epoch: 3, train_loss: 0.8912, test_loss: 1.0613, test_f1: 0.5571
 epoch: 4, train_loss: 0.8718, test_loss: 1.1398, test_f1: 0.4067
 epoch: 5, train_loss: 0.8203, test_loss: 1.1008, test_f1: 0.5619
 epoch: 6, train_loss: 0.8106, test_loss: 1.1917, test_f1: 0.3781
 epoch: 7, train_loss: 0.8163, test_loss: 1.4806, test_f1: 0.4639
 epoch: 8, train_loss: 0.8040, test_loss: 0.9596, test_f1: 0.6106
 epoch: 9, train_loss: 0.7757, test_loss: 1.0593, test_f1: 0.5268
 epoch: 10, train_loss: 0.7990, test_loss: 1.4846, test_f1: 0.4472
 epoch: 11, train_loss: 0.8002, test_loss: 1.3333, test_f1: 0.4206
 epoch: 12, train_loss: 0.8124, test_loss: 1.0462, test_f1: 0.5685
 epoch: 13, train_loss: 0.7804, test_loss: 0.9810, test_f1: 0.6103
 epoch: 14, train_loss: 0.7645, test_loss: 1.0852, test_f1: 0.5283
 epoch: 15, train_loss: 0.7396, test_loss: 2.7744, test_f1: 0.3709
 epoch: 16, train_loss: 0.7511, test_loss: 0.9926, test_f1: 0.5858
 epoch: 17, train_loss: 0.7248, test_loss: 1.1156, test_f1: 0.5674
 epoch: 18, train_loss: 0.7446, test_loss: 1.3073, test_f1: 0.4881
 epoch: 19, train_loss: 0.7368, test_loss: 1.2833, test_f1: 0.5684
 epoch: 20, train_loss: 0.7344, test_loss: 1.1619, test_f1: 0.5538
 epoch: 21, train_loss: 0.7365, test_loss: 1.2526, test_f1: 0.5522
 epoch: 22, train_loss: 0.7160, test_loss: 1.0330, test_f1: 0.5838
 epoch: 23, train_loss: 0.7115, test_loss: 1.1872, test_f1: 0.5135
 epoch: 24, train_loss: 0.6957, test_loss: 1.2423, test_f1: 0.5440
 epoch: 25, train_loss: 0.6928, test_loss: 1.0444, test_f1: 0.5654
 epoch: 26, train_loss: 0.6856, test_loss: 1.0012, test_f1: 0.5566
 epoch: 27, train_loss: 0.6853, test_loss: 1.2172, test_f1: 0.6066
 epoch: 28, train_loss: 0.7006, test_loss: 1.2460, test_f1: 0.5131
 epoch: 29, train_loss: 0.6827, test_loss: 1.1825, test_f1: 0.4505
 epoch: 30, train_loss: 0.6889, test_loss: 1.0557, test_f1: 0.5883
 epoch: 31, train_loss: 0.6658, test_loss: 0.9695, test_f1: 0.5899
 epoch: 32, train_loss: 0.6520, test_loss: 1.1080, test_f1: 0.5820
 epoch: 33, train_loss: 0.6632, test_loss: 1.2166, test_f1: 0.5580
 epoch: 34, train_loss: 0.6579, test_loss: 1.0705, test_f1: 0.5822
 epoch: 35, train_loss: 0.6609, test_loss: 1.1525, test_f1: 0.5037
 epoch: 36, train_loss: 0.6955, test_loss: 1.6108, test_f1: 0.4493
 epoch: 37, train_loss: 0.6744, test_loss: 0.9914, test_f1: 0.6034
 epoch: 38, train_loss: 0.6483, test_loss: 1.1506, test_f1: 0.6303
 epoch: 39, train_loss: 0.6418, test_loss: 1.2868, test_f1: 0.4848
 epoch: 40, train_loss: 0.6988, test_loss: 1.0687, test_f1: 0.5634
 epoch: 41, train_loss: 0.6478, test_loss: 1.0699, test_f1: 0.5970
 epoch: 42, train_loss: 0.6518, test_loss: 1.1630, test_f1: 0.6272
 epoch: 43, train_loss: 0.6184, test_loss: 1.0293, test_f1: 0.6228
 epoch: 44, train_loss: 0.6505, test_loss: 1.0042, test_f1: 0.6365
 epoch: 45, train_loss: 0.6395, test_loss: 1.1085, test_f1: 0.5987
 epoch: 46, train_loss: 0.6246, test_loss: 1.0382, test_f1: 0.6517
 epoch: 47, train_loss: 0.6186, test_loss: 1.0151, test_f1: 0.6549
 epoch: 48, train_loss: 0.5981, test_loss: 1.1219, test_f1: 0.5442
 epoch: 49, train_loss: 0.6042, test_loss: 1.2018, test_f1: 0.6325
 epoch: 50, train_loss: 0.5683, test_loss: 1.1255, test_f1: 0.6338
 epoch: 51, train_loss: 0.5657, test_loss: 1.0941, test_f1: 0.6293
 epoch: 52, train_loss: 0.5699, test_loss: 1.0056, test_f1: 0.6266
 epoch: 53, train_loss: 0.5396, test_loss: 1.2869, test_f1: 0.5829
 epoch: 54, train_loss: 0.5317, test_loss: 1.1239, test_f1: 0.6574
 epoch: 55, train_loss: 0.5243, test_loss: 1.1582, test_f1: 0.6220
 epoch: 56, train_loss: 0.5325, test_loss: 1.1510, test_f1: 0.5679
 epoch: 57, train_loss: 0.5324, test_loss: 1.2181, test_f1: 0.6367
 epoch: 58, train_loss: 0.5331, test_loss: 1.1026, test_f1: 0.6346
 epoch: 59, train_loss: 0.4915, test_loss: 1.1499, test_f1: 0.6686
 epoch: 60, train_loss: 0.4945, test_loss: 1.1593, test_f1: 0.5995
 epoch: 61, train_loss: 0.5169, test_loss: 1.1060, test_f1: 0.6590
 epoch: 62, train_loss: 0.5001, test_loss: 1.1025, test_f1: 0.6255
 epoch: 63, train_loss: 0.4837, test_loss: 1.1725, test_f1: 0.6011
 epoch: 64, train_loss: 0.4979, test_loss: 1.3508, test_f1: 0.6073
 epoch: 65, train_loss: 0.4728, test_loss: 1.0941, test_f1: 0.6435
 epoch: 66, train_loss: 0.4906, test_loss: 1.2157, test_f1: 0.6474
 epoch: 67, train_loss: 0.4657, test_loss: 1.2982, test_f1: 0.6187
 epoch: 68, train_loss: 0.4872, test_loss: 1.5500, test_f1: 0.5756
 epoch: 69, train_loss: 0.4639, test_loss: 1.0814, test_f1: 0.6657
 epoch: 70, train_loss: 0.4791, test_loss: 1.1990, test_f1: 0.6454
 epoch: 71, train_loss: 0.4553, test_loss: 1.2399, test_f1: 0.6402
 epoch: 72, train_loss: 0.4442, test_loss: 1.3142, test_f1: 0.6443
 epoch: 73, train_loss: 0.4328, test_loss: 1.1968, test_f1: 0.6433
 epoch: 74, train_loss: 0.4415, test_loss: 1.5710, test_f1: 0.6108
 epoch: 75, train_loss: 0.4295, test_loss: 1.2205, test_f1: 0.6252
 epoch: 76, train_loss: 0.4386, test_loss: 1.9377, test_f1: 0.4954
 epoch: 77, train_loss: 0.4581, test_loss: 1.3200, test_f1: 0.6344
 epoch: 78, train_loss: 0.4154, test_loss: 1.3483, test_f1: 0.6595
 epoch: 79, train_loss: 0.4601, test_loss: 1.2179, test_f1: 0.6510
 epoch: 80, train_loss: 0.5258, test_loss: 1.1740, test_f1: 0.5947
 epoch: 81, train_loss: 0.4293, test_loss: 1.2116, test_f1: 0.6866
 epoch: 82, train_loss: 0.4224, test_loss: 1.4705, test_f1: 0.6168
 epoch: 83, train_loss: 0.4340, test_loss: 1.3994, test_f1: 0.5712
 epoch: 84, train_loss: 0.4067, test_loss: 1.3335, test_f1: 0.6353
 epoch: 85, train_loss: 0.3983, test_loss: 1.5198, test_f1: 0.6337
 epoch: 86, train_loss: 0.3931, test_loss: 1.4676, test_f1: 0.6184
 epoch: 87, train_loss: 0.4201, test_loss: 1.4431, test_f1: 0.6240
 epoch: 88, train_loss: 0.4005, test_loss: 1.3970, test_f1: 0.6865
 epoch: 89, train_loss: 0.3997, test_loss: 1.4566, test_f1: 0.6464
 epoch: 90, train_loss: 0.3675, test_loss: 1.5145, test_f1: 0.6354
 epoch: 91, train_loss: 0.3864, test_loss: 1.5362, test_f1: 0.6368
 epoch: 92, train_loss: 0.3727, test_loss: 1.5488, test_f1: 0.6630
 epoch: 93, train_loss: 0.3652, test_loss: 1.3984, test_f1: 0.6894
 epoch: 94, train_loss: 0.3484, test_loss: 1.7450, test_f1: 0.6029
 epoch: 95, train_loss: 0.3669, test_loss: 1.6330, test_f1: 0.6132
 epoch: 96, train_loss: 0.3856, test_loss: 1.5631, test_f1: 0.6396
 epoch: 97, train_loss: 0.3901, test_loss: 1.4176, test_f1: 0.6509
 epoch: 98, train_loss: 0.3696, test_loss: 1.7955, test_f1: 0.5802
 epoch: 99, train_loss: 0.3765, test_loss: 1.4289, test_f1: 0.6653
##################ITERATION #2 ****************************************
 epoch: 0, train_loss: 1.2239, test_loss: 1.4329, test_f1: 0.2618
 epoch: 1, train_loss: 1.0652, test_loss: 1.2140, test_f1: 0.4276
 epoch: 2, train_loss: 0.9683, test_loss: 1.2300, test_f1: 0.3833
 epoch: 3, train_loss: 0.9109, test_loss: 0.9979, test_f1: 0.5518
 epoch: 4, train_loss: 0.8982, test_loss: 1.1017, test_f1: 0.4909
 epoch: 5, train_loss: 0.8645, test_loss: 1.0032, test_f1: 0.5605
 epoch: 6, train_loss: 0.8678, test_loss: 1.0420, test_f1: 0.5586
 epoch: 7, train_loss: 0.8661, test_loss: 1.2079, test_f1: 0.4806
 epoch: 8, train_loss: 0.8227, test_loss: 0.9896, test_f1: 0.5701
 epoch: 9, train_loss: 0.8195, test_loss: 1.0117, test_f1: 0.5890
 epoch: 10, train_loss: 0.7969, test_loss: 0.9802, test_f1: 0.5727
 epoch: 11, train_loss: 0.7807, test_loss: 1.2373, test_f1: 0.5477
 epoch: 12, train_loss: 0.7755, test_loss: 1.0612, test_f1: 0.5624
 epoch: 13, train_loss: 0.7682, test_loss: 1.0907, test_f1: 0.5397
 epoch: 14, train_loss: 0.7636, test_loss: 0.9822, test_f1: 0.5472
 epoch: 15, train_loss: 0.7380, test_loss: 1.0018, test_f1: 0.6218
 epoch: 16, train_loss: 0.7533, test_loss: 0.9534, test_f1: 0.6059
 epoch: 17, train_loss: 0.7888, test_loss: 1.1683, test_f1: 0.4902
 epoch: 18, train_loss: 0.7648, test_loss: 0.9702, test_f1: 0.5830
 epoch: 19, train_loss: 0.7455, test_loss: 1.1159, test_f1: 0.5616
 epoch: 20, train_loss: 0.7326, test_loss: 0.9851, test_f1: 0.6016
 epoch: 21, train_loss: 0.7284, test_loss: 1.0272, test_f1: 0.5950
 epoch: 22, train_loss: 0.7202, test_loss: 0.9618, test_f1: 0.6199
 epoch: 23, train_loss: 0.7132, test_loss: 1.0116, test_f1: 0.5653
 epoch: 24, train_loss: 0.6757, test_loss: 0.9616, test_f1: 0.6386
 epoch: 25, train_loss: 0.6854, test_loss: 1.0735, test_f1: 0.5921
 epoch: 26, train_loss: 0.6688, test_loss: 0.9707, test_f1: 0.6345
 epoch: 27, train_loss: 0.6745, test_loss: 1.0192, test_f1: 0.6028
 epoch: 28, train_loss: 0.6617, test_loss: 1.1214, test_f1: 0.5620
 epoch: 29, train_loss: 0.6528, test_loss: 1.5732, test_f1: 0.5069
 epoch: 30, train_loss: 0.6618, test_loss: 0.9546, test_f1: 0.6097
 epoch: 31, train_loss: 0.6378, test_loss: 1.0500, test_f1: 0.6339
 epoch: 32, train_loss: 0.6326, test_loss: 1.2920, test_f1: 0.5550
 epoch: 33, train_loss: 0.6215, test_loss: 1.1718, test_f1: 0.6165
 epoch: 34, train_loss: 0.6468, test_loss: 1.4723, test_f1: 0.5232
 epoch: 35, train_loss: 0.6487, test_loss: 1.3643, test_f1: 0.4880
 epoch: 36, train_loss: 0.6797, test_loss: 1.1814, test_f1: 0.5682
 epoch: 37, train_loss: 0.6509, test_loss: 1.5203, test_f1: 0.4744
 epoch: 38, train_loss: 0.6689, test_loss: 1.0806, test_f1: 0.5196
 epoch: 39, train_loss: 0.6507, test_loss: 1.0140, test_f1: 0.6480
 epoch: 40, train_loss: 0.6325, test_loss: 1.8369, test_f1: 0.4286
 epoch: 41, train_loss: 0.6224, test_loss: 1.1453, test_f1: 0.5508
 epoch: 42, train_loss: 0.5958, test_loss: 1.2632, test_f1: 0.5636
 epoch: 43, train_loss: 0.6454, test_loss: 1.1194, test_f1: 0.6024
 epoch: 44, train_loss: 0.6103, test_loss: 1.0482, test_f1: 0.5722
 epoch: 45, train_loss: 0.6064, test_loss: 1.1470, test_f1: 0.6037
 epoch: 46, train_loss: 0.6197, test_loss: 1.1387, test_f1: 0.6512
 epoch: 47, train_loss: 0.6202, test_loss: 1.3187, test_f1: 0.4636
 epoch: 48, train_loss: 0.6386, test_loss: 0.9959, test_f1: 0.6133
 epoch: 49, train_loss: 0.6411, test_loss: 0.9803, test_f1: 0.6536
 epoch: 50, train_loss: 0.6042, test_loss: 1.0263, test_f1: 0.6182
 epoch: 51, train_loss: 0.5557, test_loss: 0.9527, test_f1: 0.6686
 epoch: 52, train_loss: 0.5486, test_loss: 0.9782, test_f1: 0.6950
 epoch: 53, train_loss: 0.5382, test_loss: 0.9617, test_f1: 0.6986
 epoch: 54, train_loss: 0.5301, test_loss: 0.9739, test_f1: 0.6703
 epoch: 55, train_loss: 0.5195, test_loss: 1.0967, test_f1: 0.6464
 epoch: 56, train_loss: 0.5133, test_loss: 1.0196, test_f1: 0.6827
 epoch: 57, train_loss: 0.5060, test_loss: 1.1044, test_f1: 0.6838
 epoch: 58, train_loss: 0.4984, test_loss: 1.1783, test_f1: 0.6221
 epoch: 59, train_loss: 0.4822, test_loss: 1.1854, test_f1: 0.6523
 epoch: 60, train_loss: 0.5116, test_loss: 1.2103, test_f1: 0.6379
 epoch: 61, train_loss: 0.4647, test_loss: 1.0936, test_f1: 0.6748
 epoch: 62, train_loss: 0.4792, test_loss: 1.1734, test_f1: 0.6267
 epoch: 63, train_loss: 0.4859, test_loss: 1.2187, test_f1: 0.6296
 epoch: 64, train_loss: 0.5022, test_loss: 1.3164, test_f1: 0.6150
 epoch: 65, train_loss: 0.4689, test_loss: 1.0998, test_f1: 0.6684
 epoch: 66, train_loss: 0.4680, test_loss: 1.2074, test_f1: 0.6464
 epoch: 67, train_loss: 0.4699, test_loss: 1.2178, test_f1: 0.6543
 epoch: 68, train_loss: 0.4452, test_loss: 1.2848, test_f1: 0.6348
 epoch: 69, train_loss: 0.4339, test_loss: 1.2304, test_f1: 0.6522
 epoch: 70, train_loss: 0.4477, test_loss: 1.2947, test_f1: 0.6304
 epoch: 71, train_loss: 0.4453, test_loss: 1.1249, test_f1: 0.6549
 epoch: 72, train_loss: 0.4234, test_loss: 1.2094, test_f1: 0.6577
 epoch: 73, train_loss: 0.4528, test_loss: 1.6645, test_f1: 0.5197
 epoch: 74, train_loss: 0.4521, test_loss: 1.5448, test_f1: 0.6277
 epoch: 75, train_loss: 0.4506, test_loss: 1.4055, test_f1: 0.6625
 epoch: 76, train_loss: 0.4485, test_loss: 1.4583, test_f1: 0.6086
 epoch: 77, train_loss: 0.4709, test_loss: 1.4356, test_f1: 0.6195
 epoch: 78, train_loss: 0.4152, test_loss: 1.3681, test_f1: 0.6427
 epoch: 79, train_loss: 0.4084, test_loss: 1.4791, test_f1: 0.6252
 epoch: 80, train_loss: 0.4119, test_loss: 1.5296, test_f1: 0.5994
 epoch: 81, train_loss: 0.4221, test_loss: 1.5093, test_f1: 0.6114
 epoch: 82, train_loss: 0.4164, test_loss: 1.2550, test_f1: 0.6662
 epoch: 83, train_loss: 0.4193, test_loss: 1.3300, test_f1: 0.6419
 epoch: 84, train_loss: 0.3975, test_loss: 1.3860, test_f1: 0.6495
 epoch: 85, train_loss: 0.3814, test_loss: 1.4235, test_f1: 0.6112
 epoch: 86, train_loss: 0.3794, test_loss: 1.2247, test_f1: 0.7106
 epoch: 87, train_loss: 0.4149, test_loss: 1.2803, test_f1: 0.6958
 epoch: 88, train_loss: 0.4109, test_loss: 1.3169, test_f1: 0.6473
 epoch: 89, train_loss: 0.3904, test_loss: 1.2594, test_f1: 0.6279
 epoch: 90, train_loss: 0.4316, test_loss: 1.3637, test_f1: 0.6527
 epoch: 91, train_loss: 0.4318, test_loss: 1.4523, test_f1: 0.5598
 epoch: 92, train_loss: 0.4182, test_loss: 1.2436, test_f1: 0.6618
 epoch: 93, train_loss: 0.4049, test_loss: 1.3975, test_f1: 0.6657
 epoch: 94, train_loss: 0.3848, test_loss: 1.3044, test_f1: 0.6082
 epoch: 95, train_loss: 0.4050, test_loss: 1.4773, test_f1: 0.6236
 epoch: 96, train_loss: 0.4095, test_loss: 1.2367, test_f1: 0.6679
 epoch: 97, train_loss: 0.3772, test_loss: 1.4520, test_f1: 0.6221
 epoch: 98, train_loss: 0.3734, test_loss: 1.5853, test_f1: 0.6402
 epoch: 99, train_loss: 0.3800, test_loss: 1.3723, test_f1: 0.6655
##################ITERATION #3 ****************************************
 epoch: 0, train_loss: 1.2343, test_loss: 1.5111, test_f1: 0.2144
 epoch: 1, train_loss: 1.0206, test_loss: 1.1921, test_f1: 0.4524
 epoch: 2, train_loss: 0.9704, test_loss: 1.1063, test_f1: 0.4767
 epoch: 3, train_loss: 0.9233, test_loss: 1.0722, test_f1: 0.5033
 epoch: 4, train_loss: 0.8723, test_loss: 1.1203, test_f1: 0.5076
 epoch: 5, train_loss: 0.8899, test_loss: 1.2007, test_f1: 0.4458
 epoch: 6, train_loss: 0.8467, test_loss: 1.1587, test_f1: 0.4687
 epoch: 7, train_loss: 0.8345, test_loss: 0.9745, test_f1: 0.5605
 epoch: 8, train_loss: 0.8064, test_loss: 1.3144, test_f1: 0.5370
 epoch: 9, train_loss: 0.8230, test_loss: 1.2289, test_f1: 0.5843
 epoch: 10, train_loss: 0.7788, test_loss: 1.3388, test_f1: 0.4699
 epoch: 11, train_loss: 0.7794, test_loss: 1.1827, test_f1: 0.5354
 epoch: 12, train_loss: 0.7989, test_loss: 1.1316, test_f1: 0.4684
 epoch: 13, train_loss: 0.8051, test_loss: 1.0002, test_f1: 0.5770
 epoch: 14, train_loss: 0.7782, test_loss: 1.0258, test_f1: 0.5970
 epoch: 15, train_loss: 0.7537, test_loss: 1.3910, test_f1: 0.5118
 epoch: 16, train_loss: 0.7580, test_loss: 1.3934, test_f1: 0.5246
 epoch: 17, train_loss: 0.7449, test_loss: 1.0945, test_f1: 0.5597
 epoch: 18, train_loss: 0.7925, test_loss: 3.1959, test_f1: 0.3413
 epoch: 19, train_loss: 0.8167, test_loss: 1.0675, test_f1: 0.6102
 epoch: 20, train_loss: 0.7647, test_loss: 1.0461, test_f1: 0.6050
 epoch: 21, train_loss: 0.7425, test_loss: 1.0098, test_f1: 0.5773
 epoch: 22, train_loss: 0.7411, test_loss: 0.9506, test_f1: 0.6064
 epoch: 23, train_loss: 0.7244, test_loss: 1.1815, test_f1: 0.6058
 epoch: 24, train_loss: 0.7228, test_loss: 1.2914, test_f1: 0.5347
 epoch: 25, train_loss: 0.7287, test_loss: 1.1639, test_f1: 0.5107
 epoch: 26, train_loss: 0.7184, test_loss: 1.0411, test_f1: 0.5547
 epoch: 27, train_loss: 0.7517, test_loss: 1.1961, test_f1: 0.5342
 epoch: 28, train_loss: 0.7342, test_loss: 1.0710, test_f1: 0.5842
 epoch: 29, train_loss: 0.7295, test_loss: 1.0361, test_f1: 0.5959
 epoch: 30, train_loss: 0.6956, test_loss: 1.2227, test_f1: 0.5970
 epoch: 31, train_loss: 0.7159, test_loss: 1.2220, test_f1: 0.5855
 epoch: 32, train_loss: 0.6931, test_loss: 1.0484, test_f1: 0.6066
 epoch: 33, train_loss: 0.7088, test_loss: 1.1710, test_f1: 0.4932
 epoch: 34, train_loss: 0.6935, test_loss: 1.2338, test_f1: 0.6232
 epoch: 35, train_loss: 0.6857, test_loss: 0.9662, test_f1: 0.6190
 epoch: 36, train_loss: 0.6745, test_loss: 1.3784, test_f1: 0.5835
 epoch: 37, train_loss: 0.6856, test_loss: 1.5146, test_f1: 0.5885
 epoch: 38, train_loss: 0.6929, test_loss: 1.5565, test_f1: 0.5317
 epoch: 39, train_loss: 0.6809, test_loss: 1.2606, test_f1: 0.5920
 epoch: 40, train_loss: 0.6734, test_loss: 1.1649, test_f1: 0.5399
 epoch: 41, train_loss: 0.6937, test_loss: 1.3098, test_f1: 0.4754
 epoch: 42, train_loss: 0.6854, test_loss: 1.3970, test_f1: 0.5889
 epoch: 43, train_loss: 0.6641, test_loss: 1.2467, test_f1: 0.5631
 epoch: 44, train_loss: 0.6471, test_loss: 1.4740, test_f1: 0.5697
 epoch: 45, train_loss: 0.6636, test_loss: 1.3144, test_f1: 0.5812
 epoch: 46, train_loss: 0.6511, test_loss: 1.3708, test_f1: 0.5890
 epoch: 47, train_loss: 0.6354, test_loss: 1.1167, test_f1: 0.6392
 epoch: 48, train_loss: 0.6663, test_loss: 1.1782, test_f1: 0.5657
 epoch: 49, train_loss: 0.6593, test_loss: 1.4705, test_f1: 0.5984
 epoch: 50, train_loss: 0.6602, test_loss: 1.3661, test_f1: 0.6544
 epoch: 51, train_loss: 0.6425, test_loss: 1.4423, test_f1: 0.6370
 epoch: 52, train_loss: 0.6186, test_loss: 1.4048, test_f1: 0.6160
 epoch: 53, train_loss: 0.6229, test_loss: 1.2957, test_f1: 0.6280
 epoch: 54, train_loss: 0.6041, test_loss: 1.6329, test_f1: 0.6105
 epoch: 55, train_loss: 0.6138, test_loss: 1.6865, test_f1: 0.6513
 epoch: 56, train_loss: 0.5992, test_loss: 1.5980, test_f1: 0.6176
 epoch: 57, train_loss: 0.5816, test_loss: 1.3839, test_f1: 0.6400
 epoch: 58, train_loss: 0.5964, test_loss: 1.3932, test_f1: 0.6461
 epoch: 59, train_loss: 0.5903, test_loss: 1.3644, test_f1: 0.5835
 epoch: 60, train_loss: 0.5701, test_loss: 1.3851, test_f1: 0.6214
 epoch: 61, train_loss: 0.5541, test_loss: 1.3731, test_f1: 0.6429
 epoch: 62, train_loss: 0.5526, test_loss: 1.5669, test_f1: 0.6084
 epoch: 63, train_loss: 0.5662, test_loss: 1.3695, test_f1: 0.5879
 epoch: 64, train_loss: 0.5535, test_loss: 1.3705, test_f1: 0.6411
 epoch: 65, train_loss: 0.5459, test_loss: 1.3661, test_f1: 0.6352
 epoch: 66, train_loss: 0.5492, test_loss: 1.5676, test_f1: 0.6281
 epoch: 67, train_loss: 0.5420, test_loss: 1.4880, test_f1: 0.6278
 epoch: 68, train_loss: 0.5315, test_loss: 1.7931, test_f1: 0.6336
 epoch: 69, train_loss: 0.5545, test_loss: 1.6039, test_f1: 0.6382
 epoch: 70, train_loss: 0.5408, test_loss: 1.6652, test_f1: 0.6139
 epoch: 71, train_loss: 0.5512, test_loss: 1.5666, test_f1: 0.6026
 epoch: 72, train_loss: 0.5338, test_loss: 1.7207, test_f1: 0.6217
 epoch: 73, train_loss: 0.5301, test_loss: 1.8726, test_f1: 0.6147
 epoch: 74, train_loss: 0.5387, test_loss: 1.5828, test_f1: 0.6532
 epoch: 75, train_loss: 0.5628, test_loss: 1.4089, test_f1: 0.5993
 epoch: 76, train_loss: 0.5628, test_loss: 1.5446, test_f1: 0.6365
 epoch: 77, train_loss: 0.5367, test_loss: 1.5020, test_f1: 0.6597
 epoch: 78, train_loss: 0.5000, test_loss: 1.7443, test_f1: 0.6279
 epoch: 79, train_loss: 0.5227, test_loss: 1.7309, test_f1: 0.5730
 epoch: 80, train_loss: 0.5056, test_loss: 1.6055, test_f1: 0.6713
 epoch: 81, train_loss: 0.5253, test_loss: 1.6245, test_f1: 0.6310
 epoch: 82, train_loss: 0.5036, test_loss: 1.8502, test_f1: 0.5950
 epoch: 83, train_loss: 0.4922, test_loss: 1.7173, test_f1: 0.6659
 epoch: 84, train_loss: 0.5249, test_loss: 1.5336, test_f1: 0.6434
 epoch: 85, train_loss: 0.6163, test_loss: 1.5068, test_f1: 0.6047
 epoch: 86, train_loss: 0.5623, test_loss: 1.5652, test_f1: 0.6025
 epoch: 87, train_loss: 0.5169, test_loss: 2.0175, test_f1: 0.5737
 epoch: 88, train_loss: 0.5149, test_loss: 1.9807, test_f1: 0.5705
 epoch: 89, train_loss: 0.5139, test_loss: 1.6642, test_f1: 0.5716
 epoch: 90, train_loss: 0.4869, test_loss: 1.5717, test_f1: 0.5996
 epoch: 91, train_loss: 0.5021, test_loss: 1.7049, test_f1: 0.5811
 epoch: 92, train_loss: 0.5016, test_loss: 2.0769, test_f1: 0.5469
 epoch: 93, train_loss: 0.5214, test_loss: 1.7202, test_f1: 0.5853
 epoch: 94, train_loss: 0.4892, test_loss: 1.7124, test_f1: 0.5985
 epoch: 95, train_loss: 0.4903, test_loss: 1.4890, test_f1: 0.5821
 epoch: 96, train_loss: 0.4998, test_loss: 1.9110, test_f1: 0.5823
 epoch: 97, train_loss: 0.4916, test_loss: 1.7342, test_f1: 0.5864
 epoch: 98, train_loss: 0.4965, test_loss: 1.6724, test_f1: 0.5968
 epoch: 99, train_loss: 0.4432, test_loss: 1.6249, test_f1: 0.6052
##################ITERATION #4 ****************************************
 epoch: 0, train_loss: 1.1953, test_loss: 1.3405, test_f1: 0.1388
 epoch: 1, train_loss: 0.9735, test_loss: 1.2213, test_f1: 0.4630
 epoch: 2, train_loss: 0.9168, test_loss: 1.0908, test_f1: 0.5188
 epoch: 3, train_loss: 0.8823, test_loss: 1.0302, test_f1: 0.5879
 epoch: 4, train_loss: 0.8530, test_loss: 1.1066, test_f1: 0.5010
 epoch: 5, train_loss: 0.8303, test_loss: 0.9941, test_f1: 0.5452
 epoch: 6, train_loss: 0.8156, test_loss: 1.0654, test_f1: 0.5856
 epoch: 7, train_loss: 0.8347, test_loss: 1.1528, test_f1: 0.5368
 epoch: 8, train_loss: 0.8162, test_loss: 0.9864, test_f1: 0.5377
 epoch: 9, train_loss: 0.7864, test_loss: 1.0389, test_f1: 0.5304
 epoch: 10, train_loss: 0.7826, test_loss: 1.1125, test_f1: 0.5214
 epoch: 11, train_loss: 0.7602, test_loss: 1.0247, test_f1: 0.5735
 epoch: 12, train_loss: 0.7644, test_loss: 0.8971, test_f1: 0.6204
 epoch: 13, train_loss: 0.7338, test_loss: 1.2170, test_f1: 0.5726
 epoch: 14, train_loss: 0.7209, test_loss: 0.9104, test_f1: 0.5712
 epoch: 15, train_loss: 0.7454, test_loss: 1.4564, test_f1: 0.4325
 epoch: 16, train_loss: 0.7601, test_loss: 0.9980, test_f1: 0.5595
 epoch: 17, train_loss: 0.7678, test_loss: 1.1424, test_f1: 0.5366
 epoch: 18, train_loss: 0.7642, test_loss: 1.0702, test_f1: 0.5499
 epoch: 19, train_loss: 0.7200, test_loss: 0.9222, test_f1: 0.6029
 epoch: 20, train_loss: 0.6954, test_loss: 0.9766, test_f1: 0.5898
 epoch: 21, train_loss: 0.6899, test_loss: 1.0545, test_f1: 0.5886
 epoch: 22, train_loss: 0.7201, test_loss: 1.1230, test_f1: 0.5345
 epoch: 23, train_loss: 0.7023, test_loss: 1.0913, test_f1: 0.5955
 epoch: 24, train_loss: 0.7007, test_loss: 1.2999, test_f1: 0.5333
 epoch: 25, train_loss: 0.7184, test_loss: 1.1141, test_f1: 0.5424
 epoch: 26, train_loss: 0.6956, test_loss: 1.4641, test_f1: 0.5367
 epoch: 27, train_loss: 0.6769, test_loss: 1.0619, test_f1: 0.5764
 epoch: 28, train_loss: 0.6897, test_loss: 1.2071, test_f1: 0.5466
 epoch: 29, train_loss: 0.6570, test_loss: 1.2322, test_f1: 0.5739
 epoch: 30, train_loss: 0.6606, test_loss: 1.0909, test_f1: 0.5814
 epoch: 31, train_loss: 0.6748, test_loss: 1.1929, test_f1: 0.5608
 epoch: 32, train_loss: 0.6579, test_loss: 1.1521, test_f1: 0.5895
 epoch: 33, train_loss: 0.6227, test_loss: 1.1667, test_f1: 0.5558
 epoch: 34, train_loss: 0.6359, test_loss: 1.4887, test_f1: 0.5777
 epoch: 35, train_loss: 0.6766, test_loss: 1.1286, test_f1: 0.5681
 epoch: 36, train_loss: 0.6875, test_loss: 1.2306, test_f1: 0.5736
 epoch: 37, train_loss: 0.6675, test_loss: 1.4914, test_f1: 0.5221
 epoch: 38, train_loss: 0.6292, test_loss: 1.3689, test_f1: 0.5343
 epoch: 39, train_loss: 0.6544, test_loss: 1.1443, test_f1: 0.6417
 epoch: 40, train_loss: 0.6388, test_loss: 1.2267, test_f1: 0.5983
 epoch: 41, train_loss: 0.5911, test_loss: 1.2120, test_f1: 0.5596
 epoch: 42, train_loss: 0.5907, test_loss: 1.9663, test_f1: 0.4548
 epoch: 43, train_loss: 0.5980, test_loss: 1.2058, test_f1: 0.5320
 epoch: 44, train_loss: 0.5542, test_loss: 1.3169, test_f1: 0.5631
 epoch: 45, train_loss: 0.5901, test_loss: 1.4310, test_f1: 0.5455
 epoch: 46, train_loss: 0.5956, test_loss: 1.2076, test_f1: 0.5937
 epoch: 47, train_loss: 0.5634, test_loss: 1.2154, test_f1: 0.6128
 epoch: 48, train_loss: 0.5659, test_loss: 1.4957, test_f1: 0.5773
 epoch: 49, train_loss: 0.5803, test_loss: 1.5756, test_f1: 0.5523
 epoch: 50, train_loss: 0.5678, test_loss: 1.2148, test_f1: 0.5876
 epoch: 51, train_loss: 0.5464, test_loss: 1.2872, test_f1: 0.5751
 epoch: 52, train_loss: 0.5114, test_loss: 1.3686, test_f1: 0.5722
 epoch: 53, train_loss: 0.4946, test_loss: 1.4942, test_f1: 0.5881
 epoch: 54, train_loss: 0.4737, test_loss: 1.4703, test_f1: 0.5868
 epoch: 55, train_loss: 0.4762, test_loss: 1.6116, test_f1: 0.5740
 epoch: 56, train_loss: 0.4757, test_loss: 1.5771, test_f1: 0.5736
 epoch: 57, train_loss: 0.4637, test_loss: 1.3424, test_f1: 0.6194
 epoch: 58, train_loss: 0.4770, test_loss: 1.6138, test_f1: 0.5724
 epoch: 59, train_loss: 0.4553, test_loss: 2.1959, test_f1: 0.5418
 epoch: 60, train_loss: 0.5035, test_loss: 1.5609, test_f1: 0.5746
 epoch: 61, train_loss: 0.4679, test_loss: 1.5129, test_f1: 0.6300
 epoch: 62, train_loss: 0.4730, test_loss: 1.9910, test_f1: 0.6067
 epoch: 63, train_loss: 0.4778, test_loss: 1.7160, test_f1: 0.5864
 epoch: 64, train_loss: 0.4422, test_loss: 1.8520, test_f1: 0.5779
 epoch: 65, train_loss: 0.4119, test_loss: 1.7934, test_f1: 0.6000
 epoch: 66, train_loss: 0.4359, test_loss: 1.7124, test_f1: 0.6001
 epoch: 67, train_loss: 0.4155, test_loss: 1.8089, test_f1: 0.5835
 epoch: 68, train_loss: 0.4099, test_loss: 2.0581, test_f1: 0.5807
 epoch: 69, train_loss: 0.4378, test_loss: 1.9154, test_f1: 0.5947
 epoch: 70, train_loss: 0.4479, test_loss: 2.0043, test_f1: 0.5937
 epoch: 71, train_loss: 0.4687, test_loss: 1.8075, test_f1: 0.5900
 epoch: 72, train_loss: 0.4289, test_loss: 2.0041, test_f1: 0.6011
 epoch: 73, train_loss: 0.4000, test_loss: 1.9268, test_f1: 0.5898
 epoch: 74, train_loss: 0.3822, test_loss: 2.3418, test_f1: 0.5799
 epoch: 75, train_loss: 0.4131, test_loss: 2.0136, test_f1: 0.5635
 epoch: 76, train_loss: 0.3975, test_loss: 1.6560, test_f1: 0.6156
 epoch: 77, train_loss: 0.3920, test_loss: 1.8925, test_f1: 0.5711
 epoch: 78, train_loss: 0.3881, test_loss: 1.9792, test_f1: 0.6143
 epoch: 79, train_loss: 0.3883, test_loss: 1.9299, test_f1: 0.6021
 epoch: 80, train_loss: 0.4167, test_loss: 2.0139, test_f1: 0.6077
 epoch: 81, train_loss: 0.3707, test_loss: 1.9569, test_f1: 0.5536
 epoch: 82, train_loss: 0.3940, test_loss: 1.9775, test_f1: 0.5702
 epoch: 83, train_loss: 0.3819, test_loss: 1.8503, test_f1: 0.5687
 epoch: 84, train_loss: 0.3730, test_loss: 2.5268, test_f1: 0.5534
 epoch: 85, train_loss: 0.3622, test_loss: 2.1817, test_f1: 0.5949
 epoch: 86, train_loss: 0.3796, test_loss: 2.4733, test_f1: 0.5648
 epoch: 87, train_loss: 0.3511, test_loss: 2.3631, test_f1: 0.5991
 epoch: 88, train_loss: 0.4185, test_loss: 2.0769, test_f1: 0.6227
 epoch: 89, train_loss: 0.3939, test_loss: 1.8516, test_f1: 0.6090
 epoch: 90, train_loss: 0.3798, test_loss: 1.9667, test_f1: 0.6038
 epoch: 91, train_loss: 0.3703, test_loss: 2.2390, test_f1: 0.6257
 epoch: 92, train_loss: 0.3712, test_loss: 2.1307, test_f1: 0.6106
 epoch: 93, train_loss: 0.3621, test_loss: 2.2057, test_f1: 0.5778
 epoch: 94, train_loss: 0.3389, test_loss: 2.1478, test_f1: 0.6141
 epoch: 95, train_loss: 0.3598, test_loss: 2.3847, test_f1: 0.6045
 epoch: 96, train_loss: 0.3353, test_loss: 2.2351, test_f1: 0.6082
 epoch: 97, train_loss: 0.3136, test_loss: 2.2640, test_f1: 0.5631
 epoch: 98, train_loss: 0.3485, test_loss: 2.5847, test_f1: 0.5895
 epoch: 99, train_loss: 0.3323, test_loss: 2.1539, test_f1: 0.5982
##################ITERATION #5 ****************************************
 epoch: 0, train_loss: 1.2684, test_loss: 1.3750, test_f1: 0.3236
 epoch: 1, train_loss: 1.0712, test_loss: 1.3500, test_f1: 0.2969
 epoch: 2, train_loss: 0.9627, test_loss: 1.3029, test_f1: 0.3674
 epoch: 3, train_loss: 0.8988, test_loss: 1.0295, test_f1: 0.5677
 epoch: 4, train_loss: 0.8667, test_loss: 1.0328, test_f1: 0.5418
 epoch: 5, train_loss: 0.8359, test_loss: 0.9860, test_f1: 0.5906
 epoch: 6, train_loss: 0.8153, test_loss: 1.0642, test_f1: 0.5955
 epoch: 7, train_loss: 0.8103, test_loss: 1.0477, test_f1: 0.5786
 epoch: 8, train_loss: 0.8220, test_loss: 1.0004, test_f1: 0.4775
 epoch: 9, train_loss: 0.7851, test_loss: 1.0140, test_f1: 0.5675
 epoch: 10, train_loss: 0.7572, test_loss: 1.0348, test_f1: 0.6363
 epoch: 11, train_loss: 0.7550, test_loss: 1.2370, test_f1: 0.4547
 epoch: 12, train_loss: 0.7566, test_loss: 1.0139, test_f1: 0.6154
 epoch: 13, train_loss: 0.7717, test_loss: 1.0990, test_f1: 0.5354
 epoch: 14, train_loss: 0.7045, test_loss: 1.0476, test_f1: 0.6105
 epoch: 15, train_loss: 0.7248, test_loss: 1.1739, test_f1: 0.5223
 epoch: 16, train_loss: 0.7342, test_loss: 1.3060, test_f1: 0.5125
 epoch: 17, train_loss: 0.7254, test_loss: 1.3521, test_f1: 0.5055
 epoch: 18, train_loss: 0.6980, test_loss: 1.0605, test_f1: 0.5714
 epoch: 19, train_loss: 0.7438, test_loss: 2.2157, test_f1: 0.4415
 epoch: 20, train_loss: 0.7094, test_loss: 1.0286, test_f1: 0.5713
 epoch: 21, train_loss: 0.6838, test_loss: 0.9635, test_f1: 0.6236
 epoch: 22, train_loss: 0.6879, test_loss: 1.0735, test_f1: 0.6160
 epoch: 23, train_loss: 0.6866, test_loss: 1.0438, test_f1: 0.6024
 epoch: 24, train_loss: 0.6919, test_loss: 1.0491, test_f1: 0.5372
 epoch: 25, train_loss: 0.6856, test_loss: 1.2864, test_f1: 0.5399
 epoch: 26, train_loss: 0.6874, test_loss: 1.2263, test_f1: 0.5429
 epoch: 27, train_loss: 0.6503, test_loss: 0.9583, test_f1: 0.6332
 epoch: 28, train_loss: 0.6466, test_loss: 1.0551, test_f1: 0.6175
 epoch: 29, train_loss: 0.6622, test_loss: 1.1197, test_f1: 0.4891
 epoch: 30, train_loss: 0.6725, test_loss: 1.0366, test_f1: 0.6036
 epoch: 31, train_loss: 0.6464, test_loss: 1.1085, test_f1: 0.6503
 epoch: 32, train_loss: 0.6648, test_loss: 1.3975, test_f1: 0.5751
 epoch: 33, train_loss: 0.6796, test_loss: 0.9518, test_f1: 0.5919
 epoch: 34, train_loss: 0.6445, test_loss: 1.1458, test_f1: 0.5502
 epoch: 35, train_loss: 0.5976, test_loss: 1.4542, test_f1: 0.5693
 epoch: 36, train_loss: 0.6056, test_loss: 1.8885, test_f1: 0.4726
 epoch: 37, train_loss: 0.6013, test_loss: 1.5458, test_f1: 0.5603
 epoch: 38, train_loss: 0.6350, test_loss: 1.0765, test_f1: 0.6309
 epoch: 39, train_loss: 0.6137, test_loss: 1.1030, test_f1: 0.6351
 epoch: 40, train_loss: 0.6159, test_loss: 1.2330, test_f1: 0.5087
 epoch: 41, train_loss: 0.5892, test_loss: 1.2513, test_f1: 0.5674
 epoch: 42, train_loss: 0.5610, test_loss: 1.3607, test_f1: 0.5968
 epoch: 43, train_loss: 0.5989, test_loss: 1.1394, test_f1: 0.6145
 epoch: 44, train_loss: 0.6200, test_loss: 0.9554, test_f1: 0.6422
 epoch: 45, train_loss: 0.5880, test_loss: 0.9915, test_f1: 0.6135
 epoch: 46, train_loss: 0.5696, test_loss: 1.1435, test_f1: 0.5940
 epoch: 47, train_loss: 0.5959, test_loss: 1.0521, test_f1: 0.5796
 epoch: 48, train_loss: 0.5646, test_loss: 1.0487, test_f1: 0.6546
 epoch: 49, train_loss: 0.5616, test_loss: 1.0532, test_f1: 0.6511
 epoch: 50, train_loss: 0.5397, test_loss: 1.3128, test_f1: 0.5812
 epoch: 51, train_loss: 0.5107, test_loss: 1.0893, test_f1: 0.6158
 epoch: 52, train_loss: 0.5292, test_loss: 1.1572, test_f1: 0.6147
 epoch: 53, train_loss: 0.5020, test_loss: 1.2250, test_f1: 0.6177
 epoch: 54, train_loss: 0.4904, test_loss: 1.6189, test_f1: 0.5882
 epoch: 55, train_loss: 0.4755, test_loss: 1.4191, test_f1: 0.6348
 epoch: 56, train_loss: 0.4595, test_loss: 1.2126, test_f1: 0.5859
 epoch: 57, train_loss: 0.4625, test_loss: 1.2813, test_f1: 0.6600
 epoch: 58, train_loss: 0.4665, test_loss: 1.1495, test_f1: 0.6226
 epoch: 59, train_loss: 0.4610, test_loss: 1.5407, test_f1: 0.6279
 epoch: 60, train_loss: 0.4698, test_loss: 1.0582, test_f1: 0.6453
 epoch: 61, train_loss: 0.4845, test_loss: 1.1788, test_f1: 0.6435
 epoch: 62, train_loss: 0.4562, test_loss: 1.2795, test_f1: 0.6590
 epoch: 63, train_loss: 0.4592, test_loss: 1.4101, test_f1: 0.6039
 epoch: 64, train_loss: 0.4386, test_loss: 1.5096, test_f1: 0.6392
 epoch: 65, train_loss: 0.4547, test_loss: 1.2763, test_f1: 0.6231
 epoch: 66, train_loss: 0.4729, test_loss: 1.3989, test_f1: 0.6089
 epoch: 67, train_loss: 0.4639, test_loss: 1.5853, test_f1: 0.6074
 epoch: 68, train_loss: 0.4247, test_loss: 1.5018, test_f1: 0.6246
 epoch: 69, train_loss: 0.4487, test_loss: 1.4056, test_f1: 0.6690
 epoch: 70, train_loss: 0.4584, test_loss: 1.4829, test_f1: 0.6452
 epoch: 71, train_loss: 0.4310, test_loss: 1.2578, test_f1: 0.6298
 epoch: 72, train_loss: 0.4141, test_loss: 1.3814, test_f1: 0.6399
 epoch: 73, train_loss: 0.4180, test_loss: 1.5677, test_f1: 0.6240
 epoch: 74, train_loss: 0.4082, test_loss: 1.4408, test_f1: 0.5965
 epoch: 75, train_loss: 0.4216, test_loss: 1.5484, test_f1: 0.5425
 epoch: 76, train_loss: 0.4228, test_loss: 1.4916, test_f1: 0.6048
 epoch: 77, train_loss: 0.4286, test_loss: 1.5815, test_f1: 0.5912
 epoch: 78, train_loss: 0.4269, test_loss: 1.8402, test_f1: 0.6077
 epoch: 79, train_loss: 0.4025, test_loss: 1.9122, test_f1: 0.5877
 epoch: 80, train_loss: 0.4132, test_loss: 1.4456, test_f1: 0.5802
 epoch: 81, train_loss: 0.4122, test_loss: 1.5357, test_f1: 0.5865
 epoch: 82, train_loss: 0.4153, test_loss: 1.5418, test_f1: 0.6071
 epoch: 83, train_loss: 0.4200, test_loss: 1.5794, test_f1: 0.6165
 epoch: 84, train_loss: 0.4104, test_loss: 1.8305, test_f1: 0.6223
 epoch: 85, train_loss: 0.4180, test_loss: 2.0840, test_f1: 0.5341
 epoch: 86, train_loss: 0.3802, test_loss: 1.9006, test_f1: 0.5569
 epoch: 87, train_loss: 0.3842, test_loss: 1.8054, test_f1: 0.5709
 epoch: 88, train_loss: 0.4401, test_loss: 1.8113, test_f1: 0.5945
 epoch: 89, train_loss: 0.4079, test_loss: 1.8235, test_f1: 0.5738
 epoch: 90, train_loss: 0.3868, test_loss: 1.5241, test_f1: 0.6284
 epoch: 91, train_loss: 0.3734, test_loss: 1.5942, test_f1: 0.6148
 epoch: 92, train_loss: 0.3863, test_loss: 1.3891, test_f1: 0.6435
 epoch: 93, train_loss: 0.3917, test_loss: 1.8266, test_f1: 0.6059
 epoch: 94, train_loss: 0.3418, test_loss: 1.6165, test_f1: 0.6339
 epoch: 95, train_loss: 0.3658, test_loss: 1.8959, test_f1: 0.5847
 epoch: 96, train_loss: 0.3498, test_loss: 1.8402, test_f1: 0.6510
 epoch: 97, train_loss: 0.3648, test_loss: 1.6480, test_f1: 0.6088
 epoch: 98, train_loss: 0.3616, test_loss: 1.8085, test_f1: 0.6142
 epoch: 99, train_loss: 0.3740, test_loss: 1.6423, test_f1: 0.6062
##################ITERATION #6 ****************************************
 epoch: 0, train_loss: 1.3297, test_loss: 1.4783, test_f1: 0.2337
 epoch: 1, train_loss: 1.0506, test_loss: 1.3158, test_f1: 0.3653
 epoch: 2, train_loss: 0.9868, test_loss: 1.1503, test_f1: 0.5310
 epoch: 3, train_loss: 0.9837, test_loss: 1.1302, test_f1: 0.4622
 epoch: 4, train_loss: 0.9373, test_loss: 1.0266, test_f1: 0.5814
 epoch: 5, train_loss: 0.8947, test_loss: 1.0169, test_f1: 0.5680
 epoch: 6, train_loss: 0.8540, test_loss: 1.2520, test_f1: 0.4116
 epoch: 7, train_loss: 0.8404, test_loss: 1.0117, test_f1: 0.5556
 epoch: 8, train_loss: 0.8330, test_loss: 1.7864, test_f1: 0.3810
 epoch: 9, train_loss: 0.8401, test_loss: 1.0736, test_f1: 0.5097
 epoch: 10, train_loss: 0.8248, test_loss: 1.1673, test_f1: 0.4621
 epoch: 11, train_loss: 0.8196, test_loss: 1.1511, test_f1: 0.4334
 epoch: 12, train_loss: 0.8108, test_loss: 0.9955, test_f1: 0.4783
 epoch: 13, train_loss: 0.7799, test_loss: 1.0527, test_f1: 0.4969
 epoch: 14, train_loss: 0.7856, test_loss: 1.0703, test_f1: 0.4834
 epoch: 15, train_loss: 0.7807, test_loss: 0.9708, test_f1: 0.5842
 epoch: 16, train_loss: 0.7827, test_loss: 1.0315, test_f1: 0.5629
 epoch: 17, train_loss: 0.7580, test_loss: 1.0014, test_f1: 0.6016
 epoch: 18, train_loss: 0.7363, test_loss: 1.0223, test_f1: 0.5963
 epoch: 19, train_loss: 0.7198, test_loss: 1.1870, test_f1: 0.5484
 epoch: 20, train_loss: 0.6965, test_loss: 0.9694, test_f1: 0.5769
 epoch: 21, train_loss: 0.6983, test_loss: 1.0015, test_f1: 0.6036
 epoch: 22, train_loss: 0.6873, test_loss: 1.4472, test_f1: 0.4854
 epoch: 23, train_loss: 0.6994, test_loss: 1.0407, test_f1: 0.5923
 epoch: 24, train_loss: 0.7119, test_loss: 1.2040, test_f1: 0.5018
 epoch: 25, train_loss: 0.7102, test_loss: 1.1042, test_f1: 0.5402
 epoch: 26, train_loss: 0.6846, test_loss: 1.1426, test_f1: 0.5823
 epoch: 27, train_loss: 0.6922, test_loss: 1.0763, test_f1: 0.5557
 epoch: 28, train_loss: 0.7143, test_loss: 1.0022, test_f1: 0.6035
 epoch: 29, train_loss: 0.7298, test_loss: 1.0944, test_f1: 0.5579
 epoch: 30, train_loss: 0.6739, test_loss: 1.0265, test_f1: 0.6103
 epoch: 31, train_loss: 0.6663, test_loss: 1.1237, test_f1: 0.5819
 epoch: 32, train_loss: 0.6624, test_loss: 0.9785, test_f1: 0.6060
 epoch: 33, train_loss: 0.6606, test_loss: 1.1050, test_f1: 0.5894
 epoch: 34, train_loss: 0.6633, test_loss: 1.0990, test_f1: 0.6186
 epoch: 35, train_loss: 0.6949, test_loss: 1.0559, test_f1: 0.5410
 epoch: 36, train_loss: 0.6669, test_loss: 0.9894, test_f1: 0.6153
 epoch: 37, train_loss: 0.6475, test_loss: 0.9939, test_f1: 0.6164
 epoch: 38, train_loss: 0.6439, test_loss: 1.0898, test_f1: 0.6004
 epoch: 39, train_loss: 0.6138, test_loss: 1.0397, test_f1: 0.5652
 epoch: 40, train_loss: 0.6063, test_loss: 1.0866, test_f1: 0.5849
 epoch: 41, train_loss: 0.5826, test_loss: 1.4049, test_f1: 0.5222
 epoch: 42, train_loss: 0.6066, test_loss: 1.1701, test_f1: 0.6034
 epoch: 43, train_loss: 0.6121, test_loss: 1.0554, test_f1: 0.6296
 epoch: 44, train_loss: 0.5888, test_loss: 1.0544, test_f1: 0.6232
 epoch: 45, train_loss: 0.5922, test_loss: 1.1906, test_f1: 0.5661
 epoch: 46, train_loss: 0.5832, test_loss: 0.9783, test_f1: 0.6647
 epoch: 47, train_loss: 0.6017, test_loss: 1.0961, test_f1: 0.6807
 epoch: 48, train_loss: 0.6065, test_loss: 0.9503, test_f1: 0.6467
 epoch: 49, train_loss: 0.5910, test_loss: 1.0308, test_f1: 0.6133
 epoch: 50, train_loss: 0.5811, test_loss: 1.1538, test_f1: 0.5353
 epoch: 51, train_loss: 0.5813, test_loss: 1.0483, test_f1: 0.6098
 epoch: 52, train_loss: 0.5392, test_loss: 1.0297, test_f1: 0.6107
 epoch: 53, train_loss: 0.5333, test_loss: 1.0088, test_f1: 0.5929
 epoch: 54, train_loss: 0.5370, test_loss: 1.0907, test_f1: 0.6139
 epoch: 55, train_loss: 0.5350, test_loss: 1.0235, test_f1: 0.6258
 epoch: 56, train_loss: 0.5421, test_loss: 1.1081, test_f1: 0.6095
 epoch: 57, train_loss: 0.5269, test_loss: 1.0598, test_f1: 0.6230
 epoch: 58, train_loss: 0.4981, test_loss: 1.1330, test_f1: 0.6013
 epoch: 59, train_loss: 0.5086, test_loss: 1.1790, test_f1: 0.5784
 epoch: 60, train_loss: 0.5251, test_loss: 1.1921, test_f1: 0.5434
 epoch: 61, train_loss: 0.4859, test_loss: 1.4502, test_f1: 0.5196
 epoch: 62, train_loss: 0.4850, test_loss: 1.1274, test_f1: 0.6057
 epoch: 63, train_loss: 0.4800, test_loss: 1.1262, test_f1: 0.5851
 epoch: 64, train_loss: 0.4642, test_loss: 1.3041, test_f1: 0.5885
 epoch: 65, train_loss: 0.4607, test_loss: 1.2454, test_f1: 0.5868
 epoch: 66, train_loss: 0.4756, test_loss: 1.1530, test_f1: 0.5748
 epoch: 67, train_loss: 0.5124, test_loss: 1.1817, test_f1: 0.5656
 epoch: 68, train_loss: 0.4692, test_loss: 1.2371, test_f1: 0.6072
 epoch: 69, train_loss: 0.4754, test_loss: 1.1249, test_f1: 0.6276
 epoch: 70, train_loss: 0.4561, test_loss: 1.1413, test_f1: 0.6170
 epoch: 71, train_loss: 0.4422, test_loss: 1.2012, test_f1: 0.6287
 epoch: 72, train_loss: 0.4618, test_loss: 1.1914, test_f1: 0.5892
 epoch: 73, train_loss: 0.4535, test_loss: 1.5580, test_f1: 0.5574
 epoch: 74, train_loss: 0.4911, test_loss: 1.3116, test_f1: 0.6278
 epoch: 75, train_loss: 0.4914, test_loss: 1.2681, test_f1: 0.5794
 epoch: 76, train_loss: 0.4583, test_loss: 1.1396, test_f1: 0.6098
 epoch: 77, train_loss: 0.4344, test_loss: 1.1208, test_f1: 0.6205
 epoch: 78, train_loss: 0.4337, test_loss: 1.0756, test_f1: 0.6419
 epoch: 79, train_loss: 0.4348, test_loss: 1.2435, test_f1: 0.5996
 epoch: 80, train_loss: 0.4227, test_loss: 1.4182, test_f1: 0.5626
 epoch: 81, train_loss: 0.4470, test_loss: 1.2611, test_f1: 0.5864
 epoch: 82, train_loss: 0.4366, test_loss: 1.2641, test_f1: 0.6055
 epoch: 83, train_loss: 0.4248, test_loss: 1.2230, test_f1: 0.6081
 epoch: 84, train_loss: 0.4375, test_loss: 1.2340, test_f1: 0.6290
 epoch: 85, train_loss: 0.4361, test_loss: 1.2364, test_f1: 0.6016
 epoch: 86, train_loss: 0.3847, test_loss: 1.1962, test_f1: 0.6253
 epoch: 87, train_loss: 0.3904, test_loss: 1.3741, test_f1: 0.6067
 epoch: 88, train_loss: 0.4095, test_loss: 1.4150, test_f1: 0.5821
 epoch: 89, train_loss: 0.4195, test_loss: 1.2657, test_f1: 0.6138
 epoch: 90, train_loss: 0.4302, test_loss: 1.3513, test_f1: 0.5752
 epoch: 91, train_loss: 0.4260, test_loss: 1.4291, test_f1: 0.5258
 epoch: 92, train_loss: 0.3999, test_loss: 1.2271, test_f1: 0.5974
 epoch: 93, train_loss: 0.4001, test_loss: 1.4021, test_f1: 0.5329
 epoch: 94, train_loss: 0.3883, test_loss: 1.4529, test_f1: 0.5856
 epoch: 95, train_loss: 0.4077, test_loss: 1.3998, test_f1: 0.5949
 epoch: 96, train_loss: 0.3908, test_loss: 1.3669, test_f1: 0.5826
 epoch: 97, train_loss: 0.3980, test_loss: 1.3712, test_f1: 0.5922
 epoch: 98, train_loss: 0.3730, test_loss: 1.4440, test_f1: 0.6200
 epoch: 99, train_loss: 0.3825, test_loss: 1.2649, test_f1: 0.5746
##################ITERATION #7 ****************************************
 epoch: 0, train_loss: 1.2704, test_loss: 1.5172, test_f1: 0.3242
 epoch: 1, train_loss: 1.0049, test_loss: 1.3466, test_f1: 0.3900
 epoch: 2, train_loss: 0.9178, test_loss: 1.4865, test_f1: 0.3775
 epoch: 3, train_loss: 0.8789, test_loss: 1.3194, test_f1: 0.5125
 epoch: 4, train_loss: 0.8470, test_loss: 1.3591, test_f1: 0.4148
 epoch: 5, train_loss: 0.8265, test_loss: 1.2814, test_f1: 0.5011
 epoch: 6, train_loss: 0.8193, test_loss: 1.1821, test_f1: 0.5288
 epoch: 7, train_loss: 0.8208, test_loss: 1.4600, test_f1: 0.4856
 epoch: 8, train_loss: 0.8000, test_loss: 1.1160, test_f1: 0.5500
 epoch: 9, train_loss: 0.8039, test_loss: 2.0576, test_f1: 0.2742
 epoch: 10, train_loss: 0.7965, test_loss: 1.1202, test_f1: 0.4958
 epoch: 11, train_loss: 0.7938, test_loss: 0.9557, test_f1: 0.5900
 epoch: 12, train_loss: 0.7537, test_loss: 0.9397, test_f1: 0.6266
 epoch: 13, train_loss: 0.7562, test_loss: 1.0948, test_f1: 0.5139
 epoch: 14, train_loss: 0.7497, test_loss: 1.2676, test_f1: 0.4887
 epoch: 15, train_loss: 0.7442, test_loss: 1.1166, test_f1: 0.6133
 epoch: 16, train_loss: 0.7641, test_loss: 1.5174, test_f1: 0.3970
 epoch: 17, train_loss: 0.7836, test_loss: 0.9937, test_f1: 0.6015
 epoch: 18, train_loss: 0.7593, test_loss: 0.9323, test_f1: 0.5652
 epoch: 19, train_loss: 0.7373, test_loss: 0.9708, test_f1: 0.6304
 epoch: 20, train_loss: 0.7448, test_loss: 0.9436, test_f1: 0.5977
 epoch: 21, train_loss: 0.7415, test_loss: 1.0428, test_f1: 0.5477
 epoch: 22, train_loss: 0.7283, test_loss: 0.9361, test_f1: 0.6112
 epoch: 23, train_loss: 0.7281, test_loss: 0.9809, test_f1: 0.5997
 epoch: 24, train_loss: 0.7239, test_loss: 1.0590, test_f1: 0.6320
 epoch: 25, train_loss: 0.7052, test_loss: 1.0432, test_f1: 0.5869
 epoch: 26, train_loss: 0.7043, test_loss: 1.0422, test_f1: 0.6441
 epoch: 27, train_loss: 0.6927, test_loss: 1.1201, test_f1: 0.5745
 epoch: 28, train_loss: 0.6807, test_loss: 1.0729, test_f1: 0.6006
 epoch: 29, train_loss: 0.6859, test_loss: 1.2648, test_f1: 0.5671
 epoch: 30, train_loss: 0.6965, test_loss: 1.2616, test_f1: 0.6311
 epoch: 31, train_loss: 0.6757, test_loss: 0.9577, test_f1: 0.5812
 epoch: 32, train_loss: 0.6891, test_loss: 1.0477, test_f1: 0.5867
 epoch: 33, train_loss: 0.7386, test_loss: 1.1415, test_f1: 0.5314
 epoch: 34, train_loss: 0.7458, test_loss: 0.9860, test_f1: 0.6241
 epoch: 35, train_loss: 0.8043, test_loss: 0.9883, test_f1: 0.6175
 epoch: 36, train_loss: 0.7615, test_loss: 1.0019, test_f1: 0.6207
 epoch: 37, train_loss: 0.7222, test_loss: 1.0444, test_f1: 0.5836
 epoch: 38, train_loss: 0.6925, test_loss: 0.9883, test_f1: 0.6239
 epoch: 39, train_loss: 0.6768, test_loss: 1.0120, test_f1: 0.5468
 epoch: 40, train_loss: 0.6787, test_loss: 0.9694, test_f1: 0.6135
 epoch: 41, train_loss: 0.6813, test_loss: 0.9590, test_f1: 0.6323
 epoch: 42, train_loss: 0.6446, test_loss: 1.1096, test_f1: 0.6036
 epoch: 43, train_loss: 0.6649, test_loss: 1.0522, test_f1: 0.6492
 epoch: 44, train_loss: 0.6291, test_loss: 1.0564, test_f1: 0.6074
 epoch: 45, train_loss: 0.6435, test_loss: 1.1327, test_f1: 0.6335
 epoch: 46, train_loss: 0.6245, test_loss: 0.9968, test_f1: 0.6353
 epoch: 47, train_loss: 0.6749, test_loss: 1.0855, test_f1: 0.5430
 epoch: 48, train_loss: 0.6818, test_loss: 1.1509, test_f1: 0.6454
 epoch: 49, train_loss: 0.7095, test_loss: 1.0432, test_f1: 0.6280
 epoch: 50, train_loss: 0.6316, test_loss: 1.0005, test_f1: 0.6206
 epoch: 51, train_loss: 0.6456, test_loss: 1.1679, test_f1: 0.5667
 epoch: 52, train_loss: 0.5873, test_loss: 1.0062, test_f1: 0.6421
 epoch: 53, train_loss: 0.5703, test_loss: 1.1740, test_f1: 0.6419
 epoch: 54, train_loss: 0.5670, test_loss: 1.1181, test_f1: 0.6357
 epoch: 55, train_loss: 0.5599, test_loss: 1.1221, test_f1: 0.6412
 epoch: 56, train_loss: 0.5565, test_loss: 1.1489, test_f1: 0.6280
 epoch: 57, train_loss: 0.5554, test_loss: 1.1823, test_f1: 0.6460
 epoch: 58, train_loss: 0.5388, test_loss: 1.0359, test_f1: 0.6389
 epoch: 59, train_loss: 0.5512, test_loss: 1.1569, test_f1: 0.6279
 epoch: 60, train_loss: 0.5487, test_loss: 1.1192, test_f1: 0.5850
 epoch: 61, train_loss: 0.5244, test_loss: 1.2807, test_f1: 0.6486
 epoch: 62, train_loss: 0.5330, test_loss: 1.1294, test_f1: 0.6741
 epoch: 63, train_loss: 0.4946, test_loss: 1.1391, test_f1: 0.6722
 epoch: 64, train_loss: 0.4993, test_loss: 1.3695, test_f1: 0.6454
 epoch: 65, train_loss: 0.5008, test_loss: 1.2209, test_f1: 0.6275
 epoch: 66, train_loss: 0.4962, test_loss: 1.1483, test_f1: 0.6705
 epoch: 67, train_loss: 0.4946, test_loss: 1.3316, test_f1: 0.5722
 epoch: 68, train_loss: 0.5327, test_loss: 1.6181, test_f1: 0.5385
 epoch: 69, train_loss: 0.5059, test_loss: 1.2668, test_f1: 0.5844
 epoch: 70, train_loss: 0.4942, test_loss: 1.2713, test_f1: 0.6313
 epoch: 71, train_loss: 0.5050, test_loss: 1.1458, test_f1: 0.5964
 epoch: 72, train_loss: 0.5002, test_loss: 1.2281, test_f1: 0.6608
 epoch: 73, train_loss: 0.5000, test_loss: 1.1653, test_f1: 0.5891
 epoch: 74, train_loss: 0.4859, test_loss: 0.9863, test_f1: 0.6591
 epoch: 75, train_loss: 0.4788, test_loss: 1.1959, test_f1: 0.6322
 epoch: 76, train_loss: 0.4688, test_loss: 1.1819, test_f1: 0.6410
 epoch: 77, train_loss: 0.4612, test_loss: 1.3834, test_f1: 0.6214
 epoch: 78, train_loss: 0.4861, test_loss: 1.4561, test_f1: 0.5927
 epoch: 79, train_loss: 0.4939, test_loss: 1.2607, test_f1: 0.6494
 epoch: 80, train_loss: 0.4794, test_loss: 1.2304, test_f1: 0.6396
 epoch: 81, train_loss: 0.4988, test_loss: 1.3206, test_f1: 0.5950
 epoch: 82, train_loss: 0.4900, test_loss: 1.2567, test_f1: 0.6465
 epoch: 83, train_loss: 0.4531, test_loss: 1.3787, test_f1: 0.6184
 epoch: 84, train_loss: 0.4319, test_loss: 1.3327, test_f1: 0.6325
 epoch: 85, train_loss: 0.4226, test_loss: 1.4980, test_f1: 0.6596
 epoch: 86, train_loss: 0.4147, test_loss: 1.5415, test_f1: 0.6486
 epoch: 87, train_loss: 0.4330, test_loss: 1.3665, test_f1: 0.6620
 epoch: 88, train_loss: 0.4775, test_loss: 1.4210, test_f1: 0.6163
 epoch: 89, train_loss: 0.4579, test_loss: 1.1541, test_f1: 0.6378
 epoch: 90, train_loss: 0.4674, test_loss: 1.1713, test_f1: 0.6394
 epoch: 91, train_loss: 0.4588, test_loss: 1.9446, test_f1: 0.4268
 epoch: 92, train_loss: 0.4309, test_loss: 1.3529, test_f1: 0.6812
 epoch: 93, train_loss: 0.4281, test_loss: 1.4659, test_f1: 0.6169
 epoch: 94, train_loss: 0.4168, test_loss: 1.4795, test_f1: 0.5741
 epoch: 95, train_loss: 0.4104, test_loss: 1.6438, test_f1: 0.5799
 epoch: 96, train_loss: 0.4200, test_loss: 1.1224, test_f1: 0.6578
 epoch: 97, train_loss: 0.4278, test_loss: 1.5375, test_f1: 0.6521
 epoch: 98, train_loss: 0.4125, test_loss: 1.4972, test_f1: 0.6571
 epoch: 99, train_loss: 0.4077, test_loss: 1.4171, test_f1: 0.6708
##################ITERATION #8 ****************************************
 epoch: 0, train_loss: 1.2508, test_loss: 1.5542, test_f1: 0.2852
 epoch: 1, train_loss: 1.0390, test_loss: 1.2509, test_f1: 0.3424
 epoch: 2, train_loss: 0.9634, test_loss: 1.0414, test_f1: 0.5180
 epoch: 3, train_loss: 0.9087, test_loss: 1.0407, test_f1: 0.5216
 epoch: 4, train_loss: 0.8596, test_loss: 0.9732, test_f1: 0.5487
 epoch: 5, train_loss: 0.8458, test_loss: 1.0967, test_f1: 0.4687
 epoch: 6, train_loss: 0.8188, test_loss: 1.0623, test_f1: 0.5371
 epoch: 7, train_loss: 0.8577, test_loss: 1.0447, test_f1: 0.4785
 epoch: 8, train_loss: 0.8175, test_loss: 1.2128, test_f1: 0.5638
 epoch: 9, train_loss: 0.8176, test_loss: 1.0096, test_f1: 0.5767
 epoch: 10, train_loss: 0.7811, test_loss: 1.8885, test_f1: 0.4067
 epoch: 11, train_loss: 0.8134, test_loss: 1.1398, test_f1: 0.5397
 epoch: 12, train_loss: 0.8053, test_loss: 1.2956, test_f1: 0.5318
 epoch: 13, train_loss: 0.7758, test_loss: 1.1656, test_f1: 0.4828
 epoch: 14, train_loss: 0.7478, test_loss: 1.1715, test_f1: 0.4701
 epoch: 15, train_loss: 0.7645, test_loss: 1.1387, test_f1: 0.5501
 epoch: 16, train_loss: 0.7544, test_loss: 1.8271, test_f1: 0.5356
 epoch: 17, train_loss: 0.7319, test_loss: 1.1472, test_f1: 0.5725
 epoch: 18, train_loss: 0.7321, test_loss: 2.0587, test_f1: 0.4988
 epoch: 19, train_loss: 0.7200, test_loss: 1.2808, test_f1: 0.5033
 epoch: 20, train_loss: 0.7365, test_loss: 1.3180, test_f1: 0.5678
 epoch: 21, train_loss: 0.7453, test_loss: 1.4053, test_f1: 0.5214
 epoch: 22, train_loss: 0.7366, test_loss: 1.5173, test_f1: 0.4742
 epoch: 23, train_loss: 0.7902, test_loss: 1.5540, test_f1: 0.4451
 epoch: 24, train_loss: 0.7520, test_loss: 1.1750, test_f1: 0.5492
 epoch: 25, train_loss: 0.7340, test_loss: 1.1533, test_f1: 0.5818
 epoch: 26, train_loss: 0.7284, test_loss: 1.2090, test_f1: 0.5616
 epoch: 27, train_loss: 0.7229, test_loss: 1.2367, test_f1: 0.5344
 epoch: 28, train_loss: 0.6852, test_loss: 1.2283, test_f1: 0.5753
 epoch: 29, train_loss: 0.6742, test_loss: 1.1694, test_f1: 0.5303
 epoch: 30, train_loss: 0.6965, test_loss: 1.2610, test_f1: 0.5522
 epoch: 31, train_loss: 0.7085, test_loss: 1.8267, test_f1: 0.4955
 epoch: 32, train_loss: 0.7010, test_loss: 1.7616, test_f1: 0.5237
 epoch: 33, train_loss: 0.7111, test_loss: 1.1498, test_f1: 0.6034
 epoch: 34, train_loss: 0.6712, test_loss: 1.2181, test_f1: 0.5187
 epoch: 35, train_loss: 0.7116, test_loss: 1.4311, test_f1: 0.5877
 epoch: 36, train_loss: 0.6786, test_loss: 1.8428, test_f1: 0.4901
 epoch: 37, train_loss: 0.6866, test_loss: 1.3029, test_f1: 0.5336
 epoch: 38, train_loss: 0.6964, test_loss: 1.3735, test_f1: 0.5693
 epoch: 39, train_loss: 0.6441, test_loss: 1.2124, test_f1: 0.5708
 epoch: 40, train_loss: 0.6446, test_loss: 1.2858, test_f1: 0.5996
 epoch: 41, train_loss: 0.6502, test_loss: 1.2234, test_f1: 0.6024
 epoch: 42, train_loss: 0.6475, test_loss: 1.4512, test_f1: 0.6114
 epoch: 43, train_loss: 0.6604, test_loss: 1.2004, test_f1: 0.5665
 epoch: 44, train_loss: 0.6377, test_loss: 1.2627, test_f1: 0.5821
 epoch: 45, train_loss: 0.6262, test_loss: 1.3693, test_f1: 0.6036
 epoch: 46, train_loss: 0.6462, test_loss: 1.2594, test_f1: 0.5749
 epoch: 47, train_loss: 0.6561, test_loss: 1.2347, test_f1: 0.6034
 epoch: 48, train_loss: 0.6398, test_loss: 1.3324, test_f1: 0.6116
 epoch: 49, train_loss: 0.6596, test_loss: 1.2717, test_f1: 0.5972
 epoch: 50, train_loss: 0.6334, test_loss: 1.1653, test_f1: 0.5468
 epoch: 51, train_loss: 0.6401, test_loss: 1.2864, test_f1: 0.6151
 epoch: 52, train_loss: 0.5892, test_loss: 1.2140, test_f1: 0.5977
 epoch: 53, train_loss: 0.5881, test_loss: 1.3131, test_f1: 0.5882
 epoch: 54, train_loss: 0.5574, test_loss: 1.3342, test_f1: 0.5761
 epoch: 55, train_loss: 0.5641, test_loss: 1.2889, test_f1: 0.5925
 epoch: 56, train_loss: 0.5508, test_loss: 1.7150, test_f1: 0.5288
 epoch: 57, train_loss: 0.5624, test_loss: 1.7407, test_f1: 0.5288
 epoch: 58, train_loss: 0.5401, test_loss: 1.6193, test_f1: 0.5839
 epoch: 59, train_loss: 0.5556, test_loss: 1.7308, test_f1: 0.5444
 epoch: 60, train_loss: 0.5528, test_loss: 1.7610, test_f1: 0.5533
 epoch: 61, train_loss: 0.5454, test_loss: 1.4852, test_f1: 0.5730
 epoch: 62, train_loss: 0.5795, test_loss: 1.4236, test_f1: 0.6236
 epoch: 63, train_loss: 0.5552, test_loss: 1.6672, test_f1: 0.6100
 epoch: 64, train_loss: 0.5336, test_loss: 1.5642, test_f1: 0.5968
 epoch: 65, train_loss: 0.5353, test_loss: 1.7493, test_f1: 0.5506
 epoch: 66, train_loss: 0.5233, test_loss: 1.5469, test_f1: 0.5797
 epoch: 67, train_loss: 0.5390, test_loss: 1.5250, test_f1: 0.6049
 epoch: 68, train_loss: 0.5303, test_loss: 1.6087, test_f1: 0.5828
 epoch: 69, train_loss: 0.5385, test_loss: 1.8298, test_f1: 0.5695
 epoch: 70, train_loss: 0.5030, test_loss: 2.5057, test_f1: 0.5312
 epoch: 71, train_loss: 0.5522, test_loss: 1.4572, test_f1: 0.6016
 epoch: 72, train_loss: 0.5490, test_loss: 1.3412, test_f1: 0.6101
 epoch: 73, train_loss: 0.5523, test_loss: 1.7815, test_f1: 0.5657
 epoch: 74, train_loss: 0.5142, test_loss: 1.6037, test_f1: 0.5797
 epoch: 75, train_loss: 0.4968, test_loss: 1.6375, test_f1: 0.5741
 epoch: 76, train_loss: 0.5267, test_loss: 1.4986, test_f1: 0.6066
 epoch: 77, train_loss: 0.5210, test_loss: 1.5684, test_f1: 0.5864
 epoch: 78, train_loss: 0.4897, test_loss: 1.4619, test_f1: 0.5957
 epoch: 79, train_loss: 0.5208, test_loss: 1.5166, test_f1: 0.5864
 epoch: 80, train_loss: 0.4975, test_loss: 1.5443, test_f1: 0.5826
 epoch: 81, train_loss: 0.5146, test_loss: 2.0460, test_f1: 0.5118
 epoch: 82, train_loss: 0.4966, test_loss: 1.6407, test_f1: 0.5662
 epoch: 83, train_loss: 0.4882, test_loss: 1.7144, test_f1: 0.5980
 epoch: 84, train_loss: 0.4574, test_loss: 2.0577, test_f1: 0.6213
 epoch: 85, train_loss: 0.5100, test_loss: 2.0091, test_f1: 0.5929
 epoch: 86, train_loss: 0.5103, test_loss: 1.6096, test_f1: 0.6641
 epoch: 87, train_loss: 0.4818, test_loss: 1.7146, test_f1: 0.6039
 epoch: 88, train_loss: 0.4543, test_loss: 1.8065, test_f1: 0.5610
 epoch: 89, train_loss: 0.4820, test_loss: 2.0714, test_f1: 0.5596
 epoch: 90, train_loss: 0.4731, test_loss: 1.5009, test_f1: 0.6234
 epoch: 91, train_loss: 0.4546, test_loss: 1.8524, test_f1: 0.6223
 epoch: 92, train_loss: 0.4680, test_loss: 1.6867, test_f1: 0.6259
 epoch: 93, train_loss: 0.4466, test_loss: 1.9592, test_f1: 0.6155
 epoch: 94, train_loss: 0.4286, test_loss: 1.7330, test_f1: 0.6454
 epoch: 95, train_loss: 0.4471, test_loss: 1.7958, test_f1: 0.5704
 epoch: 96, train_loss: 0.4220, test_loss: 2.2826, test_f1: 0.5219
 epoch: 97, train_loss: 0.4409, test_loss: 1.7084, test_f1: 0.6019
 epoch: 98, train_loss: 0.4190, test_loss: 1.9319, test_f1: 0.5809
 epoch: 99, train_loss: 0.4310, test_loss: 2.0454, test_f1: 0.5924
##################ITERATION #9 ****************************************
 epoch: 0, train_loss: 1.2623, test_loss: 1.5522, test_f1: 0.1414
 epoch: 1, train_loss: 1.0021, test_loss: 1.5282, test_f1: 0.2354
 epoch: 2, train_loss: 0.9370, test_loss: 1.3828, test_f1: 0.4120
 epoch: 3, train_loss: 0.9078, test_loss: 1.1805, test_f1: 0.5406
 epoch: 4, train_loss: 0.8535, test_loss: 0.9830, test_f1: 0.6019
 epoch: 5, train_loss: 0.8207, test_loss: 1.0624, test_f1: 0.5660
 epoch: 6, train_loss: 0.8509, test_loss: 1.0130, test_f1: 0.5656
 epoch: 7, train_loss: 0.8220, test_loss: 1.0395, test_f1: 0.5439
 epoch: 8, train_loss: 0.7959, test_loss: 1.0451, test_f1: 0.5476
 epoch: 9, train_loss: 0.7904, test_loss: 0.9282, test_f1: 0.6360
 epoch: 10, train_loss: 0.7524, test_loss: 1.0659, test_f1: 0.5955
 epoch: 11, train_loss: 0.7438, test_loss: 1.2952, test_f1: 0.5866
 epoch: 12, train_loss: 0.7499, test_loss: 1.1434, test_f1: 0.5714
 epoch: 13, train_loss: 0.7752, test_loss: 0.9396, test_f1: 0.6278
 epoch: 14, train_loss: 0.7791, test_loss: 1.1908, test_f1: 0.6481
 epoch: 15, train_loss: 0.7293, test_loss: 1.1132, test_f1: 0.5914
 epoch: 16, train_loss: 0.7189, test_loss: 1.0727, test_f1: 0.6315
 epoch: 17, train_loss: 0.7357, test_loss: 0.9610, test_f1: 0.6106
 epoch: 18, train_loss: 0.7162, test_loss: 1.2758, test_f1: 0.6158
 epoch: 19, train_loss: 0.6799, test_loss: 1.0581, test_f1: 0.6039
 epoch: 20, train_loss: 0.7186, test_loss: 1.1968, test_f1: 0.5734
 epoch: 21, train_loss: 0.7099, test_loss: 1.2709, test_f1: 0.5973
 epoch: 22, train_loss: 0.7099, test_loss: 1.2159, test_f1: 0.5166
 epoch: 23, train_loss: 0.7064, test_loss: 1.4919, test_f1: 0.4868
 epoch: 24, train_loss: 0.7155, test_loss: 1.2445, test_f1: 0.5710
 epoch: 25, train_loss: 0.7092, test_loss: 1.2225, test_f1: 0.4991
 epoch: 26, train_loss: 0.6796, test_loss: 1.3138, test_f1: 0.5953
 epoch: 27, train_loss: 0.6933, test_loss: 1.3205, test_f1: 0.5809
 epoch: 28, train_loss: 0.6810, test_loss: 1.0802, test_f1: 0.6505
 epoch: 29, train_loss: 0.6688, test_loss: 1.2380, test_f1: 0.5808
 epoch: 30, train_loss: 0.6144, test_loss: 1.3049, test_f1: 0.5322
 epoch: 31, train_loss: 0.6079, test_loss: 1.4810, test_f1: 0.6331
 epoch: 32, train_loss: 0.6903, test_loss: 1.5220, test_f1: 0.5681
 epoch: 33, train_loss: 0.6606, test_loss: 1.6413, test_f1: 0.5381
 epoch: 34, train_loss: 0.6370, test_loss: 1.2071, test_f1: 0.5972
 epoch: 35, train_loss: 0.5973, test_loss: 1.2027, test_f1: 0.5918
 epoch: 36, train_loss: 0.5858, test_loss: 1.1336, test_f1: 0.6289
 epoch: 37, train_loss: 0.6241, test_loss: 1.3877, test_f1: 0.5582
 epoch: 38, train_loss: 0.6337, test_loss: 1.4387, test_f1: 0.5541
 epoch: 39, train_loss: 0.6675, test_loss: 1.5075, test_f1: 0.5784
 epoch: 40, train_loss: 0.6812, test_loss: 1.5619, test_f1: 0.4751
 epoch: 41, train_loss: 0.6611, test_loss: 1.3709, test_f1: 0.5859
 epoch: 42, train_loss: 0.6006, test_loss: 1.2218, test_f1: 0.6447
 epoch: 43, train_loss: 0.5774, test_loss: 1.3347, test_f1: 0.6184
 epoch: 44, train_loss: 0.6105, test_loss: 1.2315, test_f1: 0.5631
 epoch: 45, train_loss: 0.5949, test_loss: 1.2391, test_f1: 0.5921
 epoch: 46, train_loss: 0.5981, test_loss: 1.3805, test_f1: 0.6092
 epoch: 47, train_loss: 0.5623, test_loss: 1.6076, test_f1: 0.6094
 epoch: 48, train_loss: 0.5822, test_loss: 1.4900, test_f1: 0.6085
 epoch: 49, train_loss: 0.5891, test_loss: 1.7801, test_f1: 0.5874
 epoch: 50, train_loss: 0.5947, test_loss: 1.7584, test_f1: 0.6152
 epoch: 51, train_loss: 0.5606, test_loss: 1.5380, test_f1: 0.6630
 epoch: 52, train_loss: 0.5248, test_loss: 1.6005, test_f1: 0.6160
 epoch: 53, train_loss: 0.5139, test_loss: 1.6966, test_f1: 0.6402
 epoch: 54, train_loss: 0.5041, test_loss: 1.7822, test_f1: 0.5490
 epoch: 55, train_loss: 0.5018, test_loss: 1.4530, test_f1: 0.5975
 epoch: 56, train_loss: 0.5146, test_loss: 1.7083, test_f1: 0.5908
 epoch: 57, train_loss: 0.4596, test_loss: 1.7146, test_f1: 0.6075
 epoch: 58, train_loss: 0.4697, test_loss: 2.1700, test_f1: 0.5303
 epoch: 59, train_loss: 0.4792, test_loss: 1.7470, test_f1: 0.6146
 epoch: 60, train_loss: 0.4703, test_loss: 1.7839, test_f1: 0.5794
 epoch: 61, train_loss: 0.4588, test_loss: 1.6345, test_f1: 0.6284
 epoch: 62, train_loss: 0.4544, test_loss: 1.7018, test_f1: 0.5839
 epoch: 63, train_loss: 0.5180, test_loss: 1.4584, test_f1: 0.5198
 epoch: 64, train_loss: 0.5231, test_loss: 1.8029, test_f1: 0.5892
 epoch: 65, train_loss: 0.4962, test_loss: 1.8028, test_f1: 0.5558
 epoch: 66, train_loss: 0.5069, test_loss: 1.6134, test_f1: 0.5518
 epoch: 67, train_loss: 0.5286, test_loss: 1.6816, test_f1: 0.6017
 epoch: 68, train_loss: 0.4653, test_loss: 1.7971, test_f1: 0.5496
 epoch: 69, train_loss: 0.4722, test_loss: 1.9537, test_f1: 0.5721
 epoch: 70, train_loss: 0.4839, test_loss: 1.6509, test_f1: 0.5594
 epoch: 71, train_loss: 0.4391, test_loss: 1.8444, test_f1: 0.5731
 epoch: 72, train_loss: 0.4482, test_loss: 1.8190, test_f1: 0.6114
 epoch: 73, train_loss: 0.4527, test_loss: 2.0812, test_f1: 0.5415
 epoch: 74, train_loss: 0.4578, test_loss: 1.8353, test_f1: 0.5922
 epoch: 75, train_loss: 0.4730, test_loss: 2.1409, test_f1: 0.5659
 epoch: 76, train_loss: 0.4280, test_loss: 2.2441, test_f1: 0.5756
 epoch: 77, train_loss: 0.4299, test_loss: 1.9294, test_f1: 0.5767
 epoch: 78, train_loss: 0.4368, test_loss: 1.6740, test_f1: 0.5909
 epoch: 79, train_loss: 0.4311, test_loss: 2.1412, test_f1: 0.5407
 epoch: 80, train_loss: 0.4303, test_loss: 2.0557, test_f1: 0.6006
 epoch: 81, train_loss: 0.4309, test_loss: 1.8625, test_f1: 0.5290
 epoch: 82, train_loss: 0.4616, test_loss: 1.9244, test_f1: 0.5834
 epoch: 83, train_loss: 0.4276, test_loss: 1.8940, test_f1: 0.5368
 epoch: 84, train_loss: 0.4172, test_loss: 2.2747, test_f1: 0.5359
 epoch: 85, train_loss: 0.3856, test_loss: 2.2212, test_f1: 0.5388
 epoch: 86, train_loss: 0.3851, test_loss: 1.7813, test_f1: 0.5439
 epoch: 87, train_loss: 0.3986, test_loss: 1.8928, test_f1: 0.5339
 epoch: 88, train_loss: 0.3675, test_loss: 1.9646, test_f1: 0.5764
 epoch: 89, train_loss: 0.4261, test_loss: 1.8777, test_f1: 0.5755
 epoch: 90, train_loss: 0.4463, test_loss: 2.1697, test_f1: 0.5776
 epoch: 91, train_loss: 0.4459, test_loss: 1.5316, test_f1: 0.6007
 epoch: 92, train_loss: 0.4395, test_loss: 1.9030, test_f1: 0.5642
 epoch: 93, train_loss: 0.4050, test_loss: 1.8560, test_f1: 0.6108
 epoch: 94, train_loss: 0.3945, test_loss: 1.8290, test_f1: 0.5559
 epoch: 95, train_loss: 0.3959, test_loss: 1.8574, test_f1: 0.5921
 epoch: 96, train_loss: 0.3914, test_loss: 2.2571, test_f1: 0.5868
 epoch: 97, train_loss: 0.3963, test_loss: 1.9630, test_f1: 0.5644
 epoch: 98, train_loss: 0.3738, test_loss: 1.9562, test_f1: 0.5745
 epoch: 99, train_loss: 0.4103, test_loss: 1.8782, test_f1: 0.5626

Training completed in 338.96 seconds
Best F1: 0.7106 at epoch 86
Mean F1 across iterations: 0.6748  0.0172
========================FINAL RESULTS================================
FEGIN weighted F1: 0.7106  0.0172
python main.py --data ltspice_demos --representation component_pin --model FEGIN --layers 3 --hiddens 32 --batch_size 128 --lr 0.01 --emb_size 128 --epochs 100 --save_appendix component_pin_L3_H32_BS128_LR0.01_E128 --no_val
-----



STDERR:
  File "main.py", line 370, in <module>
    main()
  File "main.py", line 254, in main
    dataset = dataset_class(
  File "/home/philip/projects/ltspice_examples_code_repo/Circuit-Completion-Using-GNNs/component_classification_with_link_prediction_head/evaluation/FEGIN/kernel/circuit_datasets.py", line 15, in __init__
    self.data, self.slices = torch.load(self.processed_paths[0])
  File "/home/philip/.local/lib/python3.8/site-packages/torch/serialization.py", line 1040, in load
    warnings.warn(
  File "/usr/lib/python3.8/warnings.py", line 109, in _showwarnmsg
    sw(msg.message, msg.category, msg.filename, msg.lineno,
  File "main.py", line 47, in warn_with_traceback
    traceback.print_stack(file=log)
/home/philip/projects/ltspice_examples_code_repo/Circuit-Completion-Using-GNNs/component_classification_with_link_prediction_head/evaluation/FEGIN/kernel/circuit_datasets.py:15: FutureWarning: You are using `torch.load` with `weights_only=False` (the current default value), which uses the default pickle module implicitly. It is possible to construct malicious pickle data which will execute arbitrary code during unpickling (See https://github.com/pytorch/pytorch/blob/main/SECURITY.md#untrusted-models for more details). In a future release, the default value for `weights_only` will be flipped to `True`. This limits the functions that could be executed during unpickling. Arbitrary objects will no longer be allowed to be loaded via this mode unless they are explicitly allowlisted by the user via `torch.serialization.add_safe_globals`. We recommend you start setting `weights_only=True` for any use case where you don't have full control of the loaded file. Please open an issue on GitHub for any issues related to this experimental feature.
  self.data, self.slices = torch.load(self.processed_paths[0])
