STDOUT:
Results will be saved in /home/philip/projects/ltspice_examples_code_repo/Circuit-Completion-Using-GNNs/component_classification_with_link_prediction_head/evaluation/FEGIN/results/model_FEGIN_dataset_ltspice_examples
Command line input: python main.py --data ltspice_examples --representation component_pin_net --model FEGIN --layers 6 --hiddens 16 --batch_size 32 --lr 0.0001 --emb_size 250 --epochs 100 --save_appendix component_pin_net_L6_H16_BS32_LR0.0001_E250 --no_val
 is saved.
-----
ltspice_examples - FEGIN
Using 6 layers, 16 hidden units, h = 2
Loading component_pin_net representation dataset
ENTERED
Training FEGIN on component_pin_net representation
Train: 3558, Test: 846
##################ITERATION #0 ****************************************
 epoch: 0, train_loss: 1.4580, test_loss: 1.4368, test_f1: 0.0793
 epoch: 1, train_loss: 1.4421, test_loss: 1.4285, test_f1: 0.0793
 epoch: 2, train_loss: 1.4331, test_loss: 1.4193, test_f1: 0.0794
 epoch: 3, train_loss: 1.4233, test_loss: 1.4087, test_f1: 0.1457
 epoch: 4, train_loss: 1.4119, test_loss: 1.3963, test_f1: 0.2019
 epoch: 5, train_loss: 1.3972, test_loss: 1.3826, test_f1: 0.1991
 epoch: 6, train_loss: 1.3783, test_loss: 1.3603, test_f1: 0.3118
 epoch: 7, train_loss: 1.3542, test_loss: 1.3280, test_f1: 0.3410
 epoch: 8, train_loss: 1.3220, test_loss: 1.3064, test_f1: 0.3202
 epoch: 9, train_loss: 1.3023, test_loss: 1.2808, test_f1: 0.2949
 epoch: 10, train_loss: 1.2854, test_loss: 1.2635, test_f1: 0.2953
 epoch: 11, train_loss: 1.2715, test_loss: 1.2493, test_f1: 0.2854
 epoch: 12, train_loss: 1.2609, test_loss: 1.2299, test_f1: 0.3028
 epoch: 13, train_loss: 1.2464, test_loss: 1.2162, test_f1: 0.3390
 epoch: 14, train_loss: 1.2375, test_loss: 1.2008, test_f1: 0.3554
 epoch: 15, train_loss: 1.2240, test_loss: 1.1903, test_f1: 0.3649
 epoch: 16, train_loss: 1.2101, test_loss: 1.1712, test_f1: 0.3847
 epoch: 17, train_loss: 1.2051, test_loss: 1.1581, test_f1: 0.3718
 epoch: 18, train_loss: 1.1862, test_loss: 1.1469, test_f1: 0.3689
 epoch: 19, train_loss: 1.1728, test_loss: 1.1340, test_f1: 0.3599
 epoch: 20, train_loss: 1.1634, test_loss: 1.1209, test_f1: 0.3752
 epoch: 21, train_loss: 1.1510, test_loss: 1.1187, test_f1: 0.3445
 epoch: 22, train_loss: 1.1493, test_loss: 1.1016, test_f1: 0.3614
 epoch: 23, train_loss: 1.1257, test_loss: 1.0943, test_f1: 0.3596
 epoch: 24, train_loss: 1.1239, test_loss: 1.0857, test_f1: 0.3762
 epoch: 25, train_loss: 1.1215, test_loss: 1.0816, test_f1: 0.3577
 epoch: 26, train_loss: 1.1069, test_loss: 1.0785, test_f1: 0.3632
 epoch: 27, train_loss: 1.1010, test_loss: 1.0799, test_f1: 0.3580
 epoch: 28, train_loss: 1.0890, test_loss: 1.0784, test_f1: 0.3416
 epoch: 29, train_loss: 1.0912, test_loss: 1.0756, test_f1: 0.3412
 epoch: 30, train_loss: 1.0853, test_loss: 1.0714, test_f1: 0.3421
 epoch: 31, train_loss: 1.0927, test_loss: 1.0658, test_f1: 0.3644
 epoch: 32, train_loss: 1.0831, test_loss: 1.0703, test_f1: 0.3412
 epoch: 33, train_loss: 1.0767, test_loss: 1.0719, test_f1: 0.3438
 epoch: 34, train_loss: 1.0768, test_loss: 1.0778, test_f1: 0.3425
 epoch: 35, train_loss: 1.0791, test_loss: 1.0669, test_f1: 0.3433
 epoch: 36, train_loss: 1.0779, test_loss: 1.0659, test_f1: 0.3433
 epoch: 37, train_loss: 1.0681, test_loss: 1.0638, test_f1: 0.3417
 epoch: 38, train_loss: 1.0688, test_loss: 1.0669, test_f1: 0.3448
 epoch: 39, train_loss: 1.0534, test_loss: 1.0639, test_f1: 0.3442
 epoch: 40, train_loss: 1.0632, test_loss: 1.0711, test_f1: 0.3430
 epoch: 41, train_loss: 1.0521, test_loss: 1.0710, test_f1: 0.3338
 epoch: 42, train_loss: 1.0583, test_loss: 1.0602, test_f1: 0.3438
 epoch: 43, train_loss: 1.0573, test_loss: 1.0486, test_f1: 0.3436
 epoch: 44, train_loss: 1.0515, test_loss: 1.0565, test_f1: 0.3427
 epoch: 45, train_loss: 1.0516, test_loss: 1.0466, test_f1: 0.3452
 epoch: 46, train_loss: 1.0473, test_loss: 1.0629, test_f1: 0.3333
 epoch: 47, train_loss: 1.0496, test_loss: 1.0516, test_f1: 0.3438
 epoch: 48, train_loss: 1.0450, test_loss: 1.0575, test_f1: 0.3452
 epoch: 49, train_loss: 1.0483, test_loss: 1.0439, test_f1: 0.3466
 epoch: 50, train_loss: 1.0362, test_loss: 1.0488, test_f1: 0.3465
 epoch: 51, train_loss: 1.0336, test_loss: 1.0324, test_f1: 0.3455
 epoch: 52, train_loss: 1.0367, test_loss: 1.0484, test_f1: 0.3463
 epoch: 53, train_loss: 1.0420, test_loss: 1.0469, test_f1: 0.3464
 epoch: 54, train_loss: 1.0332, test_loss: 1.0457, test_f1: 0.3472
 epoch: 55, train_loss: 1.0336, test_loss: 1.0528, test_f1: 0.3471
 epoch: 56, train_loss: 1.0309, test_loss: 1.0326, test_f1: 0.3464
 epoch: 57, train_loss: 1.0346, test_loss: 1.0488, test_f1: 0.3451
 epoch: 58, train_loss: 1.0374, test_loss: 1.0423, test_f1: 0.3456
 epoch: 59, train_loss: 1.0346, test_loss: 1.0424, test_f1: 0.3501
 epoch: 60, train_loss: 1.0329, test_loss: 1.0499, test_f1: 0.3614
 epoch: 61, train_loss: 1.0364, test_loss: 1.0338, test_f1: 0.3583
 epoch: 62, train_loss: 1.0359, test_loss: 1.0369, test_f1: 0.3514
 epoch: 63, train_loss: 1.0336, test_loss: 1.0249, test_f1: 0.3481
 epoch: 64, train_loss: 1.0273, test_loss: 1.0331, test_f1: 0.3593
 epoch: 65, train_loss: 1.0178, test_loss: 1.0345, test_f1: 0.3762
 epoch: 66, train_loss: 1.0266, test_loss: 1.0418, test_f1: 0.3575
 epoch: 67, train_loss: 1.0306, test_loss: 1.0346, test_f1: 0.3654
 epoch: 68, train_loss: 1.0248, test_loss: 1.0315, test_f1: 0.3759
 epoch: 69, train_loss: 1.0268, test_loss: 1.0304, test_f1: 0.3727
 epoch: 70, train_loss: 1.0309, test_loss: 1.0265, test_f1: 0.3651
 epoch: 71, train_loss: 1.0188, test_loss: 1.0189, test_f1: 0.3738
 epoch: 72, train_loss: 1.0244, test_loss: 1.0036, test_f1: 0.3889
 epoch: 73, train_loss: 1.0243, test_loss: 1.0144, test_f1: 0.3793
 epoch: 74, train_loss: 1.0198, test_loss: 1.0246, test_f1: 0.3678
 epoch: 75, train_loss: 1.0237, test_loss: 1.0226, test_f1: 0.3898
 epoch: 76, train_loss: 1.0227, test_loss: 1.0244, test_f1: 0.3898
 epoch: 77, train_loss: 1.0180, test_loss: 1.0163, test_f1: 0.3824
 epoch: 78, train_loss: 1.0170, test_loss: 1.0316, test_f1: 0.4102
 epoch: 79, train_loss: 1.0188, test_loss: 1.0472, test_f1: 0.4141
 epoch: 80, train_loss: 1.0173, test_loss: 1.0459, test_f1: 0.3936
 epoch: 81, train_loss: 1.0171, test_loss: 1.0149, test_f1: 0.3979
 epoch: 82, train_loss: 1.0178, test_loss: 1.0301, test_f1: 0.3920
 epoch: 83, train_loss: 1.0179, test_loss: 1.0300, test_f1: 0.3774
 epoch: 84, train_loss: 1.0137, test_loss: 1.0268, test_f1: 0.4125
 epoch: 85, train_loss: 1.0170, test_loss: 1.0106, test_f1: 0.4126
 epoch: 86, train_loss: 1.0117, test_loss: 1.0183, test_f1: 0.3992
 epoch: 87, train_loss: 1.0167, test_loss: 1.0215, test_f1: 0.4162
 epoch: 88, train_loss: 1.0032, test_loss: 1.0156, test_f1: 0.3909
 epoch: 89, train_loss: 1.0082, test_loss: 1.0237, test_f1: 0.4248
 epoch: 90, train_loss: 1.0164, test_loss: 1.0117, test_f1: 0.4188
 epoch: 91, train_loss: 1.0117, test_loss: 1.0346, test_f1: 0.4126
 epoch: 92, train_loss: 1.0084, test_loss: 1.0445, test_f1: 0.4096
 epoch: 93, train_loss: 1.0011, test_loss: 1.0216, test_f1: 0.4227
 epoch: 94, train_loss: 1.0120, test_loss: 1.0275, test_f1: 0.4240
 epoch: 95, train_loss: 1.0063, test_loss: 1.0149, test_f1: 0.4305
 epoch: 96, train_loss: 1.0092, test_loss: 1.0004, test_f1: 0.4299
 epoch: 97, train_loss: 1.0029, test_loss: 1.0076, test_f1: 0.4103
 epoch: 98, train_loss: 1.0103, test_loss: 1.0236, test_f1: 0.4257
 epoch: 99, train_loss: 1.0056, test_loss: 1.0147, test_f1: 0.4273
##################ITERATION #1 ****************************************
 epoch: 0, train_loss: 1.3631, test_loss: 1.3525, test_f1: 0.2397
 epoch: 1, train_loss: 1.3459, test_loss: 1.3379, test_f1: 0.2418
 epoch: 2, train_loss: 1.3287, test_loss: 1.3177, test_f1: 0.2270
 epoch: 3, train_loss: 1.3046, test_loss: 1.2877, test_f1: 0.2270
 epoch: 4, train_loss: 1.2787, test_loss: 1.2497, test_f1: 0.2295
 epoch: 5, train_loss: 1.2534, test_loss: 1.2166, test_f1: 0.3435
 epoch: 6, train_loss: 1.2217, test_loss: 1.1859, test_f1: 0.3441
 epoch: 7, train_loss: 1.1932, test_loss: 1.1522, test_f1: 0.3460
 epoch: 8, train_loss: 1.1770, test_loss: 1.1342, test_f1: 0.3429
 epoch: 9, train_loss: 1.1564, test_loss: 1.1148, test_f1: 0.3428
 epoch: 10, train_loss: 1.1452, test_loss: 1.1092, test_f1: 0.3407
 epoch: 11, train_loss: 1.1175, test_loss: 1.0931, test_f1: 0.3441
 epoch: 12, train_loss: 1.1179, test_loss: 1.0886, test_f1: 0.3414
 epoch: 13, train_loss: 1.1069, test_loss: 1.0827, test_f1: 0.3419
 epoch: 14, train_loss: 1.0947, test_loss: 1.0783, test_f1: 0.3386
 epoch: 15, train_loss: 1.0910, test_loss: 1.0760, test_f1: 0.3407
 epoch: 16, train_loss: 1.0910, test_loss: 1.0696, test_f1: 0.3440
 epoch: 17, train_loss: 1.0797, test_loss: 1.0669, test_f1: 0.3430
 epoch: 18, train_loss: 1.0729, test_loss: 1.0645, test_f1: 0.3430
 epoch: 19, train_loss: 1.0742, test_loss: 1.0499, test_f1: 0.3440
 epoch: 20, train_loss: 1.0680, test_loss: 1.0407, test_f1: 0.3406
 epoch: 21, train_loss: 1.0577, test_loss: 1.0495, test_f1: 0.3460
 epoch: 22, train_loss: 1.0586, test_loss: 1.0417, test_f1: 0.3440
 epoch: 23, train_loss: 1.0479, test_loss: 1.0401, test_f1: 0.3510
 epoch: 24, train_loss: 1.0500, test_loss: 1.0204, test_f1: 0.3822
 epoch: 25, train_loss: 1.0523, test_loss: 1.0327, test_f1: 0.3958
 epoch: 26, train_loss: 1.0359, test_loss: 1.0213, test_f1: 0.4002
 epoch: 27, train_loss: 1.0311, test_loss: 1.0022, test_f1: 0.4080
 epoch: 28, train_loss: 1.0298, test_loss: 1.0115, test_f1: 0.4109
 epoch: 29, train_loss: 1.0302, test_loss: 1.0262, test_f1: 0.4363
 epoch: 30, train_loss: 1.0298, test_loss: 1.0056, test_f1: 0.4549
 epoch: 31, train_loss: 1.0239, test_loss: 1.0001, test_f1: 0.4246
 epoch: 32, train_loss: 1.0228, test_loss: 0.9941, test_f1: 0.4447
 epoch: 33, train_loss: 1.0243, test_loss: 0.9914, test_f1: 0.4642
 epoch: 34, train_loss: 1.0110, test_loss: 0.9990, test_f1: 0.4726
 epoch: 35, train_loss: 1.0137, test_loss: 1.0000, test_f1: 0.4578
 epoch: 36, train_loss: 1.0172, test_loss: 0.9839, test_f1: 0.4731
 epoch: 37, train_loss: 1.0151, test_loss: 0.9830, test_f1: 0.4736
 epoch: 38, train_loss: 1.0000, test_loss: 0.9845, test_f1: 0.4792
 epoch: 39, train_loss: 1.0093, test_loss: 0.9743, test_f1: 0.4740
 epoch: 40, train_loss: 1.0023, test_loss: 0.9591, test_f1: 0.4873
 epoch: 41, train_loss: 0.9945, test_loss: 0.9903, test_f1: 0.4831
 epoch: 42, train_loss: 1.0008, test_loss: 0.9829, test_f1: 0.4735
 epoch: 43, train_loss: 0.9842, test_loss: 0.9900, test_f1: 0.4844
 epoch: 44, train_loss: 0.9940, test_loss: 0.9706, test_f1: 0.4790
 epoch: 45, train_loss: 0.9881, test_loss: 0.9791, test_f1: 0.4730
 epoch: 46, train_loss: 0.9899, test_loss: 0.9942, test_f1: 0.4807
 epoch: 47, train_loss: 0.9890, test_loss: 0.9921, test_f1: 0.4768
 epoch: 48, train_loss: 0.9923, test_loss: 0.9664, test_f1: 0.4966
 epoch: 49, train_loss: 0.9786, test_loss: 0.9697, test_f1: 0.4899
 epoch: 50, train_loss: 0.9833, test_loss: 0.9604, test_f1: 0.4891
 epoch: 51, train_loss: 0.9762, test_loss: 0.9681, test_f1: 0.4928
 epoch: 52, train_loss: 0.9771, test_loss: 0.9832, test_f1: 0.4839
 epoch: 53, train_loss: 0.9803, test_loss: 0.9622, test_f1: 0.4858
 epoch: 54, train_loss: 0.9657, test_loss: 0.9742, test_f1: 0.4827
 epoch: 55, train_loss: 0.9692, test_loss: 0.9684, test_f1: 0.4805
 epoch: 56, train_loss: 0.9729, test_loss: 0.9578, test_f1: 0.4812
 epoch: 57, train_loss: 0.9665, test_loss: 0.9547, test_f1: 0.4907
 epoch: 58, train_loss: 0.9761, test_loss: 0.9798, test_f1: 0.4866
 epoch: 59, train_loss: 0.9720, test_loss: 0.9677, test_f1: 0.4882
 epoch: 60, train_loss: 0.9733, test_loss: 0.9598, test_f1: 0.4882
 epoch: 61, train_loss: 0.9602, test_loss: 0.9605, test_f1: 0.4833
 epoch: 62, train_loss: 0.9661, test_loss: 0.9587, test_f1: 0.4894
 epoch: 63, train_loss: 0.9724, test_loss: 0.9633, test_f1: 0.4805
 epoch: 64, train_loss: 0.9610, test_loss: 0.9671, test_f1: 0.4836
 epoch: 65, train_loss: 0.9610, test_loss: 0.9406, test_f1: 0.4875
 epoch: 66, train_loss: 0.9689, test_loss: 0.9468, test_f1: 0.4875
 epoch: 67, train_loss: 0.9573, test_loss: 0.9585, test_f1: 0.4700
 epoch: 68, train_loss: 0.9590, test_loss: 0.9366, test_f1: 0.4998
 epoch: 69, train_loss: 0.9596, test_loss: 0.9467, test_f1: 0.4982
 epoch: 70, train_loss: 0.9572, test_loss: 0.9606, test_f1: 0.4917
 epoch: 71, train_loss: 0.9634, test_loss: 0.9527, test_f1: 0.4984
 epoch: 72, train_loss: 0.9592, test_loss: 0.9478, test_f1: 0.5221
 epoch: 73, train_loss: 0.9604, test_loss: 0.9500, test_f1: 0.4885
 epoch: 74, train_loss: 0.9550, test_loss: 0.9694, test_f1: 0.4863
 epoch: 75, train_loss: 0.9527, test_loss: 0.9587, test_f1: 0.5072
 epoch: 76, train_loss: 0.9603, test_loss: 0.9479, test_f1: 0.4918
 epoch: 77, train_loss: 0.9444, test_loss: 0.9506, test_f1: 0.4917
 epoch: 78, train_loss: 0.9507, test_loss: 0.9578, test_f1: 0.4979
 epoch: 79, train_loss: 0.9558, test_loss: 0.9542, test_f1: 0.5029
 epoch: 80, train_loss: 0.9529, test_loss: 0.9757, test_f1: 0.4659
 epoch: 81, train_loss: 0.9583, test_loss: 0.9480, test_f1: 0.5055
 epoch: 82, train_loss: 0.9440, test_loss: 0.9589, test_f1: 0.4937
 epoch: 83, train_loss: 0.9592, test_loss: 0.9573, test_f1: 0.4846
 epoch: 84, train_loss: 0.9564, test_loss: 0.9530, test_f1: 0.4876
 epoch: 85, train_loss: 0.9620, test_loss: 0.9339, test_f1: 0.4922
 epoch: 86, train_loss: 0.9531, test_loss: 0.9503, test_f1: 0.5033
 epoch: 87, train_loss: 0.9645, test_loss: 0.9344, test_f1: 0.4978
 epoch: 88, train_loss: 0.9554, test_loss: 0.9362, test_f1: 0.5139
 epoch: 89, train_loss: 0.9403, test_loss: 0.9453, test_f1: 0.5063
 epoch: 90, train_loss: 0.9568, test_loss: 0.9322, test_f1: 0.4959
 epoch: 91, train_loss: 0.9454, test_loss: 0.9431, test_f1: 0.5075
 epoch: 92, train_loss: 0.9530, test_loss: 0.9493, test_f1: 0.5010
 epoch: 93, train_loss: 0.9498, test_loss: 0.9436, test_f1: 0.5042
 epoch: 94, train_loss: 0.9479, test_loss: 0.9333, test_f1: 0.5041
 epoch: 95, train_loss: 0.9477, test_loss: 0.9535, test_f1: 0.4912
 epoch: 96, train_loss: 0.9444, test_loss: 0.9390, test_f1: 0.4984
 epoch: 97, train_loss: 0.9441, test_loss: 0.9329, test_f1: 0.5081
 epoch: 98, train_loss: 0.9454, test_loss: 0.9256, test_f1: 0.5050
 epoch: 99, train_loss: 0.9450, test_loss: 0.9326, test_f1: 0.5129
##################ITERATION #2 ****************************************
 epoch: 0, train_loss: 1.2960, test_loss: 1.2803, test_f1: 0.2270
 epoch: 1, train_loss: 1.2761, test_loss: 1.2652, test_f1: 0.2270
 epoch: 2, train_loss: 1.2636, test_loss: 1.2534, test_f1: 0.2270
 epoch: 3, train_loss: 1.2518, test_loss: 1.2390, test_f1: 0.2270
 epoch: 4, train_loss: 1.2399, test_loss: 1.2252, test_f1: 0.2270
 epoch: 5, train_loss: 1.2229, test_loss: 1.2062, test_f1: 0.2270
 epoch: 6, train_loss: 1.2093, test_loss: 1.1838, test_f1: 0.2570
 epoch: 7, train_loss: 1.1871, test_loss: 1.1604, test_f1: 0.3287
 epoch: 8, train_loss: 1.1705, test_loss: 1.1361, test_f1: 0.3519
 epoch: 9, train_loss: 1.1514, test_loss: 1.1111, test_f1: 0.3451
 epoch: 10, train_loss: 1.1388, test_loss: 1.0939, test_f1: 0.3441
 epoch: 11, train_loss: 1.1229, test_loss: 1.0825, test_f1: 0.3447
 epoch: 12, train_loss: 1.1114, test_loss: 1.0778, test_f1: 0.3447
 epoch: 13, train_loss: 1.1080, test_loss: 1.0697, test_f1: 0.3387
 epoch: 14, train_loss: 1.0897, test_loss: 1.0563, test_f1: 0.3459
 epoch: 15, train_loss: 1.0793, test_loss: 1.0508, test_f1: 0.3502
 epoch: 16, train_loss: 1.0839, test_loss: 1.0533, test_f1: 0.3465
 epoch: 17, train_loss: 1.0763, test_loss: 1.0475, test_f1: 0.3543
 epoch: 18, train_loss: 1.0625, test_loss: 1.0537, test_f1: 0.3768
 epoch: 19, train_loss: 1.0680, test_loss: 1.0412, test_f1: 0.4059
 epoch: 20, train_loss: 1.0699, test_loss: 1.0419, test_f1: 0.4014
 epoch: 21, train_loss: 1.0576, test_loss: 1.0388, test_f1: 0.4094
 epoch: 22, train_loss: 1.0563, test_loss: 1.0465, test_f1: 0.3989
 epoch: 23, train_loss: 1.0505, test_loss: 1.0538, test_f1: 0.3844
 epoch: 24, train_loss: 1.0432, test_loss: 1.0429, test_f1: 0.4168
 epoch: 25, train_loss: 1.0422, test_loss: 1.0500, test_f1: 0.4151
 epoch: 26, train_loss: 1.0367, test_loss: 1.0442, test_f1: 0.4268
 epoch: 27, train_loss: 1.0350, test_loss: 1.0398, test_f1: 0.4403
 epoch: 28, train_loss: 1.0343, test_loss: 1.0440, test_f1: 0.4312
 epoch: 29, train_loss: 1.0332, test_loss: 1.0365, test_f1: 0.4367
 epoch: 30, train_loss: 1.0348, test_loss: 1.0451, test_f1: 0.4292
 epoch: 31, train_loss: 1.0272, test_loss: 1.0278, test_f1: 0.4429
 epoch: 32, train_loss: 1.0200, test_loss: 1.0295, test_f1: 0.4558
 epoch: 33, train_loss: 1.0192, test_loss: 1.0400, test_f1: 0.4339
 epoch: 34, train_loss: 1.0184, test_loss: 1.0302, test_f1: 0.4545
 epoch: 35, train_loss: 1.0107, test_loss: 1.0318, test_f1: 0.4460
 epoch: 36, train_loss: 1.0119, test_loss: 1.0355, test_f1: 0.4475
 epoch: 37, train_loss: 1.0028, test_loss: 1.0450, test_f1: 0.4474
 epoch: 38, train_loss: 1.0058, test_loss: 1.0549, test_f1: 0.4364
 epoch: 39, train_loss: 0.9956, test_loss: 1.0387, test_f1: 0.4452
 epoch: 40, train_loss: 1.0054, test_loss: 1.0240, test_f1: 0.4666
 epoch: 41, train_loss: 0.9942, test_loss: 1.0467, test_f1: 0.4448
 epoch: 42, train_loss: 0.9914, test_loss: 1.0223, test_f1: 0.4701
 epoch: 43, train_loss: 0.9923, test_loss: 1.0230, test_f1: 0.4694
 epoch: 44, train_loss: 0.9938, test_loss: 1.0345, test_f1: 0.4544
 epoch: 45, train_loss: 0.9910, test_loss: 1.0209, test_f1: 0.4611
 epoch: 46, train_loss: 0.9796, test_loss: 1.0303, test_f1: 0.4544
 epoch: 47, train_loss: 0.9897, test_loss: 1.0148, test_f1: 0.4646
 epoch: 48, train_loss: 0.9767, test_loss: 1.0138, test_f1: 0.4700
 epoch: 49, train_loss: 0.9884, test_loss: 1.0109, test_f1: 0.4693
 epoch: 50, train_loss: 0.9780, test_loss: 1.0214, test_f1: 0.4598
 epoch: 51, train_loss: 0.9858, test_loss: 1.0097, test_f1: 0.4705
 epoch: 52, train_loss: 0.9776, test_loss: 1.0306, test_f1: 0.4530
 epoch: 53, train_loss: 0.9686, test_loss: 1.0172, test_f1: 0.4643
 epoch: 54, train_loss: 0.9781, test_loss: 1.0245, test_f1: 0.4619
 epoch: 55, train_loss: 0.9620, test_loss: 1.0236, test_f1: 0.4708
 epoch: 56, train_loss: 0.9782, test_loss: 1.0339, test_f1: 0.4589
 epoch: 57, train_loss: 0.9771, test_loss: 1.0345, test_f1: 0.4528
 epoch: 58, train_loss: 0.9668, test_loss: 1.0117, test_f1: 0.4763
 epoch: 59, train_loss: 0.9583, test_loss: 1.0412, test_f1: 0.4609
 epoch: 60, train_loss: 0.9699, test_loss: 1.0105, test_f1: 0.4787
 epoch: 61, train_loss: 0.9589, test_loss: 1.0486, test_f1: 0.4544
 epoch: 62, train_loss: 0.9677, test_loss: 1.0150, test_f1: 0.4727
 epoch: 63, train_loss: 0.9666, test_loss: 1.0417, test_f1: 0.4600
 epoch: 64, train_loss: 0.9551, test_loss: 1.0270, test_f1: 0.4664
 epoch: 65, train_loss: 0.9681, test_loss: 1.0590, test_f1: 0.4320
 epoch: 66, train_loss: 0.9753, test_loss: 1.0320, test_f1: 0.4593
 epoch: 67, train_loss: 0.9647, test_loss: 1.0065, test_f1: 0.4837
 epoch: 68, train_loss: 0.9578, test_loss: 0.9922, test_f1: 0.4852
 epoch: 69, train_loss: 0.9651, test_loss: 1.0628, test_f1: 0.4508
 epoch: 70, train_loss: 0.9613, test_loss: 1.0392, test_f1: 0.4629
 epoch: 71, train_loss: 0.9605, test_loss: 1.0163, test_f1: 0.4792
 epoch: 72, train_loss: 0.9603, test_loss: 0.9922, test_f1: 0.4905
 epoch: 73, train_loss: 0.9604, test_loss: 1.0308, test_f1: 0.4755
 epoch: 74, train_loss: 0.9627, test_loss: 1.0138, test_f1: 0.4771
 epoch: 75, train_loss: 0.9542, test_loss: 1.0016, test_f1: 0.4969
 epoch: 76, train_loss: 0.9586, test_loss: 1.0733, test_f1: 0.4576
 epoch: 77, train_loss: 0.9600, test_loss: 0.9977, test_f1: 0.4952
 epoch: 78, train_loss: 0.9517, test_loss: 1.0028, test_f1: 0.4960
 epoch: 79, train_loss: 0.9668, test_loss: 1.0303, test_f1: 0.4766
 epoch: 80, train_loss: 0.9638, test_loss: 1.0262, test_f1: 0.4721
 epoch: 81, train_loss: 0.9591, test_loss: 1.0154, test_f1: 0.4784
 epoch: 82, train_loss: 0.9584, test_loss: 0.9900, test_f1: 0.4916
 epoch: 83, train_loss: 0.9532, test_loss: 0.9869, test_f1: 0.4973
 epoch: 84, train_loss: 0.9529, test_loss: 0.9868, test_f1: 0.4893
 epoch: 85, train_loss: 0.9593, test_loss: 0.9803, test_f1: 0.5096
 epoch: 86, train_loss: 0.9517, test_loss: 0.9976, test_f1: 0.4951
 epoch: 87, train_loss: 0.9614, test_loss: 0.9943, test_f1: 0.4908
 epoch: 88, train_loss: 0.9479, test_loss: 0.9859, test_f1: 0.4913
 epoch: 89, train_loss: 0.9497, test_loss: 0.9936, test_f1: 0.4873
 epoch: 90, train_loss: 0.9464, test_loss: 0.9872, test_f1: 0.5013
 epoch: 91, train_loss: 0.9472, test_loss: 0.9947, test_f1: 0.4925
 epoch: 92, train_loss: 0.9477, test_loss: 1.0019, test_f1: 0.4832
 epoch: 93, train_loss: 0.9499, test_loss: 0.9955, test_f1: 0.5065
 epoch: 94, train_loss: 0.9554, test_loss: 1.0161, test_f1: 0.4776
 epoch: 95, train_loss: 0.9471, test_loss: 1.0365, test_f1: 0.4710
 epoch: 96, train_loss: 0.9481, test_loss: 1.0370, test_f1: 0.4684
 epoch: 97, train_loss: 0.9458, test_loss: 1.0290, test_f1: 0.4759
 epoch: 98, train_loss: 0.9420, test_loss: 1.0051, test_f1: 0.4893
 epoch: 99, train_loss: 0.9549, test_loss: 0.9877, test_f1: 0.4991
##################ITERATION #3 ****************************************
 epoch: 0, train_loss: 1.2901, test_loss: 1.2583, test_f1: 0.2270
 epoch: 1, train_loss: 1.2509, test_loss: 1.2215, test_f1: 0.2887
 epoch: 2, train_loss: 1.2167, test_loss: 1.1887, test_f1: 0.3324
 epoch: 3, train_loss: 1.1905, test_loss: 1.1587, test_f1: 0.3432
 epoch: 4, train_loss: 1.1735, test_loss: 1.1412, test_f1: 0.3411
 epoch: 5, train_loss: 1.1462, test_loss: 1.1256, test_f1: 0.3450
 epoch: 6, train_loss: 1.1338, test_loss: 1.1246, test_f1: 0.3411
 epoch: 7, train_loss: 1.1201, test_loss: 1.1125, test_f1: 0.3460
 epoch: 8, train_loss: 1.1123, test_loss: 1.1060, test_f1: 0.3411
 epoch: 9, train_loss: 1.1046, test_loss: 1.1047, test_f1: 0.3392
 epoch: 10, train_loss: 1.0997, test_loss: 1.0930, test_f1: 0.3421
 epoch: 11, train_loss: 1.0864, test_loss: 1.0870, test_f1: 0.3430
 epoch: 12, train_loss: 1.0789, test_loss: 1.0964, test_f1: 0.3402
 epoch: 13, train_loss: 1.0752, test_loss: 1.0943, test_f1: 0.3382
 epoch: 14, train_loss: 1.0720, test_loss: 1.0874, test_f1: 0.3500
 epoch: 15, train_loss: 1.0680, test_loss: 1.0909, test_f1: 0.3445
 epoch: 16, train_loss: 1.0596, test_loss: 1.0926, test_f1: 0.3432
 epoch: 17, train_loss: 1.0585, test_loss: 1.0784, test_f1: 0.3553
 epoch: 18, train_loss: 1.0594, test_loss: 1.0879, test_f1: 0.3502
 epoch: 19, train_loss: 1.0515, test_loss: 1.0795, test_f1: 0.3519
 epoch: 20, train_loss: 1.0459, test_loss: 1.0704, test_f1: 0.3560
 epoch: 21, train_loss: 1.0496, test_loss: 1.0655, test_f1: 0.3581
 epoch: 22, train_loss: 1.0435, test_loss: 1.0740, test_f1: 0.3537
 epoch: 23, train_loss: 1.0419, test_loss: 1.0653, test_f1: 0.3634
 epoch: 24, train_loss: 1.0383, test_loss: 1.0730, test_f1: 0.3533
 epoch: 25, train_loss: 1.0282, test_loss: 1.0635, test_f1: 0.3747
 epoch: 26, train_loss: 1.0224, test_loss: 1.0657, test_f1: 0.3691
 epoch: 27, train_loss: 1.0212, test_loss: 1.0595, test_f1: 0.3755
 epoch: 28, train_loss: 1.0216, test_loss: 0.9873, test_f1: 0.4002
 epoch: 29, train_loss: 1.0216, test_loss: 1.0120, test_f1: 0.4005
 epoch: 30, train_loss: 1.0155, test_loss: 1.0283, test_f1: 0.4311
 epoch: 31, train_loss: 1.0145, test_loss: 0.9784, test_f1: 0.4193
 epoch: 32, train_loss: 1.0075, test_loss: 1.0508, test_f1: 0.4288
 epoch: 33, train_loss: 1.0025, test_loss: 1.0377, test_f1: 0.4159
 epoch: 34, train_loss: 1.0064, test_loss: 1.0283, test_f1: 0.4190
 epoch: 35, train_loss: 0.9940, test_loss: 1.0047, test_f1: 0.4324
 epoch: 36, train_loss: 1.0015, test_loss: 1.0419, test_f1: 0.4312
 epoch: 37, train_loss: 0.9946, test_loss: 1.0436, test_f1: 0.4462
 epoch: 38, train_loss: 0.9874, test_loss: 1.0336, test_f1: 0.4583
 epoch: 39, train_loss: 0.9917, test_loss: 1.0167, test_f1: 0.4395
 epoch: 40, train_loss: 0.9923, test_loss: 0.9765, test_f1: 0.4610
 epoch: 41, train_loss: 0.9815, test_loss: 1.0203, test_f1: 0.4552
 epoch: 42, train_loss: 0.9810, test_loss: 1.0033, test_f1: 0.4775
 epoch: 43, train_loss: 0.9751, test_loss: 0.9528, test_f1: 0.4929
 epoch: 44, train_loss: 0.9776, test_loss: 0.9482, test_f1: 0.4713
 epoch: 45, train_loss: 0.9762, test_loss: 0.9678, test_f1: 0.4720
 epoch: 46, train_loss: 0.9811, test_loss: 0.9441, test_f1: 0.4721
 epoch: 47, train_loss: 0.9778, test_loss: 0.9369, test_f1: 0.4785
 epoch: 48, train_loss: 0.9706, test_loss: 0.9495, test_f1: 0.4999
 epoch: 49, train_loss: 0.9686, test_loss: 0.9276, test_f1: 0.4980
 epoch: 50, train_loss: 0.9732, test_loss: 0.9277, test_f1: 0.4970
 epoch: 51, train_loss: 0.9624, test_loss: 0.9305, test_f1: 0.4925
 epoch: 52, train_loss: 0.9648, test_loss: 0.9363, test_f1: 0.4948
 epoch: 53, train_loss: 0.9605, test_loss: 0.9308, test_f1: 0.4965
 epoch: 54, train_loss: 0.9660, test_loss: 0.9735, test_f1: 0.4934
 epoch: 55, train_loss: 0.9608, test_loss: 0.9351, test_f1: 0.4909
 epoch: 56, train_loss: 0.9553, test_loss: 0.9647, test_f1: 0.4773
 epoch: 57, train_loss: 0.9587, test_loss: 0.9528, test_f1: 0.4927
 epoch: 58, train_loss: 0.9586, test_loss: 0.9395, test_f1: 0.4859
 epoch: 59, train_loss: 0.9550, test_loss: 0.9341, test_f1: 0.5027
 epoch: 60, train_loss: 0.9609, test_loss: 0.9212, test_f1: 0.5001
 epoch: 61, train_loss: 0.9563, test_loss: 0.9085, test_f1: 0.5203
 epoch: 62, train_loss: 0.9483, test_loss: 0.9242, test_f1: 0.4977
 epoch: 63, train_loss: 0.9634, test_loss: 0.9157, test_f1: 0.5078
 epoch: 64, train_loss: 0.9462, test_loss: 0.9086, test_f1: 0.5218
 epoch: 65, train_loss: 0.9523, test_loss: 0.9301, test_f1: 0.4952
 epoch: 66, train_loss: 0.9458, test_loss: 0.9195, test_f1: 0.5071
 epoch: 67, train_loss: 0.9455, test_loss: 0.9187, test_f1: 0.5023
 epoch: 68, train_loss: 0.9457, test_loss: 0.9236, test_f1: 0.5029
 epoch: 69, train_loss: 0.9384, test_loss: 0.9196, test_f1: 0.5035
 epoch: 70, train_loss: 0.9441, test_loss: 0.9125, test_f1: 0.5223
 epoch: 71, train_loss: 0.9477, test_loss: 0.9290, test_f1: 0.5009
 epoch: 72, train_loss: 0.9507, test_loss: 0.9024, test_f1: 0.5233
 epoch: 73, train_loss: 0.9554, test_loss: 0.9222, test_f1: 0.5002
 epoch: 74, train_loss: 0.9432, test_loss: 0.9487, test_f1: 0.4922
 epoch: 75, train_loss: 0.9432, test_loss: 0.9370, test_f1: 0.4973
 epoch: 76, train_loss: 0.9448, test_loss: 0.9070, test_f1: 0.5148
 epoch: 77, train_loss: 0.9425, test_loss: 0.9095, test_f1: 0.5209
 epoch: 78, train_loss: 0.9424, test_loss: 0.9304, test_f1: 0.4956
 epoch: 79, train_loss: 0.9487, test_loss: 0.8969, test_f1: 0.5212
 epoch: 80, train_loss: 0.9397, test_loss: 0.9017, test_f1: 0.5260
 epoch: 81, train_loss: 0.9435, test_loss: 0.9243, test_f1: 0.4816
 epoch: 82, train_loss: 0.9400, test_loss: 0.8931, test_f1: 0.5246
 epoch: 83, train_loss: 0.9403, test_loss: 0.9051, test_f1: 0.5152
 epoch: 84, train_loss: 0.9424, test_loss: 0.9047, test_f1: 0.5238
 epoch: 85, train_loss: 0.9348, test_loss: 0.9090, test_f1: 0.5261
 epoch: 86, train_loss: 0.9450, test_loss: 0.9171, test_f1: 0.5089
 epoch: 87, train_loss: 0.9384, test_loss: 0.9382, test_f1: 0.4870
 epoch: 88, train_loss: 0.9286, test_loss: 0.9036, test_f1: 0.5279
 epoch: 89, train_loss: 0.9348, test_loss: 0.8956, test_f1: 0.5221
 epoch: 90, train_loss: 0.9234, test_loss: 0.8915, test_f1: 0.5201
 epoch: 91, train_loss: 0.9404, test_loss: 0.8959, test_f1: 0.5208
 epoch: 92, train_loss: 0.9297, test_loss: 0.9033, test_f1: 0.5163
 epoch: 93, train_loss: 0.9388, test_loss: 0.8973, test_f1: 0.5233
 epoch: 94, train_loss: 0.9393, test_loss: 0.8936, test_f1: 0.5294
 epoch: 95, train_loss: 0.9222, test_loss: 0.9084, test_f1: 0.5077
 epoch: 96, train_loss: 0.9229, test_loss: 0.8908, test_f1: 0.5223
 epoch: 97, train_loss: 0.9271, test_loss: 0.8828, test_f1: 0.5392
 epoch: 98, train_loss: 0.9245, test_loss: 0.9047, test_f1: 0.5330
 epoch: 99, train_loss: 0.9364, test_loss: 0.9186, test_f1: 0.5136
##################ITERATION #4 ****************************************
 epoch: 0, train_loss: 1.2768, test_loss: 1.2297, test_f1: 0.2765
 epoch: 1, train_loss: 1.2290, test_loss: 1.1985, test_f1: 0.3171
 epoch: 2, train_loss: 1.2030, test_loss: 1.1709, test_f1: 0.3418
 epoch: 3, train_loss: 1.1814, test_loss: 1.1421, test_f1: 0.3421
 epoch: 4, train_loss: 1.1578, test_loss: 1.1225, test_f1: 0.3486
 epoch: 5, train_loss: 1.1460, test_loss: 1.1172, test_f1: 0.3466
 epoch: 6, train_loss: 1.1177, test_loss: 1.1079, test_f1: 0.3407
 epoch: 7, train_loss: 1.1119, test_loss: 1.0916, test_f1: 0.3590
 epoch: 8, train_loss: 1.0963, test_loss: 1.0894, test_f1: 0.3842
 epoch: 9, train_loss: 1.0918, test_loss: 1.0839, test_f1: 0.3904
 epoch: 10, train_loss: 1.0792, test_loss: 1.0545, test_f1: 0.3843
 epoch: 11, train_loss: 1.0656, test_loss: 1.0734, test_f1: 0.4076
 epoch: 12, train_loss: 1.0668, test_loss: 1.0584, test_f1: 0.4101
 epoch: 13, train_loss: 1.0534, test_loss: 1.0497, test_f1: 0.4086
 epoch: 14, train_loss: 1.0523, test_loss: 1.0664, test_f1: 0.3973
 epoch: 15, train_loss: 1.0474, test_loss: 1.0613, test_f1: 0.4201
 epoch: 16, train_loss: 1.0303, test_loss: 1.0404, test_f1: 0.4318
 epoch: 17, train_loss: 1.0314, test_loss: 1.0112, test_f1: 0.4286
 epoch: 18, train_loss: 1.0340, test_loss: 1.0311, test_f1: 0.4377
 epoch: 19, train_loss: 1.0231, test_loss: 1.0297, test_f1: 0.4466
 epoch: 20, train_loss: 1.0190, test_loss: 1.0060, test_f1: 0.4382
 epoch: 21, train_loss: 1.0172, test_loss: 1.0036, test_f1: 0.4570
 epoch: 22, train_loss: 1.0096, test_loss: 1.0135, test_f1: 0.4556
 epoch: 23, train_loss: 1.0112, test_loss: 1.0059, test_f1: 0.4630
 epoch: 24, train_loss: 1.0026, test_loss: 1.0055, test_f1: 0.4517
 epoch: 25, train_loss: 0.9977, test_loss: 0.9933, test_f1: 0.4697
 epoch: 26, train_loss: 0.9955, test_loss: 1.0058, test_f1: 0.4669
 epoch: 27, train_loss: 1.0042, test_loss: 0.9786, test_f1: 0.4667
 epoch: 28, train_loss: 0.9962, test_loss: 1.0134, test_f1: 0.4758
 epoch: 29, train_loss: 0.9818, test_loss: 1.0006, test_f1: 0.4617
 epoch: 30, train_loss: 0.9880, test_loss: 1.0013, test_f1: 0.4628
 epoch: 31, train_loss: 0.9807, test_loss: 0.9965, test_f1: 0.4850
 epoch: 32, train_loss: 0.9822, test_loss: 0.9873, test_f1: 0.4727
 epoch: 33, train_loss: 0.9836, test_loss: 0.9844, test_f1: 0.4860
 epoch: 34, train_loss: 0.9684, test_loss: 0.9786, test_f1: 0.4944
 epoch: 35, train_loss: 0.9695, test_loss: 0.9705, test_f1: 0.4769
 epoch: 36, train_loss: 0.9689, test_loss: 0.9731, test_f1: 0.4904
 epoch: 37, train_loss: 0.9731, test_loss: 0.9772, test_f1: 0.4897
 epoch: 38, train_loss: 0.9613, test_loss: 0.9468, test_f1: 0.4904
 epoch: 39, train_loss: 0.9631, test_loss: 0.9673, test_f1: 0.4937
 epoch: 40, train_loss: 0.9631, test_loss: 0.9631, test_f1: 0.4927
 epoch: 41, train_loss: 0.9630, test_loss: 0.9680, test_f1: 0.4822
 epoch: 42, train_loss: 0.9504, test_loss: 0.9541, test_f1: 0.5032
 epoch: 43, train_loss: 0.9619, test_loss: 0.9626, test_f1: 0.5149
 epoch: 44, train_loss: 0.9593, test_loss: 0.9525, test_f1: 0.5073
 epoch: 45, train_loss: 0.9568, test_loss: 0.9525, test_f1: 0.5011
 epoch: 46, train_loss: 0.9599, test_loss: 0.9616, test_f1: 0.4954
 epoch: 47, train_loss: 0.9520, test_loss: 0.9533, test_f1: 0.5042
 epoch: 48, train_loss: 0.9532, test_loss: 0.9688, test_f1: 0.5067
 epoch: 49, train_loss: 0.9471, test_loss: 0.9657, test_f1: 0.4882
 epoch: 50, train_loss: 0.9513, test_loss: 0.9606, test_f1: 0.5060
 epoch: 51, train_loss: 0.9391, test_loss: 0.9512, test_f1: 0.5073
 epoch: 52, train_loss: 0.9439, test_loss: 0.9589, test_f1: 0.5073
 epoch: 53, train_loss: 0.9430, test_loss: 0.9568, test_f1: 0.5035
 epoch: 54, train_loss: 0.9387, test_loss: 0.9554, test_f1: 0.4932
 epoch: 55, train_loss: 0.9388, test_loss: 0.9416, test_f1: 0.5185
 epoch: 56, train_loss: 0.9511, test_loss: 0.9568, test_f1: 0.5131
 epoch: 57, train_loss: 0.9381, test_loss: 0.9483, test_f1: 0.5103
 epoch: 58, train_loss: 0.9429, test_loss: 0.9464, test_f1: 0.5123
 epoch: 59, train_loss: 0.9405, test_loss: 0.9557, test_f1: 0.5011
 epoch: 60, train_loss: 0.9487, test_loss: 0.9531, test_f1: 0.5095
 epoch: 61, train_loss: 0.9414, test_loss: 0.9400, test_f1: 0.5215
 epoch: 62, train_loss: 0.9362, test_loss: 0.9463, test_f1: 0.5202
 epoch: 63, train_loss: 0.9363, test_loss: 0.9493, test_f1: 0.5090
 epoch: 64, train_loss: 0.9395, test_loss: 0.9498, test_f1: 0.5121
 epoch: 65, train_loss: 0.9367, test_loss: 0.9474, test_f1: 0.5121
 epoch: 66, train_loss: 0.9330, test_loss: 0.9479, test_f1: 0.4958
 epoch: 67, train_loss: 0.9335, test_loss: 0.9491, test_f1: 0.4969
 epoch: 68, train_loss: 0.9366, test_loss: 0.9414, test_f1: 0.5197
 epoch: 69, train_loss: 0.9351, test_loss: 0.9387, test_f1: 0.5108
 epoch: 70, train_loss: 0.9335, test_loss: 0.9441, test_f1: 0.5168
 epoch: 71, train_loss: 0.9275, test_loss: 0.9372, test_f1: 0.5065
 epoch: 72, train_loss: 0.9334, test_loss: 0.9332, test_f1: 0.5261
 epoch: 73, train_loss: 0.9251, test_loss: 0.9458, test_f1: 0.5089
 epoch: 74, train_loss: 0.9286, test_loss: 0.9299, test_f1: 0.5215
 epoch: 75, train_loss: 0.9312, test_loss: 0.9401, test_f1: 0.5259
 epoch: 76, train_loss: 0.9269, test_loss: 0.9352, test_f1: 0.5195
 epoch: 77, train_loss: 0.9356, test_loss: 0.9305, test_f1: 0.5160
 epoch: 78, train_loss: 0.9313, test_loss: 0.9388, test_f1: 0.5176
 epoch: 79, train_loss: 0.9275, test_loss: 0.9249, test_f1: 0.5178
 epoch: 80, train_loss: 0.9347, test_loss: 0.9506, test_f1: 0.5020
 epoch: 81, train_loss: 0.9281, test_loss: 0.9362, test_f1: 0.5223
 epoch: 82, train_loss: 0.9332, test_loss: 0.9428, test_f1: 0.5008
 epoch: 83, train_loss: 0.9234, test_loss: 0.9400, test_f1: 0.5204
 epoch: 84, train_loss: 0.9240, test_loss: 0.9386, test_f1: 0.5172
 epoch: 85, train_loss: 0.9183, test_loss: 0.9387, test_f1: 0.5156
 epoch: 86, train_loss: 0.9226, test_loss: 0.9579, test_f1: 0.5245
 epoch: 87, train_loss: 0.9291, test_loss: 0.9333, test_f1: 0.5194
 epoch: 88, train_loss: 0.9250, test_loss: 0.9232, test_f1: 0.5206
 epoch: 89, train_loss: 0.9225, test_loss: 0.9330, test_f1: 0.5221
 epoch: 90, train_loss: 0.9262, test_loss: 0.9343, test_f1: 0.5246
 epoch: 91, train_loss: 0.9235, test_loss: 0.9333, test_f1: 0.5242
 epoch: 92, train_loss: 0.9231, test_loss: 0.9423, test_f1: 0.5232
 epoch: 93, train_loss: 0.9217, test_loss: 0.9417, test_f1: 0.5196
 epoch: 94, train_loss: 0.9203, test_loss: 0.9366, test_f1: 0.5098
 epoch: 95, train_loss: 0.9215, test_loss: 0.9298, test_f1: 0.5214
 epoch: 96, train_loss: 0.9146, test_loss: 0.9250, test_f1: 0.5209
 epoch: 97, train_loss: 0.9234, test_loss: 0.9207, test_f1: 0.5211
 epoch: 98, train_loss: 0.9222, test_loss: 0.9241, test_f1: 0.5214
 epoch: 99, train_loss: 0.9195, test_loss: 0.9163, test_f1: 0.5211
##################ITERATION #5 ****************************************
 epoch: 0, train_loss: 1.2745, test_loss: 1.1532, test_f1: 0.3299
 epoch: 1, train_loss: 1.1927, test_loss: 1.1242, test_f1: 0.3462
 epoch: 2, train_loss: 1.1663, test_loss: 1.1049, test_f1: 0.3422
 epoch: 3, train_loss: 1.1411, test_loss: 1.0903, test_f1: 0.3458
 epoch: 4, train_loss: 1.1286, test_loss: 1.0908, test_f1: 0.3537
 epoch: 5, train_loss: 1.1096, test_loss: 1.0807, test_f1: 0.3537
 epoch: 6, train_loss: 1.1002, test_loss: 1.0734, test_f1: 0.3537
 epoch: 7, train_loss: 1.0885, test_loss: 1.0655, test_f1: 0.3546
 epoch: 8, train_loss: 1.0854, test_loss: 1.0671, test_f1: 0.3546
 epoch: 9, train_loss: 1.0769, test_loss: 1.0673, test_f1: 0.3546
 epoch: 10, train_loss: 1.0757, test_loss: 1.0631, test_f1: 0.3546
 epoch: 11, train_loss: 1.0660, test_loss: 1.0601, test_f1: 0.3617
 epoch: 12, train_loss: 1.0689, test_loss: 1.0575, test_f1: 0.3579
 epoch: 13, train_loss: 1.0571, test_loss: 1.0562, test_f1: 0.3573
 epoch: 14, train_loss: 1.0577, test_loss: 1.0652, test_f1: 0.3505
 epoch: 15, train_loss: 1.0556, test_loss: 1.0573, test_f1: 0.3588
 epoch: 16, train_loss: 1.0499, test_loss: 1.0498, test_f1: 0.3594
 epoch: 17, train_loss: 1.0567, test_loss: 1.0505, test_f1: 0.3682
 epoch: 18, train_loss: 1.0451, test_loss: 1.0602, test_f1: 0.3611
 epoch: 19, train_loss: 1.0456, test_loss: 1.0587, test_f1: 0.3689
 epoch: 20, train_loss: 1.0366, test_loss: 1.0575, test_f1: 0.3781
 epoch: 21, train_loss: 1.0380, test_loss: 1.0615, test_f1: 0.3687
 epoch: 22, train_loss: 1.0342, test_loss: 1.0576, test_f1: 0.3696
 epoch: 23, train_loss: 1.0332, test_loss: 1.0569, test_f1: 0.3886
 epoch: 24, train_loss: 1.0303, test_loss: 1.0433, test_f1: 0.3968
 epoch: 25, train_loss: 1.0328, test_loss: 1.0481, test_f1: 0.4081
 epoch: 26, train_loss: 1.0226, test_loss: 1.0431, test_f1: 0.4081
 epoch: 27, train_loss: 1.0250, test_loss: 1.0436, test_f1: 0.4123
 epoch: 28, train_loss: 1.0144, test_loss: 1.0275, test_f1: 0.4177
 epoch: 29, train_loss: 1.0143, test_loss: 1.0343, test_f1: 0.4402
 epoch: 30, train_loss: 1.0124, test_loss: 1.0340, test_f1: 0.4297
 epoch: 31, train_loss: 1.0142, test_loss: 1.0469, test_f1: 0.4266
 epoch: 32, train_loss: 1.0111, test_loss: 1.0427, test_f1: 0.4335
 epoch: 33, train_loss: 1.0122, test_loss: 1.0179, test_f1: 0.4444
 epoch: 34, train_loss: 1.0075, test_loss: 1.0223, test_f1: 0.4545
 epoch: 35, train_loss: 1.0122, test_loss: 1.0204, test_f1: 0.4624
 epoch: 36, train_loss: 1.0062, test_loss: 1.0227, test_f1: 0.4763
 epoch: 37, train_loss: 1.0048, test_loss: 1.0295, test_f1: 0.4721
 epoch: 38, train_loss: 1.0001, test_loss: 1.0311, test_f1: 0.4758
 epoch: 39, train_loss: 0.9953, test_loss: 1.0008, test_f1: 0.4643
 epoch: 40, train_loss: 0.9967, test_loss: 1.0105, test_f1: 0.4643
 epoch: 41, train_loss: 0.9870, test_loss: 1.0118, test_f1: 0.4746
 epoch: 42, train_loss: 0.9946, test_loss: 1.0332, test_f1: 0.4640
 epoch: 43, train_loss: 0.9835, test_loss: 0.9917, test_f1: 0.4764
 epoch: 44, train_loss: 0.9812, test_loss: 1.0092, test_f1: 0.4781
 epoch: 45, train_loss: 0.9852, test_loss: 0.9739, test_f1: 0.4794
 epoch: 46, train_loss: 0.9866, test_loss: 0.9850, test_f1: 0.4830
 epoch: 47, train_loss: 0.9832, test_loss: 0.9805, test_f1: 0.4825
 epoch: 48, train_loss: 0.9769, test_loss: 0.9949, test_f1: 0.4859
 epoch: 49, train_loss: 0.9710, test_loss: 0.9834, test_f1: 0.4821
 epoch: 50, train_loss: 0.9722, test_loss: 0.9732, test_f1: 0.4867
 epoch: 51, train_loss: 0.9694, test_loss: 0.9685, test_f1: 0.4925
 epoch: 52, train_loss: 0.9667, test_loss: 0.9700, test_f1: 0.4855
 epoch: 53, train_loss: 0.9653, test_loss: 0.9735, test_f1: 0.4874
 epoch: 54, train_loss: 0.9660, test_loss: 0.9688, test_f1: 0.4859
 epoch: 55, train_loss: 0.9688, test_loss: 0.9931, test_f1: 0.4833
 epoch: 56, train_loss: 0.9658, test_loss: 0.9747, test_f1: 0.4877
 epoch: 57, train_loss: 0.9642, test_loss: 0.9490, test_f1: 0.4887
 epoch: 58, train_loss: 0.9632, test_loss: 0.9596, test_f1: 0.4856
 epoch: 59, train_loss: 0.9682, test_loss: 0.9749, test_f1: 0.4918
 epoch: 60, train_loss: 0.9580, test_loss: 0.9642, test_f1: 0.4937
 epoch: 61, train_loss: 0.9686, test_loss: 0.9625, test_f1: 0.4912
 epoch: 62, train_loss: 0.9664, test_loss: 0.9678, test_f1: 0.4911
 epoch: 63, train_loss: 0.9585, test_loss: 0.9520, test_f1: 0.4912
 epoch: 64, train_loss: 0.9667, test_loss: 0.9663, test_f1: 0.4923
 epoch: 65, train_loss: 0.9651, test_loss: 0.9521, test_f1: 0.4942
 epoch: 66, train_loss: 0.9569, test_loss: 0.9541, test_f1: 0.4896
 epoch: 67, train_loss: 0.9591, test_loss: 0.9595, test_f1: 0.4921
 epoch: 68, train_loss: 0.9566, test_loss: 0.9515, test_f1: 0.4929
 epoch: 69, train_loss: 0.9520, test_loss: 0.9618, test_f1: 0.4970
 epoch: 70, train_loss: 0.9548, test_loss: 0.9525, test_f1: 0.4973
 epoch: 71, train_loss: 0.9616, test_loss: 0.9435, test_f1: 0.4960
 epoch: 72, train_loss: 0.9539, test_loss: 0.9530, test_f1: 0.4965
 epoch: 73, train_loss: 0.9468, test_loss: 0.9346, test_f1: 0.5009
 epoch: 74, train_loss: 0.9545, test_loss: 0.9404, test_f1: 0.4974
 epoch: 75, train_loss: 0.9482, test_loss: 0.9531, test_f1: 0.4950
 epoch: 76, train_loss: 0.9512, test_loss: 0.9371, test_f1: 0.4949
 epoch: 77, train_loss: 0.9549, test_loss: 0.9242, test_f1: 0.4986
 epoch: 78, train_loss: 0.9451, test_loss: 0.9224, test_f1: 0.5049
 epoch: 79, train_loss: 0.9479, test_loss: 0.9426, test_f1: 0.4968
 epoch: 80, train_loss: 0.9456, test_loss: 0.9323, test_f1: 0.4989
 epoch: 81, train_loss: 0.9457, test_loss: 0.9360, test_f1: 0.5016
 epoch: 82, train_loss: 0.9485, test_loss: 0.9217, test_f1: 0.5121
 epoch: 83, train_loss: 0.9386, test_loss: 0.9261, test_f1: 0.5021
 epoch: 84, train_loss: 0.9439, test_loss: 0.9259, test_f1: 0.5050
 epoch: 85, train_loss: 0.9368, test_loss: 0.9291, test_f1: 0.5028
 epoch: 86, train_loss: 0.9382, test_loss: 0.9200, test_f1: 0.5016
 epoch: 87, train_loss: 0.9395, test_loss: 0.9317, test_f1: 0.5004
 epoch: 88, train_loss: 0.9420, test_loss: 0.9406, test_f1: 0.4992
 epoch: 89, train_loss: 0.9481, test_loss: 0.9331, test_f1: 0.5009
 epoch: 90, train_loss: 0.9397, test_loss: 0.9299, test_f1: 0.4999
 epoch: 91, train_loss: 0.9299, test_loss: 0.9234, test_f1: 0.5048
 epoch: 92, train_loss: 0.9416, test_loss: 0.9291, test_f1: 0.5027
 epoch: 93, train_loss: 0.9414, test_loss: 0.9250, test_f1: 0.5018
 epoch: 94, train_loss: 0.9301, test_loss: 0.9141, test_f1: 0.5262
 epoch: 95, train_loss: 0.9380, test_loss: 0.9213, test_f1: 0.5061
 epoch: 96, train_loss: 0.9380, test_loss: 0.9440, test_f1: 0.5045
 epoch: 97, train_loss: 0.9391, test_loss: 0.9226, test_f1: 0.5027
 epoch: 98, train_loss: 0.9401, test_loss: 0.9451, test_f1: 0.5072
 epoch: 99, train_loss: 0.9379, test_loss: 0.9253, test_f1: 0.5065
##################ITERATION #6 ****************************************
 epoch: 0, train_loss: 1.2975, test_loss: 1.1834, test_f1: 0.2728
 epoch: 1, train_loss: 1.2085, test_loss: 1.1388, test_f1: 0.3335
 epoch: 2, train_loss: 1.1709, test_loss: 1.1036, test_f1: 0.3575
 epoch: 3, train_loss: 1.1491, test_loss: 1.0832, test_f1: 0.3606
 epoch: 4, train_loss: 1.1276, test_loss: 1.0752, test_f1: 0.3562
 epoch: 5, train_loss: 1.1191, test_loss: 1.0640, test_f1: 0.3652
 epoch: 6, train_loss: 1.0958, test_loss: 1.0552, test_f1: 0.3707
 epoch: 7, train_loss: 1.0894, test_loss: 1.0407, test_f1: 0.3941
 epoch: 8, train_loss: 1.0842, test_loss: 1.0355, test_f1: 0.3910
 epoch: 9, train_loss: 1.0737, test_loss: 1.0398, test_f1: 0.3984
 epoch: 10, train_loss: 1.0663, test_loss: 1.0229, test_f1: 0.4081
 epoch: 11, train_loss: 1.0587, test_loss: 1.0157, test_f1: 0.4221
 epoch: 12, train_loss: 1.0426, test_loss: 1.0103, test_f1: 0.4391
 epoch: 13, train_loss: 1.0409, test_loss: 0.9998, test_f1: 0.4231
 epoch: 14, train_loss: 1.0325, test_loss: 1.0017, test_f1: 0.4409
 epoch: 15, train_loss: 1.0309, test_loss: 0.9922, test_f1: 0.4479
 epoch: 16, train_loss: 1.0232, test_loss: 0.9944, test_f1: 0.4569
 epoch: 17, train_loss: 1.0269, test_loss: 0.9822, test_f1: 0.4685
 epoch: 18, train_loss: 1.0141, test_loss: 0.9804, test_f1: 0.4691
 epoch: 19, train_loss: 1.0149, test_loss: 0.9798, test_f1: 0.4678
 epoch: 20, train_loss: 1.0111, test_loss: 0.9848, test_f1: 0.4548
 epoch: 21, train_loss: 1.0082, test_loss: 0.9740, test_f1: 0.4649
 epoch: 22, train_loss: 1.0054, test_loss: 0.9690, test_f1: 0.4675
 epoch: 23, train_loss: 1.0070, test_loss: 0.9799, test_f1: 0.4702
 epoch: 24, train_loss: 0.9879, test_loss: 0.9575, test_f1: 0.4686
 epoch: 25, train_loss: 0.9927, test_loss: 0.9542, test_f1: 0.4676
 epoch: 26, train_loss: 0.9857, test_loss: 0.9739, test_f1: 0.4700
 epoch: 27, train_loss: 0.9929, test_loss: 0.9583, test_f1: 0.4790
 epoch: 28, train_loss: 0.9919, test_loss: 0.9470, test_f1: 0.4775
 epoch: 29, train_loss: 0.9780, test_loss: 0.9589, test_f1: 0.4803
 epoch: 30, train_loss: 0.9739, test_loss: 0.9433, test_f1: 0.4863
 epoch: 31, train_loss: 0.9859, test_loss: 0.9420, test_f1: 0.4815
 epoch: 32, train_loss: 0.9731, test_loss: 0.9496, test_f1: 0.4744
 epoch: 33, train_loss: 0.9753, test_loss: 0.9410, test_f1: 0.4774
 epoch: 34, train_loss: 0.9684, test_loss: 0.9332, test_f1: 0.4804
 epoch: 35, train_loss: 0.9659, test_loss: 0.9335, test_f1: 0.4922
 epoch: 36, train_loss: 0.9630, test_loss: 0.9249, test_f1: 0.4812
 epoch: 37, train_loss: 0.9532, test_loss: 0.9651, test_f1: 0.4734
 epoch: 38, train_loss: 0.9517, test_loss: 0.9252, test_f1: 0.4968
 epoch: 39, train_loss: 0.9618, test_loss: 0.9180, test_f1: 0.4876
 epoch: 40, train_loss: 0.9460, test_loss: 0.9259, test_f1: 0.4990
 epoch: 41, train_loss: 0.9522, test_loss: 0.9259, test_f1: 0.5103
 epoch: 42, train_loss: 0.9467, test_loss: 0.9139, test_f1: 0.4959
 epoch: 43, train_loss: 0.9489, test_loss: 0.9231, test_f1: 0.4898
 epoch: 44, train_loss: 0.9491, test_loss: 0.9204, test_f1: 0.4998
 epoch: 45, train_loss: 0.9398, test_loss: 0.9114, test_f1: 0.5074
 epoch: 46, train_loss: 0.9372, test_loss: 0.9148, test_f1: 0.5006
 epoch: 47, train_loss: 0.9368, test_loss: 0.9090, test_f1: 0.5066
 epoch: 48, train_loss: 0.9453, test_loss: 0.9035, test_f1: 0.4991
 epoch: 49, train_loss: 0.9405, test_loss: 0.8969, test_f1: 0.5078
 epoch: 50, train_loss: 0.9292, test_loss: 0.9270, test_f1: 0.5016
 epoch: 51, train_loss: 0.9320, test_loss: 0.9040, test_f1: 0.5105
 epoch: 52, train_loss: 0.9380, test_loss: 0.8902, test_f1: 0.5210
 epoch: 53, train_loss: 0.9315, test_loss: 0.9020, test_f1: 0.4995
 epoch: 54, train_loss: 0.9288, test_loss: 0.8985, test_f1: 0.5008
 epoch: 55, train_loss: 0.9287, test_loss: 0.8943, test_f1: 0.4970
 epoch: 56, train_loss: 0.9386, test_loss: 0.9003, test_f1: 0.5025
 epoch: 57, train_loss: 0.9182, test_loss: 0.8964, test_f1: 0.5017
 epoch: 58, train_loss: 0.9338, test_loss: 0.8886, test_f1: 0.5105
 epoch: 59, train_loss: 0.9331, test_loss: 0.9004, test_f1: 0.4916
 epoch: 60, train_loss: 0.9193, test_loss: 0.9075, test_f1: 0.4982
 epoch: 61, train_loss: 0.9269, test_loss: 0.8927, test_f1: 0.5068
 epoch: 62, train_loss: 0.9184, test_loss: 0.8898, test_f1: 0.5238
 epoch: 63, train_loss: 0.9262, test_loss: 0.8786, test_f1: 0.5331
 epoch: 64, train_loss: 0.9233, test_loss: 0.8977, test_f1: 0.5099
 epoch: 65, train_loss: 0.9260, test_loss: 0.8997, test_f1: 0.4967
 epoch: 66, train_loss: 0.9260, test_loss: 0.8879, test_f1: 0.5171
 epoch: 67, train_loss: 0.9205, test_loss: 0.8867, test_f1: 0.5331
 epoch: 68, train_loss: 0.9240, test_loss: 0.8876, test_f1: 0.5153
 epoch: 69, train_loss: 0.9235, test_loss: 0.8984, test_f1: 0.5196
 epoch: 70, train_loss: 0.9124, test_loss: 0.8814, test_f1: 0.5247
 epoch: 71, train_loss: 0.9140, test_loss: 0.8970, test_f1: 0.5003
 epoch: 72, train_loss: 0.9191, test_loss: 0.8939, test_f1: 0.5041
 epoch: 73, train_loss: 0.9154, test_loss: 0.8930, test_f1: 0.5288
 epoch: 74, train_loss: 0.9051, test_loss: 0.9014, test_f1: 0.5253
 epoch: 75, train_loss: 0.9191, test_loss: 0.8884, test_f1: 0.5282
 epoch: 76, train_loss: 0.9188, test_loss: 0.8987, test_f1: 0.5022
 epoch: 77, train_loss: 0.9115, test_loss: 0.8651, test_f1: 0.5317
 epoch: 78, train_loss: 0.9278, test_loss: 0.8766, test_f1: 0.5300
 epoch: 79, train_loss: 0.9223, test_loss: 0.8876, test_f1: 0.5356
 epoch: 80, train_loss: 0.9159, test_loss: 0.8813, test_f1: 0.5141
 epoch: 81, train_loss: 0.9081, test_loss: 0.8735, test_f1: 0.5214
 epoch: 82, train_loss: 0.9141, test_loss: 0.8696, test_f1: 0.5343
 epoch: 83, train_loss: 0.9091, test_loss: 0.8877, test_f1: 0.5064
 epoch: 84, train_loss: 0.9102, test_loss: 0.8794, test_f1: 0.5432
 epoch: 85, train_loss: 0.9129, test_loss: 0.8767, test_f1: 0.5350
 epoch: 86, train_loss: 0.9152, test_loss: 0.8787, test_f1: 0.5321
 epoch: 87, train_loss: 0.9075, test_loss: 0.8905, test_f1: 0.5036
 epoch: 88, train_loss: 0.9054, test_loss: 0.8741, test_f1: 0.5413
 epoch: 89, train_loss: 0.9036, test_loss: 0.8733, test_f1: 0.5511
 epoch: 90, train_loss: 0.9006, test_loss: 0.8927, test_f1: 0.5290
 epoch: 91, train_loss: 0.9049, test_loss: 0.8724, test_f1: 0.5483
 epoch: 92, train_loss: 0.8966, test_loss: 0.8701, test_f1: 0.5328
 epoch: 93, train_loss: 0.8943, test_loss: 0.8854, test_f1: 0.5294
 epoch: 94, train_loss: 0.9116, test_loss: 0.8709, test_f1: 0.5305
 epoch: 95, train_loss: 0.9039, test_loss: 0.8644, test_f1: 0.5387
 epoch: 96, train_loss: 0.8989, test_loss: 0.8727, test_f1: 0.5309
 epoch: 97, train_loss: 0.9061, test_loss: 0.8805, test_f1: 0.5386
 epoch: 98, train_loss: 0.8951, test_loss: 0.8873, test_f1: 0.5117
 epoch: 99, train_loss: 0.8990, test_loss: 0.8696, test_f1: 0.5361
##################ITERATION #7 ****************************************
 epoch: 0, train_loss: 1.3511, test_loss: 1.2653, test_f1: 0.2595
 epoch: 1, train_loss: 1.2387, test_loss: 1.1925, test_f1: 0.3055
 epoch: 2, train_loss: 1.2073, test_loss: 1.1440, test_f1: 0.3210
 epoch: 3, train_loss: 1.1714, test_loss: 1.1167, test_f1: 0.3404
 epoch: 4, train_loss: 1.1444, test_loss: 1.0978, test_f1: 0.3493
 epoch: 5, train_loss: 1.1233, test_loss: 1.0801, test_f1: 0.3700
 epoch: 6, train_loss: 1.1117, test_loss: 1.0730, test_f1: 0.3562
 epoch: 7, train_loss: 1.0970, test_loss: 1.0636, test_f1: 0.3627
 epoch: 8, train_loss: 1.0856, test_loss: 1.0540, test_f1: 0.3657
 epoch: 9, train_loss: 1.0765, test_loss: 1.0475, test_f1: 0.3717
 epoch: 10, train_loss: 1.0657, test_loss: 1.0427, test_f1: 0.3813
 epoch: 11, train_loss: 1.0625, test_loss: 1.0335, test_f1: 0.3974
 epoch: 12, train_loss: 1.0533, test_loss: 1.0280, test_f1: 0.4153
 epoch: 13, train_loss: 1.0459, test_loss: 1.0266, test_f1: 0.4060
 epoch: 14, train_loss: 1.0441, test_loss: 1.0197, test_f1: 0.4642
 epoch: 15, train_loss: 1.0378, test_loss: 1.0287, test_f1: 0.4341
 epoch: 16, train_loss: 1.0384, test_loss: 1.0169, test_f1: 0.4723
 epoch: 17, train_loss: 1.0261, test_loss: 1.0134, test_f1: 0.4573
 epoch: 18, train_loss: 1.0155, test_loss: 1.0048, test_f1: 0.4795
 epoch: 19, train_loss: 1.0123, test_loss: 1.0020, test_f1: 0.4899
 epoch: 20, train_loss: 1.0185, test_loss: 1.0022, test_f1: 0.4822
 epoch: 21, train_loss: 1.0082, test_loss: 0.9965, test_f1: 0.4805
 epoch: 22, train_loss: 0.9985, test_loss: 0.9964, test_f1: 0.4708
 epoch: 23, train_loss: 0.9998, test_loss: 0.9840, test_f1: 0.4878
 epoch: 24, train_loss: 0.9976, test_loss: 0.9903, test_f1: 0.4915
 epoch: 25, train_loss: 0.9926, test_loss: 0.9827, test_f1: 0.4674
 epoch: 26, train_loss: 0.9858, test_loss: 0.9695, test_f1: 0.4902
 epoch: 27, train_loss: 0.9857, test_loss: 0.9675, test_f1: 0.4774
 epoch: 28, train_loss: 0.9799, test_loss: 0.9666, test_f1: 0.4968
 epoch: 29, train_loss: 0.9813, test_loss: 0.9644, test_f1: 0.5102
 epoch: 30, train_loss: 0.9752, test_loss: 0.9542, test_f1: 0.5024
 epoch: 31, train_loss: 0.9730, test_loss: 0.9526, test_f1: 0.5098
 epoch: 32, train_loss: 0.9699, test_loss: 0.9440, test_f1: 0.4888
 epoch: 33, train_loss: 0.9728, test_loss: 0.9384, test_f1: 0.5051
 epoch: 34, train_loss: 0.9749, test_loss: 0.9458, test_f1: 0.4813
 epoch: 35, train_loss: 0.9696, test_loss: 0.9429, test_f1: 0.4894
 epoch: 36, train_loss: 0.9706, test_loss: 0.9587, test_f1: 0.5005
 epoch: 37, train_loss: 0.9700, test_loss: 0.9457, test_f1: 0.4932
 epoch: 38, train_loss: 0.9586, test_loss: 0.9489, test_f1: 0.5127
 epoch: 39, train_loss: 0.9670, test_loss: 0.9401, test_f1: 0.4978
 epoch: 40, train_loss: 0.9613, test_loss: 0.9307, test_f1: 0.4963
 epoch: 41, train_loss: 0.9640, test_loss: 0.9254, test_f1: 0.4903
 epoch: 42, train_loss: 0.9554, test_loss: 0.9206, test_f1: 0.4998
 epoch: 43, train_loss: 0.9558, test_loss: 0.9231, test_f1: 0.5102
 epoch: 44, train_loss: 0.9534, test_loss: 0.9186, test_f1: 0.5011
 epoch: 45, train_loss: 0.9458, test_loss: 0.9138, test_f1: 0.5111
 epoch: 46, train_loss: 0.9501, test_loss: 0.9101, test_f1: 0.5031
 epoch: 47, train_loss: 0.9486, test_loss: 0.9149, test_f1: 0.4947
 epoch: 48, train_loss: 0.9412, test_loss: 0.9143, test_f1: 0.5036
 epoch: 49, train_loss: 0.9351, test_loss: 0.9183, test_f1: 0.5073
 epoch: 50, train_loss: 0.9371, test_loss: 0.9405, test_f1: 0.4979
 epoch: 51, train_loss: 0.9458, test_loss: 0.9218, test_f1: 0.5120
 epoch: 52, train_loss: 0.9314, test_loss: 0.9096, test_f1: 0.5038
 epoch: 53, train_loss: 0.9320, test_loss: 0.9175, test_f1: 0.5131
 epoch: 54, train_loss: 0.9412, test_loss: 0.9086, test_f1: 0.5009
 epoch: 55, train_loss: 0.9373, test_loss: 0.9074, test_f1: 0.5156
 epoch: 56, train_loss: 0.9295, test_loss: 0.9095, test_f1: 0.5169
 epoch: 57, train_loss: 0.9319, test_loss: 0.9063, test_f1: 0.5159
 epoch: 58, train_loss: 0.9322, test_loss: 0.8966, test_f1: 0.5313
 epoch: 59, train_loss: 0.9274, test_loss: 0.8979, test_f1: 0.5080
 epoch: 60, train_loss: 0.9399, test_loss: 0.8911, test_f1: 0.5171
 epoch: 61, train_loss: 0.9339, test_loss: 0.8884, test_f1: 0.5317
 epoch: 62, train_loss: 0.9263, test_loss: 0.8928, test_f1: 0.5225
 epoch: 63, train_loss: 0.9256, test_loss: 0.8952, test_f1: 0.5238
 epoch: 64, train_loss: 0.9266, test_loss: 0.8911, test_f1: 0.5188
 epoch: 65, train_loss: 0.9231, test_loss: 0.8884, test_f1: 0.5089
 epoch: 66, train_loss: 0.9160, test_loss: 0.8948, test_f1: 0.5177
 epoch: 67, train_loss: 0.9297, test_loss: 0.8973, test_f1: 0.5172
 epoch: 68, train_loss: 0.9249, test_loss: 0.8933, test_f1: 0.5228
 epoch: 69, train_loss: 0.9304, test_loss: 0.8875, test_f1: 0.5287
 epoch: 70, train_loss: 0.9262, test_loss: 0.9023, test_f1: 0.5223
 epoch: 71, train_loss: 0.9180, test_loss: 0.8985, test_f1: 0.5152
 epoch: 72, train_loss: 0.9237, test_loss: 0.8980, test_f1: 0.5078
 epoch: 73, train_loss: 0.9127, test_loss: 0.8971, test_f1: 0.5084
 epoch: 74, train_loss: 0.9129, test_loss: 0.9086, test_f1: 0.5111
 epoch: 75, train_loss: 0.9205, test_loss: 0.8810, test_f1: 0.5193
 epoch: 76, train_loss: 0.9101, test_loss: 0.9054, test_f1: 0.5175
 epoch: 77, train_loss: 0.9166, test_loss: 0.8869, test_f1: 0.5271
 epoch: 78, train_loss: 0.9097, test_loss: 0.9085, test_f1: 0.5056
 epoch: 79, train_loss: 0.9180, test_loss: 0.8866, test_f1: 0.5202
 epoch: 80, train_loss: 0.9066, test_loss: 0.8825, test_f1: 0.5294
 epoch: 81, train_loss: 0.9141, test_loss: 0.8853, test_f1: 0.5314
 epoch: 82, train_loss: 0.9032, test_loss: 0.8748, test_f1: 0.5338
 epoch: 83, train_loss: 0.9127, test_loss: 0.8972, test_f1: 0.5201
 epoch: 84, train_loss: 0.9121, test_loss: 0.8850, test_f1: 0.5304
 epoch: 85, train_loss: 0.9065, test_loss: 0.8911, test_f1: 0.5196
 epoch: 86, train_loss: 0.9110, test_loss: 0.8822, test_f1: 0.5320
 epoch: 87, train_loss: 0.9069, test_loss: 0.8878, test_f1: 0.5239
 epoch: 88, train_loss: 0.9136, test_loss: 0.8883, test_f1: 0.5222
 epoch: 89, train_loss: 0.9047, test_loss: 0.8894, test_f1: 0.5240
 epoch: 90, train_loss: 0.9017, test_loss: 0.8801, test_f1: 0.5348
 epoch: 91, train_loss: 0.8961, test_loss: 0.8860, test_f1: 0.5239
 epoch: 92, train_loss: 0.9065, test_loss: 0.8973, test_f1: 0.5184
 epoch: 93, train_loss: 0.9129, test_loss: 0.8874, test_f1: 0.5056
 epoch: 94, train_loss: 0.8912, test_loss: 0.8755, test_f1: 0.5268
 epoch: 95, train_loss: 0.9072, test_loss: 0.8768, test_f1: 0.5355
 epoch: 96, train_loss: 0.8958, test_loss: 0.8972, test_f1: 0.5210
 epoch: 97, train_loss: 0.9045, test_loss: 0.8713, test_f1: 0.5401
 epoch: 98, train_loss: 0.9047, test_loss: 0.8751, test_f1: 0.5283
 epoch: 99, train_loss: 0.9013, test_loss: 0.8751, test_f1: 0.5264
##################ITERATION #8 ****************************************
 epoch: 0, train_loss: 1.3498, test_loss: 1.2010, test_f1: 0.3056
 epoch: 1, train_loss: 1.2365, test_loss: 1.1826, test_f1: 0.3066
 epoch: 2, train_loss: 1.2213, test_loss: 1.1654, test_f1: 0.3173
 epoch: 3, train_loss: 1.1826, test_loss: 1.1339, test_f1: 0.3292
 epoch: 4, train_loss: 1.1679, test_loss: 1.1161, test_f1: 0.3432
 epoch: 5, train_loss: 1.1498, test_loss: 1.1054, test_f1: 0.3367
 epoch: 6, train_loss: 1.1373, test_loss: 1.1114, test_f1: 0.3272
 epoch: 7, train_loss: 1.1354, test_loss: 1.0898, test_f1: 0.3491
 epoch: 8, train_loss: 1.1216, test_loss: 1.0677, test_f1: 0.3549
 epoch: 9, train_loss: 1.1055, test_loss: 1.0743, test_f1: 0.3651
 epoch: 10, train_loss: 1.0903, test_loss: 1.0569, test_f1: 0.3672
 epoch: 11, train_loss: 1.0983, test_loss: 1.0660, test_f1: 0.3724
 epoch: 12, train_loss: 1.0800, test_loss: 1.0508, test_f1: 0.3879
 epoch: 13, train_loss: 1.0750, test_loss: 1.0369, test_f1: 0.3959
 epoch: 14, train_loss: 1.0724, test_loss: 1.0528, test_f1: 0.3930
 epoch: 15, train_loss: 1.0704, test_loss: 1.0171, test_f1: 0.4220
 epoch: 16, train_loss: 1.0604, test_loss: 1.0207, test_f1: 0.4281
 epoch: 17, train_loss: 1.0484, test_loss: 1.0007, test_f1: 0.4569
 epoch: 18, train_loss: 1.0437, test_loss: 1.0002, test_f1: 0.4440
 epoch: 19, train_loss: 1.0421, test_loss: 0.9973, test_f1: 0.4284
 epoch: 20, train_loss: 1.0449, test_loss: 1.0043, test_f1: 0.4448
 epoch: 21, train_loss: 1.0323, test_loss: 1.0199, test_f1: 0.4489
 epoch: 22, train_loss: 1.0251, test_loss: 1.0000, test_f1: 0.4718
 epoch: 23, train_loss: 1.0281, test_loss: 0.9947, test_f1: 0.4506
 epoch: 24, train_loss: 1.0161, test_loss: 0.9817, test_f1: 0.4776
 epoch: 25, train_loss: 1.0180, test_loss: 0.9820, test_f1: 0.4742
 epoch: 26, train_loss: 1.0092, test_loss: 0.9860, test_f1: 0.4728
 epoch: 27, train_loss: 1.0077, test_loss: 0.9782, test_f1: 0.4643
 epoch: 28, train_loss: 1.0060, test_loss: 0.9758, test_f1: 0.4791
 epoch: 29, train_loss: 1.0073, test_loss: 0.9668, test_f1: 0.4784
 epoch: 30, train_loss: 1.0009, test_loss: 0.9850, test_f1: 0.4821
 epoch: 31, train_loss: 1.0027, test_loss: 0.9763, test_f1: 0.4827
 epoch: 32, train_loss: 0.9868, test_loss: 0.9778, test_f1: 0.4849
 epoch: 33, train_loss: 0.9990, test_loss: 0.9784, test_f1: 0.4756
 epoch: 34, train_loss: 0.9893, test_loss: 0.9776, test_f1: 0.4641
 epoch: 35, train_loss: 0.9908, test_loss: 0.9712, test_f1: 0.4838
 epoch: 36, train_loss: 0.9918, test_loss: 0.9622, test_f1: 0.4820
 epoch: 37, train_loss: 0.9911, test_loss: 0.9545, test_f1: 0.4949
 epoch: 38, train_loss: 0.9825, test_loss: 0.9525, test_f1: 0.4804
 epoch: 39, train_loss: 0.9850, test_loss: 0.9474, test_f1: 0.4858
 epoch: 40, train_loss: 0.9739, test_loss: 0.9522, test_f1: 0.4951
 epoch: 41, train_loss: 0.9811, test_loss: 0.9438, test_f1: 0.4959
 epoch: 42, train_loss: 0.9755, test_loss: 0.9423, test_f1: 0.4885
 epoch: 43, train_loss: 0.9753, test_loss: 0.9527, test_f1: 0.4741
 epoch: 44, train_loss: 0.9724, test_loss: 0.9489, test_f1: 0.4865
 epoch: 45, train_loss: 0.9764, test_loss: 0.9458, test_f1: 0.4805
 epoch: 46, train_loss: 0.9696, test_loss: 0.9554, test_f1: 0.4816
 epoch: 47, train_loss: 0.9598, test_loss: 0.9460, test_f1: 0.4871
 epoch: 48, train_loss: 0.9578, test_loss: 0.9526, test_f1: 0.4747
 epoch: 49, train_loss: 0.9622, test_loss: 0.9412, test_f1: 0.4981
 epoch: 50, train_loss: 0.9663, test_loss: 0.9402, test_f1: 0.4900
 epoch: 51, train_loss: 0.9584, test_loss: 0.9610, test_f1: 0.4891
 epoch: 52, train_loss: 0.9591, test_loss: 0.9452, test_f1: 0.4954
 epoch: 53, train_loss: 0.9625, test_loss: 0.9360, test_f1: 0.4913
 epoch: 54, train_loss: 0.9612, test_loss: 0.9418, test_f1: 0.4837
 epoch: 55, train_loss: 0.9569, test_loss: 0.9578, test_f1: 0.4812
 epoch: 56, train_loss: 0.9608, test_loss: 0.9432, test_f1: 0.4881
 epoch: 57, train_loss: 0.9556, test_loss: 0.9466, test_f1: 0.4918
 epoch: 58, train_loss: 0.9500, test_loss: 0.9465, test_f1: 0.4878
 epoch: 59, train_loss: 0.9494, test_loss: 0.9450, test_f1: 0.4780
 epoch: 60, train_loss: 0.9437, test_loss: 0.9526, test_f1: 0.4918
 epoch: 61, train_loss: 0.9522, test_loss: 0.9394, test_f1: 0.4909
 epoch: 62, train_loss: 0.9494, test_loss: 0.9324, test_f1: 0.4968
 epoch: 63, train_loss: 0.9447, test_loss: 0.9328, test_f1: 0.4912
 epoch: 64, train_loss: 0.9465, test_loss: 0.9324, test_f1: 0.4940
 epoch: 65, train_loss: 0.9434, test_loss: 0.9359, test_f1: 0.4930
 epoch: 66, train_loss: 0.9537, test_loss: 0.9622, test_f1: 0.4740
 epoch: 67, train_loss: 0.9436, test_loss: 0.9390, test_f1: 0.4959
 epoch: 68, train_loss: 0.9608, test_loss: 0.9359, test_f1: 0.4919
 epoch: 69, train_loss: 0.9424, test_loss: 0.9398, test_f1: 0.4807
 epoch: 70, train_loss: 0.9415, test_loss: 0.9272, test_f1: 0.4981
 epoch: 71, train_loss: 0.9336, test_loss: 0.9324, test_f1: 0.4855
 epoch: 72, train_loss: 0.9504, test_loss: 0.9411, test_f1: 0.4862
 epoch: 73, train_loss: 0.9416, test_loss: 0.9461, test_f1: 0.4931
 epoch: 74, train_loss: 0.9399, test_loss: 0.9394, test_f1: 0.4972
 epoch: 75, train_loss: 0.9425, test_loss: 0.9279, test_f1: 0.4957
 epoch: 76, train_loss: 0.9468, test_loss: 0.9245, test_f1: 0.4979
 epoch: 77, train_loss: 0.9436, test_loss: 0.9305, test_f1: 0.4944
 epoch: 78, train_loss: 0.9418, test_loss: 0.9283, test_f1: 0.4964
 epoch: 79, train_loss: 0.9341, test_loss: 0.9319, test_f1: 0.4956
 epoch: 80, train_loss: 0.9452, test_loss: 0.9220, test_f1: 0.4981
 epoch: 81, train_loss: 0.9350, test_loss: 0.9329, test_f1: 0.4872
 epoch: 82, train_loss: 0.9379, test_loss: 0.9216, test_f1: 0.5032
 epoch: 83, train_loss: 0.9378, test_loss: 0.9208, test_f1: 0.4878
 epoch: 84, train_loss: 0.9408, test_loss: 0.9225, test_f1: 0.5046
 epoch: 85, train_loss: 0.9351, test_loss: 0.9186, test_f1: 0.4897
 epoch: 86, train_loss: 0.9368, test_loss: 0.9198, test_f1: 0.5024
 epoch: 87, train_loss: 0.9372, test_loss: 0.9282, test_f1: 0.4933
 epoch: 88, train_loss: 0.9405, test_loss: 0.9255, test_f1: 0.4970
 epoch: 89, train_loss: 0.9393, test_loss: 0.9254, test_f1: 0.4960
 epoch: 90, train_loss: 0.9366, test_loss: 0.9239, test_f1: 0.4963
 epoch: 91, train_loss: 0.9321, test_loss: 0.9199, test_f1: 0.4847
 epoch: 92, train_loss: 0.9392, test_loss: 0.9172, test_f1: 0.5021
 epoch: 93, train_loss: 0.9430, test_loss: 0.9164, test_f1: 0.4986
 epoch: 94, train_loss: 0.9254, test_loss: 0.9227, test_f1: 0.4876
 epoch: 95, train_loss: 0.9354, test_loss: 0.9128, test_f1: 0.4956
 epoch: 96, train_loss: 0.9294, test_loss: 0.9228, test_f1: 0.4878
 epoch: 97, train_loss: 0.9343, test_loss: 0.9161, test_f1: 0.4893
 epoch: 98, train_loss: 0.9313, test_loss: 0.9256, test_f1: 0.4897
 epoch: 99, train_loss: 0.9295, test_loss: 0.9119, test_f1: 0.5019
##################ITERATION #9 ****************************************
 epoch: 0, train_loss: 1.3260, test_loss: 1.1683, test_f1: 0.2926
 epoch: 1, train_loss: 1.2174, test_loss: 1.1233, test_f1: 0.3598
 epoch: 2, train_loss: 1.1884, test_loss: 1.1080, test_f1: 0.3745
 epoch: 3, train_loss: 1.1503, test_loss: 1.0808, test_f1: 0.4090
 epoch: 4, train_loss: 1.1401, test_loss: 1.0684, test_f1: 0.4281
 epoch: 5, train_loss: 1.1292, test_loss: 1.0526, test_f1: 0.4157
 epoch: 6, train_loss: 1.1098, test_loss: 1.0363, test_f1: 0.4341
 epoch: 7, train_loss: 1.0962, test_loss: 1.0291, test_f1: 0.4344
 epoch: 8, train_loss: 1.0988, test_loss: 1.0208, test_f1: 0.4440
 epoch: 9, train_loss: 1.0861, test_loss: 1.0130, test_f1: 0.4347
 epoch: 10, train_loss: 1.0784, test_loss: 1.0029, test_f1: 0.4453
 epoch: 11, train_loss: 1.0637, test_loss: 1.0078, test_f1: 0.4277
 epoch: 12, train_loss: 1.0595, test_loss: 1.0006, test_f1: 0.4364
 epoch: 13, train_loss: 1.0572, test_loss: 0.9983, test_f1: 0.4430
 epoch: 14, train_loss: 1.0401, test_loss: 0.9904, test_f1: 0.4498
 epoch: 15, train_loss: 1.0443, test_loss: 0.9919, test_f1: 0.4493
 epoch: 16, train_loss: 1.0393, test_loss: 0.9816, test_f1: 0.4520
 epoch: 17, train_loss: 1.0403, test_loss: 0.9756, test_f1: 0.4646
 epoch: 18, train_loss: 1.0399, test_loss: 0.9775, test_f1: 0.4547
 epoch: 19, train_loss: 1.0330, test_loss: 0.9693, test_f1: 0.4555
 epoch: 20, train_loss: 1.0209, test_loss: 0.9722, test_f1: 0.4596
 epoch: 21, train_loss: 1.0207, test_loss: 0.9733, test_f1: 0.4553
 epoch: 22, train_loss: 1.0195, test_loss: 0.9660, test_f1: 0.4667
 epoch: 23, train_loss: 1.0107, test_loss: 0.9696, test_f1: 0.4662
 epoch: 24, train_loss: 1.0057, test_loss: 0.9599, test_f1: 0.4594
 epoch: 25, train_loss: 1.0108, test_loss: 0.9649, test_f1: 0.4734
 epoch: 26, train_loss: 0.9947, test_loss: 0.9565, test_f1: 0.4705
 epoch: 27, train_loss: 0.9974, test_loss: 0.9548, test_f1: 0.4757
 epoch: 28, train_loss: 1.0023, test_loss: 0.9558, test_f1: 0.4478
 epoch: 29, train_loss: 0.9876, test_loss: 0.9564, test_f1: 0.4686
 epoch: 30, train_loss: 0.9873, test_loss: 0.9540, test_f1: 0.4704
 epoch: 31, train_loss: 1.0017, test_loss: 0.9540, test_f1: 0.4698
 epoch: 32, train_loss: 0.9843, test_loss: 0.9458, test_f1: 0.4786
 epoch: 33, train_loss: 0.9845, test_loss: 0.9462, test_f1: 0.4741
 epoch: 34, train_loss: 0.9783, test_loss: 0.9426, test_f1: 0.4645
 epoch: 35, train_loss: 0.9800, test_loss: 0.9415, test_f1: 0.4905
 epoch: 36, train_loss: 0.9873, test_loss: 0.9387, test_f1: 0.4760
 epoch: 37, train_loss: 0.9698, test_loss: 0.9485, test_f1: 0.4824
 epoch: 38, train_loss: 0.9746, test_loss: 0.9403, test_f1: 0.4805
 epoch: 39, train_loss: 0.9728, test_loss: 0.9339, test_f1: 0.5001
 epoch: 40, train_loss: 0.9818, test_loss: 0.9438, test_f1: 0.4951
 epoch: 41, train_loss: 0.9725, test_loss: 0.9396, test_f1: 0.4800
 epoch: 42, train_loss: 0.9675, test_loss: 0.9328, test_f1: 0.4990
 epoch: 43, train_loss: 0.9636, test_loss: 0.9352, test_f1: 0.4864
 epoch: 44, train_loss: 0.9776, test_loss: 0.9399, test_f1: 0.4826
 epoch: 45, train_loss: 0.9698, test_loss: 0.9284, test_f1: 0.4865
 epoch: 46, train_loss: 0.9621, test_loss: 0.9326, test_f1: 0.4989
 epoch: 47, train_loss: 0.9673, test_loss: 0.9311, test_f1: 0.5048
 epoch: 48, train_loss: 0.9584, test_loss: 0.9344, test_f1: 0.4940
 epoch: 49, train_loss: 0.9612, test_loss: 0.9311, test_f1: 0.4966
 epoch: 50, train_loss: 0.9621, test_loss: 0.9266, test_f1: 0.4929
 epoch: 51, train_loss: 0.9554, test_loss: 0.9228, test_f1: 0.5043
 epoch: 52, train_loss: 0.9589, test_loss: 0.9272, test_f1: 0.5014
 epoch: 53, train_loss: 0.9523, test_loss: 0.9267, test_f1: 0.5074
 epoch: 54, train_loss: 0.9489, test_loss: 0.9318, test_f1: 0.4964
 epoch: 55, train_loss: 0.9623, test_loss: 0.9364, test_f1: 0.5089
 epoch: 56, train_loss: 0.9565, test_loss: 0.9392, test_f1: 0.5101
 epoch: 57, train_loss: 0.9503, test_loss: 0.9317, test_f1: 0.4987
 epoch: 58, train_loss: 0.9586, test_loss: 0.9274, test_f1: 0.5081
 epoch: 59, train_loss: 0.9505, test_loss: 0.9258, test_f1: 0.5111
 epoch: 60, train_loss: 0.9509, test_loss: 0.9248, test_f1: 0.5074
 epoch: 61, train_loss: 0.9518, test_loss: 0.9310, test_f1: 0.4983
 epoch: 62, train_loss: 0.9466, test_loss: 0.9209, test_f1: 0.4920
 epoch: 63, train_loss: 0.9537, test_loss: 0.9204, test_f1: 0.5174
 epoch: 64, train_loss: 0.9527, test_loss: 0.9223, test_f1: 0.5000
 epoch: 65, train_loss: 0.9450, test_loss: 0.9219, test_f1: 0.5029
 epoch: 66, train_loss: 0.9364, test_loss: 0.9154, test_f1: 0.5264
 epoch: 67, train_loss: 0.9360, test_loss: 0.9235, test_f1: 0.5063
 epoch: 68, train_loss: 0.9488, test_loss: 0.9215, test_f1: 0.5129
 epoch: 69, train_loss: 0.9442, test_loss: 0.9374, test_f1: 0.5161
 epoch: 70, train_loss: 0.9511, test_loss: 0.9215, test_f1: 0.4992
 epoch: 71, train_loss: 0.9529, test_loss: 0.9250, test_f1: 0.5045
 epoch: 72, train_loss: 0.9573, test_loss: 0.9263, test_f1: 0.5078
 epoch: 73, train_loss: 0.9368, test_loss: 0.9171, test_f1: 0.5169
 epoch: 74, train_loss: 0.9383, test_loss: 0.9312, test_f1: 0.5146
 epoch: 75, train_loss: 0.9462, test_loss: 0.9144, test_f1: 0.5125
 epoch: 76, train_loss: 0.9413, test_loss: 0.9227, test_f1: 0.5104
 epoch: 77, train_loss: 0.9390, test_loss: 0.9226, test_f1: 0.5069
 epoch: 78, train_loss: 0.9463, test_loss: 0.9117, test_f1: 0.5210
 epoch: 79, train_loss: 0.9412, test_loss: 0.9237, test_f1: 0.5302
 epoch: 80, train_loss: 0.9407, test_loss: 0.9201, test_f1: 0.5105
 epoch: 81, train_loss: 0.9498, test_loss: 0.9176, test_f1: 0.5091
 epoch: 82, train_loss: 0.9406, test_loss: 0.9095, test_f1: 0.5082
 epoch: 83, train_loss: 0.9362, test_loss: 0.9202, test_f1: 0.5237
 epoch: 84, train_loss: 0.9423, test_loss: 0.9178, test_f1: 0.5140
 epoch: 85, train_loss: 0.9325, test_loss: 0.9306, test_f1: 0.5136
 epoch: 86, train_loss: 0.9451, test_loss: 0.9229, test_f1: 0.5150
 epoch: 87, train_loss: 0.9381, test_loss: 0.9174, test_f1: 0.5152
 epoch: 88, train_loss: 0.9479, test_loss: 0.9192, test_f1: 0.5096
 epoch: 89, train_loss: 0.9451, test_loss: 0.9149, test_f1: 0.5305
 epoch: 90, train_loss: 0.9309, test_loss: 0.9112, test_f1: 0.5141
 epoch: 91, train_loss: 0.9341, test_loss: 0.9221, test_f1: 0.5164
 epoch: 92, train_loss: 0.9425, test_loss: 0.9163, test_f1: 0.5148
 epoch: 93, train_loss: 0.9313, test_loss: 0.9176, test_f1: 0.5047
 epoch: 94, train_loss: 0.9294, test_loss: 0.9115, test_f1: 0.5301
 epoch: 95, train_loss: 0.9263, test_loss: 0.9222, test_f1: 0.5251
 epoch: 96, train_loss: 0.9323, test_loss: 0.9349, test_f1: 0.5226
 epoch: 97, train_loss: 0.9309, test_loss: 0.9124, test_f1: 0.5281
 epoch: 98, train_loss: 0.9376, test_loss: 0.9282, test_f1: 0.5165
 epoch: 99, train_loss: 0.9424, test_loss: 0.9250, test_f1: 0.5062

Training completed in 1427.17 seconds
Best F1: 0.5511 at epoch 89
Mean F1 across iterations: 0.5180  0.0320
========================FINAL RESULTS================================
FEGIN weighted F1: 0.5511  0.0320
python main.py --data ltspice_examples --representation component_pin_net --model FEGIN --layers 6 --hiddens 16 --batch_size 32 --lr 0.0001 --emb_size 250 --epochs 100 --save_appendix component_pin_net_L6_H16_BS32_LR0.0001_E250 --no_val
-----



STDERR:
  File "main.py", line 370, in <module>
    main()
  File "main.py", line 254, in main
    dataset = dataset_class(
  File "/home/philip/projects/ltspice_examples_code_repo/Circuit-Completion-Using-GNNs/component_classification_with_link_prediction_head/evaluation/FEGIN/kernel/circuit_datasets.py", line 15, in __init__
    self.data, self.slices = torch.load(self.processed_paths[0])
  File "/home/philip/.local/lib/python3.8/site-packages/torch/serialization.py", line 1040, in load
    warnings.warn(
  File "/usr/lib/python3.8/warnings.py", line 109, in _showwarnmsg
    sw(msg.message, msg.category, msg.filename, msg.lineno,
  File "main.py", line 47, in warn_with_traceback
    traceback.print_stack(file=log)
/home/philip/projects/ltspice_examples_code_repo/Circuit-Completion-Using-GNNs/component_classification_with_link_prediction_head/evaluation/FEGIN/kernel/circuit_datasets.py:15: FutureWarning: You are using `torch.load` with `weights_only=False` (the current default value), which uses the default pickle module implicitly. It is possible to construct malicious pickle data which will execute arbitrary code during unpickling (See https://github.com/pytorch/pytorch/blob/main/SECURITY.md#untrusted-models for more details). In a future release, the default value for `weights_only` will be flipped to `True`. This limits the functions that could be executed during unpickling. Arbitrary objects will no longer be allowed to be loaded via this mode unless they are explicitly allowlisted by the user via `torch.serialization.add_safe_globals`. We recommend you start setting `weights_only=True` for any use case where you don't have full control of the loaded file. Please open an issue on GitHub for any issues related to this experimental feature.
  self.data, self.slices = torch.load(self.processed_paths[0])
