STDOUT:
Results will be saved in /home/philip/projects/ltspice_examples_code_repo/Circuit-Completion-Using-GNNs/component_classification_with_link_prediction_head/evaluation/FEGIN/results/model_FEGIN_dataset_ltspice_demos
Command line input: python main.py --data ltspice_demos --representation component_net --model FEGIN --layers 6 --hiddens 64 --batch_size 256 --lr 0.0001 --emb_size 512 --epochs 100 --save_appendix component_net_L6_H64_BS256_LR0.0001_E512 --no_val
 is saved.
-----
ltspice_demos - FEGIN
Using 6 layers, 64 hidden units, h = 2
Loading component_net representation dataset
ENTERED
Training FEGIN on component_net representation
Train: 1565, Test: 383
##################ITERATION #0 ****************************************
 epoch: 0, train_loss: 1.3844, test_loss: 1.3928, test_f1: 0.1365
 epoch: 1, train_loss: 1.3757, test_loss: 1.3922, test_f1: 0.1365
 epoch: 2, train_loss: 1.3717, test_loss: 1.3908, test_f1: 0.1365
 epoch: 3, train_loss: 1.3660, test_loss: 1.3874, test_f1: 0.1365
 epoch: 4, train_loss: 1.3605, test_loss: 1.3834, test_f1: 0.1365
 epoch: 5, train_loss: 1.3559, test_loss: 1.3805, test_f1: 0.1365
 epoch: 6, train_loss: 1.3483, test_loss: 1.3790, test_f1: 0.1365
 epoch: 7, train_loss: 1.3426, test_loss: 1.3761, test_f1: 0.1365
 epoch: 8, train_loss: 1.3372, test_loss: 1.3715, test_f1: 0.1365
 epoch: 9, train_loss: 1.3290, test_loss: 1.3661, test_f1: 0.1365
 epoch: 10, train_loss: 1.3207, test_loss: 1.3597, test_f1: 0.1365
 epoch: 11, train_loss: 1.3112, test_loss: 1.3513, test_f1: 0.1365
 epoch: 12, train_loss: 1.3028, test_loss: 1.3416, test_f1: 0.1365
 epoch: 13, train_loss: 1.2929, test_loss: 1.3312, test_f1: 0.1365
 epoch: 14, train_loss: 1.2823, test_loss: 1.3203, test_f1: 0.1365
 epoch: 15, train_loss: 1.2722, test_loss: 1.3096, test_f1: 0.1365
 epoch: 16, train_loss: 1.2595, test_loss: 1.3006, test_f1: 0.1365
 epoch: 17, train_loss: 1.2480, test_loss: 1.2913, test_f1: 0.1365
 epoch: 18, train_loss: 1.2379, test_loss: 1.2826, test_f1: 0.1420
 epoch: 19, train_loss: 1.2259, test_loss: 1.2711, test_f1: 0.1601
 epoch: 20, train_loss: 1.2164, test_loss: 1.2637, test_f1: 0.1822
 epoch: 21, train_loss: 1.2050, test_loss: 1.2568, test_f1: 0.2037
 epoch: 22, train_loss: 1.1989, test_loss: 1.2494, test_f1: 0.2354
 epoch: 23, train_loss: 1.1904, test_loss: 1.2394, test_f1: 0.2571
 epoch: 24, train_loss: 1.1820, test_loss: 1.2327, test_f1: 0.2711
 epoch: 25, train_loss: 1.1757, test_loss: 1.2269, test_f1: 0.2954
 epoch: 26, train_loss: 1.1661, test_loss: 1.2209, test_f1: 0.3152
 epoch: 27, train_loss: 1.1595, test_loss: 1.2134, test_f1: 0.3401
 epoch: 28, train_loss: 1.1577, test_loss: 1.2102, test_f1: 0.3535
 epoch: 29, train_loss: 1.1492, test_loss: 1.2074, test_f1: 0.3470
 epoch: 30, train_loss: 1.1459, test_loss: 1.2044, test_f1: 0.3417
 epoch: 31, train_loss: 1.1406, test_loss: 1.1987, test_f1: 0.3253
 epoch: 32, train_loss: 1.1392, test_loss: 1.1930, test_f1: 0.3211
 epoch: 33, train_loss: 1.1281, test_loss: 1.1898, test_f1: 0.3383
 epoch: 34, train_loss: 1.1310, test_loss: 1.1860, test_f1: 0.3329
 epoch: 35, train_loss: 1.1253, test_loss: 1.1831, test_f1: 0.3329
 epoch: 36, train_loss: 1.1256, test_loss: 1.1793, test_f1: 0.3226
 epoch: 37, train_loss: 1.1217, test_loss: 1.1761, test_f1: 0.3183
 epoch: 38, train_loss: 1.1212, test_loss: 1.1742, test_f1: 0.2884
 epoch: 39, train_loss: 1.1125, test_loss: 1.1700, test_f1: 0.2813
 epoch: 40, train_loss: 1.1078, test_loss: 1.1696, test_f1: 0.2762
 epoch: 41, train_loss: 1.1028, test_loss: 1.1675, test_f1: 0.2964
 epoch: 42, train_loss: 1.1043, test_loss: 1.1618, test_f1: 0.3200
 epoch: 43, train_loss: 1.1021, test_loss: 1.1603, test_f1: 0.3370
 epoch: 44, train_loss: 1.1016, test_loss: 1.1597, test_f1: 0.3363
 epoch: 45, train_loss: 1.0929, test_loss: 1.1567, test_f1: 0.3266
 epoch: 46, train_loss: 1.0905, test_loss: 1.1526, test_f1: 0.3311
 epoch: 47, train_loss: 1.0879, test_loss: 1.1531, test_f1: 0.3427
 epoch: 48, train_loss: 1.0883, test_loss: 1.1480, test_f1: 0.3455
 epoch: 49, train_loss: 1.0852, test_loss: 1.1456, test_f1: 0.3428
 epoch: 50, train_loss: 1.0872, test_loss: 1.1421, test_f1: 0.3625
 epoch: 51, train_loss: 1.0780, test_loss: 1.1409, test_f1: 0.3606
 epoch: 52, train_loss: 1.0815, test_loss: 1.1388, test_f1: 0.3715
 epoch: 53, train_loss: 1.0770, test_loss: 1.1381, test_f1: 0.3650
 epoch: 54, train_loss: 1.0736, test_loss: 1.1362, test_f1: 0.3788
 epoch: 55, train_loss: 1.0740, test_loss: 1.1343, test_f1: 0.3836
 epoch: 56, train_loss: 1.0721, test_loss: 1.1349, test_f1: 0.3874
 epoch: 57, train_loss: 1.0687, test_loss: 1.1342, test_f1: 0.3840
 epoch: 58, train_loss: 1.0679, test_loss: 1.1323, test_f1: 0.3841
 epoch: 59, train_loss: 1.0721, test_loss: 1.1309, test_f1: 0.3952
 epoch: 60, train_loss: 1.0643, test_loss: 1.1280, test_f1: 0.3998
 epoch: 61, train_loss: 1.0650, test_loss: 1.1265, test_f1: 0.3923
 epoch: 62, train_loss: 1.0657, test_loss: 1.1258, test_f1: 0.3899
 epoch: 63, train_loss: 1.0633, test_loss: 1.1233, test_f1: 0.3887
 epoch: 64, train_loss: 1.0600, test_loss: 1.1245, test_f1: 0.4019
 epoch: 65, train_loss: 1.0602, test_loss: 1.1255, test_f1: 0.3949
 epoch: 66, train_loss: 1.0555, test_loss: 1.1235, test_f1: 0.4093
 epoch: 67, train_loss: 1.0613, test_loss: 1.1206, test_f1: 0.4098
 epoch: 68, train_loss: 1.0522, test_loss: 1.1181, test_f1: 0.4107
 epoch: 69, train_loss: 1.0533, test_loss: 1.1175, test_f1: 0.3958
 epoch: 70, train_loss: 1.0488, test_loss: 1.1149, test_f1: 0.4234
 epoch: 71, train_loss: 1.0545, test_loss: 1.1142, test_f1: 0.4116
 epoch: 72, train_loss: 1.0538, test_loss: 1.1128, test_f1: 0.4223
 epoch: 73, train_loss: 1.0516, test_loss: 1.1144, test_f1: 0.4354
 epoch: 74, train_loss: 1.0456, test_loss: 1.1131, test_f1: 0.4415
 epoch: 75, train_loss: 1.0445, test_loss: 1.1115, test_f1: 0.4443
 epoch: 76, train_loss: 1.0438, test_loss: 1.1088, test_f1: 0.4405
 epoch: 77, train_loss: 1.0393, test_loss: 1.1077, test_f1: 0.4483
 epoch: 78, train_loss: 1.0409, test_loss: 1.1088, test_f1: 0.4387
 epoch: 79, train_loss: 1.0407, test_loss: 1.1053, test_f1: 0.4659
 epoch: 80, train_loss: 1.0392, test_loss: 1.1041, test_f1: 0.4630
 epoch: 81, train_loss: 1.0320, test_loss: 1.1016, test_f1: 0.4758
 epoch: 82, train_loss: 1.0343, test_loss: 1.1003, test_f1: 0.4826
 epoch: 83, train_loss: 1.0288, test_loss: 1.0982, test_f1: 0.4776
 epoch: 84, train_loss: 1.0308, test_loss: 1.0978, test_f1: 0.4891
 epoch: 85, train_loss: 1.0298, test_loss: 1.0958, test_f1: 0.4917
 epoch: 86, train_loss: 1.0267, test_loss: 1.0969, test_f1: 0.4790
 epoch: 87, train_loss: 1.0250, test_loss: 1.0954, test_f1: 0.4836
 epoch: 88, train_loss: 1.0237, test_loss: 1.0977, test_f1: 0.4786
 epoch: 89, train_loss: 1.0264, test_loss: 1.0962, test_f1: 0.4818
 epoch: 90, train_loss: 1.0271, test_loss: 1.0928, test_f1: 0.4887
 epoch: 91, train_loss: 1.0274, test_loss: 1.0896, test_f1: 0.4954
 epoch: 92, train_loss: 1.0187, test_loss: 1.0888, test_f1: 0.4954
 epoch: 93, train_loss: 1.0151, test_loss: 1.0884, test_f1: 0.4906
 epoch: 94, train_loss: 1.0188, test_loss: 1.0884, test_f1: 0.5009
 epoch: 95, train_loss: 1.0245, test_loss: 1.0889, test_f1: 0.5094
 epoch: 96, train_loss: 1.0118, test_loss: 1.0878, test_f1: 0.5006
 epoch: 97, train_loss: 1.0170, test_loss: 1.0893, test_f1: 0.5007
 epoch: 98, train_loss: 1.0173, test_loss: 1.0905, test_f1: 0.4988
 epoch: 99, train_loss: 1.0067, test_loss: 1.0904, test_f1: 0.5022
##################ITERATION #1 ****************************************
 epoch: 0, train_loss: 1.3437, test_loss: 1.3761, test_f1: 0.1365
 epoch: 1, train_loss: 1.3266, test_loss: 1.3760, test_f1: 0.1365
 epoch: 2, train_loss: 1.3148, test_loss: 1.3741, test_f1: 0.1365
 epoch: 3, train_loss: 1.3048, test_loss: 1.3715, test_f1: 0.1365
 epoch: 4, train_loss: 1.2938, test_loss: 1.3642, test_f1: 0.1365
 epoch: 5, train_loss: 1.2833, test_loss: 1.3501, test_f1: 0.1365
 epoch: 6, train_loss: 1.2719, test_loss: 1.3340, test_f1: 0.1365
 epoch: 7, train_loss: 1.2604, test_loss: 1.3254, test_f1: 0.1365
 epoch: 8, train_loss: 1.2489, test_loss: 1.3079, test_f1: 0.1448
 epoch: 9, train_loss: 1.2359, test_loss: 1.2899, test_f1: 0.2155
 epoch: 10, train_loss: 1.2231, test_loss: 1.2757, test_f1: 0.2883
 epoch: 11, train_loss: 1.2147, test_loss: 1.2619, test_f1: 0.3098
 epoch: 12, train_loss: 1.2030, test_loss: 1.2482, test_f1: 0.3162
 epoch: 13, train_loss: 1.1914, test_loss: 1.2340, test_f1: 0.3405
 epoch: 14, train_loss: 1.1867, test_loss: 1.2275, test_f1: 0.3566
 epoch: 15, train_loss: 1.1765, test_loss: 1.2211, test_f1: 0.3602
 epoch: 16, train_loss: 1.1682, test_loss: 1.2150, test_f1: 0.3618
 epoch: 17, train_loss: 1.1598, test_loss: 1.2095, test_f1: 0.3518
 epoch: 18, train_loss: 1.1545, test_loss: 1.2043, test_f1: 0.3320
 epoch: 19, train_loss: 1.1471, test_loss: 1.2016, test_f1: 0.3350
 epoch: 20, train_loss: 1.1430, test_loss: 1.1980, test_f1: 0.3382
 epoch: 21, train_loss: 1.1342, test_loss: 1.1955, test_f1: 0.3320
 epoch: 22, train_loss: 1.1388, test_loss: 1.1907, test_f1: 0.3261
 epoch: 23, train_loss: 1.1283, test_loss: 1.1863, test_f1: 0.3214
 epoch: 24, train_loss: 1.1238, test_loss: 1.1855, test_f1: 0.3248
 epoch: 25, train_loss: 1.1205, test_loss: 1.1832, test_f1: 0.3212
 epoch: 26, train_loss: 1.1153, test_loss: 1.1829, test_f1: 0.3433
 epoch: 27, train_loss: 1.1109, test_loss: 1.1830, test_f1: 0.3469
 epoch: 28, train_loss: 1.1128, test_loss: 1.1815, test_f1: 0.3488
 epoch: 29, train_loss: 1.1087, test_loss: 1.1820, test_f1: 0.3522
 epoch: 30, train_loss: 1.1062, test_loss: 1.1743, test_f1: 0.3506
 epoch: 31, train_loss: 1.1009, test_loss: 1.1733, test_f1: 0.3519
 epoch: 32, train_loss: 1.0989, test_loss: 1.1707, test_f1: 0.3537
 epoch: 33, train_loss: 1.0951, test_loss: 1.1683, test_f1: 0.3587
 epoch: 34, train_loss: 1.0910, test_loss: 1.1647, test_f1: 0.3587
 epoch: 35, train_loss: 1.0879, test_loss: 1.1636, test_f1: 0.3628
 epoch: 36, train_loss: 1.0891, test_loss: 1.1607, test_f1: 0.3630
 epoch: 37, train_loss: 1.0775, test_loss: 1.1597, test_f1: 0.3757
 epoch: 38, train_loss: 1.0793, test_loss: 1.1606, test_f1: 0.3669
 epoch: 39, train_loss: 1.0711, test_loss: 1.1510, test_f1: 0.3779
 epoch: 40, train_loss: 1.0730, test_loss: 1.1491, test_f1: 0.3811
 epoch: 41, train_loss: 1.0689, test_loss: 1.1449, test_f1: 0.3794
 epoch: 42, train_loss: 1.0708, test_loss: 1.1498, test_f1: 0.3862
 epoch: 43, train_loss: 1.0623, test_loss: 1.1417, test_f1: 0.3942
 epoch: 44, train_loss: 1.0570, test_loss: 1.1348, test_f1: 0.3935
 epoch: 45, train_loss: 1.0565, test_loss: 1.1377, test_f1: 0.4164
 epoch: 46, train_loss: 1.0493, test_loss: 1.1361, test_f1: 0.4409
 epoch: 47, train_loss: 1.0451, test_loss: 1.1349, test_f1: 0.4448
 epoch: 48, train_loss: 1.0473, test_loss: 1.1381, test_f1: 0.4436
 epoch: 49, train_loss: 1.0431, test_loss: 1.1321, test_f1: 0.4488
 epoch: 50, train_loss: 1.0458, test_loss: 1.1332, test_f1: 0.4671
 epoch: 51, train_loss: 1.0389, test_loss: 1.1292, test_f1: 0.4686
 epoch: 52, train_loss: 1.0356, test_loss: 1.1343, test_f1: 0.4499
 epoch: 53, train_loss: 1.0405, test_loss: 1.1353, test_f1: 0.4466
 epoch: 54, train_loss: 1.0349, test_loss: 1.1336, test_f1: 0.4628
 epoch: 55, train_loss: 1.0260, test_loss: 1.1351, test_f1: 0.4664
 epoch: 56, train_loss: 1.0305, test_loss: 1.1327, test_f1: 0.4684
 epoch: 57, train_loss: 1.0308, test_loss: 1.1418, test_f1: 0.4666
 epoch: 58, train_loss: 1.0302, test_loss: 1.1492, test_f1: 0.4633
 epoch: 59, train_loss: 1.0264, test_loss: 1.1313, test_f1: 0.4762
 epoch: 60, train_loss: 1.0256, test_loss: 1.1312, test_f1: 0.4781
 epoch: 61, train_loss: 1.0248, test_loss: 1.1272, test_f1: 0.4834
 epoch: 62, train_loss: 1.0199, test_loss: 1.1362, test_f1: 0.4757
 epoch: 63, train_loss: 1.0206, test_loss: 1.1323, test_f1: 0.4785
 epoch: 64, train_loss: 1.0248, test_loss: 1.1297, test_f1: 0.4905
 epoch: 65, train_loss: 1.0182, test_loss: 1.1284, test_f1: 0.4860
 epoch: 66, train_loss: 1.0193, test_loss: 1.1217, test_f1: 0.4910
 epoch: 67, train_loss: 1.0095, test_loss: 1.1226, test_f1: 0.4910
 epoch: 68, train_loss: 1.0103, test_loss: 1.1304, test_f1: 0.4860
 epoch: 69, train_loss: 1.0089, test_loss: 1.1393, test_f1: 0.4933
 epoch: 70, train_loss: 1.0079, test_loss: 1.1324, test_f1: 0.4855
 epoch: 71, train_loss: 1.0025, test_loss: 1.1218, test_f1: 0.4925
 epoch: 72, train_loss: 1.0037, test_loss: 1.1200, test_f1: 0.4898
 epoch: 73, train_loss: 1.0081, test_loss: 1.1287, test_f1: 0.4867
 epoch: 74, train_loss: 1.0048, test_loss: 1.1109, test_f1: 0.5061
 epoch: 75, train_loss: 1.0006, test_loss: 1.1150, test_f1: 0.5018
 epoch: 76, train_loss: 1.0011, test_loss: 1.1188, test_f1: 0.5072
 epoch: 77, train_loss: 0.9973, test_loss: 1.1250, test_f1: 0.5026
 epoch: 78, train_loss: 0.9957, test_loss: 1.1145, test_f1: 0.5039
 epoch: 79, train_loss: 0.9881, test_loss: 1.1269, test_f1: 0.5068
 epoch: 80, train_loss: 0.9873, test_loss: 1.1327, test_f1: 0.4965
 epoch: 81, train_loss: 0.9858, test_loss: 1.1234, test_f1: 0.4907
 epoch: 82, train_loss: 0.9914, test_loss: 1.1253, test_f1: 0.5088
 epoch: 83, train_loss: 0.9906, test_loss: 1.1247, test_f1: 0.5062
 epoch: 84, train_loss: 0.9814, test_loss: 1.1221, test_f1: 0.5151
 epoch: 85, train_loss: 0.9870, test_loss: 1.1031, test_f1: 0.5187
 epoch: 86, train_loss: 0.9794, test_loss: 1.1046, test_f1: 0.5092
 epoch: 87, train_loss: 0.9801, test_loss: 1.1111, test_f1: 0.5075
 epoch: 88, train_loss: 0.9812, test_loss: 1.1217, test_f1: 0.5071
 epoch: 89, train_loss: 0.9825, test_loss: 1.1129, test_f1: 0.5078
 epoch: 90, train_loss: 0.9786, test_loss: 1.1097, test_f1: 0.5130
 epoch: 91, train_loss: 0.9743, test_loss: 1.1083, test_f1: 0.5176
 epoch: 92, train_loss: 0.9685, test_loss: 1.1158, test_f1: 0.5306
 epoch: 93, train_loss: 0.9695, test_loss: 1.1203, test_f1: 0.5270
 epoch: 94, train_loss: 0.9743, test_loss: 1.1242, test_f1: 0.5258
 epoch: 95, train_loss: 0.9670, test_loss: 1.1054, test_f1: 0.5264
 epoch: 96, train_loss: 0.9636, test_loss: 1.1029, test_f1: 0.5270
 epoch: 97, train_loss: 0.9619, test_loss: 1.0992, test_f1: 0.5270
 epoch: 98, train_loss: 0.9723, test_loss: 1.0999, test_f1: 0.5334
 epoch: 99, train_loss: 0.9631, test_loss: 1.1039, test_f1: 0.5371
##################ITERATION #2 ****************************************
 epoch: 0, train_loss: 1.3112, test_loss: 1.3620, test_f1: 0.1365
 epoch: 1, train_loss: 1.2853, test_loss: 1.3579, test_f1: 0.1365
 epoch: 2, train_loss: 1.2712, test_loss: 1.3567, test_f1: 0.1365
 epoch: 3, train_loss: 1.2584, test_loss: 1.3565, test_f1: 0.1365
 epoch: 4, train_loss: 1.2447, test_loss: 1.3499, test_f1: 0.1365
 epoch: 5, train_loss: 1.2295, test_loss: 1.3408, test_f1: 0.1492
 epoch: 6, train_loss: 1.2190, test_loss: 1.3336, test_f1: 0.2466
 epoch: 7, train_loss: 1.2073, test_loss: 1.3261, test_f1: 0.2521
 epoch: 8, train_loss: 1.2009, test_loss: 1.3170, test_f1: 0.2981
 epoch: 9, train_loss: 1.1971, test_loss: 1.3034, test_f1: 0.3301
 epoch: 10, train_loss: 1.1837, test_loss: 1.2905, test_f1: 0.3463
 epoch: 11, train_loss: 1.1792, test_loss: 1.2735, test_f1: 0.3511
 epoch: 12, train_loss: 1.1666, test_loss: 1.2580, test_f1: 0.3244
 epoch: 13, train_loss: 1.1586, test_loss: 1.2437, test_f1: 0.2991
 epoch: 14, train_loss: 1.1567, test_loss: 1.2273, test_f1: 0.2718
 epoch: 15, train_loss: 1.1492, test_loss: 1.2160, test_f1: 0.3131
 epoch: 16, train_loss: 1.1424, test_loss: 1.2086, test_f1: 0.2965
 epoch: 17, train_loss: 1.1375, test_loss: 1.2016, test_f1: 0.2907
 epoch: 18, train_loss: 1.1322, test_loss: 1.1955, test_f1: 0.2774
 epoch: 19, train_loss: 1.1244, test_loss: 1.1902, test_f1: 0.2774
 epoch: 20, train_loss: 1.1220, test_loss: 1.1851, test_f1: 0.2837
 epoch: 21, train_loss: 1.1146, test_loss: 1.1827, test_f1: 0.3017
 epoch: 22, train_loss: 1.1185, test_loss: 1.1810, test_f1: 0.2978
 epoch: 23, train_loss: 1.1052, test_loss: 1.1734, test_f1: 0.2927
 epoch: 24, train_loss: 1.1020, test_loss: 1.1691, test_f1: 0.3247
 epoch: 25, train_loss: 1.0988, test_loss: 1.1655, test_f1: 0.3291
 epoch: 26, train_loss: 1.0938, test_loss: 1.1623, test_f1: 0.3317
 epoch: 27, train_loss: 1.0876, test_loss: 1.1596, test_f1: 0.3420
 epoch: 28, train_loss: 1.0862, test_loss: 1.1554, test_f1: 0.3370
 epoch: 29, train_loss: 1.0813, test_loss: 1.1538, test_f1: 0.3369
 epoch: 30, train_loss: 1.0810, test_loss: 1.1506, test_f1: 0.3596
 epoch: 31, train_loss: 1.0797, test_loss: 1.1480, test_f1: 0.3447
 epoch: 32, train_loss: 1.0749, test_loss: 1.1491, test_f1: 0.3750
 epoch: 33, train_loss: 1.0661, test_loss: 1.1451, test_f1: 0.3981
 epoch: 34, train_loss: 1.0719, test_loss: 1.1427, test_f1: 0.4186
 epoch: 35, train_loss: 1.0596, test_loss: 1.1388, test_f1: 0.4129
 epoch: 36, train_loss: 1.0574, test_loss: 1.1379, test_f1: 0.4035
 epoch: 37, train_loss: 1.0506, test_loss: 1.1354, test_f1: 0.3954
 epoch: 38, train_loss: 1.0548, test_loss: 1.1322, test_f1: 0.4088
 epoch: 39, train_loss: 1.0458, test_loss: 1.1266, test_f1: 0.4292
 epoch: 40, train_loss: 1.0442, test_loss: 1.1261, test_f1: 0.4271
 epoch: 41, train_loss: 1.0354, test_loss: 1.1276, test_f1: 0.4191
 epoch: 42, train_loss: 1.0369, test_loss: 1.1175, test_f1: 0.4494
 epoch: 43, train_loss: 1.0311, test_loss: 1.1109, test_f1: 0.4742
 epoch: 44, train_loss: 1.0256, test_loss: 1.1111, test_f1: 0.4713
 epoch: 45, train_loss: 1.0267, test_loss: 1.1119, test_f1: 0.4669
 epoch: 46, train_loss: 1.0211, test_loss: 1.1085, test_f1: 0.4665
 epoch: 47, train_loss: 1.0179, test_loss: 1.0996, test_f1: 0.4528
 epoch: 48, train_loss: 1.0133, test_loss: 1.0958, test_f1: 0.4818
 epoch: 49, train_loss: 0.9994, test_loss: 1.0957, test_f1: 0.4864
 epoch: 50, train_loss: 1.0083, test_loss: 1.0899, test_f1: 0.4992
 epoch: 51, train_loss: 1.0025, test_loss: 1.0911, test_f1: 0.4962
 epoch: 52, train_loss: 0.9985, test_loss: 1.0873, test_f1: 0.4890
 epoch: 53, train_loss: 0.9936, test_loss: 1.0824, test_f1: 0.4958
 epoch: 54, train_loss: 0.9968, test_loss: 1.0804, test_f1: 0.5042
 epoch: 55, train_loss: 0.9947, test_loss: 1.0771, test_f1: 0.4945
 epoch: 56, train_loss: 0.9970, test_loss: 1.0779, test_f1: 0.4985
 epoch: 57, train_loss: 0.9853, test_loss: 1.0865, test_f1: 0.5035
 epoch: 58, train_loss: 0.9848, test_loss: 1.0881, test_f1: 0.4997
 epoch: 59, train_loss: 0.9813, test_loss: 1.0886, test_f1: 0.5003
 epoch: 60, train_loss: 0.9861, test_loss: 1.0771, test_f1: 0.4994
 epoch: 61, train_loss: 0.9768, test_loss: 1.0820, test_f1: 0.5004
 epoch: 62, train_loss: 0.9768, test_loss: 1.0797, test_f1: 0.5001
 epoch: 63, train_loss: 0.9706, test_loss: 1.0753, test_f1: 0.5006
 epoch: 64, train_loss: 0.9771, test_loss: 1.0802, test_f1: 0.5011
 epoch: 65, train_loss: 0.9736, test_loss: 1.0803, test_f1: 0.5058
 epoch: 66, train_loss: 0.9706, test_loss: 1.0738, test_f1: 0.5059
 epoch: 67, train_loss: 0.9722, test_loss: 1.0746, test_f1: 0.5056
 epoch: 68, train_loss: 0.9690, test_loss: 1.0775, test_f1: 0.5065
 epoch: 69, train_loss: 0.9658, test_loss: 1.0723, test_f1: 0.5110
 epoch: 70, train_loss: 0.9607, test_loss: 1.0660, test_f1: 0.5073
 epoch: 71, train_loss: 0.9592, test_loss: 1.0689, test_f1: 0.5147
 epoch: 72, train_loss: 0.9549, test_loss: 1.0704, test_f1: 0.4995
 epoch: 73, train_loss: 0.9548, test_loss: 1.0676, test_f1: 0.5063
 epoch: 74, train_loss: 0.9532, test_loss: 1.0593, test_f1: 0.5193
 epoch: 75, train_loss: 0.9467, test_loss: 1.0689, test_f1: 0.5145
 epoch: 76, train_loss: 0.9542, test_loss: 1.0769, test_f1: 0.5120
 epoch: 77, train_loss: 0.9456, test_loss: 1.0636, test_f1: 0.5107
 epoch: 78, train_loss: 0.9511, test_loss: 1.0667, test_f1: 0.4939
 epoch: 79, train_loss: 0.9434, test_loss: 1.0673, test_f1: 0.5117
 epoch: 80, train_loss: 0.9415, test_loss: 1.0616, test_f1: 0.5221
 epoch: 81, train_loss: 0.9344, test_loss: 1.0702, test_f1: 0.5264
 epoch: 82, train_loss: 0.9357, test_loss: 1.0631, test_f1: 0.5183
 epoch: 83, train_loss: 0.9430, test_loss: 1.0626, test_f1: 0.5202
 epoch: 84, train_loss: 0.9408, test_loss: 1.0685, test_f1: 0.5233
 epoch: 85, train_loss: 0.9354, test_loss: 1.0646, test_f1: 0.5258
 epoch: 86, train_loss: 0.9324, test_loss: 1.0606, test_f1: 0.5248
 epoch: 87, train_loss: 0.9324, test_loss: 1.0722, test_f1: 0.5175
 epoch: 88, train_loss: 0.9296, test_loss: 1.0597, test_f1: 0.5247
 epoch: 89, train_loss: 0.9284, test_loss: 1.0603, test_f1: 0.5316
 epoch: 90, train_loss: 0.9294, test_loss: 1.0640, test_f1: 0.5283
 epoch: 91, train_loss: 0.9196, test_loss: 1.0584, test_f1: 0.5252
 epoch: 92, train_loss: 0.9241, test_loss: 1.0551, test_f1: 0.5271
 epoch: 93, train_loss: 0.9176, test_loss: 1.0500, test_f1: 0.5290
 epoch: 94, train_loss: 0.9227, test_loss: 1.0558, test_f1: 0.5245
 epoch: 95, train_loss: 0.9164, test_loss: 1.0575, test_f1: 0.5303
 epoch: 96, train_loss: 0.9106, test_loss: 1.0620, test_f1: 0.5277
 epoch: 97, train_loss: 0.9153, test_loss: 1.0460, test_f1: 0.5307
 epoch: 98, train_loss: 0.9108, test_loss: 1.0556, test_f1: 0.5357
 epoch: 99, train_loss: 0.9128, test_loss: 1.0551, test_f1: 0.5351
##################ITERATION #3 ****************************************
 epoch: 0, train_loss: 1.2776, test_loss: 1.3581, test_f1: 0.2281
 epoch: 1, train_loss: 1.2371, test_loss: 1.3530, test_f1: 0.2281
 epoch: 2, train_loss: 1.2238, test_loss: 1.3501, test_f1: 0.2281
 epoch: 3, train_loss: 1.2060, test_loss: 1.3480, test_f1: 0.2281
 epoch: 4, train_loss: 1.1949, test_loss: 1.3444, test_f1: 0.2281
 epoch: 5, train_loss: 1.1895, test_loss: 1.3349, test_f1: 0.2281
 epoch: 6, train_loss: 1.1801, test_loss: 1.3204, test_f1: 0.2281
 epoch: 7, train_loss: 1.1732, test_loss: 1.2927, test_f1: 0.2281
 epoch: 8, train_loss: 1.1622, test_loss: 1.2594, test_f1: 0.2259
 epoch: 9, train_loss: 1.1506, test_loss: 1.2353, test_f1: 0.2259
 epoch: 10, train_loss: 1.1457, test_loss: 1.2215, test_f1: 0.2315
 epoch: 11, train_loss: 1.1428, test_loss: 1.2077, test_f1: 0.2315
 epoch: 12, train_loss: 1.1342, test_loss: 1.1984, test_f1: 0.2379
 epoch: 13, train_loss: 1.1337, test_loss: 1.1909, test_f1: 0.2434
 epoch: 14, train_loss: 1.1239, test_loss: 1.1859, test_f1: 0.2422
 epoch: 15, train_loss: 1.1243, test_loss: 1.1809, test_f1: 0.2516
 epoch: 16, train_loss: 1.1187, test_loss: 1.1782, test_f1: 0.2505
 epoch: 17, train_loss: 1.1120, test_loss: 1.1763, test_f1: 0.2535
 epoch: 18, train_loss: 1.1077, test_loss: 1.1747, test_f1: 0.2966
 epoch: 19, train_loss: 1.1045, test_loss: 1.1671, test_f1: 0.3252
 epoch: 20, train_loss: 1.1036, test_loss: 1.1616, test_f1: 0.3348
 epoch: 21, train_loss: 1.0936, test_loss: 1.1579, test_f1: 0.3647
 epoch: 22, train_loss: 1.0998, test_loss: 1.1541, test_f1: 0.3741
 epoch: 23, train_loss: 1.0865, test_loss: 1.1500, test_f1: 0.3741
 epoch: 24, train_loss: 1.0815, test_loss: 1.1463, test_f1: 0.3724
 epoch: 25, train_loss: 1.0821, test_loss: 1.1466, test_f1: 0.3724
 epoch: 26, train_loss: 1.0714, test_loss: 1.1484, test_f1: 0.3909
 epoch: 27, train_loss: 1.0662, test_loss: 1.1428, test_f1: 0.4080
 epoch: 28, train_loss: 1.0694, test_loss: 1.1477, test_f1: 0.4155
 epoch: 29, train_loss: 1.0666, test_loss: 1.1337, test_f1: 0.4289
 epoch: 30, train_loss: 1.0617, test_loss: 1.1300, test_f1: 0.4560
 epoch: 31, train_loss: 1.0517, test_loss: 1.1303, test_f1: 0.4449
 epoch: 32, train_loss: 1.0493, test_loss: 1.1281, test_f1: 0.4386
 epoch: 33, train_loss: 1.0454, test_loss: 1.1310, test_f1: 0.4469
 epoch: 34, train_loss: 1.0450, test_loss: 1.1184, test_f1: 0.4446
 epoch: 35, train_loss: 1.0443, test_loss: 1.1148, test_f1: 0.4478
 epoch: 36, train_loss: 1.0263, test_loss: 1.1088, test_f1: 0.4475
 epoch: 37, train_loss: 1.0360, test_loss: 1.1038, test_f1: 0.4517
 epoch: 38, train_loss: 1.0304, test_loss: 1.0999, test_f1: 0.4427
 epoch: 39, train_loss: 1.0217, test_loss: 1.1042, test_f1: 0.4556
 epoch: 40, train_loss: 1.0166, test_loss: 1.1108, test_f1: 0.4447
 epoch: 41, train_loss: 1.0233, test_loss: 1.1103, test_f1: 0.4406
 epoch: 42, train_loss: 1.0145, test_loss: 1.0943, test_f1: 0.4456
 epoch: 43, train_loss: 1.0084, test_loss: 1.0920, test_f1: 0.4611
 epoch: 44, train_loss: 1.0061, test_loss: 1.0886, test_f1: 0.4589
 epoch: 45, train_loss: 1.0041, test_loss: 1.0890, test_f1: 0.4743
 epoch: 46, train_loss: 0.9946, test_loss: 1.0808, test_f1: 0.4730
 epoch: 47, train_loss: 0.9898, test_loss: 1.0785, test_f1: 0.4872
 epoch: 48, train_loss: 0.9842, test_loss: 1.0817, test_f1: 0.4822
 epoch: 49, train_loss: 0.9877, test_loss: 1.0780, test_f1: 0.4851
 epoch: 50, train_loss: 0.9813, test_loss: 1.0698, test_f1: 0.4828
 epoch: 51, train_loss: 0.9775, test_loss: 1.0769, test_f1: 0.4924
 epoch: 52, train_loss: 0.9732, test_loss: 1.0813, test_f1: 0.4862
 epoch: 53, train_loss: 0.9686, test_loss: 1.0702, test_f1: 0.4866
 epoch: 54, train_loss: 0.9697, test_loss: 1.0621, test_f1: 0.4869
 epoch: 55, train_loss: 0.9640, test_loss: 1.0679, test_f1: 0.4909
 epoch: 56, train_loss: 0.9620, test_loss: 1.0643, test_f1: 0.4968
 epoch: 57, train_loss: 0.9647, test_loss: 1.0588, test_f1: 0.4978
 epoch: 58, train_loss: 0.9600, test_loss: 1.0612, test_f1: 0.4922
 epoch: 59, train_loss: 0.9550, test_loss: 1.0584, test_f1: 0.5051
 epoch: 60, train_loss: 0.9543, test_loss: 1.0576, test_f1: 0.4968
 epoch: 61, train_loss: 0.9581, test_loss: 1.0521, test_f1: 0.4996
 epoch: 62, train_loss: 0.9492, test_loss: 1.0511, test_f1: 0.4941
 epoch: 63, train_loss: 0.9445, test_loss: 1.0524, test_f1: 0.5038
 epoch: 64, train_loss: 0.9589, test_loss: 1.0573, test_f1: 0.5084
 epoch: 65, train_loss: 0.9484, test_loss: 1.0523, test_f1: 0.5022
 epoch: 66, train_loss: 0.9535, test_loss: 1.0611, test_f1: 0.5010
 epoch: 67, train_loss: 0.9463, test_loss: 1.0640, test_f1: 0.5107
 epoch: 68, train_loss: 0.9377, test_loss: 1.0622, test_f1: 0.5132
 epoch: 69, train_loss: 0.9386, test_loss: 1.0575, test_f1: 0.5238
 epoch: 70, train_loss: 0.9446, test_loss: 1.0467, test_f1: 0.5163
 epoch: 71, train_loss: 0.9439, test_loss: 1.0504, test_f1: 0.5218
 epoch: 72, train_loss: 0.9443, test_loss: 1.0445, test_f1: 0.5262
 epoch: 73, train_loss: 0.9365, test_loss: 1.0505, test_f1: 0.5149
 epoch: 74, train_loss: 0.9314, test_loss: 1.0490, test_f1: 0.5297
 epoch: 75, train_loss: 0.9185, test_loss: 1.0577, test_f1: 0.5237
 epoch: 76, train_loss: 0.9271, test_loss: 1.0510, test_f1: 0.5214
 epoch: 77, train_loss: 0.9282, test_loss: 1.0477, test_f1: 0.5234
 epoch: 78, train_loss: 0.9210, test_loss: 1.0485, test_f1: 0.5206
 epoch: 79, train_loss: 0.9191, test_loss: 1.0554, test_f1: 0.5230
 epoch: 80, train_loss: 0.9193, test_loss: 1.0627, test_f1: 0.5166
 epoch: 81, train_loss: 0.9166, test_loss: 1.0486, test_f1: 0.5166
 epoch: 82, train_loss: 0.9144, test_loss: 1.0382, test_f1: 0.5142
 epoch: 83, train_loss: 0.9257, test_loss: 1.0453, test_f1: 0.5275
 epoch: 84, train_loss: 0.9198, test_loss: 1.0522, test_f1: 0.5196
 epoch: 85, train_loss: 0.9052, test_loss: 1.0623, test_f1: 0.5166
 epoch: 86, train_loss: 0.8997, test_loss: 1.0689, test_f1: 0.5126
 epoch: 87, train_loss: 0.9138, test_loss: 1.0688, test_f1: 0.5143
 epoch: 88, train_loss: 0.9196, test_loss: 1.0373, test_f1: 0.5443
 epoch: 89, train_loss: 0.9159, test_loss: 1.0407, test_f1: 0.5353
 epoch: 90, train_loss: 0.9066, test_loss: 1.0433, test_f1: 0.5403
 epoch: 91, train_loss: 0.9057, test_loss: 1.0464, test_f1: 0.5398
 epoch: 92, train_loss: 0.8923, test_loss: 1.0490, test_f1: 0.5327
 epoch: 93, train_loss: 0.9026, test_loss: 1.0445, test_f1: 0.5426
 epoch: 94, train_loss: 0.9056, test_loss: 1.0350, test_f1: 0.5425
 epoch: 95, train_loss: 0.8910, test_loss: 1.0344, test_f1: 0.5422
 epoch: 96, train_loss: 0.8958, test_loss: 1.0436, test_f1: 0.5350
 epoch: 97, train_loss: 0.8976, test_loss: 1.0356, test_f1: 0.5421
 epoch: 98, train_loss: 0.8949, test_loss: 1.0445, test_f1: 0.5383
 epoch: 99, train_loss: 0.8970, test_loss: 1.0383, test_f1: 0.5490
##################ITERATION #4 ****************************************
 epoch: 0, train_loss: 1.2820, test_loss: 1.3486, test_f1: 0.2281
 epoch: 1, train_loss: 1.2410, test_loss: 1.3433, test_f1: 0.2652
 epoch: 2, train_loss: 1.2259, test_loss: 1.3355, test_f1: 0.2168
 epoch: 3, train_loss: 1.2130, test_loss: 1.3228, test_f1: 0.2887
 epoch: 4, train_loss: 1.1952, test_loss: 1.3179, test_f1: 0.2852
 epoch: 5, train_loss: 1.1838, test_loss: 1.3137, test_f1: 0.2642
 epoch: 6, train_loss: 1.1743, test_loss: 1.3094, test_f1: 0.2606
 epoch: 7, train_loss: 1.1654, test_loss: 1.2944, test_f1: 0.2721
 epoch: 8, train_loss: 1.1525, test_loss: 1.2649, test_f1: 0.2749
 epoch: 9, train_loss: 1.1450, test_loss: 1.2377, test_f1: 0.2797
 epoch: 10, train_loss: 1.1482, test_loss: 1.2194, test_f1: 0.3376
 epoch: 11, train_loss: 1.1342, test_loss: 1.2066, test_f1: 0.3433
 epoch: 12, train_loss: 1.1260, test_loss: 1.1930, test_f1: 0.3537
 epoch: 13, train_loss: 1.1162, test_loss: 1.1806, test_f1: 0.3692
 epoch: 14, train_loss: 1.1157, test_loss: 1.1731, test_f1: 0.3803
 epoch: 15, train_loss: 1.1100, test_loss: 1.1633, test_f1: 0.3879
 epoch: 16, train_loss: 1.1077, test_loss: 1.1586, test_f1: 0.3980
 epoch: 17, train_loss: 1.0958, test_loss: 1.1509, test_f1: 0.4116
 epoch: 18, train_loss: 1.0943, test_loss: 1.1482, test_f1: 0.4177
 epoch: 19, train_loss: 1.0905, test_loss: 1.1410, test_f1: 0.4308
 epoch: 20, train_loss: 1.0847, test_loss: 1.1339, test_f1: 0.4395
 epoch: 21, train_loss: 1.0800, test_loss: 1.1287, test_f1: 0.4503
 epoch: 22, train_loss: 1.0677, test_loss: 1.1258, test_f1: 0.4421
 epoch: 23, train_loss: 1.0645, test_loss: 1.1233, test_f1: 0.4463
 epoch: 24, train_loss: 1.0599, test_loss: 1.1211, test_f1: 0.4558
 epoch: 25, train_loss: 1.0585, test_loss: 1.1287, test_f1: 0.4417
 epoch: 26, train_loss: 1.0525, test_loss: 1.1223, test_f1: 0.4510
 epoch: 27, train_loss: 1.0441, test_loss: 1.1210, test_f1: 0.4654
 epoch: 28, train_loss: 1.0454, test_loss: 1.1139, test_f1: 0.4672
 epoch: 29, train_loss: 1.0377, test_loss: 1.1078, test_f1: 0.4704
 epoch: 30, train_loss: 1.0311, test_loss: 1.1008, test_f1: 0.4864
 epoch: 31, train_loss: 1.0300, test_loss: 1.0961, test_f1: 0.5031
 epoch: 32, train_loss: 1.0257, test_loss: 1.0976, test_f1: 0.5055
 epoch: 33, train_loss: 1.0178, test_loss: 1.1024, test_f1: 0.4821
 epoch: 34, train_loss: 1.0183, test_loss: 1.0953, test_f1: 0.4951
 epoch: 35, train_loss: 1.0225, test_loss: 1.0918, test_f1: 0.4990
 epoch: 36, train_loss: 1.0143, test_loss: 1.0962, test_f1: 0.4952
 epoch: 37, train_loss: 1.0120, test_loss: 1.0900, test_f1: 0.5051
 epoch: 38, train_loss: 1.0048, test_loss: 1.0880, test_f1: 0.5030
 epoch: 39, train_loss: 1.0064, test_loss: 1.0788, test_f1: 0.5172
 epoch: 40, train_loss: 0.9890, test_loss: 1.0773, test_f1: 0.5100
 epoch: 41, train_loss: 0.9980, test_loss: 1.0835, test_f1: 0.5041
 epoch: 42, train_loss: 0.9927, test_loss: 1.0794, test_f1: 0.4973
 epoch: 43, train_loss: 0.9918, test_loss: 1.0859, test_f1: 0.5095
 epoch: 44, train_loss: 0.9841, test_loss: 1.0976, test_f1: 0.5032
 epoch: 45, train_loss: 0.9913, test_loss: 1.0789, test_f1: 0.5057
 epoch: 46, train_loss: 0.9808, test_loss: 1.0623, test_f1: 0.5280
 epoch: 47, train_loss: 0.9801, test_loss: 1.0697, test_f1: 0.5134
 epoch: 48, train_loss: 0.9771, test_loss: 1.0907, test_f1: 0.5075
 epoch: 49, train_loss: 0.9656, test_loss: 1.0900, test_f1: 0.4978
 epoch: 50, train_loss: 0.9606, test_loss: 1.0760, test_f1: 0.5113
 epoch: 51, train_loss: 0.9608, test_loss: 1.0705, test_f1: 0.5040
 epoch: 52, train_loss: 0.9556, test_loss: 1.0691, test_f1: 0.5033
 epoch: 53, train_loss: 0.9529, test_loss: 1.0785, test_f1: 0.5014
 epoch: 54, train_loss: 0.9609, test_loss: 1.0723, test_f1: 0.5099
 epoch: 55, train_loss: 0.9482, test_loss: 1.0732, test_f1: 0.5132
 epoch: 56, train_loss: 0.9530, test_loss: 1.0726, test_f1: 0.5170
 epoch: 57, train_loss: 0.9465, test_loss: 1.0682, test_f1: 0.5149
 epoch: 58, train_loss: 0.9508, test_loss: 1.0698, test_f1: 0.5194
 epoch: 59, train_loss: 0.9537, test_loss: 1.0677, test_f1: 0.5159
 epoch: 60, train_loss: 0.9448, test_loss: 1.0627, test_f1: 0.5158
 epoch: 61, train_loss: 0.9457, test_loss: 1.0619, test_f1: 0.5080
 epoch: 62, train_loss: 0.9537, test_loss: 1.0549, test_f1: 0.5125
 epoch: 63, train_loss: 0.9420, test_loss: 1.0606, test_f1: 0.5034
 epoch: 64, train_loss: 0.9456, test_loss: 1.0719, test_f1: 0.5035
 epoch: 65, train_loss: 0.9421, test_loss: 1.0828, test_f1: 0.4962
 epoch: 66, train_loss: 0.9448, test_loss: 1.0812, test_f1: 0.4993
 epoch: 67, train_loss: 0.9400, test_loss: 1.0836, test_f1: 0.5094
 epoch: 68, train_loss: 0.9337, test_loss: 1.0845, test_f1: 0.4988
 epoch: 69, train_loss: 0.9361, test_loss: 1.0848, test_f1: 0.5036
 epoch: 70, train_loss: 0.9389, test_loss: 1.0821, test_f1: 0.5063
 epoch: 71, train_loss: 0.9353, test_loss: 1.0825, test_f1: 0.5064
 epoch: 72, train_loss: 0.9302, test_loss: 1.0929, test_f1: 0.5093
 epoch: 73, train_loss: 0.9260, test_loss: 1.0927, test_f1: 0.5070
 epoch: 74, train_loss: 0.9174, test_loss: 1.0790, test_f1: 0.5101
 epoch: 75, train_loss: 0.9256, test_loss: 1.0707, test_f1: 0.5178
 epoch: 76, train_loss: 0.9297, test_loss: 1.0679, test_f1: 0.5069
 epoch: 77, train_loss: 0.9192, test_loss: 1.0696, test_f1: 0.4989
 epoch: 78, train_loss: 0.9165, test_loss: 1.0918, test_f1: 0.4999
 epoch: 79, train_loss: 0.9204, test_loss: 1.0842, test_f1: 0.4924
 epoch: 80, train_loss: 0.9145, test_loss: 1.0871, test_f1: 0.5103
 epoch: 81, train_loss: 0.9189, test_loss: 1.0783, test_f1: 0.5046
 epoch: 82, train_loss: 0.9172, test_loss: 1.0806, test_f1: 0.5077
 epoch: 83, train_loss: 0.9176, test_loss: 1.0727, test_f1: 0.5038
 epoch: 84, train_loss: 0.9159, test_loss: 1.0835, test_f1: 0.4919
 epoch: 85, train_loss: 0.9088, test_loss: 1.0612, test_f1: 0.5047
 epoch: 86, train_loss: 0.9090, test_loss: 1.0665, test_f1: 0.4933
 epoch: 87, train_loss: 0.9000, test_loss: 1.0741, test_f1: 0.4942
 epoch: 88, train_loss: 0.9101, test_loss: 1.0765, test_f1: 0.5024
 epoch: 89, train_loss: 0.9070, test_loss: 1.0736, test_f1: 0.5016
 epoch: 90, train_loss: 0.9062, test_loss: 1.0790, test_f1: 0.5142
 epoch: 91, train_loss: 0.9071, test_loss: 1.0920, test_f1: 0.5061
 epoch: 92, train_loss: 0.8964, test_loss: 1.0816, test_f1: 0.4991
 epoch: 93, train_loss: 0.8960, test_loss: 1.0759, test_f1: 0.5073
 epoch: 94, train_loss: 0.8900, test_loss: 1.0888, test_f1: 0.5104
 epoch: 95, train_loss: 0.8914, test_loss: 1.0977, test_f1: 0.5000
 epoch: 96, train_loss: 0.8943, test_loss: 1.0890, test_f1: 0.4974
 epoch: 97, train_loss: 0.8971, test_loss: 1.0808, test_f1: 0.5122
 epoch: 98, train_loss: 0.8879, test_loss: 1.0939, test_f1: 0.5102
 epoch: 99, train_loss: 0.8941, test_loss: 1.0975, test_f1: 0.5069
##################ITERATION #5 ****************************************
 epoch: 0, train_loss: 1.2856, test_loss: 1.3523, test_f1: 0.2281
 epoch: 1, train_loss: 1.2410, test_loss: 1.3505, test_f1: 0.2281
 epoch: 2, train_loss: 1.2259, test_loss: 1.3472, test_f1: 0.2281
 epoch: 3, train_loss: 1.2132, test_loss: 1.3449, test_f1: 0.2281
 epoch: 4, train_loss: 1.1994, test_loss: 1.3397, test_f1: 0.2281
 epoch: 5, train_loss: 1.1918, test_loss: 1.3298, test_f1: 0.2281
 epoch: 6, train_loss: 1.1787, test_loss: 1.3196, test_f1: 0.2336
 epoch: 7, train_loss: 1.1709, test_loss: 1.2961, test_f1: 0.2392
 epoch: 8, train_loss: 1.1555, test_loss: 1.2708, test_f1: 0.2585
 epoch: 9, train_loss: 1.1533, test_loss: 1.2496, test_f1: 0.2570
 epoch: 10, train_loss: 1.1471, test_loss: 1.2319, test_f1: 0.2556
 epoch: 11, train_loss: 1.1355, test_loss: 1.2140, test_f1: 0.3144
 epoch: 12, train_loss: 1.1254, test_loss: 1.2007, test_f1: 0.3252
 epoch: 13, train_loss: 1.1246, test_loss: 1.1947, test_f1: 0.3478
 epoch: 14, train_loss: 1.1164, test_loss: 1.1869, test_f1: 0.3818
 epoch: 15, train_loss: 1.1090, test_loss: 1.1821, test_f1: 0.3793
 epoch: 16, train_loss: 1.1067, test_loss: 1.1747, test_f1: 0.3766
 epoch: 17, train_loss: 1.0982, test_loss: 1.1686, test_f1: 0.4007
 epoch: 18, train_loss: 1.0885, test_loss: 1.1666, test_f1: 0.4027
 epoch: 19, train_loss: 1.0905, test_loss: 1.1622, test_f1: 0.4061
 epoch: 20, train_loss: 1.0844, test_loss: 1.1579, test_f1: 0.4049
 epoch: 21, train_loss: 1.0762, test_loss: 1.1531, test_f1: 0.4199
 epoch: 22, train_loss: 1.0700, test_loss: 1.1462, test_f1: 0.4269
 epoch: 23, train_loss: 1.0610, test_loss: 1.1413, test_f1: 0.4305
 epoch: 24, train_loss: 1.0522, test_loss: 1.1403, test_f1: 0.4284
 epoch: 25, train_loss: 1.0475, test_loss: 1.1396, test_f1: 0.4340
 epoch: 26, train_loss: 1.0501, test_loss: 1.1347, test_f1: 0.4385
 epoch: 27, train_loss: 1.0434, test_loss: 1.1362, test_f1: 0.4434
 epoch: 28, train_loss: 1.0399, test_loss: 1.1315, test_f1: 0.4587
 epoch: 29, train_loss: 1.0328, test_loss: 1.1255, test_f1: 0.4635
 epoch: 30, train_loss: 1.0345, test_loss: 1.1184, test_f1: 0.4696
 epoch: 31, train_loss: 1.0232, test_loss: 1.1139, test_f1: 0.4615
 epoch: 32, train_loss: 1.0218, test_loss: 1.1094, test_f1: 0.4653
 epoch: 33, train_loss: 1.0186, test_loss: 1.1109, test_f1: 0.4633
 epoch: 34, train_loss: 1.0083, test_loss: 1.1090, test_f1: 0.4736
 epoch: 35, train_loss: 1.0131, test_loss: 1.1044, test_f1: 0.4909
 epoch: 36, train_loss: 0.9997, test_loss: 1.1016, test_f1: 0.4849
 epoch: 37, train_loss: 0.9962, test_loss: 1.1007, test_f1: 0.4730
 epoch: 38, train_loss: 0.9966, test_loss: 1.0984, test_f1: 0.4897
 epoch: 39, train_loss: 0.9908, test_loss: 1.0943, test_f1: 0.4911
 epoch: 40, train_loss: 0.9848, test_loss: 1.0972, test_f1: 0.4896
 epoch: 41, train_loss: 0.9759, test_loss: 1.0907, test_f1: 0.5015
 epoch: 42, train_loss: 0.9812, test_loss: 1.0894, test_f1: 0.4932
 epoch: 43, train_loss: 0.9875, test_loss: 1.0863, test_f1: 0.4914
 epoch: 44, train_loss: 0.9771, test_loss: 1.0814, test_f1: 0.4933
 epoch: 45, train_loss: 0.9676, test_loss: 1.0720, test_f1: 0.4854
 epoch: 46, train_loss: 0.9642, test_loss: 1.0705, test_f1: 0.4906
 epoch: 47, train_loss: 0.9671, test_loss: 1.0709, test_f1: 0.5047
 epoch: 48, train_loss: 0.9632, test_loss: 1.0717, test_f1: 0.4975
 epoch: 49, train_loss: 0.9550, test_loss: 1.0809, test_f1: 0.4931
 epoch: 50, train_loss: 0.9584, test_loss: 1.0774, test_f1: 0.5012
 epoch: 51, train_loss: 0.9510, test_loss: 1.0842, test_f1: 0.5027
 epoch: 52, train_loss: 0.9439, test_loss: 1.0913, test_f1: 0.5009
 epoch: 53, train_loss: 0.9449, test_loss: 1.0906, test_f1: 0.5012
 epoch: 54, train_loss: 0.9494, test_loss: 1.0884, test_f1: 0.5080
 epoch: 55, train_loss: 0.9482, test_loss: 1.0902, test_f1: 0.5083
 epoch: 56, train_loss: 0.9388, test_loss: 1.0882, test_f1: 0.5077
 epoch: 57, train_loss: 0.9371, test_loss: 1.0838, test_f1: 0.5234
 epoch: 58, train_loss: 0.9417, test_loss: 1.0854, test_f1: 0.5175
 epoch: 59, train_loss: 0.9308, test_loss: 1.0776, test_f1: 0.5213
 epoch: 60, train_loss: 0.9332, test_loss: 1.0810, test_f1: 0.5113
 epoch: 61, train_loss: 0.9361, test_loss: 1.0907, test_f1: 0.5274
 epoch: 62, train_loss: 0.9305, test_loss: 1.0836, test_f1: 0.5344
 epoch: 63, train_loss: 0.9322, test_loss: 1.0838, test_f1: 0.5244
 epoch: 64, train_loss: 0.9234, test_loss: 1.0795, test_f1: 0.5324
 epoch: 65, train_loss: 0.9278, test_loss: 1.0814, test_f1: 0.5236
 epoch: 66, train_loss: 0.9175, test_loss: 1.0805, test_f1: 0.5278
 epoch: 67, train_loss: 0.9254, test_loss: 1.0847, test_f1: 0.5257
 epoch: 68, train_loss: 0.9212, test_loss: 1.0880, test_f1: 0.5233
 epoch: 69, train_loss: 0.9183, test_loss: 1.0810, test_f1: 0.5235
 epoch: 70, train_loss: 0.9149, test_loss: 1.0701, test_f1: 0.5205
 epoch: 71, train_loss: 0.9120, test_loss: 1.0704, test_f1: 0.5258
 epoch: 72, train_loss: 0.9154, test_loss: 1.0835, test_f1: 0.5305
 epoch: 73, train_loss: 0.9197, test_loss: 1.0909, test_f1: 0.5205
 epoch: 74, train_loss: 0.9097, test_loss: 1.0990, test_f1: 0.5215
 epoch: 75, train_loss: 0.9087, test_loss: 1.0923, test_f1: 0.5216
 epoch: 76, train_loss: 0.9069, test_loss: 1.0845, test_f1: 0.5159
 epoch: 77, train_loss: 0.9079, test_loss: 1.0805, test_f1: 0.5196
 epoch: 78, train_loss: 0.9011, test_loss: 1.0718, test_f1: 0.5208
 epoch: 79, train_loss: 0.8973, test_loss: 1.0729, test_f1: 0.5175
 epoch: 80, train_loss: 0.9045, test_loss: 1.0745, test_f1: 0.5127
 epoch: 81, train_loss: 0.8923, test_loss: 1.0783, test_f1: 0.5204
 epoch: 82, train_loss: 0.9150, test_loss: 1.0807, test_f1: 0.5137
 epoch: 83, train_loss: 0.8978, test_loss: 1.0820, test_f1: 0.5224
 epoch: 84, train_loss: 0.8994, test_loss: 1.0824, test_f1: 0.5234
 epoch: 85, train_loss: 0.8961, test_loss: 1.0741, test_f1: 0.5228
 epoch: 86, train_loss: 0.8909, test_loss: 1.0697, test_f1: 0.5068
 epoch: 87, train_loss: 0.8972, test_loss: 1.0631, test_f1: 0.5091
 epoch: 88, train_loss: 0.8923, test_loss: 1.0739, test_f1: 0.5233
 epoch: 89, train_loss: 0.8923, test_loss: 1.0830, test_f1: 0.5236
 epoch: 90, train_loss: 0.8909, test_loss: 1.0944, test_f1: 0.5167
 epoch: 91, train_loss: 0.8846, test_loss: 1.0837, test_f1: 0.5274
 epoch: 92, train_loss: 0.8828, test_loss: 1.0712, test_f1: 0.5266
 epoch: 93, train_loss: 0.8881, test_loss: 1.0780, test_f1: 0.5269
 epoch: 94, train_loss: 0.8905, test_loss: 1.0819, test_f1: 0.5269
 epoch: 95, train_loss: 0.8859, test_loss: 1.0719, test_f1: 0.5196
 epoch: 96, train_loss: 0.8860, test_loss: 1.0729, test_f1: 0.5170
 epoch: 97, train_loss: 0.8747, test_loss: 1.0867, test_f1: 0.5166
 epoch: 98, train_loss: 0.8792, test_loss: 1.1043, test_f1: 0.5106
 epoch: 99, train_loss: 0.8717, test_loss: 1.1153, test_f1: 0.5108
##################ITERATION #6 ****************************************
 epoch: 0, train_loss: 1.2679, test_loss: 1.3728, test_f1: 0.2281
 epoch: 1, train_loss: 1.2091, test_loss: 1.3602, test_f1: 0.2281
 epoch: 2, train_loss: 1.1920, test_loss: 1.3558, test_f1: 0.2281
 epoch: 3, train_loss: 1.1796, test_loss: 1.3479, test_f1: 0.2281
 epoch: 4, train_loss: 1.1584, test_loss: 1.3375, test_f1: 0.2929
 epoch: 5, train_loss: 1.1501, test_loss: 1.3182, test_f1: 0.2949
 epoch: 6, train_loss: 1.1379, test_loss: 1.2895, test_f1: 0.2992
 epoch: 7, train_loss: 1.1306, test_loss: 1.2750, test_f1: 0.3027
 epoch: 8, train_loss: 1.1244, test_loss: 1.2541, test_f1: 0.3193
 epoch: 9, train_loss: 1.1175, test_loss: 1.2282, test_f1: 0.3529
 epoch: 10, train_loss: 1.1044, test_loss: 1.2016, test_f1: 0.3991
 epoch: 11, train_loss: 1.1050, test_loss: 1.1850, test_f1: 0.4067
 epoch: 12, train_loss: 1.0939, test_loss: 1.1729, test_f1: 0.4121
 epoch: 13, train_loss: 1.0896, test_loss: 1.1639, test_f1: 0.4197
 epoch: 14, train_loss: 1.0812, test_loss: 1.1623, test_f1: 0.4313
 epoch: 15, train_loss: 1.0815, test_loss: 1.1573, test_f1: 0.4330
 epoch: 16, train_loss: 1.0690, test_loss: 1.1528, test_f1: 0.4228
 epoch: 17, train_loss: 1.0616, test_loss: 1.1483, test_f1: 0.4609
 epoch: 18, train_loss: 1.0548, test_loss: 1.1461, test_f1: 0.4527
 epoch: 19, train_loss: 1.0541, test_loss: 1.1448, test_f1: 0.4687
 epoch: 20, train_loss: 1.0569, test_loss: 1.1393, test_f1: 0.4705
 epoch: 21, train_loss: 1.0411, test_loss: 1.1357, test_f1: 0.4721
 epoch: 22, train_loss: 1.0453, test_loss: 1.1348, test_f1: 0.4697
 epoch: 23, train_loss: 1.0316, test_loss: 1.1344, test_f1: 0.4669
 epoch: 24, train_loss: 1.0233, test_loss: 1.1324, test_f1: 0.4714
 epoch: 25, train_loss: 1.0259, test_loss: 1.1291, test_f1: 0.4764
 epoch: 26, train_loss: 1.0137, test_loss: 1.1265, test_f1: 0.4705
 epoch: 27, train_loss: 1.0128, test_loss: 1.1178, test_f1: 0.4798
 epoch: 28, train_loss: 1.0045, test_loss: 1.1124, test_f1: 0.4846
 epoch: 29, train_loss: 1.0034, test_loss: 1.1132, test_f1: 0.4866
 epoch: 30, train_loss: 1.0078, test_loss: 1.1115, test_f1: 0.4856
 epoch: 31, train_loss: 1.0046, test_loss: 1.1159, test_f1: 0.4911
 epoch: 32, train_loss: 1.0014, test_loss: 1.1084, test_f1: 0.4761
 epoch: 33, train_loss: 0.9938, test_loss: 1.1060, test_f1: 0.4755
 epoch: 34, train_loss: 0.9845, test_loss: 1.1028, test_f1: 0.4797
 epoch: 35, train_loss: 0.9822, test_loss: 1.1019, test_f1: 0.5043
 epoch: 36, train_loss: 0.9865, test_loss: 1.1029, test_f1: 0.5033
 epoch: 37, train_loss: 0.9772, test_loss: 1.0966, test_f1: 0.5124
 epoch: 38, train_loss: 0.9737, test_loss: 1.0863, test_f1: 0.5227
 epoch: 39, train_loss: 0.9620, test_loss: 1.0905, test_f1: 0.5143
 epoch: 40, train_loss: 0.9605, test_loss: 1.0948, test_f1: 0.5092
 epoch: 41, train_loss: 0.9580, test_loss: 1.0989, test_f1: 0.5187
 epoch: 42, train_loss: 0.9523, test_loss: 1.0831, test_f1: 0.5225
 epoch: 43, train_loss: 0.9497, test_loss: 1.0794, test_f1: 0.5235
 epoch: 44, train_loss: 0.9456, test_loss: 1.0736, test_f1: 0.5306
 epoch: 45, train_loss: 0.9437, test_loss: 1.0782, test_f1: 0.5327
 epoch: 46, train_loss: 0.9515, test_loss: 1.0915, test_f1: 0.5164
 epoch: 47, train_loss: 0.9356, test_loss: 1.0893, test_f1: 0.5060
 epoch: 48, train_loss: 0.9467, test_loss: 1.0875, test_f1: 0.5136
 epoch: 49, train_loss: 0.9317, test_loss: 1.0827, test_f1: 0.5344
 epoch: 50, train_loss: 0.9374, test_loss: 1.0810, test_f1: 0.5293
 epoch: 51, train_loss: 0.9279, test_loss: 1.0793, test_f1: 0.5204
 epoch: 52, train_loss: 0.9312, test_loss: 1.0820, test_f1: 0.5198
 epoch: 53, train_loss: 0.9259, test_loss: 1.0793, test_f1: 0.5191
 epoch: 54, train_loss: 0.9349, test_loss: 1.0735, test_f1: 0.5248
 epoch: 55, train_loss: 0.9275, test_loss: 1.0764, test_f1: 0.5313
 epoch: 56, train_loss: 0.9208, test_loss: 1.0821, test_f1: 0.5260
 epoch: 57, train_loss: 0.9108, test_loss: 1.0707, test_f1: 0.5306
 epoch: 58, train_loss: 0.9085, test_loss: 1.0645, test_f1: 0.5339
 epoch: 59, train_loss: 0.9253, test_loss: 1.0631, test_f1: 0.5279
 epoch: 60, train_loss: 0.9128, test_loss: 1.0707, test_f1: 0.5276
 epoch: 61, train_loss: 0.9239, test_loss: 1.0695, test_f1: 0.5332
 epoch: 62, train_loss: 0.9133, test_loss: 1.0750, test_f1: 0.5277
 epoch: 63, train_loss: 0.9128, test_loss: 1.0754, test_f1: 0.5219
 epoch: 64, train_loss: 0.8944, test_loss: 1.0846, test_f1: 0.5113
 epoch: 65, train_loss: 0.9007, test_loss: 1.0833, test_f1: 0.5255
 epoch: 66, train_loss: 0.9079, test_loss: 1.0717, test_f1: 0.5330
 epoch: 67, train_loss: 0.9116, test_loss: 1.0711, test_f1: 0.5285
 epoch: 68, train_loss: 0.9063, test_loss: 1.0746, test_f1: 0.5396
 epoch: 69, train_loss: 0.9026, test_loss: 1.0679, test_f1: 0.5262
 epoch: 70, train_loss: 0.9054, test_loss: 1.0608, test_f1: 0.5243
 epoch: 71, train_loss: 0.9013, test_loss: 1.0578, test_f1: 0.5234
 epoch: 72, train_loss: 0.8971, test_loss: 1.0679, test_f1: 0.5092
 epoch: 73, train_loss: 0.8975, test_loss: 1.0668, test_f1: 0.5155
 epoch: 74, train_loss: 0.8991, test_loss: 1.0678, test_f1: 0.5283
 epoch: 75, train_loss: 0.9033, test_loss: 1.0742, test_f1: 0.5256
 epoch: 76, train_loss: 0.8918, test_loss: 1.0639, test_f1: 0.5300
 epoch: 77, train_loss: 0.8871, test_loss: 1.0654, test_f1: 0.5237
 epoch: 78, train_loss: 0.8955, test_loss: 1.0644, test_f1: 0.5237
 epoch: 79, train_loss: 0.8878, test_loss: 1.0614, test_f1: 0.5187
 epoch: 80, train_loss: 0.8937, test_loss: 1.0629, test_f1: 0.5157
 epoch: 81, train_loss: 0.8906, test_loss: 1.0734, test_f1: 0.5344
 epoch: 82, train_loss: 0.8794, test_loss: 1.0614, test_f1: 0.5469
 epoch: 83, train_loss: 0.8949, test_loss: 1.0616, test_f1: 0.5446
 epoch: 84, train_loss: 0.8893, test_loss: 1.0556, test_f1: 0.5561
 epoch: 85, train_loss: 0.8907, test_loss: 1.0635, test_f1: 0.5419
 epoch: 86, train_loss: 0.8826, test_loss: 1.0689, test_f1: 0.5418
 epoch: 87, train_loss: 0.8863, test_loss: 1.0665, test_f1: 0.5420
 epoch: 88, train_loss: 0.8745, test_loss: 1.0549, test_f1: 0.5469
 epoch: 89, train_loss: 0.8753, test_loss: 1.0543, test_f1: 0.5452
 epoch: 90, train_loss: 0.8795, test_loss: 1.0527, test_f1: 0.5345
 epoch: 91, train_loss: 0.8740, test_loss: 1.0441, test_f1: 0.5447
 epoch: 92, train_loss: 0.8813, test_loss: 1.0387, test_f1: 0.5535
 epoch: 93, train_loss: 0.8825, test_loss: 1.0436, test_f1: 0.5467
 epoch: 94, train_loss: 0.8757, test_loss: 1.0588, test_f1: 0.5352
 epoch: 95, train_loss: 0.8666, test_loss: 1.0612, test_f1: 0.5473
 epoch: 96, train_loss: 0.8632, test_loss: 1.0619, test_f1: 0.5415
 epoch: 97, train_loss: 0.8734, test_loss: 1.0695, test_f1: 0.5255
 epoch: 98, train_loss: 0.8663, test_loss: 1.0651, test_f1: 0.5336
 epoch: 99, train_loss: 0.8742, test_loss: 1.0885, test_f1: 0.5232
##################ITERATION #7 ****************************************
 epoch: 0, train_loss: 1.2542, test_loss: 1.3576, test_f1: 0.2281
 epoch: 1, train_loss: 1.2120, test_loss: 1.3317, test_f1: 0.2281
 epoch: 2, train_loss: 1.1933, test_loss: 1.3084, test_f1: 0.2281
 epoch: 3, train_loss: 1.1738, test_loss: 1.2899, test_f1: 0.2281
 epoch: 4, train_loss: 1.1661, test_loss: 1.2853, test_f1: 0.2441
 epoch: 5, train_loss: 1.1572, test_loss: 1.3038, test_f1: 0.2803
 epoch: 6, train_loss: 1.1463, test_loss: 1.3023, test_f1: 0.2812
 epoch: 7, train_loss: 1.1246, test_loss: 1.2921, test_f1: 0.2703
 epoch: 8, train_loss: 1.1242, test_loss: 1.2725, test_f1: 0.2715
 epoch: 9, train_loss: 1.1128, test_loss: 1.2618, test_f1: 0.2999
 epoch: 10, train_loss: 1.1133, test_loss: 1.2453, test_f1: 0.3342
 epoch: 11, train_loss: 1.1015, test_loss: 1.2138, test_f1: 0.4083
 epoch: 12, train_loss: 1.0939, test_loss: 1.1927, test_f1: 0.4087
 epoch: 13, train_loss: 1.0918, test_loss: 1.1790, test_f1: 0.4261
 epoch: 14, train_loss: 1.0877, test_loss: 1.1673, test_f1: 0.4388
 epoch: 15, train_loss: 1.0862, test_loss: 1.1614, test_f1: 0.4432
 epoch: 16, train_loss: 1.0829, test_loss: 1.1579, test_f1: 0.4403
 epoch: 17, train_loss: 1.0742, test_loss: 1.1545, test_f1: 0.4391
 epoch: 18, train_loss: 1.0644, test_loss: 1.1523, test_f1: 0.4348
 epoch: 19, train_loss: 1.0602, test_loss: 1.1520, test_f1: 0.4376
 epoch: 20, train_loss: 1.0584, test_loss: 1.1470, test_f1: 0.4229
 epoch: 21, train_loss: 1.0486, test_loss: 1.1456, test_f1: 0.4304
 epoch: 22, train_loss: 1.0391, test_loss: 1.1405, test_f1: 0.4304
 epoch: 23, train_loss: 1.0360, test_loss: 1.1320, test_f1: 0.4305
 epoch: 24, train_loss: 1.0345, test_loss: 1.1272, test_f1: 0.4570
 epoch: 25, train_loss: 1.0296, test_loss: 1.1233, test_f1: 0.4471
 epoch: 26, train_loss: 1.0318, test_loss: 1.1236, test_f1: 0.4524
 epoch: 27, train_loss: 1.0285, test_loss: 1.1194, test_f1: 0.4700
 epoch: 28, train_loss: 1.0209, test_loss: 1.1214, test_f1: 0.4720
 epoch: 29, train_loss: 1.0131, test_loss: 1.1175, test_f1: 0.4590
 epoch: 30, train_loss: 1.0094, test_loss: 1.1132, test_f1: 0.4513
 epoch: 31, train_loss: 1.0046, test_loss: 1.1085, test_f1: 0.4674
 epoch: 32, train_loss: 1.0047, test_loss: 1.1017, test_f1: 0.4628
 epoch: 33, train_loss: 1.0031, test_loss: 1.1030, test_f1: 0.4543
 epoch: 34, train_loss: 0.9886, test_loss: 1.1009, test_f1: 0.4545
 epoch: 35, train_loss: 0.9795, test_loss: 1.0956, test_f1: 0.4742
 epoch: 36, train_loss: 0.9883, test_loss: 1.0914, test_f1: 0.4882
 epoch: 37, train_loss: 0.9828, test_loss: 1.0904, test_f1: 0.4909
 epoch: 38, train_loss: 0.9784, test_loss: 1.0866, test_f1: 0.5046
 epoch: 39, train_loss: 0.9702, test_loss: 1.0902, test_f1: 0.4815
 epoch: 40, train_loss: 0.9699, test_loss: 1.0890, test_f1: 0.4881
 epoch: 41, train_loss: 0.9635, test_loss: 1.0880, test_f1: 0.4787
 epoch: 42, train_loss: 0.9673, test_loss: 1.0869, test_f1: 0.4821
 epoch: 43, train_loss: 0.9673, test_loss: 1.0818, test_f1: 0.4858
 epoch: 44, train_loss: 0.9543, test_loss: 1.0776, test_f1: 0.4911
 epoch: 45, train_loss: 0.9577, test_loss: 1.0616, test_f1: 0.4996
 epoch: 46, train_loss: 0.9552, test_loss: 1.0615, test_f1: 0.5182
 epoch: 47, train_loss: 0.9528, test_loss: 1.0666, test_f1: 0.5129
 epoch: 48, train_loss: 0.9461, test_loss: 1.0674, test_f1: 0.4994
 epoch: 49, train_loss: 0.9423, test_loss: 1.0601, test_f1: 0.5187
 epoch: 50, train_loss: 0.9410, test_loss: 1.0526, test_f1: 0.5132
 epoch: 51, train_loss: 0.9336, test_loss: 1.0535, test_f1: 0.5103
 epoch: 52, train_loss: 0.9397, test_loss: 1.0510, test_f1: 0.5149
 epoch: 53, train_loss: 0.9301, test_loss: 1.0549, test_f1: 0.5059
 epoch: 54, train_loss: 0.9322, test_loss: 1.0532, test_f1: 0.5111
 epoch: 55, train_loss: 0.9422, test_loss: 1.0536, test_f1: 0.5183
 epoch: 56, train_loss: 0.9328, test_loss: 1.0476, test_f1: 0.5133
 epoch: 57, train_loss: 0.9151, test_loss: 1.0475, test_f1: 0.5129
 epoch: 58, train_loss: 0.9299, test_loss: 1.0451, test_f1: 0.5093
 epoch: 59, train_loss: 0.9327, test_loss: 1.0485, test_f1: 0.5151
 epoch: 60, train_loss: 0.9204, test_loss: 1.0506, test_f1: 0.5003
 epoch: 61, train_loss: 0.9159, test_loss: 1.0517, test_f1: 0.5139
 epoch: 62, train_loss: 0.9286, test_loss: 1.0498, test_f1: 0.5146
 epoch: 63, train_loss: 0.9221, test_loss: 1.0524, test_f1: 0.5102
 epoch: 64, train_loss: 0.9178, test_loss: 1.0553, test_f1: 0.5187
 epoch: 65, train_loss: 0.9224, test_loss: 1.0504, test_f1: 0.5113
 epoch: 66, train_loss: 0.9156, test_loss: 1.0435, test_f1: 0.5171
 epoch: 67, train_loss: 0.9028, test_loss: 1.0435, test_f1: 0.5189
 epoch: 68, train_loss: 0.9176, test_loss: 1.0438, test_f1: 0.5194
 epoch: 69, train_loss: 0.9116, test_loss: 1.0370, test_f1: 0.5222
 epoch: 70, train_loss: 0.9137, test_loss: 1.0454, test_f1: 0.5228
 epoch: 71, train_loss: 0.9093, test_loss: 1.0458, test_f1: 0.5329
 epoch: 72, train_loss: 0.9093, test_loss: 1.0494, test_f1: 0.5260
 epoch: 73, train_loss: 0.9105, test_loss: 1.0498, test_f1: 0.5285
 epoch: 74, train_loss: 0.9016, test_loss: 1.0406, test_f1: 0.5331
 epoch: 75, train_loss: 0.9003, test_loss: 1.0438, test_f1: 0.5341
 epoch: 76, train_loss: 0.8987, test_loss: 1.0480, test_f1: 0.5159
 epoch: 77, train_loss: 0.9013, test_loss: 1.0486, test_f1: 0.5184
 epoch: 78, train_loss: 0.8996, test_loss: 1.0565, test_f1: 0.5115
 epoch: 79, train_loss: 0.8890, test_loss: 1.0596, test_f1: 0.5152
 epoch: 80, train_loss: 0.8870, test_loss: 1.0577, test_f1: 0.5071
 epoch: 81, train_loss: 0.8909, test_loss: 1.0549, test_f1: 0.5242
 epoch: 82, train_loss: 0.8960, test_loss: 1.0546, test_f1: 0.5350
 epoch: 83, train_loss: 0.8864, test_loss: 1.0409, test_f1: 0.5253
 epoch: 84, train_loss: 0.8820, test_loss: 1.0401, test_f1: 0.5165
 epoch: 85, train_loss: 0.8831, test_loss: 1.0447, test_f1: 0.5358
 epoch: 86, train_loss: 0.8876, test_loss: 1.0529, test_f1: 0.5370
 epoch: 87, train_loss: 0.8909, test_loss: 1.0407, test_f1: 0.5388
 epoch: 88, train_loss: 0.8873, test_loss: 1.0407, test_f1: 0.5469
 epoch: 89, train_loss: 0.8867, test_loss: 1.0483, test_f1: 0.5451
 epoch: 90, train_loss: 0.8874, test_loss: 1.0484, test_f1: 0.5365
 epoch: 91, train_loss: 0.8872, test_loss: 1.0440, test_f1: 0.5463
 epoch: 92, train_loss: 0.8788, test_loss: 1.0427, test_f1: 0.5353
 epoch: 93, train_loss: 0.8751, test_loss: 1.0398, test_f1: 0.5294
 epoch: 94, train_loss: 0.8840, test_loss: 1.0398, test_f1: 0.5346
 epoch: 95, train_loss: 0.8785, test_loss: 1.0459, test_f1: 0.5251
 epoch: 96, train_loss: 0.8686, test_loss: 1.0401, test_f1: 0.5346
 epoch: 97, train_loss: 0.8809, test_loss: 1.0498, test_f1: 0.5303
 epoch: 98, train_loss: 0.8741, test_loss: 1.0373, test_f1: 0.5376
 epoch: 99, train_loss: 0.8732, test_loss: 1.0327, test_f1: 0.5184
##################ITERATION #8 ****************************************
 epoch: 0, train_loss: 1.2644, test_loss: 1.3404, test_f1: 0.2281
 epoch: 1, train_loss: 1.2009, test_loss: 1.3341, test_f1: 0.2281
 epoch: 2, train_loss: 1.1874, test_loss: 1.3297, test_f1: 0.2281
 epoch: 3, train_loss: 1.1700, test_loss: 1.3236, test_f1: 0.2281
 epoch: 4, train_loss: 1.1485, test_loss: 1.3149, test_f1: 0.2281
 epoch: 5, train_loss: 1.1438, test_loss: 1.3148, test_f1: 0.2464
 epoch: 6, train_loss: 1.1305, test_loss: 1.2992, test_f1: 0.2612
 epoch: 7, train_loss: 1.1113, test_loss: 1.2633, test_f1: 0.2673
 epoch: 8, train_loss: 1.1087, test_loss: 1.2348, test_f1: 0.3080
 epoch: 9, train_loss: 1.1027, test_loss: 1.2128, test_f1: 0.3434
 epoch: 10, train_loss: 1.0923, test_loss: 1.2008, test_f1: 0.3542
 epoch: 11, train_loss: 1.0851, test_loss: 1.1986, test_f1: 0.3903
 epoch: 12, train_loss: 1.0838, test_loss: 1.1823, test_f1: 0.4324
 epoch: 13, train_loss: 1.0765, test_loss: 1.1726, test_f1: 0.4420
 epoch: 14, train_loss: 1.0774, test_loss: 1.1766, test_f1: 0.4554
 epoch: 15, train_loss: 1.0655, test_loss: 1.1793, test_f1: 0.4461
 epoch: 16, train_loss: 1.0564, test_loss: 1.1737, test_f1: 0.4444
 epoch: 17, train_loss: 1.0462, test_loss: 1.1761, test_f1: 0.4487
 epoch: 18, train_loss: 1.0386, test_loss: 1.1808, test_f1: 0.4710
 epoch: 19, train_loss: 1.0470, test_loss: 1.1760, test_f1: 0.4658
 epoch: 20, train_loss: 1.0365, test_loss: 1.1741, test_f1: 0.4640
 epoch: 21, train_loss: 1.0339, test_loss: 1.1679, test_f1: 0.4708
 epoch: 22, train_loss: 1.0327, test_loss: 1.1622, test_f1: 0.4711
 epoch: 23, train_loss: 1.0237, test_loss: 1.1540, test_f1: 0.4837
 epoch: 24, train_loss: 1.0142, test_loss: 1.1528, test_f1: 0.4990
 epoch: 25, train_loss: 1.0198, test_loss: 1.1580, test_f1: 0.4944
 epoch: 26, train_loss: 1.0182, test_loss: 1.1550, test_f1: 0.4939
 epoch: 27, train_loss: 1.0058, test_loss: 1.1434, test_f1: 0.4910
 epoch: 28, train_loss: 1.0068, test_loss: 1.1419, test_f1: 0.4954
 epoch: 29, train_loss: 0.9965, test_loss: 1.1412, test_f1: 0.4894
 epoch: 30, train_loss: 0.9924, test_loss: 1.1393, test_f1: 0.4971
 epoch: 31, train_loss: 0.9810, test_loss: 1.1467, test_f1: 0.5081
 epoch: 32, train_loss: 0.9988, test_loss: 1.1465, test_f1: 0.5082
 epoch: 33, train_loss: 0.9793, test_loss: 1.1478, test_f1: 0.4857
 epoch: 34, train_loss: 0.9759, test_loss: 1.1407, test_f1: 0.4969
 epoch: 35, train_loss: 0.9691, test_loss: 1.1247, test_f1: 0.4999
 epoch: 36, train_loss: 0.9754, test_loss: 1.1173, test_f1: 0.5069
 epoch: 37, train_loss: 0.9721, test_loss: 1.1210, test_f1: 0.4973
 epoch: 38, train_loss: 0.9538, test_loss: 1.1307, test_f1: 0.5218
 epoch: 39, train_loss: 0.9622, test_loss: 1.1138, test_f1: 0.5250
 epoch: 40, train_loss: 0.9593, test_loss: 1.1145, test_f1: 0.5017
 epoch: 41, train_loss: 0.9535, test_loss: 1.1079, test_f1: 0.5003
 epoch: 42, train_loss: 0.9513, test_loss: 1.0968, test_f1: 0.5254
 epoch: 43, train_loss: 0.9398, test_loss: 1.1092, test_f1: 0.5201
 epoch: 44, train_loss: 0.9458, test_loss: 1.1096, test_f1: 0.5236
 epoch: 45, train_loss: 0.9405, test_loss: 1.1063, test_f1: 0.5099
 epoch: 46, train_loss: 0.9427, test_loss: 1.1117, test_f1: 0.5050
 epoch: 47, train_loss: 0.9353, test_loss: 1.1112, test_f1: 0.5089
 epoch: 48, train_loss: 0.9348, test_loss: 1.1159, test_f1: 0.5042
 epoch: 49, train_loss: 0.9247, test_loss: 1.1006, test_f1: 0.5103
 epoch: 50, train_loss: 0.9278, test_loss: 1.0808, test_f1: 0.5151
 epoch: 51, train_loss: 0.9281, test_loss: 1.0954, test_f1: 0.5119
 epoch: 52, train_loss: 0.9247, test_loss: 1.1142, test_f1: 0.5035
 epoch: 53, train_loss: 0.9264, test_loss: 1.1127, test_f1: 0.5102
 epoch: 54, train_loss: 0.9164, test_loss: 1.1097, test_f1: 0.5067
 epoch: 55, train_loss: 0.9235, test_loss: 1.1090, test_f1: 0.5137
 epoch: 56, train_loss: 0.9077, test_loss: 1.0939, test_f1: 0.5312
 epoch: 57, train_loss: 0.9179, test_loss: 1.0968, test_f1: 0.5252
 epoch: 58, train_loss: 0.9090, test_loss: 1.0926, test_f1: 0.5300
 epoch: 59, train_loss: 0.9160, test_loss: 1.0931, test_f1: 0.5302
 epoch: 60, train_loss: 0.9094, test_loss: 1.1044, test_f1: 0.5303
 epoch: 61, train_loss: 0.9053, test_loss: 1.1043, test_f1: 0.5300
 epoch: 62, train_loss: 0.9096, test_loss: 1.0996, test_f1: 0.5321
 epoch: 63, train_loss: 0.9036, test_loss: 1.1109, test_f1: 0.5331
 epoch: 64, train_loss: 0.9053, test_loss: 1.1068, test_f1: 0.5278
 epoch: 65, train_loss: 0.9101, test_loss: 1.1025, test_f1: 0.5368
 epoch: 66, train_loss: 0.9057, test_loss: 1.0983, test_f1: 0.5289
 epoch: 67, train_loss: 0.8973, test_loss: 1.0928, test_f1: 0.5264
 epoch: 68, train_loss: 0.9017, test_loss: 1.0889, test_f1: 0.5195
 epoch: 69, train_loss: 0.8942, test_loss: 1.0806, test_f1: 0.5251
 epoch: 70, train_loss: 0.9016, test_loss: 1.0838, test_f1: 0.5236
 epoch: 71, train_loss: 0.8828, test_loss: 1.0820, test_f1: 0.5332
 epoch: 72, train_loss: 0.8965, test_loss: 1.0870, test_f1: 0.5491
 epoch: 73, train_loss: 0.8910, test_loss: 1.0898, test_f1: 0.5242
 epoch: 74, train_loss: 0.8885, test_loss: 1.1062, test_f1: 0.5315
 epoch: 75, train_loss: 0.8849, test_loss: 1.1078, test_f1: 0.5290
 epoch: 76, train_loss: 0.8902, test_loss: 1.1020, test_f1: 0.5334
 epoch: 77, train_loss: 0.8900, test_loss: 1.0958, test_f1: 0.5310
 epoch: 78, train_loss: 0.8950, test_loss: 1.0962, test_f1: 0.5279
 epoch: 79, train_loss: 0.8787, test_loss: 1.0961, test_f1: 0.5361
 epoch: 80, train_loss: 0.8813, test_loss: 1.0884, test_f1: 0.5388
 epoch: 81, train_loss: 0.8775, test_loss: 1.0865, test_f1: 0.5472
 epoch: 82, train_loss: 0.8854, test_loss: 1.1003, test_f1: 0.5288
 epoch: 83, train_loss: 0.8875, test_loss: 1.1080, test_f1: 0.5271
 epoch: 84, train_loss: 0.8707, test_loss: 1.1051, test_f1: 0.5293
 epoch: 85, train_loss: 0.8830, test_loss: 1.1015, test_f1: 0.5408
 epoch: 86, train_loss: 0.8716, test_loss: 1.1034, test_f1: 0.5338
 epoch: 87, train_loss: 0.8793, test_loss: 1.1064, test_f1: 0.5433
 epoch: 88, train_loss: 0.8757, test_loss: 1.0930, test_f1: 0.5373
 epoch: 89, train_loss: 0.8888, test_loss: 1.1066, test_f1: 0.5256
 epoch: 90, train_loss: 0.8704, test_loss: 1.1104, test_f1: 0.5402
 epoch: 91, train_loss: 0.8616, test_loss: 1.1133, test_f1: 0.5389
 epoch: 92, train_loss: 0.8692, test_loss: 1.1145, test_f1: 0.5362
 epoch: 93, train_loss: 0.8660, test_loss: 1.1159, test_f1: 0.5418
 epoch: 94, train_loss: 0.8706, test_loss: 1.1074, test_f1: 0.5450
 epoch: 95, train_loss: 0.8567, test_loss: 1.1088, test_f1: 0.5424
 epoch: 96, train_loss: 0.8666, test_loss: 1.1080, test_f1: 0.5485
 epoch: 97, train_loss: 0.8687, test_loss: 1.1112, test_f1: 0.5330
 epoch: 98, train_loss: 0.8576, test_loss: 1.1087, test_f1: 0.5328
 epoch: 99, train_loss: 0.8710, test_loss: 1.0929, test_f1: 0.5422
##################ITERATION #9 ****************************************
 epoch: 0, train_loss: 1.3100, test_loss: 1.3800, test_f1: 0.2281
 epoch: 1, train_loss: 1.2409, test_loss: 1.3608, test_f1: 0.2281
 epoch: 2, train_loss: 1.2212, test_loss: 1.3415, test_f1: 0.2281
 epoch: 3, train_loss: 1.1998, test_loss: 1.3221, test_f1: 0.2281
 epoch: 4, train_loss: 1.1860, test_loss: 1.3029, test_f1: 0.2281
 epoch: 5, train_loss: 1.1730, test_loss: 1.2829, test_f1: 0.2336
 epoch: 6, train_loss: 1.1584, test_loss: 1.2650, test_f1: 0.2658
 epoch: 7, train_loss: 1.1506, test_loss: 1.2694, test_f1: 0.2946
 epoch: 8, train_loss: 1.1255, test_loss: 1.2721, test_f1: 0.2792
 epoch: 9, train_loss: 1.1307, test_loss: 1.2476, test_f1: 0.2920
 epoch: 10, train_loss: 1.1156, test_loss: 1.2244, test_f1: 0.3200
 epoch: 11, train_loss: 1.1024, test_loss: 1.2117, test_f1: 0.3031
 epoch: 12, train_loss: 1.1003, test_loss: 1.2010, test_f1: 0.3323
 epoch: 13, train_loss: 1.1000, test_loss: 1.1950, test_f1: 0.3322
 epoch: 14, train_loss: 1.0836, test_loss: 1.1903, test_f1: 0.3425
 epoch: 15, train_loss: 1.0774, test_loss: 1.1889, test_f1: 0.3150
 epoch: 16, train_loss: 1.0665, test_loss: 1.1780, test_f1: 0.3219
 epoch: 17, train_loss: 1.0725, test_loss: 1.1661, test_f1: 0.3296
 epoch: 18, train_loss: 1.0698, test_loss: 1.1667, test_f1: 0.3250
 epoch: 19, train_loss: 1.0599, test_loss: 1.1624, test_f1: 0.3222
 epoch: 20, train_loss: 1.0521, test_loss: 1.1532, test_f1: 0.3572
 epoch: 21, train_loss: 1.0451, test_loss: 1.1452, test_f1: 0.3650
 epoch: 22, train_loss: 1.0479, test_loss: 1.1393, test_f1: 0.3723
 epoch: 23, train_loss: 1.0343, test_loss: 1.1329, test_f1: 0.4033
 epoch: 24, train_loss: 1.0326, test_loss: 1.1283, test_f1: 0.3994
 epoch: 25, train_loss: 1.0165, test_loss: 1.1224, test_f1: 0.4226
 epoch: 26, train_loss: 1.0120, test_loss: 1.1262, test_f1: 0.4375
 epoch: 27, train_loss: 1.0102, test_loss: 1.1176, test_f1: 0.4179
 epoch: 28, train_loss: 1.0089, test_loss: 1.1118, test_f1: 0.4242
 epoch: 29, train_loss: 1.0006, test_loss: 1.1047, test_f1: 0.4258
 epoch: 30, train_loss: 1.0003, test_loss: 1.0937, test_f1: 0.4330
 epoch: 31, train_loss: 0.9938, test_loss: 1.0968, test_f1: 0.4614
 epoch: 32, train_loss: 0.9881, test_loss: 1.1015, test_f1: 0.4502
 epoch: 33, train_loss: 0.9946, test_loss: 1.0985, test_f1: 0.4617
 epoch: 34, train_loss: 0.9795, test_loss: 1.0922, test_f1: 0.4919
 epoch: 35, train_loss: 0.9815, test_loss: 1.0850, test_f1: 0.5141
 epoch: 36, train_loss: 0.9764, test_loss: 1.0793, test_f1: 0.5080
 epoch: 37, train_loss: 0.9702, test_loss: 1.0737, test_f1: 0.5034
 epoch: 38, train_loss: 0.9675, test_loss: 1.0738, test_f1: 0.5011
 epoch: 39, train_loss: 0.9595, test_loss: 1.0788, test_f1: 0.5116
 epoch: 40, train_loss: 0.9585, test_loss: 1.0723, test_f1: 0.5187
 epoch: 41, train_loss: 0.9547, test_loss: 1.0590, test_f1: 0.5064
 epoch: 42, train_loss: 0.9489, test_loss: 1.0489, test_f1: 0.5150
 epoch: 43, train_loss: 0.9484, test_loss: 1.0514, test_f1: 0.5192
 epoch: 44, train_loss: 0.9480, test_loss: 1.0537, test_f1: 0.4997
 epoch: 45, train_loss: 0.9386, test_loss: 1.0567, test_f1: 0.4981
 epoch: 46, train_loss: 0.9413, test_loss: 1.0580, test_f1: 0.4836
 epoch: 47, train_loss: 0.9378, test_loss: 1.0582, test_f1: 0.4835
 epoch: 48, train_loss: 0.9361, test_loss: 1.0630, test_f1: 0.4786
 epoch: 49, train_loss: 0.9254, test_loss: 1.0570, test_f1: 0.5088
 epoch: 50, train_loss: 0.9279, test_loss: 1.0513, test_f1: 0.5152
 epoch: 51, train_loss: 0.9233, test_loss: 1.0557, test_f1: 0.5060
 epoch: 52, train_loss: 0.9148, test_loss: 1.0545, test_f1: 0.5081
 epoch: 53, train_loss: 0.9124, test_loss: 1.0571, test_f1: 0.5059
 epoch: 54, train_loss: 0.9203, test_loss: 1.0533, test_f1: 0.5029
 epoch: 55, train_loss: 0.9151, test_loss: 1.0467, test_f1: 0.5127
 epoch: 56, train_loss: 0.9037, test_loss: 1.0469, test_f1: 0.5171
 epoch: 57, train_loss: 0.9156, test_loss: 1.0424, test_f1: 0.5273
 epoch: 58, train_loss: 0.9019, test_loss: 1.0449, test_f1: 0.5299
 epoch: 59, train_loss: 0.9111, test_loss: 1.0445, test_f1: 0.5272
 epoch: 60, train_loss: 0.9088, test_loss: 1.0439, test_f1: 0.5319
 epoch: 61, train_loss: 0.9098, test_loss: 1.0492, test_f1: 0.5325
 epoch: 62, train_loss: 0.9119, test_loss: 1.0492, test_f1: 0.5337
 epoch: 63, train_loss: 0.9070, test_loss: 1.0430, test_f1: 0.5342
 epoch: 64, train_loss: 0.9121, test_loss: 1.0379, test_f1: 0.5356
 epoch: 65, train_loss: 0.8975, test_loss: 1.0428, test_f1: 0.5221
 epoch: 66, train_loss: 0.9050, test_loss: 1.0504, test_f1: 0.5122
 epoch: 67, train_loss: 0.8964, test_loss: 1.0467, test_f1: 0.5218
 epoch: 68, train_loss: 0.9010, test_loss: 1.0531, test_f1: 0.5371
 epoch: 69, train_loss: 0.8922, test_loss: 1.0483, test_f1: 0.5231
 epoch: 70, train_loss: 0.8955, test_loss: 1.0442, test_f1: 0.5218
 epoch: 71, train_loss: 0.8994, test_loss: 1.0442, test_f1: 0.5392
 epoch: 72, train_loss: 0.8879, test_loss: 1.0451, test_f1: 0.5387
 epoch: 73, train_loss: 0.8894, test_loss: 1.0454, test_f1: 0.5376
 epoch: 74, train_loss: 0.8873, test_loss: 1.0495, test_f1: 0.5320
 epoch: 75, train_loss: 0.8774, test_loss: 1.0370, test_f1: 0.5503
 epoch: 76, train_loss: 0.8786, test_loss: 1.0331, test_f1: 0.5355
 epoch: 77, train_loss: 0.8830, test_loss: 1.0362, test_f1: 0.5233
 epoch: 78, train_loss: 0.8829, test_loss: 1.0363, test_f1: 0.5252
 epoch: 79, train_loss: 0.8825, test_loss: 1.0372, test_f1: 0.5267
 epoch: 80, train_loss: 0.8845, test_loss: 1.0322, test_f1: 0.5452
 epoch: 81, train_loss: 0.8800, test_loss: 1.0439, test_f1: 0.5210
 epoch: 82, train_loss: 0.8810, test_loss: 1.0485, test_f1: 0.5229
 epoch: 83, train_loss: 0.8772, test_loss: 1.0494, test_f1: 0.5318
 epoch: 84, train_loss: 0.8804, test_loss: 1.0380, test_f1: 0.5288
 epoch: 85, train_loss: 0.8807, test_loss: 1.0477, test_f1: 0.5249
 epoch: 86, train_loss: 0.8665, test_loss: 1.0452, test_f1: 0.5354
 epoch: 87, train_loss: 0.8748, test_loss: 1.0640, test_f1: 0.5280
 epoch: 88, train_loss: 0.8691, test_loss: 1.0561, test_f1: 0.5407
 epoch: 89, train_loss: 0.8614, test_loss: 1.0446, test_f1: 0.5400
 epoch: 90, train_loss: 0.8805, test_loss: 1.0417, test_f1: 0.5384
 epoch: 91, train_loss: 0.8609, test_loss: 1.0440, test_f1: 0.5373
 epoch: 92, train_loss: 0.8643, test_loss: 1.0449, test_f1: 0.5325
 epoch: 93, train_loss: 0.8684, test_loss: 1.0436, test_f1: 0.5376
 epoch: 94, train_loss: 0.8693, test_loss: 1.0410, test_f1: 0.5438
 epoch: 95, train_loss: 0.8677, test_loss: 1.0383, test_f1: 0.5366
 epoch: 96, train_loss: 0.8679, test_loss: 1.0360, test_f1: 0.5409
 epoch: 97, train_loss: 0.8635, test_loss: 1.0377, test_f1: 0.5406
 epoch: 98, train_loss: 0.8640, test_loss: 1.0396, test_f1: 0.5426
 epoch: 99, train_loss: 0.8641, test_loss: 1.0405, test_f1: 0.5362

Training completed in 400.51 seconds
Best F1: 0.5561 at epoch 84
Mean F1 across iterations: 0.5396  0.0131
========================FINAL RESULTS================================
FEGIN weighted F1: 0.5561  0.0131
python main.py --data ltspice_demos --representation component_net --model FEGIN --layers 6 --hiddens 64 --batch_size 256 --lr 0.0001 --emb_size 512 --epochs 100 --save_appendix component_net_L6_H64_BS256_LR0.0001_E512 --no_val
-----



STDERR:
  File "main.py", line 370, in <module>
    main()
  File "main.py", line 254, in main
    dataset = dataset_class(
  File "/home/philip/projects/ltspice_examples_code_repo/Circuit-Completion-Using-GNNs/component_classification_with_link_prediction_head/evaluation/FEGIN/kernel/circuit_datasets.py", line 15, in __init__
    self.data, self.slices = torch.load(self.processed_paths[0])
  File "/home/philip/.local/lib/python3.8/site-packages/torch/serialization.py", line 1040, in load
    warnings.warn(
  File "/usr/lib/python3.8/warnings.py", line 109, in _showwarnmsg
    sw(msg.message, msg.category, msg.filename, msg.lineno,
  File "main.py", line 47, in warn_with_traceback
    traceback.print_stack(file=log)
/home/philip/projects/ltspice_examples_code_repo/Circuit-Completion-Using-GNNs/component_classification_with_link_prediction_head/evaluation/FEGIN/kernel/circuit_datasets.py:15: FutureWarning: You are using `torch.load` with `weights_only=False` (the current default value), which uses the default pickle module implicitly. It is possible to construct malicious pickle data which will execute arbitrary code during unpickling (See https://github.com/pytorch/pytorch/blob/main/SECURITY.md#untrusted-models for more details). In a future release, the default value for `weights_only` will be flipped to `True`. This limits the functions that could be executed during unpickling. Arbitrary objects will no longer be allowed to be loaded via this mode unless they are explicitly allowlisted by the user via `torch.serialization.add_safe_globals`. We recommend you start setting `weights_only=True` for any use case where you don't have full control of the loaded file. Please open an issue on GitHub for any issues related to this experimental feature.
  self.data, self.slices = torch.load(self.processed_paths[0])
