STDOUT:
Results will be saved in /home/philip/projects/ltspice_examples_code_repo/Circuit-Completion-Using-GNNs/component_classification_with_link_prediction_head/evaluation/FEGIN/results/model_FEGIN_dataset_ltspice_examples
Command line input: python main.py --data ltspice_examples --representation component_pin --model FEGIN --layers 2 --hiddens 128 --batch_size 128 --lr 0.001 --emb_size 250 --epochs 100 --save_appendix component_pin_L2_H128_BS128_LR0.001_E250 --no_val
 is saved.
-----
ltspice_examples - FEGIN
Using 2 layers, 128 hidden units, h = 2
Loading component_pin representation dataset
ENTERED
Training FEGIN on component_pin representation
Train: 3560, Test: 848
##################ITERATION #0 ****************************************
 epoch: 0, train_loss: 1.2110, test_loss: 1.2512, test_f1: 0.2260
 epoch: 1, train_loss: 1.0314, test_loss: 1.0528, test_f1: 0.3447
 epoch: 2, train_loss: 0.9792, test_loss: 1.0393, test_f1: 0.4250
 epoch: 3, train_loss: 0.9356, test_loss: 0.9779, test_f1: 0.4963
 epoch: 4, train_loss: 0.8962, test_loss: 0.9598, test_f1: 0.5099
 epoch: 5, train_loss: 0.8544, test_loss: 0.8992, test_f1: 0.5407
 epoch: 6, train_loss: 0.8150, test_loss: 0.9775, test_f1: 0.5146
 epoch: 7, train_loss: 0.7997, test_loss: 0.9470, test_f1: 0.5099
 epoch: 8, train_loss: 0.7835, test_loss: 0.8654, test_f1: 0.5324
 epoch: 9, train_loss: 0.7593, test_loss: 0.9274, test_f1: 0.5138
 epoch: 10, train_loss: 0.7360, test_loss: 0.8720, test_f1: 0.5743
 epoch: 11, train_loss: 0.7165, test_loss: 0.9219, test_f1: 0.5792
 epoch: 12, train_loss: 0.6980, test_loss: 0.9320, test_f1: 0.5689
 epoch: 13, train_loss: 0.6970, test_loss: 0.8686, test_f1: 0.5897
 epoch: 14, train_loss: 0.6912, test_loss: 1.1200, test_f1: 0.4902
 epoch: 15, train_loss: 0.6628, test_loss: 0.9500, test_f1: 0.5948
 epoch: 16, train_loss: 0.6585, test_loss: 0.9185, test_f1: 0.5653
 epoch: 17, train_loss: 0.6403, test_loss: 0.8755, test_f1: 0.6048
 epoch: 18, train_loss: 0.6479, test_loss: 0.8965, test_f1: 0.6098
 epoch: 19, train_loss: 0.6302, test_loss: 0.9669, test_f1: 0.5870
 epoch: 20, train_loss: 0.6048, test_loss: 0.9642, test_f1: 0.5983
 epoch: 21, train_loss: 0.5920, test_loss: 0.9506, test_f1: 0.6304
 epoch: 22, train_loss: 0.5883, test_loss: 1.1079, test_f1: 0.6056
 epoch: 23, train_loss: 0.5822, test_loss: 1.0063, test_f1: 0.6209
 epoch: 24, train_loss: 0.5659, test_loss: 1.0423, test_f1: 0.5901
 epoch: 25, train_loss: 0.5704, test_loss: 0.9948, test_f1: 0.6010
 epoch: 26, train_loss: 0.5396, test_loss: 1.1233, test_f1: 0.6293
 epoch: 27, train_loss: 0.5324, test_loss: 0.9124, test_f1: 0.6418
 epoch: 28, train_loss: 0.5270, test_loss: 1.0473, test_f1: 0.6277
 epoch: 29, train_loss: 0.5164, test_loss: 1.0472, test_f1: 0.6159
 epoch: 30, train_loss: 0.4979, test_loss: 1.0109, test_f1: 0.6350
 epoch: 31, train_loss: 0.4781, test_loss: 1.4034, test_f1: 0.5999
 epoch: 32, train_loss: 0.4596, test_loss: 1.2739, test_f1: 0.5740
 epoch: 33, train_loss: 0.4738, test_loss: 1.2435, test_f1: 0.6176
 epoch: 34, train_loss: 0.4867, test_loss: 1.2224, test_f1: 0.6308
 epoch: 35, train_loss: 0.4895, test_loss: 1.0336, test_f1: 0.6534
 epoch: 36, train_loss: 0.4473, test_loss: 1.2560, test_f1: 0.6102
 epoch: 37, train_loss: 0.4580, test_loss: 1.1808, test_f1: 0.6734
 epoch: 38, train_loss: 0.4421, test_loss: 1.1280, test_f1: 0.6138
 epoch: 39, train_loss: 0.3904, test_loss: 1.2493, test_f1: 0.6533
 epoch: 40, train_loss: 0.3836, test_loss: 1.2910, test_f1: 0.6711
 epoch: 41, train_loss: 0.3688, test_loss: 1.3177, test_f1: 0.6310
 epoch: 42, train_loss: 0.3850, test_loss: 1.3328, test_f1: 0.6249
 epoch: 43, train_loss: 0.3861, test_loss: 1.3112, test_f1: 0.5792
 epoch: 44, train_loss: 0.3667, test_loss: 1.3766, test_f1: 0.6690
 epoch: 45, train_loss: 0.3644, test_loss: 1.4569, test_f1: 0.6038
 epoch: 46, train_loss: 0.3954, test_loss: 1.4044, test_f1: 0.6688
 epoch: 47, train_loss: 0.3753, test_loss: 1.2020, test_f1: 0.6491
 epoch: 48, train_loss: 0.3695, test_loss: 1.3862, test_f1: 0.6350
 epoch: 49, train_loss: 0.3421, test_loss: 1.4958, test_f1: 0.6420
 epoch: 50, train_loss: 0.3406, test_loss: 1.4925, test_f1: 0.6323
 epoch: 51, train_loss: 0.2947, test_loss: 1.5076, test_f1: 0.6735
 epoch: 52, train_loss: 0.2668, test_loss: 1.3978, test_f1: 0.6679
 epoch: 53, train_loss: 0.2466, test_loss: 1.5237, test_f1: 0.6734
 epoch: 54, train_loss: 0.2515, test_loss: 1.5692, test_f1: 0.6536
 epoch: 55, train_loss: 0.2617, test_loss: 1.4020, test_f1: 0.6702
 epoch: 56, train_loss: 0.2395, test_loss: 1.6589, test_f1: 0.6552
 epoch: 57, train_loss: 0.2273, test_loss: 1.6166, test_f1: 0.6672
 epoch: 58, train_loss: 0.2277, test_loss: 1.7071, test_f1: 0.6612
 epoch: 59, train_loss: 0.2165, test_loss: 1.7280, test_f1: 0.6418
 epoch: 60, train_loss: 0.2245, test_loss: 1.6585, test_f1: 0.6646
 epoch: 61, train_loss: 0.2093, test_loss: 1.7331, test_f1: 0.6301
 epoch: 62, train_loss: 0.2024, test_loss: 1.5989, test_f1: 0.6906
 epoch: 63, train_loss: 0.2132, test_loss: 1.7443, test_f1: 0.6464
 epoch: 64, train_loss: 0.2135, test_loss: 1.8022, test_f1: 0.6360
 epoch: 65, train_loss: 0.1835, test_loss: 1.7104, test_f1: 0.6657
 epoch: 66, train_loss: 0.1879, test_loss: 1.7587, test_f1: 0.6358
 epoch: 67, train_loss: 0.1872, test_loss: 1.7904, test_f1: 0.6630
 epoch: 68, train_loss: 0.1917, test_loss: 1.6839, test_f1: 0.6956
 epoch: 69, train_loss: 0.1868, test_loss: 2.0953, test_f1: 0.6608
 epoch: 70, train_loss: 0.1751, test_loss: 1.6952, test_f1: 0.6590
 epoch: 71, train_loss: 0.1980, test_loss: 1.9678, test_f1: 0.6746
 epoch: 72, train_loss: 0.1895, test_loss: 1.8693, test_f1: 0.6600
 epoch: 73, train_loss: 0.1940, test_loss: 1.7094, test_f1: 0.6720
 epoch: 74, train_loss: 0.1792, test_loss: 1.8953, test_f1: 0.6457
 epoch: 75, train_loss: 0.1586, test_loss: 1.9978, test_f1: 0.6708
 epoch: 76, train_loss: 0.1672, test_loss: 1.8336, test_f1: 0.6942
 epoch: 77, train_loss: 0.1712, test_loss: 2.0360, test_f1: 0.6673
 epoch: 78, train_loss: 0.1726, test_loss: 2.1397, test_f1: 0.6587
 epoch: 79, train_loss: 0.1616, test_loss: 1.9311, test_f1: 0.6553
 epoch: 80, train_loss: 0.1526, test_loss: 2.0154, test_f1: 0.6373
 epoch: 81, train_loss: 0.1562, test_loss: 2.0192, test_f1: 0.6307
 epoch: 82, train_loss: 0.1503, test_loss: 2.0788, test_f1: 0.6363
 epoch: 83, train_loss: 0.1591, test_loss: 2.0145, test_f1: 0.6411
 epoch: 84, train_loss: 0.1476, test_loss: 2.1822, test_f1: 0.6378
 epoch: 85, train_loss: 0.1521, test_loss: 2.1057, test_f1: 0.6772
 epoch: 86, train_loss: 0.1424, test_loss: 2.1884, test_f1: 0.6261
 epoch: 87, train_loss: 0.1606, test_loss: 2.0742, test_f1: 0.6339
 epoch: 88, train_loss: 0.1360, test_loss: 2.3529, test_f1: 0.6361
 epoch: 89, train_loss: 0.1591, test_loss: 2.0976, test_f1: 0.6632
 epoch: 90, train_loss: 0.1333, test_loss: 2.6615, test_f1: 0.6251
 epoch: 91, train_loss: 0.1490, test_loss: 2.2529, test_f1: 0.6243
 epoch: 92, train_loss: 0.1362, test_loss: 2.1985, test_f1: 0.6398
 epoch: 93, train_loss: 0.1384, test_loss: 2.1457, test_f1: 0.6462
 epoch: 94, train_loss: 0.1432, test_loss: 2.0936, test_f1: 0.6624
 epoch: 95, train_loss: 0.1377, test_loss: 2.3834, test_f1: 0.6376
 epoch: 96, train_loss: 0.1348, test_loss: 2.1136, test_f1: 0.6628
 epoch: 97, train_loss: 0.1301, test_loss: 2.2597, test_f1: 0.6559
 epoch: 98, train_loss: 0.1313, test_loss: 2.4369, test_f1: 0.6311
 epoch: 99, train_loss: 0.1243, test_loss: 2.2894, test_f1: 0.6604
##################ITERATION #1 ****************************************
 epoch: 0, train_loss: 1.1114, test_loss: 1.1783, test_f1: 0.3766
 epoch: 1, train_loss: 0.9584, test_loss: 1.0722, test_f1: 0.3941
 epoch: 2, train_loss: 0.9033, test_loss: 0.8762, test_f1: 0.5258
 epoch: 3, train_loss: 0.8567, test_loss: 0.8343, test_f1: 0.5463
 epoch: 4, train_loss: 0.8316, test_loss: 0.8920, test_f1: 0.6034
 epoch: 5, train_loss: 0.7943, test_loss: 0.8731, test_f1: 0.5292
 epoch: 6, train_loss: 0.7834, test_loss: 0.8847, test_f1: 0.6240
 epoch: 7, train_loss: 0.7607, test_loss: 0.8771, test_f1: 0.5760
 epoch: 8, train_loss: 0.7275, test_loss: 0.9161, test_f1: 0.6246
 epoch: 9, train_loss: 0.7213, test_loss: 0.9145, test_f1: 0.5809
 epoch: 10, train_loss: 0.6968, test_loss: 0.8327, test_f1: 0.6748
 epoch: 11, train_loss: 0.6742, test_loss: 0.9161, test_f1: 0.6297
 epoch: 12, train_loss: 0.6571, test_loss: 0.8773, test_f1: 0.6179
 epoch: 13, train_loss: 0.6668, test_loss: 0.8354, test_f1: 0.6120
 epoch: 14, train_loss: 0.6327, test_loss: 0.8411, test_f1: 0.6468
 epoch: 15, train_loss: 0.6319, test_loss: 0.9348, test_f1: 0.6313
 epoch: 16, train_loss: 0.6264, test_loss: 0.8946, test_f1: 0.6225
 epoch: 17, train_loss: 0.5963, test_loss: 0.8827, test_f1: 0.6133
 epoch: 18, train_loss: 0.5891, test_loss: 0.9084, test_f1: 0.6291
 epoch: 19, train_loss: 0.5771, test_loss: 0.9454, test_f1: 0.6365
 epoch: 20, train_loss: 0.5846, test_loss: 0.8646, test_f1: 0.6644
 epoch: 21, train_loss: 0.5528, test_loss: 0.9228, test_f1: 0.6249
 epoch: 22, train_loss: 0.5412, test_loss: 0.9599, test_f1: 0.6524
 epoch: 23, train_loss: 0.5413, test_loss: 0.9170, test_f1: 0.6114
 epoch: 24, train_loss: 0.5168, test_loss: 0.8804, test_f1: 0.6494
 epoch: 25, train_loss: 0.5381, test_loss: 0.9520, test_f1: 0.6389
 epoch: 26, train_loss: 0.5156, test_loss: 0.9744, test_f1: 0.6110
 epoch: 27, train_loss: 0.5128, test_loss: 1.1027, test_f1: 0.5816
 epoch: 28, train_loss: 0.4877, test_loss: 1.0017, test_f1: 0.6293
 epoch: 29, train_loss: 0.4840, test_loss: 0.9401, test_f1: 0.6630
 epoch: 30, train_loss: 0.4726, test_loss: 0.9227, test_f1: 0.6612
 epoch: 31, train_loss: 0.4755, test_loss: 1.0694, test_f1: 0.6216
 epoch: 32, train_loss: 0.4561, test_loss: 0.9887, test_f1: 0.6602
 epoch: 33, train_loss: 0.4421, test_loss: 1.1185, test_f1: 0.5919
 epoch: 34, train_loss: 0.4402, test_loss: 1.0237, test_f1: 0.6429
 epoch: 35, train_loss: 0.4309, test_loss: 0.9748, test_f1: 0.6585
 epoch: 36, train_loss: 0.4259, test_loss: 1.1315, test_f1: 0.6277
 epoch: 37, train_loss: 0.4142, test_loss: 1.0921, test_f1: 0.6097
 epoch: 38, train_loss: 0.4195, test_loss: 1.2780, test_f1: 0.6168
 epoch: 39, train_loss: 0.3810, test_loss: 0.9710, test_f1: 0.6393
 epoch: 40, train_loss: 0.3981, test_loss: 1.0422, test_f1: 0.6484
 epoch: 41, train_loss: 0.3745, test_loss: 1.1528, test_f1: 0.6149
 epoch: 42, train_loss: 0.3806, test_loss: 1.0526, test_f1: 0.6465
 epoch: 43, train_loss: 0.3813, test_loss: 1.1209, test_f1: 0.6373
 epoch: 44, train_loss: 0.3696, test_loss: 1.1164, test_f1: 0.6569
 epoch: 45, train_loss: 0.3412, test_loss: 1.3175, test_f1: 0.6316
 epoch: 46, train_loss: 0.3352, test_loss: 1.3991, test_f1: 0.5985
 epoch: 47, train_loss: 0.3216, test_loss: 1.2065, test_f1: 0.6689
 epoch: 48, train_loss: 0.3449, test_loss: 1.3515, test_f1: 0.6383
 epoch: 49, train_loss: 0.3238, test_loss: 1.1114, test_f1: 0.6511
 epoch: 50, train_loss: 0.3073, test_loss: 1.1963, test_f1: 0.6609
 epoch: 51, train_loss: 0.2813, test_loss: 1.0878, test_f1: 0.6884
 epoch: 52, train_loss: 0.2502, test_loss: 1.2402, test_f1: 0.6599
 epoch: 53, train_loss: 0.2602, test_loss: 1.2250, test_f1: 0.6717
 epoch: 54, train_loss: 0.2422, test_loss: 1.3676, test_f1: 0.6706
 epoch: 55, train_loss: 0.2226, test_loss: 1.3671, test_f1: 0.6511
 epoch: 56, train_loss: 0.2385, test_loss: 1.3131, test_f1: 0.6676
 epoch: 57, train_loss: 0.2259, test_loss: 1.5689, test_f1: 0.6244
 epoch: 58, train_loss: 0.2221, test_loss: 1.3563, test_f1: 0.6336
 epoch: 59, train_loss: 0.2266, test_loss: 1.2946, test_f1: 0.6480
 epoch: 60, train_loss: 0.2135, test_loss: 1.5298, test_f1: 0.6217
 epoch: 61, train_loss: 0.2145, test_loss: 1.4207, test_f1: 0.6408
 epoch: 62, train_loss: 0.2354, test_loss: 1.4497, test_f1: 0.6448
 epoch: 63, train_loss: 0.2074, test_loss: 1.4777, test_f1: 0.6526
 epoch: 64, train_loss: 0.1908, test_loss: 1.5795, test_f1: 0.6438
 epoch: 65, train_loss: 0.2139, test_loss: 1.3453, test_f1: 0.6594
 epoch: 66, train_loss: 0.1933, test_loss: 1.4986, test_f1: 0.6881
 epoch: 67, train_loss: 0.1971, test_loss: 1.5226, test_f1: 0.6760
 epoch: 68, train_loss: 0.2118, test_loss: 1.5404, test_f1: 0.6467
 epoch: 69, train_loss: 0.1920, test_loss: 1.6226, test_f1: 0.6507
 epoch: 70, train_loss: 0.2096, test_loss: 1.6382, test_f1: 0.6530
 epoch: 71, train_loss: 0.1876, test_loss: 1.6196, test_f1: 0.6530
 epoch: 72, train_loss: 0.1925, test_loss: 1.5984, test_f1: 0.6639
 epoch: 73, train_loss: 0.1774, test_loss: 1.4613, test_f1: 0.6843
 epoch: 74, train_loss: 0.1871, test_loss: 1.5990, test_f1: 0.6618
 epoch: 75, train_loss: 0.1729, test_loss: 1.7188, test_f1: 0.6402
 epoch: 76, train_loss: 0.1882, test_loss: 1.7010, test_f1: 0.6558
 epoch: 77, train_loss: 0.1779, test_loss: 1.6864, test_f1: 0.6207
 epoch: 78, train_loss: 0.1730, test_loss: 1.6457, test_f1: 0.6562
 epoch: 79, train_loss: 0.1802, test_loss: 1.5798, test_f1: 0.6755
 epoch: 80, train_loss: 0.1743, test_loss: 1.6057, test_f1: 0.6494
 epoch: 81, train_loss: 0.1809, test_loss: 1.6544, test_f1: 0.6589
 epoch: 82, train_loss: 0.1911, test_loss: 1.7019, test_f1: 0.6455
 epoch: 83, train_loss: 0.1640, test_loss: 1.7164, test_f1: 0.6571
 epoch: 84, train_loss: 0.1680, test_loss: 1.6784, test_f1: 0.6851
 epoch: 85, train_loss: 0.1562, test_loss: 1.7958, test_f1: 0.6226
 epoch: 86, train_loss: 0.1513, test_loss: 1.8286, test_f1: 0.6401
 epoch: 87, train_loss: 0.1650, test_loss: 2.0579, test_f1: 0.6006
 epoch: 88, train_loss: 0.1640, test_loss: 1.7429, test_f1: 0.6630
 epoch: 89, train_loss: 0.1690, test_loss: 1.9035, test_f1: 0.6316
 epoch: 90, train_loss: 0.1580, test_loss: 1.8667, test_f1: 0.6346
 epoch: 91, train_loss: 0.1478, test_loss: 1.6387, test_f1: 0.6496
 epoch: 92, train_loss: 0.1466, test_loss: 2.0102, test_f1: 0.6215
 epoch: 93, train_loss: 0.1382, test_loss: 1.9996, test_f1: 0.6262
 epoch: 94, train_loss: 0.1366, test_loss: 2.0587, test_f1: 0.6370
 epoch: 95, train_loss: 0.1538, test_loss: 1.8843, test_f1: 0.6257
 epoch: 96, train_loss: 0.1402, test_loss: 1.8687, test_f1: 0.6162
 epoch: 97, train_loss: 0.1463, test_loss: 1.9286, test_f1: 0.6459
 epoch: 98, train_loss: 0.1520, test_loss: 1.9375, test_f1: 0.6631
 epoch: 99, train_loss: 0.1401, test_loss: 1.8543, test_f1: 0.6328
##################ITERATION #2 ****************************************
 epoch: 0, train_loss: 1.1430, test_loss: 1.2157, test_f1: 0.2286
 epoch: 1, train_loss: 0.9576, test_loss: 0.9926, test_f1: 0.4494
 epoch: 2, train_loss: 0.9024, test_loss: 0.9272, test_f1: 0.5297
 epoch: 3, train_loss: 0.8597, test_loss: 1.1016, test_f1: 0.4903
 epoch: 4, train_loss: 0.8372, test_loss: 0.9527, test_f1: 0.5788
 epoch: 5, train_loss: 0.8205, test_loss: 0.9435, test_f1: 0.5882
 epoch: 6, train_loss: 0.7836, test_loss: 0.8724, test_f1: 0.6114
 epoch: 7, train_loss: 0.7534, test_loss: 0.8838, test_f1: 0.5689
 epoch: 8, train_loss: 0.7474, test_loss: 0.9398, test_f1: 0.5372
 epoch: 9, train_loss: 0.7171, test_loss: 0.8168, test_f1: 0.6273
 epoch: 10, train_loss: 0.7069, test_loss: 0.8788, test_f1: 0.5618
 epoch: 11, train_loss: 0.6919, test_loss: 0.8355, test_f1: 0.6341
 epoch: 12, train_loss: 0.6815, test_loss: 0.9454, test_f1: 0.5460
 epoch: 13, train_loss: 0.6489, test_loss: 0.8100, test_f1: 0.6209
 epoch: 14, train_loss: 0.6330, test_loss: 0.8550, test_f1: 0.6605
 epoch: 15, train_loss: 0.6298, test_loss: 0.8203, test_f1: 0.6017
 epoch: 16, train_loss: 0.6285, test_loss: 1.0225, test_f1: 0.5721
 epoch: 17, train_loss: 0.6024, test_loss: 0.8454, test_f1: 0.6274
 epoch: 18, train_loss: 0.5976, test_loss: 0.8257, test_f1: 0.6270
 epoch: 19, train_loss: 0.5796, test_loss: 0.8987, test_f1: 0.6058
 epoch: 20, train_loss: 0.5701, test_loss: 0.8160, test_f1: 0.6392
 epoch: 21, train_loss: 0.5638, test_loss: 0.9197, test_f1: 0.6305
 epoch: 22, train_loss: 0.5245, test_loss: 0.8931, test_f1: 0.6277
 epoch: 23, train_loss: 0.5344, test_loss: 0.8815, test_f1: 0.6453
 epoch: 24, train_loss: 0.5414, test_loss: 0.9039, test_f1: 0.6456
 epoch: 25, train_loss: 0.5053, test_loss: 0.8091, test_f1: 0.6688
 epoch: 26, train_loss: 0.4962, test_loss: 1.0201, test_f1: 0.6493
 epoch: 27, train_loss: 0.5145, test_loss: 0.8904, test_f1: 0.6386
 epoch: 28, train_loss: 0.4821, test_loss: 0.9562, test_f1: 0.6433
 epoch: 29, train_loss: 0.4936, test_loss: 0.8551, test_f1: 0.6526
 epoch: 30, train_loss: 0.4795, test_loss: 0.9181, test_f1: 0.6706
 epoch: 31, train_loss: 0.4601, test_loss: 0.9433, test_f1: 0.6910
 epoch: 32, train_loss: 0.4552, test_loss: 0.9085, test_f1: 0.6426
 epoch: 33, train_loss: 0.4315, test_loss: 1.0100, test_f1: 0.6549
 epoch: 34, train_loss: 0.4132, test_loss: 1.0283, test_f1: 0.6446
 epoch: 35, train_loss: 0.4180, test_loss: 0.9743, test_f1: 0.6580
 epoch: 36, train_loss: 0.4328, test_loss: 1.1360, test_f1: 0.6386
 epoch: 37, train_loss: 0.4335, test_loss: 1.0314, test_f1: 0.6783
 epoch: 38, train_loss: 0.4076, test_loss: 0.9515, test_f1: 0.6728
 epoch: 39, train_loss: 0.3740, test_loss: 1.1419, test_f1: 0.6370
 epoch: 40, train_loss: 0.3853, test_loss: 1.0888, test_f1: 0.6764
 epoch: 41, train_loss: 0.3684, test_loss: 1.1648, test_f1: 0.6589
 epoch: 42, train_loss: 0.3755, test_loss: 1.2053, test_f1: 0.6073
 epoch: 43, train_loss: 0.3544, test_loss: 0.9672, test_f1: 0.6702
 epoch: 44, train_loss: 0.3822, test_loss: 1.0377, test_f1: 0.6637
 epoch: 45, train_loss: 0.3362, test_loss: 1.1370, test_f1: 0.6810
 epoch: 46, train_loss: 0.3414, test_loss: 1.0352, test_f1: 0.6849
 epoch: 47, train_loss: 0.3325, test_loss: 1.1062, test_f1: 0.6805
 epoch: 48, train_loss: 0.3187, test_loss: 1.2169, test_f1: 0.6868
 epoch: 49, train_loss: 0.3218, test_loss: 1.1305, test_f1: 0.6899
 epoch: 50, train_loss: 0.3247, test_loss: 1.1719, test_f1: 0.6635
 epoch: 51, train_loss: 0.2937, test_loss: 1.2439, test_f1: 0.6727
 epoch: 52, train_loss: 0.2647, test_loss: 1.1600, test_f1: 0.6813
 epoch: 53, train_loss: 0.2445, test_loss: 1.3113, test_f1: 0.6872
 epoch: 54, train_loss: 0.2403, test_loss: 1.3061, test_f1: 0.6692
 epoch: 55, train_loss: 0.2472, test_loss: 1.3328, test_f1: 0.6578
 epoch: 56, train_loss: 0.2262, test_loss: 1.2338, test_f1: 0.6882
 epoch: 57, train_loss: 0.2041, test_loss: 1.2327, test_f1: 0.6901
 epoch: 58, train_loss: 0.2269, test_loss: 1.5506, test_f1: 0.6294
 epoch: 59, train_loss: 0.2277, test_loss: 1.2653, test_f1: 0.6989
 epoch: 60, train_loss: 0.2121, test_loss: 1.3279, test_f1: 0.6952
 epoch: 61, train_loss: 0.2035, test_loss: 1.4511, test_f1: 0.6647
 epoch: 62, train_loss: 0.2153, test_loss: 1.4692, test_f1: 0.6897
 epoch: 63, train_loss: 0.1985, test_loss: 1.3795, test_f1: 0.6730
 epoch: 64, train_loss: 0.2006, test_loss: 1.2594, test_f1: 0.7160
 epoch: 65, train_loss: 0.1955, test_loss: 1.4449, test_f1: 0.7124
 epoch: 66, train_loss: 0.1924, test_loss: 1.5277, test_f1: 0.6711
 epoch: 67, train_loss: 0.1889, test_loss: 1.3952, test_f1: 0.6932
 epoch: 68, train_loss: 0.1910, test_loss: 1.4648, test_f1: 0.6664
 epoch: 69, train_loss: 0.1844, test_loss: 1.3903, test_f1: 0.6919
 epoch: 70, train_loss: 0.1744, test_loss: 1.5340, test_f1: 0.6901
 epoch: 71, train_loss: 0.1734, test_loss: 1.4882, test_f1: 0.6645
 epoch: 72, train_loss: 0.1689, test_loss: 1.5575, test_f1: 0.6698
 epoch: 73, train_loss: 0.1800, test_loss: 1.3841, test_f1: 0.6851
 epoch: 74, train_loss: 0.1743, test_loss: 1.3825, test_f1: 0.7165
 epoch: 75, train_loss: 0.1629, test_loss: 1.4317, test_f1: 0.7181
 epoch: 76, train_loss: 0.1600, test_loss: 1.4836, test_f1: 0.7060
 epoch: 77, train_loss: 0.1607, test_loss: 1.5917, test_f1: 0.6766
 epoch: 78, train_loss: 0.1629, test_loss: 1.6556, test_f1: 0.6914
 epoch: 79, train_loss: 0.1840, test_loss: 1.6388, test_f1: 0.6853
 epoch: 80, train_loss: 0.1687, test_loss: 1.4168, test_f1: 0.7063
 epoch: 81, train_loss: 0.1705, test_loss: 1.5974, test_f1: 0.6978
 epoch: 82, train_loss: 0.1543, test_loss: 1.6400, test_f1: 0.6744
 epoch: 83, train_loss: 0.1677, test_loss: 1.7738, test_f1: 0.6475
 epoch: 84, train_loss: 0.1618, test_loss: 1.6598, test_f1: 0.6552
 epoch: 85, train_loss: 0.1747, test_loss: 1.8731, test_f1: 0.6501
 epoch: 86, train_loss: 0.1510, test_loss: 1.8235, test_f1: 0.6622
 epoch: 87, train_loss: 0.1334, test_loss: 1.5194, test_f1: 0.6976
 epoch: 88, train_loss: 0.1303, test_loss: 1.8641, test_f1: 0.6734
 epoch: 89, train_loss: 0.1403, test_loss: 1.6721, test_f1: 0.7195
 epoch: 90, train_loss: 0.1310, test_loss: 1.7519, test_f1: 0.6766
 epoch: 91, train_loss: 0.1359, test_loss: 1.6199, test_f1: 0.6878
 epoch: 92, train_loss: 0.1395, test_loss: 1.6851, test_f1: 0.6801
 epoch: 93, train_loss: 0.1298, test_loss: 1.9512, test_f1: 0.6572
 epoch: 94, train_loss: 0.1307, test_loss: 1.6661, test_f1: 0.6786
 epoch: 95, train_loss: 0.1226, test_loss: 1.8497, test_f1: 0.6637
 epoch: 96, train_loss: 0.1338, test_loss: 1.6504, test_f1: 0.7137
 epoch: 97, train_loss: 0.1362, test_loss: 1.9239, test_f1: 0.6622
 epoch: 98, train_loss: 0.1562, test_loss: 1.7431, test_f1: 0.6926
 epoch: 99, train_loss: 0.1389, test_loss: 2.0281, test_f1: 0.6480
##################ITERATION #3 ****************************************
 epoch: 0, train_loss: 1.2126, test_loss: 1.2757, test_f1: 0.2461
 epoch: 1, train_loss: 1.0083, test_loss: 1.0363, test_f1: 0.4705
 epoch: 2, train_loss: 0.9478, test_loss: 0.9023, test_f1: 0.5453
 epoch: 3, train_loss: 0.9020, test_loss: 0.9225, test_f1: 0.5463
 epoch: 4, train_loss: 0.8750, test_loss: 0.9059, test_f1: 0.5608
 epoch: 5, train_loss: 0.8722, test_loss: 0.9649, test_f1: 0.5389
 epoch: 6, train_loss: 0.8384, test_loss: 0.8567, test_f1: 0.6084
 epoch: 7, train_loss: 0.8052, test_loss: 0.8948, test_f1: 0.5423
 epoch: 8, train_loss: 0.7830, test_loss: 0.8260, test_f1: 0.6158
 epoch: 9, train_loss: 0.7625, test_loss: 0.8520, test_f1: 0.5924
 epoch: 10, train_loss: 0.7402, test_loss: 0.9021, test_f1: 0.6191
 epoch: 11, train_loss: 0.7311, test_loss: 0.8825, test_f1: 0.6114
 epoch: 12, train_loss: 0.7232, test_loss: 0.8876, test_f1: 0.6161
 epoch: 13, train_loss: 0.7049, test_loss: 0.8585, test_f1: 0.6430
 epoch: 14, train_loss: 0.6835, test_loss: 0.8070, test_f1: 0.6220
 epoch: 15, train_loss: 0.6758, test_loss: 0.8669, test_f1: 0.6375
 epoch: 16, train_loss: 0.6656, test_loss: 1.0316, test_f1: 0.5698
 epoch: 17, train_loss: 0.6523, test_loss: 0.8715, test_f1: 0.6334
 epoch: 18, train_loss: 0.6262, test_loss: 0.8199, test_f1: 0.6383
 epoch: 19, train_loss: 0.6301, test_loss: 0.9224, test_f1: 0.5994
 epoch: 20, train_loss: 0.6414, test_loss: 0.8881, test_f1: 0.6052
 epoch: 21, train_loss: 0.5929, test_loss: 0.8952, test_f1: 0.6426
 epoch: 22, train_loss: 0.6271, test_loss: 1.0146, test_f1: 0.6041
 epoch: 23, train_loss: 0.5954, test_loss: 0.9829, test_f1: 0.5973
 epoch: 24, train_loss: 0.5715, test_loss: 0.8020, test_f1: 0.6753
 epoch: 25, train_loss: 0.5764, test_loss: 0.9546, test_f1: 0.5997
 epoch: 26, train_loss: 0.5591, test_loss: 0.8650, test_f1: 0.6480
 epoch: 27, train_loss: 0.5365, test_loss: 0.9086, test_f1: 0.6225
 epoch: 28, train_loss: 0.5399, test_loss: 0.7341, test_f1: 0.6700
 epoch: 29, train_loss: 0.5259, test_loss: 0.9271, test_f1: 0.6385
 epoch: 30, train_loss: 0.5162, test_loss: 0.9906, test_f1: 0.6193
 epoch: 31, train_loss: 0.5253, test_loss: 0.8994, test_f1: 0.6185
 epoch: 32, train_loss: 0.5110, test_loss: 0.9768, test_f1: 0.6364
 epoch: 33, train_loss: 0.4993, test_loss: 1.2804, test_f1: 0.5860
 epoch: 34, train_loss: 0.5010, test_loss: 1.0438, test_f1: 0.5981
 epoch: 35, train_loss: 0.5064, test_loss: 0.8208, test_f1: 0.6463
 epoch: 36, train_loss: 0.4723, test_loss: 0.9553, test_f1: 0.5981
 epoch: 37, train_loss: 0.4639, test_loss: 0.8755, test_f1: 0.6675
 epoch: 38, train_loss: 0.4571, test_loss: 0.9031, test_f1: 0.6697
 epoch: 39, train_loss: 0.4446, test_loss: 0.8581, test_f1: 0.6687
 epoch: 40, train_loss: 0.4464, test_loss: 0.9381, test_f1: 0.6616
 epoch: 41, train_loss: 0.4386, test_loss: 1.0145, test_f1: 0.6268
 epoch: 42, train_loss: 0.4315, test_loss: 0.9967, test_f1: 0.6350
 epoch: 43, train_loss: 0.4196, test_loss: 1.3523, test_f1: 0.6037
 epoch: 44, train_loss: 0.4145, test_loss: 0.8418, test_f1: 0.6863
 epoch: 45, train_loss: 0.4182, test_loss: 1.0210, test_f1: 0.6440
 epoch: 46, train_loss: 0.3990, test_loss: 0.9078, test_f1: 0.6550
 epoch: 47, train_loss: 0.3919, test_loss: 0.9037, test_f1: 0.6582
 epoch: 48, train_loss: 0.3916, test_loss: 1.0043, test_f1: 0.6599
 epoch: 49, train_loss: 0.3823, test_loss: 1.1563, test_f1: 0.6258
 epoch: 50, train_loss: 0.3705, test_loss: 1.1838, test_f1: 0.6499
 epoch: 51, train_loss: 0.3279, test_loss: 0.9792, test_f1: 0.6758
 epoch: 52, train_loss: 0.3280, test_loss: 1.0393, test_f1: 0.6659
 epoch: 53, train_loss: 0.2972, test_loss: 0.9922, test_f1: 0.6673
 epoch: 54, train_loss: 0.2760, test_loss: 1.1651, test_f1: 0.6503
 epoch: 55, train_loss: 0.2835, test_loss: 1.1272, test_f1: 0.6405
 epoch: 56, train_loss: 0.2795, test_loss: 1.2097, test_f1: 0.6365
 epoch: 57, train_loss: 0.2897, test_loss: 1.0333, test_f1: 0.6652
 epoch: 58, train_loss: 0.2850, test_loss: 1.1118, test_f1: 0.6322
 epoch: 59, train_loss: 0.2816, test_loss: 1.0508, test_f1: 0.6639
 epoch: 60, train_loss: 0.2799, test_loss: 1.1646, test_f1: 0.6588
 epoch: 61, train_loss: 0.2832, test_loss: 1.0914, test_f1: 0.6501
 epoch: 62, train_loss: 0.2554, test_loss: 1.1452, test_f1: 0.6550
 epoch: 63, train_loss: 0.2473, test_loss: 1.0989, test_f1: 0.6541
 epoch: 64, train_loss: 0.2492, test_loss: 1.1727, test_f1: 0.6476
 epoch: 65, train_loss: 0.2337, test_loss: 1.1610, test_f1: 0.6958
 epoch: 66, train_loss: 0.2344, test_loss: 1.2401, test_f1: 0.6583
 epoch: 67, train_loss: 0.2250, test_loss: 1.2201, test_f1: 0.6459
 epoch: 68, train_loss: 0.2266, test_loss: 1.2089, test_f1: 0.6565
 epoch: 69, train_loss: 0.2374, test_loss: 1.4494, test_f1: 0.6249
 epoch: 70, train_loss: 0.2292, test_loss: 1.2391, test_f1: 0.6359
 epoch: 71, train_loss: 0.2202, test_loss: 1.1795, test_f1: 0.6757
 epoch: 72, train_loss: 0.2285, test_loss: 1.1418, test_f1: 0.6684
 epoch: 73, train_loss: 0.2318, test_loss: 1.1801, test_f1: 0.6806
 epoch: 74, train_loss: 0.2127, test_loss: 1.6141, test_f1: 0.6179
 epoch: 75, train_loss: 0.2099, test_loss: 1.1368, test_f1: 0.6929
 epoch: 76, train_loss: 0.2310, test_loss: 1.4670, test_f1: 0.6222
 epoch: 77, train_loss: 0.2326, test_loss: 1.2912, test_f1: 0.6546
 epoch: 78, train_loss: 0.2167, test_loss: 1.3260, test_f1: 0.6599
 epoch: 79, train_loss: 0.2044, test_loss: 1.2598, test_f1: 0.6860
 epoch: 80, train_loss: 0.2085, test_loss: 1.3834, test_f1: 0.6795
 epoch: 81, train_loss: 0.1899, test_loss: 1.4068, test_f1: 0.6700
 epoch: 82, train_loss: 0.2071, test_loss: 1.3306, test_f1: 0.6799
 epoch: 83, train_loss: 0.1854, test_loss: 1.3392, test_f1: 0.6593
 epoch: 84, train_loss: 0.1880, test_loss: 1.4901, test_f1: 0.6575
 epoch: 85, train_loss: 0.2226, test_loss: 1.3704, test_f1: 0.6450
 epoch: 86, train_loss: 0.1896, test_loss: 1.3936, test_f1: 0.6596
 epoch: 87, train_loss: 0.1857, test_loss: 1.3086, test_f1: 0.6861
 epoch: 88, train_loss: 0.1905, test_loss: 1.2622, test_f1: 0.6659
 epoch: 89, train_loss: 0.1813, test_loss: 1.3730, test_f1: 0.6994
 epoch: 90, train_loss: 0.1934, test_loss: 1.6317, test_f1: 0.6286
 epoch: 91, train_loss: 0.1768, test_loss: 1.5686, test_f1: 0.6552
 epoch: 92, train_loss: 0.1697, test_loss: 1.3931, test_f1: 0.6747
 epoch: 93, train_loss: 0.1762, test_loss: 1.4872, test_f1: 0.6670
 epoch: 94, train_loss: 0.1760, test_loss: 1.7052, test_f1: 0.6393
 epoch: 95, train_loss: 0.1659, test_loss: 1.6329, test_f1: 0.6700
 epoch: 96, train_loss: 0.1700, test_loss: 1.5662, test_f1: 0.6575
 epoch: 97, train_loss: 0.1724, test_loss: 1.5997, test_f1: 0.6723
 epoch: 98, train_loss: 0.1685, test_loss: 1.7154, test_f1: 0.6548
 epoch: 99, train_loss: 0.1628, test_loss: 1.6003, test_f1: 0.6405
##################ITERATION #4 ****************************************
 epoch: 0, train_loss: 1.3374, test_loss: 1.1575, test_f1: 0.3619
 epoch: 1, train_loss: 0.9936, test_loss: 0.9983, test_f1: 0.4902
 epoch: 2, train_loss: 0.9339, test_loss: 0.9662, test_f1: 0.5742
 epoch: 3, train_loss: 0.8887, test_loss: 0.8972, test_f1: 0.5928
 epoch: 4, train_loss: 0.8694, test_loss: 0.9721, test_f1: 0.5167
 epoch: 5, train_loss: 0.8562, test_loss: 0.9152, test_f1: 0.5842
 epoch: 6, train_loss: 0.8282, test_loss: 0.9316, test_f1: 0.5804
 epoch: 7, train_loss: 0.8100, test_loss: 0.9864, test_f1: 0.5090
 epoch: 8, train_loss: 0.7888, test_loss: 0.9151, test_f1: 0.5547
 epoch: 9, train_loss: 0.7924, test_loss: 0.9329, test_f1: 0.5482
 epoch: 10, train_loss: 0.7689, test_loss: 0.8847, test_f1: 0.6075
 epoch: 11, train_loss: 0.7335, test_loss: 0.9767, test_f1: 0.5238
 epoch: 12, train_loss: 0.7260, test_loss: 0.8972, test_f1: 0.6239
 epoch: 13, train_loss: 0.7100, test_loss: 0.8430, test_f1: 0.6410
 epoch: 14, train_loss: 0.6980, test_loss: 0.8571, test_f1: 0.6294
 epoch: 15, train_loss: 0.7030, test_loss: 0.9567, test_f1: 0.5694
 epoch: 16, train_loss: 0.6786, test_loss: 1.0531, test_f1: 0.5367
 epoch: 17, train_loss: 0.6631, test_loss: 0.8624, test_f1: 0.6409
 epoch: 18, train_loss: 0.6455, test_loss: 0.8401, test_f1: 0.5810
 epoch: 19, train_loss: 0.6432, test_loss: 1.1367, test_f1: 0.5645
 epoch: 20, train_loss: 0.6257, test_loss: 0.9253, test_f1: 0.5917
 epoch: 21, train_loss: 0.5987, test_loss: 0.8747, test_f1: 0.6127
 epoch: 22, train_loss: 0.6098, test_loss: 0.8834, test_f1: 0.6258
 epoch: 23, train_loss: 0.5896, test_loss: 0.9455, test_f1: 0.6113
 epoch: 24, train_loss: 0.5740, test_loss: 0.9594, test_f1: 0.6245
 epoch: 25, train_loss: 0.5687, test_loss: 0.9178, test_f1: 0.6261
 epoch: 26, train_loss: 0.5575, test_loss: 0.8424, test_f1: 0.6318
 epoch: 27, train_loss: 0.5222, test_loss: 0.9537, test_f1: 0.6302
 epoch: 28, train_loss: 0.5343, test_loss: 0.9226, test_f1: 0.6192
 epoch: 29, train_loss: 0.5334, test_loss: 1.1915, test_f1: 0.5743
 epoch: 30, train_loss: 0.5264, test_loss: 0.8625, test_f1: 0.6545
 epoch: 31, train_loss: 0.5016, test_loss: 0.9337, test_f1: 0.6297
 epoch: 32, train_loss: 0.4968, test_loss: 0.8828, test_f1: 0.6243
 epoch: 33, train_loss: 0.5045, test_loss: 1.0054, test_f1: 0.6212
 epoch: 34, train_loss: 0.4838, test_loss: 0.9601, test_f1: 0.6765
 epoch: 35, train_loss: 0.4855, test_loss: 0.9097, test_f1: 0.6471
 epoch: 36, train_loss: 0.4860, test_loss: 0.9562, test_f1: 0.6412
 epoch: 37, train_loss: 0.4758, test_loss: 0.9536, test_f1: 0.6284
 epoch: 38, train_loss: 0.4436, test_loss: 0.9287, test_f1: 0.6349
 epoch: 39, train_loss: 0.4479, test_loss: 0.9571, test_f1: 0.6389
 epoch: 40, train_loss: 0.4474, test_loss: 0.8871, test_f1: 0.6458
 epoch: 41, train_loss: 0.4288, test_loss: 1.0399, test_f1: 0.6419
 epoch: 42, train_loss: 0.4230, test_loss: 1.0148, test_f1: 0.6440
 epoch: 43, train_loss: 0.4217, test_loss: 0.9669, test_f1: 0.6540
 epoch: 44, train_loss: 0.4033, test_loss: 1.0695, test_f1: 0.6433
 epoch: 45, train_loss: 0.3913, test_loss: 1.0284, test_f1: 0.6700
 epoch: 46, train_loss: 0.3887, test_loss: 1.0532, test_f1: 0.6196
 epoch: 47, train_loss: 0.4095, test_loss: 1.1332, test_f1: 0.6362
 epoch: 48, train_loss: 0.3848, test_loss: 1.0864, test_f1: 0.6428
 epoch: 49, train_loss: 0.3941, test_loss: 1.1215, test_f1: 0.6177
 epoch: 50, train_loss: 0.3659, test_loss: 1.0347, test_f1: 0.6593
 epoch: 51, train_loss: 0.3311, test_loss: 1.0382, test_f1: 0.6525
 epoch: 52, train_loss: 0.3081, test_loss: 1.0977, test_f1: 0.6621
 epoch: 53, train_loss: 0.3103, test_loss: 1.0747, test_f1: 0.6368
 epoch: 54, train_loss: 0.2860, test_loss: 1.1694, test_f1: 0.6748
 epoch: 55, train_loss: 0.2846, test_loss: 1.1144, test_f1: 0.6549
 epoch: 56, train_loss: 0.2711, test_loss: 1.1353, test_f1: 0.6985
 epoch: 57, train_loss: 0.2797, test_loss: 1.1706, test_f1: 0.6728
 epoch: 58, train_loss: 0.2668, test_loss: 1.2682, test_f1: 0.6107
 epoch: 59, train_loss: 0.2682, test_loss: 1.1445, test_f1: 0.6779
 epoch: 60, train_loss: 0.2755, test_loss: 1.1598, test_f1: 0.6474
 epoch: 61, train_loss: 0.2622, test_loss: 1.2018, test_f1: 0.6811
 epoch: 62, train_loss: 0.2749, test_loss: 1.2156, test_f1: 0.6595
 epoch: 63, train_loss: 0.2860, test_loss: 1.2717, test_f1: 0.6511
 epoch: 64, train_loss: 0.2633, test_loss: 1.2401, test_f1: 0.6524
 epoch: 65, train_loss: 0.2477, test_loss: 1.2782, test_f1: 0.6598
 epoch: 66, train_loss: 0.2381, test_loss: 1.1375, test_f1: 0.6747
 epoch: 67, train_loss: 0.2465, test_loss: 1.1909, test_f1: 0.6561
 epoch: 68, train_loss: 0.2405, test_loss: 1.2768, test_f1: 0.6522
 epoch: 69, train_loss: 0.2365, test_loss: 1.3306, test_f1: 0.6192
 epoch: 70, train_loss: 0.2404, test_loss: 1.3679, test_f1: 0.6625
 epoch: 71, train_loss: 0.2245, test_loss: 1.1254, test_f1: 0.6847
 epoch: 72, train_loss: 0.2371, test_loss: 1.4099, test_f1: 0.6390
 epoch: 73, train_loss: 0.2295, test_loss: 1.4801, test_f1: 0.6229
 epoch: 74, train_loss: 0.2298, test_loss: 1.2141, test_f1: 0.6747
 epoch: 75, train_loss: 0.2278, test_loss: 1.2705, test_f1: 0.6809
 epoch: 76, train_loss: 0.2286, test_loss: 1.4622, test_f1: 0.6297
 epoch: 77, train_loss: 0.2227, test_loss: 1.3469, test_f1: 0.6880
 epoch: 78, train_loss: 0.2282, test_loss: 1.2217, test_f1: 0.6707
 epoch: 79, train_loss: 0.2176, test_loss: 1.5828, test_f1: 0.6219
 epoch: 80, train_loss: 0.2158, test_loss: 1.4035, test_f1: 0.6562
 epoch: 81, train_loss: 0.2056, test_loss: 1.3916, test_f1: 0.6396
 epoch: 82, train_loss: 0.2162, test_loss: 1.3110, test_f1: 0.7039
 epoch: 83, train_loss: 0.1926, test_loss: 1.3870, test_f1: 0.6512
 epoch: 84, train_loss: 0.1979, test_loss: 1.3282, test_f1: 0.6524
 epoch: 85, train_loss: 0.1916, test_loss: 1.3047, test_f1: 0.6733
 epoch: 86, train_loss: 0.2207, test_loss: 1.5602, test_f1: 0.6413
 epoch: 87, train_loss: 0.2073, test_loss: 1.4889, test_f1: 0.6161
 epoch: 88, train_loss: 0.1846, test_loss: 1.4139, test_f1: 0.6754
 epoch: 89, train_loss: 0.1665, test_loss: 1.4745, test_f1: 0.6594
 epoch: 90, train_loss: 0.1952, test_loss: 1.4296, test_f1: 0.6481
 epoch: 91, train_loss: 0.1844, test_loss: 1.4588, test_f1: 0.6422
 epoch: 92, train_loss: 0.1966, test_loss: 1.6986, test_f1: 0.6068
 epoch: 93, train_loss: 0.1808, test_loss: 1.6204, test_f1: 0.6119
 epoch: 94, train_loss: 0.1623, test_loss: 1.4374, test_f1: 0.6814
 epoch: 95, train_loss: 0.1715, test_loss: 1.5396, test_f1: 0.6514
 epoch: 96, train_loss: 0.1717, test_loss: 1.5446, test_f1: 0.6318
 epoch: 97, train_loss: 0.1839, test_loss: 1.5700, test_f1: 0.6427
 epoch: 98, train_loss: 0.1874, test_loss: 1.4301, test_f1: 0.6558
 epoch: 99, train_loss: 0.1842, test_loss: 1.5895, test_f1: 0.6438
##################ITERATION #5 ****************************************
 epoch: 0, train_loss: 1.5186, test_loss: 1.2302, test_f1: 0.3243
 epoch: 1, train_loss: 1.0305, test_loss: 1.0281, test_f1: 0.4781
 epoch: 2, train_loss: 0.9464, test_loss: 1.0211, test_f1: 0.4962
 epoch: 3, train_loss: 0.9127, test_loss: 0.9687, test_f1: 0.5357
 epoch: 4, train_loss: 0.8642, test_loss: 0.9431, test_f1: 0.5589
 epoch: 5, train_loss: 0.8572, test_loss: 0.9168, test_f1: 0.5964
 epoch: 6, train_loss: 0.8275, test_loss: 0.9945, test_f1: 0.5406
 epoch: 7, train_loss: 0.8171, test_loss: 0.9080, test_f1: 0.5783
 epoch: 8, train_loss: 0.7840, test_loss: 0.8958, test_f1: 0.5796
 epoch: 9, train_loss: 0.7584, test_loss: 0.8945, test_f1: 0.5514
 epoch: 10, train_loss: 0.7432, test_loss: 0.8434, test_f1: 0.6364
 epoch: 11, train_loss: 0.7340, test_loss: 0.8450, test_f1: 0.6330
 epoch: 12, train_loss: 0.7106, test_loss: 0.8702, test_f1: 0.6174
 epoch: 13, train_loss: 0.6901, test_loss: 0.9494, test_f1: 0.5775
 epoch: 14, train_loss: 0.6921, test_loss: 1.4633, test_f1: 0.4781
 epoch: 15, train_loss: 0.6899, test_loss: 0.9336, test_f1: 0.6145
 epoch: 16, train_loss: 0.6700, test_loss: 0.8977, test_f1: 0.6391
 epoch: 17, train_loss: 0.6598, test_loss: 0.8747, test_f1: 0.6193
 epoch: 18, train_loss: 0.6404, test_loss: 0.8071, test_f1: 0.6375
 epoch: 19, train_loss: 0.6345, test_loss: 0.8777, test_f1: 0.5866
 epoch: 20, train_loss: 0.6213, test_loss: 0.9599, test_f1: 0.5870
 epoch: 21, train_loss: 0.6220, test_loss: 0.9761, test_f1: 0.5971
 epoch: 22, train_loss: 0.5984, test_loss: 0.8950, test_f1: 0.5985
 epoch: 23, train_loss: 0.5915, test_loss: 0.9547, test_f1: 0.6292
 epoch: 24, train_loss: 0.5509, test_loss: 0.8649, test_f1: 0.6404
 epoch: 25, train_loss: 0.5525, test_loss: 0.9219, test_f1: 0.6397
 epoch: 26, train_loss: 0.5400, test_loss: 0.8646, test_f1: 0.6055
 epoch: 27, train_loss: 0.5295, test_loss: 0.8829, test_f1: 0.6429
 epoch: 28, train_loss: 0.5279, test_loss: 0.8811, test_f1: 0.6072
 epoch: 29, train_loss: 0.5230, test_loss: 1.0598, test_f1: 0.5921
 epoch: 30, train_loss: 0.5083, test_loss: 0.9459, test_f1: 0.6003
 epoch: 31, train_loss: 0.5096, test_loss: 0.8560, test_f1: 0.6286
 epoch: 32, train_loss: 0.5023, test_loss: 0.9498, test_f1: 0.6351
 epoch: 33, train_loss: 0.4882, test_loss: 0.9002, test_f1: 0.6352
 epoch: 34, train_loss: 0.4765, test_loss: 0.8505, test_f1: 0.6538
 epoch: 35, train_loss: 0.4503, test_loss: 0.9628, test_f1: 0.6389
 epoch: 36, train_loss: 0.4555, test_loss: 1.0653, test_f1: 0.5852
 epoch: 37, train_loss: 0.4472, test_loss: 0.9758, test_f1: 0.6159
 epoch: 38, train_loss: 0.4109, test_loss: 1.0326, test_f1: 0.6173
 epoch: 39, train_loss: 0.4165, test_loss: 1.0101, test_f1: 0.6578
 epoch: 40, train_loss: 0.4382, test_loss: 1.2026, test_f1: 0.6055
 epoch: 41, train_loss: 0.4166, test_loss: 0.9823, test_f1: 0.6230
 epoch: 42, train_loss: 0.4153, test_loss: 0.9614, test_f1: 0.6726
 epoch: 43, train_loss: 0.4308, test_loss: 1.1651, test_f1: 0.6275
 epoch: 44, train_loss: 0.4024, test_loss: 1.1456, test_f1: 0.5874
 epoch: 45, train_loss: 0.3738, test_loss: 1.0578, test_f1: 0.6408
 epoch: 46, train_loss: 0.3946, test_loss: 0.9438, test_f1: 0.6441
 epoch: 47, train_loss: 0.3808, test_loss: 1.0882, test_f1: 0.6200
 epoch: 48, train_loss: 0.3923, test_loss: 1.0696, test_f1: 0.6083
 epoch: 49, train_loss: 0.3586, test_loss: 1.1328, test_f1: 0.6287
 epoch: 50, train_loss: 0.3609, test_loss: 1.0016, test_f1: 0.6650
 epoch: 51, train_loss: 0.3380, test_loss: 1.1084, test_f1: 0.6453
 epoch: 52, train_loss: 0.3134, test_loss: 1.0853, test_f1: 0.6432
 epoch: 53, train_loss: 0.2931, test_loss: 1.0653, test_f1: 0.6540
 epoch: 54, train_loss: 0.2979, test_loss: 1.0813, test_f1: 0.6313
 epoch: 55, train_loss: 0.2836, test_loss: 1.1913, test_f1: 0.6410
 epoch: 56, train_loss: 0.2598, test_loss: 1.0974, test_f1: 0.6840
 epoch: 57, train_loss: 0.2687, test_loss: 1.0863, test_f1: 0.6579
 epoch: 58, train_loss: 0.2761, test_loss: 1.1922, test_f1: 0.6417
 epoch: 59, train_loss: 0.2804, test_loss: 1.1567, test_f1: 0.6579
 epoch: 60, train_loss: 0.2600, test_loss: 1.1894, test_f1: 0.6630
 epoch: 61, train_loss: 0.2402, test_loss: 1.1827, test_f1: 0.6451
 epoch: 62, train_loss: 0.2539, test_loss: 1.3187, test_f1: 0.6355
 epoch: 63, train_loss: 0.2550, test_loss: 1.2318, test_f1: 0.6678
 epoch: 64, train_loss: 0.2519, test_loss: 1.2773, test_f1: 0.6187
 epoch: 65, train_loss: 0.2449, test_loss: 1.1496, test_f1: 0.6543
 epoch: 66, train_loss: 0.2610, test_loss: 1.2374, test_f1: 0.6364
 epoch: 67, train_loss: 0.2539, test_loss: 1.2133, test_f1: 0.6453
 epoch: 68, train_loss: 0.2336, test_loss: 1.1633, test_f1: 0.6659
 epoch: 69, train_loss: 0.2317, test_loss: 1.3356, test_f1: 0.6179
 epoch: 70, train_loss: 0.2416, test_loss: 1.3017, test_f1: 0.6413
 epoch: 71, train_loss: 0.2447, test_loss: 1.1963, test_f1: 0.6595
 epoch: 72, train_loss: 0.2327, test_loss: 1.2643, test_f1: 0.6875
 epoch: 73, train_loss: 0.2439, test_loss: 1.2291, test_f1: 0.6332
 epoch: 74, train_loss: 0.2211, test_loss: 1.3776, test_f1: 0.6257
 epoch: 75, train_loss: 0.2234, test_loss: 1.3955, test_f1: 0.6206
 epoch: 76, train_loss: 0.2071, test_loss: 1.2826, test_f1: 0.6631
 epoch: 77, train_loss: 0.1992, test_loss: 1.3633, test_f1: 0.6240
 epoch: 78, train_loss: 0.2136, test_loss: 1.4574, test_f1: 0.6270
 epoch: 79, train_loss: 0.2128, test_loss: 1.2816, test_f1: 0.6556
 epoch: 80, train_loss: 0.2240, test_loss: 1.2970, test_f1: 0.6685
 epoch: 81, train_loss: 0.2056, test_loss: 1.4662, test_f1: 0.6320
 epoch: 82, train_loss: 0.2112, test_loss: 1.4323, test_f1: 0.6330
 epoch: 83, train_loss: 0.2053, test_loss: 1.3585, test_f1: 0.6636
 epoch: 84, train_loss: 0.2092, test_loss: 1.4427, test_f1: 0.6464
 epoch: 85, train_loss: 0.1838, test_loss: 1.3086, test_f1: 0.6686
 epoch: 86, train_loss: 0.1899, test_loss: 1.4953, test_f1: 0.6329
 epoch: 87, train_loss: 0.1929, test_loss: 1.5144, test_f1: 0.6406
 epoch: 88, train_loss: 0.1964, test_loss: 1.3423, test_f1: 0.6592
 epoch: 89, train_loss: 0.1998, test_loss: 1.3389, test_f1: 0.6697
 epoch: 90, train_loss: 0.1853, test_loss: 1.4482, test_f1: 0.6572
 epoch: 91, train_loss: 0.1831, test_loss: 1.4687, test_f1: 0.6307
 epoch: 92, train_loss: 0.1927, test_loss: 1.5717, test_f1: 0.6346
 epoch: 93, train_loss: 0.1958, test_loss: 1.4534, test_f1: 0.6500
 epoch: 94, train_loss: 0.1840, test_loss: 1.5231, test_f1: 0.6558
 epoch: 95, train_loss: 0.1774, test_loss: 1.5720, test_f1: 0.6321
 epoch: 96, train_loss: 0.1964, test_loss: 1.5586, test_f1: 0.6539
 epoch: 97, train_loss: 0.1747, test_loss: 1.5256, test_f1: 0.6500
 epoch: 98, train_loss: 0.1660, test_loss: 1.5688, test_f1: 0.6143
 epoch: 99, train_loss: 0.1768, test_loss: 1.3974, test_f1: 0.6431
##################ITERATION #6 ****************************************
 epoch: 0, train_loss: 1.4830, test_loss: 1.3223, test_f1: 0.2671
 epoch: 1, train_loss: 0.9927, test_loss: 1.0172, test_f1: 0.4781
 epoch: 2, train_loss: 0.9272, test_loss: 0.9584, test_f1: 0.5816
 epoch: 3, train_loss: 0.8916, test_loss: 0.9346, test_f1: 0.5571
 epoch: 4, train_loss: 0.8643, test_loss: 0.9973, test_f1: 0.5666
 epoch: 5, train_loss: 0.8244, test_loss: 0.8994, test_f1: 0.6107
 epoch: 6, train_loss: 0.8124, test_loss: 0.8821, test_f1: 0.6139
 epoch: 7, train_loss: 0.8065, test_loss: 0.9197, test_f1: 0.5832
 epoch: 8, train_loss: 0.7723, test_loss: 0.8558, test_f1: 0.6222
 epoch: 9, train_loss: 0.7537, test_loss: 0.8842, test_f1: 0.6243
 epoch: 10, train_loss: 0.7596, test_loss: 0.8917, test_f1: 0.5825
 epoch: 11, train_loss: 0.7192, test_loss: 0.8661, test_f1: 0.6137
 epoch: 12, train_loss: 0.6865, test_loss: 0.8398, test_f1: 0.6173
 epoch: 13, train_loss: 0.7017, test_loss: 0.9197, test_f1: 0.6106
 epoch: 14, train_loss: 0.6781, test_loss: 0.7879, test_f1: 0.6765
 epoch: 15, train_loss: 0.6597, test_loss: 0.8579, test_f1: 0.6043
 epoch: 16, train_loss: 0.6407, test_loss: 0.9023, test_f1: 0.5963
 epoch: 17, train_loss: 0.6449, test_loss: 0.9242, test_f1: 0.5988
 epoch: 18, train_loss: 0.6266, test_loss: 0.8493, test_f1: 0.6412
 epoch: 19, train_loss: 0.5922, test_loss: 0.8107, test_f1: 0.6587
 epoch: 20, train_loss: 0.6153, test_loss: 0.8280, test_f1: 0.6255
 epoch: 21, train_loss: 0.6017, test_loss: 0.8602, test_f1: 0.6646
 epoch: 22, train_loss: 0.5815, test_loss: 0.9627, test_f1: 0.6148
 epoch: 23, train_loss: 0.5507, test_loss: 0.8384, test_f1: 0.6553
 epoch: 24, train_loss: 0.5413, test_loss: 0.9164, test_f1: 0.6533
 epoch: 25, train_loss: 0.5342, test_loss: 0.9405, test_f1: 0.6147
 epoch: 26, train_loss: 0.5524, test_loss: 0.8677, test_f1: 0.6363
 epoch: 27, train_loss: 0.5116, test_loss: 0.8712, test_f1: 0.6319
 epoch: 28, train_loss: 0.5090, test_loss: 0.9083, test_f1: 0.6301
 epoch: 29, train_loss: 0.4976, test_loss: 1.0814, test_f1: 0.6230
 epoch: 30, train_loss: 0.5153, test_loss: 0.8807, test_f1: 0.6053
 epoch: 31, train_loss: 0.4840, test_loss: 0.9202, test_f1: 0.6447
 epoch: 32, train_loss: 0.4846, test_loss: 0.8465, test_f1: 0.6400
 epoch: 33, train_loss: 0.4648, test_loss: 0.8709, test_f1: 0.6487
 epoch: 34, train_loss: 0.4725, test_loss: 1.1500, test_f1: 0.5934
 epoch: 35, train_loss: 0.4677, test_loss: 0.8593, test_f1: 0.6657
 epoch: 36, train_loss: 0.4530, test_loss: 1.0329, test_f1: 0.6161
 epoch: 37, train_loss: 0.4575, test_loss: 0.9891, test_f1: 0.6515
 epoch: 38, train_loss: 0.4500, test_loss: 0.9320, test_f1: 0.6558
 epoch: 39, train_loss: 0.4296, test_loss: 0.9505, test_f1: 0.6713
 epoch: 40, train_loss: 0.4318, test_loss: 0.9486, test_f1: 0.6518
 epoch: 41, train_loss: 0.4198, test_loss: 1.0153, test_f1: 0.6473
 epoch: 42, train_loss: 0.4003, test_loss: 1.0034, test_f1: 0.6668
 epoch: 43, train_loss: 0.4173, test_loss: 1.1152, test_f1: 0.6184
 epoch: 44, train_loss: 0.4027, test_loss: 0.9514, test_f1: 0.6544
 epoch: 45, train_loss: 0.3800, test_loss: 0.9838, test_f1: 0.6723
 epoch: 46, train_loss: 0.4051, test_loss: 0.9841, test_f1: 0.6782
 epoch: 47, train_loss: 0.3607, test_loss: 1.1884, test_f1: 0.6561
 epoch: 48, train_loss: 0.3687, test_loss: 0.9861, test_f1: 0.6678
 epoch: 49, train_loss: 0.3634, test_loss: 1.1063, test_f1: 0.6409
 epoch: 50, train_loss: 0.3457, test_loss: 0.9936, test_f1: 0.6585
 epoch: 51, train_loss: 0.3417, test_loss: 0.9609, test_f1: 0.6846
 epoch: 52, train_loss: 0.3074, test_loss: 1.0263, test_f1: 0.6785
 epoch: 53, train_loss: 0.2793, test_loss: 1.0974, test_f1: 0.6822
 epoch: 54, train_loss: 0.2830, test_loss: 1.0378, test_f1: 0.6939
 epoch: 55, train_loss: 0.2978, test_loss: 1.0957, test_f1: 0.6781
 epoch: 56, train_loss: 0.2675, test_loss: 1.0792, test_f1: 0.6892
 epoch: 57, train_loss: 0.2620, test_loss: 1.1076, test_f1: 0.6813
 epoch: 58, train_loss: 0.2651, test_loss: 1.1621, test_f1: 0.6968
 epoch: 59, train_loss: 0.2693, test_loss: 1.0977, test_f1: 0.6656
 epoch: 60, train_loss: 0.2567, test_loss: 1.1534, test_f1: 0.6886
 epoch: 61, train_loss: 0.2413, test_loss: 1.1444, test_f1: 0.6726
 epoch: 62, train_loss: 0.2503, test_loss: 1.1951, test_f1: 0.6932
 epoch: 63, train_loss: 0.2392, test_loss: 1.2079, test_f1: 0.6606
 epoch: 64, train_loss: 0.2354, test_loss: 1.1620, test_f1: 0.6886
 epoch: 65, train_loss: 0.2589, test_loss: 1.1045, test_f1: 0.6880
 epoch: 66, train_loss: 0.2478, test_loss: 1.1989, test_f1: 0.6660
 epoch: 67, train_loss: 0.2265, test_loss: 1.1869, test_f1: 0.6742
 epoch: 68, train_loss: 0.2405, test_loss: 1.1888, test_f1: 0.6641
 epoch: 69, train_loss: 0.2368, test_loss: 1.2386, test_f1: 0.6652
 epoch: 70, train_loss: 0.2185, test_loss: 1.2081, test_f1: 0.6714
 epoch: 71, train_loss: 0.2226, test_loss: 1.2772, test_f1: 0.6695
 epoch: 72, train_loss: 0.2335, test_loss: 1.2672, test_f1: 0.6629
 epoch: 73, train_loss: 0.2230, test_loss: 1.3812, test_f1: 0.6563
 epoch: 74, train_loss: 0.2372, test_loss: 1.2703, test_f1: 0.6821
 epoch: 75, train_loss: 0.2257, test_loss: 1.3882, test_f1: 0.6855
 epoch: 76, train_loss: 0.2204, test_loss: 1.1786, test_f1: 0.6900
 epoch: 77, train_loss: 0.2214, test_loss: 1.3678, test_f1: 0.6657
 epoch: 78, train_loss: 0.2006, test_loss: 1.3189, test_f1: 0.6803
 epoch: 79, train_loss: 0.2020, test_loss: 1.3120, test_f1: 0.6631
 epoch: 80, train_loss: 0.1928, test_loss: 1.4388, test_f1: 0.6486
 epoch: 81, train_loss: 0.1970, test_loss: 1.3533, test_f1: 0.6824
 epoch: 82, train_loss: 0.2128, test_loss: 1.3384, test_f1: 0.6803
 epoch: 83, train_loss: 0.2106, test_loss: 1.4119, test_f1: 0.6363
 epoch: 84, train_loss: 0.1912, test_loss: 1.2912, test_f1: 0.6990
 epoch: 85, train_loss: 0.1965, test_loss: 1.3381, test_f1: 0.6753
 epoch: 86, train_loss: 0.1989, test_loss: 1.3544, test_f1: 0.6861
 epoch: 87, train_loss: 0.1902, test_loss: 1.4748, test_f1: 0.6526
 epoch: 88, train_loss: 0.2024, test_loss: 1.4584, test_f1: 0.6610
 epoch: 89, train_loss: 0.1907, test_loss: 1.3611, test_f1: 0.6709
 epoch: 90, train_loss: 0.1714, test_loss: 1.3810, test_f1: 0.6659
 epoch: 91, train_loss: 0.1839, test_loss: 1.4949, test_f1: 0.6462
 epoch: 92, train_loss: 0.1811, test_loss: 1.3750, test_f1: 0.6832
 epoch: 93, train_loss: 0.1838, test_loss: 1.5043, test_f1: 0.6735
 epoch: 94, train_loss: 0.1849, test_loss: 1.4105, test_f1: 0.7010
 epoch: 95, train_loss: 0.1938, test_loss: 1.3264, test_f1: 0.6861
 epoch: 96, train_loss: 0.1913, test_loss: 1.4073, test_f1: 0.6545
 epoch: 97, train_loss: 0.1937, test_loss: 1.5407, test_f1: 0.6699
 epoch: 98, train_loss: 0.1754, test_loss: 1.2881, test_f1: 0.6873
 epoch: 99, train_loss: 0.1821, test_loss: 1.4761, test_f1: 0.6996
##################ITERATION #7 ****************************************
 epoch: 0, train_loss: 1.4429, test_loss: 1.1662, test_f1: 0.3537
 epoch: 1, train_loss: 1.0168, test_loss: 1.0085, test_f1: 0.4508
 epoch: 2, train_loss: 0.9540, test_loss: 0.9790, test_f1: 0.5419
 epoch: 3, train_loss: 0.9160, test_loss: 0.9669, test_f1: 0.5622
 epoch: 4, train_loss: 0.8879, test_loss: 0.9371, test_f1: 0.5867
 epoch: 5, train_loss: 0.8619, test_loss: 0.9451, test_f1: 0.5852
 epoch: 6, train_loss: 0.8468, test_loss: 0.9282, test_f1: 0.6084
 epoch: 7, train_loss: 0.8198, test_loss: 1.0237, test_f1: 0.5445
 epoch: 8, train_loss: 0.7936, test_loss: 1.0613, test_f1: 0.5060
 epoch: 9, train_loss: 0.7685, test_loss: 0.9302, test_f1: 0.5866
 epoch: 10, train_loss: 0.7685, test_loss: 0.9275, test_f1: 0.5774
 epoch: 11, train_loss: 0.7517, test_loss: 0.9119, test_f1: 0.6187
 epoch: 12, train_loss: 0.7264, test_loss: 0.9230, test_f1: 0.5877
 epoch: 13, train_loss: 0.7426, test_loss: 0.8762, test_f1: 0.6043
 epoch: 14, train_loss: 0.7182, test_loss: 0.8756, test_f1: 0.6172
 epoch: 15, train_loss: 0.6891, test_loss: 1.0899, test_f1: 0.5677
 epoch: 16, train_loss: 0.6830, test_loss: 0.8636, test_f1: 0.6295
 epoch: 17, train_loss: 0.6872, test_loss: 0.8623, test_f1: 0.6364
 epoch: 18, train_loss: 0.6604, test_loss: 0.8209, test_f1: 0.6620
 epoch: 19, train_loss: 0.6372, test_loss: 0.9473, test_f1: 0.5978
 epoch: 20, train_loss: 0.6442, test_loss: 0.9632, test_f1: 0.5852
 epoch: 21, train_loss: 0.6179, test_loss: 0.8564, test_f1: 0.6394
 epoch: 22, train_loss: 0.6076, test_loss: 0.9259, test_f1: 0.6057
 epoch: 23, train_loss: 0.5892, test_loss: 0.9183, test_f1: 0.6433
 epoch: 24, train_loss: 0.5941, test_loss: 0.8268, test_f1: 0.6329
 epoch: 25, train_loss: 0.5683, test_loss: 0.9548, test_f1: 0.6286
 epoch: 26, train_loss: 0.5395, test_loss: 0.9339, test_f1: 0.6514
 epoch: 27, train_loss: 0.5602, test_loss: 1.1085, test_f1: 0.5776
 epoch: 28, train_loss: 0.5318, test_loss: 0.9573, test_f1: 0.6263
 epoch: 29, train_loss: 0.5062, test_loss: 0.9497, test_f1: 0.6485
 epoch: 30, train_loss: 0.5203, test_loss: 1.0160, test_f1: 0.6373
 epoch: 31, train_loss: 0.5172, test_loss: 1.8561, test_f1: 0.5351
 epoch: 32, train_loss: 0.5194, test_loss: 1.0772, test_f1: 0.5820
 epoch: 33, train_loss: 0.4930, test_loss: 0.9370, test_f1: 0.6409
 epoch: 34, train_loss: 0.5048, test_loss: 0.9640, test_f1: 0.6290
 epoch: 35, train_loss: 0.4911, test_loss: 1.3144, test_f1: 0.5677
 epoch: 36, train_loss: 0.4744, test_loss: 0.8909, test_f1: 0.6479
 epoch: 37, train_loss: 0.4535, test_loss: 0.9643, test_f1: 0.6410
 epoch: 38, train_loss: 0.4415, test_loss: 1.0073, test_f1: 0.6165
 epoch: 39, train_loss: 0.4580, test_loss: 1.2820, test_f1: 0.5713
 epoch: 40, train_loss: 0.4514, test_loss: 1.1101, test_f1: 0.6072
 epoch: 41, train_loss: 0.4459, test_loss: 1.0446, test_f1: 0.6198
 epoch: 42, train_loss: 0.4358, test_loss: 1.2976, test_f1: 0.5809
 epoch: 43, train_loss: 0.4381, test_loss: 1.1187, test_f1: 0.6234
 epoch: 44, train_loss: 0.4221, test_loss: 1.1558, test_f1: 0.6082
 epoch: 45, train_loss: 0.3887, test_loss: 1.0390, test_f1: 0.6611
 epoch: 46, train_loss: 0.3889, test_loss: 1.2624, test_f1: 0.5917
 epoch: 47, train_loss: 0.3924, test_loss: 1.1790, test_f1: 0.6101
 epoch: 48, train_loss: 0.3892, test_loss: 1.1586, test_f1: 0.6095
 epoch: 49, train_loss: 0.3808, test_loss: 1.0977, test_f1: 0.6648
 epoch: 50, train_loss: 0.3824, test_loss: 1.1349, test_f1: 0.6143
 epoch: 51, train_loss: 0.3347, test_loss: 1.1944, test_f1: 0.6359
 epoch: 52, train_loss: 0.3117, test_loss: 1.1833, test_f1: 0.6339
 epoch: 53, train_loss: 0.3107, test_loss: 1.1620, test_f1: 0.6588
 epoch: 54, train_loss: 0.3126, test_loss: 1.2411, test_f1: 0.6265
 epoch: 55, train_loss: 0.2950, test_loss: 1.1224, test_f1: 0.6450
 epoch: 56, train_loss: 0.2704, test_loss: 1.1826, test_f1: 0.6456
 epoch: 57, train_loss: 0.2761, test_loss: 1.2810, test_f1: 0.6496
 epoch: 58, train_loss: 0.2680, test_loss: 1.3471, test_f1: 0.6649
 epoch: 59, train_loss: 0.2742, test_loss: 1.3296, test_f1: 0.6265
 epoch: 60, train_loss: 0.2829, test_loss: 1.2054, test_f1: 0.6623
 epoch: 61, train_loss: 0.2769, test_loss: 1.2672, test_f1: 0.6520
 epoch: 62, train_loss: 0.2545, test_loss: 1.4118, test_f1: 0.6301
 epoch: 63, train_loss: 0.2767, test_loss: 1.2361, test_f1: 0.6613
 epoch: 64, train_loss: 0.2606, test_loss: 1.3762, test_f1: 0.6296
 epoch: 65, train_loss: 0.2376, test_loss: 1.3792, test_f1: 0.6310
 epoch: 66, train_loss: 0.2500, test_loss: 1.2612, test_f1: 0.6508
 epoch: 67, train_loss: 0.2666, test_loss: 1.3546, test_f1: 0.6270
 epoch: 68, train_loss: 0.2467, test_loss: 1.2974, test_f1: 0.6512
 epoch: 69, train_loss: 0.2429, test_loss: 1.2539, test_f1: 0.6598
 epoch: 70, train_loss: 0.2261, test_loss: 1.4175, test_f1: 0.6329
 epoch: 71, train_loss: 0.2380, test_loss: 1.5088, test_f1: 0.6120
 epoch: 72, train_loss: 0.2371, test_loss: 1.3928, test_f1: 0.6418
 epoch: 73, train_loss: 0.2459, test_loss: 1.3288, test_f1: 0.6430
 epoch: 74, train_loss: 0.2363, test_loss: 1.3783, test_f1: 0.6689
 epoch: 75, train_loss: 0.2340, test_loss: 1.4728, test_f1: 0.6479
 epoch: 76, train_loss: 0.2351, test_loss: 1.3573, test_f1: 0.6414
 epoch: 77, train_loss: 0.2252, test_loss: 1.4847, test_f1: 0.6348
 epoch: 78, train_loss: 0.2233, test_loss: 1.5059, test_f1: 0.6442
 epoch: 79, train_loss: 0.2360, test_loss: 1.5086, test_f1: 0.6165
 epoch: 80, train_loss: 0.2187, test_loss: 1.4782, test_f1: 0.6457
 epoch: 81, train_loss: 0.2196, test_loss: 1.5848, test_f1: 0.6261
 epoch: 82, train_loss: 0.2290, test_loss: 1.4759, test_f1: 0.6544
 epoch: 83, train_loss: 0.1977, test_loss: 1.5537, test_f1: 0.6415
 epoch: 84, train_loss: 0.2214, test_loss: 1.5169, test_f1: 0.6438
 epoch: 85, train_loss: 0.2047, test_loss: 1.5447, test_f1: 0.6461
 epoch: 86, train_loss: 0.2116, test_loss: 1.4543, test_f1: 0.6429
 epoch: 87, train_loss: 0.2229, test_loss: 1.4086, test_f1: 0.6613
 epoch: 88, train_loss: 0.1910, test_loss: 1.5934, test_f1: 0.6418
 epoch: 89, train_loss: 0.1870, test_loss: 1.5138, test_f1: 0.6547
 epoch: 90, train_loss: 0.1965, test_loss: 1.8456, test_f1: 0.5911
 epoch: 91, train_loss: 0.2123, test_loss: 1.4574, test_f1: 0.6650
 epoch: 92, train_loss: 0.2109, test_loss: 1.6256, test_f1: 0.6208
 epoch: 93, train_loss: 0.2027, test_loss: 1.6848, test_f1: 0.6136
 epoch: 94, train_loss: 0.1886, test_loss: 1.5454, test_f1: 0.6407
 epoch: 95, train_loss: 0.1809, test_loss: 1.4914, test_f1: 0.6664
 epoch: 96, train_loss: 0.1842, test_loss: 1.6991, test_f1: 0.6337
 epoch: 97, train_loss: 0.1841, test_loss: 1.6699, test_f1: 0.6255
 epoch: 98, train_loss: 0.1937, test_loss: 1.9463, test_f1: 0.5907
 epoch: 99, train_loss: 0.1936, test_loss: 1.6559, test_f1: 0.6178
##################ITERATION #8 ****************************************
 epoch: 0, train_loss: 1.5862, test_loss: 1.1807, test_f1: 0.3231
 epoch: 1, train_loss: 1.0328, test_loss: 1.0174, test_f1: 0.4345
 epoch: 2, train_loss: 0.9497, test_loss: 0.9533, test_f1: 0.5292
 epoch: 3, train_loss: 0.9225, test_loss: 0.9142, test_f1: 0.5855
 epoch: 4, train_loss: 0.8845, test_loss: 0.9233, test_f1: 0.5185
 epoch: 5, train_loss: 0.8609, test_loss: 0.9338, test_f1: 0.5361
 epoch: 6, train_loss: 0.8321, test_loss: 0.8780, test_f1: 0.5686
 epoch: 7, train_loss: 0.8130, test_loss: 0.8634, test_f1: 0.5944
 epoch: 8, train_loss: 0.7823, test_loss: 0.8738, test_f1: 0.5928
 epoch: 9, train_loss: 0.7627, test_loss: 0.8953, test_f1: 0.6040
 epoch: 10, train_loss: 0.7367, test_loss: 0.8809, test_f1: 0.5885
 epoch: 11, train_loss: 0.7128, test_loss: 0.9448, test_f1: 0.5665
 epoch: 12, train_loss: 0.7206, test_loss: 0.8711, test_f1: 0.5761
 epoch: 13, train_loss: 0.7158, test_loss: 0.8957, test_f1: 0.6219
 epoch: 14, train_loss: 0.6909, test_loss: 0.9053, test_f1: 0.6029
 epoch: 15, train_loss: 0.6791, test_loss: 0.8775, test_f1: 0.6160
 epoch: 16, train_loss: 0.6630, test_loss: 0.9274, test_f1: 0.6376
 epoch: 17, train_loss: 0.6505, test_loss: 0.9708, test_f1: 0.6121
 epoch: 18, train_loss: 0.6329, test_loss: 0.8629, test_f1: 0.6228
 epoch: 19, train_loss: 0.6403, test_loss: 0.8947, test_f1: 0.6549
 epoch: 20, train_loss: 0.6103, test_loss: 0.8923, test_f1: 0.6127
 epoch: 21, train_loss: 0.5991, test_loss: 0.8700, test_f1: 0.6377
 epoch: 22, train_loss: 0.5957, test_loss: 0.8472, test_f1: 0.6493
 epoch: 23, train_loss: 0.5860, test_loss: 0.9012, test_f1: 0.6289
 epoch: 24, train_loss: 0.5852, test_loss: 0.8652, test_f1: 0.6689
 epoch: 25, train_loss: 0.5900, test_loss: 0.8494, test_f1: 0.6653
 epoch: 26, train_loss: 0.5670, test_loss: 0.9007, test_f1: 0.6583
 epoch: 27, train_loss: 0.5475, test_loss: 0.8763, test_f1: 0.6215
 epoch: 28, train_loss: 0.5379, test_loss: 0.8607, test_f1: 0.6665
 epoch: 29, train_loss: 0.5468, test_loss: 0.9985, test_f1: 0.6014
 epoch: 30, train_loss: 0.5239, test_loss: 0.8428, test_f1: 0.6841
 epoch: 31, train_loss: 0.5017, test_loss: 0.8966, test_f1: 0.6619
 epoch: 32, train_loss: 0.5389, test_loss: 1.0134, test_f1: 0.6220
 epoch: 33, train_loss: 0.4944, test_loss: 0.9012, test_f1: 0.6859
 epoch: 34, train_loss: 0.4843, test_loss: 0.9272, test_f1: 0.6360
 epoch: 35, train_loss: 0.4967, test_loss: 0.9632, test_f1: 0.6306
 epoch: 36, train_loss: 0.4588, test_loss: 0.9053, test_f1: 0.7032
 epoch: 37, train_loss: 0.4637, test_loss: 1.0822, test_f1: 0.6579
 epoch: 38, train_loss: 0.4688, test_loss: 0.9570, test_f1: 0.6651
 epoch: 39, train_loss: 0.4811, test_loss: 1.0073, test_f1: 0.6870
 epoch: 40, train_loss: 0.4439, test_loss: 1.0167, test_f1: 0.6420
 epoch: 41, train_loss: 0.4328, test_loss: 1.0364, test_f1: 0.6508
 epoch: 42, train_loss: 0.4228, test_loss: 0.8962, test_f1: 0.6990
 epoch: 43, train_loss: 0.4249, test_loss: 1.0109, test_f1: 0.6737
 epoch: 44, train_loss: 0.4203, test_loss: 0.9634, test_f1: 0.6752
 epoch: 45, train_loss: 0.4073, test_loss: 1.0926, test_f1: 0.6578
 epoch: 46, train_loss: 0.3991, test_loss: 1.1231, test_f1: 0.6866
 epoch: 47, train_loss: 0.4209, test_loss: 1.0554, test_f1: 0.6729
 epoch: 48, train_loss: 0.3855, test_loss: 1.0062, test_f1: 0.6913
 epoch: 49, train_loss: 0.3777, test_loss: 1.0796, test_f1: 0.6583
 epoch: 50, train_loss: 0.3943, test_loss: 1.0741, test_f1: 0.6837
 epoch: 51, train_loss: 0.3594, test_loss: 1.0416, test_f1: 0.6795
 epoch: 52, train_loss: 0.3159, test_loss: 1.1343, test_f1: 0.6777
 epoch: 53, train_loss: 0.3287, test_loss: 1.0695, test_f1: 0.6966
 epoch: 54, train_loss: 0.3182, test_loss: 1.1191, test_f1: 0.6839
 epoch: 55, train_loss: 0.2932, test_loss: 1.1730, test_f1: 0.6631
 epoch: 56, train_loss: 0.2995, test_loss: 1.0939, test_f1: 0.7121
 epoch: 57, train_loss: 0.2892, test_loss: 1.2373, test_f1: 0.6805
 epoch: 58, train_loss: 0.2909, test_loss: 1.2006, test_f1: 0.6751
 epoch: 59, train_loss: 0.2730, test_loss: 1.1583, test_f1: 0.6731
 epoch: 60, train_loss: 0.2904, test_loss: 1.2069, test_f1: 0.6824
 epoch: 61, train_loss: 0.2911, test_loss: 1.1920, test_f1: 0.6715
 epoch: 62, train_loss: 0.2905, test_loss: 1.2201, test_f1: 0.6631
 epoch: 63, train_loss: 0.2591, test_loss: 1.2082, test_f1: 0.6773
 epoch: 64, train_loss: 0.2518, test_loss: 1.1454, test_f1: 0.6966
 epoch: 65, train_loss: 0.2588, test_loss: 1.2399, test_f1: 0.6887
 epoch: 66, train_loss: 0.2583, test_loss: 1.1935, test_f1: 0.6850
 epoch: 67, train_loss: 0.2521, test_loss: 1.2839, test_f1: 0.6550
 epoch: 68, train_loss: 0.2557, test_loss: 1.2152, test_f1: 0.7035
 epoch: 69, train_loss: 0.2489, test_loss: 1.2202, test_f1: 0.6649
 epoch: 70, train_loss: 0.2501, test_loss: 1.3981, test_f1: 0.6416
 epoch: 71, train_loss: 0.2479, test_loss: 1.1999, test_f1: 0.6780
 epoch: 72, train_loss: 0.2774, test_loss: 1.2896, test_f1: 0.6894
 epoch: 73, train_loss: 0.2630, test_loss: 1.2441, test_f1: 0.6842
 epoch: 74, train_loss: 0.2397, test_loss: 1.2879, test_f1: 0.6840
 epoch: 75, train_loss: 0.2491, test_loss: 1.3032, test_f1: 0.6880
 epoch: 76, train_loss: 0.2443, test_loss: 1.3600, test_f1: 0.6821
 epoch: 77, train_loss: 0.2459, test_loss: 1.2810, test_f1: 0.7013
 epoch: 78, train_loss: 0.2386, test_loss: 1.4489, test_f1: 0.6605
 epoch: 79, train_loss: 0.2334, test_loss: 1.2116, test_f1: 0.6979
 epoch: 80, train_loss: 0.2284, test_loss: 1.2494, test_f1: 0.6960
 epoch: 81, train_loss: 0.2175, test_loss: 1.3482, test_f1: 0.6668
 epoch: 82, train_loss: 0.2083, test_loss: 1.2912, test_f1: 0.6941
 epoch: 83, train_loss: 0.2242, test_loss: 1.3736, test_f1: 0.6834
 epoch: 84, train_loss: 0.2218, test_loss: 1.4585, test_f1: 0.6568
 epoch: 85, train_loss: 0.2126, test_loss: 1.5626, test_f1: 0.6699
 epoch: 86, train_loss: 0.2194, test_loss: 1.3279, test_f1: 0.6917
 epoch: 87, train_loss: 0.2117, test_loss: 1.4435, test_f1: 0.6669
 epoch: 88, train_loss: 0.2100, test_loss: 1.4881, test_f1: 0.6330
 epoch: 89, train_loss: 0.2269, test_loss: 1.3977, test_f1: 0.6931
 epoch: 90, train_loss: 0.2065, test_loss: 1.5055, test_f1: 0.6713
 epoch: 91, train_loss: 0.1987, test_loss: 1.3283, test_f1: 0.6918
 epoch: 92, train_loss: 0.2049, test_loss: 1.4898, test_f1: 0.6852
 epoch: 93, train_loss: 0.1994, test_loss: 1.5065, test_f1: 0.6804
 epoch: 94, train_loss: 0.2039, test_loss: 1.3647, test_f1: 0.6772
 epoch: 95, train_loss: 0.2192, test_loss: 1.4776, test_f1: 0.6650
 epoch: 96, train_loss: 0.2052, test_loss: 1.4191, test_f1: 0.6894
 epoch: 97, train_loss: 0.2130, test_loss: 1.3895, test_f1: 0.6738
 epoch: 98, train_loss: 0.1940, test_loss: 1.4398, test_f1: 0.6836
 epoch: 99, train_loss: 0.1896, test_loss: 1.4840, test_f1: 0.6837
##################ITERATION #9 ****************************************
 epoch: 0, train_loss: 1.4516, test_loss: 1.2315, test_f1: 0.2792
 epoch: 1, train_loss: 1.0116, test_loss: 1.0629, test_f1: 0.4008
 epoch: 2, train_loss: 0.9521, test_loss: 0.9816, test_f1: 0.4853
 epoch: 3, train_loss: 0.9165, test_loss: 0.9579, test_f1: 0.5410
 epoch: 4, train_loss: 0.8836, test_loss: 0.9288, test_f1: 0.5949
 epoch: 5, train_loss: 0.8619, test_loss: 0.8810, test_f1: 0.5969
 epoch: 6, train_loss: 0.8300, test_loss: 0.8273, test_f1: 0.5776
 epoch: 7, train_loss: 0.7984, test_loss: 1.0352, test_f1: 0.4605
 epoch: 8, train_loss: 0.7897, test_loss: 0.9794, test_f1: 0.5912
 epoch: 9, train_loss: 0.7463, test_loss: 0.8758, test_f1: 0.5948
 epoch: 10, train_loss: 0.7448, test_loss: 0.8511, test_f1: 0.6174
 epoch: 11, train_loss: 0.7302, test_loss: 0.8387, test_f1: 0.6084
 epoch: 12, train_loss: 0.7157, test_loss: 0.8308, test_f1: 0.6328
 epoch: 13, train_loss: 0.6899, test_loss: 0.8433, test_f1: 0.5950
 epoch: 14, train_loss: 0.6808, test_loss: 0.8931, test_f1: 0.5928
 epoch: 15, train_loss: 0.6566, test_loss: 0.8284, test_f1: 0.6372
 epoch: 16, train_loss: 0.6477, test_loss: 0.7969, test_f1: 0.6281
 epoch: 17, train_loss: 0.6411, test_loss: 0.8234, test_f1: 0.5912
 epoch: 18, train_loss: 0.6384, test_loss: 0.9548, test_f1: 0.6090
 epoch: 19, train_loss: 0.6225, test_loss: 0.9278, test_f1: 0.6114
 epoch: 20, train_loss: 0.5994, test_loss: 0.8813, test_f1: 0.6250
 epoch: 21, train_loss: 0.6033, test_loss: 0.8245, test_f1: 0.6548
 epoch: 22, train_loss: 0.5868, test_loss: 0.7623, test_f1: 0.6270
 epoch: 23, train_loss: 0.5861, test_loss: 0.7726, test_f1: 0.6329
 epoch: 24, train_loss: 0.5739, test_loss: 0.7548, test_f1: 0.6346
 epoch: 25, train_loss: 0.5422, test_loss: 0.7739, test_f1: 0.6557
 epoch: 26, train_loss: 0.5280, test_loss: 0.8525, test_f1: 0.6301
 epoch: 27, train_loss: 0.5376, test_loss: 0.7623, test_f1: 0.6673
 epoch: 28, train_loss: 0.5235, test_loss: 0.8922, test_f1: 0.6386
 epoch: 29, train_loss: 0.4957, test_loss: 0.8159, test_f1: 0.6156
 epoch: 30, train_loss: 0.4995, test_loss: 0.8813, test_f1: 0.6261
 epoch: 31, train_loss: 0.4982, test_loss: 0.8577, test_f1: 0.6499
 epoch: 32, train_loss: 0.4794, test_loss: 0.8257, test_f1: 0.6309
 epoch: 33, train_loss: 0.5139, test_loss: 1.1280, test_f1: 0.5981
 epoch: 34, train_loss: 0.4842, test_loss: 0.7994, test_f1: 0.6664
 epoch: 35, train_loss: 0.4727, test_loss: 0.7982, test_f1: 0.6622
 epoch: 36, train_loss: 0.4376, test_loss: 0.8915, test_f1: 0.6508
 epoch: 37, train_loss: 0.4417, test_loss: 0.9892, test_f1: 0.6141
 epoch: 38, train_loss: 0.4621, test_loss: 0.8298, test_f1: 0.6372
 epoch: 39, train_loss: 0.4407, test_loss: 0.8491, test_f1: 0.6584
 epoch: 40, train_loss: 0.4329, test_loss: 0.8862, test_f1: 0.6389
 epoch: 41, train_loss: 0.4249, test_loss: 0.9231, test_f1: 0.6534
 epoch: 42, train_loss: 0.4265, test_loss: 0.9136, test_f1: 0.6383
 epoch: 43, train_loss: 0.4000, test_loss: 0.9156, test_f1: 0.6497
 epoch: 44, train_loss: 0.3807, test_loss: 1.0334, test_f1: 0.6442
 epoch: 45, train_loss: 0.3952, test_loss: 0.9663, test_f1: 0.6269
 epoch: 46, train_loss: 0.4038, test_loss: 0.8927, test_f1: 0.6730
 epoch: 47, train_loss: 0.3737, test_loss: 0.8796, test_f1: 0.6781
 epoch: 48, train_loss: 0.3713, test_loss: 1.0907, test_f1: 0.6491
 epoch: 49, train_loss: 0.3851, test_loss: 0.9388, test_f1: 0.6483
 epoch: 50, train_loss: 0.3683, test_loss: 0.9470, test_f1: 0.6409
 epoch: 51, train_loss: 0.3202, test_loss: 1.0046, test_f1: 0.6703
 epoch: 52, train_loss: 0.3056, test_loss: 1.0502, test_f1: 0.6847
 epoch: 53, train_loss: 0.2869, test_loss: 1.0650, test_f1: 0.6860
 epoch: 54, train_loss: 0.2777, test_loss: 1.0958, test_f1: 0.6569
 epoch: 55, train_loss: 0.2713, test_loss: 1.0790, test_f1: 0.6553
 epoch: 56, train_loss: 0.2677, test_loss: 1.1226, test_f1: 0.6532
 epoch: 57, train_loss: 0.2801, test_loss: 1.2249, test_f1: 0.6693
 epoch: 58, train_loss: 0.2626, test_loss: 1.1221, test_f1: 0.6868
 epoch: 59, train_loss: 0.2724, test_loss: 1.1526, test_f1: 0.6690
 epoch: 60, train_loss: 0.2591, test_loss: 1.0506, test_f1: 0.6709
 epoch: 61, train_loss: 0.2697, test_loss: 1.2860, test_f1: 0.6357
 epoch: 62, train_loss: 0.2453, test_loss: 1.1425, test_f1: 0.6668
 epoch: 63, train_loss: 0.2510, test_loss: 1.1596, test_f1: 0.6733
 epoch: 64, train_loss: 0.2337, test_loss: 1.1200, test_f1: 0.6569
 epoch: 65, train_loss: 0.2442, test_loss: 1.2758, test_f1: 0.6536
 epoch: 66, train_loss: 0.2542, test_loss: 1.2515, test_f1: 0.6659
 epoch: 67, train_loss: 0.2413, test_loss: 1.0734, test_f1: 0.6707
 epoch: 68, train_loss: 0.2276, test_loss: 1.1780, test_f1: 0.6767
 epoch: 69, train_loss: 0.2395, test_loss: 1.3385, test_f1: 0.6403
 epoch: 70, train_loss: 0.2236, test_loss: 1.2100, test_f1: 0.6764
 epoch: 71, train_loss: 0.2186, test_loss: 1.2513, test_f1: 0.6979
 epoch: 72, train_loss: 0.2233, test_loss: 1.2193, test_f1: 0.6815
 epoch: 73, train_loss: 0.2410, test_loss: 1.2743, test_f1: 0.6612
 epoch: 74, train_loss: 0.2339, test_loss: 1.2637, test_f1: 0.6574
 epoch: 75, train_loss: 0.2237, test_loss: 1.1829, test_f1: 0.6923
 epoch: 76, train_loss: 0.2213, test_loss: 1.4859, test_f1: 0.6640
 epoch: 77, train_loss: 0.2400, test_loss: 1.4712, test_f1: 0.6548
 epoch: 78, train_loss: 0.2117, test_loss: 1.3401, test_f1: 0.6688
 epoch: 79, train_loss: 0.2241, test_loss: 1.3601, test_f1: 0.6781
 epoch: 80, train_loss: 0.2323, test_loss: 1.4613, test_f1: 0.6554
 epoch: 81, train_loss: 0.2129, test_loss: 1.2881, test_f1: 0.6738
 epoch: 82, train_loss: 0.2071, test_loss: 1.2620, test_f1: 0.6583
 epoch: 83, train_loss: 0.2178, test_loss: 1.7140, test_f1: 0.6320
 epoch: 84, train_loss: 0.2209, test_loss: 1.3562, test_f1: 0.6774
 epoch: 85, train_loss: 0.2087, test_loss: 1.2333, test_f1: 0.6765
 epoch: 86, train_loss: 0.2038, test_loss: 1.2808, test_f1: 0.6577
 epoch: 87, train_loss: 0.2124, test_loss: 1.2622, test_f1: 0.6741
 epoch: 88, train_loss: 0.1832, test_loss: 1.4097, test_f1: 0.6779
 epoch: 89, train_loss: 0.1913, test_loss: 1.5016, test_f1: 0.6801
 epoch: 90, train_loss: 0.2002, test_loss: 1.2505, test_f1: 0.6886
 epoch: 91, train_loss: 0.1766, test_loss: 1.3943, test_f1: 0.6762
 epoch: 92, train_loss: 0.1743, test_loss: 1.4286, test_f1: 0.6815
 epoch: 93, train_loss: 0.1773, test_loss: 1.6609, test_f1: 0.6606
 epoch: 94, train_loss: 0.1797, test_loss: 1.4511, test_f1: 0.6565
 epoch: 95, train_loss: 0.1823, test_loss: 1.5858, test_f1: 0.6628
 epoch: 96, train_loss: 0.1735, test_loss: 1.5353, test_f1: 0.6587
 epoch: 97, train_loss: 0.1771, test_loss: 1.1931, test_f1: 0.6744
 epoch: 98, train_loss: 0.1725, test_loss: 1.4369, test_f1: 0.7023
 epoch: 99, train_loss: 0.1824, test_loss: 1.3969, test_f1: 0.6678

Training completed in 473.21 seconds
Best F1: 0.7195 at epoch 89
Mean F1 across iterations: 0.6979  0.0133
========================FINAL RESULTS================================
FEGIN weighted F1: 0.7195  0.0133
python main.py --data ltspice_examples --representation component_pin --model FEGIN --layers 2 --hiddens 128 --batch_size 128 --lr 0.001 --emb_size 250 --epochs 100 --save_appendix component_pin_L2_H128_BS128_LR0.001_E250 --no_val
-----



STDERR:
  File "main.py", line 370, in <module>
    main()
  File "main.py", line 254, in main
    dataset = dataset_class(
  File "/home/philip/projects/ltspice_examples_code_repo/Circuit-Completion-Using-GNNs/component_classification_with_link_prediction_head/evaluation/FEGIN/kernel/circuit_datasets.py", line 15, in __init__
    self.data, self.slices = torch.load(self.processed_paths[0])
  File "/home/philip/.local/lib/python3.8/site-packages/torch/serialization.py", line 1040, in load
    warnings.warn(
  File "/usr/lib/python3.8/warnings.py", line 109, in _showwarnmsg
    sw(msg.message, msg.category, msg.filename, msg.lineno,
  File "main.py", line 47, in warn_with_traceback
    traceback.print_stack(file=log)
/home/philip/projects/ltspice_examples_code_repo/Circuit-Completion-Using-GNNs/component_classification_with_link_prediction_head/evaluation/FEGIN/kernel/circuit_datasets.py:15: FutureWarning: You are using `torch.load` with `weights_only=False` (the current default value), which uses the default pickle module implicitly. It is possible to construct malicious pickle data which will execute arbitrary code during unpickling (See https://github.com/pytorch/pytorch/blob/main/SECURITY.md#untrusted-models for more details). In a future release, the default value for `weights_only` will be flipped to `True`. This limits the functions that could be executed during unpickling. Arbitrary objects will no longer be allowed to be loaded via this mode unless they are explicitly allowlisted by the user via `torch.serialization.add_safe_globals`. We recommend you start setting `weights_only=True` for any use case where you don't have full control of the loaded file. Please open an issue on GitHub for any issues related to this experimental feature.
  self.data, self.slices = torch.load(self.processed_paths[0])
