STDOUT:
Results will be saved in /home/philip/projects/ltspice_examples_code_repo/Circuit-Completion-Using-GNNs/component_classification_with_link_prediction_head/evaluation/FEGIN/results/model_FEGIN_dataset_ltspice_examples
Command line input: python main.py --data ltspice_examples --representation component_component --model FEGIN --layers 4 --hiddens 16 --batch_size 128 --lr 0.001 --emb_size 128 --epochs 100 --save_appendix component_component_L4_H16_BS128_LR0.001_E128 --no_val
 is saved.
-----
ltspice_examples - FEGIN
Using 4 layers, 16 hidden units, h = 2
Loading component_component representation dataset
ENTERED
Training FEGIN on component_component representation
Train: 3556, Test: 845
##################ITERATION #0 ****************************************
 epoch: 0, train_loss: 1.3474, test_loss: 1.3455, test_f1: 0.2274
 epoch: 1, train_loss: 1.3261, test_loss: 1.3282, test_f1: 0.2274
 epoch: 2, train_loss: 1.3078, test_loss: 1.3086, test_f1: 0.2274
 epoch: 3, train_loss: 1.2875, test_loss: 1.2834, test_f1: 0.2274
 epoch: 4, train_loss: 1.2691, test_loss: 1.2543, test_f1: 0.2274
 epoch: 5, train_loss: 1.2547, test_loss: 1.2287, test_f1: 0.2274
 epoch: 6, train_loss: 1.2418, test_loss: 1.2184, test_f1: 0.2274
 epoch: 7, train_loss: 1.2368, test_loss: 1.2121, test_f1: 0.2444
 epoch: 8, train_loss: 1.2233, test_loss: 1.2029, test_f1: 0.2998
 epoch: 9, train_loss: 1.2188, test_loss: 1.1943, test_f1: 0.3200
 epoch: 10, train_loss: 1.2097, test_loss: 1.1858, test_f1: 0.3697
 epoch: 11, train_loss: 1.1936, test_loss: 1.1648, test_f1: 0.3812
 epoch: 12, train_loss: 1.1885, test_loss: 1.1574, test_f1: 0.3623
 epoch: 13, train_loss: 1.1736, test_loss: 1.1569, test_f1: 0.4230
 epoch: 14, train_loss: 1.1720, test_loss: 1.1521, test_f1: 0.4383
 epoch: 15, train_loss: 1.1541, test_loss: 1.1330, test_f1: 0.4527
 epoch: 16, train_loss: 1.1442, test_loss: 1.1320, test_f1: 0.4502
 epoch: 17, train_loss: 1.1381, test_loss: 1.1082, test_f1: 0.4554
 epoch: 18, train_loss: 1.1272, test_loss: 1.1376, test_f1: 0.4469
 epoch: 19, train_loss: 1.1203, test_loss: 1.0945, test_f1: 0.4287
 epoch: 20, train_loss: 1.1046, test_loss: 1.0639, test_f1: 0.4836
 epoch: 21, train_loss: 1.1058, test_loss: 1.0929, test_f1: 0.4673
 epoch: 22, train_loss: 1.0877, test_loss: 1.0590, test_f1: 0.4382
 epoch: 23, train_loss: 1.0747, test_loss: 1.0413, test_f1: 0.4895
 epoch: 24, train_loss: 1.0724, test_loss: 1.0726, test_f1: 0.4400
 epoch: 25, train_loss: 1.0644, test_loss: 1.0556, test_f1: 0.4836
 epoch: 26, train_loss: 1.0488, test_loss: 1.0313, test_f1: 0.5002
 epoch: 27, train_loss: 1.0503, test_loss: 1.0244, test_f1: 0.4787
 epoch: 28, train_loss: 1.0340, test_loss: 1.0093, test_f1: 0.4920
 epoch: 29, train_loss: 1.0229, test_loss: 1.0085, test_f1: 0.4930
 epoch: 30, train_loss: 1.0201, test_loss: 1.0053, test_f1: 0.4603
 epoch: 31, train_loss: 1.0128, test_loss: 0.9978, test_f1: 0.4698
 epoch: 32, train_loss: 1.0137, test_loss: 1.0093, test_f1: 0.4680
 epoch: 33, train_loss: 0.9873, test_loss: 0.9993, test_f1: 0.4791
 epoch: 34, train_loss: 0.9943, test_loss: 1.0066, test_f1: 0.4747
 epoch: 35, train_loss: 0.9841, test_loss: 0.9958, test_f1: 0.4758
 epoch: 36, train_loss: 0.9824, test_loss: 0.9899, test_f1: 0.4878
 epoch: 37, train_loss: 0.9800, test_loss: 0.9853, test_f1: 0.4863
 epoch: 38, train_loss: 0.9656, test_loss: 0.9900, test_f1: 0.4680
 epoch: 39, train_loss: 0.9643, test_loss: 0.9880, test_f1: 0.4722
 epoch: 40, train_loss: 0.9618, test_loss: 0.9670, test_f1: 0.4827
 epoch: 41, train_loss: 0.9619, test_loss: 0.9704, test_f1: 0.4942
 epoch: 42, train_loss: 0.9685, test_loss: 0.9958, test_f1: 0.4961
 epoch: 43, train_loss: 0.9570, test_loss: 0.9722, test_f1: 0.5073
 epoch: 44, train_loss: 0.9469, test_loss: 1.0089, test_f1: 0.4673
 epoch: 45, train_loss: 0.9389, test_loss: 0.9804, test_f1: 0.4844
 epoch: 46, train_loss: 0.9335, test_loss: 0.9738, test_f1: 0.5028
 epoch: 47, train_loss: 0.9334, test_loss: 0.9739, test_f1: 0.4744
 epoch: 48, train_loss: 0.9301, test_loss: 0.9827, test_f1: 0.5064
 epoch: 49, train_loss: 0.9217, test_loss: 0.9652, test_f1: 0.5155
 epoch: 50, train_loss: 0.9198, test_loss: 0.9695, test_f1: 0.5241
 epoch: 51, train_loss: 0.9138, test_loss: 0.9847, test_f1: 0.5166
 epoch: 52, train_loss: 0.9071, test_loss: 0.9646, test_f1: 0.5159
 epoch: 53, train_loss: 0.9040, test_loss: 0.9808, test_f1: 0.5062
 epoch: 54, train_loss: 0.9065, test_loss: 0.9776, test_f1: 0.5141
 epoch: 55, train_loss: 0.9005, test_loss: 0.9883, test_f1: 0.5177
 epoch: 56, train_loss: 0.9008, test_loss: 0.9882, test_f1: 0.5038
 epoch: 57, train_loss: 0.8990, test_loss: 0.9996, test_f1: 0.5136
 epoch: 58, train_loss: 0.8971, test_loss: 0.9762, test_f1: 0.4935
 epoch: 59, train_loss: 0.8867, test_loss: 1.0025, test_f1: 0.5056
 epoch: 60, train_loss: 0.8942, test_loss: 0.9898, test_f1: 0.5199
 epoch: 61, train_loss: 0.8844, test_loss: 0.9903, test_f1: 0.5113
 epoch: 62, train_loss: 0.8807, test_loss: 0.9996, test_f1: 0.5161
 epoch: 63, train_loss: 0.8750, test_loss: 0.9869, test_f1: 0.5068
 epoch: 64, train_loss: 0.8820, test_loss: 1.0283, test_f1: 0.5159
 epoch: 65, train_loss: 0.8718, test_loss: 0.9865, test_f1: 0.5095
 epoch: 66, train_loss: 0.8818, test_loss: 1.0082, test_f1: 0.4999
 epoch: 67, train_loss: 0.8769, test_loss: 1.0204, test_f1: 0.4861
 epoch: 68, train_loss: 0.8638, test_loss: 1.0099, test_f1: 0.5212
 epoch: 69, train_loss: 0.8695, test_loss: 1.0059, test_f1: 0.5101
 epoch: 70, train_loss: 0.8674, test_loss: 1.0291, test_f1: 0.5090
 epoch: 71, train_loss: 0.8697, test_loss: 1.0097, test_f1: 0.5089
 epoch: 72, train_loss: 0.8701, test_loss: 1.0167, test_f1: 0.5077
 epoch: 73, train_loss: 0.8660, test_loss: 1.0256, test_f1: 0.5159
 epoch: 74, train_loss: 0.8742, test_loss: 1.0230, test_f1: 0.5060
 epoch: 75, train_loss: 0.8802, test_loss: 1.0057, test_f1: 0.5168
 epoch: 76, train_loss: 0.8584, test_loss: 1.0305, test_f1: 0.5097
 epoch: 77, train_loss: 0.8585, test_loss: 1.0311, test_f1: 0.5058
 epoch: 78, train_loss: 0.8555, test_loss: 1.0269, test_f1: 0.5176
 epoch: 79, train_loss: 0.8625, test_loss: 1.0208, test_f1: 0.5191
 epoch: 80, train_loss: 0.8597, test_loss: 1.0037, test_f1: 0.5128
 epoch: 81, train_loss: 0.8628, test_loss: 1.0438, test_f1: 0.5193
 epoch: 82, train_loss: 0.8553, test_loss: 1.0106, test_f1: 0.5218
 epoch: 83, train_loss: 0.8673, test_loss: 1.0151, test_f1: 0.5055
 epoch: 84, train_loss: 0.8464, test_loss: 1.0242, test_f1: 0.5116
 epoch: 85, train_loss: 0.8468, test_loss: 1.0245, test_f1: 0.5117
 epoch: 86, train_loss: 0.8462, test_loss: 1.0379, test_f1: 0.5157
 epoch: 87, train_loss: 0.8536, test_loss: 1.0189, test_f1: 0.5131
 epoch: 88, train_loss: 0.8541, test_loss: 1.0786, test_f1: 0.4859
 epoch: 89, train_loss: 0.8424, test_loss: 1.0414, test_f1: 0.5086
 epoch: 90, train_loss: 0.8550, test_loss: 1.0205, test_f1: 0.5151
 epoch: 91, train_loss: 0.8436, test_loss: 1.0485, test_f1: 0.5016
 epoch: 92, train_loss: 0.8441, test_loss: 1.0501, test_f1: 0.5073
 epoch: 93, train_loss: 0.8389, test_loss: 1.0278, test_f1: 0.5047
 epoch: 94, train_loss: 0.8406, test_loss: 1.0397, test_f1: 0.5066
 epoch: 95, train_loss: 0.8321, test_loss: 1.0524, test_f1: 0.5141
 epoch: 96, train_loss: 0.8517, test_loss: 1.0409, test_f1: 0.5195
 epoch: 97, train_loss: 0.8443, test_loss: 1.0286, test_f1: 0.5065
 epoch: 98, train_loss: 0.8463, test_loss: 1.0474, test_f1: 0.4992
 epoch: 99, train_loss: 0.8280, test_loss: 1.0563, test_f1: 0.5088
##################ITERATION #1 ****************************************
 epoch: 0, train_loss: 1.3662, test_loss: 1.3231, test_f1: 0.2274
 epoch: 1, train_loss: 1.2825, test_loss: 1.2772, test_f1: 0.2555
 epoch: 2, train_loss: 1.2595, test_loss: 1.2411, test_f1: 0.2705
 epoch: 3, train_loss: 1.2381, test_loss: 1.2070, test_f1: 0.2946
 epoch: 4, train_loss: 1.2222, test_loss: 1.1834, test_f1: 0.3630
 epoch: 5, train_loss: 1.2062, test_loss: 1.1582, test_f1: 0.4333
 epoch: 6, train_loss: 1.1846, test_loss: 1.1765, test_f1: 0.4232
 epoch: 7, train_loss: 1.1710, test_loss: 1.1241, test_f1: 0.4176
 epoch: 8, train_loss: 1.1405, test_loss: 1.0820, test_f1: 0.4539
 epoch: 9, train_loss: 1.1260, test_loss: 1.0848, test_f1: 0.4347
 epoch: 10, train_loss: 1.1099, test_loss: 1.0882, test_f1: 0.4437
 epoch: 11, train_loss: 1.1041, test_loss: 1.0464, test_f1: 0.4506
 epoch: 12, train_loss: 1.0892, test_loss: 1.0197, test_f1: 0.4828
 epoch: 13, train_loss: 1.0745, test_loss: 0.9997, test_f1: 0.4784
 epoch: 14, train_loss: 1.0710, test_loss: 1.0006, test_f1: 0.4789
 epoch: 15, train_loss: 1.0563, test_loss: 1.0042, test_f1: 0.4788
 epoch: 16, train_loss: 1.0459, test_loss: 0.9969, test_f1: 0.4760
 epoch: 17, train_loss: 1.0399, test_loss: 0.9818, test_f1: 0.4905
 epoch: 18, train_loss: 1.0355, test_loss: 0.9847, test_f1: 0.4763
 epoch: 19, train_loss: 1.0258, test_loss: 0.9901, test_f1: 0.4654
 epoch: 20, train_loss: 1.0117, test_loss: 1.0137, test_f1: 0.4612
 epoch: 21, train_loss: 1.0219, test_loss: 0.9739, test_f1: 0.4750
 epoch: 22, train_loss: 1.0056, test_loss: 1.0065, test_f1: 0.4631
 epoch: 23, train_loss: 0.9926, test_loss: 0.9813, test_f1: 0.4791
 epoch: 24, train_loss: 0.9889, test_loss: 0.9763, test_f1: 0.4707
 epoch: 25, train_loss: 0.9905, test_loss: 1.0112, test_f1: 0.4543
 epoch: 26, train_loss: 0.9868, test_loss: 0.9821, test_f1: 0.4621
 epoch: 27, train_loss: 0.9931, test_loss: 1.0070, test_f1: 0.4668
 epoch: 28, train_loss: 0.9910, test_loss: 0.9717, test_f1: 0.4935
 epoch: 29, train_loss: 0.9743, test_loss: 0.9694, test_f1: 0.4865
 epoch: 30, train_loss: 0.9817, test_loss: 0.9760, test_f1: 0.4694
 epoch: 31, train_loss: 0.9678, test_loss: 0.9684, test_f1: 0.4794
 epoch: 32, train_loss: 0.9626, test_loss: 0.9897, test_f1: 0.4712
 epoch: 33, train_loss: 0.9574, test_loss: 1.0042, test_f1: 0.4590
 epoch: 34, train_loss: 0.9612, test_loss: 0.9778, test_f1: 0.4744
 epoch: 35, train_loss: 0.9521, test_loss: 0.9932, test_f1: 0.4771
 epoch: 36, train_loss: 0.9349, test_loss: 0.9820, test_f1: 0.4778
 epoch: 37, train_loss: 0.9424, test_loss: 1.0063, test_f1: 0.4813
 epoch: 38, train_loss: 0.9358, test_loss: 0.9904, test_f1: 0.4960
 epoch: 39, train_loss: 0.9355, test_loss: 1.0294, test_f1: 0.4650
 epoch: 40, train_loss: 0.9316, test_loss: 1.0332, test_f1: 0.4724
 epoch: 41, train_loss: 0.9382, test_loss: 1.0330, test_f1: 0.4624
 epoch: 42, train_loss: 0.9347, test_loss: 0.9947, test_f1: 0.5021
 epoch: 43, train_loss: 0.9348, test_loss: 1.0414, test_f1: 0.4723
 epoch: 44, train_loss: 0.9207, test_loss: 0.9859, test_f1: 0.4870
 epoch: 45, train_loss: 0.9206, test_loss: 1.0087, test_f1: 0.4945
 epoch: 46, train_loss: 0.9082, test_loss: 0.9863, test_f1: 0.4828
 epoch: 47, train_loss: 0.9094, test_loss: 1.0233, test_f1: 0.4691
 epoch: 48, train_loss: 0.9212, test_loss: 1.0152, test_f1: 0.4807
 epoch: 49, train_loss: 0.9108, test_loss: 1.0327, test_f1: 0.4852
 epoch: 50, train_loss: 0.9001, test_loss: 1.0888, test_f1: 0.4635
 epoch: 51, train_loss: 0.8922, test_loss: 1.0398, test_f1: 0.4823
 epoch: 52, train_loss: 0.8871, test_loss: 1.0334, test_f1: 0.4853
 epoch: 53, train_loss: 0.9003, test_loss: 1.0569, test_f1: 0.4762
 epoch: 54, train_loss: 0.8951, test_loss: 1.0283, test_f1: 0.4804
 epoch: 55, train_loss: 0.8942, test_loss: 1.0361, test_f1: 0.4799
 epoch: 56, train_loss: 0.8850, test_loss: 1.0426, test_f1: 0.4787
 epoch: 57, train_loss: 0.8789, test_loss: 1.0353, test_f1: 0.4903
 epoch: 58, train_loss: 0.8764, test_loss: 1.0329, test_f1: 0.4891
 epoch: 59, train_loss: 0.8790, test_loss: 1.0420, test_f1: 0.4846
 epoch: 60, train_loss: 0.8723, test_loss: 1.0745, test_f1: 0.4799
 epoch: 61, train_loss: 0.8777, test_loss: 1.0496, test_f1: 0.4755
 epoch: 62, train_loss: 0.8832, test_loss: 1.0890, test_f1: 0.4842
 epoch: 63, train_loss: 0.8706, test_loss: 1.0507, test_f1: 0.4818
 epoch: 64, train_loss: 0.8707, test_loss: 1.0443, test_f1: 0.4808
 epoch: 65, train_loss: 0.8703, test_loss: 1.0594, test_f1: 0.4854
 epoch: 66, train_loss: 0.8742, test_loss: 1.0597, test_f1: 0.4830
 epoch: 67, train_loss: 0.8739, test_loss: 1.0442, test_f1: 0.4811
 epoch: 68, train_loss: 0.8669, test_loss: 1.0882, test_f1: 0.4830
 epoch: 69, train_loss: 0.8679, test_loss: 1.0628, test_f1: 0.4811
 epoch: 70, train_loss: 0.8739, test_loss: 1.0690, test_f1: 0.4845
 epoch: 71, train_loss: 0.8724, test_loss: 1.0794, test_f1: 0.4835
 epoch: 72, train_loss: 0.8692, test_loss: 1.0728, test_f1: 0.4797
 epoch: 73, train_loss: 0.8628, test_loss: 1.0732, test_f1: 0.4816
 epoch: 74, train_loss: 0.8637, test_loss: 1.0841, test_f1: 0.4812
 epoch: 75, train_loss: 0.8635, test_loss: 1.0876, test_f1: 0.4867
 epoch: 76, train_loss: 0.8550, test_loss: 1.0766, test_f1: 0.4827
 epoch: 77, train_loss: 0.8659, test_loss: 1.0761, test_f1: 0.4733
 epoch: 78, train_loss: 0.8477, test_loss: 1.1230, test_f1: 0.4725
 epoch: 79, train_loss: 0.8555, test_loss: 1.0844, test_f1: 0.4850
 epoch: 80, train_loss: 0.8544, test_loss: 1.1140, test_f1: 0.4727
 epoch: 81, train_loss: 0.8493, test_loss: 1.1013, test_f1: 0.4761
 epoch: 82, train_loss: 0.8458, test_loss: 1.0972, test_f1: 0.4764
 epoch: 83, train_loss: 0.8614, test_loss: 1.1216, test_f1: 0.4627
 epoch: 84, train_loss: 0.8509, test_loss: 1.1038, test_f1: 0.4714
 epoch: 85, train_loss: 0.8443, test_loss: 1.1215, test_f1: 0.4794
 epoch: 86, train_loss: 0.8467, test_loss: 1.1241, test_f1: 0.4769
 epoch: 87, train_loss: 0.8522, test_loss: 1.0962, test_f1: 0.4811
 epoch: 88, train_loss: 0.8375, test_loss: 1.1127, test_f1: 0.4709
 epoch: 89, train_loss: 0.8387, test_loss: 1.0949, test_f1: 0.4809
 epoch: 90, train_loss: 0.8451, test_loss: 1.1284, test_f1: 0.4704
 epoch: 91, train_loss: 0.8545, test_loss: 1.1314, test_f1: 0.4661
 epoch: 92, train_loss: 0.8338, test_loss: 1.1317, test_f1: 0.5086
 epoch: 93, train_loss: 0.8363, test_loss: 1.1211, test_f1: 0.4762
 epoch: 94, train_loss: 0.8429, test_loss: 1.1300, test_f1: 0.4786
 epoch: 95, train_loss: 0.8352, test_loss: 1.1433, test_f1: 0.4784
 epoch: 96, train_loss: 0.8426, test_loss: 1.1248, test_f1: 0.5020
 epoch: 97, train_loss: 0.8507, test_loss: 1.1450, test_f1: 0.4844
 epoch: 98, train_loss: 0.8394, test_loss: 1.1392, test_f1: 0.4924
 epoch: 99, train_loss: 0.8424, test_loss: 1.1532, test_f1: 0.4973
##################ITERATION #2 ****************************************
 epoch: 0, train_loss: 1.3951, test_loss: 1.3292, test_f1: 0.2274
 epoch: 1, train_loss: 1.2931, test_loss: 1.2733, test_f1: 0.2274
 epoch: 2, train_loss: 1.2704, test_loss: 1.2473, test_f1: 0.2266
 epoch: 3, train_loss: 1.2464, test_loss: 1.2263, test_f1: 0.2555
 epoch: 4, train_loss: 1.2327, test_loss: 1.2035, test_f1: 0.2711
 epoch: 5, train_loss: 1.2258, test_loss: 1.1888, test_f1: 0.3088
 epoch: 6, train_loss: 1.2211, test_loss: 1.1767, test_f1: 0.3442
 epoch: 7, train_loss: 1.2026, test_loss: 1.1653, test_f1: 0.3524
 epoch: 8, train_loss: 1.1996, test_loss: 1.1569, test_f1: 0.3805
 epoch: 9, train_loss: 1.1853, test_loss: 1.1528, test_f1: 0.3921
 epoch: 10, train_loss: 1.1802, test_loss: 1.1421, test_f1: 0.3802
 epoch: 11, train_loss: 1.1705, test_loss: 1.1369, test_f1: 0.3853
 epoch: 12, train_loss: 1.1690, test_loss: 1.1391, test_f1: 0.4016
 epoch: 13, train_loss: 1.1548, test_loss: 1.1234, test_f1: 0.4042
 epoch: 14, train_loss: 1.1451, test_loss: 1.1135, test_f1: 0.4102
 epoch: 15, train_loss: 1.1406, test_loss: 1.1151, test_f1: 0.4134
 epoch: 16, train_loss: 1.1359, test_loss: 1.0976, test_f1: 0.4221
 epoch: 17, train_loss: 1.1239, test_loss: 1.0862, test_f1: 0.4098
 epoch: 18, train_loss: 1.1238, test_loss: 1.0829, test_f1: 0.4227
 epoch: 19, train_loss: 1.1188, test_loss: 1.0771, test_f1: 0.4483
 epoch: 20, train_loss: 1.1090, test_loss: 1.0694, test_f1: 0.4427
 epoch: 21, train_loss: 1.1034, test_loss: 1.0709, test_f1: 0.4508
 epoch: 22, train_loss: 1.1002, test_loss: 1.0571, test_f1: 0.4505
 epoch: 23, train_loss: 1.0887, test_loss: 1.0534, test_f1: 0.4605
 epoch: 24, train_loss: 1.0980, test_loss: 1.0554, test_f1: 0.4660
 epoch: 25, train_loss: 1.0826, test_loss: 1.0582, test_f1: 0.4520
 epoch: 26, train_loss: 1.0753, test_loss: 1.0431, test_f1: 0.4385
 epoch: 27, train_loss: 1.0794, test_loss: 1.0425, test_f1: 0.4427
 epoch: 28, train_loss: 1.0603, test_loss: 1.0483, test_f1: 0.4384
 epoch: 29, train_loss: 1.0607, test_loss: 1.0376, test_f1: 0.4554
 epoch: 30, train_loss: 1.0540, test_loss: 1.0361, test_f1: 0.4521
 epoch: 31, train_loss: 1.0563, test_loss: 1.0388, test_f1: 0.4446
 epoch: 32, train_loss: 1.0533, test_loss: 1.0288, test_f1: 0.4551
 epoch: 33, train_loss: 1.0579, test_loss: 1.0345, test_f1: 0.4527
 epoch: 34, train_loss: 1.0424, test_loss: 1.0293, test_f1: 0.4435
 epoch: 35, train_loss: 1.0277, test_loss: 1.0280, test_f1: 0.4622
 epoch: 36, train_loss: 1.0244, test_loss: 1.0465, test_f1: 0.4370
 epoch: 37, train_loss: 1.0294, test_loss: 1.0139, test_f1: 0.4627
 epoch: 38, train_loss: 1.0285, test_loss: 1.0038, test_f1: 0.4566
 epoch: 39, train_loss: 1.0146, test_loss: 1.0074, test_f1: 0.4494
 epoch: 40, train_loss: 1.0140, test_loss: 1.0678, test_f1: 0.4382
 epoch: 41, train_loss: 1.0259, test_loss: 1.0138, test_f1: 0.4471
 epoch: 42, train_loss: 1.0014, test_loss: 1.0055, test_f1: 0.4676
 epoch: 43, train_loss: 1.0044, test_loss: 1.0037, test_f1: 0.4555
 epoch: 44, train_loss: 0.9931, test_loss: 1.0246, test_f1: 0.4670
 epoch: 45, train_loss: 0.9926, test_loss: 1.0044, test_f1: 0.4480
 epoch: 46, train_loss: 1.0033, test_loss: 1.0029, test_f1: 0.4685
 epoch: 47, train_loss: 0.9909, test_loss: 1.0023, test_f1: 0.4781
 epoch: 48, train_loss: 0.9855, test_loss: 1.0088, test_f1: 0.4676
 epoch: 49, train_loss: 0.9826, test_loss: 1.0078, test_f1: 0.4621
 epoch: 50, train_loss: 0.9740, test_loss: 1.0160, test_f1: 0.4838
 epoch: 51, train_loss: 0.9737, test_loss: 0.9875, test_f1: 0.4667
 epoch: 52, train_loss: 0.9663, test_loss: 0.9852, test_f1: 0.4698
 epoch: 53, train_loss: 0.9585, test_loss: 0.9928, test_f1: 0.4760
 epoch: 54, train_loss: 0.9540, test_loss: 0.9928, test_f1: 0.4813
 epoch: 55, train_loss: 0.9594, test_loss: 1.0066, test_f1: 0.4636
 epoch: 56, train_loss: 0.9737, test_loss: 0.9928, test_f1: 0.4601
 epoch: 57, train_loss: 0.9487, test_loss: 0.9882, test_f1: 0.4718
 epoch: 58, train_loss: 0.9489, test_loss: 0.9937, test_f1: 0.4738
 epoch: 59, train_loss: 0.9447, test_loss: 1.0046, test_f1: 0.4753
 epoch: 60, train_loss: 0.9505, test_loss: 1.0006, test_f1: 0.4672
 epoch: 61, train_loss: 0.9502, test_loss: 1.0121, test_f1: 0.4723
 epoch: 62, train_loss: 0.9388, test_loss: 1.0102, test_f1: 0.4664
 epoch: 63, train_loss: 0.9476, test_loss: 0.9942, test_f1: 0.4687
 epoch: 64, train_loss: 0.9325, test_loss: 1.0127, test_f1: 0.4619
 epoch: 65, train_loss: 0.9325, test_loss: 0.9875, test_f1: 0.4697
 epoch: 66, train_loss: 0.9444, test_loss: 1.0100, test_f1: 0.4690
 epoch: 67, train_loss: 0.9304, test_loss: 1.0011, test_f1: 0.4710
 epoch: 68, train_loss: 0.9362, test_loss: 0.9892, test_f1: 0.4877
 epoch: 69, train_loss: 0.9278, test_loss: 0.9948, test_f1: 0.4729
 epoch: 70, train_loss: 0.9286, test_loss: 0.9976, test_f1: 0.4703
 epoch: 71, train_loss: 0.9345, test_loss: 1.0032, test_f1: 0.4950
 epoch: 72, train_loss: 0.9255, test_loss: 1.0055, test_f1: 0.4809
 epoch: 73, train_loss: 0.9274, test_loss: 1.0030, test_f1: 0.4782
 epoch: 74, train_loss: 0.9342, test_loss: 1.0378, test_f1: 0.4641
 epoch: 75, train_loss: 0.9181, test_loss: 1.0153, test_f1: 0.4744
 epoch: 76, train_loss: 0.9294, test_loss: 1.0015, test_f1: 0.4866
 epoch: 77, train_loss: 0.9344, test_loss: 0.9957, test_f1: 0.4774
 epoch: 78, train_loss: 0.9156, test_loss: 0.9933, test_f1: 0.4819
 epoch: 79, train_loss: 0.9172, test_loss: 1.0149, test_f1: 0.4683
 epoch: 80, train_loss: 0.9196, test_loss: 1.0037, test_f1: 0.4874
 epoch: 81, train_loss: 0.9155, test_loss: 1.0092, test_f1: 0.4805
 epoch: 82, train_loss: 0.9207, test_loss: 1.0131, test_f1: 0.4678
 epoch: 83, train_loss: 0.9076, test_loss: 1.0125, test_f1: 0.4717
 epoch: 84, train_loss: 0.9156, test_loss: 0.9977, test_f1: 0.4804
 epoch: 85, train_loss: 0.9180, test_loss: 1.0112, test_f1: 0.4789
 epoch: 86, train_loss: 0.9126, test_loss: 1.0086, test_f1: 0.4736
 epoch: 87, train_loss: 0.9022, test_loss: 1.0096, test_f1: 0.4816
 epoch: 88, train_loss: 0.9067, test_loss: 0.9906, test_f1: 0.4803
 epoch: 89, train_loss: 0.9116, test_loss: 1.0160, test_f1: 0.4820
 epoch: 90, train_loss: 0.9004, test_loss: 1.0187, test_f1: 0.4736
 epoch: 91, train_loss: 0.9076, test_loss: 1.0316, test_f1: 0.4773
 epoch: 92, train_loss: 0.9128, test_loss: 1.0370, test_f1: 0.4824
 epoch: 93, train_loss: 0.9103, test_loss: 1.0137, test_f1: 0.4592
 epoch: 94, train_loss: 0.8989, test_loss: 1.0259, test_f1: 0.4635
 epoch: 95, train_loss: 0.8874, test_loss: 1.0324, test_f1: 0.4827
 epoch: 96, train_loss: 0.9079, test_loss: 1.0057, test_f1: 0.4832
 epoch: 97, train_loss: 0.8869, test_loss: 1.0273, test_f1: 0.4768
 epoch: 98, train_loss: 0.8973, test_loss: 1.0254, test_f1: 0.4770
 epoch: 99, train_loss: 0.8930, test_loss: 1.0164, test_f1: 0.4703
##################ITERATION #3 ****************************************
 epoch: 0, train_loss: 1.3200, test_loss: 1.2874, test_f1: 0.2274
 epoch: 1, train_loss: 1.2619, test_loss: 1.2465, test_f1: 0.2991
 epoch: 2, train_loss: 1.2418, test_loss: 1.2075, test_f1: 0.3721
 epoch: 3, train_loss: 1.2254, test_loss: 1.1861, test_f1: 0.3789
 epoch: 4, train_loss: 1.2102, test_loss: 1.1667, test_f1: 0.3940
 epoch: 5, train_loss: 1.2025, test_loss: 1.1518, test_f1: 0.4102
 epoch: 6, train_loss: 1.1869, test_loss: 1.1379, test_f1: 0.4176
 epoch: 7, train_loss: 1.1819, test_loss: 1.1182, test_f1: 0.4179
 epoch: 8, train_loss: 1.1687, test_loss: 1.1076, test_f1: 0.4321
 epoch: 9, train_loss: 1.1540, test_loss: 1.0968, test_f1: 0.4335
 epoch: 10, train_loss: 1.1500, test_loss: 1.0871, test_f1: 0.4339
 epoch: 11, train_loss: 1.1530, test_loss: 1.0828, test_f1: 0.4368
 epoch: 12, train_loss: 1.1305, test_loss: 1.0586, test_f1: 0.4752
 epoch: 13, train_loss: 1.1266, test_loss: 1.0505, test_f1: 0.4760
 epoch: 14, train_loss: 1.1237, test_loss: 1.0464, test_f1: 0.4698
 epoch: 15, train_loss: 1.1162, test_loss: 1.0383, test_f1: 0.4738
 epoch: 16, train_loss: 1.1069, test_loss: 1.0362, test_f1: 0.4714
 epoch: 17, train_loss: 1.1002, test_loss: 1.0217, test_f1: 0.4731
 epoch: 18, train_loss: 1.0997, test_loss: 1.0135, test_f1: 0.4768
 epoch: 19, train_loss: 1.0819, test_loss: 1.0173, test_f1: 0.4654
 epoch: 20, train_loss: 1.0871, test_loss: 1.0149, test_f1: 0.4792
 epoch: 21, train_loss: 1.0802, test_loss: 1.0056, test_f1: 0.4786
 epoch: 22, train_loss: 1.0696, test_loss: 0.9891, test_f1: 0.4890
 epoch: 23, train_loss: 1.0624, test_loss: 0.9902, test_f1: 0.4785
 epoch: 24, train_loss: 1.0619, test_loss: 0.9793, test_f1: 0.4762
 epoch: 25, train_loss: 1.0570, test_loss: 0.9686, test_f1: 0.4990
 epoch: 26, train_loss: 1.0491, test_loss: 0.9682, test_f1: 0.4866
 epoch: 27, train_loss: 1.0448, test_loss: 0.9615, test_f1: 0.4771
 epoch: 28, train_loss: 1.0523, test_loss: 0.9535, test_f1: 0.4945
 epoch: 29, train_loss: 1.0422, test_loss: 0.9629, test_f1: 0.4891
 epoch: 30, train_loss: 1.0197, test_loss: 0.9567, test_f1: 0.4790
 epoch: 31, train_loss: 1.0156, test_loss: 0.9672, test_f1: 0.4703
 epoch: 32, train_loss: 1.0254, test_loss: 0.9459, test_f1: 0.4791
 epoch: 33, train_loss: 1.0185, test_loss: 0.9435, test_f1: 0.4932
 epoch: 34, train_loss: 1.0187, test_loss: 0.9574, test_f1: 0.4790
 epoch: 35, train_loss: 1.0027, test_loss: 0.9370, test_f1: 0.4879
 epoch: 36, train_loss: 1.0000, test_loss: 0.9423, test_f1: 0.4691
 epoch: 37, train_loss: 0.9979, test_loss: 0.9476, test_f1: 0.4951
 epoch: 38, train_loss: 0.9961, test_loss: 0.9332, test_f1: 0.4830
 epoch: 39, train_loss: 1.0032, test_loss: 0.9206, test_f1: 0.4953
 epoch: 40, train_loss: 1.0009, test_loss: 0.9373, test_f1: 0.4963
 epoch: 41, train_loss: 0.9824, test_loss: 0.9372, test_f1: 0.4847
 epoch: 42, train_loss: 0.9909, test_loss: 0.9314, test_f1: 0.4843
 epoch: 43, train_loss: 0.9751, test_loss: 0.9142, test_f1: 0.5015
 epoch: 44, train_loss: 0.9737, test_loss: 0.9367, test_f1: 0.4921
 epoch: 45, train_loss: 0.9729, test_loss: 0.9188, test_f1: 0.4843
 epoch: 46, train_loss: 0.9619, test_loss: 0.9296, test_f1: 0.4864
 epoch: 47, train_loss: 0.9712, test_loss: 0.9209, test_f1: 0.4896
 epoch: 48, train_loss: 0.9599, test_loss: 0.9231, test_f1: 0.4846
 epoch: 49, train_loss: 0.9592, test_loss: 0.9122, test_f1: 0.4890
 epoch: 50, train_loss: 0.9684, test_loss: 0.9139, test_f1: 0.4946
 epoch: 51, train_loss: 0.9483, test_loss: 0.9299, test_f1: 0.4871
 epoch: 52, train_loss: 0.9409, test_loss: 0.9121, test_f1: 0.4958
 epoch: 53, train_loss: 0.9528, test_loss: 0.9171, test_f1: 0.4883
 epoch: 54, train_loss: 0.9451, test_loss: 0.9106, test_f1: 0.4973
 epoch: 55, train_loss: 0.9386, test_loss: 0.9237, test_f1: 0.4937
 epoch: 56, train_loss: 0.9389, test_loss: 0.9244, test_f1: 0.4932
 epoch: 57, train_loss: 0.9276, test_loss: 0.9118, test_f1: 0.4944
 epoch: 58, train_loss: 0.9361, test_loss: 0.9196, test_f1: 0.4856
 epoch: 59, train_loss: 0.9523, test_loss: 0.9254, test_f1: 0.4826
 epoch: 60, train_loss: 0.9391, test_loss: 0.9228, test_f1: 0.4902
 epoch: 61, train_loss: 0.9312, test_loss: 0.9272, test_f1: 0.4994
 epoch: 62, train_loss: 0.9279, test_loss: 0.9279, test_f1: 0.4852
 epoch: 63, train_loss: 0.9218, test_loss: 0.9294, test_f1: 0.5011
 epoch: 64, train_loss: 0.9246, test_loss: 0.9230, test_f1: 0.4826
 epoch: 65, train_loss: 0.9307, test_loss: 0.9158, test_f1: 0.4992
 epoch: 66, train_loss: 0.9330, test_loss: 0.9113, test_f1: 0.4933
 epoch: 67, train_loss: 0.9294, test_loss: 0.9178, test_f1: 0.4874
 epoch: 68, train_loss: 0.9140, test_loss: 0.9262, test_f1: 0.4820
 epoch: 69, train_loss: 0.9270, test_loss: 0.9242, test_f1: 0.4815
 epoch: 70, train_loss: 0.9236, test_loss: 0.9223, test_f1: 0.5074
 epoch: 71, train_loss: 0.9181, test_loss: 0.9373, test_f1: 0.4787
 epoch: 72, train_loss: 0.9265, test_loss: 0.9288, test_f1: 0.4928
 epoch: 73, train_loss: 0.9181, test_loss: 0.9208, test_f1: 0.4978
 epoch: 74, train_loss: 0.9278, test_loss: 0.9276, test_f1: 0.5139
 epoch: 75, train_loss: 0.9091, test_loss: 0.9317, test_f1: 0.5011
 epoch: 76, train_loss: 0.9141, test_loss: 0.9267, test_f1: 0.5071
 epoch: 77, train_loss: 0.9061, test_loss: 0.9153, test_f1: 0.5073
 epoch: 78, train_loss: 0.9199, test_loss: 0.9310, test_f1: 0.5185
 epoch: 79, train_loss: 0.9096, test_loss: 0.9082, test_f1: 0.5153
 epoch: 80, train_loss: 0.9017, test_loss: 0.9197, test_f1: 0.5289
 epoch: 81, train_loss: 0.9146, test_loss: 0.9182, test_f1: 0.5104
 epoch: 82, train_loss: 0.9051, test_loss: 0.9307, test_f1: 0.5065
 epoch: 83, train_loss: 0.9033, test_loss: 0.9216, test_f1: 0.5196
 epoch: 84, train_loss: 0.8983, test_loss: 0.9212, test_f1: 0.5128
 epoch: 85, train_loss: 0.9029, test_loss: 0.9133, test_f1: 0.5223
 epoch: 86, train_loss: 0.9048, test_loss: 0.9193, test_f1: 0.5187
 epoch: 87, train_loss: 0.8960, test_loss: 0.9278, test_f1: 0.5202
 epoch: 88, train_loss: 0.9078, test_loss: 0.9200, test_f1: 0.5189
 epoch: 89, train_loss: 0.8920, test_loss: 0.9179, test_f1: 0.5226
 epoch: 90, train_loss: 0.9040, test_loss: 0.9242, test_f1: 0.5285
 epoch: 91, train_loss: 0.9028, test_loss: 0.9266, test_f1: 0.5328
 epoch: 92, train_loss: 0.8943, test_loss: 0.9306, test_f1: 0.5145
 epoch: 93, train_loss: 0.8914, test_loss: 0.9209, test_f1: 0.5255
 epoch: 94, train_loss: 0.8892, test_loss: 0.9227, test_f1: 0.5439
 epoch: 95, train_loss: 0.8888, test_loss: 0.9391, test_f1: 0.5144
 epoch: 96, train_loss: 0.8890, test_loss: 0.9331, test_f1: 0.5293
 epoch: 97, train_loss: 0.8766, test_loss: 0.9269, test_f1: 0.5324
 epoch: 98, train_loss: 0.8876, test_loss: 0.9382, test_f1: 0.5299
 epoch: 99, train_loss: 0.8834, test_loss: 0.9354, test_f1: 0.5234
##################ITERATION #4 ****************************************
 epoch: 0, train_loss: 1.3609, test_loss: 1.3031, test_f1: 0.2274
 epoch: 1, train_loss: 1.2673, test_loss: 1.2555, test_f1: 0.2555
 epoch: 2, train_loss: 1.2355, test_loss: 1.2208, test_f1: 0.2340
 epoch: 3, train_loss: 1.2387, test_loss: 1.2021, test_f1: 0.2769
 epoch: 4, train_loss: 1.2270, test_loss: 1.1927, test_f1: 0.3295
 epoch: 5, train_loss: 1.2150, test_loss: 1.1826, test_f1: 0.3577
 epoch: 6, train_loss: 1.2011, test_loss: 1.1765, test_f1: 0.3721
 epoch: 7, train_loss: 1.2004, test_loss: 1.1718, test_f1: 0.3709
 epoch: 8, train_loss: 1.1891, test_loss: 1.1708, test_f1: 0.3671
 epoch: 9, train_loss: 1.1770, test_loss: 1.1572, test_f1: 0.4040
 epoch: 10, train_loss: 1.1748, test_loss: 1.1435, test_f1: 0.4094
 epoch: 11, train_loss: 1.1683, test_loss: 1.1438, test_f1: 0.4070
 epoch: 12, train_loss: 1.1625, test_loss: 1.1417, test_f1: 0.3814
 epoch: 13, train_loss: 1.1456, test_loss: 1.1328, test_f1: 0.3836
 epoch: 14, train_loss: 1.1396, test_loss: 1.1285, test_f1: 0.3852
 epoch: 15, train_loss: 1.1418, test_loss: 1.1262, test_f1: 0.3930
 epoch: 16, train_loss: 1.1348, test_loss: 1.1278, test_f1: 0.3919
 epoch: 17, train_loss: 1.1240, test_loss: 1.1201, test_f1: 0.4005
 epoch: 18, train_loss: 1.1173, test_loss: 1.1020, test_f1: 0.4101
 epoch: 19, train_loss: 1.1145, test_loss: 1.1026, test_f1: 0.4153
 epoch: 20, train_loss: 1.0995, test_loss: 1.1038, test_f1: 0.4045
 epoch: 21, train_loss: 1.0992, test_loss: 1.0820, test_f1: 0.4133
 epoch: 22, train_loss: 1.0954, test_loss: 1.0870, test_f1: 0.4246
 epoch: 23, train_loss: 1.0844, test_loss: 1.0780, test_f1: 0.4219
 epoch: 24, train_loss: 1.0773, test_loss: 1.0895, test_f1: 0.4179
 epoch: 25, train_loss: 1.0672, test_loss: 1.0741, test_f1: 0.4316
 epoch: 26, train_loss: 1.0654, test_loss: 1.0572, test_f1: 0.4138
 epoch: 27, train_loss: 1.0716, test_loss: 1.0669, test_f1: 0.4236
 epoch: 28, train_loss: 1.0613, test_loss: 1.0533, test_f1: 0.4367
 epoch: 29, train_loss: 1.0397, test_loss: 1.0506, test_f1: 0.4476
 epoch: 30, train_loss: 1.0425, test_loss: 1.0372, test_f1: 0.4451
 epoch: 31, train_loss: 1.0513, test_loss: 1.0705, test_f1: 0.4184
 epoch: 32, train_loss: 1.0312, test_loss: 1.0448, test_f1: 0.4425
 epoch: 33, train_loss: 1.0273, test_loss: 1.0401, test_f1: 0.4629
 epoch: 34, train_loss: 1.0252, test_loss: 1.0350, test_f1: 0.4525
 epoch: 35, train_loss: 1.0266, test_loss: 1.0515, test_f1: 0.4443
 epoch: 36, train_loss: 1.0120, test_loss: 1.0319, test_f1: 0.4353
 epoch: 37, train_loss: 1.0090, test_loss: 1.0266, test_f1: 0.4483
 epoch: 38, train_loss: 1.0078, test_loss: 1.0307, test_f1: 0.4540
 epoch: 39, train_loss: 1.0036, test_loss: 1.0453, test_f1: 0.4596
 epoch: 40, train_loss: 1.0074, test_loss: 1.0454, test_f1: 0.4704
 epoch: 41, train_loss: 0.9979, test_loss: 1.0316, test_f1: 0.4605
 epoch: 42, train_loss: 0.9941, test_loss: 1.0160, test_f1: 0.4498
 epoch: 43, train_loss: 0.9913, test_loss: 1.0295, test_f1: 0.4588
 epoch: 44, train_loss: 0.9804, test_loss: 1.0146, test_f1: 0.4389
 epoch: 45, train_loss: 0.9822, test_loss: 1.0029, test_f1: 0.4489
 epoch: 46, train_loss: 0.9755, test_loss: 0.9973, test_f1: 0.4630
 epoch: 47, train_loss: 0.9742, test_loss: 1.0330, test_f1: 0.4362
 epoch: 48, train_loss: 0.9729, test_loss: 0.9900, test_f1: 0.4469
 epoch: 49, train_loss: 0.9669, test_loss: 1.0385, test_f1: 0.4456
 epoch: 50, train_loss: 0.9559, test_loss: 0.9897, test_f1: 0.4602
 epoch: 51, train_loss: 0.9513, test_loss: 0.9977, test_f1: 0.4570
 epoch: 52, train_loss: 0.9381, test_loss: 1.0423, test_f1: 0.4330
 epoch: 53, train_loss: 0.9434, test_loss: 0.9926, test_f1: 0.4555
 epoch: 54, train_loss: 0.9370, test_loss: 1.0100, test_f1: 0.4429
 epoch: 55, train_loss: 0.9382, test_loss: 1.0018, test_f1: 0.4525
 epoch: 56, train_loss: 0.9374, test_loss: 1.0157, test_f1: 0.4539
 epoch: 57, train_loss: 0.9286, test_loss: 1.0129, test_f1: 0.4450
 epoch: 58, train_loss: 0.9431, test_loss: 1.0159, test_f1: 0.4469
 epoch: 59, train_loss: 0.9309, test_loss: 1.0059, test_f1: 0.4580
 epoch: 60, train_loss: 0.9303, test_loss: 1.0003, test_f1: 0.4534
 epoch: 61, train_loss: 0.9315, test_loss: 1.0231, test_f1: 0.4476
 epoch: 62, train_loss: 0.9250, test_loss: 1.0193, test_f1: 0.4490
 epoch: 63, train_loss: 0.9099, test_loss: 1.0109, test_f1: 0.4557
 epoch: 64, train_loss: 0.9183, test_loss: 1.0039, test_f1: 0.4556
 epoch: 65, train_loss: 0.9234, test_loss: 1.0137, test_f1: 0.4511
 epoch: 66, train_loss: 0.9240, test_loss: 1.0342, test_f1: 0.4610
 epoch: 67, train_loss: 0.9047, test_loss: 1.0156, test_f1: 0.4739
 epoch: 68, train_loss: 0.9163, test_loss: 1.0403, test_f1: 0.4446
 epoch: 69, train_loss: 0.9042, test_loss: 1.0399, test_f1: 0.4690
 epoch: 70, train_loss: 0.9026, test_loss: 1.0435, test_f1: 0.4457
 epoch: 71, train_loss: 0.9150, test_loss: 1.0320, test_f1: 0.4656
 epoch: 72, train_loss: 0.9034, test_loss: 1.0444, test_f1: 0.4648
 epoch: 73, train_loss: 0.8954, test_loss: 1.0348, test_f1: 0.4515
 epoch: 74, train_loss: 0.9086, test_loss: 1.0254, test_f1: 0.4544
 epoch: 75, train_loss: 0.9097, test_loss: 1.0174, test_f1: 0.4613
 epoch: 76, train_loss: 0.8938, test_loss: 1.0417, test_f1: 0.4527
 epoch: 77, train_loss: 0.8964, test_loss: 1.0307, test_f1: 0.4524
 epoch: 78, train_loss: 0.8899, test_loss: 1.0320, test_f1: 0.4510
 epoch: 79, train_loss: 0.9029, test_loss: 1.0389, test_f1: 0.4492
 epoch: 80, train_loss: 0.8914, test_loss: 1.0587, test_f1: 0.4648
 epoch: 81, train_loss: 0.8969, test_loss: 1.0396, test_f1: 0.4546
 epoch: 82, train_loss: 0.8903, test_loss: 1.0374, test_f1: 0.4484
 epoch: 83, train_loss: 0.8868, test_loss: 1.1017, test_f1: 0.4553
 epoch: 84, train_loss: 0.8998, test_loss: 1.0617, test_f1: 0.4469
 epoch: 85, train_loss: 0.8741, test_loss: 1.0556, test_f1: 0.4508
 epoch: 86, train_loss: 0.8822, test_loss: 1.0612, test_f1: 0.4693
 epoch: 87, train_loss: 0.8779, test_loss: 1.0519, test_f1: 0.4723
 epoch: 88, train_loss: 0.8701, test_loss: 1.0620, test_f1: 0.4469
 epoch: 89, train_loss: 0.8731, test_loss: 1.0802, test_f1: 0.4911
 epoch: 90, train_loss: 0.8771, test_loss: 1.0779, test_f1: 0.4515
 epoch: 91, train_loss: 0.8813, test_loss: 1.0550, test_f1: 0.4646
 epoch: 92, train_loss: 0.8639, test_loss: 1.1006, test_f1: 0.4472
 epoch: 93, train_loss: 0.8675, test_loss: 1.0682, test_f1: 0.4867
 epoch: 94, train_loss: 0.8589, test_loss: 1.0667, test_f1: 0.4650
 epoch: 95, train_loss: 0.8720, test_loss: 1.0685, test_f1: 0.4506
 epoch: 96, train_loss: 0.8580, test_loss: 1.0594, test_f1: 0.4607
 epoch: 97, train_loss: 0.8576, test_loss: 1.0652, test_f1: 0.4564
 epoch: 98, train_loss: 0.8599, test_loss: 1.0948, test_f1: 0.4581
 epoch: 99, train_loss: 0.8676, test_loss: 1.0650, test_f1: 0.4623
##################ITERATION #5 ****************************************
 epoch: 0, train_loss: 1.3502, test_loss: 1.3265, test_f1: 0.2274
 epoch: 1, train_loss: 1.2655, test_loss: 1.2711, test_f1: 0.2438
 epoch: 2, train_loss: 1.2434, test_loss: 1.2410, test_f1: 0.3184
 epoch: 3, train_loss: 1.2288, test_loss: 1.2161, test_f1: 0.3503
 epoch: 4, train_loss: 1.2062, test_loss: 1.1980, test_f1: 0.4017
 epoch: 5, train_loss: 1.2070, test_loss: 1.1804, test_f1: 0.3950
 epoch: 6, train_loss: 1.1906, test_loss: 1.1739, test_f1: 0.3917
 epoch: 7, train_loss: 1.1885, test_loss: 1.1627, test_f1: 0.3946
 epoch: 8, train_loss: 1.1833, test_loss: 1.1519, test_f1: 0.4081
 epoch: 9, train_loss: 1.1684, test_loss: 1.1403, test_f1: 0.4096
 epoch: 10, train_loss: 1.1613, test_loss: 1.1311, test_f1: 0.4169
 epoch: 11, train_loss: 1.1599, test_loss: 1.1123, test_f1: 0.4375
 epoch: 12, train_loss: 1.1461, test_loss: 1.1100, test_f1: 0.4363
 epoch: 13, train_loss: 1.1383, test_loss: 1.0976, test_f1: 0.4396
 epoch: 14, train_loss: 1.1282, test_loss: 1.0863, test_f1: 0.4550
 epoch: 15, train_loss: 1.1243, test_loss: 1.0787, test_f1: 0.4414
 epoch: 16, train_loss: 1.1124, test_loss: 1.0673, test_f1: 0.4453
 epoch: 17, train_loss: 1.1013, test_loss: 1.0602, test_f1: 0.4524
 epoch: 18, train_loss: 1.0933, test_loss: 1.0467, test_f1: 0.4606
 epoch: 19, train_loss: 1.0792, test_loss: 1.0430, test_f1: 0.4378
 epoch: 20, train_loss: 1.0755, test_loss: 1.0266, test_f1: 0.4705
 epoch: 21, train_loss: 1.0695, test_loss: 1.0174, test_f1: 0.4728
 epoch: 22, train_loss: 1.0696, test_loss: 1.0363, test_f1: 0.4596
 epoch: 23, train_loss: 1.0579, test_loss: 1.0115, test_f1: 0.4862
 epoch: 24, train_loss: 1.0572, test_loss: 1.0048, test_f1: 0.4872
 epoch: 25, train_loss: 1.0405, test_loss: 1.0109, test_f1: 0.4813
 epoch: 26, train_loss: 1.0384, test_loss: 1.0069, test_f1: 0.4727
 epoch: 27, train_loss: 1.0368, test_loss: 0.9989, test_f1: 0.4777
 epoch: 28, train_loss: 1.0337, test_loss: 0.9880, test_f1: 0.4905
 epoch: 29, train_loss: 1.0104, test_loss: 0.9845, test_f1: 0.4946
 epoch: 30, train_loss: 1.0215, test_loss: 0.9924, test_f1: 0.4861
 epoch: 31, train_loss: 1.0071, test_loss: 0.9903, test_f1: 0.4836
 epoch: 32, train_loss: 1.0025, test_loss: 0.9822, test_f1: 0.4893
 epoch: 33, train_loss: 0.9946, test_loss: 1.0038, test_f1: 0.4778
 epoch: 34, train_loss: 0.9976, test_loss: 0.9965, test_f1: 0.4842
 epoch: 35, train_loss: 0.9926, test_loss: 0.9845, test_f1: 0.4976
 epoch: 36, train_loss: 0.9824, test_loss: 0.9744, test_f1: 0.4992
 epoch: 37, train_loss: 0.9789, test_loss: 1.0116, test_f1: 0.4835
 epoch: 38, train_loss: 0.9822, test_loss: 0.9865, test_f1: 0.4737
 epoch: 39, train_loss: 0.9621, test_loss: 0.9934, test_f1: 0.4823
 epoch: 40, train_loss: 0.9667, test_loss: 0.9732, test_f1: 0.5003
 epoch: 41, train_loss: 0.9564, test_loss: 0.9757, test_f1: 0.4909
 epoch: 42, train_loss: 0.9659, test_loss: 0.9975, test_f1: 0.4822
 epoch: 43, train_loss: 0.9638, test_loss: 1.0159, test_f1: 0.4669
 epoch: 44, train_loss: 0.9542, test_loss: 1.0036, test_f1: 0.4908
 epoch: 45, train_loss: 0.9498, test_loss: 1.0030, test_f1: 0.4871
 epoch: 46, train_loss: 0.9554, test_loss: 0.9892, test_f1: 0.4856
 epoch: 47, train_loss: 0.9470, test_loss: 1.0006, test_f1: 0.4834
 epoch: 48, train_loss: 0.9331, test_loss: 1.0213, test_f1: 0.4914
 epoch: 49, train_loss: 0.9297, test_loss: 1.0146, test_f1: 0.4877
 epoch: 50, train_loss: 0.9329, test_loss: 1.0891, test_f1: 0.4698
 epoch: 51, train_loss: 0.9283, test_loss: 1.0158, test_f1: 0.4786
 epoch: 52, train_loss: 0.9199, test_loss: 1.0317, test_f1: 0.4848
 epoch: 53, train_loss: 0.9169, test_loss: 1.0345, test_f1: 0.4908
 epoch: 54, train_loss: 0.9227, test_loss: 1.0283, test_f1: 0.4703
 epoch: 55, train_loss: 0.9085, test_loss: 1.0365, test_f1: 0.4732
 epoch: 56, train_loss: 0.9165, test_loss: 1.0583, test_f1: 0.4656
 epoch: 57, train_loss: 0.9105, test_loss: 1.0352, test_f1: 0.4686
 epoch: 58, train_loss: 0.9121, test_loss: 1.0584, test_f1: 0.4636
 epoch: 59, train_loss: 0.9130, test_loss: 1.0702, test_f1: 0.4726
 epoch: 60, train_loss: 0.9099, test_loss: 1.0687, test_f1: 0.4690
 epoch: 61, train_loss: 0.9181, test_loss: 1.0843, test_f1: 0.4761
 epoch: 62, train_loss: 0.9110, test_loss: 1.0950, test_f1: 0.4594
 epoch: 63, train_loss: 0.9083, test_loss: 1.0729, test_f1: 0.4659
 epoch: 64, train_loss: 0.9031, test_loss: 1.1176, test_f1: 0.4615
 epoch: 65, train_loss: 0.9085, test_loss: 1.0785, test_f1: 0.4778
 epoch: 66, train_loss: 0.8968, test_loss: 1.0748, test_f1: 0.4732
 epoch: 67, train_loss: 0.8945, test_loss: 1.0580, test_f1: 0.4644
 epoch: 68, train_loss: 0.9037, test_loss: 1.1017, test_f1: 0.4574
 epoch: 69, train_loss: 0.9044, test_loss: 1.0665, test_f1: 0.4725
 epoch: 70, train_loss: 0.9069, test_loss: 1.0822, test_f1: 0.4686
 epoch: 71, train_loss: 0.8919, test_loss: 1.0666, test_f1: 0.4581
 epoch: 72, train_loss: 0.9054, test_loss: 1.1152, test_f1: 0.4766
 epoch: 73, train_loss: 0.8934, test_loss: 1.1140, test_f1: 0.4712
 epoch: 74, train_loss: 0.8820, test_loss: 1.1135, test_f1: 0.4688
 epoch: 75, train_loss: 0.8869, test_loss: 1.1007, test_f1: 0.4622
 epoch: 76, train_loss: 0.8943, test_loss: 1.1061, test_f1: 0.4713
 epoch: 77, train_loss: 0.8910, test_loss: 1.1257, test_f1: 0.4565
 epoch: 78, train_loss: 0.8891, test_loss: 1.1340, test_f1: 0.4725
 epoch: 79, train_loss: 0.8921, test_loss: 1.0860, test_f1: 0.4731
 epoch: 80, train_loss: 0.8818, test_loss: 1.0780, test_f1: 0.4855
 epoch: 81, train_loss: 0.8847, test_loss: 1.0918, test_f1: 0.4678
 epoch: 82, train_loss: 0.8759, test_loss: 1.1156, test_f1: 0.4733
 epoch: 83, train_loss: 0.8791, test_loss: 1.1222, test_f1: 0.4692
 epoch: 84, train_loss: 0.8765, test_loss: 1.1582, test_f1: 0.4755
 epoch: 85, train_loss: 0.8827, test_loss: 1.0603, test_f1: 0.4639
 epoch: 86, train_loss: 0.8895, test_loss: 1.1221, test_f1: 0.4698
 epoch: 87, train_loss: 0.8820, test_loss: 1.1228, test_f1: 0.4656
 epoch: 88, train_loss: 0.8828, test_loss: 1.2055, test_f1: 0.4758
 epoch: 89, train_loss: 0.8726, test_loss: 1.1692, test_f1: 0.4724
 epoch: 90, train_loss: 0.8821, test_loss: 1.1690, test_f1: 0.4684
 epoch: 91, train_loss: 0.8759, test_loss: 1.1361, test_f1: 0.4748
 epoch: 92, train_loss: 0.8725, test_loss: 1.1360, test_f1: 0.4764
 epoch: 93, train_loss: 0.8683, test_loss: 1.1479, test_f1: 0.4805
 epoch: 94, train_loss: 0.8635, test_loss: 1.2300, test_f1: 0.4649
 epoch: 95, train_loss: 0.8697, test_loss: 1.1852, test_f1: 0.4710
 epoch: 96, train_loss: 0.8728, test_loss: 1.1910, test_f1: 0.4749
 epoch: 97, train_loss: 0.8723, test_loss: 1.1832, test_f1: 0.4659
 epoch: 98, train_loss: 0.8760, test_loss: 1.1388, test_f1: 0.4727
 epoch: 99, train_loss: 0.8771, test_loss: 1.1895, test_f1: 0.4585
##################ITERATION #6 ****************************************
 epoch: 0, train_loss: 1.3703, test_loss: 1.3159, test_f1: 0.2274
 epoch: 1, train_loss: 1.2853, test_loss: 1.2699, test_f1: 0.2696
 epoch: 2, train_loss: 1.2633, test_loss: 1.2364, test_f1: 0.3019
 epoch: 3, train_loss: 1.2509, test_loss: 1.2131, test_f1: 0.3094
 epoch: 4, train_loss: 1.2458, test_loss: 1.2025, test_f1: 0.3151
 epoch: 5, train_loss: 1.2380, test_loss: 1.1998, test_f1: 0.3492
 epoch: 6, train_loss: 1.2151, test_loss: 1.1906, test_f1: 0.3663
 epoch: 7, train_loss: 1.2194, test_loss: 1.1757, test_f1: 0.3842
 epoch: 8, train_loss: 1.2031, test_loss: 1.1770, test_f1: 0.3851
 epoch: 9, train_loss: 1.1994, test_loss: 1.1693, test_f1: 0.3964
 epoch: 10, train_loss: 1.1861, test_loss: 1.1441, test_f1: 0.3942
 epoch: 11, train_loss: 1.1762, test_loss: 1.1301, test_f1: 0.4180
 epoch: 12, train_loss: 1.1728, test_loss: 1.1211, test_f1: 0.4124
 epoch: 13, train_loss: 1.1622, test_loss: 1.1048, test_f1: 0.4153
 epoch: 14, train_loss: 1.1555, test_loss: 1.1097, test_f1: 0.4076
 epoch: 15, train_loss: 1.1447, test_loss: 1.0913, test_f1: 0.4253
 epoch: 16, train_loss: 1.1468, test_loss: 1.0873, test_f1: 0.4136
 epoch: 17, train_loss: 1.1414, test_loss: 1.0958, test_f1: 0.4007
 epoch: 18, train_loss: 1.1331, test_loss: 1.0743, test_f1: 0.4283
 epoch: 19, train_loss: 1.1235, test_loss: 1.0603, test_f1: 0.4376
 epoch: 20, train_loss: 1.1249, test_loss: 1.0640, test_f1: 0.4231
 epoch: 21, train_loss: 1.1175, test_loss: 1.0596, test_f1: 0.4277
 epoch: 22, train_loss: 1.1204, test_loss: 1.0410, test_f1: 0.4564
 epoch: 23, train_loss: 1.1068, test_loss: 1.0263, test_f1: 0.4278
 epoch: 24, train_loss: 1.0954, test_loss: 1.0317, test_f1: 0.4572
 epoch: 25, train_loss: 1.1028, test_loss: 1.0218, test_f1: 0.4427
 epoch: 26, train_loss: 1.0913, test_loss: 1.0122, test_f1: 0.4504
 epoch: 27, train_loss: 1.0808, test_loss: 1.0264, test_f1: 0.4536
 epoch: 28, train_loss: 1.0745, test_loss: 1.0034, test_f1: 0.4585
 epoch: 29, train_loss: 1.0721, test_loss: 0.9835, test_f1: 0.4677
 epoch: 30, train_loss: 1.0623, test_loss: 0.9982, test_f1: 0.4631
 epoch: 31, train_loss: 1.0523, test_loss: 0.9851, test_f1: 0.4716
 epoch: 32, train_loss: 1.0456, test_loss: 0.9861, test_f1: 0.4941
 epoch: 33, train_loss: 1.0509, test_loss: 0.9645, test_f1: 0.4876
 epoch: 34, train_loss: 1.0562, test_loss: 0.9816, test_f1: 0.4816
 epoch: 35, train_loss: 1.0447, test_loss: 0.9693, test_f1: 0.4872
 epoch: 36, train_loss: 1.0354, test_loss: 0.9640, test_f1: 0.5015
 epoch: 37, train_loss: 1.0328, test_loss: 0.9585, test_f1: 0.4924
 epoch: 38, train_loss: 1.0259, test_loss: 0.9575, test_f1: 0.4806
 epoch: 39, train_loss: 1.0215, test_loss: 0.9574, test_f1: 0.5005
 epoch: 40, train_loss: 1.0277, test_loss: 0.9614, test_f1: 0.4891
 epoch: 41, train_loss: 1.0145, test_loss: 0.9492, test_f1: 0.4972
 epoch: 42, train_loss: 1.0071, test_loss: 0.9524, test_f1: 0.4951
 epoch: 43, train_loss: 1.0113, test_loss: 0.9649, test_f1: 0.4816
 epoch: 44, train_loss: 1.0043, test_loss: 0.9612, test_f1: 0.4974
 epoch: 45, train_loss: 1.0013, test_loss: 0.9555, test_f1: 0.4740
 epoch: 46, train_loss: 1.0012, test_loss: 0.9407, test_f1: 0.4936
 epoch: 47, train_loss: 1.0002, test_loss: 0.9566, test_f1: 0.4781
 epoch: 48, train_loss: 0.9821, test_loss: 0.9348, test_f1: 0.4884
 epoch: 49, train_loss: 0.9975, test_loss: 0.9310, test_f1: 0.5058
 epoch: 50, train_loss: 0.9876, test_loss: 0.9385, test_f1: 0.4835
 epoch: 51, train_loss: 0.9710, test_loss: 0.9349, test_f1: 0.4832
 epoch: 52, train_loss: 0.9827, test_loss: 0.9297, test_f1: 0.5055
 epoch: 53, train_loss: 0.9662, test_loss: 0.9282, test_f1: 0.4803
 epoch: 54, train_loss: 0.9573, test_loss: 0.9300, test_f1: 0.4755
 epoch: 55, train_loss: 0.9705, test_loss: 0.9318, test_f1: 0.4967
 epoch: 56, train_loss: 0.9571, test_loss: 0.9312, test_f1: 0.4837
 epoch: 57, train_loss: 0.9614, test_loss: 0.9300, test_f1: 0.4827
 epoch: 58, train_loss: 0.9594, test_loss: 0.9306, test_f1: 0.5007
 epoch: 59, train_loss: 0.9532, test_loss: 0.9206, test_f1: 0.4980
 epoch: 60, train_loss: 0.9524, test_loss: 0.9172, test_f1: 0.4999
 epoch: 61, train_loss: 0.9599, test_loss: 0.9177, test_f1: 0.4746
 epoch: 62, train_loss: 0.9649, test_loss: 0.9237, test_f1: 0.4866
 epoch: 63, train_loss: 0.9513, test_loss: 0.9218, test_f1: 0.4885
 epoch: 64, train_loss: 0.9518, test_loss: 0.9287, test_f1: 0.4798
 epoch: 65, train_loss: 0.9490, test_loss: 0.9197, test_f1: 0.4791
 epoch: 66, train_loss: 0.9436, test_loss: 0.9261, test_f1: 0.5008
 epoch: 67, train_loss: 0.9545, test_loss: 0.9158, test_f1: 0.4959
 epoch: 68, train_loss: 0.9478, test_loss: 0.9245, test_f1: 0.4869
 epoch: 69, train_loss: 0.9436, test_loss: 0.9317, test_f1: 0.4852
 epoch: 70, train_loss: 0.9381, test_loss: 0.9251, test_f1: 0.4853
 epoch: 71, train_loss: 0.9352, test_loss: 0.9151, test_f1: 0.4820
 epoch: 72, train_loss: 0.9372, test_loss: 0.9186, test_f1: 0.4835
 epoch: 73, train_loss: 0.9376, test_loss: 0.9185, test_f1: 0.4906
 epoch: 74, train_loss: 0.9389, test_loss: 0.9248, test_f1: 0.4860
 epoch: 75, train_loss: 0.9349, test_loss: 0.9241, test_f1: 0.4818
 epoch: 76, train_loss: 0.9374, test_loss: 0.9172, test_f1: 0.4764
 epoch: 77, train_loss: 0.9298, test_loss: 0.9242, test_f1: 0.4856
 epoch: 78, train_loss: 0.9211, test_loss: 0.9302, test_f1: 0.4928
 epoch: 79, train_loss: 0.9204, test_loss: 0.9239, test_f1: 0.4866
 epoch: 80, train_loss: 0.9320, test_loss: 0.9242, test_f1: 0.4918
 epoch: 81, train_loss: 0.9258, test_loss: 0.9165, test_f1: 0.5061
 epoch: 82, train_loss: 0.9200, test_loss: 0.9219, test_f1: 0.4819
 epoch: 83, train_loss: 0.9233, test_loss: 0.9258, test_f1: 0.4947
 epoch: 84, train_loss: 0.9308, test_loss: 0.9213, test_f1: 0.4919
 epoch: 85, train_loss: 0.9254, test_loss: 0.9184, test_f1: 0.5012
 epoch: 86, train_loss: 0.9188, test_loss: 0.9302, test_f1: 0.4955
 epoch: 87, train_loss: 0.9288, test_loss: 0.9331, test_f1: 0.4966
 epoch: 88, train_loss: 0.9166, test_loss: 0.9291, test_f1: 0.4951
 epoch: 89, train_loss: 0.9157, test_loss: 0.9327, test_f1: 0.5011
 epoch: 90, train_loss: 0.9090, test_loss: 0.9436, test_f1: 0.4853
 epoch: 91, train_loss: 0.9175, test_loss: 0.9230, test_f1: 0.5024
 epoch: 92, train_loss: 0.9231, test_loss: 0.9252, test_f1: 0.5094
 epoch: 93, train_loss: 0.9074, test_loss: 0.9155, test_f1: 0.5009
 epoch: 94, train_loss: 0.9087, test_loss: 0.9229, test_f1: 0.4979
 epoch: 95, train_loss: 0.9044, test_loss: 0.9383, test_f1: 0.4999
 epoch: 96, train_loss: 0.9082, test_loss: 0.9337, test_f1: 0.5044
 epoch: 97, train_loss: 0.9059, test_loss: 0.9433, test_f1: 0.4982
 epoch: 98, train_loss: 0.9121, test_loss: 0.9302, test_f1: 0.4897
 epoch: 99, train_loss: 0.8996, test_loss: 0.9250, test_f1: 0.4808
##################ITERATION #7 ****************************************
 epoch: 0, train_loss: 1.4852, test_loss: 1.3448, test_f1: 0.2751
 epoch: 1, train_loss: 1.3045, test_loss: 1.2788, test_f1: 0.2487
 epoch: 2, train_loss: 1.2723, test_loss: 1.2255, test_f1: 0.3168
 epoch: 3, train_loss: 1.2631, test_loss: 1.2081, test_f1: 0.3142
 epoch: 4, train_loss: 1.2395, test_loss: 1.2012, test_f1: 0.3123
 epoch: 5, train_loss: 1.2321, test_loss: 1.1926, test_f1: 0.3271
 epoch: 6, train_loss: 1.2257, test_loss: 1.1861, test_f1: 0.3342
 epoch: 7, train_loss: 1.2223, test_loss: 1.1761, test_f1: 0.3543
 epoch: 8, train_loss: 1.2211, test_loss: 1.1703, test_f1: 0.3693
 epoch: 9, train_loss: 1.2052, test_loss: 1.1675, test_f1: 0.3645
 epoch: 10, train_loss: 1.2101, test_loss: 1.1637, test_f1: 0.3697
 epoch: 11, train_loss: 1.1936, test_loss: 1.1454, test_f1: 0.4031
 epoch: 12, train_loss: 1.1868, test_loss: 1.1377, test_f1: 0.4038
 epoch: 13, train_loss: 1.1785, test_loss: 1.1337, test_f1: 0.4167
 epoch: 14, train_loss: 1.1786, test_loss: 1.1355, test_f1: 0.3983
 epoch: 15, train_loss: 1.1704, test_loss: 1.1227, test_f1: 0.4106
 epoch: 16, train_loss: 1.1697, test_loss: 1.1163, test_f1: 0.4078
 epoch: 17, train_loss: 1.1612, test_loss: 1.1187, test_f1: 0.4119
 epoch: 18, train_loss: 1.1533, test_loss: 1.1027, test_f1: 0.4137
 epoch: 19, train_loss: 1.1483, test_loss: 1.0924, test_f1: 0.4386
 epoch: 20, train_loss: 1.1421, test_loss: 1.0931, test_f1: 0.4234
 epoch: 21, train_loss: 1.1331, test_loss: 1.0831, test_f1: 0.4285
 epoch: 22, train_loss: 1.1376, test_loss: 1.0870, test_f1: 0.4396
 epoch: 23, train_loss: 1.1260, test_loss: 1.0705, test_f1: 0.4540
 epoch: 24, train_loss: 1.1137, test_loss: 1.0654, test_f1: 0.4482
 epoch: 25, train_loss: 1.1091, test_loss: 1.0648, test_f1: 0.4467
 epoch: 26, train_loss: 1.1055, test_loss: 1.0578, test_f1: 0.4600
 epoch: 27, train_loss: 1.0973, test_loss: 1.0404, test_f1: 0.4498
 epoch: 28, train_loss: 1.0941, test_loss: 1.0649, test_f1: 0.4427
 epoch: 29, train_loss: 1.0880, test_loss: 1.0320, test_f1: 0.4575
 epoch: 30, train_loss: 1.0712, test_loss: 1.0263, test_f1: 0.4599
 epoch: 31, train_loss: 1.0792, test_loss: 1.0130, test_f1: 0.4725
 epoch: 32, train_loss: 1.0675, test_loss: 1.0051, test_f1: 0.4607
 epoch: 33, train_loss: 1.0530, test_loss: 0.9847, test_f1: 0.4937
 epoch: 34, train_loss: 1.0542, test_loss: 1.0101, test_f1: 0.4681
 epoch: 35, train_loss: 1.0560, test_loss: 0.9839, test_f1: 0.4548
 epoch: 36, train_loss: 1.0520, test_loss: 0.9853, test_f1: 0.4879
 epoch: 37, train_loss: 1.0414, test_loss: 0.9792, test_f1: 0.4709
 epoch: 38, train_loss: 1.0461, test_loss: 0.9824, test_f1: 0.4832
 epoch: 39, train_loss: 1.0314, test_loss: 0.9848, test_f1: 0.4674
 epoch: 40, train_loss: 1.0282, test_loss: 0.9553, test_f1: 0.4846
 epoch: 41, train_loss: 1.0149, test_loss: 0.9829, test_f1: 0.4732
 epoch: 42, train_loss: 1.0139, test_loss: 0.9879, test_f1: 0.4829
 epoch: 43, train_loss: 1.0258, test_loss: 0.9738, test_f1: 0.4720
 epoch: 44, train_loss: 1.0070, test_loss: 0.9860, test_f1: 0.4765
 epoch: 45, train_loss: 1.0061, test_loss: 0.9641, test_f1: 0.4765
 epoch: 46, train_loss: 1.0042, test_loss: 0.9539, test_f1: 0.4837
 epoch: 47, train_loss: 0.9919, test_loss: 0.9765, test_f1: 0.4744
 epoch: 48, train_loss: 0.9901, test_loss: 0.9582, test_f1: 0.4925
 epoch: 49, train_loss: 0.9899, test_loss: 0.9608, test_f1: 0.4704
 epoch: 50, train_loss: 0.9871, test_loss: 0.9644, test_f1: 0.4932
 epoch: 51, train_loss: 0.9815, test_loss: 0.9569, test_f1: 0.4819
 epoch: 52, train_loss: 0.9780, test_loss: 0.9665, test_f1: 0.4792
 epoch: 53, train_loss: 0.9696, test_loss: 0.9606, test_f1: 0.4698
 epoch: 54, train_loss: 0.9750, test_loss: 0.9554, test_f1: 0.4867
 epoch: 55, train_loss: 0.9701, test_loss: 0.9590, test_f1: 0.4689
 epoch: 56, train_loss: 0.9838, test_loss: 0.9563, test_f1: 0.4800
 epoch: 57, train_loss: 0.9673, test_loss: 0.9465, test_f1: 0.4781
 epoch: 58, train_loss: 0.9697, test_loss: 0.9605, test_f1: 0.4727
 epoch: 59, train_loss: 0.9742, test_loss: 0.9472, test_f1: 0.4772
 epoch: 60, train_loss: 0.9633, test_loss: 0.9506, test_f1: 0.4887
 epoch: 61, train_loss: 0.9611, test_loss: 0.9521, test_f1: 0.4731
 epoch: 62, train_loss: 0.9622, test_loss: 0.9683, test_f1: 0.4728
 epoch: 63, train_loss: 0.9666, test_loss: 0.9507, test_f1: 0.4780
 epoch: 64, train_loss: 0.9666, test_loss: 0.9694, test_f1: 0.4718
 epoch: 65, train_loss: 0.9595, test_loss: 0.9545, test_f1: 0.4781
 epoch: 66, train_loss: 0.9494, test_loss: 0.9500, test_f1: 0.4833
 epoch: 67, train_loss: 0.9524, test_loss: 0.9496, test_f1: 0.4812
 epoch: 68, train_loss: 0.9554, test_loss: 0.9534, test_f1: 0.4876
 epoch: 69, train_loss: 0.9565, test_loss: 0.9517, test_f1: 0.4804
 epoch: 70, train_loss: 0.9547, test_loss: 0.9637, test_f1: 0.4769
 epoch: 71, train_loss: 0.9495, test_loss: 0.9717, test_f1: 0.4758
 epoch: 72, train_loss: 0.9496, test_loss: 0.9475, test_f1: 0.4820
 epoch: 73, train_loss: 0.9505, test_loss: 0.9638, test_f1: 0.4680
 epoch: 74, train_loss: 0.9472, test_loss: 0.9572, test_f1: 0.4821
 epoch: 75, train_loss: 0.9526, test_loss: 0.9749, test_f1: 0.4870
 epoch: 76, train_loss: 0.9440, test_loss: 0.9481, test_f1: 0.4895
 epoch: 77, train_loss: 0.9254, test_loss: 0.9800, test_f1: 0.4771
 epoch: 78, train_loss: 0.9381, test_loss: 0.9736, test_f1: 0.4823
 epoch: 79, train_loss: 0.9432, test_loss: 0.9552, test_f1: 0.4917
 epoch: 80, train_loss: 0.9360, test_loss: 0.9436, test_f1: 0.4937
 epoch: 81, train_loss: 0.9279, test_loss: 0.9509, test_f1: 0.4889
 epoch: 82, train_loss: 0.9368, test_loss: 0.9727, test_f1: 0.4804
 epoch: 83, train_loss: 0.9425, test_loss: 0.9712, test_f1: 0.4868
 epoch: 84, train_loss: 0.9317, test_loss: 0.9546, test_f1: 0.4937
 epoch: 85, train_loss: 0.9251, test_loss: 0.9615, test_f1: 0.4858
 epoch: 86, train_loss: 0.9213, test_loss: 0.9524, test_f1: 0.5019
 epoch: 87, train_loss: 0.9316, test_loss: 0.9693, test_f1: 0.4782
 epoch: 88, train_loss: 0.9189, test_loss: 0.9483, test_f1: 0.4913
 epoch: 89, train_loss: 0.9195, test_loss: 0.9504, test_f1: 0.4924
 epoch: 90, train_loss: 0.9328, test_loss: 0.9763, test_f1: 0.4782
 epoch: 91, train_loss: 0.9382, test_loss: 0.9611, test_f1: 0.4844
 epoch: 92, train_loss: 0.9356, test_loss: 0.9867, test_f1: 0.4718
 epoch: 93, train_loss: 0.9300, test_loss: 0.9688, test_f1: 0.4776
 epoch: 94, train_loss: 0.9269, test_loss: 0.9543, test_f1: 0.4891
 epoch: 95, train_loss: 0.9288, test_loss: 0.9707, test_f1: 0.4875
 epoch: 96, train_loss: 0.9168, test_loss: 0.9578, test_f1: 0.4939
 epoch: 97, train_loss: 0.9319, test_loss: 0.9703, test_f1: 0.4878
 epoch: 98, train_loss: 0.9277, test_loss: 0.9428, test_f1: 0.4995
 epoch: 99, train_loss: 0.9253, test_loss: 0.9371, test_f1: 0.4876
##################ITERATION #8 ****************************************
 epoch: 0, train_loss: 1.6834, test_loss: 1.3510, test_f1: 0.2274
 epoch: 1, train_loss: 1.3651, test_loss: 1.2938, test_f1: 0.2700
 epoch: 2, train_loss: 1.3139, test_loss: 1.2656, test_f1: 0.3271
 epoch: 3, train_loss: 1.2849, test_loss: 1.2372, test_f1: 0.3508
 epoch: 4, train_loss: 1.2614, test_loss: 1.2127, test_f1: 0.3179
 epoch: 5, train_loss: 1.2530, test_loss: 1.2072, test_f1: 0.3543
 epoch: 6, train_loss: 1.2457, test_loss: 1.2009, test_f1: 0.3382
 epoch: 7, train_loss: 1.2241, test_loss: 1.1874, test_f1: 0.3653
 epoch: 8, train_loss: 1.2165, test_loss: 1.1751, test_f1: 0.3722
 epoch: 9, train_loss: 1.2080, test_loss: 1.1660, test_f1: 0.3714
 epoch: 10, train_loss: 1.1935, test_loss: 1.1484, test_f1: 0.4068
 epoch: 11, train_loss: 1.1903, test_loss: 1.1402, test_f1: 0.3959
 epoch: 12, train_loss: 1.1808, test_loss: 1.1328, test_f1: 0.4198
 epoch: 13, train_loss: 1.1706, test_loss: 1.1216, test_f1: 0.4185
 epoch: 14, train_loss: 1.1612, test_loss: 1.1102, test_f1: 0.4403
 epoch: 15, train_loss: 1.1515, test_loss: 1.0989, test_f1: 0.4472
 epoch: 16, train_loss: 1.1549, test_loss: 1.0822, test_f1: 0.4594
 epoch: 17, train_loss: 1.1412, test_loss: 1.0818, test_f1: 0.4491
 epoch: 18, train_loss: 1.1382, test_loss: 1.0755, test_f1: 0.4663
 epoch: 19, train_loss: 1.1261, test_loss: 1.0745, test_f1: 0.4717
 epoch: 20, train_loss: 1.1065, test_loss: 1.0484, test_f1: 0.4809
 epoch: 21, train_loss: 1.0966, test_loss: 1.0376, test_f1: 0.4747
 epoch: 22, train_loss: 1.0986, test_loss: 1.0294, test_f1: 0.4858
 epoch: 23, train_loss: 1.0908, test_loss: 1.0130, test_f1: 0.4831
 epoch: 24, train_loss: 1.0754, test_loss: 1.0113, test_f1: 0.4933
 epoch: 25, train_loss: 1.0645, test_loss: 0.9926, test_f1: 0.4881
 epoch: 26, train_loss: 1.0698, test_loss: 0.9896, test_f1: 0.4999
 epoch: 27, train_loss: 1.0604, test_loss: 0.9949, test_f1: 0.4910
 epoch: 28, train_loss: 1.0510, test_loss: 0.9541, test_f1: 0.5043
 epoch: 29, train_loss: 1.0363, test_loss: 0.9588, test_f1: 0.5088
 epoch: 30, train_loss: 1.0264, test_loss: 0.9412, test_f1: 0.4979
 epoch: 31, train_loss: 1.0387, test_loss: 0.9664, test_f1: 0.4869
 epoch: 32, train_loss: 1.0196, test_loss: 0.9403, test_f1: 0.5034
 epoch: 33, train_loss: 1.0074, test_loss: 0.9662, test_f1: 0.4762
 epoch: 34, train_loss: 1.0165, test_loss: 0.9381, test_f1: 0.4891
 epoch: 35, train_loss: 1.0145, test_loss: 0.9682, test_f1: 0.4803
 epoch: 36, train_loss: 1.0011, test_loss: 0.9438, test_f1: 0.4951
 epoch: 37, train_loss: 0.9882, test_loss: 0.9569, test_f1: 0.4807
 epoch: 38, train_loss: 0.9974, test_loss: 0.9164, test_f1: 0.4890
 epoch: 39, train_loss: 0.9801, test_loss: 0.9135, test_f1: 0.4882
 epoch: 40, train_loss: 0.9762, test_loss: 0.9323, test_f1: 0.4842
 epoch: 41, train_loss: 0.9768, test_loss: 0.9047, test_f1: 0.4990
 epoch: 42, train_loss: 0.9600, test_loss: 0.9130, test_f1: 0.4997
 epoch: 43, train_loss: 0.9763, test_loss: 0.9064, test_f1: 0.4993
 epoch: 44, train_loss: 0.9635, test_loss: 0.9199, test_f1: 0.5040
 epoch: 45, train_loss: 0.9643, test_loss: 0.8948, test_f1: 0.5098
 epoch: 46, train_loss: 0.9503, test_loss: 0.8971, test_f1: 0.4890
 epoch: 47, train_loss: 0.9500, test_loss: 0.9085, test_f1: 0.4958
 epoch: 48, train_loss: 0.9559, test_loss: 0.9067, test_f1: 0.4925
 epoch: 49, train_loss: 0.9444, test_loss: 0.9312, test_f1: 0.4895
 epoch: 50, train_loss: 0.9394, test_loss: 0.9104, test_f1: 0.4989
 epoch: 51, train_loss: 0.9488, test_loss: 0.9045, test_f1: 0.5017
 epoch: 52, train_loss: 0.9259, test_loss: 0.8992, test_f1: 0.5154
 epoch: 53, train_loss: 0.9310, test_loss: 0.9024, test_f1: 0.5077
 epoch: 54, train_loss: 0.9406, test_loss: 0.8918, test_f1: 0.5068
 epoch: 55, train_loss: 0.9258, test_loss: 0.8956, test_f1: 0.5040
 epoch: 56, train_loss: 0.9303, test_loss: 0.8900, test_f1: 0.5181
 epoch: 57, train_loss: 0.9195, test_loss: 0.8895, test_f1: 0.5039
 epoch: 58, train_loss: 0.9184, test_loss: 0.8971, test_f1: 0.5013
 epoch: 59, train_loss: 0.9316, test_loss: 0.8998, test_f1: 0.5017
 epoch: 60, train_loss: 0.9192, test_loss: 0.8968, test_f1: 0.5014
 epoch: 61, train_loss: 0.9138, test_loss: 0.9207, test_f1: 0.5003
 epoch: 62, train_loss: 0.9308, test_loss: 0.8932, test_f1: 0.5159
 epoch: 63, train_loss: 0.9277, test_loss: 0.8965, test_f1: 0.5073
 epoch: 64, train_loss: 0.9216, test_loss: 0.9126, test_f1: 0.4936
 epoch: 65, train_loss: 0.9107, test_loss: 0.9023, test_f1: 0.4923
 epoch: 66, train_loss: 0.9201, test_loss: 0.8940, test_f1: 0.5012
 epoch: 67, train_loss: 0.9094, test_loss: 0.8873, test_f1: 0.5132
 epoch: 68, train_loss: 0.9128, test_loss: 0.8983, test_f1: 0.5069
 epoch: 69, train_loss: 0.9058, test_loss: 0.8776, test_f1: 0.5062
 epoch: 70, train_loss: 0.9039, test_loss: 0.8937, test_f1: 0.5160
 epoch: 71, train_loss: 0.9042, test_loss: 0.8939, test_f1: 0.5081
 epoch: 72, train_loss: 0.9093, test_loss: 0.8868, test_f1: 0.5115
 epoch: 73, train_loss: 0.8978, test_loss: 0.8936, test_f1: 0.5165
 epoch: 74, train_loss: 0.9025, test_loss: 0.8777, test_f1: 0.5231
 epoch: 75, train_loss: 0.8998, test_loss: 0.8966, test_f1: 0.5122
 epoch: 76, train_loss: 0.9001, test_loss: 0.9032, test_f1: 0.5110
 epoch: 77, train_loss: 0.9077, test_loss: 0.8869, test_f1: 0.5152
 epoch: 78, train_loss: 0.9030, test_loss: 0.9031, test_f1: 0.5004
 epoch: 79, train_loss: 0.9004, test_loss: 0.8827, test_f1: 0.5120
 epoch: 80, train_loss: 0.8968, test_loss: 0.9157, test_f1: 0.5110
 epoch: 81, train_loss: 0.8973, test_loss: 0.8816, test_f1: 0.5160
 epoch: 82, train_loss: 0.9012, test_loss: 0.9184, test_f1: 0.5009
 epoch: 83, train_loss: 0.9025, test_loss: 0.9046, test_f1: 0.4981
 epoch: 84, train_loss: 0.8963, test_loss: 0.9068, test_f1: 0.4880
 epoch: 85, train_loss: 0.8899, test_loss: 0.8821, test_f1: 0.5132
 epoch: 86, train_loss: 0.8875, test_loss: 0.8942, test_f1: 0.5103
 epoch: 87, train_loss: 0.8911, test_loss: 0.8988, test_f1: 0.5087
 epoch: 88, train_loss: 0.8901, test_loss: 0.8852, test_f1: 0.5157
 epoch: 89, train_loss: 0.8878, test_loss: 0.8895, test_f1: 0.5089
 epoch: 90, train_loss: 0.8717, test_loss: 0.9047, test_f1: 0.5140
 epoch: 91, train_loss: 0.8854, test_loss: 0.8930, test_f1: 0.5039
 epoch: 92, train_loss: 0.8825, test_loss: 0.9008, test_f1: 0.5070
 epoch: 93, train_loss: 0.8859, test_loss: 0.9111, test_f1: 0.5076
 epoch: 94, train_loss: 0.8835, test_loss: 0.9272, test_f1: 0.4998
 epoch: 95, train_loss: 0.8751, test_loss: 0.9025, test_f1: 0.5012
 epoch: 96, train_loss: 0.8804, test_loss: 0.8968, test_f1: 0.5140
 epoch: 97, train_loss: 0.8890, test_loss: 0.8907, test_f1: 0.5027
 epoch: 98, train_loss: 0.8782, test_loss: 0.9089, test_f1: 0.5037
 epoch: 99, train_loss: 0.8804, test_loss: 0.9052, test_f1: 0.5085
##################ITERATION #9 ****************************************
 epoch: 0, train_loss: 1.5823, test_loss: 1.3270, test_f1: 0.2494
 epoch: 1, train_loss: 1.3298, test_loss: 1.2515, test_f1: 0.2795
 epoch: 2, train_loss: 1.2981, test_loss: 1.2005, test_f1: 0.3478
 epoch: 3, train_loss: 1.2552, test_loss: 1.1749, test_f1: 0.3864
 epoch: 4, train_loss: 1.2229, test_loss: 1.1453, test_f1: 0.4018
 epoch: 5, train_loss: 1.2087, test_loss: 1.1154, test_f1: 0.4328
 epoch: 6, train_loss: 1.1869, test_loss: 1.1016, test_f1: 0.4356
 epoch: 7, train_loss: 1.1693, test_loss: 1.0880, test_f1: 0.4310
 epoch: 8, train_loss: 1.1585, test_loss: 1.0560, test_f1: 0.4844
 epoch: 9, train_loss: 1.1389, test_loss: 1.0572, test_f1: 0.4688
 epoch: 10, train_loss: 1.1337, test_loss: 1.0411, test_f1: 0.4624
 epoch: 11, train_loss: 1.1146, test_loss: 1.0310, test_f1: 0.4730
 epoch: 12, train_loss: 1.1049, test_loss: 1.0161, test_f1: 0.4697
 epoch: 13, train_loss: 1.0990, test_loss: 1.0248, test_f1: 0.4568
 epoch: 14, train_loss: 1.0914, test_loss: 1.0031, test_f1: 0.4764
 epoch: 15, train_loss: 1.0764, test_loss: 0.9789, test_f1: 0.4833
 epoch: 16, train_loss: 1.0703, test_loss: 0.9743, test_f1: 0.4900
 epoch: 17, train_loss: 1.0651, test_loss: 0.9645, test_f1: 0.4822
 epoch: 18, train_loss: 1.0632, test_loss: 0.9697, test_f1: 0.4863
 epoch: 19, train_loss: 1.0539, test_loss: 0.9532, test_f1: 0.4844
 epoch: 20, train_loss: 1.0478, test_loss: 0.9553, test_f1: 0.4954
 epoch: 21, train_loss: 1.0422, test_loss: 0.9665, test_f1: 0.4890
 epoch: 22, train_loss: 1.0485, test_loss: 0.9736, test_f1: 0.4727
 epoch: 23, train_loss: 1.0323, test_loss: 0.9285, test_f1: 0.5024
 epoch: 24, train_loss: 1.0362, test_loss: 0.9612, test_f1: 0.4923
 epoch: 25, train_loss: 1.0286, test_loss: 0.9344, test_f1: 0.5033
 epoch: 26, train_loss: 1.0239, test_loss: 0.9285, test_f1: 0.5050
 epoch: 27, train_loss: 1.0124, test_loss: 0.9369, test_f1: 0.4793
 epoch: 28, train_loss: 1.0200, test_loss: 0.9187, test_f1: 0.5090
 epoch: 29, train_loss: 1.0066, test_loss: 0.9193, test_f1: 0.4958
 epoch: 30, train_loss: 1.0064, test_loss: 0.9260, test_f1: 0.4977
 epoch: 31, train_loss: 1.0022, test_loss: 0.9235, test_f1: 0.5015
 epoch: 32, train_loss: 0.9979, test_loss: 0.9148, test_f1: 0.4964
 epoch: 33, train_loss: 1.0012, test_loss: 0.9203, test_f1: 0.4810
 epoch: 34, train_loss: 0.9938, test_loss: 0.9161, test_f1: 0.4949
 epoch: 35, train_loss: 0.9823, test_loss: 0.9211, test_f1: 0.4992
 epoch: 36, train_loss: 0.9884, test_loss: 0.9089, test_f1: 0.5033
 epoch: 37, train_loss: 0.9785, test_loss: 0.9126, test_f1: 0.5002
 epoch: 38, train_loss: 0.9746, test_loss: 0.9119, test_f1: 0.5083
 epoch: 39, train_loss: 0.9758, test_loss: 0.9145, test_f1: 0.5023
 epoch: 40, train_loss: 0.9770, test_loss: 0.9127, test_f1: 0.5050
 epoch: 41, train_loss: 0.9766, test_loss: 0.9137, test_f1: 0.5034
 epoch: 42, train_loss: 0.9728, test_loss: 0.9200, test_f1: 0.5059
 epoch: 43, train_loss: 0.9673, test_loss: 0.8951, test_f1: 0.5009
 epoch: 44, train_loss: 0.9630, test_loss: 0.9138, test_f1: 0.5071
 epoch: 45, train_loss: 0.9655, test_loss: 0.9079, test_f1: 0.5054
 epoch: 46, train_loss: 0.9663, test_loss: 0.8969, test_f1: 0.5174
 epoch: 47, train_loss: 0.9673, test_loss: 0.9006, test_f1: 0.5147
 epoch: 48, train_loss: 0.9543, test_loss: 0.9518, test_f1: 0.4928
 epoch: 49, train_loss: 0.9474, test_loss: 0.9237, test_f1: 0.4964
 epoch: 50, train_loss: 0.9529, test_loss: 0.9240, test_f1: 0.4938
 epoch: 51, train_loss: 0.9461, test_loss: 0.9050, test_f1: 0.5079
 epoch: 52, train_loss: 0.9453, test_loss: 0.9322, test_f1: 0.4989
 epoch: 53, train_loss: 0.9358, test_loss: 0.9117, test_f1: 0.5066
 epoch: 54, train_loss: 0.9441, test_loss: 0.9110, test_f1: 0.5086
 epoch: 55, train_loss: 0.9313, test_loss: 0.9220, test_f1: 0.5056
 epoch: 56, train_loss: 0.9447, test_loss: 0.9085, test_f1: 0.5073
 epoch: 57, train_loss: 0.9286, test_loss: 0.9244, test_f1: 0.5049
 epoch: 58, train_loss: 0.9358, test_loss: 0.9283, test_f1: 0.5070
 epoch: 59, train_loss: 0.9320, test_loss: 0.9356, test_f1: 0.5123
 epoch: 60, train_loss: 0.9316, test_loss: 0.9186, test_f1: 0.5059
 epoch: 61, train_loss: 0.9350, test_loss: 0.9481, test_f1: 0.5168
 epoch: 62, train_loss: 0.9289, test_loss: 0.9124, test_f1: 0.5098
 epoch: 63, train_loss: 0.9213, test_loss: 0.9430, test_f1: 0.5088
 epoch: 64, train_loss: 0.9372, test_loss: 0.9370, test_f1: 0.5088
 epoch: 65, train_loss: 0.9211, test_loss: 0.9288, test_f1: 0.4983
 epoch: 66, train_loss: 0.9284, test_loss: 0.9269, test_f1: 0.5140
 epoch: 67, train_loss: 0.9319, test_loss: 0.9213, test_f1: 0.5052
 epoch: 68, train_loss: 0.9212, test_loss: 0.9070, test_f1: 0.5131
 epoch: 69, train_loss: 0.9062, test_loss: 0.9447, test_f1: 0.5124
 epoch: 70, train_loss: 0.9192, test_loss: 0.9296, test_f1: 0.5082
 epoch: 71, train_loss: 0.9043, test_loss: 0.9123, test_f1: 0.5133
 epoch: 72, train_loss: 0.9148, test_loss: 0.9375, test_f1: 0.5052
 epoch: 73, train_loss: 0.9238, test_loss: 0.9472, test_f1: 0.5096
 epoch: 74, train_loss: 0.9118, test_loss: 0.9377, test_f1: 0.5021
 epoch: 75, train_loss: 0.9169, test_loss: 0.9397, test_f1: 0.5178
 epoch: 76, train_loss: 0.9037, test_loss: 0.9413, test_f1: 0.5166
 epoch: 77, train_loss: 0.9062, test_loss: 0.9451, test_f1: 0.5113
 epoch: 78, train_loss: 0.9168, test_loss: 0.9601, test_f1: 0.5092
 epoch: 79, train_loss: 0.9133, test_loss: 0.9529, test_f1: 0.5199
 epoch: 80, train_loss: 0.9155, test_loss: 0.9512, test_f1: 0.5081
 epoch: 81, train_loss: 0.9083, test_loss: 0.9448, test_f1: 0.5063
 epoch: 82, train_loss: 0.9033, test_loss: 0.9660, test_f1: 0.5129
 epoch: 83, train_loss: 0.8986, test_loss: 0.9632, test_f1: 0.5139
 epoch: 84, train_loss: 0.8985, test_loss: 0.9355, test_f1: 0.5047
 epoch: 85, train_loss: 0.9162, test_loss: 0.9661, test_f1: 0.5077
 epoch: 86, train_loss: 0.8962, test_loss: 0.9615, test_f1: 0.5071
 epoch: 87, train_loss: 0.9073, test_loss: 0.9705, test_f1: 0.5114
 epoch: 88, train_loss: 0.9102, test_loss: 0.9599, test_f1: 0.5078
 epoch: 89, train_loss: 0.8965, test_loss: 0.9561, test_f1: 0.5143
 epoch: 90, train_loss: 0.9058, test_loss: 0.9580, test_f1: 0.5089
 epoch: 91, train_loss: 0.8995, test_loss: 0.9657, test_f1: 0.5064
 epoch: 92, train_loss: 0.8964, test_loss: 0.9501, test_f1: 0.5090
 epoch: 93, train_loss: 0.8988, test_loss: 0.9557, test_f1: 0.5147
 epoch: 94, train_loss: 0.8900, test_loss: 0.9642, test_f1: 0.5133
 epoch: 95, train_loss: 0.8852, test_loss: 0.9776, test_f1: 0.5182
 epoch: 96, train_loss: 0.8758, test_loss: 0.9759, test_f1: 0.5123
 epoch: 97, train_loss: 0.9068, test_loss: 0.9689, test_f1: 0.5092
 epoch: 98, train_loss: 0.8776, test_loss: 0.9554, test_f1: 0.5097
 epoch: 99, train_loss: 0.8929, test_loss: 0.9763, test_f1: 0.5177

Training completed in 477.45 seconds
Best F1: 0.5439 at epoch 94
Mean F1 across iterations: 0.5117  0.0153
========================FINAL RESULTS================================
FEGIN weighted F1: 0.5439  0.0153
python main.py --data ltspice_examples --representation component_component --model FEGIN --layers 4 --hiddens 16 --batch_size 128 --lr 0.001 --emb_size 128 --epochs 100 --save_appendix component_component_L4_H16_BS128_LR0.001_E128 --no_val
-----



STDERR:
  File "main.py", line 370, in <module>
    main()
  File "main.py", line 254, in main
    dataset = dataset_class(
  File "/home/philip/projects/ltspice_examples_code_repo/Circuit-Completion-Using-GNNs/component_classification_with_link_prediction_head/evaluation/FEGIN/kernel/circuit_datasets.py", line 15, in __init__
    self.data, self.slices = torch.load(self.processed_paths[0])
  File "/home/philip/.local/lib/python3.8/site-packages/torch/serialization.py", line 1040, in load
    warnings.warn(
  File "/usr/lib/python3.8/warnings.py", line 109, in _showwarnmsg
    sw(msg.message, msg.category, msg.filename, msg.lineno,
  File "main.py", line 47, in warn_with_traceback
    traceback.print_stack(file=log)
/home/philip/projects/ltspice_examples_code_repo/Circuit-Completion-Using-GNNs/component_classification_with_link_prediction_head/evaluation/FEGIN/kernel/circuit_datasets.py:15: FutureWarning: You are using `torch.load` with `weights_only=False` (the current default value), which uses the default pickle module implicitly. It is possible to construct malicious pickle data which will execute arbitrary code during unpickling (See https://github.com/pytorch/pytorch/blob/main/SECURITY.md#untrusted-models for more details). In a future release, the default value for `weights_only` will be flipped to `True`. This limits the functions that could be executed during unpickling. Arbitrary objects will no longer be allowed to be loaded via this mode unless they are explicitly allowlisted by the user via `torch.serialization.add_safe_globals`. We recommend you start setting `weights_only=True` for any use case where you don't have full control of the loaded file. Please open an issue on GitHub for any issues related to this experimental feature.
  self.data, self.slices = torch.load(self.processed_paths[0])
