STDOUT:
Results will be saved in /home/philip/projects/ltspice_examples_code_repo/Circuit-Completion-Using-GNNs/component_classification_with_link_prediction_head/evaluation/FEGIN/results/model_FEGIN_dataset_ltspice_demos
Command line input: python main.py --data ltspice_demos --representation component_pin --model FEGIN --layers 6 --hiddens 64 --batch_size 64 --lr 0.01 --emb_size 250 --epochs 100 --save_appendix component_pin_L6_H64_BS64_LR0.01_E250 --no_val
 is saved.
-----
ltspice_demos - FEGIN
Using 6 layers, 64 hidden units, h = 2
Loading component_pin representation dataset
ENTERED
Training FEGIN on component_pin representation
Train: 1565, Test: 383
##################ITERATION #0 ****************************************
 epoch: 0, train_loss: 1.2368, test_loss: 1.8091, test_f1: 0.3232
 epoch: 1, train_loss: 1.0330, test_loss: 1.0971, test_f1: 0.4681
 epoch: 2, train_loss: 0.9621, test_loss: 1.1775, test_f1: 0.4482
 epoch: 3, train_loss: 0.9473, test_loss: 1.1633, test_f1: 0.4212
 epoch: 4, train_loss: 0.9079, test_loss: 1.3091, test_f1: 0.2688
 epoch: 5, train_loss: 0.8607, test_loss: 1.1243, test_f1: 0.5012
 epoch: 6, train_loss: 0.8401, test_loss: 1.0261, test_f1: 0.5009
 epoch: 7, train_loss: 0.8339, test_loss: 1.0259, test_f1: 0.5730
 epoch: 8, train_loss: 0.8218, test_loss: 1.1312, test_f1: 0.5530
 epoch: 9, train_loss: 0.7952, test_loss: 3.0147, test_f1: 0.2683
 epoch: 10, train_loss: 0.7998, test_loss: 0.9750, test_f1: 0.5542
 epoch: 11, train_loss: 0.7662, test_loss: 1.2098, test_f1: 0.5141
 epoch: 12, train_loss: 0.7629, test_loss: 0.9693, test_f1: 0.5980
 epoch: 13, train_loss: 0.8240, test_loss: 1.1300, test_f1: 0.4910
 epoch: 14, train_loss: 0.7655, test_loss: 1.1648, test_f1: 0.5640
 epoch: 15, train_loss: 0.7689, test_loss: 0.9967, test_f1: 0.5929
 epoch: 16, train_loss: 0.7481, test_loss: 1.0608, test_f1: 0.5490
 epoch: 17, train_loss: 0.7561, test_loss: 1.0607, test_f1: 0.6159
 epoch: 18, train_loss: 0.7205, test_loss: 1.3759, test_f1: 0.5603
 epoch: 19, train_loss: 0.7126, test_loss: 1.1273, test_f1: 0.5870
 epoch: 20, train_loss: 0.7134, test_loss: 0.9911, test_f1: 0.6079
 epoch: 21, train_loss: 0.6887, test_loss: 1.1101, test_f1: 0.6094
 epoch: 22, train_loss: 0.6854, test_loss: 1.5480, test_f1: 0.5632
 epoch: 23, train_loss: 0.6877, test_loss: 1.1518, test_f1: 0.5499
 epoch: 24, train_loss: 0.7130, test_loss: 0.9380, test_f1: 0.6334
 epoch: 25, train_loss: 0.7181, test_loss: 1.7858, test_f1: 0.4940
 epoch: 26, train_loss: 0.6899, test_loss: 1.0112, test_f1: 0.6265
 epoch: 27, train_loss: 0.7080, test_loss: 1.1605, test_f1: 0.5415
 epoch: 28, train_loss: 0.6982, test_loss: 1.2622, test_f1: 0.5146
 epoch: 29, train_loss: 0.6806, test_loss: 1.0692, test_f1: 0.5573
 epoch: 30, train_loss: 0.6890, test_loss: 1.2717, test_f1: 0.5276
 epoch: 31, train_loss: 0.6804, test_loss: 0.9997, test_f1: 0.5987
 epoch: 32, train_loss: 0.6380, test_loss: 1.1596, test_f1: 0.6201
 epoch: 33, train_loss: 0.6490, test_loss: 1.5583, test_f1: 0.5171
 epoch: 34, train_loss: 0.6425, test_loss: 1.0825, test_f1: 0.6228
 epoch: 35, train_loss: 0.6402, test_loss: 1.5204, test_f1: 0.4721
 epoch: 36, train_loss: 0.6208, test_loss: 1.4047, test_f1: 0.6095
 epoch: 37, train_loss: 0.6507, test_loss: 0.9851, test_f1: 0.6380
 epoch: 38, train_loss: 0.6369, test_loss: 1.2222, test_f1: 0.6178
 epoch: 39, train_loss: 0.6063, test_loss: 1.1893, test_f1: 0.5299
 epoch: 40, train_loss: 0.6008, test_loss: 1.2396, test_f1: 0.5422
 epoch: 41, train_loss: 0.5791, test_loss: 1.0745, test_f1: 0.6022
 epoch: 42, train_loss: 0.5712, test_loss: 1.3998, test_f1: 0.5442
 epoch: 43, train_loss: 0.6207, test_loss: 1.0184, test_f1: 0.5695
 epoch: 44, train_loss: 0.5958, test_loss: 1.2916, test_f1: 0.5343
 epoch: 45, train_loss: 0.5676, test_loss: 1.4601, test_f1: 0.6241
 epoch: 46, train_loss: 0.5455, test_loss: 1.0996, test_f1: 0.6043
 epoch: 47, train_loss: 0.5879, test_loss: 1.0295, test_f1: 0.6213
 epoch: 48, train_loss: 0.5670, test_loss: 1.3376, test_f1: 0.6149
 epoch: 49, train_loss: 0.5977, test_loss: 1.2849, test_f1: 0.6021
 epoch: 50, train_loss: 0.5650, test_loss: 1.3226, test_f1: 0.6134
 epoch: 51, train_loss: 0.5281, test_loss: 1.3427, test_f1: 0.6526
 epoch: 52, train_loss: 0.4914, test_loss: 1.3442, test_f1: 0.6271
 epoch: 53, train_loss: 0.4896, test_loss: 1.4372, test_f1: 0.6279
 epoch: 54, train_loss: 0.4668, test_loss: 1.5460, test_f1: 0.5987
 epoch: 55, train_loss: 0.4355, test_loss: 1.4920, test_f1: 0.6047
 epoch: 56, train_loss: 0.4668, test_loss: 1.5002, test_f1: 0.6467
 epoch: 57, train_loss: 0.4359, test_loss: 1.4512, test_f1: 0.6300
 epoch: 58, train_loss: 0.4553, test_loss: 1.3938, test_f1: 0.6060
 epoch: 59, train_loss: 0.4583, test_loss: 1.8196, test_f1: 0.6462
 epoch: 60, train_loss: 0.4291, test_loss: 1.6403, test_f1: 0.6425
 epoch: 61, train_loss: 0.4300, test_loss: 1.8235, test_f1: 0.6253
 epoch: 62, train_loss: 0.4415, test_loss: 1.5386, test_f1: 0.6174
 epoch: 63, train_loss: 0.4150, test_loss: 1.7783, test_f1: 0.6386
 epoch: 64, train_loss: 0.4141, test_loss: 1.7004, test_f1: 0.6554
 epoch: 65, train_loss: 0.3990, test_loss: 1.7168, test_f1: 0.6176
 epoch: 66, train_loss: 0.3952, test_loss: 1.6298, test_f1: 0.6297
 epoch: 67, train_loss: 0.3753, test_loss: 1.8225, test_f1: 0.6429
 epoch: 68, train_loss: 0.4135, test_loss: 1.7113, test_f1: 0.5765
 epoch: 69, train_loss: 0.3689, test_loss: 1.6498, test_f1: 0.6655
 epoch: 70, train_loss: 0.4061, test_loss: 1.9273, test_f1: 0.6048
 epoch: 71, train_loss: 0.3920, test_loss: 1.8786, test_f1: 0.6119
 epoch: 72, train_loss: 0.3988, test_loss: 1.9058, test_f1: 0.6349
 epoch: 73, train_loss: 0.3659, test_loss: 1.7326, test_f1: 0.6196
 epoch: 74, train_loss: 0.3892, test_loss: 1.7693, test_f1: 0.6123
 epoch: 75, train_loss: 0.3773, test_loss: 1.6845, test_f1: 0.6593
 epoch: 76, train_loss: 0.3819, test_loss: 1.9586, test_f1: 0.6215
 epoch: 77, train_loss: 0.3650, test_loss: 1.6136, test_f1: 0.6306
 epoch: 78, train_loss: 0.3632, test_loss: 1.5287, test_f1: 0.6582
 epoch: 79, train_loss: 0.3643, test_loss: 1.8789, test_f1: 0.6270
 epoch: 80, train_loss: 0.3660, test_loss: 1.6180, test_f1: 0.6543
 epoch: 81, train_loss: 0.3309, test_loss: 1.8532, test_f1: 0.5804
 epoch: 82, train_loss: 0.3326, test_loss: 1.8172, test_f1: 0.6397
 epoch: 83, train_loss: 0.3744, test_loss: 2.1280, test_f1: 0.6184
 epoch: 84, train_loss: 0.3596, test_loss: 1.5810, test_f1: 0.6587
 epoch: 85, train_loss: 0.3440, test_loss: 2.0943, test_f1: 0.6354
 epoch: 86, train_loss: 0.3450, test_loss: 1.7456, test_f1: 0.6223
 epoch: 87, train_loss: 0.3107, test_loss: 1.9955, test_f1: 0.6467
 epoch: 88, train_loss: 0.2893, test_loss: 2.2821, test_f1: 0.6419
 epoch: 89, train_loss: 0.2951, test_loss: 2.1513, test_f1: 0.6022
 epoch: 90, train_loss: 0.2805, test_loss: 2.1807, test_f1: 0.6441
 epoch: 91, train_loss: 0.3144, test_loss: 2.0097, test_f1: 0.6160
 epoch: 92, train_loss: 0.2944, test_loss: 1.9839, test_f1: 0.6332
 epoch: 93, train_loss: 0.2943, test_loss: 1.9423, test_f1: 0.6655
 epoch: 94, train_loss: 0.3032, test_loss: 2.1438, test_f1: 0.6373
 epoch: 95, train_loss: 0.3103, test_loss: 2.0372, test_f1: 0.6545
 epoch: 96, train_loss: 0.3407, test_loss: 2.0967, test_f1: 0.6199
 epoch: 97, train_loss: 0.3335, test_loss: 1.8317, test_f1: 0.6319
 epoch: 98, train_loss: 0.2969, test_loss: 1.9576, test_f1: 0.6364
 epoch: 99, train_loss: 0.2939, test_loss: 2.0687, test_f1: 0.6453
##################ITERATION #1 ****************************************
 epoch: 0, train_loss: 1.1580, test_loss: 1.5346, test_f1: 0.2955
 epoch: 1, train_loss: 0.9799, test_loss: 1.5971, test_f1: 0.3141
 epoch: 2, train_loss: 0.9142, test_loss: 1.0572, test_f1: 0.5107
 epoch: 3, train_loss: 0.8617, test_loss: 1.6027, test_f1: 0.4177
 epoch: 4, train_loss: 0.8846, test_loss: 1.5309, test_f1: 0.4390
 epoch: 5, train_loss: 0.8367, test_loss: 1.0004, test_f1: 0.5130
 epoch: 6, train_loss: 0.8101, test_loss: 1.0299, test_f1: 0.5470
 epoch: 7, train_loss: 0.7994, test_loss: 1.5996, test_f1: 0.5299
 epoch: 8, train_loss: 0.8016, test_loss: 1.1036, test_f1: 0.5402
 epoch: 9, train_loss: 0.7839, test_loss: 1.0431, test_f1: 0.5446
 epoch: 10, train_loss: 0.7822, test_loss: 1.1366, test_f1: 0.5720
 epoch: 11, train_loss: 0.7587, test_loss: 1.1282, test_f1: 0.5615
 epoch: 12, train_loss: 0.7717, test_loss: 1.1939, test_f1: 0.5796
 epoch: 13, train_loss: 0.7546, test_loss: 1.1472, test_f1: 0.5918
 epoch: 14, train_loss: 0.7338, test_loss: 2.7713, test_f1: 0.3681
 epoch: 15, train_loss: 0.7619, test_loss: 1.2885, test_f1: 0.5887
 epoch: 16, train_loss: 0.7407, test_loss: 1.1525, test_f1: 0.5515
 epoch: 17, train_loss: 0.7712, test_loss: 1.1128, test_f1: 0.4984
 epoch: 18, train_loss: 0.7534, test_loss: 1.0809, test_f1: 0.5943
 epoch: 19, train_loss: 0.7472, test_loss: 1.0826, test_f1: 0.5381
 epoch: 20, train_loss: 0.7530, test_loss: 0.9670, test_f1: 0.6219
 epoch: 21, train_loss: 0.7316, test_loss: 1.1962, test_f1: 0.5484
 epoch: 22, train_loss: 0.7026, test_loss: 1.4631, test_f1: 0.6163
 epoch: 23, train_loss: 0.6952, test_loss: 1.0681, test_f1: 0.6121
 epoch: 24, train_loss: 0.6993, test_loss: 1.0961, test_f1: 0.5735
 epoch: 25, train_loss: 0.6881, test_loss: 1.4931, test_f1: 0.6128
 epoch: 26, train_loss: 0.6734, test_loss: 1.2419, test_f1: 0.5910
 epoch: 27, train_loss: 0.7015, test_loss: 1.4838, test_f1: 0.6248
 epoch: 28, train_loss: 0.6912, test_loss: 1.5172, test_f1: 0.4660
 epoch: 29, train_loss: 0.6942, test_loss: 1.1230, test_f1: 0.5529
 epoch: 30, train_loss: 0.6644, test_loss: 1.2744, test_f1: 0.5987
 epoch: 31, train_loss: 0.6382, test_loss: 1.7969, test_f1: 0.4522
 epoch: 32, train_loss: 0.6570, test_loss: 1.3993, test_f1: 0.5967
 epoch: 33, train_loss: 0.6515, test_loss: 1.1954, test_f1: 0.5593
 epoch: 34, train_loss: 0.6711, test_loss: 1.2586, test_f1: 0.5955
 epoch: 35, train_loss: 0.6232, test_loss: 1.3271, test_f1: 0.6118
 epoch: 36, train_loss: 0.6291, test_loss: 1.6823, test_f1: 0.5689
 epoch: 37, train_loss: 0.6432, test_loss: 1.1143, test_f1: 0.5744
 epoch: 38, train_loss: 0.6366, test_loss: 1.0306, test_f1: 0.6098
 epoch: 39, train_loss: 0.6268, test_loss: 1.3748, test_f1: 0.5146
 epoch: 40, train_loss: 0.6388, test_loss: 1.0468, test_f1: 0.6051
 epoch: 41, train_loss: 0.5824, test_loss: 1.3720, test_f1: 0.5972
 epoch: 42, train_loss: 0.6094, test_loss: 1.1060, test_f1: 0.6053
 epoch: 43, train_loss: 0.5972, test_loss: 1.1829, test_f1: 0.5460
 epoch: 44, train_loss: 0.5837, test_loss: 1.1482, test_f1: 0.6458
 epoch: 45, train_loss: 0.5908, test_loss: 1.5442, test_f1: 0.5392
 epoch: 46, train_loss: 0.6138, test_loss: 1.2332, test_f1: 0.6125
 epoch: 47, train_loss: 0.5891, test_loss: 1.1237, test_f1: 0.6595
 epoch: 48, train_loss: 0.5999, test_loss: 1.2847, test_f1: 0.6465
 epoch: 49, train_loss: 0.5833, test_loss: 1.2974, test_f1: 0.6079
 epoch: 50, train_loss: 0.5524, test_loss: 1.5444, test_f1: 0.5645
 epoch: 51, train_loss: 0.5191, test_loss: 1.1637, test_f1: 0.6329
 epoch: 52, train_loss: 0.4941, test_loss: 1.3783, test_f1: 0.5971
 epoch: 53, train_loss: 0.5006, test_loss: 1.4562, test_f1: 0.6299
 epoch: 54, train_loss: 0.4766, test_loss: 1.4390, test_f1: 0.6127
 epoch: 55, train_loss: 0.4767, test_loss: 1.5430, test_f1: 0.6578
 epoch: 56, train_loss: 0.4811, test_loss: 1.6259, test_f1: 0.6806
 epoch: 57, train_loss: 0.4755, test_loss: 1.6461, test_f1: 0.6470
 epoch: 58, train_loss: 0.4371, test_loss: 1.3002, test_f1: 0.6524
 epoch: 59, train_loss: 0.4496, test_loss: 1.2626, test_f1: 0.6620
 epoch: 60, train_loss: 0.4658, test_loss: 1.2616, test_f1: 0.6990
 epoch: 61, train_loss: 0.4461, test_loss: 1.3781, test_f1: 0.6257
 epoch: 62, train_loss: 0.4255, test_loss: 1.6979, test_f1: 0.6233
 epoch: 63, train_loss: 0.4682, test_loss: 1.3642, test_f1: 0.6951
 epoch: 64, train_loss: 0.4175, test_loss: 1.4763, test_f1: 0.6224
 epoch: 65, train_loss: 0.4350, test_loss: 1.5638, test_f1: 0.6316
 epoch: 66, train_loss: 0.4390, test_loss: 1.3925, test_f1: 0.6576
 epoch: 67, train_loss: 0.4271, test_loss: 1.6233, test_f1: 0.6542
 epoch: 68, train_loss: 0.3898, test_loss: 1.6503, test_f1: 0.6409
 epoch: 69, train_loss: 0.3858, test_loss: 2.1147, test_f1: 0.6266
 epoch: 70, train_loss: 0.3626, test_loss: 1.9722, test_f1: 0.6468
 epoch: 71, train_loss: 0.4228, test_loss: 1.9373, test_f1: 0.6071
 epoch: 72, train_loss: 0.3730, test_loss: 1.7995, test_f1: 0.6567
 epoch: 73, train_loss: 0.4016, test_loss: 1.7221, test_f1: 0.6496
 epoch: 74, train_loss: 0.4004, test_loss: 1.8170, test_f1: 0.6478
 epoch: 75, train_loss: 0.3821, test_loss: 2.0156, test_f1: 0.6560
 epoch: 76, train_loss: 0.4127, test_loss: 1.8017, test_f1: 0.6503
 epoch: 77, train_loss: 0.3860, test_loss: 1.6604, test_f1: 0.6600
 epoch: 78, train_loss: 0.3924, test_loss: 1.6245, test_f1: 0.6630
 epoch: 79, train_loss: 0.3519, test_loss: 2.1339, test_f1: 0.6729
 epoch: 80, train_loss: 0.3863, test_loss: 1.6424, test_f1: 0.6494
 epoch: 81, train_loss: 0.3600, test_loss: 2.2709, test_f1: 0.6522
 epoch: 82, train_loss: 0.3731, test_loss: 1.5225, test_f1: 0.6184
 epoch: 83, train_loss: 0.3449, test_loss: 1.8828, test_f1: 0.6604
 epoch: 84, train_loss: 0.3540, test_loss: 1.9289, test_f1: 0.6490
 epoch: 85, train_loss: 0.3530, test_loss: 1.8489, test_f1: 0.6848
 epoch: 86, train_loss: 0.3499, test_loss: 1.9296, test_f1: 0.6450
 epoch: 87, train_loss: 0.3303, test_loss: 1.7448, test_f1: 0.6686
 epoch: 88, train_loss: 0.3439, test_loss: 1.7000, test_f1: 0.6458
 epoch: 89, train_loss: 0.3327, test_loss: 2.0411, test_f1: 0.6758
 epoch: 90, train_loss: 0.3112, test_loss: 1.9659, test_f1: 0.6716
 epoch: 91, train_loss: 0.3313, test_loss: 2.1005, test_f1: 0.6935
 epoch: 92, train_loss: 0.3645, test_loss: 1.8000, test_f1: 0.6615
 epoch: 93, train_loss: 0.3294, test_loss: 1.7660, test_f1: 0.6837
 epoch: 94, train_loss: 0.3264, test_loss: 1.9042, test_f1: 0.6802
 epoch: 95, train_loss: 0.2921, test_loss: 2.2205, test_f1: 0.6865
 epoch: 96, train_loss: 0.3223, test_loss: 1.7010, test_f1: 0.6941
 epoch: 97, train_loss: 0.3468, test_loss: 1.8667, test_f1: 0.6516
 epoch: 98, train_loss: 0.2810, test_loss: 2.2594, test_f1: 0.6728
 epoch: 99, train_loss: 0.3079, test_loss: 2.1155, test_f1: 0.6477
##################ITERATION #2 ****************************************
 epoch: 0, train_loss: 1.2461, test_loss: 1.2523, test_f1: 0.3205
 epoch: 1, train_loss: 0.9838, test_loss: 1.3999, test_f1: 0.4187
 epoch: 2, train_loss: 0.9033, test_loss: 1.2357, test_f1: 0.4267
 epoch: 3, train_loss: 0.8708, test_loss: 1.3615, test_f1: 0.4093
 epoch: 4, train_loss: 0.8489, test_loss: 1.1091, test_f1: 0.4481
 epoch: 5, train_loss: 0.8217, test_loss: 1.0405, test_f1: 0.5812
 epoch: 6, train_loss: 0.8264, test_loss: 1.1029, test_f1: 0.5095
 epoch: 7, train_loss: 0.8115, test_loss: 1.0792, test_f1: 0.5517
 epoch: 8, train_loss: 0.7844, test_loss: 1.0429, test_f1: 0.4708
 epoch: 9, train_loss: 0.7712, test_loss: 1.3489, test_f1: 0.4525
 epoch: 10, train_loss: 0.7832, test_loss: 0.9563, test_f1: 0.5824
 epoch: 11, train_loss: 0.7743, test_loss: 1.1085, test_f1: 0.5433
 epoch: 12, train_loss: 0.7555, test_loss: 1.0705, test_f1: 0.5113
 epoch: 13, train_loss: 0.7823, test_loss: 1.2633, test_f1: 0.5112
 epoch: 14, train_loss: 0.7350, test_loss: 1.0134, test_f1: 0.6084
 epoch: 15, train_loss: 0.7501, test_loss: 1.0511, test_f1: 0.5695
 epoch: 16, train_loss: 0.7498, test_loss: 1.1091, test_f1: 0.5236
 epoch: 17, train_loss: 0.7367, test_loss: 1.0483, test_f1: 0.6172
 epoch: 18, train_loss: 0.7077, test_loss: 1.0126, test_f1: 0.5839
 epoch: 19, train_loss: 0.7360, test_loss: 1.0779, test_f1: 0.5064
 epoch: 20, train_loss: 0.7005, test_loss: 1.1915, test_f1: 0.5479
 epoch: 21, train_loss: 0.7408, test_loss: 0.9851, test_f1: 0.5681
 epoch: 22, train_loss: 0.6886, test_loss: 1.0726, test_f1: 0.5676
 epoch: 23, train_loss: 0.6872, test_loss: 1.1336, test_f1: 0.5154
 epoch: 24, train_loss: 0.6960, test_loss: 1.0261, test_f1: 0.5689
 epoch: 25, train_loss: 0.7028, test_loss: 1.0473, test_f1: 0.6148
 epoch: 26, train_loss: 0.7067, test_loss: 1.1583, test_f1: 0.5730
 epoch: 27, train_loss: 0.6793, test_loss: 1.1017, test_f1: 0.6103
 epoch: 28, train_loss: 0.7017, test_loss: 1.3027, test_f1: 0.5228
 epoch: 29, train_loss: 0.6954, test_loss: 1.0892, test_f1: 0.5644
 epoch: 30, train_loss: 0.6472, test_loss: 1.2484, test_f1: 0.5098
 epoch: 31, train_loss: 0.6317, test_loss: 1.8908, test_f1: 0.4712
 epoch: 32, train_loss: 0.6648, test_loss: 1.0758, test_f1: 0.5760
 epoch: 33, train_loss: 0.6564, test_loss: 0.9810, test_f1: 0.5838
 epoch: 34, train_loss: 0.6435, test_loss: 1.1650, test_f1: 0.5320
 epoch: 35, train_loss: 0.6651, test_loss: 1.0430, test_f1: 0.6005
 epoch: 36, train_loss: 0.6906, test_loss: 0.9526, test_f1: 0.6487
 epoch: 37, train_loss: 0.6303, test_loss: 1.1139, test_f1: 0.5869
 epoch: 38, train_loss: 0.6282, test_loss: 1.0768, test_f1: 0.5911
 epoch: 39, train_loss: 0.5923, test_loss: 1.3124, test_f1: 0.5487
 epoch: 40, train_loss: 0.6074, test_loss: 1.2405, test_f1: 0.5585
 epoch: 41, train_loss: 0.6143, test_loss: 1.1049, test_f1: 0.6143
 epoch: 42, train_loss: 0.5977, test_loss: 1.1762, test_f1: 0.6194
 epoch: 43, train_loss: 0.6015, test_loss: 1.0572, test_f1: 0.5919
 epoch: 44, train_loss: 0.6070, test_loss: 1.2113, test_f1: 0.5702
 epoch: 45, train_loss: 0.5855, test_loss: 1.4654, test_f1: 0.5532
 epoch: 46, train_loss: 0.5809, test_loss: 1.0293, test_f1: 0.6306
 epoch: 47, train_loss: 0.5773, test_loss: 1.1911, test_f1: 0.5960
 epoch: 48, train_loss: 0.5862, test_loss: 1.5442, test_f1: 0.4909
 epoch: 49, train_loss: 0.5648, test_loss: 1.2809, test_f1: 0.6204
 epoch: 50, train_loss: 0.5407, test_loss: 1.8897, test_f1: 0.5708
 epoch: 51, train_loss: 0.5079, test_loss: 1.3963, test_f1: 0.5404
 epoch: 52, train_loss: 0.4939, test_loss: 1.2542, test_f1: 0.5791
 epoch: 53, train_loss: 0.4908, test_loss: 1.2310, test_f1: 0.5886
 epoch: 54, train_loss: 0.4892, test_loss: 1.4342, test_f1: 0.5725
 epoch: 55, train_loss: 0.4633, test_loss: 1.4613, test_f1: 0.6390
 epoch: 56, train_loss: 0.4838, test_loss: 1.2847, test_f1: 0.6457
 epoch: 57, train_loss: 0.4949, test_loss: 1.2091, test_f1: 0.6156
 epoch: 58, train_loss: 0.4812, test_loss: 1.1954, test_f1: 0.6319
 epoch: 59, train_loss: 0.4635, test_loss: 1.1979, test_f1: 0.6248
 epoch: 60, train_loss: 0.4744, test_loss: 1.5532, test_f1: 0.6148
 epoch: 61, train_loss: 0.4379, test_loss: 1.3187, test_f1: 0.6175
 epoch: 62, train_loss: 0.4333, test_loss: 1.5613, test_f1: 0.5647
 epoch: 63, train_loss: 0.4614, test_loss: 1.2498, test_f1: 0.6451
 epoch: 64, train_loss: 0.4077, test_loss: 1.2938, test_f1: 0.6049
 epoch: 65, train_loss: 0.4051, test_loss: 1.4440, test_f1: 0.6169
 epoch: 66, train_loss: 0.4141, test_loss: 1.3334, test_f1: 0.6747
 epoch: 67, train_loss: 0.4162, test_loss: 1.4154, test_f1: 0.5961
 epoch: 68, train_loss: 0.4315, test_loss: 1.4127, test_f1: 0.6196
 epoch: 69, train_loss: 0.4015, test_loss: 1.4608, test_f1: 0.6092
 epoch: 70, train_loss: 0.3873, test_loss: 1.5006, test_f1: 0.6545
 epoch: 71, train_loss: 0.4054, test_loss: 1.6123, test_f1: 0.6362
 epoch: 72, train_loss: 0.3773, test_loss: 1.6712, test_f1: 0.6237
 epoch: 73, train_loss: 0.4014, test_loss: 1.4077, test_f1: 0.6517
 epoch: 74, train_loss: 0.4009, test_loss: 1.7016, test_f1: 0.6542
 epoch: 75, train_loss: 0.3800, test_loss: 1.5518, test_f1: 0.6335
 epoch: 76, train_loss: 0.3671, test_loss: 1.8242, test_f1: 0.6205
 epoch: 77, train_loss: 0.3946, test_loss: 1.7699, test_f1: 0.6516
 epoch: 78, train_loss: 0.3873, test_loss: 1.8482, test_f1: 0.5965
 epoch: 79, train_loss: 0.4019, test_loss: 1.4871, test_f1: 0.6495
 epoch: 80, train_loss: 0.3704, test_loss: 3.0682, test_f1: 0.4935
 epoch: 81, train_loss: 0.3663, test_loss: 2.0342, test_f1: 0.6203
 epoch: 82, train_loss: 0.3769, test_loss: 1.5055, test_f1: 0.6181
 epoch: 83, train_loss: 0.3593, test_loss: 1.6333, test_f1: 0.6513
 epoch: 84, train_loss: 0.3589, test_loss: 1.6142, test_f1: 0.6347
 epoch: 85, train_loss: 0.3369, test_loss: 1.9979, test_f1: 0.6213
 epoch: 86, train_loss: 0.3362, test_loss: 1.7048, test_f1: 0.6497
 epoch: 87, train_loss: 0.3174, test_loss: 1.9893, test_f1: 0.6383
 epoch: 88, train_loss: 0.3123, test_loss: 1.8388, test_f1: 0.6551
 epoch: 89, train_loss: 0.3704, test_loss: 3.1049, test_f1: 0.5405
 epoch: 90, train_loss: 0.3345, test_loss: 1.7046, test_f1: 0.6461
 epoch: 91, train_loss: 0.3360, test_loss: 1.7573, test_f1: 0.6502
 epoch: 92, train_loss: 0.3562, test_loss: 1.8043, test_f1: 0.6210
 epoch: 93, train_loss: 0.3429, test_loss: 2.0176, test_f1: 0.5915
 epoch: 94, train_loss: 0.3544, test_loss: 1.9203, test_f1: 0.6437
 epoch: 95, train_loss: 0.3247, test_loss: 1.9385, test_f1: 0.6112
 epoch: 96, train_loss: 0.3276, test_loss: 1.8655, test_f1: 0.6047
 epoch: 97, train_loss: 0.3518, test_loss: 1.7004, test_f1: 0.6457
 epoch: 98, train_loss: 0.3051, test_loss: 1.8841, test_f1: 0.6566
 epoch: 99, train_loss: 0.3096, test_loss: 2.0386, test_f1: 0.6200
##################ITERATION #3 ****************************************
 epoch: 0, train_loss: 1.2446, test_loss: 1.3016, test_f1: 0.2997
 epoch: 1, train_loss: 1.0160, test_loss: 1.2287, test_f1: 0.4128
 epoch: 2, train_loss: 0.9192, test_loss: 1.1322, test_f1: 0.5409
 epoch: 3, train_loss: 0.8926, test_loss: 0.9971, test_f1: 0.5871
 epoch: 4, train_loss: 0.9113, test_loss: 1.1433, test_f1: 0.5376
 epoch: 5, train_loss: 0.8482, test_loss: 1.1531, test_f1: 0.4844
 epoch: 6, train_loss: 0.8446, test_loss: 1.0074, test_f1: 0.5433
 epoch: 7, train_loss: 0.8166, test_loss: 0.9995, test_f1: 0.5717
 epoch: 8, train_loss: 0.8275, test_loss: 0.9434, test_f1: 0.5809
 epoch: 9, train_loss: 0.8075, test_loss: 0.8988, test_f1: 0.6207
 epoch: 10, train_loss: 0.8022, test_loss: 1.0502, test_f1: 0.5965
 epoch: 11, train_loss: 0.7459, test_loss: 0.9716, test_f1: 0.6129
 epoch: 12, train_loss: 0.7793, test_loss: 1.0213, test_f1: 0.5757
 epoch: 13, train_loss: 0.7988, test_loss: 3.3956, test_f1: 0.1286
 epoch: 14, train_loss: 0.8292, test_loss: 3.7380, test_f1: 0.1608
 epoch: 15, train_loss: 0.7524, test_loss: 0.9794, test_f1: 0.5827
 epoch: 16, train_loss: 0.7772, test_loss: 0.9612, test_f1: 0.5957
 epoch: 17, train_loss: 0.7743, test_loss: 1.3286, test_f1: 0.4388
 epoch: 18, train_loss: 0.7117, test_loss: 1.1522, test_f1: 0.4877
 epoch: 19, train_loss: 0.7161, test_loss: 1.0609, test_f1: 0.5605
 epoch: 20, train_loss: 0.7165, test_loss: 0.9601, test_f1: 0.6518
 epoch: 21, train_loss: 0.7083, test_loss: 1.0502, test_f1: 0.5521
 epoch: 22, train_loss: 0.6874, test_loss: 1.3188, test_f1: 0.6078
 epoch: 23, train_loss: 0.7222, test_loss: 1.3190, test_f1: 0.5471
 epoch: 24, train_loss: 0.7377, test_loss: 1.2764, test_f1: 0.4613
 epoch: 25, train_loss: 0.6951, test_loss: 0.9796, test_f1: 0.6179
 epoch: 26, train_loss: 0.6827, test_loss: 1.2041, test_f1: 0.5559
 epoch: 27, train_loss: 0.7237, test_loss: 1.0421, test_f1: 0.5480
 epoch: 28, train_loss: 0.7104, test_loss: 0.9994, test_f1: 0.5857
 epoch: 29, train_loss: 0.6762, test_loss: 1.2054, test_f1: 0.5900
 epoch: 30, train_loss: 0.6693, test_loss: 1.0792, test_f1: 0.6274
 epoch: 31, train_loss: 0.6485, test_loss: 1.2070, test_f1: 0.5893
 epoch: 32, train_loss: 0.6490, test_loss: 1.0446, test_f1: 0.6377
 epoch: 33, train_loss: 0.6649, test_loss: 1.0550, test_f1: 0.6144
 epoch: 34, train_loss: 0.6327, test_loss: 1.4180, test_f1: 0.5173
 epoch: 35, train_loss: 0.6333, test_loss: 1.0346, test_f1: 0.6338
 epoch: 36, train_loss: 0.6557, test_loss: 1.1175, test_f1: 0.6214
 epoch: 37, train_loss: 0.5978, test_loss: 1.3380, test_f1: 0.6016
 epoch: 38, train_loss: 0.6438, test_loss: 1.0812, test_f1: 0.5824
 epoch: 39, train_loss: 0.6450, test_loss: 1.2516, test_f1: 0.6000
 epoch: 40, train_loss: 0.6342, test_loss: 1.2762, test_f1: 0.5413
 epoch: 41, train_loss: 0.6148, test_loss: 1.1607, test_f1: 0.6138
 epoch: 42, train_loss: 0.6000, test_loss: 1.0508, test_f1: 0.6622
 epoch: 43, train_loss: 0.6235, test_loss: 1.3533, test_f1: 0.6100
 epoch: 44, train_loss: 0.5957, test_loss: 1.3818, test_f1: 0.5428
 epoch: 45, train_loss: 0.6302, test_loss: 1.2154, test_f1: 0.6077
 epoch: 46, train_loss: 0.5913, test_loss: 1.2825, test_f1: 0.6411
 epoch: 47, train_loss: 0.5851, test_loss: 1.4697, test_f1: 0.5915
 epoch: 48, train_loss: 0.6251, test_loss: 1.2603, test_f1: 0.5595
 epoch: 49, train_loss: 0.6132, test_loss: 1.1453, test_f1: 0.6123
 epoch: 50, train_loss: 0.5552, test_loss: 1.5914, test_f1: 0.5791
 epoch: 51, train_loss: 0.5406, test_loss: 1.5661, test_f1: 0.5998
 epoch: 52, train_loss: 0.5007, test_loss: 1.3723, test_f1: 0.6525
 epoch: 53, train_loss: 0.4955, test_loss: 1.4809, test_f1: 0.5922
 epoch: 54, train_loss: 0.5018, test_loss: 1.6304, test_f1: 0.6256
 epoch: 55, train_loss: 0.5111, test_loss: 1.5763, test_f1: 0.6009
 epoch: 56, train_loss: 0.4872, test_loss: 1.4621, test_f1: 0.6369
 epoch: 57, train_loss: 0.4997, test_loss: 1.6839, test_f1: 0.6733
 epoch: 58, train_loss: 0.4689, test_loss: 1.4299, test_f1: 0.6460
 epoch: 59, train_loss: 0.5730, test_loss: 1.5152, test_f1: 0.5113
 epoch: 60, train_loss: 0.5047, test_loss: 1.3402, test_f1: 0.6576
 epoch: 61, train_loss: 0.4897, test_loss: 1.8671, test_f1: 0.6172
 epoch: 62, train_loss: 0.4989, test_loss: 1.5991, test_f1: 0.5854
 epoch: 63, train_loss: 0.4660, test_loss: 1.5888, test_f1: 0.6351
 epoch: 64, train_loss: 0.4528, test_loss: 1.6399, test_f1: 0.6620
 epoch: 65, train_loss: 0.4549, test_loss: 1.5293, test_f1: 0.6521
 epoch: 66, train_loss: 0.4276, test_loss: 2.0515, test_f1: 0.5958
 epoch: 67, train_loss: 0.4209, test_loss: 1.6164, test_f1: 0.6652
 epoch: 68, train_loss: 0.4023, test_loss: 1.8106, test_f1: 0.6595
 epoch: 69, train_loss: 0.4104, test_loss: 1.9676, test_f1: 0.6411
 epoch: 70, train_loss: 0.4189, test_loss: 1.7442, test_f1: 0.6309
 epoch: 71, train_loss: 0.4491, test_loss: 2.1280, test_f1: 0.6168
 epoch: 72, train_loss: 0.4412, test_loss: 2.2242, test_f1: 0.6372
 epoch: 73, train_loss: 0.4032, test_loss: 2.0716, test_f1: 0.6389
 epoch: 74, train_loss: 0.4370, test_loss: 1.7501, test_f1: 0.6678
 epoch: 75, train_loss: 0.4187, test_loss: 2.1891, test_f1: 0.5980
 epoch: 76, train_loss: 0.4289, test_loss: 1.9160, test_f1: 0.5383
 epoch: 77, train_loss: 0.4558, test_loss: 1.9510, test_f1: 0.5964
 epoch: 78, train_loss: 0.4183, test_loss: 1.5893, test_f1: 0.6479
 epoch: 79, train_loss: 0.3830, test_loss: 1.7408, test_f1: 0.6532
 epoch: 80, train_loss: 0.3847, test_loss: 2.3167, test_f1: 0.6395
 epoch: 81, train_loss: 0.4363, test_loss: 1.8029, test_f1: 0.6469
 epoch: 82, train_loss: 0.4007, test_loss: 2.0633, test_f1: 0.6423
 epoch: 83, train_loss: 0.3694, test_loss: 2.2043, test_f1: 0.6848
 epoch: 84, train_loss: 0.3845, test_loss: 1.9384, test_f1: 0.6412
 epoch: 85, train_loss: 0.3522, test_loss: 2.6723, test_f1: 0.5637
 epoch: 86, train_loss: 0.3890, test_loss: 2.5246, test_f1: 0.6766
 epoch: 87, train_loss: 0.3824, test_loss: 1.8826, test_f1: 0.6398
 epoch: 88, train_loss: 0.3433, test_loss: 2.4970, test_f1: 0.6334
 epoch: 89, train_loss: 0.3629, test_loss: 2.0218, test_f1: 0.6195
 epoch: 90, train_loss: 0.3202, test_loss: 2.0404, test_f1: 0.6578
 epoch: 91, train_loss: 0.3751, test_loss: 1.9347, test_f1: 0.6283
 epoch: 92, train_loss: 0.3423, test_loss: 1.7619, test_f1: 0.6292
 epoch: 93, train_loss: 0.3250, test_loss: 2.3133, test_f1: 0.5655
 epoch: 94, train_loss: 0.3862, test_loss: 2.3404, test_f1: 0.5931
 epoch: 95, train_loss: 0.3524, test_loss: 2.0228, test_f1: 0.6399
 epoch: 96, train_loss: 0.2916, test_loss: 2.1201, test_f1: 0.6335
 epoch: 97, train_loss: 0.2870, test_loss: 2.6686, test_f1: 0.6156
 epoch: 98, train_loss: 0.2952, test_loss: 2.1562, test_f1: 0.6383
 epoch: 99, train_loss: 0.2889, test_loss: 2.2965, test_f1: 0.6199
##################ITERATION #4 ****************************************
 epoch: 0, train_loss: 1.2556, test_loss: 1.2368, test_f1: 0.4119
 epoch: 1, train_loss: 0.9925, test_loss: 1.1069, test_f1: 0.4511
 epoch: 2, train_loss: 0.9153, test_loss: 1.0915, test_f1: 0.5237
 epoch: 3, train_loss: 0.8780, test_loss: 1.0091, test_f1: 0.5551
 epoch: 4, train_loss: 0.8587, test_loss: 1.0512, test_f1: 0.5678
 epoch: 5, train_loss: 0.8401, test_loss: 1.0490, test_f1: 0.5502
 epoch: 6, train_loss: 0.8335, test_loss: 1.0494, test_f1: 0.5847
 epoch: 7, train_loss: 0.8198, test_loss: 1.0282, test_f1: 0.5376
 epoch: 8, train_loss: 0.8259, test_loss: 1.5808, test_f1: 0.4638
 epoch: 9, train_loss: 0.8176, test_loss: 1.1879, test_f1: 0.4693
 epoch: 10, train_loss: 0.8144, test_loss: 1.0006, test_f1: 0.4946
 epoch: 11, train_loss: 0.8012, test_loss: 1.0930, test_f1: 0.5380
 epoch: 12, train_loss: 0.7754, test_loss: 1.1345, test_f1: 0.5848
 epoch: 13, train_loss: 0.7698, test_loss: 1.1256, test_f1: 0.4616
 epoch: 14, train_loss: 0.8178, test_loss: 1.2818, test_f1: 0.5836
 epoch: 15, train_loss: 0.7820, test_loss: 1.0255, test_f1: 0.5942
 epoch: 16, train_loss: 0.7662, test_loss: 1.6739, test_f1: 0.5055
 epoch: 17, train_loss: 0.7450, test_loss: 1.6373, test_f1: 0.3860
 epoch: 18, train_loss: 0.7293, test_loss: 1.1628, test_f1: 0.5586
 epoch: 19, train_loss: 0.7885, test_loss: 1.1037, test_f1: 0.5711
 epoch: 20, train_loss: 0.7529, test_loss: 1.0444, test_f1: 0.5563
 epoch: 21, train_loss: 0.7482, test_loss: 1.0334, test_f1: 0.6151
 epoch: 22, train_loss: 0.7023, test_loss: 2.1675, test_f1: 0.4401
 epoch: 23, train_loss: 0.7038, test_loss: 1.3174, test_f1: 0.5894
 epoch: 24, train_loss: 0.7145, test_loss: 1.1903, test_f1: 0.6528
 epoch: 25, train_loss: 0.6904, test_loss: 1.2337, test_f1: 0.5685
 epoch: 26, train_loss: 0.7721, test_loss: 1.3376, test_f1: 0.5539
 epoch: 27, train_loss: 0.7210, test_loss: 1.0475, test_f1: 0.5113
 epoch: 28, train_loss: 0.6870, test_loss: 1.0742, test_f1: 0.5468
 epoch: 29, train_loss: 0.6872, test_loss: 1.1549, test_f1: 0.5781
 epoch: 30, train_loss: 0.6816, test_loss: 1.2067, test_f1: 0.5313
 epoch: 31, train_loss: 0.6701, test_loss: 1.3178, test_f1: 0.6058
 epoch: 32, train_loss: 0.6730, test_loss: 1.2398, test_f1: 0.6277
 epoch: 33, train_loss: 0.6722, test_loss: 1.1753, test_f1: 0.6046
 epoch: 34, train_loss: 0.6805, test_loss: 1.2958, test_f1: 0.6215
 epoch: 35, train_loss: 0.6627, test_loss: 1.4889, test_f1: 0.5846
 epoch: 36, train_loss: 0.6408, test_loss: 1.1903, test_f1: 0.6166
 epoch: 37, train_loss: 0.6271, test_loss: 1.4810, test_f1: 0.6036
 epoch: 38, train_loss: 0.6342, test_loss: 1.3585, test_f1: 0.5935
 epoch: 39, train_loss: 0.6359, test_loss: 1.6314, test_f1: 0.6186
 epoch: 40, train_loss: 0.6215, test_loss: 1.3239, test_f1: 0.6428
 epoch: 41, train_loss: 0.6388, test_loss: 1.6529, test_f1: 0.5599
 epoch: 42, train_loss: 0.6454, test_loss: 1.2729, test_f1: 0.5436
 epoch: 43, train_loss: 0.6149, test_loss: 1.4215, test_f1: 0.5480
 epoch: 44, train_loss: 0.5949, test_loss: 1.3581, test_f1: 0.6122
 epoch: 45, train_loss: 0.5969, test_loss: 1.1963, test_f1: 0.6346
 epoch: 46, train_loss: 0.6086, test_loss: 1.1314, test_f1: 0.6179
 epoch: 47, train_loss: 0.5763, test_loss: 1.1188, test_f1: 0.6200
 epoch: 48, train_loss: 0.5438, test_loss: 1.2783, test_f1: 0.5883
 epoch: 49, train_loss: 0.5634, test_loss: 1.3079, test_f1: 0.6000
 epoch: 50, train_loss: 0.5788, test_loss: 1.5358, test_f1: 0.5762
 epoch: 51, train_loss: 0.5533, test_loss: 1.4704, test_f1: 0.6267
 epoch: 52, train_loss: 0.5159, test_loss: 1.3409, test_f1: 0.5945
 epoch: 53, train_loss: 0.4870, test_loss: 1.5355, test_f1: 0.6484
 epoch: 54, train_loss: 0.5027, test_loss: 1.4214, test_f1: 0.5960
 epoch: 55, train_loss: 0.4674, test_loss: 1.4801, test_f1: 0.6213
 epoch: 56, train_loss: 0.4713, test_loss: 1.7513, test_f1: 0.6371
 epoch: 57, train_loss: 0.4912, test_loss: 1.7248, test_f1: 0.5639
 epoch: 58, train_loss: 0.4519, test_loss: 1.5580, test_f1: 0.6101
 epoch: 59, train_loss: 0.4464, test_loss: 1.7937, test_f1: 0.6076
 epoch: 60, train_loss: 0.4323, test_loss: 1.5993, test_f1: 0.5943
 epoch: 61, train_loss: 0.4326, test_loss: 1.9806, test_f1: 0.5680
 epoch: 62, train_loss: 0.4686, test_loss: 1.6815, test_f1: 0.6172
 epoch: 63, train_loss: 0.4259, test_loss: 1.5561, test_f1: 0.5605
 epoch: 64, train_loss: 0.4317, test_loss: 1.8218, test_f1: 0.6179
 epoch: 65, train_loss: 0.4010, test_loss: 1.6287, test_f1: 0.5976
 epoch: 66, train_loss: 0.3925, test_loss: 1.6259, test_f1: 0.5926
 epoch: 67, train_loss: 0.3995, test_loss: 1.8760, test_f1: 0.5960
 epoch: 68, train_loss: 0.4139, test_loss: 1.6740, test_f1: 0.6434
 epoch: 69, train_loss: 0.4107, test_loss: 1.7099, test_f1: 0.6061
 epoch: 70, train_loss: 0.4017, test_loss: 1.7526, test_f1: 0.6371
 epoch: 71, train_loss: 0.4281, test_loss: 1.6224, test_f1: 0.5797
 epoch: 72, train_loss: 0.3848, test_loss: 1.7828, test_f1: 0.5781
 epoch: 73, train_loss: 0.4028, test_loss: 2.3518, test_f1: 0.5915
 epoch: 74, train_loss: 0.4026, test_loss: 1.5212, test_f1: 0.6181
 epoch: 75, train_loss: 0.3848, test_loss: 2.0274, test_f1: 0.6038
 epoch: 76, train_loss: 0.3895, test_loss: 1.7781, test_f1: 0.5771
 epoch: 77, train_loss: 0.3979, test_loss: 1.8666, test_f1: 0.6061
 epoch: 78, train_loss: 0.3853, test_loss: 1.6756, test_f1: 0.5954
 epoch: 79, train_loss: 0.3230, test_loss: 2.0042, test_f1: 0.6252
 epoch: 80, train_loss: 0.3407, test_loss: 1.8181, test_f1: 0.6072
 epoch: 81, train_loss: 0.3519, test_loss: 2.0593, test_f1: 0.5939
 epoch: 82, train_loss: 0.3677, test_loss: 1.7959, test_f1: 0.6304
 epoch: 83, train_loss: 0.3494, test_loss: 2.2211, test_f1: 0.5845
 epoch: 84, train_loss: 0.3727, test_loss: 1.9449, test_f1: 0.6082
 epoch: 85, train_loss: 0.3454, test_loss: 1.9522, test_f1: 0.5896
 epoch: 86, train_loss: 0.3379, test_loss: 2.0130, test_f1: 0.5401
 epoch: 87, train_loss: 0.3561, test_loss: 2.2283, test_f1: 0.5896
 epoch: 88, train_loss: 0.3215, test_loss: 2.1539, test_f1: 0.5920
 epoch: 89, train_loss: 0.3137, test_loss: 2.3345, test_f1: 0.6275
 epoch: 90, train_loss: 0.3487, test_loss: 1.9799, test_f1: 0.6053
 epoch: 91, train_loss: 0.3406, test_loss: 2.2958, test_f1: 0.5985
 epoch: 92, train_loss: 0.3423, test_loss: 1.9242, test_f1: 0.6212
 epoch: 93, train_loss: 0.3204, test_loss: 1.9379, test_f1: 0.6445
 epoch: 94, train_loss: 0.3134, test_loss: 2.6626, test_f1: 0.5579
 epoch: 95, train_loss: 0.3568, test_loss: 2.0432, test_f1: 0.6192
 epoch: 96, train_loss: 0.3401, test_loss: 2.4414, test_f1: 0.5961
 epoch: 97, train_loss: 0.3005, test_loss: 1.9199, test_f1: 0.6179
 epoch: 98, train_loss: 0.2872, test_loss: 2.1129, test_f1: 0.5371
 epoch: 99, train_loss: 0.3244, test_loss: 2.5893, test_f1: 0.5699
##################ITERATION #5 ****************************************
 epoch: 0, train_loss: 1.3034, test_loss: 1.4353, test_f1: 0.2884
 epoch: 1, train_loss: 1.0027, test_loss: 1.0714, test_f1: 0.4768
 epoch: 2, train_loss: 0.9443, test_loss: 1.0423, test_f1: 0.5226
 epoch: 3, train_loss: 0.8832, test_loss: 1.0945, test_f1: 0.5311
 epoch: 4, train_loss: 0.8395, test_loss: 1.0617, test_f1: 0.5473
 epoch: 5, train_loss: 0.8327, test_loss: 3.0000, test_f1: 0.3398
 epoch: 6, train_loss: 0.8379, test_loss: 0.9506, test_f1: 0.5304
 epoch: 7, train_loss: 0.8444, test_loss: 1.0879, test_f1: 0.5271
 epoch: 8, train_loss: 0.8177, test_loss: 0.9172, test_f1: 0.6259
 epoch: 9, train_loss: 0.7860, test_loss: 1.1302, test_f1: 0.5910
 epoch: 10, train_loss: 0.7578, test_loss: 0.9704, test_f1: 0.6299
 epoch: 11, train_loss: 0.7769, test_loss: 0.9952, test_f1: 0.5668
 epoch: 12, train_loss: 0.7887, test_loss: 1.0590, test_f1: 0.5761
 epoch: 13, train_loss: 0.7853, test_loss: 1.1920, test_f1: 0.5668
 epoch: 14, train_loss: 0.7449, test_loss: 1.3775, test_f1: 0.5324
 epoch: 15, train_loss: 0.7483, test_loss: 0.9458, test_f1: 0.5822
 epoch: 16, train_loss: 0.7446, test_loss: 1.7036, test_f1: 0.4430
 epoch: 17, train_loss: 0.8597, test_loss: 1.1462, test_f1: 0.4209
 epoch: 18, train_loss: 0.7703, test_loss: 1.1599, test_f1: 0.5419
 epoch: 19, train_loss: 0.7701, test_loss: 1.1075, test_f1: 0.5396
 epoch: 20, train_loss: 0.7233, test_loss: 1.2723, test_f1: 0.5699
 epoch: 21, train_loss: 0.7187, test_loss: 0.9929, test_f1: 0.6498
 epoch: 22, train_loss: 0.7050, test_loss: 1.0521, test_f1: 0.5690
 epoch: 23, train_loss: 0.7259, test_loss: 1.1325, test_f1: 0.5575
 epoch: 24, train_loss: 0.7262, test_loss: 1.3295, test_f1: 0.5457
 epoch: 25, train_loss: 0.7155, test_loss: 1.0792, test_f1: 0.5196
 epoch: 26, train_loss: 0.6862, test_loss: 1.4842, test_f1: 0.5155
 epoch: 27, train_loss: 0.6957, test_loss: 1.4742, test_f1: 0.6034
 epoch: 28, train_loss: 0.6850, test_loss: 1.0299, test_f1: 0.5861
 epoch: 29, train_loss: 0.6870, test_loss: 1.3380, test_f1: 0.4764
 epoch: 30, train_loss: 0.6604, test_loss: 1.1728, test_f1: 0.5850
 epoch: 31, train_loss: 0.7290, test_loss: 0.9986, test_f1: 0.6368
 epoch: 32, train_loss: 0.7143, test_loss: 1.0256, test_f1: 0.6173
 epoch: 33, train_loss: 0.6825, test_loss: 1.2699, test_f1: 0.5716
 epoch: 34, train_loss: 0.6827, test_loss: 1.0112, test_f1: 0.6240
 epoch: 35, train_loss: 0.6644, test_loss: 1.0830, test_f1: 0.5837
 epoch: 36, train_loss: 0.6530, test_loss: 1.0873, test_f1: 0.5866
 epoch: 37, train_loss: 0.6351, test_loss: 1.2013, test_f1: 0.5795
 epoch: 38, train_loss: 0.6554, test_loss: 1.4061, test_f1: 0.5632
 epoch: 39, train_loss: 0.6555, test_loss: 1.1129, test_f1: 0.5468
 epoch: 40, train_loss: 0.6306, test_loss: 1.1182, test_f1: 0.6089
 epoch: 41, train_loss: 0.6583, test_loss: 1.2450, test_f1: 0.5773
 epoch: 42, train_loss: 0.6558, test_loss: 1.0585, test_f1: 0.6054
 epoch: 43, train_loss: 0.6296, test_loss: 1.1546, test_f1: 0.5868
 epoch: 44, train_loss: 0.6891, test_loss: 1.2207, test_f1: 0.5576
 epoch: 45, train_loss: 0.6476, test_loss: 1.2294, test_f1: 0.5057
 epoch: 46, train_loss: 0.6123, test_loss: 1.0300, test_f1: 0.5933
 epoch: 47, train_loss: 0.6313, test_loss: 1.0194, test_f1: 0.6117
 epoch: 48, train_loss: 0.6443, test_loss: 1.1754, test_f1: 0.6363
 epoch: 49, train_loss: 0.6066, test_loss: 1.1059, test_f1: 0.5617
 epoch: 50, train_loss: 0.6107, test_loss: 1.0455, test_f1: 0.6013
 epoch: 51, train_loss: 0.5968, test_loss: 1.1166, test_f1: 0.5592
 epoch: 52, train_loss: 0.5549, test_loss: 1.1345, test_f1: 0.6051
 epoch: 53, train_loss: 0.5420, test_loss: 1.2539, test_f1: 0.5754
 epoch: 54, train_loss: 0.5340, test_loss: 1.2662, test_f1: 0.5765
 epoch: 55, train_loss: 0.5434, test_loss: 1.2826, test_f1: 0.5883
 epoch: 56, train_loss: 0.5349, test_loss: 1.1912, test_f1: 0.6144
 epoch: 57, train_loss: 0.5265, test_loss: 1.3867, test_f1: 0.5899
 epoch: 58, train_loss: 0.5560, test_loss: 1.2056, test_f1: 0.5968
 epoch: 59, train_loss: 0.5398, test_loss: 1.3005, test_f1: 0.5836
 epoch: 60, train_loss: 0.4984, test_loss: 1.3211, test_f1: 0.5724
 epoch: 61, train_loss: 0.4962, test_loss: 1.2781, test_f1: 0.6065
 epoch: 62, train_loss: 0.5024, test_loss: 1.2805, test_f1: 0.6414
 epoch: 63, train_loss: 0.4967, test_loss: 1.3298, test_f1: 0.6162
 epoch: 64, train_loss: 0.4983, test_loss: 1.6384, test_f1: 0.5651
 epoch: 65, train_loss: 0.4788, test_loss: 1.2740, test_f1: 0.5779
 epoch: 66, train_loss: 0.4788, test_loss: 1.6392, test_f1: 0.6239
 epoch: 67, train_loss: 0.4779, test_loss: 1.5270, test_f1: 0.6090
 epoch: 68, train_loss: 0.4951, test_loss: 1.4622, test_f1: 0.6062
 epoch: 69, train_loss: 0.5074, test_loss: 1.6213, test_f1: 0.5137
 epoch: 70, train_loss: 0.4948, test_loss: 1.3364, test_f1: 0.5973
 epoch: 71, train_loss: 0.4756, test_loss: 1.7170, test_f1: 0.5798
 epoch: 72, train_loss: 0.4684, test_loss: 1.2663, test_f1: 0.5925
 epoch: 73, train_loss: 0.4846, test_loss: 1.2589, test_f1: 0.6036
 epoch: 74, train_loss: 0.4657, test_loss: 1.4817, test_f1: 0.5906
 epoch: 75, train_loss: 0.4374, test_loss: 1.4341, test_f1: 0.5750
 epoch: 76, train_loss: 0.4624, test_loss: 1.4509, test_f1: 0.5949
 epoch: 77, train_loss: 0.4544, test_loss: 1.7190, test_f1: 0.6203
 epoch: 78, train_loss: 0.4400, test_loss: 1.4900, test_f1: 0.5900
 epoch: 79, train_loss: 0.4136, test_loss: 1.4999, test_f1: 0.5963
 epoch: 80, train_loss: 0.4384, test_loss: 1.6801, test_f1: 0.6194
 epoch: 81, train_loss: 0.4680, test_loss: 1.4469, test_f1: 0.5948
 epoch: 82, train_loss: 0.4338, test_loss: 1.4814, test_f1: 0.5845
 epoch: 83, train_loss: 0.4259, test_loss: 1.4971, test_f1: 0.5545
 epoch: 84, train_loss: 0.4277, test_loss: 1.8959, test_f1: 0.6191
 epoch: 85, train_loss: 0.4431, test_loss: 1.7174, test_f1: 0.6103
 epoch: 86, train_loss: 0.4278, test_loss: 1.2411, test_f1: 0.5928
 epoch: 87, train_loss: 0.4371, test_loss: 1.7837, test_f1: 0.5702
 epoch: 88, train_loss: 0.4390, test_loss: 1.5135, test_f1: 0.5794
 epoch: 89, train_loss: 0.4911, test_loss: 1.3664, test_f1: 0.5631
 epoch: 90, train_loss: 0.4316, test_loss: 1.3526, test_f1: 0.6054
 epoch: 91, train_loss: 0.3977, test_loss: 1.5338, test_f1: 0.5851
 epoch: 92, train_loss: 0.3730, test_loss: 1.6028, test_f1: 0.5872
 epoch: 93, train_loss: 0.4100, test_loss: 1.5759, test_f1: 0.6321
 epoch: 94, train_loss: 0.3786, test_loss: 1.7862, test_f1: 0.6090
 epoch: 95, train_loss: 0.4039, test_loss: 1.7253, test_f1: 0.5893
 epoch: 96, train_loss: 0.3752, test_loss: 1.7207, test_f1: 0.6243
 epoch: 97, train_loss: 0.3579, test_loss: 1.6361, test_f1: 0.6413
 epoch: 98, train_loss: 0.3949, test_loss: 1.5819, test_f1: 0.6130
 epoch: 99, train_loss: 0.3657, test_loss: 1.6628, test_f1: 0.6473
##################ITERATION #6 ****************************************
 epoch: 0, train_loss: 1.2099, test_loss: 1.2408, test_f1: 0.3363
 epoch: 1, train_loss: 0.9722, test_loss: 1.1383, test_f1: 0.5023
 epoch: 2, train_loss: 0.9229, test_loss: 1.0980, test_f1: 0.4891
 epoch: 3, train_loss: 0.8840, test_loss: 1.0540, test_f1: 0.5316
 epoch: 4, train_loss: 0.8702, test_loss: 0.9657, test_f1: 0.5641
 epoch: 5, train_loss: 0.8539, test_loss: 1.0260, test_f1: 0.5316
 epoch: 6, train_loss: 0.8353, test_loss: 1.0060, test_f1: 0.5382
 epoch: 7, train_loss: 0.8258, test_loss: 1.0919, test_f1: 0.4875
 epoch: 8, train_loss: 0.8281, test_loss: 1.2802, test_f1: 0.4830
 epoch: 9, train_loss: 0.8360, test_loss: 1.6616, test_f1: 0.4512
 epoch: 10, train_loss: 0.8296, test_loss: 1.0070, test_f1: 0.5290
 epoch: 11, train_loss: 0.8005, test_loss: 1.0402, test_f1: 0.5993
 epoch: 12, train_loss: 0.7963, test_loss: 1.0731, test_f1: 0.5717
 epoch: 13, train_loss: 0.7638, test_loss: 1.1399, test_f1: 0.5613
 epoch: 14, train_loss: 0.7461, test_loss: 1.1862, test_f1: 0.5221
 epoch: 15, train_loss: 0.7903, test_loss: 1.5756, test_f1: 0.4427
 epoch: 16, train_loss: 0.7912, test_loss: 0.9652, test_f1: 0.5265
 epoch: 17, train_loss: 0.7938, test_loss: 1.6296, test_f1: 0.5141
 epoch: 18, train_loss: 0.7801, test_loss: 1.0338, test_f1: 0.5797
 epoch: 19, train_loss: 0.7266, test_loss: 1.0193, test_f1: 0.6383
 epoch: 20, train_loss: 0.7113, test_loss: 1.1315, test_f1: 0.5133
 epoch: 21, train_loss: 0.7282, test_loss: 0.9966, test_f1: 0.5871
 epoch: 22, train_loss: 0.7121, test_loss: 0.9669, test_f1: 0.6463
 epoch: 23, train_loss: 0.6902, test_loss: 1.0553, test_f1: 0.6205
 epoch: 24, train_loss: 0.6901, test_loss: 1.0109, test_f1: 0.6281
 epoch: 25, train_loss: 0.6786, test_loss: 1.4904, test_f1: 0.5750
 epoch: 26, train_loss: 0.7260, test_loss: 1.0676, test_f1: 0.5118
 epoch: 27, train_loss: 0.7046, test_loss: 1.0112, test_f1: 0.5799
 epoch: 28, train_loss: 0.6906, test_loss: 1.0422, test_f1: 0.6278
 epoch: 29, train_loss: 0.6449, test_loss: 1.3606, test_f1: 0.6158
 epoch: 30, train_loss: 0.6467, test_loss: 1.1514, test_f1: 0.5309
 epoch: 31, train_loss: 0.6824, test_loss: 1.2849, test_f1: 0.5474
 epoch: 32, train_loss: 0.6720, test_loss: 2.2976, test_f1: 0.5443
 epoch: 33, train_loss: 0.6865, test_loss: 1.0287, test_f1: 0.5938
 epoch: 34, train_loss: 0.6616, test_loss: 1.0807, test_f1: 0.5698
 epoch: 35, train_loss: 0.6431, test_loss: 1.1193, test_f1: 0.5719
 epoch: 36, train_loss: 0.6521, test_loss: 1.1053, test_f1: 0.6026
 epoch: 37, train_loss: 0.6443, test_loss: 0.9417, test_f1: 0.6004
 epoch: 38, train_loss: 0.6217, test_loss: 1.4412, test_f1: 0.6244
 epoch: 39, train_loss: 0.6336, test_loss: 1.7496, test_f1: 0.4918
 epoch: 40, train_loss: 0.6196, test_loss: 1.2276, test_f1: 0.6318
 epoch: 41, train_loss: 0.6039, test_loss: 1.0844, test_f1: 0.6296
 epoch: 42, train_loss: 0.6085, test_loss: 1.4376, test_f1: 0.6114
 epoch: 43, train_loss: 0.6214, test_loss: 1.2185, test_f1: 0.6330
 epoch: 44, train_loss: 0.6326, test_loss: 1.2484, test_f1: 0.6440
 epoch: 45, train_loss: 0.5826, test_loss: 1.1601, test_f1: 0.5975
 epoch: 46, train_loss: 0.6327, test_loss: 1.6541, test_f1: 0.5796
 epoch: 47, train_loss: 0.6197, test_loss: 1.2899, test_f1: 0.5610
 epoch: 48, train_loss: 0.6026, test_loss: 1.1118, test_f1: 0.5953
 epoch: 49, train_loss: 0.5968, test_loss: 1.9241, test_f1: 0.5759
 epoch: 50, train_loss: 0.5707, test_loss: 1.0085, test_f1: 0.6023
 epoch: 51, train_loss: 0.5202, test_loss: 1.2888, test_f1: 0.6074
 epoch: 52, train_loss: 0.5331, test_loss: 1.1144, test_f1: 0.5982
 epoch: 53, train_loss: 0.5223, test_loss: 1.0808, test_f1: 0.6366
 epoch: 54, train_loss: 0.5265, test_loss: 1.2906, test_f1: 0.5681
 epoch: 55, train_loss: 0.5021, test_loss: 1.1277, test_f1: 0.6151
 epoch: 56, train_loss: 0.4705, test_loss: 1.2851, test_f1: 0.6172
 epoch: 57, train_loss: 0.5156, test_loss: 1.2407, test_f1: 0.6269
 epoch: 58, train_loss: 0.5279, test_loss: 1.2760, test_f1: 0.6008
 epoch: 59, train_loss: 0.4961, test_loss: 1.1677, test_f1: 0.6123
 epoch: 60, train_loss: 0.4906, test_loss: 1.3234, test_f1: 0.6272
 epoch: 61, train_loss: 0.4737, test_loss: 1.3843, test_f1: 0.6135
 epoch: 62, train_loss: 0.4756, test_loss: 2.0761, test_f1: 0.6503
 epoch: 63, train_loss: 0.4597, test_loss: 1.6816, test_f1: 0.5905
 epoch: 64, train_loss: 0.4760, test_loss: 1.3228, test_f1: 0.6021
 epoch: 65, train_loss: 0.4556, test_loss: 1.7857, test_f1: 0.6503
 epoch: 66, train_loss: 0.4649, test_loss: 1.5662, test_f1: 0.6274
 epoch: 67, train_loss: 0.4444, test_loss: 1.3530, test_f1: 0.5761
 epoch: 68, train_loss: 0.4739, test_loss: 1.8147, test_f1: 0.6070
 epoch: 69, train_loss: 0.4515, test_loss: 1.4165, test_f1: 0.5982
 epoch: 70, train_loss: 0.4426, test_loss: 1.5094, test_f1: 0.6296
 epoch: 71, train_loss: 0.4568, test_loss: 1.1888, test_f1: 0.6513
 epoch: 72, train_loss: 0.4724, test_loss: 1.4563, test_f1: 0.6351
 epoch: 73, train_loss: 0.4443, test_loss: 1.5004, test_f1: 0.5916
 epoch: 74, train_loss: 0.4209, test_loss: 1.5477, test_f1: 0.5837
 epoch: 75, train_loss: 0.4213, test_loss: 1.5470, test_f1: 0.6445
 epoch: 76, train_loss: 0.4137, test_loss: 1.5765, test_f1: 0.6089
 epoch: 77, train_loss: 0.4143, test_loss: 1.4248, test_f1: 0.6098
 epoch: 78, train_loss: 0.4199, test_loss: 1.3374, test_f1: 0.6356
 epoch: 79, train_loss: 0.4267, test_loss: 1.4941, test_f1: 0.6213
 epoch: 80, train_loss: 0.4714, test_loss: 1.5059, test_f1: 0.6136
 epoch: 81, train_loss: 0.4172, test_loss: 1.4491, test_f1: 0.6209
 epoch: 82, train_loss: 0.3887, test_loss: 1.4908, test_f1: 0.6258
 epoch: 83, train_loss: 0.4142, test_loss: 1.6349, test_f1: 0.6213
 epoch: 84, train_loss: 0.4336, test_loss: 1.5375, test_f1: 0.6253
 epoch: 85, train_loss: 0.4403, test_loss: 1.2512, test_f1: 0.6296
 epoch: 86, train_loss: 0.3991, test_loss: 1.4818, test_f1: 0.6282
 epoch: 87, train_loss: 0.3899, test_loss: 1.2839, test_f1: 0.6284
 epoch: 88, train_loss: 0.4174, test_loss: 1.4269, test_f1: 0.6161
 epoch: 89, train_loss: 0.4240, test_loss: 1.6084, test_f1: 0.5533
 epoch: 90, train_loss: 0.3955, test_loss: 1.5578, test_f1: 0.6319
 epoch: 91, train_loss: 0.3918, test_loss: 1.4872, test_f1: 0.6266
 epoch: 92, train_loss: 0.3846, test_loss: 1.4230, test_f1: 0.6417
 epoch: 93, train_loss: 0.3856, test_loss: 1.4587, test_f1: 0.6012
 epoch: 94, train_loss: 0.3825, test_loss: 1.3466, test_f1: 0.6436
 epoch: 95, train_loss: 0.3603, test_loss: 1.6419, test_f1: 0.6445
 epoch: 96, train_loss: 0.3692, test_loss: 1.8231, test_f1: 0.5846
 epoch: 97, train_loss: 0.3785, test_loss: 1.4521, test_f1: 0.6234
 epoch: 98, train_loss: 0.3588, test_loss: 1.5529, test_f1: 0.6040
 epoch: 99, train_loss: 0.3637, test_loss: 1.4306, test_f1: 0.6188
##################ITERATION #7 ****************************************
 epoch: 0, train_loss: 1.2565, test_loss: 1.4083, test_f1: 0.2040
 epoch: 1, train_loss: 0.9777, test_loss: 1.8934, test_f1: 0.1848
 epoch: 2, train_loss: 0.8920, test_loss: 2.4151, test_f1: 0.1069
 epoch: 3, train_loss: 0.8938, test_loss: 1.1659, test_f1: 0.4993
 epoch: 4, train_loss: 0.8731, test_loss: 1.7549, test_f1: 0.3266
 epoch: 5, train_loss: 0.8561, test_loss: 1.0871, test_f1: 0.5657
 epoch: 6, train_loss: 0.8453, test_loss: 1.8996, test_f1: 0.3185
 epoch: 7, train_loss: 0.8146, test_loss: 1.1952, test_f1: 0.4979
 epoch: 8, train_loss: 0.7929, test_loss: 1.0113, test_f1: 0.5673
 epoch: 9, train_loss: 0.7724, test_loss: 1.1092, test_f1: 0.5485
 epoch: 10, train_loss: 0.7620, test_loss: 1.4515, test_f1: 0.5610
 epoch: 11, train_loss: 0.7973, test_loss: 1.2550, test_f1: 0.5618
 epoch: 12, train_loss: 0.7748, test_loss: 1.3300, test_f1: 0.4863
 epoch: 13, train_loss: 0.7833, test_loss: 1.6356, test_f1: 0.6035
 epoch: 14, train_loss: 0.7394, test_loss: 1.0792, test_f1: 0.5739
 epoch: 15, train_loss: 0.7152, test_loss: 1.3137, test_f1: 0.4904
 epoch: 16, train_loss: 0.7389, test_loss: 1.1990, test_f1: 0.5108
 epoch: 17, train_loss: 0.7537, test_loss: 1.6262, test_f1: 0.4718
 epoch: 18, train_loss: 0.7273, test_loss: 1.3330, test_f1: 0.5420
 epoch: 19, train_loss: 0.7365, test_loss: 1.2310, test_f1: 0.5954
 epoch: 20, train_loss: 0.7166, test_loss: 1.1154, test_f1: 0.5994
 epoch: 21, train_loss: 0.7211, test_loss: 2.0244, test_f1: 0.4420
 epoch: 22, train_loss: 0.7067, test_loss: 1.1680, test_f1: 0.5164
 epoch: 23, train_loss: 0.7192, test_loss: 1.5252, test_f1: 0.4573
 epoch: 24, train_loss: 0.7439, test_loss: 1.0715, test_f1: 0.5832
 epoch: 25, train_loss: 0.6792, test_loss: 1.1094, test_f1: 0.6001
 epoch: 26, train_loss: 0.6844, test_loss: 1.2893, test_f1: 0.5826
 epoch: 27, train_loss: 0.6855, test_loss: 1.5036, test_f1: 0.5398
 epoch: 28, train_loss: 0.7280, test_loss: 1.8042, test_f1: 0.4736
 epoch: 29, train_loss: 0.6929, test_loss: 1.0526, test_f1: 0.6089
 epoch: 30, train_loss: 0.6643, test_loss: 1.1207, test_f1: 0.5898
 epoch: 31, train_loss: 0.6516, test_loss: 1.2832, test_f1: 0.5349
 epoch: 32, train_loss: 0.6564, test_loss: 1.3448, test_f1: 0.4658
 epoch: 33, train_loss: 0.6498, test_loss: 2.3574, test_f1: 0.3908
 epoch: 34, train_loss: 0.6519, test_loss: 1.2717, test_f1: 0.5912
 epoch: 35, train_loss: 0.6485, test_loss: 1.2020, test_f1: 0.6022
 epoch: 36, train_loss: 0.6294, test_loss: 1.2263, test_f1: 0.5667
 epoch: 37, train_loss: 0.6408, test_loss: 1.2372, test_f1: 0.5340
 epoch: 38, train_loss: 0.6478, test_loss: 1.3048, test_f1: 0.5471
 epoch: 39, train_loss: 0.6565, test_loss: 1.1768, test_f1: 0.5646
 epoch: 40, train_loss: 0.6287, test_loss: 1.8418, test_f1: 0.4390
 epoch: 41, train_loss: 0.6471, test_loss: 1.2955, test_f1: 0.5869
 epoch: 42, train_loss: 0.6099, test_loss: 1.3099, test_f1: 0.6486
 epoch: 43, train_loss: 0.6022, test_loss: 1.8198, test_f1: 0.4856
 epoch: 44, train_loss: 0.6363, test_loss: 1.3942, test_f1: 0.5965
 epoch: 45, train_loss: 0.5976, test_loss: 1.2422, test_f1: 0.5845
 epoch: 46, train_loss: 0.5714, test_loss: 1.5019, test_f1: 0.5381
 epoch: 47, train_loss: 0.5872, test_loss: 1.5989, test_f1: 0.6004
 epoch: 48, train_loss: 0.6176, test_loss: 1.2555, test_f1: 0.6504
 epoch: 49, train_loss: 0.5613, test_loss: 1.4850, test_f1: 0.6337
 epoch: 50, train_loss: 0.5945, test_loss: 1.5093, test_f1: 0.5459
 epoch: 51, train_loss: 0.5782, test_loss: 1.3078, test_f1: 0.6234
 epoch: 52, train_loss: 0.5490, test_loss: 1.3271, test_f1: 0.6355
 epoch: 53, train_loss: 0.5182, test_loss: 1.5281, test_f1: 0.6041
 epoch: 54, train_loss: 0.5214, test_loss: 1.3909, test_f1: 0.5569
 epoch: 55, train_loss: 0.4982, test_loss: 1.3103, test_f1: 0.6611
 epoch: 56, train_loss: 0.4808, test_loss: 1.8588, test_f1: 0.5553
 epoch: 57, train_loss: 0.4630, test_loss: 1.5348, test_f1: 0.6414
 epoch: 58, train_loss: 0.4945, test_loss: 1.5317, test_f1: 0.6460
 epoch: 59, train_loss: 0.4648, test_loss: 1.6672, test_f1: 0.6415
 epoch: 60, train_loss: 0.4509, test_loss: 1.3317, test_f1: 0.6374
 epoch: 61, train_loss: 0.4842, test_loss: 1.6437, test_f1: 0.6110
 epoch: 62, train_loss: 0.4536, test_loss: 1.5418, test_f1: 0.6629
 epoch: 63, train_loss: 0.4409, test_loss: 1.4784, test_f1: 0.6416
 epoch: 64, train_loss: 0.4435, test_loss: 1.8408, test_f1: 0.5584
 epoch: 65, train_loss: 0.4408, test_loss: 1.4304, test_f1: 0.6719
 epoch: 66, train_loss: 0.4318, test_loss: 1.8484, test_f1: 0.6030
 epoch: 67, train_loss: 0.4286, test_loss: 2.0113, test_f1: 0.5978
 epoch: 68, train_loss: 0.4572, test_loss: 1.6656, test_f1: 0.5850
 epoch: 69, train_loss: 0.4808, test_loss: 1.3598, test_f1: 0.6199
 epoch: 70, train_loss: 0.4206, test_loss: 1.3548, test_f1: 0.6380
 epoch: 71, train_loss: 0.4243, test_loss: 1.3887, test_f1: 0.6157
 epoch: 72, train_loss: 0.4404, test_loss: 1.4359, test_f1: 0.6568
 epoch: 73, train_loss: 0.4032, test_loss: 1.5684, test_f1: 0.6241
 epoch: 74, train_loss: 0.3903, test_loss: 1.9976, test_f1: 0.5951
 epoch: 75, train_loss: 0.3736, test_loss: 1.5855, test_f1: 0.6297
 epoch: 76, train_loss: 0.3944, test_loss: 2.0802, test_f1: 0.5865
 epoch: 77, train_loss: 0.4181, test_loss: 1.5367, test_f1: 0.6266
 epoch: 78, train_loss: 0.4210, test_loss: 2.1822, test_f1: 0.5433
 epoch: 79, train_loss: 0.3975, test_loss: 1.7065, test_f1: 0.6428
 epoch: 80, train_loss: 0.4024, test_loss: 1.7903, test_f1: 0.6188
 epoch: 81, train_loss: 0.3977, test_loss: 1.5796, test_f1: 0.6121
 epoch: 82, train_loss: 0.3947, test_loss: 1.6626, test_f1: 0.5865
 epoch: 83, train_loss: 0.4029, test_loss: 2.1636, test_f1: 0.5738
 epoch: 84, train_loss: 0.3927, test_loss: 1.8135, test_f1: 0.6233
 epoch: 85, train_loss: 0.3523, test_loss: 2.2668, test_f1: 0.5840
 epoch: 86, train_loss: 0.3880, test_loss: 1.6928, test_f1: 0.6497
 epoch: 87, train_loss: 0.3794, test_loss: 1.7567, test_f1: 0.6099
 epoch: 88, train_loss: 0.3798, test_loss: 1.9211, test_f1: 0.5965
 epoch: 89, train_loss: 0.3722, test_loss: 1.7671, test_f1: 0.6199
 epoch: 90, train_loss: 0.3711, test_loss: 2.0974, test_f1: 0.6074
 epoch: 91, train_loss: 0.3182, test_loss: 1.8554, test_f1: 0.6318
 epoch: 92, train_loss: 0.3487, test_loss: 2.0419, test_f1: 0.6256
 epoch: 93, train_loss: 0.3431, test_loss: 1.7852, test_f1: 0.6363
 epoch: 94, train_loss: 0.3691, test_loss: 1.6319, test_f1: 0.6539
 epoch: 95, train_loss: 0.3880, test_loss: 2.0748, test_f1: 0.6204
 epoch: 96, train_loss: 0.3584, test_loss: 2.0199, test_f1: 0.6291
 epoch: 97, train_loss: 0.3444, test_loss: 2.2224, test_f1: 0.6229
 epoch: 98, train_loss: 0.3276, test_loss: 2.2421, test_f1: 0.6107
 epoch: 99, train_loss: 0.3302, test_loss: 2.2891, test_f1: 0.6008
##################ITERATION #8 ****************************************
 epoch: 0, train_loss: 1.2684, test_loss: 1.3930, test_f1: 0.1998
 epoch: 1, train_loss: 0.9779, test_loss: 1.2283, test_f1: 0.4285
 epoch: 2, train_loss: 0.9364, test_loss: 1.1161, test_f1: 0.4974
 epoch: 3, train_loss: 0.9366, test_loss: 1.0587, test_f1: 0.5235
 epoch: 4, train_loss: 0.8878, test_loss: 1.3213, test_f1: 0.3833
 epoch: 5, train_loss: 0.8768, test_loss: 1.0240, test_f1: 0.5571
 epoch: 6, train_loss: 0.8453, test_loss: 1.0128, test_f1: 0.5722
 epoch: 7, train_loss: 0.8566, test_loss: 0.9947, test_f1: 0.5708
 epoch: 8, train_loss: 0.8185, test_loss: 1.8611, test_f1: 0.4062
 epoch: 9, train_loss: 0.8325, test_loss: 1.1161, test_f1: 0.5465
 epoch: 10, train_loss: 0.7941, test_loss: 1.1084, test_f1: 0.5865
 epoch: 11, train_loss: 0.8270, test_loss: 1.0767, test_f1: 0.4720
 epoch: 12, train_loss: 0.7698, test_loss: 1.0610, test_f1: 0.5932
 epoch: 13, train_loss: 0.7920, test_loss: 2.1024, test_f1: 0.3887
 epoch: 14, train_loss: 0.7823, test_loss: 1.0806, test_f1: 0.5314
 epoch: 15, train_loss: 0.7989, test_loss: 1.2536, test_f1: 0.5246
 epoch: 16, train_loss: 0.8064, test_loss: 1.6892, test_f1: 0.3955
 epoch: 17, train_loss: 0.7675, test_loss: 1.3396, test_f1: 0.5485
 epoch: 18, train_loss: 0.7897, test_loss: 1.1107, test_f1: 0.5837
 epoch: 19, train_loss: 0.8155, test_loss: 1.0002, test_f1: 0.5593
 epoch: 20, train_loss: 0.7505, test_loss: 1.0350, test_f1: 0.6070
 epoch: 21, train_loss: 0.7419, test_loss: 1.0433, test_f1: 0.5801
 epoch: 22, train_loss: 0.7623, test_loss: 1.0269, test_f1: 0.5424
 epoch: 23, train_loss: 0.7317, test_loss: 1.0447, test_f1: 0.5938
 epoch: 24, train_loss: 0.7180, test_loss: 1.1040, test_f1: 0.5711
 epoch: 25, train_loss: 0.7085, test_loss: 1.0411, test_f1: 0.5878
 epoch: 26, train_loss: 0.7078, test_loss: 1.3763, test_f1: 0.4777
 epoch: 27, train_loss: 0.7372, test_loss: 1.2144, test_f1: 0.5731
 epoch: 28, train_loss: 0.7251, test_loss: 11.9940, test_f1: 0.1593
 epoch: 29, train_loss: 0.7252, test_loss: 1.2388, test_f1: 0.4867
 epoch: 30, train_loss: 0.7132, test_loss: 1.0002, test_f1: 0.5980
 epoch: 31, train_loss: 0.7176, test_loss: 1.0401, test_f1: 0.5549
 epoch: 32, train_loss: 0.7112, test_loss: 0.9981, test_f1: 0.6201
 epoch: 33, train_loss: 0.6874, test_loss: 1.2536, test_f1: 0.5875
 epoch: 34, train_loss: 0.6636, test_loss: 1.2685, test_f1: 0.6227
 epoch: 35, train_loss: 0.6766, test_loss: 1.0117, test_f1: 0.5822
 epoch: 36, train_loss: 0.6640, test_loss: 1.0776, test_f1: 0.6004
 epoch: 37, train_loss: 0.6832, test_loss: 1.2341, test_f1: 0.5975
 epoch: 38, train_loss: 0.6819, test_loss: 1.1500, test_f1: 0.6052
 epoch: 39, train_loss: 0.6641, test_loss: 1.1315, test_f1: 0.5757
 epoch: 40, train_loss: 0.6500, test_loss: 1.0798, test_f1: 0.5807
 epoch: 41, train_loss: 0.6723, test_loss: 1.1116, test_f1: 0.5685
 epoch: 42, train_loss: 0.6158, test_loss: 1.2924, test_f1: 0.6623
 epoch: 43, train_loss: 0.6522, test_loss: 1.2697, test_f1: 0.6191
 epoch: 44, train_loss: 0.5969, test_loss: 1.1023, test_f1: 0.5705
 epoch: 45, train_loss: 0.5946, test_loss: 1.1906, test_f1: 0.5810
 epoch: 46, train_loss: 0.5962, test_loss: 1.1958, test_f1: 0.6047
 epoch: 47, train_loss: 0.6221, test_loss: 1.0636, test_f1: 0.5302
 epoch: 48, train_loss: 0.6461, test_loss: 1.2246, test_f1: 0.6544
 epoch: 49, train_loss: 0.6002, test_loss: 1.2138, test_f1: 0.5565
 epoch: 50, train_loss: 0.6155, test_loss: 1.0505, test_f1: 0.5762
 epoch: 51, train_loss: 0.5869, test_loss: 1.1479, test_f1: 0.5929
 epoch: 52, train_loss: 0.5342, test_loss: 1.1329, test_f1: 0.6570
 epoch: 53, train_loss: 0.5240, test_loss: 1.2756, test_f1: 0.6132
 epoch: 54, train_loss: 0.5185, test_loss: 1.4659, test_f1: 0.6440
 epoch: 55, train_loss: 0.5300, test_loss: 1.3605, test_f1: 0.5436
 epoch: 56, train_loss: 0.5187, test_loss: 1.1616, test_f1: 0.6429
 epoch: 57, train_loss: 0.5245, test_loss: 1.2728, test_f1: 0.6575
 epoch: 58, train_loss: 0.4943, test_loss: 1.4099, test_f1: 0.6157
 epoch: 59, train_loss: 0.5025, test_loss: 1.7302, test_f1: 0.5242
 epoch: 60, train_loss: 0.4952, test_loss: 1.3692, test_f1: 0.6073
 epoch: 61, train_loss: 0.4784, test_loss: 1.1920, test_f1: 0.5830
 epoch: 62, train_loss: 0.5336, test_loss: 1.4796, test_f1: 0.5539
 epoch: 63, train_loss: 0.4930, test_loss: 1.1075, test_f1: 0.6457
 epoch: 64, train_loss: 0.4468, test_loss: 1.2787, test_f1: 0.5971
 epoch: 65, train_loss: 0.4770, test_loss: 1.4515, test_f1: 0.6275
 epoch: 66, train_loss: 0.4540, test_loss: 1.4187, test_f1: 0.6098
 epoch: 67, train_loss: 0.4448, test_loss: 1.1084, test_f1: 0.6749
 epoch: 68, train_loss: 0.4392, test_loss: 1.3677, test_f1: 0.6330
 epoch: 69, train_loss: 0.4408, test_loss: 1.4487, test_f1: 0.6003
 epoch: 70, train_loss: 0.4065, test_loss: 1.4205, test_f1: 0.5611
 epoch: 71, train_loss: 0.4512, test_loss: 1.6742, test_f1: 0.5885
 epoch: 72, train_loss: 0.4213, test_loss: 1.5036, test_f1: 0.5973
 epoch: 73, train_loss: 0.3959, test_loss: 1.8869, test_f1: 0.5574
 epoch: 74, train_loss: 0.4383, test_loss: 1.6635, test_f1: 0.5698
 epoch: 75, train_loss: 0.4260, test_loss: 1.3125, test_f1: 0.6275
 epoch: 76, train_loss: 0.4010, test_loss: 1.6036, test_f1: 0.5237
 epoch: 77, train_loss: 0.4508, test_loss: 1.7432, test_f1: 0.5488
 epoch: 78, train_loss: 0.4537, test_loss: 1.7667, test_f1: 0.5654
 epoch: 79, train_loss: 0.4293, test_loss: 1.2044, test_f1: 0.5940
 epoch: 80, train_loss: 0.4219, test_loss: 1.5071, test_f1: 0.5368
 epoch: 81, train_loss: 0.3770, test_loss: 1.3748, test_f1: 0.6058
 epoch: 82, train_loss: 0.4337, test_loss: 1.6586, test_f1: 0.6006
 epoch: 83, train_loss: 0.4356, test_loss: 1.6254, test_f1: 0.5904
 epoch: 84, train_loss: 0.3927, test_loss: 1.4774, test_f1: 0.6114
 epoch: 85, train_loss: 0.4983, test_loss: 1.2292, test_f1: 0.6014
 epoch: 86, train_loss: 0.4480, test_loss: 1.6421, test_f1: 0.5839
 epoch: 87, train_loss: 0.3837, test_loss: 1.3773, test_f1: 0.6258
 epoch: 88, train_loss: 0.3493, test_loss: 1.4173, test_f1: 0.6017
 epoch: 89, train_loss: 0.3711, test_loss: 1.5426, test_f1: 0.6513
 epoch: 90, train_loss: 0.3898, test_loss: 1.3469, test_f1: 0.6049
 epoch: 91, train_loss: 0.3705, test_loss: 1.5451, test_f1: 0.5990
 epoch: 92, train_loss: 0.3422, test_loss: 1.6784, test_f1: 0.5855
 epoch: 93, train_loss: 0.3465, test_loss: 1.5817, test_f1: 0.5820
 epoch: 94, train_loss: 0.3133, test_loss: 2.0510, test_f1: 0.5484
 epoch: 95, train_loss: 0.3273, test_loss: 1.6671, test_f1: 0.5991
 epoch: 96, train_loss: 0.3031, test_loss: 1.7439, test_f1: 0.6300
 epoch: 97, train_loss: 0.3430, test_loss: 1.5697, test_f1: 0.6139
 epoch: 98, train_loss: 0.3368, test_loss: 1.7288, test_f1: 0.6324
 epoch: 99, train_loss: 0.3153, test_loss: 2.0314, test_f1: 0.6113
##################ITERATION #9 ****************************************
 epoch: 0, train_loss: 1.3109, test_loss: 1.2612, test_f1: 0.3558
 epoch: 1, train_loss: 1.0251, test_loss: 1.1456, test_f1: 0.3996
 epoch: 2, train_loss: 0.9798, test_loss: 1.1982, test_f1: 0.4440
 epoch: 3, train_loss: 0.9650, test_loss: 1.1085, test_f1: 0.4792
 epoch: 4, train_loss: 0.9189, test_loss: 1.0903, test_f1: 0.5016
 epoch: 5, train_loss: 0.9116, test_loss: 1.3961, test_f1: 0.3193
 epoch: 6, train_loss: 0.9602, test_loss: 0.9919, test_f1: 0.5370
 epoch: 7, train_loss: 0.8634, test_loss: 1.0095, test_f1: 0.4942
 epoch: 8, train_loss: 0.8401, test_loss: 1.0459, test_f1: 0.5007
 epoch: 9, train_loss: 0.8218, test_loss: 1.1295, test_f1: 0.5010
 epoch: 10, train_loss: 0.8263, test_loss: 1.1538, test_f1: 0.5050
 epoch: 11, train_loss: 0.8350, test_loss: 1.0311, test_f1: 0.5597
 epoch: 12, train_loss: 0.7936, test_loss: 1.0034, test_f1: 0.6077
 epoch: 13, train_loss: 0.7595, test_loss: 1.1267, test_f1: 0.5232
 epoch: 14, train_loss: 0.7863, test_loss: 0.9666, test_f1: 0.5911
 epoch: 15, train_loss: 0.8133, test_loss: 2.2516, test_f1: 0.2701
 epoch: 16, train_loss: 0.7842, test_loss: 1.0168, test_f1: 0.6068
 epoch: 17, train_loss: 0.7816, test_loss: 1.0579, test_f1: 0.5352
 epoch: 18, train_loss: 0.7751, test_loss: 1.1740, test_f1: 0.5810
 epoch: 19, train_loss: 0.7780, test_loss: 9.7429, test_f1: 0.3369
 epoch: 20, train_loss: 0.7825, test_loss: 1.0077, test_f1: 0.5490
 epoch: 21, train_loss: 0.7469, test_loss: 2.4619, test_f1: 0.3684
 epoch: 22, train_loss: 0.8283, test_loss: 1.1739, test_f1: 0.6058
 epoch: 23, train_loss: 0.7524, test_loss: 1.1163, test_f1: 0.5744
 epoch: 24, train_loss: 0.7530, test_loss: 1.8820, test_f1: 0.4899
 epoch: 25, train_loss: 0.7333, test_loss: 1.1647, test_f1: 0.5605
 epoch: 26, train_loss: 0.7253, test_loss: 1.6949, test_f1: 0.4980
 epoch: 27, train_loss: 0.7200, test_loss: 1.0598, test_f1: 0.5746
 epoch: 28, train_loss: 0.6881, test_loss: 1.7904, test_f1: 0.5196
 epoch: 29, train_loss: 0.6938, test_loss: 1.7013, test_f1: 0.4768
 epoch: 30, train_loss: 0.6905, test_loss: 1.1091, test_f1: 0.6048
 epoch: 31, train_loss: 0.7450, test_loss: 1.1448, test_f1: 0.5236
 epoch: 32, train_loss: 0.6882, test_loss: 1.4441, test_f1: 0.5652
 epoch: 33, train_loss: 0.6804, test_loss: 1.6822, test_f1: 0.5410
 epoch: 34, train_loss: 0.6968, test_loss: 1.1208, test_f1: 0.5610
 epoch: 35, train_loss: 0.6794, test_loss: 1.3063, test_f1: 0.5907
 epoch: 36, train_loss: 0.7144, test_loss: 1.4313, test_f1: 0.5328
 epoch: 37, train_loss: 0.7004, test_loss: 1.2373, test_f1: 0.5533
 epoch: 38, train_loss: 0.6698, test_loss: 1.4377, test_f1: 0.5155
 epoch: 39, train_loss: 0.7291, test_loss: 1.0008, test_f1: 0.5676
 epoch: 40, train_loss: 0.7157, test_loss: 1.0742, test_f1: 0.5911
 epoch: 41, train_loss: 0.6639, test_loss: 1.3596, test_f1: 0.5712
 epoch: 42, train_loss: 0.6339, test_loss: 1.1574, test_f1: 0.6331
 epoch: 43, train_loss: 0.6624, test_loss: 1.2163, test_f1: 0.5636
 epoch: 44, train_loss: 0.6454, test_loss: 2.0248, test_f1: 0.5445
 epoch: 45, train_loss: 0.6571, test_loss: 1.1149, test_f1: 0.5456
 epoch: 46, train_loss: 0.6322, test_loss: 1.7487, test_f1: 0.5555
 epoch: 47, train_loss: 0.6395, test_loss: 1.0993, test_f1: 0.6164
 epoch: 48, train_loss: 0.6064, test_loss: 1.1353, test_f1: 0.5376
 epoch: 49, train_loss: 0.6359, test_loss: 1.1734, test_f1: 0.5954
 epoch: 50, train_loss: 0.6306, test_loss: 1.2466, test_f1: 0.6090
 epoch: 51, train_loss: 0.5756, test_loss: 1.3533, test_f1: 0.6018
 epoch: 52, train_loss: 0.5400, test_loss: 1.3541, test_f1: 0.6096
 epoch: 53, train_loss: 0.5603, test_loss: 1.4643, test_f1: 0.5533
 epoch: 54, train_loss: 0.5554, test_loss: 1.5658, test_f1: 0.6265
 epoch: 55, train_loss: 0.5289, test_loss: 1.3865, test_f1: 0.6151
 epoch: 56, train_loss: 0.5072, test_loss: 1.5640, test_f1: 0.5841
 epoch: 57, train_loss: 0.5181, test_loss: 1.8448, test_f1: 0.6280
 epoch: 58, train_loss: 0.5034, test_loss: 1.5599, test_f1: 0.6165
 epoch: 59, train_loss: 0.4978, test_loss: 1.5597, test_f1: 0.6163
 epoch: 60, train_loss: 0.4849, test_loss: 1.9471, test_f1: 0.6478
 epoch: 61, train_loss: 0.4961, test_loss: 1.4555, test_f1: 0.6518
 epoch: 62, train_loss: 0.4792, test_loss: 1.6252, test_f1: 0.6390
 epoch: 63, train_loss: 0.4614, test_loss: 1.4895, test_f1: 0.6464
 epoch: 64, train_loss: 0.5119, test_loss: 1.5359, test_f1: 0.6381
 epoch: 65, train_loss: 0.4776, test_loss: 1.5962, test_f1: 0.6005
 epoch: 66, train_loss: 0.4519, test_loss: 2.1499, test_f1: 0.6463
 epoch: 67, train_loss: 0.4727, test_loss: 2.0699, test_f1: 0.5819
 epoch: 68, train_loss: 0.4825, test_loss: 1.6205, test_f1: 0.6691
 epoch: 69, train_loss: 0.4550, test_loss: 1.4757, test_f1: 0.6801
 epoch: 70, train_loss: 0.4488, test_loss: 1.4999, test_f1: 0.6476
 epoch: 71, train_loss: 0.4522, test_loss: 1.6737, test_f1: 0.6286
 epoch: 72, train_loss: 0.4405, test_loss: 1.4171, test_f1: 0.6666
 epoch: 73, train_loss: 0.4227, test_loss: 1.7095, test_f1: 0.6531
 epoch: 74, train_loss: 0.4666, test_loss: 1.5061, test_f1: 0.6283
 epoch: 75, train_loss: 0.4528, test_loss: 1.8620, test_f1: 0.6321
 epoch: 76, train_loss: 0.4476, test_loss: 1.6931, test_f1: 0.5945
 epoch: 77, train_loss: 0.4510, test_loss: 1.3346, test_f1: 0.6468
 epoch: 78, train_loss: 0.4461, test_loss: 1.6084, test_f1: 0.6590
 epoch: 79, train_loss: 0.3991, test_loss: 1.6788, test_f1: 0.5627
 epoch: 80, train_loss: 0.4220, test_loss: 2.4281, test_f1: 0.6217
 epoch: 81, train_loss: 0.4011, test_loss: 1.7448, test_f1: 0.6299
 epoch: 82, train_loss: 0.3952, test_loss: 1.6707, test_f1: 0.6374
 epoch: 83, train_loss: 0.4065, test_loss: 1.7142, test_f1: 0.6489
 epoch: 84, train_loss: 0.4272, test_loss: 1.7559, test_f1: 0.6448
 epoch: 85, train_loss: 0.4121, test_loss: 2.0062, test_f1: 0.6513
 epoch: 86, train_loss: 0.4242, test_loss: 1.7651, test_f1: 0.6721
 epoch: 87, train_loss: 0.4003, test_loss: 1.5302, test_f1: 0.6807
 epoch: 88, train_loss: 0.4242, test_loss: 1.8140, test_f1: 0.6568
 epoch: 89, train_loss: 0.3918, test_loss: 1.9143, test_f1: 0.6356
 epoch: 90, train_loss: 0.3770, test_loss: 1.7158, test_f1: 0.6632
 epoch: 91, train_loss: 0.3992, test_loss: 2.2481, test_f1: 0.6914
 epoch: 92, train_loss: 0.3668, test_loss: 2.1029, test_f1: 0.5983
 epoch: 93, train_loss: 0.3611, test_loss: 2.1850, test_f1: 0.6407
 epoch: 94, train_loss: 0.3254, test_loss: 2.2569, test_f1: 0.6416
 epoch: 95, train_loss: 0.3693, test_loss: 2.0131, test_f1: 0.6522
 epoch: 96, train_loss: 0.3396, test_loss: 1.7839, test_f1: 0.6999
 epoch: 97, train_loss: 0.3583, test_loss: 2.0828, test_f1: 0.6410
 epoch: 98, train_loss: 0.3516, test_loss: 2.1514, test_f1: 0.6652
 epoch: 99, train_loss: 0.3776, test_loss: 2.1084, test_f1: 0.6112

Training completed in 555.49 seconds
Best F1: 0.6999 at epoch 96
Mean F1 across iterations: 0.6725  0.0174
========================FINAL RESULTS================================
FEGIN weighted F1: 0.6999  0.0174
python main.py --data ltspice_demos --representation component_pin --model FEGIN --layers 6 --hiddens 64 --batch_size 64 --lr 0.01 --emb_size 250 --epochs 100 --save_appendix component_pin_L6_H64_BS64_LR0.01_E250 --no_val
-----



STDERR:
  File "main.py", line 370, in <module>
    main()
  File "main.py", line 254, in main
    dataset = dataset_class(
  File "/home/philip/projects/ltspice_examples_code_repo/Circuit-Completion-Using-GNNs/component_classification_with_link_prediction_head/evaluation/FEGIN/kernel/circuit_datasets.py", line 15, in __init__
    self.data, self.slices = torch.load(self.processed_paths[0])
  File "/home/philip/.local/lib/python3.8/site-packages/torch/serialization.py", line 1040, in load
    warnings.warn(
  File "/usr/lib/python3.8/warnings.py", line 109, in _showwarnmsg
    sw(msg.message, msg.category, msg.filename, msg.lineno,
  File "main.py", line 47, in warn_with_traceback
    traceback.print_stack(file=log)
/home/philip/projects/ltspice_examples_code_repo/Circuit-Completion-Using-GNNs/component_classification_with_link_prediction_head/evaluation/FEGIN/kernel/circuit_datasets.py:15: FutureWarning: You are using `torch.load` with `weights_only=False` (the current default value), which uses the default pickle module implicitly. It is possible to construct malicious pickle data which will execute arbitrary code during unpickling (See https://github.com/pytorch/pytorch/blob/main/SECURITY.md#untrusted-models for more details). In a future release, the default value for `weights_only` will be flipped to `True`. This limits the functions that could be executed during unpickling. Arbitrary objects will no longer be allowed to be loaded via this mode unless they are explicitly allowlisted by the user via `torch.serialization.add_safe_globals`. We recommend you start setting `weights_only=True` for any use case where you don't have full control of the loaded file. Please open an issue on GitHub for any issues related to this experimental feature.
  self.data, self.slices = torch.load(self.processed_paths[0])
