STDOUT:
Results will be saved in /home/philip/projects/ltspice_examples_code_repo/Circuit-Completion-Using-GNNs/component_classification_with_link_prediction_head/evaluation/FEGIN/results/model_FEGIN_dataset_ltspice_demos
Command line input: python main.py --data ltspice_demos --representation component_net --model FEGIN --layers 5 --hiddens 32 --batch_size 64 --lr 0.01 --emb_size 512 --epochs 100 --save_appendix component_net_L5_H32_BS64_LR0.01_E512 --no_val
 is saved.
-----
ltspice_demos - FEGIN
Using 5 layers, 32 hidden units, h = 2
Loading component_net representation dataset
ENTERED
Training FEGIN on component_net representation
Train: 1565, Test: 383
##################ITERATION #0 ****************************************
 epoch: 0, train_loss: 1.2334, test_loss: 1.3698, test_f1: 0.1621
 epoch: 1, train_loss: 1.0940, test_loss: 1.2057, test_f1: 0.4024
 epoch: 2, train_loss: 1.0330, test_loss: 1.1441, test_f1: 0.4316
 epoch: 3, train_loss: 0.9965, test_loss: 1.1048, test_f1: 0.4918
 epoch: 4, train_loss: 0.9843, test_loss: 1.0634, test_f1: 0.4701
 epoch: 5, train_loss: 0.9503, test_loss: 1.0695, test_f1: 0.4640
 epoch: 6, train_loss: 0.9613, test_loss: 1.1047, test_f1: 0.5004
 epoch: 7, train_loss: 0.9392, test_loss: 1.0979, test_f1: 0.5080
 epoch: 8, train_loss: 0.9429, test_loss: 1.1098, test_f1: 0.4472
 epoch: 9, train_loss: 0.9257, test_loss: 1.1026, test_f1: 0.4608
 epoch: 10, train_loss: 0.9130, test_loss: 1.0449, test_f1: 0.5490
 epoch: 11, train_loss: 0.8948, test_loss: 1.1115, test_f1: 0.5485
 epoch: 12, train_loss: 0.9096, test_loss: 1.0736, test_f1: 0.5567
 epoch: 13, train_loss: 0.8895, test_loss: 1.0300, test_f1: 0.5597
 epoch: 14, train_loss: 0.8659, test_loss: 1.0551, test_f1: 0.5564
 epoch: 15, train_loss: 0.8485, test_loss: 1.2076, test_f1: 0.5590
 epoch: 16, train_loss: 0.8546, test_loss: 1.0392, test_f1: 0.5833
 epoch: 17, train_loss: 0.8403, test_loss: 1.2451, test_f1: 0.5465
 epoch: 18, train_loss: 0.8111, test_loss: 1.4661, test_f1: 0.3578
 epoch: 19, train_loss: 0.8251, test_loss: 1.1854, test_f1: 0.5553
 epoch: 20, train_loss: 0.8052, test_loss: 1.1131, test_f1: 0.5585
 epoch: 21, train_loss: 0.8136, test_loss: 1.0426, test_f1: 0.5316
 epoch: 22, train_loss: 0.7859, test_loss: 1.1098, test_f1: 0.5625
 epoch: 23, train_loss: 0.7830, test_loss: 1.0765, test_f1: 0.5905
 epoch: 24, train_loss: 0.7545, test_loss: 1.3799, test_f1: 0.5221
 epoch: 25, train_loss: 0.7595, test_loss: 1.2370, test_f1: 0.5650
 epoch: 26, train_loss: 0.7805, test_loss: 1.2351, test_f1: 0.5762
 epoch: 27, train_loss: 0.7552, test_loss: 1.0708, test_f1: 0.5625
 epoch: 28, train_loss: 0.7366, test_loss: 1.3335, test_f1: 0.5658
 epoch: 29, train_loss: 0.7387, test_loss: 1.1114, test_f1: 0.5889
 epoch: 30, train_loss: 0.7182, test_loss: 1.3287, test_f1: 0.5455
 epoch: 31, train_loss: 0.7228, test_loss: 1.2983, test_f1: 0.5811
 epoch: 32, train_loss: 0.7433, test_loss: 1.1182, test_f1: 0.5180
 epoch: 33, train_loss: 0.7246, test_loss: 1.3668, test_f1: 0.5575
 epoch: 34, train_loss: 0.7160, test_loss: 1.2054, test_f1: 0.5479
 epoch: 35, train_loss: 0.6926, test_loss: 1.2133, test_f1: 0.5477
 epoch: 36, train_loss: 0.7007, test_loss: 1.3285, test_f1: 0.5140
 epoch: 37, train_loss: 0.6738, test_loss: 1.3593, test_f1: 0.5517
 epoch: 38, train_loss: 0.6858, test_loss: 1.3268, test_f1: 0.5904
 epoch: 39, train_loss: 0.6910, test_loss: 1.5376, test_f1: 0.4471
 epoch: 40, train_loss: 0.6807, test_loss: 1.2254, test_f1: 0.5537
 epoch: 41, train_loss: 0.6792, test_loss: 1.3164, test_f1: 0.5679
 epoch: 42, train_loss: 0.6927, test_loss: 1.5307, test_f1: 0.5567
 epoch: 43, train_loss: 0.6943, test_loss: 1.3597, test_f1: 0.5454
 epoch: 44, train_loss: 0.6724, test_loss: 1.2781, test_f1: 0.5916
 epoch: 45, train_loss: 0.6366, test_loss: 1.3278, test_f1: 0.5754
 epoch: 46, train_loss: 0.6852, test_loss: 1.2742, test_f1: 0.5368
 epoch: 47, train_loss: 0.6848, test_loss: 1.5546, test_f1: 0.5476
 epoch: 48, train_loss: 0.6588, test_loss: 1.3202, test_f1: 0.5586
 epoch: 49, train_loss: 0.6371, test_loss: 1.3195, test_f1: 0.5721
 epoch: 50, train_loss: 0.6222, test_loss: 1.4664, test_f1: 0.5401
 epoch: 51, train_loss: 0.6233, test_loss: 1.5259, test_f1: 0.6168
 epoch: 52, train_loss: 0.6070, test_loss: 1.4122, test_f1: 0.5586
 epoch: 53, train_loss: 0.5812, test_loss: 1.3583, test_f1: 0.5721
 epoch: 54, train_loss: 0.5643, test_loss: 1.4669, test_f1: 0.6012
 epoch: 55, train_loss: 0.5781, test_loss: 1.5666, test_f1: 0.5937
 epoch: 56, train_loss: 0.5529, test_loss: 1.6000, test_f1: 0.5847
 epoch: 57, train_loss: 0.5547, test_loss: 1.6136, test_f1: 0.5795
 epoch: 58, train_loss: 0.5550, test_loss: 1.4840, test_f1: 0.5928
 epoch: 59, train_loss: 0.5744, test_loss: 1.5874, test_f1: 0.5916
 epoch: 60, train_loss: 0.5587, test_loss: 1.4611, test_f1: 0.5948
 epoch: 61, train_loss: 0.5507, test_loss: 1.5747, test_f1: 0.5831
 epoch: 62, train_loss: 0.5717, test_loss: 1.2707, test_f1: 0.5735
 epoch: 63, train_loss: 0.5545, test_loss: 1.4330, test_f1: 0.5629
 epoch: 64, train_loss: 0.5357, test_loss: 1.6137, test_f1: 0.5820
 epoch: 65, train_loss: 0.5598, test_loss: 1.4950, test_f1: 0.6034
 epoch: 66, train_loss: 0.5547, test_loss: 1.5675, test_f1: 0.5750
 epoch: 67, train_loss: 0.5581, test_loss: 1.6392, test_f1: 0.5582
 epoch: 68, train_loss: 0.5534, test_loss: 1.4452, test_f1: 0.5792
 epoch: 69, train_loss: 0.5434, test_loss: 1.6087, test_f1: 0.5847
 epoch: 70, train_loss: 0.5435, test_loss: 1.5447, test_f1: 0.6058
 epoch: 71, train_loss: 0.5240, test_loss: 1.6517, test_f1: 0.5684
 epoch: 72, train_loss: 0.5224, test_loss: 1.6811, test_f1: 0.5832
 epoch: 73, train_loss: 0.5019, test_loss: 1.7181, test_f1: 0.5532
 epoch: 74, train_loss: 0.5242, test_loss: 1.5392, test_f1: 0.5607
 epoch: 75, train_loss: 0.4952, test_loss: 2.2629, test_f1: 0.5883
 epoch: 76, train_loss: 0.5212, test_loss: 1.6770, test_f1: 0.5597
 epoch: 77, train_loss: 0.5207, test_loss: 1.6381, test_f1: 0.5709
 epoch: 78, train_loss: 0.5030, test_loss: 1.6820, test_f1: 0.5926
 epoch: 79, train_loss: 0.4823, test_loss: 1.7127, test_f1: 0.5851
 epoch: 80, train_loss: 0.4958, test_loss: 1.6585, test_f1: 0.5893
 epoch: 81, train_loss: 0.5000, test_loss: 1.8240, test_f1: 0.5489
 epoch: 82, train_loss: 0.5086, test_loss: 1.7493, test_f1: 0.5788
 epoch: 83, train_loss: 0.5058, test_loss: 2.1458, test_f1: 0.5467
 epoch: 84, train_loss: 0.5135, test_loss: 1.9287, test_f1: 0.5720
 epoch: 85, train_loss: 0.5036, test_loss: 1.6223, test_f1: 0.5622
 epoch: 86, train_loss: 0.4997, test_loss: 2.1899, test_f1: 0.5430
 epoch: 87, train_loss: 0.4771, test_loss: 1.8230, test_f1: 0.5654
 epoch: 88, train_loss: 0.5008, test_loss: 1.8297, test_f1: 0.5889
 epoch: 89, train_loss: 0.4929, test_loss: 1.9286, test_f1: 0.5931
 epoch: 90, train_loss: 0.4922, test_loss: 2.0703, test_f1: 0.5705
 epoch: 91, train_loss: 0.5230, test_loss: 2.0087, test_f1: 0.5944
 epoch: 92, train_loss: 0.4792, test_loss: 2.0605, test_f1: 0.5850
 epoch: 93, train_loss: 0.4810, test_loss: 2.2444, test_f1: 0.5851
 epoch: 94, train_loss: 0.4895, test_loss: 1.7898, test_f1: 0.5906
 epoch: 95, train_loss: 0.4717, test_loss: 1.9149, test_f1: 0.5622
 epoch: 96, train_loss: 0.4802, test_loss: 1.6694, test_f1: 0.5763
 epoch: 97, train_loss: 0.4739, test_loss: 1.8889, test_f1: 0.5839
 epoch: 98, train_loss: 0.4856, test_loss: 1.9429, test_f1: 0.5777
 epoch: 99, train_loss: 0.4761, test_loss: 1.9456, test_f1: 0.5903
##################ITERATION #1 ****************************************
 epoch: 0, train_loss: 1.2076, test_loss: 1.3228, test_f1: 0.2360
 epoch: 1, train_loss: 1.0618, test_loss: 1.1332, test_f1: 0.4382
 epoch: 2, train_loss: 1.0205, test_loss: 1.1347, test_f1: 0.4736
 epoch: 3, train_loss: 0.9865, test_loss: 1.0933, test_f1: 0.5268
 epoch: 4, train_loss: 0.9831, test_loss: 1.1395, test_f1: 0.4749
 epoch: 5, train_loss: 0.9539, test_loss: 1.1261, test_f1: 0.4786
 epoch: 6, train_loss: 0.9508, test_loss: 1.0692, test_f1: 0.5364
 epoch: 7, train_loss: 0.9646, test_loss: 1.0454, test_f1: 0.5444
 epoch: 8, train_loss: 0.9400, test_loss: 1.1108, test_f1: 0.4830
 epoch: 9, train_loss: 0.9237, test_loss: 1.1447, test_f1: 0.4870
 epoch: 10, train_loss: 0.9620, test_loss: 1.1103, test_f1: 0.4583
 epoch: 11, train_loss: 0.9296, test_loss: 1.1009, test_f1: 0.5178
 epoch: 12, train_loss: 0.9192, test_loss: 1.0727, test_f1: 0.5724
 epoch: 13, train_loss: 0.9108, test_loss: 1.0778, test_f1: 0.5663
 epoch: 14, train_loss: 0.8745, test_loss: 1.0840, test_f1: 0.5232
 epoch: 15, train_loss: 0.8748, test_loss: 1.0864, test_f1: 0.5483
 epoch: 16, train_loss: 0.8642, test_loss: 1.1836, test_f1: 0.4200
 epoch: 17, train_loss: 0.8644, test_loss: 1.0692, test_f1: 0.5655
 epoch: 18, train_loss: 0.8589, test_loss: 1.2493, test_f1: 0.5079
 epoch: 19, train_loss: 0.8480, test_loss: 1.0574, test_f1: 0.6075
 epoch: 20, train_loss: 0.8393, test_loss: 1.3459, test_f1: 0.4552
 epoch: 21, train_loss: 0.8703, test_loss: 1.1290, test_f1: 0.5530
 epoch: 22, train_loss: 0.8425, test_loss: 1.1562, test_f1: 0.5679
 epoch: 23, train_loss: 0.8284, test_loss: 1.1082, test_f1: 0.5227
 epoch: 24, train_loss: 0.8080, test_loss: 1.0162, test_f1: 0.5921
 epoch: 25, train_loss: 0.8185, test_loss: 1.1326, test_f1: 0.5194
 epoch: 26, train_loss: 0.8197, test_loss: 1.2251, test_f1: 0.5270
 epoch: 27, train_loss: 0.7955, test_loss: 1.1971, test_f1: 0.5307
 epoch: 28, train_loss: 0.7919, test_loss: 1.0725, test_f1: 0.5593
 epoch: 29, train_loss: 0.8058, test_loss: 1.0611, test_f1: 0.5788
 epoch: 30, train_loss: 0.7969, test_loss: 1.0245, test_f1: 0.5710
 epoch: 31, train_loss: 0.7739, test_loss: 1.1165, test_f1: 0.5772
 epoch: 32, train_loss: 0.7598, test_loss: 1.1819, test_f1: 0.5551
 epoch: 33, train_loss: 0.7843, test_loss: 1.0812, test_f1: 0.5465
 epoch: 34, train_loss: 0.7799, test_loss: 1.2367, test_f1: 0.4962
 epoch: 35, train_loss: 0.7664, test_loss: 1.1611, test_f1: 0.5119
 epoch: 36, train_loss: 0.7157, test_loss: 1.2831, test_f1: 0.5449
 epoch: 37, train_loss: 0.7904, test_loss: 1.1975, test_f1: 0.4654
 epoch: 38, train_loss: 0.7626, test_loss: 1.1243, test_f1: 0.4965
 epoch: 39, train_loss: 0.7078, test_loss: 1.2240, test_f1: 0.5339
 epoch: 40, train_loss: 0.6941, test_loss: 1.1910, test_f1: 0.5481
 epoch: 41, train_loss: 0.7216, test_loss: 1.1512, test_f1: 0.5396
 epoch: 42, train_loss: 0.7288, test_loss: 1.2323, test_f1: 0.5344
 epoch: 43, train_loss: 0.7341, test_loss: 1.2066, test_f1: 0.5315
 epoch: 44, train_loss: 0.6997, test_loss: 1.1974, test_f1: 0.5160
 epoch: 45, train_loss: 0.7238, test_loss: 1.4144, test_f1: 0.4783
 epoch: 46, train_loss: 0.7284, test_loss: 1.2096, test_f1: 0.5871
 epoch: 47, train_loss: 0.6950, test_loss: 1.3642, test_f1: 0.5355
 epoch: 48, train_loss: 0.6963, test_loss: 1.2311, test_f1: 0.5679
 epoch: 49, train_loss: 0.6840, test_loss: 1.2078, test_f1: 0.5245
 epoch: 50, train_loss: 0.6876, test_loss: 1.2763, test_f1: 0.5423
 epoch: 51, train_loss: 0.6367, test_loss: 1.1963, test_f1: 0.5641
 epoch: 52, train_loss: 0.6107, test_loss: 1.2032, test_f1: 0.5766
 epoch: 53, train_loss: 0.6024, test_loss: 1.2334, test_f1: 0.5468
 epoch: 54, train_loss: 0.5760, test_loss: 1.3611, test_f1: 0.5606
 epoch: 55, train_loss: 0.5612, test_loss: 1.4735, test_f1: 0.5660
 epoch: 56, train_loss: 0.5948, test_loss: 1.4404, test_f1: 0.5641
 epoch: 57, train_loss: 0.5708, test_loss: 1.4761, test_f1: 0.5334
 epoch: 58, train_loss: 0.5774, test_loss: 1.4363, test_f1: 0.5946
 epoch: 59, train_loss: 0.5704, test_loss: 1.4754, test_f1: 0.6033
 epoch: 60, train_loss: 0.6126, test_loss: 1.5293, test_f1: 0.5016
 epoch: 61, train_loss: 0.5910, test_loss: 1.4439, test_f1: 0.5796
 epoch: 62, train_loss: 0.5537, test_loss: 1.6440, test_f1: 0.5439
 epoch: 63, train_loss: 0.5425, test_loss: 1.7216, test_f1: 0.5689
 epoch: 64, train_loss: 0.5528, test_loss: 1.5396, test_f1: 0.5540
 epoch: 65, train_loss: 0.5299, test_loss: 1.6782, test_f1: 0.5743
 epoch: 66, train_loss: 0.5397, test_loss: 1.6717, test_f1: 0.5989
 epoch: 67, train_loss: 0.5261, test_loss: 1.5269, test_f1: 0.6055
 epoch: 68, train_loss: 0.5345, test_loss: 1.6739, test_f1: 0.5490
 epoch: 69, train_loss: 0.5291, test_loss: 1.8018, test_f1: 0.5653
 epoch: 70, train_loss: 0.5285, test_loss: 1.8122, test_f1: 0.5027
 epoch: 71, train_loss: 0.5183, test_loss: 1.7908, test_f1: 0.5371
 epoch: 72, train_loss: 0.5352, test_loss: 1.5856, test_f1: 0.5880
 epoch: 73, train_loss: 0.5407, test_loss: 1.5655, test_f1: 0.5816
 epoch: 74, train_loss: 0.4930, test_loss: 1.5563, test_f1: 0.5811
 epoch: 75, train_loss: 0.4931, test_loss: 1.6947, test_f1: 0.5631
 epoch: 76, train_loss: 0.5484, test_loss: 1.9036, test_f1: 0.5488
 epoch: 77, train_loss: 0.5135, test_loss: 1.8323, test_f1: 0.5750
 epoch: 78, train_loss: 0.5162, test_loss: 2.0400, test_f1: 0.5689
 epoch: 79, train_loss: 0.5259, test_loss: 1.7064, test_f1: 0.6093
 epoch: 80, train_loss: 0.5297, test_loss: 1.6843, test_f1: 0.5794
 epoch: 81, train_loss: 0.4857, test_loss: 1.9586, test_f1: 0.5163
 epoch: 82, train_loss: 0.4961, test_loss: 1.8369, test_f1: 0.5697
 epoch: 83, train_loss: 0.4878, test_loss: 1.8779, test_f1: 0.5421
 epoch: 84, train_loss: 0.5012, test_loss: 1.7492, test_f1: 0.5820
 epoch: 85, train_loss: 0.5006, test_loss: 1.7519, test_f1: 0.5605
 epoch: 86, train_loss: 0.5153, test_loss: 1.9740, test_f1: 0.5812
 epoch: 87, train_loss: 0.5022, test_loss: 1.7958, test_f1: 0.5659
 epoch: 88, train_loss: 0.4798, test_loss: 1.8803, test_f1: 0.6053
 epoch: 89, train_loss: 0.4779, test_loss: 2.1527, test_f1: 0.5512
 epoch: 90, train_loss: 0.5063, test_loss: 1.8798, test_f1: 0.5646
 epoch: 91, train_loss: 0.5057, test_loss: 1.8547, test_f1: 0.5949
 epoch: 92, train_loss: 0.4529, test_loss: 1.9139, test_f1: 0.5431
 epoch: 93, train_loss: 0.4494, test_loss: 2.1205, test_f1: 0.5607
 epoch: 94, train_loss: 0.4530, test_loss: 2.1887, test_f1: 0.5216
 epoch: 95, train_loss: 0.4710, test_loss: 2.1395, test_f1: 0.5351
 epoch: 96, train_loss: 0.4493, test_loss: 1.9204, test_f1: 0.5731
 epoch: 97, train_loss: 0.4708, test_loss: 2.0349, test_f1: 0.5655
 epoch: 98, train_loss: 0.4436, test_loss: 2.0673, test_f1: 0.5282
 epoch: 99, train_loss: 0.4825, test_loss: 2.2393, test_f1: 0.5444
##################ITERATION #2 ****************************************
 epoch: 0, train_loss: 1.2153, test_loss: 1.4468, test_f1: 0.2281
 epoch: 1, train_loss: 1.0714, test_loss: 1.1305, test_f1: 0.3861
 epoch: 2, train_loss: 1.0162, test_loss: 1.0494, test_f1: 0.5105
 epoch: 3, train_loss: 0.9991, test_loss: 1.0973, test_f1: 0.5058
 epoch: 4, train_loss: 0.9725, test_loss: 1.1316, test_f1: 0.5011
 epoch: 5, train_loss: 0.9449, test_loss: 1.1365, test_f1: 0.5298
 epoch: 6, train_loss: 0.9454, test_loss: 1.1551, test_f1: 0.5021
 epoch: 7, train_loss: 0.9451, test_loss: 1.0776, test_f1: 0.5622
 epoch: 8, train_loss: 0.9191, test_loss: 1.3168, test_f1: 0.4982
 epoch: 9, train_loss: 0.9170, test_loss: 1.1564, test_f1: 0.4937
 epoch: 10, train_loss: 0.9275, test_loss: 1.0722, test_f1: 0.5475
 epoch: 11, train_loss: 0.9297, test_loss: 1.1315, test_f1: 0.5379
 epoch: 12, train_loss: 0.9109, test_loss: 0.9713, test_f1: 0.5487
 epoch: 13, train_loss: 0.8833, test_loss: 1.1461, test_f1: 0.5561
 epoch: 14, train_loss: 0.8541, test_loss: 1.2421, test_f1: 0.4293
 epoch: 15, train_loss: 0.8783, test_loss: 1.0368, test_f1: 0.5518
 epoch: 16, train_loss: 0.8647, test_loss: 1.0300, test_f1: 0.5568
 epoch: 17, train_loss: 0.8792, test_loss: 2.4048, test_f1: 0.1979
 epoch: 18, train_loss: 0.8538, test_loss: 1.1755, test_f1: 0.5413
 epoch: 19, train_loss: 0.8233, test_loss: 1.2560, test_f1: 0.5512
 epoch: 20, train_loss: 0.8273, test_loss: 1.1670, test_f1: 0.5269
 epoch: 21, train_loss: 0.8193, test_loss: 1.0735, test_f1: 0.5726
 epoch: 22, train_loss: 0.8686, test_loss: 1.1342, test_f1: 0.5624
 epoch: 23, train_loss: 0.8097, test_loss: 1.1205, test_f1: 0.5276
 epoch: 24, train_loss: 0.7732, test_loss: 1.1508, test_f1: 0.5320
 epoch: 25, train_loss: 0.7439, test_loss: 1.5274, test_f1: 0.4928
 epoch: 26, train_loss: 0.7784, test_loss: 1.2191, test_f1: 0.5739
 epoch: 27, train_loss: 0.7994, test_loss: 1.2392, test_f1: 0.4561
 epoch: 28, train_loss: 0.7818, test_loss: 1.1687, test_f1: 0.5108
 epoch: 29, train_loss: 0.7650, test_loss: 1.0949, test_f1: 0.4963
 epoch: 30, train_loss: 0.7410, test_loss: 1.1276, test_f1: 0.5390
 epoch: 31, train_loss: 0.7335, test_loss: 1.1999, test_f1: 0.5752
 epoch: 32, train_loss: 0.7235, test_loss: 1.1534, test_f1: 0.5779
 epoch: 33, train_loss: 0.7324, test_loss: 1.1500, test_f1: 0.5669
 epoch: 34, train_loss: 0.7300, test_loss: 1.5780, test_f1: 0.4419
 epoch: 35, train_loss: 0.7229, test_loss: 1.8646, test_f1: 0.4893
 epoch: 36, train_loss: 0.7348, test_loss: 1.2580, test_f1: 0.5450
 epoch: 37, train_loss: 0.7221, test_loss: 1.3276, test_f1: 0.5386
 epoch: 38, train_loss: 0.7232, test_loss: 1.2717, test_f1: 0.5463
 epoch: 39, train_loss: 0.7491, test_loss: 1.1964, test_f1: 0.5732
 epoch: 40, train_loss: 0.7128, test_loss: 1.2632, test_f1: 0.5461
 epoch: 41, train_loss: 0.6797, test_loss: 1.2585, test_f1: 0.5787
 epoch: 42, train_loss: 0.6725, test_loss: 1.2989, test_f1: 0.5043
 epoch: 43, train_loss: 0.6762, test_loss: 1.2557, test_f1: 0.5490
 epoch: 44, train_loss: 0.6968, test_loss: 1.3876, test_f1: 0.5511
 epoch: 45, train_loss: 0.6611, test_loss: 1.2927, test_f1: 0.5487
 epoch: 46, train_loss: 0.6554, test_loss: 1.2314, test_f1: 0.5232
 epoch: 47, train_loss: 0.6542, test_loss: 1.6366, test_f1: 0.5551
 epoch: 48, train_loss: 0.7175, test_loss: 1.4589, test_f1: 0.4857
 epoch: 49, train_loss: 0.7277, test_loss: 1.1128, test_f1: 0.6112
 epoch: 50, train_loss: 0.7139, test_loss: 1.2249, test_f1: 0.5856
 epoch: 51, train_loss: 0.6616, test_loss: 1.2499, test_f1: 0.5837
 epoch: 52, train_loss: 0.6386, test_loss: 1.2616, test_f1: 0.5466
 epoch: 53, train_loss: 0.6170, test_loss: 1.3216, test_f1: 0.5783
 epoch: 54, train_loss: 0.6019, test_loss: 1.4055, test_f1: 0.5415
 epoch: 55, train_loss: 0.5943, test_loss: 1.3734, test_f1: 0.5770
 epoch: 56, train_loss: 0.5968, test_loss: 1.4472, test_f1: 0.5516
 epoch: 57, train_loss: 0.5771, test_loss: 1.5436, test_f1: 0.5695
 epoch: 58, train_loss: 0.5478, test_loss: 1.4450, test_f1: 0.5891
 epoch: 59, train_loss: 0.5657, test_loss: 1.6820, test_f1: 0.5694
 epoch: 60, train_loss: 0.5662, test_loss: 1.6850, test_f1: 0.5861
 epoch: 61, train_loss: 0.5937, test_loss: 1.5525, test_f1: 0.5782
 epoch: 62, train_loss: 0.5700, test_loss: 1.5786, test_f1: 0.5901
 epoch: 63, train_loss: 0.5667, test_loss: 1.4515, test_f1: 0.5995
 epoch: 64, train_loss: 0.5688, test_loss: 1.5496, test_f1: 0.5877
 epoch: 65, train_loss: 0.5390, test_loss: 1.5826, test_f1: 0.5884
 epoch: 66, train_loss: 0.5294, test_loss: 1.5447, test_f1: 0.5871
 epoch: 67, train_loss: 0.5577, test_loss: 1.6051, test_f1: 0.5857
 epoch: 68, train_loss: 0.5360, test_loss: 1.7212, test_f1: 0.5851
 epoch: 69, train_loss: 0.5563, test_loss: 1.7633, test_f1: 0.5641
 epoch: 70, train_loss: 0.5360, test_loss: 1.6210, test_f1: 0.5907
 epoch: 71, train_loss: 0.5218, test_loss: 1.7582, test_f1: 0.6090
 epoch: 72, train_loss: 0.5185, test_loss: 1.5912, test_f1: 0.5984
 epoch: 73, train_loss: 0.5051, test_loss: 1.7960, test_f1: 0.6101
 epoch: 74, train_loss: 0.5219, test_loss: 1.6964, test_f1: 0.5842
 epoch: 75, train_loss: 0.5123, test_loss: 1.6859, test_f1: 0.5875
 epoch: 76, train_loss: 0.4919, test_loss: 1.9345, test_f1: 0.5383
 epoch: 77, train_loss: 0.5171, test_loss: 1.5443, test_f1: 0.6128
 epoch: 78, train_loss: 0.5233, test_loss: 1.8072, test_f1: 0.5530
 epoch: 79, train_loss: 0.5372, test_loss: 1.7742, test_f1: 0.6050
 epoch: 80, train_loss: 0.5023, test_loss: 1.7610, test_f1: 0.5464
 epoch: 81, train_loss: 0.4931, test_loss: 1.5571, test_f1: 0.5874
 epoch: 82, train_loss: 0.5336, test_loss: 1.7554, test_f1: 0.5443
 epoch: 83, train_loss: 0.4856, test_loss: 1.6514, test_f1: 0.6145
 epoch: 84, train_loss: 0.4945, test_loss: 1.6964, test_f1: 0.5911
 epoch: 85, train_loss: 0.5024, test_loss: 1.7264, test_f1: 0.6229
 epoch: 86, train_loss: 0.4805, test_loss: 1.7041, test_f1: 0.6028
 epoch: 87, train_loss: 0.4981, test_loss: 1.7961, test_f1: 0.5247
 epoch: 88, train_loss: 0.4761, test_loss: 1.7994, test_f1: 0.5584
 epoch: 89, train_loss: 0.4547, test_loss: 1.7920, test_f1: 0.6184
 epoch: 90, train_loss: 0.4806, test_loss: 1.8439, test_f1: 0.6277
 epoch: 91, train_loss: 0.4825, test_loss: 2.4714, test_f1: 0.4279
 epoch: 92, train_loss: 0.5002, test_loss: 1.7244, test_f1: 0.6022
 epoch: 93, train_loss: 0.4381, test_loss: 1.9123, test_f1: 0.6143
 epoch: 94, train_loss: 0.4796, test_loss: 2.0405, test_f1: 0.5672
 epoch: 95, train_loss: 0.4322, test_loss: 2.1807, test_f1: 0.5986
 epoch: 96, train_loss: 0.4304, test_loss: 2.1792, test_f1: 0.6142
 epoch: 97, train_loss: 0.4638, test_loss: 2.1026, test_f1: 0.5946
 epoch: 98, train_loss: 0.4773, test_loss: 1.8808, test_f1: 0.6410
 epoch: 99, train_loss: 0.5145, test_loss: 1.9396, test_f1: 0.5694
##################ITERATION #3 ****************************************
 epoch: 0, train_loss: 1.2728, test_loss: 1.3216, test_f1: 0.1605
 epoch: 1, train_loss: 1.0673, test_loss: 1.1299, test_f1: 0.3982
 epoch: 2, train_loss: 1.0428, test_loss: 1.2885, test_f1: 0.3823
 epoch: 3, train_loss: 1.0175, test_loss: 1.1497, test_f1: 0.4230
 epoch: 4, train_loss: 0.9768, test_loss: 1.0734, test_f1: 0.4260
 epoch: 5, train_loss: 0.9247, test_loss: 1.0664, test_f1: 0.5040
 epoch: 6, train_loss: 0.9058, test_loss: 1.0835, test_f1: 0.5240
 epoch: 7, train_loss: 0.9179, test_loss: 1.1605, test_f1: 0.4514
 epoch: 8, train_loss: 0.9128, test_loss: 1.0461, test_f1: 0.5273
 epoch: 9, train_loss: 0.8936, test_loss: 1.0520, test_f1: 0.5604
 epoch: 10, train_loss: 0.8767, test_loss: 1.1543, test_f1: 0.5090
 epoch: 11, train_loss: 0.8560, test_loss: 1.0300, test_f1: 0.5356
 epoch: 12, train_loss: 0.8420, test_loss: 1.0468, test_f1: 0.5660
 epoch: 13, train_loss: 0.8317, test_loss: 1.1072, test_f1: 0.4672
 epoch: 14, train_loss: 0.8310, test_loss: 1.1658, test_f1: 0.5188
 epoch: 15, train_loss: 0.8575, test_loss: 1.1165, test_f1: 0.5020
 epoch: 16, train_loss: 0.8102, test_loss: 1.1030, test_f1: 0.5355
 epoch: 17, train_loss: 0.7714, test_loss: 1.2843, test_f1: 0.5370
 epoch: 18, train_loss: 0.7633, test_loss: 1.2484, test_f1: 0.5268
 epoch: 19, train_loss: 0.8134, test_loss: 1.1656, test_f1: 0.5453
 epoch: 20, train_loss: 0.7934, test_loss: 1.0435, test_f1: 0.5887
 epoch: 21, train_loss: 0.7562, test_loss: 1.0938, test_f1: 0.5546
 epoch: 22, train_loss: 0.7490, test_loss: 1.0958, test_f1: 0.5704
 epoch: 23, train_loss: 0.7600, test_loss: 1.1943, test_f1: 0.5018
 epoch: 24, train_loss: 0.7488, test_loss: 1.1301, test_f1: 0.5657
 epoch: 25, train_loss: 0.7534, test_loss: 1.1977, test_f1: 0.5846
 epoch: 26, train_loss: 0.7825, test_loss: 1.1315, test_f1: 0.5324
 epoch: 27, train_loss: 0.7408, test_loss: 1.2159, test_f1: 0.5324
 epoch: 28, train_loss: 0.7216, test_loss: 1.1087, test_f1: 0.6142
 epoch: 29, train_loss: 0.7205, test_loss: 1.1414, test_f1: 0.5677
 epoch: 30, train_loss: 0.7139, test_loss: 1.2729, test_f1: 0.5676
 epoch: 31, train_loss: 0.6956, test_loss: 1.2545, test_f1: 0.5243
 epoch: 32, train_loss: 0.7150, test_loss: 1.2421, test_f1: 0.5587
 epoch: 33, train_loss: 0.6878, test_loss: 1.2495, test_f1: 0.4838
 epoch: 34, train_loss: 0.6773, test_loss: 1.2672, test_f1: 0.5216
 epoch: 35, train_loss: 0.7072, test_loss: 1.2712, test_f1: 0.5337
 epoch: 36, train_loss: 0.6974, test_loss: 1.1614, test_f1: 0.5082
 epoch: 37, train_loss: 0.6769, test_loss: 1.2825, test_f1: 0.5475
 epoch: 38, train_loss: 0.6649, test_loss: 1.2815, test_f1: 0.5089
 epoch: 39, train_loss: 0.6492, test_loss: 1.3271, test_f1: 0.5674
 epoch: 40, train_loss: 0.6438, test_loss: 1.1667, test_f1: 0.5465
 epoch: 41, train_loss: 0.6658, test_loss: 1.5788, test_f1: 0.5507
 epoch: 42, train_loss: 0.6626, test_loss: 1.3048, test_f1: 0.5457
 epoch: 43, train_loss: 0.6344, test_loss: 1.5072, test_f1: 0.5722
 epoch: 44, train_loss: 0.6165, test_loss: 1.3764, test_f1: 0.5368
 epoch: 45, train_loss: 0.6447, test_loss: 1.3243, test_f1: 0.5487
 epoch: 46, train_loss: 0.6670, test_loss: 1.1225, test_f1: 0.6015
 epoch: 47, train_loss: 0.6418, test_loss: 1.2004, test_f1: 0.5955
 epoch: 48, train_loss: 0.6110, test_loss: 1.3486, test_f1: 0.5640
 epoch: 49, train_loss: 0.6197, test_loss: 1.1946, test_f1: 0.6076
 epoch: 50, train_loss: 0.6072, test_loss: 1.5318, test_f1: 0.5736
 epoch: 51, train_loss: 0.6118, test_loss: 1.4014, test_f1: 0.6000
 epoch: 52, train_loss: 0.5601, test_loss: 1.4636, test_f1: 0.5847
 epoch: 53, train_loss: 0.5350, test_loss: 1.4300, test_f1: 0.5798
 epoch: 54, train_loss: 0.5438, test_loss: 1.4683, test_f1: 0.6004
 epoch: 55, train_loss: 0.5254, test_loss: 1.3236, test_f1: 0.6469
 epoch: 56, train_loss: 0.5256, test_loss: 1.4095, test_f1: 0.6153
 epoch: 57, train_loss: 0.5762, test_loss: 1.5222, test_f1: 0.5516
 epoch: 58, train_loss: 0.5408, test_loss: 1.5385, test_f1: 0.5448
 epoch: 59, train_loss: 0.5140, test_loss: 1.5996, test_f1: 0.5697
 epoch: 60, train_loss: 0.4988, test_loss: 1.5691, test_f1: 0.6063
 epoch: 61, train_loss: 0.5001, test_loss: 1.5372, test_f1: 0.5860
 epoch: 62, train_loss: 0.5038, test_loss: 1.7172, test_f1: 0.5334
 epoch: 63, train_loss: 0.5190, test_loss: 1.5127, test_f1: 0.5738
 epoch: 64, train_loss: 0.5221, test_loss: 1.4440, test_f1: 0.6187
 epoch: 65, train_loss: 0.4929, test_loss: 1.5500, test_f1: 0.5314
 epoch: 66, train_loss: 0.4922, test_loss: 1.5189, test_f1: 0.5667
 epoch: 67, train_loss: 0.5050, test_loss: 1.5867, test_f1: 0.5469
 epoch: 68, train_loss: 0.5436, test_loss: 1.4189, test_f1: 0.6266
 epoch: 69, train_loss: 0.4786, test_loss: 1.7695, test_f1: 0.6136
 epoch: 70, train_loss: 0.5323, test_loss: 1.4471, test_f1: 0.6054
 epoch: 71, train_loss: 0.4929, test_loss: 1.4560, test_f1: 0.6007
 epoch: 72, train_loss: 0.4813, test_loss: 1.4400, test_f1: 0.6136
 epoch: 73, train_loss: 0.4661, test_loss: 1.4688, test_f1: 0.5647
 epoch: 74, train_loss: 0.4783, test_loss: 1.3826, test_f1: 0.6154
 epoch: 75, train_loss: 0.4426, test_loss: 1.6998, test_f1: 0.5840
 epoch: 76, train_loss: 0.4414, test_loss: 1.5158, test_f1: 0.6152
 epoch: 77, train_loss: 0.4566, test_loss: 1.3224, test_f1: 0.6394
 epoch: 78, train_loss: 0.4415, test_loss: 1.5616, test_f1: 0.5952
 epoch: 79, train_loss: 0.4461, test_loss: 1.4538, test_f1: 0.5726
 epoch: 80, train_loss: 0.4378, test_loss: 1.6257, test_f1: 0.5996
 epoch: 81, train_loss: 0.4308, test_loss: 1.7157, test_f1: 0.5617
 epoch: 82, train_loss: 0.4365, test_loss: 1.9306, test_f1: 0.5960
 epoch: 83, train_loss: 0.4103, test_loss: 1.7381, test_f1: 0.5886
 epoch: 84, train_loss: 0.4612, test_loss: 1.7824, test_f1: 0.5776
 epoch: 85, train_loss: 0.4820, test_loss: 1.6301, test_f1: 0.5825
 epoch: 86, train_loss: 0.4221, test_loss: 1.7726, test_f1: 0.5990
 epoch: 87, train_loss: 0.4445, test_loss: 1.7301, test_f1: 0.5526
 epoch: 88, train_loss: 0.4193, test_loss: 1.8854, test_f1: 0.5565
 epoch: 89, train_loss: 0.4388, test_loss: 2.1451, test_f1: 0.5563
 epoch: 90, train_loss: 0.4329, test_loss: 1.9397, test_f1: 0.5763
 epoch: 91, train_loss: 0.3898, test_loss: 1.7598, test_f1: 0.5797
 epoch: 92, train_loss: 0.4182, test_loss: 2.0822, test_f1: 0.5978
 epoch: 93, train_loss: 0.4027, test_loss: 1.8610, test_f1: 0.5740
 epoch: 94, train_loss: 0.4502, test_loss: 1.8600, test_f1: 0.5847
 epoch: 95, train_loss: 0.4788, test_loss: 1.7181, test_f1: 0.5470
 epoch: 96, train_loss: 0.4310, test_loss: 1.9351, test_f1: 0.5719
 epoch: 97, train_loss: 0.4158, test_loss: 1.9244, test_f1: 0.5555
 epoch: 98, train_loss: 0.4008, test_loss: 1.7964, test_f1: 0.6237
 epoch: 99, train_loss: 0.3979, test_loss: 1.8167, test_f1: 0.5738
##################ITERATION #4 ****************************************
 epoch: 0, train_loss: 1.2586, test_loss: 1.3103, test_f1: 0.1877
 epoch: 1, train_loss: 1.1068, test_loss: 1.1424, test_f1: 0.4275
 epoch: 2, train_loss: 1.0474, test_loss: 1.1387, test_f1: 0.4955
 epoch: 3, train_loss: 1.0197, test_loss: 1.1153, test_f1: 0.4518
 epoch: 4, train_loss: 0.9969, test_loss: 1.1171, test_f1: 0.3916
 epoch: 5, train_loss: 0.9837, test_loss: 1.0684, test_f1: 0.5108
 epoch: 6, train_loss: 0.9557, test_loss: 1.0722, test_f1: 0.5186
 epoch: 7, train_loss: 0.9343, test_loss: 1.0928, test_f1: 0.5098
 epoch: 8, train_loss: 0.9422, test_loss: 1.1163, test_f1: 0.5321
 epoch: 9, train_loss: 0.9455, test_loss: 1.0409, test_f1: 0.5073
 epoch: 10, train_loss: 0.9400, test_loss: 1.2241, test_f1: 0.4831
 epoch: 11, train_loss: 0.9314, test_loss: 1.0702, test_f1: 0.4990
 epoch: 12, train_loss: 0.9063, test_loss: 1.0239, test_f1: 0.5183
 epoch: 13, train_loss: 0.9075, test_loss: 1.0847, test_f1: 0.5418
 epoch: 14, train_loss: 0.9025, test_loss: 1.0506, test_f1: 0.5295
 epoch: 15, train_loss: 0.9480, test_loss: 1.2451, test_f1: 0.4329
 epoch: 16, train_loss: 0.9418, test_loss: 0.9914, test_f1: 0.5426
 epoch: 17, train_loss: 0.9001, test_loss: 1.0123, test_f1: 0.5684
 epoch: 18, train_loss: 0.8905, test_loss: 1.1014, test_f1: 0.5006
 epoch: 19, train_loss: 0.8929, test_loss: 1.0112, test_f1: 0.5670
 epoch: 20, train_loss: 0.8732, test_loss: 1.0774, test_f1: 0.5802
 epoch: 21, train_loss: 0.8649, test_loss: 1.0365, test_f1: 0.5676
 epoch: 22, train_loss: 0.8595, test_loss: 1.0211, test_f1: 0.5822
 epoch: 23, train_loss: 0.8539, test_loss: 1.0481, test_f1: 0.5961
 epoch: 24, train_loss: 0.8373, test_loss: 1.0962, test_f1: 0.4831
 epoch: 25, train_loss: 0.8496, test_loss: 1.1258, test_f1: 0.5290
 epoch: 26, train_loss: 0.8365, test_loss: 1.0811, test_f1: 0.4923
 epoch: 27, train_loss: 0.8028, test_loss: 1.1593, test_f1: 0.5443
 epoch: 28, train_loss: 0.8046, test_loss: 1.1561, test_f1: 0.5863
 epoch: 29, train_loss: 0.8096, test_loss: 1.0447, test_f1: 0.5581
 epoch: 30, train_loss: 0.8086, test_loss: 1.3505, test_f1: 0.5058
 epoch: 31, train_loss: 0.8084, test_loss: 1.0103, test_f1: 0.5068
 epoch: 32, train_loss: 0.7675, test_loss: 1.0635, test_f1: 0.5583
 epoch: 33, train_loss: 0.7612, test_loss: 1.2226, test_f1: 0.5378
 epoch: 34, train_loss: 0.7501, test_loss: 1.0885, test_f1: 0.5892
 epoch: 35, train_loss: 0.7513, test_loss: 1.2981, test_f1: 0.5368
 epoch: 36, train_loss: 0.7455, test_loss: 1.2956, test_f1: 0.4689
 epoch: 37, train_loss: 0.7127, test_loss: 1.1192, test_f1: 0.6168
 epoch: 38, train_loss: 0.7453, test_loss: 1.3818, test_f1: 0.4831
 epoch: 39, train_loss: 0.7547, test_loss: 1.1266, test_f1: 0.4994
 epoch: 40, train_loss: 0.7178, test_loss: 1.1912, test_f1: 0.5705
 epoch: 41, train_loss: 0.7006, test_loss: 1.3309, test_f1: 0.5842
 epoch: 42, train_loss: 0.6635, test_loss: 1.1579, test_f1: 0.6265
 epoch: 43, train_loss: 0.6815, test_loss: 1.2976, test_f1: 0.5789
 epoch: 44, train_loss: 0.6860, test_loss: 1.2776, test_f1: 0.5609
 epoch: 45, train_loss: 0.6625, test_loss: 1.4172, test_f1: 0.5660
 epoch: 46, train_loss: 0.7046, test_loss: 1.3974, test_f1: 0.4825
 epoch: 47, train_loss: 0.6957, test_loss: 1.2507, test_f1: 0.4567
 epoch: 48, train_loss: 0.6867, test_loss: 1.2097, test_f1: 0.5761
 epoch: 49, train_loss: 0.6819, test_loss: 1.5089, test_f1: 0.5283
 epoch: 50, train_loss: 0.6598, test_loss: 1.2933, test_f1: 0.6228
 epoch: 51, train_loss: 0.6296, test_loss: 1.1496, test_f1: 0.5481
 epoch: 52, train_loss: 0.6169, test_loss: 1.2293, test_f1: 0.5873
 epoch: 53, train_loss: 0.5944, test_loss: 1.2563, test_f1: 0.5837
 epoch: 54, train_loss: 0.5780, test_loss: 1.2701, test_f1: 0.5671
 epoch: 55, train_loss: 0.5757, test_loss: 1.2188, test_f1: 0.5955
 epoch: 56, train_loss: 0.5631, test_loss: 1.3080, test_f1: 0.5900
 epoch: 57, train_loss: 0.5479, test_loss: 1.3113, test_f1: 0.6039
 epoch: 58, train_loss: 0.5807, test_loss: 1.3593, test_f1: 0.5790
 epoch: 59, train_loss: 0.5731, test_loss: 1.4284, test_f1: 0.5716
 epoch: 60, train_loss: 0.5735, test_loss: 1.2828, test_f1: 0.6027
 epoch: 61, train_loss: 0.5754, test_loss: 1.5073, test_f1: 0.6006
 epoch: 62, train_loss: 0.5790, test_loss: 1.2656, test_f1: 0.5949
 epoch: 63, train_loss: 0.5576, test_loss: 1.3849, test_f1: 0.5838
 epoch: 64, train_loss: 0.5713, test_loss: 1.4101, test_f1: 0.5627
 epoch: 65, train_loss: 0.5538, test_loss: 1.4691, test_f1: 0.5873
 epoch: 66, train_loss: 0.5489, test_loss: 1.4916, test_f1: 0.5710
 epoch: 67, train_loss: 0.5357, test_loss: 1.4564, test_f1: 0.6147
 epoch: 68, train_loss: 0.5209, test_loss: 1.3448, test_f1: 0.5677
 epoch: 69, train_loss: 0.5179, test_loss: 1.7015, test_f1: 0.6228
 epoch: 70, train_loss: 0.5237, test_loss: 1.5060, test_f1: 0.5941
 epoch: 71, train_loss: 0.5198, test_loss: 1.6259, test_f1: 0.6031
 epoch: 72, train_loss: 0.5191, test_loss: 1.5920, test_f1: 0.6133
 epoch: 73, train_loss: 0.5226, test_loss: 1.6649, test_f1: 0.5958
 epoch: 74, train_loss: 0.4981, test_loss: 1.5707, test_f1: 0.6128
 epoch: 75, train_loss: 0.5277, test_loss: 1.7317, test_f1: 0.6202
 epoch: 76, train_loss: 0.5183, test_loss: 1.4823, test_f1: 0.5555
 epoch: 77, train_loss: 0.4841, test_loss: 1.7440, test_f1: 0.6108
 epoch: 78, train_loss: 0.5076, test_loss: 1.6416, test_f1: 0.5860
 epoch: 79, train_loss: 0.4787, test_loss: 1.5967, test_f1: 0.5940
 epoch: 80, train_loss: 0.4993, test_loss: 1.5439, test_f1: 0.5887
 epoch: 81, train_loss: 0.4832, test_loss: 1.7379, test_f1: 0.5695
 epoch: 82, train_loss: 0.4716, test_loss: 1.6166, test_f1: 0.5941
 epoch: 83, train_loss: 0.4845, test_loss: 1.8075, test_f1: 0.5921
 epoch: 84, train_loss: 0.4712, test_loss: 1.8863, test_f1: 0.6091
 epoch: 85, train_loss: 0.5083, test_loss: 1.8089, test_f1: 0.5995
 epoch: 86, train_loss: 0.5122, test_loss: 1.4854, test_f1: 0.5656
 epoch: 87, train_loss: 0.4927, test_loss: 1.5170, test_f1: 0.6159
 epoch: 88, train_loss: 0.4972, test_loss: 1.7572, test_f1: 0.6004
 epoch: 89, train_loss: 0.4994, test_loss: 1.4740, test_f1: 0.6318
 epoch: 90, train_loss: 0.4726, test_loss: 1.5597, test_f1: 0.6106
 epoch: 91, train_loss: 0.4616, test_loss: 1.6931, test_f1: 0.6291
 epoch: 92, train_loss: 0.4777, test_loss: 1.5553, test_f1: 0.6328
 epoch: 93, train_loss: 0.4499, test_loss: 1.7309, test_f1: 0.5904
 epoch: 94, train_loss: 0.4551, test_loss: 1.6348, test_f1: 0.6074
 epoch: 95, train_loss: 0.4675, test_loss: 1.5820, test_f1: 0.6030
 epoch: 96, train_loss: 0.4600, test_loss: 1.7339, test_f1: 0.6149
 epoch: 97, train_loss: 0.4265, test_loss: 1.7926, test_f1: 0.5896
 epoch: 98, train_loss: 0.4365, test_loss: 2.3274, test_f1: 0.5986
 epoch: 99, train_loss: 0.4465, test_loss: 2.0741, test_f1: 0.6055
##################ITERATION #5 ****************************************
 epoch: 0, train_loss: 1.2474, test_loss: 1.5427, test_f1: 0.2887
 epoch: 1, train_loss: 1.0858, test_loss: 1.1429, test_f1: 0.4732
 epoch: 2, train_loss: 1.0516, test_loss: 1.1122, test_f1: 0.5007
 epoch: 3, train_loss: 1.0093, test_loss: 1.1225, test_f1: 0.4975
 epoch: 4, train_loss: 1.0016, test_loss: 1.1158, test_f1: 0.4632
 epoch: 5, train_loss: 0.9773, test_loss: 1.0767, test_f1: 0.5087
 epoch: 6, train_loss: 0.9703, test_loss: 1.1210, test_f1: 0.4750
 epoch: 7, train_loss: 0.9678, test_loss: 1.1053, test_f1: 0.5189
 epoch: 8, train_loss: 0.9555, test_loss: 1.0635, test_f1: 0.4702
 epoch: 9, train_loss: 0.9445, test_loss: 1.0992, test_f1: 0.4860
 epoch: 10, train_loss: 0.9256, test_loss: 1.0524, test_f1: 0.5253
 epoch: 11, train_loss: 0.9320, test_loss: 1.0888, test_f1: 0.5277
 epoch: 12, train_loss: 0.8956, test_loss: 1.0626, test_f1: 0.5358
 epoch: 13, train_loss: 0.8989, test_loss: 1.0870, test_f1: 0.5109
 epoch: 14, train_loss: 0.9322, test_loss: 1.1127, test_f1: 0.4465
 epoch: 15, train_loss: 0.9103, test_loss: 1.0353, test_f1: 0.5209
 epoch: 16, train_loss: 0.8993, test_loss: 1.0359, test_f1: 0.5217
 epoch: 17, train_loss: 0.8737, test_loss: 1.1186, test_f1: 0.5450
 epoch: 18, train_loss: 0.8494, test_loss: 1.1184, test_f1: 0.5678
 epoch: 19, train_loss: 0.8638, test_loss: 1.0799, test_f1: 0.5277
 epoch: 20, train_loss: 0.8416, test_loss: 0.9800, test_f1: 0.5223
 epoch: 21, train_loss: 0.8466, test_loss: 1.2237, test_f1: 0.4109
 epoch: 22, train_loss: 0.8597, test_loss: 1.1215, test_f1: 0.4990
 epoch: 23, train_loss: 0.8176, test_loss: 1.4465, test_f1: 0.4091
 epoch: 24, train_loss: 0.8483, test_loss: 1.1350, test_f1: 0.4116
 epoch: 25, train_loss: 0.8421, test_loss: 1.0418, test_f1: 0.5358
 epoch: 26, train_loss: 0.8399, test_loss: 1.0677, test_f1: 0.5239
 epoch: 27, train_loss: 0.8040, test_loss: 1.0174, test_f1: 0.5544
 epoch: 28, train_loss: 0.7982, test_loss: 1.0057, test_f1: 0.5591
 epoch: 29, train_loss: 0.7986, test_loss: 1.0040, test_f1: 0.6330
 epoch: 30, train_loss: 0.7758, test_loss: 1.0253, test_f1: 0.5575
 epoch: 31, train_loss: 0.7582, test_loss: 1.0368, test_f1: 0.5367
 epoch: 32, train_loss: 0.7739, test_loss: 1.0233, test_f1: 0.6118
 epoch: 33, train_loss: 0.7705, test_loss: 1.0994, test_f1: 0.5119
 epoch: 34, train_loss: 0.7525, test_loss: 1.0654, test_f1: 0.5998
 epoch: 35, train_loss: 0.7537, test_loss: 1.1137, test_f1: 0.5416
 epoch: 36, train_loss: 0.7335, test_loss: 1.2911, test_f1: 0.4902
 epoch: 37, train_loss: 0.7159, test_loss: 1.1706, test_f1: 0.5366
 epoch: 38, train_loss: 0.7627, test_loss: 1.1916, test_f1: 0.5096
 epoch: 39, train_loss: 0.7359, test_loss: 1.0427, test_f1: 0.5894
 epoch: 40, train_loss: 0.7040, test_loss: 1.2801, test_f1: 0.5247
 epoch: 41, train_loss: 0.7265, test_loss: 1.1691, test_f1: 0.5571
 epoch: 42, train_loss: 0.7279, test_loss: 1.2588, test_f1: 0.5142
 epoch: 43, train_loss: 0.7231, test_loss: 1.1341, test_f1: 0.5541
 epoch: 44, train_loss: 0.7601, test_loss: 1.1039, test_f1: 0.5766
 epoch: 45, train_loss: 0.6871, test_loss: 1.1087, test_f1: 0.5838
 epoch: 46, train_loss: 0.7108, test_loss: 1.0816, test_f1: 0.5895
 epoch: 47, train_loss: 0.7039, test_loss: 1.0040, test_f1: 0.6149
 epoch: 48, train_loss: 0.6720, test_loss: 1.1940, test_f1: 0.6141
 epoch: 49, train_loss: 0.6528, test_loss: 1.0502, test_f1: 0.6007
 epoch: 50, train_loss: 0.6770, test_loss: 1.3016, test_f1: 0.5778
 epoch: 51, train_loss: 0.6367, test_loss: 1.0798, test_f1: 0.6260
 epoch: 52, train_loss: 0.6498, test_loss: 1.1279, test_f1: 0.6055
 epoch: 53, train_loss: 0.6396, test_loss: 1.1578, test_f1: 0.6023
 epoch: 54, train_loss: 0.6126, test_loss: 1.1579, test_f1: 0.5659
 epoch: 55, train_loss: 0.6009, test_loss: 1.2889, test_f1: 0.5517
 epoch: 56, train_loss: 0.5959, test_loss: 1.2885, test_f1: 0.5751
 epoch: 57, train_loss: 0.6070, test_loss: 1.2599, test_f1: 0.5606
 epoch: 58, train_loss: 0.5762, test_loss: 1.3654, test_f1: 0.5390
 epoch: 59, train_loss: 0.5823, test_loss: 1.4985, test_f1: 0.5555
 epoch: 60, train_loss: 0.5520, test_loss: 1.2897, test_f1: 0.5884
 epoch: 61, train_loss: 0.5752, test_loss: 1.4224, test_f1: 0.5867
 epoch: 62, train_loss: 0.5778, test_loss: 1.2247, test_f1: 0.5918
 epoch: 63, train_loss: 0.5524, test_loss: 1.4976, test_f1: 0.5484
 epoch: 64, train_loss: 0.5609, test_loss: 2.0347, test_f1: 0.5335
 epoch: 65, train_loss: 0.5514, test_loss: 1.5832, test_f1: 0.5700
 epoch: 66, train_loss: 0.5452, test_loss: 1.3499, test_f1: 0.5901
 epoch: 67, train_loss: 0.5363, test_loss: 1.2361, test_f1: 0.5853
 epoch: 68, train_loss: 0.5546, test_loss: 1.5486, test_f1: 0.5624
 epoch: 69, train_loss: 0.5577, test_loss: 1.2419, test_f1: 0.5835
 epoch: 70, train_loss: 0.5392, test_loss: 1.4118, test_f1: 0.5651
 epoch: 71, train_loss: 0.5303, test_loss: 1.3872, test_f1: 0.5681
 epoch: 72, train_loss: 0.5376, test_loss: 1.5097, test_f1: 0.5676
 epoch: 73, train_loss: 0.5364, test_loss: 1.5183, test_f1: 0.5754
 epoch: 74, train_loss: 0.5472, test_loss: 1.1824, test_f1: 0.6062
 epoch: 75, train_loss: 0.5709, test_loss: 1.6892, test_f1: 0.5819
 epoch: 76, train_loss: 0.5390, test_loss: 1.7580, test_f1: 0.5773
 epoch: 77, train_loss: 0.5385, test_loss: 1.7766, test_f1: 0.5981
 epoch: 78, train_loss: 0.5135, test_loss: 1.6942, test_f1: 0.6028
 epoch: 79, train_loss: 0.5186, test_loss: 1.4505, test_f1: 0.6016
 epoch: 80, train_loss: 0.5124, test_loss: 1.9310, test_f1: 0.6097
 epoch: 81, train_loss: 0.5070, test_loss: 1.7059, test_f1: 0.6092
 epoch: 82, train_loss: 0.5016, test_loss: 1.5865, test_f1: 0.5797
 epoch: 83, train_loss: 0.5243, test_loss: 1.7762, test_f1: 0.5787
 epoch: 84, train_loss: 0.5105, test_loss: 1.5690, test_f1: 0.5607
 epoch: 85, train_loss: 0.5532, test_loss: 1.4418, test_f1: 0.5899
 epoch: 86, train_loss: 0.5262, test_loss: 1.6570, test_f1: 0.6018
 epoch: 87, train_loss: 0.4956, test_loss: 1.2990, test_f1: 0.6090
 epoch: 88, train_loss: 0.5139, test_loss: 1.3152, test_f1: 0.6101
 epoch: 89, train_loss: 0.5152, test_loss: 1.3206, test_f1: 0.6238
 epoch: 90, train_loss: 0.4993, test_loss: 1.5091, test_f1: 0.6071
 epoch: 91, train_loss: 0.4695, test_loss: 1.4639, test_f1: 0.5900
 epoch: 92, train_loss: 0.4890, test_loss: 1.6173, test_f1: 0.6153
 epoch: 93, train_loss: 0.4835, test_loss: 1.8276, test_f1: 0.5988
 epoch: 94, train_loss: 0.4875, test_loss: 1.9002, test_f1: 0.5978
 epoch: 95, train_loss: 0.5061, test_loss: 2.0711, test_f1: 0.5944
 epoch: 96, train_loss: 0.4723, test_loss: 1.6031, test_f1: 0.5664
 epoch: 97, train_loss: 0.4879, test_loss: 1.7280, test_f1: 0.6116
 epoch: 98, train_loss: 0.5193, test_loss: 1.3546, test_f1: 0.6074
 epoch: 99, train_loss: 0.4720, test_loss: 1.5222, test_f1: 0.6471
##################ITERATION #6 ****************************************
 epoch: 0, train_loss: 1.3464, test_loss: 1.1772, test_f1: 0.3527
 epoch: 1, train_loss: 1.1299, test_loss: 1.1332, test_f1: 0.4244
 epoch: 2, train_loss: 1.1021, test_loss: 1.1075, test_f1: 0.4693
 epoch: 3, train_loss: 1.0585, test_loss: 1.1739, test_f1: 0.4377
 epoch: 4, train_loss: 1.0260, test_loss: 1.0909, test_f1: 0.4679
 epoch: 5, train_loss: 1.0072, test_loss: 1.1420, test_f1: 0.4637
 epoch: 6, train_loss: 0.9866, test_loss: 1.0972, test_f1: 0.4922
 epoch: 7, train_loss: 0.9509, test_loss: 1.0240, test_f1: 0.5319
 epoch: 8, train_loss: 0.9341, test_loss: 1.0745, test_f1: 0.5033
 epoch: 9, train_loss: 0.9410, test_loss: 1.1317, test_f1: 0.5162
 epoch: 10, train_loss: 0.9481, test_loss: 1.0321, test_f1: 0.4958
 epoch: 11, train_loss: 0.9258, test_loss: 1.1471, test_f1: 0.4470
 epoch: 12, train_loss: 0.9233, test_loss: 1.2051, test_f1: 0.4613
 epoch: 13, train_loss: 0.9309, test_loss: 1.0974, test_f1: 0.5131
 epoch: 14, train_loss: 0.9336, test_loss: 1.0177, test_f1: 0.5443
 epoch: 15, train_loss: 0.9056, test_loss: 1.1498, test_f1: 0.4044
 epoch: 16, train_loss: 0.9040, test_loss: 1.0975, test_f1: 0.5194
 epoch: 17, train_loss: 0.8897, test_loss: 1.1262, test_f1: 0.4733
 epoch: 18, train_loss: 0.8815, test_loss: 1.1477, test_f1: 0.4898
 epoch: 19, train_loss: 0.8655, test_loss: 1.0585, test_f1: 0.5424
 epoch: 20, train_loss: 0.8515, test_loss: 1.0286, test_f1: 0.5346
 epoch: 21, train_loss: 0.8522, test_loss: 1.0393, test_f1: 0.5514
 epoch: 22, train_loss: 0.8954, test_loss: 1.1192, test_f1: 0.5620
 epoch: 23, train_loss: 0.8614, test_loss: 1.0516, test_f1: 0.5523
 epoch: 24, train_loss: 0.8811, test_loss: 1.1285, test_f1: 0.5519
 epoch: 25, train_loss: 0.8318, test_loss: 1.2002, test_f1: 0.4851
 epoch: 26, train_loss: 0.8415, test_loss: 1.4580, test_f1: 0.3546
 epoch: 27, train_loss: 0.8719, test_loss: 1.3039, test_f1: 0.4040
 epoch: 28, train_loss: 0.8547, test_loss: 1.1069, test_f1: 0.5768
 epoch: 29, train_loss: 0.8273, test_loss: 1.1028, test_f1: 0.5456
 epoch: 30, train_loss: 0.8213, test_loss: 1.0637, test_f1: 0.5210
 epoch: 31, train_loss: 0.7921, test_loss: 1.1216, test_f1: 0.5516
 epoch: 32, train_loss: 0.8224, test_loss: 1.1181, test_f1: 0.5530
 epoch: 33, train_loss: 0.7787, test_loss: 1.1579, test_f1: 0.5516
 epoch: 34, train_loss: 0.7695, test_loss: 1.1712, test_f1: 0.5558
 epoch: 35, train_loss: 0.7775, test_loss: 1.3158, test_f1: 0.5497
 epoch: 36, train_loss: 0.7698, test_loss: 1.1101, test_f1: 0.5346
 epoch: 37, train_loss: 0.7710, test_loss: 1.2391, test_f1: 0.5432
 epoch: 38, train_loss: 0.7418, test_loss: 1.0955, test_f1: 0.5962
 epoch: 39, train_loss: 0.7357, test_loss: 1.5089, test_f1: 0.4938
 epoch: 40, train_loss: 0.7179, test_loss: 1.1461, test_f1: 0.5626
 epoch: 41, train_loss: 0.7046, test_loss: 1.2168, test_f1: 0.5426
 epoch: 42, train_loss: 0.6994, test_loss: 1.2369, test_f1: 0.5928
 epoch: 43, train_loss: 0.6951, test_loss: 1.2799, test_f1: 0.5163
 epoch: 44, train_loss: 0.7199, test_loss: 1.1879, test_f1: 0.5696
 epoch: 45, train_loss: 0.7102, test_loss: 1.1980, test_f1: 0.5899
 epoch: 46, train_loss: 0.7310, test_loss: 1.2664, test_f1: 0.5412
 epoch: 47, train_loss: 0.7197, test_loss: 1.2475, test_f1: 0.5352
 epoch: 48, train_loss: 0.7146, test_loss: 1.3917, test_f1: 0.5532
 epoch: 49, train_loss: 0.6917, test_loss: 1.4676, test_f1: 0.5366
 epoch: 50, train_loss: 0.6916, test_loss: 1.2506, test_f1: 0.5729
 epoch: 51, train_loss: 0.6478, test_loss: 1.2440, test_f1: 0.6162
 epoch: 52, train_loss: 0.6309, test_loss: 1.2877, test_f1: 0.6259
 epoch: 53, train_loss: 0.6231, test_loss: 1.2727, test_f1: 0.6120
 epoch: 54, train_loss: 0.6010, test_loss: 1.1499, test_f1: 0.5896
 epoch: 55, train_loss: 0.6095, test_loss: 1.3588, test_f1: 0.6227
 epoch: 56, train_loss: 0.5960, test_loss: 1.3483, test_f1: 0.6113
 epoch: 57, train_loss: 0.6049, test_loss: 1.5330, test_f1: 0.5929
 epoch: 58, train_loss: 0.6086, test_loss: 1.5188, test_f1: 0.6073
 epoch: 59, train_loss: 0.6116, test_loss: 1.2520, test_f1: 0.5482
 epoch: 60, train_loss: 0.6101, test_loss: 1.2051, test_f1: 0.6110
 epoch: 61, train_loss: 0.5893, test_loss: 1.3670, test_f1: 0.6089
 epoch: 62, train_loss: 0.5800, test_loss: 1.4090, test_f1: 0.6035
 epoch: 63, train_loss: 0.5901, test_loss: 1.3972, test_f1: 0.6081
 epoch: 64, train_loss: 0.5812, test_loss: 1.6101, test_f1: 0.6046
 epoch: 65, train_loss: 0.5821, test_loss: 1.3954, test_f1: 0.5951
 epoch: 66, train_loss: 0.5635, test_loss: 1.5194, test_f1: 0.6273
 epoch: 67, train_loss: 0.5595, test_loss: 1.3982, test_f1: 0.5803
 epoch: 68, train_loss: 0.5661, test_loss: 1.5303, test_f1: 0.5714
 epoch: 69, train_loss: 0.5736, test_loss: 1.5109, test_f1: 0.5579
 epoch: 70, train_loss: 0.5658, test_loss: 1.2577, test_f1: 0.6367
 epoch: 71, train_loss: 0.5507, test_loss: 1.3556, test_f1: 0.6054
 epoch: 72, train_loss: 0.5638, test_loss: 1.5204, test_f1: 0.6040
 epoch: 73, train_loss: 0.5529, test_loss: 1.2064, test_f1: 0.6055
 epoch: 74, train_loss: 0.5328, test_loss: 1.2450, test_f1: 0.6167
 epoch: 75, train_loss: 0.5265, test_loss: 1.5297, test_f1: 0.6082
 epoch: 76, train_loss: 0.5457, test_loss: 1.8760, test_f1: 0.5868
 epoch: 77, train_loss: 0.5510, test_loss: 1.4313, test_f1: 0.6357
 epoch: 78, train_loss: 0.5275, test_loss: 1.3958, test_f1: 0.6174
 epoch: 79, train_loss: 0.5359, test_loss: 1.5201, test_f1: 0.6089
 epoch: 80, train_loss: 0.5101, test_loss: 1.5964, test_f1: 0.6009
 epoch: 81, train_loss: 0.5214, test_loss: 1.6096, test_f1: 0.6162
 epoch: 82, train_loss: 0.5186, test_loss: 1.6273, test_f1: 0.5732
 epoch: 83, train_loss: 0.5455, test_loss: 1.4852, test_f1: 0.5992
 epoch: 84, train_loss: 0.5371, test_loss: 1.7228, test_f1: 0.6265
 epoch: 85, train_loss: 0.5161, test_loss: 1.4009, test_f1: 0.6273
 epoch: 86, train_loss: 0.5206, test_loss: 1.9877, test_f1: 0.5353
 epoch: 87, train_loss: 0.5253, test_loss: 1.3962, test_f1: 0.6353
 epoch: 88, train_loss: 0.4780, test_loss: 1.6749, test_f1: 0.6173
 epoch: 89, train_loss: 0.4769, test_loss: 1.6260, test_f1: 0.5919
 epoch: 90, train_loss: 0.5007, test_loss: 1.5736, test_f1: 0.6210
 epoch: 91, train_loss: 0.4972, test_loss: 1.7154, test_f1: 0.6047
 epoch: 92, train_loss: 0.5034, test_loss: 1.8124, test_f1: 0.5322
 epoch: 93, train_loss: 0.5200, test_loss: 1.5656, test_f1: 0.6228
 epoch: 94, train_loss: 0.4759, test_loss: 1.7655, test_f1: 0.6030
 epoch: 95, train_loss: 0.4776, test_loss: 1.6212, test_f1: 0.5607
 epoch: 96, train_loss: 0.4789, test_loss: 1.6219, test_f1: 0.6446
 epoch: 97, train_loss: 0.4620, test_loss: 1.7739, test_f1: 0.6143
 epoch: 98, train_loss: 0.4446, test_loss: 1.7904, test_f1: 0.6084
 epoch: 99, train_loss: 0.4717, test_loss: 1.9007, test_f1: 0.5843
##################ITERATION #7 ****************************************
 epoch: 0, train_loss: 1.2330, test_loss: 1.2747, test_f1: 0.2281
 epoch: 1, train_loss: 1.0884, test_loss: 1.2643, test_f1: 0.3430
 epoch: 2, train_loss: 1.0303, test_loss: 1.1161, test_f1: 0.4007
 epoch: 3, train_loss: 0.9991, test_loss: 1.0592, test_f1: 0.4052
 epoch: 4, train_loss: 0.9742, test_loss: 1.0805, test_f1: 0.4984
 epoch: 5, train_loss: 0.9527, test_loss: 1.1070, test_f1: 0.4618
 epoch: 6, train_loss: 0.9429, test_loss: 1.1188, test_f1: 0.4877
 epoch: 7, train_loss: 0.9386, test_loss: 1.1257, test_f1: 0.4899
 epoch: 8, train_loss: 0.9330, test_loss: 1.0869, test_f1: 0.5232
 epoch: 9, train_loss: 0.8942, test_loss: 1.1356, test_f1: 0.4739
 epoch: 10, train_loss: 0.8822, test_loss: 1.2274, test_f1: 0.5192
 epoch: 11, train_loss: 0.9145, test_loss: 1.1167, test_f1: 0.4336
 epoch: 12, train_loss: 0.8772, test_loss: 1.1923, test_f1: 0.5197
 epoch: 13, train_loss: 0.8724, test_loss: 1.1492, test_f1: 0.5434
 epoch: 14, train_loss: 0.8487, test_loss: 1.1610, test_f1: 0.5548
 epoch: 15, train_loss: 0.8581, test_loss: 1.1505, test_f1: 0.5658
 epoch: 16, train_loss: 0.8372, test_loss: 1.2003, test_f1: 0.4436
 epoch: 17, train_loss: 0.8254, test_loss: 1.0505, test_f1: 0.5718
 epoch: 18, train_loss: 0.8061, test_loss: 1.2313, test_f1: 0.5770
 epoch: 19, train_loss: 0.7839, test_loss: 1.1872, test_f1: 0.5638
 epoch: 20, train_loss: 0.8104, test_loss: 1.2316, test_f1: 0.5683
 epoch: 21, train_loss: 0.7836, test_loss: 1.1528, test_f1: 0.5910
 epoch: 22, train_loss: 0.7530, test_loss: 1.1027, test_f1: 0.5572
 epoch: 23, train_loss: 0.7828, test_loss: 1.0889, test_f1: 0.5905
 epoch: 24, train_loss: 0.7643, test_loss: 0.9926, test_f1: 0.6056
 epoch: 25, train_loss: 0.7978, test_loss: 1.2665, test_f1: 0.5724
 epoch: 26, train_loss: 0.7305, test_loss: 1.1708, test_f1: 0.5796
 epoch: 27, train_loss: 0.7494, test_loss: 1.3478, test_f1: 0.5657
 epoch: 28, train_loss: 0.7322, test_loss: 1.1550, test_f1: 0.5666
 epoch: 29, train_loss: 0.7238, test_loss: 1.1905, test_f1: 0.5782
 epoch: 30, train_loss: 0.7379, test_loss: 1.1286, test_f1: 0.5897
 epoch: 31, train_loss: 0.7281, test_loss: 1.1354, test_f1: 0.5820
 epoch: 32, train_loss: 0.7361, test_loss: 1.0556, test_f1: 0.5736
 epoch: 33, train_loss: 0.7175, test_loss: 1.2959, test_f1: 0.5818
 epoch: 34, train_loss: 0.7500, test_loss: 1.4894, test_f1: 0.4882
 epoch: 35, train_loss: 0.7159, test_loss: 1.0918, test_f1: 0.5829
 epoch: 36, train_loss: 0.6942, test_loss: 1.3622, test_f1: 0.5858
 epoch: 37, train_loss: 0.7304, test_loss: 1.1875, test_f1: 0.5649
 epoch: 38, train_loss: 0.7161, test_loss: 1.0508, test_f1: 0.5922
 epoch: 39, train_loss: 0.6779, test_loss: 1.1648, test_f1: 0.6298
 epoch: 40, train_loss: 0.6636, test_loss: 1.2196, test_f1: 0.6103
 epoch: 41, train_loss: 0.6753, test_loss: 1.1223, test_f1: 0.5754
 epoch: 42, train_loss: 0.7012, test_loss: 1.2962, test_f1: 0.5436
 epoch: 43, train_loss: 0.6656, test_loss: 1.2053, test_f1: 0.5274
 epoch: 44, train_loss: 0.6616, test_loss: 1.2368, test_f1: 0.5863
 epoch: 45, train_loss: 0.6806, test_loss: 1.3389, test_f1: 0.5418
 epoch: 46, train_loss: 0.6642, test_loss: 1.2265, test_f1: 0.6025
 epoch: 47, train_loss: 0.6590, test_loss: 1.2005, test_f1: 0.6052
 epoch: 48, train_loss: 0.6305, test_loss: 1.2189, test_f1: 0.6066
 epoch: 49, train_loss: 0.6344, test_loss: 1.3975, test_f1: 0.5590
 epoch: 50, train_loss: 0.6305, test_loss: 1.1572, test_f1: 0.5980
 epoch: 51, train_loss: 0.6040, test_loss: 1.2368, test_f1: 0.5963
 epoch: 52, train_loss: 0.5777, test_loss: 1.2631, test_f1: 0.6107
 epoch: 53, train_loss: 0.5809, test_loss: 1.2920, test_f1: 0.6157
 epoch: 54, train_loss: 0.5798, test_loss: 1.3159, test_f1: 0.5750
 epoch: 55, train_loss: 0.5806, test_loss: 1.3953, test_f1: 0.5705
 epoch: 56, train_loss: 0.5820, test_loss: 1.2373, test_f1: 0.5980
 epoch: 57, train_loss: 0.5492, test_loss: 1.3008, test_f1: 0.6033
 epoch: 58, train_loss: 0.5406, test_loss: 1.3613, test_f1: 0.6201
 epoch: 59, train_loss: 0.5210, test_loss: 1.4753, test_f1: 0.5892
 epoch: 60, train_loss: 0.5720, test_loss: 1.3198, test_f1: 0.6241
 epoch: 61, train_loss: 0.5418, test_loss: 1.5092, test_f1: 0.5987
 epoch: 62, train_loss: 0.5510, test_loss: 1.4954, test_f1: 0.5843
 epoch: 63, train_loss: 0.5386, test_loss: 1.4776, test_f1: 0.6029
 epoch: 64, train_loss: 0.5225, test_loss: 1.4749, test_f1: 0.6056
 epoch: 65, train_loss: 0.5129, test_loss: 1.5534, test_f1: 0.6239
 epoch: 66, train_loss: 0.5317, test_loss: 1.5416, test_f1: 0.5955
 epoch: 67, train_loss: 0.5248, test_loss: 1.5472, test_f1: 0.5633
 epoch: 68, train_loss: 0.5213, test_loss: 1.6283, test_f1: 0.5702
 epoch: 69, train_loss: 0.5409, test_loss: 1.4512, test_f1: 0.5799
 epoch: 70, train_loss: 0.5380, test_loss: 1.4481, test_f1: 0.6177
 epoch: 71, train_loss: 0.5269, test_loss: 1.6112, test_f1: 0.5949
 epoch: 72, train_loss: 0.5341, test_loss: 1.4659, test_f1: 0.5875
 epoch: 73, train_loss: 0.5062, test_loss: 1.4678, test_f1: 0.5893
 epoch: 74, train_loss: 0.5052, test_loss: 1.6495, test_f1: 0.6057
 epoch: 75, train_loss: 0.5261, test_loss: 1.4879, test_f1: 0.6247
 epoch: 76, train_loss: 0.4735, test_loss: 1.5515, test_f1: 0.6056
 epoch: 77, train_loss: 0.4759, test_loss: 1.5644, test_f1: 0.6111
 epoch: 78, train_loss: 0.4862, test_loss: 1.5068, test_f1: 0.6286
 epoch: 79, train_loss: 0.4990, test_loss: 1.7155, test_f1: 0.5827
 epoch: 80, train_loss: 0.4736, test_loss: 1.6609, test_f1: 0.5936
 epoch: 81, train_loss: 0.4731, test_loss: 1.6638, test_f1: 0.5906
 epoch: 82, train_loss: 0.5009, test_loss: 1.7221, test_f1: 0.6057
 epoch: 83, train_loss: 0.5061, test_loss: 1.7765, test_f1: 0.5887
 epoch: 84, train_loss: 0.5182, test_loss: 1.6474, test_f1: 0.6213
 epoch: 85, train_loss: 0.4786, test_loss: 1.6345, test_f1: 0.6099
 epoch: 86, train_loss: 0.4622, test_loss: 1.6868, test_f1: 0.6132
 epoch: 87, train_loss: 0.4617, test_loss: 1.5202, test_f1: 0.6371
 epoch: 88, train_loss: 0.4650, test_loss: 1.7280, test_f1: 0.6135
 epoch: 89, train_loss: 0.4882, test_loss: 1.6615, test_f1: 0.6004
 epoch: 90, train_loss: 0.4897, test_loss: 1.6489, test_f1: 0.6275
 epoch: 91, train_loss: 0.4376, test_loss: 1.8483, test_f1: 0.5912
 epoch: 92, train_loss: 0.4754, test_loss: 1.6889, test_f1: 0.6067
 epoch: 93, train_loss: 0.4429, test_loss: 1.7719, test_f1: 0.5932
 epoch: 94, train_loss: 0.4330, test_loss: 1.9731, test_f1: 0.5985
 epoch: 95, train_loss: 0.4344, test_loss: 1.7442, test_f1: 0.6099
 epoch: 96, train_loss: 0.4837, test_loss: 1.9592, test_f1: 0.5941
 epoch: 97, train_loss: 0.4516, test_loss: 1.6592, test_f1: 0.6197
 epoch: 98, train_loss: 0.4566, test_loss: 1.8385, test_f1: 0.6309
 epoch: 99, train_loss: 0.4547, test_loss: 1.6105, test_f1: 0.6040
##################ITERATION #8 ****************************************
 epoch: 0, train_loss: 1.2666, test_loss: 1.3931, test_f1: 0.3535
 epoch: 1, train_loss: 1.0703, test_loss: 1.1469, test_f1: 0.4902
 epoch: 2, train_loss: 1.0289, test_loss: 1.0872, test_f1: 0.4856
 epoch: 3, train_loss: 0.9887, test_loss: 1.0793, test_f1: 0.5223
 epoch: 4, train_loss: 0.9682, test_loss: 1.0240, test_f1: 0.5382
 epoch: 5, train_loss: 0.9615, test_loss: 1.0405, test_f1: 0.5498
 epoch: 6, train_loss: 0.9352, test_loss: 1.0182, test_f1: 0.5454
 epoch: 7, train_loss: 0.9182, test_loss: 1.0671, test_f1: 0.5528
 epoch: 8, train_loss: 0.9140, test_loss: 1.0342, test_f1: 0.5374
 epoch: 9, train_loss: 0.9264, test_loss: 1.2559, test_f1: 0.4904
 epoch: 10, train_loss: 0.9192, test_loss: 1.0319, test_f1: 0.5831
 epoch: 11, train_loss: 0.8987, test_loss: 1.1381, test_f1: 0.5034
 epoch: 12, train_loss: 0.9230, test_loss: 1.0715, test_f1: 0.5040
 epoch: 13, train_loss: 0.8634, test_loss: 1.1210, test_f1: 0.5431
 epoch: 14, train_loss: 0.8614, test_loss: 1.1182, test_f1: 0.5572
 epoch: 15, train_loss: 0.8466, test_loss: 1.0908, test_f1: 0.5700
 epoch: 16, train_loss: 0.8670, test_loss: 1.0500, test_f1: 0.5393
 epoch: 17, train_loss: 0.8836, test_loss: 1.1239, test_f1: 0.5107
 epoch: 18, train_loss: 0.8316, test_loss: 1.1478, test_f1: 0.5281
 epoch: 19, train_loss: 0.8423, test_loss: 1.1007, test_f1: 0.5658
 epoch: 20, train_loss: 0.8258, test_loss: 1.3442, test_f1: 0.4933
 epoch: 21, train_loss: 0.8382, test_loss: 1.1209, test_f1: 0.5284
 epoch: 22, train_loss: 0.8115, test_loss: 1.3523, test_f1: 0.4671
 epoch: 23, train_loss: 0.8129, test_loss: 1.1747, test_f1: 0.5211
 epoch: 24, train_loss: 0.7834, test_loss: 1.1681, test_f1: 0.5400
 epoch: 25, train_loss: 0.7813, test_loss: 1.1934, test_f1: 0.5454
 epoch: 26, train_loss: 0.7593, test_loss: 1.1476, test_f1: 0.5428
 epoch: 27, train_loss: 0.7747, test_loss: 1.2128, test_f1: 0.5345
 epoch: 28, train_loss: 0.7797, test_loss: 1.1171, test_f1: 0.5447
 epoch: 29, train_loss: 0.7458, test_loss: 1.2252, test_f1: 0.5489
 epoch: 30, train_loss: 0.7344, test_loss: 1.1805, test_f1: 0.5226
 epoch: 31, train_loss: 0.7523, test_loss: 1.2347, test_f1: 0.5669
 epoch: 32, train_loss: 0.7420, test_loss: 1.5393, test_f1: 0.5090
 epoch: 33, train_loss: 0.7656, test_loss: 1.0843, test_f1: 0.5501
 epoch: 34, train_loss: 0.7223, test_loss: 1.3041, test_f1: 0.5144
 epoch: 35, train_loss: 0.7184, test_loss: 1.2895, test_f1: 0.5811
 epoch: 36, train_loss: 0.7130, test_loss: 1.2355, test_f1: 0.5751
 epoch: 37, train_loss: 0.7063, test_loss: 1.1905, test_f1: 0.5970
 epoch: 38, train_loss: 0.7070, test_loss: 1.2147, test_f1: 0.5771
 epoch: 39, train_loss: 0.7028, test_loss: 1.3566, test_f1: 0.5688
 epoch: 40, train_loss: 0.7072, test_loss: 1.2726, test_f1: 0.6227
 epoch: 41, train_loss: 0.6826, test_loss: 1.3373, test_f1: 0.5896
 epoch: 42, train_loss: 0.7079, test_loss: 1.4692, test_f1: 0.5751
 epoch: 43, train_loss: 0.6903, test_loss: 1.1842, test_f1: 0.5165
 epoch: 44, train_loss: 0.7058, test_loss: 1.2192, test_f1: 0.5422
 epoch: 45, train_loss: 0.6999, test_loss: 1.1601, test_f1: 0.6080
 epoch: 46, train_loss: 0.6801, test_loss: 1.4020, test_f1: 0.5690
 epoch: 47, train_loss: 0.6476, test_loss: 1.2913, test_f1: 0.5286
 epoch: 48, train_loss: 0.6485, test_loss: 1.2845, test_f1: 0.5749
 epoch: 49, train_loss: 0.6609, test_loss: 1.2776, test_f1: 0.6212
 epoch: 50, train_loss: 0.6435, test_loss: 1.5470, test_f1: 0.5477
 epoch: 51, train_loss: 0.6170, test_loss: 1.2988, test_f1: 0.5573
 epoch: 52, train_loss: 0.6154, test_loss: 1.5322, test_f1: 0.5333
 epoch: 53, train_loss: 0.5899, test_loss: 1.3987, test_f1: 0.5616
 epoch: 54, train_loss: 0.5762, test_loss: 1.3542, test_f1: 0.5719
 epoch: 55, train_loss: 0.5904, test_loss: 1.3254, test_f1: 0.5960
 epoch: 56, train_loss: 0.5983, test_loss: 1.5407, test_f1: 0.5731
 epoch: 57, train_loss: 0.5853, test_loss: 1.5165, test_f1: 0.5782
 epoch: 58, train_loss: 0.5695, test_loss: 1.5283, test_f1: 0.5740
 epoch: 59, train_loss: 0.5827, test_loss: 1.3120, test_f1: 0.6194
 epoch: 60, train_loss: 0.6038, test_loss: 1.4435, test_f1: 0.5388
 epoch: 61, train_loss: 0.5863, test_loss: 1.4189, test_f1: 0.6125
 epoch: 62, train_loss: 0.5501, test_loss: 1.4274, test_f1: 0.6164
 epoch: 63, train_loss: 0.5543, test_loss: 1.6719, test_f1: 0.5663
 epoch: 64, train_loss: 0.5522, test_loss: 1.5486, test_f1: 0.6376
 epoch: 65, train_loss: 0.5691, test_loss: 1.5772, test_f1: 0.5272
 epoch: 66, train_loss: 0.5605, test_loss: 1.7664, test_f1: 0.5796
 epoch: 67, train_loss: 0.5823, test_loss: 1.5936, test_f1: 0.6255
 epoch: 68, train_loss: 0.5409, test_loss: 1.5491, test_f1: 0.5952
 epoch: 69, train_loss: 0.5696, test_loss: 1.5710, test_f1: 0.5903
 epoch: 70, train_loss: 0.5701, test_loss: 1.6683, test_f1: 0.5723
 epoch: 71, train_loss: 0.5613, test_loss: 1.5361, test_f1: 0.5675
 epoch: 72, train_loss: 0.5121, test_loss: 1.9446, test_f1: 0.5759
 epoch: 73, train_loss: 0.5582, test_loss: 1.4602, test_f1: 0.6062
 epoch: 74, train_loss: 0.5266, test_loss: 1.6669, test_f1: 0.6048
 epoch: 75, train_loss: 0.5418, test_loss: 1.6394, test_f1: 0.5722
 epoch: 76, train_loss: 0.5206, test_loss: 1.8843, test_f1: 0.5458
 epoch: 77, train_loss: 0.5013, test_loss: 1.6615, test_f1: 0.6262
 epoch: 78, train_loss: 0.5289, test_loss: 1.5617, test_f1: 0.6150
 epoch: 79, train_loss: 0.5321, test_loss: 1.6186, test_f1: 0.5798
 epoch: 80, train_loss: 0.4979, test_loss: 1.5921, test_f1: 0.5956
 epoch: 81, train_loss: 0.5012, test_loss: 1.8467, test_f1: 0.6112
 epoch: 82, train_loss: 0.4845, test_loss: 1.9517, test_f1: 0.5719
 epoch: 83, train_loss: 0.4876, test_loss: 1.6288, test_f1: 0.6313
 epoch: 84, train_loss: 0.5254, test_loss: 1.5551, test_f1: 0.5487
 epoch: 85, train_loss: 0.5132, test_loss: 1.7163, test_f1: 0.5776
 epoch: 86, train_loss: 0.5004, test_loss: 1.5328, test_f1: 0.5663
 epoch: 87, train_loss: 0.4655, test_loss: 1.6465, test_f1: 0.5903
 epoch: 88, train_loss: 0.4888, test_loss: 1.7735, test_f1: 0.6305
 epoch: 89, train_loss: 0.5087, test_loss: 1.7987, test_f1: 0.5602
 epoch: 90, train_loss: 0.4858, test_loss: 1.7724, test_f1: 0.6003
 epoch: 91, train_loss: 0.4662, test_loss: 1.6696, test_f1: 0.5927
 epoch: 92, train_loss: 0.4791, test_loss: 1.5091, test_f1: 0.6086
 epoch: 93, train_loss: 0.5041, test_loss: 2.0836, test_f1: 0.5620
 epoch: 94, train_loss: 0.4831, test_loss: 1.7362, test_f1: 0.5905
 epoch: 95, train_loss: 0.4995, test_loss: 1.6646, test_f1: 0.5225
 epoch: 96, train_loss: 0.5029, test_loss: 1.7336, test_f1: 0.6188
 epoch: 97, train_loss: 0.4542, test_loss: 1.4473, test_f1: 0.5937
 epoch: 98, train_loss: 0.4713, test_loss: 1.6401, test_f1: 0.5812
 epoch: 99, train_loss: 0.4778, test_loss: 1.4736, test_f1: 0.5830
##################ITERATION #9 ****************************************
 epoch: 0, train_loss: 1.2570, test_loss: 1.4718, test_f1: 0.1908
 epoch: 1, train_loss: 1.0620, test_loss: 1.2625, test_f1: 0.4161
 epoch: 2, train_loss: 1.0544, test_loss: 1.0905, test_f1: 0.4800
 epoch: 3, train_loss: 0.9761, test_loss: 1.1979, test_f1: 0.4399
 epoch: 4, train_loss: 0.9910, test_loss: 1.1564, test_f1: 0.4455
 epoch: 5, train_loss: 0.9659, test_loss: 1.1291, test_f1: 0.4623
 epoch: 6, train_loss: 0.9602, test_loss: 1.0996, test_f1: 0.4914
 epoch: 7, train_loss: 0.9567, test_loss: 1.0717, test_f1: 0.5194
 epoch: 8, train_loss: 0.9483, test_loss: 1.1551, test_f1: 0.4693
 epoch: 9, train_loss: 0.9528, test_loss: 1.0492, test_f1: 0.5034
 epoch: 10, train_loss: 0.9339, test_loss: 1.0635, test_f1: 0.5273
 epoch: 11, train_loss: 0.9299, test_loss: 1.0247, test_f1: 0.5175
 epoch: 12, train_loss: 0.9023, test_loss: 1.0209, test_f1: 0.5781
 epoch: 13, train_loss: 0.9058, test_loss: 1.0457, test_f1: 0.5220
 epoch: 14, train_loss: 0.9030, test_loss: 1.0009, test_f1: 0.5131
 epoch: 15, train_loss: 0.8706, test_loss: 1.0595, test_f1: 0.5765
 epoch: 16, train_loss: 0.8878, test_loss: 1.0964, test_f1: 0.5404
 epoch: 17, train_loss: 0.8838, test_loss: 1.0464, test_f1: 0.5603
 epoch: 18, train_loss: 0.8890, test_loss: 1.0835, test_f1: 0.5556
 epoch: 19, train_loss: 0.8502, test_loss: 1.0584, test_f1: 0.5648
 epoch: 20, train_loss: 0.8396, test_loss: 1.0571, test_f1: 0.5647
 epoch: 21, train_loss: 0.8575, test_loss: 1.1334, test_f1: 0.5664
 epoch: 22, train_loss: 0.8285, test_loss: 1.0429, test_f1: 0.5158
 epoch: 23, train_loss: 0.8679, test_loss: 1.1073, test_f1: 0.5750
 epoch: 24, train_loss: 0.8393, test_loss: 1.0556, test_f1: 0.4643
 epoch: 25, train_loss: 0.8273, test_loss: 1.2240, test_f1: 0.5477
 epoch: 26, train_loss: 0.8023, test_loss: 1.0086, test_f1: 0.5777
 epoch: 27, train_loss: 0.8010, test_loss: 1.2602, test_f1: 0.5376
 epoch: 28, train_loss: 0.8479, test_loss: 1.0829, test_f1: 0.5501
 epoch: 29, train_loss: 0.8269, test_loss: 0.9848, test_f1: 0.5823
 epoch: 30, train_loss: 0.8056, test_loss: 1.1412, test_f1: 0.5753
 epoch: 31, train_loss: 0.7964, test_loss: 6.5466, test_f1: 0.2287
 epoch: 32, train_loss: 0.9773, test_loss: 1.0948, test_f1: 0.5362
 epoch: 33, train_loss: 0.8548, test_loss: 1.0313, test_f1: 0.5442
 epoch: 34, train_loss: 0.8454, test_loss: 1.0339, test_f1: 0.5756
 epoch: 35, train_loss: 0.8326, test_loss: 1.0733, test_f1: 0.5103
 epoch: 36, train_loss: 0.8231, test_loss: 1.0540, test_f1: 0.5868
 epoch: 37, train_loss: 0.7945, test_loss: 1.0219, test_f1: 0.5775
 epoch: 38, train_loss: 0.7730, test_loss: 1.0533, test_f1: 0.6040
 epoch: 39, train_loss: 0.7803, test_loss: 1.0802, test_f1: 0.5387
 epoch: 40, train_loss: 0.7757, test_loss: 1.1191, test_f1: 0.5358
 epoch: 41, train_loss: 0.7714, test_loss: 1.0874, test_f1: 0.5650
 epoch: 42, train_loss: 0.7635, test_loss: 1.0774, test_f1: 0.5763
 epoch: 43, train_loss: 0.7698, test_loss: 1.2378, test_f1: 0.5044
 epoch: 44, train_loss: 0.7774, test_loss: 0.9856, test_f1: 0.5891
 epoch: 45, train_loss: 0.7556, test_loss: 1.0130, test_f1: 0.5777
 epoch: 46, train_loss: 0.7463, test_loss: 1.1406, test_f1: 0.5562
 epoch: 47, train_loss: 0.7212, test_loss: 1.0875, test_f1: 0.5687
 epoch: 48, train_loss: 0.7270, test_loss: 1.2383, test_f1: 0.5861
 epoch: 49, train_loss: 0.7178, test_loss: 1.1261, test_f1: 0.5849
 epoch: 50, train_loss: 0.7399, test_loss: 1.1724, test_f1: 0.5528
 epoch: 51, train_loss: 0.7139, test_loss: 1.0730, test_f1: 0.5640
 epoch: 52, train_loss: 0.6833, test_loss: 1.1207, test_f1: 0.5840
 epoch: 53, train_loss: 0.6663, test_loss: 1.1431, test_f1: 0.5807
 epoch: 54, train_loss: 0.6706, test_loss: 1.0773, test_f1: 0.6284
 epoch: 55, train_loss: 0.6623, test_loss: 1.2817, test_f1: 0.5000
 epoch: 56, train_loss: 0.6560, test_loss: 1.1506, test_f1: 0.5919
 epoch: 57, train_loss: 0.6426, test_loss: 1.1372, test_f1: 0.5850
 epoch: 58, train_loss: 0.6664, test_loss: 1.3665, test_f1: 0.5462
 epoch: 59, train_loss: 0.6648, test_loss: 1.2561, test_f1: 0.5796
 epoch: 60, train_loss: 0.6415, test_loss: 1.0822, test_f1: 0.6215
 epoch: 61, train_loss: 0.6512, test_loss: 1.1315, test_f1: 0.5993
 epoch: 62, train_loss: 0.6532, test_loss: 1.3299, test_f1: 0.5599
 epoch: 63, train_loss: 0.6379, test_loss: 1.1435, test_f1: 0.6081
 epoch: 64, train_loss: 0.6408, test_loss: 1.1949, test_f1: 0.5856
 epoch: 65, train_loss: 0.6147, test_loss: 1.2789, test_f1: 0.5591
 epoch: 66, train_loss: 0.6206, test_loss: 1.2730, test_f1: 0.5958
 epoch: 67, train_loss: 0.6171, test_loss: 1.1882, test_f1: 0.5704
 epoch: 68, train_loss: 0.6076, test_loss: 1.2042, test_f1: 0.6202
 epoch: 69, train_loss: 0.6068, test_loss: 1.3642, test_f1: 0.5891
 epoch: 70, train_loss: 0.6330, test_loss: 1.2046, test_f1: 0.5942
 epoch: 71, train_loss: 0.6141, test_loss: 1.3673, test_f1: 0.5957
 epoch: 72, train_loss: 0.6069, test_loss: 1.2547, test_f1: 0.5679
 epoch: 73, train_loss: 0.5974, test_loss: 1.2103, test_f1: 0.6125
 epoch: 74, train_loss: 0.5912, test_loss: 1.3185, test_f1: 0.6086
 epoch: 75, train_loss: 0.5926, test_loss: 1.3672, test_f1: 0.6096
 epoch: 76, train_loss: 0.6004, test_loss: 1.3868, test_f1: 0.6122
 epoch: 77, train_loss: 0.5764, test_loss: 1.3921, test_f1: 0.5901
 epoch: 78, train_loss: 0.6152, test_loss: 1.2895, test_f1: 0.6138
 epoch: 79, train_loss: 0.5958, test_loss: 1.3973, test_f1: 0.5719
 epoch: 80, train_loss: 0.5814, test_loss: 1.2917, test_f1: 0.5961
 epoch: 81, train_loss: 0.5917, test_loss: 1.2360, test_f1: 0.5772
 epoch: 82, train_loss: 0.5881, test_loss: 1.3009, test_f1: 0.5931
 epoch: 83, train_loss: 0.5815, test_loss: 1.3003, test_f1: 0.5990
 epoch: 84, train_loss: 0.5999, test_loss: 1.5124, test_f1: 0.5427
 epoch: 85, train_loss: 0.5974, test_loss: 1.3592, test_f1: 0.5103
 epoch: 86, train_loss: 0.5701, test_loss: 1.4124, test_f1: 0.6132
 epoch: 87, train_loss: 0.5667, test_loss: 1.4192, test_f1: 0.6168
 epoch: 88, train_loss: 0.5760, test_loss: 1.1244, test_f1: 0.6009
 epoch: 89, train_loss: 0.5836, test_loss: 1.5405, test_f1: 0.5671
 epoch: 90, train_loss: 0.5791, test_loss: 1.2548, test_f1: 0.6009
 epoch: 91, train_loss: 0.5456, test_loss: 1.5154, test_f1: 0.5108
 epoch: 92, train_loss: 0.5517, test_loss: 1.3425, test_f1: 0.6072
 epoch: 93, train_loss: 0.5599, test_loss: 1.4143, test_f1: 0.5696
 epoch: 94, train_loss: 0.6054, test_loss: 1.4553, test_f1: 0.6134
 epoch: 95, train_loss: 0.5728, test_loss: 1.1719, test_f1: 0.6395
 epoch: 96, train_loss: 0.5875, test_loss: 1.3375, test_f1: 0.5823
 epoch: 97, train_loss: 0.5545, test_loss: 1.2202, test_f1: 0.6079
 epoch: 98, train_loss: 0.5445, test_loss: 1.2883, test_f1: 0.5853
 epoch: 99, train_loss: 0.5443, test_loss: 1.4165, test_f1: 0.6054

Training completed in 487.18 seconds
Best F1: 0.6471 at epoch 99
Mean F1 across iterations: 0.6353  0.0120
========================FINAL RESULTS================================
FEGIN weighted F1: 0.6471  0.0120
python main.py --data ltspice_demos --representation component_net --model FEGIN --layers 5 --hiddens 32 --batch_size 64 --lr 0.01 --emb_size 512 --epochs 100 --save_appendix component_net_L5_H32_BS64_LR0.01_E512 --no_val
-----



STDERR:
  File "main.py", line 370, in <module>
    main()
  File "main.py", line 254, in main
    dataset = dataset_class(
  File "/home/philip/projects/ltspice_examples_code_repo/Circuit-Completion-Using-GNNs/component_classification_with_link_prediction_head/evaluation/FEGIN/kernel/circuit_datasets.py", line 15, in __init__
    self.data, self.slices = torch.load(self.processed_paths[0])
  File "/home/philip/.local/lib/python3.8/site-packages/torch/serialization.py", line 1040, in load
    warnings.warn(
  File "/usr/lib/python3.8/warnings.py", line 109, in _showwarnmsg
    sw(msg.message, msg.category, msg.filename, msg.lineno,
  File "main.py", line 47, in warn_with_traceback
    traceback.print_stack(file=log)
/home/philip/projects/ltspice_examples_code_repo/Circuit-Completion-Using-GNNs/component_classification_with_link_prediction_head/evaluation/FEGIN/kernel/circuit_datasets.py:15: FutureWarning: You are using `torch.load` with `weights_only=False` (the current default value), which uses the default pickle module implicitly. It is possible to construct malicious pickle data which will execute arbitrary code during unpickling (See https://github.com/pytorch/pytorch/blob/main/SECURITY.md#untrusted-models for more details). In a future release, the default value for `weights_only` will be flipped to `True`. This limits the functions that could be executed during unpickling. Arbitrary objects will no longer be allowed to be loaded via this mode unless they are explicitly allowlisted by the user via `torch.serialization.add_safe_globals`. We recommend you start setting `weights_only=True` for any use case where you don't have full control of the loaded file. Please open an issue on GitHub for any issues related to this experimental feature.
  self.data, self.slices = torch.load(self.processed_paths[0])
