STDOUT:
Results will be saved in /home/philip/projects/ltspice_examples_code_repo/Circuit-Completion-Using-GNNs/component_classification_with_link_prediction_head/evaluation/FEGIN/results/model_FEGIN_dataset_ltspice_examples
Command line input: python main.py --data ltspice_examples --representation component_pin --model FEGIN --layers 3 --hiddens 64 --batch_size 128 --lr 0.01 --emb_size 250 --epochs 100 --save_appendix component_pin_L3_H64_BS128_LR0.01_E250 --no_val
 is saved.
-----
ltspice_examples - FEGIN
Using 3 layers, 64 hidden units, h = 2
Loading component_pin representation dataset
ENTERED
Training FEGIN on component_pin representation
Train: 3560, Test: 848
##################ITERATION #0 ****************************************
 epoch: 0, train_loss: 1.1942, test_loss: 1.5718, test_f1: 0.2710
 epoch: 1, train_loss: 1.0451, test_loss: 1.0506, test_f1: 0.4428
 epoch: 2, train_loss: 1.0040, test_loss: 1.1973, test_f1: 0.3897
 epoch: 3, train_loss: 0.9697, test_loss: 1.0045, test_f1: 0.4972
 epoch: 4, train_loss: 0.9277, test_loss: 0.9886, test_f1: 0.4984
 epoch: 5, train_loss: 0.8977, test_loss: 0.9365, test_f1: 0.4899
 epoch: 6, train_loss: 0.8981, test_loss: 0.9833, test_f1: 0.4999
 epoch: 7, train_loss: 0.8761, test_loss: 0.9179, test_f1: 0.5509
 epoch: 8, train_loss: 0.8537, test_loss: 0.8292, test_f1: 0.5434
 epoch: 9, train_loss: 0.8274, test_loss: 1.0021, test_f1: 0.5219
 epoch: 10, train_loss: 0.8190, test_loss: 0.8853, test_f1: 0.5445
 epoch: 11, train_loss: 0.8169, test_loss: 0.9817, test_f1: 0.5078
 epoch: 12, train_loss: 0.7976, test_loss: 0.9429, test_f1: 0.5637
 epoch: 13, train_loss: 0.7791, test_loss: 1.0290, test_f1: 0.5287
 epoch: 14, train_loss: 0.7992, test_loss: 0.9719, test_f1: 0.4815
 epoch: 15, train_loss: 0.7744, test_loss: 0.9431, test_f1: 0.5264
 epoch: 16, train_loss: 0.7688, test_loss: 0.9850, test_f1: 0.4794
 epoch: 17, train_loss: 0.7587, test_loss: 0.8631, test_f1: 0.5488
 epoch: 18, train_loss: 0.7454, test_loss: 0.9365, test_f1: 0.5561
 epoch: 19, train_loss: 0.7457, test_loss: 0.9272, test_f1: 0.6047
 epoch: 20, train_loss: 0.7199, test_loss: 0.9845, test_f1: 0.6187
 epoch: 21, train_loss: 0.7284, test_loss: 0.8923, test_f1: 0.5670
 epoch: 22, train_loss: 0.7009, test_loss: 0.8499, test_f1: 0.5822
 epoch: 23, train_loss: 0.7054, test_loss: 1.0068, test_f1: 0.6292
 epoch: 24, train_loss: 0.6879, test_loss: 1.1809, test_f1: 0.5311
 epoch: 25, train_loss: 0.6878, test_loss: 1.0566, test_f1: 0.5386
 epoch: 26, train_loss: 0.6744, test_loss: 0.9838, test_f1: 0.5964
 epoch: 27, train_loss: 0.6626, test_loss: 1.1537, test_f1: 0.5904
 epoch: 28, train_loss: 0.6602, test_loss: 1.2924, test_f1: 0.4994
 epoch: 29, train_loss: 0.6615, test_loss: 2.4985, test_f1: 0.4677
 epoch: 30, train_loss: 0.6780, test_loss: 0.8131, test_f1: 0.6155
 epoch: 31, train_loss: 0.6602, test_loss: 1.1845, test_f1: 0.5648
 epoch: 32, train_loss: 0.6471, test_loss: 0.9350, test_f1: 0.6059
 epoch: 33, train_loss: 0.6202, test_loss: 1.1972, test_f1: 0.5779
 epoch: 34, train_loss: 0.6502, test_loss: 0.8307, test_f1: 0.5796
 epoch: 35, train_loss: 0.6256, test_loss: 0.8186, test_f1: 0.6008
 epoch: 36, train_loss: 0.6274, test_loss: 0.9334, test_f1: 0.5706
 epoch: 37, train_loss: 0.6069, test_loss: 0.8018, test_f1: 0.6062
 epoch: 38, train_loss: 0.6249, test_loss: 0.9549, test_f1: 0.5975
 epoch: 39, train_loss: 0.6342, test_loss: 1.0653, test_f1: 0.6099
 epoch: 40, train_loss: 0.5881, test_loss: 0.9054, test_f1: 0.5623
 epoch: 41, train_loss: 0.6131, test_loss: 1.0358, test_f1: 0.6278
 epoch: 42, train_loss: 0.5798, test_loss: 1.0458, test_f1: 0.6179
 epoch: 43, train_loss: 0.5819, test_loss: 0.9612, test_f1: 0.5875
 epoch: 44, train_loss: 0.5857, test_loss: 0.9139, test_f1: 0.5917
 epoch: 45, train_loss: 0.5931, test_loss: 1.0152, test_f1: 0.5769
 epoch: 46, train_loss: 0.5740, test_loss: 1.2772, test_f1: 0.5713
 epoch: 47, train_loss: 0.5543, test_loss: 1.0417, test_f1: 0.6281
 epoch: 48, train_loss: 0.5593, test_loss: 1.1570, test_f1: 0.5949
 epoch: 49, train_loss: 0.5543, test_loss: 1.0170, test_f1: 0.6000
 epoch: 50, train_loss: 0.5550, test_loss: 1.0123, test_f1: 0.6386
 epoch: 51, train_loss: 0.5065, test_loss: 1.0471, test_f1: 0.6424
 epoch: 52, train_loss: 0.4847, test_loss: 1.0777, test_f1: 0.6522
 epoch: 53, train_loss: 0.4720, test_loss: 1.2711, test_f1: 0.6309
 epoch: 54, train_loss: 0.4833, test_loss: 1.0760, test_f1: 0.6503
 epoch: 55, train_loss: 0.4824, test_loss: 0.9503, test_f1: 0.6236
 epoch: 56, train_loss: 0.4841, test_loss: 1.0401, test_f1: 0.6369
 epoch: 57, train_loss: 0.4495, test_loss: 1.1623, test_f1: 0.6192
 epoch: 58, train_loss: 0.4660, test_loss: 1.1122, test_f1: 0.6402
 epoch: 59, train_loss: 0.4592, test_loss: 1.1789, test_f1: 0.6239
 epoch: 60, train_loss: 0.4671, test_loss: 1.1818, test_f1: 0.5865
 epoch: 61, train_loss: 0.4680, test_loss: 1.1328, test_f1: 0.6198
 epoch: 62, train_loss: 0.4457, test_loss: 1.1512, test_f1: 0.6644
 epoch: 63, train_loss: 0.4172, test_loss: 1.1708, test_f1: 0.6406
 epoch: 64, train_loss: 0.4316, test_loss: 1.0525, test_f1: 0.6323
 epoch: 65, train_loss: 0.4408, test_loss: 1.1470, test_f1: 0.6604
 epoch: 66, train_loss: 0.4214, test_loss: 1.3285, test_f1: 0.5925
 epoch: 67, train_loss: 0.4416, test_loss: 1.1302, test_f1: 0.6552
 epoch: 68, train_loss: 0.4421, test_loss: 1.2305, test_f1: 0.6269
 epoch: 69, train_loss: 0.4167, test_loss: 1.2260, test_f1: 0.6398
 epoch: 70, train_loss: 0.4221, test_loss: 1.3727, test_f1: 0.6072
 epoch: 71, train_loss: 0.4204, test_loss: 1.2130, test_f1: 0.6220
 epoch: 72, train_loss: 0.4257, test_loss: 1.2974, test_f1: 0.6231
 epoch: 73, train_loss: 0.4210, test_loss: 1.2341, test_f1: 0.6450
 epoch: 74, train_loss: 0.4136, test_loss: 1.0225, test_f1: 0.6575
 epoch: 75, train_loss: 0.4032, test_loss: 1.1791, test_f1: 0.6423
 epoch: 76, train_loss: 0.4062, test_loss: 1.1156, test_f1: 0.6675
 epoch: 77, train_loss: 0.4136, test_loss: 1.2468, test_f1: 0.6262
 epoch: 78, train_loss: 0.3980, test_loss: 1.4685, test_f1: 0.6451
 epoch: 79, train_loss: 0.3937, test_loss: 1.4456, test_f1: 0.6409
 epoch: 80, train_loss: 0.3771, test_loss: 1.2778, test_f1: 0.6395
 epoch: 81, train_loss: 0.3781, test_loss: 1.3139, test_f1: 0.6398
 epoch: 82, train_loss: 0.3712, test_loss: 1.2376, test_f1: 0.6372
 epoch: 83, train_loss: 0.3657, test_loss: 1.2961, test_f1: 0.6382
 epoch: 84, train_loss: 0.3842, test_loss: 1.1396, test_f1: 0.6694
 epoch: 85, train_loss: 0.3848, test_loss: 1.2567, test_f1: 0.6614
 epoch: 86, train_loss: 0.3968, test_loss: 1.1497, test_f1: 0.6501
 epoch: 87, train_loss: 0.3691, test_loss: 1.2278, test_f1: 0.6560
 epoch: 88, train_loss: 0.3788, test_loss: 1.2495, test_f1: 0.6609
 epoch: 89, train_loss: 0.3660, test_loss: 1.1389, test_f1: 0.6604
 epoch: 90, train_loss: 0.3598, test_loss: 1.1964, test_f1: 0.6738
 epoch: 91, train_loss: 0.3623, test_loss: 1.4589, test_f1: 0.6207
 epoch: 92, train_loss: 0.3692, test_loss: 1.2858, test_f1: 0.6405
 epoch: 93, train_loss: 0.3699, test_loss: 1.4724, test_f1: 0.5941
 epoch: 94, train_loss: 0.3524, test_loss: 1.1765, test_f1: 0.6597
 epoch: 95, train_loss: 0.3587, test_loss: 1.6253, test_f1: 0.6097
 epoch: 96, train_loss: 0.3387, test_loss: 1.1657, test_f1: 0.6550
 epoch: 97, train_loss: 0.3415, test_loss: 1.4124, test_f1: 0.6432
 epoch: 98, train_loss: 0.3490, test_loss: 1.2909, test_f1: 0.6554
 epoch: 99, train_loss: 0.3479, test_loss: 1.1778, test_f1: 0.6655
##################ITERATION #1 ****************************************
 epoch: 0, train_loss: 1.1042, test_loss: 1.0362, test_f1: 0.4738
 epoch: 1, train_loss: 0.9782, test_loss: 1.1004, test_f1: 0.4385
 epoch: 2, train_loss: 0.9439, test_loss: 1.0223, test_f1: 0.4721
 epoch: 3, train_loss: 0.9221, test_loss: 0.9525, test_f1: 0.5246
 epoch: 4, train_loss: 0.8958, test_loss: 1.3585, test_f1: 0.4726
 epoch: 5, train_loss: 0.8936, test_loss: 1.0619, test_f1: 0.4754
 epoch: 6, train_loss: 0.8645, test_loss: 4.0746, test_f1: 0.2749
 epoch: 7, train_loss: 0.8755, test_loss: 0.8984, test_f1: 0.5927
 epoch: 8, train_loss: 0.8278, test_loss: 0.9482, test_f1: 0.5764
 epoch: 9, train_loss: 0.8176, test_loss: 0.8677, test_f1: 0.5179
 epoch: 10, train_loss: 0.8121, test_loss: 0.8607, test_f1: 0.5319
 epoch: 11, train_loss: 0.7915, test_loss: 0.8120, test_f1: 0.6224
 epoch: 12, train_loss: 0.7791, test_loss: 0.8618, test_f1: 0.5962
 epoch: 13, train_loss: 0.7820, test_loss: 0.8959, test_f1: 0.5269
 epoch: 14, train_loss: 0.7632, test_loss: 0.7915, test_f1: 0.5915
 epoch: 15, train_loss: 0.7282, test_loss: 0.9255, test_f1: 0.6039
 epoch: 16, train_loss: 0.7444, test_loss: 1.0024, test_f1: 0.5257
 epoch: 17, train_loss: 0.7259, test_loss: 0.8180, test_f1: 0.6302
 epoch: 18, train_loss: 0.6871, test_loss: 0.7929, test_f1: 0.5794
 epoch: 19, train_loss: 0.7127, test_loss: 0.9596, test_f1: 0.6084
 epoch: 20, train_loss: 0.7069, test_loss: 0.9077, test_f1: 0.5531
 epoch: 21, train_loss: 0.7081, test_loss: 0.8932, test_f1: 0.5934
 epoch: 22, train_loss: 0.6682, test_loss: 0.9103, test_f1: 0.6215
 epoch: 23, train_loss: 0.6604, test_loss: 0.9575, test_f1: 0.5730
 epoch: 24, train_loss: 0.6625, test_loss: 0.8923, test_f1: 0.6204
 epoch: 25, train_loss: 0.6633, test_loss: 0.9116, test_f1: 0.6448
 epoch: 26, train_loss: 0.6747, test_loss: 0.9051, test_f1: 0.5955
 epoch: 27, train_loss: 0.6636, test_loss: 0.8829, test_f1: 0.6450
 epoch: 28, train_loss: 0.6498, test_loss: 0.8869, test_f1: 0.6101
 epoch: 29, train_loss: 0.6555, test_loss: 0.8385, test_f1: 0.6312
 epoch: 30, train_loss: 0.6229, test_loss: 0.9162, test_f1: 0.5947
 epoch: 31, train_loss: 0.6275, test_loss: 1.0095, test_f1: 0.6178
 epoch: 32, train_loss: 0.6294, test_loss: 0.8180, test_f1: 0.6117
 epoch: 33, train_loss: 0.6142, test_loss: 0.9672, test_f1: 0.6041
 epoch: 34, train_loss: 0.5933, test_loss: 0.8965, test_f1: 0.6281
 epoch: 35, train_loss: 0.5794, test_loss: 1.1464, test_f1: 0.5459
 epoch: 36, train_loss: 0.5788, test_loss: 1.0059, test_f1: 0.6024
 epoch: 37, train_loss: 0.5923, test_loss: 0.8621, test_f1: 0.5945
 epoch: 38, train_loss: 0.6019, test_loss: 1.0609, test_f1: 0.5838
 epoch: 39, train_loss: 0.5644, test_loss: 0.7921, test_f1: 0.6360
 epoch: 40, train_loss: 0.5603, test_loss: 1.0774, test_f1: 0.6315
 epoch: 41, train_loss: 0.5767, test_loss: 0.9937, test_f1: 0.6291
 epoch: 42, train_loss: 0.5782, test_loss: 0.8823, test_f1: 0.6221
 epoch: 43, train_loss: 0.5576, test_loss: 0.9241, test_f1: 0.6172
 epoch: 44, train_loss: 0.5628, test_loss: 0.8731, test_f1: 0.6555
 epoch: 45, train_loss: 0.5279, test_loss: 0.7694, test_f1: 0.6385
 epoch: 46, train_loss: 0.5473, test_loss: 0.9229, test_f1: 0.6587
 epoch: 47, train_loss: 0.5412, test_loss: 0.8587, test_f1: 0.6427
 epoch: 48, train_loss: 0.5249, test_loss: 1.2239, test_f1: 0.6244
 epoch: 49, train_loss: 0.5035, test_loss: 0.9748, test_f1: 0.6500
 epoch: 50, train_loss: 0.5249, test_loss: 1.3165, test_f1: 0.6142
 epoch: 51, train_loss: 0.4824, test_loss: 0.9903, test_f1: 0.6609
 epoch: 52, train_loss: 0.4463, test_loss: 0.9970, test_f1: 0.6832
 epoch: 53, train_loss: 0.4413, test_loss: 1.0369, test_f1: 0.6633
 epoch: 54, train_loss: 0.4373, test_loss: 1.0594, test_f1: 0.6344
 epoch: 55, train_loss: 0.4149, test_loss: 0.9589, test_f1: 0.6800
 epoch: 56, train_loss: 0.4163, test_loss: 1.0459, test_f1: 0.6664
 epoch: 57, train_loss: 0.4182, test_loss: 1.0435, test_f1: 0.6646
 epoch: 58, train_loss: 0.4193, test_loss: 1.0682, test_f1: 0.6655
 epoch: 59, train_loss: 0.4521, test_loss: 0.9706, test_f1: 0.6711
 epoch: 60, train_loss: 0.4081, test_loss: 1.1269, test_f1: 0.6482
 epoch: 61, train_loss: 0.4324, test_loss: 1.1796, test_f1: 0.6536
 epoch: 62, train_loss: 0.4246, test_loss: 1.1841, test_f1: 0.6722
 epoch: 63, train_loss: 0.4126, test_loss: 1.0231, test_f1: 0.6632
 epoch: 64, train_loss: 0.4161, test_loss: 1.0991, test_f1: 0.6711
 epoch: 65, train_loss: 0.3976, test_loss: 1.0370, test_f1: 0.6481
 epoch: 66, train_loss: 0.3972, test_loss: 1.1638, test_f1: 0.6417
 epoch: 67, train_loss: 0.4104, test_loss: 1.3345, test_f1: 0.6749
 epoch: 68, train_loss: 0.3844, test_loss: 1.0734, test_f1: 0.6578
 epoch: 69, train_loss: 0.3856, test_loss: 1.1161, test_f1: 0.6778
 epoch: 70, train_loss: 0.3890, test_loss: 1.3402, test_f1: 0.6343
 epoch: 71, train_loss: 0.4080, test_loss: 0.9981, test_f1: 0.6723
 epoch: 72, train_loss: 0.4055, test_loss: 0.9007, test_f1: 0.6756
 epoch: 73, train_loss: 0.3725, test_loss: 1.2562, test_f1: 0.6727
 epoch: 74, train_loss: 0.3901, test_loss: 1.1533, test_f1: 0.6807
 epoch: 75, train_loss: 0.3851, test_loss: 1.0530, test_f1: 0.6538
 epoch: 76, train_loss: 0.3818, test_loss: 1.2984, test_f1: 0.6540
 epoch: 77, train_loss: 0.3846, test_loss: 1.0655, test_f1: 0.6658
 epoch: 78, train_loss: 0.3613, test_loss: 1.2254, test_f1: 0.6644
 epoch: 79, train_loss: 0.3620, test_loss: 1.1180, test_f1: 0.6620
 epoch: 80, train_loss: 0.3671, test_loss: 1.2061, test_f1: 0.6646
 epoch: 81, train_loss: 0.3577, test_loss: 1.1352, test_f1: 0.6664
 epoch: 82, train_loss: 0.3763, test_loss: 1.1551, test_f1: 0.6819
 epoch: 83, train_loss: 0.3657, test_loss: 1.2289, test_f1: 0.6744
 epoch: 84, train_loss: 0.3603, test_loss: 1.0021, test_f1: 0.6907
 epoch: 85, train_loss: 0.3845, test_loss: 1.1635, test_f1: 0.6685
 epoch: 86, train_loss: 0.3913, test_loss: 1.2005, test_f1: 0.5765
 epoch: 87, train_loss: 0.4048, test_loss: 1.0915, test_f1: 0.6957
 epoch: 88, train_loss: 0.3702, test_loss: 1.1575, test_f1: 0.6723
 epoch: 89, train_loss: 0.3564, test_loss: 1.0990, test_f1: 0.6817
 epoch: 90, train_loss: 0.3309, test_loss: 1.1805, test_f1: 0.6622
 epoch: 91, train_loss: 0.3723, test_loss: 1.2239, test_f1: 0.6671
 epoch: 92, train_loss: 0.3279, test_loss: 1.3249, test_f1: 0.6456
 epoch: 93, train_loss: 0.3243, test_loss: 1.2580, test_f1: 0.7044
 epoch: 94, train_loss: 0.3405, test_loss: 1.3898, test_f1: 0.6640
 epoch: 95, train_loss: 0.3248, test_loss: 1.1922, test_f1: 0.6677
 epoch: 96, train_loss: 0.3289, test_loss: 1.4380, test_f1: 0.6754
 epoch: 97, train_loss: 0.3315, test_loss: 1.5079, test_f1: 0.6527
 epoch: 98, train_loss: 0.3315, test_loss: 1.4594, test_f1: 0.6643
 epoch: 99, train_loss: 0.3164, test_loss: 1.1999, test_f1: 0.6723
##################ITERATION #2 ****************************************
 epoch: 0, train_loss: 1.1801, test_loss: 1.0681, test_f1: 0.3771
 epoch: 1, train_loss: 1.0348, test_loss: 1.0682, test_f1: 0.4058
 epoch: 2, train_loss: 0.9802, test_loss: 1.0734, test_f1: 0.4562
 epoch: 3, train_loss: 0.9539, test_loss: 1.1029, test_f1: 0.4298
 epoch: 4, train_loss: 0.9485, test_loss: 1.0619, test_f1: 0.4638
 epoch: 5, train_loss: 0.9138, test_loss: 1.0067, test_f1: 0.4647
 epoch: 6, train_loss: 0.8893, test_loss: 0.9741, test_f1: 0.4827
 epoch: 7, train_loss: 0.8642, test_loss: 1.0335, test_f1: 0.4811
 epoch: 8, train_loss: 0.8414, test_loss: 0.9755, test_f1: 0.5343
 epoch: 9, train_loss: 0.8171, test_loss: 0.8714, test_f1: 0.5834
 epoch: 10, train_loss: 0.7986, test_loss: 0.9952, test_f1: 0.5180
 epoch: 11, train_loss: 0.8053, test_loss: 0.9648, test_f1: 0.5310
 epoch: 12, train_loss: 0.7856, test_loss: 0.9930, test_f1: 0.5036
 epoch: 13, train_loss: 0.7993, test_loss: 1.1853, test_f1: 0.4585
 epoch: 14, train_loss: 0.7989, test_loss: 0.9704, test_f1: 0.5417
 epoch: 15, train_loss: 0.7611, test_loss: 0.8068, test_f1: 0.5750
 epoch: 16, train_loss: 0.7422, test_loss: 0.8807, test_f1: 0.5345
 epoch: 17, train_loss: 0.7219, test_loss: 0.9126, test_f1: 0.5958
 epoch: 18, train_loss: 0.7238, test_loss: 0.9150, test_f1: 0.5628
 epoch: 19, train_loss: 0.7529, test_loss: 1.1783, test_f1: 0.4375
 epoch: 20, train_loss: 0.7328, test_loss: 0.8842, test_f1: 0.5759
 epoch: 21, train_loss: 0.7117, test_loss: 0.8877, test_f1: 0.5511
 epoch: 22, train_loss: 0.6967, test_loss: 0.8393, test_f1: 0.6236
 epoch: 23, train_loss: 0.7000, test_loss: 1.2046, test_f1: 0.4696
 epoch: 24, train_loss: 0.7042, test_loss: 1.0204, test_f1: 0.5101
 epoch: 25, train_loss: 0.6848, test_loss: 0.9004, test_f1: 0.5247
 epoch: 26, train_loss: 0.6701, test_loss: 0.8649, test_f1: 0.6360
 epoch: 27, train_loss: 0.6766, test_loss: 1.0776, test_f1: 0.5031
 epoch: 28, train_loss: 0.6758, test_loss: 0.9650, test_f1: 0.5790
 epoch: 29, train_loss: 0.6892, test_loss: 1.0864, test_f1: 0.5673
 epoch: 30, train_loss: 0.6664, test_loss: 1.0955, test_f1: 0.5302
 epoch: 31, train_loss: 0.6375, test_loss: 0.9678, test_f1: 0.5817
 epoch: 32, train_loss: 0.6174, test_loss: 0.9382, test_f1: 0.5917
 epoch: 33, train_loss: 0.6219, test_loss: 0.9169, test_f1: 0.6162
 epoch: 34, train_loss: 0.6038, test_loss: 1.0206, test_f1: 0.5745
 epoch: 35, train_loss: 0.6247, test_loss: 0.8077, test_f1: 0.6228
 epoch: 36, train_loss: 0.6083, test_loss: 0.8139, test_f1: 0.6157
 epoch: 37, train_loss: 0.5993, test_loss: 0.8811, test_f1: 0.5990
 epoch: 38, train_loss: 0.6035, test_loss: 0.9281, test_f1: 0.6440
 epoch: 39, train_loss: 0.5783, test_loss: 0.9904, test_f1: 0.6240
 epoch: 40, train_loss: 0.5741, test_loss: 1.0550, test_f1: 0.6091
 epoch: 41, train_loss: 0.5797, test_loss: 0.9268, test_f1: 0.6638
 epoch: 42, train_loss: 0.6201, test_loss: 0.8922, test_f1: 0.6223
 epoch: 43, train_loss: 0.5691, test_loss: 0.9799, test_f1: 0.5905
 epoch: 44, train_loss: 0.5887, test_loss: 0.6794, test_f1: 0.6831
 epoch: 45, train_loss: 0.5542, test_loss: 0.7464, test_f1: 0.6540
 epoch: 46, train_loss: 0.5728, test_loss: 1.0249, test_f1: 0.5501
 epoch: 47, train_loss: 0.5764, test_loss: 0.9497, test_f1: 0.6047
 epoch: 48, train_loss: 0.5697, test_loss: 0.9062, test_f1: 0.5601
 epoch: 49, train_loss: 0.5605, test_loss: 0.8872, test_f1: 0.6245
 epoch: 50, train_loss: 0.5582, test_loss: 1.2511, test_f1: 0.5841
 epoch: 51, train_loss: 0.5102, test_loss: 0.9136, test_f1: 0.6471
 epoch: 52, train_loss: 0.4841, test_loss: 0.9638, test_f1: 0.6221
 epoch: 53, train_loss: 0.4703, test_loss: 0.9149, test_f1: 0.6596
 epoch: 54, train_loss: 0.4706, test_loss: 0.8837, test_f1: 0.6524
 epoch: 55, train_loss: 0.4728, test_loss: 0.8314, test_f1: 0.6393
 epoch: 56, train_loss: 0.4762, test_loss: 0.8977, test_f1: 0.6387
 epoch: 57, train_loss: 0.4693, test_loss: 0.9461, test_f1: 0.6483
 epoch: 58, train_loss: 0.4658, test_loss: 0.8981, test_f1: 0.6232
 epoch: 59, train_loss: 0.4602, test_loss: 0.7822, test_f1: 0.6807
 epoch: 60, train_loss: 0.4657, test_loss: 0.9783, test_f1: 0.6535
 epoch: 61, train_loss: 0.4627, test_loss: 0.9598, test_f1: 0.6488
 epoch: 62, train_loss: 0.4338, test_loss: 0.9522, test_f1: 0.6701
 epoch: 63, train_loss: 0.4307, test_loss: 0.9917, test_f1: 0.6159
 epoch: 64, train_loss: 0.4234, test_loss: 1.0338, test_f1: 0.6609
 epoch: 65, train_loss: 0.4346, test_loss: 1.0708, test_f1: 0.6185
 epoch: 66, train_loss: 0.4371, test_loss: 0.9866, test_f1: 0.6305
 epoch: 67, train_loss: 0.4377, test_loss: 0.8756, test_f1: 0.6342
 epoch: 68, train_loss: 0.4304, test_loss: 1.0234, test_f1: 0.6424
 epoch: 69, train_loss: 0.4185, test_loss: 1.0405, test_f1: 0.6143
 epoch: 70, train_loss: 0.4230, test_loss: 1.0214, test_f1: 0.6594
 epoch: 71, train_loss: 0.4071, test_loss: 1.0251, test_f1: 0.6798
 epoch: 72, train_loss: 0.4280, test_loss: 0.9111, test_f1: 0.6591
 epoch: 73, train_loss: 0.4022, test_loss: 0.9899, test_f1: 0.6642
 epoch: 74, train_loss: 0.4111, test_loss: 0.9966, test_f1: 0.6693
 epoch: 75, train_loss: 0.4145, test_loss: 1.0358, test_f1: 0.6704
 epoch: 76, train_loss: 0.4069, test_loss: 1.0862, test_f1: 0.6404
 epoch: 77, train_loss: 0.4192, test_loss: 1.1236, test_f1: 0.6346
 epoch: 78, train_loss: 0.4042, test_loss: 0.9903, test_f1: 0.6812
 epoch: 79, train_loss: 0.4035, test_loss: 1.0382, test_f1: 0.6622
 epoch: 80, train_loss: 0.4066, test_loss: 1.1359, test_f1: 0.6283
 epoch: 81, train_loss: 0.3866, test_loss: 1.0474, test_f1: 0.6614
 epoch: 82, train_loss: 0.3808, test_loss: 1.0777, test_f1: 0.6871
 epoch: 83, train_loss: 0.4018, test_loss: 1.0328, test_f1: 0.6639
 epoch: 84, train_loss: 0.3824, test_loss: 0.9947, test_f1: 0.6773
 epoch: 85, train_loss: 0.3695, test_loss: 1.0218, test_f1: 0.6824
 epoch: 86, train_loss: 0.3753, test_loss: 0.9832, test_f1: 0.6687
 epoch: 87, train_loss: 0.3829, test_loss: 1.2162, test_f1: 0.6717
 epoch: 88, train_loss: 0.4061, test_loss: 1.0966, test_f1: 0.6286
 epoch: 89, train_loss: 0.3825, test_loss: 1.0401, test_f1: 0.6619
 epoch: 90, train_loss: 0.3615, test_loss: 1.1171, test_f1: 0.6527
 epoch: 91, train_loss: 0.3680, test_loss: 1.1176, test_f1: 0.6803
 epoch: 92, train_loss: 0.3703, test_loss: 1.0599, test_f1: 0.6962
 epoch: 93, train_loss: 0.3844, test_loss: 1.1432, test_f1: 0.6841
 epoch: 94, train_loss: 0.3620, test_loss: 1.0684, test_f1: 0.6658
 epoch: 95, train_loss: 0.3537, test_loss: 1.1676, test_f1: 0.6517
 epoch: 96, train_loss: 0.3794, test_loss: 1.0758, test_f1: 0.6581
 epoch: 97, train_loss: 0.3437, test_loss: 1.0402, test_f1: 0.6885
 epoch: 98, train_loss: 0.3445, test_loss: 1.0139, test_f1: 0.6604
 epoch: 99, train_loss: 0.3752, test_loss: 1.2686, test_f1: 0.6674
##################ITERATION #3 ****************************************
 epoch: 0, train_loss: 1.2409, test_loss: 1.2907, test_f1: 0.3174
 epoch: 1, train_loss: 1.0030, test_loss: 1.0246, test_f1: 0.4676
 epoch: 2, train_loss: 0.9720, test_loss: 0.9529, test_f1: 0.4980
 epoch: 3, train_loss: 0.9213, test_loss: 0.9257, test_f1: 0.5383
 epoch: 4, train_loss: 0.8958, test_loss: 0.9577, test_f1: 0.5356
 epoch: 5, train_loss: 0.8892, test_loss: 0.8630, test_f1: 0.5021
 epoch: 6, train_loss: 0.8703, test_loss: 0.8581, test_f1: 0.5294
 epoch: 7, train_loss: 0.8419, test_loss: 1.2843, test_f1: 0.4532
 epoch: 8, train_loss: 0.8357, test_loss: 0.8763, test_f1: 0.5044
 epoch: 9, train_loss: 0.8126, test_loss: 1.0770, test_f1: 0.4823
 epoch: 10, train_loss: 0.7982, test_loss: 1.1571, test_f1: 0.4819
 epoch: 11, train_loss: 0.7780, test_loss: 0.8545, test_f1: 0.6032
 epoch: 12, train_loss: 0.7696, test_loss: 0.9093, test_f1: 0.5113
 epoch: 13, train_loss: 0.7527, test_loss: 0.7907, test_f1: 0.6441
 epoch: 14, train_loss: 0.7413, test_loss: 0.8898, test_f1: 0.5626
 epoch: 15, train_loss: 0.7363, test_loss: 1.1699, test_f1: 0.5157
 epoch: 16, train_loss: 0.7110, test_loss: 0.8794, test_f1: 0.6096
 epoch: 17, train_loss: 0.7285, test_loss: 0.9088, test_f1: 0.5686
 epoch: 18, train_loss: 0.7128, test_loss: 0.8973, test_f1: 0.5981
 epoch: 19, train_loss: 0.6864, test_loss: 0.8838, test_f1: 0.5898
 epoch: 20, train_loss: 0.6994, test_loss: 0.8567, test_f1: 0.5869
 epoch: 21, train_loss: 0.6827, test_loss: 1.0922, test_f1: 0.5707
 epoch: 22, train_loss: 0.6816, test_loss: 0.8658, test_f1: 0.6121
 epoch: 23, train_loss: 0.6760, test_loss: 1.0655, test_f1: 0.5365
 epoch: 24, train_loss: 0.6777, test_loss: 0.9045, test_f1: 0.5707
 epoch: 25, train_loss: 0.6385, test_loss: 0.8592, test_f1: 0.6149
 epoch: 26, train_loss: 0.6664, test_loss: 0.8214, test_f1: 0.5920
 epoch: 27, train_loss: 0.6310, test_loss: 0.9101, test_f1: 0.6049
 epoch: 28, train_loss: 0.6370, test_loss: 0.7982, test_f1: 0.6243
 epoch: 29, train_loss: 0.6326, test_loss: 1.2646, test_f1: 0.5231
 epoch: 30, train_loss: 0.6444, test_loss: 0.8246, test_f1: 0.6149
 epoch: 31, train_loss: 0.6217, test_loss: 0.8422, test_f1: 0.6052
 epoch: 32, train_loss: 0.6038, test_loss: 0.8478, test_f1: 0.6344
 epoch: 33, train_loss: 0.6328, test_loss: 0.9527, test_f1: 0.6257
 epoch: 34, train_loss: 0.6210, test_loss: 0.8547, test_f1: 0.6754
 epoch: 35, train_loss: 0.6074, test_loss: 0.9448, test_f1: 0.6180
 epoch: 36, train_loss: 0.6294, test_loss: 0.9787, test_f1: 0.6397
 epoch: 37, train_loss: 0.5894, test_loss: 0.9297, test_f1: 0.6454
 epoch: 38, train_loss: 0.5930, test_loss: 1.0123, test_f1: 0.6502
 epoch: 39, train_loss: 0.5975, test_loss: 0.9172, test_f1: 0.6123
 epoch: 40, train_loss: 0.5836, test_loss: 1.1110, test_f1: 0.5982
 epoch: 41, train_loss: 0.5672, test_loss: 0.9099, test_f1: 0.6588
 epoch: 42, train_loss: 0.5619, test_loss: 0.8778, test_f1: 0.6837
 epoch: 43, train_loss: 0.5631, test_loss: 0.9853, test_f1: 0.6416
 epoch: 44, train_loss: 0.5461, test_loss: 0.9359, test_f1: 0.6142
 epoch: 45, train_loss: 0.5501, test_loss: 1.1841, test_f1: 0.6151
 epoch: 46, train_loss: 0.5195, test_loss: 1.1207, test_f1: 0.6025
 epoch: 47, train_loss: 0.5236, test_loss: 0.8800, test_f1: 0.6598
 epoch: 48, train_loss: 0.5493, test_loss: 1.1833, test_f1: 0.5469
 epoch: 49, train_loss: 0.5648, test_loss: 0.9545, test_f1: 0.6415
 epoch: 50, train_loss: 0.5298, test_loss: 1.1016, test_f1: 0.6053
 epoch: 51, train_loss: 0.5141, test_loss: 0.9483, test_f1: 0.6703
 epoch: 52, train_loss: 0.4661, test_loss: 1.1780, test_f1: 0.6170
 epoch: 53, train_loss: 0.4671, test_loss: 0.9370, test_f1: 0.6553
 epoch: 54, train_loss: 0.4295, test_loss: 1.0195, test_f1: 0.6289
 epoch: 55, train_loss: 0.4456, test_loss: 1.1563, test_f1: 0.6163
 epoch: 56, train_loss: 0.4493, test_loss: 0.9349, test_f1: 0.6969
 epoch: 57, train_loss: 0.4164, test_loss: 1.0917, test_f1: 0.6419
 epoch: 58, train_loss: 0.4543, test_loss: 1.2258, test_f1: 0.5966
 epoch: 59, train_loss: 0.4344, test_loss: 1.1833, test_f1: 0.6290
 epoch: 60, train_loss: 0.4456, test_loss: 1.1902, test_f1: 0.6483
 epoch: 61, train_loss: 0.4060, test_loss: 1.1586, test_f1: 0.6352
 epoch: 62, train_loss: 0.3950, test_loss: 1.0768, test_f1: 0.6439
 epoch: 63, train_loss: 0.4003, test_loss: 1.0258, test_f1: 0.6517
 epoch: 64, train_loss: 0.3993, test_loss: 1.0495, test_f1: 0.6570
 epoch: 65, train_loss: 0.3960, test_loss: 1.1331, test_f1: 0.6142
 epoch: 66, train_loss: 0.3902, test_loss: 1.2865, test_f1: 0.6509
 epoch: 67, train_loss: 0.3996, test_loss: 1.3352, test_f1: 0.6491
 epoch: 68, train_loss: 0.4016, test_loss: 1.0512, test_f1: 0.6634
 epoch: 69, train_loss: 0.4090, test_loss: 1.1748, test_f1: 0.6579
 epoch: 70, train_loss: 0.3836, test_loss: 1.1479, test_f1: 0.6649
 epoch: 71, train_loss: 0.4107, test_loss: 1.2989, test_f1: 0.6393
 epoch: 72, train_loss: 0.3818, test_loss: 1.1012, test_f1: 0.6631
 epoch: 73, train_loss: 0.3991, test_loss: 1.1961, test_f1: 0.6531
 epoch: 74, train_loss: 0.3928, test_loss: 1.1013, test_f1: 0.6861
 epoch: 75, train_loss: 0.4036, test_loss: 1.3157, test_f1: 0.6109
 epoch: 76, train_loss: 0.3753, test_loss: 1.1987, test_f1: 0.6494
 epoch: 77, train_loss: 0.3898, test_loss: 1.3396, test_f1: 0.5858
 epoch: 78, train_loss: 0.3817, test_loss: 1.4421, test_f1: 0.5951
 epoch: 79, train_loss: 0.3764, test_loss: 1.1513, test_f1: 0.6432
 epoch: 80, train_loss: 0.3616, test_loss: 1.2775, test_f1: 0.6251
 epoch: 81, train_loss: 0.3569, test_loss: 1.1551, test_f1: 0.6342
 epoch: 82, train_loss: 0.3854, test_loss: 1.4750, test_f1: 0.6089
 epoch: 83, train_loss: 0.3613, test_loss: 1.2379, test_f1: 0.6285
 epoch: 84, train_loss: 0.3811, test_loss: 1.2812, test_f1: 0.6544
 epoch: 85, train_loss: 0.3580, test_loss: 1.3134, test_f1: 0.6111
 epoch: 86, train_loss: 0.3426, test_loss: 1.1634, test_f1: 0.6645
 epoch: 87, train_loss: 0.3553, test_loss: 1.2994, test_f1: 0.6258
 epoch: 88, train_loss: 0.3299, test_loss: 1.3922, test_f1: 0.6513
 epoch: 89, train_loss: 0.3376, test_loss: 1.3784, test_f1: 0.6088
 epoch: 90, train_loss: 0.3569, test_loss: 1.3974, test_f1: 0.6116
 epoch: 91, train_loss: 0.3459, test_loss: 1.2948, test_f1: 0.6137
 epoch: 92, train_loss: 0.3409, test_loss: 1.1136, test_f1: 0.6473
 epoch: 93, train_loss: 0.3331, test_loss: 1.2279, test_f1: 0.6254
 epoch: 94, train_loss: 0.3343, test_loss: 1.2755, test_f1: 0.6816
 epoch: 95, train_loss: 0.3788, test_loss: 1.2260, test_f1: 0.6435
 epoch: 96, train_loss: 0.3551, test_loss: 1.1087, test_f1: 0.6263
 epoch: 97, train_loss: 0.3428, test_loss: 1.4096, test_f1: 0.6197
 epoch: 98, train_loss: 0.3371, test_loss: 1.3144, test_f1: 0.6016
 epoch: 99, train_loss: 0.3713, test_loss: 1.3403, test_f1: 0.5932
##################ITERATION #4 ****************************************
 epoch: 0, train_loss: 1.2430, test_loss: 2.2273, test_f1: 0.1991
 epoch: 1, train_loss: 1.0008, test_loss: 1.4651, test_f1: 0.3609
 epoch: 2, train_loss: 0.9585, test_loss: 1.0273, test_f1: 0.4952
 epoch: 3, train_loss: 0.9170, test_loss: 1.0973, test_f1: 0.4696
 epoch: 4, train_loss: 0.9001, test_loss: 1.0638, test_f1: 0.4942
 epoch: 5, train_loss: 0.8892, test_loss: 1.0465, test_f1: 0.5158
 epoch: 6, train_loss: 0.8600, test_loss: 0.9499, test_f1: 0.5097
 epoch: 7, train_loss: 0.8478, test_loss: 0.8863, test_f1: 0.5771
 epoch: 8, train_loss: 0.8201, test_loss: 1.1156, test_f1: 0.4109
 epoch: 9, train_loss: 0.8259, test_loss: 0.9782, test_f1: 0.5006
 epoch: 10, train_loss: 0.8029, test_loss: 1.1715, test_f1: 0.4494
 epoch: 11, train_loss: 0.8048, test_loss: 0.8630, test_f1: 0.5737
 epoch: 12, train_loss: 0.8108, test_loss: 0.8820, test_f1: 0.4875
 epoch: 13, train_loss: 0.7887, test_loss: 0.7877, test_f1: 0.5490
 epoch: 14, train_loss: 0.7688, test_loss: 1.3023, test_f1: 0.4970
 epoch: 15, train_loss: 0.7505, test_loss: 1.4765, test_f1: 0.4847
 epoch: 16, train_loss: 0.7579, test_loss: 0.7697, test_f1: 0.6083
 epoch: 17, train_loss: 0.7446, test_loss: 1.0915, test_f1: 0.4796
 epoch: 18, train_loss: 0.7388, test_loss: 0.9163, test_f1: 0.5905
 epoch: 19, train_loss: 0.6963, test_loss: 1.2277, test_f1: 0.5016
 epoch: 20, train_loss: 0.7133, test_loss: 0.8854, test_f1: 0.5971
 epoch: 21, train_loss: 0.7066, test_loss: 0.8864, test_f1: 0.5712
 epoch: 22, train_loss: 0.7139, test_loss: 0.9675, test_f1: 0.5513
 epoch: 23, train_loss: 0.7044, test_loss: 0.9439, test_f1: 0.5929
 epoch: 24, train_loss: 0.6969, test_loss: 1.1951, test_f1: 0.5500
 epoch: 25, train_loss: 0.6850, test_loss: 1.1653, test_f1: 0.4781
 epoch: 26, train_loss: 0.7072, test_loss: 0.8473, test_f1: 0.5909
 epoch: 27, train_loss: 0.6695, test_loss: 1.0531, test_f1: 0.6166
 epoch: 28, train_loss: 0.6800, test_loss: 1.2723, test_f1: 0.5588
 epoch: 29, train_loss: 0.6855, test_loss: 1.2462, test_f1: 0.5840
 epoch: 30, train_loss: 0.6720, test_loss: 1.6458, test_f1: 0.4328
 epoch: 31, train_loss: 0.6545, test_loss: 0.9078, test_f1: 0.5933
 epoch: 32, train_loss: 0.6423, test_loss: 0.8363, test_f1: 0.6183
 epoch: 33, train_loss: 0.6569, test_loss: 0.8103, test_f1: 0.6050
 epoch: 34, train_loss: 0.6185, test_loss: 0.9315, test_f1: 0.6492
 epoch: 35, train_loss: 0.6216, test_loss: 0.9267, test_f1: 0.6052
 epoch: 36, train_loss: 0.6255, test_loss: 1.1110, test_f1: 0.5282
 epoch: 37, train_loss: 0.6416, test_loss: 1.1563, test_f1: 0.5600
 epoch: 38, train_loss: 0.6298, test_loss: 0.8208, test_f1: 0.6411
 epoch: 39, train_loss: 0.6054, test_loss: 1.1734, test_f1: 0.5871
 epoch: 40, train_loss: 0.6093, test_loss: 0.9869, test_f1: 0.5975
 epoch: 41, train_loss: 0.6174, test_loss: 1.0850, test_f1: 0.6491
 epoch: 42, train_loss: 0.6096, test_loss: 1.0606, test_f1: 0.6121
 epoch: 43, train_loss: 0.5744, test_loss: 1.0630, test_f1: 0.6413
 epoch: 44, train_loss: 0.5987, test_loss: 0.9033, test_f1: 0.6233
 epoch: 45, train_loss: 0.5919, test_loss: 0.9897, test_f1: 0.6557
 epoch: 46, train_loss: 0.5551, test_loss: 1.2384, test_f1: 0.5946
 epoch: 47, train_loss: 0.6067, test_loss: 0.7960, test_f1: 0.6068
 epoch: 48, train_loss: 0.5873, test_loss: 1.0238, test_f1: 0.6294
 epoch: 49, train_loss: 0.5652, test_loss: 1.0213, test_f1: 0.6400
 epoch: 50, train_loss: 0.5694, test_loss: 1.2008, test_f1: 0.6083
 epoch: 51, train_loss: 0.5426, test_loss: 1.0716, test_f1: 0.6431
 epoch: 52, train_loss: 0.5109, test_loss: 0.9638, test_f1: 0.6405
 epoch: 53, train_loss: 0.4859, test_loss: 0.9610, test_f1: 0.6660
 epoch: 54, train_loss: 0.5096, test_loss: 1.0280, test_f1: 0.6477
 epoch: 55, train_loss: 0.4785, test_loss: 1.1131, test_f1: 0.6640
 epoch: 56, train_loss: 0.4706, test_loss: 1.0577, test_f1: 0.6337
 epoch: 57, train_loss: 0.4601, test_loss: 1.1232, test_f1: 0.6530
 epoch: 58, train_loss: 0.4773, test_loss: 1.1414, test_f1: 0.6484
 epoch: 59, train_loss: 0.4893, test_loss: 1.1319, test_f1: 0.6167
 epoch: 60, train_loss: 0.4751, test_loss: 1.0516, test_f1: 0.6626
 epoch: 61, train_loss: 0.4773, test_loss: 1.1706, test_f1: 0.6444
 epoch: 62, train_loss: 0.4582, test_loss: 0.9982, test_f1: 0.6775
 epoch: 63, train_loss: 0.4610, test_loss: 1.0153, test_f1: 0.6501
 epoch: 64, train_loss: 0.4501, test_loss: 0.8704, test_f1: 0.6609
 epoch: 65, train_loss: 0.4486, test_loss: 1.0029, test_f1: 0.6615
 epoch: 66, train_loss: 0.4765, test_loss: 1.1952, test_f1: 0.6459
 epoch: 67, train_loss: 0.4417, test_loss: 1.0582, test_f1: 0.6527
 epoch: 68, train_loss: 0.4371, test_loss: 1.0544, test_f1: 0.6689
 epoch: 69, train_loss: 0.4497, test_loss: 1.1978, test_f1: 0.6496
 epoch: 70, train_loss: 0.4362, test_loss: 1.3242, test_f1: 0.6129
 epoch: 71, train_loss: 0.4263, test_loss: 1.1249, test_f1: 0.6664
 epoch: 72, train_loss: 0.4196, test_loss: 1.0804, test_f1: 0.6569
 epoch: 73, train_loss: 0.4207, test_loss: 1.2808, test_f1: 0.6550
 epoch: 74, train_loss: 0.4127, test_loss: 1.0969, test_f1: 0.6337
 epoch: 75, train_loss: 0.4181, test_loss: 1.1865, test_f1: 0.6463
 epoch: 76, train_loss: 0.4228, test_loss: 1.2614, test_f1: 0.6197
 epoch: 77, train_loss: 0.4272, test_loss: 1.3045, test_f1: 0.6552
 epoch: 78, train_loss: 0.4411, test_loss: 1.3222, test_f1: 0.6075
 epoch: 79, train_loss: 0.4233, test_loss: 1.1163, test_f1: 0.6525
 epoch: 80, train_loss: 0.4024, test_loss: 1.3161, test_f1: 0.6450
 epoch: 81, train_loss: 0.3998, test_loss: 1.2249, test_f1: 0.6604
 epoch: 82, train_loss: 0.4018, test_loss: 1.2328, test_f1: 0.6337
 epoch: 83, train_loss: 0.3957, test_loss: 1.2529, test_f1: 0.6295
 epoch: 84, train_loss: 0.4253, test_loss: 1.1899, test_f1: 0.6372
 epoch: 85, train_loss: 0.3923, test_loss: 1.1927, test_f1: 0.6740
 epoch: 86, train_loss: 0.3971, test_loss: 1.3732, test_f1: 0.6362
 epoch: 87, train_loss: 0.3954, test_loss: 1.0144, test_f1: 0.6435
 epoch: 88, train_loss: 0.4103, test_loss: 1.1698, test_f1: 0.6427
 epoch: 89, train_loss: 0.3672, test_loss: 1.2888, test_f1: 0.6616
 epoch: 90, train_loss: 0.3757, test_loss: 1.2134, test_f1: 0.6587
 epoch: 91, train_loss: 0.3879, test_loss: 1.3404, test_f1: 0.6799
 epoch: 92, train_loss: 0.3906, test_loss: 1.2636, test_f1: 0.6622
 epoch: 93, train_loss: 0.3747, test_loss: 1.1389, test_f1: 0.6540
 epoch: 94, train_loss: 0.3593, test_loss: 1.2081, test_f1: 0.6430
 epoch: 95, train_loss: 0.3880, test_loss: 1.3784, test_f1: 0.6152
 epoch: 96, train_loss: 0.3769, test_loss: 1.4348, test_f1: 0.6378
 epoch: 97, train_loss: 0.3500, test_loss: 1.3247, test_f1: 0.6554
 epoch: 98, train_loss: 0.3643, test_loss: 1.3106, test_f1: 0.6610
 epoch: 99, train_loss: 0.3581, test_loss: 1.5161, test_f1: 0.5969
##################ITERATION #5 ****************************************
 epoch: 0, train_loss: 1.2591, test_loss: 1.3557, test_f1: 0.3449
 epoch: 1, train_loss: 0.9844, test_loss: 1.0953, test_f1: 0.4507
 epoch: 2, train_loss: 0.9590, test_loss: 1.0239, test_f1: 0.5161
 epoch: 3, train_loss: 0.9189, test_loss: 0.9917, test_f1: 0.5114
 epoch: 4, train_loss: 0.9154, test_loss: 1.0656, test_f1: 0.4845
 epoch: 5, train_loss: 0.8769, test_loss: 1.0517, test_f1: 0.4889
 epoch: 6, train_loss: 0.8612, test_loss: 1.2166, test_f1: 0.4401
 epoch: 7, train_loss: 0.8488, test_loss: 0.9483, test_f1: 0.5319
 epoch: 8, train_loss: 0.8267, test_loss: 0.9962, test_f1: 0.5194
 epoch: 9, train_loss: 0.7994, test_loss: 0.8445, test_f1: 0.5702
 epoch: 10, train_loss: 0.8080, test_loss: 1.1538, test_f1: 0.4851
 epoch: 11, train_loss: 0.8067, test_loss: 0.9733, test_f1: 0.4787
 epoch: 12, train_loss: 0.7852, test_loss: 0.9892, test_f1: 0.5039
 epoch: 13, train_loss: 0.7679, test_loss: 0.8848, test_f1: 0.5607
 epoch: 14, train_loss: 0.7598, test_loss: 1.1206, test_f1: 0.4823
 epoch: 15, train_loss: 0.7654, test_loss: 0.8522, test_f1: 0.5919
 epoch: 16, train_loss: 0.7446, test_loss: 0.8113, test_f1: 0.5957
 epoch: 17, train_loss: 0.7319, test_loss: 0.8730, test_f1: 0.5930
 epoch: 18, train_loss: 0.7565, test_loss: 0.9672, test_f1: 0.5636
 epoch: 19, train_loss: 0.7174, test_loss: 0.8043, test_f1: 0.5818
 epoch: 20, train_loss: 0.7350, test_loss: 1.1131, test_f1: 0.4809
 epoch: 21, train_loss: 0.7229, test_loss: 0.9566, test_f1: 0.5583
 epoch: 22, train_loss: 0.7122, test_loss: 0.8866, test_f1: 0.6152
 epoch: 23, train_loss: 0.6810, test_loss: 0.8182, test_f1: 0.6676
 epoch: 24, train_loss: 0.7133, test_loss: 1.2503, test_f1: 0.5185
 epoch: 25, train_loss: 0.7446, test_loss: 0.9430, test_f1: 0.6142
 epoch: 26, train_loss: 0.7028, test_loss: 0.9557, test_f1: 0.5693
 epoch: 27, train_loss: 0.7117, test_loss: 0.8773, test_f1: 0.6297
 epoch: 28, train_loss: 0.6922, test_loss: 0.8114, test_f1: 0.6731
 epoch: 29, train_loss: 0.6624, test_loss: 0.9130, test_f1: 0.6185
 epoch: 30, train_loss: 0.6723, test_loss: 0.8966, test_f1: 0.5999
 epoch: 31, train_loss: 0.6730, test_loss: 0.8590, test_f1: 0.6314
 epoch: 32, train_loss: 0.6654, test_loss: 1.0736, test_f1: 0.5906
 epoch: 33, train_loss: 0.6365, test_loss: 0.9418, test_f1: 0.6091
 epoch: 34, train_loss: 0.6358, test_loss: 0.9570, test_f1: 0.6235
 epoch: 35, train_loss: 0.6105, test_loss: 0.7682, test_f1: 0.6480
 epoch: 36, train_loss: 0.6155, test_loss: 0.9012, test_f1: 0.6135
 epoch: 37, train_loss: 0.6288, test_loss: 0.8600, test_f1: 0.6703
 epoch: 38, train_loss: 0.6107, test_loss: 0.8645, test_f1: 0.5977
 epoch: 39, train_loss: 0.5997, test_loss: 0.9510, test_f1: 0.6387
 epoch: 40, train_loss: 0.6263, test_loss: 0.9472, test_f1: 0.5784
 epoch: 41, train_loss: 0.6240, test_loss: 0.9968, test_f1: 0.6540
 epoch: 42, train_loss: 0.5920, test_loss: 0.8186, test_f1: 0.6668
 epoch: 43, train_loss: 0.6260, test_loss: 0.8395, test_f1: 0.6000
 epoch: 44, train_loss: 0.6323, test_loss: 0.8266, test_f1: 0.6722
 epoch: 45, train_loss: 0.5754, test_loss: 0.9139, test_f1: 0.6745
 epoch: 46, train_loss: 0.5787, test_loss: 1.0889, test_f1: 0.6026
 epoch: 47, train_loss: 0.5790, test_loss: 0.9738, test_f1: 0.6149
 epoch: 48, train_loss: 0.5993, test_loss: 0.9804, test_f1: 0.5952
 epoch: 49, train_loss: 0.5909, test_loss: 0.9506, test_f1: 0.6371
 epoch: 50, train_loss: 0.5736, test_loss: 1.1051, test_f1: 0.5902
 epoch: 51, train_loss: 0.5503, test_loss: 0.8790, test_f1: 0.6443
 epoch: 52, train_loss: 0.5082, test_loss: 0.9060, test_f1: 0.6466
 epoch: 53, train_loss: 0.4987, test_loss: 0.9719, test_f1: 0.6162
 epoch: 54, train_loss: 0.5114, test_loss: 1.0723, test_f1: 0.5825
 epoch: 55, train_loss: 0.4954, test_loss: 0.9632, test_f1: 0.6447
 epoch: 56, train_loss: 0.4858, test_loss: 0.9331, test_f1: 0.6347
 epoch: 57, train_loss: 0.4764, test_loss: 1.0735, test_f1: 0.6147
 epoch: 58, train_loss: 0.4878, test_loss: 1.0350, test_f1: 0.6379
 epoch: 59, train_loss: 0.4594, test_loss: 0.9957, test_f1: 0.6437
 epoch: 60, train_loss: 0.4560, test_loss: 0.9116, test_f1: 0.6469
 epoch: 61, train_loss: 0.4687, test_loss: 1.1681, test_f1: 0.6123
 epoch: 62, train_loss: 0.4534, test_loss: 1.1458, test_f1: 0.6116
 epoch: 63, train_loss: 0.4348, test_loss: 1.0039, test_f1: 0.6686
 epoch: 64, train_loss: 0.4397, test_loss: 1.0742, test_f1: 0.6566
 epoch: 65, train_loss: 0.4452, test_loss: 1.0437, test_f1: 0.6481
 epoch: 66, train_loss: 0.4401, test_loss: 1.0074, test_f1: 0.6642
 epoch: 67, train_loss: 0.4220, test_loss: 1.1484, test_f1: 0.6433
 epoch: 68, train_loss: 0.4104, test_loss: 1.1707, test_f1: 0.6559
 epoch: 69, train_loss: 0.4248, test_loss: 1.1256, test_f1: 0.6617
 epoch: 70, train_loss: 0.4278, test_loss: 1.0682, test_f1: 0.6427
 epoch: 71, train_loss: 0.4357, test_loss: 1.0487, test_f1: 0.6645
 epoch: 72, train_loss: 0.4243, test_loss: 1.0314, test_f1: 0.6726
 epoch: 73, train_loss: 0.4052, test_loss: 1.1867, test_f1: 0.6375
 epoch: 74, train_loss: 0.4059, test_loss: 1.1355, test_f1: 0.6471
 epoch: 75, train_loss: 0.4025, test_loss: 1.2502, test_f1: 0.6158
 epoch: 76, train_loss: 0.4158, test_loss: 1.3090, test_f1: 0.5974
 epoch: 77, train_loss: 0.4120, test_loss: 1.1485, test_f1: 0.6575
 epoch: 78, train_loss: 0.3975, test_loss: 1.2239, test_f1: 0.6472
 epoch: 79, train_loss: 0.3870, test_loss: 1.2206, test_f1: 0.6439
 epoch: 80, train_loss: 0.3783, test_loss: 1.1107, test_f1: 0.6443
 epoch: 81, train_loss: 0.3927, test_loss: 1.0552, test_f1: 0.6543
 epoch: 82, train_loss: 0.3863, test_loss: 1.0029, test_f1: 0.6612
 epoch: 83, train_loss: 0.3974, test_loss: 1.2808, test_f1: 0.6747
 epoch: 84, train_loss: 0.3894, test_loss: 1.1336, test_f1: 0.6488
 epoch: 85, train_loss: 0.4062, test_loss: 1.0842, test_f1: 0.6683
 epoch: 86, train_loss: 0.3965, test_loss: 1.1137, test_f1: 0.6435
 epoch: 87, train_loss: 0.4076, test_loss: 1.5951, test_f1: 0.6022
 epoch: 88, train_loss: 0.3859, test_loss: 1.2899, test_f1: 0.6421
 epoch: 89, train_loss: 0.3862, test_loss: 1.1108, test_f1: 0.6598
 epoch: 90, train_loss: 0.4035, test_loss: 1.2590, test_f1: 0.6417
 epoch: 91, train_loss: 0.3730, test_loss: 1.2336, test_f1: 0.6581
 epoch: 92, train_loss: 0.3740, test_loss: 1.2045, test_f1: 0.6480
 epoch: 93, train_loss: 0.3638, test_loss: 1.3994, test_f1: 0.6323
 epoch: 94, train_loss: 0.3686, test_loss: 1.1134, test_f1: 0.6713
 epoch: 95, train_loss: 0.3545, test_loss: 1.1926, test_f1: 0.6529
 epoch: 96, train_loss: 0.3701, test_loss: 1.2490, test_f1: 0.6504
 epoch: 97, train_loss: 0.3831, test_loss: 1.2383, test_f1: 0.6469
 epoch: 98, train_loss: 0.3494, test_loss: 1.1307, test_f1: 0.6758
 epoch: 99, train_loss: 0.3536, test_loss: 1.1407, test_f1: 0.6781
##################ITERATION #6 ****************************************
 epoch: 0, train_loss: 1.2584, test_loss: 1.1983, test_f1: 0.3398
 epoch: 1, train_loss: 1.0354, test_loss: 1.1068, test_f1: 0.4192
 epoch: 2, train_loss: 0.9780, test_loss: 1.0185, test_f1: 0.4706
 epoch: 3, train_loss: 0.9574, test_loss: 1.0310, test_f1: 0.4833
 epoch: 4, train_loss: 0.9219, test_loss: 1.0015, test_f1: 0.4913
 epoch: 5, train_loss: 0.9019, test_loss: 1.1324, test_f1: 0.4912
 epoch: 6, train_loss: 0.8873, test_loss: 0.9753, test_f1: 0.5237
 epoch: 7, train_loss: 0.8832, test_loss: 0.9547, test_f1: 0.5036
 epoch: 8, train_loss: 0.8664, test_loss: 0.9916, test_f1: 0.5170
 epoch: 9, train_loss: 0.8446, test_loss: 0.9169, test_f1: 0.5609
 epoch: 10, train_loss: 0.7998, test_loss: 0.8911, test_f1: 0.5452
 epoch: 11, train_loss: 0.7951, test_loss: 1.0107, test_f1: 0.5296
 epoch: 12, train_loss: 0.7930, test_loss: 0.8690, test_f1: 0.5697
 epoch: 13, train_loss: 0.8019, test_loss: 0.8147, test_f1: 0.5576
 epoch: 14, train_loss: 0.7665, test_loss: 0.9034, test_f1: 0.5866
 epoch: 15, train_loss: 0.7531, test_loss: 1.0165, test_f1: 0.5322
 epoch: 16, train_loss: 0.7601, test_loss: 0.9691, test_f1: 0.5875
 epoch: 17, train_loss: 0.7484, test_loss: 0.9188, test_f1: 0.6076
 epoch: 18, train_loss: 0.7195, test_loss: 0.9763, test_f1: 0.5958
 epoch: 19, train_loss: 0.7482, test_loss: 0.9634, test_f1: 0.6026
 epoch: 20, train_loss: 0.7232, test_loss: 1.0465, test_f1: 0.5792
 epoch: 21, train_loss: 0.6995, test_loss: 1.0340, test_f1: 0.5313
 epoch: 22, train_loss: 0.6944, test_loss: 1.1725, test_f1: 0.5137
 epoch: 23, train_loss: 0.7042, test_loss: 0.9849, test_f1: 0.5952
 epoch: 24, train_loss: 0.6888, test_loss: 0.9120, test_f1: 0.6147
 epoch: 25, train_loss: 0.6766, test_loss: 1.0924, test_f1: 0.6068
 epoch: 26, train_loss: 0.6688, test_loss: 1.0299, test_f1: 0.5502
 epoch: 27, train_loss: 0.6443, test_loss: 1.1204, test_f1: 0.5753
 epoch: 28, train_loss: 0.6457, test_loss: 1.0125, test_f1: 0.6189
 epoch: 29, train_loss: 0.6326, test_loss: 0.9663, test_f1: 0.6243
 epoch: 30, train_loss: 0.6567, test_loss: 0.8521, test_f1: 0.6046
 epoch: 31, train_loss: 0.6477, test_loss: 0.9885, test_f1: 0.5373
 epoch: 32, train_loss: 0.6270, test_loss: 0.9145, test_f1: 0.5707
 epoch: 33, train_loss: 0.6151, test_loss: 1.0976, test_f1: 0.5939
 epoch: 34, train_loss: 0.6117, test_loss: 0.9147, test_f1: 0.6150
 epoch: 35, train_loss: 0.6070, test_loss: 0.8829, test_f1: 0.6284
 epoch: 36, train_loss: 0.6320, test_loss: 0.9800, test_f1: 0.5876
 epoch: 37, train_loss: 0.5989, test_loss: 1.0656, test_f1: 0.5927
 epoch: 38, train_loss: 0.6596, test_loss: 1.0423, test_f1: 0.6243
 epoch: 39, train_loss: 0.6431, test_loss: 1.0234, test_f1: 0.6470
 epoch: 40, train_loss: 0.6062, test_loss: 1.0493, test_f1: 0.5975
 epoch: 41, train_loss: 0.6128, test_loss: 0.9671, test_f1: 0.6132
 epoch: 42, train_loss: 0.6031, test_loss: 1.0993, test_f1: 0.6200
 epoch: 43, train_loss: 0.6021, test_loss: 1.1206, test_f1: 0.6025
 epoch: 44, train_loss: 0.5810, test_loss: 0.9837, test_f1: 0.6364
 epoch: 45, train_loss: 0.5627, test_loss: 1.1986, test_f1: 0.5830
 epoch: 46, train_loss: 0.5703, test_loss: 1.0885, test_f1: 0.6249
 epoch: 47, train_loss: 0.5566, test_loss: 0.8987, test_f1: 0.6612
 epoch: 48, train_loss: 0.5908, test_loss: 0.8176, test_f1: 0.6468
 epoch: 49, train_loss: 0.5564, test_loss: 1.0220, test_f1: 0.6113
 epoch: 50, train_loss: 0.5471, test_loss: 1.1094, test_f1: 0.6068
 epoch: 51, train_loss: 0.5256, test_loss: 0.8903, test_f1: 0.6419
 epoch: 52, train_loss: 0.4878, test_loss: 1.0155, test_f1: 0.6351
 epoch: 53, train_loss: 0.4829, test_loss: 1.0825, test_f1: 0.6227
 epoch: 54, train_loss: 0.4905, test_loss: 0.9544, test_f1: 0.6488
 epoch: 55, train_loss: 0.4629, test_loss: 1.0295, test_f1: 0.6434
 epoch: 56, train_loss: 0.4567, test_loss: 1.0627, test_f1: 0.6541
 epoch: 57, train_loss: 0.4434, test_loss: 1.0159, test_f1: 0.6660
 epoch: 58, train_loss: 0.4565, test_loss: 1.0515, test_f1: 0.6452
 epoch: 59, train_loss: 0.4515, test_loss: 1.0369, test_f1: 0.6491
 epoch: 60, train_loss: 0.4542, test_loss: 1.0613, test_f1: 0.6411
 epoch: 61, train_loss: 0.4390, test_loss: 1.0082, test_f1: 0.6829
 epoch: 62, train_loss: 0.4306, test_loss: 1.0747, test_f1: 0.6460
 epoch: 63, train_loss: 0.4331, test_loss: 1.1150, test_f1: 0.6378
 epoch: 64, train_loss: 0.4425, test_loss: 1.0409, test_f1: 0.6390
 epoch: 65, train_loss: 0.4257, test_loss: 1.0456, test_f1: 0.6609
 epoch: 66, train_loss: 0.4032, test_loss: 1.1205, test_f1: 0.6729
 epoch: 67, train_loss: 0.4199, test_loss: 1.0840, test_f1: 0.6608
 epoch: 68, train_loss: 0.4063, test_loss: 1.1436, test_f1: 0.6364
 epoch: 69, train_loss: 0.4009, test_loss: 1.0947, test_f1: 0.6546
 epoch: 70, train_loss: 0.4056, test_loss: 1.3307, test_f1: 0.6199
 epoch: 71, train_loss: 0.3959, test_loss: 1.1773, test_f1: 0.6529
 epoch: 72, train_loss: 0.4061, test_loss: 1.2132, test_f1: 0.6469
 epoch: 73, train_loss: 0.4045, test_loss: 1.0018, test_f1: 0.6913
 epoch: 74, train_loss: 0.4194, test_loss: 1.0934, test_f1: 0.6589
 epoch: 75, train_loss: 0.4127, test_loss: 1.1363, test_f1: 0.6823
 epoch: 76, train_loss: 0.3993, test_loss: 1.2799, test_f1: 0.6705
 epoch: 77, train_loss: 0.3801, test_loss: 1.3036, test_f1: 0.6554
 epoch: 78, train_loss: 0.3831, test_loss: 1.2012, test_f1: 0.6617
 epoch: 79, train_loss: 0.3871, test_loss: 1.3035, test_f1: 0.6591
 epoch: 80, train_loss: 0.3829, test_loss: 1.2122, test_f1: 0.6423
 epoch: 81, train_loss: 0.3950, test_loss: 1.2921, test_f1: 0.6338
 epoch: 82, train_loss: 0.3749, test_loss: 1.2855, test_f1: 0.6530
 epoch: 83, train_loss: 0.3690, test_loss: 1.2368, test_f1: 0.6465
 epoch: 84, train_loss: 0.3718, test_loss: 1.2919, test_f1: 0.6617
 epoch: 85, train_loss: 0.3567, test_loss: 1.2250, test_f1: 0.6585
 epoch: 86, train_loss: 0.3682, test_loss: 1.1843, test_f1: 0.6767
 epoch: 87, train_loss: 0.3904, test_loss: 1.2361, test_f1: 0.6387
 epoch: 88, train_loss: 0.3843, test_loss: 1.2084, test_f1: 0.6493
 epoch: 89, train_loss: 0.3733, test_loss: 1.2775, test_f1: 0.6811
 epoch: 90, train_loss: 0.3584, test_loss: 1.2346, test_f1: 0.6508
 epoch: 91, train_loss: 0.3806, test_loss: 1.2636, test_f1: 0.6449
 epoch: 92, train_loss: 0.3694, test_loss: 1.3651, test_f1: 0.6478
 epoch: 93, train_loss: 0.3466, test_loss: 1.2127, test_f1: 0.6949
 epoch: 94, train_loss: 0.3531, test_loss: 1.2794, test_f1: 0.6573
 epoch: 95, train_loss: 0.3371, test_loss: 1.2534, test_f1: 0.6955
 epoch: 96, train_loss: 0.3379, test_loss: 1.2861, test_f1: 0.6578
 epoch: 97, train_loss: 0.3215, test_loss: 1.2828, test_f1: 0.6489
 epoch: 98, train_loss: 0.3571, test_loss: 1.5181, test_f1: 0.6298
 epoch: 99, train_loss: 0.3550, test_loss: 1.3233, test_f1: 0.6513
##################ITERATION #7 ****************************************
 epoch: 0, train_loss: 1.2873, test_loss: 1.1070, test_f1: 0.3548
 epoch: 1, train_loss: 1.0243, test_loss: 1.0950, test_f1: 0.4749
 epoch: 2, train_loss: 0.9644, test_loss: 1.2286, test_f1: 0.4030
 epoch: 3, train_loss: 0.9567, test_loss: 1.0053, test_f1: 0.5112
 epoch: 4, train_loss: 0.9268, test_loss: 0.9722, test_f1: 0.5414
 epoch: 5, train_loss: 0.8869, test_loss: 0.9604, test_f1: 0.5413
 epoch: 6, train_loss: 0.8873, test_loss: 1.1910, test_f1: 0.4168
 epoch: 7, train_loss: 0.8539, test_loss: 0.9608, test_f1: 0.5503
 epoch: 8, train_loss: 0.8229, test_loss: 0.9488, test_f1: 0.6007
 epoch: 9, train_loss: 0.8318, test_loss: 0.8986, test_f1: 0.5590
 epoch: 10, train_loss: 0.8102, test_loss: 0.8889, test_f1: 0.5442
 epoch: 11, train_loss: 0.7725, test_loss: 0.9680, test_f1: 0.5583
 epoch: 12, train_loss: 0.7727, test_loss: 0.8855, test_f1: 0.5952
 epoch: 13, train_loss: 0.7470, test_loss: 0.8276, test_f1: 0.5732
 epoch: 14, train_loss: 0.7333, test_loss: 1.1295, test_f1: 0.5790
 epoch: 15, train_loss: 0.7357, test_loss: 0.8628, test_f1: 0.5968
 epoch: 16, train_loss: 0.7069, test_loss: 0.8132, test_f1: 0.6253
 epoch: 17, train_loss: 0.7488, test_loss: 0.9651, test_f1: 0.5497
 epoch: 18, train_loss: 0.7340, test_loss: 1.0412, test_f1: 0.5946
 epoch: 19, train_loss: 0.6985, test_loss: 1.3527, test_f1: 0.4933
 epoch: 20, train_loss: 0.6882, test_loss: 0.7632, test_f1: 0.6797
 epoch: 21, train_loss: 0.6884, test_loss: 1.0550, test_f1: 0.5979
 epoch: 22, train_loss: 0.6896, test_loss: 0.8607, test_f1: 0.6062
 epoch: 23, train_loss: 0.7000, test_loss: 0.7650, test_f1: 0.6678
 epoch: 24, train_loss: 0.6548, test_loss: 1.0753, test_f1: 0.5781
 epoch: 25, train_loss: 0.6586, test_loss: 0.9108, test_f1: 0.6501
 epoch: 26, train_loss: 0.6608, test_loss: 0.9534, test_f1: 0.5982
 epoch: 27, train_loss: 0.6535, test_loss: 0.8585, test_f1: 0.6620
 epoch: 28, train_loss: 0.6555, test_loss: 0.9928, test_f1: 0.6228
 epoch: 29, train_loss: 0.6469, test_loss: 0.8640, test_f1: 0.6301
 epoch: 30, train_loss: 0.6312, test_loss: 0.9131, test_f1: 0.6661
 epoch: 31, train_loss: 0.6362, test_loss: 0.9185, test_f1: 0.6433
 epoch: 32, train_loss: 0.6249, test_loss: 0.9043, test_f1: 0.6391
 epoch: 33, train_loss: 0.6426, test_loss: 0.8722, test_f1: 0.6453
 epoch: 34, train_loss: 0.6151, test_loss: 0.9470, test_f1: 0.6032
 epoch: 35, train_loss: 0.6011, test_loss: 0.8218, test_f1: 0.6545
 epoch: 36, train_loss: 0.5736, test_loss: 0.9554, test_f1: 0.6229
 epoch: 37, train_loss: 0.5997, test_loss: 0.9311, test_f1: 0.5893
 epoch: 38, train_loss: 0.6225, test_loss: 1.1137, test_f1: 0.5689
 epoch: 39, train_loss: 0.5856, test_loss: 0.8837, test_f1: 0.6577
 epoch: 40, train_loss: 0.5673, test_loss: 0.9950, test_f1: 0.6884
 epoch: 41, train_loss: 0.5572, test_loss: 1.0753, test_f1: 0.6452
 epoch: 42, train_loss: 0.5681, test_loss: 0.7862, test_f1: 0.6347
 epoch: 43, train_loss: 0.5587, test_loss: 1.0275, test_f1: 0.6370
 epoch: 44, train_loss: 0.5349, test_loss: 0.8735, test_f1: 0.6656
 epoch: 45, train_loss: 0.5432, test_loss: 0.9867, test_f1: 0.6673
 epoch: 46, train_loss: 0.5502, test_loss: 0.7801, test_f1: 0.7105
 epoch: 47, train_loss: 0.5289, test_loss: 1.0344, test_f1: 0.6738
 epoch: 48, train_loss: 0.5233, test_loss: 0.8856, test_f1: 0.6196
 epoch: 49, train_loss: 0.5408, test_loss: 0.8574, test_f1: 0.6591
 epoch: 50, train_loss: 0.5034, test_loss: 0.9284, test_f1: 0.6302
 epoch: 51, train_loss: 0.4866, test_loss: 0.9558, test_f1: 0.6774
 epoch: 52, train_loss: 0.4495, test_loss: 1.0316, test_f1: 0.6864
 epoch: 53, train_loss: 0.4469, test_loss: 1.0473, test_f1: 0.6796
 epoch: 54, train_loss: 0.4463, test_loss: 0.9134, test_f1: 0.6744
 epoch: 55, train_loss: 0.4349, test_loss: 1.0590, test_f1: 0.6669
 epoch: 56, train_loss: 0.4295, test_loss: 0.9972, test_f1: 0.6654
 epoch: 57, train_loss: 0.4228, test_loss: 1.0530, test_f1: 0.6824
 epoch: 58, train_loss: 0.4408, test_loss: 0.9863, test_f1: 0.6572
 epoch: 59, train_loss: 0.4220, test_loss: 1.0861, test_f1: 0.7030
 epoch: 60, train_loss: 0.4188, test_loss: 0.9273, test_f1: 0.6699
 epoch: 61, train_loss: 0.4155, test_loss: 0.8721, test_f1: 0.6886
 epoch: 62, train_loss: 0.4413, test_loss: 1.1040, test_f1: 0.6539
 epoch: 63, train_loss: 0.4219, test_loss: 1.0248, test_f1: 0.6831
 epoch: 64, train_loss: 0.4226, test_loss: 1.0178, test_f1: 0.6556
 epoch: 65, train_loss: 0.4033, test_loss: 0.9532, test_f1: 0.6985
 epoch: 66, train_loss: 0.4139, test_loss: 0.9974, test_f1: 0.6909
 epoch: 67, train_loss: 0.3990, test_loss: 1.1045, test_f1: 0.6746
 epoch: 68, train_loss: 0.4058, test_loss: 1.1086, test_f1: 0.6485
 epoch: 69, train_loss: 0.4029, test_loss: 1.1082, test_f1: 0.7018
 epoch: 70, train_loss: 0.4154, test_loss: 1.0741, test_f1: 0.6842
 epoch: 71, train_loss: 0.3948, test_loss: 1.0012, test_f1: 0.6677
 epoch: 72, train_loss: 0.3673, test_loss: 1.1451, test_f1: 0.6888
 epoch: 73, train_loss: 0.3815, test_loss: 1.1031, test_f1: 0.7058
 epoch: 74, train_loss: 0.3984, test_loss: 0.8590, test_f1: 0.6919
 epoch: 75, train_loss: 0.4022, test_loss: 1.1644, test_f1: 0.6587
 epoch: 76, train_loss: 0.3985, test_loss: 1.1009, test_f1: 0.6742
 epoch: 77, train_loss: 0.3856, test_loss: 0.8930, test_f1: 0.6492
 epoch: 78, train_loss: 0.3557, test_loss: 1.1666, test_f1: 0.6737
 epoch: 79, train_loss: 0.3752, test_loss: 1.1677, test_f1: 0.6479
 epoch: 80, train_loss: 0.3852, test_loss: 1.2310, test_f1: 0.6530
 epoch: 81, train_loss: 0.3679, test_loss: 1.2415, test_f1: 0.6538
 epoch: 82, train_loss: 0.3535, test_loss: 1.3300, test_f1: 0.6617
 epoch: 83, train_loss: 0.3552, test_loss: 1.1586, test_f1: 0.6747
 epoch: 84, train_loss: 0.3579, test_loss: 1.1401, test_f1: 0.6911
 epoch: 85, train_loss: 0.3630, test_loss: 1.0389, test_f1: 0.6776
 epoch: 86, train_loss: 0.3483, test_loss: 1.1653, test_f1: 0.6947
 epoch: 87, train_loss: 0.3677, test_loss: 1.2226, test_f1: 0.6597
 epoch: 88, train_loss: 0.3600, test_loss: 1.2173, test_f1: 0.6699
 epoch: 89, train_loss: 0.3349, test_loss: 1.2561, test_f1: 0.6535
 epoch: 90, train_loss: 0.3522, test_loss: 1.0109, test_f1: 0.6782
 epoch: 91, train_loss: 0.3445, test_loss: 1.1957, test_f1: 0.6528
 epoch: 92, train_loss: 0.3342, test_loss: 1.1801, test_f1: 0.7103
 epoch: 93, train_loss: 0.3513, test_loss: 1.3600, test_f1: 0.6399
 epoch: 94, train_loss: 0.3390, test_loss: 1.2770, test_f1: 0.6728
 epoch: 95, train_loss: 0.3345, test_loss: 1.2478, test_f1: 0.6719
 epoch: 96, train_loss: 0.3475, test_loss: 1.1814, test_f1: 0.6767
 epoch: 97, train_loss: 0.3331, test_loss: 1.3418, test_f1: 0.6646
 epoch: 98, train_loss: 0.3454, test_loss: 1.1948, test_f1: 0.6532
 epoch: 99, train_loss: 0.3464, test_loss: 1.3600, test_f1: 0.6849
##################ITERATION #8 ****************************************
 epoch: 0, train_loss: 1.2396, test_loss: 1.1677, test_f1: 0.4392
 epoch: 1, train_loss: 0.9904, test_loss: 1.0706, test_f1: 0.4171
 epoch: 2, train_loss: 0.9771, test_loss: 1.0210, test_f1: 0.4624
 epoch: 3, train_loss: 0.9472, test_loss: 0.9554, test_f1: 0.5096
 epoch: 4, train_loss: 0.9239, test_loss: 1.0526, test_f1: 0.4911
 epoch: 5, train_loss: 0.9002, test_loss: 0.9092, test_f1: 0.5172
 epoch: 6, train_loss: 0.8926, test_loss: 0.9193, test_f1: 0.5440
 epoch: 7, train_loss: 0.8591, test_loss: 1.0269, test_f1: 0.5240
 epoch: 8, train_loss: 0.8529, test_loss: 1.0102, test_f1: 0.5120
 epoch: 9, train_loss: 0.8274, test_loss: 1.2331, test_f1: 0.5009
 epoch: 10, train_loss: 0.8166, test_loss: 0.8274, test_f1: 0.5467
 epoch: 11, train_loss: 0.8219, test_loss: 0.9763, test_f1: 0.5148
 epoch: 12, train_loss: 0.8101, test_loss: 0.9166, test_f1: 0.5215
 epoch: 13, train_loss: 0.7894, test_loss: 1.0223, test_f1: 0.5963
 epoch: 14, train_loss: 0.7810, test_loss: 0.9314, test_f1: 0.5306
 epoch: 15, train_loss: 0.7686, test_loss: 0.9677, test_f1: 0.5518
 epoch: 16, train_loss: 0.7720, test_loss: 0.9328, test_f1: 0.5741
 epoch: 17, train_loss: 0.7544, test_loss: 0.8796, test_f1: 0.5791
 epoch: 18, train_loss: 0.7357, test_loss: 1.0989, test_f1: 0.5535
 epoch: 19, train_loss: 0.7326, test_loss: 0.9550, test_f1: 0.6050
 epoch: 20, train_loss: 0.7270, test_loss: 0.8835, test_f1: 0.5690
 epoch: 21, train_loss: 0.7200, test_loss: 0.9150, test_f1: 0.6182
 epoch: 22, train_loss: 0.7255, test_loss: 0.8790, test_f1: 0.6387
 epoch: 23, train_loss: 0.7122, test_loss: 0.9704, test_f1: 0.5782
 epoch: 24, train_loss: 0.6852, test_loss: 0.7472, test_f1: 0.6348
 epoch: 25, train_loss: 0.7054, test_loss: 0.8929, test_f1: 0.6393
 epoch: 26, train_loss: 0.6776, test_loss: 0.9095, test_f1: 0.6210
 epoch: 27, train_loss: 0.6744, test_loss: 0.9244, test_f1: 0.5934
 epoch: 28, train_loss: 0.6746, test_loss: 0.9081, test_f1: 0.6115
 epoch: 29, train_loss: 0.6696, test_loss: 0.8683, test_f1: 0.6315
 epoch: 30, train_loss: 0.7008, test_loss: 0.9331, test_f1: 0.6464
 epoch: 31, train_loss: 0.6647, test_loss: 0.8778, test_f1: 0.6108
 epoch: 32, train_loss: 0.6416, test_loss: 0.9020, test_f1: 0.6573
 epoch: 33, train_loss: 0.6336, test_loss: 0.9380, test_f1: 0.6297
 epoch: 34, train_loss: 0.6103, test_loss: 0.9183, test_f1: 0.6230
 epoch: 35, train_loss: 0.6186, test_loss: 0.9036, test_f1: 0.6174
 epoch: 36, train_loss: 0.6015, test_loss: 0.8663, test_f1: 0.6467
 epoch: 37, train_loss: 0.6193, test_loss: 0.9315, test_f1: 0.6127
 epoch: 38, train_loss: 0.6189, test_loss: 0.9552, test_f1: 0.6233
 epoch: 39, train_loss: 0.6044, test_loss: 1.0299, test_f1: 0.6462
 epoch: 40, train_loss: 0.5925, test_loss: 1.0792, test_f1: 0.6606
 epoch: 41, train_loss: 0.5790, test_loss: 0.9197, test_f1: 0.6614
 epoch: 42, train_loss: 0.6033, test_loss: 0.9880, test_f1: 0.6484
 epoch: 43, train_loss: 0.5941, test_loss: 0.8630, test_f1: 0.6649
 epoch: 44, train_loss: 0.5782, test_loss: 0.9198, test_f1: 0.6293
 epoch: 45, train_loss: 0.5773, test_loss: 0.7603, test_f1: 0.6806
 epoch: 46, train_loss: 0.5645, test_loss: 0.8194, test_f1: 0.6368
 epoch: 47, train_loss: 0.5528, test_loss: 1.0684, test_f1: 0.6249
 epoch: 48, train_loss: 0.5606, test_loss: 0.8881, test_f1: 0.6432
 epoch: 49, train_loss: 0.5440, test_loss: 0.8424, test_f1: 0.6267
 epoch: 50, train_loss: 0.5470, test_loss: 0.9318, test_f1: 0.6171
 epoch: 51, train_loss: 0.5095, test_loss: 0.8554, test_f1: 0.6566
 epoch: 52, train_loss: 0.4935, test_loss: 0.8166, test_f1: 0.6446
 epoch: 53, train_loss: 0.4657, test_loss: 0.8247, test_f1: 0.6701
 epoch: 54, train_loss: 0.4657, test_loss: 0.8298, test_f1: 0.6471
 epoch: 55, train_loss: 0.4644, test_loss: 0.7783, test_f1: 0.6873
 epoch: 56, train_loss: 0.4523, test_loss: 0.7389, test_f1: 0.6836
 epoch: 57, train_loss: 0.4353, test_loss: 0.7863, test_f1: 0.6844
 epoch: 58, train_loss: 0.4501, test_loss: 0.7783, test_f1: 0.6970
 epoch: 59, train_loss: 0.4297, test_loss: 0.7685, test_f1: 0.7082
 epoch: 60, train_loss: 0.4251, test_loss: 0.7801, test_f1: 0.6923
 epoch: 61, train_loss: 0.4284, test_loss: 0.8267, test_f1: 0.6740
 epoch: 62, train_loss: 0.4267, test_loss: 0.8665, test_f1: 0.6572
 epoch: 63, train_loss: 0.4184, test_loss: 0.7781, test_f1: 0.6826
 epoch: 64, train_loss: 0.4309, test_loss: 0.8780, test_f1: 0.6779
 epoch: 65, train_loss: 0.4271, test_loss: 0.8608, test_f1: 0.6644
 epoch: 66, train_loss: 0.4160, test_loss: 0.8243, test_f1: 0.6828
 epoch: 67, train_loss: 0.4128, test_loss: 0.9421, test_f1: 0.6323
 epoch: 68, train_loss: 0.4368, test_loss: 0.8435, test_f1: 0.6843
 epoch: 69, train_loss: 0.3976, test_loss: 0.8336, test_f1: 0.6637
 epoch: 70, train_loss: 0.4026, test_loss: 0.8885, test_f1: 0.6466
 epoch: 71, train_loss: 0.4185, test_loss: 0.8146, test_f1: 0.6654
 epoch: 72, train_loss: 0.4050, test_loss: 0.9608, test_f1: 0.6588
 epoch: 73, train_loss: 0.3944, test_loss: 0.9324, test_f1: 0.6586
 epoch: 74, train_loss: 0.3942, test_loss: 0.8001, test_f1: 0.7032
 epoch: 75, train_loss: 0.4007, test_loss: 0.8966, test_f1: 0.6804
 epoch: 76, train_loss: 0.3974, test_loss: 0.8063, test_f1: 0.6678
 epoch: 77, train_loss: 0.3932, test_loss: 0.7700, test_f1: 0.6824
 epoch: 78, train_loss: 0.3936, test_loss: 0.8521, test_f1: 0.6659
 epoch: 79, train_loss: 0.3806, test_loss: 0.7385, test_f1: 0.6954
 epoch: 80, train_loss: 0.3728, test_loss: 0.7765, test_f1: 0.6758
 epoch: 81, train_loss: 0.3674, test_loss: 0.8780, test_f1: 0.6788
 epoch: 82, train_loss: 0.3407, test_loss: 0.8189, test_f1: 0.6600
 epoch: 83, train_loss: 0.3950, test_loss: 0.8301, test_f1: 0.6697
 epoch: 84, train_loss: 0.3706, test_loss: 0.9121, test_f1: 0.6734
 epoch: 85, train_loss: 0.3821, test_loss: 0.9575, test_f1: 0.6436
 epoch: 86, train_loss: 0.3714, test_loss: 0.8476, test_f1: 0.6792
 epoch: 87, train_loss: 0.3703, test_loss: 0.8653, test_f1: 0.6666
 epoch: 88, train_loss: 0.3610, test_loss: 0.9791, test_f1: 0.6534
 epoch: 89, train_loss: 0.3578, test_loss: 1.1220, test_f1: 0.6271
 epoch: 90, train_loss: 0.3441, test_loss: 1.0243, test_f1: 0.6722
 epoch: 91, train_loss: 0.3464, test_loss: 0.9963, test_f1: 0.6662
 epoch: 92, train_loss: 0.3645, test_loss: 0.9668, test_f1: 0.6799
 epoch: 93, train_loss: 0.3292, test_loss: 0.9408, test_f1: 0.7172
 epoch: 94, train_loss: 0.3225, test_loss: 0.9861, test_f1: 0.6915
 epoch: 95, train_loss: 0.3910, test_loss: 1.0006, test_f1: 0.6639
 epoch: 96, train_loss: 0.3498, test_loss: 0.9780, test_f1: 0.6785
 epoch: 97, train_loss: 0.3520, test_loss: 0.8793, test_f1: 0.6830
 epoch: 98, train_loss: 0.3210, test_loss: 1.0841, test_f1: 0.6565
 epoch: 99, train_loss: 0.3154, test_loss: 0.9641, test_f1: 0.6623
##################ITERATION #9 ****************************************
 epoch: 0, train_loss: 1.2870, test_loss: 1.1636, test_f1: 0.3490
 epoch: 1, train_loss: 1.0181, test_loss: 1.1005, test_f1: 0.4504
 epoch: 2, train_loss: 0.9721, test_loss: 1.0218, test_f1: 0.4941
 epoch: 3, train_loss: 0.9414, test_loss: 1.0234, test_f1: 0.5025
 epoch: 4, train_loss: 0.9254, test_loss: 1.0183, test_f1: 0.4560
 epoch: 5, train_loss: 0.8895, test_loss: 1.0607, test_f1: 0.4858
 epoch: 6, train_loss: 0.8970, test_loss: 0.9955, test_f1: 0.5063
 epoch: 7, train_loss: 0.8645, test_loss: 1.1042, test_f1: 0.4983
 epoch: 8, train_loss: 0.8649, test_loss: 1.1947, test_f1: 0.4444
 epoch: 9, train_loss: 0.8306, test_loss: 0.8839, test_f1: 0.5695
 epoch: 10, train_loss: 0.8330, test_loss: 0.9575, test_f1: 0.5517
 epoch: 11, train_loss: 0.8243, test_loss: 1.0266, test_f1: 0.4943
 epoch: 12, train_loss: 0.8130, test_loss: 1.0028, test_f1: 0.5849
 epoch: 13, train_loss: 0.7982, test_loss: 0.9344, test_f1: 0.6447
 epoch: 14, train_loss: 0.7721, test_loss: 1.1296, test_f1: 0.5322
 epoch: 15, train_loss: 0.7586, test_loss: 0.8793, test_f1: 0.5553
 epoch: 16, train_loss: 0.7694, test_loss: 0.9693, test_f1: 0.5620
 epoch: 17, train_loss: 0.7383, test_loss: 1.1636, test_f1: 0.4696
 epoch: 18, train_loss: 0.7330, test_loss: 0.9422, test_f1: 0.5808
 epoch: 19, train_loss: 0.7407, test_loss: 1.1342, test_f1: 0.4714
 epoch: 20, train_loss: 0.7246, test_loss: 0.9734, test_f1: 0.5797
 epoch: 21, train_loss: 0.7174, test_loss: 1.0156, test_f1: 0.5520
 epoch: 22, train_loss: 0.6987, test_loss: 0.9734, test_f1: 0.5144
 epoch: 23, train_loss: 0.7028, test_loss: 1.2502, test_f1: 0.5292
 epoch: 24, train_loss: 0.6952, test_loss: 0.8531, test_f1: 0.6261
 epoch: 25, train_loss: 0.7025, test_loss: 0.8452, test_f1: 0.5981
 epoch: 26, train_loss: 0.6725, test_loss: 0.9132, test_f1: 0.6039
 epoch: 27, train_loss: 0.6651, test_loss: 0.9857, test_f1: 0.5757
 epoch: 28, train_loss: 0.6799, test_loss: 0.9999, test_f1: 0.6076
 epoch: 29, train_loss: 0.6834, test_loss: 0.9131, test_f1: 0.6365
 epoch: 30, train_loss: 0.6698, test_loss: 0.9584, test_f1: 0.6194
 epoch: 31, train_loss: 0.6489, test_loss: 0.9612, test_f1: 0.6337
 epoch: 32, train_loss: 0.6692, test_loss: 1.2581, test_f1: 0.5865
 epoch: 33, train_loss: 0.6746, test_loss: 0.9166, test_f1: 0.6375
 epoch: 34, train_loss: 0.6189, test_loss: 1.1278, test_f1: 0.6203
 epoch: 35, train_loss: 0.6386, test_loss: 0.9069, test_f1: 0.6160
 epoch: 36, train_loss: 0.6061, test_loss: 1.0991, test_f1: 0.5967
 epoch: 37, train_loss: 0.6106, test_loss: 0.8479, test_f1: 0.6618
 epoch: 38, train_loss: 0.6027, test_loss: 0.9499, test_f1: 0.6123
 epoch: 39, train_loss: 0.6157, test_loss: 1.0653, test_f1: 0.6143
 epoch: 40, train_loss: 0.6044, test_loss: 0.8055, test_f1: 0.6661
 epoch: 41, train_loss: 0.6050, test_loss: 0.9251, test_f1: 0.6302
 epoch: 42, train_loss: 0.5793, test_loss: 1.0567, test_f1: 0.6481
 epoch: 43, train_loss: 0.6037, test_loss: 0.8846, test_f1: 0.6485
 epoch: 44, train_loss: 0.6073, test_loss: 1.5230, test_f1: 0.4633
 epoch: 45, train_loss: 0.6432, test_loss: 1.1179, test_f1: 0.6228
 epoch: 46, train_loss: 0.6234, test_loss: 0.8976, test_f1: 0.6598
 epoch: 47, train_loss: 0.5844, test_loss: 0.9738, test_f1: 0.6249
 epoch: 48, train_loss: 0.5925, test_loss: 0.9543, test_f1: 0.6583
 epoch: 49, train_loss: 0.5894, test_loss: 1.2382, test_f1: 0.5893
 epoch: 50, train_loss: 0.5671, test_loss: 1.0116, test_f1: 0.6115
 epoch: 51, train_loss: 0.5544, test_loss: 0.9721, test_f1: 0.6698
 epoch: 52, train_loss: 0.5273, test_loss: 1.0337, test_f1: 0.6532
 epoch: 53, train_loss: 0.4996, test_loss: 0.9295, test_f1: 0.6466
 epoch: 54, train_loss: 0.4875, test_loss: 1.0286, test_f1: 0.6714
 epoch: 55, train_loss: 0.4944, test_loss: 1.2060, test_f1: 0.6190
 epoch: 56, train_loss: 0.4838, test_loss: 1.0073, test_f1: 0.6602
 epoch: 57, train_loss: 0.4636, test_loss: 1.1195, test_f1: 0.6577
 epoch: 58, train_loss: 0.4601, test_loss: 0.9878, test_f1: 0.6690
 epoch: 59, train_loss: 0.4596, test_loss: 1.1242, test_f1: 0.6785
 epoch: 60, train_loss: 0.4626, test_loss: 0.9562, test_f1: 0.6674
 epoch: 61, train_loss: 0.4442, test_loss: 1.2363, test_f1: 0.6306
 epoch: 62, train_loss: 0.4581, test_loss: 1.1751, test_f1: 0.6436
 epoch: 63, train_loss: 0.4551, test_loss: 1.0753, test_f1: 0.6483
 epoch: 64, train_loss: 0.4649, test_loss: 1.1579, test_f1: 0.6610
 epoch: 65, train_loss: 0.4494, test_loss: 1.1386, test_f1: 0.6409
 epoch: 66, train_loss: 0.4403, test_loss: 1.0273, test_f1: 0.6642
 epoch: 67, train_loss: 0.4353, test_loss: 1.1128, test_f1: 0.6336
 epoch: 68, train_loss: 0.4251, test_loss: 1.1975, test_f1: 0.6665
 epoch: 69, train_loss: 0.4259, test_loss: 1.3470, test_f1: 0.6273
 epoch: 70, train_loss: 0.4331, test_loss: 1.0566, test_f1: 0.6593
 epoch: 71, train_loss: 0.4180, test_loss: 1.1908, test_f1: 0.6488
 epoch: 72, train_loss: 0.4043, test_loss: 1.1430, test_f1: 0.6716
 epoch: 73, train_loss: 0.4430, test_loss: 1.1929, test_f1: 0.6322
 epoch: 74, train_loss: 0.4136, test_loss: 1.2434, test_f1: 0.6519
 epoch: 75, train_loss: 0.4112, test_loss: 1.1129, test_f1: 0.6614
 epoch: 76, train_loss: 0.4044, test_loss: 1.3479, test_f1: 0.6538
 epoch: 77, train_loss: 0.4146, test_loss: 1.0966, test_f1: 0.6567
 epoch: 78, train_loss: 0.4040, test_loss: 1.2730, test_f1: 0.6822
 epoch: 79, train_loss: 0.3969, test_loss: 1.1721, test_f1: 0.6564
 epoch: 80, train_loss: 0.3873, test_loss: 1.2794, test_f1: 0.6605
 epoch: 81, train_loss: 0.3745, test_loss: 1.3916, test_f1: 0.6615
 epoch: 82, train_loss: 0.4036, test_loss: 1.3774, test_f1: 0.6405
 epoch: 83, train_loss: 0.4093, test_loss: 1.3221, test_f1: 0.6143
 epoch: 84, train_loss: 0.3666, test_loss: 1.2296, test_f1: 0.6597
 epoch: 85, train_loss: 0.3786, test_loss: 1.2173, test_f1: 0.6923
 epoch: 86, train_loss: 0.3898, test_loss: 1.4659, test_f1: 0.6159
 epoch: 87, train_loss: 0.4020, test_loss: 1.1874, test_f1: 0.6479
 epoch: 88, train_loss: 0.3757, test_loss: 1.1608, test_f1: 0.6746
 epoch: 89, train_loss: 0.3699, test_loss: 1.3909, test_f1: 0.6119
 epoch: 90, train_loss: 0.3717, test_loss: 1.1211, test_f1: 0.6835
 epoch: 91, train_loss: 0.3724, test_loss: 1.2456, test_f1: 0.6525
 epoch: 92, train_loss: 0.3618, test_loss: 1.1814, test_f1: 0.6607
 epoch: 93, train_loss: 0.3598, test_loss: 1.2834, test_f1: 0.6446
 epoch: 94, train_loss: 0.3547, test_loss: 1.3619, test_f1: 0.6471
 epoch: 95, train_loss: 0.3517, test_loss: 1.2617, test_f1: 0.6684
 epoch: 96, train_loss: 0.3906, test_loss: 1.1948, test_f1: 0.6731
 epoch: 97, train_loss: 0.3637, test_loss: 1.4331, test_f1: 0.6539
 epoch: 98, train_loss: 0.3490, test_loss: 1.4429, test_f1: 0.6355
 epoch: 99, train_loss: 0.3700, test_loss: 1.2471, test_f1: 0.6465

Training completed in 486.49 seconds
Best F1: 0.7172 at epoch 93
Mean F1 across iterations: 0.6945  0.0134
========================FINAL RESULTS================================
FEGIN weighted F1: 0.7172  0.0134
python main.py --data ltspice_examples --representation component_pin --model FEGIN --layers 3 --hiddens 64 --batch_size 128 --lr 0.01 --emb_size 250 --epochs 100 --save_appendix component_pin_L3_H64_BS128_LR0.01_E250 --no_val
-----



STDERR:
  File "main.py", line 370, in <module>
    main()
  File "main.py", line 254, in main
    dataset = dataset_class(
  File "/home/philip/projects/ltspice_examples_code_repo/Circuit-Completion-Using-GNNs/component_classification_with_link_prediction_head/evaluation/FEGIN/kernel/circuit_datasets.py", line 15, in __init__
    self.data, self.slices = torch.load(self.processed_paths[0])
  File "/home/philip/.local/lib/python3.8/site-packages/torch/serialization.py", line 1040, in load
    warnings.warn(
  File "/usr/lib/python3.8/warnings.py", line 109, in _showwarnmsg
    sw(msg.message, msg.category, msg.filename, msg.lineno,
  File "main.py", line 47, in warn_with_traceback
    traceback.print_stack(file=log)
/home/philip/projects/ltspice_examples_code_repo/Circuit-Completion-Using-GNNs/component_classification_with_link_prediction_head/evaluation/FEGIN/kernel/circuit_datasets.py:15: FutureWarning: You are using `torch.load` with `weights_only=False` (the current default value), which uses the default pickle module implicitly. It is possible to construct malicious pickle data which will execute arbitrary code during unpickling (See https://github.com/pytorch/pytorch/blob/main/SECURITY.md#untrusted-models for more details). In a future release, the default value for `weights_only` will be flipped to `True`. This limits the functions that could be executed during unpickling. Arbitrary objects will no longer be allowed to be loaded via this mode unless they are explicitly allowlisted by the user via `torch.serialization.add_safe_globals`. We recommend you start setting `weights_only=True` for any use case where you don't have full control of the loaded file. Please open an issue on GitHub for any issues related to this experimental feature.
  self.data, self.slices = torch.load(self.processed_paths[0])
