STDOUT:
Results will be saved in /home/philip/projects/ltspice_examples_code_repo/Circuit-Completion-Using-GNNs/component_classification_with_link_prediction_head/evaluation/FEGIN/results/model_FEGIN_dataset_ltspice_demos
Command line input: python main.py --data ltspice_demos --representation component_pin_net --model FEGIN --layers 6 --hiddens 128 --batch_size 32 --lr 0.001 --emb_size 128 --epochs 100 --save_appendix component_pin_net_L6_H128_BS32_LR0.001_E128 --no_val
 is saved.
-----
ltspice_demos - FEGIN
Using 6 layers, 128 hidden units, h = 2
Loading component_pin_net representation dataset
ENTERED
Training FEGIN on component_pin_net representation
Train: 1565, Test: 383
##################ITERATION #0 ****************************************
 epoch: 0, train_loss: 1.1859, test_loss: 1.1128, test_f1: 0.4230
 epoch: 1, train_loss: 1.0105, test_loss: 1.0620, test_f1: 0.4067
 epoch: 2, train_loss: 0.9660, test_loss: 1.0370, test_f1: 0.4993
 epoch: 3, train_loss: 0.9286, test_loss: 1.0514, test_f1: 0.4384
 epoch: 4, train_loss: 0.9123, test_loss: 1.0276, test_f1: 0.5688
 epoch: 5, train_loss: 0.8844, test_loss: 0.9656, test_f1: 0.5415
 epoch: 6, train_loss: 0.8754, test_loss: 1.0158, test_f1: 0.5635
 epoch: 7, train_loss: 0.8288, test_loss: 1.1297, test_f1: 0.5282
 epoch: 8, train_loss: 0.7961, test_loss: 1.0796, test_f1: 0.5803
 epoch: 9, train_loss: 0.8140, test_loss: 1.0444, test_f1: 0.5049
 epoch: 10, train_loss: 0.7635, test_loss: 1.1704, test_f1: 0.5961
 epoch: 11, train_loss: 0.7208, test_loss: 1.0115, test_f1: 0.5398
 epoch: 12, train_loss: 0.7189, test_loss: 1.1563, test_f1: 0.5515
 epoch: 13, train_loss: 0.7146, test_loss: 1.1070, test_f1: 0.5143
 epoch: 14, train_loss: 0.6702, test_loss: 0.9464, test_f1: 0.6443
 epoch: 15, train_loss: 0.6867, test_loss: 0.9781, test_f1: 0.5888
 epoch: 16, train_loss: 0.6315, test_loss: 1.0578, test_f1: 0.5900
 epoch: 17, train_loss: 0.6235, test_loss: 1.1012, test_f1: 0.6097
 epoch: 18, train_loss: 0.5920, test_loss: 1.1699, test_f1: 0.6020
 epoch: 19, train_loss: 0.6049, test_loss: 1.0008, test_f1: 0.6420
 epoch: 20, train_loss: 0.5872, test_loss: 1.1144, test_f1: 0.6450
 epoch: 21, train_loss: 0.6011, test_loss: 1.0752, test_f1: 0.6045
 epoch: 22, train_loss: 0.5570, test_loss: 1.0790, test_f1: 0.6407
 epoch: 23, train_loss: 0.5577, test_loss: 1.1811, test_f1: 0.6003
 epoch: 24, train_loss: 0.5635, test_loss: 1.1403, test_f1: 0.5817
 epoch: 25, train_loss: 0.5479, test_loss: 1.2306, test_f1: 0.6123
 epoch: 26, train_loss: 0.5202, test_loss: 1.1970, test_f1: 0.6357
 epoch: 27, train_loss: 0.4920, test_loss: 1.3355, test_f1: 0.6096
 epoch: 28, train_loss: 0.5213, test_loss: 1.3169, test_f1: 0.5925
 epoch: 29, train_loss: 0.4979, test_loss: 1.4766, test_f1: 0.5524
 epoch: 30, train_loss: 0.4807, test_loss: 1.2190, test_f1: 0.6031
 epoch: 31, train_loss: 0.4672, test_loss: 1.2320, test_f1: 0.6581
 epoch: 32, train_loss: 0.4621, test_loss: 1.2902, test_f1: 0.6165
 epoch: 33, train_loss: 0.4124, test_loss: 1.5229, test_f1: 0.6371
 epoch: 34, train_loss: 0.4657, test_loss: 1.4685, test_f1: 0.6032
 epoch: 35, train_loss: 0.4338, test_loss: 1.2755, test_f1: 0.6474
 epoch: 36, train_loss: 0.4274, test_loss: 1.4163, test_f1: 0.6048
 epoch: 37, train_loss: 0.4451, test_loss: 1.4394, test_f1: 0.6061
 epoch: 38, train_loss: 0.4087, test_loss: 1.3808, test_f1: 0.6159
 epoch: 39, train_loss: 0.3996, test_loss: 1.7129, test_f1: 0.5933
 epoch: 40, train_loss: 0.4056, test_loss: 1.4538, test_f1: 0.6637
 epoch: 41, train_loss: 0.3722, test_loss: 1.4971, test_f1: 0.6145
 epoch: 42, train_loss: 0.3465, test_loss: 1.6995, test_f1: 0.6455
 epoch: 43, train_loss: 0.3565, test_loss: 1.5793, test_f1: 0.6463
 epoch: 44, train_loss: 0.3857, test_loss: 1.7694, test_f1: 0.6057
 epoch: 45, train_loss: 0.3669, test_loss: 1.7772, test_f1: 0.6251
 epoch: 46, train_loss: 0.3600, test_loss: 1.7438, test_f1: 0.6251
 epoch: 47, train_loss: 0.3901, test_loss: 1.6444, test_f1: 0.6081
 epoch: 48, train_loss: 0.3572, test_loss: 1.6905, test_f1: 0.6027
 epoch: 49, train_loss: 0.3547, test_loss: 1.9745, test_f1: 0.5956
 epoch: 50, train_loss: 0.3041, test_loss: 1.9418, test_f1: 0.6335
 epoch: 51, train_loss: 0.2573, test_loss: 2.1025, test_f1: 0.5865
 epoch: 52, train_loss: 0.2664, test_loss: 2.1697, test_f1: 0.6152
 epoch: 53, train_loss: 0.2327, test_loss: 2.2210, test_f1: 0.6183
 epoch: 54, train_loss: 0.2371, test_loss: 2.2568, test_f1: 0.6121
 epoch: 55, train_loss: 0.2324, test_loss: 2.2737, test_f1: 0.5905
 epoch: 56, train_loss: 0.2244, test_loss: 2.2953, test_f1: 0.6140
 epoch: 57, train_loss: 0.2322, test_loss: 2.3526, test_f1: 0.5940
 epoch: 58, train_loss: 0.2225, test_loss: 2.4586, test_f1: 0.6067
 epoch: 59, train_loss: 0.2366, test_loss: 2.4301, test_f1: 0.6280
 epoch: 60, train_loss: 0.2093, test_loss: 2.4213, test_f1: 0.5695
 epoch: 61, train_loss: 0.1792, test_loss: 2.5799, test_f1: 0.6168
 epoch: 62, train_loss: 0.1996, test_loss: 2.6438, test_f1: 0.5946
 epoch: 63, train_loss: 0.2006, test_loss: 2.4557, test_f1: 0.5960
 epoch: 64, train_loss: 0.1907, test_loss: 2.6035, test_f1: 0.6146
 epoch: 65, train_loss: 0.2145, test_loss: 3.0477, test_f1: 0.6064
 epoch: 66, train_loss: 0.2152, test_loss: 2.5967, test_f1: 0.6396
 epoch: 67, train_loss: 0.1659, test_loss: 2.7708, test_f1: 0.6159
 epoch: 68, train_loss: 0.1981, test_loss: 2.7718, test_f1: 0.5941
 epoch: 69, train_loss: 0.1810, test_loss: 2.9253, test_f1: 0.6042
 epoch: 70, train_loss: 0.1977, test_loss: 2.9216, test_f1: 0.6096
 epoch: 71, train_loss: 0.1730, test_loss: 2.8997, test_f1: 0.6181
 epoch: 72, train_loss: 0.1374, test_loss: 2.9485, test_f1: 0.6072
 epoch: 73, train_loss: 0.1779, test_loss: 3.3493, test_f1: 0.5905
 epoch: 74, train_loss: 0.1502, test_loss: 3.1928, test_f1: 0.5941
 epoch: 75, train_loss: 0.1720, test_loss: 2.8825, test_f1: 0.6182
 epoch: 76, train_loss: 0.1829, test_loss: 2.8552, test_f1: 0.5911
 epoch: 77, train_loss: 0.1549, test_loss: 3.1878, test_f1: 0.5950
 epoch: 78, train_loss: 0.1293, test_loss: 3.2228, test_f1: 0.5867
 epoch: 79, train_loss: 0.1415, test_loss: 3.2407, test_f1: 0.6000
 epoch: 80, train_loss: 0.1403, test_loss: 3.1215, test_f1: 0.6036
 epoch: 81, train_loss: 0.1910, test_loss: 3.1266, test_f1: 0.5802
 epoch: 82, train_loss: 0.1592, test_loss: 3.1117, test_f1: 0.5875
 epoch: 83, train_loss: 0.1488, test_loss: 3.1359, test_f1: 0.6057
 epoch: 84, train_loss: 0.1337, test_loss: 3.1122, test_f1: 0.5990
 epoch: 85, train_loss: 0.1287, test_loss: 3.3662, test_f1: 0.5809
 epoch: 86, train_loss: 0.1147, test_loss: 3.4245, test_f1: 0.6035
 epoch: 87, train_loss: 0.0945, test_loss: 3.5294, test_f1: 0.6092
 epoch: 88, train_loss: 0.1229, test_loss: 3.4804, test_f1: 0.6285
 epoch: 89, train_loss: 0.1324, test_loss: 3.8921, test_f1: 0.5797
 epoch: 90, train_loss: 0.1390, test_loss: 3.1626, test_f1: 0.5927
 epoch: 91, train_loss: 0.1438, test_loss: 3.1211, test_f1: 0.5902
 epoch: 92, train_loss: 0.1372, test_loss: 3.4637, test_f1: 0.5845
 epoch: 93, train_loss: 0.1601, test_loss: 3.2972, test_f1: 0.5940
 epoch: 94, train_loss: 0.1049, test_loss: 3.1328, test_f1: 0.6274
 epoch: 95, train_loss: 0.1328, test_loss: 3.2071, test_f1: 0.6127
 epoch: 96, train_loss: 0.1110, test_loss: 3.4767, test_f1: 0.5927
 epoch: 97, train_loss: 0.0876, test_loss: 3.5828, test_f1: 0.6083
 epoch: 98, train_loss: 0.1073, test_loss: 3.7749, test_f1: 0.5857
 epoch: 99, train_loss: 0.1149, test_loss: 3.7345, test_f1: 0.5980
##################ITERATION #1 ****************************************
 epoch: 0, train_loss: 1.1055, test_loss: 1.1602, test_f1: 0.3599
 epoch: 1, train_loss: 0.9731, test_loss: 1.0572, test_f1: 0.5195
 epoch: 2, train_loss: 0.9135, test_loss: 0.9838, test_f1: 0.5616
 epoch: 3, train_loss: 0.8674, test_loss: 1.0421, test_f1: 0.5515
 epoch: 4, train_loss: 0.8532, test_loss: 1.0564, test_f1: 0.5369
 epoch: 5, train_loss: 0.8335, test_loss: 0.9968, test_f1: 0.5296
 epoch: 6, train_loss: 0.7841, test_loss: 1.1537, test_f1: 0.4689
 epoch: 7, train_loss: 0.7715, test_loss: 0.9581, test_f1: 0.6010
 epoch: 8, train_loss: 0.7512, test_loss: 1.0022, test_f1: 0.6011
 epoch: 9, train_loss: 0.7180, test_loss: 1.0809, test_f1: 0.5265
 epoch: 10, train_loss: 0.7110, test_loss: 1.2079, test_f1: 0.5313
 epoch: 11, train_loss: 0.6754, test_loss: 1.2177, test_f1: 0.5869
 epoch: 12, train_loss: 0.6789, test_loss: 0.9973, test_f1: 0.6082
 epoch: 13, train_loss: 0.6407, test_loss: 1.1146, test_f1: 0.5938
 epoch: 14, train_loss: 0.6348, test_loss: 1.1582, test_f1: 0.5861
 epoch: 15, train_loss: 0.6204, test_loss: 1.1053, test_f1: 0.5867
 epoch: 16, train_loss: 0.6169, test_loss: 1.0895, test_f1: 0.5488
 epoch: 17, train_loss: 0.6146, test_loss: 1.1861, test_f1: 0.6014
 epoch: 18, train_loss: 0.6058, test_loss: 1.2293, test_f1: 0.5419
 epoch: 19, train_loss: 0.5740, test_loss: 1.0735, test_f1: 0.6072
 epoch: 20, train_loss: 0.5677, test_loss: 1.2177, test_f1: 0.5560
 epoch: 21, train_loss: 0.5631, test_loss: 1.3029, test_f1: 0.5939
 epoch: 22, train_loss: 0.5462, test_loss: 1.1984, test_f1: 0.5863
 epoch: 23, train_loss: 0.5259, test_loss: 1.4211, test_f1: 0.5917
 epoch: 24, train_loss: 0.5032, test_loss: 1.4203, test_f1: 0.5678
 epoch: 25, train_loss: 0.5252, test_loss: 1.3746, test_f1: 0.5528
 epoch: 26, train_loss: 0.4865, test_loss: 1.3439, test_f1: 0.5939
 epoch: 27, train_loss: 0.4746, test_loss: 1.3110, test_f1: 0.6237
 epoch: 28, train_loss: 0.4533, test_loss: 1.4087, test_f1: 0.6247
 epoch: 29, train_loss: 0.4448, test_loss: 1.4608, test_f1: 0.6050
 epoch: 30, train_loss: 0.4376, test_loss: 1.4079, test_f1: 0.6231
 epoch: 31, train_loss: 0.4489, test_loss: 1.4000, test_f1: 0.6009
 epoch: 32, train_loss: 0.4423, test_loss: 1.8432, test_f1: 0.5039
 epoch: 33, train_loss: 0.4063, test_loss: 1.5095, test_f1: 0.6266
 epoch: 34, train_loss: 0.4050, test_loss: 1.6644, test_f1: 0.5798
 epoch: 35, train_loss: 0.3999, test_loss: 1.8184, test_f1: 0.5685
 epoch: 36, train_loss: 0.3806, test_loss: 1.8024, test_f1: 0.6078
 epoch: 37, train_loss: 0.4121, test_loss: 1.7923, test_f1: 0.5609
 epoch: 38, train_loss: 0.3784, test_loss: 1.7160, test_f1: 0.5831
 epoch: 39, train_loss: 0.3955, test_loss: 1.7188, test_f1: 0.6149
 epoch: 40, train_loss: 0.3777, test_loss: 1.6789, test_f1: 0.6134
 epoch: 41, train_loss: 0.3408, test_loss: 1.9738, test_f1: 0.6058
 epoch: 42, train_loss: 0.3589, test_loss: 1.7011, test_f1: 0.6350
 epoch: 43, train_loss: 0.3051, test_loss: 2.0271, test_f1: 0.6033
 epoch: 44, train_loss: 0.3128, test_loss: 2.1801, test_f1: 0.5515
 epoch: 45, train_loss: 0.3419, test_loss: 2.0126, test_f1: 0.5981
 epoch: 46, train_loss: 0.3642, test_loss: 1.8230, test_f1: 0.6117
 epoch: 47, train_loss: 0.3448, test_loss: 1.8508, test_f1: 0.6012
 epoch: 48, train_loss: 0.3642, test_loss: 2.0530, test_f1: 0.6005
 epoch: 49, train_loss: 0.2983, test_loss: 2.0519, test_f1: 0.6021
 epoch: 50, train_loss: 0.3158, test_loss: 2.2708, test_f1: 0.6061
 epoch: 51, train_loss: 0.2600, test_loss: 2.1186, test_f1: 0.5894
 epoch: 52, train_loss: 0.2473, test_loss: 2.3762, test_f1: 0.5858
 epoch: 53, train_loss: 0.2259, test_loss: 2.3719, test_f1: 0.5694
 epoch: 54, train_loss: 0.1938, test_loss: 2.4662, test_f1: 0.5786
 epoch: 55, train_loss: 0.2015, test_loss: 2.4191, test_f1: 0.5825
 epoch: 56, train_loss: 0.2089, test_loss: 2.4492, test_f1: 0.6040
 epoch: 57, train_loss: 0.2144, test_loss: 2.5315, test_f1: 0.6242
 epoch: 58, train_loss: 0.1983, test_loss: 2.7591, test_f1: 0.5615
 epoch: 59, train_loss: 0.1963, test_loss: 2.7638, test_f1: 0.5751
 epoch: 60, train_loss: 0.1820, test_loss: 2.7307, test_f1: 0.6005
 epoch: 61, train_loss: 0.2037, test_loss: 2.6316, test_f1: 0.5844
 epoch: 62, train_loss: 0.1756, test_loss: 2.8156, test_f1: 0.6128
 epoch: 63, train_loss: 0.1872, test_loss: 2.9519, test_f1: 0.5763
 epoch: 64, train_loss: 0.1600, test_loss: 2.9849, test_f1: 0.5802
 epoch: 65, train_loss: 0.1613, test_loss: 3.0360, test_f1: 0.5989
 epoch: 66, train_loss: 0.1944, test_loss: 2.8889, test_f1: 0.6152
 epoch: 67, train_loss: 0.1548, test_loss: 2.9903, test_f1: 0.5873
 epoch: 68, train_loss: 0.1696, test_loss: 2.9711, test_f1: 0.6001
 epoch: 69, train_loss: 0.1621, test_loss: 2.9746, test_f1: 0.5838
 epoch: 70, train_loss: 0.1770, test_loss: 2.9545, test_f1: 0.5892
 epoch: 71, train_loss: 0.1615, test_loss: 2.7942, test_f1: 0.5853
 epoch: 72, train_loss: 0.1467, test_loss: 3.0389, test_f1: 0.6059
 epoch: 73, train_loss: 0.1473, test_loss: 3.1716, test_f1: 0.5728
 epoch: 74, train_loss: 0.1630, test_loss: 3.0828, test_f1: 0.5921
 epoch: 75, train_loss: 0.1281, test_loss: 2.9048, test_f1: 0.5791
 epoch: 76, train_loss: 0.1393, test_loss: 3.0107, test_f1: 0.5807
 epoch: 77, train_loss: 0.1306, test_loss: 3.1824, test_f1: 0.5597
 epoch: 78, train_loss: 0.1240, test_loss: 3.2542, test_f1: 0.6011
 epoch: 79, train_loss: 0.1440, test_loss: 3.2953, test_f1: 0.5720
 epoch: 80, train_loss: 0.1663, test_loss: 2.9676, test_f1: 0.5873
 epoch: 81, train_loss: 0.1426, test_loss: 3.0729, test_f1: 0.5675
 epoch: 82, train_loss: 0.1155, test_loss: 2.9257, test_f1: 0.6006
 epoch: 83, train_loss: 0.1542, test_loss: 3.3132, test_f1: 0.5529
 epoch: 84, train_loss: 0.1365, test_loss: 3.2251, test_f1: 0.5902
 epoch: 85, train_loss: 0.1272, test_loss: 3.2169, test_f1: 0.5942
 epoch: 86, train_loss: 0.1321, test_loss: 3.3674, test_f1: 0.5994
 epoch: 87, train_loss: 0.1163, test_loss: 3.4573, test_f1: 0.5681
 epoch: 88, train_loss: 0.1417, test_loss: 3.5324, test_f1: 0.5825
 epoch: 89, train_loss: 0.1516, test_loss: 3.3342, test_f1: 0.5860
 epoch: 90, train_loss: 0.1290, test_loss: 3.2646, test_f1: 0.5704
 epoch: 91, train_loss: 0.1107, test_loss: 3.3374, test_f1: 0.5838
 epoch: 92, train_loss: 0.1394, test_loss: 3.3141, test_f1: 0.5837
 epoch: 93, train_loss: 0.1425, test_loss: 3.0256, test_f1: 0.6015
 epoch: 94, train_loss: 0.1132, test_loss: 3.1170, test_f1: 0.6020
 epoch: 95, train_loss: 0.1056, test_loss: 3.1737, test_f1: 0.6019
 epoch: 96, train_loss: 0.0975, test_loss: 3.1716, test_f1: 0.6048
 epoch: 97, train_loss: 0.1166, test_loss: 3.1208, test_f1: 0.6054
 epoch: 98, train_loss: 0.1383, test_loss: 3.3588, test_f1: 0.5795
 epoch: 99, train_loss: 0.0926, test_loss: 3.5688, test_f1: 0.5878
##################ITERATION #2 ****************************************
 epoch: 0, train_loss: 1.1378, test_loss: 1.0789, test_f1: 0.5117
 epoch: 1, train_loss: 0.9811, test_loss: 1.0386, test_f1: 0.5417
 epoch: 2, train_loss: 0.9306, test_loss: 1.0736, test_f1: 0.5320
 epoch: 3, train_loss: 0.8669, test_loss: 1.0795, test_f1: 0.4846
 epoch: 4, train_loss: 0.8541, test_loss: 1.0207, test_f1: 0.5608
 epoch: 5, train_loss: 0.8417, test_loss: 1.1342, test_f1: 0.4988
 epoch: 6, train_loss: 0.8000, test_loss: 1.1344, test_f1: 0.5350
 epoch: 7, train_loss: 0.7713, test_loss: 1.0648, test_f1: 0.6231
 epoch: 8, train_loss: 0.7574, test_loss: 1.1835, test_f1: 0.5377
 epoch: 9, train_loss: 0.7397, test_loss: 1.1918, test_f1: 0.5497
 epoch: 10, train_loss: 0.7184, test_loss: 1.0643, test_f1: 0.5751
 epoch: 11, train_loss: 0.6974, test_loss: 1.1592, test_f1: 0.5572
 epoch: 12, train_loss: 0.7051, test_loss: 1.0339, test_f1: 0.6012
 epoch: 13, train_loss: 0.6644, test_loss: 1.1361, test_f1: 0.5736
 epoch: 14, train_loss: 0.6516, test_loss: 1.1725, test_f1: 0.5866
 epoch: 15, train_loss: 0.6253, test_loss: 1.1974, test_f1: 0.6027
 epoch: 16, train_loss: 0.6535, test_loss: 1.1953, test_f1: 0.5823
 epoch: 17, train_loss: 0.6056, test_loss: 1.1533, test_f1: 0.5731
 epoch: 18, train_loss: 0.5907, test_loss: 1.1174, test_f1: 0.5988
 epoch: 19, train_loss: 0.5820, test_loss: 1.1689, test_f1: 0.6303
 epoch: 20, train_loss: 0.5730, test_loss: 1.2190, test_f1: 0.5529
 epoch: 21, train_loss: 0.5624, test_loss: 1.2273, test_f1: 0.6360
 epoch: 22, train_loss: 0.5590, test_loss: 1.1198, test_f1: 0.6411
 epoch: 23, train_loss: 0.5313, test_loss: 1.4113, test_f1: 0.6090
 epoch: 24, train_loss: 0.5256, test_loss: 1.2510, test_f1: 0.6212
 epoch: 25, train_loss: 0.5052, test_loss: 1.4720, test_f1: 0.5825
 epoch: 26, train_loss: 0.4973, test_loss: 1.5310, test_f1: 0.5941
 epoch: 27, train_loss: 0.4924, test_loss: 1.3240, test_f1: 0.5763
 epoch: 28, train_loss: 0.4976, test_loss: 1.2393, test_f1: 0.6291
 epoch: 29, train_loss: 0.4791, test_loss: 1.3150, test_f1: 0.6105
 epoch: 30, train_loss: 0.4905, test_loss: 1.4806, test_f1: 0.6201
 epoch: 31, train_loss: 0.4747, test_loss: 1.4811, test_f1: 0.6199
 epoch: 32, train_loss: 0.4437, test_loss: 1.4884, test_f1: 0.6050
 epoch: 33, train_loss: 0.4164, test_loss: 1.4946, test_f1: 0.6041
 epoch: 34, train_loss: 0.4319, test_loss: 1.2813, test_f1: 0.6241
 epoch: 35, train_loss: 0.4242, test_loss: 1.3996, test_f1: 0.5929
 epoch: 36, train_loss: 0.4217, test_loss: 1.4259, test_f1: 0.6145
 epoch: 37, train_loss: 0.3528, test_loss: 1.5848, test_f1: 0.5854
 epoch: 38, train_loss: 0.3929, test_loss: 1.7314, test_f1: 0.6238
 epoch: 39, train_loss: 0.3562, test_loss: 1.6484, test_f1: 0.6326
 epoch: 40, train_loss: 0.3682, test_loss: 1.5680, test_f1: 0.6251
 epoch: 41, train_loss: 0.3460, test_loss: 1.6471, test_f1: 0.5979
 epoch: 42, train_loss: 0.3807, test_loss: 1.7114, test_f1: 0.5875
 epoch: 43, train_loss: 0.3880, test_loss: 1.4098, test_f1: 0.6177
 epoch: 44, train_loss: 0.3266, test_loss: 1.4813, test_f1: 0.5980
 epoch: 45, train_loss: 0.3800, test_loss: 1.7328, test_f1: 0.5816
 epoch: 46, train_loss: 0.3465, test_loss: 1.8483, test_f1: 0.6017
 epoch: 47, train_loss: 0.3584, test_loss: 1.7792, test_f1: 0.6033
 epoch: 48, train_loss: 0.3502, test_loss: 1.7899, test_f1: 0.5962
 epoch: 49, train_loss: 0.3453, test_loss: 1.7904, test_f1: 0.5735
 epoch: 50, train_loss: 0.3074, test_loss: 1.6161, test_f1: 0.6292
 epoch: 51, train_loss: 0.2374, test_loss: 1.7735, test_f1: 0.5894
 epoch: 52, train_loss: 0.2115, test_loss: 1.7476, test_f1: 0.6317
 epoch: 53, train_loss: 0.2216, test_loss: 1.8180, test_f1: 0.6367
 epoch: 54, train_loss: 0.2232, test_loss: 1.9812, test_f1: 0.6124
 epoch: 55, train_loss: 0.2383, test_loss: 1.9417, test_f1: 0.5940
 epoch: 56, train_loss: 0.2090, test_loss: 2.0540, test_f1: 0.6289
 epoch: 57, train_loss: 0.2011, test_loss: 2.1806, test_f1: 0.5690
 epoch: 58, train_loss: 0.1929, test_loss: 2.0721, test_f1: 0.6194
 epoch: 59, train_loss: 0.2077, test_loss: 2.3246, test_f1: 0.5583
 epoch: 60, train_loss: 0.1935, test_loss: 2.2113, test_f1: 0.5812
 epoch: 61, train_loss: 0.1875, test_loss: 1.9297, test_f1: 0.6069
 epoch: 62, train_loss: 0.1768, test_loss: 2.2851, test_f1: 0.5995
 epoch: 63, train_loss: 0.1942, test_loss: 2.2794, test_f1: 0.5973
 epoch: 64, train_loss: 0.1831, test_loss: 2.4390, test_f1: 0.5856
 epoch: 65, train_loss: 0.1947, test_loss: 2.2877, test_f1: 0.6025
 epoch: 66, train_loss: 0.1657, test_loss: 2.4277, test_f1: 0.5606
 epoch: 67, train_loss: 0.1510, test_loss: 2.5139, test_f1: 0.5798
 epoch: 68, train_loss: 0.1710, test_loss: 2.4404, test_f1: 0.5866
 epoch: 69, train_loss: 0.1641, test_loss: 2.3097, test_f1: 0.5815
 epoch: 70, train_loss: 0.1569, test_loss: 2.4314, test_f1: 0.6091
 epoch: 71, train_loss: 0.1759, test_loss: 2.4699, test_f1: 0.6064
 epoch: 72, train_loss: 0.1541, test_loss: 2.6456, test_f1: 0.5700
 epoch: 73, train_loss: 0.1534, test_loss: 2.8516, test_f1: 0.5607
 epoch: 74, train_loss: 0.1666, test_loss: 2.3742, test_f1: 0.6119
 epoch: 75, train_loss: 0.1656, test_loss: 2.6488, test_f1: 0.6006
 epoch: 76, train_loss: 0.1479, test_loss: 2.6804, test_f1: 0.5773
 epoch: 77, train_loss: 0.1389, test_loss: 2.8894, test_f1: 0.5646
 epoch: 78, train_loss: 0.1964, test_loss: 2.6073, test_f1: 0.6012
 epoch: 79, train_loss: 0.1809, test_loss: 2.3619, test_f1: 0.5926
 epoch: 80, train_loss: 0.1334, test_loss: 2.5358, test_f1: 0.5963
 epoch: 81, train_loss: 0.1495, test_loss: 2.6080, test_f1: 0.6162
 epoch: 82, train_loss: 0.1502, test_loss: 2.6531, test_f1: 0.5825
 epoch: 83, train_loss: 0.1359, test_loss: 2.6620, test_f1: 0.6000
 epoch: 84, train_loss: 0.1508, test_loss: 2.8523, test_f1: 0.5549
 epoch: 85, train_loss: 0.1114, test_loss: 2.5495, test_f1: 0.6010
 epoch: 86, train_loss: 0.1197, test_loss: 2.7718, test_f1: 0.6000
 epoch: 87, train_loss: 0.1294, test_loss: 2.9402, test_f1: 0.5925
 epoch: 88, train_loss: 0.1391, test_loss: 3.1400, test_f1: 0.5359
 epoch: 89, train_loss: 0.1376, test_loss: 2.6160, test_f1: 0.6089
 epoch: 90, train_loss: 0.1232, test_loss: 2.8849, test_f1: 0.6077
 epoch: 91, train_loss: 0.0923, test_loss: 2.7638, test_f1: 0.6005
 epoch: 92, train_loss: 0.1062, test_loss: 2.8839, test_f1: 0.6091
 epoch: 93, train_loss: 0.0972, test_loss: 3.1404, test_f1: 0.5684
 epoch: 94, train_loss: 0.1144, test_loss: 2.9052, test_f1: 0.5943
 epoch: 95, train_loss: 0.1459, test_loss: 2.9741, test_f1: 0.5880
 epoch: 96, train_loss: 0.1282, test_loss: 3.0770, test_f1: 0.6112
 epoch: 97, train_loss: 0.1049, test_loss: 3.1288, test_f1: 0.5840
 epoch: 98, train_loss: 0.0995, test_loss: 3.0212, test_f1: 0.6077
 epoch: 99, train_loss: 0.0953, test_loss: 3.3420, test_f1: 0.5789
##################ITERATION #3 ****************************************
 epoch: 0, train_loss: 1.1896, test_loss: 1.1684, test_f1: 0.4225
 epoch: 1, train_loss: 0.9864, test_loss: 1.0383, test_f1: 0.5498
 epoch: 2, train_loss: 0.9170, test_loss: 1.0594, test_f1: 0.4701
 epoch: 3, train_loss: 0.8973, test_loss: 1.0396, test_f1: 0.5243
 epoch: 4, train_loss: 0.8924, test_loss: 1.0704, test_f1: 0.5093
 epoch: 5, train_loss: 0.8332, test_loss: 1.0771, test_f1: 0.5182
 epoch: 6, train_loss: 0.8014, test_loss: 1.0360, test_f1: 0.5892
 epoch: 7, train_loss: 0.7932, test_loss: 1.0810, test_f1: 0.5845
 epoch: 8, train_loss: 0.7516, test_loss: 1.2047, test_f1: 0.5475
 epoch: 9, train_loss: 0.7375, test_loss: 1.1274, test_f1: 0.5595
 epoch: 10, train_loss: 0.6925, test_loss: 1.0618, test_f1: 0.6113
 epoch: 11, train_loss: 0.6992, test_loss: 1.1781, test_f1: 0.5704
 epoch: 12, train_loss: 0.6854, test_loss: 1.3233, test_f1: 0.5434
 epoch: 13, train_loss: 0.7030, test_loss: 1.0953, test_f1: 0.5975
 epoch: 14, train_loss: 0.6741, test_loss: 1.0855, test_f1: 0.5887
 epoch: 15, train_loss: 0.6094, test_loss: 1.0966, test_f1: 0.5976
 epoch: 16, train_loss: 0.6117, test_loss: 1.1101, test_f1: 0.5988
 epoch: 17, train_loss: 0.5909, test_loss: 1.2379, test_f1: 0.5993
 epoch: 18, train_loss: 0.5932, test_loss: 1.2467, test_f1: 0.6218
 epoch: 19, train_loss: 0.5462, test_loss: 1.4698, test_f1: 0.5350
 epoch: 20, train_loss: 0.5812, test_loss: 1.3619, test_f1: 0.5776
 epoch: 21, train_loss: 0.5545, test_loss: 1.2988, test_f1: 0.5822
 epoch: 22, train_loss: 0.5408, test_loss: 1.3451, test_f1: 0.5737
 epoch: 23, train_loss: 0.5299, test_loss: 1.2145, test_f1: 0.5679
 epoch: 24, train_loss: 0.5194, test_loss: 1.1630, test_f1: 0.6714
 epoch: 25, train_loss: 0.5055, test_loss: 1.3762, test_f1: 0.6050
 epoch: 26, train_loss: 0.5160, test_loss: 1.4456, test_f1: 0.5772
 epoch: 27, train_loss: 0.4617, test_loss: 1.3200, test_f1: 0.5882
 epoch: 28, train_loss: 0.4931, test_loss: 1.4064, test_f1: 0.5393
 epoch: 29, train_loss: 0.4334, test_loss: 1.4503, test_f1: 0.6195
 epoch: 30, train_loss: 0.4731, test_loss: 1.5727, test_f1: 0.5168
 epoch: 31, train_loss: 0.4259, test_loss: 1.3208, test_f1: 0.6416
 epoch: 32, train_loss: 0.4513, test_loss: 1.7715, test_f1: 0.5443
 epoch: 33, train_loss: 0.4287, test_loss: 1.4781, test_f1: 0.6242
 epoch: 34, train_loss: 0.4421, test_loss: 1.5265, test_f1: 0.5220
 epoch: 35, train_loss: 0.3914, test_loss: 1.5204, test_f1: 0.6021
 epoch: 36, train_loss: 0.4223, test_loss: 1.4427, test_f1: 0.6272
 epoch: 37, train_loss: 0.3710, test_loss: 1.8396, test_f1: 0.5526
 epoch: 38, train_loss: 0.3882, test_loss: 1.5279, test_f1: 0.5893
 epoch: 39, train_loss: 0.3635, test_loss: 1.4192, test_f1: 0.6521
 epoch: 40, train_loss: 0.3569, test_loss: 1.6029, test_f1: 0.5669
 epoch: 41, train_loss: 0.3929, test_loss: 1.6017, test_f1: 0.5756
 epoch: 42, train_loss: 0.3545, test_loss: 1.4896, test_f1: 0.6383
 epoch: 43, train_loss: 0.3253, test_loss: 1.9558, test_f1: 0.5981
 epoch: 44, train_loss: 0.3594, test_loss: 1.7422, test_f1: 0.6171
 epoch: 45, train_loss: 0.3657, test_loss: 1.6380, test_f1: 0.5857
 epoch: 46, train_loss: 0.2885, test_loss: 1.6648, test_f1: 0.6128
 epoch: 47, train_loss: 0.3601, test_loss: 1.5843, test_f1: 0.6185
 epoch: 48, train_loss: 0.2730, test_loss: 1.7056, test_f1: 0.5884
 epoch: 49, train_loss: 0.3452, test_loss: 2.1660, test_f1: 0.5456
 epoch: 50, train_loss: 0.3567, test_loss: 1.5604, test_f1: 0.6043
 epoch: 51, train_loss: 0.2737, test_loss: 1.7318, test_f1: 0.5996
 epoch: 52, train_loss: 0.2394, test_loss: 1.7016, test_f1: 0.6143
 epoch: 53, train_loss: 0.1981, test_loss: 1.8424, test_f1: 0.5927
 epoch: 54, train_loss: 0.1919, test_loss: 1.9210, test_f1: 0.6118
 epoch: 55, train_loss: 0.1902, test_loss: 1.9507, test_f1: 0.6182
 epoch: 56, train_loss: 0.1995, test_loss: 2.0224, test_f1: 0.5735
 epoch: 57, train_loss: 0.2156, test_loss: 2.0232, test_f1: 0.5939
 epoch: 58, train_loss: 0.1778, test_loss: 1.9272, test_f1: 0.6100
 epoch: 59, train_loss: 0.1839, test_loss: 2.2342, test_f1: 0.5943
 epoch: 60, train_loss: 0.1907, test_loss: 2.0968, test_f1: 0.6028
 epoch: 61, train_loss: 0.1901, test_loss: 2.2553, test_f1: 0.5973
 epoch: 62, train_loss: 0.1681, test_loss: 2.1079, test_f1: 0.6167
 epoch: 63, train_loss: 0.2087, test_loss: 2.3425, test_f1: 0.5772
 epoch: 64, train_loss: 0.2116, test_loss: 2.1629, test_f1: 0.6388
 epoch: 65, train_loss: 0.1808, test_loss: 2.2975, test_f1: 0.6277
 epoch: 66, train_loss: 0.1716, test_loss: 2.2317, test_f1: 0.6207
 epoch: 67, train_loss: 0.1815, test_loss: 2.2880, test_f1: 0.6041
 epoch: 68, train_loss: 0.1599, test_loss: 2.3024, test_f1: 0.6084
 epoch: 69, train_loss: 0.1562, test_loss: 2.3367, test_f1: 0.5908
 epoch: 70, train_loss: 0.1640, test_loss: 2.3493, test_f1: 0.6039
 epoch: 71, train_loss: 0.1508, test_loss: 2.2890, test_f1: 0.6006
 epoch: 72, train_loss: 0.1639, test_loss: 2.3432, test_f1: 0.6227
 epoch: 73, train_loss: 0.1388, test_loss: 2.3708, test_f1: 0.5908
 epoch: 74, train_loss: 0.1422, test_loss: 2.3428, test_f1: 0.6339
 epoch: 75, train_loss: 0.1473, test_loss: 2.5391, test_f1: 0.5716
 epoch: 76, train_loss: 0.1470, test_loss: 2.4567, test_f1: 0.5954
 epoch: 77, train_loss: 0.1442, test_loss: 2.5380, test_f1: 0.5964
 epoch: 78, train_loss: 0.1656, test_loss: 2.3980, test_f1: 0.6300
 epoch: 79, train_loss: 0.1209, test_loss: 2.4879, test_f1: 0.6183
 epoch: 80, train_loss: 0.1503, test_loss: 2.6975, test_f1: 0.5833
 epoch: 81, train_loss: 0.1390, test_loss: 2.7025, test_f1: 0.6245
 epoch: 82, train_loss: 0.1290, test_loss: 2.6090, test_f1: 0.6154
 epoch: 83, train_loss: 0.1459, test_loss: 2.5874, test_f1: 0.6228
 epoch: 84, train_loss: 0.1237, test_loss: 2.7077, test_f1: 0.6020
 epoch: 85, train_loss: 0.1117, test_loss: 2.5729, test_f1: 0.6093
 epoch: 86, train_loss: 0.1435, test_loss: 2.5858, test_f1: 0.6087
 epoch: 87, train_loss: 0.1254, test_loss: 2.9018, test_f1: 0.5846
 epoch: 88, train_loss: 0.1390, test_loss: 2.7732, test_f1: 0.6079
 epoch: 89, train_loss: 0.1362, test_loss: 2.6370, test_f1: 0.6079
 epoch: 90, train_loss: 0.1540, test_loss: 2.7323, test_f1: 0.6369
 epoch: 91, train_loss: 0.1326, test_loss: 2.5325, test_f1: 0.6279
 epoch: 92, train_loss: 0.1328, test_loss: 2.5854, test_f1: 0.6186
 epoch: 93, train_loss: 0.1268, test_loss: 2.7114, test_f1: 0.6247
 epoch: 94, train_loss: 0.1443, test_loss: 2.7072, test_f1: 0.6302
 epoch: 95, train_loss: 0.1118, test_loss: 2.4594, test_f1: 0.6185
 epoch: 96, train_loss: 0.1018, test_loss: 2.8919, test_f1: 0.5893
 epoch: 97, train_loss: 0.1113, test_loss: 2.6504, test_f1: 0.6053
 epoch: 98, train_loss: 0.1001, test_loss: 2.6556, test_f1: 0.6010
 epoch: 99, train_loss: 0.1214, test_loss: 2.6713, test_f1: 0.6305
##################ITERATION #4 ****************************************
 epoch: 0, train_loss: 1.3234, test_loss: 1.1902, test_f1: 0.3689
 epoch: 1, train_loss: 1.0287, test_loss: 1.0308, test_f1: 0.5135
 epoch: 2, train_loss: 0.9544, test_loss: 1.1437, test_f1: 0.4211
 epoch: 3, train_loss: 0.9037, test_loss: 1.0902, test_f1: 0.5469
 epoch: 4, train_loss: 0.8851, test_loss: 1.1057, test_f1: 0.5461
 epoch: 5, train_loss: 0.8355, test_loss: 1.1228, test_f1: 0.5331
 epoch: 6, train_loss: 0.7886, test_loss: 1.1444, test_f1: 0.5319
 epoch: 7, train_loss: 0.7940, test_loss: 1.0617, test_f1: 0.5825
 epoch: 8, train_loss: 0.7598, test_loss: 1.1100, test_f1: 0.5294
 epoch: 9, train_loss: 0.7379, test_loss: 1.1134, test_f1: 0.6005
 epoch: 10, train_loss: 0.7106, test_loss: 1.1196, test_f1: 0.6028
 epoch: 11, train_loss: 0.6967, test_loss: 1.0795, test_f1: 0.6592
 epoch: 12, train_loss: 0.7010, test_loss: 1.2188, test_f1: 0.5215
 epoch: 13, train_loss: 0.6455, test_loss: 1.0703, test_f1: 0.6090
 epoch: 14, train_loss: 0.6451, test_loss: 1.1054, test_f1: 0.6684
 epoch: 15, train_loss: 0.6771, test_loss: 1.0464, test_f1: 0.6202
 epoch: 16, train_loss: 0.6107, test_loss: 1.1713, test_f1: 0.5781
 epoch: 17, train_loss: 0.5749, test_loss: 1.0874, test_f1: 0.6488
 epoch: 18, train_loss: 0.5699, test_loss: 1.2982, test_f1: 0.5659
 epoch: 19, train_loss: 0.5526, test_loss: 1.3137, test_f1: 0.5654
 epoch: 20, train_loss: 0.5899, test_loss: 1.2279, test_f1: 0.5686
 epoch: 21, train_loss: 0.5426, test_loss: 1.1610, test_f1: 0.6198
 epoch: 22, train_loss: 0.5617, test_loss: 1.1122, test_f1: 0.6261
 epoch: 23, train_loss: 0.5540, test_loss: 1.1476, test_f1: 0.6274
 epoch: 24, train_loss: 0.5139, test_loss: 1.2327, test_f1: 0.6079
 epoch: 25, train_loss: 0.5036, test_loss: 1.1246, test_f1: 0.6304
 epoch: 26, train_loss: 0.4832, test_loss: 1.6548, test_f1: 0.5301
 epoch: 27, train_loss: 0.4364, test_loss: 1.7224, test_f1: 0.5390
 epoch: 28, train_loss: 0.4735, test_loss: 1.3911, test_f1: 0.6016
 epoch: 29, train_loss: 0.4418, test_loss: 1.3975, test_f1: 0.5726
 epoch: 30, train_loss: 0.4653, test_loss: 1.2623, test_f1: 0.6034
 epoch: 31, train_loss: 0.4379, test_loss: 1.3240, test_f1: 0.5928
 epoch: 32, train_loss: 0.4131, test_loss: 1.3372, test_f1: 0.6444
 epoch: 33, train_loss: 0.4515, test_loss: 1.3310, test_f1: 0.5969
 epoch: 34, train_loss: 0.4233, test_loss: 1.3453, test_f1: 0.6254
 epoch: 35, train_loss: 0.4393, test_loss: 1.5070, test_f1: 0.5952
 epoch: 36, train_loss: 0.3927, test_loss: 1.4427, test_f1: 0.6064
 epoch: 37, train_loss: 0.3674, test_loss: 1.4670, test_f1: 0.6498
 epoch: 38, train_loss: 0.3853, test_loss: 1.5551, test_f1: 0.6396
 epoch: 39, train_loss: 0.3745, test_loss: 1.2745, test_f1: 0.6655
 epoch: 40, train_loss: 0.3582, test_loss: 1.3564, test_f1: 0.6025
 epoch: 41, train_loss: 0.3583, test_loss: 1.5820, test_f1: 0.6345
 epoch: 42, train_loss: 0.3699, test_loss: 1.5434, test_f1: 0.6152
 epoch: 43, train_loss: 0.3768, test_loss: 1.6919, test_f1: 0.5980
 epoch: 44, train_loss: 0.3383, test_loss: 1.3138, test_f1: 0.6291
 epoch: 45, train_loss: 0.3148, test_loss: 1.4267, test_f1: 0.6536
 epoch: 46, train_loss: 0.3120, test_loss: 1.8683, test_f1: 0.6011
 epoch: 47, train_loss: 0.2975, test_loss: 1.4957, test_f1: 0.6104
 epoch: 48, train_loss: 0.3329, test_loss: 1.6618, test_f1: 0.6136
 epoch: 49, train_loss: 0.2753, test_loss: 1.6339, test_f1: 0.6572
 epoch: 50, train_loss: 0.2663, test_loss: 1.7591, test_f1: 0.5855
 epoch: 51, train_loss: 0.2528, test_loss: 1.6895, test_f1: 0.6291
 epoch: 52, train_loss: 0.2264, test_loss: 1.7457, test_f1: 0.6304
 epoch: 53, train_loss: 0.1780, test_loss: 1.9494, test_f1: 0.6094
 epoch: 54, train_loss: 0.1886, test_loss: 1.9344, test_f1: 0.6224
 epoch: 55, train_loss: 0.1948, test_loss: 1.9093, test_f1: 0.6092
 epoch: 56, train_loss: 0.1879, test_loss: 2.0145, test_f1: 0.5962
 epoch: 57, train_loss: 0.1861, test_loss: 2.2872, test_f1: 0.5987
 epoch: 58, train_loss: 0.1884, test_loss: 2.0107, test_f1: 0.6199
 epoch: 59, train_loss: 0.1921, test_loss: 2.0373, test_f1: 0.6075
 epoch: 60, train_loss: 0.1797, test_loss: 2.0970, test_f1: 0.6096
 epoch: 61, train_loss: 0.1624, test_loss: 2.1801, test_f1: 0.6038
 epoch: 62, train_loss: 0.1577, test_loss: 2.1237, test_f1: 0.6364
 epoch: 63, train_loss: 0.1528, test_loss: 2.2684, test_f1: 0.6145
 epoch: 64, train_loss: 0.1586, test_loss: 2.4403, test_f1: 0.5880
 epoch: 65, train_loss: 0.1849, test_loss: 2.0769, test_f1: 0.6174
 epoch: 66, train_loss: 0.1474, test_loss: 2.3025, test_f1: 0.6357
 epoch: 67, train_loss: 0.1586, test_loss: 2.2471, test_f1: 0.6069
 epoch: 68, train_loss: 0.1544, test_loss: 2.2939, test_f1: 0.6138
 epoch: 69, train_loss: 0.1457, test_loss: 2.3468, test_f1: 0.6274
 epoch: 70, train_loss: 0.1231, test_loss: 2.4716, test_f1: 0.6073
 epoch: 71, train_loss: 0.1365, test_loss: 2.4256, test_f1: 0.5858
 epoch: 72, train_loss: 0.1208, test_loss: 2.5351, test_f1: 0.6103
 epoch: 73, train_loss: 0.1255, test_loss: 2.6020, test_f1: 0.5962
 epoch: 74, train_loss: 0.1313, test_loss: 2.6046, test_f1: 0.5770
 epoch: 75, train_loss: 0.1510, test_loss: 2.3406, test_f1: 0.6084
 epoch: 76, train_loss: 0.1834, test_loss: 2.3600, test_f1: 0.6245
 epoch: 77, train_loss: 0.1377, test_loss: 2.4925, test_f1: 0.5884
 epoch: 78, train_loss: 0.1534, test_loss: 2.5701, test_f1: 0.5950
 epoch: 79, train_loss: 0.1161, test_loss: 2.5304, test_f1: 0.5821
 epoch: 80, train_loss: 0.1364, test_loss: 2.6253, test_f1: 0.5922
 epoch: 81, train_loss: 0.1414, test_loss: 2.6868, test_f1: 0.6082
 epoch: 82, train_loss: 0.1150, test_loss: 2.5128, test_f1: 0.6310
 epoch: 83, train_loss: 0.1578, test_loss: 2.5578, test_f1: 0.6097
 epoch: 84, train_loss: 0.1369, test_loss: 2.6616, test_f1: 0.6081
 epoch: 85, train_loss: 0.1535, test_loss: 2.8466, test_f1: 0.5677
 epoch: 86, train_loss: 0.1124, test_loss: 2.8501, test_f1: 0.6001
 epoch: 87, train_loss: 0.1377, test_loss: 2.8569, test_f1: 0.6072
 epoch: 88, train_loss: 0.1238, test_loss: 2.8245, test_f1: 0.6162
 epoch: 89, train_loss: 0.1214, test_loss: 3.0281, test_f1: 0.5996
 epoch: 90, train_loss: 0.1324, test_loss: 2.7396, test_f1: 0.6058
 epoch: 91, train_loss: 0.1361, test_loss: 2.7339, test_f1: 0.6046
 epoch: 92, train_loss: 0.1186, test_loss: 3.0536, test_f1: 0.5690
 epoch: 93, train_loss: 0.1368, test_loss: 2.7330, test_f1: 0.5759
 epoch: 94, train_loss: 0.1097, test_loss: 2.8955, test_f1: 0.5689
 epoch: 95, train_loss: 0.1152, test_loss: 2.8583, test_f1: 0.6029
 epoch: 96, train_loss: 0.1264, test_loss: 2.9846, test_f1: 0.6198
 epoch: 97, train_loss: 0.1350, test_loss: 2.9256, test_f1: 0.6106
 epoch: 98, train_loss: 0.1165, test_loss: 2.9773, test_f1: 0.5927
 epoch: 99, train_loss: 0.1054, test_loss: 3.1284, test_f1: 0.5999
##################ITERATION #5 ****************************************
 epoch: 0, train_loss: 1.3206, test_loss: 1.2323, test_f1: 0.4265
 epoch: 1, train_loss: 1.0224, test_loss: 1.1060, test_f1: 0.5358
 epoch: 2, train_loss: 0.9484, test_loss: 1.0623, test_f1: 0.5750
 epoch: 3, train_loss: 0.8890, test_loss: 1.0709, test_f1: 0.5230
 epoch: 4, train_loss: 0.8521, test_loss: 1.0565, test_f1: 0.5323
 epoch: 5, train_loss: 0.8323, test_loss: 1.1857, test_f1: 0.5365
 epoch: 6, train_loss: 0.7942, test_loss: 1.1196, test_f1: 0.5513
 epoch: 7, train_loss: 0.7712, test_loss: 1.1534, test_f1: 0.5271
 epoch: 8, train_loss: 0.7724, test_loss: 1.1325, test_f1: 0.5171
 epoch: 9, train_loss: 0.7563, test_loss: 1.1119, test_f1: 0.5703
 epoch: 10, train_loss: 0.7178, test_loss: 1.0682, test_f1: 0.5871
 epoch: 11, train_loss: 0.7072, test_loss: 1.1292, test_f1: 0.5884
 epoch: 12, train_loss: 0.6818, test_loss: 1.1367, test_f1: 0.5405
 epoch: 13, train_loss: 0.6658, test_loss: 1.1815, test_f1: 0.5872
 epoch: 14, train_loss: 0.6583, test_loss: 1.1644, test_f1: 0.6270
 epoch: 15, train_loss: 0.6553, test_loss: 1.1660, test_f1: 0.5977
 epoch: 16, train_loss: 0.6264, test_loss: 1.1057, test_f1: 0.6513
 epoch: 17, train_loss: 0.6222, test_loss: 1.1215, test_f1: 0.6157
 epoch: 18, train_loss: 0.6092, test_loss: 1.2239, test_f1: 0.6191
 epoch: 19, train_loss: 0.6118, test_loss: 1.1172, test_f1: 0.6474
 epoch: 20, train_loss: 0.6041, test_loss: 1.1741, test_f1: 0.6025
 epoch: 21, train_loss: 0.5754, test_loss: 1.2795, test_f1: 0.5773
 epoch: 22, train_loss: 0.5491, test_loss: 1.2380, test_f1: 0.6018
 epoch: 23, train_loss: 0.5712, test_loss: 1.4570, test_f1: 0.5403
 epoch: 24, train_loss: 0.5524, test_loss: 1.0927, test_f1: 0.6203
 epoch: 25, train_loss: 0.5236, test_loss: 1.3305, test_f1: 0.5525
 epoch: 26, train_loss: 0.5244, test_loss: 1.1878, test_f1: 0.6119
 epoch: 27, train_loss: 0.4967, test_loss: 1.3730, test_f1: 0.6180
 epoch: 28, train_loss: 0.5063, test_loss: 1.4179, test_f1: 0.5803
 epoch: 29, train_loss: 0.4863, test_loss: 1.3162, test_f1: 0.6405
 epoch: 30, train_loss: 0.5055, test_loss: 1.2370, test_f1: 0.5904
 epoch: 31, train_loss: 0.4943, test_loss: 1.2202, test_f1: 0.6414
 epoch: 32, train_loss: 0.4931, test_loss: 1.3575, test_f1: 0.6215
 epoch: 33, train_loss: 0.4549, test_loss: 1.4668, test_f1: 0.6102
 epoch: 34, train_loss: 0.4666, test_loss: 1.4281, test_f1: 0.5964
 epoch: 35, train_loss: 0.4675, test_loss: 1.2594, test_f1: 0.6280
 epoch: 36, train_loss: 0.4194, test_loss: 1.3669, test_f1: 0.6337
 epoch: 37, train_loss: 0.4245, test_loss: 1.3250, test_f1: 0.6226
 epoch: 38, train_loss: 0.4058, test_loss: 1.4323, test_f1: 0.6328
 epoch: 39, train_loss: 0.3778, test_loss: 1.8723, test_f1: 0.5563
 epoch: 40, train_loss: 0.4181, test_loss: 1.5152, test_f1: 0.6008
 epoch: 41, train_loss: 0.4040, test_loss: 1.5344, test_f1: 0.5761
 epoch: 42, train_loss: 0.3757, test_loss: 1.5858, test_f1: 0.6211
 epoch: 43, train_loss: 0.3640, test_loss: 1.6530, test_f1: 0.5939
 epoch: 44, train_loss: 0.4047, test_loss: 1.4408, test_f1: 0.6501
 epoch: 45, train_loss: 0.3476, test_loss: 1.6183, test_f1: 0.6158
 epoch: 46, train_loss: 0.3462, test_loss: 1.6439, test_f1: 0.6008
 epoch: 47, train_loss: 0.3207, test_loss: 1.7202, test_f1: 0.6578
 epoch: 48, train_loss: 0.3448, test_loss: 1.4846, test_f1: 0.6145
 epoch: 49, train_loss: 0.3259, test_loss: 1.7953, test_f1: 0.6050
 epoch: 50, train_loss: 0.3321, test_loss: 1.7792, test_f1: 0.5934
 epoch: 51, train_loss: 0.2750, test_loss: 1.7651, test_f1: 0.5981
 epoch: 52, train_loss: 0.2648, test_loss: 1.9254, test_f1: 0.5894
 epoch: 53, train_loss: 0.2659, test_loss: 1.8798, test_f1: 0.6384
 epoch: 54, train_loss: 0.2252, test_loss: 1.9358, test_f1: 0.5988
 epoch: 55, train_loss: 0.2271, test_loss: 2.0104, test_f1: 0.6300
 epoch: 56, train_loss: 0.2045, test_loss: 2.1651, test_f1: 0.5737
 epoch: 57, train_loss: 0.2481, test_loss: 2.2240, test_f1: 0.5762
 epoch: 58, train_loss: 0.2265, test_loss: 2.0439, test_f1: 0.5682
 epoch: 59, train_loss: 0.2024, test_loss: 2.0720, test_f1: 0.5962
 epoch: 60, train_loss: 0.1977, test_loss: 2.1400, test_f1: 0.5964
 epoch: 61, train_loss: 0.2256, test_loss: 2.1979, test_f1: 0.5858
 epoch: 62, train_loss: 0.2064, test_loss: 2.2010, test_f1: 0.6076
 epoch: 63, train_loss: 0.2025, test_loss: 2.0839, test_f1: 0.6035
 epoch: 64, train_loss: 0.2246, test_loss: 2.2222, test_f1: 0.5968
 epoch: 65, train_loss: 0.2027, test_loss: 2.2926, test_f1: 0.5808
 epoch: 66, train_loss: 0.1959, test_loss: 2.3276, test_f1: 0.6189
 epoch: 67, train_loss: 0.1887, test_loss: 2.3486, test_f1: 0.5845
 epoch: 68, train_loss: 0.2062, test_loss: 2.2273, test_f1: 0.6216
 epoch: 69, train_loss: 0.1812, test_loss: 2.1842, test_f1: 0.6167
 epoch: 70, train_loss: 0.1695, test_loss: 2.3190, test_f1: 0.6261
 epoch: 71, train_loss: 0.1691, test_loss: 2.4345, test_f1: 0.6046
 epoch: 72, train_loss: 0.1642, test_loss: 2.3718, test_f1: 0.6058
 epoch: 73, train_loss: 0.1903, test_loss: 2.3113, test_f1: 0.6270
 epoch: 74, train_loss: 0.1686, test_loss: 2.3280, test_f1: 0.6027
 epoch: 75, train_loss: 0.1644, test_loss: 2.3722, test_f1: 0.6022
 epoch: 76, train_loss: 0.1780, test_loss: 2.4250, test_f1: 0.5978
 epoch: 77, train_loss: 0.1699, test_loss: 2.5358, test_f1: 0.5858
 epoch: 78, train_loss: 0.1554, test_loss: 2.5985, test_f1: 0.5490
 epoch: 79, train_loss: 0.1604, test_loss: 2.5552, test_f1: 0.5871
 epoch: 80, train_loss: 0.1484, test_loss: 2.3861, test_f1: 0.6263
 epoch: 81, train_loss: 0.1537, test_loss: 2.3284, test_f1: 0.6036
 epoch: 82, train_loss: 0.1781, test_loss: 2.5044, test_f1: 0.5955
 epoch: 83, train_loss: 0.1501, test_loss: 2.4798, test_f1: 0.5716
 epoch: 84, train_loss: 0.1426, test_loss: 2.6468, test_f1: 0.5883
 epoch: 85, train_loss: 0.1613, test_loss: 2.5378, test_f1: 0.5963
 epoch: 86, train_loss: 0.1468, test_loss: 2.7844, test_f1: 0.6192
 epoch: 87, train_loss: 0.1358, test_loss: 2.7566, test_f1: 0.5935
 epoch: 88, train_loss: 0.1874, test_loss: 2.5149, test_f1: 0.5714
 epoch: 89, train_loss: 0.1586, test_loss: 2.5475, test_f1: 0.5962
 epoch: 90, train_loss: 0.1429, test_loss: 2.4900, test_f1: 0.6205
 epoch: 91, train_loss: 0.1460, test_loss: 2.5186, test_f1: 0.6387
 epoch: 92, train_loss: 0.1375, test_loss: 2.9287, test_f1: 0.5722
 epoch: 93, train_loss: 0.1563, test_loss: 2.5971, test_f1: 0.6029
 epoch: 94, train_loss: 0.1357, test_loss: 2.5764, test_f1: 0.5900
 epoch: 95, train_loss: 0.1453, test_loss: 2.6528, test_f1: 0.5536
 epoch: 96, train_loss: 0.1523, test_loss: 2.6791, test_f1: 0.6083
 epoch: 97, train_loss: 0.1560, test_loss: 2.9559, test_f1: 0.5849
 epoch: 98, train_loss: 0.1375, test_loss: 2.8355, test_f1: 0.5829
 epoch: 99, train_loss: 0.1218, test_loss: 2.9110, test_f1: 0.5903
##################ITERATION #6 ****************************************
 epoch: 0, train_loss: 1.3119, test_loss: 1.1870, test_f1: 0.4382
 epoch: 1, train_loss: 1.0252, test_loss: 1.0794, test_f1: 0.5194
 epoch: 2, train_loss: 0.9533, test_loss: 1.0446, test_f1: 0.5480
 epoch: 3, train_loss: 0.9157, test_loss: 1.1090, test_f1: 0.5760
 epoch: 4, train_loss: 0.8998, test_loss: 1.0359, test_f1: 0.5990
 epoch: 5, train_loss: 0.8539, test_loss: 1.1028, test_f1: 0.5834
 epoch: 6, train_loss: 0.8254, test_loss: 1.0121, test_f1: 0.5913
 epoch: 7, train_loss: 0.8021, test_loss: 1.0971, test_f1: 0.5594
 epoch: 8, train_loss: 0.7723, test_loss: 1.0454, test_f1: 0.5739
 epoch: 9, train_loss: 0.7384, test_loss: 1.0447, test_f1: 0.6063
 epoch: 10, train_loss: 0.7350, test_loss: 0.9947, test_f1: 0.6120
 epoch: 11, train_loss: 0.7034, test_loss: 1.1173, test_f1: 0.5660
 epoch: 12, train_loss: 0.6856, test_loss: 1.1965, test_f1: 0.5219
 epoch: 13, train_loss: 0.6856, test_loss: 1.1067, test_f1: 0.5789
 epoch: 14, train_loss: 0.6540, test_loss: 1.0081, test_f1: 0.6468
 epoch: 15, train_loss: 0.6212, test_loss: 1.0321, test_f1: 0.6203
 epoch: 16, train_loss: 0.6035, test_loss: 1.0966, test_f1: 0.6254
 epoch: 17, train_loss: 0.5951, test_loss: 1.0570, test_f1: 0.6239
 epoch: 18, train_loss: 0.5769, test_loss: 1.2287, test_f1: 0.5758
 epoch: 19, train_loss: 0.5828, test_loss: 1.2138, test_f1: 0.6096
 epoch: 20, train_loss: 0.5799, test_loss: 1.2429, test_f1: 0.5677
 epoch: 21, train_loss: 0.5578, test_loss: 1.0833, test_f1: 0.6141
 epoch: 22, train_loss: 0.5300, test_loss: 1.0812, test_f1: 0.6293
 epoch: 23, train_loss: 0.5134, test_loss: 1.2728, test_f1: 0.6645
 epoch: 24, train_loss: 0.5509, test_loss: 1.1222, test_f1: 0.6094
 epoch: 25, train_loss: 0.4933, test_loss: 1.3074, test_f1: 0.6007
 epoch: 26, train_loss: 0.4875, test_loss: 1.3647, test_f1: 0.5670
 epoch: 27, train_loss: 0.4932, test_loss: 1.3482, test_f1: 0.6192
 epoch: 28, train_loss: 0.4827, test_loss: 1.3446, test_f1: 0.6237
 epoch: 29, train_loss: 0.4643, test_loss: 1.3172, test_f1: 0.6378
 epoch: 30, train_loss: 0.4590, test_loss: 1.2556, test_f1: 0.6254
 epoch: 31, train_loss: 0.4624, test_loss: 1.4038, test_f1: 0.5666
 epoch: 32, train_loss: 0.4727, test_loss: 1.2755, test_f1: 0.6226
 epoch: 33, train_loss: 0.4578, test_loss: 1.3022, test_f1: 0.5992
 epoch: 34, train_loss: 0.4269, test_loss: 1.4183, test_f1: 0.5861
 epoch: 35, train_loss: 0.4109, test_loss: 1.4911, test_f1: 0.5905
 epoch: 36, train_loss: 0.4002, test_loss: 1.4676, test_f1: 0.5941
 epoch: 37, train_loss: 0.4172, test_loss: 1.4463, test_f1: 0.6172
 epoch: 38, train_loss: 0.3616, test_loss: 1.5088, test_f1: 0.6411
 epoch: 39, train_loss: 0.3495, test_loss: 1.6601, test_f1: 0.5576
 epoch: 40, train_loss: 0.4002, test_loss: 1.7907, test_f1: 0.5385
 epoch: 41, train_loss: 0.3870, test_loss: 1.4356, test_f1: 0.6137
 epoch: 42, train_loss: 0.4064, test_loss: 1.4822, test_f1: 0.5801
 epoch: 43, train_loss: 0.3548, test_loss: 1.5070, test_f1: 0.6465
 epoch: 44, train_loss: 0.3518, test_loss: 1.6117, test_f1: 0.6252
 epoch: 45, train_loss: 0.3802, test_loss: 1.4832, test_f1: 0.6440
 epoch: 46, train_loss: 0.3516, test_loss: 1.6711, test_f1: 0.5871
 epoch: 47, train_loss: 0.3450, test_loss: 1.7992, test_f1: 0.6075
 epoch: 48, train_loss: 0.3052, test_loss: 1.8043, test_f1: 0.5793
 epoch: 49, train_loss: 0.3571, test_loss: 1.6196, test_f1: 0.6340
 epoch: 50, train_loss: 0.3178, test_loss: 1.7865, test_f1: 0.6234
 epoch: 51, train_loss: 0.2833, test_loss: 1.7477, test_f1: 0.6452
 epoch: 52, train_loss: 0.2259, test_loss: 1.9146, test_f1: 0.5956
 epoch: 53, train_loss: 0.2099, test_loss: 2.0644, test_f1: 0.6100
 epoch: 54, train_loss: 0.2589, test_loss: 1.7307, test_f1: 0.6422
 epoch: 55, train_loss: 0.2431, test_loss: 1.8939, test_f1: 0.5861
 epoch: 56, train_loss: 0.1913, test_loss: 1.8745, test_f1: 0.6323
 epoch: 57, train_loss: 0.2133, test_loss: 1.9876, test_f1: 0.6329
 epoch: 58, train_loss: 0.2068, test_loss: 1.9301, test_f1: 0.6339
 epoch: 59, train_loss: 0.2111, test_loss: 2.0527, test_f1: 0.5948
 epoch: 60, train_loss: 0.2028, test_loss: 2.0172, test_f1: 0.6205
 epoch: 61, train_loss: 0.1953, test_loss: 2.0429, test_f1: 0.6292
 epoch: 62, train_loss: 0.1886, test_loss: 2.2840, test_f1: 0.6069
 epoch: 63, train_loss: 0.2279, test_loss: 2.0755, test_f1: 0.6270
 epoch: 64, train_loss: 0.2172, test_loss: 2.1943, test_f1: 0.5661
 epoch: 65, train_loss: 0.1689, test_loss: 2.0978, test_f1: 0.6152
 epoch: 66, train_loss: 0.1664, test_loss: 2.1910, test_f1: 0.6050
 epoch: 67, train_loss: 0.1801, test_loss: 2.3109, test_f1: 0.5937
 epoch: 68, train_loss: 0.1642, test_loss: 2.2876, test_f1: 0.5775
 epoch: 69, train_loss: 0.1845, test_loss: 2.0745, test_f1: 0.6130
 epoch: 70, train_loss: 0.1531, test_loss: 2.3039, test_f1: 0.5751
 epoch: 71, train_loss: 0.1758, test_loss: 2.3134, test_f1: 0.6107
 epoch: 72, train_loss: 0.1588, test_loss: 2.2451, test_f1: 0.5978
 epoch: 73, train_loss: 0.1751, test_loss: 2.6538, test_f1: 0.5619
 epoch: 74, train_loss: 0.1739, test_loss: 2.5885, test_f1: 0.5783
 epoch: 75, train_loss: 0.1517, test_loss: 2.5917, test_f1: 0.5736
 epoch: 76, train_loss: 0.1361, test_loss: 2.4046, test_f1: 0.6241
 epoch: 77, train_loss: 0.1896, test_loss: 2.4596, test_f1: 0.5864
 epoch: 78, train_loss: 0.1764, test_loss: 2.5183, test_f1: 0.5890
 epoch: 79, train_loss: 0.1665, test_loss: 2.2543, test_f1: 0.6084
 epoch: 80, train_loss: 0.1590, test_loss: 2.4048, test_f1: 0.6025
 epoch: 81, train_loss: 0.1404, test_loss: 2.4043, test_f1: 0.5960
 epoch: 82, train_loss: 0.1409, test_loss: 2.3968, test_f1: 0.6152
 epoch: 83, train_loss: 0.1279, test_loss: 2.7332, test_f1: 0.5913
 epoch: 84, train_loss: 0.1703, test_loss: 2.5659, test_f1: 0.5804
 epoch: 85, train_loss: 0.1410, test_loss: 2.6971, test_f1: 0.5586
 epoch: 86, train_loss: 0.1491, test_loss: 2.5098, test_f1: 0.6383
 epoch: 87, train_loss: 0.1428, test_loss: 2.4989, test_f1: 0.5982
 epoch: 88, train_loss: 0.1315, test_loss: 2.7814, test_f1: 0.5713
 epoch: 89, train_loss: 0.1236, test_loss: 2.6138, test_f1: 0.5953
 epoch: 90, train_loss: 0.1418, test_loss: 2.7275, test_f1: 0.5680
 epoch: 91, train_loss: 0.1227, test_loss: 2.7703, test_f1: 0.5753
 epoch: 92, train_loss: 0.1225, test_loss: 2.6898, test_f1: 0.5891
 epoch: 93, train_loss: 0.1196, test_loss: 2.8102, test_f1: 0.5826
 epoch: 94, train_loss: 0.1666, test_loss: 2.8672, test_f1: 0.5751
 epoch: 95, train_loss: 0.1547, test_loss: 2.8565, test_f1: 0.5886
 epoch: 96, train_loss: 0.1207, test_loss: 2.7155, test_f1: 0.6267
 epoch: 97, train_loss: 0.1156, test_loss: 2.7049, test_f1: 0.6165
 epoch: 98, train_loss: 0.0965, test_loss: 2.6718, test_f1: 0.6094
 epoch: 99, train_loss: 0.1159, test_loss: 2.8598, test_f1: 0.5655
##################ITERATION #7 ****************************************
 epoch: 0, train_loss: 1.2883, test_loss: 1.2820, test_f1: 0.4652
 epoch: 1, train_loss: 1.0344, test_loss: 1.1317, test_f1: 0.4872
 epoch: 2, train_loss: 0.9588, test_loss: 1.1337, test_f1: 0.4679
 epoch: 3, train_loss: 0.8982, test_loss: 1.0311, test_f1: 0.5521
 epoch: 4, train_loss: 0.8802, test_loss: 1.0325, test_f1: 0.5767
 epoch: 5, train_loss: 0.8511, test_loss: 1.0331, test_f1: 0.5793
 epoch: 6, train_loss: 0.8193, test_loss: 1.0205, test_f1: 0.5530
 epoch: 7, train_loss: 0.8013, test_loss: 1.0536, test_f1: 0.6047
 epoch: 8, train_loss: 0.7484, test_loss: 1.0662, test_f1: 0.6042
 epoch: 9, train_loss: 0.7656, test_loss: 1.0481, test_f1: 0.5958
 epoch: 10, train_loss: 0.7085, test_loss: 1.0584, test_f1: 0.5854
 epoch: 11, train_loss: 0.6965, test_loss: 1.1274, test_f1: 0.5886
 epoch: 12, train_loss: 0.6849, test_loss: 1.0620, test_f1: 0.6063
 epoch: 13, train_loss: 0.6664, test_loss: 1.0750, test_f1: 0.6160
 epoch: 14, train_loss: 0.6321, test_loss: 1.1626, test_f1: 0.6280
 epoch: 15, train_loss: 0.6282, test_loss: 1.1793, test_f1: 0.6062
 epoch: 16, train_loss: 0.6159, test_loss: 1.2568, test_f1: 0.6086
 epoch: 17, train_loss: 0.5961, test_loss: 1.2940, test_f1: 0.6088
 epoch: 18, train_loss: 0.5697, test_loss: 1.0936, test_f1: 0.6161
 epoch: 19, train_loss: 0.5682, test_loss: 1.0323, test_f1: 0.6434
 epoch: 20, train_loss: 0.5932, test_loss: 1.1076, test_f1: 0.6065
 epoch: 21, train_loss: 0.5587, test_loss: 1.2370, test_f1: 0.6433
 epoch: 22, train_loss: 0.5230, test_loss: 1.2736, test_f1: 0.5915
 epoch: 23, train_loss: 0.5254, test_loss: 1.4002, test_f1: 0.6064
 epoch: 24, train_loss: 0.5587, test_loss: 1.2997, test_f1: 0.6146
 epoch: 25, train_loss: 0.5063, test_loss: 1.2434, test_f1: 0.6430
 epoch: 26, train_loss: 0.4898, test_loss: 1.2286, test_f1: 0.6439
 epoch: 27, train_loss: 0.5358, test_loss: 1.2845, test_f1: 0.6353
 epoch: 28, train_loss: 0.4803, test_loss: 1.3126, test_f1: 0.6204
 epoch: 29, train_loss: 0.4576, test_loss: 1.4134, test_f1: 0.5895
 epoch: 30, train_loss: 0.4695, test_loss: 1.5053, test_f1: 0.6727
 epoch: 31, train_loss: 0.4221, test_loss: 1.4756, test_f1: 0.6271
 epoch: 32, train_loss: 0.4151, test_loss: 1.4349, test_f1: 0.6522
 epoch: 33, train_loss: 0.4026, test_loss: 1.6293, test_f1: 0.5946
 epoch: 34, train_loss: 0.4144, test_loss: 1.3889, test_f1: 0.5745
 epoch: 35, train_loss: 0.3608, test_loss: 1.7542, test_f1: 0.6177
 epoch: 36, train_loss: 0.3692, test_loss: 1.4671, test_f1: 0.6652
 epoch: 37, train_loss: 0.3744, test_loss: 1.6057, test_f1: 0.5491
 epoch: 38, train_loss: 0.3856, test_loss: 1.5090, test_f1: 0.6248
 epoch: 39, train_loss: 0.3544, test_loss: 1.5136, test_f1: 0.6540
 epoch: 40, train_loss: 0.3693, test_loss: 1.6941, test_f1: 0.6012
 epoch: 41, train_loss: 0.3836, test_loss: 1.7599, test_f1: 0.5258
 epoch: 42, train_loss: 0.3351, test_loss: 1.6861, test_f1: 0.5688
 epoch: 43, train_loss: 0.3671, test_loss: 1.6297, test_f1: 0.6049
 epoch: 44, train_loss: 0.3595, test_loss: 1.6968, test_f1: 0.5815
 epoch: 45, train_loss: 0.3285, test_loss: 1.6452, test_f1: 0.5523
 epoch: 46, train_loss: 0.3325, test_loss: 1.6045, test_f1: 0.5654
 epoch: 47, train_loss: 0.3504, test_loss: 1.6516, test_f1: 0.6362
 epoch: 48, train_loss: 0.3050, test_loss: 1.7816, test_f1: 0.6057
 epoch: 49, train_loss: 0.3264, test_loss: 1.7031, test_f1: 0.6230
 epoch: 50, train_loss: 0.3178, test_loss: 1.7355, test_f1: 0.5754
 epoch: 51, train_loss: 0.2680, test_loss: 1.7515, test_f1: 0.5887
 epoch: 52, train_loss: 0.2137, test_loss: 1.8224, test_f1: 0.6040
 epoch: 53, train_loss: 0.1928, test_loss: 1.9833, test_f1: 0.6418
 epoch: 54, train_loss: 0.1991, test_loss: 2.0632, test_f1: 0.6082
 epoch: 55, train_loss: 0.1717, test_loss: 2.2046, test_f1: 0.5902
 epoch: 56, train_loss: 0.1736, test_loss: 2.2661, test_f1: 0.6146
 epoch: 57, train_loss: 0.1739, test_loss: 2.2784, test_f1: 0.5793
 epoch: 58, train_loss: 0.1742, test_loss: 2.3283, test_f1: 0.5944
 epoch: 59, train_loss: 0.1926, test_loss: 2.2353, test_f1: 0.6045
 epoch: 60, train_loss: 0.1859, test_loss: 2.3715, test_f1: 0.6061
 epoch: 61, train_loss: 0.1783, test_loss: 2.1703, test_f1: 0.5777
 epoch: 62, train_loss: 0.1590, test_loss: 2.6025, test_f1: 0.5876
 epoch: 63, train_loss: 0.2348, test_loss: 2.1942, test_f1: 0.6005
 epoch: 64, train_loss: 0.1630, test_loss: 2.0835, test_f1: 0.6090
 epoch: 65, train_loss: 0.1672, test_loss: 2.3394, test_f1: 0.5911
 epoch: 66, train_loss: 0.1754, test_loss: 2.5101, test_f1: 0.5601
 epoch: 67, train_loss: 0.1736, test_loss: 2.5828, test_f1: 0.5730
 epoch: 68, train_loss: 0.1772, test_loss: 2.3515, test_f1: 0.6032
 epoch: 69, train_loss: 0.1535, test_loss: 2.3250, test_f1: 0.5917
 epoch: 70, train_loss: 0.1489, test_loss: 2.2913, test_f1: 0.5802
 epoch: 71, train_loss: 0.1513, test_loss: 2.6659, test_f1: 0.5974
 epoch: 72, train_loss: 0.1530, test_loss: 2.6380, test_f1: 0.5703
 epoch: 73, train_loss: 0.1605, test_loss: 2.7600, test_f1: 0.5782
 epoch: 74, train_loss: 0.1471, test_loss: 2.5449, test_f1: 0.6064
 epoch: 75, train_loss: 0.1277, test_loss: 2.6192, test_f1: 0.6036
 epoch: 76, train_loss: 0.1523, test_loss: 2.6709, test_f1: 0.5829
 epoch: 77, train_loss: 0.1411, test_loss: 2.6693, test_f1: 0.5843
 epoch: 78, train_loss: 0.1408, test_loss: 2.5901, test_f1: 0.6238
 epoch: 79, train_loss: 0.1084, test_loss: 2.7209, test_f1: 0.6271
 epoch: 80, train_loss: 0.1344, test_loss: 2.6262, test_f1: 0.5892
 epoch: 81, train_loss: 0.2028, test_loss: 2.6256, test_f1: 0.6481
 epoch: 82, train_loss: 0.1274, test_loss: 2.5611, test_f1: 0.5945
 epoch: 83, train_loss: 0.1156, test_loss: 2.6044, test_f1: 0.5744
 epoch: 84, train_loss: 0.1145, test_loss: 2.5372, test_f1: 0.6120
 epoch: 85, train_loss: 0.1354, test_loss: 2.9352, test_f1: 0.5853
 epoch: 86, train_loss: 0.1160, test_loss: 3.0213, test_f1: 0.5950
 epoch: 87, train_loss: 0.1146, test_loss: 2.7603, test_f1: 0.6063
 epoch: 88, train_loss: 0.1106, test_loss: 2.8358, test_f1: 0.6094
 epoch: 89, train_loss: 0.1193, test_loss: 3.2675, test_f1: 0.5993
 epoch: 90, train_loss: 0.1428, test_loss: 3.0895, test_f1: 0.6040
 epoch: 91, train_loss: 0.1217, test_loss: 3.0468, test_f1: 0.5655
 epoch: 92, train_loss: 0.1031, test_loss: 3.0721, test_f1: 0.5737
 epoch: 93, train_loss: 0.1043, test_loss: 3.0137, test_f1: 0.6048
 epoch: 94, train_loss: 0.1168, test_loss: 3.0936, test_f1: 0.6178
 epoch: 95, train_loss: 0.1221, test_loss: 2.8679, test_f1: 0.5852
 epoch: 96, train_loss: 0.1000, test_loss: 2.8853, test_f1: 0.5850
 epoch: 97, train_loss: 0.1426, test_loss: 2.8116, test_f1: 0.5785
 epoch: 98, train_loss: 0.0956, test_loss: 2.9170, test_f1: 0.6002
 epoch: 99, train_loss: 0.1091, test_loss: 3.0717, test_f1: 0.5887
##################ITERATION #8 ****************************************
 epoch: 0, train_loss: 1.3400, test_loss: 1.1928, test_f1: 0.4264
 epoch: 1, train_loss: 1.0204, test_loss: 1.1111, test_f1: 0.5411
 epoch: 2, train_loss: 0.9617, test_loss: 1.1185, test_f1: 0.5053
 epoch: 3, train_loss: 0.9048, test_loss: 1.0683, test_f1: 0.4685
 epoch: 4, train_loss: 0.8870, test_loss: 1.0697, test_f1: 0.5282
 epoch: 5, train_loss: 0.8568, test_loss: 1.1030, test_f1: 0.5410
 epoch: 6, train_loss: 0.8226, test_loss: 1.1631, test_f1: 0.5457
 epoch: 7, train_loss: 0.7933, test_loss: 1.1770, test_f1: 0.5351
 epoch: 8, train_loss: 0.7694, test_loss: 1.1025, test_f1: 0.5871
 epoch: 9, train_loss: 0.7499, test_loss: 1.1053, test_f1: 0.5525
 epoch: 10, train_loss: 0.7331, test_loss: 1.1393, test_f1: 0.5772
 epoch: 11, train_loss: 0.7256, test_loss: 1.0839, test_f1: 0.5674
 epoch: 12, train_loss: 0.7068, test_loss: 1.0230, test_f1: 0.5948
 epoch: 13, train_loss: 0.6720, test_loss: 1.2056, test_f1: 0.5557
 epoch: 14, train_loss: 0.6589, test_loss: 1.1801, test_f1: 0.5812
 epoch: 15, train_loss: 0.6214, test_loss: 1.1688, test_f1: 0.5510
 epoch: 16, train_loss: 0.6312, test_loss: 1.1596, test_f1: 0.5707
 epoch: 17, train_loss: 0.6482, test_loss: 1.2147, test_f1: 0.6298
 epoch: 18, train_loss: 0.6031, test_loss: 1.2162, test_f1: 0.5717
 epoch: 19, train_loss: 0.5731, test_loss: 1.1885, test_f1: 0.6263
 epoch: 20, train_loss: 0.5563, test_loss: 1.2239, test_f1: 0.5931
 epoch: 21, train_loss: 0.5275, test_loss: 1.2391, test_f1: 0.5978
 epoch: 22, train_loss: 0.5664, test_loss: 1.3470, test_f1: 0.5845
 epoch: 23, train_loss: 0.5117, test_loss: 1.2935, test_f1: 0.6278
 epoch: 24, train_loss: 0.5118, test_loss: 1.5531, test_f1: 0.5089
 epoch: 25, train_loss: 0.5141, test_loss: 1.5043, test_f1: 0.5679
 epoch: 26, train_loss: 0.4982, test_loss: 1.4499, test_f1: 0.5719
 epoch: 27, train_loss: 0.4662, test_loss: 1.3741, test_f1: 0.5862
 epoch: 28, train_loss: 0.4962, test_loss: 1.3316, test_f1: 0.6025
 epoch: 29, train_loss: 0.4801, test_loss: 1.4585, test_f1: 0.6156
 epoch: 30, train_loss: 0.4620, test_loss: 1.4890, test_f1: 0.5723
 epoch: 31, train_loss: 0.4835, test_loss: 1.3593, test_f1: 0.6396
 epoch: 32, train_loss: 0.4115, test_loss: 1.5184, test_f1: 0.6051
 epoch: 33, train_loss: 0.4226, test_loss: 1.6305, test_f1: 0.5891
 epoch: 34, train_loss: 0.3878, test_loss: 1.6134, test_f1: 0.6142
 epoch: 35, train_loss: 0.3988, test_loss: 1.3027, test_f1: 0.6744
 epoch: 36, train_loss: 0.4046, test_loss: 1.6742, test_f1: 0.6030
 epoch: 37, train_loss: 0.4255, test_loss: 1.6923, test_f1: 0.5922
 epoch: 38, train_loss: 0.4007, test_loss: 1.4908, test_f1: 0.6159
 epoch: 39, train_loss: 0.3797, test_loss: 1.4658, test_f1: 0.6370
 epoch: 40, train_loss: 0.4120, test_loss: 1.4559, test_f1: 0.5923
 epoch: 41, train_loss: 0.3393, test_loss: 2.0328, test_f1: 0.5703
 epoch: 42, train_loss: 0.3473, test_loss: 1.5621, test_f1: 0.6406
 epoch: 43, train_loss: 0.3946, test_loss: 1.3655, test_f1: 0.5928
 epoch: 44, train_loss: 0.3555, test_loss: 1.6572, test_f1: 0.6117
 epoch: 45, train_loss: 0.3069, test_loss: 1.9188, test_f1: 0.6399
 epoch: 46, train_loss: 0.2975, test_loss: 1.7873, test_f1: 0.6240
 epoch: 47, train_loss: 0.3972, test_loss: 1.6889, test_f1: 0.6141
 epoch: 48, train_loss: 0.3043, test_loss: 2.3042, test_f1: 0.5966
 epoch: 49, train_loss: 0.3225, test_loss: 1.7451, test_f1: 0.6027
 epoch: 50, train_loss: 0.2739, test_loss: 2.0248, test_f1: 0.5879
 epoch: 51, train_loss: 0.2438, test_loss: 2.1133, test_f1: 0.6304
 epoch: 52, train_loss: 0.2598, test_loss: 1.8471, test_f1: 0.6277
 epoch: 53, train_loss: 0.2040, test_loss: 2.1253, test_f1: 0.5889
 epoch: 54, train_loss: 0.2079, test_loss: 2.0181, test_f1: 0.6187
 epoch: 55, train_loss: 0.2096, test_loss: 2.0388, test_f1: 0.6249
 epoch: 56, train_loss: 0.2148, test_loss: 1.9776, test_f1: 0.6216
 epoch: 57, train_loss: 0.1938, test_loss: 1.9544, test_f1: 0.6020
 epoch: 58, train_loss: 0.2036, test_loss: 1.9554, test_f1: 0.6436
 epoch: 59, train_loss: 0.1969, test_loss: 2.1527, test_f1: 0.6045
 epoch: 60, train_loss: 0.1879, test_loss: 2.1209, test_f1: 0.5996
 epoch: 61, train_loss: 0.2002, test_loss: 2.1624, test_f1: 0.5988
 epoch: 62, train_loss: 0.1585, test_loss: 2.2078, test_f1: 0.6153
 epoch: 63, train_loss: 0.1482, test_loss: 2.3194, test_f1: 0.5840
 epoch: 64, train_loss: 0.2128, test_loss: 2.3359, test_f1: 0.6197
 epoch: 65, train_loss: 0.1657, test_loss: 2.0857, test_f1: 0.6428
 epoch: 66, train_loss: 0.1841, test_loss: 2.2024, test_f1: 0.6356
 epoch: 67, train_loss: 0.1693, test_loss: 2.4837, test_f1: 0.5844
 epoch: 68, train_loss: 0.1747, test_loss: 2.2976, test_f1: 0.6314
 epoch: 69, train_loss: 0.1843, test_loss: 2.4207, test_f1: 0.5608
 epoch: 70, train_loss: 0.1456, test_loss: 2.5210, test_f1: 0.5912
 epoch: 71, train_loss: 0.1784, test_loss: 2.2479, test_f1: 0.6278
 epoch: 72, train_loss: 0.1763, test_loss: 2.3578, test_f1: 0.6057
 epoch: 73, train_loss: 0.1393, test_loss: 2.2719, test_f1: 0.6020
 epoch: 74, train_loss: 0.1448, test_loss: 2.4910, test_f1: 0.5998
 epoch: 75, train_loss: 0.1243, test_loss: 2.4793, test_f1: 0.6139
 epoch: 76, train_loss: 0.1394, test_loss: 2.5746, test_f1: 0.6418
 epoch: 77, train_loss: 0.1659, test_loss: 2.5566, test_f1: 0.5978
 epoch: 78, train_loss: 0.1642, test_loss: 2.3554, test_f1: 0.6042
 epoch: 79, train_loss: 0.1690, test_loss: 2.4463, test_f1: 0.6064
 epoch: 80, train_loss: 0.1100, test_loss: 2.5879, test_f1: 0.6174
 epoch: 81, train_loss: 0.1366, test_loss: 2.7253, test_f1: 0.5871
 epoch: 82, train_loss: 0.1367, test_loss: 2.7769, test_f1: 0.5759
 epoch: 83, train_loss: 0.1363, test_loss: 2.7440, test_f1: 0.5900
 epoch: 84, train_loss: 0.1441, test_loss: 2.6426, test_f1: 0.5828
 epoch: 85, train_loss: 0.1605, test_loss: 2.8532, test_f1: 0.5902
 epoch: 86, train_loss: 0.1702, test_loss: 2.8239, test_f1: 0.5860
 epoch: 87, train_loss: 0.1802, test_loss: 2.5544, test_f1: 0.5946
 epoch: 88, train_loss: 0.1336, test_loss: 2.7079, test_f1: 0.5808
 epoch: 89, train_loss: 0.1388, test_loss: 2.5990, test_f1: 0.5798
 epoch: 90, train_loss: 0.1358, test_loss: 2.6768, test_f1: 0.6104
 epoch: 91, train_loss: 0.1219, test_loss: 2.6541, test_f1: 0.5782
 epoch: 92, train_loss: 0.1076, test_loss: 2.5553, test_f1: 0.6149
 epoch: 93, train_loss: 0.1632, test_loss: 2.6668, test_f1: 0.6059
 epoch: 94, train_loss: 0.1320, test_loss: 2.6716, test_f1: 0.5886
 epoch: 95, train_loss: 0.1154, test_loss: 2.6341, test_f1: 0.5849
 epoch: 96, train_loss: 0.1296, test_loss: 2.9192, test_f1: 0.5494
 epoch: 97, train_loss: 0.1321, test_loss: 2.6962, test_f1: 0.5848
 epoch: 98, train_loss: 0.1209, test_loss: 3.0953, test_f1: 0.5550
 epoch: 99, train_loss: 0.1291, test_loss: 3.0668, test_f1: 0.5331
##################ITERATION #9 ****************************************
 epoch: 0, train_loss: 1.3513, test_loss: 1.2941, test_f1: 0.3194
 epoch: 1, train_loss: 1.0043, test_loss: 1.1667, test_f1: 0.4509
 epoch: 2, train_loss: 0.9433, test_loss: 1.0969, test_f1: 0.5190
 epoch: 3, train_loss: 0.9055, test_loss: 1.0493, test_f1: 0.5241
 epoch: 4, train_loss: 0.8685, test_loss: 1.1436, test_f1: 0.4127
 epoch: 5, train_loss: 0.8641, test_loss: 1.0469, test_f1: 0.5421
 epoch: 6, train_loss: 0.8246, test_loss: 1.1534, test_f1: 0.5383
 epoch: 7, train_loss: 0.7919, test_loss: 1.0714, test_f1: 0.5920
 epoch: 8, train_loss: 0.7864, test_loss: 1.0796, test_f1: 0.5890
 epoch: 9, train_loss: 0.7457, test_loss: 1.0543, test_f1: 0.5897
 epoch: 10, train_loss: 0.7210, test_loss: 1.2796, test_f1: 0.5720
 epoch: 11, train_loss: 0.6884, test_loss: 1.2284, test_f1: 0.5750
 epoch: 12, train_loss: 0.6896, test_loss: 1.2324, test_f1: 0.5613
 epoch: 13, train_loss: 0.6641, test_loss: 1.1368, test_f1: 0.6140
 epoch: 14, train_loss: 0.6658, test_loss: 1.0776, test_f1: 0.6104
 epoch: 15, train_loss: 0.6294, test_loss: 1.1898, test_f1: 0.5708
 epoch: 16, train_loss: 0.6135, test_loss: 1.3457, test_f1: 0.5386
 epoch: 17, train_loss: 0.6059, test_loss: 1.3101, test_f1: 0.5676
 epoch: 18, train_loss: 0.5840, test_loss: 1.1649, test_f1: 0.6136
 epoch: 19, train_loss: 0.5647, test_loss: 1.3571, test_f1: 0.6128
 epoch: 20, train_loss: 0.5848, test_loss: 1.2468, test_f1: 0.6114
 epoch: 21, train_loss: 0.5595, test_loss: 1.2367, test_f1: 0.6129
 epoch: 22, train_loss: 0.5317, test_loss: 1.3074, test_f1: 0.6024
 epoch: 23, train_loss: 0.5825, test_loss: 1.1641, test_f1: 0.6337
 epoch: 24, train_loss: 0.5477, test_loss: 1.2739, test_f1: 0.6485
 epoch: 25, train_loss: 0.5076, test_loss: 1.5346, test_f1: 0.5498
 epoch: 26, train_loss: 0.5166, test_loss: 1.4588, test_f1: 0.5638
 epoch: 27, train_loss: 0.5001, test_loss: 1.2688, test_f1: 0.6415
 epoch: 28, train_loss: 0.4861, test_loss: 1.4997, test_f1: 0.6080
 epoch: 29, train_loss: 0.4613, test_loss: 1.3529, test_f1: 0.6180
 epoch: 30, train_loss: 0.4379, test_loss: 1.5787, test_f1: 0.5868
 epoch: 31, train_loss: 0.4543, test_loss: 1.5004, test_f1: 0.6117
 epoch: 32, train_loss: 0.4333, test_loss: 1.6758, test_f1: 0.5524
 epoch: 33, train_loss: 0.4404, test_loss: 1.5510, test_f1: 0.5991
 epoch: 34, train_loss: 0.4146, test_loss: 1.7335, test_f1: 0.4967
 epoch: 35, train_loss: 0.4179, test_loss: 1.6456, test_f1: 0.6023
 epoch: 36, train_loss: 0.3812, test_loss: 1.6022, test_f1: 0.6001
 epoch: 37, train_loss: 0.3850, test_loss: 1.5944, test_f1: 0.5896
 epoch: 38, train_loss: 0.3851, test_loss: 1.5005, test_f1: 0.6151
 epoch: 39, train_loss: 0.3923, test_loss: 1.5076, test_f1: 0.6290
 epoch: 40, train_loss: 0.3752, test_loss: 2.0773, test_f1: 0.5713
 epoch: 41, train_loss: 0.3500, test_loss: 1.8528, test_f1: 0.5398
 epoch: 42, train_loss: 0.3310, test_loss: 1.8486, test_f1: 0.5877
 epoch: 43, train_loss: 0.3238, test_loss: 1.8177, test_f1: 0.5942
 epoch: 44, train_loss: 0.3634, test_loss: 1.6225, test_f1: 0.6099
 epoch: 45, train_loss: 0.3585, test_loss: 1.5323, test_f1: 0.5676
 epoch: 46, train_loss: 0.3278, test_loss: 1.7047, test_f1: 0.6389
 epoch: 47, train_loss: 0.3229, test_loss: 1.7627, test_f1: 0.6251
 epoch: 48, train_loss: 0.3393, test_loss: 1.8762, test_f1: 0.5832
 epoch: 49, train_loss: 0.3172, test_loss: 1.6929, test_f1: 0.6219
 epoch: 50, train_loss: 0.3128, test_loss: 1.7878, test_f1: 0.6080
 epoch: 51, train_loss: 0.2700, test_loss: 2.0786, test_f1: 0.5525
 epoch: 52, train_loss: 0.2254, test_loss: 1.7636, test_f1: 0.6425
 epoch: 53, train_loss: 0.2317, test_loss: 2.0560, test_f1: 0.5930
 epoch: 54, train_loss: 0.2119, test_loss: 1.9870, test_f1: 0.6046
 epoch: 55, train_loss: 0.2087, test_loss: 2.1145, test_f1: 0.5834
 epoch: 56, train_loss: 0.2366, test_loss: 1.9818, test_f1: 0.6263
 epoch: 57, train_loss: 0.2111, test_loss: 2.0504, test_f1: 0.6235
 epoch: 58, train_loss: 0.1928, test_loss: 2.0839, test_f1: 0.6149
 epoch: 59, train_loss: 0.2110, test_loss: 2.0740, test_f1: 0.6304
 epoch: 60, train_loss: 0.1951, test_loss: 2.2078, test_f1: 0.5878
 epoch: 61, train_loss: 0.2008, test_loss: 2.0316, test_f1: 0.6234
 epoch: 62, train_loss: 0.1760, test_loss: 2.1237, test_f1: 0.6256
 epoch: 63, train_loss: 0.1725, test_loss: 2.2861, test_f1: 0.5865
 epoch: 64, train_loss: 0.1779, test_loss: 2.1105, test_f1: 0.6360
 epoch: 65, train_loss: 0.1857, test_loss: 2.5014, test_f1: 0.5714
 epoch: 66, train_loss: 0.1860, test_loss: 2.2789, test_f1: 0.5869
 epoch: 67, train_loss: 0.1789, test_loss: 2.4034, test_f1: 0.6270
 epoch: 68, train_loss: 0.1566, test_loss: 2.5759, test_f1: 0.5862
 epoch: 69, train_loss: 0.1664, test_loss: 2.5024, test_f1: 0.5905
 epoch: 70, train_loss: 0.1486, test_loss: 2.5108, test_f1: 0.6297
 epoch: 71, train_loss: 0.1627, test_loss: 2.4561, test_f1: 0.5940
 epoch: 72, train_loss: 0.1836, test_loss: 2.3244, test_f1: 0.6152
 epoch: 73, train_loss: 0.1678, test_loss: 2.2459, test_f1: 0.6319
 epoch: 74, train_loss: 0.1560, test_loss: 2.2834, test_f1: 0.6156
 epoch: 75, train_loss: 0.1424, test_loss: 2.5473, test_f1: 0.5928
 epoch: 76, train_loss: 0.1693, test_loss: 2.4096, test_f1: 0.5998
 epoch: 77, train_loss: 0.1604, test_loss: 2.4250, test_f1: 0.5870
 epoch: 78, train_loss: 0.1532, test_loss: 2.4888, test_f1: 0.5893
 epoch: 79, train_loss: 0.1555, test_loss: 2.8471, test_f1: 0.5772
 epoch: 80, train_loss: 0.1550, test_loss: 2.4052, test_f1: 0.5908
 epoch: 81, train_loss: 0.1323, test_loss: 2.5794, test_f1: 0.5929
 epoch: 82, train_loss: 0.1368, test_loss: 2.7506, test_f1: 0.5886
 epoch: 83, train_loss: 0.1420, test_loss: 2.8435, test_f1: 0.5619
 epoch: 84, train_loss: 0.1549, test_loss: 2.6123, test_f1: 0.5735
 epoch: 85, train_loss: 0.1691, test_loss: 2.6504, test_f1: 0.5890
 epoch: 86, train_loss: 0.1657, test_loss: 3.1295, test_f1: 0.5599
 epoch: 87, train_loss: 0.1462, test_loss: 2.5918, test_f1: 0.5632
 epoch: 88, train_loss: 0.1340, test_loss: 2.6331, test_f1: 0.5730
 epoch: 89, train_loss: 0.1333, test_loss: 2.6606, test_f1: 0.6032
 epoch: 90, train_loss: 0.1124, test_loss: 2.9392, test_f1: 0.5754
 epoch: 91, train_loss: 0.1435, test_loss: 2.5939, test_f1: 0.5806
 epoch: 92, train_loss: 0.1549, test_loss: 2.6161, test_f1: 0.6390
 epoch: 93, train_loss: 0.1473, test_loss: 2.6865, test_f1: 0.5961
 epoch: 94, train_loss: 0.1362, test_loss: 2.6559, test_f1: 0.5827
 epoch: 95, train_loss: 0.1472, test_loss: 2.3447, test_f1: 0.6181
 epoch: 96, train_loss: 0.1246, test_loss: 2.6161, test_f1: 0.5718
 epoch: 97, train_loss: 0.1395, test_loss: 2.8168, test_f1: 0.5983
 epoch: 98, train_loss: 0.1203, test_loss: 2.8088, test_f1: 0.6085
 epoch: 99, train_loss: 0.0958, test_loss: 2.9068, test_f1: 0.5951

Training completed in 799.31 seconds
Best F1: 0.6744 at epoch 35
Mean F1 across iterations: 0.6597  0.0131
========================FINAL RESULTS================================
FEGIN weighted F1: 0.6744  0.0131
python main.py --data ltspice_demos --representation component_pin_net --model FEGIN --layers 6 --hiddens 128 --batch_size 32 --lr 0.001 --emb_size 128 --epochs 100 --save_appendix component_pin_net_L6_H128_BS32_LR0.001_E128 --no_val
-----



STDERR:
  File "main.py", line 370, in <module>
    main()
  File "main.py", line 254, in main
    dataset = dataset_class(
  File "/home/philip/projects/ltspice_examples_code_repo/Circuit-Completion-Using-GNNs/component_classification_with_link_prediction_head/evaluation/FEGIN/kernel/circuit_datasets.py", line 15, in __init__
    self.data, self.slices = torch.load(self.processed_paths[0])
  File "/home/philip/.local/lib/python3.8/site-packages/torch/serialization.py", line 1040, in load
    warnings.warn(
  File "/usr/lib/python3.8/warnings.py", line 109, in _showwarnmsg
    sw(msg.message, msg.category, msg.filename, msg.lineno,
  File "main.py", line 47, in warn_with_traceback
    traceback.print_stack(file=log)
/home/philip/projects/ltspice_examples_code_repo/Circuit-Completion-Using-GNNs/component_classification_with_link_prediction_head/evaluation/FEGIN/kernel/circuit_datasets.py:15: FutureWarning: You are using `torch.load` with `weights_only=False` (the current default value), which uses the default pickle module implicitly. It is possible to construct malicious pickle data which will execute arbitrary code during unpickling (See https://github.com/pytorch/pytorch/blob/main/SECURITY.md#untrusted-models for more details). In a future release, the default value for `weights_only` will be flipped to `True`. This limits the functions that could be executed during unpickling. Arbitrary objects will no longer be allowed to be loaded via this mode unless they are explicitly allowlisted by the user via `torch.serialization.add_safe_globals`. We recommend you start setting `weights_only=True` for any use case where you don't have full control of the loaded file. Please open an issue on GitHub for any issues related to this experimental feature.
  self.data, self.slices = torch.load(self.processed_paths[0])
