STDOUT:
Results will be saved in /home/philip/projects/ltspice_examples_code_repo/Circuit-Completion-Using-GNNs/component_classification_with_link_prediction_head/evaluation/FEGIN/results/model_FEGIN_dataset_ltspice_demos
Command line input: python main.py --data ltspice_demos --representation component_pin --model FEGIN --layers 3 --hiddens 64 --batch_size 64 --lr 0.001 --emb_size 250 --epochs 100 --save_appendix component_pin_L3_H64_BS64_LR0.001_E250 --no_val
 is saved.
-----
ltspice_demos - FEGIN
Using 3 layers, 64 hidden units, h = 2
Loading component_pin representation dataset
ENTERED
Training FEGIN on component_pin representation
Train: 1565, Test: 383
##################ITERATION #0 ****************************************
 epoch: 0, train_loss: 1.3132, test_loss: 1.3039, test_f1: 0.2655
 epoch: 1, train_loss: 1.1785, test_loss: 1.2479, test_f1: 0.3533
 epoch: 2, train_loss: 1.1353, test_loss: 1.2001, test_f1: 0.4582
 epoch: 3, train_loss: 1.0888, test_loss: 1.1565, test_f1: 0.4537
 epoch: 4, train_loss: 1.0152, test_loss: 1.0997, test_f1: 0.4470
 epoch: 5, train_loss: 0.9696, test_loss: 1.0520, test_f1: 0.5362
 epoch: 6, train_loss: 0.9334, test_loss: 1.0102, test_f1: 0.5249
 epoch: 7, train_loss: 0.8856, test_loss: 1.0525, test_f1: 0.5367
 epoch: 8, train_loss: 0.8612, test_loss: 1.0729, test_f1: 0.5014
 epoch: 9, train_loss: 0.8219, test_loss: 0.9951, test_f1: 0.5609
 epoch: 10, train_loss: 0.8101, test_loss: 0.9677, test_f1: 0.5709
 epoch: 11, train_loss: 0.7712, test_loss: 0.9868, test_f1: 0.5953
 epoch: 12, train_loss: 0.7607, test_loss: 0.9475, test_f1: 0.6274
 epoch: 13, train_loss: 0.7410, test_loss: 0.9864, test_f1: 0.5461
 epoch: 14, train_loss: 0.7057, test_loss: 1.0535, test_f1: 0.5920
 epoch: 15, train_loss: 0.6987, test_loss: 1.0598, test_f1: 0.5687
 epoch: 16, train_loss: 0.6705, test_loss: 1.0313, test_f1: 0.5933
 epoch: 17, train_loss: 0.6441, test_loss: 1.0434, test_f1: 0.5941
 epoch: 18, train_loss: 0.6305, test_loss: 1.0522, test_f1: 0.5815
 epoch: 19, train_loss: 0.6136, test_loss: 1.1855, test_f1: 0.5105
 epoch: 20, train_loss: 0.6394, test_loss: 1.0246, test_f1: 0.5932
 epoch: 21, train_loss: 0.6109, test_loss: 1.0386, test_f1: 0.6043
 epoch: 22, train_loss: 0.5782, test_loss: 1.0058, test_f1: 0.5925
 epoch: 23, train_loss: 0.5637, test_loss: 1.2637, test_f1: 0.5428
 epoch: 24, train_loss: 0.5714, test_loss: 1.0810, test_f1: 0.5859
 epoch: 25, train_loss: 0.5812, test_loss: 1.1042, test_f1: 0.6153
 epoch: 26, train_loss: 0.5550, test_loss: 1.1631, test_f1: 0.5724
 epoch: 27, train_loss: 0.5202, test_loss: 1.0578, test_f1: 0.5957
 epoch: 28, train_loss: 0.5030, test_loss: 1.4460, test_f1: 0.5871
 epoch: 29, train_loss: 0.5085, test_loss: 1.3137, test_f1: 0.6040
 epoch: 30, train_loss: 0.4932, test_loss: 1.2455, test_f1: 0.5848
 epoch: 31, train_loss: 0.4864, test_loss: 1.4703, test_f1: 0.5789
 epoch: 32, train_loss: 0.4745, test_loss: 1.5189, test_f1: 0.5576
 epoch: 33, train_loss: 0.4887, test_loss: 1.2801, test_f1: 0.6048
 epoch: 34, train_loss: 0.4620, test_loss: 1.3873, test_f1: 0.6118
 epoch: 35, train_loss: 0.4311, test_loss: 1.6736, test_f1: 0.5292
 epoch: 36, train_loss: 0.4100, test_loss: 1.4724, test_f1: 0.5768
 epoch: 37, train_loss: 0.3893, test_loss: 1.4972, test_f1: 0.6458
 epoch: 38, train_loss: 0.4113, test_loss: 1.2489, test_f1: 0.6572
 epoch: 39, train_loss: 0.3772, test_loss: 1.6460, test_f1: 0.5955
 epoch: 40, train_loss: 0.4195, test_loss: 1.3663, test_f1: 0.6314
 epoch: 41, train_loss: 0.3639, test_loss: 1.5021, test_f1: 0.5969
 epoch: 42, train_loss: 0.3750, test_loss: 1.4054, test_f1: 0.6010
 epoch: 43, train_loss: 0.3601, test_loss: 1.5790, test_f1: 0.6606
 epoch: 44, train_loss: 0.3163, test_loss: 1.4552, test_f1: 0.6289
 epoch: 45, train_loss: 0.3321, test_loss: 1.7336, test_f1: 0.5848
 epoch: 46, train_loss: 0.3499, test_loss: 1.8357, test_f1: 0.6168
 epoch: 47, train_loss: 0.3078, test_loss: 1.4486, test_f1: 0.6175
 epoch: 48, train_loss: 0.2954, test_loss: 1.5269, test_f1: 0.6069
 epoch: 49, train_loss: 0.2813, test_loss: 1.9066, test_f1: 0.5882
 epoch: 50, train_loss: 0.2761, test_loss: 1.6290, test_f1: 0.6051
 epoch: 51, train_loss: 0.2434, test_loss: 1.6358, test_f1: 0.6284
 epoch: 52, train_loss: 0.2510, test_loss: 1.6454, test_f1: 0.6362
 epoch: 53, train_loss: 0.2082, test_loss: 1.7368, test_f1: 0.6069
 epoch: 54, train_loss: 0.2001, test_loss: 1.7827, test_f1: 0.6278
 epoch: 55, train_loss: 0.1996, test_loss: 1.8766, test_f1: 0.5869
 epoch: 56, train_loss: 0.2168, test_loss: 1.7490, test_f1: 0.6034
 epoch: 57, train_loss: 0.2108, test_loss: 2.0055, test_f1: 0.6015
 epoch: 58, train_loss: 0.1774, test_loss: 1.7200, test_f1: 0.6175
 epoch: 59, train_loss: 0.1854, test_loss: 2.0476, test_f1: 0.5960
 epoch: 60, train_loss: 0.1993, test_loss: 1.9223, test_f1: 0.6371
 epoch: 61, train_loss: 0.2175, test_loss: 1.5883, test_f1: 0.6408
 epoch: 62, train_loss: 0.1888, test_loss: 2.0699, test_f1: 0.6060
 epoch: 63, train_loss: 0.1909, test_loss: 1.9163, test_f1: 0.6062
 epoch: 64, train_loss: 0.1837, test_loss: 1.6682, test_f1: 0.6744
 epoch: 65, train_loss: 0.1553, test_loss: 2.0837, test_f1: 0.5960
 epoch: 66, train_loss: 0.1572, test_loss: 1.9586, test_f1: 0.6257
 epoch: 67, train_loss: 0.1493, test_loss: 2.2025, test_f1: 0.5817
 epoch: 68, train_loss: 0.1535, test_loss: 2.2918, test_f1: 0.5959
 epoch: 69, train_loss: 0.1577, test_loss: 2.1652, test_f1: 0.6120
 epoch: 70, train_loss: 0.1658, test_loss: 1.9233, test_f1: 0.6076
 epoch: 71, train_loss: 0.1558, test_loss: 2.0674, test_f1: 0.6640
 epoch: 72, train_loss: 0.1561, test_loss: 2.3274, test_f1: 0.6225
 epoch: 73, train_loss: 0.1297, test_loss: 2.2644, test_f1: 0.6057
 epoch: 74, train_loss: 0.1322, test_loss: 2.3438, test_f1: 0.6260
 epoch: 75, train_loss: 0.1571, test_loss: 2.2610, test_f1: 0.6105
 epoch: 76, train_loss: 0.1366, test_loss: 2.4107, test_f1: 0.6233
 epoch: 77, train_loss: 0.1292, test_loss: 2.4587, test_f1: 0.6143
 epoch: 78, train_loss: 0.1361, test_loss: 2.1339, test_f1: 0.6426
 epoch: 79, train_loss: 0.1517, test_loss: 2.4417, test_f1: 0.6521
 epoch: 80, train_loss: 0.1589, test_loss: 2.1208, test_f1: 0.6127
 epoch: 81, train_loss: 0.1537, test_loss: 2.5469, test_f1: 0.5688
 epoch: 82, train_loss: 0.1475, test_loss: 2.1824, test_f1: 0.6316
 epoch: 83, train_loss: 0.1187, test_loss: 2.3001, test_f1: 0.6332
 epoch: 84, train_loss: 0.1132, test_loss: 2.5073, test_f1: 0.6270
 epoch: 85, train_loss: 0.0937, test_loss: 2.4687, test_f1: 0.6368
 epoch: 86, train_loss: 0.1377, test_loss: 2.4558, test_f1: 0.6094
 epoch: 87, train_loss: 0.1484, test_loss: 2.4119, test_f1: 0.6537
 epoch: 88, train_loss: 0.1503, test_loss: 2.5022, test_f1: 0.6396
 epoch: 89, train_loss: 0.1454, test_loss: 2.2247, test_f1: 0.6312
 epoch: 90, train_loss: 0.1250, test_loss: 2.0888, test_f1: 0.6562
 epoch: 91, train_loss: 0.1235, test_loss: 2.5534, test_f1: 0.6363
 epoch: 92, train_loss: 0.1499, test_loss: 2.3387, test_f1: 0.6499
 epoch: 93, train_loss: 0.1070, test_loss: 2.4729, test_f1: 0.6310
 epoch: 94, train_loss: 0.1315, test_loss: 2.2703, test_f1: 0.6549
 epoch: 95, train_loss: 0.0851, test_loss: 2.6288, test_f1: 0.6712
 epoch: 96, train_loss: 0.0832, test_loss: 2.3974, test_f1: 0.6489
 epoch: 97, train_loss: 0.0863, test_loss: 2.7033, test_f1: 0.6301
 epoch: 98, train_loss: 0.1372, test_loss: 2.4506, test_f1: 0.6325
 epoch: 99, train_loss: 0.1397, test_loss: 2.5897, test_f1: 0.6226
##################ITERATION #1 ****************************************
 epoch: 0, train_loss: 1.1856, test_loss: 1.3283, test_f1: 0.2604
 epoch: 1, train_loss: 1.0246, test_loss: 1.3824, test_f1: 0.3522
 epoch: 2, train_loss: 0.9697, test_loss: 1.0759, test_f1: 0.5028
 epoch: 3, train_loss: 0.8874, test_loss: 0.9918, test_f1: 0.5517
 epoch: 4, train_loss: 0.8450, test_loss: 0.9866, test_f1: 0.5725
 epoch: 5, train_loss: 0.8136, test_loss: 0.9837, test_f1: 0.6033
 epoch: 6, train_loss: 0.7789, test_loss: 1.0063, test_f1: 0.5608
 epoch: 7, train_loss: 0.7475, test_loss: 1.0080, test_f1: 0.5398
 epoch: 8, train_loss: 0.7188, test_loss: 0.9705, test_f1: 0.6204
 epoch: 9, train_loss: 0.7084, test_loss: 1.1244, test_f1: 0.5625
 epoch: 10, train_loss: 0.7024, test_loss: 1.0347, test_f1: 0.6331
 epoch: 11, train_loss: 0.6817, test_loss: 1.1198, test_f1: 0.6158
 epoch: 12, train_loss: 0.6644, test_loss: 1.1603, test_f1: 0.5541
 epoch: 13, train_loss: 0.6555, test_loss: 1.0394, test_f1: 0.6261
 epoch: 14, train_loss: 0.6370, test_loss: 1.1673, test_f1: 0.5737
 epoch: 15, train_loss: 0.6029, test_loss: 1.1129, test_f1: 0.5877
 epoch: 16, train_loss: 0.5820, test_loss: 1.0669, test_f1: 0.6440
 epoch: 17, train_loss: 0.6028, test_loss: 1.3026, test_f1: 0.6427
 epoch: 18, train_loss: 0.6438, test_loss: 1.1006, test_f1: 0.5825
 epoch: 19, train_loss: 0.6138, test_loss: 1.1495, test_f1: 0.6013
 epoch: 20, train_loss: 0.5612, test_loss: 1.1912, test_f1: 0.5703
 epoch: 21, train_loss: 0.5376, test_loss: 1.2042, test_f1: 0.5782
 epoch: 22, train_loss: 0.5316, test_loss: 1.2973, test_f1: 0.5997
 epoch: 23, train_loss: 0.4858, test_loss: 1.1712, test_f1: 0.6210
 epoch: 24, train_loss: 0.4777, test_loss: 1.4496, test_f1: 0.6487
 epoch: 25, train_loss: 0.4928, test_loss: 1.4367, test_f1: 0.5860
 epoch: 26, train_loss: 0.4879, test_loss: 1.3490, test_f1: 0.6056
 epoch: 27, train_loss: 0.4492, test_loss: 1.4894, test_f1: 0.5959
 epoch: 28, train_loss: 0.4497, test_loss: 1.3943, test_f1: 0.6721
 epoch: 29, train_loss: 0.4390, test_loss: 1.3563, test_f1: 0.6262
 epoch: 30, train_loss: 0.3895, test_loss: 1.5526, test_f1: 0.6124
 epoch: 31, train_loss: 0.3939, test_loss: 1.7375, test_f1: 0.5662
 epoch: 32, train_loss: 0.4291, test_loss: 1.4217, test_f1: 0.6215
 epoch: 33, train_loss: 0.4173, test_loss: 1.5643, test_f1: 0.5956
 epoch: 34, train_loss: 0.3760, test_loss: 1.5090, test_f1: 0.6195
 epoch: 35, train_loss: 0.3684, test_loss: 1.5546, test_f1: 0.6377
 epoch: 36, train_loss: 0.3595, test_loss: 1.7388, test_f1: 0.5551
 epoch: 37, train_loss: 0.3573, test_loss: 1.8254, test_f1: 0.5902
 epoch: 38, train_loss: 0.3432, test_loss: 1.8821, test_f1: 0.5976
 epoch: 39, train_loss: 0.3408, test_loss: 1.7037, test_f1: 0.6135
 epoch: 40, train_loss: 0.3269, test_loss: 2.0840, test_f1: 0.6095
 epoch: 41, train_loss: 0.3517, test_loss: 1.6550, test_f1: 0.6004
 epoch: 42, train_loss: 0.3303, test_loss: 1.9802, test_f1: 0.5720
 epoch: 43, train_loss: 0.3291, test_loss: 2.0386, test_f1: 0.5791
 epoch: 44, train_loss: 0.3104, test_loss: 2.0724, test_f1: 0.5557
 epoch: 45, train_loss: 0.3135, test_loss: 1.7265, test_f1: 0.5901
 epoch: 46, train_loss: 0.3247, test_loss: 2.6797, test_f1: 0.5946
 epoch: 47, train_loss: 0.3339, test_loss: 2.0538, test_f1: 0.5697
 epoch: 48, train_loss: 0.3065, test_loss: 2.1512, test_f1: 0.5640
 epoch: 49, train_loss: 0.2942, test_loss: 2.2405, test_f1: 0.6428
 epoch: 50, train_loss: 0.2601, test_loss: 2.1828, test_f1: 0.5912
 epoch: 51, train_loss: 0.2429, test_loss: 1.9882, test_f1: 0.6222
 epoch: 52, train_loss: 0.2311, test_loss: 1.9529, test_f1: 0.6118
 epoch: 53, train_loss: 0.1895, test_loss: 2.1270, test_f1: 0.6252
 epoch: 54, train_loss: 0.1885, test_loss: 2.0515, test_f1: 0.6118
 epoch: 55, train_loss: 0.1888, test_loss: 2.3488, test_f1: 0.6200
 epoch: 56, train_loss: 0.1986, test_loss: 2.2109, test_f1: 0.6129
 epoch: 57, train_loss: 0.1738, test_loss: 2.2321, test_f1: 0.6112
 epoch: 58, train_loss: 0.1948, test_loss: 2.3590, test_f1: 0.6165
 epoch: 59, train_loss: 0.1624, test_loss: 2.3843, test_f1: 0.6246
 epoch: 60, train_loss: 0.1688, test_loss: 2.3473, test_f1: 0.5927
 epoch: 61, train_loss: 0.1699, test_loss: 2.3993, test_f1: 0.6076
 epoch: 62, train_loss: 0.1590, test_loss: 2.6080, test_f1: 0.5794
 epoch: 63, train_loss: 0.1640, test_loss: 2.5282, test_f1: 0.5969
 epoch: 64, train_loss: 0.1459, test_loss: 2.5795, test_f1: 0.5767
 epoch: 65, train_loss: 0.1623, test_loss: 3.0263, test_f1: 0.5772
 epoch: 66, train_loss: 0.1562, test_loss: 2.9677, test_f1: 0.6037
 epoch: 67, train_loss: 0.1697, test_loss: 2.5080, test_f1: 0.6053
 epoch: 68, train_loss: 0.1576, test_loss: 2.8863, test_f1: 0.5443
 epoch: 69, train_loss: 0.1505, test_loss: 2.8793, test_f1: 0.5491
 epoch: 70, train_loss: 0.1370, test_loss: 2.8632, test_f1: 0.5929
 epoch: 71, train_loss: 0.1457, test_loss: 2.6653, test_f1: 0.5989
 epoch: 72, train_loss: 0.1527, test_loss: 2.8324, test_f1: 0.6049
 epoch: 73, train_loss: 0.1484, test_loss: 2.8917, test_f1: 0.5750
 epoch: 74, train_loss: 0.1362, test_loss: 3.2361, test_f1: 0.5879
 epoch: 75, train_loss: 0.1298, test_loss: 2.9993, test_f1: 0.5825
 epoch: 76, train_loss: 0.1157, test_loss: 2.9575, test_f1: 0.5887
 epoch: 77, train_loss: 0.1341, test_loss: 3.1731, test_f1: 0.5942
 epoch: 78, train_loss: 0.1634, test_loss: 3.2650, test_f1: 0.5776
 epoch: 79, train_loss: 0.1640, test_loss: 3.0893, test_f1: 0.5368
 epoch: 80, train_loss: 0.1618, test_loss: 3.1750, test_f1: 0.6041
 epoch: 81, train_loss: 0.1415, test_loss: 3.1136, test_f1: 0.5807
 epoch: 82, train_loss: 0.1350, test_loss: 3.2674, test_f1: 0.6062
 epoch: 83, train_loss: 0.1275, test_loss: 3.1029, test_f1: 0.5869
 epoch: 84, train_loss: 0.1121, test_loss: 3.4388, test_f1: 0.5739
 epoch: 85, train_loss: 0.1016, test_loss: 3.2890, test_f1: 0.6032
 epoch: 86, train_loss: 0.1167, test_loss: 3.3533, test_f1: 0.5748
 epoch: 87, train_loss: 0.1098, test_loss: 3.2347, test_f1: 0.6029
 epoch: 88, train_loss: 0.1206, test_loss: 3.4139, test_f1: 0.5814
 epoch: 89, train_loss: 0.1097, test_loss: 3.3694, test_f1: 0.5920
 epoch: 90, train_loss: 0.0973, test_loss: 3.5639, test_f1: 0.5724
 epoch: 91, train_loss: 0.1168, test_loss: 3.5522, test_f1: 0.5818
 epoch: 92, train_loss: 0.1241, test_loss: 3.6980, test_f1: 0.5790
 epoch: 93, train_loss: 0.1201, test_loss: 3.4414, test_f1: 0.5816
 epoch: 94, train_loss: 0.1171, test_loss: 3.3940, test_f1: 0.5947
 epoch: 95, train_loss: 0.1088, test_loss: 3.4954, test_f1: 0.5970
 epoch: 96, train_loss: 0.0929, test_loss: 3.4999, test_f1: 0.5988
 epoch: 97, train_loss: 0.1069, test_loss: 3.8280, test_f1: 0.5811
 epoch: 98, train_loss: 0.1076, test_loss: 3.9680, test_f1: 0.5872
 epoch: 99, train_loss: 0.1293, test_loss: 4.3884, test_f1: 0.5695
##################ITERATION #2 ****************************************
 epoch: 0, train_loss: 1.1442, test_loss: 1.2854, test_f1: 0.2975
 epoch: 1, train_loss: 0.9633, test_loss: 1.1228, test_f1: 0.4033
 epoch: 2, train_loss: 0.9009, test_loss: 1.0324, test_f1: 0.5091
 epoch: 3, train_loss: 0.8611, test_loss: 1.0386, test_f1: 0.4831
 epoch: 4, train_loss: 0.8258, test_loss: 0.9383, test_f1: 0.6044
 epoch: 5, train_loss: 0.7893, test_loss: 0.9598, test_f1: 0.5780
 epoch: 6, train_loss: 0.7656, test_loss: 1.1227, test_f1: 0.5143
 epoch: 7, train_loss: 0.7516, test_loss: 1.1618, test_f1: 0.4933
 epoch: 8, train_loss: 0.7180, test_loss: 0.9955, test_f1: 0.5707
 epoch: 9, train_loss: 0.6937, test_loss: 1.0275, test_f1: 0.5321
 epoch: 10, train_loss: 0.6782, test_loss: 1.4213, test_f1: 0.4663
 epoch: 11, train_loss: 0.6890, test_loss: 1.0991, test_f1: 0.5624
 epoch: 12, train_loss: 0.6578, test_loss: 0.9561, test_f1: 0.5658
 epoch: 13, train_loss: 0.6218, test_loss: 1.0831, test_f1: 0.6230
 epoch: 14, train_loss: 0.6149, test_loss: 1.0346, test_f1: 0.5824
 epoch: 15, train_loss: 0.5957, test_loss: 0.9808, test_f1: 0.6363
 epoch: 16, train_loss: 0.5859, test_loss: 1.0096, test_f1: 0.6116
 epoch: 17, train_loss: 0.5677, test_loss: 1.1993, test_f1: 0.5613
 epoch: 18, train_loss: 0.5641, test_loss: 1.0393, test_f1: 0.6242
 epoch: 19, train_loss: 0.5383, test_loss: 1.3854, test_f1: 0.5478
 epoch: 20, train_loss: 0.5738, test_loss: 1.1799, test_f1: 0.5660
 epoch: 21, train_loss: 0.5232, test_loss: 1.4765, test_f1: 0.5464
 epoch: 22, train_loss: 0.5224, test_loss: 1.0980, test_f1: 0.5904
 epoch: 23, train_loss: 0.5042, test_loss: 1.1383, test_f1: 0.6226
 epoch: 24, train_loss: 0.4869, test_loss: 1.3855, test_f1: 0.6283
 epoch: 25, train_loss: 0.4839, test_loss: 1.3536, test_f1: 0.6139
 epoch: 26, train_loss: 0.4467, test_loss: 1.6214, test_f1: 0.5866
 epoch: 27, train_loss: 0.4548, test_loss: 1.0760, test_f1: 0.6364
 epoch: 28, train_loss: 0.4373, test_loss: 1.1509, test_f1: 0.6237
 epoch: 29, train_loss: 0.4206, test_loss: 1.1360, test_f1: 0.6417
 epoch: 30, train_loss: 0.4214, test_loss: 1.3760, test_f1: 0.6397
 epoch: 31, train_loss: 0.4321, test_loss: 1.3016, test_f1: 0.6505
 epoch: 32, train_loss: 0.3919, test_loss: 1.3532, test_f1: 0.6039
 epoch: 33, train_loss: 0.3577, test_loss: 1.4471, test_f1: 0.6041
 epoch: 34, train_loss: 0.4150, test_loss: 1.2873, test_f1: 0.6243
 epoch: 35, train_loss: 0.3931, test_loss: 1.3678, test_f1: 0.6207
 epoch: 36, train_loss: 0.3480, test_loss: 1.3311, test_f1: 0.6068
 epoch: 37, train_loss: 0.3598, test_loss: 1.7490, test_f1: 0.5594
 epoch: 38, train_loss: 0.3654, test_loss: 1.2309, test_f1: 0.5978
 epoch: 39, train_loss: 0.3285, test_loss: 1.5172, test_f1: 0.5717
 epoch: 40, train_loss: 0.3749, test_loss: 1.5763, test_f1: 0.6082
 epoch: 41, train_loss: 0.3431, test_loss: 1.3749, test_f1: 0.6341
 epoch: 42, train_loss: 0.2977, test_loss: 1.4797, test_f1: 0.6460
 epoch: 43, train_loss: 0.3056, test_loss: 1.4338, test_f1: 0.6412
 epoch: 44, train_loss: 0.3520, test_loss: 1.4581, test_f1: 0.5959
 epoch: 45, train_loss: 0.3180, test_loss: 1.4923, test_f1: 0.5741
 epoch: 46, train_loss: 0.3354, test_loss: 1.6788, test_f1: 0.6293
 epoch: 47, train_loss: 0.2976, test_loss: 1.5330, test_f1: 0.6072
 epoch: 48, train_loss: 0.2681, test_loss: 1.5743, test_f1: 0.6180
 epoch: 49, train_loss: 0.2823, test_loss: 1.5036, test_f1: 0.6234
 epoch: 50, train_loss: 0.2900, test_loss: 1.6278, test_f1: 0.6247
 epoch: 51, train_loss: 0.2335, test_loss: 1.5362, test_f1: 0.6539
 epoch: 52, train_loss: 0.2199, test_loss: 1.7270, test_f1: 0.6479
 epoch: 53, train_loss: 0.1951, test_loss: 1.7131, test_f1: 0.6523
 epoch: 54, train_loss: 0.1803, test_loss: 1.7349, test_f1: 0.6314
 epoch: 55, train_loss: 0.1982, test_loss: 1.7944, test_f1: 0.6345
 epoch: 56, train_loss: 0.1906, test_loss: 1.7201, test_f1: 0.6617
 epoch: 57, train_loss: 0.1713, test_loss: 1.7486, test_f1: 0.6697
 epoch: 58, train_loss: 0.1784, test_loss: 1.7719, test_f1: 0.6323
 epoch: 59, train_loss: 0.1678, test_loss: 1.8706, test_f1: 0.6564
 epoch: 60, train_loss: 0.1635, test_loss: 2.0204, test_f1: 0.6122
 epoch: 61, train_loss: 0.1436, test_loss: 1.9536, test_f1: 0.6332
 epoch: 62, train_loss: 0.1658, test_loss: 1.9720, test_f1: 0.6663
 epoch: 63, train_loss: 0.1537, test_loss: 1.8953, test_f1: 0.6260
 epoch: 64, train_loss: 0.1488, test_loss: 2.0964, test_f1: 0.6551
 epoch: 65, train_loss: 0.1487, test_loss: 2.0867, test_f1: 0.6468
 epoch: 66, train_loss: 0.1421, test_loss: 2.0966, test_f1: 0.6298
 epoch: 67, train_loss: 0.1563, test_loss: 1.9471, test_f1: 0.6512
 epoch: 68, train_loss: 0.1991, test_loss: 2.1698, test_f1: 0.6558
 epoch: 69, train_loss: 0.1850, test_loss: 2.1362, test_f1: 0.6481
 epoch: 70, train_loss: 0.1648, test_loss: 2.1363, test_f1: 0.6123
 epoch: 71, train_loss: 0.1618, test_loss: 2.0736, test_f1: 0.6376
 epoch: 72, train_loss: 0.1305, test_loss: 2.0585, test_f1: 0.6227
 epoch: 73, train_loss: 0.1336, test_loss: 2.2451, test_f1: 0.6210
 epoch: 74, train_loss: 0.1133, test_loss: 2.0782, test_f1: 0.6410
 epoch: 75, train_loss: 0.1264, test_loss: 2.1391, test_f1: 0.6288
 epoch: 76, train_loss: 0.1195, test_loss: 2.1558, test_f1: 0.6429
 epoch: 77, train_loss: 0.1692, test_loss: 2.3272, test_f1: 0.6192
 epoch: 78, train_loss: 0.1714, test_loss: 2.2187, test_f1: 0.6398
 epoch: 79, train_loss: 0.1925, test_loss: 2.2191, test_f1: 0.6155
 epoch: 80, train_loss: 0.1657, test_loss: 1.9492, test_f1: 0.6465
 epoch: 81, train_loss: 0.1458, test_loss: 2.1970, test_f1: 0.6516
 epoch: 82, train_loss: 0.1397, test_loss: 2.1217, test_f1: 0.6260
 epoch: 83, train_loss: 0.1147, test_loss: 2.2786, test_f1: 0.6265
 epoch: 84, train_loss: 0.1116, test_loss: 2.3247, test_f1: 0.6531
 epoch: 85, train_loss: 0.1123, test_loss: 2.4331, test_f1: 0.6560
 epoch: 86, train_loss: 0.1104, test_loss: 2.2465, test_f1: 0.6153
 epoch: 87, train_loss: 0.1217, test_loss: 2.2857, test_f1: 0.6391
 epoch: 88, train_loss: 0.1387, test_loss: 2.4135, test_f1: 0.6434
 epoch: 89, train_loss: 0.1096, test_loss: 2.2399, test_f1: 0.6544
 epoch: 90, train_loss: 0.1163, test_loss: 2.1657, test_f1: 0.6372
 epoch: 91, train_loss: 0.1088, test_loss: 2.0925, test_f1: 0.6823
 epoch: 92, train_loss: 0.1129, test_loss: 2.2849, test_f1: 0.6271
 epoch: 93, train_loss: 0.1260, test_loss: 2.3805, test_f1: 0.6602
 epoch: 94, train_loss: 0.1132, test_loss: 2.4757, test_f1: 0.6601
 epoch: 95, train_loss: 0.1307, test_loss: 2.1737, test_f1: 0.6706
 epoch: 96, train_loss: 0.1251, test_loss: 2.0945, test_f1: 0.6708
 epoch: 97, train_loss: 0.1449, test_loss: 2.2935, test_f1: 0.6396
 epoch: 98, train_loss: 0.1411, test_loss: 2.4327, test_f1: 0.6488
 epoch: 99, train_loss: 0.1224, test_loss: 2.3116, test_f1: 0.6679
##################ITERATION #3 ****************************************
 epoch: 0, train_loss: 1.1809, test_loss: 1.2987, test_f1: 0.3087
 epoch: 1, train_loss: 0.9839, test_loss: 1.1407, test_f1: 0.4014
 epoch: 2, train_loss: 0.9273, test_loss: 1.0228, test_f1: 0.5426
 epoch: 3, train_loss: 0.8878, test_loss: 0.9873, test_f1: 0.5709
 epoch: 4, train_loss: 0.8511, test_loss: 1.0092, test_f1: 0.5218
 epoch: 5, train_loss: 0.8202, test_loss: 0.9700, test_f1: 0.5858
 epoch: 6, train_loss: 0.7857, test_loss: 0.9458, test_f1: 0.5512
 epoch: 7, train_loss: 0.7672, test_loss: 0.9037, test_f1: 0.6236
 epoch: 8, train_loss: 0.7487, test_loss: 0.9102, test_f1: 0.6160
 epoch: 9, train_loss: 0.7068, test_loss: 0.8927, test_f1: 0.6533
 epoch: 10, train_loss: 0.6729, test_loss: 0.9790, test_f1: 0.5548
 epoch: 11, train_loss: 0.6869, test_loss: 0.9515, test_f1: 0.6145
 epoch: 12, train_loss: 0.6648, test_loss: 1.0058, test_f1: 0.5763
 epoch: 13, train_loss: 0.6574, test_loss: 0.9309, test_f1: 0.6583
 epoch: 14, train_loss: 0.6378, test_loss: 0.9058, test_f1: 0.6168
 epoch: 15, train_loss: 0.6009, test_loss: 0.9539, test_f1: 0.5602
 epoch: 16, train_loss: 0.5876, test_loss: 1.0406, test_f1: 0.6005
 epoch: 17, train_loss: 0.6109, test_loss: 0.9873, test_f1: 0.6427
 epoch: 18, train_loss: 0.5676, test_loss: 1.1357, test_f1: 0.5810
 epoch: 19, train_loss: 0.5544, test_loss: 1.0243, test_f1: 0.5481
 epoch: 20, train_loss: 0.5421, test_loss: 1.0322, test_f1: 0.6110
 epoch: 21, train_loss: 0.5202, test_loss: 1.0354, test_f1: 0.5953
 epoch: 22, train_loss: 0.5132, test_loss: 1.2245, test_f1: 0.5980
 epoch: 23, train_loss: 0.4939, test_loss: 1.2018, test_f1: 0.5232
 epoch: 24, train_loss: 0.4723, test_loss: 1.2570, test_f1: 0.5253
 epoch: 25, train_loss: 0.4680, test_loss: 1.1448, test_f1: 0.5983
 epoch: 26, train_loss: 0.4568, test_loss: 1.1916, test_f1: 0.5862
 epoch: 27, train_loss: 0.4836, test_loss: 1.2556, test_f1: 0.5508
 epoch: 28, train_loss: 0.4365, test_loss: 1.1824, test_f1: 0.6030
 epoch: 29, train_loss: 0.4398, test_loss: 1.3289, test_f1: 0.5783
 epoch: 30, train_loss: 0.4143, test_loss: 1.4494, test_f1: 0.5219
 epoch: 31, train_loss: 0.4520, test_loss: 1.0568, test_f1: 0.6785
 epoch: 32, train_loss: 0.4441, test_loss: 1.1871, test_f1: 0.6411
 epoch: 33, train_loss: 0.4153, test_loss: 1.1385, test_f1: 0.6355
 epoch: 34, train_loss: 0.4010, test_loss: 1.4076, test_f1: 0.5640
 epoch: 35, train_loss: 0.3957, test_loss: 1.7907, test_f1: 0.4886
 epoch: 36, train_loss: 0.3649, test_loss: 1.4831, test_f1: 0.5839
 epoch: 37, train_loss: 0.3504, test_loss: 1.3343, test_f1: 0.5633
 epoch: 38, train_loss: 0.3308, test_loss: 1.3311, test_f1: 0.5900
 epoch: 39, train_loss: 0.3323, test_loss: 1.3740, test_f1: 0.5953
 epoch: 40, train_loss: 0.3553, test_loss: 1.8465, test_f1: 0.5637
 epoch: 41, train_loss: 0.3585, test_loss: 1.4190, test_f1: 0.5899
 epoch: 42, train_loss: 0.3016, test_loss: 2.0187, test_f1: 0.4986
 epoch: 43, train_loss: 0.3592, test_loss: 1.3782, test_f1: 0.6387
 epoch: 44, train_loss: 0.3412, test_loss: 1.3655, test_f1: 0.6050
 epoch: 45, train_loss: 0.3376, test_loss: 1.5405, test_f1: 0.5965
 epoch: 46, train_loss: 0.3062, test_loss: 1.6471, test_f1: 0.5746
 epoch: 47, train_loss: 0.2991, test_loss: 1.8257, test_f1: 0.5606
 epoch: 48, train_loss: 0.3122, test_loss: 1.7894, test_f1: 0.5616
 epoch: 49, train_loss: 0.3223, test_loss: 1.5427, test_f1: 0.5953
 epoch: 50, train_loss: 0.2952, test_loss: 1.6015, test_f1: 0.5431
 epoch: 51, train_loss: 0.2519, test_loss: 1.5717, test_f1: 0.5909
 epoch: 52, train_loss: 0.2200, test_loss: 1.6315, test_f1: 0.6218
 epoch: 53, train_loss: 0.2051, test_loss: 1.6373, test_f1: 0.6091
 epoch: 54, train_loss: 0.1870, test_loss: 1.6941, test_f1: 0.6073
 epoch: 55, train_loss: 0.1844, test_loss: 1.7972, test_f1: 0.6124
 epoch: 56, train_loss: 0.1916, test_loss: 1.8512, test_f1: 0.6155
 epoch: 57, train_loss: 0.1997, test_loss: 1.8728, test_f1: 0.6083
 epoch: 58, train_loss: 0.1830, test_loss: 1.8225, test_f1: 0.6210
 epoch: 59, train_loss: 0.1918, test_loss: 1.7817, test_f1: 0.6033
 epoch: 60, train_loss: 0.1620, test_loss: 1.7707, test_f1: 0.6087
 epoch: 61, train_loss: 0.1543, test_loss: 1.7413, test_f1: 0.6207
 epoch: 62, train_loss: 0.1557, test_loss: 1.6850, test_f1: 0.6339
 epoch: 63, train_loss: 0.1946, test_loss: 2.0205, test_f1: 0.5693
 epoch: 64, train_loss: 0.1853, test_loss: 1.8279, test_f1: 0.6259
 epoch: 65, train_loss: 0.1757, test_loss: 1.9416, test_f1: 0.6073
 epoch: 66, train_loss: 0.1524, test_loss: 1.8814, test_f1: 0.6216
 epoch: 67, train_loss: 0.1403, test_loss: 2.1772, test_f1: 0.5963
 epoch: 68, train_loss: 0.1690, test_loss: 1.9601, test_f1: 0.5900
 epoch: 69, train_loss: 0.1796, test_loss: 1.9546, test_f1: 0.5909
 epoch: 70, train_loss: 0.1608, test_loss: 2.1109, test_f1: 0.6046
 epoch: 71, train_loss: 0.1602, test_loss: 2.0155, test_f1: 0.5953
 epoch: 72, train_loss: 0.1389, test_loss: 2.1268, test_f1: 0.5816
 epoch: 73, train_loss: 0.1694, test_loss: 1.8404, test_f1: 0.6145
 epoch: 74, train_loss: 0.1751, test_loss: 1.8286, test_f1: 0.6242
 epoch: 75, train_loss: 0.1522, test_loss: 2.1973, test_f1: 0.5702
 epoch: 76, train_loss: 0.1503, test_loss: 2.0931, test_f1: 0.6087
 epoch: 77, train_loss: 0.1507, test_loss: 2.0412, test_f1: 0.6183
 epoch: 78, train_loss: 0.1312, test_loss: 2.2011, test_f1: 0.5949
 epoch: 79, train_loss: 0.1210, test_loss: 2.0746, test_f1: 0.6033
 epoch: 80, train_loss: 0.1268, test_loss: 2.0168, test_f1: 0.6169
 epoch: 81, train_loss: 0.1386, test_loss: 2.1121, test_f1: 0.6250
 epoch: 82, train_loss: 0.1409, test_loss: 2.1482, test_f1: 0.6241
 epoch: 83, train_loss: 0.1341, test_loss: 2.2553, test_f1: 0.6095
 epoch: 84, train_loss: 0.1416, test_loss: 2.2252, test_f1: 0.6105
 epoch: 85, train_loss: 0.1162, test_loss: 2.2350, test_f1: 0.6042
 epoch: 86, train_loss: 0.1163, test_loss: 2.2085, test_f1: 0.6124
 epoch: 87, train_loss: 0.1010, test_loss: 1.9486, test_f1: 0.6214
 epoch: 88, train_loss: 0.1127, test_loss: 2.3913, test_f1: 0.6036
 epoch: 89, train_loss: 0.1351, test_loss: 2.2964, test_f1: 0.5952
 epoch: 90, train_loss: 0.1404, test_loss: 2.1926, test_f1: 0.6137
 epoch: 91, train_loss: 0.1343, test_loss: 2.3117, test_f1: 0.5811
 epoch: 92, train_loss: 0.1419, test_loss: 2.2752, test_f1: 0.5847
 epoch: 93, train_loss: 0.1174, test_loss: 2.3253, test_f1: 0.6134
 epoch: 94, train_loss: 0.1443, test_loss: 2.1778, test_f1: 0.6094
 epoch: 95, train_loss: 0.1416, test_loss: 2.1193, test_f1: 0.6181
 epoch: 96, train_loss: 0.1393, test_loss: 2.2837, test_f1: 0.6024
 epoch: 97, train_loss: 0.1035, test_loss: 2.2659, test_f1: 0.6322
 epoch: 98, train_loss: 0.0911, test_loss: 2.4597, test_f1: 0.6113
 epoch: 99, train_loss: 0.1252, test_loss: 2.3469, test_f1: 0.6002
##################ITERATION #4 ****************************************
 epoch: 0, train_loss: 1.1967, test_loss: 1.3893, test_f1: 0.2845
 epoch: 1, train_loss: 0.9858, test_loss: 1.2066, test_f1: 0.4335
 epoch: 2, train_loss: 0.9158, test_loss: 1.0314, test_f1: 0.5373
 epoch: 3, train_loss: 0.8768, test_loss: 0.9661, test_f1: 0.5998
 epoch: 4, train_loss: 0.8466, test_loss: 0.9481, test_f1: 0.5947
 epoch: 5, train_loss: 0.7980, test_loss: 0.9624, test_f1: 0.6039
 epoch: 6, train_loss: 0.7710, test_loss: 0.9627, test_f1: 0.6164
 epoch: 7, train_loss: 0.7303, test_loss: 1.2122, test_f1: 0.5538
 epoch: 8, train_loss: 0.7335, test_loss: 0.9644, test_f1: 0.5994
 epoch: 9, train_loss: 0.7125, test_loss: 1.1392, test_f1: 0.5412
 epoch: 10, train_loss: 0.6961, test_loss: 1.1753, test_f1: 0.5095
 epoch: 11, train_loss: 0.6766, test_loss: 1.0384, test_f1: 0.5785
 epoch: 12, train_loss: 0.6436, test_loss: 1.1199, test_f1: 0.6138
 epoch: 13, train_loss: 0.5984, test_loss: 1.0719, test_f1: 0.6088
 epoch: 14, train_loss: 0.6228, test_loss: 1.2463, test_f1: 0.5214
 epoch: 15, train_loss: 0.6075, test_loss: 1.1099, test_f1: 0.5919
 epoch: 16, train_loss: 0.5888, test_loss: 1.4296, test_f1: 0.4750
 epoch: 17, train_loss: 0.5574, test_loss: 1.1123, test_f1: 0.6223
 epoch: 18, train_loss: 0.5412, test_loss: 1.0324, test_f1: 0.6302
 epoch: 19, train_loss: 0.5271, test_loss: 1.0809, test_f1: 0.5978
 epoch: 20, train_loss: 0.5072, test_loss: 1.1812, test_f1: 0.5905
 epoch: 21, train_loss: 0.5200, test_loss: 1.1751, test_f1: 0.6040
 epoch: 22, train_loss: 0.4998, test_loss: 1.1883, test_f1: 0.6170
 epoch: 23, train_loss: 0.4990, test_loss: 1.3126, test_f1: 0.5749
 epoch: 24, train_loss: 0.4913, test_loss: 1.1029, test_f1: 0.6310
 epoch: 25, train_loss: 0.4637, test_loss: 1.2794, test_f1: 0.5595
 epoch: 26, train_loss: 0.4324, test_loss: 1.2816, test_f1: 0.5967
 epoch: 27, train_loss: 0.4363, test_loss: 1.3351, test_f1: 0.6207
 epoch: 28, train_loss: 0.4411, test_loss: 1.2678, test_f1: 0.6389
 epoch: 29, train_loss: 0.4451, test_loss: 1.2502, test_f1: 0.6100
 epoch: 30, train_loss: 0.4179, test_loss: 1.0998, test_f1: 0.6624
 epoch: 31, train_loss: 0.3814, test_loss: 1.3025, test_f1: 0.6109
 epoch: 32, train_loss: 0.3853, test_loss: 1.3294, test_f1: 0.6310
 epoch: 33, train_loss: 0.3647, test_loss: 1.4722, test_f1: 0.6348
 epoch: 34, train_loss: 0.3723, test_loss: 1.4702, test_f1: 0.5839
 epoch: 35, train_loss: 0.3547, test_loss: 1.4080, test_f1: 0.6300
 epoch: 36, train_loss: 0.3657, test_loss: 1.4178, test_f1: 0.6168
 epoch: 37, train_loss: 0.3532, test_loss: 1.4567, test_f1: 0.6111
 epoch: 38, train_loss: 0.3223, test_loss: 1.3540, test_f1: 0.6112
 epoch: 39, train_loss: 0.3199, test_loss: 1.4791, test_f1: 0.6149
 epoch: 40, train_loss: 0.3331, test_loss: 1.3382, test_f1: 0.6481
 epoch: 41, train_loss: 0.3437, test_loss: 1.7482, test_f1: 0.5964
 epoch: 42, train_loss: 0.3273, test_loss: 1.3702, test_f1: 0.6288
 epoch: 43, train_loss: 0.2991, test_loss: 1.6422, test_f1: 0.6253
 epoch: 44, train_loss: 0.3067, test_loss: 1.6279, test_f1: 0.5968
 epoch: 45, train_loss: 0.3164, test_loss: 1.5960, test_f1: 0.6373
 epoch: 46, train_loss: 0.3179, test_loss: 1.7767, test_f1: 0.5958
 epoch: 47, train_loss: 0.3005, test_loss: 1.5128, test_f1: 0.6687
 epoch: 48, train_loss: 0.2735, test_loss: 1.7604, test_f1: 0.6499
 epoch: 49, train_loss: 0.3206, test_loss: 1.6468, test_f1: 0.6077
 epoch: 50, train_loss: 0.2767, test_loss: 1.7844, test_f1: 0.6187
 epoch: 51, train_loss: 0.2317, test_loss: 1.8792, test_f1: 0.6109
 epoch: 52, train_loss: 0.2047, test_loss: 1.7448, test_f1: 0.6321
 epoch: 53, train_loss: 0.2008, test_loss: 1.8443, test_f1: 0.6161
 epoch: 54, train_loss: 0.1842, test_loss: 1.7838, test_f1: 0.6456
 epoch: 55, train_loss: 0.1718, test_loss: 1.8484, test_f1: 0.6475
 epoch: 56, train_loss: 0.1715, test_loss: 1.8702, test_f1: 0.6647
 epoch: 57, train_loss: 0.1859, test_loss: 2.0155, test_f1: 0.6454
 epoch: 58, train_loss: 0.1806, test_loss: 1.8502, test_f1: 0.6700
 epoch: 59, train_loss: 0.1863, test_loss: 2.0730, test_f1: 0.6316
 epoch: 60, train_loss: 0.1400, test_loss: 1.9777, test_f1: 0.6433
 epoch: 61, train_loss: 0.1674, test_loss: 1.9623, test_f1: 0.6505
 epoch: 62, train_loss: 0.1595, test_loss: 2.0921, test_f1: 0.6060
 epoch: 63, train_loss: 0.1653, test_loss: 2.0968, test_f1: 0.6035
 epoch: 64, train_loss: 0.1873, test_loss: 2.0320, test_f1: 0.6101
 epoch: 65, train_loss: 0.1437, test_loss: 2.0584, test_f1: 0.6378
 epoch: 66, train_loss: 0.1539, test_loss: 2.1344, test_f1: 0.6251
 epoch: 67, train_loss: 0.1628, test_loss: 2.0023, test_f1: 0.6490
 epoch: 68, train_loss: 0.1529, test_loss: 2.1416, test_f1: 0.6463
 epoch: 69, train_loss: 0.1760, test_loss: 2.1006, test_f1: 0.6493
 epoch: 70, train_loss: 0.1497, test_loss: 2.1754, test_f1: 0.6288
 epoch: 71, train_loss: 0.1526, test_loss: 2.1549, test_f1: 0.6025
 epoch: 72, train_loss: 0.1453, test_loss: 2.2213, test_f1: 0.6248
 epoch: 73, train_loss: 0.1276, test_loss: 2.0523, test_f1: 0.6532
 epoch: 74, train_loss: 0.1648, test_loss: 2.1779, test_f1: 0.6237
 epoch: 75, train_loss: 0.1600, test_loss: 2.3008, test_f1: 0.6512
 epoch: 76, train_loss: 0.1337, test_loss: 2.2211, test_f1: 0.6580
 epoch: 77, train_loss: 0.1431, test_loss: 2.3501, test_f1: 0.6419
 epoch: 78, train_loss: 0.1431, test_loss: 2.3549, test_f1: 0.6104
 epoch: 79, train_loss: 0.1386, test_loss: 2.3895, test_f1: 0.6217
 epoch: 80, train_loss: 0.1305, test_loss: 2.2624, test_f1: 0.6590
 epoch: 81, train_loss: 0.1355, test_loss: 2.2607, test_f1: 0.6401
 epoch: 82, train_loss: 0.1489, test_loss: 2.2249, test_f1: 0.6532
 epoch: 83, train_loss: 0.1373, test_loss: 2.1283, test_f1: 0.6919
 epoch: 84, train_loss: 0.1352, test_loss: 2.3706, test_f1: 0.6466
 epoch: 85, train_loss: 0.1098, test_loss: 2.2780, test_f1: 0.6601
 epoch: 86, train_loss: 0.1153, test_loss: 2.2378, test_f1: 0.6822
 epoch: 87, train_loss: 0.1404, test_loss: 2.5487, test_f1: 0.6347
 epoch: 88, train_loss: 0.1305, test_loss: 2.4647, test_f1: 0.6288
 epoch: 89, train_loss: 0.1188, test_loss: 2.5833, test_f1: 0.6489
 epoch: 90, train_loss: 0.1305, test_loss: 2.4135, test_f1: 0.6455
 epoch: 91, train_loss: 0.1271, test_loss: 2.3954, test_f1: 0.6357
 epoch: 92, train_loss: 0.1166, test_loss: 2.3742, test_f1: 0.6343
 epoch: 93, train_loss: 0.1179, test_loss: 2.3391, test_f1: 0.6623
 epoch: 94, train_loss: 0.1097, test_loss: 2.3567, test_f1: 0.6584
 epoch: 95, train_loss: 0.0947, test_loss: 2.4952, test_f1: 0.6251
 epoch: 96, train_loss: 0.1107, test_loss: 2.6143, test_f1: 0.6354
 epoch: 97, train_loss: 0.1118, test_loss: 2.4486, test_f1: 0.6425
 epoch: 98, train_loss: 0.0972, test_loss: 2.6459, test_f1: 0.6435
 epoch: 99, train_loss: 0.1172, test_loss: 2.6447, test_f1: 0.6102
##################ITERATION #5 ****************************************
 epoch: 0, train_loss: 1.2161, test_loss: 1.3209, test_f1: 0.2723
 epoch: 1, train_loss: 0.9823, test_loss: 1.1110, test_f1: 0.4854
 epoch: 2, train_loss: 0.9282, test_loss: 1.0268, test_f1: 0.5994
 epoch: 3, train_loss: 0.8964, test_loss: 1.0134, test_f1: 0.6321
 epoch: 4, train_loss: 0.8447, test_loss: 0.9931, test_f1: 0.6366
 epoch: 5, train_loss: 0.8129, test_loss: 1.0231, test_f1: 0.5635
 epoch: 6, train_loss: 0.7912, test_loss: 0.9745, test_f1: 0.6239
 epoch: 7, train_loss: 0.7919, test_loss: 0.9829, test_f1: 0.5795
 epoch: 8, train_loss: 0.7561, test_loss: 0.9732, test_f1: 0.6354
 epoch: 9, train_loss: 0.7250, test_loss: 1.0057, test_f1: 0.5977
 epoch: 10, train_loss: 0.7152, test_loss: 0.9743, test_f1: 0.6430
 epoch: 11, train_loss: 0.7046, test_loss: 0.9521, test_f1: 0.6138
 epoch: 12, train_loss: 0.6830, test_loss: 1.0321, test_f1: 0.5866
 epoch: 13, train_loss: 0.6810, test_loss: 1.0675, test_f1: 0.5951
 epoch: 14, train_loss: 0.6784, test_loss: 1.0324, test_f1: 0.5393
 epoch: 15, train_loss: 0.6685, test_loss: 1.0597, test_f1: 0.6339
 epoch: 16, train_loss: 0.6359, test_loss: 1.0746, test_f1: 0.5754
 epoch: 17, train_loss: 0.6300, test_loss: 1.1293, test_f1: 0.5942
 epoch: 18, train_loss: 0.6030, test_loss: 0.9659, test_f1: 0.6303
 epoch: 19, train_loss: 0.6017, test_loss: 1.0750, test_f1: 0.6245
 epoch: 20, train_loss: 0.5901, test_loss: 1.1028, test_f1: 0.5891
 epoch: 21, train_loss: 0.5839, test_loss: 1.0224, test_f1: 0.5833
 epoch: 22, train_loss: 0.5526, test_loss: 1.2568, test_f1: 0.5686
 epoch: 23, train_loss: 0.5296, test_loss: 1.3860, test_f1: 0.5854
 epoch: 24, train_loss: 0.5195, test_loss: 1.5288, test_f1: 0.5309
 epoch: 25, train_loss: 0.5526, test_loss: 1.2613, test_f1: 0.5907
 epoch: 26, train_loss: 0.5167, test_loss: 1.1145, test_f1: 0.5875
 epoch: 27, train_loss: 0.5147, test_loss: 1.0332, test_f1: 0.6515
 epoch: 28, train_loss: 0.5325, test_loss: 1.3197, test_f1: 0.5591
 epoch: 29, train_loss: 0.4880, test_loss: 1.1556, test_f1: 0.6292
 epoch: 30, train_loss: 0.4690, test_loss: 1.1971, test_f1: 0.6339
 epoch: 31, train_loss: 0.4366, test_loss: 1.1415, test_f1: 0.6358
 epoch: 32, train_loss: 0.4604, test_loss: 1.2342, test_f1: 0.5945
 epoch: 33, train_loss: 0.4474, test_loss: 1.3611, test_f1: 0.5854
 epoch: 34, train_loss: 0.4477, test_loss: 1.5366, test_f1: 0.5983
 epoch: 35, train_loss: 0.4265, test_loss: 1.3225, test_f1: 0.6194
 epoch: 36, train_loss: 0.4115, test_loss: 1.7304, test_f1: 0.6273
 epoch: 37, train_loss: 0.4351, test_loss: 1.2541, test_f1: 0.6252
 epoch: 38, train_loss: 0.3978, test_loss: 1.4846, test_f1: 0.5909
 epoch: 39, train_loss: 0.3908, test_loss: 1.3458, test_f1: 0.5951
 epoch: 40, train_loss: 0.3787, test_loss: 1.3183, test_f1: 0.6488
 epoch: 41, train_loss: 0.3823, test_loss: 1.7770, test_f1: 0.5906
 epoch: 42, train_loss: 0.3613, test_loss: 1.6015, test_f1: 0.6146
 epoch: 43, train_loss: 0.3620, test_loss: 1.6847, test_f1: 0.5687
 epoch: 44, train_loss: 0.3438, test_loss: 1.7439, test_f1: 0.6354
 epoch: 45, train_loss: 0.3531, test_loss: 1.6628, test_f1: 0.5640
 epoch: 46, train_loss: 0.3863, test_loss: 1.7111, test_f1: 0.5644
 epoch: 47, train_loss: 0.3891, test_loss: 1.5480, test_f1: 0.6134
 epoch: 48, train_loss: 0.3879, test_loss: 1.5003, test_f1: 0.5898
 epoch: 49, train_loss: 0.3393, test_loss: 1.5043, test_f1: 0.5955
 epoch: 50, train_loss: 0.3625, test_loss: 1.5367, test_f1: 0.5982
 epoch: 51, train_loss: 0.2988, test_loss: 1.7125, test_f1: 0.5839
 epoch: 52, train_loss: 0.2697, test_loss: 1.7318, test_f1: 0.6044
 epoch: 53, train_loss: 0.2343, test_loss: 1.6697, test_f1: 0.5959
 epoch: 54, train_loss: 0.2365, test_loss: 1.9334, test_f1: 0.6101
 epoch: 55, train_loss: 0.2112, test_loss: 1.9099, test_f1: 0.5922
 epoch: 56, train_loss: 0.2133, test_loss: 1.9033, test_f1: 0.5905
 epoch: 57, train_loss: 0.2346, test_loss: 1.8503, test_f1: 0.6061
 epoch: 58, train_loss: 0.2098, test_loss: 1.9172, test_f1: 0.5846
 epoch: 59, train_loss: 0.2033, test_loss: 1.9328, test_f1: 0.6199
 epoch: 60, train_loss: 0.2148, test_loss: 1.9522, test_f1: 0.6160
 epoch: 61, train_loss: 0.2101, test_loss: 2.1514, test_f1: 0.5904
 epoch: 62, train_loss: 0.2137, test_loss: 2.0285, test_f1: 0.5770
 epoch: 63, train_loss: 0.2207, test_loss: 2.0958, test_f1: 0.6089
 epoch: 64, train_loss: 0.2050, test_loss: 2.2856, test_f1: 0.5753
 epoch: 65, train_loss: 0.1876, test_loss: 2.0410, test_f1: 0.6234
 epoch: 66, train_loss: 0.2010, test_loss: 2.2680, test_f1: 0.5730
 epoch: 67, train_loss: 0.1853, test_loss: 2.1921, test_f1: 0.5726
 epoch: 68, train_loss: 0.1983, test_loss: 1.9321, test_f1: 0.6129
 epoch: 69, train_loss: 0.1937, test_loss: 2.3887, test_f1: 0.5739
 epoch: 70, train_loss: 0.1734, test_loss: 2.1710, test_f1: 0.6173
 epoch: 71, train_loss: 0.1959, test_loss: 2.2717, test_f1: 0.6133
 epoch: 72, train_loss: 0.2312, test_loss: 2.5626, test_f1: 0.5753
 epoch: 73, train_loss: 0.2203, test_loss: 2.3744, test_f1: 0.5845
 epoch: 74, train_loss: 0.1795, test_loss: 2.2647, test_f1: 0.6071
 epoch: 75, train_loss: 0.1749, test_loss: 2.2238, test_f1: 0.5938
 epoch: 76, train_loss: 0.1559, test_loss: 2.1663, test_f1: 0.6077
 epoch: 77, train_loss: 0.1867, test_loss: 2.3807, test_f1: 0.5956
 epoch: 78, train_loss: 0.1735, test_loss: 2.2539, test_f1: 0.5845
 epoch: 79, train_loss: 0.1851, test_loss: 2.2653, test_f1: 0.6082
 epoch: 80, train_loss: 0.2006, test_loss: 2.3910, test_f1: 0.6352
 epoch: 81, train_loss: 0.1717, test_loss: 2.2291, test_f1: 0.6184
 epoch: 82, train_loss: 0.1576, test_loss: 2.5572, test_f1: 0.5979
 epoch: 83, train_loss: 0.1473, test_loss: 2.3737, test_f1: 0.5895
 epoch: 84, train_loss: 0.1441, test_loss: 2.3129, test_f1: 0.6068
 epoch: 85, train_loss: 0.1471, test_loss: 2.4378, test_f1: 0.5905
 epoch: 86, train_loss: 0.1805, test_loss: 2.4286, test_f1: 0.6273
 epoch: 87, train_loss: 0.1571, test_loss: 2.3903, test_f1: 0.6152
 epoch: 88, train_loss: 0.1577, test_loss: 2.5909, test_f1: 0.5762
 epoch: 89, train_loss: 0.1562, test_loss: 2.5529, test_f1: 0.6103
 epoch: 90, train_loss: 0.1675, test_loss: 2.4735, test_f1: 0.6155
 epoch: 91, train_loss: 0.1475, test_loss: 2.4366, test_f1: 0.5952
 epoch: 92, train_loss: 0.1355, test_loss: 2.6012, test_f1: 0.6051
 epoch: 93, train_loss: 0.1399, test_loss: 2.5743, test_f1: 0.5745
 epoch: 94, train_loss: 0.1331, test_loss: 2.5181, test_f1: 0.6133
 epoch: 95, train_loss: 0.1412, test_loss: 2.4441, test_f1: 0.6204
 epoch: 96, train_loss: 0.1560, test_loss: 2.4971, test_f1: 0.6179
 epoch: 97, train_loss: 0.1508, test_loss: 2.2344, test_f1: 0.6185
 epoch: 98, train_loss: 0.1536, test_loss: 2.5949, test_f1: 0.6091
 epoch: 99, train_loss: 0.1586, test_loss: 2.4879, test_f1: 0.5761
##################ITERATION #6 ****************************************
 epoch: 0, train_loss: 1.3971, test_loss: 1.4434, test_f1: 0.1425
 epoch: 1, train_loss: 1.0489, test_loss: 1.2938, test_f1: 0.3607
 epoch: 2, train_loss: 0.9723, test_loss: 1.0561, test_f1: 0.5635
 epoch: 3, train_loss: 0.9342, test_loss: 1.0275, test_f1: 0.5633
 epoch: 4, train_loss: 0.9184, test_loss: 1.0882, test_f1: 0.5442
 epoch: 5, train_loss: 0.8811, test_loss: 1.0971, test_f1: 0.5792
 epoch: 6, train_loss: 0.8503, test_loss: 1.0178, test_f1: 0.5892
 epoch: 7, train_loss: 0.8623, test_loss: 1.0603, test_f1: 0.5429
 epoch: 8, train_loss: 0.8204, test_loss: 1.0457, test_f1: 0.6078
 epoch: 9, train_loss: 0.7813, test_loss: 0.9731, test_f1: 0.5922
 epoch: 10, train_loss: 0.7733, test_loss: 1.0098, test_f1: 0.6063
 epoch: 11, train_loss: 0.7464, test_loss: 0.9936, test_f1: 0.5816
 epoch: 12, train_loss: 0.7115, test_loss: 1.0260, test_f1: 0.5671
 epoch: 13, train_loss: 0.6995, test_loss: 1.0121, test_f1: 0.5875
 epoch: 14, train_loss: 0.7098, test_loss: 1.0732, test_f1: 0.5453
 epoch: 15, train_loss: 0.7124, test_loss: 1.0397, test_f1: 0.5597
 epoch: 16, train_loss: 0.6761, test_loss: 0.9950, test_f1: 0.6055
 epoch: 17, train_loss: 0.6527, test_loss: 0.9911, test_f1: 0.6317
 epoch: 18, train_loss: 0.6491, test_loss: 1.0879, test_f1: 0.5969
 epoch: 19, train_loss: 0.6409, test_loss: 1.1867, test_f1: 0.6144
 epoch: 20, train_loss: 0.6348, test_loss: 1.0844, test_f1: 0.5982
 epoch: 21, train_loss: 0.5954, test_loss: 1.1430, test_f1: 0.5725
 epoch: 22, train_loss: 0.5936, test_loss: 1.2327, test_f1: 0.6027
 epoch: 23, train_loss: 0.5822, test_loss: 1.1829, test_f1: 0.6095
 epoch: 24, train_loss: 0.5559, test_loss: 1.2943, test_f1: 0.5832
 epoch: 25, train_loss: 0.5526, test_loss: 1.1587, test_f1: 0.6065
 epoch: 26, train_loss: 0.5273, test_loss: 1.1536, test_f1: 0.6936
 epoch: 27, train_loss: 0.5367, test_loss: 1.3335, test_f1: 0.5971
 epoch: 28, train_loss: 0.5207, test_loss: 1.3062, test_f1: 0.5852
 epoch: 29, train_loss: 0.5180, test_loss: 1.1390, test_f1: 0.6253
 epoch: 30, train_loss: 0.5245, test_loss: 1.1933, test_f1: 0.6091
 epoch: 31, train_loss: 0.4798, test_loss: 1.1618, test_f1: 0.6367
 epoch: 32, train_loss: 0.4726, test_loss: 1.4727, test_f1: 0.5406
 epoch: 33, train_loss: 0.4513, test_loss: 1.2556, test_f1: 0.6274
 epoch: 34, train_loss: 0.4978, test_loss: 1.5557, test_f1: 0.6444
 epoch: 35, train_loss: 0.4523, test_loss: 1.2896, test_f1: 0.5937
 epoch: 36, train_loss: 0.4548, test_loss: 1.2656, test_f1: 0.6296
 epoch: 37, train_loss: 0.4857, test_loss: 1.3248, test_f1: 0.6097
 epoch: 38, train_loss: 0.4499, test_loss: 1.5874, test_f1: 0.5884
 epoch: 39, train_loss: 0.4019, test_loss: 1.2310, test_f1: 0.6587
 epoch: 40, train_loss: 0.4321, test_loss: 1.4314, test_f1: 0.6054
 epoch: 41, train_loss: 0.4248, test_loss: 1.3524, test_f1: 0.6229
 epoch: 42, train_loss: 0.4090, test_loss: 1.3587, test_f1: 0.6329
 epoch: 43, train_loss: 0.3822, test_loss: 1.2702, test_f1: 0.6499
 epoch: 44, train_loss: 0.3748, test_loss: 1.4709, test_f1: 0.6525
 epoch: 45, train_loss: 0.3883, test_loss: 1.3530, test_f1: 0.6612
 epoch: 46, train_loss: 0.3559, test_loss: 1.4373, test_f1: 0.6569
 epoch: 47, train_loss: 0.3636, test_loss: 1.5634, test_f1: 0.6251
 epoch: 48, train_loss: 0.3606, test_loss: 1.5700, test_f1: 0.6066
 epoch: 49, train_loss: 0.3307, test_loss: 1.5575, test_f1: 0.6120
 epoch: 50, train_loss: 0.3422, test_loss: 1.5350, test_f1: 0.6371
 epoch: 51, train_loss: 0.3024, test_loss: 1.5610, test_f1: 0.6367
 epoch: 52, train_loss: 0.2625, test_loss: 1.5372, test_f1: 0.6582
 epoch: 53, train_loss: 0.2589, test_loss: 1.6208, test_f1: 0.6344
 epoch: 54, train_loss: 0.2278, test_loss: 1.6860, test_f1: 0.6371
 epoch: 55, train_loss: 0.2455, test_loss: 1.7048, test_f1: 0.6377
 epoch: 56, train_loss: 0.2282, test_loss: 1.6716, test_f1: 0.6213
 epoch: 57, train_loss: 0.2110, test_loss: 1.6477, test_f1: 0.6542
 epoch: 58, train_loss: 0.2377, test_loss: 1.6672, test_f1: 0.6476
 epoch: 59, train_loss: 0.2294, test_loss: 1.6981, test_f1: 0.6322
 epoch: 60, train_loss: 0.2312, test_loss: 1.6859, test_f1: 0.6293
 epoch: 61, train_loss: 0.2069, test_loss: 1.7120, test_f1: 0.6850
 epoch: 62, train_loss: 0.2196, test_loss: 1.8109, test_f1: 0.6242
 epoch: 63, train_loss: 0.2333, test_loss: 1.8587, test_f1: 0.6386
 epoch: 64, train_loss: 0.2202, test_loss: 1.8702, test_f1: 0.6356
 epoch: 65, train_loss: 0.2077, test_loss: 1.8779, test_f1: 0.6400
 epoch: 66, train_loss: 0.2157, test_loss: 1.9134, test_f1: 0.6370
 epoch: 67, train_loss: 0.2149, test_loss: 1.7896, test_f1: 0.6610
 epoch: 68, train_loss: 0.2013, test_loss: 1.8378, test_f1: 0.6288
 epoch: 69, train_loss: 0.2116, test_loss: 1.8764, test_f1: 0.6624
 epoch: 70, train_loss: 0.1925, test_loss: 1.9677, test_f1: 0.6215
 epoch: 71, train_loss: 0.1529, test_loss: 1.8506, test_f1: 0.6650
 epoch: 72, train_loss: 0.1578, test_loss: 1.9648, test_f1: 0.6649
 epoch: 73, train_loss: 0.1678, test_loss: 1.8907, test_f1: 0.6510
 epoch: 74, train_loss: 0.2104, test_loss: 1.9326, test_f1: 0.6277
 epoch: 75, train_loss: 0.1924, test_loss: 1.9606, test_f1: 0.6403
 epoch: 76, train_loss: 0.1580, test_loss: 1.8891, test_f1: 0.6441
 epoch: 77, train_loss: 0.1568, test_loss: 1.9503, test_f1: 0.6296
 epoch: 78, train_loss: 0.1420, test_loss: 2.0386, test_f1: 0.6350
 epoch: 79, train_loss: 0.2070, test_loss: 2.1625, test_f1: 0.6133
 epoch: 80, train_loss: 0.1857, test_loss: 1.7942, test_f1: 0.6669
 epoch: 81, train_loss: 0.1656, test_loss: 2.2510, test_f1: 0.6005
 epoch: 82, train_loss: 0.1692, test_loss: 2.2592, test_f1: 0.6267
 epoch: 83, train_loss: 0.1623, test_loss: 2.1303, test_f1: 0.6532
 epoch: 84, train_loss: 0.1587, test_loss: 1.8979, test_f1: 0.6877
 epoch: 85, train_loss: 0.1701, test_loss: 2.2417, test_f1: 0.5948
 epoch: 86, train_loss: 0.1599, test_loss: 2.5066, test_f1: 0.5892
 epoch: 87, train_loss: 0.1671, test_loss: 2.0698, test_f1: 0.6817
 epoch: 88, train_loss: 0.1499, test_loss: 2.2282, test_f1: 0.6220
 epoch: 89, train_loss: 0.1388, test_loss: 1.9833, test_f1: 0.6724
 epoch: 90, train_loss: 0.1645, test_loss: 2.2814, test_f1: 0.6352
 epoch: 91, train_loss: 0.1695, test_loss: 2.1082, test_f1: 0.6060
 epoch: 92, train_loss: 0.1705, test_loss: 2.2791, test_f1: 0.6483
 epoch: 93, train_loss: 0.1723, test_loss: 2.2918, test_f1: 0.6297
 epoch: 94, train_loss: 0.1784, test_loss: 2.1963, test_f1: 0.6344
 epoch: 95, train_loss: 0.1479, test_loss: 2.2572, test_f1: 0.6266
 epoch: 96, train_loss: 0.1469, test_loss: 2.5368, test_f1: 0.6027
 epoch: 97, train_loss: 0.1291, test_loss: 2.3943, test_f1: 0.6110
 epoch: 98, train_loss: 0.1563, test_loss: 2.3344, test_f1: 0.6182
 epoch: 99, train_loss: 0.1197, test_loss: 2.5002, test_f1: 0.5879
##################ITERATION #7 ****************************************
 epoch: 0, train_loss: 1.3564, test_loss: 1.3743, test_f1: 0.2225
 epoch: 1, train_loss: 1.0487, test_loss: 1.1634, test_f1: 0.5059
 epoch: 2, train_loss: 0.9539, test_loss: 1.1551, test_f1: 0.5178
 epoch: 3, train_loss: 0.8856, test_loss: 1.0770, test_f1: 0.5970
 epoch: 4, train_loss: 0.8485, test_loss: 1.0587, test_f1: 0.5991
 epoch: 5, train_loss: 0.8256, test_loss: 1.0649, test_f1: 0.5551
 epoch: 6, train_loss: 0.8015, test_loss: 1.1133, test_f1: 0.5725
 epoch: 7, train_loss: 0.7592, test_loss: 1.2336, test_f1: 0.4860
 epoch: 8, train_loss: 0.7777, test_loss: 1.1408, test_f1: 0.5602
 epoch: 9, train_loss: 0.7340, test_loss: 1.1161, test_f1: 0.5875
 epoch: 10, train_loss: 0.7154, test_loss: 1.2833, test_f1: 0.5303
 epoch: 11, train_loss: 0.7108, test_loss: 1.0644, test_f1: 0.5820
 epoch: 12, train_loss: 0.6818, test_loss: 1.2569, test_f1: 0.5488
 epoch: 13, train_loss: 0.6501, test_loss: 1.2756, test_f1: 0.5604
 epoch: 14, train_loss: 0.6628, test_loss: 1.3427, test_f1: 0.4695
 epoch: 15, train_loss: 0.6312, test_loss: 1.1823, test_f1: 0.5484
 epoch: 16, train_loss: 0.6361, test_loss: 1.2891, test_f1: 0.5542
 epoch: 17, train_loss: 0.6074, test_loss: 1.5581, test_f1: 0.5463
 epoch: 18, train_loss: 0.5963, test_loss: 1.2719, test_f1: 0.5566
 epoch: 19, train_loss: 0.5939, test_loss: 1.4917, test_f1: 0.5807
 epoch: 20, train_loss: 0.5664, test_loss: 1.5010, test_f1: 0.5548
 epoch: 21, train_loss: 0.5769, test_loss: 1.4839, test_f1: 0.5851
 epoch: 22, train_loss: 0.5436, test_loss: 1.6324, test_f1: 0.5576
 epoch: 23, train_loss: 0.5355, test_loss: 1.2748, test_f1: 0.5958
 epoch: 24, train_loss: 0.5396, test_loss: 1.5058, test_f1: 0.5370
 epoch: 25, train_loss: 0.5150, test_loss: 1.3614, test_f1: 0.5835
 epoch: 26, train_loss: 0.4886, test_loss: 1.3279, test_f1: 0.5894
 epoch: 27, train_loss: 0.5131, test_loss: 1.4367, test_f1: 0.6348
 epoch: 28, train_loss: 0.4686, test_loss: 1.4695, test_f1: 0.5535
 epoch: 29, train_loss: 0.4600, test_loss: 1.7630, test_f1: 0.5285
 epoch: 30, train_loss: 0.4507, test_loss: 1.6299, test_f1: 0.5953
 epoch: 31, train_loss: 0.4417, test_loss: 1.3302, test_f1: 0.5534
 epoch: 32, train_loss: 0.4202, test_loss: 1.6252, test_f1: 0.5700
 epoch: 33, train_loss: 0.4257, test_loss: 1.7068, test_f1: 0.5541
 epoch: 34, train_loss: 0.3967, test_loss: 1.7972, test_f1: 0.5826
 epoch: 35, train_loss: 0.4043, test_loss: 1.6899, test_f1: 0.5809
 epoch: 36, train_loss: 0.4004, test_loss: 1.8445, test_f1: 0.5836
 epoch: 37, train_loss: 0.3959, test_loss: 1.8629, test_f1: 0.5702
 epoch: 38, train_loss: 0.3927, test_loss: 1.8556, test_f1: 0.5447
 epoch: 39, train_loss: 0.3910, test_loss: 1.7011, test_f1: 0.6210
 epoch: 40, train_loss: 0.3621, test_loss: 1.7312, test_f1: 0.5571
 epoch: 41, train_loss: 0.3743, test_loss: 1.7274, test_f1: 0.5391
 epoch: 42, train_loss: 0.3371, test_loss: 1.8995, test_f1: 0.5923
 epoch: 43, train_loss: 0.3788, test_loss: 2.1308, test_f1: 0.5342
 epoch: 44, train_loss: 0.3521, test_loss: 1.8964, test_f1: 0.5623
 epoch: 45, train_loss: 0.3563, test_loss: 1.6998, test_f1: 0.5918
 epoch: 46, train_loss: 0.3555, test_loss: 2.3043, test_f1: 0.5463
 epoch: 47, train_loss: 0.4013, test_loss: 1.6851, test_f1: 0.5847
 epoch: 48, train_loss: 0.3105, test_loss: 1.7869, test_f1: 0.6004
 epoch: 49, train_loss: 0.3081, test_loss: 2.1180, test_f1: 0.5693
 epoch: 50, train_loss: 0.2872, test_loss: 1.8289, test_f1: 0.5820
 epoch: 51, train_loss: 0.2739, test_loss: 2.0890, test_f1: 0.5862
 epoch: 52, train_loss: 0.2393, test_loss: 2.0436, test_f1: 0.5849
 epoch: 53, train_loss: 0.2028, test_loss: 2.0562, test_f1: 0.6058
 epoch: 54, train_loss: 0.2219, test_loss: 2.2463, test_f1: 0.5808
 epoch: 55, train_loss: 0.2345, test_loss: 1.9960, test_f1: 0.6032
 epoch: 56, train_loss: 0.2237, test_loss: 2.1724, test_f1: 0.5831
 epoch: 57, train_loss: 0.2153, test_loss: 2.1751, test_f1: 0.6083
 epoch: 58, train_loss: 0.2178, test_loss: 2.1527, test_f1: 0.6311
 epoch: 59, train_loss: 0.1871, test_loss: 2.2185, test_f1: 0.5987
 epoch: 60, train_loss: 0.1849, test_loss: 2.2369, test_f1: 0.6027
 epoch: 61, train_loss: 0.2073, test_loss: 2.3002, test_f1: 0.5979
 epoch: 62, train_loss: 0.1934, test_loss: 2.4517, test_f1: 0.5879
 epoch: 63, train_loss: 0.1818, test_loss: 2.3778, test_f1: 0.5935
 epoch: 64, train_loss: 0.2102, test_loss: 2.6036, test_f1: 0.5873
 epoch: 65, train_loss: 0.1967, test_loss: 2.5251, test_f1: 0.5630
 epoch: 66, train_loss: 0.2013, test_loss: 2.7470, test_f1: 0.6042
 epoch: 67, train_loss: 0.1925, test_loss: 2.4769, test_f1: 0.5988
 epoch: 68, train_loss: 0.1748, test_loss: 2.4864, test_f1: 0.6102
 epoch: 69, train_loss: 0.1473, test_loss: 2.5537, test_f1: 0.6061
 epoch: 70, train_loss: 0.1670, test_loss: 2.7737, test_f1: 0.6092
 epoch: 71, train_loss: 0.1474, test_loss: 2.6306, test_f1: 0.5968
 epoch: 72, train_loss: 0.1711, test_loss: 2.7353, test_f1: 0.5730
 epoch: 73, train_loss: 0.1489, test_loss: 2.9299, test_f1: 0.5846
 epoch: 74, train_loss: 0.1392, test_loss: 3.1382, test_f1: 0.5989
 epoch: 75, train_loss: 0.1381, test_loss: 3.0280, test_f1: 0.6154
 epoch: 76, train_loss: 0.1351, test_loss: 2.8094, test_f1: 0.5881
 epoch: 77, train_loss: 0.1507, test_loss: 2.6573, test_f1: 0.5779
 epoch: 78, train_loss: 0.2064, test_loss: 2.9509, test_f1: 0.5789
 epoch: 79, train_loss: 0.1741, test_loss: 2.7715, test_f1: 0.5693
 epoch: 80, train_loss: 0.1528, test_loss: 2.7371, test_f1: 0.6123
 epoch: 81, train_loss: 0.1389, test_loss: 3.0297, test_f1: 0.5882
 epoch: 82, train_loss: 0.1461, test_loss: 2.9502, test_f1: 0.5879
 epoch: 83, train_loss: 0.1331, test_loss: 3.1292, test_f1: 0.5881
 epoch: 84, train_loss: 0.1262, test_loss: 2.9306, test_f1: 0.6029
 epoch: 85, train_loss: 0.1813, test_loss: 2.7374, test_f1: 0.5893
 epoch: 86, train_loss: 0.1554, test_loss: 3.3052, test_f1: 0.5724
 epoch: 87, train_loss: 0.1855, test_loss: 3.1236, test_f1: 0.5989
 epoch: 88, train_loss: 0.1510, test_loss: 3.0627, test_f1: 0.5957
 epoch: 89, train_loss: 0.1424, test_loss: 3.0768, test_f1: 0.5924
 epoch: 90, train_loss: 0.1138, test_loss: 2.9571, test_f1: 0.5796
 epoch: 91, train_loss: 0.1115, test_loss: 3.0384, test_f1: 0.5907
 epoch: 92, train_loss: 0.1203, test_loss: 3.1049, test_f1: 0.5995
 epoch: 93, train_loss: 0.1203, test_loss: 2.9169, test_f1: 0.5890
 epoch: 94, train_loss: 0.1304, test_loss: 2.9958, test_f1: 0.5885
 epoch: 95, train_loss: 0.1473, test_loss: 2.8602, test_f1: 0.5807
 epoch: 96, train_loss: 0.1587, test_loss: 3.1963, test_f1: 0.5785
 epoch: 97, train_loss: 0.1276, test_loss: 3.0763, test_f1: 0.5812
 epoch: 98, train_loss: 0.1284, test_loss: 2.9786, test_f1: 0.5893
 epoch: 99, train_loss: 0.1394, test_loss: 3.1205, test_f1: 0.6106
##################ITERATION #8 ****************************************
 epoch: 0, train_loss: 1.3331, test_loss: 1.3354, test_f1: 0.2882
 epoch: 1, train_loss: 1.0488, test_loss: 1.1399, test_f1: 0.4548
 epoch: 2, train_loss: 0.9986, test_loss: 1.0327, test_f1: 0.5507
 epoch: 3, train_loss: 0.9175, test_loss: 1.0552, test_f1: 0.5511
 epoch: 4, train_loss: 0.8772, test_loss: 1.0644, test_f1: 0.5588
 epoch: 5, train_loss: 0.8344, test_loss: 1.1006, test_f1: 0.5496
 epoch: 6, train_loss: 0.8081, test_loss: 1.0267, test_f1: 0.5238
 epoch: 7, train_loss: 0.7951, test_loss: 1.0286, test_f1: 0.5692
 epoch: 8, train_loss: 0.7520, test_loss: 1.0126, test_f1: 0.5867
 epoch: 9, train_loss: 0.7585, test_loss: 1.0404, test_f1: 0.6054
 epoch: 10, train_loss: 0.7477, test_loss: 1.0612, test_f1: 0.5217
 epoch: 11, train_loss: 0.7014, test_loss: 1.0190, test_f1: 0.5888
 epoch: 12, train_loss: 0.6798, test_loss: 1.2555, test_f1: 0.5593
 epoch: 13, train_loss: 0.6596, test_loss: 1.1423, test_f1: 0.5714
 epoch: 14, train_loss: 0.6573, test_loss: 1.1828, test_f1: 0.5575
 epoch: 15, train_loss: 0.6340, test_loss: 1.0082, test_f1: 0.6096
 epoch: 16, train_loss: 0.6309, test_loss: 1.1729, test_f1: 0.5751
 epoch: 17, train_loss: 0.6291, test_loss: 1.1218, test_f1: 0.6078
 epoch: 18, train_loss: 0.6105, test_loss: 1.0407, test_f1: 0.6338
 epoch: 19, train_loss: 0.5983, test_loss: 1.1959, test_f1: 0.5700
 epoch: 20, train_loss: 0.5710, test_loss: 1.1161, test_f1: 0.6380
 epoch: 21, train_loss: 0.5438, test_loss: 1.1126, test_f1: 0.6061
 epoch: 22, train_loss: 0.5853, test_loss: 1.1215, test_f1: 0.6296
 epoch: 23, train_loss: 0.5520, test_loss: 1.2852, test_f1: 0.6638
 epoch: 24, train_loss: 0.5504, test_loss: 1.1377, test_f1: 0.5888
 epoch: 25, train_loss: 0.5100, test_loss: 1.2479, test_f1: 0.5549
 epoch: 26, train_loss: 0.5292, test_loss: 1.3168, test_f1: 0.5947
 epoch: 27, train_loss: 0.5032, test_loss: 1.1962, test_f1: 0.6605
 epoch: 28, train_loss: 0.5047, test_loss: 1.0949, test_f1: 0.6453
 epoch: 29, train_loss: 0.4994, test_loss: 1.1986, test_f1: 0.6110
 epoch: 30, train_loss: 0.4927, test_loss: 1.2614, test_f1: 0.5789
 epoch: 31, train_loss: 0.4781, test_loss: 1.1724, test_f1: 0.6361
 epoch: 32, train_loss: 0.4502, test_loss: 1.2473, test_f1: 0.6362
 epoch: 33, train_loss: 0.4431, test_loss: 1.0468, test_f1: 0.6612
 epoch: 34, train_loss: 0.4452, test_loss: 1.6602, test_f1: 0.6220
 epoch: 35, train_loss: 0.3913, test_loss: 1.1924, test_f1: 0.6245
 epoch: 36, train_loss: 0.4265, test_loss: 1.4306, test_f1: 0.6125
 epoch: 37, train_loss: 0.4502, test_loss: 1.2799, test_f1: 0.6488
 epoch: 38, train_loss: 0.4303, test_loss: 1.2800, test_f1: 0.5962
 epoch: 39, train_loss: 0.3681, test_loss: 1.3552, test_f1: 0.6243
 epoch: 40, train_loss: 0.3664, test_loss: 1.1550, test_f1: 0.6509
 epoch: 41, train_loss: 0.3770, test_loss: 1.5317, test_f1: 0.5620
 epoch: 42, train_loss: 0.3948, test_loss: 1.2563, test_f1: 0.6674
 epoch: 43, train_loss: 0.3130, test_loss: 1.3731, test_f1: 0.6279
 epoch: 44, train_loss: 0.3328, test_loss: 1.3891, test_f1: 0.6361
 epoch: 45, train_loss: 0.3324, test_loss: 1.6444, test_f1: 0.5704
 epoch: 46, train_loss: 0.3234, test_loss: 1.4960, test_f1: 0.6245
 epoch: 47, train_loss: 0.3228, test_loss: 1.5063, test_f1: 0.6080
 epoch: 48, train_loss: 0.3041, test_loss: 1.7378, test_f1: 0.6282
 epoch: 49, train_loss: 0.3023, test_loss: 1.6829, test_f1: 0.5919
 epoch: 50, train_loss: 0.3159, test_loss: 1.5287, test_f1: 0.6496
 epoch: 51, train_loss: 0.2983, test_loss: 1.4573, test_f1: 0.6445
 epoch: 52, train_loss: 0.2365, test_loss: 1.5087, test_f1: 0.6156
 epoch: 53, train_loss: 0.2211, test_loss: 1.8073, test_f1: 0.6076
 epoch: 54, train_loss: 0.2245, test_loss: 1.6111, test_f1: 0.6265
 epoch: 55, train_loss: 0.2105, test_loss: 1.7023, test_f1: 0.6589
 epoch: 56, train_loss: 0.2351, test_loss: 1.6128, test_f1: 0.6209
 epoch: 57, train_loss: 0.2171, test_loss: 1.9340, test_f1: 0.6355
 epoch: 58, train_loss: 0.1877, test_loss: 1.7869, test_f1: 0.6320
 epoch: 59, train_loss: 0.1896, test_loss: 1.7702, test_f1: 0.6420
 epoch: 60, train_loss: 0.1885, test_loss: 1.9103, test_f1: 0.6559
 epoch: 61, train_loss: 0.2009, test_loss: 1.8219, test_f1: 0.6202
 epoch: 62, train_loss: 0.1767, test_loss: 1.9764, test_f1: 0.6251
 epoch: 63, train_loss: 0.1822, test_loss: 1.7298, test_f1: 0.6387
 epoch: 64, train_loss: 0.1852, test_loss: 2.0131, test_f1: 0.6443
 epoch: 65, train_loss: 0.2111, test_loss: 1.8617, test_f1: 0.6268
 epoch: 66, train_loss: 0.1773, test_loss: 1.9988, test_f1: 0.6172
 epoch: 67, train_loss: 0.1686, test_loss: 1.9698, test_f1: 0.6226
 epoch: 68, train_loss: 0.1682, test_loss: 1.9436, test_f1: 0.6216
 epoch: 69, train_loss: 0.1620, test_loss: 1.8868, test_f1: 0.6146
 epoch: 70, train_loss: 0.1652, test_loss: 1.8991, test_f1: 0.6620
 epoch: 71, train_loss: 0.1572, test_loss: 2.1830, test_f1: 0.6294
 epoch: 72, train_loss: 0.1481, test_loss: 1.8838, test_f1: 0.6387
 epoch: 73, train_loss: 0.1450, test_loss: 2.0229, test_f1: 0.6059
 epoch: 74, train_loss: 0.1195, test_loss: 2.2559, test_f1: 0.6206
 epoch: 75, train_loss: 0.1434, test_loss: 1.8295, test_f1: 0.6426
 epoch: 76, train_loss: 0.1512, test_loss: 2.2863, test_f1: 0.6088
 epoch: 77, train_loss: 0.1397, test_loss: 2.1753, test_f1: 0.6240
 epoch: 78, train_loss: 0.1359, test_loss: 2.3352, test_f1: 0.6072
 epoch: 79, train_loss: 0.1581, test_loss: 2.0204, test_f1: 0.6352
 epoch: 80, train_loss: 0.1114, test_loss: 2.0348, test_f1: 0.6382
 epoch: 81, train_loss: 0.1628, test_loss: 2.2567, test_f1: 0.6166
 epoch: 82, train_loss: 0.1753, test_loss: 2.2208, test_f1: 0.6284
 epoch: 83, train_loss: 0.1311, test_loss: 2.2115, test_f1: 0.6304
 epoch: 84, train_loss: 0.1497, test_loss: 2.1170, test_f1: 0.6125
 epoch: 85, train_loss: 0.1469, test_loss: 2.1036, test_f1: 0.6459
 epoch: 86, train_loss: 0.1383, test_loss: 2.3338, test_f1: 0.6247
 epoch: 87, train_loss: 0.1132, test_loss: 2.1022, test_f1: 0.6261
 epoch: 88, train_loss: 0.1368, test_loss: 2.1691, test_f1: 0.6229
 epoch: 89, train_loss: 0.1316, test_loss: 2.2333, test_f1: 0.6249
 epoch: 90, train_loss: 0.1720, test_loss: 2.2516, test_f1: 0.6032
 epoch: 91, train_loss: 0.1532, test_loss: 2.3947, test_f1: 0.6671
 epoch: 92, train_loss: 0.1221, test_loss: 2.1602, test_f1: 0.6396
 epoch: 93, train_loss: 0.1323, test_loss: 2.2718, test_f1: 0.6243
 epoch: 94, train_loss: 0.1342, test_loss: 2.2622, test_f1: 0.6242
 epoch: 95, train_loss: 0.1417, test_loss: 2.1347, test_f1: 0.6290
 epoch: 96, train_loss: 0.1418, test_loss: 2.4078, test_f1: 0.6216
 epoch: 97, train_loss: 0.1248, test_loss: 2.6685, test_f1: 0.6314
 epoch: 98, train_loss: 0.1168, test_loss: 2.3618, test_f1: 0.6242
 epoch: 99, train_loss: 0.1345, test_loss: 2.2616, test_f1: 0.6039
##################ITERATION #9 ****************************************
 epoch: 0, train_loss: 1.3990, test_loss: 1.4336, test_f1: 0.2630
 epoch: 1, train_loss: 1.1304, test_loss: 1.2077, test_f1: 0.4198
 epoch: 2, train_loss: 1.0289, test_loss: 1.2114, test_f1: 0.5671
 epoch: 3, train_loss: 0.9499, test_loss: 1.0281, test_f1: 0.5795
 epoch: 4, train_loss: 0.8989, test_loss: 1.0776, test_f1: 0.5562
 epoch: 5, train_loss: 0.8432, test_loss: 1.0379, test_f1: 0.6035
 epoch: 6, train_loss: 0.7949, test_loss: 1.1471, test_f1: 0.5397
 epoch: 7, train_loss: 0.8002, test_loss: 1.1652, test_f1: 0.5865
 epoch: 8, train_loss: 0.7565, test_loss: 1.0774, test_f1: 0.5914
 epoch: 9, train_loss: 0.7235, test_loss: 1.1708, test_f1: 0.6232
 epoch: 10, train_loss: 0.7043, test_loss: 1.2734, test_f1: 0.5983
 epoch: 11, train_loss: 0.6690, test_loss: 1.1492, test_f1: 0.6104
 epoch: 12, train_loss: 0.6558, test_loss: 1.1695, test_f1: 0.6252
 epoch: 13, train_loss: 0.6821, test_loss: 1.0733, test_f1: 0.6710
 epoch: 14, train_loss: 0.6741, test_loss: 1.0854, test_f1: 0.6520
 epoch: 15, train_loss: 0.6414, test_loss: 1.1266, test_f1: 0.6319
 epoch: 16, train_loss: 0.6295, test_loss: 1.1735, test_f1: 0.5930
 epoch: 17, train_loss: 0.6146, test_loss: 1.3758, test_f1: 0.6132
 epoch: 18, train_loss: 0.5652, test_loss: 1.1772, test_f1: 0.6458
 epoch: 19, train_loss: 0.5763, test_loss: 1.2844, test_f1: 0.6758
 epoch: 20, train_loss: 0.5735, test_loss: 1.2099, test_f1: 0.6158
 epoch: 21, train_loss: 0.5362, test_loss: 1.3378, test_f1: 0.6312
 epoch: 22, train_loss: 0.5236, test_loss: 1.4968, test_f1: 0.6096
 epoch: 23, train_loss: 0.5367, test_loss: 1.2840, test_f1: 0.6473
 epoch: 24, train_loss: 0.4890, test_loss: 1.4267, test_f1: 0.6008
 epoch: 25, train_loss: 0.5173, test_loss: 1.3137, test_f1: 0.6202
 epoch: 26, train_loss: 0.5072, test_loss: 1.5260, test_f1: 0.5530
 epoch: 27, train_loss: 0.4613, test_loss: 1.5485, test_f1: 0.6137
 epoch: 28, train_loss: 0.4901, test_loss: 1.4284, test_f1: 0.6476
 epoch: 29, train_loss: 0.4628, test_loss: 1.4631, test_f1: 0.5905
 epoch: 30, train_loss: 0.4406, test_loss: 1.4431, test_f1: 0.6198
 epoch: 31, train_loss: 0.4161, test_loss: 1.3311, test_f1: 0.6564
 epoch: 32, train_loss: 0.4438, test_loss: 1.4239, test_f1: 0.6260
 epoch: 33, train_loss: 0.4156, test_loss: 1.4136, test_f1: 0.6392
 epoch: 34, train_loss: 0.4214, test_loss: 1.4784, test_f1: 0.6131
 epoch: 35, train_loss: 0.4357, test_loss: 1.7789, test_f1: 0.5842
 epoch: 36, train_loss: 0.4327, test_loss: 1.4544, test_f1: 0.6244
 epoch: 37, train_loss: 0.4276, test_loss: 1.5194, test_f1: 0.6190
 epoch: 38, train_loss: 0.3945, test_loss: 1.5222, test_f1: 0.6216
 epoch: 39, train_loss: 0.4086, test_loss: 1.4227, test_f1: 0.6376
 epoch: 40, train_loss: 0.3505, test_loss: 1.6178, test_f1: 0.6406
 epoch: 41, train_loss: 0.3396, test_loss: 1.6838, test_f1: 0.6211
 epoch: 42, train_loss: 0.3553, test_loss: 1.7954, test_f1: 0.6453
 epoch: 43, train_loss: 0.3618, test_loss: 1.8968, test_f1: 0.6058
 epoch: 44, train_loss: 0.3331, test_loss: 1.6362, test_f1: 0.6261
 epoch: 45, train_loss: 0.3143, test_loss: 2.0739, test_f1: 0.6121
 epoch: 46, train_loss: 0.3407, test_loss: 1.6399, test_f1: 0.6302
 epoch: 47, train_loss: 0.3117, test_loss: 1.7327, test_f1: 0.6535
 epoch: 48, train_loss: 0.3194, test_loss: 1.9746, test_f1: 0.6024
 epoch: 49, train_loss: 0.3111, test_loss: 1.9295, test_f1: 0.6378
 epoch: 50, train_loss: 0.3253, test_loss: 1.6864, test_f1: 0.6529
 epoch: 51, train_loss: 0.2734, test_loss: 1.6910, test_f1: 0.6661
 epoch: 52, train_loss: 0.2420, test_loss: 1.9361, test_f1: 0.6239
 epoch: 53, train_loss: 0.2293, test_loss: 1.9006, test_f1: 0.6452
 epoch: 54, train_loss: 0.2055, test_loss: 2.0146, test_f1: 0.6140
 epoch: 55, train_loss: 0.2035, test_loss: 2.0339, test_f1: 0.6227
 epoch: 56, train_loss: 0.2348, test_loss: 2.1264, test_f1: 0.6484
 epoch: 57, train_loss: 0.2130, test_loss: 1.9018, test_f1: 0.6570
 epoch: 58, train_loss: 0.2071, test_loss: 2.1293, test_f1: 0.5992
 epoch: 59, train_loss: 0.2194, test_loss: 2.0785, test_f1: 0.6382
 epoch: 60, train_loss: 0.2072, test_loss: 2.2148, test_f1: 0.6222
 epoch: 61, train_loss: 0.1892, test_loss: 2.0931, test_f1: 0.6387
 epoch: 62, train_loss: 0.2104, test_loss: 2.0116, test_f1: 0.6608
 epoch: 63, train_loss: 0.1849, test_loss: 2.0884, test_f1: 0.6462
 epoch: 64, train_loss: 0.1622, test_loss: 2.2121, test_f1: 0.6243
 epoch: 65, train_loss: 0.1835, test_loss: 2.3730, test_f1: 0.6204
 epoch: 66, train_loss: 0.1842, test_loss: 2.5337, test_f1: 0.6150
 epoch: 67, train_loss: 0.1675, test_loss: 2.2394, test_f1: 0.6473
 epoch: 68, train_loss: 0.1744, test_loss: 2.3937, test_f1: 0.6265
 epoch: 69, train_loss: 0.1591, test_loss: 2.3858, test_f1: 0.6461
 epoch: 70, train_loss: 0.1873, test_loss: 2.3365, test_f1: 0.6236
 epoch: 71, train_loss: 0.1883, test_loss: 2.3775, test_f1: 0.5966
 epoch: 72, train_loss: 0.1830, test_loss: 2.4112, test_f1: 0.6060
 epoch: 73, train_loss: 0.1847, test_loss: 2.4688, test_f1: 0.6476
 epoch: 74, train_loss: 0.1830, test_loss: 2.0317, test_f1: 0.6539
 epoch: 75, train_loss: 0.1806, test_loss: 2.1257, test_f1: 0.6219
 epoch: 76, train_loss: 0.1723, test_loss: 2.5423, test_f1: 0.6126
 epoch: 77, train_loss: 0.1516, test_loss: 2.1184, test_f1: 0.6709
 epoch: 78, train_loss: 0.1644, test_loss: 2.7231, test_f1: 0.5982
 epoch: 79, train_loss: 0.1393, test_loss: 2.3364, test_f1: 0.6675
 epoch: 80, train_loss: 0.1392, test_loss: 2.4684, test_f1: 0.6333
 epoch: 81, train_loss: 0.1528, test_loss: 2.1901, test_f1: 0.6441
 epoch: 82, train_loss: 0.1432, test_loss: 2.3769, test_f1: 0.6449
 epoch: 83, train_loss: 0.1372, test_loss: 2.3636, test_f1: 0.6477
 epoch: 84, train_loss: 0.1328, test_loss: 2.5448, test_f1: 0.6057
 epoch: 85, train_loss: 0.1459, test_loss: 2.4621, test_f1: 0.6558
 epoch: 86, train_loss: 0.1403, test_loss: 2.5311, test_f1: 0.6456
 epoch: 87, train_loss: 0.1325, test_loss: 2.3304, test_f1: 0.6372
 epoch: 88, train_loss: 0.1188, test_loss: 2.4784, test_f1: 0.6381
 epoch: 89, train_loss: 0.1376, test_loss: 2.5615, test_f1: 0.6069
 epoch: 90, train_loss: 0.1274, test_loss: 2.5508, test_f1: 0.6384
 epoch: 91, train_loss: 0.1453, test_loss: 2.8389, test_f1: 0.6332
 epoch: 92, train_loss: 0.1793, test_loss: 2.6958, test_f1: 0.6298
 epoch: 93, train_loss: 0.1824, test_loss: 2.2790, test_f1: 0.6983
 epoch: 94, train_loss: 0.1320, test_loss: 2.6430, test_f1: 0.6400
 epoch: 95, train_loss: 0.1424, test_loss: 2.7597, test_f1: 0.5976
 epoch: 96, train_loss: 0.1344, test_loss: 2.5650, test_f1: 0.6740
 epoch: 97, train_loss: 0.1399, test_loss: 2.7104, test_f1: 0.6541
 epoch: 98, train_loss: 0.1351, test_loss: 2.7979, test_f1: 0.5976
 epoch: 99, train_loss: 0.1067, test_loss: 2.6167, test_f1: 0.6128

Training completed in 421.42 seconds
Best F1: 0.6983 at epoch 93
Mean F1 across iterations: 0.6745  0.0186
========================FINAL RESULTS================================
FEGIN weighted F1: 0.6983  0.0186
python main.py --data ltspice_demos --representation component_pin --model FEGIN --layers 3 --hiddens 64 --batch_size 64 --lr 0.001 --emb_size 250 --epochs 100 --save_appendix component_pin_L3_H64_BS64_LR0.001_E250 --no_val
-----



STDERR:
  File "main.py", line 370, in <module>
    main()
  File "main.py", line 254, in main
    dataset = dataset_class(
  File "/home/philip/projects/ltspice_examples_code_repo/Circuit-Completion-Using-GNNs/component_classification_with_link_prediction_head/evaluation/FEGIN/kernel/circuit_datasets.py", line 15, in __init__
    self.data, self.slices = torch.load(self.processed_paths[0])
  File "/home/philip/.local/lib/python3.8/site-packages/torch/serialization.py", line 1040, in load
    warnings.warn(
  File "/usr/lib/python3.8/warnings.py", line 109, in _showwarnmsg
    sw(msg.message, msg.category, msg.filename, msg.lineno,
  File "main.py", line 47, in warn_with_traceback
    traceback.print_stack(file=log)
/home/philip/projects/ltspice_examples_code_repo/Circuit-Completion-Using-GNNs/component_classification_with_link_prediction_head/evaluation/FEGIN/kernel/circuit_datasets.py:15: FutureWarning: You are using `torch.load` with `weights_only=False` (the current default value), which uses the default pickle module implicitly. It is possible to construct malicious pickle data which will execute arbitrary code during unpickling (See https://github.com/pytorch/pytorch/blob/main/SECURITY.md#untrusted-models for more details). In a future release, the default value for `weights_only` will be flipped to `True`. This limits the functions that could be executed during unpickling. Arbitrary objects will no longer be allowed to be loaded via this mode unless they are explicitly allowlisted by the user via `torch.serialization.add_safe_globals`. We recommend you start setting `weights_only=True` for any use case where you don't have full control of the loaded file. Please open an issue on GitHub for any issues related to this experimental feature.
  self.data, self.slices = torch.load(self.processed_paths[0])
