STDOUT:
Results will be saved in /home/philip/projects/ltspice_examples_code_repo/Circuit-Completion-Using-GNNs/component_classification_with_link_prediction_head/evaluation/FEGIN/results/model_FEGIN_dataset_ltspice_examples
Command line input: python main.py --data ltspice_examples --representation component_component --model FEGIN --layers 5 --hiddens 32 --batch_size 32 --lr 0.0001 --emb_size 512 --epochs 100 --save_appendix component_component_L5_H32_BS32_LR0.0001_E512 --no_val
 is saved.
-----
ltspice_examples - FEGIN
Using 5 layers, 32 hidden units, h = 2
Loading component_component representation dataset
ENTERED
Training FEGIN on component_component representation
Train: 3556, Test: 845
##################ITERATION #0 ****************************************
 epoch: 0, train_loss: 1.3515, test_loss: 1.3471, test_f1: 0.2274
 epoch: 1, train_loss: 1.3344, test_loss: 1.3336, test_f1: 0.2274
 epoch: 2, train_loss: 1.3204, test_loss: 1.3225, test_f1: 0.2274
 epoch: 3, train_loss: 1.3086, test_loss: 1.3053, test_f1: 0.2274
 epoch: 4, train_loss: 1.2963, test_loss: 1.2995, test_f1: 0.2274
 epoch: 5, train_loss: 1.2874, test_loss: 1.2842, test_f1: 0.2274
 epoch: 6, train_loss: 1.2825, test_loss: 1.2773, test_f1: 0.2274
 epoch: 7, train_loss: 1.2704, test_loss: 1.2693, test_f1: 0.2274
 epoch: 8, train_loss: 1.2670, test_loss: 1.2552, test_f1: 0.2274
 epoch: 9, train_loss: 1.2575, test_loss: 1.2519, test_f1: 0.2274
 epoch: 10, train_loss: 1.2518, test_loss: 1.2435, test_f1: 0.2274
 epoch: 11, train_loss: 1.2476, test_loss: 1.2276, test_f1: 0.2274
 epoch: 12, train_loss: 1.2399, test_loss: 1.2248, test_f1: 0.2274
 epoch: 13, train_loss: 1.2325, test_loss: 1.2179, test_f1: 0.2274
 epoch: 14, train_loss: 1.2249, test_loss: 1.2056, test_f1: 0.2433
 epoch: 15, train_loss: 1.2257, test_loss: 1.2017, test_f1: 0.2940
 epoch: 16, train_loss: 1.2179, test_loss: 1.1990, test_f1: 0.2941
 epoch: 17, train_loss: 1.2116, test_loss: 1.1899, test_f1: 0.2967
 epoch: 18, train_loss: 1.2121, test_loss: 1.1848, test_f1: 0.3157
 epoch: 19, train_loss: 1.2017, test_loss: 1.1766, test_f1: 0.3252
 epoch: 20, train_loss: 1.2075, test_loss: 1.1725, test_f1: 0.3355
 epoch: 21, train_loss: 1.1907, test_loss: 1.1652, test_f1: 0.3389
 epoch: 22, train_loss: 1.1858, test_loss: 1.1612, test_f1: 0.3399
 epoch: 23, train_loss: 1.1839, test_loss: 1.1536, test_f1: 0.3500
 epoch: 24, train_loss: 1.1774, test_loss: 1.1510, test_f1: 0.3565
 epoch: 25, train_loss: 1.1761, test_loss: 1.1448, test_f1: 0.3534
 epoch: 26, train_loss: 1.1639, test_loss: 1.1410, test_f1: 0.3560
 epoch: 27, train_loss: 1.1638, test_loss: 1.1335, test_f1: 0.3515
 epoch: 28, train_loss: 1.1559, test_loss: 1.1292, test_f1: 0.3638
 epoch: 29, train_loss: 1.1449, test_loss: 1.1157, test_f1: 0.3913
 epoch: 30, train_loss: 1.1443, test_loss: 1.1190, test_f1: 0.4303
 epoch: 31, train_loss: 1.1368, test_loss: 1.1049, test_f1: 0.4359
 epoch: 32, train_loss: 1.1318, test_loss: 1.1008, test_f1: 0.4297
 epoch: 33, train_loss: 1.1313, test_loss: 1.0953, test_f1: 0.4441
 epoch: 34, train_loss: 1.1226, test_loss: 1.0954, test_f1: 0.4415
 epoch: 35, train_loss: 1.1258, test_loss: 1.0920, test_f1: 0.4382
 epoch: 36, train_loss: 1.1121, test_loss: 1.0874, test_f1: 0.4465
 epoch: 37, train_loss: 1.1035, test_loss: 1.0855, test_f1: 0.4425
 epoch: 38, train_loss: 1.1036, test_loss: 1.0914, test_f1: 0.4532
 epoch: 39, train_loss: 1.0993, test_loss: 1.0743, test_f1: 0.4508
 epoch: 40, train_loss: 1.0995, test_loss: 1.0756, test_f1: 0.4433
 epoch: 41, train_loss: 1.0971, test_loss: 1.0779, test_f1: 0.4511
 epoch: 42, train_loss: 1.0964, test_loss: 1.0675, test_f1: 0.4429
 epoch: 43, train_loss: 1.0893, test_loss: 1.0603, test_f1: 0.4427
 epoch: 44, train_loss: 1.0865, test_loss: 1.0704, test_f1: 0.4469
 epoch: 45, train_loss: 1.0842, test_loss: 1.0661, test_f1: 0.4458
 epoch: 46, train_loss: 1.0838, test_loss: 1.0665, test_f1: 0.4490
 epoch: 47, train_loss: 1.0919, test_loss: 1.0655, test_f1: 0.4427
 epoch: 48, train_loss: 1.0815, test_loss: 1.0671, test_f1: 0.4536
 epoch: 49, train_loss: 1.0731, test_loss: 1.0562, test_f1: 0.4611
 epoch: 50, train_loss: 1.0768, test_loss: 1.0678, test_f1: 0.4465
 epoch: 51, train_loss: 1.0756, test_loss: 1.0573, test_f1: 0.4491
 epoch: 52, train_loss: 1.0708, test_loss: 1.0484, test_f1: 0.4521
 epoch: 53, train_loss: 1.0682, test_loss: 1.0540, test_f1: 0.4562
 epoch: 54, train_loss: 1.0617, test_loss: 1.0512, test_f1: 0.4484
 epoch: 55, train_loss: 1.0601, test_loss: 1.0529, test_f1: 0.4503
 epoch: 56, train_loss: 1.0705, test_loss: 1.0528, test_f1: 0.4623
 epoch: 57, train_loss: 1.0691, test_loss: 1.0514, test_f1: 0.4480
 epoch: 58, train_loss: 1.0590, test_loss: 1.0522, test_f1: 0.4480
 epoch: 59, train_loss: 1.0489, test_loss: 1.0534, test_f1: 0.4490
 epoch: 60, train_loss: 1.0676, test_loss: 1.0459, test_f1: 0.4606
 epoch: 61, train_loss: 1.0657, test_loss: 1.0460, test_f1: 0.4640
 epoch: 62, train_loss: 1.0537, test_loss: 1.0537, test_f1: 0.4432
 epoch: 63, train_loss: 1.0564, test_loss: 1.0463, test_f1: 0.4470
 epoch: 64, train_loss: 1.0513, test_loss: 1.0585, test_f1: 0.4387
 epoch: 65, train_loss: 1.0545, test_loss: 1.0446, test_f1: 0.4627
 epoch: 66, train_loss: 1.0513, test_loss: 1.0537, test_f1: 0.4442
 epoch: 67, train_loss: 1.0479, test_loss: 1.0529, test_f1: 0.4623
 epoch: 68, train_loss: 1.0445, test_loss: 1.0477, test_f1: 0.4589
 epoch: 69, train_loss: 1.0512, test_loss: 1.0474, test_f1: 0.4663
 epoch: 70, train_loss: 1.0401, test_loss: 1.0487, test_f1: 0.4441
 epoch: 71, train_loss: 1.0355, test_loss: 1.0522, test_f1: 0.4556
 epoch: 72, train_loss: 1.0424, test_loss: 1.0435, test_f1: 0.4608
 epoch: 73, train_loss: 1.0431, test_loss: 1.0483, test_f1: 0.4613
 epoch: 74, train_loss: 1.0438, test_loss: 1.0343, test_f1: 0.4646
 epoch: 75, train_loss: 1.0410, test_loss: 1.0431, test_f1: 0.4623
 epoch: 76, train_loss: 1.0386, test_loss: 1.0365, test_f1: 0.4933
 epoch: 77, train_loss: 1.0364, test_loss: 1.0401, test_f1: 0.4672
 epoch: 78, train_loss: 1.0403, test_loss: 1.0511, test_f1: 0.4821
 epoch: 79, train_loss: 1.0278, test_loss: 1.0676, test_f1: 0.4406
 epoch: 80, train_loss: 1.0360, test_loss: 1.0515, test_f1: 0.4551
 epoch: 81, train_loss: 1.0273, test_loss: 1.0384, test_f1: 0.4606
 epoch: 82, train_loss: 1.0276, test_loss: 1.0409, test_f1: 0.4616
 epoch: 83, train_loss: 1.0287, test_loss: 1.0461, test_f1: 0.4684
 epoch: 84, train_loss: 1.0314, test_loss: 1.0361, test_f1: 0.4660
 epoch: 85, train_loss: 1.0248, test_loss: 1.0342, test_f1: 0.4709
 epoch: 86, train_loss: 1.0207, test_loss: 1.0422, test_f1: 0.4489
 epoch: 87, train_loss: 1.0270, test_loss: 1.0443, test_f1: 0.4587
 epoch: 88, train_loss: 1.0285, test_loss: 1.0316, test_f1: 0.4526
 epoch: 89, train_loss: 1.0206, test_loss: 1.0349, test_f1: 0.4577
 epoch: 90, train_loss: 1.0233, test_loss: 1.0443, test_f1: 0.4472
 epoch: 91, train_loss: 1.0198, test_loss: 1.0317, test_f1: 0.4694
 epoch: 92, train_loss: 1.0302, test_loss: 1.0345, test_f1: 0.4764
 epoch: 93, train_loss: 1.0202, test_loss: 1.0354, test_f1: 0.4577
 epoch: 94, train_loss: 1.0121, test_loss: 1.0323, test_f1: 0.4570
 epoch: 95, train_loss: 1.0185, test_loss: 1.0425, test_f1: 0.4523
 epoch: 96, train_loss: 1.0106, test_loss: 1.0381, test_f1: 0.4624
 epoch: 97, train_loss: 1.0200, test_loss: 1.0298, test_f1: 0.4664
 epoch: 98, train_loss: 1.0113, test_loss: 1.0357, test_f1: 0.4575
 epoch: 99, train_loss: 1.0099, test_loss: 1.0349, test_f1: 0.4617
##################ITERATION #1 ****************************************
 epoch: 0, train_loss: 1.3240, test_loss: 1.3297, test_f1: 0.2274
 epoch: 1, train_loss: 1.2908, test_loss: 1.2894, test_f1: 0.2274
 epoch: 2, train_loss: 1.2737, test_loss: 1.2735, test_f1: 0.2274
 epoch: 3, train_loss: 1.2660, test_loss: 1.2597, test_f1: 0.2274
 epoch: 4, train_loss: 1.2535, test_loss: 1.2502, test_f1: 0.2274
 epoch: 5, train_loss: 1.2478, test_loss: 1.2407, test_f1: 0.2274
 epoch: 6, train_loss: 1.2395, test_loss: 1.2360, test_f1: 0.2274
 epoch: 7, train_loss: 1.2340, test_loss: 1.2308, test_f1: 0.2497
 epoch: 8, train_loss: 1.2286, test_loss: 1.2224, test_f1: 0.2845
 epoch: 9, train_loss: 1.2188, test_loss: 1.2093, test_f1: 0.3231
 epoch: 10, train_loss: 1.2161, test_loss: 1.1982, test_f1: 0.3772
 epoch: 11, train_loss: 1.2095, test_loss: 1.1954, test_f1: 0.3752
 epoch: 12, train_loss: 1.2069, test_loss: 1.1893, test_f1: 0.3875
 epoch: 13, train_loss: 1.2027, test_loss: 1.1816, test_f1: 0.3885
 epoch: 14, train_loss: 1.1956, test_loss: 1.1776, test_f1: 0.4045
 epoch: 15, train_loss: 1.1896, test_loss: 1.1700, test_f1: 0.3997
 epoch: 16, train_loss: 1.1840, test_loss: 1.1589, test_f1: 0.4053
 epoch: 17, train_loss: 1.1785, test_loss: 1.1619, test_f1: 0.4143
 epoch: 18, train_loss: 1.1778, test_loss: 1.1512, test_f1: 0.4150
 epoch: 19, train_loss: 1.1663, test_loss: 1.1492, test_f1: 0.4294
 epoch: 20, train_loss: 1.1622, test_loss: 1.1394, test_f1: 0.4393
 epoch: 21, train_loss: 1.1587, test_loss: 1.1292, test_f1: 0.4541
 epoch: 22, train_loss: 1.1568, test_loss: 1.1310, test_f1: 0.4497
 epoch: 23, train_loss: 1.1490, test_loss: 1.1284, test_f1: 0.4626
 epoch: 24, train_loss: 1.1509, test_loss: 1.1213, test_f1: 0.4493
 epoch: 25, train_loss: 1.1419, test_loss: 1.1136, test_f1: 0.4508
 epoch: 26, train_loss: 1.1385, test_loss: 1.1108, test_f1: 0.4442
 epoch: 27, train_loss: 1.1341, test_loss: 1.0990, test_f1: 0.4473
 epoch: 28, train_loss: 1.1338, test_loss: 1.0966, test_f1: 0.4675
 epoch: 29, train_loss: 1.1304, test_loss: 1.0886, test_f1: 0.4479
 epoch: 30, train_loss: 1.1325, test_loss: 1.0993, test_f1: 0.4473
 epoch: 31, train_loss: 1.1266, test_loss: 1.1027, test_f1: 0.4486
 epoch: 32, train_loss: 1.1059, test_loss: 1.0876, test_f1: 0.4425
 epoch: 33, train_loss: 1.1149, test_loss: 1.0866, test_f1: 0.4426
 epoch: 34, train_loss: 1.1137, test_loss: 1.0800, test_f1: 0.4501
 epoch: 35, train_loss: 1.1139, test_loss: 1.0820, test_f1: 0.4636
 epoch: 36, train_loss: 1.1152, test_loss: 1.0763, test_f1: 0.4495
 epoch: 37, train_loss: 1.1096, test_loss: 1.0783, test_f1: 0.4449
 epoch: 38, train_loss: 1.1067, test_loss: 1.0769, test_f1: 0.4615
 epoch: 39, train_loss: 1.1005, test_loss: 1.0626, test_f1: 0.4625
 epoch: 40, train_loss: 1.0911, test_loss: 1.0597, test_f1: 0.4534
 epoch: 41, train_loss: 1.0899, test_loss: 1.0545, test_f1: 0.4582
 epoch: 42, train_loss: 1.0899, test_loss: 1.0495, test_f1: 0.4687
 epoch: 43, train_loss: 1.0876, test_loss: 1.0520, test_f1: 0.4603
 epoch: 44, train_loss: 1.0934, test_loss: 1.0594, test_f1: 0.4661
 epoch: 45, train_loss: 1.0816, test_loss: 1.0605, test_f1: 0.4628
 epoch: 46, train_loss: 1.0797, test_loss: 1.0598, test_f1: 0.4613
 epoch: 47, train_loss: 1.0804, test_loss: 1.0431, test_f1: 0.4842
 epoch: 48, train_loss: 1.0679, test_loss: 1.0522, test_f1: 0.4682
 epoch: 49, train_loss: 1.0745, test_loss: 1.0409, test_f1: 0.4610
 epoch: 50, train_loss: 1.0682, test_loss: 1.0373, test_f1: 0.4792
 epoch: 51, train_loss: 1.0686, test_loss: 1.0482, test_f1: 0.4852
 epoch: 52, train_loss: 1.0630, test_loss: 1.0417, test_f1: 0.4875
 epoch: 53, train_loss: 1.0774, test_loss: 1.0369, test_f1: 0.4816
 epoch: 54, train_loss: 1.0674, test_loss: 1.0345, test_f1: 0.4864
 epoch: 55, train_loss: 1.0586, test_loss: 1.0347, test_f1: 0.4771
 epoch: 56, train_loss: 1.0608, test_loss: 1.0436, test_f1: 0.4658
 epoch: 57, train_loss: 1.0588, test_loss: 1.0624, test_f1: 0.4514
 epoch: 58, train_loss: 1.0526, test_loss: 1.0357, test_f1: 0.4735
 epoch: 59, train_loss: 1.0617, test_loss: 1.0443, test_f1: 0.4724
 epoch: 60, train_loss: 1.0644, test_loss: 1.0422, test_f1: 0.4507
 epoch: 61, train_loss: 1.0559, test_loss: 1.0451, test_f1: 0.4564
 epoch: 62, train_loss: 1.0553, test_loss: 1.0343, test_f1: 0.4806
 epoch: 63, train_loss: 1.0485, test_loss: 1.0395, test_f1: 0.4541
 epoch: 64, train_loss: 1.0463, test_loss: 1.0415, test_f1: 0.4596
 epoch: 65, train_loss: 1.0577, test_loss: 1.0262, test_f1: 0.4566
 epoch: 66, train_loss: 1.0459, test_loss: 1.0275, test_f1: 0.4687
 epoch: 67, train_loss: 1.0530, test_loss: 1.0330, test_f1: 0.4696
 epoch: 68, train_loss: 1.0560, test_loss: 1.0225, test_f1: 0.4881
 epoch: 69, train_loss: 1.0491, test_loss: 1.0355, test_f1: 0.4639
 epoch: 70, train_loss: 1.0380, test_loss: 1.0348, test_f1: 0.4558
 epoch: 71, train_loss: 1.0431, test_loss: 1.0518, test_f1: 0.4648
 epoch: 72, train_loss: 1.0421, test_loss: 1.0367, test_f1: 0.4695
 epoch: 73, train_loss: 1.0485, test_loss: 1.0401, test_f1: 0.4669
 epoch: 74, train_loss: 1.0323, test_loss: 1.0289, test_f1: 0.4725
 epoch: 75, train_loss: 1.0433, test_loss: 1.0194, test_f1: 0.4822
 epoch: 76, train_loss: 1.0403, test_loss: 1.0315, test_f1: 0.4753
 epoch: 77, train_loss: 1.0283, test_loss: 1.0339, test_f1: 0.4690
 epoch: 78, train_loss: 1.0332, test_loss: 1.0293, test_f1: 0.4676
 epoch: 79, train_loss: 1.0454, test_loss: 1.0144, test_f1: 0.4751
 epoch: 80, train_loss: 1.0462, test_loss: 1.0238, test_f1: 0.4742
 epoch: 81, train_loss: 1.0383, test_loss: 1.0246, test_f1: 0.4849
 epoch: 82, train_loss: 1.0431, test_loss: 1.0404, test_f1: 0.4655
 epoch: 83, train_loss: 1.0336, test_loss: 1.0373, test_f1: 0.4758
 epoch: 84, train_loss: 1.0245, test_loss: 1.0168, test_f1: 0.4819
 epoch: 85, train_loss: 1.0331, test_loss: 1.0327, test_f1: 0.4584
 epoch: 86, train_loss: 1.0393, test_loss: 1.0170, test_f1: 0.4744
 epoch: 87, train_loss: 1.0325, test_loss: 1.0408, test_f1: 0.4635
 epoch: 88, train_loss: 1.0482, test_loss: 1.0292, test_f1: 0.4658
 epoch: 89, train_loss: 1.0338, test_loss: 1.0377, test_f1: 0.4719
 epoch: 90, train_loss: 1.0273, test_loss: 1.0181, test_f1: 0.4631
 epoch: 91, train_loss: 1.0319, test_loss: 1.0291, test_f1: 0.4763
 epoch: 92, train_loss: 1.0216, test_loss: 1.0405, test_f1: 0.4537
 epoch: 93, train_loss: 1.0222, test_loss: 1.0165, test_f1: 0.4703
 epoch: 94, train_loss: 1.0333, test_loss: 1.0273, test_f1: 0.4774
 epoch: 95, train_loss: 1.0257, test_loss: 1.0370, test_f1: 0.4620
 epoch: 96, train_loss: 1.0323, test_loss: 1.0392, test_f1: 0.4633
 epoch: 97, train_loss: 1.0207, test_loss: 1.0327, test_f1: 0.4747
 epoch: 98, train_loss: 1.0265, test_loss: 1.0011, test_f1: 0.4905
 epoch: 99, train_loss: 1.0218, test_loss: 1.0207, test_f1: 0.4818
##################ITERATION #2 ****************************************
 epoch: 0, train_loss: 1.3120, test_loss: 1.2831, test_f1: 0.2274
 epoch: 1, train_loss: 1.2841, test_loss: 1.2710, test_f1: 0.2274
 epoch: 2, train_loss: 1.2721, test_loss: 1.2570, test_f1: 0.2274
 epoch: 3, train_loss: 1.2584, test_loss: 1.2471, test_f1: 0.2569
 epoch: 4, train_loss: 1.2528, test_loss: 1.2400, test_f1: 0.2704
 epoch: 5, train_loss: 1.2405, test_loss: 1.2332, test_f1: 0.3174
 epoch: 6, train_loss: 1.2383, test_loss: 1.2212, test_f1: 0.3377
 epoch: 7, train_loss: 1.2291, test_loss: 1.2126, test_f1: 0.3426
 epoch: 8, train_loss: 1.2225, test_loss: 1.2014, test_f1: 0.3586
 epoch: 9, train_loss: 1.2181, test_loss: 1.1901, test_f1: 0.3743
 epoch: 10, train_loss: 1.2131, test_loss: 1.1829, test_f1: 0.3776
 epoch: 11, train_loss: 1.2086, test_loss: 1.1823, test_f1: 0.3722
 epoch: 12, train_loss: 1.1971, test_loss: 1.1715, test_f1: 0.3906
 epoch: 13, train_loss: 1.1946, test_loss: 1.1657, test_f1: 0.3929
 epoch: 14, train_loss: 1.1888, test_loss: 1.1548, test_f1: 0.3915
 epoch: 15, train_loss: 1.1851, test_loss: 1.1441, test_f1: 0.4023
 epoch: 16, train_loss: 1.1786, test_loss: 1.1417, test_f1: 0.4151
 epoch: 17, train_loss: 1.1741, test_loss: 1.1322, test_f1: 0.4047
 epoch: 18, train_loss: 1.1628, test_loss: 1.1318, test_f1: 0.4330
 epoch: 19, train_loss: 1.1606, test_loss: 1.1232, test_f1: 0.4230
 epoch: 20, train_loss: 1.1541, test_loss: 1.1156, test_f1: 0.4378
 epoch: 21, train_loss: 1.1549, test_loss: 1.1174, test_f1: 0.4407
 epoch: 22, train_loss: 1.1425, test_loss: 1.1177, test_f1: 0.4363
 epoch: 23, train_loss: 1.1500, test_loss: 1.1102, test_f1: 0.4187
 epoch: 24, train_loss: 1.1428, test_loss: 1.1016, test_f1: 0.4358
 epoch: 25, train_loss: 1.1449, test_loss: 1.0984, test_f1: 0.4490
 epoch: 26, train_loss: 1.1304, test_loss: 1.0943, test_f1: 0.4349
 epoch: 27, train_loss: 1.1306, test_loss: 1.0858, test_f1: 0.4544
 epoch: 28, train_loss: 1.1236, test_loss: 1.0885, test_f1: 0.4465
 epoch: 29, train_loss: 1.1245, test_loss: 1.0855, test_f1: 0.4242
 epoch: 30, train_loss: 1.1185, test_loss: 1.0781, test_f1: 0.4270
 epoch: 31, train_loss: 1.1165, test_loss: 1.0783, test_f1: 0.4474
 epoch: 32, train_loss: 1.1068, test_loss: 1.0774, test_f1: 0.4559
 epoch: 33, train_loss: 1.1080, test_loss: 1.0738, test_f1: 0.4679
 epoch: 34, train_loss: 1.1014, test_loss: 1.0741, test_f1: 0.4656
 epoch: 35, train_loss: 1.1080, test_loss: 1.0734, test_f1: 0.4346
 epoch: 36, train_loss: 1.1004, test_loss: 1.0762, test_f1: 0.4514
 epoch: 37, train_loss: 1.0889, test_loss: 1.0696, test_f1: 0.4561
 epoch: 38, train_loss: 1.0865, test_loss: 1.0678, test_f1: 0.4524
 epoch: 39, train_loss: 1.0881, test_loss: 1.0701, test_f1: 0.4410
 epoch: 40, train_loss: 1.0864, test_loss: 1.0595, test_f1: 0.4517
 epoch: 41, train_loss: 1.0760, test_loss: 1.0634, test_f1: 0.4385
 epoch: 42, train_loss: 1.0738, test_loss: 1.0488, test_f1: 0.4554
 epoch: 43, train_loss: 1.0742, test_loss: 1.0592, test_f1: 0.4510
 epoch: 44, train_loss: 1.0810, test_loss: 1.0539, test_f1: 0.4545
 epoch: 45, train_loss: 1.0716, test_loss: 1.0513, test_f1: 0.4499
 epoch: 46, train_loss: 1.0662, test_loss: 1.0532, test_f1: 0.4313
 epoch: 47, train_loss: 1.0666, test_loss: 1.0740, test_f1: 0.4210
 epoch: 48, train_loss: 1.0642, test_loss: 1.0514, test_f1: 0.4450
 epoch: 49, train_loss: 1.0651, test_loss: 1.0567, test_f1: 0.4519
 epoch: 50, train_loss: 1.0574, test_loss: 1.0636, test_f1: 0.4251
 epoch: 51, train_loss: 1.0561, test_loss: 1.0479, test_f1: 0.4568
 epoch: 52, train_loss: 1.0538, test_loss: 1.0493, test_f1: 0.4473
 epoch: 53, train_loss: 1.0550, test_loss: 1.0426, test_f1: 0.4474
 epoch: 54, train_loss: 1.0447, test_loss: 1.0494, test_f1: 0.4428
 epoch: 55, train_loss: 1.0534, test_loss: 1.0400, test_f1: 0.4439
 epoch: 56, train_loss: 1.0511, test_loss: 1.0392, test_f1: 0.4470
 epoch: 57, train_loss: 1.0443, test_loss: 1.0431, test_f1: 0.4380
 epoch: 58, train_loss: 1.0429, test_loss: 1.0502, test_f1: 0.4440
 epoch: 59, train_loss: 1.0449, test_loss: 1.0612, test_f1: 0.4261
 epoch: 60, train_loss: 1.0443, test_loss: 1.0351, test_f1: 0.4305
 epoch: 61, train_loss: 1.0334, test_loss: 1.0435, test_f1: 0.4231
 epoch: 62, train_loss: 1.0483, test_loss: 1.0358, test_f1: 0.4427
 epoch: 63, train_loss: 1.0383, test_loss: 1.0474, test_f1: 0.4449
 epoch: 64, train_loss: 1.0353, test_loss: 1.0511, test_f1: 0.4314
 epoch: 65, train_loss: 1.0304, test_loss: 1.0388, test_f1: 0.4420
 epoch: 66, train_loss: 1.0353, test_loss: 1.0384, test_f1: 0.4487
 epoch: 67, train_loss: 1.0428, test_loss: 1.0460, test_f1: 0.4359
 epoch: 68, train_loss: 1.0280, test_loss: 1.0560, test_f1: 0.4417
 epoch: 69, train_loss: 1.0325, test_loss: 1.0546, test_f1: 0.4374
 epoch: 70, train_loss: 1.0356, test_loss: 1.0429, test_f1: 0.4394
 epoch: 71, train_loss: 1.0245, test_loss: 1.0413, test_f1: 0.4549
 epoch: 72, train_loss: 1.0233, test_loss: 1.0476, test_f1: 0.4371
 epoch: 73, train_loss: 1.0299, test_loss: 1.0463, test_f1: 0.4420
 epoch: 74, train_loss: 1.0286, test_loss: 1.0693, test_f1: 0.4391
 epoch: 75, train_loss: 1.0208, test_loss: 1.0290, test_f1: 0.4571
 epoch: 76, train_loss: 1.0272, test_loss: 1.0239, test_f1: 0.4604
 epoch: 77, train_loss: 1.0312, test_loss: 1.0765, test_f1: 0.4324
 epoch: 78, train_loss: 1.0244, test_loss: 1.0423, test_f1: 0.4447
 epoch: 79, train_loss: 1.0266, test_loss: 1.0232, test_f1: 0.4643
 epoch: 80, train_loss: 1.0183, test_loss: 1.0573, test_f1: 0.4280
 epoch: 81, train_loss: 1.0220, test_loss: 1.0443, test_f1: 0.4461
 epoch: 82, train_loss: 1.0096, test_loss: 1.0516, test_f1: 0.4405
 epoch: 83, train_loss: 1.0145, test_loss: 1.0298, test_f1: 0.4741
 epoch: 84, train_loss: 1.0146, test_loss: 1.0395, test_f1: 0.4625
 epoch: 85, train_loss: 1.0237, test_loss: 1.0432, test_f1: 0.4551
 epoch: 86, train_loss: 1.0087, test_loss: 1.0533, test_f1: 0.4456
 epoch: 87, train_loss: 1.0141, test_loss: 1.0410, test_f1: 0.4365
 epoch: 88, train_loss: 1.0186, test_loss: 1.0389, test_f1: 0.4490
 epoch: 89, train_loss: 1.0029, test_loss: 1.0362, test_f1: 0.4646
 epoch: 90, train_loss: 0.9975, test_loss: 1.0278, test_f1: 0.4622
 epoch: 91, train_loss: 1.0156, test_loss: 1.0342, test_f1: 0.4812
 epoch: 92, train_loss: 1.0017, test_loss: 1.0373, test_f1: 0.4705
 epoch: 93, train_loss: 0.9995, test_loss: 1.0216, test_f1: 0.4745
 epoch: 94, train_loss: 1.0083, test_loss: 1.0215, test_f1: 0.4963
 epoch: 95, train_loss: 1.0002, test_loss: 1.0389, test_f1: 0.4684
 epoch: 96, train_loss: 1.0139, test_loss: 1.0135, test_f1: 0.4840
 epoch: 97, train_loss: 1.0009, test_loss: 1.0278, test_f1: 0.4747
 epoch: 98, train_loss: 1.0004, test_loss: 1.0291, test_f1: 0.4545
 epoch: 99, train_loss: 0.9988, test_loss: 1.0343, test_f1: 0.4490
##################ITERATION #3 ****************************************
 epoch: 0, train_loss: 1.3062, test_loss: 1.2675, test_f1: 0.2274
 epoch: 1, train_loss: 1.2736, test_loss: 1.2574, test_f1: 0.2274
 epoch: 2, train_loss: 1.2607, test_loss: 1.2441, test_f1: 0.2372
 epoch: 3, train_loss: 1.2525, test_loss: 1.2245, test_f1: 0.2640
 epoch: 4, train_loss: 1.2423, test_loss: 1.2198, test_f1: 0.2691
 epoch: 5, train_loss: 1.2356, test_loss: 1.2063, test_f1: 0.3117
 epoch: 6, train_loss: 1.2215, test_loss: 1.1989, test_f1: 0.3523
 epoch: 7, train_loss: 1.2221, test_loss: 1.1882, test_f1: 0.3678
 epoch: 8, train_loss: 1.2220, test_loss: 1.1857, test_f1: 0.3526
 epoch: 9, train_loss: 1.2126, test_loss: 1.1760, test_f1: 0.3679
 epoch: 10, train_loss: 1.2016, test_loss: 1.1708, test_f1: 0.3796
 epoch: 11, train_loss: 1.2003, test_loss: 1.1722, test_f1: 0.3786
 epoch: 12, train_loss: 1.2034, test_loss: 1.1630, test_f1: 0.3874
 epoch: 13, train_loss: 1.1941, test_loss: 1.1605, test_f1: 0.3986
 epoch: 14, train_loss: 1.1900, test_loss: 1.1544, test_f1: 0.4237
 epoch: 15, train_loss: 1.1820, test_loss: 1.1395, test_f1: 0.4041
 epoch: 16, train_loss: 1.1818, test_loss: 1.1505, test_f1: 0.4086
 epoch: 17, train_loss: 1.1832, test_loss: 1.1386, test_f1: 0.4103
 epoch: 18, train_loss: 1.1732, test_loss: 1.1401, test_f1: 0.4128
 epoch: 19, train_loss: 1.1804, test_loss: 1.1395, test_f1: 0.4106
 epoch: 20, train_loss: 1.1748, test_loss: 1.1297, test_f1: 0.4214
 epoch: 21, train_loss: 1.1733, test_loss: 1.1294, test_f1: 0.4117
 epoch: 22, train_loss: 1.1612, test_loss: 1.1170, test_f1: 0.4161
 epoch: 23, train_loss: 1.1682, test_loss: 1.1077, test_f1: 0.4306
 epoch: 24, train_loss: 1.1654, test_loss: 1.1079, test_f1: 0.4172
 epoch: 25, train_loss: 1.1530, test_loss: 1.1121, test_f1: 0.4263
 epoch: 26, train_loss: 1.1417, test_loss: 1.0975, test_f1: 0.4398
 epoch: 27, train_loss: 1.1491, test_loss: 1.1426, test_f1: 0.4052
 epoch: 28, train_loss: 1.1438, test_loss: 1.1041, test_f1: 0.4272
 epoch: 29, train_loss: 1.1406, test_loss: 1.1007, test_f1: 0.4377
 epoch: 30, train_loss: 1.1410, test_loss: 1.0918, test_f1: 0.4228
 epoch: 31, train_loss: 1.1405, test_loss: 1.0798, test_f1: 0.4443
 epoch: 32, train_loss: 1.1317, test_loss: 1.0863, test_f1: 0.4464
 epoch: 33, train_loss: 1.1295, test_loss: 1.0779, test_f1: 0.4481
 epoch: 34, train_loss: 1.1302, test_loss: 1.0836, test_f1: 0.4401
 epoch: 35, train_loss: 1.1293, test_loss: 1.0759, test_f1: 0.4399
 epoch: 36, train_loss: 1.1212, test_loss: 1.0715, test_f1: 0.4689
 epoch: 37, train_loss: 1.1187, test_loss: 1.0904, test_f1: 0.4373
 epoch: 38, train_loss: 1.1140, test_loss: 1.0753, test_f1: 0.4567
 epoch: 39, train_loss: 1.1218, test_loss: 1.1254, test_f1: 0.4260
 epoch: 40, train_loss: 1.1187, test_loss: 1.0697, test_f1: 0.4527
 epoch: 41, train_loss: 1.1095, test_loss: 1.0672, test_f1: 0.4420
 epoch: 42, train_loss: 1.1050, test_loss: 1.0648, test_f1: 0.4594
 epoch: 43, train_loss: 1.0982, test_loss: 1.0617, test_f1: 0.4355
 epoch: 44, train_loss: 1.0982, test_loss: 1.0453, test_f1: 0.4552
 epoch: 45, train_loss: 1.0974, test_loss: 1.0542, test_f1: 0.4577
 epoch: 46, train_loss: 1.0956, test_loss: 1.0554, test_f1: 0.4573
 epoch: 47, train_loss: 1.0944, test_loss: 1.0349, test_f1: 0.4699
 epoch: 48, train_loss: 1.0977, test_loss: 1.0424, test_f1: 0.4434
 epoch: 49, train_loss: 1.0863, test_loss: 1.0551, test_f1: 0.4494
 epoch: 50, train_loss: 1.0893, test_loss: 1.0342, test_f1: 0.4581
 epoch: 51, train_loss: 1.0807, test_loss: 1.0332, test_f1: 0.4498
 epoch: 52, train_loss: 1.0707, test_loss: 1.0560, test_f1: 0.4385
 epoch: 53, train_loss: 1.0759, test_loss: 1.0361, test_f1: 0.4508
 epoch: 54, train_loss: 1.0818, test_loss: 1.0630, test_f1: 0.4361
 epoch: 55, train_loss: 1.0778, test_loss: 1.0718, test_f1: 0.4327
 epoch: 56, train_loss: 1.0824, test_loss: 1.0409, test_f1: 0.4421
 epoch: 57, train_loss: 1.0657, test_loss: 1.0523, test_f1: 0.4575
 epoch: 58, train_loss: 1.0765, test_loss: 1.0559, test_f1: 0.4283
 epoch: 59, train_loss: 1.0751, test_loss: 1.0285, test_f1: 0.4420
 epoch: 60, train_loss: 1.0722, test_loss: 1.0459, test_f1: 0.4348
 epoch: 61, train_loss: 1.0706, test_loss: 1.0328, test_f1: 0.4533
 epoch: 62, train_loss: 1.0613, test_loss: 1.0271, test_f1: 0.4449
 epoch: 63, train_loss: 1.0663, test_loss: 1.0328, test_f1: 0.4691
 epoch: 64, train_loss: 1.0630, test_loss: 1.0327, test_f1: 0.4508
 epoch: 65, train_loss: 1.0769, test_loss: 1.0405, test_f1: 0.4542
 epoch: 66, train_loss: 1.0657, test_loss: 1.0280, test_f1: 0.4523
 epoch: 67, train_loss: 1.0602, test_loss: 1.0392, test_f1: 0.4519
 epoch: 68, train_loss: 1.0685, test_loss: 1.0581, test_f1: 0.4460
 epoch: 69, train_loss: 1.0589, test_loss: 1.0232, test_f1: 0.4456
 epoch: 70, train_loss: 1.0657, test_loss: 1.0223, test_f1: 0.4547
 epoch: 71, train_loss: 1.0656, test_loss: 1.0196, test_f1: 0.4715
 epoch: 72, train_loss: 1.0542, test_loss: 1.0689, test_f1: 0.4314
 epoch: 73, train_loss: 1.0571, test_loss: 1.0522, test_f1: 0.4647
 epoch: 74, train_loss: 1.0611, test_loss: 1.0525, test_f1: 0.4380
 epoch: 75, train_loss: 1.0614, test_loss: 1.0279, test_f1: 0.4647
 epoch: 76, train_loss: 1.0505, test_loss: 1.0413, test_f1: 0.4507
 epoch: 77, train_loss: 1.0581, test_loss: 1.0366, test_f1: 0.4584
 epoch: 78, train_loss: 1.0468, test_loss: 1.0241, test_f1: 0.4783
 epoch: 79, train_loss: 1.0480, test_loss: 1.0220, test_f1: 0.4552
 epoch: 80, train_loss: 1.0466, test_loss: 1.0202, test_f1: 0.4450
 epoch: 81, train_loss: 1.0435, test_loss: 1.0563, test_f1: 0.4466
 epoch: 82, train_loss: 1.0511, test_loss: 1.0385, test_f1: 0.4494
 epoch: 83, train_loss: 1.0500, test_loss: 1.0767, test_f1: 0.4549
 epoch: 84, train_loss: 1.0433, test_loss: 1.0824, test_f1: 0.4475
 epoch: 85, train_loss: 1.0421, test_loss: 1.0984, test_f1: 0.4453
 epoch: 86, train_loss: 1.0433, test_loss: 1.0200, test_f1: 0.4624
 epoch: 87, train_loss: 1.0462, test_loss: 1.0164, test_f1: 0.4501
 epoch: 88, train_loss: 1.0464, test_loss: 1.0675, test_f1: 0.4493
 epoch: 89, train_loss: 1.0448, test_loss: 1.0042, test_f1: 0.4652
 epoch: 90, train_loss: 1.0530, test_loss: 1.0085, test_f1: 0.4679
 epoch: 91, train_loss: 1.0493, test_loss: 1.0631, test_f1: 0.4559
 epoch: 92, train_loss: 1.0372, test_loss: 1.0191, test_f1: 0.4610
 epoch: 93, train_loss: 1.0532, test_loss: 1.0193, test_f1: 0.4536
 epoch: 94, train_loss: 1.0357, test_loss: 1.0096, test_f1: 0.4632
 epoch: 95, train_loss: 1.0469, test_loss: 1.0507, test_f1: 0.4495
 epoch: 96, train_loss: 1.0361, test_loss: 1.0273, test_f1: 0.4499
 epoch: 97, train_loss: 1.0388, test_loss: 1.0342, test_f1: 0.4561
 epoch: 98, train_loss: 1.0351, test_loss: 1.1660, test_f1: 0.4392
 epoch: 99, train_loss: 1.0366, test_loss: 1.0175, test_f1: 0.4813
##################ITERATION #4 ****************************************
 epoch: 0, train_loss: 1.3377, test_loss: 1.2832, test_f1: 0.2383
 epoch: 1, train_loss: 1.2715, test_loss: 1.2623, test_f1: 0.2346
 epoch: 2, train_loss: 1.2587, test_loss: 1.2471, test_f1: 0.2366
 epoch: 3, train_loss: 1.2449, test_loss: 1.2335, test_f1: 0.2446
 epoch: 4, train_loss: 1.2389, test_loss: 1.2302, test_f1: 0.2774
 epoch: 5, train_loss: 1.2298, test_loss: 1.2113, test_f1: 0.2620
 epoch: 6, train_loss: 1.2272, test_loss: 1.2015, test_f1: 0.3112
 epoch: 7, train_loss: 1.2185, test_loss: 1.1925, test_f1: 0.3612
 epoch: 8, train_loss: 1.2085, test_loss: 1.1829, test_f1: 0.3662
 epoch: 9, train_loss: 1.2035, test_loss: 1.1703, test_f1: 0.3772
 epoch: 10, train_loss: 1.1902, test_loss: 1.1619, test_f1: 0.3900
 epoch: 11, train_loss: 1.1941, test_loss: 1.1503, test_f1: 0.3837
 epoch: 12, train_loss: 1.1803, test_loss: 1.1415, test_f1: 0.4047
 epoch: 13, train_loss: 1.1753, test_loss: 1.1357, test_f1: 0.4079
 epoch: 14, train_loss: 1.1649, test_loss: 1.1326, test_f1: 0.4019
 epoch: 15, train_loss: 1.1604, test_loss: 1.1173, test_f1: 0.4190
 epoch: 16, train_loss: 1.1433, test_loss: 1.1077, test_f1: 0.4225
 epoch: 17, train_loss: 1.1496, test_loss: 1.1056, test_f1: 0.4119
 epoch: 18, train_loss: 1.1378, test_loss: 1.0980, test_f1: 0.4322
 epoch: 19, train_loss: 1.1308, test_loss: 1.0817, test_f1: 0.4410
 epoch: 20, train_loss: 1.1248, test_loss: 1.0863, test_f1: 0.4095
 epoch: 21, train_loss: 1.1330, test_loss: 1.0805, test_f1: 0.4402
 epoch: 22, train_loss: 1.1201, test_loss: 1.0804, test_f1: 0.4266
 epoch: 23, train_loss: 1.1116, test_loss: 1.0666, test_f1: 0.4297
 epoch: 24, train_loss: 1.0988, test_loss: 1.0558, test_f1: 0.4382
 epoch: 25, train_loss: 1.1089, test_loss: 1.0551, test_f1: 0.4337
 epoch: 26, train_loss: 1.1057, test_loss: 1.0606, test_f1: 0.4254
 epoch: 27, train_loss: 1.1030, test_loss: 1.0475, test_f1: 0.4456
 epoch: 28, train_loss: 1.0986, test_loss: 1.0477, test_f1: 0.4393
 epoch: 29, train_loss: 1.0851, test_loss: 1.0563, test_f1: 0.4314
 epoch: 30, train_loss: 1.0757, test_loss: 1.0428, test_f1: 0.4387
 epoch: 31, train_loss: 1.0803, test_loss: 1.0426, test_f1: 0.4388
 epoch: 32, train_loss: 1.0769, test_loss: 1.0424, test_f1: 0.4357
 epoch: 33, train_loss: 1.0853, test_loss: 1.0423, test_f1: 0.4382
 epoch: 34, train_loss: 1.0708, test_loss: 1.0391, test_f1: 0.4326
 epoch: 35, train_loss: 1.0747, test_loss: 1.0421, test_f1: 0.4265
 epoch: 36, train_loss: 1.0760, test_loss: 1.0338, test_f1: 0.4566
 epoch: 37, train_loss: 1.0612, test_loss: 1.0320, test_f1: 0.4383
 epoch: 38, train_loss: 1.0578, test_loss: 1.0274, test_f1: 0.4408
 epoch: 39, train_loss: 1.0503, test_loss: 1.0275, test_f1: 0.4395
 epoch: 40, train_loss: 1.0522, test_loss: 1.0145, test_f1: 0.4502
 epoch: 41, train_loss: 1.0594, test_loss: 1.0321, test_f1: 0.4375
 epoch: 42, train_loss: 1.0544, test_loss: 1.0076, test_f1: 0.4474
 epoch: 43, train_loss: 1.0491, test_loss: 1.0056, test_f1: 0.4568
 epoch: 44, train_loss: 1.0326, test_loss: 1.0223, test_f1: 0.4435
 epoch: 45, train_loss: 1.0358, test_loss: 1.0191, test_f1: 0.4438
 epoch: 46, train_loss: 1.0400, test_loss: 1.0087, test_f1: 0.4459
 epoch: 47, train_loss: 1.0244, test_loss: 1.0019, test_f1: 0.4385
 epoch: 48, train_loss: 1.0323, test_loss: 0.9945, test_f1: 0.4627
 epoch: 49, train_loss: 1.0260, test_loss: 1.0215, test_f1: 0.4741
 epoch: 50, train_loss: 1.0308, test_loss: 0.9918, test_f1: 0.4831
 epoch: 51, train_loss: 1.0193, test_loss: 0.9740, test_f1: 0.4705
 epoch: 52, train_loss: 1.0217, test_loss: 0.9986, test_f1: 0.4686
 epoch: 53, train_loss: 1.0254, test_loss: 0.9915, test_f1: 0.4685
 epoch: 54, train_loss: 1.0266, test_loss: 1.0008, test_f1: 0.4693
 epoch: 55, train_loss: 1.0081, test_loss: 1.0060, test_f1: 0.4403
 epoch: 56, train_loss: 1.0084, test_loss: 1.0003, test_f1: 0.4841
 epoch: 57, train_loss: 1.0118, test_loss: 1.0031, test_f1: 0.4771
 epoch: 58, train_loss: 1.0075, test_loss: 0.9999, test_f1: 0.4679
 epoch: 59, train_loss: 1.0046, test_loss: 0.9902, test_f1: 0.4832
 epoch: 60, train_loss: 1.0047, test_loss: 0.9863, test_f1: 0.4792
 epoch: 61, train_loss: 1.0080, test_loss: 0.9939, test_f1: 0.4414
 epoch: 62, train_loss: 1.0117, test_loss: 0.9859, test_f1: 0.4517
 epoch: 63, train_loss: 1.0076, test_loss: 0.9667, test_f1: 0.4642
 epoch: 64, train_loss: 1.0031, test_loss: 0.9939, test_f1: 0.4895
 epoch: 65, train_loss: 0.9953, test_loss: 0.9811, test_f1: 0.4633
 epoch: 66, train_loss: 0.9946, test_loss: 0.9878, test_f1: 0.4769
 epoch: 67, train_loss: 0.9997, test_loss: 0.9819, test_f1: 0.4677
 epoch: 68, train_loss: 0.9952, test_loss: 0.9862, test_f1: 0.4748
 epoch: 69, train_loss: 0.9900, test_loss: 0.9695, test_f1: 0.4713
 epoch: 70, train_loss: 0.9938, test_loss: 0.9710, test_f1: 0.4842
 epoch: 71, train_loss: 1.0014, test_loss: 0.9717, test_f1: 0.4748
 epoch: 72, train_loss: 0.9956, test_loss: 0.9996, test_f1: 0.4743
 epoch: 73, train_loss: 1.0065, test_loss: 0.9944, test_f1: 0.4726
 epoch: 74, train_loss: 0.9978, test_loss: 0.9885, test_f1: 0.4719
 epoch: 75, train_loss: 0.9922, test_loss: 0.9794, test_f1: 0.4690
 epoch: 76, train_loss: 0.9995, test_loss: 0.9987, test_f1: 0.4765
 epoch: 77, train_loss: 0.9938, test_loss: 0.9798, test_f1: 0.4833
 epoch: 78, train_loss: 0.9941, test_loss: 0.9876, test_f1: 0.4754
 epoch: 79, train_loss: 0.9859, test_loss: 0.9806, test_f1: 0.4647
 epoch: 80, train_loss: 0.9798, test_loss: 0.9897, test_f1: 0.4907
 epoch: 81, train_loss: 0.9758, test_loss: 0.9761, test_f1: 0.4822
 epoch: 82, train_loss: 0.9867, test_loss: 0.9922, test_f1: 0.4853
 epoch: 83, train_loss: 0.9764, test_loss: 0.9795, test_f1: 0.4839
 epoch: 84, train_loss: 0.9937, test_loss: 0.9805, test_f1: 0.4822
 epoch: 85, train_loss: 0.9922, test_loss: 0.9784, test_f1: 0.4826
 epoch: 86, train_loss: 0.9880, test_loss: 0.9732, test_f1: 0.4825
 epoch: 87, train_loss: 0.9848, test_loss: 0.9683, test_f1: 0.4674
 epoch: 88, train_loss: 0.9780, test_loss: 0.9695, test_f1: 0.4904
 epoch: 89, train_loss: 0.9851, test_loss: 0.9694, test_f1: 0.4751
 epoch: 90, train_loss: 0.9764, test_loss: 0.9822, test_f1: 0.4578
 epoch: 91, train_loss: 0.9891, test_loss: 0.9685, test_f1: 0.4727
 epoch: 92, train_loss: 0.9778, test_loss: 0.9620, test_f1: 0.4612
 epoch: 93, train_loss: 0.9785, test_loss: 0.9690, test_f1: 0.4760
 epoch: 94, train_loss: 0.9690, test_loss: 0.9764, test_f1: 0.4630
 epoch: 95, train_loss: 0.9799, test_loss: 0.9739, test_f1: 0.4753
 epoch: 96, train_loss: 0.9727, test_loss: 0.9763, test_f1: 0.4924
 epoch: 97, train_loss: 0.9693, test_loss: 0.9846, test_f1: 0.4621
 epoch: 98, train_loss: 0.9669, test_loss: 0.9677, test_f1: 0.5047
 epoch: 99, train_loss: 0.9663, test_loss: 0.9875, test_f1: 0.4672
##################ITERATION #5 ****************************************
 epoch: 0, train_loss: 1.3027, test_loss: 1.2280, test_f1: 0.2524
 epoch: 1, train_loss: 1.2531, test_loss: 1.2084, test_f1: 0.3422
 epoch: 2, train_loss: 1.2256, test_loss: 1.1956, test_f1: 0.3767
 epoch: 3, train_loss: 1.2269, test_loss: 1.1821, test_f1: 0.3659
 epoch: 4, train_loss: 1.2237, test_loss: 1.1738, test_f1: 0.3829
 epoch: 5, train_loss: 1.2105, test_loss: 1.1688, test_f1: 0.3766
 epoch: 6, train_loss: 1.1957, test_loss: 1.1572, test_f1: 0.4152
 epoch: 7, train_loss: 1.2002, test_loss: 1.1521, test_f1: 0.4078
 epoch: 8, train_loss: 1.1844, test_loss: 1.1439, test_f1: 0.4033
 epoch: 9, train_loss: 1.1777, test_loss: 1.1395, test_f1: 0.4078
 epoch: 10, train_loss: 1.1661, test_loss: 1.1313, test_f1: 0.4215
 epoch: 11, train_loss: 1.1759, test_loss: 1.1279, test_f1: 0.4219
 epoch: 12, train_loss: 1.1591, test_loss: 1.1206, test_f1: 0.4203
 epoch: 13, train_loss: 1.1640, test_loss: 1.1194, test_f1: 0.4175
 epoch: 14, train_loss: 1.1541, test_loss: 1.1213, test_f1: 0.4353
 epoch: 15, train_loss: 1.1531, test_loss: 1.1236, test_f1: 0.4008
 epoch: 16, train_loss: 1.1438, test_loss: 1.1158, test_f1: 0.4263
 epoch: 17, train_loss: 1.1401, test_loss: 1.1021, test_f1: 0.4203
 epoch: 18, train_loss: 1.1371, test_loss: 1.1032, test_f1: 0.4495
 epoch: 19, train_loss: 1.1348, test_loss: 1.0841, test_f1: 0.4168
 epoch: 20, train_loss: 1.1261, test_loss: 1.0950, test_f1: 0.4357
 epoch: 21, train_loss: 1.1219, test_loss: 1.0917, test_f1: 0.4199
 epoch: 22, train_loss: 1.1186, test_loss: 1.0913, test_f1: 0.4566
 epoch: 23, train_loss: 1.1164, test_loss: 1.0970, test_f1: 0.4316
 epoch: 24, train_loss: 1.1186, test_loss: 1.0756, test_f1: 0.4257
 epoch: 25, train_loss: 1.1040, test_loss: 1.0782, test_f1: 0.4275
 epoch: 26, train_loss: 1.1106, test_loss: 1.0726, test_f1: 0.4423
 epoch: 27, train_loss: 1.0946, test_loss: 1.0580, test_f1: 0.4421
 epoch: 28, train_loss: 1.0951, test_loss: 1.1128, test_f1: 0.4406
 epoch: 29, train_loss: 1.0935, test_loss: 1.0900, test_f1: 0.4417
 epoch: 30, train_loss: 1.0855, test_loss: 1.0926, test_f1: 0.4274
 epoch: 31, train_loss: 1.0938, test_loss: 1.0846, test_f1: 0.4317
 epoch: 32, train_loss: 1.0954, test_loss: 1.1175, test_f1: 0.4353
 epoch: 33, train_loss: 1.0855, test_loss: 1.0881, test_f1: 0.4415
 epoch: 34, train_loss: 1.0777, test_loss: 1.1158, test_f1: 0.4432
 epoch: 35, train_loss: 1.0747, test_loss: 1.0370, test_f1: 0.4436
 epoch: 36, train_loss: 1.0770, test_loss: 1.0577, test_f1: 0.4451
 epoch: 37, train_loss: 1.0802, test_loss: 1.0617, test_f1: 0.4547
 epoch: 38, train_loss: 1.0852, test_loss: 1.0485, test_f1: 0.4315
 epoch: 39, train_loss: 1.0630, test_loss: 1.0454, test_f1: 0.4485
 epoch: 40, train_loss: 1.0514, test_loss: 1.0336, test_f1: 0.4386
 epoch: 41, train_loss: 1.0584, test_loss: 1.0456, test_f1: 0.4457
 epoch: 42, train_loss: 1.0505, test_loss: 1.0566, test_f1: 0.4289
 epoch: 43, train_loss: 1.0613, test_loss: 1.0259, test_f1: 0.4554
 epoch: 44, train_loss: 1.0562, test_loss: 1.0324, test_f1: 0.4492
 epoch: 45, train_loss: 1.0500, test_loss: 1.0324, test_f1: 0.4404
 epoch: 46, train_loss: 1.0501, test_loss: 1.0275, test_f1: 0.4446
 epoch: 47, train_loss: 1.0477, test_loss: 1.0269, test_f1: 0.4433
 epoch: 48, train_loss: 1.0363, test_loss: 1.0574, test_f1: 0.4439
 epoch: 49, train_loss: 1.0322, test_loss: 1.0122, test_f1: 0.4548
 epoch: 50, train_loss: 1.0521, test_loss: 0.9942, test_f1: 0.4564
 epoch: 51, train_loss: 1.0356, test_loss: 1.0079, test_f1: 0.4612
 epoch: 52, train_loss: 1.0369, test_loss: 0.9986, test_f1: 0.4628
 epoch: 53, train_loss: 1.0323, test_loss: 1.0011, test_f1: 0.4493
 epoch: 54, train_loss: 1.0307, test_loss: 0.9856, test_f1: 0.4628
 epoch: 55, train_loss: 1.0384, test_loss: 0.9931, test_f1: 0.4586
 epoch: 56, train_loss: 1.0335, test_loss: 0.9920, test_f1: 0.4627
 epoch: 57, train_loss: 1.0333, test_loss: 1.0054, test_f1: 0.4657
 epoch: 58, train_loss: 1.0210, test_loss: 1.0298, test_f1: 0.4440
 epoch: 59, train_loss: 1.0266, test_loss: 1.0328, test_f1: 0.4400
 epoch: 60, train_loss: 1.0292, test_loss: 1.0061, test_f1: 0.4675
 epoch: 61, train_loss: 1.0262, test_loss: 0.9995, test_f1: 0.4687
 epoch: 62, train_loss: 1.0223, test_loss: 1.0582, test_f1: 0.4512
 epoch: 63, train_loss: 1.0320, test_loss: 1.0015, test_f1: 0.4607
 epoch: 64, train_loss: 1.0120, test_loss: 0.9952, test_f1: 0.4676
 epoch: 65, train_loss: 1.0224, test_loss: 1.0271, test_f1: 0.4562
 epoch: 66, train_loss: 1.0095, test_loss: 1.0076, test_f1: 0.4496
 epoch: 67, train_loss: 1.0215, test_loss: 1.0009, test_f1: 0.4650
 epoch: 68, train_loss: 1.0124, test_loss: 0.9897, test_f1: 0.4680
 epoch: 69, train_loss: 1.0234, test_loss: 0.9981, test_f1: 0.4792
 epoch: 70, train_loss: 1.0166, test_loss: 1.0071, test_f1: 0.4601
 epoch: 71, train_loss: 1.0214, test_loss: 0.9918, test_f1: 0.4627
 epoch: 72, train_loss: 1.0127, test_loss: 0.9783, test_f1: 0.4766
 epoch: 73, train_loss: 1.0187, test_loss: 0.9805, test_f1: 0.4760
 epoch: 74, train_loss: 1.0163, test_loss: 0.9958, test_f1: 0.4625
 epoch: 75, train_loss: 1.0076, test_loss: 0.9990, test_f1: 0.4540
 epoch: 76, train_loss: 1.0169, test_loss: 0.9807, test_f1: 0.4737
 epoch: 77, train_loss: 1.0089, test_loss: 0.9846, test_f1: 0.4664
 epoch: 78, train_loss: 1.0029, test_loss: 0.9984, test_f1: 0.4699
 epoch: 79, train_loss: 1.0235, test_loss: 1.0059, test_f1: 0.4385
 epoch: 80, train_loss: 1.0156, test_loss: 1.0282, test_f1: 0.4568
 epoch: 81, train_loss: 0.9974, test_loss: 0.9971, test_f1: 0.4778
 epoch: 82, train_loss: 1.0071, test_loss: 1.0004, test_f1: 0.4717
 epoch: 83, train_loss: 1.0017, test_loss: 0.9913, test_f1: 0.4645
 epoch: 84, train_loss: 1.0070, test_loss: 1.0316, test_f1: 0.4419
 epoch: 85, train_loss: 1.0085, test_loss: 0.9621, test_f1: 0.4801
 epoch: 86, train_loss: 1.0005, test_loss: 0.9781, test_f1: 0.4677
 epoch: 87, train_loss: 1.0009, test_loss: 0.9811, test_f1: 0.4692
 epoch: 88, train_loss: 1.0009, test_loss: 0.9794, test_f1: 0.4758
 epoch: 89, train_loss: 0.9927, test_loss: 0.9716, test_f1: 0.4777
 epoch: 90, train_loss: 0.9993, test_loss: 0.9830, test_f1: 0.4756
 epoch: 91, train_loss: 0.9965, test_loss: 0.9662, test_f1: 0.4830
 epoch: 92, train_loss: 0.9958, test_loss: 1.0107, test_f1: 0.4774
 epoch: 93, train_loss: 0.9950, test_loss: 0.9755, test_f1: 0.4827
 epoch: 94, train_loss: 0.9797, test_loss: 1.0233, test_f1: 0.4641
 epoch: 95, train_loss: 0.9979, test_loss: 0.9754, test_f1: 0.4758
 epoch: 96, train_loss: 0.9939, test_loss: 0.9753, test_f1: 0.4863
 epoch: 97, train_loss: 0.9918, test_loss: 0.9758, test_f1: 0.4726
 epoch: 98, train_loss: 0.9927, test_loss: 0.9825, test_f1: 0.4762
 epoch: 99, train_loss: 0.9948, test_loss: 0.9644, test_f1: 0.4840
##################ITERATION #6 ****************************************
 epoch: 0, train_loss: 1.3257, test_loss: 1.2575, test_f1: 0.2546
 epoch: 1, train_loss: 1.2671, test_loss: 1.2405, test_f1: 0.2895
 epoch: 2, train_loss: 1.2657, test_loss: 1.2313, test_f1: 0.2916
 epoch: 3, train_loss: 1.2399, test_loss: 1.2053, test_f1: 0.3128
 epoch: 4, train_loss: 1.2347, test_loss: 1.1941, test_f1: 0.3170
 epoch: 5, train_loss: 1.2294, test_loss: 1.1868, test_f1: 0.3228
 epoch: 6, train_loss: 1.2264, test_loss: 1.1916, test_f1: 0.3566
 epoch: 7, train_loss: 1.2103, test_loss: 1.1825, test_f1: 0.3507
 epoch: 8, train_loss: 1.2048, test_loss: 1.1727, test_f1: 0.3762
 epoch: 9, train_loss: 1.2017, test_loss: 1.1755, test_f1: 0.3786
 epoch: 10, train_loss: 1.1926, test_loss: 1.1496, test_f1: 0.3849
 epoch: 11, train_loss: 1.1894, test_loss: 1.1500, test_f1: 0.3837
 epoch: 12, train_loss: 1.1880, test_loss: 1.1411, test_f1: 0.3956
 epoch: 13, train_loss: 1.1780, test_loss: 1.1426, test_f1: 0.3887
 epoch: 14, train_loss: 1.1807, test_loss: 1.1347, test_f1: 0.3964
 epoch: 15, train_loss: 1.1752, test_loss: 1.1328, test_f1: 0.4108
 epoch: 16, train_loss: 1.1719, test_loss: 1.1212, test_f1: 0.4150
 epoch: 17, train_loss: 1.1613, test_loss: 1.1163, test_f1: 0.4119
 epoch: 18, train_loss: 1.1684, test_loss: 1.1190, test_f1: 0.3964
 epoch: 19, train_loss: 1.1593, test_loss: 1.1156, test_f1: 0.3955
 epoch: 20, train_loss: 1.1519, test_loss: 1.1090, test_f1: 0.3982
 epoch: 21, train_loss: 1.1537, test_loss: 1.1085, test_f1: 0.4081
 epoch: 22, train_loss: 1.1493, test_loss: 1.0974, test_f1: 0.4241
 epoch: 23, train_loss: 1.1331, test_loss: 1.1008, test_f1: 0.4167
 epoch: 24, train_loss: 1.1299, test_loss: 1.0950, test_f1: 0.4233
 epoch: 25, train_loss: 1.1243, test_loss: 1.0908, test_f1: 0.4197
 epoch: 26, train_loss: 1.1271, test_loss: 1.0881, test_f1: 0.4246
 epoch: 27, train_loss: 1.1305, test_loss: 1.0800, test_f1: 0.4179
 epoch: 28, train_loss: 1.1191, test_loss: 1.0730, test_f1: 0.4377
 epoch: 29, train_loss: 1.1174, test_loss: 1.0816, test_f1: 0.4468
 epoch: 30, train_loss: 1.1153, test_loss: 1.0686, test_f1: 0.4131
 epoch: 31, train_loss: 1.1120, test_loss: 1.0796, test_f1: 0.4173
 epoch: 32, train_loss: 1.1051, test_loss: 1.0714, test_f1: 0.4288
 epoch: 33, train_loss: 1.1209, test_loss: 1.0732, test_f1: 0.4190
 epoch: 34, train_loss: 1.1061, test_loss: 1.0683, test_f1: 0.4405
 epoch: 35, train_loss: 1.1033, test_loss: 1.0629, test_f1: 0.4192
 epoch: 36, train_loss: 1.0984, test_loss: 1.0555, test_f1: 0.4193
 epoch: 37, train_loss: 1.1027, test_loss: 1.0526, test_f1: 0.4214
 epoch: 38, train_loss: 1.0898, test_loss: 1.0473, test_f1: 0.4352
 epoch: 39, train_loss: 1.0909, test_loss: 1.0472, test_f1: 0.4515
 epoch: 40, train_loss: 1.0889, test_loss: 1.0523, test_f1: 0.4321
 epoch: 41, train_loss: 1.0812, test_loss: 1.0427, test_f1: 0.4317
 epoch: 42, train_loss: 1.0871, test_loss: 1.0490, test_f1: 0.4411
 epoch: 43, train_loss: 1.0779, test_loss: 1.0533, test_f1: 0.4417
 epoch: 44, train_loss: 1.0719, test_loss: 1.0544, test_f1: 0.4320
 epoch: 45, train_loss: 1.0730, test_loss: 1.0420, test_f1: 0.4455
 epoch: 46, train_loss: 1.0749, test_loss: 1.0393, test_f1: 0.4595
 epoch: 47, train_loss: 1.0721, test_loss: 1.0379, test_f1: 0.4407
 epoch: 48, train_loss: 1.0675, test_loss: 1.0462, test_f1: 0.4466
 epoch: 49, train_loss: 1.0680, test_loss: 1.0388, test_f1: 0.4625
 epoch: 50, train_loss: 1.0668, test_loss: 1.0373, test_f1: 0.4418
 epoch: 51, train_loss: 1.0639, test_loss: 1.0317, test_f1: 0.4448
 epoch: 52, train_loss: 1.0551, test_loss: 1.0503, test_f1: 0.4580
 epoch: 53, train_loss: 1.0569, test_loss: 1.0337, test_f1: 0.4530
 epoch: 54, train_loss: 1.0562, test_loss: 1.0405, test_f1: 0.4696
 epoch: 55, train_loss: 1.0501, test_loss: 1.0356, test_f1: 0.4401
 epoch: 56, train_loss: 1.0601, test_loss: 1.0303, test_f1: 0.4869
 epoch: 57, train_loss: 1.0539, test_loss: 1.0263, test_f1: 0.4528
 epoch: 58, train_loss: 1.0549, test_loss: 1.0202, test_f1: 0.4469
 epoch: 59, train_loss: 1.0527, test_loss: 1.0268, test_f1: 0.4811
 epoch: 60, train_loss: 1.0433, test_loss: 1.0282, test_f1: 0.4653
 epoch: 61, train_loss: 1.0600, test_loss: 1.0374, test_f1: 0.4753
 epoch: 62, train_loss: 1.0427, test_loss: 1.0114, test_f1: 0.4492
 epoch: 63, train_loss: 1.0427, test_loss: 1.0283, test_f1: 0.4548
 epoch: 64, train_loss: 1.0522, test_loss: 1.0204, test_f1: 0.4527
 epoch: 65, train_loss: 1.0515, test_loss: 1.0309, test_f1: 0.4705
 epoch: 66, train_loss: 1.0441, test_loss: 1.0121, test_f1: 0.4528
 epoch: 67, train_loss: 1.0417, test_loss: 1.0110, test_f1: 0.4577
 epoch: 68, train_loss: 1.0305, test_loss: 1.0256, test_f1: 0.4604
 epoch: 69, train_loss: 1.0425, test_loss: 1.0083, test_f1: 0.4620
 epoch: 70, train_loss: 1.0475, test_loss: 1.0304, test_f1: 0.4693
 epoch: 71, train_loss: 1.0387, test_loss: 1.0348, test_f1: 0.4541
 epoch: 72, train_loss: 1.0299, test_loss: 1.0113, test_f1: 0.5040
 epoch: 73, train_loss: 1.0296, test_loss: 1.0224, test_f1: 0.4637
 epoch: 74, train_loss: 1.0306, test_loss: 1.0194, test_f1: 0.4643
 epoch: 75, train_loss: 1.0397, test_loss: 1.0318, test_f1: 0.4891
 epoch: 76, train_loss: 1.0319, test_loss: 1.0139, test_f1: 0.4826
 epoch: 77, train_loss: 1.0273, test_loss: 1.0124, test_f1: 0.4641
 epoch: 78, train_loss: 1.0347, test_loss: 1.0103, test_f1: 0.4594
 epoch: 79, train_loss: 1.0352, test_loss: 1.0198, test_f1: 0.4878
 epoch: 80, train_loss: 1.0279, test_loss: 1.0252, test_f1: 0.4902
 epoch: 81, train_loss: 1.0276, test_loss: 1.0158, test_f1: 0.4902
 epoch: 82, train_loss: 1.0240, test_loss: 1.0258, test_f1: 0.4875
 epoch: 83, train_loss: 1.0173, test_loss: 1.0123, test_f1: 0.4979
 epoch: 84, train_loss: 1.0229, test_loss: 1.0283, test_f1: 0.4892
 epoch: 85, train_loss: 1.0204, test_loss: 1.0259, test_f1: 0.4836
 epoch: 86, train_loss: 1.0191, test_loss: 1.0100, test_f1: 0.4954
 epoch: 87, train_loss: 1.0203, test_loss: 1.0156, test_f1: 0.4602
 epoch: 88, train_loss: 1.0092, test_loss: 1.0053, test_f1: 0.5151
 epoch: 89, train_loss: 1.0187, test_loss: 1.0194, test_f1: 0.4602
 epoch: 90, train_loss: 1.0099, test_loss: 1.0327, test_f1: 0.5047
 epoch: 91, train_loss: 1.0045, test_loss: 1.0159, test_f1: 0.4859
 epoch: 92, train_loss: 1.0071, test_loss: 1.0092, test_f1: 0.4988
 epoch: 93, train_loss: 1.0132, test_loss: 1.0082, test_f1: 0.4632
 epoch: 94, train_loss: 1.0093, test_loss: 1.0004, test_f1: 0.5023
 epoch: 95, train_loss: 1.0137, test_loss: 1.0024, test_f1: 0.4764
 epoch: 96, train_loss: 1.0047, test_loss: 1.0204, test_f1: 0.4954
 epoch: 97, train_loss: 1.0109, test_loss: 1.0039, test_f1: 0.5084
 epoch: 98, train_loss: 1.0118, test_loss: 0.9974, test_f1: 0.5001
 epoch: 99, train_loss: 1.0070, test_loss: 1.0012, test_f1: 0.5082
##################ITERATION #7 ****************************************
 epoch: 0, train_loss: 1.3296, test_loss: 1.2716, test_f1: 0.2388
 epoch: 1, train_loss: 1.2704, test_loss: 1.2483, test_f1: 0.2667
 epoch: 2, train_loss: 1.2618, test_loss: 1.3182, test_f1: 0.3172
 epoch: 3, train_loss: 1.2457, test_loss: 1.2279, test_f1: 0.3211
 epoch: 4, train_loss: 1.2366, test_loss: 1.2646, test_f1: 0.3273
 epoch: 5, train_loss: 1.2409, test_loss: 1.4958, test_f1: 0.3913
 epoch: 6, train_loss: 1.2262, test_loss: 1.2000, test_f1: 0.4047
 epoch: 7, train_loss: 1.2225, test_loss: 1.1997, test_f1: 0.3776
 epoch: 8, train_loss: 1.2230, test_loss: 1.1870, test_f1: 0.3809
 epoch: 9, train_loss: 1.2121, test_loss: 1.1867, test_f1: 0.4219
 epoch: 10, train_loss: 1.2068, test_loss: 1.1619, test_f1: 0.4010
 epoch: 11, train_loss: 1.2020, test_loss: 1.2150, test_f1: 0.4317
 epoch: 12, train_loss: 1.1994, test_loss: 1.2621, test_f1: 0.4102
 epoch: 13, train_loss: 1.1952, test_loss: 1.1874, test_f1: 0.4130
 epoch: 14, train_loss: 1.1977, test_loss: 1.1634, test_f1: 0.4207
 epoch: 15, train_loss: 1.1831, test_loss: 1.1643, test_f1: 0.4213
 epoch: 16, train_loss: 1.1775, test_loss: 1.2524, test_f1: 0.4524
 epoch: 17, train_loss: 1.1790, test_loss: 1.1433, test_f1: 0.4534
 epoch: 18, train_loss: 1.1771, test_loss: 1.1409, test_f1: 0.4296
 epoch: 19, train_loss: 1.1710, test_loss: 1.1868, test_f1: 0.4475
 epoch: 20, train_loss: 1.1649, test_loss: 1.1777, test_f1: 0.4431
 epoch: 21, train_loss: 1.1635, test_loss: 1.1268, test_f1: 0.4522
 epoch: 22, train_loss: 1.1590, test_loss: 1.1139, test_f1: 0.4470
 epoch: 23, train_loss: 1.1620, test_loss: 1.1295, test_f1: 0.4617
 epoch: 24, train_loss: 1.1601, test_loss: 1.1061, test_f1: 0.4448
 epoch: 25, train_loss: 1.1508, test_loss: 1.1014, test_f1: 0.4731
 epoch: 26, train_loss: 1.1489, test_loss: 1.1513, test_f1: 0.4684
 epoch: 27, train_loss: 1.1472, test_loss: 1.1075, test_f1: 0.4535
 epoch: 28, train_loss: 1.1467, test_loss: 1.0965, test_f1: 0.4814
 epoch: 29, train_loss: 1.1363, test_loss: 1.0841, test_f1: 0.4799
 epoch: 30, train_loss: 1.1356, test_loss: 1.1638, test_f1: 0.4759
 epoch: 31, train_loss: 1.1264, test_loss: 1.1468, test_f1: 0.4723
 epoch: 32, train_loss: 1.1315, test_loss: 1.1272, test_f1: 0.4486
 epoch: 33, train_loss: 1.1259, test_loss: 1.1111, test_f1: 0.4565
 epoch: 34, train_loss: 1.1314, test_loss: 1.1456, test_f1: 0.4446
 epoch: 35, train_loss: 1.1217, test_loss: 1.1018, test_f1: 0.4769
 epoch: 36, train_loss: 1.1177, test_loss: 1.0931, test_f1: 0.4431
 epoch: 37, train_loss: 1.1047, test_loss: 1.0830, test_f1: 0.4437
 epoch: 38, train_loss: 1.1030, test_loss: 1.0741, test_f1: 0.4755
 epoch: 39, train_loss: 1.1192, test_loss: 1.0826, test_f1: 0.4781
 epoch: 40, train_loss: 1.1041, test_loss: 1.0610, test_f1: 0.4749
 epoch: 41, train_loss: 1.1121, test_loss: 1.0948, test_f1: 0.4846
 epoch: 42, train_loss: 1.0964, test_loss: 1.0520, test_f1: 0.4757
 epoch: 43, train_loss: 1.1009, test_loss: 1.0866, test_f1: 0.4937
 epoch: 44, train_loss: 1.0977, test_loss: 1.0732, test_f1: 0.4931
 epoch: 45, train_loss: 1.0949, test_loss: 1.0662, test_f1: 0.4768
 epoch: 46, train_loss: 1.1018, test_loss: 1.0575, test_f1: 0.4639
 epoch: 47, train_loss: 1.0994, test_loss: 1.0546, test_f1: 0.4899
 epoch: 48, train_loss: 1.0774, test_loss: 1.0550, test_f1: 0.4752
 epoch: 49, train_loss: 1.0830, test_loss: 1.0706, test_f1: 0.4773
 epoch: 50, train_loss: 1.0860, test_loss: 1.0412, test_f1: 0.4676
 epoch: 51, train_loss: 1.0819, test_loss: 1.0482, test_f1: 0.4900
 epoch: 52, train_loss: 1.0851, test_loss: 1.1042, test_f1: 0.4824
 epoch: 53, train_loss: 1.0702, test_loss: 1.0652, test_f1: 0.4829
 epoch: 54, train_loss: 1.0837, test_loss: 1.0943, test_f1: 0.4901
 epoch: 55, train_loss: 1.0792, test_loss: 1.0640, test_f1: 0.4889
 epoch: 56, train_loss: 1.0767, test_loss: 1.0702, test_f1: 0.4737
 epoch: 57, train_loss: 1.0730, test_loss: 1.0316, test_f1: 0.4958
 epoch: 58, train_loss: 1.0734, test_loss: 1.0101, test_f1: 0.4960
 epoch: 59, train_loss: 1.0780, test_loss: 1.0035, test_f1: 0.4884
 epoch: 60, train_loss: 1.0663, test_loss: 0.9998, test_f1: 0.4939
 epoch: 61, train_loss: 1.0675, test_loss: 0.9980, test_f1: 0.4954
 epoch: 62, train_loss: 1.0715, test_loss: 1.0064, test_f1: 0.4933
 epoch: 63, train_loss: 1.0665, test_loss: 1.0167, test_f1: 0.4797
 epoch: 64, train_loss: 1.0658, test_loss: 1.0007, test_f1: 0.5040
 epoch: 65, train_loss: 1.0615, test_loss: 0.9997, test_f1: 0.4877
 epoch: 66, train_loss: 1.0608, test_loss: 0.9958, test_f1: 0.4921
 epoch: 67, train_loss: 1.0626, test_loss: 0.9932, test_f1: 0.5028
 epoch: 68, train_loss: 1.0550, test_loss: 1.0113, test_f1: 0.4775
 epoch: 69, train_loss: 1.0598, test_loss: 1.0032, test_f1: 0.4727
 epoch: 70, train_loss: 1.0551, test_loss: 0.9934, test_f1: 0.4880
 epoch: 71, train_loss: 1.0661, test_loss: 0.9862, test_f1: 0.4965
 epoch: 72, train_loss: 1.0486, test_loss: 1.0039, test_f1: 0.4851
 epoch: 73, train_loss: 1.0451, test_loss: 0.9827, test_f1: 0.4938
 epoch: 74, train_loss: 1.0500, test_loss: 0.9892, test_f1: 0.5014
 epoch: 75, train_loss: 1.0512, test_loss: 0.9936, test_f1: 0.4877
 epoch: 76, train_loss: 1.0491, test_loss: 0.9974, test_f1: 0.4682
 epoch: 77, train_loss: 1.0529, test_loss: 0.9855, test_f1: 0.4952
 epoch: 78, train_loss: 1.0459, test_loss: 0.9889, test_f1: 0.5002
 epoch: 79, train_loss: 1.0478, test_loss: 0.9812, test_f1: 0.5007
 epoch: 80, train_loss: 1.0564, test_loss: 0.9797, test_f1: 0.5033
 epoch: 81, train_loss: 1.0523, test_loss: 0.9825, test_f1: 0.5009
 epoch: 82, train_loss: 1.0458, test_loss: 0.9784, test_f1: 0.5093
 epoch: 83, train_loss: 1.0366, test_loss: 0.9903, test_f1: 0.4851
 epoch: 84, train_loss: 1.0402, test_loss: 0.9711, test_f1: 0.4988
 epoch: 85, train_loss: 1.0464, test_loss: 0.9815, test_f1: 0.4964
 epoch: 86, train_loss: 1.0442, test_loss: 0.9776, test_f1: 0.4862
 epoch: 87, train_loss: 1.0449, test_loss: 0.9825, test_f1: 0.4753
 epoch: 88, train_loss: 1.0379, test_loss: 0.9830, test_f1: 0.4827
 epoch: 89, train_loss: 1.0398, test_loss: 0.9686, test_f1: 0.4830
 epoch: 90, train_loss: 1.0335, test_loss: 0.9714, test_f1: 0.4913
 epoch: 91, train_loss: 1.0349, test_loss: 0.9698, test_f1: 0.4920
 epoch: 92, train_loss: 1.0327, test_loss: 0.9730, test_f1: 0.4839
 epoch: 93, train_loss: 1.0403, test_loss: 0.9598, test_f1: 0.4821
 epoch: 94, train_loss: 1.0322, test_loss: 0.9683, test_f1: 0.4871
 epoch: 95, train_loss: 1.0358, test_loss: 0.9621, test_f1: 0.4963
 epoch: 96, train_loss: 1.0338, test_loss: 0.9613, test_f1: 0.4987
 epoch: 97, train_loss: 1.0303, test_loss: 0.9609, test_f1: 0.4767
 epoch: 98, train_loss: 1.0253, test_loss: 0.9669, test_f1: 0.4943
 epoch: 99, train_loss: 1.0342, test_loss: 0.9583, test_f1: 0.4955
##################ITERATION #8 ****************************************
 epoch: 0, train_loss: 1.3150, test_loss: 1.2879, test_f1: 0.2920
 epoch: 1, train_loss: 1.2777, test_loss: 1.2549, test_f1: 0.3063
 epoch: 2, train_loss: 1.2592, test_loss: 1.2727, test_f1: 0.2872
 epoch: 3, train_loss: 1.2569, test_loss: 1.2330, test_f1: 0.3119
 epoch: 4, train_loss: 1.2444, test_loss: 1.2294, test_f1: 0.3165
 epoch: 5, train_loss: 1.2324, test_loss: 1.2081, test_f1: 0.3645
 epoch: 6, train_loss: 1.2276, test_loss: 1.2541, test_f1: 0.3473
 epoch: 7, train_loss: 1.2162, test_loss: 1.2356, test_f1: 0.3667
 epoch: 8, train_loss: 1.2055, test_loss: 1.2040, test_f1: 0.3783
 epoch: 9, train_loss: 1.2081, test_loss: 1.2494, test_f1: 0.3725
 epoch: 10, train_loss: 1.2083, test_loss: 1.1933, test_f1: 0.3773
 epoch: 11, train_loss: 1.1969, test_loss: 1.2654, test_f1: 0.3783
 epoch: 12, train_loss: 1.1959, test_loss: 1.2093, test_f1: 0.3853
 epoch: 13, train_loss: 1.1849, test_loss: 1.2210, test_f1: 0.3873
 epoch: 14, train_loss: 1.1754, test_loss: 1.1981, test_f1: 0.3912
 epoch: 15, train_loss: 1.1756, test_loss: 1.2646, test_f1: 0.3934
 epoch: 16, train_loss: 1.1754, test_loss: 1.1685, test_f1: 0.4003
 epoch: 17, train_loss: 1.1630, test_loss: 1.1671, test_f1: 0.4206
 epoch: 18, train_loss: 1.1623, test_loss: 1.1464, test_f1: 0.4079
 epoch: 19, train_loss: 1.1549, test_loss: 1.1639, test_f1: 0.4175
 epoch: 20, train_loss: 1.1550, test_loss: 1.1417, test_f1: 0.4132
 epoch: 21, train_loss: 1.1346, test_loss: 1.1355, test_f1: 0.4068
 epoch: 22, train_loss: 1.1346, test_loss: 1.1177, test_f1: 0.4049
 epoch: 23, train_loss: 1.1333, test_loss: 1.1114, test_f1: 0.4222
 epoch: 24, train_loss: 1.1321, test_loss: 1.1236, test_f1: 0.4120
 epoch: 25, train_loss: 1.1270, test_loss: 1.1249, test_f1: 0.4300
 epoch: 26, train_loss: 1.1210, test_loss: 1.1033, test_f1: 0.4219
 epoch: 27, train_loss: 1.1236, test_loss: 1.1093, test_f1: 0.4196
 epoch: 28, train_loss: 1.1134, test_loss: 1.0828, test_f1: 0.4240
 epoch: 29, train_loss: 1.1193, test_loss: 1.0828, test_f1: 0.4233
 epoch: 30, train_loss: 1.1190, test_loss: 1.0815, test_f1: 0.4227
 epoch: 31, train_loss: 1.1070, test_loss: 1.0710, test_f1: 0.4272
 epoch: 32, train_loss: 1.1017, test_loss: 1.0889, test_f1: 0.4405
 epoch: 33, train_loss: 1.1028, test_loss: 1.0648, test_f1: 0.4526
 epoch: 34, train_loss: 1.0975, test_loss: 1.0556, test_f1: 0.4443
 epoch: 35, train_loss: 1.1006, test_loss: 1.0587, test_f1: 0.4153
 epoch: 36, train_loss: 1.0945, test_loss: 1.0545, test_f1: 0.4345
 epoch: 37, train_loss: 1.0972, test_loss: 1.0609, test_f1: 0.4334
 epoch: 38, train_loss: 1.0908, test_loss: 1.0587, test_f1: 0.4212
 epoch: 39, train_loss: 1.0845, test_loss: 1.0444, test_f1: 0.4262
 epoch: 40, train_loss: 1.0782, test_loss: 1.0412, test_f1: 0.4456
 epoch: 41, train_loss: 1.0829, test_loss: 1.0452, test_f1: 0.4607
 epoch: 42, train_loss: 1.0792, test_loss: 1.0752, test_f1: 0.4475
 epoch: 43, train_loss: 1.0753, test_loss: 1.0576, test_f1: 0.4384
 epoch: 44, train_loss: 1.0686, test_loss: 1.0459, test_f1: 0.4211
 epoch: 45, train_loss: 1.0691, test_loss: 1.0365, test_f1: 0.4459
 epoch: 46, train_loss: 1.0649, test_loss: 1.0439, test_f1: 0.4670
 epoch: 47, train_loss: 1.0697, test_loss: 1.0341, test_f1: 0.4605
 epoch: 48, train_loss: 1.0673, test_loss: 1.0535, test_f1: 0.4285
 epoch: 49, train_loss: 1.0683, test_loss: 1.0623, test_f1: 0.4585
 epoch: 50, train_loss: 1.0611, test_loss: 1.0206, test_f1: 0.4687
 epoch: 51, train_loss: 1.0534, test_loss: 1.0345, test_f1: 0.4569
 epoch: 52, train_loss: 1.0556, test_loss: 1.0145, test_f1: 0.4678
 epoch: 53, train_loss: 1.0537, test_loss: 1.0231, test_f1: 0.4638
 epoch: 54, train_loss: 1.0546, test_loss: 1.0137, test_f1: 0.4420
 epoch: 55, train_loss: 1.0455, test_loss: 1.0329, test_f1: 0.4460
 epoch: 56, train_loss: 1.0526, test_loss: 1.0071, test_f1: 0.4569
 epoch: 57, train_loss: 1.0459, test_loss: 1.0144, test_f1: 0.4619
 epoch: 58, train_loss: 1.0467, test_loss: 1.0174, test_f1: 0.4728
 epoch: 59, train_loss: 1.0485, test_loss: 1.0087, test_f1: 0.4516
 epoch: 60, train_loss: 1.0380, test_loss: 1.0202, test_f1: 0.4465
 epoch: 61, train_loss: 1.0405, test_loss: 1.0044, test_f1: 0.4578
 epoch: 62, train_loss: 1.0424, test_loss: 1.0035, test_f1: 0.4597
 epoch: 63, train_loss: 1.0458, test_loss: 1.0107, test_f1: 0.4468
 epoch: 64, train_loss: 1.0377, test_loss: 1.0013, test_f1: 0.4518
 epoch: 65, train_loss: 1.0335, test_loss: 1.0120, test_f1: 0.4660
 epoch: 66, train_loss: 1.0448, test_loss: 1.0198, test_f1: 0.4681
 epoch: 67, train_loss: 1.0473, test_loss: 1.0104, test_f1: 0.4551
 epoch: 68, train_loss: 1.0369, test_loss: 1.0123, test_f1: 0.4649
 epoch: 69, train_loss: 1.0376, test_loss: 1.0069, test_f1: 0.4608
 epoch: 70, train_loss: 1.0404, test_loss: 1.0203, test_f1: 0.4743
 epoch: 71, train_loss: 1.0365, test_loss: 1.0113, test_f1: 0.4475
 epoch: 72, train_loss: 1.0315, test_loss: 1.0268, test_f1: 0.4509
 epoch: 73, train_loss: 1.0290, test_loss: 1.0055, test_f1: 0.4503
 epoch: 74, train_loss: 1.0326, test_loss: 1.0153, test_f1: 0.4521
 epoch: 75, train_loss: 1.0362, test_loss: 1.0055, test_f1: 0.4503
 epoch: 76, train_loss: 1.0223, test_loss: 1.0456, test_f1: 0.4609
 epoch: 77, train_loss: 1.0222, test_loss: 1.0131, test_f1: 0.4615
 epoch: 78, train_loss: 1.0309, test_loss: 1.0114, test_f1: 0.4616
 epoch: 79, train_loss: 1.0141, test_loss: 1.0222, test_f1: 0.4685
 epoch: 80, train_loss: 1.0213, test_loss: 1.0108, test_f1: 0.4715
 epoch: 81, train_loss: 1.0152, test_loss: 1.0103, test_f1: 0.4432
 epoch: 82, train_loss: 1.0143, test_loss: 1.0242, test_f1: 0.4631
 epoch: 83, train_loss: 1.0063, test_loss: 1.0436, test_f1: 0.4496
 epoch: 84, train_loss: 1.0166, test_loss: 1.0196, test_f1: 0.4628
 epoch: 85, train_loss: 1.0069, test_loss: 1.0093, test_f1: 0.4624
 epoch: 86, train_loss: 1.0156, test_loss: 1.0026, test_f1: 0.4679
 epoch: 87, train_loss: 1.0159, test_loss: 0.9978, test_f1: 0.4531
 epoch: 88, train_loss: 1.0067, test_loss: 1.0129, test_f1: 0.4550
 epoch: 89, train_loss: 1.0108, test_loss: 1.0038, test_f1: 0.4638
 epoch: 90, train_loss: 1.0097, test_loss: 1.0255, test_f1: 0.4548
 epoch: 91, train_loss: 1.0064, test_loss: 1.0094, test_f1: 0.4542
 epoch: 92, train_loss: 1.0022, test_loss: 1.0212, test_f1: 0.4510
 epoch: 93, train_loss: 1.0125, test_loss: 1.0187, test_f1: 0.4684
 epoch: 94, train_loss: 1.0098, test_loss: 1.0364, test_f1: 0.4628
 epoch: 95, train_loss: 0.9996, test_loss: 1.0339, test_f1: 0.4517
 epoch: 96, train_loss: 1.0065, test_loss: 1.0326, test_f1: 0.4519
 epoch: 97, train_loss: 0.9965, test_loss: 1.0136, test_f1: 0.4521
 epoch: 98, train_loss: 1.0027, test_loss: 0.9954, test_f1: 0.4650
 epoch: 99, train_loss: 0.9993, test_loss: 1.0222, test_f1: 0.4739
##################ITERATION #9 ****************************************
 epoch: 0, train_loss: 1.3682, test_loss: 1.2789, test_f1: 0.2283
 epoch: 1, train_loss: 1.2858, test_loss: 1.2556, test_f1: 0.2280
 epoch: 2, train_loss: 1.2682, test_loss: 1.2341, test_f1: 0.2393
 epoch: 3, train_loss: 1.2447, test_loss: 1.2226, test_f1: 0.2558
 epoch: 4, train_loss: 1.2482, test_loss: 1.2038, test_f1: 0.3067
 epoch: 5, train_loss: 1.2230, test_loss: 1.1892, test_f1: 0.3308
 epoch: 6, train_loss: 1.2264, test_loss: 1.1785, test_f1: 0.3454
 epoch: 7, train_loss: 1.2149, test_loss: 1.1685, test_f1: 0.3566
 epoch: 8, train_loss: 1.2031, test_loss: 1.1644, test_f1: 0.3685
 epoch: 9, train_loss: 1.1959, test_loss: 1.1530, test_f1: 0.3734
 epoch: 10, train_loss: 1.1994, test_loss: 1.1473, test_f1: 0.3712
 epoch: 11, train_loss: 1.1802, test_loss: 1.1488, test_f1: 0.3810
 epoch: 12, train_loss: 1.1805, test_loss: 1.1331, test_f1: 0.3979
 epoch: 13, train_loss: 1.1675, test_loss: 1.1245, test_f1: 0.3936
 epoch: 14, train_loss: 1.1680, test_loss: 1.1157, test_f1: 0.3945
 epoch: 15, train_loss: 1.1512, test_loss: 1.1090, test_f1: 0.4070
 epoch: 16, train_loss: 1.1480, test_loss: 1.1148, test_f1: 0.3964
 epoch: 17, train_loss: 1.1498, test_loss: 1.0960, test_f1: 0.4107
 epoch: 18, train_loss: 1.1376, test_loss: 1.0898, test_f1: 0.4113
 epoch: 19, train_loss: 1.1394, test_loss: 1.0945, test_f1: 0.4112
 epoch: 20, train_loss: 1.1429, test_loss: 1.0904, test_f1: 0.3972
 epoch: 21, train_loss: 1.1379, test_loss: 1.0846, test_f1: 0.4294
 epoch: 22, train_loss: 1.1295, test_loss: 1.0838, test_f1: 0.4070
 epoch: 23, train_loss: 1.1266, test_loss: 1.0730, test_f1: 0.4177
 epoch: 24, train_loss: 1.1231, test_loss: 1.0802, test_f1: 0.4250
 epoch: 25, train_loss: 1.1223, test_loss: 1.0680, test_f1: 0.4232
 epoch: 26, train_loss: 1.1168, test_loss: 1.0744, test_f1: 0.4271
 epoch: 27, train_loss: 1.1134, test_loss: 1.0671, test_f1: 0.4416
 epoch: 28, train_loss: 1.1057, test_loss: 1.0581, test_f1: 0.4312
 epoch: 29, train_loss: 1.1003, test_loss: 1.0603, test_f1: 0.4405
 epoch: 30, train_loss: 1.1001, test_loss: 1.0509, test_f1: 0.4309
 epoch: 31, train_loss: 1.1002, test_loss: 1.0475, test_f1: 0.4293
 epoch: 32, train_loss: 1.0915, test_loss: 1.0561, test_f1: 0.4276
 epoch: 33, train_loss: 1.0969, test_loss: 1.0413, test_f1: 0.4423
 epoch: 34, train_loss: 1.1028, test_loss: 1.0410, test_f1: 0.4324
 epoch: 35, train_loss: 1.0888, test_loss: 1.0409, test_f1: 0.4237
 epoch: 36, train_loss: 1.0842, test_loss: 1.0365, test_f1: 0.4461
 epoch: 37, train_loss: 1.0869, test_loss: 1.0287, test_f1: 0.4501
 epoch: 38, train_loss: 1.0802, test_loss: 1.0331, test_f1: 0.4288
 epoch: 39, train_loss: 1.0777, test_loss: 1.0306, test_f1: 0.4466
 epoch: 40, train_loss: 1.0746, test_loss: 1.0277, test_f1: 0.4454
 epoch: 41, train_loss: 1.0677, test_loss: 1.0273, test_f1: 0.4319
 epoch: 42, train_loss: 1.0629, test_loss: 1.0151, test_f1: 0.4350
 epoch: 43, train_loss: 1.0667, test_loss: 1.0296, test_f1: 0.4392
 epoch: 44, train_loss: 1.0538, test_loss: 1.0210, test_f1: 0.4425
 epoch: 45, train_loss: 1.0585, test_loss: 1.0023, test_f1: 0.4646
 epoch: 46, train_loss: 1.0583, test_loss: 1.0451, test_f1: 0.4199
 epoch: 47, train_loss: 1.0518, test_loss: 1.0221, test_f1: 0.4234
 epoch: 48, train_loss: 1.0595, test_loss: 1.0173, test_f1: 0.4437
 epoch: 49, train_loss: 1.0504, test_loss: 1.0132, test_f1: 0.4443
 epoch: 50, train_loss: 1.0387, test_loss: 1.0160, test_f1: 0.4363
 epoch: 51, train_loss: 1.0428, test_loss: 1.0079, test_f1: 0.4455
 epoch: 52, train_loss: 1.0512, test_loss: 1.0053, test_f1: 0.4311
 epoch: 53, train_loss: 1.0349, test_loss: 1.0102, test_f1: 0.4343
 epoch: 54, train_loss: 1.0469, test_loss: 0.9975, test_f1: 0.4447
 epoch: 55, train_loss: 1.0367, test_loss: 1.0129, test_f1: 0.4360
 epoch: 56, train_loss: 1.0422, test_loss: 0.9901, test_f1: 0.4569
 epoch: 57, train_loss: 1.0375, test_loss: 0.9977, test_f1: 0.4417
 epoch: 58, train_loss: 1.0367, test_loss: 1.0106, test_f1: 0.4404
 epoch: 59, train_loss: 1.0426, test_loss: 1.0025, test_f1: 0.4608
 epoch: 60, train_loss: 1.0317, test_loss: 1.0066, test_f1: 0.4383
 epoch: 61, train_loss: 1.0283, test_loss: 0.9928, test_f1: 0.4535
 epoch: 62, train_loss: 1.0363, test_loss: 1.0016, test_f1: 0.4455
 epoch: 63, train_loss: 1.0336, test_loss: 1.0003, test_f1: 0.4374
 epoch: 64, train_loss: 1.0313, test_loss: 0.9922, test_f1: 0.4533
 epoch: 65, train_loss: 1.0281, test_loss: 1.0024, test_f1: 0.4485
 epoch: 66, train_loss: 1.0334, test_loss: 0.9987, test_f1: 0.4647
 epoch: 67, train_loss: 1.0344, test_loss: 1.0137, test_f1: 0.4276
 epoch: 68, train_loss: 1.0273, test_loss: 0.9885, test_f1: 0.4538
 epoch: 69, train_loss: 1.0163, test_loss: 0.9838, test_f1: 0.4484
 epoch: 70, train_loss: 1.0247, test_loss: 0.9964, test_f1: 0.4501
 epoch: 71, train_loss: 1.0259, test_loss: 1.0050, test_f1: 0.4367
 epoch: 72, train_loss: 1.0227, test_loss: 1.0036, test_f1: 0.4336
 epoch: 73, train_loss: 1.0109, test_loss: 0.9899, test_f1: 0.4437
 epoch: 74, train_loss: 1.0141, test_loss: 0.9943, test_f1: 0.4426
 epoch: 75, train_loss: 1.0226, test_loss: 0.9909, test_f1: 0.4370
 epoch: 76, train_loss: 1.0222, test_loss: 0.9868, test_f1: 0.4521
 epoch: 77, train_loss: 1.0233, test_loss: 0.9893, test_f1: 0.4542
 epoch: 78, train_loss: 1.0317, test_loss: 1.0023, test_f1: 0.4339
 epoch: 79, train_loss: 1.0153, test_loss: 0.9910, test_f1: 0.4446
 epoch: 80, train_loss: 1.0216, test_loss: 0.9885, test_f1: 0.4480
 epoch: 81, train_loss: 1.0168, test_loss: 0.9933, test_f1: 0.4517
 epoch: 82, train_loss: 1.0088, test_loss: 0.9874, test_f1: 0.4442
 epoch: 83, train_loss: 1.0073, test_loss: 0.9897, test_f1: 0.4501
 epoch: 84, train_loss: 1.0056, test_loss: 0.9882, test_f1: 0.4550
 epoch: 85, train_loss: 1.0095, test_loss: 0.9728, test_f1: 0.4664
 epoch: 86, train_loss: 1.0087, test_loss: 0.9799, test_f1: 0.4518
 epoch: 87, train_loss: 1.0134, test_loss: 0.9921, test_f1: 0.4488
 epoch: 88, train_loss: 1.0072, test_loss: 0.9914, test_f1: 0.4514
 epoch: 89, train_loss: 1.0053, test_loss: 0.9911, test_f1: 0.4496
 epoch: 90, train_loss: 1.0148, test_loss: 0.9908, test_f1: 0.4379
 epoch: 91, train_loss: 0.9999, test_loss: 0.9872, test_f1: 0.4429
 epoch: 92, train_loss: 0.9960, test_loss: 0.9777, test_f1: 0.4433
 epoch: 93, train_loss: 1.0040, test_loss: 0.9784, test_f1: 0.4453
 epoch: 94, train_loss: 0.9956, test_loss: 0.9841, test_f1: 0.4398
 epoch: 95, train_loss: 0.9934, test_loss: 0.9851, test_f1: 0.4497
 epoch: 96, train_loss: 0.9956, test_loss: 0.9772, test_f1: 0.4474
 epoch: 97, train_loss: 0.9842, test_loss: 1.0039, test_f1: 0.4355
 epoch: 98, train_loss: 1.0000, test_loss: 0.9884, test_f1: 0.4493
 epoch: 99, train_loss: 0.9944, test_loss: 0.9954, test_f1: 0.4430

Training completed in 1270.44 seconds
Best F1: 0.5151 at epoch 88
Mean F1 across iterations: 0.4918  0.0146
========================FINAL RESULTS================================
FEGIN weighted F1: 0.5151  0.0146
python main.py --data ltspice_examples --representation component_component --model FEGIN --layers 5 --hiddens 32 --batch_size 32 --lr 0.0001 --emb_size 512 --epochs 100 --save_appendix component_component_L5_H32_BS32_LR0.0001_E512 --no_val
-----



STDERR:
  File "main.py", line 370, in <module>
    main()
  File "main.py", line 254, in main
    dataset = dataset_class(
  File "/home/philip/projects/ltspice_examples_code_repo/Circuit-Completion-Using-GNNs/component_classification_with_link_prediction_head/evaluation/FEGIN/kernel/circuit_datasets.py", line 15, in __init__
    self.data, self.slices = torch.load(self.processed_paths[0])
  File "/home/philip/.local/lib/python3.8/site-packages/torch/serialization.py", line 1040, in load
    warnings.warn(
  File "/usr/lib/python3.8/warnings.py", line 109, in _showwarnmsg
    sw(msg.message, msg.category, msg.filename, msg.lineno,
  File "main.py", line 47, in warn_with_traceback
    traceback.print_stack(file=log)
/home/philip/projects/ltspice_examples_code_repo/Circuit-Completion-Using-GNNs/component_classification_with_link_prediction_head/evaluation/FEGIN/kernel/circuit_datasets.py:15: FutureWarning: You are using `torch.load` with `weights_only=False` (the current default value), which uses the default pickle module implicitly. It is possible to construct malicious pickle data which will execute arbitrary code during unpickling (See https://github.com/pytorch/pytorch/blob/main/SECURITY.md#untrusted-models for more details). In a future release, the default value for `weights_only` will be flipped to `True`. This limits the functions that could be executed during unpickling. Arbitrary objects will no longer be allowed to be loaded via this mode unless they are explicitly allowlisted by the user via `torch.serialization.add_safe_globals`. We recommend you start setting `weights_only=True` for any use case where you don't have full control of the loaded file. Please open an issue on GitHub for any issues related to this experimental feature.
  self.data, self.slices = torch.load(self.processed_paths[0])
