STDOUT:
Results will be saved in /home/philip/projects/ltspice_examples_code_repo/Circuit-Completion-Using-GNNs/component_classification_with_link_prediction_head/evaluation/FEGIN/results/model_FEGIN_dataset_ltspice_demos
Command line input: python main.py --data ltspice_demos --representation component_pin --model FEGIN --layers 2 --hiddens 128 --batch_size 64 --lr 0.01 --emb_size 512 --epochs 100 --save_appendix component_pin_L2_H128_BS64_LR0.01_E512 --no_val
 is saved.
-----
ltspice_demos - FEGIN
Using 2 layers, 128 hidden units, h = 2
Loading component_pin representation dataset
ENTERED
Training FEGIN on component_pin representation
Train: 1565, Test: 383
##################ITERATION #0 ****************************************
 epoch: 0, train_loss: 1.1886, test_loss: 1.3454, test_f1: 0.1382
 epoch: 1, train_loss: 1.0354, test_loss: 1.1770, test_f1: 0.4158
 epoch: 2, train_loss: 0.9438, test_loss: 2.1579, test_f1: 0.3266
 epoch: 3, train_loss: 0.8645, test_loss: 1.0954, test_f1: 0.5141
 epoch: 4, train_loss: 0.8193, test_loss: 1.0372, test_f1: 0.5678
 epoch: 5, train_loss: 0.8190, test_loss: 1.4003, test_f1: 0.3608
 epoch: 6, train_loss: 0.8191, test_loss: 0.9698, test_f1: 0.5740
 epoch: 7, train_loss: 0.8045, test_loss: 1.6307, test_f1: 0.4945
 epoch: 8, train_loss: 0.7851, test_loss: 0.9772, test_f1: 0.5948
 epoch: 9, train_loss: 0.7930, test_loss: 1.3792, test_f1: 0.3606
 epoch: 10, train_loss: 0.7652, test_loss: 1.3821, test_f1: 0.5766
 epoch: 11, train_loss: 0.7582, test_loss: 0.9442, test_f1: 0.5166
 epoch: 12, train_loss: 0.7238, test_loss: 1.1600, test_f1: 0.4787
 epoch: 13, train_loss: 0.8080, test_loss: 1.1016, test_f1: 0.5431
 epoch: 14, train_loss: 0.7605, test_loss: 1.4689, test_f1: 0.4460
 epoch: 15, train_loss: 0.7348, test_loss: 1.0027, test_f1: 0.6033
 epoch: 16, train_loss: 0.7432, test_loss: 1.0632, test_f1: 0.4989
 epoch: 17, train_loss: 0.7383, test_loss: 0.9949, test_f1: 0.5538
 epoch: 18, train_loss: 0.6871, test_loss: 1.2175, test_f1: 0.5545
 epoch: 19, train_loss: 0.6686, test_loss: 0.9900, test_f1: 0.6488
 epoch: 20, train_loss: 0.6669, test_loss: 1.0329, test_f1: 0.6191
 epoch: 21, train_loss: 0.6393, test_loss: 1.4454, test_f1: 0.5511
 epoch: 22, train_loss: 0.6673, test_loss: 1.3119, test_f1: 0.5874
 epoch: 23, train_loss: 0.6359, test_loss: 1.1100, test_f1: 0.6313
 epoch: 24, train_loss: 0.6318, test_loss: 1.2620, test_f1: 0.5748
 epoch: 25, train_loss: 0.6367, test_loss: 0.9808, test_f1: 0.6282
 epoch: 26, train_loss: 0.6296, test_loss: 1.0385, test_f1: 0.6155
 epoch: 27, train_loss: 0.5815, test_loss: 1.4477, test_f1: 0.5987
 epoch: 28, train_loss: 0.5923, test_loss: 1.1389, test_f1: 0.6459
 epoch: 29, train_loss: 0.6103, test_loss: 1.2723, test_f1: 0.5245
 epoch: 30, train_loss: 0.5389, test_loss: 1.4576, test_f1: 0.5801
 epoch: 31, train_loss: 0.5717, test_loss: 1.6623, test_f1: 0.5552
 epoch: 32, train_loss: 0.5339, test_loss: 1.4327, test_f1: 0.5759
 epoch: 33, train_loss: 0.5676, test_loss: 1.2787, test_f1: 0.5651
 epoch: 34, train_loss: 0.6041, test_loss: 1.1843, test_f1: 0.6123
 epoch: 35, train_loss: 0.5459, test_loss: 1.3022, test_f1: 0.6098
 epoch: 36, train_loss: 0.5339, test_loss: 1.5726, test_f1: 0.5811
 epoch: 37, train_loss: 0.5088, test_loss: 1.3723, test_f1: 0.6399
 epoch: 38, train_loss: 0.5134, test_loss: 1.4223, test_f1: 0.5711
 epoch: 39, train_loss: 0.5002, test_loss: 1.3158, test_f1: 0.5554
 epoch: 40, train_loss: 0.5407, test_loss: 1.8353, test_f1: 0.5698
 epoch: 41, train_loss: 0.5068, test_loss: 1.6169, test_f1: 0.5245
 epoch: 42, train_loss: 0.4694, test_loss: 1.4405, test_f1: 0.5745
 epoch: 43, train_loss: 0.5098, test_loss: 1.6301, test_f1: 0.5766
 epoch: 44, train_loss: 0.4874, test_loss: 1.8069, test_f1: 0.5538
 epoch: 45, train_loss: 0.5088, test_loss: 1.6445, test_f1: 0.5891
 epoch: 46, train_loss: 0.4566, test_loss: 1.4011, test_f1: 0.6037
 epoch: 47, train_loss: 0.4543, test_loss: 1.4938, test_f1: 0.6048
 epoch: 48, train_loss: 0.4388, test_loss: 1.4913, test_f1: 0.6123
 epoch: 49, train_loss: 0.4156, test_loss: 1.4044, test_f1: 0.6575
 epoch: 50, train_loss: 0.4171, test_loss: 1.8057, test_f1: 0.6179
 epoch: 51, train_loss: 0.3651, test_loss: 1.6931, test_f1: 0.5914
 epoch: 52, train_loss: 0.3579, test_loss: 1.7776, test_f1: 0.6171
 epoch: 53, train_loss: 0.3237, test_loss: 1.9376, test_f1: 0.6077
 epoch: 54, train_loss: 0.3264, test_loss: 2.1870, test_f1: 0.6231
 epoch: 55, train_loss: 0.2988, test_loss: 2.0627, test_f1: 0.6242
 epoch: 56, train_loss: 0.2695, test_loss: 2.0478, test_f1: 0.6156
 epoch: 57, train_loss: 0.3001, test_loss: 2.2098, test_f1: 0.5770
 epoch: 58, train_loss: 0.2998, test_loss: 2.1481, test_f1: 0.5989
 epoch: 59, train_loss: 0.3103, test_loss: 2.0183, test_f1: 0.6139
 epoch: 60, train_loss: 0.3507, test_loss: 1.9526, test_f1: 0.6049
 epoch: 61, train_loss: 0.2753, test_loss: 2.2319, test_f1: 0.5893
 epoch: 62, train_loss: 0.2918, test_loss: 2.3331, test_f1: 0.6286
 epoch: 63, train_loss: 0.2359, test_loss: 2.5867, test_f1: 0.6339
 epoch: 64, train_loss: 0.2695, test_loss: 2.1589, test_f1: 0.6133
 epoch: 65, train_loss: 0.2556, test_loss: 2.4849, test_f1: 0.6158
 epoch: 66, train_loss: 0.2772, test_loss: 2.4865, test_f1: 0.6033
 epoch: 67, train_loss: 0.2653, test_loss: 2.2740, test_f1: 0.6115
 epoch: 68, train_loss: 0.2559, test_loss: 2.7451, test_f1: 0.6392
 epoch: 69, train_loss: 0.2295, test_loss: 2.9611, test_f1: 0.5995
 epoch: 70, train_loss: 0.2222, test_loss: 2.6588, test_f1: 0.6156
 epoch: 71, train_loss: 0.2302, test_loss: 2.3347, test_f1: 0.6246
 epoch: 72, train_loss: 0.2065, test_loss: 2.5370, test_f1: 0.6413
 epoch: 73, train_loss: 0.2455, test_loss: 2.5773, test_f1: 0.6166
 epoch: 74, train_loss: 0.2255, test_loss: 2.7520, test_f1: 0.6471
 epoch: 75, train_loss: 0.2711, test_loss: 2.1027, test_f1: 0.6469
 epoch: 76, train_loss: 0.1825, test_loss: 2.5819, test_f1: 0.6395
 epoch: 77, train_loss: 0.2186, test_loss: 2.4885, test_f1: 0.6241
 epoch: 78, train_loss: 0.1799, test_loss: 2.8014, test_f1: 0.6473
 epoch: 79, train_loss: 0.1921, test_loss: 2.5063, test_f1: 0.6105
 epoch: 80, train_loss: 0.2254, test_loss: 2.7556, test_f1: 0.5967
 epoch: 81, train_loss: 0.2122, test_loss: 2.7512, test_f1: 0.6402
 epoch: 82, train_loss: 0.1757, test_loss: 2.5808, test_f1: 0.6282
 epoch: 83, train_loss: 0.1930, test_loss: 2.9035, test_f1: 0.6632
 epoch: 84, train_loss: 0.2156, test_loss: 2.1441, test_f1: 0.6571
 epoch: 85, train_loss: 0.2117, test_loss: 2.3345, test_f1: 0.6595
 epoch: 86, train_loss: 0.1877, test_loss: 2.3632, test_f1: 0.6657
 epoch: 87, train_loss: 0.1868, test_loss: 2.3457, test_f1: 0.6607
 epoch: 88, train_loss: 0.1867, test_loss: 2.6754, test_f1: 0.6221
 epoch: 89, train_loss: 0.2314, test_loss: 2.4076, test_f1: 0.6211
 epoch: 90, train_loss: 0.1837, test_loss: 2.8490, test_f1: 0.6266
 epoch: 91, train_loss: 0.1702, test_loss: 2.9809, test_f1: 0.5913
 epoch: 92, train_loss: 0.1756, test_loss: 2.8901, test_f1: 0.6171
 epoch: 93, train_loss: 0.1816, test_loss: 2.9419, test_f1: 0.6345
 epoch: 94, train_loss: 0.1833, test_loss: 2.8692, test_f1: 0.6149
 epoch: 95, train_loss: 0.1676, test_loss: 2.7145, test_f1: 0.5990
 epoch: 96, train_loss: 0.2066, test_loss: 3.3423, test_f1: 0.6315
 epoch: 97, train_loss: 0.1407, test_loss: 2.9656, test_f1: 0.6097
 epoch: 98, train_loss: 0.1876, test_loss: 3.0374, test_f1: 0.5861
 epoch: 99, train_loss: 0.1898, test_loss: 2.5272, test_f1: 0.6422
##################ITERATION #1 ****************************************
 epoch: 0, train_loss: 1.2569, test_loss: 1.3494, test_f1: 0.2976
 epoch: 1, train_loss: 1.0319, test_loss: 1.1073, test_f1: 0.5227
 epoch: 2, train_loss: 0.9557, test_loss: 1.1811, test_f1: 0.5293
 epoch: 3, train_loss: 0.8854, test_loss: 1.2947, test_f1: 0.3788
 epoch: 4, train_loss: 0.9079, test_loss: 0.9693, test_f1: 0.5623
 epoch: 5, train_loss: 0.8256, test_loss: 1.0810, test_f1: 0.5545
 epoch: 6, train_loss: 0.8147, test_loss: 1.0053, test_f1: 0.5460
 epoch: 7, train_loss: 0.7998, test_loss: 1.0195, test_f1: 0.5900
 epoch: 8, train_loss: 0.7822, test_loss: 1.0294, test_f1: 0.5939
 epoch: 9, train_loss: 0.7877, test_loss: 1.1218, test_f1: 0.5191
 epoch: 10, train_loss: 0.7354, test_loss: 0.9706, test_f1: 0.6257
 epoch: 11, train_loss: 0.7092, test_loss: 0.9497, test_f1: 0.6095
 epoch: 12, train_loss: 0.7401, test_loss: 0.8969, test_f1: 0.6056
 epoch: 13, train_loss: 0.7101, test_loss: 1.3165, test_f1: 0.5996
 epoch: 14, train_loss: 0.6824, test_loss: 0.9368, test_f1: 0.5904
 epoch: 15, train_loss: 0.6672, test_loss: 0.8851, test_f1: 0.6489
 epoch: 16, train_loss: 0.6812, test_loss: 1.0058, test_f1: 0.6017
 epoch: 17, train_loss: 0.6915, test_loss: 1.2113, test_f1: 0.5230
 epoch: 18, train_loss: 0.6576, test_loss: 0.9752, test_f1: 0.6590
 epoch: 19, train_loss: 0.6428, test_loss: 1.0127, test_f1: 0.6244
 epoch: 20, train_loss: 0.6479, test_loss: 0.9880, test_f1: 0.6088
 epoch: 21, train_loss: 0.6192, test_loss: 1.0912, test_f1: 0.6179
 epoch: 22, train_loss: 0.6202, test_loss: 1.2669, test_f1: 0.5508
 epoch: 23, train_loss: 0.6542, test_loss: 1.0510, test_f1: 0.6183
 epoch: 24, train_loss: 0.6286, test_loss: 1.1299, test_f1: 0.6191
 epoch: 25, train_loss: 0.5984, test_loss: 1.3764, test_f1: 0.5332
 epoch: 26, train_loss: 0.5774, test_loss: 1.0522, test_f1: 0.6152
 epoch: 27, train_loss: 0.5822, test_loss: 1.1945, test_f1: 0.6365
 epoch: 28, train_loss: 0.5521, test_loss: 1.1937, test_f1: 0.6466
 epoch: 29, train_loss: 0.5438, test_loss: 1.3960, test_f1: 0.5920
 epoch: 30, train_loss: 0.5488, test_loss: 1.2291, test_f1: 0.5989
 epoch: 31, train_loss: 0.5392, test_loss: 1.0791, test_f1: 0.5727
 epoch: 32, train_loss: 0.5169, test_loss: 1.8446, test_f1: 0.5298
 epoch: 33, train_loss: 0.5352, test_loss: 1.1130, test_f1: 0.6071
 epoch: 34, train_loss: 0.5471, test_loss: 1.1577, test_f1: 0.5923
 epoch: 35, train_loss: 0.5559, test_loss: 1.2880, test_f1: 0.6104
 epoch: 36, train_loss: 0.4875, test_loss: 1.3110, test_f1: 0.5617
 epoch: 37, train_loss: 0.5196, test_loss: 1.5558, test_f1: 0.5553
 epoch: 38, train_loss: 0.4827, test_loss: 1.3876, test_f1: 0.5979
 epoch: 39, train_loss: 0.5411, test_loss: 1.3521, test_f1: 0.5676
 epoch: 40, train_loss: 0.5212, test_loss: 1.4081, test_f1: 0.5770
 epoch: 41, train_loss: 0.4709, test_loss: 1.2634, test_f1: 0.5434
 epoch: 42, train_loss: 0.4888, test_loss: 1.2223, test_f1: 0.6076
 epoch: 43, train_loss: 0.4671, test_loss: 1.8437, test_f1: 0.6005
 epoch: 44, train_loss: 0.4804, test_loss: 1.3745, test_f1: 0.6088
 epoch: 45, train_loss: 0.5211, test_loss: 1.4512, test_f1: 0.5977
 epoch: 46, train_loss: 0.4607, test_loss: 1.3690, test_f1: 0.6207
 epoch: 47, train_loss: 0.4396, test_loss: 1.3551, test_f1: 0.6537
 epoch: 48, train_loss: 0.4319, test_loss: 1.4468, test_f1: 0.6482
 epoch: 49, train_loss: 0.4247, test_loss: 1.1582, test_f1: 0.6491
 epoch: 50, train_loss: 0.4302, test_loss: 1.4763, test_f1: 0.6427
 epoch: 51, train_loss: 0.3649, test_loss: 1.4127, test_f1: 0.6319
 epoch: 52, train_loss: 0.3299, test_loss: 1.5819, test_f1: 0.5991
 epoch: 53, train_loss: 0.3017, test_loss: 1.6142, test_f1: 0.6088
 epoch: 54, train_loss: 0.3233, test_loss: 1.7759, test_f1: 0.6251
 epoch: 55, train_loss: 0.3112, test_loss: 1.8205, test_f1: 0.6049
 epoch: 56, train_loss: 0.2972, test_loss: 1.7929, test_f1: 0.6510
 epoch: 57, train_loss: 0.2907, test_loss: 2.2729, test_f1: 0.5805
 epoch: 58, train_loss: 0.2934, test_loss: 1.8672, test_f1: 0.6201
 epoch: 59, train_loss: 0.2584, test_loss: 2.0964, test_f1: 0.6081
 epoch: 60, train_loss: 0.2665, test_loss: 1.9873, test_f1: 0.6427
 epoch: 61, train_loss: 0.2851, test_loss: 1.9053, test_f1: 0.6086
 epoch: 62, train_loss: 0.2613, test_loss: 1.9771, test_f1: 0.6631
 epoch: 63, train_loss: 0.2681, test_loss: 1.8251, test_f1: 0.6594
 epoch: 64, train_loss: 0.2359, test_loss: 2.1686, test_f1: 0.6564
 epoch: 65, train_loss: 0.2541, test_loss: 2.2033, test_f1: 0.6063
 epoch: 66, train_loss: 0.2762, test_loss: 2.0453, test_f1: 0.6364
 epoch: 67, train_loss: 0.2916, test_loss: 1.7753, test_f1: 0.6360
 epoch: 68, train_loss: 0.2598, test_loss: 2.0790, test_f1: 0.6261
 epoch: 69, train_loss: 0.2065, test_loss: 2.1185, test_f1: 0.6643
 epoch: 70, train_loss: 0.2195, test_loss: 2.4911, test_f1: 0.6294
 epoch: 71, train_loss: 0.2369, test_loss: 2.5081, test_f1: 0.6175
 epoch: 72, train_loss: 0.2400, test_loss: 1.9986, test_f1: 0.6608
 epoch: 73, train_loss: 0.1937, test_loss: 2.2650, test_f1: 0.6190
 epoch: 74, train_loss: 0.2096, test_loss: 2.8285, test_f1: 0.6310
 epoch: 75, train_loss: 0.2505, test_loss: 2.2386, test_f1: 0.6563
 epoch: 76, train_loss: 0.2109, test_loss: 2.2696, test_f1: 0.6333
 epoch: 77, train_loss: 0.1907, test_loss: 2.4223, test_f1: 0.6589
 epoch: 78, train_loss: 0.2352, test_loss: 2.2960, test_f1: 0.5753
 epoch: 79, train_loss: 0.2235, test_loss: 2.1524, test_f1: 0.6225
 epoch: 80, train_loss: 0.1885, test_loss: 2.1553, test_f1: 0.6333
 epoch: 81, train_loss: 0.2176, test_loss: 2.1970, test_f1: 0.6610
 epoch: 82, train_loss: 0.1946, test_loss: 2.5097, test_f1: 0.5989
 epoch: 83, train_loss: 0.2203, test_loss: 2.0238, test_f1: 0.6546
 epoch: 84, train_loss: 0.1712, test_loss: 2.4169, test_f1: 0.6618
 epoch: 85, train_loss: 0.1685, test_loss: 2.6733, test_f1: 0.6151
 epoch: 86, train_loss: 0.1924, test_loss: 2.4412, test_f1: 0.6147
 epoch: 87, train_loss: 0.2055, test_loss: 2.5203, test_f1: 0.6402
 epoch: 88, train_loss: 0.2067, test_loss: 2.4227, test_f1: 0.6712
 epoch: 89, train_loss: 0.2160, test_loss: 2.2624, test_f1: 0.6773
 epoch: 90, train_loss: 0.1417, test_loss: 2.5501, test_f1: 0.6381
 epoch: 91, train_loss: 0.1405, test_loss: 2.7506, test_f1: 0.6201
 epoch: 92, train_loss: 0.1364, test_loss: 2.7228, test_f1: 0.6340
 epoch: 93, train_loss: 0.1839, test_loss: 2.5968, test_f1: 0.6249
 epoch: 94, train_loss: 0.1446, test_loss: 2.5783, test_f1: 0.6291
 epoch: 95, train_loss: 0.1744, test_loss: 2.6015, test_f1: 0.6343
 epoch: 96, train_loss: 0.1778, test_loss: 2.6693, test_f1: 0.6282
 epoch: 97, train_loss: 0.1447, test_loss: 2.8069, test_f1: 0.6127
 epoch: 98, train_loss: 0.1490, test_loss: 2.7046, test_f1: 0.6591
 epoch: 99, train_loss: 0.1848, test_loss: 2.3109, test_f1: 0.6516
##################ITERATION #2 ****************************************
 epoch: 0, train_loss: 1.2088, test_loss: 1.6199, test_f1: 0.1429
 epoch: 1, train_loss: 1.0526, test_loss: 1.2366, test_f1: 0.4143
 epoch: 2, train_loss: 0.9850, test_loss: 1.4935, test_f1: 0.2970
 epoch: 3, train_loss: 0.9590, test_loss: 1.2205, test_f1: 0.4546
 epoch: 4, train_loss: 0.9312, test_loss: 1.0446, test_f1: 0.4812
 epoch: 5, train_loss: 0.8860, test_loss: 1.0305, test_f1: 0.5663
 epoch: 6, train_loss: 0.8354, test_loss: 1.1718, test_f1: 0.5302
 epoch: 7, train_loss: 0.8410, test_loss: 1.5434, test_f1: 0.4118
 epoch: 8, train_loss: 0.8195, test_loss: 1.3191, test_f1: 0.5113
 epoch: 9, train_loss: 0.8648, test_loss: 1.5592, test_f1: 0.3702
 epoch: 10, train_loss: 0.8352, test_loss: 1.1601, test_f1: 0.5100
 epoch: 11, train_loss: 0.8020, test_loss: 1.2485, test_f1: 0.4575
 epoch: 12, train_loss: 0.7824, test_loss: 1.2078, test_f1: 0.5005
 epoch: 13, train_loss: 0.7850, test_loss: 1.0071, test_f1: 0.5235
 epoch: 14, train_loss: 0.7834, test_loss: 1.1819, test_f1: 0.4391
 epoch: 15, train_loss: 0.7842, test_loss: 1.1812, test_f1: 0.5834
 epoch: 16, train_loss: 0.7696, test_loss: 1.1466, test_f1: 0.5441
 epoch: 17, train_loss: 0.7550, test_loss: 1.2872, test_f1: 0.4523
 epoch: 18, train_loss: 0.7605, test_loss: 1.6075, test_f1: 0.5153
 epoch: 19, train_loss: 0.7341, test_loss: 1.0909, test_f1: 0.5925
 epoch: 20, train_loss: 0.7302, test_loss: 1.3472, test_f1: 0.4995
 epoch: 21, train_loss: 0.7306, test_loss: 1.3494, test_f1: 0.5070
 epoch: 22, train_loss: 0.7132, test_loss: 1.0926, test_f1: 0.5796
 epoch: 23, train_loss: 0.7526, test_loss: 1.1233, test_f1: 0.5019
 epoch: 24, train_loss: 0.7250, test_loss: 1.0767, test_f1: 0.5972
 epoch: 25, train_loss: 0.7092, test_loss: 1.6854, test_f1: 0.4871
 epoch: 26, train_loss: 0.6995, test_loss: 1.1303, test_f1: 0.6264
 epoch: 27, train_loss: 0.6984, test_loss: 1.3648, test_f1: 0.5235
 epoch: 28, train_loss: 0.6954, test_loss: 1.0527, test_f1: 0.5190
 epoch: 29, train_loss: 0.7130, test_loss: 1.0270, test_f1: 0.5946
 epoch: 30, train_loss: 0.6753, test_loss: 1.3317, test_f1: 0.5386
 epoch: 31, train_loss: 0.6696, test_loss: 1.5146, test_f1: 0.5765
 epoch: 32, train_loss: 0.6698, test_loss: 1.0284, test_f1: 0.6192
 epoch: 33, train_loss: 0.6519, test_loss: 1.4284, test_f1: 0.6311
 epoch: 34, train_loss: 0.6630, test_loss: 1.9172, test_f1: 0.5239
 epoch: 35, train_loss: 0.6587, test_loss: 1.3211, test_f1: 0.5474
 epoch: 36, train_loss: 0.6694, test_loss: 0.9996, test_f1: 0.6563
 epoch: 37, train_loss: 0.6442, test_loss: 1.2178, test_f1: 0.6350
 epoch: 38, train_loss: 0.6345, test_loss: 1.1295, test_f1: 0.5714
 epoch: 39, train_loss: 0.6325, test_loss: 1.1722, test_f1: 0.6202
 epoch: 40, train_loss: 0.6273, test_loss: 1.4501, test_f1: 0.5174
 epoch: 41, train_loss: 0.6501, test_loss: 1.0534, test_f1: 0.6566
 epoch: 42, train_loss: 0.6092, test_loss: 1.1242, test_f1: 0.5766
 epoch: 43, train_loss: 0.6245, test_loss: 1.4030, test_f1: 0.5821
 epoch: 44, train_loss: 0.6280, test_loss: 1.5609, test_f1: 0.6186
 epoch: 45, train_loss: 0.6442, test_loss: 1.1737, test_f1: 0.6090
 epoch: 46, train_loss: 0.6219, test_loss: 1.3684, test_f1: 0.4808
 epoch: 47, train_loss: 0.6103, test_loss: 0.9580, test_f1: 0.6582
 epoch: 48, train_loss: 0.5870, test_loss: 1.2290, test_f1: 0.5955
 epoch: 49, train_loss: 0.5957, test_loss: 1.2485, test_f1: 0.5576
 epoch: 50, train_loss: 0.5644, test_loss: 1.1784, test_f1: 0.6275
 epoch: 51, train_loss: 0.5471, test_loss: 1.0599, test_f1: 0.6667
 epoch: 52, train_loss: 0.5080, test_loss: 1.6579, test_f1: 0.5478
 epoch: 53, train_loss: 0.5197, test_loss: 1.1872, test_f1: 0.6056
 epoch: 54, train_loss: 0.4719, test_loss: 1.5833, test_f1: 0.6306
 epoch: 55, train_loss: 0.4812, test_loss: 1.6922, test_f1: 0.6001
 epoch: 56, train_loss: 0.5122, test_loss: 1.1571, test_f1: 0.6200
 epoch: 57, train_loss: 0.4864, test_loss: 1.6894, test_f1: 0.6092
 epoch: 58, train_loss: 0.4720, test_loss: 1.2956, test_f1: 0.6271
 epoch: 59, train_loss: 0.5020, test_loss: 1.2366, test_f1: 0.5630
 epoch: 60, train_loss: 0.4660, test_loss: 1.5559, test_f1: 0.6351
 epoch: 61, train_loss: 0.4281, test_loss: 1.5295, test_f1: 0.5837
 epoch: 62, train_loss: 0.4281, test_loss: 1.4731, test_f1: 0.6024
 epoch: 63, train_loss: 0.4657, test_loss: 1.6885, test_f1: 0.6079
 epoch: 64, train_loss: 0.4604, test_loss: 1.1327, test_f1: 0.6324
 epoch: 65, train_loss: 0.3947, test_loss: 1.4414, test_f1: 0.6347
 epoch: 66, train_loss: 0.4157, test_loss: 1.2471, test_f1: 0.6318
 epoch: 67, train_loss: 0.4032, test_loss: 1.7781, test_f1: 0.6044
 epoch: 68, train_loss: 0.4003, test_loss: 1.7551, test_f1: 0.5708
 epoch: 69, train_loss: 0.4055, test_loss: 1.4593, test_f1: 0.5952
 epoch: 70, train_loss: 0.3914, test_loss: 1.9450, test_f1: 0.6069
 epoch: 71, train_loss: 0.4635, test_loss: 1.4172, test_f1: 0.6178
 epoch: 72, train_loss: 0.3847, test_loss: 1.8971, test_f1: 0.5864
 epoch: 73, train_loss: 0.3867, test_loss: 1.5114, test_f1: 0.5804
 epoch: 74, train_loss: 0.3629, test_loss: 1.2339, test_f1: 0.6387
 epoch: 75, train_loss: 0.3932, test_loss: 1.7180, test_f1: 0.6245
 epoch: 76, train_loss: 0.3240, test_loss: 1.8034, test_f1: 0.6322
 epoch: 77, train_loss: 0.3324, test_loss: 1.8170, test_f1: 0.5851
 epoch: 78, train_loss: 0.3676, test_loss: 2.1645, test_f1: 0.5496
 epoch: 79, train_loss: 0.3617, test_loss: 1.9706, test_f1: 0.5879
 epoch: 80, train_loss: 0.3512, test_loss: 1.9377, test_f1: 0.6351
 epoch: 81, train_loss: 0.3166, test_loss: 1.6362, test_f1: 0.5999
 epoch: 82, train_loss: 0.3403, test_loss: 1.6843, test_f1: 0.6500
 epoch: 83, train_loss: 0.3204, test_loss: 1.6991, test_f1: 0.6035
 epoch: 84, train_loss: 0.3156, test_loss: 2.0247, test_f1: 0.5561
 epoch: 85, train_loss: 0.2924, test_loss: 1.8971, test_f1: 0.5807
 epoch: 86, train_loss: 0.3002, test_loss: 2.1935, test_f1: 0.6038
 epoch: 87, train_loss: 0.2898, test_loss: 1.8745, test_f1: 0.5918
 epoch: 88, train_loss: 0.3069, test_loss: 2.3228, test_f1: 0.5917
 epoch: 89, train_loss: 0.3396, test_loss: 1.5776, test_f1: 0.6145
 epoch: 90, train_loss: 0.3094, test_loss: 1.5874, test_f1: 0.6465
 epoch: 91, train_loss: 0.3003, test_loss: 1.9902, test_f1: 0.5884
 epoch: 92, train_loss: 0.2880, test_loss: 2.4870, test_f1: 0.5690
 epoch: 93, train_loss: 0.2891, test_loss: 1.5610, test_f1: 0.6157
 epoch: 94, train_loss: 0.2943, test_loss: 1.9949, test_f1: 0.6003
 epoch: 95, train_loss: 0.2840, test_loss: 1.7391, test_f1: 0.6395
 epoch: 96, train_loss: 0.2755, test_loss: 1.9167, test_f1: 0.5863
 epoch: 97, train_loss: 0.3007, test_loss: 1.7621, test_f1: 0.6312
 epoch: 98, train_loss: 0.2358, test_loss: 2.1683, test_f1: 0.5866
 epoch: 99, train_loss: 0.2777, test_loss: 1.8730, test_f1: 0.6062
##################ITERATION #3 ****************************************
 epoch: 0, train_loss: 1.1979, test_loss: 1.1418, test_f1: 0.3701
 epoch: 1, train_loss: 1.0001, test_loss: 1.1734, test_f1: 0.4890
 epoch: 2, train_loss: 0.9095, test_loss: 1.1486, test_f1: 0.4226
 epoch: 3, train_loss: 0.8515, test_loss: 1.9752, test_f1: 0.4055
 epoch: 4, train_loss: 0.8668, test_loss: 1.1208, test_f1: 0.5491
 epoch: 5, train_loss: 0.8091, test_loss: 1.0773, test_f1: 0.4834
 epoch: 6, train_loss: 0.8051, test_loss: 1.1839, test_f1: 0.5190
 epoch: 7, train_loss: 0.7854, test_loss: 1.2210, test_f1: 0.4393
 epoch: 8, train_loss: 0.8019, test_loss: 3.8870, test_f1: 0.2569
 epoch: 9, train_loss: 0.8085, test_loss: 1.0616, test_f1: 0.5794
 epoch: 10, train_loss: 0.7737, test_loss: 1.0081, test_f1: 0.5681
 epoch: 11, train_loss: 0.7895, test_loss: 1.3179, test_f1: 0.4303
 epoch: 12, train_loss: 0.7477, test_loss: 1.0391, test_f1: 0.5144
 epoch: 13, train_loss: 0.7347, test_loss: 1.3440, test_f1: 0.4219
 epoch: 14, train_loss: 0.7415, test_loss: 1.1049, test_f1: 0.5477
 epoch: 15, train_loss: 0.7297, test_loss: 1.0740, test_f1: 0.4979
 epoch: 16, train_loss: 0.7706, test_loss: 1.2089, test_f1: 0.5282
 epoch: 17, train_loss: 0.7583, test_loss: 1.0521, test_f1: 0.6092
 epoch: 18, train_loss: 0.7440, test_loss: 1.0004, test_f1: 0.6012
 epoch: 19, train_loss: 0.7029, test_loss: 1.2551, test_f1: 0.6274
 epoch: 20, train_loss: 0.7091, test_loss: 1.1265, test_f1: 0.5933
 epoch: 21, train_loss: 0.6967, test_loss: 1.0637, test_f1: 0.6098
 epoch: 22, train_loss: 0.7098, test_loss: 1.0656, test_f1: 0.5459
 epoch: 23, train_loss: 0.7349, test_loss: 1.1622, test_f1: 0.6325
 epoch: 24, train_loss: 0.6844, test_loss: 1.0583, test_f1: 0.6686
 epoch: 25, train_loss: 0.6646, test_loss: 1.0397, test_f1: 0.6274
 epoch: 26, train_loss: 0.6503, test_loss: 1.0119, test_f1: 0.5746
 epoch: 27, train_loss: 0.6720, test_loss: 1.7248, test_f1: 0.6345
 epoch: 28, train_loss: 0.6421, test_loss: 1.1211, test_f1: 0.6052
 epoch: 29, train_loss: 0.6340, test_loss: 1.2285, test_f1: 0.6336
 epoch: 30, train_loss: 0.6194, test_loss: 1.1899, test_f1: 0.6311
 epoch: 31, train_loss: 0.6290, test_loss: 1.4786, test_f1: 0.6051
 epoch: 32, train_loss: 0.6296, test_loss: 1.4284, test_f1: 0.5939
 epoch: 33, train_loss: 0.6239, test_loss: 1.1868, test_f1: 0.6374
 epoch: 34, train_loss: 0.6009, test_loss: 1.1979, test_f1: 0.6296
 epoch: 35, train_loss: 0.5591, test_loss: 1.2304, test_f1: 0.6116
 epoch: 36, train_loss: 0.5596, test_loss: 1.5191, test_f1: 0.5497
 epoch: 37, train_loss: 0.5846, test_loss: 1.9159, test_f1: 0.5181
 epoch: 38, train_loss: 0.5437, test_loss: 1.2460, test_f1: 0.6150
 epoch: 39, train_loss: 0.5206, test_loss: 1.6668, test_f1: 0.6008
 epoch: 40, train_loss: 0.5222, test_loss: 1.7464, test_f1: 0.6039
 epoch: 41, train_loss: 0.4964, test_loss: 1.5409, test_f1: 0.5988
 epoch: 42, train_loss: 0.5500, test_loss: 1.4734, test_f1: 0.5754
 epoch: 43, train_loss: 0.5728, test_loss: 1.4207, test_f1: 0.5830
 epoch: 44, train_loss: 0.5092, test_loss: 1.2723, test_f1: 0.6569
 epoch: 45, train_loss: 0.5080, test_loss: 1.5556, test_f1: 0.6188
 epoch: 46, train_loss: 0.4882, test_loss: 1.7528, test_f1: 0.6289
 epoch: 47, train_loss: 0.5515, test_loss: 1.4059, test_f1: 0.5971
 epoch: 48, train_loss: 0.4786, test_loss: 1.3988, test_f1: 0.6199
 epoch: 49, train_loss: 0.4567, test_loss: 1.2923, test_f1: 0.6309
 epoch: 50, train_loss: 0.4771, test_loss: 1.0867, test_f1: 0.6571
 epoch: 51, train_loss: 0.4100, test_loss: 1.4923, test_f1: 0.5914
 epoch: 52, train_loss: 0.3750, test_loss: 1.4457, test_f1: 0.6355
 epoch: 53, train_loss: 0.3937, test_loss: 1.5144, test_f1: 0.6423
 epoch: 54, train_loss: 0.3548, test_loss: 1.6500, test_f1: 0.6340
 epoch: 55, train_loss: 0.3711, test_loss: 1.5732, test_f1: 0.6096
 epoch: 56, train_loss: 0.3713, test_loss: 1.5807, test_f1: 0.6260
 epoch: 57, train_loss: 0.3657, test_loss: 1.5726, test_f1: 0.6424
 epoch: 58, train_loss: 0.3487, test_loss: 1.8333, test_f1: 0.6144
 epoch: 59, train_loss: 0.3400, test_loss: 1.7215, test_f1: 0.5832
 epoch: 60, train_loss: 0.3308, test_loss: 1.6434, test_f1: 0.6362
 epoch: 61, train_loss: 0.2999, test_loss: 1.9355, test_f1: 0.6076
 epoch: 62, train_loss: 0.3275, test_loss: 1.9802, test_f1: 0.6205
 epoch: 63, train_loss: 0.3230, test_loss: 1.8253, test_f1: 0.6221
 epoch: 64, train_loss: 0.2926, test_loss: 2.3069, test_f1: 0.5865
 epoch: 65, train_loss: 0.2730, test_loss: 1.7973, test_f1: 0.6601
 epoch: 66, train_loss: 0.3026, test_loss: 1.7412, test_f1: 0.6475
 epoch: 67, train_loss: 0.2825, test_loss: 2.2184, test_f1: 0.6125
 epoch: 68, train_loss: 0.2668, test_loss: 1.7427, test_f1: 0.6679
 epoch: 69, train_loss: 0.2645, test_loss: 1.9747, test_f1: 0.6280
 epoch: 70, train_loss: 0.2679, test_loss: 1.9723, test_f1: 0.6024
 epoch: 71, train_loss: 0.2411, test_loss: 1.9378, test_f1: 0.6115
 epoch: 72, train_loss: 0.2492, test_loss: 2.3965, test_f1: 0.6117
 epoch: 73, train_loss: 0.2408, test_loss: 2.1732, test_f1: 0.6078
 epoch: 74, train_loss: 0.2554, test_loss: 3.0475, test_f1: 0.5499
 epoch: 75, train_loss: 0.2313, test_loss: 2.0759, test_f1: 0.6554
 epoch: 76, train_loss: 0.2559, test_loss: 2.7716, test_f1: 0.6254
 epoch: 77, train_loss: 0.2448, test_loss: 2.6510, test_f1: 0.6427
 epoch: 78, train_loss: 0.2419, test_loss: 2.4550, test_f1: 0.6449
 epoch: 79, train_loss: 0.2624, test_loss: 2.2429, test_f1: 0.6300
 epoch: 80, train_loss: 0.2423, test_loss: 2.4780, test_f1: 0.6355
 epoch: 81, train_loss: 0.2457, test_loss: 2.4678, test_f1: 0.6208
 epoch: 82, train_loss: 0.2209, test_loss: 2.5435, test_f1: 0.6076
 epoch: 83, train_loss: 0.2362, test_loss: 2.3402, test_f1: 0.6326
 epoch: 84, train_loss: 0.1992, test_loss: 2.6001, test_f1: 0.6556
 epoch: 85, train_loss: 0.2290, test_loss: 2.3585, test_f1: 0.6305
 epoch: 86, train_loss: 0.1935, test_loss: 2.3924, test_f1: 0.6155
 epoch: 87, train_loss: 0.1931, test_loss: 1.9507, test_f1: 0.6397
 epoch: 88, train_loss: 0.1930, test_loss: 2.4916, test_f1: 0.6601
 epoch: 89, train_loss: 0.1759, test_loss: 2.4992, test_f1: 0.6189
 epoch: 90, train_loss: 0.1943, test_loss: 2.4563, test_f1: 0.6436
 epoch: 91, train_loss: 0.1894, test_loss: 2.5228, test_f1: 0.6497
 epoch: 92, train_loss: 0.1565, test_loss: 2.7263, test_f1: 0.6542
 epoch: 93, train_loss: 0.1870, test_loss: 2.7719, test_f1: 0.6454
 epoch: 94, train_loss: 0.1543, test_loss: 3.0928, test_f1: 0.6440
 epoch: 95, train_loss: 0.1672, test_loss: 2.7356, test_f1: 0.6318
 epoch: 96, train_loss: 0.1462, test_loss: 3.1365, test_f1: 0.6554
 epoch: 97, train_loss: 0.2232, test_loss: 2.4947, test_f1: 0.6750
 epoch: 98, train_loss: 0.1777, test_loss: 2.5578, test_f1: 0.6358
 epoch: 99, train_loss: 0.1561, test_loss: 2.5897, test_f1: 0.6170
##################ITERATION #4 ****************************************
 epoch: 0, train_loss: 1.2077, test_loss: 1.1499, test_f1: 0.3290
 epoch: 1, train_loss: 1.0883, test_loss: 1.2021, test_f1: 0.3823
 epoch: 2, train_loss: 1.0315, test_loss: 1.0503, test_f1: 0.4406
 epoch: 3, train_loss: 0.9526, test_loss: 1.0659, test_f1: 0.4636
 epoch: 4, train_loss: 0.9279, test_loss: 1.3869, test_f1: 0.4056
 epoch: 5, train_loss: 0.8757, test_loss: 1.0277, test_f1: 0.4591
 epoch: 6, train_loss: 0.8432, test_loss: 0.9272, test_f1: 0.5587
 epoch: 7, train_loss: 0.8475, test_loss: 1.0430, test_f1: 0.4813
 epoch: 8, train_loss: 0.8090, test_loss: 1.0624, test_f1: 0.4656
 epoch: 9, train_loss: 0.8279, test_loss: 1.0263, test_f1: 0.5143
 epoch: 10, train_loss: 0.8215, test_loss: 1.0426, test_f1: 0.5685
 epoch: 11, train_loss: 0.7807, test_loss: 1.0086, test_f1: 0.5349
 epoch: 12, train_loss: 0.7686, test_loss: 1.0770, test_f1: 0.5718
 epoch: 13, train_loss: 0.8170, test_loss: 1.1876, test_f1: 0.5296
 epoch: 14, train_loss: 0.7623, test_loss: 0.9841, test_f1: 0.5896
 epoch: 15, train_loss: 0.7697, test_loss: 0.9421, test_f1: 0.5655
 epoch: 16, train_loss: 0.7299, test_loss: 0.9423, test_f1: 0.6114
 epoch: 17, train_loss: 0.7308, test_loss: 0.9469, test_f1: 0.6076
 epoch: 18, train_loss: 0.7796, test_loss: 1.0643, test_f1: 0.6045
 epoch: 19, train_loss: 0.7414, test_loss: 1.0743, test_f1: 0.5348
 epoch: 20, train_loss: 0.7219, test_loss: 1.0191, test_f1: 0.6067
 epoch: 21, train_loss: 0.6998, test_loss: 0.9766, test_f1: 0.6083
 epoch: 22, train_loss: 0.6963, test_loss: 0.9998, test_f1: 0.6221
 epoch: 23, train_loss: 0.6748, test_loss: 0.8973, test_f1: 0.6797
 epoch: 24, train_loss: 0.7088, test_loss: 1.3478, test_f1: 0.4969
 epoch: 25, train_loss: 0.6947, test_loss: 1.1262, test_f1: 0.5550
 epoch: 26, train_loss: 0.6883, test_loss: 0.9532, test_f1: 0.6726
 epoch: 27, train_loss: 0.6876, test_loss: 0.9688, test_f1: 0.5822
 epoch: 28, train_loss: 0.6976, test_loss: 1.1871, test_f1: 0.5468
 epoch: 29, train_loss: 0.6682, test_loss: 1.4301, test_f1: 0.6587
 epoch: 30, train_loss: 0.6491, test_loss: 1.0037, test_f1: 0.6438
 epoch: 31, train_loss: 0.6676, test_loss: 0.9332, test_f1: 0.6105
 epoch: 32, train_loss: 0.6274, test_loss: 1.0468, test_f1: 0.6311
 epoch: 33, train_loss: 0.6281, test_loss: 0.9651, test_f1: 0.5677
 epoch: 34, train_loss: 0.6148, test_loss: 1.2495, test_f1: 0.5085
 epoch: 35, train_loss: 0.5982, test_loss: 1.4001, test_f1: 0.5495
 epoch: 36, train_loss: 0.6266, test_loss: 1.3885, test_f1: 0.5268
 epoch: 37, train_loss: 0.6312, test_loss: 1.0922, test_f1: 0.6298
 epoch: 38, train_loss: 0.6304, test_loss: 1.1318, test_f1: 0.6037
 epoch: 39, train_loss: 0.5991, test_loss: 1.0814, test_f1: 0.6669
 epoch: 40, train_loss: 0.5800, test_loss: 1.0224, test_f1: 0.6772
 epoch: 41, train_loss: 0.5754, test_loss: 1.1199, test_f1: 0.6367
 epoch: 42, train_loss: 0.5553, test_loss: 1.2912, test_f1: 0.6040
 epoch: 43, train_loss: 0.5323, test_loss: 1.1914, test_f1: 0.6008
 epoch: 44, train_loss: 0.5300, test_loss: 1.1054, test_f1: 0.6811
 epoch: 45, train_loss: 0.5806, test_loss: 1.1956, test_f1: 0.6098
 epoch: 46, train_loss: 0.6112, test_loss: 1.1373, test_f1: 0.6355
 epoch: 47, train_loss: 0.5267, test_loss: 1.1912, test_f1: 0.6788
 epoch: 48, train_loss: 0.5383, test_loss: 0.9691, test_f1: 0.6644
 epoch: 49, train_loss: 0.5027, test_loss: 1.0788, test_f1: 0.6574
 epoch: 50, train_loss: 0.5123, test_loss: 1.4132, test_f1: 0.6281
 epoch: 51, train_loss: 0.4750, test_loss: 1.0507, test_f1: 0.6771
 epoch: 52, train_loss: 0.4471, test_loss: 1.3638, test_f1: 0.6765
 epoch: 53, train_loss: 0.4222, test_loss: 1.2066, test_f1: 0.6702
 epoch: 54, train_loss: 0.4187, test_loss: 1.4446, test_f1: 0.6040
 epoch: 55, train_loss: 0.4117, test_loss: 1.3582, test_f1: 0.6436
 epoch: 56, train_loss: 0.4181, test_loss: 1.4254, test_f1: 0.6316
 epoch: 57, train_loss: 0.3953, test_loss: 1.3546, test_f1: 0.6761
 epoch: 58, train_loss: 0.3950, test_loss: 1.5608, test_f1: 0.6271
 epoch: 59, train_loss: 0.3872, test_loss: 1.4584, test_f1: 0.6488
 epoch: 60, train_loss: 0.4131, test_loss: 1.3184, test_f1: 0.6509
 epoch: 61, train_loss: 0.3622, test_loss: 1.6189, test_f1: 0.6245
 epoch: 62, train_loss: 0.3673, test_loss: 1.5135, test_f1: 0.6589
 epoch: 63, train_loss: 0.3897, test_loss: 1.3145, test_f1: 0.6518
 epoch: 64, train_loss: 0.3490, test_loss: 1.3497, test_f1: 0.6605
 epoch: 65, train_loss: 0.3398, test_loss: 1.4786, test_f1: 0.6490
 epoch: 66, train_loss: 0.3644, test_loss: 1.1686, test_f1: 0.6732
 epoch: 67, train_loss: 0.3329, test_loss: 1.4889, test_f1: 0.6791
 epoch: 68, train_loss: 0.3299, test_loss: 1.2572, test_f1: 0.6543
 epoch: 69, train_loss: 0.3068, test_loss: 1.4923, test_f1: 0.6620
 epoch: 70, train_loss: 0.3158, test_loss: 1.5161, test_f1: 0.6052
 epoch: 71, train_loss: 0.3185, test_loss: 1.4248, test_f1: 0.6290
 epoch: 72, train_loss: 0.3390, test_loss: 1.3435, test_f1: 0.6772
 epoch: 73, train_loss: 0.2977, test_loss: 1.5478, test_f1: 0.6420
 epoch: 74, train_loss: 0.2960, test_loss: 1.3697, test_f1: 0.6926
 epoch: 75, train_loss: 0.3634, test_loss: 1.3833, test_f1: 0.6375
 epoch: 76, train_loss: 0.3097, test_loss: 1.7918, test_f1: 0.6361
 epoch: 77, train_loss: 0.3027, test_loss: 1.8478, test_f1: 0.6247
 epoch: 78, train_loss: 0.2805, test_loss: 1.6033, test_f1: 0.6341
 epoch: 79, train_loss: 0.2705, test_loss: 1.8709, test_f1: 0.5873
 epoch: 80, train_loss: 0.2998, test_loss: 1.7496, test_f1: 0.6094
 epoch: 81, train_loss: 0.3379, test_loss: 1.6853, test_f1: 0.5958
 epoch: 82, train_loss: 0.2613, test_loss: 1.6168, test_f1: 0.6586
 epoch: 83, train_loss: 0.2887, test_loss: 1.7053, test_f1: 0.6396
 epoch: 84, train_loss: 0.2510, test_loss: 1.6900, test_f1: 0.6067
 epoch: 85, train_loss: 0.2903, test_loss: 1.7345, test_f1: 0.6323
 epoch: 86, train_loss: 0.2670, test_loss: 1.7704, test_f1: 0.6003
 epoch: 87, train_loss: 0.2774, test_loss: 1.5122, test_f1: 0.6329
 epoch: 88, train_loss: 0.2381, test_loss: 1.6792, test_f1: 0.6190
 epoch: 89, train_loss: 0.2443, test_loss: 1.9281, test_f1: 0.5939
 epoch: 90, train_loss: 0.2537, test_loss: 1.5833, test_f1: 0.6661
 epoch: 91, train_loss: 0.2365, test_loss: 1.7692, test_f1: 0.6185
 epoch: 92, train_loss: 0.2597, test_loss: 1.4834, test_f1: 0.6608
 epoch: 93, train_loss: 0.2375, test_loss: 1.6820, test_f1: 0.6155
 epoch: 94, train_loss: 0.2327, test_loss: 1.8940, test_f1: 0.6662
 epoch: 95, train_loss: 0.2295, test_loss: 1.8106, test_f1: 0.6712
 epoch: 96, train_loss: 0.2418, test_loss: 1.8092, test_f1: 0.6416
 epoch: 97, train_loss: 0.2396, test_loss: 1.5225, test_f1: 0.6632
 epoch: 98, train_loss: 0.2048, test_loss: 1.7627, test_f1: 0.6404
 epoch: 99, train_loss: 0.2254, test_loss: 1.5598, test_f1: 0.6407
##################ITERATION #5 ****************************************
 epoch: 0, train_loss: 1.1659, test_loss: 1.0685, test_f1: 0.3863
 epoch: 1, train_loss: 0.9640, test_loss: 0.9833, test_f1: 0.4596
 epoch: 2, train_loss: 0.8898, test_loss: 0.9519, test_f1: 0.4425
 epoch: 3, train_loss: 0.9049, test_loss: 1.2093, test_f1: 0.4952
 epoch: 4, train_loss: 0.8663, test_loss: 0.9419, test_f1: 0.5774
 epoch: 5, train_loss: 0.8169, test_loss: 1.0537, test_f1: 0.4535
 epoch: 6, train_loss: 0.8474, test_loss: 0.9907, test_f1: 0.4466
 epoch: 7, train_loss: 0.8083, test_loss: 1.1301, test_f1: 0.4521
 epoch: 8, train_loss: 0.7804, test_loss: 1.0791, test_f1: 0.5523
 epoch: 9, train_loss: 0.7910, test_loss: 0.8970, test_f1: 0.6159
 epoch: 10, train_loss: 0.7796, test_loss: 1.0395, test_f1: 0.4280
 epoch: 11, train_loss: 0.7700, test_loss: 0.9357, test_f1: 0.6145
 epoch: 12, train_loss: 0.7711, test_loss: 0.9018, test_f1: 0.6085
 epoch: 13, train_loss: 0.7292, test_loss: 0.8772, test_f1: 0.5966
 epoch: 14, train_loss: 0.7375, test_loss: 0.9060, test_f1: 0.6123
 epoch: 15, train_loss: 0.7937, test_loss: 1.0065, test_f1: 0.5684
 epoch: 16, train_loss: 0.7366, test_loss: 0.9096, test_f1: 0.5942
 epoch: 17, train_loss: 0.7268, test_loss: 1.1161, test_f1: 0.5333
 epoch: 18, train_loss: 0.7188, test_loss: 1.0547, test_f1: 0.5286
 epoch: 19, train_loss: 0.7233, test_loss: 0.9193, test_f1: 0.6073
 epoch: 20, train_loss: 0.7042, test_loss: 0.9519, test_f1: 0.5330
 epoch: 21, train_loss: 0.7292, test_loss: 1.2630, test_f1: 0.5208
 epoch: 22, train_loss: 0.6897, test_loss: 0.8616, test_f1: 0.6329
 epoch: 23, train_loss: 0.6995, test_loss: 1.1705, test_f1: 0.5244
 epoch: 24, train_loss: 0.6780, test_loss: 0.9382, test_f1: 0.5679
 epoch: 25, train_loss: 0.7220, test_loss: 1.1046, test_f1: 0.5858
 epoch: 26, train_loss: 0.6826, test_loss: 0.9681, test_f1: 0.6309
 epoch: 27, train_loss: 0.6501, test_loss: 0.9873, test_f1: 0.6090
 epoch: 28, train_loss: 0.6640, test_loss: 0.9569, test_f1: 0.6335
 epoch: 29, train_loss: 0.6540, test_loss: 0.9302, test_f1: 0.5734
 epoch: 30, train_loss: 0.6091, test_loss: 1.0362, test_f1: 0.6042
 epoch: 31, train_loss: 0.6370, test_loss: 1.1067, test_f1: 0.5590
 epoch: 32, train_loss: 0.6098, test_loss: 1.0141, test_f1: 0.6521
 epoch: 33, train_loss: 0.6203, test_loss: 1.3850, test_f1: 0.4851
 epoch: 34, train_loss: 0.5932, test_loss: 1.0043, test_f1: 0.6478
 epoch: 35, train_loss: 0.5732, test_loss: 1.0683, test_f1: 0.6021
 epoch: 36, train_loss: 0.6014, test_loss: 1.1783, test_f1: 0.6076
 epoch: 37, train_loss: 0.6122, test_loss: 0.9895, test_f1: 0.6228
 epoch: 38, train_loss: 0.5606, test_loss: 1.2205, test_f1: 0.5827
 epoch: 39, train_loss: 0.5571, test_loss: 1.0185, test_f1: 0.6554
 epoch: 40, train_loss: 0.6097, test_loss: 0.9860, test_f1: 0.6161
 epoch: 41, train_loss: 0.5617, test_loss: 1.2290, test_f1: 0.6010
 epoch: 42, train_loss: 0.5505, test_loss: 1.1230, test_f1: 0.6233
 epoch: 43, train_loss: 0.5572, test_loss: 1.1077, test_f1: 0.6248
 epoch: 44, train_loss: 0.5322, test_loss: 1.1461, test_f1: 0.6141
 epoch: 45, train_loss: 0.5336, test_loss: 1.2009, test_f1: 0.6406
 epoch: 46, train_loss: 0.5162, test_loss: 1.1581, test_f1: 0.6064
 epoch: 47, train_loss: 0.4790, test_loss: 1.3069, test_f1: 0.6015
 epoch: 48, train_loss: 0.4911, test_loss: 1.0803, test_f1: 0.5957
 epoch: 49, train_loss: 0.4955, test_loss: 1.1305, test_f1: 0.6762
 epoch: 50, train_loss: 0.4503, test_loss: 1.2045, test_f1: 0.6135
 epoch: 51, train_loss: 0.4411, test_loss: 1.4130, test_f1: 0.5901
 epoch: 52, train_loss: 0.4041, test_loss: 1.4298, test_f1: 0.6208
 epoch: 53, train_loss: 0.3964, test_loss: 1.4764, test_f1: 0.5884
 epoch: 54, train_loss: 0.3993, test_loss: 1.4174, test_f1: 0.6294
 epoch: 55, train_loss: 0.3795, test_loss: 1.4945, test_f1: 0.5887
 epoch: 56, train_loss: 0.3564, test_loss: 1.5869, test_f1: 0.5758
 epoch: 57, train_loss: 0.3420, test_loss: 1.6430, test_f1: 0.6116
 epoch: 58, train_loss: 0.3527, test_loss: 1.5419, test_f1: 0.6132
 epoch: 59, train_loss: 0.3338, test_loss: 1.9854, test_f1: 0.6175
 epoch: 60, train_loss: 0.3289, test_loss: 1.8037, test_f1: 0.5758
 epoch: 61, train_loss: 0.3104, test_loss: 1.7473, test_f1: 0.6256
 epoch: 62, train_loss: 0.3335, test_loss: 1.7187, test_f1: 0.6388
 epoch: 63, train_loss: 0.3692, test_loss: 2.7837, test_f1: 0.5814
 epoch: 64, train_loss: 0.3281, test_loss: 1.4486, test_f1: 0.6027
 epoch: 65, train_loss: 0.3385, test_loss: 1.5208, test_f1: 0.6548
 epoch: 66, train_loss: 0.3149, test_loss: 1.4463, test_f1: 0.6169
 epoch: 67, train_loss: 0.3000, test_loss: 1.8225, test_f1: 0.6079
 epoch: 68, train_loss: 0.2908, test_loss: 1.6139, test_f1: 0.6156
 epoch: 69, train_loss: 0.2946, test_loss: 1.8856, test_f1: 0.6129
 epoch: 70, train_loss: 0.2814, test_loss: 1.6594, test_f1: 0.6313
 epoch: 71, train_loss: 0.2582, test_loss: 1.7425, test_f1: 0.6234
 epoch: 72, train_loss: 0.2501, test_loss: 2.1541, test_f1: 0.6020
 epoch: 73, train_loss: 0.2781, test_loss: 1.7896, test_f1: 0.6222
 epoch: 74, train_loss: 0.2527, test_loss: 2.0053, test_f1: 0.6106
 epoch: 75, train_loss: 0.2676, test_loss: 1.8513, test_f1: 0.6143
 epoch: 76, train_loss: 0.2626, test_loss: 1.7902, test_f1: 0.6172
 epoch: 77, train_loss: 0.2766, test_loss: 1.9857, test_f1: 0.6336
 epoch: 78, train_loss: 0.2902, test_loss: 1.7565, test_f1: 0.6247
 epoch: 79, train_loss: 0.2412, test_loss: 1.9723, test_f1: 0.5882
 epoch: 80, train_loss: 0.2136, test_loss: 1.9691, test_f1: 0.6047
 epoch: 81, train_loss: 0.2325, test_loss: 2.2328, test_f1: 0.6231
 epoch: 82, train_loss: 0.2145, test_loss: 1.9910, test_f1: 0.6418
 epoch: 83, train_loss: 0.2303, test_loss: 2.1672, test_f1: 0.6406
 epoch: 84, train_loss: 0.2369, test_loss: 2.0515, test_f1: 0.6291
 epoch: 85, train_loss: 0.2571, test_loss: 1.8029, test_f1: 0.6212
 epoch: 86, train_loss: 0.2423, test_loss: 1.7545, test_f1: 0.6264
 epoch: 87, train_loss: 0.1927, test_loss: 1.9614, test_f1: 0.6255
 epoch: 88, train_loss: 0.1687, test_loss: 1.9008, test_f1: 0.6313
 epoch: 89, train_loss: 0.1940, test_loss: 1.8880, test_f1: 0.6240
 epoch: 90, train_loss: 0.2076, test_loss: 2.2208, test_f1: 0.6322
 epoch: 91, train_loss: 0.1758, test_loss: 2.1433, test_f1: 0.6420
 epoch: 92, train_loss: 0.2215, test_loss: 2.3406, test_f1: 0.6233
 epoch: 93, train_loss: 0.2107, test_loss: 1.9154, test_f1: 0.6403
 epoch: 94, train_loss: 0.1755, test_loss: 2.0371, test_f1: 0.6423
 epoch: 95, train_loss: 0.1297, test_loss: 2.1193, test_f1: 0.6410
 epoch: 96, train_loss: 0.1840, test_loss: 2.5441, test_f1: 0.5905
 epoch: 97, train_loss: 0.2329, test_loss: 1.9705, test_f1: 0.6094
 epoch: 98, train_loss: 0.2241, test_loss: 2.0302, test_f1: 0.6347
 epoch: 99, train_loss: 0.1887, test_loss: 2.1718, test_f1: 0.6413
##################ITERATION #6 ****************************************
 epoch: 0, train_loss: 1.2321, test_loss: 1.5555, test_f1: 0.3552
 epoch: 1, train_loss: 0.9960, test_loss: 1.1473, test_f1: 0.3965
 epoch: 2, train_loss: 0.8894, test_loss: 0.9649, test_f1: 0.4572
 epoch: 3, train_loss: 0.8625, test_loss: 0.9626, test_f1: 0.5652
 epoch: 4, train_loss: 0.8432, test_loss: 1.2090, test_f1: 0.4086
 epoch: 5, train_loss: 0.8099, test_loss: 1.1468, test_f1: 0.5663
 epoch: 6, train_loss: 0.7989, test_loss: 1.0432, test_f1: 0.5964
 epoch: 7, train_loss: 0.7869, test_loss: 1.0201, test_f1: 0.5118
 epoch: 8, train_loss: 0.7650, test_loss: 0.9170, test_f1: 0.6160
 epoch: 9, train_loss: 0.7809, test_loss: 0.9974, test_f1: 0.5940
 epoch: 10, train_loss: 0.7470, test_loss: 0.9891, test_f1: 0.5963
 epoch: 11, train_loss: 0.7709, test_loss: 0.9735, test_f1: 0.4972
 epoch: 12, train_loss: 0.7993, test_loss: 1.3565, test_f1: 0.5367
 epoch: 13, train_loss: 0.7744, test_loss: 1.0079, test_f1: 0.6040
 epoch: 14, train_loss: 0.7428, test_loss: 1.1259, test_f1: 0.5447
 epoch: 15, train_loss: 0.7205, test_loss: 1.0045, test_f1: 0.5948
 epoch: 16, train_loss: 0.7037, test_loss: 0.9366, test_f1: 0.6215
 epoch: 17, train_loss: 0.7009, test_loss: 1.1272, test_f1: 0.5959
 epoch: 18, train_loss: 0.7063, test_loss: 1.2123, test_f1: 0.5237
 epoch: 19, train_loss: 0.7329, test_loss: 1.2473, test_f1: 0.5500
 epoch: 20, train_loss: 0.7597, test_loss: 1.2008, test_f1: 0.5269
 epoch: 21, train_loss: 0.7226, test_loss: 0.9289, test_f1: 0.6286
 epoch: 22, train_loss: 0.6709, test_loss: 1.0068, test_f1: 0.6338
 epoch: 23, train_loss: 0.6741, test_loss: 0.9723, test_f1: 0.6352
 epoch: 24, train_loss: 0.6775, test_loss: 1.4190, test_f1: 0.6104
 epoch: 25, train_loss: 0.6842, test_loss: 1.0975, test_f1: 0.5841
 epoch: 26, train_loss: 0.6887, test_loss: 1.1198, test_f1: 0.5833
 epoch: 27, train_loss: 0.6646, test_loss: 1.0375, test_f1: 0.6501
 epoch: 28, train_loss: 0.6289, test_loss: 1.2676, test_f1: 0.5883
 epoch: 29, train_loss: 0.6567, test_loss: 1.1650, test_f1: 0.5880
 epoch: 30, train_loss: 0.6346, test_loss: 1.1461, test_f1: 0.5870
 epoch: 31, train_loss: 0.6389, test_loss: 1.4991, test_f1: 0.5776
 epoch: 32, train_loss: 0.6471, test_loss: 1.1162, test_f1: 0.6029
 epoch: 33, train_loss: 0.6479, test_loss: 1.4655, test_f1: 0.4982
 epoch: 34, train_loss: 0.6367, test_loss: 1.0327, test_f1: 0.5897
 epoch: 35, train_loss: 0.6089, test_loss: 1.3010, test_f1: 0.5347
 epoch: 36, train_loss: 0.6299, test_loss: 1.0795, test_f1: 0.6260
 epoch: 37, train_loss: 0.5857, test_loss: 1.1291, test_f1: 0.6247
 epoch: 38, train_loss: 0.5956, test_loss: 1.1784, test_f1: 0.5573
 epoch: 39, train_loss: 0.5878, test_loss: 1.3510, test_f1: 0.5854
 epoch: 40, train_loss: 0.5291, test_loss: 1.0613, test_f1: 0.5656
 epoch: 41, train_loss: 0.5786, test_loss: 1.3165, test_f1: 0.6434
 epoch: 42, train_loss: 0.5998, test_loss: 1.1042, test_f1: 0.5641
 epoch: 43, train_loss: 0.5865, test_loss: 1.3528, test_f1: 0.5079
 epoch: 44, train_loss: 0.5844, test_loss: 1.0333, test_f1: 0.6354
 epoch: 45, train_loss: 0.5443, test_loss: 1.4018, test_f1: 0.5517
 epoch: 46, train_loss: 0.5689, test_loss: 1.0390, test_f1: 0.6291
 epoch: 47, train_loss: 0.5247, test_loss: 1.1998, test_f1: 0.6435
 epoch: 48, train_loss: 0.5441, test_loss: 1.0748, test_f1: 0.6548
 epoch: 49, train_loss: 0.5384, test_loss: 1.5643, test_f1: 0.5957
 epoch: 50, train_loss: 0.5011, test_loss: 1.4649, test_f1: 0.5885
 epoch: 51, train_loss: 0.4833, test_loss: 1.4073, test_f1: 0.6368
 epoch: 52, train_loss: 0.4516, test_loss: 1.6607, test_f1: 0.5792
 epoch: 53, train_loss: 0.4400, test_loss: 1.2315, test_f1: 0.6748
 epoch: 54, train_loss: 0.4489, test_loss: 1.3412, test_f1: 0.6385
 epoch: 55, train_loss: 0.4508, test_loss: 1.2779, test_f1: 0.6321
 epoch: 56, train_loss: 0.4027, test_loss: 1.4326, test_f1: 0.6696
 epoch: 57, train_loss: 0.4265, test_loss: 1.2688, test_f1: 0.6673
 epoch: 58, train_loss: 0.4024, test_loss: 1.2929, test_f1: 0.6738
 epoch: 59, train_loss: 0.4148, test_loss: 1.3904, test_f1: 0.6518
 epoch: 60, train_loss: 0.4196, test_loss: 1.3879, test_f1: 0.6659
 epoch: 61, train_loss: 0.3861, test_loss: 1.2888, test_f1: 0.6534
 epoch: 62, train_loss: 0.3890, test_loss: 1.6516, test_f1: 0.6009
 epoch: 63, train_loss: 0.3974, test_loss: 1.6088, test_f1: 0.6402
 epoch: 64, train_loss: 0.4196, test_loss: 1.3158, test_f1: 0.6691
 epoch: 65, train_loss: 0.3929, test_loss: 1.5166, test_f1: 0.6743
 epoch: 66, train_loss: 0.4262, test_loss: 1.2563, test_f1: 0.6614
 epoch: 67, train_loss: 0.3622, test_loss: 1.6975, test_f1: 0.6038
 epoch: 68, train_loss: 0.3487, test_loss: 1.4371, test_f1: 0.6752
 epoch: 69, train_loss: 0.3674, test_loss: 1.7197, test_f1: 0.6717
 epoch: 70, train_loss: 0.3693, test_loss: 1.2923, test_f1: 0.6456
 epoch: 71, train_loss: 0.3725, test_loss: 1.3913, test_f1: 0.6677
 epoch: 72, train_loss: 0.3455, test_loss: 1.7596, test_f1: 0.6423
 epoch: 73, train_loss: 0.3853, test_loss: 1.4833, test_f1: 0.6394
 epoch: 74, train_loss: 0.3995, test_loss: 1.2815, test_f1: 0.6598
 epoch: 75, train_loss: 0.3714, test_loss: 1.4301, test_f1: 0.6661
 epoch: 76, train_loss: 0.3378, test_loss: 1.4625, test_f1: 0.6618
 epoch: 77, train_loss: 0.3454, test_loss: 1.2581, test_f1: 0.6602
 epoch: 78, train_loss: 0.3313, test_loss: 1.3991, test_f1: 0.6541
 epoch: 79, train_loss: 0.3325, test_loss: 1.2113, test_f1: 0.6495
 epoch: 80, train_loss: 0.3427, test_loss: 1.6042, test_f1: 0.6338
 epoch: 81, train_loss: 0.3246, test_loss: 1.5866, test_f1: 0.7043
 epoch: 82, train_loss: 0.3300, test_loss: 1.4932, test_f1: 0.6639
 epoch: 83, train_loss: 0.3066, test_loss: 1.8647, test_f1: 0.5891
 epoch: 84, train_loss: 0.3192, test_loss: 1.6010, test_f1: 0.6686
 epoch: 85, train_loss: 0.3103, test_loss: 1.3582, test_f1: 0.6542
 epoch: 86, train_loss: 0.3045, test_loss: 1.4721, test_f1: 0.6656
 epoch: 87, train_loss: 0.2644, test_loss: 1.8852, test_f1: 0.6473
 epoch: 88, train_loss: 0.2604, test_loss: 1.8252, test_f1: 0.6540
 epoch: 89, train_loss: 0.2913, test_loss: 1.9496, test_f1: 0.6370
 epoch: 90, train_loss: 0.2720, test_loss: 1.9614, test_f1: 0.6573
 epoch: 91, train_loss: 0.2669, test_loss: 1.9737, test_f1: 0.6524
 epoch: 92, train_loss: 0.2874, test_loss: 1.3897, test_f1: 0.6613
 epoch: 93, train_loss: 0.2589, test_loss: 1.7181, test_f1: 0.6951
 epoch: 94, train_loss: 0.2240, test_loss: 2.0973, test_f1: 0.6774
 epoch: 95, train_loss: 0.2778, test_loss: 1.7860, test_f1: 0.6315
 epoch: 96, train_loss: 0.2992, test_loss: 1.6364, test_f1: 0.6686
 epoch: 97, train_loss: 0.2906, test_loss: 1.5326, test_f1: 0.6376
 epoch: 98, train_loss: 0.2406, test_loss: 1.6628, test_f1: 0.6779
 epoch: 99, train_loss: 0.2307, test_loss: 2.1448, test_f1: 0.6612
##################ITERATION #7 ****************************************
 epoch: 0, train_loss: 1.2019, test_loss: 1.2317, test_f1: 0.3362
 epoch: 1, train_loss: 1.0259, test_loss: 1.0672, test_f1: 0.4670
 epoch: 2, train_loss: 0.9684, test_loss: 1.3176, test_f1: 0.3710
 epoch: 3, train_loss: 0.9292, test_loss: 1.0016, test_f1: 0.4442
 epoch: 4, train_loss: 0.8819, test_loss: 1.2299, test_f1: 0.3213
 epoch: 5, train_loss: 0.8960, test_loss: 1.5013, test_f1: 0.3740
 epoch: 6, train_loss: 0.8808, test_loss: 0.9706, test_f1: 0.5637
 epoch: 7, train_loss: 0.8207, test_loss: 1.2231, test_f1: 0.4371
 epoch: 8, train_loss: 0.8245, test_loss: 0.9479, test_f1: 0.5597
 epoch: 9, train_loss: 0.8064, test_loss: 1.1170, test_f1: 0.4621
 epoch: 10, train_loss: 0.8017, test_loss: 0.9662, test_f1: 0.6183
 epoch: 11, train_loss: 0.7747, test_loss: 0.9959, test_f1: 0.6076
 epoch: 12, train_loss: 0.7432, test_loss: 0.9998, test_f1: 0.5297
 epoch: 13, train_loss: 0.7419, test_loss: 1.1186, test_f1: 0.5355
 epoch: 14, train_loss: 0.7420, test_loss: 0.9213, test_f1: 0.6222
 epoch: 15, train_loss: 0.7168, test_loss: 1.4011, test_f1: 0.4448
 epoch: 16, train_loss: 0.7183, test_loss: 1.5752, test_f1: 0.4599
 epoch: 17, train_loss: 0.7125, test_loss: 1.1160, test_f1: 0.5911
 epoch: 18, train_loss: 0.7144, test_loss: 1.0319, test_f1: 0.5628
 epoch: 19, train_loss: 0.7044, test_loss: 1.1043, test_f1: 0.5581
 epoch: 20, train_loss: 0.6668, test_loss: 1.1400, test_f1: 0.5215
 epoch: 21, train_loss: 0.6963, test_loss: 1.0723, test_f1: 0.5336
 epoch: 22, train_loss: 0.7141, test_loss: 1.2438, test_f1: 0.5554
 epoch: 23, train_loss: 0.6815, test_loss: 0.9551, test_f1: 0.6403
 epoch: 24, train_loss: 0.6613, test_loss: 1.1820, test_f1: 0.5389
 epoch: 25, train_loss: 0.6696, test_loss: 1.5278, test_f1: 0.4816
 epoch: 26, train_loss: 0.6283, test_loss: 1.2166, test_f1: 0.5707
 epoch: 27, train_loss: 0.6423, test_loss: 1.1076, test_f1: 0.5506
 epoch: 28, train_loss: 0.6612, test_loss: 1.2801, test_f1: 0.5776
 epoch: 29, train_loss: 0.6294, test_loss: 1.1273, test_f1: 0.6100
 epoch: 30, train_loss: 0.6408, test_loss: 1.1661, test_f1: 0.6136
 epoch: 31, train_loss: 0.6430, test_loss: 1.0864, test_f1: 0.5796
 epoch: 32, train_loss: 0.6279, test_loss: 1.0797, test_f1: 0.6130
 epoch: 33, train_loss: 0.6566, test_loss: 1.1732, test_f1: 0.5712
 epoch: 34, train_loss: 0.6428, test_loss: 1.0179, test_f1: 0.6638
 epoch: 35, train_loss: 0.6672, test_loss: 1.0474, test_f1: 0.5806
 epoch: 36, train_loss: 0.6268, test_loss: 0.9582, test_f1: 0.6429
 epoch: 37, train_loss: 0.6307, test_loss: 1.1409, test_f1: 0.5864
 epoch: 38, train_loss: 0.6197, test_loss: 0.9915, test_f1: 0.6521
 epoch: 39, train_loss: 0.5899, test_loss: 1.0498, test_f1: 0.6215
 epoch: 40, train_loss: 0.5702, test_loss: 1.2035, test_f1: 0.5874
 epoch: 41, train_loss: 0.5836, test_loss: 1.0622, test_f1: 0.5950
 epoch: 42, train_loss: 0.6198, test_loss: 1.2938, test_f1: 0.6141
 epoch: 43, train_loss: 0.5882, test_loss: 1.0344, test_f1: 0.6363
 epoch: 44, train_loss: 0.5593, test_loss: 1.0987, test_f1: 0.6247
 epoch: 45, train_loss: 0.5532, test_loss: 1.0359, test_f1: 0.6298
 epoch: 46, train_loss: 0.5520, test_loss: 1.2006, test_f1: 0.6266
 epoch: 47, train_loss: 0.5686, test_loss: 1.3048, test_f1: 0.5695
 epoch: 48, train_loss: 0.5669, test_loss: 1.7532, test_f1: 0.5204
 epoch: 49, train_loss: 0.5587, test_loss: 1.0113, test_f1: 0.6441
 epoch: 50, train_loss: 0.5476, test_loss: 1.1647, test_f1: 0.6302
 epoch: 51, train_loss: 0.4850, test_loss: 1.2652, test_f1: 0.6154
 epoch: 52, train_loss: 0.4800, test_loss: 1.1450, test_f1: 0.6282
 epoch: 53, train_loss: 0.4565, test_loss: 1.1770, test_f1: 0.6245
 epoch: 54, train_loss: 0.4256, test_loss: 1.4480, test_f1: 0.5976
 epoch: 55, train_loss: 0.4212, test_loss: 1.3258, test_f1: 0.6220
 epoch: 56, train_loss: 0.4250, test_loss: 1.3492, test_f1: 0.6131
 epoch: 57, train_loss: 0.4127, test_loss: 1.2461, test_f1: 0.6290
 epoch: 58, train_loss: 0.4117, test_loss: 1.2594, test_f1: 0.6558
 epoch: 59, train_loss: 0.3958, test_loss: 1.5101, test_f1: 0.5975
 epoch: 60, train_loss: 0.4060, test_loss: 1.3724, test_f1: 0.6373
 epoch: 61, train_loss: 0.4054, test_loss: 1.3616, test_f1: 0.6185
 epoch: 62, train_loss: 0.4236, test_loss: 1.3833, test_f1: 0.6083
 epoch: 63, train_loss: 0.4208, test_loss: 1.2008, test_f1: 0.6524
 epoch: 64, train_loss: 0.3831, test_loss: 1.3567, test_f1: 0.6006
 epoch: 65, train_loss: 0.3772, test_loss: 1.4461, test_f1: 0.6273
 epoch: 66, train_loss: 0.3840, test_loss: 1.2054, test_f1: 0.6205
 epoch: 67, train_loss: 0.4006, test_loss: 1.3258, test_f1: 0.6244
 epoch: 68, train_loss: 0.3504, test_loss: 1.4540, test_f1: 0.6062
 epoch: 69, train_loss: 0.3629, test_loss: 1.4365, test_f1: 0.6261
 epoch: 70, train_loss: 0.3404, test_loss: 1.4029, test_f1: 0.6533
 epoch: 71, train_loss: 0.3475, test_loss: 1.3115, test_f1: 0.6622
 epoch: 72, train_loss: 0.3790, test_loss: 1.5622, test_f1: 0.6423
 epoch: 73, train_loss: 0.3912, test_loss: 1.3148, test_f1: 0.6503
 epoch: 74, train_loss: 0.3467, test_loss: 1.4211, test_f1: 0.6512
 epoch: 75, train_loss: 0.3492, test_loss: 1.4761, test_f1: 0.6521
 epoch: 76, train_loss: 0.3360, test_loss: 1.6351, test_f1: 0.6294
 epoch: 77, train_loss: 0.3596, test_loss: 1.3584, test_f1: 0.6241
 epoch: 78, train_loss: 0.3299, test_loss: 1.7606, test_f1: 0.6113
 epoch: 79, train_loss: 0.3314, test_loss: 1.5916, test_f1: 0.6268
 epoch: 80, train_loss: 0.3435, test_loss: 1.7120, test_f1: 0.6298
 epoch: 81, train_loss: 0.3027, test_loss: 1.4982, test_f1: 0.6333
 epoch: 82, train_loss: 0.3157, test_loss: 1.6309, test_f1: 0.6723
 epoch: 83, train_loss: 0.3849, test_loss: 1.3997, test_f1: 0.6440
 epoch: 84, train_loss: 0.3390, test_loss: 1.6043, test_f1: 0.6321
 epoch: 85, train_loss: 0.3627, test_loss: 1.4834, test_f1: 0.5980
 epoch: 86, train_loss: 0.3502, test_loss: 1.5952, test_f1: 0.6180
 epoch: 87, train_loss: 0.2874, test_loss: 1.7045, test_f1: 0.6367
 epoch: 88, train_loss: 0.3009, test_loss: 1.5147, test_f1: 0.6440
 epoch: 89, train_loss: 0.2914, test_loss: 1.4876, test_f1: 0.6693
 epoch: 90, train_loss: 0.3066, test_loss: 1.5532, test_f1: 0.6284
 epoch: 91, train_loss: 0.2724, test_loss: 1.5240, test_f1: 0.6743
 epoch: 92, train_loss: 0.3210, test_loss: 1.6894, test_f1: 0.6489
 epoch: 93, train_loss: 0.2778, test_loss: 1.6804, test_f1: 0.6403
 epoch: 94, train_loss: 0.2704, test_loss: 1.7321, test_f1: 0.6668
 epoch: 95, train_loss: 0.2442, test_loss: 1.8172, test_f1: 0.6518
 epoch: 96, train_loss: 0.2439, test_loss: 1.7690, test_f1: 0.6397
 epoch: 97, train_loss: 0.2645, test_loss: 1.9409, test_f1: 0.6688
 epoch: 98, train_loss: 0.2459, test_loss: 2.0431, test_f1: 0.6440
 epoch: 99, train_loss: 0.2580, test_loss: 2.0344, test_f1: 0.6461
##################ITERATION #8 ****************************************
 epoch: 0, train_loss: 1.2390, test_loss: 1.3595, test_f1: 0.1873
 epoch: 1, train_loss: 1.0702, test_loss: 1.1257, test_f1: 0.3955
 epoch: 2, train_loss: 0.9784, test_loss: 1.0543, test_f1: 0.5484
 epoch: 3, train_loss: 0.9548, test_loss: 0.9635, test_f1: 0.5685
 epoch: 4, train_loss: 0.9160, test_loss: 2.9182, test_f1: 0.3760
 epoch: 5, train_loss: 0.9085, test_loss: 1.4369, test_f1: 0.4070
 epoch: 6, train_loss: 0.9126, test_loss: 1.0686, test_f1: 0.5224
 epoch: 7, train_loss: 0.8571, test_loss: 1.0836, test_f1: 0.4931
 epoch: 8, train_loss: 0.8310, test_loss: 1.1121, test_f1: 0.4670
 epoch: 9, train_loss: 0.8050, test_loss: 0.9781, test_f1: 0.5700
 epoch: 10, train_loss: 0.7770, test_loss: 0.9597, test_f1: 0.5572
 epoch: 11, train_loss: 0.8177, test_loss: 1.0026, test_f1: 0.5617
 epoch: 12, train_loss: 0.8068, test_loss: 1.0956, test_f1: 0.5203
 epoch: 13, train_loss: 0.7878, test_loss: 1.0170, test_f1: 0.5374
 epoch: 14, train_loss: 0.7608, test_loss: 1.1197, test_f1: 0.5347
 epoch: 15, train_loss: 0.7631, test_loss: 1.0038, test_f1: 0.5701
 epoch: 16, train_loss: 0.7394, test_loss: 1.2100, test_f1: 0.5238
 epoch: 17, train_loss: 0.7608, test_loss: 1.0498, test_f1: 0.5572
 epoch: 18, train_loss: 0.7308, test_loss: 1.1013, test_f1: 0.4953
 epoch: 19, train_loss: 0.7218, test_loss: 1.4746, test_f1: 0.5165
 epoch: 20, train_loss: 0.7486, test_loss: 0.9794, test_f1: 0.5482
 epoch: 21, train_loss: 0.7247, test_loss: 1.0225, test_f1: 0.5666
 epoch: 22, train_loss: 0.7272, test_loss: 1.0236, test_f1: 0.5370
 epoch: 23, train_loss: 0.6899, test_loss: 1.2164, test_f1: 0.5883
 epoch: 24, train_loss: 0.6970, test_loss: 1.0324, test_f1: 0.5253
 epoch: 25, train_loss: 0.7168, test_loss: 1.1270, test_f1: 0.5151
 epoch: 26, train_loss: 0.6591, test_loss: 1.0284, test_f1: 0.6164
 epoch: 27, train_loss: 0.6765, test_loss: 1.0705, test_f1: 0.5381
 epoch: 28, train_loss: 0.6422, test_loss: 1.0574, test_f1: 0.6028
 epoch: 29, train_loss: 0.6477, test_loss: 1.2023, test_f1: 0.5665
 epoch: 30, train_loss: 0.6411, test_loss: 1.1085, test_f1: 0.5696
 epoch: 31, train_loss: 0.6690, test_loss: 1.3981, test_f1: 0.5376
 epoch: 32, train_loss: 0.6587, test_loss: 1.2317, test_f1: 0.5874
 epoch: 33, train_loss: 0.6190, test_loss: 1.2106, test_f1: 0.4965
 epoch: 34, train_loss: 0.6567, test_loss: 1.1422, test_f1: 0.5289
 epoch: 35, train_loss: 0.6092, test_loss: 1.1575, test_f1: 0.5681
 epoch: 36, train_loss: 0.6099, test_loss: 1.0261, test_f1: 0.5198
 epoch: 37, train_loss: 0.6051, test_loss: 1.1095, test_f1: 0.5764
 epoch: 38, train_loss: 0.6280, test_loss: 1.4980, test_f1: 0.5944
 epoch: 39, train_loss: 0.6277, test_loss: 1.2586, test_f1: 0.5143
 epoch: 40, train_loss: 0.6209, test_loss: 1.3225, test_f1: 0.5817
 epoch: 41, train_loss: 0.5813, test_loss: 1.1448, test_f1: 0.5903
 epoch: 42, train_loss: 0.6040, test_loss: 1.3069, test_f1: 0.4911
 epoch: 43, train_loss: 0.6018, test_loss: 1.0727, test_f1: 0.6402
 epoch: 44, train_loss: 0.5890, test_loss: 1.1771, test_f1: 0.5832
 epoch: 45, train_loss: 0.6002, test_loss: 1.0818, test_f1: 0.6250
 epoch: 46, train_loss: 0.5612, test_loss: 1.2186, test_f1: 0.5520
 epoch: 47, train_loss: 0.5488, test_loss: 1.3565, test_f1: 0.5528
 epoch: 48, train_loss: 0.5541, test_loss: 1.1438, test_f1: 0.5316
 epoch: 49, train_loss: 0.5774, test_loss: 1.7841, test_f1: 0.5424
 epoch: 50, train_loss: 0.5728, test_loss: 1.2959, test_f1: 0.5745
 epoch: 51, train_loss: 0.5486, test_loss: 1.2467, test_f1: 0.5767
 epoch: 52, train_loss: 0.5115, test_loss: 1.2595, test_f1: 0.6047
 epoch: 53, train_loss: 0.4901, test_loss: 1.4905, test_f1: 0.6020
 epoch: 54, train_loss: 0.5119, test_loss: 2.6274, test_f1: 0.4841
 epoch: 55, train_loss: 0.4835, test_loss: 1.3553, test_f1: 0.5915
 epoch: 56, train_loss: 0.4617, test_loss: 1.6980, test_f1: 0.5695
 epoch: 57, train_loss: 0.4473, test_loss: 1.3157, test_f1: 0.5863
 epoch: 58, train_loss: 0.4214, test_loss: 1.6369, test_f1: 0.5829
 epoch: 59, train_loss: 0.4935, test_loss: 1.1307, test_f1: 0.6034
 epoch: 60, train_loss: 0.4702, test_loss: 1.2578, test_f1: 0.6141
 epoch: 61, train_loss: 0.4191, test_loss: 1.5655, test_f1: 0.5959
 epoch: 62, train_loss: 0.4423, test_loss: 1.8155, test_f1: 0.5906
 epoch: 63, train_loss: 0.4324, test_loss: 1.5647, test_f1: 0.5785
 epoch: 64, train_loss: 0.4194, test_loss: 1.5082, test_f1: 0.5983
 epoch: 65, train_loss: 0.4109, test_loss: 1.3129, test_f1: 0.6519
 epoch: 66, train_loss: 0.3966, test_loss: 1.5200, test_f1: 0.6220
 epoch: 67, train_loss: 0.3961, test_loss: 1.5676, test_f1: 0.6161
 epoch: 68, train_loss: 0.4017, test_loss: 1.5837, test_f1: 0.6125
 epoch: 69, train_loss: 0.3700, test_loss: 2.1666, test_f1: 0.5767
 epoch: 70, train_loss: 0.3905, test_loss: 2.0399, test_f1: 0.5840
 epoch: 71, train_loss: 0.3701, test_loss: 1.5519, test_f1: 0.6130
 epoch: 72, train_loss: 0.3950, test_loss: 1.4710, test_f1: 0.6247
 epoch: 73, train_loss: 0.3818, test_loss: 1.7855, test_f1: 0.6130
 epoch: 74, train_loss: 0.3711, test_loss: 1.8899, test_f1: 0.5967
 epoch: 75, train_loss: 0.3981, test_loss: 1.8900, test_f1: 0.5921
 epoch: 76, train_loss: 0.3992, test_loss: 1.7357, test_f1: 0.5920
 epoch: 77, train_loss: 0.3356, test_loss: 1.8648, test_f1: 0.6122
 epoch: 78, train_loss: 0.3701, test_loss: 2.1045, test_f1: 0.5735
 epoch: 79, train_loss: 0.3364, test_loss: 1.9782, test_f1: 0.6053
 epoch: 80, train_loss: 0.3382, test_loss: 1.7884, test_f1: 0.6067
 epoch: 81, train_loss: 0.3280, test_loss: 2.1590, test_f1: 0.5644
 epoch: 82, train_loss: 0.3140, test_loss: 2.5913, test_f1: 0.5711
 epoch: 83, train_loss: 0.3196, test_loss: 2.3281, test_f1: 0.6342
 epoch: 84, train_loss: 0.2743, test_loss: 2.3210, test_f1: 0.5673
 epoch: 85, train_loss: 0.2834, test_loss: 2.4203, test_f1: 0.5732
 epoch: 86, train_loss: 0.3634, test_loss: 2.4298, test_f1: 0.6042
 epoch: 87, train_loss: 0.2918, test_loss: 2.1335, test_f1: 0.5825
 epoch: 88, train_loss: 0.3341, test_loss: 2.0428, test_f1: 0.5891
 epoch: 89, train_loss: 0.2963, test_loss: 2.0840, test_f1: 0.5957
 epoch: 90, train_loss: 0.3044, test_loss: 2.4833, test_f1: 0.5944
 epoch: 91, train_loss: 0.3315, test_loss: 2.1575, test_f1: 0.5873
 epoch: 92, train_loss: 0.2852, test_loss: 2.7561, test_f1: 0.5978
 epoch: 93, train_loss: 0.2700, test_loss: 2.5163, test_f1: 0.5792
 epoch: 94, train_loss: 0.2793, test_loss: 2.3158, test_f1: 0.6140
 epoch: 95, train_loss: 0.2639, test_loss: 2.5691, test_f1: 0.6059
 epoch: 96, train_loss: 0.2505, test_loss: 2.6026, test_f1: 0.6018
 epoch: 97, train_loss: 0.2758, test_loss: 2.6666, test_f1: 0.5919
 epoch: 98, train_loss: 0.2504, test_loss: 2.7001, test_f1: 0.5768
 epoch: 99, train_loss: 0.2221, test_loss: 2.8987, test_f1: 0.6129
##################ITERATION #9 ****************************************
 epoch: 0, train_loss: 1.1947, test_loss: 1.1392, test_f1: 0.4662
 epoch: 1, train_loss: 0.9714, test_loss: 1.0236, test_f1: 0.5399
 epoch: 2, train_loss: 0.9090, test_loss: 1.1113, test_f1: 0.4899
 epoch: 3, train_loss: 0.9008, test_loss: 1.0111, test_f1: 0.5408
 epoch: 4, train_loss: 0.8780, test_loss: 1.1256, test_f1: 0.5283
 epoch: 5, train_loss: 0.8804, test_loss: 0.9626, test_f1: 0.5427
 epoch: 6, train_loss: 0.8613, test_loss: 1.0182, test_f1: 0.5107
 epoch: 7, train_loss: 0.8381, test_loss: 1.2433, test_f1: 0.4338
 epoch: 8, train_loss: 0.8480, test_loss: 1.0177, test_f1: 0.5253
 epoch: 9, train_loss: 0.8151, test_loss: 1.0949, test_f1: 0.5384
 epoch: 10, train_loss: 0.7919, test_loss: 1.0758, test_f1: 0.5533
 epoch: 11, train_loss: 0.7697, test_loss: 0.9177, test_f1: 0.5424
 epoch: 12, train_loss: 0.7985, test_loss: 1.3005, test_f1: 0.5728
 epoch: 13, train_loss: 0.7993, test_loss: 0.9640, test_f1: 0.5465
 epoch: 14, train_loss: 0.7605, test_loss: 1.1983, test_f1: 0.5476
 epoch: 15, train_loss: 0.7355, test_loss: 1.0057, test_f1: 0.5109
 epoch: 16, train_loss: 0.7389, test_loss: 0.8907, test_f1: 0.6239
 epoch: 17, train_loss: 0.7519, test_loss: 1.0516, test_f1: 0.5686
 epoch: 18, train_loss: 0.7016, test_loss: 1.0053, test_f1: 0.6136
 epoch: 19, train_loss: 0.6711, test_loss: 1.1907, test_f1: 0.5926
 epoch: 20, train_loss: 0.6997, test_loss: 1.1804, test_f1: 0.5948
 epoch: 21, train_loss: 0.6657, test_loss: 1.1997, test_f1: 0.4919
 epoch: 22, train_loss: 0.6738, test_loss: 1.6075, test_f1: 0.5550
 epoch: 23, train_loss: 0.6772, test_loss: 1.0480, test_f1: 0.6108
 epoch: 24, train_loss: 0.6522, test_loss: 1.1231, test_f1: 0.5838
 epoch: 25, train_loss: 0.6503, test_loss: 1.1573, test_f1: 0.5877
 epoch: 26, train_loss: 0.6378, test_loss: 1.6001, test_f1: 0.5262
 epoch: 27, train_loss: 0.5993, test_loss: 1.0687, test_f1: 0.5327
 epoch: 28, train_loss: 0.6088, test_loss: 1.0455, test_f1: 0.6143
 epoch: 29, train_loss: 0.6020, test_loss: 0.9236, test_f1: 0.6569
 epoch: 30, train_loss: 0.6132, test_loss: 1.2624, test_f1: 0.5344
 epoch: 31, train_loss: 0.5738, test_loss: 1.2488, test_f1: 0.6075
 epoch: 32, train_loss: 0.5634, test_loss: 1.1132, test_f1: 0.6546
 epoch: 33, train_loss: 0.5631, test_loss: 1.0330, test_f1: 0.5756
 epoch: 34, train_loss: 0.5412, test_loss: 1.0448, test_f1: 0.6336
 epoch: 35, train_loss: 0.5850, test_loss: 1.1714, test_f1: 0.5694
 epoch: 36, train_loss: 0.5606, test_loss: 1.2344, test_f1: 0.6380
 epoch: 37, train_loss: 0.5546, test_loss: 1.6396, test_f1: 0.4609
 epoch: 38, train_loss: 0.5438, test_loss: 1.3263, test_f1: 0.5303
 epoch: 39, train_loss: 0.5495, test_loss: 1.0909, test_f1: 0.6100
 epoch: 40, train_loss: 0.5527, test_loss: 1.0266, test_f1: 0.6129
 epoch: 41, train_loss: 0.5151, test_loss: 1.2135, test_f1: 0.5793
 epoch: 42, train_loss: 0.5451, test_loss: 1.4412, test_f1: 0.4746
 epoch: 43, train_loss: 0.5330, test_loss: 1.0797, test_f1: 0.5842
 epoch: 44, train_loss: 0.5337, test_loss: 1.1065, test_f1: 0.5554
 epoch: 45, train_loss: 0.4984, test_loss: 1.2078, test_f1: 0.5668
 epoch: 46, train_loss: 0.4757, test_loss: 1.0442, test_f1: 0.5994
 epoch: 47, train_loss: 0.4750, test_loss: 1.3411, test_f1: 0.5616
 epoch: 48, train_loss: 0.4756, test_loss: 1.1300, test_f1: 0.6298
 epoch: 49, train_loss: 0.4913, test_loss: 1.4173, test_f1: 0.5997
 epoch: 50, train_loss: 0.5235, test_loss: 1.5672, test_f1: 0.5482
 epoch: 51, train_loss: 0.4327, test_loss: 1.4454, test_f1: 0.6178
 epoch: 52, train_loss: 0.4083, test_loss: 1.6355, test_f1: 0.5670
 epoch: 53, train_loss: 0.3907, test_loss: 1.4867, test_f1: 0.6016
 epoch: 54, train_loss: 0.3690, test_loss: 1.3330, test_f1: 0.6488
 epoch: 55, train_loss: 0.3633, test_loss: 1.3355, test_f1: 0.6181
 epoch: 56, train_loss: 0.3530, test_loss: 1.5520, test_f1: 0.6066
 epoch: 57, train_loss: 0.3836, test_loss: 1.4066, test_f1: 0.6148
 epoch: 58, train_loss: 0.3267, test_loss: 1.6599, test_f1: 0.6256
 epoch: 59, train_loss: 0.3732, test_loss: 1.3854, test_f1: 0.6247
 epoch: 60, train_loss: 0.3368, test_loss: 1.4643, test_f1: 0.6279
 epoch: 61, train_loss: 0.3259, test_loss: 1.5113, test_f1: 0.5935
 epoch: 62, train_loss: 0.3505, test_loss: 1.5229, test_f1: 0.6382
 epoch: 63, train_loss: 0.3289, test_loss: 1.9050, test_f1: 0.5890
 epoch: 64, train_loss: 0.3444, test_loss: 1.6849, test_f1: 0.6308
 epoch: 65, train_loss: 0.3386, test_loss: 1.8470, test_f1: 0.6207
 epoch: 66, train_loss: 0.3552, test_loss: 1.6608, test_f1: 0.6122
 epoch: 67, train_loss: 0.3498, test_loss: 1.5965, test_f1: 0.6320
 epoch: 68, train_loss: 0.3338, test_loss: 1.6364, test_f1: 0.6040
 epoch: 69, train_loss: 0.3208, test_loss: 1.7755, test_f1: 0.6310
 epoch: 70, train_loss: 0.2934, test_loss: 1.7563, test_f1: 0.6292
 epoch: 71, train_loss: 0.3207, test_loss: 2.0686, test_f1: 0.6051
 epoch: 72, train_loss: 0.2955, test_loss: 1.8734, test_f1: 0.6339
 epoch: 73, train_loss: 0.2760, test_loss: 1.8803, test_f1: 0.6397
 epoch: 74, train_loss: 0.3021, test_loss: 1.8358, test_f1: 0.6219
 epoch: 75, train_loss: 0.3437, test_loss: 1.7447, test_f1: 0.6085
 epoch: 76, train_loss: 0.3116, test_loss: 1.8726, test_f1: 0.6296
 epoch: 77, train_loss: 0.2749, test_loss: 1.9637, test_f1: 0.6091
 epoch: 78, train_loss: 0.2525, test_loss: 2.2428, test_f1: 0.6056
 epoch: 79, train_loss: 0.2761, test_loss: 2.2162, test_f1: 0.6315
 epoch: 80, train_loss: 0.2620, test_loss: 2.1359, test_f1: 0.5965
 epoch: 81, train_loss: 0.2479, test_loss: 2.0922, test_f1: 0.6375
 epoch: 82, train_loss: 0.2543, test_loss: 2.2156, test_f1: 0.6108
 epoch: 83, train_loss: 0.2685, test_loss: 2.2516, test_f1: 0.6337
 epoch: 84, train_loss: 0.2261, test_loss: 2.4261, test_f1: 0.5800
 epoch: 85, train_loss: 0.2577, test_loss: 2.1100, test_f1: 0.6159
 epoch: 86, train_loss: 0.2650, test_loss: 1.8070, test_f1: 0.6455
 epoch: 87, train_loss: 0.2785, test_loss: 1.9606, test_f1: 0.6294
 epoch: 88, train_loss: 0.2315, test_loss: 2.6343, test_f1: 0.6101
 epoch: 89, train_loss: 0.2214, test_loss: 1.8520, test_f1: 0.5953
 epoch: 90, train_loss: 0.2677, test_loss: 1.9719, test_f1: 0.6176
 epoch: 91, train_loss: 0.2879, test_loss: 1.9486, test_f1: 0.6341
 epoch: 92, train_loss: 0.2317, test_loss: 2.0754, test_f1: 0.6382
 epoch: 93, train_loss: 0.2507, test_loss: 2.1597, test_f1: 0.6034
 epoch: 94, train_loss: 0.2245, test_loss: 1.8226, test_f1: 0.6249
 epoch: 95, train_loss: 0.2267, test_loss: 1.9820, test_f1: 0.6377
 epoch: 96, train_loss: 0.2387, test_loss: 1.9038, test_f1: 0.6456
 epoch: 97, train_loss: 0.2110, test_loss: 1.9679, test_f1: 0.6262
 epoch: 98, train_loss: 0.2141, test_loss: 1.9073, test_f1: 0.6405
 epoch: 99, train_loss: 0.2041, test_loss: 1.9930, test_f1: 0.6421

Training completed in 388.07 seconds
Best F1: 0.7043 at epoch 81
Mean F1 across iterations: 0.6741  0.0148
========================FINAL RESULTS================================
FEGIN weighted F1: 0.7043  0.0148
python main.py --data ltspice_demos --representation component_pin --model FEGIN --layers 2 --hiddens 128 --batch_size 64 --lr 0.01 --emb_size 512 --epochs 100 --save_appendix component_pin_L2_H128_BS64_LR0.01_E512 --no_val
-----



STDERR:
  File "main.py", line 370, in <module>
    main()
  File "main.py", line 254, in main
    dataset = dataset_class(
  File "/home/philip/projects/ltspice_examples_code_repo/Circuit-Completion-Using-GNNs/component_classification_with_link_prediction_head/evaluation/FEGIN/kernel/circuit_datasets.py", line 15, in __init__
    self.data, self.slices = torch.load(self.processed_paths[0])
  File "/home/philip/.local/lib/python3.8/site-packages/torch/serialization.py", line 1040, in load
    warnings.warn(
  File "/usr/lib/python3.8/warnings.py", line 109, in _showwarnmsg
    sw(msg.message, msg.category, msg.filename, msg.lineno,
  File "main.py", line 47, in warn_with_traceback
    traceback.print_stack(file=log)
/home/philip/projects/ltspice_examples_code_repo/Circuit-Completion-Using-GNNs/component_classification_with_link_prediction_head/evaluation/FEGIN/kernel/circuit_datasets.py:15: FutureWarning: You are using `torch.load` with `weights_only=False` (the current default value), which uses the default pickle module implicitly. It is possible to construct malicious pickle data which will execute arbitrary code during unpickling (See https://github.com/pytorch/pytorch/blob/main/SECURITY.md#untrusted-models for more details). In a future release, the default value for `weights_only` will be flipped to `True`. This limits the functions that could be executed during unpickling. Arbitrary objects will no longer be allowed to be loaded via this mode unless they are explicitly allowlisted by the user via `torch.serialization.add_safe_globals`. We recommend you start setting `weights_only=True` for any use case where you don't have full control of the loaded file. Please open an issue on GitHub for any issues related to this experimental feature.
  self.data, self.slices = torch.load(self.processed_paths[0])
