STDOUT:
Results will be saved in /home/philip/projects/ltspice_examples_code_repo/Circuit-Completion-Using-GNNs/component_classification_with_link_prediction_head/evaluation/FEGIN/results/model_FEGIN_dataset_ltspice_examples
Command line input: python main.py --data ltspice_examples --representation component_pin --model FEGIN --layers 2 --hiddens 128 --batch_size 64 --lr 0.01 --emb_size 512 --epochs 100 --save_appendix component_pin_L2_H128_BS64_LR0.01_E512 --no_val
 is saved.
-----
ltspice_examples - FEGIN
Using 2 layers, 128 hidden units, h = 2
Loading component_pin representation dataset
ENTERED
Training FEGIN on component_pin representation
Train: 3560, Test: 848
##################ITERATION #0 ****************************************
 epoch: 0, train_loss: 1.1687, test_loss: 1.3365, test_f1: 0.3453
 epoch: 1, train_loss: 1.0108, test_loss: 1.0074, test_f1: 0.5140
 epoch: 2, train_loss: 0.9492, test_loss: 0.9825, test_f1: 0.4350
 epoch: 3, train_loss: 0.9379, test_loss: 1.0560, test_f1: 0.4759
 epoch: 4, train_loss: 0.8889, test_loss: 0.8762, test_f1: 0.5340
 epoch: 5, train_loss: 0.8722, test_loss: 0.9958, test_f1: 0.4774
 epoch: 6, train_loss: 0.8488, test_loss: 0.8361, test_f1: 0.5687
 epoch: 7, train_loss: 0.8448, test_loss: 0.8447, test_f1: 0.6058
 epoch: 8, train_loss: 0.8394, test_loss: 0.9875, test_f1: 0.5752
 epoch: 9, train_loss: 0.8066, test_loss: 0.9042, test_f1: 0.5811
 epoch: 10, train_loss: 0.8193, test_loss: 0.8507, test_f1: 0.6263
 epoch: 11, train_loss: 0.7805, test_loss: 0.8346, test_f1: 0.5573
 epoch: 12, train_loss: 0.7864, test_loss: 0.7869, test_f1: 0.6194
 epoch: 13, train_loss: 0.7513, test_loss: 0.8565, test_f1: 0.5879
 epoch: 14, train_loss: 0.7712, test_loss: 0.9467, test_f1: 0.6209
 epoch: 15, train_loss: 0.7353, test_loss: 0.8483, test_f1: 0.5552
 epoch: 16, train_loss: 0.7275, test_loss: 0.7968, test_f1: 0.5743
 epoch: 17, train_loss: 0.7038, test_loss: 0.7704, test_f1: 0.6161
 epoch: 18, train_loss: 0.7010, test_loss: 1.1743, test_f1: 0.5482
 epoch: 19, train_loss: 0.7025, test_loss: 0.9043, test_f1: 0.6003
 epoch: 20, train_loss: 0.6844, test_loss: 0.9627, test_f1: 0.5705
 epoch: 21, train_loss: 0.6749, test_loss: 0.8146, test_f1: 0.6014
 epoch: 22, train_loss: 0.6608, test_loss: 1.0786, test_f1: 0.6011
 epoch: 23, train_loss: 0.6696, test_loss: 0.8873, test_f1: 0.6159
 epoch: 24, train_loss: 0.6485, test_loss: 0.8779, test_f1: 0.6131
 epoch: 25, train_loss: 0.6407, test_loss: 0.8233, test_f1: 0.6503
 epoch: 26, train_loss: 0.6350, test_loss: 0.8214, test_f1: 0.6347
 epoch: 27, train_loss: 0.6449, test_loss: 1.4739, test_f1: 0.5284
 epoch: 28, train_loss: 0.6280, test_loss: 0.7693, test_f1: 0.5883
 epoch: 29, train_loss: 0.6380, test_loss: 0.7644, test_f1: 0.6377
 epoch: 30, train_loss: 0.6322, test_loss: 0.9158, test_f1: 0.6830
 epoch: 31, train_loss: 0.6036, test_loss: 0.7786, test_f1: 0.6395
 epoch: 32, train_loss: 0.5704, test_loss: 1.0804, test_f1: 0.6336
 epoch: 33, train_loss: 0.5607, test_loss: 0.9100, test_f1: 0.6585
 epoch: 34, train_loss: 0.5975, test_loss: 0.8118, test_f1: 0.6739
 epoch: 35, train_loss: 0.5547, test_loss: 0.7269, test_f1: 0.6409
 epoch: 36, train_loss: 0.5667, test_loss: 0.9424, test_f1: 0.6608
 epoch: 37, train_loss: 0.6005, test_loss: 0.7431, test_f1: 0.6254
 epoch: 38, train_loss: 0.5628, test_loss: 0.8426, test_f1: 0.6567
 epoch: 39, train_loss: 0.5699, test_loss: 1.1296, test_f1: 0.6447
 epoch: 40, train_loss: 0.5268, test_loss: 1.1208, test_f1: 0.6522
 epoch: 41, train_loss: 0.5269, test_loss: 0.9143, test_f1: 0.6339
 epoch: 42, train_loss: 0.5245, test_loss: 0.8071, test_f1: 0.6467
 epoch: 43, train_loss: 0.5009, test_loss: 0.9325, test_f1: 0.6650
 epoch: 44, train_loss: 0.4981, test_loss: 1.2164, test_f1: 0.6729
 epoch: 45, train_loss: 0.4961, test_loss: 1.1008, test_f1: 0.6781
 epoch: 46, train_loss: 0.5215, test_loss: 1.3077, test_f1: 0.6728
 epoch: 47, train_loss: 0.4896, test_loss: 0.7796, test_f1: 0.6806
 epoch: 48, train_loss: 0.5143, test_loss: 1.3339, test_f1: 0.6245
 epoch: 49, train_loss: 0.4916, test_loss: 0.9175, test_f1: 0.6732
 epoch: 50, train_loss: 0.4725, test_loss: 1.2662, test_f1: 0.6419
 epoch: 51, train_loss: 0.4244, test_loss: 1.0945, test_f1: 0.6656
 epoch: 52, train_loss: 0.4021, test_loss: 1.0733, test_f1: 0.6871
 epoch: 53, train_loss: 0.3986, test_loss: 1.0958, test_f1: 0.6801
 epoch: 54, train_loss: 0.3864, test_loss: 1.1981, test_f1: 0.6961
 epoch: 55, train_loss: 0.3873, test_loss: 1.0911, test_f1: 0.6928
 epoch: 56, train_loss: 0.3682, test_loss: 0.9595, test_f1: 0.6756
 epoch: 57, train_loss: 0.3838, test_loss: 1.2040, test_f1: 0.6912
 epoch: 58, train_loss: 0.3648, test_loss: 1.0129, test_f1: 0.6877
 epoch: 59, train_loss: 0.3577, test_loss: 1.0829, test_f1: 0.6936
 epoch: 60, train_loss: 0.3602, test_loss: 1.0172, test_f1: 0.6860
 epoch: 61, train_loss: 0.3624, test_loss: 0.9941, test_f1: 0.6946
 epoch: 62, train_loss: 0.3453, test_loss: 1.3301, test_f1: 0.6828
 epoch: 63, train_loss: 0.3766, test_loss: 1.1222, test_f1: 0.6810
 epoch: 64, train_loss: 0.3501, test_loss: 1.1508, test_f1: 0.7070
 epoch: 65, train_loss: 0.3301, test_loss: 1.3668, test_f1: 0.6974
 epoch: 66, train_loss: 0.3272, test_loss: 1.3714, test_f1: 0.6939
 epoch: 67, train_loss: 0.3094, test_loss: 1.2485, test_f1: 0.6928
 epoch: 68, train_loss: 0.3308, test_loss: 1.2108, test_f1: 0.6918
 epoch: 69, train_loss: 0.3309, test_loss: 1.2621, test_f1: 0.7091
 epoch: 70, train_loss: 0.3582, test_loss: 1.3142, test_f1: 0.6698
 epoch: 71, train_loss: 0.3625, test_loss: 1.3811, test_f1: 0.6710
 epoch: 72, train_loss: 0.3121, test_loss: 1.6112, test_f1: 0.6605
 epoch: 73, train_loss: 0.3091, test_loss: 1.4132, test_f1: 0.6940
 epoch: 74, train_loss: 0.3107, test_loss: 1.6116, test_f1: 0.6928
 epoch: 75, train_loss: 0.3058, test_loss: 1.2335, test_f1: 0.7077
 epoch: 76, train_loss: 0.2968, test_loss: 1.5360, test_f1: 0.6889
 epoch: 77, train_loss: 0.2940, test_loss: 1.3614, test_f1: 0.6943
 epoch: 78, train_loss: 0.3375, test_loss: 1.4108, test_f1: 0.6870
 epoch: 79, train_loss: 0.2860, test_loss: 1.3288, test_f1: 0.6817
 epoch: 80, train_loss: 0.3065, test_loss: 1.4054, test_f1: 0.6808
 epoch: 81, train_loss: 0.2736, test_loss: 1.5173, test_f1: 0.6862
 epoch: 82, train_loss: 0.2830, test_loss: 1.7125, test_f1: 0.6821
 epoch: 83, train_loss: 0.2875, test_loss: 1.4464, test_f1: 0.7026
 epoch: 84, train_loss: 0.2702, test_loss: 1.4649, test_f1: 0.6561
 epoch: 85, train_loss: 0.2743, test_loss: 1.4297, test_f1: 0.6732
 epoch: 86, train_loss: 0.2818, test_loss: 1.3512, test_f1: 0.6943
 epoch: 87, train_loss: 0.2656, test_loss: 1.5741, test_f1: 0.6814
 epoch: 88, train_loss: 0.2756, test_loss: 1.4866, test_f1: 0.6765
 epoch: 89, train_loss: 0.2670, test_loss: 1.4145, test_f1: 0.6841
 epoch: 90, train_loss: 0.2622, test_loss: 1.5261, test_f1: 0.6893
 epoch: 91, train_loss: 0.2679, test_loss: 1.2857, test_f1: 0.6707
 epoch: 92, train_loss: 0.2627, test_loss: 1.6444, test_f1: 0.6772
 epoch: 93, train_loss: 0.2812, test_loss: 1.0964, test_f1: 0.6760
 epoch: 94, train_loss: 0.2687, test_loss: 1.5248, test_f1: 0.6810
 epoch: 95, train_loss: 0.2828, test_loss: 1.4161, test_f1: 0.6798
 epoch: 96, train_loss: 0.2313, test_loss: 1.8135, test_f1: 0.6838
 epoch: 97, train_loss: 0.2380, test_loss: 1.5877, test_f1: 0.6748
 epoch: 98, train_loss: 0.2872, test_loss: 1.4591, test_f1: 0.6657
 epoch: 99, train_loss: 0.2887, test_loss: 1.2712, test_f1: 0.6854
##################ITERATION #1 ****************************************
 epoch: 0, train_loss: 1.1423, test_loss: 1.0828, test_f1: 0.3410
 epoch: 1, train_loss: 0.9955, test_loss: 0.9579, test_f1: 0.5392
 epoch: 2, train_loss: 0.9380, test_loss: 0.9495, test_f1: 0.4979
 epoch: 3, train_loss: 0.9150, test_loss: 0.9786, test_f1: 0.4675
 epoch: 4, train_loss: 0.8890, test_loss: 0.9955, test_f1: 0.5134
 epoch: 5, train_loss: 0.8645, test_loss: 0.9560, test_f1: 0.5644
 epoch: 6, train_loss: 0.8434, test_loss: 0.9026, test_f1: 0.5239
 epoch: 7, train_loss: 0.8264, test_loss: 1.0744, test_f1: 0.5202
 epoch: 8, train_loss: 0.8239, test_loss: 0.8538, test_f1: 0.5251
 epoch: 9, train_loss: 0.8014, test_loss: 0.9954, test_f1: 0.4844
 epoch: 10, train_loss: 0.8053, test_loss: 0.8988, test_f1: 0.5118
 epoch: 11, train_loss: 0.7705, test_loss: 0.8584, test_f1: 0.5839
 epoch: 12, train_loss: 0.7834, test_loss: 0.7879, test_f1: 0.5751
 epoch: 13, train_loss: 0.7617, test_loss: 1.0193, test_f1: 0.5399
 epoch: 14, train_loss: 0.7671, test_loss: 0.9708, test_f1: 0.6195
 epoch: 15, train_loss: 0.7189, test_loss: 1.0105, test_f1: 0.5836
 epoch: 16, train_loss: 0.7527, test_loss: 0.8222, test_f1: 0.6398
 epoch: 17, train_loss: 0.7032, test_loss: 0.9085, test_f1: 0.6079
 epoch: 18, train_loss: 0.6969, test_loss: 0.9045, test_f1: 0.5924
 epoch: 19, train_loss: 0.6849, test_loss: 0.8684, test_f1: 0.6154
 epoch: 20, train_loss: 0.6811, test_loss: 1.0675, test_f1: 0.5497
 epoch: 21, train_loss: 0.6590, test_loss: 0.9290, test_f1: 0.6581
 epoch: 22, train_loss: 0.6794, test_loss: 0.9897, test_f1: 0.5644
 epoch: 23, train_loss: 0.6694, test_loss: 0.8597, test_f1: 0.5647
 epoch: 24, train_loss: 0.6779, test_loss: 1.0921, test_f1: 0.5444
 epoch: 25, train_loss: 0.6292, test_loss: 1.2154, test_f1: 0.6266
 epoch: 26, train_loss: 0.6500, test_loss: 0.8942, test_f1: 0.6192
 epoch: 27, train_loss: 0.6708, test_loss: 1.0669, test_f1: 0.5397
 epoch: 28, train_loss: 0.6293, test_loss: 1.0310, test_f1: 0.5965
 epoch: 29, train_loss: 0.6214, test_loss: 1.0300, test_f1: 0.5984
 epoch: 30, train_loss: 0.6286, test_loss: 0.8991, test_f1: 0.6696
 epoch: 31, train_loss: 0.5913, test_loss: 0.9702, test_f1: 0.6372
 epoch: 32, train_loss: 0.5998, test_loss: 0.9304, test_f1: 0.6554
 epoch: 33, train_loss: 0.5839, test_loss: 0.9876, test_f1: 0.6363
 epoch: 34, train_loss: 0.5999, test_loss: 0.9760, test_f1: 0.6553
 epoch: 35, train_loss: 0.5826, test_loss: 1.0447, test_f1: 0.5950
 epoch: 36, train_loss: 0.5651, test_loss: 1.0918, test_f1: 0.6162
 epoch: 37, train_loss: 0.5645, test_loss: 0.9975, test_f1: 0.5995
 epoch: 38, train_loss: 0.5700, test_loss: 0.7586, test_f1: 0.7151
 epoch: 39, train_loss: 0.5348, test_loss: 1.0054, test_f1: 0.6572
 epoch: 40, train_loss: 0.5411, test_loss: 0.9881, test_f1: 0.6991
 epoch: 41, train_loss: 0.5018, test_loss: 1.1556, test_f1: 0.7300
 epoch: 42, train_loss: 0.5294, test_loss: 1.0519, test_f1: 0.6662
 epoch: 43, train_loss: 0.5128, test_loss: 1.3670, test_f1: 0.6202
 epoch: 44, train_loss: 0.5210, test_loss: 1.0767, test_f1: 0.6453
 epoch: 45, train_loss: 0.5098, test_loss: 1.0558, test_f1: 0.6438
 epoch: 46, train_loss: 0.4923, test_loss: 0.9877, test_f1: 0.6449
 epoch: 47, train_loss: 0.4939, test_loss: 1.0133, test_f1: 0.6534
 epoch: 48, train_loss: 0.4780, test_loss: 1.1691, test_f1: 0.6347
 epoch: 49, train_loss: 0.4742, test_loss: 1.2452, test_f1: 0.6664
 epoch: 50, train_loss: 0.4775, test_loss: 1.0642, test_f1: 0.6825
 epoch: 51, train_loss: 0.4415, test_loss: 0.9502, test_f1: 0.6745
 epoch: 52, train_loss: 0.3977, test_loss: 1.1417, test_f1: 0.6906
 epoch: 53, train_loss: 0.3867, test_loss: 1.1083, test_f1: 0.6776
 epoch: 54, train_loss: 0.3891, test_loss: 1.1170, test_f1: 0.6812
 epoch: 55, train_loss: 0.3683, test_loss: 1.1079, test_f1: 0.6853
 epoch: 56, train_loss: 0.3677, test_loss: 1.0936, test_f1: 0.6782
 epoch: 57, train_loss: 0.3786, test_loss: 1.1618, test_f1: 0.6753
 epoch: 58, train_loss: 0.3738, test_loss: 1.2632, test_f1: 0.6444
 epoch: 59, train_loss: 0.3494, test_loss: 1.2740, test_f1: 0.6706
 epoch: 60, train_loss: 0.3369, test_loss: 1.1205, test_f1: 0.6800
 epoch: 61, train_loss: 0.3636, test_loss: 1.1972, test_f1: 0.6518
 epoch: 62, train_loss: 0.3420, test_loss: 1.3245, test_f1: 0.6610
 epoch: 63, train_loss: 0.3441, test_loss: 1.3661, test_f1: 0.6581
 epoch: 64, train_loss: 0.3287, test_loss: 1.1260, test_f1: 0.6828
 epoch: 65, train_loss: 0.3249, test_loss: 1.1800, test_f1: 0.6661
 epoch: 66, train_loss: 0.3316, test_loss: 1.3400, test_f1: 0.6621
 epoch: 67, train_loss: 0.3237, test_loss: 1.4075, test_f1: 0.6878
 epoch: 68, train_loss: 0.3337, test_loss: 1.3576, test_f1: 0.6750
 epoch: 69, train_loss: 0.3253, test_loss: 1.3025, test_f1: 0.6770
 epoch: 70, train_loss: 0.3121, test_loss: 1.3531, test_f1: 0.6849
 epoch: 71, train_loss: 0.3145, test_loss: 1.4278, test_f1: 0.6576
 epoch: 72, train_loss: 0.2978, test_loss: 1.6703, test_f1: 0.6763
 epoch: 73, train_loss: 0.3120, test_loss: 1.4229, test_f1: 0.6826
 epoch: 74, train_loss: 0.3284, test_loss: 1.5590, test_f1: 0.6742
 epoch: 75, train_loss: 0.2940, test_loss: 1.4951, test_f1: 0.6680
 epoch: 76, train_loss: 0.2878, test_loss: 1.3989, test_f1: 0.6776
 epoch: 77, train_loss: 0.2929, test_loss: 1.5090, test_f1: 0.6678
 epoch: 78, train_loss: 0.3048, test_loss: 1.3281, test_f1: 0.6807
 epoch: 79, train_loss: 0.2989, test_loss: 1.2664, test_f1: 0.6803
 epoch: 80, train_loss: 0.3120, test_loss: 1.2617, test_f1: 0.6719
 epoch: 81, train_loss: 0.2780, test_loss: 1.3626, test_f1: 0.6854
 epoch: 82, train_loss: 0.2907, test_loss: 1.3292, test_f1: 0.6782
 epoch: 83, train_loss: 0.2788, test_loss: 1.4457, test_f1: 0.6592
 epoch: 84, train_loss: 0.2850, test_loss: 1.4918, test_f1: 0.6747
 epoch: 85, train_loss: 0.2732, test_loss: 1.4714, test_f1: 0.6771
 epoch: 86, train_loss: 0.2849, test_loss: 1.4651, test_f1: 0.6682
 epoch: 87, train_loss: 0.2718, test_loss: 1.5636, test_f1: 0.6568
 epoch: 88, train_loss: 0.2626, test_loss: 1.5810, test_f1: 0.6820
 epoch: 89, train_loss: 0.2481, test_loss: 1.4746, test_f1: 0.6718
 epoch: 90, train_loss: 0.2463, test_loss: 1.6164, test_f1: 0.6790
 epoch: 91, train_loss: 0.2734, test_loss: 1.5829, test_f1: 0.6387
 epoch: 92, train_loss: 0.2597, test_loss: 1.6247, test_f1: 0.6794
 epoch: 93, train_loss: 0.2572, test_loss: 1.6104, test_f1: 0.6609
 epoch: 94, train_loss: 0.2362, test_loss: 1.3692, test_f1: 0.6838
 epoch: 95, train_loss: 0.2597, test_loss: 1.3960, test_f1: 0.6666
 epoch: 96, train_loss: 0.2644, test_loss: 1.3716, test_f1: 0.7007
 epoch: 97, train_loss: 0.2557, test_loss: 1.5420, test_f1: 0.6759
 epoch: 98, train_loss: 0.2787, test_loss: 1.3873, test_f1: 0.6872
 epoch: 99, train_loss: 0.2307, test_loss: 1.6304, test_f1: 0.6710
##################ITERATION #2 ****************************************
 epoch: 0, train_loss: 1.1713, test_loss: 1.2355, test_f1: 0.3622
 epoch: 1, train_loss: 1.0216, test_loss: 1.0891, test_f1: 0.4465
 epoch: 2, train_loss: 0.9847, test_loss: 0.9697, test_f1: 0.5354
 epoch: 3, train_loss: 0.9461, test_loss: 1.0477, test_f1: 0.4755
 epoch: 4, train_loss: 0.9331, test_loss: 0.9478, test_f1: 0.5483
 epoch: 5, train_loss: 0.9073, test_loss: 0.9984, test_f1: 0.5394
 epoch: 6, train_loss: 0.9001, test_loss: 0.9062, test_f1: 0.5663
 epoch: 7, train_loss: 0.8582, test_loss: 0.8105, test_f1: 0.5339
 epoch: 8, train_loss: 0.8643, test_loss: 0.9206, test_f1: 0.5233
 epoch: 9, train_loss: 0.8470, test_loss: 0.9183, test_f1: 0.5172
 epoch: 10, train_loss: 0.8435, test_loss: 0.8566, test_f1: 0.5348
 epoch: 11, train_loss: 0.8310, test_loss: 0.9084, test_f1: 0.5138
 epoch: 12, train_loss: 0.8267, test_loss: 0.9974, test_f1: 0.4667
 epoch: 13, train_loss: 0.8062, test_loss: 0.9026, test_f1: 0.5123
 epoch: 14, train_loss: 0.7981, test_loss: 0.9500, test_f1: 0.5498
 epoch: 15, train_loss: 0.7863, test_loss: 0.8032, test_f1: 0.5470
 epoch: 16, train_loss: 0.7816, test_loss: 0.9835, test_f1: 0.5156
 epoch: 17, train_loss: 0.7592, test_loss: 0.8587, test_f1: 0.5466
 epoch: 18, train_loss: 0.7404, test_loss: 0.9399, test_f1: 0.5802
 epoch: 19, train_loss: 0.7562, test_loss: 0.8382, test_f1: 0.5875
 epoch: 20, train_loss: 0.7644, test_loss: 0.8071, test_f1: 0.5686
 epoch: 21, train_loss: 0.7473, test_loss: 0.8451, test_f1: 0.5132
 epoch: 22, train_loss: 0.7235, test_loss: 0.7997, test_f1: 0.5444
 epoch: 23, train_loss: 0.7124, test_loss: 0.9262, test_f1: 0.5855
 epoch: 24, train_loss: 0.7340, test_loss: 0.9440, test_f1: 0.5546
 epoch: 25, train_loss: 0.7013, test_loss: 0.8320, test_f1: 0.5532
 epoch: 26, train_loss: 0.7208, test_loss: 0.9042, test_f1: 0.5824
 epoch: 27, train_loss: 0.7283, test_loss: 0.8659, test_f1: 0.5723
 epoch: 28, train_loss: 0.7029, test_loss: 1.0035, test_f1: 0.5838
 epoch: 29, train_loss: 0.6805, test_loss: 0.8572, test_f1: 0.5807
 epoch: 30, train_loss: 0.6611, test_loss: 0.9102, test_f1: 0.5397
 epoch: 31, train_loss: 0.6843, test_loss: 0.8537, test_f1: 0.6264
 epoch: 32, train_loss: 0.6458, test_loss: 0.9563, test_f1: 0.6420
 epoch: 33, train_loss: 0.6680, test_loss: 0.8478, test_f1: 0.5722
 epoch: 34, train_loss: 0.6635, test_loss: 0.8875, test_f1: 0.6258
 epoch: 35, train_loss: 0.6431, test_loss: 0.9628, test_f1: 0.5935
 epoch: 36, train_loss: 0.6361, test_loss: 1.0615, test_f1: 0.5352
 epoch: 37, train_loss: 0.6456, test_loss: 0.9257, test_f1: 0.5596
 epoch: 38, train_loss: 0.6237, test_loss: 0.8479, test_f1: 0.5895
 epoch: 39, train_loss: 0.6018, test_loss: 0.9914, test_f1: 0.5789
 epoch: 40, train_loss: 0.6108, test_loss: 0.9599, test_f1: 0.6390
 epoch: 41, train_loss: 0.6115, test_loss: 0.9948, test_f1: 0.5276
 epoch: 42, train_loss: 0.6038, test_loss: 0.8426, test_f1: 0.6090
 epoch: 43, train_loss: 0.5976, test_loss: 1.0352, test_f1: 0.6064
 epoch: 44, train_loss: 0.5956, test_loss: 1.0344, test_f1: 0.6249
 epoch: 45, train_loss: 0.5912, test_loss: 0.9717, test_f1: 0.5993
 epoch: 46, train_loss: 0.6278, test_loss: 0.9006, test_f1: 0.6366
 epoch: 47, train_loss: 0.5629, test_loss: 0.9665, test_f1: 0.6346
 epoch: 48, train_loss: 0.5784, test_loss: 0.9251, test_f1: 0.6448
 epoch: 49, train_loss: 0.5685, test_loss: 0.8196, test_f1: 0.6635
 epoch: 50, train_loss: 0.5535, test_loss: 1.4534, test_f1: 0.6120
 epoch: 51, train_loss: 0.5148, test_loss: 0.9483, test_f1: 0.6602
 epoch: 52, train_loss: 0.5068, test_loss: 0.8431, test_f1: 0.6622
 epoch: 53, train_loss: 0.4752, test_loss: 0.9404, test_f1: 0.6032
 epoch: 54, train_loss: 0.4731, test_loss: 1.1588, test_f1: 0.6372
 epoch: 55, train_loss: 0.4647, test_loss: 0.9374, test_f1: 0.6685
 epoch: 56, train_loss: 0.4697, test_loss: 1.1720, test_f1: 0.6848
 epoch: 57, train_loss: 0.4814, test_loss: 0.8919, test_f1: 0.6315
 epoch: 58, train_loss: 0.4529, test_loss: 0.9689, test_f1: 0.6731
 epoch: 59, train_loss: 0.4538, test_loss: 0.9235, test_f1: 0.6705
 epoch: 60, train_loss: 0.4498, test_loss: 0.8555, test_f1: 0.6894
 epoch: 61, train_loss: 0.4566, test_loss: 0.8497, test_f1: 0.6775
 epoch: 62, train_loss: 0.4463, test_loss: 1.0269, test_f1: 0.6550
 epoch: 63, train_loss: 0.4375, test_loss: 0.9523, test_f1: 0.6641
 epoch: 64, train_loss: 0.4386, test_loss: 1.0274, test_f1: 0.6795
 epoch: 65, train_loss: 0.4225, test_loss: 0.9320, test_f1: 0.6551
 epoch: 66, train_loss: 0.4229, test_loss: 1.0967, test_f1: 0.6637
 epoch: 67, train_loss: 0.4121, test_loss: 1.1180, test_f1: 0.6399
 epoch: 68, train_loss: 0.4181, test_loss: 0.9874, test_f1: 0.6610
 epoch: 69, train_loss: 0.4221, test_loss: 1.0447, test_f1: 0.6818
 epoch: 70, train_loss: 0.4057, test_loss: 0.9636, test_f1: 0.6708
 epoch: 71, train_loss: 0.4073, test_loss: 1.0075, test_f1: 0.6528
 epoch: 72, train_loss: 0.4152, test_loss: 0.9284, test_f1: 0.6847
 epoch: 73, train_loss: 0.4054, test_loss: 1.0996, test_f1: 0.6731
 epoch: 74, train_loss: 0.4045, test_loss: 1.3771, test_f1: 0.6606
 epoch: 75, train_loss: 0.4027, test_loss: 0.9757, test_f1: 0.6694
 epoch: 76, train_loss: 0.3858, test_loss: 0.9222, test_f1: 0.6571
 epoch: 77, train_loss: 0.3765, test_loss: 1.0303, test_f1: 0.6677
 epoch: 78, train_loss: 0.3897, test_loss: 1.1324, test_f1: 0.7055
 epoch: 79, train_loss: 0.3811, test_loss: 1.3635, test_f1: 0.6739
 epoch: 80, train_loss: 0.3754, test_loss: 1.1184, test_f1: 0.6723
 epoch: 81, train_loss: 0.4016, test_loss: 1.1796, test_f1: 0.6608
 epoch: 82, train_loss: 0.3760, test_loss: 1.0311, test_f1: 0.6632
 epoch: 83, train_loss: 0.3723, test_loss: 0.8393, test_f1: 0.6751
 epoch: 84, train_loss: 0.3691, test_loss: 0.9965, test_f1: 0.6721
 epoch: 85, train_loss: 0.3722, test_loss: 1.0249, test_f1: 0.6968
 epoch: 86, train_loss: 0.3518, test_loss: 0.9681, test_f1: 0.6709
 epoch: 87, train_loss: 0.3618, test_loss: 1.0323, test_f1: 0.6739
 epoch: 88, train_loss: 0.3528, test_loss: 1.0344, test_f1: 0.6675
 epoch: 89, train_loss: 0.3537, test_loss: 1.0733, test_f1: 0.6552
 epoch: 90, train_loss: 0.3518, test_loss: 1.0870, test_f1: 0.6712
 epoch: 91, train_loss: 0.3428, test_loss: 1.2406, test_f1: 0.6482
 epoch: 92, train_loss: 0.3329, test_loss: 1.0851, test_f1: 0.6648
 epoch: 93, train_loss: 0.3333, test_loss: 0.9980, test_f1: 0.6593
 epoch: 94, train_loss: 0.3302, test_loss: 1.1335, test_f1: 0.6572
 epoch: 95, train_loss: 0.3284, test_loss: 1.2191, test_f1: 0.6656
 epoch: 96, train_loss: 0.3368, test_loss: 1.0431, test_f1: 0.6735
 epoch: 97, train_loss: 0.3309, test_loss: 1.0578, test_f1: 0.6724
 epoch: 98, train_loss: 0.3111, test_loss: 1.2114, test_f1: 0.6603
 epoch: 99, train_loss: 0.3418, test_loss: 1.2348, test_f1: 0.6476
##################ITERATION #3 ****************************************
 epoch: 0, train_loss: 1.2062, test_loss: 1.1710, test_f1: 0.3361
 epoch: 1, train_loss: 1.0970, test_loss: 1.2061, test_f1: 0.3843
 epoch: 2, train_loss: 1.0603, test_loss: 1.1847, test_f1: 0.3383
 epoch: 3, train_loss: 1.0410, test_loss: 1.1075, test_f1: 0.3392
 epoch: 4, train_loss: 1.0090, test_loss: 1.0532, test_f1: 0.3470
 epoch: 5, train_loss: 0.9912, test_loss: 0.9620, test_f1: 0.3731
 epoch: 6, train_loss: 0.9923, test_loss: 0.9942, test_f1: 0.3901
 epoch: 7, train_loss: 0.9588, test_loss: 1.1605, test_f1: 0.4760
 epoch: 8, train_loss: 0.9575, test_loss: 0.9685, test_f1: 0.5116
 epoch: 9, train_loss: 0.9337, test_loss: 0.9837, test_f1: 0.5600
 epoch: 10, train_loss: 0.9105, test_loss: 0.9190, test_f1: 0.5407
 epoch: 11, train_loss: 0.9297, test_loss: 1.0667, test_f1: 0.4930
 epoch: 12, train_loss: 0.8947, test_loss: 1.1097, test_f1: 0.4906
 epoch: 13, train_loss: 0.8767, test_loss: 1.8927, test_f1: 0.3454
 epoch: 14, train_loss: 0.8825, test_loss: 0.9694, test_f1: 0.5244
 epoch: 15, train_loss: 0.8771, test_loss: 0.8795, test_f1: 0.5378
 epoch: 16, train_loss: 0.8437, test_loss: 0.9074, test_f1: 0.5431
 epoch: 17, train_loss: 0.8440, test_loss: 0.8424, test_f1: 0.6048
 epoch: 18, train_loss: 0.8455, test_loss: 0.9053, test_f1: 0.5327
 epoch: 19, train_loss: 0.8400, test_loss: 0.8982, test_f1: 0.5198
 epoch: 20, train_loss: 0.8083, test_loss: 0.9001, test_f1: 0.5537
 epoch: 21, train_loss: 0.8166, test_loss: 0.9620, test_f1: 0.5788
 epoch: 22, train_loss: 0.8075, test_loss: 0.8490, test_f1: 0.5416
 epoch: 23, train_loss: 0.8140, test_loss: 0.8857, test_f1: 0.5312
 epoch: 24, train_loss: 0.7712, test_loss: 0.9395, test_f1: 0.5697
 epoch: 25, train_loss: 0.7820, test_loss: 0.9174, test_f1: 0.5810
 epoch: 26, train_loss: 0.8048, test_loss: 0.9453, test_f1: 0.5828
 epoch: 27, train_loss: 0.7696, test_loss: 0.9398, test_f1: 0.5750
 epoch: 28, train_loss: 0.7750, test_loss: 0.8187, test_f1: 0.5791
 epoch: 29, train_loss: 0.7507, test_loss: 0.8843, test_f1: 0.6288
 epoch: 30, train_loss: 0.7546, test_loss: 0.8745, test_f1: 0.5385
 epoch: 31, train_loss: 0.7462, test_loss: 1.0335, test_f1: 0.5470
 epoch: 32, train_loss: 0.7568, test_loss: 0.9372, test_f1: 0.5998
 epoch: 33, train_loss: 0.7324, test_loss: 0.9792, test_f1: 0.6087
 epoch: 34, train_loss: 0.7350, test_loss: 0.8673, test_f1: 0.5604
 epoch: 35, train_loss: 0.7017, test_loss: 0.7935, test_f1: 0.5860
 epoch: 36, train_loss: 0.7111, test_loss: 0.9442, test_f1: 0.5597
 epoch: 37, train_loss: 0.6999, test_loss: 0.8454, test_f1: 0.5635
 epoch: 38, train_loss: 0.6940, test_loss: 0.9017, test_f1: 0.5475
 epoch: 39, train_loss: 0.6852, test_loss: 0.7990, test_f1: 0.6303
 epoch: 40, train_loss: 0.6832, test_loss: 0.8513, test_f1: 0.5934
 epoch: 41, train_loss: 0.6736, test_loss: 1.0247, test_f1: 0.5625
 epoch: 42, train_loss: 0.6690, test_loss: 0.8429, test_f1: 0.6391
 epoch: 43, train_loss: 0.6948, test_loss: 0.8167, test_f1: 0.6454
 epoch: 44, train_loss: 0.6831, test_loss: 0.8036, test_f1: 0.6269
 epoch: 45, train_loss: 0.6663, test_loss: 1.1424, test_f1: 0.5799
 epoch: 46, train_loss: 0.6502, test_loss: 0.9234, test_f1: 0.6112
 epoch: 47, train_loss: 0.6423, test_loss: 0.8069, test_f1: 0.6502
 epoch: 48, train_loss: 0.6347, test_loss: 0.9603, test_f1: 0.6432
 epoch: 49, train_loss: 0.6387, test_loss: 0.8862, test_f1: 0.6166
 epoch: 50, train_loss: 0.6291, test_loss: 0.9263, test_f1: 0.6474
 epoch: 51, train_loss: 0.5749, test_loss: 0.8612, test_f1: 0.6425
 epoch: 52, train_loss: 0.5592, test_loss: 0.7774, test_f1: 0.6617
 epoch: 53, train_loss: 0.5559, test_loss: 0.8115, test_f1: 0.6550
 epoch: 54, train_loss: 0.5486, test_loss: 0.8364, test_f1: 0.6276
 epoch: 55, train_loss: 0.5148, test_loss: 0.9526, test_f1: 0.6473
 epoch: 56, train_loss: 0.5213, test_loss: 0.7672, test_f1: 0.6609
 epoch: 57, train_loss: 0.5175, test_loss: 0.9670, test_f1: 0.6207
 epoch: 58, train_loss: 0.4976, test_loss: 0.9825, test_f1: 0.6309
 epoch: 59, train_loss: 0.5111, test_loss: 0.8033, test_f1: 0.6596
 epoch: 60, train_loss: 0.4964, test_loss: 0.9778, test_f1: 0.6364
 epoch: 61, train_loss: 0.4891, test_loss: 0.8682, test_f1: 0.6637
 epoch: 62, train_loss: 0.4611, test_loss: 0.8845, test_f1: 0.6460
 epoch: 63, train_loss: 0.4675, test_loss: 0.9393, test_f1: 0.6803
 epoch: 64, train_loss: 0.4787, test_loss: 1.0027, test_f1: 0.6148
 epoch: 65, train_loss: 0.4688, test_loss: 0.8491, test_f1: 0.6677
 epoch: 66, train_loss: 0.4680, test_loss: 0.9783, test_f1: 0.6344
 epoch: 67, train_loss: 0.4471, test_loss: 0.9645, test_f1: 0.6157
 epoch: 68, train_loss: 0.4486, test_loss: 0.8921, test_f1: 0.6453
 epoch: 69, train_loss: 0.4586, test_loss: 1.0013, test_f1: 0.6527
 epoch: 70, train_loss: 0.4370, test_loss: 0.9733, test_f1: 0.6444
 epoch: 71, train_loss: 0.4301, test_loss: 1.0012, test_f1: 0.6556
 epoch: 72, train_loss: 0.4301, test_loss: 1.0392, test_f1: 0.6578
 epoch: 73, train_loss: 0.4325, test_loss: 1.1065, test_f1: 0.6502
 epoch: 74, train_loss: 0.4287, test_loss: 0.7902, test_f1: 0.6687
 epoch: 75, train_loss: 0.4302, test_loss: 0.9050, test_f1: 0.6612
 epoch: 76, train_loss: 0.4210, test_loss: 0.9924, test_f1: 0.6764
 epoch: 77, train_loss: 0.4171, test_loss: 1.0528, test_f1: 0.6704
 epoch: 78, train_loss: 0.3934, test_loss: 0.9649, test_f1: 0.6519
 epoch: 79, train_loss: 0.3975, test_loss: 1.1214, test_f1: 0.6415
 epoch: 80, train_loss: 0.4001, test_loss: 0.9212, test_f1: 0.6462
 epoch: 81, train_loss: 0.3810, test_loss: 1.0474, test_f1: 0.6746
 epoch: 82, train_loss: 0.3636, test_loss: 1.2586, test_f1: 0.6541
 epoch: 83, train_loss: 0.4189, test_loss: 1.2570, test_f1: 0.6407
 epoch: 84, train_loss: 0.4049, test_loss: 1.0184, test_f1: 0.6362
 epoch: 85, train_loss: 0.3984, test_loss: 0.9844, test_f1: 0.6674
 epoch: 86, train_loss: 0.3678, test_loss: 0.8763, test_f1: 0.6678
 epoch: 87, train_loss: 0.3650, test_loss: 1.1651, test_f1: 0.6587
 epoch: 88, train_loss: 0.3788, test_loss: 1.0012, test_f1: 0.6645
 epoch: 89, train_loss: 0.3861, test_loss: 1.0894, test_f1: 0.6818
 epoch: 90, train_loss: 0.3793, test_loss: 1.1289, test_f1: 0.6797
 epoch: 91, train_loss: 0.3530, test_loss: 1.1484, test_f1: 0.6682
 epoch: 92, train_loss: 0.3526, test_loss: 0.9466, test_f1: 0.6768
 epoch: 93, train_loss: 0.3559, test_loss: 1.0274, test_f1: 0.6794
 epoch: 94, train_loss: 0.3596, test_loss: 0.9829, test_f1: 0.6824
 epoch: 95, train_loss: 0.3345, test_loss: 1.0398, test_f1: 0.6679
 epoch: 96, train_loss: 0.3729, test_loss: 1.1088, test_f1: 0.6610
 epoch: 97, train_loss: 0.3457, test_loss: 0.8974, test_f1: 0.6886
 epoch: 98, train_loss: 0.3363, test_loss: 1.0738, test_f1: 0.6727
 epoch: 99, train_loss: 0.3227, test_loss: 1.1725, test_f1: 0.6669
##################ITERATION #4 ****************************************
 epoch: 0, train_loss: 1.2252, test_loss: 1.3525, test_f1: 0.4441
 epoch: 1, train_loss: 0.9734, test_loss: 0.9786, test_f1: 0.5118
 epoch: 2, train_loss: 0.9314, test_loss: 0.9088, test_f1: 0.5134
 epoch: 3, train_loss: 0.9088, test_loss: 0.9614, test_f1: 0.5089
 epoch: 4, train_loss: 0.9013, test_loss: 0.9744, test_f1: 0.4895
 epoch: 5, train_loss: 0.8888, test_loss: 1.0519, test_f1: 0.5109
 epoch: 6, train_loss: 0.8921, test_loss: 1.0124, test_f1: 0.4221
 epoch: 7, train_loss: 0.8729, test_loss: 1.0208, test_f1: 0.4636
 epoch: 8, train_loss: 0.8477, test_loss: 0.8558, test_f1: 0.5218
 epoch: 9, train_loss: 0.8729, test_loss: 0.9506, test_f1: 0.5319
 epoch: 10, train_loss: 0.8683, test_loss: 1.0851, test_f1: 0.4795
 epoch: 11, train_loss: 0.8380, test_loss: 0.8751, test_f1: 0.5455
 epoch: 12, train_loss: 0.8122, test_loss: 0.9956, test_f1: 0.5457
 epoch: 13, train_loss: 0.8198, test_loss: 1.1244, test_f1: 0.5698
 epoch: 14, train_loss: 0.8275, test_loss: 0.8384, test_f1: 0.5503
 epoch: 15, train_loss: 0.8195, test_loss: 0.9355, test_f1: 0.5365
 epoch: 16, train_loss: 0.7847, test_loss: 0.8975, test_f1: 0.6072
 epoch: 17, train_loss: 0.7661, test_loss: 1.0479, test_f1: 0.5421
 epoch: 18, train_loss: 0.7657, test_loss: 0.7891, test_f1: 0.5857
 epoch: 19, train_loss: 0.7542, test_loss: 0.9030, test_f1: 0.5382
 epoch: 20, train_loss: 0.7398, test_loss: 0.8436, test_f1: 0.6042
 epoch: 21, train_loss: 0.7683, test_loss: 0.8711, test_f1: 0.5849
 epoch: 22, train_loss: 0.7454, test_loss: 0.9381, test_f1: 0.5733
 epoch: 23, train_loss: 0.7496, test_loss: 0.9054, test_f1: 0.5214
 epoch: 24, train_loss: 0.7185, test_loss: 0.9371, test_f1: 0.5695
 epoch: 25, train_loss: 0.7242, test_loss: 0.8632, test_f1: 0.6233
 epoch: 26, train_loss: 0.6869, test_loss: 0.9466, test_f1: 0.6317
 epoch: 27, train_loss: 0.6852, test_loss: 0.9549, test_f1: 0.5863
 epoch: 28, train_loss: 0.7068, test_loss: 0.8963, test_f1: 0.6368
 epoch: 29, train_loss: 0.6924, test_loss: 0.7756, test_f1: 0.6408
 epoch: 30, train_loss: 0.6762, test_loss: 0.9949, test_f1: 0.5624
 epoch: 31, train_loss: 0.6667, test_loss: 0.8091, test_f1: 0.6178
 epoch: 32, train_loss: 0.6572, test_loss: 1.0534, test_f1: 0.6103
 epoch: 33, train_loss: 0.6654, test_loss: 0.9074, test_f1: 0.6283
 epoch: 34, train_loss: 0.6437, test_loss: 0.8640, test_f1: 0.6448
 epoch: 35, train_loss: 0.6828, test_loss: 0.8638, test_f1: 0.5990
 epoch: 36, train_loss: 0.6324, test_loss: 0.9278, test_f1: 0.6881
 epoch: 37, train_loss: 0.6584, test_loss: 0.9856, test_f1: 0.6119
 epoch: 38, train_loss: 0.6358, test_loss: 0.8989, test_f1: 0.5991
 epoch: 39, train_loss: 0.6138, test_loss: 0.8665, test_f1: 0.6193
 epoch: 40, train_loss: 0.6141, test_loss: 1.0110, test_f1: 0.5921
 epoch: 41, train_loss: 0.6266, test_loss: 0.9038, test_f1: 0.6250
 epoch: 42, train_loss: 0.6032, test_loss: 0.9170, test_f1: 0.6387
 epoch: 43, train_loss: 0.6061, test_loss: 1.0749, test_f1: 0.6447
 epoch: 44, train_loss: 0.5986, test_loss: 1.0550, test_f1: 0.6104
 epoch: 45, train_loss: 0.6028, test_loss: 1.2452, test_f1: 0.5847
 epoch: 46, train_loss: 0.5938, test_loss: 0.8839, test_f1: 0.6413
 epoch: 47, train_loss: 0.6146, test_loss: 1.1648, test_f1: 0.5987
 epoch: 48, train_loss: 0.5728, test_loss: 1.0276, test_f1: 0.6352
 epoch: 49, train_loss: 0.5602, test_loss: 1.1872, test_f1: 0.6799
 epoch: 50, train_loss: 0.5358, test_loss: 1.0949, test_f1: 0.6645
 epoch: 51, train_loss: 0.5051, test_loss: 1.1219, test_f1: 0.6920
 epoch: 52, train_loss: 0.4794, test_loss: 1.1281, test_f1: 0.6767
 epoch: 53, train_loss: 0.4708, test_loss: 1.1362, test_f1: 0.6549
 epoch: 54, train_loss: 0.4869, test_loss: 1.2195, test_f1: 0.6542
 epoch: 55, train_loss: 0.4904, test_loss: 1.3888, test_f1: 0.6322
 epoch: 56, train_loss: 0.4610, test_loss: 1.2125, test_f1: 0.6742
 epoch: 57, train_loss: 0.4466, test_loss: 1.2191, test_f1: 0.6873
 epoch: 58, train_loss: 0.4398, test_loss: 1.3318, test_f1: 0.6439
 epoch: 59, train_loss: 0.4428, test_loss: 1.2834, test_f1: 0.6528
 epoch: 60, train_loss: 0.4274, test_loss: 1.1507, test_f1: 0.6880
 epoch: 61, train_loss: 0.4433, test_loss: 1.3572, test_f1: 0.6420
 epoch: 62, train_loss: 0.4259, test_loss: 1.4830, test_f1: 0.6216
 epoch: 63, train_loss: 0.4397, test_loss: 1.6619, test_f1: 0.6531
 epoch: 64, train_loss: 0.4103, test_loss: 1.4676, test_f1: 0.6432
 epoch: 65, train_loss: 0.4145, test_loss: 1.4498, test_f1: 0.6364
 epoch: 66, train_loss: 0.3941, test_loss: 1.2884, test_f1: 0.6717
 epoch: 67, train_loss: 0.4100, test_loss: 1.1668, test_f1: 0.6572
 epoch: 68, train_loss: 0.4059, test_loss: 1.3598, test_f1: 0.6450
 epoch: 69, train_loss: 0.4087, test_loss: 1.5333, test_f1: 0.6652
 epoch: 70, train_loss: 0.4082, test_loss: 1.2669, test_f1: 0.6711
 epoch: 71, train_loss: 0.4017, test_loss: 1.3894, test_f1: 0.6769
 epoch: 72, train_loss: 0.3999, test_loss: 1.1782, test_f1: 0.6725
 epoch: 73, train_loss: 0.4001, test_loss: 1.3743, test_f1: 0.6839
 epoch: 74, train_loss: 0.3927, test_loss: 1.5165, test_f1: 0.6617
 epoch: 75, train_loss: 0.3884, test_loss: 1.5128, test_f1: 0.6341
 epoch: 76, train_loss: 0.3822, test_loss: 1.3614, test_f1: 0.6719
 epoch: 77, train_loss: 0.3949, test_loss: 1.3602, test_f1: 0.6897
 epoch: 78, train_loss: 0.3749, test_loss: 1.5153, test_f1: 0.6841
 epoch: 79, train_loss: 0.3694, test_loss: 1.3564, test_f1: 0.6807
 epoch: 80, train_loss: 0.3780, test_loss: 1.5968, test_f1: 0.6571
 epoch: 81, train_loss: 0.3632, test_loss: 1.7402, test_f1: 0.6032
 epoch: 82, train_loss: 0.3663, test_loss: 1.4070, test_f1: 0.6867
 epoch: 83, train_loss: 0.3525, test_loss: 1.6103, test_f1: 0.6611
 epoch: 84, train_loss: 0.3377, test_loss: 1.6532, test_f1: 0.6524
 epoch: 85, train_loss: 0.3479, test_loss: 1.4560, test_f1: 0.6477
 epoch: 86, train_loss: 0.3548, test_loss: 1.6389, test_f1: 0.6721
 epoch: 87, train_loss: 0.3815, test_loss: 1.5420, test_f1: 0.6529
 epoch: 88, train_loss: 0.3547, test_loss: 1.4714, test_f1: 0.6681
 epoch: 89, train_loss: 0.3478, test_loss: 1.6482, test_f1: 0.6696
 epoch: 90, train_loss: 0.3333, test_loss: 1.7636, test_f1: 0.6391
 epoch: 91, train_loss: 0.3705, test_loss: 1.3925, test_f1: 0.6607
 epoch: 92, train_loss: 0.3533, test_loss: 1.5495, test_f1: 0.6658
 epoch: 93, train_loss: 0.3371, test_loss: 1.5606, test_f1: 0.6516
 epoch: 94, train_loss: 0.3305, test_loss: 1.3871, test_f1: 0.6894
 epoch: 95, train_loss: 0.3039, test_loss: 1.5783, test_f1: 0.6602
 epoch: 96, train_loss: 0.3166, test_loss: 1.5027, test_f1: 0.6818
 epoch: 97, train_loss: 0.3182, test_loss: 1.6888, test_f1: 0.6767
 epoch: 98, train_loss: 0.3129, test_loss: 1.7681, test_f1: 0.6770
 epoch: 99, train_loss: 0.3442, test_loss: 1.5532, test_f1: 0.6416
##################ITERATION #5 ****************************************
 epoch: 0, train_loss: 1.1827, test_loss: 1.0837, test_f1: 0.4385
 epoch: 1, train_loss: 0.9998, test_loss: 1.0826, test_f1: 0.4657
 epoch: 2, train_loss: 0.9563, test_loss: 1.0122, test_f1: 0.5241
 epoch: 3, train_loss: 0.9132, test_loss: 0.8990, test_f1: 0.5964
 epoch: 4, train_loss: 0.9017, test_loss: 0.9180, test_f1: 0.5077
 epoch: 5, train_loss: 0.8655, test_loss: 0.8475, test_f1: 0.5584
 epoch: 6, train_loss: 0.8471, test_loss: 1.0401, test_f1: 0.4607
 epoch: 7, train_loss: 0.8447, test_loss: 0.9941, test_f1: 0.4939
 epoch: 8, train_loss: 0.8134, test_loss: 0.9425, test_f1: 0.4859
 epoch: 9, train_loss: 0.8133, test_loss: 0.9958, test_f1: 0.5469
 epoch: 10, train_loss: 0.7863, test_loss: 0.8706, test_f1: 0.5294
 epoch: 11, train_loss: 0.7866, test_loss: 0.8734, test_f1: 0.5421
 epoch: 12, train_loss: 0.7656, test_loss: 0.8101, test_f1: 0.5445
 epoch: 13, train_loss: 0.7718, test_loss: 0.8773, test_f1: 0.5698
 epoch: 14, train_loss: 0.7706, test_loss: 0.9592, test_f1: 0.5403
 epoch: 15, train_loss: 0.7812, test_loss: 0.8942, test_f1: 0.5187
 epoch: 16, train_loss: 0.7655, test_loss: 0.8479, test_f1: 0.6105
 epoch: 17, train_loss: 0.7301, test_loss: 0.8933, test_f1: 0.5600
 epoch: 18, train_loss: 0.7240, test_loss: 0.9305, test_f1: 0.5764
 epoch: 19, train_loss: 0.7337, test_loss: 0.8756, test_f1: 0.6294
 epoch: 20, train_loss: 0.7214, test_loss: 0.9847, test_f1: 0.5581
 epoch: 21, train_loss: 0.7246, test_loss: 0.8714, test_f1: 0.5628
 epoch: 22, train_loss: 0.6984, test_loss: 0.8540, test_f1: 0.6106
 epoch: 23, train_loss: 0.7048, test_loss: 0.8111, test_f1: 0.6145
 epoch: 24, train_loss: 0.7161, test_loss: 0.8250, test_f1: 0.5273
 epoch: 25, train_loss: 0.6893, test_loss: 1.0549, test_f1: 0.5898
 epoch: 26, train_loss: 0.6687, test_loss: 0.9083, test_f1: 0.6366
 epoch: 27, train_loss: 0.6502, test_loss: 0.7686, test_f1: 0.6417
 epoch: 28, train_loss: 0.6347, test_loss: 0.8460, test_f1: 0.6110
 epoch: 29, train_loss: 0.6514, test_loss: 0.8600, test_f1: 0.6518
 epoch: 30, train_loss: 0.6399, test_loss: 0.8868, test_f1: 0.6426
 epoch: 31, train_loss: 0.6451, test_loss: 1.0201, test_f1: 0.5796
 epoch: 32, train_loss: 0.6219, test_loss: 0.9840, test_f1: 0.6177
 epoch: 33, train_loss: 0.5983, test_loss: 1.0327, test_f1: 0.6275
 epoch: 34, train_loss: 0.6178, test_loss: 0.8877, test_f1: 0.6015
 epoch: 35, train_loss: 0.6147, test_loss: 0.9468, test_f1: 0.6264
 epoch: 36, train_loss: 0.6265, test_loss: 0.9964, test_f1: 0.5787
 epoch: 37, train_loss: 0.6035, test_loss: 1.0005, test_f1: 0.6536
 epoch: 38, train_loss: 0.5753, test_loss: 1.1957, test_f1: 0.6004
 epoch: 39, train_loss: 0.5783, test_loss: 1.1458, test_f1: 0.6119
 epoch: 40, train_loss: 0.5861, test_loss: 0.9675, test_f1: 0.6466
 epoch: 41, train_loss: 0.5713, test_loss: 1.0699, test_f1: 0.5627
 epoch: 42, train_loss: 0.5742, test_loss: 0.9336, test_f1: 0.6162
 epoch: 43, train_loss: 0.5528, test_loss: 1.2356, test_f1: 0.6185
 epoch: 44, train_loss: 0.5526, test_loss: 1.1465, test_f1: 0.6329
 epoch: 45, train_loss: 0.5524, test_loss: 1.0891, test_f1: 0.5778
 epoch: 46, train_loss: 0.5470, test_loss: 1.1349, test_f1: 0.5876
 epoch: 47, train_loss: 0.5539, test_loss: 1.0138, test_f1: 0.6511
 epoch: 48, train_loss: 0.5529, test_loss: 1.0039, test_f1: 0.6347
 epoch: 49, train_loss: 0.5465, test_loss: 1.2047, test_f1: 0.6654
 epoch: 50, train_loss: 0.5223, test_loss: 1.1925, test_f1: 0.6594
 epoch: 51, train_loss: 0.4810, test_loss: 1.1749, test_f1: 0.6458
 epoch: 52, train_loss: 0.4577, test_loss: 1.2148, test_f1: 0.6488
 epoch: 53, train_loss: 0.4335, test_loss: 1.2071, test_f1: 0.6633
 epoch: 54, train_loss: 0.4396, test_loss: 1.3085, test_f1: 0.6274
 epoch: 55, train_loss: 0.4148, test_loss: 1.3862, test_f1: 0.6424
 epoch: 56, train_loss: 0.4080, test_loss: 1.2193, test_f1: 0.6563
 epoch: 57, train_loss: 0.4218, test_loss: 1.4227, test_f1: 0.6479
 epoch: 58, train_loss: 0.4011, test_loss: 1.3322, test_f1: 0.6450
 epoch: 59, train_loss: 0.4107, test_loss: 1.2314, test_f1: 0.6498
 epoch: 60, train_loss: 0.4150, test_loss: 1.3891, test_f1: 0.6100
 epoch: 61, train_loss: 0.4019, test_loss: 1.3209, test_f1: 0.6480
 epoch: 62, train_loss: 0.3923, test_loss: 1.2523, test_f1: 0.6575
 epoch: 63, train_loss: 0.3930, test_loss: 1.2397, test_f1: 0.6604
 epoch: 64, train_loss: 0.3916, test_loss: 1.1401, test_f1: 0.6644
 epoch: 65, train_loss: 0.3926, test_loss: 1.3716, test_f1: 0.6618
 epoch: 66, train_loss: 0.3831, test_loss: 1.3421, test_f1: 0.6378
 epoch: 67, train_loss: 0.3964, test_loss: 1.3911, test_f1: 0.6216
 epoch: 68, train_loss: 0.3900, test_loss: 1.4153, test_f1: 0.6429
 epoch: 69, train_loss: 0.3798, test_loss: 1.3498, test_f1: 0.6526
 epoch: 70, train_loss: 0.3740, test_loss: 1.3906, test_f1: 0.6568
 epoch: 71, train_loss: 0.3604, test_loss: 1.4739, test_f1: 0.6613
 epoch: 72, train_loss: 0.3812, test_loss: 1.3446, test_f1: 0.6692
 epoch: 73, train_loss: 0.3608, test_loss: 1.5419, test_f1: 0.6357
 epoch: 74, train_loss: 0.3690, test_loss: 1.3067, test_f1: 0.6504
 epoch: 75, train_loss: 0.3805, test_loss: 1.5183, test_f1: 0.6455
 epoch: 76, train_loss: 0.3412, test_loss: 1.4814, test_f1: 0.6047
 epoch: 77, train_loss: 0.3583, test_loss: 1.3150, test_f1: 0.6669
 epoch: 78, train_loss: 0.3319, test_loss: 1.4956, test_f1: 0.6496
 epoch: 79, train_loss: 0.3282, test_loss: 1.3786, test_f1: 0.6200
 epoch: 80, train_loss: 0.3549, test_loss: 1.5349, test_f1: 0.6388
 epoch: 81, train_loss: 0.3235, test_loss: 1.5500, test_f1: 0.6453
 epoch: 82, train_loss: 0.3385, test_loss: 1.7538, test_f1: 0.6234
 epoch: 83, train_loss: 0.3534, test_loss: 1.6026, test_f1: 0.6459
 epoch: 84, train_loss: 0.3463, test_loss: 1.5462, test_f1: 0.6502
 epoch: 85, train_loss: 0.3446, test_loss: 1.5288, test_f1: 0.6428
 epoch: 86, train_loss: 0.3445, test_loss: 1.4130, test_f1: 0.6344
 epoch: 87, train_loss: 0.3470, test_loss: 1.5481, test_f1: 0.6361
 epoch: 88, train_loss: 0.3069, test_loss: 1.6130, test_f1: 0.6700
 epoch: 89, train_loss: 0.3124, test_loss: 1.5127, test_f1: 0.6738
 epoch: 90, train_loss: 0.3136, test_loss: 1.7771, test_f1: 0.6603
 epoch: 91, train_loss: 0.3139, test_loss: 1.4416, test_f1: 0.6617
 epoch: 92, train_loss: 0.3117, test_loss: 1.5749, test_f1: 0.6424
 epoch: 93, train_loss: 0.3279, test_loss: 1.5889, test_f1: 0.6495
 epoch: 94, train_loss: 0.2978, test_loss: 1.5420, test_f1: 0.6183
 epoch: 95, train_loss: 0.2828, test_loss: 1.4376, test_f1: 0.6252
 epoch: 96, train_loss: 0.3025, test_loss: 1.4895, test_f1: 0.6452
 epoch: 97, train_loss: 0.3134, test_loss: 1.5425, test_f1: 0.6197
 epoch: 98, train_loss: 0.2878, test_loss: 1.4112, test_f1: 0.6536
 epoch: 99, train_loss: 0.3115, test_loss: 1.4238, test_f1: 0.6618
##################ITERATION #6 ****************************************
 epoch: 0, train_loss: 1.2199, test_loss: 1.1229, test_f1: 0.4790
 epoch: 1, train_loss: 0.9708, test_loss: 1.1361, test_f1: 0.5602
 epoch: 2, train_loss: 0.9338, test_loss: 0.8997, test_f1: 0.5711
 epoch: 3, train_loss: 0.9346, test_loss: 1.0967, test_f1: 0.5020
 epoch: 4, train_loss: 0.9216, test_loss: 1.0422, test_f1: 0.4974
 epoch: 5, train_loss: 0.9045, test_loss: 0.8832, test_f1: 0.5931
 epoch: 6, train_loss: 0.8842, test_loss: 0.9864, test_f1: 0.5426
 epoch: 7, train_loss: 0.8722, test_loss: 0.8744, test_f1: 0.5949
 epoch: 8, train_loss: 0.8584, test_loss: 0.9034, test_f1: 0.5503
 epoch: 9, train_loss: 0.8396, test_loss: 1.5441, test_f1: 0.3240
 epoch: 10, train_loss: 0.8479, test_loss: 0.9634, test_f1: 0.5501
 epoch: 11, train_loss: 0.7985, test_loss: 0.8838, test_f1: 0.6071
 epoch: 12, train_loss: 0.8145, test_loss: 1.0040, test_f1: 0.5728
 epoch: 13, train_loss: 0.7822, test_loss: 1.1668, test_f1: 0.5068
 epoch: 14, train_loss: 0.7910, test_loss: 1.0178, test_f1: 0.5580
 epoch: 15, train_loss: 0.7877, test_loss: 0.9002, test_f1: 0.6011
 epoch: 16, train_loss: 0.7606, test_loss: 0.9970, test_f1: 0.5889
 epoch: 17, train_loss: 0.7677, test_loss: 0.8657, test_f1: 0.6117
 epoch: 18, train_loss: 0.7458, test_loss: 0.7591, test_f1: 0.6322
 epoch: 19, train_loss: 0.7181, test_loss: 0.8400, test_f1: 0.6020
 epoch: 20, train_loss: 0.7336, test_loss: 0.9197, test_f1: 0.6009
 epoch: 21, train_loss: 0.7243, test_loss: 0.8245, test_f1: 0.6325
 epoch: 22, train_loss: 0.7117, test_loss: 0.9126, test_f1: 0.6051
 epoch: 23, train_loss: 0.6881, test_loss: 0.9097, test_f1: 0.5924
 epoch: 24, train_loss: 0.6910, test_loss: 0.8431, test_f1: 0.6103
 epoch: 25, train_loss: 0.6752, test_loss: 0.9247, test_f1: 0.6072
 epoch: 26, train_loss: 0.6731, test_loss: 1.1653, test_f1: 0.5437
 epoch: 27, train_loss: 0.6606, test_loss: 1.0318, test_f1: 0.5817
 epoch: 28, train_loss: 0.6632, test_loss: 1.0001, test_f1: 0.5794
 epoch: 29, train_loss: 0.6631, test_loss: 0.8369, test_f1: 0.6627
 epoch: 30, train_loss: 0.6696, test_loss: 0.9647, test_f1: 0.5890
 epoch: 31, train_loss: 0.6353, test_loss: 0.9523, test_f1: 0.6295
 epoch: 32, train_loss: 0.6434, test_loss: 0.9962, test_f1: 0.6191
 epoch: 33, train_loss: 0.6442, test_loss: 1.1584, test_f1: 0.6121
 epoch: 34, train_loss: 0.6490, test_loss: 0.9280, test_f1: 0.6605
 epoch: 35, train_loss: 0.6288, test_loss: 0.8881, test_f1: 0.5728
 epoch: 36, train_loss: 0.5938, test_loss: 0.9517, test_f1: 0.5944
 epoch: 37, train_loss: 0.6297, test_loss: 1.0404, test_f1: 0.5502
 epoch: 38, train_loss: 0.6082, test_loss: 1.0428, test_f1: 0.6418
 epoch: 39, train_loss: 0.6107, test_loss: 0.9377, test_f1: 0.6448
 epoch: 40, train_loss: 0.6072, test_loss: 0.9787, test_f1: 0.6908
 epoch: 41, train_loss: 0.5821, test_loss: 0.9678, test_f1: 0.6364
 epoch: 42, train_loss: 0.5654, test_loss: 1.1093, test_f1: 0.6395
 epoch: 43, train_loss: 0.5619, test_loss: 1.0965, test_f1: 0.6253
 epoch: 44, train_loss: 0.5935, test_loss: 0.8918, test_f1: 0.6015
 epoch: 45, train_loss: 0.5687, test_loss: 0.8539, test_f1: 0.6458
 epoch: 46, train_loss: 0.5922, test_loss: 0.9362, test_f1: 0.6128
 epoch: 47, train_loss: 0.5390, test_loss: 1.0501, test_f1: 0.6592
 epoch: 48, train_loss: 0.5334, test_loss: 0.9657, test_f1: 0.6775
 epoch: 49, train_loss: 0.5517, test_loss: 0.9717, test_f1: 0.6747
 epoch: 50, train_loss: 0.5280, test_loss: 1.1645, test_f1: 0.6507
 epoch: 51, train_loss: 0.4876, test_loss: 1.0253, test_f1: 0.6708
 epoch: 52, train_loss: 0.4764, test_loss: 1.0659, test_f1: 0.6693
 epoch: 53, train_loss: 0.4685, test_loss: 1.0572, test_f1: 0.6788
 epoch: 54, train_loss: 0.4510, test_loss: 1.1530, test_f1: 0.6674
 epoch: 55, train_loss: 0.4668, test_loss: 1.1371, test_f1: 0.6766
 epoch: 56, train_loss: 0.4439, test_loss: 1.0203, test_f1: 0.6872
 epoch: 57, train_loss: 0.4304, test_loss: 1.1336, test_f1: 0.6711
 epoch: 58, train_loss: 0.4209, test_loss: 1.1634, test_f1: 0.6668
 epoch: 59, train_loss: 0.4217, test_loss: 1.0477, test_f1: 0.6666
 epoch: 60, train_loss: 0.4149, test_loss: 1.1948, test_f1: 0.6844
 epoch: 61, train_loss: 0.4075, test_loss: 1.1307, test_f1: 0.6926
 epoch: 62, train_loss: 0.4086, test_loss: 1.1577, test_f1: 0.6672
 epoch: 63, train_loss: 0.4208, test_loss: 1.2327, test_f1: 0.6672
 epoch: 64, train_loss: 0.3898, test_loss: 1.0899, test_f1: 0.6981
 epoch: 65, train_loss: 0.4124, test_loss: 1.1278, test_f1: 0.6693
 epoch: 66, train_loss: 0.3992, test_loss: 1.2264, test_f1: 0.6691
 epoch: 67, train_loss: 0.4145, test_loss: 1.1110, test_f1: 0.6826
 epoch: 68, train_loss: 0.3943, test_loss: 1.2358, test_f1: 0.6286
 epoch: 69, train_loss: 0.3887, test_loss: 1.1673, test_f1: 0.6564
 epoch: 70, train_loss: 0.3834, test_loss: 1.1763, test_f1: 0.6653
 epoch: 71, train_loss: 0.3812, test_loss: 1.2756, test_f1: 0.6701
 epoch: 72, train_loss: 0.3662, test_loss: 1.0753, test_f1: 0.6797
 epoch: 73, train_loss: 0.3654, test_loss: 1.1906, test_f1: 0.6492
 epoch: 74, train_loss: 0.3554, test_loss: 1.3018, test_f1: 0.6478
 epoch: 75, train_loss: 0.4100, test_loss: 1.3285, test_f1: 0.6347
 epoch: 76, train_loss: 0.3804, test_loss: 0.9747, test_f1: 0.6674
 epoch: 77, train_loss: 0.3573, test_loss: 1.1305, test_f1: 0.6690
 epoch: 78, train_loss: 0.3807, test_loss: 1.2304, test_f1: 0.6456
 epoch: 79, train_loss: 0.3353, test_loss: 1.2351, test_f1: 0.6409
 epoch: 80, train_loss: 0.3513, test_loss: 1.4863, test_f1: 0.6334
 epoch: 81, train_loss: 0.3455, test_loss: 1.1174, test_f1: 0.6313
 epoch: 82, train_loss: 0.3571, test_loss: 1.1371, test_f1: 0.6458
 epoch: 83, train_loss: 0.3594, test_loss: 1.3770, test_f1: 0.6550
 epoch: 84, train_loss: 0.3318, test_loss: 1.3260, test_f1: 0.6533
 epoch: 85, train_loss: 0.3656, test_loss: 1.3100, test_f1: 0.6450
 epoch: 86, train_loss: 0.3515, test_loss: 1.3793, test_f1: 0.6293
 epoch: 87, train_loss: 0.3224, test_loss: 1.3494, test_f1: 0.6812
 epoch: 88, train_loss: 0.3250, test_loss: 1.2730, test_f1: 0.6422
 epoch: 89, train_loss: 0.3391, test_loss: 1.3379, test_f1: 0.6890
 epoch: 90, train_loss: 0.3335, test_loss: 1.1984, test_f1: 0.6708
 epoch: 91, train_loss: 0.3398, test_loss: 1.2475, test_f1: 0.6467
 epoch: 92, train_loss: 0.3141, test_loss: 1.4556, test_f1: 0.6407
 epoch: 93, train_loss: 0.3375, test_loss: 1.4275, test_f1: 0.6378
 epoch: 94, train_loss: 0.3279, test_loss: 1.2733, test_f1: 0.6806
 epoch: 95, train_loss: 0.2937, test_loss: 1.5398, test_f1: 0.6496
 epoch: 96, train_loss: 0.3030, test_loss: 1.4762, test_f1: 0.6283
 epoch: 97, train_loss: 0.2766, test_loss: 1.2470, test_f1: 0.6411
 epoch: 98, train_loss: 0.2821, test_loss: 1.2314, test_f1: 0.6551
 epoch: 99, train_loss: 0.2937, test_loss: 1.3157, test_f1: 0.6339
##################ITERATION #7 ****************************************
 epoch: 0, train_loss: 1.2649, test_loss: 1.0373, test_f1: 0.4178
 epoch: 1, train_loss: 1.0290, test_loss: 1.1380, test_f1: 0.4957
 epoch: 2, train_loss: 0.9822, test_loss: 1.0254, test_f1: 0.5270
 epoch: 3, train_loss: 0.9398, test_loss: 0.9613, test_f1: 0.4951
 epoch: 4, train_loss: 0.9184, test_loss: 0.8934, test_f1: 0.5622
 epoch: 5, train_loss: 0.9061, test_loss: 0.8783, test_f1: 0.5060
 epoch: 6, train_loss: 0.9017, test_loss: 1.0165, test_f1: 0.4267
 epoch: 7, train_loss: 0.8582, test_loss: 0.8939, test_f1: 0.5691
 epoch: 8, train_loss: 0.8783, test_loss: 0.9124, test_f1: 0.5460
 epoch: 9, train_loss: 0.8713, test_loss: 0.8857, test_f1: 0.5364
 epoch: 10, train_loss: 0.8609, test_loss: 1.0857, test_f1: 0.5333
 epoch: 11, train_loss: 0.8431, test_loss: 0.9011, test_f1: 0.5421
 epoch: 12, train_loss: 0.8304, test_loss: 0.8699, test_f1: 0.5389
 epoch: 13, train_loss: 0.8085, test_loss: 1.0355, test_f1: 0.5244
 epoch: 14, train_loss: 0.7862, test_loss: 0.9840, test_f1: 0.5174
 epoch: 15, train_loss: 0.8024, test_loss: 1.0026, test_f1: 0.5429
 epoch: 16, train_loss: 0.8055, test_loss: 1.0595, test_f1: 0.5689
 epoch: 17, train_loss: 0.7870, test_loss: 0.9333, test_f1: 0.5685
 epoch: 18, train_loss: 0.7606, test_loss: 0.9000, test_f1: 0.5874
 epoch: 19, train_loss: 0.7476, test_loss: 0.8852, test_f1: 0.5549
 epoch: 20, train_loss: 0.7462, test_loss: 0.8229, test_f1: 0.5730
 epoch: 21, train_loss: 0.7354, test_loss: 0.8896, test_f1: 0.5661
 epoch: 22, train_loss: 0.7439, test_loss: 1.1782, test_f1: 0.6092
 epoch: 23, train_loss: 0.7414, test_loss: 0.9113, test_f1: 0.5830
 epoch: 24, train_loss: 0.7302, test_loss: 1.0556, test_f1: 0.5850
 epoch: 25, train_loss: 0.7401, test_loss: 1.0227, test_f1: 0.5364
 epoch: 26, train_loss: 0.7205, test_loss: 0.8665, test_f1: 0.5498
 epoch: 27, train_loss: 0.6896, test_loss: 0.8799, test_f1: 0.6116
 epoch: 28, train_loss: 0.6927, test_loss: 0.9392, test_f1: 0.6027
 epoch: 29, train_loss: 0.6768, test_loss: 0.8601, test_f1: 0.5260
 epoch: 30, train_loss: 0.6755, test_loss: 0.9781, test_f1: 0.6341
 epoch: 31, train_loss: 0.6755, test_loss: 1.0012, test_f1: 0.6290
 epoch: 32, train_loss: 0.6531, test_loss: 1.1061, test_f1: 0.6237
 epoch: 33, train_loss: 0.6568, test_loss: 1.0556, test_f1: 0.5790
 epoch: 34, train_loss: 0.6485, test_loss: 0.9897, test_f1: 0.6486
 epoch: 35, train_loss: 0.6359, test_loss: 1.0028, test_f1: 0.5544
 epoch: 36, train_loss: 0.6244, test_loss: 1.0342, test_f1: 0.6124
 epoch: 37, train_loss: 0.6396, test_loss: 0.9956, test_f1: 0.5553
 epoch: 38, train_loss: 0.6293, test_loss: 1.0041, test_f1: 0.6082
 epoch: 39, train_loss: 0.6122, test_loss: 1.0461, test_f1: 0.6070
 epoch: 40, train_loss: 0.6283, test_loss: 0.9682, test_f1: 0.6598
 epoch: 41, train_loss: 0.6132, test_loss: 0.8932, test_f1: 0.6752
 epoch: 42, train_loss: 0.5911, test_loss: 0.9930, test_f1: 0.6513
 epoch: 43, train_loss: 0.6166, test_loss: 0.9071, test_f1: 0.6636
 epoch: 44, train_loss: 0.5655, test_loss: 0.8303, test_f1: 0.6493
 epoch: 45, train_loss: 0.5748, test_loss: 1.1923, test_f1: 0.6356
 epoch: 46, train_loss: 0.5468, test_loss: 0.9404, test_f1: 0.6396
 epoch: 47, train_loss: 0.5635, test_loss: 0.9839, test_f1: 0.6683
 epoch: 48, train_loss: 0.5836, test_loss: 1.0089, test_f1: 0.6208
 epoch: 49, train_loss: 0.5665, test_loss: 0.9532, test_f1: 0.6803
 epoch: 50, train_loss: 0.5309, test_loss: 0.8344, test_f1: 0.6482
 epoch: 51, train_loss: 0.5021, test_loss: 0.9284, test_f1: 0.6632
 epoch: 52, train_loss: 0.4642, test_loss: 1.0378, test_f1: 0.6508
 epoch: 53, train_loss: 0.4770, test_loss: 1.0639, test_f1: 0.6698
 epoch: 54, train_loss: 0.4455, test_loss: 1.1419, test_f1: 0.6111
 epoch: 55, train_loss: 0.4470, test_loss: 1.0338, test_f1: 0.6579
 epoch: 56, train_loss: 0.4336, test_loss: 1.0698, test_f1: 0.6365
 epoch: 57, train_loss: 0.4523, test_loss: 1.1658, test_f1: 0.6434
 epoch: 58, train_loss: 0.4351, test_loss: 1.1065, test_f1: 0.6228
 epoch: 59, train_loss: 0.4326, test_loss: 1.3428, test_f1: 0.6200
 epoch: 60, train_loss: 0.4208, test_loss: 1.2221, test_f1: 0.6509
 epoch: 61, train_loss: 0.4154, test_loss: 1.1743, test_f1: 0.6569
 epoch: 62, train_loss: 0.4109, test_loss: 1.3610, test_f1: 0.6651
 epoch: 63, train_loss: 0.4127, test_loss: 1.1897, test_f1: 0.6580
 epoch: 64, train_loss: 0.3885, test_loss: 1.2667, test_f1: 0.6468
 epoch: 65, train_loss: 0.3945, test_loss: 1.1682, test_f1: 0.6222
 epoch: 66, train_loss: 0.4043, test_loss: 1.2138, test_f1: 0.6780
 epoch: 67, train_loss: 0.4068, test_loss: 1.3321, test_f1: 0.6605
 epoch: 68, train_loss: 0.3954, test_loss: 1.2593, test_f1: 0.6411
 epoch: 69, train_loss: 0.3814, test_loss: 1.2055, test_f1: 0.6597
 epoch: 70, train_loss: 0.3696, test_loss: 1.1577, test_f1: 0.6667
 epoch: 71, train_loss: 0.3792, test_loss: 1.2634, test_f1: 0.6681
 epoch: 72, train_loss: 0.3703, test_loss: 1.1686, test_f1: 0.6594
 epoch: 73, train_loss: 0.3804, test_loss: 1.0937, test_f1: 0.6668
 epoch: 74, train_loss: 0.3595, test_loss: 1.2920, test_f1: 0.6380
 epoch: 75, train_loss: 0.3642, test_loss: 1.3584, test_f1: 0.6374
 epoch: 76, train_loss: 0.3890, test_loss: 1.4092, test_f1: 0.6591
 epoch: 77, train_loss: 0.3507, test_loss: 1.3002, test_f1: 0.6603
 epoch: 78, train_loss: 0.3630, test_loss: 1.2949, test_f1: 0.6366
 epoch: 79, train_loss: 0.3581, test_loss: 1.3532, test_f1: 0.6284
 epoch: 80, train_loss: 0.3681, test_loss: 1.2303, test_f1: 0.6533
 epoch: 81, train_loss: 0.3438, test_loss: 1.3126, test_f1: 0.6424
 epoch: 82, train_loss: 0.3599, test_loss: 1.3593, test_f1: 0.6369
 epoch: 83, train_loss: 0.3474, test_loss: 1.2117, test_f1: 0.6715
 epoch: 84, train_loss: 0.3330, test_loss: 1.3892, test_f1: 0.6435
 epoch: 85, train_loss: 0.3446, test_loss: 1.4303, test_f1: 0.6471
 epoch: 86, train_loss: 0.3244, test_loss: 1.6338, test_f1: 0.6429
 epoch: 87, train_loss: 0.3342, test_loss: 1.3972, test_f1: 0.6557
 epoch: 88, train_loss: 0.3193, test_loss: 1.4476, test_f1: 0.6630
 epoch: 89, train_loss: 0.3198, test_loss: 1.3470, test_f1: 0.6810
 epoch: 90, train_loss: 0.2989, test_loss: 1.3408, test_f1: 0.6268
 epoch: 91, train_loss: 0.3243, test_loss: 1.4194, test_f1: 0.6681
 epoch: 92, train_loss: 0.2992, test_loss: 1.4019, test_f1: 0.6772
 epoch: 93, train_loss: 0.3130, test_loss: 1.5130, test_f1: 0.6530
 epoch: 94, train_loss: 0.3204, test_loss: 1.4697, test_f1: 0.6636
 epoch: 95, train_loss: 0.2981, test_loss: 1.4713, test_f1: 0.6484
 epoch: 96, train_loss: 0.3038, test_loss: 1.5482, test_f1: 0.6810
 epoch: 97, train_loss: 0.3120, test_loss: 1.4960, test_f1: 0.6674
 epoch: 98, train_loss: 0.2941, test_loss: 1.5303, test_f1: 0.6673
 epoch: 99, train_loss: 0.3068, test_loss: 1.6086, test_f1: 0.6622
##################ITERATION #8 ****************************************
 epoch: 0, train_loss: 1.2753, test_loss: 1.3442, test_f1: 0.4878
 epoch: 1, train_loss: 1.0126, test_loss: 1.0575, test_f1: 0.5115
 epoch: 2, train_loss: 0.9762, test_loss: 1.0029, test_f1: 0.5404
 epoch: 3, train_loss: 0.9479, test_loss: 1.1600, test_f1: 0.4709
 epoch: 4, train_loss: 0.9314, test_loss: 1.0957, test_f1: 0.5119
 epoch: 5, train_loss: 0.9184, test_loss: 0.9207, test_f1: 0.5579
 epoch: 6, train_loss: 0.8919, test_loss: 0.9985, test_f1: 0.5192
 epoch: 7, train_loss: 0.8953, test_loss: 0.9848, test_f1: 0.5988
 epoch: 8, train_loss: 0.8549, test_loss: 0.9425, test_f1: 0.5956
 epoch: 9, train_loss: 0.8638, test_loss: 0.9998, test_f1: 0.5024
 epoch: 10, train_loss: 0.8525, test_loss: 1.1363, test_f1: 0.5669
 epoch: 11, train_loss: 0.8253, test_loss: 1.0381, test_f1: 0.5824
 epoch: 12, train_loss: 0.8281, test_loss: 1.2437, test_f1: 0.5462
 epoch: 13, train_loss: 0.8337, test_loss: 0.9157, test_f1: 0.5934
 epoch: 14, train_loss: 0.8107, test_loss: 0.9789, test_f1: 0.6175
 epoch: 15, train_loss: 0.8039, test_loss: 1.0407, test_f1: 0.5447
 epoch: 16, train_loss: 0.7873, test_loss: 0.9261, test_f1: 0.5707
 epoch: 17, train_loss: 0.7809, test_loss: 0.8801, test_f1: 0.6032
 epoch: 18, train_loss: 0.7756, test_loss: 0.9009, test_f1: 0.5976
 epoch: 19, train_loss: 0.7750, test_loss: 0.8663, test_f1: 0.5607
 epoch: 20, train_loss: 0.7784, test_loss: 0.9009, test_f1: 0.5962
 epoch: 21, train_loss: 0.7398, test_loss: 1.0512, test_f1: 0.5633
 epoch: 22, train_loss: 0.7344, test_loss: 0.9602, test_f1: 0.6006
 epoch: 23, train_loss: 0.7352, test_loss: 0.9882, test_f1: 0.5870
 epoch: 24, train_loss: 0.7399, test_loss: 0.9093, test_f1: 0.5987
 epoch: 25, train_loss: 0.7242, test_loss: 1.0478, test_f1: 0.5709
 epoch: 26, train_loss: 0.7078, test_loss: 1.0258, test_f1: 0.6695
 epoch: 27, train_loss: 0.7080, test_loss: 1.0682, test_f1: 0.5648
 epoch: 28, train_loss: 0.7029, test_loss: 1.0869, test_f1: 0.6235
 epoch: 29, train_loss: 0.6863, test_loss: 1.0813, test_f1: 0.5703
 epoch: 30, train_loss: 0.6826, test_loss: 0.8994, test_f1: 0.6083
 epoch: 31, train_loss: 0.6735, test_loss: 1.0854, test_f1: 0.6173
 epoch: 32, train_loss: 0.6614, test_loss: 1.2225, test_f1: 0.5880
 epoch: 33, train_loss: 0.6458, test_loss: 1.2196, test_f1: 0.6228
 epoch: 34, train_loss: 0.6772, test_loss: 0.9389, test_f1: 0.6637
 epoch: 35, train_loss: 0.6540, test_loss: 1.1194, test_f1: 0.6235
 epoch: 36, train_loss: 0.6526, test_loss: 1.1399, test_f1: 0.6505
 epoch: 37, train_loss: 0.6626, test_loss: 0.9368, test_f1: 0.6455
 epoch: 38, train_loss: 0.6349, test_loss: 0.8765, test_f1: 0.5841
 epoch: 39, train_loss: 0.6372, test_loss: 1.0579, test_f1: 0.5997
 epoch: 40, train_loss: 0.6068, test_loss: 0.9938, test_f1: 0.6272
 epoch: 41, train_loss: 0.5863, test_loss: 0.8540, test_f1: 0.5768
 epoch: 42, train_loss: 0.6457, test_loss: 1.0988, test_f1: 0.6303
 epoch: 43, train_loss: 0.5966, test_loss: 0.8801, test_f1: 0.6574
 epoch: 44, train_loss: 0.5961, test_loss: 1.1707, test_f1: 0.6361
 epoch: 45, train_loss: 0.6288, test_loss: 0.9694, test_f1: 0.6377
 epoch: 46, train_loss: 0.5560, test_loss: 1.0529, test_f1: 0.6335
 epoch: 47, train_loss: 0.5644, test_loss: 0.9418, test_f1: 0.6661
 epoch: 48, train_loss: 0.5785, test_loss: 1.0298, test_f1: 0.6810
 epoch: 49, train_loss: 0.5829, test_loss: 0.9717, test_f1: 0.6801
 epoch: 50, train_loss: 0.5665, test_loss: 1.1025, test_f1: 0.6110
 epoch: 51, train_loss: 0.5126, test_loss: 1.1585, test_f1: 0.6725
 epoch: 52, train_loss: 0.5161, test_loss: 1.0326, test_f1: 0.6397
 epoch: 53, train_loss: 0.4987, test_loss: 1.0739, test_f1: 0.6642
 epoch: 54, train_loss: 0.4843, test_loss: 1.2337, test_f1: 0.6475
 epoch: 55, train_loss: 0.4653, test_loss: 0.9875, test_f1: 0.6700
 epoch: 56, train_loss: 0.4566, test_loss: 1.3800, test_f1: 0.6509
 epoch: 57, train_loss: 0.4523, test_loss: 1.0665, test_f1: 0.6370
 epoch: 58, train_loss: 0.4439, test_loss: 1.0540, test_f1: 0.6606
 epoch: 59, train_loss: 0.4444, test_loss: 1.2703, test_f1: 0.6519
 epoch: 60, train_loss: 0.4503, test_loss: 1.0396, test_f1: 0.6966
 epoch: 61, train_loss: 0.4400, test_loss: 1.1402, test_f1: 0.6661
 epoch: 62, train_loss: 0.4433, test_loss: 1.0673, test_f1: 0.6683
 epoch: 63, train_loss: 0.4122, test_loss: 1.0636, test_f1: 0.6543
 epoch: 64, train_loss: 0.4060, test_loss: 1.2006, test_f1: 0.6770
 epoch: 65, train_loss: 0.4101, test_loss: 1.2175, test_f1: 0.6573
 epoch: 66, train_loss: 0.4211, test_loss: 0.9649, test_f1: 0.6609
 epoch: 67, train_loss: 0.4106, test_loss: 1.3145, test_f1: 0.6647
 epoch: 68, train_loss: 0.4085, test_loss: 1.2267, test_f1: 0.6848
 epoch: 69, train_loss: 0.4168, test_loss: 1.0174, test_f1: 0.6358
 epoch: 70, train_loss: 0.4054, test_loss: 1.3229, test_f1: 0.6935
 epoch: 71, train_loss: 0.4081, test_loss: 1.2183, test_f1: 0.6840
 epoch: 72, train_loss: 0.3873, test_loss: 1.3403, test_f1: 0.6796
 epoch: 73, train_loss: 0.4021, test_loss: 1.4627, test_f1: 0.7017
 epoch: 74, train_loss: 0.3941, test_loss: 1.2391, test_f1: 0.6520
 epoch: 75, train_loss: 0.3946, test_loss: 0.9821, test_f1: 0.6382
 epoch: 76, train_loss: 0.3903, test_loss: 1.3544, test_f1: 0.6591
 epoch: 77, train_loss: 0.4032, test_loss: 1.2261, test_f1: 0.6821
 epoch: 78, train_loss: 0.3833, test_loss: 1.1197, test_f1: 0.6947
 epoch: 79, train_loss: 0.3830, test_loss: 1.1727, test_f1: 0.6812
 epoch: 80, train_loss: 0.3502, test_loss: 1.3604, test_f1: 0.6755
 epoch: 81, train_loss: 0.3844, test_loss: 1.4367, test_f1: 0.6446
 epoch: 82, train_loss: 0.3845, test_loss: 1.3272, test_f1: 0.6894
 epoch: 83, train_loss: 0.3723, test_loss: 1.1721, test_f1: 0.6713
 epoch: 84, train_loss: 0.3489, test_loss: 1.3469, test_f1: 0.6726
 epoch: 85, train_loss: 0.3705, test_loss: 1.5175, test_f1: 0.6357
 epoch: 86, train_loss: 0.3691, test_loss: 1.3701, test_f1: 0.6508
 epoch: 87, train_loss: 0.3523, test_loss: 1.3581, test_f1: 0.6627
 epoch: 88, train_loss: 0.3582, test_loss: 1.4451, test_f1: 0.6635
 epoch: 89, train_loss: 0.3523, test_loss: 1.3532, test_f1: 0.6479
 epoch: 90, train_loss: 0.3289, test_loss: 1.5141, test_f1: 0.6554
 epoch: 91, train_loss: 0.3772, test_loss: 1.4646, test_f1: 0.6663
 epoch: 92, train_loss: 0.3335, test_loss: 1.3313, test_f1: 0.6685
 epoch: 93, train_loss: 0.3645, test_loss: 1.9739, test_f1: 0.6535
 epoch: 94, train_loss: 0.3512, test_loss: 1.6980, test_f1: 0.6946
 epoch: 95, train_loss: 0.3295, test_loss: 1.6313, test_f1: 0.6772
 epoch: 96, train_loss: 0.3411, test_loss: 1.5854, test_f1: 0.6764
 epoch: 97, train_loss: 0.3360, test_loss: 1.6180, test_f1: 0.6837
 epoch: 98, train_loss: 0.3524, test_loss: 1.7203, test_f1: 0.6505
 epoch: 99, train_loss: 0.3163, test_loss: 1.2981, test_f1: 0.6645
##################ITERATION #9 ****************************************
 epoch: 0, train_loss: 1.2171, test_loss: 1.1839, test_f1: 0.4430
 epoch: 1, train_loss: 1.0039, test_loss: 1.0975, test_f1: 0.5102
 epoch: 2, train_loss: 0.9685, test_loss: 0.9886, test_f1: 0.5185
 epoch: 3, train_loss: 0.9189, test_loss: 0.9817, test_f1: 0.4928
 epoch: 4, train_loss: 0.9303, test_loss: 0.9911, test_f1: 0.5430
 epoch: 5, train_loss: 0.8896, test_loss: 1.0348, test_f1: 0.4851
 epoch: 6, train_loss: 0.8795, test_loss: 1.0039, test_f1: 0.5814
 epoch: 7, train_loss: 0.8680, test_loss: 0.9118, test_f1: 0.4859
 epoch: 8, train_loss: 0.8519, test_loss: 0.9250, test_f1: 0.5711
 epoch: 9, train_loss: 0.8434, test_loss: 0.9763, test_f1: 0.5282
 epoch: 10, train_loss: 0.8212, test_loss: 0.8545, test_f1: 0.5493
 epoch: 11, train_loss: 0.8352, test_loss: 2.0248, test_f1: 0.3215
 epoch: 12, train_loss: 0.8246, test_loss: 0.9138, test_f1: 0.5541
 epoch: 13, train_loss: 0.7926, test_loss: 1.0306, test_f1: 0.5128
 epoch: 14, train_loss: 0.8233, test_loss: 0.9395, test_f1: 0.5560
 epoch: 15, train_loss: 0.7894, test_loss: 1.1056, test_f1: 0.5018
 epoch: 16, train_loss: 0.7869, test_loss: 0.8832, test_f1: 0.5668
 epoch: 17, train_loss: 0.7738, test_loss: 0.9131, test_f1: 0.5521
 epoch: 18, train_loss: 0.7644, test_loss: 0.9194, test_f1: 0.5706
 epoch: 19, train_loss: 0.7578, test_loss: 0.9932, test_f1: 0.5652
 epoch: 20, train_loss: 0.7619, test_loss: 0.9981, test_f1: 0.5426
 epoch: 21, train_loss: 0.7504, test_loss: 0.9421, test_f1: 0.5978
 epoch: 22, train_loss: 0.7201, test_loss: 0.8910, test_f1: 0.6036
 epoch: 23, train_loss: 0.7196, test_loss: 0.8190, test_f1: 0.6601
 epoch: 24, train_loss: 0.6998, test_loss: 0.8041, test_f1: 0.5950
 epoch: 25, train_loss: 0.7198, test_loss: 0.9337, test_f1: 0.5481
 epoch: 26, train_loss: 0.6937, test_loss: 0.8540, test_f1: 0.6139
 epoch: 27, train_loss: 0.6912, test_loss: 0.9669, test_f1: 0.6352
 epoch: 28, train_loss: 0.6982, test_loss: 0.9545, test_f1: 0.6211
 epoch: 29, train_loss: 0.6666, test_loss: 0.8221, test_f1: 0.6246
 epoch: 30, train_loss: 0.6616, test_loss: 0.9377, test_f1: 0.6465
 epoch: 31, train_loss: 0.6603, test_loss: 0.9194, test_f1: 0.6104
 epoch: 32, train_loss: 0.6501, test_loss: 0.9142, test_f1: 0.6084
 epoch: 33, train_loss: 0.6313, test_loss: 1.1630, test_f1: 0.5886
 epoch: 34, train_loss: 0.6394, test_loss: 0.8920, test_f1: 0.6200
 epoch: 35, train_loss: 0.6205, test_loss: 0.9556, test_f1: 0.6172
 epoch: 36, train_loss: 0.6365, test_loss: 0.9502, test_f1: 0.6113
 epoch: 37, train_loss: 0.6087, test_loss: 0.9247, test_f1: 0.6120
 epoch: 38, train_loss: 0.6177, test_loss: 0.9233, test_f1: 0.6427
 epoch: 39, train_loss: 0.5829, test_loss: 0.9881, test_f1: 0.6160
 epoch: 40, train_loss: 0.6055, test_loss: 0.8454, test_f1: 0.6476
 epoch: 41, train_loss: 0.5956, test_loss: 0.7969, test_f1: 0.6322
 epoch: 42, train_loss: 0.6056, test_loss: 1.0509, test_f1: 0.6068
 epoch: 43, train_loss: 0.6102, test_loss: 0.8318, test_f1: 0.6357
 epoch: 44, train_loss: 0.5836, test_loss: 0.9693, test_f1: 0.6250
 epoch: 45, train_loss: 0.5847, test_loss: 0.8968, test_f1: 0.6277
 epoch: 46, train_loss: 0.5466, test_loss: 1.0948, test_f1: 0.5831
 epoch: 47, train_loss: 0.5479, test_loss: 0.8947, test_f1: 0.6604
 epoch: 48, train_loss: 0.5713, test_loss: 0.8824, test_f1: 0.6208
 epoch: 49, train_loss: 0.5585, test_loss: 0.9975, test_f1: 0.6550
 epoch: 50, train_loss: 0.5269, test_loss: 1.2464, test_f1: 0.5874
 epoch: 51, train_loss: 0.5025, test_loss: 1.1102, test_f1: 0.6218
 epoch: 52, train_loss: 0.4578, test_loss: 1.0751, test_f1: 0.6774
 epoch: 53, train_loss: 0.4845, test_loss: 0.9742, test_f1: 0.6382
 epoch: 54, train_loss: 0.4661, test_loss: 0.9885, test_f1: 0.6480
 epoch: 55, train_loss: 0.4382, test_loss: 0.9406, test_f1: 0.6824
 epoch: 56, train_loss: 0.4281, test_loss: 0.9296, test_f1: 0.6685
 epoch: 57, train_loss: 0.4341, test_loss: 0.9540, test_f1: 0.6648
 epoch: 58, train_loss: 0.4438, test_loss: 0.9844, test_f1: 0.6539
 epoch: 59, train_loss: 0.4219, test_loss: 1.0575, test_f1: 0.6826
 epoch: 60, train_loss: 0.4304, test_loss: 0.9894, test_f1: 0.6771
 epoch: 61, train_loss: 0.4454, test_loss: 0.9159, test_f1: 0.6597
 epoch: 62, train_loss: 0.4395, test_loss: 1.0936, test_f1: 0.6657
 epoch: 63, train_loss: 0.4138, test_loss: 0.9973, test_f1: 0.6575
 epoch: 64, train_loss: 0.3911, test_loss: 1.0514, test_f1: 0.6453
 epoch: 65, train_loss: 0.3961, test_loss: 1.0704, test_f1: 0.6592
 epoch: 66, train_loss: 0.4071, test_loss: 1.0021, test_f1: 0.6927
 epoch: 67, train_loss: 0.3959, test_loss: 0.9862, test_f1: 0.6324
 epoch: 68, train_loss: 0.3932, test_loss: 1.0871, test_f1: 0.6472
 epoch: 69, train_loss: 0.3939, test_loss: 0.9248, test_f1: 0.6638
 epoch: 70, train_loss: 0.3936, test_loss: 1.1627, test_f1: 0.6729
 epoch: 71, train_loss: 0.3691, test_loss: 1.0527, test_f1: 0.6564
 epoch: 72, train_loss: 0.3705, test_loss: 0.9430, test_f1: 0.6663
 epoch: 73, train_loss: 0.4004, test_loss: 1.1951, test_f1: 0.6460
 epoch: 74, train_loss: 0.3837, test_loss: 1.2051, test_f1: 0.6509
 epoch: 75, train_loss: 0.3753, test_loss: 1.0512, test_f1: 0.6753
 epoch: 76, train_loss: 0.3787, test_loss: 0.9920, test_f1: 0.6750
 epoch: 77, train_loss: 0.3349, test_loss: 1.1048, test_f1: 0.6652
 epoch: 78, train_loss: 0.3859, test_loss: 1.1567, test_f1: 0.6785
 epoch: 79, train_loss: 0.3541, test_loss: 1.1007, test_f1: 0.6789
 epoch: 80, train_loss: 0.3377, test_loss: 1.0273, test_f1: 0.6706
 epoch: 81, train_loss: 0.3347, test_loss: 1.1201, test_f1: 0.6612
 epoch: 82, train_loss: 0.3582, test_loss: 1.1142, test_f1: 0.6651
 epoch: 83, train_loss: 0.3423, test_loss: 1.2465, test_f1: 0.6605
 epoch: 84, train_loss: 0.3714, test_loss: 1.1023, test_f1: 0.6832
 epoch: 85, train_loss: 0.3460, test_loss: 1.1654, test_f1: 0.6600
 epoch: 86, train_loss: 0.3412, test_loss: 1.1230, test_f1: 0.6863
 epoch: 87, train_loss: 0.3300, test_loss: 1.0630, test_f1: 0.6787
 epoch: 88, train_loss: 0.3413, test_loss: 1.1931, test_f1: 0.6576
 epoch: 89, train_loss: 0.3185, test_loss: 1.1773, test_f1: 0.6540
 epoch: 90, train_loss: 0.3260, test_loss: 1.2246, test_f1: 0.6733
 epoch: 91, train_loss: 0.3530, test_loss: 1.2624, test_f1: 0.6737
 epoch: 92, train_loss: 0.3280, test_loss: 1.0546, test_f1: 0.6792
 epoch: 93, train_loss: 0.3330, test_loss: 1.2055, test_f1: 0.6444
 epoch: 94, train_loss: 0.3118, test_loss: 1.3810, test_f1: 0.6532
 epoch: 95, train_loss: 0.3398, test_loss: 1.0912, test_f1: 0.6762
 epoch: 96, train_loss: 0.3005, test_loss: 1.1479, test_f1: 0.6666
 epoch: 97, train_loss: 0.3040, test_loss: 1.2243, test_f1: 0.6547
 epoch: 98, train_loss: 0.2961, test_loss: 0.9883, test_f1: 0.6701
 epoch: 99, train_loss: 0.3030, test_loss: 1.0881, test_f1: 0.6601

Training completed in 588.38 seconds
Best F1: 0.7300 at epoch 41
Mean F1 across iterations: 0.6973  0.0150
========================FINAL RESULTS================================
FEGIN weighted F1: 0.7300  0.0150
python main.py --data ltspice_examples --representation component_pin --model FEGIN --layers 2 --hiddens 128 --batch_size 64 --lr 0.01 --emb_size 512 --epochs 100 --save_appendix component_pin_L2_H128_BS64_LR0.01_E512 --no_val
-----



STDERR:
  File "main.py", line 370, in <module>
    main()
  File "main.py", line 254, in main
    dataset = dataset_class(
  File "/home/philip/projects/ltspice_examples_code_repo/Circuit-Completion-Using-GNNs/component_classification_with_link_prediction_head/evaluation/FEGIN/kernel/circuit_datasets.py", line 15, in __init__
    self.data, self.slices = torch.load(self.processed_paths[0])
  File "/home/philip/.local/lib/python3.8/site-packages/torch/serialization.py", line 1040, in load
    warnings.warn(
  File "/usr/lib/python3.8/warnings.py", line 109, in _showwarnmsg
    sw(msg.message, msg.category, msg.filename, msg.lineno,
  File "main.py", line 47, in warn_with_traceback
    traceback.print_stack(file=log)
/home/philip/projects/ltspice_examples_code_repo/Circuit-Completion-Using-GNNs/component_classification_with_link_prediction_head/evaluation/FEGIN/kernel/circuit_datasets.py:15: FutureWarning: You are using `torch.load` with `weights_only=False` (the current default value), which uses the default pickle module implicitly. It is possible to construct malicious pickle data which will execute arbitrary code during unpickling (See https://github.com/pytorch/pytorch/blob/main/SECURITY.md#untrusted-models for more details). In a future release, the default value for `weights_only` will be flipped to `True`. This limits the functions that could be executed during unpickling. Arbitrary objects will no longer be allowed to be loaded via this mode unless they are explicitly allowlisted by the user via `torch.serialization.add_safe_globals`. We recommend you start setting `weights_only=True` for any use case where you don't have full control of the loaded file. Please open an issue on GitHub for any issues related to this experimental feature.
  self.data, self.slices = torch.load(self.processed_paths[0])
