STDOUT:
Results will be saved in /home/philip/projects/ltspice_examples_code_repo/Circuit-Completion-Using-GNNs/component_classification_with_link_prediction_head/evaluation/FEGIN/results/model_FEGIN_dataset_ltspice_examples
Command line input: python main.py --data ltspice_examples --representation component_net --model FEGIN --layers 4 --hiddens 32 --batch_size 256 --lr 0.0001 --emb_size 128 --epochs 100 --save_appendix component_net_L4_H32_BS256_LR0.0001_E128 --no_val
 is saved.
-----
ltspice_examples - FEGIN
Using 4 layers, 32 hidden units, h = 2
Loading component_net representation dataset
ENTERED
Training FEGIN on component_net representation
Train: 3558, Test: 846
##################ITERATION #0 ****************************************
 epoch: 0, train_loss: 1.3614, test_loss: 1.3607, test_f1: 0.2270
 epoch: 1, train_loss: 1.3572, test_loss: 1.3602, test_f1: 0.2270
 epoch: 2, train_loss: 1.3550, test_loss: 1.3598, test_f1: 0.2270
 epoch: 3, train_loss: 1.3517, test_loss: 1.3572, test_f1: 0.2270
 epoch: 4, train_loss: 1.3491, test_loss: 1.3531, test_f1: 0.2270
 epoch: 5, train_loss: 1.3461, test_loss: 1.3482, test_f1: 0.2270
 epoch: 6, train_loss: 1.3441, test_loss: 1.3439, test_f1: 0.2270
 epoch: 7, train_loss: 1.3394, test_loss: 1.3403, test_f1: 0.2270
 epoch: 8, train_loss: 1.3359, test_loss: 1.3360, test_f1: 0.2270
 epoch: 9, train_loss: 1.3329, test_loss: 1.3317, test_f1: 0.2270
 epoch: 10, train_loss: 1.3287, test_loss: 1.3279, test_f1: 0.2270
 epoch: 11, train_loss: 1.3254, test_loss: 1.3247, test_f1: 0.2270
 epoch: 12, train_loss: 1.3212, test_loss: 1.3204, test_f1: 0.2270
 epoch: 13, train_loss: 1.3176, test_loss: 1.3154, test_f1: 0.2270
 epoch: 14, train_loss: 1.3138, test_loss: 1.3114, test_f1: 0.2270
 epoch: 15, train_loss: 1.3089, test_loss: 1.3079, test_f1: 0.2320
 epoch: 16, train_loss: 1.3058, test_loss: 1.3043, test_f1: 0.2320
 epoch: 17, train_loss: 1.3003, test_loss: 1.3003, test_f1: 0.2392
 epoch: 18, train_loss: 1.2972, test_loss: 1.2958, test_f1: 0.2461
 epoch: 19, train_loss: 1.2938, test_loss: 1.2918, test_f1: 0.2506
 epoch: 20, train_loss: 1.2892, test_loss: 1.2884, test_f1: 0.2570
 epoch: 21, train_loss: 1.2828, test_loss: 1.2841, test_f1: 0.2631
 epoch: 22, train_loss: 1.2810, test_loss: 1.2809, test_f1: 0.2696
 epoch: 23, train_loss: 1.2762, test_loss: 1.2746, test_f1: 0.2737
 epoch: 24, train_loss: 1.2710, test_loss: 1.2703, test_f1: 0.2806
 epoch: 25, train_loss: 1.2668, test_loss: 1.2671, test_f1: 0.2843
 epoch: 26, train_loss: 1.2608, test_loss: 1.2630, test_f1: 0.2892
 epoch: 27, train_loss: 1.2586, test_loss: 1.2564, test_f1: 0.3005
 epoch: 28, train_loss: 1.2539, test_loss: 1.2522, test_f1: 0.3021
 epoch: 29, train_loss: 1.2461, test_loss: 1.2477, test_f1: 0.3207
 epoch: 30, train_loss: 1.2426, test_loss: 1.2413, test_f1: 0.3271
 epoch: 31, train_loss: 1.2368, test_loss: 1.2348, test_f1: 0.3345
 epoch: 32, train_loss: 1.2312, test_loss: 1.2294, test_f1: 0.3447
 epoch: 33, train_loss: 1.2281, test_loss: 1.2225, test_f1: 0.3447
 epoch: 34, train_loss: 1.2210, test_loss: 1.2169, test_f1: 0.3595
 epoch: 35, train_loss: 1.2160, test_loss: 1.2092, test_f1: 0.3661
 epoch: 36, train_loss: 1.2137, test_loss: 1.2014, test_f1: 0.3780
 epoch: 37, train_loss: 1.2035, test_loss: 1.1947, test_f1: 0.3789
 epoch: 38, train_loss: 1.1976, test_loss: 1.1878, test_f1: 0.3823
 epoch: 39, train_loss: 1.1924, test_loss: 1.1800, test_f1: 0.3888
 epoch: 40, train_loss: 1.1859, test_loss: 1.1725, test_f1: 0.3982
 epoch: 41, train_loss: 1.1767, test_loss: 1.1639, test_f1: 0.3997
 epoch: 42, train_loss: 1.1708, test_loss: 1.1561, test_f1: 0.4092
 epoch: 43, train_loss: 1.1602, test_loss: 1.1493, test_f1: 0.4090
 epoch: 44, train_loss: 1.1542, test_loss: 1.1433, test_f1: 0.4125
 epoch: 45, train_loss: 1.1464, test_loss: 1.1333, test_f1: 0.4224
 epoch: 46, train_loss: 1.1462, test_loss: 1.1262, test_f1: 0.4259
 epoch: 47, train_loss: 1.1323, test_loss: 1.1168, test_f1: 0.4312
 epoch: 48, train_loss: 1.1256, test_loss: 1.1111, test_f1: 0.4325
 epoch: 49, train_loss: 1.1228, test_loss: 1.1028, test_f1: 0.4296
 epoch: 50, train_loss: 1.1159, test_loss: 1.0950, test_f1: 0.4371
 epoch: 51, train_loss: 1.1151, test_loss: 1.0913, test_f1: 0.4425
 epoch: 52, train_loss: 1.1093, test_loss: 1.0884, test_f1: 0.4443
 epoch: 53, train_loss: 1.1028, test_loss: 1.0837, test_f1: 0.4410
 epoch: 54, train_loss: 1.0992, test_loss: 1.0797, test_f1: 0.4460
 epoch: 55, train_loss: 1.1008, test_loss: 1.0763, test_f1: 0.4548
 epoch: 56, train_loss: 1.0945, test_loss: 1.0723, test_f1: 0.4501
 epoch: 57, train_loss: 1.0902, test_loss: 1.0686, test_f1: 0.4615
 epoch: 58, train_loss: 1.0838, test_loss: 1.0660, test_f1: 0.4594
 epoch: 59, train_loss: 1.0830, test_loss: 1.0614, test_f1: 0.4571
 epoch: 60, train_loss: 1.0779, test_loss: 1.0587, test_f1: 0.4631
 epoch: 61, train_loss: 1.0785, test_loss: 1.0543, test_f1: 0.4648
 epoch: 62, train_loss: 1.0718, test_loss: 1.0509, test_f1: 0.4679
 epoch: 63, train_loss: 1.0725, test_loss: 1.0479, test_f1: 0.4812
 epoch: 64, train_loss: 1.0695, test_loss: 1.0441, test_f1: 0.4839
 epoch: 65, train_loss: 1.0600, test_loss: 1.0414, test_f1: 0.4899
 epoch: 66, train_loss: 1.0543, test_loss: 1.0365, test_f1: 0.4855
 epoch: 67, train_loss: 1.0602, test_loss: 1.0337, test_f1: 0.4900
 epoch: 68, train_loss: 1.0586, test_loss: 1.0322, test_f1: 0.4900
 epoch: 69, train_loss: 1.0539, test_loss: 1.0278, test_f1: 0.4909
 epoch: 70, train_loss: 1.0528, test_loss: 1.0277, test_f1: 0.4950
 epoch: 71, train_loss: 1.0513, test_loss: 1.0234, test_f1: 0.4930
 epoch: 72, train_loss: 1.0499, test_loss: 1.0201, test_f1: 0.4940
 epoch: 73, train_loss: 1.0389, test_loss: 1.0182, test_f1: 0.4935
 epoch: 74, train_loss: 1.0366, test_loss: 1.0155, test_f1: 0.4942
 epoch: 75, train_loss: 1.0367, test_loss: 1.0127, test_f1: 0.4977
 epoch: 76, train_loss: 1.0355, test_loss: 1.0083, test_f1: 0.4951
 epoch: 77, train_loss: 1.0310, test_loss: 1.0051, test_f1: 0.4951
 epoch: 78, train_loss: 1.0262, test_loss: 1.0033, test_f1: 0.4974
 epoch: 79, train_loss: 1.0216, test_loss: 1.0013, test_f1: 0.4940
 epoch: 80, train_loss: 1.0217, test_loss: 1.0004, test_f1: 0.4935
 epoch: 81, train_loss: 1.0253, test_loss: 0.9993, test_f1: 0.4826
 epoch: 82, train_loss: 1.0189, test_loss: 0.9949, test_f1: 0.5088
 epoch: 83, train_loss: 1.0155, test_loss: 0.9909, test_f1: 0.5111
 epoch: 84, train_loss: 1.0108, test_loss: 0.9902, test_f1: 0.4977
 epoch: 85, train_loss: 1.0115, test_loss: 0.9872, test_f1: 0.4921
 epoch: 86, train_loss: 1.0023, test_loss: 0.9824, test_f1: 0.5059
 epoch: 87, train_loss: 1.0074, test_loss: 0.9809, test_f1: 0.5066
 epoch: 88, train_loss: 1.0025, test_loss: 0.9783, test_f1: 0.5053
 epoch: 89, train_loss: 1.0052, test_loss: 0.9781, test_f1: 0.5042
 epoch: 90, train_loss: 0.9960, test_loss: 0.9775, test_f1: 0.5041
 epoch: 91, train_loss: 0.9952, test_loss: 0.9762, test_f1: 0.5038
 epoch: 92, train_loss: 0.9935, test_loss: 0.9759, test_f1: 0.5042
 epoch: 93, train_loss: 0.9879, test_loss: 0.9727, test_f1: 0.5041
 epoch: 94, train_loss: 0.9931, test_loss: 0.9716, test_f1: 0.5041
 epoch: 95, train_loss: 0.9850, test_loss: 0.9690, test_f1: 0.5093
 epoch: 96, train_loss: 0.9852, test_loss: 0.9658, test_f1: 0.5120
 epoch: 97, train_loss: 0.9746, test_loss: 0.9651, test_f1: 0.5122
 epoch: 98, train_loss: 0.9802, test_loss: 0.9636, test_f1: 0.5162
 epoch: 99, train_loss: 0.9780, test_loss: 0.9623, test_f1: 0.5135
##################ITERATION #1 ****************************************
 epoch: 0, train_loss: 1.3271, test_loss: 1.3359, test_f1: 0.2270
 epoch: 1, train_loss: 1.3198, test_loss: 1.3309, test_f1: 0.2270
 epoch: 2, train_loss: 1.3162, test_loss: 1.3250, test_f1: 0.2270
 epoch: 3, train_loss: 1.3112, test_loss: 1.3184, test_f1: 0.2270
 epoch: 4, train_loss: 1.3065, test_loss: 1.3133, test_f1: 0.2270
 epoch: 5, train_loss: 1.3006, test_loss: 1.3071, test_f1: 0.2270
 epoch: 6, train_loss: 1.2968, test_loss: 1.3012, test_f1: 0.2270
 epoch: 7, train_loss: 1.2909, test_loss: 1.2952, test_f1: 0.2270
 epoch: 8, train_loss: 1.2836, test_loss: 1.2892, test_f1: 0.2270
 epoch: 9, train_loss: 1.2801, test_loss: 1.2833, test_f1: 0.2270
 epoch: 10, train_loss: 1.2755, test_loss: 1.2778, test_f1: 0.2270
 epoch: 11, train_loss: 1.2676, test_loss: 1.2716, test_f1: 0.2270
 epoch: 12, train_loss: 1.2652, test_loss: 1.2655, test_f1: 0.2270
 epoch: 13, train_loss: 1.2598, test_loss: 1.2596, test_f1: 0.2270
 epoch: 14, train_loss: 1.2535, test_loss: 1.2536, test_f1: 0.2270
 epoch: 15, train_loss: 1.2495, test_loss: 1.2476, test_f1: 0.2270
 epoch: 16, train_loss: 1.2417, test_loss: 1.2416, test_f1: 0.2295
 epoch: 17, train_loss: 1.2370, test_loss: 1.2355, test_f1: 0.2506
 epoch: 18, train_loss: 1.2348, test_loss: 1.2293, test_f1: 0.2611
 epoch: 19, train_loss: 1.2267, test_loss: 1.2239, test_f1: 0.2728
 epoch: 20, train_loss: 1.2260, test_loss: 1.2190, test_f1: 0.2765
 epoch: 21, train_loss: 1.2205, test_loss: 1.2133, test_f1: 0.2819
 epoch: 22, train_loss: 1.2161, test_loss: 1.2078, test_f1: 0.2853
 epoch: 23, train_loss: 1.2116, test_loss: 1.2025, test_f1: 0.2921
 epoch: 24, train_loss: 1.2019, test_loss: 1.1951, test_f1: 0.3196
 epoch: 25, train_loss: 1.1973, test_loss: 1.1898, test_f1: 0.3375
 epoch: 26, train_loss: 1.1950, test_loss: 1.1839, test_f1: 0.3473
 epoch: 27, train_loss: 1.1921, test_loss: 1.1787, test_f1: 0.3600
 epoch: 28, train_loss: 1.1854, test_loss: 1.1724, test_f1: 0.3808
 epoch: 29, train_loss: 1.1819, test_loss: 1.1658, test_f1: 0.4039
 epoch: 30, train_loss: 1.1717, test_loss: 1.1595, test_f1: 0.4095
 epoch: 31, train_loss: 1.1660, test_loss: 1.1525, test_f1: 0.4113
 epoch: 32, train_loss: 1.1626, test_loss: 1.1455, test_f1: 0.4148
 epoch: 33, train_loss: 1.1608, test_loss: 1.1379, test_f1: 0.4203
 epoch: 34, train_loss: 1.1552, test_loss: 1.1304, test_f1: 0.4262
 epoch: 35, train_loss: 1.1404, test_loss: 1.1242, test_f1: 0.4456
 epoch: 36, train_loss: 1.1375, test_loss: 1.1166, test_f1: 0.4558
 epoch: 37, train_loss: 1.1353, test_loss: 1.1089, test_f1: 0.4624
 epoch: 38, train_loss: 1.1242, test_loss: 1.1016, test_f1: 0.4648
 epoch: 39, train_loss: 1.1184, test_loss: 1.0958, test_f1: 0.4674
 epoch: 40, train_loss: 1.1101, test_loss: 1.0863, test_f1: 0.4673
 epoch: 41, train_loss: 1.1135, test_loss: 1.0845, test_f1: 0.4642
 epoch: 42, train_loss: 1.1017, test_loss: 1.0742, test_f1: 0.4722
 epoch: 43, train_loss: 1.0940, test_loss: 1.0672, test_f1: 0.4766
 epoch: 44, train_loss: 1.0877, test_loss: 1.0611, test_f1: 0.4743
 epoch: 45, train_loss: 1.0815, test_loss: 1.0550, test_f1: 0.4802
 epoch: 46, train_loss: 1.0771, test_loss: 1.0494, test_f1: 0.4802
 epoch: 47, train_loss: 1.0679, test_loss: 1.0452, test_f1: 0.4776
 epoch: 48, train_loss: 1.0647, test_loss: 1.0363, test_f1: 0.4825
 epoch: 49, train_loss: 1.0570, test_loss: 1.0360, test_f1: 0.4839
 epoch: 50, train_loss: 1.0523, test_loss: 1.0266, test_f1: 0.4859
 epoch: 51, train_loss: 1.0455, test_loss: 1.0231, test_f1: 0.4875
 epoch: 52, train_loss: 1.0406, test_loss: 1.0219, test_f1: 0.4829
 epoch: 53, train_loss: 1.0369, test_loss: 1.0204, test_f1: 0.4778
 epoch: 54, train_loss: 1.0393, test_loss: 1.0154, test_f1: 0.4824
 epoch: 55, train_loss: 1.0299, test_loss: 1.0147, test_f1: 0.4793
 epoch: 56, train_loss: 1.0322, test_loss: 1.0134, test_f1: 0.4805
 epoch: 57, train_loss: 1.0312, test_loss: 1.0123, test_f1: 0.4819
 epoch: 58, train_loss: 1.0232, test_loss: 1.0074, test_f1: 0.4810
 epoch: 59, train_loss: 1.0224, test_loss: 1.0067, test_f1: 0.4805
 epoch: 60, train_loss: 1.0129, test_loss: 1.0045, test_f1: 0.4826
 epoch: 61, train_loss: 1.0135, test_loss: 0.9998, test_f1: 0.4806
 epoch: 62, train_loss: 1.0162, test_loss: 0.9999, test_f1: 0.4816
 epoch: 63, train_loss: 1.0029, test_loss: 1.0000, test_f1: 0.4832
 epoch: 64, train_loss: 1.0086, test_loss: 0.9961, test_f1: 0.4879
 epoch: 65, train_loss: 0.9990, test_loss: 0.9918, test_f1: 0.4871
 epoch: 66, train_loss: 1.0002, test_loss: 0.9928, test_f1: 0.4892
 epoch: 67, train_loss: 1.0014, test_loss: 0.9912, test_f1: 0.4911
 epoch: 68, train_loss: 1.0010, test_loss: 0.9939, test_f1: 0.4887
 epoch: 69, train_loss: 0.9978, test_loss: 0.9925, test_f1: 0.4820
 epoch: 70, train_loss: 0.9948, test_loss: 0.9887, test_f1: 0.4825
 epoch: 71, train_loss: 0.9911, test_loss: 0.9877, test_f1: 0.4831
 epoch: 72, train_loss: 0.9893, test_loss: 0.9914, test_f1: 0.4914
 epoch: 73, train_loss: 0.9815, test_loss: 0.9863, test_f1: 0.4835
 epoch: 74, train_loss: 0.9794, test_loss: 0.9866, test_f1: 0.4849
 epoch: 75, train_loss: 0.9874, test_loss: 0.9896, test_f1: 0.4887
 epoch: 76, train_loss: 0.9783, test_loss: 0.9866, test_f1: 0.4910
 epoch: 77, train_loss: 0.9804, test_loss: 0.9806, test_f1: 0.4868
 epoch: 78, train_loss: 0.9843, test_loss: 0.9830, test_f1: 0.4864
 epoch: 79, train_loss: 0.9729, test_loss: 0.9780, test_f1: 0.4898
 epoch: 80, train_loss: 0.9788, test_loss: 0.9775, test_f1: 0.4935
 epoch: 81, train_loss: 0.9713, test_loss: 0.9804, test_f1: 0.4892
 epoch: 82, train_loss: 0.9707, test_loss: 0.9765, test_f1: 0.4904
 epoch: 83, train_loss: 0.9595, test_loss: 0.9803, test_f1: 0.4872
 epoch: 84, train_loss: 0.9702, test_loss: 0.9767, test_f1: 0.4828
 epoch: 85, train_loss: 0.9681, test_loss: 0.9778, test_f1: 0.4910
 epoch: 86, train_loss: 0.9622, test_loss: 0.9767, test_f1: 0.4859
 epoch: 87, train_loss: 0.9669, test_loss: 0.9730, test_f1: 0.4910
 epoch: 88, train_loss: 0.9603, test_loss: 0.9648, test_f1: 0.4952
 epoch: 89, train_loss: 0.9582, test_loss: 0.9732, test_f1: 0.4845
 epoch: 90, train_loss: 0.9528, test_loss: 0.9733, test_f1: 0.4909
 epoch: 91, train_loss: 0.9562, test_loss: 0.9691, test_f1: 0.4891
 epoch: 92, train_loss: 0.9449, test_loss: 0.9747, test_f1: 0.4930
 epoch: 93, train_loss: 0.9539, test_loss: 0.9727, test_f1: 0.4891
 epoch: 94, train_loss: 0.9495, test_loss: 0.9708, test_f1: 0.4930
 epoch: 95, train_loss: 0.9437, test_loss: 0.9654, test_f1: 0.4964
 epoch: 96, train_loss: 0.9472, test_loss: 0.9615, test_f1: 0.4918
 epoch: 97, train_loss: 0.9475, test_loss: 0.9579, test_f1: 0.4925
 epoch: 98, train_loss: 0.9407, test_loss: 0.9602, test_f1: 0.4939
 epoch: 99, train_loss: 0.9404, test_loss: 0.9630, test_f1: 0.4947
##################ITERATION #2 ****************************************
 epoch: 0, train_loss: 1.3190, test_loss: 1.3268, test_f1: 0.2270
 epoch: 1, train_loss: 1.3081, test_loss: 1.3250, test_f1: 0.2270
 epoch: 2, train_loss: 1.2992, test_loss: 1.3161, test_f1: 0.2270
 epoch: 3, train_loss: 1.2877, test_loss: 1.3045, test_f1: 0.2270
 epoch: 4, train_loss: 1.2841, test_loss: 1.2933, test_f1: 0.2270
 epoch: 5, train_loss: 1.2773, test_loss: 1.2820, test_f1: 0.2766
 epoch: 6, train_loss: 1.2707, test_loss: 1.2619, test_f1: 0.3149
 epoch: 7, train_loss: 1.2607, test_loss: 1.2460, test_f1: 0.3230
 epoch: 8, train_loss: 1.2560, test_loss: 1.2362, test_f1: 0.3308
 epoch: 9, train_loss: 1.2471, test_loss: 1.2301, test_f1: 0.3332
 epoch: 10, train_loss: 1.2398, test_loss: 1.2195, test_f1: 0.3367
 epoch: 11, train_loss: 1.2366, test_loss: 1.2123, test_f1: 0.3480
 epoch: 12, train_loss: 1.2306, test_loss: 1.2059, test_f1: 0.3508
 epoch: 13, train_loss: 1.2243, test_loss: 1.1993, test_f1: 0.3612
 epoch: 14, train_loss: 1.2175, test_loss: 1.1938, test_f1: 0.3611
 epoch: 15, train_loss: 1.2179, test_loss: 1.1889, test_f1: 0.3652
 epoch: 16, train_loss: 1.2089, test_loss: 1.1846, test_f1: 0.3642
 epoch: 17, train_loss: 1.2039, test_loss: 1.1773, test_f1: 0.3678
 epoch: 18, train_loss: 1.1953, test_loss: 1.1717, test_f1: 0.3718
 epoch: 19, train_loss: 1.1966, test_loss: 1.1671, test_f1: 0.3711
 epoch: 20, train_loss: 1.1867, test_loss: 1.1614, test_f1: 0.3749
 epoch: 21, train_loss: 1.1812, test_loss: 1.1542, test_f1: 0.3804
 epoch: 22, train_loss: 1.1832, test_loss: 1.1494, test_f1: 0.3797
 epoch: 23, train_loss: 1.1728, test_loss: 1.1462, test_f1: 0.3795
 epoch: 24, train_loss: 1.1715, test_loss: 1.1441, test_f1: 0.3849
 epoch: 25, train_loss: 1.1624, test_loss: 1.1384, test_f1: 0.3968
 epoch: 26, train_loss: 1.1604, test_loss: 1.1319, test_f1: 0.4107
 epoch: 27, train_loss: 1.1557, test_loss: 1.1270, test_f1: 0.4123
 epoch: 28, train_loss: 1.1520, test_loss: 1.1259, test_f1: 0.4141
 epoch: 29, train_loss: 1.1525, test_loss: 1.1213, test_f1: 0.4131
 epoch: 30, train_loss: 1.1408, test_loss: 1.1162, test_f1: 0.4200
 epoch: 31, train_loss: 1.1392, test_loss: 1.1087, test_f1: 0.4342
 epoch: 32, train_loss: 1.1308, test_loss: 1.1055, test_f1: 0.4350
 epoch: 33, train_loss: 1.1236, test_loss: 1.1031, test_f1: 0.4369
 epoch: 34, train_loss: 1.1223, test_loss: 1.0963, test_f1: 0.4389
 epoch: 35, train_loss: 1.1213, test_loss: 1.0918, test_f1: 0.4452
 epoch: 36, train_loss: 1.1212, test_loss: 1.0889, test_f1: 0.4452
 epoch: 37, train_loss: 1.1168, test_loss: 1.0813, test_f1: 0.4592
 epoch: 38, train_loss: 1.1123, test_loss: 1.0785, test_f1: 0.4610
 epoch: 39, train_loss: 1.1080, test_loss: 1.0766, test_f1: 0.4600
 epoch: 40, train_loss: 1.1012, test_loss: 1.0683, test_f1: 0.4600
 epoch: 41, train_loss: 1.0947, test_loss: 1.0640, test_f1: 0.4692
 epoch: 42, train_loss: 1.0877, test_loss: 1.0594, test_f1: 0.4693
 epoch: 43, train_loss: 1.0827, test_loss: 1.0558, test_f1: 0.4716
 epoch: 44, train_loss: 1.0822, test_loss: 1.0512, test_f1: 0.4726
 epoch: 45, train_loss: 1.0782, test_loss: 1.0477, test_f1: 0.4729
 epoch: 46, train_loss: 1.0703, test_loss: 1.0427, test_f1: 0.4746
 epoch: 47, train_loss: 1.0705, test_loss: 1.0414, test_f1: 0.4755
 epoch: 48, train_loss: 1.0608, test_loss: 1.0381, test_f1: 0.4682
 epoch: 49, train_loss: 1.0576, test_loss: 1.0350, test_f1: 0.4736
 epoch: 50, train_loss: 1.0576, test_loss: 1.0328, test_f1: 0.4700
 epoch: 51, train_loss: 1.0478, test_loss: 1.0295, test_f1: 0.4641
 epoch: 52, train_loss: 1.0517, test_loss: 1.0279, test_f1: 0.4670
 epoch: 53, train_loss: 1.0472, test_loss: 1.0267, test_f1: 0.4687
 epoch: 54, train_loss: 1.0445, test_loss: 1.0249, test_f1: 0.4754
 epoch: 55, train_loss: 1.0455, test_loss: 1.0239, test_f1: 0.4751
 epoch: 56, train_loss: 1.0399, test_loss: 1.0228, test_f1: 0.4764
 epoch: 57, train_loss: 1.0359, test_loss: 1.0205, test_f1: 0.4762
 epoch: 58, train_loss: 1.0379, test_loss: 1.0199, test_f1: 0.4762
 epoch: 59, train_loss: 1.0366, test_loss: 1.0197, test_f1: 0.4787
 epoch: 60, train_loss: 1.0312, test_loss: 1.0171, test_f1: 0.4772
 epoch: 61, train_loss: 1.0291, test_loss: 1.0162, test_f1: 0.4764
 epoch: 62, train_loss: 1.0285, test_loss: 1.0153, test_f1: 0.4786
 epoch: 63, train_loss: 1.0310, test_loss: 1.0140, test_f1: 0.4843
 epoch: 64, train_loss: 1.0250, test_loss: 1.0136, test_f1: 0.4829
 epoch: 65, train_loss: 1.0193, test_loss: 1.0120, test_f1: 0.4838
 epoch: 66, train_loss: 1.0198, test_loss: 1.0111, test_f1: 0.4805
 epoch: 67, train_loss: 1.0175, test_loss: 1.0101, test_f1: 0.4851
 epoch: 68, train_loss: 1.0175, test_loss: 1.0078, test_f1: 0.4882
 epoch: 69, train_loss: 1.0202, test_loss: 1.0063, test_f1: 0.4867
 epoch: 70, train_loss: 1.0138, test_loss: 1.0054, test_f1: 0.4886
 epoch: 71, train_loss: 1.0068, test_loss: 1.0051, test_f1: 0.4894
 epoch: 72, train_loss: 1.0115, test_loss: 1.0046, test_f1: 0.4870
 epoch: 73, train_loss: 1.0065, test_loss: 1.0034, test_f1: 0.4875
 epoch: 74, train_loss: 1.0058, test_loss: 1.0030, test_f1: 0.4863
 epoch: 75, train_loss: 1.0064, test_loss: 1.0024, test_f1: 0.4871
 epoch: 76, train_loss: 1.0043, test_loss: 1.0015, test_f1: 0.4865
 epoch: 77, train_loss: 1.0051, test_loss: 0.9999, test_f1: 0.4863
 epoch: 78, train_loss: 0.9981, test_loss: 1.0001, test_f1: 0.4844
 epoch: 79, train_loss: 1.0084, test_loss: 0.9974, test_f1: 0.4898
 epoch: 80, train_loss: 0.9952, test_loss: 0.9961, test_f1: 0.4888
 epoch: 81, train_loss: 0.9964, test_loss: 0.9961, test_f1: 0.4884
 epoch: 82, train_loss: 0.9966, test_loss: 0.9957, test_f1: 0.4961
 epoch: 83, train_loss: 0.9898, test_loss: 0.9964, test_f1: 0.4908
 epoch: 84, train_loss: 0.9940, test_loss: 0.9949, test_f1: 0.4886
 epoch: 85, train_loss: 0.9815, test_loss: 0.9926, test_f1: 0.4926
 epoch: 86, train_loss: 0.9943, test_loss: 0.9923, test_f1: 0.4929
 epoch: 87, train_loss: 0.9876, test_loss: 0.9918, test_f1: 0.4921
 epoch: 88, train_loss: 0.9893, test_loss: 0.9900, test_f1: 0.4910
 epoch: 89, train_loss: 0.9864, test_loss: 0.9902, test_f1: 0.4898
 epoch: 90, train_loss: 0.9803, test_loss: 0.9907, test_f1: 0.4845
 epoch: 91, train_loss: 0.9838, test_loss: 0.9903, test_f1: 0.4821
 epoch: 92, train_loss: 0.9832, test_loss: 0.9885, test_f1: 0.4931
 epoch: 93, train_loss: 0.9852, test_loss: 0.9878, test_f1: 0.4920
 epoch: 94, train_loss: 0.9805, test_loss: 0.9859, test_f1: 0.4969
 epoch: 95, train_loss: 0.9805, test_loss: 0.9855, test_f1: 0.4935
 epoch: 96, train_loss: 0.9842, test_loss: 0.9854, test_f1: 0.4950
 epoch: 97, train_loss: 0.9755, test_loss: 0.9847, test_f1: 0.4929
 epoch: 98, train_loss: 0.9739, test_loss: 0.9845, test_f1: 0.4948
 epoch: 99, train_loss: 0.9738, test_loss: 0.9826, test_f1: 0.4934
##################ITERATION #3 ****************************************
 epoch: 0, train_loss: 1.3121, test_loss: 1.3197, test_f1: 0.2270
 epoch: 1, train_loss: 1.2940, test_loss: 1.3191, test_f1: 0.2270
 epoch: 2, train_loss: 1.2852, test_loss: 1.3096, test_f1: 0.2270
 epoch: 3, train_loss: 1.2765, test_loss: 1.2910, test_f1: 0.2270
 epoch: 4, train_loss: 1.2663, test_loss: 1.2721, test_f1: 0.2270
 epoch: 5, train_loss: 1.2597, test_loss: 1.2529, test_f1: 0.2295
 epoch: 6, train_loss: 1.2509, test_loss: 1.2386, test_f1: 0.2487
 epoch: 7, train_loss: 1.2419, test_loss: 1.2275, test_f1: 0.2698
 epoch: 8, train_loss: 1.2360, test_loss: 1.2196, test_f1: 0.2737
 epoch: 9, train_loss: 1.2289, test_loss: 1.2119, test_f1: 0.2862
 epoch: 10, train_loss: 1.2210, test_loss: 1.2049, test_f1: 0.3079
 epoch: 11, train_loss: 1.2130, test_loss: 1.1968, test_f1: 0.3274
 epoch: 12, train_loss: 1.2067, test_loss: 1.1897, test_f1: 0.3545
 epoch: 13, train_loss: 1.2018, test_loss: 1.1805, test_f1: 0.3709
 epoch: 14, train_loss: 1.1907, test_loss: 1.1724, test_f1: 0.3829
 epoch: 15, train_loss: 1.1838, test_loss: 1.1650, test_f1: 0.4018
 epoch: 16, train_loss: 1.1757, test_loss: 1.1564, test_f1: 0.4081
 epoch: 17, train_loss: 1.1672, test_loss: 1.1487, test_f1: 0.4162
 epoch: 18, train_loss: 1.1638, test_loss: 1.1402, test_f1: 0.4180
 epoch: 19, train_loss: 1.1605, test_loss: 1.1322, test_f1: 0.4300
 epoch: 20, train_loss: 1.1510, test_loss: 1.1247, test_f1: 0.4287
 epoch: 21, train_loss: 1.1437, test_loss: 1.1182, test_f1: 0.4370
 epoch: 22, train_loss: 1.1325, test_loss: 1.1092, test_f1: 0.4430
 epoch: 23, train_loss: 1.1290, test_loss: 1.1016, test_f1: 0.4459
 epoch: 24, train_loss: 1.1181, test_loss: 1.0924, test_f1: 0.4506
 epoch: 25, train_loss: 1.1144, test_loss: 1.0841, test_f1: 0.4477
 epoch: 26, train_loss: 1.1076, test_loss: 1.0779, test_f1: 0.4482
 epoch: 27, train_loss: 1.1000, test_loss: 1.0708, test_f1: 0.4492
 epoch: 28, train_loss: 1.0965, test_loss: 1.0640, test_f1: 0.4355
 epoch: 29, train_loss: 1.0870, test_loss: 1.0584, test_f1: 0.4421
 epoch: 30, train_loss: 1.0816, test_loss: 1.0527, test_f1: 0.4431
 epoch: 31, train_loss: 1.0738, test_loss: 1.0467, test_f1: 0.4408
 epoch: 32, train_loss: 1.0679, test_loss: 1.0417, test_f1: 0.4501
 epoch: 33, train_loss: 1.0657, test_loss: 1.0363, test_f1: 0.4487
 epoch: 34, train_loss: 1.0564, test_loss: 1.0311, test_f1: 0.4513
 epoch: 35, train_loss: 1.0515, test_loss: 1.0201, test_f1: 0.4550
 epoch: 36, train_loss: 1.0414, test_loss: 1.0201, test_f1: 0.4583
 epoch: 37, train_loss: 1.0393, test_loss: 1.0152, test_f1: 0.4573
 epoch: 38, train_loss: 1.0238, test_loss: 1.0074, test_f1: 0.4628
 epoch: 39, train_loss: 1.0238, test_loss: 1.0022, test_f1: 0.4571
 epoch: 40, train_loss: 1.0191, test_loss: 1.0057, test_f1: 0.4667
 epoch: 41, train_loss: 1.0099, test_loss: 1.0007, test_f1: 0.4645
 epoch: 42, train_loss: 1.0121, test_loss: 0.9910, test_f1: 0.4697
 epoch: 43, train_loss: 1.0098, test_loss: 0.9927, test_f1: 0.4826
 epoch: 44, train_loss: 0.9936, test_loss: 0.9900, test_f1: 0.4719
 epoch: 45, train_loss: 0.9985, test_loss: 0.9822, test_f1: 0.4772
 epoch: 46, train_loss: 0.9890, test_loss: 0.9823, test_f1: 0.4770
 epoch: 47, train_loss: 0.9889, test_loss: 0.9794, test_f1: 0.4809
 epoch: 48, train_loss: 0.9896, test_loss: 0.9751, test_f1: 0.4802
 epoch: 49, train_loss: 0.9781, test_loss: 0.9719, test_f1: 0.4829
 epoch: 50, train_loss: 0.9759, test_loss: 0.9715, test_f1: 0.4789
 epoch: 51, train_loss: 0.9761, test_loss: 0.9696, test_f1: 0.4821
 epoch: 52, train_loss: 0.9703, test_loss: 0.9703, test_f1: 0.4833
 epoch: 53, train_loss: 0.9691, test_loss: 0.9696, test_f1: 0.4869
 epoch: 54, train_loss: 0.9627, test_loss: 0.9742, test_f1: 0.4879
 epoch: 55, train_loss: 0.9598, test_loss: 0.9701, test_f1: 0.4870
 epoch: 56, train_loss: 0.9737, test_loss: 0.9679, test_f1: 0.4862
 epoch: 57, train_loss: 0.9609, test_loss: 0.9688, test_f1: 0.4864
 epoch: 58, train_loss: 0.9655, test_loss: 0.9698, test_f1: 0.4872
 epoch: 59, train_loss: 0.9594, test_loss: 0.9658, test_f1: 0.4838
 epoch: 60, train_loss: 0.9587, test_loss: 0.9623, test_f1: 0.4870
 epoch: 61, train_loss: 0.9583, test_loss: 0.9611, test_f1: 0.4900
 epoch: 62, train_loss: 0.9609, test_loss: 0.9579, test_f1: 0.4867
 epoch: 63, train_loss: 0.9537, test_loss: 0.9640, test_f1: 0.4884
 epoch: 64, train_loss: 0.9499, test_loss: 0.9627, test_f1: 0.4905
 epoch: 65, train_loss: 0.9468, test_loss: 0.9615, test_f1: 0.4877
 epoch: 66, train_loss: 0.9502, test_loss: 0.9600, test_f1: 0.4910
 epoch: 67, train_loss: 0.9457, test_loss: 0.9555, test_f1: 0.4886
 epoch: 68, train_loss: 0.9497, test_loss: 0.9612, test_f1: 0.4875
 epoch: 69, train_loss: 0.9395, test_loss: 0.9633, test_f1: 0.4923
 epoch: 70, train_loss: 0.9443, test_loss: 0.9574, test_f1: 0.4926
 epoch: 71, train_loss: 0.9356, test_loss: 0.9544, test_f1: 0.4940
 epoch: 72, train_loss: 0.9409, test_loss: 0.9633, test_f1: 0.4954
 epoch: 73, train_loss: 0.9385, test_loss: 0.9604, test_f1: 0.4917
 epoch: 74, train_loss: 0.9398, test_loss: 0.9643, test_f1: 0.4944
 epoch: 75, train_loss: 0.9420, test_loss: 0.9569, test_f1: 0.4917
 epoch: 76, train_loss: 0.9374, test_loss: 0.9600, test_f1: 0.4917
 epoch: 77, train_loss: 0.9312, test_loss: 0.9605, test_f1: 0.4958
 epoch: 78, train_loss: 0.9371, test_loss: 0.9619, test_f1: 0.4948
 epoch: 79, train_loss: 0.9315, test_loss: 0.9627, test_f1: 0.4946
 epoch: 80, train_loss: 0.9292, test_loss: 0.9598, test_f1: 0.4958
 epoch: 81, train_loss: 0.9315, test_loss: 0.9619, test_f1: 0.4967
 epoch: 82, train_loss: 0.9244, test_loss: 0.9552, test_f1: 0.5052
 epoch: 83, train_loss: 0.9302, test_loss: 0.9574, test_f1: 0.4970
 epoch: 84, train_loss: 0.9224, test_loss: 0.9577, test_f1: 0.4956
 epoch: 85, train_loss: 0.9178, test_loss: 0.9612, test_f1: 0.4972
 epoch: 86, train_loss: 0.9144, test_loss: 0.9591, test_f1: 0.4966
 epoch: 87, train_loss: 0.9138, test_loss: 0.9555, test_f1: 0.5050
 epoch: 88, train_loss: 0.9214, test_loss: 0.9571, test_f1: 0.5069
 epoch: 89, train_loss: 0.9134, test_loss: 0.9542, test_f1: 0.5064
 epoch: 90, train_loss: 0.9166, test_loss: 0.9560, test_f1: 0.5024
 epoch: 91, train_loss: 0.9235, test_loss: 0.9613, test_f1: 0.5091
 epoch: 92, train_loss: 0.9166, test_loss: 0.9609, test_f1: 0.5054
 epoch: 93, train_loss: 0.9160, test_loss: 0.9577, test_f1: 0.5062
 epoch: 94, train_loss: 0.9121, test_loss: 0.9571, test_f1: 0.5085
 epoch: 95, train_loss: 0.9135, test_loss: 0.9615, test_f1: 0.5131
 epoch: 96, train_loss: 0.9063, test_loss: 0.9578, test_f1: 0.5113
 epoch: 97, train_loss: 0.9064, test_loss: 0.9553, test_f1: 0.5116
 epoch: 98, train_loss: 0.9053, test_loss: 0.9590, test_f1: 0.5104
 epoch: 99, train_loss: 0.9073, test_loss: 0.9551, test_f1: 0.5106
##################ITERATION #4 ****************************************
 epoch: 0, train_loss: 1.3040, test_loss: 1.3165, test_f1: 0.2270
 epoch: 1, train_loss: 1.2783, test_loss: 1.3072, test_f1: 0.2270
 epoch: 2, train_loss: 1.2651, test_loss: 1.2898, test_f1: 0.2270
 epoch: 3, train_loss: 1.2573, test_loss: 1.2656, test_f1: 0.2270
 epoch: 4, train_loss: 1.2466, test_loss: 1.2438, test_f1: 0.2374
 epoch: 5, train_loss: 1.2407, test_loss: 1.2207, test_f1: 0.2704
 epoch: 6, train_loss: 1.2363, test_loss: 1.2050, test_f1: 0.2912
 epoch: 7, train_loss: 1.2261, test_loss: 1.1951, test_f1: 0.3044
 epoch: 8, train_loss: 1.2206, test_loss: 1.1870, test_f1: 0.3084
 epoch: 9, train_loss: 1.2153, test_loss: 1.1785, test_f1: 0.3130
 epoch: 10, train_loss: 1.2095, test_loss: 1.1705, test_f1: 0.3296
 epoch: 11, train_loss: 1.2056, test_loss: 1.1623, test_f1: 0.3358
 epoch: 12, train_loss: 1.1931, test_loss: 1.1569, test_f1: 0.3647
 epoch: 13, train_loss: 1.1913, test_loss: 1.1496, test_f1: 0.3747
 epoch: 14, train_loss: 1.1851, test_loss: 1.1408, test_f1: 0.3906
 epoch: 15, train_loss: 1.1711, test_loss: 1.1333, test_f1: 0.3935
 epoch: 16, train_loss: 1.1596, test_loss: 1.1288, test_f1: 0.4063
 epoch: 17, train_loss: 1.1592, test_loss: 1.1217, test_f1: 0.4127
 epoch: 18, train_loss: 1.1556, test_loss: 1.1133, test_f1: 0.4099
 epoch: 19, train_loss: 1.1423, test_loss: 1.1054, test_f1: 0.4123
 epoch: 20, train_loss: 1.1416, test_loss: 1.0977, test_f1: 0.4157
 epoch: 21, train_loss: 1.1351, test_loss: 1.0905, test_f1: 0.4196
 epoch: 22, train_loss: 1.1256, test_loss: 1.0849, test_f1: 0.4318
 epoch: 23, train_loss: 1.1199, test_loss: 1.0776, test_f1: 0.4284
 epoch: 24, train_loss: 1.1148, test_loss: 1.0704, test_f1: 0.4420
 epoch: 25, train_loss: 1.1120, test_loss: 1.0649, test_f1: 0.4520
 epoch: 26, train_loss: 1.0959, test_loss: 1.0581, test_f1: 0.4463
 epoch: 27, train_loss: 1.0910, test_loss: 1.0531, test_f1: 0.4549
 epoch: 28, train_loss: 1.0914, test_loss: 1.0450, test_f1: 0.4507
 epoch: 29, train_loss: 1.0820, test_loss: 1.0423, test_f1: 0.4550
 epoch: 30, train_loss: 1.0774, test_loss: 1.0348, test_f1: 0.4592
 epoch: 31, train_loss: 1.0616, test_loss: 1.0300, test_f1: 0.4575
 epoch: 32, train_loss: 1.0581, test_loss: 1.0205, test_f1: 0.4652
 epoch: 33, train_loss: 1.0539, test_loss: 1.0165, test_f1: 0.4678
 epoch: 34, train_loss: 1.0455, test_loss: 1.0147, test_f1: 0.4568
 epoch: 35, train_loss: 1.0384, test_loss: 1.0080, test_f1: 0.4522
 epoch: 36, train_loss: 1.0383, test_loss: 1.0008, test_f1: 0.4629
 epoch: 37, train_loss: 1.0291, test_loss: 0.9954, test_f1: 0.4687
 epoch: 38, train_loss: 1.0272, test_loss: 0.9898, test_f1: 0.4724
 epoch: 39, train_loss: 1.0215, test_loss: 0.9877, test_f1: 0.4752
 epoch: 40, train_loss: 1.0208, test_loss: 0.9891, test_f1: 0.4763
 epoch: 41, train_loss: 1.0185, test_loss: 0.9812, test_f1: 0.4768
 epoch: 42, train_loss: 1.0114, test_loss: 0.9738, test_f1: 0.4736
 epoch: 43, train_loss: 0.9967, test_loss: 0.9722, test_f1: 0.4717
 epoch: 44, train_loss: 1.0003, test_loss: 0.9669, test_f1: 0.4780
 epoch: 45, train_loss: 0.9967, test_loss: 0.9635, test_f1: 0.4838
 epoch: 46, train_loss: 0.9915, test_loss: 0.9631, test_f1: 0.4855
 epoch: 47, train_loss: 0.9796, test_loss: 0.9614, test_f1: 0.4820
 epoch: 48, train_loss: 0.9844, test_loss: 0.9611, test_f1: 0.4797
 epoch: 49, train_loss: 0.9742, test_loss: 0.9571, test_f1: 0.4869
 epoch: 50, train_loss: 0.9742, test_loss: 0.9624, test_f1: 0.4792
 epoch: 51, train_loss: 0.9702, test_loss: 0.9518, test_f1: 0.4881
 epoch: 52, train_loss: 0.9778, test_loss: 0.9537, test_f1: 0.4869
 epoch: 53, train_loss: 0.9650, test_loss: 0.9553, test_f1: 0.4865
 epoch: 54, train_loss: 0.9527, test_loss: 0.9531, test_f1: 0.4911
 epoch: 55, train_loss: 0.9701, test_loss: 0.9492, test_f1: 0.4911
 epoch: 56, train_loss: 0.9681, test_loss: 0.9478, test_f1: 0.4933
 epoch: 57, train_loss: 0.9606, test_loss: 0.9447, test_f1: 0.4933
 epoch: 58, train_loss: 0.9593, test_loss: 0.9514, test_f1: 0.4878
 epoch: 59, train_loss: 0.9535, test_loss: 0.9490, test_f1: 0.4890
 epoch: 60, train_loss: 0.9505, test_loss: 0.9483, test_f1: 0.4890
 epoch: 61, train_loss: 0.9530, test_loss: 0.9523, test_f1: 0.4931
 epoch: 62, train_loss: 0.9530, test_loss: 0.9502, test_f1: 0.4938
 epoch: 63, train_loss: 0.9584, test_loss: 0.9510, test_f1: 0.4889
 epoch: 64, train_loss: 0.9476, test_loss: 0.9462, test_f1: 0.4874
 epoch: 65, train_loss: 0.9471, test_loss: 0.9491, test_f1: 0.4895
 epoch: 66, train_loss: 0.9441, test_loss: 0.9423, test_f1: 0.4923
 epoch: 67, train_loss: 0.9426, test_loss: 0.9404, test_f1: 0.4945
 epoch: 68, train_loss: 0.9501, test_loss: 0.9438, test_f1: 0.4907
 epoch: 69, train_loss: 0.9476, test_loss: 0.9477, test_f1: 0.4905
 epoch: 70, train_loss: 0.9319, test_loss: 0.9424, test_f1: 0.4907
 epoch: 71, train_loss: 0.9395, test_loss: 0.9428, test_f1: 0.4876
 epoch: 72, train_loss: 0.9358, test_loss: 0.9424, test_f1: 0.4929
 epoch: 73, train_loss: 0.9359, test_loss: 0.9388, test_f1: 0.4978
 epoch: 74, train_loss: 0.9413, test_loss: 0.9419, test_f1: 0.4939
 epoch: 75, train_loss: 0.9291, test_loss: 0.9382, test_f1: 0.4950
 epoch: 76, train_loss: 0.9407, test_loss: 0.9362, test_f1: 0.5011
 epoch: 77, train_loss: 0.9250, test_loss: 0.9370, test_f1: 0.4989
 epoch: 78, train_loss: 0.9301, test_loss: 0.9398, test_f1: 0.4958
 epoch: 79, train_loss: 0.9229, test_loss: 0.9374, test_f1: 0.4987
 epoch: 80, train_loss: 0.9311, test_loss: 0.9379, test_f1: 0.4982
 epoch: 81, train_loss: 0.9306, test_loss: 0.9401, test_f1: 0.4956
 epoch: 82, train_loss: 0.9240, test_loss: 0.9389, test_f1: 0.4980
 epoch: 83, train_loss: 0.9230, test_loss: 0.9400, test_f1: 0.4987
 epoch: 84, train_loss: 0.9255, test_loss: 0.9357, test_f1: 0.5044
 epoch: 85, train_loss: 0.9192, test_loss: 0.9395, test_f1: 0.5004
 epoch: 86, train_loss: 0.9200, test_loss: 0.9428, test_f1: 0.4967
 epoch: 87, train_loss: 0.9142, test_loss: 0.9394, test_f1: 0.4989
 epoch: 88, train_loss: 0.9112, test_loss: 0.9370, test_f1: 0.4989
 epoch: 89, train_loss: 0.9188, test_loss: 0.9398, test_f1: 0.5004
 epoch: 90, train_loss: 0.9160, test_loss: 0.9467, test_f1: 0.5005
 epoch: 91, train_loss: 0.9109, test_loss: 0.9455, test_f1: 0.5040
 epoch: 92, train_loss: 0.9155, test_loss: 0.9375, test_f1: 0.5104
 epoch: 93, train_loss: 0.9129, test_loss: 0.9367, test_f1: 0.5128
 epoch: 94, train_loss: 0.9094, test_loss: 0.9389, test_f1: 0.5051
 epoch: 95, train_loss: 0.9033, test_loss: 0.9389, test_f1: 0.5089
 epoch: 96, train_loss: 0.9173, test_loss: 0.9373, test_f1: 0.5057
 epoch: 97, train_loss: 0.9125, test_loss: 0.9427, test_f1: 0.5060
 epoch: 98, train_loss: 0.9035, test_loss: 0.9442, test_f1: 0.4985
 epoch: 99, train_loss: 0.9043, test_loss: 0.9450, test_f1: 0.5009
##################ITERATION #5 ****************************************
 epoch: 0, train_loss: 1.3081, test_loss: 1.3312, test_f1: 0.2270
 epoch: 1, train_loss: 1.2763, test_loss: 1.3312, test_f1: 0.2270
 epoch: 2, train_loss: 1.2666, test_loss: 1.3275, test_f1: 0.2270
 epoch: 3, train_loss: 1.2514, test_loss: 1.3256, test_f1: 0.2270
 epoch: 4, train_loss: 1.2369, test_loss: 1.3041, test_f1: 0.2526
 epoch: 5, train_loss: 1.2279, test_loss: 1.2411, test_f1: 0.2601
 epoch: 6, train_loss: 1.2201, test_loss: 1.1969, test_f1: 0.2901
 epoch: 7, train_loss: 1.2159, test_loss: 1.1790, test_f1: 0.3025
 epoch: 8, train_loss: 1.2031, test_loss: 1.1689, test_f1: 0.3110
 epoch: 9, train_loss: 1.1944, test_loss: 1.1600, test_f1: 0.3247
 epoch: 10, train_loss: 1.1877, test_loss: 1.1530, test_f1: 0.3430
 epoch: 11, train_loss: 1.1869, test_loss: 1.1439, test_f1: 0.3577
 epoch: 12, train_loss: 1.1719, test_loss: 1.1351, test_f1: 0.3681
 epoch: 13, train_loss: 1.1735, test_loss: 1.1295, test_f1: 0.3716
 epoch: 14, train_loss: 1.1584, test_loss: 1.1214, test_f1: 0.4084
 epoch: 15, train_loss: 1.1551, test_loss: 1.1109, test_f1: 0.4160
 epoch: 16, train_loss: 1.1477, test_loss: 1.1069, test_f1: 0.4221
 epoch: 17, train_loss: 1.1433, test_loss: 1.0999, test_f1: 0.4235
 epoch: 18, train_loss: 1.1382, test_loss: 1.0946, test_f1: 0.4384
 epoch: 19, train_loss: 1.1311, test_loss: 1.0879, test_f1: 0.4444
 epoch: 20, train_loss: 1.1261, test_loss: 1.0828, test_f1: 0.4527
 epoch: 21, train_loss: 1.1170, test_loss: 1.0736, test_f1: 0.4648
 epoch: 22, train_loss: 1.1107, test_loss: 1.0667, test_f1: 0.4614
 epoch: 23, train_loss: 1.1104, test_loss: 1.0622, test_f1: 0.4696
 epoch: 24, train_loss: 1.1026, test_loss: 1.0575, test_f1: 0.4590
 epoch: 25, train_loss: 1.1014, test_loss: 1.0550, test_f1: 0.4675
 epoch: 26, train_loss: 1.0972, test_loss: 1.0471, test_f1: 0.4689
 epoch: 27, train_loss: 1.0824, test_loss: 1.0435, test_f1: 0.4536
 epoch: 28, train_loss: 1.0810, test_loss: 1.0342, test_f1: 0.4741
 epoch: 29, train_loss: 1.0780, test_loss: 1.0293, test_f1: 0.4722
 epoch: 30, train_loss: 1.0727, test_loss: 1.0255, test_f1: 0.4616
 epoch: 31, train_loss: 1.0662, test_loss: 1.0205, test_f1: 0.4756
 epoch: 32, train_loss: 1.0650, test_loss: 1.0180, test_f1: 0.4641
 epoch: 33, train_loss: 1.0544, test_loss: 1.0144, test_f1: 0.4689
 epoch: 34, train_loss: 1.0481, test_loss: 1.0066, test_f1: 0.4774
 epoch: 35, train_loss: 1.0445, test_loss: 1.0040, test_f1: 0.4693
 epoch: 36, train_loss: 1.0373, test_loss: 1.0008, test_f1: 0.4734
 epoch: 37, train_loss: 1.0364, test_loss: 0.9967, test_f1: 0.4761
 epoch: 38, train_loss: 1.0328, test_loss: 0.9919, test_f1: 0.4788
 epoch: 39, train_loss: 1.0336, test_loss: 0.9920, test_f1: 0.4730
 epoch: 40, train_loss: 1.0277, test_loss: 0.9886, test_f1: 0.4779
 epoch: 41, train_loss: 1.0193, test_loss: 0.9836, test_f1: 0.4891
 epoch: 42, train_loss: 1.0216, test_loss: 0.9848, test_f1: 0.4782
 epoch: 43, train_loss: 1.0218, test_loss: 0.9785, test_f1: 0.4928
 epoch: 44, train_loss: 1.0080, test_loss: 0.9785, test_f1: 0.4840
 epoch: 45, train_loss: 1.0014, test_loss: 0.9787, test_f1: 0.4888
 epoch: 46, train_loss: 0.9988, test_loss: 0.9783, test_f1: 0.4728
 epoch: 47, train_loss: 0.9951, test_loss: 0.9747, test_f1: 0.4893
 epoch: 48, train_loss: 1.0022, test_loss: 0.9680, test_f1: 0.4873
 epoch: 49, train_loss: 0.9997, test_loss: 0.9690, test_f1: 0.4897
 epoch: 50, train_loss: 0.9875, test_loss: 0.9693, test_f1: 0.4919
 epoch: 51, train_loss: 0.9855, test_loss: 0.9711, test_f1: 0.4943
 epoch: 52, train_loss: 0.9846, test_loss: 0.9737, test_f1: 0.4832
 epoch: 53, train_loss: 0.9826, test_loss: 0.9650, test_f1: 0.4925
 epoch: 54, train_loss: 0.9828, test_loss: 0.9677, test_f1: 0.4901
 epoch: 55, train_loss: 0.9903, test_loss: 0.9660, test_f1: 0.4919
 epoch: 56, train_loss: 0.9659, test_loss: 0.9623, test_f1: 0.4959
 epoch: 57, train_loss: 0.9822, test_loss: 0.9627, test_f1: 0.4950
 epoch: 58, train_loss: 0.9764, test_loss: 0.9601, test_f1: 0.4911
 epoch: 59, train_loss: 0.9637, test_loss: 0.9608, test_f1: 0.4880
 epoch: 60, train_loss: 0.9759, test_loss: 0.9626, test_f1: 0.4942
 epoch: 61, train_loss: 0.9721, test_loss: 0.9618, test_f1: 0.4921
 epoch: 62, train_loss: 0.9666, test_loss: 0.9583, test_f1: 0.4925
 epoch: 63, train_loss: 0.9618, test_loss: 0.9553, test_f1: 0.4905
 epoch: 64, train_loss: 0.9611, test_loss: 0.9579, test_f1: 0.4884
 epoch: 65, train_loss: 0.9663, test_loss: 0.9585, test_f1: 0.4966
 epoch: 66, train_loss: 0.9655, test_loss: 0.9588, test_f1: 0.4900
 epoch: 67, train_loss: 0.9646, test_loss: 0.9532, test_f1: 0.4896
 epoch: 68, train_loss: 0.9576, test_loss: 0.9531, test_f1: 0.4935
 epoch: 69, train_loss: 0.9657, test_loss: 0.9591, test_f1: 0.4835
 epoch: 70, train_loss: 0.9583, test_loss: 0.9551, test_f1: 0.4969
 epoch: 71, train_loss: 0.9687, test_loss: 0.9499, test_f1: 0.4930
 epoch: 72, train_loss: 0.9572, test_loss: 0.9538, test_f1: 0.4903
 epoch: 73, train_loss: 0.9540, test_loss: 0.9505, test_f1: 0.4901
 epoch: 74, train_loss: 0.9567, test_loss: 0.9444, test_f1: 0.4950
 epoch: 75, train_loss: 0.9484, test_loss: 0.9480, test_f1: 0.4886
 epoch: 76, train_loss: 0.9452, test_loss: 0.9436, test_f1: 0.4905
 epoch: 77, train_loss: 0.9411, test_loss: 0.9497, test_f1: 0.4916
 epoch: 78, train_loss: 0.9502, test_loss: 0.9545, test_f1: 0.4957
 epoch: 79, train_loss: 0.9446, test_loss: 0.9521, test_f1: 0.4916
 epoch: 80, train_loss: 0.9457, test_loss: 0.9526, test_f1: 0.4912
 epoch: 81, train_loss: 0.9509, test_loss: 0.9518, test_f1: 0.4878
 epoch: 82, train_loss: 0.9478, test_loss: 0.9444, test_f1: 0.4947
 epoch: 83, train_loss: 0.9434, test_loss: 0.9461, test_f1: 0.4910
 epoch: 84, train_loss: 0.9384, test_loss: 0.9462, test_f1: 0.4880
 epoch: 85, train_loss: 0.9414, test_loss: 0.9451, test_f1: 0.4949
 epoch: 86, train_loss: 0.9418, test_loss: 0.9457, test_f1: 0.4925
 epoch: 87, train_loss: 0.9395, test_loss: 0.9509, test_f1: 0.4898
 epoch: 88, train_loss: 0.9375, test_loss: 0.9487, test_f1: 0.4913
 epoch: 89, train_loss: 0.9332, test_loss: 0.9490, test_f1: 0.4905
 epoch: 90, train_loss: 0.9376, test_loss: 0.9505, test_f1: 0.5000
 epoch: 91, train_loss: 0.9350, test_loss: 0.9516, test_f1: 0.5012
 epoch: 92, train_loss: 0.9340, test_loss: 0.9498, test_f1: 0.4912
 epoch: 93, train_loss: 0.9304, test_loss: 0.9496, test_f1: 0.4868
 epoch: 94, train_loss: 0.9380, test_loss: 0.9418, test_f1: 0.5026
 epoch: 95, train_loss: 0.9292, test_loss: 0.9487, test_f1: 0.5073
 epoch: 96, train_loss: 0.9352, test_loss: 0.9472, test_f1: 0.5044
 epoch: 97, train_loss: 0.9324, test_loss: 0.9530, test_f1: 0.5024
 epoch: 98, train_loss: 0.9310, test_loss: 0.9439, test_f1: 0.5069
 epoch: 99, train_loss: 0.9240, test_loss: 0.9485, test_f1: 0.4978
##################ITERATION #6 ****************************************
 epoch: 0, train_loss: 1.3244, test_loss: 1.3126, test_f1: 0.2270
 epoch: 1, train_loss: 1.2806, test_loss: 1.3127, test_f1: 0.2270
 epoch: 2, train_loss: 1.2666, test_loss: 1.2961, test_f1: 0.2270
 epoch: 3, train_loss: 1.2435, test_loss: 1.2660, test_f1: 0.2270
 epoch: 4, train_loss: 1.2333, test_loss: 1.2234, test_f1: 0.2671
 epoch: 5, train_loss: 1.2292, test_loss: 1.1937, test_f1: 0.2783
 epoch: 6, train_loss: 1.2158, test_loss: 1.1761, test_f1: 0.2904
 epoch: 7, train_loss: 1.2055, test_loss: 1.1658, test_f1: 0.3021
 epoch: 8, train_loss: 1.1949, test_loss: 1.1557, test_f1: 0.3190
 epoch: 9, train_loss: 1.1899, test_loss: 1.1478, test_f1: 0.3311
 epoch: 10, train_loss: 1.1835, test_loss: 1.1398, test_f1: 0.3421
 epoch: 11, train_loss: 1.1761, test_loss: 1.1321, test_f1: 0.3603
 epoch: 12, train_loss: 1.1677, test_loss: 1.1223, test_f1: 0.3660
 epoch: 13, train_loss: 1.1602, test_loss: 1.1152, test_f1: 0.3745
 epoch: 14, train_loss: 1.1490, test_loss: 1.1070, test_f1: 0.3815
 epoch: 15, train_loss: 1.1442, test_loss: 1.0979, test_f1: 0.3928
 epoch: 16, train_loss: 1.1417, test_loss: 1.0905, test_f1: 0.4127
 epoch: 17, train_loss: 1.1363, test_loss: 1.0838, test_f1: 0.4177
 epoch: 18, train_loss: 1.1255, test_loss: 1.0765, test_f1: 0.4269
 epoch: 19, train_loss: 1.1214, test_loss: 1.0715, test_f1: 0.4362
 epoch: 20, train_loss: 1.1257, test_loss: 1.0639, test_f1: 0.4444
 epoch: 21, train_loss: 1.1061, test_loss: 1.0576, test_f1: 0.4517
 epoch: 22, train_loss: 1.1068, test_loss: 1.0522, test_f1: 0.4577
 epoch: 23, train_loss: 1.1037, test_loss: 1.0457, test_f1: 0.4547
 epoch: 24, train_loss: 1.0907, test_loss: 1.0411, test_f1: 0.4508
 epoch: 25, train_loss: 1.0898, test_loss: 1.0366, test_f1: 0.4664
 epoch: 26, train_loss: 1.0786, test_loss: 1.0308, test_f1: 0.4642
 epoch: 27, train_loss: 1.0835, test_loss: 1.0229, test_f1: 0.4653
 epoch: 28, train_loss: 1.0813, test_loss: 1.0199, test_f1: 0.4645
 epoch: 29, train_loss: 1.0656, test_loss: 1.0170, test_f1: 0.4684
 epoch: 30, train_loss: 1.0600, test_loss: 1.0129, test_f1: 0.4698
 epoch: 31, train_loss: 1.0585, test_loss: 1.0094, test_f1: 0.4698
 epoch: 32, train_loss: 1.0503, test_loss: 1.0071, test_f1: 0.4611
 epoch: 33, train_loss: 1.0524, test_loss: 1.0034, test_f1: 0.4695
 epoch: 34, train_loss: 1.0479, test_loss: 0.9989, test_f1: 0.4682
 epoch: 35, train_loss: 1.0541, test_loss: 0.9969, test_f1: 0.4603
 epoch: 36, train_loss: 1.0389, test_loss: 0.9906, test_f1: 0.4693
 epoch: 37, train_loss: 1.0339, test_loss: 0.9876, test_f1: 0.4717
 epoch: 38, train_loss: 1.0369, test_loss: 0.9873, test_f1: 0.4647
 epoch: 39, train_loss: 1.0268, test_loss: 0.9867, test_f1: 0.4628
 epoch: 40, train_loss: 1.0250, test_loss: 0.9792, test_f1: 0.4665
 epoch: 41, train_loss: 1.0188, test_loss: 0.9762, test_f1: 0.4745
 epoch: 42, train_loss: 1.0128, test_loss: 0.9751, test_f1: 0.4628
 epoch: 43, train_loss: 1.0159, test_loss: 0.9715, test_f1: 0.4725
 epoch: 44, train_loss: 1.0050, test_loss: 0.9663, test_f1: 0.4865
 epoch: 45, train_loss: 1.0051, test_loss: 0.9640, test_f1: 0.4767
 epoch: 46, train_loss: 0.9956, test_loss: 0.9652, test_f1: 0.4735
 epoch: 47, train_loss: 0.9951, test_loss: 0.9628, test_f1: 0.4724
 epoch: 48, train_loss: 0.9914, test_loss: 0.9505, test_f1: 0.5045
 epoch: 49, train_loss: 0.9994, test_loss: 0.9502, test_f1: 0.5058
 epoch: 50, train_loss: 0.9891, test_loss: 0.9465, test_f1: 0.5095
 epoch: 51, train_loss: 0.9920, test_loss: 0.9453, test_f1: 0.5083
 epoch: 52, train_loss: 0.9781, test_loss: 0.9440, test_f1: 0.5083
 epoch: 53, train_loss: 0.9793, test_loss: 0.9455, test_f1: 0.5098
 epoch: 54, train_loss: 0.9825, test_loss: 0.9434, test_f1: 0.5119
 epoch: 55, train_loss: 0.9843, test_loss: 0.9432, test_f1: 0.5119
 epoch: 56, train_loss: 0.9765, test_loss: 0.9415, test_f1: 0.5120
 epoch: 57, train_loss: 0.9804, test_loss: 0.9418, test_f1: 0.5131
 epoch: 58, train_loss: 0.9792, test_loss: 0.9392, test_f1: 0.5138
 epoch: 59, train_loss: 0.9778, test_loss: 0.9393, test_f1: 0.5129
 epoch: 60, train_loss: 0.9810, test_loss: 0.9376, test_f1: 0.5152
 epoch: 61, train_loss: 0.9825, test_loss: 0.9384, test_f1: 0.5118
 epoch: 62, train_loss: 0.9747, test_loss: 0.9369, test_f1: 0.5067
 epoch: 63, train_loss: 0.9671, test_loss: 0.9354, test_f1: 0.5157
 epoch: 64, train_loss: 0.9666, test_loss: 0.9337, test_f1: 0.5150
 epoch: 65, train_loss: 0.9668, test_loss: 0.9324, test_f1: 0.5171
 epoch: 66, train_loss: 0.9638, test_loss: 0.9314, test_f1: 0.5152
 epoch: 67, train_loss: 0.9619, test_loss: 0.9303, test_f1: 0.5140
 epoch: 68, train_loss: 0.9616, test_loss: 0.9311, test_f1: 0.5116
 epoch: 69, train_loss: 0.9593, test_loss: 0.9313, test_f1: 0.5070
 epoch: 70, train_loss: 0.9686, test_loss: 0.9304, test_f1: 0.5083
 epoch: 71, train_loss: 0.9665, test_loss: 0.9296, test_f1: 0.5073
 epoch: 72, train_loss: 0.9596, test_loss: 0.9250, test_f1: 0.5206
 epoch: 73, train_loss: 0.9617, test_loss: 0.9237, test_f1: 0.5144
 epoch: 74, train_loss: 0.9629, test_loss: 0.9241, test_f1: 0.5137
 epoch: 75, train_loss: 0.9543, test_loss: 0.9248, test_f1: 0.5160
 epoch: 76, train_loss: 0.9639, test_loss: 0.9217, test_f1: 0.5223
 epoch: 77, train_loss: 0.9515, test_loss: 0.9206, test_f1: 0.5205
 epoch: 78, train_loss: 0.9551, test_loss: 0.9204, test_f1: 0.5244
 epoch: 79, train_loss: 0.9516, test_loss: 0.9173, test_f1: 0.5178
 epoch: 80, train_loss: 0.9444, test_loss: 0.9179, test_f1: 0.5222
 epoch: 81, train_loss: 0.9461, test_loss: 0.9138, test_f1: 0.5239
 epoch: 82, train_loss: 0.9449, test_loss: 0.9135, test_f1: 0.5228
 epoch: 83, train_loss: 0.9468, test_loss: 0.9129, test_f1: 0.5300
 epoch: 84, train_loss: 0.9504, test_loss: 0.9099, test_f1: 0.5265
 epoch: 85, train_loss: 0.9465, test_loss: 0.9122, test_f1: 0.5232
 epoch: 86, train_loss: 0.9454, test_loss: 0.9111, test_f1: 0.5291
 epoch: 87, train_loss: 0.9478, test_loss: 0.9134, test_f1: 0.5287
 epoch: 88, train_loss: 0.9386, test_loss: 0.9098, test_f1: 0.5257
 epoch: 89, train_loss: 0.9362, test_loss: 0.9096, test_f1: 0.5262
 epoch: 90, train_loss: 0.9484, test_loss: 0.9097, test_f1: 0.5294
 epoch: 91, train_loss: 0.9375, test_loss: 0.9069, test_f1: 0.5295
 epoch: 92, train_loss: 0.9412, test_loss: 0.9056, test_f1: 0.5258
 epoch: 93, train_loss: 0.9355, test_loss: 0.9073, test_f1: 0.5309
 epoch: 94, train_loss: 0.9423, test_loss: 0.9109, test_f1: 0.5193
 epoch: 95, train_loss: 0.9332, test_loss: 0.9103, test_f1: 0.5225
 epoch: 96, train_loss: 0.9284, test_loss: 0.9117, test_f1: 0.5134
 epoch: 97, train_loss: 0.9348, test_loss: 0.9064, test_f1: 0.5203
 epoch: 98, train_loss: 0.9304, test_loss: 0.9052, test_f1: 0.5306
 epoch: 99, train_loss: 0.9276, test_loss: 0.9055, test_f1: 0.5313
##################ITERATION #7 ****************************************
 epoch: 0, train_loss: 1.3621, test_loss: 1.3357, test_f1: 0.2270
 epoch: 1, train_loss: 1.3120, test_loss: 1.3195, test_f1: 0.2270
 epoch: 2, train_loss: 1.2804, test_loss: 1.3118, test_f1: 0.2270
 epoch: 3, train_loss: 1.2730, test_loss: 1.2845, test_f1: 0.2270
 epoch: 4, train_loss: 1.2520, test_loss: 1.2434, test_f1: 0.2270
 epoch: 5, train_loss: 1.2358, test_loss: 1.2190, test_f1: 0.2439
 epoch: 6, train_loss: 1.2285, test_loss: 1.2061, test_f1: 0.2646
 epoch: 7, train_loss: 1.2212, test_loss: 1.1953, test_f1: 0.2813
 epoch: 8, train_loss: 1.2113, test_loss: 1.1847, test_f1: 0.3174
 epoch: 9, train_loss: 1.1976, test_loss: 1.1757, test_f1: 0.3372
 epoch: 10, train_loss: 1.1917, test_loss: 1.1676, test_f1: 0.3513
 epoch: 11, train_loss: 1.1848, test_loss: 1.1564, test_f1: 0.3691
 epoch: 12, train_loss: 1.1810, test_loss: 1.1477, test_f1: 0.3820
 epoch: 13, train_loss: 1.1790, test_loss: 1.1389, test_f1: 0.4033
 epoch: 14, train_loss: 1.1610, test_loss: 1.1315, test_f1: 0.4129
 epoch: 15, train_loss: 1.1561, test_loss: 1.1236, test_f1: 0.4193
 epoch: 16, train_loss: 1.1485, test_loss: 1.1146, test_f1: 0.4268
 epoch: 17, train_loss: 1.1331, test_loss: 1.1051, test_f1: 0.4328
 epoch: 18, train_loss: 1.1270, test_loss: 1.0951, test_f1: 0.4370
 epoch: 19, train_loss: 1.1172, test_loss: 1.0874, test_f1: 0.4369
 epoch: 20, train_loss: 1.1145, test_loss: 1.0804, test_f1: 0.4404
 epoch: 21, train_loss: 1.1051, test_loss: 1.0728, test_f1: 0.4421
 epoch: 22, train_loss: 1.0972, test_loss: 1.0658, test_f1: 0.4522
 epoch: 23, train_loss: 1.0847, test_loss: 1.0579, test_f1: 0.4567
 epoch: 24, train_loss: 1.0868, test_loss: 1.0486, test_f1: 0.4603
 epoch: 25, train_loss: 1.0835, test_loss: 1.0418, test_f1: 0.4614
 epoch: 26, train_loss: 1.0738, test_loss: 1.0348, test_f1: 0.4667
 epoch: 27, train_loss: 1.0703, test_loss: 1.0299, test_f1: 0.4706
 epoch: 28, train_loss: 1.0604, test_loss: 1.0226, test_f1: 0.4709
 epoch: 29, train_loss: 1.0585, test_loss: 1.0169, test_f1: 0.4728
 epoch: 30, train_loss: 1.0494, test_loss: 1.0116, test_f1: 0.4745
 epoch: 31, train_loss: 1.0513, test_loss: 1.0086, test_f1: 0.4725
 epoch: 32, train_loss: 1.0403, test_loss: 1.0042, test_f1: 0.4736
 epoch: 33, train_loss: 1.0327, test_loss: 0.9984, test_f1: 0.4742
 epoch: 34, train_loss: 1.0271, test_loss: 0.9963, test_f1: 0.4760
 epoch: 35, train_loss: 1.0274, test_loss: 0.9924, test_f1: 0.4766
 epoch: 36, train_loss: 1.0154, test_loss: 0.9910, test_f1: 0.4772
 epoch: 37, train_loss: 1.0157, test_loss: 0.9896, test_f1: 0.4812
 epoch: 38, train_loss: 1.0101, test_loss: 0.9840, test_f1: 0.4803
 epoch: 39, train_loss: 1.0032, test_loss: 0.9776, test_f1: 0.4765
 epoch: 40, train_loss: 1.0075, test_loss: 0.9774, test_f1: 0.4765
 epoch: 41, train_loss: 0.9919, test_loss: 0.9804, test_f1: 0.4778
 epoch: 42, train_loss: 1.0019, test_loss: 0.9771, test_f1: 0.4801
 epoch: 43, train_loss: 0.9886, test_loss: 0.9755, test_f1: 0.4820
 epoch: 44, train_loss: 0.9853, test_loss: 0.9761, test_f1: 0.4820
 epoch: 45, train_loss: 0.9822, test_loss: 0.9733, test_f1: 0.4863
 epoch: 46, train_loss: 0.9821, test_loss: 0.9717, test_f1: 0.4819
 epoch: 47, train_loss: 0.9784, test_loss: 0.9714, test_f1: 0.4873
 epoch: 48, train_loss: 0.9735, test_loss: 0.9637, test_f1: 0.4862
 epoch: 49, train_loss: 0.9738, test_loss: 0.9599, test_f1: 0.4954
 epoch: 50, train_loss: 0.9658, test_loss: 0.9618, test_f1: 0.5060
 epoch: 51, train_loss: 0.9597, test_loss: 0.9605, test_f1: 0.5025
 epoch: 52, train_loss: 0.9709, test_loss: 0.9620, test_f1: 0.5012
 epoch: 53, train_loss: 0.9704, test_loss: 0.9660, test_f1: 0.5014
 epoch: 54, train_loss: 0.9619, test_loss: 0.9665, test_f1: 0.5028
 epoch: 55, train_loss: 0.9602, test_loss: 0.9673, test_f1: 0.4983
 epoch: 56, train_loss: 0.9553, test_loss: 0.9626, test_f1: 0.5004
 epoch: 57, train_loss: 0.9589, test_loss: 0.9597, test_f1: 0.4973
 epoch: 58, train_loss: 0.9493, test_loss: 0.9603, test_f1: 0.5028
 epoch: 59, train_loss: 0.9574, test_loss: 0.9629, test_f1: 0.5041
 epoch: 60, train_loss: 0.9584, test_loss: 0.9661, test_f1: 0.5033
 epoch: 61, train_loss: 0.9536, test_loss: 0.9638, test_f1: 0.5080
 epoch: 62, train_loss: 0.9545, test_loss: 0.9626, test_f1: 0.5062
 epoch: 63, train_loss: 0.9616, test_loss: 0.9598, test_f1: 0.5038
 epoch: 64, train_loss: 0.9575, test_loss: 0.9640, test_f1: 0.5018
 epoch: 65, train_loss: 0.9551, test_loss: 0.9678, test_f1: 0.4982
 epoch: 66, train_loss: 0.9504, test_loss: 0.9629, test_f1: 0.5073
 epoch: 67, train_loss: 0.9515, test_loss: 0.9601, test_f1: 0.5041
 epoch: 68, train_loss: 0.9463, test_loss: 0.9622, test_f1: 0.5062
 epoch: 69, train_loss: 0.9479, test_loss: 0.9644, test_f1: 0.5059
 epoch: 70, train_loss: 0.9409, test_loss: 0.9710, test_f1: 0.4998
 epoch: 71, train_loss: 0.9486, test_loss: 0.9644, test_f1: 0.5074
 epoch: 72, train_loss: 0.9407, test_loss: 0.9664, test_f1: 0.5012
 epoch: 73, train_loss: 0.9428, test_loss: 0.9675, test_f1: 0.4957
 epoch: 74, train_loss: 0.9434, test_loss: 0.9667, test_f1: 0.5072
 epoch: 75, train_loss: 0.9424, test_loss: 0.9596, test_f1: 0.5025
 epoch: 76, train_loss: 0.9348, test_loss: 0.9640, test_f1: 0.5024
 epoch: 77, train_loss: 0.9368, test_loss: 0.9680, test_f1: 0.4997
 epoch: 78, train_loss: 0.9327, test_loss: 0.9599, test_f1: 0.4959
 epoch: 79, train_loss: 0.9365, test_loss: 0.9592, test_f1: 0.4972
 epoch: 80, train_loss: 0.9319, test_loss: 0.9657, test_f1: 0.4986
 epoch: 81, train_loss: 0.9390, test_loss: 0.9663, test_f1: 0.4977
 epoch: 82, train_loss: 0.9369, test_loss: 0.9640, test_f1: 0.4973
 epoch: 83, train_loss: 0.9323, test_loss: 0.9644, test_f1: 0.4992
 epoch: 84, train_loss: 0.9322, test_loss: 0.9604, test_f1: 0.5028
 epoch: 85, train_loss: 0.9326, test_loss: 0.9576, test_f1: 0.5018
 epoch: 86, train_loss: 0.9328, test_loss: 0.9592, test_f1: 0.5007
 epoch: 87, train_loss: 0.9221, test_loss: 0.9659, test_f1: 0.4961
 epoch: 88, train_loss: 0.9195, test_loss: 0.9698, test_f1: 0.4992
 epoch: 89, train_loss: 0.9374, test_loss: 0.9706, test_f1: 0.5020
 epoch: 90, train_loss: 0.9311, test_loss: 0.9643, test_f1: 0.5059
 epoch: 91, train_loss: 0.9196, test_loss: 0.9622, test_f1: 0.5117
 epoch: 92, train_loss: 0.9302, test_loss: 0.9575, test_f1: 0.5057
 epoch: 93, train_loss: 0.9305, test_loss: 0.9701, test_f1: 0.5096
 epoch: 94, train_loss: 0.9245, test_loss: 0.9648, test_f1: 0.5027
 epoch: 95, train_loss: 0.9221, test_loss: 0.9687, test_f1: 0.5059
 epoch: 96, train_loss: 0.9189, test_loss: 0.9690, test_f1: 0.5116
 epoch: 97, train_loss: 0.9170, test_loss: 0.9656, test_f1: 0.5144
 epoch: 98, train_loss: 0.9129, test_loss: 0.9627, test_f1: 0.5146
 epoch: 99, train_loss: 0.9185, test_loss: 0.9624, test_f1: 0.5130
##################ITERATION #8 ****************************************
 epoch: 0, train_loss: 1.3431, test_loss: 1.3129, test_f1: 0.2270
 epoch: 1, train_loss: 1.2742, test_loss: 1.2963, test_f1: 0.2270
 epoch: 2, train_loss: 1.2497, test_loss: 1.2827, test_f1: 0.2270
 epoch: 3, train_loss: 1.2284, test_loss: 1.2528, test_f1: 0.2521
 epoch: 4, train_loss: 1.2198, test_loss: 1.2107, test_f1: 0.2610
 epoch: 5, train_loss: 1.2078, test_loss: 1.1708, test_f1: 0.3347
 epoch: 6, train_loss: 1.2023, test_loss: 1.1532, test_f1: 0.3512
 epoch: 7, train_loss: 1.1891, test_loss: 1.1385, test_f1: 0.3662
 epoch: 8, train_loss: 1.1768, test_loss: 1.1297, test_f1: 0.3876
 epoch: 9, train_loss: 1.1750, test_loss: 1.1209, test_f1: 0.3993
 epoch: 10, train_loss: 1.1613, test_loss: 1.1124, test_f1: 0.4154
 epoch: 11, train_loss: 1.1569, test_loss: 1.1053, test_f1: 0.4253
 epoch: 12, train_loss: 1.1492, test_loss: 1.0975, test_f1: 0.4290
 epoch: 13, train_loss: 1.1382, test_loss: 1.0926, test_f1: 0.4349
 epoch: 14, train_loss: 1.1322, test_loss: 1.0860, test_f1: 0.4363
 epoch: 15, train_loss: 1.1378, test_loss: 1.0794, test_f1: 0.4541
 epoch: 16, train_loss: 1.1261, test_loss: 1.0712, test_f1: 0.4516
 epoch: 17, train_loss: 1.1145, test_loss: 1.0657, test_f1: 0.4568
 epoch: 18, train_loss: 1.1080, test_loss: 1.0584, test_f1: 0.4561
 epoch: 19, train_loss: 1.0978, test_loss: 1.0525, test_f1: 0.4615
 epoch: 20, train_loss: 1.0999, test_loss: 1.0468, test_f1: 0.4619
 epoch: 21, train_loss: 1.0825, test_loss: 1.0395, test_f1: 0.4620
 epoch: 22, train_loss: 1.0873, test_loss: 1.0336, test_f1: 0.4744
 epoch: 23, train_loss: 1.0891, test_loss: 1.0294, test_f1: 0.4685
 epoch: 24, train_loss: 1.0752, test_loss: 1.0222, test_f1: 0.4746
 epoch: 25, train_loss: 1.0599, test_loss: 1.0157, test_f1: 0.4766
 epoch: 26, train_loss: 1.0647, test_loss: 1.0120, test_f1: 0.4755
 epoch: 27, train_loss: 1.0581, test_loss: 1.0072, test_f1: 0.4770
 epoch: 28, train_loss: 1.0525, test_loss: 1.0020, test_f1: 0.4796
 epoch: 29, train_loss: 1.0462, test_loss: 0.9975, test_f1: 0.4831
 epoch: 30, train_loss: 1.0410, test_loss: 0.9930, test_f1: 0.4854
 epoch: 31, train_loss: 1.0317, test_loss: 0.9898, test_f1: 0.4795
 epoch: 32, train_loss: 1.0359, test_loss: 0.9869, test_f1: 0.4818
 epoch: 33, train_loss: 1.0254, test_loss: 0.9815, test_f1: 0.4845
 epoch: 34, train_loss: 1.0217, test_loss: 0.9788, test_f1: 0.4870
 epoch: 35, train_loss: 1.0176, test_loss: 0.9747, test_f1: 0.4768
 epoch: 36, train_loss: 1.0097, test_loss: 0.9727, test_f1: 0.4751
 epoch: 37, train_loss: 1.0019, test_loss: 0.9730, test_f1: 0.4806
 epoch: 38, train_loss: 1.0028, test_loss: 0.9694, test_f1: 0.4815
 epoch: 39, train_loss: 1.0008, test_loss: 0.9651, test_f1: 0.4836
 epoch: 40, train_loss: 1.0010, test_loss: 0.9616, test_f1: 0.4864
 epoch: 41, train_loss: 0.9873, test_loss: 0.9616, test_f1: 0.4835
 epoch: 42, train_loss: 0.9886, test_loss: 0.9607, test_f1: 0.4832
 epoch: 43, train_loss: 0.9867, test_loss: 0.9627, test_f1: 0.4868
 epoch: 44, train_loss: 0.9886, test_loss: 0.9569, test_f1: 0.4822
 epoch: 45, train_loss: 0.9800, test_loss: 0.9564, test_f1: 0.4823
 epoch: 46, train_loss: 0.9879, test_loss: 0.9538, test_f1: 0.4864
 epoch: 47, train_loss: 0.9740, test_loss: 0.9546, test_f1: 0.4883
 epoch: 48, train_loss: 0.9696, test_loss: 0.9531, test_f1: 0.4951
 epoch: 49, train_loss: 0.9750, test_loss: 0.9544, test_f1: 0.4985
 epoch: 50, train_loss: 0.9641, test_loss: 0.9534, test_f1: 0.4927
 epoch: 51, train_loss: 0.9666, test_loss: 0.9548, test_f1: 0.4934
 epoch: 52, train_loss: 0.9631, test_loss: 0.9535, test_f1: 0.4990
 epoch: 53, train_loss: 0.9506, test_loss: 0.9534, test_f1: 0.4989
 epoch: 54, train_loss: 0.9607, test_loss: 0.9532, test_f1: 0.4962
 epoch: 55, train_loss: 0.9559, test_loss: 0.9514, test_f1: 0.5024
 epoch: 56, train_loss: 0.9564, test_loss: 0.9531, test_f1: 0.5022
 epoch: 57, train_loss: 0.9605, test_loss: 0.9536, test_f1: 0.5061
 epoch: 58, train_loss: 0.9530, test_loss: 0.9535, test_f1: 0.5025
 epoch: 59, train_loss: 0.9450, test_loss: 0.9536, test_f1: 0.5020
 epoch: 60, train_loss: 0.9489, test_loss: 0.9498, test_f1: 0.5048
 epoch: 61, train_loss: 0.9510, test_loss: 0.9468, test_f1: 0.5016
 epoch: 62, train_loss: 0.9428, test_loss: 0.9498, test_f1: 0.5015
 epoch: 63, train_loss: 0.9527, test_loss: 0.9507, test_f1: 0.5029
 epoch: 64, train_loss: 0.9444, test_loss: 0.9520, test_f1: 0.5014
 epoch: 65, train_loss: 0.9459, test_loss: 0.9500, test_f1: 0.4999
 epoch: 66, train_loss: 0.9427, test_loss: 0.9459, test_f1: 0.5023
 epoch: 67, train_loss: 0.9482, test_loss: 0.9444, test_f1: 0.5026
 epoch: 68, train_loss: 0.9425, test_loss: 0.9454, test_f1: 0.5039
 epoch: 69, train_loss: 0.9530, test_loss: 0.9464, test_f1: 0.5055
 epoch: 70, train_loss: 0.9379, test_loss: 0.9503, test_f1: 0.5058
 epoch: 71, train_loss: 0.9384, test_loss: 0.9493, test_f1: 0.5049
 epoch: 72, train_loss: 0.9424, test_loss: 0.9477, test_f1: 0.5078
 epoch: 73, train_loss: 0.9316, test_loss: 0.9538, test_f1: 0.5072
 epoch: 74, train_loss: 0.9305, test_loss: 0.9472, test_f1: 0.5097
 epoch: 75, train_loss: 0.9322, test_loss: 0.9461, test_f1: 0.5094
 epoch: 76, train_loss: 0.9270, test_loss: 0.9450, test_f1: 0.5077
 epoch: 77, train_loss: 0.9307, test_loss: 0.9507, test_f1: 0.5102
 epoch: 78, train_loss: 0.9322, test_loss: 0.9511, test_f1: 0.5111
 epoch: 79, train_loss: 0.9344, test_loss: 0.9543, test_f1: 0.5082
 epoch: 80, train_loss: 0.9315, test_loss: 0.9494, test_f1: 0.5122
 epoch: 81, train_loss: 0.9272, test_loss: 0.9450, test_f1: 0.5113
 epoch: 82, train_loss: 0.9329, test_loss: 0.9457, test_f1: 0.5099
 epoch: 83, train_loss: 0.9215, test_loss: 0.9490, test_f1: 0.5101
 epoch: 84, train_loss: 0.9250, test_loss: 0.9476, test_f1: 0.5084
 epoch: 85, train_loss: 0.9261, test_loss: 0.9493, test_f1: 0.5089
 epoch: 86, train_loss: 0.9189, test_loss: 0.9503, test_f1: 0.5097
 epoch: 87, train_loss: 0.9279, test_loss: 0.9475, test_f1: 0.5117
 epoch: 88, train_loss: 0.9211, test_loss: 0.9463, test_f1: 0.5149
 epoch: 89, train_loss: 0.9222, test_loss: 0.9481, test_f1: 0.5173
 epoch: 90, train_loss: 0.9173, test_loss: 0.9463, test_f1: 0.5130
 epoch: 91, train_loss: 0.9156, test_loss: 0.9443, test_f1: 0.5193
 epoch: 92, train_loss: 0.9187, test_loss: 0.9476, test_f1: 0.5164
 epoch: 93, train_loss: 0.9148, test_loss: 0.9468, test_f1: 0.5161
 epoch: 94, train_loss: 0.9247, test_loss: 0.9469, test_f1: 0.5107
 epoch: 95, train_loss: 0.9166, test_loss: 0.9486, test_f1: 0.5136
 epoch: 96, train_loss: 0.9169, test_loss: 0.9496, test_f1: 0.5117
 epoch: 97, train_loss: 0.9086, test_loss: 0.9458, test_f1: 0.5124
 epoch: 98, train_loss: 0.9113, test_loss: 0.9455, test_f1: 0.5129
 epoch: 99, train_loss: 0.9128, test_loss: 0.9482, test_f1: 0.5113
##################ITERATION #9 ****************************************
 epoch: 0, train_loss: 1.4077, test_loss: 1.3746, test_f1: 0.2270
 epoch: 1, train_loss: 1.3301, test_loss: 1.3610, test_f1: 0.2270
 epoch: 2, train_loss: 1.2866, test_loss: 1.3317, test_f1: 0.2270
 epoch: 3, train_loss: 1.2644, test_loss: 1.2717, test_f1: 0.2538
 epoch: 4, train_loss: 1.2507, test_loss: 1.2199, test_f1: 0.3238
 epoch: 5, train_loss: 1.2324, test_loss: 1.1919, test_f1: 0.3409
 epoch: 6, train_loss: 1.2191, test_loss: 1.1756, test_f1: 0.3491
 epoch: 7, train_loss: 1.2071, test_loss: 1.1655, test_f1: 0.3572
 epoch: 8, train_loss: 1.1932, test_loss: 1.1547, test_f1: 0.3655
 epoch: 9, train_loss: 1.1871, test_loss: 1.1450, test_f1: 0.3655
 epoch: 10, train_loss: 1.1763, test_loss: 1.1353, test_f1: 0.3775
 epoch: 11, train_loss: 1.1658, test_loss: 1.1258, test_f1: 0.3899
 epoch: 12, train_loss: 1.1553, test_loss: 1.1145, test_f1: 0.4020
 epoch: 13, train_loss: 1.1552, test_loss: 1.1037, test_f1: 0.4247
 epoch: 14, train_loss: 1.1452, test_loss: 1.0964, test_f1: 0.4261
 epoch: 15, train_loss: 1.1330, test_loss: 1.0866, test_f1: 0.4304
 epoch: 16, train_loss: 1.1248, test_loss: 1.0791, test_f1: 0.4346
 epoch: 17, train_loss: 1.1134, test_loss: 1.0696, test_f1: 0.4339
 epoch: 18, train_loss: 1.1101, test_loss: 1.0626, test_f1: 0.4406
 epoch: 19, train_loss: 1.1039, test_loss: 1.0552, test_f1: 0.4447
 epoch: 20, train_loss: 1.0952, test_loss: 1.0488, test_f1: 0.4486
 epoch: 21, train_loss: 1.0927, test_loss: 1.0412, test_f1: 0.4473
 epoch: 22, train_loss: 1.0789, test_loss: 1.0361, test_f1: 0.4522
 epoch: 23, train_loss: 1.0757, test_loss: 1.0318, test_f1: 0.4532
 epoch: 24, train_loss: 1.0642, test_loss: 1.0267, test_f1: 0.4429
 epoch: 25, train_loss: 1.0640, test_loss: 1.0196, test_f1: 0.4672
 epoch: 26, train_loss: 1.0598, test_loss: 1.0190, test_f1: 0.4595
 epoch: 27, train_loss: 1.0559, test_loss: 1.0136, test_f1: 0.4602
 epoch: 28, train_loss: 1.0540, test_loss: 1.0083, test_f1: 0.4620
 epoch: 29, train_loss: 1.0372, test_loss: 1.0056, test_f1: 0.4682
 epoch: 30, train_loss: 1.0299, test_loss: 1.0024, test_f1: 0.4805
 epoch: 31, train_loss: 1.0293, test_loss: 0.9980, test_f1: 0.4827
 epoch: 32, train_loss: 1.0257, test_loss: 0.9953, test_f1: 0.4706
 epoch: 33, train_loss: 1.0304, test_loss: 0.9923, test_f1: 0.4861
 epoch: 34, train_loss: 1.0158, test_loss: 0.9921, test_f1: 0.4842
 epoch: 35, train_loss: 1.0130, test_loss: 0.9852, test_f1: 0.4867
 epoch: 36, train_loss: 1.0086, test_loss: 0.9855, test_f1: 0.4927
 epoch: 37, train_loss: 1.0073, test_loss: 0.9823, test_f1: 0.4846
 epoch: 38, train_loss: 1.0075, test_loss: 0.9779, test_f1: 0.4943
 epoch: 39, train_loss: 1.0022, test_loss: 0.9779, test_f1: 0.4920
 epoch: 40, train_loss: 0.9979, test_loss: 0.9748, test_f1: 0.4974
 epoch: 41, train_loss: 0.9933, test_loss: 0.9736, test_f1: 0.4941
 epoch: 42, train_loss: 0.9872, test_loss: 0.9694, test_f1: 0.4860
 epoch: 43, train_loss: 0.9915, test_loss: 0.9674, test_f1: 0.4881
 epoch: 44, train_loss: 0.9859, test_loss: 0.9691, test_f1: 0.4977
 epoch: 45, train_loss: 0.9746, test_loss: 0.9670, test_f1: 0.4974
 epoch: 46, train_loss: 0.9878, test_loss: 0.9695, test_f1: 0.5007
 epoch: 47, train_loss: 0.9708, test_loss: 0.9688, test_f1: 0.5024
 epoch: 48, train_loss: 0.9734, test_loss: 0.9678, test_f1: 0.4942
 epoch: 49, train_loss: 0.9704, test_loss: 0.9653, test_f1: 0.4900
 epoch: 50, train_loss: 0.9590, test_loss: 0.9646, test_f1: 0.4986
 epoch: 51, train_loss: 0.9637, test_loss: 0.9633, test_f1: 0.4999
 epoch: 52, train_loss: 0.9644, test_loss: 0.9616, test_f1: 0.4869
 epoch: 53, train_loss: 0.9596, test_loss: 0.9602, test_f1: 0.4947
 epoch: 54, train_loss: 0.9587, test_loss: 0.9599, test_f1: 0.4918
 epoch: 55, train_loss: 0.9567, test_loss: 0.9593, test_f1: 0.4940
 epoch: 56, train_loss: 0.9566, test_loss: 0.9587, test_f1: 0.4969
 epoch: 57, train_loss: 0.9494, test_loss: 0.9560, test_f1: 0.4992
 epoch: 58, train_loss: 0.9512, test_loss: 0.9557, test_f1: 0.5000
 epoch: 59, train_loss: 0.9452, test_loss: 0.9580, test_f1: 0.4954
 epoch: 60, train_loss: 0.9448, test_loss: 0.9539, test_f1: 0.4984
 epoch: 61, train_loss: 0.9453, test_loss: 0.9525, test_f1: 0.5050
 epoch: 62, train_loss: 0.9530, test_loss: 0.9521, test_f1: 0.5085
 epoch: 63, train_loss: 0.9492, test_loss: 0.9494, test_f1: 0.5061
 epoch: 64, train_loss: 0.9445, test_loss: 0.9519, test_f1: 0.5010
 epoch: 65, train_loss: 0.9428, test_loss: 0.9532, test_f1: 0.4963
 epoch: 66, train_loss: 0.9352, test_loss: 0.9525, test_f1: 0.4861
 epoch: 67, train_loss: 0.9408, test_loss: 0.9491, test_f1: 0.4956
 epoch: 68, train_loss: 0.9347, test_loss: 0.9484, test_f1: 0.4974
 epoch: 69, train_loss: 0.9372, test_loss: 0.9485, test_f1: 0.4936
 epoch: 70, train_loss: 0.9390, test_loss: 0.9495, test_f1: 0.4982
 epoch: 71, train_loss: 0.9335, test_loss: 0.9477, test_f1: 0.4909
 epoch: 72, train_loss: 0.9306, test_loss: 0.9475, test_f1: 0.4908
 epoch: 73, train_loss: 0.9366, test_loss: 0.9471, test_f1: 0.4936
 epoch: 74, train_loss: 0.9294, test_loss: 0.9452, test_f1: 0.4910
 epoch: 75, train_loss: 0.9316, test_loss: 0.9485, test_f1: 0.4917
 epoch: 76, train_loss: 0.9338, test_loss: 0.9489, test_f1: 0.4951
 epoch: 77, train_loss: 0.9226, test_loss: 0.9495, test_f1: 0.4949
 epoch: 78, train_loss: 0.9343, test_loss: 0.9451, test_f1: 0.4949
 epoch: 79, train_loss: 0.9222, test_loss: 0.9458, test_f1: 0.4939
 epoch: 80, train_loss: 0.9233, test_loss: 0.9452, test_f1: 0.5029
 epoch: 81, train_loss: 0.9168, test_loss: 0.9423, test_f1: 0.5116
 epoch: 82, train_loss: 0.9226, test_loss: 0.9425, test_f1: 0.4929
 epoch: 83, train_loss: 0.9220, test_loss: 0.9442, test_f1: 0.4891
 epoch: 84, train_loss: 0.9207, test_loss: 0.9401, test_f1: 0.4913
 epoch: 85, train_loss: 0.9215, test_loss: 0.9421, test_f1: 0.4913
 epoch: 86, train_loss: 0.9196, test_loss: 0.9410, test_f1: 0.4925
 epoch: 87, train_loss: 0.9212, test_loss: 0.9400, test_f1: 0.4936
 epoch: 88, train_loss: 0.9178, test_loss: 0.9392, test_f1: 0.4816
 epoch: 89, train_loss: 0.9103, test_loss: 0.9370, test_f1: 0.4942
 epoch: 90, train_loss: 0.9139, test_loss: 0.9377, test_f1: 0.5069
 epoch: 91, train_loss: 0.9114, test_loss: 0.9371, test_f1: 0.4880
 epoch: 92, train_loss: 0.9046, test_loss: 0.9353, test_f1: 0.4907
 epoch: 93, train_loss: 0.9127, test_loss: 0.9368, test_f1: 0.4934
 epoch: 94, train_loss: 0.9041, test_loss: 0.9367, test_f1: 0.4882
 epoch: 95, train_loss: 0.9037, test_loss: 0.9394, test_f1: 0.4831
 epoch: 96, train_loss: 0.9196, test_loss: 0.9370, test_f1: 0.4834
 epoch: 97, train_loss: 0.9044, test_loss: 0.9379, test_f1: 0.4973
 epoch: 98, train_loss: 0.9072, test_loss: 0.9409, test_f1: 0.5121
 epoch: 99, train_loss: 0.9065, test_loss: 0.9377, test_f1: 0.5071

Training completed in 401.01 seconds
Best F1: 0.5313 at epoch 99
Mean F1 across iterations: 0.5120  0.0097
========================FINAL RESULTS================================
FEGIN weighted F1: 0.5313  0.0097
python main.py --data ltspice_examples --representation component_net --model FEGIN --layers 4 --hiddens 32 --batch_size 256 --lr 0.0001 --emb_size 128 --epochs 100 --save_appendix component_net_L4_H32_BS256_LR0.0001_E128 --no_val
-----



STDERR:
  File "main.py", line 370, in <module>
    main()
  File "main.py", line 254, in main
    dataset = dataset_class(
  File "/home/philip/projects/ltspice_examples_code_repo/Circuit-Completion-Using-GNNs/component_classification_with_link_prediction_head/evaluation/FEGIN/kernel/circuit_datasets.py", line 15, in __init__
    self.data, self.slices = torch.load(self.processed_paths[0])
  File "/home/philip/.local/lib/python3.8/site-packages/torch/serialization.py", line 1040, in load
    warnings.warn(
  File "/usr/lib/python3.8/warnings.py", line 109, in _showwarnmsg
    sw(msg.message, msg.category, msg.filename, msg.lineno,
  File "main.py", line 47, in warn_with_traceback
    traceback.print_stack(file=log)
/home/philip/projects/ltspice_examples_code_repo/Circuit-Completion-Using-GNNs/component_classification_with_link_prediction_head/evaluation/FEGIN/kernel/circuit_datasets.py:15: FutureWarning: You are using `torch.load` with `weights_only=False` (the current default value), which uses the default pickle module implicitly. It is possible to construct malicious pickle data which will execute arbitrary code during unpickling (See https://github.com/pytorch/pytorch/blob/main/SECURITY.md#untrusted-models for more details). In a future release, the default value for `weights_only` will be flipped to `True`. This limits the functions that could be executed during unpickling. Arbitrary objects will no longer be allowed to be loaded via this mode unless they are explicitly allowlisted by the user via `torch.serialization.add_safe_globals`. We recommend you start setting `weights_only=True` for any use case where you don't have full control of the loaded file. Please open an issue on GitHub for any issues related to this experimental feature.
  self.data, self.slices = torch.load(self.processed_paths[0])
