STDOUT:
Results will be saved in /home/philip/projects/ltspice_examples_code_repo/Circuit-Completion-Using-GNNs/component_classification_with_link_prediction_head/evaluation/FEGIN/results/model_FEGIN_dataset_ltspice_demos
Command line input: python main.py --data ltspice_demos --representation component_net --model FEGIN --layers 5 --hiddens 64 --batch_size 128 --lr 0.0001 --emb_size 512 --epochs 100 --save_appendix component_net_L5_H64_BS128_LR0.0001_E512 --no_val
 is saved.
-----
ltspice_demos - FEGIN
Using 5 layers, 64 hidden units, h = 2
Loading component_net representation dataset
ENTERED
Training FEGIN on component_net representation
Train: 1565, Test: 383
##################ITERATION #0 ****************************************
 epoch: 0, train_loss: 1.3944, test_loss: 1.3975, test_f1: 0.1365
 epoch: 1, train_loss: 1.3826, test_loss: 1.3923, test_f1: 0.1365
 epoch: 2, train_loss: 1.3729, test_loss: 1.3846, test_f1: 0.1365
 epoch: 3, train_loss: 1.3638, test_loss: 1.3792, test_f1: 0.1423
 epoch: 4, train_loss: 1.3526, test_loss: 1.3718, test_f1: 0.1981
 epoch: 5, train_loss: 1.3397, test_loss: 1.3592, test_f1: 0.2193
 epoch: 6, train_loss: 1.3257, test_loss: 1.3425, test_f1: 0.2783
 epoch: 7, train_loss: 1.3101, test_loss: 1.3246, test_f1: 0.3090
 epoch: 8, train_loss: 1.2907, test_loss: 1.3099, test_f1: 0.2793
 epoch: 9, train_loss: 1.2718, test_loss: 1.2945, test_f1: 0.2789
 epoch: 10, train_loss: 1.2499, test_loss: 1.2777, test_f1: 0.2799
 epoch: 11, train_loss: 1.2337, test_loss: 1.2653, test_f1: 0.2799
 epoch: 12, train_loss: 1.2153, test_loss: 1.2533, test_f1: 0.2813
 epoch: 13, train_loss: 1.1944, test_loss: 1.2416, test_f1: 0.2807
 epoch: 14, train_loss: 1.1830, test_loss: 1.2304, test_f1: 0.2843
 epoch: 15, train_loss: 1.1738, test_loss: 1.2229, test_f1: 0.2806
 epoch: 16, train_loss: 1.1707, test_loss: 1.2158, test_f1: 0.2839
 epoch: 17, train_loss: 1.1581, test_loss: 1.2082, test_f1: 0.2905
 epoch: 18, train_loss: 1.1531, test_loss: 1.2001, test_f1: 0.2833
 epoch: 19, train_loss: 1.1435, test_loss: 1.1923, test_f1: 0.2983
 epoch: 20, train_loss: 1.1363, test_loss: 1.1886, test_f1: 0.2994
 epoch: 21, train_loss: 1.1285, test_loss: 1.1804, test_f1: 0.3027
 epoch: 22, train_loss: 1.1226, test_loss: 1.1756, test_f1: 0.3210
 epoch: 23, train_loss: 1.1155, test_loss: 1.1725, test_f1: 0.3238
 epoch: 24, train_loss: 1.1147, test_loss: 1.1659, test_f1: 0.3576
 epoch: 25, train_loss: 1.1070, test_loss: 1.1614, test_f1: 0.3576
 epoch: 26, train_loss: 1.1063, test_loss: 1.1565, test_f1: 0.3492
 epoch: 27, train_loss: 1.0956, test_loss: 1.1533, test_f1: 0.3507
 epoch: 28, train_loss: 1.1008, test_loss: 1.1503, test_f1: 0.3622
 epoch: 29, train_loss: 1.0937, test_loss: 1.1430, test_f1: 0.3868
 epoch: 30, train_loss: 1.0863, test_loss: 1.1372, test_f1: 0.3980
 epoch: 31, train_loss: 1.0829, test_loss: 1.1357, test_f1: 0.4014
 epoch: 32, train_loss: 1.0775, test_loss: 1.1309, test_f1: 0.3986
 epoch: 33, train_loss: 1.0712, test_loss: 1.1263, test_f1: 0.4062
 epoch: 34, train_loss: 1.0649, test_loss: 1.1227, test_f1: 0.4527
 epoch: 35, train_loss: 1.0631, test_loss: 1.1212, test_f1: 0.4701
 epoch: 36, train_loss: 1.0632, test_loss: 1.1189, test_f1: 0.4602
 epoch: 37, train_loss: 1.0483, test_loss: 1.1115, test_f1: 0.4906
 epoch: 38, train_loss: 1.0446, test_loss: 1.1081, test_f1: 0.4767
 epoch: 39, train_loss: 1.0437, test_loss: 1.1046, test_f1: 0.4661
 epoch: 40, train_loss: 1.0372, test_loss: 1.1021, test_f1: 0.4747
 epoch: 41, train_loss: 1.0319, test_loss: 1.0995, test_f1: 0.4644
 epoch: 42, train_loss: 1.0244, test_loss: 1.0959, test_f1: 0.4762
 epoch: 43, train_loss: 1.0283, test_loss: 1.0874, test_f1: 0.4647
 epoch: 44, train_loss: 1.0162, test_loss: 1.0836, test_f1: 0.4808
 epoch: 45, train_loss: 1.0082, test_loss: 1.0854, test_f1: 0.4812
 epoch: 46, train_loss: 1.0079, test_loss: 1.0872, test_f1: 0.4761
 epoch: 47, train_loss: 1.0023, test_loss: 1.0854, test_f1: 0.4817
 epoch: 48, train_loss: 0.9916, test_loss: 1.0749, test_f1: 0.5232
 epoch: 49, train_loss: 0.9913, test_loss: 1.0764, test_f1: 0.5153
 epoch: 50, train_loss: 0.9853, test_loss: 1.0654, test_f1: 0.5078
 epoch: 51, train_loss: 0.9787, test_loss: 1.0594, test_f1: 0.5106
 epoch: 52, train_loss: 0.9768, test_loss: 1.0573, test_f1: 0.5101
 epoch: 53, train_loss: 0.9675, test_loss: 1.0614, test_f1: 0.5117
 epoch: 54, train_loss: 0.9696, test_loss: 1.0566, test_f1: 0.5076
 epoch: 55, train_loss: 0.9636, test_loss: 1.0522, test_f1: 0.5082
 epoch: 56, train_loss: 0.9585, test_loss: 1.0491, test_f1: 0.5106
 epoch: 57, train_loss: 0.9586, test_loss: 1.0443, test_f1: 0.5151
 epoch: 58, train_loss: 0.9568, test_loss: 1.0459, test_f1: 0.5131
 epoch: 59, train_loss: 0.9472, test_loss: 1.0400, test_f1: 0.5227
 epoch: 60, train_loss: 0.9444, test_loss: 1.0341, test_f1: 0.5124
 epoch: 61, train_loss: 0.9452, test_loss: 1.0360, test_f1: 0.5188
 epoch: 62, train_loss: 0.9428, test_loss: 1.0360, test_f1: 0.5214
 epoch: 63, train_loss: 0.9443, test_loss: 1.0389, test_f1: 0.5281
 epoch: 64, train_loss: 0.9382, test_loss: 1.0335, test_f1: 0.5203
 epoch: 65, train_loss: 0.9309, test_loss: 1.0295, test_f1: 0.5264
 epoch: 66, train_loss: 0.9280, test_loss: 1.0326, test_f1: 0.5211
 epoch: 67, train_loss: 0.9183, test_loss: 1.0321, test_f1: 0.5245
 epoch: 68, train_loss: 0.9224, test_loss: 1.0315, test_f1: 0.5241
 epoch: 69, train_loss: 0.9166, test_loss: 1.0217, test_f1: 0.5208
 epoch: 70, train_loss: 0.9232, test_loss: 1.0247, test_f1: 0.5353
 epoch: 71, train_loss: 0.9160, test_loss: 1.0262, test_f1: 0.5382
 epoch: 72, train_loss: 0.9122, test_loss: 1.0178, test_f1: 0.5326
 epoch: 73, train_loss: 0.9139, test_loss: 1.0265, test_f1: 0.5160
 epoch: 74, train_loss: 0.9094, test_loss: 1.0133, test_f1: 0.5318
 epoch: 75, train_loss: 0.9084, test_loss: 1.0243, test_f1: 0.5318
 epoch: 76, train_loss: 0.9033, test_loss: 1.0284, test_f1: 0.5409
 epoch: 77, train_loss: 0.9106, test_loss: 1.0230, test_f1: 0.5198
 epoch: 78, train_loss: 0.9038, test_loss: 1.0341, test_f1: 0.5287
 epoch: 79, train_loss: 0.9033, test_loss: 1.0367, test_f1: 0.5502
 epoch: 80, train_loss: 0.9017, test_loss: 1.0150, test_f1: 0.5289
 epoch: 81, train_loss: 0.8881, test_loss: 1.0255, test_f1: 0.5409
 epoch: 82, train_loss: 0.8808, test_loss: 1.0155, test_f1: 0.5482
 epoch: 83, train_loss: 0.8820, test_loss: 1.0153, test_f1: 0.5404
 epoch: 84, train_loss: 0.8842, test_loss: 1.0100, test_f1: 0.5308
 epoch: 85, train_loss: 0.8746, test_loss: 1.0160, test_f1: 0.5309
 epoch: 86, train_loss: 0.8787, test_loss: 1.0145, test_f1: 0.5422
 epoch: 87, train_loss: 0.8732, test_loss: 1.0268, test_f1: 0.5373
 epoch: 88, train_loss: 0.8681, test_loss: 1.0111, test_f1: 0.5378
 epoch: 89, train_loss: 0.8681, test_loss: 1.0254, test_f1: 0.5482
 epoch: 90, train_loss: 0.8766, test_loss: 1.0089, test_f1: 0.5350
 epoch: 91, train_loss: 0.8812, test_loss: 1.0130, test_f1: 0.5303
 epoch: 92, train_loss: 0.8746, test_loss: 1.0161, test_f1: 0.5381
 epoch: 93, train_loss: 0.8782, test_loss: 1.0114, test_f1: 0.5466
 epoch: 94, train_loss: 0.8644, test_loss: 1.0177, test_f1: 0.5455
 epoch: 95, train_loss: 0.8644, test_loss: 1.0127, test_f1: 0.5411
 epoch: 96, train_loss: 0.8639, test_loss: 1.0194, test_f1: 0.5432
 epoch: 97, train_loss: 0.8563, test_loss: 1.0162, test_f1: 0.5313
 epoch: 98, train_loss: 0.8510, test_loss: 1.0254, test_f1: 0.5287
 epoch: 99, train_loss: 0.8551, test_loss: 1.0264, test_f1: 0.5391
##################ITERATION #1 ****************************************
 epoch: 0, train_loss: 1.3281, test_loss: 1.3664, test_f1: 0.1365
 epoch: 1, train_loss: 1.2918, test_loss: 1.3620, test_f1: 0.1365
 epoch: 2, train_loss: 1.2701, test_loss: 1.3554, test_f1: 0.1529
 epoch: 3, train_loss: 1.2489, test_loss: 1.3385, test_f1: 0.2188
 epoch: 4, train_loss: 1.2284, test_loss: 1.2976, test_f1: 0.3197
 epoch: 5, train_loss: 1.2105, test_loss: 1.2633, test_f1: 0.3126
 epoch: 6, train_loss: 1.1976, test_loss: 1.2442, test_f1: 0.3271
 epoch: 7, train_loss: 1.1828, test_loss: 1.2315, test_f1: 0.3296
 epoch: 8, train_loss: 1.1684, test_loss: 1.2200, test_f1: 0.3063
 epoch: 9, train_loss: 1.1531, test_loss: 1.2117, test_f1: 0.3214
 epoch: 10, train_loss: 1.1440, test_loss: 1.2048, test_f1: 0.3017
 epoch: 11, train_loss: 1.1333, test_loss: 1.1988, test_f1: 0.2720
 epoch: 12, train_loss: 1.1250, test_loss: 1.1928, test_f1: 0.2870
 epoch: 13, train_loss: 1.1172, test_loss: 1.1850, test_f1: 0.3005
 epoch: 14, train_loss: 1.1087, test_loss: 1.1883, test_f1: 0.3218
 epoch: 15, train_loss: 1.0965, test_loss: 1.1798, test_f1: 0.3073
 epoch: 16, train_loss: 1.0940, test_loss: 1.1731, test_f1: 0.3373
 epoch: 17, train_loss: 1.0800, test_loss: 1.1741, test_f1: 0.3375
 epoch: 18, train_loss: 1.0739, test_loss: 1.1674, test_f1: 0.3398
 epoch: 19, train_loss: 1.0650, test_loss: 1.1589, test_f1: 0.3798
 epoch: 20, train_loss: 1.0605, test_loss: 1.1623, test_f1: 0.3893
 epoch: 21, train_loss: 1.0552, test_loss: 1.1594, test_f1: 0.4124
 epoch: 22, train_loss: 1.0413, test_loss: 1.1591, test_f1: 0.4284
 epoch: 23, train_loss: 1.0368, test_loss: 1.1560, test_f1: 0.4408
 epoch: 24, train_loss: 1.0333, test_loss: 1.1365, test_f1: 0.4542
 epoch: 25, train_loss: 1.0296, test_loss: 1.1399, test_f1: 0.4635
 epoch: 26, train_loss: 1.0162, test_loss: 1.1548, test_f1: 0.4610
 epoch: 27, train_loss: 1.0096, test_loss: 1.1686, test_f1: 0.4686
 epoch: 28, train_loss: 0.9996, test_loss: 1.1354, test_f1: 0.4683
 epoch: 29, train_loss: 0.9947, test_loss: 1.1340, test_f1: 0.4878
 epoch: 30, train_loss: 0.9971, test_loss: 1.1091, test_f1: 0.4878
 epoch: 31, train_loss: 0.9931, test_loss: 1.1255, test_f1: 0.4892
 epoch: 32, train_loss: 0.9727, test_loss: 1.1142, test_f1: 0.4906
 epoch: 33, train_loss: 0.9662, test_loss: 1.1163, test_f1: 0.5088
 epoch: 34, train_loss: 0.9573, test_loss: 1.1009, test_f1: 0.4974
 epoch: 35, train_loss: 0.9536, test_loss: 1.1101, test_f1: 0.5099
 epoch: 36, train_loss: 0.9474, test_loss: 1.1029, test_f1: 0.5112
 epoch: 37, train_loss: 0.9499, test_loss: 1.1022, test_f1: 0.5150
 epoch: 38, train_loss: 0.9423, test_loss: 1.0921, test_f1: 0.5083
 epoch: 39, train_loss: 0.9231, test_loss: 1.0862, test_f1: 0.5045
 epoch: 40, train_loss: 0.9304, test_loss: 1.0941, test_f1: 0.5208
 epoch: 41, train_loss: 0.9252, test_loss: 1.1238, test_f1: 0.5092
 epoch: 42, train_loss: 0.9219, test_loss: 1.0942, test_f1: 0.5046
 epoch: 43, train_loss: 0.9072, test_loss: 1.0666, test_f1: 0.5192
 epoch: 44, train_loss: 0.9053, test_loss: 1.1079, test_f1: 0.5220
 epoch: 45, train_loss: 0.9152, test_loss: 1.0995, test_f1: 0.5276
 epoch: 46, train_loss: 0.8915, test_loss: 1.0861, test_f1: 0.5353
 epoch: 47, train_loss: 0.8867, test_loss: 1.0947, test_f1: 0.5315
 epoch: 48, train_loss: 0.8813, test_loss: 1.0964, test_f1: 0.5413
 epoch: 49, train_loss: 0.8817, test_loss: 1.0942, test_f1: 0.5308
 epoch: 50, train_loss: 0.8786, test_loss: 1.0965, test_f1: 0.5376
 epoch: 51, train_loss: 0.8744, test_loss: 1.0858, test_f1: 0.5343
 epoch: 52, train_loss: 0.8751, test_loss: 1.1214, test_f1: 0.5426
 epoch: 53, train_loss: 0.8677, test_loss: 1.0990, test_f1: 0.5439
 epoch: 54, train_loss: 0.8670, test_loss: 1.0870, test_f1: 0.5618
 epoch: 55, train_loss: 0.8596, test_loss: 1.0706, test_f1: 0.5445
 epoch: 56, train_loss: 0.8602, test_loss: 1.0546, test_f1: 0.5598
 epoch: 57, train_loss: 0.8553, test_loss: 1.0782, test_f1: 0.5576
 epoch: 58, train_loss: 0.8481, test_loss: 1.0903, test_f1: 0.5433
 epoch: 59, train_loss: 0.8545, test_loss: 1.0948, test_f1: 0.5493
 epoch: 60, train_loss: 0.8438, test_loss: 1.1025, test_f1: 0.5410
 epoch: 61, train_loss: 0.8542, test_loss: 1.0948, test_f1: 0.5660
 epoch: 62, train_loss: 0.8538, test_loss: 1.1266, test_f1: 0.5413
 epoch: 63, train_loss: 0.8411, test_loss: 1.0903, test_f1: 0.5483
 epoch: 64, train_loss: 0.8575, test_loss: 1.0796, test_f1: 0.5657
 epoch: 65, train_loss: 0.8372, test_loss: 1.0742, test_f1: 0.5647
 epoch: 66, train_loss: 0.8322, test_loss: 1.0830, test_f1: 0.5689
 epoch: 67, train_loss: 0.8373, test_loss: 1.1009, test_f1: 0.5785
 epoch: 68, train_loss: 0.8360, test_loss: 1.1120, test_f1: 0.5636
 epoch: 69, train_loss: 0.8333, test_loss: 1.1043, test_f1: 0.5697
 epoch: 70, train_loss: 0.8230, test_loss: 1.1006, test_f1: 0.5672
 epoch: 71, train_loss: 0.8275, test_loss: 1.1117, test_f1: 0.5633
 epoch: 72, train_loss: 0.8353, test_loss: 1.1390, test_f1: 0.5419
 epoch: 73, train_loss: 0.8276, test_loss: 1.1376, test_f1: 0.5583
 epoch: 74, train_loss: 0.8290, test_loss: 1.0886, test_f1: 0.5562
 epoch: 75, train_loss: 0.8285, test_loss: 1.1155, test_f1: 0.5598
 epoch: 76, train_loss: 0.8265, test_loss: 1.1100, test_f1: 0.5623
 epoch: 77, train_loss: 0.8103, test_loss: 1.0998, test_f1: 0.5766
 epoch: 78, train_loss: 0.8182, test_loss: 1.1136, test_f1: 0.5571
 epoch: 79, train_loss: 0.8174, test_loss: 1.1294, test_f1: 0.5688
 epoch: 80, train_loss: 0.8120, test_loss: 1.1272, test_f1: 0.5639
 epoch: 81, train_loss: 0.8158, test_loss: 1.1148, test_f1: 0.5698
 epoch: 82, train_loss: 0.8168, test_loss: 1.1249, test_f1: 0.5712
 epoch: 83, train_loss: 0.8043, test_loss: 1.1118, test_f1: 0.5591
 epoch: 84, train_loss: 0.8065, test_loss: 1.0784, test_f1: 0.5768
 epoch: 85, train_loss: 0.7983, test_loss: 1.1086, test_f1: 0.5672
 epoch: 86, train_loss: 0.8030, test_loss: 1.1311, test_f1: 0.5621
 epoch: 87, train_loss: 0.7969, test_loss: 1.1320, test_f1: 0.5611
 epoch: 88, train_loss: 0.7965, test_loss: 1.1643, test_f1: 0.5657
 epoch: 89, train_loss: 0.8023, test_loss: 1.1783, test_f1: 0.5713
 epoch: 90, train_loss: 0.7967, test_loss: 1.1434, test_f1: 0.5674
 epoch: 91, train_loss: 0.7916, test_loss: 1.1277, test_f1: 0.5671
 epoch: 92, train_loss: 0.8070, test_loss: 1.1826, test_f1: 0.5659
 epoch: 93, train_loss: 0.7995, test_loss: 1.1607, test_f1: 0.5725
 epoch: 94, train_loss: 0.7938, test_loss: 1.1160, test_f1: 0.5658
 epoch: 95, train_loss: 0.7984, test_loss: 1.1459, test_f1: 0.5663
 epoch: 96, train_loss: 0.7894, test_loss: 1.1397, test_f1: 0.5614
 epoch: 97, train_loss: 0.7951, test_loss: 1.1720, test_f1: 0.5799
 epoch: 98, train_loss: 0.7907, test_loss: 1.1533, test_f1: 0.5774
 epoch: 99, train_loss: 0.7855, test_loss: 1.1369, test_f1: 0.5768
##################ITERATION #2 ****************************************
 epoch: 0, train_loss: 1.2970, test_loss: 1.3614, test_f1: 0.1365
 epoch: 1, train_loss: 1.2573, test_loss: 1.3379, test_f1: 0.2749
 epoch: 2, train_loss: 1.2369, test_loss: 1.3219, test_f1: 0.2848
 epoch: 3, train_loss: 1.2157, test_loss: 1.3101, test_f1: 0.2707
 epoch: 4, train_loss: 1.1973, test_loss: 1.2857, test_f1: 0.3368
 epoch: 5, train_loss: 1.1816, test_loss: 1.2604, test_f1: 0.3553
 epoch: 6, train_loss: 1.1681, test_loss: 1.2430, test_f1: 0.3618
 epoch: 7, train_loss: 1.1545, test_loss: 1.2252, test_f1: 0.3709
 epoch: 8, train_loss: 1.1504, test_loss: 1.2109, test_f1: 0.3621
 epoch: 9, train_loss: 1.1335, test_loss: 1.1995, test_f1: 0.3774
 epoch: 10, train_loss: 1.1238, test_loss: 1.1913, test_f1: 0.3617
 epoch: 11, train_loss: 1.1201, test_loss: 1.1819, test_f1: 0.3649
 epoch: 12, train_loss: 1.1115, test_loss: 1.1741, test_f1: 0.3737
 epoch: 13, train_loss: 1.0955, test_loss: 1.1653, test_f1: 0.3770
 epoch: 14, train_loss: 1.0843, test_loss: 1.1589, test_f1: 0.3962
 epoch: 15, train_loss: 1.0820, test_loss: 1.1551, test_f1: 0.3905
 epoch: 16, train_loss: 1.0703, test_loss: 1.1459, test_f1: 0.4087
 epoch: 17, train_loss: 1.0685, test_loss: 1.1420, test_f1: 0.4536
 epoch: 18, train_loss: 1.0627, test_loss: 1.1314, test_f1: 0.4576
 epoch: 19, train_loss: 1.0508, test_loss: 1.1207, test_f1: 0.4810
 epoch: 20, train_loss: 1.0440, test_loss: 1.1163, test_f1: 0.4785
 epoch: 21, train_loss: 1.0338, test_loss: 1.1055, test_f1: 0.4769
 epoch: 22, train_loss: 1.0216, test_loss: 1.1052, test_f1: 0.4841
 epoch: 23, train_loss: 1.0232, test_loss: 1.0979, test_f1: 0.4927
 epoch: 24, train_loss: 1.0166, test_loss: 1.0908, test_f1: 0.4888
 epoch: 25, train_loss: 1.0075, test_loss: 1.0893, test_f1: 0.4970
 epoch: 26, train_loss: 0.9958, test_loss: 1.0757, test_f1: 0.4970
 epoch: 27, train_loss: 0.9881, test_loss: 1.0672, test_f1: 0.4883
 epoch: 28, train_loss: 0.9808, test_loss: 1.0616, test_f1: 0.5104
 epoch: 29, train_loss: 0.9730, test_loss: 1.0618, test_f1: 0.5120
 epoch: 30, train_loss: 0.9643, test_loss: 1.0671, test_f1: 0.5037
 epoch: 31, train_loss: 0.9640, test_loss: 1.0612, test_f1: 0.5093
 epoch: 32, train_loss: 0.9510, test_loss: 1.0649, test_f1: 0.5147
 epoch: 33, train_loss: 0.9431, test_loss: 1.0494, test_f1: 0.5234
 epoch: 34, train_loss: 0.9435, test_loss: 1.0449, test_f1: 0.5216
 epoch: 35, train_loss: 0.9334, test_loss: 1.0448, test_f1: 0.5239
 epoch: 36, train_loss: 0.9315, test_loss: 1.0567, test_f1: 0.5255
 epoch: 37, train_loss: 0.9256, test_loss: 1.0323, test_f1: 0.5395
 epoch: 38, train_loss: 0.9229, test_loss: 1.0360, test_f1: 0.5406
 epoch: 39, train_loss: 0.9129, test_loss: 1.0264, test_f1: 0.5521
 epoch: 40, train_loss: 0.9015, test_loss: 1.0524, test_f1: 0.5482
 epoch: 41, train_loss: 0.8987, test_loss: 1.0333, test_f1: 0.5544
 epoch: 42, train_loss: 0.8995, test_loss: 1.0332, test_f1: 0.5543
 epoch: 43, train_loss: 0.8873, test_loss: 1.0270, test_f1: 0.5479
 epoch: 44, train_loss: 0.8824, test_loss: 1.0015, test_f1: 0.5491
 epoch: 45, train_loss: 0.8818, test_loss: 1.0455, test_f1: 0.5509
 epoch: 46, train_loss: 0.8764, test_loss: 1.0464, test_f1: 0.5528
 epoch: 47, train_loss: 0.8804, test_loss: 1.0508, test_f1: 0.5555
 epoch: 48, train_loss: 0.8642, test_loss: 1.0431, test_f1: 0.5553
 epoch: 49, train_loss: 0.8580, test_loss: 1.0222, test_f1: 0.5564
 epoch: 50, train_loss: 0.8597, test_loss: 1.0227, test_f1: 0.5663
 epoch: 51, train_loss: 0.8515, test_loss: 1.0324, test_f1: 0.5642
 epoch: 52, train_loss: 0.8571, test_loss: 1.0396, test_f1: 0.5597
 epoch: 53, train_loss: 0.8436, test_loss: 1.0368, test_f1: 0.5592
 epoch: 54, train_loss: 0.8543, test_loss: 1.0314, test_f1: 0.5679
 epoch: 55, train_loss: 0.8423, test_loss: 1.0545, test_f1: 0.5587
 epoch: 56, train_loss: 0.8375, test_loss: 1.0423, test_f1: 0.5710
 epoch: 57, train_loss: 0.8397, test_loss: 1.0494, test_f1: 0.5624
 epoch: 58, train_loss: 0.8329, test_loss: 1.0422, test_f1: 0.5595
 epoch: 59, train_loss: 0.8278, test_loss: 1.0571, test_f1: 0.5680
 epoch: 60, train_loss: 0.8335, test_loss: 1.0481, test_f1: 0.5655
 epoch: 61, train_loss: 0.8284, test_loss: 1.0483, test_f1: 0.5712
 epoch: 62, train_loss: 0.8414, test_loss: 1.0564, test_f1: 0.5621
 epoch: 63, train_loss: 0.8259, test_loss: 1.0550, test_f1: 0.5590
 epoch: 64, train_loss: 0.8383, test_loss: 1.0280, test_f1: 0.5592
 epoch: 65, train_loss: 0.8258, test_loss: 1.0331, test_f1: 0.5606
 epoch: 66, train_loss: 0.8090, test_loss: 1.0381, test_f1: 0.5719
 epoch: 67, train_loss: 0.8244, test_loss: 1.0386, test_f1: 0.5706
 epoch: 68, train_loss: 0.8261, test_loss: 1.0550, test_f1: 0.5682
 epoch: 69, train_loss: 0.8240, test_loss: 1.0570, test_f1: 0.5680
 epoch: 70, train_loss: 0.8106, test_loss: 1.0747, test_f1: 0.5625
 epoch: 71, train_loss: 0.8019, test_loss: 1.0610, test_f1: 0.5681
 epoch: 72, train_loss: 0.8157, test_loss: 1.0528, test_f1: 0.5752
 epoch: 73, train_loss: 0.8179, test_loss: 1.0502, test_f1: 0.5830
 epoch: 74, train_loss: 0.8116, test_loss: 1.0423, test_f1: 0.5659
 epoch: 75, train_loss: 0.8201, test_loss: 1.0911, test_f1: 0.5709
 epoch: 76, train_loss: 0.8076, test_loss: 1.0494, test_f1: 0.5736
 epoch: 77, train_loss: 0.7994, test_loss: 1.0361, test_f1: 0.5734
 epoch: 78, train_loss: 0.8044, test_loss: 1.0773, test_f1: 0.5593
 epoch: 79, train_loss: 0.8001, test_loss: 1.0491, test_f1: 0.5706
 epoch: 80, train_loss: 0.8039, test_loss: 1.0513, test_f1: 0.5761
 epoch: 81, train_loss: 0.8016, test_loss: 1.0577, test_f1: 0.5728
 epoch: 82, train_loss: 0.7950, test_loss: 1.0476, test_f1: 0.5724
 epoch: 83, train_loss: 0.7926, test_loss: 1.0475, test_f1: 0.5793
 epoch: 84, train_loss: 0.8115, test_loss: 1.0563, test_f1: 0.5761
 epoch: 85, train_loss: 0.8013, test_loss: 1.0736, test_f1: 0.5754
 epoch: 86, train_loss: 0.7975, test_loss: 1.0532, test_f1: 0.5811
 epoch: 87, train_loss: 0.7956, test_loss: 1.0787, test_f1: 0.5867
 epoch: 88, train_loss: 0.8078, test_loss: 1.0618, test_f1: 0.5797
 epoch: 89, train_loss: 0.7946, test_loss: 1.0579, test_f1: 0.5824
 epoch: 90, train_loss: 0.7955, test_loss: 1.0498, test_f1: 0.5738
 epoch: 91, train_loss: 0.7871, test_loss: 1.0733, test_f1: 0.5735
 epoch: 92, train_loss: 0.7802, test_loss: 1.0560, test_f1: 0.5792
 epoch: 93, train_loss: 0.7792, test_loss: 1.0551, test_f1: 0.5812
 epoch: 94, train_loss: 0.7803, test_loss: 1.0630, test_f1: 0.5812
 epoch: 95, train_loss: 0.7833, test_loss: 1.0339, test_f1: 0.5731
 epoch: 96, train_loss: 0.7662, test_loss: 1.0552, test_f1: 0.5860
 epoch: 97, train_loss: 0.7794, test_loss: 1.0447, test_f1: 0.5879
 epoch: 98, train_loss: 0.7798, test_loss: 1.0553, test_f1: 0.5799
 epoch: 99, train_loss: 0.7736, test_loss: 1.0605, test_f1: 0.5893
##################ITERATION #3 ****************************************
 epoch: 0, train_loss: 1.3014, test_loss: 1.3624, test_f1: 0.1365
 epoch: 1, train_loss: 1.2386, test_loss: 1.3568, test_f1: 0.2212
 epoch: 2, train_loss: 1.2190, test_loss: 1.3393, test_f1: 0.3041
 epoch: 3, train_loss: 1.1857, test_loss: 1.3139, test_f1: 0.3399
 epoch: 4, train_loss: 1.1735, test_loss: 1.2907, test_f1: 0.3784
 epoch: 5, train_loss: 1.1575, test_loss: 1.2557, test_f1: 0.3996
 epoch: 6, train_loss: 1.1425, test_loss: 1.2245, test_f1: 0.3832
 epoch: 7, train_loss: 1.1320, test_loss: 1.2047, test_f1: 0.3975
 epoch: 8, train_loss: 1.1281, test_loss: 1.1934, test_f1: 0.3874
 epoch: 9, train_loss: 1.1143, test_loss: 1.1874, test_f1: 0.4068
 epoch: 10, train_loss: 1.0909, test_loss: 1.1789, test_f1: 0.4082
 epoch: 11, train_loss: 1.0913, test_loss: 1.1710, test_f1: 0.4222
 epoch: 12, train_loss: 1.0866, test_loss: 1.1644, test_f1: 0.4232
 epoch: 13, train_loss: 1.0725, test_loss: 1.1580, test_f1: 0.4278
 epoch: 14, train_loss: 1.0694, test_loss: 1.1477, test_f1: 0.4391
 epoch: 15, train_loss: 1.0538, test_loss: 1.1441, test_f1: 0.4423
 epoch: 16, train_loss: 1.0497, test_loss: 1.1396, test_f1: 0.4595
 epoch: 17, train_loss: 1.0350, test_loss: 1.1371, test_f1: 0.4511
 epoch: 18, train_loss: 1.0258, test_loss: 1.1378, test_f1: 0.4761
 epoch: 19, train_loss: 1.0171, test_loss: 1.1278, test_f1: 0.4888
 epoch: 20, train_loss: 1.0152, test_loss: 1.1335, test_f1: 0.4847
 epoch: 21, train_loss: 1.0039, test_loss: 1.1183, test_f1: 0.4928
 epoch: 22, train_loss: 1.0163, test_loss: 1.1173, test_f1: 0.4857
 epoch: 23, train_loss: 1.0015, test_loss: 1.1215, test_f1: 0.4947
 epoch: 24, train_loss: 0.9927, test_loss: 1.1105, test_f1: 0.4925
 epoch: 25, train_loss: 0.9797, test_loss: 1.0969, test_f1: 0.4995
 epoch: 26, train_loss: 0.9716, test_loss: 1.1019, test_f1: 0.5020
 epoch: 27, train_loss: 0.9766, test_loss: 1.0845, test_f1: 0.5070
 epoch: 28, train_loss: 0.9687, test_loss: 1.0881, test_f1: 0.5110
 epoch: 29, train_loss: 0.9648, test_loss: 1.0872, test_f1: 0.4990
 epoch: 30, train_loss: 0.9528, test_loss: 1.0759, test_f1: 0.5194
 epoch: 31, train_loss: 0.9459, test_loss: 1.0814, test_f1: 0.5139
 epoch: 32, train_loss: 0.9437, test_loss: 1.0810, test_f1: 0.5091
 epoch: 33, train_loss: 0.9423, test_loss: 1.0712, test_f1: 0.5166
 epoch: 34, train_loss: 0.9413, test_loss: 1.0695, test_f1: 0.4943
 epoch: 35, train_loss: 0.9384, test_loss: 1.0641, test_f1: 0.5095
 epoch: 36, train_loss: 0.9345, test_loss: 1.0581, test_f1: 0.5169
 epoch: 37, train_loss: 0.9210, test_loss: 1.0600, test_f1: 0.5245
 epoch: 38, train_loss: 0.9191, test_loss: 1.0607, test_f1: 0.5358
 epoch: 39, train_loss: 0.9130, test_loss: 1.0652, test_f1: 0.5231
 epoch: 40, train_loss: 0.9113, test_loss: 1.0738, test_f1: 0.5287
 epoch: 41, train_loss: 0.9099, test_loss: 1.0704, test_f1: 0.5306
 epoch: 42, train_loss: 0.9066, test_loss: 1.0816, test_f1: 0.5429
 epoch: 43, train_loss: 0.9033, test_loss: 1.0766, test_f1: 0.5362
 epoch: 44, train_loss: 0.8916, test_loss: 1.0700, test_f1: 0.5292
 epoch: 45, train_loss: 0.8854, test_loss: 1.0672, test_f1: 0.5410
 epoch: 46, train_loss: 0.8940, test_loss: 1.0797, test_f1: 0.5306
 epoch: 47, train_loss: 0.8896, test_loss: 1.0817, test_f1: 0.5367
 epoch: 48, train_loss: 0.8820, test_loss: 1.0703, test_f1: 0.5447
 epoch: 49, train_loss: 0.8744, test_loss: 1.0623, test_f1: 0.5526
 epoch: 50, train_loss: 0.8717, test_loss: 1.0569, test_f1: 0.5580
 epoch: 51, train_loss: 0.8746, test_loss: 1.0676, test_f1: 0.5637
 epoch: 52, train_loss: 0.8563, test_loss: 1.0739, test_f1: 0.5652
 epoch: 53, train_loss: 0.8664, test_loss: 1.0837, test_f1: 0.5645
 epoch: 54, train_loss: 0.8665, test_loss: 1.0910, test_f1: 0.5770
 epoch: 55, train_loss: 0.8596, test_loss: 1.0908, test_f1: 0.5639
 epoch: 56, train_loss: 0.8551, test_loss: 1.0974, test_f1: 0.5579
 epoch: 57, train_loss: 0.8532, test_loss: 1.1108, test_f1: 0.5644
 epoch: 58, train_loss: 0.8566, test_loss: 1.1111, test_f1: 0.5470
 epoch: 59, train_loss: 0.8367, test_loss: 1.1142, test_f1: 0.5560
 epoch: 60, train_loss: 0.8514, test_loss: 1.1106, test_f1: 0.5623
 epoch: 61, train_loss: 0.8437, test_loss: 1.1159, test_f1: 0.5696
 epoch: 62, train_loss: 0.8415, test_loss: 1.1085, test_f1: 0.5717
 epoch: 63, train_loss: 0.8398, test_loss: 1.1226, test_f1: 0.5628
 epoch: 64, train_loss: 0.8388, test_loss: 1.1179, test_f1: 0.5730
 epoch: 65, train_loss: 0.8404, test_loss: 1.0994, test_f1: 0.5755
 epoch: 66, train_loss: 0.8297, test_loss: 1.1137, test_f1: 0.5641
 epoch: 67, train_loss: 0.8283, test_loss: 1.1027, test_f1: 0.5724
 epoch: 68, train_loss: 0.8418, test_loss: 1.1231, test_f1: 0.5770
 epoch: 69, train_loss: 0.8445, test_loss: 1.1105, test_f1: 0.5816
 epoch: 70, train_loss: 0.8392, test_loss: 1.1194, test_f1: 0.5717
 epoch: 71, train_loss: 0.8327, test_loss: 1.1110, test_f1: 0.5747
 epoch: 72, train_loss: 0.8314, test_loss: 1.1321, test_f1: 0.5857
 epoch: 73, train_loss: 0.8234, test_loss: 1.1162, test_f1: 0.5731
 epoch: 74, train_loss: 0.8271, test_loss: 1.1310, test_f1: 0.5765
 epoch: 75, train_loss: 0.8290, test_loss: 1.1147, test_f1: 0.5626
 epoch: 76, train_loss: 0.8217, test_loss: 1.1153, test_f1: 0.5708
 epoch: 77, train_loss: 0.8168, test_loss: 1.1078, test_f1: 0.5860
 epoch: 78, train_loss: 0.8265, test_loss: 1.1150, test_f1: 0.5632
 epoch: 79, train_loss: 0.8322, test_loss: 1.1278, test_f1: 0.5697
 epoch: 80, train_loss: 0.8203, test_loss: 1.1160, test_f1: 0.5817
 epoch: 81, train_loss: 0.8170, test_loss: 1.1208, test_f1: 0.5741
 epoch: 82, train_loss: 0.8234, test_loss: 1.1424, test_f1: 0.5846
 epoch: 83, train_loss: 0.8098, test_loss: 1.1417, test_f1: 0.5771
 epoch: 84, train_loss: 0.8254, test_loss: 1.1273, test_f1: 0.5795
 epoch: 85, train_loss: 0.8036, test_loss: 1.1245, test_f1: 0.5796
 epoch: 86, train_loss: 0.8042, test_loss: 1.1347, test_f1: 0.5847
 epoch: 87, train_loss: 0.8150, test_loss: 1.1452, test_f1: 0.5791
 epoch: 88, train_loss: 0.8014, test_loss: 1.1240, test_f1: 0.5992
 epoch: 89, train_loss: 0.8151, test_loss: 1.1266, test_f1: 0.5849
 epoch: 90, train_loss: 0.8017, test_loss: 1.1227, test_f1: 0.5846
 epoch: 91, train_loss: 0.8116, test_loss: 1.1471, test_f1: 0.5721
 epoch: 92, train_loss: 0.8098, test_loss: 1.1304, test_f1: 0.5714
 epoch: 93, train_loss: 0.8049, test_loss: 1.1269, test_f1: 0.5846
 epoch: 94, train_loss: 0.8046, test_loss: 1.1453, test_f1: 0.5884
 epoch: 95, train_loss: 0.7939, test_loss: 1.1460, test_f1: 0.5800
 epoch: 96, train_loss: 0.7961, test_loss: 1.1643, test_f1: 0.5802
 epoch: 97, train_loss: 0.7957, test_loss: 1.1616, test_f1: 0.5852
 epoch: 98, train_loss: 0.8041, test_loss: 1.1778, test_f1: 0.5645
 epoch: 99, train_loss: 0.7954, test_loss: 1.1498, test_f1: 0.5878
##################ITERATION #4 ****************************************
 epoch: 0, train_loss: 1.2688, test_loss: 1.3524, test_f1: 0.2281
 epoch: 1, train_loss: 1.2099, test_loss: 1.3322, test_f1: 0.2281
 epoch: 2, train_loss: 1.1953, test_loss: 1.3012, test_f1: 0.2587
 epoch: 3, train_loss: 1.1723, test_loss: 1.2921, test_f1: 0.2654
 epoch: 4, train_loss: 1.1621, test_loss: 1.2655, test_f1: 0.3322
 epoch: 5, train_loss: 1.1392, test_loss: 1.2582, test_f1: 0.3347
 epoch: 6, train_loss: 1.1244, test_loss: 1.2250, test_f1: 0.4145
 epoch: 7, train_loss: 1.1169, test_loss: 1.1955, test_f1: 0.4424
 epoch: 8, train_loss: 1.1082, test_loss: 1.1791, test_f1: 0.4434
 epoch: 9, train_loss: 1.0953, test_loss: 1.1791, test_f1: 0.4558
 epoch: 10, train_loss: 1.0850, test_loss: 1.1750, test_f1: 0.4621
 epoch: 11, train_loss: 1.0747, test_loss: 1.1735, test_f1: 0.4597
 epoch: 12, train_loss: 1.0636, test_loss: 1.1665, test_f1: 0.4740
 epoch: 13, train_loss: 1.0649, test_loss: 1.1662, test_f1: 0.4799
 epoch: 14, train_loss: 1.0585, test_loss: 1.1565, test_f1: 0.4899
 epoch: 15, train_loss: 1.0421, test_loss: 1.1498, test_f1: 0.4895
 epoch: 16, train_loss: 1.0458, test_loss: 1.1369, test_f1: 0.4992
 epoch: 17, train_loss: 1.0363, test_loss: 1.1411, test_f1: 0.5016
 epoch: 18, train_loss: 1.0286, test_loss: 1.1402, test_f1: 0.5070
 epoch: 19, train_loss: 1.0120, test_loss: 1.1310, test_f1: 0.5056
 epoch: 20, train_loss: 1.0148, test_loss: 1.1317, test_f1: 0.5047
 epoch: 21, train_loss: 1.0050, test_loss: 1.1167, test_f1: 0.5177
 epoch: 22, train_loss: 0.9917, test_loss: 1.1226, test_f1: 0.5382
 epoch: 23, train_loss: 0.9884, test_loss: 1.1034, test_f1: 0.5299
 epoch: 24, train_loss: 0.9916, test_loss: 1.0893, test_f1: 0.5358
 epoch: 25, train_loss: 0.9779, test_loss: 1.0968, test_f1: 0.5140
 epoch: 26, train_loss: 0.9659, test_loss: 1.1041, test_f1: 0.5372
 epoch: 27, train_loss: 0.9743, test_loss: 1.0899, test_f1: 0.5451
 epoch: 28, train_loss: 0.9648, test_loss: 1.0992, test_f1: 0.5362
 epoch: 29, train_loss: 0.9482, test_loss: 1.0960, test_f1: 0.5354
 epoch: 30, train_loss: 0.9472, test_loss: 1.0916, test_f1: 0.5248
 epoch: 31, train_loss: 0.9410, test_loss: 1.0663, test_f1: 0.5324
 epoch: 32, train_loss: 0.9422, test_loss: 1.0649, test_f1: 0.5265
 epoch: 33, train_loss: 0.9502, test_loss: 1.0671, test_f1: 0.5381
 epoch: 34, train_loss: 0.9388, test_loss: 1.0778, test_f1: 0.5305
 epoch: 35, train_loss: 0.9257, test_loss: 1.0741, test_f1: 0.5265
 epoch: 36, train_loss: 0.9340, test_loss: 1.0692, test_f1: 0.5346
 epoch: 37, train_loss: 0.9255, test_loss: 1.0818, test_f1: 0.5297
 epoch: 38, train_loss: 0.9177, test_loss: 1.0841, test_f1: 0.5280
 epoch: 39, train_loss: 0.9162, test_loss: 1.0829, test_f1: 0.5375
 epoch: 40, train_loss: 0.9065, test_loss: 1.0620, test_f1: 0.5459
 epoch: 41, train_loss: 0.9083, test_loss: 1.0891, test_f1: 0.5459
 epoch: 42, train_loss: 0.8964, test_loss: 1.0737, test_f1: 0.5401
 epoch: 43, train_loss: 0.9258, test_loss: 1.0778, test_f1: 0.5577
 epoch: 44, train_loss: 0.8961, test_loss: 1.0994, test_f1: 0.5412
 epoch: 45, train_loss: 0.8956, test_loss: 1.0869, test_f1: 0.5221
 epoch: 46, train_loss: 0.8827, test_loss: 1.0722, test_f1: 0.5299
 epoch: 47, train_loss: 0.8728, test_loss: 1.0681, test_f1: 0.5359
 epoch: 48, train_loss: 0.8826, test_loss: 1.0839, test_f1: 0.5515
 epoch: 49, train_loss: 0.8755, test_loss: 1.0748, test_f1: 0.5551
 epoch: 50, train_loss: 0.8701, test_loss: 1.0779, test_f1: 0.5459
 epoch: 51, train_loss: 0.8775, test_loss: 1.0859, test_f1: 0.5505
 epoch: 52, train_loss: 0.8705, test_loss: 1.0912, test_f1: 0.5491
 epoch: 53, train_loss: 0.8604, test_loss: 1.0992, test_f1: 0.5505
 epoch: 54, train_loss: 0.8508, test_loss: 1.0957, test_f1: 0.5477
 epoch: 55, train_loss: 0.8761, test_loss: 1.1049, test_f1: 0.5373
 epoch: 56, train_loss: 0.8544, test_loss: 1.0999, test_f1: 0.5573
 epoch: 57, train_loss: 0.8526, test_loss: 1.0915, test_f1: 0.5485
 epoch: 58, train_loss: 0.8458, test_loss: 1.1202, test_f1: 0.5510
 epoch: 59, train_loss: 0.8503, test_loss: 1.1026, test_f1: 0.5601
 epoch: 60, train_loss: 0.8570, test_loss: 1.0933, test_f1: 0.5507
 epoch: 61, train_loss: 0.8466, test_loss: 1.0941, test_f1: 0.5561
 epoch: 62, train_loss: 0.8520, test_loss: 1.0917, test_f1: 0.5594
 epoch: 63, train_loss: 0.8526, test_loss: 1.1061, test_f1: 0.5504
 epoch: 64, train_loss: 0.8420, test_loss: 1.1149, test_f1: 0.5493
 epoch: 65, train_loss: 0.8466, test_loss: 1.1445, test_f1: 0.5499
 epoch: 66, train_loss: 0.8561, test_loss: 1.1149, test_f1: 0.5512
 epoch: 67, train_loss: 0.8406, test_loss: 1.1042, test_f1: 0.5536
 epoch: 68, train_loss: 0.8346, test_loss: 1.1062, test_f1: 0.5636
 epoch: 69, train_loss: 0.8393, test_loss: 1.0981, test_f1: 0.5736
 epoch: 70, train_loss: 0.8338, test_loss: 1.1009, test_f1: 0.5606
 epoch: 71, train_loss: 0.8248, test_loss: 1.1163, test_f1: 0.5489
 epoch: 72, train_loss: 0.8310, test_loss: 1.1144, test_f1: 0.5512
 epoch: 73, train_loss: 0.8331, test_loss: 1.0965, test_f1: 0.5551
 epoch: 74, train_loss: 0.8417, test_loss: 1.1130, test_f1: 0.5567
 epoch: 75, train_loss: 0.8347, test_loss: 1.1357, test_f1: 0.5425
 epoch: 76, train_loss: 0.8311, test_loss: 1.1379, test_f1: 0.5411
 epoch: 77, train_loss: 0.8426, test_loss: 1.1460, test_f1: 0.5526
 epoch: 78, train_loss: 0.8359, test_loss: 1.1421, test_f1: 0.5486
 epoch: 79, train_loss: 0.8282, test_loss: 1.1410, test_f1: 0.5535
 epoch: 80, train_loss: 0.8272, test_loss: 1.1402, test_f1: 0.5432
 epoch: 81, train_loss: 0.8268, test_loss: 1.1336, test_f1: 0.5596
 epoch: 82, train_loss: 0.8124, test_loss: 1.1321, test_f1: 0.5647
 epoch: 83, train_loss: 0.8109, test_loss: 1.1335, test_f1: 0.5550
 epoch: 84, train_loss: 0.8271, test_loss: 1.1399, test_f1: 0.5614
 epoch: 85, train_loss: 0.8156, test_loss: 1.1391, test_f1: 0.5506
 epoch: 86, train_loss: 0.8063, test_loss: 1.1407, test_f1: 0.5506
 epoch: 87, train_loss: 0.8055, test_loss: 1.1494, test_f1: 0.5604
 epoch: 88, train_loss: 0.8173, test_loss: 1.1565, test_f1: 0.5539
 epoch: 89, train_loss: 0.8163, test_loss: 1.1668, test_f1: 0.5383
 epoch: 90, train_loss: 0.8046, test_loss: 1.1518, test_f1: 0.5493
 epoch: 91, train_loss: 0.8135, test_loss: 1.1492, test_f1: 0.5626
 epoch: 92, train_loss: 0.8053, test_loss: 1.1522, test_f1: 0.5307
 epoch: 93, train_loss: 0.8053, test_loss: 1.1614, test_f1: 0.5599
 epoch: 94, train_loss: 0.8151, test_loss: 1.1527, test_f1: 0.5628
 epoch: 95, train_loss: 0.8043, test_loss: 1.1642, test_f1: 0.5340
 epoch: 96, train_loss: 0.8014, test_loss: 1.1626, test_f1: 0.5675
 epoch: 97, train_loss: 0.8036, test_loss: 1.1676, test_f1: 0.5329
 epoch: 98, train_loss: 0.7890, test_loss: 1.1911, test_f1: 0.5493
 epoch: 99, train_loss: 0.7958, test_loss: 1.1744, test_f1: 0.5467
##################ITERATION #5 ****************************************
 epoch: 0, train_loss: 1.2370, test_loss: 1.3249, test_f1: 0.2281
 epoch: 1, train_loss: 1.1816, test_loss: 1.3431, test_f1: 0.2281
 epoch: 2, train_loss: 1.1608, test_loss: 1.3214, test_f1: 0.2726
 epoch: 3, train_loss: 1.1481, test_loss: 1.2833, test_f1: 0.2884
 epoch: 4, train_loss: 1.1219, test_loss: 1.2470, test_f1: 0.3616
 epoch: 5, train_loss: 1.1074, test_loss: 1.2004, test_f1: 0.3776
 epoch: 6, train_loss: 1.0939, test_loss: 1.1660, test_f1: 0.4311
 epoch: 7, train_loss: 1.0863, test_loss: 1.1557, test_f1: 0.4116
 epoch: 8, train_loss: 1.0751, test_loss: 1.1506, test_f1: 0.4053
 epoch: 9, train_loss: 1.0706, test_loss: 1.1502, test_f1: 0.4049
 epoch: 10, train_loss: 1.0636, test_loss: 1.1433, test_f1: 0.4081
 epoch: 11, train_loss: 1.0573, test_loss: 1.1446, test_f1: 0.4171
 epoch: 12, train_loss: 1.0416, test_loss: 1.1292, test_f1: 0.4136
 epoch: 13, train_loss: 1.0423, test_loss: 1.1367, test_f1: 0.4190
 epoch: 14, train_loss: 1.0259, test_loss: 1.1360, test_f1: 0.4193
 epoch: 15, train_loss: 1.0213, test_loss: 1.1221, test_f1: 0.4261
 epoch: 16, train_loss: 1.0165, test_loss: 1.1108, test_f1: 0.4348
 epoch: 17, train_loss: 1.0144, test_loss: 1.1173, test_f1: 0.4427
 epoch: 18, train_loss: 1.0080, test_loss: 1.1159, test_f1: 0.4550
 epoch: 19, train_loss: 0.9924, test_loss: 1.0961, test_f1: 0.4709
 epoch: 20, train_loss: 0.9929, test_loss: 1.0967, test_f1: 0.4692
 epoch: 21, train_loss: 0.9802, test_loss: 1.0876, test_f1: 0.4810
 epoch: 22, train_loss: 0.9748, test_loss: 1.0870, test_f1: 0.4971
 epoch: 23, train_loss: 0.9723, test_loss: 1.0946, test_f1: 0.4923
 epoch: 24, train_loss: 0.9737, test_loss: 1.0970, test_f1: 0.4969
 epoch: 25, train_loss: 0.9712, test_loss: 1.0996, test_f1: 0.5032
 epoch: 26, train_loss: 0.9494, test_loss: 1.0900, test_f1: 0.5082
 epoch: 27, train_loss: 0.9527, test_loss: 1.0936, test_f1: 0.5072
 epoch: 28, train_loss: 0.9449, test_loss: 1.0908, test_f1: 0.5134
 epoch: 29, train_loss: 0.9407, test_loss: 1.0807, test_f1: 0.5284
 epoch: 30, train_loss: 0.9459, test_loss: 1.0709, test_f1: 0.5332
 epoch: 31, train_loss: 0.9379, test_loss: 1.0868, test_f1: 0.5153
 epoch: 32, train_loss: 0.9295, test_loss: 1.0832, test_f1: 0.5259
 epoch: 33, train_loss: 0.9234, test_loss: 1.0661, test_f1: 0.5171
 epoch: 34, train_loss: 0.9145, test_loss: 1.0649, test_f1: 0.5211
 epoch: 35, train_loss: 0.9203, test_loss: 1.0418, test_f1: 0.5366
 epoch: 36, train_loss: 0.9105, test_loss: 1.0846, test_f1: 0.5186
 epoch: 37, train_loss: 0.9059, test_loss: 1.0860, test_f1: 0.5309
 epoch: 38, train_loss: 0.8957, test_loss: 1.0827, test_f1: 0.5389
 epoch: 39, train_loss: 0.9016, test_loss: 1.0843, test_f1: 0.5343
 epoch: 40, train_loss: 0.9052, test_loss: 1.0851, test_f1: 0.5389
 epoch: 41, train_loss: 0.8990, test_loss: 1.0797, test_f1: 0.5295
 epoch: 42, train_loss: 0.8801, test_loss: 1.1178, test_f1: 0.5359
 epoch: 43, train_loss: 0.8917, test_loss: 1.0658, test_f1: 0.5461
 epoch: 44, train_loss: 0.8808, test_loss: 1.0865, test_f1: 0.5420
 epoch: 45, train_loss: 0.8800, test_loss: 1.0744, test_f1: 0.5427
 epoch: 46, train_loss: 0.8754, test_loss: 1.0484, test_f1: 0.5613
 epoch: 47, train_loss: 0.8668, test_loss: 1.1048, test_f1: 0.5305
 epoch: 48, train_loss: 0.8728, test_loss: 1.0542, test_f1: 0.5567
 epoch: 49, train_loss: 0.8629, test_loss: 1.0426, test_f1: 0.5574
 epoch: 50, train_loss: 0.8544, test_loss: 1.0696, test_f1: 0.5602
 epoch: 51, train_loss: 0.8493, test_loss: 1.0640, test_f1: 0.5544
 epoch: 52, train_loss: 0.8520, test_loss: 1.0614, test_f1: 0.5450
 epoch: 53, train_loss: 0.8418, test_loss: 1.0607, test_f1: 0.5557
 epoch: 54, train_loss: 0.8515, test_loss: 1.0724, test_f1: 0.5456
 epoch: 55, train_loss: 0.8481, test_loss: 1.0582, test_f1: 0.5520
 epoch: 56, train_loss: 0.8441, test_loss: 1.0561, test_f1: 0.5574
 epoch: 57, train_loss: 0.8448, test_loss: 1.0597, test_f1: 0.5597
 epoch: 58, train_loss: 0.8451, test_loss: 1.0595, test_f1: 0.5554
 epoch: 59, train_loss: 0.8348, test_loss: 1.0613, test_f1: 0.5608
 epoch: 60, train_loss: 0.8400, test_loss: 1.0563, test_f1: 0.5496
 epoch: 61, train_loss: 0.8335, test_loss: 1.0563, test_f1: 0.5509
 epoch: 62, train_loss: 0.8362, test_loss: 1.0815, test_f1: 0.5486
 epoch: 63, train_loss: 0.8376, test_loss: 1.0753, test_f1: 0.5462
 epoch: 64, train_loss: 0.8243, test_loss: 1.0618, test_f1: 0.5545
 epoch: 65, train_loss: 0.8308, test_loss: 1.0562, test_f1: 0.5556
 epoch: 66, train_loss: 0.8206, test_loss: 1.0608, test_f1: 0.5597
 epoch: 67, train_loss: 0.8315, test_loss: 1.0858, test_f1: 0.5494
 epoch: 68, train_loss: 0.8337, test_loss: 1.0776, test_f1: 0.5445
 epoch: 69, train_loss: 0.8097, test_loss: 1.0629, test_f1: 0.5426
 epoch: 70, train_loss: 0.8219, test_loss: 1.0927, test_f1: 0.5437
 epoch: 71, train_loss: 0.8254, test_loss: 1.0651, test_f1: 0.5395
 epoch: 72, train_loss: 0.8293, test_loss: 1.0859, test_f1: 0.5486
 epoch: 73, train_loss: 0.8152, test_loss: 1.0809, test_f1: 0.5478
 epoch: 74, train_loss: 0.8080, test_loss: 1.0881, test_f1: 0.5469
 epoch: 75, train_loss: 0.8105, test_loss: 1.0899, test_f1: 0.5313
 epoch: 76, train_loss: 0.8154, test_loss: 1.0729, test_f1: 0.5506
 epoch: 77, train_loss: 0.8065, test_loss: 1.0930, test_f1: 0.5414
 epoch: 78, train_loss: 0.8089, test_loss: 1.0859, test_f1: 0.5443
 epoch: 79, train_loss: 0.8095, test_loss: 1.0892, test_f1: 0.5559
 epoch: 80, train_loss: 0.7975, test_loss: 1.0878, test_f1: 0.5471
 epoch: 81, train_loss: 0.8070, test_loss: 1.0941, test_f1: 0.5440
 epoch: 82, train_loss: 0.7993, test_loss: 1.0888, test_f1: 0.5480
 epoch: 83, train_loss: 0.8078, test_loss: 1.0765, test_f1: 0.5517
 epoch: 84, train_loss: 0.7970, test_loss: 1.0847, test_f1: 0.5639
 epoch: 85, train_loss: 0.7988, test_loss: 1.0936, test_f1: 0.5524
 epoch: 86, train_loss: 0.8018, test_loss: 1.1120, test_f1: 0.5443
 epoch: 87, train_loss: 0.7917, test_loss: 1.0815, test_f1: 0.5498
 epoch: 88, train_loss: 0.7970, test_loss: 1.0919, test_f1: 0.5643
 epoch: 89, train_loss: 0.7876, test_loss: 1.1100, test_f1: 0.5526
 epoch: 90, train_loss: 0.7976, test_loss: 1.0994, test_f1: 0.5664
 epoch: 91, train_loss: 0.7920, test_loss: 1.1060, test_f1: 0.5397
 epoch: 92, train_loss: 0.7853, test_loss: 1.0770, test_f1: 0.5401
 epoch: 93, train_loss: 0.7791, test_loss: 1.1123, test_f1: 0.5479
 epoch: 94, train_loss: 0.7997, test_loss: 1.0818, test_f1: 0.5511
 epoch: 95, train_loss: 0.7876, test_loss: 1.1232, test_f1: 0.5593
 epoch: 96, train_loss: 0.7806, test_loss: 1.0860, test_f1: 0.5699
 epoch: 97, train_loss: 0.7783, test_loss: 1.1224, test_f1: 0.5491
 epoch: 98, train_loss: 0.7896, test_loss: 1.1154, test_f1: 0.5537
 epoch: 99, train_loss: 0.7807, test_loss: 1.1186, test_f1: 0.5617
##################ITERATION #6 ****************************************
 epoch: 0, train_loss: 1.2546, test_loss: 1.3146, test_f1: 0.2281
 epoch: 1, train_loss: 1.1912, test_loss: 1.3131, test_f1: 0.2281
 epoch: 2, train_loss: 1.1576, test_loss: 1.2876, test_f1: 0.2484
 epoch: 3, train_loss: 1.1423, test_loss: 1.2686, test_f1: 0.2737
 epoch: 4, train_loss: 1.1238, test_loss: 1.2383, test_f1: 0.2827
 epoch: 5, train_loss: 1.1031, test_loss: 1.1910, test_f1: 0.3250
 epoch: 6, train_loss: 1.0942, test_loss: 1.1663, test_f1: 0.3776
 epoch: 7, train_loss: 1.0855, test_loss: 1.1537, test_f1: 0.3934
 epoch: 8, train_loss: 1.0726, test_loss: 1.1387, test_f1: 0.4116
 epoch: 9, train_loss: 1.0565, test_loss: 1.1211, test_f1: 0.4281
 epoch: 10, train_loss: 1.0545, test_loss: 1.1240, test_f1: 0.4341
 epoch: 11, train_loss: 1.0471, test_loss: 1.1104, test_f1: 0.4617
 epoch: 12, train_loss: 1.0489, test_loss: 1.1012, test_f1: 0.4519
 epoch: 13, train_loss: 1.0263, test_loss: 1.0910, test_f1: 0.4721
 epoch: 14, train_loss: 1.0242, test_loss: 1.0837, test_f1: 0.4852
 epoch: 15, train_loss: 1.0119, test_loss: 1.0790, test_f1: 0.4773
 epoch: 16, train_loss: 1.0055, test_loss: 1.0747, test_f1: 0.4840
 epoch: 17, train_loss: 1.0044, test_loss: 1.0664, test_f1: 0.4972
 epoch: 18, train_loss: 0.9928, test_loss: 1.0616, test_f1: 0.4904
 epoch: 19, train_loss: 0.9868, test_loss: 1.0594, test_f1: 0.4951
 epoch: 20, train_loss: 0.9763, test_loss: 1.0548, test_f1: 0.5056
 epoch: 21, train_loss: 0.9664, test_loss: 1.0540, test_f1: 0.5140
 epoch: 22, train_loss: 0.9742, test_loss: 1.0471, test_f1: 0.5046
 epoch: 23, train_loss: 0.9571, test_loss: 1.0424, test_f1: 0.5324
 epoch: 24, train_loss: 0.9658, test_loss: 1.0512, test_f1: 0.5218
 epoch: 25, train_loss: 0.9519, test_loss: 1.0497, test_f1: 0.5153
 epoch: 26, train_loss: 0.9466, test_loss: 1.0368, test_f1: 0.5187
 epoch: 27, train_loss: 0.9334, test_loss: 1.0316, test_f1: 0.5280
 epoch: 28, train_loss: 0.9376, test_loss: 1.0428, test_f1: 0.5128
 epoch: 29, train_loss: 0.9272, test_loss: 1.0442, test_f1: 0.5136
 epoch: 30, train_loss: 0.9406, test_loss: 1.0427, test_f1: 0.5263
 epoch: 31, train_loss: 0.9169, test_loss: 1.0310, test_f1: 0.5321
 epoch: 32, train_loss: 0.9201, test_loss: 1.0390, test_f1: 0.5298
 epoch: 33, train_loss: 0.9134, test_loss: 1.0189, test_f1: 0.5454
 epoch: 34, train_loss: 0.8986, test_loss: 1.0203, test_f1: 0.5392
 epoch: 35, train_loss: 0.9097, test_loss: 1.0292, test_f1: 0.5493
 epoch: 36, train_loss: 0.9038, test_loss: 1.0364, test_f1: 0.5650
 epoch: 37, train_loss: 0.8943, test_loss: 1.0463, test_f1: 0.5473
 epoch: 38, train_loss: 0.8869, test_loss: 1.0290, test_f1: 0.5528
 epoch: 39, train_loss: 0.8868, test_loss: 1.0145, test_f1: 0.5577
 epoch: 40, train_loss: 0.8944, test_loss: 1.0092, test_f1: 0.5506
 epoch: 41, train_loss: 0.8846, test_loss: 1.0128, test_f1: 0.5710
 epoch: 42, train_loss: 0.8802, test_loss: 1.0275, test_f1: 0.5662
 epoch: 43, train_loss: 0.8662, test_loss: 1.0132, test_f1: 0.5849
 epoch: 44, train_loss: 0.8728, test_loss: 1.0143, test_f1: 0.5693
 epoch: 45, train_loss: 0.8755, test_loss: 0.9989, test_f1: 0.5919
 epoch: 46, train_loss: 0.8702, test_loss: 1.0029, test_f1: 0.5831
 epoch: 47, train_loss: 0.8634, test_loss: 1.0148, test_f1: 0.5742
 epoch: 48, train_loss: 0.8530, test_loss: 1.0213, test_f1: 0.5767
 epoch: 49, train_loss: 0.8649, test_loss: 0.9956, test_f1: 0.5586
 epoch: 50, train_loss: 0.8567, test_loss: 0.9928, test_f1: 0.5735
 epoch: 51, train_loss: 0.8570, test_loss: 1.0083, test_f1: 0.5813
 epoch: 52, train_loss: 0.8518, test_loss: 1.0281, test_f1: 0.5830
 epoch: 53, train_loss: 0.8420, test_loss: 1.0301, test_f1: 0.5913
 epoch: 54, train_loss: 0.8557, test_loss: 1.0586, test_f1: 0.5809
 epoch: 55, train_loss: 0.8452, test_loss: 1.0284, test_f1: 0.5747
 epoch: 56, train_loss: 0.8344, test_loss: 1.0297, test_f1: 0.5831
 epoch: 57, train_loss: 0.8377, test_loss: 1.0216, test_f1: 0.5585
 epoch: 58, train_loss: 0.8332, test_loss: 1.0215, test_f1: 0.5861
 epoch: 59, train_loss: 0.8302, test_loss: 1.0222, test_f1: 0.5772
 epoch: 60, train_loss: 0.8214, test_loss: 1.0233, test_f1: 0.5718
 epoch: 61, train_loss: 0.8228, test_loss: 1.0271, test_f1: 0.5724
 epoch: 62, train_loss: 0.8311, test_loss: 1.0232, test_f1: 0.5887
 epoch: 63, train_loss: 0.8266, test_loss: 1.0158, test_f1: 0.5871
 epoch: 64, train_loss: 0.8241, test_loss: 1.0157, test_f1: 0.5846
 epoch: 65, train_loss: 0.8221, test_loss: 1.0199, test_f1: 0.5816
 epoch: 66, train_loss: 0.8136, test_loss: 1.0157, test_f1: 0.5720
 epoch: 67, train_loss: 0.8172, test_loss: 1.0365, test_f1: 0.5856
 epoch: 68, train_loss: 0.8192, test_loss: 1.0316, test_f1: 0.5882
 epoch: 69, train_loss: 0.8058, test_loss: 1.0179, test_f1: 0.5732
 epoch: 70, train_loss: 0.8232, test_loss: 1.0448, test_f1: 0.5853
 epoch: 71, train_loss: 0.8177, test_loss: 1.0496, test_f1: 0.5792
 epoch: 72, train_loss: 0.8107, test_loss: 1.0346, test_f1: 0.5869
 epoch: 73, train_loss: 0.8155, test_loss: 1.0344, test_f1: 0.5837
 epoch: 74, train_loss: 0.8109, test_loss: 1.0426, test_f1: 0.5775
 epoch: 75, train_loss: 0.8225, test_loss: 1.0282, test_f1: 0.5830
 epoch: 76, train_loss: 0.8054, test_loss: 1.0279, test_f1: 0.5829
 epoch: 77, train_loss: 0.8110, test_loss: 1.0320, test_f1: 0.5854
 epoch: 78, train_loss: 0.7974, test_loss: 1.0333, test_f1: 0.5790
 epoch: 79, train_loss: 0.7956, test_loss: 1.0365, test_f1: 0.5888
 epoch: 80, train_loss: 0.7988, test_loss: 1.0380, test_f1: 0.5835
 epoch: 81, train_loss: 0.8069, test_loss: 1.0488, test_f1: 0.5954
 epoch: 82, train_loss: 0.8010, test_loss: 1.0285, test_f1: 0.5694
 epoch: 83, train_loss: 0.8012, test_loss: 1.0384, test_f1: 0.5876
 epoch: 84, train_loss: 0.8066, test_loss: 1.0453, test_f1: 0.5869
 epoch: 85, train_loss: 0.7895, test_loss: 1.0404, test_f1: 0.5892
 epoch: 86, train_loss: 0.7779, test_loss: 1.0554, test_f1: 0.5837
 epoch: 87, train_loss: 0.7901, test_loss: 1.0593, test_f1: 0.5666
 epoch: 88, train_loss: 0.7815, test_loss: 1.0341, test_f1: 0.5768
 epoch: 89, train_loss: 0.7872, test_loss: 1.0589, test_f1: 0.5934
 epoch: 90, train_loss: 0.7858, test_loss: 1.0505, test_f1: 0.5744
 epoch: 91, train_loss: 0.7966, test_loss: 1.0575, test_f1: 0.5885
 epoch: 92, train_loss: 0.7730, test_loss: 1.0527, test_f1: 0.5795
 epoch: 93, train_loss: 0.7857, test_loss: 1.0696, test_f1: 0.5910
 epoch: 94, train_loss: 0.7791, test_loss: 1.0406, test_f1: 0.5824
 epoch: 95, train_loss: 0.7789, test_loss: 1.0441, test_f1: 0.5793
 epoch: 96, train_loss: 0.7891, test_loss: 1.0582, test_f1: 0.5913
 epoch: 97, train_loss: 0.7822, test_loss: 1.0505, test_f1: 0.5957
 epoch: 98, train_loss: 0.7717, test_loss: 1.0566, test_f1: 0.5907
 epoch: 99, train_loss: 0.7778, test_loss: 1.0650, test_f1: 0.5863
##################ITERATION #7 ****************************************
 epoch: 0, train_loss: 1.2600, test_loss: 1.3563, test_f1: 0.2281
 epoch: 1, train_loss: 1.1867, test_loss: 1.3199, test_f1: 0.2281
 epoch: 2, train_loss: 1.1686, test_loss: 1.2812, test_f1: 0.2444
 epoch: 3, train_loss: 1.1426, test_loss: 1.2561, test_f1: 0.2824
 epoch: 4, train_loss: 1.1281, test_loss: 1.2201, test_f1: 0.2813
 epoch: 5, train_loss: 1.1052, test_loss: 1.1963, test_f1: 0.2901
 epoch: 6, train_loss: 1.1019, test_loss: 1.1608, test_f1: 0.3821
 epoch: 7, train_loss: 1.0905, test_loss: 1.1315, test_f1: 0.4392
 epoch: 8, train_loss: 1.0649, test_loss: 1.1210, test_f1: 0.4648
 epoch: 9, train_loss: 1.0633, test_loss: 1.1113, test_f1: 0.5044
 epoch: 10, train_loss: 1.0532, test_loss: 1.1080, test_f1: 0.4879
 epoch: 11, train_loss: 1.0415, test_loss: 1.0993, test_f1: 0.4905
 epoch: 12, train_loss: 1.0365, test_loss: 1.0931, test_f1: 0.5186
 epoch: 13, train_loss: 1.0274, test_loss: 1.0796, test_f1: 0.5018
 epoch: 14, train_loss: 1.0214, test_loss: 1.0757, test_f1: 0.5191
 epoch: 15, train_loss: 1.0105, test_loss: 1.0601, test_f1: 0.4939
 epoch: 16, train_loss: 1.0030, test_loss: 1.0675, test_f1: 0.5021
 epoch: 17, train_loss: 1.0043, test_loss: 1.0586, test_f1: 0.5031
 epoch: 18, train_loss: 0.9906, test_loss: 1.0556, test_f1: 0.5181
 epoch: 19, train_loss: 0.9870, test_loss: 1.0532, test_f1: 0.5197
 epoch: 20, train_loss: 0.9763, test_loss: 1.0456, test_f1: 0.5157
 epoch: 21, train_loss: 0.9756, test_loss: 1.0326, test_f1: 0.5197
 epoch: 22, train_loss: 0.9702, test_loss: 1.0404, test_f1: 0.5283
 epoch: 23, train_loss: 0.9662, test_loss: 1.0317, test_f1: 0.5172
 epoch: 24, train_loss: 0.9615, test_loss: 1.0276, test_f1: 0.5236
 epoch: 25, train_loss: 0.9563, test_loss: 1.0264, test_f1: 0.5187
 epoch: 26, train_loss: 0.9460, test_loss: 1.0251, test_f1: 0.5157
 epoch: 27, train_loss: 0.9443, test_loss: 1.0217, test_f1: 0.5162
 epoch: 28, train_loss: 0.9432, test_loss: 1.0181, test_f1: 0.5199
 epoch: 29, train_loss: 0.9299, test_loss: 1.0151, test_f1: 0.5283
 epoch: 30, train_loss: 0.9353, test_loss: 1.0161, test_f1: 0.5223
 epoch: 31, train_loss: 0.9219, test_loss: 1.0143, test_f1: 0.5190
 epoch: 32, train_loss: 0.9364, test_loss: 1.0199, test_f1: 0.5203
 epoch: 33, train_loss: 0.9210, test_loss: 1.0168, test_f1: 0.5192
 epoch: 34, train_loss: 0.9067, test_loss: 1.0233, test_f1: 0.5362
 epoch: 35, train_loss: 0.9081, test_loss: 1.0266, test_f1: 0.5338
 epoch: 36, train_loss: 0.9135, test_loss: 1.0222, test_f1: 0.5400
 epoch: 37, train_loss: 0.9191, test_loss: 1.0077, test_f1: 0.5394
 epoch: 38, train_loss: 0.9017, test_loss: 1.0371, test_f1: 0.5123
 epoch: 39, train_loss: 0.9029, test_loss: 1.0254, test_f1: 0.5269
 epoch: 40, train_loss: 0.8946, test_loss: 1.0113, test_f1: 0.5250
 epoch: 41, train_loss: 0.8888, test_loss: 1.0296, test_f1: 0.5203
 epoch: 42, train_loss: 0.8880, test_loss: 1.0231, test_f1: 0.5430
 epoch: 43, train_loss: 0.8881, test_loss: 0.9988, test_f1: 0.5406
 epoch: 44, train_loss: 0.8850, test_loss: 1.0015, test_f1: 0.5504
 epoch: 45, train_loss: 0.8861, test_loss: 1.0010, test_f1: 0.5474
 epoch: 46, train_loss: 0.8714, test_loss: 0.9997, test_f1: 0.5514
 epoch: 47, train_loss: 0.8700, test_loss: 1.0198, test_f1: 0.5343
 epoch: 48, train_loss: 0.8618, test_loss: 1.0246, test_f1: 0.5538
 epoch: 49, train_loss: 0.8812, test_loss: 1.0100, test_f1: 0.5532
 epoch: 50, train_loss: 0.8745, test_loss: 1.0126, test_f1: 0.5476
 epoch: 51, train_loss: 0.8513, test_loss: 1.0212, test_f1: 0.5400
 epoch: 52, train_loss: 0.8530, test_loss: 0.9881, test_f1: 0.5482
 epoch: 53, train_loss: 0.8668, test_loss: 1.0121, test_f1: 0.5520
 epoch: 54, train_loss: 0.8588, test_loss: 1.0157, test_f1: 0.5550
 epoch: 55, train_loss: 0.8522, test_loss: 1.0160, test_f1: 0.5552
 epoch: 56, train_loss: 0.8430, test_loss: 1.0205, test_f1: 0.5541
 epoch: 57, train_loss: 0.8354, test_loss: 1.0213, test_f1: 0.5418
 epoch: 58, train_loss: 0.8459, test_loss: 1.0171, test_f1: 0.5482
 epoch: 59, train_loss: 0.8380, test_loss: 1.0197, test_f1: 0.5555
 epoch: 60, train_loss: 0.8369, test_loss: 1.0097, test_f1: 0.5622
 epoch: 61, train_loss: 0.8424, test_loss: 1.0200, test_f1: 0.5619
 epoch: 62, train_loss: 0.8361, test_loss: 1.0183, test_f1: 0.5611
 epoch: 63, train_loss: 0.8282, test_loss: 1.0267, test_f1: 0.5534
 epoch: 64, train_loss: 0.8378, test_loss: 1.0215, test_f1: 0.5616
 epoch: 65, train_loss: 0.8359, test_loss: 1.0132, test_f1: 0.5442
 epoch: 66, train_loss: 0.8352, test_loss: 1.0089, test_f1: 0.5632
 epoch: 67, train_loss: 0.8328, test_loss: 1.0064, test_f1: 0.5686
 epoch: 68, train_loss: 0.8451, test_loss: 1.0094, test_f1: 0.5755
 epoch: 69, train_loss: 0.8427, test_loss: 1.0103, test_f1: 0.5668
 epoch: 70, train_loss: 0.8200, test_loss: 1.0009, test_f1: 0.5690
 epoch: 71, train_loss: 0.8187, test_loss: 0.9974, test_f1: 0.5632
 epoch: 72, train_loss: 0.8179, test_loss: 1.0019, test_f1: 0.5679
 epoch: 73, train_loss: 0.8171, test_loss: 1.0019, test_f1: 0.5599
 epoch: 74, train_loss: 0.8156, test_loss: 1.0017, test_f1: 0.5626
 epoch: 75, train_loss: 0.8126, test_loss: 0.9982, test_f1: 0.5604
 epoch: 76, train_loss: 0.8219, test_loss: 0.9892, test_f1: 0.5664
 epoch: 77, train_loss: 0.8232, test_loss: 0.9905, test_f1: 0.5712
 epoch: 78, train_loss: 0.8107, test_loss: 1.0028, test_f1: 0.5763
 epoch: 79, train_loss: 0.8120, test_loss: 1.0126, test_f1: 0.5723
 epoch: 80, train_loss: 0.8209, test_loss: 0.9977, test_f1: 0.5733
 epoch: 81, train_loss: 0.8007, test_loss: 0.9981, test_f1: 0.5693
 epoch: 82, train_loss: 0.8147, test_loss: 1.0018, test_f1: 0.5733
 epoch: 83, train_loss: 0.8094, test_loss: 1.0070, test_f1: 0.5653
 epoch: 84, train_loss: 0.8189, test_loss: 1.0126, test_f1: 0.5786
 epoch: 85, train_loss: 0.8049, test_loss: 1.0041, test_f1: 0.5713
 epoch: 86, train_loss: 0.8072, test_loss: 0.9955, test_f1: 0.5766
 epoch: 87, train_loss: 0.8049, test_loss: 0.9971, test_f1: 0.5685
 epoch: 88, train_loss: 0.7982, test_loss: 0.9954, test_f1: 0.5654
 epoch: 89, train_loss: 0.8039, test_loss: 1.0076, test_f1: 0.5755
 epoch: 90, train_loss: 0.8110, test_loss: 0.9990, test_f1: 0.5784
 epoch: 91, train_loss: 0.7981, test_loss: 1.0088, test_f1: 0.5684
 epoch: 92, train_loss: 0.7976, test_loss: 1.0025, test_f1: 0.5886
 epoch: 93, train_loss: 0.8089, test_loss: 1.0050, test_f1: 0.5848
 epoch: 94, train_loss: 0.7970, test_loss: 1.0137, test_f1: 0.5853
 epoch: 95, train_loss: 0.7993, test_loss: 1.0062, test_f1: 0.5816
 epoch: 96, train_loss: 0.7899, test_loss: 0.9998, test_f1: 0.5782
 epoch: 97, train_loss: 0.7933, test_loss: 0.9961, test_f1: 0.5646
 epoch: 98, train_loss: 0.8072, test_loss: 1.0014, test_f1: 0.5827
 epoch: 99, train_loss: 0.7866, test_loss: 1.0011, test_f1: 0.5809
##################ITERATION #8 ****************************************
 epoch: 0, train_loss: 1.2964, test_loss: 1.3415, test_f1: 0.2407
 epoch: 1, train_loss: 1.2027, test_loss: 1.3073, test_f1: 0.2545
 epoch: 2, train_loss: 1.1577, test_loss: 1.2804, test_f1: 0.3493
 epoch: 3, train_loss: 1.1294, test_loss: 1.2361, test_f1: 0.4191
 epoch: 4, train_loss: 1.1217, test_loss: 1.2018, test_f1: 0.4017
 epoch: 5, train_loss: 1.1011, test_loss: 1.1777, test_f1: 0.4229
 epoch: 6, train_loss: 1.0933, test_loss: 1.1569, test_f1: 0.4487
 epoch: 7, train_loss: 1.0772, test_loss: 1.1354, test_f1: 0.4545
 epoch: 8, train_loss: 1.0616, test_loss: 1.1206, test_f1: 0.4562
 epoch: 9, train_loss: 1.0575, test_loss: 1.1144, test_f1: 0.4547
 epoch: 10, train_loss: 1.0365, test_loss: 1.1172, test_f1: 0.4485
 epoch: 11, train_loss: 1.0359, test_loss: 1.1078, test_f1: 0.4633
 epoch: 12, train_loss: 1.0128, test_loss: 1.0978, test_f1: 0.4728
 epoch: 13, train_loss: 1.0243, test_loss: 1.1067, test_f1: 0.4698
 epoch: 14, train_loss: 1.0110, test_loss: 1.0956, test_f1: 0.4873
 epoch: 15, train_loss: 0.9970, test_loss: 1.0794, test_f1: 0.4949
 epoch: 16, train_loss: 0.9936, test_loss: 1.0707, test_f1: 0.4860
 epoch: 17, train_loss: 0.9893, test_loss: 1.0731, test_f1: 0.5073
 epoch: 18, train_loss: 0.9875, test_loss: 1.0742, test_f1: 0.5167
 epoch: 19, train_loss: 0.9655, test_loss: 1.0593, test_f1: 0.5117
 epoch: 20, train_loss: 0.9650, test_loss: 1.0630, test_f1: 0.5223
 epoch: 21, train_loss: 0.9572, test_loss: 1.0637, test_f1: 0.5226
 epoch: 22, train_loss: 0.9615, test_loss: 1.0567, test_f1: 0.5224
 epoch: 23, train_loss: 0.9498, test_loss: 1.0627, test_f1: 0.5252
 epoch: 24, train_loss: 0.9373, test_loss: 1.0620, test_f1: 0.5146
 epoch: 25, train_loss: 0.9436, test_loss: 1.0576, test_f1: 0.5276
 epoch: 26, train_loss: 0.9413, test_loss: 1.0468, test_f1: 0.5386
 epoch: 27, train_loss: 0.9290, test_loss: 1.0405, test_f1: 0.5276
 epoch: 28, train_loss: 0.9181, test_loss: 1.0359, test_f1: 0.5383
 epoch: 29, train_loss: 0.9130, test_loss: 1.0408, test_f1: 0.5521
 epoch: 30, train_loss: 0.9125, test_loss: 1.0422, test_f1: 0.5559
 epoch: 31, train_loss: 0.9071, test_loss: 1.0494, test_f1: 0.5542
 epoch: 32, train_loss: 0.9032, test_loss: 1.0376, test_f1: 0.5435
 epoch: 33, train_loss: 0.8913, test_loss: 1.0583, test_f1: 0.5457
 epoch: 34, train_loss: 0.8920, test_loss: 1.0296, test_f1: 0.5387
 epoch: 35, train_loss: 0.8943, test_loss: 1.0356, test_f1: 0.5560
 epoch: 36, train_loss: 0.8912, test_loss: 1.0595, test_f1: 0.5455
 epoch: 37, train_loss: 0.8776, test_loss: 1.0307, test_f1: 0.5533
 epoch: 38, train_loss: 0.8818, test_loss: 1.0543, test_f1: 0.5567
 epoch: 39, train_loss: 0.8787, test_loss: 1.0606, test_f1: 0.5501
 epoch: 40, train_loss: 0.8737, test_loss: 1.0463, test_f1: 0.5457
 epoch: 41, train_loss: 0.8612, test_loss: 1.0754, test_f1: 0.5603
 epoch: 42, train_loss: 0.8544, test_loss: 1.0648, test_f1: 0.5573
 epoch: 43, train_loss: 0.8600, test_loss: 1.0551, test_f1: 0.5649
 epoch: 44, train_loss: 0.8578, test_loss: 1.0661, test_f1: 0.5561
 epoch: 45, train_loss: 0.8603, test_loss: 1.0572, test_f1: 0.5555
 epoch: 46, train_loss: 0.8376, test_loss: 1.0603, test_f1: 0.5647
 epoch: 47, train_loss: 0.8513, test_loss: 1.0610, test_f1: 0.5643
 epoch: 48, train_loss: 0.8414, test_loss: 1.0779, test_f1: 0.5725
 epoch: 49, train_loss: 0.8293, test_loss: 1.0679, test_f1: 0.5735
 epoch: 50, train_loss: 0.8213, test_loss: 1.0641, test_f1: 0.5751
 epoch: 51, train_loss: 0.8166, test_loss: 1.0634, test_f1: 0.5775
 epoch: 52, train_loss: 0.8280, test_loss: 1.0646, test_f1: 0.5719
 epoch: 53, train_loss: 0.8149, test_loss: 1.0804, test_f1: 0.5700
 epoch: 54, train_loss: 0.8219, test_loss: 1.0684, test_f1: 0.5770
 epoch: 55, train_loss: 0.8141, test_loss: 1.0818, test_f1: 0.5769
 epoch: 56, train_loss: 0.8041, test_loss: 1.0797, test_f1: 0.5688
 epoch: 57, train_loss: 0.8179, test_loss: 1.0774, test_f1: 0.5676
 epoch: 58, train_loss: 0.8181, test_loss: 1.1038, test_f1: 0.5717
 epoch: 59, train_loss: 0.8064, test_loss: 1.0916, test_f1: 0.5711
 epoch: 60, train_loss: 0.8273, test_loss: 1.0977, test_f1: 0.5719
 epoch: 61, train_loss: 0.8288, test_loss: 1.1045, test_f1: 0.5623
 epoch: 62, train_loss: 0.8098, test_loss: 1.0888, test_f1: 0.5737
 epoch: 63, train_loss: 0.8084, test_loss: 1.0974, test_f1: 0.5734
 epoch: 64, train_loss: 0.7882, test_loss: 1.1062, test_f1: 0.5818
 epoch: 65, train_loss: 0.7947, test_loss: 1.0953, test_f1: 0.5789
 epoch: 66, train_loss: 0.8020, test_loss: 1.1124, test_f1: 0.5716
 epoch: 67, train_loss: 0.7829, test_loss: 1.1207, test_f1: 0.5678
 epoch: 68, train_loss: 0.8002, test_loss: 1.1106, test_f1: 0.5676
 epoch: 69, train_loss: 0.7954, test_loss: 1.1043, test_f1: 0.5769
 epoch: 70, train_loss: 0.8003, test_loss: 1.1318, test_f1: 0.5703
 epoch: 71, train_loss: 0.7979, test_loss: 1.1211, test_f1: 0.5849
 epoch: 72, train_loss: 0.7806, test_loss: 1.1005, test_f1: 0.5828
 epoch: 73, train_loss: 0.7976, test_loss: 1.0980, test_f1: 0.5963
 epoch: 74, train_loss: 0.7884, test_loss: 1.1039, test_f1: 0.5952
 epoch: 75, train_loss: 0.7916, test_loss: 1.1219, test_f1: 0.5886
 epoch: 76, train_loss: 0.7886, test_loss: 1.1324, test_f1: 0.5912
 epoch: 77, train_loss: 0.7839, test_loss: 1.1560, test_f1: 0.5915
 epoch: 78, train_loss: 0.7729, test_loss: 1.1309, test_f1: 0.5952
 epoch: 79, train_loss: 0.7848, test_loss: 1.1278, test_f1: 0.5892
 epoch: 80, train_loss: 0.7779, test_loss: 1.1342, test_f1: 0.5746
 epoch: 81, train_loss: 0.7831, test_loss: 1.1229, test_f1: 0.5941
 epoch: 82, train_loss: 0.7736, test_loss: 1.1399, test_f1: 0.5857
 epoch: 83, train_loss: 0.7700, test_loss: 1.1393, test_f1: 0.5838
 epoch: 84, train_loss: 0.7748, test_loss: 1.1694, test_f1: 0.5786
 epoch: 85, train_loss: 0.7793, test_loss: 1.1441, test_f1: 0.5946
 epoch: 86, train_loss: 0.7794, test_loss: 1.1599, test_f1: 0.5842
 epoch: 87, train_loss: 0.7663, test_loss: 1.1622, test_f1: 0.5755
 epoch: 88, train_loss: 0.7648, test_loss: 1.1474, test_f1: 0.5818
 epoch: 89, train_loss: 0.7771, test_loss: 1.1393, test_f1: 0.5818
 epoch: 90, train_loss: 0.7719, test_loss: 1.1381, test_f1: 0.5775
 epoch: 91, train_loss: 0.7719, test_loss: 1.1673, test_f1: 0.5977
 epoch: 92, train_loss: 0.7649, test_loss: 1.1883, test_f1: 0.5935
 epoch: 93, train_loss: 0.7804, test_loss: 1.1511, test_f1: 0.5704
 epoch: 94, train_loss: 0.7607, test_loss: 1.1429, test_f1: 0.5771
 epoch: 95, train_loss: 0.7525, test_loss: 1.1852, test_f1: 0.5697
 epoch: 96, train_loss: 0.7602, test_loss: 1.1980, test_f1: 0.5763
 epoch: 97, train_loss: 0.7511, test_loss: 1.1403, test_f1: 0.5931
 epoch: 98, train_loss: 0.7676, test_loss: 1.1894, test_f1: 0.5764
 epoch: 99, train_loss: 0.7578, test_loss: 1.1731, test_f1: 0.5954
##################ITERATION #9 ****************************************
 epoch: 0, train_loss: 1.2886, test_loss: 1.3647, test_f1: 0.2281
 epoch: 1, train_loss: 1.1861, test_loss: 1.4681, test_f1: 0.0727
 epoch: 2, train_loss: 1.1694, test_loss: 1.4380, test_f1: 0.1138
 epoch: 3, train_loss: 1.1385, test_loss: 1.3423, test_f1: 0.2775
 epoch: 4, train_loss: 1.1191, test_loss: 1.2341, test_f1: 0.3673
 epoch: 5, train_loss: 1.1032, test_loss: 1.1884, test_f1: 0.3761
 epoch: 6, train_loss: 1.0850, test_loss: 1.1550, test_f1: 0.4349
 epoch: 7, train_loss: 1.0768, test_loss: 1.1373, test_f1: 0.4658
 epoch: 8, train_loss: 1.0615, test_loss: 1.1294, test_f1: 0.4830
 epoch: 9, train_loss: 1.0587, test_loss: 1.1228, test_f1: 0.5087
 epoch: 10, train_loss: 1.0340, test_loss: 1.1131, test_f1: 0.4898
 epoch: 11, train_loss: 1.0357, test_loss: 1.1029, test_f1: 0.5194
 epoch: 12, train_loss: 1.0226, test_loss: 1.0999, test_f1: 0.5183
 epoch: 13, train_loss: 1.0294, test_loss: 1.0905, test_f1: 0.5245
 epoch: 14, train_loss: 1.0081, test_loss: 1.0790, test_f1: 0.5325
 epoch: 15, train_loss: 0.9964, test_loss: 1.0824, test_f1: 0.5149
 epoch: 16, train_loss: 1.0004, test_loss: 1.0775, test_f1: 0.5301
 epoch: 17, train_loss: 0.9861, test_loss: 1.0648, test_f1: 0.5313
 epoch: 18, train_loss: 0.9868, test_loss: 1.0624, test_f1: 0.5370
 epoch: 19, train_loss: 0.9778, test_loss: 1.0563, test_f1: 0.5398
 epoch: 20, train_loss: 0.9783, test_loss: 1.0555, test_f1: 0.5325
 epoch: 21, train_loss: 0.9750, test_loss: 1.0603, test_f1: 0.5329
 epoch: 22, train_loss: 0.9572, test_loss: 1.0583, test_f1: 0.5274
 epoch: 23, train_loss: 0.9495, test_loss: 1.0545, test_f1: 0.5276
 epoch: 24, train_loss: 0.9371, test_loss: 1.0440, test_f1: 0.5256
 epoch: 25, train_loss: 0.9360, test_loss: 1.0402, test_f1: 0.5309
 epoch: 26, train_loss: 0.9307, test_loss: 1.0400, test_f1: 0.5387
 epoch: 27, train_loss: 0.9394, test_loss: 1.0441, test_f1: 0.5280
 epoch: 28, train_loss: 0.9290, test_loss: 1.0603, test_f1: 0.5356
 epoch: 29, train_loss: 0.9244, test_loss: 1.0479, test_f1: 0.5365
 epoch: 30, train_loss: 0.9140, test_loss: 1.0459, test_f1: 0.5291
 epoch: 31, train_loss: 0.9160, test_loss: 1.0373, test_f1: 0.5408
 epoch: 32, train_loss: 0.9096, test_loss: 1.0196, test_f1: 0.5399
 epoch: 33, train_loss: 0.9094, test_loss: 1.0180, test_f1: 0.5500
 epoch: 34, train_loss: 0.9017, test_loss: 1.0290, test_f1: 0.5514
 epoch: 35, train_loss: 0.8948, test_loss: 1.0290, test_f1: 0.5542
 epoch: 36, train_loss: 0.8923, test_loss: 1.0504, test_f1: 0.5589
 epoch: 37, train_loss: 0.8947, test_loss: 1.0396, test_f1: 0.5581
 epoch: 38, train_loss: 0.8747, test_loss: 1.0342, test_f1: 0.5643
 epoch: 39, train_loss: 0.8886, test_loss: 1.0102, test_f1: 0.5578
 epoch: 40, train_loss: 0.8784, test_loss: 1.0163, test_f1: 0.5670
 epoch: 41, train_loss: 0.8613, test_loss: 1.0159, test_f1: 0.5731
 epoch: 42, train_loss: 0.8699, test_loss: 1.0312, test_f1: 0.5666
 epoch: 43, train_loss: 0.8745, test_loss: 1.0290, test_f1: 0.5729
 epoch: 44, train_loss: 0.8614, test_loss: 1.0196, test_f1: 0.5737
 epoch: 45, train_loss: 0.8577, test_loss: 1.0258, test_f1: 0.5642
 epoch: 46, train_loss: 0.8603, test_loss: 1.0151, test_f1: 0.5810
 epoch: 47, train_loss: 0.8581, test_loss: 1.0250, test_f1: 0.5733
 epoch: 48, train_loss: 0.8517, test_loss: 1.0161, test_f1: 0.5849
 epoch: 49, train_loss: 0.8380, test_loss: 1.0185, test_f1: 0.5761
 epoch: 50, train_loss: 0.8334, test_loss: 1.0187, test_f1: 0.5827
 epoch: 51, train_loss: 0.8386, test_loss: 1.0303, test_f1: 0.5824
 epoch: 52, train_loss: 0.8378, test_loss: 1.0391, test_f1: 0.5774
 epoch: 53, train_loss: 0.8352, test_loss: 1.0337, test_f1: 0.5888
 epoch: 54, train_loss: 0.8327, test_loss: 1.0289, test_f1: 0.5909
 epoch: 55, train_loss: 0.8331, test_loss: 1.0250, test_f1: 0.5832
 epoch: 56, train_loss: 0.8166, test_loss: 1.0166, test_f1: 0.5885
 epoch: 57, train_loss: 0.8325, test_loss: 1.0219, test_f1: 0.5960
 epoch: 58, train_loss: 0.8271, test_loss: 1.0361, test_f1: 0.5900
 epoch: 59, train_loss: 0.8238, test_loss: 1.0283, test_f1: 0.5807
 epoch: 60, train_loss: 0.8235, test_loss: 1.0291, test_f1: 0.5933
 epoch: 61, train_loss: 0.8321, test_loss: 1.0279, test_f1: 0.5962
 epoch: 62, train_loss: 0.8197, test_loss: 1.0145, test_f1: 0.5959
 epoch: 63, train_loss: 0.8201, test_loss: 1.0109, test_f1: 0.5988
 epoch: 64, train_loss: 0.8048, test_loss: 1.0066, test_f1: 0.6026
 epoch: 65, train_loss: 0.8148, test_loss: 1.0185, test_f1: 0.5916
 epoch: 66, train_loss: 0.8172, test_loss: 1.0169, test_f1: 0.5869
 epoch: 67, train_loss: 0.8136, test_loss: 1.0177, test_f1: 0.5917
 epoch: 68, train_loss: 0.8006, test_loss: 1.0443, test_f1: 0.5968
 epoch: 69, train_loss: 0.8085, test_loss: 1.0478, test_f1: 0.5915
 epoch: 70, train_loss: 0.7985, test_loss: 1.0260, test_f1: 0.6042
 epoch: 71, train_loss: 0.8063, test_loss: 1.0321, test_f1: 0.5989
 epoch: 72, train_loss: 0.8036, test_loss: 1.0461, test_f1: 0.5986
 epoch: 73, train_loss: 0.8030, test_loss: 1.0315, test_f1: 0.6036
 epoch: 74, train_loss: 0.8072, test_loss: 1.0307, test_f1: 0.6010
 epoch: 75, train_loss: 0.7964, test_loss: 1.0432, test_f1: 0.5841
 epoch: 76, train_loss: 0.7892, test_loss: 1.0400, test_f1: 0.5858
 epoch: 77, train_loss: 0.7841, test_loss: 1.0319, test_f1: 0.5889
 epoch: 78, train_loss: 0.8004, test_loss: 1.0314, test_f1: 0.6045
 epoch: 79, train_loss: 0.7899, test_loss: 1.0299, test_f1: 0.6050
 epoch: 80, train_loss: 0.8045, test_loss: 1.0367, test_f1: 0.5919
 epoch: 81, train_loss: 0.7894, test_loss: 1.0390, test_f1: 0.5868
 epoch: 82, train_loss: 0.7887, test_loss: 1.0445, test_f1: 0.5777
 epoch: 83, train_loss: 0.7947, test_loss: 1.0349, test_f1: 0.5899
 epoch: 84, train_loss: 0.7899, test_loss: 1.0284, test_f1: 0.5871
 epoch: 85, train_loss: 0.7860, test_loss: 1.0210, test_f1: 0.5968
 epoch: 86, train_loss: 0.7897, test_loss: 1.0376, test_f1: 0.5995
 epoch: 87, train_loss: 0.7888, test_loss: 1.0459, test_f1: 0.5768
 epoch: 88, train_loss: 0.7772, test_loss: 1.0322, test_f1: 0.5938
 epoch: 89, train_loss: 0.7781, test_loss: 1.0324, test_f1: 0.5969
 epoch: 90, train_loss: 0.7811, test_loss: 1.0343, test_f1: 0.6009
 epoch: 91, train_loss: 0.7789, test_loss: 1.0431, test_f1: 0.5937
 epoch: 92, train_loss: 0.7753, test_loss: 1.0593, test_f1: 0.5912
 epoch: 93, train_loss: 0.7725, test_loss: 1.0395, test_f1: 0.5919
 epoch: 94, train_loss: 0.7711, test_loss: 1.0425, test_f1: 0.5965
 epoch: 95, train_loss: 0.7718, test_loss: 1.0650, test_f1: 0.5686
 epoch: 96, train_loss: 0.7650, test_loss: 1.0515, test_f1: 0.5887
 epoch: 97, train_loss: 0.7647, test_loss: 1.0528, test_f1: 0.5926
 epoch: 98, train_loss: 0.7641, test_loss: 1.0474, test_f1: 0.6002
 epoch: 99, train_loss: 0.7730, test_loss: 1.0579, test_f1: 0.5837

Training completed in 371.32 seconds
Best F1: 0.6050 at epoch 79
Mean F1 across iterations: 0.5849  0.0158
========================FINAL RESULTS================================
FEGIN weighted F1: 0.6050  0.0158
python main.py --data ltspice_demos --representation component_net --model FEGIN --layers 5 --hiddens 64 --batch_size 128 --lr 0.0001 --emb_size 512 --epochs 100 --save_appendix component_net_L5_H64_BS128_LR0.0001_E512 --no_val
-----



STDERR:
  File "main.py", line 370, in <module>
    main()
  File "main.py", line 254, in main
    dataset = dataset_class(
  File "/home/philip/projects/ltspice_examples_code_repo/Circuit-Completion-Using-GNNs/component_classification_with_link_prediction_head/evaluation/FEGIN/kernel/circuit_datasets.py", line 15, in __init__
    self.data, self.slices = torch.load(self.processed_paths[0])
  File "/home/philip/.local/lib/python3.8/site-packages/torch/serialization.py", line 1040, in load
    warnings.warn(
  File "/usr/lib/python3.8/warnings.py", line 109, in _showwarnmsg
    sw(msg.message, msg.category, msg.filename, msg.lineno,
  File "main.py", line 47, in warn_with_traceback
    traceback.print_stack(file=log)
/home/philip/projects/ltspice_examples_code_repo/Circuit-Completion-Using-GNNs/component_classification_with_link_prediction_head/evaluation/FEGIN/kernel/circuit_datasets.py:15: FutureWarning: You are using `torch.load` with `weights_only=False` (the current default value), which uses the default pickle module implicitly. It is possible to construct malicious pickle data which will execute arbitrary code during unpickling (See https://github.com/pytorch/pytorch/blob/main/SECURITY.md#untrusted-models for more details). In a future release, the default value for `weights_only` will be flipped to `True`. This limits the functions that could be executed during unpickling. Arbitrary objects will no longer be allowed to be loaded via this mode unless they are explicitly allowlisted by the user via `torch.serialization.add_safe_globals`. We recommend you start setting `weights_only=True` for any use case where you don't have full control of the loaded file. Please open an issue on GitHub for any issues related to this experimental feature.
  self.data, self.slices = torch.load(self.processed_paths[0])
