STDOUT:
Results will be saved in /home/philip/projects/ltspice_examples_code_repo/Circuit-Completion-Using-GNNs/component_classification_with_link_prediction_head/evaluation/FEGIN/results/model_FEGIN_dataset_ltspice_demos
Command line input: python main.py --data ltspice_demos --representation component_pin --model FEGIN --layers 3 --hiddens 128 --batch_size 64 --lr 0.01 --emb_size 512 --epochs 100 --save_appendix component_pin_L3_H128_BS64_LR0.01_E512 --no_val
 is saved.
-----
ltspice_demos - FEGIN
Using 3 layers, 128 hidden units, h = 2
Loading component_pin representation dataset
ENTERED
Training FEGIN on component_pin representation
Train: 1565, Test: 383
##################ITERATION #0 ****************************************
 epoch: 0, train_loss: 1.1887, test_loss: 1.2334, test_f1: 0.3018
 epoch: 1, train_loss: 1.0363, test_loss: 1.4056, test_f1: 0.4124
 epoch: 2, train_loss: 0.9690, test_loss: 1.1528, test_f1: 0.4088
 epoch: 3, train_loss: 0.9080, test_loss: 1.4420, test_f1: 0.3366
 epoch: 4, train_loss: 0.9125, test_loss: 1.0403, test_f1: 0.4138
 epoch: 5, train_loss: 0.8542, test_loss: 1.1940, test_f1: 0.5052
 epoch: 6, train_loss: 0.8903, test_loss: 1.1055, test_f1: 0.5058
 epoch: 7, train_loss: 0.8441, test_loss: 0.9967, test_f1: 0.4374
 epoch: 8, train_loss: 0.8151, test_loss: 1.0233, test_f1: 0.6009
 epoch: 9, train_loss: 0.8048, test_loss: 0.9905, test_f1: 0.5885
 epoch: 10, train_loss: 0.7987, test_loss: 1.0450, test_f1: 0.4591
 epoch: 11, train_loss: 0.7883, test_loss: 1.2028, test_f1: 0.4503
 epoch: 12, train_loss: 0.8234, test_loss: 1.0130, test_f1: 0.5471
 epoch: 13, train_loss: 0.7927, test_loss: 1.2571, test_f1: 0.5162
 epoch: 14, train_loss: 0.7782, test_loss: 1.1928, test_f1: 0.5814
 epoch: 15, train_loss: 0.7533, test_loss: 0.9860, test_f1: 0.6282
 epoch: 16, train_loss: 0.7410, test_loss: 1.1954, test_f1: 0.4533
 epoch: 17, train_loss: 0.7532, test_loss: 1.3209, test_f1: 0.4903
 epoch: 18, train_loss: 0.7773, test_loss: 2.0132, test_f1: 0.4297
 epoch: 19, train_loss: 0.7447, test_loss: 1.1583, test_f1: 0.5883
 epoch: 20, train_loss: 0.7100, test_loss: 1.5167, test_f1: 0.5508
 epoch: 21, train_loss: 0.7125, test_loss: 1.1354, test_f1: 0.5147
 epoch: 22, train_loss: 0.7486, test_loss: 0.9897, test_f1: 0.5831
 epoch: 23, train_loss: 0.7340, test_loss: 1.0298, test_f1: 0.6132
 epoch: 24, train_loss: 0.7104, test_loss: 0.9529, test_f1: 0.6392
 epoch: 25, train_loss: 0.6822, test_loss: 1.1399, test_f1: 0.5660
 epoch: 26, train_loss: 0.7309, test_loss: 1.1291, test_f1: 0.5760
 epoch: 27, train_loss: 0.6917, test_loss: 1.1264, test_f1: 0.5934
 epoch: 28, train_loss: 0.6821, test_loss: 1.0649, test_f1: 0.6067
 epoch: 29, train_loss: 0.6724, test_loss: 1.1345, test_f1: 0.6249
 epoch: 30, train_loss: 0.6764, test_loss: 0.8986, test_f1: 0.6593
 epoch: 31, train_loss: 0.6173, test_loss: 1.0743, test_f1: 0.6435
 epoch: 32, train_loss: 0.6402, test_loss: 1.0184, test_f1: 0.6455
 epoch: 33, train_loss: 0.6475, test_loss: 1.0379, test_f1: 0.6385
 epoch: 34, train_loss: 0.6266, test_loss: 1.6264, test_f1: 0.6157
 epoch: 35, train_loss: 0.6245, test_loss: 1.1772, test_f1: 0.6178
 epoch: 36, train_loss: 0.5964, test_loss: 1.1095, test_f1: 0.6845
 epoch: 37, train_loss: 0.5822, test_loss: 1.8474, test_f1: 0.5875
 epoch: 38, train_loss: 0.6203, test_loss: 1.0162, test_f1: 0.6473
 epoch: 39, train_loss: 0.6055, test_loss: 1.3197, test_f1: 0.5652
 epoch: 40, train_loss: 0.6297, test_loss: 1.0514, test_f1: 0.6459
 epoch: 41, train_loss: 0.5889, test_loss: 1.9723, test_f1: 0.5595
 epoch: 42, train_loss: 0.5794, test_loss: 1.0733, test_f1: 0.6014
 epoch: 43, train_loss: 0.5710, test_loss: 1.3838, test_f1: 0.5916
 epoch: 44, train_loss: 0.6208, test_loss: 1.2130, test_f1: 0.5970
 epoch: 45, train_loss: 0.5877, test_loss: 1.2788, test_f1: 0.6521
 epoch: 46, train_loss: 0.5507, test_loss: 1.2734, test_f1: 0.5745
 epoch: 47, train_loss: 0.5172, test_loss: 1.6750, test_f1: 0.6459
 epoch: 48, train_loss: 0.5687, test_loss: 1.0922, test_f1: 0.6069
 epoch: 49, train_loss: 0.5292, test_loss: 1.3966, test_f1: 0.5933
 epoch: 50, train_loss: 0.5755, test_loss: 1.6990, test_f1: 0.5519
 epoch: 51, train_loss: 0.5269, test_loss: 1.2200, test_f1: 0.6609
 epoch: 52, train_loss: 0.4490, test_loss: 1.3357, test_f1: 0.6444
 epoch: 53, train_loss: 0.4273, test_loss: 1.2558, test_f1: 0.6505
 epoch: 54, train_loss: 0.4210, test_loss: 1.4335, test_f1: 0.6117
 epoch: 55, train_loss: 0.4096, test_loss: 1.4163, test_f1: 0.6356
 epoch: 56, train_loss: 0.3860, test_loss: 1.9252, test_f1: 0.6140
 epoch: 57, train_loss: 0.4230, test_loss: 1.1590, test_f1: 0.7108
 epoch: 58, train_loss: 0.4011, test_loss: 1.6860, test_f1: 0.6363
 epoch: 59, train_loss: 0.3843, test_loss: 1.8032, test_f1: 0.6676
 epoch: 60, train_loss: 0.4077, test_loss: 1.3927, test_f1: 0.6802
 epoch: 61, train_loss: 0.3610, test_loss: 1.7012, test_f1: 0.6672
 epoch: 62, train_loss: 0.3458, test_loss: 1.7764, test_f1: 0.6558
 epoch: 63, train_loss: 0.3869, test_loss: 1.5489, test_f1: 0.6316
 epoch: 64, train_loss: 0.3833, test_loss: 1.4679, test_f1: 0.6413
 epoch: 65, train_loss: 0.3602, test_loss: 1.7746, test_f1: 0.6680
 epoch: 66, train_loss: 0.3255, test_loss: 1.8528, test_f1: 0.6425
 epoch: 67, train_loss: 0.4027, test_loss: 1.5902, test_f1: 0.6093
 epoch: 68, train_loss: 0.3532, test_loss: 1.7869, test_f1: 0.6324
 epoch: 69, train_loss: 0.3302, test_loss: 1.6240, test_f1: 0.6089
 epoch: 70, train_loss: 0.3446, test_loss: 1.5472, test_f1: 0.6866
 epoch: 71, train_loss: 0.3534, test_loss: 1.6681, test_f1: 0.6766
 epoch: 72, train_loss: 0.3150, test_loss: 1.7848, test_f1: 0.6413
 epoch: 73, train_loss: 0.3223, test_loss: 1.8865, test_f1: 0.6178
 epoch: 74, train_loss: 0.3089, test_loss: 1.6838, test_f1: 0.6747
 epoch: 75, train_loss: 0.3898, test_loss: 1.5117, test_f1: 0.6689
 epoch: 76, train_loss: 0.3734, test_loss: 1.2640, test_f1: 0.6806
 epoch: 77, train_loss: 0.3574, test_loss: 1.4264, test_f1: 0.6735
 epoch: 78, train_loss: 0.3053, test_loss: 1.6432, test_f1: 0.6222
 epoch: 79, train_loss: 0.2997, test_loss: 2.0065, test_f1: 0.5923
 epoch: 80, train_loss: 0.2942, test_loss: 1.6931, test_f1: 0.6376
 epoch: 81, train_loss: 0.2439, test_loss: 1.5355, test_f1: 0.6661
 epoch: 82, train_loss: 0.2848, test_loss: 1.7751, test_f1: 0.6557
 epoch: 83, train_loss: 0.2926, test_loss: 1.4405, test_f1: 0.6296
 epoch: 84, train_loss: 0.2978, test_loss: 1.5291, test_f1: 0.6564
 epoch: 85, train_loss: 0.2510, test_loss: 1.7978, test_f1: 0.6423
 epoch: 86, train_loss: 0.2453, test_loss: 1.5906, test_f1: 0.6933
 epoch: 87, train_loss: 0.2988, test_loss: 2.0029, test_f1: 0.6026
 epoch: 88, train_loss: 0.2435, test_loss: 1.8498, test_f1: 0.6819
 epoch: 89, train_loss: 0.2589, test_loss: 1.6816, test_f1: 0.6354
 epoch: 90, train_loss: 0.2795, test_loss: 2.7141, test_f1: 0.5920
 epoch: 91, train_loss: 0.2590, test_loss: 1.6217, test_f1: 0.6556
 epoch: 92, train_loss: 0.2412, test_loss: 2.2226, test_f1: 0.6098
 epoch: 93, train_loss: 0.2361, test_loss: 1.8953, test_f1: 0.6550
 epoch: 94, train_loss: 0.2244, test_loss: 1.7961, test_f1: 0.6162
 epoch: 95, train_loss: 0.2729, test_loss: 1.7198, test_f1: 0.6445
 epoch: 96, train_loss: 0.2367, test_loss: 1.8995, test_f1: 0.6159
 epoch: 97, train_loss: 0.2206, test_loss: 2.0855, test_f1: 0.6230
 epoch: 98, train_loss: 0.2351, test_loss: 1.8822, test_f1: 0.6790
 epoch: 99, train_loss: 0.2189, test_loss: 2.0671, test_f1: 0.6085
##################ITERATION #1 ****************************************
 epoch: 0, train_loss: 1.2171, test_loss: 1.5355, test_f1: 0.2862
 epoch: 1, train_loss: 0.9515, test_loss: 1.0377, test_f1: 0.5536
 epoch: 2, train_loss: 0.8747, test_loss: 1.1186, test_f1: 0.5293
 epoch: 3, train_loss: 0.8507, test_loss: 1.0638, test_f1: 0.5533
 epoch: 4, train_loss: 0.8574, test_loss: 1.0473, test_f1: 0.4665
 epoch: 5, train_loss: 0.8556, test_loss: 1.0050, test_f1: 0.6158
 epoch: 6, train_loss: 0.8116, test_loss: 1.0269, test_f1: 0.5454
 epoch: 7, train_loss: 0.7926, test_loss: 1.0392, test_f1: 0.5356
 epoch: 8, train_loss: 0.7728, test_loss: 1.3811, test_f1: 0.3874
 epoch: 9, train_loss: 0.7544, test_loss: 1.0206, test_f1: 0.5506
 epoch: 10, train_loss: 0.7708, test_loss: 0.9291, test_f1: 0.5899
 epoch: 11, train_loss: 0.7188, test_loss: 1.0951, test_f1: 0.5639
 epoch: 12, train_loss: 0.7297, test_loss: 1.0626, test_f1: 0.5360
 epoch: 13, train_loss: 0.7464, test_loss: 1.1102, test_f1: 0.5944
 epoch: 14, train_loss: 0.6912, test_loss: 1.0513, test_f1: 0.6165
 epoch: 15, train_loss: 0.6693, test_loss: 0.9835, test_f1: 0.5918
 epoch: 16, train_loss: 0.6931, test_loss: 1.2029, test_f1: 0.4846
 epoch: 17, train_loss: 0.6830, test_loss: 1.0131, test_f1: 0.6573
 epoch: 18, train_loss: 0.6604, test_loss: 0.9914, test_f1: 0.6410
 epoch: 19, train_loss: 0.6401, test_loss: 1.3058, test_f1: 0.6134
 epoch: 20, train_loss: 0.6346, test_loss: 1.4459, test_f1: 0.5412
 epoch: 21, train_loss: 0.6310, test_loss: 1.0995, test_f1: 0.5910
 epoch: 22, train_loss: 0.6102, test_loss: 1.0545, test_f1: 0.6487
 epoch: 23, train_loss: 0.5862, test_loss: 1.1691, test_f1: 0.6484
 epoch: 24, train_loss: 0.5917, test_loss: 1.1426, test_f1: 0.6225
 epoch: 25, train_loss: 0.5938, test_loss: 1.2933, test_f1: 0.6453
 epoch: 26, train_loss: 0.6268, test_loss: 0.9945, test_f1: 0.5861
 epoch: 27, train_loss: 0.5578, test_loss: 1.0549, test_f1: 0.6368
 epoch: 28, train_loss: 0.5692, test_loss: 1.3312, test_f1: 0.6134
 epoch: 29, train_loss: 0.5759, test_loss: 1.0111, test_f1: 0.5979
 epoch: 30, train_loss: 0.5659, test_loss: 1.2536, test_f1: 0.6247
 epoch: 31, train_loss: 0.5942, test_loss: 1.0470, test_f1: 0.5334
 epoch: 32, train_loss: 0.5518, test_loss: 1.0522, test_f1: 0.6591
 epoch: 33, train_loss: 0.5290, test_loss: 1.1366, test_f1: 0.5681
 epoch: 34, train_loss: 0.4933, test_loss: 8.5192, test_f1: 0.5006
 epoch: 35, train_loss: 0.5812, test_loss: 1.3508, test_f1: 0.6149
 epoch: 36, train_loss: 0.6125, test_loss: 1.4787, test_f1: 0.5214
 epoch: 37, train_loss: 0.5350, test_loss: 1.6422, test_f1: 0.6047
 epoch: 38, train_loss: 0.4915, test_loss: 1.3851, test_f1: 0.6061
 epoch: 39, train_loss: 0.5063, test_loss: 1.3105, test_f1: 0.5899
 epoch: 40, train_loss: 0.5065, test_loss: 1.5109, test_f1: 0.5976
 epoch: 41, train_loss: 0.4862, test_loss: 1.3626, test_f1: 0.5492
 epoch: 42, train_loss: 0.5077, test_loss: 1.7086, test_f1: 0.6043
 epoch: 43, train_loss: 0.4749, test_loss: 1.2615, test_f1: 0.6201
 epoch: 44, train_loss: 0.4840, test_loss: 1.1455, test_f1: 0.6381
 epoch: 45, train_loss: 0.4563, test_loss: 1.6542, test_f1: 0.5893
 epoch: 46, train_loss: 0.4555, test_loss: 1.5794, test_f1: 0.5308
 epoch: 47, train_loss: 0.4910, test_loss: 1.2033, test_f1: 0.6267
 epoch: 48, train_loss: 0.4462, test_loss: 1.3007, test_f1: 0.6123
 epoch: 49, train_loss: 0.4331, test_loss: 1.4496, test_f1: 0.6328
 epoch: 50, train_loss: 0.4074, test_loss: 1.7406, test_f1: 0.5864
 epoch: 51, train_loss: 0.3749, test_loss: 1.6841, test_f1: 0.6230
 epoch: 52, train_loss: 0.4031, test_loss: 1.4304, test_f1: 0.6195
 epoch: 53, train_loss: 0.3392, test_loss: 1.6711, test_f1: 0.6395
 epoch: 54, train_loss: 0.3290, test_loss: 1.7084, test_f1: 0.6422
 epoch: 55, train_loss: 0.2943, test_loss: 2.0015, test_f1: 0.6302
 epoch: 56, train_loss: 0.2496, test_loss: 2.1797, test_f1: 0.6330
 epoch: 57, train_loss: 0.2926, test_loss: 2.0056, test_f1: 0.6196
 epoch: 58, train_loss: 0.3062, test_loss: 2.0025, test_f1: 0.6780
 epoch: 59, train_loss: 0.2939, test_loss: 2.1212, test_f1: 0.6466
 epoch: 60, train_loss: 0.2648, test_loss: 1.9672, test_f1: 0.6658
 epoch: 61, train_loss: 0.2755, test_loss: 1.9503, test_f1: 0.6296
 epoch: 62, train_loss: 0.2646, test_loss: 2.2435, test_f1: 0.6531
 epoch: 63, train_loss: 0.2795, test_loss: 2.1735, test_f1: 0.6336
 epoch: 64, train_loss: 0.2581, test_loss: 2.2967, test_f1: 0.6016
 epoch: 65, train_loss: 0.2559, test_loss: 1.9956, test_f1: 0.6831
 epoch: 66, train_loss: 0.2195, test_loss: 2.5869, test_f1: 0.6526
 epoch: 67, train_loss: 0.2508, test_loss: 2.4055, test_f1: 0.6623
 epoch: 68, train_loss: 0.2668, test_loss: 2.1207, test_f1: 0.6355
 epoch: 69, train_loss: 0.2211, test_loss: 2.6576, test_f1: 0.6527
 epoch: 70, train_loss: 0.2237, test_loss: 2.3817, test_f1: 0.6685
 epoch: 71, train_loss: 0.2333, test_loss: 2.4988, test_f1: 0.6459
 epoch: 72, train_loss: 0.2386, test_loss: 2.8888, test_f1: 0.6198
 epoch: 73, train_loss: 0.2330, test_loss: 2.4062, test_f1: 0.6369
 epoch: 74, train_loss: 0.2266, test_loss: 2.6725, test_f1: 0.6370
 epoch: 75, train_loss: 0.1983, test_loss: 2.3244, test_f1: 0.6299
 epoch: 76, train_loss: 0.2597, test_loss: 2.3832, test_f1: 0.6350
 epoch: 77, train_loss: 0.2184, test_loss: 2.5157, test_f1: 0.6242
 epoch: 78, train_loss: 0.1762, test_loss: 2.7533, test_f1: 0.6195
 epoch: 79, train_loss: 0.2309, test_loss: 2.4178, test_f1: 0.6247
 epoch: 80, train_loss: 0.2570, test_loss: 2.5896, test_f1: 0.6447
 epoch: 81, train_loss: 0.2273, test_loss: 2.4077, test_f1: 0.6565
 epoch: 82, train_loss: 0.1800, test_loss: 2.5698, test_f1: 0.6627
 epoch: 83, train_loss: 0.1741, test_loss: 2.6411, test_f1: 0.6271
 epoch: 84, train_loss: 0.1751, test_loss: 3.0225, test_f1: 0.6119
 epoch: 85, train_loss: 0.1616, test_loss: 2.7356, test_f1: 0.6150
 epoch: 86, train_loss: 0.1661, test_loss: 2.8139, test_f1: 0.6460
 epoch: 87, train_loss: 0.1597, test_loss: 2.6680, test_f1: 0.6418
 epoch: 88, train_loss: 0.1825, test_loss: 3.0907, test_f1: 0.6560
 epoch: 89, train_loss: 0.1978, test_loss: 3.0770, test_f1: 0.6009
 epoch: 90, train_loss: 0.1700, test_loss: 2.7617, test_f1: 0.6172
 epoch: 91, train_loss: 0.1604, test_loss: 2.3524, test_f1: 0.6519
 epoch: 92, train_loss: 0.1805, test_loss: 2.2140, test_f1: 0.6373
 epoch: 93, train_loss: 0.1389, test_loss: 2.6878, test_f1: 0.6305
 epoch: 94, train_loss: 0.1499, test_loss: 2.4658, test_f1: 0.6674
 epoch: 95, train_loss: 0.1925, test_loss: 2.2592, test_f1: 0.6281
 epoch: 96, train_loss: 0.1890, test_loss: 2.3257, test_f1: 0.6432
 epoch: 97, train_loss: 0.1494, test_loss: 2.5457, test_f1: 0.6684
 epoch: 98, train_loss: 0.1551, test_loss: 2.8546, test_f1: 0.6163
 epoch: 99, train_loss: 0.1659, test_loss: 2.5302, test_f1: 0.6846
##################ITERATION #2 ****************************************
 epoch: 0, train_loss: 1.1475, test_loss: 1.3296, test_f1: 0.4054
 epoch: 1, train_loss: 0.9659, test_loss: 1.1401, test_f1: 0.5047
 epoch: 2, train_loss: 0.9530, test_loss: 1.0279, test_f1: 0.5107
 epoch: 3, train_loss: 0.8909, test_loss: 0.9852, test_f1: 0.5533
 epoch: 4, train_loss: 0.8647, test_loss: 1.1219, test_f1: 0.4428
 epoch: 5, train_loss: 0.8673, test_loss: 1.1035, test_f1: 0.5267
 epoch: 6, train_loss: 0.8216, test_loss: 1.0228, test_f1: 0.5427
 epoch: 7, train_loss: 0.8056, test_loss: 1.2260, test_f1: 0.4252
 epoch: 8, train_loss: 0.7983, test_loss: 1.0434, test_f1: 0.5721
 epoch: 9, train_loss: 0.7679, test_loss: 1.3000, test_f1: 0.4267
 epoch: 10, train_loss: 0.7759, test_loss: 1.0771, test_f1: 0.4910
 epoch: 11, train_loss: 0.7623, test_loss: 1.0214, test_f1: 0.5737
 epoch: 12, train_loss: 0.7682, test_loss: 1.0760, test_f1: 0.5654
 epoch: 13, train_loss: 0.7802, test_loss: 1.0878, test_f1: 0.4967
 epoch: 14, train_loss: 0.7584, test_loss: 1.0591, test_f1: 0.5925
 epoch: 15, train_loss: 0.7682, test_loss: 1.0793, test_f1: 0.5813
 epoch: 16, train_loss: 0.7423, test_loss: 1.0707, test_f1: 0.5539
 epoch: 17, train_loss: 0.7257, test_loss: 1.1624, test_f1: 0.5316
 epoch: 18, train_loss: 0.6807, test_loss: 0.9596, test_f1: 0.5659
 epoch: 19, train_loss: 0.7026, test_loss: 1.2233, test_f1: 0.5334
 epoch: 20, train_loss: 0.7175, test_loss: 0.9649, test_f1: 0.6133
 epoch: 21, train_loss: 0.6960, test_loss: 1.0567, test_f1: 0.5826
 epoch: 22, train_loss: 0.6842, test_loss: 1.1315, test_f1: 0.5325
 epoch: 23, train_loss: 0.7180, test_loss: 1.1241, test_f1: 0.4802
 epoch: 24, train_loss: 0.7327, test_loss: 1.1193, test_f1: 0.5947
 epoch: 25, train_loss: 0.6931, test_loss: 1.0517, test_f1: 0.5828
 epoch: 26, train_loss: 0.6943, test_loss: 1.2258, test_f1: 0.5878
 epoch: 27, train_loss: 0.6513, test_loss: 1.3386, test_f1: 0.5382
 epoch: 28, train_loss: 0.6661, test_loss: 1.1590, test_f1: 0.5686
 epoch: 29, train_loss: 0.6721, test_loss: 1.4386, test_f1: 0.5820
 epoch: 30, train_loss: 0.6598, test_loss: 1.2316, test_f1: 0.5303
 epoch: 31, train_loss: 0.6716, test_loss: 1.2930, test_f1: 0.6090
 epoch: 32, train_loss: 0.6480, test_loss: 1.1273, test_f1: 0.6271
 epoch: 33, train_loss: 0.6068, test_loss: 1.2740, test_f1: 0.6010
 epoch: 34, train_loss: 0.5874, test_loss: 1.3108, test_f1: 0.5735
 epoch: 35, train_loss: 0.6102, test_loss: 1.2088, test_f1: 0.5844
 epoch: 36, train_loss: 0.6310, test_loss: 1.5433, test_f1: 0.4701
 epoch: 37, train_loss: 0.5902, test_loss: 1.3486, test_f1: 0.5358
 epoch: 38, train_loss: 0.5910, test_loss: 1.3188, test_f1: 0.5940
 epoch: 39, train_loss: 0.6064, test_loss: 1.1802, test_f1: 0.5838
 epoch: 40, train_loss: 0.5694, test_loss: 1.4229, test_f1: 0.5961
 epoch: 41, train_loss: 0.5827, test_loss: 1.3855, test_f1: 0.5968
 epoch: 42, train_loss: 0.5405, test_loss: 1.2716, test_f1: 0.5805
 epoch: 43, train_loss: 0.5585, test_loss: 1.4282, test_f1: 0.5774
 epoch: 44, train_loss: 0.5683, test_loss: 1.2370, test_f1: 0.5882
 epoch: 45, train_loss: 0.5378, test_loss: 1.3898, test_f1: 0.5069
 epoch: 46, train_loss: 0.5613, test_loss: 1.2686, test_f1: 0.6275
 epoch: 47, train_loss: 0.5272, test_loss: 1.6269, test_f1: 0.5370
 epoch: 48, train_loss: 0.5185, test_loss: 1.2663, test_f1: 0.6150
 epoch: 49, train_loss: 0.5088, test_loss: 1.7426, test_f1: 0.5450
 epoch: 50, train_loss: 0.5565, test_loss: 1.1612, test_f1: 0.5584
 epoch: 51, train_loss: 0.4867, test_loss: 1.4204, test_f1: 0.6072
 epoch: 52, train_loss: 0.4598, test_loss: 1.3787, test_f1: 0.6061
 epoch: 53, train_loss: 0.4466, test_loss: 1.7105, test_f1: 0.6162
 epoch: 54, train_loss: 0.4305, test_loss: 1.4675, test_f1: 0.5953
 epoch: 55, train_loss: 0.4104, test_loss: 1.5239, test_f1: 0.6347
 epoch: 56, train_loss: 0.4216, test_loss: 1.5358, test_f1: 0.6008
 epoch: 57, train_loss: 0.4023, test_loss: 1.5506, test_f1: 0.6110
 epoch: 58, train_loss: 0.3885, test_loss: 1.7746, test_f1: 0.5584
 epoch: 59, train_loss: 0.3851, test_loss: 1.6637, test_f1: 0.5751
 epoch: 60, train_loss: 0.4288, test_loss: 1.8483, test_f1: 0.5931
 epoch: 61, train_loss: 0.3899, test_loss: 1.8298, test_f1: 0.5565
 epoch: 62, train_loss: 0.3572, test_loss: 1.7059, test_f1: 0.6236
 epoch: 63, train_loss: 0.3665, test_loss: 1.7311, test_f1: 0.6098
 epoch: 64, train_loss: 0.4180, test_loss: 1.3506, test_f1: 0.6091
 epoch: 65, train_loss: 0.3778, test_loss: 1.6310, test_f1: 0.5786
 epoch: 66, train_loss: 0.3590, test_loss: 1.6943, test_f1: 0.6407
 epoch: 67, train_loss: 0.3494, test_loss: 1.6022, test_f1: 0.6186
 epoch: 68, train_loss: 0.3673, test_loss: 2.1238, test_f1: 0.6004
 epoch: 69, train_loss: 0.3393, test_loss: 1.7252, test_f1: 0.6129
 epoch: 70, train_loss: 0.4096, test_loss: 1.8351, test_f1: 0.6108
 epoch: 71, train_loss: 0.3935, test_loss: 1.4593, test_f1: 0.6071
 epoch: 72, train_loss: 0.3371, test_loss: 1.9691, test_f1: 0.6206
 epoch: 73, train_loss: 0.3550, test_loss: 1.6930, test_f1: 0.6146
 epoch: 74, train_loss: 0.3118, test_loss: 1.8310, test_f1: 0.5607
 epoch: 75, train_loss: 0.3428, test_loss: 1.6969, test_f1: 0.6161
 epoch: 76, train_loss: 0.3328, test_loss: 1.7928, test_f1: 0.6243
 epoch: 77, train_loss: 0.3498, test_loss: 1.4504, test_f1: 0.6264
 epoch: 78, train_loss: 0.3498, test_loss: 1.5617, test_f1: 0.6339
 epoch: 79, train_loss: 0.3339, test_loss: 2.0997, test_f1: 0.6137
 epoch: 80, train_loss: 0.2967, test_loss: 2.0365, test_f1: 0.6292
 epoch: 81, train_loss: 0.3349, test_loss: 1.8916, test_f1: 0.6064
 epoch: 82, train_loss: 0.2920, test_loss: 2.0170, test_f1: 0.6181
 epoch: 83, train_loss: 0.3077, test_loss: 1.7311, test_f1: 0.6517
 epoch: 84, train_loss: 0.2989, test_loss: 1.8933, test_f1: 0.6459
 epoch: 85, train_loss: 0.2661, test_loss: 1.8926, test_f1: 0.6447
 epoch: 86, train_loss: 0.2866, test_loss: 1.9128, test_f1: 0.6880
 epoch: 87, train_loss: 0.2628, test_loss: 1.8066, test_f1: 0.6031
 epoch: 88, train_loss: 0.2567, test_loss: 1.7540, test_f1: 0.6523
 epoch: 89, train_loss: 0.2924, test_loss: 1.8201, test_f1: 0.6113
 epoch: 90, train_loss: 0.3260, test_loss: 2.0458, test_f1: 0.6544
 epoch: 91, train_loss: 0.2523, test_loss: 2.0362, test_f1: 0.6764
 epoch: 92, train_loss: 0.2934, test_loss: 1.7797, test_f1: 0.6513
 epoch: 93, train_loss: 0.2708, test_loss: 1.9571, test_f1: 0.5973
 epoch: 94, train_loss: 0.2478, test_loss: 2.1000, test_f1: 0.6285
 epoch: 95, train_loss: 0.3262, test_loss: 1.7314, test_f1: 0.6656
 epoch: 96, train_loss: 0.2699, test_loss: 1.8942, test_f1: 0.6167
 epoch: 97, train_loss: 0.2684, test_loss: 1.9561, test_f1: 0.6514
 epoch: 98, train_loss: 0.2362, test_loss: 2.0554, test_f1: 0.6606
 epoch: 99, train_loss: 0.2292, test_loss: 2.1102, test_f1: 0.6330
##################ITERATION #3 ****************************************
 epoch: 0, train_loss: 1.2275, test_loss: 1.2211, test_f1: 0.4069
 epoch: 1, train_loss: 0.9244, test_loss: 1.7323, test_f1: 0.3235
 epoch: 2, train_loss: 0.8764, test_loss: 1.2246, test_f1: 0.4214
 epoch: 3, train_loss: 0.8850, test_loss: 1.3376, test_f1: 0.4408
 epoch: 4, train_loss: 0.8359, test_loss: 1.2192, test_f1: 0.5127
 epoch: 5, train_loss: 0.7785, test_loss: 1.5128, test_f1: 0.4487
 epoch: 6, train_loss: 0.7995, test_loss: 1.0740, test_f1: 0.6086
 epoch: 7, train_loss: 0.8002, test_loss: 1.1610, test_f1: 0.5892
 epoch: 8, train_loss: 0.7627, test_loss: 1.0186, test_f1: 0.4903
 epoch: 9, train_loss: 0.7808, test_loss: 1.0179, test_f1: 0.5453
 epoch: 10, train_loss: 0.7847, test_loss: 2.5196, test_f1: 0.3914
 epoch: 11, train_loss: 0.7942, test_loss: 0.9921, test_f1: 0.5240
 epoch: 12, train_loss: 0.7895, test_loss: 0.9741, test_f1: 0.5161
 epoch: 13, train_loss: 0.7522, test_loss: 1.0762, test_f1: 0.6048
 epoch: 14, train_loss: 0.7363, test_loss: 1.3735, test_f1: 0.5343
 epoch: 15, train_loss: 0.8017, test_loss: 1.1937, test_f1: 0.4954
 epoch: 16, train_loss: 0.7409, test_loss: 1.1868, test_f1: 0.5909
 epoch: 17, train_loss: 0.7530, test_loss: 1.2175, test_f1: 0.5890
 epoch: 18, train_loss: 0.7029, test_loss: 1.1380, test_f1: 0.6258
 epoch: 19, train_loss: 0.6948, test_loss: 1.3449, test_f1: 0.5284
 epoch: 20, train_loss: 0.7248, test_loss: 1.4865, test_f1: 0.4746
 epoch: 21, train_loss: 0.7145, test_loss: 1.5279, test_f1: 0.5909
 epoch: 22, train_loss: 0.7056, test_loss: 1.1778, test_f1: 0.5088
 epoch: 23, train_loss: 0.6715, test_loss: 1.5374, test_f1: 0.4964
 epoch: 24, train_loss: 0.6679, test_loss: 1.2136, test_f1: 0.5786
 epoch: 25, train_loss: 0.6853, test_loss: 1.1361, test_f1: 0.6432
 epoch: 26, train_loss: 0.7068, test_loss: 0.9834, test_f1: 0.5815
 epoch: 27, train_loss: 0.6809, test_loss: 1.3831, test_f1: 0.4676
 epoch: 28, train_loss: 0.7158, test_loss: 1.1787, test_f1: 0.6188
 epoch: 29, train_loss: 0.6544, test_loss: 1.1214, test_f1: 0.6209
 epoch: 30, train_loss: 0.6151, test_loss: 1.4931, test_f1: 0.5743
 epoch: 31, train_loss: 0.5975, test_loss: 1.7378, test_f1: 0.5711
 epoch: 32, train_loss: 0.6293, test_loss: 1.1713, test_f1: 0.5640
 epoch: 33, train_loss: 0.5945, test_loss: 1.2548, test_f1: 0.5711
 epoch: 34, train_loss: 0.6242, test_loss: 1.3061, test_f1: 0.5266
 epoch: 35, train_loss: 0.5779, test_loss: 1.4514, test_f1: 0.5416
 epoch: 36, train_loss: 0.6120, test_loss: 1.4422, test_f1: 0.5275
 epoch: 37, train_loss: 0.6317, test_loss: 1.3328, test_f1: 0.6025
 epoch: 38, train_loss: 0.6045, test_loss: 1.2263, test_f1: 0.5649
 epoch: 39, train_loss: 0.5661, test_loss: 1.2790, test_f1: 0.5787
 epoch: 40, train_loss: 0.5724, test_loss: 1.2828, test_f1: 0.6201
 epoch: 41, train_loss: 0.5287, test_loss: 1.4230, test_f1: 0.6343
 epoch: 42, train_loss: 0.5162, test_loss: 1.6643, test_f1: 0.6179
 epoch: 43, train_loss: 0.5672, test_loss: 1.4436, test_f1: 0.5963
 epoch: 44, train_loss: 0.5488, test_loss: 1.3814, test_f1: 0.5430
 epoch: 45, train_loss: 0.5041, test_loss: 1.4962, test_f1: 0.6101
 epoch: 46, train_loss: 0.5237, test_loss: 1.6801, test_f1: 0.5904
 epoch: 47, train_loss: 0.5656, test_loss: 1.4947, test_f1: 0.5386
 epoch: 48, train_loss: 0.5457, test_loss: 1.6098, test_f1: 0.6149
 epoch: 49, train_loss: 0.5060, test_loss: 1.3235, test_f1: 0.5516
 epoch: 50, train_loss: 0.5254, test_loss: 1.3548, test_f1: 0.5389
 epoch: 51, train_loss: 0.4809, test_loss: 1.4555, test_f1: 0.6050
 epoch: 52, train_loss: 0.4239, test_loss: 1.5469, test_f1: 0.6138
 epoch: 53, train_loss: 0.4155, test_loss: 1.4444, test_f1: 0.6147
 epoch: 54, train_loss: 0.4289, test_loss: 1.6940, test_f1: 0.6300
 epoch: 55, train_loss: 0.4269, test_loss: 1.6000, test_f1: 0.5447
 epoch: 56, train_loss: 0.3909, test_loss: 1.8660, test_f1: 0.5812
 epoch: 57, train_loss: 0.4245, test_loss: 2.0684, test_f1: 0.5527
 epoch: 58, train_loss: 0.4190, test_loss: 1.8535, test_f1: 0.5948
 epoch: 59, train_loss: 0.3796, test_loss: 1.5384, test_f1: 0.6085
 epoch: 60, train_loss: 0.3800, test_loss: 2.0641, test_f1: 0.5935
 epoch: 61, train_loss: 0.3908, test_loss: 1.7635, test_f1: 0.5708
 epoch: 62, train_loss: 0.3299, test_loss: 1.8053, test_f1: 0.5831
 epoch: 63, train_loss: 0.3290, test_loss: 2.3660, test_f1: 0.6028
 epoch: 64, train_loss: 0.3528, test_loss: 2.0049, test_f1: 0.5943
 epoch: 65, train_loss: 0.3468, test_loss: 2.7205, test_f1: 0.5676
 epoch: 66, train_loss: 0.3631, test_loss: 1.5358, test_f1: 0.5905
 epoch: 67, train_loss: 0.3711, test_loss: 2.2834, test_f1: 0.6173
 epoch: 68, train_loss: 0.3101, test_loss: 2.0329, test_f1: 0.5850
 epoch: 69, train_loss: 0.3166, test_loss: 2.1809, test_f1: 0.5795
 epoch: 70, train_loss: 0.3402, test_loss: 2.0643, test_f1: 0.6092
 epoch: 71, train_loss: 0.3650, test_loss: 1.7474, test_f1: 0.6301
 epoch: 72, train_loss: 0.3245, test_loss: 2.3179, test_f1: 0.5561
 epoch: 73, train_loss: 0.2860, test_loss: 2.0575, test_f1: 0.6137
 epoch: 74, train_loss: 0.2993, test_loss: 1.9453, test_f1: 0.5705
 epoch: 75, train_loss: 0.3057, test_loss: 2.4644, test_f1: 0.5564
 epoch: 76, train_loss: 0.3211, test_loss: 2.2617, test_f1: 0.5657
 epoch: 77, train_loss: 0.3284, test_loss: 2.0145, test_f1: 0.5633
 epoch: 78, train_loss: 0.2998, test_loss: 2.2638, test_f1: 0.5717
 epoch: 79, train_loss: 0.3406, test_loss: 2.2295, test_f1: 0.5899
 epoch: 80, train_loss: 0.3120, test_loss: 2.1369, test_f1: 0.5698
 epoch: 81, train_loss: 0.3190, test_loss: 2.2076, test_f1: 0.6000
 epoch: 82, train_loss: 0.2723, test_loss: 2.4386, test_f1: 0.5530
 epoch: 83, train_loss: 0.2659, test_loss: 2.5264, test_f1: 0.5207
 epoch: 84, train_loss: 0.3143, test_loss: 2.5916, test_f1: 0.5802
 epoch: 85, train_loss: 0.2603, test_loss: 2.5476, test_f1: 0.5809
 epoch: 86, train_loss: 0.2592, test_loss: 2.4930, test_f1: 0.5538
 epoch: 87, train_loss: 0.2567, test_loss: 2.1033, test_f1: 0.6009
 epoch: 88, train_loss: 0.2446, test_loss: 2.9212, test_f1: 0.5452
 epoch: 89, train_loss: 0.2538, test_loss: 2.9020, test_f1: 0.5483
 epoch: 90, train_loss: 0.2620, test_loss: 2.5462, test_f1: 0.5408
 epoch: 91, train_loss: 0.2553, test_loss: 2.3998, test_f1: 0.6058
 epoch: 92, train_loss: 0.2687, test_loss: 2.9163, test_f1: 0.5592
 epoch: 93, train_loss: 0.3026, test_loss: 2.2795, test_f1: 0.5842
 epoch: 94, train_loss: 0.2594, test_loss: 2.1932, test_f1: 0.5701
 epoch: 95, train_loss: 0.2761, test_loss: 2.0941, test_f1: 0.6013
 epoch: 96, train_loss: 0.2617, test_loss: 2.4158, test_f1: 0.5511
 epoch: 97, train_loss: 0.2411, test_loss: 2.3318, test_f1: 0.5970
 epoch: 98, train_loss: 0.2968, test_loss: 2.2350, test_f1: 0.5340
 epoch: 99, train_loss: 0.2148, test_loss: 1.9127, test_f1: 0.6172
##################ITERATION #4 ****************************************
 epoch: 0, train_loss: 1.1775, test_loss: 1.7787, test_f1: 0.2255
 epoch: 1, train_loss: 0.9203, test_loss: 1.1419, test_f1: 0.5155
 epoch: 2, train_loss: 0.8820, test_loss: 0.9511, test_f1: 0.5196
 epoch: 3, train_loss: 0.8287, test_loss: 1.0917, test_f1: 0.5043
 epoch: 4, train_loss: 0.8306, test_loss: 0.9965, test_f1: 0.5911
 epoch: 5, train_loss: 0.8194, test_loss: 1.0104, test_f1: 0.5995
 epoch: 6, train_loss: 0.7711, test_loss: 1.1588, test_f1: 0.4863
 epoch: 7, train_loss: 0.7489, test_loss: 1.0246, test_f1: 0.5823
 epoch: 8, train_loss: 0.7513, test_loss: 1.0620, test_f1: 0.5797
 epoch: 9, train_loss: 0.7636, test_loss: 1.3237, test_f1: 0.5070
 epoch: 10, train_loss: 0.7354, test_loss: 0.9595, test_f1: 0.5627
 epoch: 11, train_loss: 0.7054, test_loss: 1.1005, test_f1: 0.5832
 epoch: 12, train_loss: 0.6826, test_loss: 1.2646, test_f1: 0.6013
 epoch: 13, train_loss: 0.7033, test_loss: 2.1512, test_f1: 0.3931
 epoch: 14, train_loss: 0.6816, test_loss: 1.3516, test_f1: 0.5043
 epoch: 15, train_loss: 0.7026, test_loss: 1.3033, test_f1: 0.4156
 epoch: 16, train_loss: 0.6404, test_loss: 1.0568, test_f1: 0.5277
 epoch: 17, train_loss: 0.6603, test_loss: 1.0022, test_f1: 0.5732
 epoch: 18, train_loss: 0.6520, test_loss: 0.9284, test_f1: 0.6054
 epoch: 19, train_loss: 0.6143, test_loss: 1.1960, test_f1: 0.5657
 epoch: 20, train_loss: 0.6135, test_loss: 1.1111, test_f1: 0.5904
 epoch: 21, train_loss: 0.5949, test_loss: 1.0354, test_f1: 0.5710
 epoch: 22, train_loss: 0.5810, test_loss: 0.9351, test_f1: 0.6333
 epoch: 23, train_loss: 0.6267, test_loss: 1.1824, test_f1: 0.6086
 epoch: 24, train_loss: 0.5836, test_loss: 1.1307, test_f1: 0.5665
 epoch: 25, train_loss: 0.5729, test_loss: 1.0968, test_f1: 0.5848
 epoch: 26, train_loss: 0.5647, test_loss: 1.1057, test_f1: 0.6262
 epoch: 27, train_loss: 0.5373, test_loss: 1.1064, test_f1: 0.6535
 epoch: 28, train_loss: 0.5436, test_loss: 1.2560, test_f1: 0.5586
 epoch: 29, train_loss: 0.5249, test_loss: 1.1473, test_f1: 0.6458
 epoch: 30, train_loss: 0.5212, test_loss: 1.2955, test_f1: 0.6057
 epoch: 31, train_loss: 0.5051, test_loss: 1.2284, test_f1: 0.5718
 epoch: 32, train_loss: 0.5258, test_loss: 1.0519, test_f1: 0.6427
 epoch: 33, train_loss: 0.5215, test_loss: 1.0282, test_f1: 0.6403
 epoch: 34, train_loss: 0.4904, test_loss: 1.2805, test_f1: 0.5998
 epoch: 35, train_loss: 0.4638, test_loss: 1.1978, test_f1: 0.6235
 epoch: 36, train_loss: 0.4960, test_loss: 1.3497, test_f1: 0.6350
 epoch: 37, train_loss: 0.4934, test_loss: 1.0125, test_f1: 0.6197
 epoch: 38, train_loss: 0.4684, test_loss: 1.2552, test_f1: 0.5823
 epoch: 39, train_loss: 0.4724, test_loss: 1.0981, test_f1: 0.5975
 epoch: 40, train_loss: 0.4467, test_loss: 1.2835, test_f1: 0.5958
 epoch: 41, train_loss: 0.4666, test_loss: 1.2255, test_f1: 0.6296
 epoch: 42, train_loss: 0.4567, test_loss: 1.3348, test_f1: 0.6040
 epoch: 43, train_loss: 0.4265, test_loss: 1.1283, test_f1: 0.6127
 epoch: 44, train_loss: 0.5054, test_loss: 1.2371, test_f1: 0.5367
 epoch: 45, train_loss: 0.5821, test_loss: 1.1199, test_f1: 0.6043
 epoch: 46, train_loss: 0.4391, test_loss: 1.6761, test_f1: 0.6289
 epoch: 47, train_loss: 0.4230, test_loss: 1.4651, test_f1: 0.6110
 epoch: 48, train_loss: 0.4054, test_loss: 1.1778, test_f1: 0.5621
 epoch: 49, train_loss: 0.4179, test_loss: 1.2870, test_f1: 0.6415
 epoch: 50, train_loss: 0.4158, test_loss: 1.2832, test_f1: 0.6586
 epoch: 51, train_loss: 0.3805, test_loss: 1.2949, test_f1: 0.6192
 epoch: 52, train_loss: 0.3618, test_loss: 1.2950, test_f1: 0.6312
 epoch: 53, train_loss: 0.3395, test_loss: 1.3699, test_f1: 0.6271
 epoch: 54, train_loss: 0.3006, test_loss: 1.5462, test_f1: 0.6364
 epoch: 55, train_loss: 0.2983, test_loss: 1.5396, test_f1: 0.6200
 epoch: 56, train_loss: 0.2858, test_loss: 1.5478, test_f1: 0.6138
 epoch: 57, train_loss: 0.2632, test_loss: 1.6710, test_f1: 0.6348
 epoch: 58, train_loss: 0.2815, test_loss: 1.5093, test_f1: 0.6114
 epoch: 59, train_loss: 0.2794, test_loss: 1.6264, test_f1: 0.6659
 epoch: 60, train_loss: 0.2562, test_loss: 2.0121, test_f1: 0.6213
 epoch: 61, train_loss: 0.2492, test_loss: 1.8905, test_f1: 0.6599
 epoch: 62, train_loss: 0.3125, test_loss: 1.6682, test_f1: 0.6353
 epoch: 63, train_loss: 0.2804, test_loss: 1.8867, test_f1: 0.5934
 epoch: 64, train_loss: 0.2491, test_loss: 1.7337, test_f1: 0.6365
 epoch: 65, train_loss: 0.2656, test_loss: 1.5985, test_f1: 0.6326
 epoch: 66, train_loss: 0.2788, test_loss: 1.7574, test_f1: 0.6179
 epoch: 67, train_loss: 0.2406, test_loss: 1.8446, test_f1: 0.6525
 epoch: 68, train_loss: 0.2697, test_loss: 1.8791, test_f1: 0.6422
 epoch: 69, train_loss: 0.2487, test_loss: 1.6952, test_f1: 0.6660
 epoch: 70, train_loss: 0.2281, test_loss: 1.8686, test_f1: 0.6481
 epoch: 71, train_loss: 0.2726, test_loss: 1.7494, test_f1: 0.6386
 epoch: 72, train_loss: 0.1905, test_loss: 1.6768, test_f1: 0.6489
 epoch: 73, train_loss: 0.2524, test_loss: 1.7771, test_f1: 0.6400
 epoch: 74, train_loss: 0.2189, test_loss: 1.9716, test_f1: 0.6637
 epoch: 75, train_loss: 0.2370, test_loss: 1.8372, test_f1: 0.6489
 epoch: 76, train_loss: 0.2350, test_loss: 1.8431, test_f1: 0.6076
 epoch: 77, train_loss: 0.2342, test_loss: 1.9766, test_f1: 0.6400
 epoch: 78, train_loss: 0.1967, test_loss: 2.0252, test_f1: 0.6254
 epoch: 79, train_loss: 0.2144, test_loss: 1.9090, test_f1: 0.6505
 epoch: 80, train_loss: 0.2257, test_loss: 1.9271, test_f1: 0.6999
 epoch: 81, train_loss: 0.2163, test_loss: 2.3400, test_f1: 0.6518
 epoch: 82, train_loss: 0.2170, test_loss: 1.9159, test_f1: 0.6481
 epoch: 83, train_loss: 0.2157, test_loss: 2.1883, test_f1: 0.6248
 epoch: 84, train_loss: 0.1898, test_loss: 2.2705, test_f1: 0.6313
 epoch: 85, train_loss: 0.1962, test_loss: 2.3298, test_f1: 0.6772
 epoch: 86, train_loss: 0.2210, test_loss: 2.0345, test_f1: 0.6371
 epoch: 87, train_loss: 0.2026, test_loss: 1.8037, test_f1: 0.6842
 epoch: 88, train_loss: 0.1650, test_loss: 2.0477, test_f1: 0.6977
 epoch: 89, train_loss: 0.1811, test_loss: 2.1557, test_f1: 0.6855
 epoch: 90, train_loss: 0.1777, test_loss: 2.3745, test_f1: 0.6694
 epoch: 91, train_loss: 0.1662, test_loss: 2.2494, test_f1: 0.6654
 epoch: 92, train_loss: 0.2033, test_loss: 1.8595, test_f1: 0.6622
 epoch: 93, train_loss: 0.1767, test_loss: 2.1823, test_f1: 0.6941
 epoch: 94, train_loss: 0.1970, test_loss: 2.3129, test_f1: 0.6818
 epoch: 95, train_loss: 0.1658, test_loss: 2.6222, test_f1: 0.6542
 epoch: 96, train_loss: 0.2089, test_loss: 2.2738, test_f1: 0.7029
 epoch: 97, train_loss: 0.1672, test_loss: 2.5970, test_f1: 0.6558
 epoch: 98, train_loss: 0.1559, test_loss: 2.1482, test_f1: 0.6768
 epoch: 99, train_loss: 0.1525, test_loss: 2.4312, test_f1: 0.6792
##################ITERATION #5 ****************************************
 epoch: 0, train_loss: 1.2721, test_loss: 1.1974, test_f1: 0.3005
 epoch: 1, train_loss: 1.0193, test_loss: 1.0560, test_f1: 0.4924
 epoch: 2, train_loss: 0.9382, test_loss: 1.0126, test_f1: 0.5206
 epoch: 3, train_loss: 0.9195, test_loss: 1.0733, test_f1: 0.4965
 epoch: 4, train_loss: 0.8843, test_loss: 1.1324, test_f1: 0.4880
 epoch: 5, train_loss: 0.8534, test_loss: 1.0663, test_f1: 0.5041
 epoch: 6, train_loss: 0.8401, test_loss: 0.9848, test_f1: 0.5004
 epoch: 7, train_loss: 0.8361, test_loss: 1.1476, test_f1: 0.4160
 epoch: 8, train_loss: 0.7960, test_loss: 0.9905, test_f1: 0.4672
 epoch: 9, train_loss: 0.7997, test_loss: 0.9503, test_f1: 0.5503
 epoch: 10, train_loss: 0.7894, test_loss: 1.0817, test_f1: 0.5146
 epoch: 11, train_loss: 0.7710, test_loss: 1.0751, test_f1: 0.5042
 epoch: 12, train_loss: 0.7745, test_loss: 1.0880, test_f1: 0.4798
 epoch: 13, train_loss: 0.7949, test_loss: 1.0498, test_f1: 0.4854
 epoch: 14, train_loss: 0.7504, test_loss: 1.2084, test_f1: 0.4939
 epoch: 15, train_loss: 0.7406, test_loss: 1.0228, test_f1: 0.6848
 epoch: 16, train_loss: 0.7343, test_loss: 1.5486, test_f1: 0.4899
 epoch: 17, train_loss: 0.7541, test_loss: 0.9986, test_f1: 0.6379
 epoch: 18, train_loss: 0.7313, test_loss: 1.1809, test_f1: 0.5444
 epoch: 19, train_loss: 0.7311, test_loss: 1.2236, test_f1: 0.6296
 epoch: 20, train_loss: 0.7302, test_loss: 1.4259, test_f1: 0.5952
 epoch: 21, train_loss: 0.7059, test_loss: 1.1509, test_f1: 0.5285
 epoch: 22, train_loss: 0.7103, test_loss: 1.3162, test_f1: 0.5728
 epoch: 23, train_loss: 0.7264, test_loss: 1.1232, test_f1: 0.5908
 epoch: 24, train_loss: 0.7301, test_loss: 1.5796, test_f1: 0.5410
 epoch: 25, train_loss: 0.7023, test_loss: 1.1316, test_f1: 0.6893
 epoch: 26, train_loss: 0.7458, test_loss: 1.0181, test_f1: 0.5384
 epoch: 27, train_loss: 0.7031, test_loss: 0.9387, test_f1: 0.6230
 epoch: 28, train_loss: 0.7000, test_loss: 1.4372, test_f1: 0.5805
 epoch: 29, train_loss: 0.6534, test_loss: 1.3787, test_f1: 0.5779
 epoch: 30, train_loss: 0.6590, test_loss: 1.1138, test_f1: 0.5729
 epoch: 31, train_loss: 0.6393, test_loss: 1.2617, test_f1: 0.6403
 epoch: 32, train_loss: 0.6822, test_loss: 0.9711, test_f1: 0.6295
 epoch: 33, train_loss: 0.6470, test_loss: 1.3344, test_f1: 0.6030
 epoch: 34, train_loss: 0.5987, test_loss: 1.0032, test_f1: 0.6056
 epoch: 35, train_loss: 0.6403, test_loss: 1.3203, test_f1: 0.5886
 epoch: 36, train_loss: 0.6173, test_loss: 1.1215, test_f1: 0.5971
 epoch: 37, train_loss: 0.6149, test_loss: 1.4676, test_f1: 0.5796
 epoch: 38, train_loss: 0.5921, test_loss: 1.6836, test_f1: 0.5774
 epoch: 39, train_loss: 0.6469, test_loss: 1.0378, test_f1: 0.6304
 epoch: 40, train_loss: 0.5983, test_loss: 1.0989, test_f1: 0.6080
 epoch: 41, train_loss: 0.5803, test_loss: 1.3075, test_f1: 0.6136
 epoch: 42, train_loss: 0.6285, test_loss: 1.3724, test_f1: 0.5769
 epoch: 43, train_loss: 0.5972, test_loss: 1.4443, test_f1: 0.6310
 epoch: 44, train_loss: 0.5886, test_loss: 1.1972, test_f1: 0.6108
 epoch: 45, train_loss: 0.5704, test_loss: 1.3314, test_f1: 0.6206
 epoch: 46, train_loss: 0.5327, test_loss: 1.2580, test_f1: 0.5910
 epoch: 47, train_loss: 0.5150, test_loss: 1.1475, test_f1: 0.6217
 epoch: 48, train_loss: 0.5250, test_loss: 1.5107, test_f1: 0.5498
 epoch: 49, train_loss: 0.5480, test_loss: 1.8531, test_f1: 0.6212
 epoch: 50, train_loss: 0.5248, test_loss: 1.9298, test_f1: 0.5787
 epoch: 51, train_loss: 0.5178, test_loss: 1.3181, test_f1: 0.6163
 epoch: 52, train_loss: 0.5167, test_loss: 1.3838, test_f1: 0.6618
 epoch: 53, train_loss: 0.4786, test_loss: 1.4526, test_f1: 0.6509
 epoch: 54, train_loss: 0.4383, test_loss: 1.6740, test_f1: 0.5410
 epoch: 55, train_loss: 0.4304, test_loss: 1.8031, test_f1: 0.6266
 epoch: 56, train_loss: 0.4542, test_loss: 1.6741, test_f1: 0.6570
 epoch: 57, train_loss: 0.4127, test_loss: 2.0488, test_f1: 0.5880
 epoch: 58, train_loss: 0.4027, test_loss: 1.5576, test_f1: 0.6111
 epoch: 59, train_loss: 0.4125, test_loss: 1.6445, test_f1: 0.5845
 epoch: 60, train_loss: 0.4116, test_loss: 1.8346, test_f1: 0.6412
 epoch: 61, train_loss: 0.4191, test_loss: 1.4058, test_f1: 0.6576
 epoch: 62, train_loss: 0.3983, test_loss: 2.5711, test_f1: 0.5216
 epoch: 63, train_loss: 0.4085, test_loss: 1.8885, test_f1: 0.5980
 epoch: 64, train_loss: 0.3921, test_loss: 1.8471, test_f1: 0.6491
 epoch: 65, train_loss: 0.3957, test_loss: 1.5476, test_f1: 0.6406
 epoch: 66, train_loss: 0.4066, test_loss: 1.7888, test_f1: 0.6200
 epoch: 67, train_loss: 0.3837, test_loss: 1.7864, test_f1: 0.6528
 epoch: 68, train_loss: 0.3588, test_loss: 2.0042, test_f1: 0.6297
 epoch: 69, train_loss: 0.3762, test_loss: 1.7510, test_f1: 0.6111
 epoch: 70, train_loss: 0.3524, test_loss: 1.7889, test_f1: 0.6048
 epoch: 71, train_loss: 0.3698, test_loss: 2.0428, test_f1: 0.6311
 epoch: 72, train_loss: 0.3854, test_loss: 1.7842, test_f1: 0.6396
 epoch: 73, train_loss: 0.3274, test_loss: 2.2989, test_f1: 0.6186
 epoch: 74, train_loss: 0.3293, test_loss: 2.2503, test_f1: 0.6393
 epoch: 75, train_loss: 0.3541, test_loss: 1.8579, test_f1: 0.5920
 epoch: 76, train_loss: 0.3636, test_loss: 1.9815, test_f1: 0.6347
 epoch: 77, train_loss: 0.3177, test_loss: 2.5113, test_f1: 0.6426
 epoch: 78, train_loss: 0.3384, test_loss: 1.9971, test_f1: 0.6449
 epoch: 79, train_loss: 0.3075, test_loss: 2.6124, test_f1: 0.6064
 epoch: 80, train_loss: 0.3034, test_loss: 2.3516, test_f1: 0.6351
 epoch: 81, train_loss: 0.3012, test_loss: 2.2287, test_f1: 0.6416
 epoch: 82, train_loss: 0.2961, test_loss: 3.1756, test_f1: 0.5185
 epoch: 83, train_loss: 0.3046, test_loss: 2.3145, test_f1: 0.6270
 epoch: 84, train_loss: 0.3127, test_loss: 2.3179, test_f1: 0.6004
 epoch: 85, train_loss: 0.2954, test_loss: 2.6177, test_f1: 0.6406
 epoch: 86, train_loss: 0.3187, test_loss: 2.6557, test_f1: 0.6308
 epoch: 87, train_loss: 0.2984, test_loss: 2.4952, test_f1: 0.6248
 epoch: 88, train_loss: 0.2985, test_loss: 2.3964, test_f1: 0.5970
 epoch: 89, train_loss: 0.3018, test_loss: 2.1875, test_f1: 0.6051
 epoch: 90, train_loss: 0.2844, test_loss: 2.5036, test_f1: 0.6289
 epoch: 91, train_loss: 0.3186, test_loss: 2.2380, test_f1: 0.6093
 epoch: 92, train_loss: 0.2820, test_loss: 2.4056, test_f1: 0.5938
 epoch: 93, train_loss: 0.3086, test_loss: 2.2204, test_f1: 0.6620
 epoch: 94, train_loss: 0.3049, test_loss: 2.1697, test_f1: 0.6273
 epoch: 95, train_loss: 0.3271, test_loss: 2.3906, test_f1: 0.6277
 epoch: 96, train_loss: 0.2590, test_loss: 3.0101, test_f1: 0.5947
 epoch: 97, train_loss: 0.2327, test_loss: 2.7663, test_f1: 0.6040
 epoch: 98, train_loss: 0.2701, test_loss: 2.2544, test_f1: 0.6718
 epoch: 99, train_loss: 0.2374, test_loss: 3.2058, test_f1: 0.6337
##################ITERATION #6 ****************************************
 epoch: 0, train_loss: 1.2278, test_loss: 1.2933, test_f1: 0.2839
 epoch: 1, train_loss: 1.0127, test_loss: 1.0081, test_f1: 0.4765
 epoch: 2, train_loss: 0.9444, test_loss: 0.9966, test_f1: 0.4367
 epoch: 3, train_loss: 0.9281, test_loss: 0.9626, test_f1: 0.4543
 epoch: 4, train_loss: 0.8695, test_loss: 0.9626, test_f1: 0.5029
 epoch: 5, train_loss: 0.8646, test_loss: 1.1682, test_f1: 0.4919
 epoch: 6, train_loss: 0.8377, test_loss: 0.9958, test_f1: 0.5341
 epoch: 7, train_loss: 0.8065, test_loss: 1.0489, test_f1: 0.5558
 epoch: 8, train_loss: 0.8245, test_loss: 0.9950, test_f1: 0.5566
 epoch: 9, train_loss: 0.8098, test_loss: 1.1833, test_f1: 0.4716
 epoch: 10, train_loss: 0.7986, test_loss: 1.0978, test_f1: 0.5569
 epoch: 11, train_loss: 0.8101, test_loss: 1.0404, test_f1: 0.5360
 epoch: 12, train_loss: 0.7834, test_loss: 1.1295, test_f1: 0.5611
 epoch: 13, train_loss: 0.7621, test_loss: 1.5029, test_f1: 0.4639
 epoch: 14, train_loss: 0.8043, test_loss: 1.1958, test_f1: 0.5941
 epoch: 15, train_loss: 0.7904, test_loss: 1.0971, test_f1: 0.4982
 epoch: 16, train_loss: 0.7516, test_loss: 1.1416, test_f1: 0.4606
 epoch: 17, train_loss: 0.7611, test_loss: 1.1943, test_f1: 0.4815
 epoch: 18, train_loss: 0.7377, test_loss: 1.1547, test_f1: 0.5837
 epoch: 19, train_loss: 0.7399, test_loss: 1.0199, test_f1: 0.5863
 epoch: 20, train_loss: 0.7216, test_loss: 1.1797, test_f1: 0.5938
 epoch: 21, train_loss: 0.7306, test_loss: 1.3112, test_f1: 0.5406
 epoch: 22, train_loss: 0.7220, test_loss: 1.0026, test_f1: 0.5367
 epoch: 23, train_loss: 0.7213, test_loss: 1.3335, test_f1: 0.5431
 epoch: 24, train_loss: 0.6947, test_loss: 1.1580, test_f1: 0.4921
 epoch: 25, train_loss: 0.7068, test_loss: 1.4632, test_f1: 0.6257
 epoch: 26, train_loss: 0.6783, test_loss: 1.1396, test_f1: 0.5656
 epoch: 27, train_loss: 0.7458, test_loss: 1.5017, test_f1: 0.5128
 epoch: 28, train_loss: 0.7257, test_loss: 1.2664, test_f1: 0.5024
 epoch: 29, train_loss: 0.7548, test_loss: 1.1408, test_f1: 0.5749
 epoch: 30, train_loss: 0.7059, test_loss: 1.2795, test_f1: 0.5832
 epoch: 31, train_loss: 0.6721, test_loss: 1.2548, test_f1: 0.5958
 epoch: 32, train_loss: 0.6661, test_loss: 1.4383, test_f1: 0.5980
 epoch: 33, train_loss: 0.6625, test_loss: 1.1387, test_f1: 0.6166
 epoch: 34, train_loss: 0.6820, test_loss: 1.3197, test_f1: 0.5938
 epoch: 35, train_loss: 0.6979, test_loss: 1.1822, test_f1: 0.6397
 epoch: 36, train_loss: 0.6431, test_loss: 1.1330, test_f1: 0.6460
 epoch: 37, train_loss: 0.6411, test_loss: 1.4177, test_f1: 0.6182
 epoch: 38, train_loss: 0.6285, test_loss: 1.2000, test_f1: 0.6566
 epoch: 39, train_loss: 0.6262, test_loss: 1.2753, test_f1: 0.6319
 epoch: 40, train_loss: 0.6093, test_loss: 1.3910, test_f1: 0.6167
 epoch: 41, train_loss: 0.6069, test_loss: 1.1931, test_f1: 0.5954
 epoch: 42, train_loss: 0.6387, test_loss: 1.1768, test_f1: 0.6553
 epoch: 43, train_loss: 0.6054, test_loss: 1.1823, test_f1: 0.6038
 epoch: 44, train_loss: 0.5734, test_loss: 1.2394, test_f1: 0.6484
 epoch: 45, train_loss: 0.5819, test_loss: 1.1645, test_f1: 0.6201
 epoch: 46, train_loss: 0.5804, test_loss: 1.4864, test_f1: 0.5741
 epoch: 47, train_loss: 0.5959, test_loss: 1.5343, test_f1: 0.6012
 epoch: 48, train_loss: 0.5627, test_loss: 1.2660, test_f1: 0.6236
 epoch: 49, train_loss: 0.5962, test_loss: 1.3737, test_f1: 0.6339
 epoch: 50, train_loss: 0.5584, test_loss: 1.4497, test_f1: 0.6675
 epoch: 51, train_loss: 0.5063, test_loss: 1.2764, test_f1: 0.6625
 epoch: 52, train_loss: 0.4886, test_loss: 1.4818, test_f1: 0.6792
 epoch: 53, train_loss: 0.4827, test_loss: 1.4405, test_f1: 0.6520
 epoch: 54, train_loss: 0.4588, test_loss: 1.6396, test_f1: 0.6383
 epoch: 55, train_loss: 0.4621, test_loss: 1.7560, test_f1: 0.6252
 epoch: 56, train_loss: 0.4411, test_loss: 1.7858, test_f1: 0.6167
 epoch: 57, train_loss: 0.4650, test_loss: 1.7584, test_f1: 0.6081
 epoch: 58, train_loss: 0.4430, test_loss: 1.8062, test_f1: 0.5203
 epoch: 59, train_loss: 0.4469, test_loss: 2.0189, test_f1: 0.6135
 epoch: 60, train_loss: 0.4094, test_loss: 1.7490, test_f1: 0.6478
 epoch: 61, train_loss: 0.4078, test_loss: 1.6734, test_f1: 0.6520
 epoch: 62, train_loss: 0.4199, test_loss: 1.9037, test_f1: 0.6482
 epoch: 63, train_loss: 0.4118, test_loss: 1.8108, test_f1: 0.6121
 epoch: 64, train_loss: 0.4316, test_loss: 1.7356, test_f1: 0.6200
 epoch: 65, train_loss: 0.4033, test_loss: 1.8813, test_f1: 0.6458
 epoch: 66, train_loss: 0.4150, test_loss: 1.5287, test_f1: 0.6568
 epoch: 67, train_loss: 0.4095, test_loss: 1.9484, test_f1: 0.6326
 epoch: 68, train_loss: 0.4042, test_loss: 1.9838, test_f1: 0.5791
 epoch: 69, train_loss: 0.3743, test_loss: 1.7310, test_f1: 0.6602
 epoch: 70, train_loss: 0.3794, test_loss: 1.7813, test_f1: 0.6528
 epoch: 71, train_loss: 0.3261, test_loss: 2.2493, test_f1: 0.6222
 epoch: 72, train_loss: 0.3609, test_loss: 1.8119, test_f1: 0.6803
 epoch: 73, train_loss: 0.2957, test_loss: 2.2033, test_f1: 0.6337
 epoch: 74, train_loss: 0.3318, test_loss: 1.9151, test_f1: 0.6446
 epoch: 75, train_loss: 0.3159, test_loss: 2.0994, test_f1: 0.6415
 epoch: 76, train_loss: 0.3155, test_loss: 2.3825, test_f1: 0.6272
 epoch: 77, train_loss: 0.3234, test_loss: 2.2591, test_f1: 0.6497
 epoch: 78, train_loss: 0.3468, test_loss: 2.0804, test_f1: 0.6284
 epoch: 79, train_loss: 0.3567, test_loss: 2.0306, test_f1: 0.6386
 epoch: 80, train_loss: 0.3343, test_loss: 1.9688, test_f1: 0.6266
 epoch: 81, train_loss: 0.3153, test_loss: 2.2572, test_f1: 0.6191
 epoch: 82, train_loss: 0.2887, test_loss: 2.3647, test_f1: 0.6163
 epoch: 83, train_loss: 0.3159, test_loss: 2.1293, test_f1: 0.6495
 epoch: 84, train_loss: 0.3141, test_loss: 1.8389, test_f1: 0.6598
 epoch: 85, train_loss: 0.2792, test_loss: 2.0634, test_f1: 0.6567
 epoch: 86, train_loss: 0.3076, test_loss: 1.9359, test_f1: 0.6402
 epoch: 87, train_loss: 0.2834, test_loss: 2.4546, test_f1: 0.6820
 epoch: 88, train_loss: 0.2565, test_loss: 2.5280, test_f1: 0.5943
 epoch: 89, train_loss: 0.2747, test_loss: 2.2431, test_f1: 0.6532
 epoch: 90, train_loss: 0.2777, test_loss: 1.9592, test_f1: 0.6566
 epoch: 91, train_loss: 0.2872, test_loss: 2.1771, test_f1: 0.6314
 epoch: 92, train_loss: 0.2642, test_loss: 2.2830, test_f1: 0.6402
 epoch: 93, train_loss: 0.2498, test_loss: 2.8258, test_f1: 0.6587
 epoch: 94, train_loss: 0.2705, test_loss: 2.0882, test_f1: 0.6319
 epoch: 95, train_loss: 0.2293, test_loss: 2.5116, test_f1: 0.6491
 epoch: 96, train_loss: 0.2484, test_loss: 2.6343, test_f1: 0.6092
 epoch: 97, train_loss: 0.2836, test_loss: 2.2249, test_f1: 0.6300
 epoch: 98, train_loss: 0.2395, test_loss: 2.7441, test_f1: 0.6308
 epoch: 99, train_loss: 0.2812, test_loss: 2.4137, test_f1: 0.6215
##################ITERATION #7 ****************************************
 epoch: 0, train_loss: 1.2090, test_loss: 1.2058, test_f1: 0.3295
 epoch: 1, train_loss: 1.0694, test_loss: 1.1564, test_f1: 0.3344
 epoch: 2, train_loss: 1.0555, test_loss: 1.1848, test_f1: 0.3291
 epoch: 3, train_loss: 1.0593, test_loss: 1.1273, test_f1: 0.4579
 epoch: 4, train_loss: 1.0249, test_loss: 1.1127, test_f1: 0.3902
 epoch: 5, train_loss: 1.0290, test_loss: 1.2397, test_f1: 0.3507
 epoch: 6, train_loss: 1.0274, test_loss: 1.1494, test_f1: 0.4061
 epoch: 7, train_loss: 1.0291, test_loss: 1.4095, test_f1: 0.3434
 epoch: 8, train_loss: 1.0060, test_loss: 1.0985, test_f1: 0.3609
 epoch: 9, train_loss: 0.9951, test_loss: 1.1513, test_f1: 0.3549
 epoch: 10, train_loss: 1.0031, test_loss: 1.0684, test_f1: 0.4347
 epoch: 11, train_loss: 0.9876, test_loss: 1.0970, test_f1: 0.3370
 epoch: 12, train_loss: 0.9841, test_loss: 1.1101, test_f1: 0.3395
 epoch: 13, train_loss: 0.9606, test_loss: 1.0436, test_f1: 0.4675
 epoch: 14, train_loss: 0.9485, test_loss: 1.1328, test_f1: 0.3502
 epoch: 15, train_loss: 0.9441, test_loss: 1.0505, test_f1: 0.3395
 epoch: 16, train_loss: 0.9271, test_loss: 1.0489, test_f1: 0.3334
 epoch: 17, train_loss: 0.9209, test_loss: 1.0469, test_f1: 0.4149
 epoch: 18, train_loss: 0.8996, test_loss: 0.9846, test_f1: 0.4713
 epoch: 19, train_loss: 0.9000, test_loss: 0.9700, test_f1: 0.4336
 epoch: 20, train_loss: 0.8883, test_loss: 1.1062, test_f1: 0.4683
 epoch: 21, train_loss: 0.8760, test_loss: 1.0525, test_f1: 0.4998
 epoch: 22, train_loss: 0.8752, test_loss: 2.3087, test_f1: 0.2981
 epoch: 23, train_loss: 0.8786, test_loss: 1.1178, test_f1: 0.4237
 epoch: 24, train_loss: 0.8594, test_loss: 1.0597, test_f1: 0.5296
 epoch: 25, train_loss: 0.8308, test_loss: 0.9960, test_f1: 0.5941
 epoch: 26, train_loss: 0.8259, test_loss: 1.0473, test_f1: 0.5772
 epoch: 27, train_loss: 0.8388, test_loss: 1.1291, test_f1: 0.4365
 epoch: 28, train_loss: 0.8194, test_loss: 1.0806, test_f1: 0.5869
 epoch: 29, train_loss: 0.8306, test_loss: 2.7171, test_f1: 0.2924
 epoch: 30, train_loss: 0.8469, test_loss: 1.1114, test_f1: 0.4768
 epoch: 31, train_loss: 0.8292, test_loss: 0.9960, test_f1: 0.5850
 epoch: 32, train_loss: 0.7961, test_loss: 1.3105, test_f1: 0.4523
 epoch: 33, train_loss: 0.7532, test_loss: 1.0221, test_f1: 0.6038
 epoch: 34, train_loss: 0.7477, test_loss: 1.0723, test_f1: 0.6042
 epoch: 35, train_loss: 0.7676, test_loss: 0.9292, test_f1: 0.4659
 epoch: 36, train_loss: 0.7262, test_loss: 1.1543, test_f1: 0.6180
 epoch: 37, train_loss: 0.7043, test_loss: 1.0868, test_f1: 0.4800
 epoch: 38, train_loss: 0.7345, test_loss: 1.4169, test_f1: 0.5389
 epoch: 39, train_loss: 0.7160, test_loss: 1.0065, test_f1: 0.5488
 epoch: 40, train_loss: 0.7329, test_loss: 1.1061, test_f1: 0.5819
 epoch: 41, train_loss: 0.7047, test_loss: 1.2444, test_f1: 0.5363
 epoch: 42, train_loss: 0.7057, test_loss: 1.1744, test_f1: 0.5237
 epoch: 43, train_loss: 0.6799, test_loss: 1.0999, test_f1: 0.6193
 epoch: 44, train_loss: 0.6785, test_loss: 1.0686, test_f1: 0.5932
 epoch: 45, train_loss: 0.6538, test_loss: 1.2668, test_f1: 0.5725
 epoch: 46, train_loss: 0.6384, test_loss: 1.1940, test_f1: 0.5941
 epoch: 47, train_loss: 0.6155, test_loss: 1.3280, test_f1: 0.5778
 epoch: 48, train_loss: 0.6775, test_loss: 1.0207, test_f1: 0.5722
 epoch: 49, train_loss: 0.6969, test_loss: 0.9359, test_f1: 0.5719
 epoch: 50, train_loss: 0.6291, test_loss: 1.1587, test_f1: 0.6094
 epoch: 51, train_loss: 0.6097, test_loss: 1.0357, test_f1: 0.5993
 epoch: 52, train_loss: 0.5770, test_loss: 1.0638, test_f1: 0.6355
 epoch: 53, train_loss: 0.5473, test_loss: 1.1585, test_f1: 0.5988
 epoch: 54, train_loss: 0.5515, test_loss: 1.1688, test_f1: 0.6447
 epoch: 55, train_loss: 0.5536, test_loss: 1.2632, test_f1: 0.6310
 epoch: 56, train_loss: 0.5672, test_loss: 1.2414, test_f1: 0.6194
 epoch: 57, train_loss: 0.5728, test_loss: 1.0909, test_f1: 0.6166
 epoch: 58, train_loss: 0.5458, test_loss: 1.0828, test_f1: 0.6642
 epoch: 59, train_loss: 0.5187, test_loss: 1.5715, test_f1: 0.5437
 epoch: 60, train_loss: 0.5226, test_loss: 1.2930, test_f1: 0.6021
 epoch: 61, train_loss: 0.5039, test_loss: 1.2808, test_f1: 0.6373
 epoch: 62, train_loss: 0.5024, test_loss: 1.4667, test_f1: 0.6503
 epoch: 63, train_loss: 0.4968, test_loss: 1.5026, test_f1: 0.6437
 epoch: 64, train_loss: 0.4722, test_loss: 1.6769, test_f1: 0.6212
 epoch: 65, train_loss: 0.4594, test_loss: 2.2497, test_f1: 0.6399
 epoch: 66, train_loss: 0.4915, test_loss: 1.8669, test_f1: 0.5753
 epoch: 67, train_loss: 0.4907, test_loss: 1.3797, test_f1: 0.6138
 epoch: 68, train_loss: 0.4762, test_loss: 1.6018, test_f1: 0.5683
 epoch: 69, train_loss: 0.4792, test_loss: 1.6819, test_f1: 0.6266
 epoch: 70, train_loss: 0.4668, test_loss: 1.5181, test_f1: 0.5986
 epoch: 71, train_loss: 0.4591, test_loss: 1.5888, test_f1: 0.6176
 epoch: 72, train_loss: 0.4428, test_loss: 1.6285, test_f1: 0.6128
 epoch: 73, train_loss: 0.4283, test_loss: 1.6707, test_f1: 0.6044
 epoch: 74, train_loss: 0.4037, test_loss: 2.0317, test_f1: 0.5938
 epoch: 75, train_loss: 0.4155, test_loss: 2.4704, test_f1: 0.5862
 epoch: 76, train_loss: 0.4220, test_loss: 2.1016, test_f1: 0.6166
 epoch: 77, train_loss: 0.4294, test_loss: 1.7464, test_f1: 0.6031
 epoch: 78, train_loss: 0.3916, test_loss: 1.8406, test_f1: 0.5569
 epoch: 79, train_loss: 0.4235, test_loss: 1.8402, test_f1: 0.6259
 epoch: 80, train_loss: 0.3767, test_loss: 2.0611, test_f1: 0.6115
 epoch: 81, train_loss: 0.4051, test_loss: 1.9968, test_f1: 0.5877
 epoch: 82, train_loss: 0.3752, test_loss: 2.3562, test_f1: 0.5510
 epoch: 83, train_loss: 0.3605, test_loss: 2.0337, test_f1: 0.6413
 epoch: 84, train_loss: 0.3468, test_loss: 2.1131, test_f1: 0.6058
 epoch: 85, train_loss: 0.3798, test_loss: 2.3118, test_f1: 0.6188
 epoch: 86, train_loss: 0.3323, test_loss: 2.0502, test_f1: 0.6368
 epoch: 87, train_loss: 0.3582, test_loss: 2.2282, test_f1: 0.6412
 epoch: 88, train_loss: 0.3405, test_loss: 2.1803, test_f1: 0.5926
 epoch: 89, train_loss: 0.3087, test_loss: 2.0452, test_f1: 0.6257
 epoch: 90, train_loss: 0.3319, test_loss: 1.9830, test_f1: 0.6208
 epoch: 91, train_loss: 0.3313, test_loss: 1.7233, test_f1: 0.6771
 epoch: 92, train_loss: 0.3164, test_loss: 2.2324, test_f1: 0.6524
 epoch: 93, train_loss: 0.3081, test_loss: 2.2113, test_f1: 0.6541
 epoch: 94, train_loss: 0.3070, test_loss: 2.0910, test_f1: 0.6256
 epoch: 95, train_loss: 0.3176, test_loss: 1.9031, test_f1: 0.6464
 epoch: 96, train_loss: 0.3091, test_loss: 2.0285, test_f1: 0.6408
 epoch: 97, train_loss: 0.3128, test_loss: 2.0254, test_f1: 0.6103
 epoch: 98, train_loss: 0.2804, test_loss: 2.2221, test_f1: 0.6025
 epoch: 99, train_loss: 0.2833, test_loss: 2.4775, test_f1: 0.5763
##################ITERATION #8 ****************************************
 epoch: 0, train_loss: 1.1823, test_loss: 1.2366, test_f1: 0.2986
 epoch: 1, train_loss: 0.9465, test_loss: 1.0869, test_f1: 0.5375
 epoch: 2, train_loss: 0.9066, test_loss: 0.9701, test_f1: 0.4802
 epoch: 3, train_loss: 0.8745, test_loss: 0.9617, test_f1: 0.5900
 epoch: 4, train_loss: 0.8432, test_loss: 1.0901, test_f1: 0.5428
 epoch: 5, train_loss: 0.8320, test_loss: 1.0050, test_f1: 0.6031
 epoch: 6, train_loss: 0.7995, test_loss: 0.9688, test_f1: 0.6210
 epoch: 7, train_loss: 0.8235, test_loss: 1.0002, test_f1: 0.5751
 epoch: 8, train_loss: 0.8029, test_loss: 0.9253, test_f1: 0.6092
 epoch: 9, train_loss: 0.7452, test_loss: 1.1161, test_f1: 0.5765
 epoch: 10, train_loss: 0.7699, test_loss: 1.1384, test_f1: 0.5853
 epoch: 11, train_loss: 0.7710, test_loss: 1.0213, test_f1: 0.5156
 epoch: 12, train_loss: 0.7418, test_loss: 1.0269, test_f1: 0.5710
 epoch: 13, train_loss: 0.7017, test_loss: 0.9205, test_f1: 0.6255
 epoch: 14, train_loss: 0.7552, test_loss: 0.9686, test_f1: 0.6060
 epoch: 15, train_loss: 0.6864, test_loss: 0.8888, test_f1: 0.6172
 epoch: 16, train_loss: 0.6723, test_loss: 0.9744, test_f1: 0.6205
 epoch: 17, train_loss: 0.7153, test_loss: 1.0522, test_f1: 0.5742
 epoch: 18, train_loss: 0.7080, test_loss: 1.0879, test_f1: 0.5604
 epoch: 19, train_loss: 0.6884, test_loss: 0.9223, test_f1: 0.6319
 epoch: 20, train_loss: 0.6545, test_loss: 1.0751, test_f1: 0.5918
 epoch: 21, train_loss: 0.6679, test_loss: 0.9964, test_f1: 0.6516
 epoch: 22, train_loss: 0.6118, test_loss: 1.0712, test_f1: 0.6098
 epoch: 23, train_loss: 0.6673, test_loss: 0.9661, test_f1: 0.5800
 epoch: 24, train_loss: 0.6285, test_loss: 1.0311, test_f1: 0.5951
 epoch: 25, train_loss: 0.6270, test_loss: 0.9419, test_f1: 0.6128
 epoch: 26, train_loss: 0.6240, test_loss: 1.0189, test_f1: 0.6269
 epoch: 27, train_loss: 0.6308, test_loss: 0.9007, test_f1: 0.6117
 epoch: 28, train_loss: 0.6138, test_loss: 0.9680, test_f1: 0.6799
 epoch: 29, train_loss: 0.5963, test_loss: 0.8857, test_f1: 0.6582
 epoch: 30, train_loss: 0.5702, test_loss: 0.8710, test_f1: 0.6856
 epoch: 31, train_loss: 0.5679, test_loss: 0.9403, test_f1: 0.6003
 epoch: 32, train_loss: 0.5999, test_loss: 1.1358, test_f1: 0.5709
 epoch: 33, train_loss: 0.6096, test_loss: 1.0873, test_f1: 0.6213
 epoch: 34, train_loss: 0.5822, test_loss: 1.0065, test_f1: 0.6676
 epoch: 35, train_loss: 0.5703, test_loss: 0.9557, test_f1: 0.6294
 epoch: 36, train_loss: 0.5719, test_loss: 1.0140, test_f1: 0.5959
 epoch: 37, train_loss: 0.5534, test_loss: 0.9213, test_f1: 0.6915
 epoch: 38, train_loss: 0.5522, test_loss: 1.2279, test_f1: 0.6187
 epoch: 39, train_loss: 0.5068, test_loss: 1.2621, test_f1: 0.5324
 epoch: 40, train_loss: 0.5214, test_loss: 1.7325, test_f1: 0.5390
 epoch: 41, train_loss: 0.5184, test_loss: 1.0374, test_f1: 0.6538
 epoch: 42, train_loss: 0.5112, test_loss: 1.1608, test_f1: 0.6113
 epoch: 43, train_loss: 0.5117, test_loss: 1.1190, test_f1: 0.6302
 epoch: 44, train_loss: 0.5230, test_loss: 1.0937, test_f1: 0.6101
 epoch: 45, train_loss: 0.5094, test_loss: 1.0428, test_f1: 0.6160
 epoch: 46, train_loss: 0.4995, test_loss: 0.9225, test_f1: 0.6704
 epoch: 47, train_loss: 0.4947, test_loss: 1.1091, test_f1: 0.6754
 epoch: 48, train_loss: 0.5082, test_loss: 1.1033, test_f1: 0.6423
 epoch: 49, train_loss: 0.4671, test_loss: 1.0414, test_f1: 0.6562
 epoch: 50, train_loss: 0.4694, test_loss: 1.0727, test_f1: 0.6281
 epoch: 51, train_loss: 0.4246, test_loss: 1.0041, test_f1: 0.6720
 epoch: 52, train_loss: 0.3549, test_loss: 1.1942, test_f1: 0.6399
 epoch: 53, train_loss: 0.3749, test_loss: 1.3167, test_f1: 0.6005
 epoch: 54, train_loss: 0.3734, test_loss: 1.1454, test_f1: 0.6678
 epoch: 55, train_loss: 0.3444, test_loss: 1.0725, test_f1: 0.7028
 epoch: 56, train_loss: 0.3192, test_loss: 1.3082, test_f1: 0.6794
 epoch: 57, train_loss: 0.3399, test_loss: 1.4351, test_f1: 0.6641
 epoch: 58, train_loss: 0.3413, test_loss: 1.3038, test_f1: 0.6648
 epoch: 59, train_loss: 0.3461, test_loss: 1.3363, test_f1: 0.6850
 epoch: 60, train_loss: 0.3236, test_loss: 1.4883, test_f1: 0.6399
 epoch: 61, train_loss: 0.3436, test_loss: 1.3148, test_f1: 0.6568
 epoch: 62, train_loss: 0.3414, test_loss: 1.1360, test_f1: 0.6933
 epoch: 63, train_loss: 0.2941, test_loss: 1.3729, test_f1: 0.6578
 epoch: 64, train_loss: 0.3266, test_loss: 1.3298, test_f1: 0.6063
 epoch: 65, train_loss: 0.3083, test_loss: 1.3174, test_f1: 0.6593
 epoch: 66, train_loss: 0.3009, test_loss: 1.5105, test_f1: 0.6504
 epoch: 67, train_loss: 0.2953, test_loss: 1.2819, test_f1: 0.6998
 epoch: 68, train_loss: 0.2636, test_loss: 1.5898, test_f1: 0.6869
 epoch: 69, train_loss: 0.2863, test_loss: 1.6316, test_f1: 0.6438
 epoch: 70, train_loss: 0.2854, test_loss: 1.5913, test_f1: 0.6912
 epoch: 71, train_loss: 0.2977, test_loss: 1.6466, test_f1: 0.6470
 epoch: 72, train_loss: 0.2624, test_loss: 1.8008, test_f1: 0.6714
 epoch: 73, train_loss: 0.2665, test_loss: 1.9374, test_f1: 0.6520
 epoch: 74, train_loss: 0.2486, test_loss: 1.7442, test_f1: 0.6823
 epoch: 75, train_loss: 0.2753, test_loss: 2.1007, test_f1: 0.6622
 epoch: 76, train_loss: 0.3027, test_loss: 1.7746, test_f1: 0.6303
 epoch: 77, train_loss: 0.2953, test_loss: 1.6469, test_f1: 0.6404
 epoch: 78, train_loss: 0.2503, test_loss: 1.7342, test_f1: 0.6488
 epoch: 79, train_loss: 0.2304, test_loss: 1.7228, test_f1: 0.6377
 epoch: 80, train_loss: 0.2362, test_loss: 1.6695, test_f1: 0.6682
 epoch: 81, train_loss: 0.2610, test_loss: 1.5735, test_f1: 0.6563
 epoch: 82, train_loss: 0.2364, test_loss: 1.3701, test_f1: 0.6926
 epoch: 83, train_loss: 0.2135, test_loss: 1.9755, test_f1: 0.6373
 epoch: 84, train_loss: 0.2389, test_loss: 1.7490, test_f1: 0.6561
 epoch: 85, train_loss: 0.2335, test_loss: 1.8279, test_f1: 0.6533
 epoch: 86, train_loss: 0.2429, test_loss: 1.6423, test_f1: 0.6678
 epoch: 87, train_loss: 0.2123, test_loss: 1.8581, test_f1: 0.6338
 epoch: 88, train_loss: 0.2560, test_loss: 1.9606, test_f1: 0.6300
 epoch: 89, train_loss: 0.2168, test_loss: 2.0703, test_f1: 0.6499
 epoch: 90, train_loss: 0.2316, test_loss: 2.0797, test_f1: 0.6950
 epoch: 91, train_loss: 0.2131, test_loss: 2.0416, test_f1: 0.6485
 epoch: 92, train_loss: 0.1977, test_loss: 1.9264, test_f1: 0.6898
 epoch: 93, train_loss: 0.1839, test_loss: 1.9208, test_f1: 0.6854
 epoch: 94, train_loss: 0.2117, test_loss: 1.8709, test_f1: 0.6790
 epoch: 95, train_loss: 0.1941, test_loss: 1.7603, test_f1: 0.6867
 epoch: 96, train_loss: 0.1808, test_loss: 1.9404, test_f1: 0.6464
 epoch: 97, train_loss: 0.1727, test_loss: 1.7388, test_f1: 0.6697
 epoch: 98, train_loss: 0.2685, test_loss: 1.7544, test_f1: 0.6971
 epoch: 99, train_loss: 0.2167, test_loss: 1.8999, test_f1: 0.6802
##################ITERATION #9 ****************************************
 epoch: 0, train_loss: 1.3051, test_loss: 1.6280, test_f1: 0.2923
 epoch: 1, train_loss: 1.0048, test_loss: 1.0141, test_f1: 0.4572
 epoch: 2, train_loss: 0.9267, test_loss: 0.9702, test_f1: 0.5594
 epoch: 3, train_loss: 0.8833, test_loss: 1.0459, test_f1: 0.4798
 epoch: 4, train_loss: 0.8705, test_loss: 1.0965, test_f1: 0.5014
 epoch: 5, train_loss: 0.8375, test_loss: 0.9316, test_f1: 0.6223
 epoch: 6, train_loss: 0.8289, test_loss: 1.0273, test_f1: 0.5541
 epoch: 7, train_loss: 0.7721, test_loss: 0.9904, test_f1: 0.4775
 epoch: 8, train_loss: 0.8152, test_loss: 1.0201, test_f1: 0.5707
 epoch: 9, train_loss: 0.7938, test_loss: 1.1304, test_f1: 0.4683
 epoch: 10, train_loss: 0.7704, test_loss: 1.1457, test_f1: 0.5737
 epoch: 11, train_loss: 0.7353, test_loss: 1.8822, test_f1: 0.4602
 epoch: 12, train_loss: 0.7420, test_loss: 1.0778, test_f1: 0.5723
 epoch: 13, train_loss: 0.7408, test_loss: 0.9606, test_f1: 0.6172
 epoch: 14, train_loss: 0.7084, test_loss: 1.0618, test_f1: 0.5993
 epoch: 15, train_loss: 0.7423, test_loss: 1.2536, test_f1: 0.5215
 epoch: 16, train_loss: 0.7097, test_loss: 1.3019, test_f1: 0.5660
 epoch: 17, train_loss: 0.7304, test_loss: 1.5125, test_f1: 0.4302
 epoch: 18, train_loss: 0.7701, test_loss: 1.4197, test_f1: 0.5788
 epoch: 19, train_loss: 0.7212, test_loss: 1.0130, test_f1: 0.5960
 epoch: 20, train_loss: 0.6975, test_loss: 1.1572, test_f1: 0.5266
 epoch: 21, train_loss: 0.6655, test_loss: 1.0405, test_f1: 0.5337
 epoch: 22, train_loss: 0.6395, test_loss: 1.2206, test_f1: 0.5985
 epoch: 23, train_loss: 0.6402, test_loss: 1.1717, test_f1: 0.4939
 epoch: 24, train_loss: 0.6221, test_loss: 1.1132, test_f1: 0.6074
 epoch: 25, train_loss: 0.6605, test_loss: 1.0681, test_f1: 0.5690
 epoch: 26, train_loss: 0.6351, test_loss: 1.1651, test_f1: 0.5425
 epoch: 27, train_loss: 0.6215, test_loss: 1.1084, test_f1: 0.5547
 epoch: 28, train_loss: 0.5985, test_loss: 1.0181, test_f1: 0.6493
 epoch: 29, train_loss: 0.6097, test_loss: 1.3768, test_f1: 0.5019
 epoch: 30, train_loss: 0.5885, test_loss: 1.1087, test_f1: 0.5901
 epoch: 31, train_loss: 0.5831, test_loss: 1.1248, test_f1: 0.6152
 epoch: 32, train_loss: 0.6009, test_loss: 1.4312, test_f1: 0.5798
 epoch: 33, train_loss: 0.5732, test_loss: 1.2846, test_f1: 0.5973
 epoch: 34, train_loss: 0.6087, test_loss: 1.0207, test_f1: 0.6301
 epoch: 35, train_loss: 0.5788, test_loss: 1.3362, test_f1: 0.5652
 epoch: 36, train_loss: 0.5223, test_loss: 1.3004, test_f1: 0.5869
 epoch: 37, train_loss: 0.5400, test_loss: 0.9797, test_f1: 0.6318
 epoch: 38, train_loss: 0.5557, test_loss: 1.1472, test_f1: 0.6362
 epoch: 39, train_loss: 0.5676, test_loss: 1.2721, test_f1: 0.5560
 epoch: 40, train_loss: 0.5422, test_loss: 1.1472, test_f1: 0.6029
 epoch: 41, train_loss: 0.5605, test_loss: 1.5363, test_f1: 0.5309
 epoch: 42, train_loss: 0.5468, test_loss: 1.2034, test_f1: 0.5952
 epoch: 43, train_loss: 0.4917, test_loss: 1.1066, test_f1: 0.6214
 epoch: 44, train_loss: 0.5125, test_loss: 1.2071, test_f1: 0.6238
 epoch: 45, train_loss: 0.5084, test_loss: 1.1569, test_f1: 0.6285
 epoch: 46, train_loss: 0.4834, test_loss: 1.3702, test_f1: 0.5825
 epoch: 47, train_loss: 0.4914, test_loss: 1.2382, test_f1: 0.6328
 epoch: 48, train_loss: 0.5024, test_loss: 1.2999, test_f1: 0.6360
 epoch: 49, train_loss: 0.4716, test_loss: 1.1777, test_f1: 0.6587
 epoch: 50, train_loss: 0.4734, test_loss: 1.5668, test_f1: 0.5319
 epoch: 51, train_loss: 0.4455, test_loss: 1.2329, test_f1: 0.6486
 epoch: 52, train_loss: 0.3852, test_loss: 1.3242, test_f1: 0.5775
 epoch: 53, train_loss: 0.4173, test_loss: 1.2633, test_f1: 0.6350
 epoch: 54, train_loss: 0.3894, test_loss: 1.2175, test_f1: 0.6460
 epoch: 55, train_loss: 0.3809, test_loss: 1.1734, test_f1: 0.6748
 epoch: 56, train_loss: 0.3673, test_loss: 1.3188, test_f1: 0.6514
 epoch: 57, train_loss: 0.3812, test_loss: 1.3784, test_f1: 0.6453
 epoch: 58, train_loss: 0.3751, test_loss: 1.1771, test_f1: 0.6774
 epoch: 59, train_loss: 0.3405, test_loss: 1.2984, test_f1: 0.6951
 epoch: 60, train_loss: 0.3622, test_loss: 1.1969, test_f1: 0.7056
 epoch: 61, train_loss: 0.3622, test_loss: 1.2575, test_f1: 0.6278
 epoch: 62, train_loss: 0.4015, test_loss: 1.3451, test_f1: 0.6648
 epoch: 63, train_loss: 0.3435, test_loss: 1.4784, test_f1: 0.6774
 epoch: 64, train_loss: 0.3530, test_loss: 1.3291, test_f1: 0.6612
 epoch: 65, train_loss: 0.3460, test_loss: 1.5343, test_f1: 0.6714
 epoch: 66, train_loss: 0.3360, test_loss: 1.3089, test_f1: 0.6603
 epoch: 67, train_loss: 0.3480, test_loss: 1.4106, test_f1: 0.6625
 epoch: 68, train_loss: 0.3503, test_loss: 1.6565, test_f1: 0.5987
 epoch: 69, train_loss: 0.3462, test_loss: 1.4429, test_f1: 0.6676
 epoch: 70, train_loss: 0.3129, test_loss: 1.5563, test_f1: 0.6563
 epoch: 71, train_loss: 0.3107, test_loss: 1.4960, test_f1: 0.6454
 epoch: 72, train_loss: 0.3013, test_loss: 1.5678, test_f1: 0.6507
 epoch: 73, train_loss: 0.3117, test_loss: 1.6209, test_f1: 0.6301
 epoch: 74, train_loss: 0.2814, test_loss: 1.8273, test_f1: 0.6838
 epoch: 75, train_loss: 0.2865, test_loss: 1.8601, test_f1: 0.6713
 epoch: 76, train_loss: 0.3183, test_loss: 1.8578, test_f1: 0.6322
 epoch: 77, train_loss: 0.2942, test_loss: 1.6900, test_f1: 0.6206
 epoch: 78, train_loss: 0.2941, test_loss: 1.7828, test_f1: 0.6411
 epoch: 79, train_loss: 0.2845, test_loss: 1.4818, test_f1: 0.6821
 epoch: 80, train_loss: 0.2777, test_loss: 1.7272, test_f1: 0.6365
 epoch: 81, train_loss: 0.2876, test_loss: 2.0238, test_f1: 0.6148
 epoch: 82, train_loss: 0.2849, test_loss: 1.6588, test_f1: 0.6853
 epoch: 83, train_loss: 0.2661, test_loss: 1.9549, test_f1: 0.6446
 epoch: 84, train_loss: 0.2491, test_loss: 1.9036, test_f1: 0.6663
 epoch: 85, train_loss: 0.2689, test_loss: 1.7673, test_f1: 0.7119
 epoch: 86, train_loss: 0.3073, test_loss: 1.9052, test_f1: 0.6416
 epoch: 87, train_loss: 0.2379, test_loss: 1.8517, test_f1: 0.6468
 epoch: 88, train_loss: 0.2440, test_loss: 2.0836, test_f1: 0.6530
 epoch: 89, train_loss: 0.2329, test_loss: 1.9367, test_f1: 0.6597
 epoch: 90, train_loss: 0.2492, test_loss: 1.7978, test_f1: 0.6280
 epoch: 91, train_loss: 0.2654, test_loss: 1.7063, test_f1: 0.6422
 epoch: 92, train_loss: 0.2633, test_loss: 1.5938, test_f1: 0.6534
 epoch: 93, train_loss: 0.2196, test_loss: 1.8142, test_f1: 0.6678
 epoch: 94, train_loss: 0.1901, test_loss: 1.7999, test_f1: 0.6766
 epoch: 95, train_loss: 0.1866, test_loss: 1.8478, test_f1: 0.6846
 epoch: 96, train_loss: 0.2317, test_loss: 2.0824, test_f1: 0.6706
 epoch: 97, train_loss: 0.2221, test_loss: 1.9918, test_f1: 0.6718
 epoch: 98, train_loss: 0.2289, test_loss: 1.8019, test_f1: 0.6632
 epoch: 99, train_loss: 0.1807, test_loss: 1.8640, test_f1: 0.7199

Training completed in 424.37 seconds
Best F1: 0.7199 at epoch 99
Mean F1 across iterations: 0.6901  0.0203
========================FINAL RESULTS================================
FEGIN weighted F1: 0.7199  0.0203
python main.py --data ltspice_demos --representation component_pin --model FEGIN --layers 3 --hiddens 128 --batch_size 64 --lr 0.01 --emb_size 512 --epochs 100 --save_appendix component_pin_L3_H128_BS64_LR0.01_E512 --no_val
-----



STDERR:
  File "main.py", line 370, in <module>
    main()
  File "main.py", line 254, in main
    dataset = dataset_class(
  File "/home/philip/projects/ltspice_examples_code_repo/Circuit-Completion-Using-GNNs/component_classification_with_link_prediction_head/evaluation/FEGIN/kernel/circuit_datasets.py", line 15, in __init__
    self.data, self.slices = torch.load(self.processed_paths[0])
  File "/home/philip/.local/lib/python3.8/site-packages/torch/serialization.py", line 1040, in load
    warnings.warn(
  File "/usr/lib/python3.8/warnings.py", line 109, in _showwarnmsg
    sw(msg.message, msg.category, msg.filename, msg.lineno,
  File "main.py", line 47, in warn_with_traceback
    traceback.print_stack(file=log)
/home/philip/projects/ltspice_examples_code_repo/Circuit-Completion-Using-GNNs/component_classification_with_link_prediction_head/evaluation/FEGIN/kernel/circuit_datasets.py:15: FutureWarning: You are using `torch.load` with `weights_only=False` (the current default value), which uses the default pickle module implicitly. It is possible to construct malicious pickle data which will execute arbitrary code during unpickling (See https://github.com/pytorch/pytorch/blob/main/SECURITY.md#untrusted-models for more details). In a future release, the default value for `weights_only` will be flipped to `True`. This limits the functions that could be executed during unpickling. Arbitrary objects will no longer be allowed to be loaded via this mode unless they are explicitly allowlisted by the user via `torch.serialization.add_safe_globals`. We recommend you start setting `weights_only=True` for any use case where you don't have full control of the loaded file. Please open an issue on GitHub for any issues related to this experimental feature.
  self.data, self.slices = torch.load(self.processed_paths[0])
