STDOUT:
Results will be saved in /home/philip/projects/ltspice_examples_code_repo/Circuit-Completion-Using-GNNs/component_classification_with_link_prediction_head/evaluation/FEGIN/results/model_FEGIN_dataset_ltspice_demos
Command line input: python main.py --data ltspice_demos --representation component_pin --model FEGIN --layers 6 --hiddens 64 --batch_size 128 --lr 0.0001 --emb_size 250 --epochs 100 --save_appendix component_pin_L6_H64_BS128_LR0.0001_E250 --no_val
 is saved.
-----
ltspice_demos - FEGIN
Using 6 layers, 64 hidden units, h = 2
Loading component_pin representation dataset
ENTERED
Training FEGIN on component_pin representation
Train: 1565, Test: 383
##################ITERATION #0 ****************************************
 epoch: 0, train_loss: 1.3906, test_loss: 1.3906, test_f1: 0.1365
 epoch: 1, train_loss: 1.3842, test_loss: 1.3876, test_f1: 0.1365
 epoch: 2, train_loss: 1.3797, test_loss: 1.3846, test_f1: 0.1365
 epoch: 3, train_loss: 1.3752, test_loss: 1.3815, test_f1: 0.1365
 epoch: 4, train_loss: 1.3697, test_loss: 1.3780, test_f1: 0.1365
 epoch: 5, train_loss: 1.3637, test_loss: 1.3737, test_f1: 0.1533
 epoch: 6, train_loss: 1.3568, test_loss: 1.3678, test_f1: 0.2842
 epoch: 7, train_loss: 1.3487, test_loss: 1.3607, test_f1: 0.3285
 epoch: 8, train_loss: 1.3386, test_loss: 1.3527, test_f1: 0.3231
 epoch: 9, train_loss: 1.3257, test_loss: 1.3431, test_f1: 0.3379
 epoch: 10, train_loss: 1.3110, test_loss: 1.3320, test_f1: 0.3349
 epoch: 11, train_loss: 1.2935, test_loss: 1.3206, test_f1: 0.3370
 epoch: 12, train_loss: 1.2735, test_loss: 1.3080, test_f1: 0.3391
 epoch: 13, train_loss: 1.2570, test_loss: 1.2946, test_f1: 0.3305
 epoch: 14, train_loss: 1.2386, test_loss: 1.2836, test_f1: 0.3388
 epoch: 15, train_loss: 1.2206, test_loss: 1.2732, test_f1: 0.3388
 epoch: 16, train_loss: 1.2034, test_loss: 1.2645, test_f1: 0.3386
 epoch: 17, train_loss: 1.1899, test_loss: 1.2549, test_f1: 0.3303
 epoch: 18, train_loss: 1.1848, test_loss: 1.2454, test_f1: 0.3342
 epoch: 19, train_loss: 1.1703, test_loss: 1.2388, test_f1: 0.3343
 epoch: 20, train_loss: 1.1659, test_loss: 1.2344, test_f1: 0.3341
 epoch: 21, train_loss: 1.1582, test_loss: 1.2448, test_f1: 0.3340
 epoch: 22, train_loss: 1.1520, test_loss: 1.2277, test_f1: 0.3369
 epoch: 23, train_loss: 1.1450, test_loss: 1.2256, test_f1: 0.3396
 epoch: 24, train_loss: 1.1362, test_loss: 1.2217, test_f1: 0.3679
 epoch: 25, train_loss: 1.1290, test_loss: 1.2183, test_f1: 0.3812
 epoch: 26, train_loss: 1.1242, test_loss: 1.2153, test_f1: 0.4085
 epoch: 27, train_loss: 1.1224, test_loss: 1.2110, test_f1: 0.4187
 epoch: 28, train_loss: 1.1149, test_loss: 1.1983, test_f1: 0.4372
 epoch: 29, train_loss: 1.1125, test_loss: 1.1936, test_f1: 0.4430
 epoch: 30, train_loss: 1.1033, test_loss: 1.1912, test_f1: 0.4211
 epoch: 31, train_loss: 1.0993, test_loss: 1.1866, test_f1: 0.4434
 epoch: 32, train_loss: 1.0941, test_loss: 1.1831, test_f1: 0.4288
 epoch: 33, train_loss: 1.0879, test_loss: 1.1798, test_f1: 0.4478
 epoch: 34, train_loss: 1.0794, test_loss: 1.1757, test_f1: 0.4402
 epoch: 35, train_loss: 1.0789, test_loss: 1.1853, test_f1: 0.4254
 epoch: 36, train_loss: 1.0689, test_loss: 1.1647, test_f1: 0.4449
 epoch: 37, train_loss: 1.0566, test_loss: 1.1457, test_f1: 0.4453
 epoch: 38, train_loss: 1.0494, test_loss: 1.1541, test_f1: 0.4510
 epoch: 39, train_loss: 1.0419, test_loss: 1.1373, test_f1: 0.4473
 epoch: 40, train_loss: 1.0401, test_loss: 1.1484, test_f1: 0.4412
 epoch: 41, train_loss: 1.0272, test_loss: 1.1225, test_f1: 0.4504
 epoch: 42, train_loss: 1.0204, test_loss: 1.1257, test_f1: 0.4474
 epoch: 43, train_loss: 1.0095, test_loss: 1.1338, test_f1: 0.4319
 epoch: 44, train_loss: 1.0100, test_loss: 1.1155, test_f1: 0.4466
 epoch: 45, train_loss: 0.9937, test_loss: 1.1051, test_f1: 0.4583
 epoch: 46, train_loss: 0.9843, test_loss: 1.1223, test_f1: 0.4553
 epoch: 47, train_loss: 0.9817, test_loss: 1.0928, test_f1: 0.4491
 epoch: 48, train_loss: 0.9706, test_loss: 1.0887, test_f1: 0.4496
 epoch: 49, train_loss: 0.9550, test_loss: 1.0994, test_f1: 0.4482
 epoch: 50, train_loss: 0.9535, test_loss: 1.1055, test_f1: 0.4491
 epoch: 51, train_loss: 0.9363, test_loss: 1.0815, test_f1: 0.4467
 epoch: 52, train_loss: 0.9309, test_loss: 1.0829, test_f1: 0.4491
 epoch: 53, train_loss: 0.9259, test_loss: 1.0743, test_f1: 0.4550
 epoch: 54, train_loss: 0.9182, test_loss: 1.0636, test_f1: 0.4478
 epoch: 55, train_loss: 0.9115, test_loss: 1.0697, test_f1: 0.4507
 epoch: 56, train_loss: 0.9094, test_loss: 1.0815, test_f1: 0.4550
 epoch: 57, train_loss: 0.9094, test_loss: 1.0687, test_f1: 0.4462
 epoch: 58, train_loss: 0.8971, test_loss: 1.0662, test_f1: 0.4650
 epoch: 59, train_loss: 0.8970, test_loss: 1.0563, test_f1: 0.4529
 epoch: 60, train_loss: 0.8984, test_loss: 1.0753, test_f1: 0.4503
 epoch: 61, train_loss: 0.9005, test_loss: 1.0630, test_f1: 0.4508
 epoch: 62, train_loss: 0.8930, test_loss: 1.0491, test_f1: 0.4629
 epoch: 63, train_loss: 0.8927, test_loss: 1.0606, test_f1: 0.4677
 epoch: 64, train_loss: 0.8806, test_loss: 1.0426, test_f1: 0.4614
 epoch: 65, train_loss: 0.8814, test_loss: 1.0566, test_f1: 0.4647
 epoch: 66, train_loss: 0.8908, test_loss: 1.0715, test_f1: 0.4727
 epoch: 67, train_loss: 0.8696, test_loss: 1.0410, test_f1: 0.4874
 epoch: 68, train_loss: 0.8732, test_loss: 1.0517, test_f1: 0.4771
 epoch: 69, train_loss: 0.8658, test_loss: 1.0496, test_f1: 0.4865
 epoch: 70, train_loss: 0.8600, test_loss: 1.0523, test_f1: 0.5138
 epoch: 71, train_loss: 0.8627, test_loss: 1.0686, test_f1: 0.4715
 epoch: 72, train_loss: 0.8653, test_loss: 1.0438, test_f1: 0.5148
 epoch: 73, train_loss: 0.8552, test_loss: 1.0571, test_f1: 0.4818
 epoch: 74, train_loss: 0.8535, test_loss: 1.0513, test_f1: 0.5150
 epoch: 75, train_loss: 0.8526, test_loss: 1.0381, test_f1: 0.5293
 epoch: 76, train_loss: 0.8527, test_loss: 1.0542, test_f1: 0.5086
 epoch: 77, train_loss: 0.8427, test_loss: 1.0383, test_f1: 0.5194
 epoch: 78, train_loss: 0.8500, test_loss: 1.0239, test_f1: 0.5296
 epoch: 79, train_loss: 0.8391, test_loss: 1.0445, test_f1: 0.5204
 epoch: 80, train_loss: 0.8362, test_loss: 1.0354, test_f1: 0.5358
 epoch: 81, train_loss: 0.8368, test_loss: 1.0509, test_f1: 0.5236
 epoch: 82, train_loss: 0.8290, test_loss: 1.0413, test_f1: 0.5201
 epoch: 83, train_loss: 0.8264, test_loss: 1.0460, test_f1: 0.5120
 epoch: 84, train_loss: 0.8311, test_loss: 1.0425, test_f1: 0.5357
 epoch: 85, train_loss: 0.8205, test_loss: 1.0437, test_f1: 0.5153
 epoch: 86, train_loss: 0.8281, test_loss: 1.0581, test_f1: 0.5168
 epoch: 87, train_loss: 0.8145, test_loss: 1.0455, test_f1: 0.5139
 epoch: 88, train_loss: 0.8082, test_loss: 1.0463, test_f1: 0.5495
 epoch: 89, train_loss: 0.8117, test_loss: 1.0426, test_f1: 0.5158
 epoch: 90, train_loss: 0.8046, test_loss: 1.0451, test_f1: 0.5307
 epoch: 91, train_loss: 0.8058, test_loss: 1.0454, test_f1: 0.5379
 epoch: 92, train_loss: 0.7933, test_loss: 1.0323, test_f1: 0.5344
 epoch: 93, train_loss: 0.7952, test_loss: 1.0469, test_f1: 0.5290
 epoch: 94, train_loss: 0.8026, test_loss: 1.0435, test_f1: 0.5400
 epoch: 95, train_loss: 0.7965, test_loss: 1.0380, test_f1: 0.5557
 epoch: 96, train_loss: 0.7972, test_loss: 1.0425, test_f1: 0.5382
 epoch: 97, train_loss: 0.8010, test_loss: 1.0609, test_f1: 0.5435
 epoch: 98, train_loss: 0.7897, test_loss: 1.0445, test_f1: 0.5448
 epoch: 99, train_loss: 0.7867, test_loss: 1.0192, test_f1: 0.5469
##################ITERATION #1 ****************************************
 epoch: 0, train_loss: 1.3583, test_loss: 1.3695, test_f1: 0.1365
 epoch: 1, train_loss: 1.3381, test_loss: 1.3605, test_f1: 0.1365
 epoch: 2, train_loss: 1.3242, test_loss: 1.3492, test_f1: 0.1365
 epoch: 3, train_loss: 1.3061, test_loss: 1.3360, test_f1: 0.3021
 epoch: 4, train_loss: 1.2913, test_loss: 1.3239, test_f1: 0.3345
 epoch: 5, train_loss: 1.2717, test_loss: 1.3102, test_f1: 0.3454
 epoch: 6, train_loss: 1.2537, test_loss: 1.2972, test_f1: 0.3432
 epoch: 7, train_loss: 1.2347, test_loss: 1.2857, test_f1: 0.3457
 epoch: 8, train_loss: 1.2175, test_loss: 1.2728, test_f1: 0.3532
 epoch: 9, train_loss: 1.2019, test_loss: 1.2627, test_f1: 0.3477
 epoch: 10, train_loss: 1.1915, test_loss: 1.2538, test_f1: 0.3533
 epoch: 11, train_loss: 1.1807, test_loss: 1.2454, test_f1: 0.3553
 epoch: 12, train_loss: 1.1674, test_loss: 1.2358, test_f1: 0.3522
 epoch: 13, train_loss: 1.1608, test_loss: 1.2288, test_f1: 0.3725
 epoch: 14, train_loss: 1.1535, test_loss: 1.2210, test_f1: 0.4104
 epoch: 15, train_loss: 1.1468, test_loss: 1.2232, test_f1: 0.4235
 epoch: 16, train_loss: 1.1351, test_loss: 1.2109, test_f1: 0.4264
 epoch: 17, train_loss: 1.1258, test_loss: 1.2023, test_f1: 0.4497
 epoch: 18, train_loss: 1.1135, test_loss: 1.1914, test_f1: 0.4500
 epoch: 19, train_loss: 1.1091, test_loss: 1.1776, test_f1: 0.4511
 epoch: 20, train_loss: 1.1036, test_loss: 1.1731, test_f1: 0.4594
 epoch: 21, train_loss: 1.0896, test_loss: 1.1754, test_f1: 0.4582
 epoch: 22, train_loss: 1.0782, test_loss: 1.1644, test_f1: 0.4609
 epoch: 23, train_loss: 1.0706, test_loss: 1.1535, test_f1: 0.4603
 epoch: 24, train_loss: 1.0631, test_loss: 1.1486, test_f1: 0.4609
 epoch: 25, train_loss: 1.0485, test_loss: 1.1313, test_f1: 0.4623
 epoch: 26, train_loss: 1.0408, test_loss: 1.1249, test_f1: 0.4597
 epoch: 27, train_loss: 1.0347, test_loss: 1.1195, test_f1: 0.4583
 epoch: 28, train_loss: 1.0290, test_loss: 1.1153, test_f1: 0.4578
 epoch: 29, train_loss: 1.0173, test_loss: 1.1133, test_f1: 0.4603
 epoch: 30, train_loss: 1.0022, test_loss: 1.0989, test_f1: 0.4589
 epoch: 31, train_loss: 0.9907, test_loss: 1.0979, test_f1: 0.4555
 epoch: 32, train_loss: 0.9929, test_loss: 1.0900, test_f1: 0.4553
 epoch: 33, train_loss: 0.9742, test_loss: 1.0905, test_f1: 0.4516
 epoch: 34, train_loss: 0.9645, test_loss: 1.0774, test_f1: 0.4528
 epoch: 35, train_loss: 0.9649, test_loss: 1.0781, test_f1: 0.4495
 epoch: 36, train_loss: 0.9586, test_loss: 1.0731, test_f1: 0.4357
 epoch: 37, train_loss: 0.9435, test_loss: 1.0776, test_f1: 0.4335
 epoch: 38, train_loss: 0.9404, test_loss: 1.0655, test_f1: 0.4430
 epoch: 39, train_loss: 0.9335, test_loss: 1.0539, test_f1: 0.4652
 epoch: 40, train_loss: 0.9262, test_loss: 1.0615, test_f1: 0.4600
 epoch: 41, train_loss: 0.9138, test_loss: 1.0558, test_f1: 0.4557
 epoch: 42, train_loss: 0.9106, test_loss: 1.0404, test_f1: 0.4777
 epoch: 43, train_loss: 0.9132, test_loss: 1.0744, test_f1: 0.4666
 epoch: 44, train_loss: 0.8958, test_loss: 1.0400, test_f1: 0.4911
 epoch: 45, train_loss: 0.8889, test_loss: 1.0628, test_f1: 0.5205
 epoch: 46, train_loss: 0.8885, test_loss: 1.0509, test_f1: 0.5275
 epoch: 47, train_loss: 0.8766, test_loss: 1.0684, test_f1: 0.4879
 epoch: 48, train_loss: 0.8757, test_loss: 1.0551, test_f1: 0.5068
 epoch: 49, train_loss: 0.8855, test_loss: 1.0622, test_f1: 0.5193
 epoch: 50, train_loss: 0.8718, test_loss: 1.0579, test_f1: 0.5083
 epoch: 51, train_loss: 0.8564, test_loss: 1.0665, test_f1: 0.5138
 epoch: 52, train_loss: 0.8530, test_loss: 1.0705, test_f1: 0.5088
 epoch: 53, train_loss: 0.8551, test_loss: 1.0759, test_f1: 0.5165
 epoch: 54, train_loss: 0.8438, test_loss: 1.0628, test_f1: 0.5278
 epoch: 55, train_loss: 0.8393, test_loss: 1.0702, test_f1: 0.5151
 epoch: 56, train_loss: 0.8426, test_loss: 1.0641, test_f1: 0.5304
 epoch: 57, train_loss: 0.8378, test_loss: 1.0560, test_f1: 0.5280
 epoch: 58, train_loss: 0.8357, test_loss: 1.0705, test_f1: 0.5197
 epoch: 59, train_loss: 0.8349, test_loss: 1.0707, test_f1: 0.5219
 epoch: 60, train_loss: 0.8424, test_loss: 1.0764, test_f1: 0.5235
 epoch: 61, train_loss: 0.8250, test_loss: 1.0751, test_f1: 0.5305
 epoch: 62, train_loss: 0.8204, test_loss: 1.0795, test_f1: 0.5229
 epoch: 63, train_loss: 0.8188, test_loss: 1.0671, test_f1: 0.5309
 epoch: 64, train_loss: 0.8205, test_loss: 1.0937, test_f1: 0.5225
 epoch: 65, train_loss: 0.8250, test_loss: 1.0865, test_f1: 0.5303
 epoch: 66, train_loss: 0.8127, test_loss: 1.0951, test_f1: 0.5229
 epoch: 67, train_loss: 0.8107, test_loss: 1.0625, test_f1: 0.5312
 epoch: 68, train_loss: 0.8052, test_loss: 1.0795, test_f1: 0.5268
 epoch: 69, train_loss: 0.8129, test_loss: 1.1233, test_f1: 0.5114
 epoch: 70, train_loss: 0.8078, test_loss: 1.0727, test_f1: 0.5286
 epoch: 71, train_loss: 0.8038, test_loss: 1.0765, test_f1: 0.5344
 epoch: 72, train_loss: 0.8083, test_loss: 1.0820, test_f1: 0.5251
 epoch: 73, train_loss: 0.8063, test_loss: 1.0965, test_f1: 0.5303
 epoch: 74, train_loss: 0.7984, test_loss: 1.1061, test_f1: 0.5281
 epoch: 75, train_loss: 0.7920, test_loss: 1.1015, test_f1: 0.5257
 epoch: 76, train_loss: 0.7861, test_loss: 1.1141, test_f1: 0.5429
 epoch: 77, train_loss: 0.7892, test_loss: 1.0955, test_f1: 0.5229
 epoch: 78, train_loss: 0.7900, test_loss: 1.0966, test_f1: 0.5368
 epoch: 79, train_loss: 0.7837, test_loss: 1.0903, test_f1: 0.5412
 epoch: 80, train_loss: 0.7763, test_loss: 1.1192, test_f1: 0.5381
 epoch: 81, train_loss: 0.7856, test_loss: 1.1204, test_f1: 0.5116
 epoch: 82, train_loss: 0.7786, test_loss: 1.1237, test_f1: 0.5363
 epoch: 83, train_loss: 0.7752, test_loss: 1.1116, test_f1: 0.5431
 epoch: 84, train_loss: 0.7758, test_loss: 1.1349, test_f1: 0.5358
 epoch: 85, train_loss: 0.7764, test_loss: 1.1024, test_f1: 0.5386
 epoch: 86, train_loss: 0.7646, test_loss: 1.1293, test_f1: 0.5335
 epoch: 87, train_loss: 0.7601, test_loss: 1.1172, test_f1: 0.5220
 epoch: 88, train_loss: 0.7603, test_loss: 1.1108, test_f1: 0.5304
 epoch: 89, train_loss: 0.7636, test_loss: 1.1323, test_f1: 0.5453
 epoch: 90, train_loss: 0.7587, test_loss: 1.1322, test_f1: 0.5371
 epoch: 91, train_loss: 0.7669, test_loss: 1.1123, test_f1: 0.5406
 epoch: 92, train_loss: 0.7568, test_loss: 1.1144, test_f1: 0.5207
 epoch: 93, train_loss: 0.7690, test_loss: 1.1454, test_f1: 0.5410
 epoch: 94, train_loss: 0.7501, test_loss: 1.1116, test_f1: 0.5212
 epoch: 95, train_loss: 0.7511, test_loss: 1.1186, test_f1: 0.5201
 epoch: 96, train_loss: 0.7496, test_loss: 1.1582, test_f1: 0.5246
 epoch: 97, train_loss: 0.7472, test_loss: 1.1304, test_f1: 0.5267
 epoch: 98, train_loss: 0.7418, test_loss: 1.1240, test_f1: 0.5390
 epoch: 99, train_loss: 0.7415, test_loss: 1.1369, test_f1: 0.5340
##################ITERATION #2 ****************************************
 epoch: 0, train_loss: 1.3417, test_loss: 1.3608, test_f1: 0.1365
 epoch: 1, train_loss: 1.3099, test_loss: 1.3516, test_f1: 0.1365
 epoch: 2, train_loss: 1.2913, test_loss: 1.3432, test_f1: 0.1365
 epoch: 3, train_loss: 1.2743, test_loss: 1.3330, test_f1: 0.1365
 epoch: 4, train_loss: 1.2565, test_loss: 1.3153, test_f1: 0.1365
 epoch: 5, train_loss: 1.2413, test_loss: 1.2971, test_f1: 0.1485
 epoch: 6, train_loss: 1.2228, test_loss: 1.2818, test_f1: 0.1763
 epoch: 7, train_loss: 1.2093, test_loss: 1.2683, test_f1: 0.2306
 epoch: 8, train_loss: 1.1880, test_loss: 1.2509, test_f1: 0.2943
 epoch: 9, train_loss: 1.1760, test_loss: 1.2390, test_f1: 0.4346
 epoch: 10, train_loss: 1.1617, test_loss: 1.2290, test_f1: 0.4492
 epoch: 11, train_loss: 1.1448, test_loss: 1.2116, test_f1: 0.4445
 epoch: 12, train_loss: 1.1281, test_loss: 1.1961, test_f1: 0.4040
 epoch: 13, train_loss: 1.1189, test_loss: 1.1852, test_f1: 0.3866
 epoch: 14, train_loss: 1.0976, test_loss: 1.1681, test_f1: 0.3729
 epoch: 15, train_loss: 1.0850, test_loss: 1.1512, test_f1: 0.3867
 epoch: 16, train_loss: 1.0710, test_loss: 1.1398, test_f1: 0.3859
 epoch: 17, train_loss: 1.0598, test_loss: 1.1257, test_f1: 0.3821
 epoch: 18, train_loss: 1.0433, test_loss: 1.1209, test_f1: 0.3747
 epoch: 19, train_loss: 1.0325, test_loss: 1.1063, test_f1: 0.3996
 epoch: 20, train_loss: 1.0242, test_loss: 1.1019, test_f1: 0.3783
 epoch: 21, train_loss: 1.0171, test_loss: 1.0908, test_f1: 0.3835
 epoch: 22, train_loss: 0.9969, test_loss: 1.0816, test_f1: 0.3813
 epoch: 23, train_loss: 0.9939, test_loss: 1.0738, test_f1: 0.4165
 epoch: 24, train_loss: 0.9801, test_loss: 1.0650, test_f1: 0.4118
 epoch: 25, train_loss: 0.9750, test_loss: 1.0676, test_f1: 0.4279
 epoch: 26, train_loss: 0.9618, test_loss: 1.0522, test_f1: 0.4043
 epoch: 27, train_loss: 0.9560, test_loss: 1.0427, test_f1: 0.4251
 epoch: 28, train_loss: 0.9431, test_loss: 1.0447, test_f1: 0.4582
 epoch: 29, train_loss: 0.9372, test_loss: 1.0369, test_f1: 0.4312
 epoch: 30, train_loss: 0.9257, test_loss: 1.0275, test_f1: 0.4599
 epoch: 31, train_loss: 0.9229, test_loss: 1.0472, test_f1: 0.4454
 epoch: 32, train_loss: 0.9099, test_loss: 1.0187, test_f1: 0.4924
 epoch: 33, train_loss: 0.9055, test_loss: 1.0317, test_f1: 0.4628
 epoch: 34, train_loss: 0.9025, test_loss: 1.0205, test_f1: 0.4847
 epoch: 35, train_loss: 0.8875, test_loss: 1.0108, test_f1: 0.4826
 epoch: 36, train_loss: 0.8936, test_loss: 1.0036, test_f1: 0.5170
 epoch: 37, train_loss: 0.8828, test_loss: 0.9949, test_f1: 0.5051
 epoch: 38, train_loss: 0.8697, test_loss: 0.9945, test_f1: 0.4920
 epoch: 39, train_loss: 0.8636, test_loss: 0.9971, test_f1: 0.4964
 epoch: 40, train_loss: 0.8568, test_loss: 0.9914, test_f1: 0.4876
 epoch: 41, train_loss: 0.8387, test_loss: 0.9884, test_f1: 0.4985
 epoch: 42, train_loss: 0.8375, test_loss: 0.9785, test_f1: 0.5213
 epoch: 43, train_loss: 0.8262, test_loss: 1.0067, test_f1: 0.5318
 epoch: 44, train_loss: 0.8268, test_loss: 0.9769, test_f1: 0.5317
 epoch: 45, train_loss: 0.8238, test_loss: 1.0052, test_f1: 0.5106
 epoch: 46, train_loss: 0.8251, test_loss: 0.9785, test_f1: 0.5347
 epoch: 47, train_loss: 0.8054, test_loss: 0.9889, test_f1: 0.5237
 epoch: 48, train_loss: 0.7925, test_loss: 0.9582, test_f1: 0.5318
 epoch: 49, train_loss: 0.7962, test_loss: 0.9677, test_f1: 0.5470
 epoch: 50, train_loss: 0.7866, test_loss: 0.9709, test_f1: 0.5364
 epoch: 51, train_loss: 0.7809, test_loss: 0.9505, test_f1: 0.5607
 epoch: 52, train_loss: 0.7796, test_loss: 0.9670, test_f1: 0.5506
 epoch: 53, train_loss: 0.7716, test_loss: 0.9677, test_f1: 0.5528
 epoch: 54, train_loss: 0.7690, test_loss: 0.9644, test_f1: 0.5354
 epoch: 55, train_loss: 0.7676, test_loss: 0.9626, test_f1: 0.5371
 epoch: 56, train_loss: 0.7571, test_loss: 0.9550, test_f1: 0.5358
 epoch: 57, train_loss: 0.7571, test_loss: 0.9661, test_f1: 0.5448
 epoch: 58, train_loss: 0.7550, test_loss: 0.9669, test_f1: 0.5539
 epoch: 59, train_loss: 0.7575, test_loss: 0.9714, test_f1: 0.5490
 epoch: 60, train_loss: 0.7500, test_loss: 0.9701, test_f1: 0.5496
 epoch: 61, train_loss: 0.7502, test_loss: 0.9641, test_f1: 0.5638
 epoch: 62, train_loss: 0.7488, test_loss: 0.9639, test_f1: 0.5389
 epoch: 63, train_loss: 0.7468, test_loss: 0.9605, test_f1: 0.5435
 epoch: 64, train_loss: 0.7386, test_loss: 0.9775, test_f1: 0.5480
 epoch: 65, train_loss: 0.7279, test_loss: 0.9678, test_f1: 0.5400
 epoch: 66, train_loss: 0.7342, test_loss: 0.9781, test_f1: 0.5430
 epoch: 67, train_loss: 0.7399, test_loss: 0.9711, test_f1: 0.5314
 epoch: 68, train_loss: 0.7334, test_loss: 0.9604, test_f1: 0.5427
 epoch: 69, train_loss: 0.7270, test_loss: 0.9609, test_f1: 0.5639
 epoch: 70, train_loss: 0.7338, test_loss: 0.9712, test_f1: 0.5533
 epoch: 71, train_loss: 0.7241, test_loss: 0.9741, test_f1: 0.5448
 epoch: 72, train_loss: 0.7261, test_loss: 0.9709, test_f1: 0.5632
 epoch: 73, train_loss: 0.7226, test_loss: 0.9725, test_f1: 0.5425
 epoch: 74, train_loss: 0.7240, test_loss: 0.9780, test_f1: 0.5472
 epoch: 75, train_loss: 0.7208, test_loss: 0.9817, test_f1: 0.5608
 epoch: 76, train_loss: 0.7108, test_loss: 0.9743, test_f1: 0.5421
 epoch: 77, train_loss: 0.7158, test_loss: 0.9889, test_f1: 0.5338
 epoch: 78, train_loss: 0.7099, test_loss: 0.9786, test_f1: 0.5340
 epoch: 79, train_loss: 0.7133, test_loss: 0.9886, test_f1: 0.5523
 epoch: 80, train_loss: 0.7044, test_loss: 0.9805, test_f1: 0.5610
 epoch: 81, train_loss: 0.7013, test_loss: 0.9700, test_f1: 0.5627
 epoch: 82, train_loss: 0.7067, test_loss: 0.9874, test_f1: 0.5471
 epoch: 83, train_loss: 0.7052, test_loss: 0.9918, test_f1: 0.5383
 epoch: 84, train_loss: 0.6950, test_loss: 1.0091, test_f1: 0.5262
 epoch: 85, train_loss: 0.6986, test_loss: 0.9898, test_f1: 0.5359
 epoch: 86, train_loss: 0.7038, test_loss: 0.9869, test_f1: 0.5418
 epoch: 87, train_loss: 0.6922, test_loss: 0.9906, test_f1: 0.5212
 epoch: 88, train_loss: 0.6910, test_loss: 0.9771, test_f1: 0.5520
 epoch: 89, train_loss: 0.6906, test_loss: 0.9802, test_f1: 0.5244
 epoch: 90, train_loss: 0.6897, test_loss: 0.9848, test_f1: 0.5299
 epoch: 91, train_loss: 0.7102, test_loss: 0.9919, test_f1: 0.5431
 epoch: 92, train_loss: 0.6969, test_loss: 1.0028, test_f1: 0.5374
 epoch: 93, train_loss: 0.6880, test_loss: 1.0122, test_f1: 0.5353
 epoch: 94, train_loss: 0.6780, test_loss: 1.0077, test_f1: 0.5535
 epoch: 95, train_loss: 0.6903, test_loss: 1.0016, test_f1: 0.5494
 epoch: 96, train_loss: 0.6767, test_loss: 1.0221, test_f1: 0.5295
 epoch: 97, train_loss: 0.6829, test_loss: 1.0027, test_f1: 0.5487
 epoch: 98, train_loss: 0.6830, test_loss: 1.0301, test_f1: 0.5460
 epoch: 99, train_loss: 0.6727, test_loss: 1.0058, test_f1: 0.5330
##################ITERATION #3 ****************************************
 epoch: 0, train_loss: 1.2969, test_loss: 1.3187, test_f1: 0.1527
 epoch: 1, train_loss: 1.2537, test_loss: 1.3069, test_f1: 0.1527
 epoch: 2, train_loss: 1.2363, test_loss: 1.3044, test_f1: 0.1836
 epoch: 3, train_loss: 1.2180, test_loss: 1.2879, test_f1: 0.1883
 epoch: 4, train_loss: 1.2007, test_loss: 1.2658, test_f1: 0.3388
 epoch: 5, train_loss: 1.1863, test_loss: 1.2497, test_f1: 0.4071
 epoch: 6, train_loss: 1.1712, test_loss: 1.2346, test_f1: 0.4046
 epoch: 7, train_loss: 1.1590, test_loss: 1.2178, test_f1: 0.3872
 epoch: 8, train_loss: 1.1448, test_loss: 1.2101, test_f1: 0.3660
 epoch: 9, train_loss: 1.1274, test_loss: 1.1952, test_f1: 0.3804
 epoch: 10, train_loss: 1.1132, test_loss: 1.1778, test_f1: 0.3928
 epoch: 11, train_loss: 1.1014, test_loss: 1.1712, test_f1: 0.3987
 epoch: 12, train_loss: 1.0865, test_loss: 1.1635, test_f1: 0.3895
 epoch: 13, train_loss: 1.0733, test_loss: 1.1486, test_f1: 0.3852
 epoch: 14, train_loss: 1.0666, test_loss: 1.1388, test_f1: 0.3716
 epoch: 15, train_loss: 1.0510, test_loss: 1.1266, test_f1: 0.3930
 epoch: 16, train_loss: 1.0414, test_loss: 1.1178, test_f1: 0.4049
 epoch: 17, train_loss: 1.0254, test_loss: 1.1033, test_f1: 0.4327
 epoch: 18, train_loss: 1.0209, test_loss: 1.1003, test_f1: 0.4177
 epoch: 19, train_loss: 1.0143, test_loss: 1.1031, test_f1: 0.4266
 epoch: 20, train_loss: 1.0020, test_loss: 1.0870, test_f1: 0.4388
 epoch: 21, train_loss: 0.9944, test_loss: 1.0833, test_f1: 0.4344
 epoch: 22, train_loss: 0.9783, test_loss: 1.0750, test_f1: 0.4433
 epoch: 23, train_loss: 0.9651, test_loss: 1.0739, test_f1: 0.4496
 epoch: 24, train_loss: 0.9662, test_loss: 1.0746, test_f1: 0.4423
 epoch: 25, train_loss: 0.9543, test_loss: 1.0821, test_f1: 0.4631
 epoch: 26, train_loss: 0.9506, test_loss: 1.0810, test_f1: 0.4898
 epoch: 27, train_loss: 0.9342, test_loss: 1.0726, test_f1: 0.4937
 epoch: 28, train_loss: 0.9230, test_loss: 1.0642, test_f1: 0.4967
 epoch: 29, train_loss: 0.9206, test_loss: 1.0707, test_f1: 0.5012
 epoch: 30, train_loss: 0.9198, test_loss: 1.0526, test_f1: 0.4979
 epoch: 31, train_loss: 0.9103, test_loss: 1.0796, test_f1: 0.5043
 epoch: 32, train_loss: 0.8981, test_loss: 1.0986, test_f1: 0.5037
 epoch: 33, train_loss: 0.8907, test_loss: 1.0933, test_f1: 0.5257
 epoch: 34, train_loss: 0.8807, test_loss: 1.0282, test_f1: 0.5203
 epoch: 35, train_loss: 0.8783, test_loss: 1.0253, test_f1: 0.5272
 epoch: 36, train_loss: 0.8628, test_loss: 1.0664, test_f1: 0.5145
 epoch: 37, train_loss: 0.8659, test_loss: 1.0598, test_f1: 0.5120
 epoch: 38, train_loss: 0.8542, test_loss: 1.0876, test_f1: 0.5288
 epoch: 39, train_loss: 0.8465, test_loss: 1.1104, test_f1: 0.5198
 epoch: 40, train_loss: 0.8394, test_loss: 1.0715, test_f1: 0.5198
 epoch: 41, train_loss: 0.8412, test_loss: 1.0226, test_f1: 0.5460
 epoch: 42, train_loss: 0.8251, test_loss: 1.0230, test_f1: 0.5468
 epoch: 43, train_loss: 0.8207, test_loss: 1.0466, test_f1: 0.5343
 epoch: 44, train_loss: 0.8117, test_loss: 1.0195, test_f1: 0.5443
 epoch: 45, train_loss: 0.8123, test_loss: 1.0470, test_f1: 0.5581
 epoch: 46, train_loss: 0.8016, test_loss: 1.0245, test_f1: 0.5601
 epoch: 47, train_loss: 0.8036, test_loss: 1.0709, test_f1: 0.5526
 epoch: 48, train_loss: 0.7854, test_loss: 0.9878, test_f1: 0.5507
 epoch: 49, train_loss: 0.7981, test_loss: 1.0167, test_f1: 0.5699
 epoch: 50, train_loss: 0.7744, test_loss: 1.0122, test_f1: 0.5577
 epoch: 51, train_loss: 0.7762, test_loss: 1.0486, test_f1: 0.5397
 epoch: 52, train_loss: 0.7781, test_loss: 1.0508, test_f1: 0.5703
 epoch: 53, train_loss: 0.7714, test_loss: 1.0267, test_f1: 0.5700
 epoch: 54, train_loss: 0.7575, test_loss: 1.0720, test_f1: 0.5563
 epoch: 55, train_loss: 0.7504, test_loss: 1.1082, test_f1: 0.5703
 epoch: 56, train_loss: 0.7491, test_loss: 1.0421, test_f1: 0.5695
 epoch: 57, train_loss: 0.7558, test_loss: 1.0171, test_f1: 0.5803
 epoch: 58, train_loss: 0.7612, test_loss: 1.0768, test_f1: 0.5672
 epoch: 59, train_loss: 0.7479, test_loss: 1.0364, test_f1: 0.5522
 epoch: 60, train_loss: 0.7494, test_loss: 1.0492, test_f1: 0.5665
 epoch: 61, train_loss: 0.7373, test_loss: 1.0500, test_f1: 0.5715
 epoch: 62, train_loss: 0.7421, test_loss: 1.0615, test_f1: 0.5731
 epoch: 63, train_loss: 0.7319, test_loss: 1.0467, test_f1: 0.5690
 epoch: 64, train_loss: 0.7464, test_loss: 1.0313, test_f1: 0.5794
 epoch: 65, train_loss: 0.7432, test_loss: 1.0267, test_f1: 0.5766
 epoch: 66, train_loss: 0.7226, test_loss: 1.1039, test_f1: 0.5638
 epoch: 67, train_loss: 0.7286, test_loss: 1.0743, test_f1: 0.6037
 epoch: 68, train_loss: 0.7097, test_loss: 1.0829, test_f1: 0.5968
 epoch: 69, train_loss: 0.7212, test_loss: 1.0571, test_f1: 0.6015
 epoch: 70, train_loss: 0.7129, test_loss: 1.0260, test_f1: 0.5974
 epoch: 71, train_loss: 0.7132, test_loss: 1.0408, test_f1: 0.5969
 epoch: 72, train_loss: 0.7148, test_loss: 1.0468, test_f1: 0.6074
 epoch: 73, train_loss: 0.7095, test_loss: 1.0426, test_f1: 0.6068
 epoch: 74, train_loss: 0.7057, test_loss: 1.0923, test_f1: 0.5693
 epoch: 75, train_loss: 0.7136, test_loss: 1.0838, test_f1: 0.5527
 epoch: 76, train_loss: 0.7085, test_loss: 1.0269, test_f1: 0.5944
 epoch: 77, train_loss: 0.6997, test_loss: 1.0376, test_f1: 0.5862
 epoch: 78, train_loss: 0.6939, test_loss: 1.0314, test_f1: 0.5928
 epoch: 79, train_loss: 0.7022, test_loss: 1.0329, test_f1: 0.5736
 epoch: 80, train_loss: 0.6961, test_loss: 1.0423, test_f1: 0.5775
 epoch: 81, train_loss: 0.6968, test_loss: 1.0449, test_f1: 0.5687
 epoch: 82, train_loss: 0.6962, test_loss: 1.0324, test_f1: 0.6028
 epoch: 83, train_loss: 0.6821, test_loss: 1.0826, test_f1: 0.5622
 epoch: 84, train_loss: 0.6802, test_loss: 1.0775, test_f1: 0.5667
 epoch: 85, train_loss: 0.6811, test_loss: 1.0997, test_f1: 0.5799
 epoch: 86, train_loss: 0.6714, test_loss: 1.0679, test_f1: 0.5690
 epoch: 87, train_loss: 0.6751, test_loss: 1.0224, test_f1: 0.5860
 epoch: 88, train_loss: 0.6868, test_loss: 1.0382, test_f1: 0.5781
 epoch: 89, train_loss: 0.6765, test_loss: 1.0896, test_f1: 0.5380
 epoch: 90, train_loss: 0.6675, test_loss: 1.0818, test_f1: 0.5721
 epoch: 91, train_loss: 0.6694, test_loss: 1.0873, test_f1: 0.5720
 epoch: 92, train_loss: 0.6616, test_loss: 1.1612, test_f1: 0.5538
 epoch: 93, train_loss: 0.6612, test_loss: 1.2080, test_f1: 0.5450
 epoch: 94, train_loss: 0.6688, test_loss: 1.1002, test_f1: 0.5689
 epoch: 95, train_loss: 0.6616, test_loss: 1.0519, test_f1: 0.5688
 epoch: 96, train_loss: 0.6685, test_loss: 1.1180, test_f1: 0.5500
 epoch: 97, train_loss: 0.6547, test_loss: 1.1796, test_f1: 0.5478
 epoch: 98, train_loss: 0.6568, test_loss: 1.1451, test_f1: 0.5440
 epoch: 99, train_loss: 0.6610, test_loss: 1.1676, test_f1: 0.5368
##################ITERATION #4 ****************************************
 epoch: 0, train_loss: 1.2841, test_loss: 1.3301, test_f1: 0.2281
 epoch: 1, train_loss: 1.2434, test_loss: 1.3141, test_f1: 0.2281
 epoch: 2, train_loss: 1.2143, test_loss: 1.3035, test_f1: 0.2281
 epoch: 3, train_loss: 1.2060, test_loss: 1.2915, test_f1: 0.2281
 epoch: 4, train_loss: 1.1884, test_loss: 1.2743, test_f1: 0.2435
 epoch: 5, train_loss: 1.1732, test_loss: 1.2551, test_f1: 0.2759
 epoch: 6, train_loss: 1.1573, test_loss: 1.2390, test_f1: 0.3464
 epoch: 7, train_loss: 1.1416, test_loss: 1.2222, test_f1: 0.3781
 epoch: 8, train_loss: 1.1271, test_loss: 1.2072, test_f1: 0.3797
 epoch: 9, train_loss: 1.1193, test_loss: 1.2054, test_f1: 0.3964
 epoch: 10, train_loss: 1.1129, test_loss: 1.1956, test_f1: 0.3817
 epoch: 11, train_loss: 1.0918, test_loss: 1.1925, test_f1: 0.4056
 epoch: 12, train_loss: 1.0863, test_loss: 1.1748, test_f1: 0.4198
 epoch: 13, train_loss: 1.0650, test_loss: 1.1657, test_f1: 0.4269
 epoch: 14, train_loss: 1.0551, test_loss: 1.1466, test_f1: 0.4428
 epoch: 15, train_loss: 1.0467, test_loss: 1.1448, test_f1: 0.4306
 epoch: 16, train_loss: 1.0326, test_loss: 1.1401, test_f1: 0.4499
 epoch: 17, train_loss: 1.0263, test_loss: 1.1415, test_f1: 0.4770
 epoch: 18, train_loss: 1.0109, test_loss: 1.1289, test_f1: 0.4769
 epoch: 19, train_loss: 0.9928, test_loss: 1.1086, test_f1: 0.4997
 epoch: 20, train_loss: 0.9870, test_loss: 1.1108, test_f1: 0.4745
 epoch: 21, train_loss: 0.9738, test_loss: 1.1157, test_f1: 0.4919
 epoch: 22, train_loss: 0.9641, test_loss: 1.0977, test_f1: 0.5091
 epoch: 23, train_loss: 0.9492, test_loss: 1.0952, test_f1: 0.5051
 epoch: 24, train_loss: 0.9432, test_loss: 1.1091, test_f1: 0.5072
 epoch: 25, train_loss: 0.9488, test_loss: 1.0840, test_f1: 0.5098
 epoch: 26, train_loss: 0.9285, test_loss: 1.0996, test_f1: 0.5016
 epoch: 27, train_loss: 0.9284, test_loss: 1.0894, test_f1: 0.5068
 epoch: 28, train_loss: 0.9013, test_loss: 1.0894, test_f1: 0.5150
 epoch: 29, train_loss: 0.9046, test_loss: 1.0910, test_f1: 0.5085
 epoch: 30, train_loss: 0.8939, test_loss: 1.1092, test_f1: 0.5109
 epoch: 31, train_loss: 0.8872, test_loss: 1.0760, test_f1: 0.5455
 epoch: 32, train_loss: 0.8856, test_loss: 1.0735, test_f1: 0.5225
 epoch: 33, train_loss: 0.8750, test_loss: 1.0878, test_f1: 0.5371
 epoch: 34, train_loss: 0.8690, test_loss: 1.0817, test_f1: 0.5455
 epoch: 35, train_loss: 0.8607, test_loss: 1.1019, test_f1: 0.5282
 epoch: 36, train_loss: 0.8482, test_loss: 1.0877, test_f1: 0.5343
 epoch: 37, train_loss: 0.8437, test_loss: 1.0784, test_f1: 0.5420
 epoch: 38, train_loss: 0.8354, test_loss: 1.1177, test_f1: 0.5244
 epoch: 39, train_loss: 0.8262, test_loss: 1.1119, test_f1: 0.5410
 epoch: 40, train_loss: 0.8184, test_loss: 1.0976, test_f1: 0.5461
 epoch: 41, train_loss: 0.8128, test_loss: 1.0835, test_f1: 0.5459
 epoch: 42, train_loss: 0.8059, test_loss: 1.1163, test_f1: 0.5338
 epoch: 43, train_loss: 0.8057, test_loss: 1.1031, test_f1: 0.5467
 epoch: 44, train_loss: 0.7995, test_loss: 1.1173, test_f1: 0.5177
 epoch: 45, train_loss: 0.8006, test_loss: 1.0906, test_f1: 0.5509
 epoch: 46, train_loss: 0.7927, test_loss: 1.0970, test_f1: 0.5522
 epoch: 47, train_loss: 0.7871, test_loss: 1.1016, test_f1: 0.5498
 epoch: 48, train_loss: 0.7729, test_loss: 1.1033, test_f1: 0.5465
 epoch: 49, train_loss: 0.7631, test_loss: 1.1075, test_f1: 0.5459
 epoch: 50, train_loss: 0.7580, test_loss: 1.1333, test_f1: 0.5396
 epoch: 51, train_loss: 0.7512, test_loss: 1.1326, test_f1: 0.5359
 epoch: 52, train_loss: 0.7530, test_loss: 1.1298, test_f1: 0.5480
 epoch: 53, train_loss: 0.7421, test_loss: 1.1193, test_f1: 0.5456
 epoch: 54, train_loss: 0.7527, test_loss: 1.1256, test_f1: 0.5385
 epoch: 55, train_loss: 0.7461, test_loss: 1.1204, test_f1: 0.5501
 epoch: 56, train_loss: 0.7517, test_loss: 1.1481, test_f1: 0.5244
 epoch: 57, train_loss: 0.7347, test_loss: 1.1456, test_f1: 0.5305
 epoch: 58, train_loss: 0.7441, test_loss: 1.1524, test_f1: 0.5296
 epoch: 59, train_loss: 0.7466, test_loss: 1.1650, test_f1: 0.5201
 epoch: 60, train_loss: 0.7376, test_loss: 1.1290, test_f1: 0.5493
 epoch: 61, train_loss: 0.7260, test_loss: 1.1317, test_f1: 0.5510
 epoch: 62, train_loss: 0.7240, test_loss: 1.1437, test_f1: 0.5328
 epoch: 63, train_loss: 0.7303, test_loss: 1.1339, test_f1: 0.5291
 epoch: 64, train_loss: 0.7292, test_loss: 1.1562, test_f1: 0.5212
 epoch: 65, train_loss: 0.7045, test_loss: 1.1516, test_f1: 0.5595
 epoch: 66, train_loss: 0.7159, test_loss: 1.1509, test_f1: 0.5448
 epoch: 67, train_loss: 0.7134, test_loss: 1.1746, test_f1: 0.5283
 epoch: 68, train_loss: 0.7206, test_loss: 1.1531, test_f1: 0.5435
 epoch: 69, train_loss: 0.7075, test_loss: 1.1629, test_f1: 0.5404
 epoch: 70, train_loss: 0.6990, test_loss: 1.1606, test_f1: 0.5458
 epoch: 71, train_loss: 0.7156, test_loss: 1.1708, test_f1: 0.5310
 epoch: 72, train_loss: 0.7094, test_loss: 1.1761, test_f1: 0.5304
 epoch: 73, train_loss: 0.7020, test_loss: 1.1689, test_f1: 0.5274
 epoch: 74, train_loss: 0.6924, test_loss: 1.1666, test_f1: 0.5369
 epoch: 75, train_loss: 0.6929, test_loss: 1.1860, test_f1: 0.5091
 epoch: 76, train_loss: 0.6923, test_loss: 1.1954, test_f1: 0.5273
 epoch: 77, train_loss: 0.6995, test_loss: 1.2068, test_f1: 0.5399
 epoch: 78, train_loss: 0.6847, test_loss: 1.2191, test_f1: 0.5298
 epoch: 79, train_loss: 0.6890, test_loss: 1.2189, test_f1: 0.5162
 epoch: 80, train_loss: 0.6741, test_loss: 1.1716, test_f1: 0.5592
 epoch: 81, train_loss: 0.6822, test_loss: 1.1872, test_f1: 0.5474
 epoch: 82, train_loss: 0.6826, test_loss: 1.2022, test_f1: 0.5355
 epoch: 83, train_loss: 0.6914, test_loss: 1.2072, test_f1: 0.5225
 epoch: 84, train_loss: 0.6728, test_loss: 1.2052, test_f1: 0.5488
 epoch: 85, train_loss: 0.6703, test_loss: 1.1786, test_f1: 0.5518
 epoch: 86, train_loss: 0.6625, test_loss: 1.1823, test_f1: 0.5360
 epoch: 87, train_loss: 0.6668, test_loss: 1.2063, test_f1: 0.5463
 epoch: 88, train_loss: 0.6786, test_loss: 1.2199, test_f1: 0.5439
 epoch: 89, train_loss: 0.6671, test_loss: 1.1740, test_f1: 0.5448
 epoch: 90, train_loss: 0.6611, test_loss: 1.1896, test_f1: 0.5381
 epoch: 91, train_loss: 0.6578, test_loss: 1.2139, test_f1: 0.5491
 epoch: 92, train_loss: 0.6757, test_loss: 1.2234, test_f1: 0.5419
 epoch: 93, train_loss: 0.6693, test_loss: 1.2295, test_f1: 0.5435
 epoch: 94, train_loss: 0.6726, test_loss: 1.2248, test_f1: 0.5417
 epoch: 95, train_loss: 0.6542, test_loss: 1.2279, test_f1: 0.5315
 epoch: 96, train_loss: 0.6522, test_loss: 1.1918, test_f1: 0.5389
 epoch: 97, train_loss: 0.6598, test_loss: 1.2116, test_f1: 0.5654
 epoch: 98, train_loss: 0.6630, test_loss: 1.2035, test_f1: 0.5582
 epoch: 99, train_loss: 0.6504, test_loss: 1.2326, test_f1: 0.5624
##################ITERATION #5 ****************************************
 epoch: 0, train_loss: 1.2506, test_loss: 1.3050, test_f1: 0.2281
 epoch: 1, train_loss: 1.2118, test_loss: 1.3016, test_f1: 0.2281
 epoch: 2, train_loss: 1.1939, test_loss: 1.2908, test_f1: 0.2281
 epoch: 3, train_loss: 1.1799, test_loss: 1.2712, test_f1: 0.2270
 epoch: 4, train_loss: 1.1629, test_loss: 1.2521, test_f1: 0.2696
 epoch: 5, train_loss: 1.1532, test_loss: 1.2215, test_f1: 0.2955
 epoch: 6, train_loss: 1.1320, test_loss: 1.1946, test_f1: 0.4005
 epoch: 7, train_loss: 1.1236, test_loss: 1.1867, test_f1: 0.4381
 epoch: 8, train_loss: 1.1079, test_loss: 1.1764, test_f1: 0.4536
 epoch: 9, train_loss: 1.1025, test_loss: 1.1619, test_f1: 0.4565
 epoch: 10, train_loss: 1.0891, test_loss: 1.1491, test_f1: 0.4681
 epoch: 11, train_loss: 1.0685, test_loss: 1.1444, test_f1: 0.4645
 epoch: 12, train_loss: 1.0584, test_loss: 1.1206, test_f1: 0.4943
 epoch: 13, train_loss: 1.0401, test_loss: 1.1191, test_f1: 0.5117
 epoch: 14, train_loss: 1.0366, test_loss: 1.1117, test_f1: 0.4886
 epoch: 15, train_loss: 1.0249, test_loss: 1.1093, test_f1: 0.5122
 epoch: 16, train_loss: 1.0023, test_loss: 1.1001, test_f1: 0.5213
 epoch: 17, train_loss: 0.9974, test_loss: 1.0881, test_f1: 0.5040
 epoch: 18, train_loss: 0.9807, test_loss: 1.0763, test_f1: 0.5189
 epoch: 19, train_loss: 0.9595, test_loss: 1.0698, test_f1: 0.5263
 epoch: 20, train_loss: 0.9645, test_loss: 1.0653, test_f1: 0.5123
 epoch: 21, train_loss: 0.9410, test_loss: 1.0794, test_f1: 0.5033
 epoch: 22, train_loss: 0.9360, test_loss: 1.0658, test_f1: 0.5050
 epoch: 23, train_loss: 0.9300, test_loss: 1.0506, test_f1: 0.5134
 epoch: 24, train_loss: 0.9192, test_loss: 1.0245, test_f1: 0.5238
 epoch: 25, train_loss: 0.9114, test_loss: 1.0524, test_f1: 0.5259
 epoch: 26, train_loss: 0.9140, test_loss: 1.0385, test_f1: 0.5180
 epoch: 27, train_loss: 0.8918, test_loss: 1.0203, test_f1: 0.5323
 epoch: 28, train_loss: 0.8888, test_loss: 1.0333, test_f1: 0.5310
 epoch: 29, train_loss: 0.8885, test_loss: 1.0279, test_f1: 0.5122
 epoch: 30, train_loss: 0.8729, test_loss: 1.0772, test_f1: 0.5404
 epoch: 31, train_loss: 0.8629, test_loss: 1.0620, test_f1: 0.5514
 epoch: 32, train_loss: 0.8578, test_loss: 1.0055, test_f1: 0.5624
 epoch: 33, train_loss: 0.8356, test_loss: 1.0365, test_f1: 0.5811
 epoch: 34, train_loss: 0.8411, test_loss: 1.0016, test_f1: 0.5763
 epoch: 35, train_loss: 0.8321, test_loss: 1.0608, test_f1: 0.5653
 epoch: 36, train_loss: 0.8303, test_loss: 1.0960, test_f1: 0.5742
 epoch: 37, train_loss: 0.8285, test_loss: 1.0270, test_f1: 0.5643
 epoch: 38, train_loss: 0.8081, test_loss: 0.9971, test_f1: 0.5628
 epoch: 39, train_loss: 0.7934, test_loss: 1.0020, test_f1: 0.5720
 epoch: 40, train_loss: 0.7813, test_loss: 1.0024, test_f1: 0.5559
 epoch: 41, train_loss: 0.7759, test_loss: 0.9960, test_f1: 0.5609
 epoch: 42, train_loss: 0.7632, test_loss: 0.9895, test_f1: 0.5508
 epoch: 43, train_loss: 0.7679, test_loss: 0.9889, test_f1: 0.5631
 epoch: 44, train_loss: 0.7768, test_loss: 0.9970, test_f1: 0.5714
 epoch: 45, train_loss: 0.7565, test_loss: 0.9879, test_f1: 0.5503
 epoch: 46, train_loss: 0.7499, test_loss: 0.9902, test_f1: 0.5579
 epoch: 47, train_loss: 0.7512, test_loss: 1.0259, test_f1: 0.5585
 epoch: 48, train_loss: 0.7438, test_loss: 1.0253, test_f1: 0.5592
 epoch: 49, train_loss: 0.7374, test_loss: 1.0365, test_f1: 0.5462
 epoch: 50, train_loss: 0.7295, test_loss: 1.0341, test_f1: 0.5352
 epoch: 51, train_loss: 0.7203, test_loss: 0.9910, test_f1: 0.5593
 epoch: 52, train_loss: 0.7238, test_loss: 0.9933, test_f1: 0.5433
 epoch: 53, train_loss: 0.7168, test_loss: 1.0384, test_f1: 0.5230
 epoch: 54, train_loss: 0.7299, test_loss: 1.0431, test_f1: 0.5453
 epoch: 55, train_loss: 0.7149, test_loss: 1.0198, test_f1: 0.5415
 epoch: 56, train_loss: 0.7154, test_loss: 1.0184, test_f1: 0.5507
 epoch: 57, train_loss: 0.7085, test_loss: 1.0026, test_f1: 0.5458
 epoch: 58, train_loss: 0.7000, test_loss: 1.0207, test_f1: 0.5435
 epoch: 59, train_loss: 0.6990, test_loss: 1.0148, test_f1: 0.5436
 epoch: 60, train_loss: 0.6988, test_loss: 1.0279, test_f1: 0.5216
 epoch: 61, train_loss: 0.6945, test_loss: 1.0018, test_f1: 0.5521
 epoch: 62, train_loss: 0.6988, test_loss: 1.0206, test_f1: 0.5413
 epoch: 63, train_loss: 0.6903, test_loss: 1.0298, test_f1: 0.5385
 epoch: 64, train_loss: 0.7034, test_loss: 1.0195, test_f1: 0.5568
 epoch: 65, train_loss: 0.6901, test_loss: 1.0303, test_f1: 0.5311
 epoch: 66, train_loss: 0.6845, test_loss: 1.0321, test_f1: 0.5336
 epoch: 67, train_loss: 0.6789, test_loss: 1.0187, test_f1: 0.5458
 epoch: 68, train_loss: 0.6837, test_loss: 1.0009, test_f1: 0.5492
 epoch: 69, train_loss: 0.6751, test_loss: 1.0164, test_f1: 0.5330
 epoch: 70, train_loss: 0.6646, test_loss: 1.0187, test_f1: 0.5264
 epoch: 71, train_loss: 0.6646, test_loss: 1.0143, test_f1: 0.5340
 epoch: 72, train_loss: 0.6759, test_loss: 1.0474, test_f1: 0.5282
 epoch: 73, train_loss: 0.6759, test_loss: 1.0462, test_f1: 0.5372
 epoch: 74, train_loss: 0.6642, test_loss: 1.0356, test_f1: 0.5501
 epoch: 75, train_loss: 0.6668, test_loss: 1.0408, test_f1: 0.5349
 epoch: 76, train_loss: 0.6699, test_loss: 1.0388, test_f1: 0.5334
 epoch: 77, train_loss: 0.6584, test_loss: 1.0422, test_f1: 0.5421
 epoch: 78, train_loss: 0.6472, test_loss: 1.0510, test_f1: 0.5370
 epoch: 79, train_loss: 0.6629, test_loss: 1.0358, test_f1: 0.5366
 epoch: 80, train_loss: 0.6519, test_loss: 1.0659, test_f1: 0.5100
 epoch: 81, train_loss: 0.6631, test_loss: 1.0622, test_f1: 0.5183
 epoch: 82, train_loss: 0.6540, test_loss: 1.0700, test_f1: 0.5459
 epoch: 83, train_loss: 0.6555, test_loss: 1.0902, test_f1: 0.5296
 epoch: 84, train_loss: 0.6657, test_loss: 1.0272, test_f1: 0.5652
 epoch: 85, train_loss: 0.6458, test_loss: 1.0532, test_f1: 0.5433
 epoch: 86, train_loss: 0.6473, test_loss: 1.0610, test_f1: 0.5329
 epoch: 87, train_loss: 0.6366, test_loss: 1.0699, test_f1: 0.5224
 epoch: 88, train_loss: 0.6517, test_loss: 1.0502, test_f1: 0.5272
 epoch: 89, train_loss: 0.6394, test_loss: 1.0645, test_f1: 0.5328
 epoch: 90, train_loss: 0.6460, test_loss: 1.0766, test_f1: 0.5376
 epoch: 91, train_loss: 0.6306, test_loss: 1.0741, test_f1: 0.5151
 epoch: 92, train_loss: 0.6460, test_loss: 1.0782, test_f1: 0.5242
 epoch: 93, train_loss: 0.6302, test_loss: 1.0775, test_f1: 0.5241
 epoch: 94, train_loss: 0.6238, test_loss: 1.1027, test_f1: 0.5221
 epoch: 95, train_loss: 0.6329, test_loss: 1.0857, test_f1: 0.5221
 epoch: 96, train_loss: 0.6417, test_loss: 1.0866, test_f1: 0.5326
 epoch: 97, train_loss: 0.6336, test_loss: 1.0946, test_f1: 0.5149
 epoch: 98, train_loss: 0.6275, test_loss: 1.1077, test_f1: 0.5253
 epoch: 99, train_loss: 0.6289, test_loss: 1.0938, test_f1: 0.5221
##################ITERATION #6 ****************************************
 epoch: 0, train_loss: 1.2491, test_loss: 1.3028, test_f1: 0.2248
 epoch: 1, train_loss: 1.2080, test_loss: 1.3024, test_f1: 0.2404
 epoch: 2, train_loss: 1.1959, test_loss: 1.2905, test_f1: 0.2357
 epoch: 3, train_loss: 1.1805, test_loss: 1.2669, test_f1: 0.2653
 epoch: 4, train_loss: 1.1605, test_loss: 1.2396, test_f1: 0.2667
 epoch: 5, train_loss: 1.1422, test_loss: 1.2203, test_f1: 0.3102
 epoch: 6, train_loss: 1.1341, test_loss: 1.1963, test_f1: 0.3785
 epoch: 7, train_loss: 1.1132, test_loss: 1.1626, test_f1: 0.4325
 epoch: 8, train_loss: 1.0950, test_loss: 1.1311, test_f1: 0.4295
 epoch: 9, train_loss: 1.0668, test_loss: 1.1138, test_f1: 0.4410
 epoch: 10, train_loss: 1.0596, test_loss: 1.0974, test_f1: 0.4419
 epoch: 11, train_loss: 1.0450, test_loss: 1.0878, test_f1: 0.4441
 epoch: 12, train_loss: 1.0184, test_loss: 1.0813, test_f1: 0.4322
 epoch: 13, train_loss: 1.0113, test_loss: 1.0809, test_f1: 0.4688
 epoch: 14, train_loss: 0.9969, test_loss: 1.0681, test_f1: 0.4713
 epoch: 15, train_loss: 0.9702, test_loss: 1.0405, test_f1: 0.4719
 epoch: 16, train_loss: 0.9690, test_loss: 1.0325, test_f1: 0.5030
 epoch: 17, train_loss: 0.9381, test_loss: 1.0302, test_f1: 0.5309
 epoch: 18, train_loss: 0.9480, test_loss: 1.0126, test_f1: 0.5191
 epoch: 19, train_loss: 0.9282, test_loss: 1.0078, test_f1: 0.5445
 epoch: 20, train_loss: 0.9099, test_loss: 1.0071, test_f1: 0.5463
 epoch: 21, train_loss: 0.9070, test_loss: 1.0155, test_f1: 0.5468
 epoch: 22, train_loss: 0.8962, test_loss: 1.0123, test_f1: 0.5600
 epoch: 23, train_loss: 0.8835, test_loss: 1.0016, test_f1: 0.5560
 epoch: 24, train_loss: 0.8747, test_loss: 0.9992, test_f1: 0.5569
 epoch: 25, train_loss: 0.8651, test_loss: 0.9888, test_f1: 0.5701
 epoch: 26, train_loss: 0.8616, test_loss: 0.9929, test_f1: 0.5756
 epoch: 27, train_loss: 0.8652, test_loss: 0.9921, test_f1: 0.5711
 epoch: 28, train_loss: 0.8379, test_loss: 0.9757, test_f1: 0.5661
 epoch: 29, train_loss: 0.8397, test_loss: 1.0341, test_f1: 0.5850
 epoch: 30, train_loss: 0.8228, test_loss: 1.0629, test_f1: 0.5711
 epoch: 31, train_loss: 0.8086, test_loss: 1.0530, test_f1: 0.5722
 epoch: 32, train_loss: 0.8111, test_loss: 1.0946, test_f1: 0.5726
 epoch: 33, train_loss: 0.8053, test_loss: 1.0473, test_f1: 0.5712
 epoch: 34, train_loss: 0.7919, test_loss: 1.0114, test_f1: 0.5913
 epoch: 35, train_loss: 0.7976, test_loss: 0.9998, test_f1: 0.5795
 epoch: 36, train_loss: 0.7965, test_loss: 1.0101, test_f1: 0.5821
 epoch: 37, train_loss: 0.7893, test_loss: 1.1130, test_f1: 0.5620
 epoch: 38, train_loss: 0.7688, test_loss: 1.0343, test_f1: 0.5747
 epoch: 39, train_loss: 0.7655, test_loss: 0.9920, test_f1: 0.5768
 epoch: 40, train_loss: 0.7611, test_loss: 1.0313, test_f1: 0.5753
 epoch: 41, train_loss: 0.7589, test_loss: 1.0040, test_f1: 0.5464
 epoch: 42, train_loss: 0.7664, test_loss: 1.0205, test_f1: 0.5877
 epoch: 43, train_loss: 0.7499, test_loss: 1.0293, test_f1: 0.5621
 epoch: 44, train_loss: 0.7374, test_loss: 1.0241, test_f1: 0.5886
 epoch: 45, train_loss: 0.7484, test_loss: 1.0708, test_f1: 0.5734
 epoch: 46, train_loss: 0.7223, test_loss: 1.0377, test_f1: 0.5831
 epoch: 47, train_loss: 0.7296, test_loss: 1.0471, test_f1: 0.5983
 epoch: 48, train_loss: 0.7222, test_loss: 0.9997, test_f1: 0.6029
 epoch: 49, train_loss: 0.7089, test_loss: 1.0327, test_f1: 0.6065
 epoch: 50, train_loss: 0.7107, test_loss: 1.0831, test_f1: 0.6087
 epoch: 51, train_loss: 0.6961, test_loss: 1.0402, test_f1: 0.6005
 epoch: 52, train_loss: 0.7054, test_loss: 1.0421, test_f1: 0.5995
 epoch: 53, train_loss: 0.6876, test_loss: 0.9959, test_f1: 0.6045
 epoch: 54, train_loss: 0.6988, test_loss: 1.0296, test_f1: 0.6146
 epoch: 55, train_loss: 0.6980, test_loss: 1.0462, test_f1: 0.6044
 epoch: 56, train_loss: 0.6808, test_loss: 1.0710, test_f1: 0.5831
 epoch: 57, train_loss: 0.6884, test_loss: 1.0741, test_f1: 0.5794
 epoch: 58, train_loss: 0.6788, test_loss: 1.0685, test_f1: 0.6047
 epoch: 59, train_loss: 0.6901, test_loss: 1.0523, test_f1: 0.5868
 epoch: 60, train_loss: 0.6727, test_loss: 1.0410, test_f1: 0.6033
 epoch: 61, train_loss: 0.6704, test_loss: 1.0505, test_f1: 0.6206
 epoch: 62, train_loss: 0.6791, test_loss: 1.0552, test_f1: 0.5985
 epoch: 63, train_loss: 0.6662, test_loss: 1.0673, test_f1: 0.5880
 epoch: 64, train_loss: 0.6783, test_loss: 1.0730, test_f1: 0.6002
 epoch: 65, train_loss: 0.6734, test_loss: 1.0811, test_f1: 0.6005
 epoch: 66, train_loss: 0.6581, test_loss: 1.0703, test_f1: 0.6095
 epoch: 67, train_loss: 0.6536, test_loss: 1.0873, test_f1: 0.6018
 epoch: 68, train_loss: 0.6611, test_loss: 1.0575, test_f1: 0.6123
 epoch: 69, train_loss: 0.6474, test_loss: 1.0518, test_f1: 0.6073
 epoch: 70, train_loss: 0.6620, test_loss: 1.0541, test_f1: 0.5859
 epoch: 71, train_loss: 0.6623, test_loss: 1.0422, test_f1: 0.6168
 epoch: 72, train_loss: 0.6603, test_loss: 1.0615, test_f1: 0.6218
 epoch: 73, train_loss: 0.6546, test_loss: 1.0915, test_f1: 0.5968
 epoch: 74, train_loss: 0.6487, test_loss: 1.0654, test_f1: 0.6072
 epoch: 75, train_loss: 0.6479, test_loss: 1.0471, test_f1: 0.6093
 epoch: 76, train_loss: 0.6407, test_loss: 1.0445, test_f1: 0.6034
 epoch: 77, train_loss: 0.6433, test_loss: 1.0590, test_f1: 0.6085
 epoch: 78, train_loss: 0.6473, test_loss: 1.0573, test_f1: 0.6149
 epoch: 79, train_loss: 0.6488, test_loss: 1.0587, test_f1: 0.6008
 epoch: 80, train_loss: 0.6429, test_loss: 1.0575, test_f1: 0.5825
 epoch: 81, train_loss: 0.6322, test_loss: 1.0268, test_f1: 0.6235
 epoch: 82, train_loss: 0.6317, test_loss: 1.0264, test_f1: 0.6231
 epoch: 83, train_loss: 0.6333, test_loss: 1.0313, test_f1: 0.6100
 epoch: 84, train_loss: 0.6320, test_loss: 1.0441, test_f1: 0.5961
 epoch: 85, train_loss: 0.6374, test_loss: 1.0486, test_f1: 0.6129
 epoch: 86, train_loss: 0.6274, test_loss: 1.0651, test_f1: 0.6129
 epoch: 87, train_loss: 0.6379, test_loss: 1.0892, test_f1: 0.5941
 epoch: 88, train_loss: 0.6366, test_loss: 1.0638, test_f1: 0.5982
 epoch: 89, train_loss: 0.6215, test_loss: 1.0460, test_f1: 0.5749
 epoch: 90, train_loss: 0.6307, test_loss: 1.0494, test_f1: 0.5876
 epoch: 91, train_loss: 0.6279, test_loss: 1.0484, test_f1: 0.6013
 epoch: 92, train_loss: 0.6276, test_loss: 1.0386, test_f1: 0.5832
 epoch: 93, train_loss: 0.6268, test_loss: 1.0358, test_f1: 0.5775
 epoch: 94, train_loss: 0.6328, test_loss: 1.0526, test_f1: 0.6221
 epoch: 95, train_loss: 0.6145, test_loss: 1.0389, test_f1: 0.6101
 epoch: 96, train_loss: 0.6184, test_loss: 1.0415, test_f1: 0.6037
 epoch: 97, train_loss: 0.6232, test_loss: 1.0628, test_f1: 0.5969
 epoch: 98, train_loss: 0.6070, test_loss: 1.0728, test_f1: 0.6236
 epoch: 99, train_loss: 0.6098, test_loss: 1.0700, test_f1: 0.6135
##################ITERATION #7 ****************************************
 epoch: 0, train_loss: 1.2499, test_loss: 1.3022, test_f1: 0.2404
 epoch: 1, train_loss: 1.2045, test_loss: 1.3043, test_f1: 0.2259
 epoch: 2, train_loss: 1.1774, test_loss: 1.3036, test_f1: 0.2321
 epoch: 3, train_loss: 1.1586, test_loss: 1.2799, test_f1: 0.2161
 epoch: 4, train_loss: 1.1407, test_loss: 1.2447, test_f1: 0.2690
 epoch: 5, train_loss: 1.1275, test_loss: 1.2326, test_f1: 0.3533
 epoch: 6, train_loss: 1.1106, test_loss: 1.1906, test_f1: 0.3746
 epoch: 7, train_loss: 1.1002, test_loss: 1.1833, test_f1: 0.4090
 epoch: 8, train_loss: 1.0862, test_loss: 1.1679, test_f1: 0.4248
 epoch: 9, train_loss: 1.0840, test_loss: 1.1567, test_f1: 0.4168
 epoch: 10, train_loss: 1.0719, test_loss: 1.1487, test_f1: 0.4298
 epoch: 11, train_loss: 1.0524, test_loss: 1.1379, test_f1: 0.4384
 epoch: 12, train_loss: 1.0482, test_loss: 1.1291, test_f1: 0.4621
 epoch: 13, train_loss: 1.0278, test_loss: 1.1314, test_f1: 0.4704
 epoch: 14, train_loss: 1.0196, test_loss: 1.1322, test_f1: 0.4729
 epoch: 15, train_loss: 1.0068, test_loss: 1.1199, test_f1: 0.4924
 epoch: 16, train_loss: 1.0016, test_loss: 1.1034, test_f1: 0.4999
 epoch: 17, train_loss: 0.9892, test_loss: 1.1016, test_f1: 0.4779
 epoch: 18, train_loss: 0.9778, test_loss: 1.0839, test_f1: 0.4896
 epoch: 19, train_loss: 0.9710, test_loss: 1.0828, test_f1: 0.4821
 epoch: 20, train_loss: 0.9666, test_loss: 1.0799, test_f1: 0.4858
 epoch: 21, train_loss: 0.9507, test_loss: 1.0579, test_f1: 0.4858
 epoch: 22, train_loss: 0.9438, test_loss: 1.0599, test_f1: 0.5118
 epoch: 23, train_loss: 0.9464, test_loss: 1.0685, test_f1: 0.4870
 epoch: 24, train_loss: 0.9353, test_loss: 1.0541, test_f1: 0.4816
 epoch: 25, train_loss: 0.9176, test_loss: 1.0474, test_f1: 0.4985
 epoch: 26, train_loss: 0.9001, test_loss: 1.0433, test_f1: 0.5009
 epoch: 27, train_loss: 0.9013, test_loss: 1.0564, test_f1: 0.5042
 epoch: 28, train_loss: 0.8942, test_loss: 1.0400, test_f1: 0.5232
 epoch: 29, train_loss: 0.8868, test_loss: 1.0481, test_f1: 0.5311
 epoch: 30, train_loss: 0.8711, test_loss: 1.0258, test_f1: 0.5413
 epoch: 31, train_loss: 0.8727, test_loss: 1.0471, test_f1: 0.5326
 epoch: 32, train_loss: 0.8698, test_loss: 1.0298, test_f1: 0.5394
 epoch: 33, train_loss: 0.8629, test_loss: 1.0327, test_f1: 0.5316
 epoch: 34, train_loss: 0.8476, test_loss: 1.0877, test_f1: 0.5248
 epoch: 35, train_loss: 0.8495, test_loss: 1.0449, test_f1: 0.5475
 epoch: 36, train_loss: 0.8482, test_loss: 1.0354, test_f1: 0.5451
 epoch: 37, train_loss: 0.8461, test_loss: 1.0110, test_f1: 0.5610
 epoch: 38, train_loss: 0.8339, test_loss: 1.0016, test_f1: 0.5700
 epoch: 39, train_loss: 0.8248, test_loss: 1.0262, test_f1: 0.5473
 epoch: 40, train_loss: 0.8128, test_loss: 1.0184, test_f1: 0.5761
 epoch: 41, train_loss: 0.8130, test_loss: 1.0487, test_f1: 0.5485
 epoch: 42, train_loss: 0.8051, test_loss: 1.0685, test_f1: 0.5551
 epoch: 43, train_loss: 0.8142, test_loss: 1.0250, test_f1: 0.5624
 epoch: 44, train_loss: 0.7981, test_loss: 1.0391, test_f1: 0.5648
 epoch: 45, train_loss: 0.8136, test_loss: 1.0511, test_f1: 0.5455
 epoch: 46, train_loss: 0.8067, test_loss: 1.1042, test_f1: 0.5197
 epoch: 47, train_loss: 0.7854, test_loss: 1.0380, test_f1: 0.5581
 epoch: 48, train_loss: 0.7804, test_loss: 1.0735, test_f1: 0.5608
 epoch: 49, train_loss: 0.7643, test_loss: 1.0539, test_f1: 0.5604
 epoch: 50, train_loss: 0.7745, test_loss: 1.0603, test_f1: 0.5600
 epoch: 51, train_loss: 0.7589, test_loss: 1.0535, test_f1: 0.5717
 epoch: 52, train_loss: 0.7674, test_loss: 1.0432, test_f1: 0.5733
 epoch: 53, train_loss: 0.7424, test_loss: 1.0695, test_f1: 0.5742
 epoch: 54, train_loss: 0.7553, test_loss: 1.0490, test_f1: 0.5800
 epoch: 55, train_loss: 0.7450, test_loss: 1.0365, test_f1: 0.5799
 epoch: 56, train_loss: 0.7472, test_loss: 1.0079, test_f1: 0.5670
 epoch: 57, train_loss: 0.7587, test_loss: 1.0348, test_f1: 0.5653
 epoch: 58, train_loss: 0.7373, test_loss: 1.0571, test_f1: 0.5504
 epoch: 59, train_loss: 0.7336, test_loss: 1.0627, test_f1: 0.5473
 epoch: 60, train_loss: 0.7406, test_loss: 1.0119, test_f1: 0.5620
 epoch: 61, train_loss: 0.7351, test_loss: 1.0317, test_f1: 0.5630
 epoch: 62, train_loss: 0.7299, test_loss: 1.0481, test_f1: 0.5734
 epoch: 63, train_loss: 0.7238, test_loss: 1.0446, test_f1: 0.5603
 epoch: 64, train_loss: 0.7289, test_loss: 1.0434, test_f1: 0.5685
 epoch: 65, train_loss: 0.7252, test_loss: 1.0439, test_f1: 0.5742
 epoch: 66, train_loss: 0.7332, test_loss: 1.0395, test_f1: 0.5757
 epoch: 67, train_loss: 0.7114, test_loss: 1.0538, test_f1: 0.5685
 epoch: 68, train_loss: 0.7206, test_loss: 1.0390, test_f1: 0.5615
 epoch: 69, train_loss: 0.7149, test_loss: 1.0146, test_f1: 0.5759
 epoch: 70, train_loss: 0.7001, test_loss: 1.0237, test_f1: 0.5823
 epoch: 71, train_loss: 0.7063, test_loss: 1.0578, test_f1: 0.5730
 epoch: 72, train_loss: 0.7058, test_loss: 1.0553, test_f1: 0.5705
 epoch: 73, train_loss: 0.6923, test_loss: 1.0550, test_f1: 0.5688
 epoch: 74, train_loss: 0.6925, test_loss: 1.0577, test_f1: 0.5608
 epoch: 75, train_loss: 0.7015, test_loss: 1.0108, test_f1: 0.5679
 epoch: 76, train_loss: 0.7020, test_loss: 1.0071, test_f1: 0.5904
 epoch: 77, train_loss: 0.6962, test_loss: 1.0177, test_f1: 0.5875
 epoch: 78, train_loss: 0.6982, test_loss: 1.0224, test_f1: 0.5977
 epoch: 79, train_loss: 0.7016, test_loss: 1.0232, test_f1: 0.5923
 epoch: 80, train_loss: 0.7006, test_loss: 1.0283, test_f1: 0.5809
 epoch: 81, train_loss: 0.6878, test_loss: 1.0441, test_f1: 0.5912
 epoch: 82, train_loss: 0.6797, test_loss: 1.0349, test_f1: 0.5884
 epoch: 83, train_loss: 0.6861, test_loss: 1.0173, test_f1: 0.5969
 epoch: 84, train_loss: 0.6948, test_loss: 1.0351, test_f1: 0.5739
 epoch: 85, train_loss: 0.6833, test_loss: 1.0308, test_f1: 0.5929
 epoch: 86, train_loss: 0.6782, test_loss: 1.0306, test_f1: 0.5883
 epoch: 87, train_loss: 0.6794, test_loss: 1.0512, test_f1: 0.6011
 epoch: 88, train_loss: 0.6663, test_loss: 1.0733, test_f1: 0.5938
 epoch: 89, train_loss: 0.6772, test_loss: 1.0786, test_f1: 0.5793
 epoch: 90, train_loss: 0.6566, test_loss: 1.0444, test_f1: 0.5736
 epoch: 91, train_loss: 0.6631, test_loss: 1.0304, test_f1: 0.5847
 epoch: 92, train_loss: 0.6746, test_loss: 1.0343, test_f1: 0.5829
 epoch: 93, train_loss: 0.6625, test_loss: 1.0531, test_f1: 0.5881
 epoch: 94, train_loss: 0.6709, test_loss: 1.0637, test_f1: 0.5777
 epoch: 95, train_loss: 0.6641, test_loss: 1.0447, test_f1: 0.5917
 epoch: 96, train_loss: 0.6638, test_loss: 1.0436, test_f1: 0.5923
 epoch: 97, train_loss: 0.6533, test_loss: 1.0638, test_f1: 0.5850
 epoch: 98, train_loss: 0.6546, test_loss: 1.0698, test_f1: 0.5708
 epoch: 99, train_loss: 0.6664, test_loss: 1.0540, test_f1: 0.6054
##################ITERATION #8 ****************************************
 epoch: 0, train_loss: 1.2617, test_loss: 1.3010, test_f1: 0.2407
 epoch: 1, train_loss: 1.2003, test_loss: 1.2922, test_f1: 0.2440
 epoch: 2, train_loss: 1.1763, test_loss: 1.2815, test_f1: 0.2600
 epoch: 3, train_loss: 1.1681, test_loss: 1.2528, test_f1: 0.2569
 epoch: 4, train_loss: 1.1315, test_loss: 1.2308, test_f1: 0.2675
 epoch: 5, train_loss: 1.1284, test_loss: 1.2234, test_f1: 0.3617
 epoch: 6, train_loss: 1.1088, test_loss: 1.2196, test_f1: 0.3813
 epoch: 7, train_loss: 1.0981, test_loss: 1.2113, test_f1: 0.4319
 epoch: 8, train_loss: 1.0733, test_loss: 1.1923, test_f1: 0.4635
 epoch: 9, train_loss: 1.0517, test_loss: 1.1996, test_f1: 0.4835
 epoch: 10, train_loss: 1.0433, test_loss: 1.1926, test_f1: 0.4875
 epoch: 11, train_loss: 1.0306, test_loss: 1.1652, test_f1: 0.4997
 epoch: 12, train_loss: 0.9976, test_loss: 1.1632, test_f1: 0.5163
 epoch: 13, train_loss: 0.9961, test_loss: 1.1671, test_f1: 0.5014
 epoch: 14, train_loss: 0.9914, test_loss: 1.1090, test_f1: 0.5218
 epoch: 15, train_loss: 0.9733, test_loss: 1.0993, test_f1: 0.5148
 epoch: 16, train_loss: 0.9762, test_loss: 1.0894, test_f1: 0.5179
 epoch: 17, train_loss: 0.9507, test_loss: 1.1063, test_f1: 0.5089
 epoch: 18, train_loss: 0.9381, test_loss: 1.1292, test_f1: 0.5071
 epoch: 19, train_loss: 0.9229, test_loss: 1.0779, test_f1: 0.5158
 epoch: 20, train_loss: 0.9147, test_loss: 1.0761, test_f1: 0.5214
 epoch: 21, train_loss: 0.9140, test_loss: 1.0689, test_f1: 0.5228
 epoch: 22, train_loss: 0.8948, test_loss: 1.0423, test_f1: 0.5342
 epoch: 23, train_loss: 0.9042, test_loss: 1.0356, test_f1: 0.5239
 epoch: 24, train_loss: 0.8846, test_loss: 1.0176, test_f1: 0.5356
 epoch: 25, train_loss: 0.8681, test_loss: 1.0388, test_f1: 0.5370
 epoch: 26, train_loss: 0.8647, test_loss: 1.0644, test_f1: 0.5341
 epoch: 27, train_loss: 0.8560, test_loss: 1.0168, test_f1: 0.5403
 epoch: 28, train_loss: 0.8491, test_loss: 1.0221, test_f1: 0.5174
 epoch: 29, train_loss: 0.8401, test_loss: 1.0428, test_f1: 0.5219
 epoch: 30, train_loss: 0.8354, test_loss: 1.0081, test_f1: 0.5415
 epoch: 31, train_loss: 0.8282, test_loss: 0.9990, test_f1: 0.5281
 epoch: 32, train_loss: 0.8262, test_loss: 1.0019, test_f1: 0.5331
 epoch: 33, train_loss: 0.8213, test_loss: 0.9922, test_f1: 0.5455
 epoch: 34, train_loss: 0.8030, test_loss: 1.0117, test_f1: 0.5160
 epoch: 35, train_loss: 0.8007, test_loss: 0.9989, test_f1: 0.5395
 epoch: 36, train_loss: 0.8036, test_loss: 1.0084, test_f1: 0.5209
 epoch: 37, train_loss: 0.7920, test_loss: 1.0025, test_f1: 0.5530
 epoch: 38, train_loss: 0.7839, test_loss: 1.0255, test_f1: 0.5544
 epoch: 39, train_loss: 0.7938, test_loss: 1.0077, test_f1: 0.5479
 epoch: 40, train_loss: 0.7696, test_loss: 0.9823, test_f1: 0.5679
 epoch: 41, train_loss: 0.7618, test_loss: 0.9761, test_f1: 0.5506
 epoch: 42, train_loss: 0.7667, test_loss: 0.9866, test_f1: 0.5676
 epoch: 43, train_loss: 0.7447, test_loss: 0.9888, test_f1: 0.5506
 epoch: 44, train_loss: 0.7394, test_loss: 0.9878, test_f1: 0.5558
 epoch: 45, train_loss: 0.7366, test_loss: 0.9851, test_f1: 0.5530
 epoch: 46, train_loss: 0.7381, test_loss: 1.0033, test_f1: 0.5561
 epoch: 47, train_loss: 0.7286, test_loss: 1.0148, test_f1: 0.5393
 epoch: 48, train_loss: 0.7207, test_loss: 0.9957, test_f1: 0.5535
 epoch: 49, train_loss: 0.7097, test_loss: 1.0175, test_f1: 0.5421
 epoch: 50, train_loss: 0.7104, test_loss: 1.0077, test_f1: 0.5719
 epoch: 51, train_loss: 0.7261, test_loss: 1.0047, test_f1: 0.5726
 epoch: 52, train_loss: 0.6978, test_loss: 1.0136, test_f1: 0.5614
 epoch: 53, train_loss: 0.6933, test_loss: 1.0106, test_f1: 0.5354
 epoch: 54, train_loss: 0.6961, test_loss: 1.0017, test_f1: 0.5605
 epoch: 55, train_loss: 0.6827, test_loss: 0.9997, test_f1: 0.5624
 epoch: 56, train_loss: 0.6800, test_loss: 1.0225, test_f1: 0.5471
 epoch: 57, train_loss: 0.6887, test_loss: 1.0399, test_f1: 0.5300
 epoch: 58, train_loss: 0.6790, test_loss: 1.0349, test_f1: 0.5603
 epoch: 59, train_loss: 0.6891, test_loss: 1.0347, test_f1: 0.5643
 epoch: 60, train_loss: 0.6807, test_loss: 1.0171, test_f1: 0.5769
 epoch: 61, train_loss: 0.6680, test_loss: 1.0281, test_f1: 0.5451
 epoch: 62, train_loss: 0.6783, test_loss: 1.0403, test_f1: 0.5508
 epoch: 63, train_loss: 0.6796, test_loss: 1.0303, test_f1: 0.5763
 epoch: 64, train_loss: 0.6697, test_loss: 1.0505, test_f1: 0.5287
 epoch: 65, train_loss: 0.6486, test_loss: 1.0572, test_f1: 0.5488
 epoch: 66, train_loss: 0.6746, test_loss: 1.0719, test_f1: 0.5351
 epoch: 67, train_loss: 0.6732, test_loss: 1.0333, test_f1: 0.5648
 epoch: 68, train_loss: 0.6511, test_loss: 1.0601, test_f1: 0.5675
 epoch: 69, train_loss: 0.6532, test_loss: 1.0646, test_f1: 0.5545
 epoch: 70, train_loss: 0.6503, test_loss: 1.0505, test_f1: 0.5476
 epoch: 71, train_loss: 0.6566, test_loss: 1.0452, test_f1: 0.5473
 epoch: 72, train_loss: 0.6532, test_loss: 1.0544, test_f1: 0.5551
 epoch: 73, train_loss: 0.6570, test_loss: 1.0678, test_f1: 0.5549
 epoch: 74, train_loss: 0.6468, test_loss: 1.0630, test_f1: 0.5525
 epoch: 75, train_loss: 0.6381, test_loss: 1.0503, test_f1: 0.5360
 epoch: 76, train_loss: 0.6442, test_loss: 1.0689, test_f1: 0.5435
 epoch: 77, train_loss: 0.6391, test_loss: 1.0377, test_f1: 0.5589
 epoch: 78, train_loss: 0.6498, test_loss: 1.0748, test_f1: 0.5594
 epoch: 79, train_loss: 0.6468, test_loss: 1.0525, test_f1: 0.5806
 epoch: 80, train_loss: 0.6277, test_loss: 1.0655, test_f1: 0.5493
 epoch: 81, train_loss: 0.6234, test_loss: 1.0788, test_f1: 0.5490
 epoch: 82, train_loss: 0.6326, test_loss: 1.0711, test_f1: 0.5575
 epoch: 83, train_loss: 0.6203, test_loss: 1.1044, test_f1: 0.5513
 epoch: 84, train_loss: 0.6160, test_loss: 1.0921, test_f1: 0.5563
 epoch: 85, train_loss: 0.6264, test_loss: 1.0847, test_f1: 0.5776
 epoch: 86, train_loss: 0.6246, test_loss: 1.0923, test_f1: 0.5561
 epoch: 87, train_loss: 0.6140, test_loss: 1.1100, test_f1: 0.5356
 epoch: 88, train_loss: 0.6102, test_loss: 1.1352, test_f1: 0.5386
 epoch: 89, train_loss: 0.6220, test_loss: 1.1501, test_f1: 0.5378
 epoch: 90, train_loss: 0.6202, test_loss: 1.1397, test_f1: 0.5350
 epoch: 91, train_loss: 0.6252, test_loss: 1.1388, test_f1: 0.5644
 epoch: 92, train_loss: 0.6087, test_loss: 1.1424, test_f1: 0.5557
 epoch: 93, train_loss: 0.6100, test_loss: 1.1500, test_f1: 0.5287
 epoch: 94, train_loss: 0.6144, test_loss: 1.1251, test_f1: 0.5385
 epoch: 95, train_loss: 0.6212, test_loss: 1.1208, test_f1: 0.5336
 epoch: 96, train_loss: 0.6103, test_loss: 1.1823, test_f1: 0.5352
 epoch: 97, train_loss: 0.6146, test_loss: 1.1179, test_f1: 0.5692
 epoch: 98, train_loss: 0.5995, test_loss: 1.1303, test_f1: 0.5537
 epoch: 99, train_loss: 0.6059, test_loss: 1.1730, test_f1: 0.5387
##################ITERATION #9 ****************************************
 epoch: 0, train_loss: 1.2595, test_loss: 1.3135, test_f1: 0.2281
 epoch: 1, train_loss: 1.2067, test_loss: 1.3046, test_f1: 0.2281
 epoch: 2, train_loss: 1.1826, test_loss: 1.3000, test_f1: 0.2281
 epoch: 3, train_loss: 1.1754, test_loss: 1.2751, test_f1: 0.2265
 epoch: 4, train_loss: 1.1631, test_loss: 1.2474, test_f1: 0.2631
 epoch: 5, train_loss: 1.1400, test_loss: 1.2186, test_f1: 0.3735
 epoch: 6, train_loss: 1.1276, test_loss: 1.1962, test_f1: 0.3839
 epoch: 7, train_loss: 1.1045, test_loss: 1.1696, test_f1: 0.4227
 epoch: 8, train_loss: 1.0850, test_loss: 1.1617, test_f1: 0.4408
 epoch: 9, train_loss: 1.0605, test_loss: 1.1548, test_f1: 0.4590
 epoch: 10, train_loss: 1.0580, test_loss: 1.1339, test_f1: 0.4797
 epoch: 11, train_loss: 1.0450, test_loss: 1.1319, test_f1: 0.4965
 epoch: 12, train_loss: 1.0380, test_loss: 1.1121, test_f1: 0.5096
 epoch: 13, train_loss: 1.0160, test_loss: 1.1008, test_f1: 0.5310
 epoch: 14, train_loss: 1.0089, test_loss: 1.0943, test_f1: 0.5182
 epoch: 15, train_loss: 0.9881, test_loss: 1.0763, test_f1: 0.5308
 epoch: 16, train_loss: 0.9821, test_loss: 1.0810, test_f1: 0.5512
 epoch: 17, train_loss: 0.9708, test_loss: 1.0722, test_f1: 0.5377
 epoch: 18, train_loss: 0.9625, test_loss: 1.0616, test_f1: 0.5440
 epoch: 19, train_loss: 0.9536, test_loss: 1.0618, test_f1: 0.5486
 epoch: 20, train_loss: 0.9401, test_loss: 1.0634, test_f1: 0.5515
 epoch: 21, train_loss: 0.9233, test_loss: 1.0501, test_f1: 0.5355
 epoch: 22, train_loss: 0.9227, test_loss: 1.0440, test_f1: 0.5394
 epoch: 23, train_loss: 0.9171, test_loss: 1.0589, test_f1: 0.5604
 epoch: 24, train_loss: 0.9009, test_loss: 1.0576, test_f1: 0.5568
 epoch: 25, train_loss: 0.9022, test_loss: 1.0512, test_f1: 0.5686
 epoch: 26, train_loss: 0.8901, test_loss: 1.0519, test_f1: 0.5648
 epoch: 27, train_loss: 0.8888, test_loss: 1.0500, test_f1: 0.5722
 epoch: 28, train_loss: 0.8781, test_loss: 1.0466, test_f1: 0.5594
 epoch: 29, train_loss: 0.8651, test_loss: 1.0468, test_f1: 0.5645
 epoch: 30, train_loss: 0.8467, test_loss: 1.0646, test_f1: 0.5690
 epoch: 31, train_loss: 0.8708, test_loss: 1.0582, test_f1: 0.5736
 epoch: 32, train_loss: 0.8465, test_loss: 1.0367, test_f1: 0.5701
 epoch: 33, train_loss: 0.8372, test_loss: 1.0396, test_f1: 0.5650
 epoch: 34, train_loss: 0.8444, test_loss: 1.0487, test_f1: 0.5665
 epoch: 35, train_loss: 0.8232, test_loss: 1.0366, test_f1: 0.5676
 epoch: 36, train_loss: 0.8092, test_loss: 1.0549, test_f1: 0.5650
 epoch: 37, train_loss: 0.8087, test_loss: 1.0386, test_f1: 0.5655
 epoch: 38, train_loss: 0.7927, test_loss: 1.0436, test_f1: 0.5612
 epoch: 39, train_loss: 0.8091, test_loss: 1.0403, test_f1: 0.5560
 epoch: 40, train_loss: 0.7885, test_loss: 1.0211, test_f1: 0.5705
 epoch: 41, train_loss: 0.7816, test_loss: 1.0461, test_f1: 0.5517
 epoch: 42, train_loss: 0.7817, test_loss: 1.0501, test_f1: 0.5445
 epoch: 43, train_loss: 0.7677, test_loss: 1.0436, test_f1: 0.5462
 epoch: 44, train_loss: 0.7707, test_loss: 1.0360, test_f1: 0.5336
 epoch: 45, train_loss: 0.7490, test_loss: 1.0423, test_f1: 0.5553
 epoch: 46, train_loss: 0.7492, test_loss: 1.0246, test_f1: 0.5644
 epoch: 47, train_loss: 0.7542, test_loss: 1.0476, test_f1: 0.5487
 epoch: 48, train_loss: 0.7480, test_loss: 1.0443, test_f1: 0.5606
 epoch: 49, train_loss: 0.7462, test_loss: 1.0330, test_f1: 0.5583
 epoch: 50, train_loss: 0.7350, test_loss: 1.0513, test_f1: 0.5425
 epoch: 51, train_loss: 0.7323, test_loss: 1.0616, test_f1: 0.5489
 epoch: 52, train_loss: 0.7294, test_loss: 1.0612, test_f1: 0.5445
 epoch: 53, train_loss: 0.7258, test_loss: 1.0725, test_f1: 0.5494
 epoch: 54, train_loss: 0.7244, test_loss: 1.0651, test_f1: 0.5458
 epoch: 55, train_loss: 0.7193, test_loss: 1.0726, test_f1: 0.5528
 epoch: 56, train_loss: 0.7192, test_loss: 1.0611, test_f1: 0.5462
 epoch: 57, train_loss: 0.7000, test_loss: 1.0609, test_f1: 0.5589
 epoch: 58, train_loss: 0.7091, test_loss: 1.0679, test_f1: 0.5622
 epoch: 59, train_loss: 0.7165, test_loss: 1.0683, test_f1: 0.5576
 epoch: 60, train_loss: 0.7010, test_loss: 1.0508, test_f1: 0.5666
 epoch: 61, train_loss: 0.6911, test_loss: 1.0630, test_f1: 0.5561
 epoch: 62, train_loss: 0.7028, test_loss: 1.0592, test_f1: 0.5621
 epoch: 63, train_loss: 0.6910, test_loss: 1.0768, test_f1: 0.5548
 epoch: 64, train_loss: 0.6789, test_loss: 1.0572, test_f1: 0.5694
 epoch: 65, train_loss: 0.6909, test_loss: 1.0791, test_f1: 0.5401
 epoch: 66, train_loss: 0.6830, test_loss: 1.0609, test_f1: 0.5456
 epoch: 67, train_loss: 0.6808, test_loss: 1.0647, test_f1: 0.5564
 epoch: 68, train_loss: 0.6891, test_loss: 1.0812, test_f1: 0.5518
 epoch: 69, train_loss: 0.6718, test_loss: 1.0851, test_f1: 0.5569
 epoch: 70, train_loss: 0.6740, test_loss: 1.0802, test_f1: 0.5484
 epoch: 71, train_loss: 0.6733, test_loss: 1.0894, test_f1: 0.5517
 epoch: 72, train_loss: 0.6713, test_loss: 1.0794, test_f1: 0.5477
 epoch: 73, train_loss: 0.6677, test_loss: 1.0879, test_f1: 0.5517
 epoch: 74, train_loss: 0.6617, test_loss: 1.0910, test_f1: 0.5566
 epoch: 75, train_loss: 0.6746, test_loss: 1.0935, test_f1: 0.5519
 epoch: 76, train_loss: 0.6590, test_loss: 1.0953, test_f1: 0.5535
 epoch: 77, train_loss: 0.6563, test_loss: 1.0927, test_f1: 0.5577
 epoch: 78, train_loss: 0.6686, test_loss: 1.0976, test_f1: 0.5402
 epoch: 79, train_loss: 0.6477, test_loss: 1.0950, test_f1: 0.5409
 epoch: 80, train_loss: 0.6587, test_loss: 1.0968, test_f1: 0.5565
 epoch: 81, train_loss: 0.6497, test_loss: 1.1119, test_f1: 0.5365
 epoch: 82, train_loss: 0.6570, test_loss: 1.1031, test_f1: 0.5490
 epoch: 83, train_loss: 0.6449, test_loss: 1.1236, test_f1: 0.5476
 epoch: 84, train_loss: 0.6494, test_loss: 1.1141, test_f1: 0.5542
 epoch: 85, train_loss: 0.6453, test_loss: 1.1194, test_f1: 0.5537
 epoch: 86, train_loss: 0.6434, test_loss: 1.1221, test_f1: 0.5463
 epoch: 87, train_loss: 0.6367, test_loss: 1.1375, test_f1: 0.5373
 epoch: 88, train_loss: 0.6440, test_loss: 1.1365, test_f1: 0.5482
 epoch: 89, train_loss: 0.6364, test_loss: 1.1183, test_f1: 0.5537
 epoch: 90, train_loss: 0.6260, test_loss: 1.1421, test_f1: 0.5454
 epoch: 91, train_loss: 0.6279, test_loss: 1.1541, test_f1: 0.5572
 epoch: 92, train_loss: 0.6424, test_loss: 1.1456, test_f1: 0.5491
 epoch: 93, train_loss: 0.6228, test_loss: 1.1481, test_f1: 0.5483
 epoch: 94, train_loss: 0.6165, test_loss: 1.1391, test_f1: 0.5448
 epoch: 95, train_loss: 0.6278, test_loss: 1.1351, test_f1: 0.5412
 epoch: 96, train_loss: 0.6320, test_loss: 1.1292, test_f1: 0.5457
 epoch: 97, train_loss: 0.6402, test_loss: 1.1292, test_f1: 0.5414
 epoch: 98, train_loss: 0.6301, test_loss: 1.1360, test_f1: 0.5355
 epoch: 99, train_loss: 0.6272, test_loss: 1.1543, test_f1: 0.5343

Training completed in 522.20 seconds
Best F1: 0.6236 at epoch 98
Mean F1 across iterations: 0.5802  0.0237
========================FINAL RESULTS================================
FEGIN weighted F1: 0.6236  0.0237
python main.py --data ltspice_demos --representation component_pin --model FEGIN --layers 6 --hiddens 64 --batch_size 128 --lr 0.0001 --emb_size 250 --epochs 100 --save_appendix component_pin_L6_H64_BS128_LR0.0001_E250 --no_val
-----



STDERR:
  File "main.py", line 370, in <module>
    main()
  File "main.py", line 254, in main
    dataset = dataset_class(
  File "/home/philip/projects/ltspice_examples_code_repo/Circuit-Completion-Using-GNNs/component_classification_with_link_prediction_head/evaluation/FEGIN/kernel/circuit_datasets.py", line 15, in __init__
    self.data, self.slices = torch.load(self.processed_paths[0])
  File "/home/philip/.local/lib/python3.8/site-packages/torch/serialization.py", line 1040, in load
    warnings.warn(
  File "/usr/lib/python3.8/warnings.py", line 109, in _showwarnmsg
    sw(msg.message, msg.category, msg.filename, msg.lineno,
  File "main.py", line 47, in warn_with_traceback
    traceback.print_stack(file=log)
/home/philip/projects/ltspice_examples_code_repo/Circuit-Completion-Using-GNNs/component_classification_with_link_prediction_head/evaluation/FEGIN/kernel/circuit_datasets.py:15: FutureWarning: You are using `torch.load` with `weights_only=False` (the current default value), which uses the default pickle module implicitly. It is possible to construct malicious pickle data which will execute arbitrary code during unpickling (See https://github.com/pytorch/pytorch/blob/main/SECURITY.md#untrusted-models for more details). In a future release, the default value for `weights_only` will be flipped to `True`. This limits the functions that could be executed during unpickling. Arbitrary objects will no longer be allowed to be loaded via this mode unless they are explicitly allowlisted by the user via `torch.serialization.add_safe_globals`. We recommend you start setting `weights_only=True` for any use case where you don't have full control of the loaded file. Please open an issue on GitHub for any issues related to this experimental feature.
  self.data, self.slices = torch.load(self.processed_paths[0])
