STDOUT:
Results will be saved in /home/philip/projects/llm_inference_code_repo/Circuit-Completion-Using-GNNs/component_classification_with_link_prediction_head/evaluation/FEGIN/results/model_FEGIN_dataset_ltspice_examples
Command line input: python main.py --data ltspice_examples --representation component_pin --model FEGIN --layers 3 --hiddens 64 --batch_size 64 --lr 0.001 --emb_size 250 --epochs 100 --save_appendix component_pin_L3_H64_BS64_LR0.001_E250 --no_val
 is saved.
-----
ltspice_examples - FEGIN
Using 3 layers, 64 hidden units, h = 2
Loading component_pin representation dataset
ENTERED
Training FEGIN on component_pin representation
Train: 3560, Test: 848
##################ITERATION #0 ****************************************
 epoch: 0, train_loss: 1.2566, test_loss: 1.1199, test_f1: 0.3391
 epoch: 1, train_loss: 1.0552, test_loss: 1.0202, test_f1: 0.4619
 epoch: 2, train_loss: 0.9940, test_loss: 1.2705, test_f1: 0.3965
 epoch: 3, train_loss: 0.9444, test_loss: 1.0033, test_f1: 0.4944
 epoch: 4, train_loss: 0.9088, test_loss: 0.9737, test_f1: 0.5053
 epoch: 5, train_loss: 0.8941, test_loss: 0.9112, test_f1: 0.5699
 epoch: 6, train_loss: 0.8655, test_loss: 0.9799, test_f1: 0.5133
 epoch: 7, train_loss: 0.8326, test_loss: 1.0914, test_f1: 0.4676
 epoch: 8, train_loss: 0.8219, test_loss: 0.9471, test_f1: 0.5448
 epoch: 9, train_loss: 0.8017, test_loss: 0.8994, test_f1: 0.5644
 epoch: 10, train_loss: 0.7979, test_loss: 0.8703, test_f1: 0.5509
 epoch: 11, train_loss: 0.7574, test_loss: 0.8896, test_f1: 0.5399
 epoch: 12, train_loss: 0.7577, test_loss: 0.9657, test_f1: 0.5410
 epoch: 13, train_loss: 0.7527, test_loss: 0.8700, test_f1: 0.5900
 epoch: 14, train_loss: 0.7302, test_loss: 0.9049, test_f1: 0.5766
 epoch: 15, train_loss: 0.7255, test_loss: 0.8741, test_f1: 0.5971
 epoch: 16, train_loss: 0.7048, test_loss: 0.8909, test_f1: 0.5846
 epoch: 17, train_loss: 0.7063, test_loss: 0.8803, test_f1: 0.5886
 epoch: 18, train_loss: 0.6885, test_loss: 0.8838, test_f1: 0.6201
 epoch: 19, train_loss: 0.6815, test_loss: 0.8939, test_f1: 0.6161
 epoch: 20, train_loss: 0.6711, test_loss: 1.0133, test_f1: 0.5910
 epoch: 21, train_loss: 0.6673, test_loss: 0.9265, test_f1: 0.6008
 epoch: 22, train_loss: 0.6377, test_loss: 0.9217, test_f1: 0.6092
 epoch: 23, train_loss: 0.6223, test_loss: 0.8935, test_f1: 0.6230
 epoch: 24, train_loss: 0.6510, test_loss: 0.8907, test_f1: 0.6376
 epoch: 25, train_loss: 0.6176, test_loss: 1.0250, test_f1: 0.6158
 epoch: 26, train_loss: 0.6324, test_loss: 1.0964, test_f1: 0.5772
 epoch: 27, train_loss: 0.6117, test_loss: 0.9370, test_f1: 0.6031
 epoch: 28, train_loss: 0.6030, test_loss: 0.9958, test_f1: 0.6107
 epoch: 29, train_loss: 0.6097, test_loss: 1.0577, test_f1: 0.6015
 epoch: 30, train_loss: 0.5946, test_loss: 1.0558, test_f1: 0.5975
 epoch: 31, train_loss: 0.5861, test_loss: 0.9709, test_f1: 0.6414
 epoch: 32, train_loss: 0.5657, test_loss: 0.9926, test_f1: 0.6356
 epoch: 33, train_loss: 0.5752, test_loss: 1.3235, test_f1: 0.5644
 epoch: 34, train_loss: 0.5615, test_loss: 1.0504, test_f1: 0.6167
 epoch: 35, train_loss: 0.5616, test_loss: 1.0702, test_f1: 0.5973
 epoch: 36, train_loss: 0.5572, test_loss: 1.0924, test_f1: 0.6155
 epoch: 37, train_loss: 0.5438, test_loss: 1.1536, test_f1: 0.6095
 epoch: 38, train_loss: 0.5400, test_loss: 1.0112, test_f1: 0.6359
 epoch: 39, train_loss: 0.5516, test_loss: 1.0937, test_f1: 0.5839
 epoch: 40, train_loss: 0.5279, test_loss: 1.0897, test_f1: 0.6187
 epoch: 41, train_loss: 0.5254, test_loss: 1.1529, test_f1: 0.6375
 epoch: 42, train_loss: 0.5405, test_loss: 1.1138, test_f1: 0.6559
 epoch: 43, train_loss: 0.5095, test_loss: 1.0679, test_f1: 0.6439
 epoch: 44, train_loss: 0.5140, test_loss: 1.1097, test_f1: 0.6272
 epoch: 45, train_loss: 0.5047, test_loss: 1.0389, test_f1: 0.6910
 epoch: 46, train_loss: 0.5039, test_loss: 1.1421, test_f1: 0.6433
 epoch: 47, train_loss: 0.4777, test_loss: 1.1228, test_f1: 0.6525
 epoch: 48, train_loss: 0.4848, test_loss: 1.1480, test_f1: 0.6696
 epoch: 49, train_loss: 0.4844, test_loss: 1.2213, test_f1: 0.6224
 epoch: 50, train_loss: 0.4721, test_loss: 1.1023, test_f1: 0.6692
 epoch: 51, train_loss: 0.4360, test_loss: 1.1905, test_f1: 0.6694
 epoch: 52, train_loss: 0.4265, test_loss: 1.2240, test_f1: 0.6453
 epoch: 53, train_loss: 0.4185, test_loss: 1.1596, test_f1: 0.6534
 epoch: 54, train_loss: 0.3962, test_loss: 1.2988, test_f1: 0.6485
 epoch: 55, train_loss: 0.3827, test_loss: 1.2461, test_f1: 0.6653
 epoch: 56, train_loss: 0.3904, test_loss: 1.2409, test_f1: 0.6396
 epoch: 57, train_loss: 0.3931, test_loss: 1.1945, test_f1: 0.6811
 epoch: 58, train_loss: 0.3916, test_loss: 1.3236, test_f1: 0.6373
 epoch: 59, train_loss: 0.3954, test_loss: 1.3676, test_f1: 0.6442
 epoch: 60, train_loss: 0.3774, test_loss: 1.3085, test_f1: 0.6597
 epoch: 61, train_loss: 0.3617, test_loss: 1.3117, test_f1: 0.6590
 epoch: 62, train_loss: 0.3566, test_loss: 1.3857, test_f1: 0.6701
 epoch: 63, train_loss: 0.3533, test_loss: 1.3285, test_f1: 0.6654
 epoch: 64, train_loss: 0.3563, test_loss: 1.3325, test_f1: 0.6443
 epoch: 65, train_loss: 0.3459, test_loss: 1.3928, test_f1: 0.6274
 epoch: 66, train_loss: 0.3474, test_loss: 1.4404, test_f1: 0.6591
 epoch: 67, train_loss: 0.3481, test_loss: 1.4538, test_f1: 0.6689
 epoch: 68, train_loss: 0.3273, test_loss: 1.5142, test_f1: 0.6643
 epoch: 69, train_loss: 0.3341, test_loss: 1.4408, test_f1: 0.6751
 epoch: 70, train_loss: 0.3337, test_loss: 1.4255, test_f1: 0.6658
 epoch: 71, train_loss: 0.3386, test_loss: 1.5085, test_f1: 0.6649
 epoch: 72, train_loss: 0.3198, test_loss: 1.5477, test_f1: 0.6429
 epoch: 73, train_loss: 0.3247, test_loss: 1.3885, test_f1: 0.6849
 epoch: 74, train_loss: 0.3135, test_loss: 1.5969, test_f1: 0.6451
 epoch: 75, train_loss: 0.3177, test_loss: 1.6662, test_f1: 0.6657
 epoch: 76, train_loss: 0.3131, test_loss: 1.4697, test_f1: 0.6436
 epoch: 77, train_loss: 0.3129, test_loss: 1.5020, test_f1: 0.6706
 epoch: 78, train_loss: 0.3013, test_loss: 1.5593, test_f1: 0.6770
 epoch: 79, train_loss: 0.2921, test_loss: 1.6162, test_f1: 0.6533
 epoch: 80, train_loss: 0.2927, test_loss: 1.5532, test_f1: 0.6836
 epoch: 81, train_loss: 0.2849, test_loss: 1.6073, test_f1: 0.6610
 epoch: 82, train_loss: 0.2895, test_loss: 1.5366, test_f1: 0.6500
 epoch: 83, train_loss: 0.3089, test_loss: 1.6779, test_f1: 0.6524
 epoch: 84, train_loss: 0.2779, test_loss: 1.6321, test_f1: 0.6401
 epoch: 85, train_loss: 0.2821, test_loss: 1.6747, test_f1: 0.6758
 epoch: 86, train_loss: 0.2793, test_loss: 1.7986, test_f1: 0.6689
 epoch: 87, train_loss: 0.2815, test_loss: 1.8065, test_f1: 0.6460
 epoch: 88, train_loss: 0.3088, test_loss: 1.8754, test_f1: 0.6164
 epoch: 89, train_loss: 0.3206, test_loss: 1.5459, test_f1: 0.6642
 epoch: 90, train_loss: 0.2854, test_loss: 1.6155, test_f1: 0.6652
 epoch: 91, train_loss: 0.2756, test_loss: 1.6292, test_f1: 0.6758
 epoch: 92, train_loss: 0.2615, test_loss: 1.6725, test_f1: 0.6775
 epoch: 93, train_loss: 0.2565, test_loss: 1.6363, test_f1: 0.6720
 epoch: 94, train_loss: 0.2737, test_loss: 1.6969, test_f1: 0.6468
 epoch: 95, train_loss: 0.2837, test_loss: 1.7275, test_f1: 0.6645
 epoch: 96, train_loss: 0.2563, test_loss: 1.7966, test_f1: 0.6625
 epoch: 97, train_loss: 0.2710, test_loss: 1.6060, test_f1: 0.6463
 epoch: 98, train_loss: 0.2717, test_loss: 1.7246, test_f1: 0.6757
 epoch: 99, train_loss: 0.2572, test_loss: 1.6731, test_f1: 0.6429
##################ITERATION #1 ****************************************
 epoch: 0, train_loss: 1.0967, test_loss: 1.1507, test_f1: 0.3303
 epoch: 1, train_loss: 0.9696, test_loss: 0.9583, test_f1: 0.5040
 epoch: 2, train_loss: 0.9326, test_loss: 0.9325, test_f1: 0.5037
 epoch: 3, train_loss: 0.8843, test_loss: 0.8688, test_f1: 0.5784
 epoch: 4, train_loss: 0.8528, test_loss: 0.8583, test_f1: 0.5463
 epoch: 5, train_loss: 0.8359, test_loss: 0.9214, test_f1: 0.5028
 epoch: 6, train_loss: 0.8112, test_loss: 0.8229, test_f1: 0.5577
 epoch: 7, train_loss: 0.7866, test_loss: 0.8452, test_f1: 0.5653
 epoch: 8, train_loss: 0.7532, test_loss: 0.7666, test_f1: 0.5921
 epoch: 9, train_loss: 0.7597, test_loss: 0.9085, test_f1: 0.5608
 epoch: 10, train_loss: 0.7520, test_loss: 0.8352, test_f1: 0.5861
 epoch: 11, train_loss: 0.7246, test_loss: 0.8635, test_f1: 0.6000
 epoch: 12, train_loss: 0.7062, test_loss: 0.8037, test_f1: 0.6216
 epoch: 13, train_loss: 0.6904, test_loss: 0.8095, test_f1: 0.6110
 epoch: 14, train_loss: 0.6890, test_loss: 0.8365, test_f1: 0.6218
 epoch: 15, train_loss: 0.6677, test_loss: 0.8770, test_f1: 0.5762
 epoch: 16, train_loss: 0.6548, test_loss: 0.7921, test_f1: 0.6365
 epoch: 17, train_loss: 0.6380, test_loss: 0.8436, test_f1: 0.6369
 epoch: 18, train_loss: 0.6237, test_loss: 0.7881, test_f1: 0.6335
 epoch: 19, train_loss: 0.6203, test_loss: 0.9464, test_f1: 0.5810
 epoch: 20, train_loss: 0.6125, test_loss: 0.8043, test_f1: 0.6412
 epoch: 21, train_loss: 0.6005, test_loss: 0.9982, test_f1: 0.5872
 epoch: 22, train_loss: 0.6109, test_loss: 0.9996, test_f1: 0.5877
 epoch: 23, train_loss: 0.5839, test_loss: 0.9000, test_f1: 0.6335
 epoch: 24, train_loss: 0.5878, test_loss: 0.8037, test_f1: 0.6293
 epoch: 25, train_loss: 0.5596, test_loss: 1.0246, test_f1: 0.6102
 epoch: 26, train_loss: 0.5860, test_loss: 0.9841, test_f1: 0.5965
 epoch: 27, train_loss: 0.5486, test_loss: 0.9380, test_f1: 0.6389
 epoch: 28, train_loss: 0.5563, test_loss: 0.8908, test_f1: 0.6280
 epoch: 29, train_loss: 0.5489, test_loss: 0.9707, test_f1: 0.5891
 epoch: 30, train_loss: 0.5295, test_loss: 0.8701, test_f1: 0.6441
 epoch: 31, train_loss: 0.5255, test_loss: 0.8438, test_f1: 0.6264
 epoch: 32, train_loss: 0.5181, test_loss: 0.8575, test_f1: 0.6192
 epoch: 33, train_loss: 0.5264, test_loss: 0.9702, test_f1: 0.6092
 epoch: 34, train_loss: 0.4987, test_loss: 0.9545, test_f1: 0.6326
 epoch: 35, train_loss: 0.4943, test_loss: 1.0237, test_f1: 0.6485
 epoch: 36, train_loss: 0.4923, test_loss: 0.9968, test_f1: 0.6524
 epoch: 37, train_loss: 0.4892, test_loss: 1.0064, test_f1: 0.6253
 epoch: 38, train_loss: 0.5066, test_loss: 0.9915, test_f1: 0.6455
 epoch: 39, train_loss: 0.4718, test_loss: 0.9230, test_f1: 0.6721
 epoch: 40, train_loss: 0.4488, test_loss: 1.1426, test_f1: 0.6595
 epoch: 41, train_loss: 0.4533, test_loss: 1.1334, test_f1: 0.6233
 epoch: 42, train_loss: 0.4650, test_loss: 1.1260, test_f1: 0.6269
 epoch: 43, train_loss: 0.4592, test_loss: 0.9541, test_f1: 0.6550
 epoch: 44, train_loss: 0.4529, test_loss: 1.0466, test_f1: 0.6614
 epoch: 45, train_loss: 0.4442, test_loss: 1.3631, test_f1: 0.5824
 epoch: 46, train_loss: 0.4410, test_loss: 1.0549, test_f1: 0.6508
 epoch: 47, train_loss: 0.4371, test_loss: 1.0698, test_f1: 0.6178
 epoch: 48, train_loss: 0.4200, test_loss: 1.1921, test_f1: 0.6323
 epoch: 49, train_loss: 0.4144, test_loss: 1.0442, test_f1: 0.6503
 epoch: 50, train_loss: 0.4015, test_loss: 1.4415, test_f1: 0.5764
 epoch: 51, train_loss: 0.3758, test_loss: 1.1616, test_f1: 0.6393
 epoch: 52, train_loss: 0.3519, test_loss: 1.2425, test_f1: 0.6509
 epoch: 53, train_loss: 0.3404, test_loss: 1.0993, test_f1: 0.6599
 epoch: 54, train_loss: 0.3461, test_loss: 1.2033, test_f1: 0.6370
 epoch: 55, train_loss: 0.3413, test_loss: 1.2973, test_f1: 0.6585
 epoch: 56, train_loss: 0.3330, test_loss: 1.2854, test_f1: 0.6187
 epoch: 57, train_loss: 0.3198, test_loss: 1.1810, test_f1: 0.6290
 epoch: 58, train_loss: 0.3311, test_loss: 1.2587, test_f1: 0.6532
 epoch: 59, train_loss: 0.3120, test_loss: 1.2437, test_f1: 0.6516
 epoch: 60, train_loss: 0.3132, test_loss: 1.2872, test_f1: 0.6453
 epoch: 61, train_loss: 0.3024, test_loss: 1.2625, test_f1: 0.6709
 epoch: 62, train_loss: 0.3296, test_loss: 1.3005, test_f1: 0.6422
 epoch: 63, train_loss: 0.3091, test_loss: 1.1962, test_f1: 0.6496
 epoch: 64, train_loss: 0.3133, test_loss: 1.3509, test_f1: 0.6676
 epoch: 65, train_loss: 0.3041, test_loss: 1.6854, test_f1: 0.6166
 epoch: 66, train_loss: 0.2866, test_loss: 1.4317, test_f1: 0.6457
 epoch: 67, train_loss: 0.2885, test_loss: 1.4108, test_f1: 0.6317
 epoch: 68, train_loss: 0.2846, test_loss: 1.5060, test_f1: 0.6413
 epoch: 69, train_loss: 0.2942, test_loss: 1.7107, test_f1: 0.6082
 epoch: 70, train_loss: 0.2762, test_loss: 1.3614, test_f1: 0.6569
 epoch: 71, train_loss: 0.2749, test_loss: 1.3830, test_f1: 0.6484
 epoch: 72, train_loss: 0.2857, test_loss: 1.6399, test_f1: 0.6116
 epoch: 73, train_loss: 0.2772, test_loss: 1.5594, test_f1: 0.6432
 epoch: 74, train_loss: 0.2616, test_loss: 1.4760, test_f1: 0.6814
 epoch: 75, train_loss: 0.2543, test_loss: 1.8299, test_f1: 0.6468
 epoch: 76, train_loss: 0.2648, test_loss: 1.5720, test_f1: 0.6647
 epoch: 77, train_loss: 0.2557, test_loss: 1.7446, test_f1: 0.6569
 epoch: 78, train_loss: 0.2694, test_loss: 1.8267, test_f1: 0.6535
 epoch: 79, train_loss: 0.2637, test_loss: 1.7361, test_f1: 0.6533
 epoch: 80, train_loss: 0.2424, test_loss: 1.4103, test_f1: 0.6371
 epoch: 81, train_loss: 0.2538, test_loss: 1.5870, test_f1: 0.6595
 epoch: 82, train_loss: 0.2437, test_loss: 1.6495, test_f1: 0.6042
 epoch: 83, train_loss: 0.2447, test_loss: 1.5685, test_f1: 0.6490
 epoch: 84, train_loss: 0.2347, test_loss: 1.5188, test_f1: 0.6332
 epoch: 85, train_loss: 0.2310, test_loss: 1.6491, test_f1: 0.6382
 epoch: 86, train_loss: 0.2376, test_loss: 1.6265, test_f1: 0.6719
 epoch: 87, train_loss: 0.2547, test_loss: 1.6216, test_f1: 0.6625
 epoch: 88, train_loss: 0.2442, test_loss: 1.6245, test_f1: 0.6423
 epoch: 89, train_loss: 0.2468, test_loss: 1.5878, test_f1: 0.6206
 epoch: 90, train_loss: 0.2474, test_loss: 1.7549, test_f1: 0.6444
 epoch: 91, train_loss: 0.2207, test_loss: 1.8687, test_f1: 0.6498
 epoch: 92, train_loss: 0.2275, test_loss: 1.9618, test_f1: 0.6451
 epoch: 93, train_loss: 0.2268, test_loss: 1.9438, test_f1: 0.6591
 epoch: 94, train_loss: 0.2245, test_loss: 1.8182, test_f1: 0.6222
 epoch: 95, train_loss: 0.2416, test_loss: 1.4957, test_f1: 0.6484
 epoch: 96, train_loss: 0.2217, test_loss: 1.7810, test_f1: 0.6131
 epoch: 97, train_loss: 0.2242, test_loss: 1.6918, test_f1: 0.6535
 epoch: 98, train_loss: 0.2029, test_loss: 1.7493, test_f1: 0.6528
 epoch: 99, train_loss: 0.1913, test_loss: 1.9010, test_f1: 0.6577
##################ITERATION #2 ****************************************
 epoch: 0, train_loss: 1.1487, test_loss: 0.9953, test_f1: 0.4615
 epoch: 1, train_loss: 0.9883, test_loss: 0.9663, test_f1: 0.5174
 epoch: 2, train_loss: 0.9477, test_loss: 0.9673, test_f1: 0.5095
 epoch: 3, train_loss: 0.9189, test_loss: 1.0029, test_f1: 0.5520
 epoch: 4, train_loss: 0.9065, test_loss: 0.9350, test_f1: 0.5554
 epoch: 5, train_loss: 0.8853, test_loss: 0.9174, test_f1: 0.5961
 epoch: 6, train_loss: 0.8625, test_loss: 0.9429, test_f1: 0.5408
 epoch: 7, train_loss: 0.8490, test_loss: 0.9396, test_f1: 0.5579
 epoch: 8, train_loss: 0.8279, test_loss: 0.9445, test_f1: 0.5902
 epoch: 9, train_loss: 0.8322, test_loss: 0.9479, test_f1: 0.5649
 epoch: 10, train_loss: 0.8035, test_loss: 0.8903, test_f1: 0.5543
 epoch: 11, train_loss: 0.7847, test_loss: 0.9411, test_f1: 0.5420
 epoch: 12, train_loss: 0.7776, test_loss: 0.9269, test_f1: 0.6017
 epoch: 13, train_loss: 0.7611, test_loss: 0.9549, test_f1: 0.5953
 epoch: 14, train_loss: 0.7550, test_loss: 0.8603, test_f1: 0.6500
 epoch: 15, train_loss: 0.7349, test_loss: 0.8852, test_f1: 0.5899
 epoch: 16, train_loss: 0.7268, test_loss: 0.8365, test_f1: 0.6036
 epoch: 17, train_loss: 0.7111, test_loss: 0.9309, test_f1: 0.6368
 epoch: 18, train_loss: 0.6967, test_loss: 0.8855, test_f1: 0.6407
 epoch: 19, train_loss: 0.6985, test_loss: 0.9615, test_f1: 0.5871
 epoch: 20, train_loss: 0.6939, test_loss: 0.8698, test_f1: 0.6412
 epoch: 21, train_loss: 0.6803, test_loss: 0.8479, test_f1: 0.6441
 epoch: 22, train_loss: 0.6656, test_loss: 0.9344, test_f1: 0.6302
 epoch: 23, train_loss: 0.6653, test_loss: 0.9370, test_f1: 0.5975
 epoch: 24, train_loss: 0.6463, test_loss: 0.9010, test_f1: 0.6364
 epoch: 25, train_loss: 0.6324, test_loss: 0.8949, test_f1: 0.6231
 epoch: 26, train_loss: 0.6329, test_loss: 0.8688, test_f1: 0.6488
 epoch: 27, train_loss: 0.6140, test_loss: 0.8711, test_f1: 0.6535
 epoch: 28, train_loss: 0.6095, test_loss: 0.8718, test_f1: 0.6593
 epoch: 29, train_loss: 0.6037, test_loss: 0.8389, test_f1: 0.6447
 epoch: 30, train_loss: 0.5858, test_loss: 1.0046, test_f1: 0.6438
 epoch: 31, train_loss: 0.5995, test_loss: 0.8782, test_f1: 0.6459
 epoch: 32, train_loss: 0.5906, test_loss: 0.8705, test_f1: 0.6513
 epoch: 33, train_loss: 0.5665, test_loss: 0.8501, test_f1: 0.6742
 epoch: 34, train_loss: 0.5418, test_loss: 0.8498, test_f1: 0.6625
 epoch: 35, train_loss: 0.5735, test_loss: 0.9317, test_f1: 0.6621
 epoch: 36, train_loss: 0.5565, test_loss: 0.8362, test_f1: 0.6829
 epoch: 37, train_loss: 0.5447, test_loss: 1.0619, test_f1: 0.6190
 epoch: 38, train_loss: 0.5435, test_loss: 0.8625, test_f1: 0.6749
 epoch: 39, train_loss: 0.5381, test_loss: 0.8957, test_f1: 0.6524
 epoch: 40, train_loss: 0.5316, test_loss: 0.9446, test_f1: 0.6501
 epoch: 41, train_loss: 0.5054, test_loss: 0.9875, test_f1: 0.6490
 epoch: 42, train_loss: 0.5226, test_loss: 1.0450, test_f1: 0.6224
 epoch: 43, train_loss: 0.5074, test_loss: 1.0564, test_f1: 0.6058
 epoch: 44, train_loss: 0.4934, test_loss: 0.8971, test_f1: 0.6614
 epoch: 45, train_loss: 0.4785, test_loss: 1.0258, test_f1: 0.6277
 epoch: 46, train_loss: 0.4970, test_loss: 1.0429, test_f1: 0.6213
 epoch: 47, train_loss: 0.4808, test_loss: 1.0745, test_f1: 0.6359
 epoch: 48, train_loss: 0.4774, test_loss: 0.8992, test_f1: 0.6545
 epoch: 49, train_loss: 0.4842, test_loss: 1.0491, test_f1: 0.6540
 epoch: 50, train_loss: 0.4588, test_loss: 1.0165, test_f1: 0.6208
 epoch: 51, train_loss: 0.4329, test_loss: 0.9308, test_f1: 0.6799
 epoch: 52, train_loss: 0.4052, test_loss: 1.0285, test_f1: 0.6455
 epoch: 53, train_loss: 0.3978, test_loss: 1.0944, test_f1: 0.6292
 epoch: 54, train_loss: 0.3868, test_loss: 1.0604, test_f1: 0.6583
 epoch: 55, train_loss: 0.3811, test_loss: 1.0405, test_f1: 0.6702
 epoch: 56, train_loss: 0.3639, test_loss: 1.0777, test_f1: 0.6697
 epoch: 57, train_loss: 0.3819, test_loss: 1.0390, test_f1: 0.6781
 epoch: 58, train_loss: 0.3723, test_loss: 1.1034, test_f1: 0.6518
 epoch: 59, train_loss: 0.3635, test_loss: 1.1236, test_f1: 0.6410
 epoch: 60, train_loss: 0.3545, test_loss: 1.1558, test_f1: 0.6523
 epoch: 61, train_loss: 0.3638, test_loss: 1.1014, test_f1: 0.6618
 epoch: 62, train_loss: 0.3683, test_loss: 1.2581, test_f1: 0.6402
 epoch: 63, train_loss: 0.3614, test_loss: 1.1331, test_f1: 0.6560
 epoch: 64, train_loss: 0.3559, test_loss: 1.1917, test_f1: 0.6611
 epoch: 65, train_loss: 0.3450, test_loss: 1.1820, test_f1: 0.6602
 epoch: 66, train_loss: 0.3438, test_loss: 1.0980, test_f1: 0.6598
 epoch: 67, train_loss: 0.3530, test_loss: 1.2026, test_f1: 0.6335
 epoch: 68, train_loss: 0.3321, test_loss: 1.1498, test_f1: 0.6594
 epoch: 69, train_loss: 0.3312, test_loss: 1.1548, test_f1: 0.6601
 epoch: 70, train_loss: 0.3236, test_loss: 1.1009, test_f1: 0.6845
 epoch: 71, train_loss: 0.3161, test_loss: 1.1947, test_f1: 0.6644
 epoch: 72, train_loss: 0.3283, test_loss: 1.2033, test_f1: 0.6472
 epoch: 73, train_loss: 0.3153, test_loss: 1.1364, test_f1: 0.6721
 epoch: 74, train_loss: 0.3174, test_loss: 1.5093, test_f1: 0.6327
 epoch: 75, train_loss: 0.3177, test_loss: 1.3394, test_f1: 0.6453
 epoch: 76, train_loss: 0.3159, test_loss: 1.2741, test_f1: 0.6714
 epoch: 77, train_loss: 0.3213, test_loss: 1.1464, test_f1: 0.6767
 epoch: 78, train_loss: 0.3230, test_loss: 1.4961, test_f1: 0.6330
 epoch: 79, train_loss: 0.3052, test_loss: 1.1887, test_f1: 0.6741
 epoch: 80, train_loss: 0.3077, test_loss: 1.5226, test_f1: 0.6110
 epoch: 81, train_loss: 0.3006, test_loss: 1.3560, test_f1: 0.6252
 epoch: 82, train_loss: 0.3097, test_loss: 1.3302, test_f1: 0.6443
 epoch: 83, train_loss: 0.2863, test_loss: 1.3112, test_f1: 0.6580
 epoch: 84, train_loss: 0.2988, test_loss: 1.3851, test_f1: 0.6617
 epoch: 85, train_loss: 0.2904, test_loss: 1.3705, test_f1: 0.6404
 epoch: 86, train_loss: 0.2656, test_loss: 1.3060, test_f1: 0.6533
 epoch: 87, train_loss: 0.2870, test_loss: 1.5060, test_f1: 0.6271
 epoch: 88, train_loss: 0.2707, test_loss: 1.3299, test_f1: 0.6612
 epoch: 89, train_loss: 0.2801, test_loss: 1.4339, test_f1: 0.6422
 epoch: 90, train_loss: 0.2860, test_loss: 1.4293, test_f1: 0.6565
 epoch: 91, train_loss: 0.2756, test_loss: 1.2908, test_f1: 0.6724
 epoch: 92, train_loss: 0.2743, test_loss: 1.7064, test_f1: 0.6267
 epoch: 93, train_loss: 0.2922, test_loss: 1.4967, test_f1: 0.6499
 epoch: 94, train_loss: 0.2581, test_loss: 1.4757, test_f1: 0.6340
 epoch: 95, train_loss: 0.2482, test_loss: 1.4471, test_f1: 0.6408
 epoch: 96, train_loss: 0.2642, test_loss: 1.4543, test_f1: 0.6431
 epoch: 97, train_loss: 0.2586, test_loss: 1.6190, test_f1: 0.6336
 epoch: 98, train_loss: 0.2715, test_loss: 1.5848, test_f1: 0.6406
 epoch: 99, train_loss: 0.2620, test_loss: 1.4222, test_f1: 0.6612
##################ITERATION #3 ****************************************
 epoch: 0, train_loss: 1.1660, test_loss: 1.1005, test_f1: 0.4859
 epoch: 1, train_loss: 0.9993, test_loss: 0.9799, test_f1: 0.5289
 epoch: 2, train_loss: 0.9289, test_loss: 0.9596, test_f1: 0.5148
 epoch: 3, train_loss: 0.8924, test_loss: 1.0926, test_f1: 0.5339
 epoch: 4, train_loss: 0.8955, test_loss: 0.8848, test_f1: 0.5605
 epoch: 5, train_loss: 0.8673, test_loss: 0.9676, test_f1: 0.5375
 epoch: 6, train_loss: 0.8507, test_loss: 0.8897, test_f1: 0.6099
 epoch: 7, train_loss: 0.8314, test_loss: 0.9122, test_f1: 0.5995
 epoch: 8, train_loss: 0.8161, test_loss: 0.8947, test_f1: 0.6100
 epoch: 9, train_loss: 0.8016, test_loss: 0.9226, test_f1: 0.6009
 epoch: 10, train_loss: 0.7716, test_loss: 0.8679, test_f1: 0.6196
 epoch: 11, train_loss: 0.7557, test_loss: 0.8987, test_f1: 0.6167
 epoch: 12, train_loss: 0.7345, test_loss: 0.9455, test_f1: 0.6053
 epoch: 13, train_loss: 0.7377, test_loss: 1.0444, test_f1: 0.5205
 epoch: 14, train_loss: 0.7301, test_loss: 0.8908, test_f1: 0.5563
 epoch: 15, train_loss: 0.7186, test_loss: 0.8745, test_f1: 0.6292
 epoch: 16, train_loss: 0.6945, test_loss: 0.8740, test_f1: 0.6184
 epoch: 17, train_loss: 0.6831, test_loss: 0.8492, test_f1: 0.6236
 epoch: 18, train_loss: 0.6737, test_loss: 0.8469, test_f1: 0.6326
 epoch: 19, train_loss: 0.6560, test_loss: 0.7830, test_f1: 0.6193
 epoch: 20, train_loss: 0.6673, test_loss: 0.8857, test_f1: 0.5825
 epoch: 21, train_loss: 0.6781, test_loss: 0.9476, test_f1: 0.5887
 epoch: 22, train_loss: 0.6516, test_loss: 0.8445, test_f1: 0.6185
 epoch: 23, train_loss: 0.6315, test_loss: 0.8946, test_f1: 0.6081
 epoch: 24, train_loss: 0.6413, test_loss: 1.0304, test_f1: 0.5897
 epoch: 25, train_loss: 0.6272, test_loss: 0.8501, test_f1: 0.6208
 epoch: 26, train_loss: 0.5910, test_loss: 0.9635, test_f1: 0.5888
 epoch: 27, train_loss: 0.6166, test_loss: 0.8767, test_f1: 0.6151
 epoch: 28, train_loss: 0.6067, test_loss: 0.8112, test_f1: 0.6608
 epoch: 29, train_loss: 0.5799, test_loss: 0.9341, test_f1: 0.6149
 epoch: 30, train_loss: 0.5824, test_loss: 0.9377, test_f1: 0.6146
 epoch: 31, train_loss: 0.5810, test_loss: 0.9217, test_f1: 0.6179
 epoch: 32, train_loss: 0.5669, test_loss: 1.0893, test_f1: 0.5788
 epoch: 33, train_loss: 0.5600, test_loss: 0.9402, test_f1: 0.6272
 epoch: 34, train_loss: 0.5561, test_loss: 0.9180, test_f1: 0.6259
 epoch: 35, train_loss: 0.5564, test_loss: 0.8948, test_f1: 0.6289
 epoch: 36, train_loss: 0.5605, test_loss: 0.9991, test_f1: 0.6231
 epoch: 37, train_loss: 0.5465, test_loss: 0.8594, test_f1: 0.6743
 epoch: 38, train_loss: 0.5227, test_loss: 0.9999, test_f1: 0.6258
 epoch: 39, train_loss: 0.5213, test_loss: 1.0262, test_f1: 0.6211
 epoch: 40, train_loss: 0.5129, test_loss: 0.9108, test_f1: 0.6236
 epoch: 41, train_loss: 0.5222, test_loss: 0.9699, test_f1: 0.6606
 epoch: 42, train_loss: 0.4937, test_loss: 1.0606, test_f1: 0.6020
 epoch: 43, train_loss: 0.4898, test_loss: 0.9447, test_f1: 0.6382
 epoch: 44, train_loss: 0.4861, test_loss: 0.9241, test_f1: 0.6611
 epoch: 45, train_loss: 0.4995, test_loss: 1.0394, test_f1: 0.6337
 epoch: 46, train_loss: 0.4703, test_loss: 0.9801, test_f1: 0.6696
 epoch: 47, train_loss: 0.4825, test_loss: 1.0243, test_f1: 0.6451
 epoch: 48, train_loss: 0.4561, test_loss: 1.0754, test_f1: 0.6217
 epoch: 49, train_loss: 0.4557, test_loss: 1.0209, test_f1: 0.6531
 epoch: 50, train_loss: 0.4587, test_loss: 1.0328, test_f1: 0.6640
 epoch: 51, train_loss: 0.4264, test_loss: 1.0419, test_f1: 0.6412
 epoch: 52, train_loss: 0.4003, test_loss: 1.0718, test_f1: 0.6499
 epoch: 53, train_loss: 0.3895, test_loss: 1.0157, test_f1: 0.6680
 epoch: 54, train_loss: 0.3846, test_loss: 1.0250, test_f1: 0.6554
 epoch: 55, train_loss: 0.3956, test_loss: 1.0470, test_f1: 0.6709
 epoch: 56, train_loss: 0.3763, test_loss: 1.0645, test_f1: 0.6615
 epoch: 57, train_loss: 0.3698, test_loss: 1.0121, test_f1: 0.6770
 epoch: 58, train_loss: 0.3695, test_loss: 1.1122, test_f1: 0.6588
 epoch: 59, train_loss: 0.3716, test_loss: 1.0993, test_f1: 0.6406
 epoch: 60, train_loss: 0.3482, test_loss: 1.0971, test_f1: 0.6522
 epoch: 61, train_loss: 0.3638, test_loss: 1.1096, test_f1: 0.6723
 epoch: 62, train_loss: 0.3469, test_loss: 1.1121, test_f1: 0.6354
 epoch: 63, train_loss: 0.3673, test_loss: 1.2080, test_f1: 0.6571
 epoch: 64, train_loss: 0.3354, test_loss: 1.0565, test_f1: 0.6722
 epoch: 65, train_loss: 0.3472, test_loss: 1.1821, test_f1: 0.6583
 epoch: 66, train_loss: 0.3373, test_loss: 1.1367, test_f1: 0.6621
 epoch: 67, train_loss: 0.3315, test_loss: 1.1066, test_f1: 0.6618
 epoch: 68, train_loss: 0.3231, test_loss: 1.1832, test_f1: 0.6705
 epoch: 69, train_loss: 0.3244, test_loss: 1.1288, test_f1: 0.6783
 epoch: 70, train_loss: 0.3281, test_loss: 1.2070, test_f1: 0.6611
 epoch: 71, train_loss: 0.3185, test_loss: 1.1821, test_f1: 0.6672
 epoch: 72, train_loss: 0.3199, test_loss: 1.1672, test_f1: 0.6658
 epoch: 73, train_loss: 0.3166, test_loss: 1.2046, test_f1: 0.6864
 epoch: 74, train_loss: 0.3066, test_loss: 1.2158, test_f1: 0.6515
 epoch: 75, train_loss: 0.3130, test_loss: 1.1444, test_f1: 0.6492
 epoch: 76, train_loss: 0.3269, test_loss: 1.1604, test_f1: 0.6993
 epoch: 77, train_loss: 0.3066, test_loss: 1.1552, test_f1: 0.6801
 epoch: 78, train_loss: 0.3063, test_loss: 1.2841, test_f1: 0.6496
 epoch: 79, train_loss: 0.2988, test_loss: 1.1608, test_f1: 0.6631
 epoch: 80, train_loss: 0.3003, test_loss: 1.1689, test_f1: 0.6683
 epoch: 81, train_loss: 0.2946, test_loss: 1.1600, test_f1: 0.6767
 epoch: 82, train_loss: 0.3197, test_loss: 1.2808, test_f1: 0.6370
 epoch: 83, train_loss: 0.2730, test_loss: 1.3004, test_f1: 0.6494
 epoch: 84, train_loss: 0.2822, test_loss: 1.3061, test_f1: 0.6718
 epoch: 85, train_loss: 0.2836, test_loss: 1.2797, test_f1: 0.6677
 epoch: 86, train_loss: 0.2912, test_loss: 1.2063, test_f1: 0.6645
 epoch: 87, train_loss: 0.2761, test_loss: 1.2137, test_f1: 0.6946
 epoch: 88, train_loss: 0.2807, test_loss: 1.3095, test_f1: 0.6680
 epoch: 89, train_loss: 0.2620, test_loss: 1.2788, test_f1: 0.6444
 epoch: 90, train_loss: 0.2689, test_loss: 1.3293, test_f1: 0.6504
 epoch: 91, train_loss: 0.2544, test_loss: 1.2703, test_f1: 0.6830
 epoch: 92, train_loss: 0.2570, test_loss: 1.2748, test_f1: 0.6576
 epoch: 93, train_loss: 0.2738, test_loss: 1.3540, test_f1: 0.6836
 epoch: 94, train_loss: 0.2716, test_loss: 1.2796, test_f1: 0.6627
 epoch: 95, train_loss: 0.2559, test_loss: 1.4674, test_f1: 0.6223
 epoch: 96, train_loss: 0.2541, test_loss: 1.4272, test_f1: 0.6483
 epoch: 97, train_loss: 0.2427, test_loss: 1.3780, test_f1: 0.6569
 epoch: 98, train_loss: 0.2588, test_loss: 1.5150, test_f1: 0.6545
 epoch: 99, train_loss: 0.2405, test_loss: 1.4675, test_f1: 0.6342
##################ITERATION #4 ****************************************
 epoch: 0, train_loss: 1.2331, test_loss: 1.0174, test_f1: 0.5384
 epoch: 1, train_loss: 1.0258, test_loss: 1.0331, test_f1: 0.5229
 epoch: 2, train_loss: 0.9777, test_loss: 0.9471, test_f1: 0.5412
 epoch: 3, train_loss: 0.9498, test_loss: 0.9845, test_f1: 0.5473
 epoch: 4, train_loss: 0.9289, test_loss: 0.9483, test_f1: 0.5665
 epoch: 5, train_loss: 0.9127, test_loss: 0.9758, test_f1: 0.5438
 epoch: 6, train_loss: 0.8933, test_loss: 0.9190, test_f1: 0.5724
 epoch: 7, train_loss: 0.8698, test_loss: 0.9507, test_f1: 0.5296
 epoch: 8, train_loss: 0.8538, test_loss: 0.9724, test_f1: 0.5569
 epoch: 9, train_loss: 0.8428, test_loss: 0.9832, test_f1: 0.5020
 epoch: 10, train_loss: 0.8231, test_loss: 0.9621, test_f1: 0.5280
 epoch: 11, train_loss: 0.8095, test_loss: 0.8973, test_f1: 0.6147
 epoch: 12, train_loss: 0.7987, test_loss: 0.9197, test_f1: 0.6010
 epoch: 13, train_loss: 0.7886, test_loss: 0.9197, test_f1: 0.5798
 epoch: 14, train_loss: 0.7887, test_loss: 0.8902, test_f1: 0.5707
 epoch: 15, train_loss: 0.7682, test_loss: 0.8738, test_f1: 0.5759
 epoch: 16, train_loss: 0.7433, test_loss: 0.8215, test_f1: 0.5727
 epoch: 17, train_loss: 0.7328, test_loss: 0.8801, test_f1: 0.5737
 epoch: 18, train_loss: 0.7166, test_loss: 0.8233, test_f1: 0.6216
 epoch: 19, train_loss: 0.7273, test_loss: 0.8675, test_f1: 0.6160
 epoch: 20, train_loss: 0.7200, test_loss: 0.8569, test_f1: 0.6379
 epoch: 21, train_loss: 0.7222, test_loss: 0.8605, test_f1: 0.6363
 epoch: 22, train_loss: 0.6928, test_loss: 0.8607, test_f1: 0.6386
 epoch: 23, train_loss: 0.6813, test_loss: 0.8051, test_f1: 0.6486
 epoch: 24, train_loss: 0.6824, test_loss: 0.8435, test_f1: 0.6282
 epoch: 25, train_loss: 0.6776, test_loss: 0.8238, test_f1: 0.6436
 epoch: 26, train_loss: 0.6803, test_loss: 0.8089, test_f1: 0.6347
 epoch: 27, train_loss: 0.6802, test_loss: 0.8523, test_f1: 0.6002
 epoch: 28, train_loss: 0.6472, test_loss: 0.8457, test_f1: 0.6438
 epoch: 29, train_loss: 0.6350, test_loss: 0.8258, test_f1: 0.6068
 epoch: 30, train_loss: 0.6329, test_loss: 0.9206, test_f1: 0.6098
 epoch: 31, train_loss: 0.6372, test_loss: 0.7865, test_f1: 0.6400
 epoch: 32, train_loss: 0.6182, test_loss: 0.8280, test_f1: 0.6363
 epoch: 33, train_loss: 0.6205, test_loss: 0.7974, test_f1: 0.6539
 epoch: 34, train_loss: 0.6004, test_loss: 0.8576, test_f1: 0.6394
 epoch: 35, train_loss: 0.5990, test_loss: 0.8067, test_f1: 0.6454
 epoch: 36, train_loss: 0.5858, test_loss: 0.7770, test_f1: 0.6675
 epoch: 37, train_loss: 0.5992, test_loss: 0.7610, test_f1: 0.6918
 epoch: 38, train_loss: 0.5955, test_loss: 0.8395, test_f1: 0.6570
 epoch: 39, train_loss: 0.5846, test_loss: 0.8034, test_f1: 0.6344
 epoch: 40, train_loss: 0.5831, test_loss: 0.7914, test_f1: 0.6557
 epoch: 41, train_loss: 0.5829, test_loss: 0.8192, test_f1: 0.6098
 epoch: 42, train_loss: 0.5868, test_loss: 0.8363, test_f1: 0.6392
 epoch: 43, train_loss: 0.5547, test_loss: 0.8570, test_f1: 0.6488
 epoch: 44, train_loss: 0.5614, test_loss: 1.0334, test_f1: 0.6311
 epoch: 45, train_loss: 0.5716, test_loss: 0.8092, test_f1: 0.6644
 epoch: 46, train_loss: 0.5483, test_loss: 0.7659, test_f1: 0.6790
 epoch: 47, train_loss: 0.5483, test_loss: 0.8067, test_f1: 0.6461
 epoch: 48, train_loss: 0.5394, test_loss: 0.8484, test_f1: 0.6551
 epoch: 49, train_loss: 0.5500, test_loss: 0.8315, test_f1: 0.6640
 epoch: 50, train_loss: 0.5357, test_loss: 0.8868, test_f1: 0.6496
 epoch: 51, train_loss: 0.4914, test_loss: 0.7928, test_f1: 0.6834
 epoch: 52, train_loss: 0.5057, test_loss: 0.7844, test_f1: 0.6887
 epoch: 53, train_loss: 0.4831, test_loss: 0.8297, test_f1: 0.6739
 epoch: 54, train_loss: 0.4740, test_loss: 0.8791, test_f1: 0.6589
 epoch: 55, train_loss: 0.4524, test_loss: 0.8999, test_f1: 0.6586
 epoch: 56, train_loss: 0.4627, test_loss: 0.9096, test_f1: 0.6514
 epoch: 57, train_loss: 0.4527, test_loss: 0.8810, test_f1: 0.6477
 epoch: 58, train_loss: 0.4520, test_loss: 0.8994, test_f1: 0.6405
 epoch: 59, train_loss: 0.4329, test_loss: 0.8849, test_f1: 0.6590
 epoch: 60, train_loss: 0.4454, test_loss: 0.8709, test_f1: 0.6621
 epoch: 61, train_loss: 0.4488, test_loss: 0.8669, test_f1: 0.6618
 epoch: 62, train_loss: 0.4326, test_loss: 0.9083, test_f1: 0.6544
 epoch: 63, train_loss: 0.4205, test_loss: 0.9559, test_f1: 0.6544
 epoch: 64, train_loss: 0.4219, test_loss: 0.9030, test_f1: 0.6613
 epoch: 65, train_loss: 0.4236, test_loss: 1.0335, test_f1: 0.6455
 epoch: 66, train_loss: 0.4240, test_loss: 0.9102, test_f1: 0.6561
 epoch: 67, train_loss: 0.4174, test_loss: 0.9199, test_f1: 0.6727
 epoch: 68, train_loss: 0.4169, test_loss: 0.9458, test_f1: 0.6371
 epoch: 69, train_loss: 0.3978, test_loss: 1.0008, test_f1: 0.6492
 epoch: 70, train_loss: 0.4171, test_loss: 0.9408, test_f1: 0.6525
 epoch: 71, train_loss: 0.3852, test_loss: 0.9314, test_f1: 0.6828
 epoch: 72, train_loss: 0.3994, test_loss: 1.0089, test_f1: 0.6807
 epoch: 73, train_loss: 0.4005, test_loss: 1.0047, test_f1: 0.6678
 epoch: 74, train_loss: 0.4027, test_loss: 0.9374, test_f1: 0.6739
 epoch: 75, train_loss: 0.3859, test_loss: 0.9585, test_f1: 0.6826
 epoch: 76, train_loss: 0.3843, test_loss: 1.0327, test_f1: 0.6592
 epoch: 77, train_loss: 0.3775, test_loss: 0.9881, test_f1: 0.6613
 epoch: 78, train_loss: 0.3963, test_loss: 0.9441, test_f1: 0.6789
 epoch: 79, train_loss: 0.3809, test_loss: 0.9385, test_f1: 0.6584
 epoch: 80, train_loss: 0.3920, test_loss: 1.0278, test_f1: 0.6504
 epoch: 81, train_loss: 0.3873, test_loss: 0.9385, test_f1: 0.6832
 epoch: 82, train_loss: 0.3827, test_loss: 1.0434, test_f1: 0.6670
 epoch: 83, train_loss: 0.3808, test_loss: 0.9761, test_f1: 0.6700
 epoch: 84, train_loss: 0.3615, test_loss: 1.0253, test_f1: 0.6637
 epoch: 85, train_loss: 0.3629, test_loss: 1.0156, test_f1: 0.6747
 epoch: 86, train_loss: 0.3585, test_loss: 0.9471, test_f1: 0.6715
 epoch: 87, train_loss: 0.3560, test_loss: 0.9297, test_f1: 0.6771
 epoch: 88, train_loss: 0.3662, test_loss: 0.9831, test_f1: 0.6827
 epoch: 89, train_loss: 0.3555, test_loss: 1.0955, test_f1: 0.6544
 epoch: 90, train_loss: 0.3603, test_loss: 1.1409, test_f1: 0.6540
 epoch: 91, train_loss: 0.3601, test_loss: 1.0320, test_f1: 0.6653
 epoch: 92, train_loss: 0.3647, test_loss: 1.0520, test_f1: 0.6580
 epoch: 93, train_loss: 0.3460, test_loss: 1.0591, test_f1: 0.6756
 epoch: 94, train_loss: 0.3507, test_loss: 1.0455, test_f1: 0.6492
 epoch: 95, train_loss: 0.3382, test_loss: 1.1267, test_f1: 0.6563
 epoch: 96, train_loss: 0.3367, test_loss: 1.1292, test_f1: 0.6717
 epoch: 97, train_loss: 0.3383, test_loss: 1.0688, test_f1: 0.6903
 epoch: 98, train_loss: 0.3394, test_loss: 1.1072, test_f1: 0.6468
 epoch: 99, train_loss: 0.3337, test_loss: 1.1021, test_f1: 0.6763
##################ITERATION #5 ****************************************
 epoch: 0, train_loss: 1.2601, test_loss: 1.0891, test_f1: 0.3932
 epoch: 1, train_loss: 1.0299, test_loss: 1.0420, test_f1: 0.4907
 epoch: 2, train_loss: 0.9655, test_loss: 0.9912, test_f1: 0.5456
 epoch: 3, train_loss: 0.9231, test_loss: 0.9139, test_f1: 0.5607
 epoch: 4, train_loss: 0.9019, test_loss: 0.9209, test_f1: 0.5564
 epoch: 5, train_loss: 0.8805, test_loss: 0.9125, test_f1: 0.5764
 epoch: 6, train_loss: 0.8561, test_loss: 0.9765, test_f1: 0.5603
 epoch: 7, train_loss: 0.8442, test_loss: 0.8892, test_f1: 0.5629
 epoch: 8, train_loss: 0.8284, test_loss: 1.0229, test_f1: 0.5453
 epoch: 9, train_loss: 0.8184, test_loss: 0.8907, test_f1: 0.5570
 epoch: 10, train_loss: 0.8112, test_loss: 0.8807, test_f1: 0.5668
 epoch: 11, train_loss: 0.7924, test_loss: 0.9183, test_f1: 0.5364
 epoch: 12, train_loss: 0.7655, test_loss: 0.8906, test_f1: 0.5794
 epoch: 13, train_loss: 0.7563, test_loss: 0.8543, test_f1: 0.5918
 epoch: 14, train_loss: 0.7408, test_loss: 0.8532, test_f1: 0.6024
 epoch: 15, train_loss: 0.7517, test_loss: 0.9015, test_f1: 0.5588
 epoch: 16, train_loss: 0.7601, test_loss: 0.8243, test_f1: 0.6072
 epoch: 17, train_loss: 0.7218, test_loss: 0.8600, test_f1: 0.5814
 epoch: 18, train_loss: 0.7219, test_loss: 0.9031, test_f1: 0.5902
 epoch: 19, train_loss: 0.6981, test_loss: 0.8003, test_f1: 0.6121
 epoch: 20, train_loss: 0.7180, test_loss: 0.8724, test_f1: 0.5920
 epoch: 21, train_loss: 0.6887, test_loss: 0.8490, test_f1: 0.6067
 epoch: 22, train_loss: 0.6805, test_loss: 0.8353, test_f1: 0.6200
 epoch: 23, train_loss: 0.6707, test_loss: 0.8091, test_f1: 0.6174
 epoch: 24, train_loss: 0.6710, test_loss: 0.8762, test_f1: 0.5619
 epoch: 25, train_loss: 0.6638, test_loss: 0.8406, test_f1: 0.6163
 epoch: 26, train_loss: 0.6572, test_loss: 0.8269, test_f1: 0.6168
 epoch: 27, train_loss: 0.6372, test_loss: 0.7857, test_f1: 0.6376
 epoch: 28, train_loss: 0.6409, test_loss: 0.7993, test_f1: 0.6271
 epoch: 29, train_loss: 0.6388, test_loss: 0.7726, test_f1: 0.6318
 epoch: 30, train_loss: 0.6357, test_loss: 0.9278, test_f1: 0.5993
 epoch: 31, train_loss: 0.6242, test_loss: 0.8858, test_f1: 0.6070
 epoch: 32, train_loss: 0.6039, test_loss: 0.8566, test_f1: 0.6278
 epoch: 33, train_loss: 0.5950, test_loss: 0.8113, test_f1: 0.6187
 epoch: 34, train_loss: 0.5967, test_loss: 0.8885, test_f1: 0.5967
 epoch: 35, train_loss: 0.5893, test_loss: 0.7977, test_f1: 0.6428
 epoch: 36, train_loss: 0.5756, test_loss: 0.7677, test_f1: 0.6535
 epoch: 37, train_loss: 0.5717, test_loss: 0.8836, test_f1: 0.5945
 epoch: 38, train_loss: 0.5615, test_loss: 0.7846, test_f1: 0.6437
 epoch: 39, train_loss: 0.5703, test_loss: 0.8509, test_f1: 0.6165
 epoch: 40, train_loss: 0.5548, test_loss: 0.9357, test_f1: 0.5975
 epoch: 41, train_loss: 0.5575, test_loss: 0.8663, test_f1: 0.6531
 epoch: 42, train_loss: 0.5502, test_loss: 0.7798, test_f1: 0.6717
 epoch: 43, train_loss: 0.5599, test_loss: 0.8010, test_f1: 0.6323
 epoch: 44, train_loss: 0.5534, test_loss: 0.9533, test_f1: 0.6195
 epoch: 45, train_loss: 0.5324, test_loss: 0.8630, test_f1: 0.6263
 epoch: 46, train_loss: 0.5281, test_loss: 0.8794, test_f1: 0.6292
 epoch: 47, train_loss: 0.5272, test_loss: 1.0476, test_f1: 0.5916
 epoch: 48, train_loss: 0.5282, test_loss: 0.9044, test_f1: 0.6312
 epoch: 49, train_loss: 0.5156, test_loss: 0.9759, test_f1: 0.6281
 epoch: 50, train_loss: 0.5026, test_loss: 0.8645, test_f1: 0.6553
 epoch: 51, train_loss: 0.4841, test_loss: 0.8387, test_f1: 0.6578
 epoch: 52, train_loss: 0.4626, test_loss: 0.8877, test_f1: 0.6638
 epoch: 53, train_loss: 0.4509, test_loss: 0.9291, test_f1: 0.6567
 epoch: 54, train_loss: 0.4327, test_loss: 0.8693, test_f1: 0.6741
 epoch: 55, train_loss: 0.4409, test_loss: 0.9855, test_f1: 0.6324
 epoch: 56, train_loss: 0.4330, test_loss: 1.0330, test_f1: 0.6275
 epoch: 57, train_loss: 0.4293, test_loss: 0.9235, test_f1: 0.6591
 epoch: 58, train_loss: 0.4346, test_loss: 0.9124, test_f1: 0.6354
 epoch: 59, train_loss: 0.4324, test_loss: 0.9740, test_f1: 0.6406
 epoch: 60, train_loss: 0.4145, test_loss: 0.9428, test_f1: 0.6507
 epoch: 61, train_loss: 0.4030, test_loss: 0.9891, test_f1: 0.6543
 epoch: 62, train_loss: 0.4053, test_loss: 1.0476, test_f1: 0.6338
 epoch: 63, train_loss: 0.4185, test_loss: 1.0181, test_f1: 0.6467
 epoch: 64, train_loss: 0.4073, test_loss: 1.0437, test_f1: 0.6304
 epoch: 65, train_loss: 0.3964, test_loss: 0.9629, test_f1: 0.6429
 epoch: 66, train_loss: 0.3792, test_loss: 0.9513, test_f1: 0.6549
 epoch: 67, train_loss: 0.3889, test_loss: 1.0253, test_f1: 0.6482
 epoch: 68, train_loss: 0.3974, test_loss: 0.9705, test_f1: 0.6567
 epoch: 69, train_loss: 0.3924, test_loss: 0.9946, test_f1: 0.6510
 epoch: 70, train_loss: 0.3858, test_loss: 0.9282, test_f1: 0.6745
 epoch: 71, train_loss: 0.3788, test_loss: 1.1077, test_f1: 0.6267
 epoch: 72, train_loss: 0.3673, test_loss: 1.1428, test_f1: 0.6380
 epoch: 73, train_loss: 0.3857, test_loss: 1.0437, test_f1: 0.6618
 epoch: 74, train_loss: 0.3762, test_loss: 1.0474, test_f1: 0.6432
 epoch: 75, train_loss: 0.3733, test_loss: 0.9185, test_f1: 0.6829
 epoch: 76, train_loss: 0.3443, test_loss: 1.0049, test_f1: 0.6728
 epoch: 77, train_loss: 0.3509, test_loss: 1.0147, test_f1: 0.6649
 epoch: 78, train_loss: 0.3558, test_loss: 1.0383, test_f1: 0.6744
 epoch: 79, train_loss: 0.3543, test_loss: 1.0638, test_f1: 0.6664
 epoch: 80, train_loss: 0.3420, test_loss: 1.2054, test_f1: 0.6451
 epoch: 81, train_loss: 0.3541, test_loss: 1.0705, test_f1: 0.6568
 epoch: 82, train_loss: 0.3369, test_loss: 0.9879, test_f1: 0.6696
 epoch: 83, train_loss: 0.3421, test_loss: 1.1434, test_f1: 0.6555
 epoch: 84, train_loss: 0.3215, test_loss: 0.9654, test_f1: 0.6622
 epoch: 85, train_loss: 0.3334, test_loss: 1.0561, test_f1: 0.6875
 epoch: 86, train_loss: 0.3605, test_loss: 1.0717, test_f1: 0.6672
 epoch: 87, train_loss: 0.3329, test_loss: 1.1142, test_f1: 0.6486
 epoch: 88, train_loss: 0.3195, test_loss: 1.1332, test_f1: 0.6606
 epoch: 89, train_loss: 0.3159, test_loss: 1.0644, test_f1: 0.6758
 epoch: 90, train_loss: 0.3358, test_loss: 1.1665, test_f1: 0.6596
 epoch: 91, train_loss: 0.3373, test_loss: 1.1074, test_f1: 0.6602
 epoch: 92, train_loss: 0.3092, test_loss: 1.0536, test_f1: 0.6580
 epoch: 93, train_loss: 0.3187, test_loss: 1.1447, test_f1: 0.6683
 epoch: 94, train_loss: 0.3099, test_loss: 1.0428, test_f1: 0.6574
 epoch: 95, train_loss: 0.3080, test_loss: 1.0735, test_f1: 0.6794
 epoch: 96, train_loss: 0.2920, test_loss: 1.1188, test_f1: 0.6731
 epoch: 97, train_loss: 0.2963, test_loss: 1.2871, test_f1: 0.6526
 epoch: 98, train_loss: 0.3205, test_loss: 1.1887, test_f1: 0.6593
 epoch: 99, train_loss: 0.2892, test_loss: 1.1997, test_f1: 0.6709
##################ITERATION #6 ****************************************
 epoch: 0, train_loss: 1.2475, test_loss: 1.0657, test_f1: 0.4811
 epoch: 1, train_loss: 1.0025, test_loss: 0.9744, test_f1: 0.5202
 epoch: 2, train_loss: 0.9305, test_loss: 0.9316, test_f1: 0.5414
 epoch: 3, train_loss: 0.9132, test_loss: 1.0581, test_f1: 0.5082
 epoch: 4, train_loss: 0.8779, test_loss: 0.8932, test_f1: 0.5882
 epoch: 5, train_loss: 0.8518, test_loss: 0.9213, test_f1: 0.5535
 epoch: 6, train_loss: 0.8388, test_loss: 0.8869, test_f1: 0.5784
 epoch: 7, train_loss: 0.8293, test_loss: 0.8898, test_f1: 0.5422
 epoch: 8, train_loss: 0.8067, test_loss: 0.8344, test_f1: 0.5698
 epoch: 9, train_loss: 0.7831, test_loss: 0.8864, test_f1: 0.5767
 epoch: 10, train_loss: 0.7743, test_loss: 0.8813, test_f1: 0.5483
 epoch: 11, train_loss: 0.7558, test_loss: 0.9211, test_f1: 0.5785
 epoch: 12, train_loss: 0.7502, test_loss: 0.8662, test_f1: 0.5671
 epoch: 13, train_loss: 0.7540, test_loss: 0.8668, test_f1: 0.5745
 epoch: 14, train_loss: 0.7347, test_loss: 0.9088, test_f1: 0.5642
 epoch: 15, train_loss: 0.7307, test_loss: 0.8525, test_f1: 0.6016
 epoch: 16, train_loss: 0.7052, test_loss: 0.8411, test_f1: 0.6221
 epoch: 17, train_loss: 0.7138, test_loss: 0.8345, test_f1: 0.6056
 epoch: 18, train_loss: 0.6788, test_loss: 0.7963, test_f1: 0.6050
 epoch: 19, train_loss: 0.6922, test_loss: 0.8032, test_f1: 0.6267
 epoch: 20, train_loss: 0.6862, test_loss: 0.8018, test_f1: 0.6211
 epoch: 21, train_loss: 0.6642, test_loss: 0.7531, test_f1: 0.6558
 epoch: 22, train_loss: 0.6707, test_loss: 0.8153, test_f1: 0.6187
 epoch: 23, train_loss: 0.6510, test_loss: 0.9080, test_f1: 0.6062
 epoch: 24, train_loss: 0.6477, test_loss: 0.8277, test_f1: 0.6309
 epoch: 25, train_loss: 0.6463, test_loss: 0.8015, test_f1: 0.6337
 epoch: 26, train_loss: 0.6318, test_loss: 0.7954, test_f1: 0.6236
 epoch: 27, train_loss: 0.6143, test_loss: 0.8077, test_f1: 0.6309
 epoch: 28, train_loss: 0.6380, test_loss: 0.8280, test_f1: 0.6345
 epoch: 29, train_loss: 0.6057, test_loss: 0.8106, test_f1: 0.6242
 epoch: 30, train_loss: 0.6100, test_loss: 0.9057, test_f1: 0.6004
 epoch: 31, train_loss: 0.5922, test_loss: 0.7984, test_f1: 0.6635
 epoch: 32, train_loss: 0.6009, test_loss: 0.8335, test_f1: 0.6059
 epoch: 33, train_loss: 0.5715, test_loss: 0.8886, test_f1: 0.6314
 epoch: 34, train_loss: 0.5842, test_loss: 0.8020, test_f1: 0.6270
 epoch: 35, train_loss: 0.5623, test_loss: 0.8922, test_f1: 0.6563
 epoch: 36, train_loss: 0.5596, test_loss: 0.8089, test_f1: 0.6453
 epoch: 37, train_loss: 0.5620, test_loss: 0.8055, test_f1: 0.6466
 epoch: 38, train_loss: 0.5605, test_loss: 0.9469, test_f1: 0.6473
 epoch: 39, train_loss: 0.5552, test_loss: 0.8312, test_f1: 0.6549
 epoch: 40, train_loss: 0.5420, test_loss: 0.8667, test_f1: 0.6410
 epoch: 41, train_loss: 0.5333, test_loss: 0.8810, test_f1: 0.6332
 epoch: 42, train_loss: 0.5226, test_loss: 0.8526, test_f1: 0.6490
 epoch: 43, train_loss: 0.5129, test_loss: 0.9622, test_f1: 0.6026
 epoch: 44, train_loss: 0.5259, test_loss: 0.8506, test_f1: 0.6348
 epoch: 45, train_loss: 0.5096, test_loss: 0.8480, test_f1: 0.6588
 epoch: 46, train_loss: 0.5143, test_loss: 0.9889, test_f1: 0.6128
 epoch: 47, train_loss: 0.4975, test_loss: 0.8282, test_f1: 0.6567
 epoch: 48, train_loss: 0.4908, test_loss: 0.8867, test_f1: 0.6654
 epoch: 49, train_loss: 0.4870, test_loss: 0.9035, test_f1: 0.6573
 epoch: 50, train_loss: 0.4727, test_loss: 0.8475, test_f1: 0.6512
 epoch: 51, train_loss: 0.4679, test_loss: 0.9332, test_f1: 0.6559
 epoch: 52, train_loss: 0.4170, test_loss: 1.0070, test_f1: 0.6368
 epoch: 53, train_loss: 0.4209, test_loss: 0.9417, test_f1: 0.6482
 epoch: 54, train_loss: 0.4105, test_loss: 0.9720, test_f1: 0.6552
 epoch: 55, train_loss: 0.4157, test_loss: 1.0040, test_f1: 0.6544
 epoch: 56, train_loss: 0.4164, test_loss: 1.1302, test_f1: 0.6395
 epoch: 57, train_loss: 0.4084, test_loss: 1.0160, test_f1: 0.6541
 epoch: 58, train_loss: 0.4039, test_loss: 0.9313, test_f1: 0.6814
 epoch: 59, train_loss: 0.4090, test_loss: 1.0185, test_f1: 0.6469
 epoch: 60, train_loss: 0.4111, test_loss: 1.0386, test_f1: 0.6305
 epoch: 61, train_loss: 0.3903, test_loss: 0.9988, test_f1: 0.6563
 epoch: 62, train_loss: 0.3967, test_loss: 1.0916, test_f1: 0.6358
 epoch: 63, train_loss: 0.4021, test_loss: 1.0721, test_f1: 0.6442
 epoch: 64, train_loss: 0.3939, test_loss: 1.0984, test_f1: 0.6495
 epoch: 65, train_loss: 0.3754, test_loss: 1.1780, test_f1: 0.6243
 epoch: 66, train_loss: 0.3854, test_loss: 1.2162, test_f1: 0.6216
 epoch: 67, train_loss: 0.3764, test_loss: 1.0236, test_f1: 0.6518
 epoch: 68, train_loss: 0.3703, test_loss: 1.0518, test_f1: 0.6610
 epoch: 69, train_loss: 0.3723, test_loss: 1.0708, test_f1: 0.6558
 epoch: 70, train_loss: 0.3743, test_loss: 1.0019, test_f1: 0.6552
 epoch: 71, train_loss: 0.3646, test_loss: 1.0679, test_f1: 0.6570
 epoch: 72, train_loss: 0.3648, test_loss: 1.1086, test_f1: 0.6313
 epoch: 73, train_loss: 0.3611, test_loss: 1.1722, test_f1: 0.6642
 epoch: 74, train_loss: 0.3478, test_loss: 1.1404, test_f1: 0.6629
 epoch: 75, train_loss: 0.3428, test_loss: 1.2926, test_f1: 0.6419
 epoch: 76, train_loss: 0.3466, test_loss: 1.3221, test_f1: 0.6363
 epoch: 77, train_loss: 0.3301, test_loss: 1.2420, test_f1: 0.6304
 epoch: 78, train_loss: 0.3598, test_loss: 1.1562, test_f1: 0.6401
 epoch: 79, train_loss: 0.3392, test_loss: 1.2866, test_f1: 0.6681
 epoch: 80, train_loss: 0.3248, test_loss: 1.2497, test_f1: 0.6397
 epoch: 81, train_loss: 0.3249, test_loss: 1.3784, test_f1: 0.6359
 epoch: 82, train_loss: 0.3340, test_loss: 1.2557, test_f1: 0.6444
 epoch: 83, train_loss: 0.3179, test_loss: 1.2354, test_f1: 0.6532
 epoch: 84, train_loss: 0.3175, test_loss: 1.3448, test_f1: 0.6416
 epoch: 85, train_loss: 0.3090, test_loss: 1.2338, test_f1: 0.6714
 epoch: 86, train_loss: 0.3208, test_loss: 1.1800, test_f1: 0.6544
 epoch: 87, train_loss: 0.3322, test_loss: 1.2251, test_f1: 0.6295
 epoch: 88, train_loss: 0.3231, test_loss: 1.3087, test_f1: 0.6463
 epoch: 89, train_loss: 0.3250, test_loss: 1.3165, test_f1: 0.6511
 epoch: 90, train_loss: 0.3157, test_loss: 1.3271, test_f1: 0.6688
 epoch: 91, train_loss: 0.3170, test_loss: 1.3853, test_f1: 0.6605
 epoch: 92, train_loss: 0.2946, test_loss: 1.5051, test_f1: 0.6138
 epoch: 93, train_loss: 0.2950, test_loss: 1.3969, test_f1: 0.6318
 epoch: 94, train_loss: 0.2851, test_loss: 1.3227, test_f1: 0.6609
 epoch: 95, train_loss: 0.3070, test_loss: 1.2514, test_f1: 0.6839
 epoch: 96, train_loss: 0.2882, test_loss: 1.4728, test_f1: 0.6428
 epoch: 97, train_loss: 0.3181, test_loss: 1.3296, test_f1: 0.6456
 epoch: 98, train_loss: 0.2947, test_loss: 1.2885, test_f1: 0.6790
 epoch: 99, train_loss: 0.2795, test_loss: 1.5026, test_f1: 0.6207
##################ITERATION #7 ****************************************
 epoch: 0, train_loss: 1.3067, test_loss: 1.1954, test_f1: 0.3643
 epoch: 1, train_loss: 1.0086, test_loss: 0.9930, test_f1: 0.4678
 epoch: 2, train_loss: 0.9521, test_loss: 0.9674, test_f1: 0.5039
 epoch: 3, train_loss: 0.9170, test_loss: 0.9444, test_f1: 0.5248
 epoch: 4, train_loss: 0.8886, test_loss: 0.9235, test_f1: 0.5477
 epoch: 5, train_loss: 0.8683, test_loss: 0.9023, test_f1: 0.5763
 epoch: 6, train_loss: 0.8509, test_loss: 0.9276, test_f1: 0.5737
 epoch: 7, train_loss: 0.8311, test_loss: 0.8467, test_f1: 0.5749
 epoch: 8, train_loss: 0.8152, test_loss: 0.8890, test_f1: 0.5530
 epoch: 9, train_loss: 0.8081, test_loss: 0.8334, test_f1: 0.5932
 epoch: 10, train_loss: 0.7837, test_loss: 0.9115, test_f1: 0.5556
 epoch: 11, train_loss: 0.7849, test_loss: 0.8564, test_f1: 0.5434
 epoch: 12, train_loss: 0.7621, test_loss: 0.8314, test_f1: 0.6132
 epoch: 13, train_loss: 0.7592, test_loss: 0.8694, test_f1: 0.5604
 epoch: 14, train_loss: 0.7399, test_loss: 0.9204, test_f1: 0.5915
 epoch: 15, train_loss: 0.7392, test_loss: 0.7966, test_f1: 0.6358
 epoch: 16, train_loss: 0.7393, test_loss: 0.8552, test_f1: 0.6290
 epoch: 17, train_loss: 0.6916, test_loss: 0.9935, test_f1: 0.5898
 epoch: 18, train_loss: 0.7102, test_loss: 0.8477, test_f1: 0.6385
 epoch: 19, train_loss: 0.6971, test_loss: 0.9068, test_f1: 0.5791
 epoch: 20, train_loss: 0.6798, test_loss: 0.8080, test_f1: 0.6386
 epoch: 21, train_loss: 0.6480, test_loss: 0.8057, test_f1: 0.6164
 epoch: 22, train_loss: 0.6502, test_loss: 0.8109, test_f1: 0.6023
 epoch: 23, train_loss: 0.6415, test_loss: 0.8100, test_f1: 0.6119
 epoch: 24, train_loss: 0.6476, test_loss: 0.7822, test_f1: 0.6404
 epoch: 25, train_loss: 0.6405, test_loss: 0.8260, test_f1: 0.6509
 epoch: 26, train_loss: 0.6241, test_loss: 0.8516, test_f1: 0.6391
 epoch: 27, train_loss: 0.5917, test_loss: 0.8564, test_f1: 0.6380
 epoch: 28, train_loss: 0.6229, test_loss: 0.8429, test_f1: 0.6358
 epoch: 29, train_loss: 0.6114, test_loss: 0.8628, test_f1: 0.5941
 epoch: 30, train_loss: 0.6089, test_loss: 0.8576, test_f1: 0.6064
 epoch: 31, train_loss: 0.5967, test_loss: 0.8271, test_f1: 0.6498
 epoch: 32, train_loss: 0.6006, test_loss: 0.8666, test_f1: 0.6425
 epoch: 33, train_loss: 0.5758, test_loss: 0.8030, test_f1: 0.6665
 epoch: 34, train_loss: 0.5485, test_loss: 0.8211, test_f1: 0.6687
 epoch: 35, train_loss: 0.5677, test_loss: 0.8164, test_f1: 0.6441
 epoch: 36, train_loss: 0.5289, test_loss: 0.8714, test_f1: 0.6496
 epoch: 37, train_loss: 0.5369, test_loss: 0.8000, test_f1: 0.6219
 epoch: 38, train_loss: 0.5610, test_loss: 0.8762, test_f1: 0.6425
 epoch: 39, train_loss: 0.5417, test_loss: 0.9213, test_f1: 0.6301
 epoch: 40, train_loss: 0.5421, test_loss: 0.9051, test_f1: 0.6402
 epoch: 41, train_loss: 0.5215, test_loss: 0.8141, test_f1: 0.6728
 epoch: 42, train_loss: 0.5023, test_loss: 0.8205, test_f1: 0.6790
 epoch: 43, train_loss: 0.5034, test_loss: 0.9045, test_f1: 0.6212
 epoch: 44, train_loss: 0.5181, test_loss: 0.8558, test_f1: 0.6500
 epoch: 45, train_loss: 0.4869, test_loss: 0.8315, test_f1: 0.6485
 epoch: 46, train_loss: 0.4816, test_loss: 0.8477, test_f1: 0.6309
 epoch: 47, train_loss: 0.4815, test_loss: 0.9247, test_f1: 0.6428
 epoch: 48, train_loss: 0.4878, test_loss: 0.9018, test_f1: 0.6222
 epoch: 49, train_loss: 0.4806, test_loss: 0.7607, test_f1: 0.6760
 epoch: 50, train_loss: 0.4624, test_loss: 0.8961, test_f1: 0.6495
 epoch: 51, train_loss: 0.4181, test_loss: 0.8239, test_f1: 0.6576
 epoch: 52, train_loss: 0.4016, test_loss: 0.8637, test_f1: 0.6693
 epoch: 53, train_loss: 0.4005, test_loss: 0.8670, test_f1: 0.6738
 epoch: 54, train_loss: 0.3760, test_loss: 0.8601, test_f1: 0.6703
 epoch: 55, train_loss: 0.3844, test_loss: 0.9128, test_f1: 0.6369
 epoch: 56, train_loss: 0.3794, test_loss: 0.8690, test_f1: 0.6895
 epoch: 57, train_loss: 0.3980, test_loss: 0.8476, test_f1: 0.6732
 epoch: 58, train_loss: 0.3819, test_loss: 0.9893, test_f1: 0.6419
 epoch: 59, train_loss: 0.3642, test_loss: 0.8723, test_f1: 0.6615
 epoch: 60, train_loss: 0.3703, test_loss: 0.9598, test_f1: 0.6936
 epoch: 61, train_loss: 0.3731, test_loss: 0.9740, test_f1: 0.6551
 epoch: 62, train_loss: 0.3548, test_loss: 1.0113, test_f1: 0.6469
 epoch: 63, train_loss: 0.3529, test_loss: 0.9554, test_f1: 0.6614
 epoch: 64, train_loss: 0.3397, test_loss: 0.9199, test_f1: 0.6726
 epoch: 65, train_loss: 0.3641, test_loss: 1.0463, test_f1: 0.6624
 epoch: 66, train_loss: 0.3453, test_loss: 0.9580, test_f1: 0.6571
 epoch: 67, train_loss: 0.3478, test_loss: 1.0033, test_f1: 0.6691
 epoch: 68, train_loss: 0.3459, test_loss: 1.0621, test_f1: 0.6350
 epoch: 69, train_loss: 0.3310, test_loss: 1.0055, test_f1: 0.6756
 epoch: 70, train_loss: 0.3395, test_loss: 1.0225, test_f1: 0.6603
 epoch: 71, train_loss: 0.3301, test_loss: 1.0329, test_f1: 0.6540
 epoch: 72, train_loss: 0.3081, test_loss: 1.0674, test_f1: 0.6516
 epoch: 73, train_loss: 0.3235, test_loss: 1.0452, test_f1: 0.6447
 epoch: 74, train_loss: 0.3367, test_loss: 1.0209, test_f1: 0.6450
 epoch: 75, train_loss: 0.2934, test_loss: 1.0208, test_f1: 0.6804
 epoch: 76, train_loss: 0.3346, test_loss: 0.9856, test_f1: 0.6470
 epoch: 77, train_loss: 0.3219, test_loss: 1.0654, test_f1: 0.6500
 epoch: 78, train_loss: 0.3117, test_loss: 1.0593, test_f1: 0.6720
 epoch: 79, train_loss: 0.2808, test_loss: 1.0492, test_f1: 0.6626
 epoch: 80, train_loss: 0.2885, test_loss: 1.0899, test_f1: 0.6394
 epoch: 81, train_loss: 0.2839, test_loss: 1.1317, test_f1: 0.6507
 epoch: 82, train_loss: 0.2869, test_loss: 1.1528, test_f1: 0.6375
 epoch: 83, train_loss: 0.3010, test_loss: 1.2205, test_f1: 0.6398
 epoch: 84, train_loss: 0.2810, test_loss: 1.1046, test_f1: 0.6445
 epoch: 85, train_loss: 0.3093, test_loss: 1.1434, test_f1: 0.6291
 epoch: 86, train_loss: 0.3065, test_loss: 1.0890, test_f1: 0.6335
 epoch: 87, train_loss: 0.2942, test_loss: 1.2001, test_f1: 0.6416
 epoch: 88, train_loss: 0.3011, test_loss: 1.0562, test_f1: 0.6816
 epoch: 89, train_loss: 0.2752, test_loss: 1.1824, test_f1: 0.6409
 epoch: 90, train_loss: 0.2830, test_loss: 1.2112, test_f1: 0.6654
 epoch: 91, train_loss: 0.2770, test_loss: 1.0809, test_f1: 0.6717
 epoch: 92, train_loss: 0.2894, test_loss: 1.1267, test_f1: 0.6562
 epoch: 93, train_loss: 0.2890, test_loss: 1.2852, test_f1: 0.6535
 epoch: 94, train_loss: 0.2638, test_loss: 1.1913, test_f1: 0.6430
 epoch: 95, train_loss: 0.2668, test_loss: 1.2499, test_f1: 0.6335
 epoch: 96, train_loss: 0.2488, test_loss: 1.1687, test_f1: 0.6622
 epoch: 97, train_loss: 0.2751, test_loss: 1.2213, test_f1: 0.6417
 epoch: 98, train_loss: 0.2595, test_loss: 1.4806, test_f1: 0.6422
 epoch: 99, train_loss: 0.2422, test_loss: 1.3556, test_f1: 0.6419
##################ITERATION #8 ****************************************
 epoch: 0, train_loss: 1.3357, test_loss: 1.0362, test_f1: 0.4896
 epoch: 1, train_loss: 1.0173, test_loss: 0.9686, test_f1: 0.5510
 epoch: 2, train_loss: 0.9521, test_loss: 1.0027, test_f1: 0.5128
 epoch: 3, train_loss: 0.9172, test_loss: 0.9540, test_f1: 0.5415
 epoch: 4, train_loss: 0.8859, test_loss: 0.9569, test_f1: 0.5481
 epoch: 5, train_loss: 0.8635, test_loss: 0.9478, test_f1: 0.5143
 epoch: 6, train_loss: 0.8511, test_loss: 0.9390, test_f1: 0.5801
 epoch: 7, train_loss: 0.8412, test_loss: 0.9596, test_f1: 0.5512
 epoch: 8, train_loss: 0.8176, test_loss: 0.9644, test_f1: 0.5105
 epoch: 9, train_loss: 0.8143, test_loss: 0.9442, test_f1: 0.5224
 epoch: 10, train_loss: 0.8053, test_loss: 0.8937, test_f1: 0.5446
 epoch: 11, train_loss: 0.7943, test_loss: 0.8408, test_f1: 0.5611
 epoch: 12, train_loss: 0.7588, test_loss: 0.8848, test_f1: 0.5469
 epoch: 13, train_loss: 0.7544, test_loss: 0.9053, test_f1: 0.5939
 epoch: 14, train_loss: 0.7228, test_loss: 0.8822, test_f1: 0.5619
 epoch: 15, train_loss: 0.7126, test_loss: 0.9464, test_f1: 0.5500
 epoch: 16, train_loss: 0.7089, test_loss: 0.9207, test_f1: 0.5716
 epoch: 17, train_loss: 0.6926, test_loss: 0.8460, test_f1: 0.5863
 epoch: 18, train_loss: 0.7050, test_loss: 0.8569, test_f1: 0.6038
 epoch: 19, train_loss: 0.6900, test_loss: 0.8677, test_f1: 0.5987
 epoch: 20, train_loss: 0.6720, test_loss: 0.8883, test_f1: 0.5965
 epoch: 21, train_loss: 0.6982, test_loss: 0.9506, test_f1: 0.5649
 epoch: 22, train_loss: 0.6874, test_loss: 0.9687, test_f1: 0.5543
 epoch: 23, train_loss: 0.6657, test_loss: 0.9619, test_f1: 0.5942
 epoch: 24, train_loss: 0.6571, test_loss: 0.8247, test_f1: 0.6030
 epoch: 25, train_loss: 0.6379, test_loss: 0.7977, test_f1: 0.6411
 epoch: 26, train_loss: 0.6167, test_loss: 0.8928, test_f1: 0.5790
 epoch: 27, train_loss: 0.6230, test_loss: 0.9481, test_f1: 0.5853
 epoch: 28, train_loss: 0.6148, test_loss: 0.8889, test_f1: 0.6100
 epoch: 29, train_loss: 0.6253, test_loss: 0.7555, test_f1: 0.6571
 epoch: 30, train_loss: 0.6006, test_loss: 0.9096, test_f1: 0.6019
 epoch: 31, train_loss: 0.6218, test_loss: 0.8983, test_f1: 0.5679
 epoch: 32, train_loss: 0.6051, test_loss: 0.8596, test_f1: 0.6143
 epoch: 33, train_loss: 0.5896, test_loss: 0.8407, test_f1: 0.5723
 epoch: 34, train_loss: 0.5787, test_loss: 0.8369, test_f1: 0.6363
 epoch: 35, train_loss: 0.5659, test_loss: 0.9169, test_f1: 0.6002
 epoch: 36, train_loss: 0.5690, test_loss: 0.9632, test_f1: 0.5911
 epoch: 37, train_loss: 0.5496, test_loss: 0.9588, test_f1: 0.6189
 epoch: 38, train_loss: 0.5702, test_loss: 0.8807, test_f1: 0.6155
 epoch: 39, train_loss: 0.5504, test_loss: 0.8786, test_f1: 0.6373
 epoch: 40, train_loss: 0.5374, test_loss: 0.9188, test_f1: 0.6169
 epoch: 41, train_loss: 0.5357, test_loss: 0.8851, test_f1: 0.6307
 epoch: 42, train_loss: 0.5479, test_loss: 0.9683, test_f1: 0.6212
 epoch: 43, train_loss: 0.5313, test_loss: 1.0203, test_f1: 0.6152
 epoch: 44, train_loss: 0.5096, test_loss: 0.8632, test_f1: 0.6425
 epoch: 45, train_loss: 0.5184, test_loss: 0.9671, test_f1: 0.6292
 epoch: 46, train_loss: 0.5047, test_loss: 0.9220, test_f1: 0.6370
 epoch: 47, train_loss: 0.4955, test_loss: 0.8903, test_f1: 0.6387
 epoch: 48, train_loss: 0.5072, test_loss: 1.0593, test_f1: 0.6193
 epoch: 49, train_loss: 0.4903, test_loss: 0.9256, test_f1: 0.6367
 epoch: 50, train_loss: 0.4762, test_loss: 0.9559, test_f1: 0.6457
 epoch: 51, train_loss: 0.4475, test_loss: 0.9364, test_f1: 0.6255
 epoch: 52, train_loss: 0.4239, test_loss: 0.9324, test_f1: 0.6555
 epoch: 53, train_loss: 0.4084, test_loss: 1.0018, test_f1: 0.6407
 epoch: 54, train_loss: 0.4105, test_loss: 1.0401, test_f1: 0.6322
 epoch: 55, train_loss: 0.3948, test_loss: 1.0531, test_f1: 0.6197
 epoch: 56, train_loss: 0.3883, test_loss: 1.1224, test_f1: 0.6163
 epoch: 57, train_loss: 0.3971, test_loss: 1.0266, test_f1: 0.6199
 epoch: 58, train_loss: 0.3913, test_loss: 1.0411, test_f1: 0.6239
 epoch: 59, train_loss: 0.3722, test_loss: 1.0855, test_f1: 0.6405
 epoch: 60, train_loss: 0.3720, test_loss: 1.0436, test_f1: 0.6501
 epoch: 61, train_loss: 0.3931, test_loss: 1.0462, test_f1: 0.6359
 epoch: 62, train_loss: 0.3870, test_loss: 1.0216, test_f1: 0.6422
 epoch: 63, train_loss: 0.3771, test_loss: 1.0163, test_f1: 0.6368
 epoch: 64, train_loss: 0.3637, test_loss: 1.0342, test_f1: 0.6464
 epoch: 65, train_loss: 0.3814, test_loss: 1.0914, test_f1: 0.6434
 epoch: 66, train_loss: 0.3697, test_loss: 1.0499, test_f1: 0.6438
 epoch: 67, train_loss: 0.3459, test_loss: 1.0167, test_f1: 0.6549
 epoch: 68, train_loss: 0.3606, test_loss: 1.0734, test_f1: 0.6336
 epoch: 69, train_loss: 0.3429, test_loss: 1.1787, test_f1: 0.6272
 epoch: 70, train_loss: 0.3428, test_loss: 1.0176, test_f1: 0.6353
 epoch: 71, train_loss: 0.3649, test_loss: 1.0287, test_f1: 0.6333
 epoch: 72, train_loss: 0.3358, test_loss: 1.1053, test_f1: 0.6139
 epoch: 73, train_loss: 0.3455, test_loss: 1.0897, test_f1: 0.6442
 epoch: 74, train_loss: 0.3168, test_loss: 1.0789, test_f1: 0.6435
 epoch: 75, train_loss: 0.3295, test_loss: 1.1370, test_f1: 0.6370
 epoch: 76, train_loss: 0.3481, test_loss: 1.2518, test_f1: 0.6279
 epoch: 77, train_loss: 0.3178, test_loss: 1.1305, test_f1: 0.6299
 epoch: 78, train_loss: 0.3232, test_loss: 1.2362, test_f1: 0.6227
 epoch: 79, train_loss: 0.3061, test_loss: 1.1559, test_f1: 0.6394
 epoch: 80, train_loss: 0.3273, test_loss: 1.1490, test_f1: 0.6370
 epoch: 81, train_loss: 0.3087, test_loss: 1.1462, test_f1: 0.6142
 epoch: 82, train_loss: 0.3034, test_loss: 1.1728, test_f1: 0.6322
 epoch: 83, train_loss: 0.3166, test_loss: 1.2084, test_f1: 0.6375
 epoch: 84, train_loss: 0.3094, test_loss: 1.1060, test_f1: 0.6433
 epoch: 85, train_loss: 0.3136, test_loss: 1.1296, test_f1: 0.6710
 epoch: 86, train_loss: 0.3115, test_loss: 1.1796, test_f1: 0.6524
 epoch: 87, train_loss: 0.3039, test_loss: 1.1651, test_f1: 0.6697
 epoch: 88, train_loss: 0.3023, test_loss: 1.1923, test_f1: 0.6474
 epoch: 89, train_loss: 0.3132, test_loss: 1.1608, test_f1: 0.6684
 epoch: 90, train_loss: 0.2968, test_loss: 1.1694, test_f1: 0.6591
 epoch: 91, train_loss: 0.2887, test_loss: 1.2673, test_f1: 0.6501
 epoch: 92, train_loss: 0.3127, test_loss: 1.2152, test_f1: 0.6483
 epoch: 93, train_loss: 0.2901, test_loss: 1.2223, test_f1: 0.6478
 epoch: 94, train_loss: 0.2941, test_loss: 1.1187, test_f1: 0.6741
 epoch: 95, train_loss: 0.2929, test_loss: 1.1798, test_f1: 0.6415
 epoch: 96, train_loss: 0.2762, test_loss: 1.2262, test_f1: 0.6383
 epoch: 97, train_loss: 0.2978, test_loss: 1.1941, test_f1: 0.6570
 epoch: 98, train_loss: 0.3001, test_loss: 1.1976, test_f1: 0.6462
 epoch: 99, train_loss: 0.2673, test_loss: 1.1391, test_f1: 0.6564
##################ITERATION #9 ****************************************
 epoch: 0, train_loss: 1.3915, test_loss: 1.0759, test_f1: 0.3550
 epoch: 1, train_loss: 1.0352, test_loss: 0.9689, test_f1: 0.4564
 epoch: 2, train_loss: 0.9812, test_loss: 0.9533, test_f1: 0.5079
 epoch: 3, train_loss: 0.9485, test_loss: 0.9748, test_f1: 0.5259
 epoch: 4, train_loss: 0.9414, test_loss: 0.8902, test_f1: 0.5136
 epoch: 5, train_loss: 0.9197, test_loss: 0.9257, test_f1: 0.4945
 epoch: 6, train_loss: 0.8915, test_loss: 0.9077, test_f1: 0.5418
 epoch: 7, train_loss: 0.8845, test_loss: 0.8862, test_f1: 0.5332
 epoch: 8, train_loss: 0.8493, test_loss: 0.8620, test_f1: 0.5707
 epoch: 9, train_loss: 0.8338, test_loss: 0.8679, test_f1: 0.5446
 epoch: 10, train_loss: 0.8176, test_loss: 0.8857, test_f1: 0.5415
 epoch: 11, train_loss: 0.7992, test_loss: 0.8872, test_f1: 0.5577
 epoch: 12, train_loss: 0.7929, test_loss: 0.8438, test_f1: 0.5808
 epoch: 13, train_loss: 0.7803, test_loss: 0.8351, test_f1: 0.6012
 epoch: 14, train_loss: 0.7567, test_loss: 0.8202, test_f1: 0.5793
 epoch: 15, train_loss: 0.7642, test_loss: 0.9276, test_f1: 0.5693
 epoch: 16, train_loss: 0.7404, test_loss: 0.8625, test_f1: 0.5692
 epoch: 17, train_loss: 0.7367, test_loss: 0.7709, test_f1: 0.6066
 epoch: 18, train_loss: 0.7204, test_loss: 0.8330, test_f1: 0.5908
 epoch: 19, train_loss: 0.7219, test_loss: 0.8798, test_f1: 0.5642
 epoch: 20, train_loss: 0.7039, test_loss: 0.8055, test_f1: 0.6104
 epoch: 21, train_loss: 0.7012, test_loss: 0.8598, test_f1: 0.5919
 epoch: 22, train_loss: 0.6986, test_loss: 0.8402, test_f1: 0.5957
 epoch: 23, train_loss: 0.6763, test_loss: 0.8231, test_f1: 0.6299
 epoch: 24, train_loss: 0.6473, test_loss: 0.8568, test_f1: 0.6214
 epoch: 25, train_loss: 0.6680, test_loss: 0.8516, test_f1: 0.6021
 epoch: 26, train_loss: 0.6501, test_loss: 0.8530, test_f1: 0.6079
 epoch: 27, train_loss: 0.6268, test_loss: 0.9065, test_f1: 0.5581
 epoch: 28, train_loss: 0.6548, test_loss: 0.8802, test_f1: 0.5933
 epoch: 29, train_loss: 0.6555, test_loss: 0.7784, test_f1: 0.6166
 epoch: 30, train_loss: 0.6212, test_loss: 0.9010, test_f1: 0.5812
 epoch: 31, train_loss: 0.6142, test_loss: 0.8424, test_f1: 0.6150
 epoch: 32, train_loss: 0.6096, test_loss: 0.9838, test_f1: 0.5594
 epoch: 33, train_loss: 0.5913, test_loss: 0.8440, test_f1: 0.6156
 epoch: 34, train_loss: 0.6047, test_loss: 0.8849, test_f1: 0.6148
 epoch: 35, train_loss: 0.6092, test_loss: 0.7744, test_f1: 0.6207
 epoch: 36, train_loss: 0.5889, test_loss: 0.8789, test_f1: 0.6108
 epoch: 37, train_loss: 0.5794, test_loss: 0.8414, test_f1: 0.6422
 epoch: 38, train_loss: 0.5661, test_loss: 0.8512, test_f1: 0.6326
 epoch: 39, train_loss: 0.5723, test_loss: 0.8710, test_f1: 0.6084
 epoch: 40, train_loss: 0.5588, test_loss: 0.8861, test_f1: 0.6340
 epoch: 41, train_loss: 0.5681, test_loss: 0.8575, test_f1: 0.6354
 epoch: 42, train_loss: 0.5479, test_loss: 0.9660, test_f1: 0.6050
 epoch: 43, train_loss: 0.5327, test_loss: 0.8992, test_f1: 0.6089
 epoch: 44, train_loss: 0.5336, test_loss: 1.1047, test_f1: 0.5575
 epoch: 45, train_loss: 0.5189, test_loss: 0.8788, test_f1: 0.6226
 epoch: 46, train_loss: 0.5157, test_loss: 0.9162, test_f1: 0.5894
 epoch: 47, train_loss: 0.5187, test_loss: 0.9864, test_f1: 0.5984
 epoch: 48, train_loss: 0.5217, test_loss: 1.0899, test_f1: 0.5705
 epoch: 49, train_loss: 0.5047, test_loss: 0.8904, test_f1: 0.6057
 epoch: 50, train_loss: 0.5164, test_loss: 0.9470, test_f1: 0.6065
 epoch: 51, train_loss: 0.4671, test_loss: 0.8579, test_f1: 0.6620
 epoch: 52, train_loss: 0.4405, test_loss: 0.8919, test_f1: 0.6468
 epoch: 53, train_loss: 0.4198, test_loss: 0.8477, test_f1: 0.6723
 epoch: 54, train_loss: 0.4214, test_loss: 0.9070, test_f1: 0.6588
 epoch: 55, train_loss: 0.4287, test_loss: 0.9578, test_f1: 0.6599
 epoch: 56, train_loss: 0.4253, test_loss: 0.9915, test_f1: 0.6404
 epoch: 57, train_loss: 0.4114, test_loss: 0.9239, test_f1: 0.6602
 epoch: 58, train_loss: 0.3858, test_loss: 0.9546, test_f1: 0.6590
 epoch: 59, train_loss: 0.4015, test_loss: 0.9863, test_f1: 0.6609
 epoch: 60, train_loss: 0.3957, test_loss: 0.9159, test_f1: 0.6446
 epoch: 61, train_loss: 0.4071, test_loss: 1.0563, test_f1: 0.6152
 epoch: 62, train_loss: 0.4166, test_loss: 0.9512, test_f1: 0.6624
 epoch: 63, train_loss: 0.3887, test_loss: 1.0071, test_f1: 0.6456
 epoch: 64, train_loss: 0.3663, test_loss: 1.0205, test_f1: 0.6565
 epoch: 65, train_loss: 0.3891, test_loss: 0.9958, test_f1: 0.6448
 epoch: 66, train_loss: 0.3607, test_loss: 0.9565, test_f1: 0.6629
 epoch: 67, train_loss: 0.3678, test_loss: 1.0276, test_f1: 0.6415
 epoch: 68, train_loss: 0.3729, test_loss: 1.0041, test_f1: 0.6352
 epoch: 69, train_loss: 0.3652, test_loss: 0.9211, test_f1: 0.6911
 epoch: 70, train_loss: 0.3658, test_loss: 1.0246, test_f1: 0.6307
 epoch: 71, train_loss: 0.3568, test_loss: 1.0953, test_f1: 0.6422
 epoch: 72, train_loss: 0.3551, test_loss: 0.9992, test_f1: 0.6678
 epoch: 73, train_loss: 0.3521, test_loss: 1.1453, test_f1: 0.6237
 epoch: 74, train_loss: 0.3443, test_loss: 1.0155, test_f1: 0.6739
 epoch: 75, train_loss: 0.3567, test_loss: 1.0663, test_f1: 0.6282
 epoch: 76, train_loss: 0.3337, test_loss: 1.3466, test_f1: 0.6207
 epoch: 77, train_loss: 0.3545, test_loss: 1.0199, test_f1: 0.6219
 epoch: 78, train_loss: 0.3385, test_loss: 1.1169, test_f1: 0.6623
 epoch: 79, train_loss: 0.3143, test_loss: 1.2568, test_f1: 0.6277
 epoch: 80, train_loss: 0.3251, test_loss: 1.0641, test_f1: 0.6460
 epoch: 81, train_loss: 0.3305, test_loss: 1.0870, test_f1: 0.6226
 epoch: 82, train_loss: 0.3352, test_loss: 1.1020, test_f1: 0.6574
 epoch: 83, train_loss: 0.3415, test_loss: 1.0453, test_f1: 0.6298
 epoch: 84, train_loss: 0.3241, test_loss: 1.1065, test_f1: 0.6222
 epoch: 85, train_loss: 0.3141, test_loss: 1.0610, test_f1: 0.6344
 epoch: 86, train_loss: 0.3168, test_loss: 0.9662, test_f1: 0.6826
 epoch: 87, train_loss: 0.3243, test_loss: 1.0550, test_f1: 0.6358
 epoch: 88, train_loss: 0.3238, test_loss: 1.2797, test_f1: 0.6377
 epoch: 89, train_loss: 0.3021, test_loss: 1.1221, test_f1: 0.6462
 epoch: 90, train_loss: 0.2964, test_loss: 1.0990, test_f1: 0.6407
 epoch: 91, train_loss: 0.3080, test_loss: 1.2475, test_f1: 0.6159
 epoch: 92, train_loss: 0.2997, test_loss: 1.1197, test_f1: 0.6503
 epoch: 93, train_loss: 0.2969, test_loss: 1.2167, test_f1: 0.6116
 epoch: 94, train_loss: 0.3224, test_loss: 1.1308, test_f1: 0.6672
 epoch: 95, train_loss: 0.2964, test_loss: 1.1266, test_f1: 0.6654
 epoch: 96, train_loss: 0.3036, test_loss: 1.1966, test_f1: 0.6243
 epoch: 97, train_loss: 0.2981, test_loss: 1.1332, test_f1: 0.6481
 epoch: 98, train_loss: 0.2896, test_loss: 1.1272, test_f1: 0.6648
 epoch: 99, train_loss: 0.2860, test_loss: 1.3421, test_f1: 0.6168

Training completed in 952.93 seconds
Best F1: 0.6993 at epoch 76
Mean F1 across iterations: 0.6878  0.0068
========================FINAL RESULTS================================
FEGIN weighted F1: 0.6993  0.0068
python main.py --data ltspice_examples --representation component_pin --model FEGIN --layers 3 --hiddens 64 --batch_size 64 --lr 0.001 --emb_size 250 --epochs 100 --save_appendix component_pin_L3_H64_BS64_LR0.001_E250 --no_val
-----



STDERR:
  File "main.py", line 370, in <module>
    main()
  File "main.py", line 254, in main
    dataset = dataset_class(
  File "/home/philip/projects/llm_inference_code_repo/Circuit-Completion-Using-GNNs/component_classification_with_link_prediction_head/evaluation/FEGIN/kernel/circuit_datasets.py", line 15, in __init__
    self.data, self.slices = torch.load(self.processed_paths[0])
  File "/home/philip/.local/lib/python3.8/site-packages/torch/serialization.py", line 1040, in load
    warnings.warn(
  File "/usr/lib/python3.8/warnings.py", line 109, in _showwarnmsg
    sw(msg.message, msg.category, msg.filename, msg.lineno,
  File "main.py", line 47, in warn_with_traceback
    traceback.print_stack(file=log)
/home/philip/projects/llm_inference_code_repo/Circuit-Completion-Using-GNNs/component_classification_with_link_prediction_head/evaluation/FEGIN/kernel/circuit_datasets.py:15: FutureWarning: You are using `torch.load` with `weights_only=False` (the current default value), which uses the default pickle module implicitly. It is possible to construct malicious pickle data which will execute arbitrary code during unpickling (See https://github.com/pytorch/pytorch/blob/main/SECURITY.md#untrusted-models for more details). In a future release, the default value for `weights_only` will be flipped to `True`. This limits the functions that could be executed during unpickling. Arbitrary objects will no longer be allowed to be loaded via this mode unless they are explicitly allowlisted by the user via `torch.serialization.add_safe_globals`. We recommend you start setting `weights_only=True` for any use case where you don't have full control of the loaded file. Please open an issue on GitHub for any issues related to this experimental feature.
  self.data, self.slices = torch.load(self.processed_paths[0])
