STDOUT:
Results will be saved in /home/philip/projects/ltspice_examples_code_repo/Circuit-Completion-Using-GNNs/component_classification_with_link_prediction_head/evaluation/FEGIN/results/model_FEGIN_dataset_ltspice_examples
Command line input: python main.py --data ltspice_examples --representation component_component --model FEGIN --layers 2 --hiddens 128 --batch_size 256 --lr 0.0001 --emb_size 128 --epochs 100 --save_appendix component_component_L2_H128_BS256_LR0.0001_E128 --no_val
 is saved.
-----
ltspice_examples - FEGIN
Using 2 layers, 128 hidden units, h = 2
Loading component_component representation dataset
ENTERED
Training FEGIN on component_component representation
Train: 3556, Test: 845
##################ITERATION #0 ****************************************
 epoch: 0, train_loss: 1.3704, test_loss: 1.3678, test_f1: 0.2274
 epoch: 1, train_loss: 1.3539, test_loss: 1.3580, test_f1: 0.2274
 epoch: 2, train_loss: 1.3434, test_loss: 1.3444, test_f1: 0.2274
 epoch: 3, train_loss: 1.3307, test_loss: 1.3277, test_f1: 0.2274
 epoch: 4, train_loss: 1.3162, test_loss: 1.3092, test_f1: 0.2274
 epoch: 5, train_loss: 1.2988, test_loss: 1.2903, test_f1: 0.2274
 epoch: 6, train_loss: 1.2841, test_loss: 1.2726, test_f1: 0.2274
 epoch: 7, train_loss: 1.2666, test_loss: 1.2555, test_f1: 0.2276
 epoch: 8, train_loss: 1.2509, test_loss: 1.2396, test_f1: 0.2390
 epoch: 9, train_loss: 1.2365, test_loss: 1.2251, test_f1: 0.2578
 epoch: 10, train_loss: 1.2208, test_loss: 1.2109, test_f1: 0.2859
 epoch: 11, train_loss: 1.2074, test_loss: 1.1982, test_f1: 0.3417
 epoch: 12, train_loss: 1.1945, test_loss: 1.1838, test_f1: 0.3513
 epoch: 13, train_loss: 1.1828, test_loss: 1.1725, test_f1: 0.3573
 epoch: 14, train_loss: 1.1688, test_loss: 1.1609, test_f1: 0.3594
 epoch: 15, train_loss: 1.1567, test_loss: 1.1493, test_f1: 0.3719
 epoch: 16, train_loss: 1.1475, test_loss: 1.1418, test_f1: 0.4143
 epoch: 17, train_loss: 1.1322, test_loss: 1.1304, test_f1: 0.4335
 epoch: 18, train_loss: 1.1159, test_loss: 1.1203, test_f1: 0.4403
 epoch: 19, train_loss: 1.1082, test_loss: 1.1125, test_f1: 0.4394
 epoch: 20, train_loss: 1.0983, test_loss: 1.1007, test_f1: 0.4464
 epoch: 21, train_loss: 1.0858, test_loss: 1.0922, test_f1: 0.4543
 epoch: 22, train_loss: 1.0713, test_loss: 1.0841, test_f1: 0.4483
 epoch: 23, train_loss: 1.0603, test_loss: 1.0746, test_f1: 0.4555
 epoch: 24, train_loss: 1.0503, test_loss: 1.0649, test_f1: 0.4463
 epoch: 25, train_loss: 1.0305, test_loss: 1.0579, test_f1: 0.4585
 epoch: 26, train_loss: 1.0289, test_loss: 1.0504, test_f1: 0.4596
 epoch: 27, train_loss: 1.0189, test_loss: 1.0409, test_f1: 0.4534
 epoch: 28, train_loss: 1.0100, test_loss: 1.0324, test_f1: 0.4768
 epoch: 29, train_loss: 0.9980, test_loss: 1.0272, test_f1: 0.4683
 epoch: 30, train_loss: 0.9856, test_loss: 1.0196, test_f1: 0.4781
 epoch: 31, train_loss: 0.9799, test_loss: 1.0168, test_f1: 0.4743
 epoch: 32, train_loss: 0.9692, test_loss: 1.0184, test_f1: 0.4858
 epoch: 33, train_loss: 0.9546, test_loss: 1.0095, test_f1: 0.4780
 epoch: 34, train_loss: 0.9474, test_loss: 1.0083, test_f1: 0.4891
 epoch: 35, train_loss: 0.9396, test_loss: 0.9952, test_f1: 0.4918
 epoch: 36, train_loss: 0.9278, test_loss: 0.9965, test_f1: 0.4801
 epoch: 37, train_loss: 0.9245, test_loss: 0.9971, test_f1: 0.4741
 epoch: 38, train_loss: 0.9120, test_loss: 0.9890, test_f1: 0.4802
 epoch: 39, train_loss: 0.9100, test_loss: 0.9823, test_f1: 0.4751
 epoch: 40, train_loss: 0.9020, test_loss: 1.0017, test_f1: 0.4855
 epoch: 41, train_loss: 0.8945, test_loss: 0.9901, test_f1: 0.4918
 epoch: 42, train_loss: 0.8835, test_loss: 0.9858, test_f1: 0.4853
 epoch: 43, train_loss: 0.8761, test_loss: 0.9826, test_f1: 0.4858
 epoch: 44, train_loss: 0.8664, test_loss: 1.0073, test_f1: 0.4938
 epoch: 45, train_loss: 0.8576, test_loss: 0.9874, test_f1: 0.4900
 epoch: 46, train_loss: 0.8559, test_loss: 0.9944, test_f1: 0.5110
 epoch: 47, train_loss: 0.8426, test_loss: 0.9939, test_f1: 0.5129
 epoch: 48, train_loss: 0.8327, test_loss: 0.9935, test_f1: 0.4921
 epoch: 49, train_loss: 0.8234, test_loss: 0.9919, test_f1: 0.4822
 epoch: 50, train_loss: 0.8267, test_loss: 0.9963, test_f1: 0.5139
 epoch: 51, train_loss: 0.8217, test_loss: 0.9936, test_f1: 0.5040
 epoch: 52, train_loss: 0.8052, test_loss: 1.0109, test_f1: 0.5065
 epoch: 53, train_loss: 0.8073, test_loss: 1.0159, test_f1: 0.4921
 epoch: 54, train_loss: 0.7990, test_loss: 1.0136, test_f1: 0.5046
 epoch: 55, train_loss: 0.7964, test_loss: 1.0132, test_f1: 0.5030
 epoch: 56, train_loss: 0.7906, test_loss: 1.0135, test_f1: 0.5128
 epoch: 57, train_loss: 0.7889, test_loss: 1.0268, test_f1: 0.4939
 epoch: 58, train_loss: 0.7875, test_loss: 1.0204, test_f1: 0.5027
 epoch: 59, train_loss: 0.7800, test_loss: 1.0150, test_f1: 0.5066
 epoch: 60, train_loss: 0.7802, test_loss: 1.0327, test_f1: 0.5194
 epoch: 61, train_loss: 0.7700, test_loss: 1.0304, test_f1: 0.4900
 epoch: 62, train_loss: 0.7730, test_loss: 1.0365, test_f1: 0.5088
 epoch: 63, train_loss: 0.7666, test_loss: 1.0303, test_f1: 0.5053
 epoch: 64, train_loss: 0.7675, test_loss: 1.0366, test_f1: 0.5028
 epoch: 65, train_loss: 0.7583, test_loss: 1.0362, test_f1: 0.5057
 epoch: 66, train_loss: 0.7582, test_loss: 1.0436, test_f1: 0.5049
 epoch: 67, train_loss: 0.7554, test_loss: 1.0496, test_f1: 0.4953
 epoch: 68, train_loss: 0.7535, test_loss: 1.0444, test_f1: 0.5053
 epoch: 69, train_loss: 0.7427, test_loss: 1.0477, test_f1: 0.5162
 epoch: 70, train_loss: 0.7454, test_loss: 1.0517, test_f1: 0.5060
 epoch: 71, train_loss: 0.7385, test_loss: 1.0490, test_f1: 0.5217
 epoch: 72, train_loss: 0.7445, test_loss: 1.0509, test_f1: 0.5022
 epoch: 73, train_loss: 0.7387, test_loss: 1.0611, test_f1: 0.5122
 epoch: 74, train_loss: 0.7321, test_loss: 1.0656, test_f1: 0.5149
 epoch: 75, train_loss: 0.7339, test_loss: 1.0725, test_f1: 0.5168
 epoch: 76, train_loss: 0.7257, test_loss: 1.0734, test_f1: 0.4951
 epoch: 77, train_loss: 0.7365, test_loss: 1.0750, test_f1: 0.5090
 epoch: 78, train_loss: 0.7275, test_loss: 1.0744, test_f1: 0.5123
 epoch: 79, train_loss: 0.7264, test_loss: 1.0775, test_f1: 0.5070
 epoch: 80, train_loss: 0.7179, test_loss: 1.1001, test_f1: 0.5046
 epoch: 81, train_loss: 0.7120, test_loss: 1.0910, test_f1: 0.5040
 epoch: 82, train_loss: 0.7065, test_loss: 1.1011, test_f1: 0.5039
 epoch: 83, train_loss: 0.7061, test_loss: 1.0987, test_f1: 0.5059
 epoch: 84, train_loss: 0.7029, test_loss: 1.1103, test_f1: 0.5054
 epoch: 85, train_loss: 0.7081, test_loss: 1.0956, test_f1: 0.5002
 epoch: 86, train_loss: 0.6963, test_loss: 1.1054, test_f1: 0.5104
 epoch: 87, train_loss: 0.7098, test_loss: 1.1095, test_f1: 0.5114
 epoch: 88, train_loss: 0.6899, test_loss: 1.1023, test_f1: 0.5264
 epoch: 89, train_loss: 0.6899, test_loss: 1.1307, test_f1: 0.5044
 epoch: 90, train_loss: 0.6887, test_loss: 1.1250, test_f1: 0.5079
 epoch: 91, train_loss: 0.6879, test_loss: 1.1255, test_f1: 0.5025
 epoch: 92, train_loss: 0.6827, test_loss: 1.1409, test_f1: 0.5126
 epoch: 93, train_loss: 0.6761, test_loss: 1.1128, test_f1: 0.5077
 epoch: 94, train_loss: 0.6756, test_loss: 1.1191, test_f1: 0.5148
 epoch: 95, train_loss: 0.6764, test_loss: 1.1249, test_f1: 0.5200
 epoch: 96, train_loss: 0.6664, test_loss: 1.1344, test_f1: 0.5115
 epoch: 97, train_loss: 0.6701, test_loss: 1.1422, test_f1: 0.5184
 epoch: 98, train_loss: 0.6727, test_loss: 1.1595, test_f1: 0.5095
 epoch: 99, train_loss: 0.6680, test_loss: 1.1485, test_f1: 0.5218
##################ITERATION #1 ****************************************
 epoch: 0, train_loss: 1.3349, test_loss: 1.3358, test_f1: 0.2274
 epoch: 1, train_loss: 1.2923, test_loss: 1.3050, test_f1: 0.2532
 epoch: 2, train_loss: 1.2715, test_loss: 1.2733, test_f1: 0.2603
 epoch: 3, train_loss: 1.2519, test_loss: 1.2409, test_f1: 0.2646
 epoch: 4, train_loss: 1.2354, test_loss: 1.2146, test_f1: 0.3118
 epoch: 5, train_loss: 1.2174, test_loss: 1.1927, test_f1: 0.3387
 epoch: 6, train_loss: 1.2069, test_loss: 1.1749, test_f1: 0.3647
 epoch: 7, train_loss: 1.1900, test_loss: 1.1592, test_f1: 0.4054
 epoch: 8, train_loss: 1.1729, test_loss: 1.1449, test_f1: 0.4211
 epoch: 9, train_loss: 1.1656, test_loss: 1.1326, test_f1: 0.4459
 epoch: 10, train_loss: 1.1512, test_loss: 1.1174, test_f1: 0.4445
 epoch: 11, train_loss: 1.1382, test_loss: 1.1051, test_f1: 0.4409
 epoch: 12, train_loss: 1.1235, test_loss: 1.0938, test_f1: 0.4487
 epoch: 13, train_loss: 1.1122, test_loss: 1.0785, test_f1: 0.4449
 epoch: 14, train_loss: 1.0993, test_loss: 1.0667, test_f1: 0.4430
 epoch: 15, train_loss: 1.0926, test_loss: 1.0570, test_f1: 0.4436
 epoch: 16, train_loss: 1.0756, test_loss: 1.0472, test_f1: 0.4405
 epoch: 17, train_loss: 1.0668, test_loss: 1.0356, test_f1: 0.4488
 epoch: 18, train_loss: 1.0538, test_loss: 1.0261, test_f1: 0.4513
 epoch: 19, train_loss: 1.0469, test_loss: 1.0182, test_f1: 0.4538
 epoch: 20, train_loss: 1.0411, test_loss: 1.0079, test_f1: 0.4534
 epoch: 21, train_loss: 1.0316, test_loss: 1.0028, test_f1: 0.4744
 epoch: 22, train_loss: 1.0240, test_loss: 0.9948, test_f1: 0.4930
 epoch: 23, train_loss: 1.0060, test_loss: 0.9841, test_f1: 0.4729
 epoch: 24, train_loss: 1.0047, test_loss: 0.9807, test_f1: 0.4893
 epoch: 25, train_loss: 0.9856, test_loss: 0.9755, test_f1: 0.4702
 epoch: 26, train_loss: 0.9826, test_loss: 0.9735, test_f1: 0.4910
 epoch: 27, train_loss: 0.9793, test_loss: 0.9651, test_f1: 0.4852
 epoch: 28, train_loss: 0.9667, test_loss: 0.9585, test_f1: 0.4841
 epoch: 29, train_loss: 0.9572, test_loss: 0.9542, test_f1: 0.4883
 epoch: 30, train_loss: 0.9579, test_loss: 0.9591, test_f1: 0.4838
 epoch: 31, train_loss: 0.9431, test_loss: 0.9500, test_f1: 0.4980
 epoch: 32, train_loss: 0.9392, test_loss: 0.9503, test_f1: 0.4838
 epoch: 33, train_loss: 0.9293, test_loss: 0.9465, test_f1: 0.4863
 epoch: 34, train_loss: 0.9278, test_loss: 0.9414, test_f1: 0.5014
 epoch: 35, train_loss: 0.9133, test_loss: 0.9458, test_f1: 0.4830
 epoch: 36, train_loss: 0.9086, test_loss: 0.9460, test_f1: 0.4789
 epoch: 37, train_loss: 0.9012, test_loss: 0.9390, test_f1: 0.4896
 epoch: 38, train_loss: 0.8994, test_loss: 0.9377, test_f1: 0.4904
 epoch: 39, train_loss: 0.8913, test_loss: 0.9512, test_f1: 0.4970
 epoch: 40, train_loss: 0.8846, test_loss: 0.9491, test_f1: 0.5141
 epoch: 41, train_loss: 0.8835, test_loss: 0.9486, test_f1: 0.5073
 epoch: 42, train_loss: 0.8745, test_loss: 0.9418, test_f1: 0.5056
 epoch: 43, train_loss: 0.8616, test_loss: 0.9532, test_f1: 0.5100
 epoch: 44, train_loss: 0.8615, test_loss: 0.9538, test_f1: 0.4963
 epoch: 45, train_loss: 0.8536, test_loss: 0.9585, test_f1: 0.5076
 epoch: 46, train_loss: 0.8504, test_loss: 0.9412, test_f1: 0.5140
 epoch: 47, train_loss: 0.8489, test_loss: 0.9495, test_f1: 0.5186
 epoch: 48, train_loss: 0.8397, test_loss: 0.9555, test_f1: 0.5038
 epoch: 49, train_loss: 0.8297, test_loss: 0.9495, test_f1: 0.5104
 epoch: 50, train_loss: 0.8235, test_loss: 0.9509, test_f1: 0.5100
 epoch: 51, train_loss: 0.8209, test_loss: 0.9560, test_f1: 0.5014
 epoch: 52, train_loss: 0.8115, test_loss: 0.9607, test_f1: 0.5126
 epoch: 53, train_loss: 0.8174, test_loss: 0.9666, test_f1: 0.5069
 epoch: 54, train_loss: 0.8083, test_loss: 0.9574, test_f1: 0.5135
 epoch: 55, train_loss: 0.8036, test_loss: 0.9607, test_f1: 0.5162
 epoch: 56, train_loss: 0.7997, test_loss: 0.9679, test_f1: 0.5150
 epoch: 57, train_loss: 0.8015, test_loss: 0.9676, test_f1: 0.5206
 epoch: 58, train_loss: 0.8063, test_loss: 0.9665, test_f1: 0.5105
 epoch: 59, train_loss: 0.7980, test_loss: 0.9660, test_f1: 0.5191
 epoch: 60, train_loss: 0.7989, test_loss: 0.9604, test_f1: 0.5266
 epoch: 61, train_loss: 0.7852, test_loss: 0.9601, test_f1: 0.5188
 epoch: 62, train_loss: 0.7898, test_loss: 0.9701, test_f1: 0.5055
 epoch: 63, train_loss: 0.7829, test_loss: 0.9684, test_f1: 0.5203
 epoch: 64, train_loss: 0.7814, test_loss: 0.9721, test_f1: 0.5154
 epoch: 65, train_loss: 0.7706, test_loss: 0.9766, test_f1: 0.5162
 epoch: 66, train_loss: 0.7864, test_loss: 0.9729, test_f1: 0.5210
 epoch: 67, train_loss: 0.7732, test_loss: 0.9746, test_f1: 0.5151
 epoch: 68, train_loss: 0.7758, test_loss: 0.9692, test_f1: 0.5174
 epoch: 69, train_loss: 0.7659, test_loss: 0.9764, test_f1: 0.5166
 epoch: 70, train_loss: 0.7736, test_loss: 0.9898, test_f1: 0.5071
 epoch: 71, train_loss: 0.7598, test_loss: 0.9877, test_f1: 0.5119
 epoch: 72, train_loss: 0.7541, test_loss: 0.9798, test_f1: 0.5081
 epoch: 73, train_loss: 0.7486, test_loss: 0.9722, test_f1: 0.5142
 epoch: 74, train_loss: 0.7563, test_loss: 0.9820, test_f1: 0.5168
 epoch: 75, train_loss: 0.7604, test_loss: 0.9815, test_f1: 0.5263
 epoch: 76, train_loss: 0.7432, test_loss: 0.9781, test_f1: 0.5212
 epoch: 77, train_loss: 0.7515, test_loss: 0.9784, test_f1: 0.5149
 epoch: 78, train_loss: 0.7478, test_loss: 0.9843, test_f1: 0.5229
 epoch: 79, train_loss: 0.7498, test_loss: 0.9954, test_f1: 0.5145
 epoch: 80, train_loss: 0.7431, test_loss: 0.9939, test_f1: 0.5206
 epoch: 81, train_loss: 0.7402, test_loss: 0.9848, test_f1: 0.5217
 epoch: 82, train_loss: 0.7271, test_loss: 0.9934, test_f1: 0.5214
 epoch: 83, train_loss: 0.7373, test_loss: 0.9968, test_f1: 0.5238
 epoch: 84, train_loss: 0.7338, test_loss: 0.9936, test_f1: 0.5213
 epoch: 85, train_loss: 0.7291, test_loss: 0.9986, test_f1: 0.5159
 epoch: 86, train_loss: 0.7256, test_loss: 0.9902, test_f1: 0.5147
 epoch: 87, train_loss: 0.7298, test_loss: 1.0090, test_f1: 0.5087
 epoch: 88, train_loss: 0.7343, test_loss: 0.9927, test_f1: 0.5185
 epoch: 89, train_loss: 0.7080, test_loss: 1.0051, test_f1: 0.5180
 epoch: 90, train_loss: 0.7230, test_loss: 1.0020, test_f1: 0.5134
 epoch: 91, train_loss: 0.7221, test_loss: 1.0021, test_f1: 0.5218
 epoch: 92, train_loss: 0.7171, test_loss: 1.0092, test_f1: 0.5160
 epoch: 93, train_loss: 0.7182, test_loss: 1.0063, test_f1: 0.5231
 epoch: 94, train_loss: 0.7062, test_loss: 0.9995, test_f1: 0.5115
 epoch: 95, train_loss: 0.7125, test_loss: 1.0155, test_f1: 0.5163
 epoch: 96, train_loss: 0.7064, test_loss: 1.0134, test_f1: 0.5177
 epoch: 97, train_loss: 0.6966, test_loss: 1.0272, test_f1: 0.5235
 epoch: 98, train_loss: 0.6962, test_loss: 1.0214, test_f1: 0.5022
 epoch: 99, train_loss: 0.6940, test_loss: 1.0092, test_f1: 0.5189
##################ITERATION #2 ****************************************
 epoch: 0, train_loss: 1.3052, test_loss: 1.3057, test_f1: 0.2274
 epoch: 1, train_loss: 1.2361, test_loss: 1.2740, test_f1: 0.2555
 epoch: 2, train_loss: 1.2178, test_loss: 1.2286, test_f1: 0.2814
 epoch: 3, train_loss: 1.1932, test_loss: 1.1885, test_f1: 0.3809
 epoch: 4, train_loss: 1.1750, test_loss: 1.1583, test_f1: 0.4183
 epoch: 5, train_loss: 1.1565, test_loss: 1.1394, test_f1: 0.4482
 epoch: 6, train_loss: 1.1432, test_loss: 1.1209, test_f1: 0.4759
 epoch: 7, train_loss: 1.1255, test_loss: 1.1061, test_f1: 0.4333
 epoch: 8, train_loss: 1.1140, test_loss: 1.0902, test_f1: 0.4741
 epoch: 9, train_loss: 1.0981, test_loss: 1.0781, test_f1: 0.4698
 epoch: 10, train_loss: 1.0890, test_loss: 1.0698, test_f1: 0.4625
 epoch: 11, train_loss: 1.0746, test_loss: 1.0588, test_f1: 0.4748
 epoch: 12, train_loss: 1.0699, test_loss: 1.0530, test_f1: 0.4601
 epoch: 13, train_loss: 1.0577, test_loss: 1.0465, test_f1: 0.4659
 epoch: 14, train_loss: 1.0503, test_loss: 1.0337, test_f1: 0.4680
 epoch: 15, train_loss: 1.0416, test_loss: 1.0264, test_f1: 0.4685
 epoch: 16, train_loss: 1.0402, test_loss: 1.0224, test_f1: 0.4749
 epoch: 17, train_loss: 1.0224, test_loss: 1.0143, test_f1: 0.4795
 epoch: 18, train_loss: 1.0250, test_loss: 1.0093, test_f1: 0.4752
 epoch: 19, train_loss: 1.0123, test_loss: 1.0149, test_f1: 0.4738
 epoch: 20, train_loss: 1.0072, test_loss: 0.9975, test_f1: 0.4892
 epoch: 21, train_loss: 0.9953, test_loss: 1.0052, test_f1: 0.4833
 epoch: 22, train_loss: 0.9890, test_loss: 0.9946, test_f1: 0.4949
 epoch: 23, train_loss: 0.9792, test_loss: 0.9878, test_f1: 0.4796
 epoch: 24, train_loss: 0.9792, test_loss: 0.9875, test_f1: 0.4938
 epoch: 25, train_loss: 0.9688, test_loss: 0.9788, test_f1: 0.5011
 epoch: 26, train_loss: 0.9586, test_loss: 0.9853, test_f1: 0.4969
 epoch: 27, train_loss: 0.9544, test_loss: 0.9775, test_f1: 0.4945
 epoch: 28, train_loss: 0.9520, test_loss: 0.9716, test_f1: 0.5043
 epoch: 29, train_loss: 0.9420, test_loss: 0.9741, test_f1: 0.4908
 epoch: 30, train_loss: 0.9368, test_loss: 0.9715, test_f1: 0.4929
 epoch: 31, train_loss: 0.9278, test_loss: 0.9697, test_f1: 0.4946
 epoch: 32, train_loss: 0.9281, test_loss: 0.9770, test_f1: 0.4820
 epoch: 33, train_loss: 0.9161, test_loss: 0.9520, test_f1: 0.4990
 epoch: 34, train_loss: 0.9030, test_loss: 0.9726, test_f1: 0.4941
 epoch: 35, train_loss: 0.9080, test_loss: 0.9628, test_f1: 0.4964
 epoch: 36, train_loss: 0.8996, test_loss: 0.9714, test_f1: 0.4939
 epoch: 37, train_loss: 0.9070, test_loss: 0.9667, test_f1: 0.4874
 epoch: 38, train_loss: 0.8956, test_loss: 0.9528, test_f1: 0.5103
 epoch: 39, train_loss: 0.8852, test_loss: 0.9635, test_f1: 0.5044
 epoch: 40, train_loss: 0.8857, test_loss: 0.9569, test_f1: 0.5010
 epoch: 41, train_loss: 0.8786, test_loss: 0.9664, test_f1: 0.4881
 epoch: 42, train_loss: 0.8725, test_loss: 0.9641, test_f1: 0.4777
 epoch: 43, train_loss: 0.8615, test_loss: 0.9583, test_f1: 0.4942
 epoch: 44, train_loss: 0.8583, test_loss: 0.9667, test_f1: 0.4960
 epoch: 45, train_loss: 0.8470, test_loss: 0.9591, test_f1: 0.4823
 epoch: 46, train_loss: 0.8621, test_loss: 0.9750, test_f1: 0.4957
 epoch: 47, train_loss: 0.8458, test_loss: 0.9693, test_f1: 0.4952
 epoch: 48, train_loss: 0.8448, test_loss: 0.9595, test_f1: 0.5036
 epoch: 49, train_loss: 0.8308, test_loss: 0.9718, test_f1: 0.4962
 epoch: 50, train_loss: 0.8302, test_loss: 0.9667, test_f1: 0.5040
 epoch: 51, train_loss: 0.8330, test_loss: 0.9721, test_f1: 0.4959
 epoch: 52, train_loss: 0.8206, test_loss: 0.9713, test_f1: 0.5108
 epoch: 53, train_loss: 0.8205, test_loss: 0.9705, test_f1: 0.4970
 epoch: 54, train_loss: 0.8146, test_loss: 0.9690, test_f1: 0.4995
 epoch: 55, train_loss: 0.8069, test_loss: 0.9784, test_f1: 0.4942
 epoch: 56, train_loss: 0.8149, test_loss: 0.9766, test_f1: 0.5059
 epoch: 57, train_loss: 0.8034, test_loss: 0.9739, test_f1: 0.4963
 epoch: 58, train_loss: 0.8029, test_loss: 0.9802, test_f1: 0.5104
 epoch: 59, train_loss: 0.7999, test_loss: 0.9851, test_f1: 0.5081
 epoch: 60, train_loss: 0.7957, test_loss: 0.9908, test_f1: 0.4847
 epoch: 61, train_loss: 0.7966, test_loss: 0.9882, test_f1: 0.5017
 epoch: 62, train_loss: 0.7909, test_loss: 0.9929, test_f1: 0.5080
 epoch: 63, train_loss: 0.7897, test_loss: 0.9822, test_f1: 0.4870
 epoch: 64, train_loss: 0.7922, test_loss: 0.9902, test_f1: 0.5054
 epoch: 65, train_loss: 0.7867, test_loss: 0.9960, test_f1: 0.5011
 epoch: 66, train_loss: 0.7894, test_loss: 1.0030, test_f1: 0.5060
 epoch: 67, train_loss: 0.7896, test_loss: 0.9983, test_f1: 0.5085
 epoch: 68, train_loss: 0.7807, test_loss: 1.0012, test_f1: 0.5043
 epoch: 69, train_loss: 0.7725, test_loss: 0.9946, test_f1: 0.5096
 epoch: 70, train_loss: 0.7771, test_loss: 0.9984, test_f1: 0.5010
 epoch: 71, train_loss: 0.7711, test_loss: 1.0112, test_f1: 0.4987
 epoch: 72, train_loss: 0.7603, test_loss: 1.0097, test_f1: 0.5031
 epoch: 73, train_loss: 0.7697, test_loss: 1.0222, test_f1: 0.5035
 epoch: 74, train_loss: 0.7658, test_loss: 1.0060, test_f1: 0.4967
 epoch: 75, train_loss: 0.7609, test_loss: 1.0180, test_f1: 0.5024
 epoch: 76, train_loss: 0.7540, test_loss: 1.0179, test_f1: 0.5026
 epoch: 77, train_loss: 0.7601, test_loss: 1.0096, test_f1: 0.5123
 epoch: 78, train_loss: 0.7538, test_loss: 1.0236, test_f1: 0.5076
 epoch: 79, train_loss: 0.7516, test_loss: 1.0168, test_f1: 0.5005
 epoch: 80, train_loss: 0.7421, test_loss: 1.0303, test_f1: 0.5054
 epoch: 81, train_loss: 0.7466, test_loss: 1.0304, test_f1: 0.5038
 epoch: 82, train_loss: 0.7468, test_loss: 1.0269, test_f1: 0.4936
 epoch: 83, train_loss: 0.7406, test_loss: 1.0395, test_f1: 0.5029
 epoch: 84, train_loss: 0.7389, test_loss: 1.0349, test_f1: 0.4999
 epoch: 85, train_loss: 0.7301, test_loss: 1.0375, test_f1: 0.5116
 epoch: 86, train_loss: 0.7398, test_loss: 1.0458, test_f1: 0.5021
 epoch: 87, train_loss: 0.7301, test_loss: 1.0526, test_f1: 0.5056
 epoch: 88, train_loss: 0.7320, test_loss: 1.0324, test_f1: 0.5025
 epoch: 89, train_loss: 0.7225, test_loss: 1.0537, test_f1: 0.4940
 epoch: 90, train_loss: 0.7249, test_loss: 1.0582, test_f1: 0.4963
 epoch: 91, train_loss: 0.7303, test_loss: 1.0623, test_f1: 0.4988
 epoch: 92, train_loss: 0.7318, test_loss: 1.0527, test_f1: 0.5024
 epoch: 93, train_loss: 0.7136, test_loss: 1.0613, test_f1: 0.4940
 epoch: 94, train_loss: 0.7171, test_loss: 1.0521, test_f1: 0.5058
 epoch: 95, train_loss: 0.7111, test_loss: 1.0800, test_f1: 0.5053
 epoch: 96, train_loss: 0.7202, test_loss: 1.0617, test_f1: 0.4914
 epoch: 97, train_loss: 0.7229, test_loss: 1.0776, test_f1: 0.5025
 epoch: 98, train_loss: 0.7170, test_loss: 1.0619, test_f1: 0.4917
 epoch: 99, train_loss: 0.7130, test_loss: 1.0883, test_f1: 0.4905
##################ITERATION #3 ****************************************
 epoch: 0, train_loss: 1.3258, test_loss: 1.3016, test_f1: 0.2274
 epoch: 1, train_loss: 1.2416, test_loss: 1.2575, test_f1: 0.2859
 epoch: 2, train_loss: 1.2126, test_loss: 1.2052, test_f1: 0.3544
 epoch: 3, train_loss: 1.1858, test_loss: 1.1656, test_f1: 0.4202
 epoch: 4, train_loss: 1.1720, test_loss: 1.1412, test_f1: 0.4451
 epoch: 5, train_loss: 1.1505, test_loss: 1.1267, test_f1: 0.4531
 epoch: 6, train_loss: 1.1371, test_loss: 1.1155, test_f1: 0.4623
 epoch: 7, train_loss: 1.1274, test_loss: 1.1036, test_f1: 0.4620
 epoch: 8, train_loss: 1.1068, test_loss: 1.0968, test_f1: 0.4601
 epoch: 9, train_loss: 1.1068, test_loss: 1.0949, test_f1: 0.4554
 epoch: 10, train_loss: 1.0844, test_loss: 1.0824, test_f1: 0.4578
 epoch: 11, train_loss: 1.0804, test_loss: 1.0737, test_f1: 0.4602
 epoch: 12, train_loss: 1.0761, test_loss: 1.0643, test_f1: 0.4556
 epoch: 13, train_loss: 1.0610, test_loss: 1.0607, test_f1: 0.4626
 epoch: 14, train_loss: 1.0477, test_loss: 1.0552, test_f1: 0.4592
 epoch: 15, train_loss: 1.0442, test_loss: 1.0452, test_f1: 0.4645
 epoch: 16, train_loss: 1.0299, test_loss: 1.0382, test_f1: 0.4584
 epoch: 17, train_loss: 1.0168, test_loss: 1.0322, test_f1: 0.4586
 epoch: 18, train_loss: 1.0171, test_loss: 1.0230, test_f1: 0.4681
 epoch: 19, train_loss: 1.0088, test_loss: 1.0118, test_f1: 0.4700
 epoch: 20, train_loss: 0.9946, test_loss: 1.0070, test_f1: 0.4791
 epoch: 21, train_loss: 0.9893, test_loss: 1.0086, test_f1: 0.4620
 epoch: 22, train_loss: 0.9889, test_loss: 0.9994, test_f1: 0.4749
 epoch: 23, train_loss: 0.9736, test_loss: 1.0017, test_f1: 0.4781
 epoch: 24, train_loss: 0.9747, test_loss: 0.9916, test_f1: 0.4825
 epoch: 25, train_loss: 0.9609, test_loss: 0.9808, test_f1: 0.4888
 epoch: 26, train_loss: 0.9562, test_loss: 0.9899, test_f1: 0.4856
 epoch: 27, train_loss: 0.9427, test_loss: 0.9835, test_f1: 0.4893
 epoch: 28, train_loss: 0.9349, test_loss: 0.9868, test_f1: 0.4858
 epoch: 29, train_loss: 0.9278, test_loss: 0.9834, test_f1: 0.4966
 epoch: 30, train_loss: 0.9265, test_loss: 0.9809, test_f1: 0.4943
 epoch: 31, train_loss: 0.9256, test_loss: 0.9732, test_f1: 0.5013
 epoch: 32, train_loss: 0.9127, test_loss: 0.9775, test_f1: 0.4972
 epoch: 33, train_loss: 0.9088, test_loss: 0.9638, test_f1: 0.5008
 epoch: 34, train_loss: 0.9018, test_loss: 0.9817, test_f1: 0.5005
 epoch: 35, train_loss: 0.8959, test_loss: 0.9806, test_f1: 0.5058
 epoch: 36, train_loss: 0.8913, test_loss: 0.9748, test_f1: 0.5072
 epoch: 37, train_loss: 0.8862, test_loss: 0.9835, test_f1: 0.5079
 epoch: 38, train_loss: 0.8785, test_loss: 0.9788, test_f1: 0.5042
 epoch: 39, train_loss: 0.8722, test_loss: 0.9820, test_f1: 0.5094
 epoch: 40, train_loss: 0.8597, test_loss: 0.9781, test_f1: 0.5031
 epoch: 41, train_loss: 0.8608, test_loss: 0.9964, test_f1: 0.5136
 epoch: 42, train_loss: 0.8498, test_loss: 0.9994, test_f1: 0.5123
 epoch: 43, train_loss: 0.8504, test_loss: 0.9950, test_f1: 0.5070
 epoch: 44, train_loss: 0.8469, test_loss: 0.9953, test_f1: 0.4979
 epoch: 45, train_loss: 0.8443, test_loss: 1.0051, test_f1: 0.5005
 epoch: 46, train_loss: 0.8338, test_loss: 1.0049, test_f1: 0.5101
 epoch: 47, train_loss: 0.8321, test_loss: 1.0060, test_f1: 0.5034
 epoch: 48, train_loss: 0.8208, test_loss: 1.0099, test_f1: 0.4962
 epoch: 49, train_loss: 0.8219, test_loss: 1.0173, test_f1: 0.5089
 epoch: 50, train_loss: 0.8224, test_loss: 1.0084, test_f1: 0.5183
 epoch: 51, train_loss: 0.8055, test_loss: 1.0133, test_f1: 0.5105
 epoch: 52, train_loss: 0.8022, test_loss: 1.0162, test_f1: 0.4987
 epoch: 53, train_loss: 0.7953, test_loss: 1.0204, test_f1: 0.5082
 epoch: 54, train_loss: 0.7994, test_loss: 1.0091, test_f1: 0.5204
 epoch: 55, train_loss: 0.8019, test_loss: 1.0107, test_f1: 0.5194
 epoch: 56, train_loss: 0.7924, test_loss: 1.0159, test_f1: 0.5197
 epoch: 57, train_loss: 0.7902, test_loss: 1.0219, test_f1: 0.5273
 epoch: 58, train_loss: 0.7803, test_loss: 1.0206, test_f1: 0.5252
 epoch: 59, train_loss: 0.7818, test_loss: 1.0307, test_f1: 0.5144
 epoch: 60, train_loss: 0.7808, test_loss: 1.0337, test_f1: 0.5273
 epoch: 61, train_loss: 0.7785, test_loss: 1.0234, test_f1: 0.5298
 epoch: 62, train_loss: 0.7841, test_loss: 1.0356, test_f1: 0.5256
 epoch: 63, train_loss: 0.7754, test_loss: 1.0399, test_f1: 0.5318
 epoch: 64, train_loss: 0.7761, test_loss: 1.0507, test_f1: 0.5204
 epoch: 65, train_loss: 0.7645, test_loss: 1.0368, test_f1: 0.5296
 epoch: 66, train_loss: 0.7725, test_loss: 1.0467, test_f1: 0.5227
 epoch: 67, train_loss: 0.7703, test_loss: 1.0475, test_f1: 0.5125
 epoch: 68, train_loss: 0.7647, test_loss: 1.0409, test_f1: 0.5271
 epoch: 69, train_loss: 0.7651, test_loss: 1.0591, test_f1: 0.5347
 epoch: 70, train_loss: 0.7532, test_loss: 1.0752, test_f1: 0.5144
 epoch: 71, train_loss: 0.7609, test_loss: 1.0659, test_f1: 0.5270
 epoch: 72, train_loss: 0.7465, test_loss: 1.0754, test_f1: 0.5288
 epoch: 73, train_loss: 0.7505, test_loss: 1.0725, test_f1: 0.5316
 epoch: 74, train_loss: 0.7513, test_loss: 1.0623, test_f1: 0.5346
 epoch: 75, train_loss: 0.7532, test_loss: 1.0764, test_f1: 0.5275
 epoch: 76, train_loss: 0.7480, test_loss: 1.0795, test_f1: 0.5174
 epoch: 77, train_loss: 0.7445, test_loss: 1.0612, test_f1: 0.5329
 epoch: 78, train_loss: 0.7429, test_loss: 1.0767, test_f1: 0.5316
 epoch: 79, train_loss: 0.7451, test_loss: 1.0680, test_f1: 0.5223
 epoch: 80, train_loss: 0.7411, test_loss: 1.0835, test_f1: 0.5287
 epoch: 81, train_loss: 0.7400, test_loss: 1.0797, test_f1: 0.5292
 epoch: 82, train_loss: 0.7418, test_loss: 1.0966, test_f1: 0.5290
 epoch: 83, train_loss: 0.7392, test_loss: 1.0813, test_f1: 0.5296
 epoch: 84, train_loss: 0.7310, test_loss: 1.0892, test_f1: 0.5227
 epoch: 85, train_loss: 0.7289, test_loss: 1.1031, test_f1: 0.5229
 epoch: 86, train_loss: 0.7275, test_loss: 1.0939, test_f1: 0.5322
 epoch: 87, train_loss: 0.7270, test_loss: 1.1002, test_f1: 0.5267
 epoch: 88, train_loss: 0.7149, test_loss: 1.1067, test_f1: 0.5295
 epoch: 89, train_loss: 0.7380, test_loss: 1.1042, test_f1: 0.5325
 epoch: 90, train_loss: 0.7166, test_loss: 1.1180, test_f1: 0.5277
 epoch: 91, train_loss: 0.7188, test_loss: 1.1107, test_f1: 0.5335
 epoch: 92, train_loss: 0.7249, test_loss: 1.1234, test_f1: 0.5337
 epoch: 93, train_loss: 0.7092, test_loss: 1.1181, test_f1: 0.5321
 epoch: 94, train_loss: 0.7079, test_loss: 1.1479, test_f1: 0.5268
 epoch: 95, train_loss: 0.7049, test_loss: 1.1229, test_f1: 0.5315
 epoch: 96, train_loss: 0.7012, test_loss: 1.1305, test_f1: 0.5343
 epoch: 97, train_loss: 0.7033, test_loss: 1.1269, test_f1: 0.5305
 epoch: 98, train_loss: 0.7112, test_loss: 1.1442, test_f1: 0.5206
 epoch: 99, train_loss: 0.7048, test_loss: 1.1359, test_f1: 0.5270
##################ITERATION #4 ****************************************
 epoch: 0, train_loss: 1.3307, test_loss: 1.2915, test_f1: 0.2292
 epoch: 1, train_loss: 1.2419, test_loss: 1.2549, test_f1: 0.3210
 epoch: 2, train_loss: 1.2052, test_loss: 1.2154, test_f1: 0.3921
 epoch: 3, train_loss: 1.1877, test_loss: 1.1740, test_f1: 0.4251
 epoch: 4, train_loss: 1.1644, test_loss: 1.1384, test_f1: 0.4460
 epoch: 5, train_loss: 1.1460, test_loss: 1.1172, test_f1: 0.4565
 epoch: 6, train_loss: 1.1264, test_loss: 1.1008, test_f1: 0.4661
 epoch: 7, train_loss: 1.1262, test_loss: 1.0885, test_f1: 0.4598
 epoch: 8, train_loss: 1.1040, test_loss: 1.0787, test_f1: 0.4544
 epoch: 9, train_loss: 1.1023, test_loss: 1.0717, test_f1: 0.4585
 epoch: 10, train_loss: 1.0861, test_loss: 1.0617, test_f1: 0.4618
 epoch: 11, train_loss: 1.0835, test_loss: 1.0501, test_f1: 0.4584
 epoch: 12, train_loss: 1.0590, test_loss: 1.0447, test_f1: 0.4601
 epoch: 13, train_loss: 1.0501, test_loss: 1.0417, test_f1: 0.4569
 epoch: 14, train_loss: 1.0431, test_loss: 1.0345, test_f1: 0.4373
 epoch: 15, train_loss: 1.0369, test_loss: 1.0219, test_f1: 0.4598
 epoch: 16, train_loss: 1.0293, test_loss: 1.0149, test_f1: 0.4417
 epoch: 17, train_loss: 1.0219, test_loss: 1.0098, test_f1: 0.4455
 epoch: 18, train_loss: 1.0158, test_loss: 1.0097, test_f1: 0.4572
 epoch: 19, train_loss: 0.9979, test_loss: 0.9998, test_f1: 0.4521
 epoch: 20, train_loss: 1.0001, test_loss: 1.0003, test_f1: 0.4648
 epoch: 21, train_loss: 0.9924, test_loss: 0.9912, test_f1: 0.4673
 epoch: 22, train_loss: 0.9921, test_loss: 0.9892, test_f1: 0.4622
 epoch: 23, train_loss: 0.9808, test_loss: 0.9835, test_f1: 0.4647
 epoch: 24, train_loss: 0.9758, test_loss: 0.9781, test_f1: 0.4786
 epoch: 25, train_loss: 0.9558, test_loss: 0.9874, test_f1: 0.4588
 epoch: 26, train_loss: 0.9552, test_loss: 0.9735, test_f1: 0.4689
 epoch: 27, train_loss: 0.9571, test_loss: 0.9695, test_f1: 0.4781
 epoch: 28, train_loss: 0.9520, test_loss: 0.9701, test_f1: 0.4697
 epoch: 29, train_loss: 0.9439, test_loss: 0.9820, test_f1: 0.4658
 epoch: 30, train_loss: 0.9418, test_loss: 0.9670, test_f1: 0.4790
 epoch: 31, train_loss: 0.9312, test_loss: 0.9621, test_f1: 0.4873
 epoch: 32, train_loss: 0.9249, test_loss: 0.9808, test_f1: 0.4733
 epoch: 33, train_loss: 0.9281, test_loss: 0.9779, test_f1: 0.4782
 epoch: 34, train_loss: 0.9121, test_loss: 0.9624, test_f1: 0.4788
 epoch: 35, train_loss: 0.9112, test_loss: 0.9778, test_f1: 0.4647
 epoch: 36, train_loss: 0.9084, test_loss: 0.9561, test_f1: 0.4948
 epoch: 37, train_loss: 0.8928, test_loss: 0.9822, test_f1: 0.4989
 epoch: 38, train_loss: 0.8989, test_loss: 0.9718, test_f1: 0.4931
 epoch: 39, train_loss: 0.8823, test_loss: 0.9682, test_f1: 0.5006
 epoch: 40, train_loss: 0.8751, test_loss: 0.9799, test_f1: 0.5001
 epoch: 41, train_loss: 0.8720, test_loss: 0.9764, test_f1: 0.4761
 epoch: 42, train_loss: 0.8736, test_loss: 0.9840, test_f1: 0.5033
 epoch: 43, train_loss: 0.8632, test_loss: 0.9756, test_f1: 0.4683
 epoch: 44, train_loss: 0.8605, test_loss: 0.9722, test_f1: 0.4957
 epoch: 45, train_loss: 0.8502, test_loss: 0.9841, test_f1: 0.4630
 epoch: 46, train_loss: 0.8528, test_loss: 0.9698, test_f1: 0.5000
 epoch: 47, train_loss: 0.8402, test_loss: 0.9961, test_f1: 0.4923
 epoch: 48, train_loss: 0.8363, test_loss: 0.9853, test_f1: 0.4961
 epoch: 49, train_loss: 0.8411, test_loss: 1.0076, test_f1: 0.4872
 epoch: 50, train_loss: 0.8285, test_loss: 0.9721, test_f1: 0.4923
 epoch: 51, train_loss: 0.8201, test_loss: 0.9830, test_f1: 0.5033
 epoch: 52, train_loss: 0.8153, test_loss: 0.9770, test_f1: 0.4846
 epoch: 53, train_loss: 0.8133, test_loss: 0.9914, test_f1: 0.4956
 epoch: 54, train_loss: 0.8068, test_loss: 0.9944, test_f1: 0.4948
 epoch: 55, train_loss: 0.8064, test_loss: 0.9811, test_f1: 0.4909
 epoch: 56, train_loss: 0.7987, test_loss: 0.9873, test_f1: 0.5015
 epoch: 57, train_loss: 0.8124, test_loss: 0.9876, test_f1: 0.4853
 epoch: 58, train_loss: 0.7959, test_loss: 1.0017, test_f1: 0.5045
 epoch: 59, train_loss: 0.8015, test_loss: 0.9962, test_f1: 0.4992
 epoch: 60, train_loss: 0.8052, test_loss: 1.0088, test_f1: 0.4787
 epoch: 61, train_loss: 0.7884, test_loss: 1.0052, test_f1: 0.5031
 epoch: 62, train_loss: 0.7949, test_loss: 0.9961, test_f1: 0.4974
 epoch: 63, train_loss: 0.7873, test_loss: 0.9981, test_f1: 0.4971
 epoch: 64, train_loss: 0.7826, test_loss: 0.9962, test_f1: 0.4952
 epoch: 65, train_loss: 0.7850, test_loss: 0.9989, test_f1: 0.4986
 epoch: 66, train_loss: 0.7830, test_loss: 1.0067, test_f1: 0.5136
 epoch: 67, train_loss: 0.7697, test_loss: 1.0056, test_f1: 0.5061
 epoch: 68, train_loss: 0.7790, test_loss: 0.9992, test_f1: 0.4895
 epoch: 69, train_loss: 0.7736, test_loss: 1.0007, test_f1: 0.5008
 epoch: 70, train_loss: 0.7733, test_loss: 1.0030, test_f1: 0.5060
 epoch: 71, train_loss: 0.7642, test_loss: 1.0084, test_f1: 0.4993
 epoch: 72, train_loss: 0.7666, test_loss: 1.0068, test_f1: 0.4877
 epoch: 73, train_loss: 0.7659, test_loss: 1.0157, test_f1: 0.4981
 epoch: 74, train_loss: 0.7684, test_loss: 1.0133, test_f1: 0.4951
 epoch: 75, train_loss: 0.7658, test_loss: 1.0172, test_f1: 0.4912
 epoch: 76, train_loss: 0.7615, test_loss: 1.0122, test_f1: 0.4893
 epoch: 77, train_loss: 0.7515, test_loss: 1.0172, test_f1: 0.4947
 epoch: 78, train_loss: 0.7617, test_loss: 1.0238, test_f1: 0.4956
 epoch: 79, train_loss: 0.7434, test_loss: 1.0207, test_f1: 0.5082
 epoch: 80, train_loss: 0.7431, test_loss: 1.0166, test_f1: 0.5071
 epoch: 81, train_loss: 0.7494, test_loss: 1.0134, test_f1: 0.4987
 epoch: 82, train_loss: 0.7490, test_loss: 1.0250, test_f1: 0.4926
 epoch: 83, train_loss: 0.7381, test_loss: 1.0242, test_f1: 0.5100
 epoch: 84, train_loss: 0.7476, test_loss: 1.0295, test_f1: 0.5083
 epoch: 85, train_loss: 0.7380, test_loss: 1.0259, test_f1: 0.5042
 epoch: 86, train_loss: 0.7300, test_loss: 1.0369, test_f1: 0.5076
 epoch: 87, train_loss: 0.7392, test_loss: 1.0396, test_f1: 0.4946
 epoch: 88, train_loss: 0.7268, test_loss: 1.0195, test_f1: 0.5036
 epoch: 89, train_loss: 0.7334, test_loss: 1.0277, test_f1: 0.5099
 epoch: 90, train_loss: 0.7310, test_loss: 1.0380, test_f1: 0.4948
 epoch: 91, train_loss: 0.7316, test_loss: 1.0434, test_f1: 0.5027
 epoch: 92, train_loss: 0.7235, test_loss: 1.0352, test_f1: 0.4932
 epoch: 93, train_loss: 0.7206, test_loss: 1.0394, test_f1: 0.5114
 epoch: 94, train_loss: 0.7068, test_loss: 1.0468, test_f1: 0.5163
 epoch: 95, train_loss: 0.7138, test_loss: 1.0496, test_f1: 0.4997
 epoch: 96, train_loss: 0.7114, test_loss: 1.0519, test_f1: 0.5024
 epoch: 97, train_loss: 0.7142, test_loss: 1.0519, test_f1: 0.5000
 epoch: 98, train_loss: 0.7066, test_loss: 1.0523, test_f1: 0.5030
 epoch: 99, train_loss: 0.7200, test_loss: 1.0450, test_f1: 0.4958
##################ITERATION #5 ****************************************
 epoch: 0, train_loss: 1.2996, test_loss: 1.2840, test_f1: 0.2274
 epoch: 1, train_loss: 1.2196, test_loss: 1.2533, test_f1: 0.2276
 epoch: 2, train_loss: 1.1962, test_loss: 1.2082, test_f1: 0.2875
 epoch: 3, train_loss: 1.1751, test_loss: 1.1600, test_f1: 0.4209
 epoch: 4, train_loss: 1.1593, test_loss: 1.1269, test_f1: 0.4542
 epoch: 5, train_loss: 1.1381, test_loss: 1.0951, test_f1: 0.4679
 epoch: 6, train_loss: 1.1280, test_loss: 1.0747, test_f1: 0.4674
 epoch: 7, train_loss: 1.1189, test_loss: 1.0649, test_f1: 0.4612
 epoch: 8, train_loss: 1.1097, test_loss: 1.0544, test_f1: 0.4673
 epoch: 9, train_loss: 1.0885, test_loss: 1.0424, test_f1: 0.4631
 epoch: 10, train_loss: 1.0758, test_loss: 1.0338, test_f1: 0.4712
 epoch: 11, train_loss: 1.0661, test_loss: 1.0295, test_f1: 0.4698
 epoch: 12, train_loss: 1.0513, test_loss: 1.0199, test_f1: 0.4746
 epoch: 13, train_loss: 1.0379, test_loss: 1.0138, test_f1: 0.4652
 epoch: 14, train_loss: 1.0383, test_loss: 1.0044, test_f1: 0.4681
 epoch: 15, train_loss: 1.0335, test_loss: 1.0040, test_f1: 0.4704
 epoch: 16, train_loss: 1.0201, test_loss: 1.0012, test_f1: 0.4771
 epoch: 17, train_loss: 1.0120, test_loss: 0.9955, test_f1: 0.4854
 epoch: 18, train_loss: 1.0042, test_loss: 0.9884, test_f1: 0.4834
 epoch: 19, train_loss: 0.9984, test_loss: 0.9773, test_f1: 0.4865
 epoch: 20, train_loss: 0.9875, test_loss: 0.9733, test_f1: 0.4912
 epoch: 21, train_loss: 0.9796, test_loss: 0.9762, test_f1: 0.4845
 epoch: 22, train_loss: 0.9778, test_loss: 0.9706, test_f1: 0.4999
 epoch: 23, train_loss: 0.9744, test_loss: 0.9620, test_f1: 0.4895
 epoch: 24, train_loss: 0.9617, test_loss: 0.9609, test_f1: 0.4858
 epoch: 25, train_loss: 0.9530, test_loss: 0.9631, test_f1: 0.4944
 epoch: 26, train_loss: 0.9514, test_loss: 0.9620, test_f1: 0.4840
 epoch: 27, train_loss: 0.9383, test_loss: 0.9624, test_f1: 0.5033
 epoch: 28, train_loss: 0.9375, test_loss: 0.9563, test_f1: 0.4971
 epoch: 29, train_loss: 0.9248, test_loss: 0.9575, test_f1: 0.4902
 epoch: 30, train_loss: 0.9197, test_loss: 0.9468, test_f1: 0.5024
 epoch: 31, train_loss: 0.9088, test_loss: 0.9584, test_f1: 0.5088
 epoch: 32, train_loss: 0.9146, test_loss: 0.9630, test_f1: 0.5073
 epoch: 33, train_loss: 0.9082, test_loss: 0.9436, test_f1: 0.5092
 epoch: 34, train_loss: 0.8930, test_loss: 0.9491, test_f1: 0.5163
 epoch: 35, train_loss: 0.8919, test_loss: 0.9494, test_f1: 0.5238
 epoch: 36, train_loss: 0.8894, test_loss: 0.9500, test_f1: 0.5249
 epoch: 37, train_loss: 0.8909, test_loss: 0.9622, test_f1: 0.5243
 epoch: 38, train_loss: 0.8779, test_loss: 0.9470, test_f1: 0.5140
 epoch: 39, train_loss: 0.8716, test_loss: 0.9526, test_f1: 0.5119
 epoch: 40, train_loss: 0.8704, test_loss: 0.9569, test_f1: 0.5090
 epoch: 41, train_loss: 0.8608, test_loss: 0.9614, test_f1: 0.5130
 epoch: 42, train_loss: 0.8637, test_loss: 0.9590, test_f1: 0.5210
 epoch: 43, train_loss: 0.8638, test_loss: 0.9696, test_f1: 0.5079
 epoch: 44, train_loss: 0.8472, test_loss: 0.9638, test_f1: 0.5086
 epoch: 45, train_loss: 0.8471, test_loss: 0.9656, test_f1: 0.5136
 epoch: 46, train_loss: 0.8412, test_loss: 0.9595, test_f1: 0.5199
 epoch: 47, train_loss: 0.8420, test_loss: 0.9600, test_f1: 0.5213
 epoch: 48, train_loss: 0.8344, test_loss: 0.9722, test_f1: 0.5264
 epoch: 49, train_loss: 0.8281, test_loss: 0.9854, test_f1: 0.5157
 epoch: 50, train_loss: 0.8221, test_loss: 0.9798, test_f1: 0.5224
 epoch: 51, train_loss: 0.8096, test_loss: 0.9737, test_f1: 0.5313
 epoch: 52, train_loss: 0.8133, test_loss: 0.9738, test_f1: 0.5288
 epoch: 53, train_loss: 0.8060, test_loss: 0.9620, test_f1: 0.5378
 epoch: 54, train_loss: 0.8082, test_loss: 0.9711, test_f1: 0.5219
 epoch: 55, train_loss: 0.8017, test_loss: 0.9725, test_f1: 0.5306
 epoch: 56, train_loss: 0.7989, test_loss: 0.9804, test_f1: 0.5207
 epoch: 57, train_loss: 0.7968, test_loss: 0.9985, test_f1: 0.5082
 epoch: 58, train_loss: 0.7974, test_loss: 1.0068, test_f1: 0.5084
 epoch: 59, train_loss: 0.7884, test_loss: 1.0076, test_f1: 0.5107
 epoch: 60, train_loss: 0.7894, test_loss: 0.9893, test_f1: 0.5219
 epoch: 61, train_loss: 0.7913, test_loss: 1.0049, test_f1: 0.5160
 epoch: 62, train_loss: 0.7814, test_loss: 1.0157, test_f1: 0.5132
 epoch: 63, train_loss: 0.7799, test_loss: 1.0056, test_f1: 0.5127
 epoch: 64, train_loss: 0.7757, test_loss: 0.9971, test_f1: 0.5174
 epoch: 65, train_loss: 0.7751, test_loss: 0.9988, test_f1: 0.5201
 epoch: 66, train_loss: 0.7832, test_loss: 1.0017, test_f1: 0.5089
 epoch: 67, train_loss: 0.7720, test_loss: 1.0238, test_f1: 0.4974
 epoch: 68, train_loss: 0.7621, test_loss: 1.0237, test_f1: 0.5036
 epoch: 69, train_loss: 0.7565, test_loss: 1.0086, test_f1: 0.5024
 epoch: 70, train_loss: 0.7618, test_loss: 1.0129, test_f1: 0.5187
 epoch: 71, train_loss: 0.7708, test_loss: 1.0377, test_f1: 0.5132
 epoch: 72, train_loss: 0.7660, test_loss: 1.0278, test_f1: 0.5109
 epoch: 73, train_loss: 0.7612, test_loss: 1.0459, test_f1: 0.5094
 epoch: 74, train_loss: 0.7603, test_loss: 1.0388, test_f1: 0.4949
 epoch: 75, train_loss: 0.7507, test_loss: 1.0487, test_f1: 0.4987
 epoch: 76, train_loss: 0.7558, test_loss: 1.0729, test_f1: 0.5106
 epoch: 77, train_loss: 0.7448, test_loss: 1.0444, test_f1: 0.4952
 epoch: 78, train_loss: 0.7536, test_loss: 1.0829, test_f1: 0.4836
 epoch: 79, train_loss: 0.7447, test_loss: 1.0683, test_f1: 0.4909
 epoch: 80, train_loss: 0.7453, test_loss: 1.0347, test_f1: 0.5211
 epoch: 81, train_loss: 0.7390, test_loss: 1.0429, test_f1: 0.5050
 epoch: 82, train_loss: 0.7422, test_loss: 1.0590, test_f1: 0.4909
 epoch: 83, train_loss: 0.7288, test_loss: 1.0427, test_f1: 0.5100
 epoch: 84, train_loss: 0.7226, test_loss: 1.0443, test_f1: 0.5130
 epoch: 85, train_loss: 0.7261, test_loss: 1.1181, test_f1: 0.4796
 epoch: 86, train_loss: 0.7262, test_loss: 1.0864, test_f1: 0.4989
 epoch: 87, train_loss: 0.7264, test_loss: 1.0566, test_f1: 0.5174
 epoch: 88, train_loss: 0.7296, test_loss: 1.0841, test_f1: 0.4879
 epoch: 89, train_loss: 0.7150, test_loss: 1.0781, test_f1: 0.5096
 epoch: 90, train_loss: 0.7201, test_loss: 1.1011, test_f1: 0.5099
 epoch: 91, train_loss: 0.7284, test_loss: 1.1202, test_f1: 0.4893
 epoch: 92, train_loss: 0.7196, test_loss: 1.1324, test_f1: 0.4935
 epoch: 93, train_loss: 0.7178, test_loss: 1.0672, test_f1: 0.5268
 epoch: 94, train_loss: 0.7050, test_loss: 1.0729, test_f1: 0.4937
 epoch: 95, train_loss: 0.7006, test_loss: 1.1587, test_f1: 0.4863
 epoch: 96, train_loss: 0.6992, test_loss: 1.1013, test_f1: 0.5073
 epoch: 97, train_loss: 0.7096, test_loss: 1.0900, test_f1: 0.5135
 epoch: 98, train_loss: 0.7052, test_loss: 1.1017, test_f1: 0.4995
 epoch: 99, train_loss: 0.7036, test_loss: 1.1019, test_f1: 0.4938
##################ITERATION #6 ****************************************
 epoch: 0, train_loss: 1.3516, test_loss: 1.2826, test_f1: 0.2416
 epoch: 1, train_loss: 1.2681, test_loss: 1.2376, test_f1: 0.2869
 epoch: 2, train_loss: 1.2232, test_loss: 1.1888, test_f1: 0.3903
 epoch: 3, train_loss: 1.2016, test_loss: 1.1479, test_f1: 0.4445
 epoch: 4, train_loss: 1.1921, test_loss: 1.1222, test_f1: 0.4561
 epoch: 5, train_loss: 1.1635, test_loss: 1.1082, test_f1: 0.4554
 epoch: 6, train_loss: 1.1434, test_loss: 1.0967, test_f1: 0.4512
 epoch: 7, train_loss: 1.1337, test_loss: 1.0847, test_f1: 0.4433
 epoch: 8, train_loss: 1.1273, test_loss: 1.0770, test_f1: 0.4447
 epoch: 9, train_loss: 1.1121, test_loss: 1.0677, test_f1: 0.4465
 epoch: 10, train_loss: 1.0909, test_loss: 1.0645, test_f1: 0.4458
 epoch: 11, train_loss: 1.0836, test_loss: 1.0570, test_f1: 0.4486
 epoch: 12, train_loss: 1.0876, test_loss: 1.0504, test_f1: 0.4513
 epoch: 13, train_loss: 1.0749, test_loss: 1.0463, test_f1: 0.4510
 epoch: 14, train_loss: 1.0576, test_loss: 1.0401, test_f1: 0.4630
 epoch: 15, train_loss: 1.0623, test_loss: 1.0334, test_f1: 0.4589
 epoch: 16, train_loss: 1.0402, test_loss: 1.0279, test_f1: 0.4547
 epoch: 17, train_loss: 1.0362, test_loss: 1.0212, test_f1: 0.4611
 epoch: 18, train_loss: 1.0258, test_loss: 1.0137, test_f1: 0.4665
 epoch: 19, train_loss: 1.0182, test_loss: 1.0121, test_f1: 0.4685
 epoch: 20, train_loss: 1.0100, test_loss: 1.0076, test_f1: 0.4696
 epoch: 21, train_loss: 1.0033, test_loss: 1.0020, test_f1: 0.4546
 epoch: 22, train_loss: 0.9964, test_loss: 0.9957, test_f1: 0.4730
 epoch: 23, train_loss: 0.9941, test_loss: 0.9912, test_f1: 0.4692
 epoch: 24, train_loss: 0.9914, test_loss: 0.9819, test_f1: 0.4675
 epoch: 25, train_loss: 0.9773, test_loss: 0.9872, test_f1: 0.4490
 epoch: 26, train_loss: 0.9704, test_loss: 0.9769, test_f1: 0.4423
 epoch: 27, train_loss: 0.9733, test_loss: 0.9719, test_f1: 0.4568
 epoch: 28, train_loss: 0.9616, test_loss: 0.9709, test_f1: 0.4607
 epoch: 29, train_loss: 0.9464, test_loss: 0.9679, test_f1: 0.4633
 epoch: 30, train_loss: 0.9421, test_loss: 0.9616, test_f1: 0.4793
 epoch: 31, train_loss: 0.9462, test_loss: 0.9689, test_f1: 0.4719
 epoch: 32, train_loss: 0.9386, test_loss: 0.9677, test_f1: 0.4703
 epoch: 33, train_loss: 0.9180, test_loss: 0.9599, test_f1: 0.4771
 epoch: 34, train_loss: 0.9254, test_loss: 0.9487, test_f1: 0.4927
 epoch: 35, train_loss: 0.9199, test_loss: 0.9593, test_f1: 0.4802
 epoch: 36, train_loss: 0.9183, test_loss: 0.9551, test_f1: 0.4979
 epoch: 37, train_loss: 0.9119, test_loss: 0.9532, test_f1: 0.4889
 epoch: 38, train_loss: 0.9035, test_loss: 0.9557, test_f1: 0.4972
 epoch: 39, train_loss: 0.9122, test_loss: 0.9464, test_f1: 0.5065
 epoch: 40, train_loss: 0.8930, test_loss: 0.9468, test_f1: 0.4953
 epoch: 41, train_loss: 0.8853, test_loss: 0.9505, test_f1: 0.5053
 epoch: 42, train_loss: 0.8929, test_loss: 0.9467, test_f1: 0.5079
 epoch: 43, train_loss: 0.8817, test_loss: 0.9487, test_f1: 0.4850
 epoch: 44, train_loss: 0.8845, test_loss: 0.9317, test_f1: 0.4984
 epoch: 45, train_loss: 0.8772, test_loss: 0.9521, test_f1: 0.4898
 epoch: 46, train_loss: 0.8798, test_loss: 0.9524, test_f1: 0.4875
 epoch: 47, train_loss: 0.8649, test_loss: 0.9687, test_f1: 0.4875
 epoch: 48, train_loss: 0.8551, test_loss: 0.9333, test_f1: 0.4980
 epoch: 49, train_loss: 0.8489, test_loss: 0.9607, test_f1: 0.4830
 epoch: 50, train_loss: 0.8524, test_loss: 0.9586, test_f1: 0.5041
 epoch: 51, train_loss: 0.8504, test_loss: 0.9515, test_f1: 0.5211
 epoch: 52, train_loss: 0.8466, test_loss: 0.9535, test_f1: 0.5015
 epoch: 53, train_loss: 0.8359, test_loss: 0.9540, test_f1: 0.4973
 epoch: 54, train_loss: 0.8250, test_loss: 0.9502, test_f1: 0.5062
 epoch: 55, train_loss: 0.8363, test_loss: 0.9521, test_f1: 0.4903
 epoch: 56, train_loss: 0.8279, test_loss: 0.9476, test_f1: 0.5050
 epoch: 57, train_loss: 0.8244, test_loss: 0.9587, test_f1: 0.5035
 epoch: 58, train_loss: 0.8237, test_loss: 0.9495, test_f1: 0.5051
 epoch: 59, train_loss: 0.8314, test_loss: 0.9489, test_f1: 0.5053
 epoch: 60, train_loss: 0.8214, test_loss: 0.9646, test_f1: 0.4898
 epoch: 61, train_loss: 0.8245, test_loss: 0.9680, test_f1: 0.4954
 epoch: 62, train_loss: 0.8094, test_loss: 0.9613, test_f1: 0.4980
 epoch: 63, train_loss: 0.8123, test_loss: 0.9854, test_f1: 0.4985
 epoch: 64, train_loss: 0.8201, test_loss: 0.9613, test_f1: 0.4982
 epoch: 65, train_loss: 0.8111, test_loss: 0.9661, test_f1: 0.4997
 epoch: 66, train_loss: 0.8063, test_loss: 0.9708, test_f1: 0.4987
 epoch: 67, train_loss: 0.8076, test_loss: 0.9674, test_f1: 0.4941
 epoch: 68, train_loss: 0.8085, test_loss: 0.9818, test_f1: 0.4971
 epoch: 69, train_loss: 0.7973, test_loss: 0.9783, test_f1: 0.5025
 epoch: 70, train_loss: 0.8077, test_loss: 0.9674, test_f1: 0.4986
 epoch: 71, train_loss: 0.7954, test_loss: 0.9862, test_f1: 0.4989
 epoch: 72, train_loss: 0.7855, test_loss: 0.9821, test_f1: 0.5163
 epoch: 73, train_loss: 0.7909, test_loss: 0.9673, test_f1: 0.5112
 epoch: 74, train_loss: 0.7907, test_loss: 0.9799, test_f1: 0.5060
 epoch: 75, train_loss: 0.7903, test_loss: 0.9753, test_f1: 0.5139
 epoch: 76, train_loss: 0.7901, test_loss: 0.9866, test_f1: 0.5027
 epoch: 77, train_loss: 0.7896, test_loss: 0.9791, test_f1: 0.5143
 epoch: 78, train_loss: 0.7747, test_loss: 0.9934, test_f1: 0.5087
 epoch: 79, train_loss: 0.7806, test_loss: 0.9809, test_f1: 0.5053
 epoch: 80, train_loss: 0.7754, test_loss: 0.9846, test_f1: 0.5148
 epoch: 81, train_loss: 0.7794, test_loss: 1.0171, test_f1: 0.5079
 epoch: 82, train_loss: 0.7782, test_loss: 0.9905, test_f1: 0.5239
 epoch: 83, train_loss: 0.7735, test_loss: 0.9944, test_f1: 0.5008
 epoch: 84, train_loss: 0.7766, test_loss: 0.9901, test_f1: 0.5010
 epoch: 85, train_loss: 0.7823, test_loss: 0.9945, test_f1: 0.5220
 epoch: 86, train_loss: 0.7633, test_loss: 0.9942, test_f1: 0.5149
 epoch: 87, train_loss: 0.7662, test_loss: 0.9854, test_f1: 0.5171
 epoch: 88, train_loss: 0.7617, test_loss: 1.0039, test_f1: 0.5100
 epoch: 89, train_loss: 0.7558, test_loss: 0.9916, test_f1: 0.5214
 epoch: 90, train_loss: 0.7579, test_loss: 1.0047, test_f1: 0.5235
 epoch: 91, train_loss: 0.7698, test_loss: 1.0173, test_f1: 0.5228
 epoch: 92, train_loss: 0.7585, test_loss: 1.0193, test_f1: 0.5305
 epoch: 93, train_loss: 0.7561, test_loss: 1.0046, test_f1: 0.5223
 epoch: 94, train_loss: 0.7399, test_loss: 1.0217, test_f1: 0.5173
 epoch: 95, train_loss: 0.7555, test_loss: 1.0086, test_f1: 0.5291
 epoch: 96, train_loss: 0.7377, test_loss: 1.0125, test_f1: 0.5287
 epoch: 97, train_loss: 0.7368, test_loss: 1.0352, test_f1: 0.5233
 epoch: 98, train_loss: 0.7470, test_loss: 1.0299, test_f1: 0.5247
 epoch: 99, train_loss: 0.7384, test_loss: 1.0268, test_f1: 0.5137
##################ITERATION #7 ****************************************
 epoch: 0, train_loss: 1.3597, test_loss: 1.2658, test_f1: 0.2274
 epoch: 1, train_loss: 1.2490, test_loss: 1.2315, test_f1: 0.2870
 epoch: 2, train_loss: 1.2150, test_loss: 1.1968, test_f1: 0.2920
 epoch: 3, train_loss: 1.1914, test_loss: 1.1543, test_f1: 0.4173
 epoch: 4, train_loss: 1.1758, test_loss: 1.1190, test_f1: 0.4653
 epoch: 5, train_loss: 1.1707, test_loss: 1.0922, test_f1: 0.4879
 epoch: 6, train_loss: 1.1374, test_loss: 1.0779, test_f1: 0.4869
 epoch: 7, train_loss: 1.1423, test_loss: 1.0631, test_f1: 0.4828
 epoch: 8, train_loss: 1.1119, test_loss: 1.0571, test_f1: 0.4900
 epoch: 9, train_loss: 1.1048, test_loss: 1.0478, test_f1: 0.4812
 epoch: 10, train_loss: 1.0896, test_loss: 1.0367, test_f1: 0.4852
 epoch: 11, train_loss: 1.0762, test_loss: 1.0316, test_f1: 0.4891
 epoch: 12, train_loss: 1.0659, test_loss: 1.0261, test_f1: 0.4922
 epoch: 13, train_loss: 1.0597, test_loss: 1.0159, test_f1: 0.4922
 epoch: 14, train_loss: 1.0430, test_loss: 1.0130, test_f1: 0.4844
 epoch: 15, train_loss: 1.0446, test_loss: 1.0054, test_f1: 0.4811
 epoch: 16, train_loss: 1.0269, test_loss: 0.9999, test_f1: 0.4815
 epoch: 17, train_loss: 1.0237, test_loss: 0.9998, test_f1: 0.4794
 epoch: 18, train_loss: 1.0178, test_loss: 0.9953, test_f1: 0.4834
 epoch: 19, train_loss: 1.0102, test_loss: 0.9919, test_f1: 0.4835
 epoch: 20, train_loss: 0.9973, test_loss: 0.9766, test_f1: 0.4850
 epoch: 21, train_loss: 0.9856, test_loss: 0.9801, test_f1: 0.4821
 epoch: 22, train_loss: 0.9767, test_loss: 0.9776, test_f1: 0.4923
 epoch: 23, train_loss: 0.9663, test_loss: 0.9766, test_f1: 0.4933
 epoch: 24, train_loss: 0.9533, test_loss: 0.9798, test_f1: 0.4901
 epoch: 25, train_loss: 0.9675, test_loss: 0.9742, test_f1: 0.4918
 epoch: 26, train_loss: 0.9553, test_loss: 0.9725, test_f1: 0.4910
 epoch: 27, train_loss: 0.9377, test_loss: 0.9661, test_f1: 0.5000
 epoch: 28, train_loss: 0.9319, test_loss: 0.9681, test_f1: 0.5056
 epoch: 29, train_loss: 0.9304, test_loss: 0.9638, test_f1: 0.4983
 epoch: 30, train_loss: 0.9079, test_loss: 0.9635, test_f1: 0.4940
 epoch: 31, train_loss: 0.9175, test_loss: 0.9601, test_f1: 0.4979
 epoch: 32, train_loss: 0.9075, test_loss: 0.9662, test_f1: 0.4888
 epoch: 33, train_loss: 0.9098, test_loss: 0.9691, test_f1: 0.5019
 epoch: 34, train_loss: 0.8917, test_loss: 0.9708, test_f1: 0.5022
 epoch: 35, train_loss: 0.8995, test_loss: 0.9768, test_f1: 0.5101
 epoch: 36, train_loss: 0.8881, test_loss: 0.9725, test_f1: 0.4976
 epoch: 37, train_loss: 0.8781, test_loss: 0.9690, test_f1: 0.5056
 epoch: 38, train_loss: 0.8729, test_loss: 0.9746, test_f1: 0.5040
 epoch: 39, train_loss: 0.8776, test_loss: 0.9911, test_f1: 0.5059
 epoch: 40, train_loss: 0.8584, test_loss: 0.9761, test_f1: 0.4943
 epoch: 41, train_loss: 0.8626, test_loss: 0.9891, test_f1: 0.5134
 epoch: 42, train_loss: 0.8522, test_loss: 0.9906, test_f1: 0.5042
 epoch: 43, train_loss: 0.8507, test_loss: 0.9956, test_f1: 0.5208
 epoch: 44, train_loss: 0.8326, test_loss: 0.9896, test_f1: 0.4985
 epoch: 45, train_loss: 0.8335, test_loss: 1.0043, test_f1: 0.5089
 epoch: 46, train_loss: 0.8265, test_loss: 1.0165, test_f1: 0.5032
 epoch: 47, train_loss: 0.8277, test_loss: 1.0203, test_f1: 0.5085
 epoch: 48, train_loss: 0.8209, test_loss: 1.0264, test_f1: 0.5199
 epoch: 49, train_loss: 0.8110, test_loss: 1.0290, test_f1: 0.5159
 epoch: 50, train_loss: 0.8061, test_loss: 1.0382, test_f1: 0.5212
 epoch: 51, train_loss: 0.7967, test_loss: 1.0418, test_f1: 0.5241
 epoch: 52, train_loss: 0.8001, test_loss: 1.0393, test_f1: 0.5220
 epoch: 53, train_loss: 0.7881, test_loss: 1.0306, test_f1: 0.5251
 epoch: 54, train_loss: 0.7915, test_loss: 1.0415, test_f1: 0.5166
 epoch: 55, train_loss: 0.7987, test_loss: 1.0513, test_f1: 0.5167
 epoch: 56, train_loss: 0.7943, test_loss: 1.0459, test_f1: 0.5216
 epoch: 57, train_loss: 0.7827, test_loss: 1.0429, test_f1: 0.5266
 epoch: 58, train_loss: 0.7752, test_loss: 1.0428, test_f1: 0.5288
 epoch: 59, train_loss: 0.7742, test_loss: 1.0528, test_f1: 0.5397
 epoch: 60, train_loss: 0.7640, test_loss: 1.0492, test_f1: 0.5236
 epoch: 61, train_loss: 0.7668, test_loss: 1.0528, test_f1: 0.5363
 epoch: 62, train_loss: 0.7676, test_loss: 1.0510, test_f1: 0.5243
 epoch: 63, train_loss: 0.7730, test_loss: 1.0514, test_f1: 0.5336
 epoch: 64, train_loss: 0.7652, test_loss: 1.0719, test_f1: 0.5346
 epoch: 65, train_loss: 0.7600, test_loss: 1.0619, test_f1: 0.5318
 epoch: 66, train_loss: 0.7569, test_loss: 1.0687, test_f1: 0.5273
 epoch: 67, train_loss: 0.7729, test_loss: 1.0612, test_f1: 0.5460
 epoch: 68, train_loss: 0.7550, test_loss: 1.0703, test_f1: 0.5510
 epoch: 69, train_loss: 0.7474, test_loss: 1.0815, test_f1: 0.5301
 epoch: 70, train_loss: 0.7609, test_loss: 1.0744, test_f1: 0.5438
 epoch: 71, train_loss: 0.7417, test_loss: 1.0674, test_f1: 0.5448
 epoch: 72, train_loss: 0.7357, test_loss: 1.0754, test_f1: 0.5438
 epoch: 73, train_loss: 0.7427, test_loss: 1.0863, test_f1: 0.5379
 epoch: 74, train_loss: 0.7491, test_loss: 1.0860, test_f1: 0.5357
 epoch: 75, train_loss: 0.7370, test_loss: 1.0930, test_f1: 0.5269
 epoch: 76, train_loss: 0.7324, test_loss: 1.1037, test_f1: 0.5344
 epoch: 77, train_loss: 0.7267, test_loss: 1.0863, test_f1: 0.5302
 epoch: 78, train_loss: 0.7301, test_loss: 1.0821, test_f1: 0.5527
 epoch: 79, train_loss: 0.7295, test_loss: 1.0975, test_f1: 0.5359
 epoch: 80, train_loss: 0.7296, test_loss: 1.0974, test_f1: 0.5496
 epoch: 81, train_loss: 0.7280, test_loss: 1.1055, test_f1: 0.5505
 epoch: 82, train_loss: 0.7248, test_loss: 1.1088, test_f1: 0.5445
 epoch: 83, train_loss: 0.7257, test_loss: 1.1019, test_f1: 0.5432
 epoch: 84, train_loss: 0.7089, test_loss: 1.1210, test_f1: 0.5334
 epoch: 85, train_loss: 0.7383, test_loss: 1.1007, test_f1: 0.5391
 epoch: 86, train_loss: 0.7129, test_loss: 1.1099, test_f1: 0.5245
 epoch: 87, train_loss: 0.7064, test_loss: 1.1174, test_f1: 0.5452
 epoch: 88, train_loss: 0.7162, test_loss: 1.1220, test_f1: 0.5302
 epoch: 89, train_loss: 0.7166, test_loss: 1.1393, test_f1: 0.5415
 epoch: 90, train_loss: 0.7065, test_loss: 1.1206, test_f1: 0.5524
 epoch: 91, train_loss: 0.7075, test_loss: 1.1370, test_f1: 0.5455
 epoch: 92, train_loss: 0.7003, test_loss: 1.1326, test_f1: 0.5571
 epoch: 93, train_loss: 0.7112, test_loss: 1.1355, test_f1: 0.5371
 epoch: 94, train_loss: 0.6850, test_loss: 1.1312, test_f1: 0.5379
 epoch: 95, train_loss: 0.7085, test_loss: 1.1387, test_f1: 0.5371
 epoch: 96, train_loss: 0.6916, test_loss: 1.1396, test_f1: 0.5377
 epoch: 97, train_loss: 0.6916, test_loss: 1.1350, test_f1: 0.5412
 epoch: 98, train_loss: 0.6978, test_loss: 1.1346, test_f1: 0.5531
 epoch: 99, train_loss: 0.6921, test_loss: 1.1394, test_f1: 0.5623
##################ITERATION #8 ****************************************
 epoch: 0, train_loss: 1.4090, test_loss: 1.2947, test_f1: 0.2459
 epoch: 1, train_loss: 1.2765, test_loss: 1.2574, test_f1: 0.2869
 epoch: 2, train_loss: 1.2353, test_loss: 1.2134, test_f1: 0.3551
 epoch: 3, train_loss: 1.1957, test_loss: 1.1610, test_f1: 0.4323
 epoch: 4, train_loss: 1.1875, test_loss: 1.1246, test_f1: 0.4425
 epoch: 5, train_loss: 1.1678, test_loss: 1.1065, test_f1: 0.4503
 epoch: 6, train_loss: 1.1485, test_loss: 1.0923, test_f1: 0.4521
 epoch: 7, train_loss: 1.1353, test_loss: 1.0781, test_f1: 0.4560
 epoch: 8, train_loss: 1.1273, test_loss: 1.0696, test_f1: 0.4533
 epoch: 9, train_loss: 1.1084, test_loss: 1.0626, test_f1: 0.4517
 epoch: 10, train_loss: 1.0801, test_loss: 1.0506, test_f1: 0.4528
 epoch: 11, train_loss: 1.0783, test_loss: 1.0440, test_f1: 0.4683
 epoch: 12, train_loss: 1.0731, test_loss: 1.0330, test_f1: 0.4684
 epoch: 13, train_loss: 1.0633, test_loss: 1.0186, test_f1: 0.4571
 epoch: 14, train_loss: 1.0571, test_loss: 1.0204, test_f1: 0.4611
 epoch: 15, train_loss: 1.0459, test_loss: 1.0068, test_f1: 0.4676
 epoch: 16, train_loss: 1.0332, test_loss: 1.0032, test_f1: 0.4679
 epoch: 17, train_loss: 1.0204, test_loss: 1.0000, test_f1: 0.4681
 epoch: 18, train_loss: 1.0105, test_loss: 0.9923, test_f1: 0.4790
 epoch: 19, train_loss: 1.0020, test_loss: 0.9917, test_f1: 0.4734
 epoch: 20, train_loss: 0.9884, test_loss: 0.9852, test_f1: 0.4731
 epoch: 21, train_loss: 0.9881, test_loss: 0.9792, test_f1: 0.4796
 epoch: 22, train_loss: 0.9789, test_loss: 0.9794, test_f1: 0.4716
 epoch: 23, train_loss: 0.9712, test_loss: 0.9839, test_f1: 0.4761
 epoch: 24, train_loss: 0.9710, test_loss: 0.9642, test_f1: 0.4836
 epoch: 25, train_loss: 0.9541, test_loss: 0.9606, test_f1: 0.4836
 epoch: 26, train_loss: 0.9615, test_loss: 0.9645, test_f1: 0.4679
 epoch: 27, train_loss: 0.9541, test_loss: 0.9547, test_f1: 0.4939
 epoch: 28, train_loss: 0.9435, test_loss: 0.9591, test_f1: 0.4830
 epoch: 29, train_loss: 0.9316, test_loss: 0.9559, test_f1: 0.4850
 epoch: 30, train_loss: 0.9343, test_loss: 0.9586, test_f1: 0.4819
 epoch: 31, train_loss: 0.9281, test_loss: 0.9581, test_f1: 0.4841
 epoch: 32, train_loss: 0.9175, test_loss: 0.9549, test_f1: 0.4983
 epoch: 33, train_loss: 0.9066, test_loss: 0.9532, test_f1: 0.4813
 epoch: 34, train_loss: 0.9094, test_loss: 0.9579, test_f1: 0.4880
 epoch: 35, train_loss: 0.9161, test_loss: 0.9637, test_f1: 0.4811
 epoch: 36, train_loss: 0.8973, test_loss: 0.9584, test_f1: 0.4938
 epoch: 37, train_loss: 0.8939, test_loss: 0.9655, test_f1: 0.4785
 epoch: 38, train_loss: 0.8841, test_loss: 0.9559, test_f1: 0.4897
 epoch: 39, train_loss: 0.8810, test_loss: 0.9658, test_f1: 0.4919
 epoch: 40, train_loss: 0.8766, test_loss: 0.9516, test_f1: 0.4774
 epoch: 41, train_loss: 0.8698, test_loss: 0.9566, test_f1: 0.4993
 epoch: 42, train_loss: 0.8696, test_loss: 0.9549, test_f1: 0.4933
 epoch: 43, train_loss: 0.8634, test_loss: 0.9667, test_f1: 0.4940
 epoch: 44, train_loss: 0.8523, test_loss: 0.9639, test_f1: 0.4992
 epoch: 45, train_loss: 0.8619, test_loss: 0.9664, test_f1: 0.4876
 epoch: 46, train_loss: 0.8467, test_loss: 0.9571, test_f1: 0.4995
 epoch: 47, train_loss: 0.8522, test_loss: 0.9622, test_f1: 0.4852
 epoch: 48, train_loss: 0.8424, test_loss: 0.9536, test_f1: 0.4957
 epoch: 49, train_loss: 0.8353, test_loss: 0.9665, test_f1: 0.4983
 epoch: 50, train_loss: 0.8317, test_loss: 0.9596, test_f1: 0.5020
 epoch: 51, train_loss: 0.8166, test_loss: 0.9608, test_f1: 0.4896
 epoch: 52, train_loss: 0.8188, test_loss: 0.9624, test_f1: 0.4873
 epoch: 53, train_loss: 0.8171, test_loss: 0.9588, test_f1: 0.4955
 epoch: 54, train_loss: 0.8194, test_loss: 0.9561, test_f1: 0.4936
 epoch: 55, train_loss: 0.7993, test_loss: 0.9589, test_f1: 0.4957
 epoch: 56, train_loss: 0.8030, test_loss: 0.9713, test_f1: 0.5006
 epoch: 57, train_loss: 0.8053, test_loss: 0.9735, test_f1: 0.5049
 epoch: 58, train_loss: 0.8020, test_loss: 0.9635, test_f1: 0.4936
 epoch: 59, train_loss: 0.8067, test_loss: 0.9575, test_f1: 0.4981
 epoch: 60, train_loss: 0.8016, test_loss: 0.9611, test_f1: 0.4846
 epoch: 61, train_loss: 0.7992, test_loss: 0.9639, test_f1: 0.4900
 epoch: 62, train_loss: 0.7985, test_loss: 0.9551, test_f1: 0.4983
 epoch: 63, train_loss: 0.7905, test_loss: 0.9677, test_f1: 0.4885
 epoch: 64, train_loss: 0.7964, test_loss: 0.9640, test_f1: 0.4844
 epoch: 65, train_loss: 0.8017, test_loss: 0.9767, test_f1: 0.4628
 epoch: 66, train_loss: 0.7828, test_loss: 0.9710, test_f1: 0.4948
 epoch: 67, train_loss: 0.7852, test_loss: 0.9722, test_f1: 0.4939
 epoch: 68, train_loss: 0.7827, test_loss: 0.9679, test_f1: 0.5016
 epoch: 69, train_loss: 0.7809, test_loss: 0.9841, test_f1: 0.4946
 epoch: 70, train_loss: 0.7760, test_loss: 0.9792, test_f1: 0.4978
 epoch: 71, train_loss: 0.7781, test_loss: 0.9760, test_f1: 0.5089
 epoch: 72, train_loss: 0.7810, test_loss: 0.9785, test_f1: 0.5071
 epoch: 73, train_loss: 0.7718, test_loss: 0.9849, test_f1: 0.5028
 epoch: 74, train_loss: 0.7615, test_loss: 0.9859, test_f1: 0.4951
 epoch: 75, train_loss: 0.7669, test_loss: 0.9883, test_f1: 0.4973
 epoch: 76, train_loss: 0.7688, test_loss: 0.9900, test_f1: 0.4925
 epoch: 77, train_loss: 0.7665, test_loss: 1.0007, test_f1: 0.4998
 epoch: 78, train_loss: 0.7705, test_loss: 0.9789, test_f1: 0.5052
 epoch: 79, train_loss: 0.7737, test_loss: 0.9830, test_f1: 0.4990
 epoch: 80, train_loss: 0.7614, test_loss: 1.0014, test_f1: 0.4899
 epoch: 81, train_loss: 0.7468, test_loss: 0.9950, test_f1: 0.5021
 epoch: 82, train_loss: 0.7636, test_loss: 0.9983, test_f1: 0.4979
 epoch: 83, train_loss: 0.7466, test_loss: 1.0100, test_f1: 0.4840
 epoch: 84, train_loss: 0.7575, test_loss: 1.0052, test_f1: 0.4827
 epoch: 85, train_loss: 0.7424, test_loss: 0.9998, test_f1: 0.4988
 epoch: 86, train_loss: 0.7483, test_loss: 0.9967, test_f1: 0.5178
 epoch: 87, train_loss: 0.7534, test_loss: 1.0096, test_f1: 0.4842
 epoch: 88, train_loss: 0.7463, test_loss: 0.9953, test_f1: 0.5041
 epoch: 89, train_loss: 0.7438, test_loss: 0.9982, test_f1: 0.5103
 epoch: 90, train_loss: 0.7407, test_loss: 1.0047, test_f1: 0.5044
 epoch: 91, train_loss: 0.7285, test_loss: 0.9956, test_f1: 0.5075
 epoch: 92, train_loss: 0.7412, test_loss: 0.9924, test_f1: 0.5073
 epoch: 93, train_loss: 0.7407, test_loss: 1.0235, test_f1: 0.4762
 epoch: 94, train_loss: 0.7315, test_loss: 1.0145, test_f1: 0.4966
 epoch: 95, train_loss: 0.7309, test_loss: 1.0238, test_f1: 0.5113
 epoch: 96, train_loss: 0.7245, test_loss: 1.0264, test_f1: 0.5041
 epoch: 97, train_loss: 0.7266, test_loss: 0.9966, test_f1: 0.4997
 epoch: 98, train_loss: 0.7198, test_loss: 1.0108, test_f1: 0.5026
 epoch: 99, train_loss: 0.7100, test_loss: 1.0094, test_f1: 0.5069
##################ITERATION #9 ****************************************
 epoch: 0, train_loss: 1.3603, test_loss: 1.2610, test_f1: 0.3218
 epoch: 1, train_loss: 1.2595, test_loss: 1.1881, test_f1: 0.3379
 epoch: 2, train_loss: 1.2182, test_loss: 1.1428, test_f1: 0.4342
 epoch: 3, train_loss: 1.1800, test_loss: 1.1020, test_f1: 0.4754
 epoch: 4, train_loss: 1.1638, test_loss: 1.0797, test_f1: 0.4760
 epoch: 5, train_loss: 1.1687, test_loss: 1.0673, test_f1: 0.4674
 epoch: 6, train_loss: 1.1421, test_loss: 1.0644, test_f1: 0.4770
 epoch: 7, train_loss: 1.1207, test_loss: 1.0522, test_f1: 0.4692
 epoch: 8, train_loss: 1.1097, test_loss: 1.0486, test_f1: 0.4742
 epoch: 9, train_loss: 1.1071, test_loss: 1.0430, test_f1: 0.4507
 epoch: 10, train_loss: 1.1036, test_loss: 1.0369, test_f1: 0.4498
 epoch: 11, train_loss: 1.0758, test_loss: 1.0302, test_f1: 0.4535
 epoch: 12, train_loss: 1.0775, test_loss: 1.0202, test_f1: 0.4613
 epoch: 13, train_loss: 1.0614, test_loss: 1.0148, test_f1: 0.4742
 epoch: 14, train_loss: 1.0529, test_loss: 1.0060, test_f1: 0.4700
 epoch: 15, train_loss: 1.0543, test_loss: 1.0068, test_f1: 0.4770
 epoch: 16, train_loss: 1.0487, test_loss: 1.0017, test_f1: 0.4886
 epoch: 17, train_loss: 1.0182, test_loss: 0.9978, test_f1: 0.4996
 epoch: 18, train_loss: 1.0297, test_loss: 0.9893, test_f1: 0.4940
 epoch: 19, train_loss: 1.0293, test_loss: 0.9870, test_f1: 0.4965
 epoch: 20, train_loss: 1.0102, test_loss: 0.9859, test_f1: 0.4932
 epoch: 21, train_loss: 1.0083, test_loss: 0.9866, test_f1: 0.4966
 epoch: 22, train_loss: 1.0047, test_loss: 0.9828, test_f1: 0.5000
 epoch: 23, train_loss: 1.0007, test_loss: 0.9834, test_f1: 0.4978
 epoch: 24, train_loss: 0.9856, test_loss: 0.9739, test_f1: 0.5080
 epoch: 25, train_loss: 0.9820, test_loss: 0.9745, test_f1: 0.5036
 epoch: 26, train_loss: 0.9771, test_loss: 0.9835, test_f1: 0.5005
 epoch: 27, train_loss: 0.9709, test_loss: 0.9748, test_f1: 0.5089
 epoch: 28, train_loss: 0.9667, test_loss: 0.9652, test_f1: 0.5147
 epoch: 29, train_loss: 0.9685, test_loss: 0.9845, test_f1: 0.4878
 epoch: 30, train_loss: 0.9460, test_loss: 0.9991, test_f1: 0.5078
 epoch: 31, train_loss: 0.9562, test_loss: 0.9729, test_f1: 0.4917
 epoch: 32, train_loss: 0.9572, test_loss: 1.0094, test_f1: 0.4929
 epoch: 33, train_loss: 0.9418, test_loss: 1.0194, test_f1: 0.4885
 epoch: 34, train_loss: 0.9445, test_loss: 0.9568, test_f1: 0.4917
 epoch: 35, train_loss: 0.9343, test_loss: 1.0213, test_f1: 0.4900
 epoch: 36, train_loss: 0.9249, test_loss: 0.9878, test_f1: 0.4762
 epoch: 37, train_loss: 0.9163, test_loss: 0.9667, test_f1: 0.4793
 epoch: 38, train_loss: 0.9151, test_loss: 1.0068, test_f1: 0.4878
 epoch: 39, train_loss: 0.9185, test_loss: 1.0029, test_f1: 0.4972
 epoch: 40, train_loss: 0.9035, test_loss: 0.9725, test_f1: 0.4886
 epoch: 41, train_loss: 0.9076, test_loss: 0.9862, test_f1: 0.4908
 epoch: 42, train_loss: 0.8997, test_loss: 1.0472, test_f1: 0.4784
 epoch: 43, train_loss: 0.8870, test_loss: 0.9547, test_f1: 0.5069
 epoch: 44, train_loss: 0.8842, test_loss: 1.2011, test_f1: 0.4603
 epoch: 45, train_loss: 0.8789, test_loss: 0.9884, test_f1: 0.4885
 epoch: 46, train_loss: 0.8802, test_loss: 1.0777, test_f1: 0.4656
 epoch: 47, train_loss: 0.8700, test_loss: 1.0064, test_f1: 0.4883
 epoch: 48, train_loss: 0.8677, test_loss: 1.0607, test_f1: 0.4661
 epoch: 49, train_loss: 0.8594, test_loss: 0.9936, test_f1: 0.4873
 epoch: 50, train_loss: 0.8586, test_loss: 1.0800, test_f1: 0.4907
 epoch: 51, train_loss: 0.8526, test_loss: 1.0429, test_f1: 0.4805
 epoch: 52, train_loss: 0.8527, test_loss: 1.0246, test_f1: 0.4958
 epoch: 53, train_loss: 0.8366, test_loss: 1.0446, test_f1: 0.4881
 epoch: 54, train_loss: 0.8494, test_loss: 1.0333, test_f1: 0.4845
 epoch: 55, train_loss: 0.8462, test_loss: 1.0519, test_f1: 0.4803
 epoch: 56, train_loss: 0.8304, test_loss: 1.0084, test_f1: 0.4921
 epoch: 57, train_loss: 0.8408, test_loss: 1.0577, test_f1: 0.4766
 epoch: 58, train_loss: 0.8323, test_loss: 1.0304, test_f1: 0.4807
 epoch: 59, train_loss: 0.8354, test_loss: 1.0339, test_f1: 0.4881
 epoch: 60, train_loss: 0.8265, test_loss: 1.0483, test_f1: 0.4827
 epoch: 61, train_loss: 0.8193, test_loss: 1.0445, test_f1: 0.4940
 epoch: 62, train_loss: 0.8196, test_loss: 1.0798, test_f1: 0.4954
 epoch: 63, train_loss: 0.8203, test_loss: 1.0810, test_f1: 0.4816
 epoch: 64, train_loss: 0.8163, test_loss: 1.0841, test_f1: 0.4771
 epoch: 65, train_loss: 0.8098, test_loss: 1.0872, test_f1: 0.4742
 epoch: 66, train_loss: 0.8248, test_loss: 1.0693, test_f1: 0.4820
 epoch: 67, train_loss: 0.8063, test_loss: 1.0575, test_f1: 0.4788
 epoch: 68, train_loss: 0.8072, test_loss: 1.0890, test_f1: 0.4667
 epoch: 69, train_loss: 0.8127, test_loss: 1.0882, test_f1: 0.4664
 epoch: 70, train_loss: 0.8144, test_loss: 1.0567, test_f1: 0.4854
 epoch: 71, train_loss: 0.8124, test_loss: 1.0710, test_f1: 0.4849
 epoch: 72, train_loss: 0.8093, test_loss: 1.0969, test_f1: 0.4749
 epoch: 73, train_loss: 0.7990, test_loss: 1.1011, test_f1: 0.4771
 epoch: 74, train_loss: 0.7922, test_loss: 1.1202, test_f1: 0.4706
 epoch: 75, train_loss: 0.7975, test_loss: 1.1341, test_f1: 0.4658
 epoch: 76, train_loss: 0.7961, test_loss: 1.0969, test_f1: 0.4758
 epoch: 77, train_loss: 0.7849, test_loss: 1.0935, test_f1: 0.4848
 epoch: 78, train_loss: 0.7796, test_loss: 1.0985, test_f1: 0.4758
 epoch: 79, train_loss: 0.7990, test_loss: 1.1067, test_f1: 0.4803
 epoch: 80, train_loss: 0.7781, test_loss: 1.1136, test_f1: 0.4799
 epoch: 81, train_loss: 0.7886, test_loss: 1.0780, test_f1: 0.4755
 epoch: 82, train_loss: 0.7760, test_loss: 1.1745, test_f1: 0.4749
 epoch: 83, train_loss: 0.7681, test_loss: 1.1415, test_f1: 0.4841
 epoch: 84, train_loss: 0.7737, test_loss: 1.1676, test_f1: 0.4688
 epoch: 85, train_loss: 0.7748, test_loss: 1.1495, test_f1: 0.4706
 epoch: 86, train_loss: 0.7606, test_loss: 1.2227, test_f1: 0.4750
 epoch: 87, train_loss: 0.7924, test_loss: 1.1439, test_f1: 0.4860
 epoch: 88, train_loss: 0.7748, test_loss: 1.1446, test_f1: 0.4829
 epoch: 89, train_loss: 0.7705, test_loss: 1.1619, test_f1: 0.4796
 epoch: 90, train_loss: 0.7646, test_loss: 1.2116, test_f1: 0.4827
 epoch: 91, train_loss: 0.7665, test_loss: 1.1455, test_f1: 0.4839
 epoch: 92, train_loss: 0.7689, test_loss: 1.1650, test_f1: 0.4804
 epoch: 93, train_loss: 0.7604, test_loss: 1.1544, test_f1: 0.4845
 epoch: 94, train_loss: 0.7512, test_loss: 1.1656, test_f1: 0.4891
 epoch: 95, train_loss: 0.7531, test_loss: 1.2276, test_f1: 0.4818
 epoch: 96, train_loss: 0.7524, test_loss: 1.1725, test_f1: 0.4846
 epoch: 97, train_loss: 0.7360, test_loss: 1.1557, test_f1: 0.4865
 epoch: 98, train_loss: 0.7515, test_loss: 1.1663, test_f1: 0.4821
 epoch: 99, train_loss: 0.7474, test_loss: 1.1340, test_f1: 0.4907

Training completed in 362.53 seconds
Best F1: 0.5623 at epoch 99
Mean F1 across iterations: 0.5280  0.0141
========================FINAL RESULTS================================
FEGIN weighted F1: 0.5623  0.0141
python main.py --data ltspice_examples --representation component_component --model FEGIN --layers 2 --hiddens 128 --batch_size 256 --lr 0.0001 --emb_size 128 --epochs 100 --save_appendix component_component_L2_H128_BS256_LR0.0001_E128 --no_val
-----



STDERR:
  File "main.py", line 370, in <module>
    main()
  File "main.py", line 254, in main
    dataset = dataset_class(
  File "/home/philip/projects/ltspice_examples_code_repo/Circuit-Completion-Using-GNNs/component_classification_with_link_prediction_head/evaluation/FEGIN/kernel/circuit_datasets.py", line 15, in __init__
    self.data, self.slices = torch.load(self.processed_paths[0])
  File "/home/philip/.local/lib/python3.8/site-packages/torch/serialization.py", line 1040, in load
    warnings.warn(
  File "/usr/lib/python3.8/warnings.py", line 109, in _showwarnmsg
    sw(msg.message, msg.category, msg.filename, msg.lineno,
  File "main.py", line 47, in warn_with_traceback
    traceback.print_stack(file=log)
/home/philip/projects/ltspice_examples_code_repo/Circuit-Completion-Using-GNNs/component_classification_with_link_prediction_head/evaluation/FEGIN/kernel/circuit_datasets.py:15: FutureWarning: You are using `torch.load` with `weights_only=False` (the current default value), which uses the default pickle module implicitly. It is possible to construct malicious pickle data which will execute arbitrary code during unpickling (See https://github.com/pytorch/pytorch/blob/main/SECURITY.md#untrusted-models for more details). In a future release, the default value for `weights_only` will be flipped to `True`. This limits the functions that could be executed during unpickling. Arbitrary objects will no longer be allowed to be loaded via this mode unless they are explicitly allowlisted by the user via `torch.serialization.add_safe_globals`. We recommend you start setting `weights_only=True` for any use case where you don't have full control of the loaded file. Please open an issue on GitHub for any issues related to this experimental feature.
  self.data, self.slices = torch.load(self.processed_paths[0])
