STDOUT:
Results will be saved in /home/philip/projects/ltspice_examples_code_repo/Circuit-Completion-Using-GNNs/component_classification_with_link_prediction_head/evaluation/FEGIN/results/model_FEGIN_dataset_ltspice_examples
Command line input: python main.py --data ltspice_examples --representation component_pin --model FEGIN --layers 3 --hiddens 16 --batch_size 64 --lr 0.001 --emb_size 250 --epochs 100 --save_appendix component_pin_L3_H16_BS64_LR0.001_E250 --no_val
 is saved.
-----
ltspice_examples - FEGIN
Using 3 layers, 16 hidden units, h = 2
Loading component_pin representation dataset
ENTERED
Training FEGIN on component_pin representation
Train: 3560, Test: 848
##################ITERATION #0 ****************************************
 epoch: 0, train_loss: 1.3313, test_loss: 1.3087, test_f1: 0.2260
 epoch: 1, train_loss: 1.2618, test_loss: 1.2109, test_f1: 0.3392
 epoch: 2, train_loss: 1.1614, test_loss: 1.0878, test_f1: 0.3410
 epoch: 3, train_loss: 1.0908, test_loss: 1.1143, test_f1: 0.3173
 epoch: 4, train_loss: 1.0633, test_loss: 1.0525, test_f1: 0.3391
 epoch: 5, train_loss: 1.0486, test_loss: 1.0252, test_f1: 0.3400
 epoch: 6, train_loss: 1.0341, test_loss: 1.0077, test_f1: 0.3647
 epoch: 7, train_loss: 1.0179, test_loss: 1.0187, test_f1: 0.3540
 epoch: 8, train_loss: 1.0108, test_loss: 0.9926, test_f1: 0.3645
 epoch: 9, train_loss: 0.9980, test_loss: 1.0268, test_f1: 0.4198
 epoch: 10, train_loss: 0.9905, test_loss: 1.0608, test_f1: 0.3613
 epoch: 11, train_loss: 0.9837, test_loss: 0.9834, test_f1: 0.4340
 epoch: 12, train_loss: 0.9860, test_loss: 1.1011, test_f1: 0.4091
 epoch: 13, train_loss: 0.9703, test_loss: 1.0035, test_f1: 0.4320
 epoch: 14, train_loss: 0.9683, test_loss: 1.0087, test_f1: 0.4546
 epoch: 15, train_loss: 0.9632, test_loss: 0.9696, test_f1: 0.4645
 epoch: 16, train_loss: 0.9525, test_loss: 1.0726, test_f1: 0.4275
 epoch: 17, train_loss: 0.9534, test_loss: 0.9614, test_f1: 0.4697
 epoch: 18, train_loss: 0.9446, test_loss: 1.0118, test_f1: 0.4415
 epoch: 19, train_loss: 0.9351, test_loss: 1.0284, test_f1: 0.4631
 epoch: 20, train_loss: 0.9404, test_loss: 0.9677, test_f1: 0.4707
 epoch: 21, train_loss: 0.9241, test_loss: 0.9776, test_f1: 0.4783
 epoch: 22, train_loss: 0.9248, test_loss: 0.9986, test_f1: 0.4755
 epoch: 23, train_loss: 0.9133, test_loss: 0.9741, test_f1: 0.4917
 epoch: 24, train_loss: 0.9160, test_loss: 0.9916, test_f1: 0.4838
 epoch: 25, train_loss: 0.9169, test_loss: 0.9835, test_f1: 0.4799
 epoch: 26, train_loss: 0.8881, test_loss: 0.9924, test_f1: 0.4746
 epoch: 27, train_loss: 0.8941, test_loss: 0.9611, test_f1: 0.4881
 epoch: 28, train_loss: 0.8846, test_loss: 0.9795, test_f1: 0.4941
 epoch: 29, train_loss: 0.8809, test_loss: 0.9755, test_f1: 0.4856
 epoch: 30, train_loss: 0.8752, test_loss: 0.9415, test_f1: 0.5078
 epoch: 31, train_loss: 0.8561, test_loss: 0.9338, test_f1: 0.4972
 epoch: 32, train_loss: 0.8567, test_loss: 0.9532, test_f1: 0.5355
 epoch: 33, train_loss: 0.8550, test_loss: 0.9546, test_f1: 0.5026
 epoch: 34, train_loss: 0.8501, test_loss: 0.9244, test_f1: 0.5274
 epoch: 35, train_loss: 0.8420, test_loss: 1.0059, test_f1: 0.5116
 epoch: 36, train_loss: 0.8303, test_loss: 0.8794, test_f1: 0.5176
 epoch: 37, train_loss: 0.8345, test_loss: 0.9320, test_f1: 0.5074
 epoch: 38, train_loss: 0.8420, test_loss: 0.9119, test_f1: 0.5046
 epoch: 39, train_loss: 0.8290, test_loss: 1.0483, test_f1: 0.5221
 epoch: 40, train_loss: 0.8253, test_loss: 0.9352, test_f1: 0.5107
 epoch: 41, train_loss: 0.8221, test_loss: 0.9100, test_f1: 0.5309
 epoch: 42, train_loss: 0.8236, test_loss: 0.9756, test_f1: 0.5190
 epoch: 43, train_loss: 0.8120, test_loss: 0.9069, test_f1: 0.5465
 epoch: 44, train_loss: 0.8162, test_loss: 0.9444, test_f1: 0.5115
 epoch: 45, train_loss: 0.8158, test_loss: 0.9145, test_f1: 0.5220
 epoch: 46, train_loss: 0.8020, test_loss: 0.9402, test_f1: 0.5292
 epoch: 47, train_loss: 0.8159, test_loss: 0.9621, test_f1: 0.5080
 epoch: 48, train_loss: 0.8101, test_loss: 0.8866, test_f1: 0.5253
 epoch: 49, train_loss: 0.8047, test_loss: 0.9427, test_f1: 0.5147
 epoch: 50, train_loss: 0.8094, test_loss: 0.9478, test_f1: 0.5323
 epoch: 51, train_loss: 0.7800, test_loss: 0.9265, test_f1: 0.5392
 epoch: 52, train_loss: 0.7898, test_loss: 0.9146, test_f1: 0.5252
 epoch: 53, train_loss: 0.7728, test_loss: 0.9342, test_f1: 0.5417
 epoch: 54, train_loss: 0.7635, test_loss: 0.9175, test_f1: 0.5402
 epoch: 55, train_loss: 0.7719, test_loss: 0.9353, test_f1: 0.5440
 epoch: 56, train_loss: 0.7605, test_loss: 0.9342, test_f1: 0.5385
 epoch: 57, train_loss: 0.7713, test_loss: 0.9379, test_f1: 0.5322
 epoch: 58, train_loss: 0.7618, test_loss: 0.9147, test_f1: 0.5381
 epoch: 59, train_loss: 0.7677, test_loss: 0.8941, test_f1: 0.5534
 epoch: 60, train_loss: 0.7580, test_loss: 0.9126, test_f1: 0.5413
 epoch: 61, train_loss: 0.7553, test_loss: 0.9217, test_f1: 0.5382
 epoch: 62, train_loss: 0.7636, test_loss: 0.9604, test_f1: 0.5291
 epoch: 63, train_loss: 0.7628, test_loss: 0.9398, test_f1: 0.5375
 epoch: 64, train_loss: 0.7504, test_loss: 0.9795, test_f1: 0.5363
 epoch: 65, train_loss: 0.7554, test_loss: 0.9397, test_f1: 0.5427
 epoch: 66, train_loss: 0.7575, test_loss: 0.9442, test_f1: 0.5402
 epoch: 67, train_loss: 0.7530, test_loss: 0.9292, test_f1: 0.5369
 epoch: 68, train_loss: 0.7433, test_loss: 0.9744, test_f1: 0.5437
 epoch: 69, train_loss: 0.7469, test_loss: 0.9730, test_f1: 0.5395
 epoch: 70, train_loss: 0.7482, test_loss: 0.9404, test_f1: 0.5385
 epoch: 71, train_loss: 0.7538, test_loss: 0.9235, test_f1: 0.5403
 epoch: 72, train_loss: 0.7331, test_loss: 0.9449, test_f1: 0.5413
 epoch: 73, train_loss: 0.7520, test_loss: 0.9424, test_f1: 0.5508
 epoch: 74, train_loss: 0.7487, test_loss: 0.9191, test_f1: 0.5355
 epoch: 75, train_loss: 0.7482, test_loss: 0.9371, test_f1: 0.5342
 epoch: 76, train_loss: 0.7418, test_loss: 0.9346, test_f1: 0.5298
 epoch: 77, train_loss: 0.7390, test_loss: 0.9155, test_f1: 0.5271
 epoch: 78, train_loss: 0.7390, test_loss: 0.9460, test_f1: 0.5387
 epoch: 79, train_loss: 0.7354, test_loss: 0.9637, test_f1: 0.5352
 epoch: 80, train_loss: 0.7455, test_loss: 0.9504, test_f1: 0.5298
 epoch: 81, train_loss: 0.7490, test_loss: 0.9369, test_f1: 0.5440
 epoch: 82, train_loss: 0.7395, test_loss: 0.9370, test_f1: 0.5392
 epoch: 83, train_loss: 0.7360, test_loss: 0.9468, test_f1: 0.5403
 epoch: 84, train_loss: 0.7363, test_loss: 0.9595, test_f1: 0.5365
 epoch: 85, train_loss: 0.7265, test_loss: 0.9700, test_f1: 0.5421
 epoch: 86, train_loss: 0.7217, test_loss: 0.9807, test_f1: 0.5382
 epoch: 87, train_loss: 0.7318, test_loss: 0.9468, test_f1: 0.5452
 epoch: 88, train_loss: 0.7236, test_loss: 0.9608, test_f1: 0.5486
 epoch: 89, train_loss: 0.7312, test_loss: 0.9532, test_f1: 0.5281
 epoch: 90, train_loss: 0.7203, test_loss: 0.9319, test_f1: 0.5374
 epoch: 91, train_loss: 0.7291, test_loss: 0.9342, test_f1: 0.5385
 epoch: 92, train_loss: 0.7279, test_loss: 0.9792, test_f1: 0.5530
 epoch: 93, train_loss: 0.7268, test_loss: 0.9821, test_f1: 0.5511
 epoch: 94, train_loss: 0.7205, test_loss: 0.9315, test_f1: 0.5552
 epoch: 95, train_loss: 0.7174, test_loss: 0.8895, test_f1: 0.5431
 epoch: 96, train_loss: 0.7286, test_loss: 1.0046, test_f1: 0.5363
 epoch: 97, train_loss: 0.7139, test_loss: 0.9393, test_f1: 0.5433
 epoch: 98, train_loss: 0.7262, test_loss: 0.9718, test_f1: 0.5484
 epoch: 99, train_loss: 0.7298, test_loss: 0.9993, test_f1: 0.5369
##################ITERATION #1 ****************************************
 epoch: 0, train_loss: 1.2745, test_loss: 1.2022, test_f1: 0.2893
 epoch: 1, train_loss: 1.1619, test_loss: 1.0911, test_f1: 0.3530
 epoch: 2, train_loss: 1.0733, test_loss: 1.0393, test_f1: 0.3447
 epoch: 3, train_loss: 1.0335, test_loss: 1.0260, test_f1: 0.3603
 epoch: 4, train_loss: 1.0322, test_loss: 1.0132, test_f1: 0.3514
 epoch: 5, train_loss: 1.0108, test_loss: 1.0128, test_f1: 0.3726
 epoch: 6, train_loss: 0.9991, test_loss: 0.9997, test_f1: 0.4055
 epoch: 7, train_loss: 0.9976, test_loss: 0.9936, test_f1: 0.4282
 epoch: 8, train_loss: 0.9806, test_loss: 1.0345, test_f1: 0.4129
 epoch: 9, train_loss: 0.9722, test_loss: 0.9672, test_f1: 0.4700
 epoch: 10, train_loss: 0.9607, test_loss: 0.9578, test_f1: 0.4965
 epoch: 11, train_loss: 0.9527, test_loss: 0.9495, test_f1: 0.4829
 epoch: 12, train_loss: 0.9502, test_loss: 0.9530, test_f1: 0.4887
 epoch: 13, train_loss: 0.9335, test_loss: 0.9441, test_f1: 0.4797
 epoch: 14, train_loss: 0.9376, test_loss: 0.9354, test_f1: 0.5041
 epoch: 15, train_loss: 0.9244, test_loss: 0.9476, test_f1: 0.4790
 epoch: 16, train_loss: 0.9247, test_loss: 0.9418, test_f1: 0.4966
 epoch: 17, train_loss: 0.9157, test_loss: 0.9894, test_f1: 0.4973
 epoch: 18, train_loss: 0.9185, test_loss: 0.9624, test_f1: 0.4983
 epoch: 19, train_loss: 0.9121, test_loss: 0.9624, test_f1: 0.4912
 epoch: 20, train_loss: 0.9051, test_loss: 0.9004, test_f1: 0.4991
 epoch: 21, train_loss: 0.8991, test_loss: 0.9253, test_f1: 0.4994
 epoch: 22, train_loss: 0.8896, test_loss: 0.9458, test_f1: 0.4965
 epoch: 23, train_loss: 0.8894, test_loss: 0.9010, test_f1: 0.5003
 epoch: 24, train_loss: 0.8925, test_loss: 0.8978, test_f1: 0.5269
 epoch: 25, train_loss: 0.8846, test_loss: 0.8957, test_f1: 0.5180
 epoch: 26, train_loss: 0.8866, test_loss: 0.9549, test_f1: 0.4896
 epoch: 27, train_loss: 0.8697, test_loss: 0.8894, test_f1: 0.5347
 epoch: 28, train_loss: 0.8685, test_loss: 0.9424, test_f1: 0.4931
 epoch: 29, train_loss: 0.8655, test_loss: 0.9337, test_f1: 0.4989
 epoch: 30, train_loss: 0.8721, test_loss: 0.9628, test_f1: 0.5147
 epoch: 31, train_loss: 0.8629, test_loss: 0.8710, test_f1: 0.5196
 epoch: 32, train_loss: 0.8599, test_loss: 0.8908, test_f1: 0.5130
 epoch: 33, train_loss: 0.8603, test_loss: 0.9328, test_f1: 0.5041
 epoch: 34, train_loss: 0.8521, test_loss: 0.9010, test_f1: 0.5121
 epoch: 35, train_loss: 0.8434, test_loss: 0.9323, test_f1: 0.5018
 epoch: 36, train_loss: 0.8448, test_loss: 0.9573, test_f1: 0.5007
 epoch: 37, train_loss: 0.8356, test_loss: 0.9062, test_f1: 0.5136
 epoch: 38, train_loss: 0.8526, test_loss: 0.8830, test_f1: 0.5292
 epoch: 39, train_loss: 0.8383, test_loss: 0.9145, test_f1: 0.5135
 epoch: 40, train_loss: 0.8382, test_loss: 0.9200, test_f1: 0.5287
 epoch: 41, train_loss: 0.8415, test_loss: 0.9262, test_f1: 0.5104
 epoch: 42, train_loss: 0.8429, test_loss: 0.9627, test_f1: 0.5051
 epoch: 43, train_loss: 0.8286, test_loss: 0.8864, test_f1: 0.5166
 epoch: 44, train_loss: 0.8187, test_loss: 0.8787, test_f1: 0.5273
 epoch: 45, train_loss: 0.8180, test_loss: 0.9044, test_f1: 0.5343
 epoch: 46, train_loss: 0.8277, test_loss: 0.9181, test_f1: 0.5319
 epoch: 47, train_loss: 0.8205, test_loss: 0.8951, test_f1: 0.5280
 epoch: 48, train_loss: 0.8172, test_loss: 0.9069, test_f1: 0.5345
 epoch: 49, train_loss: 0.8157, test_loss: 0.9313, test_f1: 0.5352
 epoch: 50, train_loss: 0.8072, test_loss: 0.9097, test_f1: 0.5259
 epoch: 51, train_loss: 0.8094, test_loss: 0.9190, test_f1: 0.5458
 epoch: 52, train_loss: 0.8035, test_loss: 0.9129, test_f1: 0.5365
 epoch: 53, train_loss: 0.7950, test_loss: 0.9510, test_f1: 0.5296
 epoch: 54, train_loss: 0.7966, test_loss: 0.9172, test_f1: 0.5302
 epoch: 55, train_loss: 0.7978, test_loss: 0.9361, test_f1: 0.5241
 epoch: 56, train_loss: 0.7891, test_loss: 0.9133, test_f1: 0.5446
 epoch: 57, train_loss: 0.7858, test_loss: 0.9073, test_f1: 0.5455
 epoch: 58, train_loss: 0.7894, test_loss: 0.9239, test_f1: 0.5394
 epoch: 59, train_loss: 0.7963, test_loss: 0.9153, test_f1: 0.5310
 epoch: 60, train_loss: 0.7956, test_loss: 0.9222, test_f1: 0.5440
 epoch: 61, train_loss: 0.7831, test_loss: 0.9414, test_f1: 0.5513
 epoch: 62, train_loss: 0.7832, test_loss: 0.9273, test_f1: 0.5566
 epoch: 63, train_loss: 0.7859, test_loss: 0.9120, test_f1: 0.5431
 epoch: 64, train_loss: 0.7871, test_loss: 0.8955, test_f1: 0.5582
 epoch: 65, train_loss: 0.7693, test_loss: 0.9311, test_f1: 0.5408
 epoch: 66, train_loss: 0.7740, test_loss: 0.9231, test_f1: 0.5374
 epoch: 67, train_loss: 0.7787, test_loss: 0.9287, test_f1: 0.5443
 epoch: 68, train_loss: 0.7751, test_loss: 0.9315, test_f1: 0.5520
 epoch: 69, train_loss: 0.7707, test_loss: 0.9433, test_f1: 0.5483
 epoch: 70, train_loss: 0.7618, test_loss: 0.9237, test_f1: 0.5492
 epoch: 71, train_loss: 0.7705, test_loss: 0.9428, test_f1: 0.5540
 epoch: 72, train_loss: 0.7726, test_loss: 0.9236, test_f1: 0.5518
 epoch: 73, train_loss: 0.7770, test_loss: 0.9376, test_f1: 0.5378
 epoch: 74, train_loss: 0.7657, test_loss: 0.9328, test_f1: 0.5395
 epoch: 75, train_loss: 0.7746, test_loss: 0.9254, test_f1: 0.5471
 epoch: 76, train_loss: 0.7664, test_loss: 0.9457, test_f1: 0.5338
 epoch: 77, train_loss: 0.7685, test_loss: 0.9443, test_f1: 0.5456
 epoch: 78, train_loss: 0.7722, test_loss: 0.9383, test_f1: 0.5420
 epoch: 79, train_loss: 0.7569, test_loss: 0.9364, test_f1: 0.5463
 epoch: 80, train_loss: 0.7616, test_loss: 0.9335, test_f1: 0.5505
 epoch: 81, train_loss: 0.7569, test_loss: 0.9237, test_f1: 0.5471
 epoch: 82, train_loss: 0.7598, test_loss: 0.9889, test_f1: 0.5232
 epoch: 83, train_loss: 0.7722, test_loss: 0.9399, test_f1: 0.5589
 epoch: 84, train_loss: 0.7585, test_loss: 0.9341, test_f1: 0.5520
 epoch: 85, train_loss: 0.7615, test_loss: 0.9657, test_f1: 0.5472
 epoch: 86, train_loss: 0.7592, test_loss: 0.9430, test_f1: 0.5499
 epoch: 87, train_loss: 0.7465, test_loss: 0.9956, test_f1: 0.5407
 epoch: 88, train_loss: 0.7603, test_loss: 0.9869, test_f1: 0.5528
 epoch: 89, train_loss: 0.7549, test_loss: 0.9721, test_f1: 0.5412
 epoch: 90, train_loss: 0.7628, test_loss: 0.9298, test_f1: 0.5452
 epoch: 91, train_loss: 0.7509, test_loss: 0.9412, test_f1: 0.5420
 epoch: 92, train_loss: 0.7480, test_loss: 0.9909, test_f1: 0.5338
 epoch: 93, train_loss: 0.7562, test_loss: 0.9923, test_f1: 0.5300
 epoch: 94, train_loss: 0.7486, test_loss: 0.9910, test_f1: 0.5351
 epoch: 95, train_loss: 0.7468, test_loss: 0.9714, test_f1: 0.5443
 epoch: 96, train_loss: 0.7553, test_loss: 0.9569, test_f1: 0.5437
 epoch: 97, train_loss: 0.7482, test_loss: 0.9541, test_f1: 0.5400
 epoch: 98, train_loss: 0.7448, test_loss: 0.9997, test_f1: 0.5417
 epoch: 99, train_loss: 0.7447, test_loss: 0.9734, test_f1: 0.5497
##################ITERATION #2 ****************************************
 epoch: 0, train_loss: 1.2388, test_loss: 1.1680, test_f1: 0.2661
 epoch: 1, train_loss: 1.1272, test_loss: 1.0780, test_f1: 0.3399
 epoch: 2, train_loss: 1.0736, test_loss: 1.0650, test_f1: 0.3607
 epoch: 3, train_loss: 1.0346, test_loss: 1.0465, test_f1: 0.3978
 epoch: 4, train_loss: 1.0217, test_loss: 1.0459, test_f1: 0.4047
 epoch: 5, train_loss: 1.0087, test_loss: 1.0477, test_f1: 0.4052
 epoch: 6, train_loss: 1.0030, test_loss: 1.0431, test_f1: 0.4311
 epoch: 7, train_loss: 0.9889, test_loss: 1.0312, test_f1: 0.4572
 epoch: 8, train_loss: 0.9812, test_loss: 1.0210, test_f1: 0.4859
 epoch: 9, train_loss: 0.9684, test_loss: 1.0237, test_f1: 0.4987
 epoch: 10, train_loss: 0.9682, test_loss: 1.0202, test_f1: 0.4870
 epoch: 11, train_loss: 0.9533, test_loss: 1.0233, test_f1: 0.4848
 epoch: 12, train_loss: 0.9466, test_loss: 1.0322, test_f1: 0.4994
 epoch: 13, train_loss: 0.9295, test_loss: 1.0485, test_f1: 0.4715
 epoch: 14, train_loss: 0.9454, test_loss: 1.0027, test_f1: 0.4877
 epoch: 15, train_loss: 0.9363, test_loss: 0.9939, test_f1: 0.5052
 epoch: 16, train_loss: 0.9160, test_loss: 1.0417, test_f1: 0.4750
 epoch: 17, train_loss: 0.9070, test_loss: 1.0323, test_f1: 0.4915
 epoch: 18, train_loss: 0.9130, test_loss: 0.9834, test_f1: 0.5057
 epoch: 19, train_loss: 0.9078, test_loss: 0.9480, test_f1: 0.5103
 epoch: 20, train_loss: 0.8892, test_loss: 0.9839, test_f1: 0.4993
 epoch: 21, train_loss: 0.8785, test_loss: 0.9954, test_f1: 0.4940
 epoch: 22, train_loss: 0.8743, test_loss: 0.9513, test_f1: 0.5080
 epoch: 23, train_loss: 0.8923, test_loss: 0.9684, test_f1: 0.5115
 epoch: 24, train_loss: 0.8699, test_loss: 0.9382, test_f1: 0.5082
 epoch: 25, train_loss: 0.8622, test_loss: 0.9450, test_f1: 0.5179
 epoch: 26, train_loss: 0.8696, test_loss: 0.9137, test_f1: 0.5173
 epoch: 27, train_loss: 0.8584, test_loss: 0.9269, test_f1: 0.5163
 epoch: 28, train_loss: 0.8516, test_loss: 0.8957, test_f1: 0.5189
 epoch: 29, train_loss: 0.8505, test_loss: 0.8929, test_f1: 0.5315
 epoch: 30, train_loss: 0.8460, test_loss: 0.9520, test_f1: 0.5055
 epoch: 31, train_loss: 0.8379, test_loss: 0.9188, test_f1: 0.5192
 epoch: 32, train_loss: 0.8357, test_loss: 0.9040, test_f1: 0.5175
 epoch: 33, train_loss: 0.8326, test_loss: 0.9610, test_f1: 0.5012
 epoch: 34, train_loss: 0.8356, test_loss: 0.8717, test_f1: 0.5184
 epoch: 35, train_loss: 0.8144, test_loss: 0.8688, test_f1: 0.5268
 epoch: 36, train_loss: 0.8265, test_loss: 0.8962, test_f1: 0.5404
 epoch: 37, train_loss: 0.8251, test_loss: 0.8748, test_f1: 0.5309
 epoch: 38, train_loss: 0.8133, test_loss: 0.8900, test_f1: 0.5289
 epoch: 39, train_loss: 0.8109, test_loss: 0.9296, test_f1: 0.5348
 epoch: 40, train_loss: 0.8144, test_loss: 0.9051, test_f1: 0.5400
 epoch: 41, train_loss: 0.7991, test_loss: 0.8886, test_f1: 0.5175
 epoch: 42, train_loss: 0.8063, test_loss: 0.8706, test_f1: 0.5349
 epoch: 43, train_loss: 0.7950, test_loss: 0.8757, test_f1: 0.5398
 epoch: 44, train_loss: 0.7897, test_loss: 0.8753, test_f1: 0.5390
 epoch: 45, train_loss: 0.8039, test_loss: 0.9299, test_f1: 0.5243
 epoch: 46, train_loss: 0.7965, test_loss: 0.8665, test_f1: 0.5425
 epoch: 47, train_loss: 0.7873, test_loss: 0.8912, test_f1: 0.5412
 epoch: 48, train_loss: 0.7782, test_loss: 0.9245, test_f1: 0.5116
 epoch: 49, train_loss: 0.7925, test_loss: 0.8828, test_f1: 0.5181
 epoch: 50, train_loss: 0.7766, test_loss: 0.9126, test_f1: 0.5274
 epoch: 51, train_loss: 0.7669, test_loss: 0.8952, test_f1: 0.5275
 epoch: 52, train_loss: 0.7596, test_loss: 0.8722, test_f1: 0.5356
 epoch: 53, train_loss: 0.7601, test_loss: 0.8687, test_f1: 0.5494
 epoch: 54, train_loss: 0.7657, test_loss: 0.8770, test_f1: 0.5392
 epoch: 55, train_loss: 0.7618, test_loss: 0.8724, test_f1: 0.5344
 epoch: 56, train_loss: 0.7683, test_loss: 0.8920, test_f1: 0.5389
 epoch: 57, train_loss: 0.7583, test_loss: 0.8864, test_f1: 0.5239
 epoch: 58, train_loss: 0.7498, test_loss: 0.8676, test_f1: 0.5308
 epoch: 59, train_loss: 0.7518, test_loss: 0.8639, test_f1: 0.5450
 epoch: 60, train_loss: 0.7505, test_loss: 0.8788, test_f1: 0.5361
 epoch: 61, train_loss: 0.7508, test_loss: 0.8628, test_f1: 0.5421
 epoch: 62, train_loss: 0.7508, test_loss: 0.8823, test_f1: 0.5479
 epoch: 63, train_loss: 0.7474, test_loss: 0.8713, test_f1: 0.5340
 epoch: 64, train_loss: 0.7453, test_loss: 0.9083, test_f1: 0.5453
 epoch: 65, train_loss: 0.7373, test_loss: 0.8601, test_f1: 0.5448
 epoch: 66, train_loss: 0.7329, test_loss: 0.9220, test_f1: 0.5334
 epoch: 67, train_loss: 0.7448, test_loss: 0.8813, test_f1: 0.5506
 epoch: 68, train_loss: 0.7558, test_loss: 0.8766, test_f1: 0.5435
 epoch: 69, train_loss: 0.7347, test_loss: 0.8654, test_f1: 0.5497
 epoch: 70, train_loss: 0.7300, test_loss: 0.9052, test_f1: 0.5548
 epoch: 71, train_loss: 0.7430, test_loss: 0.8833, test_f1: 0.5416
 epoch: 72, train_loss: 0.7310, test_loss: 0.9073, test_f1: 0.5436
 epoch: 73, train_loss: 0.7329, test_loss: 0.8851, test_f1: 0.5466
 epoch: 74, train_loss: 0.7355, test_loss: 0.8961, test_f1: 0.5417
 epoch: 75, train_loss: 0.7277, test_loss: 0.8719, test_f1: 0.5511
 epoch: 76, train_loss: 0.7207, test_loss: 0.8706, test_f1: 0.5578
 epoch: 77, train_loss: 0.7328, test_loss: 0.9251, test_f1: 0.5286
 epoch: 78, train_loss: 0.7218, test_loss: 0.8852, test_f1: 0.5506
 epoch: 79, train_loss: 0.7313, test_loss: 0.8724, test_f1: 0.5519
 epoch: 80, train_loss: 0.7292, test_loss: 0.8677, test_f1: 0.5544
 epoch: 81, train_loss: 0.7232, test_loss: 0.8816, test_f1: 0.5570
 epoch: 82, train_loss: 0.7330, test_loss: 0.8950, test_f1: 0.5534
 epoch: 83, train_loss: 0.7242, test_loss: 0.8844, test_f1: 0.5489
 epoch: 84, train_loss: 0.7269, test_loss: 0.8788, test_f1: 0.5313
 epoch: 85, train_loss: 0.7283, test_loss: 0.8931, test_f1: 0.5368
 epoch: 86, train_loss: 0.7043, test_loss: 0.8830, test_f1: 0.5418
 epoch: 87, train_loss: 0.7207, test_loss: 0.9001, test_f1: 0.5493
 epoch: 88, train_loss: 0.7246, test_loss: 0.8924, test_f1: 0.5394
 epoch: 89, train_loss: 0.7182, test_loss: 0.8931, test_f1: 0.5510
 epoch: 90, train_loss: 0.7259, test_loss: 0.9104, test_f1: 0.5433
 epoch: 91, train_loss: 0.7162, test_loss: 0.8925, test_f1: 0.5441
 epoch: 92, train_loss: 0.7124, test_loss: 0.9046, test_f1: 0.5525
 epoch: 93, train_loss: 0.7200, test_loss: 0.9032, test_f1: 0.5445
 epoch: 94, train_loss: 0.7108, test_loss: 0.9566, test_f1: 0.5255
 epoch: 95, train_loss: 0.7116, test_loss: 0.8942, test_f1: 0.5452
 epoch: 96, train_loss: 0.7166, test_loss: 0.9091, test_f1: 0.5447
 epoch: 97, train_loss: 0.7145, test_loss: 0.9013, test_f1: 0.5472
 epoch: 98, train_loss: 0.7040, test_loss: 0.9099, test_f1: 0.5457
 epoch: 99, train_loss: 0.7105, test_loss: 0.9081, test_f1: 0.5394
##################ITERATION #3 ****************************************
 epoch: 0, train_loss: 1.2860, test_loss: 1.1551, test_f1: 0.3127
 epoch: 1, train_loss: 1.1395, test_loss: 1.0609, test_f1: 0.4441
 epoch: 2, train_loss: 1.0921, test_loss: 1.0180, test_f1: 0.4753
 epoch: 3, train_loss: 1.0479, test_loss: 1.0282, test_f1: 0.4566
 epoch: 4, train_loss: 1.0295, test_loss: 1.0199, test_f1: 0.4724
 epoch: 5, train_loss: 1.0143, test_loss: 0.9802, test_f1: 0.5035
 epoch: 6, train_loss: 0.9965, test_loss: 1.0083, test_f1: 0.4827
 epoch: 7, train_loss: 0.9881, test_loss: 0.9749, test_f1: 0.4951
 epoch: 8, train_loss: 0.9696, test_loss: 0.9569, test_f1: 0.5039
 epoch: 9, train_loss: 0.9635, test_loss: 0.9407, test_f1: 0.5081
 epoch: 10, train_loss: 0.9528, test_loss: 0.9847, test_f1: 0.4729
 epoch: 11, train_loss: 0.9407, test_loss: 0.9466, test_f1: 0.5095
 epoch: 12, train_loss: 0.9456, test_loss: 0.9568, test_f1: 0.5111
 epoch: 13, train_loss: 0.9329, test_loss: 1.0024, test_f1: 0.4813
 epoch: 14, train_loss: 0.9257, test_loss: 0.9398, test_f1: 0.5007
 epoch: 15, train_loss: 0.9170, test_loss: 0.9477, test_f1: 0.4925
 epoch: 16, train_loss: 0.9156, test_loss: 0.9245, test_f1: 0.5023
 epoch: 17, train_loss: 0.9126, test_loss: 0.9289, test_f1: 0.5129
 epoch: 18, train_loss: 0.9099, test_loss: 0.9464, test_f1: 0.5210
 epoch: 19, train_loss: 0.9045, test_loss: 0.9287, test_f1: 0.5193
 epoch: 20, train_loss: 0.9055, test_loss: 0.9357, test_f1: 0.5213
 epoch: 21, train_loss: 0.9010, test_loss: 0.9519, test_f1: 0.4918
 epoch: 22, train_loss: 0.8886, test_loss: 0.9261, test_f1: 0.5150
 epoch: 23, train_loss: 0.8889, test_loss: 0.9486, test_f1: 0.4986
 epoch: 24, train_loss: 0.8924, test_loss: 0.9125, test_f1: 0.5269
 epoch: 25, train_loss: 0.8827, test_loss: 0.9106, test_f1: 0.5195
 epoch: 26, train_loss: 0.8810, test_loss: 0.9530, test_f1: 0.5400
 epoch: 27, train_loss: 0.8767, test_loss: 0.9270, test_f1: 0.5252
 epoch: 28, train_loss: 0.8732, test_loss: 0.9724, test_f1: 0.5327
 epoch: 29, train_loss: 0.8714, test_loss: 0.9401, test_f1: 0.5316
 epoch: 30, train_loss: 0.8508, test_loss: 0.9482, test_f1: 0.5239
 epoch: 31, train_loss: 0.8582, test_loss: 0.9881, test_f1: 0.5040
 epoch: 32, train_loss: 0.8599, test_loss: 0.9325, test_f1: 0.5279
 epoch: 33, train_loss: 0.8663, test_loss: 0.9517, test_f1: 0.4978
 epoch: 34, train_loss: 0.8524, test_loss: 0.9506, test_f1: 0.5198
 epoch: 35, train_loss: 0.8577, test_loss: 0.9568, test_f1: 0.5288
 epoch: 36, train_loss: 0.8510, test_loss: 0.9611, test_f1: 0.5170
 epoch: 37, train_loss: 0.8486, test_loss: 0.9418, test_f1: 0.5203
 epoch: 38, train_loss: 0.8491, test_loss: 0.9165, test_f1: 0.5356
 epoch: 39, train_loss: 0.8476, test_loss: 0.9496, test_f1: 0.5209
 epoch: 40, train_loss: 0.8371, test_loss: 0.9636, test_f1: 0.4927
 epoch: 41, train_loss: 0.8370, test_loss: 0.9221, test_f1: 0.5255
 epoch: 42, train_loss: 0.8387, test_loss: 0.9379, test_f1: 0.5219
 epoch: 43, train_loss: 0.8240, test_loss: 0.9595, test_f1: 0.5104
 epoch: 44, train_loss: 0.8298, test_loss: 0.9342, test_f1: 0.5275
 epoch: 45, train_loss: 0.8261, test_loss: 0.9227, test_f1: 0.5284
 epoch: 46, train_loss: 0.8218, test_loss: 0.9128, test_f1: 0.5292
 epoch: 47, train_loss: 0.8328, test_loss: 0.9317, test_f1: 0.5351
 epoch: 48, train_loss: 0.8174, test_loss: 0.9662, test_f1: 0.5086
 epoch: 49, train_loss: 0.8165, test_loss: 0.9108, test_f1: 0.5380
 epoch: 50, train_loss: 0.8273, test_loss: 0.9443, test_f1: 0.5347
 epoch: 51, train_loss: 0.7994, test_loss: 0.9240, test_f1: 0.5257
 epoch: 52, train_loss: 0.7986, test_loss: 0.9213, test_f1: 0.5310
 epoch: 53, train_loss: 0.7961, test_loss: 0.9341, test_f1: 0.5247
 epoch: 54, train_loss: 0.7908, test_loss: 0.9452, test_f1: 0.5123
 epoch: 55, train_loss: 0.7886, test_loss: 0.9218, test_f1: 0.5246
 epoch: 56, train_loss: 0.8141, test_loss: 0.9672, test_f1: 0.5074
 epoch: 57, train_loss: 0.7938, test_loss: 0.9385, test_f1: 0.5221
 epoch: 58, train_loss: 0.8029, test_loss: 0.9216, test_f1: 0.5312
 epoch: 59, train_loss: 0.7884, test_loss: 0.9439, test_f1: 0.5157
 epoch: 60, train_loss: 0.8014, test_loss: 0.9217, test_f1: 0.5173
 epoch: 61, train_loss: 0.7971, test_loss: 0.9518, test_f1: 0.5319
 epoch: 62, train_loss: 0.7904, test_loss: 0.9138, test_f1: 0.5356
 epoch: 63, train_loss: 0.7910, test_loss: 0.9263, test_f1: 0.5263
 epoch: 64, train_loss: 0.7871, test_loss: 0.9350, test_f1: 0.5360
 epoch: 65, train_loss: 0.7851, test_loss: 0.9228, test_f1: 0.5301
 epoch: 66, train_loss: 0.7950, test_loss: 0.9338, test_f1: 0.5270
 epoch: 67, train_loss: 0.7779, test_loss: 0.9524, test_f1: 0.5283
 epoch: 68, train_loss: 0.7793, test_loss: 0.9321, test_f1: 0.5320
 epoch: 69, train_loss: 0.7821, test_loss: 0.9472, test_f1: 0.5267
 epoch: 70, train_loss: 0.7765, test_loss: 0.9553, test_f1: 0.5217
 epoch: 71, train_loss: 0.7817, test_loss: 0.9666, test_f1: 0.5125
 epoch: 72, train_loss: 0.7769, test_loss: 0.9567, test_f1: 0.5166
 epoch: 73, train_loss: 0.7866, test_loss: 0.9194, test_f1: 0.5270
 epoch: 74, train_loss: 0.7682, test_loss: 0.9405, test_f1: 0.5275
 epoch: 75, train_loss: 0.7831, test_loss: 0.9640, test_f1: 0.5155
 epoch: 76, train_loss: 0.7728, test_loss: 0.9465, test_f1: 0.5257
 epoch: 77, train_loss: 0.7770, test_loss: 0.9293, test_f1: 0.5318
 epoch: 78, train_loss: 0.7685, test_loss: 0.9454, test_f1: 0.5344
 epoch: 79, train_loss: 0.7787, test_loss: 0.9372, test_f1: 0.5323
 epoch: 80, train_loss: 0.7841, test_loss: 0.9544, test_f1: 0.5368
 epoch: 81, train_loss: 0.7744, test_loss: 0.9450, test_f1: 0.5337
 epoch: 82, train_loss: 0.7670, test_loss: 0.9447, test_f1: 0.5290
 epoch: 83, train_loss: 0.7752, test_loss: 0.9132, test_f1: 0.5374
 epoch: 84, train_loss: 0.7894, test_loss: 0.9365, test_f1: 0.5346
 epoch: 85, train_loss: 0.7584, test_loss: 0.9618, test_f1: 0.5203
 epoch: 86, train_loss: 0.7689, test_loss: 0.9503, test_f1: 0.5318
 epoch: 87, train_loss: 0.7641, test_loss: 0.9267, test_f1: 0.5354
 epoch: 88, train_loss: 0.7808, test_loss: 0.9609, test_f1: 0.5289
 epoch: 89, train_loss: 0.7787, test_loss: 0.9256, test_f1: 0.5302
 epoch: 90, train_loss: 0.7666, test_loss: 0.9364, test_f1: 0.5357
 epoch: 91, train_loss: 0.7481, test_loss: 0.9297, test_f1: 0.5376
 epoch: 92, train_loss: 0.7566, test_loss: 0.9307, test_f1: 0.5370
 epoch: 93, train_loss: 0.7672, test_loss: 0.9516, test_f1: 0.5267
 epoch: 94, train_loss: 0.7573, test_loss: 0.9436, test_f1: 0.5275
 epoch: 95, train_loss: 0.7576, test_loss: 0.9531, test_f1: 0.5373
 epoch: 96, train_loss: 0.7452, test_loss: 0.9591, test_f1: 0.5213
 epoch: 97, train_loss: 0.7685, test_loss: 0.9399, test_f1: 0.5380
 epoch: 98, train_loss: 0.7550, test_loss: 0.9324, test_f1: 0.5492
 epoch: 99, train_loss: 0.7446, test_loss: 0.9581, test_f1: 0.5236
##################ITERATION #4 ****************************************
 epoch: 0, train_loss: 1.2350, test_loss: 1.1004, test_f1: 0.3521
 epoch: 1, train_loss: 1.1132, test_loss: 1.0436, test_f1: 0.4021
 epoch: 2, train_loss: 1.0770, test_loss: 1.0146, test_f1: 0.4223
 epoch: 3, train_loss: 1.0486, test_loss: 1.0334, test_f1: 0.4147
 epoch: 4, train_loss: 1.0382, test_loss: 1.0317, test_f1: 0.4408
 epoch: 5, train_loss: 1.0217, test_loss: 0.9811, test_f1: 0.4952
 epoch: 6, train_loss: 1.0066, test_loss: 0.9595, test_f1: 0.4773
 epoch: 7, train_loss: 0.9943, test_loss: 0.9619, test_f1: 0.5070
 epoch: 8, train_loss: 0.9867, test_loss: 0.9859, test_f1: 0.4830
 epoch: 9, train_loss: 0.9746, test_loss: 0.9557, test_f1: 0.4988
 epoch: 10, train_loss: 0.9619, test_loss: 0.9301, test_f1: 0.4994
 epoch: 11, train_loss: 0.9641, test_loss: 0.9142, test_f1: 0.5014
 epoch: 12, train_loss: 0.9498, test_loss: 0.9476, test_f1: 0.5042
 epoch: 13, train_loss: 0.9400, test_loss: 0.9235, test_f1: 0.5046
 epoch: 14, train_loss: 0.9319, test_loss: 0.9093, test_f1: 0.5260
 epoch: 15, train_loss: 0.9304, test_loss: 0.8754, test_f1: 0.5327
 epoch: 16, train_loss: 0.9227, test_loss: 0.9362, test_f1: 0.5232
 epoch: 17, train_loss: 0.9137, test_loss: 0.8518, test_f1: 0.5364
 epoch: 18, train_loss: 0.9227, test_loss: 0.9062, test_f1: 0.5260
 epoch: 19, train_loss: 0.8990, test_loss: 0.8589, test_f1: 0.5265
 epoch: 20, train_loss: 0.8995, test_loss: 0.9128, test_f1: 0.5158
 epoch: 21, train_loss: 0.8915, test_loss: 0.8383, test_f1: 0.5388
 epoch: 22, train_loss: 0.9061, test_loss: 0.8948, test_f1: 0.5388
 epoch: 23, train_loss: 0.8901, test_loss: 0.8986, test_f1: 0.5255
 epoch: 24, train_loss: 0.8820, test_loss: 0.8855, test_f1: 0.5382
 epoch: 25, train_loss: 0.8828, test_loss: 0.8570, test_f1: 0.5382
 epoch: 26, train_loss: 0.8845, test_loss: 0.9087, test_f1: 0.5403
 epoch: 27, train_loss: 0.8754, test_loss: 0.9182, test_f1: 0.5282
 epoch: 28, train_loss: 0.8707, test_loss: 0.9312, test_f1: 0.5328
 epoch: 29, train_loss: 0.8724, test_loss: 0.9020, test_f1: 0.5259
 epoch: 30, train_loss: 0.8577, test_loss: 0.8993, test_f1: 0.5451
 epoch: 31, train_loss: 0.8687, test_loss: 0.9147, test_f1: 0.5364
 epoch: 32, train_loss: 0.8481, test_loss: 0.8684, test_f1: 0.5252
 epoch: 33, train_loss: 0.8416, test_loss: 0.8431, test_f1: 0.5375
 epoch: 34, train_loss: 0.8399, test_loss: 0.8533, test_f1: 0.5397
 epoch: 35, train_loss: 0.8524, test_loss: 0.8727, test_f1: 0.5468
 epoch: 36, train_loss: 0.8439, test_loss: 0.8759, test_f1: 0.5377
 epoch: 37, train_loss: 0.8384, test_loss: 0.8819, test_f1: 0.5127
 epoch: 38, train_loss: 0.8366, test_loss: 0.8889, test_f1: 0.5230
 epoch: 39, train_loss: 0.8341, test_loss: 0.8514, test_f1: 0.5366
 epoch: 40, train_loss: 0.8335, test_loss: 0.8377, test_f1: 0.5412
 epoch: 41, train_loss: 0.8440, test_loss: 0.8624, test_f1: 0.5295
 epoch: 42, train_loss: 0.8089, test_loss: 0.8092, test_f1: 0.5628
 epoch: 43, train_loss: 0.8274, test_loss: 0.8754, test_f1: 0.5244
 epoch: 44, train_loss: 0.8396, test_loss: 0.8667, test_f1: 0.5237
 epoch: 45, train_loss: 0.8157, test_loss: 0.8464, test_f1: 0.5395
 epoch: 46, train_loss: 0.8063, test_loss: 0.8233, test_f1: 0.5405
 epoch: 47, train_loss: 0.8059, test_loss: 0.8908, test_f1: 0.5402
 epoch: 48, train_loss: 0.8199, test_loss: 0.8293, test_f1: 0.5317
 epoch: 49, train_loss: 0.8132, test_loss: 0.8264, test_f1: 0.5523
 epoch: 50, train_loss: 0.8100, test_loss: 0.8201, test_f1: 0.5554
 epoch: 51, train_loss: 0.7927, test_loss: 0.8367, test_f1: 0.5389
 epoch: 52, train_loss: 0.7920, test_loss: 0.8156, test_f1: 0.5477
 epoch: 53, train_loss: 0.7949, test_loss: 0.8404, test_f1: 0.5403
 epoch: 54, train_loss: 0.7908, test_loss: 0.8179, test_f1: 0.5500
 epoch: 55, train_loss: 0.7846, test_loss: 0.8148, test_f1: 0.5438
 epoch: 56, train_loss: 0.7846, test_loss: 0.8070, test_f1: 0.5513
 epoch: 57, train_loss: 0.7855, test_loss: 0.8135, test_f1: 0.5488
 epoch: 58, train_loss: 0.7856, test_loss: 0.8577, test_f1: 0.5160
 epoch: 59, train_loss: 0.7813, test_loss: 0.8265, test_f1: 0.5435
 epoch: 60, train_loss: 0.7830, test_loss: 0.8373, test_f1: 0.5336
 epoch: 61, train_loss: 0.7793, test_loss: 0.8318, test_f1: 0.5449
 epoch: 62, train_loss: 0.7793, test_loss: 0.8279, test_f1: 0.5432
 epoch: 63, train_loss: 0.7721, test_loss: 0.8229, test_f1: 0.5415
 epoch: 64, train_loss: 0.7635, test_loss: 0.8196, test_f1: 0.5480
 epoch: 65, train_loss: 0.7657, test_loss: 0.8071, test_f1: 0.5562
 epoch: 66, train_loss: 0.7706, test_loss: 0.8133, test_f1: 0.5458
 epoch: 67, train_loss: 0.7661, test_loss: 0.8140, test_f1: 0.5534
 epoch: 68, train_loss: 0.7728, test_loss: 0.8049, test_f1: 0.5611
 epoch: 69, train_loss: 0.7592, test_loss: 0.8136, test_f1: 0.5511
 epoch: 70, train_loss: 0.7672, test_loss: 0.8419, test_f1: 0.5495
 epoch: 71, train_loss: 0.7662, test_loss: 0.8249, test_f1: 0.5389
 epoch: 72, train_loss: 0.7757, test_loss: 0.8186, test_f1: 0.5522
 epoch: 73, train_loss: 0.7645, test_loss: 0.8189, test_f1: 0.5559
 epoch: 74, train_loss: 0.7696, test_loss: 0.8250, test_f1: 0.5512
 epoch: 75, train_loss: 0.7479, test_loss: 0.8270, test_f1: 0.5514
 epoch: 76, train_loss: 0.7604, test_loss: 0.8319, test_f1: 0.5567
 epoch: 77, train_loss: 0.7631, test_loss: 0.8167, test_f1: 0.5612
 epoch: 78, train_loss: 0.7559, test_loss: 0.8229, test_f1: 0.5486
 epoch: 79, train_loss: 0.7537, test_loss: 0.8116, test_f1: 0.5557
 epoch: 80, train_loss: 0.7571, test_loss: 0.8127, test_f1: 0.5532
 epoch: 81, train_loss: 0.7488, test_loss: 0.8220, test_f1: 0.5605
 epoch: 82, train_loss: 0.7558, test_loss: 0.8373, test_f1: 0.5612
 epoch: 83, train_loss: 0.7582, test_loss: 0.8092, test_f1: 0.5654
 epoch: 84, train_loss: 0.7556, test_loss: 0.8260, test_f1: 0.5628
 epoch: 85, train_loss: 0.7468, test_loss: 0.8012, test_f1: 0.5415
 epoch: 86, train_loss: 0.7580, test_loss: 0.8234, test_f1: 0.5542
 epoch: 87, train_loss: 0.7408, test_loss: 0.8252, test_f1: 0.5591
 epoch: 88, train_loss: 0.7509, test_loss: 0.8214, test_f1: 0.5534
 epoch: 89, train_loss: 0.7477, test_loss: 0.8339, test_f1: 0.5534
 epoch: 90, train_loss: 0.7479, test_loss: 0.8165, test_f1: 0.5567
 epoch: 91, train_loss: 0.7415, test_loss: 0.8186, test_f1: 0.5514
 epoch: 92, train_loss: 0.7515, test_loss: 0.8203, test_f1: 0.5578
 epoch: 93, train_loss: 0.7398, test_loss: 0.8340, test_f1: 0.5523
 epoch: 94, train_loss: 0.7343, test_loss: 0.8022, test_f1: 0.5499
 epoch: 95, train_loss: 0.7367, test_loss: 0.8188, test_f1: 0.5541
 epoch: 96, train_loss: 0.7354, test_loss: 0.8122, test_f1: 0.5693
 epoch: 97, train_loss: 0.7354, test_loss: 0.7912, test_f1: 0.5626
 epoch: 98, train_loss: 0.7268, test_loss: 0.8183, test_f1: 0.5577
 epoch: 99, train_loss: 0.7218, test_loss: 0.8235, test_f1: 0.5582
##################ITERATION #5 ****************************************
 epoch: 0, train_loss: 1.2473, test_loss: 1.1650, test_f1: 0.3119
 epoch: 1, train_loss: 1.1179, test_loss: 1.0722, test_f1: 0.3481
 epoch: 2, train_loss: 1.0729, test_loss: 1.0469, test_f1: 0.3901
 epoch: 3, train_loss: 1.0604, test_loss: 1.0698, test_f1: 0.3875
 epoch: 4, train_loss: 1.0340, test_loss: 1.0630, test_f1: 0.4037
 epoch: 5, train_loss: 1.0237, test_loss: 1.0626, test_f1: 0.4599
 epoch: 6, train_loss: 1.0155, test_loss: 1.0347, test_f1: 0.4661
 epoch: 7, train_loss: 0.9891, test_loss: 1.0406, test_f1: 0.4701
 epoch: 8, train_loss: 0.9807, test_loss: 1.0329, test_f1: 0.4621
 epoch: 9, train_loss: 0.9838, test_loss: 1.0393, test_f1: 0.4851
 epoch: 10, train_loss: 0.9558, test_loss: 1.0090, test_f1: 0.5012
 epoch: 11, train_loss: 0.9586, test_loss: 1.0392, test_f1: 0.4833
 epoch: 12, train_loss: 0.9336, test_loss: 1.0127, test_f1: 0.4969
 epoch: 13, train_loss: 0.9361, test_loss: 1.0262, test_f1: 0.4997
 epoch: 14, train_loss: 0.9293, test_loss: 1.0311, test_f1: 0.4975
 epoch: 15, train_loss: 0.9240, test_loss: 0.9999, test_f1: 0.5127
 epoch: 16, train_loss: 0.9187, test_loss: 1.0237, test_f1: 0.4862
 epoch: 17, train_loss: 0.9127, test_loss: 1.0131, test_f1: 0.5260
 epoch: 18, train_loss: 0.9015, test_loss: 0.9849, test_f1: 0.5156
 epoch: 19, train_loss: 0.8966, test_loss: 0.9942, test_f1: 0.4979
 epoch: 20, train_loss: 0.8940, test_loss: 0.9602, test_f1: 0.5313
 epoch: 21, train_loss: 0.8927, test_loss: 1.0234, test_f1: 0.5145
 epoch: 22, train_loss: 0.8858, test_loss: 1.0444, test_f1: 0.5062
 epoch: 23, train_loss: 0.8836, test_loss: 0.9897, test_f1: 0.5299
 epoch: 24, train_loss: 0.8780, test_loss: 1.0028, test_f1: 0.5033
 epoch: 25, train_loss: 0.8749, test_loss: 0.9721, test_f1: 0.5217
 epoch: 26, train_loss: 0.8732, test_loss: 1.0073, test_f1: 0.5106
 epoch: 27, train_loss: 0.8783, test_loss: 0.9956, test_f1: 0.4933
 epoch: 28, train_loss: 0.8795, test_loss: 1.0257, test_f1: 0.5196
 epoch: 29, train_loss: 0.8614, test_loss: 0.9824, test_f1: 0.4933
 epoch: 30, train_loss: 0.8567, test_loss: 0.9982, test_f1: 0.5295
 epoch: 31, train_loss: 0.8462, test_loss: 1.0909, test_f1: 0.5032
 epoch: 32, train_loss: 0.8544, test_loss: 0.9484, test_f1: 0.5343
 epoch: 33, train_loss: 0.8455, test_loss: 0.9596, test_f1: 0.5255
 epoch: 34, train_loss: 0.8440, test_loss: 1.0340, test_f1: 0.4802
 epoch: 35, train_loss: 0.8474, test_loss: 1.0361, test_f1: 0.4929
 epoch: 36, train_loss: 0.8438, test_loss: 0.9838, test_f1: 0.5018
 epoch: 37, train_loss: 0.8444, test_loss: 0.9091, test_f1: 0.5397
 epoch: 38, train_loss: 0.8290, test_loss: 0.9199, test_f1: 0.5341
 epoch: 39, train_loss: 0.8261, test_loss: 0.9209, test_f1: 0.5320
 epoch: 40, train_loss: 0.8275, test_loss: 1.0116, test_f1: 0.5231
 epoch: 41, train_loss: 0.8325, test_loss: 0.9432, test_f1: 0.5305
 epoch: 42, train_loss: 0.8397, test_loss: 0.9435, test_f1: 0.5428
 epoch: 43, train_loss: 0.8218, test_loss: 0.9337, test_f1: 0.5338
 epoch: 44, train_loss: 0.8237, test_loss: 0.9909, test_f1: 0.5022
 epoch: 45, train_loss: 0.8206, test_loss: 0.9308, test_f1: 0.5229
 epoch: 46, train_loss: 0.8165, test_loss: 0.9173, test_f1: 0.5338
 epoch: 47, train_loss: 0.8025, test_loss: 0.9695, test_f1: 0.5210
 epoch: 48, train_loss: 0.8207, test_loss: 0.9859, test_f1: 0.5346
 epoch: 49, train_loss: 0.8100, test_loss: 0.9058, test_f1: 0.5486
 epoch: 50, train_loss: 0.8065, test_loss: 0.8990, test_f1: 0.5425
 epoch: 51, train_loss: 0.7883, test_loss: 0.9697, test_f1: 0.5358
 epoch: 52, train_loss: 0.7815, test_loss: 0.9474, test_f1: 0.5285
 epoch: 53, train_loss: 0.7883, test_loss: 0.9461, test_f1: 0.5288
 epoch: 54, train_loss: 0.7773, test_loss: 0.9371, test_f1: 0.5411
 epoch: 55, train_loss: 0.7822, test_loss: 1.0145, test_f1: 0.5156
 epoch: 56, train_loss: 0.7944, test_loss: 0.9323, test_f1: 0.5403
 epoch: 57, train_loss: 0.7844, test_loss: 0.9548, test_f1: 0.5279
 epoch: 58, train_loss: 0.7835, test_loss: 0.9413, test_f1: 0.5297
 epoch: 59, train_loss: 0.7630, test_loss: 0.9040, test_f1: 0.5453
 epoch: 60, train_loss: 0.7717, test_loss: 0.9513, test_f1: 0.5327
 epoch: 61, train_loss: 0.7726, test_loss: 0.9619, test_f1: 0.5293
 epoch: 62, train_loss: 0.7805, test_loss: 0.9330, test_f1: 0.5291
 epoch: 63, train_loss: 0.7731, test_loss: 0.9307, test_f1: 0.5294
 epoch: 64, train_loss: 0.7697, test_loss: 0.9478, test_f1: 0.5059
 epoch: 65, train_loss: 0.7700, test_loss: 0.9539, test_f1: 0.5423
 epoch: 66, train_loss: 0.7766, test_loss: 0.9507, test_f1: 0.5370
 epoch: 67, train_loss: 0.7669, test_loss: 0.9677, test_f1: 0.5320
 epoch: 68, train_loss: 0.7537, test_loss: 0.9376, test_f1: 0.5448
 epoch: 69, train_loss: 0.7677, test_loss: 0.9378, test_f1: 0.5370
 epoch: 70, train_loss: 0.7665, test_loss: 0.9350, test_f1: 0.5428
 epoch: 71, train_loss: 0.7595, test_loss: 0.9558, test_f1: 0.5317
 epoch: 72, train_loss: 0.7627, test_loss: 0.9659, test_f1: 0.5322
 epoch: 73, train_loss: 0.7536, test_loss: 0.9565, test_f1: 0.5405
 epoch: 74, train_loss: 0.7630, test_loss: 0.9792, test_f1: 0.5272
 epoch: 75, train_loss: 0.7589, test_loss: 0.9813, test_f1: 0.5238
 epoch: 76, train_loss: 0.7488, test_loss: 0.9597, test_f1: 0.5339
 epoch: 77, train_loss: 0.7487, test_loss: 0.9732, test_f1: 0.5452
 epoch: 78, train_loss: 0.7561, test_loss: 0.9691, test_f1: 0.5302
 epoch: 79, train_loss: 0.7586, test_loss: 0.9816, test_f1: 0.5387
 epoch: 80, train_loss: 0.7602, test_loss: 0.9890, test_f1: 0.5196
 epoch: 81, train_loss: 0.7594, test_loss: 0.9975, test_f1: 0.5289
 epoch: 82, train_loss: 0.7525, test_loss: 0.9705, test_f1: 0.5369
 epoch: 83, train_loss: 0.7483, test_loss: 0.9828, test_f1: 0.5191
 epoch: 84, train_loss: 0.7589, test_loss: 0.9711, test_f1: 0.5266
 epoch: 85, train_loss: 0.7471, test_loss: 1.0079, test_f1: 0.5241
 epoch: 86, train_loss: 0.7437, test_loss: 0.9354, test_f1: 0.5420
 epoch: 87, train_loss: 0.7461, test_loss: 0.9676, test_f1: 0.5325
 epoch: 88, train_loss: 0.7655, test_loss: 0.9662, test_f1: 0.5242
 epoch: 89, train_loss: 0.7494, test_loss: 0.9811, test_f1: 0.5367
 epoch: 90, train_loss: 0.7409, test_loss: 0.9803, test_f1: 0.5310
 epoch: 91, train_loss: 0.7403, test_loss: 0.9687, test_f1: 0.5334
 epoch: 92, train_loss: 0.7481, test_loss: 0.9559, test_f1: 0.5450
 epoch: 93, train_loss: 0.7440, test_loss: 0.9805, test_f1: 0.5259
 epoch: 94, train_loss: 0.7506, test_loss: 0.9749, test_f1: 0.5413
 epoch: 95, train_loss: 0.7349, test_loss: 0.8983, test_f1: 0.5372
 epoch: 96, train_loss: 0.7398, test_loss: 0.9913, test_f1: 0.5320
 epoch: 97, train_loss: 0.7394, test_loss: 0.9438, test_f1: 0.5461
 epoch: 98, train_loss: 0.7482, test_loss: 0.9781, test_f1: 0.5445
 epoch: 99, train_loss: 0.7241, test_loss: 0.9682, test_f1: 0.5392
##################ITERATION #6 ****************************************
 epoch: 0, train_loss: 1.2434, test_loss: 1.2074, test_f1: 0.2431
 epoch: 1, train_loss: 1.0704, test_loss: 1.0339, test_f1: 0.4326
 epoch: 2, train_loss: 1.0377, test_loss: 0.9897, test_f1: 0.4579
 epoch: 3, train_loss: 1.0176, test_loss: 0.9842, test_f1: 0.4697
 epoch: 4, train_loss: 0.9855, test_loss: 0.9904, test_f1: 0.4808
 epoch: 5, train_loss: 0.9801, test_loss: 0.9529, test_f1: 0.4954
 epoch: 6, train_loss: 0.9709, test_loss: 0.9584, test_f1: 0.4955
 epoch: 7, train_loss: 0.9526, test_loss: 0.9988, test_f1: 0.4645
 epoch: 8, train_loss: 0.9360, test_loss: 0.9535, test_f1: 0.4975
 epoch: 9, train_loss: 0.9345, test_loss: 0.9491, test_f1: 0.5000
 epoch: 10, train_loss: 0.9156, test_loss: 0.9343, test_f1: 0.4865
 epoch: 11, train_loss: 0.9308, test_loss: 0.9401, test_f1: 0.4999
 epoch: 12, train_loss: 0.9095, test_loss: 1.0051, test_f1: 0.4838
 epoch: 13, train_loss: 0.9145, test_loss: 0.9740, test_f1: 0.5106
 epoch: 14, train_loss: 0.9037, test_loss: 0.9188, test_f1: 0.5193
 epoch: 15, train_loss: 0.8969, test_loss: 0.9612, test_f1: 0.4824
 epoch: 16, train_loss: 0.8674, test_loss: 0.9229, test_f1: 0.5166
 epoch: 17, train_loss: 0.8880, test_loss: 0.9496, test_f1: 0.5116
 epoch: 18, train_loss: 0.8763, test_loss: 0.9524, test_f1: 0.5051
 epoch: 19, train_loss: 0.8829, test_loss: 0.9404, test_f1: 0.5159
 epoch: 20, train_loss: 0.8698, test_loss: 1.0040, test_f1: 0.4597
 epoch: 21, train_loss: 0.8555, test_loss: 1.0198, test_f1: 0.4948
 epoch: 22, train_loss: 0.8506, test_loss: 0.9094, test_f1: 0.5371
 epoch: 23, train_loss: 0.8557, test_loss: 0.9298, test_f1: 0.4872
 epoch: 24, train_loss: 0.8602, test_loss: 0.9321, test_f1: 0.5022
 epoch: 25, train_loss: 0.8458, test_loss: 0.9700, test_f1: 0.5081
 epoch: 26, train_loss: 0.8602, test_loss: 0.9322, test_f1: 0.5151
 epoch: 27, train_loss: 0.8527, test_loss: 0.8818, test_f1: 0.5311
 epoch: 28, train_loss: 0.8348, test_loss: 0.9154, test_f1: 0.5294
 epoch: 29, train_loss: 0.8293, test_loss: 0.9263, test_f1: 0.5177
 epoch: 30, train_loss: 0.8264, test_loss: 0.8950, test_f1: 0.5178
 epoch: 31, train_loss: 0.8140, test_loss: 0.9469, test_f1: 0.5008
 epoch: 32, train_loss: 0.8181, test_loss: 0.9836, test_f1: 0.4852
 epoch: 33, train_loss: 0.8179, test_loss: 0.8971, test_f1: 0.5111
 epoch: 34, train_loss: 0.8179, test_loss: 0.8785, test_f1: 0.5414
 epoch: 35, train_loss: 0.8081, test_loss: 0.9217, test_f1: 0.5266
 epoch: 36, train_loss: 0.8031, test_loss: 0.9106, test_f1: 0.5397
 epoch: 37, train_loss: 0.8144, test_loss: 0.9374, test_f1: 0.5048
 epoch: 38, train_loss: 0.8091, test_loss: 0.8790, test_f1: 0.5469
 epoch: 39, train_loss: 0.8006, test_loss: 0.9140, test_f1: 0.4958
 epoch: 40, train_loss: 0.8008, test_loss: 0.8857, test_f1: 0.5229
 epoch: 41, train_loss: 0.7978, test_loss: 0.9309, test_f1: 0.5065
 epoch: 42, train_loss: 0.7914, test_loss: 0.8890, test_f1: 0.5462
 epoch: 43, train_loss: 0.7928, test_loss: 0.8864, test_f1: 0.5423
 epoch: 44, train_loss: 0.7962, test_loss: 0.9613, test_f1: 0.4973
 epoch: 45, train_loss: 0.7820, test_loss: 0.9365, test_f1: 0.4884
 epoch: 46, train_loss: 0.7778, test_loss: 0.9305, test_f1: 0.5229
 epoch: 47, train_loss: 0.7890, test_loss: 0.9892, test_f1: 0.4815
 epoch: 48, train_loss: 0.7802, test_loss: 0.8831, test_f1: 0.5511
 epoch: 49, train_loss: 0.7765, test_loss: 0.8726, test_f1: 0.5474
 epoch: 50, train_loss: 0.7878, test_loss: 0.9368, test_f1: 0.4894
 epoch: 51, train_loss: 0.7736, test_loss: 0.8628, test_f1: 0.5519
 epoch: 52, train_loss: 0.7571, test_loss: 0.8829, test_f1: 0.5302
 epoch: 53, train_loss: 0.7646, test_loss: 0.8796, test_f1: 0.5266
 epoch: 54, train_loss: 0.7585, test_loss: 0.9051, test_f1: 0.5205
 epoch: 55, train_loss: 0.7613, test_loss: 0.8710, test_f1: 0.5328
 epoch: 56, train_loss: 0.7438, test_loss: 0.8642, test_f1: 0.5468
 epoch: 57, train_loss: 0.7442, test_loss: 0.8875, test_f1: 0.5293
 epoch: 58, train_loss: 0.7471, test_loss: 0.8959, test_f1: 0.5265
 epoch: 59, train_loss: 0.7451, test_loss: 0.8954, test_f1: 0.5219
 epoch: 60, train_loss: 0.7492, test_loss: 0.8891, test_f1: 0.5309
 epoch: 61, train_loss: 0.7430, test_loss: 0.8938, test_f1: 0.5266
 epoch: 62, train_loss: 0.7450, test_loss: 0.9122, test_f1: 0.5352
 epoch: 63, train_loss: 0.7557, test_loss: 0.9490, test_f1: 0.5165
 epoch: 64, train_loss: 0.7529, test_loss: 0.9262, test_f1: 0.5298
 epoch: 65, train_loss: 0.7500, test_loss: 0.8952, test_f1: 0.5372
 epoch: 66, train_loss: 0.7376, test_loss: 0.8895, test_f1: 0.5257
 epoch: 67, train_loss: 0.7501, test_loss: 0.8891, test_f1: 0.5230
 epoch: 68, train_loss: 0.7370, test_loss: 0.8945, test_f1: 0.5534
 epoch: 69, train_loss: 0.7377, test_loss: 0.8893, test_f1: 0.5345
 epoch: 70, train_loss: 0.7502, test_loss: 0.8917, test_f1: 0.5448
 epoch: 71, train_loss: 0.7446, test_loss: 0.9110, test_f1: 0.5292
 epoch: 72, train_loss: 0.7294, test_loss: 0.9050, test_f1: 0.5277
 epoch: 73, train_loss: 0.7421, test_loss: 0.9353, test_f1: 0.5267
 epoch: 74, train_loss: 0.7338, test_loss: 0.8978, test_f1: 0.5535
 epoch: 75, train_loss: 0.7377, test_loss: 0.9041, test_f1: 0.5296
 epoch: 76, train_loss: 0.7371, test_loss: 0.9426, test_f1: 0.5235
 epoch: 77, train_loss: 0.7438, test_loss: 0.9445, test_f1: 0.5275
 epoch: 78, train_loss: 0.7220, test_loss: 0.9166, test_f1: 0.5407
 epoch: 79, train_loss: 0.7303, test_loss: 0.8996, test_f1: 0.5428
 epoch: 80, train_loss: 0.7344, test_loss: 0.9013, test_f1: 0.5361
 epoch: 81, train_loss: 0.7271, test_loss: 0.9292, test_f1: 0.5363
 epoch: 82, train_loss: 0.7202, test_loss: 0.9048, test_f1: 0.5450
 epoch: 83, train_loss: 0.7322, test_loss: 0.9099, test_f1: 0.5402
 epoch: 84, train_loss: 0.7219, test_loss: 0.9012, test_f1: 0.5373
 epoch: 85, train_loss: 0.7262, test_loss: 0.9180, test_f1: 0.5410
 epoch: 86, train_loss: 0.7325, test_loss: 0.8880, test_f1: 0.5505
 epoch: 87, train_loss: 0.7176, test_loss: 0.8921, test_f1: 0.5581
 epoch: 88, train_loss: 0.7272, test_loss: 0.9275, test_f1: 0.5278
 epoch: 89, train_loss: 0.7235, test_loss: 0.9291, test_f1: 0.5457
 epoch: 90, train_loss: 0.7303, test_loss: 0.9060, test_f1: 0.5485
 epoch: 91, train_loss: 0.7142, test_loss: 0.9504, test_f1: 0.5334
 epoch: 92, train_loss: 0.7311, test_loss: 0.9336, test_f1: 0.5257
 epoch: 93, train_loss: 0.7044, test_loss: 0.9079, test_f1: 0.5449
 epoch: 94, train_loss: 0.7180, test_loss: 0.9308, test_f1: 0.5420
 epoch: 95, train_loss: 0.7247, test_loss: 0.9380, test_f1: 0.5385
 epoch: 96, train_loss: 0.7207, test_loss: 0.9275, test_f1: 0.5502
 epoch: 97, train_loss: 0.7335, test_loss: 0.9464, test_f1: 0.5308
 epoch: 98, train_loss: 0.7266, test_loss: 0.9501, test_f1: 0.5412
 epoch: 99, train_loss: 0.7170, test_loss: 0.9418, test_f1: 0.5423
##################ITERATION #7 ****************************************
 epoch: 0, train_loss: 1.2500, test_loss: 1.2855, test_f1: 0.2586
 epoch: 1, train_loss: 1.1195, test_loss: 1.0314, test_f1: 0.4216
 epoch: 2, train_loss: 1.0870, test_loss: 1.0250, test_f1: 0.3921
 epoch: 3, train_loss: 1.0635, test_loss: 1.0243, test_f1: 0.4574
 epoch: 4, train_loss: 1.0500, test_loss: 1.0279, test_f1: 0.4116
 epoch: 5, train_loss: 1.0479, test_loss: 1.0160, test_f1: 0.4221
 epoch: 6, train_loss: 1.0347, test_loss: 1.0291, test_f1: 0.4327
 epoch: 7, train_loss: 1.0249, test_loss: 1.0228, test_f1: 0.4686
 epoch: 8, train_loss: 1.0211, test_loss: 1.0126, test_f1: 0.4990
 epoch: 9, train_loss: 1.0124, test_loss: 1.0217, test_f1: 0.4382
 epoch: 10, train_loss: 1.0034, test_loss: 1.0021, test_f1: 0.4895
 epoch: 11, train_loss: 0.9930, test_loss: 1.0347, test_f1: 0.4498
 epoch: 12, train_loss: 0.9955, test_loss: 1.0374, test_f1: 0.4747
 epoch: 13, train_loss: 0.9794, test_loss: 0.9884, test_f1: 0.5066
 epoch: 14, train_loss: 0.9778, test_loss: 0.9891, test_f1: 0.4955
 epoch: 15, train_loss: 0.9650, test_loss: 0.9816, test_f1: 0.5086
 epoch: 16, train_loss: 0.9608, test_loss: 0.9580, test_f1: 0.5096
 epoch: 17, train_loss: 0.9607, test_loss: 0.9660, test_f1: 0.5129
 epoch: 18, train_loss: 0.9451, test_loss: 0.9544, test_f1: 0.5274
 epoch: 19, train_loss: 0.9293, test_loss: 0.9400, test_f1: 0.5177
 epoch: 20, train_loss: 0.9314, test_loss: 0.9839, test_f1: 0.5137
 epoch: 21, train_loss: 0.9214, test_loss: 0.9512, test_f1: 0.5222
 epoch: 22, train_loss: 0.9197, test_loss: 0.9458, test_f1: 0.5136
 epoch: 23, train_loss: 0.9143, test_loss: 0.9249, test_f1: 0.5536
 epoch: 24, train_loss: 0.9091, test_loss: 0.9242, test_f1: 0.5496
 epoch: 25, train_loss: 0.9097, test_loss: 0.9355, test_f1: 0.5487
 epoch: 26, train_loss: 0.8835, test_loss: 0.8894, test_f1: 0.5456
 epoch: 27, train_loss: 0.8991, test_loss: 0.9155, test_f1: 0.5256
 epoch: 28, train_loss: 0.8880, test_loss: 0.8964, test_f1: 0.5324
 epoch: 29, train_loss: 0.8822, test_loss: 0.8977, test_f1: 0.5297
 epoch: 30, train_loss: 0.8865, test_loss: 0.8939, test_f1: 0.5458
 epoch: 31, train_loss: 0.8873, test_loss: 0.8977, test_f1: 0.5350
 epoch: 32, train_loss: 0.8626, test_loss: 0.9230, test_f1: 0.5319
 epoch: 33, train_loss: 0.8621, test_loss: 0.8807, test_f1: 0.5492
 epoch: 34, train_loss: 0.8653, test_loss: 0.8940, test_f1: 0.5377
 epoch: 35, train_loss: 0.8545, test_loss: 0.8950, test_f1: 0.5394
 epoch: 36, train_loss: 0.8498, test_loss: 0.8965, test_f1: 0.5457
 epoch: 37, train_loss: 0.8518, test_loss: 0.9428, test_f1: 0.5512
 epoch: 38, train_loss: 0.8628, test_loss: 0.9987, test_f1: 0.5106
 epoch: 39, train_loss: 0.8503, test_loss: 0.9592, test_f1: 0.5466
 epoch: 40, train_loss: 0.8510, test_loss: 0.8975, test_f1: 0.5309
 epoch: 41, train_loss: 0.8421, test_loss: 0.8868, test_f1: 0.5369
 epoch: 42, train_loss: 0.8332, test_loss: 0.8670, test_f1: 0.5428
 epoch: 43, train_loss: 0.8400, test_loss: 0.8717, test_f1: 0.5280
 epoch: 44, train_loss: 0.8366, test_loss: 0.8718, test_f1: 0.5381
 epoch: 45, train_loss: 0.8382, test_loss: 0.9266, test_f1: 0.4927
 epoch: 46, train_loss: 0.8313, test_loss: 0.8710, test_f1: 0.5307
 epoch: 47, train_loss: 0.8343, test_loss: 0.8674, test_f1: 0.5536
 epoch: 48, train_loss: 0.8182, test_loss: 0.9144, test_f1: 0.5230
 epoch: 49, train_loss: 0.8150, test_loss: 0.9044, test_f1: 0.5258
 epoch: 50, train_loss: 0.8137, test_loss: 0.9086, test_f1: 0.5161
 epoch: 51, train_loss: 0.8019, test_loss: 0.8849, test_f1: 0.5429
 epoch: 52, train_loss: 0.8181, test_loss: 0.8520, test_f1: 0.5444
 epoch: 53, train_loss: 0.8005, test_loss: 0.9094, test_f1: 0.5256
 epoch: 54, train_loss: 0.8010, test_loss: 0.8823, test_f1: 0.5349
 epoch: 55, train_loss: 0.8032, test_loss: 0.9147, test_f1: 0.5295
 epoch: 56, train_loss: 0.7922, test_loss: 0.8850, test_f1: 0.5300
 epoch: 57, train_loss: 0.7962, test_loss: 0.8970, test_f1: 0.5352
 epoch: 58, train_loss: 0.7945, test_loss: 0.8780, test_f1: 0.5522
 epoch: 59, train_loss: 0.7981, test_loss: 0.8828, test_f1: 0.5517
 epoch: 60, train_loss: 0.7944, test_loss: 0.8736, test_f1: 0.5369
 epoch: 61, train_loss: 0.7931, test_loss: 0.8656, test_f1: 0.5483
 epoch: 62, train_loss: 0.7888, test_loss: 0.8976, test_f1: 0.5347
 epoch: 63, train_loss: 0.7902, test_loss: 0.8748, test_f1: 0.5390
 epoch: 64, train_loss: 0.8006, test_loss: 0.9422, test_f1: 0.5187
 epoch: 65, train_loss: 0.7986, test_loss: 0.9047, test_f1: 0.5260
 epoch: 66, train_loss: 0.7845, test_loss: 0.9042, test_f1: 0.5370
 epoch: 67, train_loss: 0.7920, test_loss: 0.8568, test_f1: 0.5596
 epoch: 68, train_loss: 0.7831, test_loss: 0.8627, test_f1: 0.5402
 epoch: 69, train_loss: 0.7947, test_loss: 0.8961, test_f1: 0.5390
 epoch: 70, train_loss: 0.7766, test_loss: 0.9154, test_f1: 0.5230
 epoch: 71, train_loss: 0.7902, test_loss: 0.9314, test_f1: 0.5297
 epoch: 72, train_loss: 0.7844, test_loss: 0.9048, test_f1: 0.5442
 epoch: 73, train_loss: 0.7809, test_loss: 0.8705, test_f1: 0.5573
 epoch: 74, train_loss: 0.7712, test_loss: 0.9018, test_f1: 0.5371
 epoch: 75, train_loss: 0.7916, test_loss: 1.0076, test_f1: 0.4975
 epoch: 76, train_loss: 0.7770, test_loss: 0.8827, test_f1: 0.5423
 epoch: 77, train_loss: 0.7727, test_loss: 0.9399, test_f1: 0.5433
 epoch: 78, train_loss: 0.7760, test_loss: 0.9401, test_f1: 0.5272
 epoch: 79, train_loss: 0.7752, test_loss: 0.9073, test_f1: 0.5379
 epoch: 80, train_loss: 0.7737, test_loss: 0.9374, test_f1: 0.5309
 epoch: 81, train_loss: 0.7729, test_loss: 0.8675, test_f1: 0.5580
 epoch: 82, train_loss: 0.7690, test_loss: 0.8907, test_f1: 0.5526
 epoch: 83, train_loss: 0.7651, test_loss: 0.8923, test_f1: 0.5553
 epoch: 84, train_loss: 0.7694, test_loss: 0.8779, test_f1: 0.5643
 epoch: 85, train_loss: 0.7690, test_loss: 0.8752, test_f1: 0.5424
 epoch: 86, train_loss: 0.7660, test_loss: 0.8847, test_f1: 0.5484
 epoch: 87, train_loss: 0.7606, test_loss: 0.8900, test_f1: 0.5447
 epoch: 88, train_loss: 0.7585, test_loss: 0.8760, test_f1: 0.5562
 epoch: 89, train_loss: 0.7602, test_loss: 0.8652, test_f1: 0.5564
 epoch: 90, train_loss: 0.7746, test_loss: 0.8810, test_f1: 0.5446
 epoch: 91, train_loss: 0.7745, test_loss: 0.9111, test_f1: 0.5414
 epoch: 92, train_loss: 0.7553, test_loss: 0.9106, test_f1: 0.5501
 epoch: 93, train_loss: 0.7568, test_loss: 0.8708, test_f1: 0.5849
 epoch: 94, train_loss: 0.7644, test_loss: 0.9012, test_f1: 0.5628
 epoch: 95, train_loss: 0.7676, test_loss: 0.8736, test_f1: 0.5607
 epoch: 96, train_loss: 0.7686, test_loss: 0.8796, test_f1: 0.5637
 epoch: 97, train_loss: 0.7567, test_loss: 0.8651, test_f1: 0.5693
 epoch: 98, train_loss: 0.7694, test_loss: 0.9296, test_f1: 0.5373
 epoch: 99, train_loss: 0.7624, test_loss: 0.9428, test_f1: 0.5293
##################ITERATION #8 ****************************************
 epoch: 0, train_loss: 1.2932, test_loss: 1.2917, test_f1: 0.2571
 epoch: 1, train_loss: 1.1254, test_loss: 1.0464, test_f1: 0.4190
 epoch: 2, train_loss: 1.0917, test_loss: 1.0287, test_f1: 0.4270
 epoch: 3, train_loss: 1.0702, test_loss: 1.0561, test_f1: 0.4068
 epoch: 4, train_loss: 1.0639, test_loss: 1.0119, test_f1: 0.4495
 epoch: 5, train_loss: 1.0372, test_loss: 1.0390, test_f1: 0.4358
 epoch: 6, train_loss: 1.0203, test_loss: 1.0216, test_f1: 0.4352
 epoch: 7, train_loss: 0.9954, test_loss: 1.0180, test_f1: 0.4700
 epoch: 8, train_loss: 0.9962, test_loss: 1.0460, test_f1: 0.4305
 epoch: 9, train_loss: 0.9848, test_loss: 0.9834, test_f1: 0.4812
 epoch: 10, train_loss: 0.9723, test_loss: 1.0033, test_f1: 0.4912
 epoch: 11, train_loss: 0.9732, test_loss: 1.0309, test_f1: 0.4607
 epoch: 12, train_loss: 0.9607, test_loss: 1.0196, test_f1: 0.5027
 epoch: 13, train_loss: 0.9626, test_loss: 1.0388, test_f1: 0.4798
 epoch: 14, train_loss: 0.9535, test_loss: 1.0060, test_f1: 0.4835
 epoch: 15, train_loss: 0.9434, test_loss: 1.0149, test_f1: 0.4868
 epoch: 16, train_loss: 0.9425, test_loss: 1.0171, test_f1: 0.4888
 epoch: 17, train_loss: 0.9248, test_loss: 1.0045, test_f1: 0.4961
 epoch: 18, train_loss: 0.9297, test_loss: 0.9982, test_f1: 0.4985
 epoch: 19, train_loss: 0.9349, test_loss: 0.9862, test_f1: 0.4810
 epoch: 20, train_loss: 0.9254, test_loss: 0.9979, test_f1: 0.5011
 epoch: 21, train_loss: 0.9193, test_loss: 1.0007, test_f1: 0.5115
 epoch: 22, train_loss: 0.9038, test_loss: 1.0236, test_f1: 0.5131
 epoch: 23, train_loss: 0.9082, test_loss: 0.9833, test_f1: 0.5026
 epoch: 24, train_loss: 0.8983, test_loss: 0.9875, test_f1: 0.5107
 epoch: 25, train_loss: 0.9065, test_loss: 0.9677, test_f1: 0.5073
 epoch: 26, train_loss: 0.8927, test_loss: 0.9911, test_f1: 0.4920
 epoch: 27, train_loss: 0.8979, test_loss: 0.9896, test_f1: 0.5174
 epoch: 28, train_loss: 0.8841, test_loss: 1.0022, test_f1: 0.4856
 epoch: 29, train_loss: 0.8919, test_loss: 0.9927, test_f1: 0.4951
 epoch: 30, train_loss: 0.8783, test_loss: 0.9523, test_f1: 0.5367
 epoch: 31, train_loss: 0.8954, test_loss: 0.9859, test_f1: 0.5331
 epoch: 32, train_loss: 0.8862, test_loss: 0.9536, test_f1: 0.5381
 epoch: 33, train_loss: 0.8769, test_loss: 0.9914, test_f1: 0.5270
 epoch: 34, train_loss: 0.8706, test_loss: 0.9564, test_f1: 0.5008
 epoch: 35, train_loss: 0.8718, test_loss: 0.9600, test_f1: 0.5391
 epoch: 36, train_loss: 0.8775, test_loss: 0.9670, test_f1: 0.5202
 epoch: 37, train_loss: 0.8763, test_loss: 0.9880, test_f1: 0.5082
 epoch: 38, train_loss: 0.8613, test_loss: 0.9859, test_f1: 0.5339
 epoch: 39, train_loss: 0.8623, test_loss: 1.0061, test_f1: 0.5050
 epoch: 40, train_loss: 0.8557, test_loss: 0.9562, test_f1: 0.5433
 epoch: 41, train_loss: 0.8605, test_loss: 0.9506, test_f1: 0.5256
 epoch: 42, train_loss: 0.8479, test_loss: 0.9365, test_f1: 0.5306
 epoch: 43, train_loss: 0.8550, test_loss: 1.0028, test_f1: 0.5077
 epoch: 44, train_loss: 0.8627, test_loss: 0.9976, test_f1: 0.5064
 epoch: 45, train_loss: 0.8404, test_loss: 0.9452, test_f1: 0.5314
 epoch: 46, train_loss: 0.8478, test_loss: 0.9973, test_f1: 0.5091
 epoch: 47, train_loss: 0.8414, test_loss: 1.0116, test_f1: 0.5299
 epoch: 48, train_loss: 0.8533, test_loss: 0.9729, test_f1: 0.5424
 epoch: 49, train_loss: 0.8227, test_loss: 0.9544, test_f1: 0.5353
 epoch: 50, train_loss: 0.8353, test_loss: 0.9454, test_f1: 0.5433
 epoch: 51, train_loss: 0.8190, test_loss: 0.9446, test_f1: 0.5619
 epoch: 52, train_loss: 0.8096, test_loss: 0.9739, test_f1: 0.5633
 epoch: 53, train_loss: 0.8156, test_loss: 0.9415, test_f1: 0.5471
 epoch: 54, train_loss: 0.8364, test_loss: 0.9489, test_f1: 0.5393
 epoch: 55, train_loss: 0.8194, test_loss: 0.9679, test_f1: 0.5376
 epoch: 56, train_loss: 0.8203, test_loss: 0.9562, test_f1: 0.5528
 epoch: 57, train_loss: 0.8126, test_loss: 1.0197, test_f1: 0.5080
 epoch: 58, train_loss: 0.8133, test_loss: 0.9668, test_f1: 0.5588
 epoch: 59, train_loss: 0.8045, test_loss: 0.9944, test_f1: 0.5417
 epoch: 60, train_loss: 0.8033, test_loss: 0.9960, test_f1: 0.5388
 epoch: 61, train_loss: 0.8179, test_loss: 0.9970, test_f1: 0.5396
 epoch: 62, train_loss: 0.8153, test_loss: 0.9598, test_f1: 0.5541
 epoch: 63, train_loss: 0.8148, test_loss: 0.9497, test_f1: 0.5537
 epoch: 64, train_loss: 0.7997, test_loss: 0.9847, test_f1: 0.5458
 epoch: 65, train_loss: 0.8205, test_loss: 0.9632, test_f1: 0.5488
 epoch: 66, train_loss: 0.8127, test_loss: 0.9758, test_f1: 0.5421
 epoch: 67, train_loss: 0.8017, test_loss: 0.9522, test_f1: 0.5392
 epoch: 68, train_loss: 0.7950, test_loss: 0.9737, test_f1: 0.5493
 epoch: 69, train_loss: 0.8121, test_loss: 0.9453, test_f1: 0.5542
 epoch: 70, train_loss: 0.8013, test_loss: 0.9832, test_f1: 0.5439
 epoch: 71, train_loss: 0.7969, test_loss: 0.9762, test_f1: 0.5304
 epoch: 72, train_loss: 0.7981, test_loss: 0.9783, test_f1: 0.5330
 epoch: 73, train_loss: 0.8031, test_loss: 0.9800, test_f1: 0.5397
 epoch: 74, train_loss: 0.7967, test_loss: 0.9679, test_f1: 0.5378
 epoch: 75, train_loss: 0.8063, test_loss: 1.0086, test_f1: 0.5429
 epoch: 76, train_loss: 0.7942, test_loss: 1.0006, test_f1: 0.5426
 epoch: 77, train_loss: 0.8105, test_loss: 0.9750, test_f1: 0.5341
 epoch: 78, train_loss: 0.7869, test_loss: 0.9623, test_f1: 0.5496
 epoch: 79, train_loss: 0.7864, test_loss: 0.9735, test_f1: 0.5489
 epoch: 80, train_loss: 0.7999, test_loss: 0.9567, test_f1: 0.5727
 epoch: 81, train_loss: 0.7786, test_loss: 0.9574, test_f1: 0.5682
 epoch: 82, train_loss: 0.7871, test_loss: 0.9390, test_f1: 0.5560
 epoch: 83, train_loss: 0.7905, test_loss: 0.9608, test_f1: 0.5443
 epoch: 84, train_loss: 0.7899, test_loss: 0.9843, test_f1: 0.5355
 epoch: 85, train_loss: 0.8051, test_loss: 0.9394, test_f1: 0.5476
 epoch: 86, train_loss: 0.7919, test_loss: 0.9631, test_f1: 0.5503
 epoch: 87, train_loss: 0.7878, test_loss: 0.9699, test_f1: 0.5554
 epoch: 88, train_loss: 0.7852, test_loss: 0.9677, test_f1: 0.5388
 epoch: 89, train_loss: 0.7874, test_loss: 0.9707, test_f1: 0.5435
 epoch: 90, train_loss: 0.7790, test_loss: 0.9465, test_f1: 0.5515
 epoch: 91, train_loss: 0.7819, test_loss: 0.9655, test_f1: 0.5388
 epoch: 92, train_loss: 0.7749, test_loss: 0.9621, test_f1: 0.5412
 epoch: 93, train_loss: 0.7871, test_loss: 0.9934, test_f1: 0.5427
 epoch: 94, train_loss: 0.7965, test_loss: 0.9869, test_f1: 0.5297
 epoch: 95, train_loss: 0.7868, test_loss: 0.9956, test_f1: 0.5354
 epoch: 96, train_loss: 0.7824, test_loss: 0.9536, test_f1: 0.5395
 epoch: 97, train_loss: 0.7734, test_loss: 0.9679, test_f1: 0.5474
 epoch: 98, train_loss: 0.7926, test_loss: 0.9729, test_f1: 0.5469
 epoch: 99, train_loss: 0.7805, test_loss: 0.9730, test_f1: 0.5352
##################ITERATION #9 ****************************************
 epoch: 0, train_loss: 1.5061, test_loss: 1.2688, test_f1: 0.2426
 epoch: 1, train_loss: 1.1774, test_loss: 1.1309, test_f1: 0.3666
 epoch: 2, train_loss: 1.1148, test_loss: 1.0967, test_f1: 0.3837
 epoch: 3, train_loss: 1.0947, test_loss: 1.0687, test_f1: 0.3739
 epoch: 4, train_loss: 1.0583, test_loss: 1.0583, test_f1: 0.3689
 epoch: 5, train_loss: 1.0483, test_loss: 1.0423, test_f1: 0.3952
 epoch: 6, train_loss: 1.0285, test_loss: 1.0672, test_f1: 0.3912
 epoch: 7, train_loss: 1.0010, test_loss: 0.9976, test_f1: 0.4079
 epoch: 8, train_loss: 0.9928, test_loss: 0.9896, test_f1: 0.4104
 epoch: 9, train_loss: 0.9858, test_loss: 0.9842, test_f1: 0.4355
 epoch: 10, train_loss: 0.9749, test_loss: 0.9865, test_f1: 0.4766
 epoch: 11, train_loss: 0.9657, test_loss: 1.0943, test_f1: 0.4507
 epoch: 12, train_loss: 0.9664, test_loss: 1.0080, test_f1: 0.4905
 epoch: 13, train_loss: 0.9527, test_loss: 0.9867, test_f1: 0.4497
 epoch: 14, train_loss: 0.9355, test_loss: 0.9650, test_f1: 0.4789
 epoch: 15, train_loss: 0.9486, test_loss: 0.9344, test_f1: 0.5128
 epoch: 16, train_loss: 0.9267, test_loss: 0.9507, test_f1: 0.5011
 epoch: 17, train_loss: 0.9189, test_loss: 1.0099, test_f1: 0.4674
 epoch: 18, train_loss: 0.9159, test_loss: 0.9380, test_f1: 0.5000
 epoch: 19, train_loss: 0.8968, test_loss: 0.9322, test_f1: 0.4898
 epoch: 20, train_loss: 0.8916, test_loss: 0.9292, test_f1: 0.4875
 epoch: 21, train_loss: 0.9050, test_loss: 0.8945, test_f1: 0.5362
 epoch: 22, train_loss: 0.8970, test_loss: 0.9422, test_f1: 0.4917
 epoch: 23, train_loss: 0.8948, test_loss: 0.9468, test_f1: 0.5089
 epoch: 24, train_loss: 0.8992, test_loss: 0.8937, test_f1: 0.5255
 epoch: 25, train_loss: 0.8739, test_loss: 0.9074, test_f1: 0.5156
 epoch: 26, train_loss: 0.8776, test_loss: 0.9058, test_f1: 0.5227
 epoch: 27, train_loss: 0.8689, test_loss: 0.9261, test_f1: 0.5302
 epoch: 28, train_loss: 0.8728, test_loss: 0.8985, test_f1: 0.5262
 epoch: 29, train_loss: 0.8599, test_loss: 0.8819, test_f1: 0.5226
 epoch: 30, train_loss: 0.8501, test_loss: 0.8976, test_f1: 0.5281
 epoch: 31, train_loss: 0.8491, test_loss: 0.8911, test_f1: 0.5299
 epoch: 32, train_loss: 0.8497, test_loss: 0.8665, test_f1: 0.5310
 epoch: 33, train_loss: 0.8378, test_loss: 0.8907, test_f1: 0.5345
 epoch: 34, train_loss: 0.8380, test_loss: 0.8637, test_f1: 0.5498
 epoch: 35, train_loss: 0.8354, test_loss: 0.8412, test_f1: 0.5541
 epoch: 36, train_loss: 0.8414, test_loss: 0.8890, test_f1: 0.5398
 epoch: 37, train_loss: 0.8398, test_loss: 0.9539, test_f1: 0.5064
 epoch: 38, train_loss: 0.8305, test_loss: 0.8841, test_f1: 0.5298
 epoch: 39, train_loss: 0.8222, test_loss: 0.8632, test_f1: 0.5288
 epoch: 40, train_loss: 0.8331, test_loss: 0.9071, test_f1: 0.5154
 epoch: 41, train_loss: 0.8216, test_loss: 0.8511, test_f1: 0.5533
 epoch: 42, train_loss: 0.8126, test_loss: 0.8727, test_f1: 0.5246
 epoch: 43, train_loss: 0.8062, test_loss: 0.8911, test_f1: 0.5386
 epoch: 44, train_loss: 0.8016, test_loss: 0.8858, test_f1: 0.5240
 epoch: 45, train_loss: 0.8016, test_loss: 0.9562, test_f1: 0.5440
 epoch: 46, train_loss: 0.8222, test_loss: 0.8599, test_f1: 0.5484
 epoch: 47, train_loss: 0.8105, test_loss: 0.8994, test_f1: 0.5167
 epoch: 48, train_loss: 0.8010, test_loss: 0.8834, test_f1: 0.5298
 epoch: 49, train_loss: 0.8045, test_loss: 0.8419, test_f1: 0.5644
 epoch: 50, train_loss: 0.7875, test_loss: 0.8972, test_f1: 0.5363
 epoch: 51, train_loss: 0.7869, test_loss: 0.8671, test_f1: 0.5562
 epoch: 52, train_loss: 0.7856, test_loss: 0.8611, test_f1: 0.5565
 epoch: 53, train_loss: 0.7693, test_loss: 0.8556, test_f1: 0.5653
 epoch: 54, train_loss: 0.7763, test_loss: 0.8682, test_f1: 0.5543
 epoch: 55, train_loss: 0.7702, test_loss: 0.8620, test_f1: 0.5506
 epoch: 56, train_loss: 0.7705, test_loss: 0.8610, test_f1: 0.5522
 epoch: 57, train_loss: 0.7651, test_loss: 0.8620, test_f1: 0.5624
 epoch: 58, train_loss: 0.7735, test_loss: 0.8760, test_f1: 0.5426
 epoch: 59, train_loss: 0.7725, test_loss: 0.8694, test_f1: 0.5532
 epoch: 60, train_loss: 0.7728, test_loss: 0.8504, test_f1: 0.5626
 epoch: 61, train_loss: 0.7686, test_loss: 0.8750, test_f1: 0.5397
 epoch: 62, train_loss: 0.7606, test_loss: 0.8669, test_f1: 0.5550
 epoch: 63, train_loss: 0.7718, test_loss: 0.8977, test_f1: 0.5305
 epoch: 64, train_loss: 0.7585, test_loss: 0.8624, test_f1: 0.5558
 epoch: 65, train_loss: 0.7642, test_loss: 0.8600, test_f1: 0.5619
 epoch: 66, train_loss: 0.7535, test_loss: 0.8707, test_f1: 0.5547
 epoch: 67, train_loss: 0.7629, test_loss: 0.8748, test_f1: 0.5379
 epoch: 68, train_loss: 0.7493, test_loss: 0.8677, test_f1: 0.5464
 epoch: 69, train_loss: 0.7505, test_loss: 0.8983, test_f1: 0.5351
 epoch: 70, train_loss: 0.7615, test_loss: 0.8643, test_f1: 0.5561
 epoch: 71, train_loss: 0.7537, test_loss: 0.8696, test_f1: 0.5528
 epoch: 72, train_loss: 0.7627, test_loss: 0.8652, test_f1: 0.5519
 epoch: 73, train_loss: 0.7590, test_loss: 0.8555, test_f1: 0.5667
 epoch: 74, train_loss: 0.7508, test_loss: 0.8658, test_f1: 0.5396
 epoch: 75, train_loss: 0.7449, test_loss: 0.8932, test_f1: 0.5428
 epoch: 76, train_loss: 0.7479, test_loss: 0.8951, test_f1: 0.5279
 epoch: 77, train_loss: 0.7522, test_loss: 0.8833, test_f1: 0.5362
 epoch: 78, train_loss: 0.7443, test_loss: 0.8664, test_f1: 0.5347
 epoch: 79, train_loss: 0.7421, test_loss: 0.8679, test_f1: 0.5489
 epoch: 80, train_loss: 0.7418, test_loss: 0.8705, test_f1: 0.5451
 epoch: 81, train_loss: 0.7547, test_loss: 0.8670, test_f1: 0.5497
 epoch: 82, train_loss: 0.7497, test_loss: 0.8833, test_f1: 0.5248
 epoch: 83, train_loss: 0.7463, test_loss: 0.8918, test_f1: 0.5287
 epoch: 84, train_loss: 0.7418, test_loss: 0.8621, test_f1: 0.5448
 epoch: 85, train_loss: 0.7421, test_loss: 0.8580, test_f1: 0.5543
 epoch: 86, train_loss: 0.7438, test_loss: 0.8877, test_f1: 0.5331
 epoch: 87, train_loss: 0.7362, test_loss: 0.8699, test_f1: 0.5414
 epoch: 88, train_loss: 0.7442, test_loss: 0.8769, test_f1: 0.5311
 epoch: 89, train_loss: 0.7445, test_loss: 0.8797, test_f1: 0.5255
 epoch: 90, train_loss: 0.7406, test_loss: 0.9162, test_f1: 0.5342
 epoch: 91, train_loss: 0.7261, test_loss: 0.9038, test_f1: 0.5271
 epoch: 92, train_loss: 0.7373, test_loss: 0.8748, test_f1: 0.5455
 epoch: 93, train_loss: 0.7376, test_loss: 0.8639, test_f1: 0.5460
 epoch: 94, train_loss: 0.7373, test_loss: 0.8655, test_f1: 0.5543
 epoch: 95, train_loss: 0.7338, test_loss: 0.8698, test_f1: 0.5509
 epoch: 96, train_loss: 0.7345, test_loss: 0.8553, test_f1: 0.5419
 epoch: 97, train_loss: 0.7351, test_loss: 0.8828, test_f1: 0.5328
 epoch: 98, train_loss: 0.7484, test_loss: 0.8825, test_f1: 0.5405
 epoch: 99, train_loss: 0.7361, test_loss: 0.8868, test_f1: 0.5454

Training completed in 638.94 seconds
Best F1: 0.5849 at epoch 93
Mean F1 across iterations: 0.5621  0.0107
========================FINAL RESULTS================================
FEGIN weighted F1: 0.5849  0.0107
python main.py --data ltspice_examples --representation component_pin --model FEGIN --layers 3 --hiddens 16 --batch_size 64 --lr 0.001 --emb_size 250 --epochs 100 --save_appendix component_pin_L3_H16_BS64_LR0.001_E250 --no_val
-----



STDERR:
  File "main.py", line 370, in <module>
    main()
  File "main.py", line 254, in main
    dataset = dataset_class(
  File "/home/philip/projects/ltspice_examples_code_repo/Circuit-Completion-Using-GNNs/component_classification_with_link_prediction_head/evaluation/FEGIN/kernel/circuit_datasets.py", line 15, in __init__
    self.data, self.slices = torch.load(self.processed_paths[0])
  File "/home/philip/.local/lib/python3.8/site-packages/torch/serialization.py", line 1040, in load
    warnings.warn(
  File "/usr/lib/python3.8/warnings.py", line 109, in _showwarnmsg
    sw(msg.message, msg.category, msg.filename, msg.lineno,
  File "main.py", line 47, in warn_with_traceback
    traceback.print_stack(file=log)
/home/philip/projects/ltspice_examples_code_repo/Circuit-Completion-Using-GNNs/component_classification_with_link_prediction_head/evaluation/FEGIN/kernel/circuit_datasets.py:15: FutureWarning: You are using `torch.load` with `weights_only=False` (the current default value), which uses the default pickle module implicitly. It is possible to construct malicious pickle data which will execute arbitrary code during unpickling (See https://github.com/pytorch/pytorch/blob/main/SECURITY.md#untrusted-models for more details). In a future release, the default value for `weights_only` will be flipped to `True`. This limits the functions that could be executed during unpickling. Arbitrary objects will no longer be allowed to be loaded via this mode unless they are explicitly allowlisted by the user via `torch.serialization.add_safe_globals`. We recommend you start setting `weights_only=True` for any use case where you don't have full control of the loaded file. Please open an issue on GitHub for any issues related to this experimental feature.
  self.data, self.slices = torch.load(self.processed_paths[0])
