STDOUT:
Results will be saved in /home/philip/projects/ltspice_examples_code_repo/Circuit-Completion-Using-GNNs/component_classification_with_link_prediction_head/evaluation/FEGIN/results/model_FEGIN_dataset_ltspice_demos
Command line input: python main.py --data ltspice_demos --representation component_pin --model FEGIN --layers 3 --hiddens 16 --batch_size 128 --lr 0.01 --emb_size 250 --epochs 100 --save_appendix component_pin_L3_H16_BS128_LR0.01_E250 --no_val
 is saved.
-----
ltspice_demos - FEGIN
Using 3 layers, 16 hidden units, h = 2
Loading component_pin representation dataset
ENTERED
Training FEGIN on component_pin representation
Train: 1565, Test: 383
##################ITERATION #0 ****************************************
 epoch: 0, train_loss: 1.2803, test_loss: 1.3145, test_f1: 0.2281
 epoch: 1, train_loss: 1.1927, test_loss: 1.3440, test_f1: 0.2281
 epoch: 2, train_loss: 1.1590, test_loss: 1.3208, test_f1: 0.3496
 epoch: 3, train_loss: 1.1362, test_loss: 1.2214, test_f1: 0.2583
 epoch: 4, train_loss: 1.1088, test_loss: 1.1858, test_f1: 0.3562
 epoch: 5, train_loss: 1.0518, test_loss: 1.0974, test_f1: 0.4469
 epoch: 6, train_loss: 0.9792, test_loss: 1.0473, test_f1: 0.5450
 epoch: 7, train_loss: 0.9468, test_loss: 1.1258, test_f1: 0.4249
 epoch: 8, train_loss: 0.9332, test_loss: 1.7889, test_f1: 0.3044
 epoch: 9, train_loss: 0.9051, test_loss: 0.9957, test_f1: 0.5317
 epoch: 10, train_loss: 0.8701, test_loss: 1.0852, test_f1: 0.5264
 epoch: 11, train_loss: 0.8490, test_loss: 1.0484, test_f1: 0.4577
 epoch: 12, train_loss: 0.8773, test_loss: 1.1615, test_f1: 0.4486
 epoch: 13, train_loss: 0.8620, test_loss: 1.0899, test_f1: 0.4596
 epoch: 14, train_loss: 0.8298, test_loss: 1.2066, test_f1: 0.4212
 epoch: 15, train_loss: 0.8353, test_loss: 1.1594, test_f1: 0.5279
 epoch: 16, train_loss: 0.8465, test_loss: 1.2693, test_f1: 0.4064
 epoch: 17, train_loss: 0.8367, test_loss: 1.3729, test_f1: 0.5519
 epoch: 18, train_loss: 0.8200, test_loss: 1.0701, test_f1: 0.4799
 epoch: 19, train_loss: 0.8077, test_loss: 1.0715, test_f1: 0.5027
 epoch: 20, train_loss: 0.7855, test_loss: 1.0048, test_f1: 0.5211
 epoch: 21, train_loss: 0.7854, test_loss: 1.0871, test_f1: 0.5378
 epoch: 22, train_loss: 0.7844, test_loss: 1.3625, test_f1: 0.5236
 epoch: 23, train_loss: 0.7681, test_loss: 1.0745, test_f1: 0.5360
 epoch: 24, train_loss: 0.7920, test_loss: 1.2639, test_f1: 0.5658
 epoch: 25, train_loss: 0.7670, test_loss: 1.0860, test_f1: 0.4946
 epoch: 26, train_loss: 0.7918, test_loss: 1.1092, test_f1: 0.5844
 epoch: 27, train_loss: 0.7642, test_loss: 1.0072, test_f1: 0.5101
 epoch: 28, train_loss: 0.7650, test_loss: 1.0242, test_f1: 0.5609
 epoch: 29, train_loss: 0.7506, test_loss: 1.1138, test_f1: 0.5283
 epoch: 30, train_loss: 0.7489, test_loss: 1.0538, test_f1: 0.6194
 epoch: 31, train_loss: 0.7367, test_loss: 1.0572, test_f1: 0.5440
 epoch: 32, train_loss: 0.7435, test_loss: 0.9932, test_f1: 0.4696
 epoch: 33, train_loss: 0.7425, test_loss: 1.1106, test_f1: 0.5235
 epoch: 34, train_loss: 0.7224, test_loss: 1.2637, test_f1: 0.5151
 epoch: 35, train_loss: 0.7243, test_loss: 1.3056, test_f1: 0.3863
 epoch: 36, train_loss: 0.7202, test_loss: 1.1179, test_f1: 0.4815
 epoch: 37, train_loss: 0.7134, test_loss: 1.1024, test_f1: 0.5273
 epoch: 38, train_loss: 0.7709, test_loss: 1.5752, test_f1: 0.5640
 epoch: 39, train_loss: 0.7246, test_loss: 0.9697, test_f1: 0.6044
 epoch: 40, train_loss: 0.7410, test_loss: 1.1407, test_f1: 0.5537
 epoch: 41, train_loss: 0.7029, test_loss: 1.1344, test_f1: 0.5032
 epoch: 42, train_loss: 0.7017, test_loss: 1.2589, test_f1: 0.5496
 epoch: 43, train_loss: 0.6970, test_loss: 0.9858, test_f1: 0.5934
 epoch: 44, train_loss: 0.7157, test_loss: 1.1198, test_f1: 0.4993
 epoch: 45, train_loss: 0.7271, test_loss: 0.9564, test_f1: 0.5778
 epoch: 46, train_loss: 0.7248, test_loss: 1.2941, test_f1: 0.4658
 epoch: 47, train_loss: 0.7072, test_loss: 1.1736, test_f1: 0.5413
 epoch: 48, train_loss: 0.7090, test_loss: 1.1578, test_f1: 0.4723
 epoch: 49, train_loss: 0.6997, test_loss: 1.4139, test_f1: 0.5773
 epoch: 50, train_loss: 0.7695, test_loss: 1.5002, test_f1: 0.4406
 epoch: 51, train_loss: 0.7346, test_loss: 1.1836, test_f1: 0.5671
 epoch: 52, train_loss: 0.7087, test_loss: 1.3636, test_f1: 0.5701
 epoch: 53, train_loss: 0.6955, test_loss: 1.3284, test_f1: 0.5580
 epoch: 54, train_loss: 0.6877, test_loss: 1.3958, test_f1: 0.5314
 epoch: 55, train_loss: 0.6862, test_loss: 1.8287, test_f1: 0.5268
 epoch: 56, train_loss: 0.6909, test_loss: 1.3838, test_f1: 0.5041
 epoch: 57, train_loss: 0.6791, test_loss: 1.7345, test_f1: 0.5035
 epoch: 58, train_loss: 0.6678, test_loss: 1.4779, test_f1: 0.5288
 epoch: 59, train_loss: 0.6630, test_loss: 1.8243, test_f1: 0.5000
 epoch: 60, train_loss: 0.6644, test_loss: 1.8115, test_f1: 0.5331
 epoch: 61, train_loss: 0.6587, test_loss: 1.1659, test_f1: 0.5715
 epoch: 62, train_loss: 0.6754, test_loss: 1.4991, test_f1: 0.5549
 epoch: 63, train_loss: 0.6656, test_loss: 1.2463, test_f1: 0.5366
 epoch: 64, train_loss: 0.6424, test_loss: 1.2757, test_f1: 0.6215
 epoch: 65, train_loss: 0.6461, test_loss: 1.1820, test_f1: 0.6149
 epoch: 66, train_loss: 0.6323, test_loss: 1.2659, test_f1: 0.6085
 epoch: 67, train_loss: 0.6302, test_loss: 1.3033, test_f1: 0.5646
 epoch: 68, train_loss: 0.6476, test_loss: 1.3134, test_f1: 0.6177
 epoch: 69, train_loss: 0.6548, test_loss: 1.5434, test_f1: 0.5893
 epoch: 70, train_loss: 0.6501, test_loss: 1.3903, test_f1: 0.6171
 epoch: 71, train_loss: 0.6384, test_loss: 1.3482, test_f1: 0.6257
 epoch: 72, train_loss: 0.6342, test_loss: 1.3657, test_f1: 0.6215
 epoch: 73, train_loss: 0.6445, test_loss: 1.2818, test_f1: 0.6273
 epoch: 74, train_loss: 0.6440, test_loss: 1.4030, test_f1: 0.6047
 epoch: 75, train_loss: 0.6402, test_loss: 1.1997, test_f1: 0.6150
 epoch: 76, train_loss: 0.6333, test_loss: 1.2668, test_f1: 0.6008
 epoch: 77, train_loss: 0.6248, test_loss: 1.3759, test_f1: 0.6146
 epoch: 78, train_loss: 0.6393, test_loss: 1.5242, test_f1: 0.6065
 epoch: 79, train_loss: 0.6433, test_loss: 1.7522, test_f1: 0.5825
 epoch: 80, train_loss: 0.7316, test_loss: 1.6807, test_f1: 0.5931
 epoch: 81, train_loss: 0.7029, test_loss: 1.3093, test_f1: 0.5893
 epoch: 82, train_loss: 0.6814, test_loss: 1.3113, test_f1: 0.5525
 epoch: 83, train_loss: 0.6402, test_loss: 1.5262, test_f1: 0.6133
 epoch: 84, train_loss: 0.6387, test_loss: 1.2887, test_f1: 0.6013
 epoch: 85, train_loss: 0.6429, test_loss: 1.3887, test_f1: 0.6053
 epoch: 86, train_loss: 0.6351, test_loss: 1.4706, test_f1: 0.5519
 epoch: 87, train_loss: 0.6295, test_loss: 1.3005, test_f1: 0.6326
 epoch: 88, train_loss: 0.6216, test_loss: 1.3737, test_f1: 0.6117
 epoch: 89, train_loss: 0.6144, test_loss: 1.2525, test_f1: 0.6682
 epoch: 90, train_loss: 0.6107, test_loss: 1.2854, test_f1: 0.5941
 epoch: 91, train_loss: 0.6149, test_loss: 1.4982, test_f1: 0.5782
 epoch: 92, train_loss: 0.6149, test_loss: 1.5836, test_f1: 0.5987
 epoch: 93, train_loss: 0.6065, test_loss: 1.2756, test_f1: 0.6469
 epoch: 94, train_loss: 0.6097, test_loss: 1.4198, test_f1: 0.6299
 epoch: 95, train_loss: 0.6129, test_loss: 1.3101, test_f1: 0.6230
 epoch: 96, train_loss: 0.5932, test_loss: 1.3160, test_f1: 0.5990
 epoch: 97, train_loss: 0.6006, test_loss: 1.3751, test_f1: 0.6238
 epoch: 98, train_loss: 0.5880, test_loss: 1.5266, test_f1: 0.6005
 epoch: 99, train_loss: 0.6080, test_loss: 1.4099, test_f1: 0.6540
##################ITERATION #1 ****************************************
 epoch: 0, train_loss: 1.1595, test_loss: 1.3818, test_f1: 0.2281
 epoch: 1, train_loss: 1.0427, test_loss: 1.4160, test_f1: 0.2912
 epoch: 2, train_loss: 1.0096, test_loss: 1.3598, test_f1: 0.3429
 epoch: 3, train_loss: 0.9908, test_loss: 1.2420, test_f1: 0.4779
 epoch: 4, train_loss: 0.9657, test_loss: 1.3292, test_f1: 0.3560
 epoch: 5, train_loss: 0.9685, test_loss: 1.0642, test_f1: 0.5455
 epoch: 6, train_loss: 0.9292, test_loss: 1.0622, test_f1: 0.5184
 epoch: 7, train_loss: 0.9097, test_loss: 0.9714, test_f1: 0.5272
 epoch: 8, train_loss: 0.8895, test_loss: 0.9947, test_f1: 0.5066
 epoch: 9, train_loss: 0.8810, test_loss: 1.0743, test_f1: 0.5107
 epoch: 10, train_loss: 0.8799, test_loss: 1.0405, test_f1: 0.4728
 epoch: 11, train_loss: 0.8707, test_loss: 1.1182, test_f1: 0.4106
 epoch: 12, train_loss: 0.8695, test_loss: 0.9895, test_f1: 0.5581
 epoch: 13, train_loss: 0.8492, test_loss: 0.9712, test_f1: 0.5377
 epoch: 14, train_loss: 0.8238, test_loss: 0.9913, test_f1: 0.5331
 epoch: 15, train_loss: 0.7975, test_loss: 1.0154, test_f1: 0.5578
 epoch: 16, train_loss: 0.7930, test_loss: 1.0657, test_f1: 0.5383
 epoch: 17, train_loss: 0.7858, test_loss: 1.6140, test_f1: 0.4248
 epoch: 18, train_loss: 0.8039, test_loss: 1.2208, test_f1: 0.5321
 epoch: 19, train_loss: 0.8372, test_loss: 1.3048, test_f1: 0.5146
 epoch: 20, train_loss: 0.7858, test_loss: 0.9845, test_f1: 0.5828
 epoch: 21, train_loss: 0.7968, test_loss: 1.0106, test_f1: 0.5098
 epoch: 22, train_loss: 0.7803, test_loss: 1.0838, test_f1: 0.5400
 epoch: 23, train_loss: 0.7633, test_loss: 1.1874, test_f1: 0.5230
 epoch: 24, train_loss: 0.7417, test_loss: 1.1195, test_f1: 0.5171
 epoch: 25, train_loss: 0.7401, test_loss: 1.3995, test_f1: 0.5145
 epoch: 26, train_loss: 0.7210, test_loss: 0.9989, test_f1: 0.5551
 epoch: 27, train_loss: 0.7211, test_loss: 1.0939, test_f1: 0.5729
 epoch: 28, train_loss: 0.7193, test_loss: 1.4521, test_f1: 0.5403
 epoch: 29, train_loss: 0.7165, test_loss: 1.2186, test_f1: 0.5784
 epoch: 30, train_loss: 0.7665, test_loss: 1.4537, test_f1: 0.4966
 epoch: 31, train_loss: 0.7519, test_loss: 1.0517, test_f1: 0.5412
 epoch: 32, train_loss: 0.7385, test_loss: 1.4470, test_f1: 0.5194
 epoch: 33, train_loss: 0.7579, test_loss: 1.0580, test_f1: 0.5276
 epoch: 34, train_loss: 0.7356, test_loss: 1.0358, test_f1: 0.5584
 epoch: 35, train_loss: 0.7136, test_loss: 1.1975, test_f1: 0.5193
 epoch: 36, train_loss: 0.7038, test_loss: 1.2275, test_f1: 0.5496
 epoch: 37, train_loss: 0.6914, test_loss: 1.1222, test_f1: 0.5959
 epoch: 38, train_loss: 0.7182, test_loss: 1.0346, test_f1: 0.5606
 epoch: 39, train_loss: 0.7257, test_loss: 1.5946, test_f1: 0.5338
 epoch: 40, train_loss: 0.7098, test_loss: 1.4464, test_f1: 0.5365
 epoch: 41, train_loss: 0.7337, test_loss: 1.4174, test_f1: 0.5251
 epoch: 42, train_loss: 0.6941, test_loss: 1.4410, test_f1: 0.5301
 epoch: 43, train_loss: 0.6918, test_loss: 1.1347, test_f1: 0.5478
 epoch: 44, train_loss: 0.6728, test_loss: 1.1220, test_f1: 0.5762
 epoch: 45, train_loss: 0.6768, test_loss: 1.1159, test_f1: 0.5382
 epoch: 46, train_loss: 0.6823, test_loss: 1.6602, test_f1: 0.5440
 epoch: 47, train_loss: 0.6915, test_loss: 1.5934, test_f1: 0.5464
 epoch: 48, train_loss: 0.6835, test_loss: 1.1986, test_f1: 0.5489
 epoch: 49, train_loss: 0.6880, test_loss: 1.4880, test_f1: 0.4894
 epoch: 50, train_loss: 0.6983, test_loss: 1.2461, test_f1: 0.5504
 epoch: 51, train_loss: 0.6896, test_loss: 1.0527, test_f1: 0.5729
 epoch: 52, train_loss: 0.6826, test_loss: 1.0725, test_f1: 0.5946
 epoch: 53, train_loss: 0.6674, test_loss: 1.2671, test_f1: 0.5739
 epoch: 54, train_loss: 0.6643, test_loss: 1.4300, test_f1: 0.5869
 epoch: 55, train_loss: 0.6603, test_loss: 1.4772, test_f1: 0.5655
 epoch: 56, train_loss: 0.6470, test_loss: 1.3147, test_f1: 0.5999
 epoch: 57, train_loss: 0.6389, test_loss: 1.2479, test_f1: 0.6048
 epoch: 58, train_loss: 0.6265, test_loss: 1.2275, test_f1: 0.6195
 epoch: 59, train_loss: 0.6174, test_loss: 1.3113, test_f1: 0.6200
 epoch: 60, train_loss: 0.6227, test_loss: 1.3995, test_f1: 0.5842
 epoch: 61, train_loss: 0.6261, test_loss: 1.5842, test_f1: 0.5559
 epoch: 62, train_loss: 0.6305, test_loss: 1.6622, test_f1: 0.6288
 epoch: 63, train_loss: 0.6223, test_loss: 1.4347, test_f1: 0.6173
 epoch: 64, train_loss: 0.6195, test_loss: 1.2272, test_f1: 0.6064
 epoch: 65, train_loss: 0.6194, test_loss: 1.3402, test_f1: 0.6259
 epoch: 66, train_loss: 0.6287, test_loss: 1.4661, test_f1: 0.5744
 epoch: 67, train_loss: 0.6362, test_loss: 1.4637, test_f1: 0.6166
 epoch: 68, train_loss: 0.6190, test_loss: 1.5303, test_f1: 0.5948
 epoch: 69, train_loss: 0.6027, test_loss: 1.2912, test_f1: 0.5943
 epoch: 70, train_loss: 0.6345, test_loss: 1.1560, test_f1: 0.5827
 epoch: 71, train_loss: 0.6209, test_loss: 1.3234, test_f1: 0.5632
 epoch: 72, train_loss: 0.6479, test_loss: 1.8666, test_f1: 0.5857
 epoch: 73, train_loss: 0.6287, test_loss: 2.0555, test_f1: 0.5075
 epoch: 74, train_loss: 0.6252, test_loss: 1.4695, test_f1: 0.6000
 epoch: 75, train_loss: 0.6350, test_loss: 1.4033, test_f1: 0.6508
 epoch: 76, train_loss: 0.6152, test_loss: 1.2334, test_f1: 0.6222
 epoch: 77, train_loss: 0.6216, test_loss: 1.2847, test_f1: 0.6454
 epoch: 78, train_loss: 0.6059, test_loss: 1.5859, test_f1: 0.6188
 epoch: 79, train_loss: 0.6114, test_loss: 1.3673, test_f1: 0.6515
 epoch: 80, train_loss: 0.6089, test_loss: 1.4201, test_f1: 0.6324
 epoch: 81, train_loss: 0.5976, test_loss: 1.7576, test_f1: 0.6307
 epoch: 82, train_loss: 0.6563, test_loss: 3.4493, test_f1: 0.3239
 epoch: 83, train_loss: 0.7148, test_loss: 1.5055, test_f1: 0.5945
 epoch: 84, train_loss: 0.6654, test_loss: 1.3068, test_f1: 0.5969
 epoch: 85, train_loss: 0.6267, test_loss: 1.4389, test_f1: 0.5958
 epoch: 86, train_loss: 0.6095, test_loss: 1.4666, test_f1: 0.6654
 epoch: 87, train_loss: 0.6194, test_loss: 1.4402, test_f1: 0.6386
 epoch: 88, train_loss: 0.5916, test_loss: 1.7026, test_f1: 0.6284
 epoch: 89, train_loss: 0.5912, test_loss: 1.4726, test_f1: 0.5793
 epoch: 90, train_loss: 0.6002, test_loss: 1.6239, test_f1: 0.5998
 epoch: 91, train_loss: 0.5908, test_loss: 1.5278, test_f1: 0.5714
 epoch: 92, train_loss: 0.5942, test_loss: 1.9945, test_f1: 0.6331
 epoch: 93, train_loss: 0.5917, test_loss: 1.3863, test_f1: 0.6313
 epoch: 94, train_loss: 0.6005, test_loss: 1.5891, test_f1: 0.6201
 epoch: 95, train_loss: 0.5658, test_loss: 1.7386, test_f1: 0.6602
 epoch: 96, train_loss: 0.5660, test_loss: 1.7537, test_f1: 0.6305
 epoch: 97, train_loss: 0.5721, test_loss: 1.8856, test_f1: 0.6321
 epoch: 98, train_loss: 0.7164, test_loss: 1.5125, test_f1: 0.6136
 epoch: 99, train_loss: 0.6243, test_loss: 1.5641, test_f1: 0.5658
##################ITERATION #2 ****************************************
 epoch: 0, train_loss: 1.2225, test_loss: 1.4055, test_f1: 0.2182
 epoch: 1, train_loss: 1.0737, test_loss: 1.3901, test_f1: 0.3147
 epoch: 2, train_loss: 1.0557, test_loss: 1.1748, test_f1: 0.4030
 epoch: 3, train_loss: 1.0224, test_loss: 1.1358, test_f1: 0.4597
 epoch: 4, train_loss: 0.9835, test_loss: 1.1833, test_f1: 0.4305
 epoch: 5, train_loss: 0.9819, test_loss: 1.1370, test_f1: 0.4596
 epoch: 6, train_loss: 0.9652, test_loss: 1.0067, test_f1: 0.5569
 epoch: 7, train_loss: 0.9361, test_loss: 1.1376, test_f1: 0.4769
 epoch: 8, train_loss: 0.9092, test_loss: 1.0757, test_f1: 0.4797
 epoch: 9, train_loss: 0.8916, test_loss: 1.0566, test_f1: 0.5270
 epoch: 10, train_loss: 0.8678, test_loss: 1.1070, test_f1: 0.4611
 epoch: 11, train_loss: 0.8546, test_loss: 1.8570, test_f1: 0.4923
 epoch: 12, train_loss: 0.8803, test_loss: 1.0811, test_f1: 0.5165
 epoch: 13, train_loss: 0.8703, test_loss: 1.0134, test_f1: 0.5717
 epoch: 14, train_loss: 0.8538, test_loss: 1.0739, test_f1: 0.5560
 epoch: 15, train_loss: 0.8373, test_loss: 1.0527, test_f1: 0.5489
 epoch: 16, train_loss: 0.8094, test_loss: 1.0654, test_f1: 0.5708
 epoch: 17, train_loss: 0.7999, test_loss: 1.1729, test_f1: 0.5182
 epoch: 18, train_loss: 0.8036, test_loss: 1.0166, test_f1: 0.5378
 epoch: 19, train_loss: 0.7969, test_loss: 1.0890, test_f1: 0.5158
 epoch: 20, train_loss: 0.8067, test_loss: 0.9885, test_f1: 0.5185
 epoch: 21, train_loss: 0.7985, test_loss: 1.2560, test_f1: 0.5519
 epoch: 22, train_loss: 0.7844, test_loss: 1.1262, test_f1: 0.5563
 epoch: 23, train_loss: 0.7875, test_loss: 1.1355, test_f1: 0.5385
 epoch: 24, train_loss: 0.7803, test_loss: 1.0223, test_f1: 0.5347
 epoch: 25, train_loss: 0.7717, test_loss: 1.1191, test_f1: 0.5224
 epoch: 26, train_loss: 0.7579, test_loss: 1.0975, test_f1: 0.5612
 epoch: 27, train_loss: 0.7824, test_loss: 1.1659, test_f1: 0.4976
 epoch: 28, train_loss: 0.7965, test_loss: 1.0445, test_f1: 0.5693
 epoch: 29, train_loss: 0.7715, test_loss: 1.0165, test_f1: 0.5268
 epoch: 30, train_loss: 0.7549, test_loss: 1.0129, test_f1: 0.5468
 epoch: 31, train_loss: 0.7533, test_loss: 1.0741, test_f1: 0.5617
 epoch: 32, train_loss: 0.7670, test_loss: 1.0064, test_f1: 0.5305
 epoch: 33, train_loss: 0.7484, test_loss: 1.0805, test_f1: 0.5915
 epoch: 34, train_loss: 0.7355, test_loss: 1.2657, test_f1: 0.5252
 epoch: 35, train_loss: 0.7417, test_loss: 1.3199, test_f1: 0.5163
 epoch: 36, train_loss: 0.7696, test_loss: 1.0358, test_f1: 0.5666
 epoch: 37, train_loss: 0.7582, test_loss: 1.0275, test_f1: 0.5784
 epoch: 38, train_loss: 0.7327, test_loss: 1.4458, test_f1: 0.5180
 epoch: 39, train_loss: 0.7313, test_loss: 1.1493, test_f1: 0.5784
 epoch: 40, train_loss: 0.7091, test_loss: 1.3611, test_f1: 0.5500
 epoch: 41, train_loss: 0.7132, test_loss: 1.2494, test_f1: 0.5659
 epoch: 42, train_loss: 0.7180, test_loss: 1.1784, test_f1: 0.5734
 epoch: 43, train_loss: 0.7208, test_loss: 1.0263, test_f1: 0.5767
 epoch: 44, train_loss: 0.7317, test_loss: 1.7861, test_f1: 0.4674
 epoch: 45, train_loss: 0.7440, test_loss: 1.2347, test_f1: 0.5123
 epoch: 46, train_loss: 0.7488, test_loss: 1.5465, test_f1: 0.5589
 epoch: 47, train_loss: 0.7228, test_loss: 1.2059, test_f1: 0.5369
 epoch: 48, train_loss: 0.7302, test_loss: 1.4345, test_f1: 0.5548
 epoch: 49, train_loss: 0.7205, test_loss: 1.4758, test_f1: 0.5167
 epoch: 50, train_loss: 0.7094, test_loss: 1.2201, test_f1: 0.5650
 epoch: 51, train_loss: 0.6947, test_loss: 1.2577, test_f1: 0.6029
 epoch: 52, train_loss: 0.6845, test_loss: 1.2912, test_f1: 0.6044
 epoch: 53, train_loss: 0.6777, test_loss: 1.2358, test_f1: 0.6046
 epoch: 54, train_loss: 0.6661, test_loss: 1.3200, test_f1: 0.5713
 epoch: 55, train_loss: 0.6710, test_loss: 1.3329, test_f1: 0.5786
 epoch: 56, train_loss: 0.6745, test_loss: 1.1262, test_f1: 0.5775
 epoch: 57, train_loss: 0.6671, test_loss: 1.2812, test_f1: 0.5236
 epoch: 58, train_loss: 0.6641, test_loss: 1.6916, test_f1: 0.5476
 epoch: 59, train_loss: 0.6578, test_loss: 1.1737, test_f1: 0.5835
 epoch: 60, train_loss: 0.6721, test_loss: 1.2706, test_f1: 0.5683
 epoch: 61, train_loss: 0.6721, test_loss: 1.1342, test_f1: 0.6053
 epoch: 62, train_loss: 0.6789, test_loss: 1.1772, test_f1: 0.5710
 epoch: 63, train_loss: 0.6678, test_loss: 1.2469, test_f1: 0.5861
 epoch: 64, train_loss: 0.6662, test_loss: 1.2682, test_f1: 0.5965
 epoch: 65, train_loss: 0.7169, test_loss: 1.0661, test_f1: 0.5099
 epoch: 66, train_loss: 0.7080, test_loss: 1.0639, test_f1: 0.5546
 epoch: 67, train_loss: 0.6826, test_loss: 1.1485, test_f1: 0.5805
 epoch: 68, train_loss: 0.6858, test_loss: 1.2150, test_f1: 0.5683
 epoch: 69, train_loss: 0.6613, test_loss: 1.2114, test_f1: 0.5513
 epoch: 70, train_loss: 0.6574, test_loss: 1.2853, test_f1: 0.5743
 epoch: 71, train_loss: 0.6537, test_loss: 1.3601, test_f1: 0.5982
 epoch: 72, train_loss: 0.6384, test_loss: 1.5160, test_f1: 0.5706
 epoch: 73, train_loss: 0.6939, test_loss: 1.0906, test_f1: 0.5966
 epoch: 74, train_loss: 0.6935, test_loss: 1.4524, test_f1: 0.5638
 epoch: 75, train_loss: 0.6734, test_loss: 0.9804, test_f1: 0.6058
 epoch: 76, train_loss: 0.6534, test_loss: 1.4021, test_f1: 0.5593
 epoch: 77, train_loss: 0.6549, test_loss: 1.4579, test_f1: 0.5795
 epoch: 78, train_loss: 0.6360, test_loss: 1.3552, test_f1: 0.5817
 epoch: 79, train_loss: 0.6415, test_loss: 1.2497, test_f1: 0.5867
 epoch: 80, train_loss: 0.6329, test_loss: 1.2463, test_f1: 0.5841
 epoch: 81, train_loss: 0.6400, test_loss: 1.4122, test_f1: 0.5566
 epoch: 82, train_loss: 0.6500, test_loss: 1.5586, test_f1: 0.5436
 epoch: 83, train_loss: 0.6528, test_loss: 1.1009, test_f1: 0.5565
 epoch: 84, train_loss: 0.6592, test_loss: 1.5636, test_f1: 0.5088
 epoch: 85, train_loss: 0.6447, test_loss: 1.1532, test_f1: 0.6066
 epoch: 86, train_loss: 0.6378, test_loss: 1.3864, test_f1: 0.5618
 epoch: 87, train_loss: 0.6433, test_loss: 1.3347, test_f1: 0.5989
 epoch: 88, train_loss: 0.6548, test_loss: 1.2879, test_f1: 0.5781
 epoch: 89, train_loss: 0.6805, test_loss: 1.2963, test_f1: 0.5659
 epoch: 90, train_loss: 0.6663, test_loss: 1.1599, test_f1: 0.5937
 epoch: 91, train_loss: 0.6513, test_loss: 1.2803, test_f1: 0.6041
 epoch: 92, train_loss: 0.6394, test_loss: 1.2589, test_f1: 0.5874
 epoch: 93, train_loss: 0.6167, test_loss: 1.5087, test_f1: 0.5695
 epoch: 94, train_loss: 0.6346, test_loss: 1.4187, test_f1: 0.5738
 epoch: 95, train_loss: 0.6492, test_loss: 1.4759, test_f1: 0.5582
 epoch: 96, train_loss: 0.6480, test_loss: 1.4720, test_f1: 0.5532
 epoch: 97, train_loss: 0.6379, test_loss: 1.7842, test_f1: 0.5817
 epoch: 98, train_loss: 0.6374, test_loss: 1.4549, test_f1: 0.5653
 epoch: 99, train_loss: 0.6336, test_loss: 1.6930, test_f1: 0.5812
##################ITERATION #3 ****************************************
 epoch: 0, train_loss: 1.1840, test_loss: 1.3555, test_f1: 0.1995
 epoch: 1, train_loss: 1.0336, test_loss: 1.2038, test_f1: 0.2876
 epoch: 2, train_loss: 1.0067, test_loss: 1.2756, test_f1: 0.3318
 epoch: 3, train_loss: 0.9927, test_loss: 1.1447, test_f1: 0.4646
 epoch: 4, train_loss: 0.9090, test_loss: 1.0517, test_f1: 0.4979
 epoch: 5, train_loss: 0.8834, test_loss: 1.0388, test_f1: 0.4889
 epoch: 6, train_loss: 0.8799, test_loss: 1.1811, test_f1: 0.4457
 epoch: 7, train_loss: 0.8637, test_loss: 1.0959, test_f1: 0.5685
 epoch: 8, train_loss: 0.8421, test_loss: 1.2198, test_f1: 0.5096
 epoch: 9, train_loss: 0.8339, test_loss: 1.1822, test_f1: 0.4037
 epoch: 10, train_loss: 0.8520, test_loss: 1.1483, test_f1: 0.5051
 epoch: 11, train_loss: 0.8614, test_loss: 1.3432, test_f1: 0.4342
 epoch: 12, train_loss: 0.8285, test_loss: 1.3978, test_f1: 0.5204
 epoch: 13, train_loss: 0.8149, test_loss: 1.0859, test_f1: 0.4960
 epoch: 14, train_loss: 0.8264, test_loss: 1.1871, test_f1: 0.5013
 epoch: 15, train_loss: 0.8044, test_loss: 1.2124, test_f1: 0.5989
 epoch: 16, train_loss: 0.8046, test_loss: 1.2671, test_f1: 0.5471
 epoch: 17, train_loss: 0.7784, test_loss: 1.6149, test_f1: 0.4290
 epoch: 18, train_loss: 0.7860, test_loss: 1.2565, test_f1: 0.5173
 epoch: 19, train_loss: 0.7700, test_loss: 1.0368, test_f1: 0.6046
 epoch: 20, train_loss: 0.7693, test_loss: 1.8822, test_f1: 0.4768
 epoch: 21, train_loss: 0.7814, test_loss: 1.1333, test_f1: 0.5921
 epoch: 22, train_loss: 0.7529, test_loss: 1.0884, test_f1: 0.5650
 epoch: 23, train_loss: 0.7495, test_loss: 1.1765, test_f1: 0.5538
 epoch: 24, train_loss: 0.7879, test_loss: 1.3003, test_f1: 0.4757
 epoch: 25, train_loss: 0.7827, test_loss: 1.0506, test_f1: 0.5394
 epoch: 26, train_loss: 0.7648, test_loss: 1.0304, test_f1: 0.5950
 epoch: 27, train_loss: 0.7534, test_loss: 1.2724, test_f1: 0.5942
 epoch: 28, train_loss: 0.7527, test_loss: 1.5779, test_f1: 0.5483
 epoch: 29, train_loss: 0.7402, test_loss: 1.1424, test_f1: 0.5724
 epoch: 30, train_loss: 0.7335, test_loss: 1.4470, test_f1: 0.4665
 epoch: 31, train_loss: 0.7217, test_loss: 1.1157, test_f1: 0.5109
 epoch: 32, train_loss: 0.7330, test_loss: 1.2522, test_f1: 0.5849
 epoch: 33, train_loss: 0.7185, test_loss: 1.4551, test_f1: 0.6139
 epoch: 34, train_loss: 0.7298, test_loss: 1.2092, test_f1: 0.5694
 epoch: 35, train_loss: 0.7595, test_loss: 1.1442, test_f1: 0.5253
 epoch: 36, train_loss: 0.7355, test_loss: 1.5167, test_f1: 0.5712
 epoch: 37, train_loss: 0.7111, test_loss: 1.3048, test_f1: 0.5085
 epoch: 38, train_loss: 0.7060, test_loss: 1.0545, test_f1: 0.6140
 epoch: 39, train_loss: 0.7182, test_loss: 1.7586, test_f1: 0.4920
 epoch: 40, train_loss: 0.7193, test_loss: 1.0942, test_f1: 0.5803
 epoch: 41, train_loss: 0.7078, test_loss: 1.2352, test_f1: 0.5362
 epoch: 42, train_loss: 0.7104, test_loss: 1.2178, test_f1: 0.5719
 epoch: 43, train_loss: 0.7501, test_loss: 1.2515, test_f1: 0.5156
 epoch: 44, train_loss: 0.7292, test_loss: 1.2794, test_f1: 0.5442
 epoch: 45, train_loss: 0.7074, test_loss: 1.1480, test_f1: 0.5746
 epoch: 46, train_loss: 0.7103, test_loss: 1.2413, test_f1: 0.5944
 epoch: 47, train_loss: 0.7063, test_loss: 1.2359, test_f1: 0.5583
 epoch: 48, train_loss: 0.7209, test_loss: 1.8418, test_f1: 0.4534
 epoch: 49, train_loss: 0.7265, test_loss: 1.3297, test_f1: 0.5592
 epoch: 50, train_loss: 0.7245, test_loss: 1.1368, test_f1: 0.5723
 epoch: 51, train_loss: 0.7058, test_loss: 1.2444, test_f1: 0.5353
 epoch: 52, train_loss: 0.6910, test_loss: 1.1068, test_f1: 0.5678
 epoch: 53, train_loss: 0.6842, test_loss: 1.0563, test_f1: 0.5821
 epoch: 54, train_loss: 0.6768, test_loss: 1.1283, test_f1: 0.6103
 epoch: 55, train_loss: 0.6683, test_loss: 1.2555, test_f1: 0.6009
 epoch: 56, train_loss: 0.6860, test_loss: 1.1714, test_f1: 0.5907
 epoch: 57, train_loss: 0.6735, test_loss: 1.1911, test_f1: 0.6054
 epoch: 58, train_loss: 0.6619, test_loss: 1.2062, test_f1: 0.5770
 epoch: 59, train_loss: 0.6558, test_loss: 1.2052, test_f1: 0.5928
 epoch: 60, train_loss: 0.6532, test_loss: 1.2361, test_f1: 0.5983
 epoch: 61, train_loss: 0.6449, test_loss: 1.2430, test_f1: 0.6128
 epoch: 62, train_loss: 0.6446, test_loss: 1.3145, test_f1: 0.5913
 epoch: 63, train_loss: 0.6504, test_loss: 1.3313, test_f1: 0.5936
 epoch: 64, train_loss: 0.6448, test_loss: 1.3818, test_f1: 0.5981
 epoch: 65, train_loss: 0.6384, test_loss: 1.3428, test_f1: 0.5780
 epoch: 66, train_loss: 0.6500, test_loss: 1.3263, test_f1: 0.5897
 epoch: 67, train_loss: 0.6360, test_loss: 1.4849, test_f1: 0.6016
 epoch: 68, train_loss: 0.6511, test_loss: 1.6471, test_f1: 0.6060
 epoch: 69, train_loss: 0.6571, test_loss: 1.4394, test_f1: 0.6061
 epoch: 70, train_loss: 0.6372, test_loss: 1.3445, test_f1: 0.5503
 epoch: 71, train_loss: 0.6489, test_loss: 1.4253, test_f1: 0.6069
 epoch: 72, train_loss: 0.6525, test_loss: 1.6813, test_f1: 0.6106
 epoch: 73, train_loss: 0.6367, test_loss: 1.5363, test_f1: 0.5995
 epoch: 74, train_loss: 0.6413, test_loss: 1.4207, test_f1: 0.5888
 epoch: 75, train_loss: 0.6387, test_loss: 1.5935, test_f1: 0.5979
 epoch: 76, train_loss: 0.6455, test_loss: 1.2953, test_f1: 0.6087
 epoch: 77, train_loss: 0.6365, test_loss: 1.6775, test_f1: 0.5680
 epoch: 78, train_loss: 0.6613, test_loss: 1.2378, test_f1: 0.5878
 epoch: 79, train_loss: 0.6324, test_loss: 1.4612, test_f1: 0.6118
 epoch: 80, train_loss: 0.6110, test_loss: 1.6486, test_f1: 0.5823
 epoch: 81, train_loss: 0.6276, test_loss: 1.5213, test_f1: 0.5914
 epoch: 82, train_loss: 0.6161, test_loss: 1.3660, test_f1: 0.6052
 epoch: 83, train_loss: 0.6337, test_loss: 1.5567, test_f1: 0.5919
 epoch: 84, train_loss: 0.6340, test_loss: 1.7504, test_f1: 0.5514
 epoch: 85, train_loss: 0.6169, test_loss: 1.3713, test_f1: 0.5864
 epoch: 86, train_loss: 0.6331, test_loss: 1.5435, test_f1: 0.6198
 epoch: 87, train_loss: 0.6544, test_loss: 2.3779, test_f1: 0.5498
 epoch: 88, train_loss: 0.6599, test_loss: 1.6076, test_f1: 0.4196
 epoch: 89, train_loss: 0.6571, test_loss: 1.5238, test_f1: 0.5551
 epoch: 90, train_loss: 0.6257, test_loss: 1.2627, test_f1: 0.6496
 epoch: 91, train_loss: 0.6386, test_loss: 1.5084, test_f1: 0.6014
 epoch: 92, train_loss: 0.6215, test_loss: 1.5076, test_f1: 0.6170
 epoch: 93, train_loss: 0.6039, test_loss: 1.3638, test_f1: 0.5576
 epoch: 94, train_loss: 0.6113, test_loss: 1.4897, test_f1: 0.6049
 epoch: 95, train_loss: 0.6212, test_loss: 1.8792, test_f1: 0.6037
 epoch: 96, train_loss: 0.6265, test_loss: 1.4999, test_f1: 0.5826
 epoch: 97, train_loss: 0.6203, test_loss: 1.6595, test_f1: 0.6048
 epoch: 98, train_loss: 0.6072, test_loss: 1.8693, test_f1: 0.5577
 epoch: 99, train_loss: 0.6131, test_loss: 1.8099, test_f1: 0.6200
##################ITERATION #4 ****************************************
 epoch: 0, train_loss: 1.2754, test_loss: 1.3838, test_f1: 0.2990
 epoch: 1, train_loss: 1.1025, test_loss: 1.3187, test_f1: 0.2218
 epoch: 2, train_loss: 1.0127, test_loss: 1.3278, test_f1: 0.3088
 epoch: 3, train_loss: 0.9906, test_loss: 1.0164, test_f1: 0.4987
 epoch: 4, train_loss: 0.9596, test_loss: 1.0007, test_f1: 0.5017
 epoch: 5, train_loss: 0.9401, test_loss: 1.0404, test_f1: 0.5146
 epoch: 6, train_loss: 0.9157, test_loss: 1.0463, test_f1: 0.5322
 epoch: 7, train_loss: 0.9045, test_loss: 0.9799, test_f1: 0.5948
 epoch: 8, train_loss: 0.8718, test_loss: 0.9784, test_f1: 0.5609
 epoch: 9, train_loss: 0.8673, test_loss: 1.1855, test_f1: 0.3992
 epoch: 10, train_loss: 0.8705, test_loss: 1.3993, test_f1: 0.4361
 epoch: 11, train_loss: 0.8556, test_loss: 0.9612, test_f1: 0.5330
 epoch: 12, train_loss: 0.8262, test_loss: 1.0306, test_f1: 0.5031
 epoch: 13, train_loss: 0.8269, test_loss: 1.1886, test_f1: 0.5222
 epoch: 14, train_loss: 0.8415, test_loss: 1.1299, test_f1: 0.4358
 epoch: 15, train_loss: 0.8333, test_loss: 0.9297, test_f1: 0.5474
 epoch: 16, train_loss: 0.8219, test_loss: 1.0460, test_f1: 0.5510
 epoch: 17, train_loss: 0.8075, test_loss: 0.9377, test_f1: 0.5377
 epoch: 18, train_loss: 0.7890, test_loss: 0.9561, test_f1: 0.5369
 epoch: 19, train_loss: 0.8543, test_loss: 1.1333, test_f1: 0.5020
 epoch: 20, train_loss: 0.8232, test_loss: 0.9692, test_f1: 0.5899
 epoch: 21, train_loss: 0.8068, test_loss: 1.0030, test_f1: 0.5424
 epoch: 22, train_loss: 0.7979, test_loss: 0.8860, test_f1: 0.6335
 epoch: 23, train_loss: 0.7852, test_loss: 0.9409, test_f1: 0.5389
 epoch: 24, train_loss: 0.7645, test_loss: 0.9821, test_f1: 0.5141
 epoch: 25, train_loss: 0.7654, test_loss: 0.9926, test_f1: 0.5375
 epoch: 26, train_loss: 0.7595, test_loss: 0.9460, test_f1: 0.6069
 epoch: 27, train_loss: 0.7605, test_loss: 0.9810, test_f1: 0.5643
 epoch: 28, train_loss: 0.7534, test_loss: 0.9254, test_f1: 0.6554
 epoch: 29, train_loss: 0.7541, test_loss: 0.9385, test_f1: 0.5932
 epoch: 30, train_loss: 0.7796, test_loss: 1.1237, test_f1: 0.5394
 epoch: 31, train_loss: 0.7869, test_loss: 0.9831, test_f1: 0.5635
 epoch: 32, train_loss: 0.7689, test_loss: 1.0953, test_f1: 0.5688
 epoch: 33, train_loss: 0.7626, test_loss: 1.0028, test_f1: 0.5946
 epoch: 34, train_loss: 0.7418, test_loss: 1.0339, test_f1: 0.5536
 epoch: 35, train_loss: 0.7367, test_loss: 0.9648, test_f1: 0.5962
 epoch: 36, train_loss: 0.7543, test_loss: 0.9327, test_f1: 0.6055
 epoch: 37, train_loss: 0.7414, test_loss: 1.0432, test_f1: 0.5349
 epoch: 38, train_loss: 0.7518, test_loss: 0.9989, test_f1: 0.5537
 epoch: 39, train_loss: 0.7586, test_loss: 0.9206, test_f1: 0.6289
 epoch: 40, train_loss: 0.7444, test_loss: 1.2490, test_f1: 0.4897
 epoch: 41, train_loss: 0.7317, test_loss: 1.1986, test_f1: 0.4733
 epoch: 42, train_loss: 0.7461, test_loss: 1.1133, test_f1: 0.6145
 epoch: 43, train_loss: 0.7413, test_loss: 0.9113, test_f1: 0.6329
 epoch: 44, train_loss: 0.7322, test_loss: 0.9291, test_f1: 0.5727
 epoch: 45, train_loss: 0.7336, test_loss: 0.8872, test_f1: 0.6236
 epoch: 46, train_loss: 0.7072, test_loss: 1.0984, test_f1: 0.5762
 epoch: 47, train_loss: 0.6971, test_loss: 0.9867, test_f1: 0.6261
 epoch: 48, train_loss: 0.7073, test_loss: 1.0463, test_f1: 0.5255
 epoch: 49, train_loss: 0.7101, test_loss: 0.9715, test_f1: 0.5905
 epoch: 50, train_loss: 0.7078, test_loss: 1.1311, test_f1: 0.5105
 epoch: 51, train_loss: 0.6977, test_loss: 1.0561, test_f1: 0.6112
 epoch: 52, train_loss: 0.6937, test_loss: 1.0379, test_f1: 0.6337
 epoch: 53, train_loss: 0.6829, test_loss: 1.0525, test_f1: 0.5888
 epoch: 54, train_loss: 0.6771, test_loss: 1.0988, test_f1: 0.5861
 epoch: 55, train_loss: 0.6756, test_loss: 0.9621, test_f1: 0.6250
 epoch: 56, train_loss: 0.6867, test_loss: 0.9407, test_f1: 0.6269
 epoch: 57, train_loss: 0.6659, test_loss: 0.9319, test_f1: 0.6486
 epoch: 58, train_loss: 0.6410, test_loss: 0.9493, test_f1: 0.5873
 epoch: 59, train_loss: 0.6540, test_loss: 0.9396, test_f1: 0.6392
 epoch: 60, train_loss: 0.6439, test_loss: 0.9427, test_f1: 0.6184
 epoch: 61, train_loss: 0.6444, test_loss: 0.9726, test_f1: 0.6254
 epoch: 62, train_loss: 0.6300, test_loss: 0.9598, test_f1: 0.6554
 epoch: 63, train_loss: 0.6680, test_loss: 0.9303, test_f1: 0.6247
 epoch: 64, train_loss: 0.6356, test_loss: 0.9474, test_f1: 0.6538
 epoch: 65, train_loss: 0.6432, test_loss: 1.0018, test_f1: 0.6270
 epoch: 66, train_loss: 0.6341, test_loss: 0.9997, test_f1: 0.6082
 epoch: 67, train_loss: 0.6441, test_loss: 0.9850, test_f1: 0.6456
 epoch: 68, train_loss: 0.6376, test_loss: 1.0620, test_f1: 0.5993
 epoch: 69, train_loss: 0.6460, test_loss: 1.0841, test_f1: 0.6228
 epoch: 70, train_loss: 0.6507, test_loss: 1.0494, test_f1: 0.5630
 epoch: 71, train_loss: 0.6586, test_loss: 0.9382, test_f1: 0.6323
 epoch: 72, train_loss: 0.6551, test_loss: 0.9857, test_f1: 0.6322
 epoch: 73, train_loss: 0.6503, test_loss: 1.1535, test_f1: 0.5414
 epoch: 74, train_loss: 0.6411, test_loss: 0.9772, test_f1: 0.6616
 epoch: 75, train_loss: 0.6363, test_loss: 1.1235, test_f1: 0.5646
 epoch: 76, train_loss: 0.6455, test_loss: 1.0358, test_f1: 0.6294
 epoch: 77, train_loss: 0.6486, test_loss: 1.0963, test_f1: 0.6031
 epoch: 78, train_loss: 0.6280, test_loss: 1.0832, test_f1: 0.6245
 epoch: 79, train_loss: 0.6151, test_loss: 1.0296, test_f1: 0.6467
 epoch: 80, train_loss: 0.6177, test_loss: 0.9847, test_f1: 0.6572
 epoch: 81, train_loss: 0.6147, test_loss: 1.1296, test_f1: 0.5602
 epoch: 82, train_loss: 0.6207, test_loss: 1.2707, test_f1: 0.5606
 epoch: 83, train_loss: 0.6221, test_loss: 1.0299, test_f1: 0.6282
 epoch: 84, train_loss: 0.6162, test_loss: 1.0169, test_f1: 0.6406
 epoch: 85, train_loss: 0.6377, test_loss: 1.0189, test_f1: 0.6486
 epoch: 86, train_loss: 0.6588, test_loss: 1.0584, test_f1: 0.6353
 epoch: 87, train_loss: 0.6316, test_loss: 0.9975, test_f1: 0.6119
 epoch: 88, train_loss: 0.6331, test_loss: 1.0329, test_f1: 0.6126
 epoch: 89, train_loss: 0.6618, test_loss: 1.0732, test_f1: 0.6032
 epoch: 90, train_loss: 0.6366, test_loss: 1.1352, test_f1: 0.6184
 epoch: 91, train_loss: 0.6554, test_loss: 1.1459, test_f1: 0.5676
 epoch: 92, train_loss: 0.6238, test_loss: 1.0333, test_f1: 0.6073
 epoch: 93, train_loss: 0.6244, test_loss: 1.0064, test_f1: 0.6347
 epoch: 94, train_loss: 0.6213, test_loss: 0.9547, test_f1: 0.6056
 epoch: 95, train_loss: 0.6202, test_loss: 0.9232, test_f1: 0.6359
 epoch: 96, train_loss: 0.6219, test_loss: 0.9323, test_f1: 0.6657
 epoch: 97, train_loss: 0.5895, test_loss: 1.0667, test_f1: 0.5855
 epoch: 98, train_loss: 0.6076, test_loss: 1.0219, test_f1: 0.6499
 epoch: 99, train_loss: 0.6245, test_loss: 1.4492, test_f1: 0.5315
##################ITERATION #5 ****************************************
 epoch: 0, train_loss: 1.2356, test_loss: 1.3996, test_f1: 0.2404
 epoch: 1, train_loss: 1.0790, test_loss: 1.2701, test_f1: 0.2390
 epoch: 2, train_loss: 1.0370, test_loss: 1.1855, test_f1: 0.3105
 epoch: 3, train_loss: 1.0158, test_loss: 1.1070, test_f1: 0.4223
 epoch: 4, train_loss: 0.9891, test_loss: 1.1815, test_f1: 0.4743
 epoch: 5, train_loss: 0.9656, test_loss: 1.2126, test_f1: 0.4728
 epoch: 6, train_loss: 0.9230, test_loss: 1.2172, test_f1: 0.4012
 epoch: 7, train_loss: 0.8933, test_loss: 1.0398, test_f1: 0.5210
 epoch: 8, train_loss: 0.8922, test_loss: 1.0948, test_f1: 0.5151
 epoch: 9, train_loss: 0.8408, test_loss: 1.0562, test_f1: 0.5285
 epoch: 10, train_loss: 0.8762, test_loss: 1.0066, test_f1: 0.5086
 epoch: 11, train_loss: 0.8562, test_loss: 1.0140, test_f1: 0.5494
 epoch: 12, train_loss: 0.8195, test_loss: 0.9817, test_f1: 0.5626
 epoch: 13, train_loss: 0.7988, test_loss: 1.0001, test_f1: 0.5626
 epoch: 14, train_loss: 0.7990, test_loss: 1.0300, test_f1: 0.5233
 epoch: 15, train_loss: 0.8209, test_loss: 1.1250, test_f1: 0.5722
 epoch: 16, train_loss: 0.8341, test_loss: 1.1718, test_f1: 0.5229
 epoch: 17, train_loss: 0.8171, test_loss: 0.9752, test_f1: 0.5568
 epoch: 18, train_loss: 0.7953, test_loss: 1.5164, test_f1: 0.4860
 epoch: 19, train_loss: 0.7771, test_loss: 0.9424, test_f1: 0.6194
 epoch: 20, train_loss: 0.7730, test_loss: 1.0278, test_f1: 0.5913
 epoch: 21, train_loss: 0.7642, test_loss: 1.0892, test_f1: 0.5724
 epoch: 22, train_loss: 0.7738, test_loss: 1.0978, test_f1: 0.4986
 epoch: 23, train_loss: 0.7821, test_loss: 1.1213, test_f1: 0.5675
 epoch: 24, train_loss: 0.7620, test_loss: 1.0023, test_f1: 0.5726
 epoch: 25, train_loss: 0.7622, test_loss: 1.1939, test_f1: 0.6046
 epoch: 26, train_loss: 0.7561, test_loss: 1.0600, test_f1: 0.5936
 epoch: 27, train_loss: 0.7449, test_loss: 1.1614, test_f1: 0.5541
 epoch: 28, train_loss: 0.7724, test_loss: 1.1607, test_f1: 0.5464
 epoch: 29, train_loss: 0.7832, test_loss: 1.0357, test_f1: 0.5463
 epoch: 30, train_loss: 0.7515, test_loss: 1.2821, test_f1: 0.4968
 epoch: 31, train_loss: 0.7903, test_loss: 1.2215, test_f1: 0.5709
 epoch: 32, train_loss: 0.7424, test_loss: 1.0567, test_f1: 0.5365
 epoch: 33, train_loss: 0.7249, test_loss: 1.1405, test_f1: 0.5828
 epoch: 34, train_loss: 0.7088, test_loss: 1.1733, test_f1: 0.5657
 epoch: 35, train_loss: 0.6973, test_loss: 1.3686, test_f1: 0.5590
 epoch: 36, train_loss: 0.6944, test_loss: 1.1995, test_f1: 0.6102
 epoch: 37, train_loss: 0.7346, test_loss: 1.1920, test_f1: 0.5539
 epoch: 38, train_loss: 0.7087, test_loss: 1.4738, test_f1: 0.5646
 epoch: 39, train_loss: 0.6995, test_loss: 1.1676, test_f1: 0.5842
 epoch: 40, train_loss: 0.6916, test_loss: 1.3586, test_f1: 0.5504
 epoch: 41, train_loss: 0.7236, test_loss: 1.2558, test_f1: 0.5652
 epoch: 42, train_loss: 0.7261, test_loss: 1.2541, test_f1: 0.5547
 epoch: 43, train_loss: 0.7631, test_loss: 1.1864, test_f1: 0.5149
 epoch: 44, train_loss: 0.7318, test_loss: 1.4822, test_f1: 0.4827
 epoch: 45, train_loss: 0.7853, test_loss: 1.3618, test_f1: 0.5505
 epoch: 46, train_loss: 0.7619, test_loss: 1.1045, test_f1: 0.5767
 epoch: 47, train_loss: 0.7973, test_loss: 1.2477, test_f1: 0.5152
 epoch: 48, train_loss: 0.7212, test_loss: 0.9846, test_f1: 0.6016
 epoch: 49, train_loss: 0.7121, test_loss: 1.0812, test_f1: 0.5807
 epoch: 50, train_loss: 0.6862, test_loss: 1.2588, test_f1: 0.6093
 epoch: 51, train_loss: 0.6729, test_loss: 1.2445, test_f1: 0.5892
 epoch: 52, train_loss: 0.6781, test_loss: 1.2778, test_f1: 0.5922
 epoch: 53, train_loss: 0.6546, test_loss: 1.4316, test_f1: 0.5673
 epoch: 54, train_loss: 0.6480, test_loss: 1.2370, test_f1: 0.5833
 epoch: 55, train_loss: 0.6384, test_loss: 1.2313, test_f1: 0.6029
 epoch: 56, train_loss: 0.6348, test_loss: 1.2785, test_f1: 0.5988
 epoch: 57, train_loss: 0.6328, test_loss: 1.2751, test_f1: 0.5984
 epoch: 58, train_loss: 0.6195, test_loss: 1.3425, test_f1: 0.6182
 epoch: 59, train_loss: 0.6434, test_loss: 1.3943, test_f1: 0.5986
 epoch: 60, train_loss: 0.6252, test_loss: 1.3246, test_f1: 0.5912
 epoch: 61, train_loss: 0.6214, test_loss: 1.2360, test_f1: 0.5873
 epoch: 62, train_loss: 0.6442, test_loss: 1.2580, test_f1: 0.5578
 epoch: 63, train_loss: 0.6309, test_loss: 1.3561, test_f1: 0.5667
 epoch: 64, train_loss: 0.6191, test_loss: 1.6213, test_f1: 0.5633
 epoch: 65, train_loss: 0.6201, test_loss: 1.3288, test_f1: 0.6089
 epoch: 66, train_loss: 0.6264, test_loss: 1.4908, test_f1: 0.6195
 epoch: 67, train_loss: 0.6409, test_loss: 1.6370, test_f1: 0.6093
 epoch: 68, train_loss: 0.6204, test_loss: 1.4665, test_f1: 0.5748
 epoch: 69, train_loss: 0.6173, test_loss: 1.4332, test_f1: 0.5396
 epoch: 70, train_loss: 0.6278, test_loss: 1.3016, test_f1: 0.5937
 epoch: 71, train_loss: 0.6400, test_loss: 1.3791, test_f1: 0.5409
 epoch: 72, train_loss: 0.6222, test_loss: 1.5099, test_f1: 0.5377
 epoch: 73, train_loss: 0.6316, test_loss: 1.9658, test_f1: 0.5572
 epoch: 74, train_loss: 0.6145, test_loss: 1.5667, test_f1: 0.6029
 epoch: 75, train_loss: 0.6402, test_loss: 1.7712, test_f1: 0.5544
 epoch: 76, train_loss: 0.6171, test_loss: 1.2976, test_f1: 0.5408
 epoch: 77, train_loss: 0.6123, test_loss: 1.6203, test_f1: 0.5754
 epoch: 78, train_loss: 0.5881, test_loss: 1.2494, test_f1: 0.5847
 epoch: 79, train_loss: 0.6036, test_loss: 1.6438, test_f1: 0.5789
 epoch: 80, train_loss: 0.5904, test_loss: 1.4016, test_f1: 0.5718
 epoch: 81, train_loss: 0.6084, test_loss: 1.7007, test_f1: 0.5714
 epoch: 82, train_loss: 0.5823, test_loss: 1.6506, test_f1: 0.5671
 epoch: 83, train_loss: 0.5750, test_loss: 1.5704, test_f1: 0.5949
 epoch: 84, train_loss: 0.5948, test_loss: 1.3633, test_f1: 0.5426
 epoch: 85, train_loss: 0.5881, test_loss: 1.8490, test_f1: 0.5858
 epoch: 86, train_loss: 0.5992, test_loss: 1.7679, test_f1: 0.6034
 epoch: 87, train_loss: 0.5906, test_loss: 1.4343, test_f1: 0.5515
 epoch: 88, train_loss: 0.5814, test_loss: 1.5186, test_f1: 0.5800
 epoch: 89, train_loss: 0.5829, test_loss: 1.7673, test_f1: 0.5458
 epoch: 90, train_loss: 0.5868, test_loss: 1.5749, test_f1: 0.6067
 epoch: 91, train_loss: 0.5696, test_loss: 1.9145, test_f1: 0.5429
 epoch: 92, train_loss: 0.5874, test_loss: 1.9130, test_f1: 0.5684
 epoch: 93, train_loss: 0.5891, test_loss: 1.5446, test_f1: 0.5494
 epoch: 94, train_loss: 0.5959, test_loss: 1.3702, test_f1: 0.5759
 epoch: 95, train_loss: 0.6103, test_loss: 1.6464, test_f1: 0.5463
 epoch: 96, train_loss: 0.5916, test_loss: 2.1950, test_f1: 0.5780
 epoch: 97, train_loss: 0.5784, test_loss: 1.6785, test_f1: 0.5365
 epoch: 98, train_loss: 0.5765, test_loss: 1.7281, test_f1: 0.5946
 epoch: 99, train_loss: 0.5469, test_loss: 1.7515, test_f1: 0.5828
##################ITERATION #6 ****************************************
 epoch: 0, train_loss: 1.3874, test_loss: 1.3172, test_f1: 0.2281
 epoch: 1, train_loss: 1.0923, test_loss: 1.2968, test_f1: 0.3333
 epoch: 2, train_loss: 1.0088, test_loss: 1.1295, test_f1: 0.4298
 epoch: 3, train_loss: 0.9655, test_loss: 1.1190, test_f1: 0.4950
 epoch: 4, train_loss: 0.9203, test_loss: 1.1389, test_f1: 0.4810
 epoch: 5, train_loss: 0.8888, test_loss: 1.1247, test_f1: 0.5186
 epoch: 6, train_loss: 0.8936, test_loss: 0.9871, test_f1: 0.5654
 epoch: 7, train_loss: 0.8548, test_loss: 0.9931, test_f1: 0.5348
 epoch: 8, train_loss: 0.8440, test_loss: 1.3999, test_f1: 0.5106
 epoch: 9, train_loss: 0.8496, test_loss: 1.0007, test_f1: 0.5549
 epoch: 10, train_loss: 0.8298, test_loss: 1.0690, test_f1: 0.5383
 epoch: 11, train_loss: 0.8040, test_loss: 1.0044, test_f1: 0.5566
 epoch: 12, train_loss: 0.8336, test_loss: 1.1453, test_f1: 0.5243
 epoch: 13, train_loss: 0.8333, test_loss: 0.9873, test_f1: 0.5876
 epoch: 14, train_loss: 0.8284, test_loss: 0.9737, test_f1: 0.5992
 epoch: 15, train_loss: 0.8135, test_loss: 0.9592, test_f1: 0.5933
 epoch: 16, train_loss: 0.7953, test_loss: 1.3540, test_f1: 0.5081
 epoch: 17, train_loss: 0.7803, test_loss: 1.2581, test_f1: 0.4379
 epoch: 18, train_loss: 0.8104, test_loss: 1.1085, test_f1: 0.4856
 epoch: 19, train_loss: 0.8007, test_loss: 0.9246, test_f1: 0.5946
 epoch: 20, train_loss: 0.7661, test_loss: 0.9794, test_f1: 0.6104
 epoch: 21, train_loss: 0.7712, test_loss: 0.9615, test_f1: 0.5720
 epoch: 22, train_loss: 0.7819, test_loss: 1.0407, test_f1: 0.5636
 epoch: 23, train_loss: 0.7572, test_loss: 1.0026, test_f1: 0.6098
 epoch: 24, train_loss: 0.7647, test_loss: 0.9608, test_f1: 0.6389
 epoch: 25, train_loss: 0.7300, test_loss: 0.9501, test_f1: 0.6070
 epoch: 26, train_loss: 0.7457, test_loss: 1.0054, test_f1: 0.6534
 epoch: 27, train_loss: 0.7270, test_loss: 1.2580, test_f1: 0.5923
 epoch: 28, train_loss: 0.7893, test_loss: 1.0686, test_f1: 0.5753
 epoch: 29, train_loss: 0.7843, test_loss: 1.1179, test_f1: 0.5599
 epoch: 30, train_loss: 0.7439, test_loss: 1.0822, test_f1: 0.5313
 epoch: 31, train_loss: 0.7518, test_loss: 0.9787, test_f1: 0.6352
 epoch: 32, train_loss: 0.7253, test_loss: 1.0251, test_f1: 0.5727
 epoch: 33, train_loss: 0.7344, test_loss: 1.1887, test_f1: 0.6246
 epoch: 34, train_loss: 0.7369, test_loss: 1.0643, test_f1: 0.5854
 epoch: 35, train_loss: 0.7279, test_loss: 1.1982, test_f1: 0.5644
 epoch: 36, train_loss: 0.7180, test_loss: 1.1072, test_f1: 0.6184
 epoch: 37, train_loss: 0.7103, test_loss: 1.2436, test_f1: 0.5244
 epoch: 38, train_loss: 0.7005, test_loss: 1.0545, test_f1: 0.6053
 epoch: 39, train_loss: 0.7258, test_loss: 1.0647, test_f1: 0.5676
 epoch: 40, train_loss: 0.7238, test_loss: 1.2437, test_f1: 0.5566
 epoch: 41, train_loss: 0.6882, test_loss: 1.0430, test_f1: 0.5777
 epoch: 42, train_loss: 0.7290, test_loss: 1.2944, test_f1: 0.5612
 epoch: 43, train_loss: 0.7006, test_loss: 1.0919, test_f1: 0.5993
 epoch: 44, train_loss: 0.6873, test_loss: 1.2030, test_f1: 0.6244
 epoch: 45, train_loss: 0.6766, test_loss: 1.4162, test_f1: 0.5400
 epoch: 46, train_loss: 0.6792, test_loss: 1.0154, test_f1: 0.6511
 epoch: 47, train_loss: 0.6748, test_loss: 1.2069, test_f1: 0.5949
 epoch: 48, train_loss: 0.6769, test_loss: 1.1581, test_f1: 0.6387
 epoch: 49, train_loss: 0.6614, test_loss: 1.0113, test_f1: 0.6163
 epoch: 50, train_loss: 0.6461, test_loss: 1.0868, test_f1: 0.6450
 epoch: 51, train_loss: 0.6274, test_loss: 1.1225, test_f1: 0.6129
 epoch: 52, train_loss: 0.6016, test_loss: 1.1314, test_f1: 0.6355
 epoch: 53, train_loss: 0.6214, test_loss: 1.1929, test_f1: 0.6060
 epoch: 54, train_loss: 0.5954, test_loss: 1.1357, test_f1: 0.6208
 epoch: 55, train_loss: 0.6058, test_loss: 1.0433, test_f1: 0.6500
 epoch: 56, train_loss: 0.6203, test_loss: 1.2568, test_f1: 0.6116
 epoch: 57, train_loss: 0.5996, test_loss: 1.4307, test_f1: 0.5946
 epoch: 58, train_loss: 0.5985, test_loss: 1.2805, test_f1: 0.6052
 epoch: 59, train_loss: 0.6107, test_loss: 1.0892, test_f1: 0.6343
 epoch: 60, train_loss: 0.6016, test_loss: 1.2619, test_f1: 0.5951
 epoch: 61, train_loss: 0.5870, test_loss: 1.3377, test_f1: 0.5892
 epoch: 62, train_loss: 0.5750, test_loss: 1.2158, test_f1: 0.6409
 epoch: 63, train_loss: 0.5752, test_loss: 1.3988, test_f1: 0.5931
 epoch: 64, train_loss: 0.5886, test_loss: 1.3812, test_f1: 0.6453
 epoch: 65, train_loss: 0.5873, test_loss: 1.1502, test_f1: 0.6303
 epoch: 66, train_loss: 0.5742, test_loss: 1.2907, test_f1: 0.6723
 epoch: 67, train_loss: 0.5746, test_loss: 1.4722, test_f1: 0.5964
 epoch: 68, train_loss: 0.5903, test_loss: 1.4301, test_f1: 0.6286
 epoch: 69, train_loss: 0.6070, test_loss: 1.1080, test_f1: 0.6409
 epoch: 70, train_loss: 0.5896, test_loss: 1.1504, test_f1: 0.6409
 epoch: 71, train_loss: 0.5847, test_loss: 1.3920, test_f1: 0.6269
 epoch: 72, train_loss: 0.5703, test_loss: 1.4625, test_f1: 0.6264
 epoch: 73, train_loss: 0.5416, test_loss: 1.4114, test_f1: 0.5859
 epoch: 74, train_loss: 0.5572, test_loss: 1.4761, test_f1: 0.6198
 epoch: 75, train_loss: 0.5644, test_loss: 1.4096, test_f1: 0.6055
 epoch: 76, train_loss: 0.5713, test_loss: 1.2953, test_f1: 0.6590
 epoch: 77, train_loss: 0.5693, test_loss: 1.0791, test_f1: 0.6062
 epoch: 78, train_loss: 0.5700, test_loss: 1.3663, test_f1: 0.6578
 epoch: 79, train_loss: 0.5771, test_loss: 1.3132, test_f1: 0.5928
 epoch: 80, train_loss: 0.5785, test_loss: 1.3126, test_f1: 0.6526
 epoch: 81, train_loss: 0.5725, test_loss: 1.4846, test_f1: 0.6287
 epoch: 82, train_loss: 0.5637, test_loss: 1.2309, test_f1: 0.6517
 epoch: 83, train_loss: 0.5326, test_loss: 1.4094, test_f1: 0.6234
 epoch: 84, train_loss: 0.5582, test_loss: 1.1520, test_f1: 0.6217
 epoch: 85, train_loss: 0.5268, test_loss: 1.3893, test_f1: 0.6172
 epoch: 86, train_loss: 0.5540, test_loss: 1.4840, test_f1: 0.6188
 epoch: 87, train_loss: 0.5904, test_loss: 1.4113, test_f1: 0.6078
 epoch: 88, train_loss: 0.5357, test_loss: 1.4254, test_f1: 0.5975
 epoch: 89, train_loss: 0.5431, test_loss: 1.3778, test_f1: 0.5977
 epoch: 90, train_loss: 0.5496, test_loss: 1.3806, test_f1: 0.6078
 epoch: 91, train_loss: 0.5571, test_loss: 1.6831, test_f1: 0.6075
 epoch: 92, train_loss: 0.5445, test_loss: 1.4817, test_f1: 0.6122
 epoch: 93, train_loss: 0.5402, test_loss: 1.3389, test_f1: 0.6268
 epoch: 94, train_loss: 0.5264, test_loss: 1.3528, test_f1: 0.5933
 epoch: 95, train_loss: 0.5336, test_loss: 1.4003, test_f1: 0.6314
 epoch: 96, train_loss: 0.5293, test_loss: 1.4251, test_f1: 0.6506
 epoch: 97, train_loss: 0.5261, test_loss: 1.3516, test_f1: 0.5913
 epoch: 98, train_loss: 0.5197, test_loss: 1.5375, test_f1: 0.6352
 epoch: 99, train_loss: 0.5328, test_loss: 1.3674, test_f1: 0.6105
##################ITERATION #7 ****************************************
 epoch: 0, train_loss: 1.3313, test_loss: 1.3255, test_f1: 0.2583
 epoch: 1, train_loss: 1.1044, test_loss: 1.2809, test_f1: 0.2281
 epoch: 2, train_loss: 1.0288, test_loss: 1.2152, test_f1: 0.3360
 epoch: 3, train_loss: 1.0143, test_loss: 1.0845, test_f1: 0.4864
 epoch: 4, train_loss: 0.9745, test_loss: 1.1948, test_f1: 0.4098
 epoch: 5, train_loss: 0.9450, test_loss: 1.0141, test_f1: 0.5475
 epoch: 6, train_loss: 0.9014, test_loss: 1.0204, test_f1: 0.5308
 epoch: 7, train_loss: 0.8697, test_loss: 1.0362, test_f1: 0.5336
 epoch: 8, train_loss: 0.8992, test_loss: 1.0513, test_f1: 0.4696
 epoch: 9, train_loss: 0.8380, test_loss: 1.0175, test_f1: 0.5437
 epoch: 10, train_loss: 0.8610, test_loss: 1.0372, test_f1: 0.5396
 epoch: 11, train_loss: 0.9061, test_loss: 2.0710, test_f1: 0.3699
 epoch: 12, train_loss: 0.8796, test_loss: 1.1256, test_f1: 0.4465
 epoch: 13, train_loss: 0.8639, test_loss: 1.1974, test_f1: 0.5337
 epoch: 14, train_loss: 0.8777, test_loss: 0.9977, test_f1: 0.4969
 epoch: 15, train_loss: 0.8465, test_loss: 1.0506, test_f1: 0.5070
 epoch: 16, train_loss: 0.8367, test_loss: 1.5986, test_f1: 0.4061
 epoch: 17, train_loss: 0.8234, test_loss: 1.3408, test_f1: 0.4751
 epoch: 18, train_loss: 0.8238, test_loss: 0.9794, test_f1: 0.5704
 epoch: 19, train_loss: 0.8141, test_loss: 1.4934, test_f1: 0.4822
 epoch: 20, train_loss: 0.8024, test_loss: 0.9995, test_f1: 0.5853
 epoch: 21, train_loss: 0.8026, test_loss: 1.3162, test_f1: 0.4632
 epoch: 22, train_loss: 0.8184, test_loss: 1.7468, test_f1: 0.4231
 epoch: 23, train_loss: 0.8102, test_loss: 1.2155, test_f1: 0.4765
 epoch: 24, train_loss: 0.8009, test_loss: 1.0212, test_f1: 0.5309
 epoch: 25, train_loss: 0.8090, test_loss: 1.1653, test_f1: 0.5326
 epoch: 26, train_loss: 0.8147, test_loss: 1.1814, test_f1: 0.5306
 epoch: 27, train_loss: 0.8252, test_loss: 1.0549, test_f1: 0.5142
 epoch: 28, train_loss: 0.8062, test_loss: 1.0548, test_f1: 0.5483
 epoch: 29, train_loss: 0.7657, test_loss: 1.0733, test_f1: 0.5373
 epoch: 30, train_loss: 0.7786, test_loss: 0.9925, test_f1: 0.4940
 epoch: 31, train_loss: 0.7587, test_loss: 1.3396, test_f1: 0.5020
 epoch: 32, train_loss: 0.7681, test_loss: 1.0524, test_f1: 0.5256
 epoch: 33, train_loss: 0.7533, test_loss: 0.9930, test_f1: 0.5743
 epoch: 34, train_loss: 0.7559, test_loss: 1.0130, test_f1: 0.5673
 epoch: 35, train_loss: 0.7498, test_loss: 1.4647, test_f1: 0.5222
 epoch: 36, train_loss: 0.7486, test_loss: 1.4458, test_f1: 0.5115
 epoch: 37, train_loss: 0.7503, test_loss: 1.3376, test_f1: 0.4853
 epoch: 38, train_loss: 0.7413, test_loss: 1.5997, test_f1: 0.5061
 epoch: 39, train_loss: 0.7647, test_loss: 1.1744, test_f1: 0.5434
 epoch: 40, train_loss: 0.7629, test_loss: 1.3131, test_f1: 0.5575
 epoch: 41, train_loss: 0.7443, test_loss: 1.2638, test_f1: 0.5281
 epoch: 42, train_loss: 0.7182, test_loss: 1.2054, test_f1: 0.5025
 epoch: 43, train_loss: 0.7226, test_loss: 1.2544, test_f1: 0.5660
 epoch: 44, train_loss: 0.7349, test_loss: 0.8879, test_f1: 0.5852
 epoch: 45, train_loss: 0.7675, test_loss: 1.2014, test_f1: 0.5364
 epoch: 46, train_loss: 0.7715, test_loss: 1.0759, test_f1: 0.5697
 epoch: 47, train_loss: 0.7343, test_loss: 1.0759, test_f1: 0.5808
 epoch: 48, train_loss: 0.7253, test_loss: 0.9919, test_f1: 0.5689
 epoch: 49, train_loss: 0.7182, test_loss: 1.7298, test_f1: 0.5457
 epoch: 50, train_loss: 0.7229, test_loss: 0.9383, test_f1: 0.6121
 epoch: 51, train_loss: 0.7056, test_loss: 1.1421, test_f1: 0.5819
 epoch: 52, train_loss: 0.6895, test_loss: 1.0884, test_f1: 0.5874
 epoch: 53, train_loss: 0.6798, test_loss: 1.2496, test_f1: 0.5944
 epoch: 54, train_loss: 0.6888, test_loss: 1.1486, test_f1: 0.5719
 epoch: 55, train_loss: 0.6620, test_loss: 1.4252, test_f1: 0.5574
 epoch: 56, train_loss: 0.6642, test_loss: 1.0479, test_f1: 0.5963
 epoch: 57, train_loss: 0.6651, test_loss: 1.2421, test_f1: 0.5910
 epoch: 58, train_loss: 0.6455, test_loss: 1.3851, test_f1: 0.5717
 epoch: 59, train_loss: 0.6535, test_loss: 1.2568, test_f1: 0.6039
 epoch: 60, train_loss: 0.6397, test_loss: 1.2104, test_f1: 0.5996
 epoch: 61, train_loss: 0.6516, test_loss: 1.4791, test_f1: 0.5776
 epoch: 62, train_loss: 0.6449, test_loss: 1.4420, test_f1: 0.5913
 epoch: 63, train_loss: 0.6535, test_loss: 1.1619, test_f1: 0.5816
 epoch: 64, train_loss: 0.6526, test_loss: 1.3665, test_f1: 0.6118
 epoch: 65, train_loss: 0.6423, test_loss: 1.4083, test_f1: 0.5904
 epoch: 66, train_loss: 0.6424, test_loss: 1.2106, test_f1: 0.6186
 epoch: 67, train_loss: 0.6577, test_loss: 1.4225, test_f1: 0.6147
 epoch: 68, train_loss: 0.6551, test_loss: 1.1176, test_f1: 0.6012
 epoch: 69, train_loss: 0.6735, test_loss: 0.9400, test_f1: 0.6353
 epoch: 70, train_loss: 0.6583, test_loss: 1.1481, test_f1: 0.6184
 epoch: 71, train_loss: 0.6618, test_loss: 1.7118, test_f1: 0.6049
 epoch: 72, train_loss: 0.6519, test_loss: 1.4351, test_f1: 0.6351
 epoch: 73, train_loss: 0.6925, test_loss: 1.6747, test_f1: 0.6252
 epoch: 74, train_loss: 0.6787, test_loss: 1.3475, test_f1: 0.5929
 epoch: 75, train_loss: 0.6615, test_loss: 1.2669, test_f1: 0.6153
 epoch: 76, train_loss: 0.6488, test_loss: 1.1283, test_f1: 0.6046
 epoch: 77, train_loss: 0.6258, test_loss: 1.6337, test_f1: 0.6097
 epoch: 78, train_loss: 0.6334, test_loss: 1.3479, test_f1: 0.5878
 epoch: 79, train_loss: 0.6078, test_loss: 1.2889, test_f1: 0.6135
 epoch: 80, train_loss: 0.6227, test_loss: 1.7047, test_f1: 0.5843
 epoch: 81, train_loss: 0.6162, test_loss: 1.7572, test_f1: 0.6023
 epoch: 82, train_loss: 0.6302, test_loss: 1.4557, test_f1: 0.6049
 epoch: 83, train_loss: 0.6450, test_loss: 1.3442, test_f1: 0.6072
 epoch: 84, train_loss: 0.6215, test_loss: 1.7172, test_f1: 0.6408
 epoch: 85, train_loss: 0.6331, test_loss: 1.5796, test_f1: 0.6080
 epoch: 86, train_loss: 0.6243, test_loss: 1.5691, test_f1: 0.5900
 epoch: 87, train_loss: 0.6097, test_loss: 1.4187, test_f1: 0.5735
 epoch: 88, train_loss: 0.6368, test_loss: 1.5198, test_f1: 0.5759
 epoch: 89, train_loss: 0.6275, test_loss: 1.3998, test_f1: 0.5981
 epoch: 90, train_loss: 0.6087, test_loss: 1.9110, test_f1: 0.5905
 epoch: 91, train_loss: 0.6072, test_loss: 2.0127, test_f1: 0.5945
 epoch: 92, train_loss: 0.6231, test_loss: 1.6748, test_f1: 0.6301
 epoch: 93, train_loss: 0.6341, test_loss: 2.3098, test_f1: 0.5575
 epoch: 94, train_loss: 0.6111, test_loss: 2.0941, test_f1: 0.5984
 epoch: 95, train_loss: 0.6632, test_loss: 2.5391, test_f1: 0.6341
 epoch: 96, train_loss: 0.6421, test_loss: 1.8444, test_f1: 0.6153
 epoch: 97, train_loss: 0.6185, test_loss: 1.3257, test_f1: 0.5797
 epoch: 98, train_loss: 0.6555, test_loss: 1.9250, test_f1: 0.6084
 epoch: 99, train_loss: 0.6405, test_loss: 1.6045, test_f1: 0.6454
##################ITERATION #8 ****************************************
 epoch: 0, train_loss: 1.2822, test_loss: 1.4065, test_f1: 0.1379
 epoch: 1, train_loss: 1.0557, test_loss: 1.3123, test_f1: 0.2810
 epoch: 2, train_loss: 0.9810, test_loss: 1.1631, test_f1: 0.3761
 epoch: 3, train_loss: 0.9525, test_loss: 2.2189, test_f1: 0.2690
 epoch: 4, train_loss: 0.9153, test_loss: 0.9845, test_f1: 0.5244
 epoch: 5, train_loss: 0.8721, test_loss: 1.0073, test_f1: 0.5409
 epoch: 6, train_loss: 0.8879, test_loss: 0.9900, test_f1: 0.4672
 epoch: 7, train_loss: 0.8596, test_loss: 1.9118, test_f1: 0.4098
 epoch: 8, train_loss: 0.8634, test_loss: 1.1709, test_f1: 0.4086
 epoch: 9, train_loss: 0.8338, test_loss: 1.1220, test_f1: 0.5527
 epoch: 10, train_loss: 0.8197, test_loss: 1.0597, test_f1: 0.5870
 epoch: 11, train_loss: 0.7964, test_loss: 1.1945, test_f1: 0.4619
 epoch: 12, train_loss: 0.8031, test_loss: 1.1004, test_f1: 0.5356
 epoch: 13, train_loss: 0.7949, test_loss: 1.2364, test_f1: 0.4632
 epoch: 14, train_loss: 0.7887, test_loss: 1.1857, test_f1: 0.4837
 epoch: 15, train_loss: 0.7825, test_loss: 1.0932, test_f1: 0.5700
 epoch: 16, train_loss: 0.7613, test_loss: 1.3631, test_f1: 0.4940
 epoch: 17, train_loss: 0.7622, test_loss: 1.4170, test_f1: 0.4216
 epoch: 18, train_loss: 0.7676, test_loss: 1.2392, test_f1: 0.5806
 epoch: 19, train_loss: 0.7508, test_loss: 1.0906, test_f1: 0.6142
 epoch: 20, train_loss: 0.7633, test_loss: 1.4088, test_f1: 0.5385
 epoch: 21, train_loss: 0.7604, test_loss: 0.9889, test_f1: 0.5879
 epoch: 22, train_loss: 0.8020, test_loss: 1.6617, test_f1: 0.4775
 epoch: 23, train_loss: 0.7949, test_loss: 1.3137, test_f1: 0.4972
 epoch: 24, train_loss: 0.7763, test_loss: 1.0378, test_f1: 0.5903
 epoch: 25, train_loss: 0.7650, test_loss: 1.1215, test_f1: 0.5618
 epoch: 26, train_loss: 0.7746, test_loss: 1.1640, test_f1: 0.5693
 epoch: 27, train_loss: 0.7562, test_loss: 1.0762, test_f1: 0.6104
 epoch: 28, train_loss: 0.7370, test_loss: 1.2178, test_f1: 0.5471
 epoch: 29, train_loss: 0.7398, test_loss: 1.0708, test_f1: 0.5742
 epoch: 30, train_loss: 0.7315, test_loss: 1.0617, test_f1: 0.6039
 epoch: 31, train_loss: 0.7268, test_loss: 1.1767, test_f1: 0.5105
 epoch: 32, train_loss: 0.7165, test_loss: 1.0524, test_f1: 0.6357
 epoch: 33, train_loss: 0.7024, test_loss: 1.2438, test_f1: 0.5173
 epoch: 34, train_loss: 0.7175, test_loss: 1.0371, test_f1: 0.6049
 epoch: 35, train_loss: 0.7172, test_loss: 1.0511, test_f1: 0.6150
 epoch: 36, train_loss: 0.7307, test_loss: 1.1281, test_f1: 0.5882
 epoch: 37, train_loss: 0.7147, test_loss: 1.1631, test_f1: 0.6179
 epoch: 38, train_loss: 0.7222, test_loss: 0.9468, test_f1: 0.6108
 epoch: 39, train_loss: 0.7082, test_loss: 1.2262, test_f1: 0.5346
 epoch: 40, train_loss: 0.7074, test_loss: 1.1146, test_f1: 0.6174
 epoch: 41, train_loss: 0.6831, test_loss: 1.1936, test_f1: 0.6222
 epoch: 42, train_loss: 0.7173, test_loss: 1.4450, test_f1: 0.4994
 epoch: 43, train_loss: 0.7351, test_loss: 1.2638, test_f1: 0.6289
 epoch: 44, train_loss: 0.7255, test_loss: 1.0874, test_f1: 0.6202
 epoch: 45, train_loss: 0.7152, test_loss: 1.2845, test_f1: 0.5871
 epoch: 46, train_loss: 0.7195, test_loss: 0.9602, test_f1: 0.6171
 epoch: 47, train_loss: 0.7578, test_loss: 2.5110, test_f1: 0.4081
 epoch: 48, train_loss: 0.7291, test_loss: 1.1742, test_f1: 0.5603
 epoch: 49, train_loss: 0.7019, test_loss: 1.4132, test_f1: 0.5416
 epoch: 50, train_loss: 0.6800, test_loss: 1.4019, test_f1: 0.5579
 epoch: 51, train_loss: 0.6737, test_loss: 1.1662, test_f1: 0.5885
 epoch: 52, train_loss: 0.6687, test_loss: 1.1158, test_f1: 0.6328
 epoch: 53, train_loss: 0.6570, test_loss: 1.1641, test_f1: 0.6206
 epoch: 54, train_loss: 0.6647, test_loss: 1.1446, test_f1: 0.5976
 epoch: 55, train_loss: 0.6571, test_loss: 1.2022, test_f1: 0.6103
 epoch: 56, train_loss: 0.6506, test_loss: 1.2436, test_f1: 0.5837
 epoch: 57, train_loss: 0.6563, test_loss: 1.2647, test_f1: 0.6329
 epoch: 58, train_loss: 0.6478, test_loss: 1.3511, test_f1: 0.5800
 epoch: 59, train_loss: 0.6436, test_loss: 1.3633, test_f1: 0.5921
 epoch: 60, train_loss: 0.6372, test_loss: 1.2094, test_f1: 0.6341
 epoch: 61, train_loss: 0.6422, test_loss: 1.1869, test_f1: 0.6054
 epoch: 62, train_loss: 0.6440, test_loss: 1.6089, test_f1: 0.5524
 epoch: 63, train_loss: 0.6517, test_loss: 1.3396, test_f1: 0.5497
 epoch: 64, train_loss: 0.6526, test_loss: 1.3080, test_f1: 0.6311
 epoch: 65, train_loss: 0.6610, test_loss: 1.2393, test_f1: 0.5869
 epoch: 66, train_loss: 0.6422, test_loss: 1.4392, test_f1: 0.5884
 epoch: 67, train_loss: 0.6245, test_loss: 1.3997, test_f1: 0.6150
 epoch: 68, train_loss: 0.6674, test_loss: 1.4430, test_f1: 0.5384
 epoch: 69, train_loss: 0.6505, test_loss: 1.4781, test_f1: 0.6051
 epoch: 70, train_loss: 0.6370, test_loss: 1.2985, test_f1: 0.6107
 epoch: 71, train_loss: 0.6208, test_loss: 1.4645, test_f1: 0.6417
 epoch: 72, train_loss: 0.6354, test_loss: 1.2363, test_f1: 0.5946
 epoch: 73, train_loss: 0.6787, test_loss: 1.6298, test_f1: 0.5436
 epoch: 74, train_loss: 0.6708, test_loss: 1.6107, test_f1: 0.5344
 epoch: 75, train_loss: 0.6566, test_loss: 1.2624, test_f1: 0.6138
 epoch: 76, train_loss: 0.6539, test_loss: 1.2310, test_f1: 0.6177
 epoch: 77, train_loss: 0.6508, test_loss: 1.2687, test_f1: 0.6128
 epoch: 78, train_loss: 0.6334, test_loss: 1.2661, test_f1: 0.5966
 epoch: 79, train_loss: 0.6248, test_loss: 1.2065, test_f1: 0.6084
 epoch: 80, train_loss: 0.6381, test_loss: 1.1477, test_f1: 0.6384
 epoch: 81, train_loss: 0.6184, test_loss: 1.4046, test_f1: 0.5906
 epoch: 82, train_loss: 0.6315, test_loss: 1.3646, test_f1: 0.5753
 epoch: 83, train_loss: 0.6349, test_loss: 1.4698, test_f1: 0.4707
 epoch: 84, train_loss: 0.6449, test_loss: 1.5855, test_f1: 0.6259
 epoch: 85, train_loss: 0.6243, test_loss: 1.2032, test_f1: 0.6031
 epoch: 86, train_loss: 0.6258, test_loss: 1.4176, test_f1: 0.5985
 epoch: 87, train_loss: 0.6174, test_loss: 1.3993, test_f1: 0.6126
 epoch: 88, train_loss: 0.6128, test_loss: 1.5430, test_f1: 0.5631
 epoch: 89, train_loss: 0.5887, test_loss: 1.2658, test_f1: 0.5834
 epoch: 90, train_loss: 0.5860, test_loss: 1.4682, test_f1: 0.5496
 epoch: 91, train_loss: 0.5789, test_loss: 1.2204, test_f1: 0.6033
 epoch: 92, train_loss: 0.5912, test_loss: 1.5335, test_f1: 0.5556
 epoch: 93, train_loss: 0.5970, test_loss: 1.2675, test_f1: 0.6077
 epoch: 94, train_loss: 0.5688, test_loss: 1.7597, test_f1: 0.5708
 epoch: 95, train_loss: 0.5615, test_loss: 1.4148, test_f1: 0.5823
 epoch: 96, train_loss: 0.5975, test_loss: 1.2264, test_f1: 0.5973
 epoch: 97, train_loss: 0.5996, test_loss: 1.4136, test_f1: 0.5704
 epoch: 98, train_loss: 0.5834, test_loss: 1.2426, test_f1: 0.6037
 epoch: 99, train_loss: 0.5695, test_loss: 1.4077, test_f1: 0.6029
##################ITERATION #9 ****************************************
 epoch: 0, train_loss: 1.3306, test_loss: 1.4045, test_f1: 0.3317
 epoch: 1, train_loss: 1.0917, test_loss: 1.3260, test_f1: 0.3383
 epoch: 2, train_loss: 1.0214, test_loss: 1.1380, test_f1: 0.4422
 epoch: 3, train_loss: 0.9951, test_loss: 1.0876, test_f1: 0.4901
 epoch: 4, train_loss: 0.9817, test_loss: 1.1069, test_f1: 0.4410
 epoch: 5, train_loss: 0.9621, test_loss: 1.0909, test_f1: 0.4762
 epoch: 6, train_loss: 0.9068, test_loss: 1.0985, test_f1: 0.4756
 epoch: 7, train_loss: 0.8863, test_loss: 1.0460, test_f1: 0.5155
 epoch: 8, train_loss: 0.8523, test_loss: 1.0369, test_f1: 0.4604
 epoch: 9, train_loss: 0.8616, test_loss: 1.0378, test_f1: 0.4254
 epoch: 10, train_loss: 0.8387, test_loss: 0.9759, test_f1: 0.5842
 epoch: 11, train_loss: 0.8305, test_loss: 0.9848, test_f1: 0.5433
 epoch: 12, train_loss: 0.8091, test_loss: 0.9869, test_f1: 0.5597
 epoch: 13, train_loss: 0.8037, test_loss: 0.9896, test_f1: 0.5714
 epoch: 14, train_loss: 0.8018, test_loss: 0.9937, test_f1: 0.5744
 epoch: 15, train_loss: 0.8027, test_loss: 1.2347, test_f1: 0.5351
 epoch: 16, train_loss: 0.7946, test_loss: 0.9641, test_f1: 0.5570
 epoch: 17, train_loss: 0.7809, test_loss: 1.0953, test_f1: 0.5270
 epoch: 18, train_loss: 0.7838, test_loss: 0.9866, test_f1: 0.5716
 epoch: 19, train_loss: 0.8000, test_loss: 1.2825, test_f1: 0.4893
 epoch: 20, train_loss: 0.7722, test_loss: 0.9055, test_f1: 0.6127
 epoch: 21, train_loss: 0.7583, test_loss: 0.9959, test_f1: 0.5554
 epoch: 22, train_loss: 0.7980, test_loss: 1.2719, test_f1: 0.5231
 epoch: 23, train_loss: 0.7978, test_loss: 1.0055, test_f1: 0.5783
 epoch: 24, train_loss: 0.7660, test_loss: 0.9923, test_f1: 0.5379
 epoch: 25, train_loss: 0.7745, test_loss: 1.0567, test_f1: 0.5731
 epoch: 26, train_loss: 0.7671, test_loss: 1.1409, test_f1: 0.5780
 epoch: 27, train_loss: 0.7428, test_loss: 1.0868, test_f1: 0.5837
 epoch: 28, train_loss: 0.7461, test_loss: 0.9872, test_f1: 0.4608
 epoch: 29, train_loss: 0.7528, test_loss: 1.0712, test_f1: 0.5484
 epoch: 30, train_loss: 0.7730, test_loss: 1.0155, test_f1: 0.4175
 epoch: 31, train_loss: 0.7705, test_loss: 1.0711, test_f1: 0.5035
 epoch: 32, train_loss: 0.7564, test_loss: 1.1005, test_f1: 0.4694
 epoch: 33, train_loss: 0.7393, test_loss: 1.0124, test_f1: 0.5881
 epoch: 34, train_loss: 0.7443, test_loss: 0.9673, test_f1: 0.6160
 epoch: 35, train_loss: 0.7357, test_loss: 0.9164, test_f1: 0.5382
 epoch: 36, train_loss: 0.7821, test_loss: 0.9436, test_f1: 0.5885
 epoch: 37, train_loss: 0.7285, test_loss: 0.9915, test_f1: 0.5467
 epoch: 38, train_loss: 0.7450, test_loss: 1.0921, test_f1: 0.5321
 epoch: 39, train_loss: 0.7102, test_loss: 1.0118, test_f1: 0.6175
 epoch: 40, train_loss: 0.7222, test_loss: 0.9464, test_f1: 0.5712
 epoch: 41, train_loss: 0.7328, test_loss: 1.0453, test_f1: 0.5024
 epoch: 42, train_loss: 0.7354, test_loss: 1.0089, test_f1: 0.5900
 epoch: 43, train_loss: 0.7099, test_loss: 1.2454, test_f1: 0.5322
 epoch: 44, train_loss: 0.7244, test_loss: 1.1741, test_f1: 0.4766
 epoch: 45, train_loss: 0.6993, test_loss: 1.1398, test_f1: 0.5518
 epoch: 46, train_loss: 0.6940, test_loss: 0.9352, test_f1: 0.5737
 epoch: 47, train_loss: 0.6943, test_loss: 1.2766, test_f1: 0.5208
 epoch: 48, train_loss: 0.7250, test_loss: 1.1023, test_f1: 0.5766
 epoch: 49, train_loss: 0.7455, test_loss: 0.9872, test_f1: 0.6158
 epoch: 50, train_loss: 0.7479, test_loss: 1.0927, test_f1: 0.5497
 epoch: 51, train_loss: 0.7199, test_loss: 0.9620, test_f1: 0.6408
 epoch: 52, train_loss: 0.7010, test_loss: 0.9636, test_f1: 0.6077
 epoch: 53, train_loss: 0.6891, test_loss: 0.9489, test_f1: 0.5743
 epoch: 54, train_loss: 0.6955, test_loss: 0.9972, test_f1: 0.6137
 epoch: 55, train_loss: 0.7029, test_loss: 0.9545, test_f1: 0.6379
 epoch: 56, train_loss: 0.6937, test_loss: 1.0155, test_f1: 0.5712
 epoch: 57, train_loss: 0.6806, test_loss: 0.9541, test_f1: 0.5947
 epoch: 58, train_loss: 0.6771, test_loss: 0.9853, test_f1: 0.6189
 epoch: 59, train_loss: 0.6866, test_loss: 0.9854, test_f1: 0.6180
 epoch: 60, train_loss: 0.6679, test_loss: 0.9858, test_f1: 0.6480
 epoch: 61, train_loss: 0.6739, test_loss: 1.1387, test_f1: 0.5940
 epoch: 62, train_loss: 0.6896, test_loss: 1.1371, test_f1: 0.6195
 epoch: 63, train_loss: 0.6730, test_loss: 0.9709, test_f1: 0.6502
 epoch: 64, train_loss: 0.6549, test_loss: 0.9624, test_f1: 0.6382
 epoch: 65, train_loss: 0.6621, test_loss: 1.0886, test_f1: 0.6054
 epoch: 66, train_loss: 0.6612, test_loss: 1.0459, test_f1: 0.6328
 epoch: 67, train_loss: 0.6481, test_loss: 0.9938, test_f1: 0.6106
 epoch: 68, train_loss: 0.6552, test_loss: 0.9826, test_f1: 0.6258
 epoch: 69, train_loss: 0.6521, test_loss: 1.1959, test_f1: 0.5348
 epoch: 70, train_loss: 0.6620, test_loss: 1.0430, test_f1: 0.6219
 epoch: 71, train_loss: 0.6549, test_loss: 1.1998, test_f1: 0.6085
 epoch: 72, train_loss: 0.6689, test_loss: 1.1810, test_f1: 0.6178
 epoch: 73, train_loss: 0.6327, test_loss: 1.0831, test_f1: 0.6215
 epoch: 74, train_loss: 0.6305, test_loss: 1.0794, test_f1: 0.5954
 epoch: 75, train_loss: 0.6286, test_loss: 1.0968, test_f1: 0.6228
 epoch: 76, train_loss: 0.6337, test_loss: 1.2899, test_f1: 0.5919
 epoch: 77, train_loss: 0.6261, test_loss: 1.1590, test_f1: 0.6143
 epoch: 78, train_loss: 0.6240, test_loss: 1.1439, test_f1: 0.6033
 epoch: 79, train_loss: 0.6323, test_loss: 1.1901, test_f1: 0.5855
 epoch: 80, train_loss: 0.6408, test_loss: 1.1478, test_f1: 0.6046
 epoch: 81, train_loss: 0.6370, test_loss: 1.4296, test_f1: 0.6419
 epoch: 82, train_loss: 0.6572, test_loss: 1.2006, test_f1: 0.6169
 epoch: 83, train_loss: 0.6514, test_loss: 1.0524, test_f1: 0.6207
 epoch: 84, train_loss: 0.6580, test_loss: 0.9878, test_f1: 0.6073
 epoch: 85, train_loss: 0.6314, test_loss: 1.1238, test_f1: 0.6252
 epoch: 86, train_loss: 0.6361, test_loss: 1.0487, test_f1: 0.6054
 epoch: 87, train_loss: 0.6134, test_loss: 1.1640, test_f1: 0.6240
 epoch: 88, train_loss: 0.6254, test_loss: 1.1741, test_f1: 0.5740
 epoch: 89, train_loss: 0.6183, test_loss: 1.3528, test_f1: 0.6137
 epoch: 90, train_loss: 0.6231, test_loss: 1.1360, test_f1: 0.6354
 epoch: 91, train_loss: 0.6396, test_loss: 1.3024, test_f1: 0.5733
 epoch: 92, train_loss: 0.6264, test_loss: 1.2368, test_f1: 0.5826
 epoch: 93, train_loss: 0.6329, test_loss: 1.1737, test_f1: 0.6152
 epoch: 94, train_loss: 0.6336, test_loss: 1.0490, test_f1: 0.6345
 epoch: 95, train_loss: 0.6197, test_loss: 1.0641, test_f1: 0.6135
 epoch: 96, train_loss: 0.6206, test_loss: 1.2326, test_f1: 0.6137
 epoch: 97, train_loss: 0.6415, test_loss: 1.1672, test_f1: 0.6066
 epoch: 98, train_loss: 0.6141, test_loss: 1.0551, test_f1: 0.6043
 epoch: 99, train_loss: 0.6249, test_loss: 1.0484, test_f1: 0.5998

Training completed in 338.58 seconds
Best F1: 0.6723 at epoch 66
Mean F1 across iterations: 0.6484  0.0205
========================FINAL RESULTS================================
FEGIN weighted F1: 0.6723  0.0205
python main.py --data ltspice_demos --representation component_pin --model FEGIN --layers 3 --hiddens 16 --batch_size 128 --lr 0.01 --emb_size 250 --epochs 100 --save_appendix component_pin_L3_H16_BS128_LR0.01_E250 --no_val
-----



STDERR:
  File "main.py", line 370, in <module>
    main()
  File "main.py", line 254, in main
    dataset = dataset_class(
  File "/home/philip/projects/ltspice_examples_code_repo/Circuit-Completion-Using-GNNs/component_classification_with_link_prediction_head/evaluation/FEGIN/kernel/circuit_datasets.py", line 15, in __init__
    self.data, self.slices = torch.load(self.processed_paths[0])
  File "/home/philip/.local/lib/python3.8/site-packages/torch/serialization.py", line 1040, in load
    warnings.warn(
  File "/usr/lib/python3.8/warnings.py", line 109, in _showwarnmsg
    sw(msg.message, msg.category, msg.filename, msg.lineno,
  File "main.py", line 47, in warn_with_traceback
    traceback.print_stack(file=log)
/home/philip/projects/ltspice_examples_code_repo/Circuit-Completion-Using-GNNs/component_classification_with_link_prediction_head/evaluation/FEGIN/kernel/circuit_datasets.py:15: FutureWarning: You are using `torch.load` with `weights_only=False` (the current default value), which uses the default pickle module implicitly. It is possible to construct malicious pickle data which will execute arbitrary code during unpickling (See https://github.com/pytorch/pytorch/blob/main/SECURITY.md#untrusted-models for more details). In a future release, the default value for `weights_only` will be flipped to `True`. This limits the functions that could be executed during unpickling. Arbitrary objects will no longer be allowed to be loaded via this mode unless they are explicitly allowlisted by the user via `torch.serialization.add_safe_globals`. We recommend you start setting `weights_only=True` for any use case where you don't have full control of the loaded file. Please open an issue on GitHub for any issues related to this experimental feature.
  self.data, self.slices = torch.load(self.processed_paths[0])
