STDOUT:
Results will be saved in /home/philip/projects/ltspice_examples_code_repo/Circuit-Completion-Using-GNNs/component_classification_with_link_prediction_head/evaluation/FEGIN/results/model_FEGIN_dataset_ltspice_demos
Command line input: python main.py --data ltspice_demos --representation component_component --model FEGIN --layers 3 --hiddens 128 --batch_size 32 --lr 0.001 --emb_size 512 --epochs 100 --save_appendix component_component_L3_H128_BS32_LR0.001_E512 --no_val
 is saved.
-----
ltspice_demos - FEGIN
Using 3 layers, 128 hidden units, h = 2
Loading component_component representation dataset
ENTERED
Training FEGIN on component_component representation
Train: 1565, Test: 383
##################ITERATION #0 ****************************************
 epoch: 0, train_loss: 1.2194, test_loss: 1.2668, test_f1: 0.3256
 epoch: 1, train_loss: 1.1125, test_loss: 1.2344, test_f1: 0.3805
 epoch: 2, train_loss: 1.0559, test_loss: 1.3235, test_f1: 0.3967
 epoch: 3, train_loss: 1.0323, test_loss: 1.3351, test_f1: 0.4402
 epoch: 4, train_loss: 0.9853, test_loss: 1.2268, test_f1: 0.4394
 epoch: 5, train_loss: 0.9386, test_loss: 1.2834, test_f1: 0.4743
 epoch: 6, train_loss: 0.9265, test_loss: 1.2061, test_f1: 0.4853
 epoch: 7, train_loss: 0.8761, test_loss: 1.2234, test_f1: 0.4876
 epoch: 8, train_loss: 0.8618, test_loss: 1.2384, test_f1: 0.5023
 epoch: 9, train_loss: 0.8520, test_loss: 1.2629, test_f1: 0.5434
 epoch: 10, train_loss: 0.8181, test_loss: 1.3242, test_f1: 0.4909
 epoch: 11, train_loss: 0.8110, test_loss: 1.1959, test_f1: 0.5483
 epoch: 12, train_loss: 0.7818, test_loss: 1.5357, test_f1: 0.3963
 epoch: 13, train_loss: 0.7795, test_loss: 1.2163, test_f1: 0.5309
 epoch: 14, train_loss: 0.7821, test_loss: 1.3356, test_f1: 0.5110
 epoch: 15, train_loss: 0.7416, test_loss: 1.0753, test_f1: 0.6126
 epoch: 16, train_loss: 0.7431, test_loss: 1.1558, test_f1: 0.5871
 epoch: 17, train_loss: 0.7198, test_loss: 1.5317, test_f1: 0.5643
 epoch: 18, train_loss: 0.6930, test_loss: 1.3809, test_f1: 0.5582
 epoch: 19, train_loss: 0.6872, test_loss: 1.4172, test_f1: 0.5741
 epoch: 20, train_loss: 0.7015, test_loss: 1.4498, test_f1: 0.5714
 epoch: 21, train_loss: 0.6709, test_loss: 1.3071, test_f1: 0.5271
 epoch: 22, train_loss: 0.6565, test_loss: 1.4377, test_f1: 0.5851
 epoch: 23, train_loss: 0.6439, test_loss: 1.6193, test_f1: 0.5887
 epoch: 24, train_loss: 0.6158, test_loss: 1.3896, test_f1: 0.5515
 epoch: 25, train_loss: 0.5838, test_loss: 1.6308, test_f1: 0.5719
 epoch: 26, train_loss: 0.6023, test_loss: 1.4243, test_f1: 0.5598
 epoch: 27, train_loss: 0.6109, test_loss: 1.3458, test_f1: 0.5920
 epoch: 28, train_loss: 0.5801, test_loss: 1.5205, test_f1: 0.5977
 epoch: 29, train_loss: 0.5544, test_loss: 1.6204, test_f1: 0.5658
 epoch: 30, train_loss: 0.5739, test_loss: 1.6651, test_f1: 0.5397
 epoch: 31, train_loss: 0.5612, test_loss: 1.7406, test_f1: 0.5246
 epoch: 32, train_loss: 0.5632, test_loss: 1.6553, test_f1: 0.5485
 epoch: 33, train_loss: 0.5333, test_loss: 1.9172, test_f1: 0.5530
 epoch: 34, train_loss: 0.5135, test_loss: 2.1850, test_f1: 0.4653
 epoch: 35, train_loss: 0.5063, test_loss: 1.7383, test_f1: 0.5664
 epoch: 36, train_loss: 0.5211, test_loss: 2.4389, test_f1: 0.5509
 epoch: 37, train_loss: 0.5149, test_loss: 1.6170, test_f1: 0.5453
 epoch: 38, train_loss: 0.5137, test_loss: 2.1818, test_f1: 0.5201
 epoch: 39, train_loss: 0.4883, test_loss: 2.0045, test_f1: 0.5799
 epoch: 40, train_loss: 0.5168, test_loss: 1.9653, test_f1: 0.5421
 epoch: 41, train_loss: 0.4939, test_loss: 1.7457, test_f1: 0.5825
 epoch: 42, train_loss: 0.4800, test_loss: 1.7652, test_f1: 0.6065
 epoch: 43, train_loss: 0.4878, test_loss: 1.5742, test_f1: 0.5929
 epoch: 44, train_loss: 0.4687, test_loss: 1.8005, test_f1: 0.5452
 epoch: 45, train_loss: 0.4620, test_loss: 1.8175, test_f1: 0.5162
 epoch: 46, train_loss: 0.4445, test_loss: 1.7995, test_f1: 0.5754
 epoch: 47, train_loss: 0.4090, test_loss: 1.9225, test_f1: 0.5867
 epoch: 48, train_loss: 0.4314, test_loss: 2.0502, test_f1: 0.5910
 epoch: 49, train_loss: 0.4496, test_loss: 1.8761, test_f1: 0.6003
 epoch: 50, train_loss: 0.4434, test_loss: 1.8840, test_f1: 0.5475
 epoch: 51, train_loss: 0.3776, test_loss: 2.0281, test_f1: 0.5797
 epoch: 52, train_loss: 0.3463, test_loss: 2.1539, test_f1: 0.5723
 epoch: 53, train_loss: 0.3410, test_loss: 2.4894, test_f1: 0.5769
 epoch: 54, train_loss: 0.3492, test_loss: 2.0603, test_f1: 0.5300
 epoch: 55, train_loss: 0.3261, test_loss: 2.1998, test_f1: 0.5567
 epoch: 56, train_loss: 0.3194, test_loss: 2.1580, test_f1: 0.5796
 epoch: 57, train_loss: 0.3378, test_loss: 2.2223, test_f1: 0.5611
 epoch: 58, train_loss: 0.3063, test_loss: 2.5695, test_f1: 0.5475
 epoch: 59, train_loss: 0.2896, test_loss: 2.4666, test_f1: 0.5685
 epoch: 60, train_loss: 0.2939, test_loss: 2.5857, test_f1: 0.5430
 epoch: 61, train_loss: 0.3046, test_loss: 2.7766, test_f1: 0.5313
 epoch: 62, train_loss: 0.3351, test_loss: 2.7748, test_f1: 0.5248
 epoch: 63, train_loss: 0.2925, test_loss: 2.6747, test_f1: 0.5630
 epoch: 64, train_loss: 0.2777, test_loss: 2.6306, test_f1: 0.5334
 epoch: 65, train_loss: 0.2992, test_loss: 2.6956, test_f1: 0.5444
 epoch: 66, train_loss: 0.3021, test_loss: 3.1852, test_f1: 0.5605
 epoch: 67, train_loss: 0.2770, test_loss: 4.5721, test_f1: 0.5727
 epoch: 68, train_loss: 0.2862, test_loss: 2.8141, test_f1: 0.5622
 epoch: 69, train_loss: 0.2521, test_loss: 3.1724, test_f1: 0.5605
 epoch: 70, train_loss: 0.2745, test_loss: 3.0880, test_f1: 0.5527
 epoch: 71, train_loss: 0.2449, test_loss: 2.8075, test_f1: 0.5688
 epoch: 72, train_loss: 0.2501, test_loss: 3.3192, test_f1: 0.5352
 epoch: 73, train_loss: 0.2578, test_loss: 2.8266, test_f1: 0.5796
 epoch: 74, train_loss: 0.2661, test_loss: 3.0541, test_f1: 0.5689
 epoch: 75, train_loss: 0.2599, test_loss: 2.8983, test_f1: 0.5531
 epoch: 76, train_loss: 0.2429, test_loss: 2.6059, test_f1: 0.5582
 epoch: 77, train_loss: 0.2295, test_loss: 2.9580, test_f1: 0.5382
 epoch: 78, train_loss: 0.2689, test_loss: 2.7627, test_f1: 0.5908
 epoch: 79, train_loss: 0.2381, test_loss: 3.0397, test_f1: 0.5671
 epoch: 80, train_loss: 0.2248, test_loss: 2.7681, test_f1: 0.6218
 epoch: 81, train_loss: 0.2166, test_loss: 3.0924, test_f1: 0.5484
 epoch: 82, train_loss: 0.2300, test_loss: 3.3644, test_f1: 0.5815
 epoch: 83, train_loss: 0.2336, test_loss: 3.0467, test_f1: 0.5903
 epoch: 84, train_loss: 0.2501, test_loss: 3.1353, test_f1: 0.5681
 epoch: 85, train_loss: 0.2146, test_loss: 3.1683, test_f1: 0.5816
 epoch: 86, train_loss: 0.2232, test_loss: 3.2792, test_f1: 0.5589
 epoch: 87, train_loss: 0.2508, test_loss: 3.3138, test_f1: 0.5546
 epoch: 88, train_loss: 0.2324, test_loss: 3.0851, test_f1: 0.5661
 epoch: 89, train_loss: 0.2349, test_loss: 3.0279, test_f1: 0.5660
 epoch: 90, train_loss: 0.2420, test_loss: 2.9444, test_f1: 0.5582
 epoch: 91, train_loss: 0.2021, test_loss: 3.0278, test_f1: 0.5514
 epoch: 92, train_loss: 0.2116, test_loss: 3.0122, test_f1: 0.6052
 epoch: 93, train_loss: 0.2156, test_loss: 3.2518, test_f1: 0.5169
 epoch: 94, train_loss: 0.2328, test_loss: 2.8178, test_f1: 0.5692
 epoch: 95, train_loss: 0.1868, test_loss: 2.8578, test_f1: 0.5677
 epoch: 96, train_loss: 0.2148, test_loss: 2.8278, test_f1: 0.5991
 epoch: 97, train_loss: 0.1879, test_loss: 3.2155, test_f1: 0.5749
 epoch: 98, train_loss: 0.1718, test_loss: 3.1462, test_f1: 0.5743
 epoch: 99, train_loss: 0.2104, test_loss: 3.1193, test_f1: 0.5979
##################ITERATION #1 ****************************************
 epoch: 0, train_loss: 1.1643, test_loss: 1.1984, test_f1: 0.4580
 epoch: 1, train_loss: 1.0772, test_loss: 1.1666, test_f1: 0.4935
 epoch: 2, train_loss: 1.0027, test_loss: 1.0801, test_f1: 0.5640
 epoch: 3, train_loss: 0.9286, test_loss: 1.1471, test_f1: 0.4802
 epoch: 4, train_loss: 0.9316, test_loss: 1.0849, test_f1: 0.6280
 epoch: 5, train_loss: 0.8876, test_loss: 1.1271, test_f1: 0.5942
 epoch: 6, train_loss: 0.8795, test_loss: 1.1451, test_f1: 0.5196
 epoch: 7, train_loss: 0.8587, test_loss: 1.1529, test_f1: 0.5894
 epoch: 8, train_loss: 0.8267, test_loss: 1.3159, test_f1: 0.4828
 epoch: 9, train_loss: 0.8204, test_loss: 1.1634, test_f1: 0.6074
 epoch: 10, train_loss: 0.8062, test_loss: 1.1083, test_f1: 0.6148
 epoch: 11, train_loss: 0.7768, test_loss: 1.1719, test_f1: 0.6040
 epoch: 12, train_loss: 0.7684, test_loss: 1.2654, test_f1: 0.5795
 epoch: 13, train_loss: 0.7627, test_loss: 1.2056, test_f1: 0.5784
 epoch: 14, train_loss: 0.7286, test_loss: 1.7189, test_f1: 0.4964
 epoch: 15, train_loss: 0.6989, test_loss: 1.2270, test_f1: 0.5611
 epoch: 16, train_loss: 0.7068, test_loss: 1.4002, test_f1: 0.5647
 epoch: 17, train_loss: 0.7043, test_loss: 1.2599, test_f1: 0.5756
 epoch: 18, train_loss: 0.6641, test_loss: 1.3738, test_f1: 0.5671
 epoch: 19, train_loss: 0.6959, test_loss: 1.4137, test_f1: 0.5744
 epoch: 20, train_loss: 0.6566, test_loss: 1.4156, test_f1: 0.5909
 epoch: 21, train_loss: 0.6688, test_loss: 1.3737, test_f1: 0.6008
 epoch: 22, train_loss: 0.6245, test_loss: 1.5514, test_f1: 0.5281
 epoch: 23, train_loss: 0.6433, test_loss: 1.6652, test_f1: 0.5516
 epoch: 24, train_loss: 0.6164, test_loss: 1.4984, test_f1: 0.6236
 epoch: 25, train_loss: 0.6061, test_loss: 1.5663, test_f1: 0.6332
 epoch: 26, train_loss: 0.6192, test_loss: 1.5411, test_f1: 0.5688
 epoch: 27, train_loss: 0.6001, test_loss: 1.5035, test_f1: 0.5544
 epoch: 28, train_loss: 0.5958, test_loss: 1.7512, test_f1: 0.5937
 epoch: 29, train_loss: 0.5473, test_loss: 1.4959, test_f1: 0.5930
 epoch: 30, train_loss: 0.5474, test_loss: 1.8269, test_f1: 0.6053
 epoch: 31, train_loss: 0.5503, test_loss: 1.6717, test_f1: 0.5675
 epoch: 32, train_loss: 0.5409, test_loss: 1.7264, test_f1: 0.6355
 epoch: 33, train_loss: 0.5313, test_loss: 1.8680, test_f1: 0.5850
 epoch: 34, train_loss: 0.5577, test_loss: 1.7307, test_f1: 0.6407
 epoch: 35, train_loss: 0.5295, test_loss: 2.3227, test_f1: 0.6228
 epoch: 36, train_loss: 0.4811, test_loss: 1.8187, test_f1: 0.6058
 epoch: 37, train_loss: 0.4953, test_loss: 2.0816, test_f1: 0.6010
 epoch: 38, train_loss: 0.5006, test_loss: 2.3581, test_f1: 0.5524
 epoch: 39, train_loss: 0.4979, test_loss: 1.7951, test_f1: 0.6047
 epoch: 40, train_loss: 0.4869, test_loss: 2.0106, test_f1: 0.5924
 epoch: 41, train_loss: 0.4776, test_loss: 2.1088, test_f1: 0.6062
 epoch: 42, train_loss: 0.4483, test_loss: 1.8307, test_f1: 0.6051
 epoch: 43, train_loss: 0.4729, test_loss: 1.9264, test_f1: 0.6276
 epoch: 44, train_loss: 0.4709, test_loss: 2.0346, test_f1: 0.5780
 epoch: 45, train_loss: 0.4766, test_loss: 1.9905, test_f1: 0.6072
 epoch: 46, train_loss: 0.4502, test_loss: 1.8576, test_f1: 0.6395
 epoch: 47, train_loss: 0.4761, test_loss: 1.7455, test_f1: 0.6395
 epoch: 48, train_loss: 0.4345, test_loss: 1.9182, test_f1: 0.5997
 epoch: 49, train_loss: 0.4216, test_loss: 2.1700, test_f1: 0.6124
 epoch: 50, train_loss: 0.4226, test_loss: 2.4892, test_f1: 0.5846
 epoch: 51, train_loss: 0.4000, test_loss: 2.2245, test_f1: 0.6003
 epoch: 52, train_loss: 0.3522, test_loss: 1.9646, test_f1: 0.6245
 epoch: 53, train_loss: 0.3522, test_loss: 2.0789, test_f1: 0.6080
 epoch: 54, train_loss: 0.3338, test_loss: 2.2905, test_f1: 0.5930
 epoch: 55, train_loss: 0.3279, test_loss: 2.1191, test_f1: 0.6249
 epoch: 56, train_loss: 0.3283, test_loss: 2.5196, test_f1: 0.5906
 epoch: 57, train_loss: 0.3255, test_loss: 2.4047, test_f1: 0.6072
 epoch: 58, train_loss: 0.3116, test_loss: 2.0600, test_f1: 0.5941
 epoch: 59, train_loss: 0.3145, test_loss: 2.1312, test_f1: 0.6294
 epoch: 60, train_loss: 0.3151, test_loss: 2.1720, test_f1: 0.6132
 epoch: 61, train_loss: 0.3097, test_loss: 2.1766, test_f1: 0.6136
 epoch: 62, train_loss: 0.3046, test_loss: 2.5056, test_f1: 0.5786
 epoch: 63, train_loss: 0.3102, test_loss: 2.2449, test_f1: 0.6170
 epoch: 64, train_loss: 0.2871, test_loss: 2.5278, test_f1: 0.6060
 epoch: 65, train_loss: 0.2934, test_loss: 2.3860, test_f1: 0.6013
 epoch: 66, train_loss: 0.2868, test_loss: 2.5351, test_f1: 0.5653
 epoch: 67, train_loss: 0.2843, test_loss: 2.2063, test_f1: 0.6186
 epoch: 68, train_loss: 0.2657, test_loss: 2.2901, test_f1: 0.6041
 epoch: 69, train_loss: 0.3006, test_loss: 2.2914, test_f1: 0.5922
 epoch: 70, train_loss: 0.3017, test_loss: 2.2264, test_f1: 0.5956
 epoch: 71, train_loss: 0.2527, test_loss: 2.4835, test_f1: 0.6019
 epoch: 72, train_loss: 0.2913, test_loss: 2.4891, test_f1: 0.5960
 epoch: 73, train_loss: 0.2556, test_loss: 2.4758, test_f1: 0.6063
 epoch: 74, train_loss: 0.2430, test_loss: 2.8042, test_f1: 0.5968
 epoch: 75, train_loss: 0.2620, test_loss: 2.4019, test_f1: 0.5957
 epoch: 76, train_loss: 0.2668, test_loss: 2.5444, test_f1: 0.5761
 epoch: 77, train_loss: 0.2397, test_loss: 2.6001, test_f1: 0.6271
 epoch: 78, train_loss: 0.2790, test_loss: 2.2949, test_f1: 0.6501
 epoch: 79, train_loss: 0.2710, test_loss: 2.7966, test_f1: 0.5987
 epoch: 80, train_loss: 0.2655, test_loss: 3.5281, test_f1: 0.6073
 epoch: 81, train_loss: 0.2539, test_loss: 2.8657, test_f1: 0.5554
 epoch: 82, train_loss: 0.2373, test_loss: 2.7830, test_f1: 0.5935
 epoch: 83, train_loss: 0.2221, test_loss: 2.7726, test_f1: 0.5860
 epoch: 84, train_loss: 0.2384, test_loss: 2.9374, test_f1: 0.5897
 epoch: 85, train_loss: 0.2299, test_loss: 2.5659, test_f1: 0.6045
 epoch: 86, train_loss: 0.2263, test_loss: 2.7707, test_f1: 0.6130
 epoch: 87, train_loss: 0.2543, test_loss: 2.5025, test_f1: 0.5988
 epoch: 88, train_loss: 0.2588, test_loss: 2.7414, test_f1: 0.6623
 epoch: 89, train_loss: 0.2426, test_loss: 2.6165, test_f1: 0.6472
 epoch: 90, train_loss: 0.2104, test_loss: 3.2793, test_f1: 0.5876
 epoch: 91, train_loss: 0.2246, test_loss: 3.0779, test_f1: 0.5607
 epoch: 92, train_loss: 0.2306, test_loss: 2.7851, test_f1: 0.6252
 epoch: 93, train_loss: 0.2242, test_loss: 2.8680, test_f1: 0.6237
 epoch: 94, train_loss: 0.2170, test_loss: 2.7988, test_f1: 0.6036
 epoch: 95, train_loss: 0.2178, test_loss: 3.0260, test_f1: 0.6306
 epoch: 96, train_loss: 0.2031, test_loss: 2.6222, test_f1: 0.6515
 epoch: 97, train_loss: 0.1935, test_loss: 2.5292, test_f1: 0.6581
 epoch: 98, train_loss: 0.1980, test_loss: 3.0116, test_f1: 0.6490
 epoch: 99, train_loss: 0.2108, test_loss: 3.5165, test_f1: 0.6215
##################ITERATION #2 ****************************************
 epoch: 0, train_loss: 1.2059, test_loss: 1.2725, test_f1: 0.4577
 epoch: 1, train_loss: 1.0490, test_loss: 1.2205, test_f1: 0.4776
 epoch: 2, train_loss: 0.9904, test_loss: 1.1796, test_f1: 0.5185
 epoch: 3, train_loss: 0.9529, test_loss: 1.1974, test_f1: 0.5264
 epoch: 4, train_loss: 0.9133, test_loss: 1.1968, test_f1: 0.5421
 epoch: 5, train_loss: 0.8872, test_loss: 1.1338, test_f1: 0.4921
 epoch: 6, train_loss: 0.8766, test_loss: 1.1346, test_f1: 0.5735
 epoch: 7, train_loss: 0.8470, test_loss: 1.0456, test_f1: 0.5815
 epoch: 8, train_loss: 0.8143, test_loss: 1.2028, test_f1: 0.5207
 epoch: 9, train_loss: 0.8122, test_loss: 1.1783, test_f1: 0.5978
 epoch: 10, train_loss: 0.8268, test_loss: 1.1647, test_f1: 0.5282
 epoch: 11, train_loss: 0.8061, test_loss: 1.1551, test_f1: 0.5699
 epoch: 12, train_loss: 0.7598, test_loss: 1.2441, test_f1: 0.6194
 epoch: 13, train_loss: 0.7564, test_loss: 1.1807, test_f1: 0.5790
 epoch: 14, train_loss: 0.7434, test_loss: 1.0764, test_f1: 0.5801
 epoch: 15, train_loss: 0.7500, test_loss: 1.1776, test_f1: 0.5881
 epoch: 16, train_loss: 0.7650, test_loss: 1.2690, test_f1: 0.5717
 epoch: 17, train_loss: 0.7379, test_loss: 1.2834, test_f1: 0.5763
 epoch: 18, train_loss: 0.6803, test_loss: 1.2186, test_f1: 0.6207
 epoch: 19, train_loss: 0.7638, test_loss: 1.2331, test_f1: 0.5981
 epoch: 20, train_loss: 0.7220, test_loss: 1.3389, test_f1: 0.6264
 epoch: 21, train_loss: 0.6900, test_loss: 1.2247, test_f1: 0.6163
 epoch: 22, train_loss: 0.6345, test_loss: 1.5754, test_f1: 0.5719
 epoch: 23, train_loss: 0.6554, test_loss: 1.6065, test_f1: 0.5301
 epoch: 24, train_loss: 0.6574, test_loss: 1.9410, test_f1: 0.5196
 epoch: 25, train_loss: 0.6342, test_loss: 1.5229, test_f1: 0.5622
 epoch: 26, train_loss: 0.5938, test_loss: 1.3807, test_f1: 0.5770
 epoch: 27, train_loss: 0.6250, test_loss: 1.5400, test_f1: 0.5958
 epoch: 28, train_loss: 0.5863, test_loss: 1.6631, test_f1: 0.5624
 epoch: 29, train_loss: 0.5496, test_loss: 1.5325, test_f1: 0.6177
 epoch: 30, train_loss: 0.5847, test_loss: 1.4984, test_f1: 0.5668
 epoch: 31, train_loss: 0.5651, test_loss: 1.4398, test_f1: 0.6114
 epoch: 32, train_loss: 0.5502, test_loss: 1.6313, test_f1: 0.5492
 epoch: 33, train_loss: 0.5433, test_loss: 1.5661, test_f1: 0.5439
 epoch: 34, train_loss: 0.5542, test_loss: 2.2114, test_f1: 0.4698
 epoch: 35, train_loss: 0.5554, test_loss: 1.6265, test_f1: 0.5700
 epoch: 36, train_loss: 0.5345, test_loss: 1.5618, test_f1: 0.5790
 epoch: 37, train_loss: 0.5202, test_loss: 1.7119, test_f1: 0.5957
 epoch: 38, train_loss: 0.4788, test_loss: 1.9412, test_f1: 0.5663
 epoch: 39, train_loss: 0.5165, test_loss: 1.7827, test_f1: 0.5756
 epoch: 40, train_loss: 0.5304, test_loss: 1.8099, test_f1: 0.5517
 epoch: 41, train_loss: 0.4887, test_loss: 1.7086, test_f1: 0.5835
 epoch: 42, train_loss: 0.4818, test_loss: 1.7177, test_f1: 0.6186
 epoch: 43, train_loss: 0.4735, test_loss: 1.7322, test_f1: 0.6017
 epoch: 44, train_loss: 0.4650, test_loss: 1.8244, test_f1: 0.5855
 epoch: 45, train_loss: 0.4707, test_loss: 2.0252, test_f1: 0.5839
 epoch: 46, train_loss: 0.4482, test_loss: 2.3565, test_f1: 0.5500
 epoch: 47, train_loss: 0.4716, test_loss: 1.9332, test_f1: 0.5540
 epoch: 48, train_loss: 0.4363, test_loss: 1.9934, test_f1: 0.5863
 epoch: 49, train_loss: 0.4586, test_loss: 1.7910, test_f1: 0.5580
 epoch: 50, train_loss: 0.4428, test_loss: 1.8100, test_f1: 0.5596
 epoch: 51, train_loss: 0.3885, test_loss: 1.8628, test_f1: 0.5735
 epoch: 52, train_loss: 0.3757, test_loss: 1.8648, test_f1: 0.5505
 epoch: 53, train_loss: 0.3623, test_loss: 1.9656, test_f1: 0.5465
 epoch: 54, train_loss: 0.3547, test_loss: 2.0057, test_f1: 0.5487
 epoch: 55, train_loss: 0.3405, test_loss: 1.9159, test_f1: 0.5654
 epoch: 56, train_loss: 0.3635, test_loss: 1.9718, test_f1: 0.5727
 epoch: 57, train_loss: 0.3421, test_loss: 1.9818, test_f1: 0.6266
 epoch: 58, train_loss: 0.3112, test_loss: 2.1020, test_f1: 0.5451
 epoch: 59, train_loss: 0.3062, test_loss: 2.2307, test_f1: 0.5742
 epoch: 60, train_loss: 0.3096, test_loss: 2.5047, test_f1: 0.5456
 epoch: 61, train_loss: 0.3381, test_loss: 2.1857, test_f1: 0.5801
 epoch: 62, train_loss: 0.3199, test_loss: 2.4742, test_f1: 0.5370
 epoch: 63, train_loss: 0.3273, test_loss: 2.0262, test_f1: 0.6200
 epoch: 64, train_loss: 0.2978, test_loss: 2.1818, test_f1: 0.5948
 epoch: 65, train_loss: 0.2915, test_loss: 2.1661, test_f1: 0.5494
 epoch: 66, train_loss: 0.3047, test_loss: 2.3737, test_f1: 0.5911
 epoch: 67, train_loss: 0.3055, test_loss: 2.3755, test_f1: 0.5867
 epoch: 68, train_loss: 0.2707, test_loss: 2.6102, test_f1: 0.5439
 epoch: 69, train_loss: 0.3003, test_loss: 2.4345, test_f1: 0.5785
 epoch: 70, train_loss: 0.2613, test_loss: 2.5517, test_f1: 0.5656
 epoch: 71, train_loss: 0.2835, test_loss: 2.3186, test_f1: 0.5818
 epoch: 72, train_loss: 0.2842, test_loss: 2.4487, test_f1: 0.5550
 epoch: 73, train_loss: 0.2615, test_loss: 2.4815, test_f1: 0.6026
 epoch: 74, train_loss: 0.2922, test_loss: 2.5527, test_f1: 0.5578
 epoch: 75, train_loss: 0.2957, test_loss: 2.8383, test_f1: 0.5496
 epoch: 76, train_loss: 0.2599, test_loss: 2.5933, test_f1: 0.5897
 epoch: 77, train_loss: 0.2746, test_loss: 2.5961, test_f1: 0.5436
 epoch: 78, train_loss: 0.2732, test_loss: 2.5959, test_f1: 0.5854
 epoch: 79, train_loss: 0.2577, test_loss: 2.2987, test_f1: 0.5790
 epoch: 80, train_loss: 0.2498, test_loss: 2.3809, test_f1: 0.5977
 epoch: 81, train_loss: 0.2347, test_loss: 2.1592, test_f1: 0.6123
 epoch: 82, train_loss: 0.2617, test_loss: 2.3000, test_f1: 0.6077
 epoch: 83, train_loss: 0.2337, test_loss: 2.4569, test_f1: 0.5757
 epoch: 84, train_loss: 0.2579, test_loss: 2.6601, test_f1: 0.5758
 epoch: 85, train_loss: 0.2341, test_loss: 2.6522, test_f1: 0.5989
 epoch: 86, train_loss: 0.2703, test_loss: 2.8298, test_f1: 0.5590
 epoch: 87, train_loss: 0.2399, test_loss: 2.8040, test_f1: 0.5449
 epoch: 88, train_loss: 0.2520, test_loss: 2.7593, test_f1: 0.5722
 epoch: 89, train_loss: 0.2430, test_loss: 2.7201, test_f1: 0.5458
 epoch: 90, train_loss: 0.2343, test_loss: 2.6350, test_f1: 0.5702
 epoch: 91, train_loss: 0.2229, test_loss: 2.4470, test_f1: 0.6102
 epoch: 92, train_loss: 0.2026, test_loss: 2.6962, test_f1: 0.6170
 epoch: 93, train_loss: 0.2385, test_loss: 2.7374, test_f1: 0.6039
 epoch: 94, train_loss: 0.2241, test_loss: 2.6500, test_f1: 0.5853
 epoch: 95, train_loss: 0.2333, test_loss: 2.6311, test_f1: 0.5975
 epoch: 96, train_loss: 0.2085, test_loss: 2.5212, test_f1: 0.6488
 epoch: 97, train_loss: 0.2333, test_loss: 2.3147, test_f1: 0.5966
 epoch: 98, train_loss: 0.2226, test_loss: 2.7855, test_f1: 0.5543
 epoch: 99, train_loss: 0.2298, test_loss: 2.8596, test_f1: 0.5670
##################ITERATION #3 ****************************************
 epoch: 0, train_loss: 1.2298, test_loss: 1.3142, test_f1: 0.4481
 epoch: 1, train_loss: 1.0859, test_loss: 1.1616, test_f1: 0.5114
 epoch: 2, train_loss: 1.0077, test_loss: 1.1450, test_f1: 0.5156
 epoch: 3, train_loss: 0.9860, test_loss: 1.1403, test_f1: 0.5592
 epoch: 4, train_loss: 0.9171, test_loss: 1.1490, test_f1: 0.5339
 epoch: 5, train_loss: 0.8938, test_loss: 1.2429, test_f1: 0.5016
 epoch: 6, train_loss: 0.8979, test_loss: 1.1729, test_f1: 0.5380
 epoch: 7, train_loss: 0.8521, test_loss: 1.0800, test_f1: 0.6013
 epoch: 8, train_loss: 0.8432, test_loss: 1.0121, test_f1: 0.6195
 epoch: 9, train_loss: 0.8095, test_loss: 1.1453, test_f1: 0.6019
 epoch: 10, train_loss: 0.8089, test_loss: 1.0549, test_f1: 0.6088
 epoch: 11, train_loss: 0.7836, test_loss: 1.1110, test_f1: 0.5651
 epoch: 12, train_loss: 0.7888, test_loss: 1.0346, test_f1: 0.5785
 epoch: 13, train_loss: 0.7250, test_loss: 1.3345, test_f1: 0.4967
 epoch: 14, train_loss: 0.7707, test_loss: 1.0448, test_f1: 0.6062
 epoch: 15, train_loss: 0.7550, test_loss: 1.0989, test_f1: 0.6264
 epoch: 16, train_loss: 0.6994, test_loss: 1.0635, test_f1: 0.6126
 epoch: 17, train_loss: 0.7054, test_loss: 1.0316, test_f1: 0.6532
 epoch: 18, train_loss: 0.6958, test_loss: 1.1996, test_f1: 0.6115
 epoch: 19, train_loss: 0.6722, test_loss: 1.0972, test_f1: 0.6439
 epoch: 20, train_loss: 0.6612, test_loss: 1.2575, test_f1: 0.6179
 epoch: 21, train_loss: 0.6598, test_loss: 1.4128, test_f1: 0.5691
 epoch: 22, train_loss: 0.6570, test_loss: 1.4040, test_f1: 0.5587
 epoch: 23, train_loss: 0.6411, test_loss: 1.2414, test_f1: 0.5955
 epoch: 24, train_loss: 0.6147, test_loss: 1.1557, test_f1: 0.6030
 epoch: 25, train_loss: 0.6295, test_loss: 1.2048, test_f1: 0.6203
 epoch: 26, train_loss: 0.5871, test_loss: 1.1380, test_f1: 0.6424
 epoch: 27, train_loss: 0.5837, test_loss: 1.3391, test_f1: 0.6253
 epoch: 28, train_loss: 0.5689, test_loss: 1.3118, test_f1: 0.5942
 epoch: 29, train_loss: 0.6305, test_loss: 1.2628, test_f1: 0.5783
 epoch: 30, train_loss: 0.5926, test_loss: 1.2516, test_f1: 0.6050
 epoch: 31, train_loss: 0.5550, test_loss: 1.2122, test_f1: 0.6079
 epoch: 32, train_loss: 0.5300, test_loss: 1.3490, test_f1: 0.5706
 epoch: 33, train_loss: 0.5279, test_loss: 1.4650, test_f1: 0.5659
 epoch: 34, train_loss: 0.5270, test_loss: 1.2962, test_f1: 0.6143
 epoch: 35, train_loss: 0.5285, test_loss: 1.4290, test_f1: 0.6352
 epoch: 36, train_loss: 0.5321, test_loss: 1.4172, test_f1: 0.6123
 epoch: 37, train_loss: 0.4947, test_loss: 1.4300, test_f1: 0.6145
 epoch: 38, train_loss: 0.4833, test_loss: 1.3857, test_f1: 0.6209
 epoch: 39, train_loss: 0.5037, test_loss: 1.2710, test_f1: 0.6400
 epoch: 40, train_loss: 0.4763, test_loss: 1.3580, test_f1: 0.6390
 epoch: 41, train_loss: 0.4684, test_loss: 1.5494, test_f1: 0.5793
 epoch: 42, train_loss: 0.4887, test_loss: 1.4510, test_f1: 0.5965
 epoch: 43, train_loss: 0.4639, test_loss: 1.5958, test_f1: 0.6387
 epoch: 44, train_loss: 0.4458, test_loss: 1.6719, test_f1: 0.5720
 epoch: 45, train_loss: 0.4914, test_loss: 1.4068, test_f1: 0.5931
 epoch: 46, train_loss: 0.4419, test_loss: 1.5956, test_f1: 0.5641
 epoch: 47, train_loss: 0.4803, test_loss: 1.5259, test_f1: 0.5859
 epoch: 48, train_loss: 0.4568, test_loss: 1.6102, test_f1: 0.5939
 epoch: 49, train_loss: 0.4313, test_loss: 1.6566, test_f1: 0.6036
 epoch: 50, train_loss: 0.4150, test_loss: 1.6654, test_f1: 0.5798
 epoch: 51, train_loss: 0.3862, test_loss: 1.7676, test_f1: 0.5913
 epoch: 52, train_loss: 0.3507, test_loss: 1.7207, test_f1: 0.6121
 epoch: 53, train_loss: 0.3379, test_loss: 1.8738, test_f1: 0.5818
 epoch: 54, train_loss: 0.3271, test_loss: 1.7981, test_f1: 0.5962
 epoch: 55, train_loss: 0.3172, test_loss: 1.9209, test_f1: 0.5811
 epoch: 56, train_loss: 0.3048, test_loss: 2.0532, test_f1: 0.6260
 epoch: 57, train_loss: 0.2960, test_loss: 1.9652, test_f1: 0.5817
 epoch: 58, train_loss: 0.2803, test_loss: 1.9691, test_f1: 0.6106
 epoch: 59, train_loss: 0.2920, test_loss: 2.1193, test_f1: 0.5467
 epoch: 60, train_loss: 0.2995, test_loss: 2.0947, test_f1: 0.5987
 epoch: 61, train_loss: 0.3089, test_loss: 2.1424, test_f1: 0.6033
 epoch: 62, train_loss: 0.3045, test_loss: 2.3671, test_f1: 0.5734
 epoch: 63, train_loss: 0.2684, test_loss: 2.1736, test_f1: 0.5874
 epoch: 64, train_loss: 0.2657, test_loss: 2.3812, test_f1: 0.5951
 epoch: 65, train_loss: 0.2450, test_loss: 2.4476, test_f1: 0.6005
 epoch: 66, train_loss: 0.2807, test_loss: 2.0791, test_f1: 0.5915
 epoch: 67, train_loss: 0.2768, test_loss: 2.1529, test_f1: 0.6014
 epoch: 68, train_loss: 0.2751, test_loss: 2.2154, test_f1: 0.5996
 epoch: 69, train_loss: 0.2574, test_loss: 2.1650, test_f1: 0.5879
 epoch: 70, train_loss: 0.2787, test_loss: 2.1128, test_f1: 0.5991
 epoch: 71, train_loss: 0.2536, test_loss: 2.2891, test_f1: 0.6154
 epoch: 72, train_loss: 0.2739, test_loss: 2.4636, test_f1: 0.5564
 epoch: 73, train_loss: 0.2637, test_loss: 2.3664, test_f1: 0.5896
 epoch: 74, train_loss: 0.2773, test_loss: 2.1554, test_f1: 0.6027
 epoch: 75, train_loss: 0.2480, test_loss: 2.3477, test_f1: 0.6072
 epoch: 76, train_loss: 0.2489, test_loss: 2.6175, test_f1: 0.5391
 epoch: 77, train_loss: 0.2134, test_loss: 2.6735, test_f1: 0.5544
 epoch: 78, train_loss: 0.2303, test_loss: 2.5938, test_f1: 0.5586
 epoch: 79, train_loss: 0.2471, test_loss: 2.5691, test_f1: 0.5930
 epoch: 80, train_loss: 0.2275, test_loss: 2.5428, test_f1: 0.5810
 epoch: 81, train_loss: 0.2235, test_loss: 2.5887, test_f1: 0.6114
 epoch: 82, train_loss: 0.2415, test_loss: 2.4109, test_f1: 0.5882
 epoch: 83, train_loss: 0.2109, test_loss: 2.4033, test_f1: 0.6070
 epoch: 84, train_loss: 0.2171, test_loss: 2.6625, test_f1: 0.5878
 epoch: 85, train_loss: 0.2294, test_loss: 2.5916, test_f1: 0.5983
 epoch: 86, train_loss: 0.2128, test_loss: 2.4299, test_f1: 0.5723
 epoch: 87, train_loss: 0.2466, test_loss: 2.8563, test_f1: 0.6099
 epoch: 88, train_loss: 0.2263, test_loss: 2.7652, test_f1: 0.6192
 epoch: 89, train_loss: 0.2290, test_loss: 2.7117, test_f1: 0.6174
 epoch: 90, train_loss: 0.2035, test_loss: 2.8103, test_f1: 0.6034
 epoch: 91, train_loss: 0.2397, test_loss: 2.7166, test_f1: 0.6016
 epoch: 92, train_loss: 0.2417, test_loss: 2.3366, test_f1: 0.6010
 epoch: 93, train_loss: 0.2124, test_loss: 2.5576, test_f1: 0.6090
 epoch: 94, train_loss: 0.2155, test_loss: 2.3755, test_f1: 0.5758
 epoch: 95, train_loss: 0.2127, test_loss: 2.4732, test_f1: 0.6089
 epoch: 96, train_loss: 0.2058, test_loss: 2.7485, test_f1: 0.5511
 epoch: 97, train_loss: 0.1891, test_loss: 2.6848, test_f1: 0.5995
 epoch: 98, train_loss: 0.1846, test_loss: 2.7264, test_f1: 0.5865
 epoch: 99, train_loss: 0.2042, test_loss: 2.5064, test_f1: 0.6038
##################ITERATION #4 ****************************************
 epoch: 0, train_loss: 1.2481, test_loss: 1.3985, test_f1: 0.2392
 epoch: 1, train_loss: 1.0802, test_loss: 1.1728, test_f1: 0.5368
 epoch: 2, train_loss: 1.0445, test_loss: 1.1356, test_f1: 0.4896
 epoch: 3, train_loss: 1.0003, test_loss: 1.1284, test_f1: 0.5635
 epoch: 4, train_loss: 0.9335, test_loss: 1.2117, test_f1: 0.4929
 epoch: 5, train_loss: 0.9134, test_loss: 1.1913, test_f1: 0.5522
 epoch: 6, train_loss: 0.8827, test_loss: 1.1996, test_f1: 0.5628
 epoch: 7, train_loss: 0.8718, test_loss: 1.1930, test_f1: 0.5201
 epoch: 8, train_loss: 0.8620, test_loss: 1.1100, test_f1: 0.6145
 epoch: 9, train_loss: 0.8438, test_loss: 1.3019, test_f1: 0.5610
 epoch: 10, train_loss: 0.8181, test_loss: 1.4856, test_f1: 0.4389
 epoch: 11, train_loss: 0.8206, test_loss: 1.2744, test_f1: 0.5496
 epoch: 12, train_loss: 0.7887, test_loss: 1.2577, test_f1: 0.5430
 epoch: 13, train_loss: 0.7730, test_loss: 1.3366, test_f1: 0.5630
 epoch: 14, train_loss: 0.7834, test_loss: 1.2347, test_f1: 0.5662
 epoch: 15, train_loss: 0.7589, test_loss: 1.2900, test_f1: 0.5685
 epoch: 16, train_loss: 0.7531, test_loss: 1.3304, test_f1: 0.5909
 epoch: 17, train_loss: 0.7338, test_loss: 1.3008, test_f1: 0.5582
 epoch: 18, train_loss: 0.7148, test_loss: 1.4091, test_f1: 0.5529
 epoch: 19, train_loss: 0.6959, test_loss: 1.3512, test_f1: 0.5799
 epoch: 20, train_loss: 0.7147, test_loss: 1.4675, test_f1: 0.5069
 epoch: 21, train_loss: 0.6867, test_loss: 1.4091, test_f1: 0.5881
 epoch: 22, train_loss: 0.7155, test_loss: 1.3570, test_f1: 0.5832
 epoch: 23, train_loss: 0.6845, test_loss: 1.2478, test_f1: 0.5778
 epoch: 24, train_loss: 0.6749, test_loss: 1.4680, test_f1: 0.5204
 epoch: 25, train_loss: 0.6519, test_loss: 1.3826, test_f1: 0.6004
 epoch: 26, train_loss: 0.6490, test_loss: 1.4503, test_f1: 0.5924
 epoch: 27, train_loss: 0.6200, test_loss: 1.7272, test_f1: 0.5689
 epoch: 28, train_loss: 0.5852, test_loss: 1.8585, test_f1: 0.6051
 epoch: 29, train_loss: 0.6427, test_loss: 1.4767, test_f1: 0.6029
 epoch: 30, train_loss: 0.6331, test_loss: 1.4398, test_f1: 0.6115
 epoch: 31, train_loss: 0.6253, test_loss: 1.6020, test_f1: 0.5411
 epoch: 32, train_loss: 0.5820, test_loss: 1.5263, test_f1: 0.5656
 epoch: 33, train_loss: 0.5644, test_loss: 1.8126, test_f1: 0.6053
 epoch: 34, train_loss: 0.5585, test_loss: 1.5362, test_f1: 0.6101
 epoch: 35, train_loss: 0.5805, test_loss: 1.4759, test_f1: 0.5967
 epoch: 36, train_loss: 0.5726, test_loss: 1.4831, test_f1: 0.5853
 epoch: 37, train_loss: 0.5835, test_loss: 1.6067, test_f1: 0.5444
 epoch: 38, train_loss: 0.5696, test_loss: 1.5123, test_f1: 0.5761
 epoch: 39, train_loss: 0.5411, test_loss: 1.5503, test_f1: 0.5685
 epoch: 40, train_loss: 0.5449, test_loss: 1.4140, test_f1: 0.6435
 epoch: 41, train_loss: 0.5169, test_loss: 1.6689, test_f1: 0.5522
 epoch: 42, train_loss: 0.5099, test_loss: 1.6614, test_f1: 0.5975
 epoch: 43, train_loss: 0.4959, test_loss: 2.0473, test_f1: 0.5251
 epoch: 44, train_loss: 0.5122, test_loss: 1.9203, test_f1: 0.5252
 epoch: 45, train_loss: 0.4838, test_loss: 1.7192, test_f1: 0.5672
 epoch: 46, train_loss: 0.4852, test_loss: 2.2374, test_f1: 0.5056
 epoch: 47, train_loss: 0.4864, test_loss: 1.9100, test_f1: 0.5083
 epoch: 48, train_loss: 0.4608, test_loss: 2.0539, test_f1: 0.5544
 epoch: 49, train_loss: 0.4812, test_loss: 1.8900, test_f1: 0.5761
 epoch: 50, train_loss: 0.4637, test_loss: 1.7645, test_f1: 0.5657
 epoch: 51, train_loss: 0.4282, test_loss: 1.9785, test_f1: 0.5436
 epoch: 52, train_loss: 0.3887, test_loss: 1.8137, test_f1: 0.5692
 epoch: 53, train_loss: 0.3900, test_loss: 1.9471, test_f1: 0.5534
 epoch: 54, train_loss: 0.3865, test_loss: 2.0964, test_f1: 0.5940
 epoch: 55, train_loss: 0.3957, test_loss: 2.4124, test_f1: 0.5207
 epoch: 56, train_loss: 0.3600, test_loss: 2.1224, test_f1: 0.5641
 epoch: 57, train_loss: 0.3580, test_loss: 2.0205, test_f1: 0.5533
 epoch: 58, train_loss: 0.3595, test_loss: 2.0387, test_f1: 0.5690
 epoch: 59, train_loss: 0.3482, test_loss: 2.1854, test_f1: 0.5999
 epoch: 60, train_loss: 0.3397, test_loss: 2.1768, test_f1: 0.5919
 epoch: 61, train_loss: 0.3323, test_loss: 1.9638, test_f1: 0.5815
 epoch: 62, train_loss: 0.3504, test_loss: 2.2876, test_f1: 0.5498
 epoch: 63, train_loss: 0.3230, test_loss: 2.4088, test_f1: 0.5537
 epoch: 64, train_loss: 0.3141, test_loss: 2.3847, test_f1: 0.5435
 epoch: 65, train_loss: 0.3304, test_loss: 2.0707, test_f1: 0.5800
 epoch: 66, train_loss: 0.3409, test_loss: 2.3027, test_f1: 0.5715
 epoch: 67, train_loss: 0.3301, test_loss: 2.1170, test_f1: 0.5840
 epoch: 68, train_loss: 0.3279, test_loss: 2.6480, test_f1: 0.5791
 epoch: 69, train_loss: 0.2874, test_loss: 2.2253, test_f1: 0.5551
 epoch: 70, train_loss: 0.3214, test_loss: 2.3200, test_f1: 0.5486
 epoch: 71, train_loss: 0.2850, test_loss: 2.4906, test_f1: 0.5279
 epoch: 72, train_loss: 0.2854, test_loss: 2.3622, test_f1: 0.5394
 epoch: 73, train_loss: 0.2873, test_loss: 2.4483, test_f1: 0.5829
 epoch: 74, train_loss: 0.3002, test_loss: 2.1370, test_f1: 0.5715
 epoch: 75, train_loss: 0.3086, test_loss: 2.2803, test_f1: 0.5995
 epoch: 76, train_loss: 0.3399, test_loss: 2.7877, test_f1: 0.5821
 epoch: 77, train_loss: 0.2793, test_loss: 2.3256, test_f1: 0.5647
 epoch: 78, train_loss: 0.2910, test_loss: 2.4366, test_f1: 0.5764
 epoch: 79, train_loss: 0.2958, test_loss: 2.4638, test_f1: 0.5780
 epoch: 80, train_loss: 0.2652, test_loss: 2.5240, test_f1: 0.5711
 epoch: 81, train_loss: 0.2741, test_loss: 2.4437, test_f1: 0.5774
 epoch: 82, train_loss: 0.2567, test_loss: 2.4366, test_f1: 0.5508
 epoch: 83, train_loss: 0.2452, test_loss: 2.8018, test_f1: 0.5363
 epoch: 84, train_loss: 0.2591, test_loss: 2.4889, test_f1: 0.6119
 epoch: 85, train_loss: 0.2478, test_loss: 2.5860, test_f1: 0.6008
 epoch: 86, train_loss: 0.2512, test_loss: 2.4192, test_f1: 0.5932
 epoch: 87, train_loss: 0.2426, test_loss: 2.8247, test_f1: 0.5395
 epoch: 88, train_loss: 0.2607, test_loss: 2.4137, test_f1: 0.6135
 epoch: 89, train_loss: 0.2175, test_loss: 2.4119, test_f1: 0.6193
 epoch: 90, train_loss: 0.2578, test_loss: 2.6053, test_f1: 0.5872
 epoch: 91, train_loss: 0.2747, test_loss: 2.5463, test_f1: 0.5873
 epoch: 92, train_loss: 0.2284, test_loss: 2.6541, test_f1: 0.6152
 epoch: 93, train_loss: 0.2224, test_loss: 2.6906, test_f1: 0.6018
 epoch: 94, train_loss: 0.2380, test_loss: 2.8027, test_f1: 0.5984
 epoch: 95, train_loss: 0.2437, test_loss: 2.4144, test_f1: 0.5429
 epoch: 96, train_loss: 0.2371, test_loss: 2.3443, test_f1: 0.6124
 epoch: 97, train_loss: 0.2505, test_loss: 2.4106, test_f1: 0.5907
 epoch: 98, train_loss: 0.2552, test_loss: 2.2938, test_f1: 0.5777
 epoch: 99, train_loss: 0.2463, test_loss: 2.5364, test_f1: 0.5697
##################ITERATION #5 ****************************************
 epoch: 0, train_loss: 1.2123, test_loss: 1.2663, test_f1: 0.4648
 epoch: 1, train_loss: 1.0708, test_loss: 1.2744, test_f1: 0.5308
 epoch: 2, train_loss: 0.9751, test_loss: 1.1053, test_f1: 0.5980
 epoch: 3, train_loss: 0.9160, test_loss: 1.1972, test_f1: 0.5417
 epoch: 4, train_loss: 0.9287, test_loss: 1.1104, test_f1: 0.6112
 epoch: 5, train_loss: 0.8874, test_loss: 1.1835, test_f1: 0.5443
 epoch: 6, train_loss: 0.8549, test_loss: 1.1475, test_f1: 0.4553
 epoch: 7, train_loss: 0.8694, test_loss: 1.1661, test_f1: 0.5497
 epoch: 8, train_loss: 0.8202, test_loss: 1.0800, test_f1: 0.5180
 epoch: 9, train_loss: 0.7912, test_loss: 1.2922, test_f1: 0.5121
 epoch: 10, train_loss: 0.7982, test_loss: 1.2655, test_f1: 0.5696
 epoch: 11, train_loss: 0.7574, test_loss: 1.2122, test_f1: 0.5552
 epoch: 12, train_loss: 0.7407, test_loss: 1.2028, test_f1: 0.5812
 epoch: 13, train_loss: 0.7558, test_loss: 1.2405, test_f1: 0.5646
 epoch: 14, train_loss: 0.7530, test_loss: 1.3932, test_f1: 0.5570
 epoch: 15, train_loss: 0.7340, test_loss: 1.2165, test_f1: 0.5985
 epoch: 16, train_loss: 0.7155, test_loss: 1.5674, test_f1: 0.5613
 epoch: 17, train_loss: 0.7220, test_loss: 1.2200, test_f1: 0.6051
 epoch: 18, train_loss: 0.6785, test_loss: 1.1960, test_f1: 0.6310
 epoch: 19, train_loss: 0.6654, test_loss: 1.3615, test_f1: 0.5721
 epoch: 20, train_loss: 0.6451, test_loss: 1.3651, test_f1: 0.5898
 epoch: 21, train_loss: 0.6213, test_loss: 1.4541, test_f1: 0.5938
 epoch: 22, train_loss: 0.6262, test_loss: 1.2802, test_f1: 0.6168
 epoch: 23, train_loss: 0.6238, test_loss: 1.4968, test_f1: 0.5723
 epoch: 24, train_loss: 0.6489, test_loss: 1.3816, test_f1: 0.6124
 epoch: 25, train_loss: 0.5927, test_loss: 1.4148, test_f1: 0.5859
 epoch: 26, train_loss: 0.6041, test_loss: 1.4023, test_f1: 0.6031
 epoch: 27, train_loss: 0.5814, test_loss: 1.3044, test_f1: 0.6409
 epoch: 28, train_loss: 0.5592, test_loss: 1.5339, test_f1: 0.6054
 epoch: 29, train_loss: 0.5493, test_loss: 1.5564, test_f1: 0.6194
 epoch: 30, train_loss: 0.5612, test_loss: 1.5235, test_f1: 0.6219
 epoch: 31, train_loss: 0.5552, test_loss: 1.4371, test_f1: 0.5874
 epoch: 32, train_loss: 0.5113, test_loss: 1.5500, test_f1: 0.5850
 epoch: 33, train_loss: 0.5109, test_loss: 1.4549, test_f1: 0.6158
 epoch: 34, train_loss: 0.5473, test_loss: 1.3809, test_f1: 0.6378
 epoch: 35, train_loss: 0.4959, test_loss: 1.4348, test_f1: 0.6069
 epoch: 36, train_loss: 0.5077, test_loss: 1.4857, test_f1: 0.5903
 epoch: 37, train_loss: 0.4963, test_loss: 1.5662, test_f1: 0.5659
 epoch: 38, train_loss: 0.5046, test_loss: 1.6374, test_f1: 0.5589
 epoch: 39, train_loss: 0.5082, test_loss: 1.7792, test_f1: 0.5566
 epoch: 40, train_loss: 0.4846, test_loss: 1.5224, test_f1: 0.6368
 epoch: 41, train_loss: 0.4687, test_loss: 1.8240, test_f1: 0.5623
 epoch: 42, train_loss: 0.4575, test_loss: 1.6153, test_f1: 0.6222
 epoch: 43, train_loss: 0.4633, test_loss: 1.6688, test_f1: 0.5868
 epoch: 44, train_loss: 0.4720, test_loss: 1.9135, test_f1: 0.5903
 epoch: 45, train_loss: 0.4890, test_loss: 1.9684, test_f1: 0.5798
 epoch: 46, train_loss: 0.4759, test_loss: 2.5500, test_f1: 0.5647
 epoch: 47, train_loss: 0.4612, test_loss: 1.6387, test_f1: 0.5980
 epoch: 48, train_loss: 0.4400, test_loss: 1.7127, test_f1: 0.6073
 epoch: 49, train_loss: 0.4423, test_loss: 1.6855, test_f1: 0.5969
 epoch: 50, train_loss: 0.4466, test_loss: 1.9033, test_f1: 0.6029
 epoch: 51, train_loss: 0.3819, test_loss: 1.9279, test_f1: 0.5847
 epoch: 52, train_loss: 0.3415, test_loss: 2.1710, test_f1: 0.5837
 epoch: 53, train_loss: 0.3379, test_loss: 2.1853, test_f1: 0.5980
 epoch: 54, train_loss: 0.3728, test_loss: 1.9759, test_f1: 0.5935
 epoch: 55, train_loss: 0.3266, test_loss: 2.0867, test_f1: 0.6061
 epoch: 56, train_loss: 0.3107, test_loss: 2.0155, test_f1: 0.6134
 epoch: 57, train_loss: 0.3340, test_loss: 2.0197, test_f1: 0.6144
 epoch: 58, train_loss: 0.3055, test_loss: 1.9801, test_f1: 0.6414
 epoch: 59, train_loss: 0.2933, test_loss: 2.2117, test_f1: 0.6252
 epoch: 60, train_loss: 0.2943, test_loss: 2.1288, test_f1: 0.6063
 epoch: 61, train_loss: 0.3436, test_loss: 2.1821, test_f1: 0.6124
 epoch: 62, train_loss: 0.2953, test_loss: 2.1118, test_f1: 0.6271
 epoch: 63, train_loss: 0.3059, test_loss: 2.4101, test_f1: 0.5913
 epoch: 64, train_loss: 0.2623, test_loss: 2.1282, test_f1: 0.6071
 epoch: 65, train_loss: 0.2824, test_loss: 2.6774, test_f1: 0.6048
 epoch: 66, train_loss: 0.2850, test_loss: 2.5403, test_f1: 0.5968
 epoch: 67, train_loss: 0.2622, test_loss: 2.3102, test_f1: 0.5982
 epoch: 68, train_loss: 0.2769, test_loss: 2.2202, test_f1: 0.6224
 epoch: 69, train_loss: 0.2508, test_loss: 2.6065, test_f1: 0.5814
 epoch: 70, train_loss: 0.2670, test_loss: 2.5234, test_f1: 0.5664
 epoch: 71, train_loss: 0.2467, test_loss: 2.7584, test_f1: 0.6029
 epoch: 72, train_loss: 0.2293, test_loss: 2.5768, test_f1: 0.6077
 epoch: 73, train_loss: 0.2558, test_loss: 2.4923, test_f1: 0.5986
 epoch: 74, train_loss: 0.2687, test_loss: 3.0658, test_f1: 0.6263
 epoch: 75, train_loss: 0.2666, test_loss: 3.1331, test_f1: 0.5890
 epoch: 76, train_loss: 0.2405, test_loss: 2.6037, test_f1: 0.5971
 epoch: 77, train_loss: 0.2489, test_loss: 2.6042, test_f1: 0.5651
 epoch: 78, train_loss: 0.2475, test_loss: 2.5245, test_f1: 0.5827
 epoch: 79, train_loss: 0.2516, test_loss: 2.4704, test_f1: 0.5750
 epoch: 80, train_loss: 0.2445, test_loss: 2.4369, test_f1: 0.5856
 epoch: 81, train_loss: 0.2327, test_loss: 2.3759, test_f1: 0.6264
 epoch: 82, train_loss: 0.2285, test_loss: 2.9014, test_f1: 0.6254
 epoch: 83, train_loss: 0.2541, test_loss: 2.6527, test_f1: 0.6042
 epoch: 84, train_loss: 0.2464, test_loss: 2.6150, test_f1: 0.5811
 epoch: 85, train_loss: 0.2370, test_loss: 2.3030, test_f1: 0.6137
 epoch: 86, train_loss: 0.2279, test_loss: 2.5507, test_f1: 0.6206
 epoch: 87, train_loss: 0.2232, test_loss: 2.6821, test_f1: 0.6163
 epoch: 88, train_loss: 0.2108, test_loss: 3.0956, test_f1: 0.5668
 epoch: 89, train_loss: 0.2357, test_loss: 2.6672, test_f1: 0.6021
 epoch: 90, train_loss: 0.2075, test_loss: 2.4710, test_f1: 0.6031
 epoch: 91, train_loss: 0.2373, test_loss: 2.6148, test_f1: 0.6248
 epoch: 92, train_loss: 0.2079, test_loss: 2.5648, test_f1: 0.6183
 epoch: 93, train_loss: 0.2388, test_loss: 2.4299, test_f1: 0.6030
 epoch: 94, train_loss: 0.1959, test_loss: 2.7747, test_f1: 0.5789
 epoch: 95, train_loss: 0.2182, test_loss: 2.5304, test_f1: 0.6018
 epoch: 96, train_loss: 0.1935, test_loss: 2.6803, test_f1: 0.5904
 epoch: 97, train_loss: 0.2063, test_loss: 2.6474, test_f1: 0.6464
 epoch: 98, train_loss: 0.2339, test_loss: 2.5981, test_f1: 0.5984
 epoch: 99, train_loss: 0.2194, test_loss: 2.4738, test_f1: 0.6348
##################ITERATION #6 ****************************************
 epoch: 0, train_loss: 1.2691, test_loss: 1.4220, test_f1: 0.3815
 epoch: 1, train_loss: 1.0883, test_loss: 1.2281, test_f1: 0.4961
 epoch: 2, train_loss: 1.0256, test_loss: 1.2879, test_f1: 0.4349
 epoch: 3, train_loss: 0.9751, test_loss: 1.2464, test_f1: 0.5484
 epoch: 4, train_loss: 0.9540, test_loss: 1.0752, test_f1: 0.5447
 epoch: 5, train_loss: 0.9020, test_loss: 1.1207, test_f1: 0.5890
 epoch: 6, train_loss: 0.8918, test_loss: 1.1557, test_f1: 0.5990
 epoch: 7, train_loss: 0.9059, test_loss: 1.1219, test_f1: 0.5349
 epoch: 8, train_loss: 0.8874, test_loss: 1.1116, test_f1: 0.5756
 epoch: 9, train_loss: 0.8505, test_loss: 1.1728, test_f1: 0.5695
 epoch: 10, train_loss: 0.8342, test_loss: 1.1919, test_f1: 0.5556
 epoch: 11, train_loss: 0.8122, test_loss: 1.1184, test_f1: 0.5789
 epoch: 12, train_loss: 0.7882, test_loss: 1.2317, test_f1: 0.5491
 epoch: 13, train_loss: 0.7793, test_loss: 1.2248, test_f1: 0.5929
 epoch: 14, train_loss: 0.7609, test_loss: 1.4101, test_f1: 0.5410
 epoch: 15, train_loss: 0.7480, test_loss: 1.2172, test_f1: 0.5933
 epoch: 16, train_loss: 0.7491, test_loss: 1.1599, test_f1: 0.5741
 epoch: 17, train_loss: 0.7184, test_loss: 1.3297, test_f1: 0.6048
 epoch: 18, train_loss: 0.7176, test_loss: 1.3392, test_f1: 0.5442
 epoch: 19, train_loss: 0.7429, test_loss: 1.2710, test_f1: 0.6005
 epoch: 20, train_loss: 0.7095, test_loss: 1.4633, test_f1: 0.5443
 epoch: 21, train_loss: 0.7151, test_loss: 1.3157, test_f1: 0.5862
 epoch: 22, train_loss: 0.7080, test_loss: 1.5732, test_f1: 0.5132
 epoch: 23, train_loss: 0.6867, test_loss: 1.4041, test_f1: 0.5757
 epoch: 24, train_loss: 0.6608, test_loss: 1.4588, test_f1: 0.5422
 epoch: 25, train_loss: 0.6677, test_loss: 1.4245, test_f1: 0.5517
 epoch: 26, train_loss: 0.6558, test_loss: 1.4269, test_f1: 0.5674
 epoch: 27, train_loss: 0.6198, test_loss: 1.4101, test_f1: 0.5588
 epoch: 28, train_loss: 0.6259, test_loss: 1.6438, test_f1: 0.5698
 epoch: 29, train_loss: 0.6117, test_loss: 1.8839, test_f1: 0.4978
 epoch: 30, train_loss: 0.6166, test_loss: 1.4242, test_f1: 0.5617
 epoch: 31, train_loss: 0.6167, test_loss: 1.5025, test_f1: 0.5613
 epoch: 32, train_loss: 0.5894, test_loss: 1.7582, test_f1: 0.5546
 epoch: 33, train_loss: 0.5984, test_loss: 1.5674, test_f1: 0.5384
 epoch: 34, train_loss: 0.5757, test_loss: 1.6549, test_f1: 0.5283
 epoch: 35, train_loss: 0.5623, test_loss: 1.8328, test_f1: 0.5843
 epoch: 36, train_loss: 0.5869, test_loss: 1.7109, test_f1: 0.5730
 epoch: 37, train_loss: 0.5677, test_loss: 1.8887, test_f1: 0.5621
 epoch: 38, train_loss: 0.5621, test_loss: 1.7854, test_f1: 0.5402
 epoch: 39, train_loss: 0.5321, test_loss: 1.6634, test_f1: 0.5579
 epoch: 40, train_loss: 0.5330, test_loss: 1.6943, test_f1: 0.5878
 epoch: 41, train_loss: 0.5378, test_loss: 1.7725, test_f1: 0.5901
 epoch: 42, train_loss: 0.5424, test_loss: 1.6609, test_f1: 0.5845
 epoch: 43, train_loss: 0.5155, test_loss: 1.5253, test_f1: 0.6072
 epoch: 44, train_loss: 0.5034, test_loss: 1.8326, test_f1: 0.5361
 epoch: 45, train_loss: 0.4995, test_loss: 1.8804, test_f1: 0.5794
 epoch: 46, train_loss: 0.5366, test_loss: 1.5763, test_f1: 0.5916
 epoch: 47, train_loss: 0.5224, test_loss: 1.8884, test_f1: 0.5228
 epoch: 48, train_loss: 0.5010, test_loss: 1.6191, test_f1: 0.5957
 epoch: 49, train_loss: 0.4723, test_loss: 1.6501, test_f1: 0.5773
 epoch: 50, train_loss: 0.4659, test_loss: 1.8389, test_f1: 0.5495
 epoch: 51, train_loss: 0.4030, test_loss: 1.9426, test_f1: 0.5565
 epoch: 52, train_loss: 0.3775, test_loss: 1.9775, test_f1: 0.5607
 epoch: 53, train_loss: 0.3966, test_loss: 2.0432, test_f1: 0.5854
 epoch: 54, train_loss: 0.3746, test_loss: 2.2365, test_f1: 0.5325
 epoch: 55, train_loss: 0.3553, test_loss: 2.2335, test_f1: 0.5729
 epoch: 56, train_loss: 0.3486, test_loss: 2.2943, test_f1: 0.5780
 epoch: 57, train_loss: 0.3299, test_loss: 2.4594, test_f1: 0.5694
 epoch: 58, train_loss: 0.3325, test_loss: 2.2984, test_f1: 0.5429
 epoch: 59, train_loss: 0.3778, test_loss: 2.3180, test_f1: 0.5849
 epoch: 60, train_loss: 0.3338, test_loss: 2.3291, test_f1: 0.5734
 epoch: 61, train_loss: 0.3594, test_loss: 2.3561, test_f1: 0.5566
 epoch: 62, train_loss: 0.3252, test_loss: 2.4230, test_f1: 0.5588
 epoch: 63, train_loss: 0.3078, test_loss: 2.5443, test_f1: 0.5724
 epoch: 64, train_loss: 0.3152, test_loss: 2.6835, test_f1: 0.5394
 epoch: 65, train_loss: 0.3230, test_loss: 2.4275, test_f1: 0.5795
 epoch: 66, train_loss: 0.3358, test_loss: 2.0343, test_f1: 0.5751
 epoch: 67, train_loss: 0.3403, test_loss: 2.4062, test_f1: 0.5523
 epoch: 68, train_loss: 0.3039, test_loss: 2.4094, test_f1: 0.5739
 epoch: 69, train_loss: 0.2988, test_loss: 2.3880, test_f1: 0.5382
 epoch: 70, train_loss: 0.3011, test_loss: 2.5014, test_f1: 0.5582
 epoch: 71, train_loss: 0.3076, test_loss: 2.5344, test_f1: 0.5691
 epoch: 72, train_loss: 0.2926, test_loss: 2.5003, test_f1: 0.5869
 epoch: 73, train_loss: 0.3143, test_loss: 2.6133, test_f1: 0.5544
 epoch: 74, train_loss: 0.3064, test_loss: 2.5586, test_f1: 0.5604
 epoch: 75, train_loss: 0.2792, test_loss: 2.3827, test_f1: 0.5883
 epoch: 76, train_loss: 0.3036, test_loss: 3.0335, test_f1: 0.5493
 epoch: 77, train_loss: 0.2907, test_loss: 3.0228, test_f1: 0.5496
 epoch: 78, train_loss: 0.2442, test_loss: 2.7993, test_f1: 0.5621
 epoch: 79, train_loss: 0.2866, test_loss: 2.6180, test_f1: 0.5797
 epoch: 80, train_loss: 0.2905, test_loss: 2.6998, test_f1: 0.5636
 epoch: 81, train_loss: 0.2459, test_loss: 2.7676, test_f1: 0.5839
 epoch: 82, train_loss: 0.2704, test_loss: 3.0317, test_f1: 0.5742
 epoch: 83, train_loss: 0.2906, test_loss: 2.8039, test_f1: 0.5555
 epoch: 84, train_loss: 0.2626, test_loss: 2.4725, test_f1: 0.5882
 epoch: 85, train_loss: 0.2662, test_loss: 2.7192, test_f1: 0.5464
 epoch: 86, train_loss: 0.2479, test_loss: 2.7085, test_f1: 0.5676
 epoch: 87, train_loss: 0.2536, test_loss: 2.9325, test_f1: 0.5750
 epoch: 88, train_loss: 0.2505, test_loss: 2.7428, test_f1: 0.5951
 epoch: 89, train_loss: 0.2414, test_loss: 2.7854, test_f1: 0.5985
 epoch: 90, train_loss: 0.2503, test_loss: 3.1612, test_f1: 0.5544
 epoch: 91, train_loss: 0.2536, test_loss: 3.0446, test_f1: 0.5567
 epoch: 92, train_loss: 0.2495, test_loss: 3.1975, test_f1: 0.5890
 epoch: 93, train_loss: 0.2638, test_loss: 2.9578, test_f1: 0.5855
 epoch: 94, train_loss: 0.2567, test_loss: 2.9434, test_f1: 0.5522
 epoch: 95, train_loss: 0.2306, test_loss: 3.0195, test_f1: 0.5904
 epoch: 96, train_loss: 0.2156, test_loss: 2.6854, test_f1: 0.5860
 epoch: 97, train_loss: 0.2425, test_loss: 2.6498, test_f1: 0.5567
 epoch: 98, train_loss: 0.2408, test_loss: 3.3368, test_f1: 0.4936
 epoch: 99, train_loss: 0.2327, test_loss: 2.8433, test_f1: 0.5658
##################ITERATION #7 ****************************************
 epoch: 0, train_loss: 1.2865, test_loss: 1.3105, test_f1: 0.4212
 epoch: 1, train_loss: 1.0572, test_loss: 1.1786, test_f1: 0.5107
 epoch: 2, train_loss: 1.0119, test_loss: 1.2526, test_f1: 0.4637
 epoch: 3, train_loss: 0.9646, test_loss: 1.1529, test_f1: 0.5613
 epoch: 4, train_loss: 0.9493, test_loss: 1.1016, test_f1: 0.5534
 epoch: 5, train_loss: 0.9128, test_loss: 1.0898, test_f1: 0.5966
 epoch: 6, train_loss: 0.8682, test_loss: 1.1338, test_f1: 0.5502
 epoch: 7, train_loss: 0.8756, test_loss: 1.2401, test_f1: 0.5124
 epoch: 8, train_loss: 0.8448, test_loss: 1.1744, test_f1: 0.5582
 epoch: 9, train_loss: 0.8460, test_loss: 1.2828, test_f1: 0.5916
 epoch: 10, train_loss: 0.8256, test_loss: 1.1688, test_f1: 0.5914
 epoch: 11, train_loss: 0.8088, test_loss: 1.0789, test_f1: 0.5971
 epoch: 12, train_loss: 0.7643, test_loss: 1.1774, test_f1: 0.5604
 epoch: 13, train_loss: 0.7881, test_loss: 1.2362, test_f1: 0.6313
 epoch: 14, train_loss: 0.7781, test_loss: 1.3129, test_f1: 0.5720
 epoch: 15, train_loss: 0.7636, test_loss: 1.2403, test_f1: 0.5727
 epoch: 16, train_loss: 0.7402, test_loss: 1.3216, test_f1: 0.5705
 epoch: 17, train_loss: 0.7195, test_loss: 1.4038, test_f1: 0.5836
 epoch: 18, train_loss: 0.7384, test_loss: 1.2841, test_f1: 0.5478
 epoch: 19, train_loss: 0.6915, test_loss: 1.1702, test_f1: 0.5938
 epoch: 20, train_loss: 0.6819, test_loss: 1.3287, test_f1: 0.5325
 epoch: 21, train_loss: 0.6734, test_loss: 1.4145, test_f1: 0.5570
 epoch: 22, train_loss: 0.6392, test_loss: 1.3607, test_f1: 0.5557
 epoch: 23, train_loss: 0.6687, test_loss: 1.3735, test_f1: 0.5858
 epoch: 24, train_loss: 0.6599, test_loss: 1.4266, test_f1: 0.5406
 epoch: 25, train_loss: 0.6232, test_loss: 1.3476, test_f1: 0.5623
 epoch: 26, train_loss: 0.6199, test_loss: 1.2989, test_f1: 0.5864
 epoch: 27, train_loss: 0.6016, test_loss: 1.3503, test_f1: 0.5975
 epoch: 28, train_loss: 0.6154, test_loss: 1.5482, test_f1: 0.5395
 epoch: 29, train_loss: 0.6277, test_loss: 1.4703, test_f1: 0.5859
 epoch: 30, train_loss: 0.5600, test_loss: 1.3266, test_f1: 0.5879
 epoch: 31, train_loss: 0.5984, test_loss: 1.5356, test_f1: 0.5648
 epoch: 32, train_loss: 0.5820, test_loss: 1.3744, test_f1: 0.5688
 epoch: 33, train_loss: 0.5586, test_loss: 1.4830, test_f1: 0.5974
 epoch: 34, train_loss: 0.5393, test_loss: 1.3998, test_f1: 0.5801
 epoch: 35, train_loss: 0.5711, test_loss: 1.3664, test_f1: 0.5528
 epoch: 36, train_loss: 0.5431, test_loss: 1.6172, test_f1: 0.6005
 epoch: 37, train_loss: 0.5322, test_loss: 1.8182, test_f1: 0.5549
 epoch: 38, train_loss: 0.5735, test_loss: 1.6025, test_f1: 0.6037
 epoch: 39, train_loss: 0.5393, test_loss: 1.7518, test_f1: 0.5739
 epoch: 40, train_loss: 0.5267, test_loss: 1.5920, test_f1: 0.5440
 epoch: 41, train_loss: 0.4741, test_loss: 1.7360, test_f1: 0.5509
 epoch: 42, train_loss: 0.5038, test_loss: 1.7291, test_f1: 0.6210
 epoch: 43, train_loss: 0.5055, test_loss: 1.6851, test_f1: 0.5851
 epoch: 44, train_loss: 0.4750, test_loss: 1.5504, test_f1: 0.5794
 epoch: 45, train_loss: 0.4754, test_loss: 1.5842, test_f1: 0.5701
 epoch: 46, train_loss: 0.4881, test_loss: 1.7147, test_f1: 0.6048
 epoch: 47, train_loss: 0.4837, test_loss: 1.6567, test_f1: 0.5876
 epoch: 48, train_loss: 0.4645, test_loss: 1.9805, test_f1: 0.5604
 epoch: 49, train_loss: 0.4623, test_loss: 1.8936, test_f1: 0.5645
 epoch: 50, train_loss: 0.4554, test_loss: 2.3276, test_f1: 0.5147
 epoch: 51, train_loss: 0.4073, test_loss: 1.7236, test_f1: 0.6109
 epoch: 52, train_loss: 0.3609, test_loss: 1.9378, test_f1: 0.5694
 epoch: 53, train_loss: 0.3533, test_loss: 2.0873, test_f1: 0.5943
 epoch: 54, train_loss: 0.3725, test_loss: 2.2604, test_f1: 0.5467
 epoch: 55, train_loss: 0.3571, test_loss: 1.8612, test_f1: 0.6071
 epoch: 56, train_loss: 0.3479, test_loss: 2.2927, test_f1: 0.5786
 epoch: 57, train_loss: 0.3454, test_loss: 2.3201, test_f1: 0.5449
 epoch: 58, train_loss: 0.3313, test_loss: 2.2866, test_f1: 0.5852
 epoch: 59, train_loss: 0.3330, test_loss: 2.2400, test_f1: 0.5830
 epoch: 60, train_loss: 0.3348, test_loss: 2.2186, test_f1: 0.5696
 epoch: 61, train_loss: 0.3255, test_loss: 2.5443, test_f1: 0.5380
 epoch: 62, train_loss: 0.3187, test_loss: 2.3294, test_f1: 0.5799
 epoch: 63, train_loss: 0.3197, test_loss: 2.4508, test_f1: 0.5894
 epoch: 64, train_loss: 0.3158, test_loss: 2.3580, test_f1: 0.5646
 epoch: 65, train_loss: 0.3087, test_loss: 2.2017, test_f1: 0.5568
 epoch: 66, train_loss: 0.3193, test_loss: 2.4242, test_f1: 0.5680
 epoch: 67, train_loss: 0.2938, test_loss: 2.4137, test_f1: 0.5409
 epoch: 68, train_loss: 0.2968, test_loss: 2.5660, test_f1: 0.6034
 epoch: 69, train_loss: 0.2768, test_loss: 2.7967, test_f1: 0.5680
 epoch: 70, train_loss: 0.3267, test_loss: 2.6931, test_f1: 0.5522
 epoch: 71, train_loss: 0.3211, test_loss: 2.7113, test_f1: 0.5595
 epoch: 72, train_loss: 0.2856, test_loss: 2.4346, test_f1: 0.5737
 epoch: 73, train_loss: 0.3094, test_loss: 2.5906, test_f1: 0.5609
 epoch: 74, train_loss: 0.3001, test_loss: 2.4433, test_f1: 0.5671
 epoch: 75, train_loss: 0.3104, test_loss: 2.7669, test_f1: 0.5848
 epoch: 76, train_loss: 0.2600, test_loss: 2.7969, test_f1: 0.5751
 epoch: 77, train_loss: 0.2581, test_loss: 3.0125, test_f1: 0.5957
 epoch: 78, train_loss: 0.2759, test_loss: 2.1958, test_f1: 0.5861
 epoch: 79, train_loss: 0.2564, test_loss: 2.8643, test_f1: 0.5544
 epoch: 80, train_loss: 0.2754, test_loss: 2.6411, test_f1: 0.5550
 epoch: 81, train_loss: 0.2512, test_loss: 2.9018, test_f1: 0.5539
 epoch: 82, train_loss: 0.2741, test_loss: 3.1610, test_f1: 0.5913
 epoch: 83, train_loss: 0.2475, test_loss: 3.1049, test_f1: 0.5994
 epoch: 84, train_loss: 0.2470, test_loss: 2.9907, test_f1: 0.5635
 epoch: 85, train_loss: 0.2375, test_loss: 3.3029, test_f1: 0.5449
 epoch: 86, train_loss: 0.2459, test_loss: 3.0287, test_f1: 0.5816
 epoch: 87, train_loss: 0.2350, test_loss: 2.7679, test_f1: 0.5780
 epoch: 88, train_loss: 0.2675, test_loss: 3.0884, test_f1: 0.6033
 epoch: 89, train_loss: 0.2527, test_loss: 2.8203, test_f1: 0.5625
 epoch: 90, train_loss: 0.2693, test_loss: 3.3380, test_f1: 0.5328
 epoch: 91, train_loss: 0.2243, test_loss: 2.4747, test_f1: 0.5658
 epoch: 92, train_loss: 0.2502, test_loss: 2.9185, test_f1: 0.5726
 epoch: 93, train_loss: 0.2266, test_loss: 2.6391, test_f1: 0.6041
 epoch: 94, train_loss: 0.2454, test_loss: 3.2109, test_f1: 0.5957
 epoch: 95, train_loss: 0.2379, test_loss: 3.0713, test_f1: 0.5709
 epoch: 96, train_loss: 0.2334, test_loss: 3.8668, test_f1: 0.5208
 epoch: 97, train_loss: 0.2160, test_loss: 3.0091, test_f1: 0.5810
 epoch: 98, train_loss: 0.2170, test_loss: 3.0540, test_f1: 0.5722
 epoch: 99, train_loss: 0.2091, test_loss: 2.9446, test_f1: 0.5850
##################ITERATION #8 ****************************************
 epoch: 0, train_loss: 1.2881, test_loss: 1.2857, test_f1: 0.4604
 epoch: 1, train_loss: 1.0814, test_loss: 1.1543, test_f1: 0.5126
 epoch: 2, train_loss: 1.0021, test_loss: 1.1752, test_f1: 0.5626
 epoch: 3, train_loss: 0.9354, test_loss: 1.1576, test_f1: 0.5835
 epoch: 4, train_loss: 0.9285, test_loss: 1.1817, test_f1: 0.5908
 epoch: 5, train_loss: 0.8767, test_loss: 1.1974, test_f1: 0.5500
 epoch: 6, train_loss: 0.8839, test_loss: 1.1577, test_f1: 0.5546
 epoch: 7, train_loss: 0.8758, test_loss: 1.2562, test_f1: 0.5597
 epoch: 8, train_loss: 0.8231, test_loss: 1.1349, test_f1: 0.5633
 epoch: 9, train_loss: 0.8232, test_loss: 1.3777, test_f1: 0.4961
 epoch: 10, train_loss: 0.8289, test_loss: 1.1154, test_f1: 0.5843
 epoch: 11, train_loss: 0.7812, test_loss: 1.2583, test_f1: 0.5594
 epoch: 12, train_loss: 0.7782, test_loss: 1.1486, test_f1: 0.6025
 epoch: 13, train_loss: 0.7372, test_loss: 1.3101, test_f1: 0.5249
 epoch: 14, train_loss: 0.7266, test_loss: 1.2211, test_f1: 0.5887
 epoch: 15, train_loss: 0.6912, test_loss: 1.2331, test_f1: 0.5978
 epoch: 16, train_loss: 0.6991, test_loss: 1.2935, test_f1: 0.6117
 epoch: 17, train_loss: 0.6920, test_loss: 1.2755, test_f1: 0.5964
 epoch: 18, train_loss: 0.6843, test_loss: 1.4451, test_f1: 0.5460
 epoch: 19, train_loss: 0.6753, test_loss: 1.1490, test_f1: 0.5493
 epoch: 20, train_loss: 0.6538, test_loss: 1.3614, test_f1: 0.5675
 epoch: 21, train_loss: 0.6428, test_loss: 1.3062, test_f1: 0.5624
 epoch: 22, train_loss: 0.6450, test_loss: 1.2432, test_f1: 0.6004
 epoch: 23, train_loss: 0.6088, test_loss: 1.1601, test_f1: 0.6305
 epoch: 24, train_loss: 0.6485, test_loss: 1.4585, test_f1: 0.4828
 epoch: 25, train_loss: 0.5912, test_loss: 1.4267, test_f1: 0.5642
 epoch: 26, train_loss: 0.5639, test_loss: 1.4314, test_f1: 0.6321
 epoch: 27, train_loss: 0.5875, test_loss: 1.4930, test_f1: 0.5947
 epoch: 28, train_loss: 0.5772, test_loss: 1.5086, test_f1: 0.5975
 epoch: 29, train_loss: 0.5483, test_loss: 1.5314, test_f1: 0.6316
 epoch: 30, train_loss: 0.5709, test_loss: 1.6300, test_f1: 0.5274
 epoch: 31, train_loss: 0.5738, test_loss: 1.2520, test_f1: 0.6400
 epoch: 32, train_loss: 0.5336, test_loss: 1.2542, test_f1: 0.6539
 epoch: 33, train_loss: 0.5429, test_loss: 1.2315, test_f1: 0.6024
 epoch: 34, train_loss: 0.5180, test_loss: 1.5141, test_f1: 0.5451
 epoch: 35, train_loss: 0.4776, test_loss: 1.5926, test_f1: 0.5937
 epoch: 36, train_loss: 0.4730, test_loss: 1.7467, test_f1: 0.5724
 epoch: 37, train_loss: 0.5071, test_loss: 1.3724, test_f1: 0.6269
 epoch: 38, train_loss: 0.5375, test_loss: 1.5079, test_f1: 0.6023
 epoch: 39, train_loss: 0.5231, test_loss: 1.6857, test_f1: 0.5597
 epoch: 40, train_loss: 0.4681, test_loss: 1.6951, test_f1: 0.5662
 epoch: 41, train_loss: 0.4747, test_loss: 1.5341, test_f1: 0.6093
 epoch: 42, train_loss: 0.4930, test_loss: 1.5142, test_f1: 0.5829
 epoch: 43, train_loss: 0.4761, test_loss: 1.8264, test_f1: 0.5211
 epoch: 44, train_loss: 0.4599, test_loss: 1.5163, test_f1: 0.5918
 epoch: 45, train_loss: 0.4832, test_loss: 1.6016, test_f1: 0.5922
 epoch: 46, train_loss: 0.4641, test_loss: 1.8583, test_f1: 0.5887
 epoch: 47, train_loss: 0.4223, test_loss: 1.9160, test_f1: 0.5335
 epoch: 48, train_loss: 0.4579, test_loss: 1.8325, test_f1: 0.5399
 epoch: 49, train_loss: 0.4639, test_loss: 2.0373, test_f1: 0.5199
 epoch: 50, train_loss: 0.4354, test_loss: 1.9912, test_f1: 0.5263
 epoch: 51, train_loss: 0.4006, test_loss: 1.8919, test_f1: 0.5947
 epoch: 52, train_loss: 0.3871, test_loss: 1.9542, test_f1: 0.5916
 epoch: 53, train_loss: 0.3592, test_loss: 1.9682, test_f1: 0.5792
 epoch: 54, train_loss: 0.3491, test_loss: 2.0807, test_f1: 0.6245
 epoch: 55, train_loss: 0.3312, test_loss: 1.9144, test_f1: 0.6246
 epoch: 56, train_loss: 0.3446, test_loss: 2.1415, test_f1: 0.5965
 epoch: 57, train_loss: 0.3391, test_loss: 2.1030, test_f1: 0.6000
 epoch: 58, train_loss: 0.3041, test_loss: 2.3127, test_f1: 0.5991
 epoch: 59, train_loss: 0.3046, test_loss: 2.2724, test_f1: 0.5954
 epoch: 60, train_loss: 0.3320, test_loss: 2.2482, test_f1: 0.5566
 epoch: 61, train_loss: 0.2948, test_loss: 2.3584, test_f1: 0.5887
 epoch: 62, train_loss: 0.2993, test_loss: 2.3147, test_f1: 0.5644
 epoch: 63, train_loss: 0.2775, test_loss: 2.2965, test_f1: 0.6072
 epoch: 64, train_loss: 0.3037, test_loss: 2.3583, test_f1: 0.5571
 epoch: 65, train_loss: 0.3215, test_loss: 2.2096, test_f1: 0.5954
 epoch: 66, train_loss: 0.3000, test_loss: 2.3713, test_f1: 0.5767
 epoch: 67, train_loss: 0.2605, test_loss: 2.3694, test_f1: 0.5615
 epoch: 68, train_loss: 0.2656, test_loss: 2.6307, test_f1: 0.5517
 epoch: 69, train_loss: 0.2877, test_loss: 2.4367, test_f1: 0.5670
 epoch: 70, train_loss: 0.3072, test_loss: 2.5075, test_f1: 0.5756
 epoch: 71, train_loss: 0.2770, test_loss: 2.6053, test_f1: 0.5429
 epoch: 72, train_loss: 0.2607, test_loss: 2.3799, test_f1: 0.5902
 epoch: 73, train_loss: 0.2620, test_loss: 2.5437, test_f1: 0.5650
 epoch: 74, train_loss: 0.2872, test_loss: 2.2110, test_f1: 0.5867
 epoch: 75, train_loss: 0.2480, test_loss: 2.6656, test_f1: 0.5565
 epoch: 76, train_loss: 0.2404, test_loss: 2.4638, test_f1: 0.5727
 epoch: 77, train_loss: 0.2745, test_loss: 2.4579, test_f1: 0.5625
 epoch: 78, train_loss: 0.2469, test_loss: 2.4440, test_f1: 0.5977
 epoch: 79, train_loss: 0.2439, test_loss: 2.2158, test_f1: 0.6286
 epoch: 80, train_loss: 0.2789, test_loss: 2.2752, test_f1: 0.5674
 epoch: 81, train_loss: 0.2648, test_loss: 2.3108, test_f1: 0.5933
 epoch: 82, train_loss: 0.2307, test_loss: 2.6057, test_f1: 0.5879
 epoch: 83, train_loss: 0.2450, test_loss: 2.5993, test_f1: 0.6047
 epoch: 84, train_loss: 0.2382, test_loss: 2.4568, test_f1: 0.5999
 epoch: 85, train_loss: 0.2424, test_loss: 2.5350, test_f1: 0.6363
 epoch: 86, train_loss: 0.2219, test_loss: 2.7153, test_f1: 0.5873
 epoch: 87, train_loss: 0.2587, test_loss: 2.7836, test_f1: 0.6059
 epoch: 88, train_loss: 0.2396, test_loss: 2.5656, test_f1: 0.5873
 epoch: 89, train_loss: 0.2212, test_loss: 2.7464, test_f1: 0.5689
 epoch: 90, train_loss: 0.2262, test_loss: 2.6983, test_f1: 0.5797
 epoch: 91, train_loss: 0.2386, test_loss: 2.4513, test_f1: 0.6127
 epoch: 92, train_loss: 0.2015, test_loss: 2.6403, test_f1: 0.5635
 epoch: 93, train_loss: 0.2387, test_loss: 2.6756, test_f1: 0.5955
 epoch: 94, train_loss: 0.2358, test_loss: 2.4085, test_f1: 0.5989
 epoch: 95, train_loss: 0.2029, test_loss: 2.4647, test_f1: 0.6052
 epoch: 96, train_loss: 0.2177, test_loss: 2.5993, test_f1: 0.5798
 epoch: 97, train_loss: 0.2258, test_loss: 2.7393, test_f1: 0.5574
 epoch: 98, train_loss: 0.2130, test_loss: 2.6358, test_f1: 0.5641
 epoch: 99, train_loss: 0.2155, test_loss: 2.7039, test_f1: 0.5695
##################ITERATION #9 ****************************************
 epoch: 0, train_loss: 1.3226, test_loss: 1.3635, test_f1: 0.3478
 epoch: 1, train_loss: 1.0967, test_loss: 1.1733, test_f1: 0.4825
 epoch: 2, train_loss: 1.0284, test_loss: 1.2335, test_f1: 0.4935
 epoch: 3, train_loss: 1.0081, test_loss: 1.1815, test_f1: 0.5521
 epoch: 4, train_loss: 0.9664, test_loss: 1.2124, test_f1: 0.4956
 epoch: 5, train_loss: 0.9397, test_loss: 1.1233, test_f1: 0.5204
 epoch: 6, train_loss: 0.9050, test_loss: 1.0933, test_f1: 0.5626
 epoch: 7, train_loss: 0.8608, test_loss: 1.1723, test_f1: 0.5201
 epoch: 8, train_loss: 0.8536, test_loss: 1.1187, test_f1: 0.5449
 epoch: 9, train_loss: 0.8604, test_loss: 1.1262, test_f1: 0.5547
 epoch: 10, train_loss: 0.8386, test_loss: 1.1026, test_f1: 0.5369
 epoch: 11, train_loss: 0.8272, test_loss: 1.1667, test_f1: 0.5786
 epoch: 12, train_loss: 0.8097, test_loss: 1.1389, test_f1: 0.5098
 epoch: 13, train_loss: 0.8095, test_loss: 1.2667, test_f1: 0.5725
 epoch: 14, train_loss: 0.7695, test_loss: 1.1660, test_f1: 0.5851
 epoch: 15, train_loss: 0.7569, test_loss: 1.1205, test_f1: 0.6106
 epoch: 16, train_loss: 0.7465, test_loss: 1.2878, test_f1: 0.5858
 epoch: 17, train_loss: 0.7351, test_loss: 1.1795, test_f1: 0.5687
 epoch: 18, train_loss: 0.7238, test_loss: 1.3083, test_f1: 0.5619
 epoch: 19, train_loss: 0.7025, test_loss: 1.1845, test_f1: 0.5868
 epoch: 20, train_loss: 0.6721, test_loss: 1.2198, test_f1: 0.5590
 epoch: 21, train_loss: 0.6921, test_loss: 1.1265, test_f1: 0.5125
 epoch: 22, train_loss: 0.6759, test_loss: 1.2066, test_f1: 0.5838
 epoch: 23, train_loss: 0.6764, test_loss: 1.1589, test_f1: 0.5588
 epoch: 24, train_loss: 0.6595, test_loss: 1.2393, test_f1: 0.6177
 epoch: 25, train_loss: 0.6234, test_loss: 1.2220, test_f1: 0.6166
 epoch: 26, train_loss: 0.6138, test_loss: 1.3142, test_f1: 0.5661
 epoch: 27, train_loss: 0.6392, test_loss: 1.2268, test_f1: 0.6063
 epoch: 28, train_loss: 0.5801, test_loss: 1.3684, test_f1: 0.5918
 epoch: 29, train_loss: 0.5826, test_loss: 1.3275, test_f1: 0.5976
 epoch: 30, train_loss: 0.6162, test_loss: 1.1868, test_f1: 0.6355
 epoch: 31, train_loss: 0.5939, test_loss: 1.3793, test_f1: 0.5481
 epoch: 32, train_loss: 0.5502, test_loss: 1.2808, test_f1: 0.6228
 epoch: 33, train_loss: 0.5734, test_loss: 1.3710, test_f1: 0.5708
 epoch: 34, train_loss: 0.5476, test_loss: 1.4139, test_f1: 0.5650
 epoch: 35, train_loss: 0.5423, test_loss: 1.5571, test_f1: 0.6100
 epoch: 36, train_loss: 0.4990, test_loss: 1.4493, test_f1: 0.5869
 epoch: 37, train_loss: 0.5340, test_loss: 1.5746, test_f1: 0.5805
 epoch: 38, train_loss: 0.5272, test_loss: 1.3670, test_f1: 0.6134
 epoch: 39, train_loss: 0.5165, test_loss: 1.7325, test_f1: 0.5596
 epoch: 40, train_loss: 0.5202, test_loss: 1.7085, test_f1: 0.5943
 epoch: 41, train_loss: 0.4676, test_loss: 1.5819, test_f1: 0.5747
 epoch: 42, train_loss: 0.5102, test_loss: 1.4645, test_f1: 0.6174
 epoch: 43, train_loss: 0.5063, test_loss: 1.5743, test_f1: 0.5469
 epoch: 44, train_loss: 0.5064, test_loss: 1.6580, test_f1: 0.6070
 epoch: 45, train_loss: 0.4686, test_loss: 1.5932, test_f1: 0.5736
 epoch: 46, train_loss: 0.4601, test_loss: 1.7298, test_f1: 0.5824
 epoch: 47, train_loss: 0.4520, test_loss: 1.7344, test_f1: 0.6211
 epoch: 48, train_loss: 0.4590, test_loss: 1.6214, test_f1: 0.5891
 epoch: 49, train_loss: 0.4796, test_loss: 1.5602, test_f1: 0.5820
 epoch: 50, train_loss: 0.4469, test_loss: 1.7139, test_f1: 0.5965
 epoch: 51, train_loss: 0.3884, test_loss: 1.7531, test_f1: 0.6107
 epoch: 52, train_loss: 0.3512, test_loss: 1.7582, test_f1: 0.5872
 epoch: 53, train_loss: 0.3513, test_loss: 1.9885, test_f1: 0.5709
 epoch: 54, train_loss: 0.3481, test_loss: 1.8970, test_f1: 0.5822
 epoch: 55, train_loss: 0.3484, test_loss: 2.0027, test_f1: 0.6220
 epoch: 56, train_loss: 0.3467, test_loss: 1.8680, test_f1: 0.5905
 epoch: 57, train_loss: 0.3282, test_loss: 1.9296, test_f1: 0.6034
 epoch: 58, train_loss: 0.3349, test_loss: 2.2319, test_f1: 0.5334
 epoch: 59, train_loss: 0.3226, test_loss: 1.9973, test_f1: 0.6247
 epoch: 60, train_loss: 0.3051, test_loss: 1.9997, test_f1: 0.6006
 epoch: 61, train_loss: 0.3027, test_loss: 2.2625, test_f1: 0.6070
 epoch: 62, train_loss: 0.3047, test_loss: 2.4458, test_f1: 0.5849
 epoch: 63, train_loss: 0.3143, test_loss: 2.0256, test_f1: 0.5617
 epoch: 64, train_loss: 0.3073, test_loss: 2.1448, test_f1: 0.5861
 epoch: 65, train_loss: 0.3019, test_loss: 2.3303, test_f1: 0.6011
 epoch: 66, train_loss: 0.3053, test_loss: 2.1850, test_f1: 0.5767
 epoch: 67, train_loss: 0.2925, test_loss: 2.1900, test_f1: 0.6082
 epoch: 68, train_loss: 0.2901, test_loss: 2.2230, test_f1: 0.5901
 epoch: 69, train_loss: 0.2865, test_loss: 2.1722, test_f1: 0.5801
 epoch: 70, train_loss: 0.2750, test_loss: 2.3242, test_f1: 0.6136
 epoch: 71, train_loss: 0.2980, test_loss: 2.5246, test_f1: 0.6201
 epoch: 72, train_loss: 0.2809, test_loss: 2.3401, test_f1: 0.5899
 epoch: 73, train_loss: 0.2827, test_loss: 2.5251, test_f1: 0.6017
 epoch: 74, train_loss: 0.2341, test_loss: 2.7231, test_f1: 0.5945
 epoch: 75, train_loss: 0.2528, test_loss: 2.3203, test_f1: 0.6071
 epoch: 76, train_loss: 0.2493, test_loss: 2.2725, test_f1: 0.5775
 epoch: 77, train_loss: 0.2703, test_loss: 2.3169, test_f1: 0.6059
 epoch: 78, train_loss: 0.2321, test_loss: 2.4563, test_f1: 0.6204
 epoch: 79, train_loss: 0.2522, test_loss: 2.4893, test_f1: 0.6027
 epoch: 80, train_loss: 0.2414, test_loss: 2.8575, test_f1: 0.5664
 epoch: 81, train_loss: 0.2377, test_loss: 2.9117, test_f1: 0.6098
 epoch: 82, train_loss: 0.2524, test_loss: 2.7333, test_f1: 0.5748
 epoch: 83, train_loss: 0.2458, test_loss: 2.3770, test_f1: 0.5920
 epoch: 84, train_loss: 0.2172, test_loss: 2.7437, test_f1: 0.5888
 epoch: 85, train_loss: 0.2434, test_loss: 2.3962, test_f1: 0.6181
 epoch: 86, train_loss: 0.2305, test_loss: 2.6603, test_f1: 0.6046
 epoch: 87, train_loss: 0.2420, test_loss: 2.4792, test_f1: 0.6248
 epoch: 88, train_loss: 0.2247, test_loss: 2.5157, test_f1: 0.5760
 epoch: 89, train_loss: 0.2237, test_loss: 2.3781, test_f1: 0.6189
 epoch: 90, train_loss: 0.1964, test_loss: 2.7190, test_f1: 0.5982
 epoch: 91, train_loss: 0.2001, test_loss: 3.1116, test_f1: 0.5784
 epoch: 92, train_loss: 0.2226, test_loss: 2.5699, test_f1: 0.6109
 epoch: 93, train_loss: 0.2308, test_loss: 2.4387, test_f1: 0.6330
 epoch: 94, train_loss: 0.2354, test_loss: 2.6968, test_f1: 0.5863
 epoch: 95, train_loss: 0.2108, test_loss: 2.7886, test_f1: 0.6121
 epoch: 96, train_loss: 0.1949, test_loss: 2.6354, test_f1: 0.5963
 epoch: 97, train_loss: 0.1911, test_loss: 3.0240, test_f1: 0.5891
 epoch: 98, train_loss: 0.2596, test_loss: 2.9710, test_f1: 0.5979
 epoch: 99, train_loss: 0.2554, test_loss: 2.5162, test_f1: 0.6313

Training completed in 865.35 seconds
Best F1: 0.6623 at epoch 88
Mean F1 across iterations: 0.6404  0.0158
========================FINAL RESULTS================================
FEGIN weighted F1: 0.6623  0.0158
python main.py --data ltspice_demos --representation component_component --model FEGIN --layers 3 --hiddens 128 --batch_size 32 --lr 0.001 --emb_size 512 --epochs 100 --save_appendix component_component_L3_H128_BS32_LR0.001_E512 --no_val
-----



STDERR:
  File "main.py", line 370, in <module>
    main()
  File "main.py", line 254, in main
    dataset = dataset_class(
  File "/home/philip/projects/ltspice_examples_code_repo/Circuit-Completion-Using-GNNs/component_classification_with_link_prediction_head/evaluation/FEGIN/kernel/circuit_datasets.py", line 15, in __init__
    self.data, self.slices = torch.load(self.processed_paths[0])
  File "/home/philip/.local/lib/python3.8/site-packages/torch/serialization.py", line 1040, in load
    warnings.warn(
  File "/usr/lib/python3.8/warnings.py", line 109, in _showwarnmsg
    sw(msg.message, msg.category, msg.filename, msg.lineno,
  File "main.py", line 47, in warn_with_traceback
    traceback.print_stack(file=log)
/home/philip/projects/ltspice_examples_code_repo/Circuit-Completion-Using-GNNs/component_classification_with_link_prediction_head/evaluation/FEGIN/kernel/circuit_datasets.py:15: FutureWarning: You are using `torch.load` with `weights_only=False` (the current default value), which uses the default pickle module implicitly. It is possible to construct malicious pickle data which will execute arbitrary code during unpickling (See https://github.com/pytorch/pytorch/blob/main/SECURITY.md#untrusted-models for more details). In a future release, the default value for `weights_only` will be flipped to `True`. This limits the functions that could be executed during unpickling. Arbitrary objects will no longer be allowed to be loaded via this mode unless they are explicitly allowlisted by the user via `torch.serialization.add_safe_globals`. We recommend you start setting `weights_only=True` for any use case where you don't have full control of the loaded file. Please open an issue on GitHub for any issues related to this experimental feature.
  self.data, self.slices = torch.load(self.processed_paths[0])
