STDOUT:
Results will be saved in /home/philip/projects/ltspice_examples_code_repo/Circuit-Completion-Using-GNNs/component_classification_with_link_prediction_head/evaluation/FEGIN/results/model_FEGIN_dataset_ltspice_demos
Command line input: python main.py --data ltspice_demos --representation component_component --model FEGIN --layers 2 --hiddens 128 --batch_size 256 --lr 0.0001 --emb_size 128 --epochs 100 --save_appendix component_component_L2_H128_BS256_LR0.0001_E128 --no_val
 is saved.
-----
ltspice_demos - FEGIN
Using 2 layers, 128 hidden units, h = 2
Loading component_component representation dataset
ENTERED
Training FEGIN on component_component representation
Train: 1565, Test: 383
##################ITERATION #0 ****************************************
 epoch: 0, train_loss: 1.3788, test_loss: 1.3778, test_f1: 0.2281
 epoch: 1, train_loss: 1.3667, test_loss: 1.3746, test_f1: 0.2281
 epoch: 2, train_loss: 1.3594, test_loss: 1.3705, test_f1: 0.2281
 epoch: 3, train_loss: 1.3531, test_loss: 1.3655, test_f1: 0.2281
 epoch: 4, train_loss: 1.3455, test_loss: 1.3593, test_f1: 0.2281
 epoch: 5, train_loss: 1.3383, test_loss: 1.3522, test_f1: 0.2281
 epoch: 6, train_loss: 1.3299, test_loss: 1.3442, test_f1: 0.2281
 epoch: 7, train_loss: 1.3206, test_loss: 1.3352, test_f1: 0.2281
 epoch: 8, train_loss: 1.3115, test_loss: 1.3265, test_f1: 0.2281
 epoch: 9, train_loss: 1.3014, test_loss: 1.3176, test_f1: 0.2281
 epoch: 10, train_loss: 1.2894, test_loss: 1.3090, test_f1: 0.2281
 epoch: 11, train_loss: 1.2786, test_loss: 1.3017, test_f1: 0.2281
 epoch: 12, train_loss: 1.2645, test_loss: 1.2945, test_f1: 0.2281
 epoch: 13, train_loss: 1.2545, test_loss: 1.2878, test_f1: 0.2281
 epoch: 14, train_loss: 1.2411, test_loss: 1.2820, test_f1: 0.2281
 epoch: 15, train_loss: 1.2293, test_loss: 1.2760, test_f1: 0.2281
 epoch: 16, train_loss: 1.2202, test_loss: 1.2706, test_f1: 0.2281
 epoch: 17, train_loss: 1.2110, test_loss: 1.2658, test_f1: 0.2281
 epoch: 18, train_loss: 1.2037, test_loss: 1.2632, test_f1: 0.2281
 epoch: 19, train_loss: 1.1953, test_loss: 1.2579, test_f1: 0.2653
 epoch: 20, train_loss: 1.1840, test_loss: 1.2529, test_f1: 0.2587
 epoch: 21, train_loss: 1.1777, test_loss: 1.2500, test_f1: 0.2587
 epoch: 22, train_loss: 1.1689, test_loss: 1.2477, test_f1: 0.2587
 epoch: 23, train_loss: 1.1605, test_loss: 1.2416, test_f1: 0.2587
 epoch: 24, train_loss: 1.1571, test_loss: 1.2387, test_f1: 0.2587
 epoch: 25, train_loss: 1.1523, test_loss: 1.2379, test_f1: 0.2573
 epoch: 26, train_loss: 1.1465, test_loss: 1.2305, test_f1: 0.2587
 epoch: 27, train_loss: 1.1397, test_loss: 1.2281, test_f1: 0.2587
 epoch: 28, train_loss: 1.1315, test_loss: 1.2216, test_f1: 0.2801
 epoch: 29, train_loss: 1.1253, test_loss: 1.2190, test_f1: 0.2948
 epoch: 30, train_loss: 1.1208, test_loss: 1.2129, test_f1: 0.3039
 epoch: 31, train_loss: 1.1182, test_loss: 1.2078, test_f1: 0.3148
 epoch: 32, train_loss: 1.1113, test_loss: 1.2073, test_f1: 0.3377
 epoch: 33, train_loss: 1.1063, test_loss: 1.2062, test_f1: 0.3715
 epoch: 34, train_loss: 1.0954, test_loss: 1.1998, test_f1: 0.3599
 epoch: 35, train_loss: 1.0903, test_loss: 1.1963, test_f1: 0.3633
 epoch: 36, train_loss: 1.0882, test_loss: 1.1897, test_f1: 0.3571
 epoch: 37, train_loss: 1.0769, test_loss: 1.1874, test_f1: 0.3660
 epoch: 38, train_loss: 1.0721, test_loss: 1.1816, test_f1: 0.3685
 epoch: 39, train_loss: 1.0644, test_loss: 1.1820, test_f1: 0.3703
 epoch: 40, train_loss: 1.0605, test_loss: 1.1810, test_f1: 0.3633
 epoch: 41, train_loss: 1.0521, test_loss: 1.1784, test_f1: 0.4011
 epoch: 42, train_loss: 1.0486, test_loss: 1.1706, test_f1: 0.3701
 epoch: 43, train_loss: 1.0405, test_loss: 1.1668, test_f1: 0.3687
 epoch: 44, train_loss: 1.0329, test_loss: 1.1620, test_f1: 0.3873
 epoch: 45, train_loss: 1.0243, test_loss: 1.1637, test_f1: 0.3891
 epoch: 46, train_loss: 1.0155, test_loss: 1.1608, test_f1: 0.4075
 epoch: 47, train_loss: 1.0058, test_loss: 1.1568, test_f1: 0.4025
 epoch: 48, train_loss: 0.9972, test_loss: 1.1513, test_f1: 0.4141
 epoch: 49, train_loss: 0.9901, test_loss: 1.1467, test_f1: 0.4151
 epoch: 50, train_loss: 0.9803, test_loss: 1.1475, test_f1: 0.4208
 epoch: 51, train_loss: 0.9818, test_loss: 1.1510, test_f1: 0.4209
 epoch: 52, train_loss: 0.9707, test_loss: 1.1537, test_f1: 0.4196
 epoch: 53, train_loss: 0.9638, test_loss: 1.1537, test_f1: 0.4212
 epoch: 54, train_loss: 0.9610, test_loss: 1.1478, test_f1: 0.4253
 epoch: 55, train_loss: 0.9574, test_loss: 1.1493, test_f1: 0.4299
 epoch: 56, train_loss: 0.9492, test_loss: 1.1499, test_f1: 0.4429
 epoch: 57, train_loss: 0.9520, test_loss: 1.1497, test_f1: 0.4430
 epoch: 58, train_loss: 0.9529, test_loss: 1.1489, test_f1: 0.4502
 epoch: 59, train_loss: 0.9430, test_loss: 1.1528, test_f1: 0.4325
 epoch: 60, train_loss: 0.9358, test_loss: 1.1512, test_f1: 0.4403
 epoch: 61, train_loss: 0.9335, test_loss: 1.1553, test_f1: 0.4544
 epoch: 62, train_loss: 0.9320, test_loss: 1.1521, test_f1: 0.4777
 epoch: 63, train_loss: 0.9251, test_loss: 1.1537, test_f1: 0.4817
 epoch: 64, train_loss: 0.9211, test_loss: 1.1621, test_f1: 0.4740
 epoch: 65, train_loss: 0.9193, test_loss: 1.1627, test_f1: 0.4814
 epoch: 66, train_loss: 0.9189, test_loss: 1.1596, test_f1: 0.4759
 epoch: 67, train_loss: 0.9205, test_loss: 1.1617, test_f1: 0.4769
 epoch: 68, train_loss: 0.9096, test_loss: 1.1666, test_f1: 0.4764
 epoch: 69, train_loss: 0.9154, test_loss: 1.1620, test_f1: 0.4819
 epoch: 70, train_loss: 0.9021, test_loss: 1.1626, test_f1: 0.4990
 epoch: 71, train_loss: 0.8996, test_loss: 1.1620, test_f1: 0.4993
 epoch: 72, train_loss: 0.8969, test_loss: 1.1611, test_f1: 0.5042
 epoch: 73, train_loss: 0.9000, test_loss: 1.1698, test_f1: 0.5132
 epoch: 74, train_loss: 0.8952, test_loss: 1.1770, test_f1: 0.5059
 epoch: 75, train_loss: 0.8890, test_loss: 1.1719, test_f1: 0.5125
 epoch: 76, train_loss: 0.8834, test_loss: 1.1756, test_f1: 0.5106
 epoch: 77, train_loss: 0.8800, test_loss: 1.1770, test_f1: 0.5122
 epoch: 78, train_loss: 0.8755, test_loss: 1.1861, test_f1: 0.5134
 epoch: 79, train_loss: 0.8799, test_loss: 1.1798, test_f1: 0.5110
 epoch: 80, train_loss: 0.8739, test_loss: 1.1752, test_f1: 0.5116
 epoch: 81, train_loss: 0.8688, test_loss: 1.1757, test_f1: 0.5007
 epoch: 82, train_loss: 0.8607, test_loss: 1.1704, test_f1: 0.5062
 epoch: 83, train_loss: 0.8639, test_loss: 1.1843, test_f1: 0.4988
 epoch: 84, train_loss: 0.8656, test_loss: 1.1858, test_f1: 0.5093
 epoch: 85, train_loss: 0.8626, test_loss: 1.1917, test_f1: 0.4995
 epoch: 86, train_loss: 0.8576, test_loss: 1.1852, test_f1: 0.4877
 epoch: 87, train_loss: 0.8476, test_loss: 1.1867, test_f1: 0.4952
 epoch: 88, train_loss: 0.8525, test_loss: 1.1808, test_f1: 0.4916
 epoch: 89, train_loss: 0.8442, test_loss: 1.1878, test_f1: 0.4871
 epoch: 90, train_loss: 0.8438, test_loss: 1.2008, test_f1: 0.4947
 epoch: 91, train_loss: 0.8337, test_loss: 1.2010, test_f1: 0.5123
 epoch: 92, train_loss: 0.8342, test_loss: 1.2034, test_f1: 0.5245
 epoch: 93, train_loss: 0.8307, test_loss: 1.2026, test_f1: 0.5104
 epoch: 94, train_loss: 0.8312, test_loss: 1.2025, test_f1: 0.5135
 epoch: 95, train_loss: 0.8292, test_loss: 1.1953, test_f1: 0.5248
 epoch: 96, train_loss: 0.8275, test_loss: 1.2020, test_f1: 0.5249
 epoch: 97, train_loss: 0.8306, test_loss: 1.2109, test_f1: 0.5112
 epoch: 98, train_loss: 0.8241, test_loss: 1.2108, test_f1: 0.5121
 epoch: 99, train_loss: 0.8160, test_loss: 1.2157, test_f1: 0.5037
##################ITERATION #1 ****************************************
 epoch: 0, train_loss: 1.3465, test_loss: 1.3563, test_f1: 0.2281
 epoch: 1, train_loss: 1.3169, test_loss: 1.3514, test_f1: 0.2281
 epoch: 2, train_loss: 1.3034, test_loss: 1.3428, test_f1: 0.2281
 epoch: 3, train_loss: 1.2901, test_loss: 1.3327, test_f1: 0.2281
 epoch: 4, train_loss: 1.2753, test_loss: 1.3238, test_f1: 0.2281
 epoch: 5, train_loss: 1.2640, test_loss: 1.3158, test_f1: 0.2281
 epoch: 6, train_loss: 1.2527, test_loss: 1.3066, test_f1: 0.2281
 epoch: 7, train_loss: 1.2401, test_loss: 1.3010, test_f1: 0.2281
 epoch: 8, train_loss: 1.2270, test_loss: 1.2911, test_f1: 0.2281
 epoch: 9, train_loss: 1.2143, test_loss: 1.2853, test_f1: 0.2281
 epoch: 10, train_loss: 1.2080, test_loss: 1.2786, test_f1: 0.2281
 epoch: 11, train_loss: 1.2019, test_loss: 1.2755, test_f1: 0.2393
 epoch: 12, train_loss: 1.1909, test_loss: 1.2745, test_f1: 0.2500
 epoch: 13, train_loss: 1.1847, test_loss: 1.2731, test_f1: 0.2931
 epoch: 14, train_loss: 1.1765, test_loss: 1.2682, test_f1: 0.3019
 epoch: 15, train_loss: 1.1658, test_loss: 1.2612, test_f1: 0.3062
 epoch: 16, train_loss: 1.1569, test_loss: 1.2573, test_f1: 0.3260
 epoch: 17, train_loss: 1.1480, test_loss: 1.2526, test_f1: 0.3337
 epoch: 18, train_loss: 1.1383, test_loss: 1.2418, test_f1: 0.3466
 epoch: 19, train_loss: 1.1260, test_loss: 1.2363, test_f1: 0.3446
 epoch: 20, train_loss: 1.1192, test_loss: 1.2302, test_f1: 0.3476
 epoch: 21, train_loss: 1.1133, test_loss: 1.2240, test_f1: 0.3324
 epoch: 22, train_loss: 1.1053, test_loss: 1.2200, test_f1: 0.3274
 epoch: 23, train_loss: 1.0991, test_loss: 1.2183, test_f1: 0.3296
 epoch: 24, train_loss: 1.0864, test_loss: 1.2133, test_f1: 0.3223
 epoch: 25, train_loss: 1.0763, test_loss: 1.2084, test_f1: 0.3353
 epoch: 26, train_loss: 1.0697, test_loss: 1.2057, test_f1: 0.3476
 epoch: 27, train_loss: 1.0615, test_loss: 1.2201, test_f1: 0.3502
 epoch: 28, train_loss: 1.0511, test_loss: 1.2290, test_f1: 0.3474
 epoch: 29, train_loss: 1.0401, test_loss: 1.2155, test_f1: 0.3468
 epoch: 30, train_loss: 1.0442, test_loss: 1.1976, test_f1: 0.3658
 epoch: 31, train_loss: 1.0250, test_loss: 1.1990, test_f1: 0.3826
 epoch: 32, train_loss: 1.0141, test_loss: 1.2170, test_f1: 0.4088
 epoch: 33, train_loss: 1.0103, test_loss: 1.2216, test_f1: 0.4252
 epoch: 34, train_loss: 1.0023, test_loss: 1.2371, test_f1: 0.4122
 epoch: 35, train_loss: 0.9975, test_loss: 1.2419, test_f1: 0.4241
 epoch: 36, train_loss: 0.9949, test_loss: 1.2593, test_f1: 0.4451
 epoch: 37, train_loss: 0.9850, test_loss: 1.2345, test_f1: 0.4492
 epoch: 38, train_loss: 0.9703, test_loss: 1.2335, test_f1: 0.4542
 epoch: 39, train_loss: 0.9743, test_loss: 1.2757, test_f1: 0.4728
 epoch: 40, train_loss: 0.9556, test_loss: 1.2660, test_f1: 0.4789
 epoch: 41, train_loss: 0.9556, test_loss: 1.2581, test_f1: 0.4909
 epoch: 42, train_loss: 0.9462, test_loss: 1.2002, test_f1: 0.4977
 epoch: 43, train_loss: 0.9360, test_loss: 1.1943, test_f1: 0.5008
 epoch: 44, train_loss: 0.9208, test_loss: 1.2403, test_f1: 0.5112
 epoch: 45, train_loss: 0.9235, test_loss: 1.2800, test_f1: 0.5370
 epoch: 46, train_loss: 0.9193, test_loss: 1.2877, test_f1: 0.5573
 epoch: 47, train_loss: 0.9132, test_loss: 1.2698, test_f1: 0.5556
 epoch: 48, train_loss: 0.9064, test_loss: 1.2518, test_f1: 0.5579
 epoch: 49, train_loss: 0.8934, test_loss: 1.2445, test_f1: 0.5679
 epoch: 50, train_loss: 0.8818, test_loss: 1.2329, test_f1: 0.5622
 epoch: 51, train_loss: 0.8804, test_loss: 1.2390, test_f1: 0.5645
 epoch: 52, train_loss: 0.8774, test_loss: 1.2654, test_f1: 0.5699
 epoch: 53, train_loss: 0.8761, test_loss: 1.2336, test_f1: 0.5805
 epoch: 54, train_loss: 0.8673, test_loss: 1.2214, test_f1: 0.5533
 epoch: 55, train_loss: 0.8600, test_loss: 1.1541, test_f1: 0.5482
 epoch: 56, train_loss: 0.8612, test_loss: 1.1579, test_f1: 0.5553
 epoch: 57, train_loss: 0.8607, test_loss: 1.1656, test_f1: 0.5723
 epoch: 58, train_loss: 0.8578, test_loss: 1.1655, test_f1: 0.5697
 epoch: 59, train_loss: 0.8539, test_loss: 1.1547, test_f1: 0.5757
 epoch: 60, train_loss: 0.8447, test_loss: 1.1525, test_f1: 0.5706
 epoch: 61, train_loss: 0.8444, test_loss: 1.1323, test_f1: 0.5707
 epoch: 62, train_loss: 0.8516, test_loss: 1.1412, test_f1: 0.5680
 epoch: 63, train_loss: 0.8421, test_loss: 1.1351, test_f1: 0.5763
 epoch: 64, train_loss: 0.8437, test_loss: 1.1369, test_f1: 0.5809
 epoch: 65, train_loss: 0.8375, test_loss: 1.1405, test_f1: 0.5624
 epoch: 66, train_loss: 0.8321, test_loss: 1.1320, test_f1: 0.5652
 epoch: 67, train_loss: 0.8358, test_loss: 1.1395, test_f1: 0.5811
 epoch: 68, train_loss: 0.8252, test_loss: 1.1466, test_f1: 0.5813
 epoch: 69, train_loss: 0.8252, test_loss: 1.1339, test_f1: 0.5895
 epoch: 70, train_loss: 0.8255, test_loss: 1.1302, test_f1: 0.5921
 epoch: 71, train_loss: 0.8181, test_loss: 1.1206, test_f1: 0.5899
 epoch: 72, train_loss: 0.8180, test_loss: 1.1218, test_f1: 0.5867
 epoch: 73, train_loss: 0.8135, test_loss: 1.1301, test_f1: 0.5805
 epoch: 74, train_loss: 0.8094, test_loss: 1.1331, test_f1: 0.5722
 epoch: 75, train_loss: 0.8131, test_loss: 1.1262, test_f1: 0.5908
 epoch: 76, train_loss: 0.8123, test_loss: 1.1293, test_f1: 0.6025
 epoch: 77, train_loss: 0.8011, test_loss: 1.1368, test_f1: 0.6107
 epoch: 78, train_loss: 0.7934, test_loss: 1.1470, test_f1: 0.6050
 epoch: 79, train_loss: 0.7982, test_loss: 1.1436, test_f1: 0.6002
 epoch: 80, train_loss: 0.7969, test_loss: 1.1475, test_f1: 0.5972
 epoch: 81, train_loss: 0.7950, test_loss: 1.1480, test_f1: 0.5840
 epoch: 82, train_loss: 0.7914, test_loss: 1.1846, test_f1: 0.5682
 epoch: 83, train_loss: 0.7817, test_loss: 1.1635, test_f1: 0.5610
 epoch: 84, train_loss: 0.7812, test_loss: 1.1664, test_f1: 0.5891
 epoch: 85, train_loss: 0.7835, test_loss: 1.1738, test_f1: 0.5889
 epoch: 86, train_loss: 0.7818, test_loss: 1.1518, test_f1: 0.5975
 epoch: 87, train_loss: 0.7719, test_loss: 1.1457, test_f1: 0.5617
 epoch: 88, train_loss: 0.7717, test_loss: 1.1588, test_f1: 0.5426
 epoch: 89, train_loss: 0.7682, test_loss: 1.1748, test_f1: 0.5499
 epoch: 90, train_loss: 0.7749, test_loss: 1.1641, test_f1: 0.5674
 epoch: 91, train_loss: 0.7763, test_loss: 1.1487, test_f1: 0.5706
 epoch: 92, train_loss: 0.7677, test_loss: 1.1381, test_f1: 0.5653
 epoch: 93, train_loss: 0.7689, test_loss: 1.1337, test_f1: 0.5802
 epoch: 94, train_loss: 0.7618, test_loss: 1.1321, test_f1: 0.5764
 epoch: 95, train_loss: 0.7643, test_loss: 1.1349, test_f1: 0.5829
 epoch: 96, train_loss: 0.7515, test_loss: 1.1445, test_f1: 0.5712
 epoch: 97, train_loss: 0.7471, test_loss: 1.1400, test_f1: 0.5839
 epoch: 98, train_loss: 0.7495, test_loss: 1.1383, test_f1: 0.5956
 epoch: 99, train_loss: 0.7481, test_loss: 1.1478, test_f1: 0.5775
##################ITERATION #2 ****************************************
 epoch: 0, train_loss: 1.3211, test_loss: 1.3449, test_f1: 0.2388
 epoch: 1, train_loss: 1.2819, test_loss: 1.3438, test_f1: 0.2388
 epoch: 2, train_loss: 1.2688, test_loss: 1.3371, test_f1: 0.2294
 epoch: 3, train_loss: 1.2500, test_loss: 1.3302, test_f1: 0.2316
 epoch: 4, train_loss: 1.2362, test_loss: 1.3208, test_f1: 0.2511
 epoch: 5, train_loss: 1.2216, test_loss: 1.3088, test_f1: 0.2841
 epoch: 6, train_loss: 1.2090, test_loss: 1.2941, test_f1: 0.3181
 epoch: 7, train_loss: 1.1921, test_loss: 1.2768, test_f1: 0.3430
 epoch: 8, train_loss: 1.1841, test_loss: 1.2652, test_f1: 0.3565
 epoch: 9, train_loss: 1.1723, test_loss: 1.2463, test_f1: 0.3418
 epoch: 10, train_loss: 1.1589, test_loss: 1.2371, test_f1: 0.3501
 epoch: 11, train_loss: 1.1511, test_loss: 1.2281, test_f1: 0.3807
 epoch: 12, train_loss: 1.1362, test_loss: 1.2248, test_f1: 0.4295
 epoch: 13, train_loss: 1.1260, test_loss: 1.2148, test_f1: 0.4307
 epoch: 14, train_loss: 1.1144, test_loss: 1.2094, test_f1: 0.4186
 epoch: 15, train_loss: 1.1062, test_loss: 1.1985, test_f1: 0.4187
 epoch: 16, train_loss: 1.0908, test_loss: 1.1911, test_f1: 0.4195
 epoch: 17, train_loss: 1.0852, test_loss: 1.1863, test_f1: 0.4245
 epoch: 18, train_loss: 1.0709, test_loss: 1.1850, test_f1: 0.4208
 epoch: 19, train_loss: 1.0721, test_loss: 1.1800, test_f1: 0.4481
 epoch: 20, train_loss: 1.0596, test_loss: 1.1782, test_f1: 0.4395
 epoch: 21, train_loss: 1.0555, test_loss: 1.1715, test_f1: 0.4456
 epoch: 22, train_loss: 1.0414, test_loss: 1.1673, test_f1: 0.4635
 epoch: 23, train_loss: 1.0338, test_loss: 1.1639, test_f1: 0.4789
 epoch: 24, train_loss: 1.0249, test_loss: 1.1577, test_f1: 0.4889
 epoch: 25, train_loss: 1.0170, test_loss: 1.1508, test_f1: 0.4902
 epoch: 26, train_loss: 1.0161, test_loss: 1.1459, test_f1: 0.4841
 epoch: 27, train_loss: 1.0074, test_loss: 1.1416, test_f1: 0.5084
 epoch: 28, train_loss: 1.0031, test_loss: 1.1340, test_f1: 0.4965
 epoch: 29, train_loss: 0.9936, test_loss: 1.1376, test_f1: 0.4915
 epoch: 30, train_loss: 0.9835, test_loss: 1.1327, test_f1: 0.5079
 epoch: 31, train_loss: 0.9807, test_loss: 1.1365, test_f1: 0.4995
 epoch: 32, train_loss: 0.9639, test_loss: 1.1284, test_f1: 0.5070
 epoch: 33, train_loss: 0.9623, test_loss: 1.1316, test_f1: 0.5076
 epoch: 34, train_loss: 0.9580, test_loss: 1.1344, test_f1: 0.5051
 epoch: 35, train_loss: 0.9586, test_loss: 1.1226, test_f1: 0.5273
 epoch: 36, train_loss: 0.9470, test_loss: 1.1174, test_f1: 0.5276
 epoch: 37, train_loss: 0.9415, test_loss: 1.1115, test_f1: 0.5336
 epoch: 38, train_loss: 0.9371, test_loss: 1.1073, test_f1: 0.5336
 epoch: 39, train_loss: 0.9282, test_loss: 1.1059, test_f1: 0.5267
 epoch: 40, train_loss: 0.9188, test_loss: 1.1074, test_f1: 0.5219
 epoch: 41, train_loss: 0.9211, test_loss: 1.1096, test_f1: 0.5250
 epoch: 42, train_loss: 0.9145, test_loss: 1.1033, test_f1: 0.5300
 epoch: 43, train_loss: 0.9072, test_loss: 1.1027, test_f1: 0.5315
 epoch: 44, train_loss: 0.9062, test_loss: 1.1050, test_f1: 0.5370
 epoch: 45, train_loss: 0.9001, test_loss: 1.1097, test_f1: 0.5339
 epoch: 46, train_loss: 0.8936, test_loss: 1.1062, test_f1: 0.5278
 epoch: 47, train_loss: 0.8836, test_loss: 1.1033, test_f1: 0.5297
 epoch: 48, train_loss: 0.8824, test_loss: 1.0956, test_f1: 0.5323
 epoch: 49, train_loss: 0.8734, test_loss: 1.0901, test_f1: 0.5328
 epoch: 50, train_loss: 0.8681, test_loss: 1.0796, test_f1: 0.5437
 epoch: 51, train_loss: 0.8717, test_loss: 1.0873, test_f1: 0.5458
 epoch: 52, train_loss: 0.8652, test_loss: 1.0866, test_f1: 0.5483
 epoch: 53, train_loss: 0.8628, test_loss: 1.0950, test_f1: 0.5401
 epoch: 54, train_loss: 0.8535, test_loss: 1.0978, test_f1: 0.5372
 epoch: 55, train_loss: 0.8614, test_loss: 1.1003, test_f1: 0.5424
 epoch: 56, train_loss: 0.8560, test_loss: 1.0963, test_f1: 0.5476
 epoch: 57, train_loss: 0.8482, test_loss: 1.0989, test_f1: 0.5420
 epoch: 58, train_loss: 0.8525, test_loss: 1.0983, test_f1: 0.5490
 epoch: 59, train_loss: 0.8397, test_loss: 1.0941, test_f1: 0.5581
 epoch: 60, train_loss: 0.8494, test_loss: 1.0935, test_f1: 0.5551
 epoch: 61, train_loss: 0.8441, test_loss: 1.0912, test_f1: 0.5494
 epoch: 62, train_loss: 0.8444, test_loss: 1.0920, test_f1: 0.5528
 epoch: 63, train_loss: 0.8358, test_loss: 1.0915, test_f1: 0.5376
 epoch: 64, train_loss: 0.8429, test_loss: 1.0848, test_f1: 0.5431
 epoch: 65, train_loss: 0.8352, test_loss: 1.0968, test_f1: 0.5505
 epoch: 66, train_loss: 0.8337, test_loss: 1.0949, test_f1: 0.5429
 epoch: 67, train_loss: 0.8287, test_loss: 1.1016, test_f1: 0.5454
 epoch: 68, train_loss: 0.8325, test_loss: 1.1112, test_f1: 0.5372
 epoch: 69, train_loss: 0.8272, test_loss: 1.1121, test_f1: 0.5350
 epoch: 70, train_loss: 0.8246, test_loss: 1.1160, test_f1: 0.5427
 epoch: 71, train_loss: 0.8227, test_loss: 1.1049, test_f1: 0.5478
 epoch: 72, train_loss: 0.8134, test_loss: 1.0970, test_f1: 0.5497
 epoch: 73, train_loss: 0.8158, test_loss: 1.0844, test_f1: 0.5431
 epoch: 74, train_loss: 0.8187, test_loss: 1.0849, test_f1: 0.5536
 epoch: 75, train_loss: 0.8150, test_loss: 1.0976, test_f1: 0.5485
 epoch: 76, train_loss: 0.8200, test_loss: 1.0966, test_f1: 0.5409
 epoch: 77, train_loss: 0.8089, test_loss: 1.1208, test_f1: 0.5397
 epoch: 78, train_loss: 0.8080, test_loss: 1.1193, test_f1: 0.5478
 epoch: 79, train_loss: 0.8075, test_loss: 1.1301, test_f1: 0.5479
 epoch: 80, train_loss: 0.7957, test_loss: 1.1187, test_f1: 0.5430
 epoch: 81, train_loss: 0.7983, test_loss: 1.1091, test_f1: 0.5455
 epoch: 82, train_loss: 0.8001, test_loss: 1.1034, test_f1: 0.5482
 epoch: 83, train_loss: 0.8053, test_loss: 1.1070, test_f1: 0.5458
 epoch: 84, train_loss: 0.7979, test_loss: 1.1054, test_f1: 0.5531
 epoch: 85, train_loss: 0.7930, test_loss: 1.0982, test_f1: 0.5533
 epoch: 86, train_loss: 0.7836, test_loss: 1.0931, test_f1: 0.5504
 epoch: 87, train_loss: 0.7888, test_loss: 1.0994, test_f1: 0.5450
 epoch: 88, train_loss: 0.7956, test_loss: 1.0986, test_f1: 0.5556
 epoch: 89, train_loss: 0.7901, test_loss: 1.1066, test_f1: 0.5457
 epoch: 90, train_loss: 0.7790, test_loss: 1.1075, test_f1: 0.5503
 epoch: 91, train_loss: 0.7838, test_loss: 1.1142, test_f1: 0.5480
 epoch: 92, train_loss: 0.7724, test_loss: 1.1060, test_f1: 0.5559
 epoch: 93, train_loss: 0.7739, test_loss: 1.1079, test_f1: 0.5561
 epoch: 94, train_loss: 0.7754, test_loss: 1.1072, test_f1: 0.5518
 epoch: 95, train_loss: 0.7733, test_loss: 1.1043, test_f1: 0.5566
 epoch: 96, train_loss: 0.7701, test_loss: 1.1154, test_f1: 0.5665
 epoch: 97, train_loss: 0.7737, test_loss: 1.1081, test_f1: 0.5614
 epoch: 98, train_loss: 0.7659, test_loss: 1.1398, test_f1: 0.5622
 epoch: 99, train_loss: 0.7629, test_loss: 1.1432, test_f1: 0.5494
##################ITERATION #3 ****************************************
 epoch: 0, train_loss: 1.2930, test_loss: 1.3245, test_f1: 0.3582
 epoch: 1, train_loss: 1.2534, test_loss: 1.3255, test_f1: 0.3136
 epoch: 2, train_loss: 1.2355, test_loss: 1.3212, test_f1: 0.2958
 epoch: 3, train_loss: 1.2195, test_loss: 1.3112, test_f1: 0.3041
 epoch: 4, train_loss: 1.2141, test_loss: 1.2980, test_f1: 0.3315
 epoch: 5, train_loss: 1.1978, test_loss: 1.2849, test_f1: 0.3412
 epoch: 6, train_loss: 1.1884, test_loss: 1.2686, test_f1: 0.3566
 epoch: 7, train_loss: 1.1802, test_loss: 1.2564, test_f1: 0.4005
 epoch: 8, train_loss: 1.1710, test_loss: 1.2434, test_f1: 0.4339
 epoch: 9, train_loss: 1.1629, test_loss: 1.2326, test_f1: 0.4548
 epoch: 10, train_loss: 1.1491, test_loss: 1.2230, test_f1: 0.4458
 epoch: 11, train_loss: 1.1401, test_loss: 1.2205, test_f1: 0.4333
 epoch: 12, train_loss: 1.1279, test_loss: 1.2118, test_f1: 0.4426
 epoch: 13, train_loss: 1.1164, test_loss: 1.1985, test_f1: 0.4453
 epoch: 14, train_loss: 1.1055, test_loss: 1.1958, test_f1: 0.4370
 epoch: 15, train_loss: 1.0970, test_loss: 1.1826, test_f1: 0.4477
 epoch: 16, train_loss: 1.0889, test_loss: 1.1794, test_f1: 0.4483
 epoch: 17, train_loss: 1.0833, test_loss: 1.1664, test_f1: 0.4721
 epoch: 18, train_loss: 1.0644, test_loss: 1.1522, test_f1: 0.4741
 epoch: 19, train_loss: 1.0584, test_loss: 1.1485, test_f1: 0.4629
 epoch: 20, train_loss: 1.0516, test_loss: 1.1444, test_f1: 0.4626
 epoch: 21, train_loss: 1.0404, test_loss: 1.1451, test_f1: 0.4638
 epoch: 22, train_loss: 1.0395, test_loss: 1.1396, test_f1: 0.4690
 epoch: 23, train_loss: 1.0296, test_loss: 1.1340, test_f1: 0.4883
 epoch: 24, train_loss: 1.0211, test_loss: 1.1344, test_f1: 0.4822
 epoch: 25, train_loss: 1.0162, test_loss: 1.1354, test_f1: 0.4980
 epoch: 26, train_loss: 1.0098, test_loss: 1.1309, test_f1: 0.4980
 epoch: 27, train_loss: 0.9876, test_loss: 1.1190, test_f1: 0.5025
 epoch: 28, train_loss: 0.9890, test_loss: 1.1168, test_f1: 0.5031
 epoch: 29, train_loss: 0.9795, test_loss: 1.1179, test_f1: 0.5116
 epoch: 30, train_loss: 0.9779, test_loss: 1.1224, test_f1: 0.5143
 epoch: 31, train_loss: 0.9646, test_loss: 1.1214, test_f1: 0.5106
 epoch: 32, train_loss: 0.9718, test_loss: 1.1158, test_f1: 0.5183
 epoch: 33, train_loss: 0.9670, test_loss: 1.1139, test_f1: 0.4999
 epoch: 34, train_loss: 0.9517, test_loss: 1.1188, test_f1: 0.4984
 epoch: 35, train_loss: 0.9463, test_loss: 1.1149, test_f1: 0.5015
 epoch: 36, train_loss: 0.9399, test_loss: 1.1190, test_f1: 0.4943
 epoch: 37, train_loss: 0.9444, test_loss: 1.1184, test_f1: 0.5078
 epoch: 38, train_loss: 0.9275, test_loss: 1.1149, test_f1: 0.5006
 epoch: 39, train_loss: 0.9243, test_loss: 1.1093, test_f1: 0.5051
 epoch: 40, train_loss: 0.9161, test_loss: 1.1172, test_f1: 0.5149
 epoch: 41, train_loss: 0.9184, test_loss: 1.1194, test_f1: 0.5257
 epoch: 42, train_loss: 0.9051, test_loss: 1.1124, test_f1: 0.5355
 epoch: 43, train_loss: 0.8974, test_loss: 1.1089, test_f1: 0.5274
 epoch: 44, train_loss: 0.8949, test_loss: 1.1117, test_f1: 0.5344
 epoch: 45, train_loss: 0.8810, test_loss: 1.1161, test_f1: 0.5352
 epoch: 46, train_loss: 0.8917, test_loss: 1.1172, test_f1: 0.5372
 epoch: 47, train_loss: 0.8749, test_loss: 1.1128, test_f1: 0.5405
 epoch: 48, train_loss: 0.8775, test_loss: 1.1138, test_f1: 0.5423
 epoch: 49, train_loss: 0.8667, test_loss: 1.1070, test_f1: 0.5429
 epoch: 50, train_loss: 0.8597, test_loss: 1.1105, test_f1: 0.5509
 epoch: 51, train_loss: 0.8651, test_loss: 1.1167, test_f1: 0.5482
 epoch: 52, train_loss: 0.8580, test_loss: 1.1147, test_f1: 0.5533
 epoch: 53, train_loss: 0.8523, test_loss: 1.1173, test_f1: 0.5507
 epoch: 54, train_loss: 0.8510, test_loss: 1.1214, test_f1: 0.5379
 epoch: 55, train_loss: 0.8543, test_loss: 1.1208, test_f1: 0.5347
 epoch: 56, train_loss: 0.8440, test_loss: 1.1118, test_f1: 0.5480
 epoch: 57, train_loss: 0.8385, test_loss: 1.1058, test_f1: 0.5484
 epoch: 58, train_loss: 0.8409, test_loss: 1.1055, test_f1: 0.5687
 epoch: 59, train_loss: 0.8377, test_loss: 1.1080, test_f1: 0.5536
 epoch: 60, train_loss: 0.8370, test_loss: 1.1165, test_f1: 0.5466
 epoch: 61, train_loss: 0.8335, test_loss: 1.1090, test_f1: 0.5456
 epoch: 62, train_loss: 0.8354, test_loss: 1.1067, test_f1: 0.5559
 epoch: 63, train_loss: 0.8332, test_loss: 1.1070, test_f1: 0.5529
 epoch: 64, train_loss: 0.8162, test_loss: 1.1110, test_f1: 0.5559
 epoch: 65, train_loss: 0.8302, test_loss: 1.1113, test_f1: 0.5585
 epoch: 66, train_loss: 0.8219, test_loss: 1.1016, test_f1: 0.5716
 epoch: 67, train_loss: 0.8232, test_loss: 1.1082, test_f1: 0.5616
 epoch: 68, train_loss: 0.8107, test_loss: 1.1092, test_f1: 0.5514
 epoch: 69, train_loss: 0.8204, test_loss: 1.1076, test_f1: 0.5484
 epoch: 70, train_loss: 0.8098, test_loss: 1.1097, test_f1: 0.5517
 epoch: 71, train_loss: 0.8046, test_loss: 1.1085, test_f1: 0.5587
 epoch: 72, train_loss: 0.8012, test_loss: 1.1121, test_f1: 0.5585
 epoch: 73, train_loss: 0.8070, test_loss: 1.1115, test_f1: 0.5535
 epoch: 74, train_loss: 0.8056, test_loss: 1.1143, test_f1: 0.5717
 epoch: 75, train_loss: 0.8016, test_loss: 1.1180, test_f1: 0.5645
 epoch: 76, train_loss: 0.8166, test_loss: 1.1109, test_f1: 0.5642
 epoch: 77, train_loss: 0.8012, test_loss: 1.1146, test_f1: 0.5616
 epoch: 78, train_loss: 0.8007, test_loss: 1.1167, test_f1: 0.5616
 epoch: 79, train_loss: 0.7944, test_loss: 1.1223, test_f1: 0.5620
 epoch: 80, train_loss: 0.7804, test_loss: 1.1169, test_f1: 0.5795
 epoch: 81, train_loss: 0.7873, test_loss: 1.1138, test_f1: 0.5769
 epoch: 82, train_loss: 0.7861, test_loss: 1.1181, test_f1: 0.5537
 epoch: 83, train_loss: 0.7852, test_loss: 1.1187, test_f1: 0.5513
 epoch: 84, train_loss: 0.7810, test_loss: 1.1217, test_f1: 0.5541
 epoch: 85, train_loss: 0.7801, test_loss: 1.1273, test_f1: 0.5545
 epoch: 86, train_loss: 0.7745, test_loss: 1.1305, test_f1: 0.5600
 epoch: 87, train_loss: 0.7786, test_loss: 1.1292, test_f1: 0.5543
 epoch: 88, train_loss: 0.7798, test_loss: 1.1318, test_f1: 0.5464
 epoch: 89, train_loss: 0.7643, test_loss: 1.1366, test_f1: 0.5568
 epoch: 90, train_loss: 0.7792, test_loss: 1.1369, test_f1: 0.5540
 epoch: 91, train_loss: 0.7785, test_loss: 1.1257, test_f1: 0.5627
 epoch: 92, train_loss: 0.7751, test_loss: 1.1212, test_f1: 0.5750
 epoch: 93, train_loss: 0.7571, test_loss: 1.1280, test_f1: 0.5591
 epoch: 94, train_loss: 0.7476, test_loss: 1.1298, test_f1: 0.5642
 epoch: 95, train_loss: 0.7647, test_loss: 1.1387, test_f1: 0.5650
 epoch: 96, train_loss: 0.7533, test_loss: 1.1407, test_f1: 0.5626
 epoch: 97, train_loss: 0.7442, test_loss: 1.1351, test_f1: 0.5686
 epoch: 98, train_loss: 0.7600, test_loss: 1.1391, test_f1: 0.5752
 epoch: 99, train_loss: 0.7495, test_loss: 1.1372, test_f1: 0.5673
##################ITERATION #4 ****************************************
 epoch: 0, train_loss: 1.2805, test_loss: 1.3470, test_f1: 0.1384
 epoch: 1, train_loss: 1.2348, test_loss: 1.3343, test_f1: 0.2748
 epoch: 2, train_loss: 1.2144, test_loss: 1.3210, test_f1: 0.3406
 epoch: 3, train_loss: 1.1971, test_loss: 1.3063, test_f1: 0.3429
 epoch: 4, train_loss: 1.1679, test_loss: 1.2866, test_f1: 0.3465
 epoch: 5, train_loss: 1.1599, test_loss: 1.2704, test_f1: 0.3946
 epoch: 6, train_loss: 1.1497, test_loss: 1.2449, test_f1: 0.4430
 epoch: 7, train_loss: 1.1388, test_loss: 1.2244, test_f1: 0.4535
 epoch: 8, train_loss: 1.1116, test_loss: 1.2091, test_f1: 0.4635
 epoch: 9, train_loss: 1.1098, test_loss: 1.1914, test_f1: 0.4719
 epoch: 10, train_loss: 1.0891, test_loss: 1.1746, test_f1: 0.4812
 epoch: 11, train_loss: 1.0737, test_loss: 1.1594, test_f1: 0.4851
 epoch: 12, train_loss: 1.0720, test_loss: 1.1633, test_f1: 0.4877
 epoch: 13, train_loss: 1.0696, test_loss: 1.1597, test_f1: 0.4848
 epoch: 14, train_loss: 1.0491, test_loss: 1.1573, test_f1: 0.4665
 epoch: 15, train_loss: 1.0365, test_loss: 1.1513, test_f1: 0.4865
 epoch: 16, train_loss: 1.0366, test_loss: 1.1472, test_f1: 0.4724
 epoch: 17, train_loss: 1.0239, test_loss: 1.1436, test_f1: 0.4907
 epoch: 18, train_loss: 1.0076, test_loss: 1.1349, test_f1: 0.4907
 epoch: 19, train_loss: 1.0029, test_loss: 1.1282, test_f1: 0.5004
 epoch: 20, train_loss: 0.9952, test_loss: 1.1304, test_f1: 0.4980
 epoch: 21, train_loss: 0.9957, test_loss: 1.1301, test_f1: 0.4887
 epoch: 22, train_loss: 0.9885, test_loss: 1.1274, test_f1: 0.5041
 epoch: 23, train_loss: 0.9766, test_loss: 1.1158, test_f1: 0.5261
 epoch: 24, train_loss: 0.9664, test_loss: 1.1159, test_f1: 0.5171
 epoch: 25, train_loss: 0.9642, test_loss: 1.1118, test_f1: 0.5340
 epoch: 26, train_loss: 0.9612, test_loss: 1.1126, test_f1: 0.5263
 epoch: 27, train_loss: 0.9408, test_loss: 1.1168, test_f1: 0.5469
 epoch: 28, train_loss: 0.9366, test_loss: 1.1214, test_f1: 0.5377
 epoch: 29, train_loss: 0.9272, test_loss: 1.1306, test_f1: 0.5564
 epoch: 30, train_loss: 0.9254, test_loss: 1.1222, test_f1: 0.5373
 epoch: 31, train_loss: 0.9212, test_loss: 1.1115, test_f1: 0.5507
 epoch: 32, train_loss: 0.9269, test_loss: 1.1084, test_f1: 0.5495
 epoch: 33, train_loss: 0.9133, test_loss: 1.1095, test_f1: 0.5643
 epoch: 34, train_loss: 0.9011, test_loss: 1.1264, test_f1: 0.5447
 epoch: 35, train_loss: 0.8979, test_loss: 1.1290, test_f1: 0.5306
 epoch: 36, train_loss: 0.8918, test_loss: 1.1254, test_f1: 0.5569
 epoch: 37, train_loss: 0.8904, test_loss: 1.1114, test_f1: 0.5596
 epoch: 38, train_loss: 0.8813, test_loss: 1.1168, test_f1: 0.5820
 epoch: 39, train_loss: 0.8731, test_loss: 1.1125, test_f1: 0.5895
 epoch: 40, train_loss: 0.8772, test_loss: 1.1207, test_f1: 0.5710
 epoch: 41, train_loss: 0.8663, test_loss: 1.1270, test_f1: 0.5426
 epoch: 42, train_loss: 0.8572, test_loss: 1.1352, test_f1: 0.5691
 epoch: 43, train_loss: 0.8523, test_loss: 1.1237, test_f1: 0.5618
 epoch: 44, train_loss: 0.8592, test_loss: 1.1151, test_f1: 0.5593
 epoch: 45, train_loss: 0.8476, test_loss: 1.1249, test_f1: 0.5698
 epoch: 46, train_loss: 0.8314, test_loss: 1.1391, test_f1: 0.5793
 epoch: 47, train_loss: 0.8369, test_loss: 1.1457, test_f1: 0.5773
 epoch: 48, train_loss: 0.8253, test_loss: 1.1812, test_f1: 0.5373
 epoch: 49, train_loss: 0.8336, test_loss: 1.1699, test_f1: 0.5525
 epoch: 50, train_loss: 0.8336, test_loss: 1.1466, test_f1: 0.5456
 epoch: 51, train_loss: 0.8201, test_loss: 1.1707, test_f1: 0.5158
 epoch: 52, train_loss: 0.8245, test_loss: 1.1795, test_f1: 0.5174
 epoch: 53, train_loss: 0.8064, test_loss: 1.1819, test_f1: 0.5142
 epoch: 54, train_loss: 0.8044, test_loss: 1.2022, test_f1: 0.5070
 epoch: 55, train_loss: 0.7992, test_loss: 1.2194, test_f1: 0.5061
 epoch: 56, train_loss: 0.8053, test_loss: 1.2158, test_f1: 0.5186
 epoch: 57, train_loss: 0.7991, test_loss: 1.2143, test_f1: 0.5517
 epoch: 58, train_loss: 0.8066, test_loss: 1.2128, test_f1: 0.5225
 epoch: 59, train_loss: 0.8091, test_loss: 1.1842, test_f1: 0.5422
 epoch: 60, train_loss: 0.7964, test_loss: 1.1824, test_f1: 0.5146
 epoch: 61, train_loss: 0.8065, test_loss: 1.2119, test_f1: 0.5273
 epoch: 62, train_loss: 0.7900, test_loss: 1.2421, test_f1: 0.5455
 epoch: 63, train_loss: 0.7796, test_loss: 1.2333, test_f1: 0.5384
 epoch: 64, train_loss: 0.7931, test_loss: 1.2011, test_f1: 0.5406
 epoch: 65, train_loss: 0.7939, test_loss: 1.2062, test_f1: 0.5457
 epoch: 66, train_loss: 0.7834, test_loss: 1.1870, test_f1: 0.5454
 epoch: 67, train_loss: 0.7866, test_loss: 1.1973, test_f1: 0.5184
 epoch: 68, train_loss: 0.7813, test_loss: 1.2215, test_f1: 0.5297
 epoch: 69, train_loss: 0.7704, test_loss: 1.2143, test_f1: 0.5477
 epoch: 70, train_loss: 0.7725, test_loss: 1.2248, test_f1: 0.5476
 epoch: 71, train_loss: 0.7606, test_loss: 1.2147, test_f1: 0.5313
 epoch: 72, train_loss: 0.7830, test_loss: 1.2157, test_f1: 0.5406
 epoch: 73, train_loss: 0.7670, test_loss: 1.2269, test_f1: 0.5136
 epoch: 74, train_loss: 0.7666, test_loss: 1.2431, test_f1: 0.5063
 epoch: 75, train_loss: 0.7660, test_loss: 1.2287, test_f1: 0.5539
 epoch: 76, train_loss: 0.7660, test_loss: 1.2023, test_f1: 0.5427
 epoch: 77, train_loss: 0.7602, test_loss: 1.2347, test_f1: 0.5258
 epoch: 78, train_loss: 0.7582, test_loss: 1.2665, test_f1: 0.4794
 epoch: 79, train_loss: 0.7561, test_loss: 1.3021, test_f1: 0.4974
 epoch: 80, train_loss: 0.7614, test_loss: 1.2926, test_f1: 0.5559
 epoch: 81, train_loss: 0.7611, test_loss: 1.2771, test_f1: 0.5667
 epoch: 82, train_loss: 0.7544, test_loss: 1.2711, test_f1: 0.5567
 epoch: 83, train_loss: 0.7452, test_loss: 1.2339, test_f1: 0.5564
 epoch: 84, train_loss: 0.7464, test_loss: 1.2189, test_f1: 0.5609
 epoch: 85, train_loss: 0.7478, test_loss: 1.2661, test_f1: 0.5507
 epoch: 86, train_loss: 0.7442, test_loss: 1.3052, test_f1: 0.5560
 epoch: 87, train_loss: 0.7427, test_loss: 1.2802, test_f1: 0.5589
 epoch: 88, train_loss: 0.7382, test_loss: 1.2566, test_f1: 0.5562
 epoch: 89, train_loss: 0.7348, test_loss: 1.2672, test_f1: 0.5535
 epoch: 90, train_loss: 0.7435, test_loss: 1.2748, test_f1: 0.5036
 epoch: 91, train_loss: 0.7352, test_loss: 1.2402, test_f1: 0.5323
 epoch: 92, train_loss: 0.7383, test_loss: 1.2269, test_f1: 0.5452
 epoch: 93, train_loss: 0.7268, test_loss: 1.2509, test_f1: 0.5404
 epoch: 94, train_loss: 0.7273, test_loss: 1.2375, test_f1: 0.5479
 epoch: 95, train_loss: 0.7340, test_loss: 1.2609, test_f1: 0.5539
 epoch: 96, train_loss: 0.7321, test_loss: 1.2524, test_f1: 0.5565
 epoch: 97, train_loss: 0.7377, test_loss: 1.2652, test_f1: 0.5536
 epoch: 98, train_loss: 0.7300, test_loss: 1.2747, test_f1: 0.5506
 epoch: 99, train_loss: 0.7177, test_loss: 1.2759, test_f1: 0.5314
##################ITERATION #5 ****************************************
 epoch: 0, train_loss: 1.2752, test_loss: 1.3333, test_f1: 0.2446
 epoch: 1, train_loss: 1.2306, test_loss: 1.3290, test_f1: 0.3306
 epoch: 2, train_loss: 1.2158, test_loss: 1.3273, test_f1: 0.3313
 epoch: 3, train_loss: 1.1969, test_loss: 1.3285, test_f1: 0.3453
 epoch: 4, train_loss: 1.1789, test_loss: 1.3258, test_f1: 0.3667
 epoch: 5, train_loss: 1.1704, test_loss: 1.3115, test_f1: 0.4039
 epoch: 6, train_loss: 1.1556, test_loss: 1.2883, test_f1: 0.4224
 epoch: 7, train_loss: 1.1391, test_loss: 1.2652, test_f1: 0.4210
 epoch: 8, train_loss: 1.1311, test_loss: 1.2445, test_f1: 0.4221
 epoch: 9, train_loss: 1.1118, test_loss: 1.2258, test_f1: 0.4170
 epoch: 10, train_loss: 1.1031, test_loss: 1.2170, test_f1: 0.4097
 epoch: 11, train_loss: 1.1048, test_loss: 1.2113, test_f1: 0.4323
 epoch: 12, train_loss: 1.0902, test_loss: 1.2100, test_f1: 0.4314
 epoch: 13, train_loss: 1.0710, test_loss: 1.2099, test_f1: 0.4285
 epoch: 14, train_loss: 1.0580, test_loss: 1.2070, test_f1: 0.4367
 epoch: 15, train_loss: 1.0656, test_loss: 1.2088, test_f1: 0.4494
 epoch: 16, train_loss: 1.0467, test_loss: 1.2126, test_f1: 0.4607
 epoch: 17, train_loss: 1.0340, test_loss: 1.2070, test_f1: 0.4632
 epoch: 18, train_loss: 1.0227, test_loss: 1.1996, test_f1: 0.4604
 epoch: 19, train_loss: 1.0151, test_loss: 1.2024, test_f1: 0.4652
 epoch: 20, train_loss: 1.0110, test_loss: 1.2172, test_f1: 0.4671
 epoch: 21, train_loss: 1.0061, test_loss: 1.2174, test_f1: 0.4680
 epoch: 22, train_loss: 0.9991, test_loss: 1.2218, test_f1: 0.4929
 epoch: 23, train_loss: 0.9947, test_loss: 1.2285, test_f1: 0.4940
 epoch: 24, train_loss: 0.9759, test_loss: 1.2205, test_f1: 0.4844
 epoch: 25, train_loss: 0.9698, test_loss: 1.2264, test_f1: 0.4810
 epoch: 26, train_loss: 0.9677, test_loss: 1.2487, test_f1: 0.4930
 epoch: 27, train_loss: 0.9635, test_loss: 1.2439, test_f1: 0.5203
 epoch: 28, train_loss: 0.9418, test_loss: 1.2475, test_f1: 0.5188
 epoch: 29, train_loss: 0.9509, test_loss: 1.2504, test_f1: 0.5187
 epoch: 30, train_loss: 0.9360, test_loss: 1.2613, test_f1: 0.5142
 epoch: 31, train_loss: 0.9323, test_loss: 1.2351, test_f1: 0.5169
 epoch: 32, train_loss: 0.9326, test_loss: 1.2291, test_f1: 0.5284
 epoch: 33, train_loss: 0.9223, test_loss: 1.2470, test_f1: 0.5270
 epoch: 34, train_loss: 0.9142, test_loss: 1.2687, test_f1: 0.5114
 epoch: 35, train_loss: 0.9155, test_loss: 1.2957, test_f1: 0.5025
 epoch: 36, train_loss: 0.9121, test_loss: 1.2979, test_f1: 0.5144
 epoch: 37, train_loss: 0.8997, test_loss: 1.2775, test_f1: 0.5311
 epoch: 38, train_loss: 0.8930, test_loss: 1.2769, test_f1: 0.5390
 epoch: 39, train_loss: 0.8888, test_loss: 1.2670, test_f1: 0.5459
 epoch: 40, train_loss: 0.8868, test_loss: 1.2830, test_f1: 0.5241
 epoch: 41, train_loss: 0.8719, test_loss: 1.3011, test_f1: 0.4880
 epoch: 42, train_loss: 0.8741, test_loss: 1.3005, test_f1: 0.5037
 epoch: 43, train_loss: 0.8651, test_loss: 1.2681, test_f1: 0.5321
 epoch: 44, train_loss: 0.8512, test_loss: 1.2890, test_f1: 0.5322
 epoch: 45, train_loss: 0.8551, test_loss: 1.3124, test_f1: 0.5219
 epoch: 46, train_loss: 0.8450, test_loss: 1.3236, test_f1: 0.5052
 epoch: 47, train_loss: 0.8467, test_loss: 1.3078, test_f1: 0.5306
 epoch: 48, train_loss: 0.8375, test_loss: 1.3195, test_f1: 0.5199
 epoch: 49, train_loss: 0.8369, test_loss: 1.3565, test_f1: 0.4736
 epoch: 50, train_loss: 0.8396, test_loss: 1.3702, test_f1: 0.4854
 epoch: 51, train_loss: 0.8283, test_loss: 1.3560, test_f1: 0.5047
 epoch: 52, train_loss: 0.8267, test_loss: 1.3403, test_f1: 0.5171
 epoch: 53, train_loss: 0.8094, test_loss: 1.3417, test_f1: 0.5188
 epoch: 54, train_loss: 0.8148, test_loss: 1.3420, test_f1: 0.5248
 epoch: 55, train_loss: 0.8217, test_loss: 1.3362, test_f1: 0.5230
 epoch: 56, train_loss: 0.8204, test_loss: 1.3490, test_f1: 0.5047
 epoch: 57, train_loss: 0.8075, test_loss: 1.3480, test_f1: 0.5304
 epoch: 58, train_loss: 0.8129, test_loss: 1.3481, test_f1: 0.5284
 epoch: 59, train_loss: 0.8045, test_loss: 1.3611, test_f1: 0.5138
 epoch: 60, train_loss: 0.8050, test_loss: 1.3575, test_f1: 0.5118
 epoch: 61, train_loss: 0.7969, test_loss: 1.3375, test_f1: 0.5207
 epoch: 62, train_loss: 0.7983, test_loss: 1.3404, test_f1: 0.5330
 epoch: 63, train_loss: 0.7919, test_loss: 1.3503, test_f1: 0.5330
 epoch: 64, train_loss: 0.7859, test_loss: 1.3598, test_f1: 0.5356
 epoch: 65, train_loss: 0.7941, test_loss: 1.3617, test_f1: 0.5305
 epoch: 66, train_loss: 0.7936, test_loss: 1.3571, test_f1: 0.5470
 epoch: 67, train_loss: 0.7875, test_loss: 1.3586, test_f1: 0.5183
 epoch: 68, train_loss: 0.7828, test_loss: 1.3706, test_f1: 0.4933
 epoch: 69, train_loss: 0.7786, test_loss: 1.3787, test_f1: 0.4957
 epoch: 70, train_loss: 0.7802, test_loss: 1.3752, test_f1: 0.5113
 epoch: 71, train_loss: 0.7703, test_loss: 1.3530, test_f1: 0.5359
 epoch: 72, train_loss: 0.7791, test_loss: 1.3760, test_f1: 0.5376
 epoch: 73, train_loss: 0.7658, test_loss: 1.3689, test_f1: 0.5375
 epoch: 74, train_loss: 0.7670, test_loss: 1.3835, test_f1: 0.5193
 epoch: 75, train_loss: 0.7729, test_loss: 1.3715, test_f1: 0.5383
 epoch: 76, train_loss: 0.7673, test_loss: 1.3826, test_f1: 0.5506
 epoch: 77, train_loss: 0.7707, test_loss: 1.3834, test_f1: 0.5529
 epoch: 78, train_loss: 0.7643, test_loss: 1.3972, test_f1: 0.5424
 epoch: 79, train_loss: 0.7564, test_loss: 1.3960, test_f1: 0.5478
 epoch: 80, train_loss: 0.7614, test_loss: 1.3833, test_f1: 0.5460
 epoch: 81, train_loss: 0.7548, test_loss: 1.3878, test_f1: 0.5456
 epoch: 82, train_loss: 0.7535, test_loss: 1.3604, test_f1: 0.5593
 epoch: 83, train_loss: 0.7513, test_loss: 1.3858, test_f1: 0.5590
 epoch: 84, train_loss: 0.7479, test_loss: 1.3837, test_f1: 0.5388
 epoch: 85, train_loss: 0.7562, test_loss: 1.4147, test_f1: 0.5190
 epoch: 86, train_loss: 0.7447, test_loss: 1.4010, test_f1: 0.5422
 epoch: 87, train_loss: 0.7419, test_loss: 1.4124, test_f1: 0.5506
 epoch: 88, train_loss: 0.7477, test_loss: 1.3902, test_f1: 0.5440
 epoch: 89, train_loss: 0.7439, test_loss: 1.3800, test_f1: 0.5426
 epoch: 90, train_loss: 0.7382, test_loss: 1.4081, test_f1: 0.5472
 epoch: 91, train_loss: 0.7461, test_loss: 1.4505, test_f1: 0.5137
 epoch: 92, train_loss: 0.7421, test_loss: 1.4410, test_f1: 0.5160
 epoch: 93, train_loss: 0.7303, test_loss: 1.4413, test_f1: 0.5366
 epoch: 94, train_loss: 0.7292, test_loss: 1.4298, test_f1: 0.5396
 epoch: 95, train_loss: 0.7243, test_loss: 1.4133, test_f1: 0.5430
 epoch: 96, train_loss: 0.7134, test_loss: 1.4315, test_f1: 0.5477
 epoch: 97, train_loss: 0.7236, test_loss: 1.4398, test_f1: 0.5475
 epoch: 98, train_loss: 0.7144, test_loss: 1.4504, test_f1: 0.5484
 epoch: 99, train_loss: 0.7188, test_loss: 1.4306, test_f1: 0.5538
##################ITERATION #6 ****************************************
 epoch: 0, train_loss: 1.2912, test_loss: 1.3345, test_f1: 0.3098
 epoch: 1, train_loss: 1.2252, test_loss: 1.3353, test_f1: 0.3449
 epoch: 2, train_loss: 1.2159, test_loss: 1.3320, test_f1: 0.3321
 epoch: 3, train_loss: 1.1918, test_loss: 1.3328, test_f1: 0.3452
 epoch: 4, train_loss: 1.1752, test_loss: 1.3247, test_f1: 0.3239
 epoch: 5, train_loss: 1.1569, test_loss: 1.3121, test_f1: 0.3079
 epoch: 6, train_loss: 1.1487, test_loss: 1.2973, test_f1: 0.3446
 epoch: 7, train_loss: 1.1305, test_loss: 1.2713, test_f1: 0.3915
 epoch: 8, train_loss: 1.1172, test_loss: 1.2450, test_f1: 0.3968
 epoch: 9, train_loss: 1.1205, test_loss: 1.2353, test_f1: 0.4219
 epoch: 10, train_loss: 1.1120, test_loss: 1.2175, test_f1: 0.4289
 epoch: 11, train_loss: 1.0944, test_loss: 1.1959, test_f1: 0.4317
 epoch: 12, train_loss: 1.0990, test_loss: 1.1893, test_f1: 0.4505
 epoch: 13, train_loss: 1.0754, test_loss: 1.1905, test_f1: 0.4610
 epoch: 14, train_loss: 1.0694, test_loss: 1.1907, test_f1: 0.4575
 epoch: 15, train_loss: 1.0610, test_loss: 1.1902, test_f1: 0.4524
 epoch: 16, train_loss: 1.0502, test_loss: 1.1893, test_f1: 0.4644
 epoch: 17, train_loss: 1.0352, test_loss: 1.2058, test_f1: 0.4420
 epoch: 18, train_loss: 1.0293, test_loss: 1.2086, test_f1: 0.4622
 epoch: 19, train_loss: 1.0321, test_loss: 1.1976, test_f1: 0.4641
 epoch: 20, train_loss: 1.0120, test_loss: 1.1912, test_f1: 0.4739
 epoch: 21, train_loss: 1.0036, test_loss: 1.1919, test_f1: 0.4894
 epoch: 22, train_loss: 1.0079, test_loss: 1.1969, test_f1: 0.4897
 epoch: 23, train_loss: 0.9862, test_loss: 1.1907, test_f1: 0.4920
 epoch: 24, train_loss: 0.9800, test_loss: 1.1924, test_f1: 0.4925
 epoch: 25, train_loss: 0.9841, test_loss: 1.2032, test_f1: 0.5071
 epoch: 26, train_loss: 0.9678, test_loss: 1.2060, test_f1: 0.5030
 epoch: 27, train_loss: 0.9546, test_loss: 1.2006, test_f1: 0.5093
 epoch: 28, train_loss: 0.9403, test_loss: 1.1853, test_f1: 0.5142
 epoch: 29, train_loss: 0.9482, test_loss: 1.1614, test_f1: 0.5147
 epoch: 30, train_loss: 0.9372, test_loss: 1.1608, test_f1: 0.5218
 epoch: 31, train_loss: 0.9405, test_loss: 1.1555, test_f1: 0.5170
 epoch: 32, train_loss: 0.9301, test_loss: 1.1685, test_f1: 0.5122
 epoch: 33, train_loss: 0.9166, test_loss: 1.1737, test_f1: 0.5087
 epoch: 34, train_loss: 0.9199, test_loss: 1.1749, test_f1: 0.5124
 epoch: 35, train_loss: 0.9019, test_loss: 1.1690, test_f1: 0.5155
 epoch: 36, train_loss: 0.9079, test_loss: 1.1820, test_f1: 0.5100
 epoch: 37, train_loss: 0.8870, test_loss: 1.1800, test_f1: 0.5099
 epoch: 38, train_loss: 0.8851, test_loss: 1.2185, test_f1: 0.5076
 epoch: 39, train_loss: 0.8863, test_loss: 1.2129, test_f1: 0.5066
 epoch: 40, train_loss: 0.8944, test_loss: 1.2360, test_f1: 0.5018
 epoch: 41, train_loss: 0.8662, test_loss: 1.2268, test_f1: 0.5076
 epoch: 42, train_loss: 0.8673, test_loss: 1.2429, test_f1: 0.4807
 epoch: 43, train_loss: 0.8631, test_loss: 1.2487, test_f1: 0.4983
 epoch: 44, train_loss: 0.8621, test_loss: 1.2896, test_f1: 0.4918
 epoch: 45, train_loss: 0.8416, test_loss: 1.2734, test_f1: 0.5345
 epoch: 46, train_loss: 0.8520, test_loss: 1.2516, test_f1: 0.5379
 epoch: 47, train_loss: 0.8453, test_loss: 1.2105, test_f1: 0.5432
 epoch: 48, train_loss: 0.8406, test_loss: 1.2080, test_f1: 0.5258
 epoch: 49, train_loss: 0.8530, test_loss: 1.2173, test_f1: 0.5277
 epoch: 50, train_loss: 0.8369, test_loss: 1.2364, test_f1: 0.5411
 epoch: 51, train_loss: 0.8302, test_loss: 1.2640, test_f1: 0.5415
 epoch: 52, train_loss: 0.8255, test_loss: 1.3475, test_f1: 0.5308
 epoch: 53, train_loss: 0.8167, test_loss: 1.3307, test_f1: 0.5410
 epoch: 54, train_loss: 0.8143, test_loss: 1.3205, test_f1: 0.5359
 epoch: 55, train_loss: 0.8206, test_loss: 1.2603, test_f1: 0.5264
 epoch: 56, train_loss: 0.8145, test_loss: 1.2686, test_f1: 0.5218
 epoch: 57, train_loss: 0.8074, test_loss: 1.2826, test_f1: 0.5292
 epoch: 58, train_loss: 0.7991, test_loss: 1.3040, test_f1: 0.5478
 epoch: 59, train_loss: 0.8053, test_loss: 1.3696, test_f1: 0.5388
 epoch: 60, train_loss: 0.8052, test_loss: 1.3210, test_f1: 0.5470
 epoch: 61, train_loss: 0.8091, test_loss: 1.3241, test_f1: 0.5431
 epoch: 62, train_loss: 0.7994, test_loss: 1.3387, test_f1: 0.5337
 epoch: 63, train_loss: 0.8025, test_loss: 1.3101, test_f1: 0.5457
 epoch: 64, train_loss: 0.7963, test_loss: 1.3092, test_f1: 0.5387
 epoch: 65, train_loss: 0.7911, test_loss: 1.2986, test_f1: 0.5462
 epoch: 66, train_loss: 0.7904, test_loss: 1.2972, test_f1: 0.5322
 epoch: 67, train_loss: 0.7984, test_loss: 1.3036, test_f1: 0.5369
 epoch: 68, train_loss: 0.7938, test_loss: 1.3340, test_f1: 0.5342
 epoch: 69, train_loss: 0.7767, test_loss: 1.3213, test_f1: 0.5298
 epoch: 70, train_loss: 0.7891, test_loss: 1.3183, test_f1: 0.5273
 epoch: 71, train_loss: 0.7672, test_loss: 1.2895, test_f1: 0.5326
 epoch: 72, train_loss: 0.7763, test_loss: 1.3155, test_f1: 0.5278
 epoch: 73, train_loss: 0.7815, test_loss: 1.3299, test_f1: 0.5154
 epoch: 74, train_loss: 0.7708, test_loss: 1.3513, test_f1: 0.5179
 epoch: 75, train_loss: 0.7780, test_loss: 1.3485, test_f1: 0.5256
 epoch: 76, train_loss: 0.7845, test_loss: 1.3453, test_f1: 0.5160
 epoch: 77, train_loss: 0.7692, test_loss: 1.3263, test_f1: 0.5250
 epoch: 78, train_loss: 0.7737, test_loss: 1.3057, test_f1: 0.5123
 epoch: 79, train_loss: 0.7551, test_loss: 1.3078, test_f1: 0.5131
 epoch: 80, train_loss: 0.7678, test_loss: 1.3879, test_f1: 0.4949
 epoch: 81, train_loss: 0.7566, test_loss: 1.3733, test_f1: 0.5062
 epoch: 82, train_loss: 0.7647, test_loss: 1.3490, test_f1: 0.5281
 epoch: 83, train_loss: 0.7600, test_loss: 1.3338, test_f1: 0.5207
 epoch: 84, train_loss: 0.7548, test_loss: 1.3424, test_f1: 0.5227
 epoch: 85, train_loss: 0.7483, test_loss: 1.4111, test_f1: 0.5154
 epoch: 86, train_loss: 0.7529, test_loss: 1.4887, test_f1: 0.5191
 epoch: 87, train_loss: 0.7550, test_loss: 1.4064, test_f1: 0.5315
 epoch: 88, train_loss: 0.7578, test_loss: 1.3918, test_f1: 0.5312
 epoch: 89, train_loss: 0.7533, test_loss: 1.4184, test_f1: 0.5385
 epoch: 90, train_loss: 0.7526, test_loss: 1.4178, test_f1: 0.5413
 epoch: 91, train_loss: 0.7478, test_loss: 1.3949, test_f1: 0.5386
 epoch: 92, train_loss: 0.7425, test_loss: 1.4235, test_f1: 0.5277
 epoch: 93, train_loss: 0.7361, test_loss: 1.4333, test_f1: 0.5177
 epoch: 94, train_loss: 0.7368, test_loss: 1.4152, test_f1: 0.5281
 epoch: 95, train_loss: 0.7395, test_loss: 1.4616, test_f1: 0.5336
 epoch: 96, train_loss: 0.7318, test_loss: 1.4667, test_f1: 0.5308
 epoch: 97, train_loss: 0.7282, test_loss: 1.4294, test_f1: 0.5260
 epoch: 98, train_loss: 0.7364, test_loss: 1.4351, test_f1: 0.5256
 epoch: 99, train_loss: 0.7292, test_loss: 1.4377, test_f1: 0.5264
##################ITERATION #7 ****************************************
 epoch: 0, train_loss: 1.2927, test_loss: 1.3299, test_f1: 0.2442
 epoch: 1, train_loss: 1.2121, test_loss: 1.3222, test_f1: 0.3076
 epoch: 2, train_loss: 1.1929, test_loss: 1.3105, test_f1: 0.3307
 epoch: 3, train_loss: 1.1689, test_loss: 1.2946, test_f1: 0.3635
 epoch: 4, train_loss: 1.1521, test_loss: 1.2773, test_f1: 0.4021
 epoch: 5, train_loss: 1.1241, test_loss: 1.2564, test_f1: 0.4408
 epoch: 6, train_loss: 1.1231, test_loss: 1.2319, test_f1: 0.4418
 epoch: 7, train_loss: 1.1093, test_loss: 1.2122, test_f1: 0.4634
 epoch: 8, train_loss: 1.0864, test_loss: 1.1967, test_f1: 0.4703
 epoch: 9, train_loss: 1.0762, test_loss: 1.1811, test_f1: 0.4783
 epoch: 10, train_loss: 1.0543, test_loss: 1.1714, test_f1: 0.4746
 epoch: 11, train_loss: 1.0512, test_loss: 1.1650, test_f1: 0.4826
 epoch: 12, train_loss: 1.0399, test_loss: 1.1679, test_f1: 0.4896
 epoch: 13, train_loss: 1.0319, test_loss: 1.1661, test_f1: 0.4986
 epoch: 14, train_loss: 1.0248, test_loss: 1.1714, test_f1: 0.5065
 epoch: 15, train_loss: 1.0110, test_loss: 1.1733, test_f1: 0.5077
 epoch: 16, train_loss: 1.0001, test_loss: 1.1734, test_f1: 0.5042
 epoch: 17, train_loss: 1.0028, test_loss: 1.1755, test_f1: 0.4990
 epoch: 18, train_loss: 0.9833, test_loss: 1.1857, test_f1: 0.5292
 epoch: 19, train_loss: 0.9738, test_loss: 1.1901, test_f1: 0.5354
 epoch: 20, train_loss: 0.9793, test_loss: 1.1878, test_f1: 0.5457
 epoch: 21, train_loss: 0.9592, test_loss: 1.1873, test_f1: 0.5429
 epoch: 22, train_loss: 0.9674, test_loss: 1.1840, test_f1: 0.5315
 epoch: 23, train_loss: 0.9548, test_loss: 1.1814, test_f1: 0.5127
 epoch: 24, train_loss: 0.9372, test_loss: 1.1833, test_f1: 0.5304
 epoch: 25, train_loss: 0.9390, test_loss: 1.1942, test_f1: 0.5178
 epoch: 26, train_loss: 0.9311, test_loss: 1.1934, test_f1: 0.5625
 epoch: 27, train_loss: 0.9272, test_loss: 1.1839, test_f1: 0.5911
 epoch: 28, train_loss: 0.9149, test_loss: 1.1728, test_f1: 0.5902
 epoch: 29, train_loss: 0.9149, test_loss: 1.1644, test_f1: 0.5656
 epoch: 30, train_loss: 0.9067, test_loss: 1.1607, test_f1: 0.5657
 epoch: 31, train_loss: 0.9109, test_loss: 1.1729, test_f1: 0.5463
 epoch: 32, train_loss: 0.9028, test_loss: 1.1728, test_f1: 0.5777
 epoch: 33, train_loss: 0.8770, test_loss: 1.1621, test_f1: 0.5843
 epoch: 34, train_loss: 0.8813, test_loss: 1.1633, test_f1: 0.5689
 epoch: 35, train_loss: 0.8831, test_loss: 1.1641, test_f1: 0.5724
 epoch: 36, train_loss: 0.8664, test_loss: 1.1595, test_f1: 0.5658
 epoch: 37, train_loss: 0.8675, test_loss: 1.1475, test_f1: 0.5626
 epoch: 38, train_loss: 0.8635, test_loss: 1.1341, test_f1: 0.5938
 epoch: 39, train_loss: 0.8515, test_loss: 1.1423, test_f1: 0.5846
 epoch: 40, train_loss: 0.8495, test_loss: 1.1706, test_f1: 0.5607
 epoch: 41, train_loss: 0.8384, test_loss: 1.1914, test_f1: 0.5717
 epoch: 42, train_loss: 0.8540, test_loss: 1.2089, test_f1: 0.5690
 epoch: 43, train_loss: 0.8537, test_loss: 1.1957, test_f1: 0.5632
 epoch: 44, train_loss: 0.8294, test_loss: 1.2039, test_f1: 0.5585
 epoch: 45, train_loss: 0.8355, test_loss: 1.2316, test_f1: 0.5595
 epoch: 46, train_loss: 0.8213, test_loss: 1.2539, test_f1: 0.5548
 epoch: 47, train_loss: 0.8146, test_loss: 1.2360, test_f1: 0.5588
 epoch: 48, train_loss: 0.8204, test_loss: 1.1859, test_f1: 0.5510
 epoch: 49, train_loss: 0.8142, test_loss: 1.2100, test_f1: 0.5518
 epoch: 50, train_loss: 0.8160, test_loss: 1.2240, test_f1: 0.5545
 epoch: 51, train_loss: 0.7957, test_loss: 1.1937, test_f1: 0.5608
 epoch: 52, train_loss: 0.8139, test_loss: 1.2060, test_f1: 0.5586
 epoch: 53, train_loss: 0.7971, test_loss: 1.2294, test_f1: 0.5623
 epoch: 54, train_loss: 0.7878, test_loss: 1.2487, test_f1: 0.5583
 epoch: 55, train_loss: 0.7993, test_loss: 1.2437, test_f1: 0.5629
 epoch: 56, train_loss: 0.7920, test_loss: 1.2490, test_f1: 0.5660
 epoch: 57, train_loss: 0.7918, test_loss: 1.2392, test_f1: 0.5641
 epoch: 58, train_loss: 0.7824, test_loss: 1.2469, test_f1: 0.5685
 epoch: 59, train_loss: 0.7886, test_loss: 1.2360, test_f1: 0.5622
 epoch: 60, train_loss: 0.7813, test_loss: 1.2446, test_f1: 0.5589
 epoch: 61, train_loss: 0.7848, test_loss: 1.2573, test_f1: 0.5440
 epoch: 62, train_loss: 0.7751, test_loss: 1.2409, test_f1: 0.5570
 epoch: 63, train_loss: 0.7858, test_loss: 1.2378, test_f1: 0.5631
 epoch: 64, train_loss: 0.7728, test_loss: 1.2403, test_f1: 0.5532
 epoch: 65, train_loss: 0.7778, test_loss: 1.2451, test_f1: 0.5585
 epoch: 66, train_loss: 0.7700, test_loss: 1.2305, test_f1: 0.5616
 epoch: 67, train_loss: 0.7698, test_loss: 1.2340, test_f1: 0.5502
 epoch: 68, train_loss: 0.7630, test_loss: 1.2414, test_f1: 0.5471
 epoch: 69, train_loss: 0.7611, test_loss: 1.2633, test_f1: 0.5547
 epoch: 70, train_loss: 0.7570, test_loss: 1.2618, test_f1: 0.5601
 epoch: 71, train_loss: 0.7635, test_loss: 1.2489, test_f1: 0.5596
 epoch: 72, train_loss: 0.7593, test_loss: 1.2268, test_f1: 0.5572
 epoch: 73, train_loss: 0.7641, test_loss: 1.2230, test_f1: 0.5569
 epoch: 74, train_loss: 0.7577, test_loss: 1.2381, test_f1: 0.5573
 epoch: 75, train_loss: 0.7424, test_loss: 1.2488, test_f1: 0.5562
 epoch: 76, train_loss: 0.7599, test_loss: 1.2655, test_f1: 0.5564
 epoch: 77, train_loss: 0.7531, test_loss: 1.2721, test_f1: 0.5595
 epoch: 78, train_loss: 0.7457, test_loss: 1.2484, test_f1: 0.5609
 epoch: 79, train_loss: 0.7552, test_loss: 1.2536, test_f1: 0.5600
 epoch: 80, train_loss: 0.7467, test_loss: 1.2492, test_f1: 0.5525
 epoch: 81, train_loss: 0.7432, test_loss: 1.2386, test_f1: 0.5511
 epoch: 82, train_loss: 0.7331, test_loss: 1.2502, test_f1: 0.5507
 epoch: 83, train_loss: 0.7453, test_loss: 1.2602, test_f1: 0.5657
 epoch: 84, train_loss: 0.7374, test_loss: 1.2759, test_f1: 0.5599
 epoch: 85, train_loss: 0.7426, test_loss: 1.2882, test_f1: 0.5548
 epoch: 86, train_loss: 0.7397, test_loss: 1.2505, test_f1: 0.5622
 epoch: 87, train_loss: 0.7176, test_loss: 1.2700, test_f1: 0.5547
 epoch: 88, train_loss: 0.7284, test_loss: 1.2776, test_f1: 0.5556
 epoch: 89, train_loss: 0.7289, test_loss: 1.2610, test_f1: 0.5527
 epoch: 90, train_loss: 0.7161, test_loss: 1.2470, test_f1: 0.5599
 epoch: 91, train_loss: 0.7165, test_loss: 1.2616, test_f1: 0.5618
 epoch: 92, train_loss: 0.7116, test_loss: 1.2515, test_f1: 0.5550
 epoch: 93, train_loss: 0.7117, test_loss: 1.2609, test_f1: 0.5451
 epoch: 94, train_loss: 0.7381, test_loss: 1.2679, test_f1: 0.5502
 epoch: 95, train_loss: 0.7101, test_loss: 1.2780, test_f1: 0.5567
 epoch: 96, train_loss: 0.7084, test_loss: 1.2898, test_f1: 0.5608
 epoch: 97, train_loss: 0.7209, test_loss: 1.3114, test_f1: 0.5607
 epoch: 98, train_loss: 0.7180, test_loss: 1.2975, test_f1: 0.5642
 epoch: 99, train_loss: 0.7161, test_loss: 1.2917, test_f1: 0.5661
##################ITERATION #8 ****************************************
 epoch: 0, train_loss: 1.2544, test_loss: 1.3538, test_f1: 0.1500
 epoch: 1, train_loss: 1.1965, test_loss: 1.3345, test_f1: 0.2183
 epoch: 2, train_loss: 1.1715, test_loss: 1.3195, test_f1: 0.2872
 epoch: 3, train_loss: 1.1485, test_loss: 1.2975, test_f1: 0.3332
 epoch: 4, train_loss: 1.1317, test_loss: 1.2673, test_f1: 0.4203
 epoch: 5, train_loss: 1.1286, test_loss: 1.2363, test_f1: 0.4436
 epoch: 6, train_loss: 1.1120, test_loss: 1.2088, test_f1: 0.4474
 epoch: 7, train_loss: 1.0931, test_loss: 1.1824, test_f1: 0.4751
 epoch: 8, train_loss: 1.0786, test_loss: 1.1765, test_f1: 0.4629
 epoch: 9, train_loss: 1.0541, test_loss: 1.1704, test_f1: 0.4442
 epoch: 10, train_loss: 1.0485, test_loss: 1.1702, test_f1: 0.4814
 epoch: 11, train_loss: 1.0351, test_loss: 1.1746, test_f1: 0.4927
 epoch: 12, train_loss: 1.0373, test_loss: 1.1770, test_f1: 0.5001
 epoch: 13, train_loss: 1.0355, test_loss: 1.1643, test_f1: 0.4992
 epoch: 14, train_loss: 1.0143, test_loss: 1.1444, test_f1: 0.5075
 epoch: 15, train_loss: 1.0143, test_loss: 1.1377, test_f1: 0.5044
 epoch: 16, train_loss: 1.0021, test_loss: 1.1412, test_f1: 0.4999
 epoch: 17, train_loss: 0.9873, test_loss: 1.1340, test_f1: 0.5122
 epoch: 18, train_loss: 0.9815, test_loss: 1.1486, test_f1: 0.4904
 epoch: 19, train_loss: 0.9886, test_loss: 1.1632, test_f1: 0.4901
 epoch: 20, train_loss: 0.9583, test_loss: 1.1672, test_f1: 0.4901
 epoch: 21, train_loss: 0.9704, test_loss: 1.1615, test_f1: 0.5110
 epoch: 22, train_loss: 0.9601, test_loss: 1.1520, test_f1: 0.5240
 epoch: 23, train_loss: 0.9554, test_loss: 1.1447, test_f1: 0.5045
 epoch: 24, train_loss: 0.9479, test_loss: 1.1531, test_f1: 0.4960
 epoch: 25, train_loss: 0.9385, test_loss: 1.1518, test_f1: 0.4909
 epoch: 26, train_loss: 0.9354, test_loss: 1.1501, test_f1: 0.4948
 epoch: 27, train_loss: 0.9348, test_loss: 1.1577, test_f1: 0.5078
 epoch: 28, train_loss: 0.9214, test_loss: 1.1665, test_f1: 0.5236
 epoch: 29, train_loss: 0.9299, test_loss: 1.1721, test_f1: 0.5295
 epoch: 30, train_loss: 0.9181, test_loss: 1.1824, test_f1: 0.5094
 epoch: 31, train_loss: 0.9218, test_loss: 1.1878, test_f1: 0.4990
 epoch: 32, train_loss: 0.8974, test_loss: 1.2237, test_f1: 0.4943
 epoch: 33, train_loss: 0.9014, test_loss: 1.2047, test_f1: 0.4901
 epoch: 34, train_loss: 0.9025, test_loss: 1.2055, test_f1: 0.4786
 epoch: 35, train_loss: 0.9015, test_loss: 1.2117, test_f1: 0.4836
 epoch: 36, train_loss: 0.8835, test_loss: 1.2203, test_f1: 0.4786
 epoch: 37, train_loss: 0.8893, test_loss: 1.1808, test_f1: 0.4988
 epoch: 38, train_loss: 0.8872, test_loss: 1.1965, test_f1: 0.5209
 epoch: 39, train_loss: 0.8694, test_loss: 1.2138, test_f1: 0.5159
 epoch: 40, train_loss: 0.8666, test_loss: 1.2181, test_f1: 0.5074
 epoch: 41, train_loss: 0.8681, test_loss: 1.2218, test_f1: 0.5214
 epoch: 42, train_loss: 0.8622, test_loss: 1.2107, test_f1: 0.5097
 epoch: 43, train_loss: 0.8712, test_loss: 1.2026, test_f1: 0.5251
 epoch: 44, train_loss: 0.8683, test_loss: 1.2575, test_f1: 0.4796
 epoch: 45, train_loss: 0.8481, test_loss: 1.2531, test_f1: 0.4870
 epoch: 46, train_loss: 0.8543, test_loss: 1.2320, test_f1: 0.5030
 epoch: 47, train_loss: 0.8485, test_loss: 1.2138, test_f1: 0.5329
 epoch: 48, train_loss: 0.8332, test_loss: 1.2284, test_f1: 0.5297
 epoch: 49, train_loss: 0.8420, test_loss: 1.2016, test_f1: 0.5380
 epoch: 50, train_loss: 0.8299, test_loss: 1.2009, test_f1: 0.5299
 epoch: 51, train_loss: 0.8373, test_loss: 1.2168, test_f1: 0.5357
 epoch: 52, train_loss: 0.8310, test_loss: 1.2309, test_f1: 0.5273
 epoch: 53, train_loss: 0.8343, test_loss: 1.2514, test_f1: 0.5198
 epoch: 54, train_loss: 0.8169, test_loss: 1.2587, test_f1: 0.5251
 epoch: 55, train_loss: 0.8288, test_loss: 1.2566, test_f1: 0.5304
 epoch: 56, train_loss: 0.8165, test_loss: 1.2656, test_f1: 0.5162
 epoch: 57, train_loss: 0.8234, test_loss: 1.2599, test_f1: 0.5199
 epoch: 58, train_loss: 0.8257, test_loss: 1.2890, test_f1: 0.5010
 epoch: 59, train_loss: 0.8237, test_loss: 1.2709, test_f1: 0.5140
 epoch: 60, train_loss: 0.8113, test_loss: 1.2819, test_f1: 0.5305
 epoch: 61, train_loss: 0.8086, test_loss: 1.2751, test_f1: 0.5198
 epoch: 62, train_loss: 0.8075, test_loss: 1.2815, test_f1: 0.5330
 epoch: 63, train_loss: 0.8174, test_loss: 1.2750, test_f1: 0.5274
 epoch: 64, train_loss: 0.8016, test_loss: 1.2687, test_f1: 0.5386
 epoch: 65, train_loss: 0.8089, test_loss: 1.2613, test_f1: 0.5307
 epoch: 66, train_loss: 0.8048, test_loss: 1.2907, test_f1: 0.5037
 epoch: 67, train_loss: 0.8072, test_loss: 1.2845, test_f1: 0.5195
 epoch: 68, train_loss: 0.8023, test_loss: 1.2828, test_f1: 0.5112
 epoch: 69, train_loss: 0.7950, test_loss: 1.3027, test_f1: 0.5299
 epoch: 70, train_loss: 0.7968, test_loss: 1.2823, test_f1: 0.5327
 epoch: 71, train_loss: 0.7916, test_loss: 1.2933, test_f1: 0.5321
 epoch: 72, train_loss: 0.7879, test_loss: 1.2888, test_f1: 0.5281
 epoch: 73, train_loss: 0.8008, test_loss: 1.3002, test_f1: 0.5130
 epoch: 74, train_loss: 0.7844, test_loss: 1.3147, test_f1: 0.5176
 epoch: 75, train_loss: 0.7941, test_loss: 1.3205, test_f1: 0.5433
 epoch: 76, train_loss: 0.7896, test_loss: 1.3108, test_f1: 0.5272
 epoch: 77, train_loss: 0.8088, test_loss: 1.3179, test_f1: 0.5303
 epoch: 78, train_loss: 0.7830, test_loss: 1.3393, test_f1: 0.5255
 epoch: 79, train_loss: 0.7806, test_loss: 1.3750, test_f1: 0.4955
 epoch: 80, train_loss: 0.7917, test_loss: 1.3848, test_f1: 0.4995
 epoch: 81, train_loss: 0.7853, test_loss: 1.3648, test_f1: 0.5190
 epoch: 82, train_loss: 0.7697, test_loss: 1.3391, test_f1: 0.5274
 epoch: 83, train_loss: 0.7580, test_loss: 1.3240, test_f1: 0.5321
 epoch: 84, train_loss: 0.7671, test_loss: 1.3178, test_f1: 0.5294
 epoch: 85, train_loss: 0.7744, test_loss: 1.3147, test_f1: 0.5267
 epoch: 86, train_loss: 0.7661, test_loss: 1.3372, test_f1: 0.5348
 epoch: 87, train_loss: 0.7739, test_loss: 1.3346, test_f1: 0.5431
 epoch: 88, train_loss: 0.7686, test_loss: 1.3755, test_f1: 0.5572
 epoch: 89, train_loss: 0.7731, test_loss: 1.3683, test_f1: 0.5572
 epoch: 90, train_loss: 0.7619, test_loss: 1.3888, test_f1: 0.5623
 epoch: 91, train_loss: 0.7554, test_loss: 1.3799, test_f1: 0.5644
 epoch: 92, train_loss: 0.7599, test_loss: 1.3782, test_f1: 0.5563
 epoch: 93, train_loss: 0.7659, test_loss: 1.3885, test_f1: 0.5590
 epoch: 94, train_loss: 0.7554, test_loss: 1.3723, test_f1: 0.5768
 epoch: 95, train_loss: 0.7642, test_loss: 1.3995, test_f1: 0.5726
 epoch: 96, train_loss: 0.7687, test_loss: 1.3534, test_f1: 0.5680
 epoch: 97, train_loss: 0.7425, test_loss: 1.3434, test_f1: 0.5673
 epoch: 98, train_loss: 0.7587, test_loss: 1.3833, test_f1: 0.5691
 epoch: 99, train_loss: 0.7549, test_loss: 1.3875, test_f1: 0.5566
##################ITERATION #9 ****************************************
 epoch: 0, train_loss: 1.2383, test_loss: 1.3324, test_f1: 0.2514
 epoch: 1, train_loss: 1.1872, test_loss: 1.3379, test_f1: 0.3146
 epoch: 2, train_loss: 1.1694, test_loss: 1.3331, test_f1: 0.3146
 epoch: 3, train_loss: 1.1555, test_loss: 1.3241, test_f1: 0.3480
 epoch: 4, train_loss: 1.1306, test_loss: 1.3085, test_f1: 0.4131
 epoch: 5, train_loss: 1.1112, test_loss: 1.2829, test_f1: 0.4145
 epoch: 6, train_loss: 1.1190, test_loss: 1.2652, test_f1: 0.4186
 epoch: 7, train_loss: 1.0946, test_loss: 1.2490, test_f1: 0.4379
 epoch: 8, train_loss: 1.0853, test_loss: 1.2383, test_f1: 0.4614
 epoch: 9, train_loss: 1.0745, test_loss: 1.2329, test_f1: 0.4825
 epoch: 10, train_loss: 1.0568, test_loss: 1.2253, test_f1: 0.4900
 epoch: 11, train_loss: 1.0664, test_loss: 1.2252, test_f1: 0.4721
 epoch: 12, train_loss: 1.0467, test_loss: 1.2221, test_f1: 0.4870
 epoch: 13, train_loss: 1.0300, test_loss: 1.2468, test_f1: 0.4905
 epoch: 14, train_loss: 1.0296, test_loss: 1.2339, test_f1: 0.5130
 epoch: 15, train_loss: 1.0302, test_loss: 1.2234, test_f1: 0.5088
 epoch: 16, train_loss: 1.0193, test_loss: 1.2141, test_f1: 0.5038
 epoch: 17, train_loss: 1.0055, test_loss: 1.2142, test_f1: 0.5250
 epoch: 18, train_loss: 1.0046, test_loss: 1.2170, test_f1: 0.5291
 epoch: 19, train_loss: 0.9967, test_loss: 1.2188, test_f1: 0.5267
 epoch: 20, train_loss: 0.9846, test_loss: 1.2193, test_f1: 0.5569
 epoch: 21, train_loss: 0.9896, test_loss: 1.2248, test_f1: 0.5547
 epoch: 22, train_loss: 0.9666, test_loss: 1.2132, test_f1: 0.5459
 epoch: 23, train_loss: 0.9540, test_loss: 1.2169, test_f1: 0.5326
 epoch: 24, train_loss: 0.9549, test_loss: 1.2244, test_f1: 0.5409
 epoch: 25, train_loss: 0.9465, test_loss: 1.2229, test_f1: 0.5356
 epoch: 26, train_loss: 0.9463, test_loss: 1.2332, test_f1: 0.5327
 epoch: 27, train_loss: 0.9404, test_loss: 1.2525, test_f1: 0.5557
 epoch: 28, train_loss: 0.9458, test_loss: 1.2421, test_f1: 0.5537
 epoch: 29, train_loss: 0.9340, test_loss: 1.2469, test_f1: 0.5585
 epoch: 30, train_loss: 0.9241, test_loss: 1.2246, test_f1: 0.5694
 epoch: 31, train_loss: 0.9353, test_loss: 1.2443, test_f1: 0.5502
 epoch: 32, train_loss: 0.9082, test_loss: 1.2453, test_f1: 0.5331
 epoch: 33, train_loss: 0.9126, test_loss: 1.2276, test_f1: 0.5402
 epoch: 34, train_loss: 0.9096, test_loss: 1.2970, test_f1: 0.5103
 epoch: 35, train_loss: 0.8997, test_loss: 1.2932, test_f1: 0.5129
 epoch: 36, train_loss: 0.9019, test_loss: 1.2992, test_f1: 0.5365
 epoch: 37, train_loss: 0.8752, test_loss: 1.3172, test_f1: 0.5368
 epoch: 38, train_loss: 0.8885, test_loss: 1.2908, test_f1: 0.5232
 epoch: 39, train_loss: 0.8822, test_loss: 1.2278, test_f1: 0.5375
 epoch: 40, train_loss: 0.8771, test_loss: 1.2399, test_f1: 0.5434
 epoch: 41, train_loss: 0.8751, test_loss: 1.2568, test_f1: 0.5280
 epoch: 42, train_loss: 0.8689, test_loss: 1.2858, test_f1: 0.5303
 epoch: 43, train_loss: 0.8542, test_loss: 1.3038, test_f1: 0.5449
 epoch: 44, train_loss: 0.8517, test_loss: 1.2901, test_f1: 0.5220
 epoch: 45, train_loss: 0.8449, test_loss: 1.2722, test_f1: 0.5366
 epoch: 46, train_loss: 0.8537, test_loss: 1.2587, test_f1: 0.5204
 epoch: 47, train_loss: 0.8439, test_loss: 1.2616, test_f1: 0.5245
 epoch: 48, train_loss: 0.8320, test_loss: 1.2885, test_f1: 0.5313
 epoch: 49, train_loss: 0.8482, test_loss: 1.3091, test_f1: 0.5221
 epoch: 50, train_loss: 0.8310, test_loss: 1.3425, test_f1: 0.5186
 epoch: 51, train_loss: 0.8329, test_loss: 1.3690, test_f1: 0.5249
 epoch: 52, train_loss: 0.8236, test_loss: 1.3842, test_f1: 0.5308
 epoch: 53, train_loss: 0.8263, test_loss: 1.3766, test_f1: 0.5395
 epoch: 54, train_loss: 0.8314, test_loss: 1.3409, test_f1: 0.5340
 epoch: 55, train_loss: 0.8138, test_loss: 1.3687, test_f1: 0.5313
 epoch: 56, train_loss: 0.8338, test_loss: 1.3584, test_f1: 0.5362
 epoch: 57, train_loss: 0.8172, test_loss: 1.3680, test_f1: 0.5280
 epoch: 58, train_loss: 0.8129, test_loss: 1.3591, test_f1: 0.5395
 epoch: 59, train_loss: 0.8112, test_loss: 1.3419, test_f1: 0.5566
 epoch: 60, train_loss: 0.8005, test_loss: 1.3100, test_f1: 0.5514
 epoch: 61, train_loss: 0.8045, test_loss: 1.3192, test_f1: 0.5423
 epoch: 62, train_loss: 0.7989, test_loss: 1.3200, test_f1: 0.5124
 epoch: 63, train_loss: 0.7950, test_loss: 1.2977, test_f1: 0.5148
 epoch: 64, train_loss: 0.8097, test_loss: 1.3391, test_f1: 0.5237
 epoch: 65, train_loss: 0.7891, test_loss: 1.3569, test_f1: 0.4979
 epoch: 66, train_loss: 0.8019, test_loss: 1.3783, test_f1: 0.5103
 epoch: 67, train_loss: 0.7968, test_loss: 1.3723, test_f1: 0.5336
 epoch: 68, train_loss: 0.7853, test_loss: 1.3646, test_f1: 0.5535
 epoch: 69, train_loss: 0.7860, test_loss: 1.3563, test_f1: 0.5537
 epoch: 70, train_loss: 0.7898, test_loss: 1.3862, test_f1: 0.5348
 epoch: 71, train_loss: 0.7944, test_loss: 1.4042, test_f1: 0.5219
 epoch: 72, train_loss: 0.7905, test_loss: 1.3750, test_f1: 0.5089
 epoch: 73, train_loss: 0.7863, test_loss: 1.3884, test_f1: 0.5025
 epoch: 74, train_loss: 0.7869, test_loss: 1.3948, test_f1: 0.5103
 epoch: 75, train_loss: 0.7917, test_loss: 1.3829, test_f1: 0.5325
 epoch: 76, train_loss: 0.7769, test_loss: 1.3607, test_f1: 0.5562
 epoch: 77, train_loss: 0.7818, test_loss: 1.4001, test_f1: 0.5430
 epoch: 78, train_loss: 0.7799, test_loss: 1.3828, test_f1: 0.5402
 epoch: 79, train_loss: 0.7642, test_loss: 1.4057, test_f1: 0.5350
 epoch: 80, train_loss: 0.7742, test_loss: 1.3559, test_f1: 0.5416
 epoch: 81, train_loss: 0.7655, test_loss: 1.3699, test_f1: 0.5300
 epoch: 82, train_loss: 0.7720, test_loss: 1.4477, test_f1: 0.5016
 epoch: 83, train_loss: 0.7654, test_loss: 1.4040, test_f1: 0.5176
 epoch: 84, train_loss: 0.7634, test_loss: 1.4120, test_f1: 0.5265
 epoch: 85, train_loss: 0.7557, test_loss: 1.4010, test_f1: 0.5337
 epoch: 86, train_loss: 0.7662, test_loss: 1.4280, test_f1: 0.5420
 epoch: 87, train_loss: 0.7571, test_loss: 1.4448, test_f1: 0.5331
 epoch: 88, train_loss: 0.7621, test_loss: 1.4694, test_f1: 0.5143
 epoch: 89, train_loss: 0.7618, test_loss: 1.4532, test_f1: 0.5146
 epoch: 90, train_loss: 0.7600, test_loss: 1.4373, test_f1: 0.5118
 epoch: 91, train_loss: 0.7654, test_loss: 1.4227, test_f1: 0.5062
 epoch: 92, train_loss: 0.7456, test_loss: 1.4098, test_f1: 0.5171
 epoch: 93, train_loss: 0.7534, test_loss: 1.4109, test_f1: 0.5022
 epoch: 94, train_loss: 0.7514, test_loss: 1.4273, test_f1: 0.5167
 epoch: 95, train_loss: 0.7463, test_loss: 1.4729, test_f1: 0.5004
 epoch: 96, train_loss: 0.7395, test_loss: 1.4495, test_f1: 0.5304
 epoch: 97, train_loss: 0.7365, test_loss: 1.4707, test_f1: 0.5492
 epoch: 98, train_loss: 0.7341, test_loss: 1.4220, test_f1: 0.5384
 epoch: 99, train_loss: 0.7438, test_loss: 1.4755, test_f1: 0.5212

Training completed in 281.15 seconds
Best F1: 0.6107 at epoch 77
Mean F1 across iterations: 0.5718  0.0232
========================FINAL RESULTS================================
FEGIN weighted F1: 0.6107  0.0232
python main.py --data ltspice_demos --representation component_component --model FEGIN --layers 2 --hiddens 128 --batch_size 256 --lr 0.0001 --emb_size 128 --epochs 100 --save_appendix component_component_L2_H128_BS256_LR0.0001_E128 --no_val
-----



STDERR:
  File "main.py", line 370, in <module>
    main()
  File "main.py", line 254, in main
    dataset = dataset_class(
  File "/home/philip/projects/ltspice_examples_code_repo/Circuit-Completion-Using-GNNs/component_classification_with_link_prediction_head/evaluation/FEGIN/kernel/circuit_datasets.py", line 15, in __init__
    self.data, self.slices = torch.load(self.processed_paths[0])
  File "/home/philip/.local/lib/python3.8/site-packages/torch/serialization.py", line 1040, in load
    warnings.warn(
  File "/usr/lib/python3.8/warnings.py", line 109, in _showwarnmsg
    sw(msg.message, msg.category, msg.filename, msg.lineno,
  File "main.py", line 47, in warn_with_traceback
    traceback.print_stack(file=log)
/home/philip/projects/ltspice_examples_code_repo/Circuit-Completion-Using-GNNs/component_classification_with_link_prediction_head/evaluation/FEGIN/kernel/circuit_datasets.py:15: FutureWarning: You are using `torch.load` with `weights_only=False` (the current default value), which uses the default pickle module implicitly. It is possible to construct malicious pickle data which will execute arbitrary code during unpickling (See https://github.com/pytorch/pytorch/blob/main/SECURITY.md#untrusted-models for more details). In a future release, the default value for `weights_only` will be flipped to `True`. This limits the functions that could be executed during unpickling. Arbitrary objects will no longer be allowed to be loaded via this mode unless they are explicitly allowlisted by the user via `torch.serialization.add_safe_globals`. We recommend you start setting `weights_only=True` for any use case where you don't have full control of the loaded file. Please open an issue on GitHub for any issues related to this experimental feature.
  self.data, self.slices = torch.load(self.processed_paths[0])
