STDOUT:
Results will be saved in /home/philip/projects/llm_inference_code_repo/Circuit-Completion-Using-GNNs/component_classification_with_link_prediction_head/evaluation/FEGIN/results/model_FEGIN_dataset_ltspice_examples
Command line input: python main.py --data ltspice_examples --representation component_pin --model FEGIN --layers 2 --hiddens 128 --batch_size 32 --lr 0.0001 --emb_size 250 --epochs 100 --save_appendix component_pin_L2_H128_BS32_LR0.0001_E250 --no_val
 is saved.
-----
ltspice_examples - FEGIN
Using 2 layers, 128 hidden units, h = 2
Loading component_pin representation dataset
ENTERED
Training FEGIN on component_pin representation
Train: 3560, Test: 848
##################ITERATION #0 ****************************************
 epoch: 0, train_loss: 1.3337, test_loss: 1.2369, test_f1: 0.2260
 epoch: 1, train_loss: 1.2129, test_loss: 1.1544, test_f1: 0.3526
 epoch: 2, train_loss: 1.1429, test_loss: 1.0645, test_f1: 0.3596
 epoch: 3, train_loss: 1.0601, test_loss: 1.0252, test_f1: 0.3654
 epoch: 4, train_loss: 1.0169, test_loss: 1.0114, test_f1: 0.4327
 epoch: 5, train_loss: 0.9947, test_loss: 0.9970, test_f1: 0.4598
 epoch: 6, train_loss: 0.9792, test_loss: 0.9873, test_f1: 0.4824
 epoch: 7, train_loss: 0.9562, test_loss: 0.9593, test_f1: 0.5295
 epoch: 8, train_loss: 0.9402, test_loss: 0.9737, test_f1: 0.5270
 epoch: 9, train_loss: 0.9187, test_loss: 0.9333, test_f1: 0.5549
 epoch: 10, train_loss: 0.9062, test_loss: 0.9300, test_f1: 0.5470
 epoch: 11, train_loss: 0.8928, test_loss: 0.9292, test_f1: 0.5383
 epoch: 12, train_loss: 0.8791, test_loss: 0.9371, test_f1: 0.5141
 epoch: 13, train_loss: 0.8618, test_loss: 0.9300, test_f1: 0.5337
 epoch: 14, train_loss: 0.8597, test_loss: 0.9176, test_f1: 0.5315
 epoch: 15, train_loss: 0.8359, test_loss: 0.9017, test_f1: 0.5589
 epoch: 16, train_loss: 0.8195, test_loss: 0.9225, test_f1: 0.5208
 epoch: 17, train_loss: 0.8193, test_loss: 0.9402, test_f1: 0.5180
 epoch: 18, train_loss: 0.8112, test_loss: 0.8875, test_f1: 0.5544
 epoch: 19, train_loss: 0.7989, test_loss: 0.8960, test_f1: 0.5628
 epoch: 20, train_loss: 0.7887, test_loss: 0.9203, test_f1: 0.5579
 epoch: 21, train_loss: 0.7857, test_loss: 0.8825, test_f1: 0.5685
 epoch: 22, train_loss: 0.7732, test_loss: 0.8960, test_f1: 0.5478
 epoch: 23, train_loss: 0.7674, test_loss: 0.8952, test_f1: 0.5627
 epoch: 24, train_loss: 0.7585, test_loss: 0.8858, test_f1: 0.5810
 epoch: 25, train_loss: 0.7506, test_loss: 0.9027, test_f1: 0.5847
 epoch: 26, train_loss: 0.7432, test_loss: 0.8885, test_f1: 0.5821
 epoch: 27, train_loss: 0.7305, test_loss: 0.9040, test_f1: 0.5817
 epoch: 28, train_loss: 0.7292, test_loss: 0.8885, test_f1: 0.6090
 epoch: 29, train_loss: 0.7217, test_loss: 0.8796, test_f1: 0.5864
 epoch: 30, train_loss: 0.7216, test_loss: 0.8676, test_f1: 0.6008
 epoch: 31, train_loss: 0.7025, test_loss: 0.8775, test_f1: 0.6109
 epoch: 32, train_loss: 0.7002, test_loss: 0.8857, test_f1: 0.5871
 epoch: 33, train_loss: 0.6894, test_loss: 0.8905, test_f1: 0.5855
 epoch: 34, train_loss: 0.6885, test_loss: 0.8784, test_f1: 0.6131
 epoch: 35, train_loss: 0.6807, test_loss: 0.8965, test_f1: 0.5972
 epoch: 36, train_loss: 0.6688, test_loss: 0.8858, test_f1: 0.6089
 epoch: 37, train_loss: 0.6742, test_loss: 0.8939, test_f1: 0.6039
 epoch: 38, train_loss: 0.6643, test_loss: 0.8655, test_f1: 0.6082
 epoch: 39, train_loss: 0.6629, test_loss: 0.8962, test_f1: 0.6010
 epoch: 40, train_loss: 0.6533, test_loss: 0.8998, test_f1: 0.6140
 epoch: 41, train_loss: 0.6517, test_loss: 0.9054, test_f1: 0.6036
 epoch: 42, train_loss: 0.6418, test_loss: 0.8560, test_f1: 0.6098
 epoch: 43, train_loss: 0.6370, test_loss: 0.8801, test_f1: 0.6293
 epoch: 44, train_loss: 0.6467, test_loss: 0.8771, test_f1: 0.6148
 epoch: 45, train_loss: 0.6345, test_loss: 0.8568, test_f1: 0.6276
 epoch: 46, train_loss: 0.6173, test_loss: 0.9038, test_f1: 0.6127
 epoch: 47, train_loss: 0.6202, test_loss: 0.9387, test_f1: 0.6248
 epoch: 48, train_loss: 0.6207, test_loss: 0.8817, test_f1: 0.6295
 epoch: 49, train_loss: 0.6242, test_loss: 0.9170, test_f1: 0.6302
 epoch: 50, train_loss: 0.6010, test_loss: 0.9153, test_f1: 0.6355
 epoch: 51, train_loss: 0.5870, test_loss: 0.8805, test_f1: 0.6417
 epoch: 52, train_loss: 0.5867, test_loss: 0.8583, test_f1: 0.6389
 epoch: 53, train_loss: 0.5849, test_loss: 0.9085, test_f1: 0.6338
 epoch: 54, train_loss: 0.5841, test_loss: 0.8831, test_f1: 0.6298
 epoch: 55, train_loss: 0.5734, test_loss: 0.8997, test_f1: 0.6365
 epoch: 56, train_loss: 0.5769, test_loss: 0.9006, test_f1: 0.6311
 epoch: 57, train_loss: 0.5795, test_loss: 0.8774, test_f1: 0.6381
 epoch: 58, train_loss: 0.5668, test_loss: 0.9156, test_f1: 0.6254
 epoch: 59, train_loss: 0.5689, test_loss: 0.9252, test_f1: 0.6320
 epoch: 60, train_loss: 0.5688, test_loss: 0.9036, test_f1: 0.6163
 epoch: 61, train_loss: 0.5601, test_loss: 0.9379, test_f1: 0.6453
 epoch: 62, train_loss: 0.5669, test_loss: 0.9299, test_f1: 0.6431
 epoch: 63, train_loss: 0.5542, test_loss: 0.9059, test_f1: 0.6419
 epoch: 64, train_loss: 0.5665, test_loss: 0.8803, test_f1: 0.6509
 epoch: 65, train_loss: 0.5587, test_loss: 0.9308, test_f1: 0.6475
 epoch: 66, train_loss: 0.5418, test_loss: 0.9251, test_f1: 0.6558
 epoch: 67, train_loss: 0.5503, test_loss: 0.8941, test_f1: 0.6477
 epoch: 68, train_loss: 0.5464, test_loss: 0.8853, test_f1: 0.6619
 epoch: 69, train_loss: 0.5442, test_loss: 0.9089, test_f1: 0.6508
 epoch: 70, train_loss: 0.5537, test_loss: 0.8884, test_f1: 0.6578
 epoch: 71, train_loss: 0.5446, test_loss: 0.8979, test_f1: 0.6566
 epoch: 72, train_loss: 0.5382, test_loss: 0.9553, test_f1: 0.6432
 epoch: 73, train_loss: 0.5291, test_loss: 0.9409, test_f1: 0.6528
 epoch: 74, train_loss: 0.5289, test_loss: 0.8948, test_f1: 0.6543
 epoch: 75, train_loss: 0.5268, test_loss: 0.9151, test_f1: 0.6513
 epoch: 76, train_loss: 0.5322, test_loss: 0.9497, test_f1: 0.6598
 epoch: 77, train_loss: 0.5411, test_loss: 0.9412, test_f1: 0.6396
 epoch: 78, train_loss: 0.5219, test_loss: 0.9609, test_f1: 0.6426
 epoch: 79, train_loss: 0.5329, test_loss: 0.9381, test_f1: 0.6490
 epoch: 80, train_loss: 0.5272, test_loss: 0.9314, test_f1: 0.6537
 epoch: 81, train_loss: 0.5227, test_loss: 0.9168, test_f1: 0.6635
 epoch: 82, train_loss: 0.5149, test_loss: 0.9685, test_f1: 0.6564
 epoch: 83, train_loss: 0.5211, test_loss: 0.9580, test_f1: 0.6446
 epoch: 84, train_loss: 0.5156, test_loss: 0.9488, test_f1: 0.6456
 epoch: 85, train_loss: 0.5159, test_loss: 0.9916, test_f1: 0.6536
 epoch: 86, train_loss: 0.5057, test_loss: 0.9705, test_f1: 0.6454
 epoch: 87, train_loss: 0.5151, test_loss: 0.9850, test_f1: 0.6430
 epoch: 88, train_loss: 0.4976, test_loss: 0.9462, test_f1: 0.6528
 epoch: 89, train_loss: 0.5034, test_loss: 0.9431, test_f1: 0.6650
 epoch: 90, train_loss: 0.5125, test_loss: 0.9108, test_f1: 0.6494
 epoch: 91, train_loss: 0.5127, test_loss: 0.9195, test_f1: 0.6671
 epoch: 92, train_loss: 0.4978, test_loss: 0.9689, test_f1: 0.6539
 epoch: 93, train_loss: 0.4942, test_loss: 0.9542, test_f1: 0.6534
 epoch: 94, train_loss: 0.4942, test_loss: 0.9723, test_f1: 0.6506
 epoch: 95, train_loss: 0.4939, test_loss: 0.9892, test_f1: 0.6370
 epoch: 96, train_loss: 0.4901, test_loss: 1.0280, test_f1: 0.6440
 epoch: 97, train_loss: 0.4847, test_loss: 0.9831, test_f1: 0.6582
 epoch: 98, train_loss: 0.4704, test_loss: 0.9562, test_f1: 0.6391
 epoch: 99, train_loss: 0.4918, test_loss: 1.0001, test_f1: 0.6470
##################ITERATION #1 ****************************************
 epoch: 0, train_loss: 1.2230, test_loss: 1.0421, test_f1: 0.3989
 epoch: 1, train_loss: 1.0391, test_loss: 0.9986, test_f1: 0.4632
 epoch: 2, train_loss: 0.9942, test_loss: 0.9553, test_f1: 0.4951
 epoch: 3, train_loss: 0.9623, test_loss: 0.9340, test_f1: 0.5199
 epoch: 4, train_loss: 0.9347, test_loss: 0.9507, test_f1: 0.5001
 epoch: 5, train_loss: 0.9038, test_loss: 0.8959, test_f1: 0.5123
 epoch: 6, train_loss: 0.8918, test_loss: 0.9087, test_f1: 0.5285
 epoch: 7, train_loss: 0.8650, test_loss: 0.8688, test_f1: 0.5170
 epoch: 8, train_loss: 0.8543, test_loss: 0.8753, test_f1: 0.5477
 epoch: 9, train_loss: 0.8425, test_loss: 0.8627, test_f1: 0.5629
 epoch: 10, train_loss: 0.8263, test_loss: 0.8354, test_f1: 0.5745
 epoch: 11, train_loss: 0.8180, test_loss: 0.8564, test_f1: 0.5644
 epoch: 12, train_loss: 0.8111, test_loss: 0.8515, test_f1: 0.5543
 epoch: 13, train_loss: 0.7960, test_loss: 0.8497, test_f1: 0.5558
 epoch: 14, train_loss: 0.7780, test_loss: 0.8226, test_f1: 0.5705
 epoch: 15, train_loss: 0.7663, test_loss: 0.8516, test_f1: 0.5656
 epoch: 16, train_loss: 0.7605, test_loss: 0.8460, test_f1: 0.5499
 epoch: 17, train_loss: 0.7524, test_loss: 0.8364, test_f1: 0.5863
 epoch: 18, train_loss: 0.7413, test_loss: 0.8334, test_f1: 0.5955
 epoch: 19, train_loss: 0.7280, test_loss: 0.8378, test_f1: 0.5746
 epoch: 20, train_loss: 0.7181, test_loss: 0.8496, test_f1: 0.5790
 epoch: 21, train_loss: 0.7115, test_loss: 0.8366, test_f1: 0.5772
 epoch: 22, train_loss: 0.6998, test_loss: 0.8303, test_f1: 0.5875
 epoch: 23, train_loss: 0.6986, test_loss: 0.8460, test_f1: 0.6046
 epoch: 24, train_loss: 0.6789, test_loss: 0.8528, test_f1: 0.5933
 epoch: 25, train_loss: 0.6769, test_loss: 0.8146, test_f1: 0.6147
 epoch: 26, train_loss: 0.6768, test_loss: 0.8219, test_f1: 0.5968
 epoch: 27, train_loss: 0.6763, test_loss: 0.8206, test_f1: 0.6164
 epoch: 28, train_loss: 0.6657, test_loss: 0.8207, test_f1: 0.6186
 epoch: 29, train_loss: 0.6573, test_loss: 0.8648, test_f1: 0.6052
 epoch: 30, train_loss: 0.6518, test_loss: 0.8390, test_f1: 0.6195
 epoch: 31, train_loss: 0.6528, test_loss: 0.7948, test_f1: 0.6416
 epoch: 32, train_loss: 0.6377, test_loss: 0.8032, test_f1: 0.6478
 epoch: 33, train_loss: 0.6167, test_loss: 0.8385, test_f1: 0.6463
 epoch: 34, train_loss: 0.6335, test_loss: 0.8586, test_f1: 0.6001
 epoch: 35, train_loss: 0.6221, test_loss: 0.8232, test_f1: 0.6354
 epoch: 36, train_loss: 0.6196, test_loss: 0.7996, test_f1: 0.6383
 epoch: 37, train_loss: 0.6260, test_loss: 0.7914, test_f1: 0.6579
 epoch: 38, train_loss: 0.6069, test_loss: 0.8391, test_f1: 0.6226
 epoch: 39, train_loss: 0.6046, test_loss: 0.8529, test_f1: 0.6145
 epoch: 40, train_loss: 0.5871, test_loss: 0.8324, test_f1: 0.6329
 epoch: 41, train_loss: 0.5806, test_loss: 0.8131, test_f1: 0.6554
 epoch: 42, train_loss: 0.5866, test_loss: 0.8566, test_f1: 0.6252
 epoch: 43, train_loss: 0.5787, test_loss: 0.8325, test_f1: 0.6380
 epoch: 44, train_loss: 0.5778, test_loss: 0.8682, test_f1: 0.6400
 epoch: 45, train_loss: 0.5622, test_loss: 0.8616, test_f1: 0.6427
 epoch: 46, train_loss: 0.5660, test_loss: 0.8556, test_f1: 0.6674
 epoch: 47, train_loss: 0.5519, test_loss: 0.9022, test_f1: 0.6524
 epoch: 48, train_loss: 0.5656, test_loss: 0.8461, test_f1: 0.6480
 epoch: 49, train_loss: 0.5521, test_loss: 0.8889, test_f1: 0.6467
 epoch: 50, train_loss: 0.5478, test_loss: 0.8928, test_f1: 0.6334
 epoch: 51, train_loss: 0.5353, test_loss: 0.8518, test_f1: 0.6541
 epoch: 52, train_loss: 0.5276, test_loss: 0.8349, test_f1: 0.6588
 epoch: 53, train_loss: 0.5192, test_loss: 0.8605, test_f1: 0.6483
 epoch: 54, train_loss: 0.5226, test_loss: 0.8243, test_f1: 0.6680
 epoch: 55, train_loss: 0.5031, test_loss: 0.8488, test_f1: 0.6532
 epoch: 56, train_loss: 0.5179, test_loss: 0.8771, test_f1: 0.6629
 epoch: 57, train_loss: 0.5001, test_loss: 0.8471, test_f1: 0.6496
 epoch: 58, train_loss: 0.5143, test_loss: 0.9151, test_f1: 0.6395
 epoch: 59, train_loss: 0.5115, test_loss: 0.8464, test_f1: 0.6691
 epoch: 60, train_loss: 0.4960, test_loss: 0.8669, test_f1: 0.6512
 epoch: 61, train_loss: 0.4964, test_loss: 0.8912, test_f1: 0.6461
 epoch: 62, train_loss: 0.4876, test_loss: 0.8822, test_f1: 0.6720
 epoch: 63, train_loss: 0.5006, test_loss: 0.9014, test_f1: 0.6466
 epoch: 64, train_loss: 0.4962, test_loss: 0.9376, test_f1: 0.6186
 epoch: 65, train_loss: 0.4933, test_loss: 0.8773, test_f1: 0.6510
 epoch: 66, train_loss: 0.4860, test_loss: 0.9265, test_f1: 0.6338
 epoch: 67, train_loss: 0.4903, test_loss: 0.9485, test_f1: 0.6466
 epoch: 68, train_loss: 0.4941, test_loss: 0.8891, test_f1: 0.6550
 epoch: 69, train_loss: 0.4735, test_loss: 0.9318, test_f1: 0.6464
 epoch: 70, train_loss: 0.4928, test_loss: 0.8972, test_f1: 0.6532
 epoch: 71, train_loss: 0.4775, test_loss: 0.8927, test_f1: 0.6628
 epoch: 72, train_loss: 0.4785, test_loss: 0.8873, test_f1: 0.6591
 epoch: 73, train_loss: 0.4713, test_loss: 0.8706, test_f1: 0.6650
 epoch: 74, train_loss: 0.4626, test_loss: 0.8708, test_f1: 0.6473
 epoch: 75, train_loss: 0.4622, test_loss: 0.9306, test_f1: 0.6442
 epoch: 76, train_loss: 0.4704, test_loss: 0.9276, test_f1: 0.6539
 epoch: 77, train_loss: 0.4700, test_loss: 0.9289, test_f1: 0.6395
 epoch: 78, train_loss: 0.4679, test_loss: 0.9056, test_f1: 0.6531
 epoch: 79, train_loss: 0.4532, test_loss: 0.9241, test_f1: 0.6421
 epoch: 80, train_loss: 0.4733, test_loss: 0.9217, test_f1: 0.6542
 epoch: 81, train_loss: 0.4733, test_loss: 0.9735, test_f1: 0.6420
 epoch: 82, train_loss: 0.4545, test_loss: 0.9527, test_f1: 0.6438
 epoch: 83, train_loss: 0.4583, test_loss: 0.9231, test_f1: 0.6506
 epoch: 84, train_loss: 0.4521, test_loss: 1.0001, test_f1: 0.6369
 epoch: 85, train_loss: 0.4576, test_loss: 0.9495, test_f1: 0.6468
 epoch: 86, train_loss: 0.4534, test_loss: 0.9687, test_f1: 0.6309
 epoch: 87, train_loss: 0.4482, test_loss: 0.9774, test_f1: 0.6413
 epoch: 88, train_loss: 0.4270, test_loss: 0.9692, test_f1: 0.6415
 epoch: 89, train_loss: 0.4532, test_loss: 1.0640, test_f1: 0.6251
 epoch: 90, train_loss: 0.4440, test_loss: 0.9434, test_f1: 0.6453
 epoch: 91, train_loss: 0.4359, test_loss: 0.9918, test_f1: 0.6475
 epoch: 92, train_loss: 0.4372, test_loss: 0.9147, test_f1: 0.6489
 epoch: 93, train_loss: 0.4311, test_loss: 0.9936, test_f1: 0.6337
 epoch: 94, train_loss: 0.4317, test_loss: 0.9997, test_f1: 0.6453
 epoch: 95, train_loss: 0.4409, test_loss: 1.0015, test_f1: 0.6392
 epoch: 96, train_loss: 0.4304, test_loss: 1.0583, test_f1: 0.6308
 epoch: 97, train_loss: 0.4268, test_loss: 0.9804, test_f1: 0.6391
 epoch: 98, train_loss: 0.4265, test_loss: 1.0170, test_f1: 0.6325
 epoch: 99, train_loss: 0.4317, test_loss: 0.9847, test_f1: 0.6424
##################ITERATION #2 ****************************************
 epoch: 0, train_loss: 1.1796, test_loss: 1.0330, test_f1: 0.4093
 epoch: 1, train_loss: 1.0411, test_loss: 1.0113, test_f1: 0.4755
 epoch: 2, train_loss: 1.0113, test_loss: 0.9863, test_f1: 0.5182
 epoch: 3, train_loss: 0.9760, test_loss: 0.9678, test_f1: 0.5326
 epoch: 4, train_loss: 0.9465, test_loss: 0.9462, test_f1: 0.5421
 epoch: 5, train_loss: 0.9241, test_loss: 0.9177, test_f1: 0.5363
 epoch: 6, train_loss: 0.9102, test_loss: 0.9281, test_f1: 0.5354
 epoch: 7, train_loss: 0.8959, test_loss: 0.9164, test_f1: 0.5209
 epoch: 8, train_loss: 0.8763, test_loss: 0.9248, test_f1: 0.5334
 epoch: 9, train_loss: 0.8544, test_loss: 0.8623, test_f1: 0.5525
 epoch: 10, train_loss: 0.8417, test_loss: 0.8743, test_f1: 0.5426
 epoch: 11, train_loss: 0.8365, test_loss: 0.9036, test_f1: 0.5467
 epoch: 12, train_loss: 0.8303, test_loss: 0.8625, test_f1: 0.5466
 epoch: 13, train_loss: 0.8092, test_loss: 0.8508, test_f1: 0.5719
 epoch: 14, train_loss: 0.7997, test_loss: 0.8311, test_f1: 0.5779
 epoch: 15, train_loss: 0.7950, test_loss: 0.8596, test_f1: 0.5949
 epoch: 16, train_loss: 0.7846, test_loss: 0.8265, test_f1: 0.5829
 epoch: 17, train_loss: 0.7605, test_loss: 0.8437, test_f1: 0.5790
 epoch: 18, train_loss: 0.7709, test_loss: 0.8233, test_f1: 0.5771
 epoch: 19, train_loss: 0.7488, test_loss: 0.8334, test_f1: 0.5687
 epoch: 20, train_loss: 0.7429, test_loss: 0.8583, test_f1: 0.5921
 epoch: 21, train_loss: 0.7478, test_loss: 0.7997, test_f1: 0.5787
 epoch: 22, train_loss: 0.7417, test_loss: 0.8257, test_f1: 0.5988
 epoch: 23, train_loss: 0.7238, test_loss: 0.8438, test_f1: 0.5881
 epoch: 24, train_loss: 0.7264, test_loss: 0.7541, test_f1: 0.6087
 epoch: 25, train_loss: 0.7156, test_loss: 0.7909, test_f1: 0.5870
 epoch: 26, train_loss: 0.7090, test_loss: 0.8069, test_f1: 0.6189
 epoch: 27, train_loss: 0.6925, test_loss: 0.8077, test_f1: 0.6180
 epoch: 28, train_loss: 0.6958, test_loss: 0.8278, test_f1: 0.6125
 epoch: 29, train_loss: 0.6852, test_loss: 0.7939, test_f1: 0.6145
 epoch: 30, train_loss: 0.6878, test_loss: 0.7515, test_f1: 0.6229
 epoch: 31, train_loss: 0.6712, test_loss: 0.8026, test_f1: 0.6105
 epoch: 32, train_loss: 0.6808, test_loss: 0.7677, test_f1: 0.6344
 epoch: 33, train_loss: 0.6746, test_loss: 0.7678, test_f1: 0.6382
 epoch: 34, train_loss: 0.6563, test_loss: 0.7998, test_f1: 0.6072
 epoch: 35, train_loss: 0.6594, test_loss: 0.7622, test_f1: 0.6401
 epoch: 36, train_loss: 0.6536, test_loss: 0.7938, test_f1: 0.6226
 epoch: 37, train_loss: 0.6376, test_loss: 0.7481, test_f1: 0.6318
 epoch: 38, train_loss: 0.6345, test_loss: 0.8117, test_f1: 0.6590
 epoch: 39, train_loss: 0.6411, test_loss: 0.8243, test_f1: 0.6216
 epoch: 40, train_loss: 0.6279, test_loss: 0.7844, test_f1: 0.6547
 epoch: 41, train_loss: 0.6198, test_loss: 0.8197, test_f1: 0.6326
 epoch: 42, train_loss: 0.6184, test_loss: 0.8871, test_f1: 0.6351
 epoch: 43, train_loss: 0.6156, test_loss: 0.8214, test_f1: 0.6267
 epoch: 44, train_loss: 0.6109, test_loss: 0.8354, test_f1: 0.6424
 epoch: 45, train_loss: 0.6207, test_loss: 0.8082, test_f1: 0.6488
 epoch: 46, train_loss: 0.5941, test_loss: 0.8441, test_f1: 0.6413
 epoch: 47, train_loss: 0.5955, test_loss: 0.8634, test_f1: 0.6555
 epoch: 48, train_loss: 0.5929, test_loss: 0.8122, test_f1: 0.6432
 epoch: 49, train_loss: 0.6038, test_loss: 0.8342, test_f1: 0.6309
 epoch: 50, train_loss: 0.5852, test_loss: 0.8864, test_f1: 0.6410
 epoch: 51, train_loss: 0.5748, test_loss: 0.8050, test_f1: 0.6450
 epoch: 52, train_loss: 0.5702, test_loss: 0.8472, test_f1: 0.6356
 epoch: 53, train_loss: 0.5494, test_loss: 0.7923, test_f1: 0.6593
 epoch: 54, train_loss: 0.5688, test_loss: 0.8450, test_f1: 0.6395
 epoch: 55, train_loss: 0.5666, test_loss: 0.8287, test_f1: 0.6548
 epoch: 56, train_loss: 0.5477, test_loss: 0.7452, test_f1: 0.6623
 epoch: 57, train_loss: 0.5516, test_loss: 0.7943, test_f1: 0.6708
 epoch: 58, train_loss: 0.5484, test_loss: 0.8131, test_f1: 0.6806
 epoch: 59, train_loss: 0.5448, test_loss: 0.8660, test_f1: 0.6653
 epoch: 60, train_loss: 0.5543, test_loss: 0.8330, test_f1: 0.6728
 epoch: 61, train_loss: 0.5503, test_loss: 0.8302, test_f1: 0.6687
 epoch: 62, train_loss: 0.5425, test_loss: 0.7970, test_f1: 0.6765
 epoch: 63, train_loss: 0.5327, test_loss: 0.7996, test_f1: 0.6762
 epoch: 64, train_loss: 0.5382, test_loss: 0.7856, test_f1: 0.6589
 epoch: 65, train_loss: 0.5360, test_loss: 0.8594, test_f1: 0.6541
 epoch: 66, train_loss: 0.5276, test_loss: 0.8234, test_f1: 0.6629
 epoch: 67, train_loss: 0.5481, test_loss: 0.8335, test_f1: 0.6654
 epoch: 68, train_loss: 0.5362, test_loss: 0.8039, test_f1: 0.6677
 epoch: 69, train_loss: 0.5259, test_loss: 0.8245, test_f1: 0.6615
 epoch: 70, train_loss: 0.5205, test_loss: 0.9085, test_f1: 0.6319
 epoch: 71, train_loss: 0.5229, test_loss: 0.8363, test_f1: 0.6510
 epoch: 72, train_loss: 0.5158, test_loss: 0.8628, test_f1: 0.6651
 epoch: 73, train_loss: 0.5119, test_loss: 0.8496, test_f1: 0.6774
 epoch: 74, train_loss: 0.5211, test_loss: 0.7849, test_f1: 0.6772
 epoch: 75, train_loss: 0.5220, test_loss: 0.8344, test_f1: 0.6704
 epoch: 76, train_loss: 0.5101, test_loss: 0.8358, test_f1: 0.6904
 epoch: 77, train_loss: 0.5082, test_loss: 0.8190, test_f1: 0.6551
 epoch: 78, train_loss: 0.5013, test_loss: 0.8575, test_f1: 0.6731
 epoch: 79, train_loss: 0.5120, test_loss: 0.9176, test_f1: 0.6770
 epoch: 80, train_loss: 0.5070, test_loss: 0.9437, test_f1: 0.6507
 epoch: 81, train_loss: 0.5001, test_loss: 0.8880, test_f1: 0.6632
 epoch: 82, train_loss: 0.5020, test_loss: 0.8313, test_f1: 0.6824
 epoch: 83, train_loss: 0.4971, test_loss: 0.8690, test_f1: 0.6908
 epoch: 84, train_loss: 0.5129, test_loss: 0.8740, test_f1: 0.6724
 epoch: 85, train_loss: 0.4878, test_loss: 0.8852, test_f1: 0.6761
 epoch: 86, train_loss: 0.4871, test_loss: 0.8923, test_f1: 0.6542
 epoch: 87, train_loss: 0.5074, test_loss: 0.8966, test_f1: 0.6417
 epoch: 88, train_loss: 0.5009, test_loss: 0.8929, test_f1: 0.6450
 epoch: 89, train_loss: 0.4868, test_loss: 0.8932, test_f1: 0.6653
 epoch: 90, train_loss: 0.5079, test_loss: 0.9815, test_f1: 0.6557
 epoch: 91, train_loss: 0.4834, test_loss: 0.8499, test_f1: 0.6719
 epoch: 92, train_loss: 0.4882, test_loss: 0.8292, test_f1: 0.6758
 epoch: 93, train_loss: 0.4853, test_loss: 0.8454, test_f1: 0.6741
 epoch: 94, train_loss: 0.4711, test_loss: 0.9261, test_f1: 0.6740
 epoch: 95, train_loss: 0.4719, test_loss: 0.8310, test_f1: 0.6793
 epoch: 96, train_loss: 0.4776, test_loss: 0.8827, test_f1: 0.6528
 epoch: 97, train_loss: 0.4707, test_loss: 0.8486, test_f1: 0.6545
 epoch: 98, train_loss: 0.4719, test_loss: 0.9119, test_f1: 0.6605
 epoch: 99, train_loss: 0.4681, test_loss: 0.8760, test_f1: 0.6571
##################ITERATION #3 ****************************************
 epoch: 0, train_loss: 1.1573, test_loss: 1.0013, test_f1: 0.4943
 epoch: 1, train_loss: 1.0202, test_loss: 0.9850, test_f1: 0.5207
 epoch: 2, train_loss: 0.9837, test_loss: 0.9589, test_f1: 0.5196
 epoch: 3, train_loss: 0.9506, test_loss: 0.9549, test_f1: 0.5202
 epoch: 4, train_loss: 0.9380, test_loss: 0.9439, test_f1: 0.5528
 epoch: 5, train_loss: 0.9126, test_loss: 0.9353, test_f1: 0.5290
 epoch: 6, train_loss: 0.8878, test_loss: 0.9267, test_f1: 0.5420
 epoch: 7, train_loss: 0.8766, test_loss: 0.9118, test_f1: 0.5362
 epoch: 8, train_loss: 0.8537, test_loss: 0.8866, test_f1: 0.5451
 epoch: 9, train_loss: 0.8354, test_loss: 0.8759, test_f1: 0.5572
 epoch: 10, train_loss: 0.8215, test_loss: 0.9060, test_f1: 0.5448
 epoch: 11, train_loss: 0.8135, test_loss: 0.8892, test_f1: 0.5885
 epoch: 12, train_loss: 0.7978, test_loss: 0.8727, test_f1: 0.5574
 epoch: 13, train_loss: 0.7774, test_loss: 0.8512, test_f1: 0.5682
 epoch: 14, train_loss: 0.7800, test_loss: 0.8738, test_f1: 0.5690
 epoch: 15, train_loss: 0.7648, test_loss: 0.8944, test_f1: 0.5601
 epoch: 16, train_loss: 0.7444, test_loss: 0.8681, test_f1: 0.5735
 epoch: 17, train_loss: 0.7425, test_loss: 0.8561, test_f1: 0.5838
 epoch: 18, train_loss: 0.7255, test_loss: 0.8869, test_f1: 0.5938
 epoch: 19, train_loss: 0.7358, test_loss: 0.8262, test_f1: 0.6289
 epoch: 20, train_loss: 0.7220, test_loss: 0.8482, test_f1: 0.5761
 epoch: 21, train_loss: 0.7090, test_loss: 0.8766, test_f1: 0.5771
 epoch: 22, train_loss: 0.7050, test_loss: 0.8445, test_f1: 0.6140
 epoch: 23, train_loss: 0.6985, test_loss: 0.8532, test_f1: 0.6019
 epoch: 24, train_loss: 0.6850, test_loss: 0.8419, test_f1: 0.6129
 epoch: 25, train_loss: 0.6887, test_loss: 0.8806, test_f1: 0.6121
 epoch: 26, train_loss: 0.6869, test_loss: 0.8512, test_f1: 0.6154
 epoch: 27, train_loss: 0.6670, test_loss: 0.8528, test_f1: 0.6083
 epoch: 28, train_loss: 0.6666, test_loss: 0.8867, test_f1: 0.6232
 epoch: 29, train_loss: 0.6533, test_loss: 0.8689, test_f1: 0.6087
 epoch: 30, train_loss: 0.6646, test_loss: 0.8455, test_f1: 0.6516
 epoch: 31, train_loss: 0.6511, test_loss: 0.8887, test_f1: 0.6160
 epoch: 32, train_loss: 0.6526, test_loss: 0.8725, test_f1: 0.6283
 epoch: 33, train_loss: 0.6359, test_loss: 0.8184, test_f1: 0.6362
 epoch: 34, train_loss: 0.6414, test_loss: 0.8593, test_f1: 0.6445
 epoch: 35, train_loss: 0.6249, test_loss: 0.8423, test_f1: 0.6469
 epoch: 36, train_loss: 0.6312, test_loss: 0.9010, test_f1: 0.6141
 epoch: 37, train_loss: 0.6093, test_loss: 0.8928, test_f1: 0.6414
 epoch: 38, train_loss: 0.6250, test_loss: 0.8610, test_f1: 0.6066
 epoch: 39, train_loss: 0.6058, test_loss: 0.8670, test_f1: 0.6277
 epoch: 40, train_loss: 0.6048, test_loss: 0.8577, test_f1: 0.6266
 epoch: 41, train_loss: 0.6066, test_loss: 0.9318, test_f1: 0.6518
 epoch: 42, train_loss: 0.6085, test_loss: 0.8250, test_f1: 0.6517
 epoch: 43, train_loss: 0.5941, test_loss: 0.8929, test_f1: 0.6324
 epoch: 44, train_loss: 0.5924, test_loss: 0.8882, test_f1: 0.6365
 epoch: 45, train_loss: 0.5835, test_loss: 0.8599, test_f1: 0.6545
 epoch: 46, train_loss: 0.5788, test_loss: 0.9030, test_f1: 0.6443
 epoch: 47, train_loss: 0.5865, test_loss: 0.8996, test_f1: 0.6467
 epoch: 48, train_loss: 0.5715, test_loss: 0.8256, test_f1: 0.6425
 epoch: 49, train_loss: 0.5643, test_loss: 0.9185, test_f1: 0.6321
 epoch: 50, train_loss: 0.5686, test_loss: 0.8520, test_f1: 0.6487
 epoch: 51, train_loss: 0.5446, test_loss: 0.8987, test_f1: 0.6452
 epoch: 52, train_loss: 0.5376, test_loss: 0.8911, test_f1: 0.6738
 epoch: 53, train_loss: 0.5299, test_loss: 0.8925, test_f1: 0.6443
 epoch: 54, train_loss: 0.5422, test_loss: 0.9109, test_f1: 0.6474
 epoch: 55, train_loss: 0.5426, test_loss: 0.8495, test_f1: 0.6518
 epoch: 56, train_loss: 0.5453, test_loss: 0.9250, test_f1: 0.6529
 epoch: 57, train_loss: 0.5300, test_loss: 0.9016, test_f1: 0.6495
 epoch: 58, train_loss: 0.5302, test_loss: 0.8917, test_f1: 0.6541
 epoch: 59, train_loss: 0.5270, test_loss: 0.8684, test_f1: 0.6532
 epoch: 60, train_loss: 0.5288, test_loss: 0.8578, test_f1: 0.6419
 epoch: 61, train_loss: 0.5115, test_loss: 0.8675, test_f1: 0.6461
 epoch: 62, train_loss: 0.5081, test_loss: 0.9221, test_f1: 0.6421
 epoch: 63, train_loss: 0.5170, test_loss: 0.8936, test_f1: 0.6414
 epoch: 64, train_loss: 0.5105, test_loss: 0.9341, test_f1: 0.6495
 epoch: 65, train_loss: 0.5278, test_loss: 0.9108, test_f1: 0.6591
 epoch: 66, train_loss: 0.5024, test_loss: 0.8728, test_f1: 0.6779
 epoch: 67, train_loss: 0.5036, test_loss: 0.9412, test_f1: 0.6404
 epoch: 68, train_loss: 0.5118, test_loss: 0.9238, test_f1: 0.6417
 epoch: 69, train_loss: 0.5037, test_loss: 0.9961, test_f1: 0.6380
 epoch: 70, train_loss: 0.4876, test_loss: 0.9407, test_f1: 0.6440
 epoch: 71, train_loss: 0.4990, test_loss: 0.9158, test_f1: 0.6506
 epoch: 72, train_loss: 0.5069, test_loss: 0.9336, test_f1: 0.6484
 epoch: 73, train_loss: 0.4795, test_loss: 0.9011, test_f1: 0.6490
 epoch: 74, train_loss: 0.4984, test_loss: 0.9760, test_f1: 0.6436
 epoch: 75, train_loss: 0.4839, test_loss: 0.8915, test_f1: 0.6650
 epoch: 76, train_loss: 0.4831, test_loss: 0.9541, test_f1: 0.6490
 epoch: 77, train_loss: 0.4762, test_loss: 0.9395, test_f1: 0.6441
 epoch: 78, train_loss: 0.4878, test_loss: 0.9230, test_f1: 0.6474
 epoch: 79, train_loss: 0.4837, test_loss: 0.9362, test_f1: 0.6586
 epoch: 80, train_loss: 0.4742, test_loss: 0.9614, test_f1: 0.6455
 epoch: 81, train_loss: 0.4789, test_loss: 0.9617, test_f1: 0.6541
 epoch: 82, train_loss: 0.4752, test_loss: 0.9643, test_f1: 0.6619
 epoch: 83, train_loss: 0.4876, test_loss: 1.0305, test_f1: 0.6555
 epoch: 84, train_loss: 0.4602, test_loss: 0.9805, test_f1: 0.6570
 epoch: 85, train_loss: 0.4685, test_loss: 0.9825, test_f1: 0.6550
 epoch: 86, train_loss: 0.4571, test_loss: 0.9929, test_f1: 0.6572
 epoch: 87, train_loss: 0.4710, test_loss: 0.9537, test_f1: 0.6635
 epoch: 88, train_loss: 0.4719, test_loss: 0.9449, test_f1: 0.6522
 epoch: 89, train_loss: 0.4542, test_loss: 0.9579, test_f1: 0.6555
 epoch: 90, train_loss: 0.4619, test_loss: 0.9767, test_f1: 0.6538
 epoch: 91, train_loss: 0.4557, test_loss: 0.9972, test_f1: 0.6421
 epoch: 92, train_loss: 0.4518, test_loss: 0.9678, test_f1: 0.6581
 epoch: 93, train_loss: 0.4386, test_loss: 1.0008, test_f1: 0.6591
 epoch: 94, train_loss: 0.4555, test_loss: 1.0506, test_f1: 0.6390
 epoch: 95, train_loss: 0.4340, test_loss: 0.9774, test_f1: 0.6669
 epoch: 96, train_loss: 0.4501, test_loss: 1.0701, test_f1: 0.6544
 epoch: 97, train_loss: 0.4537, test_loss: 1.0178, test_f1: 0.6528
 epoch: 98, train_loss: 0.4341, test_loss: 0.9886, test_f1: 0.6630
 epoch: 99, train_loss: 0.4357, test_loss: 0.9799, test_f1: 0.6651
##################ITERATION #4 ****************************************
 epoch: 0, train_loss: 1.1583, test_loss: 0.9907, test_f1: 0.5272
 epoch: 1, train_loss: 1.0149, test_loss: 0.9437, test_f1: 0.5198
 epoch: 2, train_loss: 0.9732, test_loss: 0.9297, test_f1: 0.5337
 epoch: 3, train_loss: 0.9471, test_loss: 0.9286, test_f1: 0.5399
 epoch: 4, train_loss: 0.9250, test_loss: 0.9212, test_f1: 0.5282
 epoch: 5, train_loss: 0.8976, test_loss: 0.9061, test_f1: 0.5212
 epoch: 6, train_loss: 0.8971, test_loss: 0.8949, test_f1: 0.5657
 epoch: 7, train_loss: 0.8746, test_loss: 0.8573, test_f1: 0.5780
 epoch: 8, train_loss: 0.8531, test_loss: 0.8783, test_f1: 0.5533
 epoch: 9, train_loss: 0.8453, test_loss: 0.8878, test_f1: 0.5771
 epoch: 10, train_loss: 0.8395, test_loss: 0.8681, test_f1: 0.5883
 epoch: 11, train_loss: 0.8176, test_loss: 0.8791, test_f1: 0.5757
 epoch: 12, train_loss: 0.8133, test_loss: 0.8660, test_f1: 0.5879
 epoch: 13, train_loss: 0.8098, test_loss: 0.8827, test_f1: 0.5929
 epoch: 14, train_loss: 0.7931, test_loss: 0.8817, test_f1: 0.5740
 epoch: 15, train_loss: 0.7972, test_loss: 0.8430, test_f1: 0.6117
 epoch: 16, train_loss: 0.7876, test_loss: 0.8412, test_f1: 0.6072
 epoch: 17, train_loss: 0.7728, test_loss: 0.8545, test_f1: 0.6207
 epoch: 18, train_loss: 0.7746, test_loss: 0.8332, test_f1: 0.6326
 epoch: 19, train_loss: 0.7530, test_loss: 0.8452, test_f1: 0.6280
 epoch: 20, train_loss: 0.7546, test_loss: 0.8851, test_f1: 0.6282
 epoch: 21, train_loss: 0.7411, test_loss: 0.8399, test_f1: 0.6189
 epoch: 22, train_loss: 0.7298, test_loss: 0.8495, test_f1: 0.6056
 epoch: 23, train_loss: 0.7264, test_loss: 0.8571, test_f1: 0.6226
 epoch: 24, train_loss: 0.7139, test_loss: 0.8408, test_f1: 0.6298
 epoch: 25, train_loss: 0.7135, test_loss: 0.8586, test_f1: 0.5954
 epoch: 26, train_loss: 0.7131, test_loss: 0.8233, test_f1: 0.6330
 epoch: 27, train_loss: 0.7065, test_loss: 0.8572, test_f1: 0.6152
 epoch: 28, train_loss: 0.7109, test_loss: 0.8187, test_f1: 0.6293
 epoch: 29, train_loss: 0.6786, test_loss: 0.8165, test_f1: 0.6450
 epoch: 30, train_loss: 0.6893, test_loss: 0.8371, test_f1: 0.6478
 epoch: 31, train_loss: 0.6715, test_loss: 0.7908, test_f1: 0.6405
 epoch: 32, train_loss: 0.6633, test_loss: 0.8090, test_f1: 0.6563
 epoch: 33, train_loss: 0.6626, test_loss: 0.7783, test_f1: 0.6585
 epoch: 34, train_loss: 0.6506, test_loss: 0.7872, test_f1: 0.6455
 epoch: 35, train_loss: 0.6514, test_loss: 0.8022, test_f1: 0.6440
 epoch: 36, train_loss: 0.6503, test_loss: 0.8623, test_f1: 0.6491
 epoch: 37, train_loss: 0.6409, test_loss: 0.7936, test_f1: 0.6450
 epoch: 38, train_loss: 0.6446, test_loss: 0.8401, test_f1: 0.6329
 epoch: 39, train_loss: 0.6366, test_loss: 0.8387, test_f1: 0.6458
 epoch: 40, train_loss: 0.6447, test_loss: 0.7901, test_f1: 0.6419
 epoch: 41, train_loss: 0.6247, test_loss: 0.7918, test_f1: 0.6676
 epoch: 42, train_loss: 0.6117, test_loss: 0.8432, test_f1: 0.6489
 epoch: 43, train_loss: 0.6216, test_loss: 0.8319, test_f1: 0.6445
 epoch: 44, train_loss: 0.6133, test_loss: 0.8225, test_f1: 0.6556
 epoch: 45, train_loss: 0.5987, test_loss: 0.8085, test_f1: 0.6585
 epoch: 46, train_loss: 0.6036, test_loss: 0.7960, test_f1: 0.6456
 epoch: 47, train_loss: 0.5934, test_loss: 0.7665, test_f1: 0.6608
 epoch: 48, train_loss: 0.5921, test_loss: 0.8141, test_f1: 0.6703
 epoch: 49, train_loss: 0.5970, test_loss: 0.7517, test_f1: 0.6398
 epoch: 50, train_loss: 0.5809, test_loss: 0.7798, test_f1: 0.6760
 epoch: 51, train_loss: 0.5717, test_loss: 0.7780, test_f1: 0.6530
 epoch: 52, train_loss: 0.5465, test_loss: 0.8167, test_f1: 0.6686
 epoch: 53, train_loss: 0.5578, test_loss: 0.7886, test_f1: 0.6655
 epoch: 54, train_loss: 0.5572, test_loss: 0.8469, test_f1: 0.6656
 epoch: 55, train_loss: 0.5524, test_loss: 0.8061, test_f1: 0.6587
 epoch: 56, train_loss: 0.5638, test_loss: 0.8141, test_f1: 0.6706
 epoch: 57, train_loss: 0.5372, test_loss: 0.7912, test_f1: 0.6661
 epoch: 58, train_loss: 0.5474, test_loss: 0.8499, test_f1: 0.6544
 epoch: 59, train_loss: 0.5453, test_loss: 0.8181, test_f1: 0.6537
 epoch: 60, train_loss: 0.5425, test_loss: 0.7944, test_f1: 0.6560
 epoch: 61, train_loss: 0.5337, test_loss: 0.8260, test_f1: 0.6586
 epoch: 62, train_loss: 0.5324, test_loss: 0.7993, test_f1: 0.6499
 epoch: 63, train_loss: 0.5328, test_loss: 0.7376, test_f1: 0.6721
 epoch: 64, train_loss: 0.5288, test_loss: 0.7562, test_f1: 0.6812
 epoch: 65, train_loss: 0.5192, test_loss: 0.7595, test_f1: 0.6583
 epoch: 66, train_loss: 0.5220, test_loss: 0.8551, test_f1: 0.6580
 epoch: 67, train_loss: 0.5273, test_loss: 0.7948, test_f1: 0.6885
 epoch: 68, train_loss: 0.5127, test_loss: 0.8068, test_f1: 0.6776
 epoch: 69, train_loss: 0.5173, test_loss: 0.8138, test_f1: 0.6621
 epoch: 70, train_loss: 0.5194, test_loss: 0.7835, test_f1: 0.6727
 epoch: 71, train_loss: 0.5135, test_loss: 0.8501, test_f1: 0.6488
 epoch: 72, train_loss: 0.5121, test_loss: 0.8058, test_f1: 0.6703
 epoch: 73, train_loss: 0.4957, test_loss: 0.8508, test_f1: 0.6621
 epoch: 74, train_loss: 0.5048, test_loss: 0.8127, test_f1: 0.6730
 epoch: 75, train_loss: 0.4922, test_loss: 0.8571, test_f1: 0.6294
 epoch: 76, train_loss: 0.4985, test_loss: 0.8546, test_f1: 0.6615
 epoch: 77, train_loss: 0.5034, test_loss: 0.8444, test_f1: 0.6699
 epoch: 78, train_loss: 0.4965, test_loss: 0.8977, test_f1: 0.6405
 epoch: 79, train_loss: 0.4884, test_loss: 0.8415, test_f1: 0.6763
 epoch: 80, train_loss: 0.4961, test_loss: 0.8219, test_f1: 0.6713
 epoch: 81, train_loss: 0.4978, test_loss: 0.8313, test_f1: 0.6594
 epoch: 82, train_loss: 0.4837, test_loss: 0.8835, test_f1: 0.6339
 epoch: 83, train_loss: 0.4896, test_loss: 0.8260, test_f1: 0.6579
 epoch: 84, train_loss: 0.4884, test_loss: 0.8506, test_f1: 0.6586
 epoch: 85, train_loss: 0.4946, test_loss: 0.8534, test_f1: 0.6707
 epoch: 86, train_loss: 0.4813, test_loss: 0.8434, test_f1: 0.6440
 epoch: 87, train_loss: 0.4924, test_loss: 0.8584, test_f1: 0.6904
 epoch: 88, train_loss: 0.4874, test_loss: 0.8523, test_f1: 0.6868
 epoch: 89, train_loss: 0.4704, test_loss: 0.8791, test_f1: 0.6762
 epoch: 90, train_loss: 0.4792, test_loss: 0.9128, test_f1: 0.6463
 epoch: 91, train_loss: 0.4818, test_loss: 0.8919, test_f1: 0.6571
 epoch: 92, train_loss: 0.4551, test_loss: 0.8369, test_f1: 0.6772
 epoch: 93, train_loss: 0.4745, test_loss: 0.8435, test_f1: 0.6616
 epoch: 94, train_loss: 0.4569, test_loss: 0.8609, test_f1: 0.6626
 epoch: 95, train_loss: 0.4764, test_loss: 0.9117, test_f1: 0.6437
 epoch: 96, train_loss: 0.4609, test_loss: 0.8888, test_f1: 0.6721
 epoch: 97, train_loss: 0.4452, test_loss: 0.8867, test_f1: 0.6564
 epoch: 98, train_loss: 0.4613, test_loss: 0.9188, test_f1: 0.6495
 epoch: 99, train_loss: 0.4622, test_loss: 0.8912, test_f1: 0.6479
##################ITERATION #5 ****************************************
 epoch: 0, train_loss: 1.1718, test_loss: 0.9778, test_f1: 0.5026
 epoch: 1, train_loss: 1.0389, test_loss: 0.9571, test_f1: 0.4985
 epoch: 2, train_loss: 0.9960, test_loss: 0.9305, test_f1: 0.5760
 epoch: 3, train_loss: 0.9674, test_loss: 0.9271, test_f1: 0.5753
 epoch: 4, train_loss: 0.9417, test_loss: 0.9140, test_f1: 0.5505
 epoch: 5, train_loss: 0.9316, test_loss: 0.9066, test_f1: 0.5602
 epoch: 6, train_loss: 0.9129, test_loss: 0.9055, test_f1: 0.5680
 epoch: 7, train_loss: 0.8937, test_loss: 0.8644, test_f1: 0.5855
 epoch: 8, train_loss: 0.8664, test_loss: 0.8609, test_f1: 0.5878
 epoch: 9, train_loss: 0.8550, test_loss: 0.8861, test_f1: 0.6032
 epoch: 10, train_loss: 0.8443, test_loss: 0.8699, test_f1: 0.5921
 epoch: 11, train_loss: 0.8388, test_loss: 0.8600, test_f1: 0.5942
 epoch: 12, train_loss: 0.8219, test_loss: 0.8766, test_f1: 0.5767
 epoch: 13, train_loss: 0.8109, test_loss: 0.8336, test_f1: 0.6052
 epoch: 14, train_loss: 0.8042, test_loss: 0.8387, test_f1: 0.6233
 epoch: 15, train_loss: 0.7890, test_loss: 0.8526, test_f1: 0.6130
 epoch: 16, train_loss: 0.7778, test_loss: 0.8745, test_f1: 0.6204
 epoch: 17, train_loss: 0.7602, test_loss: 0.8520, test_f1: 0.6232
 epoch: 18, train_loss: 0.7633, test_loss: 0.8480, test_f1: 0.6232
 epoch: 19, train_loss: 0.7550, test_loss: 0.8532, test_f1: 0.6298
 epoch: 20, train_loss: 0.7496, test_loss: 0.8359, test_f1: 0.6060
 epoch: 21, train_loss: 0.7396, test_loss: 0.8331, test_f1: 0.6108
 epoch: 22, train_loss: 0.7370, test_loss: 0.8555, test_f1: 0.6148
 epoch: 23, train_loss: 0.7260, test_loss: 0.8237, test_f1: 0.6295
 epoch: 24, train_loss: 0.7142, test_loss: 0.8030, test_f1: 0.6381
 epoch: 25, train_loss: 0.7177, test_loss: 0.8263, test_f1: 0.6447
 epoch: 26, train_loss: 0.6991, test_loss: 0.8660, test_f1: 0.6142
 epoch: 27, train_loss: 0.7007, test_loss: 0.8308, test_f1: 0.6519
 epoch: 28, train_loss: 0.6986, test_loss: 0.8072, test_f1: 0.6450
 epoch: 29, train_loss: 0.6822, test_loss: 0.7718, test_f1: 0.6498
 epoch: 30, train_loss: 0.6854, test_loss: 0.7898, test_f1: 0.6437
 epoch: 31, train_loss: 0.6745, test_loss: 0.8278, test_f1: 0.6508
 epoch: 32, train_loss: 0.6673, test_loss: 0.8485, test_f1: 0.6451
 epoch: 33, train_loss: 0.6636, test_loss: 0.8182, test_f1: 0.6468
 epoch: 34, train_loss: 0.6772, test_loss: 0.7867, test_f1: 0.6495
 epoch: 35, train_loss: 0.6574, test_loss: 0.8088, test_f1: 0.6455
 epoch: 36, train_loss: 0.6391, test_loss: 0.8401, test_f1: 0.6346
 epoch: 37, train_loss: 0.6454, test_loss: 0.8072, test_f1: 0.6542
 epoch: 38, train_loss: 0.6447, test_loss: 0.8084, test_f1: 0.6451
 epoch: 39, train_loss: 0.6330, test_loss: 0.8364, test_f1: 0.6495
 epoch: 40, train_loss: 0.6210, test_loss: 0.8260, test_f1: 0.6346
 epoch: 41, train_loss: 0.6248, test_loss: 0.8020, test_f1: 0.6280
 epoch: 42, train_loss: 0.6173, test_loss: 0.8339, test_f1: 0.6598
 epoch: 43, train_loss: 0.6081, test_loss: 0.8054, test_f1: 0.6342
 epoch: 44, train_loss: 0.5961, test_loss: 0.8140, test_f1: 0.6548
 epoch: 45, train_loss: 0.6000, test_loss: 0.8563, test_f1: 0.6513
 epoch: 46, train_loss: 0.5970, test_loss: 0.8454, test_f1: 0.6476
 epoch: 47, train_loss: 0.5931, test_loss: 0.8497, test_f1: 0.6407
 epoch: 48, train_loss: 0.5976, test_loss: 0.7934, test_f1: 0.6606
 epoch: 49, train_loss: 0.5833, test_loss: 0.8433, test_f1: 0.6582
 epoch: 50, train_loss: 0.5878, test_loss: 0.8110, test_f1: 0.6558
 epoch: 51, train_loss: 0.5697, test_loss: 0.7848, test_f1: 0.6675
 epoch: 52, train_loss: 0.5618, test_loss: 0.8426, test_f1: 0.6545
 epoch: 53, train_loss: 0.5562, test_loss: 0.8328, test_f1: 0.6578
 epoch: 54, train_loss: 0.5596, test_loss: 0.8393, test_f1: 0.6538
 epoch: 55, train_loss: 0.5465, test_loss: 0.8322, test_f1: 0.6545
 epoch: 56, train_loss: 0.5461, test_loss: 0.8263, test_f1: 0.6600
 epoch: 57, train_loss: 0.5487, test_loss: 0.8436, test_f1: 0.6513
 epoch: 58, train_loss: 0.5374, test_loss: 0.8533, test_f1: 0.6470
 epoch: 59, train_loss: 0.5451, test_loss: 0.8491, test_f1: 0.6619
 epoch: 60, train_loss: 0.5239, test_loss: 0.8692, test_f1: 0.6405
 epoch: 61, train_loss: 0.5372, test_loss: 0.8430, test_f1: 0.6580
 epoch: 62, train_loss: 0.5265, test_loss: 0.8317, test_f1: 0.6649
 epoch: 63, train_loss: 0.5270, test_loss: 0.8675, test_f1: 0.6377
 epoch: 64, train_loss: 0.5319, test_loss: 0.8083, test_f1: 0.6511
 epoch: 65, train_loss: 0.5163, test_loss: 0.8619, test_f1: 0.6496
 epoch: 66, train_loss: 0.5061, test_loss: 0.8338, test_f1: 0.6635
 epoch: 67, train_loss: 0.5205, test_loss: 0.8655, test_f1: 0.6563
 epoch: 68, train_loss: 0.5167, test_loss: 0.8520, test_f1: 0.6748
 epoch: 69, train_loss: 0.5097, test_loss: 0.8871, test_f1: 0.6355
 epoch: 70, train_loss: 0.5087, test_loss: 0.8854, test_f1: 0.6428
 epoch: 71, train_loss: 0.5048, test_loss: 0.8587, test_f1: 0.6540
 epoch: 72, train_loss: 0.5083, test_loss: 0.9014, test_f1: 0.6500
 epoch: 73, train_loss: 0.5096, test_loss: 0.8875, test_f1: 0.6597
 epoch: 74, train_loss: 0.4961, test_loss: 0.9155, test_f1: 0.6394
 epoch: 75, train_loss: 0.4849, test_loss: 0.8886, test_f1: 0.6538
 epoch: 76, train_loss: 0.4948, test_loss: 0.8630, test_f1: 0.6562
 epoch: 77, train_loss: 0.4870, test_loss: 0.9249, test_f1: 0.6588
 epoch: 78, train_loss: 0.4766, test_loss: 0.9106, test_f1: 0.6629
 epoch: 79, train_loss: 0.4906, test_loss: 0.9023, test_f1: 0.6608
 epoch: 80, train_loss: 0.4968, test_loss: 0.9283, test_f1: 0.6561
 epoch: 81, train_loss: 0.4956, test_loss: 0.9191, test_f1: 0.6630
 epoch: 82, train_loss: 0.4858, test_loss: 0.9069, test_f1: 0.6560
 epoch: 83, train_loss: 0.4589, test_loss: 0.9248, test_f1: 0.6497
 epoch: 84, train_loss: 0.4748, test_loss: 0.8711, test_f1: 0.6570
 epoch: 85, train_loss: 0.4755, test_loss: 0.9257, test_f1: 0.6616
 epoch: 86, train_loss: 0.4619, test_loss: 0.9125, test_f1: 0.6665
 epoch: 87, train_loss: 0.4856, test_loss: 0.9347, test_f1: 0.6363
 epoch: 88, train_loss: 0.4692, test_loss: 0.9893, test_f1: 0.6475
 epoch: 89, train_loss: 0.4658, test_loss: 0.9526, test_f1: 0.6581
 epoch: 90, train_loss: 0.4651, test_loss: 0.9358, test_f1: 0.6691
 epoch: 91, train_loss: 0.4581, test_loss: 0.9157, test_f1: 0.6565
 epoch: 92, train_loss: 0.4579, test_loss: 0.9230, test_f1: 0.6412
 epoch: 93, train_loss: 0.4681, test_loss: 0.9667, test_f1: 0.6496
 epoch: 94, train_loss: 0.4582, test_loss: 0.9883, test_f1: 0.6382
 epoch: 95, train_loss: 0.4393, test_loss: 0.9448, test_f1: 0.6545
 epoch: 96, train_loss: 0.4373, test_loss: 0.9699, test_f1: 0.6573
 epoch: 97, train_loss: 0.4397, test_loss: 1.0086, test_f1: 0.6250
 epoch: 98, train_loss: 0.4511, test_loss: 0.9687, test_f1: 0.6488
 epoch: 99, train_loss: 0.4360, test_loss: 0.9858, test_f1: 0.6414
##################ITERATION #6 ****************************************
 epoch: 0, train_loss: 1.2100, test_loss: 0.9828, test_f1: 0.5046
 epoch: 1, train_loss: 1.0465, test_loss: 0.9646, test_f1: 0.5031
 epoch: 2, train_loss: 1.0058, test_loss: 0.9491, test_f1: 0.5466
 epoch: 3, train_loss: 0.9745, test_loss: 0.9386, test_f1: 0.5547
 epoch: 4, train_loss: 0.9535, test_loss: 0.9203, test_f1: 0.5619
 epoch: 5, train_loss: 0.9370, test_loss: 0.9022, test_f1: 0.5589
 epoch: 6, train_loss: 0.9157, test_loss: 0.8909, test_f1: 0.5414
 epoch: 7, train_loss: 0.9021, test_loss: 0.8891, test_f1: 0.5637
 epoch: 8, train_loss: 0.8888, test_loss: 0.8661, test_f1: 0.5668
 epoch: 9, train_loss: 0.8704, test_loss: 0.8845, test_f1: 0.5586
 epoch: 10, train_loss: 0.8627, test_loss: 0.8697, test_f1: 0.5831
 epoch: 11, train_loss: 0.8512, test_loss: 0.8731, test_f1: 0.5821
 epoch: 12, train_loss: 0.8491, test_loss: 0.8682, test_f1: 0.5982
 epoch: 13, train_loss: 0.8294, test_loss: 0.8650, test_f1: 0.5711
 epoch: 14, train_loss: 0.8194, test_loss: 0.8666, test_f1: 0.5869
 epoch: 15, train_loss: 0.8026, test_loss: 0.8844, test_f1: 0.5956
 epoch: 16, train_loss: 0.7905, test_loss: 0.8627, test_f1: 0.5998
 epoch: 17, train_loss: 0.7945, test_loss: 0.8402, test_f1: 0.6356
 epoch: 18, train_loss: 0.7758, test_loss: 0.8394, test_f1: 0.6025
 epoch: 19, train_loss: 0.7828, test_loss: 0.8718, test_f1: 0.6082
 epoch: 20, train_loss: 0.7694, test_loss: 0.8768, test_f1: 0.5898
 epoch: 21, train_loss: 0.7443, test_loss: 0.8168, test_f1: 0.6145
 epoch: 22, train_loss: 0.7408, test_loss: 0.8601, test_f1: 0.6319
 epoch: 23, train_loss: 0.7428, test_loss: 0.8423, test_f1: 0.6130
 epoch: 24, train_loss: 0.7398, test_loss: 0.8892, test_f1: 0.6042
 epoch: 25, train_loss: 0.7263, test_loss: 0.8395, test_f1: 0.6167
 epoch: 26, train_loss: 0.7193, test_loss: 0.8533, test_f1: 0.6201
 epoch: 27, train_loss: 0.7091, test_loss: 0.9338, test_f1: 0.5904
 epoch: 28, train_loss: 0.7100, test_loss: 0.8234, test_f1: 0.6452
 epoch: 29, train_loss: 0.6869, test_loss: 0.8870, test_f1: 0.6223
 epoch: 30, train_loss: 0.6831, test_loss: 0.8411, test_f1: 0.6284
 epoch: 31, train_loss: 0.6892, test_loss: 0.8389, test_f1: 0.6284
 epoch: 32, train_loss: 0.6801, test_loss: 0.8468, test_f1: 0.6340
 epoch: 33, train_loss: 0.6721, test_loss: 0.8403, test_f1: 0.6414
 epoch: 34, train_loss: 0.6601, test_loss: 0.8275, test_f1: 0.6268
 epoch: 35, train_loss: 0.6658, test_loss: 0.8487, test_f1: 0.6333
 epoch: 36, train_loss: 0.6675, test_loss: 0.8328, test_f1: 0.6284
 epoch: 37, train_loss: 0.6361, test_loss: 0.8279, test_f1: 0.6427
 epoch: 38, train_loss: 0.6278, test_loss: 0.8186, test_f1: 0.6356
 epoch: 39, train_loss: 0.6311, test_loss: 0.9110, test_f1: 0.6306
 epoch: 40, train_loss: 0.6346, test_loss: 0.7934, test_f1: 0.6345
 epoch: 41, train_loss: 0.6379, test_loss: 0.8583, test_f1: 0.6626
 epoch: 42, train_loss: 0.6181, test_loss: 0.8014, test_f1: 0.6558
 epoch: 43, train_loss: 0.6072, test_loss: 0.8121, test_f1: 0.6487
 epoch: 44, train_loss: 0.6235, test_loss: 0.8315, test_f1: 0.6380
 epoch: 45, train_loss: 0.5996, test_loss: 0.8626, test_f1: 0.6373
 epoch: 46, train_loss: 0.6162, test_loss: 0.8817, test_f1: 0.6153
 epoch: 47, train_loss: 0.5906, test_loss: 0.8592, test_f1: 0.6326
 epoch: 48, train_loss: 0.5866, test_loss: 0.8918, test_f1: 0.6366
 epoch: 49, train_loss: 0.5852, test_loss: 0.8925, test_f1: 0.6381
 epoch: 50, train_loss: 0.6003, test_loss: 0.8511, test_f1: 0.6421
 epoch: 51, train_loss: 0.5649, test_loss: 0.8480, test_f1: 0.6376
 epoch: 52, train_loss: 0.5657, test_loss: 0.8581, test_f1: 0.6632
 epoch: 53, train_loss: 0.5583, test_loss: 0.8577, test_f1: 0.6442
 epoch: 54, train_loss: 0.5502, test_loss: 0.8852, test_f1: 0.6266
 epoch: 55, train_loss: 0.5505, test_loss: 0.8818, test_f1: 0.6374
 epoch: 56, train_loss: 0.5578, test_loss: 0.8670, test_f1: 0.6315
 epoch: 57, train_loss: 0.5520, test_loss: 0.8429, test_f1: 0.6456
 epoch: 58, train_loss: 0.5442, test_loss: 0.8706, test_f1: 0.6485
 epoch: 59, train_loss: 0.5407, test_loss: 0.8709, test_f1: 0.6381
 epoch: 60, train_loss: 0.5422, test_loss: 0.8961, test_f1: 0.6464
 epoch: 61, train_loss: 0.5456, test_loss: 0.8815, test_f1: 0.6457
 epoch: 62, train_loss: 0.5208, test_loss: 0.8719, test_f1: 0.6506
 epoch: 63, train_loss: 0.5289, test_loss: 0.8820, test_f1: 0.6437
 epoch: 64, train_loss: 0.5262, test_loss: 0.8943, test_f1: 0.6374
 epoch: 65, train_loss: 0.5241, test_loss: 0.9205, test_f1: 0.6101
 epoch: 66, train_loss: 0.5224, test_loss: 0.9064, test_f1: 0.6481
 epoch: 67, train_loss: 0.5221, test_loss: 0.9099, test_f1: 0.6475
 epoch: 68, train_loss: 0.5256, test_loss: 0.9151, test_f1: 0.6450
 epoch: 69, train_loss: 0.5166, test_loss: 0.9000, test_f1: 0.6476
 epoch: 70, train_loss: 0.5198, test_loss: 0.9070, test_f1: 0.6577
 epoch: 71, train_loss: 0.5046, test_loss: 0.9088, test_f1: 0.6553
 epoch: 72, train_loss: 0.4991, test_loss: 0.9518, test_f1: 0.6432
 epoch: 73, train_loss: 0.5087, test_loss: 0.9382, test_f1: 0.6442
 epoch: 74, train_loss: 0.5001, test_loss: 0.9604, test_f1: 0.6435
 epoch: 75, train_loss: 0.4922, test_loss: 0.9390, test_f1: 0.6526
 epoch: 76, train_loss: 0.5007, test_loss: 0.9311, test_f1: 0.6438
 epoch: 77, train_loss: 0.5057, test_loss: 0.9356, test_f1: 0.6557
 epoch: 78, train_loss: 0.5185, test_loss: 0.8955, test_f1: 0.6478
 epoch: 79, train_loss: 0.4956, test_loss: 0.9624, test_f1: 0.6383
 epoch: 80, train_loss: 0.5035, test_loss: 0.9323, test_f1: 0.6532
 epoch: 81, train_loss: 0.4913, test_loss: 0.9378, test_f1: 0.6675
 epoch: 82, train_loss: 0.4845, test_loss: 0.9750, test_f1: 0.6398
 epoch: 83, train_loss: 0.4875, test_loss: 0.9641, test_f1: 0.6446
 epoch: 84, train_loss: 0.4771, test_loss: 0.9354, test_f1: 0.6672
 epoch: 85, train_loss: 0.4802, test_loss: 0.9443, test_f1: 0.6395
 epoch: 86, train_loss: 0.4719, test_loss: 1.0000, test_f1: 0.6417
 epoch: 87, train_loss: 0.4789, test_loss: 0.9648, test_f1: 0.6432
 epoch: 88, train_loss: 0.4817, test_loss: 0.9657, test_f1: 0.6501
 epoch: 89, train_loss: 0.4765, test_loss: 0.9658, test_f1: 0.6514
 epoch: 90, train_loss: 0.4787, test_loss: 1.0006, test_f1: 0.6597
 epoch: 91, train_loss: 0.4772, test_loss: 0.9637, test_f1: 0.6609
 epoch: 92, train_loss: 0.4741, test_loss: 0.9606, test_f1: 0.6483
 epoch: 93, train_loss: 0.4724, test_loss: 1.0124, test_f1: 0.6555
 epoch: 94, train_loss: 0.4703, test_loss: 0.9973, test_f1: 0.6485
 epoch: 95, train_loss: 0.4619, test_loss: 1.0440, test_f1: 0.6348
 epoch: 96, train_loss: 0.4513, test_loss: 1.0128, test_f1: 0.6509
 epoch: 97, train_loss: 0.4468, test_loss: 1.0118, test_f1: 0.6443
 epoch: 98, train_loss: 0.4592, test_loss: 1.0482, test_f1: 0.6598
 epoch: 99, train_loss: 0.4580, test_loss: 1.0089, test_f1: 0.6628
##################ITERATION #7 ****************************************
 epoch: 0, train_loss: 1.2107, test_loss: 0.9779, test_f1: 0.5209
 epoch: 1, train_loss: 1.0533, test_loss: 0.9438, test_f1: 0.4829
 epoch: 2, train_loss: 1.0041, test_loss: 0.9372, test_f1: 0.5174
 epoch: 3, train_loss: 0.9571, test_loss: 0.9289, test_f1: 0.5229
 epoch: 4, train_loss: 0.9332, test_loss: 0.9206, test_f1: 0.5224
 epoch: 5, train_loss: 0.9068, test_loss: 0.8922, test_f1: 0.5127
 epoch: 6, train_loss: 0.8967, test_loss: 0.8864, test_f1: 0.5545
 epoch: 7, train_loss: 0.8806, test_loss: 0.8872, test_f1: 0.5626
 epoch: 8, train_loss: 0.8582, test_loss: 0.8810, test_f1: 0.5236
 epoch: 9, train_loss: 0.8437, test_loss: 0.8874, test_f1: 0.5557
 epoch: 10, train_loss: 0.8296, test_loss: 0.8565, test_f1: 0.5568
 epoch: 11, train_loss: 0.8134, test_loss: 0.8649, test_f1: 0.5690
 epoch: 12, train_loss: 0.8117, test_loss: 0.8436, test_f1: 0.5818
 epoch: 13, train_loss: 0.7910, test_loss: 0.8555, test_f1: 0.5828
 epoch: 14, train_loss: 0.7837, test_loss: 0.8508, test_f1: 0.5965
 epoch: 15, train_loss: 0.7701, test_loss: 0.8580, test_f1: 0.5521
 epoch: 16, train_loss: 0.7482, test_loss: 0.8574, test_f1: 0.5693
 epoch: 17, train_loss: 0.7491, test_loss: 0.8286, test_f1: 0.5864
 epoch: 18, train_loss: 0.7447, test_loss: 0.8298, test_f1: 0.5814
 epoch: 19, train_loss: 0.7267, test_loss: 0.8668, test_f1: 0.5724
 epoch: 20, train_loss: 0.7271, test_loss: 0.8037, test_f1: 0.6144
 epoch: 21, train_loss: 0.7079, test_loss: 0.8555, test_f1: 0.5918
 epoch: 22, train_loss: 0.7002, test_loss: 0.8063, test_f1: 0.6119
 epoch: 23, train_loss: 0.6979, test_loss: 0.8219, test_f1: 0.6352
 epoch: 24, train_loss: 0.7004, test_loss: 0.8297, test_f1: 0.6394
 epoch: 25, train_loss: 0.6844, test_loss: 0.8111, test_f1: 0.6102
 epoch: 26, train_loss: 0.6845, test_loss: 0.8468, test_f1: 0.6151
 epoch: 27, train_loss: 0.6738, test_loss: 0.8330, test_f1: 0.6476
 epoch: 28, train_loss: 0.6725, test_loss: 0.8050, test_f1: 0.6255
 epoch: 29, train_loss: 0.6729, test_loss: 0.8365, test_f1: 0.6081
 epoch: 30, train_loss: 0.6580, test_loss: 0.8207, test_f1: 0.6189
 epoch: 31, train_loss: 0.6482, test_loss: 0.8036, test_f1: 0.6438
 epoch: 32, train_loss: 0.6409, test_loss: 0.7981, test_f1: 0.6424
 epoch: 33, train_loss: 0.6347, test_loss: 0.8006, test_f1: 0.6237
 epoch: 34, train_loss: 0.6290, test_loss: 0.7961, test_f1: 0.6398
 epoch: 35, train_loss: 0.6286, test_loss: 0.7676, test_f1: 0.6589
 epoch: 36, train_loss: 0.6127, test_loss: 0.7511, test_f1: 0.6356
 epoch: 37, train_loss: 0.6041, test_loss: 0.8158, test_f1: 0.6379
 epoch: 38, train_loss: 0.6064, test_loss: 0.8075, test_f1: 0.5999
 epoch: 39, train_loss: 0.6051, test_loss: 0.7303, test_f1: 0.6699
 epoch: 40, train_loss: 0.5940, test_loss: 0.7739, test_f1: 0.6339
 epoch: 41, train_loss: 0.6021, test_loss: 0.8378, test_f1: 0.6318
 epoch: 42, train_loss: 0.5821, test_loss: 0.7857, test_f1: 0.6372
 epoch: 43, train_loss: 0.5780, test_loss: 0.7497, test_f1: 0.6556
 epoch: 44, train_loss: 0.5746, test_loss: 0.8081, test_f1: 0.6326
 epoch: 45, train_loss: 0.5766, test_loss: 0.8742, test_f1: 0.6224
 epoch: 46, train_loss: 0.5686, test_loss: 0.8098, test_f1: 0.6544
 epoch: 47, train_loss: 0.5586, test_loss: 0.8320, test_f1: 0.6470
 epoch: 48, train_loss: 0.5693, test_loss: 0.8780, test_f1: 0.6190
 epoch: 49, train_loss: 0.5492, test_loss: 0.8063, test_f1: 0.6459
 epoch: 50, train_loss: 0.5497, test_loss: 0.8189, test_f1: 0.6446
 epoch: 51, train_loss: 0.5349, test_loss: 0.8161, test_f1: 0.6601
 epoch: 52, train_loss: 0.5364, test_loss: 0.8270, test_f1: 0.6438
 epoch: 53, train_loss: 0.5219, test_loss: 0.7733, test_f1: 0.6355
 epoch: 54, train_loss: 0.5250, test_loss: 0.8525, test_f1: 0.6268
 epoch: 55, train_loss: 0.5233, test_loss: 0.8757, test_f1: 0.6422
 epoch: 56, train_loss: 0.5204, test_loss: 0.8486, test_f1: 0.6335
 epoch: 57, train_loss: 0.5229, test_loss: 0.8407, test_f1: 0.6542
 epoch: 58, train_loss: 0.4944, test_loss: 0.8376, test_f1: 0.6466
 epoch: 59, train_loss: 0.4994, test_loss: 0.7948, test_f1: 0.6405
 epoch: 60, train_loss: 0.5124, test_loss: 0.8029, test_f1: 0.6424
 epoch: 61, train_loss: 0.4954, test_loss: 0.8528, test_f1: 0.6533
 epoch: 62, train_loss: 0.5026, test_loss: 0.8392, test_f1: 0.6492
 epoch: 63, train_loss: 0.5040, test_loss: 0.8217, test_f1: 0.6327
 epoch: 64, train_loss: 0.4912, test_loss: 0.7953, test_f1: 0.6420
 epoch: 65, train_loss: 0.4928, test_loss: 0.8244, test_f1: 0.6507
 epoch: 66, train_loss: 0.4867, test_loss: 0.7718, test_f1: 0.6530
 epoch: 67, train_loss: 0.4821, test_loss: 0.8577, test_f1: 0.6356
 epoch: 68, train_loss: 0.4810, test_loss: 0.8699, test_f1: 0.6434
 epoch: 69, train_loss: 0.4812, test_loss: 0.8612, test_f1: 0.6467
 epoch: 70, train_loss: 0.4657, test_loss: 0.8713, test_f1: 0.6443
 epoch: 71, train_loss: 0.4808, test_loss: 0.8701, test_f1: 0.6336
 epoch: 72, train_loss: 0.4772, test_loss: 0.8755, test_f1: 0.6449
 epoch: 73, train_loss: 0.4838, test_loss: 0.8088, test_f1: 0.6494
 epoch: 74, train_loss: 0.4785, test_loss: 0.8580, test_f1: 0.6302
 epoch: 75, train_loss: 0.4740, test_loss: 0.8451, test_f1: 0.6441
 epoch: 76, train_loss: 0.4599, test_loss: 0.8053, test_f1: 0.6455
 epoch: 77, train_loss: 0.4673, test_loss: 0.8962, test_f1: 0.6346
 epoch: 78, train_loss: 0.4615, test_loss: 0.8821, test_f1: 0.6124
 epoch: 79, train_loss: 0.4541, test_loss: 0.9003, test_f1: 0.6479
 epoch: 80, train_loss: 0.4545, test_loss: 0.8676, test_f1: 0.6420
 epoch: 81, train_loss: 0.4622, test_loss: 0.9227, test_f1: 0.6443
 epoch: 82, train_loss: 0.4438, test_loss: 0.9224, test_f1: 0.6439
 epoch: 83, train_loss: 0.4551, test_loss: 0.8592, test_f1: 0.6448
 epoch: 84, train_loss: 0.4524, test_loss: 0.9078, test_f1: 0.6491
 epoch: 85, train_loss: 0.4463, test_loss: 0.9553, test_f1: 0.6346
 epoch: 86, train_loss: 0.4645, test_loss: 0.9240, test_f1: 0.6193
 epoch: 87, train_loss: 0.4370, test_loss: 0.9215, test_f1: 0.6220
 epoch: 88, train_loss: 0.4400, test_loss: 0.9667, test_f1: 0.6221
 epoch: 89, train_loss: 0.4253, test_loss: 0.9481, test_f1: 0.6325
 epoch: 90, train_loss: 0.4192, test_loss: 0.8856, test_f1: 0.6502
 epoch: 91, train_loss: 0.4330, test_loss: 1.0085, test_f1: 0.6355
 epoch: 92, train_loss: 0.4180, test_loss: 0.9686, test_f1: 0.6430
 epoch: 93, train_loss: 0.4394, test_loss: 0.9286, test_f1: 0.6629
 epoch: 94, train_loss: 0.4322, test_loss: 0.9114, test_f1: 0.6554
 epoch: 95, train_loss: 0.4239, test_loss: 0.9505, test_f1: 0.6300
 epoch: 96, train_loss: 0.4234, test_loss: 0.9182, test_f1: 0.6426
 epoch: 97, train_loss: 0.4174, test_loss: 0.9286, test_f1: 0.6513
 epoch: 98, train_loss: 0.4269, test_loss: 0.8861, test_f1: 0.6681
 epoch: 99, train_loss: 0.4052, test_loss: 0.9476, test_f1: 0.6346
##################ITERATION #8 ****************************************
 epoch: 0, train_loss: 1.2507, test_loss: 1.0061, test_f1: 0.4752
 epoch: 1, train_loss: 1.0662, test_loss: 1.0081, test_f1: 0.5430
 epoch: 2, train_loss: 1.0124, test_loss: 0.9828, test_f1: 0.5313
 epoch: 3, train_loss: 0.9782, test_loss: 0.9703, test_f1: 0.5458
 epoch: 4, train_loss: 0.9517, test_loss: 0.9318, test_f1: 0.5666
 epoch: 5, train_loss: 0.9216, test_loss: 0.9357, test_f1: 0.5674
 epoch: 6, train_loss: 0.8962, test_loss: 0.9281, test_f1: 0.5356
 epoch: 7, train_loss: 0.8875, test_loss: 0.9032, test_f1: 0.5850
 epoch: 8, train_loss: 0.8732, test_loss: 0.8922, test_f1: 0.6068
 epoch: 9, train_loss: 0.8658, test_loss: 0.9146, test_f1: 0.5834
 epoch: 10, train_loss: 0.8457, test_loss: 0.9177, test_f1: 0.5780
 epoch: 11, train_loss: 0.8376, test_loss: 0.8665, test_f1: 0.6077
 epoch: 12, train_loss: 0.8312, test_loss: 0.8766, test_f1: 0.5939
 epoch: 13, train_loss: 0.8244, test_loss: 0.8325, test_f1: 0.6161
 epoch: 14, train_loss: 0.8052, test_loss: 0.8497, test_f1: 0.5985
 epoch: 15, train_loss: 0.8001, test_loss: 0.8459, test_f1: 0.6196
 epoch: 16, train_loss: 0.7951, test_loss: 0.8404, test_f1: 0.6095
 epoch: 17, train_loss: 0.7790, test_loss: 0.8241, test_f1: 0.6172
 epoch: 18, train_loss: 0.7709, test_loss: 0.8300, test_f1: 0.6329
 epoch: 19, train_loss: 0.7650, test_loss: 0.8275, test_f1: 0.6418
 epoch: 20, train_loss: 0.7556, test_loss: 0.8026, test_f1: 0.6570
 epoch: 21, train_loss: 0.7371, test_loss: 0.8243, test_f1: 0.6386
 epoch: 22, train_loss: 0.7569, test_loss: 0.8711, test_f1: 0.6177
 epoch: 23, train_loss: 0.7310, test_loss: 0.8150, test_f1: 0.6416
 epoch: 24, train_loss: 0.7294, test_loss: 0.8069, test_f1: 0.6516
 epoch: 25, train_loss: 0.7354, test_loss: 0.8013, test_f1: 0.6449
 epoch: 26, train_loss: 0.7271, test_loss: 0.8068, test_f1: 0.6504
 epoch: 27, train_loss: 0.7039, test_loss: 0.8202, test_f1: 0.6432
 epoch: 28, train_loss: 0.7075, test_loss: 0.7808, test_f1: 0.6460
 epoch: 29, train_loss: 0.7051, test_loss: 0.8174, test_f1: 0.6520
 epoch: 30, train_loss: 0.6861, test_loss: 0.7881, test_f1: 0.6331
 epoch: 31, train_loss: 0.6939, test_loss: 0.8094, test_f1: 0.6272
 epoch: 32, train_loss: 0.6725, test_loss: 0.8549, test_f1: 0.6306
 epoch: 33, train_loss: 0.6722, test_loss: 0.8092, test_f1: 0.6450
 epoch: 34, train_loss: 0.6762, test_loss: 0.8214, test_f1: 0.6167
 epoch: 35, train_loss: 0.6632, test_loss: 0.8024, test_f1: 0.6500
 epoch: 36, train_loss: 0.6661, test_loss: 0.9009, test_f1: 0.6271
 epoch: 37, train_loss: 0.6520, test_loss: 0.8654, test_f1: 0.6404
 epoch: 38, train_loss: 0.6482, test_loss: 0.7865, test_f1: 0.6253
 epoch: 39, train_loss: 0.6524, test_loss: 0.8429, test_f1: 0.6512
 epoch: 40, train_loss: 0.6494, test_loss: 0.8018, test_f1: 0.6420
 epoch: 41, train_loss: 0.6348, test_loss: 0.8538, test_f1: 0.6271
 epoch: 42, train_loss: 0.6442, test_loss: 0.8393, test_f1: 0.6428
 epoch: 43, train_loss: 0.6269, test_loss: 0.8811, test_f1: 0.6402
 epoch: 44, train_loss: 0.6185, test_loss: 0.8814, test_f1: 0.6348
 epoch: 45, train_loss: 0.6132, test_loss: 0.8111, test_f1: 0.6351
 epoch: 46, train_loss: 0.6196, test_loss: 0.8581, test_f1: 0.6411
 epoch: 47, train_loss: 0.6192, test_loss: 0.8499, test_f1: 0.6525
 epoch: 48, train_loss: 0.6153, test_loss: 0.9050, test_f1: 0.6604
 epoch: 49, train_loss: 0.6136, test_loss: 0.9124, test_f1: 0.6548
 epoch: 50, train_loss: 0.5959, test_loss: 0.8814, test_f1: 0.6634
 epoch: 51, train_loss: 0.5864, test_loss: 0.9125, test_f1: 0.6516
 epoch: 52, train_loss: 0.5745, test_loss: 0.9595, test_f1: 0.6522
 epoch: 53, train_loss: 0.5758, test_loss: 0.9510, test_f1: 0.6511
 epoch: 54, train_loss: 0.5679, test_loss: 0.9691, test_f1: 0.6672
 epoch: 55, train_loss: 0.5577, test_loss: 0.8629, test_f1: 0.6726
 epoch: 56, train_loss: 0.5706, test_loss: 0.9632, test_f1: 0.6524
 epoch: 57, train_loss: 0.5648, test_loss: 1.0394, test_f1: 0.6499
 epoch: 58, train_loss: 0.5648, test_loss: 1.0015, test_f1: 0.6608
 epoch: 59, train_loss: 0.5638, test_loss: 0.8899, test_f1: 0.6605
 epoch: 60, train_loss: 0.5534, test_loss: 1.0816, test_f1: 0.6436
 epoch: 61, train_loss: 0.5519, test_loss: 0.9224, test_f1: 0.6504
 epoch: 62, train_loss: 0.5564, test_loss: 1.0386, test_f1: 0.6483
 epoch: 63, train_loss: 0.5594, test_loss: 0.9571, test_f1: 0.6511
 epoch: 64, train_loss: 0.5476, test_loss: 0.9005, test_f1: 0.6477
 epoch: 65, train_loss: 0.5451, test_loss: 0.9303, test_f1: 0.6635
 epoch: 66, train_loss: 0.5497, test_loss: 0.8872, test_f1: 0.6500
 epoch: 67, train_loss: 0.5462, test_loss: 0.9812, test_f1: 0.6436
 epoch: 68, train_loss: 0.5450, test_loss: 0.9562, test_f1: 0.6592
 epoch: 69, train_loss: 0.5399, test_loss: 1.0405, test_f1: 0.6782
 epoch: 70, train_loss: 0.5297, test_loss: 0.9848, test_f1: 0.6469
 epoch: 71, train_loss: 0.5333, test_loss: 0.9778, test_f1: 0.6556
 epoch: 72, train_loss: 0.5414, test_loss: 0.9578, test_f1: 0.6539
 epoch: 73, train_loss: 0.5271, test_loss: 1.0290, test_f1: 0.6685
 epoch: 74, train_loss: 0.5317, test_loss: 0.9338, test_f1: 0.6620
 epoch: 75, train_loss: 0.5142, test_loss: 1.1278, test_f1: 0.6669
 epoch: 76, train_loss: 0.5264, test_loss: 0.8560, test_f1: 0.6731
 epoch: 77, train_loss: 0.5350, test_loss: 0.9257, test_f1: 0.6842
 epoch: 78, train_loss: 0.5243, test_loss: 1.0623, test_f1: 0.6593
 epoch: 79, train_loss: 0.5093, test_loss: 1.2045, test_f1: 0.6796
 epoch: 80, train_loss: 0.5159, test_loss: 1.1236, test_f1: 0.6668
 epoch: 81, train_loss: 0.5112, test_loss: 1.1710, test_f1: 0.6744
 epoch: 82, train_loss: 0.4981, test_loss: 1.3011, test_f1: 0.6772
 epoch: 83, train_loss: 0.5100, test_loss: 0.9918, test_f1: 0.6595
 epoch: 84, train_loss: 0.5093, test_loss: 1.1650, test_f1: 0.6495
 epoch: 85, train_loss: 0.5207, test_loss: 1.4301, test_f1: 0.6668
 epoch: 86, train_loss: 0.4967, test_loss: 1.1099, test_f1: 0.6762
 epoch: 87, train_loss: 0.5084, test_loss: 0.9472, test_f1: 0.6623
 epoch: 88, train_loss: 0.4923, test_loss: 1.0056, test_f1: 0.6755
 epoch: 89, train_loss: 0.5042, test_loss: 1.0636, test_f1: 0.6538
 epoch: 90, train_loss: 0.4973, test_loss: 0.9715, test_f1: 0.6668
 epoch: 91, train_loss: 0.5022, test_loss: 1.0123, test_f1: 0.6415
 epoch: 92, train_loss: 0.4824, test_loss: 1.0901, test_f1: 0.6521
 epoch: 93, train_loss: 0.4857, test_loss: 0.9462, test_f1: 0.6510
 epoch: 94, train_loss: 0.4854, test_loss: 1.1709, test_f1: 0.6560
 epoch: 95, train_loss: 0.4786, test_loss: 1.0411, test_f1: 0.6571
 epoch: 96, train_loss: 0.4930, test_loss: 1.3524, test_f1: 0.6545
 epoch: 97, train_loss: 0.4897, test_loss: 0.9690, test_f1: 0.6549
 epoch: 98, train_loss: 0.4868, test_loss: 1.1944, test_f1: 0.6624
 epoch: 99, train_loss: 0.4799, test_loss: 1.0863, test_f1: 0.6427
##################ITERATION #9 ****************************************
 epoch: 0, train_loss: 1.2381, test_loss: 0.9917, test_f1: 0.5238
 epoch: 1, train_loss: 1.0612, test_loss: 0.9593, test_f1: 0.4839
 epoch: 2, train_loss: 1.0161, test_loss: 0.9552, test_f1: 0.5029
 epoch: 3, train_loss: 0.9947, test_loss: 0.9404, test_f1: 0.4925
 epoch: 4, train_loss: 0.9553, test_loss: 0.9313, test_f1: 0.5240
 epoch: 5, train_loss: 0.9315, test_loss: 0.9097, test_f1: 0.4945
 epoch: 6, train_loss: 0.9169, test_loss: 0.9122, test_f1: 0.5398
 epoch: 7, train_loss: 0.9004, test_loss: 0.8997, test_f1: 0.5435
 epoch: 8, train_loss: 0.8806, test_loss: 0.8927, test_f1: 0.5473
 epoch: 9, train_loss: 0.8653, test_loss: 0.8838, test_f1: 0.5498
 epoch: 10, train_loss: 0.8632, test_loss: 0.8965, test_f1: 0.5595
 epoch: 11, train_loss: 0.8542, test_loss: 0.8795, test_f1: 0.5462
 epoch: 12, train_loss: 0.8382, test_loss: 0.8991, test_f1: 0.5278
 epoch: 13, train_loss: 0.8162, test_loss: 0.8865, test_f1: 0.5560
 epoch: 14, train_loss: 0.8073, test_loss: 0.8706, test_f1: 0.5651
 epoch: 15, train_loss: 0.7951, test_loss: 0.9053, test_f1: 0.5393
 epoch: 16, train_loss: 0.7827, test_loss: 0.8610, test_f1: 0.5522
 epoch: 17, train_loss: 0.7810, test_loss: 0.8602, test_f1: 0.6017
 epoch: 18, train_loss: 0.7643, test_loss: 0.8955, test_f1: 0.5677
 epoch: 19, train_loss: 0.7685, test_loss: 0.8309, test_f1: 0.5884
 epoch: 20, train_loss: 0.7570, test_loss: 0.8654, test_f1: 0.5608
 epoch: 21, train_loss: 0.7437, test_loss: 0.8396, test_f1: 0.5852
 epoch: 22, train_loss: 0.7415, test_loss: 0.8218, test_f1: 0.5831
 epoch: 23, train_loss: 0.7376, test_loss: 0.8252, test_f1: 0.5805
 epoch: 24, train_loss: 0.7307, test_loss: 0.8302, test_f1: 0.5776
 epoch: 25, train_loss: 0.7242, test_loss: 0.7987, test_f1: 0.6160
 epoch: 26, train_loss: 0.7121, test_loss: 0.8148, test_f1: 0.5781
 epoch: 27, train_loss: 0.7036, test_loss: 0.7939, test_f1: 0.6057
 epoch: 28, train_loss: 0.7033, test_loss: 0.8173, test_f1: 0.6225
 epoch: 29, train_loss: 0.6831, test_loss: 0.7823, test_f1: 0.6025
 epoch: 30, train_loss: 0.6824, test_loss: 0.7973, test_f1: 0.5917
 epoch: 31, train_loss: 0.6770, test_loss: 0.8294, test_f1: 0.5853
 epoch: 32, train_loss: 0.6726, test_loss: 0.7842, test_f1: 0.5847
 epoch: 33, train_loss: 0.6762, test_loss: 0.8481, test_f1: 0.5922
 epoch: 34, train_loss: 0.6722, test_loss: 0.8214, test_f1: 0.5987
 epoch: 35, train_loss: 0.6628, test_loss: 0.7958, test_f1: 0.5908
 epoch: 36, train_loss: 0.6454, test_loss: 0.7611, test_f1: 0.6146
 epoch: 37, train_loss: 0.6503, test_loss: 0.8417, test_f1: 0.5968
 epoch: 38, train_loss: 0.6433, test_loss: 0.7776, test_f1: 0.6030
 epoch: 39, train_loss: 0.6309, test_loss: 0.8283, test_f1: 0.5985
 epoch: 40, train_loss: 0.6235, test_loss: 0.7983, test_f1: 0.6367
 epoch: 41, train_loss: 0.6358, test_loss: 0.7979, test_f1: 0.6299
 epoch: 42, train_loss: 0.6385, test_loss: 0.7810, test_f1: 0.6412
 epoch: 43, train_loss: 0.6103, test_loss: 0.7793, test_f1: 0.6274
 epoch: 44, train_loss: 0.6177, test_loss: 0.8216, test_f1: 0.6100
 epoch: 45, train_loss: 0.6096, test_loss: 0.7715, test_f1: 0.6265
 epoch: 46, train_loss: 0.5959, test_loss: 0.7720, test_f1: 0.6171
 epoch: 47, train_loss: 0.6031, test_loss: 0.7638, test_f1: 0.6471
 epoch: 48, train_loss: 0.6069, test_loss: 0.8396, test_f1: 0.6076
 epoch: 49, train_loss: 0.5928, test_loss: 0.8250, test_f1: 0.6175
 epoch: 50, train_loss: 0.5953, test_loss: 0.8097, test_f1: 0.6239
 epoch: 51, train_loss: 0.5654, test_loss: 0.8336, test_f1: 0.6257
 epoch: 52, train_loss: 0.5462, test_loss: 0.7976, test_f1: 0.6293
 epoch: 53, train_loss: 0.5605, test_loss: 0.7865, test_f1: 0.6359
 epoch: 54, train_loss: 0.5606, test_loss: 0.7806, test_f1: 0.6301
 epoch: 55, train_loss: 0.5639, test_loss: 0.7829, test_f1: 0.6430
 epoch: 56, train_loss: 0.5525, test_loss: 0.7927, test_f1: 0.6220
 epoch: 57, train_loss: 0.5539, test_loss: 0.7829, test_f1: 0.6162
 epoch: 58, train_loss: 0.5433, test_loss: 0.8026, test_f1: 0.6456
 epoch: 59, train_loss: 0.5385, test_loss: 0.7568, test_f1: 0.6581
 epoch: 60, train_loss: 0.5278, test_loss: 0.7953, test_f1: 0.6256
 epoch: 61, train_loss: 0.5429, test_loss: 0.7833, test_f1: 0.6378
 epoch: 62, train_loss: 0.5303, test_loss: 0.7693, test_f1: 0.6285
 epoch: 63, train_loss: 0.5437, test_loss: 0.8024, test_f1: 0.6449
 epoch: 64, train_loss: 0.5267, test_loss: 0.7958, test_f1: 0.6314
 epoch: 65, train_loss: 0.5364, test_loss: 0.8405, test_f1: 0.6319
 epoch: 66, train_loss: 0.5253, test_loss: 0.8169, test_f1: 0.6514
 epoch: 67, train_loss: 0.5174, test_loss: 0.8238, test_f1: 0.6349
 epoch: 68, train_loss: 0.5265, test_loss: 0.8553, test_f1: 0.6368
 epoch: 69, train_loss: 0.5226, test_loss: 0.8766, test_f1: 0.6273
 epoch: 70, train_loss: 0.5189, test_loss: 0.8165, test_f1: 0.6324
 epoch: 71, train_loss: 0.5096, test_loss: 0.8513, test_f1: 0.6249
 epoch: 72, train_loss: 0.5145, test_loss: 0.8607, test_f1: 0.6412
 epoch: 73, train_loss: 0.5137, test_loss: 0.8391, test_f1: 0.6389
 epoch: 74, train_loss: 0.5044, test_loss: 0.8736, test_f1: 0.6275
 epoch: 75, train_loss: 0.5083, test_loss: 0.8284, test_f1: 0.6346
 epoch: 76, train_loss: 0.5018, test_loss: 0.8280, test_f1: 0.6260
 epoch: 77, train_loss: 0.4944, test_loss: 0.8850, test_f1: 0.6184
 epoch: 78, train_loss: 0.4868, test_loss: 0.9083, test_f1: 0.6435
 epoch: 79, train_loss: 0.4968, test_loss: 0.8182, test_f1: 0.6470
 epoch: 80, train_loss: 0.4941, test_loss: 0.9028, test_f1: 0.6286
 epoch: 81, train_loss: 0.4916, test_loss: 0.8170, test_f1: 0.6618
 epoch: 82, train_loss: 0.4869, test_loss: 0.8848, test_f1: 0.6401
 epoch: 83, train_loss: 0.4921, test_loss: 0.8565, test_f1: 0.6245
 epoch: 84, train_loss: 0.4728, test_loss: 0.8982, test_f1: 0.6481
 epoch: 85, train_loss: 0.4723, test_loss: 0.9245, test_f1: 0.6346
 epoch: 86, train_loss: 0.4965, test_loss: 0.8999, test_f1: 0.6407
 epoch: 87, train_loss: 0.4771, test_loss: 0.9095, test_f1: 0.6415
 epoch: 88, train_loss: 0.4868, test_loss: 0.9252, test_f1: 0.6479
 epoch: 89, train_loss: 0.4778, test_loss: 0.8691, test_f1: 0.6523
 epoch: 90, train_loss: 0.4836, test_loss: 0.9038, test_f1: 0.6416
 epoch: 91, train_loss: 0.4784, test_loss: 0.9638, test_f1: 0.6412
 epoch: 92, train_loss: 0.4658, test_loss: 0.8762, test_f1: 0.6484
 epoch: 93, train_loss: 0.4667, test_loss: 0.8874, test_f1: 0.6453
 epoch: 94, train_loss: 0.4695, test_loss: 0.9409, test_f1: 0.6216
 epoch: 95, train_loss: 0.4683, test_loss: 0.8553, test_f1: 0.6552
 epoch: 96, train_loss: 0.4593, test_loss: 0.8683, test_f1: 0.6490
 epoch: 97, train_loss: 0.4560, test_loss: 0.9599, test_f1: 0.6455
 epoch: 98, train_loss: 0.4580, test_loss: 0.9245, test_f1: 0.6532
 epoch: 99, train_loss: 0.4663, test_loss: 0.8700, test_f1: 0.6621

Training completed in 1301.49 seconds
Best F1: 0.6908 at epoch 83
Mean F1 across iterations: 0.6757  0.0095
========================FINAL RESULTS================================
FEGIN weighted F1: 0.6908  0.0095
python main.py --data ltspice_examples --representation component_pin --model FEGIN --layers 2 --hiddens 128 --batch_size 32 --lr 0.0001 --emb_size 250 --epochs 100 --save_appendix component_pin_L2_H128_BS32_LR0.0001_E250 --no_val
-----



STDERR:
  File "main.py", line 370, in <module>
    main()
  File "main.py", line 254, in main
    dataset = dataset_class(
  File "/home/philip/projects/llm_inference_code_repo/Circuit-Completion-Using-GNNs/component_classification_with_link_prediction_head/evaluation/FEGIN/kernel/circuit_datasets.py", line 15, in __init__
    self.data, self.slices = torch.load(self.processed_paths[0])
  File "/home/philip/.local/lib/python3.8/site-packages/torch/serialization.py", line 1040, in load
    warnings.warn(
  File "/usr/lib/python3.8/warnings.py", line 109, in _showwarnmsg
    sw(msg.message, msg.category, msg.filename, msg.lineno,
  File "main.py", line 47, in warn_with_traceback
    traceback.print_stack(file=log)
/home/philip/projects/llm_inference_code_repo/Circuit-Completion-Using-GNNs/component_classification_with_link_prediction_head/evaluation/FEGIN/kernel/circuit_datasets.py:15: FutureWarning: You are using `torch.load` with `weights_only=False` (the current default value), which uses the default pickle module implicitly. It is possible to construct malicious pickle data which will execute arbitrary code during unpickling (See https://github.com/pytorch/pytorch/blob/main/SECURITY.md#untrusted-models for more details). In a future release, the default value for `weights_only` will be flipped to `True`. This limits the functions that could be executed during unpickling. Arbitrary objects will no longer be allowed to be loaded via this mode unless they are explicitly allowlisted by the user via `torch.serialization.add_safe_globals`. We recommend you start setting `weights_only=True` for any use case where you don't have full control of the loaded file. Please open an issue on GitHub for any issues related to this experimental feature.
  self.data, self.slices = torch.load(self.processed_paths[0])
