STDOUT:
Results will be saved in /home/philip/projects/ltspice_examples_code_repo/Circuit-Completion-Using-GNNs/component_classification_with_link_prediction_head/evaluation/FEGIN/results/model_FEGIN_dataset_ltspice_demos
Command line input: python main.py --data ltspice_demos --representation component_net --model FEGIN --layers 3 --hiddens 32 --batch_size 64 --lr 0.001 --emb_size 128 --epochs 100 --save_appendix component_net_L3_H32_BS64_LR0.001_E128 --no_val
 is saved.
-----
ltspice_demos - FEGIN
Using 3 layers, 32 hidden units, h = 2
Loading component_net representation dataset
ENTERED
Training FEGIN on component_net representation
Train: 1565, Test: 383
##################ITERATION #0 ****************************************
 epoch: 0, train_loss: 1.3522, test_loss: 1.3470, test_f1: 0.1368
 epoch: 1, train_loss: 1.2346, test_loss: 1.2751, test_f1: 0.3466
 epoch: 2, train_loss: 1.1516, test_loss: 1.1928, test_f1: 0.3256
 epoch: 3, train_loss: 1.1169, test_loss: 1.1703, test_f1: 0.4204
 epoch: 4, train_loss: 1.0868, test_loss: 1.1517, test_f1: 0.4470
 epoch: 5, train_loss: 1.0585, test_loss: 1.1485, test_f1: 0.4401
 epoch: 6, train_loss: 1.0436, test_loss: 1.1197, test_f1: 0.4418
 epoch: 7, train_loss: 1.0104, test_loss: 1.1050, test_f1: 0.4559
 epoch: 8, train_loss: 0.9913, test_loss: 1.1394, test_f1: 0.4551
 epoch: 9, train_loss: 0.9802, test_loss: 1.0868, test_f1: 0.4482
 epoch: 10, train_loss: 0.9627, test_loss: 1.1065, test_f1: 0.4442
 epoch: 11, train_loss: 0.9500, test_loss: 1.1777, test_f1: 0.4554
 epoch: 12, train_loss: 0.9465, test_loss: 1.1868, test_f1: 0.4757
 epoch: 13, train_loss: 0.9165, test_loss: 1.0960, test_f1: 0.5147
 epoch: 14, train_loss: 0.9196, test_loss: 1.0760, test_f1: 0.5297
 epoch: 15, train_loss: 0.8959, test_loss: 1.1046, test_f1: 0.5380
 epoch: 16, train_loss: 0.8965, test_loss: 1.0990, test_f1: 0.5505
 epoch: 17, train_loss: 0.8705, test_loss: 1.1646, test_f1: 0.5058
 epoch: 18, train_loss: 0.8735, test_loss: 1.0995, test_f1: 0.5302
 epoch: 19, train_loss: 0.8597, test_loss: 1.1734, test_f1: 0.5415
 epoch: 20, train_loss: 0.8568, test_loss: 1.1162, test_f1: 0.5551
 epoch: 21, train_loss: 0.8485, test_loss: 1.1134, test_f1: 0.5547
 epoch: 22, train_loss: 0.8616, test_loss: 1.1443, test_f1: 0.5498
 epoch: 23, train_loss: 0.8472, test_loss: 1.1360, test_f1: 0.5447
 epoch: 24, train_loss: 0.8408, test_loss: 1.1735, test_f1: 0.5495
 epoch: 25, train_loss: 0.8378, test_loss: 1.1258, test_f1: 0.5847
 epoch: 26, train_loss: 0.8183, test_loss: 1.1335, test_f1: 0.5692
 epoch: 27, train_loss: 0.8272, test_loss: 1.1407, test_f1: 0.5494
 epoch: 28, train_loss: 0.8416, test_loss: 1.1399, test_f1: 0.5675
 epoch: 29, train_loss: 0.8311, test_loss: 1.1086, test_f1: 0.5319
 epoch: 30, train_loss: 0.8240, test_loss: 1.1429, test_f1: 0.5494
 epoch: 31, train_loss: 0.8184, test_loss: 1.2035, test_f1: 0.5141
 epoch: 32, train_loss: 0.8056, test_loss: 1.1188, test_f1: 0.5664
 epoch: 33, train_loss: 0.8218, test_loss: 1.0933, test_f1: 0.5543
 epoch: 34, train_loss: 0.7932, test_loss: 1.0898, test_f1: 0.6133
 epoch: 35, train_loss: 0.7861, test_loss: 1.1387, test_f1: 0.5795
 epoch: 36, train_loss: 0.7725, test_loss: 1.2508, test_f1: 0.5262
 epoch: 37, train_loss: 0.7844, test_loss: 1.0718, test_f1: 0.5763
 epoch: 38, train_loss: 0.7693, test_loss: 1.1967, test_f1: 0.5497
 epoch: 39, train_loss: 0.7581, test_loss: 1.1806, test_f1: 0.6014
 epoch: 40, train_loss: 0.7557, test_loss: 1.1949, test_f1: 0.5939
 epoch: 41, train_loss: 0.7731, test_loss: 1.2089, test_f1: 0.5850
 epoch: 42, train_loss: 0.7736, test_loss: 1.2384, test_f1: 0.5683
 epoch: 43, train_loss: 0.7690, test_loss: 1.1260, test_f1: 0.5472
 epoch: 44, train_loss: 0.7640, test_loss: 1.1732, test_f1: 0.5693
 epoch: 45, train_loss: 0.7629, test_loss: 1.2093, test_f1: 0.5802
 epoch: 46, train_loss: 0.7338, test_loss: 1.1955, test_f1: 0.5834
 epoch: 47, train_loss: 0.7447, test_loss: 1.2178, test_f1: 0.5478
 epoch: 48, train_loss: 0.7587, test_loss: 1.2072, test_f1: 0.5526
 epoch: 49, train_loss: 0.7322, test_loss: 1.2901, test_f1: 0.5325
 epoch: 50, train_loss: 0.7368, test_loss: 1.2773, test_f1: 0.5829
 epoch: 51, train_loss: 0.7106, test_loss: 1.2021, test_f1: 0.5971
 epoch: 52, train_loss: 0.6980, test_loss: 1.2242, test_f1: 0.6001
 epoch: 53, train_loss: 0.6945, test_loss: 1.2735, test_f1: 0.5999
 epoch: 54, train_loss: 0.6915, test_loss: 1.2124, test_f1: 0.5860
 epoch: 55, train_loss: 0.6829, test_loss: 1.3011, test_f1: 0.6143
 epoch: 56, train_loss: 0.6771, test_loss: 1.2758, test_f1: 0.5956
 epoch: 57, train_loss: 0.6844, test_loss: 1.2999, test_f1: 0.5847
 epoch: 58, train_loss: 0.6659, test_loss: 1.2749, test_f1: 0.5759
 epoch: 59, train_loss: 0.6741, test_loss: 1.2411, test_f1: 0.5863
 epoch: 60, train_loss: 0.6657, test_loss: 1.2325, test_f1: 0.6217
 epoch: 61, train_loss: 0.6798, test_loss: 1.3612, test_f1: 0.5783
 epoch: 62, train_loss: 0.6596, test_loss: 1.1752, test_f1: 0.6206
 epoch: 63, train_loss: 0.6648, test_loss: 1.2571, test_f1: 0.5865
 epoch: 64, train_loss: 0.6703, test_loss: 1.2048, test_f1: 0.5817
 epoch: 65, train_loss: 0.6673, test_loss: 1.3423, test_f1: 0.6121
 epoch: 66, train_loss: 0.6610, test_loss: 1.2982, test_f1: 0.6142
 epoch: 67, train_loss: 0.6832, test_loss: 1.2169, test_f1: 0.5919
 epoch: 68, train_loss: 0.6430, test_loss: 1.2660, test_f1: 0.5998
 epoch: 69, train_loss: 0.6543, test_loss: 1.2843, test_f1: 0.5832
 epoch: 70, train_loss: 0.6394, test_loss: 1.3059, test_f1: 0.5956
 epoch: 71, train_loss: 0.6589, test_loss: 1.3036, test_f1: 0.6300
 epoch: 72, train_loss: 0.6595, test_loss: 1.2840, test_f1: 0.5840
 epoch: 73, train_loss: 0.6386, test_loss: 1.2214, test_f1: 0.6298
 epoch: 74, train_loss: 0.6561, test_loss: 1.2897, test_f1: 0.5937
 epoch: 75, train_loss: 0.6348, test_loss: 1.3926, test_f1: 0.6149
 epoch: 76, train_loss: 0.6234, test_loss: 1.3532, test_f1: 0.6082
 epoch: 77, train_loss: 0.6249, test_loss: 1.2979, test_f1: 0.6118
 epoch: 78, train_loss: 0.6130, test_loss: 1.3317, test_f1: 0.6089
 epoch: 79, train_loss: 0.6161, test_loss: 1.2837, test_f1: 0.5955
 epoch: 80, train_loss: 0.6011, test_loss: 1.3809, test_f1: 0.6269
 epoch: 81, train_loss: 0.5994, test_loss: 1.3428, test_f1: 0.6171
 epoch: 82, train_loss: 0.6056, test_loss: 1.3097, test_f1: 0.6107
 epoch: 83, train_loss: 0.5965, test_loss: 1.4409, test_f1: 0.6013
 epoch: 84, train_loss: 0.6081, test_loss: 1.3944, test_f1: 0.5931
 epoch: 85, train_loss: 0.6150, test_loss: 1.4254, test_f1: 0.6118
 epoch: 86, train_loss: 0.6002, test_loss: 1.3510, test_f1: 0.6386
 epoch: 87, train_loss: 0.6022, test_loss: 1.4059, test_f1: 0.6308
 epoch: 88, train_loss: 0.6069, test_loss: 1.4639, test_f1: 0.6097
 epoch: 89, train_loss: 0.6084, test_loss: 1.4548, test_f1: 0.6301
 epoch: 90, train_loss: 0.5737, test_loss: 1.3750, test_f1: 0.6119
 epoch: 91, train_loss: 0.5820, test_loss: 1.3618, test_f1: 0.5837
 epoch: 92, train_loss: 0.6045, test_loss: 1.4855, test_f1: 0.6169
 epoch: 93, train_loss: 0.5864, test_loss: 1.4041, test_f1: 0.5918
 epoch: 94, train_loss: 0.5878, test_loss: 1.4258, test_f1: 0.6089
 epoch: 95, train_loss: 0.5675, test_loss: 1.5627, test_f1: 0.6099
 epoch: 96, train_loss: 0.5835, test_loss: 1.4076, test_f1: 0.6261
 epoch: 97, train_loss: 0.5586, test_loss: 1.4342, test_f1: 0.5785
 epoch: 98, train_loss: 0.5658, test_loss: 1.4845, test_f1: 0.5790
 epoch: 99, train_loss: 0.5399, test_loss: 1.5165, test_f1: 0.6365
##################ITERATION #1 ****************************************
 epoch: 0, train_loss: 1.2322, test_loss: 1.2993, test_f1: 0.2281
 epoch: 1, train_loss: 1.1235, test_loss: 1.2281, test_f1: 0.3283
 epoch: 2, train_loss: 1.0852, test_loss: 1.1664, test_f1: 0.4102
 epoch: 3, train_loss: 1.0443, test_loss: 1.1421, test_f1: 0.4330
 epoch: 4, train_loss: 1.0235, test_loss: 1.1280, test_f1: 0.4447
 epoch: 5, train_loss: 1.0137, test_loss: 1.1326, test_f1: 0.4536
 epoch: 6, train_loss: 0.9932, test_loss: 1.0759, test_f1: 0.4776
 epoch: 7, train_loss: 0.9806, test_loss: 1.0734, test_f1: 0.5111
 epoch: 8, train_loss: 0.9536, test_loss: 1.0509, test_f1: 0.5239
 epoch: 9, train_loss: 0.9383, test_loss: 1.1103, test_f1: 0.5003
 epoch: 10, train_loss: 0.9208, test_loss: 1.0552, test_f1: 0.5526
 epoch: 11, train_loss: 0.9111, test_loss: 1.0186, test_f1: 0.5352
 epoch: 12, train_loss: 0.8837, test_loss: 1.1269, test_f1: 0.5463
 epoch: 13, train_loss: 0.8732, test_loss: 1.0315, test_f1: 0.5680
 epoch: 14, train_loss: 0.8710, test_loss: 1.0372, test_f1: 0.5987
 epoch: 15, train_loss: 0.8585, test_loss: 1.1553, test_f1: 0.5323
 epoch: 16, train_loss: 0.8363, test_loss: 1.0341, test_f1: 0.5844
 epoch: 17, train_loss: 0.8504, test_loss: 1.1632, test_f1: 0.5166
 epoch: 18, train_loss: 0.8385, test_loss: 1.0618, test_f1: 0.5865
 epoch: 19, train_loss: 0.8150, test_loss: 1.0841, test_f1: 0.5818
 epoch: 20, train_loss: 0.8098, test_loss: 1.1339, test_f1: 0.5837
 epoch: 21, train_loss: 0.8050, test_loss: 0.9774, test_f1: 0.5707
 epoch: 22, train_loss: 0.7938, test_loss: 1.1583, test_f1: 0.5767
 epoch: 23, train_loss: 0.7873, test_loss: 0.9989, test_f1: 0.6067
 epoch: 24, train_loss: 0.7741, test_loss: 1.2137, test_f1: 0.5815
 epoch: 25, train_loss: 0.7613, test_loss: 1.0414, test_f1: 0.5787
 epoch: 26, train_loss: 0.7713, test_loss: 1.0900, test_f1: 0.5986
 epoch: 27, train_loss: 0.7796, test_loss: 1.2227, test_f1: 0.5674
 epoch: 28, train_loss: 0.7514, test_loss: 1.1701, test_f1: 0.5993
 epoch: 29, train_loss: 0.7348, test_loss: 1.2790, test_f1: 0.5609
 epoch: 30, train_loss: 0.7115, test_loss: 1.1181, test_f1: 0.6168
 epoch: 31, train_loss: 0.7085, test_loss: 1.2114, test_f1: 0.6022
 epoch: 32, train_loss: 0.7142, test_loss: 1.1625, test_f1: 0.5720
 epoch: 33, train_loss: 0.7168, test_loss: 1.4068, test_f1: 0.5942
 epoch: 34, train_loss: 0.7088, test_loss: 1.2119, test_f1: 0.5499
 epoch: 35, train_loss: 0.7241, test_loss: 1.4392, test_f1: 0.5629
 epoch: 36, train_loss: 0.7157, test_loss: 1.2576, test_f1: 0.6089
 epoch: 37, train_loss: 0.7047, test_loss: 1.1782, test_f1: 0.5824
 epoch: 38, train_loss: 0.6775, test_loss: 1.3894, test_f1: 0.5265
 epoch: 39, train_loss: 0.6724, test_loss: 1.2017, test_f1: 0.5796
 epoch: 40, train_loss: 0.6743, test_loss: 1.3761, test_f1: 0.5529
 epoch: 41, train_loss: 0.6869, test_loss: 1.2923, test_f1: 0.5883
 epoch: 42, train_loss: 0.6643, test_loss: 1.3508, test_f1: 0.5969
 epoch: 43, train_loss: 0.6515, test_loss: 1.2977, test_f1: 0.6046
 epoch: 44, train_loss: 0.6410, test_loss: 1.3801, test_f1: 0.6046
 epoch: 45, train_loss: 0.6745, test_loss: 1.3350, test_f1: 0.6019
 epoch: 46, train_loss: 0.6613, test_loss: 1.2874, test_f1: 0.6028
 epoch: 47, train_loss: 0.6322, test_loss: 1.2236, test_f1: 0.6204
 epoch: 48, train_loss: 0.6642, test_loss: 1.3160, test_f1: 0.5931
 epoch: 49, train_loss: 0.6156, test_loss: 1.4029, test_f1: 0.6306
 epoch: 50, train_loss: 0.6365, test_loss: 1.3212, test_f1: 0.6192
 epoch: 51, train_loss: 0.6110, test_loss: 1.3181, test_f1: 0.6112
 epoch: 52, train_loss: 0.5881, test_loss: 1.3249, test_f1: 0.6212
 epoch: 53, train_loss: 0.6185, test_loss: 1.3694, test_f1: 0.6277
 epoch: 54, train_loss: 0.5924, test_loss: 1.3550, test_f1: 0.6165
 epoch: 55, train_loss: 0.5798, test_loss: 1.3356, test_f1: 0.6241
 epoch: 56, train_loss: 0.5826, test_loss: 1.4084, test_f1: 0.6187
 epoch: 57, train_loss: 0.5909, test_loss: 1.5072, test_f1: 0.6078
 epoch: 58, train_loss: 0.5780, test_loss: 1.4350, test_f1: 0.6073
 epoch: 59, train_loss: 0.5665, test_loss: 1.5016, test_f1: 0.5635
 epoch: 60, train_loss: 0.5737, test_loss: 1.5015, test_f1: 0.5977
 epoch: 61, train_loss: 0.5799, test_loss: 1.5039, test_f1: 0.6089
 epoch: 62, train_loss: 0.5715, test_loss: 1.5384, test_f1: 0.5786
 epoch: 63, train_loss: 0.5788, test_loss: 1.4702, test_f1: 0.6166
 epoch: 64, train_loss: 0.5993, test_loss: 1.4741, test_f1: 0.5871
 epoch: 65, train_loss: 0.5711, test_loss: 1.4012, test_f1: 0.6039
 epoch: 66, train_loss: 0.5568, test_loss: 1.5275, test_f1: 0.5841
 epoch: 67, train_loss: 0.5667, test_loss: 1.5683, test_f1: 0.5696
 epoch: 68, train_loss: 0.5412, test_loss: 1.5611, test_f1: 0.5789
 epoch: 69, train_loss: 0.5566, test_loss: 1.6121, test_f1: 0.5555
 epoch: 70, train_loss: 0.5528, test_loss: 1.5680, test_f1: 0.5731
 epoch: 71, train_loss: 0.5430, test_loss: 1.5885, test_f1: 0.5834
 epoch: 72, train_loss: 0.5481, test_loss: 1.5943, test_f1: 0.5752
 epoch: 73, train_loss: 0.5274, test_loss: 1.5300, test_f1: 0.5736
 epoch: 74, train_loss: 0.5367, test_loss: 1.6867, test_f1: 0.5779
 epoch: 75, train_loss: 0.5486, test_loss: 1.6183, test_f1: 0.5692
 epoch: 76, train_loss: 0.5397, test_loss: 1.6140, test_f1: 0.5826
 epoch: 77, train_loss: 0.5246, test_loss: 1.7307, test_f1: 0.5866
 epoch: 78, train_loss: 0.5199, test_loss: 1.6818, test_f1: 0.5624
 epoch: 79, train_loss: 0.5107, test_loss: 1.6381, test_f1: 0.5443
 epoch: 80, train_loss: 0.5141, test_loss: 1.6824, test_f1: 0.5726
 epoch: 81, train_loss: 0.5106, test_loss: 1.7378, test_f1: 0.5506
 epoch: 82, train_loss: 0.5077, test_loss: 1.7257, test_f1: 0.5663
 epoch: 83, train_loss: 0.5225, test_loss: 1.7401, test_f1: 0.5783
 epoch: 84, train_loss: 0.5137, test_loss: 1.7629, test_f1: 0.5811
 epoch: 85, train_loss: 0.5127, test_loss: 1.7090, test_f1: 0.5756
 epoch: 86, train_loss: 0.5109, test_loss: 1.7818, test_f1: 0.5878
 epoch: 87, train_loss: 0.5284, test_loss: 1.8489, test_f1: 0.5608
 epoch: 88, train_loss: 0.5100, test_loss: 1.7861, test_f1: 0.5336
 epoch: 89, train_loss: 0.5300, test_loss: 1.8470, test_f1: 0.5608
 epoch: 90, train_loss: 0.5124, test_loss: 1.8074, test_f1: 0.5578
 epoch: 91, train_loss: 0.5058, test_loss: 1.7645, test_f1: 0.5550
 epoch: 92, train_loss: 0.4791, test_loss: 1.6957, test_f1: 0.5684
 epoch: 93, train_loss: 0.5063, test_loss: 1.7793, test_f1: 0.5444
 epoch: 94, train_loss: 0.4960, test_loss: 1.7973, test_f1: 0.5635
 epoch: 95, train_loss: 0.4864, test_loss: 1.8858, test_f1: 0.5521
 epoch: 96, train_loss: 0.4761, test_loss: 1.8497, test_f1: 0.5787
 epoch: 97, train_loss: 0.4808, test_loss: 1.8394, test_f1: 0.5775
 epoch: 98, train_loss: 0.4734, test_loss: 1.9340, test_f1: 0.5878
 epoch: 99, train_loss: 0.4747, test_loss: 1.8493, test_f1: 0.5639
##################ITERATION #2 ****************************************
 epoch: 0, train_loss: 1.1907, test_loss: 1.2888, test_f1: 0.3145
 epoch: 1, train_loss: 1.0967, test_loss: 1.2592, test_f1: 0.3019
 epoch: 2, train_loss: 1.0704, test_loss: 1.2031, test_f1: 0.4434
 epoch: 3, train_loss: 1.0449, test_loss: 1.1036, test_f1: 0.5044
 epoch: 4, train_loss: 1.0243, test_loss: 1.1279, test_f1: 0.5195
 epoch: 5, train_loss: 0.9918, test_loss: 1.0948, test_f1: 0.5185
 epoch: 6, train_loss: 0.9665, test_loss: 1.0756, test_f1: 0.5323
 epoch: 7, train_loss: 0.9555, test_loss: 1.1121, test_f1: 0.4938
 epoch: 8, train_loss: 0.9584, test_loss: 1.0813, test_f1: 0.5363
 epoch: 9, train_loss: 0.9302, test_loss: 1.0565, test_f1: 0.5241
 epoch: 10, train_loss: 0.9197, test_loss: 1.0771, test_f1: 0.5647
 epoch: 11, train_loss: 0.8996, test_loss: 1.0823, test_f1: 0.5213
 epoch: 12, train_loss: 0.8971, test_loss: 1.0567, test_f1: 0.5412
 epoch: 13, train_loss: 0.8844, test_loss: 1.0717, test_f1: 0.5631
 epoch: 14, train_loss: 0.8835, test_loss: 1.1642, test_f1: 0.5266
 epoch: 15, train_loss: 0.8819, test_loss: 1.0476, test_f1: 0.5559
 epoch: 16, train_loss: 0.8652, test_loss: 1.0230, test_f1: 0.5492
 epoch: 17, train_loss: 0.8540, test_loss: 1.0528, test_f1: 0.5677
 epoch: 18, train_loss: 0.8484, test_loss: 1.0899, test_f1: 0.5738
 epoch: 19, train_loss: 0.8468, test_loss: 1.0344, test_f1: 0.5560
 epoch: 20, train_loss: 0.8442, test_loss: 1.0163, test_f1: 0.5821
 epoch: 21, train_loss: 0.8383, test_loss: 1.1127, test_f1: 0.5771
 epoch: 22, train_loss: 0.8081, test_loss: 1.0863, test_f1: 0.5703
 epoch: 23, train_loss: 0.8265, test_loss: 1.0724, test_f1: 0.5562
 epoch: 24, train_loss: 0.8105, test_loss: 1.0449, test_f1: 0.5696
 epoch: 25, train_loss: 0.8002, test_loss: 0.9859, test_f1: 0.5761
 epoch: 26, train_loss: 0.8042, test_loss: 1.0845, test_f1: 0.5549
 epoch: 27, train_loss: 0.7911, test_loss: 1.0205, test_f1: 0.5891
 epoch: 28, train_loss: 0.7999, test_loss: 1.0506, test_f1: 0.5467
 epoch: 29, train_loss: 0.7807, test_loss: 1.0211, test_f1: 0.5811
 epoch: 30, train_loss: 0.7680, test_loss: 1.0940, test_f1: 0.5648
 epoch: 31, train_loss: 0.7621, test_loss: 1.0255, test_f1: 0.5917
 epoch: 32, train_loss: 0.7651, test_loss: 1.0340, test_f1: 0.6000
 epoch: 33, train_loss: 0.7510, test_loss: 1.0707, test_f1: 0.5623
 epoch: 34, train_loss: 0.7482, test_loss: 1.0825, test_f1: 0.5746
 epoch: 35, train_loss: 0.7570, test_loss: 1.0041, test_f1: 0.5937
 epoch: 36, train_loss: 0.7529, test_loss: 1.0466, test_f1: 0.5841
 epoch: 37, train_loss: 0.7506, test_loss: 1.0895, test_f1: 0.6008
 epoch: 38, train_loss: 0.7462, test_loss: 1.0941, test_f1: 0.5692
 epoch: 39, train_loss: 0.7273, test_loss: 1.0665, test_f1: 0.6095
 epoch: 40, train_loss: 0.7087, test_loss: 1.0561, test_f1: 0.5920
 epoch: 41, train_loss: 0.7154, test_loss: 1.0714, test_f1: 0.6122
 epoch: 42, train_loss: 0.7201, test_loss: 1.0127, test_f1: 0.6096
 epoch: 43, train_loss: 0.6891, test_loss: 1.0848, test_f1: 0.6252
 epoch: 44, train_loss: 0.6868, test_loss: 1.0881, test_f1: 0.5895
 epoch: 45, train_loss: 0.6976, test_loss: 1.0200, test_f1: 0.6101
 epoch: 46, train_loss: 0.6877, test_loss: 1.1542, test_f1: 0.6088
 epoch: 47, train_loss: 0.6714, test_loss: 1.1270, test_f1: 0.5760
 epoch: 48, train_loss: 0.6603, test_loss: 1.0780, test_f1: 0.6204
 epoch: 49, train_loss: 0.6695, test_loss: 1.0524, test_f1: 0.5773
 epoch: 50, train_loss: 0.6581, test_loss: 1.2049, test_f1: 0.5689
 epoch: 51, train_loss: 0.6470, test_loss: 1.1248, test_f1: 0.5984
 epoch: 52, train_loss: 0.6347, test_loss: 1.0889, test_f1: 0.6229
 epoch: 53, train_loss: 0.6103, test_loss: 1.1113, test_f1: 0.6142
 epoch: 54, train_loss: 0.6192, test_loss: 1.1309, test_f1: 0.5965
 epoch: 55, train_loss: 0.6169, test_loss: 1.1179, test_f1: 0.6174
 epoch: 56, train_loss: 0.6170, test_loss: 1.1127, test_f1: 0.5968
 epoch: 57, train_loss: 0.6091, test_loss: 1.1438, test_f1: 0.6045
 epoch: 58, train_loss: 0.6033, test_loss: 1.1151, test_f1: 0.6233
 epoch: 59, train_loss: 0.5889, test_loss: 1.1545, test_f1: 0.6220
 epoch: 60, train_loss: 0.5961, test_loss: 1.1055, test_f1: 0.6408
 epoch: 61, train_loss: 0.5955, test_loss: 1.2026, test_f1: 0.6236
 epoch: 62, train_loss: 0.5643, test_loss: 1.1996, test_f1: 0.6205
 epoch: 63, train_loss: 0.5951, test_loss: 1.2005, test_f1: 0.6102
 epoch: 64, train_loss: 0.5549, test_loss: 1.1644, test_f1: 0.6263
 epoch: 65, train_loss: 0.5626, test_loss: 1.2031, test_f1: 0.6211
 epoch: 66, train_loss: 0.5767, test_loss: 1.2324, test_f1: 0.5950
 epoch: 67, train_loss: 0.5610, test_loss: 1.2243, test_f1: 0.6011
 epoch: 68, train_loss: 0.5616, test_loss: 1.2756, test_f1: 0.6199
 epoch: 69, train_loss: 0.5776, test_loss: 1.2098, test_f1: 0.6363
 epoch: 70, train_loss: 0.5637, test_loss: 1.2963, test_f1: 0.6219
 epoch: 71, train_loss: 0.5409, test_loss: 1.2493, test_f1: 0.6255
 epoch: 72, train_loss: 0.5433, test_loss: 1.2523, test_f1: 0.6158
 epoch: 73, train_loss: 0.5472, test_loss: 1.3241, test_f1: 0.6002
 epoch: 74, train_loss: 0.5604, test_loss: 1.3390, test_f1: 0.6448
 epoch: 75, train_loss: 0.5456, test_loss: 1.2931, test_f1: 0.6241
 epoch: 76, train_loss: 0.5407, test_loss: 1.3403, test_f1: 0.6009
 epoch: 77, train_loss: 0.5334, test_loss: 1.3438, test_f1: 0.6174
 epoch: 78, train_loss: 0.5150, test_loss: 1.3172, test_f1: 0.6223
 epoch: 79, train_loss: 0.5338, test_loss: 1.3387, test_f1: 0.6211
 epoch: 80, train_loss: 0.5146, test_loss: 1.3349, test_f1: 0.6150
 epoch: 81, train_loss: 0.5023, test_loss: 1.4106, test_f1: 0.6370
 epoch: 82, train_loss: 0.5170, test_loss: 1.3694, test_f1: 0.5862
 epoch: 83, train_loss: 0.4975, test_loss: 1.4108, test_f1: 0.6206
 epoch: 84, train_loss: 0.5139, test_loss: 1.3595, test_f1: 0.6414
 epoch: 85, train_loss: 0.4979, test_loss: 1.4608, test_f1: 0.6170
 epoch: 86, train_loss: 0.5080, test_loss: 1.4255, test_f1: 0.6234
 epoch: 87, train_loss: 0.5026, test_loss: 1.4567, test_f1: 0.6029
 epoch: 88, train_loss: 0.5012, test_loss: 1.4141, test_f1: 0.6360
 epoch: 89, train_loss: 0.4868, test_loss: 1.4594, test_f1: 0.6438
 epoch: 90, train_loss: 0.4901, test_loss: 1.5449, test_f1: 0.6360
 epoch: 91, train_loss: 0.5218, test_loss: 1.4317, test_f1: 0.6634
 epoch: 92, train_loss: 0.4615, test_loss: 1.5227, test_f1: 0.6350
 epoch: 93, train_loss: 0.4871, test_loss: 1.4794, test_f1: 0.6402
 epoch: 94, train_loss: 0.4858, test_loss: 1.4512, test_f1: 0.6035
 epoch: 95, train_loss: 0.4859, test_loss: 1.5445, test_f1: 0.6234
 epoch: 96, train_loss: 0.4550, test_loss: 1.5811, test_f1: 0.6451
 epoch: 97, train_loss: 0.4698, test_loss: 1.4744, test_f1: 0.6280
 epoch: 98, train_loss: 0.4638, test_loss: 1.5576, test_f1: 0.6276
 epoch: 99, train_loss: 0.4672, test_loss: 1.6170, test_f1: 0.6372
##################ITERATION #3 ****************************************
 epoch: 0, train_loss: 1.2921, test_loss: 1.2743, test_f1: 0.2722
 epoch: 1, train_loss: 1.0961, test_loss: 1.1852, test_f1: 0.4651
 epoch: 2, train_loss: 1.0447, test_loss: 1.1243, test_f1: 0.4893
 epoch: 3, train_loss: 1.0307, test_loss: 1.1339, test_f1: 0.4791
 epoch: 4, train_loss: 0.9998, test_loss: 1.1257, test_f1: 0.4911
 epoch: 5, train_loss: 0.9761, test_loss: 1.1141, test_f1: 0.5051
 epoch: 6, train_loss: 0.9299, test_loss: 1.0874, test_f1: 0.5060
 epoch: 7, train_loss: 0.9339, test_loss: 1.1961, test_f1: 0.4215
 epoch: 8, train_loss: 0.9525, test_loss: 1.1306, test_f1: 0.5364
 epoch: 9, train_loss: 0.9406, test_loss: 1.1107, test_f1: 0.5262
 epoch: 10, train_loss: 0.9311, test_loss: 1.0991, test_f1: 0.5282
 epoch: 11, train_loss: 0.9110, test_loss: 1.0804, test_f1: 0.5681
 epoch: 12, train_loss: 0.8865, test_loss: 1.0928, test_f1: 0.5588
 epoch: 13, train_loss: 0.8893, test_loss: 1.1209, test_f1: 0.5664
 epoch: 14, train_loss: 0.8628, test_loss: 1.0689, test_f1: 0.6014
 epoch: 15, train_loss: 0.8678, test_loss: 1.1442, test_f1: 0.5808
 epoch: 16, train_loss: 0.8569, test_loss: 1.0822, test_f1: 0.5775
 epoch: 17, train_loss: 0.8494, test_loss: 1.1352, test_f1: 0.5887
 epoch: 18, train_loss: 0.8649, test_loss: 1.1614, test_f1: 0.5727
 epoch: 19, train_loss: 0.8428, test_loss: 1.1443, test_f1: 0.5639
 epoch: 20, train_loss: 0.8251, test_loss: 1.0404, test_f1: 0.5933
 epoch: 21, train_loss: 0.8158, test_loss: 1.1082, test_f1: 0.5619
 epoch: 22, train_loss: 0.8108, test_loss: 1.0398, test_f1: 0.5699
 epoch: 23, train_loss: 0.8035, test_loss: 1.0980, test_f1: 0.5987
 epoch: 24, train_loss: 0.7948, test_loss: 1.2607, test_f1: 0.5888
 epoch: 25, train_loss: 0.8067, test_loss: 1.1832, test_f1: 0.5824
 epoch: 26, train_loss: 0.7856, test_loss: 1.1608, test_f1: 0.5668
 epoch: 27, train_loss: 0.7609, test_loss: 1.0519, test_f1: 0.6125
 epoch: 28, train_loss: 0.7703, test_loss: 1.0798, test_f1: 0.6137
 epoch: 29, train_loss: 0.7668, test_loss: 1.2090, test_f1: 0.5651
 epoch: 30, train_loss: 0.7608, test_loss: 1.1322, test_f1: 0.5672
 epoch: 31, train_loss: 0.7511, test_loss: 1.0902, test_f1: 0.6028
 epoch: 32, train_loss: 0.7390, test_loss: 1.1456, test_f1: 0.6158
 epoch: 33, train_loss: 0.7390, test_loss: 1.2801, test_f1: 0.5409
 epoch: 34, train_loss: 0.7286, test_loss: 1.0708, test_f1: 0.5937
 epoch: 35, train_loss: 0.7077, test_loss: 1.3593, test_f1: 0.5617
 epoch: 36, train_loss: 0.6841, test_loss: 1.1451, test_f1: 0.6098
 epoch: 37, train_loss: 0.6893, test_loss: 1.1668, test_f1: 0.5316
 epoch: 38, train_loss: 0.6889, test_loss: 1.2519, test_f1: 0.6108
 epoch: 39, train_loss: 0.6787, test_loss: 1.2213, test_f1: 0.5813
 epoch: 40, train_loss: 0.6732, test_loss: 1.1154, test_f1: 0.6050
 epoch: 41, train_loss: 0.6596, test_loss: 1.3029, test_f1: 0.6005
 epoch: 42, train_loss: 0.6673, test_loss: 1.2195, test_f1: 0.5758
 epoch: 43, train_loss: 0.6696, test_loss: 1.2711, test_f1: 0.5959
 epoch: 44, train_loss: 0.6602, test_loss: 1.1329, test_f1: 0.5984
 epoch: 45, train_loss: 0.6551, test_loss: 1.2654, test_f1: 0.5974
 epoch: 46, train_loss: 0.6377, test_loss: 1.2404, test_f1: 0.6284
 epoch: 47, train_loss: 0.6422, test_loss: 1.2596, test_f1: 0.6116
 epoch: 48, train_loss: 0.6417, test_loss: 1.2828, test_f1: 0.5842
 epoch: 49, train_loss: 0.6152, test_loss: 1.2997, test_f1: 0.5960
 epoch: 50, train_loss: 0.6107, test_loss: 1.2208, test_f1: 0.5826
 epoch: 51, train_loss: 0.5900, test_loss: 1.2765, test_f1: 0.5987
 epoch: 52, train_loss: 0.5710, test_loss: 1.2987, test_f1: 0.5948
 epoch: 53, train_loss: 0.5728, test_loss: 1.3296, test_f1: 0.6048
 epoch: 54, train_loss: 0.5499, test_loss: 1.2497, test_f1: 0.6302
 epoch: 55, train_loss: 0.5686, test_loss: 1.3126, test_f1: 0.6331
 epoch: 56, train_loss: 0.5480, test_loss: 1.3390, test_f1: 0.5901
 epoch: 57, train_loss: 0.5238, test_loss: 1.3277, test_f1: 0.5968
 epoch: 58, train_loss: 0.5329, test_loss: 1.3433, test_f1: 0.5861
 epoch: 59, train_loss: 0.5336, test_loss: 1.3635, test_f1: 0.6094
 epoch: 60, train_loss: 0.5387, test_loss: 1.4045, test_f1: 0.5903
 epoch: 61, train_loss: 0.5222, test_loss: 1.4989, test_f1: 0.6135
 epoch: 62, train_loss: 0.5419, test_loss: 1.4142, test_f1: 0.5916
 epoch: 63, train_loss: 0.5366, test_loss: 1.4224, test_f1: 0.6248
 epoch: 64, train_loss: 0.5258, test_loss: 1.5318, test_f1: 0.6006
 epoch: 65, train_loss: 0.5028, test_loss: 1.4185, test_f1: 0.5880
 epoch: 66, train_loss: 0.5114, test_loss: 1.4888, test_f1: 0.5930
 epoch: 67, train_loss: 0.4955, test_loss: 1.5339, test_f1: 0.6094
 epoch: 68, train_loss: 0.5044, test_loss: 1.4035, test_f1: 0.6244
 epoch: 69, train_loss: 0.4976, test_loss: 1.4973, test_f1: 0.5881
 epoch: 70, train_loss: 0.5037, test_loss: 1.6896, test_f1: 0.6091
 epoch: 71, train_loss: 0.4796, test_loss: 1.4754, test_f1: 0.6269
 epoch: 72, train_loss: 0.5026, test_loss: 1.5100, test_f1: 0.6013
 epoch: 73, train_loss: 0.4904, test_loss: 1.5142, test_f1: 0.6171
 epoch: 74, train_loss: 0.4886, test_loss: 1.5076, test_f1: 0.6165
 epoch: 75, train_loss: 0.4840, test_loss: 1.5661, test_f1: 0.6135
 epoch: 76, train_loss: 0.4678, test_loss: 1.6586, test_f1: 0.6028
 epoch: 77, train_loss: 0.4713, test_loss: 1.8887, test_f1: 0.6071
 epoch: 78, train_loss: 0.4670, test_loss: 1.8198, test_f1: 0.5936
 epoch: 79, train_loss: 0.4848, test_loss: 1.6693, test_f1: 0.5971
 epoch: 80, train_loss: 0.4668, test_loss: 1.8758, test_f1: 0.6089
 epoch: 81, train_loss: 0.4623, test_loss: 1.7241, test_f1: 0.5889
 epoch: 82, train_loss: 0.4903, test_loss: 1.8272, test_f1: 0.5967
 epoch: 83, train_loss: 0.4927, test_loss: 1.7689, test_f1: 0.6168
 epoch: 84, train_loss: 0.4459, test_loss: 1.6970, test_f1: 0.6116
 epoch: 85, train_loss: 0.4470, test_loss: 1.6407, test_f1: 0.6098
 epoch: 86, train_loss: 0.4609, test_loss: 1.8547, test_f1: 0.6093
 epoch: 87, train_loss: 0.4397, test_loss: 1.7023, test_f1: 0.6231
 epoch: 88, train_loss: 0.4345, test_loss: 1.7493, test_f1: 0.6122
 epoch: 89, train_loss: 0.4598, test_loss: 1.7728, test_f1: 0.6120
 epoch: 90, train_loss: 0.4446, test_loss: 1.9391, test_f1: 0.6037
 epoch: 91, train_loss: 0.4606, test_loss: 1.9868, test_f1: 0.6020
 epoch: 92, train_loss: 0.4263, test_loss: 1.8555, test_f1: 0.5892
 epoch: 93, train_loss: 0.4386, test_loss: 1.9587, test_f1: 0.6136
 epoch: 94, train_loss: 0.4118, test_loss: 1.9844, test_f1: 0.6223
 epoch: 95, train_loss: 0.4268, test_loss: 1.9910, test_f1: 0.6196
 epoch: 96, train_loss: 0.4379, test_loss: 1.8681, test_f1: 0.6160
 epoch: 97, train_loss: 0.4091, test_loss: 1.9609, test_f1: 0.5919
 epoch: 98, train_loss: 0.4143, test_loss: 2.1907, test_f1: 0.5826
 epoch: 99, train_loss: 0.4039, test_loss: 2.1898, test_f1: 0.6021
##################ITERATION #4 ****************************************
 epoch: 0, train_loss: 1.2256, test_loss: 1.2671, test_f1: 0.1700
 epoch: 1, train_loss: 1.1287, test_loss: 1.2046, test_f1: 0.3713
 epoch: 2, train_loss: 1.0758, test_loss: 1.1226, test_f1: 0.4594
 epoch: 3, train_loss: 1.0364, test_loss: 1.0953, test_f1: 0.4791
 epoch: 4, train_loss: 1.0035, test_loss: 1.0730, test_f1: 0.5141
 epoch: 5, train_loss: 0.9935, test_loss: 1.0523, test_f1: 0.5412
 epoch: 6, train_loss: 0.9749, test_loss: 1.0620, test_f1: 0.5284
 epoch: 7, train_loss: 0.9521, test_loss: 1.0423, test_f1: 0.5310
 epoch: 8, train_loss: 0.9480, test_loss: 1.0430, test_f1: 0.5194
 epoch: 9, train_loss: 0.9296, test_loss: 1.0364, test_f1: 0.5300
 epoch: 10, train_loss: 0.9094, test_loss: 1.0301, test_f1: 0.5463
 epoch: 11, train_loss: 0.9306, test_loss: 1.0936, test_f1: 0.5337
 epoch: 12, train_loss: 0.9079, test_loss: 1.0267, test_f1: 0.5275
 epoch: 13, train_loss: 0.8831, test_loss: 1.0330, test_f1: 0.5651
 epoch: 14, train_loss: 0.8774, test_loss: 1.0813, test_f1: 0.5562
 epoch: 15, train_loss: 0.8574, test_loss: 1.0257, test_f1: 0.5423
 epoch: 16, train_loss: 0.8651, test_loss: 1.0541, test_f1: 0.5183
 epoch: 17, train_loss: 0.8531, test_loss: 1.0369, test_f1: 0.5394
 epoch: 18, train_loss: 0.8656, test_loss: 1.0532, test_f1: 0.5360
 epoch: 19, train_loss: 0.8476, test_loss: 1.0098, test_f1: 0.5657
 epoch: 20, train_loss: 0.8331, test_loss: 1.0269, test_f1: 0.5831
 epoch: 21, train_loss: 0.8312, test_loss: 1.1192, test_f1: 0.5104
 epoch: 22, train_loss: 0.8405, test_loss: 1.0566, test_f1: 0.5641
 epoch: 23, train_loss: 0.8166, test_loss: 1.0397, test_f1: 0.5845
 epoch: 24, train_loss: 0.8133, test_loss: 1.1426, test_f1: 0.5089
 epoch: 25, train_loss: 0.8276, test_loss: 1.1055, test_f1: 0.5408
 epoch: 26, train_loss: 0.8075, test_loss: 1.0922, test_f1: 0.5318
 epoch: 27, train_loss: 0.7852, test_loss: 1.0792, test_f1: 0.5546
 epoch: 28, train_loss: 0.7648, test_loss: 1.1414, test_f1: 0.5540
 epoch: 29, train_loss: 0.7881, test_loss: 1.1192, test_f1: 0.5487
 epoch: 30, train_loss: 0.7822, test_loss: 1.1526, test_f1: 0.5653
 epoch: 31, train_loss: 0.7526, test_loss: 1.0980, test_f1: 0.5828
 epoch: 32, train_loss: 0.7554, test_loss: 1.0397, test_f1: 0.5851
 epoch: 33, train_loss: 0.7342, test_loss: 1.0953, test_f1: 0.5585
 epoch: 34, train_loss: 0.7374, test_loss: 1.0502, test_f1: 0.5742
 epoch: 35, train_loss: 0.7471, test_loss: 1.1988, test_f1: 0.5356
 epoch: 36, train_loss: 0.7254, test_loss: 1.2146, test_f1: 0.5571
 epoch: 37, train_loss: 0.7141, test_loss: 1.1202, test_f1: 0.5903
 epoch: 38, train_loss: 0.7027, test_loss: 1.1712, test_f1: 0.5505
 epoch: 39, train_loss: 0.6944, test_loss: 1.1887, test_f1: 0.5989
 epoch: 40, train_loss: 0.7050, test_loss: 1.1699, test_f1: 0.5457
 epoch: 41, train_loss: 0.7164, test_loss: 1.3280, test_f1: 0.5272
 epoch: 42, train_loss: 0.7123, test_loss: 1.1495, test_f1: 0.5623
 epoch: 43, train_loss: 0.6950, test_loss: 1.1429, test_f1: 0.5308
 epoch: 44, train_loss: 0.6754, test_loss: 1.2127, test_f1: 0.5616
 epoch: 45, train_loss: 0.6474, test_loss: 1.3089, test_f1: 0.5406
 epoch: 46, train_loss: 0.6484, test_loss: 1.2722, test_f1: 0.5691
 epoch: 47, train_loss: 0.6533, test_loss: 1.3423, test_f1: 0.5414
 epoch: 48, train_loss: 0.6491, test_loss: 1.3553, test_f1: 0.5831
 epoch: 49, train_loss: 0.6194, test_loss: 1.2354, test_f1: 0.5650
 epoch: 50, train_loss: 0.6557, test_loss: 1.4866, test_f1: 0.5006
 epoch: 51, train_loss: 0.6261, test_loss: 1.2911, test_f1: 0.5637
 epoch: 52, train_loss: 0.5869, test_loss: 1.3020, test_f1: 0.5917
 epoch: 53, train_loss: 0.5947, test_loss: 1.3239, test_f1: 0.6026
 epoch: 54, train_loss: 0.5748, test_loss: 1.2746, test_f1: 0.5783
 epoch: 55, train_loss: 0.5681, test_loss: 1.2843, test_f1: 0.5828
 epoch: 56, train_loss: 0.5765, test_loss: 1.3498, test_f1: 0.6004
 epoch: 57, train_loss: 0.5653, test_loss: 1.3770, test_f1: 0.5639
 epoch: 58, train_loss: 0.5736, test_loss: 1.2905, test_f1: 0.6139
 epoch: 59, train_loss: 0.5781, test_loss: 1.3406, test_f1: 0.6189
 epoch: 60, train_loss: 0.5451, test_loss: 1.4254, test_f1: 0.5999
 epoch: 61, train_loss: 0.5552, test_loss: 1.2732, test_f1: 0.5689
 epoch: 62, train_loss: 0.5354, test_loss: 1.4367, test_f1: 0.6091
 epoch: 63, train_loss: 0.5318, test_loss: 1.4014, test_f1: 0.6037
 epoch: 64, train_loss: 0.5516, test_loss: 1.3748, test_f1: 0.6358
 epoch: 65, train_loss: 0.5392, test_loss: 1.4707, test_f1: 0.5477
 epoch: 66, train_loss: 0.5291, test_loss: 1.5104, test_f1: 0.5418
 epoch: 67, train_loss: 0.5368, test_loss: 1.6258, test_f1: 0.5694
 epoch: 68, train_loss: 0.5354, test_loss: 1.4861, test_f1: 0.5665
 epoch: 69, train_loss: 0.5194, test_loss: 1.4673, test_f1: 0.5947
 epoch: 70, train_loss: 0.5320, test_loss: 1.3766, test_f1: 0.6009
 epoch: 71, train_loss: 0.5178, test_loss: 1.4175, test_f1: 0.5809
 epoch: 72, train_loss: 0.4996, test_loss: 1.4372, test_f1: 0.6236
 epoch: 73, train_loss: 0.5234, test_loss: 1.6079, test_f1: 0.5384
 epoch: 74, train_loss: 0.5110, test_loss: 1.5210, test_f1: 0.6020
 epoch: 75, train_loss: 0.5011, test_loss: 1.4611, test_f1: 0.5661
 epoch: 76, train_loss: 0.4961, test_loss: 1.5283, test_f1: 0.5856
 epoch: 77, train_loss: 0.5032, test_loss: 1.3198, test_f1: 0.6298
 epoch: 78, train_loss: 0.4974, test_loss: 1.6133, test_f1: 0.6034
 epoch: 79, train_loss: 0.4923, test_loss: 1.3953, test_f1: 0.6116
 epoch: 80, train_loss: 0.4648, test_loss: 1.5719, test_f1: 0.6270
 epoch: 81, train_loss: 0.4733, test_loss: 1.4782, test_f1: 0.5996
 epoch: 82, train_loss: 0.4830, test_loss: 1.4462, test_f1: 0.6164
 epoch: 83, train_loss: 0.4714, test_loss: 1.5983, test_f1: 0.6004
 epoch: 84, train_loss: 0.4739, test_loss: 1.5496, test_f1: 0.6092
 epoch: 85, train_loss: 0.4726, test_loss: 1.4895, test_f1: 0.5987
 epoch: 86, train_loss: 0.4597, test_loss: 1.4530, test_f1: 0.6203
 epoch: 87, train_loss: 0.4520, test_loss: 1.6172, test_f1: 0.6204
 epoch: 88, train_loss: 0.4437, test_loss: 1.5555, test_f1: 0.6432
 epoch: 89, train_loss: 0.4518, test_loss: 1.6199, test_f1: 0.5848
 epoch: 90, train_loss: 0.4583, test_loss: 1.6187, test_f1: 0.6104
 epoch: 91, train_loss: 0.4665, test_loss: 1.5816, test_f1: 0.6457
 epoch: 92, train_loss: 0.4358, test_loss: 1.5542, test_f1: 0.6311
 epoch: 93, train_loss: 0.4411, test_loss: 1.6423, test_f1: 0.6362
 epoch: 94, train_loss: 0.4572, test_loss: 1.6881, test_f1: 0.5854
 epoch: 95, train_loss: 0.4252, test_loss: 1.5779, test_f1: 0.6281
 epoch: 96, train_loss: 0.4161, test_loss: 1.6228, test_f1: 0.6264
 epoch: 97, train_loss: 0.4461, test_loss: 1.5638, test_f1: 0.6436
 epoch: 98, train_loss: 0.4473, test_loss: 1.6032, test_f1: 0.5935
 epoch: 99, train_loss: 0.4380, test_loss: 1.6653, test_f1: 0.6056
##################ITERATION #5 ****************************************
 epoch: 0, train_loss: 1.3176, test_loss: 1.2516, test_f1: 0.2777
 epoch: 1, train_loss: 1.1269, test_loss: 1.2237, test_f1: 0.4178
 epoch: 2, train_loss: 1.0975, test_loss: 1.1796, test_f1: 0.4144
 epoch: 3, train_loss: 1.0657, test_loss: 1.1441, test_f1: 0.4303
 epoch: 4, train_loss: 1.0410, test_loss: 1.1537, test_f1: 0.4243
 epoch: 5, train_loss: 1.0237, test_loss: 1.0981, test_f1: 0.4672
 epoch: 6, train_loss: 1.0102, test_loss: 1.1309, test_f1: 0.5013
 epoch: 7, train_loss: 0.9916, test_loss: 1.1091, test_f1: 0.4942
 epoch: 8, train_loss: 0.9714, test_loss: 1.1119, test_f1: 0.5294
 epoch: 9, train_loss: 0.9641, test_loss: 1.1361, test_f1: 0.4786
 epoch: 10, train_loss: 0.9602, test_loss: 1.0871, test_f1: 0.5391
 epoch: 11, train_loss: 0.9456, test_loss: 1.0934, test_f1: 0.5076
 epoch: 12, train_loss: 0.9317, test_loss: 1.0507, test_f1: 0.5284
 epoch: 13, train_loss: 0.9309, test_loss: 1.0979, test_f1: 0.5099
 epoch: 14, train_loss: 0.9142, test_loss: 1.0693, test_f1: 0.5421
 epoch: 15, train_loss: 0.8923, test_loss: 1.0563, test_f1: 0.5674
 epoch: 16, train_loss: 0.9105, test_loss: 1.0604, test_f1: 0.5182
 epoch: 17, train_loss: 0.9009, test_loss: 1.0879, test_f1: 0.5449
 epoch: 18, train_loss: 0.8715, test_loss: 1.0231, test_f1: 0.5755
 epoch: 19, train_loss: 0.8690, test_loss: 1.1182, test_f1: 0.5414
 epoch: 20, train_loss: 0.8673, test_loss: 1.0488, test_f1: 0.5769
 epoch: 21, train_loss: 0.8504, test_loss: 1.0663, test_f1: 0.5605
 epoch: 22, train_loss: 0.8595, test_loss: 0.9988, test_f1: 0.5676
 epoch: 23, train_loss: 0.8416, test_loss: 1.0724, test_f1: 0.5558
 epoch: 24, train_loss: 0.8403, test_loss: 1.0045, test_f1: 0.5784
 epoch: 25, train_loss: 0.8425, test_loss: 1.0293, test_f1: 0.5708
 epoch: 26, train_loss: 0.8463, test_loss: 1.0548, test_f1: 0.5569
 epoch: 27, train_loss: 0.8354, test_loss: 1.0502, test_f1: 0.6106
 epoch: 28, train_loss: 0.8092, test_loss: 1.0068, test_f1: 0.5703
 epoch: 29, train_loss: 0.8170, test_loss: 1.1044, test_f1: 0.5596
 epoch: 30, train_loss: 0.8122, test_loss: 1.0746, test_f1: 0.5619
 epoch: 31, train_loss: 0.7932, test_loss: 1.0460, test_f1: 0.5363
 epoch: 32, train_loss: 0.7879, test_loss: 1.0895, test_f1: 0.5576
 epoch: 33, train_loss: 0.7826, test_loss: 1.0446, test_f1: 0.5999
 epoch: 34, train_loss: 0.7615, test_loss: 1.0969, test_f1: 0.5687
 epoch: 35, train_loss: 0.7658, test_loss: 1.0297, test_f1: 0.5765
 epoch: 36, train_loss: 0.7524, test_loss: 1.1047, test_f1: 0.5913
 epoch: 37, train_loss: 0.7571, test_loss: 1.0659, test_f1: 0.5305
 epoch: 38, train_loss: 0.7578, test_loss: 1.1141, test_f1: 0.5774
 epoch: 39, train_loss: 0.7323, test_loss: 1.1889, test_f1: 0.5669
 epoch: 40, train_loss: 0.7460, test_loss: 1.0608, test_f1: 0.5569
 epoch: 41, train_loss: 0.7507, test_loss: 1.0466, test_f1: 0.6089
 epoch: 42, train_loss: 0.6970, test_loss: 1.1089, test_f1: 0.6122
 epoch: 43, train_loss: 0.7137, test_loss: 1.0615, test_f1: 0.6038
 epoch: 44, train_loss: 0.7045, test_loss: 1.1767, test_f1: 0.5477
 epoch: 45, train_loss: 0.6998, test_loss: 1.1128, test_f1: 0.5925
 epoch: 46, train_loss: 0.6889, test_loss: 1.1179, test_f1: 0.5994
 epoch: 47, train_loss: 0.6702, test_loss: 1.1759, test_f1: 0.5446
 epoch: 48, train_loss: 0.7035, test_loss: 1.1748, test_f1: 0.5667
 epoch: 49, train_loss: 0.7012, test_loss: 1.1014, test_f1: 0.6089
 epoch: 50, train_loss: 0.6553, test_loss: 1.1650, test_f1: 0.5881
 epoch: 51, train_loss: 0.6417, test_loss: 1.1655, test_f1: 0.5961
 epoch: 52, train_loss: 0.6541, test_loss: 1.1518, test_f1: 0.6021
 epoch: 53, train_loss: 0.6484, test_loss: 1.1330, test_f1: 0.5854
 epoch: 54, train_loss: 0.6263, test_loss: 1.1777, test_f1: 0.6165
 epoch: 55, train_loss: 0.6295, test_loss: 1.1441, test_f1: 0.6097
 epoch: 56, train_loss: 0.6063, test_loss: 1.2242, test_f1: 0.6168
 epoch: 57, train_loss: 0.6138, test_loss: 1.1862, test_f1: 0.6309
 epoch: 58, train_loss: 0.6053, test_loss: 1.2561, test_f1: 0.5905
 epoch: 59, train_loss: 0.6039, test_loss: 1.2553, test_f1: 0.6055
 epoch: 60, train_loss: 0.5985, test_loss: 1.2984, test_f1: 0.5873
 epoch: 61, train_loss: 0.5981, test_loss: 1.2478, test_f1: 0.6130
 epoch: 62, train_loss: 0.6111, test_loss: 1.3119, test_f1: 0.5879
 epoch: 63, train_loss: 0.5966, test_loss: 1.2902, test_f1: 0.6077
 epoch: 64, train_loss: 0.5908, test_loss: 1.3290, test_f1: 0.6025
 epoch: 65, train_loss: 0.5946, test_loss: 1.2775, test_f1: 0.5941
 epoch: 66, train_loss: 0.6105, test_loss: 1.2727, test_f1: 0.5788
 epoch: 67, train_loss: 0.5924, test_loss: 1.4618, test_f1: 0.5374
 epoch: 68, train_loss: 0.5765, test_loss: 1.2866, test_f1: 0.5974
 epoch: 69, train_loss: 0.5793, test_loss: 1.2610, test_f1: 0.5786
 epoch: 70, train_loss: 0.5808, test_loss: 1.1624, test_f1: 0.6178
 epoch: 71, train_loss: 0.5652, test_loss: 1.2250, test_f1: 0.6309
 epoch: 72, train_loss: 0.5779, test_loss: 1.3423, test_f1: 0.6077
 epoch: 73, train_loss: 0.5637, test_loss: 1.2585, test_f1: 0.6376
 epoch: 74, train_loss: 0.5662, test_loss: 1.3880, test_f1: 0.6035
 epoch: 75, train_loss: 0.5429, test_loss: 1.3434, test_f1: 0.5924
 epoch: 76, train_loss: 0.5365, test_loss: 1.3438, test_f1: 0.5991
 epoch: 77, train_loss: 0.5759, test_loss: 1.3529, test_f1: 0.5800
 epoch: 78, train_loss: 0.5541, test_loss: 1.4074, test_f1: 0.5535
 epoch: 79, train_loss: 0.5702, test_loss: 1.2887, test_f1: 0.6055
 epoch: 80, train_loss: 0.5355, test_loss: 1.3145, test_f1: 0.6315
 epoch: 81, train_loss: 0.5441, test_loss: 1.3844, test_f1: 0.5854
 epoch: 82, train_loss: 0.5399, test_loss: 1.3881, test_f1: 0.5768
 epoch: 83, train_loss: 0.5354, test_loss: 1.3629, test_f1: 0.5998
 epoch: 84, train_loss: 0.5227, test_loss: 1.3238, test_f1: 0.5997
 epoch: 85, train_loss: 0.5346, test_loss: 1.4123, test_f1: 0.5716
 epoch: 86, train_loss: 0.5411, test_loss: 1.4117, test_f1: 0.5935
 epoch: 87, train_loss: 0.5186, test_loss: 1.3665, test_f1: 0.5773
 epoch: 88, train_loss: 0.5312, test_loss: 1.3531, test_f1: 0.5844
 epoch: 89, train_loss: 0.5281, test_loss: 1.4282, test_f1: 0.6298
 epoch: 90, train_loss: 0.5284, test_loss: 1.3834, test_f1: 0.5717
 epoch: 91, train_loss: 0.5030, test_loss: 1.3383, test_f1: 0.5932
 epoch: 92, train_loss: 0.5227, test_loss: 1.4788, test_f1: 0.5771
 epoch: 93, train_loss: 0.5062, test_loss: 1.3948, test_f1: 0.5730
 epoch: 94, train_loss: 0.4785, test_loss: 1.4598, test_f1: 0.6053
 epoch: 95, train_loss: 0.5142, test_loss: 1.4360, test_f1: 0.5844
 epoch: 96, train_loss: 0.5023, test_loss: 1.4889, test_f1: 0.5652
 epoch: 97, train_loss: 0.5003, test_loss: 1.3995, test_f1: 0.5645
 epoch: 98, train_loss: 0.4962, test_loss: 1.5178, test_f1: 0.5777
 epoch: 99, train_loss: 0.4954, test_loss: 1.5028, test_f1: 0.6062
##################ITERATION #6 ****************************************
 epoch: 0, train_loss: 1.4482, test_loss: 1.3767, test_f1: 0.1788
 epoch: 1, train_loss: 1.1717, test_loss: 1.2663, test_f1: 0.3095
 epoch: 2, train_loss: 1.0988, test_loss: 1.1759, test_f1: 0.4545
 epoch: 3, train_loss: 1.0599, test_loss: 1.1185, test_f1: 0.5107
 epoch: 4, train_loss: 1.0396, test_loss: 1.1021, test_f1: 0.5124
 epoch: 5, train_loss: 1.0102, test_loss: 1.1002, test_f1: 0.5057
 epoch: 6, train_loss: 1.0080, test_loss: 1.0885, test_f1: 0.5363
 epoch: 7, train_loss: 0.9933, test_loss: 1.0662, test_f1: 0.5125
 epoch: 8, train_loss: 0.9769, test_loss: 1.0697, test_f1: 0.5142
 epoch: 9, train_loss: 0.9469, test_loss: 1.0328, test_f1: 0.5559
 epoch: 10, train_loss: 0.9419, test_loss: 1.0402, test_f1: 0.5591
 epoch: 11, train_loss: 0.9476, test_loss: 0.9909, test_f1: 0.5540
 epoch: 12, train_loss: 0.9246, test_loss: 0.9894, test_f1: 0.5771
 epoch: 13, train_loss: 0.9173, test_loss: 0.9941, test_f1: 0.6076
 epoch: 14, train_loss: 0.8917, test_loss: 1.0505, test_f1: 0.5678
 epoch: 15, train_loss: 0.8849, test_loss: 0.9871, test_f1: 0.5732
 epoch: 16, train_loss: 0.8804, test_loss: 0.9972, test_f1: 0.5824
 epoch: 17, train_loss: 0.8718, test_loss: 0.9928, test_f1: 0.5959
 epoch: 18, train_loss: 0.8799, test_loss: 0.9923, test_f1: 0.5909
 epoch: 19, train_loss: 0.8654, test_loss: 1.0100, test_f1: 0.5670
 epoch: 20, train_loss: 0.8698, test_loss: 0.9477, test_f1: 0.5806
 epoch: 21, train_loss: 0.8431, test_loss: 1.0212, test_f1: 0.5910
 epoch: 22, train_loss: 0.8348, test_loss: 0.9699, test_f1: 0.6036
 epoch: 23, train_loss: 0.8352, test_loss: 0.9812, test_f1: 0.5707
 epoch: 24, train_loss: 0.8452, test_loss: 0.9967, test_f1: 0.5680
 epoch: 25, train_loss: 0.8319, test_loss: 0.9848, test_f1: 0.5964
 epoch: 26, train_loss: 0.8265, test_loss: 0.9736, test_f1: 0.6166
 epoch: 27, train_loss: 0.8201, test_loss: 1.0226, test_f1: 0.6140
 epoch: 28, train_loss: 0.8228, test_loss: 1.0204, test_f1: 0.6044
 epoch: 29, train_loss: 0.8079, test_loss: 1.0321, test_f1: 0.6047
 epoch: 30, train_loss: 0.8093, test_loss: 1.0957, test_f1: 0.5793
 epoch: 31, train_loss: 0.7887, test_loss: 1.0075, test_f1: 0.6070
 epoch: 32, train_loss: 0.7942, test_loss: 1.0874, test_f1: 0.5820
 epoch: 33, train_loss: 0.7755, test_loss: 1.0064, test_f1: 0.6083
 epoch: 34, train_loss: 0.7916, test_loss: 1.0104, test_f1: 0.6100
 epoch: 35, train_loss: 0.7822, test_loss: 1.0934, test_f1: 0.5736
 epoch: 36, train_loss: 0.7890, test_loss: 1.0453, test_f1: 0.6159
 epoch: 37, train_loss: 0.7719, test_loss: 1.0061, test_f1: 0.6065
 epoch: 38, train_loss: 0.7626, test_loss: 0.9965, test_f1: 0.5985
 epoch: 39, train_loss: 0.7455, test_loss: 1.1359, test_f1: 0.6218
 epoch: 40, train_loss: 0.7392, test_loss: 1.0584, test_f1: 0.5850
 epoch: 41, train_loss: 0.7347, test_loss: 1.0096, test_f1: 0.5987
 epoch: 42, train_loss: 0.7277, test_loss: 1.0490, test_f1: 0.5898
 epoch: 43, train_loss: 0.7330, test_loss: 1.0408, test_f1: 0.5875
 epoch: 44, train_loss: 0.7060, test_loss: 1.0256, test_f1: 0.6064
 epoch: 45, train_loss: 0.7307, test_loss: 1.0787, test_f1: 0.6087
 epoch: 46, train_loss: 0.7355, test_loss: 1.1125, test_f1: 0.5788
 epoch: 47, train_loss: 0.7043, test_loss: 1.1000, test_f1: 0.6059
 epoch: 48, train_loss: 0.7078, test_loss: 1.0773, test_f1: 0.6288
 epoch: 49, train_loss: 0.7054, test_loss: 1.0067, test_f1: 0.5979
 epoch: 50, train_loss: 0.7021, test_loss: 1.0807, test_f1: 0.6050
 epoch: 51, train_loss: 0.6693, test_loss: 1.0862, test_f1: 0.6269
 epoch: 52, train_loss: 0.6706, test_loss: 1.0755, test_f1: 0.6234
 epoch: 53, train_loss: 0.6650, test_loss: 1.1240, test_f1: 0.6298
 epoch: 54, train_loss: 0.6470, test_loss: 1.0778, test_f1: 0.6163
 epoch: 55, train_loss: 0.6652, test_loss: 1.0769, test_f1: 0.6330
 epoch: 56, train_loss: 0.6528, test_loss: 1.0739, test_f1: 0.6261
 epoch: 57, train_loss: 0.6358, test_loss: 1.0936, test_f1: 0.6352
 epoch: 58, train_loss: 0.6421, test_loss: 1.0801, test_f1: 0.6341
 epoch: 59, train_loss: 0.6465, test_loss: 1.1437, test_f1: 0.6003
 epoch: 60, train_loss: 0.6173, test_loss: 1.0840, test_f1: 0.6264
 epoch: 61, train_loss: 0.6262, test_loss: 1.1512, test_f1: 0.6062
 epoch: 62, train_loss: 0.6232, test_loss: 1.1545, test_f1: 0.6128
 epoch: 63, train_loss: 0.6349, test_loss: 1.1206, test_f1: 0.6251
 epoch: 64, train_loss: 0.6027, test_loss: 1.1492, test_f1: 0.6294
 epoch: 65, train_loss: 0.6252, test_loss: 1.1965, test_f1: 0.6147
 epoch: 66, train_loss: 0.6324, test_loss: 1.1468, test_f1: 0.6138
 epoch: 67, train_loss: 0.6080, test_loss: 1.1725, test_f1: 0.5868
 epoch: 68, train_loss: 0.5963, test_loss: 1.2602, test_f1: 0.6013
 epoch: 69, train_loss: 0.6099, test_loss: 1.1560, test_f1: 0.6053
 epoch: 70, train_loss: 0.6040, test_loss: 1.1843, test_f1: 0.5975
 epoch: 71, train_loss: 0.5809, test_loss: 1.1650, test_f1: 0.6078
 epoch: 72, train_loss: 0.5761, test_loss: 1.2310, test_f1: 0.6075
 epoch: 73, train_loss: 0.5864, test_loss: 1.1760, test_f1: 0.5982
 epoch: 74, train_loss: 0.5721, test_loss: 1.1430, test_f1: 0.6018
 epoch: 75, train_loss: 0.5848, test_loss: 1.2575, test_f1: 0.6097
 epoch: 76, train_loss: 0.5911, test_loss: 1.1569, test_f1: 0.6054
 epoch: 77, train_loss: 0.5813, test_loss: 1.2737, test_f1: 0.6004
 epoch: 78, train_loss: 0.5750, test_loss: 1.2376, test_f1: 0.6091
 epoch: 79, train_loss: 0.5716, test_loss: 1.2718, test_f1: 0.6212
 epoch: 80, train_loss: 0.5567, test_loss: 1.2669, test_f1: 0.5956
 epoch: 81, train_loss: 0.5736, test_loss: 1.2259, test_f1: 0.6316
 epoch: 82, train_loss: 0.5664, test_loss: 1.2253, test_f1: 0.6300
 epoch: 83, train_loss: 0.5715, test_loss: 1.3150, test_f1: 0.6303
 epoch: 84, train_loss: 0.5690, test_loss: 1.2953, test_f1: 0.6226
 epoch: 85, train_loss: 0.5393, test_loss: 1.2989, test_f1: 0.6398
 epoch: 86, train_loss: 0.5410, test_loss: 1.3188, test_f1: 0.6114
 epoch: 87, train_loss: 0.5664, test_loss: 1.4267, test_f1: 0.5929
 epoch: 88, train_loss: 0.5572, test_loss: 1.3817, test_f1: 0.6390
 epoch: 89, train_loss: 0.5530, test_loss: 1.2870, test_f1: 0.6363
 epoch: 90, train_loss: 0.5716, test_loss: 1.3491, test_f1: 0.6461
 epoch: 91, train_loss: 0.5433, test_loss: 1.3561, test_f1: 0.6284
 epoch: 92, train_loss: 0.5219, test_loss: 1.3419, test_f1: 0.6262
 epoch: 93, train_loss: 0.5460, test_loss: 1.3547, test_f1: 0.6170
 epoch: 94, train_loss: 0.5387, test_loss: 1.3624, test_f1: 0.6356
 epoch: 95, train_loss: 0.5131, test_loss: 1.3201, test_f1: 0.6077
 epoch: 96, train_loss: 0.5261, test_loss: 1.4646, test_f1: 0.6288
 epoch: 97, train_loss: 0.5280, test_loss: 1.3747, test_f1: 0.6215
 epoch: 98, train_loss: 0.5272, test_loss: 1.4844, test_f1: 0.6358
 epoch: 99, train_loss: 0.5005, test_loss: 1.2998, test_f1: 0.6058
##################ITERATION #7 ****************************************
 epoch: 0, train_loss: 1.4919, test_loss: 1.3135, test_f1: 0.1672
 epoch: 1, train_loss: 1.1992, test_loss: 1.2015, test_f1: 0.4372
 epoch: 2, train_loss: 1.1007, test_loss: 1.1135, test_f1: 0.4861
 epoch: 3, train_loss: 1.0609, test_loss: 1.0953, test_f1: 0.5283
 epoch: 4, train_loss: 1.0244, test_loss: 1.1066, test_f1: 0.4821
 epoch: 5, train_loss: 1.0094, test_loss: 1.0841, test_f1: 0.4499
 epoch: 6, train_loss: 0.9925, test_loss: 1.1162, test_f1: 0.4897
 epoch: 7, train_loss: 0.9780, test_loss: 1.0627, test_f1: 0.4863
 epoch: 8, train_loss: 0.9625, test_loss: 1.0707, test_f1: 0.5376
 epoch: 9, train_loss: 0.9466, test_loss: 1.0759, test_f1: 0.5160
 epoch: 10, train_loss: 0.9093, test_loss: 1.0570, test_f1: 0.5181
 epoch: 11, train_loss: 0.9249, test_loss: 1.0460, test_f1: 0.5308
 epoch: 12, train_loss: 0.9090, test_loss: 1.1259, test_f1: 0.5041
 epoch: 13, train_loss: 0.8794, test_loss: 1.0832, test_f1: 0.5397
 epoch: 14, train_loss: 0.8793, test_loss: 1.0920, test_f1: 0.5771
 epoch: 15, train_loss: 0.8997, test_loss: 1.0958, test_f1: 0.5476
 epoch: 16, train_loss: 0.8739, test_loss: 1.0688, test_f1: 0.5506
 epoch: 17, train_loss: 0.8517, test_loss: 1.0916, test_f1: 0.5452
 epoch: 18, train_loss: 0.8582, test_loss: 1.1131, test_f1: 0.5277
 epoch: 19, train_loss: 0.8404, test_loss: 1.1122, test_f1: 0.5488
 epoch: 20, train_loss: 0.8096, test_loss: 1.0922, test_f1: 0.5636
 epoch: 21, train_loss: 0.8074, test_loss: 1.1341, test_f1: 0.5517
 epoch: 22, train_loss: 0.8247, test_loss: 1.0824, test_f1: 0.5594
 epoch: 23, train_loss: 0.8078, test_loss: 1.0637, test_f1: 0.6016
 epoch: 24, train_loss: 0.8153, test_loss: 1.1305, test_f1: 0.5859
 epoch: 25, train_loss: 0.7843, test_loss: 1.1405, test_f1: 0.5488
 epoch: 26, train_loss: 0.7764, test_loss: 1.2283, test_f1: 0.5621
 epoch: 27, train_loss: 0.7611, test_loss: 1.1071, test_f1: 0.6021
 epoch: 28, train_loss: 0.7896, test_loss: 1.2151, test_f1: 0.5776
 epoch: 29, train_loss: 0.7692, test_loss: 1.1650, test_f1: 0.5491
 epoch: 30, train_loss: 0.7653, test_loss: 1.1107, test_f1: 0.5930
 epoch: 31, train_loss: 0.7410, test_loss: 1.1484, test_f1: 0.5803
 epoch: 32, train_loss: 0.7155, test_loss: 1.1949, test_f1: 0.5687
 epoch: 33, train_loss: 0.7209, test_loss: 1.2093, test_f1: 0.5618
 epoch: 34, train_loss: 0.7138, test_loss: 1.1683, test_f1: 0.5840
 epoch: 35, train_loss: 0.7224, test_loss: 1.3058, test_f1: 0.5627
 epoch: 36, train_loss: 0.7047, test_loss: 1.1636, test_f1: 0.5768
 epoch: 37, train_loss: 0.6844, test_loss: 1.2417, test_f1: 0.5537
 epoch: 38, train_loss: 0.6924, test_loss: 1.1775, test_f1: 0.5571
 epoch: 39, train_loss: 0.7034, test_loss: 1.1667, test_f1: 0.5908
 epoch: 40, train_loss: 0.6994, test_loss: 1.3053, test_f1: 0.5678
 epoch: 41, train_loss: 0.6758, test_loss: 1.1717, test_f1: 0.5807
 epoch: 42, train_loss: 0.6816, test_loss: 1.3423, test_f1: 0.5841
 epoch: 43, train_loss: 0.6749, test_loss: 1.2946, test_f1: 0.5618
 epoch: 44, train_loss: 0.6695, test_loss: 1.2971, test_f1: 0.5807
 epoch: 45, train_loss: 0.6804, test_loss: 1.2332, test_f1: 0.6000
 epoch: 46, train_loss: 0.6587, test_loss: 1.2569, test_f1: 0.5947
 epoch: 47, train_loss: 0.6490, test_loss: 1.1623, test_f1: 0.5872
 epoch: 48, train_loss: 0.6554, test_loss: 1.2173, test_f1: 0.5987
 epoch: 49, train_loss: 0.6426, test_loss: 1.2900, test_f1: 0.5731
 epoch: 50, train_loss: 0.6454, test_loss: 1.3319, test_f1: 0.5992
 epoch: 51, train_loss: 0.6268, test_loss: 1.2872, test_f1: 0.5856
 epoch: 52, train_loss: 0.6136, test_loss: 1.3489, test_f1: 0.5827
 epoch: 53, train_loss: 0.5852, test_loss: 1.3737, test_f1: 0.5982
 epoch: 54, train_loss: 0.5882, test_loss: 1.4043, test_f1: 0.5773
 epoch: 55, train_loss: 0.5956, test_loss: 1.4030, test_f1: 0.5849
 epoch: 56, train_loss: 0.5956, test_loss: 1.3981, test_f1: 0.5956
 epoch: 57, train_loss: 0.5976, test_loss: 1.4033, test_f1: 0.6023
 epoch: 58, train_loss: 0.6065, test_loss: 1.4266, test_f1: 0.5677
 epoch: 59, train_loss: 0.5913, test_loss: 1.4530, test_f1: 0.5682
 epoch: 60, train_loss: 0.5882, test_loss: 1.4612, test_f1: 0.5688
 epoch: 61, train_loss: 0.5728, test_loss: 1.4973, test_f1: 0.5741
 epoch: 62, train_loss: 0.5739, test_loss: 1.4896, test_f1: 0.5888
 epoch: 63, train_loss: 0.5790, test_loss: 1.4488, test_f1: 0.6067
 epoch: 64, train_loss: 0.5552, test_loss: 1.5187, test_f1: 0.5734
 epoch: 65, train_loss: 0.5675, test_loss: 1.4193, test_f1: 0.5792
 epoch: 66, train_loss: 0.5545, test_loss: 1.4832, test_f1: 0.5844
 epoch: 67, train_loss: 0.5633, test_loss: 1.4954, test_f1: 0.6014
 epoch: 68, train_loss: 0.5715, test_loss: 1.6263, test_f1: 0.5883
 epoch: 69, train_loss: 0.5488, test_loss: 1.5701, test_f1: 0.5807
 epoch: 70, train_loss: 0.5533, test_loss: 1.5360, test_f1: 0.6145
 epoch: 71, train_loss: 0.5490, test_loss: 1.5741, test_f1: 0.5839
 epoch: 72, train_loss: 0.5384, test_loss: 1.5233, test_f1: 0.5849
 epoch: 73, train_loss: 0.5500, test_loss: 1.4991, test_f1: 0.5797
 epoch: 74, train_loss: 0.5495, test_loss: 1.5187, test_f1: 0.6056
 epoch: 75, train_loss: 0.5371, test_loss: 1.5952, test_f1: 0.5796
 epoch: 76, train_loss: 0.5295, test_loss: 1.6091, test_f1: 0.5886
 epoch: 77, train_loss: 0.5302, test_loss: 1.6332, test_f1: 0.6003
 epoch: 78, train_loss: 0.5416, test_loss: 1.6848, test_f1: 0.5761
 epoch: 79, train_loss: 0.5107, test_loss: 1.6748, test_f1: 0.5699
 epoch: 80, train_loss: 0.5191, test_loss: 1.7669, test_f1: 0.5962
 epoch: 81, train_loss: 0.5050, test_loss: 1.5859, test_f1: 0.5850
 epoch: 82, train_loss: 0.5445, test_loss: 1.6632, test_f1: 0.5947
 epoch: 83, train_loss: 0.5081, test_loss: 1.7642, test_f1: 0.6045
 epoch: 84, train_loss: 0.5159, test_loss: 1.7001, test_f1: 0.5946
 epoch: 85, train_loss: 0.4934, test_loss: 1.6645, test_f1: 0.5986
 epoch: 86, train_loss: 0.5236, test_loss: 1.6849, test_f1: 0.5999
 epoch: 87, train_loss: 0.5142, test_loss: 1.7906, test_f1: 0.6035
 epoch: 88, train_loss: 0.5139, test_loss: 1.7009, test_f1: 0.5992
 epoch: 89, train_loss: 0.5203, test_loss: 1.8022, test_f1: 0.5814
 epoch: 90, train_loss: 0.5287, test_loss: 1.8198, test_f1: 0.6005
 epoch: 91, train_loss: 0.4947, test_loss: 1.7658, test_f1: 0.6048
 epoch: 92, train_loss: 0.4915, test_loss: 1.6399, test_f1: 0.5990
 epoch: 93, train_loss: 0.5012, test_loss: 1.7113, test_f1: 0.6008
 epoch: 94, train_loss: 0.4922, test_loss: 1.8664, test_f1: 0.5870
 epoch: 95, train_loss: 0.4877, test_loss: 1.6712, test_f1: 0.6071
 epoch: 96, train_loss: 0.4945, test_loss: 1.8636, test_f1: 0.5829
 epoch: 97, train_loss: 0.4854, test_loss: 1.8017, test_f1: 0.5941
 epoch: 98, train_loss: 0.4721, test_loss: 1.8773, test_f1: 0.5879
 epoch: 99, train_loss: 0.4945, test_loss: 1.8813, test_f1: 0.5928
##################ITERATION #8 ****************************************
 epoch: 0, train_loss: 1.4962, test_loss: 1.3939, test_f1: 0.1365
 epoch: 1, train_loss: 1.1730, test_loss: 1.2202, test_f1: 0.3918
 epoch: 2, train_loss: 1.1024, test_loss: 1.1568, test_f1: 0.4790
 epoch: 3, train_loss: 1.0555, test_loss: 1.1188, test_f1: 0.4749
 epoch: 4, train_loss: 1.0276, test_loss: 1.0819, test_f1: 0.5201
 epoch: 5, train_loss: 1.0005, test_loss: 1.0624, test_f1: 0.5208
 epoch: 6, train_loss: 0.9882, test_loss: 1.0797, test_f1: 0.5291
 epoch: 7, train_loss: 0.9678, test_loss: 1.0651, test_f1: 0.5336
 epoch: 8, train_loss: 0.9534, test_loss: 1.0359, test_f1: 0.5475
 epoch: 9, train_loss: 0.9322, test_loss: 1.0425, test_f1: 0.5212
 epoch: 10, train_loss: 0.9277, test_loss: 1.0573, test_f1: 0.5482
 epoch: 11, train_loss: 0.9086, test_loss: 1.0304, test_f1: 0.5656
 epoch: 12, train_loss: 0.8908, test_loss: 1.0654, test_f1: 0.5572
 epoch: 13, train_loss: 0.8943, test_loss: 1.0480, test_f1: 0.5452
 epoch: 14, train_loss: 0.8742, test_loss: 1.0471, test_f1: 0.5980
 epoch: 15, train_loss: 0.8574, test_loss: 1.0205, test_f1: 0.5799
 epoch: 16, train_loss: 0.8529, test_loss: 1.0941, test_f1: 0.5660
 epoch: 17, train_loss: 0.8291, test_loss: 1.0642, test_f1: 0.5966
 epoch: 18, train_loss: 0.8409, test_loss: 1.0405, test_f1: 0.5863
 epoch: 19, train_loss: 0.8142, test_loss: 1.0372, test_f1: 0.5800
 epoch: 20, train_loss: 0.8151, test_loss: 1.0563, test_f1: 0.6266
 epoch: 21, train_loss: 0.7955, test_loss: 1.1259, test_f1: 0.5803
 epoch: 22, train_loss: 0.7867, test_loss: 1.1048, test_f1: 0.5498
 epoch: 23, train_loss: 0.7861, test_loss: 1.1187, test_f1: 0.5450
 epoch: 24, train_loss: 0.7760, test_loss: 1.0898, test_f1: 0.5943
 epoch: 25, train_loss: 0.7698, test_loss: 1.1294, test_f1: 0.5824
 epoch: 26, train_loss: 0.7521, test_loss: 1.0883, test_f1: 0.5208
 epoch: 27, train_loss: 0.7571, test_loss: 1.1081, test_f1: 0.5922
 epoch: 28, train_loss: 0.7502, test_loss: 1.1104, test_f1: 0.5833
 epoch: 29, train_loss: 0.7423, test_loss: 1.0802, test_f1: 0.6159
 epoch: 30, train_loss: 0.7345, test_loss: 1.1496, test_f1: 0.5894
 epoch: 31, train_loss: 0.7230, test_loss: 1.1639, test_f1: 0.5842
 epoch: 32, train_loss: 0.7141, test_loss: 1.1154, test_f1: 0.5515
 epoch: 33, train_loss: 0.7146, test_loss: 1.1510, test_f1: 0.5907
 epoch: 34, train_loss: 0.6997, test_loss: 1.1332, test_f1: 0.5523
 epoch: 35, train_loss: 0.6796, test_loss: 1.1657, test_f1: 0.5879
 epoch: 36, train_loss: 0.6731, test_loss: 1.1260, test_f1: 0.5936
 epoch: 37, train_loss: 0.6663, test_loss: 1.2556, test_f1: 0.5925
 epoch: 38, train_loss: 0.6769, test_loss: 1.1467, test_f1: 0.6075
 epoch: 39, train_loss: 0.6946, test_loss: 1.0985, test_f1: 0.5735
 epoch: 40, train_loss: 0.6559, test_loss: 1.2042, test_f1: 0.6019
 epoch: 41, train_loss: 0.6527, test_loss: 1.2682, test_f1: 0.5837
 epoch: 42, train_loss: 0.6633, test_loss: 1.2039, test_f1: 0.5956
 epoch: 43, train_loss: 0.6071, test_loss: 1.2194, test_f1: 0.6097
 epoch: 44, train_loss: 0.6085, test_loss: 1.4032, test_f1: 0.5723
 epoch: 45, train_loss: 0.6392, test_loss: 1.2256, test_f1: 0.5843
 epoch: 46, train_loss: 0.6170, test_loss: 1.2545, test_f1: 0.6296
 epoch: 47, train_loss: 0.6126, test_loss: 1.3320, test_f1: 0.5845
 epoch: 48, train_loss: 0.6269, test_loss: 1.3936, test_f1: 0.6435
 epoch: 49, train_loss: 0.5960, test_loss: 1.2973, test_f1: 0.5638
 epoch: 50, train_loss: 0.5928, test_loss: 1.3507, test_f1: 0.5920
 epoch: 51, train_loss: 0.5574, test_loss: 1.2777, test_f1: 0.6021
 epoch: 52, train_loss: 0.5482, test_loss: 1.2818, test_f1: 0.6143
 epoch: 53, train_loss: 0.5441, test_loss: 1.4003, test_f1: 0.6196
 epoch: 54, train_loss: 0.5383, test_loss: 1.4154, test_f1: 0.5898
 epoch: 55, train_loss: 0.5449, test_loss: 1.4114, test_f1: 0.6120
 epoch: 56, train_loss: 0.5308, test_loss: 1.4890, test_f1: 0.6079
 epoch: 57, train_loss: 0.5146, test_loss: 1.4170, test_f1: 0.6019
 epoch: 58, train_loss: 0.5258, test_loss: 1.4591, test_f1: 0.6129
 epoch: 59, train_loss: 0.5071, test_loss: 1.4602, test_f1: 0.5910
 epoch: 60, train_loss: 0.5184, test_loss: 1.6089, test_f1: 0.6228
 epoch: 61, train_loss: 0.5062, test_loss: 1.4313, test_f1: 0.6191
 epoch: 62, train_loss: 0.5044, test_loss: 1.6130, test_f1: 0.6069
 epoch: 63, train_loss: 0.4833, test_loss: 1.4797, test_f1: 0.6083
 epoch: 64, train_loss: 0.4868, test_loss: 1.4019, test_f1: 0.6276
 epoch: 65, train_loss: 0.5051, test_loss: 1.5082, test_f1: 0.6157
 epoch: 66, train_loss: 0.4765, test_loss: 1.4409, test_f1: 0.6084
 epoch: 67, train_loss: 0.5145, test_loss: 1.5128, test_f1: 0.6123
 epoch: 68, train_loss: 0.4773, test_loss: 1.5344, test_f1: 0.5898
 epoch: 69, train_loss: 0.4838, test_loss: 1.5431, test_f1: 0.6062
 epoch: 70, train_loss: 0.4855, test_loss: 1.6802, test_f1: 0.5704
 epoch: 71, train_loss: 0.4793, test_loss: 1.5740, test_f1: 0.6302
 epoch: 72, train_loss: 0.4961, test_loss: 1.5216, test_f1: 0.6289
 epoch: 73, train_loss: 0.4661, test_loss: 1.5513, test_f1: 0.6103
 epoch: 74, train_loss: 0.4733, test_loss: 1.6303, test_f1: 0.5643
 epoch: 75, train_loss: 0.4464, test_loss: 1.6675, test_f1: 0.6231
 epoch: 76, train_loss: 0.4668, test_loss: 1.6987, test_f1: 0.6283
 epoch: 77, train_loss: 0.4487, test_loss: 1.7566, test_f1: 0.6084
 epoch: 78, train_loss: 0.4635, test_loss: 1.7706, test_f1: 0.6109
 epoch: 79, train_loss: 0.4653, test_loss: 1.6568, test_f1: 0.6239
 epoch: 80, train_loss: 0.4455, test_loss: 1.7781, test_f1: 0.6089
 epoch: 81, train_loss: 0.4477, test_loss: 1.7285, test_f1: 0.5594
 epoch: 82, train_loss: 0.4349, test_loss: 1.7217, test_f1: 0.6093
 epoch: 83, train_loss: 0.4321, test_loss: 1.7673, test_f1: 0.6198
 epoch: 84, train_loss: 0.4554, test_loss: 1.6635, test_f1: 0.6279
 epoch: 85, train_loss: 0.4250, test_loss: 1.7754, test_f1: 0.6221
 epoch: 86, train_loss: 0.4092, test_loss: 1.7755, test_f1: 0.6147
 epoch: 87, train_loss: 0.4243, test_loss: 1.8898, test_f1: 0.6111
 epoch: 88, train_loss: 0.4170, test_loss: 1.8553, test_f1: 0.6072
 epoch: 89, train_loss: 0.4106, test_loss: 1.9475, test_f1: 0.5900
 epoch: 90, train_loss: 0.4203, test_loss: 1.8478, test_f1: 0.6325
 epoch: 91, train_loss: 0.4345, test_loss: 1.7824, test_f1: 0.6135
 epoch: 92, train_loss: 0.3972, test_loss: 1.8771, test_f1: 0.5944
 epoch: 93, train_loss: 0.4823, test_loss: 1.8853, test_f1: 0.5610
 epoch: 94, train_loss: 0.4160, test_loss: 1.8594, test_f1: 0.5892
 epoch: 95, train_loss: 0.4153, test_loss: 1.8808, test_f1: 0.6115
 epoch: 96, train_loss: 0.3946, test_loss: 1.9448, test_f1: 0.6136
 epoch: 97, train_loss: 0.4079, test_loss: 1.9103, test_f1: 0.6267
 epoch: 98, train_loss: 0.3982, test_loss: 1.9412, test_f1: 0.6089
 epoch: 99, train_loss: 0.3946, test_loss: 1.9048, test_f1: 0.6190
##################ITERATION #9 ****************************************
 epoch: 0, train_loss: 1.4776, test_loss: 1.3768, test_f1: 0.2186
 epoch: 1, train_loss: 1.1467, test_loss: 1.2961, test_f1: 0.2161
 epoch: 2, train_loss: 1.1127, test_loss: 1.0898, test_f1: 0.4910
 epoch: 3, train_loss: 1.0899, test_loss: 1.0339, test_f1: 0.5431
 epoch: 4, train_loss: 1.0346, test_loss: 1.0259, test_f1: 0.5643
 epoch: 5, train_loss: 1.0084, test_loss: 1.0411, test_f1: 0.5480
 epoch: 6, train_loss: 1.0019, test_loss: 1.0169, test_f1: 0.5425
 epoch: 7, train_loss: 0.9776, test_loss: 1.0147, test_f1: 0.5629
 epoch: 8, train_loss: 0.9467, test_loss: 1.0115, test_f1: 0.5515
 epoch: 9, train_loss: 0.9371, test_loss: 1.0046, test_f1: 0.5793
 epoch: 10, train_loss: 0.9304, test_loss: 1.0365, test_f1: 0.5245
 epoch: 11, train_loss: 0.9312, test_loss: 0.9803, test_f1: 0.5855
 epoch: 12, train_loss: 0.9124, test_loss: 1.0084, test_f1: 0.5780
 epoch: 13, train_loss: 0.9093, test_loss: 1.0031, test_f1: 0.5906
 epoch: 14, train_loss: 0.8857, test_loss: 1.0205, test_f1: 0.6013
 epoch: 15, train_loss: 0.8753, test_loss: 0.9962, test_f1: 0.5687
 epoch: 16, train_loss: 0.8852, test_loss: 0.9942, test_f1: 0.5887
 epoch: 17, train_loss: 0.8730, test_loss: 1.0113, test_f1: 0.5928
 epoch: 18, train_loss: 0.8552, test_loss: 1.0362, test_f1: 0.5830
 epoch: 19, train_loss: 0.8484, test_loss: 1.0145, test_f1: 0.6040
 epoch: 20, train_loss: 0.8473, test_loss: 1.0391, test_f1: 0.5639
 epoch: 21, train_loss: 0.8280, test_loss: 1.0337, test_f1: 0.5652
 epoch: 22, train_loss: 0.8229, test_loss: 1.0231, test_f1: 0.5898
 epoch: 23, train_loss: 0.8259, test_loss: 1.0224, test_f1: 0.5842
 epoch: 24, train_loss: 0.8282, test_loss: 1.0262, test_f1: 0.5866
 epoch: 25, train_loss: 0.7927, test_loss: 1.0381, test_f1: 0.5951
 epoch: 26, train_loss: 0.8064, test_loss: 1.0187, test_f1: 0.5965
 epoch: 27, train_loss: 0.7805, test_loss: 1.0379, test_f1: 0.5796
 epoch: 28, train_loss: 0.8031, test_loss: 1.0420, test_f1: 0.5918
 epoch: 29, train_loss: 0.7872, test_loss: 1.0968, test_f1: 0.5699
 epoch: 30, train_loss: 0.7955, test_loss: 0.9885, test_f1: 0.6036
 epoch: 31, train_loss: 0.7867, test_loss: 1.0023, test_f1: 0.5556
 epoch: 32, train_loss: 0.7785, test_loss: 1.0190, test_f1: 0.6002
 epoch: 33, train_loss: 0.7632, test_loss: 1.0287, test_f1: 0.6114
 epoch: 34, train_loss: 0.7651, test_loss: 1.0048, test_f1: 0.5875
 epoch: 35, train_loss: 0.7483, test_loss: 1.0727, test_f1: 0.5882
 epoch: 36, train_loss: 0.7553, test_loss: 1.0115, test_f1: 0.6277
 epoch: 37, train_loss: 0.7208, test_loss: 1.0305, test_f1: 0.6068
 epoch: 38, train_loss: 0.7477, test_loss: 1.0866, test_f1: 0.5964
 epoch: 39, train_loss: 0.7289, test_loss: 1.0574, test_f1: 0.6090
 epoch: 40, train_loss: 0.7114, test_loss: 1.0734, test_f1: 0.5972
 epoch: 41, train_loss: 0.7382, test_loss: 1.0871, test_f1: 0.6101
 epoch: 42, train_loss: 0.7267, test_loss: 1.0264, test_f1: 0.5700
 epoch: 43, train_loss: 0.7435, test_loss: 1.0448, test_f1: 0.6217
 epoch: 44, train_loss: 0.7146, test_loss: 1.0555, test_f1: 0.6204
 epoch: 45, train_loss: 0.7092, test_loss: 1.1305, test_f1: 0.5993
 epoch: 46, train_loss: 0.6897, test_loss: 1.1069, test_f1: 0.6158
 epoch: 47, train_loss: 0.6806, test_loss: 1.1170, test_f1: 0.6029
 epoch: 48, train_loss: 0.6847, test_loss: 1.0715, test_f1: 0.5913
 epoch: 49, train_loss: 0.6812, test_loss: 1.1152, test_f1: 0.5918
 epoch: 50, train_loss: 0.6888, test_loss: 1.1513, test_f1: 0.6242
 epoch: 51, train_loss: 0.6535, test_loss: 1.1225, test_f1: 0.6146
 epoch: 52, train_loss: 0.6411, test_loss: 1.0694, test_f1: 0.6101
 epoch: 53, train_loss: 0.6407, test_loss: 1.0952, test_f1: 0.6181
 epoch: 54, train_loss: 0.6382, test_loss: 1.1507, test_f1: 0.5983
 epoch: 55, train_loss: 0.6198, test_loss: 1.0615, test_f1: 0.6145
 epoch: 56, train_loss: 0.6082, test_loss: 1.1578, test_f1: 0.6153
 epoch: 57, train_loss: 0.6100, test_loss: 1.1548, test_f1: 0.5904
 epoch: 58, train_loss: 0.6145, test_loss: 1.1160, test_f1: 0.6185
 epoch: 59, train_loss: 0.5963, test_loss: 1.1191, test_f1: 0.6160
 epoch: 60, train_loss: 0.5922, test_loss: 1.1038, test_f1: 0.6191
 epoch: 61, train_loss: 0.6057, test_loss: 1.1347, test_f1: 0.6209
 epoch: 62, train_loss: 0.5978, test_loss: 1.0645, test_f1: 0.6242
 epoch: 63, train_loss: 0.5845, test_loss: 1.1479, test_f1: 0.6223
 epoch: 64, train_loss: 0.5910, test_loss: 1.1582, test_f1: 0.6021
 epoch: 65, train_loss: 0.5743, test_loss: 1.1131, test_f1: 0.6323
 epoch: 66, train_loss: 0.5831, test_loss: 1.1767, test_f1: 0.6497
 epoch: 67, train_loss: 0.5659, test_loss: 1.1392, test_f1: 0.6217
 epoch: 68, train_loss: 0.5681, test_loss: 1.2262, test_f1: 0.6250
 epoch: 69, train_loss: 0.5735, test_loss: 1.1954, test_f1: 0.5947
 epoch: 70, train_loss: 0.5651, test_loss: 1.1711, test_f1: 0.6060
 epoch: 71, train_loss: 0.5668, test_loss: 1.1467, test_f1: 0.6247
 epoch: 72, train_loss: 0.5607, test_loss: 1.1958, test_f1: 0.6163
 epoch: 73, train_loss: 0.5601, test_loss: 1.1691, test_f1: 0.6190
 epoch: 74, train_loss: 0.5475, test_loss: 1.2144, test_f1: 0.6153
 epoch: 75, train_loss: 0.5596, test_loss: 1.2466, test_f1: 0.5912
 epoch: 76, train_loss: 0.5663, test_loss: 1.2903, test_f1: 0.5788
 epoch: 77, train_loss: 0.5589, test_loss: 1.1633, test_f1: 0.6266
 epoch: 78, train_loss: 0.5486, test_loss: 1.2298, test_f1: 0.6302
 epoch: 79, train_loss: 0.5312, test_loss: 1.2407, test_f1: 0.5980
 epoch: 80, train_loss: 0.5440, test_loss: 1.2171, test_f1: 0.6065
 epoch: 81, train_loss: 0.5622, test_loss: 1.2532, test_f1: 0.6307
 epoch: 82, train_loss: 0.5562, test_loss: 1.2068, test_f1: 0.6244
 epoch: 83, train_loss: 0.5379, test_loss: 1.1827, test_f1: 0.6236
 epoch: 84, train_loss: 0.5236, test_loss: 1.2370, test_f1: 0.6056
 epoch: 85, train_loss: 0.5251, test_loss: 1.3081, test_f1: 0.6076
 epoch: 86, train_loss: 0.5363, test_loss: 1.2414, test_f1: 0.5829
 epoch: 87, train_loss: 0.5070, test_loss: 1.3068, test_f1: 0.5966
 epoch: 88, train_loss: 0.5084, test_loss: 1.2484, test_f1: 0.6366
 epoch: 89, train_loss: 0.5020, test_loss: 1.2507, test_f1: 0.6020
 epoch: 90, train_loss: 0.5310, test_loss: 1.2408, test_f1: 0.6082
 epoch: 91, train_loss: 0.4973, test_loss: 1.2677, test_f1: 0.6346
 epoch: 92, train_loss: 0.5015, test_loss: 1.3099, test_f1: 0.6156
 epoch: 93, train_loss: 0.5150, test_loss: 1.2796, test_f1: 0.6169
 epoch: 94, train_loss: 0.4883, test_loss: 1.2481, test_f1: 0.6151
 epoch: 95, train_loss: 0.5034, test_loss: 1.2574, test_f1: 0.6266
 epoch: 96, train_loss: 0.4778, test_loss: 1.3147, test_f1: 0.6080
 epoch: 97, train_loss: 0.4938, test_loss: 1.2680, test_f1: 0.6303
 epoch: 98, train_loss: 0.4985, test_loss: 1.2785, test_f1: 0.6409
 epoch: 99, train_loss: 0.4800, test_loss: 1.3393, test_f1: 0.6040

Training completed in 405.88 seconds
Best F1: 0.6634 at epoch 91
Mean F1 across iterations: 0.6403  0.0123
========================FINAL RESULTS================================
FEGIN weighted F1: 0.6634  0.0123
python main.py --data ltspice_demos --representation component_net --model FEGIN --layers 3 --hiddens 32 --batch_size 64 --lr 0.001 --emb_size 128 --epochs 100 --save_appendix component_net_L3_H32_BS64_LR0.001_E128 --no_val
-----



STDERR:
  File "main.py", line 370, in <module>
    main()
  File "main.py", line 254, in main
    dataset = dataset_class(
  File "/home/philip/projects/ltspice_examples_code_repo/Circuit-Completion-Using-GNNs/component_classification_with_link_prediction_head/evaluation/FEGIN/kernel/circuit_datasets.py", line 15, in __init__
    self.data, self.slices = torch.load(self.processed_paths[0])
  File "/home/philip/.local/lib/python3.8/site-packages/torch/serialization.py", line 1040, in load
    warnings.warn(
  File "/usr/lib/python3.8/warnings.py", line 109, in _showwarnmsg
    sw(msg.message, msg.category, msg.filename, msg.lineno,
  File "main.py", line 47, in warn_with_traceback
    traceback.print_stack(file=log)
/home/philip/projects/ltspice_examples_code_repo/Circuit-Completion-Using-GNNs/component_classification_with_link_prediction_head/evaluation/FEGIN/kernel/circuit_datasets.py:15: FutureWarning: You are using `torch.load` with `weights_only=False` (the current default value), which uses the default pickle module implicitly. It is possible to construct malicious pickle data which will execute arbitrary code during unpickling (See https://github.com/pytorch/pytorch/blob/main/SECURITY.md#untrusted-models for more details). In a future release, the default value for `weights_only` will be flipped to `True`. This limits the functions that could be executed during unpickling. Arbitrary objects will no longer be allowed to be loaded via this mode unless they are explicitly allowlisted by the user via `torch.serialization.add_safe_globals`. We recommend you start setting `weights_only=True` for any use case where you don't have full control of the loaded file. Please open an issue on GitHub for any issues related to this experimental feature.
  self.data, self.slices = torch.load(self.processed_paths[0])
