STDOUT:
Results will be saved in /home/philip/projects/ltspice_examples_code_repo/Circuit-Completion-Using-GNNs/component_classification_with_link_prediction_head/evaluation/FEGIN/results/model_FEGIN_dataset_ltspice_demos
Command line input: python main.py --data ltspice_demos --representation component_component --model FEGIN --layers 4 --hiddens 64 --batch_size 64 --lr 0.0001 --emb_size 250 --epochs 100 --save_appendix component_component_L4_H64_BS64_LR0.0001_E250 --no_val
 is saved.
-----
ltspice_demos - FEGIN
Using 4 layers, 64 hidden units, h = 2
Loading component_component representation dataset
ENTERED
Training FEGIN on component_component representation
Train: 1565, Test: 383
##################ITERATION #0 ****************************************
 epoch: 0, train_loss: 1.3821, test_loss: 1.3773, test_f1: 0.2281
 epoch: 1, train_loss: 1.3677, test_loss: 1.3668, test_f1: 0.2281
 epoch: 2, train_loss: 1.3563, test_loss: 1.3557, test_f1: 0.2281
 epoch: 3, train_loss: 1.3434, test_loss: 1.3446, test_f1: 0.2281
 epoch: 4, train_loss: 1.3238, test_loss: 1.3302, test_f1: 0.2281
 epoch: 5, train_loss: 1.3030, test_loss: 1.3144, test_f1: 0.2281
 epoch: 6, train_loss: 1.2738, test_loss: 1.2966, test_f1: 0.2281
 epoch: 7, train_loss: 1.2466, test_loss: 1.2826, test_f1: 0.2281
 epoch: 8, train_loss: 1.2268, test_loss: 1.2703, test_f1: 0.2287
 epoch: 9, train_loss: 1.2042, test_loss: 1.2627, test_f1: 0.2338
 epoch: 10, train_loss: 1.1892, test_loss: 1.2517, test_f1: 0.2630
 epoch: 11, train_loss: 1.1800, test_loss: 1.2510, test_f1: 0.2674
 epoch: 12, train_loss: 1.1647, test_loss: 1.2471, test_f1: 0.2631
 epoch: 13, train_loss: 1.1606, test_loss: 1.2392, test_f1: 0.2611
 epoch: 14, train_loss: 1.1504, test_loss: 1.2409, test_f1: 0.2613
 epoch: 15, train_loss: 1.1414, test_loss: 1.2383, test_f1: 0.2692
 epoch: 16, train_loss: 1.1370, test_loss: 1.2324, test_f1: 0.2722
 epoch: 17, train_loss: 1.1281, test_loss: 1.2311, test_f1: 0.3079
 epoch: 18, train_loss: 1.1180, test_loss: 1.2309, test_f1: 0.2976
 epoch: 19, train_loss: 1.1148, test_loss: 1.2328, test_f1: 0.3237
 epoch: 20, train_loss: 1.1078, test_loss: 1.2286, test_f1: 0.3107
 epoch: 21, train_loss: 1.0991, test_loss: 1.2274, test_f1: 0.3051
 epoch: 22, train_loss: 1.0912, test_loss: 1.2219, test_f1: 0.3461
 epoch: 23, train_loss: 1.0814, test_loss: 1.2147, test_f1: 0.3965
 epoch: 24, train_loss: 1.0758, test_loss: 1.2153, test_f1: 0.4045
 epoch: 25, train_loss: 1.0668, test_loss: 1.2106, test_f1: 0.4136
 epoch: 26, train_loss: 1.0530, test_loss: 1.2102, test_f1: 0.4293
 epoch: 27, train_loss: 1.0535, test_loss: 1.2070, test_f1: 0.4155
 epoch: 28, train_loss: 1.0370, test_loss: 1.2106, test_f1: 0.4200
 epoch: 29, train_loss: 1.0307, test_loss: 1.1982, test_f1: 0.4136
 epoch: 30, train_loss: 1.0264, test_loss: 1.1999, test_f1: 0.4058
 epoch: 31, train_loss: 1.0042, test_loss: 1.1962, test_f1: 0.4086
 epoch: 32, train_loss: 1.0003, test_loss: 1.1951, test_f1: 0.4209
 epoch: 33, train_loss: 0.9992, test_loss: 1.1985, test_f1: 0.4129
 epoch: 34, train_loss: 0.9791, test_loss: 1.2032, test_f1: 0.4135
 epoch: 35, train_loss: 0.9743, test_loss: 1.2024, test_f1: 0.4234
 epoch: 36, train_loss: 0.9803, test_loss: 1.2185, test_f1: 0.4256
 epoch: 37, train_loss: 0.9669, test_loss: 1.2179, test_f1: 0.4198
 epoch: 38, train_loss: 0.9538, test_loss: 1.1982, test_f1: 0.4213
 epoch: 39, train_loss: 0.9533, test_loss: 1.2145, test_f1: 0.4250
 epoch: 40, train_loss: 0.9253, test_loss: 1.2188, test_f1: 0.4290
 epoch: 41, train_loss: 0.9340, test_loss: 1.2445, test_f1: 0.4294
 epoch: 42, train_loss: 0.9282, test_loss: 1.2451, test_f1: 0.4250
 epoch: 43, train_loss: 0.9131, test_loss: 1.2231, test_f1: 0.4350
 epoch: 44, train_loss: 0.8916, test_loss: 1.2551, test_f1: 0.4566
 epoch: 45, train_loss: 0.8949, test_loss: 1.2641, test_f1: 0.4480
 epoch: 46, train_loss: 0.8965, test_loss: 1.2688, test_f1: 0.4528
 epoch: 47, train_loss: 0.8862, test_loss: 1.2039, test_f1: 0.4913
 epoch: 48, train_loss: 0.8937, test_loss: 1.3321, test_f1: 0.4741
 epoch: 49, train_loss: 0.8846, test_loss: 1.3065, test_f1: 0.5173
 epoch: 50, train_loss: 0.8794, test_loss: 1.2823, test_f1: 0.4863
 epoch: 51, train_loss: 0.8697, test_loss: 1.2791, test_f1: 0.4987
 epoch: 52, train_loss: 0.8700, test_loss: 1.2640, test_f1: 0.4907
 epoch: 53, train_loss: 0.8519, test_loss: 1.2813, test_f1: 0.5055
 epoch: 54, train_loss: 0.8559, test_loss: 1.2748, test_f1: 0.5003
 epoch: 55, train_loss: 0.8491, test_loss: 1.2868, test_f1: 0.5058
 epoch: 56, train_loss: 0.8456, test_loss: 1.3232, test_f1: 0.5218
 epoch: 57, train_loss: 0.8375, test_loss: 1.3110, test_f1: 0.5053
 epoch: 58, train_loss: 0.8380, test_loss: 1.3243, test_f1: 0.5015
 epoch: 59, train_loss: 0.8300, test_loss: 1.3407, test_f1: 0.5036
 epoch: 60, train_loss: 0.8174, test_loss: 1.3206, test_f1: 0.5312
 epoch: 61, train_loss: 0.8475, test_loss: 1.3208, test_f1: 0.5226
 epoch: 62, train_loss: 0.8333, test_loss: 1.2908, test_f1: 0.5245
 epoch: 63, train_loss: 0.8219, test_loss: 1.3723, test_f1: 0.5170
 epoch: 64, train_loss: 0.8297, test_loss: 1.3487, test_f1: 0.5243
 epoch: 65, train_loss: 0.8067, test_loss: 1.3111, test_f1: 0.5306
 epoch: 66, train_loss: 0.8291, test_loss: 1.3594, test_f1: 0.5115
 epoch: 67, train_loss: 0.8153, test_loss: 1.3472, test_f1: 0.5178
 epoch: 68, train_loss: 0.8109, test_loss: 1.3340, test_f1: 0.5376
 epoch: 69, train_loss: 0.8047, test_loss: 1.3279, test_f1: 0.5261
 epoch: 70, train_loss: 0.8066, test_loss: 1.3668, test_f1: 0.5438
 epoch: 71, train_loss: 0.8202, test_loss: 1.3874, test_f1: 0.5363
 epoch: 72, train_loss: 0.8056, test_loss: 1.3490, test_f1: 0.5311
 epoch: 73, train_loss: 0.7942, test_loss: 1.3651, test_f1: 0.5302
 epoch: 74, train_loss: 0.8003, test_loss: 1.3987, test_f1: 0.5321
 epoch: 75, train_loss: 0.7929, test_loss: 1.3630, test_f1: 0.5369
 epoch: 76, train_loss: 0.7966, test_loss: 1.3796, test_f1: 0.5355
 epoch: 77, train_loss: 0.7871, test_loss: 1.4042, test_f1: 0.5392
 epoch: 78, train_loss: 0.7803, test_loss: 1.3949, test_f1: 0.5363
 epoch: 79, train_loss: 0.8012, test_loss: 1.4180, test_f1: 0.5462
 epoch: 80, train_loss: 0.7991, test_loss: 1.3910, test_f1: 0.5346
 epoch: 81, train_loss: 0.7967, test_loss: 1.3904, test_f1: 0.5341
 epoch: 82, train_loss: 0.7877, test_loss: 1.4266, test_f1: 0.5243
 epoch: 83, train_loss: 0.7720, test_loss: 1.4224, test_f1: 0.5292
 epoch: 84, train_loss: 0.7800, test_loss: 1.4419, test_f1: 0.5332
 epoch: 85, train_loss: 0.7656, test_loss: 1.4647, test_f1: 0.5237
 epoch: 86, train_loss: 0.7604, test_loss: 1.4294, test_f1: 0.5290
 epoch: 87, train_loss: 0.7647, test_loss: 1.4244, test_f1: 0.5324
 epoch: 88, train_loss: 0.7623, test_loss: 1.4658, test_f1: 0.5278
 epoch: 89, train_loss: 0.7475, test_loss: 1.4499, test_f1: 0.5382
 epoch: 90, train_loss: 0.7580, test_loss: 1.3421, test_f1: 0.5322
 epoch: 91, train_loss: 0.7616, test_loss: 1.4357, test_f1: 0.5241
 epoch: 92, train_loss: 0.7549, test_loss: 1.4635, test_f1: 0.5387
 epoch: 93, train_loss: 0.7652, test_loss: 1.4444, test_f1: 0.5498
 epoch: 94, train_loss: 0.7455, test_loss: 1.4452, test_f1: 0.5311
 epoch: 95, train_loss: 0.7550, test_loss: 1.4548, test_f1: 0.5364
 epoch: 96, train_loss: 0.7488, test_loss: 1.4397, test_f1: 0.5248
 epoch: 97, train_loss: 0.7467, test_loss: 1.4688, test_f1: 0.5302
 epoch: 98, train_loss: 0.7578, test_loss: 1.4807, test_f1: 0.5259
 epoch: 99, train_loss: 0.7469, test_loss: 1.5081, test_f1: 0.5212
##################ITERATION #1 ****************************************
 epoch: 0, train_loss: 1.3474, test_loss: 1.3685, test_f1: 0.2281
 epoch: 1, train_loss: 1.2996, test_loss: 1.3465, test_f1: 0.2643
 epoch: 2, train_loss: 1.2722, test_loss: 1.3204, test_f1: 0.3429
 epoch: 3, train_loss: 1.2432, test_loss: 1.2935, test_f1: 0.3234
 epoch: 4, train_loss: 1.2275, test_loss: 1.2884, test_f1: 0.3179
 epoch: 5, train_loss: 1.2092, test_loss: 1.2796, test_f1: 0.3247
 epoch: 6, train_loss: 1.2009, test_loss: 1.2734, test_f1: 0.3225
 epoch: 7, train_loss: 1.1893, test_loss: 1.2663, test_f1: 0.3267
 epoch: 8, train_loss: 1.1838, test_loss: 1.2633, test_f1: 0.3129
 epoch: 9, train_loss: 1.1710, test_loss: 1.2644, test_f1: 0.3286
 epoch: 10, train_loss: 1.1660, test_loss: 1.2559, test_f1: 0.3330
 epoch: 11, train_loss: 1.1528, test_loss: 1.2435, test_f1: 0.3444
 epoch: 12, train_loss: 1.1443, test_loss: 1.2489, test_f1: 0.3882
 epoch: 13, train_loss: 1.1387, test_loss: 1.2406, test_f1: 0.3705
 epoch: 14, train_loss: 1.1302, test_loss: 1.2298, test_f1: 0.3943
 epoch: 15, train_loss: 1.1205, test_loss: 1.2239, test_f1: 0.3924
 epoch: 16, train_loss: 1.1074, test_loss: 1.2235, test_f1: 0.4277
 epoch: 17, train_loss: 1.1017, test_loss: 1.2244, test_f1: 0.4209
 epoch: 18, train_loss: 1.0918, test_loss: 1.2153, test_f1: 0.4137
 epoch: 19, train_loss: 1.0835, test_loss: 1.2122, test_f1: 0.4311
 epoch: 20, train_loss: 1.0739, test_loss: 1.2067, test_f1: 0.4451
 epoch: 21, train_loss: 1.0646, test_loss: 1.2095, test_f1: 0.4361
 epoch: 22, train_loss: 1.0540, test_loss: 1.2152, test_f1: 0.4229
 epoch: 23, train_loss: 1.0476, test_loss: 1.2102, test_f1: 0.4557
 epoch: 24, train_loss: 1.0444, test_loss: 1.2044, test_f1: 0.4414
 epoch: 25, train_loss: 1.0346, test_loss: 1.1959, test_f1: 0.4648
 epoch: 26, train_loss: 1.0210, test_loss: 1.1836, test_f1: 0.4354
 epoch: 27, train_loss: 1.0214, test_loss: 1.1841, test_f1: 0.4507
 epoch: 28, train_loss: 1.0010, test_loss: 1.1917, test_f1: 0.4464
 epoch: 29, train_loss: 1.0030, test_loss: 1.1870, test_f1: 0.4642
 epoch: 30, train_loss: 0.9952, test_loss: 1.1901, test_f1: 0.4719
 epoch: 31, train_loss: 0.9866, test_loss: 1.2021, test_f1: 0.4947
 epoch: 32, train_loss: 0.9713, test_loss: 1.2023, test_f1: 0.4638
 epoch: 33, train_loss: 0.9744, test_loss: 1.1906, test_f1: 0.4923
 epoch: 34, train_loss: 0.9470, test_loss: 1.1949, test_f1: 0.4770
 epoch: 35, train_loss: 0.9383, test_loss: 1.1950, test_f1: 0.5131
 epoch: 36, train_loss: 0.9461, test_loss: 1.1902, test_f1: 0.5072
 epoch: 37, train_loss: 0.9352, test_loss: 1.2133, test_f1: 0.5006
 epoch: 38, train_loss: 0.9235, test_loss: 1.2073, test_f1: 0.5175
 epoch: 39, train_loss: 0.9215, test_loss: 1.2264, test_f1: 0.5160
 epoch: 40, train_loss: 0.9074, test_loss: 1.2084, test_f1: 0.5283
 epoch: 41, train_loss: 0.8948, test_loss: 1.2301, test_f1: 0.5291
 epoch: 42, train_loss: 0.8978, test_loss: 1.2240, test_f1: 0.5392
 epoch: 43, train_loss: 0.8859, test_loss: 1.2218, test_f1: 0.5328
 epoch: 44, train_loss: 0.8766, test_loss: 1.2375, test_f1: 0.5326
 epoch: 45, train_loss: 0.8750, test_loss: 1.2284, test_f1: 0.5299
 epoch: 46, train_loss: 0.8671, test_loss: 1.2946, test_f1: 0.5226
 epoch: 47, train_loss: 0.8624, test_loss: 1.3057, test_f1: 0.5307
 epoch: 48, train_loss: 0.8641, test_loss: 1.2862, test_f1: 0.5260
 epoch: 49, train_loss: 0.8412, test_loss: 1.3182, test_f1: 0.5172
 epoch: 50, train_loss: 0.8398, test_loss: 1.2698, test_f1: 0.5406
 epoch: 51, train_loss: 0.8259, test_loss: 1.2744, test_f1: 0.5314
 epoch: 52, train_loss: 0.8324, test_loss: 1.2947, test_f1: 0.5290
 epoch: 53, train_loss: 0.8278, test_loss: 1.2804, test_f1: 0.5215
 epoch: 54, train_loss: 0.8289, test_loss: 1.2829, test_f1: 0.5272
 epoch: 55, train_loss: 0.8118, test_loss: 1.2607, test_f1: 0.5414
 epoch: 56, train_loss: 0.8085, test_loss: 1.2879, test_f1: 0.5335
 epoch: 57, train_loss: 0.8161, test_loss: 1.2493, test_f1: 0.5457
 epoch: 58, train_loss: 0.8018, test_loss: 1.2547, test_f1: 0.5507
 epoch: 59, train_loss: 0.8077, test_loss: 1.2713, test_f1: 0.5484
 epoch: 60, train_loss: 0.7942, test_loss: 1.2980, test_f1: 0.5459
 epoch: 61, train_loss: 0.8135, test_loss: 1.2859, test_f1: 0.5303
 epoch: 62, train_loss: 0.7846, test_loss: 1.2975, test_f1: 0.5438
 epoch: 63, train_loss: 0.7918, test_loss: 1.2921, test_f1: 0.5384
 epoch: 64, train_loss: 0.7902, test_loss: 1.2892, test_f1: 0.5475
 epoch: 65, train_loss: 0.7948, test_loss: 1.2852, test_f1: 0.5552
 epoch: 66, train_loss: 0.7790, test_loss: 1.3330, test_f1: 0.5459
 epoch: 67, train_loss: 0.7924, test_loss: 1.2834, test_f1: 0.5332
 epoch: 68, train_loss: 0.7777, test_loss: 1.3075, test_f1: 0.5409
 epoch: 69, train_loss: 0.7742, test_loss: 1.3318, test_f1: 0.5377
 epoch: 70, train_loss: 0.7811, test_loss: 1.3066, test_f1: 0.5387
 epoch: 71, train_loss: 0.7860, test_loss: 1.2876, test_f1: 0.5388
 epoch: 72, train_loss: 0.7644, test_loss: 1.3362, test_f1: 0.5382
 epoch: 73, train_loss: 0.7654, test_loss: 1.3112, test_f1: 0.5583
 epoch: 74, train_loss: 0.7776, test_loss: 1.3064, test_f1: 0.5516
 epoch: 75, train_loss: 0.7519, test_loss: 1.2683, test_f1: 0.5387
 epoch: 76, train_loss: 0.7431, test_loss: 1.2887, test_f1: 0.5417
 epoch: 77, train_loss: 0.7491, test_loss: 1.3258, test_f1: 0.5437
 epoch: 78, train_loss: 0.7646, test_loss: 1.3407, test_f1: 0.5569
 epoch: 79, train_loss: 0.7461, test_loss: 1.3019, test_f1: 0.5514
 epoch: 80, train_loss: 0.7515, test_loss: 1.3601, test_f1: 0.5358
 epoch: 81, train_loss: 0.7484, test_loss: 1.3574, test_f1: 0.5382
 epoch: 82, train_loss: 0.7280, test_loss: 1.3386, test_f1: 0.5434
 epoch: 83, train_loss: 0.7555, test_loss: 1.3578, test_f1: 0.5330
 epoch: 84, train_loss: 0.7318, test_loss: 1.3174, test_f1: 0.5495
 epoch: 85, train_loss: 0.7319, test_loss: 1.3254, test_f1: 0.5443
 epoch: 86, train_loss: 0.7220, test_loss: 1.3477, test_f1: 0.5546
 epoch: 87, train_loss: 0.7218, test_loss: 1.3736, test_f1: 0.5509
 epoch: 88, train_loss: 0.7309, test_loss: 1.3765, test_f1: 0.5396
 epoch: 89, train_loss: 0.7217, test_loss: 1.4064, test_f1: 0.5400
 epoch: 90, train_loss: 0.7313, test_loss: 1.3954, test_f1: 0.5448
 epoch: 91, train_loss: 0.7148, test_loss: 1.3801, test_f1: 0.5496
 epoch: 92, train_loss: 0.7143, test_loss: 1.4361, test_f1: 0.5307
 epoch: 93, train_loss: 0.7284, test_loss: 1.3955, test_f1: 0.5464
 epoch: 94, train_loss: 0.7056, test_loss: 1.4112, test_f1: 0.5408
 epoch: 95, train_loss: 0.7201, test_loss: 1.4014, test_f1: 0.5498
 epoch: 96, train_loss: 0.7062, test_loss: 1.4386, test_f1: 0.5370
 epoch: 97, train_loss: 0.7231, test_loss: 1.4208, test_f1: 0.5206
 epoch: 98, train_loss: 0.6945, test_loss: 1.4077, test_f1: 0.5394
 epoch: 99, train_loss: 0.6909, test_loss: 1.4181, test_f1: 0.5457
##################ITERATION #2 ****************************************
 epoch: 0, train_loss: 1.3308, test_loss: 1.3915, test_f1: 0.1562
 epoch: 1, train_loss: 1.2843, test_loss: 1.3456, test_f1: 0.3557
 epoch: 2, train_loss: 1.2519, test_loss: 1.3482, test_f1: 0.3508
 epoch: 3, train_loss: 1.2335, test_loss: 1.3429, test_f1: 0.3360
 epoch: 4, train_loss: 1.2193, test_loss: 1.3323, test_f1: 0.3384
 epoch: 5, train_loss: 1.2012, test_loss: 1.3080, test_f1: 0.3215
 epoch: 6, train_loss: 1.1913, test_loss: 1.2957, test_f1: 0.3243
 epoch: 7, train_loss: 1.1888, test_loss: 1.2825, test_f1: 0.3299
 epoch: 8, train_loss: 1.1786, test_loss: 1.2854, test_f1: 0.3400
 epoch: 9, train_loss: 1.1775, test_loss: 1.2817, test_f1: 0.3585
 epoch: 10, train_loss: 1.1589, test_loss: 1.2779, test_f1: 0.3582
 epoch: 11, train_loss: 1.1627, test_loss: 1.2803, test_f1: 0.3806
 epoch: 12, train_loss: 1.1474, test_loss: 1.2860, test_f1: 0.4000
 epoch: 13, train_loss: 1.1302, test_loss: 1.2894, test_f1: 0.3843
 epoch: 14, train_loss: 1.1307, test_loss: 1.2731, test_f1: 0.3986
 epoch: 15, train_loss: 1.1313, test_loss: 1.2774, test_f1: 0.4068
 epoch: 16, train_loss: 1.1186, test_loss: 1.3005, test_f1: 0.4097
 epoch: 17, train_loss: 1.1060, test_loss: 1.2621, test_f1: 0.4136
 epoch: 18, train_loss: 1.1037, test_loss: 1.2974, test_f1: 0.4255
 epoch: 19, train_loss: 1.0956, test_loss: 1.2810, test_f1: 0.4343
 epoch: 20, train_loss: 1.0870, test_loss: 1.2644, test_f1: 0.4397
 epoch: 21, train_loss: 1.0728, test_loss: 1.2979, test_f1: 0.4511
 epoch: 22, train_loss: 1.0716, test_loss: 1.2978, test_f1: 0.4424
 epoch: 23, train_loss: 1.0608, test_loss: 1.2775, test_f1: 0.4498
 epoch: 24, train_loss: 1.0565, test_loss: 1.2931, test_f1: 0.4683
 epoch: 25, train_loss: 1.0482, test_loss: 1.3256, test_f1: 0.4549
 epoch: 26, train_loss: 1.0400, test_loss: 1.3185, test_f1: 0.4359
 epoch: 27, train_loss: 1.0259, test_loss: 1.2820, test_f1: 0.4853
 epoch: 28, train_loss: 1.0361, test_loss: 1.2797, test_f1: 0.4643
 epoch: 29, train_loss: 1.0242, test_loss: 1.2949, test_f1: 0.4612
 epoch: 30, train_loss: 1.0146, test_loss: 1.2594, test_f1: 0.4942
 epoch: 31, train_loss: 0.9937, test_loss: 1.2788, test_f1: 0.4778
 epoch: 32, train_loss: 0.9975, test_loss: 1.2864, test_f1: 0.4778
 epoch: 33, train_loss: 0.9849, test_loss: 1.2928, test_f1: 0.4847
 epoch: 34, train_loss: 0.9649, test_loss: 1.3126, test_f1: 0.5125
 epoch: 35, train_loss: 0.9707, test_loss: 1.3111, test_f1: 0.4990
 epoch: 36, train_loss: 0.9440, test_loss: 1.3027, test_f1: 0.4851
 epoch: 37, train_loss: 0.9356, test_loss: 1.3411, test_f1: 0.5144
 epoch: 38, train_loss: 0.9390, test_loss: 1.3341, test_f1: 0.4935
 epoch: 39, train_loss: 0.9406, test_loss: 1.3750, test_f1: 0.4919
 epoch: 40, train_loss: 0.9209, test_loss: 1.3633, test_f1: 0.5003
 epoch: 41, train_loss: 0.9189, test_loss: 1.3706, test_f1: 0.4980
 epoch: 42, train_loss: 0.9161, test_loss: 1.3581, test_f1: 0.4925
 epoch: 43, train_loss: 0.9013, test_loss: 1.3423, test_f1: 0.4965
 epoch: 44, train_loss: 0.8925, test_loss: 1.3878, test_f1: 0.4943
 epoch: 45, train_loss: 0.8823, test_loss: 1.3529, test_f1: 0.4902
 epoch: 46, train_loss: 0.8757, test_loss: 1.3808, test_f1: 0.4965
 epoch: 47, train_loss: 0.8704, test_loss: 1.3564, test_f1: 0.4997
 epoch: 48, train_loss: 0.8628, test_loss: 1.3772, test_f1: 0.5228
 epoch: 49, train_loss: 0.8494, test_loss: 1.3806, test_f1: 0.5146
 epoch: 50, train_loss: 0.8522, test_loss: 1.3818, test_f1: 0.4938
 epoch: 51, train_loss: 0.8422, test_loss: 1.4178, test_f1: 0.5149
 epoch: 52, train_loss: 0.8358, test_loss: 1.4079, test_f1: 0.5141
 epoch: 53, train_loss: 0.8146, test_loss: 1.4147, test_f1: 0.5093
 epoch: 54, train_loss: 0.8288, test_loss: 1.4094, test_f1: 0.4833
 epoch: 55, train_loss: 0.8243, test_loss: 1.3861, test_f1: 0.5140
 epoch: 56, train_loss: 0.8148, test_loss: 1.4232, test_f1: 0.4910
 epoch: 57, train_loss: 0.8197, test_loss: 1.4122, test_f1: 0.5064
 epoch: 58, train_loss: 0.8013, test_loss: 1.4253, test_f1: 0.4868
 epoch: 59, train_loss: 0.8101, test_loss: 1.4449, test_f1: 0.4885
 epoch: 60, train_loss: 0.8117, test_loss: 1.3922, test_f1: 0.4946
 epoch: 61, train_loss: 0.8071, test_loss: 1.4229, test_f1: 0.5042
 epoch: 62, train_loss: 0.8120, test_loss: 1.4869, test_f1: 0.4865
 epoch: 63, train_loss: 0.8049, test_loss: 1.4589, test_f1: 0.5148
 epoch: 64, train_loss: 0.7966, test_loss: 1.4225, test_f1: 0.5016
 epoch: 65, train_loss: 0.7910, test_loss: 1.4132, test_f1: 0.4921
 epoch: 66, train_loss: 0.7827, test_loss: 1.4433, test_f1: 0.5002
 epoch: 67, train_loss: 0.7693, test_loss: 1.4128, test_f1: 0.5081
 epoch: 68, train_loss: 0.7928, test_loss: 1.4956, test_f1: 0.4922
 epoch: 69, train_loss: 0.7797, test_loss: 1.4260, test_f1: 0.4947
 epoch: 70, train_loss: 0.7953, test_loss: 1.4536, test_f1: 0.4994
 epoch: 71, train_loss: 0.7883, test_loss: 1.4672, test_f1: 0.4927
 epoch: 72, train_loss: 0.7743, test_loss: 1.4075, test_f1: 0.5156
 epoch: 73, train_loss: 0.7751, test_loss: 1.4711, test_f1: 0.4997
 epoch: 74, train_loss: 0.7702, test_loss: 1.4764, test_f1: 0.5146
 epoch: 75, train_loss: 0.7582, test_loss: 1.4834, test_f1: 0.5074
 epoch: 76, train_loss: 0.7700, test_loss: 1.4698, test_f1: 0.5003
 epoch: 77, train_loss: 0.7651, test_loss: 1.5004, test_f1: 0.4918
 epoch: 78, train_loss: 0.7352, test_loss: 1.5057, test_f1: 0.5018
 epoch: 79, train_loss: 0.7674, test_loss: 1.5350, test_f1: 0.4885
 epoch: 80, train_loss: 0.7489, test_loss: 1.5328, test_f1: 0.5049
 epoch: 81, train_loss: 0.7495, test_loss: 1.4942, test_f1: 0.5094
 epoch: 82, train_loss: 0.7362, test_loss: 1.4937, test_f1: 0.5068
 epoch: 83, train_loss: 0.7521, test_loss: 1.5065, test_f1: 0.5082
 epoch: 84, train_loss: 0.7767, test_loss: 1.4986, test_f1: 0.5144
 epoch: 85, train_loss: 0.7434, test_loss: 1.5771, test_f1: 0.5199
 epoch: 86, train_loss: 0.7370, test_loss: 1.5490, test_f1: 0.5179
 epoch: 87, train_loss: 0.7396, test_loss: 1.6032, test_f1: 0.5121
 epoch: 88, train_loss: 0.7367, test_loss: 1.5949, test_f1: 0.5131
 epoch: 89, train_loss: 0.7171, test_loss: 1.6546, test_f1: 0.5050
 epoch: 90, train_loss: 0.7245, test_loss: 1.5663, test_f1: 0.5104
 epoch: 91, train_loss: 0.7225, test_loss: 1.6683, test_f1: 0.4898
 epoch: 92, train_loss: 0.7052, test_loss: 1.6022, test_f1: 0.5050
 epoch: 93, train_loss: 0.7257, test_loss: 1.6250, test_f1: 0.5023
 epoch: 94, train_loss: 0.7186, test_loss: 1.5560, test_f1: 0.5253
 epoch: 95, train_loss: 0.7121, test_loss: 1.5946, test_f1: 0.4988
 epoch: 96, train_loss: 0.7114, test_loss: 1.6226, test_f1: 0.5193
 epoch: 97, train_loss: 0.7049, test_loss: 1.6758, test_f1: 0.5097
 epoch: 98, train_loss: 0.6965, test_loss: 1.6204, test_f1: 0.4923
 epoch: 99, train_loss: 0.6989, test_loss: 1.6313, test_f1: 0.5149
##################ITERATION #3 ****************************************
 epoch: 0, train_loss: 1.2835, test_loss: 1.3263, test_f1: 0.2281
 epoch: 1, train_loss: 1.2394, test_loss: 1.2864, test_f1: 0.3316
 epoch: 2, train_loss: 1.2077, test_loss: 1.2769, test_f1: 0.3342
 epoch: 3, train_loss: 1.1979, test_loss: 1.2744, test_f1: 0.3743
 epoch: 4, train_loss: 1.1729, test_loss: 1.2644, test_f1: 0.3672
 epoch: 5, train_loss: 1.1677, test_loss: 1.2535, test_f1: 0.3770
 epoch: 6, train_loss: 1.1601, test_loss: 1.2494, test_f1: 0.4007
 epoch: 7, train_loss: 1.1441, test_loss: 1.2397, test_f1: 0.4007
 epoch: 8, train_loss: 1.1286, test_loss: 1.2298, test_f1: 0.4030
 epoch: 9, train_loss: 1.1263, test_loss: 1.2319, test_f1: 0.3960
 epoch: 10, train_loss: 1.1103, test_loss: 1.2283, test_f1: 0.3996
 epoch: 11, train_loss: 1.1030, test_loss: 1.2398, test_f1: 0.4000
 epoch: 12, train_loss: 1.0964, test_loss: 1.2353, test_f1: 0.4421
 epoch: 13, train_loss: 1.0854, test_loss: 1.2355, test_f1: 0.4157
 epoch: 14, train_loss: 1.0755, test_loss: 1.2440, test_f1: 0.4306
 epoch: 15, train_loss: 1.0749, test_loss: 1.2410, test_f1: 0.4510
 epoch: 16, train_loss: 1.0637, test_loss: 1.2426, test_f1: 0.4499
 epoch: 17, train_loss: 1.0625, test_loss: 1.2072, test_f1: 0.4693
 epoch: 18, train_loss: 1.0452, test_loss: 1.2056, test_f1: 0.4885
 epoch: 19, train_loss: 1.0386, test_loss: 1.2084, test_f1: 0.4792
 epoch: 20, train_loss: 1.0305, test_loss: 1.2141, test_f1: 0.4655
 epoch: 21, train_loss: 1.0245, test_loss: 1.2153, test_f1: 0.4866
 epoch: 22, train_loss: 1.0174, test_loss: 1.1981, test_f1: 0.4898
 epoch: 23, train_loss: 0.9992, test_loss: 1.2013, test_f1: 0.5046
 epoch: 24, train_loss: 1.0019, test_loss: 1.2215, test_f1: 0.4873
 epoch: 25, train_loss: 0.9976, test_loss: 1.2195, test_f1: 0.4971
 epoch: 26, train_loss: 0.9895, test_loss: 1.2438, test_f1: 0.4922
 epoch: 27, train_loss: 0.9763, test_loss: 1.2483, test_f1: 0.4834
 epoch: 28, train_loss: 0.9689, test_loss: 1.2603, test_f1: 0.4689
 epoch: 29, train_loss: 0.9657, test_loss: 1.2609, test_f1: 0.4768
 epoch: 30, train_loss: 0.9542, test_loss: 1.2667, test_f1: 0.4839
 epoch: 31, train_loss: 0.9483, test_loss: 1.2134, test_f1: 0.4821
 epoch: 32, train_loss: 0.9397, test_loss: 1.2387, test_f1: 0.4880
 epoch: 33, train_loss: 0.9331, test_loss: 1.3160, test_f1: 0.4816
 epoch: 34, train_loss: 0.9175, test_loss: 1.2769, test_f1: 0.4766
 epoch: 35, train_loss: 0.9241, test_loss: 1.2515, test_f1: 0.4947
 epoch: 36, train_loss: 0.9166, test_loss: 1.2523, test_f1: 0.5024
 epoch: 37, train_loss: 0.9070, test_loss: 1.2325, test_f1: 0.4944
 epoch: 38, train_loss: 0.9130, test_loss: 1.2526, test_f1: 0.5122
 epoch: 39, train_loss: 0.8969, test_loss: 1.2495, test_f1: 0.5051
 epoch: 40, train_loss: 0.8909, test_loss: 1.2692, test_f1: 0.5108
 epoch: 41, train_loss: 0.8837, test_loss: 1.2531, test_f1: 0.5178
 epoch: 42, train_loss: 0.8847, test_loss: 1.2436, test_f1: 0.5389
 epoch: 43, train_loss: 0.8789, test_loss: 1.2373, test_f1: 0.5228
 epoch: 44, train_loss: 0.8780, test_loss: 1.2524, test_f1: 0.5369
 epoch: 45, train_loss: 0.8568, test_loss: 1.2747, test_f1: 0.5077
 epoch: 46, train_loss: 0.8473, test_loss: 1.3049, test_f1: 0.5002
 epoch: 47, train_loss: 0.8441, test_loss: 1.2918, test_f1: 0.5272
 epoch: 48, train_loss: 0.8525, test_loss: 1.2863, test_f1: 0.5314
 epoch: 49, train_loss: 0.8394, test_loss: 1.3050, test_f1: 0.5208
 epoch: 50, train_loss: 0.8399, test_loss: 1.3041, test_f1: 0.5056
 epoch: 51, train_loss: 0.8420, test_loss: 1.3435, test_f1: 0.5360
 epoch: 52, train_loss: 0.8273, test_loss: 1.3283, test_f1: 0.5003
 epoch: 53, train_loss: 0.8303, test_loss: 1.3265, test_f1: 0.5084
 epoch: 54, train_loss: 0.8141, test_loss: 1.3276, test_f1: 0.5392
 epoch: 55, train_loss: 0.8031, test_loss: 1.3429, test_f1: 0.5250
 epoch: 56, train_loss: 0.8109, test_loss: 1.3402, test_f1: 0.5289
 epoch: 57, train_loss: 0.8085, test_loss: 1.3541, test_f1: 0.5139
 epoch: 58, train_loss: 0.8185, test_loss: 1.3478, test_f1: 0.5298
 epoch: 59, train_loss: 0.8065, test_loss: 1.3474, test_f1: 0.5397
 epoch: 60, train_loss: 0.8006, test_loss: 1.3267, test_f1: 0.5425
 epoch: 61, train_loss: 0.7872, test_loss: 1.3701, test_f1: 0.5384
 epoch: 62, train_loss: 0.7997, test_loss: 1.3647, test_f1: 0.5209
 epoch: 63, train_loss: 0.7949, test_loss: 1.3818, test_f1: 0.5267
 epoch: 64, train_loss: 0.7900, test_loss: 1.3559, test_f1: 0.5326
 epoch: 65, train_loss: 0.7811, test_loss: 1.3586, test_f1: 0.5412
 epoch: 66, train_loss: 0.7752, test_loss: 1.3929, test_f1: 0.5406
 epoch: 67, train_loss: 0.7874, test_loss: 1.3751, test_f1: 0.5348
 epoch: 68, train_loss: 0.7705, test_loss: 1.3789, test_f1: 0.5450
 epoch: 69, train_loss: 0.7762, test_loss: 1.4316, test_f1: 0.5342
 epoch: 70, train_loss: 0.7789, test_loss: 1.3929, test_f1: 0.5362
 epoch: 71, train_loss: 0.7871, test_loss: 1.3866, test_f1: 0.5473
 epoch: 72, train_loss: 0.7500, test_loss: 1.4196, test_f1: 0.5527
 epoch: 73, train_loss: 0.7724, test_loss: 1.4013, test_f1: 0.5731
 epoch: 74, train_loss: 0.7509, test_loss: 1.3948, test_f1: 0.5602
 epoch: 75, train_loss: 0.7526, test_loss: 1.4601, test_f1: 0.5595
 epoch: 76, train_loss: 0.7662, test_loss: 1.4489, test_f1: 0.5560
 epoch: 77, train_loss: 0.7477, test_loss: 1.4509, test_f1: 0.5591
 epoch: 78, train_loss: 0.7610, test_loss: 1.4351, test_f1: 0.5486
 epoch: 79, train_loss: 0.7368, test_loss: 1.4556, test_f1: 0.5535
 epoch: 80, train_loss: 0.7456, test_loss: 1.4790, test_f1: 0.5813
 epoch: 81, train_loss: 0.7327, test_loss: 1.4860, test_f1: 0.5595
 epoch: 82, train_loss: 0.7500, test_loss: 1.4861, test_f1: 0.5564
 epoch: 83, train_loss: 0.7431, test_loss: 1.4575, test_f1: 0.5338
 epoch: 84, train_loss: 0.7438, test_loss: 1.4577, test_f1: 0.5482
 epoch: 85, train_loss: 0.7151, test_loss: 1.4771, test_f1: 0.5351
 epoch: 86, train_loss: 0.7401, test_loss: 1.4416, test_f1: 0.5609
 epoch: 87, train_loss: 0.7300, test_loss: 1.5021, test_f1: 0.5684
 epoch: 88, train_loss: 0.7308, test_loss: 1.5282, test_f1: 0.5628
 epoch: 89, train_loss: 0.7240, test_loss: 1.5174, test_f1: 0.5629
 epoch: 90, train_loss: 0.7182, test_loss: 1.4606, test_f1: 0.5576
 epoch: 91, train_loss: 0.7189, test_loss: 1.5418, test_f1: 0.5575
 epoch: 92, train_loss: 0.7162, test_loss: 1.5082, test_f1: 0.5494
 epoch: 93, train_loss: 0.7232, test_loss: 1.5312, test_f1: 0.5548
 epoch: 94, train_loss: 0.7114, test_loss: 1.5439, test_f1: 0.5571
 epoch: 95, train_loss: 0.6937, test_loss: 1.5485, test_f1: 0.5480
 epoch: 96, train_loss: 0.7040, test_loss: 1.5443, test_f1: 0.5505
 epoch: 97, train_loss: 0.7103, test_loss: 1.5225, test_f1: 0.5589
 epoch: 98, train_loss: 0.7102, test_loss: 1.4559, test_f1: 0.5593
 epoch: 99, train_loss: 0.6961, test_loss: 1.5034, test_f1: 0.5552
##################ITERATION #4 ****************************************
 epoch: 0, train_loss: 1.2680, test_loss: 1.3226, test_f1: 0.2281
 epoch: 1, train_loss: 1.2361, test_loss: 1.3289, test_f1: 0.3103
 epoch: 2, train_loss: 1.2113, test_loss: 1.3488, test_f1: 0.3494
 epoch: 3, train_loss: 1.2105, test_loss: 1.3238, test_f1: 0.3687
 epoch: 4, train_loss: 1.1771, test_loss: 1.3090, test_f1: 0.3703
 epoch: 5, train_loss: 1.1753, test_loss: 1.3001, test_f1: 0.3810
 epoch: 6, train_loss: 1.1561, test_loss: 1.3016, test_f1: 0.3865
 epoch: 7, train_loss: 1.1430, test_loss: 1.2785, test_f1: 0.4083
 epoch: 8, train_loss: 1.1363, test_loss: 1.2559, test_f1: 0.4143
 epoch: 9, train_loss: 1.1274, test_loss: 1.2603, test_f1: 0.4223
 epoch: 10, train_loss: 1.1179, test_loss: 1.2509, test_f1: 0.4345
 epoch: 11, train_loss: 1.1030, test_loss: 1.2489, test_f1: 0.4507
 epoch: 12, train_loss: 1.1043, test_loss: 1.2660, test_f1: 0.4631
 epoch: 13, train_loss: 1.0803, test_loss: 1.2556, test_f1: 0.4766
 epoch: 14, train_loss: 1.0729, test_loss: 1.2183, test_f1: 0.4803
 epoch: 15, train_loss: 1.0665, test_loss: 1.2333, test_f1: 0.4849
 epoch: 16, train_loss: 1.0567, test_loss: 1.2579, test_f1: 0.4769
 epoch: 17, train_loss: 1.0494, test_loss: 1.2397, test_f1: 0.4997
 epoch: 18, train_loss: 1.0356, test_loss: 1.2397, test_f1: 0.5036
 epoch: 19, train_loss: 1.0370, test_loss: 1.2456, test_f1: 0.4753
 epoch: 20, train_loss: 1.0201, test_loss: 1.2447, test_f1: 0.4931
 epoch: 21, train_loss: 1.0166, test_loss: 1.2293, test_f1: 0.4957
 epoch: 22, train_loss: 1.0114, test_loss: 1.2332, test_f1: 0.4951
 epoch: 23, train_loss: 1.0017, test_loss: 1.2528, test_f1: 0.4996
 epoch: 24, train_loss: 0.9899, test_loss: 1.2375, test_f1: 0.4971
 epoch: 25, train_loss: 0.9893, test_loss: 1.2289, test_f1: 0.4993
 epoch: 26, train_loss: 0.9826, test_loss: 1.2496, test_f1: 0.5192
 epoch: 27, train_loss: 0.9748, test_loss: 1.2531, test_f1: 0.5194
 epoch: 28, train_loss: 0.9647, test_loss: 1.2064, test_f1: 0.5069
 epoch: 29, train_loss: 0.9655, test_loss: 1.2189, test_f1: 0.5135
 epoch: 30, train_loss: 0.9542, test_loss: 1.2300, test_f1: 0.4859
 epoch: 31, train_loss: 0.9413, test_loss: 1.2336, test_f1: 0.5213
 epoch: 32, train_loss: 0.9542, test_loss: 1.2422, test_f1: 0.5343
 epoch: 33, train_loss: 0.9347, test_loss: 1.2643, test_f1: 0.4989
 epoch: 34, train_loss: 0.9230, test_loss: 1.2440, test_f1: 0.5059
 epoch: 35, train_loss: 0.9129, test_loss: 1.2874, test_f1: 0.5269
 epoch: 36, train_loss: 0.9120, test_loss: 1.2602, test_f1: 0.5348
 epoch: 37, train_loss: 0.8951, test_loss: 1.2878, test_f1: 0.5026
 epoch: 38, train_loss: 0.8899, test_loss: 1.2511, test_f1: 0.5503
 epoch: 39, train_loss: 0.8993, test_loss: 1.2824, test_f1: 0.5080
 epoch: 40, train_loss: 0.8855, test_loss: 1.2615, test_f1: 0.5295
 epoch: 41, train_loss: 0.8954, test_loss: 1.2625, test_f1: 0.5650
 epoch: 42, train_loss: 0.8745, test_loss: 1.3092, test_f1: 0.5423
 epoch: 43, train_loss: 0.8735, test_loss: 1.3184, test_f1: 0.5518
 epoch: 44, train_loss: 0.8789, test_loss: 1.3254, test_f1: 0.5425
 epoch: 45, train_loss: 0.8458, test_loss: 1.3519, test_f1: 0.5379
 epoch: 46, train_loss: 0.8514, test_loss: 1.3248, test_f1: 0.5450
 epoch: 47, train_loss: 0.8474, test_loss: 1.3419, test_f1: 0.5446
 epoch: 48, train_loss: 0.8584, test_loss: 1.3050, test_f1: 0.5545
 epoch: 49, train_loss: 0.8371, test_loss: 1.2911, test_f1: 0.5443
 epoch: 50, train_loss: 0.8262, test_loss: 1.2440, test_f1: 0.5562
 epoch: 51, train_loss: 0.8336, test_loss: 1.2770, test_f1: 0.5338
 epoch: 52, train_loss: 0.8190, test_loss: 1.2488, test_f1: 0.5451
 epoch: 53, train_loss: 0.8185, test_loss: 1.2875, test_f1: 0.5479
 epoch: 54, train_loss: 0.8233, test_loss: 1.2876, test_f1: 0.5541
 epoch: 55, train_loss: 0.8105, test_loss: 1.3370, test_f1: 0.5657
 epoch: 56, train_loss: 0.8102, test_loss: 1.3234, test_f1: 0.5324
 epoch: 57, train_loss: 0.8168, test_loss: 1.3376, test_f1: 0.5441
 epoch: 58, train_loss: 0.8148, test_loss: 1.3668, test_f1: 0.5358
 epoch: 59, train_loss: 0.7925, test_loss: 1.3802, test_f1: 0.5497
 epoch: 60, train_loss: 0.8142, test_loss: 1.3966, test_f1: 0.5378
 epoch: 61, train_loss: 0.8093, test_loss: 1.3518, test_f1: 0.5241
 epoch: 62, train_loss: 0.8134, test_loss: 1.3518, test_f1: 0.5224
 epoch: 63, train_loss: 0.7999, test_loss: 1.3320, test_f1: 0.5397
 epoch: 64, train_loss: 0.7824, test_loss: 1.3873, test_f1: 0.5275
 epoch: 65, train_loss: 0.8064, test_loss: 1.3797, test_f1: 0.5278
 epoch: 66, train_loss: 0.7884, test_loss: 1.3457, test_f1: 0.5442
 epoch: 67, train_loss: 0.7907, test_loss: 1.3357, test_f1: 0.5442
 epoch: 68, train_loss: 0.7746, test_loss: 1.3367, test_f1: 0.5314
 epoch: 69, train_loss: 0.7658, test_loss: 1.3382, test_f1: 0.5346
 epoch: 70, train_loss: 0.7635, test_loss: 1.3391, test_f1: 0.5392
 epoch: 71, train_loss: 0.7638, test_loss: 1.3138, test_f1: 0.5492
 epoch: 72, train_loss: 0.7914, test_loss: 1.3387, test_f1: 0.5462
 epoch: 73, train_loss: 0.7791, test_loss: 1.3877, test_f1: 0.5189
 epoch: 74, train_loss: 0.7759, test_loss: 1.4028, test_f1: 0.5373
 epoch: 75, train_loss: 0.7703, test_loss: 1.3781, test_f1: 0.5463
 epoch: 76, train_loss: 0.7627, test_loss: 1.4106, test_f1: 0.5269
 epoch: 77, train_loss: 0.7627, test_loss: 1.4088, test_f1: 0.5263
 epoch: 78, train_loss: 0.7474, test_loss: 1.4168, test_f1: 0.5389
 epoch: 79, train_loss: 0.7739, test_loss: 1.4086, test_f1: 0.5633
 epoch: 80, train_loss: 0.7748, test_loss: 1.4231, test_f1: 0.5473
 epoch: 81, train_loss: 0.7672, test_loss: 1.4551, test_f1: 0.5447
 epoch: 82, train_loss: 0.7465, test_loss: 1.4602, test_f1: 0.5283
 epoch: 83, train_loss: 0.7578, test_loss: 1.4446, test_f1: 0.5289
 epoch: 84, train_loss: 0.7544, test_loss: 1.4891, test_f1: 0.5360
 epoch: 85, train_loss: 0.7543, test_loss: 1.4764, test_f1: 0.5420
 epoch: 86, train_loss: 0.7453, test_loss: 1.4892, test_f1: 0.5239
 epoch: 87, train_loss: 0.7403, test_loss: 1.5080, test_f1: 0.5290
 epoch: 88, train_loss: 0.7439, test_loss: 1.4580, test_f1: 0.5291
 epoch: 89, train_loss: 0.7385, test_loss: 1.5073, test_f1: 0.5396
 epoch: 90, train_loss: 0.7411, test_loss: 1.5286, test_f1: 0.5273
 epoch: 91, train_loss: 0.7439, test_loss: 1.4681, test_f1: 0.5531
 epoch: 92, train_loss: 0.7359, test_loss: 1.5097, test_f1: 0.5342
 epoch: 93, train_loss: 0.7286, test_loss: 1.5291, test_f1: 0.5370
 epoch: 94, train_loss: 0.7292, test_loss: 1.4616, test_f1: 0.5448
 epoch: 95, train_loss: 0.7336, test_loss: 1.4579, test_f1: 0.5560
 epoch: 96, train_loss: 0.7088, test_loss: 1.5258, test_f1: 0.5193
 epoch: 97, train_loss: 0.7270, test_loss: 1.4937, test_f1: 0.5219
 epoch: 98, train_loss: 0.7113, test_loss: 1.5309, test_f1: 0.5268
 epoch: 99, train_loss: 0.7291, test_loss: 1.5145, test_f1: 0.5222
##################ITERATION #5 ****************************************
 epoch: 0, train_loss: 1.2812, test_loss: 1.3671, test_f1: 0.2416
 epoch: 1, train_loss: 1.2195, test_loss: 1.3205, test_f1: 0.3856
 epoch: 2, train_loss: 1.1883, test_loss: 1.2944, test_f1: 0.3990
 epoch: 3, train_loss: 1.1848, test_loss: 1.2741, test_f1: 0.4169
 epoch: 4, train_loss: 1.1733, test_loss: 1.2610, test_f1: 0.4271
 epoch: 5, train_loss: 1.1531, test_loss: 1.2641, test_f1: 0.4218
 epoch: 6, train_loss: 1.1393, test_loss: 1.2451, test_f1: 0.4188
 epoch: 7, train_loss: 1.1220, test_loss: 1.2456, test_f1: 0.4343
 epoch: 8, train_loss: 1.1206, test_loss: 1.2448, test_f1: 0.4467
 epoch: 9, train_loss: 1.1066, test_loss: 1.2448, test_f1: 0.4440
 epoch: 10, train_loss: 1.1121, test_loss: 1.2295, test_f1: 0.4335
 epoch: 11, train_loss: 1.0973, test_loss: 1.2396, test_f1: 0.4488
 epoch: 12, train_loss: 1.0865, test_loss: 1.2308, test_f1: 0.4366
 epoch: 13, train_loss: 1.0792, test_loss: 1.2325, test_f1: 0.4468
 epoch: 14, train_loss: 1.0657, test_loss: 1.2509, test_f1: 0.4658
 epoch: 15, train_loss: 1.0514, test_loss: 1.2585, test_f1: 0.4508
 epoch: 16, train_loss: 1.0499, test_loss: 1.2502, test_f1: 0.4569
 epoch: 17, train_loss: 1.0480, test_loss: 1.2282, test_f1: 0.4465
 epoch: 18, train_loss: 1.0424, test_loss: 1.2290, test_f1: 0.4679
 epoch: 19, train_loss: 1.0236, test_loss: 1.2385, test_f1: 0.4894
 epoch: 20, train_loss: 1.0146, test_loss: 1.2293, test_f1: 0.4894
 epoch: 21, train_loss: 1.0138, test_loss: 1.2384, test_f1: 0.4962
 epoch: 22, train_loss: 1.0073, test_loss: 1.2210, test_f1: 0.5113
 epoch: 23, train_loss: 0.9947, test_loss: 1.2183, test_f1: 0.5025
 epoch: 24, train_loss: 0.9981, test_loss: 1.2100, test_f1: 0.5256
 epoch: 25, train_loss: 0.9962, test_loss: 1.2177, test_f1: 0.5051
 epoch: 26, train_loss: 0.9790, test_loss: 1.2363, test_f1: 0.5156
 epoch: 27, train_loss: 0.9797, test_loss: 1.2073, test_f1: 0.5339
 epoch: 28, train_loss: 0.9721, test_loss: 1.2009, test_f1: 0.5246
 epoch: 29, train_loss: 0.9508, test_loss: 1.2038, test_f1: 0.5188
 epoch: 30, train_loss: 0.9672, test_loss: 1.2211, test_f1: 0.5062
 epoch: 31, train_loss: 0.9444, test_loss: 1.1840, test_f1: 0.5176
 epoch: 32, train_loss: 0.9509, test_loss: 1.2258, test_f1: 0.5427
 epoch: 33, train_loss: 0.9457, test_loss: 1.2034, test_f1: 0.5365
 epoch: 34, train_loss: 0.9547, test_loss: 1.2051, test_f1: 0.5177
 epoch: 35, train_loss: 0.9401, test_loss: 1.2141, test_f1: 0.5458
 epoch: 36, train_loss: 0.9269, test_loss: 1.1897, test_f1: 0.5365
 epoch: 37, train_loss: 0.9202, test_loss: 1.2065, test_f1: 0.5376
 epoch: 38, train_loss: 0.9066, test_loss: 1.2064, test_f1: 0.5418
 epoch: 39, train_loss: 0.9035, test_loss: 1.2202, test_f1: 0.5348
 epoch: 40, train_loss: 0.8972, test_loss: 1.1795, test_f1: 0.5613
 epoch: 41, train_loss: 0.9084, test_loss: 1.2275, test_f1: 0.5498
 epoch: 42, train_loss: 0.8893, test_loss: 1.2331, test_f1: 0.5512
 epoch: 43, train_loss: 0.9001, test_loss: 1.2205, test_f1: 0.5567
 epoch: 44, train_loss: 0.8772, test_loss: 1.2102, test_f1: 0.5447
 epoch: 45, train_loss: 0.8868, test_loss: 1.2127, test_f1: 0.5531
 epoch: 46, train_loss: 0.8857, test_loss: 1.1966, test_f1: 0.5385
 epoch: 47, train_loss: 0.8744, test_loss: 1.2334, test_f1: 0.5524
 epoch: 48, train_loss: 0.8689, test_loss: 1.2430, test_f1: 0.5241
 epoch: 49, train_loss: 0.8632, test_loss: 1.2229, test_f1: 0.5711
 epoch: 50, train_loss: 0.8559, test_loss: 1.2417, test_f1: 0.5701
 epoch: 51, train_loss: 0.8639, test_loss: 1.2428, test_f1: 0.5408
 epoch: 52, train_loss: 0.8414, test_loss: 1.2542, test_f1: 0.5510
 epoch: 53, train_loss: 0.8308, test_loss: 1.2544, test_f1: 0.5544
 epoch: 54, train_loss: 0.8445, test_loss: 1.2635, test_f1: 0.5374
 epoch: 55, train_loss: 0.8577, test_loss: 1.2723, test_f1: 0.5383
 epoch: 56, train_loss: 0.8336, test_loss: 1.2697, test_f1: 0.5498
 epoch: 57, train_loss: 0.8286, test_loss: 1.2670, test_f1: 0.5445
 epoch: 58, train_loss: 0.8134, test_loss: 1.2700, test_f1: 0.5539
 epoch: 59, train_loss: 0.8210, test_loss: 1.2521, test_f1: 0.5418
 epoch: 60, train_loss: 0.8283, test_loss: 1.2840, test_f1: 0.5629
 epoch: 61, train_loss: 0.8190, test_loss: 1.2700, test_f1: 0.5583
 epoch: 62, train_loss: 0.8142, test_loss: 1.2721, test_f1: 0.5567
 epoch: 63, train_loss: 0.8173, test_loss: 1.2625, test_f1: 0.5721
 epoch: 64, train_loss: 0.7979, test_loss: 1.2875, test_f1: 0.5471
 epoch: 65, train_loss: 0.8045, test_loss: 1.2880, test_f1: 0.5601
 epoch: 66, train_loss: 0.8160, test_loss: 1.2752, test_f1: 0.5576
 epoch: 67, train_loss: 0.8077, test_loss: 1.3054, test_f1: 0.5383
 epoch: 68, train_loss: 0.8019, test_loss: 1.2649, test_f1: 0.5754
 epoch: 69, train_loss: 0.7873, test_loss: 1.2936, test_f1: 0.5548
 epoch: 70, train_loss: 0.8169, test_loss: 1.2981, test_f1: 0.5418
 epoch: 71, train_loss: 0.7873, test_loss: 1.3002, test_f1: 0.5651
 epoch: 72, train_loss: 0.7974, test_loss: 1.2826, test_f1: 0.5494
 epoch: 73, train_loss: 0.7852, test_loss: 1.3032, test_f1: 0.5435
 epoch: 74, train_loss: 0.7887, test_loss: 1.3036, test_f1: 0.5571
 epoch: 75, train_loss: 0.7837, test_loss: 1.2668, test_f1: 0.5488
 epoch: 76, train_loss: 0.7741, test_loss: 1.3044, test_f1: 0.5498
 epoch: 77, train_loss: 0.7899, test_loss: 1.2983, test_f1: 0.5568
 epoch: 78, train_loss: 0.7919, test_loss: 1.3155, test_f1: 0.5543
 epoch: 79, train_loss: 0.7831, test_loss: 1.3275, test_f1: 0.5538
 epoch: 80, train_loss: 0.7788, test_loss: 1.2963, test_f1: 0.5585
 epoch: 81, train_loss: 0.7916, test_loss: 1.3222, test_f1: 0.5380
 epoch: 82, train_loss: 0.7733, test_loss: 1.3204, test_f1: 0.5559
 epoch: 83, train_loss: 0.7696, test_loss: 1.3468, test_f1: 0.5462
 epoch: 84, train_loss: 0.7613, test_loss: 1.3471, test_f1: 0.5477
 epoch: 85, train_loss: 0.7658, test_loss: 1.3521, test_f1: 0.5473
 epoch: 86, train_loss: 0.7538, test_loss: 1.3441, test_f1: 0.5504
 epoch: 87, train_loss: 0.7726, test_loss: 1.3682, test_f1: 0.5397
 epoch: 88, train_loss: 0.7568, test_loss: 1.3470, test_f1: 0.5586
 epoch: 89, train_loss: 0.7585, test_loss: 1.3774, test_f1: 0.5692
 epoch: 90, train_loss: 0.7613, test_loss: 1.3764, test_f1: 0.5316
 epoch: 91, train_loss: 0.7709, test_loss: 1.3801, test_f1: 0.5565
 epoch: 92, train_loss: 0.7453, test_loss: 1.3668, test_f1: 0.5264
 epoch: 93, train_loss: 0.7642, test_loss: 1.3552, test_f1: 0.5629
 epoch: 94, train_loss: 0.7543, test_loss: 1.3578, test_f1: 0.5542
 epoch: 95, train_loss: 0.7404, test_loss: 1.4037, test_f1: 0.5637
 epoch: 96, train_loss: 0.7431, test_loss: 1.4128, test_f1: 0.5634
 epoch: 97, train_loss: 0.7575, test_loss: 1.4221, test_f1: 0.5326
 epoch: 98, train_loss: 0.7390, test_loss: 1.3809, test_f1: 0.5455
 epoch: 99, train_loss: 0.7656, test_loss: 1.3987, test_f1: 0.5603
##################ITERATION #6 ****************************************
 epoch: 0, train_loss: 1.2757, test_loss: 1.3146, test_f1: 0.2807
 epoch: 1, train_loss: 1.2143, test_loss: 1.2515, test_f1: 0.3995
 epoch: 2, train_loss: 1.2024, test_loss: 1.2707, test_f1: 0.4114
 epoch: 3, train_loss: 1.1853, test_loss: 1.5595, test_f1: 0.4613
 epoch: 4, train_loss: 1.1621, test_loss: 1.7193, test_f1: 0.4426
 epoch: 5, train_loss: 1.1583, test_loss: 1.7700, test_f1: 0.4549
 epoch: 6, train_loss: 1.1394, test_loss: 1.8821, test_f1: 0.4549
 epoch: 7, train_loss: 1.1306, test_loss: 2.1819, test_f1: 0.4593
 epoch: 8, train_loss: 1.1161, test_loss: 2.0814, test_f1: 0.4790
 epoch: 9, train_loss: 1.1009, test_loss: 2.0883, test_f1: 0.4661
 epoch: 10, train_loss: 1.1044, test_loss: 2.0866, test_f1: 0.4947
 epoch: 11, train_loss: 1.0877, test_loss: 1.9791, test_f1: 0.5018
 epoch: 12, train_loss: 1.0865, test_loss: 2.0848, test_f1: 0.5035
 epoch: 13, train_loss: 1.0732, test_loss: 2.0835, test_f1: 0.5005
 epoch: 14, train_loss: 1.0624, test_loss: 2.1432, test_f1: 0.5126
 epoch: 15, train_loss: 1.0473, test_loss: 2.1114, test_f1: 0.5144
 epoch: 16, train_loss: 1.0436, test_loss: 2.3090, test_f1: 0.5350
 epoch: 17, train_loss: 1.0391, test_loss: 2.3116, test_f1: 0.5243
 epoch: 18, train_loss: 1.0398, test_loss: 2.3030, test_f1: 0.5361
 epoch: 19, train_loss: 1.0249, test_loss: 2.4089, test_f1: 0.5394
 epoch: 20, train_loss: 1.0132, test_loss: 2.4952, test_f1: 0.5258
 epoch: 21, train_loss: 1.0110, test_loss: 2.3832, test_f1: 0.5115
 epoch: 22, train_loss: 1.0150, test_loss: 2.4261, test_f1: 0.5185
 epoch: 23, train_loss: 1.0005, test_loss: 2.5092, test_f1: 0.5177
 epoch: 24, train_loss: 0.9969, test_loss: 2.5761, test_f1: 0.5278
 epoch: 25, train_loss: 0.9776, test_loss: 2.5699, test_f1: 0.5161
 epoch: 26, train_loss: 0.9778, test_loss: 2.6922, test_f1: 0.5177
 epoch: 27, train_loss: 0.9683, test_loss: 2.6450, test_f1: 0.5243
 epoch: 28, train_loss: 0.9557, test_loss: 2.6548, test_f1: 0.5110
 epoch: 29, train_loss: 0.9618, test_loss: 2.6375, test_f1: 0.4833
 epoch: 30, train_loss: 0.9428, test_loss: 2.6261, test_f1: 0.4857
 epoch: 31, train_loss: 0.9442, test_loss: 2.6980, test_f1: 0.4960
 epoch: 32, train_loss: 0.9226, test_loss: 2.8614, test_f1: 0.5068
 epoch: 33, train_loss: 0.9345, test_loss: 3.0264, test_f1: 0.5327
 epoch: 34, train_loss: 0.9107, test_loss: 3.1896, test_f1: 0.4938
 epoch: 35, train_loss: 0.9225, test_loss: 3.4290, test_f1: 0.4919
 epoch: 36, train_loss: 0.9009, test_loss: 3.4354, test_f1: 0.5144
 epoch: 37, train_loss: 0.8922, test_loss: 3.2460, test_f1: 0.5150
 epoch: 38, train_loss: 0.8900, test_loss: 3.5227, test_f1: 0.5094
 epoch: 39, train_loss: 0.8941, test_loss: 3.9622, test_f1: 0.4906
 epoch: 40, train_loss: 0.8933, test_loss: 4.0562, test_f1: 0.4949
 epoch: 41, train_loss: 0.8945, test_loss: 3.5631, test_f1: 0.4883
 epoch: 42, train_loss: 0.8663, test_loss: 3.8915, test_f1: 0.4965
 epoch: 43, train_loss: 0.8743, test_loss: 3.9682, test_f1: 0.4952
 epoch: 44, train_loss: 0.8544, test_loss: 4.0061, test_f1: 0.4922
 epoch: 45, train_loss: 0.8525, test_loss: 4.2785, test_f1: 0.4924
 epoch: 46, train_loss: 0.8574, test_loss: 4.1961, test_f1: 0.5033
 epoch: 47, train_loss: 0.8537, test_loss: 5.5705, test_f1: 0.5192
 epoch: 48, train_loss: 0.8279, test_loss: 4.3737, test_f1: 0.5016
 epoch: 49, train_loss: 0.8458, test_loss: 4.9506, test_f1: 0.5003
 epoch: 50, train_loss: 0.8337, test_loss: 4.7007, test_f1: 0.4982
 epoch: 51, train_loss: 0.8238, test_loss: 4.7755, test_f1: 0.5117
 epoch: 52, train_loss: 0.8221, test_loss: 4.9178, test_f1: 0.5213
 epoch: 53, train_loss: 0.8278, test_loss: 4.6981, test_f1: 0.5028
 epoch: 54, train_loss: 0.8143, test_loss: 4.7955, test_f1: 0.5175
 epoch: 55, train_loss: 0.8201, test_loss: 4.8832, test_f1: 0.4976
 epoch: 56, train_loss: 0.7919, test_loss: 4.6503, test_f1: 0.4998
 epoch: 57, train_loss: 0.8088, test_loss: 5.2173, test_f1: 0.4985
 epoch: 58, train_loss: 0.8051, test_loss: 4.7112, test_f1: 0.5130
 epoch: 59, train_loss: 0.8045, test_loss: 5.1746, test_f1: 0.5209
 epoch: 60, train_loss: 0.8027, test_loss: 4.8971, test_f1: 0.4996
 epoch: 61, train_loss: 0.8096, test_loss: 5.0725, test_f1: 0.5003
 epoch: 62, train_loss: 0.7898, test_loss: 5.3204, test_f1: 0.4852
 epoch: 63, train_loss: 0.8141, test_loss: 4.6918, test_f1: 0.5175
 epoch: 64, train_loss: 0.7825, test_loss: 4.4535, test_f1: 0.5046
 epoch: 65, train_loss: 0.7779, test_loss: 4.9523, test_f1: 0.5048
 epoch: 66, train_loss: 0.7925, test_loss: 4.3455, test_f1: 0.4899
 epoch: 67, train_loss: 0.7700, test_loss: 5.1178, test_f1: 0.5176
 epoch: 68, train_loss: 0.7792, test_loss: 5.3387, test_f1: 0.5162
 epoch: 69, train_loss: 0.7932, test_loss: 5.3494, test_f1: 0.5154
 epoch: 70, train_loss: 0.7785, test_loss: 5.6923, test_f1: 0.5086
 epoch: 71, train_loss: 0.7704, test_loss: 5.8573, test_f1: 0.5011
 epoch: 72, train_loss: 0.7616, test_loss: 4.9751, test_f1: 0.5118
 epoch: 73, train_loss: 0.7664, test_loss: 5.5763, test_f1: 0.5151
 epoch: 74, train_loss: 0.7594, test_loss: 5.1745, test_f1: 0.5000
 epoch: 75, train_loss: 0.7624, test_loss: 5.5934, test_f1: 0.4945
 epoch: 76, train_loss: 0.7470, test_loss: 5.0497, test_f1: 0.4962
 epoch: 77, train_loss: 0.7346, test_loss: 4.9071, test_f1: 0.5080
 epoch: 78, train_loss: 0.7598, test_loss: 5.3047, test_f1: 0.5031
 epoch: 79, train_loss: 0.7593, test_loss: 5.3411, test_f1: 0.5055
 epoch: 80, train_loss: 0.7639, test_loss: 4.7426, test_f1: 0.4886
 epoch: 81, train_loss: 0.7477, test_loss: 4.7266, test_f1: 0.5195
 epoch: 82, train_loss: 0.7462, test_loss: 5.1226, test_f1: 0.5058
 epoch: 83, train_loss: 0.7439, test_loss: 4.8873, test_f1: 0.5084
 epoch: 84, train_loss: 0.7305, test_loss: 5.2403, test_f1: 0.5073
 epoch: 85, train_loss: 0.7558, test_loss: 5.4132, test_f1: 0.5116
 epoch: 86, train_loss: 0.7571, test_loss: 5.3120, test_f1: 0.5081
 epoch: 87, train_loss: 0.7352, test_loss: 5.3302, test_f1: 0.4976
 epoch: 88, train_loss: 0.7520, test_loss: 4.9313, test_f1: 0.5042
 epoch: 89, train_loss: 0.7306, test_loss: 5.2312, test_f1: 0.5006
 epoch: 90, train_loss: 0.7225, test_loss: 5.2374, test_f1: 0.5183
 epoch: 91, train_loss: 0.7447, test_loss: 5.3712, test_f1: 0.5191
 epoch: 92, train_loss: 0.7029, test_loss: 5.5286, test_f1: 0.5174
 epoch: 93, train_loss: 0.7208, test_loss: 5.4172, test_f1: 0.5152
 epoch: 94, train_loss: 0.7325, test_loss: 5.7785, test_f1: 0.5173
 epoch: 95, train_loss: 0.7285, test_loss: 5.8736, test_f1: 0.5202
 epoch: 96, train_loss: 0.7024, test_loss: 5.6969, test_f1: 0.5197
 epoch: 97, train_loss: 0.7190, test_loss: 5.2522, test_f1: 0.5160
 epoch: 98, train_loss: 0.7144, test_loss: 6.2457, test_f1: 0.5145
 epoch: 99, train_loss: 0.7145, test_loss: 5.8132, test_f1: 0.5151
##################ITERATION #7 ****************************************
 epoch: 0, train_loss: 1.3445, test_loss: 1.3584, test_f1: 0.2960
 epoch: 1, train_loss: 1.2542, test_loss: 1.3488, test_f1: 0.3464
 epoch: 2, train_loss: 1.2267, test_loss: 1.3447, test_f1: 0.4630
 epoch: 3, train_loss: 1.1884, test_loss: 1.3556, test_f1: 0.4809
 epoch: 4, train_loss: 1.1701, test_loss: 1.3140, test_f1: 0.4860
 epoch: 5, train_loss: 1.1522, test_loss: 1.2951, test_f1: 0.4898
 epoch: 6, train_loss: 1.1368, test_loss: 1.3158, test_f1: 0.4973
 epoch: 7, train_loss: 1.1240, test_loss: 1.2795, test_f1: 0.4993
 epoch: 8, train_loss: 1.1112, test_loss: 1.2654, test_f1: 0.5162
 epoch: 9, train_loss: 1.0897, test_loss: 1.2671, test_f1: 0.5364
 epoch: 10, train_loss: 1.0711, test_loss: 1.2683, test_f1: 0.4949
 epoch: 11, train_loss: 1.0606, test_loss: 1.2527, test_f1: 0.5216
 epoch: 12, train_loss: 1.0546, test_loss: 1.2566, test_f1: 0.5324
 epoch: 13, train_loss: 1.0311, test_loss: 1.3110, test_f1: 0.5057
 epoch: 14, train_loss: 1.0440, test_loss: 1.2574, test_f1: 0.5294
 epoch: 15, train_loss: 1.0238, test_loss: 1.2887, test_f1: 0.5296
 epoch: 16, train_loss: 1.0189, test_loss: 1.2680, test_f1: 0.5180
 epoch: 17, train_loss: 0.9953, test_loss: 1.2678, test_f1: 0.5234
 epoch: 18, train_loss: 0.9893, test_loss: 1.2879, test_f1: 0.5223
 epoch: 19, train_loss: 0.9865, test_loss: 1.2635, test_f1: 0.5200
 epoch: 20, train_loss: 0.9875, test_loss: 1.2506, test_f1: 0.5181
 epoch: 21, train_loss: 0.9763, test_loss: 1.2301, test_f1: 0.5335
 epoch: 22, train_loss: 0.9584, test_loss: 1.2536, test_f1: 0.5173
 epoch: 23, train_loss: 0.9670, test_loss: 1.2307, test_f1: 0.5265
 epoch: 24, train_loss: 0.9593, test_loss: 1.2514, test_f1: 0.5048
 epoch: 25, train_loss: 0.9509, test_loss: 1.2251, test_f1: 0.5062
 epoch: 26, train_loss: 0.9326, test_loss: 1.2292, test_f1: 0.5220
 epoch: 27, train_loss: 0.9370, test_loss: 1.2267, test_f1: 0.5240
 epoch: 28, train_loss: 0.9308, test_loss: 1.2125, test_f1: 0.5120
 epoch: 29, train_loss: 0.9132, test_loss: 1.1999, test_f1: 0.5254
 epoch: 30, train_loss: 0.9227, test_loss: 1.2177, test_f1: 0.5116
 epoch: 31, train_loss: 0.9060, test_loss: 1.2243, test_f1: 0.5351
 epoch: 32, train_loss: 0.9019, test_loss: 1.2179, test_f1: 0.5432
 epoch: 33, train_loss: 0.8901, test_loss: 1.2389, test_f1: 0.5485
 epoch: 34, train_loss: 0.9005, test_loss: 1.2581, test_f1: 0.5293
 epoch: 35, train_loss: 0.8793, test_loss: 1.2631, test_f1: 0.5477
 epoch: 36, train_loss: 0.8698, test_loss: 1.2253, test_f1: 0.5357
 epoch: 37, train_loss: 0.8705, test_loss: 1.2215, test_f1: 0.5162
 epoch: 38, train_loss: 0.8567, test_loss: 1.2310, test_f1: 0.5450
 epoch: 39, train_loss: 0.8896, test_loss: 1.2197, test_f1: 0.5512
 epoch: 40, train_loss: 0.8665, test_loss: 1.2027, test_f1: 0.5720
 epoch: 41, train_loss: 0.8504, test_loss: 1.2099, test_f1: 0.5445
 epoch: 42, train_loss: 0.8449, test_loss: 1.2403, test_f1: 0.5440
 epoch: 43, train_loss: 0.8463, test_loss: 1.2715, test_f1: 0.5449
 epoch: 44, train_loss: 0.8532, test_loss: 1.2127, test_f1: 0.5705
 epoch: 45, train_loss: 0.8231, test_loss: 1.2471, test_f1: 0.5623
 epoch: 46, train_loss: 0.8477, test_loss: 1.2312, test_f1: 0.5509
 epoch: 47, train_loss: 0.8224, test_loss: 1.2534, test_f1: 0.5442
 epoch: 48, train_loss: 0.8218, test_loss: 1.2510, test_f1: 0.5465
 epoch: 49, train_loss: 0.8184, test_loss: 1.2498, test_f1: 0.5670
 epoch: 50, train_loss: 0.8183, test_loss: 1.2665, test_f1: 0.5459
 epoch: 51, train_loss: 0.8147, test_loss: 1.2565, test_f1: 0.5434
 epoch: 52, train_loss: 0.7843, test_loss: 1.2943, test_f1: 0.5668
 epoch: 53, train_loss: 0.7975, test_loss: 1.2269, test_f1: 0.5705
 epoch: 54, train_loss: 0.8044, test_loss: 1.2658, test_f1: 0.5569
 epoch: 55, train_loss: 0.7970, test_loss: 1.2533, test_f1: 0.5696
 epoch: 56, train_loss: 0.7808, test_loss: 1.2628, test_f1: 0.5615
 epoch: 57, train_loss: 0.7893, test_loss: 1.2813, test_f1: 0.5566
 epoch: 58, train_loss: 0.7859, test_loss: 1.3209, test_f1: 0.5615
 epoch: 59, train_loss: 0.7787, test_loss: 1.2492, test_f1: 0.5718
 epoch: 60, train_loss: 0.7750, test_loss: 1.3072, test_f1: 0.5668
 epoch: 61, train_loss: 0.7864, test_loss: 1.2919, test_f1: 0.5618
 epoch: 62, train_loss: 0.7867, test_loss: 1.2811, test_f1: 0.5646
 epoch: 63, train_loss: 0.7834, test_loss: 1.3698, test_f1: 0.5591
 epoch: 64, train_loss: 0.7776, test_loss: 1.2645, test_f1: 0.5803
 epoch: 65, train_loss: 0.7730, test_loss: 1.3221, test_f1: 0.5641
 epoch: 66, train_loss: 0.7654, test_loss: 1.2771, test_f1: 0.5639
 epoch: 67, train_loss: 0.7682, test_loss: 1.2784, test_f1: 0.5905
 epoch: 68, train_loss: 0.7543, test_loss: 1.3246, test_f1: 0.5433
 epoch: 69, train_loss: 0.7698, test_loss: 1.3621, test_f1: 0.5329
 epoch: 70, train_loss: 0.7578, test_loss: 1.3576, test_f1: 0.5592
 epoch: 71, train_loss: 0.7620, test_loss: 1.3643, test_f1: 0.5509
 epoch: 72, train_loss: 0.7390, test_loss: 1.3839, test_f1: 0.5462
 epoch: 73, train_loss: 0.7588, test_loss: 1.4353, test_f1: 0.5491
 epoch: 74, train_loss: 0.7627, test_loss: 1.3520, test_f1: 0.5594
 epoch: 75, train_loss: 0.7522, test_loss: 1.3726, test_f1: 0.5516
 epoch: 76, train_loss: 0.7720, test_loss: 1.3671, test_f1: 0.5568
 epoch: 77, train_loss: 0.7496, test_loss: 1.3945, test_f1: 0.5542
 epoch: 78, train_loss: 0.7436, test_loss: 1.3258, test_f1: 0.5673
 epoch: 79, train_loss: 0.7308, test_loss: 1.3420, test_f1: 0.5596
 epoch: 80, train_loss: 0.7485, test_loss: 1.3679, test_f1: 0.5619
 epoch: 81, train_loss: 0.7270, test_loss: 1.3453, test_f1: 0.5488
 epoch: 82, train_loss: 0.7329, test_loss: 1.3612, test_f1: 0.5697
 epoch: 83, train_loss: 0.7247, test_loss: 1.3925, test_f1: 0.5540
 epoch: 84, train_loss: 0.7473, test_loss: 1.4000, test_f1: 0.5624
 epoch: 85, train_loss: 0.7275, test_loss: 1.4159, test_f1: 0.5541
 epoch: 86, train_loss: 0.7427, test_loss: 1.4499, test_f1: 0.5486
 epoch: 87, train_loss: 0.7166, test_loss: 1.4164, test_f1: 0.5564
 epoch: 88, train_loss: 0.7420, test_loss: 1.4041, test_f1: 0.5615
 epoch: 89, train_loss: 0.7276, test_loss: 1.4210, test_f1: 0.5512
 epoch: 90, train_loss: 0.7415, test_loss: 1.4023, test_f1: 0.5746
 epoch: 91, train_loss: 0.7382, test_loss: 1.4069, test_f1: 0.5621
 epoch: 92, train_loss: 0.7240, test_loss: 1.4050, test_f1: 0.5829
 epoch: 93, train_loss: 0.7195, test_loss: 1.4525, test_f1: 0.5536
 epoch: 94, train_loss: 0.7141, test_loss: 1.3797, test_f1: 0.5778
 epoch: 95, train_loss: 0.7262, test_loss: 1.4480, test_f1: 0.5590
 epoch: 96, train_loss: 0.7160, test_loss: 1.4758, test_f1: 0.5592
 epoch: 97, train_loss: 0.7158, test_loss: 1.4360, test_f1: 0.5882
 epoch: 98, train_loss: 0.7173, test_loss: 1.5121, test_f1: 0.5697
 epoch: 99, train_loss: 0.6967, test_loss: 1.5104, test_f1: 0.5441
##################ITERATION #8 ****************************************
 epoch: 0, train_loss: 1.3208, test_loss: 1.3690, test_f1: 0.2385
 epoch: 1, train_loss: 1.2358, test_loss: 1.3459, test_f1: 0.2987
 epoch: 2, train_loss: 1.2321, test_loss: 1.3201, test_f1: 0.3589
 epoch: 3, train_loss: 1.2123, test_loss: 1.2879, test_f1: 0.3844
 epoch: 4, train_loss: 1.1901, test_loss: 1.2761, test_f1: 0.4130
 epoch: 5, train_loss: 1.1655, test_loss: 1.2673, test_f1: 0.4334
 epoch: 6, train_loss: 1.1602, test_loss: 1.2566, test_f1: 0.4578
 epoch: 7, train_loss: 1.1405, test_loss: 1.2523, test_f1: 0.4560
 epoch: 8, train_loss: 1.1318, test_loss: 1.2471, test_f1: 0.4956
 epoch: 9, train_loss: 1.1196, test_loss: 1.2195, test_f1: 0.4815
 epoch: 10, train_loss: 1.1225, test_loss: 1.2385, test_f1: 0.4847
 epoch: 11, train_loss: 1.0829, test_loss: 1.2504, test_f1: 0.4829
 epoch: 12, train_loss: 1.0946, test_loss: 1.2587, test_f1: 0.4878
 epoch: 13, train_loss: 1.0790, test_loss: 1.2138, test_f1: 0.4993
 epoch: 14, train_loss: 1.0725, test_loss: 1.2236, test_f1: 0.5003
 epoch: 15, train_loss: 1.0741, test_loss: 1.2253, test_f1: 0.5029
 epoch: 16, train_loss: 1.0311, test_loss: 1.2518, test_f1: 0.5068
 epoch: 17, train_loss: 1.0460, test_loss: 1.2605, test_f1: 0.5085
 epoch: 18, train_loss: 1.0345, test_loss: 1.2660, test_f1: 0.4974
 epoch: 19, train_loss: 1.0307, test_loss: 1.2441, test_f1: 0.4972
 epoch: 20, train_loss: 1.0091, test_loss: 1.2253, test_f1: 0.5131
 epoch: 21, train_loss: 1.0072, test_loss: 1.2204, test_f1: 0.5318
 epoch: 22, train_loss: 1.0146, test_loss: 1.2257, test_f1: 0.5408
 epoch: 23, train_loss: 0.9955, test_loss: 1.1970, test_f1: 0.5467
 epoch: 24, train_loss: 0.9753, test_loss: 1.2100, test_f1: 0.5260
 epoch: 25, train_loss: 0.9889, test_loss: 1.1990, test_f1: 0.5411
 epoch: 26, train_loss: 0.9666, test_loss: 1.2088, test_f1: 0.5469
 epoch: 27, train_loss: 0.9769, test_loss: 1.2416, test_f1: 0.5363
 epoch: 28, train_loss: 0.9595, test_loss: 1.2207, test_f1: 0.5385
 epoch: 29, train_loss: 0.9460, test_loss: 1.2226, test_f1: 0.5353
 epoch: 30, train_loss: 0.9476, test_loss: 1.2326, test_f1: 0.5073
 epoch: 31, train_loss: 0.9403, test_loss: 1.2167, test_f1: 0.5186
 epoch: 32, train_loss: 0.9389, test_loss: 1.2101, test_f1: 0.5469
 epoch: 33, train_loss: 0.9265, test_loss: 1.1865, test_f1: 0.5426
 epoch: 34, train_loss: 0.9324, test_loss: 1.1737, test_f1: 0.5464
 epoch: 35, train_loss: 0.9045, test_loss: 1.1955, test_f1: 0.5355
 epoch: 36, train_loss: 0.9011, test_loss: 1.1950, test_f1: 0.5426
 epoch: 37, train_loss: 0.9089, test_loss: 1.2257, test_f1: 0.5403
 epoch: 38, train_loss: 0.9105, test_loss: 1.2068, test_f1: 0.5345
 epoch: 39, train_loss: 0.8872, test_loss: 1.2253, test_f1: 0.5320
 epoch: 40, train_loss: 0.8870, test_loss: 1.2259, test_f1: 0.5337
 epoch: 41, train_loss: 0.8813, test_loss: 1.2207, test_f1: 0.5270
 epoch: 42, train_loss: 0.8704, test_loss: 1.2327, test_f1: 0.5249
 epoch: 43, train_loss: 0.8556, test_loss: 1.2338, test_f1: 0.5173
 epoch: 44, train_loss: 0.8808, test_loss: 1.2609, test_f1: 0.5329
 epoch: 45, train_loss: 0.8687, test_loss: 1.2394, test_f1: 0.5561
 epoch: 46, train_loss: 0.8549, test_loss: 1.2439, test_f1: 0.5434
 epoch: 47, train_loss: 0.8535, test_loss: 1.2746, test_f1: 0.5337
 epoch: 48, train_loss: 0.8438, test_loss: 1.2627, test_f1: 0.5349
 epoch: 49, train_loss: 0.8367, test_loss: 1.2419, test_f1: 0.5458
 epoch: 50, train_loss: 0.8433, test_loss: 1.2664, test_f1: 0.5232
 epoch: 51, train_loss: 0.8369, test_loss: 1.2476, test_f1: 0.5487
 epoch: 52, train_loss: 0.8227, test_loss: 1.2561, test_f1: 0.5541
 epoch: 53, train_loss: 0.8227, test_loss: 1.2728, test_f1: 0.5269
 epoch: 54, train_loss: 0.8269, test_loss: 1.2670, test_f1: 0.5420
 epoch: 55, train_loss: 0.8117, test_loss: 1.2646, test_f1: 0.5469
 epoch: 56, train_loss: 0.8140, test_loss: 1.2675, test_f1: 0.5419
 epoch: 57, train_loss: 0.8130, test_loss: 1.2684, test_f1: 0.5518
 epoch: 58, train_loss: 0.7927, test_loss: 1.2702, test_f1: 0.5347
 epoch: 59, train_loss: 0.8090, test_loss: 1.2817, test_f1: 0.5541
 epoch: 60, train_loss: 0.8274, test_loss: 1.3003, test_f1: 0.5505
 epoch: 61, train_loss: 0.8099, test_loss: 1.2740, test_f1: 0.5642
 epoch: 62, train_loss: 0.8030, test_loss: 1.2863, test_f1: 0.5709
 epoch: 63, train_loss: 0.8071, test_loss: 1.3121, test_f1: 0.5543
 epoch: 64, train_loss: 0.8022, test_loss: 1.2743, test_f1: 0.5672
 epoch: 65, train_loss: 0.8029, test_loss: 1.3368, test_f1: 0.5522
 epoch: 66, train_loss: 0.7858, test_loss: 1.3248, test_f1: 0.5674
 epoch: 67, train_loss: 0.8001, test_loss: 1.3207, test_f1: 0.5705
 epoch: 68, train_loss: 0.7765, test_loss: 1.3235, test_f1: 0.5634
 epoch: 69, train_loss: 0.7894, test_loss: 1.3285, test_f1: 0.5835
 epoch: 70, train_loss: 0.7927, test_loss: 1.3352, test_f1: 0.5707
 epoch: 71, train_loss: 0.7941, test_loss: 1.3515, test_f1: 0.5737
 epoch: 72, train_loss: 0.7776, test_loss: 1.3485, test_f1: 0.5649
 epoch: 73, train_loss: 0.7611, test_loss: 1.3488, test_f1: 0.5614
 epoch: 74, train_loss: 0.7587, test_loss: 1.3518, test_f1: 0.5600
 epoch: 75, train_loss: 0.7655, test_loss: 1.3586, test_f1: 0.5654
 epoch: 76, train_loss: 0.7896, test_loss: 1.3751, test_f1: 0.5742
 epoch: 77, train_loss: 0.7647, test_loss: 1.3533, test_f1: 0.5657
 epoch: 78, train_loss: 0.7695, test_loss: 1.3765, test_f1: 0.5658
 epoch: 79, train_loss: 0.7704, test_loss: 1.3636, test_f1: 0.5485
 epoch: 80, train_loss: 0.7574, test_loss: 1.3646, test_f1: 0.5704
 epoch: 81, train_loss: 0.7490, test_loss: 1.3692, test_f1: 0.5592
 epoch: 82, train_loss: 0.7545, test_loss: 1.3449, test_f1: 0.5721
 epoch: 83, train_loss: 0.7451, test_loss: 1.3627, test_f1: 0.5627
 epoch: 84, train_loss: 0.7539, test_loss: 1.3857, test_f1: 0.5601
 epoch: 85, train_loss: 0.7624, test_loss: 1.3801, test_f1: 0.5607
 epoch: 86, train_loss: 0.7684, test_loss: 1.4022, test_f1: 0.5438
 epoch: 87, train_loss: 0.7471, test_loss: 1.3937, test_f1: 0.5580
 epoch: 88, train_loss: 0.7578, test_loss: 1.3974, test_f1: 0.5445
 epoch: 89, train_loss: 0.7400, test_loss: 1.3949, test_f1: 0.5783
 epoch: 90, train_loss: 0.7427, test_loss: 1.4089, test_f1: 0.5651
 epoch: 91, train_loss: 0.7241, test_loss: 1.3864, test_f1: 0.5546
 epoch: 92, train_loss: 0.7378, test_loss: 1.4096, test_f1: 0.5575
 epoch: 93, train_loss: 0.7322, test_loss: 1.4085, test_f1: 0.5653
 epoch: 94, train_loss: 0.7421, test_loss: 1.4229, test_f1: 0.5548
 epoch: 95, train_loss: 0.7252, test_loss: 1.3856, test_f1: 0.5636
 epoch: 96, train_loss: 0.7335, test_loss: 1.3856, test_f1: 0.5681
 epoch: 97, train_loss: 0.7272, test_loss: 1.4125, test_f1: 0.5646
 epoch: 98, train_loss: 0.7234, test_loss: 1.4089, test_f1: 0.5729
 epoch: 99, train_loss: 0.7294, test_loss: 1.4085, test_f1: 0.5682
##################ITERATION #9 ****************************************
 epoch: 0, train_loss: 1.3532, test_loss: 1.2977, test_f1: 0.2859
 epoch: 1, train_loss: 1.2520, test_loss: 1.3084, test_f1: 0.3119
 epoch: 2, train_loss: 1.2219, test_loss: 1.2840, test_f1: 0.3240
 epoch: 3, train_loss: 1.2075, test_loss: 1.2892, test_f1: 0.3524
 epoch: 4, train_loss: 1.1772, test_loss: 1.2766, test_f1: 0.3467
 epoch: 5, train_loss: 1.1748, test_loss: 1.2646, test_f1: 0.3655
 epoch: 6, train_loss: 1.1627, test_loss: 1.2789, test_f1: 0.3821
 epoch: 7, train_loss: 1.1583, test_loss: 1.2546, test_f1: 0.4232
 epoch: 8, train_loss: 1.1555, test_loss: 1.2628, test_f1: 0.4014
 epoch: 9, train_loss: 1.1116, test_loss: 1.2508, test_f1: 0.4227
 epoch: 10, train_loss: 1.1121, test_loss: 1.2437, test_f1: 0.4351
 epoch: 11, train_loss: 1.1182, test_loss: 1.2291, test_f1: 0.4294
 epoch: 12, train_loss: 1.1092, test_loss: 1.2478, test_f1: 0.4353
 epoch: 13, train_loss: 1.0878, test_loss: 1.2587, test_f1: 0.4480
 epoch: 14, train_loss: 1.0929, test_loss: 1.2158, test_f1: 0.4445
 epoch: 15, train_loss: 1.0786, test_loss: 1.2354, test_f1: 0.4404
 epoch: 16, train_loss: 1.0845, test_loss: 1.2302, test_f1: 0.4474
 epoch: 17, train_loss: 1.0771, test_loss: 1.2082, test_f1: 0.4372
 epoch: 18, train_loss: 1.0586, test_loss: 1.2097, test_f1: 0.4504
 epoch: 19, train_loss: 1.0405, test_loss: 1.2122, test_f1: 0.4899
 epoch: 20, train_loss: 1.0459, test_loss: 1.1917, test_f1: 0.5154
 epoch: 21, train_loss: 1.0341, test_loss: 1.2332, test_f1: 0.5019
 epoch: 22, train_loss: 1.0319, test_loss: 1.2139, test_f1: 0.5088
 epoch: 23, train_loss: 1.0197, test_loss: 1.2101, test_f1: 0.5121
 epoch: 24, train_loss: 1.0212, test_loss: 1.2256, test_f1: 0.5225
 epoch: 25, train_loss: 0.9972, test_loss: 1.2051, test_f1: 0.5145
 epoch: 26, train_loss: 1.0050, test_loss: 1.1904, test_f1: 0.4910
 epoch: 27, train_loss: 0.9844, test_loss: 1.2218, test_f1: 0.5032
 epoch: 28, train_loss: 0.9812, test_loss: 1.2179, test_f1: 0.5057
 epoch: 29, train_loss: 0.9778, test_loss: 1.2116, test_f1: 0.5099
 epoch: 30, train_loss: 0.9995, test_loss: 1.2010, test_f1: 0.5090
 epoch: 31, train_loss: 0.9670, test_loss: 1.2486, test_f1: 0.5092
 epoch: 32, train_loss: 0.9709, test_loss: 1.2117, test_f1: 0.5328
 epoch: 33, train_loss: 0.9550, test_loss: 1.2072, test_f1: 0.5115
 epoch: 34, train_loss: 0.9444, test_loss: 1.1874, test_f1: 0.5270
 epoch: 35, train_loss: 0.9355, test_loss: 1.1963, test_f1: 0.5023
 epoch: 36, train_loss: 0.9276, test_loss: 1.2038, test_f1: 0.5332
 epoch: 37, train_loss: 0.9166, test_loss: 1.2101, test_f1: 0.5283
 epoch: 38, train_loss: 0.9122, test_loss: 1.2226, test_f1: 0.5481
 epoch: 39, train_loss: 0.9118, test_loss: 1.2269, test_f1: 0.5330
 epoch: 40, train_loss: 0.9242, test_loss: 1.2299, test_f1: 0.5257
 epoch: 41, train_loss: 0.8972, test_loss: 1.2116, test_f1: 0.5494
 epoch: 42, train_loss: 0.8966, test_loss: 1.2493, test_f1: 0.5376
 epoch: 43, train_loss: 0.8916, test_loss: 1.2001, test_f1: 0.5300
 epoch: 44, train_loss: 0.8950, test_loss: 1.2220, test_f1: 0.5513
 epoch: 45, train_loss: 0.8742, test_loss: 1.2113, test_f1: 0.5496
 epoch: 46, train_loss: 0.8619, test_loss: 1.2362, test_f1: 0.5450
 epoch: 47, train_loss: 0.8626, test_loss: 1.2034, test_f1: 0.5553
 epoch: 48, train_loss: 0.8615, test_loss: 1.2359, test_f1: 0.5344
 epoch: 49, train_loss: 0.8667, test_loss: 1.2287, test_f1: 0.5555
 epoch: 50, train_loss: 0.8684, test_loss: 1.2378, test_f1: 0.5425
 epoch: 51, train_loss: 0.8606, test_loss: 1.2559, test_f1: 0.5455
 epoch: 52, train_loss: 0.8386, test_loss: 1.2499, test_f1: 0.5522
 epoch: 53, train_loss: 0.8560, test_loss: 1.2742, test_f1: 0.5592
 epoch: 54, train_loss: 0.8407, test_loss: 1.2176, test_f1: 0.5618
 epoch: 55, train_loss: 0.8449, test_loss: 1.2410, test_f1: 0.5471
 epoch: 56, train_loss: 0.8446, test_loss: 1.2293, test_f1: 0.5568
 epoch: 57, train_loss: 0.8492, test_loss: 1.2481, test_f1: 0.5590
 epoch: 58, train_loss: 0.8418, test_loss: 1.2811, test_f1: 0.5433
 epoch: 59, train_loss: 0.8223, test_loss: 1.2701, test_f1: 0.5523
 epoch: 60, train_loss: 0.8302, test_loss: 1.2544, test_f1: 0.5396
 epoch: 61, train_loss: 0.8172, test_loss: 1.2459, test_f1: 0.5698
 epoch: 62, train_loss: 0.8188, test_loss: 1.2340, test_f1: 0.5612
 epoch: 63, train_loss: 0.8371, test_loss: 1.2449, test_f1: 0.5586
 epoch: 64, train_loss: 0.8116, test_loss: 1.2618, test_f1: 0.5577
 epoch: 65, train_loss: 0.8293, test_loss: 1.2683, test_f1: 0.5628
 epoch: 66, train_loss: 0.8102, test_loss: 1.2499, test_f1: 0.5611
 epoch: 67, train_loss: 0.8044, test_loss: 1.2716, test_f1: 0.5417
 epoch: 68, train_loss: 0.8064, test_loss: 1.2381, test_f1: 0.5513
 epoch: 69, train_loss: 0.7930, test_loss: 1.2333, test_f1: 0.5743
 epoch: 70, train_loss: 0.8073, test_loss: 1.2540, test_f1: 0.5615
 epoch: 71, train_loss: 0.8005, test_loss: 1.2594, test_f1: 0.5771
 epoch: 72, train_loss: 0.7978, test_loss: 1.2514, test_f1: 0.5383
 epoch: 73, train_loss: 0.7831, test_loss: 1.2649, test_f1: 0.5716
 epoch: 74, train_loss: 0.7841, test_loss: 1.3008, test_f1: 0.5508
 epoch: 75, train_loss: 0.8051, test_loss: 1.2610, test_f1: 0.5696
 epoch: 76, train_loss: 0.7906, test_loss: 1.2748, test_f1: 0.5627
 epoch: 77, train_loss: 0.7863, test_loss: 1.2828, test_f1: 0.5669
 epoch: 78, train_loss: 0.7819, test_loss: 1.2779, test_f1: 0.5712
 epoch: 79, train_loss: 0.7792, test_loss: 1.2757, test_f1: 0.5558
 epoch: 80, train_loss: 0.7744, test_loss: 1.2862, test_f1: 0.5593
 epoch: 81, train_loss: 0.7902, test_loss: 1.2619, test_f1: 0.5723
 epoch: 82, train_loss: 0.7572, test_loss: 1.2728, test_f1: 0.5810
 epoch: 83, train_loss: 0.7711, test_loss: 1.2705, test_f1: 0.5662
 epoch: 84, train_loss: 0.7606, test_loss: 1.2695, test_f1: 0.5860
 epoch: 85, train_loss: 0.7594, test_loss: 1.2782, test_f1: 0.5741
 epoch: 86, train_loss: 0.7634, test_loss: 1.2969, test_f1: 0.5654
 epoch: 87, train_loss: 0.7627, test_loss: 1.2624, test_f1: 0.5488
 epoch: 88, train_loss: 0.7510, test_loss: 1.2708, test_f1: 0.5789
 epoch: 89, train_loss: 0.7654, test_loss: 1.2780, test_f1: 0.5722
 epoch: 90, train_loss: 0.7625, test_loss: 1.2856, test_f1: 0.5927
 epoch: 91, train_loss: 0.7590, test_loss: 1.2831, test_f1: 0.5764
 epoch: 92, train_loss: 0.7536, test_loss: 1.2769, test_f1: 0.5709
 epoch: 93, train_loss: 0.7464, test_loss: 1.3033, test_f1: 0.5690
 epoch: 94, train_loss: 0.7509, test_loss: 1.2835, test_f1: 0.5657
 epoch: 95, train_loss: 0.7428, test_loss: 1.2869, test_f1: 0.5778
 epoch: 96, train_loss: 0.7460, test_loss: 1.3128, test_f1: 0.5666
 epoch: 97, train_loss: 0.7610, test_loss: 1.2871, test_f1: 0.5573
 epoch: 98, train_loss: 0.7397, test_loss: 1.3361, test_f1: 0.5655
 epoch: 99, train_loss: 0.7379, test_loss: 1.3066, test_f1: 0.5619

Training completed in 447.55 seconds
Best F1: 0.5927 at epoch 90
Mean F1 across iterations: 0.5662  0.0215
========================FINAL RESULTS================================
FEGIN weighted F1: 0.5927  0.0215
python main.py --data ltspice_demos --representation component_component --model FEGIN --layers 4 --hiddens 64 --batch_size 64 --lr 0.0001 --emb_size 250 --epochs 100 --save_appendix component_component_L4_H64_BS64_LR0.0001_E250 --no_val
-----



STDERR:
  File "main.py", line 370, in <module>
    main()
  File "main.py", line 254, in main
    dataset = dataset_class(
  File "/home/philip/projects/ltspice_examples_code_repo/Circuit-Completion-Using-GNNs/component_classification_with_link_prediction_head/evaluation/FEGIN/kernel/circuit_datasets.py", line 15, in __init__
    self.data, self.slices = torch.load(self.processed_paths[0])
  File "/home/philip/.local/lib/python3.8/site-packages/torch/serialization.py", line 1040, in load
    warnings.warn(
  File "/usr/lib/python3.8/warnings.py", line 109, in _showwarnmsg
    sw(msg.message, msg.category, msg.filename, msg.lineno,
  File "main.py", line 47, in warn_with_traceback
    traceback.print_stack(file=log)
/home/philip/projects/ltspice_examples_code_repo/Circuit-Completion-Using-GNNs/component_classification_with_link_prediction_head/evaluation/FEGIN/kernel/circuit_datasets.py:15: FutureWarning: You are using `torch.load` with `weights_only=False` (the current default value), which uses the default pickle module implicitly. It is possible to construct malicious pickle data which will execute arbitrary code during unpickling (See https://github.com/pytorch/pytorch/blob/main/SECURITY.md#untrusted-models for more details). In a future release, the default value for `weights_only` will be flipped to `True`. This limits the functions that could be executed during unpickling. Arbitrary objects will no longer be allowed to be loaded via this mode unless they are explicitly allowlisted by the user via `torch.serialization.add_safe_globals`. We recommend you start setting `weights_only=True` for any use case where you don't have full control of the loaded file. Please open an issue on GitHub for any issues related to this experimental feature.
  self.data, self.slices = torch.load(self.processed_paths[0])
