STDOUT:
Results will be saved in /home/philip/projects/ltspice_examples_code_repo/Circuit-Completion-Using-GNNs/component_classification_with_link_prediction_head/evaluation/FEGIN/results/model_FEGIN_dataset_ltspice_examples
Command line input: python main.py --data ltspice_examples --representation component_component --model FEGIN --layers 5 --hiddens 128 --batch_size 256 --lr 0.001 --emb_size 512 --epochs 100 --save_appendix component_component_L5_H128_BS256_LR0.001_E512 --no_val
 is saved.
-----
ltspice_examples - FEGIN
Using 5 layers, 128 hidden units, h = 2
Loading component_component representation dataset
ENTERED
Training FEGIN on component_component representation
Train: 3556, Test: 845
##################ITERATION #0 ****************************************
 epoch: 0, train_loss: 1.3143, test_loss: 1.2851, test_f1: 0.2323
 epoch: 1, train_loss: 1.1999, test_loss: 1.2109, test_f1: 0.3447
 epoch: 2, train_loss: 1.1411, test_loss: 1.1456, test_f1: 0.3686
 epoch: 3, train_loss: 1.0945, test_loss: 1.0786, test_f1: 0.4649
 epoch: 4, train_loss: 1.0388, test_loss: 0.9808, test_f1: 0.4883
 epoch: 5, train_loss: 0.9986, test_loss: 1.0562, test_f1: 0.4489
 epoch: 6, train_loss: 0.9500, test_loss: 0.9887, test_f1: 0.4767
 epoch: 7, train_loss: 0.9129, test_loss: 1.0318, test_f1: 0.5050
 epoch: 8, train_loss: 0.9121, test_loss: 1.0222, test_f1: 0.4844
 epoch: 9, train_loss: 0.8789, test_loss: 1.0029, test_f1: 0.4947
 epoch: 10, train_loss: 0.8419, test_loss: 1.0602, test_f1: 0.4790
 epoch: 11, train_loss: 0.8314, test_loss: 1.1280, test_f1: 0.4766
 epoch: 12, train_loss: 0.8137, test_loss: 1.1039, test_f1: 0.4853
 epoch: 13, train_loss: 0.8027, test_loss: 1.0393, test_f1: 0.5068
 epoch: 14, train_loss: 0.7588, test_loss: 1.1186, test_f1: 0.5202
 epoch: 15, train_loss: 0.7376, test_loss: 1.1211, test_f1: 0.5128
 epoch: 16, train_loss: 0.7350, test_loss: 1.1958, test_f1: 0.5229
 epoch: 17, train_loss: 0.7109, test_loss: 1.1929, test_f1: 0.5250
 epoch: 18, train_loss: 0.7146, test_loss: 1.3178, test_f1: 0.5010
 epoch: 19, train_loss: 0.6860, test_loss: 1.3636, test_f1: 0.4893
 epoch: 20, train_loss: 0.6905, test_loss: 1.3536, test_f1: 0.4900
 epoch: 21, train_loss: 0.6710, test_loss: 1.2816, test_f1: 0.5113
 epoch: 22, train_loss: 0.6574, test_loss: 1.4526, test_f1: 0.5218
 epoch: 23, train_loss: 0.6368, test_loss: 1.4789, test_f1: 0.5134
 epoch: 24, train_loss: 0.6180, test_loss: 1.4310, test_f1: 0.5005
 epoch: 25, train_loss: 0.6387, test_loss: 1.3762, test_f1: 0.5173
 epoch: 26, train_loss: 0.6361, test_loss: 1.6189, test_f1: 0.4886
 epoch: 27, train_loss: 0.6150, test_loss: 1.3884, test_f1: 0.5485
 epoch: 28, train_loss: 0.5880, test_loss: 1.4405, test_f1: 0.5454
 epoch: 29, train_loss: 0.5672, test_loss: 1.5511, test_f1: 0.5291
 epoch: 30, train_loss: 0.5579, test_loss: 1.6679, test_f1: 0.5182
 epoch: 31, train_loss: 0.5577, test_loss: 1.4390, test_f1: 0.5373
 epoch: 32, train_loss: 0.5591, test_loss: 1.7398, test_f1: 0.5129
 epoch: 33, train_loss: 0.5299, test_loss: 1.6013, test_f1: 0.5499
 epoch: 34, train_loss: 0.5207, test_loss: 1.5438, test_f1: 0.5464
 epoch: 35, train_loss: 0.5225, test_loss: 1.6821, test_f1: 0.5484
 epoch: 36, train_loss: 0.5205, test_loss: 1.7008, test_f1: 0.5027
 epoch: 37, train_loss: 0.4915, test_loss: 1.8654, test_f1: 0.5510
 epoch: 38, train_loss: 0.4960, test_loss: 1.6608, test_f1: 0.5347
 epoch: 39, train_loss: 0.4684, test_loss: 2.0681, test_f1: 0.5375
 epoch: 40, train_loss: 0.4704, test_loss: 1.8583, test_f1: 0.5328
 epoch: 41, train_loss: 0.4614, test_loss: 1.8467, test_f1: 0.4981
 epoch: 42, train_loss: 0.4654, test_loss: 2.1055, test_f1: 0.5375
 epoch: 43, train_loss: 0.4751, test_loss: 1.7592, test_f1: 0.5403
 epoch: 44, train_loss: 0.4585, test_loss: 1.9439, test_f1: 0.5334
 epoch: 45, train_loss: 0.4548, test_loss: 2.0577, test_f1: 0.5192
 epoch: 46, train_loss: 0.4468, test_loss: 1.9951, test_f1: 0.5261
 epoch: 47, train_loss: 0.4224, test_loss: 2.0633, test_f1: 0.5242
 epoch: 48, train_loss: 0.4201, test_loss: 2.1161, test_f1: 0.5161
 epoch: 49, train_loss: 0.4164, test_loss: 1.9157, test_f1: 0.5275
 epoch: 50, train_loss: 0.3769, test_loss: 1.9702, test_f1: 0.5602
 epoch: 51, train_loss: 0.3604, test_loss: 2.1867, test_f1: 0.5558
 epoch: 52, train_loss: 0.3218, test_loss: 2.3544, test_f1: 0.5294
 epoch: 53, train_loss: 0.3085, test_loss: 2.1557, test_f1: 0.5393
 epoch: 54, train_loss: 0.3117, test_loss: 2.2758, test_f1: 0.5360
 epoch: 55, train_loss: 0.2810, test_loss: 2.2797, test_f1: 0.5576
 epoch: 56, train_loss: 0.2809, test_loss: 2.5101, test_f1: 0.5240
 epoch: 57, train_loss: 0.2739, test_loss: 2.3420, test_f1: 0.5329
 epoch: 58, train_loss: 0.2631, test_loss: 2.4414, test_f1: 0.5328
 epoch: 59, train_loss: 0.2596, test_loss: 2.6164, test_f1: 0.5404
 epoch: 60, train_loss: 0.2556, test_loss: 2.5220, test_f1: 0.5398
 epoch: 61, train_loss: 0.2724, test_loss: 2.5450, test_f1: 0.5481
 epoch: 62, train_loss: 0.2623, test_loss: 2.6111, test_f1: 0.5346
 epoch: 63, train_loss: 0.2570, test_loss: 2.7003, test_f1: 0.5476
 epoch: 64, train_loss: 0.2768, test_loss: 2.7447, test_f1: 0.5390
 epoch: 65, train_loss: 0.2588, test_loss: 2.7197, test_f1: 0.5361
 epoch: 66, train_loss: 0.2594, test_loss: 2.5358, test_f1: 0.5637
 epoch: 67, train_loss: 0.2533, test_loss: 3.0206, test_f1: 0.5321
 epoch: 68, train_loss: 0.2420, test_loss: 2.7788, test_f1: 0.5310
 epoch: 69, train_loss: 0.2550, test_loss: 2.9109, test_f1: 0.5297
 epoch: 70, train_loss: 0.2413, test_loss: 2.8638, test_f1: 0.5362
 epoch: 71, train_loss: 0.2441, test_loss: 3.0444, test_f1: 0.5278
 epoch: 72, train_loss: 0.2278, test_loss: 2.8105, test_f1: 0.5410
 epoch: 73, train_loss: 0.2301, test_loss: 2.7814, test_f1: 0.5112
 epoch: 74, train_loss: 0.2113, test_loss: 2.8815, test_f1: 0.5133
 epoch: 75, train_loss: 0.2234, test_loss: 3.1722, test_f1: 0.5115
 epoch: 76, train_loss: 0.2218, test_loss: 3.2641, test_f1: 0.5328
 epoch: 77, train_loss: 0.2138, test_loss: 3.1377, test_f1: 0.5216
 epoch: 78, train_loss: 0.2061, test_loss: 3.1467, test_f1: 0.5367
 epoch: 79, train_loss: 0.1882, test_loss: 3.0514, test_f1: 0.5193
 epoch: 80, train_loss: 0.2001, test_loss: 3.4833, test_f1: 0.5342
 epoch: 81, train_loss: 0.2270, test_loss: 3.2460, test_f1: 0.5256
 epoch: 82, train_loss: 0.2186, test_loss: 3.4474, test_f1: 0.5122
 epoch: 83, train_loss: 0.2086, test_loss: 3.0955, test_f1: 0.5316
 epoch: 84, train_loss: 0.1946, test_loss: 3.1859, test_f1: 0.5281
 epoch: 85, train_loss: 0.1975, test_loss: 3.2666, test_f1: 0.5167
 epoch: 86, train_loss: 0.1923, test_loss: 3.1563, test_f1: 0.5236
 epoch: 87, train_loss: 0.1757, test_loss: 3.2039, test_f1: 0.5190
 epoch: 88, train_loss: 0.1755, test_loss: 3.1428, test_f1: 0.5414
 epoch: 89, train_loss: 0.1892, test_loss: 3.2478, test_f1: 0.5262
 epoch: 90, train_loss: 0.1797, test_loss: 3.4139, test_f1: 0.5333
 epoch: 91, train_loss: 0.1784, test_loss: 3.1375, test_f1: 0.5368
 epoch: 92, train_loss: 0.1797, test_loss: 3.3756, test_f1: 0.5366
 epoch: 93, train_loss: 0.1708, test_loss: 3.2630, test_f1: 0.5408
 epoch: 94, train_loss: 0.1708, test_loss: 3.1979, test_f1: 0.5344
 epoch: 95, train_loss: 0.1817, test_loss: 3.3000, test_f1: 0.5391
 epoch: 96, train_loss: 0.1820, test_loss: 3.2461, test_f1: 0.5206
 epoch: 97, train_loss: 0.1667, test_loss: 3.4644, test_f1: 0.5385
 epoch: 98, train_loss: 0.1744, test_loss: 3.5837, test_f1: 0.5437
 epoch: 99, train_loss: 0.1536, test_loss: 3.5472, test_f1: 0.5258
##################ITERATION #1 ****************************************
 epoch: 0, train_loss: 1.2423, test_loss: 1.2361, test_f1: 0.2705
 epoch: 1, train_loss: 1.1315, test_loss: 1.1655, test_f1: 0.3952
 epoch: 2, train_loss: 1.0708, test_loss: 1.0699, test_f1: 0.4691
 epoch: 3, train_loss: 1.0283, test_loss: 1.0213, test_f1: 0.5040
 epoch: 4, train_loss: 0.9926, test_loss: 0.9974, test_f1: 0.4942
 epoch: 5, train_loss: 0.9577, test_loss: 1.0139, test_f1: 0.5043
 epoch: 6, train_loss: 0.9146, test_loss: 0.9980, test_f1: 0.4993
 epoch: 7, train_loss: 0.8701, test_loss: 0.9863, test_f1: 0.5324
 epoch: 8, train_loss: 0.8642, test_loss: 1.0575, test_f1: 0.5101
 epoch: 9, train_loss: 0.8437, test_loss: 1.0633, test_f1: 0.5203
 epoch: 10, train_loss: 0.8078, test_loss: 1.1340, test_f1: 0.5002
 epoch: 11, train_loss: 0.7799, test_loss: 1.2509, test_f1: 0.5208
 epoch: 12, train_loss: 0.7793, test_loss: 1.1131, test_f1: 0.5270
 epoch: 13, train_loss: 0.7854, test_loss: 1.1847, test_f1: 0.5121
 epoch: 14, train_loss: 0.7740, test_loss: 1.1574, test_f1: 0.5254
 epoch: 15, train_loss: 0.7226, test_loss: 1.2079, test_f1: 0.5392
 epoch: 16, train_loss: 0.7146, test_loss: 1.2883, test_f1: 0.5194
 epoch: 17, train_loss: 0.6954, test_loss: 1.1802, test_f1: 0.5077
 epoch: 18, train_loss: 0.6775, test_loss: 1.1851, test_f1: 0.5146
 epoch: 19, train_loss: 0.6699, test_loss: 1.2720, test_f1: 0.5215
 epoch: 20, train_loss: 0.6571, test_loss: 1.1849, test_f1: 0.5407
 epoch: 21, train_loss: 0.6137, test_loss: 1.3319, test_f1: 0.5336
 epoch: 22, train_loss: 0.6143, test_loss: 1.5079, test_f1: 0.5481
 epoch: 23, train_loss: 0.6142, test_loss: 1.2501, test_f1: 0.5303
 epoch: 24, train_loss: 0.5996, test_loss: 1.3828, test_f1: 0.5481
 epoch: 25, train_loss: 0.5723, test_loss: 1.5239, test_f1: 0.4860
 epoch: 26, train_loss: 0.5914, test_loss: 1.3100, test_f1: 0.5566
 epoch: 27, train_loss: 0.5670, test_loss: 1.4832, test_f1: 0.5222
 epoch: 28, train_loss: 0.5634, test_loss: 1.4915, test_f1: 0.5440
 epoch: 29, train_loss: 0.5358, test_loss: 1.4232, test_f1: 0.5329
 epoch: 30, train_loss: 0.5321, test_loss: 1.4395, test_f1: 0.5324
 epoch: 31, train_loss: 0.5032, test_loss: 1.4760, test_f1: 0.5395
 epoch: 32, train_loss: 0.4988, test_loss: 1.7069, test_f1: 0.5104
 epoch: 33, train_loss: 0.4728, test_loss: 1.4647, test_f1: 0.5436
 epoch: 34, train_loss: 0.4613, test_loss: 1.6903, test_f1: 0.5381
 epoch: 35, train_loss: 0.4827, test_loss: 1.6837, test_f1: 0.5399
 epoch: 36, train_loss: 0.4931, test_loss: 1.5324, test_f1: 0.5389
 epoch: 37, train_loss: 0.4783, test_loss: 1.4576, test_f1: 0.5548
 epoch: 38, train_loss: 0.4617, test_loss: 1.7969, test_f1: 0.5147
 epoch: 39, train_loss: 0.4353, test_loss: 1.5021, test_f1: 0.5444
 epoch: 40, train_loss: 0.4434, test_loss: 1.3791, test_f1: 0.5962
 epoch: 41, train_loss: 0.4465, test_loss: 1.6322, test_f1: 0.5401
 epoch: 42, train_loss: 0.4269, test_loss: 1.6076, test_f1: 0.5486
 epoch: 43, train_loss: 0.4038, test_loss: 1.9749, test_f1: 0.5275
 epoch: 44, train_loss: 0.4188, test_loss: 1.7135, test_f1: 0.5526
 epoch: 45, train_loss: 0.4168, test_loss: 1.6817, test_f1: 0.5197
 epoch: 46, train_loss: 0.4128, test_loss: 1.5952, test_f1: 0.5386
 epoch: 47, train_loss: 0.4157, test_loss: 1.6970, test_f1: 0.5541
 epoch: 48, train_loss: 0.3793, test_loss: 1.6401, test_f1: 0.5477
 epoch: 49, train_loss: 0.3502, test_loss: 1.6789, test_f1: 0.5432
 epoch: 50, train_loss: 0.3426, test_loss: 1.9848, test_f1: 0.5481
 epoch: 51, train_loss: 0.3320, test_loss: 2.0805, test_f1: 0.5363
 epoch: 52, train_loss: 0.3208, test_loss: 2.0163, test_f1: 0.5633
 epoch: 53, train_loss: 0.2882, test_loss: 2.0494, test_f1: 0.5343
 epoch: 54, train_loss: 0.2677, test_loss: 2.0564, test_f1: 0.5658
 epoch: 55, train_loss: 0.2703, test_loss: 2.0919, test_f1: 0.5481
 epoch: 56, train_loss: 0.2681, test_loss: 2.1656, test_f1: 0.5408
 epoch: 57, train_loss: 0.2616, test_loss: 2.3432, test_f1: 0.5580
 epoch: 58, train_loss: 0.2446, test_loss: 2.2308, test_f1: 0.5414
 epoch: 59, train_loss: 0.2322, test_loss: 2.3291, test_f1: 0.5506
 epoch: 60, train_loss: 0.2304, test_loss: 2.4339, test_f1: 0.5400
 epoch: 61, train_loss: 0.2212, test_loss: 2.2629, test_f1: 0.5444
 epoch: 62, train_loss: 0.2284, test_loss: 2.4156, test_f1: 0.5609
 epoch: 63, train_loss: 0.2347, test_loss: 2.3386, test_f1: 0.5577
 epoch: 64, train_loss: 0.2377, test_loss: 2.5681, test_f1: 0.5249
 epoch: 65, train_loss: 0.2434, test_loss: 2.3865, test_f1: 0.5500
 epoch: 66, train_loss: 0.2432, test_loss: 2.1878, test_f1: 0.5677
 epoch: 67, train_loss: 0.2212, test_loss: 2.4409, test_f1: 0.5517
 epoch: 68, train_loss: 0.2196, test_loss: 2.2806, test_f1: 0.5776
 epoch: 69, train_loss: 0.2191, test_loss: 2.4683, test_f1: 0.5387
 epoch: 70, train_loss: 0.2255, test_loss: 2.5009, test_f1: 0.5372
 epoch: 71, train_loss: 0.2324, test_loss: 2.5495, test_f1: 0.5514
 epoch: 72, train_loss: 0.2284, test_loss: 2.3718, test_f1: 0.5594
 epoch: 73, train_loss: 0.2258, test_loss: 2.3922, test_f1: 0.5615
 epoch: 74, train_loss: 0.2075, test_loss: 2.4803, test_f1: 0.5272
 epoch: 75, train_loss: 0.2169, test_loss: 2.7615, test_f1: 0.5333
 epoch: 76, train_loss: 0.2077, test_loss: 2.5081, test_f1: 0.5315
 epoch: 77, train_loss: 0.2095, test_loss: 2.5550, test_f1: 0.5524
 epoch: 78, train_loss: 0.1910, test_loss: 2.6453, test_f1: 0.5243
 epoch: 79, train_loss: 0.1704, test_loss: 2.6393, test_f1: 0.5331
 epoch: 80, train_loss: 0.1847, test_loss: 2.7132, test_f1: 0.5396
 epoch: 81, train_loss: 0.1873, test_loss: 2.9287, test_f1: 0.5348
 epoch: 82, train_loss: 0.1848, test_loss: 2.6270, test_f1: 0.5579
 epoch: 83, train_loss: 0.1784, test_loss: 2.7964, test_f1: 0.5411
 epoch: 84, train_loss: 0.1907, test_loss: 2.8855, test_f1: 0.5436
 epoch: 85, train_loss: 0.1783, test_loss: 2.6178, test_f1: 0.5569
 epoch: 86, train_loss: 0.1740, test_loss: 2.5492, test_f1: 0.5672
 epoch: 87, train_loss: 0.1685, test_loss: 2.6737, test_f1: 0.5591
 epoch: 88, train_loss: 0.1816, test_loss: 2.9627, test_f1: 0.5216
 epoch: 89, train_loss: 0.1686, test_loss: 2.9713, test_f1: 0.5297
 epoch: 90, train_loss: 0.1592, test_loss: 3.1249, test_f1: 0.5375
 epoch: 91, train_loss: 0.1547, test_loss: 3.0237, test_f1: 0.5608
 epoch: 92, train_loss: 0.1650, test_loss: 2.9412, test_f1: 0.5293
 epoch: 93, train_loss: 0.2042, test_loss: 3.0474, test_f1: 0.5167
 epoch: 94, train_loss: 0.2133, test_loss: 2.8616, test_f1: 0.5451
 epoch: 95, train_loss: 0.1824, test_loss: 2.6807, test_f1: 0.5706
 epoch: 96, train_loss: 0.1808, test_loss: 2.7642, test_f1: 0.5377
 epoch: 97, train_loss: 0.1875, test_loss: 3.0212, test_f1: 0.5421
 epoch: 98, train_loss: 0.1742, test_loss: 2.8912, test_f1: 0.5435
 epoch: 99, train_loss: 0.1665, test_loss: 2.8300, test_f1: 0.5648
##################ITERATION #2 ****************************************
 epoch: 0, train_loss: 1.2810, test_loss: 1.2500, test_f1: 0.3009
 epoch: 1, train_loss: 1.1530, test_loss: 1.1794, test_f1: 0.4362
 epoch: 2, train_loss: 1.1048, test_loss: 1.1173, test_f1: 0.4388
 epoch: 3, train_loss: 1.0534, test_loss: 1.0446, test_f1: 0.4819
 epoch: 4, train_loss: 1.0067, test_loss: 1.0050, test_f1: 0.4883
 epoch: 5, train_loss: 0.9873, test_loss: 1.0343, test_f1: 0.4544
 epoch: 6, train_loss: 0.9494, test_loss: 0.9785, test_f1: 0.5111
 epoch: 7, train_loss: 0.9255, test_loss: 1.0085, test_f1: 0.4730
 epoch: 8, train_loss: 0.9062, test_loss: 0.9702, test_f1: 0.5004
 epoch: 9, train_loss: 0.9028, test_loss: 0.9671, test_f1: 0.5048
 epoch: 10, train_loss: 0.8771, test_loss: 1.0483, test_f1: 0.4985
 epoch: 11, train_loss: 0.8487, test_loss: 0.9940, test_f1: 0.5103
 epoch: 12, train_loss: 0.8112, test_loss: 1.0496, test_f1: 0.4965
 epoch: 13, train_loss: 0.8202, test_loss: 1.0683, test_f1: 0.5020
 epoch: 14, train_loss: 0.8068, test_loss: 1.0905, test_f1: 0.4999
 epoch: 15, train_loss: 0.7978, test_loss: 1.2485, test_f1: 0.5483
 epoch: 16, train_loss: 0.8045, test_loss: 1.0496, test_f1: 0.5207
 epoch: 17, train_loss: 0.7912, test_loss: 1.0190, test_f1: 0.5302
 epoch: 18, train_loss: 0.7527, test_loss: 1.1739, test_f1: 0.5030
 epoch: 19, train_loss: 0.7337, test_loss: 1.3361, test_f1: 0.5212
 epoch: 20, train_loss: 0.7428, test_loss: 1.2154, test_f1: 0.5061
 epoch: 21, train_loss: 0.7211, test_loss: 1.4486, test_f1: 0.5074
 epoch: 22, train_loss: 0.7132, test_loss: 1.2583, test_f1: 0.5302
 epoch: 23, train_loss: 0.6896, test_loss: 1.2078, test_f1: 0.5392
 epoch: 24, train_loss: 0.6881, test_loss: 1.2812, test_f1: 0.5222
 epoch: 25, train_loss: 0.6654, test_loss: 1.4759, test_f1: 0.5057
 epoch: 26, train_loss: 0.6807, test_loss: 1.4472, test_f1: 0.5200
 epoch: 27, train_loss: 0.6548, test_loss: 1.4715, test_f1: 0.5119
 epoch: 28, train_loss: 0.6544, test_loss: 1.3013, test_f1: 0.5254
 epoch: 29, train_loss: 0.6307, test_loss: 1.3592, test_f1: 0.5298
 epoch: 30, train_loss: 0.6175, test_loss: 1.3844, test_f1: 0.5401
 epoch: 31, train_loss: 0.6111, test_loss: 1.4356, test_f1: 0.5343
 epoch: 32, train_loss: 0.6090, test_loss: 1.4467, test_f1: 0.5155
 epoch: 33, train_loss: 0.5981, test_loss: 1.4853, test_f1: 0.5114
 epoch: 34, train_loss: 0.5840, test_loss: 1.5026, test_f1: 0.5171
 epoch: 35, train_loss: 0.5674, test_loss: 1.4222, test_f1: 0.5305
 epoch: 36, train_loss: 0.5663, test_loss: 1.3887, test_f1: 0.5247
 epoch: 37, train_loss: 0.5868, test_loss: 1.6024, test_f1: 0.5092
 epoch: 38, train_loss: 0.5643, test_loss: 1.5586, test_f1: 0.5181
 epoch: 39, train_loss: 0.5573, test_loss: 1.4707, test_f1: 0.5379
 epoch: 40, train_loss: 0.5338, test_loss: 1.5129, test_f1: 0.5573
 epoch: 41, train_loss: 0.5338, test_loss: 1.5974, test_f1: 0.5330
 epoch: 42, train_loss: 0.5257, test_loss: 1.7486, test_f1: 0.5283
 epoch: 43, train_loss: 0.5187, test_loss: 1.6145, test_f1: 0.5404
 epoch: 44, train_loss: 0.5313, test_loss: 1.5537, test_f1: 0.5150
 epoch: 45, train_loss: 0.5091, test_loss: 1.5558, test_f1: 0.5615
 epoch: 46, train_loss: 0.5101, test_loss: 1.7587, test_f1: 0.5290
 epoch: 47, train_loss: 0.5130, test_loss: 1.5893, test_f1: 0.5214
 epoch: 48, train_loss: 0.4821, test_loss: 1.4888, test_f1: 0.5377
 epoch: 49, train_loss: 0.4485, test_loss: 1.8804, test_f1: 0.5331
 epoch: 50, train_loss: 0.4575, test_loss: 2.0191, test_f1: 0.5015
 epoch: 51, train_loss: 0.4280, test_loss: 1.6808, test_f1: 0.5491
 epoch: 52, train_loss: 0.4011, test_loss: 1.8647, test_f1: 0.5294
 epoch: 53, train_loss: 0.3864, test_loss: 1.6948, test_f1: 0.5610
 epoch: 54, train_loss: 0.3667, test_loss: 1.8051, test_f1: 0.5369
 epoch: 55, train_loss: 0.3755, test_loss: 1.8826, test_f1: 0.5655
 epoch: 56, train_loss: 0.3711, test_loss: 1.9250, test_f1: 0.5507
 epoch: 57, train_loss: 0.3704, test_loss: 1.8109, test_f1: 0.5617
 epoch: 58, train_loss: 0.3480, test_loss: 1.8624, test_f1: 0.5516
 epoch: 59, train_loss: 0.3443, test_loss: 1.9774, test_f1: 0.5503
 epoch: 60, train_loss: 0.3494, test_loss: 1.9627, test_f1: 0.5517
 epoch: 61, train_loss: 0.3364, test_loss: 2.0247, test_f1: 0.5651
 epoch: 62, train_loss: 0.3188, test_loss: 1.9603, test_f1: 0.5837
 epoch: 63, train_loss: 0.3231, test_loss: 2.1500, test_f1: 0.5273
 epoch: 64, train_loss: 0.3253, test_loss: 1.9555, test_f1: 0.5581
 epoch: 65, train_loss: 0.3033, test_loss: 2.1574, test_f1: 0.5537
 epoch: 66, train_loss: 0.2965, test_loss: 2.0677, test_f1: 0.5709
 epoch: 67, train_loss: 0.2988, test_loss: 2.1830, test_f1: 0.5551
 epoch: 68, train_loss: 0.3086, test_loss: 2.2621, test_f1: 0.5552
 epoch: 69, train_loss: 0.3163, test_loss: 2.3605, test_f1: 0.5616
 epoch: 70, train_loss: 0.3021, test_loss: 2.1078, test_f1: 0.5496
 epoch: 71, train_loss: 0.2924, test_loss: 2.1236, test_f1: 0.5532
 epoch: 72, train_loss: 0.2943, test_loss: 2.3264, test_f1: 0.5333
 epoch: 73, train_loss: 0.2978, test_loss: 2.1204, test_f1: 0.5606
 epoch: 74, train_loss: 0.2779, test_loss: 2.2159, test_f1: 0.5449
 epoch: 75, train_loss: 0.2832, test_loss: 2.2397, test_f1: 0.5441
 epoch: 76, train_loss: 0.2782, test_loss: 2.2642, test_f1: 0.5599
 epoch: 77, train_loss: 0.2826, test_loss: 2.1575, test_f1: 0.5552
 epoch: 78, train_loss: 0.2971, test_loss: 2.2503, test_f1: 0.5576
 epoch: 79, train_loss: 0.2651, test_loss: 2.4380, test_f1: 0.5493
 epoch: 80, train_loss: 0.2649, test_loss: 2.4156, test_f1: 0.5759
 epoch: 81, train_loss: 0.2798, test_loss: 2.5043, test_f1: 0.5467
 epoch: 82, train_loss: 0.2731, test_loss: 2.4695, test_f1: 0.5456
 epoch: 83, train_loss: 0.2770, test_loss: 2.4198, test_f1: 0.5832
 epoch: 84, train_loss: 0.2569, test_loss: 2.4818, test_f1: 0.5701
 epoch: 85, train_loss: 0.2654, test_loss: 2.5996, test_f1: 0.5420
 epoch: 86, train_loss: 0.2682, test_loss: 2.3727, test_f1: 0.5537
 epoch: 87, train_loss: 0.2595, test_loss: 2.3009, test_f1: 0.5540
 epoch: 88, train_loss: 0.2465, test_loss: 2.4165, test_f1: 0.5536
 epoch: 89, train_loss: 0.2421, test_loss: 2.5295, test_f1: 0.5555
 epoch: 90, train_loss: 0.2498, test_loss: 2.4794, test_f1: 0.5404
 epoch: 91, train_loss: 0.2329, test_loss: 2.6974, test_f1: 0.5550
 epoch: 92, train_loss: 0.2303, test_loss: 2.5139, test_f1: 0.5578
 epoch: 93, train_loss: 0.2412, test_loss: 2.6150, test_f1: 0.5492
 epoch: 94, train_loss: 0.2408, test_loss: 2.6225, test_f1: 0.5599
 epoch: 95, train_loss: 0.2265, test_loss: 2.4484, test_f1: 0.5608
 epoch: 96, train_loss: 0.2304, test_loss: 2.6159, test_f1: 0.5450
 epoch: 97, train_loss: 0.2358, test_loss: 2.7521, test_f1: 0.5445
 epoch: 98, train_loss: 0.2219, test_loss: 2.9338, test_f1: 0.5351
 epoch: 99, train_loss: 0.2376, test_loss: 2.6131, test_f1: 0.5568
##################ITERATION #3 ****************************************
 epoch: 0, train_loss: 1.3052, test_loss: 1.2437, test_f1: 0.3382
 epoch: 1, train_loss: 1.1176, test_loss: 1.1916, test_f1: 0.3874
 epoch: 2, train_loss: 1.0894, test_loss: 1.1369, test_f1: 0.4095
 epoch: 3, train_loss: 1.0344, test_loss: 1.0578, test_f1: 0.4494
 epoch: 4, train_loss: 0.9981, test_loss: 1.0427, test_f1: 0.4458
 epoch: 5, train_loss: 0.9604, test_loss: 0.9853, test_f1: 0.5150
 epoch: 6, train_loss: 0.9271, test_loss: 0.9771, test_f1: 0.5173
 epoch: 7, train_loss: 0.9043, test_loss: 1.0318, test_f1: 0.4937
 epoch: 8, train_loss: 0.9034, test_loss: 1.0418, test_f1: 0.4889
 epoch: 9, train_loss: 0.8784, test_loss: 0.9943, test_f1: 0.5189
 epoch: 10, train_loss: 0.8441, test_loss: 1.0223, test_f1: 0.5138
 epoch: 11, train_loss: 0.7958, test_loss: 1.0634, test_f1: 0.5191
 epoch: 12, train_loss: 0.7835, test_loss: 1.0494, test_f1: 0.5086
 epoch: 13, train_loss: 0.7652, test_loss: 1.1809, test_f1: 0.4994
 epoch: 14, train_loss: 0.7640, test_loss: 1.1675, test_f1: 0.5180
 epoch: 15, train_loss: 0.7269, test_loss: 1.2359, test_f1: 0.5028
 epoch: 16, train_loss: 0.7052, test_loss: 1.1340, test_f1: 0.5298
 epoch: 17, train_loss: 0.6874, test_loss: 1.1945, test_f1: 0.5166
 epoch: 18, train_loss: 0.6861, test_loss: 1.2301, test_f1: 0.5182
 epoch: 19, train_loss: 0.6916, test_loss: 1.3105, test_f1: 0.5066
 epoch: 20, train_loss: 0.6893, test_loss: 1.2071, test_f1: 0.5393
 epoch: 21, train_loss: 0.6582, test_loss: 1.3038, test_f1: 0.5165
 epoch: 22, train_loss: 0.6525, test_loss: 1.2653, test_f1: 0.5477
 epoch: 23, train_loss: 0.6387, test_loss: 1.2557, test_f1: 0.5623
 epoch: 24, train_loss: 0.6183, test_loss: 1.3910, test_f1: 0.5313
 epoch: 25, train_loss: 0.6189, test_loss: 1.5886, test_f1: 0.4966
 epoch: 26, train_loss: 0.6109, test_loss: 1.3201, test_f1: 0.5573
 epoch: 27, train_loss: 0.5604, test_loss: 1.4730, test_f1: 0.5506
 epoch: 28, train_loss: 0.5851, test_loss: 1.5770, test_f1: 0.5297
 epoch: 29, train_loss: 0.5730, test_loss: 1.3354, test_f1: 0.5315
 epoch: 30, train_loss: 0.5729, test_loss: 1.4739, test_f1: 0.5254
 epoch: 31, train_loss: 0.5357, test_loss: 1.4688, test_f1: 0.5294
 epoch: 32, train_loss: 0.5220, test_loss: 1.4237, test_f1: 0.5358
 epoch: 33, train_loss: 0.5028, test_loss: 1.5781, test_f1: 0.5253
 epoch: 34, train_loss: 0.4917, test_loss: 1.6028, test_f1: 0.5355
 epoch: 35, train_loss: 0.4928, test_loss: 1.6661, test_f1: 0.5619
 epoch: 36, train_loss: 0.4920, test_loss: 1.5882, test_f1: 0.5480
 epoch: 37, train_loss: 0.4671, test_loss: 1.5078, test_f1: 0.5567
 epoch: 38, train_loss: 0.4731, test_loss: 1.5688, test_f1: 0.5322
 epoch: 39, train_loss: 0.4668, test_loss: 1.6970, test_f1: 0.5445
 epoch: 40, train_loss: 0.4661, test_loss: 1.7438, test_f1: 0.5137
 epoch: 41, train_loss: 0.4588, test_loss: 1.6586, test_f1: 0.5286
 epoch: 42, train_loss: 0.4635, test_loss: 1.5258, test_f1: 0.5310
 epoch: 43, train_loss: 0.4501, test_loss: 1.5850, test_f1: 0.5680
 epoch: 44, train_loss: 0.4267, test_loss: 1.6622, test_f1: 0.5509
 epoch: 45, train_loss: 0.4227, test_loss: 1.8824, test_f1: 0.4938
 epoch: 46, train_loss: 0.4080, test_loss: 1.9371, test_f1: 0.5166
 epoch: 47, train_loss: 0.4064, test_loss: 1.8274, test_f1: 0.5362
 epoch: 48, train_loss: 0.4032, test_loss: 1.8802, test_f1: 0.5214
 epoch: 49, train_loss: 0.4011, test_loss: 1.8953, test_f1: 0.5457
 epoch: 50, train_loss: 0.4239, test_loss: 1.8829, test_f1: 0.5220
 epoch: 51, train_loss: 0.3940, test_loss: 1.7916, test_f1: 0.5565
 epoch: 52, train_loss: 0.3291, test_loss: 1.9281, test_f1: 0.5485
 epoch: 53, train_loss: 0.2964, test_loss: 1.9345, test_f1: 0.5566
 epoch: 54, train_loss: 0.2972, test_loss: 2.0820, test_f1: 0.5521
 epoch: 55, train_loss: 0.2868, test_loss: 2.1599, test_f1: 0.5383
 epoch: 56, train_loss: 0.2770, test_loss: 2.3198, test_f1: 0.5173
 epoch: 57, train_loss: 0.2958, test_loss: 2.2379, test_f1: 0.5283
 epoch: 58, train_loss: 0.2706, test_loss: 2.2408, test_f1: 0.5217
 epoch: 59, train_loss: 0.2739, test_loss: 2.3308, test_f1: 0.5062
 epoch: 60, train_loss: 0.2565, test_loss: 2.3349, test_f1: 0.5319
 epoch: 61, train_loss: 0.2698, test_loss: 2.2774, test_f1: 0.5347
 epoch: 62, train_loss: 0.2658, test_loss: 2.2396, test_f1: 0.5387
 epoch: 63, train_loss: 0.2462, test_loss: 2.4360, test_f1: 0.5340
 epoch: 64, train_loss: 0.2411, test_loss: 2.1751, test_f1: 0.5420
 epoch: 65, train_loss: 0.2246, test_loss: 2.7201, test_f1: 0.5302
 epoch: 66, train_loss: 0.2387, test_loss: 2.4218, test_f1: 0.5409
 epoch: 67, train_loss: 0.2317, test_loss: 2.5531, test_f1: 0.5365
 epoch: 68, train_loss: 0.2448, test_loss: 2.5255, test_f1: 0.5388
 epoch: 69, train_loss: 0.2497, test_loss: 2.7385, test_f1: 0.5378
 epoch: 70, train_loss: 0.2209, test_loss: 2.7305, test_f1: 0.5322
 epoch: 71, train_loss: 0.2286, test_loss: 2.5171, test_f1: 0.5264
 epoch: 72, train_loss: 0.2217, test_loss: 2.5162, test_f1: 0.5454
 epoch: 73, train_loss: 0.2256, test_loss: 2.7159, test_f1: 0.5615
 epoch: 74, train_loss: 0.2312, test_loss: 2.7037, test_f1: 0.5578
 epoch: 75, train_loss: 0.2060, test_loss: 2.6843, test_f1: 0.5371
 epoch: 76, train_loss: 0.2056, test_loss: 2.7019, test_f1: 0.5534
 epoch: 77, train_loss: 0.2097, test_loss: 2.7280, test_f1: 0.5381
 epoch: 78, train_loss: 0.2121, test_loss: 2.7597, test_f1: 0.5519
 epoch: 79, train_loss: 0.2112, test_loss: 2.8015, test_f1: 0.5485
 epoch: 80, train_loss: 0.2108, test_loss: 2.5777, test_f1: 0.5454
 epoch: 81, train_loss: 0.2241, test_loss: 2.7600, test_f1: 0.5394
 epoch: 82, train_loss: 0.1978, test_loss: 2.8885, test_f1: 0.5454
 epoch: 83, train_loss: 0.1976, test_loss: 2.9181, test_f1: 0.5380
 epoch: 84, train_loss: 0.1867, test_loss: 2.8852, test_f1: 0.5549
 epoch: 85, train_loss: 0.1897, test_loss: 2.9188, test_f1: 0.5278
 epoch: 86, train_loss: 0.1847, test_loss: 2.8683, test_f1: 0.5410
 epoch: 87, train_loss: 0.1986, test_loss: 3.0830, test_f1: 0.5606
 epoch: 88, train_loss: 0.1800, test_loss: 3.2121, test_f1: 0.5401
 epoch: 89, train_loss: 0.1874, test_loss: 3.0130, test_f1: 0.5524
 epoch: 90, train_loss: 0.1895, test_loss: 3.1078, test_f1: 0.5422
 epoch: 91, train_loss: 0.1896, test_loss: 3.0199, test_f1: 0.5300
 epoch: 92, train_loss: 0.1822, test_loss: 2.9629, test_f1: 0.5535
 epoch: 93, train_loss: 0.1645, test_loss: 3.0639, test_f1: 0.5469
 epoch: 94, train_loss: 0.1612, test_loss: 2.9201, test_f1: 0.5312
 epoch: 95, train_loss: 0.1577, test_loss: 3.0525, test_f1: 0.5511
 epoch: 96, train_loss: 0.1574, test_loss: 3.1904, test_f1: 0.5468
 epoch: 97, train_loss: 0.1707, test_loss: 3.5511, test_f1: 0.5320
 epoch: 98, train_loss: 0.2064, test_loss: 3.2034, test_f1: 0.5326
 epoch: 99, train_loss: 0.1904, test_loss: 3.2631, test_f1: 0.5550
##################ITERATION #4 ****************************************
 epoch: 0, train_loss: 1.3442, test_loss: 1.2977, test_f1: 0.3515
 epoch: 1, train_loss: 1.2020, test_loss: 1.1812, test_f1: 0.4856
 epoch: 2, train_loss: 1.1138, test_loss: 1.0847, test_f1: 0.4881
 epoch: 3, train_loss: 1.0579, test_loss: 1.0313, test_f1: 0.4930
 epoch: 4, train_loss: 1.0275, test_loss: 1.0004, test_f1: 0.5138
 epoch: 5, train_loss: 1.0019, test_loss: 1.0074, test_f1: 0.4943
 epoch: 6, train_loss: 0.9733, test_loss: 0.9929, test_f1: 0.5130
 epoch: 7, train_loss: 0.9282, test_loss: 1.0079, test_f1: 0.5122
 epoch: 8, train_loss: 0.9135, test_loss: 0.9729, test_f1: 0.5331
 epoch: 9, train_loss: 0.8768, test_loss: 1.0375, test_f1: 0.5183
 epoch: 10, train_loss: 0.8770, test_loss: 0.9728, test_f1: 0.5437
 epoch: 11, train_loss: 0.8548, test_loss: 1.1517, test_f1: 0.5032
 epoch: 12, train_loss: 0.8499, test_loss: 1.1512, test_f1: 0.4898
 epoch: 13, train_loss: 0.8096, test_loss: 1.1377, test_f1: 0.5454
 epoch: 14, train_loss: 0.8027, test_loss: 1.0896, test_f1: 0.5368
 epoch: 15, train_loss: 0.7795, test_loss: 1.1150, test_f1: 0.5544
 epoch: 16, train_loss: 0.7497, test_loss: 1.2839, test_f1: 0.5038
 epoch: 17, train_loss: 0.7552, test_loss: 1.2909, test_f1: 0.5101
 epoch: 18, train_loss: 0.7621, test_loss: 1.0443, test_f1: 0.5455
 epoch: 19, train_loss: 0.7328, test_loss: 1.1559, test_f1: 0.5184
 epoch: 20, train_loss: 0.7176, test_loss: 1.2169, test_f1: 0.5133
 epoch: 21, train_loss: 0.7169, test_loss: 1.1659, test_f1: 0.5408
 epoch: 22, train_loss: 0.6911, test_loss: 1.0943, test_f1: 0.5635
 epoch: 23, train_loss: 0.6698, test_loss: 1.2487, test_f1: 0.5110
 epoch: 24, train_loss: 0.6611, test_loss: 1.1783, test_f1: 0.5592
 epoch: 25, train_loss: 0.6358, test_loss: 1.4742, test_f1: 0.4965
 epoch: 26, train_loss: 0.6243, test_loss: 1.2462, test_f1: 0.5719
 epoch: 27, train_loss: 0.6311, test_loss: 1.4196, test_f1: 0.5273
 epoch: 28, train_loss: 0.6136, test_loss: 1.2039, test_f1: 0.5705
 epoch: 29, train_loss: 0.5946, test_loss: 1.3665, test_f1: 0.5485
 epoch: 30, train_loss: 0.6042, test_loss: 1.4107, test_f1: 0.5234
 epoch: 31, train_loss: 0.5892, test_loss: 1.3607, test_f1: 0.5277
 epoch: 32, train_loss: 0.5954, test_loss: 1.4702, test_f1: 0.5356
 epoch: 33, train_loss: 0.5788, test_loss: 1.2585, test_f1: 0.5645
 epoch: 34, train_loss: 0.5891, test_loss: 1.4962, test_f1: 0.5289
 epoch: 35, train_loss: 0.5870, test_loss: 1.2903, test_f1: 0.5720
 epoch: 36, train_loss: 0.5518, test_loss: 1.4767, test_f1: 0.5615
 epoch: 37, train_loss: 0.5131, test_loss: 1.5543, test_f1: 0.5140
 epoch: 38, train_loss: 0.5148, test_loss: 1.5994, test_f1: 0.5206
 epoch: 39, train_loss: 0.5119, test_loss: 1.7076, test_f1: 0.5408
 epoch: 40, train_loss: 0.5040, test_loss: 1.3901, test_f1: 0.5796
 epoch: 41, train_loss: 0.5141, test_loss: 1.5346, test_f1: 0.5140
 epoch: 42, train_loss: 0.5287, test_loss: 1.7892, test_f1: 0.5337
 epoch: 43, train_loss: 0.5045, test_loss: 1.4517, test_f1: 0.5463
 epoch: 44, train_loss: 0.4884, test_loss: 1.4904, test_f1: 0.5520
 epoch: 45, train_loss: 0.4655, test_loss: 1.4720, test_f1: 0.5815
 epoch: 46, train_loss: 0.4694, test_loss: 1.5674, test_f1: 0.5552
 epoch: 47, train_loss: 0.4597, test_loss: 1.7341, test_f1: 0.5370
 epoch: 48, train_loss: 0.4681, test_loss: 1.5976, test_f1: 0.5457
 epoch: 49, train_loss: 0.4476, test_loss: 1.8227, test_f1: 0.5311
 epoch: 50, train_loss: 0.4327, test_loss: 1.6310, test_f1: 0.5581
 epoch: 51, train_loss: 0.3850, test_loss: 1.6799, test_f1: 0.5503
 epoch: 52, train_loss: 0.3575, test_loss: 1.7722, test_f1: 0.5572
 epoch: 53, train_loss: 0.3385, test_loss: 1.9181, test_f1: 0.5323
 epoch: 54, train_loss: 0.3339, test_loss: 1.7324, test_f1: 0.5583
 epoch: 55, train_loss: 0.3259, test_loss: 1.8549, test_f1: 0.5581
 epoch: 56, train_loss: 0.3297, test_loss: 1.8697, test_f1: 0.5340
 epoch: 57, train_loss: 0.3190, test_loss: 1.9888, test_f1: 0.5492
 epoch: 58, train_loss: 0.3045, test_loss: 2.0268, test_f1: 0.5431
 epoch: 59, train_loss: 0.3089, test_loss: 2.0464, test_f1: 0.5709
 epoch: 60, train_loss: 0.3279, test_loss: 2.1587, test_f1: 0.5339
 epoch: 61, train_loss: 0.3035, test_loss: 1.9776, test_f1: 0.5348
 epoch: 62, train_loss: 0.3024, test_loss: 2.0965, test_f1: 0.5281
 epoch: 63, train_loss: 0.3127, test_loss: 2.0391, test_f1: 0.5432
 epoch: 64, train_loss: 0.3260, test_loss: 2.0200, test_f1: 0.5242
 epoch: 65, train_loss: 0.3026, test_loss: 2.2236, test_f1: 0.5489
 epoch: 66, train_loss: 0.2976, test_loss: 2.0468, test_f1: 0.5375
 epoch: 67, train_loss: 0.2728, test_loss: 2.2054, test_f1: 0.5661
 epoch: 68, train_loss: 0.2793, test_loss: 2.1356, test_f1: 0.5521
 epoch: 69, train_loss: 0.2922, test_loss: 2.2526, test_f1: 0.5613
 epoch: 70, train_loss: 0.2779, test_loss: 2.2874, test_f1: 0.5441
 epoch: 71, train_loss: 0.2837, test_loss: 2.1796, test_f1: 0.5627
 epoch: 72, train_loss: 0.2575, test_loss: 2.0672, test_f1: 0.5318
 epoch: 73, train_loss: 0.2560, test_loss: 2.0557, test_f1: 0.5622
 epoch: 74, train_loss: 0.2590, test_loss: 2.3043, test_f1: 0.5506
 epoch: 75, train_loss: 0.2506, test_loss: 2.4115, test_f1: 0.5367
 epoch: 76, train_loss: 0.2678, test_loss: 2.2284, test_f1: 0.5512
 epoch: 77, train_loss: 0.2897, test_loss: 2.2801, test_f1: 0.5556
 epoch: 78, train_loss: 0.2734, test_loss: 2.2379, test_f1: 0.5261
 epoch: 79, train_loss: 0.2566, test_loss: 2.4033, test_f1: 0.5143
 epoch: 80, train_loss: 0.2545, test_loss: 2.2399, test_f1: 0.5431
 epoch: 81, train_loss: 0.2355, test_loss: 2.4796, test_f1: 0.5216
 epoch: 82, train_loss: 0.2436, test_loss: 2.2560, test_f1: 0.5554
 epoch: 83, train_loss: 0.2459, test_loss: 2.4526, test_f1: 0.5527
 epoch: 84, train_loss: 0.2409, test_loss: 2.4561, test_f1: 0.5373
 epoch: 85, train_loss: 0.2356, test_loss: 2.4797, test_f1: 0.5544
 epoch: 86, train_loss: 0.2268, test_loss: 2.2659, test_f1: 0.5532
 epoch: 87, train_loss: 0.2235, test_loss: 2.5258, test_f1: 0.5232
 epoch: 88, train_loss: 0.2089, test_loss: 2.4249, test_f1: 0.5575
 epoch: 89, train_loss: 0.2123, test_loss: 2.6009, test_f1: 0.5455
 epoch: 90, train_loss: 0.2211, test_loss: 2.5651, test_f1: 0.5276
 epoch: 91, train_loss: 0.2211, test_loss: 2.4051, test_f1: 0.5272
 epoch: 92, train_loss: 0.2026, test_loss: 2.3115, test_f1: 0.5563
 epoch: 93, train_loss: 0.2098, test_loss: 2.5812, test_f1: 0.5331
 epoch: 94, train_loss: 0.2184, test_loss: 2.6316, test_f1: 0.5464
 epoch: 95, train_loss: 0.2258, test_loss: 2.6962, test_f1: 0.5384
 epoch: 96, train_loss: 0.2307, test_loss: 2.5144, test_f1: 0.5379
 epoch: 97, train_loss: 0.2016, test_loss: 2.5505, test_f1: 0.5745
 epoch: 98, train_loss: 0.2114, test_loss: 2.6728, test_f1: 0.5530
 epoch: 99, train_loss: 0.2161, test_loss: 2.6125, test_f1: 0.5552
##################ITERATION #5 ****************************************
 epoch: 0, train_loss: 1.4495, test_loss: 1.3173, test_f1: 0.3916
 epoch: 1, train_loss: 1.2432, test_loss: 1.2162, test_f1: 0.4550
 epoch: 2, train_loss: 1.1814, test_loss: 1.1369, test_f1: 0.4437
 epoch: 3, train_loss: 1.1032, test_loss: 1.0918, test_f1: 0.4431
 epoch: 4, train_loss: 1.0758, test_loss: 1.0308, test_f1: 0.4968
 epoch: 5, train_loss: 1.0341, test_loss: 1.0471, test_f1: 0.4795
 epoch: 6, train_loss: 1.0090, test_loss: 1.0272, test_f1: 0.4652
 epoch: 7, train_loss: 0.9773, test_loss: 1.0225, test_f1: 0.4845
 epoch: 8, train_loss: 0.9403, test_loss: 0.9802, test_f1: 0.5151
 epoch: 9, train_loss: 0.9229, test_loss: 0.9888, test_f1: 0.4941
 epoch: 10, train_loss: 0.8894, test_loss: 1.0910, test_f1: 0.4828
 epoch: 11, train_loss: 0.8846, test_loss: 1.1416, test_f1: 0.4854
 epoch: 12, train_loss: 0.8511, test_loss: 1.0167, test_f1: 0.5139
 epoch: 13, train_loss: 0.8487, test_loss: 1.0858, test_f1: 0.4725
 epoch: 14, train_loss: 0.8397, test_loss: 1.0011, test_f1: 0.5249
 epoch: 15, train_loss: 0.8066, test_loss: 1.0357, test_f1: 0.5431
 epoch: 16, train_loss: 0.7823, test_loss: 1.0283, test_f1: 0.5241
 epoch: 17, train_loss: 0.7740, test_loss: 1.2747, test_f1: 0.4808
 epoch: 18, train_loss: 0.7785, test_loss: 1.1006, test_f1: 0.5166
 epoch: 19, train_loss: 0.7600, test_loss: 1.1242, test_f1: 0.5267
 epoch: 20, train_loss: 0.7287, test_loss: 1.1241, test_f1: 0.5102
 epoch: 21, train_loss: 0.7228, test_loss: 1.0724, test_f1: 0.5163
 epoch: 22, train_loss: 0.6948, test_loss: 1.2716, test_f1: 0.4845
 epoch: 23, train_loss: 0.6859, test_loss: 1.1192, test_f1: 0.4961
 epoch: 24, train_loss: 0.6777, test_loss: 1.3847, test_f1: 0.4565
 epoch: 25, train_loss: 0.6858, test_loss: 1.2418, test_f1: 0.5158
 epoch: 26, train_loss: 0.6807, test_loss: 1.2512, test_f1: 0.5087
 epoch: 27, train_loss: 0.6663, test_loss: 1.3019, test_f1: 0.5153
 epoch: 28, train_loss: 0.6549, test_loss: 1.2477, test_f1: 0.5185
 epoch: 29, train_loss: 0.6455, test_loss: 1.2588, test_f1: 0.5104
 epoch: 30, train_loss: 0.6229, test_loss: 1.4361, test_f1: 0.4870
 epoch: 31, train_loss: 0.6005, test_loss: 1.4562, test_f1: 0.4932
 epoch: 32, train_loss: 0.6078, test_loss: 1.3315, test_f1: 0.5248
 epoch: 33, train_loss: 0.5854, test_loss: 1.4230, test_f1: 0.5225
 epoch: 34, train_loss: 0.5698, test_loss: 1.3250, test_f1: 0.5196
 epoch: 35, train_loss: 0.5708, test_loss: 1.4290, test_f1: 0.5653
 epoch: 36, train_loss: 0.5540, test_loss: 1.4482, test_f1: 0.5257
 epoch: 37, train_loss: 0.5442, test_loss: 1.3749, test_f1: 0.5452
 epoch: 38, train_loss: 0.5420, test_loss: 1.6278, test_f1: 0.5297
 epoch: 39, train_loss: 0.5399, test_loss: 1.6350, test_f1: 0.5042
 epoch: 40, train_loss: 0.5100, test_loss: 1.5855, test_f1: 0.5047
 epoch: 41, train_loss: 0.5094, test_loss: 1.8103, test_f1: 0.5037
 epoch: 42, train_loss: 0.5071, test_loss: 1.6872, test_f1: 0.4880
 epoch: 43, train_loss: 0.4815, test_loss: 1.5183, test_f1: 0.5397
 epoch: 44, train_loss: 0.5101, test_loss: 1.6932, test_f1: 0.5254
 epoch: 45, train_loss: 0.5024, test_loss: 1.6993, test_f1: 0.5412
 epoch: 46, train_loss: 0.4938, test_loss: 1.6671, test_f1: 0.5221
 epoch: 47, train_loss: 0.4748, test_loss: 1.5098, test_f1: 0.5425
 epoch: 48, train_loss: 0.4435, test_loss: 1.7237, test_f1: 0.5377
 epoch: 49, train_loss: 0.4655, test_loss: 1.8268, test_f1: 0.5324
 epoch: 50, train_loss: 0.4679, test_loss: 1.6017, test_f1: 0.5351
 epoch: 51, train_loss: 0.4082, test_loss: 1.7936, test_f1: 0.5395
 epoch: 52, train_loss: 0.3764, test_loss: 1.8194, test_f1: 0.5283
 epoch: 53, train_loss: 0.3667, test_loss: 1.8626, test_f1: 0.5350
 epoch: 54, train_loss: 0.3544, test_loss: 2.0330, test_f1: 0.5394
 epoch: 55, train_loss: 0.3549, test_loss: 2.0392, test_f1: 0.5413
 epoch: 56, train_loss: 0.3309, test_loss: 2.0829, test_f1: 0.5351
 epoch: 57, train_loss: 0.3219, test_loss: 2.1126, test_f1: 0.5216
 epoch: 58, train_loss: 0.3322, test_loss: 2.1789, test_f1: 0.5122
 epoch: 59, train_loss: 0.3267, test_loss: 1.9730, test_f1: 0.5516
 epoch: 60, train_loss: 0.3178, test_loss: 2.2845, test_f1: 0.5117
 epoch: 61, train_loss: 0.3233, test_loss: 2.2173, test_f1: 0.5344
 epoch: 62, train_loss: 0.3136, test_loss: 2.0024, test_f1: 0.5444
 epoch: 63, train_loss: 0.3123, test_loss: 2.1961, test_f1: 0.5245
 epoch: 64, train_loss: 0.3054, test_loss: 2.2876, test_f1: 0.5377
 epoch: 65, train_loss: 0.3102, test_loss: 2.3220, test_f1: 0.5180
 epoch: 66, train_loss: 0.2996, test_loss: 2.5712, test_f1: 0.5153
 epoch: 67, train_loss: 0.2636, test_loss: 2.2872, test_f1: 0.5253
 epoch: 68, train_loss: 0.2964, test_loss: 2.4092, test_f1: 0.5152
 epoch: 69, train_loss: 0.2795, test_loss: 2.4928, test_f1: 0.5255
 epoch: 70, train_loss: 0.2851, test_loss: 2.3747, test_f1: 0.5357
 epoch: 71, train_loss: 0.2821, test_loss: 2.2680, test_f1: 0.5419
 epoch: 72, train_loss: 0.2871, test_loss: 2.5036, test_f1: 0.5181
 epoch: 73, train_loss: 0.2872, test_loss: 2.3265, test_f1: 0.5273
 epoch: 74, train_loss: 0.2701, test_loss: 2.4370, test_f1: 0.5323
 epoch: 75, train_loss: 0.2709, test_loss: 2.4608, test_f1: 0.5284
 epoch: 76, train_loss: 0.2685, test_loss: 2.4583, test_f1: 0.5305
 epoch: 77, train_loss: 0.2637, test_loss: 2.5897, test_f1: 0.5124
 epoch: 78, train_loss: 0.2608, test_loss: 2.3316, test_f1: 0.5360
 epoch: 79, train_loss: 0.2807, test_loss: 2.5857, test_f1: 0.5340
 epoch: 80, train_loss: 0.2756, test_loss: 2.4976, test_f1: 0.5374
 epoch: 81, train_loss: 0.2780, test_loss: 2.3933, test_f1: 0.5373
 epoch: 82, train_loss: 0.2554, test_loss: 2.3555, test_f1: 0.5503
 epoch: 83, train_loss: 0.2557, test_loss: 2.1929, test_f1: 0.5594
 epoch: 84, train_loss: 0.2535, test_loss: 2.4818, test_f1: 0.5320
 epoch: 85, train_loss: 0.2504, test_loss: 2.5908, test_f1: 0.5268
 epoch: 86, train_loss: 0.2380, test_loss: 2.6047, test_f1: 0.5457
 epoch: 87, train_loss: 0.2448, test_loss: 2.5506, test_f1: 0.5235
 epoch: 88, train_loss: 0.2310, test_loss: 2.6660, test_f1: 0.5316
 epoch: 89, train_loss: 0.2300, test_loss: 2.7665, test_f1: 0.5359
 epoch: 90, train_loss: 0.2171, test_loss: 2.7567, test_f1: 0.5236
 epoch: 91, train_loss: 0.2467, test_loss: 2.6076, test_f1: 0.5280
 epoch: 92, train_loss: 0.2341, test_loss: 2.6636, test_f1: 0.5472
 epoch: 93, train_loss: 0.2386, test_loss: 2.5992, test_f1: 0.5319
 epoch: 94, train_loss: 0.2547, test_loss: 3.0424, test_f1: 0.5019
 epoch: 95, train_loss: 0.2255, test_loss: 2.6109, test_f1: 0.5451
 epoch: 96, train_loss: 0.2238, test_loss: 2.5295, test_f1: 0.5305
 epoch: 97, train_loss: 0.1960, test_loss: 2.8881, test_f1: 0.5094
 epoch: 98, train_loss: 0.2122, test_loss: 2.9935, test_f1: 0.5038
 epoch: 99, train_loss: 0.2163, test_loss: 2.7376, test_f1: 0.5363
##################ITERATION #6 ****************************************
 epoch: 0, train_loss: 1.5285, test_loss: 1.2612, test_f1: 0.2408
 epoch: 1, train_loss: 1.2235, test_loss: 1.2008, test_f1: 0.3945
 epoch: 2, train_loss: 1.1290, test_loss: 1.0812, test_f1: 0.4705
 epoch: 3, train_loss: 1.0539, test_loss: 1.0359, test_f1: 0.5036
 epoch: 4, train_loss: 1.0096, test_loss: 0.9889, test_f1: 0.4819
 epoch: 5, train_loss: 0.9687, test_loss: 0.9711, test_f1: 0.5186
 epoch: 6, train_loss: 0.9336, test_loss: 0.9514, test_f1: 0.5139
 epoch: 7, train_loss: 0.9251, test_loss: 0.9662, test_f1: 0.5099
 epoch: 8, train_loss: 0.8940, test_loss: 1.0364, test_f1: 0.4964
 epoch: 9, train_loss: 0.8803, test_loss: 1.0085, test_f1: 0.4867
 epoch: 10, train_loss: 0.8574, test_loss: 0.9894, test_f1: 0.4879
 epoch: 11, train_loss: 0.8377, test_loss: 0.9867, test_f1: 0.5081
 epoch: 12, train_loss: 0.8187, test_loss: 1.0190, test_f1: 0.4858
 epoch: 13, train_loss: 0.7989, test_loss: 1.0669, test_f1: 0.4995
 epoch: 14, train_loss: 0.7918, test_loss: 1.0892, test_f1: 0.4977
 epoch: 15, train_loss: 0.7551, test_loss: 0.9816, test_f1: 0.5112
 epoch: 16, train_loss: 0.7325, test_loss: 1.0914, test_f1: 0.4717
 epoch: 17, train_loss: 0.7417, test_loss: 1.1092, test_f1: 0.5201
 epoch: 18, train_loss: 0.7196, test_loss: 1.1437, test_f1: 0.5107
 epoch: 19, train_loss: 0.7157, test_loss: 1.1479, test_f1: 0.5036
 epoch: 20, train_loss: 0.6873, test_loss: 1.2230, test_f1: 0.4717
 epoch: 21, train_loss: 0.6743, test_loss: 1.1674, test_f1: 0.5224
 epoch: 22, train_loss: 0.6754, test_loss: 1.1528, test_f1: 0.5277
 epoch: 23, train_loss: 0.6698, test_loss: 1.2452, test_f1: 0.4993
 epoch: 24, train_loss: 0.6436, test_loss: 1.1247, test_f1: 0.5366
 epoch: 25, train_loss: 0.6312, test_loss: 1.2017, test_f1: 0.5112
 epoch: 26, train_loss: 0.6169, test_loss: 1.1941, test_f1: 0.5314
 epoch: 27, train_loss: 0.5947, test_loss: 1.3977, test_f1: 0.5192
 epoch: 28, train_loss: 0.5824, test_loss: 1.2371, test_f1: 0.5494
 epoch: 29, train_loss: 0.5800, test_loss: 1.2878, test_f1: 0.5002
 epoch: 30, train_loss: 0.5753, test_loss: 1.3879, test_f1: 0.5081
 epoch: 31, train_loss: 0.5422, test_loss: 1.3080, test_f1: 0.5181
 epoch: 32, train_loss: 0.5478, test_loss: 1.3617, test_f1: 0.5242
 epoch: 33, train_loss: 0.5329, test_loss: 1.5155, test_f1: 0.5172
 epoch: 34, train_loss: 0.5135, test_loss: 1.3998, test_f1: 0.5399
 epoch: 35, train_loss: 0.5293, test_loss: 1.3257, test_f1: 0.5346
 epoch: 36, train_loss: 0.5189, test_loss: 1.3553, test_f1: 0.5665
 epoch: 37, train_loss: 0.5449, test_loss: 1.3496, test_f1: 0.5334
 epoch: 38, train_loss: 0.5396, test_loss: 1.3650, test_f1: 0.5197
 epoch: 39, train_loss: 0.4983, test_loss: 1.6201, test_f1: 0.5375
 epoch: 40, train_loss: 0.4822, test_loss: 1.5017, test_f1: 0.5415
 epoch: 41, train_loss: 0.4555, test_loss: 1.7496, test_f1: 0.5183
 epoch: 42, train_loss: 0.4650, test_loss: 1.4977, test_f1: 0.5111
 epoch: 43, train_loss: 0.4644, test_loss: 1.6984, test_f1: 0.5219
 epoch: 44, train_loss: 0.4740, test_loss: 1.4545, test_f1: 0.5366
 epoch: 45, train_loss: 0.4538, test_loss: 1.6312, test_f1: 0.5006
 epoch: 46, train_loss: 0.4569, test_loss: 1.6570, test_f1: 0.5238
 epoch: 47, train_loss: 0.4852, test_loss: 1.5734, test_f1: 0.5472
 epoch: 48, train_loss: 0.4481, test_loss: 1.5033, test_f1: 0.5225
 epoch: 49, train_loss: 0.4062, test_loss: 1.6912, test_f1: 0.5329
 epoch: 50, train_loss: 0.4081, test_loss: 1.6708, test_f1: 0.5412
 epoch: 51, train_loss: 0.3708, test_loss: 1.7377, test_f1: 0.5338
 epoch: 52, train_loss: 0.3582, test_loss: 1.6423, test_f1: 0.5614
 epoch: 53, train_loss: 0.3258, test_loss: 1.8493, test_f1: 0.5492
 epoch: 54, train_loss: 0.3206, test_loss: 1.7997, test_f1: 0.5466
 epoch: 55, train_loss: 0.3122, test_loss: 1.9787, test_f1: 0.5486
 epoch: 56, train_loss: 0.2884, test_loss: 1.9286, test_f1: 0.5373
 epoch: 57, train_loss: 0.2973, test_loss: 2.0471, test_f1: 0.5273
 epoch: 58, train_loss: 0.2901, test_loss: 2.1090, test_f1: 0.5261
 epoch: 59, train_loss: 0.2841, test_loss: 1.8192, test_f1: 0.5436
 epoch: 60, train_loss: 0.2898, test_loss: 2.0485, test_f1: 0.5323
 epoch: 61, train_loss: 0.2735, test_loss: 2.0163, test_f1: 0.5542
 epoch: 62, train_loss: 0.2807, test_loss: 2.0094, test_f1: 0.5244
 epoch: 63, train_loss: 0.2622, test_loss: 2.0988, test_f1: 0.5446
 epoch: 64, train_loss: 0.2679, test_loss: 2.1316, test_f1: 0.5340
 epoch: 65, train_loss: 0.2678, test_loss: 2.1226, test_f1: 0.5467
 epoch: 66, train_loss: 0.2588, test_loss: 2.2593, test_f1: 0.5108
 epoch: 67, train_loss: 0.2623, test_loss: 2.1119, test_f1: 0.5496
 epoch: 68, train_loss: 0.2678, test_loss: 2.1591, test_f1: 0.5339
 epoch: 69, train_loss: 0.2602, test_loss: 2.0777, test_f1: 0.5456
 epoch: 70, train_loss: 0.2490, test_loss: 2.3157, test_f1: 0.5358
 epoch: 71, train_loss: 0.2359, test_loss: 2.2452, test_f1: 0.5321
 epoch: 72, train_loss: 0.2357, test_loss: 2.0442, test_f1: 0.5435
 epoch: 73, train_loss: 0.2401, test_loss: 2.3838, test_f1: 0.5348
 epoch: 74, train_loss: 0.2296, test_loss: 2.3547, test_f1: 0.5400
 epoch: 75, train_loss: 0.2227, test_loss: 2.4016, test_f1: 0.5631
 epoch: 76, train_loss: 0.2238, test_loss: 2.1549, test_f1: 0.5422
 epoch: 77, train_loss: 0.2158, test_loss: 2.3686, test_f1: 0.5227
 epoch: 78, train_loss: 0.2376, test_loss: 2.2652, test_f1: 0.5327
 epoch: 79, train_loss: 0.2275, test_loss: 2.4232, test_f1: 0.5382
 epoch: 80, train_loss: 0.2163, test_loss: 2.3844, test_f1: 0.5384
 epoch: 81, train_loss: 0.2341, test_loss: 2.4528, test_f1: 0.5408
 epoch: 82, train_loss: 0.2314, test_loss: 2.2415, test_f1: 0.5475
 epoch: 83, train_loss: 0.2337, test_loss: 2.1863, test_f1: 0.5684
 epoch: 84, train_loss: 0.2303, test_loss: 2.3156, test_f1: 0.5449
 epoch: 85, train_loss: 0.2104, test_loss: 2.3325, test_f1: 0.5219
 epoch: 86, train_loss: 0.2113, test_loss: 2.2077, test_f1: 0.5412
 epoch: 87, train_loss: 0.2093, test_loss: 2.3469, test_f1: 0.5368
 epoch: 88, train_loss: 0.1990, test_loss: 2.5424, test_f1: 0.5356
 epoch: 89, train_loss: 0.1814, test_loss: 2.4890, test_f1: 0.5384
 epoch: 90, train_loss: 0.1818, test_loss: 2.5254, test_f1: 0.5322
 epoch: 91, train_loss: 0.1744, test_loss: 2.5528, test_f1: 0.5348
 epoch: 92, train_loss: 0.1819, test_loss: 2.6128, test_f1: 0.5505
 epoch: 93, train_loss: 0.1707, test_loss: 2.5390, test_f1: 0.5464
 epoch: 94, train_loss: 0.1802, test_loss: 2.8027, test_f1: 0.5251
 epoch: 95, train_loss: 0.1839, test_loss: 2.7004, test_f1: 0.5461
 epoch: 96, train_loss: 0.1915, test_loss: 2.5483, test_f1: 0.5236
 epoch: 97, train_loss: 0.1876, test_loss: 2.7374, test_f1: 0.5446
 epoch: 98, train_loss: 0.2046, test_loss: 2.6574, test_f1: 0.5233
 epoch: 99, train_loss: 0.1878, test_loss: 2.4694, test_f1: 0.5271
##################ITERATION #7 ****************************************
 epoch: 0, train_loss: 1.4760, test_loss: 1.2980, test_f1: 0.3678
 epoch: 1, train_loss: 1.1855, test_loss: 1.2764, test_f1: 0.3325
 epoch: 2, train_loss: 1.0971, test_loss: 1.2016, test_f1: 0.4259
 epoch: 3, train_loss: 1.0543, test_loss: 1.0993, test_f1: 0.4512
 epoch: 4, train_loss: 0.9946, test_loss: 1.0067, test_f1: 0.4937
 epoch: 5, train_loss: 0.9725, test_loss: 1.0013, test_f1: 0.4574
 epoch: 6, train_loss: 0.9483, test_loss: 1.0257, test_f1: 0.4469
 epoch: 7, train_loss: 0.9162, test_loss: 0.9782, test_f1: 0.5132
 epoch: 8, train_loss: 0.8879, test_loss: 0.9951, test_f1: 0.5070
 epoch: 9, train_loss: 0.8652, test_loss: 0.9765, test_f1: 0.5284
 epoch: 10, train_loss: 0.8510, test_loss: 1.0452, test_f1: 0.4913
 epoch: 11, train_loss: 0.8305, test_loss: 1.0718, test_f1: 0.4720
 epoch: 12, train_loss: 0.8127, test_loss: 1.0152, test_f1: 0.5062
 epoch: 13, train_loss: 0.7824, test_loss: 1.1402, test_f1: 0.4852
 epoch: 14, train_loss: 0.7736, test_loss: 0.9922, test_f1: 0.5293
 epoch: 15, train_loss: 0.7445, test_loss: 1.0425, test_f1: 0.5137
 epoch: 16, train_loss: 0.7344, test_loss: 1.0694, test_f1: 0.5294
 epoch: 17, train_loss: 0.7251, test_loss: 1.1519, test_f1: 0.5219
 epoch: 18, train_loss: 0.7319, test_loss: 1.0837, test_f1: 0.5288
 epoch: 19, train_loss: 0.7124, test_loss: 1.1551, test_f1: 0.5054
 epoch: 20, train_loss: 0.6916, test_loss: 1.1834, test_f1: 0.5457
 epoch: 21, train_loss: 0.6948, test_loss: 1.0639, test_f1: 0.5534
 epoch: 22, train_loss: 0.6907, test_loss: 1.2041, test_f1: 0.5674
 epoch: 23, train_loss: 0.6474, test_loss: 1.2295, test_f1: 0.5199
 epoch: 24, train_loss: 0.6270, test_loss: 1.2649, test_f1: 0.5364
 epoch: 25, train_loss: 0.6301, test_loss: 1.2614, test_f1: 0.5390
 epoch: 26, train_loss: 0.5928, test_loss: 1.2549, test_f1: 0.5534
 epoch: 27, train_loss: 0.5878, test_loss: 1.3933, test_f1: 0.5214
 epoch: 28, train_loss: 0.5656, test_loss: 1.4535, test_f1: 0.5416
 epoch: 29, train_loss: 0.5535, test_loss: 1.3936, test_f1: 0.5483
 epoch: 30, train_loss: 0.5537, test_loss: 1.4945, test_f1: 0.5486
 epoch: 31, train_loss: 0.5813, test_loss: 1.3857, test_f1: 0.5412
 epoch: 32, train_loss: 0.5663, test_loss: 1.3780, test_f1: 0.5440
 epoch: 33, train_loss: 0.5303, test_loss: 1.5446, test_f1: 0.5371
 epoch: 34, train_loss: 0.5196, test_loss: 1.3361, test_f1: 0.5656
 epoch: 35, train_loss: 0.4867, test_loss: 1.5510, test_f1: 0.5455
 epoch: 36, train_loss: 0.5105, test_loss: 1.7785, test_f1: 0.5479
 epoch: 37, train_loss: 0.5101, test_loss: 1.6355, test_f1: 0.5171
 epoch: 38, train_loss: 0.5082, test_loss: 1.5330, test_f1: 0.5439
 epoch: 39, train_loss: 0.4830, test_loss: 1.6675, test_f1: 0.5405
 epoch: 40, train_loss: 0.4788, test_loss: 1.6971, test_f1: 0.5285
 epoch: 41, train_loss: 0.4961, test_loss: 1.6916, test_f1: 0.5464
 epoch: 42, train_loss: 0.5052, test_loss: 1.8019, test_f1: 0.5171
 epoch: 43, train_loss: 0.4824, test_loss: 1.6173, test_f1: 0.5430
 epoch: 44, train_loss: 0.4877, test_loss: 1.5446, test_f1: 0.5512
 epoch: 45, train_loss: 0.4498, test_loss: 1.9437, test_f1: 0.5163
 epoch: 46, train_loss: 0.4574, test_loss: 1.6442, test_f1: 0.5528
 epoch: 47, train_loss: 0.4416, test_loss: 1.6685, test_f1: 0.5431
 epoch: 48, train_loss: 0.4267, test_loss: 1.8212, test_f1: 0.5465
 epoch: 49, train_loss: 0.4206, test_loss: 1.8112, test_f1: 0.5184
 epoch: 50, train_loss: 0.4189, test_loss: 1.9701, test_f1: 0.5302
 epoch: 51, train_loss: 0.3951, test_loss: 1.8240, test_f1: 0.5550
 epoch: 52, train_loss: 0.3473, test_loss: 1.9817, test_f1: 0.5424
 epoch: 53, train_loss: 0.3223, test_loss: 1.9584, test_f1: 0.5325
 epoch: 54, train_loss: 0.3035, test_loss: 2.0968, test_f1: 0.5344
 epoch: 55, train_loss: 0.2826, test_loss: 2.0628, test_f1: 0.5204
 epoch: 56, train_loss: 0.3121, test_loss: 2.1138, test_f1: 0.5560
 epoch: 57, train_loss: 0.2941, test_loss: 2.1924, test_f1: 0.5585
 epoch: 58, train_loss: 0.2971, test_loss: 2.2196, test_f1: 0.5497
 epoch: 59, train_loss: 0.2730, test_loss: 2.3319, test_f1: 0.5685
 epoch: 60, train_loss: 0.2849, test_loss: 2.1520, test_f1: 0.5651
 epoch: 61, train_loss: 0.2623, test_loss: 2.3206, test_f1: 0.5537
 epoch: 62, train_loss: 0.2498, test_loss: 2.3113, test_f1: 0.5576
 epoch: 63, train_loss: 0.2693, test_loss: 2.3250, test_f1: 0.5582
 epoch: 64, train_loss: 0.2770, test_loss: 2.3743, test_f1: 0.5737
 epoch: 65, train_loss: 0.2740, test_loss: 2.3704, test_f1: 0.5461
 epoch: 66, train_loss: 0.2597, test_loss: 2.1981, test_f1: 0.5607
 epoch: 67, train_loss: 0.2621, test_loss: 2.3554, test_f1: 0.5649
 epoch: 68, train_loss: 0.2664, test_loss: 2.3302, test_f1: 0.5641
 epoch: 69, train_loss: 0.2500, test_loss: 2.5301, test_f1: 0.5403
 epoch: 70, train_loss: 0.2507, test_loss: 2.7012, test_f1: 0.5237
 epoch: 71, train_loss: 0.2408, test_loss: 2.3317, test_f1: 0.5518
 epoch: 72, train_loss: 0.2429, test_loss: 2.4253, test_f1: 0.5577
 epoch: 73, train_loss: 0.2497, test_loss: 2.4152, test_f1: 0.5690
 epoch: 74, train_loss: 0.2295, test_loss: 2.4567, test_f1: 0.5514
 epoch: 75, train_loss: 0.2286, test_loss: 2.8561, test_f1: 0.5496
 epoch: 76, train_loss: 0.2278, test_loss: 2.6938, test_f1: 0.5353
 epoch: 77, train_loss: 0.2198, test_loss: 2.5504, test_f1: 0.5511
 epoch: 78, train_loss: 0.2302, test_loss: 2.6875, test_f1: 0.5349
 epoch: 79, train_loss: 0.2348, test_loss: 2.7753, test_f1: 0.5275
 epoch: 80, train_loss: 0.2126, test_loss: 2.5522, test_f1: 0.5518
 epoch: 81, train_loss: 0.2177, test_loss: 2.7204, test_f1: 0.5499
 epoch: 82, train_loss: 0.2002, test_loss: 2.8137, test_f1: 0.5565
 epoch: 83, train_loss: 0.1957, test_loss: 2.8988, test_f1: 0.5394
 epoch: 84, train_loss: 0.2007, test_loss: 2.8354, test_f1: 0.5654
 epoch: 85, train_loss: 0.2141, test_loss: 2.6938, test_f1: 0.5568
 epoch: 86, train_loss: 0.2215, test_loss: 2.9469, test_f1: 0.5322
 epoch: 87, train_loss: 0.2132, test_loss: 2.6132, test_f1: 0.5626
 epoch: 88, train_loss: 0.2218, test_loss: 2.7599, test_f1: 0.5298
 epoch: 89, train_loss: 0.2251, test_loss: 2.8963, test_f1: 0.5299
 epoch: 90, train_loss: 0.2123, test_loss: 2.6482, test_f1: 0.5290
 epoch: 91, train_loss: 0.2119, test_loss: 2.8546, test_f1: 0.5450
 epoch: 92, train_loss: 0.2000, test_loss: 2.8472, test_f1: 0.5540
 epoch: 93, train_loss: 0.2043, test_loss: 2.7684, test_f1: 0.5487
 epoch: 94, train_loss: 0.2085, test_loss: 2.5474, test_f1: 0.5436
 epoch: 95, train_loss: 0.2026, test_loss: 2.8454, test_f1: 0.5491
 epoch: 96, train_loss: 0.1985, test_loss: 2.9223, test_f1: 0.5389
 epoch: 97, train_loss: 0.1931, test_loss: 2.6133, test_f1: 0.5705
 epoch: 98, train_loss: 0.1870, test_loss: 2.7587, test_f1: 0.5492
 epoch: 99, train_loss: 0.1988, test_loss: 2.6771, test_f1: 0.5548
##################ITERATION #8 ****************************************
 epoch: 0, train_loss: 1.6019, test_loss: 1.3123, test_f1: 0.3288
 epoch: 1, train_loss: 1.2448, test_loss: 1.2225, test_f1: 0.3134
 epoch: 2, train_loss: 1.1400, test_loss: 1.0901, test_f1: 0.4301
 epoch: 3, train_loss: 1.0787, test_loss: 1.0395, test_f1: 0.4915
 epoch: 4, train_loss: 1.0345, test_loss: 1.0019, test_f1: 0.4934
 epoch: 5, train_loss: 1.0020, test_loss: 1.0031, test_f1: 0.4711
 epoch: 6, train_loss: 0.9771, test_loss: 0.9668, test_f1: 0.5363
 epoch: 7, train_loss: 0.9399, test_loss: 0.9995, test_f1: 0.5037
 epoch: 8, train_loss: 0.9136, test_loss: 0.9867, test_f1: 0.5187
 epoch: 9, train_loss: 0.9190, test_loss: 1.0277, test_f1: 0.5312
 epoch: 10, train_loss: 0.8967, test_loss: 1.0112, test_f1: 0.5083
 epoch: 11, train_loss: 0.8814, test_loss: 1.0007, test_f1: 0.4940
 epoch: 12, train_loss: 0.8613, test_loss: 0.9622, test_f1: 0.5339
 epoch: 13, train_loss: 0.8319, test_loss: 0.9971, test_f1: 0.5293
 epoch: 14, train_loss: 0.8243, test_loss: 0.9894, test_f1: 0.5282
 epoch: 15, train_loss: 0.8106, test_loss: 1.1568, test_f1: 0.4736
 epoch: 16, train_loss: 0.8107, test_loss: 1.0394, test_f1: 0.5038
 epoch: 17, train_loss: 0.8006, test_loss: 1.0962, test_f1: 0.5202
 epoch: 18, train_loss: 0.8008, test_loss: 1.0347, test_f1: 0.5006
 epoch: 19, train_loss: 0.7683, test_loss: 1.0953, test_f1: 0.5244
 epoch: 20, train_loss: 0.7503, test_loss: 1.0777, test_f1: 0.5171
 epoch: 21, train_loss: 0.7411, test_loss: 1.1239, test_f1: 0.5437
 epoch: 22, train_loss: 0.7311, test_loss: 1.1565, test_f1: 0.5014
 epoch: 23, train_loss: 0.7118, test_loss: 1.1482, test_f1: 0.5145
 epoch: 24, train_loss: 0.7033, test_loss: 1.1619, test_f1: 0.5394
 epoch: 25, train_loss: 0.6750, test_loss: 1.2173, test_f1: 0.5235
 epoch: 26, train_loss: 0.6942, test_loss: 1.1963, test_f1: 0.4940
 epoch: 27, train_loss: 0.6985, test_loss: 1.2531, test_f1: 0.5080
 epoch: 28, train_loss: 0.6850, test_loss: 1.1978, test_f1: 0.5093
 epoch: 29, train_loss: 0.6696, test_loss: 1.1667, test_f1: 0.5352
 epoch: 30, train_loss: 0.6402, test_loss: 1.2733, test_f1: 0.5295
 epoch: 31, train_loss: 0.6110, test_loss: 1.2397, test_f1: 0.5191
 epoch: 32, train_loss: 0.6293, test_loss: 1.5053, test_f1: 0.4990
 epoch: 33, train_loss: 0.6297, test_loss: 1.2720, test_f1: 0.5259
 epoch: 34, train_loss: 0.6209, test_loss: 1.2476, test_f1: 0.5088
 epoch: 35, train_loss: 0.6034, test_loss: 1.3689, test_f1: 0.4976
 epoch: 36, train_loss: 0.5756, test_loss: 1.4103, test_f1: 0.5223
 epoch: 37, train_loss: 0.5746, test_loss: 1.3726, test_f1: 0.5123
 epoch: 38, train_loss: 0.5496, test_loss: 1.4856, test_f1: 0.5103
 epoch: 39, train_loss: 0.5487, test_loss: 1.4115, test_f1: 0.5313
 epoch: 40, train_loss: 0.5049, test_loss: 1.4004, test_f1: 0.5454
 epoch: 41, train_loss: 0.5256, test_loss: 1.7174, test_f1: 0.5075
 epoch: 42, train_loss: 0.5449, test_loss: 1.4727, test_f1: 0.5198
 epoch: 43, train_loss: 0.5339, test_loss: 1.4405, test_f1: 0.5251
 epoch: 44, train_loss: 0.5257, test_loss: 1.5212, test_f1: 0.5011
 epoch: 45, train_loss: 0.5032, test_loss: 1.4951, test_f1: 0.5490
 epoch: 46, train_loss: 0.4941, test_loss: 1.5978, test_f1: 0.5279
 epoch: 47, train_loss: 0.4804, test_loss: 1.6280, test_f1: 0.5191
 epoch: 48, train_loss: 0.4816, test_loss: 1.6942, test_f1: 0.5107
 epoch: 49, train_loss: 0.5139, test_loss: 1.4223, test_f1: 0.5069
 epoch: 50, train_loss: 0.4920, test_loss: 1.4281, test_f1: 0.5194
 epoch: 51, train_loss: 0.4286, test_loss: 1.5438, test_f1: 0.5257
 epoch: 52, train_loss: 0.4041, test_loss: 1.5977, test_f1: 0.5554
 epoch: 53, train_loss: 0.3878, test_loss: 1.6546, test_f1: 0.5504
 epoch: 54, train_loss: 0.3731, test_loss: 1.7064, test_f1: 0.5372
 epoch: 55, train_loss: 0.3553, test_loss: 1.7314, test_f1: 0.5395
 epoch: 56, train_loss: 0.3530, test_loss: 1.7521, test_f1: 0.5278
 epoch: 57, train_loss: 0.3415, test_loss: 1.9387, test_f1: 0.5548
 epoch: 58, train_loss: 0.3532, test_loss: 1.9515, test_f1: 0.5275
 epoch: 59, train_loss: 0.3254, test_loss: 1.8025, test_f1: 0.5447
 epoch: 60, train_loss: 0.3335, test_loss: 1.8591, test_f1: 0.5076
 epoch: 61, train_loss: 0.3460, test_loss: 1.9046, test_f1: 0.5006
 epoch: 62, train_loss: 0.3146, test_loss: 1.7962, test_f1: 0.5303
 epoch: 63, train_loss: 0.3221, test_loss: 1.9127, test_f1: 0.5329
 epoch: 64, train_loss: 0.3252, test_loss: 1.9487, test_f1: 0.5246
 epoch: 65, train_loss: 0.3056, test_loss: 2.0050, test_f1: 0.5259
 epoch: 66, train_loss: 0.3126, test_loss: 2.0192, test_f1: 0.5423
 epoch: 67, train_loss: 0.3164, test_loss: 2.0147, test_f1: 0.5079
 epoch: 68, train_loss: 0.3282, test_loss: 2.1941, test_f1: 0.5081
 epoch: 69, train_loss: 0.3141, test_loss: 2.0114, test_f1: 0.5343
 epoch: 70, train_loss: 0.3241, test_loss: 2.0428, test_f1: 0.5543
 epoch: 71, train_loss: 0.3091, test_loss: 2.0107, test_f1: 0.5149
 epoch: 72, train_loss: 0.3039, test_loss: 1.9409, test_f1: 0.5450
 epoch: 73, train_loss: 0.2732, test_loss: 2.0849, test_f1: 0.5670
 epoch: 74, train_loss: 0.2712, test_loss: 2.1040, test_f1: 0.5626
 epoch: 75, train_loss: 0.2643, test_loss: 2.0874, test_f1: 0.5394
 epoch: 76, train_loss: 0.2502, test_loss: 2.1629, test_f1: 0.5186
 epoch: 77, train_loss: 0.2393, test_loss: 2.1907, test_f1: 0.5424
 epoch: 78, train_loss: 0.2706, test_loss: 2.3979, test_f1: 0.5170
 epoch: 79, train_loss: 0.2598, test_loss: 2.1210, test_f1: 0.5449
 epoch: 80, train_loss: 0.2674, test_loss: 2.1998, test_f1: 0.5411
 epoch: 81, train_loss: 0.2624, test_loss: 2.4018, test_f1: 0.5195
 epoch: 82, train_loss: 0.2724, test_loss: 2.4651, test_f1: 0.5281
 epoch: 83, train_loss: 0.2557, test_loss: 2.2068, test_f1: 0.5469
 epoch: 84, train_loss: 0.2614, test_loss: 2.2818, test_f1: 0.5302
 epoch: 85, train_loss: 0.2549, test_loss: 2.4116, test_f1: 0.5521
 epoch: 86, train_loss: 0.2567, test_loss: 2.2980, test_f1: 0.5349
 epoch: 87, train_loss: 0.2383, test_loss: 2.2699, test_f1: 0.5453
 epoch: 88, train_loss: 0.2340, test_loss: 2.3575, test_f1: 0.5363
 epoch: 89, train_loss: 0.2262, test_loss: 2.4980, test_f1: 0.5324
 epoch: 90, train_loss: 0.2272, test_loss: 2.3872, test_f1: 0.5109
 epoch: 91, train_loss: 0.2337, test_loss: 2.5493, test_f1: 0.5239
 epoch: 92, train_loss: 0.2488, test_loss: 2.3070, test_f1: 0.5511
 epoch: 93, train_loss: 0.2455, test_loss: 2.3906, test_f1: 0.5626
 epoch: 94, train_loss: 0.2264, test_loss: 2.7420, test_f1: 0.5203
 epoch: 95, train_loss: 0.2425, test_loss: 2.6178, test_f1: 0.5048
 epoch: 96, train_loss: 0.2192, test_loss: 2.4364, test_f1: 0.5041
 epoch: 97, train_loss: 0.2277, test_loss: 2.4970, test_f1: 0.5494
 epoch: 98, train_loss: 0.2101, test_loss: 2.6440, test_f1: 0.5463
 epoch: 99, train_loss: 0.1997, test_loss: 2.5829, test_f1: 0.5325
##################ITERATION #9 ****************************************
 epoch: 0, train_loss: 1.5892, test_loss: 1.2791, test_f1: 0.3168
 epoch: 1, train_loss: 1.2188, test_loss: 1.2398, test_f1: 0.3497
 epoch: 2, train_loss: 1.1191, test_loss: 1.1435, test_f1: 0.3824
 epoch: 3, train_loss: 1.0777, test_loss: 1.1145, test_f1: 0.3946
 epoch: 4, train_loss: 1.0381, test_loss: 1.1118, test_f1: 0.4451
 epoch: 5, train_loss: 1.0182, test_loss: 1.0280, test_f1: 0.4703
 epoch: 6, train_loss: 0.9736, test_loss: 1.0285, test_f1: 0.4604
 epoch: 7, train_loss: 0.9426, test_loss: 1.0775, test_f1: 0.4691
 epoch: 8, train_loss: 0.9298, test_loss: 1.1130, test_f1: 0.4304
 epoch: 9, train_loss: 0.8988, test_loss: 1.0483, test_f1: 0.4735
 epoch: 10, train_loss: 0.8819, test_loss: 1.0514, test_f1: 0.4968
 epoch: 11, train_loss: 0.8594, test_loss: 1.0049, test_f1: 0.4983
 epoch: 12, train_loss: 0.8327, test_loss: 1.0359, test_f1: 0.5092
 epoch: 13, train_loss: 0.8316, test_loss: 1.0577, test_f1: 0.5265
 epoch: 14, train_loss: 0.8067, test_loss: 1.1260, test_f1: 0.4568
 epoch: 15, train_loss: 0.7872, test_loss: 1.0925, test_f1: 0.5254
 epoch: 16, train_loss: 0.7789, test_loss: 1.1298, test_f1: 0.5197
 epoch: 17, train_loss: 0.7847, test_loss: 1.1314, test_f1: 0.5119
 epoch: 18, train_loss: 0.7696, test_loss: 1.0408, test_f1: 0.5234
 epoch: 19, train_loss: 0.7392, test_loss: 1.1161, test_f1: 0.4910
 epoch: 20, train_loss: 0.7128, test_loss: 1.2241, test_f1: 0.5251
 epoch: 21, train_loss: 0.7099, test_loss: 1.1394, test_f1: 0.5418
 epoch: 22, train_loss: 0.6891, test_loss: 1.2527, test_f1: 0.5233
 epoch: 23, train_loss: 0.6868, test_loss: 1.2068, test_f1: 0.5207
 epoch: 24, train_loss: 0.6769, test_loss: 1.3443, test_f1: 0.4891
 epoch: 25, train_loss: 0.6371, test_loss: 1.3977, test_f1: 0.5140
 epoch: 26, train_loss: 0.6556, test_loss: 1.2689, test_f1: 0.5414
 epoch: 27, train_loss: 0.6608, test_loss: 1.1834, test_f1: 0.5025
 epoch: 28, train_loss: 0.6268, test_loss: 1.2167, test_f1: 0.5474
 epoch: 29, train_loss: 0.6137, test_loss: 1.3043, test_f1: 0.5062
 epoch: 30, train_loss: 0.5968, test_loss: 1.3326, test_f1: 0.5252
 epoch: 31, train_loss: 0.5873, test_loss: 1.3984, test_f1: 0.5227
 epoch: 32, train_loss: 0.5949, test_loss: 1.3476, test_f1: 0.5303
 epoch: 33, train_loss: 0.5873, test_loss: 1.2970, test_f1: 0.5126
 epoch: 34, train_loss: 0.5694, test_loss: 1.4778, test_f1: 0.5264
 epoch: 35, train_loss: 0.5808, test_loss: 1.3650, test_f1: 0.5328
 epoch: 36, train_loss: 0.5373, test_loss: 1.5408, test_f1: 0.5269
 epoch: 37, train_loss: 0.5282, test_loss: 1.5676, test_f1: 0.5155
 epoch: 38, train_loss: 0.5273, test_loss: 1.5706, test_f1: 0.5168
 epoch: 39, train_loss: 0.5348, test_loss: 1.4036, test_f1: 0.5255
 epoch: 40, train_loss: 0.5146, test_loss: 1.4953, test_f1: 0.5428
 epoch: 41, train_loss: 0.5148, test_loss: 1.6163, test_f1: 0.5275
 epoch: 42, train_loss: 0.5117, test_loss: 1.5294, test_f1: 0.5378
 epoch: 43, train_loss: 0.5154, test_loss: 1.5513, test_f1: 0.5234
 epoch: 44, train_loss: 0.4971, test_loss: 1.4090, test_f1: 0.5491
 epoch: 45, train_loss: 0.4718, test_loss: 1.5638, test_f1: 0.5246
 epoch: 46, train_loss: 0.4909, test_loss: 1.8571, test_f1: 0.4970
 epoch: 47, train_loss: 0.4951, test_loss: 1.6858, test_f1: 0.5303
 epoch: 48, train_loss: 0.4685, test_loss: 1.5094, test_f1: 0.5472
 epoch: 49, train_loss: 0.4689, test_loss: 1.6068, test_f1: 0.5311
 epoch: 50, train_loss: 0.4364, test_loss: 1.8627, test_f1: 0.5214
 epoch: 51, train_loss: 0.3985, test_loss: 1.7411, test_f1: 0.5400
 epoch: 52, train_loss: 0.3779, test_loss: 1.7386, test_f1: 0.5433
 epoch: 53, train_loss: 0.3598, test_loss: 1.8157, test_f1: 0.5423
 epoch: 54, train_loss: 0.3439, test_loss: 1.8854, test_f1: 0.5392
 epoch: 55, train_loss: 0.3282, test_loss: 1.9543, test_f1: 0.5383
 epoch: 56, train_loss: 0.3306, test_loss: 2.0021, test_f1: 0.5248
 epoch: 57, train_loss: 0.3438, test_loss: 1.8627, test_f1: 0.5560
 epoch: 58, train_loss: 0.3237, test_loss: 1.8798, test_f1: 0.5520
 epoch: 59, train_loss: 0.3242, test_loss: 1.9611, test_f1: 0.5316
 epoch: 60, train_loss: 0.3068, test_loss: 2.1003, test_f1: 0.5190
 epoch: 61, train_loss: 0.3047, test_loss: 2.0307, test_f1: 0.5424
 epoch: 62, train_loss: 0.2938, test_loss: 2.0800, test_f1: 0.5332
 epoch: 63, train_loss: 0.3082, test_loss: 2.1354, test_f1: 0.5207
 epoch: 64, train_loss: 0.3129, test_loss: 2.2505, test_f1: 0.5415
 epoch: 65, train_loss: 0.2922, test_loss: 2.1085, test_f1: 0.5506
 epoch: 66, train_loss: 0.2813, test_loss: 2.2327, test_f1: 0.5238
 epoch: 67, train_loss: 0.2814, test_loss: 2.1200, test_f1: 0.5333
 epoch: 68, train_loss: 0.2725, test_loss: 2.1707, test_f1: 0.5375
 epoch: 69, train_loss: 0.2915, test_loss: 2.2288, test_f1: 0.5479
 epoch: 70, train_loss: 0.2772, test_loss: 2.1665, test_f1: 0.5365
 epoch: 71, train_loss: 0.2854, test_loss: 2.2604, test_f1: 0.5209
 epoch: 72, train_loss: 0.2890, test_loss: 2.2100, test_f1: 0.5409
 epoch: 73, train_loss: 0.2829, test_loss: 2.2017, test_f1: 0.5198
 epoch: 74, train_loss: 0.2551, test_loss: 2.2191, test_f1: 0.5076
 epoch: 75, train_loss: 0.2661, test_loss: 2.1968, test_f1: 0.5257
 epoch: 76, train_loss: 0.2519, test_loss: 2.2200, test_f1: 0.5266
 epoch: 77, train_loss: 0.2700, test_loss: 2.2924, test_f1: 0.5553
 epoch: 78, train_loss: 0.2604, test_loss: 2.3576, test_f1: 0.5504
 epoch: 79, train_loss: 0.2529, test_loss: 2.5870, test_f1: 0.5126
 epoch: 80, train_loss: 0.2574, test_loss: 2.2665, test_f1: 0.5260
 epoch: 81, train_loss: 0.2466, test_loss: 2.3652, test_f1: 0.5202
 epoch: 82, train_loss: 0.2407, test_loss: 2.4618, test_f1: 0.5319
 epoch: 83, train_loss: 0.2486, test_loss: 2.4366, test_f1: 0.5286
 epoch: 84, train_loss: 0.2434, test_loss: 2.5448, test_f1: 0.5015
 epoch: 85, train_loss: 0.2523, test_loss: 2.2996, test_f1: 0.5438
 epoch: 86, train_loss: 0.2548, test_loss: 2.3500, test_f1: 0.5474
 epoch: 87, train_loss: 0.2401, test_loss: 2.4705, test_f1: 0.5275
 epoch: 88, train_loss: 0.2573, test_loss: 2.4268, test_f1: 0.5323
 epoch: 89, train_loss: 0.2429, test_loss: 2.4721, test_f1: 0.5252
 epoch: 90, train_loss: 0.2297, test_loss: 2.4731, test_f1: 0.5357
 epoch: 91, train_loss: 0.2356, test_loss: 2.6121, test_f1: 0.5367
 epoch: 92, train_loss: 0.2382, test_loss: 2.5810, test_f1: 0.5380
 epoch: 93, train_loss: 0.2218, test_loss: 2.4183, test_f1: 0.5443
 epoch: 94, train_loss: 0.2285, test_loss: 2.6767, test_f1: 0.5178
 epoch: 95, train_loss: 0.2234, test_loss: 2.6929, test_f1: 0.5165
 epoch: 96, train_loss: 0.2341, test_loss: 2.8286, test_f1: 0.5188
 epoch: 97, train_loss: 0.2255, test_loss: 2.6081, test_f1: 0.5230
 epoch: 98, train_loss: 0.2193, test_loss: 2.6715, test_f1: 0.5165
 epoch: 99, train_loss: 0.2000, test_loss: 2.5911, test_f1: 0.5273

Training completed in 412.01 seconds
Best F1: 0.5962 at epoch 40
Mean F1 across iterations: 0.5724  0.0111
========================FINAL RESULTS================================
FEGIN weighted F1: 0.5962  0.0111
python main.py --data ltspice_examples --representation component_component --model FEGIN --layers 5 --hiddens 128 --batch_size 256 --lr 0.001 --emb_size 512 --epochs 100 --save_appendix component_component_L5_H128_BS256_LR0.001_E512 --no_val
-----



STDERR:
  File "main.py", line 370, in <module>
    main()
  File "main.py", line 254, in main
    dataset = dataset_class(
  File "/home/philip/projects/ltspice_examples_code_repo/Circuit-Completion-Using-GNNs/component_classification_with_link_prediction_head/evaluation/FEGIN/kernel/circuit_datasets.py", line 15, in __init__
    self.data, self.slices = torch.load(self.processed_paths[0])
  File "/home/philip/.local/lib/python3.8/site-packages/torch/serialization.py", line 1040, in load
    warnings.warn(
  File "/usr/lib/python3.8/warnings.py", line 109, in _showwarnmsg
    sw(msg.message, msg.category, msg.filename, msg.lineno,
  File "main.py", line 47, in warn_with_traceback
    traceback.print_stack(file=log)
/home/philip/projects/ltspice_examples_code_repo/Circuit-Completion-Using-GNNs/component_classification_with_link_prediction_head/evaluation/FEGIN/kernel/circuit_datasets.py:15: FutureWarning: You are using `torch.load` with `weights_only=False` (the current default value), which uses the default pickle module implicitly. It is possible to construct malicious pickle data which will execute arbitrary code during unpickling (See https://github.com/pytorch/pytorch/blob/main/SECURITY.md#untrusted-models for more details). In a future release, the default value for `weights_only` will be flipped to `True`. This limits the functions that could be executed during unpickling. Arbitrary objects will no longer be allowed to be loaded via this mode unless they are explicitly allowlisted by the user via `torch.serialization.add_safe_globals`. We recommend you start setting `weights_only=True` for any use case where you don't have full control of the loaded file. Please open an issue on GitHub for any issues related to this experimental feature.
  self.data, self.slices = torch.load(self.processed_paths[0])
