STDOUT:
Results will be saved in /home/philip/projects/ltspice_examples_code_repo/Circuit-Completion-Using-GNNs/component_classification_with_link_prediction_head/evaluation/FEGIN/results/model_FEGIN_dataset_ltspice_examples
Command line input: python main.py --data ltspice_examples --representation component_pin --model FEGIN --layers 3 --hiddens 128 --batch_size 64 --lr 0.01 --emb_size 512 --epochs 100 --save_appendix component_pin_L3_H128_BS64_LR0.01_E512 --no_val
 is saved.
-----
ltspice_examples - FEGIN
Using 3 layers, 128 hidden units, h = 2
Loading component_pin representation dataset
ENTERED
Training FEGIN on component_pin representation
Train: 3560, Test: 848
##################ITERATION #0 ****************************************
 epoch: 0, train_loss: 1.1279, test_loss: 1.0290, test_f1: 0.3474
 epoch: 1, train_loss: 1.0035, test_loss: 1.0260, test_f1: 0.4730
 epoch: 2, train_loss: 0.9608, test_loss: 1.0434, test_f1: 0.4884
 epoch: 3, train_loss: 0.9411, test_loss: 1.1975, test_f1: 0.4197
 epoch: 4, train_loss: 0.8942, test_loss: 0.9241, test_f1: 0.4968
 epoch: 5, train_loss: 0.8892, test_loss: 0.9126, test_f1: 0.5129
 epoch: 6, train_loss: 0.8762, test_loss: 0.9170, test_f1: 0.5412
 epoch: 7, train_loss: 0.8688, test_loss: 0.8508, test_f1: 0.5750
 epoch: 8, train_loss: 0.8322, test_loss: 1.0433, test_f1: 0.5199
 epoch: 9, train_loss: 0.8419, test_loss: 0.9285, test_f1: 0.5631
 epoch: 10, train_loss: 0.8232, test_loss: 0.9477, test_f1: 0.5349
 epoch: 11, train_loss: 0.8178, test_loss: 0.9077, test_f1: 0.6104
 epoch: 12, train_loss: 0.7875, test_loss: 0.8264, test_f1: 0.5484
 epoch: 13, train_loss: 0.7846, test_loss: 0.7849, test_f1: 0.5504
 epoch: 14, train_loss: 0.7729, test_loss: 0.8286, test_f1: 0.5701
 epoch: 15, train_loss: 0.7524, test_loss: 0.8434, test_f1: 0.5631
 epoch: 16, train_loss: 0.7431, test_loss: 0.8107, test_f1: 0.5663
 epoch: 17, train_loss: 0.7475, test_loss: 1.0049, test_f1: 0.4962
 epoch: 18, train_loss: 0.7375, test_loss: 1.0911, test_f1: 0.5952
 epoch: 19, train_loss: 0.7184, test_loss: 0.9548, test_f1: 0.6019
 epoch: 20, train_loss: 0.7323, test_loss: 0.8881, test_f1: 0.5905
 epoch: 21, train_loss: 0.7098, test_loss: 0.8082, test_f1: 0.6295
 epoch: 22, train_loss: 0.6874, test_loss: 0.8346, test_f1: 0.5673
 epoch: 23, train_loss: 0.6998, test_loss: 1.0211, test_f1: 0.6210
 epoch: 24, train_loss: 0.6786, test_loss: 0.8666, test_f1: 0.6335
 epoch: 25, train_loss: 0.6877, test_loss: 1.1714, test_f1: 0.4872
 epoch: 26, train_loss: 0.6779, test_loss: 0.9322, test_f1: 0.6157
 epoch: 27, train_loss: 0.6466, test_loss: 1.5013, test_f1: 0.5723
 epoch: 28, train_loss: 0.6657, test_loss: 0.9231, test_f1: 0.5865
 epoch: 29, train_loss: 0.6559, test_loss: 0.9578, test_f1: 0.5725
 epoch: 30, train_loss: 0.6406, test_loss: 0.8819, test_f1: 0.5797
 epoch: 31, train_loss: 0.6407, test_loss: 0.9301, test_f1: 0.6020
 epoch: 32, train_loss: 0.6369, test_loss: 0.8423, test_f1: 0.6213
 epoch: 33, train_loss: 0.6363, test_loss: 0.8053, test_f1: 0.5950
 epoch: 34, train_loss: 0.6178, test_loss: 1.1821, test_f1: 0.5735
 epoch: 35, train_loss: 0.6169, test_loss: 0.9557, test_f1: 0.6042
 epoch: 36, train_loss: 0.6035, test_loss: 1.0109, test_f1: 0.6014
 epoch: 37, train_loss: 0.6036, test_loss: 1.0073, test_f1: 0.5873
 epoch: 38, train_loss: 0.5964, test_loss: 1.0200, test_f1: 0.5897
 epoch: 39, train_loss: 0.6187, test_loss: 0.8899, test_f1: 0.5920
 epoch: 40, train_loss: 0.5868, test_loss: 1.0852, test_f1: 0.5885
 epoch: 41, train_loss: 0.5694, test_loss: 0.7785, test_f1: 0.6511
 epoch: 42, train_loss: 0.5814, test_loss: 0.7272, test_f1: 0.6253
 epoch: 43, train_loss: 0.5678, test_loss: 0.7696, test_f1: 0.6549
 epoch: 44, train_loss: 0.5743, test_loss: 1.1391, test_f1: 0.5909
 epoch: 45, train_loss: 0.5513, test_loss: 0.9328, test_f1: 0.6613
 epoch: 46, train_loss: 0.5349, test_loss: 1.0915, test_f1: 0.6359
 epoch: 47, train_loss: 0.5220, test_loss: 0.8749, test_f1: 0.6654
 epoch: 48, train_loss: 0.5317, test_loss: 0.9182, test_f1: 0.6640
 epoch: 49, train_loss: 0.5351, test_loss: 1.0057, test_f1: 0.6262
 epoch: 50, train_loss: 0.5494, test_loss: 0.8059, test_f1: 0.6382
 epoch: 51, train_loss: 0.5009, test_loss: 0.8616, test_f1: 0.6694
 epoch: 52, train_loss: 0.4610, test_loss: 0.8245, test_f1: 0.6868
 epoch: 53, train_loss: 0.4496, test_loss: 0.9051, test_f1: 0.6705
 epoch: 54, train_loss: 0.4296, test_loss: 0.8601, test_f1: 0.6834
 epoch: 55, train_loss: 0.4518, test_loss: 0.9638, test_f1: 0.6438
 epoch: 56, train_loss: 0.4362, test_loss: 1.0269, test_f1: 0.6836
 epoch: 57, train_loss: 0.4296, test_loss: 0.9241, test_f1: 0.6438
 epoch: 58, train_loss: 0.4414, test_loss: 0.9351, test_f1: 0.6467
 epoch: 59, train_loss: 0.4152, test_loss: 0.9339, test_f1: 0.6655
 epoch: 60, train_loss: 0.3928, test_loss: 0.9835, test_f1: 0.6296
 epoch: 61, train_loss: 0.4147, test_loss: 0.7852, test_f1: 0.6909
 epoch: 62, train_loss: 0.4137, test_loss: 0.8624, test_f1: 0.6593
 epoch: 63, train_loss: 0.4033, test_loss: 0.8968, test_f1: 0.6599
 epoch: 64, train_loss: 0.3960, test_loss: 0.9692, test_f1: 0.6878
 epoch: 65, train_loss: 0.3982, test_loss: 0.9411, test_f1: 0.6541
 epoch: 66, train_loss: 0.3984, test_loss: 1.0125, test_f1: 0.6787
 epoch: 67, train_loss: 0.3717, test_loss: 0.9858, test_f1: 0.6862
 epoch: 68, train_loss: 0.3853, test_loss: 0.9488, test_f1: 0.6939
 epoch: 69, train_loss: 0.3830, test_loss: 0.9105, test_f1: 0.6365
 epoch: 70, train_loss: 0.3807, test_loss: 0.9538, test_f1: 0.6596
 epoch: 71, train_loss: 0.3825, test_loss: 0.9959, test_f1: 0.6475
 epoch: 72, train_loss: 0.3943, test_loss: 0.9608, test_f1: 0.6991
 epoch: 73, train_loss: 0.3802, test_loss: 1.0040, test_f1: 0.6409
 epoch: 74, train_loss: 0.3615, test_loss: 1.0114, test_f1: 0.6469
 epoch: 75, train_loss: 0.3723, test_loss: 0.8502, test_f1: 0.6876
 epoch: 76, train_loss: 0.3613, test_loss: 0.9188, test_f1: 0.6650
 epoch: 77, train_loss: 0.3516, test_loss: 0.8849, test_f1: 0.6543
 epoch: 78, train_loss: 0.3424, test_loss: 0.8848, test_f1: 0.6664
 epoch: 79, train_loss: 0.3551, test_loss: 1.0611, test_f1: 0.6139
 epoch: 80, train_loss: 0.3461, test_loss: 1.0096, test_f1: 0.6388
 epoch: 81, train_loss: 0.3224, test_loss: 0.8809, test_f1: 0.6565
 epoch: 82, train_loss: 0.3355, test_loss: 1.0094, test_f1: 0.6185
 epoch: 83, train_loss: 0.3266, test_loss: 0.9511, test_f1: 0.6556
 epoch: 84, train_loss: 0.3405, test_loss: 1.0478, test_f1: 0.6615
 epoch: 85, train_loss: 0.3297, test_loss: 1.2251, test_f1: 0.6323
 epoch: 86, train_loss: 0.3247, test_loss: 0.9774, test_f1: 0.6637
 epoch: 87, train_loss: 0.3093, test_loss: 1.1433, test_f1: 0.6500
 epoch: 88, train_loss: 0.3312, test_loss: 1.0843, test_f1: 0.6538
 epoch: 89, train_loss: 0.3490, test_loss: 1.0660, test_f1: 0.6446
 epoch: 90, train_loss: 0.3067, test_loss: 1.0436, test_f1: 0.6439
 epoch: 91, train_loss: 0.3205, test_loss: 1.0841, test_f1: 0.6419
 epoch: 92, train_loss: 0.3069, test_loss: 1.1266, test_f1: 0.6448
 epoch: 93, train_loss: 0.3160, test_loss: 0.9473, test_f1: 0.6712
 epoch: 94, train_loss: 0.3107, test_loss: 1.0214, test_f1: 0.6523
 epoch: 95, train_loss: 0.2745, test_loss: 1.0662, test_f1: 0.6479
 epoch: 96, train_loss: 0.2671, test_loss: 1.0586, test_f1: 0.6754
 epoch: 97, train_loss: 0.2955, test_loss: 1.0623, test_f1: 0.6419
 epoch: 98, train_loss: 0.2886, test_loss: 1.0612, test_f1: 0.6589
 epoch: 99, train_loss: 0.2865, test_loss: 1.0284, test_f1: 0.6500
##################ITERATION #1 ****************************************
 epoch: 0, train_loss: 1.1640, test_loss: 1.3045, test_f1: 0.4060
 epoch: 1, train_loss: 0.9901, test_loss: 0.9689, test_f1: 0.4834
 epoch: 2, train_loss: 0.9672, test_loss: 0.8796, test_f1: 0.5329
 epoch: 3, train_loss: 0.9258, test_loss: 0.9855, test_f1: 0.4594
 epoch: 4, train_loss: 0.9293, test_loss: 1.0519, test_f1: 0.4567
 epoch: 5, train_loss: 0.9059, test_loss: 0.8815, test_f1: 0.5261
 epoch: 6, train_loss: 0.8799, test_loss: 1.0304, test_f1: 0.5085
 epoch: 7, train_loss: 0.8559, test_loss: 1.0021, test_f1: 0.5367
 epoch: 8, train_loss: 0.8390, test_loss: 1.0973, test_f1: 0.5139
 epoch: 9, train_loss: 0.8620, test_loss: 0.7956, test_f1: 0.5516
 epoch: 10, train_loss: 0.8230, test_loss: 0.8925, test_f1: 0.5482
 epoch: 11, train_loss: 0.8124, test_loss: 0.8676, test_f1: 0.5720
 epoch: 12, train_loss: 0.8156, test_loss: 1.0653, test_f1: 0.5245
 epoch: 13, train_loss: 0.8324, test_loss: 0.8467, test_f1: 0.5544
 epoch: 14, train_loss: 0.8046, test_loss: 1.0181, test_f1: 0.5401
 epoch: 15, train_loss: 0.7998, test_loss: 0.7823, test_f1: 0.6312
 epoch: 16, train_loss: 0.7798, test_loss: 0.8981, test_f1: 0.6137
 epoch: 17, train_loss: 0.7614, test_loss: 0.8773, test_f1: 0.6260
 epoch: 18, train_loss: 0.7451, test_loss: 0.9084, test_f1: 0.6336
 epoch: 19, train_loss: 0.7378, test_loss: 0.8001, test_f1: 0.6191
 epoch: 20, train_loss: 0.7327, test_loss: 0.8011, test_f1: 0.5933
 epoch: 21, train_loss: 0.7369, test_loss: 0.9729, test_f1: 0.5982
 epoch: 22, train_loss: 0.7175, test_loss: 1.1425, test_f1: 0.5942
 epoch: 23, train_loss: 0.7089, test_loss: 1.0338, test_f1: 0.5931
 epoch: 24, train_loss: 0.6929, test_loss: 1.1578, test_f1: 0.5135
 epoch: 25, train_loss: 0.6968, test_loss: 0.8691, test_f1: 0.6064
 epoch: 26, train_loss: 0.6765, test_loss: 0.9490, test_f1: 0.5507
 epoch: 27, train_loss: 0.6921, test_loss: 0.8985, test_f1: 0.6239
 epoch: 28, train_loss: 0.6722, test_loss: 1.0219, test_f1: 0.6377
 epoch: 29, train_loss: 0.6699, test_loss: 0.9462, test_f1: 0.5867
 epoch: 30, train_loss: 0.6641, test_loss: 0.9165, test_f1: 0.6144
 epoch: 31, train_loss: 0.6709, test_loss: 0.9488, test_f1: 0.6381
 epoch: 32, train_loss: 0.6380, test_loss: 0.9877, test_f1: 0.6204
 epoch: 33, train_loss: 0.6290, test_loss: 1.2860, test_f1: 0.5826
 epoch: 34, train_loss: 0.6442, test_loss: 1.0434, test_f1: 0.5908
 epoch: 35, train_loss: 0.6281, test_loss: 1.0585, test_f1: 0.6652
 epoch: 36, train_loss: 0.6056, test_loss: 1.0542, test_f1: 0.6211
 epoch: 37, train_loss: 0.6033, test_loss: 1.3167, test_f1: 0.6047
 epoch: 38, train_loss: 0.6099, test_loss: 1.0193, test_f1: 0.6139
 epoch: 39, train_loss: 0.5879, test_loss: 0.9328, test_f1: 0.6370
 epoch: 40, train_loss: 0.5634, test_loss: 0.9478, test_f1: 0.6432
 epoch: 41, train_loss: 0.5676, test_loss: 0.8575, test_f1: 0.6515
 epoch: 42, train_loss: 0.5712, test_loss: 0.8536, test_f1: 0.6428
 epoch: 43, train_loss: 0.5430, test_loss: 0.9448, test_f1: 0.6376
 epoch: 44, train_loss: 0.5748, test_loss: 0.9359, test_f1: 0.6216
 epoch: 45, train_loss: 0.5617, test_loss: 0.9269, test_f1: 0.6110
 epoch: 46, train_loss: 0.5501, test_loss: 1.3345, test_f1: 0.6232
 epoch: 47, train_loss: 0.5498, test_loss: 1.1344, test_f1: 0.6518
 epoch: 48, train_loss: 0.5426, test_loss: 1.1257, test_f1: 0.6440
 epoch: 49, train_loss: 0.5441, test_loss: 1.0439, test_f1: 0.6629
 epoch: 50, train_loss: 0.5408, test_loss: 1.0290, test_f1: 0.6324
 epoch: 51, train_loss: 0.4953, test_loss: 1.1175, test_f1: 0.6822
 epoch: 52, train_loss: 0.4497, test_loss: 1.2351, test_f1: 0.6630
 epoch: 53, train_loss: 0.4431, test_loss: 1.1103, test_f1: 0.6788
 epoch: 54, train_loss: 0.4130, test_loss: 1.2607, test_f1: 0.6557
 epoch: 55, train_loss: 0.4255, test_loss: 1.1364, test_f1: 0.6617
 epoch: 56, train_loss: 0.4306, test_loss: 1.1451, test_f1: 0.6604
 epoch: 57, train_loss: 0.4272, test_loss: 1.1500, test_f1: 0.6455
 epoch: 58, train_loss: 0.4074, test_loss: 1.1572, test_f1: 0.6447
 epoch: 59, train_loss: 0.4062, test_loss: 1.1274, test_f1: 0.6768
 epoch: 60, train_loss: 0.4086, test_loss: 1.0872, test_f1: 0.6545
 epoch: 61, train_loss: 0.3870, test_loss: 1.2138, test_f1: 0.6693
 epoch: 62, train_loss: 0.3773, test_loss: 1.4090, test_f1: 0.6622
 epoch: 63, train_loss: 0.3712, test_loss: 1.1953, test_f1: 0.6570
 epoch: 64, train_loss: 0.3985, test_loss: 1.1136, test_f1: 0.6324
 epoch: 65, train_loss: 0.3740, test_loss: 1.1239, test_f1: 0.6400
 epoch: 66, train_loss: 0.3782, test_loss: 1.4066, test_f1: 0.6464
 epoch: 67, train_loss: 0.3462, test_loss: 1.0101, test_f1: 0.6859
 epoch: 68, train_loss: 0.3622, test_loss: 1.2022, test_f1: 0.6472
 epoch: 69, train_loss: 0.3812, test_loss: 1.2706, test_f1: 0.6471
 epoch: 70, train_loss: 0.3361, test_loss: 1.1886, test_f1: 0.6809
 epoch: 71, train_loss: 0.3682, test_loss: 1.4621, test_f1: 0.6189
 epoch: 72, train_loss: 0.3811, test_loss: 1.3587, test_f1: 0.6635
 epoch: 73, train_loss: 0.3543, test_loss: 1.4479, test_f1: 0.6328
 epoch: 74, train_loss: 0.3361, test_loss: 1.4935, test_f1: 0.6755
 epoch: 75, train_loss: 0.3353, test_loss: 1.5954, test_f1: 0.6549
 epoch: 76, train_loss: 0.3511, test_loss: 1.6105, test_f1: 0.6100
 epoch: 77, train_loss: 0.3294, test_loss: 1.5827, test_f1: 0.6938
 epoch: 78, train_loss: 0.3376, test_loss: 1.7573, test_f1: 0.6568
 epoch: 79, train_loss: 0.3096, test_loss: 1.2588, test_f1: 0.6796
 epoch: 80, train_loss: 0.3126, test_loss: 1.5632, test_f1: 0.6542
 epoch: 81, train_loss: 0.3206, test_loss: 1.4941, test_f1: 0.6637
 epoch: 82, train_loss: 0.3211, test_loss: 1.2948, test_f1: 0.6941
 epoch: 83, train_loss: 0.3108, test_loss: 1.6465, test_f1: 0.6533
 epoch: 84, train_loss: 0.3243, test_loss: 1.7719, test_f1: 0.6356
 epoch: 85, train_loss: 0.3226, test_loss: 1.6381, test_f1: 0.6278
 epoch: 86, train_loss: 0.3270, test_loss: 1.3959, test_f1: 0.6607
 epoch: 87, train_loss: 0.3025, test_loss: 1.6362, test_f1: 0.6568
 epoch: 88, train_loss: 0.3314, test_loss: 1.6326, test_f1: 0.6634
 epoch: 89, train_loss: 0.2964, test_loss: 1.9946, test_f1: 0.6483
 epoch: 90, train_loss: 0.2970, test_loss: 1.8834, test_f1: 0.6320
 epoch: 91, train_loss: 0.2903, test_loss: 1.6005, test_f1: 0.6434
 epoch: 92, train_loss: 0.2984, test_loss: 1.4909, test_f1: 0.6673
 epoch: 93, train_loss: 0.3017, test_loss: 1.6726, test_f1: 0.6778
 epoch: 94, train_loss: 0.2794, test_loss: 1.5928, test_f1: 0.6288
 epoch: 95, train_loss: 0.2875, test_loss: 1.6063, test_f1: 0.6556
 epoch: 96, train_loss: 0.2923, test_loss: 1.2483, test_f1: 0.6507
 epoch: 97, train_loss: 0.3027, test_loss: 1.5415, test_f1: 0.6572
 epoch: 98, train_loss: 0.2727, test_loss: 1.5187, test_f1: 0.6614
 epoch: 99, train_loss: 0.2949, test_loss: 1.4712, test_f1: 0.6639
##################ITERATION #2 ****************************************
 epoch: 0, train_loss: 1.2053, test_loss: 1.1203, test_f1: 0.3982
 epoch: 1, train_loss: 0.9958, test_loss: 1.0734, test_f1: 0.4234
 epoch: 2, train_loss: 0.9557, test_loss: 1.0961, test_f1: 0.4731
 epoch: 3, train_loss: 0.9106, test_loss: 1.1336, test_f1: 0.5663
 epoch: 4, train_loss: 0.9054, test_loss: 1.0101, test_f1: 0.4806
 epoch: 5, train_loss: 0.8981, test_loss: 0.9191, test_f1: 0.5518
 epoch: 6, train_loss: 0.8852, test_loss: 0.9866, test_f1: 0.5158
 epoch: 7, train_loss: 0.8643, test_loss: 0.8942, test_f1: 0.5443
 epoch: 8, train_loss: 0.8359, test_loss: 0.9151, test_f1: 0.5466
 epoch: 9, train_loss: 0.8631, test_loss: 0.8383, test_f1: 0.5518
 epoch: 10, train_loss: 0.8287, test_loss: 0.8849, test_f1: 0.5574
 epoch: 11, train_loss: 0.8090, test_loss: 1.0087, test_f1: 0.5133
 epoch: 12, train_loss: 0.8063, test_loss: 0.9290, test_f1: 0.5549
 epoch: 13, train_loss: 0.8071, test_loss: 0.8247, test_f1: 0.5590
 epoch: 14, train_loss: 0.7800, test_loss: 1.0597, test_f1: 0.5123
 epoch: 15, train_loss: 0.7742, test_loss: 0.9026, test_f1: 0.5544
 epoch: 16, train_loss: 0.7496, test_loss: 0.9597, test_f1: 0.5194
 epoch: 17, train_loss: 0.7501, test_loss: 0.9530, test_f1: 0.5684
 epoch: 18, train_loss: 0.7440, test_loss: 0.8635, test_f1: 0.5910
 epoch: 19, train_loss: 0.7358, test_loss: 0.9481, test_f1: 0.5714
 epoch: 20, train_loss: 0.7399, test_loss: 0.7639, test_f1: 0.5807
 epoch: 21, train_loss: 0.7222, test_loss: 0.8170, test_f1: 0.5675
 epoch: 22, train_loss: 0.7333, test_loss: 0.9177, test_f1: 0.5625
 epoch: 23, train_loss: 0.7247, test_loss: 0.9055, test_f1: 0.6106
 epoch: 24, train_loss: 0.7134, test_loss: 0.9451, test_f1: 0.6048
 epoch: 25, train_loss: 0.6936, test_loss: 0.7846, test_f1: 0.6539
 epoch: 26, train_loss: 0.6907, test_loss: 0.7447, test_f1: 0.5878
 epoch: 27, train_loss: 0.6706, test_loss: 0.7749, test_f1: 0.6463
 epoch: 28, train_loss: 0.6732, test_loss: 0.8466, test_f1: 0.6375
 epoch: 29, train_loss: 0.6645, test_loss: 0.8174, test_f1: 0.6290
 epoch: 30, train_loss: 0.6612, test_loss: 0.8390, test_f1: 0.5926
 epoch: 31, train_loss: 0.6784, test_loss: 0.8929, test_f1: 0.6228
 epoch: 32, train_loss: 0.6809, test_loss: 0.8815, test_f1: 0.5753
 epoch: 33, train_loss: 0.6523, test_loss: 0.9051, test_f1: 0.6371
 epoch: 34, train_loss: 0.6357, test_loss: 0.9217, test_f1: 0.5791
 epoch: 35, train_loss: 0.6374, test_loss: 0.9137, test_f1: 0.5705
 epoch: 36, train_loss: 0.6357, test_loss: 0.9939, test_f1: 0.5728
 epoch: 37, train_loss: 0.6270, test_loss: 1.0298, test_f1: 0.6427
 epoch: 38, train_loss: 0.6046, test_loss: 0.9596, test_f1: 0.5950
 epoch: 39, train_loss: 0.6314, test_loss: 1.0706, test_f1: 0.5402
 epoch: 40, train_loss: 0.6416, test_loss: 0.8824, test_f1: 0.6438
 epoch: 41, train_loss: 0.5807, test_loss: 0.9554, test_f1: 0.6791
 epoch: 42, train_loss: 0.5860, test_loss: 0.8745, test_f1: 0.6308
 epoch: 43, train_loss: 0.5910, test_loss: 1.0331, test_f1: 0.5888
 epoch: 44, train_loss: 0.5913, test_loss: 0.7218, test_f1: 0.6766
 epoch: 45, train_loss: 0.5845, test_loss: 0.8793, test_f1: 0.6438
 epoch: 46, train_loss: 0.5604, test_loss: 1.0208, test_f1: 0.6583
 epoch: 47, train_loss: 0.5774, test_loss: 0.9555, test_f1: 0.6609
 epoch: 48, train_loss: 0.5546, test_loss: 0.8252, test_f1: 0.6830
 epoch: 49, train_loss: 0.5662, test_loss: 1.1248, test_f1: 0.6227
 epoch: 50, train_loss: 0.5646, test_loss: 0.8950, test_f1: 0.6275
 epoch: 51, train_loss: 0.4908, test_loss: 0.9488, test_f1: 0.6611
 epoch: 52, train_loss: 0.4609, test_loss: 1.0416, test_f1: 0.6808
 epoch: 53, train_loss: 0.4648, test_loss: 1.0031, test_f1: 0.6549
 epoch: 54, train_loss: 0.4440, test_loss: 0.9571, test_f1: 0.6888
 epoch: 55, train_loss: 0.4440, test_loss: 1.0245, test_f1: 0.6879
 epoch: 56, train_loss: 0.4349, test_loss: 0.9402, test_f1: 0.6988
 epoch: 57, train_loss: 0.4274, test_loss: 1.1920, test_f1: 0.6266
 epoch: 58, train_loss: 0.4460, test_loss: 1.1012, test_f1: 0.6694
 epoch: 59, train_loss: 0.4213, test_loss: 1.1657, test_f1: 0.6325
 epoch: 60, train_loss: 0.4207, test_loss: 1.1086, test_f1: 0.6626
 epoch: 61, train_loss: 0.4185, test_loss: 1.1191, test_f1: 0.6874
 epoch: 62, train_loss: 0.4040, test_loss: 1.1273, test_f1: 0.6723
 epoch: 63, train_loss: 0.4142, test_loss: 1.0805, test_f1: 0.6840
 epoch: 64, train_loss: 0.4123, test_loss: 1.1038, test_f1: 0.6774
 epoch: 65, train_loss: 0.3975, test_loss: 1.2495, test_f1: 0.6693
 epoch: 66, train_loss: 0.3969, test_loss: 1.2295, test_f1: 0.6797
 epoch: 67, train_loss: 0.4027, test_loss: 1.1740, test_f1: 0.6845
 epoch: 68, train_loss: 0.3863, test_loss: 1.2223, test_f1: 0.6714
 epoch: 69, train_loss: 0.3991, test_loss: 1.3428, test_f1: 0.6570
 epoch: 70, train_loss: 0.3872, test_loss: 1.4717, test_f1: 0.6176
 epoch: 71, train_loss: 0.3860, test_loss: 1.2956, test_f1: 0.6591
 epoch: 72, train_loss: 0.3812, test_loss: 1.3577, test_f1: 0.6750
 epoch: 73, train_loss: 0.3614, test_loss: 1.4011, test_f1: 0.6825
 epoch: 74, train_loss: 0.3688, test_loss: 1.3400, test_f1: 0.6432
 epoch: 75, train_loss: 0.3602, test_loss: 1.1872, test_f1: 0.6941
 epoch: 76, train_loss: 0.3545, test_loss: 1.3928, test_f1: 0.6673
 epoch: 77, train_loss: 0.3587, test_loss: 1.2174, test_f1: 0.6683
 epoch: 78, train_loss: 0.3607, test_loss: 1.3241, test_f1: 0.6631
 epoch: 79, train_loss: 0.3465, test_loss: 1.3324, test_f1: 0.6832
 epoch: 80, train_loss: 0.3522, test_loss: 1.6007, test_f1: 0.6864
 epoch: 81, train_loss: 0.3560, test_loss: 1.2379, test_f1: 0.6831
 epoch: 82, train_loss: 0.3546, test_loss: 1.3604, test_f1: 0.6866
 epoch: 83, train_loss: 0.3276, test_loss: 1.3538, test_f1: 0.6838
 epoch: 84, train_loss: 0.3485, test_loss: 1.3883, test_f1: 0.6564
 epoch: 85, train_loss: 0.3436, test_loss: 1.4054, test_f1: 0.6533
 epoch: 86, train_loss: 0.3469, test_loss: 1.3164, test_f1: 0.6771
 epoch: 87, train_loss: 0.3531, test_loss: 1.3933, test_f1: 0.6868
 epoch: 88, train_loss: 0.3210, test_loss: 1.3020, test_f1: 0.6628
 epoch: 89, train_loss: 0.3424, test_loss: 1.3383, test_f1: 0.6830
 epoch: 90, train_loss: 0.3374, test_loss: 1.3563, test_f1: 0.6676
 epoch: 91, train_loss: 0.3297, test_loss: 1.6178, test_f1: 0.6649
 epoch: 92, train_loss: 0.3187, test_loss: 1.4913, test_f1: 0.6673
 epoch: 93, train_loss: 0.3190, test_loss: 1.3890, test_f1: 0.6815
 epoch: 94, train_loss: 0.3034, test_loss: 1.4883, test_f1: 0.6369
 epoch: 95, train_loss: 0.3046, test_loss: 1.4520, test_f1: 0.6704
 epoch: 96, train_loss: 0.2990, test_loss: 1.2996, test_f1: 0.6785
 epoch: 97, train_loss: 0.3007, test_loss: 1.4712, test_f1: 0.6545
 epoch: 98, train_loss: 0.2955, test_loss: 1.3902, test_f1: 0.6711
 epoch: 99, train_loss: 0.3190, test_loss: 1.1848, test_f1: 0.6593
##################ITERATION #3 ****************************************
 epoch: 0, train_loss: 1.1889, test_loss: 1.1014, test_f1: 0.3289
 epoch: 1, train_loss: 1.0051, test_loss: 1.0329, test_f1: 0.4743
 epoch: 2, train_loss: 0.9676, test_loss: 1.3138, test_f1: 0.4185
 epoch: 3, train_loss: 0.9398, test_loss: 0.9298, test_f1: 0.5044
 epoch: 4, train_loss: 0.9104, test_loss: 1.1027, test_f1: 0.4619
 epoch: 5, train_loss: 0.9118, test_loss: 1.0356, test_f1: 0.4935
 epoch: 6, train_loss: 0.8829, test_loss: 0.8737, test_f1: 0.5340
 epoch: 7, train_loss: 0.8507, test_loss: 1.0429, test_f1: 0.4481
 epoch: 8, train_loss: 0.8569, test_loss: 0.8363, test_f1: 0.5722
 epoch: 9, train_loss: 0.8371, test_loss: 0.7971, test_f1: 0.5472
 epoch: 10, train_loss: 0.8209, test_loss: 0.9288, test_f1: 0.5940
 epoch: 11, train_loss: 0.8251, test_loss: 0.8879, test_f1: 0.5961
 epoch: 12, train_loss: 0.8009, test_loss: 0.7853, test_f1: 0.5863
 epoch: 13, train_loss: 0.8016, test_loss: 0.8358, test_f1: 0.5496
 epoch: 14, train_loss: 0.7771, test_loss: 0.8457, test_f1: 0.5391
 epoch: 15, train_loss: 0.7696, test_loss: 0.8302, test_f1: 0.5770
 epoch: 16, train_loss: 0.7518, test_loss: 0.7826, test_f1: 0.5954
 epoch: 17, train_loss: 0.7697, test_loss: 0.9196, test_f1: 0.5534
 epoch: 18, train_loss: 0.7395, test_loss: 0.9233, test_f1: 0.5578
 epoch: 19, train_loss: 0.7252, test_loss: 0.9628, test_f1: 0.5298
 epoch: 20, train_loss: 0.7571, test_loss: 0.8201, test_f1: 0.5725
 epoch: 21, train_loss: 0.7437, test_loss: 0.8004, test_f1: 0.5844
 epoch: 22, train_loss: 0.7098, test_loss: 0.8832, test_f1: 0.6146
 epoch: 23, train_loss: 0.7184, test_loss: 0.8325, test_f1: 0.6004
 epoch: 24, train_loss: 0.7043, test_loss: 0.7836, test_f1: 0.6232
 epoch: 25, train_loss: 0.6793, test_loss: 1.2080, test_f1: 0.6151
 epoch: 26, train_loss: 0.6653, test_loss: 0.9097, test_f1: 0.5518
 epoch: 27, train_loss: 0.6870, test_loss: 0.8875, test_f1: 0.5602
 epoch: 28, train_loss: 0.6991, test_loss: 0.7934, test_f1: 0.5746
 epoch: 29, train_loss: 0.6539, test_loss: 0.8313, test_f1: 0.6246
 epoch: 30, train_loss: 0.6412, test_loss: 0.9830, test_f1: 0.6351
 epoch: 31, train_loss: 0.6335, test_loss: 1.1234, test_f1: 0.6251
 epoch: 32, train_loss: 0.6653, test_loss: 1.0533, test_f1: 0.6312
 epoch: 33, train_loss: 0.6466, test_loss: 1.0983, test_f1: 0.5646
 epoch: 34, train_loss: 0.6527, test_loss: 0.8529, test_f1: 0.6361
 epoch: 35, train_loss: 0.6266, test_loss: 0.8966, test_f1: 0.5805
 epoch: 36, train_loss: 0.6169, test_loss: 1.0188, test_f1: 0.5589
 epoch: 37, train_loss: 0.6537, test_loss: 0.8136, test_f1: 0.6052
 epoch: 38, train_loss: 0.6369, test_loss: 0.8227, test_f1: 0.5923
 epoch: 39, train_loss: 0.6245, test_loss: 0.8270, test_f1: 0.5900
 epoch: 40, train_loss: 0.6259, test_loss: 0.8860, test_f1: 0.6290
 epoch: 41, train_loss: 0.6128, test_loss: 0.7881, test_f1: 0.6423
 epoch: 42, train_loss: 0.6034, test_loss: 0.8063, test_f1: 0.6264
 epoch: 43, train_loss: 0.5807, test_loss: 0.7960, test_f1: 0.6295
 epoch: 44, train_loss: 0.6039, test_loss: 1.0061, test_f1: 0.5837
 epoch: 45, train_loss: 0.5895, test_loss: 0.9019, test_f1: 0.6280
 epoch: 46, train_loss: 0.5597, test_loss: 0.7907, test_f1: 0.6173
 epoch: 47, train_loss: 0.5719, test_loss: 1.0607, test_f1: 0.6194
 epoch: 48, train_loss: 0.5727, test_loss: 0.8411, test_f1: 0.5957
 epoch: 49, train_loss: 0.5691, test_loss: 0.7045, test_f1: 0.6492
 epoch: 50, train_loss: 0.5637, test_loss: 0.7874, test_f1: 0.6481
 epoch: 51, train_loss: 0.5212, test_loss: 0.8468, test_f1: 0.6613
 epoch: 52, train_loss: 0.5051, test_loss: 0.8205, test_f1: 0.6367
 epoch: 53, train_loss: 0.4673, test_loss: 0.7977, test_f1: 0.6596
 epoch: 54, train_loss: 0.4784, test_loss: 0.7285, test_f1: 0.6452
 epoch: 55, train_loss: 0.4798, test_loss: 0.8489, test_f1: 0.6307
 epoch: 56, train_loss: 0.4584, test_loss: 0.8375, test_f1: 0.6543
 epoch: 57, train_loss: 0.4533, test_loss: 0.8666, test_f1: 0.6469
 epoch: 58, train_loss: 0.4595, test_loss: 0.9380, test_f1: 0.6190
 epoch: 59, train_loss: 0.4496, test_loss: 0.7756, test_f1: 0.6583
 epoch: 60, train_loss: 0.4400, test_loss: 0.7230, test_f1: 0.6662
 epoch: 61, train_loss: 0.4525, test_loss: 0.8576, test_f1: 0.6580
 epoch: 62, train_loss: 0.4161, test_loss: 0.7588, test_f1: 0.6470
 epoch: 63, train_loss: 0.4148, test_loss: 0.7826, test_f1: 0.6637
 epoch: 64, train_loss: 0.4340, test_loss: 0.7870, test_f1: 0.6554
 epoch: 65, train_loss: 0.4246, test_loss: 0.9223, test_f1: 0.6626
 epoch: 66, train_loss: 0.4221, test_loss: 0.7975, test_f1: 0.6489
 epoch: 67, train_loss: 0.4149, test_loss: 0.9215, test_f1: 0.6265
 epoch: 68, train_loss: 0.4023, test_loss: 0.9350, test_f1: 0.6549
 epoch: 69, train_loss: 0.4129, test_loss: 0.8363, test_f1: 0.6659
 epoch: 70, train_loss: 0.3917, test_loss: 0.8357, test_f1: 0.6596
 epoch: 71, train_loss: 0.3985, test_loss: 0.8262, test_f1: 0.6645
 epoch: 72, train_loss: 0.3712, test_loss: 0.8908, test_f1: 0.6440
 epoch: 73, train_loss: 0.4062, test_loss: 0.9470, test_f1: 0.6652
 epoch: 74, train_loss: 0.3789, test_loss: 0.9339, test_f1: 0.6522
 epoch: 75, train_loss: 0.3999, test_loss: 0.8445, test_f1: 0.6594
 epoch: 76, train_loss: 0.3780, test_loss: 0.8445, test_f1: 0.6695
 epoch: 77, train_loss: 0.3899, test_loss: 0.8142, test_f1: 0.6677
 epoch: 78, train_loss: 0.3628, test_loss: 1.0414, test_f1: 0.6450
 epoch: 79, train_loss: 0.3727, test_loss: 0.8789, test_f1: 0.6621
 epoch: 80, train_loss: 0.3638, test_loss: 0.8803, test_f1: 0.6824
 epoch: 81, train_loss: 0.3792, test_loss: 1.0382, test_f1: 0.6601
 epoch: 82, train_loss: 0.3648, test_loss: 1.0858, test_f1: 0.6547
 epoch: 83, train_loss: 0.3613, test_loss: 0.8367, test_f1: 0.6797
 epoch: 84, train_loss: 0.3688, test_loss: 0.7880, test_f1: 0.6655
 epoch: 85, train_loss: 0.3619, test_loss: 0.8126, test_f1: 0.6754
 epoch: 86, train_loss: 0.3478, test_loss: 0.8590, test_f1: 0.6692
 epoch: 87, train_loss: 0.3577, test_loss: 0.8983, test_f1: 0.6885
 epoch: 88, train_loss: 0.3321, test_loss: 0.8773, test_f1: 0.6737
 epoch: 89, train_loss: 0.3376, test_loss: 1.0075, test_f1: 0.6752
 epoch: 90, train_loss: 0.3502, test_loss: 1.0051, test_f1: 0.6307
 epoch: 91, train_loss: 0.3384, test_loss: 0.8811, test_f1: 0.6757
 epoch: 92, train_loss: 0.3249, test_loss: 0.8798, test_f1: 0.6621
 epoch: 93, train_loss: 0.3432, test_loss: 1.0802, test_f1: 0.6556
 epoch: 94, train_loss: 0.3448, test_loss: 0.9029, test_f1: 0.6660
 epoch: 95, train_loss: 0.3324, test_loss: 0.9807, test_f1: 0.6617
 epoch: 96, train_loss: 0.3063, test_loss: 0.9483, test_f1: 0.6730
 epoch: 97, train_loss: 0.3263, test_loss: 0.9166, test_f1: 0.6856
 epoch: 98, train_loss: 0.3061, test_loss: 1.0079, test_f1: 0.6478
 epoch: 99, train_loss: 0.3175, test_loss: 0.9803, test_f1: 0.6680
##################ITERATION #4 ****************************************
 epoch: 0, train_loss: 1.2209, test_loss: 1.1362, test_f1: 0.3484
 epoch: 1, train_loss: 1.0220, test_loss: 1.0222, test_f1: 0.4616
 epoch: 2, train_loss: 0.9867, test_loss: 1.0712, test_f1: 0.4314
 epoch: 3, train_loss: 0.9760, test_loss: 1.0380, test_f1: 0.4536
 epoch: 4, train_loss: 0.9394, test_loss: 1.0953, test_f1: 0.4614
 epoch: 5, train_loss: 0.8966, test_loss: 0.9958, test_f1: 0.4888
 epoch: 6, train_loss: 0.8922, test_loss: 0.9561, test_f1: 0.5239
 epoch: 7, train_loss: 0.8573, test_loss: 0.9017, test_f1: 0.5177
 epoch: 8, train_loss: 0.8577, test_loss: 1.0617, test_f1: 0.5143
 epoch: 9, train_loss: 0.8442, test_loss: 1.0112, test_f1: 0.4758
 epoch: 10, train_loss: 0.8353, test_loss: 1.0794, test_f1: 0.5107
 epoch: 11, train_loss: 0.8103, test_loss: 0.8701, test_f1: 0.5826
 epoch: 12, train_loss: 0.7922, test_loss: 0.8995, test_f1: 0.5282
 epoch: 13, train_loss: 0.8110, test_loss: 0.8857, test_f1: 0.5754
 epoch: 14, train_loss: 0.7879, test_loss: 0.9505, test_f1: 0.6058
 epoch: 15, train_loss: 0.7806, test_loss: 0.9246, test_f1: 0.5694
 epoch: 16, train_loss: 0.7493, test_loss: 0.8005, test_f1: 0.6093
 epoch: 17, train_loss: 0.7272, test_loss: 0.8990, test_f1: 0.5729
 epoch: 18, train_loss: 0.7354, test_loss: 0.8551, test_f1: 0.6250
 epoch: 19, train_loss: 0.7256, test_loss: 0.9985, test_f1: 0.6072
 epoch: 20, train_loss: 0.7085, test_loss: 0.8232, test_f1: 0.5091
 epoch: 21, train_loss: 0.7119, test_loss: 0.9317, test_f1: 0.5700
 epoch: 22, train_loss: 0.6810, test_loss: 0.8507, test_f1: 0.6495
 epoch: 23, train_loss: 0.6750, test_loss: 0.9281, test_f1: 0.5750
 epoch: 24, train_loss: 0.6612, test_loss: 0.7887, test_f1: 0.6170
 epoch: 25, train_loss: 0.6770, test_loss: 1.0932, test_f1: 0.5608
 epoch: 26, train_loss: 0.6815, test_loss: 0.7749, test_f1: 0.6075
 epoch: 27, train_loss: 0.6760, test_loss: 0.8976, test_f1: 0.6003
 epoch: 28, train_loss: 0.6390, test_loss: 0.8729, test_f1: 0.6192
 epoch: 29, train_loss: 0.6362, test_loss: 0.8649, test_f1: 0.6177
 epoch: 30, train_loss: 0.6274, test_loss: 0.9365, test_f1: 0.6016
 epoch: 31, train_loss: 0.6289, test_loss: 0.8572, test_f1: 0.5959
 epoch: 32, train_loss: 0.5920, test_loss: 0.8649, test_f1: 0.6158
 epoch: 33, train_loss: 0.6136, test_loss: 0.7780, test_f1: 0.6813
 epoch: 34, train_loss: 0.6065, test_loss: 0.8467, test_f1: 0.6504
 epoch: 35, train_loss: 0.5959, test_loss: 0.8857, test_f1: 0.6207
 epoch: 36, train_loss: 0.5905, test_loss: 0.7757, test_f1: 0.6251
 epoch: 37, train_loss: 0.6116, test_loss: 0.7907, test_f1: 0.6625
 epoch: 38, train_loss: 0.5881, test_loss: 0.7975, test_f1: 0.6470
 epoch: 39, train_loss: 0.5936, test_loss: 0.9281, test_f1: 0.6615
 epoch: 40, train_loss: 0.5710, test_loss: 0.9002, test_f1: 0.6300
 epoch: 41, train_loss: 0.5650, test_loss: 0.8516, test_f1: 0.6223
 epoch: 42, train_loss: 0.5707, test_loss: 0.8668, test_f1: 0.6484
 epoch: 43, train_loss: 0.5789, test_loss: 0.9447, test_f1: 0.5918
 epoch: 44, train_loss: 0.5625, test_loss: 0.8014, test_f1: 0.6540
 epoch: 45, train_loss: 0.5620, test_loss: 0.8484, test_f1: 0.6383
 epoch: 46, train_loss: 0.5704, test_loss: 0.7444, test_f1: 0.6928
 epoch: 47, train_loss: 0.5551, test_loss: 0.7869, test_f1: 0.6903
 epoch: 48, train_loss: 0.5405, test_loss: 0.9298, test_f1: 0.6478
 epoch: 49, train_loss: 0.5298, test_loss: 0.9985, test_f1: 0.6508
 epoch: 50, train_loss: 0.5341, test_loss: 0.8911, test_f1: 0.6552
 epoch: 51, train_loss: 0.4626, test_loss: 0.8026, test_f1: 0.6932
 epoch: 52, train_loss: 0.4659, test_loss: 0.7197, test_f1: 0.6853
 epoch: 53, train_loss: 0.4534, test_loss: 0.8395, test_f1: 0.6824
 epoch: 54, train_loss: 0.4227, test_loss: 0.8367, test_f1: 0.6949
 epoch: 55, train_loss: 0.4272, test_loss: 0.8062, test_f1: 0.6900
 epoch: 56, train_loss: 0.4041, test_loss: 0.9890, test_f1: 0.6666
 epoch: 57, train_loss: 0.4107, test_loss: 1.0525, test_f1: 0.6565
 epoch: 58, train_loss: 0.4148, test_loss: 0.8766, test_f1: 0.6833
 epoch: 59, train_loss: 0.4060, test_loss: 0.9562, test_f1: 0.6746
 epoch: 60, train_loss: 0.3929, test_loss: 0.9387, test_f1: 0.6608
 epoch: 61, train_loss: 0.3993, test_loss: 1.0559, test_f1: 0.6829
 epoch: 62, train_loss: 0.4033, test_loss: 1.0657, test_f1: 0.6575
 epoch: 63, train_loss: 0.4003, test_loss: 0.9292, test_f1: 0.6709
 epoch: 64, train_loss: 0.3878, test_loss: 0.8667, test_f1: 0.6801
 epoch: 65, train_loss: 0.4086, test_loss: 0.8936, test_f1: 0.6557
 epoch: 66, train_loss: 0.3873, test_loss: 0.9945, test_f1: 0.6358
 epoch: 67, train_loss: 0.3937, test_loss: 0.9933, test_f1: 0.6802
 epoch: 68, train_loss: 0.3820, test_loss: 1.0275, test_f1: 0.6811
 epoch: 69, train_loss: 0.3752, test_loss: 1.1244, test_f1: 0.6492
 epoch: 70, train_loss: 0.3751, test_loss: 1.0600, test_f1: 0.6358
 epoch: 71, train_loss: 0.3789, test_loss: 1.0350, test_f1: 0.6758
 epoch: 72, train_loss: 0.3812, test_loss: 0.9763, test_f1: 0.6832
 epoch: 73, train_loss: 0.3720, test_loss: 1.0641, test_f1: 0.6753
 epoch: 74, train_loss: 0.3569, test_loss: 1.0737, test_f1: 0.6715
 epoch: 75, train_loss: 0.3544, test_loss: 1.1897, test_f1: 0.6988
 epoch: 76, train_loss: 0.3513, test_loss: 1.2591, test_f1: 0.6540
 epoch: 77, train_loss: 0.3518, test_loss: 1.2143, test_f1: 0.6542
 epoch: 78, train_loss: 0.3350, test_loss: 1.1935, test_f1: 0.6514
 epoch: 79, train_loss: 0.3435, test_loss: 0.9899, test_f1: 0.6858
 epoch: 80, train_loss: 0.3618, test_loss: 0.9330, test_f1: 0.6828
 epoch: 81, train_loss: 0.3693, test_loss: 1.2125, test_f1: 0.6795
 epoch: 82, train_loss: 0.3379, test_loss: 1.1200, test_f1: 0.6859
 epoch: 83, train_loss: 0.3355, test_loss: 1.1300, test_f1: 0.6774
 epoch: 84, train_loss: 0.3283, test_loss: 1.0788, test_f1: 0.6758
 epoch: 85, train_loss: 0.3085, test_loss: 1.1314, test_f1: 0.6749
 epoch: 86, train_loss: 0.3094, test_loss: 1.1700, test_f1: 0.6818
 epoch: 87, train_loss: 0.2823, test_loss: 1.2130, test_f1: 0.6754
 epoch: 88, train_loss: 0.3369, test_loss: 1.2512, test_f1: 0.6834
 epoch: 89, train_loss: 0.3036, test_loss: 1.1883, test_f1: 0.6919
 epoch: 90, train_loss: 0.3148, test_loss: 1.5463, test_f1: 0.6486
 epoch: 91, train_loss: 0.3316, test_loss: 1.2946, test_f1: 0.6711
 epoch: 92, train_loss: 0.3006, test_loss: 1.1384, test_f1: 0.6718
 epoch: 93, train_loss: 0.2952, test_loss: 1.2800, test_f1: 0.6798
 epoch: 94, train_loss: 0.3048, test_loss: 1.1947, test_f1: 0.6988
 epoch: 95, train_loss: 0.3027, test_loss: 1.1281, test_f1: 0.6816
 epoch: 96, train_loss: 0.2779, test_loss: 1.3417, test_f1: 0.6676
 epoch: 97, train_loss: 0.2639, test_loss: 1.3138, test_f1: 0.6791
 epoch: 98, train_loss: 0.2816, test_loss: 1.2193, test_f1: 0.7055
 epoch: 99, train_loss: 0.2603, test_loss: 1.3314, test_f1: 0.6851
##################ITERATION #5 ****************************************
 epoch: 0, train_loss: 1.2550, test_loss: 1.1741, test_f1: 0.4010
 epoch: 1, train_loss: 1.0127, test_loss: 1.0490, test_f1: 0.5339
 epoch: 2, train_loss: 0.9738, test_loss: 1.0546, test_f1: 0.5393
 epoch: 3, train_loss: 0.9574, test_loss: 1.0706, test_f1: 0.5138
 epoch: 4, train_loss: 0.9227, test_loss: 0.8989, test_f1: 0.5226
 epoch: 5, train_loss: 0.9222, test_loss: 0.9827, test_f1: 0.4858
 epoch: 6, train_loss: 0.8682, test_loss: 1.0054, test_f1: 0.3988
 epoch: 7, train_loss: 0.8538, test_loss: 0.9170, test_f1: 0.5572
 epoch: 8, train_loss: 0.8360, test_loss: 0.9308, test_f1: 0.6038
 epoch: 9, train_loss: 0.8222, test_loss: 0.9147, test_f1: 0.5171
 epoch: 10, train_loss: 0.7939, test_loss: 0.8715, test_f1: 0.5965
 epoch: 11, train_loss: 0.8223, test_loss: 0.9295, test_f1: 0.5803
 epoch: 12, train_loss: 0.7835, test_loss: 0.8584, test_f1: 0.5886
 epoch: 13, train_loss: 0.7896, test_loss: 0.9141, test_f1: 0.5405
 epoch: 14, train_loss: 0.7776, test_loss: 1.0765, test_f1: 0.5428
 epoch: 15, train_loss: 0.7847, test_loss: 0.9140, test_f1: 0.6137
 epoch: 16, train_loss: 0.7690, test_loss: 0.8233, test_f1: 0.6135
 epoch: 17, train_loss: 0.7417, test_loss: 0.8196, test_f1: 0.5621
 epoch: 18, train_loss: 0.7753, test_loss: 0.8869, test_f1: 0.6140
 epoch: 19, train_loss: 0.7507, test_loss: 0.9881, test_f1: 0.5291
 epoch: 20, train_loss: 0.7395, test_loss: 0.8850, test_f1: 0.5515
 epoch: 21, train_loss: 0.7107, test_loss: 1.0652, test_f1: 0.5895
 epoch: 22, train_loss: 0.7414, test_loss: 0.8792, test_f1: 0.5458
 epoch: 23, train_loss: 0.7074, test_loss: 0.9479, test_f1: 0.6074
 epoch: 24, train_loss: 0.7073, test_loss: 0.9360, test_f1: 0.6270
 epoch: 25, train_loss: 0.6839, test_loss: 0.9872, test_f1: 0.5504
 epoch: 26, train_loss: 0.6934, test_loss: 0.9846, test_f1: 0.5888
 epoch: 27, train_loss: 0.6781, test_loss: 0.8601, test_f1: 0.5603
 epoch: 28, train_loss: 0.6737, test_loss: 0.8762, test_f1: 0.6036
 epoch: 29, train_loss: 0.6692, test_loss: 0.7763, test_f1: 0.6484
 epoch: 30, train_loss: 0.6524, test_loss: 0.9076, test_f1: 0.5508
 epoch: 31, train_loss: 0.6615, test_loss: 0.8764, test_f1: 0.6061
 epoch: 32, train_loss: 0.6347, test_loss: 1.0926, test_f1: 0.5522
 epoch: 33, train_loss: 0.6410, test_loss: 1.0576, test_f1: 0.5794
 epoch: 34, train_loss: 0.6157, test_loss: 1.1867, test_f1: 0.5365
 epoch: 35, train_loss: 0.6379, test_loss: 0.9668, test_f1: 0.6218
 epoch: 36, train_loss: 0.6137, test_loss: 0.8071, test_f1: 0.6282
 epoch: 37, train_loss: 0.6230, test_loss: 0.8665, test_f1: 0.6439
 epoch: 38, train_loss: 0.6097, test_loss: 1.2784, test_f1: 0.5744
 epoch: 39, train_loss: 0.5948, test_loss: 1.1342, test_f1: 0.5612
 epoch: 40, train_loss: 0.6145, test_loss: 0.8623, test_f1: 0.6284
 epoch: 41, train_loss: 0.5867, test_loss: 0.8892, test_f1: 0.6365
 epoch: 42, train_loss: 0.5651, test_loss: 1.0078, test_f1: 0.6102
 epoch: 43, train_loss: 0.5938, test_loss: 0.8419, test_f1: 0.6250
 epoch: 44, train_loss: 0.5765, test_loss: 0.8382, test_f1: 0.6520
 epoch: 45, train_loss: 0.5630, test_loss: 0.8569, test_f1: 0.6817
 epoch: 46, train_loss: 0.5839, test_loss: 1.1894, test_f1: 0.5819
 epoch: 47, train_loss: 0.5410, test_loss: 0.8131, test_f1: 0.6511
 epoch: 48, train_loss: 0.5624, test_loss: 0.9917, test_f1: 0.6457
 epoch: 49, train_loss: 0.5629, test_loss: 1.1597, test_f1: 0.6125
 epoch: 50, train_loss: 0.5558, test_loss: 1.1766, test_f1: 0.6396
 epoch: 51, train_loss: 0.5147, test_loss: 1.0312, test_f1: 0.6381
 epoch: 52, train_loss: 0.4755, test_loss: 0.9995, test_f1: 0.6743
 epoch: 53, train_loss: 0.4550, test_loss: 1.0474, test_f1: 0.6803
 epoch: 54, train_loss: 0.4607, test_loss: 1.2408, test_f1: 0.6662
 epoch: 55, train_loss: 0.4317, test_loss: 1.1113, test_f1: 0.6662
 epoch: 56, train_loss: 0.4586, test_loss: 1.0860, test_f1: 0.6515
 epoch: 57, train_loss: 0.4594, test_loss: 1.1242, test_f1: 0.6693
 epoch: 58, train_loss: 0.4323, test_loss: 1.1124, test_f1: 0.6594
 epoch: 59, train_loss: 0.4308, test_loss: 1.1736, test_f1: 0.6574
 epoch: 60, train_loss: 0.4194, test_loss: 1.2649, test_f1: 0.6480
 epoch: 61, train_loss: 0.4170, test_loss: 1.1631, test_f1: 0.6951
 epoch: 62, train_loss: 0.4060, test_loss: 1.1320, test_f1: 0.6986
 epoch: 63, train_loss: 0.4031, test_loss: 1.0557, test_f1: 0.6702
 epoch: 64, train_loss: 0.3903, test_loss: 1.3841, test_f1: 0.6470
 epoch: 65, train_loss: 0.4237, test_loss: 1.2907, test_f1: 0.6549
 epoch: 66, train_loss: 0.4094, test_loss: 1.3250, test_f1: 0.6690
 epoch: 67, train_loss: 0.3995, test_loss: 1.2069, test_f1: 0.6927
 epoch: 68, train_loss: 0.3935, test_loss: 1.2586, test_f1: 0.6826
 epoch: 69, train_loss: 0.3735, test_loss: 1.0800, test_f1: 0.6901
 epoch: 70, train_loss: 0.3708, test_loss: 1.2158, test_f1: 0.6517
 epoch: 71, train_loss: 0.3897, test_loss: 1.3371, test_f1: 0.6647
 epoch: 72, train_loss: 0.3959, test_loss: 1.2160, test_f1: 0.6637
 epoch: 73, train_loss: 0.3518, test_loss: 1.4074, test_f1: 0.6511
 epoch: 74, train_loss: 0.3753, test_loss: 1.4413, test_f1: 0.6719
 epoch: 75, train_loss: 0.3631, test_loss: 1.4035, test_f1: 0.6477
 epoch: 76, train_loss: 0.3465, test_loss: 1.2129, test_f1: 0.6687
 epoch: 77, train_loss: 0.3456, test_loss: 1.2126, test_f1: 0.6610
 epoch: 78, train_loss: 0.3616, test_loss: 1.1626, test_f1: 0.6815
 epoch: 79, train_loss: 0.3600, test_loss: 1.2138, test_f1: 0.6601
 epoch: 80, train_loss: 0.3571, test_loss: 1.2071, test_f1: 0.6741
 epoch: 81, train_loss: 0.3451, test_loss: 1.2386, test_f1: 0.6717
 epoch: 82, train_loss: 0.3403, test_loss: 1.2141, test_f1: 0.6754
 epoch: 83, train_loss: 0.3625, test_loss: 1.1127, test_f1: 0.6667
 epoch: 84, train_loss: 0.3452, test_loss: 1.1663, test_f1: 0.6597
 epoch: 85, train_loss: 0.3214, test_loss: 1.3761, test_f1: 0.6564
 epoch: 86, train_loss: 0.3296, test_loss: 1.3113, test_f1: 0.6535
 epoch: 87, train_loss: 0.3209, test_loss: 1.3042, test_f1: 0.6717
 epoch: 88, train_loss: 0.3304, test_loss: 1.4187, test_f1: 0.6618
 epoch: 89, train_loss: 0.3389, test_loss: 1.0815, test_f1: 0.6813
 epoch: 90, train_loss: 0.2993, test_loss: 1.3012, test_f1: 0.6571
 epoch: 91, train_loss: 0.3506, test_loss: 1.1283, test_f1: 0.6598
 epoch: 92, train_loss: 0.3222, test_loss: 1.3215, test_f1: 0.6737
 epoch: 93, train_loss: 0.3058, test_loss: 1.4056, test_f1: 0.6569
 epoch: 94, train_loss: 0.3142, test_loss: 1.2596, test_f1: 0.6518
 epoch: 95, train_loss: 0.3123, test_loss: 1.4032, test_f1: 0.6413
 epoch: 96, train_loss: 0.2997, test_loss: 1.2810, test_f1: 0.6692
 epoch: 97, train_loss: 0.3015, test_loss: 1.2648, test_f1: 0.6670
 epoch: 98, train_loss: 0.2931, test_loss: 1.4591, test_f1: 0.6612
 epoch: 99, train_loss: 0.2915, test_loss: 1.2715, test_f1: 0.6725
##################ITERATION #6 ****************************************
 epoch: 0, train_loss: 1.2140, test_loss: 1.1139, test_f1: 0.4495
 epoch: 1, train_loss: 0.9927, test_loss: 1.0225, test_f1: 0.5003
 epoch: 2, train_loss: 0.9691, test_loss: 1.0131, test_f1: 0.5084
 epoch: 3, train_loss: 0.9358, test_loss: 0.9841, test_f1: 0.5025
 epoch: 4, train_loss: 0.9180, test_loss: 0.9611, test_f1: 0.5162
 epoch: 5, train_loss: 0.9122, test_loss: 1.0492, test_f1: 0.5157
 epoch: 6, train_loss: 0.8876, test_loss: 0.9992, test_f1: 0.4975
 epoch: 7, train_loss: 0.8789, test_loss: 0.9243, test_f1: 0.5352
 epoch: 8, train_loss: 0.8660, test_loss: 0.9809, test_f1: 0.4891
 epoch: 9, train_loss: 0.8442, test_loss: 0.9668, test_f1: 0.5302
 epoch: 10, train_loss: 0.8217, test_loss: 0.7918, test_f1: 0.6185
 epoch: 11, train_loss: 0.8236, test_loss: 0.8349, test_f1: 0.6123
 epoch: 12, train_loss: 0.8069, test_loss: 1.0980, test_f1: 0.5552
 epoch: 13, train_loss: 0.8242, test_loss: 0.9108, test_f1: 0.6036
 epoch: 14, train_loss: 0.7941, test_loss: 0.8529, test_f1: 0.5708
 epoch: 15, train_loss: 0.7787, test_loss: 0.7725, test_f1: 0.5898
 epoch: 16, train_loss: 0.7735, test_loss: 0.7979, test_f1: 0.5929
 epoch: 17, train_loss: 0.7511, test_loss: 0.8877, test_f1: 0.5484
 epoch: 18, train_loss: 0.7606, test_loss: 0.8393, test_f1: 0.5912
 epoch: 19, train_loss: 0.7262, test_loss: 0.8876, test_f1: 0.5640
 epoch: 20, train_loss: 0.7181, test_loss: 0.9417, test_f1: 0.6065
 epoch: 21, train_loss: 0.7091, test_loss: 0.9355, test_f1: 0.6065
 epoch: 22, train_loss: 0.7130, test_loss: 0.9121, test_f1: 0.6533
 epoch: 23, train_loss: 0.7047, test_loss: 0.9531, test_f1: 0.6102
 epoch: 24, train_loss: 0.7088, test_loss: 1.0382, test_f1: 0.5494
 epoch: 25, train_loss: 0.6785, test_loss: 1.0831, test_f1: 0.5642
 epoch: 26, train_loss: 0.6510, test_loss: 1.0852, test_f1: 0.6106
 epoch: 27, train_loss: 0.6734, test_loss: 0.8718, test_f1: 0.5894
 epoch: 28, train_loss: 0.6619, test_loss: 1.1883, test_f1: 0.5040
 epoch: 29, train_loss: 0.6670, test_loss: 1.0929, test_f1: 0.5756
 epoch: 30, train_loss: 0.6366, test_loss: 1.3701, test_f1: 0.5882
 epoch: 31, train_loss: 0.6125, test_loss: 0.9686, test_f1: 0.6154
 epoch: 32, train_loss: 0.6559, test_loss: 1.2187, test_f1: 0.5886
 epoch: 33, train_loss: 0.6425, test_loss: 0.9871, test_f1: 0.6246
 epoch: 34, train_loss: 0.6234, test_loss: 1.2136, test_f1: 0.5621
 epoch: 35, train_loss: 0.6277, test_loss: 1.0763, test_f1: 0.6082
 epoch: 36, train_loss: 0.6137, test_loss: 1.1119, test_f1: 0.6229
 epoch: 37, train_loss: 0.6005, test_loss: 1.0551, test_f1: 0.6656
 epoch: 38, train_loss: 0.5863, test_loss: 1.2083, test_f1: 0.5968
 epoch: 39, train_loss: 0.5889, test_loss: 1.0035, test_f1: 0.6413
 epoch: 40, train_loss: 0.6024, test_loss: 1.0343, test_f1: 0.6512
 epoch: 41, train_loss: 0.5618, test_loss: 1.1347, test_f1: 0.6329
 epoch: 42, train_loss: 0.5518, test_loss: 1.1593, test_f1: 0.6238
 epoch: 43, train_loss: 0.5657, test_loss: 0.9822, test_f1: 0.6191
 epoch: 44, train_loss: 0.5607, test_loss: 1.2164, test_f1: 0.6483
 epoch: 45, train_loss: 0.5518, test_loss: 1.2703, test_f1: 0.6295
 epoch: 46, train_loss: 0.5413, test_loss: 1.2728, test_f1: 0.6362
 epoch: 47, train_loss: 0.5148, test_loss: 1.2226, test_f1: 0.6097
 epoch: 48, train_loss: 0.5308, test_loss: 1.2075, test_f1: 0.6498
 epoch: 49, train_loss: 0.5205, test_loss: 1.2257, test_f1: 0.6472
 epoch: 50, train_loss: 0.5272, test_loss: 1.4009, test_f1: 0.6025
 epoch: 51, train_loss: 0.4701, test_loss: 1.3590, test_f1: 0.6669
 epoch: 52, train_loss: 0.4292, test_loss: 1.1363, test_f1: 0.6804
 epoch: 53, train_loss: 0.4302, test_loss: 1.4922, test_f1: 0.6718
 epoch: 54, train_loss: 0.4203, test_loss: 1.4443, test_f1: 0.6598
 epoch: 55, train_loss: 0.4418, test_loss: 1.2655, test_f1: 0.6800
 epoch: 56, train_loss: 0.3983, test_loss: 1.4251, test_f1: 0.6596
 epoch: 57, train_loss: 0.3923, test_loss: 1.4094, test_f1: 0.6579
 epoch: 58, train_loss: 0.3806, test_loss: 1.4300, test_f1: 0.6657
 epoch: 59, train_loss: 0.4062, test_loss: 1.5832, test_f1: 0.6633
 epoch: 60, train_loss: 0.3963, test_loss: 1.3894, test_f1: 0.6579
 epoch: 61, train_loss: 0.3843, test_loss: 1.5371, test_f1: 0.6680
 epoch: 62, train_loss: 0.4006, test_loss: 1.6149, test_f1: 0.6754
 epoch: 63, train_loss: 0.3829, test_loss: 1.4810, test_f1: 0.6467
 epoch: 64, train_loss: 0.3774, test_loss: 1.3563, test_f1: 0.6606
 epoch: 65, train_loss: 0.3906, test_loss: 1.6483, test_f1: 0.6712
 epoch: 66, train_loss: 0.3707, test_loss: 1.7864, test_f1: 0.6701
 epoch: 67, train_loss: 0.3595, test_loss: 1.7487, test_f1: 0.6453
 epoch: 68, train_loss: 0.3694, test_loss: 1.6934, test_f1: 0.6879
 epoch: 69, train_loss: 0.3558, test_loss: 1.9332, test_f1: 0.6461
 epoch: 70, train_loss: 0.3423, test_loss: 1.8628, test_f1: 0.6810
 epoch: 71, train_loss: 0.3542, test_loss: 1.6430, test_f1: 0.6606
 epoch: 72, train_loss: 0.3670, test_loss: 1.7144, test_f1: 0.6656
 epoch: 73, train_loss: 0.3273, test_loss: 1.7626, test_f1: 0.6665
 epoch: 74, train_loss: 0.3542, test_loss: 1.8310, test_f1: 0.6848
 epoch: 75, train_loss: 0.3232, test_loss: 1.6525, test_f1: 0.6908
 epoch: 76, train_loss: 0.3297, test_loss: 1.8882, test_f1: 0.6715
 epoch: 77, train_loss: 0.3296, test_loss: 1.9390, test_f1: 0.6898
 epoch: 78, train_loss: 0.3381, test_loss: 1.6575, test_f1: 0.6785
 epoch: 79, train_loss: 0.3214, test_loss: 1.9448, test_f1: 0.6591
 epoch: 80, train_loss: 0.3284, test_loss: 1.6926, test_f1: 0.6888
 epoch: 81, train_loss: 0.3160, test_loss: 1.8840, test_f1: 0.6951
 epoch: 82, train_loss: 0.3272, test_loss: 1.9148, test_f1: 0.6772
 epoch: 83, train_loss: 0.3306, test_loss: 2.1104, test_f1: 0.6781
 epoch: 84, train_loss: 0.3024, test_loss: 1.9896, test_f1: 0.6665
 epoch: 85, train_loss: 0.3108, test_loss: 2.2177, test_f1: 0.6768
 epoch: 86, train_loss: 0.2982, test_loss: 2.3428, test_f1: 0.6535
 epoch: 87, train_loss: 0.2857, test_loss: 2.1422, test_f1: 0.6599
 epoch: 88, train_loss: 0.2905, test_loss: 2.3418, test_f1: 0.6639
 epoch: 89, train_loss: 0.2991, test_loss: 2.2219, test_f1: 0.6803
 epoch: 90, train_loss: 0.2972, test_loss: 2.2362, test_f1: 0.6348
 epoch: 91, train_loss: 0.2842, test_loss: 2.0311, test_f1: 0.6703
 epoch: 92, train_loss: 0.2837, test_loss: 2.1468, test_f1: 0.6808
 epoch: 93, train_loss: 0.2907, test_loss: 2.1584, test_f1: 0.6884
 epoch: 94, train_loss: 0.2634, test_loss: 2.3589, test_f1: 0.6694
 epoch: 95, train_loss: 0.2748, test_loss: 2.3699, test_f1: 0.6556
 epoch: 96, train_loss: 0.3038, test_loss: 2.0818, test_f1: 0.6720
 epoch: 97, train_loss: 0.2717, test_loss: 2.4251, test_f1: 0.6474
 epoch: 98, train_loss: 0.2628, test_loss: 2.0059, test_f1: 0.6648
 epoch: 99, train_loss: 0.2704, test_loss: 2.3066, test_f1: 0.6510
##################ITERATION #7 ****************************************
 epoch: 0, train_loss: 1.2819, test_loss: 1.0607, test_f1: 0.4571
 epoch: 1, train_loss: 0.9995, test_loss: 1.0506, test_f1: 0.4630
 epoch: 2, train_loss: 0.9580, test_loss: 1.1463, test_f1: 0.4059
 epoch: 3, train_loss: 0.9516, test_loss: 0.9552, test_f1: 0.4742
 epoch: 4, train_loss: 0.9210, test_loss: 1.0292, test_f1: 0.4507
 epoch: 5, train_loss: 0.9099, test_loss: 0.9906, test_f1: 0.5305
 epoch: 6, train_loss: 0.8825, test_loss: 0.9300, test_f1: 0.4945
 epoch: 7, train_loss: 0.8890, test_loss: 0.9098, test_f1: 0.6171
 epoch: 8, train_loss: 0.8642, test_loss: 0.9725, test_f1: 0.5435
 epoch: 9, train_loss: 0.8543, test_loss: 0.8847, test_f1: 0.5382
 epoch: 10, train_loss: 0.8238, test_loss: 0.9907, test_f1: 0.5198
 epoch: 11, train_loss: 0.8320, test_loss: 0.9554, test_f1: 0.5799
 epoch: 12, train_loss: 0.8323, test_loss: 0.9347, test_f1: 0.5374
 epoch: 13, train_loss: 0.8047, test_loss: 1.2456, test_f1: 0.5089
 epoch: 14, train_loss: 0.7791, test_loss: 1.0995, test_f1: 0.6280
 epoch: 15, train_loss: 0.7898, test_loss: 0.9980, test_f1: 0.5501
 epoch: 16, train_loss: 0.7618, test_loss: 1.5738, test_f1: 0.4910
 epoch: 17, train_loss: 0.7865, test_loss: 1.1110, test_f1: 0.5463
 epoch: 18, train_loss: 0.7552, test_loss: 0.9483, test_f1: 0.6454
 epoch: 19, train_loss: 0.7481, test_loss: 0.9449, test_f1: 0.5665
 epoch: 20, train_loss: 0.7265, test_loss: 0.8548, test_f1: 0.5568
 epoch: 21, train_loss: 0.7641, test_loss: 1.1264, test_f1: 0.5580
 epoch: 22, train_loss: 0.7471, test_loss: 1.2214, test_f1: 0.5979
 epoch: 23, train_loss: 0.7149, test_loss: 0.9959, test_f1: 0.6508
 epoch: 24, train_loss: 0.6799, test_loss: 1.1436, test_f1: 0.6331
 epoch: 25, train_loss: 0.6950, test_loss: 1.0959, test_f1: 0.5902
 epoch: 26, train_loss: 0.7043, test_loss: 1.1110, test_f1: 0.5538
 epoch: 27, train_loss: 0.6720, test_loss: 0.8849, test_f1: 0.6286
 epoch: 28, train_loss: 0.6944, test_loss: 1.0718, test_f1: 0.5771
 epoch: 29, train_loss: 0.6740, test_loss: 1.0094, test_f1: 0.6060
 epoch: 30, train_loss: 0.6493, test_loss: 0.8821, test_f1: 0.6381
 epoch: 31, train_loss: 0.6285, test_loss: 1.3212, test_f1: 0.6076
 epoch: 32, train_loss: 0.6445, test_loss: 1.4867, test_f1: 0.4885
 epoch: 33, train_loss: 0.6599, test_loss: 1.1837, test_f1: 0.6544
 epoch: 34, train_loss: 0.6501, test_loss: 1.0321, test_f1: 0.6384
 epoch: 35, train_loss: 0.6404, test_loss: 1.2373, test_f1: 0.6134
 epoch: 36, train_loss: 0.6256, test_loss: 1.2392, test_f1: 0.6410
 epoch: 37, train_loss: 0.5927, test_loss: 1.1039, test_f1: 0.6405
 epoch: 38, train_loss: 0.5968, test_loss: 0.8906, test_f1: 0.6280
 epoch: 39, train_loss: 0.5712, test_loss: 0.9947, test_f1: 0.6671
 epoch: 40, train_loss: 0.6150, test_loss: 1.1600, test_f1: 0.6001
 epoch: 41, train_loss: 0.5781, test_loss: 1.2071, test_f1: 0.6474
 epoch: 42, train_loss: 0.5850, test_loss: 1.0313, test_f1: 0.5968
 epoch: 43, train_loss: 0.5671, test_loss: 1.4091, test_f1: 0.6483
 epoch: 44, train_loss: 0.5933, test_loss: 0.9782, test_f1: 0.6219
 epoch: 45, train_loss: 0.5918, test_loss: 1.0908, test_f1: 0.6146
 epoch: 46, train_loss: 0.5371, test_loss: 1.0789, test_f1: 0.6444
 epoch: 47, train_loss: 0.5340, test_loss: 1.0771, test_f1: 0.6379
 epoch: 48, train_loss: 0.5745, test_loss: 1.3481, test_f1: 0.5934
 epoch: 49, train_loss: 0.6016, test_loss: 1.1664, test_f1: 0.6194
 epoch: 50, train_loss: 0.5628, test_loss: 1.1841, test_f1: 0.6430
 epoch: 51, train_loss: 0.5235, test_loss: 1.1943, test_f1: 0.6646
 epoch: 52, train_loss: 0.4698, test_loss: 1.1844, test_f1: 0.6845
 epoch: 53, train_loss: 0.4487, test_loss: 1.2613, test_f1: 0.6616
 epoch: 54, train_loss: 0.4395, test_loss: 1.4532, test_f1: 0.6528
 epoch: 55, train_loss: 0.4500, test_loss: 1.4145, test_f1: 0.6887
 epoch: 56, train_loss: 0.4466, test_loss: 1.3064, test_f1: 0.6533
 epoch: 57, train_loss: 0.4326, test_loss: 1.2973, test_f1: 0.6864
 epoch: 58, train_loss: 0.4120, test_loss: 1.3440, test_f1: 0.6544
 epoch: 59, train_loss: 0.4087, test_loss: 1.2694, test_f1: 0.6909
 epoch: 60, train_loss: 0.4154, test_loss: 1.2130, test_f1: 0.6748
 epoch: 61, train_loss: 0.4194, test_loss: 1.3728, test_f1: 0.6838
 epoch: 62, train_loss: 0.4183, test_loss: 1.4877, test_f1: 0.6575
 epoch: 63, train_loss: 0.3954, test_loss: 1.5251, test_f1: 0.6498
 epoch: 64, train_loss: 0.3821, test_loss: 1.4109, test_f1: 0.6619
 epoch: 65, train_loss: 0.3842, test_loss: 1.1754, test_f1: 0.6718
 epoch: 66, train_loss: 0.3897, test_loss: 1.4490, test_f1: 0.6445
 epoch: 67, train_loss: 0.3868, test_loss: 1.2968, test_f1: 0.6772
 epoch: 68, train_loss: 0.3889, test_loss: 1.3713, test_f1: 0.6762
 epoch: 69, train_loss: 0.3779, test_loss: 1.3669, test_f1: 0.6587
 epoch: 70, train_loss: 0.3887, test_loss: 1.3250, test_f1: 0.6476
 epoch: 71, train_loss: 0.3663, test_loss: 1.4685, test_f1: 0.6593
 epoch: 72, train_loss: 0.3451, test_loss: 1.6488, test_f1: 0.6865
 epoch: 73, train_loss: 0.3559, test_loss: 1.5579, test_f1: 0.6772
 epoch: 74, train_loss: 0.3661, test_loss: 1.5860, test_f1: 0.6613
 epoch: 75, train_loss: 0.3675, test_loss: 1.4859, test_f1: 0.6547
 epoch: 76, train_loss: 0.3847, test_loss: 1.3672, test_f1: 0.6848
 epoch: 77, train_loss: 0.3514, test_loss: 1.3774, test_f1: 0.6581
 epoch: 78, train_loss: 0.3326, test_loss: 1.2784, test_f1: 0.6651
 epoch: 79, train_loss: 0.3478, test_loss: 1.5479, test_f1: 0.6483
 epoch: 80, train_loss: 0.3488, test_loss: 1.6006, test_f1: 0.6755
 epoch: 81, train_loss: 0.3147, test_loss: 1.5542, test_f1: 0.6837
 epoch: 82, train_loss: 0.3158, test_loss: 1.5013, test_f1: 0.6816
 epoch: 83, train_loss: 0.3387, test_loss: 1.5475, test_f1: 0.6604
 epoch: 84, train_loss: 0.3552, test_loss: 1.6674, test_f1: 0.6822
 epoch: 85, train_loss: 0.3705, test_loss: 1.4634, test_f1: 0.6755
 epoch: 86, train_loss: 0.3296, test_loss: 1.3463, test_f1: 0.6693
 epoch: 87, train_loss: 0.3122, test_loss: 1.4684, test_f1: 0.6884
 epoch: 88, train_loss: 0.3112, test_loss: 1.4820, test_f1: 0.6802
 epoch: 89, train_loss: 0.3127, test_loss: 1.5330, test_f1: 0.6599
 epoch: 90, train_loss: 0.3208, test_loss: 1.3496, test_f1: 0.6538
 epoch: 91, train_loss: 0.3208, test_loss: 1.3717, test_f1: 0.6592
 epoch: 92, train_loss: 0.3384, test_loss: 1.5128, test_f1: 0.6718
 epoch: 93, train_loss: 0.3183, test_loss: 1.7337, test_f1: 0.6731
 epoch: 94, train_loss: 0.3078, test_loss: 1.6576, test_f1: 0.6595
 epoch: 95, train_loss: 0.2943, test_loss: 1.8346, test_f1: 0.6499
 epoch: 96, train_loss: 0.2868, test_loss: 1.7838, test_f1: 0.6660
 epoch: 97, train_loss: 0.2984, test_loss: 1.6285, test_f1: 0.6688
 epoch: 98, train_loss: 0.3021, test_loss: 1.8800, test_f1: 0.6902
 epoch: 99, train_loss: 0.2704, test_loss: 1.9530, test_f1: 0.6444
##################ITERATION #8 ****************************************
 epoch: 0, train_loss: 1.1832, test_loss: 1.2019, test_f1: 0.4914
 epoch: 1, train_loss: 0.9816, test_loss: 1.0870, test_f1: 0.4761
 epoch: 2, train_loss: 0.9544, test_loss: 0.9714, test_f1: 0.5320
 epoch: 3, train_loss: 0.9257, test_loss: 1.0612, test_f1: 0.4951
 epoch: 4, train_loss: 0.9119, test_loss: 0.8655, test_f1: 0.6091
 epoch: 5, train_loss: 0.8980, test_loss: 1.4991, test_f1: 0.4088
 epoch: 6, train_loss: 0.9058, test_loss: 1.0453, test_f1: 0.5344
 epoch: 7, train_loss: 0.8841, test_loss: 0.8861, test_f1: 0.5790
 epoch: 8, train_loss: 0.8629, test_loss: 1.0739, test_f1: 0.5475
 epoch: 9, train_loss: 0.8561, test_loss: 1.0104, test_f1: 0.5655
 epoch: 10, train_loss: 0.8364, test_loss: 1.1920, test_f1: 0.5097
 epoch: 11, train_loss: 0.8200, test_loss: 0.8652, test_f1: 0.5643
 epoch: 12, train_loss: 0.8115, test_loss: 1.3569, test_f1: 0.5010
 epoch: 13, train_loss: 0.7956, test_loss: 0.9794, test_f1: 0.5438
 epoch: 14, train_loss: 0.8042, test_loss: 0.8705, test_f1: 0.5668
 epoch: 15, train_loss: 0.7717, test_loss: 0.8664, test_f1: 0.5967
 epoch: 16, train_loss: 0.7772, test_loss: 0.8770, test_f1: 0.5771
 epoch: 17, train_loss: 0.7325, test_loss: 0.9027, test_f1: 0.6267
 epoch: 18, train_loss: 0.7660, test_loss: 0.7903, test_f1: 0.5760
 epoch: 19, train_loss: 0.7694, test_loss: 0.8530, test_f1: 0.5966
 epoch: 20, train_loss: 0.7209, test_loss: 0.8815, test_f1: 0.6197
 epoch: 21, train_loss: 0.7161, test_loss: 0.9369, test_f1: 0.5762
 epoch: 22, train_loss: 0.7019, test_loss: 0.7429, test_f1: 0.6631
 epoch: 23, train_loss: 0.6809, test_loss: 0.8708, test_f1: 0.6167
 epoch: 24, train_loss: 0.6711, test_loss: 0.8781, test_f1: 0.6414
 epoch: 25, train_loss: 0.6798, test_loss: 0.8409, test_f1: 0.5768
 epoch: 26, train_loss: 0.6696, test_loss: 0.8012, test_f1: 0.6603
 epoch: 27, train_loss: 0.6521, test_loss: 1.3758, test_f1: 0.5508
 epoch: 28, train_loss: 0.6586, test_loss: 0.7581, test_f1: 0.6226
 epoch: 29, train_loss: 0.6484, test_loss: 0.8496, test_f1: 0.6489
 epoch: 30, train_loss: 0.6365, test_loss: 0.8026, test_f1: 0.6641
 epoch: 31, train_loss: 0.6184, test_loss: 0.7377, test_f1: 0.6132
 epoch: 32, train_loss: 0.6343, test_loss: 1.2651, test_f1: 0.5332
 epoch: 33, train_loss: 0.6291, test_loss: 0.9097, test_f1: 0.6308
 epoch: 34, train_loss: 0.6118, test_loss: 0.7812, test_f1: 0.6764
 epoch: 35, train_loss: 0.5959, test_loss: 0.8592, test_f1: 0.6747
 epoch: 36, train_loss: 0.5927, test_loss: 0.8083, test_f1: 0.6459
 epoch: 37, train_loss: 0.6028, test_loss: 0.8594, test_f1: 0.6417
 epoch: 38, train_loss: 0.5928, test_loss: 0.8466, test_f1: 0.6733
 epoch: 39, train_loss: 0.5720, test_loss: 0.8788, test_f1: 0.6136
 epoch: 40, train_loss: 0.5758, test_loss: 0.8058, test_f1: 0.6318
 epoch: 41, train_loss: 0.5673, test_loss: 0.8659, test_f1: 0.6665
 epoch: 42, train_loss: 0.5590, test_loss: 0.7900, test_f1: 0.6357
 epoch: 43, train_loss: 0.5805, test_loss: 0.7531, test_f1: 0.6721
 epoch: 44, train_loss: 0.5667, test_loss: 0.7982, test_f1: 0.6407
 epoch: 45, train_loss: 0.5539, test_loss: 1.0192, test_f1: 0.6454
 epoch: 46, train_loss: 0.5447, test_loss: 0.7466, test_f1: 0.6248
 epoch: 47, train_loss: 0.5625, test_loss: 1.0498, test_f1: 0.6213
 epoch: 48, train_loss: 0.5632, test_loss: 0.8173, test_f1: 0.6295
 epoch: 49, train_loss: 0.5182, test_loss: 0.8024, test_f1: 0.6673
 epoch: 50, train_loss: 0.5222, test_loss: 0.9745, test_f1: 0.6454
 epoch: 51, train_loss: 0.4800, test_loss: 0.6935, test_f1: 0.6953
 epoch: 52, train_loss: 0.4526, test_loss: 0.6814, test_f1: 0.7035
 epoch: 53, train_loss: 0.4317, test_loss: 0.6967, test_f1: 0.6995
 epoch: 54, train_loss: 0.4342, test_loss: 0.8053, test_f1: 0.6714
 epoch: 55, train_loss: 0.4014, test_loss: 0.8155, test_f1: 0.6548
 epoch: 56, train_loss: 0.4332, test_loss: 0.7893, test_f1: 0.6867
 epoch: 57, train_loss: 0.4293, test_loss: 0.7453, test_f1: 0.6910
 epoch: 58, train_loss: 0.4122, test_loss: 0.8363, test_f1: 0.6435
 epoch: 59, train_loss: 0.3890, test_loss: 0.7559, test_f1: 0.6756
 epoch: 60, train_loss: 0.3764, test_loss: 0.9583, test_f1: 0.6268
 epoch: 61, train_loss: 0.3980, test_loss: 0.7292, test_f1: 0.6790
 epoch: 62, train_loss: 0.3837, test_loss: 0.8987, test_f1: 0.6557
 epoch: 63, train_loss: 0.4033, test_loss: 0.7340, test_f1: 0.6509
 epoch: 64, train_loss: 0.3735, test_loss: 0.9247, test_f1: 0.6461
 epoch: 65, train_loss: 0.3766, test_loss: 0.8381, test_f1: 0.6860
 epoch: 66, train_loss: 0.3696, test_loss: 0.8083, test_f1: 0.6831
 epoch: 67, train_loss: 0.3734, test_loss: 0.8266, test_f1: 0.6683
 epoch: 68, train_loss: 0.3735, test_loss: 0.8980, test_f1: 0.6557
 epoch: 69, train_loss: 0.4062, test_loss: 0.8133, test_f1: 0.6539
 epoch: 70, train_loss: 0.3529, test_loss: 0.7741, test_f1: 0.6976
 epoch: 71, train_loss: 0.3731, test_loss: 0.8234, test_f1: 0.6613
 epoch: 72, train_loss: 0.3542, test_loss: 0.8886, test_f1: 0.6629
 epoch: 73, train_loss: 0.3601, test_loss: 0.8416, test_f1: 0.6479
 epoch: 74, train_loss: 0.3465, test_loss: 0.9104, test_f1: 0.6535
 epoch: 75, train_loss: 0.3142, test_loss: 0.8158, test_f1: 0.7040
 epoch: 76, train_loss: 0.3651, test_loss: 1.0340, test_f1: 0.6474
 epoch: 77, train_loss: 0.3464, test_loss: 0.8300, test_f1: 0.6695
 epoch: 78, train_loss: 0.3394, test_loss: 0.9249, test_f1: 0.6758
 epoch: 79, train_loss: 0.3195, test_loss: 0.9124, test_f1: 0.6500
 epoch: 80, train_loss: 0.3129, test_loss: 0.8779, test_f1: 0.6703
 epoch: 81, train_loss: 0.3292, test_loss: 0.8511, test_f1: 0.6604
 epoch: 82, train_loss: 0.3254, test_loss: 0.8010, test_f1: 0.6923
 epoch: 83, train_loss: 0.3328, test_loss: 0.9037, test_f1: 0.6527
 epoch: 84, train_loss: 0.3292, test_loss: 0.8445, test_f1: 0.6888
 epoch: 85, train_loss: 0.3152, test_loss: 0.9234, test_f1: 0.6611
 epoch: 86, train_loss: 0.3087, test_loss: 0.8991, test_f1: 0.6788
 epoch: 87, train_loss: 0.2959, test_loss: 0.8730, test_f1: 0.6678
 epoch: 88, train_loss: 0.3276, test_loss: 0.7928, test_f1: 0.6934
 epoch: 89, train_loss: 0.3066, test_loss: 0.8333, test_f1: 0.6807
 epoch: 90, train_loss: 0.3058, test_loss: 0.8538, test_f1: 0.7014
 epoch: 91, train_loss: 0.2994, test_loss: 0.7991, test_f1: 0.6989
 epoch: 92, train_loss: 0.2778, test_loss: 0.8868, test_f1: 0.6860
 epoch: 93, train_loss: 0.2905, test_loss: 0.9306, test_f1: 0.6904
 epoch: 94, train_loss: 0.2916, test_loss: 0.9282, test_f1: 0.6985
 epoch: 95, train_loss: 0.2817, test_loss: 0.8910, test_f1: 0.6734
 epoch: 96, train_loss: 0.2948, test_loss: 0.9100, test_f1: 0.6749
 epoch: 97, train_loss: 0.2879, test_loss: 0.8657, test_f1: 0.6980
 epoch: 98, train_loss: 0.3013, test_loss: 0.8963, test_f1: 0.6868
 epoch: 99, train_loss: 0.2720, test_loss: 0.9175, test_f1: 0.6904
##################ITERATION #9 ****************************************
 epoch: 0, train_loss: 1.4578, test_loss: 1.4236, test_f1: 0.3610
 epoch: 1, train_loss: 1.0283, test_loss: 0.9862, test_f1: 0.4372
 epoch: 2, train_loss: 0.9791, test_loss: 0.9562, test_f1: 0.5037
 epoch: 3, train_loss: 0.9641, test_loss: 1.0933, test_f1: 0.4812
 epoch: 4, train_loss: 0.9380, test_loss: 0.9304, test_f1: 0.4879
 epoch: 5, train_loss: 0.9293, test_loss: 1.0675, test_f1: 0.4596
 epoch: 6, train_loss: 0.9155, test_loss: 1.1593, test_f1: 0.5107
 epoch: 7, train_loss: 0.8951, test_loss: 1.3032, test_f1: 0.4842
 epoch: 8, train_loss: 0.8792, test_loss: 0.9469, test_f1: 0.5155
 epoch: 9, train_loss: 0.8519, test_loss: 0.8312, test_f1: 0.5393
 epoch: 10, train_loss: 0.8600, test_loss: 0.8424, test_f1: 0.5096
 epoch: 11, train_loss: 0.8197, test_loss: 0.8626, test_f1: 0.5895
 epoch: 12, train_loss: 0.8202, test_loss: 0.9597, test_f1: 0.5363
 epoch: 13, train_loss: 0.8355, test_loss: 0.8258, test_f1: 0.5997
 epoch: 14, train_loss: 0.8113, test_loss: 0.8182, test_f1: 0.6095
 epoch: 15, train_loss: 0.8054, test_loss: 0.8847, test_f1: 0.6089
 epoch: 16, train_loss: 0.7791, test_loss: 0.8587, test_f1: 0.5782
 epoch: 17, train_loss: 0.7668, test_loss: 0.9708, test_f1: 0.5823
 epoch: 18, train_loss: 0.7595, test_loss: 0.9504, test_f1: 0.6074
 epoch: 19, train_loss: 0.7476, test_loss: 0.8957, test_f1: 0.6400
 epoch: 20, train_loss: 0.7510, test_loss: 0.8202, test_f1: 0.6406
 epoch: 21, train_loss: 0.7322, test_loss: 1.0101, test_f1: 0.6109
 epoch: 22, train_loss: 0.7526, test_loss: 0.7725, test_f1: 0.5769
 epoch: 23, train_loss: 0.7266, test_loss: 0.8153, test_f1: 0.6392
 epoch: 24, train_loss: 0.7002, test_loss: 0.8069, test_f1: 0.6461
 epoch: 25, train_loss: 0.6813, test_loss: 1.0646, test_f1: 0.6162
 epoch: 26, train_loss: 0.6867, test_loss: 0.7975, test_f1: 0.6883
 epoch: 27, train_loss: 0.6709, test_loss: 0.8736, test_f1: 0.6180
 epoch: 28, train_loss: 0.6595, test_loss: 0.7342, test_f1: 0.6697
 epoch: 29, train_loss: 0.6751, test_loss: 0.8121, test_f1: 0.6602
 epoch: 30, train_loss: 0.6699, test_loss: 0.7336, test_f1: 0.6770
 epoch: 31, train_loss: 0.6390, test_loss: 0.7724, test_f1: 0.6321
 epoch: 32, train_loss: 0.6373, test_loss: 0.7369, test_f1: 0.6527
 epoch: 33, train_loss: 0.6389, test_loss: 0.7131, test_f1: 0.6780
 epoch: 34, train_loss: 0.6419, test_loss: 1.1176, test_f1: 0.5509
 epoch: 35, train_loss: 0.6513, test_loss: 0.9120, test_f1: 0.6555
 epoch: 36, train_loss: 0.6406, test_loss: 0.7598, test_f1: 0.6269
 epoch: 37, train_loss: 0.6179, test_loss: 0.8266, test_f1: 0.6467
 epoch: 38, train_loss: 0.5886, test_loss: 0.8660, test_f1: 0.6776
 epoch: 39, train_loss: 0.5889, test_loss: 0.7886, test_f1: 0.6682
 epoch: 40, train_loss: 0.6079, test_loss: 0.7478, test_f1: 0.6652
 epoch: 41, train_loss: 0.5750, test_loss: 1.0107, test_f1: 0.6295
 epoch: 42, train_loss: 0.5782, test_loss: 0.7617, test_f1: 0.6717
 epoch: 43, train_loss: 0.5722, test_loss: 0.8219, test_f1: 0.6481
 epoch: 44, train_loss: 0.5819, test_loss: 0.9453, test_f1: 0.6521
 epoch: 45, train_loss: 0.5906, test_loss: 0.7047, test_f1: 0.6642
 epoch: 46, train_loss: 0.5658, test_loss: 0.7703, test_f1: 0.6834
 epoch: 47, train_loss: 0.5469, test_loss: 0.8222, test_f1: 0.6508
 epoch: 48, train_loss: 0.5378, test_loss: 0.8686, test_f1: 0.6431
 epoch: 49, train_loss: 0.5339, test_loss: 0.7978, test_f1: 0.6525
 epoch: 50, train_loss: 0.5676, test_loss: 0.7713, test_f1: 0.6255
 epoch: 51, train_loss: 0.5039, test_loss: 0.8728, test_f1: 0.6932
 epoch: 52, train_loss: 0.4594, test_loss: 0.8517, test_f1: 0.6816
 epoch: 53, train_loss: 0.4522, test_loss: 0.7190, test_f1: 0.7033
 epoch: 54, train_loss: 0.4374, test_loss: 0.7648, test_f1: 0.6814
 epoch: 55, train_loss: 0.4433, test_loss: 0.8013, test_f1: 0.6876
 epoch: 56, train_loss: 0.4275, test_loss: 0.7284, test_f1: 0.6893
 epoch: 57, train_loss: 0.4393, test_loss: 0.8278, test_f1: 0.6854
 epoch: 58, train_loss: 0.4555, test_loss: 0.8909, test_f1: 0.6632
 epoch: 59, train_loss: 0.4274, test_loss: 0.7886, test_f1: 0.6998
 epoch: 60, train_loss: 0.4022, test_loss: 0.7652, test_f1: 0.7204
 epoch: 61, train_loss: 0.4044, test_loss: 0.8982, test_f1: 0.6810
 epoch: 62, train_loss: 0.4222, test_loss: 0.9692, test_f1: 0.6778
 epoch: 63, train_loss: 0.4017, test_loss: 0.8681, test_f1: 0.6873
 epoch: 64, train_loss: 0.4021, test_loss: 0.9198, test_f1: 0.6962
 epoch: 65, train_loss: 0.3995, test_loss: 0.9100, test_f1: 0.6806
 epoch: 66, train_loss: 0.3976, test_loss: 0.8473, test_f1: 0.7113
 epoch: 67, train_loss: 0.4030, test_loss: 0.8155, test_f1: 0.6841
 epoch: 68, train_loss: 0.3862, test_loss: 0.9643, test_f1: 0.6908
 epoch: 69, train_loss: 0.3635, test_loss: 0.9252, test_f1: 0.6860
 epoch: 70, train_loss: 0.3732, test_loss: 0.8807, test_f1: 0.6791
 epoch: 71, train_loss: 0.3715, test_loss: 0.8268, test_f1: 0.7061
 epoch: 72, train_loss: 0.3629, test_loss: 0.9565, test_f1: 0.6796
 epoch: 73, train_loss: 0.3463, test_loss: 0.9382, test_f1: 0.6882
 epoch: 74, train_loss: 0.3541, test_loss: 0.9081, test_f1: 0.7017
 epoch: 75, train_loss: 0.3546, test_loss: 0.8285, test_f1: 0.6889
 epoch: 76, train_loss: 0.3661, test_loss: 1.2208, test_f1: 0.6758
 epoch: 77, train_loss: 0.3754, test_loss: 1.0995, test_f1: 0.6729
 epoch: 78, train_loss: 0.3537, test_loss: 0.8789, test_f1: 0.6904
 epoch: 79, train_loss: 0.3411, test_loss: 0.9285, test_f1: 0.6812
 epoch: 80, train_loss: 0.3635, test_loss: 0.8826, test_f1: 0.6852
 epoch: 81, train_loss: 0.3448, test_loss: 1.0194, test_f1: 0.6629
 epoch: 82, train_loss: 0.3592, test_loss: 1.1261, test_f1: 0.6864
 epoch: 83, train_loss: 0.3562, test_loss: 1.0856, test_f1: 0.6837
 epoch: 84, train_loss: 0.3268, test_loss: 0.9121, test_f1: 0.7013
 epoch: 85, train_loss: 0.3065, test_loss: 1.1000, test_f1: 0.6810
 epoch: 86, train_loss: 0.3429, test_loss: 1.0830, test_f1: 0.6557
 epoch: 87, train_loss: 0.3325, test_loss: 1.0402, test_f1: 0.6656
 epoch: 88, train_loss: 0.3311, test_loss: 1.0191, test_f1: 0.6817
 epoch: 89, train_loss: 0.3276, test_loss: 0.9502, test_f1: 0.6916
 epoch: 90, train_loss: 0.3282, test_loss: 1.1883, test_f1: 0.6813
 epoch: 91, train_loss: 0.3211, test_loss: 1.1476, test_f1: 0.6817
 epoch: 92, train_loss: 0.3206, test_loss: 1.2154, test_f1: 0.6883
 epoch: 93, train_loss: 0.3061, test_loss: 1.1664, test_f1: 0.6816
 epoch: 94, train_loss: 0.2928, test_loss: 1.1218, test_f1: 0.6904
 epoch: 95, train_loss: 0.2956, test_loss: 0.9823, test_f1: 0.6879
 epoch: 96, train_loss: 0.2973, test_loss: 1.3668, test_f1: 0.6704
 epoch: 97, train_loss: 0.3092, test_loss: 1.3848, test_f1: 0.6661
 epoch: 98, train_loss: 0.3015, test_loss: 0.9710, test_f1: 0.7074
 epoch: 99, train_loss: 0.3401, test_loss: 1.1695, test_f1: 0.6765

Training completed in 655.19 seconds
Best F1: 0.7204 at epoch 60
Mean F1 across iterations: 0.6995  0.0086
========================FINAL RESULTS================================
FEGIN weighted F1: 0.7204  0.0086
python main.py --data ltspice_examples --representation component_pin --model FEGIN --layers 3 --hiddens 128 --batch_size 64 --lr 0.01 --emb_size 512 --epochs 100 --save_appendix component_pin_L3_H128_BS64_LR0.01_E512 --no_val
-----



STDERR:
  File "main.py", line 370, in <module>
    main()
  File "main.py", line 254, in main
    dataset = dataset_class(
  File "/home/philip/projects/ltspice_examples_code_repo/Circuit-Completion-Using-GNNs/component_classification_with_link_prediction_head/evaluation/FEGIN/kernel/circuit_datasets.py", line 15, in __init__
    self.data, self.slices = torch.load(self.processed_paths[0])
  File "/home/philip/.local/lib/python3.8/site-packages/torch/serialization.py", line 1040, in load
    warnings.warn(
  File "/usr/lib/python3.8/warnings.py", line 109, in _showwarnmsg
    sw(msg.message, msg.category, msg.filename, msg.lineno,
  File "main.py", line 47, in warn_with_traceback
    traceback.print_stack(file=log)
/home/philip/projects/ltspice_examples_code_repo/Circuit-Completion-Using-GNNs/component_classification_with_link_prediction_head/evaluation/FEGIN/kernel/circuit_datasets.py:15: FutureWarning: You are using `torch.load` with `weights_only=False` (the current default value), which uses the default pickle module implicitly. It is possible to construct malicious pickle data which will execute arbitrary code during unpickling (See https://github.com/pytorch/pytorch/blob/main/SECURITY.md#untrusted-models for more details). In a future release, the default value for `weights_only` will be flipped to `True`. This limits the functions that could be executed during unpickling. Arbitrary objects will no longer be allowed to be loaded via this mode unless they are explicitly allowlisted by the user via `torch.serialization.add_safe_globals`. We recommend you start setting `weights_only=True` for any use case where you don't have full control of the loaded file. Please open an issue on GitHub for any issues related to this experimental feature.
  self.data, self.slices = torch.load(self.processed_paths[0])
