STDOUT:
Results will be saved in /home/philip/projects/ltspice_examples_code_repo/Circuit-Completion-Using-GNNs/component_classification_with_link_prediction_head/evaluation/FEGIN/results/model_FEGIN_dataset_ltspice_demos
Command line input: python main.py --data ltspice_demos --representation component_pin_net --model FEGIN --layers 6 --hiddens 128 --batch_size 32 --lr 0.001 --emb_size 128 --epochs 100 --save_appendix component_pin_net_L6_H128_BS32_LR0.001_E128 --no_val
 is saved.
-----
ltspice_demos - FEGIN
Using 6 layers, 128 hidden units, h = 2
Loading component_pin_net representation dataset
ENTERED
Training FEGIN on component_pin_net representation
Train: 1565, Test: 383
##################ITERATION #0 ****************************************
 epoch: 0, train_loss: 1.1796, test_loss: 1.1316, test_f1: 0.4114
 epoch: 1, train_loss: 0.9987, test_loss: 1.0758, test_f1: 0.4295
 epoch: 2, train_loss: 0.9734, test_loss: 1.0304, test_f1: 0.5013
 epoch: 3, train_loss: 0.9323, test_loss: 1.0596, test_f1: 0.4381
 epoch: 4, train_loss: 0.9080, test_loss: 1.0002, test_f1: 0.5398
 epoch: 5, train_loss: 0.8817, test_loss: 1.0211, test_f1: 0.5548
 epoch: 6, train_loss: 0.8577, test_loss: 1.0370, test_f1: 0.5172
 epoch: 7, train_loss: 0.8124, test_loss: 1.1961, test_f1: 0.5118
 epoch: 8, train_loss: 0.7949, test_loss: 1.0530, test_f1: 0.5900
 epoch: 9, train_loss: 0.8001, test_loss: 1.0528, test_f1: 0.5177
 epoch: 10, train_loss: 0.7633, test_loss: 1.0550, test_f1: 0.6299
 epoch: 11, train_loss: 0.7033, test_loss: 1.0944, test_f1: 0.5148
 epoch: 12, train_loss: 0.7091, test_loss: 1.1227, test_f1: 0.5477
 epoch: 13, train_loss: 0.6845, test_loss: 1.2422, test_f1: 0.4999
 epoch: 14, train_loss: 0.6572, test_loss: 0.9877, test_f1: 0.5892
 epoch: 15, train_loss: 0.6576, test_loss: 1.0493, test_f1: 0.6184
 epoch: 16, train_loss: 0.6300, test_loss: 1.1368, test_f1: 0.6116
 epoch: 17, train_loss: 0.6277, test_loss: 1.1061, test_f1: 0.6098
 epoch: 18, train_loss: 0.6080, test_loss: 1.0703, test_f1: 0.5931
 epoch: 19, train_loss: 0.6038, test_loss: 1.1026, test_f1: 0.5633
 epoch: 20, train_loss: 0.5779, test_loss: 1.1983, test_f1: 0.6135
 epoch: 21, train_loss: 0.5933, test_loss: 1.2193, test_f1: 0.5630
 epoch: 22, train_loss: 0.5413, test_loss: 1.1409, test_f1: 0.6183
 epoch: 23, train_loss: 0.5388, test_loss: 1.2809, test_f1: 0.6002
 epoch: 24, train_loss: 0.5278, test_loss: 1.2276, test_f1: 0.5849
 epoch: 25, train_loss: 0.5892, test_loss: 1.3775, test_f1: 0.5824
 epoch: 26, train_loss: 0.5508, test_loss: 1.1160, test_f1: 0.5958
 epoch: 27, train_loss: 0.5080, test_loss: 1.3433, test_f1: 0.5967
 epoch: 28, train_loss: 0.4864, test_loss: 1.2894, test_f1: 0.6178
 epoch: 29, train_loss: 0.5192, test_loss: 1.4665, test_f1: 0.5463
 epoch: 30, train_loss: 0.4855, test_loss: 1.3515, test_f1: 0.6062
 epoch: 31, train_loss: 0.4681, test_loss: 1.2702, test_f1: 0.6416
 epoch: 32, train_loss: 0.4724, test_loss: 1.2643, test_f1: 0.6127
 epoch: 33, train_loss: 0.4276, test_loss: 1.3883, test_f1: 0.6256
 epoch: 34, train_loss: 0.4216, test_loss: 1.4346, test_f1: 0.5869
 epoch: 35, train_loss: 0.4350, test_loss: 1.3737, test_f1: 0.6093
 epoch: 36, train_loss: 0.4024, test_loss: 1.6029, test_f1: 0.5887
 epoch: 37, train_loss: 0.4675, test_loss: 1.4099, test_f1: 0.6157
 epoch: 38, train_loss: 0.4253, test_loss: 1.6204, test_f1: 0.5897
 epoch: 39, train_loss: 0.4099, test_loss: 1.6945, test_f1: 0.5629
 epoch: 40, train_loss: 0.4024, test_loss: 1.5365, test_f1: 0.5960
 epoch: 41, train_loss: 0.3617, test_loss: 1.5785, test_f1: 0.6128
 epoch: 42, train_loss: 0.3445, test_loss: 1.8869, test_f1: 0.6190
 epoch: 43, train_loss: 0.3907, test_loss: 1.5357, test_f1: 0.6669
 epoch: 44, train_loss: 0.3392, test_loss: 1.7044, test_f1: 0.6587
 epoch: 45, train_loss: 0.3533, test_loss: 1.9957, test_f1: 0.5969
 epoch: 46, train_loss: 0.3685, test_loss: 1.6083, test_f1: 0.5946
 epoch: 47, train_loss: 0.3943, test_loss: 1.5370, test_f1: 0.6533
 epoch: 48, train_loss: 0.3377, test_loss: 1.7074, test_f1: 0.6244
 epoch: 49, train_loss: 0.3337, test_loss: 1.8711, test_f1: 0.6142
 epoch: 50, train_loss: 0.3495, test_loss: 1.5963, test_f1: 0.6243
 epoch: 51, train_loss: 0.3036, test_loss: 1.8318, test_f1: 0.6192
 epoch: 52, train_loss: 0.2563, test_loss: 1.8780, test_f1: 0.6305
 epoch: 53, train_loss: 0.2386, test_loss: 2.0457, test_f1: 0.6176
 epoch: 54, train_loss: 0.2690, test_loss: 2.0218, test_f1: 0.6022
 epoch: 55, train_loss: 0.2419, test_loss: 2.0921, test_f1: 0.6712
 epoch: 56, train_loss: 0.2307, test_loss: 2.1023, test_f1: 0.6337
 epoch: 57, train_loss: 0.2267, test_loss: 2.0202, test_f1: 0.6438
 epoch: 58, train_loss: 0.2230, test_loss: 2.1636, test_f1: 0.6372
 epoch: 59, train_loss: 0.2292, test_loss: 2.3842, test_f1: 0.6012
 epoch: 60, train_loss: 0.2055, test_loss: 2.3063, test_f1: 0.6536
 epoch: 61, train_loss: 0.1961, test_loss: 2.4745, test_f1: 0.6186
 epoch: 62, train_loss: 0.2126, test_loss: 2.4971, test_f1: 0.6008
 epoch: 63, train_loss: 0.2084, test_loss: 2.2127, test_f1: 0.6343
 epoch: 64, train_loss: 0.2016, test_loss: 2.4421, test_f1: 0.6210
 epoch: 65, train_loss: 0.2336, test_loss: 2.4993, test_f1: 0.6282
 epoch: 66, train_loss: 0.2180, test_loss: 2.4747, test_f1: 0.6464
 epoch: 67, train_loss: 0.1900, test_loss: 2.4832, test_f1: 0.6218
 epoch: 68, train_loss: 0.1823, test_loss: 2.5363, test_f1: 0.6321
 epoch: 69, train_loss: 0.1809, test_loss: 2.7002, test_f1: 0.6155
 epoch: 70, train_loss: 0.1726, test_loss: 2.5456, test_f1: 0.6270
 epoch: 71, train_loss: 0.1726, test_loss: 2.8532, test_f1: 0.6381
 epoch: 72, train_loss: 0.1527, test_loss: 2.8958, test_f1: 0.6263
 epoch: 73, train_loss: 0.1821, test_loss: 3.0441, test_f1: 0.6062
 epoch: 74, train_loss: 0.1427, test_loss: 2.7717, test_f1: 0.6375
 epoch: 75, train_loss: 0.1624, test_loss: 2.8841, test_f1: 0.6318
 epoch: 76, train_loss: 0.1806, test_loss: 2.8410, test_f1: 0.6061
 epoch: 77, train_loss: 0.1540, test_loss: 2.9371, test_f1: 0.6278
 epoch: 78, train_loss: 0.1417, test_loss: 2.8199, test_f1: 0.6260
 epoch: 79, train_loss: 0.1337, test_loss: 3.2254, test_f1: 0.6063
 epoch: 80, train_loss: 0.1318, test_loss: 2.9946, test_f1: 0.6210
 epoch: 81, train_loss: 0.1657, test_loss: 3.0196, test_f1: 0.6171
 epoch: 82, train_loss: 0.1537, test_loss: 3.2477, test_f1: 0.6198
 epoch: 83, train_loss: 0.1487, test_loss: 3.1832, test_f1: 0.6116
 epoch: 84, train_loss: 0.1140, test_loss: 3.2920, test_f1: 0.6222
 epoch: 85, train_loss: 0.1300, test_loss: 3.2535, test_f1: 0.6144
 epoch: 86, train_loss: 0.1135, test_loss: 3.4024, test_f1: 0.6169
 epoch: 87, train_loss: 0.1033, test_loss: 3.5909, test_f1: 0.5749
 epoch: 88, train_loss: 0.1072, test_loss: 3.3972, test_f1: 0.6159
 epoch: 89, train_loss: 0.1337, test_loss: 3.7234, test_f1: 0.5863
 epoch: 90, train_loss: 0.1187, test_loss: 3.3547, test_f1: 0.6305
 epoch: 91, train_loss: 0.1199, test_loss: 3.6643, test_f1: 0.6015
 epoch: 92, train_loss: 0.1548, test_loss: 3.4171, test_f1: 0.6229
 epoch: 93, train_loss: 0.1978, test_loss: 2.9200, test_f1: 0.5738
 epoch: 94, train_loss: 0.1167, test_loss: 3.5267, test_f1: 0.6112
 epoch: 95, train_loss: 0.1189, test_loss: 3.4998, test_f1: 0.5997
 epoch: 96, train_loss: 0.1397, test_loss: 3.4524, test_f1: 0.5955
 epoch: 97, train_loss: 0.1224, test_loss: 3.5680, test_f1: 0.6259
 epoch: 98, train_loss: 0.1133, test_loss: 3.6401, test_f1: 0.5998
 epoch: 99, train_loss: 0.1218, test_loss: 3.4258, test_f1: 0.6148
##################ITERATION #1 ****************************************
 epoch: 0, train_loss: 1.0983, test_loss: 1.1461, test_f1: 0.2404
 epoch: 1, train_loss: 0.9805, test_loss: 1.0226, test_f1: 0.5293
 epoch: 2, train_loss: 0.9099, test_loss: 1.0298, test_f1: 0.5587
 epoch: 3, train_loss: 0.8832, test_loss: 1.0608, test_f1: 0.5292
 epoch: 4, train_loss: 0.8512, test_loss: 1.0533, test_f1: 0.5509
 epoch: 5, train_loss: 0.8358, test_loss: 1.0912, test_f1: 0.5296
 epoch: 6, train_loss: 0.7931, test_loss: 1.1321, test_f1: 0.5078
 epoch: 7, train_loss: 0.7788, test_loss: 1.0681, test_f1: 0.5712
 epoch: 8, train_loss: 0.7555, test_loss: 1.0845, test_f1: 0.5958
 epoch: 9, train_loss: 0.7233, test_loss: 1.1101, test_f1: 0.5893
 epoch: 10, train_loss: 0.7022, test_loss: 1.3540, test_f1: 0.5234
 epoch: 11, train_loss: 0.6666, test_loss: 1.1418, test_f1: 0.6040
 epoch: 12, train_loss: 0.6608, test_loss: 1.0044, test_f1: 0.6328
 epoch: 13, train_loss: 0.6441, test_loss: 1.1659, test_f1: 0.5760
 epoch: 14, train_loss: 0.6234, test_loss: 1.1278, test_f1: 0.6340
 epoch: 15, train_loss: 0.6141, test_loss: 1.1461, test_f1: 0.6310
 epoch: 16, train_loss: 0.5738, test_loss: 1.1556, test_f1: 0.6151
 epoch: 17, train_loss: 0.6281, test_loss: 1.1341, test_f1: 0.6444
 epoch: 18, train_loss: 0.5976, test_loss: 1.3623, test_f1: 0.5807
 epoch: 19, train_loss: 0.5624, test_loss: 1.1679, test_f1: 0.6195
 epoch: 20, train_loss: 0.5829, test_loss: 1.1266, test_f1: 0.6596
 epoch: 21, train_loss: 0.5296, test_loss: 1.3011, test_f1: 0.5969
 epoch: 22, train_loss: 0.5665, test_loss: 1.2063, test_f1: 0.5867
 epoch: 23, train_loss: 0.5565, test_loss: 1.2099, test_f1: 0.6208
 epoch: 24, train_loss: 0.5165, test_loss: 1.4101, test_f1: 0.6083
 epoch: 25, train_loss: 0.5105, test_loss: 1.3998, test_f1: 0.5945
 epoch: 26, train_loss: 0.4749, test_loss: 1.3944, test_f1: 0.6344
 epoch: 27, train_loss: 0.4902, test_loss: 1.2628, test_f1: 0.6086
 epoch: 28, train_loss: 0.5488, test_loss: 1.3114, test_f1: 0.6334
 epoch: 29, train_loss: 0.4702, test_loss: 1.3756, test_f1: 0.6122
 epoch: 30, train_loss: 0.4676, test_loss: 1.4677, test_f1: 0.6320
 epoch: 31, train_loss: 0.4456, test_loss: 1.5516, test_f1: 0.5531
 epoch: 32, train_loss: 0.4326, test_loss: 1.4170, test_f1: 0.6696
 epoch: 33, train_loss: 0.4073, test_loss: 1.6473, test_f1: 0.6051
 epoch: 34, train_loss: 0.4182, test_loss: 1.4665, test_f1: 0.6072
 epoch: 35, train_loss: 0.3987, test_loss: 1.6269, test_f1: 0.6256
 epoch: 36, train_loss: 0.3634, test_loss: 1.7837, test_f1: 0.5731
 epoch: 37, train_loss: 0.4108, test_loss: 1.6508, test_f1: 0.6256
 epoch: 38, train_loss: 0.4288, test_loss: 1.6531, test_f1: 0.5735
 epoch: 39, train_loss: 0.3804, test_loss: 1.5438, test_f1: 0.5991
 epoch: 40, train_loss: 0.3713, test_loss: 1.5358, test_f1: 0.6143
 epoch: 41, train_loss: 0.3437, test_loss: 1.8137, test_f1: 0.6250
 epoch: 42, train_loss: 0.3523, test_loss: 1.8247, test_f1: 0.5954
 epoch: 43, train_loss: 0.3476, test_loss: 1.7961, test_f1: 0.6176
 epoch: 44, train_loss: 0.3306, test_loss: 1.9245, test_f1: 0.5898
 epoch: 45, train_loss: 0.3329, test_loss: 1.8945, test_f1: 0.5931
 epoch: 46, train_loss: 0.3561, test_loss: 1.8267, test_f1: 0.6286
 epoch: 47, train_loss: 0.3522, test_loss: 1.9583, test_f1: 0.5834
 epoch: 48, train_loss: 0.3240, test_loss: 2.0533, test_f1: 0.5942
 epoch: 49, train_loss: 0.2895, test_loss: 2.1429, test_f1: 0.5907
 epoch: 50, train_loss: 0.3211, test_loss: 1.9758, test_f1: 0.6007
 epoch: 51, train_loss: 0.2661, test_loss: 2.0594, test_f1: 0.6256
 epoch: 52, train_loss: 0.2388, test_loss: 2.1891, test_f1: 0.5977
 epoch: 53, train_loss: 0.2136, test_loss: 2.4072, test_f1: 0.6069
 epoch: 54, train_loss: 0.2218, test_loss: 2.5375, test_f1: 0.5706
 epoch: 55, train_loss: 0.2247, test_loss: 2.4766, test_f1: 0.5837
 epoch: 56, train_loss: 0.1976, test_loss: 2.5805, test_f1: 0.5633
 epoch: 57, train_loss: 0.2052, test_loss: 2.6688, test_f1: 0.5937
 epoch: 58, train_loss: 0.1852, test_loss: 2.5595, test_f1: 0.6121
 epoch: 59, train_loss: 0.1824, test_loss: 2.6759, test_f1: 0.5927
 epoch: 60, train_loss: 0.2130, test_loss: 2.6342, test_f1: 0.6044
 epoch: 61, train_loss: 0.2173, test_loss: 2.7608, test_f1: 0.6041
 epoch: 62, train_loss: 0.1602, test_loss: 2.9600, test_f1: 0.5793
 epoch: 63, train_loss: 0.1746, test_loss: 3.1589, test_f1: 0.5751
 epoch: 64, train_loss: 0.1666, test_loss: 3.1183, test_f1: 0.5682
 epoch: 65, train_loss: 0.1639, test_loss: 3.1340, test_f1: 0.6060
 epoch: 66, train_loss: 0.1848, test_loss: 3.0125, test_f1: 0.6095
 epoch: 67, train_loss: 0.1827, test_loss: 2.9574, test_f1: 0.5793
 epoch: 68, train_loss: 0.1862, test_loss: 2.8860, test_f1: 0.5745
 epoch: 69, train_loss: 0.1629, test_loss: 3.1458, test_f1: 0.5786
 epoch: 70, train_loss: 0.1439, test_loss: 3.0570, test_f1: 0.6235
 epoch: 71, train_loss: 0.1630, test_loss: 2.9719, test_f1: 0.6155
 epoch: 72, train_loss: 0.1479, test_loss: 3.0623, test_f1: 0.6190
 epoch: 73, train_loss: 0.1457, test_loss: 3.3330, test_f1: 0.5697
 epoch: 74, train_loss: 0.1630, test_loss: 3.2344, test_f1: 0.6216
 epoch: 75, train_loss: 0.1432, test_loss: 3.2539, test_f1: 0.6139
 epoch: 76, train_loss: 0.1381, test_loss: 3.2611, test_f1: 0.5949
 epoch: 77, train_loss: 0.1292, test_loss: 3.4299, test_f1: 0.5836
 epoch: 78, train_loss: 0.1345, test_loss: 3.6680, test_f1: 0.5679
 epoch: 79, train_loss: 0.1307, test_loss: 3.4852, test_f1: 0.6023
 epoch: 80, train_loss: 0.1358, test_loss: 3.2917, test_f1: 0.5648
 epoch: 81, train_loss: 0.1214, test_loss: 3.5310, test_f1: 0.6022
 epoch: 82, train_loss: 0.1272, test_loss: 3.3405, test_f1: 0.5918
 epoch: 83, train_loss: 0.1644, test_loss: 3.4012, test_f1: 0.6087
 epoch: 84, train_loss: 0.1221, test_loss: 3.8581, test_f1: 0.5963
 epoch: 85, train_loss: 0.1293, test_loss: 3.8856, test_f1: 0.5910
 epoch: 86, train_loss: 0.1552, test_loss: 3.8210, test_f1: 0.5953
 epoch: 87, train_loss: 0.1036, test_loss: 3.8864, test_f1: 0.5896
 epoch: 88, train_loss: 0.1433, test_loss: 3.8127, test_f1: 0.5679
 epoch: 89, train_loss: 0.1684, test_loss: 3.1786, test_f1: 0.5947
 epoch: 90, train_loss: 0.1366, test_loss: 3.5147, test_f1: 0.5975
 epoch: 91, train_loss: 0.1228, test_loss: 3.4305, test_f1: 0.5911
 epoch: 92, train_loss: 0.1290, test_loss: 3.7909, test_f1: 0.5877
 epoch: 93, train_loss: 0.1097, test_loss: 3.8364, test_f1: 0.5947
 epoch: 94, train_loss: 0.1118, test_loss: 3.5372, test_f1: 0.6038
 epoch: 95, train_loss: 0.1278, test_loss: 3.6922, test_f1: 0.6097
 epoch: 96, train_loss: 0.1177, test_loss: 3.9409, test_f1: 0.6152
 epoch: 97, train_loss: 0.1404, test_loss: 3.7097, test_f1: 0.5909
 epoch: 98, train_loss: 0.1325, test_loss: 3.8409, test_f1: 0.6134
 epoch: 99, train_loss: 0.1106, test_loss: 3.7339, test_f1: 0.5844
##################ITERATION #2 ****************************************
 epoch: 0, train_loss: 1.1435, test_loss: 1.1425, test_f1: 0.4378
 epoch: 1, train_loss: 0.9703, test_loss: 1.0069, test_f1: 0.5878
 epoch: 2, train_loss: 0.9120, test_loss: 1.0538, test_f1: 0.5128
 epoch: 3, train_loss: 0.8666, test_loss: 1.0652, test_f1: 0.4903
 epoch: 4, train_loss: 0.8524, test_loss: 1.0011, test_f1: 0.5190
 epoch: 5, train_loss: 0.8527, test_loss: 1.0005, test_f1: 0.5604
 epoch: 6, train_loss: 0.8058, test_loss: 1.0831, test_f1: 0.5186
 epoch: 7, train_loss: 0.8009, test_loss: 1.0324, test_f1: 0.6018
 epoch: 8, train_loss: 0.7609, test_loss: 1.1004, test_f1: 0.5314
 epoch: 9, train_loss: 0.7261, test_loss: 1.0953, test_f1: 0.5548
 epoch: 10, train_loss: 0.7159, test_loss: 1.0695, test_f1: 0.5978
 epoch: 11, train_loss: 0.6977, test_loss: 1.1038, test_f1: 0.5929
 epoch: 12, train_loss: 0.7051, test_loss: 1.0146, test_f1: 0.5842
 epoch: 13, train_loss: 0.6620, test_loss: 1.1898, test_f1: 0.5703
 epoch: 14, train_loss: 0.6651, test_loss: 1.2404, test_f1: 0.5379
 epoch: 15, train_loss: 0.6315, test_loss: 1.1865, test_f1: 0.5879
 epoch: 16, train_loss: 0.6102, test_loss: 1.3775, test_f1: 0.5534
 epoch: 17, train_loss: 0.5862, test_loss: 1.1873, test_f1: 0.5831
 epoch: 18, train_loss: 0.6077, test_loss: 1.0618, test_f1: 0.6582
 epoch: 19, train_loss: 0.5874, test_loss: 1.2772, test_f1: 0.5759
 epoch: 20, train_loss: 0.5670, test_loss: 1.2247, test_f1: 0.6142
 epoch: 21, train_loss: 0.5646, test_loss: 1.2161, test_f1: 0.6565
 epoch: 22, train_loss: 0.5707, test_loss: 1.2549, test_f1: 0.5833
 epoch: 23, train_loss: 0.5761, test_loss: 1.2869, test_f1: 0.6264
 epoch: 24, train_loss: 0.5459, test_loss: 1.2348, test_f1: 0.5941
 epoch: 25, train_loss: 0.5079, test_loss: 1.4548, test_f1: 0.6156
 epoch: 26, train_loss: 0.5179, test_loss: 1.3870, test_f1: 0.5720
 epoch: 27, train_loss: 0.5083, test_loss: 1.2824, test_f1: 0.5803
 epoch: 28, train_loss: 0.4574, test_loss: 1.4815, test_f1: 0.6236
 epoch: 29, train_loss: 0.4877, test_loss: 1.2835, test_f1: 0.6160
 epoch: 30, train_loss: 0.4552, test_loss: 1.3622, test_f1: 0.6012
 epoch: 31, train_loss: 0.4624, test_loss: 1.3143, test_f1: 0.6463
 epoch: 32, train_loss: 0.4726, test_loss: 1.3321, test_f1: 0.5987
 epoch: 33, train_loss: 0.4322, test_loss: 1.5537, test_f1: 0.5688
 epoch: 34, train_loss: 0.4487, test_loss: 1.5705, test_f1: 0.5845
 epoch: 35, train_loss: 0.4328, test_loss: 1.4278, test_f1: 0.5844
 epoch: 36, train_loss: 0.3888, test_loss: 1.5570, test_f1: 0.6530
 epoch: 37, train_loss: 0.3813, test_loss: 1.5338, test_f1: 0.5584
 epoch: 38, train_loss: 0.4225, test_loss: 1.5765, test_f1: 0.5654
 epoch: 39, train_loss: 0.3629, test_loss: 1.6683, test_f1: 0.6114
 epoch: 40, train_loss: 0.4129, test_loss: 1.7011, test_f1: 0.6214
 epoch: 41, train_loss: 0.3961, test_loss: 1.7332, test_f1: 0.6088
 epoch: 42, train_loss: 0.3742, test_loss: 1.6024, test_f1: 0.6271
 epoch: 43, train_loss: 0.3954, test_loss: 1.4583, test_f1: 0.5878
 epoch: 44, train_loss: 0.3254, test_loss: 1.5098, test_f1: 0.5785
 epoch: 45, train_loss: 0.3394, test_loss: 1.8394, test_f1: 0.5208
 epoch: 46, train_loss: 0.3702, test_loss: 1.6305, test_f1: 0.6218
 epoch: 47, train_loss: 0.3409, test_loss: 1.6152, test_f1: 0.6018
 epoch: 48, train_loss: 0.3396, test_loss: 1.6455, test_f1: 0.6176
 epoch: 49, train_loss: 0.2940, test_loss: 1.8279, test_f1: 0.5830
 epoch: 50, train_loss: 0.3346, test_loss: 1.7893, test_f1: 0.6006
 epoch: 51, train_loss: 0.2639, test_loss: 1.8089, test_f1: 0.5761
 epoch: 52, train_loss: 0.2242, test_loss: 1.8301, test_f1: 0.6064
 epoch: 53, train_loss: 0.2239, test_loss: 1.9372, test_f1: 0.5996
 epoch: 54, train_loss: 0.2340, test_loss: 2.1692, test_f1: 0.5849
 epoch: 55, train_loss: 0.2261, test_loss: 2.1498, test_f1: 0.5781
 epoch: 56, train_loss: 0.2043, test_loss: 2.2044, test_f1: 0.5889
 epoch: 57, train_loss: 0.2064, test_loss: 1.9972, test_f1: 0.5865
 epoch: 58, train_loss: 0.1820, test_loss: 2.1647, test_f1: 0.6044
 epoch: 59, train_loss: 0.2033, test_loss: 2.4356, test_f1: 0.5182
 epoch: 60, train_loss: 0.1970, test_loss: 2.1834, test_f1: 0.6008
 epoch: 61, train_loss: 0.1930, test_loss: 2.2206, test_f1: 0.5726
 epoch: 62, train_loss: 0.1819, test_loss: 2.3908, test_f1: 0.5990
 epoch: 63, train_loss: 0.1803, test_loss: 2.4414, test_f1: 0.5897
 epoch: 64, train_loss: 0.1974, test_loss: 2.1720, test_f1: 0.5891
 epoch: 65, train_loss: 0.2200, test_loss: 2.2846, test_f1: 0.5947
 epoch: 66, train_loss: 0.1651, test_loss: 2.4269, test_f1: 0.5430
 epoch: 67, train_loss: 0.1444, test_loss: 2.6049, test_f1: 0.5139
 epoch: 68, train_loss: 0.1813, test_loss: 2.5154, test_f1: 0.5758
 epoch: 69, train_loss: 0.1730, test_loss: 2.4950, test_f1: 0.5536
 epoch: 70, train_loss: 0.1500, test_loss: 2.4545, test_f1: 0.5966
 epoch: 71, train_loss: 0.1582, test_loss: 2.4996, test_f1: 0.5916
 epoch: 72, train_loss: 0.1591, test_loss: 2.8674, test_f1: 0.5484
 epoch: 73, train_loss: 0.1702, test_loss: 2.7481, test_f1: 0.5505
 epoch: 74, train_loss: 0.1546, test_loss: 2.6201, test_f1: 0.5811
 epoch: 75, train_loss: 0.1817, test_loss: 2.6309, test_f1: 0.5627
 epoch: 76, train_loss: 0.1306, test_loss: 2.8410, test_f1: 0.5531
 epoch: 77, train_loss: 0.1347, test_loss: 2.8353, test_f1: 0.5482
 epoch: 78, train_loss: 0.1550, test_loss: 2.8467, test_f1: 0.5602
 epoch: 79, train_loss: 0.1452, test_loss: 2.8752, test_f1: 0.5835
 epoch: 80, train_loss: 0.1300, test_loss: 2.9908, test_f1: 0.5713
 epoch: 81, train_loss: 0.1478, test_loss: 3.0301, test_f1: 0.5410
 epoch: 82, train_loss: 0.1507, test_loss: 2.9429, test_f1: 0.5688
 epoch: 83, train_loss: 0.1104, test_loss: 2.9099, test_f1: 0.5631
 epoch: 84, train_loss: 0.1267, test_loss: 2.8882, test_f1: 0.5674
 epoch: 85, train_loss: 0.0926, test_loss: 2.9784, test_f1: 0.5536
 epoch: 86, train_loss: 0.1365, test_loss: 2.9624, test_f1: 0.5713
 epoch: 87, train_loss: 0.1160, test_loss: 2.9535, test_f1: 0.5724
 epoch: 88, train_loss: 0.1141, test_loss: 3.0628, test_f1: 0.5552
 epoch: 89, train_loss: 0.1287, test_loss: 3.1684, test_f1: 0.5638
 epoch: 90, train_loss: 0.0883, test_loss: 3.4970, test_f1: 0.5197
 epoch: 91, train_loss: 0.0979, test_loss: 3.2077, test_f1: 0.5388
 epoch: 92, train_loss: 0.0962, test_loss: 3.2309, test_f1: 0.5773
 epoch: 93, train_loss: 0.1141, test_loss: 3.1744, test_f1: 0.5367
 epoch: 94, train_loss: 0.1350, test_loss: 3.1577, test_f1: 0.5616
 epoch: 95, train_loss: 0.1106, test_loss: 3.1195, test_f1: 0.5818
 epoch: 96, train_loss: 0.0959, test_loss: 3.4237, test_f1: 0.5547
 epoch: 97, train_loss: 0.1001, test_loss: 3.3362, test_f1: 0.5675
 epoch: 98, train_loss: 0.1127, test_loss: 3.0815, test_f1: 0.5406
 epoch: 99, train_loss: 0.1359, test_loss: 2.7711, test_f1: 0.5970
##################ITERATION #3 ****************************************
 epoch: 0, train_loss: 1.1671, test_loss: 1.1879, test_f1: 0.4029
 epoch: 1, train_loss: 0.9634, test_loss: 1.0112, test_f1: 0.5490
 epoch: 2, train_loss: 0.9154, test_loss: 0.9979, test_f1: 0.5862
 epoch: 3, train_loss: 0.8587, test_loss: 1.0014, test_f1: 0.5541
 epoch: 4, train_loss: 0.8644, test_loss: 1.0133, test_f1: 0.5638
 epoch: 5, train_loss: 0.8195, test_loss: 1.0096, test_f1: 0.5902
 epoch: 6, train_loss: 0.7693, test_loss: 1.0815, test_f1: 0.6049
 epoch: 7, train_loss: 0.7511, test_loss: 1.1059, test_f1: 0.5714
 epoch: 8, train_loss: 0.7499, test_loss: 1.0818, test_f1: 0.5541
 epoch: 9, train_loss: 0.7510, test_loss: 1.0284, test_f1: 0.5899
 epoch: 10, train_loss: 0.7323, test_loss: 1.0078, test_f1: 0.5613
 epoch: 11, train_loss: 0.6757, test_loss: 1.0212, test_f1: 0.5813
 epoch: 12, train_loss: 0.6860, test_loss: 1.1293, test_f1: 0.5780
 epoch: 13, train_loss: 0.6805, test_loss: 1.1526, test_f1: 0.5666
 epoch: 14, train_loss: 0.6677, test_loss: 1.1161, test_f1: 0.6152
 epoch: 15, train_loss: 0.6191, test_loss: 1.0920, test_f1: 0.6455
 epoch: 16, train_loss: 0.6261, test_loss: 1.0615, test_f1: 0.5993
 epoch: 17, train_loss: 0.6066, test_loss: 1.0782, test_f1: 0.6220
 epoch: 18, train_loss: 0.5991, test_loss: 1.2839, test_f1: 0.5733
 epoch: 19, train_loss: 0.5639, test_loss: 1.3879, test_f1: 0.5906
 epoch: 20, train_loss: 0.5561, test_loss: 1.1657, test_f1: 0.5825
 epoch: 21, train_loss: 0.5961, test_loss: 1.2716, test_f1: 0.5489
 epoch: 22, train_loss: 0.5517, test_loss: 1.1199, test_f1: 0.6256
 epoch: 23, train_loss: 0.5789, test_loss: 1.1964, test_f1: 0.5593
 epoch: 24, train_loss: 0.5241, test_loss: 1.1565, test_f1: 0.6411
 epoch: 25, train_loss: 0.4917, test_loss: 1.2611, test_f1: 0.6319
 epoch: 26, train_loss: 0.5048, test_loss: 1.3841, test_f1: 0.6008
 epoch: 27, train_loss: 0.4707, test_loss: 1.1915, test_f1: 0.6276
 epoch: 28, train_loss: 0.4876, test_loss: 1.2109, test_f1: 0.6037
 epoch: 29, train_loss: 0.4838, test_loss: 1.1840, test_f1: 0.6126
 epoch: 30, train_loss: 0.4673, test_loss: 1.2586, test_f1: 0.6136
 epoch: 31, train_loss: 0.4492, test_loss: 1.4392, test_f1: 0.6050
 epoch: 32, train_loss: 0.4491, test_loss: 1.4644, test_f1: 0.5359
 epoch: 33, train_loss: 0.4198, test_loss: 1.4654, test_f1: 0.6020
 epoch: 34, train_loss: 0.4489, test_loss: 1.5207, test_f1: 0.5398
 epoch: 35, train_loss: 0.4140, test_loss: 1.5934, test_f1: 0.5755
 epoch: 36, train_loss: 0.4117, test_loss: 1.4186, test_f1: 0.6362
 epoch: 37, train_loss: 0.3724, test_loss: 1.4361, test_f1: 0.6196
 epoch: 38, train_loss: 0.3738, test_loss: 1.5767, test_f1: 0.5851
 epoch: 39, train_loss: 0.3832, test_loss: 1.3899, test_f1: 0.5768
 epoch: 40, train_loss: 0.3866, test_loss: 1.5265, test_f1: 0.5991
 epoch: 41, train_loss: 0.3484, test_loss: 1.8209, test_f1: 0.5668
 epoch: 42, train_loss: 0.3807, test_loss: 1.6644, test_f1: 0.5710
 epoch: 43, train_loss: 0.3737, test_loss: 1.5299, test_f1: 0.6171
 epoch: 44, train_loss: 0.3915, test_loss: 1.4865, test_f1: 0.5997
 epoch: 45, train_loss: 0.3227, test_loss: 1.7280, test_f1: 0.5888
 epoch: 46, train_loss: 0.3088, test_loss: 1.7339, test_f1: 0.6027
 epoch: 47, train_loss: 0.3317, test_loss: 1.6515, test_f1: 0.6017
 epoch: 48, train_loss: 0.3232, test_loss: 1.7036, test_f1: 0.5653
 epoch: 49, train_loss: 0.3517, test_loss: 1.6567, test_f1: 0.5765
 epoch: 50, train_loss: 0.3164, test_loss: 1.8787, test_f1: 0.6128
 epoch: 51, train_loss: 0.2492, test_loss: 1.8651, test_f1: 0.5945
 epoch: 52, train_loss: 0.2259, test_loss: 1.7686, test_f1: 0.6065
 epoch: 53, train_loss: 0.2181, test_loss: 1.9674, test_f1: 0.5747
 epoch: 54, train_loss: 0.1930, test_loss: 2.0569, test_f1: 0.5743
 epoch: 55, train_loss: 0.1949, test_loss: 1.9333, test_f1: 0.5980
 epoch: 56, train_loss: 0.1962, test_loss: 2.1274, test_f1: 0.5908
 epoch: 57, train_loss: 0.2214, test_loss: 2.1208, test_f1: 0.5619
 epoch: 58, train_loss: 0.1851, test_loss: 2.0987, test_f1: 0.5792
 epoch: 59, train_loss: 0.1929, test_loss: 2.1632, test_f1: 0.5857
 epoch: 60, train_loss: 0.1935, test_loss: 2.2666, test_f1: 0.5576
 epoch: 61, train_loss: 0.1839, test_loss: 2.2040, test_f1: 0.5855
 epoch: 62, train_loss: 0.1725, test_loss: 2.2756, test_f1: 0.5761
 epoch: 63, train_loss: 0.1739, test_loss: 2.3298, test_f1: 0.5930
 epoch: 64, train_loss: 0.1846, test_loss: 2.3563, test_f1: 0.5858
 epoch: 65, train_loss: 0.1756, test_loss: 2.4190, test_f1: 0.5931
 epoch: 66, train_loss: 0.1582, test_loss: 2.3139, test_f1: 0.5915
 epoch: 67, train_loss: 0.1521, test_loss: 2.5853, test_f1: 0.5642
 epoch: 68, train_loss: 0.1613, test_loss: 2.5719, test_f1: 0.5675
 epoch: 69, train_loss: 0.1983, test_loss: 2.2964, test_f1: 0.5808
 epoch: 70, train_loss: 0.1834, test_loss: 2.6233, test_f1: 0.5873
 epoch: 71, train_loss: 0.1977, test_loss: 2.6127, test_f1: 0.5700
 epoch: 72, train_loss: 0.1621, test_loss: 2.4853, test_f1: 0.5847
 epoch: 73, train_loss: 0.1394, test_loss: 2.5342, test_f1: 0.5704
 epoch: 74, train_loss: 0.1266, test_loss: 2.5998, test_f1: 0.5850
 epoch: 75, train_loss: 0.1428, test_loss: 2.7891, test_f1: 0.5421
 epoch: 76, train_loss: 0.1356, test_loss: 2.7265, test_f1: 0.5642
 epoch: 77, train_loss: 0.1371, test_loss: 2.7682, test_f1: 0.5983
 epoch: 78, train_loss: 0.1781, test_loss: 2.5375, test_f1: 0.5624
 epoch: 79, train_loss: 0.1355, test_loss: 2.5383, test_f1: 0.5791
 epoch: 80, train_loss: 0.1530, test_loss: 2.7308, test_f1: 0.5728
 epoch: 81, train_loss: 0.1662, test_loss: 2.5652, test_f1: 0.5793
 epoch: 82, train_loss: 0.1220, test_loss: 2.4382, test_f1: 0.5563
 epoch: 83, train_loss: 0.1271, test_loss: 2.8418, test_f1: 0.5834
 epoch: 84, train_loss: 0.1363, test_loss: 2.8312, test_f1: 0.5908
 epoch: 85, train_loss: 0.1337, test_loss: 2.7096, test_f1: 0.5800
 epoch: 86, train_loss: 0.1377, test_loss: 2.8130, test_f1: 0.5620
 epoch: 87, train_loss: 0.1293, test_loss: 2.8564, test_f1: 0.5702
 epoch: 88, train_loss: 0.1376, test_loss: 2.7361, test_f1: 0.5854
 epoch: 89, train_loss: 0.1287, test_loss: 2.6155, test_f1: 0.6069
 epoch: 90, train_loss: 0.1366, test_loss: 2.7119, test_f1: 0.5658
 epoch: 91, train_loss: 0.1576, test_loss: 2.7466, test_f1: 0.5573
 epoch: 92, train_loss: 0.1148, test_loss: 2.7172, test_f1: 0.5575
 epoch: 93, train_loss: 0.1187, test_loss: 2.7593, test_f1: 0.5642
 epoch: 94, train_loss: 0.1177, test_loss: 2.9686, test_f1: 0.5575
 epoch: 95, train_loss: 0.0971, test_loss: 3.0947, test_f1: 0.5660
 epoch: 96, train_loss: 0.0914, test_loss: 3.3075, test_f1: 0.5381
 epoch: 97, train_loss: 0.1405, test_loss: 2.8400, test_f1: 0.5670
 epoch: 98, train_loss: 0.1207, test_loss: 3.0264, test_f1: 0.5962
 epoch: 99, train_loss: 0.1280, test_loss: 2.9557, test_f1: 0.5803
##################ITERATION #4 ****************************************
 epoch: 0, train_loss: 1.2412, test_loss: 1.2362, test_f1: 0.3525
 epoch: 1, train_loss: 1.0219, test_loss: 1.0114, test_f1: 0.5794
 epoch: 2, train_loss: 0.9059, test_loss: 1.0006, test_f1: 0.5678
 epoch: 3, train_loss: 0.8596, test_loss: 1.0559, test_f1: 0.5438
 epoch: 4, train_loss: 0.8559, test_loss: 1.0385, test_f1: 0.5540
 epoch: 5, train_loss: 0.7875, test_loss: 1.0568, test_f1: 0.5342
 epoch: 6, train_loss: 0.7769, test_loss: 1.0485, test_f1: 0.5359
 epoch: 7, train_loss: 0.7808, test_loss: 1.0171, test_f1: 0.5973
 epoch: 8, train_loss: 0.7303, test_loss: 1.1046, test_f1: 0.5266
 epoch: 9, train_loss: 0.7220, test_loss: 1.0529, test_f1: 0.6113
 epoch: 10, train_loss: 0.6908, test_loss: 1.0882, test_f1: 0.5399
 epoch: 11, train_loss: 0.6898, test_loss: 1.0951, test_f1: 0.6029
 epoch: 12, train_loss: 0.6856, test_loss: 1.2393, test_f1: 0.5455
 epoch: 13, train_loss: 0.6300, test_loss: 1.0495, test_f1: 0.5988
 epoch: 14, train_loss: 0.6478, test_loss: 1.0816, test_f1: 0.6297
 epoch: 15, train_loss: 0.6393, test_loss: 1.0252, test_f1: 0.6373
 epoch: 16, train_loss: 0.6055, test_loss: 1.0167, test_f1: 0.6142
 epoch: 17, train_loss: 0.5941, test_loss: 0.9760, test_f1: 0.6354
 epoch: 18, train_loss: 0.5547, test_loss: 1.1305, test_f1: 0.6389
 epoch: 19, train_loss: 0.5654, test_loss: 0.9632, test_f1: 0.6268
 epoch: 20, train_loss: 0.5701, test_loss: 1.1444, test_f1: 0.5832
 epoch: 21, train_loss: 0.5384, test_loss: 1.0867, test_f1: 0.6380
 epoch: 22, train_loss: 0.5275, test_loss: 1.0883, test_f1: 0.6023
 epoch: 23, train_loss: 0.4752, test_loss: 1.2044, test_f1: 0.5942
 epoch: 24, train_loss: 0.5098, test_loss: 1.1505, test_f1: 0.6313
 epoch: 25, train_loss: 0.5115, test_loss: 1.2259, test_f1: 0.6022
 epoch: 26, train_loss: 0.4490, test_loss: 1.1933, test_f1: 0.6269
 epoch: 27, train_loss: 0.4403, test_loss: 1.3431, test_f1: 0.5896
 epoch: 28, train_loss: 0.4990, test_loss: 1.1992, test_f1: 0.6064
 epoch: 29, train_loss: 0.5205, test_loss: 1.3988, test_f1: 0.6306
 epoch: 30, train_loss: 0.4572, test_loss: 1.3673, test_f1: 0.5888
 epoch: 31, train_loss: 0.4306, test_loss: 1.3363, test_f1: 0.5578
 epoch: 32, train_loss: 0.4292, test_loss: 1.4168, test_f1: 0.6431
 epoch: 33, train_loss: 0.4624, test_loss: 1.2271, test_f1: 0.6562
 epoch: 34, train_loss: 0.4111, test_loss: 1.3742, test_f1: 0.6090
 epoch: 35, train_loss: 0.4107, test_loss: 1.3126, test_f1: 0.6251
 epoch: 36, train_loss: 0.3497, test_loss: 1.4689, test_f1: 0.5804
 epoch: 37, train_loss: 0.3566, test_loss: 1.3416, test_f1: 0.6305
 epoch: 38, train_loss: 0.3805, test_loss: 1.4222, test_f1: 0.6082
 epoch: 39, train_loss: 0.4064, test_loss: 1.2671, test_f1: 0.6169
 epoch: 40, train_loss: 0.3406, test_loss: 1.4086, test_f1: 0.6620
 epoch: 41, train_loss: 0.3496, test_loss: 1.5719, test_f1: 0.6375
 epoch: 42, train_loss: 0.3475, test_loss: 1.3795, test_f1: 0.6421
 epoch: 43, train_loss: 0.3272, test_loss: 1.6125, test_f1: 0.6363
 epoch: 44, train_loss: 0.3583, test_loss: 1.3398, test_f1: 0.6659
 epoch: 45, train_loss: 0.2846, test_loss: 1.4872, test_f1: 0.6410
 epoch: 46, train_loss: 0.2877, test_loss: 1.6944, test_f1: 0.6266
 epoch: 47, train_loss: 0.3244, test_loss: 1.6609, test_f1: 0.6428
 epoch: 48, train_loss: 0.3149, test_loss: 1.5468, test_f1: 0.6452
 epoch: 49, train_loss: 0.2712, test_loss: 1.6506, test_f1: 0.6272
 epoch: 50, train_loss: 0.2632, test_loss: 2.0191, test_f1: 0.5648
 epoch: 51, train_loss: 0.2698, test_loss: 1.8864, test_f1: 0.6296
 epoch: 52, train_loss: 0.1880, test_loss: 1.8820, test_f1: 0.6224
 epoch: 53, train_loss: 0.1964, test_loss: 1.8641, test_f1: 0.6526
 epoch: 54, train_loss: 0.1771, test_loss: 2.0959, test_f1: 0.6144
 epoch: 55, train_loss: 0.1905, test_loss: 1.9536, test_f1: 0.6163
 epoch: 56, train_loss: 0.1992, test_loss: 1.9322, test_f1: 0.6502
 epoch: 57, train_loss: 0.1698, test_loss: 2.1388, test_f1: 0.6225
 epoch: 58, train_loss: 0.1798, test_loss: 1.9823, test_f1: 0.6253
 epoch: 59, train_loss: 0.1593, test_loss: 2.1655, test_f1: 0.6206
 epoch: 60, train_loss: 0.1500, test_loss: 2.1862, test_f1: 0.6425
 epoch: 61, train_loss: 0.1676, test_loss: 2.2646, test_f1: 0.6161
 epoch: 62, train_loss: 0.1694, test_loss: 2.2481, test_f1: 0.6385
 epoch: 63, train_loss: 0.1510, test_loss: 2.3958, test_f1: 0.6111
 epoch: 64, train_loss: 0.1513, test_loss: 2.2261, test_f1: 0.6500
 epoch: 65, train_loss: 0.1878, test_loss: 2.1137, test_f1: 0.6624
 epoch: 66, train_loss: 0.1380, test_loss: 2.2964, test_f1: 0.5664
 epoch: 67, train_loss: 0.1359, test_loss: 2.2880, test_f1: 0.6285
 epoch: 68, train_loss: 0.1228, test_loss: 2.3378, test_f1: 0.6387
 epoch: 69, train_loss: 0.1581, test_loss: 2.4551, test_f1: 0.6114
 epoch: 70, train_loss: 0.1422, test_loss: 2.3531, test_f1: 0.6482
 epoch: 71, train_loss: 0.1559, test_loss: 2.5704, test_f1: 0.6011
 epoch: 72, train_loss: 0.1306, test_loss: 2.5325, test_f1: 0.6172
 epoch: 73, train_loss: 0.1463, test_loss: 2.5424, test_f1: 0.6078
 epoch: 74, train_loss: 0.1614, test_loss: 2.5738, test_f1: 0.5951
 epoch: 75, train_loss: 0.1292, test_loss: 2.5724, test_f1: 0.5775
 epoch: 76, train_loss: 0.1391, test_loss: 2.6763, test_f1: 0.5913
 epoch: 77, train_loss: 0.1306, test_loss: 2.6097, test_f1: 0.6112
 epoch: 78, train_loss: 0.1331, test_loss: 2.3340, test_f1: 0.6096
 epoch: 79, train_loss: 0.1180, test_loss: 2.5498, test_f1: 0.6217
 epoch: 80, train_loss: 0.1411, test_loss: 2.7691, test_f1: 0.6132
 epoch: 81, train_loss: 0.1588, test_loss: 2.5943, test_f1: 0.6350
 epoch: 82, train_loss: 0.1198, test_loss: 2.5922, test_f1: 0.6406
 epoch: 83, train_loss: 0.1234, test_loss: 2.5327, test_f1: 0.6304
 epoch: 84, train_loss: 0.1352, test_loss: 2.4597, test_f1: 0.6125
 epoch: 85, train_loss: 0.1461, test_loss: 2.7629, test_f1: 0.5949
 epoch: 86, train_loss: 0.0850, test_loss: 2.5222, test_f1: 0.6190
 epoch: 87, train_loss: 0.1260, test_loss: 2.5488, test_f1: 0.6163
 epoch: 88, train_loss: 0.1293, test_loss: 2.5421, test_f1: 0.6418
 epoch: 89, train_loss: 0.1160, test_loss: 2.6723, test_f1: 0.6174
 epoch: 90, train_loss: 0.1365, test_loss: 2.5308, test_f1: 0.6121
 epoch: 91, train_loss: 0.1271, test_loss: 2.6560, test_f1: 0.6042
 epoch: 92, train_loss: 0.1065, test_loss: 2.8359, test_f1: 0.5975
 epoch: 93, train_loss: 0.1287, test_loss: 2.5736, test_f1: 0.6090
 epoch: 94, train_loss: 0.1134, test_loss: 2.5379, test_f1: 0.6340
 epoch: 95, train_loss: 0.1320, test_loss: 2.6829, test_f1: 0.6369
 epoch: 96, train_loss: 0.1038, test_loss: 2.9077, test_f1: 0.6145
 epoch: 97, train_loss: 0.1326, test_loss: 2.9186, test_f1: 0.6048
 epoch: 98, train_loss: 0.1229, test_loss: 2.6854, test_f1: 0.6245
 epoch: 99, train_loss: 0.1129, test_loss: 2.9721, test_f1: 0.6088
##################ITERATION #5 ****************************************
 epoch: 0, train_loss: 1.2504, test_loss: 1.4152, test_f1: 0.2404
 epoch: 1, train_loss: 1.0070, test_loss: 1.0810, test_f1: 0.5187
 epoch: 2, train_loss: 0.9448, test_loss: 1.0726, test_f1: 0.5208
 epoch: 3, train_loss: 0.8893, test_loss: 1.0713, test_f1: 0.5299
 epoch: 4, train_loss: 0.8718, test_loss: 1.0123, test_f1: 0.5554
 epoch: 5, train_loss: 0.8318, test_loss: 1.0204, test_f1: 0.5725
 epoch: 6, train_loss: 0.8045, test_loss: 0.9978, test_f1: 0.5604
 epoch: 7, train_loss: 0.7846, test_loss: 1.0585, test_f1: 0.5192
 epoch: 8, train_loss: 0.7513, test_loss: 1.0876, test_f1: 0.5219
 epoch: 9, train_loss: 0.7395, test_loss: 1.0574, test_f1: 0.5335
 epoch: 10, train_loss: 0.7422, test_loss: 1.1102, test_f1: 0.5637
 epoch: 11, train_loss: 0.7143, test_loss: 1.1322, test_f1: 0.5190
 epoch: 12, train_loss: 0.6837, test_loss: 1.1364, test_f1: 0.5707
 epoch: 13, train_loss: 0.6725, test_loss: 1.2018, test_f1: 0.5340
 epoch: 14, train_loss: 0.6793, test_loss: 1.0649, test_f1: 0.6140
 epoch: 15, train_loss: 0.6857, test_loss: 0.9766, test_f1: 0.6553
 epoch: 16, train_loss: 0.6847, test_loss: 1.1045, test_f1: 0.5665
 epoch: 17, train_loss: 0.6266, test_loss: 1.0284, test_f1: 0.6339
 epoch: 18, train_loss: 0.6333, test_loss: 1.1396, test_f1: 0.6005
 epoch: 19, train_loss: 0.6124, test_loss: 1.0099, test_f1: 0.6577
 epoch: 20, train_loss: 0.6085, test_loss: 1.1944, test_f1: 0.5701
 epoch: 21, train_loss: 0.5645, test_loss: 1.2125, test_f1: 0.5572
 epoch: 22, train_loss: 0.5664, test_loss: 1.1381, test_f1: 0.5817
 epoch: 23, train_loss: 0.5879, test_loss: 1.2385, test_f1: 0.5363
 epoch: 24, train_loss: 0.5490, test_loss: 1.0351, test_f1: 0.6248
 epoch: 25, train_loss: 0.5541, test_loss: 1.2391, test_f1: 0.5726
 epoch: 26, train_loss: 0.5255, test_loss: 1.1685, test_f1: 0.6416
 epoch: 27, train_loss: 0.5181, test_loss: 1.2989, test_f1: 0.5900
 epoch: 28, train_loss: 0.4958, test_loss: 1.2059, test_f1: 0.5734
 epoch: 29, train_loss: 0.4967, test_loss: 1.2066, test_f1: 0.6256
 epoch: 30, train_loss: 0.4976, test_loss: 1.2173, test_f1: 0.6363
 epoch: 31, train_loss: 0.4731, test_loss: 1.1486, test_f1: 0.6033
 epoch: 32, train_loss: 0.4659, test_loss: 1.3703, test_f1: 0.5924
 epoch: 33, train_loss: 0.4309, test_loss: 1.4101, test_f1: 0.6153
 epoch: 34, train_loss: 0.4772, test_loss: 1.2870, test_f1: 0.6313
 epoch: 35, train_loss: 0.4348, test_loss: 1.3478, test_f1: 0.6271
 epoch: 36, train_loss: 0.4185, test_loss: 1.5291, test_f1: 0.6019
 epoch: 37, train_loss: 0.4080, test_loss: 1.4169, test_f1: 0.5479
 epoch: 38, train_loss: 0.4402, test_loss: 1.1197, test_f1: 0.6052
 epoch: 39, train_loss: 0.3993, test_loss: 1.4958, test_f1: 0.6116
 epoch: 40, train_loss: 0.4118, test_loss: 1.3650, test_f1: 0.6348
 epoch: 41, train_loss: 0.3750, test_loss: 1.5976, test_f1: 0.6171
 epoch: 42, train_loss: 0.4117, test_loss: 1.4183, test_f1: 0.5834
 epoch: 43, train_loss: 0.3481, test_loss: 1.4770, test_f1: 0.6223
 epoch: 44, train_loss: 0.3981, test_loss: 1.4963, test_f1: 0.6005
 epoch: 45, train_loss: 0.3658, test_loss: 1.5263, test_f1: 0.5935
 epoch: 46, train_loss: 0.3524, test_loss: 1.3315, test_f1: 0.6350
 epoch: 47, train_loss: 0.3414, test_loss: 1.4917, test_f1: 0.6291
 epoch: 48, train_loss: 0.4071, test_loss: 1.3074, test_f1: 0.6096
 epoch: 49, train_loss: 0.3417, test_loss: 1.6381, test_f1: 0.5722
 epoch: 50, train_loss: 0.3280, test_loss: 1.5721, test_f1: 0.5755
 epoch: 51, train_loss: 0.2802, test_loss: 1.5996, test_f1: 0.5801
 epoch: 52, train_loss: 0.2895, test_loss: 1.6202, test_f1: 0.6063
 epoch: 53, train_loss: 0.2470, test_loss: 1.6999, test_f1: 0.6147
 epoch: 54, train_loss: 0.2375, test_loss: 1.8116, test_f1: 0.6030
 epoch: 55, train_loss: 0.2262, test_loss: 1.7825, test_f1: 0.6224
 epoch: 56, train_loss: 0.2383, test_loss: 1.8452, test_f1: 0.6263
 epoch: 57, train_loss: 0.2286, test_loss: 2.0776, test_f1: 0.6166
 epoch: 58, train_loss: 0.2289, test_loss: 1.8660, test_f1: 0.5648
 epoch: 59, train_loss: 0.1968, test_loss: 2.0438, test_f1: 0.6224
 epoch: 60, train_loss: 0.2180, test_loss: 1.9057, test_f1: 0.6217
 epoch: 61, train_loss: 0.2081, test_loss: 1.9225, test_f1: 0.6092
 epoch: 62, train_loss: 0.2009, test_loss: 1.8655, test_f1: 0.6223
 epoch: 63, train_loss: 0.2214, test_loss: 2.0280, test_f1: 0.6055
 epoch: 64, train_loss: 0.2084, test_loss: 2.0074, test_f1: 0.5897
 epoch: 65, train_loss: 0.2148, test_loss: 1.9156, test_f1: 0.6022
 epoch: 66, train_loss: 0.1950, test_loss: 2.1821, test_f1: 0.6061
 epoch: 67, train_loss: 0.1780, test_loss: 1.9816, test_f1: 0.6133
 epoch: 68, train_loss: 0.1960, test_loss: 2.0417, test_f1: 0.6008
 epoch: 69, train_loss: 0.1694, test_loss: 2.1805, test_f1: 0.6024
 epoch: 70, train_loss: 0.1796, test_loss: 2.3041, test_f1: 0.6235
 epoch: 71, train_loss: 0.1525, test_loss: 2.0505, test_f1: 0.6263
 epoch: 72, train_loss: 0.2163, test_loss: 2.3045, test_f1: 0.6021
 epoch: 73, train_loss: 0.1883, test_loss: 2.2481, test_f1: 0.6176
 epoch: 74, train_loss: 0.1864, test_loss: 2.4060, test_f1: 0.5813
 epoch: 75, train_loss: 0.1663, test_loss: 2.3176, test_f1: 0.6252
 epoch: 76, train_loss: 0.2003, test_loss: 2.3882, test_f1: 0.5944
 epoch: 77, train_loss: 0.1588, test_loss: 2.2240, test_f1: 0.6073
 epoch: 78, train_loss: 0.1677, test_loss: 2.2630, test_f1: 0.6055
 epoch: 79, train_loss: 0.1539, test_loss: 2.2320, test_f1: 0.6277
 epoch: 80, train_loss: 0.1422, test_loss: 2.4105, test_f1: 0.6118
 epoch: 81, train_loss: 0.1573, test_loss: 2.3399, test_f1: 0.6132
 epoch: 82, train_loss: 0.1642, test_loss: 2.3696, test_f1: 0.6195
 epoch: 83, train_loss: 0.1477, test_loss: 2.2255, test_f1: 0.6135
 epoch: 84, train_loss: 0.1427, test_loss: 2.3517, test_f1: 0.6055
 epoch: 85, train_loss: 0.1450, test_loss: 2.4224, test_f1: 0.6040
 epoch: 86, train_loss: 0.1191, test_loss: 2.6246, test_f1: 0.5856
 epoch: 87, train_loss: 0.1173, test_loss: 2.4625, test_f1: 0.6055
 epoch: 88, train_loss: 0.1651, test_loss: 2.4859, test_f1: 0.5998
 epoch: 89, train_loss: 0.1233, test_loss: 2.7702, test_f1: 0.5945
 epoch: 90, train_loss: 0.1274, test_loss: 2.3863, test_f1: 0.5972
 epoch: 91, train_loss: 0.1453, test_loss: 2.3249, test_f1: 0.5981
 epoch: 92, train_loss: 0.1478, test_loss: 2.3456, test_f1: 0.6031
 epoch: 93, train_loss: 0.1334, test_loss: 2.4176, test_f1: 0.6021
 epoch: 94, train_loss: 0.1418, test_loss: 2.4204, test_f1: 0.6096
 epoch: 95, train_loss: 0.1453, test_loss: 2.3902, test_f1: 0.5910
 epoch: 96, train_loss: 0.1053, test_loss: 2.6830, test_f1: 0.6104
 epoch: 97, train_loss: 0.1404, test_loss: 3.0575, test_f1: 0.5617
 epoch: 98, train_loss: 0.1428, test_loss: 2.6296, test_f1: 0.6028
 epoch: 99, train_loss: 0.1366, test_loss: 2.5483, test_f1: 0.5993
##################ITERATION #6 ****************************************
 epoch: 0, train_loss: 1.2788, test_loss: 1.3347, test_f1: 0.2360
 epoch: 1, train_loss: 0.9979, test_loss: 1.0690, test_f1: 0.5846
 epoch: 2, train_loss: 0.9411, test_loss: 1.0647, test_f1: 0.5729
 epoch: 3, train_loss: 0.9027, test_loss: 1.0670, test_f1: 0.6027
 epoch: 4, train_loss: 0.8796, test_loss: 1.1593, test_f1: 0.5325
 epoch: 5, train_loss: 0.8326, test_loss: 1.0615, test_f1: 0.5751
 epoch: 6, train_loss: 0.7817, test_loss: 1.0689, test_f1: 0.5938
 epoch: 7, train_loss: 0.8085, test_loss: 1.1371, test_f1: 0.4912
 epoch: 8, train_loss: 0.7583, test_loss: 1.0696, test_f1: 0.5230
 epoch: 9, train_loss: 0.7259, test_loss: 1.0545, test_f1: 0.5613
 epoch: 10, train_loss: 0.7155, test_loss: 1.0422, test_f1: 0.6125
 epoch: 11, train_loss: 0.6925, test_loss: 1.2304, test_f1: 0.5409
 epoch: 12, train_loss: 0.7151, test_loss: 1.0622, test_f1: 0.6307
 epoch: 13, train_loss: 0.6792, test_loss: 1.1845, test_f1: 0.5233
 epoch: 14, train_loss: 0.6281, test_loss: 1.0238, test_f1: 0.6099
 epoch: 15, train_loss: 0.6382, test_loss: 1.1647, test_f1: 0.5685
 epoch: 16, train_loss: 0.6196, test_loss: 1.0941, test_f1: 0.6046
 epoch: 17, train_loss: 0.6014, test_loss: 1.1298, test_f1: 0.5396
 epoch: 18, train_loss: 0.6040, test_loss: 1.2046, test_f1: 0.5883
 epoch: 19, train_loss: 0.5865, test_loss: 1.1828, test_f1: 0.6191
 epoch: 20, train_loss: 0.5745, test_loss: 1.1878, test_f1: 0.5763
 epoch: 21, train_loss: 0.5443, test_loss: 1.1196, test_f1: 0.6364
 epoch: 22, train_loss: 0.5344, test_loss: 1.1485, test_f1: 0.6158
 epoch: 23, train_loss: 0.5427, test_loss: 1.2156, test_f1: 0.6083
 epoch: 24, train_loss: 0.5180, test_loss: 1.1406, test_f1: 0.6378
 epoch: 25, train_loss: 0.5283, test_loss: 1.0500, test_f1: 0.6367
 epoch: 26, train_loss: 0.4800, test_loss: 1.3830, test_f1: 0.6356
 epoch: 27, train_loss: 0.5013, test_loss: 1.2856, test_f1: 0.5650
 epoch: 28, train_loss: 0.4862, test_loss: 1.2676, test_f1: 0.6075
 epoch: 29, train_loss: 0.4970, test_loss: 1.2367, test_f1: 0.6017
 epoch: 30, train_loss: 0.4664, test_loss: 1.3128, test_f1: 0.6501
 epoch: 31, train_loss: 0.4460, test_loss: 1.3519, test_f1: 0.5977
 epoch: 32, train_loss: 0.4516, test_loss: 1.3344, test_f1: 0.6263
 epoch: 33, train_loss: 0.4551, test_loss: 1.4059, test_f1: 0.5707
 epoch: 34, train_loss: 0.4414, test_loss: 1.2745, test_f1: 0.6172
 epoch: 35, train_loss: 0.4597, test_loss: 1.3271, test_f1: 0.6295
 epoch: 36, train_loss: 0.4064, test_loss: 1.5626, test_f1: 0.6152
 epoch: 37, train_loss: 0.4386, test_loss: 1.5860, test_f1: 0.5923
 epoch: 38, train_loss: 0.3755, test_loss: 1.4590, test_f1: 0.6227
 epoch: 39, train_loss: 0.3796, test_loss: 1.5014, test_f1: 0.5940
 epoch: 40, train_loss: 0.4090, test_loss: 1.6153, test_f1: 0.6115
 epoch: 41, train_loss: 0.3527, test_loss: 1.5435, test_f1: 0.5965
 epoch: 42, train_loss: 0.3732, test_loss: 1.5982, test_f1: 0.5864
 epoch: 43, train_loss: 0.3367, test_loss: 1.5375, test_f1: 0.6166
 epoch: 44, train_loss: 0.3373, test_loss: 1.6706, test_f1: 0.6438
 epoch: 45, train_loss: 0.3865, test_loss: 1.7177, test_f1: 0.6484
 epoch: 46, train_loss: 0.3597, test_loss: 1.7003, test_f1: 0.6370
 epoch: 47, train_loss: 0.3426, test_loss: 1.7187, test_f1: 0.6109
 epoch: 48, train_loss: 0.3242, test_loss: 1.5690, test_f1: 0.6268
 epoch: 49, train_loss: 0.3270, test_loss: 1.6067, test_f1: 0.5843
 epoch: 50, train_loss: 0.3275, test_loss: 1.7625, test_f1: 0.5725
 epoch: 51, train_loss: 0.2926, test_loss: 1.7525, test_f1: 0.5833
 epoch: 52, train_loss: 0.2447, test_loss: 1.8585, test_f1: 0.5948
 epoch: 53, train_loss: 0.2245, test_loss: 1.9372, test_f1: 0.6043
 epoch: 54, train_loss: 0.2447, test_loss: 1.9390, test_f1: 0.5929
 epoch: 55, train_loss: 0.2204, test_loss: 2.1098, test_f1: 0.5899
 epoch: 56, train_loss: 0.1662, test_loss: 2.1063, test_f1: 0.6065
 epoch: 57, train_loss: 0.2327, test_loss: 2.1093, test_f1: 0.6012
 epoch: 58, train_loss: 0.1823, test_loss: 2.1681, test_f1: 0.5873
 epoch: 59, train_loss: 0.2356, test_loss: 1.9378, test_f1: 0.6094
 epoch: 60, train_loss: 0.2191, test_loss: 2.1692, test_f1: 0.6042
 epoch: 61, train_loss: 0.1981, test_loss: 1.9517, test_f1: 0.5877
 epoch: 62, train_loss: 0.2050, test_loss: 2.1888, test_f1: 0.6366
 epoch: 63, train_loss: 0.1825, test_loss: 2.0880, test_f1: 0.5915
 epoch: 64, train_loss: 0.2101, test_loss: 1.9490, test_f1: 0.5998
 epoch: 65, train_loss: 0.1816, test_loss: 2.1819, test_f1: 0.5807
 epoch: 66, train_loss: 0.1774, test_loss: 2.1220, test_f1: 0.6046
 epoch: 67, train_loss: 0.2049, test_loss: 2.1771, test_f1: 0.5571
 epoch: 68, train_loss: 0.1858, test_loss: 2.2368, test_f1: 0.5916
 epoch: 69, train_loss: 0.1736, test_loss: 2.4529, test_f1: 0.5778
 epoch: 70, train_loss: 0.1761, test_loss: 2.5041, test_f1: 0.6036
 epoch: 71, train_loss: 0.1817, test_loss: 2.3990, test_f1: 0.5679
 epoch: 72, train_loss: 0.1538, test_loss: 2.3356, test_f1: 0.6123
 epoch: 73, train_loss: 0.1732, test_loss: 2.4790, test_f1: 0.5587
 epoch: 74, train_loss: 0.1873, test_loss: 2.2582, test_f1: 0.6051
 epoch: 75, train_loss: 0.1496, test_loss: 2.2770, test_f1: 0.5961
 epoch: 76, train_loss: 0.1603, test_loss: 2.4704, test_f1: 0.5893
 epoch: 77, train_loss: 0.1861, test_loss: 2.5387, test_f1: 0.5857
 epoch: 78, train_loss: 0.1560, test_loss: 2.3245, test_f1: 0.6187
 epoch: 79, train_loss: 0.1450, test_loss: 2.4421, test_f1: 0.6037
 epoch: 80, train_loss: 0.1446, test_loss: 2.6543, test_f1: 0.5910
 epoch: 81, train_loss: 0.1500, test_loss: 2.4813, test_f1: 0.6145
 epoch: 82, train_loss: 0.1441, test_loss: 2.5276, test_f1: 0.5815
 epoch: 83, train_loss: 0.1638, test_loss: 2.6808, test_f1: 0.5849
 epoch: 84, train_loss: 0.1779, test_loss: 2.4726, test_f1: 0.5968
 epoch: 85, train_loss: 0.1620, test_loss: 2.4779, test_f1: 0.5823
 epoch: 86, train_loss: 0.1701, test_loss: 2.4037, test_f1: 0.6047
 epoch: 87, train_loss: 0.1649, test_loss: 2.3596, test_f1: 0.6275
 epoch: 88, train_loss: 0.1315, test_loss: 2.6689, test_f1: 0.5882
 epoch: 89, train_loss: 0.1322, test_loss: 2.4892, test_f1: 0.5775
 epoch: 90, train_loss: 0.1671, test_loss: 2.6391, test_f1: 0.5712
 epoch: 91, train_loss: 0.1446, test_loss: 2.5701, test_f1: 0.5901
 epoch: 92, train_loss: 0.1320, test_loss: 2.7962, test_f1: 0.5864
 epoch: 93, train_loss: 0.1394, test_loss: 2.5177, test_f1: 0.5897
 epoch: 94, train_loss: 0.1340, test_loss: 2.8955, test_f1: 0.5771
 epoch: 95, train_loss: 0.1328, test_loss: 2.8784, test_f1: 0.5819
 epoch: 96, train_loss: 0.1313, test_loss: 2.7186, test_f1: 0.6115
 epoch: 97, train_loss: 0.1319, test_loss: 2.6502, test_f1: 0.5929
 epoch: 98, train_loss: 0.1250, test_loss: 2.8656, test_f1: 0.5648
 epoch: 99, train_loss: 0.1412, test_loss: 2.9991, test_f1: 0.5481
##################ITERATION #7 ****************************************
 epoch: 0, train_loss: 1.3351, test_loss: 1.5634, test_f1: 0.3234
 epoch: 1, train_loss: 1.0403, test_loss: 1.0978, test_f1: 0.5641
 epoch: 2, train_loss: 0.9556, test_loss: 1.0867, test_f1: 0.5157
 epoch: 3, train_loss: 0.9105, test_loss: 1.0648, test_f1: 0.5249
 epoch: 4, train_loss: 0.8958, test_loss: 1.0535, test_f1: 0.5628
 epoch: 5, train_loss: 0.8283, test_loss: 1.0745, test_f1: 0.5424
 epoch: 6, train_loss: 0.8339, test_loss: 1.0878, test_f1: 0.5669
 epoch: 7, train_loss: 0.8064, test_loss: 1.1133, test_f1: 0.5189
 epoch: 8, train_loss: 0.7848, test_loss: 1.0866, test_f1: 0.5167
 epoch: 9, train_loss: 0.7758, test_loss: 1.0746, test_f1: 0.5891
 epoch: 10, train_loss: 0.7341, test_loss: 1.1124, test_f1: 0.5859
 epoch: 11, train_loss: 0.7086, test_loss: 1.1300, test_f1: 0.5664
 epoch: 12, train_loss: 0.7087, test_loss: 1.1256, test_f1: 0.5652
 epoch: 13, train_loss: 0.6775, test_loss: 1.1168, test_f1: 0.6010
 epoch: 14, train_loss: 0.6384, test_loss: 1.1730, test_f1: 0.5671
 epoch: 15, train_loss: 0.6411, test_loss: 1.1745, test_f1: 0.5600
 epoch: 16, train_loss: 0.6310, test_loss: 1.0885, test_f1: 0.5957
 epoch: 17, train_loss: 0.6372, test_loss: 1.1666, test_f1: 0.5851
 epoch: 18, train_loss: 0.6308, test_loss: 1.0484, test_f1: 0.6172
 epoch: 19, train_loss: 0.5930, test_loss: 1.1199, test_f1: 0.6261
 epoch: 20, train_loss: 0.6056, test_loss: 1.1399, test_f1: 0.6392
 epoch: 21, train_loss: 0.6057, test_loss: 1.2399, test_f1: 0.5967
 epoch: 22, train_loss: 0.5695, test_loss: 1.4499, test_f1: 0.4919
 epoch: 23, train_loss: 0.5621, test_loss: 1.2343, test_f1: 0.6128
 epoch: 24, train_loss: 0.5574, test_loss: 1.1551, test_f1: 0.6273
 epoch: 25, train_loss: 0.5454, test_loss: 1.1559, test_f1: 0.6273
 epoch: 26, train_loss: 0.5269, test_loss: 1.2187, test_f1: 0.6377
 epoch: 27, train_loss: 0.5214, test_loss: 1.4607, test_f1: 0.5667
 epoch: 28, train_loss: 0.5131, test_loss: 1.2994, test_f1: 0.6223
 epoch: 29, train_loss: 0.4885, test_loss: 1.2165, test_f1: 0.6293
 epoch: 30, train_loss: 0.4986, test_loss: 1.4101, test_f1: 0.6401
 epoch: 31, train_loss: 0.4687, test_loss: 1.2934, test_f1: 0.6634
 epoch: 32, train_loss: 0.4605, test_loss: 1.5821, test_f1: 0.5773
 epoch: 33, train_loss: 0.4496, test_loss: 1.3594, test_f1: 0.6356
 epoch: 34, train_loss: 0.4254, test_loss: 1.3742, test_f1: 0.6141
 epoch: 35, train_loss: 0.4247, test_loss: 1.5131, test_f1: 0.6241
 epoch: 36, train_loss: 0.4002, test_loss: 1.4509, test_f1: 0.6374
 epoch: 37, train_loss: 0.4247, test_loss: 1.3624, test_f1: 0.6085
 epoch: 38, train_loss: 0.4485, test_loss: 1.3670, test_f1: 0.6433
 epoch: 39, train_loss: 0.3902, test_loss: 1.4393, test_f1: 0.6101
 epoch: 40, train_loss: 0.4199, test_loss: 1.5250, test_f1: 0.5992
 epoch: 41, train_loss: 0.4025, test_loss: 1.3808, test_f1: 0.5995
 epoch: 42, train_loss: 0.3465, test_loss: 1.7822, test_f1: 0.5690
 epoch: 43, train_loss: 0.3517, test_loss: 1.6625, test_f1: 0.5960
 epoch: 44, train_loss: 0.3777, test_loss: 1.6501, test_f1: 0.6035
 epoch: 45, train_loss: 0.3539, test_loss: 1.8409, test_f1: 0.5977
 epoch: 46, train_loss: 0.3733, test_loss: 1.5840, test_f1: 0.6030
 epoch: 47, train_loss: 0.3486, test_loss: 1.7785, test_f1: 0.6093
 epoch: 48, train_loss: 0.3305, test_loss: 1.5857, test_f1: 0.6237
 epoch: 49, train_loss: 0.3632, test_loss: 1.6445, test_f1: 0.6066
 epoch: 50, train_loss: 0.3415, test_loss: 1.7340, test_f1: 0.6224
 epoch: 51, train_loss: 0.2542, test_loss: 1.7014, test_f1: 0.6206
 epoch: 52, train_loss: 0.2672, test_loss: 1.7017, test_f1: 0.6323
 epoch: 53, train_loss: 0.2257, test_loss: 1.9275, test_f1: 0.6413
 epoch: 54, train_loss: 0.2559, test_loss: 1.8593, test_f1: 0.5887
 epoch: 55, train_loss: 0.1877, test_loss: 2.1170, test_f1: 0.6000
 epoch: 56, train_loss: 0.2008, test_loss: 2.0907, test_f1: 0.6239
 epoch: 57, train_loss: 0.1885, test_loss: 2.3264, test_f1: 0.5681
 epoch: 58, train_loss: 0.1873, test_loss: 2.1893, test_f1: 0.5965
 epoch: 59, train_loss: 0.2082, test_loss: 2.0175, test_f1: 0.5676
 epoch: 60, train_loss: 0.2010, test_loss: 2.2841, test_f1: 0.5999
 epoch: 61, train_loss: 0.1996, test_loss: 2.2283, test_f1: 0.5890
 epoch: 62, train_loss: 0.1913, test_loss: 2.4707, test_f1: 0.5695
 epoch: 63, train_loss: 0.2191, test_loss: 2.2912, test_f1: 0.5861
 epoch: 64, train_loss: 0.1787, test_loss: 2.5509, test_f1: 0.6002
 epoch: 65, train_loss: 0.2029, test_loss: 2.4890, test_f1: 0.6053
 epoch: 66, train_loss: 0.1904, test_loss: 2.5603, test_f1: 0.5682
 epoch: 67, train_loss: 0.2180, test_loss: 2.3083, test_f1: 0.6205
 epoch: 68, train_loss: 0.1894, test_loss: 2.3881, test_f1: 0.6095
 epoch: 69, train_loss: 0.1720, test_loss: 2.3701, test_f1: 0.6027
 epoch: 70, train_loss: 0.1875, test_loss: 2.4287, test_f1: 0.6228
 epoch: 71, train_loss: 0.1672, test_loss: 2.6298, test_f1: 0.5746
 epoch: 72, train_loss: 0.1973, test_loss: 2.3789, test_f1: 0.6379
 epoch: 73, train_loss: 0.1857, test_loss: 2.4445, test_f1: 0.6015
 epoch: 74, train_loss: 0.1627, test_loss: 2.4197, test_f1: 0.5992
 epoch: 75, train_loss: 0.1442, test_loss: 2.5289, test_f1: 0.5885
 epoch: 76, train_loss: 0.1545, test_loss: 2.7047, test_f1: 0.5814
 epoch: 77, train_loss: 0.1537, test_loss: 2.9457, test_f1: 0.5513
 epoch: 78, train_loss: 0.1582, test_loss: 2.8729, test_f1: 0.5891
 epoch: 79, train_loss: 0.1370, test_loss: 2.8827, test_f1: 0.5816
 epoch: 80, train_loss: 0.1688, test_loss: 2.6339, test_f1: 0.6038
 epoch: 81, train_loss: 0.1889, test_loss: 2.6552, test_f1: 0.6199
 epoch: 82, train_loss: 0.1327, test_loss: 2.7022, test_f1: 0.6112
 epoch: 83, train_loss: 0.1289, test_loss: 2.6225, test_f1: 0.5823
 epoch: 84, train_loss: 0.1467, test_loss: 2.6057, test_f1: 0.5874
 epoch: 85, train_loss: 0.1843, test_loss: 2.6952, test_f1: 0.5894
 epoch: 86, train_loss: 0.1470, test_loss: 2.7537, test_f1: 0.5905
 epoch: 87, train_loss: 0.1641, test_loss: 2.6269, test_f1: 0.5979
 epoch: 88, train_loss: 0.1499, test_loss: 2.4657, test_f1: 0.6189
 epoch: 89, train_loss: 0.1139, test_loss: 2.8462, test_f1: 0.5974
 epoch: 90, train_loss: 0.1237, test_loss: 2.9494, test_f1: 0.5873
 epoch: 91, train_loss: 0.1179, test_loss: 3.0477, test_f1: 0.6347
 epoch: 92, train_loss: 0.1437, test_loss: 2.8785, test_f1: 0.6306
 epoch: 93, train_loss: 0.1448, test_loss: 2.9449, test_f1: 0.6218
 epoch: 94, train_loss: 0.1197, test_loss: 3.0593, test_f1: 0.6180
 epoch: 95, train_loss: 0.1169, test_loss: 3.1379, test_f1: 0.6102
 epoch: 96, train_loss: 0.1275, test_loss: 2.7026, test_f1: 0.5746
 epoch: 97, train_loss: 0.1534, test_loss: 3.1083, test_f1: 0.5738
 epoch: 98, train_loss: 0.1298, test_loss: 2.8652, test_f1: 0.5983
 epoch: 99, train_loss: 0.1194, test_loss: 3.0496, test_f1: 0.6086
##################ITERATION #8 ****************************************
 epoch: 0, train_loss: 1.3419, test_loss: 1.8927, test_f1: 0.2488
 epoch: 1, train_loss: 0.9896, test_loss: 1.0804, test_f1: 0.5203
 epoch: 2, train_loss: 0.9489, test_loss: 1.0924, test_f1: 0.5257
 epoch: 3, train_loss: 0.9205, test_loss: 1.0380, test_f1: 0.5113
 epoch: 4, train_loss: 0.8665, test_loss: 1.0525, test_f1: 0.5253
 epoch: 5, train_loss: 0.8476, test_loss: 1.0588, test_f1: 0.5345
 epoch: 6, train_loss: 0.8193, test_loss: 1.2008, test_f1: 0.5168
 epoch: 7, train_loss: 0.7999, test_loss: 1.1398, test_f1: 0.5735
 epoch: 8, train_loss: 0.7702, test_loss: 1.1087, test_f1: 0.5297
 epoch: 9, train_loss: 0.7484, test_loss: 1.1691, test_f1: 0.5430
 epoch: 10, train_loss: 0.7151, test_loss: 1.0061, test_f1: 0.6237
 epoch: 11, train_loss: 0.6938, test_loss: 1.0943, test_f1: 0.6174
 epoch: 12, train_loss: 0.7049, test_loss: 1.0460, test_f1: 0.5795
 epoch: 13, train_loss: 0.7007, test_loss: 1.0653, test_f1: 0.6544
 epoch: 14, train_loss: 0.6276, test_loss: 1.2204, test_f1: 0.6009
 epoch: 15, train_loss: 0.6336, test_loss: 1.1199, test_f1: 0.6388
 epoch: 16, train_loss: 0.6156, test_loss: 1.0813, test_f1: 0.5945
 epoch: 17, train_loss: 0.5984, test_loss: 1.1019, test_f1: 0.6006
 epoch: 18, train_loss: 0.5659, test_loss: 1.0827, test_f1: 0.6274
 epoch: 19, train_loss: 0.5755, test_loss: 1.1333, test_f1: 0.6419
 epoch: 20, train_loss: 0.5476, test_loss: 1.1363, test_f1: 0.6558
 epoch: 21, train_loss: 0.5363, test_loss: 1.1692, test_f1: 0.6014
 epoch: 22, train_loss: 0.5187, test_loss: 1.1214, test_f1: 0.6593
 epoch: 23, train_loss: 0.5170, test_loss: 1.2242, test_f1: 0.6026
 epoch: 24, train_loss: 0.4928, test_loss: 1.2846, test_f1: 0.6182
 epoch: 25, train_loss: 0.5082, test_loss: 1.1713, test_f1: 0.6165
 epoch: 26, train_loss: 0.4803, test_loss: 1.2766, test_f1: 0.5928
 epoch: 27, train_loss: 0.4575, test_loss: 1.2945, test_f1: 0.6196
 epoch: 28, train_loss: 0.4777, test_loss: 1.1937, test_f1: 0.6047
 epoch: 29, train_loss: 0.4889, test_loss: 1.4210, test_f1: 0.6549
 epoch: 30, train_loss: 0.4680, test_loss: 1.3457, test_f1: 0.6242
 epoch: 31, train_loss: 0.4708, test_loss: 1.2803, test_f1: 0.6353
 epoch: 32, train_loss: 0.4162, test_loss: 1.4417, test_f1: 0.5885
 epoch: 33, train_loss: 0.4583, test_loss: 1.2980, test_f1: 0.6035
 epoch: 34, train_loss: 0.4446, test_loss: 1.3877, test_f1: 0.5948
 epoch: 35, train_loss: 0.4397, test_loss: 1.1997, test_f1: 0.6245
 epoch: 36, train_loss: 0.4013, test_loss: 1.3795, test_f1: 0.6397
 epoch: 37, train_loss: 0.3893, test_loss: 1.3534, test_f1: 0.6640
 epoch: 38, train_loss: 0.3917, test_loss: 1.3396, test_f1: 0.6211
 epoch: 39, train_loss: 0.3858, test_loss: 1.4966, test_f1: 0.6100
 epoch: 40, train_loss: 0.4134, test_loss: 1.4967, test_f1: 0.6103
 epoch: 41, train_loss: 0.3385, test_loss: 1.5453, test_f1: 0.6098
 epoch: 42, train_loss: 0.3485, test_loss: 1.5058, test_f1: 0.6290
 epoch: 43, train_loss: 0.3421, test_loss: 1.6480, test_f1: 0.5995
 epoch: 44, train_loss: 0.3359, test_loss: 1.5456, test_f1: 0.6325
 epoch: 45, train_loss: 0.2976, test_loss: 1.6187, test_f1: 0.6291
 epoch: 46, train_loss: 0.3130, test_loss: 1.8623, test_f1: 0.5904
 epoch: 47, train_loss: 0.3647, test_loss: 1.5326, test_f1: 0.6095
 epoch: 48, train_loss: 0.2928, test_loss: 1.7699, test_f1: 0.6790
 epoch: 49, train_loss: 0.3273, test_loss: 1.7186, test_f1: 0.6613
 epoch: 50, train_loss: 0.3037, test_loss: 1.8635, test_f1: 0.6438
 epoch: 51, train_loss: 0.2285, test_loss: 1.8635, test_f1: 0.6466
 epoch: 52, train_loss: 0.2355, test_loss: 1.7736, test_f1: 0.6408
 epoch: 53, train_loss: 0.2147, test_loss: 1.9683, test_f1: 0.5832
 epoch: 54, train_loss: 0.1952, test_loss: 1.9878, test_f1: 0.6185
 epoch: 55, train_loss: 0.2038, test_loss: 2.2108, test_f1: 0.5931
 epoch: 56, train_loss: 0.1958, test_loss: 2.1736, test_f1: 0.6045
 epoch: 57, train_loss: 0.1985, test_loss: 2.0214, test_f1: 0.6176
 epoch: 58, train_loss: 0.1766, test_loss: 2.1114, test_f1: 0.6162
 epoch: 59, train_loss: 0.1940, test_loss: 2.1666, test_f1: 0.6032
 epoch: 60, train_loss: 0.1929, test_loss: 2.3534, test_f1: 0.5802
 epoch: 61, train_loss: 0.2247, test_loss: 2.1722, test_f1: 0.5935
 epoch: 62, train_loss: 0.1745, test_loss: 2.1320, test_f1: 0.6058
 epoch: 63, train_loss: 0.1445, test_loss: 2.1759, test_f1: 0.6296
 epoch: 64, train_loss: 0.1930, test_loss: 2.1241, test_f1: 0.6126
 epoch: 65, train_loss: 0.1674, test_loss: 2.0737, test_f1: 0.6465
 epoch: 66, train_loss: 0.1874, test_loss: 2.1293, test_f1: 0.6201
 epoch: 67, train_loss: 0.1772, test_loss: 2.1492, test_f1: 0.6158
 epoch: 68, train_loss: 0.1793, test_loss: 2.1174, test_f1: 0.5829
 epoch: 69, train_loss: 0.1635, test_loss: 2.1985, test_f1: 0.5761
 epoch: 70, train_loss: 0.1441, test_loss: 2.2196, test_f1: 0.6233
 epoch: 71, train_loss: 0.1582, test_loss: 2.2385, test_f1: 0.6015
 epoch: 72, train_loss: 0.1698, test_loss: 2.2030, test_f1: 0.6183
 epoch: 73, train_loss: 0.1650, test_loss: 2.2197, test_f1: 0.6122
 epoch: 74, train_loss: 0.1464, test_loss: 2.2777, test_f1: 0.6007
 epoch: 75, train_loss: 0.1560, test_loss: 2.4932, test_f1: 0.5827
 epoch: 76, train_loss: 0.1529, test_loss: 2.5277, test_f1: 0.6199
 epoch: 77, train_loss: 0.1398, test_loss: 2.3919, test_f1: 0.5941
 epoch: 78, train_loss: 0.1628, test_loss: 2.3325, test_f1: 0.6057
 epoch: 79, train_loss: 0.1746, test_loss: 2.3719, test_f1: 0.6202
 epoch: 80, train_loss: 0.1251, test_loss: 2.2287, test_f1: 0.6414
 epoch: 81, train_loss: 0.1555, test_loss: 2.3686, test_f1: 0.6173
 epoch: 82, train_loss: 0.1305, test_loss: 2.5523, test_f1: 0.6017
 epoch: 83, train_loss: 0.1469, test_loss: 2.5629, test_f1: 0.5875
 epoch: 84, train_loss: 0.1489, test_loss: 2.4869, test_f1: 0.6025
 epoch: 85, train_loss: 0.1411, test_loss: 2.8940, test_f1: 0.5463
 epoch: 86, train_loss: 0.1339, test_loss: 2.7894, test_f1: 0.5476
 epoch: 87, train_loss: 0.1678, test_loss: 2.3624, test_f1: 0.5752
 epoch: 88, train_loss: 0.1233, test_loss: 2.6537, test_f1: 0.5725
 epoch: 89, train_loss: 0.1356, test_loss: 2.6764, test_f1: 0.5955
 epoch: 90, train_loss: 0.1228, test_loss: 2.7931, test_f1: 0.5472
 epoch: 91, train_loss: 0.1310, test_loss: 2.4440, test_f1: 0.5773
 epoch: 92, train_loss: 0.1273, test_loss: 2.6778, test_f1: 0.5554
 epoch: 93, train_loss: 0.1778, test_loss: 2.4138, test_f1: 0.5915
 epoch: 94, train_loss: 0.1608, test_loss: 2.6112, test_f1: 0.5772
 epoch: 95, train_loss: 0.1176, test_loss: 2.6967, test_f1: 0.5817
 epoch: 96, train_loss: 0.1338, test_loss: 2.7327, test_f1: 0.5501
 epoch: 97, train_loss: 0.1464, test_loss: 2.6174, test_f1: 0.5753
 epoch: 98, train_loss: 0.1361, test_loss: 2.4942, test_f1: 0.6033
 epoch: 99, train_loss: 0.1614, test_loss: 2.4902, test_f1: 0.5941
##################ITERATION #9 ****************************************
 epoch: 0, train_loss: 1.2845, test_loss: 1.2196, test_f1: 0.2884
 epoch: 1, train_loss: 0.9798, test_loss: 1.0763, test_f1: 0.4786
 epoch: 2, train_loss: 0.9234, test_loss: 1.1029, test_f1: 0.5467
 epoch: 3, train_loss: 0.9023, test_loss: 1.0430, test_f1: 0.5504
 epoch: 4, train_loss: 0.8439, test_loss: 1.0688, test_f1: 0.5137
 epoch: 5, train_loss: 0.8296, test_loss: 1.0473, test_f1: 0.5966
 epoch: 6, train_loss: 0.8059, test_loss: 1.1440, test_f1: 0.5368
 epoch: 7, train_loss: 0.7829, test_loss: 1.0654, test_f1: 0.5422
 epoch: 8, train_loss: 0.7843, test_loss: 1.0926, test_f1: 0.5666
 epoch: 9, train_loss: 0.7327, test_loss: 1.1153, test_f1: 0.6206
 epoch: 10, train_loss: 0.7321, test_loss: 1.1946, test_f1: 0.5618
 epoch: 11, train_loss: 0.6886, test_loss: 1.1174, test_f1: 0.6167
 epoch: 12, train_loss: 0.6739, test_loss: 1.1563, test_f1: 0.6016
 epoch: 13, train_loss: 0.6458, test_loss: 1.1602, test_f1: 0.5710
 epoch: 14, train_loss: 0.6495, test_loss: 1.0641, test_f1: 0.6124
 epoch: 15, train_loss: 0.6163, test_loss: 1.1323, test_f1: 0.6339
 epoch: 16, train_loss: 0.5820, test_loss: 1.3457, test_f1: 0.4935
 epoch: 17, train_loss: 0.6010, test_loss: 1.2315, test_f1: 0.6023
 epoch: 18, train_loss: 0.6005, test_loss: 1.3378, test_f1: 0.6102
 epoch: 19, train_loss: 0.5683, test_loss: 1.2623, test_f1: 0.5653
 epoch: 20, train_loss: 0.5861, test_loss: 1.2177, test_f1: 0.5787
 epoch: 21, train_loss: 0.5162, test_loss: 1.2046, test_f1: 0.6298
 epoch: 22, train_loss: 0.5349, test_loss: 1.3162, test_f1: 0.6051
 epoch: 23, train_loss: 0.5275, test_loss: 1.2968, test_f1: 0.5831
 epoch: 24, train_loss: 0.4590, test_loss: 1.2199, test_f1: 0.6562
 epoch: 25, train_loss: 0.4694, test_loss: 1.4419, test_f1: 0.6116
 epoch: 26, train_loss: 0.4759, test_loss: 1.4402, test_f1: 0.5958
 epoch: 27, train_loss: 0.4732, test_loss: 1.3631, test_f1: 0.5661
 epoch: 28, train_loss: 0.4403, test_loss: 1.5849, test_f1: 0.6021
 epoch: 29, train_loss: 0.4598, test_loss: 1.4565, test_f1: 0.6113
 epoch: 30, train_loss: 0.4357, test_loss: 1.5361, test_f1: 0.5533
 epoch: 31, train_loss: 0.4117, test_loss: 1.5613, test_f1: 0.5895
 epoch: 32, train_loss: 0.4017, test_loss: 1.5239, test_f1: 0.6170
 epoch: 33, train_loss: 0.3936, test_loss: 1.5090, test_f1: 0.5991
 epoch: 34, train_loss: 0.3620, test_loss: 1.5065, test_f1: 0.5637
 epoch: 35, train_loss: 0.4026, test_loss: 1.6213, test_f1: 0.6032
 epoch: 36, train_loss: 0.3683, test_loss: 1.6363, test_f1: 0.5624
 epoch: 37, train_loss: 0.4049, test_loss: 1.8488, test_f1: 0.5732
 epoch: 38, train_loss: 0.3837, test_loss: 1.5303, test_f1: 0.6154
 epoch: 39, train_loss: 0.3885, test_loss: 1.5488, test_f1: 0.6067
 epoch: 40, train_loss: 0.3053, test_loss: 1.8022, test_f1: 0.5644
 epoch: 41, train_loss: 0.3008, test_loss: 2.1601, test_f1: 0.5132
 epoch: 42, train_loss: 0.3169, test_loss: 1.8373, test_f1: 0.5741
 epoch: 43, train_loss: 0.3529, test_loss: 1.7390, test_f1: 0.6055
 epoch: 44, train_loss: 0.3118, test_loss: 1.6036, test_f1: 0.6008
 epoch: 45, train_loss: 0.3129, test_loss: 1.8173, test_f1: 0.5710
 epoch: 46, train_loss: 0.3135, test_loss: 2.1058, test_f1: 0.5643
 epoch: 47, train_loss: 0.2905, test_loss: 1.6925, test_f1: 0.5589
 epoch: 48, train_loss: 0.2907, test_loss: 2.1632, test_f1: 0.5559
 epoch: 49, train_loss: 0.2855, test_loss: 1.9008, test_f1: 0.6403
 epoch: 50, train_loss: 0.2819, test_loss: 2.2432, test_f1: 0.5626
 epoch: 51, train_loss: 0.2317, test_loss: 2.3440, test_f1: 0.5513
 epoch: 52, train_loss: 0.2100, test_loss: 2.1093, test_f1: 0.5759
 epoch: 53, train_loss: 0.2072, test_loss: 2.3111, test_f1: 0.5757
 epoch: 54, train_loss: 0.1646, test_loss: 2.2674, test_f1: 0.6044
 epoch: 55, train_loss: 0.1446, test_loss: 2.4175, test_f1: 0.5811
 epoch: 56, train_loss: 0.1959, test_loss: 2.3635, test_f1: 0.5681
 epoch: 57, train_loss: 0.1741, test_loss: 2.5131, test_f1: 0.5638
 epoch: 58, train_loss: 0.1581, test_loss: 2.6151, test_f1: 0.5528
 epoch: 59, train_loss: 0.1890, test_loss: 2.4367, test_f1: 0.5594
 epoch: 60, train_loss: 0.1593, test_loss: 2.5028, test_f1: 0.5727
 epoch: 61, train_loss: 0.1593, test_loss: 2.4375, test_f1: 0.5772
 epoch: 62, train_loss: 0.1410, test_loss: 2.6384, test_f1: 0.5634
 epoch: 63, train_loss: 0.1554, test_loss: 2.5859, test_f1: 0.5589
 epoch: 64, train_loss: 0.1590, test_loss: 2.5012, test_f1: 0.5797
 epoch: 65, train_loss: 0.1779, test_loss: 2.5372, test_f1: 0.5645
 epoch: 66, train_loss: 0.1715, test_loss: 2.2509, test_f1: 0.6205
 epoch: 67, train_loss: 0.1731, test_loss: 2.4273, test_f1: 0.6011
 epoch: 68, train_loss: 0.1639, test_loss: 2.7595, test_f1: 0.5753
 epoch: 69, train_loss: 0.1342, test_loss: 2.5332, test_f1: 0.5931
 epoch: 70, train_loss: 0.1331, test_loss: 2.7145, test_f1: 0.6089
 epoch: 71, train_loss: 0.1244, test_loss: 2.7749, test_f1: 0.5733
 epoch: 72, train_loss: 0.1465, test_loss: 2.6024, test_f1: 0.5640
 epoch: 73, train_loss: 0.1601, test_loss: 2.5938, test_f1: 0.5796
 epoch: 74, train_loss: 0.1343, test_loss: 2.5800, test_f1: 0.5689
 epoch: 75, train_loss: 0.1302, test_loss: 2.5741, test_f1: 0.5966
 epoch: 76, train_loss: 0.1290, test_loss: 2.7390, test_f1: 0.5839
 epoch: 77, train_loss: 0.1314, test_loss: 2.5824, test_f1: 0.5816
 epoch: 78, train_loss: 0.1258, test_loss: 2.6431, test_f1: 0.5748
 epoch: 79, train_loss: 0.1267, test_loss: 2.9329, test_f1: 0.5638
 epoch: 80, train_loss: 0.1163, test_loss: 2.6108, test_f1: 0.5905
 epoch: 81, train_loss: 0.1263, test_loss: 2.5833, test_f1: 0.5816
 epoch: 82, train_loss: 0.1313, test_loss: 2.8018, test_f1: 0.5622
 epoch: 83, train_loss: 0.1250, test_loss: 2.6466, test_f1: 0.5795
 epoch: 84, train_loss: 0.1124, test_loss: 2.8673, test_f1: 0.5627
 epoch: 85, train_loss: 0.1457, test_loss: 3.0001, test_f1: 0.5676
 epoch: 86, train_loss: 0.1490, test_loss: 3.1018, test_f1: 0.5557
 epoch: 87, train_loss: 0.1072, test_loss: 3.0563, test_f1: 0.5460
 epoch: 88, train_loss: 0.0881, test_loss: 3.1009, test_f1: 0.5654
 epoch: 89, train_loss: 0.1315, test_loss: 3.0037, test_f1: 0.5746
 epoch: 90, train_loss: 0.1119, test_loss: 3.1315, test_f1: 0.5405
 epoch: 91, train_loss: 0.1283, test_loss: 3.4502, test_f1: 0.5640
 epoch: 92, train_loss: 0.1137, test_loss: 3.0293, test_f1: 0.5416
 epoch: 93, train_loss: 0.1248, test_loss: 2.9510, test_f1: 0.5604
 epoch: 94, train_loss: 0.1241, test_loss: 3.0773, test_f1: 0.5464
 epoch: 95, train_loss: 0.1239, test_loss: 3.1167, test_f1: 0.5645
 epoch: 96, train_loss: 0.1017, test_loss: 2.8132, test_f1: 0.6203
 epoch: 97, train_loss: 0.1250, test_loss: 3.1311, test_f1: 0.5859
 epoch: 98, train_loss: 0.1305, test_loss: 2.7408, test_f1: 0.6033
 epoch: 99, train_loss: 0.0998, test_loss: 3.1053, test_f1: 0.5974

Training completed in 797.53 seconds
Best F1: 0.6790 at epoch 48
Mean F1 across iterations: 0.6617  0.0096
========================FINAL RESULTS================================
FEGIN weighted F1: 0.6790  0.0096
python main.py --data ltspice_demos --representation component_pin_net --model FEGIN --layers 6 --hiddens 128 --batch_size 32 --lr 0.001 --emb_size 128 --epochs 100 --save_appendix component_pin_net_L6_H128_BS32_LR0.001_E128 --no_val
-----



STDERR:
  File "main.py", line 370, in <module>
    main()
  File "main.py", line 254, in main
    dataset = dataset_class(
  File "/home/philip/projects/ltspice_examples_code_repo/Circuit-Completion-Using-GNNs/component_classification_with_link_prediction_head/evaluation/FEGIN/kernel/circuit_datasets.py", line 15, in __init__
    self.data, self.slices = torch.load(self.processed_paths[0])
  File "/home/philip/.local/lib/python3.8/site-packages/torch/serialization.py", line 1040, in load
    warnings.warn(
  File "/usr/lib/python3.8/warnings.py", line 109, in _showwarnmsg
    sw(msg.message, msg.category, msg.filename, msg.lineno,
  File "main.py", line 47, in warn_with_traceback
    traceback.print_stack(file=log)
/home/philip/projects/ltspice_examples_code_repo/Circuit-Completion-Using-GNNs/component_classification_with_link_prediction_head/evaluation/FEGIN/kernel/circuit_datasets.py:15: FutureWarning: You are using `torch.load` with `weights_only=False` (the current default value), which uses the default pickle module implicitly. It is possible to construct malicious pickle data which will execute arbitrary code during unpickling (See https://github.com/pytorch/pytorch/blob/main/SECURITY.md#untrusted-models for more details). In a future release, the default value for `weights_only` will be flipped to `True`. This limits the functions that could be executed during unpickling. Arbitrary objects will no longer be allowed to be loaded via this mode unless they are explicitly allowlisted by the user via `torch.serialization.add_safe_globals`. We recommend you start setting `weights_only=True` for any use case where you don't have full control of the loaded file. Please open an issue on GitHub for any issues related to this experimental feature.
  self.data, self.slices = torch.load(self.processed_paths[0])
