STDOUT:
Results will be saved in /home/philip/projects/ltspice_examples_code_repo/Circuit-Completion-Using-GNNs/component_classification_with_link_prediction_head/evaluation/FEGIN/results/model_FEGIN_dataset_ltspice_demos
Command line input: python main.py --data ltspice_demos --representation component_pin --model FEGIN --layers 5 --hiddens 16 --batch_size 256 --lr 0.001 --emb_size 128 --epochs 100 --save_appendix component_pin_L5_H16_BS256_LR0.001_E128 --no_val
 is saved.
-----
ltspice_demos - FEGIN
Using 5 layers, 16 hidden units, h = 2
Loading component_pin representation dataset
ENTERED
Training FEGIN on component_pin representation
Train: 1565, Test: 383
##################ITERATION #0 ****************************************
 epoch: 0, train_loss: 1.4767, test_loss: 1.4581, test_f1: 0.0507
 epoch: 1, train_loss: 1.4640, test_loss: 1.4522, test_f1: 0.0507
 epoch: 2, train_loss: 1.4564, test_loss: 1.4456, test_f1: 0.0507
 epoch: 3, train_loss: 1.4486, test_loss: 1.4393, test_f1: 0.0507
 epoch: 4, train_loss: 1.4397, test_loss: 1.4321, test_f1: 0.0507
 epoch: 5, train_loss: 1.4297, test_loss: 1.4214, test_f1: 0.0507
 epoch: 6, train_loss: 1.4164, test_loss: 1.4068, test_f1: 0.0507
 epoch: 7, train_loss: 1.4020, test_loss: 1.3890, test_f1: 0.0507
 epoch: 8, train_loss: 1.3848, test_loss: 1.3666, test_f1: 0.2055
 epoch: 9, train_loss: 1.3589, test_loss: 1.3455, test_f1: 0.2632
 epoch: 10, train_loss: 1.3396, test_loss: 1.3270, test_f1: 0.3237
 epoch: 11, train_loss: 1.3115, test_loss: 1.3123, test_f1: 0.3454
 epoch: 12, train_loss: 1.2926, test_loss: 1.2978, test_f1: 0.3650
 epoch: 13, train_loss: 1.2758, test_loss: 1.2875, test_f1: 0.3385
 epoch: 14, train_loss: 1.2466, test_loss: 1.2790, test_f1: 0.3223
 epoch: 15, train_loss: 1.2432, test_loss: 1.2707, test_f1: 0.3087
 epoch: 16, train_loss: 1.2247, test_loss: 1.2622, test_f1: 0.3350
 epoch: 17, train_loss: 1.2222, test_loss: 1.2552, test_f1: 0.3379
 epoch: 18, train_loss: 1.2132, test_loss: 1.2474, test_f1: 0.3292
 epoch: 19, train_loss: 1.1996, test_loss: 1.2383, test_f1: 0.3310
 epoch: 20, train_loss: 1.1868, test_loss: 1.2260, test_f1: 0.3324
 epoch: 21, train_loss: 1.1731, test_loss: 1.2157, test_f1: 0.3362
 epoch: 22, train_loss: 1.1591, test_loss: 1.2038, test_f1: 0.3396
 epoch: 23, train_loss: 1.1489, test_loss: 1.1942, test_f1: 0.3858
 epoch: 24, train_loss: 1.1363, test_loss: 1.1887, test_f1: 0.3699
 epoch: 25, train_loss: 1.1229, test_loss: 1.1801, test_f1: 0.3760
 epoch: 26, train_loss: 1.1131, test_loss: 1.1663, test_f1: 0.3826
 epoch: 27, train_loss: 1.0933, test_loss: 1.1434, test_f1: 0.3965
 epoch: 28, train_loss: 1.0746, test_loss: 1.1333, test_f1: 0.3802
 epoch: 29, train_loss: 1.0572, test_loss: 1.1171, test_f1: 0.3934
 epoch: 30, train_loss: 1.0399, test_loss: 1.1114, test_f1: 0.3985
 epoch: 31, train_loss: 1.0392, test_loss: 1.1467, test_f1: 0.3695
 epoch: 32, train_loss: 1.0259, test_loss: 1.1189, test_f1: 0.4000
 epoch: 33, train_loss: 1.0118, test_loss: 1.0586, test_f1: 0.4498
 epoch: 34, train_loss: 0.9939, test_loss: 1.0671, test_f1: 0.4444
 epoch: 35, train_loss: 0.9876, test_loss: 1.1248, test_f1: 0.4020
 epoch: 36, train_loss: 0.9829, test_loss: 1.2601, test_f1: 0.3934
 epoch: 37, train_loss: 0.9717, test_loss: 1.0369, test_f1: 0.4460
 epoch: 38, train_loss: 0.9627, test_loss: 1.1041, test_f1: 0.3993
 epoch: 39, train_loss: 0.9536, test_loss: 1.1003, test_f1: 0.4037
 epoch: 40, train_loss: 0.9414, test_loss: 1.1114, test_f1: 0.4362
 epoch: 41, train_loss: 0.9486, test_loss: 1.1806, test_f1: 0.4360
 epoch: 42, train_loss: 0.9376, test_loss: 1.1732, test_f1: 0.4438
 epoch: 43, train_loss: 0.9262, test_loss: 1.0742, test_f1: 0.4420
 epoch: 44, train_loss: 0.9168, test_loss: 1.0247, test_f1: 0.5145
 epoch: 45, train_loss: 0.9248, test_loss: 1.1769, test_f1: 0.5203
 epoch: 46, train_loss: 0.9167, test_loss: 1.1729, test_f1: 0.5126
 epoch: 47, train_loss: 0.9151, test_loss: 1.1310, test_f1: 0.5353
 epoch: 48, train_loss: 0.9033, test_loss: 1.1278, test_f1: 0.5444
 epoch: 49, train_loss: 0.9050, test_loss: 1.0449, test_f1: 0.5452
 epoch: 50, train_loss: 0.9007, test_loss: 1.0636, test_f1: 0.5317
 epoch: 51, train_loss: 0.9088, test_loss: 1.0949, test_f1: 0.5047
 epoch: 52, train_loss: 0.8954, test_loss: 1.0288, test_f1: 0.5771
 epoch: 53, train_loss: 0.8879, test_loss: 1.0351, test_f1: 0.5748
 epoch: 54, train_loss: 0.8794, test_loss: 1.0117, test_f1: 0.5861
 epoch: 55, train_loss: 0.8892, test_loss: 1.1882, test_f1: 0.5186
 epoch: 56, train_loss: 0.8794, test_loss: 1.0647, test_f1: 0.5497
 epoch: 57, train_loss: 0.8736, test_loss: 1.0635, test_f1: 0.5546
 epoch: 58, train_loss: 0.8778, test_loss: 1.0304, test_f1: 0.5724
 epoch: 59, train_loss: 0.8695, test_loss: 1.0264, test_f1: 0.5823
 epoch: 60, train_loss: 0.8692, test_loss: 1.0144, test_f1: 0.5858
 epoch: 61, train_loss: 0.8611, test_loss: 1.0364, test_f1: 0.5791
 epoch: 62, train_loss: 0.8587, test_loss: 1.0367, test_f1: 0.5604
 epoch: 63, train_loss: 0.8664, test_loss: 1.0614, test_f1: 0.5511
 epoch: 64, train_loss: 0.8594, test_loss: 1.0822, test_f1: 0.5357
 epoch: 65, train_loss: 0.8540, test_loss: 1.0479, test_f1: 0.5425
 epoch: 66, train_loss: 0.8570, test_loss: 1.0738, test_f1: 0.5367
 epoch: 67, train_loss: 0.8523, test_loss: 1.0165, test_f1: 0.5780
 epoch: 68, train_loss: 0.8474, test_loss: 1.1428, test_f1: 0.5349
 epoch: 69, train_loss: 0.8444, test_loss: 1.0233, test_f1: 0.5738
 epoch: 70, train_loss: 0.8569, test_loss: 1.0210, test_f1: 0.5686
 epoch: 71, train_loss: 0.8431, test_loss: 1.0583, test_f1: 0.5619
 epoch: 72, train_loss: 0.8438, test_loss: 1.0430, test_f1: 0.5612
 epoch: 73, train_loss: 0.8434, test_loss: 1.0683, test_f1: 0.5598
 epoch: 74, train_loss: 0.8326, test_loss: 1.0811, test_f1: 0.5372
 epoch: 75, train_loss: 0.8305, test_loss: 1.0471, test_f1: 0.5592
 epoch: 76, train_loss: 0.8384, test_loss: 1.0493, test_f1: 0.5615
 epoch: 77, train_loss: 0.8315, test_loss: 1.1422, test_f1: 0.5276
 epoch: 78, train_loss: 0.8229, test_loss: 1.0413, test_f1: 0.5604
 epoch: 79, train_loss: 0.8245, test_loss: 1.0958, test_f1: 0.5477
 epoch: 80, train_loss: 0.8388, test_loss: 1.0249, test_f1: 0.5749
 epoch: 81, train_loss: 0.8160, test_loss: 1.0743, test_f1: 0.5532
 epoch: 82, train_loss: 0.8225, test_loss: 1.0228, test_f1: 0.5857
 epoch: 83, train_loss: 0.8221, test_loss: 1.0494, test_f1: 0.5629
 epoch: 84, train_loss: 0.8209, test_loss: 1.1220, test_f1: 0.5294
 epoch: 85, train_loss: 0.8223, test_loss: 1.1490, test_f1: 0.5394
 epoch: 86, train_loss: 0.8130, test_loss: 1.0709, test_f1: 0.5763
 epoch: 87, train_loss: 0.8009, test_loss: 1.0687, test_f1: 0.5764
 epoch: 88, train_loss: 0.8036, test_loss: 1.1200, test_f1: 0.5586
 epoch: 89, train_loss: 0.8053, test_loss: 1.1306, test_f1: 0.5530
 epoch: 90, train_loss: 0.8127, test_loss: 1.1292, test_f1: 0.5672
 epoch: 91, train_loss: 0.8076, test_loss: 1.1140, test_f1: 0.5801
 epoch: 92, train_loss: 0.8093, test_loss: 1.1269, test_f1: 0.5813
 epoch: 93, train_loss: 0.8012, test_loss: 1.1659, test_f1: 0.5688
 epoch: 94, train_loss: 0.7981, test_loss: 1.1385, test_f1: 0.5749
 epoch: 95, train_loss: 0.7917, test_loss: 1.1539, test_f1: 0.5742
 epoch: 96, train_loss: 0.7967, test_loss: 1.0680, test_f1: 0.5406
 epoch: 97, train_loss: 0.7871, test_loss: 1.0558, test_f1: 0.5650
 epoch: 98, train_loss: 0.8007, test_loss: 1.2532, test_f1: 0.5354
 epoch: 99, train_loss: 0.7994, test_loss: 1.2179, test_f1: 0.5240
##################ITERATION #1 ****************************************
 epoch: 0, train_loss: 1.3790, test_loss: 1.3775, test_f1: 0.0659
 epoch: 1, train_loss: 1.3534, test_loss: 1.3653, test_f1: 0.1365
 epoch: 2, train_loss: 1.3356, test_loss: 1.3526, test_f1: 0.1365
 epoch: 3, train_loss: 1.3173, test_loss: 1.3403, test_f1: 0.1365
 epoch: 4, train_loss: 1.2986, test_loss: 1.3298, test_f1: 0.1365
 epoch: 5, train_loss: 1.2782, test_loss: 1.3171, test_f1: 0.1466
 epoch: 6, train_loss: 1.2565, test_loss: 1.3041, test_f1: 0.3234
 epoch: 7, train_loss: 1.2437, test_loss: 1.2896, test_f1: 0.3391
 epoch: 8, train_loss: 1.2308, test_loss: 1.2763, test_f1: 0.3403
 epoch: 9, train_loss: 1.2225, test_loss: 1.2656, test_f1: 0.3458
 epoch: 10, train_loss: 1.2144, test_loss: 1.2538, test_f1: 0.3340
 epoch: 11, train_loss: 1.2016, test_loss: 1.2444, test_f1: 0.3348
 epoch: 12, train_loss: 1.1969, test_loss: 1.2377, test_f1: 0.3172
 epoch: 13, train_loss: 1.1840, test_loss: 1.2305, test_f1: 0.3184
 epoch: 14, train_loss: 1.1661, test_loss: 1.2198, test_f1: 0.3185
 epoch: 15, train_loss: 1.1653, test_loss: 1.2136, test_f1: 0.3484
 epoch: 16, train_loss: 1.1581, test_loss: 1.2070, test_f1: 0.3918
 epoch: 17, train_loss: 1.1504, test_loss: 1.1883, test_f1: 0.4229
 epoch: 18, train_loss: 1.1359, test_loss: 1.1708, test_f1: 0.4243
 epoch: 19, train_loss: 1.1172, test_loss: 1.1653, test_f1: 0.4159
 epoch: 20, train_loss: 1.1112, test_loss: 1.1552, test_f1: 0.4441
 epoch: 21, train_loss: 1.1109, test_loss: 1.1440, test_f1: 0.4425
 epoch: 22, train_loss: 1.0973, test_loss: 1.1356, test_f1: 0.4280
 epoch: 23, train_loss: 1.0829, test_loss: 1.1309, test_f1: 0.4344
 epoch: 24, train_loss: 1.0759, test_loss: 1.1181, test_f1: 0.4482
 epoch: 25, train_loss: 1.0718, test_loss: 1.1127, test_f1: 0.4510
 epoch: 26, train_loss: 1.0548, test_loss: 1.1102, test_f1: 0.4412
 epoch: 27, train_loss: 1.0599, test_loss: 1.1102, test_f1: 0.4343
 epoch: 28, train_loss: 1.0499, test_loss: 1.1087, test_f1: 0.4236
 epoch: 29, train_loss: 1.0365, test_loss: 1.0967, test_f1: 0.4341
 epoch: 30, train_loss: 1.0236, test_loss: 1.1194, test_f1: 0.4117
 epoch: 31, train_loss: 1.0171, test_loss: 1.0974, test_f1: 0.4288
 epoch: 32, train_loss: 1.0237, test_loss: 1.0907, test_f1: 0.4400
 epoch: 33, train_loss: 1.0079, test_loss: 1.1163, test_f1: 0.4166
 epoch: 34, train_loss: 0.9933, test_loss: 1.1027, test_f1: 0.4299
 epoch: 35, train_loss: 0.9862, test_loss: 1.0864, test_f1: 0.4570
 epoch: 36, train_loss: 0.9910, test_loss: 1.0735, test_f1: 0.4577
 epoch: 37, train_loss: 0.9890, test_loss: 1.0798, test_f1: 0.4368
 epoch: 38, train_loss: 0.9878, test_loss: 1.1334, test_f1: 0.4331
 epoch: 39, train_loss: 0.9780, test_loss: 1.1336, test_f1: 0.4073
 epoch: 40, train_loss: 0.9745, test_loss: 1.1153, test_f1: 0.4293
 epoch: 41, train_loss: 0.9530, test_loss: 1.1128, test_f1: 0.4435
 epoch: 42, train_loss: 0.9652, test_loss: 1.1356, test_f1: 0.4567
 epoch: 43, train_loss: 0.9533, test_loss: 1.1710, test_f1: 0.4317
 epoch: 44, train_loss: 0.9512, test_loss: 1.1498, test_f1: 0.4335
 epoch: 45, train_loss: 0.9424, test_loss: 1.1666, test_f1: 0.4473
 epoch: 46, train_loss: 0.9359, test_loss: 1.1393, test_f1: 0.4566
 epoch: 47, train_loss: 0.9289, test_loss: 1.1244, test_f1: 0.4805
 epoch: 48, train_loss: 0.9161, test_loss: 1.1336, test_f1: 0.4751
 epoch: 49, train_loss: 0.9261, test_loss: 1.1676, test_f1: 0.4610
 epoch: 50, train_loss: 0.9180, test_loss: 1.1533, test_f1: 0.4978
 epoch: 51, train_loss: 0.9162, test_loss: 1.1592, test_f1: 0.4888
 epoch: 52, train_loss: 0.9058, test_loss: 1.1245, test_f1: 0.5051
 epoch: 53, train_loss: 0.9031, test_loss: 1.1559, test_f1: 0.4897
 epoch: 54, train_loss: 0.8918, test_loss: 1.2004, test_f1: 0.5239
 epoch: 55, train_loss: 0.8792, test_loss: 1.1909, test_f1: 0.5233
 epoch: 56, train_loss: 0.8954, test_loss: 1.1312, test_f1: 0.4970
 epoch: 57, train_loss: 0.8930, test_loss: 1.1056, test_f1: 0.5139
 epoch: 58, train_loss: 0.8928, test_loss: 1.1238, test_f1: 0.5329
 epoch: 59, train_loss: 0.8762, test_loss: 1.1969, test_f1: 0.5167
 epoch: 60, train_loss: 0.8772, test_loss: 1.2157, test_f1: 0.4934
 epoch: 61, train_loss: 0.8836, test_loss: 1.1536, test_f1: 0.5207
 epoch: 62, train_loss: 0.8779, test_loss: 1.1292, test_f1: 0.5366
 epoch: 63, train_loss: 0.8879, test_loss: 1.1022, test_f1: 0.5260
 epoch: 64, train_loss: 0.8957, test_loss: 1.1172, test_f1: 0.5209
 epoch: 65, train_loss: 0.8757, test_loss: 1.1728, test_f1: 0.5393
 epoch: 66, train_loss: 0.8703, test_loss: 1.1897, test_f1: 0.5313
 epoch: 67, train_loss: 0.8669, test_loss: 1.2084, test_f1: 0.5256
 epoch: 68, train_loss: 0.8727, test_loss: 1.1910, test_f1: 0.5444
 epoch: 69, train_loss: 0.8708, test_loss: 1.1324, test_f1: 0.5384
 epoch: 70, train_loss: 0.8643, test_loss: 1.1639, test_f1: 0.5387
 epoch: 71, train_loss: 0.8574, test_loss: 1.1573, test_f1: 0.5320
 epoch: 72, train_loss: 0.8424, test_loss: 1.1128, test_f1: 0.5412
 epoch: 73, train_loss: 0.8393, test_loss: 1.1575, test_f1: 0.5227
 epoch: 74, train_loss: 0.8607, test_loss: 1.1719, test_f1: 0.5150
 epoch: 75, train_loss: 0.8449, test_loss: 1.1995, test_f1: 0.5227
 epoch: 76, train_loss: 0.8510, test_loss: 1.2815, test_f1: 0.5070
 epoch: 77, train_loss: 0.8566, test_loss: 1.2942, test_f1: 0.5196
 epoch: 78, train_loss: 0.8537, test_loss: 1.2186, test_f1: 0.5215
 epoch: 79, train_loss: 0.8532, test_loss: 1.1518, test_f1: 0.5379
 epoch: 80, train_loss: 0.8485, test_loss: 1.1579, test_f1: 0.5403
 epoch: 81, train_loss: 0.8415, test_loss: 1.1836, test_f1: 0.5469
 epoch: 82, train_loss: 0.8465, test_loss: 1.2104, test_f1: 0.5572
 epoch: 83, train_loss: 0.8280, test_loss: 1.2346, test_f1: 0.5282
 epoch: 84, train_loss: 0.8343, test_loss: 1.2556, test_f1: 0.5340
 epoch: 85, train_loss: 0.8333, test_loss: 1.2279, test_f1: 0.5436
 epoch: 86, train_loss: 0.8369, test_loss: 1.2459, test_f1: 0.5471
 epoch: 87, train_loss: 0.8317, test_loss: 1.3054, test_f1: 0.5297
 epoch: 88, train_loss: 0.8232, test_loss: 1.2836, test_f1: 0.5358
 epoch: 89, train_loss: 0.8205, test_loss: 1.2564, test_f1: 0.5537
 epoch: 90, train_loss: 0.8231, test_loss: 1.1650, test_f1: 0.5360
 epoch: 91, train_loss: 0.8143, test_loss: 1.1379, test_f1: 0.5311
 epoch: 92, train_loss: 0.8058, test_loss: 1.0754, test_f1: 0.5510
 epoch: 93, train_loss: 0.8130, test_loss: 1.0729, test_f1: 0.5526
 epoch: 94, train_loss: 0.8164, test_loss: 1.0841, test_f1: 0.5437
 epoch: 95, train_loss: 0.7974, test_loss: 1.1259, test_f1: 0.5137
 epoch: 96, train_loss: 0.8087, test_loss: 1.0544, test_f1: 0.5564
 epoch: 97, train_loss: 0.8003, test_loss: 1.1254, test_f1: 0.5504
 epoch: 98, train_loss: 0.8173, test_loss: 1.2503, test_f1: 0.5379
 epoch: 99, train_loss: 0.8057, test_loss: 1.0850, test_f1: 0.5499
##################ITERATION #2 ****************************************
 epoch: 0, train_loss: 1.3494, test_loss: 1.3492, test_f1: 0.1513
 epoch: 1, train_loss: 1.2974, test_loss: 1.3424, test_f1: 0.2372
 epoch: 2, train_loss: 1.2683, test_loss: 1.3328, test_f1: 0.2240
 epoch: 3, train_loss: 1.2419, test_loss: 1.3240, test_f1: 0.1825
 epoch: 4, train_loss: 1.2151, test_loss: 1.3114, test_f1: 0.1669
 epoch: 5, train_loss: 1.1997, test_loss: 1.2842, test_f1: 0.2552
 epoch: 6, train_loss: 1.1815, test_loss: 1.2407, test_f1: 0.3521
 epoch: 7, train_loss: 1.1550, test_loss: 1.2006, test_f1: 0.3388
 epoch: 8, train_loss: 1.1330, test_loss: 1.1742, test_f1: 0.3757
 epoch: 9, train_loss: 1.1185, test_loss: 1.1475, test_f1: 0.4120
 epoch: 10, train_loss: 1.0924, test_loss: 1.1242, test_f1: 0.3948
 epoch: 11, train_loss: 1.0752, test_loss: 1.1443, test_f1: 0.3661
 epoch: 12, train_loss: 1.0719, test_loss: 1.1394, test_f1: 0.3719
 epoch: 13, train_loss: 1.0582, test_loss: 1.0736, test_f1: 0.4174
 epoch: 14, train_loss: 1.0502, test_loss: 1.0646, test_f1: 0.4256
 epoch: 15, train_loss: 1.0320, test_loss: 1.0731, test_f1: 0.4122
 epoch: 16, train_loss: 1.0230, test_loss: 1.1298, test_f1: 0.3465
 epoch: 17, train_loss: 1.0140, test_loss: 1.1493, test_f1: 0.3593
 epoch: 18, train_loss: 1.0004, test_loss: 1.0542, test_f1: 0.4104
 epoch: 19, train_loss: 0.9934, test_loss: 1.0373, test_f1: 0.4611
 epoch: 20, train_loss: 0.9880, test_loss: 1.0252, test_f1: 0.4785
 epoch: 21, train_loss: 0.9867, test_loss: 1.0362, test_f1: 0.4571
 epoch: 22, train_loss: 0.9742, test_loss: 1.0154, test_f1: 0.5133
 epoch: 23, train_loss: 0.9587, test_loss: 1.0290, test_f1: 0.4521
 epoch: 24, train_loss: 0.9548, test_loss: 1.0050, test_f1: 0.5121
 epoch: 25, train_loss: 0.9523, test_loss: 1.0357, test_f1: 0.5173
 epoch: 26, train_loss: 0.9468, test_loss: 1.0272, test_f1: 0.5127
 epoch: 27, train_loss: 0.9375, test_loss: 0.9955, test_f1: 0.4988
 epoch: 28, train_loss: 0.9163, test_loss: 1.0057, test_f1: 0.4772
 epoch: 29, train_loss: 0.9323, test_loss: 0.9976, test_f1: 0.5037
 epoch: 30, train_loss: 0.9323, test_loss: 1.0446, test_f1: 0.4852
 epoch: 31, train_loss: 0.9180, test_loss: 0.9754, test_f1: 0.5144
 epoch: 32, train_loss: 0.9095, test_loss: 0.9802, test_f1: 0.5114
 epoch: 33, train_loss: 0.9315, test_loss: 1.0559, test_f1: 0.4680
 epoch: 34, train_loss: 0.9253, test_loss: 0.9928, test_f1: 0.5024
 epoch: 35, train_loss: 0.9102, test_loss: 1.0001, test_f1: 0.4863
 epoch: 36, train_loss: 0.9022, test_loss: 1.3544, test_f1: 0.3347
 epoch: 37, train_loss: 0.9023, test_loss: 1.0103, test_f1: 0.4765
 epoch: 38, train_loss: 0.8996, test_loss: 0.9878, test_f1: 0.5297
 epoch: 39, train_loss: 0.8999, test_loss: 0.9745, test_f1: 0.5216
 epoch: 40, train_loss: 0.8784, test_loss: 0.9870, test_f1: 0.5109
 epoch: 41, train_loss: 0.8741, test_loss: 0.9736, test_f1: 0.5224
 epoch: 42, train_loss: 0.8612, test_loss: 0.9657, test_f1: 0.5300
 epoch: 43, train_loss: 0.8641, test_loss: 0.9670, test_f1: 0.5284
 epoch: 44, train_loss: 0.8583, test_loss: 0.9893, test_f1: 0.4803
 epoch: 45, train_loss: 0.8465, test_loss: 0.9645, test_f1: 0.5049
 epoch: 46, train_loss: 0.8411, test_loss: 0.9405, test_f1: 0.5313
 epoch: 47, train_loss: 0.8446, test_loss: 0.9647, test_f1: 0.4925
 epoch: 48, train_loss: 0.8540, test_loss: 0.9425, test_f1: 0.5179
 epoch: 49, train_loss: 0.8341, test_loss: 1.1061, test_f1: 0.4159
 epoch: 50, train_loss: 0.8488, test_loss: 0.9977, test_f1: 0.4626
 epoch: 51, train_loss: 0.8393, test_loss: 0.9607, test_f1: 0.4738
 epoch: 52, train_loss: 0.8067, test_loss: 0.9439, test_f1: 0.5244
 epoch: 53, train_loss: 0.8303, test_loss: 0.9520, test_f1: 0.5249
 epoch: 54, train_loss: 0.8071, test_loss: 0.9443, test_f1: 0.5189
 epoch: 55, train_loss: 0.7945, test_loss: 0.9694, test_f1: 0.4833
 epoch: 56, train_loss: 0.8046, test_loss: 1.0048, test_f1: 0.4558
 epoch: 57, train_loss: 0.8182, test_loss: 0.9943, test_f1: 0.4319
 epoch: 58, train_loss: 0.8110, test_loss: 0.9466, test_f1: 0.5177
 epoch: 59, train_loss: 0.7951, test_loss: 0.9301, test_f1: 0.5112
 epoch: 60, train_loss: 0.7992, test_loss: 0.9410, test_f1: 0.5073
 epoch: 61, train_loss: 0.7972, test_loss: 0.9753, test_f1: 0.4940
 epoch: 62, train_loss: 0.7907, test_loss: 0.9521, test_f1: 0.5211
 epoch: 63, train_loss: 0.7835, test_loss: 0.9443, test_f1: 0.5100
 epoch: 64, train_loss: 0.8002, test_loss: 0.9446, test_f1: 0.5395
 epoch: 65, train_loss: 0.7912, test_loss: 0.9534, test_f1: 0.5357
 epoch: 66, train_loss: 0.7886, test_loss: 0.9438, test_f1: 0.5524
 epoch: 67, train_loss: 0.7754, test_loss: 0.9734, test_f1: 0.4706
 epoch: 68, train_loss: 0.7683, test_loss: 0.9849, test_f1: 0.4747
 epoch: 69, train_loss: 0.7953, test_loss: 0.9895, test_f1: 0.4769
 epoch: 70, train_loss: 0.7788, test_loss: 0.9921, test_f1: 0.4937
 epoch: 71, train_loss: 0.7655, test_loss: 0.9309, test_f1: 0.5583
 epoch: 72, train_loss: 0.7719, test_loss: 0.9458, test_f1: 0.5260
 epoch: 73, train_loss: 0.7576, test_loss: 0.9456, test_f1: 0.5188
 epoch: 74, train_loss: 0.7692, test_loss: 0.9356, test_f1: 0.5371
 epoch: 75, train_loss: 0.7661, test_loss: 0.9536, test_f1: 0.4917
 epoch: 76, train_loss: 0.7611, test_loss: 0.9665, test_f1: 0.5218
 epoch: 77, train_loss: 0.7546, test_loss: 0.9580, test_f1: 0.5554
 epoch: 78, train_loss: 0.7504, test_loss: 0.9594, test_f1: 0.5497
 epoch: 79, train_loss: 0.7572, test_loss: 0.9956, test_f1: 0.4828
 epoch: 80, train_loss: 0.7474, test_loss: 0.9937, test_f1: 0.4535
 epoch: 81, train_loss: 0.7499, test_loss: 0.9930, test_f1: 0.4688
 epoch: 82, train_loss: 0.7584, test_loss: 0.9916, test_f1: 0.4960
 epoch: 83, train_loss: 0.7837, test_loss: 0.9942, test_f1: 0.5142
 epoch: 84, train_loss: 0.7526, test_loss: 0.9788, test_f1: 0.5374
 epoch: 85, train_loss: 0.7678, test_loss: 0.9587, test_f1: 0.5457
 epoch: 86, train_loss: 0.7708, test_loss: 0.9523, test_f1: 0.5145
 epoch: 87, train_loss: 0.7640, test_loss: 0.9517, test_f1: 0.5169
 epoch: 88, train_loss: 0.7404, test_loss: 0.9439, test_f1: 0.5464
 epoch: 89, train_loss: 0.7411, test_loss: 0.9456, test_f1: 0.5283
 epoch: 90, train_loss: 0.7350, test_loss: 0.9578, test_f1: 0.5383
 epoch: 91, train_loss: 0.7358, test_loss: 0.9668, test_f1: 0.5281
 epoch: 92, train_loss: 0.7570, test_loss: 0.9632, test_f1: 0.5100
 epoch: 93, train_loss: 0.7332, test_loss: 0.9622, test_f1: 0.5197
 epoch: 94, train_loss: 0.7179, test_loss: 0.9672, test_f1: 0.5223
 epoch: 95, train_loss: 0.7173, test_loss: 0.9718, test_f1: 0.5244
 epoch: 96, train_loss: 0.7339, test_loss: 0.9883, test_f1: 0.5135
 epoch: 97, train_loss: 0.7311, test_loss: 1.0110, test_f1: 0.5317
 epoch: 98, train_loss: 0.7303, test_loss: 0.9861, test_f1: 0.5300
 epoch: 99, train_loss: 0.7284, test_loss: 0.9602, test_f1: 0.5304
##################ITERATION #3 ****************************************
 epoch: 0, train_loss: 1.2912, test_loss: 1.3133, test_f1: 0.2281
 epoch: 1, train_loss: 1.2459, test_loss: 1.3057, test_f1: 0.2281
 epoch: 2, train_loss: 1.2217, test_loss: 1.3032, test_f1: 0.2281
 epoch: 3, train_loss: 1.1987, test_loss: 1.3077, test_f1: 0.2281
 epoch: 4, train_loss: 1.1919, test_loss: 1.3171, test_f1: 0.2281
 epoch: 5, train_loss: 1.1729, test_loss: 1.3270, test_f1: 0.2281
 epoch: 6, train_loss: 1.1687, test_loss: 1.3323, test_f1: 0.2281
 epoch: 7, train_loss: 1.1535, test_loss: 1.3365, test_f1: 0.2248
 epoch: 8, train_loss: 1.1494, test_loss: 1.3407, test_f1: 0.2703
 epoch: 9, train_loss: 1.1301, test_loss: 1.3174, test_f1: 0.2754
 epoch: 10, train_loss: 1.1173, test_loss: 1.2749, test_f1: 0.3209
 epoch: 11, train_loss: 1.1130, test_loss: 1.2426, test_f1: 0.3607
 epoch: 12, train_loss: 1.0978, test_loss: 1.2052, test_f1: 0.3495
 epoch: 13, train_loss: 1.0793, test_loss: 1.1706, test_f1: 0.3868
 epoch: 14, train_loss: 1.0758, test_loss: 1.1465, test_f1: 0.4264
 epoch: 15, train_loss: 1.0618, test_loss: 1.1209, test_f1: 0.4396
 epoch: 16, train_loss: 1.0573, test_loss: 1.1141, test_f1: 0.4309
 epoch: 17, train_loss: 1.0355, test_loss: 1.1144, test_f1: 0.4209
 epoch: 18, train_loss: 1.0349, test_loss: 1.1047, test_f1: 0.4431
 epoch: 19, train_loss: 1.0152, test_loss: 1.0827, test_f1: 0.4673
 epoch: 20, train_loss: 1.0107, test_loss: 1.0781, test_f1: 0.4529
 epoch: 21, train_loss: 1.0006, test_loss: 1.0744, test_f1: 0.4685
 epoch: 22, train_loss: 1.0002, test_loss: 1.0586, test_f1: 0.4792
 epoch: 23, train_loss: 0.9884, test_loss: 1.0538, test_f1: 0.4749
 epoch: 24, train_loss: 0.9784, test_loss: 1.0501, test_f1: 0.4922
 epoch: 25, train_loss: 0.9693, test_loss: 1.0544, test_f1: 0.5134
 epoch: 26, train_loss: 0.9652, test_loss: 1.0787, test_f1: 0.5053
 epoch: 27, train_loss: 0.9604, test_loss: 1.0652, test_f1: 0.5125
 epoch: 28, train_loss: 0.9522, test_loss: 1.0453, test_f1: 0.5392
 epoch: 29, train_loss: 0.9426, test_loss: 1.0352, test_f1: 0.5652
 epoch: 30, train_loss: 0.9346, test_loss: 1.0404, test_f1: 0.5904
 epoch: 31, train_loss: 0.9424, test_loss: 1.0474, test_f1: 0.5808
 epoch: 32, train_loss: 0.9210, test_loss: 1.0420, test_f1: 0.5662
 epoch: 33, train_loss: 0.9213, test_loss: 1.0195, test_f1: 0.5455
 epoch: 34, train_loss: 0.9069, test_loss: 1.0273, test_f1: 0.5203
 epoch: 35, train_loss: 0.9258, test_loss: 1.0234, test_f1: 0.5157
 epoch: 36, train_loss: 0.9042, test_loss: 1.0240, test_f1: 0.4999
 epoch: 37, train_loss: 0.8919, test_loss: 1.0332, test_f1: 0.5125
 epoch: 38, train_loss: 0.9029, test_loss: 1.0449, test_f1: 0.4863
 epoch: 39, train_loss: 0.8855, test_loss: 1.0284, test_f1: 0.5433
 epoch: 40, train_loss: 0.8791, test_loss: 1.0273, test_f1: 0.5238
 epoch: 41, train_loss: 0.8886, test_loss: 1.0293, test_f1: 0.4950
 epoch: 42, train_loss: 0.8892, test_loss: 1.0255, test_f1: 0.4917
 epoch: 43, train_loss: 0.8821, test_loss: 1.0225, test_f1: 0.4983
 epoch: 44, train_loss: 0.8777, test_loss: 1.0127, test_f1: 0.5124
 epoch: 45, train_loss: 0.8661, test_loss: 1.0068, test_f1: 0.5136
 epoch: 46, train_loss: 0.8601, test_loss: 1.0411, test_f1: 0.4966
 epoch: 47, train_loss: 0.8617, test_loss: 1.0376, test_f1: 0.5466
 epoch: 48, train_loss: 0.8420, test_loss: 1.0299, test_f1: 0.5451
 epoch: 49, train_loss: 0.8490, test_loss: 1.0121, test_f1: 0.5445
 epoch: 50, train_loss: 0.8386, test_loss: 1.0310, test_f1: 0.5324
 epoch: 51, train_loss: 0.8425, test_loss: 1.0227, test_f1: 0.5772
 epoch: 52, train_loss: 0.8366, test_loss: 1.0059, test_f1: 0.5575
 epoch: 53, train_loss: 0.8442, test_loss: 0.9994, test_f1: 0.5642
 epoch: 54, train_loss: 0.8445, test_loss: 1.0055, test_f1: 0.5497
 epoch: 55, train_loss: 0.8238, test_loss: 1.0259, test_f1: 0.5444
 epoch: 56, train_loss: 0.8152, test_loss: 1.0187, test_f1: 0.5512
 epoch: 57, train_loss: 0.8235, test_loss: 1.0074, test_f1: 0.5185
 epoch: 58, train_loss: 0.8257, test_loss: 1.0242, test_f1: 0.5152
 epoch: 59, train_loss: 0.8125, test_loss: 1.0152, test_f1: 0.5359
 epoch: 60, train_loss: 0.8065, test_loss: 1.0076, test_f1: 0.5438
 epoch: 61, train_loss: 0.8149, test_loss: 1.0224, test_f1: 0.5396
 epoch: 62, train_loss: 0.8136, test_loss: 1.0252, test_f1: 0.5541
 epoch: 63, train_loss: 0.7990, test_loss: 1.0416, test_f1: 0.5426
 epoch: 64, train_loss: 0.8046, test_loss: 1.0215, test_f1: 0.5442
 epoch: 65, train_loss: 0.7994, test_loss: 1.0031, test_f1: 0.5593
 epoch: 66, train_loss: 0.8080, test_loss: 0.9960, test_f1: 0.5830
 epoch: 67, train_loss: 0.8018, test_loss: 1.0231, test_f1: 0.5545
 epoch: 68, train_loss: 0.7984, test_loss: 1.0394, test_f1: 0.5460
 epoch: 69, train_loss: 0.7929, test_loss: 1.0377, test_f1: 0.5528
 epoch: 70, train_loss: 0.8014, test_loss: 1.0190, test_f1: 0.5540
 epoch: 71, train_loss: 0.8007, test_loss: 1.0188, test_f1: 0.5552
 epoch: 72, train_loss: 0.7875, test_loss: 1.0228, test_f1: 0.5402
 epoch: 73, train_loss: 0.7887, test_loss: 1.0518, test_f1: 0.5360
 epoch: 74, train_loss: 0.8013, test_loss: 1.0430, test_f1: 0.5418
 epoch: 75, train_loss: 0.7831, test_loss: 1.0243, test_f1: 0.5468
 epoch: 76, train_loss: 0.7920, test_loss: 1.0199, test_f1: 0.5430
 epoch: 77, train_loss: 0.7829, test_loss: 1.0460, test_f1: 0.5337
 epoch: 78, train_loss: 0.7732, test_loss: 0.9985, test_f1: 0.5485
 epoch: 79, train_loss: 0.7816, test_loss: 0.9972, test_f1: 0.5475
 epoch: 80, train_loss: 0.7877, test_loss: 1.0051, test_f1: 0.5631
 epoch: 81, train_loss: 0.7891, test_loss: 1.0092, test_f1: 0.5422
 epoch: 82, train_loss: 0.7693, test_loss: 1.0250, test_f1: 0.5394
 epoch: 83, train_loss: 0.7646, test_loss: 1.0306, test_f1: 0.5523
 epoch: 84, train_loss: 0.7643, test_loss: 1.0282, test_f1: 0.5341
 epoch: 85, train_loss: 0.7522, test_loss: 0.9987, test_f1: 0.5508
 epoch: 86, train_loss: 0.7573, test_loss: 0.9946, test_f1: 0.5669
 epoch: 87, train_loss: 0.7743, test_loss: 1.0061, test_f1: 0.5377
 epoch: 88, train_loss: 0.7588, test_loss: 1.0067, test_f1: 0.5377
 epoch: 89, train_loss: 0.7619, test_loss: 1.0025, test_f1: 0.5388
 epoch: 90, train_loss: 0.7606, test_loss: 1.0443, test_f1: 0.5430
 epoch: 91, train_loss: 0.7438, test_loss: 1.0312, test_f1: 0.5569
 epoch: 92, train_loss: 0.7503, test_loss: 1.0149, test_f1: 0.5504
 epoch: 93, train_loss: 0.7443, test_loss: 1.0160, test_f1: 0.5233
 epoch: 94, train_loss: 0.7504, test_loss: 1.0074, test_f1: 0.5383
 epoch: 95, train_loss: 0.7528, test_loss: 1.0087, test_f1: 0.5399
 epoch: 96, train_loss: 0.7725, test_loss: 0.9950, test_f1: 0.5658
 epoch: 97, train_loss: 0.7567, test_loss: 0.9920, test_f1: 0.5616
 epoch: 98, train_loss: 0.7461, test_loss: 1.0100, test_f1: 0.5362
 epoch: 99, train_loss: 0.7331, test_loss: 1.0096, test_f1: 0.5617
##################ITERATION #4 ****************************************
 epoch: 0, train_loss: 1.2818, test_loss: 1.3075, test_f1: 0.2281
 epoch: 1, train_loss: 1.2206, test_loss: 1.3054, test_f1: 0.2281
 epoch: 2, train_loss: 1.2255, test_loss: 1.3031, test_f1: 0.2377
 epoch: 3, train_loss: 1.1996, test_loss: 1.3012, test_f1: 0.2364
 epoch: 4, train_loss: 1.1855, test_loss: 1.2962, test_f1: 0.2239
 epoch: 5, train_loss: 1.1743, test_loss: 1.2829, test_f1: 0.2382
 epoch: 6, train_loss: 1.1572, test_loss: 1.2603, test_f1: 0.2218
 epoch: 7, train_loss: 1.1559, test_loss: 1.2444, test_f1: 0.2532
 epoch: 8, train_loss: 1.1499, test_loss: 1.2326, test_f1: 0.2486
 epoch: 9, train_loss: 1.1303, test_loss: 1.2062, test_f1: 0.3276
 epoch: 10, train_loss: 1.1214, test_loss: 1.1899, test_f1: 0.3507
 epoch: 11, train_loss: 1.1070, test_loss: 1.1678, test_f1: 0.3700
 epoch: 12, train_loss: 1.0966, test_loss: 1.1333, test_f1: 0.4173
 epoch: 13, train_loss: 1.0855, test_loss: 1.1204, test_f1: 0.4445
 epoch: 14, train_loss: 1.0736, test_loss: 1.1084, test_f1: 0.4440
 epoch: 15, train_loss: 1.0613, test_loss: 1.0882, test_f1: 0.4827
 epoch: 16, train_loss: 1.0489, test_loss: 1.0869, test_f1: 0.4609
 epoch: 17, train_loss: 1.0388, test_loss: 1.0752, test_f1: 0.4887
 epoch: 18, train_loss: 1.0347, test_loss: 1.0665, test_f1: 0.5049
 epoch: 19, train_loss: 1.0285, test_loss: 1.0582, test_f1: 0.5023
 epoch: 20, train_loss: 1.0142, test_loss: 1.0825, test_f1: 0.4746
 epoch: 21, train_loss: 1.0268, test_loss: 1.1018, test_f1: 0.4480
 epoch: 22, train_loss: 1.0193, test_loss: 1.0733, test_f1: 0.4906
 epoch: 23, train_loss: 1.0092, test_loss: 1.0532, test_f1: 0.4954
 epoch: 24, train_loss: 0.9969, test_loss: 1.0571, test_f1: 0.4949
 epoch: 25, train_loss: 0.9953, test_loss: 1.0544, test_f1: 0.5028
 epoch: 26, train_loss: 0.9914, test_loss: 1.0364, test_f1: 0.5151
 epoch: 27, train_loss: 0.9913, test_loss: 1.0327, test_f1: 0.4985
 epoch: 28, train_loss: 0.9658, test_loss: 1.0471, test_f1: 0.4850
 epoch: 29, train_loss: 0.9503, test_loss: 1.0085, test_f1: 0.5124
 epoch: 30, train_loss: 0.9605, test_loss: 0.9912, test_f1: 0.5432
 epoch: 31, train_loss: 0.9532, test_loss: 0.9984, test_f1: 0.5188
 epoch: 32, train_loss: 0.9406, test_loss: 1.0087, test_f1: 0.5164
 epoch: 33, train_loss: 0.9378, test_loss: 0.9934, test_f1: 0.5287
 epoch: 34, train_loss: 0.9219, test_loss: 1.0184, test_f1: 0.5241
 epoch: 35, train_loss: 0.9326, test_loss: 0.9901, test_f1: 0.5488
 epoch: 36, train_loss: 0.9289, test_loss: 1.0429, test_f1: 0.5493
 epoch: 37, train_loss: 0.9406, test_loss: 1.0132, test_f1: 0.5253
 epoch: 38, train_loss: 0.9106, test_loss: 1.0457, test_f1: 0.5050
 epoch: 39, train_loss: 0.9305, test_loss: 1.0161, test_f1: 0.5365
 epoch: 40, train_loss: 0.9202, test_loss: 1.0188, test_f1: 0.5190
 epoch: 41, train_loss: 0.9238, test_loss: 1.0212, test_f1: 0.5307
 epoch: 42, train_loss: 0.9077, test_loss: 1.0156, test_f1: 0.5357
 epoch: 43, train_loss: 0.9072, test_loss: 0.9875, test_f1: 0.5509
 epoch: 44, train_loss: 0.9031, test_loss: 1.0030, test_f1: 0.5407
 epoch: 45, train_loss: 0.8958, test_loss: 1.0093, test_f1: 0.5428
 epoch: 46, train_loss: 0.8862, test_loss: 1.0038, test_f1: 0.5332
 epoch: 47, train_loss: 0.8898, test_loss: 1.0020, test_f1: 0.5602
 epoch: 48, train_loss: 0.8859, test_loss: 0.9903, test_f1: 0.5162
 epoch: 49, train_loss: 0.8891, test_loss: 1.0431, test_f1: 0.4924
 epoch: 50, train_loss: 0.8798, test_loss: 1.0307, test_f1: 0.4923
 epoch: 51, train_loss: 0.8587, test_loss: 1.0092, test_f1: 0.5067
 epoch: 52, train_loss: 0.8534, test_loss: 0.9996, test_f1: 0.5305
 epoch: 53, train_loss: 0.8544, test_loss: 1.0071, test_f1: 0.5442
 epoch: 54, train_loss: 0.8479, test_loss: 1.0117, test_f1: 0.5375
 epoch: 55, train_loss: 0.8495, test_loss: 1.0217, test_f1: 0.5294
 epoch: 56, train_loss: 0.8385, test_loss: 1.0300, test_f1: 0.5493
 epoch: 57, train_loss: 0.8419, test_loss: 1.0204, test_f1: 0.5339
 epoch: 58, train_loss: 0.8639, test_loss: 1.0304, test_f1: 0.5216
 epoch: 59, train_loss: 0.8670, test_loss: 1.0286, test_f1: 0.5412
 epoch: 60, train_loss: 0.8698, test_loss: 1.0305, test_f1: 0.5435
 epoch: 61, train_loss: 0.8506, test_loss: 1.0285, test_f1: 0.5562
 epoch: 62, train_loss: 0.8401, test_loss: 1.0186, test_f1: 0.5435
 epoch: 63, train_loss: 0.8582, test_loss: 1.0241, test_f1: 0.5406
 epoch: 64, train_loss: 0.8380, test_loss: 1.0247, test_f1: 0.5292
 epoch: 65, train_loss: 0.8378, test_loss: 1.0452, test_f1: 0.5195
 epoch: 66, train_loss: 0.8319, test_loss: 1.0419, test_f1: 0.5289
 epoch: 67, train_loss: 0.8347, test_loss: 1.0290, test_f1: 0.5273
 epoch: 68, train_loss: 0.8346, test_loss: 1.0107, test_f1: 0.5415
 epoch: 69, train_loss: 0.8221, test_loss: 1.0251, test_f1: 0.5327
 epoch: 70, train_loss: 0.8287, test_loss: 1.0197, test_f1: 0.5338
 epoch: 71, train_loss: 0.8208, test_loss: 1.0338, test_f1: 0.5257
 epoch: 72, train_loss: 0.8314, test_loss: 1.0390, test_f1: 0.5115
 epoch: 73, train_loss: 0.8164, test_loss: 1.0140, test_f1: 0.5519
 epoch: 74, train_loss: 0.8231, test_loss: 1.0249, test_f1: 0.5526
 epoch: 75, train_loss: 0.8336, test_loss: 1.0288, test_f1: 0.5486
 epoch: 76, train_loss: 0.8362, test_loss: 1.1278, test_f1: 0.5151
 epoch: 77, train_loss: 0.8425, test_loss: 1.0246, test_f1: 0.5736
 epoch: 78, train_loss: 0.8217, test_loss: 1.0290, test_f1: 0.5732
 epoch: 79, train_loss: 0.8312, test_loss: 1.0507, test_f1: 0.5624
 epoch: 80, train_loss: 0.8302, test_loss: 1.0268, test_f1: 0.5192
 epoch: 81, train_loss: 0.8437, test_loss: 1.0423, test_f1: 0.5637
 epoch: 82, train_loss: 0.8440, test_loss: 1.0485, test_f1: 0.5527
 epoch: 83, train_loss: 0.8260, test_loss: 1.0087, test_f1: 0.5512
 epoch: 84, train_loss: 0.8172, test_loss: 1.0157, test_f1: 0.5692
 epoch: 85, train_loss: 0.8150, test_loss: 1.0179, test_f1: 0.5708
 epoch: 86, train_loss: 0.8158, test_loss: 1.0338, test_f1: 0.5094
 epoch: 87, train_loss: 0.8315, test_loss: 0.9990, test_f1: 0.5491
 epoch: 88, train_loss: 0.8240, test_loss: 0.9817, test_f1: 0.5499
 epoch: 89, train_loss: 0.8261, test_loss: 1.0095, test_f1: 0.5404
 epoch: 90, train_loss: 0.8360, test_loss: 1.0324, test_f1: 0.5181
 epoch: 91, train_loss: 0.8132, test_loss: 1.0358, test_f1: 0.5272
 epoch: 92, train_loss: 0.8084, test_loss: 1.0148, test_f1: 0.5258
 epoch: 93, train_loss: 0.8209, test_loss: 1.0145, test_f1: 0.5244
 epoch: 94, train_loss: 0.8205, test_loss: 1.0738, test_f1: 0.5355
 epoch: 95, train_loss: 0.8289, test_loss: 1.0560, test_f1: 0.5380
 epoch: 96, train_loss: 0.8141, test_loss: 1.0530, test_f1: 0.5432
 epoch: 97, train_loss: 0.8186, test_loss: 1.0588, test_f1: 0.5432
 epoch: 98, train_loss: 0.8146, test_loss: 1.0403, test_f1: 0.5500
 epoch: 99, train_loss: 0.8269, test_loss: 1.0488, test_f1: 0.5748
##################ITERATION #5 ****************************************
 epoch: 0, train_loss: 1.2617, test_loss: 1.3010, test_f1: 0.2281
 epoch: 1, train_loss: 1.2289, test_loss: 1.3070, test_f1: 0.2281
 epoch: 2, train_loss: 1.2105, test_loss: 1.3137, test_f1: 0.2281
 epoch: 3, train_loss: 1.1985, test_loss: 1.3175, test_f1: 0.2281
 epoch: 4, train_loss: 1.1718, test_loss: 1.3198, test_f1: 0.2281
 epoch: 5, train_loss: 1.1633, test_loss: 1.3117, test_f1: 0.2281
 epoch: 6, train_loss: 1.1461, test_loss: 1.2983, test_f1: 0.2281
 epoch: 7, train_loss: 1.1334, test_loss: 1.2864, test_f1: 0.2281
 epoch: 8, train_loss: 1.1265, test_loss: 1.2676, test_f1: 0.2336
 epoch: 9, train_loss: 1.1053, test_loss: 1.2436, test_f1: 0.2431
 epoch: 10, train_loss: 1.0988, test_loss: 1.2195, test_f1: 0.3127
 epoch: 11, train_loss: 1.0789, test_loss: 1.1643, test_f1: 0.3800
 epoch: 12, train_loss: 1.0795, test_loss: 1.1465, test_f1: 0.3884
 epoch: 13, train_loss: 1.0673, test_loss: 1.1353, test_f1: 0.3916
 epoch: 14, train_loss: 1.0746, test_loss: 1.1210, test_f1: 0.4163
 epoch: 15, train_loss: 1.0456, test_loss: 1.1107, test_f1: 0.4514
 epoch: 16, train_loss: 1.0341, test_loss: 1.0871, test_f1: 0.4973
 epoch: 17, train_loss: 1.0315, test_loss: 1.1115, test_f1: 0.4674
 epoch: 18, train_loss: 1.0240, test_loss: 1.1170, test_f1: 0.4683
 epoch: 19, train_loss: 1.0336, test_loss: 1.1103, test_f1: 0.4741
 epoch: 20, train_loss: 1.0136, test_loss: 1.0903, test_f1: 0.4942
 epoch: 21, train_loss: 0.9994, test_loss: 1.1127, test_f1: 0.4382
 epoch: 22, train_loss: 1.0015, test_loss: 1.1055, test_f1: 0.4442
 epoch: 23, train_loss: 0.9868, test_loss: 1.0881, test_f1: 0.4836
 epoch: 24, train_loss: 0.9757, test_loss: 1.0751, test_f1: 0.4624
 epoch: 25, train_loss: 0.9698, test_loss: 1.0677, test_f1: 0.4565
 epoch: 26, train_loss: 0.9748, test_loss: 1.0630, test_f1: 0.4996
 epoch: 27, train_loss: 0.9635, test_loss: 1.0765, test_f1: 0.4612
 epoch: 28, train_loss: 0.9712, test_loss: 1.0704, test_f1: 0.4749
 epoch: 29, train_loss: 0.9486, test_loss: 1.0539, test_f1: 0.4907
 epoch: 30, train_loss: 0.9550, test_loss: 1.0584, test_f1: 0.4946
 epoch: 31, train_loss: 0.9464, test_loss: 1.0527, test_f1: 0.5040
 epoch: 32, train_loss: 0.9399, test_loss: 1.0635, test_f1: 0.4910
 epoch: 33, train_loss: 0.9306, test_loss: 1.0660, test_f1: 0.4972
 epoch: 34, train_loss: 0.9228, test_loss: 1.0796, test_f1: 0.4672
 epoch: 35, train_loss: 0.9242, test_loss: 1.0465, test_f1: 0.5151
 epoch: 36, train_loss: 0.9245, test_loss: 1.0342, test_f1: 0.5427
 epoch: 37, train_loss: 0.9261, test_loss: 1.0130, test_f1: 0.5510
 epoch: 38, train_loss: 0.9249, test_loss: 1.0124, test_f1: 0.5533
 epoch: 39, train_loss: 0.9053, test_loss: 1.0372, test_f1: 0.5749
 epoch: 40, train_loss: 0.9050, test_loss: 1.0604, test_f1: 0.5722
 epoch: 41, train_loss: 0.8992, test_loss: 1.0981, test_f1: 0.5279
 epoch: 42, train_loss: 0.8906, test_loss: 1.0562, test_f1: 0.5246
 epoch: 43, train_loss: 0.8878, test_loss: 1.0887, test_f1: 0.5159
 epoch: 44, train_loss: 0.8963, test_loss: 1.0241, test_f1: 0.5661
 epoch: 45, train_loss: 0.8944, test_loss: 1.0303, test_f1: 0.5679
 epoch: 46, train_loss: 0.8746, test_loss: 0.9908, test_f1: 0.5793
 epoch: 47, train_loss: 0.8811, test_loss: 0.9890, test_f1: 0.5865
 epoch: 48, train_loss: 0.8773, test_loss: 1.0237, test_f1: 0.5795
 epoch: 49, train_loss: 0.8763, test_loss: 1.0387, test_f1: 0.6157
 epoch: 50, train_loss: 0.8744, test_loss: 1.0710, test_f1: 0.5501
 epoch: 51, train_loss: 0.8717, test_loss: 1.0468, test_f1: 0.5714
 epoch: 52, train_loss: 0.8745, test_loss: 1.0835, test_f1: 0.5581
 epoch: 53, train_loss: 0.8767, test_loss: 1.0963, test_f1: 0.5251
 epoch: 54, train_loss: 0.8573, test_loss: 1.0672, test_f1: 0.5578
 epoch: 55, train_loss: 0.8521, test_loss: 1.0332, test_f1: 0.5851
 epoch: 56, train_loss: 0.8372, test_loss: 1.0876, test_f1: 0.5604
 epoch: 57, train_loss: 0.8386, test_loss: 1.0744, test_f1: 0.5797
 epoch: 58, train_loss: 0.8387, test_loss: 1.0579, test_f1: 0.5929
 epoch: 59, train_loss: 0.8546, test_loss: 1.0625, test_f1: 0.5928
 epoch: 60, train_loss: 0.8418, test_loss: 1.0084, test_f1: 0.5808
 epoch: 61, train_loss: 0.8612, test_loss: 1.0024, test_f1: 0.5861
 epoch: 62, train_loss: 0.8604, test_loss: 1.0326, test_f1: 0.5817
 epoch: 63, train_loss: 0.8381, test_loss: 1.0627, test_f1: 0.5492
 epoch: 64, train_loss: 0.8329, test_loss: 1.0307, test_f1: 0.5865
 epoch: 65, train_loss: 0.8312, test_loss: 0.9888, test_f1: 0.5895
 epoch: 66, train_loss: 0.8195, test_loss: 0.9847, test_f1: 0.5856
 epoch: 67, train_loss: 0.8383, test_loss: 1.0094, test_f1: 0.5867
 epoch: 68, train_loss: 0.8154, test_loss: 1.0245, test_f1: 0.6060
 epoch: 69, train_loss: 0.8308, test_loss: 1.0534, test_f1: 0.5876
 epoch: 70, train_loss: 0.8237, test_loss: 1.0608, test_f1: 0.5754
 epoch: 71, train_loss: 0.8108, test_loss: 1.0531, test_f1: 0.5845
 epoch: 72, train_loss: 0.8097, test_loss: 1.0329, test_f1: 0.5899
 epoch: 73, train_loss: 0.8055, test_loss: 1.0633, test_f1: 0.5842
 epoch: 74, train_loss: 0.8072, test_loss: 1.0413, test_f1: 0.5879
 epoch: 75, train_loss: 0.8024, test_loss: 1.0335, test_f1: 0.6019
 epoch: 76, train_loss: 0.7974, test_loss: 1.0588, test_f1: 0.5890
 epoch: 77, train_loss: 0.7961, test_loss: 1.0569, test_f1: 0.5974
 epoch: 78, train_loss: 0.7942, test_loss: 1.0226, test_f1: 0.6001
 epoch: 79, train_loss: 0.7966, test_loss: 1.0112, test_f1: 0.5915
 epoch: 80, train_loss: 0.7901, test_loss: 1.0339, test_f1: 0.5925
 epoch: 81, train_loss: 0.7939, test_loss: 1.0397, test_f1: 0.5934
 epoch: 82, train_loss: 0.7827, test_loss: 1.0623, test_f1: 0.5875
 epoch: 83, train_loss: 0.7845, test_loss: 1.0610, test_f1: 0.5932
 epoch: 84, train_loss: 0.7865, test_loss: 1.0895, test_f1: 0.5798
 epoch: 85, train_loss: 0.7889, test_loss: 1.1223, test_f1: 0.5564
 epoch: 86, train_loss: 0.7837, test_loss: 1.0635, test_f1: 0.6021
 epoch: 87, train_loss: 0.7772, test_loss: 1.0645, test_f1: 0.6151
 epoch: 88, train_loss: 0.7816, test_loss: 1.0580, test_f1: 0.6040
 epoch: 89, train_loss: 0.7706, test_loss: 1.0542, test_f1: 0.6185
 epoch: 90, train_loss: 0.7718, test_loss: 1.0430, test_f1: 0.5987
 epoch: 91, train_loss: 0.7774, test_loss: 1.0324, test_f1: 0.6063
 epoch: 92, train_loss: 0.7784, test_loss: 1.0279, test_f1: 0.6038
 epoch: 93, train_loss: 0.7644, test_loss: 1.0364, test_f1: 0.5992
 epoch: 94, train_loss: 0.7656, test_loss: 1.0955, test_f1: 0.6011
 epoch: 95, train_loss: 0.7627, test_loss: 1.1239, test_f1: 0.6006
 epoch: 96, train_loss: 0.7650, test_loss: 1.0841, test_f1: 0.6033
 epoch: 97, train_loss: 0.7503, test_loss: 1.0808, test_f1: 0.6062
 epoch: 98, train_loss: 0.7588, test_loss: 1.1528, test_f1: 0.6017
 epoch: 99, train_loss: 0.7503, test_loss: 1.1714, test_f1: 0.5972
##################ITERATION #6 ****************************************
 epoch: 0, train_loss: 1.3017, test_loss: 1.3065, test_f1: 0.2281
 epoch: 1, train_loss: 1.2369, test_loss: 1.3050, test_f1: 0.2281
 epoch: 2, train_loss: 1.2216, test_loss: 1.3021, test_f1: 0.2281
 epoch: 3, train_loss: 1.2012, test_loss: 1.2981, test_f1: 0.2281
 epoch: 4, train_loss: 1.1961, test_loss: 1.2860, test_f1: 0.2281
 epoch: 5, train_loss: 1.1766, test_loss: 1.2721, test_f1: 0.2242
 epoch: 6, train_loss: 1.1658, test_loss: 1.2598, test_f1: 0.2601
 epoch: 7, train_loss: 1.1700, test_loss: 1.2485, test_f1: 0.2697
 epoch: 8, train_loss: 1.1496, test_loss: 1.2317, test_f1: 0.2950
 epoch: 9, train_loss: 1.1515, test_loss: 1.2321, test_f1: 0.3441
 epoch: 10, train_loss: 1.1469, test_loss: 1.2344, test_f1: 0.3607
 epoch: 11, train_loss: 1.1265, test_loss: 1.2270, test_f1: 0.3410
 epoch: 12, train_loss: 1.1205, test_loss: 1.2114, test_f1: 0.3647
 epoch: 13, train_loss: 1.1061, test_loss: 1.1813, test_f1: 0.3829
 epoch: 14, train_loss: 1.0941, test_loss: 1.1811, test_f1: 0.4115
 epoch: 15, train_loss: 1.0804, test_loss: 1.2060, test_f1: 0.4419
 epoch: 16, train_loss: 1.0679, test_loss: 1.2118, test_f1: 0.4681
 epoch: 17, train_loss: 1.0604, test_loss: 1.2489, test_f1: 0.5101
 epoch: 18, train_loss: 1.0480, test_loss: 1.2335, test_f1: 0.5417
 epoch: 19, train_loss: 1.0424, test_loss: 1.1897, test_f1: 0.5265
 epoch: 20, train_loss: 1.0342, test_loss: 1.2034, test_f1: 0.5332
 epoch: 21, train_loss: 1.0221, test_loss: 1.2270, test_f1: 0.5136
 epoch: 22, train_loss: 1.0083, test_loss: 1.1656, test_f1: 0.5543
 epoch: 23, train_loss: 1.0099, test_loss: 1.1635, test_f1: 0.5541
 epoch: 24, train_loss: 0.9872, test_loss: 1.1661, test_f1: 0.5283
 epoch: 25, train_loss: 0.9842, test_loss: 1.1772, test_f1: 0.5456
 epoch: 26, train_loss: 0.9764, test_loss: 1.1914, test_f1: 0.5365
 epoch: 27, train_loss: 0.9475, test_loss: 1.1997, test_f1: 0.5200
 epoch: 28, train_loss: 0.9564, test_loss: 1.1847, test_f1: 0.5203
 epoch: 29, train_loss: 0.9441, test_loss: 1.2387, test_f1: 0.5447
 epoch: 30, train_loss: 0.9329, test_loss: 1.1895, test_f1: 0.5405
 epoch: 31, train_loss: 0.9270, test_loss: 1.2332, test_f1: 0.5247
 epoch: 32, train_loss: 0.9090, test_loss: 1.2142, test_f1: 0.5220
 epoch: 33, train_loss: 0.9112, test_loss: 1.2801, test_f1: 0.5154
 epoch: 34, train_loss: 0.9389, test_loss: 1.3462, test_f1: 0.5208
 epoch: 35, train_loss: 0.9160, test_loss: 1.2115, test_f1: 0.5070
 epoch: 36, train_loss: 0.9082, test_loss: 1.1999, test_f1: 0.4932
 epoch: 37, train_loss: 0.8980, test_loss: 1.1535, test_f1: 0.4765
 epoch: 38, train_loss: 0.8940, test_loss: 1.1498, test_f1: 0.5000
 epoch: 39, train_loss: 0.8846, test_loss: 1.1497, test_f1: 0.5357
 epoch: 40, train_loss: 0.8752, test_loss: 1.2263, test_f1: 0.5538
 epoch: 41, train_loss: 0.8999, test_loss: 1.3016, test_f1: 0.5532
 epoch: 42, train_loss: 0.8766, test_loss: 1.3414, test_f1: 0.5436
 epoch: 43, train_loss: 0.8669, test_loss: 1.3021, test_f1: 0.5332
 epoch: 44, train_loss: 0.8638, test_loss: 1.2670, test_f1: 0.5062
 epoch: 45, train_loss: 0.8555, test_loss: 1.2156, test_f1: 0.5177
 epoch: 46, train_loss: 0.8672, test_loss: 1.2341, test_f1: 0.5254
 epoch: 47, train_loss: 0.8621, test_loss: 1.2715, test_f1: 0.4957
 epoch: 48, train_loss: 0.8535, test_loss: 1.1895, test_f1: 0.4754
 epoch: 49, train_loss: 0.8431, test_loss: 1.2327, test_f1: 0.4756
 epoch: 50, train_loss: 0.8415, test_loss: 1.2506, test_f1: 0.4687
 epoch: 51, train_loss: 0.8262, test_loss: 1.2177, test_f1: 0.4819
 epoch: 52, train_loss: 0.8383, test_loss: 1.2127, test_f1: 0.4951
 epoch: 53, train_loss: 0.8166, test_loss: 1.1905, test_f1: 0.5000
 epoch: 54, train_loss: 0.8210, test_loss: 1.2305, test_f1: 0.5029
 epoch: 55, train_loss: 0.8275, test_loss: 1.2498, test_f1: 0.5097
 epoch: 56, train_loss: 0.8120, test_loss: 1.2141, test_f1: 0.5119
 epoch: 57, train_loss: 0.8235, test_loss: 1.2113, test_f1: 0.5131
 epoch: 58, train_loss: 0.8278, test_loss: 1.2651, test_f1: 0.4880
 epoch: 59, train_loss: 0.8166, test_loss: 1.2481, test_f1: 0.4906
 epoch: 60, train_loss: 0.8289, test_loss: 1.2487, test_f1: 0.4950
 epoch: 61, train_loss: 0.8144, test_loss: 1.2325, test_f1: 0.4906
 epoch: 62, train_loss: 0.8103, test_loss: 1.2396, test_f1: 0.4823
 epoch: 63, train_loss: 0.8150, test_loss: 1.2414, test_f1: 0.5036
 epoch: 64, train_loss: 0.8239, test_loss: 1.2836, test_f1: 0.5112
 epoch: 65, train_loss: 0.8103, test_loss: 1.3365, test_f1: 0.5283
 epoch: 66, train_loss: 0.8247, test_loss: 1.2894, test_f1: 0.5177
 epoch: 67, train_loss: 0.8206, test_loss: 1.2475, test_f1: 0.5348
 epoch: 68, train_loss: 0.8107, test_loss: 1.2507, test_f1: 0.5276
 epoch: 69, train_loss: 0.7990, test_loss: 1.2347, test_f1: 0.5271
 epoch: 70, train_loss: 0.8032, test_loss: 1.2720, test_f1: 0.5246
 epoch: 71, train_loss: 0.8117, test_loss: 1.2758, test_f1: 0.5326
 epoch: 72, train_loss: 0.7960, test_loss: 1.3110, test_f1: 0.5089
 epoch: 73, train_loss: 0.7948, test_loss: 1.2680, test_f1: 0.5215
 epoch: 74, train_loss: 0.7982, test_loss: 1.2309, test_f1: 0.5212
 epoch: 75, train_loss: 0.7981, test_loss: 1.1785, test_f1: 0.5384
 epoch: 76, train_loss: 0.8010, test_loss: 1.2277, test_f1: 0.5561
 epoch: 77, train_loss: 0.7901, test_loss: 1.2308, test_f1: 0.5465
 epoch: 78, train_loss: 0.7867, test_loss: 1.3245, test_f1: 0.5367
 epoch: 79, train_loss: 0.7875, test_loss: 1.3461, test_f1: 0.5346
 epoch: 80, train_loss: 0.7803, test_loss: 1.2981, test_f1: 0.5535
 epoch: 81, train_loss: 0.7929, test_loss: 1.3016, test_f1: 0.5560
 epoch: 82, train_loss: 0.8001, test_loss: 1.3367, test_f1: 0.5445
 epoch: 83, train_loss: 0.7915, test_loss: 1.3552, test_f1: 0.5325
 epoch: 84, train_loss: 0.7930, test_loss: 1.3291, test_f1: 0.5205
 epoch: 85, train_loss: 0.7923, test_loss: 1.4195, test_f1: 0.5095
 epoch: 86, train_loss: 0.7859, test_loss: 1.3863, test_f1: 0.5104
 epoch: 87, train_loss: 0.7823, test_loss: 1.3910, test_f1: 0.5149
 epoch: 88, train_loss: 0.7792, test_loss: 1.4438, test_f1: 0.5125
 epoch: 89, train_loss: 0.7771, test_loss: 1.4190, test_f1: 0.5123
 epoch: 90, train_loss: 0.7699, test_loss: 1.3429, test_f1: 0.5336
 epoch: 91, train_loss: 0.7708, test_loss: 1.3822, test_f1: 0.5329
 epoch: 92, train_loss: 0.7613, test_loss: 1.4191, test_f1: 0.5292
 epoch: 93, train_loss: 0.7651, test_loss: 1.3611, test_f1: 0.5220
 epoch: 94, train_loss: 0.7625, test_loss: 1.3771, test_f1: 0.5306
 epoch: 95, train_loss: 0.7639, test_loss: 1.4185, test_f1: 0.5303
 epoch: 96, train_loss: 0.7550, test_loss: 1.3984, test_f1: 0.5392
 epoch: 97, train_loss: 0.7544, test_loss: 1.3715, test_f1: 0.5259
 epoch: 98, train_loss: 0.7513, test_loss: 1.4294, test_f1: 0.5395
 epoch: 99, train_loss: 0.7581, test_loss: 1.4391, test_f1: 0.5528
##################ITERATION #7 ****************************************
 epoch: 0, train_loss: 1.2562, test_loss: 1.3614, test_f1: 0.2341
 epoch: 1, train_loss: 1.1688, test_loss: 1.3196, test_f1: 0.2383
 epoch: 2, train_loss: 1.1423, test_loss: 1.3127, test_f1: 0.2395
 epoch: 3, train_loss: 1.1167, test_loss: 1.2992, test_f1: 0.2575
 epoch: 4, train_loss: 1.0981, test_loss: 1.2724, test_f1: 0.2662
 epoch: 5, train_loss: 1.0905, test_loss: 1.2393, test_f1: 0.3306
 epoch: 6, train_loss: 1.0654, test_loss: 1.2055, test_f1: 0.3855
 epoch: 7, train_loss: 1.0621, test_loss: 1.1646, test_f1: 0.4312
 epoch: 8, train_loss: 1.0635, test_loss: 1.1382, test_f1: 0.4569
 epoch: 9, train_loss: 1.0397, test_loss: 1.1160, test_f1: 0.4934
 epoch: 10, train_loss: 1.0167, test_loss: 1.1271, test_f1: 0.5056
 epoch: 11, train_loss: 1.0137, test_loss: 1.1239, test_f1: 0.4959
 epoch: 12, train_loss: 0.9913, test_loss: 1.1120, test_f1: 0.4940
 epoch: 13, train_loss: 0.9944, test_loss: 1.1051, test_f1: 0.5151
 epoch: 14, train_loss: 0.9748, test_loss: 1.1032, test_f1: 0.5256
 epoch: 15, train_loss: 0.9795, test_loss: 1.0901, test_f1: 0.5352
 epoch: 16, train_loss: 0.9565, test_loss: 1.0830, test_f1: 0.5098
 epoch: 17, train_loss: 0.9413, test_loss: 1.0875, test_f1: 0.5310
 epoch: 18, train_loss: 0.9393, test_loss: 1.0737, test_f1: 0.5289
 epoch: 19, train_loss: 0.9379, test_loss: 1.0698, test_f1: 0.5215
 epoch: 20, train_loss: 0.9311, test_loss: 1.0780, test_f1: 0.5203
 epoch: 21, train_loss: 0.9242, test_loss: 1.0657, test_f1: 0.5340
 epoch: 22, train_loss: 0.9233, test_loss: 1.0688, test_f1: 0.5319
 epoch: 23, train_loss: 0.8991, test_loss: 1.0726, test_f1: 0.5354
 epoch: 24, train_loss: 0.9168, test_loss: 1.0495, test_f1: 0.5403
 epoch: 25, train_loss: 0.8919, test_loss: 1.0518, test_f1: 0.5216
 epoch: 26, train_loss: 0.8924, test_loss: 1.0376, test_f1: 0.5528
 epoch: 27, train_loss: 0.8987, test_loss: 1.0457, test_f1: 0.5599
 epoch: 28, train_loss: 0.8908, test_loss: 1.0450, test_f1: 0.5379
 epoch: 29, train_loss: 0.8722, test_loss: 1.0318, test_f1: 0.5485
 epoch: 30, train_loss: 0.8761, test_loss: 1.0275, test_f1: 0.5371
 epoch: 31, train_loss: 0.8681, test_loss: 1.0448, test_f1: 0.5196
 epoch: 32, train_loss: 0.8649, test_loss: 1.0821, test_f1: 0.5188
 epoch: 33, train_loss: 0.8669, test_loss: 1.0729, test_f1: 0.5248
 epoch: 34, train_loss: 0.8473, test_loss: 1.0556, test_f1: 0.5377
 epoch: 35, train_loss: 0.8380, test_loss: 1.0563, test_f1: 0.5281
 epoch: 36, train_loss: 0.8280, test_loss: 1.0397, test_f1: 0.5312
 epoch: 37, train_loss: 0.8293, test_loss: 1.0346, test_f1: 0.5293
 epoch: 38, train_loss: 0.8217, test_loss: 1.0678, test_f1: 0.5315
 epoch: 39, train_loss: 0.8225, test_loss: 1.0544, test_f1: 0.5320
 epoch: 40, train_loss: 0.8342, test_loss: 1.0385, test_f1: 0.5498
 epoch: 41, train_loss: 0.8286, test_loss: 1.0810, test_f1: 0.5149
 epoch: 42, train_loss: 0.8179, test_loss: 1.0840, test_f1: 0.5205
 epoch: 43, train_loss: 0.8144, test_loss: 1.0734, test_f1: 0.5264
 epoch: 44, train_loss: 0.8234, test_loss: 1.0629, test_f1: 0.5134
 epoch: 45, train_loss: 0.8139, test_loss: 1.0685, test_f1: 0.5443
 epoch: 46, train_loss: 0.8102, test_loss: 1.1370, test_f1: 0.5345
 epoch: 47, train_loss: 0.7928, test_loss: 1.1101, test_f1: 0.5318
 epoch: 48, train_loss: 0.7966, test_loss: 1.0972, test_f1: 0.5391
 epoch: 49, train_loss: 0.7896, test_loss: 1.0928, test_f1: 0.5383
 epoch: 50, train_loss: 0.7892, test_loss: 1.0772, test_f1: 0.5522
 epoch: 51, train_loss: 0.7730, test_loss: 1.0494, test_f1: 0.5550
 epoch: 52, train_loss: 0.7714, test_loss: 1.0791, test_f1: 0.5289
 epoch: 53, train_loss: 0.7734, test_loss: 1.0912, test_f1: 0.5412
 epoch: 54, train_loss: 0.7652, test_loss: 1.0934, test_f1: 0.5516
 epoch: 55, train_loss: 0.7604, test_loss: 1.1085, test_f1: 0.5587
 epoch: 56, train_loss: 0.7647, test_loss: 1.1218, test_f1: 0.5536
 epoch: 57, train_loss: 0.7586, test_loss: 1.1013, test_f1: 0.5690
 epoch: 58, train_loss: 0.7597, test_loss: 1.0993, test_f1: 0.5623
 epoch: 59, train_loss: 0.7571, test_loss: 1.1000, test_f1: 0.5575
 epoch: 60, train_loss: 0.7547, test_loss: 1.0926, test_f1: 0.5657
 epoch: 61, train_loss: 0.7576, test_loss: 1.0879, test_f1: 0.5513
 epoch: 62, train_loss: 0.7576, test_loss: 1.0720, test_f1: 0.5491
 epoch: 63, train_loss: 0.7599, test_loss: 1.0625, test_f1: 0.5627
 epoch: 64, train_loss: 0.7601, test_loss: 1.0808, test_f1: 0.5500
 epoch: 65, train_loss: 0.7741, test_loss: 1.0955, test_f1: 0.5485
 epoch: 66, train_loss: 0.7494, test_loss: 1.1160, test_f1: 0.5426
 epoch: 67, train_loss: 0.7568, test_loss: 1.1145, test_f1: 0.5541
 epoch: 68, train_loss: 0.7528, test_loss: 1.0949, test_f1: 0.5451
 epoch: 69, train_loss: 0.7468, test_loss: 1.1075, test_f1: 0.5542
 epoch: 70, train_loss: 0.7399, test_loss: 1.1438, test_f1: 0.5365
 epoch: 71, train_loss: 0.7392, test_loss: 1.0983, test_f1: 0.5522
 epoch: 72, train_loss: 0.7349, test_loss: 1.1074, test_f1: 0.5464
 epoch: 73, train_loss: 0.7331, test_loss: 1.0954, test_f1: 0.5617
 epoch: 74, train_loss: 0.7448, test_loss: 1.1171, test_f1: 0.5542
 epoch: 75, train_loss: 0.7213, test_loss: 1.1394, test_f1: 0.5531
 epoch: 76, train_loss: 0.7210, test_loss: 1.0788, test_f1: 0.5303
 epoch: 77, train_loss: 0.7271, test_loss: 1.0558, test_f1: 0.5468
 epoch: 78, train_loss: 0.7327, test_loss: 1.0633, test_f1: 0.5572
 epoch: 79, train_loss: 0.7192, test_loss: 1.0866, test_f1: 0.5658
 epoch: 80, train_loss: 0.7218, test_loss: 1.0756, test_f1: 0.5581
 epoch: 81, train_loss: 0.7115, test_loss: 1.0274, test_f1: 0.5636
 epoch: 82, train_loss: 0.7143, test_loss: 1.0640, test_f1: 0.5611
 epoch: 83, train_loss: 0.7182, test_loss: 1.0777, test_f1: 0.5636
 epoch: 84, train_loss: 0.7190, test_loss: 1.0576, test_f1: 0.5497
 epoch: 85, train_loss: 0.7211, test_loss: 1.0535, test_f1: 0.5392
 epoch: 86, train_loss: 0.7172, test_loss: 1.0830, test_f1: 0.5495
 epoch: 87, train_loss: 0.7294, test_loss: 1.0802, test_f1: 0.5517
 epoch: 88, train_loss: 0.7138, test_loss: 1.1197, test_f1: 0.5517
 epoch: 89, train_loss: 0.7133, test_loss: 1.0812, test_f1: 0.5602
 epoch: 90, train_loss: 0.7102, test_loss: 1.0575, test_f1: 0.5941
 epoch: 91, train_loss: 0.7158, test_loss: 1.0504, test_f1: 0.5817
 epoch: 92, train_loss: 0.7155, test_loss: 1.0968, test_f1: 0.5582
 epoch: 93, train_loss: 0.6957, test_loss: 1.0733, test_f1: 0.5663
 epoch: 94, train_loss: 0.7081, test_loss: 1.1507, test_f1: 0.5712
 epoch: 95, train_loss: 0.7068, test_loss: 1.1575, test_f1: 0.5443
 epoch: 96, train_loss: 0.7005, test_loss: 1.0990, test_f1: 0.5491
 epoch: 97, train_loss: 0.7118, test_loss: 1.0940, test_f1: 0.5350
 epoch: 98, train_loss: 0.7112, test_loss: 1.0674, test_f1: 0.5917
 epoch: 99, train_loss: 0.6981, test_loss: 1.0955, test_f1: 0.5870
##################ITERATION #8 ****************************************
 epoch: 0, train_loss: 1.3759, test_loss: 1.3098, test_f1: 0.2281
 epoch: 1, train_loss: 1.2651, test_loss: 1.3014, test_f1: 0.2281
 epoch: 2, train_loss: 1.2362, test_loss: 1.2892, test_f1: 0.2281
 epoch: 3, train_loss: 1.2123, test_loss: 1.2764, test_f1: 0.2281
 epoch: 4, train_loss: 1.1996, test_loss: 1.2599, test_f1: 0.2281
 epoch: 5, train_loss: 1.1861, test_loss: 1.2412, test_f1: 0.2281
 epoch: 6, train_loss: 1.1602, test_loss: 1.2276, test_f1: 0.2285
 epoch: 7, train_loss: 1.1410, test_loss: 1.2067, test_f1: 0.2717
 epoch: 8, train_loss: 1.1304, test_loss: 1.1938, test_f1: 0.3332
 epoch: 9, train_loss: 1.1509, test_loss: 1.1780, test_f1: 0.3981
 epoch: 10, train_loss: 1.1189, test_loss: 1.1675, test_f1: 0.4327
 epoch: 11, train_loss: 1.1084, test_loss: 1.1548, test_f1: 0.4198
 epoch: 12, train_loss: 1.1011, test_loss: 1.1417, test_f1: 0.4326
 epoch: 13, train_loss: 1.0906, test_loss: 1.1241, test_f1: 0.4438
 epoch: 14, train_loss: 1.0687, test_loss: 1.1142, test_f1: 0.5073
 epoch: 15, train_loss: 1.0546, test_loss: 1.1062, test_f1: 0.5012
 epoch: 16, train_loss: 1.0476, test_loss: 1.0919, test_f1: 0.5338
 epoch: 17, train_loss: 1.0378, test_loss: 1.0923, test_f1: 0.4965
 epoch: 18, train_loss: 1.0467, test_loss: 1.0926, test_f1: 0.5040
 epoch: 19, train_loss: 1.0215, test_loss: 1.0789, test_f1: 0.5189
 epoch: 20, train_loss: 1.0138, test_loss: 1.0720, test_f1: 0.5206
 epoch: 21, train_loss: 1.0028, test_loss: 1.0577, test_f1: 0.5344
 epoch: 22, train_loss: 1.0028, test_loss: 1.0553, test_f1: 0.5304
 epoch: 23, train_loss: 0.9997, test_loss: 1.0407, test_f1: 0.5457
 epoch: 24, train_loss: 0.9792, test_loss: 1.0431, test_f1: 0.5437
 epoch: 25, train_loss: 0.9650, test_loss: 1.0454, test_f1: 0.5538
 epoch: 26, train_loss: 0.9696, test_loss: 1.0332, test_f1: 0.5670
 epoch: 27, train_loss: 0.9521, test_loss: 1.0107, test_f1: 0.5807
 epoch: 28, train_loss: 0.9513, test_loss: 1.0095, test_f1: 0.5529
 epoch: 29, train_loss: 0.9326, test_loss: 1.0169, test_f1: 0.5736
 epoch: 30, train_loss: 0.9457, test_loss: 1.0283, test_f1: 0.5653
 epoch: 31, train_loss: 0.9217, test_loss: 1.0255, test_f1: 0.5732
 epoch: 32, train_loss: 0.9150, test_loss: 1.0061, test_f1: 0.5762
 epoch: 33, train_loss: 0.9109, test_loss: 1.0027, test_f1: 0.5970
 epoch: 34, train_loss: 0.9081, test_loss: 1.0034, test_f1: 0.5856
 epoch: 35, train_loss: 0.8976, test_loss: 1.0154, test_f1: 0.5783
 epoch: 36, train_loss: 0.9121, test_loss: 1.0267, test_f1: 0.5576
 epoch: 37, train_loss: 0.8930, test_loss: 1.0347, test_f1: 0.5583
 epoch: 38, train_loss: 0.8764, test_loss: 1.0234, test_f1: 0.5574
 epoch: 39, train_loss: 0.8748, test_loss: 1.0197, test_f1: 0.5276
 epoch: 40, train_loss: 0.8759, test_loss: 0.9967, test_f1: 0.5742
 epoch: 41, train_loss: 0.8746, test_loss: 1.0069, test_f1: 0.5861
 epoch: 42, train_loss: 0.8695, test_loss: 1.0346, test_f1: 0.5610
 epoch: 43, train_loss: 0.8640, test_loss: 1.0565, test_f1: 0.5665
 epoch: 44, train_loss: 0.8656, test_loss: 1.0437, test_f1: 0.5621
 epoch: 45, train_loss: 0.8528, test_loss: 1.0043, test_f1: 0.5683
 epoch: 46, train_loss: 0.8359, test_loss: 0.9746, test_f1: 0.6049
 epoch: 47, train_loss: 0.8377, test_loss: 0.9908, test_f1: 0.5644
 epoch: 48, train_loss: 0.8431, test_loss: 1.0070, test_f1: 0.5587
 epoch: 49, train_loss: 0.8258, test_loss: 0.9877, test_f1: 0.5854
 epoch: 50, train_loss: 0.8222, test_loss: 0.9988, test_f1: 0.5547
 epoch: 51, train_loss: 0.8099, test_loss: 0.9923, test_f1: 0.5725
 epoch: 52, train_loss: 0.8129, test_loss: 0.9976, test_f1: 0.5748
 epoch: 53, train_loss: 0.8253, test_loss: 0.9973, test_f1: 0.5733
 epoch: 54, train_loss: 0.8052, test_loss: 1.0333, test_f1: 0.5334
 epoch: 55, train_loss: 0.8114, test_loss: 1.0291, test_f1: 0.5333
 epoch: 56, train_loss: 0.8071, test_loss: 0.9883, test_f1: 0.5586
 epoch: 57, train_loss: 0.7865, test_loss: 0.9835, test_f1: 0.5773
 epoch: 58, train_loss: 0.7928, test_loss: 0.9796, test_f1: 0.5822
 epoch: 59, train_loss: 0.8119, test_loss: 1.0253, test_f1: 0.5553
 epoch: 60, train_loss: 0.8074, test_loss: 1.0943, test_f1: 0.5227
 epoch: 61, train_loss: 0.8062, test_loss: 1.0658, test_f1: 0.5222
 epoch: 62, train_loss: 0.8002, test_loss: 1.0161, test_f1: 0.5563
 epoch: 63, train_loss: 0.7872, test_loss: 0.9768, test_f1: 0.5611
 epoch: 64, train_loss: 0.7965, test_loss: 0.9604, test_f1: 0.5966
 epoch: 65, train_loss: 0.7780, test_loss: 0.9702, test_f1: 0.5782
 epoch: 66, train_loss: 0.7813, test_loss: 0.9880, test_f1: 0.5452
 epoch: 67, train_loss: 0.7773, test_loss: 1.0037, test_f1: 0.5346
 epoch: 68, train_loss: 0.7870, test_loss: 1.0102, test_f1: 0.5440
 epoch: 69, train_loss: 0.7915, test_loss: 1.0049, test_f1: 0.6000
 epoch: 70, train_loss: 0.7898, test_loss: 1.0123, test_f1: 0.5733
 epoch: 71, train_loss: 0.7822, test_loss: 1.0282, test_f1: 0.5343
 epoch: 72, train_loss: 0.7753, test_loss: 1.0378, test_f1: 0.5238
 epoch: 73, train_loss: 0.7884, test_loss: 1.0021, test_f1: 0.5453
 epoch: 74, train_loss: 0.7782, test_loss: 1.0034, test_f1: 0.5616
 epoch: 75, train_loss: 0.7671, test_loss: 0.9995, test_f1: 0.5588
 epoch: 76, train_loss: 0.7757, test_loss: 0.9952, test_f1: 0.5525
 epoch: 77, train_loss: 0.7682, test_loss: 0.9822, test_f1: 0.5570
 epoch: 78, train_loss: 0.7652, test_loss: 1.0655, test_f1: 0.5092
 epoch: 79, train_loss: 0.7763, test_loss: 1.1532, test_f1: 0.4972
 epoch: 80, train_loss: 0.7562, test_loss: 1.0911, test_f1: 0.5164
 epoch: 81, train_loss: 0.7743, test_loss: 0.9997, test_f1: 0.5625
 epoch: 82, train_loss: 0.7622, test_loss: 0.9853, test_f1: 0.5581
 epoch: 83, train_loss: 0.7606, test_loss: 0.9982, test_f1: 0.5560
 epoch: 84, train_loss: 0.7608, test_loss: 0.9965, test_f1: 0.5816
 epoch: 85, train_loss: 0.7723, test_loss: 1.0033, test_f1: 0.5947
 epoch: 86, train_loss: 0.7511, test_loss: 1.0710, test_f1: 0.5377
 epoch: 87, train_loss: 0.7534, test_loss: 1.0512, test_f1: 0.5495
 epoch: 88, train_loss: 0.7470, test_loss: 1.0584, test_f1: 0.5416
 epoch: 89, train_loss: 0.7618, test_loss: 1.0969, test_f1: 0.5244
 epoch: 90, train_loss: 0.7639, test_loss: 1.0162, test_f1: 0.5367
 epoch: 91, train_loss: 0.7378, test_loss: 0.9885, test_f1: 0.5574
 epoch: 92, train_loss: 0.7394, test_loss: 0.9859, test_f1: 0.5618
 epoch: 93, train_loss: 0.7487, test_loss: 0.9741, test_f1: 0.6077
 epoch: 94, train_loss: 0.7398, test_loss: 0.9859, test_f1: 0.5810
 epoch: 95, train_loss: 0.7438, test_loss: 1.0468, test_f1: 0.5587
 epoch: 96, train_loss: 0.7436, test_loss: 1.0948, test_f1: 0.5398
 epoch: 97, train_loss: 0.7429, test_loss: 1.1321, test_f1: 0.5371
 epoch: 98, train_loss: 0.7355, test_loss: 1.1026, test_f1: 0.5356
 epoch: 99, train_loss: 0.7307, test_loss: 1.0453, test_f1: 0.5464
##################ITERATION #9 ****************************************
 epoch: 0, train_loss: 1.5189, test_loss: 1.3497, test_f1: 0.2281
 epoch: 1, train_loss: 1.3284, test_loss: 1.3150, test_f1: 0.2281
 epoch: 2, train_loss: 1.2618, test_loss: 1.3167, test_f1: 0.2281
 epoch: 3, train_loss: 1.2188, test_loss: 1.3178, test_f1: 0.2248
 epoch: 4, train_loss: 1.2077, test_loss: 1.3170, test_f1: 0.2281
 epoch: 5, train_loss: 1.1694, test_loss: 1.3262, test_f1: 0.2281
 epoch: 6, train_loss: 1.1499, test_loss: 1.3407, test_f1: 0.2285
 epoch: 7, train_loss: 1.1276, test_loss: 1.2905, test_f1: 0.2571
 epoch: 8, train_loss: 1.1160, test_loss: 1.2561, test_f1: 0.2951
 epoch: 9, train_loss: 1.1073, test_loss: 1.2417, test_f1: 0.3350
 epoch: 10, train_loss: 1.0941, test_loss: 1.2374, test_f1: 0.3745
 epoch: 11, train_loss: 1.0801, test_loss: 1.2464, test_f1: 0.3725
 epoch: 12, train_loss: 1.0746, test_loss: 1.2185, test_f1: 0.3623
 epoch: 13, train_loss: 1.0662, test_loss: 1.1922, test_f1: 0.3809
 epoch: 14, train_loss: 1.0693, test_loss: 1.1837, test_f1: 0.3876
 epoch: 15, train_loss: 1.0376, test_loss: 1.2255, test_f1: 0.3973
 epoch: 16, train_loss: 1.0463, test_loss: 1.3173, test_f1: 0.3767
 epoch: 17, train_loss: 1.0355, test_loss: 1.2532, test_f1: 0.3971
 epoch: 18, train_loss: 1.0371, test_loss: 1.1461, test_f1: 0.4191
 epoch: 19, train_loss: 1.0200, test_loss: 1.1623, test_f1: 0.4046
 epoch: 20, train_loss: 1.0231, test_loss: 1.4538, test_f1: 0.3942
 epoch: 21, train_loss: 1.0281, test_loss: 1.1769, test_f1: 0.4199
 epoch: 22, train_loss: 0.9928, test_loss: 1.1693, test_f1: 0.4736
 epoch: 23, train_loss: 1.0145, test_loss: 1.1640, test_f1: 0.4270
 epoch: 24, train_loss: 1.0137, test_loss: 1.2025, test_f1: 0.4242
 epoch: 25, train_loss: 1.0031, test_loss: 1.1684, test_f1: 0.4186
 epoch: 26, train_loss: 0.9861, test_loss: 1.1389, test_f1: 0.4234
 epoch: 27, train_loss: 0.9755, test_loss: 1.1341, test_f1: 0.4266
 epoch: 28, train_loss: 0.9863, test_loss: 1.1862, test_f1: 0.4514
 epoch: 29, train_loss: 0.9800, test_loss: 1.1401, test_f1: 0.4726
 epoch: 30, train_loss: 0.9740, test_loss: 1.1372, test_f1: 0.4697
 epoch: 31, train_loss: 0.9795, test_loss: 1.2188, test_f1: 0.4626
 epoch: 32, train_loss: 0.9465, test_loss: 1.2703, test_f1: 0.4349
 epoch: 33, train_loss: 0.9861, test_loss: 1.1452, test_f1: 0.4701
 epoch: 34, train_loss: 0.9623, test_loss: 1.1997, test_f1: 0.4594
 epoch: 35, train_loss: 0.9646, test_loss: 1.4315, test_f1: 0.4491
 epoch: 36, train_loss: 0.9484, test_loss: 1.1634, test_f1: 0.4515
 epoch: 37, train_loss: 0.9826, test_loss: 1.1518, test_f1: 0.4618
 epoch: 38, train_loss: 0.9592, test_loss: 1.1202, test_f1: 0.4893
 epoch: 39, train_loss: 0.9610, test_loss: 1.1264, test_f1: 0.4837
 epoch: 40, train_loss: 0.9471, test_loss: 1.1284, test_f1: 0.4833
 epoch: 41, train_loss: 0.9557, test_loss: 1.1217, test_f1: 0.4609
 epoch: 42, train_loss: 0.9462, test_loss: 1.1089, test_f1: 0.4730
 epoch: 43, train_loss: 0.9360, test_loss: 1.1061, test_f1: 0.5042
 epoch: 44, train_loss: 0.9426, test_loss: 1.0772, test_f1: 0.5208
 epoch: 45, train_loss: 0.9276, test_loss: 1.0632, test_f1: 0.5229
 epoch: 46, train_loss: 0.9373, test_loss: 1.0885, test_f1: 0.4787
 epoch: 47, train_loss: 0.9203, test_loss: 1.0972, test_f1: 0.4987
 epoch: 48, train_loss: 0.9155, test_loss: 1.0379, test_f1: 0.5314
 epoch: 49, train_loss: 0.9297, test_loss: 1.0324, test_f1: 0.5183
 epoch: 50, train_loss: 0.9203, test_loss: 1.1251, test_f1: 0.4666
 epoch: 51, train_loss: 0.9028, test_loss: 1.1454, test_f1: 0.5136
 epoch: 52, train_loss: 0.9018, test_loss: 1.2023, test_f1: 0.4722
 epoch: 53, train_loss: 0.9073, test_loss: 1.1708, test_f1: 0.4854
 epoch: 54, train_loss: 0.8925, test_loss: 1.1496, test_f1: 0.5078
 epoch: 55, train_loss: 0.8858, test_loss: 1.1516, test_f1: 0.4897
 epoch: 56, train_loss: 0.8994, test_loss: 1.1274, test_f1: 0.5156
 epoch: 57, train_loss: 0.8790, test_loss: 1.1143, test_f1: 0.5104
 epoch: 58, train_loss: 0.9070, test_loss: 1.1419, test_f1: 0.5154
 epoch: 59, train_loss: 0.8840, test_loss: 1.1060, test_f1: 0.5113
 epoch: 60, train_loss: 0.8915, test_loss: 1.1579, test_f1: 0.5090
 epoch: 61, train_loss: 0.8950, test_loss: 1.1204, test_f1: 0.5347
 epoch: 62, train_loss: 0.8804, test_loss: 1.1196, test_f1: 0.5486
 epoch: 63, train_loss: 0.8679, test_loss: 1.0867, test_f1: 0.5366
 epoch: 64, train_loss: 0.8774, test_loss: 1.0809, test_f1: 0.5447
 epoch: 65, train_loss: 0.8707, test_loss: 1.0822, test_f1: 0.5211
 epoch: 66, train_loss: 0.8787, test_loss: 1.0696, test_f1: 0.5027
 epoch: 67, train_loss: 0.8751, test_loss: 1.0613, test_f1: 0.5194
 epoch: 68, train_loss: 0.8788, test_loss: 1.1200, test_f1: 0.5296
 epoch: 69, train_loss: 0.8660, test_loss: 1.1326, test_f1: 0.5157
 epoch: 70, train_loss: 0.8646, test_loss: 1.1513, test_f1: 0.4955
 epoch: 71, train_loss: 0.8749, test_loss: 1.1363, test_f1: 0.5441
 epoch: 72, train_loss: 0.8651, test_loss: 1.1132, test_f1: 0.5405
 epoch: 73, train_loss: 0.8543, test_loss: 1.1197, test_f1: 0.5287
 epoch: 74, train_loss: 0.8595, test_loss: 1.1421, test_f1: 0.5319
 epoch: 75, train_loss: 0.8649, test_loss: 1.3811, test_f1: 0.5247
 epoch: 76, train_loss: 0.8672, test_loss: 1.3558, test_f1: 0.5229
 epoch: 77, train_loss: 0.8606, test_loss: 1.1585, test_f1: 0.5362
 epoch: 78, train_loss: 0.8606, test_loss: 1.0903, test_f1: 0.5425
 epoch: 79, train_loss: 0.8711, test_loss: 1.1077, test_f1: 0.5182
 epoch: 80, train_loss: 0.8528, test_loss: 1.1351, test_f1: 0.5328
 epoch: 81, train_loss: 0.8448, test_loss: 1.1247, test_f1: 0.5367
 epoch: 82, train_loss: 0.8464, test_loss: 1.1139, test_f1: 0.5311
 epoch: 83, train_loss: 0.8228, test_loss: 1.1037, test_f1: 0.5244
 epoch: 84, train_loss: 0.8380, test_loss: 1.0858, test_f1: 0.5206
 epoch: 85, train_loss: 0.8353, test_loss: 1.0969, test_f1: 0.5220
 epoch: 86, train_loss: 0.8382, test_loss: 1.1779, test_f1: 0.5020
 epoch: 87, train_loss: 0.8377, test_loss: 1.1246, test_f1: 0.5333
 epoch: 88, train_loss: 0.8398, test_loss: 1.1991, test_f1: 0.5325
 epoch: 89, train_loss: 0.8492, test_loss: 1.2475, test_f1: 0.5144
 epoch: 90, train_loss: 0.8588, test_loss: 1.1943, test_f1: 0.5038
 epoch: 91, train_loss: 0.8629, test_loss: 1.2166, test_f1: 0.5240
 epoch: 92, train_loss: 0.8409, test_loss: 1.2349, test_f1: 0.5302
 epoch: 93, train_loss: 0.8407, test_loss: 1.2097, test_f1: 0.5239
 epoch: 94, train_loss: 0.8285, test_loss: 1.2082, test_f1: 0.5204
 epoch: 95, train_loss: 0.8240, test_loss: 1.2754, test_f1: 0.5021
 epoch: 96, train_loss: 0.8450, test_loss: 1.1535, test_f1: 0.5078
 epoch: 97, train_loss: 0.8318, test_loss: 1.1216, test_f1: 0.4976
 epoch: 98, train_loss: 0.8266, test_loss: 1.1308, test_f1: 0.5400
 epoch: 99, train_loss: 0.8299, test_loss: 1.1628, test_f1: 0.5262

Training completed in 413.35 seconds
Best F1: 0.6185 at epoch 89
Mean F1 across iterations: 0.5792  0.0227
========================FINAL RESULTS================================
FEGIN weighted F1: 0.6185  0.0227
python main.py --data ltspice_demos --representation component_pin --model FEGIN --layers 5 --hiddens 16 --batch_size 256 --lr 0.001 --emb_size 128 --epochs 100 --save_appendix component_pin_L5_H16_BS256_LR0.001_E128 --no_val
-----



STDERR:
  File "main.py", line 370, in <module>
    main()
  File "main.py", line 254, in main
    dataset = dataset_class(
  File "/home/philip/projects/ltspice_examples_code_repo/Circuit-Completion-Using-GNNs/component_classification_with_link_prediction_head/evaluation/FEGIN/kernel/circuit_datasets.py", line 15, in __init__
    self.data, self.slices = torch.load(self.processed_paths[0])
  File "/home/philip/.local/lib/python3.8/site-packages/torch/serialization.py", line 1040, in load
    warnings.warn(
  File "/usr/lib/python3.8/warnings.py", line 109, in _showwarnmsg
    sw(msg.message, msg.category, msg.filename, msg.lineno,
  File "main.py", line 47, in warn_with_traceback
    traceback.print_stack(file=log)
/home/philip/projects/ltspice_examples_code_repo/Circuit-Completion-Using-GNNs/component_classification_with_link_prediction_head/evaluation/FEGIN/kernel/circuit_datasets.py:15: FutureWarning: You are using `torch.load` with `weights_only=False` (the current default value), which uses the default pickle module implicitly. It is possible to construct malicious pickle data which will execute arbitrary code during unpickling (See https://github.com/pytorch/pytorch/blob/main/SECURITY.md#untrusted-models for more details). In a future release, the default value for `weights_only` will be flipped to `True`. This limits the functions that could be executed during unpickling. Arbitrary objects will no longer be allowed to be loaded via this mode unless they are explicitly allowlisted by the user via `torch.serialization.add_safe_globals`. We recommend you start setting `weights_only=True` for any use case where you don't have full control of the loaded file. Please open an issue on GitHub for any issues related to this experimental feature.
  self.data, self.slices = torch.load(self.processed_paths[0])
