STDOUT:
Results will be saved in /home/philip/projects/ltspice_examples_code_repo/Circuit-Completion-Using-GNNs/component_classification_with_link_prediction_head/evaluation/FEGIN/results/model_FEGIN_dataset_ltspice_demos
Command line input: python main.py --data ltspice_demos --representation component_net --model FEGIN --layers 4 --hiddens 128 --batch_size 256 --lr 0.001 --emb_size 128 --epochs 100 --save_appendix component_net_L4_H128_BS256_LR0.001_E128 --no_val
 is saved.
-----
ltspice_demos - FEGIN
Using 4 layers, 128 hidden units, h = 2
Loading component_net representation dataset
ENTERED
Training FEGIN on component_net representation
Train: 1565, Test: 383
##################ITERATION #0 ****************************************
 epoch: 0, train_loss: 1.3093, test_loss: 1.3490, test_f1: 0.2281
 epoch: 1, train_loss: 1.1645, test_loss: 1.3259, test_f1: 0.2281
 epoch: 2, train_loss: 1.1188, test_loss: 1.3117, test_f1: 0.2583
 epoch: 3, train_loss: 1.0931, test_loss: 1.2805, test_f1: 0.2281
 epoch: 4, train_loss: 1.0865, test_loss: 1.2301, test_f1: 0.2956
 epoch: 5, train_loss: 1.0606, test_loss: 1.1708, test_f1: 0.4291
 epoch: 6, train_loss: 1.0434, test_loss: 1.1694, test_f1: 0.4199
 epoch: 7, train_loss: 1.0113, test_loss: 1.1241, test_f1: 0.4439
 epoch: 8, train_loss: 0.9803, test_loss: 1.0662, test_f1: 0.5313
 epoch: 9, train_loss: 0.9461, test_loss: 1.0896, test_f1: 0.5212
 epoch: 10, train_loss: 0.9101, test_loss: 1.0424, test_f1: 0.5229
 epoch: 11, train_loss: 0.8968, test_loss: 1.1220, test_f1: 0.5480
 epoch: 12, train_loss: 0.8815, test_loss: 1.0782, test_f1: 0.4865
 epoch: 13, train_loss: 0.8537, test_loss: 1.0792, test_f1: 0.5515
 epoch: 14, train_loss: 0.8436, test_loss: 1.1547, test_f1: 0.5636
 epoch: 15, train_loss: 0.8517, test_loss: 1.0836, test_f1: 0.5834
 epoch: 16, train_loss: 0.8245, test_loss: 1.1239, test_f1: 0.6154
 epoch: 17, train_loss: 0.8052, test_loss: 1.0689, test_f1: 0.5808
 epoch: 18, train_loss: 0.8233, test_loss: 1.1111, test_f1: 0.5728
 epoch: 19, train_loss: 0.8119, test_loss: 1.1087, test_f1: 0.5691
 epoch: 20, train_loss: 0.8086, test_loss: 1.2603, test_f1: 0.5511
 epoch: 21, train_loss: 0.7966, test_loss: 1.1623, test_f1: 0.5705
 epoch: 22, train_loss: 0.7770, test_loss: 1.0612, test_f1: 0.5931
 epoch: 23, train_loss: 0.7525, test_loss: 1.1605, test_f1: 0.5482
 epoch: 24, train_loss: 0.7547, test_loss: 1.0989, test_f1: 0.5994
 epoch: 25, train_loss: 0.7717, test_loss: 1.1336, test_f1: 0.5728
 epoch: 26, train_loss: 0.7600, test_loss: 1.1378, test_f1: 0.5843
 epoch: 27, train_loss: 0.7255, test_loss: 1.1430, test_f1: 0.5702
 epoch: 28, train_loss: 0.7138, test_loss: 1.2042, test_f1: 0.6034
 epoch: 29, train_loss: 0.7298, test_loss: 1.1970, test_f1: 0.5416
 epoch: 30, train_loss: 0.7239, test_loss: 1.2935, test_f1: 0.5827
 epoch: 31, train_loss: 0.7236, test_loss: 1.3147, test_f1: 0.5745
 epoch: 32, train_loss: 0.6984, test_loss: 1.2765, test_f1: 0.5708
 epoch: 33, train_loss: 0.6835, test_loss: 1.3093, test_f1: 0.5971
 epoch: 34, train_loss: 0.6917, test_loss: 1.2975, test_f1: 0.5930
 epoch: 35, train_loss: 0.6477, test_loss: 1.2448, test_f1: 0.5938
 epoch: 36, train_loss: 0.6327, test_loss: 1.2867, test_f1: 0.5994
 epoch: 37, train_loss: 0.6532, test_loss: 1.3436, test_f1: 0.6154
 epoch: 38, train_loss: 0.6180, test_loss: 1.4185, test_f1: 0.5799
 epoch: 39, train_loss: 0.6539, test_loss: 1.4152, test_f1: 0.6077
 epoch: 40, train_loss: 0.6377, test_loss: 1.4731, test_f1: 0.5911
 epoch: 41, train_loss: 0.6241, test_loss: 1.5378, test_f1: 0.5753
 epoch: 42, train_loss: 0.6189, test_loss: 1.5052, test_f1: 0.5844
 epoch: 43, train_loss: 0.5991, test_loss: 1.5362, test_f1: 0.6069
 epoch: 44, train_loss: 0.5997, test_loss: 1.5189, test_f1: 0.5655
 epoch: 45, train_loss: 0.5617, test_loss: 1.5166, test_f1: 0.5920
 epoch: 46, train_loss: 0.5832, test_loss: 1.4446, test_f1: 0.5654
 epoch: 47, train_loss: 0.5906, test_loss: 1.4423, test_f1: 0.5882
 epoch: 48, train_loss: 0.5740, test_loss: 1.5485, test_f1: 0.5876
 epoch: 49, train_loss: 0.5813, test_loss: 1.6458, test_f1: 0.5831
 epoch: 50, train_loss: 0.5988, test_loss: 1.5169, test_f1: 0.5610
 epoch: 51, train_loss: 0.5444, test_loss: 1.6753, test_f1: 0.5482
 epoch: 52, train_loss: 0.5391, test_loss: 1.7131, test_f1: 0.5510
 epoch: 53, train_loss: 0.5153, test_loss: 1.6066, test_f1: 0.5620
 epoch: 54, train_loss: 0.5069, test_loss: 1.5767, test_f1: 0.5864
 epoch: 55, train_loss: 0.4930, test_loss: 1.6122, test_f1: 0.5767
 epoch: 56, train_loss: 0.4640, test_loss: 1.6367, test_f1: 0.6075
 epoch: 57, train_loss: 0.4679, test_loss: 1.7905, test_f1: 0.5970
 epoch: 58, train_loss: 0.4492, test_loss: 1.9938, test_f1: 0.5809
 epoch: 59, train_loss: 0.4731, test_loss: 2.1790, test_f1: 0.5570
 epoch: 60, train_loss: 0.4821, test_loss: 2.1110, test_f1: 0.5735
 epoch: 61, train_loss: 0.4551, test_loss: 2.1247, test_f1: 0.5979
 epoch: 62, train_loss: 0.4341, test_loss: 2.0922, test_f1: 0.5421
 epoch: 63, train_loss: 0.4352, test_loss: 1.7919, test_f1: 0.5858
 epoch: 64, train_loss: 0.4081, test_loss: 1.7684, test_f1: 0.5692
 epoch: 65, train_loss: 0.4144, test_loss: 1.9833, test_f1: 0.5466
 epoch: 66, train_loss: 0.4080, test_loss: 1.9599, test_f1: 0.5518
 epoch: 67, train_loss: 0.4165, test_loss: 2.0723, test_f1: 0.5897
 epoch: 68, train_loss: 0.4189, test_loss: 2.1254, test_f1: 0.5682
 epoch: 69, train_loss: 0.3988, test_loss: 2.1036, test_f1: 0.5738
 epoch: 70, train_loss: 0.3730, test_loss: 2.1729, test_f1: 0.5711
 epoch: 71, train_loss: 0.3802, test_loss: 2.2213, test_f1: 0.5933
 epoch: 72, train_loss: 0.3594, test_loss: 2.1953, test_f1: 0.5864
 epoch: 73, train_loss: 0.3531, test_loss: 2.2657, test_f1: 0.5978
 epoch: 74, train_loss: 0.3556, test_loss: 2.3447, test_f1: 0.6186
 epoch: 75, train_loss: 0.3563, test_loss: 2.4953, test_f1: 0.5917
 epoch: 76, train_loss: 0.3636, test_loss: 2.6747, test_f1: 0.5753
 epoch: 77, train_loss: 0.3705, test_loss: 2.3150, test_f1: 0.5815
 epoch: 78, train_loss: 0.3416, test_loss: 2.1930, test_f1: 0.5842
 epoch: 79, train_loss: 0.3325, test_loss: 2.2447, test_f1: 0.6022
 epoch: 80, train_loss: 0.3003, test_loss: 2.3718, test_f1: 0.5967
 epoch: 81, train_loss: 0.3295, test_loss: 2.3697, test_f1: 0.5936
 epoch: 82, train_loss: 0.3164, test_loss: 2.5764, test_f1: 0.5790
 epoch: 83, train_loss: 0.3232, test_loss: 2.3854, test_f1: 0.5976
 epoch: 84, train_loss: 0.3228, test_loss: 2.3689, test_f1: 0.6014
 epoch: 85, train_loss: 0.3263, test_loss: 2.5003, test_f1: 0.5718
 epoch: 86, train_loss: 0.3117, test_loss: 2.4985, test_f1: 0.5775
 epoch: 87, train_loss: 0.3315, test_loss: 2.5330, test_f1: 0.5633
 epoch: 88, train_loss: 0.3162, test_loss: 2.5684, test_f1: 0.5903
 epoch: 89, train_loss: 0.2841, test_loss: 2.4618, test_f1: 0.5788
 epoch: 90, train_loss: 0.2962, test_loss: 2.4902, test_f1: 0.5579
 epoch: 91, train_loss: 0.3035, test_loss: 2.2534, test_f1: 0.5649
 epoch: 92, train_loss: 0.2926, test_loss: 2.3096, test_f1: 0.5885
 epoch: 93, train_loss: 0.2965, test_loss: 2.3185, test_f1: 0.6311
 epoch: 94, train_loss: 0.2948, test_loss: 2.3925, test_f1: 0.6212
 epoch: 95, train_loss: 0.3066, test_loss: 2.4262, test_f1: 0.5720
 epoch: 96, train_loss: 0.3102, test_loss: 2.5819, test_f1: 0.5831
 epoch: 97, train_loss: 0.3021, test_loss: 2.6740, test_f1: 0.5962
 epoch: 98, train_loss: 0.3170, test_loss: 2.5406, test_f1: 0.6087
 epoch: 99, train_loss: 0.2956, test_loss: 2.4260, test_f1: 0.6064
##################ITERATION #1 ****************************************
 epoch: 0, train_loss: 1.2225, test_loss: 1.3052, test_f1: 0.2720
 epoch: 1, train_loss: 1.0811, test_loss: 1.3057, test_f1: 0.3232
 epoch: 2, train_loss: 1.0290, test_loss: 1.2880, test_f1: 0.3893
 epoch: 3, train_loss: 0.9897, test_loss: 1.2651, test_f1: 0.3783
 epoch: 4, train_loss: 0.9559, test_loss: 1.2326, test_f1: 0.3195
 epoch: 5, train_loss: 0.9238, test_loss: 1.1615, test_f1: 0.3077
 epoch: 6, train_loss: 0.9093, test_loss: 1.1585, test_f1: 0.3543
 epoch: 7, train_loss: 0.8713, test_loss: 1.1401, test_f1: 0.3986
 epoch: 8, train_loss: 0.8590, test_loss: 1.1294, test_f1: 0.4529
 epoch: 9, train_loss: 0.8644, test_loss: 1.2295, test_f1: 0.4600
 epoch: 10, train_loss: 0.8328, test_loss: 1.1846, test_f1: 0.5137
 epoch: 11, train_loss: 0.8288, test_loss: 1.1039, test_f1: 0.5562
 epoch: 12, train_loss: 0.8207, test_loss: 1.1018, test_f1: 0.5612
 epoch: 13, train_loss: 0.8046, test_loss: 1.0779, test_f1: 0.5634
 epoch: 14, train_loss: 0.8112, test_loss: 1.0760, test_f1: 0.5549
 epoch: 15, train_loss: 0.7775, test_loss: 1.0378, test_f1: 0.5901
 epoch: 16, train_loss: 0.7689, test_loss: 1.0527, test_f1: 0.5803
 epoch: 17, train_loss: 0.7548, test_loss: 1.0001, test_f1: 0.6043
 epoch: 18, train_loss: 0.7363, test_loss: 1.0448, test_f1: 0.6026
 epoch: 19, train_loss: 0.7448, test_loss: 1.1661, test_f1: 0.5720
 epoch: 20, train_loss: 0.7160, test_loss: 1.2021, test_f1: 0.5630
 epoch: 21, train_loss: 0.7012, test_loss: 1.3423, test_f1: 0.5626
 epoch: 22, train_loss: 0.7037, test_loss: 1.1856, test_f1: 0.5875
 epoch: 23, train_loss: 0.7017, test_loss: 1.1820, test_f1: 0.6158
 epoch: 24, train_loss: 0.6897, test_loss: 1.2392, test_f1: 0.5861
 epoch: 25, train_loss: 0.6733, test_loss: 1.2714, test_f1: 0.6213
 epoch: 26, train_loss: 0.6784, test_loss: 1.2861, test_f1: 0.5822
 epoch: 27, train_loss: 0.6494, test_loss: 1.4248, test_f1: 0.5567
 epoch: 28, train_loss: 0.6658, test_loss: 1.4189, test_f1: 0.5740
 epoch: 29, train_loss: 0.6589, test_loss: 1.3929, test_f1: 0.5677
 epoch: 30, train_loss: 0.6085, test_loss: 1.5131, test_f1: 0.5950
 epoch: 31, train_loss: 0.6037, test_loss: 1.4155, test_f1: 0.6041
 epoch: 32, train_loss: 0.5883, test_loss: 1.6728, test_f1: 0.5460
 epoch: 33, train_loss: 0.6160, test_loss: 1.4432, test_f1: 0.5845
 epoch: 34, train_loss: 0.6041, test_loss: 1.2934, test_f1: 0.5955
 epoch: 35, train_loss: 0.5711, test_loss: 1.3411, test_f1: 0.5893
 epoch: 36, train_loss: 0.5522, test_loss: 1.4159, test_f1: 0.5864
 epoch: 37, train_loss: 0.5359, test_loss: 1.4948, test_f1: 0.5907
 epoch: 38, train_loss: 0.5857, test_loss: 1.6804, test_f1: 0.5487
 epoch: 39, train_loss: 0.5846, test_loss: 2.0199, test_f1: 0.5365
 epoch: 40, train_loss: 0.5797, test_loss: 1.7105, test_f1: 0.5543
 epoch: 41, train_loss: 0.5814, test_loss: 1.7668, test_f1: 0.5663
 epoch: 42, train_loss: 0.5425, test_loss: 1.5562, test_f1: 0.6168
 epoch: 43, train_loss: 0.5236, test_loss: 1.9442, test_f1: 0.5610
 epoch: 44, train_loss: 0.5194, test_loss: 1.6937, test_f1: 0.5614
 epoch: 45, train_loss: 0.4801, test_loss: 1.7984, test_f1: 0.5779
 epoch: 46, train_loss: 0.4830, test_loss: 1.7759, test_f1: 0.6043
 epoch: 47, train_loss: 0.4556, test_loss: 1.7646, test_f1: 0.5863
 epoch: 48, train_loss: 0.4523, test_loss: 1.6890, test_f1: 0.5853
 epoch: 49, train_loss: 0.4449, test_loss: 1.8205, test_f1: 0.5734
 epoch: 50, train_loss: 0.4487, test_loss: 1.8074, test_f1: 0.6075
 epoch: 51, train_loss: 0.4356, test_loss: 1.8166, test_f1: 0.5980
 epoch: 52, train_loss: 0.4328, test_loss: 1.8645, test_f1: 0.5936
 epoch: 53, train_loss: 0.4037, test_loss: 1.9443, test_f1: 0.6119
 epoch: 54, train_loss: 0.3972, test_loss: 1.9257, test_f1: 0.6093
 epoch: 55, train_loss: 0.3999, test_loss: 2.1026, test_f1: 0.5513
 epoch: 56, train_loss: 0.4053, test_loss: 2.1415, test_f1: 0.5442
 epoch: 57, train_loss: 0.3836, test_loss: 1.9707, test_f1: 0.6203
 epoch: 58, train_loss: 0.3730, test_loss: 1.9336, test_f1: 0.5898
 epoch: 59, train_loss: 0.3763, test_loss: 1.8200, test_f1: 0.6160
 epoch: 60, train_loss: 0.3580, test_loss: 1.8533, test_f1: 0.5834
 epoch: 61, train_loss: 0.3406, test_loss: 1.8489, test_f1: 0.6113
 epoch: 62, train_loss: 0.3060, test_loss: 2.0085, test_f1: 0.5901
 epoch: 63, train_loss: 0.3286, test_loss: 2.0632, test_f1: 0.6102
 epoch: 64, train_loss: 0.3320, test_loss: 1.9697, test_f1: 0.5814
 epoch: 65, train_loss: 0.3145, test_loss: 2.0786, test_f1: 0.6095
 epoch: 66, train_loss: 0.3219, test_loss: 2.1316, test_f1: 0.5630
 epoch: 67, train_loss: 0.3222, test_loss: 1.8212, test_f1: 0.6463
 epoch: 68, train_loss: 0.3273, test_loss: 1.9235, test_f1: 0.5901
 epoch: 69, train_loss: 0.3250, test_loss: 2.0999, test_f1: 0.5590
 epoch: 70, train_loss: 0.3108, test_loss: 1.9244, test_f1: 0.6270
 epoch: 71, train_loss: 0.3185, test_loss: 1.9413, test_f1: 0.5859
 epoch: 72, train_loss: 0.3215, test_loss: 2.3323, test_f1: 0.5784
 epoch: 73, train_loss: 0.2945, test_loss: 2.4879, test_f1: 0.5745
 epoch: 74, train_loss: 0.3017, test_loss: 2.2313, test_f1: 0.5824
 epoch: 75, train_loss: 0.2901, test_loss: 2.3298, test_f1: 0.5647
 epoch: 76, train_loss: 0.2760, test_loss: 2.3466, test_f1: 0.5562
 epoch: 77, train_loss: 0.2684, test_loss: 2.1884, test_f1: 0.5785
 epoch: 78, train_loss: 0.2675, test_loss: 2.2518, test_f1: 0.5782
 epoch: 79, train_loss: 0.2764, test_loss: 2.1802, test_f1: 0.5937
 epoch: 80, train_loss: 0.3279, test_loss: 2.2618, test_f1: 0.5642
 epoch: 81, train_loss: 0.3377, test_loss: 2.3411, test_f1: 0.6086
 epoch: 82, train_loss: 0.3437, test_loss: 2.3616, test_f1: 0.5989
 epoch: 83, train_loss: 0.3209, test_loss: 2.5276, test_f1: 0.5726
 epoch: 84, train_loss: 0.3189, test_loss: 2.5072, test_f1: 0.5757
 epoch: 85, train_loss: 0.2936, test_loss: 2.3718, test_f1: 0.5704
 epoch: 86, train_loss: 0.2871, test_loss: 2.2097, test_f1: 0.5791
 epoch: 87, train_loss: 0.3031, test_loss: 2.1634, test_f1: 0.6084
 epoch: 88, train_loss: 0.3058, test_loss: 2.3142, test_f1: 0.6191
 epoch: 89, train_loss: 0.3243, test_loss: 2.5172, test_f1: 0.5507
 epoch: 90, train_loss: 0.3167, test_loss: 2.3739, test_f1: 0.5688
 epoch: 91, train_loss: 0.2785, test_loss: 2.4286, test_f1: 0.5844
 epoch: 92, train_loss: 0.2478, test_loss: 2.2300, test_f1: 0.6188
 epoch: 93, train_loss: 0.2661, test_loss: 2.3137, test_f1: 0.5797
 epoch: 94, train_loss: 0.2538, test_loss: 2.2226, test_f1: 0.5829
 epoch: 95, train_loss: 0.2931, test_loss: 2.6062, test_f1: 0.5614
 epoch: 96, train_loss: 0.2993, test_loss: 3.0490, test_f1: 0.5292
 epoch: 97, train_loss: 0.2794, test_loss: 2.5752, test_f1: 0.5696
 epoch: 98, train_loss: 0.2561, test_loss: 2.6329, test_f1: 0.5546
 epoch: 99, train_loss: 0.2648, test_loss: 2.4955, test_f1: 0.5554
##################ITERATION #2 ****************************************
 epoch: 0, train_loss: 1.2024, test_loss: 1.2840, test_f1: 0.2281
 epoch: 1, train_loss: 1.0489, test_loss: 1.2697, test_f1: 0.2281
 epoch: 2, train_loss: 0.9989, test_loss: 1.2584, test_f1: 0.3202
 epoch: 3, train_loss: 0.9646, test_loss: 1.2178, test_f1: 0.3575
 epoch: 4, train_loss: 0.9331, test_loss: 1.1448, test_f1: 0.4532
 epoch: 5, train_loss: 0.9006, test_loss: 1.1084, test_f1: 0.4423
 epoch: 6, train_loss: 0.8797, test_loss: 1.1029, test_f1: 0.5108
 epoch: 7, train_loss: 0.8651, test_loss: 1.1322, test_f1: 0.4750
 epoch: 8, train_loss: 0.8525, test_loss: 1.1735, test_f1: 0.4841
 epoch: 9, train_loss: 0.8368, test_loss: 1.2237, test_f1: 0.5435
 epoch: 10, train_loss: 0.8134, test_loss: 1.2143, test_f1: 0.5127
 epoch: 11, train_loss: 0.8128, test_loss: 1.1830, test_f1: 0.5383
 epoch: 12, train_loss: 0.8031, test_loss: 1.1774, test_f1: 0.4862
 epoch: 13, train_loss: 0.8182, test_loss: 1.0292, test_f1: 0.5738
 epoch: 14, train_loss: 0.7855, test_loss: 1.1172, test_f1: 0.5685
 epoch: 15, train_loss: 0.7674, test_loss: 1.1056, test_f1: 0.5347
 epoch: 16, train_loss: 0.7552, test_loss: 1.0546, test_f1: 0.5965
 epoch: 17, train_loss: 0.7283, test_loss: 1.0272, test_f1: 0.6321
 epoch: 18, train_loss: 0.7341, test_loss: 1.0745, test_f1: 0.6226
 epoch: 19, train_loss: 0.7307, test_loss: 1.1396, test_f1: 0.5767
 epoch: 20, train_loss: 0.7296, test_loss: 1.1585, test_f1: 0.5907
 epoch: 21, train_loss: 0.7089, test_loss: 1.1661, test_f1: 0.5593
 epoch: 22, train_loss: 0.7242, test_loss: 1.1885, test_f1: 0.5410
 epoch: 23, train_loss: 0.6930, test_loss: 1.3934, test_f1: 0.5196
 epoch: 24, train_loss: 0.6868, test_loss: 1.3615, test_f1: 0.5616
 epoch: 25, train_loss: 0.6858, test_loss: 1.1505, test_f1: 0.5840
 epoch: 26, train_loss: 0.6776, test_loss: 1.1989, test_f1: 0.5748
 epoch: 27, train_loss: 0.6505, test_loss: 1.1163, test_f1: 0.6347
 epoch: 28, train_loss: 0.6590, test_loss: 1.0701, test_f1: 0.6132
 epoch: 29, train_loss: 0.6394, test_loss: 1.5466, test_f1: 0.5510
 epoch: 30, train_loss: 0.6487, test_loss: 1.4502, test_f1: 0.5523
 epoch: 31, train_loss: 0.6631, test_loss: 1.5317, test_f1: 0.5437
 epoch: 32, train_loss: 0.6310, test_loss: 1.5405, test_f1: 0.5674
 epoch: 33, train_loss: 0.6226, test_loss: 1.4768, test_f1: 0.5556
 epoch: 34, train_loss: 0.6235, test_loss: 1.5073, test_f1: 0.6042
 epoch: 35, train_loss: 0.6340, test_loss: 1.4505, test_f1: 0.6115
 epoch: 36, train_loss: 0.6152, test_loss: 1.4725, test_f1: 0.6047
 epoch: 37, train_loss: 0.6306, test_loss: 1.4607, test_f1: 0.5983
 epoch: 38, train_loss: 0.6144, test_loss: 1.3948, test_f1: 0.6251
 epoch: 39, train_loss: 0.5906, test_loss: 1.3892, test_f1: 0.5376
 epoch: 40, train_loss: 0.5834, test_loss: 1.4321, test_f1: 0.6117
 epoch: 41, train_loss: 0.5496, test_loss: 1.4492, test_f1: 0.5981
 epoch: 42, train_loss: 0.5571, test_loss: 1.6315, test_f1: 0.5988
 epoch: 43, train_loss: 0.5833, test_loss: 1.6120, test_f1: 0.5891
 epoch: 44, train_loss: 0.5703, test_loss: 1.4944, test_f1: 0.6054
 epoch: 45, train_loss: 0.5696, test_loss: 1.2934, test_f1: 0.6229
 epoch: 46, train_loss: 0.5351, test_loss: 1.3898, test_f1: 0.6080
 epoch: 47, train_loss: 0.5747, test_loss: 1.4386, test_f1: 0.5803
 epoch: 48, train_loss: 0.5522, test_loss: 1.7885, test_f1: 0.5672
 epoch: 49, train_loss: 0.5504, test_loss: 1.4936, test_f1: 0.5891
 epoch: 50, train_loss: 0.5294, test_loss: 1.5185, test_f1: 0.6078
 epoch: 51, train_loss: 0.5262, test_loss: 1.4364, test_f1: 0.5984
 epoch: 52, train_loss: 0.4870, test_loss: 1.5723, test_f1: 0.6086
 epoch: 53, train_loss: 0.4840, test_loss: 1.4552, test_f1: 0.6095
 epoch: 54, train_loss: 0.4620, test_loss: 1.5051, test_f1: 0.6054
 epoch: 55, train_loss: 0.4657, test_loss: 1.4720, test_f1: 0.6119
 epoch: 56, train_loss: 0.4387, test_loss: 1.4833, test_f1: 0.6173
 epoch: 57, train_loss: 0.4205, test_loss: 1.5163, test_f1: 0.6058
 epoch: 58, train_loss: 0.4027, test_loss: 1.5089, test_f1: 0.6079
 epoch: 59, train_loss: 0.4284, test_loss: 1.6172, test_f1: 0.6140
 epoch: 60, train_loss: 0.3932, test_loss: 1.5498, test_f1: 0.6051
 epoch: 61, train_loss: 0.4041, test_loss: 1.6785, test_f1: 0.5758
 epoch: 62, train_loss: 0.4168, test_loss: 1.6344, test_f1: 0.6198
 epoch: 63, train_loss: 0.3908, test_loss: 1.7356, test_f1: 0.6301
 epoch: 64, train_loss: 0.3922, test_loss: 1.8240, test_f1: 0.5875
 epoch: 65, train_loss: 0.3957, test_loss: 1.7455, test_f1: 0.6079
 epoch: 66, train_loss: 0.3876, test_loss: 1.6189, test_f1: 0.6252
 epoch: 67, train_loss: 0.3771, test_loss: 1.5873, test_f1: 0.6124
 epoch: 68, train_loss: 0.3629, test_loss: 1.6806, test_f1: 0.6270
 epoch: 69, train_loss: 0.3963, test_loss: 1.6908, test_f1: 0.5921
 epoch: 70, train_loss: 0.3507, test_loss: 1.8406, test_f1: 0.5997
 epoch: 71, train_loss: 0.3509, test_loss: 1.9356, test_f1: 0.6076
 epoch: 72, train_loss: 0.3459, test_loss: 1.9259, test_f1: 0.5999
 epoch: 73, train_loss: 0.3363, test_loss: 1.9269, test_f1: 0.6318
 epoch: 74, train_loss: 0.3318, test_loss: 1.8704, test_f1: 0.6271
 epoch: 75, train_loss: 0.3297, test_loss: 1.9171, test_f1: 0.6107
 epoch: 76, train_loss: 0.3242, test_loss: 2.1517, test_f1: 0.5754
 epoch: 77, train_loss: 0.3304, test_loss: 2.1001, test_f1: 0.5777
 epoch: 78, train_loss: 0.3333, test_loss: 2.1316, test_f1: 0.6029
 epoch: 79, train_loss: 0.3449, test_loss: 1.9074, test_f1: 0.6195
 epoch: 80, train_loss: 0.3286, test_loss: 1.9198, test_f1: 0.5980
 epoch: 81, train_loss: 0.3499, test_loss: 2.0070, test_f1: 0.5533
 epoch: 82, train_loss: 0.3848, test_loss: 2.0106, test_f1: 0.5575
 epoch: 83, train_loss: 0.3381, test_loss: 1.9985, test_f1: 0.6007
 epoch: 84, train_loss: 0.3366, test_loss: 1.7466, test_f1: 0.6046
 epoch: 85, train_loss: 0.3124, test_loss: 1.6860, test_f1: 0.6287
 epoch: 86, train_loss: 0.3119, test_loss: 1.9621, test_f1: 0.6325
 epoch: 87, train_loss: 0.3129, test_loss: 2.0646, test_f1: 0.6228
 epoch: 88, train_loss: 0.3095, test_loss: 2.0166, test_f1: 0.5866
 epoch: 89, train_loss: 0.2884, test_loss: 2.0385, test_f1: 0.6067
 epoch: 90, train_loss: 0.2751, test_loss: 2.0187, test_f1: 0.6177
 epoch: 91, train_loss: 0.2700, test_loss: 2.1327, test_f1: 0.6361
 epoch: 92, train_loss: 0.2833, test_loss: 2.2164, test_f1: 0.6257
 epoch: 93, train_loss: 0.2734, test_loss: 2.1058, test_f1: 0.5825
 epoch: 94, train_loss: 0.2609, test_loss: 2.0625, test_f1: 0.5933
 epoch: 95, train_loss: 0.2521, test_loss: 2.1255, test_f1: 0.5857
 epoch: 96, train_loss: 0.2383, test_loss: 2.2341, test_f1: 0.5809
 epoch: 97, train_loss: 0.2480, test_loss: 2.3035, test_f1: 0.6083
 epoch: 98, train_loss: 0.2954, test_loss: 2.4633, test_f1: 0.5756
 epoch: 99, train_loss: 0.3051, test_loss: 2.8692, test_f1: 0.5850
##################ITERATION #3 ****************************************
 epoch: 0, train_loss: 1.1873, test_loss: 1.2912, test_f1: 0.1365
 epoch: 1, train_loss: 1.0291, test_loss: 1.2620, test_f1: 0.3341
 epoch: 2, train_loss: 0.9825, test_loss: 1.2391, test_f1: 0.2886
 epoch: 3, train_loss: 0.9532, test_loss: 1.2236, test_f1: 0.3148
 epoch: 4, train_loss: 0.9170, test_loss: 1.1923, test_f1: 0.4084
 epoch: 5, train_loss: 0.8947, test_loss: 1.1138, test_f1: 0.4700
 epoch: 6, train_loss: 0.8728, test_loss: 1.0668, test_f1: 0.4887
 epoch: 7, train_loss: 0.8530, test_loss: 1.1214, test_f1: 0.4945
 epoch: 8, train_loss: 0.8387, test_loss: 1.1389, test_f1: 0.5186
 epoch: 9, train_loss: 0.8127, test_loss: 1.1967, test_f1: 0.4741
 epoch: 10, train_loss: 0.8069, test_loss: 1.1275, test_f1: 0.5563
 epoch: 11, train_loss: 0.7996, test_loss: 1.1269, test_f1: 0.5763
 epoch: 12, train_loss: 0.8183, test_loss: 1.0501, test_f1: 0.5814
 epoch: 13, train_loss: 0.7667, test_loss: 1.2742, test_f1: 0.5544
 epoch: 14, train_loss: 0.8564, test_loss: 1.0224, test_f1: 0.5978
 epoch: 15, train_loss: 0.7992, test_loss: 1.0114, test_f1: 0.6065
 epoch: 16, train_loss: 0.8032, test_loss: 1.2455, test_f1: 0.5432
 epoch: 17, train_loss: 0.8021, test_loss: 1.1560, test_f1: 0.6284
 epoch: 18, train_loss: 0.7669, test_loss: 1.2620, test_f1: 0.5083
 epoch: 19, train_loss: 0.7213, test_loss: 1.1714, test_f1: 0.5522
 epoch: 20, train_loss: 0.7135, test_loss: 1.1998, test_f1: 0.5449
 epoch: 21, train_loss: 0.6980, test_loss: 1.2035, test_f1: 0.5620
 epoch: 22, train_loss: 0.6995, test_loss: 1.2249, test_f1: 0.5801
 epoch: 23, train_loss: 0.6727, test_loss: 1.3539, test_f1: 0.5533
 epoch: 24, train_loss: 0.6485, test_loss: 1.3400, test_f1: 0.6118
 epoch: 25, train_loss: 0.6489, test_loss: 1.3819, test_f1: 0.5565
 epoch: 26, train_loss: 0.6316, test_loss: 1.3963, test_f1: 0.5532
 epoch: 27, train_loss: 0.6444, test_loss: 1.4700, test_f1: 0.5596
 epoch: 28, train_loss: 0.6107, test_loss: 1.3969, test_f1: 0.5950
 epoch: 29, train_loss: 0.6018, test_loss: 1.4875, test_f1: 0.6003
 epoch: 30, train_loss: 0.5994, test_loss: 1.5654, test_f1: 0.5911
 epoch: 31, train_loss: 0.6259, test_loss: 1.5304, test_f1: 0.5853
 epoch: 32, train_loss: 0.5968, test_loss: 1.5406, test_f1: 0.5464
 epoch: 33, train_loss: 0.5946, test_loss: 1.6319, test_f1: 0.5493
 epoch: 34, train_loss: 0.5690, test_loss: 1.6802, test_f1: 0.5777
 epoch: 35, train_loss: 0.5338, test_loss: 1.7542, test_f1: 0.5539
 epoch: 36, train_loss: 0.5480, test_loss: 1.6784, test_f1: 0.5946
 epoch: 37, train_loss: 0.5361, test_loss: 1.7118, test_f1: 0.5660
 epoch: 38, train_loss: 0.5143, test_loss: 1.6231, test_f1: 0.5771
 epoch: 39, train_loss: 0.4810, test_loss: 1.6390, test_f1: 0.6002
 epoch: 40, train_loss: 0.5174, test_loss: 1.7311, test_f1: 0.5794
 epoch: 41, train_loss: 0.5261, test_loss: 1.7783, test_f1: 0.5721
 epoch: 42, train_loss: 0.5396, test_loss: 1.8029, test_f1: 0.5305
 epoch: 43, train_loss: 0.5188, test_loss: 1.7523, test_f1: 0.5684
 epoch: 44, train_loss: 0.4651, test_loss: 1.6876, test_f1: 0.5715
 epoch: 45, train_loss: 0.4680, test_loss: 1.9109, test_f1: 0.5512
 epoch: 46, train_loss: 0.4545, test_loss: 1.7780, test_f1: 0.5371
 epoch: 47, train_loss: 0.4397, test_loss: 1.9048, test_f1: 0.5288
 epoch: 48, train_loss: 0.4213, test_loss: 1.9427, test_f1: 0.5432
 epoch: 49, train_loss: 0.4452, test_loss: 2.2743, test_f1: 0.5233
 epoch: 50, train_loss: 0.4638, test_loss: 2.1404, test_f1: 0.5797
 epoch: 51, train_loss: 0.4421, test_loss: 1.8722, test_f1: 0.6266
 epoch: 52, train_loss: 0.4412, test_loss: 1.9763, test_f1: 0.5608
 epoch: 53, train_loss: 0.4112, test_loss: 1.8753, test_f1: 0.5892
 epoch: 54, train_loss: 0.4263, test_loss: 1.8710, test_f1: 0.5971
 epoch: 55, train_loss: 0.4296, test_loss: 1.8296, test_f1: 0.5744
 epoch: 56, train_loss: 0.3896, test_loss: 1.8264, test_f1: 0.6128
 epoch: 57, train_loss: 0.3974, test_loss: 1.9496, test_f1: 0.5828
 epoch: 58, train_loss: 0.3861, test_loss: 2.1601, test_f1: 0.5630
 epoch: 59, train_loss: 0.3955, test_loss: 2.0960, test_f1: 0.5634
 epoch: 60, train_loss: 0.3652, test_loss: 2.0718, test_f1: 0.5807
 epoch: 61, train_loss: 0.3528, test_loss: 2.0279, test_f1: 0.6126
 epoch: 62, train_loss: 0.3359, test_loss: 2.1287, test_f1: 0.5866
 epoch: 63, train_loss: 0.3477, test_loss: 2.2324, test_f1: 0.5638
 epoch: 64, train_loss: 0.3351, test_loss: 2.1977, test_f1: 0.5950
 epoch: 65, train_loss: 0.3222, test_loss: 2.2559, test_f1: 0.5728
 epoch: 66, train_loss: 0.3181, test_loss: 2.3175, test_f1: 0.5932
 epoch: 67, train_loss: 0.3237, test_loss: 2.3283, test_f1: 0.5721
 epoch: 68, train_loss: 0.3097, test_loss: 2.3105, test_f1: 0.5853
 epoch: 69, train_loss: 0.3205, test_loss: 2.3665, test_f1: 0.5974
 epoch: 70, train_loss: 0.3103, test_loss: 2.5194, test_f1: 0.5731
 epoch: 71, train_loss: 0.3067, test_loss: 2.4237, test_f1: 0.5769
 epoch: 72, train_loss: 0.2868, test_loss: 2.4349, test_f1: 0.5681
 epoch: 73, train_loss: 0.2875, test_loss: 2.4915, test_f1: 0.5547
 epoch: 74, train_loss: 0.2984, test_loss: 2.4394, test_f1: 0.5634
 epoch: 75, train_loss: 0.3190, test_loss: 2.4798, test_f1: 0.5661
 epoch: 76, train_loss: 0.3140, test_loss: 2.5249, test_f1: 0.5761
 epoch: 77, train_loss: 0.2864, test_loss: 2.6462, test_f1: 0.5583
 epoch: 78, train_loss: 0.3607, test_loss: 3.1983, test_f1: 0.5072
 epoch: 79, train_loss: 0.3745, test_loss: 2.8346, test_f1: 0.5729
 epoch: 80, train_loss: 0.3653, test_loss: 2.5309, test_f1: 0.5658
 epoch: 81, train_loss: 0.3307, test_loss: 2.3914, test_f1: 0.6211
 epoch: 82, train_loss: 0.3048, test_loss: 2.5378, test_f1: 0.6085
 epoch: 83, train_loss: 0.2897, test_loss: 2.3330, test_f1: 0.6083
 epoch: 84, train_loss: 0.2912, test_loss: 2.4177, test_f1: 0.6053
 epoch: 85, train_loss: 0.2921, test_loss: 2.2769, test_f1: 0.6239
 epoch: 86, train_loss: 0.2950, test_loss: 2.4954, test_f1: 0.5956
 epoch: 87, train_loss: 0.2557, test_loss: 2.6118, test_f1: 0.6002
 epoch: 88, train_loss: 0.2780, test_loss: 2.5786, test_f1: 0.5978
 epoch: 89, train_loss: 0.2556, test_loss: 2.5723, test_f1: 0.6307
 epoch: 90, train_loss: 0.2676, test_loss: 2.6332, test_f1: 0.5925
 epoch: 91, train_loss: 0.2738, test_loss: 2.4433, test_f1: 0.6039
 epoch: 92, train_loss: 0.2659, test_loss: 2.4032, test_f1: 0.6167
 epoch: 93, train_loss: 0.2792, test_loss: 2.7466, test_f1: 0.5860
 epoch: 94, train_loss: 0.2662, test_loss: 2.7048, test_f1: 0.5660
 epoch: 95, train_loss: 0.2556, test_loss: 2.6615, test_f1: 0.5618
 epoch: 96, train_loss: 0.2379, test_loss: 2.6336, test_f1: 0.5990
 epoch: 97, train_loss: 0.2350, test_loss: 2.5249, test_f1: 0.5857
 epoch: 98, train_loss: 0.2504, test_loss: 2.6270, test_f1: 0.6116
 epoch: 99, train_loss: 0.2560, test_loss: 2.6847, test_f1: 0.6162
##################ITERATION #4 ****************************************
 epoch: 0, train_loss: 1.1941, test_loss: 1.3237, test_f1: 0.1365
 epoch: 1, train_loss: 1.0389, test_loss: 1.3158, test_f1: 0.2259
 epoch: 2, train_loss: 0.9941, test_loss: 1.2628, test_f1: 0.2136
 epoch: 3, train_loss: 0.9620, test_loss: 1.2409, test_f1: 0.2529
 epoch: 4, train_loss: 0.9407, test_loss: 1.1688, test_f1: 0.3661
 epoch: 5, train_loss: 0.9091, test_loss: 1.1178, test_f1: 0.4526
 epoch: 6, train_loss: 0.8862, test_loss: 1.1010, test_f1: 0.4732
 epoch: 7, train_loss: 0.8754, test_loss: 1.0725, test_f1: 0.4319
 epoch: 8, train_loss: 0.8469, test_loss: 1.1074, test_f1: 0.4450
 epoch: 9, train_loss: 0.8321, test_loss: 1.0425, test_f1: 0.5532
 epoch: 10, train_loss: 0.8046, test_loss: 1.0853, test_f1: 0.5376
 epoch: 11, train_loss: 0.8121, test_loss: 1.0263, test_f1: 0.5444
 epoch: 12, train_loss: 0.8074, test_loss: 1.0847, test_f1: 0.5822
 epoch: 13, train_loss: 0.7901, test_loss: 1.0785, test_f1: 0.5552
 epoch: 14, train_loss: 0.7648, test_loss: 1.0144, test_f1: 0.5913
 epoch: 15, train_loss: 0.7595, test_loss: 1.1589, test_f1: 0.4983
 epoch: 16, train_loss: 0.7466, test_loss: 1.1209, test_f1: 0.5813
 epoch: 17, train_loss: 0.7720, test_loss: 1.1657, test_f1: 0.5316
 epoch: 18, train_loss: 0.7504, test_loss: 1.0943, test_f1: 0.5543
 epoch: 19, train_loss: 0.7338, test_loss: 1.0766, test_f1: 0.5592
 epoch: 20, train_loss: 0.7134, test_loss: 1.0706, test_f1: 0.6226
 epoch: 21, train_loss: 0.6925, test_loss: 1.1751, test_f1: 0.5381
 epoch: 22, train_loss: 0.6952, test_loss: 1.4049, test_f1: 0.5098
 epoch: 23, train_loss: 0.7350, test_loss: 1.0912, test_f1: 0.5741
 epoch: 24, train_loss: 0.7329, test_loss: 1.2633, test_f1: 0.5828
 epoch: 25, train_loss: 0.7079, test_loss: 1.2754, test_f1: 0.5231
 epoch: 26, train_loss: 0.7046, test_loss: 1.1266, test_f1: 0.5745
 epoch: 27, train_loss: 0.6737, test_loss: 1.1065, test_f1: 0.6356
 epoch: 28, train_loss: 0.6594, test_loss: 1.1239, test_f1: 0.6054
 epoch: 29, train_loss: 0.6372, test_loss: 1.3032, test_f1: 0.5760
 epoch: 30, train_loss: 0.6433, test_loss: 1.2882, test_f1: 0.5937
 epoch: 31, train_loss: 0.6302, test_loss: 1.2067, test_f1: 0.6399
 epoch: 32, train_loss: 0.6357, test_loss: 1.3586, test_f1: 0.5723
 epoch: 33, train_loss: 0.6140, test_loss: 1.3160, test_f1: 0.5827
 epoch: 34, train_loss: 0.6306, test_loss: 1.4032, test_f1: 0.5156
 epoch: 35, train_loss: 0.6089, test_loss: 1.2517, test_f1: 0.6058
 epoch: 36, train_loss: 0.5848, test_loss: 1.2827, test_f1: 0.5980
 epoch: 37, train_loss: 0.5499, test_loss: 1.3287, test_f1: 0.5937
 epoch: 38, train_loss: 0.5673, test_loss: 1.2697, test_f1: 0.5893
 epoch: 39, train_loss: 0.5865, test_loss: 1.2516, test_f1: 0.6008
 epoch: 40, train_loss: 0.5576, test_loss: 1.3961, test_f1: 0.5815
 epoch: 41, train_loss: 0.5377, test_loss: 1.4600, test_f1: 0.6010
 epoch: 42, train_loss: 0.4926, test_loss: 1.3839, test_f1: 0.6344
 epoch: 43, train_loss: 0.5220, test_loss: 1.5830, test_f1: 0.5681
 epoch: 44, train_loss: 0.5255, test_loss: 1.4846, test_f1: 0.5747
 epoch: 45, train_loss: 0.5113, test_loss: 2.0921, test_f1: 0.5091
 epoch: 46, train_loss: 0.5038, test_loss: 1.6522, test_f1: 0.5602
 epoch: 47, train_loss: 0.5196, test_loss: 1.6295, test_f1: 0.5557
 epoch: 48, train_loss: 0.4844, test_loss: 1.5267, test_f1: 0.5696
 epoch: 49, train_loss: 0.4691, test_loss: 1.7723, test_f1: 0.5877
 epoch: 50, train_loss: 0.4559, test_loss: 1.6648, test_f1: 0.6029
 epoch: 51, train_loss: 0.4354, test_loss: 1.6928, test_f1: 0.6026
 epoch: 52, train_loss: 0.4164, test_loss: 1.6863, test_f1: 0.6060
 epoch: 53, train_loss: 0.4103, test_loss: 1.7606, test_f1: 0.5849
 epoch: 54, train_loss: 0.4582, test_loss: 1.6235, test_f1: 0.5938
 epoch: 55, train_loss: 0.4692, test_loss: 1.5950, test_f1: 0.6164
 epoch: 56, train_loss: 0.4446, test_loss: 1.7292, test_f1: 0.5935
 epoch: 57, train_loss: 0.4227, test_loss: 1.8201, test_f1: 0.5701
 epoch: 58, train_loss: 0.4300, test_loss: 1.7224, test_f1: 0.6175
 epoch: 59, train_loss: 0.3852, test_loss: 1.6476, test_f1: 0.5926
 epoch: 60, train_loss: 0.3861, test_loss: 1.6743, test_f1: 0.5899
 epoch: 61, train_loss: 0.3752, test_loss: 1.7730, test_f1: 0.5985
 epoch: 62, train_loss: 0.3492, test_loss: 1.8230, test_f1: 0.5998
 epoch: 63, train_loss: 0.3471, test_loss: 1.6611, test_f1: 0.6258
 epoch: 64, train_loss: 0.3483, test_loss: 1.7357, test_f1: 0.6502
 epoch: 65, train_loss: 0.3442, test_loss: 1.9145, test_f1: 0.6081
 epoch: 66, train_loss: 0.3451, test_loss: 1.9664, test_f1: 0.5930
 epoch: 67, train_loss: 0.3469, test_loss: 2.0044, test_f1: 0.5703
 epoch: 68, train_loss: 0.3517, test_loss: 1.7882, test_f1: 0.6295
 epoch: 69, train_loss: 0.3067, test_loss: 1.9009, test_f1: 0.6188
 epoch: 70, train_loss: 0.3119, test_loss: 2.0254, test_f1: 0.6157
 epoch: 71, train_loss: 0.3157, test_loss: 1.9959, test_f1: 0.6053
 epoch: 72, train_loss: 0.3067, test_loss: 2.1785, test_f1: 0.5858
 epoch: 73, train_loss: 0.3006, test_loss: 2.2934, test_f1: 0.5838
 epoch: 74, train_loss: 0.2826, test_loss: 2.3316, test_f1: 0.5934
 epoch: 75, train_loss: 0.2939, test_loss: 2.4666, test_f1: 0.5845
 epoch: 76, train_loss: 0.2964, test_loss: 2.2859, test_f1: 0.5908
 epoch: 77, train_loss: 0.2923, test_loss: 2.3944, test_f1: 0.5803
 epoch: 78, train_loss: 0.2742, test_loss: 2.2713, test_f1: 0.6004
 epoch: 79, train_loss: 0.2910, test_loss: 2.3808, test_f1: 0.6093
 epoch: 80, train_loss: 0.2683, test_loss: 2.3446, test_f1: 0.5927
 epoch: 81, train_loss: 0.2828, test_loss: 2.3770, test_f1: 0.5781
 epoch: 82, train_loss: 0.3156, test_loss: 2.3093, test_f1: 0.5868
 epoch: 83, train_loss: 0.3300, test_loss: 2.4009, test_f1: 0.6032
 epoch: 84, train_loss: 0.3399, test_loss: 2.4882, test_f1: 0.6034
 epoch: 85, train_loss: 0.3607, test_loss: 2.5396, test_f1: 0.5993
 epoch: 86, train_loss: 0.2947, test_loss: 2.4759, test_f1: 0.5938
 epoch: 87, train_loss: 0.3112, test_loss: 2.4665, test_f1: 0.5863
 epoch: 88, train_loss: 0.2988, test_loss: 2.4876, test_f1: 0.5693
 epoch: 89, train_loss: 0.2925, test_loss: 2.2740, test_f1: 0.5696
 epoch: 90, train_loss: 0.3053, test_loss: 2.4427, test_f1: 0.5722
 epoch: 91, train_loss: 0.3155, test_loss: 2.2966, test_f1: 0.5544
 epoch: 92, train_loss: 0.2876, test_loss: 2.4520, test_f1: 0.5619
 epoch: 93, train_loss: 0.2899, test_loss: 2.2407, test_f1: 0.5945
 epoch: 94, train_loss: 0.2696, test_loss: 2.1777, test_f1: 0.5801
 epoch: 95, train_loss: 0.2610, test_loss: 2.3785, test_f1: 0.5590
 epoch: 96, train_loss: 0.2517, test_loss: 2.4774, test_f1: 0.5577
 epoch: 97, train_loss: 0.2503, test_loss: 2.6644, test_f1: 0.5810
 epoch: 98, train_loss: 0.2519, test_loss: 2.5612, test_f1: 0.5727
 epoch: 99, train_loss: 0.2889, test_loss: 2.5198, test_f1: 0.5885
##################ITERATION #5 ****************************************
 epoch: 0, train_loss: 1.2053, test_loss: 1.2949, test_f1: 0.1365
 epoch: 1, train_loss: 1.0820, test_loss: 1.2781, test_f1: 0.2106
 epoch: 2, train_loss: 1.0110, test_loss: 1.2428, test_f1: 0.3360
 epoch: 3, train_loss: 0.9816, test_loss: 1.2018, test_f1: 0.3588
 epoch: 4, train_loss: 0.9539, test_loss: 1.1428, test_f1: 0.4837
 epoch: 5, train_loss: 0.9387, test_loss: 1.1309, test_f1: 0.4394
 epoch: 6, train_loss: 0.8927, test_loss: 1.1789, test_f1: 0.3857
 epoch: 7, train_loss: 0.8955, test_loss: 1.1141, test_f1: 0.4879
 epoch: 8, train_loss: 0.8964, test_loss: 1.1148, test_f1: 0.5706
 epoch: 9, train_loss: 0.8470, test_loss: 1.0622, test_f1: 0.5644
 epoch: 10, train_loss: 0.8255, test_loss: 1.0102, test_f1: 0.5871
 epoch: 11, train_loss: 0.8349, test_loss: 1.0338, test_f1: 0.5926
 epoch: 12, train_loss: 0.8428, test_loss: 0.9775, test_f1: 0.5816
 epoch: 13, train_loss: 0.8082, test_loss: 0.9984, test_f1: 0.5835
 epoch: 14, train_loss: 0.8068, test_loss: 1.0080, test_f1: 0.5810
 epoch: 15, train_loss: 0.8038, test_loss: 1.0038, test_f1: 0.6143
 epoch: 16, train_loss: 0.7787, test_loss: 1.2029, test_f1: 0.5237
 epoch: 17, train_loss: 0.7852, test_loss: 1.0614, test_f1: 0.6066
 epoch: 18, train_loss: 0.7424, test_loss: 1.0208, test_f1: 0.6156
 epoch: 19, train_loss: 0.7255, test_loss: 1.1162, test_f1: 0.6008
 epoch: 20, train_loss: 0.7211, test_loss: 1.1345, test_f1: 0.6022
 epoch: 21, train_loss: 0.7329, test_loss: 1.0965, test_f1: 0.6326
 epoch: 22, train_loss: 0.7100, test_loss: 1.1163, test_f1: 0.6057
 epoch: 23, train_loss: 0.7144, test_loss: 1.1017, test_f1: 0.6044
 epoch: 24, train_loss: 0.7021, test_loss: 1.2016, test_f1: 0.6147
 epoch: 25, train_loss: 0.6802, test_loss: 1.2488, test_f1: 0.5746
 epoch: 26, train_loss: 0.6629, test_loss: 1.2140, test_f1: 0.6164
 epoch: 27, train_loss: 0.6564, test_loss: 1.1410, test_f1: 0.6240
 epoch: 28, train_loss: 0.6451, test_loss: 1.1136, test_f1: 0.6322
 epoch: 29, train_loss: 0.6207, test_loss: 1.1574, test_f1: 0.5967
 epoch: 30, train_loss: 0.6528, test_loss: 1.2344, test_f1: 0.5770
 epoch: 31, train_loss: 0.6644, test_loss: 1.1423, test_f1: 0.6376
 epoch: 32, train_loss: 0.6513, test_loss: 1.2134, test_f1: 0.5987
 epoch: 33, train_loss: 0.6457, test_loss: 1.2842, test_f1: 0.5692
 epoch: 34, train_loss: 0.6247, test_loss: 1.3255, test_f1: 0.6008
 epoch: 35, train_loss: 0.6050, test_loss: 1.2677, test_f1: 0.5893
 epoch: 36, train_loss: 0.5859, test_loss: 1.2549, test_f1: 0.6316
 epoch: 37, train_loss: 0.5664, test_loss: 1.3564, test_f1: 0.5891
 epoch: 38, train_loss: 0.5537, test_loss: 1.3137, test_f1: 0.6236
 epoch: 39, train_loss: 0.5871, test_loss: 1.4570, test_f1: 0.5870
 epoch: 40, train_loss: 0.5705, test_loss: 1.3399, test_f1: 0.6086
 epoch: 41, train_loss: 0.5775, test_loss: 1.5393, test_f1: 0.5716
 epoch: 42, train_loss: 0.5469, test_loss: 1.4211, test_f1: 0.5909
 epoch: 43, train_loss: 0.5494, test_loss: 1.4959, test_f1: 0.5201
 epoch: 44, train_loss: 0.5217, test_loss: 1.4263, test_f1: 0.5524
 epoch: 45, train_loss: 0.5218, test_loss: 1.6790, test_f1: 0.5771
 epoch: 46, train_loss: 0.5267, test_loss: 1.4995, test_f1: 0.5710
 epoch: 47, train_loss: 0.5035, test_loss: 1.3936, test_f1: 0.5941
 epoch: 48, train_loss: 0.5164, test_loss: 1.6084, test_f1: 0.6220
 epoch: 49, train_loss: 0.4677, test_loss: 1.6389, test_f1: 0.6127
 epoch: 50, train_loss: 0.4987, test_loss: 1.6637, test_f1: 0.5844
 epoch: 51, train_loss: 0.4629, test_loss: 1.7170, test_f1: 0.5672
 epoch: 52, train_loss: 0.4384, test_loss: 1.6534, test_f1: 0.6062
 epoch: 53, train_loss: 0.4209, test_loss: 1.6294, test_f1: 0.6039
 epoch: 54, train_loss: 0.4313, test_loss: 1.7117, test_f1: 0.6015
 epoch: 55, train_loss: 0.4201, test_loss: 1.5363, test_f1: 0.5921
 epoch: 56, train_loss: 0.4041, test_loss: 1.5670, test_f1: 0.5942
 epoch: 57, train_loss: 0.4199, test_loss: 1.7275, test_f1: 0.5773
 epoch: 58, train_loss: 0.3800, test_loss: 1.7491, test_f1: 0.5878
 epoch: 59, train_loss: 0.3634, test_loss: 1.7810, test_f1: 0.6007
 epoch: 60, train_loss: 0.3798, test_loss: 1.9281, test_f1: 0.6013
 epoch: 61, train_loss: 0.3738, test_loss: 1.8327, test_f1: 0.6123
 epoch: 62, train_loss: 0.3937, test_loss: 1.9613, test_f1: 0.5883
 epoch: 63, train_loss: 0.3750, test_loss: 1.8029, test_f1: 0.6234
 epoch: 64, train_loss: 0.3545, test_loss: 1.8173, test_f1: 0.6095
 epoch: 65, train_loss: 0.3590, test_loss: 1.8954, test_f1: 0.5942
 epoch: 66, train_loss: 0.3753, test_loss: 1.8253, test_f1: 0.5898
 epoch: 67, train_loss: 0.3652, test_loss: 1.8729, test_f1: 0.5859
 epoch: 68, train_loss: 0.3451, test_loss: 1.9227, test_f1: 0.5776
 epoch: 69, train_loss: 0.3440, test_loss: 2.0978, test_f1: 0.5642
 epoch: 70, train_loss: 0.3577, test_loss: 2.0264, test_f1: 0.5694
 epoch: 71, train_loss: 0.3276, test_loss: 2.1251, test_f1: 0.5729
 epoch: 72, train_loss: 0.3242, test_loss: 1.9865, test_f1: 0.5781
 epoch: 73, train_loss: 0.3407, test_loss: 2.1260, test_f1: 0.5777
 epoch: 74, train_loss: 0.3309, test_loss: 2.3240, test_f1: 0.5659
 epoch: 75, train_loss: 0.3077, test_loss: 2.1157, test_f1: 0.5966
 epoch: 76, train_loss: 0.3262, test_loss: 2.1023, test_f1: 0.5969
 epoch: 77, train_loss: 0.3352, test_loss: 1.9490, test_f1: 0.5957
 epoch: 78, train_loss: 0.3214, test_loss: 2.0273, test_f1: 0.5900
 epoch: 79, train_loss: 0.3051, test_loss: 2.2262, test_f1: 0.5769
 epoch: 80, train_loss: 0.3086, test_loss: 2.0889, test_f1: 0.5888
 epoch: 81, train_loss: 0.2973, test_loss: 2.0328, test_f1: 0.6023
 epoch: 82, train_loss: 0.3110, test_loss: 2.3671, test_f1: 0.5686
 epoch: 83, train_loss: 0.2878, test_loss: 2.2705, test_f1: 0.5716
 epoch: 84, train_loss: 0.3258, test_loss: 2.3663, test_f1: 0.5931
 epoch: 85, train_loss: 0.3404, test_loss: 2.5277, test_f1: 0.5790
 epoch: 86, train_loss: 0.3388, test_loss: 2.4766, test_f1: 0.5933
 epoch: 87, train_loss: 0.2880, test_loss: 2.3378, test_f1: 0.5919
 epoch: 88, train_loss: 0.2832, test_loss: 2.2829, test_f1: 0.5955
 epoch: 89, train_loss: 0.2790, test_loss: 2.2415, test_f1: 0.5862
 epoch: 90, train_loss: 0.2760, test_loss: 2.3644, test_f1: 0.5716
 epoch: 91, train_loss: 0.3006, test_loss: 2.7720, test_f1: 0.5546
 epoch: 92, train_loss: 0.2957, test_loss: 2.5380, test_f1: 0.5510
 epoch: 93, train_loss: 0.2684, test_loss: 2.3946, test_f1: 0.5827
 epoch: 94, train_loss: 0.2839, test_loss: 2.4433, test_f1: 0.5819
 epoch: 95, train_loss: 0.2822, test_loss: 2.4651, test_f1: 0.5755
 epoch: 96, train_loss: 0.2713, test_loss: 2.3673, test_f1: 0.5862
 epoch: 97, train_loss: 0.3273, test_loss: 2.3608, test_f1: 0.5997
 epoch: 98, train_loss: 0.3120, test_loss: 2.3476, test_f1: 0.5750
 epoch: 99, train_loss: 0.2955, test_loss: 2.2578, test_f1: 0.6020
##################ITERATION #6 ****************************************
 epoch: 0, train_loss: 1.2126, test_loss: 1.2973, test_f1: 0.1403
 epoch: 1, train_loss: 1.0417, test_loss: 1.2618, test_f1: 0.3282
 epoch: 2, train_loss: 1.0135, test_loss: 1.2507, test_f1: 0.3511
 epoch: 3, train_loss: 1.0007, test_loss: 1.1834, test_f1: 0.4130
 epoch: 4, train_loss: 0.9505, test_loss: 1.1551, test_f1: 0.4269
 epoch: 5, train_loss: 0.9217, test_loss: 1.1193, test_f1: 0.3873
 epoch: 6, train_loss: 0.8958, test_loss: 1.1514, test_f1: 0.3519
 epoch: 7, train_loss: 0.8783, test_loss: 1.1255, test_f1: 0.4194
 epoch: 8, train_loss: 0.8637, test_loss: 1.0710, test_f1: 0.4855
 epoch: 9, train_loss: 0.8632, test_loss: 1.0986, test_f1: 0.5077
 epoch: 10, train_loss: 0.8418, test_loss: 1.1251, test_f1: 0.5846
 epoch: 11, train_loss: 0.8111, test_loss: 1.1918, test_f1: 0.5287
 epoch: 12, train_loss: 0.8282, test_loss: 1.1556, test_f1: 0.5839
 epoch: 13, train_loss: 0.8080, test_loss: 1.1209, test_f1: 0.5622
 epoch: 14, train_loss: 0.7936, test_loss: 1.0803, test_f1: 0.5928
 epoch: 15, train_loss: 0.8068, test_loss: 1.1001, test_f1: 0.5532
 epoch: 16, train_loss: 0.7896, test_loss: 1.0667, test_f1: 0.5546
 epoch: 17, train_loss: 0.7910, test_loss: 1.1014, test_f1: 0.5401
 epoch: 18, train_loss: 0.7517, test_loss: 1.0999, test_f1: 0.5888
 epoch: 19, train_loss: 0.7737, test_loss: 1.1556, test_f1: 0.5157
 epoch: 20, train_loss: 0.7764, test_loss: 1.0854, test_f1: 0.5909
 epoch: 21, train_loss: 0.7699, test_loss: 1.0528, test_f1: 0.6108
 epoch: 22, train_loss: 0.7353, test_loss: 1.1023, test_f1: 0.5511
 epoch: 23, train_loss: 0.7020, test_loss: 1.0512, test_f1: 0.5997
 epoch: 24, train_loss: 0.6970, test_loss: 1.0912, test_f1: 0.5890
 epoch: 25, train_loss: 0.6957, test_loss: 1.2067, test_f1: 0.5957
 epoch: 26, train_loss: 0.6875, test_loss: 1.2042, test_f1: 0.6047
 epoch: 27, train_loss: 0.6745, test_loss: 1.1512, test_f1: 0.6030
 epoch: 28, train_loss: 0.6737, test_loss: 1.1673, test_f1: 0.6167
 epoch: 29, train_loss: 0.6500, test_loss: 1.1559, test_f1: 0.5901
 epoch: 30, train_loss: 0.6237, test_loss: 1.1474, test_f1: 0.5766
 epoch: 31, train_loss: 0.6377, test_loss: 1.2069, test_f1: 0.5929
 epoch: 32, train_loss: 0.6347, test_loss: 1.2146, test_f1: 0.6028
 epoch: 33, train_loss: 0.6254, test_loss: 1.2458, test_f1: 0.5806
 epoch: 34, train_loss: 0.6268, test_loss: 1.1560, test_f1: 0.6243
 epoch: 35, train_loss: 0.5870, test_loss: 1.2568, test_f1: 0.6016
 epoch: 36, train_loss: 0.6186, test_loss: 1.4116, test_f1: 0.5661
 epoch: 37, train_loss: 0.5919, test_loss: 1.2622, test_f1: 0.5554
 epoch: 38, train_loss: 0.5877, test_loss: 1.2115, test_f1: 0.5527
 epoch: 39, train_loss: 0.5802, test_loss: 1.3334, test_f1: 0.5683
 epoch: 40, train_loss: 0.5534, test_loss: 1.3560, test_f1: 0.5958
 epoch: 41, train_loss: 0.5584, test_loss: 1.3115, test_f1: 0.5736
 epoch: 42, train_loss: 0.5772, test_loss: 1.4685, test_f1: 0.5471
 epoch: 43, train_loss: 0.5387, test_loss: 1.4362, test_f1: 0.5910
 epoch: 44, train_loss: 0.5346, test_loss: 1.4968, test_f1: 0.5453
 epoch: 45, train_loss: 0.5214, test_loss: 1.4893, test_f1: 0.6109
 epoch: 46, train_loss: 0.5269, test_loss: 1.4243, test_f1: 0.6087
 epoch: 47, train_loss: 0.5196, test_loss: 1.3533, test_f1: 0.6006
 epoch: 48, train_loss: 0.4856, test_loss: 1.5107, test_f1: 0.5487
 epoch: 49, train_loss: 0.4693, test_loss: 1.4647, test_f1: 0.6028
 epoch: 50, train_loss: 0.5001, test_loss: 1.5320, test_f1: 0.5929
 epoch: 51, train_loss: 0.4588, test_loss: 1.4405, test_f1: 0.6180
 epoch: 52, train_loss: 0.4358, test_loss: 1.5051, test_f1: 0.6082
 epoch: 53, train_loss: 0.4306, test_loss: 1.5052, test_f1: 0.6034
 epoch: 54, train_loss: 0.3981, test_loss: 1.4558, test_f1: 0.6090
 epoch: 55, train_loss: 0.4080, test_loss: 1.5841, test_f1: 0.6318
 epoch: 56, train_loss: 0.3943, test_loss: 1.5052, test_f1: 0.5992
 epoch: 57, train_loss: 0.3930, test_loss: 1.5592, test_f1: 0.5626
 epoch: 58, train_loss: 0.4002, test_loss: 1.5037, test_f1: 0.6006
 epoch: 59, train_loss: 0.3522, test_loss: 1.5681, test_f1: 0.6072
 epoch: 60, train_loss: 0.3664, test_loss: 1.6551, test_f1: 0.5917
 epoch: 61, train_loss: 0.3599, test_loss: 1.5610, test_f1: 0.6075
 epoch: 62, train_loss: 0.3546, test_loss: 1.6347, test_f1: 0.6162
 epoch: 63, train_loss: 0.3493, test_loss: 1.5685, test_f1: 0.6251
 epoch: 64, train_loss: 0.3515, test_loss: 1.7665, test_f1: 0.5898
 epoch: 65, train_loss: 0.3627, test_loss: 1.7433, test_f1: 0.5976
 epoch: 66, train_loss: 0.3730, test_loss: 1.9844, test_f1: 0.5571
 epoch: 67, train_loss: 0.3556, test_loss: 1.8043, test_f1: 0.5875
 epoch: 68, train_loss: 0.3298, test_loss: 1.8074, test_f1: 0.5839
 epoch: 69, train_loss: 0.3645, test_loss: 1.7413, test_f1: 0.5953
 epoch: 70, train_loss: 0.3469, test_loss: 2.0581, test_f1: 0.5469
 epoch: 71, train_loss: 0.3525, test_loss: 1.9038, test_f1: 0.5752
 epoch: 72, train_loss: 0.3187, test_loss: 1.9012, test_f1: 0.5859
 epoch: 73, train_loss: 0.3560, test_loss: 1.9077, test_f1: 0.6155
 epoch: 74, train_loss: 0.3280, test_loss: 1.9480, test_f1: 0.6032
 epoch: 75, train_loss: 0.3356, test_loss: 2.0180, test_f1: 0.5517
 epoch: 76, train_loss: 0.3470, test_loss: 1.8908, test_f1: 0.6254
 epoch: 77, train_loss: 0.3312, test_loss: 1.9662, test_f1: 0.6125
 epoch: 78, train_loss: 0.2950, test_loss: 2.0480, test_f1: 0.5999
 epoch: 79, train_loss: 0.3215, test_loss: 2.0295, test_f1: 0.6052
 epoch: 80, train_loss: 0.2941, test_loss: 2.1060, test_f1: 0.5365
 epoch: 81, train_loss: 0.3148, test_loss: 2.0718, test_f1: 0.5882
 epoch: 82, train_loss: 0.3074, test_loss: 1.9909, test_f1: 0.6365
 epoch: 83, train_loss: 0.2969, test_loss: 2.1458, test_f1: 0.6270
 epoch: 84, train_loss: 0.3151, test_loss: 2.0297, test_f1: 0.6011
 epoch: 85, train_loss: 0.2833, test_loss: 1.9319, test_f1: 0.6025
 epoch: 86, train_loss: 0.2766, test_loss: 2.0318, test_f1: 0.6141
 epoch: 87, train_loss: 0.2750, test_loss: 2.1873, test_f1: 0.5861
 epoch: 88, train_loss: 0.2635, test_loss: 2.1846, test_f1: 0.5586
 epoch: 89, train_loss: 0.2773, test_loss: 2.1187, test_f1: 0.5641
 epoch: 90, train_loss: 0.2988, test_loss: 2.0783, test_f1: 0.5941
 epoch: 91, train_loss: 0.2984, test_loss: 2.4626, test_f1: 0.5656
 epoch: 92, train_loss: 0.2779, test_loss: 2.2997, test_f1: 0.5752
 epoch: 93, train_loss: 0.2721, test_loss: 2.1379, test_f1: 0.5818
 epoch: 94, train_loss: 0.2779, test_loss: 2.1335, test_f1: 0.5767
 epoch: 95, train_loss: 0.2640, test_loss: 2.1156, test_f1: 0.5691
 epoch: 96, train_loss: 0.2742, test_loss: 2.1817, test_f1: 0.5710
 epoch: 97, train_loss: 0.2673, test_loss: 2.1553, test_f1: 0.5984
 epoch: 98, train_loss: 0.2575, test_loss: 2.3082, test_f1: 0.5806
 epoch: 99, train_loss: 0.2491, test_loss: 2.4262, test_f1: 0.5873
##################ITERATION #7 ****************************************
 epoch: 0, train_loss: 1.2629, test_loss: 1.2887, test_f1: 0.1365
 epoch: 1, train_loss: 1.0726, test_loss: 1.2738, test_f1: 0.1365
 epoch: 2, train_loss: 1.0203, test_loss: 1.2240, test_f1: 0.3830
 epoch: 3, train_loss: 0.9664, test_loss: 1.1969, test_f1: 0.4005
 epoch: 4, train_loss: 0.9351, test_loss: 1.1583, test_f1: 0.4271
 epoch: 5, train_loss: 0.9135, test_loss: 1.1465, test_f1: 0.4517
 epoch: 6, train_loss: 0.8890, test_loss: 1.1358, test_f1: 0.4273
 epoch: 7, train_loss: 0.8714, test_loss: 1.0889, test_f1: 0.5163
 epoch: 8, train_loss: 0.8576, test_loss: 1.1252, test_f1: 0.5089
 epoch: 9, train_loss: 0.8515, test_loss: 1.0988, test_f1: 0.5476
 epoch: 10, train_loss: 0.8579, test_loss: 1.1725, test_f1: 0.5075
 epoch: 11, train_loss: 0.8350, test_loss: 1.0973, test_f1: 0.5287
 epoch: 12, train_loss: 0.8172, test_loss: 1.0155, test_f1: 0.5799
 epoch: 13, train_loss: 0.8065, test_loss: 1.0934, test_f1: 0.5486
 epoch: 14, train_loss: 0.8104, test_loss: 1.0540, test_f1: 0.5536
 epoch: 15, train_loss: 0.8111, test_loss: 1.0885, test_f1: 0.5906
 epoch: 16, train_loss: 0.8266, test_loss: 1.2361, test_f1: 0.5582
 epoch: 17, train_loss: 0.7787, test_loss: 1.1235, test_f1: 0.5674
 epoch: 18, train_loss: 0.7863, test_loss: 1.0998, test_f1: 0.5211
 epoch: 19, train_loss: 0.7612, test_loss: 1.1468, test_f1: 0.5445
 epoch: 20, train_loss: 0.7387, test_loss: 1.1730, test_f1: 0.6159
 epoch: 21, train_loss: 0.7499, test_loss: 1.1636, test_f1: 0.5766
 epoch: 22, train_loss: 0.7272, test_loss: 1.1572, test_f1: 0.5692
 epoch: 23, train_loss: 0.7340, test_loss: 1.1421, test_f1: 0.5848
 epoch: 24, train_loss: 0.7508, test_loss: 1.0817, test_f1: 0.5886
 epoch: 25, train_loss: 0.7152, test_loss: 1.1055, test_f1: 0.6006
 epoch: 26, train_loss: 0.7087, test_loss: 1.0629, test_f1: 0.6174
 epoch: 27, train_loss: 0.6978, test_loss: 1.0576, test_f1: 0.5810
 epoch: 28, train_loss: 0.6940, test_loss: 1.1391, test_f1: 0.5713
 epoch: 29, train_loss: 0.6693, test_loss: 1.1493, test_f1: 0.5996
 epoch: 30, train_loss: 0.6553, test_loss: 1.2557, test_f1: 0.5483
 epoch: 31, train_loss: 0.6657, test_loss: 1.1838, test_f1: 0.6089
 epoch: 32, train_loss: 0.6444, test_loss: 1.1959, test_f1: 0.5967
 epoch: 33, train_loss: 0.6373, test_loss: 1.2612, test_f1: 0.5485
 epoch: 34, train_loss: 0.6588, test_loss: 1.3155, test_f1: 0.5799
 epoch: 35, train_loss: 0.6266, test_loss: 1.2786, test_f1: 0.6041
 epoch: 36, train_loss: 0.6469, test_loss: 1.3452, test_f1: 0.5488
 epoch: 37, train_loss: 0.6566, test_loss: 1.2153, test_f1: 0.5731
 epoch: 38, train_loss: 0.6363, test_loss: 1.3061, test_f1: 0.5451
 epoch: 39, train_loss: 0.6284, test_loss: 1.1677, test_f1: 0.5854
 epoch: 40, train_loss: 0.6058, test_loss: 1.1645, test_f1: 0.6289
 epoch: 41, train_loss: 0.5737, test_loss: 1.2037, test_f1: 0.6238
 epoch: 42, train_loss: 0.5775, test_loss: 1.3605, test_f1: 0.5573
 epoch: 43, train_loss: 0.5988, test_loss: 1.2243, test_f1: 0.5912
 epoch: 44, train_loss: 0.6117, test_loss: 1.3033, test_f1: 0.5926
 epoch: 45, train_loss: 0.6018, test_loss: 1.2241, test_f1: 0.5797
 epoch: 46, train_loss: 0.5947, test_loss: 1.2432, test_f1: 0.6130
 epoch: 47, train_loss: 0.6004, test_loss: 1.2610, test_f1: 0.6042
 epoch: 48, train_loss: 0.5815, test_loss: 1.2666, test_f1: 0.6249
 epoch: 49, train_loss: 0.5480, test_loss: 1.2719, test_f1: 0.6052
 epoch: 50, train_loss: 0.5362, test_loss: 1.3102, test_f1: 0.5781
 epoch: 51, train_loss: 0.4996, test_loss: 1.2237, test_f1: 0.6246
 epoch: 52, train_loss: 0.4827, test_loss: 1.2949, test_f1: 0.6228
 epoch: 53, train_loss: 0.4874, test_loss: 1.3399, test_f1: 0.6065
 epoch: 54, train_loss: 0.4751, test_loss: 1.3301, test_f1: 0.6556
 epoch: 55, train_loss: 0.4685, test_loss: 1.3872, test_f1: 0.6090
 epoch: 56, train_loss: 0.4599, test_loss: 1.3035, test_f1: 0.6262
 epoch: 57, train_loss: 0.4427, test_loss: 1.2504, test_f1: 0.6386
 epoch: 58, train_loss: 0.4352, test_loss: 1.4817, test_f1: 0.6084
 epoch: 59, train_loss: 0.4454, test_loss: 1.4137, test_f1: 0.6292
 epoch: 60, train_loss: 0.4190, test_loss: 1.4261, test_f1: 0.6385
 epoch: 61, train_loss: 0.4320, test_loss: 1.6166, test_f1: 0.5875
 epoch: 62, train_loss: 0.4222, test_loss: 1.6642, test_f1: 0.6050
 epoch: 63, train_loss: 0.4192, test_loss: 1.5006, test_f1: 0.6453
 epoch: 64, train_loss: 0.4027, test_loss: 1.5930, test_f1: 0.6177
 epoch: 65, train_loss: 0.4303, test_loss: 1.5329, test_f1: 0.6203
 epoch: 66, train_loss: 0.4118, test_loss: 1.4968, test_f1: 0.6536
 epoch: 67, train_loss: 0.3828, test_loss: 1.5032, test_f1: 0.6044
 epoch: 68, train_loss: 0.3968, test_loss: 1.4882, test_f1: 0.6106
 epoch: 69, train_loss: 0.3716, test_loss: 1.4434, test_f1: 0.6455
 epoch: 70, train_loss: 0.3793, test_loss: 1.5884, test_f1: 0.6200
 epoch: 71, train_loss: 0.3573, test_loss: 1.6757, test_f1: 0.6186
 epoch: 72, train_loss: 0.3808, test_loss: 1.6517, test_f1: 0.6027
 epoch: 73, train_loss: 0.4002, test_loss: 1.7766, test_f1: 0.5867
 epoch: 74, train_loss: 0.3782, test_loss: 1.7048, test_f1: 0.6138
 epoch: 75, train_loss: 0.3751, test_loss: 1.9073, test_f1: 0.6239
 epoch: 76, train_loss: 0.3717, test_loss: 1.8001, test_f1: 0.5700
 epoch: 77, train_loss: 0.3794, test_loss: 1.7245, test_f1: 0.5823
 epoch: 78, train_loss: 0.3588, test_loss: 1.7521, test_f1: 0.6139
 epoch: 79, train_loss: 0.3697, test_loss: 1.8255, test_f1: 0.6115
 epoch: 80, train_loss: 0.3466, test_loss: 1.7371, test_f1: 0.6248
 epoch: 81, train_loss: 0.3421, test_loss: 1.8290, test_f1: 0.6379
 epoch: 82, train_loss: 0.3398, test_loss: 1.7361, test_f1: 0.6178
 epoch: 83, train_loss: 0.3735, test_loss: 1.4399, test_f1: 0.6398
 epoch: 84, train_loss: 0.4048, test_loss: 1.4649, test_f1: 0.6356
 epoch: 85, train_loss: 0.3663, test_loss: 1.5423, test_f1: 0.6337
 epoch: 86, train_loss: 0.3532, test_loss: 1.6854, test_f1: 0.6247
 epoch: 87, train_loss: 0.3416, test_loss: 1.7321, test_f1: 0.5996
 epoch: 88, train_loss: 0.3485, test_loss: 1.7333, test_f1: 0.6257
 epoch: 89, train_loss: 0.3399, test_loss: 1.7705, test_f1: 0.6244
 epoch: 90, train_loss: 0.3237, test_loss: 1.8050, test_f1: 0.6437
 epoch: 91, train_loss: 0.3175, test_loss: 1.8503, test_f1: 0.6260
 epoch: 92, train_loss: 0.3427, test_loss: 1.8331, test_f1: 0.6223
 epoch: 93, train_loss: 0.3229, test_loss: 1.9177, test_f1: 0.6201
 epoch: 94, train_loss: 0.3144, test_loss: 1.9700, test_f1: 0.5840
 epoch: 95, train_loss: 0.3065, test_loss: 1.9989, test_f1: 0.5991
 epoch: 96, train_loss: 0.3096, test_loss: 2.0400, test_f1: 0.5678
 epoch: 97, train_loss: 0.3116, test_loss: 2.0433, test_f1: 0.6149
 epoch: 98, train_loss: 0.3053, test_loss: 1.9646, test_f1: 0.6056
 epoch: 99, train_loss: 0.3084, test_loss: 2.0815, test_f1: 0.6037
##################ITERATION #8 ****************************************
 epoch: 0, train_loss: 1.2665, test_loss: 1.3019, test_f1: 0.1365
 epoch: 1, train_loss: 1.0517, test_loss: 1.3176, test_f1: 0.2282
 epoch: 2, train_loss: 1.0155, test_loss: 1.3559, test_f1: 0.2774
 epoch: 3, train_loss: 0.9851, test_loss: 1.3412, test_f1: 0.2885
 epoch: 4, train_loss: 0.9596, test_loss: 1.2837, test_f1: 0.3079
 epoch: 5, train_loss: 0.9185, test_loss: 1.1902, test_f1: 0.3281
 epoch: 6, train_loss: 0.8993, test_loss: 1.1455, test_f1: 0.4089
 epoch: 7, train_loss: 0.8947, test_loss: 1.1383, test_f1: 0.4241
 epoch: 8, train_loss: 0.8628, test_loss: 1.0764, test_f1: 0.4506
 epoch: 9, train_loss: 0.8562, test_loss: 1.1311, test_f1: 0.4929
 epoch: 10, train_loss: 0.8249, test_loss: 1.1091, test_f1: 0.5567
 epoch: 11, train_loss: 0.8379, test_loss: 1.0288, test_f1: 0.5675
 epoch: 12, train_loss: 0.8277, test_loss: 1.0109, test_f1: 0.6113
 epoch: 13, train_loss: 0.8282, test_loss: 1.0412, test_f1: 0.5699
 epoch: 14, train_loss: 0.8040, test_loss: 0.9868, test_f1: 0.6285
 epoch: 15, train_loss: 0.7890, test_loss: 1.0478, test_f1: 0.5910
 epoch: 16, train_loss: 0.7836, test_loss: 1.0693, test_f1: 0.5903
 epoch: 17, train_loss: 0.7787, test_loss: 1.0588, test_f1: 0.5834
 epoch: 18, train_loss: 0.7627, test_loss: 1.0441, test_f1: 0.5599
 epoch: 19, train_loss: 0.7648, test_loss: 1.0776, test_f1: 0.5836
 epoch: 20, train_loss: 0.7380, test_loss: 1.0712, test_f1: 0.5983
 epoch: 21, train_loss: 0.7153, test_loss: 1.0646, test_f1: 0.6378
 epoch: 22, train_loss: 0.7030, test_loss: 1.1079, test_f1: 0.5954
 epoch: 23, train_loss: 0.6940, test_loss: 1.1408, test_f1: 0.5664
 epoch: 24, train_loss: 0.7010, test_loss: 1.1049, test_f1: 0.5721
 epoch: 25, train_loss: 0.6843, test_loss: 1.2074, test_f1: 0.5152
 epoch: 26, train_loss: 0.6875, test_loss: 1.1262, test_f1: 0.6167
 epoch: 27, train_loss: 0.7266, test_loss: 1.0257, test_f1: 0.5788
 epoch: 28, train_loss: 0.6833, test_loss: 1.1272, test_f1: 0.5798
 epoch: 29, train_loss: 0.6600, test_loss: 1.1851, test_f1: 0.5487
 epoch: 30, train_loss: 0.6515, test_loss: 1.1111, test_f1: 0.6037
 epoch: 31, train_loss: 0.6267, test_loss: 1.2659, test_f1: 0.5079
 epoch: 32, train_loss: 0.6216, test_loss: 1.2504, test_f1: 0.6150
 epoch: 33, train_loss: 0.6159, test_loss: 1.3051, test_f1: 0.5438
 epoch: 34, train_loss: 0.6160, test_loss: 1.2479, test_f1: 0.6062
 epoch: 35, train_loss: 0.6069, test_loss: 1.4603, test_f1: 0.5458
 epoch: 36, train_loss: 0.5886, test_loss: 1.1771, test_f1: 0.5720
 epoch: 37, train_loss: 0.5976, test_loss: 1.2927, test_f1: 0.5672
 epoch: 38, train_loss: 0.5940, test_loss: 1.2328, test_f1: 0.6304
 epoch: 39, train_loss: 0.6207, test_loss: 1.3965, test_f1: 0.5805
 epoch: 40, train_loss: 0.5746, test_loss: 1.2777, test_f1: 0.5631
 epoch: 41, train_loss: 0.5810, test_loss: 1.2748, test_f1: 0.5944
 epoch: 42, train_loss: 0.5517, test_loss: 1.3330, test_f1: 0.5571
 epoch: 43, train_loss: 0.5646, test_loss: 1.2375, test_f1: 0.5768
 epoch: 44, train_loss: 0.5178, test_loss: 1.3234, test_f1: 0.5799
 epoch: 45, train_loss: 0.5022, test_loss: 1.3418, test_f1: 0.5728
 epoch: 46, train_loss: 0.5143, test_loss: 1.4238, test_f1: 0.5665
 epoch: 47, train_loss: 0.4959, test_loss: 1.4506, test_f1: 0.5652
 epoch: 48, train_loss: 0.4825, test_loss: 1.5604, test_f1: 0.5369
 epoch: 49, train_loss: 0.5334, test_loss: 1.3818, test_f1: 0.5306
 epoch: 50, train_loss: 0.5342, test_loss: 1.4304, test_f1: 0.5878
 epoch: 51, train_loss: 0.5205, test_loss: 1.4315, test_f1: 0.5821
 epoch: 52, train_loss: 0.4730, test_loss: 1.3561, test_f1: 0.5827
 epoch: 53, train_loss: 0.4522, test_loss: 1.4741, test_f1: 0.5997
 epoch: 54, train_loss: 0.4450, test_loss: 1.4777, test_f1: 0.6085
 epoch: 55, train_loss: 0.4244, test_loss: 1.3742, test_f1: 0.6062
 epoch: 56, train_loss: 0.4380, test_loss: 1.4290, test_f1: 0.5942
 epoch: 57, train_loss: 0.4149, test_loss: 1.4894, test_f1: 0.5907
 epoch: 58, train_loss: 0.4043, test_loss: 1.5488, test_f1: 0.5850
 epoch: 59, train_loss: 0.4063, test_loss: 1.6140, test_f1: 0.5807
 epoch: 60, train_loss: 0.3841, test_loss: 1.6203, test_f1: 0.6124
 epoch: 61, train_loss: 0.3955, test_loss: 1.6009, test_f1: 0.5848
 epoch: 62, train_loss: 0.3960, test_loss: 1.7309, test_f1: 0.5673
 epoch: 63, train_loss: 0.3776, test_loss: 1.6479, test_f1: 0.5767
 epoch: 64, train_loss: 0.3739, test_loss: 1.6458, test_f1: 0.6170
 epoch: 65, train_loss: 0.3815, test_loss: 1.7170, test_f1: 0.6098
 epoch: 66, train_loss: 0.3738, test_loss: 1.6867, test_f1: 0.5845
 epoch: 67, train_loss: 0.3728, test_loss: 1.7172, test_f1: 0.5815
 epoch: 68, train_loss: 0.3748, test_loss: 1.8524, test_f1: 0.5845
 epoch: 69, train_loss: 0.3664, test_loss: 1.7747, test_f1: 0.5960
 epoch: 70, train_loss: 0.3684, test_loss: 1.7849, test_f1: 0.5863
 epoch: 71, train_loss: 0.3680, test_loss: 1.6453, test_f1: 0.5910
 epoch: 72, train_loss: 0.3326, test_loss: 1.6920, test_f1: 0.5931
 epoch: 73, train_loss: 0.3663, test_loss: 1.7634, test_f1: 0.5865
 epoch: 74, train_loss: 0.3387, test_loss: 1.6671, test_f1: 0.6039
 epoch: 75, train_loss: 0.3317, test_loss: 1.8221, test_f1: 0.6116
 epoch: 76, train_loss: 0.3294, test_loss: 2.0037, test_f1: 0.5741
 epoch: 77, train_loss: 0.3258, test_loss: 1.9092, test_f1: 0.5830
 epoch: 78, train_loss: 0.3701, test_loss: 1.8378, test_f1: 0.5751
 epoch: 79, train_loss: 0.3598, test_loss: 1.9924, test_f1: 0.5761
 epoch: 80, train_loss: 0.3638, test_loss: 1.8904, test_f1: 0.5838
 epoch: 81, train_loss: 0.3534, test_loss: 1.9083, test_f1: 0.6143
 epoch: 82, train_loss: 0.3331, test_loss: 2.0050, test_f1: 0.5625
 epoch: 83, train_loss: 0.3289, test_loss: 1.8993, test_f1: 0.5741
 epoch: 84, train_loss: 0.3425, test_loss: 1.8566, test_f1: 0.5817
 epoch: 85, train_loss: 0.3094, test_loss: 1.9355, test_f1: 0.5810
 epoch: 86, train_loss: 0.3442, test_loss: 1.8844, test_f1: 0.5863
 epoch: 87, train_loss: 0.3229, test_loss: 1.7844, test_f1: 0.6285
 epoch: 88, train_loss: 0.3246, test_loss: 2.0704, test_f1: 0.5960
 epoch: 89, train_loss: 0.3055, test_loss: 2.1907, test_f1: 0.5827
 epoch: 90, train_loss: 0.2948, test_loss: 2.0404, test_f1: 0.5828
 epoch: 91, train_loss: 0.3033, test_loss: 1.9769, test_f1: 0.5817
 epoch: 92, train_loss: 0.3215, test_loss: 2.0188, test_f1: 0.5686
 epoch: 93, train_loss: 0.3063, test_loss: 2.0066, test_f1: 0.5733
 epoch: 94, train_loss: 0.2854, test_loss: 2.0872, test_f1: 0.5791
 epoch: 95, train_loss: 0.3182, test_loss: 2.1128, test_f1: 0.6108
 epoch: 96, train_loss: 0.3372, test_loss: 2.1693, test_f1: 0.5817
 epoch: 97, train_loss: 0.2891, test_loss: 2.2636, test_f1: 0.5766
 epoch: 98, train_loss: 0.2962, test_loss: 2.1593, test_f1: 0.6030
 epoch: 99, train_loss: 0.2714, test_loss: 2.1470, test_f1: 0.6063
##################ITERATION #9 ****************************************
 epoch: 0, train_loss: 1.3217, test_loss: 1.3273, test_f1: 0.1365
 epoch: 1, train_loss: 1.1088, test_loss: 1.3010, test_f1: 0.1365
 epoch: 2, train_loss: 1.0081, test_loss: 1.2443, test_f1: 0.2139
 epoch: 3, train_loss: 0.9833, test_loss: 1.2042, test_f1: 0.3531
 epoch: 4, train_loss: 0.9388, test_loss: 1.2104, test_f1: 0.2865
 epoch: 5, train_loss: 0.9116, test_loss: 1.1879, test_f1: 0.3214
 epoch: 6, train_loss: 0.8811, test_loss: 1.1319, test_f1: 0.3947
 epoch: 7, train_loss: 0.8721, test_loss: 1.0477, test_f1: 0.4894
 epoch: 8, train_loss: 0.8586, test_loss: 1.0467, test_f1: 0.4962
 epoch: 9, train_loss: 0.8430, test_loss: 1.0050, test_f1: 0.5477
 epoch: 10, train_loss: 0.8044, test_loss: 1.0029, test_f1: 0.5761
 epoch: 11, train_loss: 0.8062, test_loss: 1.0557, test_f1: 0.5970
 epoch: 12, train_loss: 0.7913, test_loss: 1.0057, test_f1: 0.5888
 epoch: 13, train_loss: 0.7875, test_loss: 1.0106, test_f1: 0.5915
 epoch: 14, train_loss: 0.7571, test_loss: 1.0260, test_f1: 0.5918
 epoch: 15, train_loss: 0.7609, test_loss: 1.0577, test_f1: 0.5687
 epoch: 16, train_loss: 0.7524, test_loss: 1.0794, test_f1: 0.5688
 epoch: 17, train_loss: 0.7542, test_loss: 0.9929, test_f1: 0.5827
 epoch: 18, train_loss: 0.7285, test_loss: 1.0593, test_f1: 0.6084
 epoch: 19, train_loss: 0.7190, test_loss: 1.1589, test_f1: 0.5425
 epoch: 20, train_loss: 0.7114, test_loss: 1.1809, test_f1: 0.5732
 epoch: 21, train_loss: 0.6893, test_loss: 1.1835, test_f1: 0.5556
 epoch: 22, train_loss: 0.6647, test_loss: 1.0766, test_f1: 0.5569
 epoch: 23, train_loss: 0.6662, test_loss: 1.1662, test_f1: 0.5740
 epoch: 24, train_loss: 0.6687, test_loss: 1.1204, test_f1: 0.5767
 epoch: 25, train_loss: 0.6637, test_loss: 1.0915, test_f1: 0.5990
 epoch: 26, train_loss: 0.6592, test_loss: 1.1632, test_f1: 0.6155
 epoch: 27, train_loss: 0.6992, test_loss: 1.2142, test_f1: 0.6122
 epoch: 28, train_loss: 0.6633, test_loss: 1.1466, test_f1: 0.5919
 epoch: 29, train_loss: 0.6610, test_loss: 1.1781, test_f1: 0.5533
 epoch: 30, train_loss: 0.6160, test_loss: 1.2697, test_f1: 0.5692
 epoch: 31, train_loss: 0.6209, test_loss: 1.2260, test_f1: 0.6147
 epoch: 32, train_loss: 0.5876, test_loss: 1.2933, test_f1: 0.6245
 epoch: 33, train_loss: 0.6258, test_loss: 1.3425, test_f1: 0.5656
 epoch: 34, train_loss: 0.6034, test_loss: 1.3342, test_f1: 0.5763
 epoch: 35, train_loss: 0.5901, test_loss: 1.3062, test_f1: 0.5904
 epoch: 36, train_loss: 0.5765, test_loss: 1.2614, test_f1: 0.5755
 epoch: 37, train_loss: 0.5554, test_loss: 1.2157, test_f1: 0.6109
 epoch: 38, train_loss: 0.5777, test_loss: 1.2242, test_f1: 0.6041
 epoch: 39, train_loss: 0.5483, test_loss: 1.2985, test_f1: 0.5935
 epoch: 40, train_loss: 0.5374, test_loss: 1.2344, test_f1: 0.6192
 epoch: 41, train_loss: 0.5264, test_loss: 1.4668, test_f1: 0.5508
 epoch: 42, train_loss: 0.5189, test_loss: 1.4178, test_f1: 0.5853
 epoch: 43, train_loss: 0.5338, test_loss: 1.4955, test_f1: 0.5976
 epoch: 44, train_loss: 0.5519, test_loss: 1.3972, test_f1: 0.6132
 epoch: 45, train_loss: 0.5303, test_loss: 1.3497, test_f1: 0.6195
 epoch: 46, train_loss: 0.5250, test_loss: 1.3029, test_f1: 0.5864
 epoch: 47, train_loss: 0.5509, test_loss: 1.3923, test_f1: 0.5770
 epoch: 48, train_loss: 0.5250, test_loss: 1.3900, test_f1: 0.5929
 epoch: 49, train_loss: 0.5472, test_loss: 1.5687, test_f1: 0.6015
 epoch: 50, train_loss: 0.5031, test_loss: 1.5492, test_f1: 0.6075
 epoch: 51, train_loss: 0.4565, test_loss: 1.4331, test_f1: 0.6172
 epoch: 52, train_loss: 0.4681, test_loss: 1.5058, test_f1: 0.5922
 epoch: 53, train_loss: 0.4794, test_loss: 1.6243, test_f1: 0.5663
 epoch: 54, train_loss: 0.4571, test_loss: 1.5504, test_f1: 0.5750
 epoch: 55, train_loss: 0.4289, test_loss: 1.4690, test_f1: 0.5817
 epoch: 56, train_loss: 0.4134, test_loss: 1.4471, test_f1: 0.5993
 epoch: 57, train_loss: 0.4036, test_loss: 1.4259, test_f1: 0.6033
 epoch: 58, train_loss: 0.3825, test_loss: 1.4482, test_f1: 0.6179
 epoch: 59, train_loss: 0.3890, test_loss: 1.5510, test_f1: 0.6044
 epoch: 60, train_loss: 0.3828, test_loss: 1.5393, test_f1: 0.6070
 epoch: 61, train_loss: 0.3581, test_loss: 1.5821, test_f1: 0.6159
 epoch: 62, train_loss: 0.3799, test_loss: 1.5466, test_f1: 0.6167
 epoch: 63, train_loss: 0.3722, test_loss: 1.4820, test_f1: 0.6503
 epoch: 64, train_loss: 0.3785, test_loss: 1.6904, test_f1: 0.5955
 epoch: 65, train_loss: 0.3737, test_loss: 1.8097, test_f1: 0.5642
 epoch: 66, train_loss: 0.3493, test_loss: 1.7277, test_f1: 0.5877
 epoch: 67, train_loss: 0.3628, test_loss: 1.7008, test_f1: 0.5894
 epoch: 68, train_loss: 0.3390, test_loss: 1.8138, test_f1: 0.5832
 epoch: 69, train_loss: 0.3581, test_loss: 1.9468, test_f1: 0.5786
 epoch: 70, train_loss: 0.3526, test_loss: 1.8294, test_f1: 0.5795
 epoch: 71, train_loss: 0.3290, test_loss: 1.8577, test_f1: 0.6132
 epoch: 72, train_loss: 0.3309, test_loss: 1.8673, test_f1: 0.6051
 epoch: 73, train_loss: 0.3430, test_loss: 1.9938, test_f1: 0.5870
 epoch: 74, train_loss: 0.3238, test_loss: 1.8642, test_f1: 0.5984
 epoch: 75, train_loss: 0.3156, test_loss: 1.6384, test_f1: 0.6344
 epoch: 76, train_loss: 0.3372, test_loss: 1.6798, test_f1: 0.6119
 epoch: 77, train_loss: 0.3137, test_loss: 1.6974, test_f1: 0.6000
 epoch: 78, train_loss: 0.3036, test_loss: 1.7449, test_f1: 0.6363
 epoch: 79, train_loss: 0.2949, test_loss: 1.7435, test_f1: 0.6327
 epoch: 80, train_loss: 0.2919, test_loss: 1.9126, test_f1: 0.5872
 epoch: 81, train_loss: 0.2916, test_loss: 1.8892, test_f1: 0.6184
 epoch: 82, train_loss: 0.2865, test_loss: 1.9087, test_f1: 0.6162
 epoch: 83, train_loss: 0.3040, test_loss: 1.8126, test_f1: 0.6465
 epoch: 84, train_loss: 0.2984, test_loss: 1.8801, test_f1: 0.6354
 epoch: 85, train_loss: 0.2757, test_loss: 1.9749, test_f1: 0.6232
 epoch: 86, train_loss: 0.2887, test_loss: 2.1296, test_f1: 0.5995
 epoch: 87, train_loss: 0.3044, test_loss: 1.7569, test_f1: 0.6219
 epoch: 88, train_loss: 0.3154, test_loss: 1.8758, test_f1: 0.6204
 epoch: 89, train_loss: 0.3072, test_loss: 2.1974, test_f1: 0.5830
 epoch: 90, train_loss: 0.3080, test_loss: 2.2570, test_f1: 0.5950
 epoch: 91, train_loss: 0.3082, test_loss: 2.1433, test_f1: 0.6192
 epoch: 92, train_loss: 0.3125, test_loss: 2.1451, test_f1: 0.5773
 epoch: 93, train_loss: 0.3075, test_loss: 2.3648, test_f1: 0.5838
 epoch: 94, train_loss: 0.3194, test_loss: 2.3144, test_f1: 0.5845
 epoch: 95, train_loss: 0.2953, test_loss: 2.2690, test_f1: 0.5596
 epoch: 96, train_loss: 0.2599, test_loss: 2.3635, test_f1: 0.5885
 epoch: 97, train_loss: 0.2729, test_loss: 2.1822, test_f1: 0.6035
 epoch: 98, train_loss: 0.2833, test_loss: 2.0313, test_f1: 0.6030
 epoch: 99, train_loss: 0.2519, test_loss: 2.2584, test_f1: 0.5813

Training completed in 306.32 seconds
Best F1: 0.6556 at epoch 54
Mean F1 across iterations: 0.6412  0.0082
========================FINAL RESULTS================================
FEGIN weighted F1: 0.6556  0.0082
python main.py --data ltspice_demos --representation component_net --model FEGIN --layers 4 --hiddens 128 --batch_size 256 --lr 0.001 --emb_size 128 --epochs 100 --save_appendix component_net_L4_H128_BS256_LR0.001_E128 --no_val
-----



STDERR:
  File "main.py", line 370, in <module>
    main()
  File "main.py", line 254, in main
    dataset = dataset_class(
  File "/home/philip/projects/ltspice_examples_code_repo/Circuit-Completion-Using-GNNs/component_classification_with_link_prediction_head/evaluation/FEGIN/kernel/circuit_datasets.py", line 15, in __init__
    self.data, self.slices = torch.load(self.processed_paths[0])
  File "/home/philip/.local/lib/python3.8/site-packages/torch/serialization.py", line 1040, in load
    warnings.warn(
  File "/usr/lib/python3.8/warnings.py", line 109, in _showwarnmsg
    sw(msg.message, msg.category, msg.filename, msg.lineno,
  File "main.py", line 47, in warn_with_traceback
    traceback.print_stack(file=log)
/home/philip/projects/ltspice_examples_code_repo/Circuit-Completion-Using-GNNs/component_classification_with_link_prediction_head/evaluation/FEGIN/kernel/circuit_datasets.py:15: FutureWarning: You are using `torch.load` with `weights_only=False` (the current default value), which uses the default pickle module implicitly. It is possible to construct malicious pickle data which will execute arbitrary code during unpickling (See https://github.com/pytorch/pytorch/blob/main/SECURITY.md#untrusted-models for more details). In a future release, the default value for `weights_only` will be flipped to `True`. This limits the functions that could be executed during unpickling. Arbitrary objects will no longer be allowed to be loaded via this mode unless they are explicitly allowlisted by the user via `torch.serialization.add_safe_globals`. We recommend you start setting `weights_only=True` for any use case where you don't have full control of the loaded file. Please open an issue on GitHub for any issues related to this experimental feature.
  self.data, self.slices = torch.load(self.processed_paths[0])
