STDOUT:
Results will be saved in /home/philip/projects/ltspice_examples_code_repo/Circuit-Completion-Using-GNNs/component_classification_with_link_prediction_head/evaluation/FEGIN/results/model_FEGIN_dataset_ltspice_examples
Command line input: python main.py --data ltspice_examples --representation component_pin_net --model FEGIN --layers 6 --hiddens 128 --batch_size 32 --lr 0.001 --emb_size 128 --epochs 100 --save_appendix component_pin_net_L6_H128_BS32_LR0.001_E128 --no_val
 is saved.
-----
ltspice_examples - FEGIN
Using 6 layers, 128 hidden units, h = 2
Loading component_pin_net representation dataset
ENTERED
Training FEGIN on component_pin_net representation
Train: 3558, Test: 846
##################ITERATION #0 ****************************************
 epoch: 0, train_loss: 1.1301, test_loss: 1.0572, test_f1: 0.4217
 epoch: 1, train_loss: 0.9990, test_loss: 0.9549, test_f1: 0.4743
 epoch: 2, train_loss: 0.9561, test_loss: 0.9107, test_f1: 0.5623
 epoch: 3, train_loss: 0.9313, test_loss: 0.9317, test_f1: 0.4623
 epoch: 4, train_loss: 0.9115, test_loss: 0.9916, test_f1: 0.5280
 epoch: 5, train_loss: 0.8918, test_loss: 0.9026, test_f1: 0.5306
 epoch: 6, train_loss: 0.8622, test_loss: 0.8387, test_f1: 0.5476
 epoch: 7, train_loss: 0.8477, test_loss: 0.8514, test_f1: 0.5726
 epoch: 8, train_loss: 0.8223, test_loss: 0.8179, test_f1: 0.5692
 epoch: 9, train_loss: 0.7980, test_loss: 0.9314, test_f1: 0.5933
 epoch: 10, train_loss: 0.8003, test_loss: 0.7840, test_f1: 0.6241
 epoch: 11, train_loss: 0.7846, test_loss: 0.8456, test_f1: 0.6063
 epoch: 12, train_loss: 0.7615, test_loss: 0.8066, test_f1: 0.5938
 epoch: 13, train_loss: 0.7477, test_loss: 0.8003, test_f1: 0.5992
 epoch: 14, train_loss: 0.7319, test_loss: 0.7533, test_f1: 0.6442
 epoch: 15, train_loss: 0.7115, test_loss: 0.7266, test_f1: 0.6633
 epoch: 16, train_loss: 0.7058, test_loss: 0.7260, test_f1: 0.5952
 epoch: 17, train_loss: 0.6876, test_loss: 0.8519, test_f1: 0.6118
 epoch: 18, train_loss: 0.6690, test_loss: 0.8258, test_f1: 0.6275
 epoch: 19, train_loss: 0.6682, test_loss: 0.7843, test_f1: 0.6292
 epoch: 20, train_loss: 0.6582, test_loss: 0.7709, test_f1: 0.6553
 epoch: 21, train_loss: 0.6327, test_loss: 0.8419, test_f1: 0.6507
 epoch: 22, train_loss: 0.6218, test_loss: 0.7532, test_f1: 0.6557
 epoch: 23, train_loss: 0.6066, test_loss: 0.7548, test_f1: 0.6514
 epoch: 24, train_loss: 0.6010, test_loss: 0.8021, test_f1: 0.6669
 epoch: 25, train_loss: 0.6000, test_loss: 0.7392, test_f1: 0.6627
 epoch: 26, train_loss: 0.5873, test_loss: 0.7281, test_f1: 0.6829
 epoch: 27, train_loss: 0.5718, test_loss: 0.7961, test_f1: 0.6420
 epoch: 28, train_loss: 0.5594, test_loss: 0.8273, test_f1: 0.6783
 epoch: 29, train_loss: 0.5698, test_loss: 0.9256, test_f1: 0.6551
 epoch: 30, train_loss: 0.5471, test_loss: 0.7607, test_f1: 0.6764
 epoch: 31, train_loss: 0.5453, test_loss: 0.8281, test_f1: 0.6537
 epoch: 32, train_loss: 0.5296, test_loss: 0.9341, test_f1: 0.6806
 epoch: 33, train_loss: 0.5196, test_loss: 0.8139, test_f1: 0.6542
 epoch: 34, train_loss: 0.5305, test_loss: 0.7628, test_f1: 0.6676
 epoch: 35, train_loss: 0.5012, test_loss: 0.7169, test_f1: 0.6834
 epoch: 36, train_loss: 0.5139, test_loss: 0.8399, test_f1: 0.6596
 epoch: 37, train_loss: 0.4958, test_loss: 0.8005, test_f1: 0.6988
 epoch: 38, train_loss: 0.4688, test_loss: 0.8808, test_f1: 0.6903
 epoch: 39, train_loss: 0.4683, test_loss: 0.8051, test_f1: 0.7044
 epoch: 40, train_loss: 0.4778, test_loss: 0.8642, test_f1: 0.6733
 epoch: 41, train_loss: 0.4549, test_loss: 0.8918, test_f1: 0.6634
 epoch: 42, train_loss: 0.4670, test_loss: 0.9454, test_f1: 0.6631
 epoch: 43, train_loss: 0.4595, test_loss: 0.9873, test_f1: 0.6675
 epoch: 44, train_loss: 0.4443, test_loss: 1.0810, test_f1: 0.6560
 epoch: 45, train_loss: 0.4165, test_loss: 0.9439, test_f1: 0.6837
 epoch: 46, train_loss: 0.4238, test_loss: 1.0341, test_f1: 0.6622
 epoch: 47, train_loss: 0.4320, test_loss: 1.0080, test_f1: 0.6677
 epoch: 48, train_loss: 0.4100, test_loss: 0.9451, test_f1: 0.7061
 epoch: 49, train_loss: 0.4286, test_loss: 1.0528, test_f1: 0.6893
 epoch: 50, train_loss: 0.3784, test_loss: 0.9838, test_f1: 0.7156
 epoch: 51, train_loss: 0.3530, test_loss: 0.9981, test_f1: 0.7003
 epoch: 52, train_loss: 0.3286, test_loss: 1.0371, test_f1: 0.7094
 epoch: 53, train_loss: 0.3298, test_loss: 1.1665, test_f1: 0.6909
 epoch: 54, train_loss: 0.3143, test_loss: 1.2281, test_f1: 0.6892
 epoch: 55, train_loss: 0.3198, test_loss: 1.2214, test_f1: 0.7159
 epoch: 56, train_loss: 0.3130, test_loss: 1.1609, test_f1: 0.7025
 epoch: 57, train_loss: 0.3230, test_loss: 0.9804, test_f1: 0.7209
 epoch: 58, train_loss: 0.3113, test_loss: 1.0806, test_f1: 0.7258
 epoch: 59, train_loss: 0.2989, test_loss: 1.1639, test_f1: 0.7064
 epoch: 60, train_loss: 0.2998, test_loss: 1.1976, test_f1: 0.6904
 epoch: 61, train_loss: 0.2801, test_loss: 1.1671, test_f1: 0.7041
 epoch: 62, train_loss: 0.2969, test_loss: 1.1959, test_f1: 0.7006
 epoch: 63, train_loss: 0.2875, test_loss: 1.1134, test_f1: 0.7058
 epoch: 64, train_loss: 0.3008, test_loss: 1.0690, test_f1: 0.6978
 epoch: 65, train_loss: 0.2913, test_loss: 1.1783, test_f1: 0.7177
 epoch: 66, train_loss: 0.2629, test_loss: 1.2681, test_f1: 0.6909
 epoch: 67, train_loss: 0.2760, test_loss: 1.3022, test_f1: 0.7144
 epoch: 68, train_loss: 0.2685, test_loss: 1.2501, test_f1: 0.6926
 epoch: 69, train_loss: 0.2632, test_loss: 1.3087, test_f1: 0.7135
 epoch: 70, train_loss: 0.2638, test_loss: 1.2097, test_f1: 0.6960
 epoch: 71, train_loss: 0.2530, test_loss: 1.2047, test_f1: 0.7231
 epoch: 72, train_loss: 0.2488, test_loss: 1.2206, test_f1: 0.7171
 epoch: 73, train_loss: 0.2467, test_loss: 1.2959, test_f1: 0.7211
 epoch: 74, train_loss: 0.2531, test_loss: 1.3899, test_f1: 0.7167
 epoch: 75, train_loss: 0.2501, test_loss: 1.3170, test_f1: 0.7099
 epoch: 76, train_loss: 0.2345, test_loss: 1.4174, test_f1: 0.7109
 epoch: 77, train_loss: 0.2386, test_loss: 1.3544, test_f1: 0.7166
 epoch: 78, train_loss: 0.2455, test_loss: 1.3125, test_f1: 0.7156
 epoch: 79, train_loss: 0.2400, test_loss: 1.2363, test_f1: 0.7196
 epoch: 80, train_loss: 0.2299, test_loss: 1.3674, test_f1: 0.7032
 epoch: 81, train_loss: 0.2306, test_loss: 1.3097, test_f1: 0.7223
 epoch: 82, train_loss: 0.2437, test_loss: 1.3669, test_f1: 0.7154
 epoch: 83, train_loss: 0.2140, test_loss: 1.4056, test_f1: 0.7051
 epoch: 84, train_loss: 0.2248, test_loss: 1.3653, test_f1: 0.7208
 epoch: 85, train_loss: 0.2192, test_loss: 1.3359, test_f1: 0.7202
 epoch: 86, train_loss: 0.2410, test_loss: 1.2683, test_f1: 0.7229
 epoch: 87, train_loss: 0.2214, test_loss: 1.3533, test_f1: 0.7166
 epoch: 88, train_loss: 0.2112, test_loss: 1.3042, test_f1: 0.7307
 epoch: 89, train_loss: 0.2168, test_loss: 1.4362, test_f1: 0.6908
 epoch: 90, train_loss: 0.1882, test_loss: 1.4524, test_f1: 0.7166
 epoch: 91, train_loss: 0.2088, test_loss: 1.5494, test_f1: 0.7047
 epoch: 92, train_loss: 0.2005, test_loss: 1.3547, test_f1: 0.7227
 epoch: 93, train_loss: 0.2224, test_loss: 1.3854, test_f1: 0.7176
 epoch: 94, train_loss: 0.2077, test_loss: 1.3658, test_f1: 0.7238
 epoch: 95, train_loss: 0.2040, test_loss: 1.4283, test_f1: 0.7215
 epoch: 96, train_loss: 0.2029, test_loss: 1.5835, test_f1: 0.6930
 epoch: 97, train_loss: 0.1961, test_loss: 1.4466, test_f1: 0.7080
 epoch: 98, train_loss: 0.1836, test_loss: 1.5603, test_f1: 0.7032
 epoch: 99, train_loss: 0.1918, test_loss: 1.6354, test_f1: 0.6814
##################ITERATION #1 ****************************************
 epoch: 0, train_loss: 1.0737, test_loss: 1.0348, test_f1: 0.4672
 epoch: 1, train_loss: 0.9541, test_loss: 0.8896, test_f1: 0.5099
 epoch: 2, train_loss: 0.9261, test_loss: 0.8729, test_f1: 0.5344
 epoch: 3, train_loss: 0.8925, test_loss: 0.8502, test_f1: 0.5181
 epoch: 4, train_loss: 0.8684, test_loss: 0.8540, test_f1: 0.5758
 epoch: 5, train_loss: 0.8315, test_loss: 0.8872, test_f1: 0.5554
 epoch: 6, train_loss: 0.8152, test_loss: 0.7764, test_f1: 0.6168
 epoch: 7, train_loss: 0.7947, test_loss: 0.8671, test_f1: 0.5817
 epoch: 8, train_loss: 0.7830, test_loss: 0.8161, test_f1: 0.6189
 epoch: 9, train_loss: 0.7762, test_loss: 0.7939, test_f1: 0.6592
 epoch: 10, train_loss: 0.7497, test_loss: 0.7618, test_f1: 0.6304
 epoch: 11, train_loss: 0.7378, test_loss: 0.8569, test_f1: 0.6117
 epoch: 12, train_loss: 0.7112, test_loss: 0.7444, test_f1: 0.6510
 epoch: 13, train_loss: 0.7122, test_loss: 0.7024, test_f1: 0.6550
 epoch: 14, train_loss: 0.7013, test_loss: 0.7133, test_f1: 0.6483
 epoch: 15, train_loss: 0.6682, test_loss: 0.7593, test_f1: 0.6700
 epoch: 16, train_loss: 0.6761, test_loss: 0.7704, test_f1: 0.6652
 epoch: 17, train_loss: 0.6643, test_loss: 0.7921, test_f1: 0.6554
 epoch: 18, train_loss: 0.6538, test_loss: 0.7252, test_f1: 0.6622
 epoch: 19, train_loss: 0.6357, test_loss: 0.7009, test_f1: 0.6732
 epoch: 20, train_loss: 0.6161, test_loss: 0.7028, test_f1: 0.6731
 epoch: 21, train_loss: 0.6108, test_loss: 0.7626, test_f1: 0.6629
 epoch: 22, train_loss: 0.5952, test_loss: 0.7826, test_f1: 0.6579
 epoch: 23, train_loss: 0.5886, test_loss: 0.8174, test_f1: 0.6745
 epoch: 24, train_loss: 0.5794, test_loss: 0.8044, test_f1: 0.6761
 epoch: 25, train_loss: 0.5539, test_loss: 0.7867, test_f1: 0.6673
 epoch: 26, train_loss: 0.5543, test_loss: 0.8227, test_f1: 0.6869
 epoch: 27, train_loss: 0.5420, test_loss: 0.7564, test_f1: 0.6543
 epoch: 28, train_loss: 0.5348, test_loss: 0.8341, test_f1: 0.6708
 epoch: 29, train_loss: 0.5225, test_loss: 0.7300, test_f1: 0.6974
 epoch: 30, train_loss: 0.5246, test_loss: 0.7016, test_f1: 0.6688
 epoch: 31, train_loss: 0.5129, test_loss: 0.7828, test_f1: 0.6900
 epoch: 32, train_loss: 0.5031, test_loss: 0.7755, test_f1: 0.6575
 epoch: 33, train_loss: 0.4880, test_loss: 0.9094, test_f1: 0.6623
 epoch: 34, train_loss: 0.5062, test_loss: 0.8061, test_f1: 0.6657
 epoch: 35, train_loss: 0.4576, test_loss: 0.8689, test_f1: 0.6743
 epoch: 36, train_loss: 0.4787, test_loss: 0.9040, test_f1: 0.6804
 epoch: 37, train_loss: 0.4736, test_loss: 0.9028, test_f1: 0.6891
 epoch: 38, train_loss: 0.4669, test_loss: 0.8325, test_f1: 0.6798
 epoch: 39, train_loss: 0.4337, test_loss: 1.0177, test_f1: 0.6266
 epoch: 40, train_loss: 0.4526, test_loss: 0.8605, test_f1: 0.6842
 epoch: 41, train_loss: 0.4427, test_loss: 0.8422, test_f1: 0.6681
 epoch: 42, train_loss: 0.4273, test_loss: 0.8029, test_f1: 0.6962
 epoch: 43, train_loss: 0.4120, test_loss: 0.8609, test_f1: 0.7083
 epoch: 44, train_loss: 0.4173, test_loss: 0.9382, test_f1: 0.6920
 epoch: 45, train_loss: 0.4041, test_loss: 0.9499, test_f1: 0.6828
 epoch: 46, train_loss: 0.3900, test_loss: 0.9534, test_f1: 0.6753
 epoch: 47, train_loss: 0.3910, test_loss: 0.8537, test_f1: 0.6918
 epoch: 48, train_loss: 0.4013, test_loss: 0.9789, test_f1: 0.6557
 epoch: 49, train_loss: 0.3987, test_loss: 0.8755, test_f1: 0.6866
 epoch: 50, train_loss: 0.3802, test_loss: 0.9425, test_f1: 0.6666
 epoch: 51, train_loss: 0.3248, test_loss: 0.9864, test_f1: 0.6740
 epoch: 52, train_loss: 0.3041, test_loss: 0.9962, test_f1: 0.6762
 epoch: 53, train_loss: 0.3130, test_loss: 1.0358, test_f1: 0.6670
 epoch: 54, train_loss: 0.2965, test_loss: 1.1148, test_f1: 0.6604
 epoch: 55, train_loss: 0.2981, test_loss: 1.1149, test_f1: 0.6815
 epoch: 56, train_loss: 0.2709, test_loss: 1.1436, test_f1: 0.6686
 epoch: 57, train_loss: 0.2748, test_loss: 1.0941, test_f1: 0.6909
 epoch: 58, train_loss: 0.2675, test_loss: 1.2253, test_f1: 0.6730
 epoch: 59, train_loss: 0.2653, test_loss: 1.0763, test_f1: 0.7053
 epoch: 60, train_loss: 0.2484, test_loss: 1.1175, test_f1: 0.7004
 epoch: 61, train_loss: 0.2479, test_loss: 1.2076, test_f1: 0.6743
 epoch: 62, train_loss: 0.2741, test_loss: 1.3273, test_f1: 0.6586
 epoch: 63, train_loss: 0.2491, test_loss: 1.3305, test_f1: 0.6867
 epoch: 64, train_loss: 0.2613, test_loss: 1.3056, test_f1: 0.6697
 epoch: 65, train_loss: 0.2403, test_loss: 1.3101, test_f1: 0.6606
 epoch: 66, train_loss: 0.2490, test_loss: 1.2948, test_f1: 0.6706
 epoch: 67, train_loss: 0.2193, test_loss: 1.3258, test_f1: 0.6704
 epoch: 68, train_loss: 0.2474, test_loss: 1.3551, test_f1: 0.6726
 epoch: 69, train_loss: 0.2363, test_loss: 1.5327, test_f1: 0.6742
 epoch: 70, train_loss: 0.2321, test_loss: 1.4185, test_f1: 0.6747
 epoch: 71, train_loss: 0.2462, test_loss: 1.3951, test_f1: 0.6719
 epoch: 72, train_loss: 0.2214, test_loss: 1.5377, test_f1: 0.6641
 epoch: 73, train_loss: 0.2200, test_loss: 1.3732, test_f1: 0.6747
 epoch: 74, train_loss: 0.2299, test_loss: 1.4355, test_f1: 0.6692
 epoch: 75, train_loss: 0.2579, test_loss: 1.3388, test_f1: 0.6760
 epoch: 76, train_loss: 0.1938, test_loss: 1.4651, test_f1: 0.6567
 epoch: 77, train_loss: 0.2089, test_loss: 1.2709, test_f1: 0.6786
 epoch: 78, train_loss: 0.2090, test_loss: 1.4050, test_f1: 0.6604
 epoch: 79, train_loss: 0.2108, test_loss: 1.3713, test_f1: 0.6697
 epoch: 80, train_loss: 0.2187, test_loss: 1.3694, test_f1: 0.6806
 epoch: 81, train_loss: 0.2180, test_loss: 1.4520, test_f1: 0.6512
 epoch: 82, train_loss: 0.1962, test_loss: 1.5071, test_f1: 0.6757
 epoch: 83, train_loss: 0.1999, test_loss: 1.4589, test_f1: 0.6564
 epoch: 84, train_loss: 0.1886, test_loss: 1.6044, test_f1: 0.6665
 epoch: 85, train_loss: 0.1965, test_loss: 1.4739, test_f1: 0.6615
 epoch: 86, train_loss: 0.1794, test_loss: 1.5621, test_f1: 0.6649
 epoch: 87, train_loss: 0.1782, test_loss: 1.5317, test_f1: 0.6751
 epoch: 88, train_loss: 0.1770, test_loss: 1.4724, test_f1: 0.6694
 epoch: 89, train_loss: 0.1713, test_loss: 1.6966, test_f1: 0.6673
 epoch: 90, train_loss: 0.1677, test_loss: 1.7594, test_f1: 0.6696
 epoch: 91, train_loss: 0.2143, test_loss: 1.4428, test_f1: 0.6798
 epoch: 92, train_loss: 0.1809, test_loss: 1.2915, test_f1: 0.6895
 epoch: 93, train_loss: 0.1737, test_loss: 1.5324, test_f1: 0.6847
 epoch: 94, train_loss: 0.1704, test_loss: 1.5699, test_f1: 0.6681
 epoch: 95, train_loss: 0.1769, test_loss: 1.6029, test_f1: 0.6851
 epoch: 96, train_loss: 0.1655, test_loss: 1.8226, test_f1: 0.6725
 epoch: 97, train_loss: 0.1750, test_loss: 1.7037, test_f1: 0.6770
 epoch: 98, train_loss: 0.1751, test_loss: 1.6258, test_f1: 0.6686
 epoch: 99, train_loss: 0.1523, test_loss: 1.6331, test_f1: 0.6881
##################ITERATION #2 ****************************************
 epoch: 0, train_loss: 1.1083, test_loss: 0.9689, test_f1: 0.5096
 epoch: 1, train_loss: 0.9463, test_loss: 0.8796, test_f1: 0.5029
 epoch: 2, train_loss: 0.9153, test_loss: 0.8940, test_f1: 0.5386
 epoch: 3, train_loss: 0.8870, test_loss: 0.8455, test_f1: 0.5635
 epoch: 4, train_loss: 0.8597, test_loss: 0.8837, test_f1: 0.5705
 epoch: 5, train_loss: 0.8489, test_loss: 0.8266, test_f1: 0.6327
 epoch: 6, train_loss: 0.8070, test_loss: 0.8052, test_f1: 0.5938
 epoch: 7, train_loss: 0.7807, test_loss: 0.7543, test_f1: 0.5941
 epoch: 8, train_loss: 0.7778, test_loss: 0.8659, test_f1: 0.5903
 epoch: 9, train_loss: 0.7609, test_loss: 0.7351, test_f1: 0.6513
 epoch: 10, train_loss: 0.7408, test_loss: 0.7878, test_f1: 0.6395
 epoch: 11, train_loss: 0.7402, test_loss: 0.7680, test_f1: 0.6816
 epoch: 12, train_loss: 0.7107, test_loss: 0.7845, test_f1: 0.6606
 epoch: 13, train_loss: 0.7141, test_loss: 0.7344, test_f1: 0.6457
 epoch: 14, train_loss: 0.6912, test_loss: 0.7488, test_f1: 0.6512
 epoch: 15, train_loss: 0.6776, test_loss: 0.7691, test_f1: 0.6495
 epoch: 16, train_loss: 0.6770, test_loss: 0.7794, test_f1: 0.6197
 epoch: 17, train_loss: 0.6437, test_loss: 0.7366, test_f1: 0.6082
 epoch: 18, train_loss: 0.6408, test_loss: 0.7392, test_f1: 0.6527
 epoch: 19, train_loss: 0.6685, test_loss: 0.7817, test_f1: 0.6379
 epoch: 20, train_loss: 0.6268, test_loss: 0.7096, test_f1: 0.6767
 epoch: 21, train_loss: 0.6067, test_loss: 0.6847, test_f1: 0.6650
 epoch: 22, train_loss: 0.5796, test_loss: 0.6825, test_f1: 0.6686
 epoch: 23, train_loss: 0.5845, test_loss: 0.8058, test_f1: 0.6492
 epoch: 24, train_loss: 0.5591, test_loss: 0.7984, test_f1: 0.6480
 epoch: 25, train_loss: 0.5802, test_loss: 0.7555, test_f1: 0.6908
 epoch: 26, train_loss: 0.5536, test_loss: 0.6963, test_f1: 0.6601
 epoch: 27, train_loss: 0.5368, test_loss: 0.8080, test_f1: 0.6865
 epoch: 28, train_loss: 0.5321, test_loss: 0.6869, test_f1: 0.6732
 epoch: 29, train_loss: 0.5499, test_loss: 0.8283, test_f1: 0.6583
 epoch: 30, train_loss: 0.5189, test_loss: 0.8221, test_f1: 0.6657
 epoch: 31, train_loss: 0.5136, test_loss: 0.7680, test_f1: 0.6811
 epoch: 32, train_loss: 0.5003, test_loss: 0.8169, test_f1: 0.6648
 epoch: 33, train_loss: 0.5018, test_loss: 0.7925, test_f1: 0.6766
 epoch: 34, train_loss: 0.4766, test_loss: 0.7728, test_f1: 0.6939
 epoch: 35, train_loss: 0.4847, test_loss: 0.9156, test_f1: 0.6566
 epoch: 36, train_loss: 0.4892, test_loss: 0.8560, test_f1: 0.6643
 epoch: 37, train_loss: 0.4851, test_loss: 0.8678, test_f1: 0.6410
 epoch: 38, train_loss: 0.4671, test_loss: 0.9289, test_f1: 0.6191
 epoch: 39, train_loss: 0.4736, test_loss: 0.8758, test_f1: 0.6751
 epoch: 40, train_loss: 0.4534, test_loss: 0.9167, test_f1: 0.6807
 epoch: 41, train_loss: 0.4283, test_loss: 0.8811, test_f1: 0.6635
 epoch: 42, train_loss: 0.4395, test_loss: 0.8583, test_f1: 0.7011
 epoch: 43, train_loss: 0.4257, test_loss: 0.9125, test_f1: 0.6662
 epoch: 44, train_loss: 0.4365, test_loss: 0.8233, test_f1: 0.6819
 epoch: 45, train_loss: 0.4332, test_loss: 0.9233, test_f1: 0.6429
 epoch: 46, train_loss: 0.4035, test_loss: 0.9729, test_f1: 0.6653
 epoch: 47, train_loss: 0.4069, test_loss: 0.9319, test_f1: 0.6821
 epoch: 48, train_loss: 0.4060, test_loss: 0.9951, test_f1: 0.6602
 epoch: 49, train_loss: 0.3980, test_loss: 0.9842, test_f1: 0.6608
 epoch: 50, train_loss: 0.3811, test_loss: 0.9186, test_f1: 0.6689
 epoch: 51, train_loss: 0.3553, test_loss: 0.9671, test_f1: 0.6780
 epoch: 52, train_loss: 0.3057, test_loss: 1.0554, test_f1: 0.6741
 epoch: 53, train_loss: 0.3106, test_loss: 1.0648, test_f1: 0.6691
 epoch: 54, train_loss: 0.2993, test_loss: 1.0039, test_f1: 0.6887
 epoch: 55, train_loss: 0.2940, test_loss: 1.1073, test_f1: 0.6803
 epoch: 56, train_loss: 0.2933, test_loss: 1.1127, test_f1: 0.6642
 epoch: 57, train_loss: 0.2939, test_loss: 1.0901, test_f1: 0.6730
 epoch: 58, train_loss: 0.2932, test_loss: 1.0064, test_f1: 0.6830
 epoch: 59, train_loss: 0.2738, test_loss: 1.0878, test_f1: 0.6667
 epoch: 60, train_loss: 0.2706, test_loss: 1.0258, test_f1: 0.6880
 epoch: 61, train_loss: 0.2618, test_loss: 1.0963, test_f1: 0.6706
 epoch: 62, train_loss: 0.2588, test_loss: 1.2011, test_f1: 0.6492
 epoch: 63, train_loss: 0.2819, test_loss: 1.0970, test_f1: 0.6505
 epoch: 64, train_loss: 0.2647, test_loss: 1.0849, test_f1: 0.6740
 epoch: 65, train_loss: 0.2325, test_loss: 1.3296, test_f1: 0.6547
 epoch: 66, train_loss: 0.2530, test_loss: 1.1084, test_f1: 0.6817
 epoch: 67, train_loss: 0.2643, test_loss: 1.2238, test_f1: 0.6765
 epoch: 68, train_loss: 0.2587, test_loss: 1.1432, test_f1: 0.6666
 epoch: 69, train_loss: 0.2466, test_loss: 1.1773, test_f1: 0.6697
 epoch: 70, train_loss: 0.2375, test_loss: 1.0677, test_f1: 0.6774
 epoch: 71, train_loss: 0.2490, test_loss: 1.1660, test_f1: 0.6800
 epoch: 72, train_loss: 0.2346, test_loss: 1.1708, test_f1: 0.6602
 epoch: 73, train_loss: 0.2435, test_loss: 1.2408, test_f1: 0.6511
 epoch: 74, train_loss: 0.2295, test_loss: 1.3062, test_f1: 0.6555
 epoch: 75, train_loss: 0.2194, test_loss: 1.2854, test_f1: 0.6655
 epoch: 76, train_loss: 0.2275, test_loss: 1.3672, test_f1: 0.6610
 epoch: 77, train_loss: 0.2141, test_loss: 1.4194, test_f1: 0.6644
 epoch: 78, train_loss: 0.2076, test_loss: 1.4354, test_f1: 0.6552
 epoch: 79, train_loss: 0.2330, test_loss: 1.3233, test_f1: 0.6516
 epoch: 80, train_loss: 0.2067, test_loss: 1.1930, test_f1: 0.6713
 epoch: 81, train_loss: 0.1883, test_loss: 1.3253, test_f1: 0.6543
 epoch: 82, train_loss: 0.2081, test_loss: 1.4194, test_f1: 0.6582
 epoch: 83, train_loss: 0.2469, test_loss: 1.2439, test_f1: 0.6713
 epoch: 84, train_loss: 0.2162, test_loss: 1.2797, test_f1: 0.6693
 epoch: 85, train_loss: 0.2059, test_loss: 1.4628, test_f1: 0.6632
 epoch: 86, train_loss: 0.1968, test_loss: 1.3988, test_f1: 0.6752
 epoch: 87, train_loss: 0.1978, test_loss: 1.3812, test_f1: 0.6682
 epoch: 88, train_loss: 0.1878, test_loss: 1.4085, test_f1: 0.6654
 epoch: 89, train_loss: 0.1858, test_loss: 1.3834, test_f1: 0.6465
 epoch: 90, train_loss: 0.1994, test_loss: 1.3159, test_f1: 0.6512
 epoch: 91, train_loss: 0.1941, test_loss: 1.3519, test_f1: 0.6647
 epoch: 92, train_loss: 0.1947, test_loss: 1.3608, test_f1: 0.6724
 epoch: 93, train_loss: 0.1852, test_loss: 1.2932, test_f1: 0.6723
 epoch: 94, train_loss: 0.1811, test_loss: 1.4783, test_f1: 0.6533
 epoch: 95, train_loss: 0.1962, test_loss: 1.2869, test_f1: 0.6720
 epoch: 96, train_loss: 0.1931, test_loss: 1.4219, test_f1: 0.6491
 epoch: 97, train_loss: 0.2014, test_loss: 1.2699, test_f1: 0.6620
 epoch: 98, train_loss: 0.1880, test_loss: 1.2729, test_f1: 0.6825
 epoch: 99, train_loss: 0.1816, test_loss: 1.2951, test_f1: 0.6581
##################ITERATION #3 ****************************************
 epoch: 0, train_loss: 1.1544, test_loss: 1.0438, test_f1: 0.4934
 epoch: 1, train_loss: 0.9766, test_loss: 0.9192, test_f1: 0.5140
 epoch: 2, train_loss: 0.9209, test_loss: 0.8775, test_f1: 0.5108
 epoch: 3, train_loss: 0.8990, test_loss: 0.8568, test_f1: 0.5495
 epoch: 4, train_loss: 0.8650, test_loss: 0.8488, test_f1: 0.5653
 epoch: 5, train_loss: 0.8483, test_loss: 0.8285, test_f1: 0.5994
 epoch: 6, train_loss: 0.8158, test_loss: 0.7955, test_f1: 0.6052
 epoch: 7, train_loss: 0.8037, test_loss: 0.7704, test_f1: 0.6348
 epoch: 8, train_loss: 0.7851, test_loss: 0.8462, test_f1: 0.5652
 epoch: 9, train_loss: 0.7799, test_loss: 0.7989, test_f1: 0.6211
 epoch: 10, train_loss: 0.7471, test_loss: 0.7684, test_f1: 0.6152
 epoch: 11, train_loss: 0.7497, test_loss: 0.7558, test_f1: 0.6472
 epoch: 12, train_loss: 0.7170, test_loss: 0.7191, test_f1: 0.6611
 epoch: 13, train_loss: 0.7157, test_loss: 0.7409, test_f1: 0.6409
 epoch: 14, train_loss: 0.6979, test_loss: 0.7208, test_f1: 0.6514
 epoch: 15, train_loss: 0.6680, test_loss: 0.7266, test_f1: 0.6826
 epoch: 16, train_loss: 0.6795, test_loss: 0.7306, test_f1: 0.6395
 epoch: 17, train_loss: 0.6574, test_loss: 0.7443, test_f1: 0.6374
 epoch: 18, train_loss: 0.6420, test_loss: 0.8486, test_f1: 0.6192
 epoch: 19, train_loss: 0.6305, test_loss: 0.7575, test_f1: 0.6417
 epoch: 20, train_loss: 0.6202, test_loss: 0.7308, test_f1: 0.6570
 epoch: 21, train_loss: 0.6352, test_loss: 0.8461, test_f1: 0.6373
 epoch: 22, train_loss: 0.6073, test_loss: 0.7089, test_f1: 0.6536
 epoch: 23, train_loss: 0.6010, test_loss: 0.8439, test_f1: 0.6307
 epoch: 24, train_loss: 0.6021, test_loss: 0.6985, test_f1: 0.6864
 epoch: 25, train_loss: 0.5781, test_loss: 0.7871, test_f1: 0.6462
 epoch: 26, train_loss: 0.5829, test_loss: 0.8562, test_f1: 0.6382
 epoch: 27, train_loss: 0.5832, test_loss: 0.8502, test_f1: 0.6493
 epoch: 28, train_loss: 0.5505, test_loss: 0.8509, test_f1: 0.6475
 epoch: 29, train_loss: 0.5338, test_loss: 0.6949, test_f1: 0.6889
 epoch: 30, train_loss: 0.5365, test_loss: 0.8766, test_f1: 0.6584
 epoch: 31, train_loss: 0.5314, test_loss: 0.8222, test_f1: 0.6531
 epoch: 32, train_loss: 0.5306, test_loss: 0.8653, test_f1: 0.6657
 epoch: 33, train_loss: 0.5088, test_loss: 0.7502, test_f1: 0.6616
 epoch: 34, train_loss: 0.4998, test_loss: 0.8305, test_f1: 0.6627
 epoch: 35, train_loss: 0.4962, test_loss: 0.8125, test_f1: 0.6677
 epoch: 36, train_loss: 0.4762, test_loss: 0.7789, test_f1: 0.6664
 epoch: 37, train_loss: 0.4808, test_loss: 0.8869, test_f1: 0.6851
 epoch: 38, train_loss: 0.5012, test_loss: 0.7047, test_f1: 0.6930
 epoch: 39, train_loss: 0.4653, test_loss: 0.7595, test_f1: 0.6822
 epoch: 40, train_loss: 0.4538, test_loss: 0.7982, test_f1: 0.6756
 epoch: 41, train_loss: 0.4641, test_loss: 0.8600, test_f1: 0.6947
 epoch: 42, train_loss: 0.4366, test_loss: 0.8438, test_f1: 0.6965
 epoch: 43, train_loss: 0.4600, test_loss: 0.8830, test_f1: 0.6718
 epoch: 44, train_loss: 0.4188, test_loss: 0.8898, test_f1: 0.6757
 epoch: 45, train_loss: 0.4436, test_loss: 0.8763, test_f1: 0.6735
 epoch: 46, train_loss: 0.4190, test_loss: 0.8882, test_f1: 0.6706
 epoch: 47, train_loss: 0.4365, test_loss: 0.9261, test_f1: 0.6876
 epoch: 48, train_loss: 0.4203, test_loss: 0.8320, test_f1: 0.6890
 epoch: 49, train_loss: 0.3995, test_loss: 0.8826, test_f1: 0.6739
 epoch: 50, train_loss: 0.4143, test_loss: 0.7927, test_f1: 0.7143
 epoch: 51, train_loss: 0.3647, test_loss: 0.8884, test_f1: 0.6943
 epoch: 52, train_loss: 0.3165, test_loss: 0.8933, test_f1: 0.7025
 epoch: 53, train_loss: 0.3020, test_loss: 0.8994, test_f1: 0.6851
 epoch: 54, train_loss: 0.3100, test_loss: 1.1645, test_f1: 0.6580
 epoch: 55, train_loss: 0.2980, test_loss: 1.0018, test_f1: 0.6865
 epoch: 56, train_loss: 0.3205, test_loss: 1.0138, test_f1: 0.6871
 epoch: 57, train_loss: 0.3206, test_loss: 0.9401, test_f1: 0.6654
 epoch: 58, train_loss: 0.2907, test_loss: 1.0206, test_f1: 0.6834
 epoch: 59, train_loss: 0.2902, test_loss: 0.9463, test_f1: 0.6699
 epoch: 60, train_loss: 0.2757, test_loss: 1.0727, test_f1: 0.6778
 epoch: 61, train_loss: 0.2629, test_loss: 1.1658, test_f1: 0.6627
 epoch: 62, train_loss: 0.2790, test_loss: 1.1064, test_f1: 0.6709
 epoch: 63, train_loss: 0.2787, test_loss: 1.1526, test_f1: 0.6769
 epoch: 64, train_loss: 0.2562, test_loss: 1.2220, test_f1: 0.6430
 epoch: 65, train_loss: 0.3463, test_loss: 0.9952, test_f1: 0.6844
 epoch: 66, train_loss: 0.2662, test_loss: 1.0700, test_f1: 0.6915
 epoch: 67, train_loss: 0.2694, test_loss: 1.1186, test_f1: 0.6739
 epoch: 68, train_loss: 0.2479, test_loss: 1.1710, test_f1: 0.6646
 epoch: 69, train_loss: 0.2706, test_loss: 1.2430, test_f1: 0.6758
 epoch: 70, train_loss: 0.2411, test_loss: 1.3434, test_f1: 0.6663
 epoch: 71, train_loss: 0.2596, test_loss: 1.1660, test_f1: 0.6791
 epoch: 72, train_loss: 0.2354, test_loss: 1.2563, test_f1: 0.6942
 epoch: 73, train_loss: 0.2305, test_loss: 1.2770, test_f1: 0.6721
 epoch: 74, train_loss: 0.2455, test_loss: 1.1706, test_f1: 0.6755
 epoch: 75, train_loss: 0.2527, test_loss: 1.1987, test_f1: 0.6834
 epoch: 76, train_loss: 0.2299, test_loss: 1.2970, test_f1: 0.6789
 epoch: 77, train_loss: 0.2331, test_loss: 1.3251, test_f1: 0.6614
 epoch: 78, train_loss: 0.2197, test_loss: 1.2957, test_f1: 0.6806
 epoch: 79, train_loss: 0.2152, test_loss: 1.3340, test_f1: 0.6741
 epoch: 80, train_loss: 0.2285, test_loss: 1.2906, test_f1: 0.6563
 epoch: 81, train_loss: 0.2136, test_loss: 1.2438, test_f1: 0.6764
 epoch: 82, train_loss: 0.2023, test_loss: 1.5032, test_f1: 0.6660
 epoch: 83, train_loss: 0.2114, test_loss: 1.3673, test_f1: 0.6741
 epoch: 84, train_loss: 0.2261, test_loss: 1.2485, test_f1: 0.6856
 epoch: 85, train_loss: 0.2006, test_loss: 1.3845, test_f1: 0.6763
 epoch: 86, train_loss: 0.2253, test_loss: 1.4284, test_f1: 0.6757
 epoch: 87, train_loss: 0.1986, test_loss: 1.3372, test_f1: 0.6787
 epoch: 88, train_loss: 0.1943, test_loss: 1.3637, test_f1: 0.6698
 epoch: 89, train_loss: 0.1905, test_loss: 1.4601, test_f1: 0.6775
 epoch: 90, train_loss: 0.1919, test_loss: 1.4693, test_f1: 0.6774
 epoch: 91, train_loss: 0.2137, test_loss: 1.3444, test_f1: 0.6754
 epoch: 92, train_loss: 0.1916, test_loss: 1.3313, test_f1: 0.6837
 epoch: 93, train_loss: 0.1866, test_loss: 1.3528, test_f1: 0.6782
 epoch: 94, train_loss: 0.1938, test_loss: 1.3085, test_f1: 0.6678
 epoch: 95, train_loss: 0.1896, test_loss: 1.3953, test_f1: 0.6649
 epoch: 96, train_loss: 0.1864, test_loss: 1.4174, test_f1: 0.6730
 epoch: 97, train_loss: 0.1744, test_loss: 1.4644, test_f1: 0.6555
 epoch: 98, train_loss: 0.1873, test_loss: 1.4230, test_f1: 0.6679
 epoch: 99, train_loss: 0.1936, test_loss: 1.4667, test_f1: 0.6682
##################ITERATION #4 ****************************************
 epoch: 0, train_loss: 1.1996, test_loss: 0.9834, test_f1: 0.5377
 epoch: 1, train_loss: 0.9708, test_loss: 0.9063, test_f1: 0.5627
 epoch: 2, train_loss: 0.9198, test_loss: 0.9091, test_f1: 0.5299
 epoch: 3, train_loss: 0.8935, test_loss: 0.9424, test_f1: 0.5372
 epoch: 4, train_loss: 0.8702, test_loss: 0.8377, test_f1: 0.5858
 epoch: 5, train_loss: 0.8625, test_loss: 0.8153, test_f1: 0.5920
 epoch: 6, train_loss: 0.8237, test_loss: 0.8018, test_f1: 0.5858
 epoch: 7, train_loss: 0.8131, test_loss: 0.8232, test_f1: 0.6227
 epoch: 8, train_loss: 0.7775, test_loss: 0.7689, test_f1: 0.6268
 epoch: 9, train_loss: 0.7992, test_loss: 0.8002, test_f1: 0.6318
 epoch: 10, train_loss: 0.7476, test_loss: 0.7741, test_f1: 0.6084
 epoch: 11, train_loss: 0.7255, test_loss: 0.7685, test_f1: 0.6247
 epoch: 12, train_loss: 0.7271, test_loss: 0.7053, test_f1: 0.6319
 epoch: 13, train_loss: 0.7102, test_loss: 0.7121, test_f1: 0.6431
 epoch: 14, train_loss: 0.6916, test_loss: 0.7095, test_f1: 0.6519
 epoch: 15, train_loss: 0.6735, test_loss: 0.6904, test_f1: 0.6749
 epoch: 16, train_loss: 0.6973, test_loss: 0.6913, test_f1: 0.6636
 epoch: 17, train_loss: 0.6812, test_loss: 0.7225, test_f1: 0.6831
 epoch: 18, train_loss: 0.6541, test_loss: 0.7102, test_f1: 0.6708
 epoch: 19, train_loss: 0.6352, test_loss: 0.7363, test_f1: 0.6506
 epoch: 20, train_loss: 0.6358, test_loss: 0.7347, test_f1: 0.6522
 epoch: 21, train_loss: 0.6109, test_loss: 0.7104, test_f1: 0.6979
 epoch: 22, train_loss: 0.6178, test_loss: 0.7655, test_f1: 0.6635
 epoch: 23, train_loss: 0.5966, test_loss: 0.7926, test_f1: 0.6712
 epoch: 24, train_loss: 0.5728, test_loss: 0.7255, test_f1: 0.6638
 epoch: 25, train_loss: 0.5955, test_loss: 0.6916, test_f1: 0.7269
 epoch: 26, train_loss: 0.5943, test_loss: 0.6885, test_f1: 0.6992
 epoch: 27, train_loss: 0.5551, test_loss: 0.6656, test_f1: 0.6823
 epoch: 28, train_loss: 0.5524, test_loss: 0.7116, test_f1: 0.6849
 epoch: 29, train_loss: 0.5309, test_loss: 0.7891, test_f1: 0.6597
 epoch: 30, train_loss: 0.5591, test_loss: 0.7788, test_f1: 0.6725
 epoch: 31, train_loss: 0.5381, test_loss: 0.8505, test_f1: 0.6596
 epoch: 32, train_loss: 0.5281, test_loss: 1.0066, test_f1: 0.6362
 epoch: 33, train_loss: 0.5279, test_loss: 0.7673, test_f1: 0.6988
 epoch: 34, train_loss: 0.5089, test_loss: 0.9125, test_f1: 0.6486
 epoch: 35, train_loss: 0.5028, test_loss: 0.8042, test_f1: 0.6662
 epoch: 36, train_loss: 0.4764, test_loss: 0.8234, test_f1: 0.6803
 epoch: 37, train_loss: 0.4797, test_loss: 1.0219, test_f1: 0.6713
 epoch: 38, train_loss: 0.4857, test_loss: 0.7416, test_f1: 0.7060
 epoch: 39, train_loss: 0.4787, test_loss: 0.7665, test_f1: 0.6710
 epoch: 40, train_loss: 0.4494, test_loss: 0.7508, test_f1: 0.7025
 epoch: 41, train_loss: 0.4477, test_loss: 0.8516, test_f1: 0.6661
 epoch: 42, train_loss: 0.4410, test_loss: 0.8990, test_f1: 0.6821
 epoch: 43, train_loss: 0.4774, test_loss: 0.9599, test_f1: 0.6715
 epoch: 44, train_loss: 0.4377, test_loss: 0.8692, test_f1: 0.6771
 epoch: 45, train_loss: 0.4594, test_loss: 1.0348, test_f1: 0.6547
 epoch: 46, train_loss: 0.4215, test_loss: 0.9900, test_f1: 0.6619
 epoch: 47, train_loss: 0.4226, test_loss: 0.9224, test_f1: 0.6603
 epoch: 48, train_loss: 0.4121, test_loss: 0.9453, test_f1: 0.6870
 epoch: 49, train_loss: 0.4225, test_loss: 1.0560, test_f1: 0.6500
 epoch: 50, train_loss: 0.4405, test_loss: 0.7718, test_f1: 0.7053
 epoch: 51, train_loss: 0.3651, test_loss: 0.9475, test_f1: 0.7119
 epoch: 52, train_loss: 0.3308, test_loss: 1.0614, test_f1: 0.6671
 epoch: 53, train_loss: 0.3385, test_loss: 1.0098, test_f1: 0.6910
 epoch: 54, train_loss: 0.3393, test_loss: 1.1154, test_f1: 0.6605
 epoch: 55, train_loss: 0.3123, test_loss: 1.0652, test_f1: 0.6659
 epoch: 56, train_loss: 0.2893, test_loss: 1.0754, test_f1: 0.6722
 epoch: 57, train_loss: 0.3036, test_loss: 1.1098, test_f1: 0.6589
 epoch: 58, train_loss: 0.2753, test_loss: 1.1459, test_f1: 0.6578
 epoch: 59, train_loss: 0.2711, test_loss: 1.1409, test_f1: 0.6792
 epoch: 60, train_loss: 0.2717, test_loss: 1.0818, test_f1: 0.6699
 epoch: 61, train_loss: 0.2829, test_loss: 1.1705, test_f1: 0.6737
 epoch: 62, train_loss: 0.2931, test_loss: 1.1200, test_f1: 0.6825
 epoch: 63, train_loss: 0.2801, test_loss: 1.1975, test_f1: 0.6811
 epoch: 64, train_loss: 0.2734, test_loss: 1.2430, test_f1: 0.6848
 epoch: 65, train_loss: 0.2574, test_loss: 1.2070, test_f1: 0.6874
 epoch: 66, train_loss: 0.2413, test_loss: 1.2541, test_f1: 0.6804
 epoch: 67, train_loss: 0.2627, test_loss: 1.2108, test_f1: 0.6706
 epoch: 68, train_loss: 0.2524, test_loss: 1.2788, test_f1: 0.6626
 epoch: 69, train_loss: 0.2588, test_loss: 1.3308, test_f1: 0.6772
 epoch: 70, train_loss: 0.2913, test_loss: 1.1989, test_f1: 0.6797
 epoch: 71, train_loss: 0.2609, test_loss: 1.1680, test_f1: 0.6860
 epoch: 72, train_loss: 0.2359, test_loss: 1.2748, test_f1: 0.6771
 epoch: 73, train_loss: 0.2350, test_loss: 1.3091, test_f1: 0.6791
 epoch: 74, train_loss: 0.2506, test_loss: 1.3489, test_f1: 0.6789
 epoch: 75, train_loss: 0.2552, test_loss: 1.2281, test_f1: 0.6782
 epoch: 76, train_loss: 0.2333, test_loss: 1.4625, test_f1: 0.6672
 epoch: 77, train_loss: 0.2454, test_loss: 1.3690, test_f1: 0.6677
 epoch: 78, train_loss: 0.2378, test_loss: 1.3909, test_f1: 0.6532
 epoch: 79, train_loss: 0.2179, test_loss: 1.2972, test_f1: 0.6796
 epoch: 80, train_loss: 0.2223, test_loss: 1.4096, test_f1: 0.6791
 epoch: 81, train_loss: 0.2139, test_loss: 1.4651, test_f1: 0.6777
 epoch: 82, train_loss: 0.2273, test_loss: 1.4799, test_f1: 0.6659
 epoch: 83, train_loss: 0.2171, test_loss: 1.5157, test_f1: 0.6740
 epoch: 84, train_loss: 0.2348, test_loss: 1.3839, test_f1: 0.6674
 epoch: 85, train_loss: 0.2131, test_loss: 1.4122, test_f1: 0.6719
 epoch: 86, train_loss: 0.2127, test_loss: 1.4203, test_f1: 0.6672
 epoch: 87, train_loss: 0.2170, test_loss: 1.3994, test_f1: 0.6746
 epoch: 88, train_loss: 0.2139, test_loss: 1.4305, test_f1: 0.6680
 epoch: 89, train_loss: 0.2086, test_loss: 1.4907, test_f1: 0.6635
 epoch: 90, train_loss: 0.2048, test_loss: 1.3940, test_f1: 0.6789
 epoch: 91, train_loss: 0.2012, test_loss: 1.4053, test_f1: 0.6822
 epoch: 92, train_loss: 0.1981, test_loss: 1.4920, test_f1: 0.6830
 epoch: 93, train_loss: 0.2117, test_loss: 1.3711, test_f1: 0.6899
 epoch: 94, train_loss: 0.2092, test_loss: 1.5259, test_f1: 0.6758
 epoch: 95, train_loss: 0.1775, test_loss: 1.6513, test_f1: 0.6692
 epoch: 96, train_loss: 0.1947, test_loss: 1.4612, test_f1: 0.6828
 epoch: 97, train_loss: 0.1961, test_loss: 1.5929, test_f1: 0.6644
 epoch: 98, train_loss: 0.1848, test_loss: 1.6187, test_f1: 0.6763
 epoch: 99, train_loss: 0.1993, test_loss: 1.4878, test_f1: 0.6635
##################ITERATION #5 ****************************************
 epoch: 0, train_loss: 1.1981, test_loss: 0.9904, test_f1: 0.4642
 epoch: 1, train_loss: 0.9638, test_loss: 0.9365, test_f1: 0.5582
 epoch: 2, train_loss: 0.9331, test_loss: 0.9171, test_f1: 0.5311
 epoch: 3, train_loss: 0.9070, test_loss: 0.9151, test_f1: 0.5269
 epoch: 4, train_loss: 0.8830, test_loss: 0.8763, test_f1: 0.5691
 epoch: 5, train_loss: 0.8529, test_loss: 0.9157, test_f1: 0.5806
 epoch: 6, train_loss: 0.8093, test_loss: 0.8396, test_f1: 0.5858
 epoch: 7, train_loss: 0.8173, test_loss: 0.7687, test_f1: 0.5878
 epoch: 8, train_loss: 0.7897, test_loss: 0.8143, test_f1: 0.5688
 epoch: 9, train_loss: 0.7690, test_loss: 0.7778, test_f1: 0.5968
 epoch: 10, train_loss: 0.7507, test_loss: 0.8212, test_f1: 0.6488
 epoch: 11, train_loss: 0.7262, test_loss: 0.7679, test_f1: 0.6431
 epoch: 12, train_loss: 0.7137, test_loss: 0.7492, test_f1: 0.6620
 epoch: 13, train_loss: 0.7127, test_loss: 0.8204, test_f1: 0.6435
 epoch: 14, train_loss: 0.7075, test_loss: 0.8338, test_f1: 0.6454
 epoch: 15, train_loss: 0.6880, test_loss: 0.8059, test_f1: 0.6563
 epoch: 16, train_loss: 0.6788, test_loss: 0.7769, test_f1: 0.6652
 epoch: 17, train_loss: 0.6643, test_loss: 0.7771, test_f1: 0.6553
 epoch: 18, train_loss: 0.6499, test_loss: 0.8696, test_f1: 0.6481
 epoch: 19, train_loss: 0.6272, test_loss: 0.8252, test_f1: 0.6519
 epoch: 20, train_loss: 0.6494, test_loss: 0.8113, test_f1: 0.6570
 epoch: 21, train_loss: 0.6308, test_loss: 0.7396, test_f1: 0.6651
 epoch: 22, train_loss: 0.6188, test_loss: 0.7735, test_f1: 0.6635
 epoch: 23, train_loss: 0.5987, test_loss: 0.8641, test_f1: 0.6560
 epoch: 24, train_loss: 0.5859, test_loss: 0.7973, test_f1: 0.6555
 epoch: 25, train_loss: 0.5726, test_loss: 0.9613, test_f1: 0.6487
 epoch: 26, train_loss: 0.5630, test_loss: 0.9609, test_f1: 0.6306
 epoch: 27, train_loss: 0.5814, test_loss: 0.8025, test_f1: 0.6451
 epoch: 28, train_loss: 0.5510, test_loss: 0.8077, test_f1: 0.6750
 epoch: 29, train_loss: 0.5618, test_loss: 0.7515, test_f1: 0.7095
 epoch: 30, train_loss: 0.5295, test_loss: 0.7949, test_f1: 0.6700
 epoch: 31, train_loss: 0.5386, test_loss: 0.9043, test_f1: 0.6828
 epoch: 32, train_loss: 0.5301, test_loss: 0.8492, test_f1: 0.6513
 epoch: 33, train_loss: 0.5166, test_loss: 0.9460, test_f1: 0.6732
 epoch: 34, train_loss: 0.5249, test_loss: 0.9054, test_f1: 0.6420
 epoch: 35, train_loss: 0.5188, test_loss: 0.8608, test_f1: 0.6818
 epoch: 36, train_loss: 0.5037, test_loss: 0.9549, test_f1: 0.6578
 epoch: 37, train_loss: 0.4997, test_loss: 0.9336, test_f1: 0.6517
 epoch: 38, train_loss: 0.4713, test_loss: 0.9450, test_f1: 0.6691
 epoch: 39, train_loss: 0.4845, test_loss: 0.7951, test_f1: 0.6884
 epoch: 40, train_loss: 0.4677, test_loss: 0.9385, test_f1: 0.6755
 epoch: 41, train_loss: 0.4670, test_loss: 0.8591, test_f1: 0.6897
 epoch: 42, train_loss: 0.4698, test_loss: 0.9109, test_f1: 0.6586
 epoch: 43, train_loss: 0.4554, test_loss: 0.9287, test_f1: 0.6957
 epoch: 44, train_loss: 0.4617, test_loss: 0.9908, test_f1: 0.6776
 epoch: 45, train_loss: 0.4586, test_loss: 0.9405, test_f1: 0.6628
 epoch: 46, train_loss: 0.4201, test_loss: 0.9990, test_f1: 0.6657
 epoch: 47, train_loss: 0.4424, test_loss: 1.0258, test_f1: 0.6823
 epoch: 48, train_loss: 0.4214, test_loss: 1.0575, test_f1: 0.6673
 epoch: 49, train_loss: 0.4196, test_loss: 0.9502, test_f1: 0.6688
 epoch: 50, train_loss: 0.4091, test_loss: 0.9522, test_f1: 0.6715
 epoch: 51, train_loss: 0.3695, test_loss: 0.9705, test_f1: 0.6664
 epoch: 52, train_loss: 0.3539, test_loss: 0.9091, test_f1: 0.6858
 epoch: 53, train_loss: 0.3456, test_loss: 1.0039, test_f1: 0.6889
 epoch: 54, train_loss: 0.3134, test_loss: 1.0654, test_f1: 0.6790
 epoch: 55, train_loss: 0.3332, test_loss: 1.0662, test_f1: 0.6737
 epoch: 56, train_loss: 0.2982, test_loss: 1.0991, test_f1: 0.6805
 epoch: 57, train_loss: 0.3123, test_loss: 1.0741, test_f1: 0.6980
 epoch: 58, train_loss: 0.3035, test_loss: 1.2007, test_f1: 0.6757
 epoch: 59, train_loss: 0.3067, test_loss: 1.1151, test_f1: 0.6716
 epoch: 60, train_loss: 0.2915, test_loss: 1.1962, test_f1: 0.6720
 epoch: 61, train_loss: 0.2719, test_loss: 1.3216, test_f1: 0.6802
 epoch: 62, train_loss: 0.2732, test_loss: 1.3059, test_f1: 0.6848
 epoch: 63, train_loss: 0.2876, test_loss: 1.3294, test_f1: 0.6765
 epoch: 64, train_loss: 0.2818, test_loss: 1.2664, test_f1: 0.6657
 epoch: 65, train_loss: 0.2935, test_loss: 1.3089, test_f1: 0.6668
 epoch: 66, train_loss: 0.2689, test_loss: 1.2344, test_f1: 0.6689
 epoch: 67, train_loss: 0.2683, test_loss: 1.3009, test_f1: 0.6815
 epoch: 68, train_loss: 0.2928, test_loss: 1.4414, test_f1: 0.6544
 epoch: 69, train_loss: 0.2607, test_loss: 1.2736, test_f1: 0.6890
 epoch: 70, train_loss: 0.2644, test_loss: 1.4118, test_f1: 0.6684
 epoch: 71, train_loss: 0.2571, test_loss: 1.4344, test_f1: 0.6720
 epoch: 72, train_loss: 0.2518, test_loss: 1.4274, test_f1: 0.6674
 epoch: 73, train_loss: 0.2758, test_loss: 1.4449, test_f1: 0.6869
 epoch: 74, train_loss: 0.2571, test_loss: 1.3661, test_f1: 0.6752
 epoch: 75, train_loss: 0.2502, test_loss: 1.4236, test_f1: 0.6818
 epoch: 76, train_loss: 0.2446, test_loss: 1.3656, test_f1: 0.6860
 epoch: 77, train_loss: 0.2351, test_loss: 1.4660, test_f1: 0.6747
 epoch: 78, train_loss: 0.2413, test_loss: 1.6983, test_f1: 0.6845
 epoch: 79, train_loss: 0.2299, test_loss: 1.3898, test_f1: 0.6882
 epoch: 80, train_loss: 0.2499, test_loss: 1.3785, test_f1: 0.6966
 epoch: 81, train_loss: 0.2045, test_loss: 1.3951, test_f1: 0.6778
 epoch: 82, train_loss: 0.2405, test_loss: 1.4597, test_f1: 0.6688
 epoch: 83, train_loss: 0.2483, test_loss: 1.4719, test_f1: 0.6807
 epoch: 84, train_loss: 0.2269, test_loss: 1.4592, test_f1: 0.6832
 epoch: 85, train_loss: 0.2073, test_loss: 1.5094, test_f1: 0.6893
 epoch: 86, train_loss: 0.2298, test_loss: 1.5311, test_f1: 0.6808
 epoch: 87, train_loss: 0.2081, test_loss: 1.5000, test_f1: 0.6684
 epoch: 88, train_loss: 0.2108, test_loss: 1.3705, test_f1: 0.6850
 epoch: 89, train_loss: 0.2068, test_loss: 1.3716, test_f1: 0.6576
 epoch: 90, train_loss: 0.2174, test_loss: 1.4588, test_f1: 0.6610
 epoch: 91, train_loss: 0.2100, test_loss: 1.3725, test_f1: 0.6899
 epoch: 92, train_loss: 0.2189, test_loss: 1.4069, test_f1: 0.6917
 epoch: 93, train_loss: 0.1948, test_loss: 1.4693, test_f1: 0.6701
 epoch: 94, train_loss: 0.2100, test_loss: 1.5721, test_f1: 0.6885
 epoch: 95, train_loss: 0.2059, test_loss: 1.5692, test_f1: 0.6709
 epoch: 96, train_loss: 0.1939, test_loss: 1.4850, test_f1: 0.6820
 epoch: 97, train_loss: 0.2089, test_loss: 1.5833, test_f1: 0.6683
 epoch: 98, train_loss: 0.1950, test_loss: 1.5294, test_f1: 0.6839
 epoch: 99, train_loss: 0.1879, test_loss: 1.5958, test_f1: 0.6668
##################ITERATION #6 ****************************************
 epoch: 0, train_loss: 1.1538, test_loss: 1.0164, test_f1: 0.4802
 epoch: 1, train_loss: 0.9756, test_loss: 0.9251, test_f1: 0.5072
 epoch: 2, train_loss: 0.9269, test_loss: 0.9220, test_f1: 0.5419
 epoch: 3, train_loss: 0.8988, test_loss: 0.8901, test_f1: 0.5469
 epoch: 4, train_loss: 0.8668, test_loss: 0.8329, test_f1: 0.5783
 epoch: 5, train_loss: 0.8437, test_loss: 0.8526, test_f1: 0.5785
 epoch: 6, train_loss: 0.8277, test_loss: 0.7565, test_f1: 0.6458
 epoch: 7, train_loss: 0.7914, test_loss: 0.8099, test_f1: 0.6098
 epoch: 8, train_loss: 0.7990, test_loss: 0.7974, test_f1: 0.6329
 epoch: 9, train_loss: 0.7614, test_loss: 0.7789, test_f1: 0.6329
 epoch: 10, train_loss: 0.7376, test_loss: 0.7578, test_f1: 0.6540
 epoch: 11, train_loss: 0.7424, test_loss: 0.7570, test_f1: 0.6153
 epoch: 12, train_loss: 0.7096, test_loss: 0.7612, test_f1: 0.6188
 epoch: 13, train_loss: 0.7135, test_loss: 0.7528, test_f1: 0.6642
 epoch: 14, train_loss: 0.6934, test_loss: 0.7103, test_f1: 0.6517
 epoch: 15, train_loss: 0.6885, test_loss: 0.7015, test_f1: 0.6670
 epoch: 16, train_loss: 0.6748, test_loss: 0.7181, test_f1: 0.6893
 epoch: 17, train_loss: 0.6487, test_loss: 0.7282, test_f1: 0.6681
 epoch: 18, train_loss: 0.6587, test_loss: 0.6954, test_f1: 0.6486
 epoch: 19, train_loss: 0.6274, test_loss: 0.7357, test_f1: 0.6540
 epoch: 20, train_loss: 0.6327, test_loss: 0.7232, test_f1: 0.6601
 epoch: 21, train_loss: 0.6253, test_loss: 0.7213, test_f1: 0.6607
 epoch: 22, train_loss: 0.6025, test_loss: 0.7704, test_f1: 0.6389
 epoch: 23, train_loss: 0.6069, test_loss: 0.6728, test_f1: 0.6816
 epoch: 24, train_loss: 0.5891, test_loss: 0.7643, test_f1: 0.6626
 epoch: 25, train_loss: 0.5759, test_loss: 0.7342, test_f1: 0.6841
 epoch: 26, train_loss: 0.5563, test_loss: 0.8060, test_f1: 0.6511
 epoch: 27, train_loss: 0.5910, test_loss: 0.7312, test_f1: 0.6560
 epoch: 28, train_loss: 0.5546, test_loss: 0.6902, test_f1: 0.6950
 epoch: 29, train_loss: 0.5427, test_loss: 0.7383, test_f1: 0.6680
 epoch: 30, train_loss: 0.5311, test_loss: 0.7262, test_f1: 0.6615
 epoch: 31, train_loss: 0.5237, test_loss: 0.8617, test_f1: 0.6386
 epoch: 32, train_loss: 0.5220, test_loss: 0.7324, test_f1: 0.6861
 epoch: 33, train_loss: 0.4993, test_loss: 0.8032, test_f1: 0.6751
 epoch: 34, train_loss: 0.5054, test_loss: 0.7079, test_f1: 0.6986
 epoch: 35, train_loss: 0.4865, test_loss: 0.7975, test_f1: 0.6588
 epoch: 36, train_loss: 0.5063, test_loss: 0.8136, test_f1: 0.6775
 epoch: 37, train_loss: 0.4672, test_loss: 0.7928, test_f1: 0.6627
 epoch: 38, train_loss: 0.4709, test_loss: 0.8157, test_f1: 0.6551
 epoch: 39, train_loss: 0.4556, test_loss: 0.8289, test_f1: 0.6823
 epoch: 40, train_loss: 0.4682, test_loss: 0.8637, test_f1: 0.6687
 epoch: 41, train_loss: 0.4680, test_loss: 0.7433, test_f1: 0.6940
 epoch: 42, train_loss: 0.4594, test_loss: 0.7971, test_f1: 0.6689
 epoch: 43, train_loss: 0.4515, test_loss: 0.8998, test_f1: 0.6393
 epoch: 44, train_loss: 0.4216, test_loss: 0.7791, test_f1: 0.6650
 epoch: 45, train_loss: 0.4363, test_loss: 0.8249, test_f1: 0.6640
 epoch: 46, train_loss: 0.4251, test_loss: 0.8942, test_f1: 0.6711
 epoch: 47, train_loss: 0.4203, test_loss: 0.9028, test_f1: 0.6888
 epoch: 48, train_loss: 0.4238, test_loss: 0.9043, test_f1: 0.7041
 epoch: 49, train_loss: 0.4005, test_loss: 0.9035, test_f1: 0.6701
 epoch: 50, train_loss: 0.4008, test_loss: 0.9685, test_f1: 0.6691
 epoch: 51, train_loss: 0.3344, test_loss: 0.9166, test_f1: 0.6933
 epoch: 52, train_loss: 0.3315, test_loss: 0.9480, test_f1: 0.6698
 epoch: 53, train_loss: 0.3420, test_loss: 0.9587, test_f1: 0.6853
 epoch: 54, train_loss: 0.3092, test_loss: 1.0445, test_f1: 0.6877
 epoch: 55, train_loss: 0.3123, test_loss: 1.0516, test_f1: 0.6799
 epoch: 56, train_loss: 0.3213, test_loss: 0.9295, test_f1: 0.6752
 epoch: 57, train_loss: 0.2856, test_loss: 0.9647, test_f1: 0.6669
 epoch: 58, train_loss: 0.3003, test_loss: 1.1632, test_f1: 0.6567
 epoch: 59, train_loss: 0.2881, test_loss: 1.0782, test_f1: 0.6671
 epoch: 60, train_loss: 0.2892, test_loss: 1.0765, test_f1: 0.6741
 epoch: 61, train_loss: 0.2667, test_loss: 1.2079, test_f1: 0.6998
 epoch: 62, train_loss: 0.2719, test_loss: 1.1153, test_f1: 0.6750
 epoch: 63, train_loss: 0.2837, test_loss: 1.1228, test_f1: 0.6623
 epoch: 64, train_loss: 0.2637, test_loss: 1.1223, test_f1: 0.6872
 epoch: 65, train_loss: 0.2718, test_loss: 1.1889, test_f1: 0.6866
 epoch: 66, train_loss: 0.2509, test_loss: 1.2145, test_f1: 0.6818
 epoch: 67, train_loss: 0.2762, test_loss: 1.0576, test_f1: 0.6936
 epoch: 68, train_loss: 0.2360, test_loss: 1.2099, test_f1: 0.6743
 epoch: 69, train_loss: 0.2573, test_loss: 1.1915, test_f1: 0.6711
 epoch: 70, train_loss: 0.2386, test_loss: 1.2529, test_f1: 0.6753
 epoch: 71, train_loss: 0.2379, test_loss: 1.1851, test_f1: 0.6668
 epoch: 72, train_loss: 0.2791, test_loss: 1.1623, test_f1: 0.6502
 epoch: 73, train_loss: 0.2568, test_loss: 1.2404, test_f1: 0.6706
 epoch: 74, train_loss: 0.2378, test_loss: 1.1355, test_f1: 0.6735
 epoch: 75, train_loss: 0.2486, test_loss: 1.1831, test_f1: 0.6593
 epoch: 76, train_loss: 0.2346, test_loss: 1.1616, test_f1: 0.6570
 epoch: 77, train_loss: 0.2336, test_loss: 1.2364, test_f1: 0.6715
 epoch: 78, train_loss: 0.2239, test_loss: 1.2330, test_f1: 0.6824
 epoch: 79, train_loss: 0.2352, test_loss: 1.1669, test_f1: 0.6857
 epoch: 80, train_loss: 0.2313, test_loss: 1.1180, test_f1: 0.6755
 epoch: 81, train_loss: 0.2286, test_loss: 1.2108, test_f1: 0.6703
 epoch: 82, train_loss: 0.2210, test_loss: 1.2086, test_f1: 0.6848
 epoch: 83, train_loss: 0.2101, test_loss: 1.4380, test_f1: 0.6655
 epoch: 84, train_loss: 0.2231, test_loss: 1.2170, test_f1: 0.6646
 epoch: 85, train_loss: 0.2048, test_loss: 1.3502, test_f1: 0.6703
 epoch: 86, train_loss: 0.2222, test_loss: 1.3692, test_f1: 0.6659
 epoch: 87, train_loss: 0.2157, test_loss: 1.3386, test_f1: 0.6571
 epoch: 88, train_loss: 0.2207, test_loss: 1.2434, test_f1: 0.6651
 epoch: 89, train_loss: 0.2337, test_loss: 1.1392, test_f1: 0.6706
 epoch: 90, train_loss: 0.2089, test_loss: 1.3514, test_f1: 0.6728
 epoch: 91, train_loss: 0.1966, test_loss: 1.2642, test_f1: 0.6602
 epoch: 92, train_loss: 0.1990, test_loss: 1.4019, test_f1: 0.6636
 epoch: 93, train_loss: 0.1912, test_loss: 1.3623, test_f1: 0.6651
 epoch: 94, train_loss: 0.1960, test_loss: 1.3642, test_f1: 0.6741
 epoch: 95, train_loss: 0.2076, test_loss: 1.3613, test_f1: 0.6634
 epoch: 96, train_loss: 0.1915, test_loss: 1.3620, test_f1: 0.6537
 epoch: 97, train_loss: 0.1945, test_loss: 1.2973, test_f1: 0.6656
 epoch: 98, train_loss: 0.2007, test_loss: 1.3880, test_f1: 0.6602
 epoch: 99, train_loss: 0.2038, test_loss: 1.4201, test_f1: 0.6753
##################ITERATION #7 ****************************************
 epoch: 0, train_loss: 1.1897, test_loss: 1.0260, test_f1: 0.5363
 epoch: 1, train_loss: 0.9737, test_loss: 0.9676, test_f1: 0.5071
 epoch: 2, train_loss: 0.9174, test_loss: 0.8944, test_f1: 0.5321
 epoch: 3, train_loss: 0.8897, test_loss: 0.8862, test_f1: 0.5501
 epoch: 4, train_loss: 0.8703, test_loss: 0.8508, test_f1: 0.5418
 epoch: 5, train_loss: 0.8329, test_loss: 0.8391, test_f1: 0.5541
 epoch: 6, train_loss: 0.8160, test_loss: 0.7976, test_f1: 0.6535
 epoch: 7, train_loss: 0.8149, test_loss: 0.7727, test_f1: 0.6148
 epoch: 8, train_loss: 0.7626, test_loss: 0.7991, test_f1: 0.5884
 epoch: 9, train_loss: 0.7702, test_loss: 0.7528, test_f1: 0.6220
 epoch: 10, train_loss: 0.7513, test_loss: 0.8115, test_f1: 0.6036
 epoch: 11, train_loss: 0.7366, test_loss: 0.8027, test_f1: 0.6028
 epoch: 12, train_loss: 0.7212, test_loss: 0.8126, test_f1: 0.5814
 epoch: 13, train_loss: 0.7090, test_loss: 0.8085, test_f1: 0.6324
 epoch: 14, train_loss: 0.7058, test_loss: 0.7916, test_f1: 0.6242
 epoch: 15, train_loss: 0.7032, test_loss: 0.6968, test_f1: 0.6491
 epoch: 16, train_loss: 0.6608, test_loss: 0.7797, test_f1: 0.5951
 epoch: 17, train_loss: 0.6557, test_loss: 0.6797, test_f1: 0.6789
 epoch: 18, train_loss: 0.6573, test_loss: 0.6970, test_f1: 0.6411
 epoch: 19, train_loss: 0.6511, test_loss: 0.7828, test_f1: 0.6528
 epoch: 20, train_loss: 0.6277, test_loss: 0.7040, test_f1: 0.6453
 epoch: 21, train_loss: 0.6255, test_loss: 0.7965, test_f1: 0.6396
 epoch: 22, train_loss: 0.6032, test_loss: 0.7722, test_f1: 0.6358
 epoch: 23, train_loss: 0.5976, test_loss: 0.7193, test_f1: 0.6879
 epoch: 24, train_loss: 0.5893, test_loss: 0.6877, test_f1: 0.6868
 epoch: 25, train_loss: 0.5804, test_loss: 0.7480, test_f1: 0.6833
 epoch: 26, train_loss: 0.5680, test_loss: 0.7398, test_f1: 0.6441
 epoch: 27, train_loss: 0.5744, test_loss: 0.7300, test_f1: 0.6629
 epoch: 28, train_loss: 0.5697, test_loss: 0.7010, test_f1: 0.6719
 epoch: 29, train_loss: 0.5468, test_loss: 0.8295, test_f1: 0.6671
 epoch: 30, train_loss: 0.5507, test_loss: 0.7272, test_f1: 0.6463
 epoch: 31, train_loss: 0.5324, test_loss: 0.7631, test_f1: 0.6478
 epoch: 32, train_loss: 0.5326, test_loss: 0.7886, test_f1: 0.6570
 epoch: 33, train_loss: 0.5072, test_loss: 0.7918, test_f1: 0.6331
 epoch: 34, train_loss: 0.5206, test_loss: 0.7734, test_f1: 0.6782
 epoch: 35, train_loss: 0.5219, test_loss: 0.7472, test_f1: 0.6900
 epoch: 36, train_loss: 0.5039, test_loss: 0.8275, test_f1: 0.6780
 epoch: 37, train_loss: 0.5157, test_loss: 0.7734, test_f1: 0.6861
 epoch: 38, train_loss: 0.4633, test_loss: 0.9149, test_f1: 0.6758
 epoch: 39, train_loss: 0.4723, test_loss: 0.8981, test_f1: 0.6830
 epoch: 40, train_loss: 0.4760, test_loss: 0.8773, test_f1: 0.6715
 epoch: 41, train_loss: 0.4619, test_loss: 0.7926, test_f1: 0.6669
 epoch: 42, train_loss: 0.4681, test_loss: 0.8261, test_f1: 0.6894
 epoch: 43, train_loss: 0.4412, test_loss: 0.8694, test_f1: 0.6653
 epoch: 44, train_loss: 0.4371, test_loss: 0.9197, test_f1: 0.6627
 epoch: 45, train_loss: 0.4148, test_loss: 0.9617, test_f1: 0.6695
 epoch: 46, train_loss: 0.4338, test_loss: 0.9478, test_f1: 0.6821
 epoch: 47, train_loss: 0.4223, test_loss: 1.0224, test_f1: 0.6628
 epoch: 48, train_loss: 0.4392, test_loss: 1.0358, test_f1: 0.6788
 epoch: 49, train_loss: 0.4058, test_loss: 0.9661, test_f1: 0.6804
 epoch: 50, train_loss: 0.3993, test_loss: 0.9454, test_f1: 0.6719
 epoch: 51, train_loss: 0.3507, test_loss: 0.9560, test_f1: 0.6958
 epoch: 52, train_loss: 0.3285, test_loss: 1.0395, test_f1: 0.6715
 epoch: 53, train_loss: 0.3186, test_loss: 1.1225, test_f1: 0.6689
 epoch: 54, train_loss: 0.3340, test_loss: 1.1030, test_f1: 0.6718
 epoch: 55, train_loss: 0.3279, test_loss: 1.0885, test_f1: 0.6756
 epoch: 56, train_loss: 0.2949, test_loss: 1.0674, test_f1: 0.6714
 epoch: 57, train_loss: 0.2944, test_loss: 1.1155, test_f1: 0.6766
 epoch: 58, train_loss: 0.3036, test_loss: 1.0698, test_f1: 0.6723
 epoch: 59, train_loss: 0.3068, test_loss: 1.0549, test_f1: 0.6800
 epoch: 60, train_loss: 0.3026, test_loss: 1.0971, test_f1: 0.6824
 epoch: 61, train_loss: 0.2753, test_loss: 1.1495, test_f1: 0.6727
 epoch: 62, train_loss: 0.2780, test_loss: 1.3085, test_f1: 0.6674
 epoch: 63, train_loss: 0.2762, test_loss: 1.2611, test_f1: 0.6748
 epoch: 64, train_loss: 0.2761, test_loss: 1.2586, test_f1: 0.6768
 epoch: 65, train_loss: 0.2770, test_loss: 1.3107, test_f1: 0.6741
 epoch: 66, train_loss: 0.2635, test_loss: 1.2301, test_f1: 0.6865
 epoch: 67, train_loss: 0.2576, test_loss: 1.3247, test_f1: 0.6970
 epoch: 68, train_loss: 0.2552, test_loss: 1.3503, test_f1: 0.6706
 epoch: 69, train_loss: 0.2689, test_loss: 1.3345, test_f1: 0.6597
 epoch: 70, train_loss: 0.2639, test_loss: 1.2631, test_f1: 0.6635
 epoch: 71, train_loss: 0.2479, test_loss: 1.3255, test_f1: 0.6669
 epoch: 72, train_loss: 0.2315, test_loss: 1.5045, test_f1: 0.6574
 epoch: 73, train_loss: 0.2421, test_loss: 1.3281, test_f1: 0.6680
 epoch: 74, train_loss: 0.2435, test_loss: 1.4503, test_f1: 0.6773
 epoch: 75, train_loss: 0.2344, test_loss: 1.4508, test_f1: 0.6660
 epoch: 76, train_loss: 0.2755, test_loss: 1.2663, test_f1: 0.6654
 epoch: 77, train_loss: 0.2282, test_loss: 1.4043, test_f1: 0.6611
 epoch: 78, train_loss: 0.2267, test_loss: 1.4466, test_f1: 0.6759
 epoch: 79, train_loss: 0.2143, test_loss: 1.4183, test_f1: 0.6585
 epoch: 80, train_loss: 0.2341, test_loss: 1.4400, test_f1: 0.6627
 epoch: 81, train_loss: 0.2231, test_loss: 1.3322, test_f1: 0.6739
 epoch: 82, train_loss: 0.2175, test_loss: 1.3816, test_f1: 0.6610
 epoch: 83, train_loss: 0.2631, test_loss: 1.4097, test_f1: 0.6665
 epoch: 84, train_loss: 0.2273, test_loss: 1.4185, test_f1: 0.6655
 epoch: 85, train_loss: 0.2135, test_loss: 1.4423, test_f1: 0.6829
 epoch: 86, train_loss: 0.1941, test_loss: 1.3546, test_f1: 0.6659
 epoch: 87, train_loss: 0.2449, test_loss: 1.4279, test_f1: 0.6766
 epoch: 88, train_loss: 0.2280, test_loss: 1.5297, test_f1: 0.6725
 epoch: 89, train_loss: 0.1899, test_loss: 1.4940, test_f1: 0.6649
 epoch: 90, train_loss: 0.1767, test_loss: 1.5774, test_f1: 0.6692
 epoch: 91, train_loss: 0.2248, test_loss: 1.4437, test_f1: 0.6762
 epoch: 92, train_loss: 0.1910, test_loss: 1.4617, test_f1: 0.6898
 epoch: 93, train_loss: 0.1821, test_loss: 1.6963, test_f1: 0.6612
 epoch: 94, train_loss: 0.1908, test_loss: 1.4902, test_f1: 0.6824
 epoch: 95, train_loss: 0.1820, test_loss: 1.7406, test_f1: 0.6846
 epoch: 96, train_loss: 0.2024, test_loss: 1.5014, test_f1: 0.6847
 epoch: 97, train_loss: 0.2226, test_loss: 1.3420, test_f1: 0.6629
 epoch: 98, train_loss: 0.2104, test_loss: 1.4745, test_f1: 0.6637
 epoch: 99, train_loss: 0.2018, test_loss: 1.5751, test_f1: 0.6699
##################ITERATION #8 ****************************************
 epoch: 0, train_loss: 1.1997, test_loss: 1.0153, test_f1: 0.4382
 epoch: 1, train_loss: 0.9775, test_loss: 0.9168, test_f1: 0.5545
 epoch: 2, train_loss: 0.9471, test_loss: 0.9363, test_f1: 0.5578
 epoch: 3, train_loss: 0.9124, test_loss: 0.9529, test_f1: 0.5189
 epoch: 4, train_loss: 0.8836, test_loss: 0.8953, test_f1: 0.5730
 epoch: 5, train_loss: 0.8605, test_loss: 0.8545, test_f1: 0.6121
 epoch: 6, train_loss: 0.8392, test_loss: 0.8279, test_f1: 0.5682
 epoch: 7, train_loss: 0.7892, test_loss: 0.8494, test_f1: 0.5898
 epoch: 8, train_loss: 0.7802, test_loss: 0.8174, test_f1: 0.6347
 epoch: 9, train_loss: 0.7735, test_loss: 0.8683, test_f1: 0.5961
 epoch: 10, train_loss: 0.7468, test_loss: 0.8971, test_f1: 0.6036
 epoch: 11, train_loss: 0.7421, test_loss: 0.8196, test_f1: 0.6355
 epoch: 12, train_loss: 0.7350, test_loss: 0.8260, test_f1: 0.6146
 epoch: 13, train_loss: 0.7177, test_loss: 0.7984, test_f1: 0.6374
 epoch: 14, train_loss: 0.6837, test_loss: 0.7105, test_f1: 0.6536
 epoch: 15, train_loss: 0.6935, test_loss: 0.8932, test_f1: 0.6037
 epoch: 16, train_loss: 0.6703, test_loss: 0.7187, test_f1: 0.6380
 epoch: 17, train_loss: 0.6631, test_loss: 0.7838, test_f1: 0.6264
 epoch: 18, train_loss: 0.6346, test_loss: 0.7913, test_f1: 0.6547
 epoch: 19, train_loss: 0.6212, test_loss: 0.7290, test_f1: 0.6473
 epoch: 20, train_loss: 0.6103, test_loss: 0.8843, test_f1: 0.6425
 epoch: 21, train_loss: 0.6056, test_loss: 0.7440, test_f1: 0.6280
 epoch: 22, train_loss: 0.6034, test_loss: 0.9009, test_f1: 0.6766
 epoch: 23, train_loss: 0.6056, test_loss: 0.8261, test_f1: 0.6054
 epoch: 24, train_loss: 0.6104, test_loss: 0.7202, test_f1: 0.6554
 epoch: 25, train_loss: 0.5777, test_loss: 0.7206, test_f1: 0.6641
 epoch: 26, train_loss: 0.5780, test_loss: 0.7594, test_f1: 0.6325
 epoch: 27, train_loss: 0.5602, test_loss: 0.7662, test_f1: 0.6719
 epoch: 28, train_loss: 0.5653, test_loss: 0.7424, test_f1: 0.6779
 epoch: 29, train_loss: 0.5518, test_loss: 0.7732, test_f1: 0.6474
 epoch: 30, train_loss: 0.5335, test_loss: 0.7941, test_f1: 0.6522
 epoch: 31, train_loss: 0.5296, test_loss: 0.6844, test_f1: 0.7142
 epoch: 32, train_loss: 0.5216, test_loss: 0.7371, test_f1: 0.6644
 epoch: 33, train_loss: 0.5271, test_loss: 0.8784, test_f1: 0.6139
 epoch: 34, train_loss: 0.4999, test_loss: 0.7716, test_f1: 0.6568
 epoch: 35, train_loss: 0.4864, test_loss: 0.8714, test_f1: 0.6690
 epoch: 36, train_loss: 0.5073, test_loss: 0.7979, test_f1: 0.6470
 epoch: 37, train_loss: 0.5175, test_loss: 0.7455, test_f1: 0.6737
 epoch: 38, train_loss: 0.4846, test_loss: 0.6614, test_f1: 0.7173
 epoch: 39, train_loss: 0.4905, test_loss: 0.7379, test_f1: 0.7128
 epoch: 40, train_loss: 0.4703, test_loss: 0.7050, test_f1: 0.7045
 epoch: 41, train_loss: 0.4545, test_loss: 0.7810, test_f1: 0.6704
 epoch: 42, train_loss: 0.4499, test_loss: 0.8448, test_f1: 0.6764
 epoch: 43, train_loss: 0.4625, test_loss: 0.6860, test_f1: 0.7041
 epoch: 44, train_loss: 0.4332, test_loss: 0.8118, test_f1: 0.6596
 epoch: 45, train_loss: 0.4252, test_loss: 0.8535, test_f1: 0.6695
 epoch: 46, train_loss: 0.4169, test_loss: 0.8119, test_f1: 0.6585
 epoch: 47, train_loss: 0.4357, test_loss: 0.7647, test_f1: 0.6879
 epoch: 48, train_loss: 0.4149, test_loss: 0.8287, test_f1: 0.6861
 epoch: 49, train_loss: 0.4123, test_loss: 0.9081, test_f1: 0.6539
 epoch: 50, train_loss: 0.4240, test_loss: 0.8952, test_f1: 0.6663
 epoch: 51, train_loss: 0.3598, test_loss: 0.9282, test_f1: 0.6848
 epoch: 52, train_loss: 0.3477, test_loss: 0.8806, test_f1: 0.6629
 epoch: 53, train_loss: 0.3385, test_loss: 1.0178, test_f1: 0.6801
 epoch: 54, train_loss: 0.3329, test_loss: 0.9241, test_f1: 0.6774
 epoch: 55, train_loss: 0.3277, test_loss: 1.0364, test_f1: 0.6697
 epoch: 56, train_loss: 0.3293, test_loss: 1.0516, test_f1: 0.6773
 epoch: 57, train_loss: 0.3074, test_loss: 1.0906, test_f1: 0.6790
 epoch: 58, train_loss: 0.3220, test_loss: 0.9574, test_f1: 0.6920
 epoch: 59, train_loss: 0.2916, test_loss: 1.1782, test_f1: 0.6596
 epoch: 60, train_loss: 0.3023, test_loss: 1.0403, test_f1: 0.6755
 epoch: 61, train_loss: 0.3229, test_loss: 1.0027, test_f1: 0.6695
 epoch: 62, train_loss: 0.2982, test_loss: 1.0434, test_f1: 0.6939
 epoch: 63, train_loss: 0.2950, test_loss: 1.0866, test_f1: 0.6657
 epoch: 64, train_loss: 0.2809, test_loss: 0.9511, test_f1: 0.6759
 epoch: 65, train_loss: 0.2629, test_loss: 1.1444, test_f1: 0.6657
 epoch: 66, train_loss: 0.2727, test_loss: 1.0710, test_f1: 0.6878
 epoch: 67, train_loss: 0.2852, test_loss: 1.1111, test_f1: 0.6850
 epoch: 68, train_loss: 0.2654, test_loss: 1.1069, test_f1: 0.6758
 epoch: 69, train_loss: 0.2591, test_loss: 1.1822, test_f1: 0.6892
 epoch: 70, train_loss: 0.2602, test_loss: 1.2776, test_f1: 0.6639
 epoch: 71, train_loss: 0.2742, test_loss: 1.1988, test_f1: 0.6697
 epoch: 72, train_loss: 0.2611, test_loss: 1.2514, test_f1: 0.6854
 epoch: 73, train_loss: 0.2556, test_loss: 1.2844, test_f1: 0.6733
 epoch: 74, train_loss: 0.2415, test_loss: 1.2309, test_f1: 0.6827
 epoch: 75, train_loss: 0.2475, test_loss: 1.2142, test_f1: 0.6807
 epoch: 76, train_loss: 0.2230, test_loss: 1.2177, test_f1: 0.6734
 epoch: 77, train_loss: 0.2515, test_loss: 1.1869, test_f1: 0.6679
 epoch: 78, train_loss: 0.2570, test_loss: 1.3065, test_f1: 0.6785
 epoch: 79, train_loss: 0.2397, test_loss: 1.3136, test_f1: 0.6650
 epoch: 80, train_loss: 0.2530, test_loss: 1.2054, test_f1: 0.6829
 epoch: 81, train_loss: 0.2140, test_loss: 1.2909, test_f1: 0.6721
 epoch: 82, train_loss: 0.2442, test_loss: 1.2434, test_f1: 0.6766
 epoch: 83, train_loss: 0.2357, test_loss: 1.2531, test_f1: 0.6874
 epoch: 84, train_loss: 0.2249, test_loss: 1.4004, test_f1: 0.6797
 epoch: 85, train_loss: 0.2384, test_loss: 1.2499, test_f1: 0.6845
 epoch: 86, train_loss: 0.2243, test_loss: 1.3297, test_f1: 0.6752
 epoch: 87, train_loss: 0.2211, test_loss: 1.3689, test_f1: 0.6747
 epoch: 88, train_loss: 0.2057, test_loss: 1.3494, test_f1: 0.6709
 epoch: 89, train_loss: 0.2250, test_loss: 1.3018, test_f1: 0.6660
 epoch: 90, train_loss: 0.2196, test_loss: 1.2813, test_f1: 0.6984
 epoch: 91, train_loss: 0.2053, test_loss: 1.3681, test_f1: 0.6707
 epoch: 92, train_loss: 0.2049, test_loss: 1.4427, test_f1: 0.6571
 epoch: 93, train_loss: 0.2047, test_loss: 1.3709, test_f1: 0.6679
 epoch: 94, train_loss: 0.2056, test_loss: 1.3270, test_f1: 0.6650
 epoch: 95, train_loss: 0.2114, test_loss: 1.3975, test_f1: 0.6857
 epoch: 96, train_loss: 0.1810, test_loss: 1.4037, test_f1: 0.6889
 epoch: 97, train_loss: 0.2049, test_loss: 1.4640, test_f1: 0.6722
 epoch: 98, train_loss: 0.2113, test_loss: 1.4418, test_f1: 0.6833
 epoch: 99, train_loss: 0.2108, test_loss: 1.4214, test_f1: 0.6581
##################ITERATION #9 ****************************************
 epoch: 0, train_loss: 1.1918, test_loss: 1.0215, test_f1: 0.5148
 epoch: 1, train_loss: 0.9750, test_loss: 0.9666, test_f1: 0.5291
 epoch: 2, train_loss: 0.9261, test_loss: 0.9200, test_f1: 0.5414
 epoch: 3, train_loss: 0.8963, test_loss: 1.2123, test_f1: 0.4841
 epoch: 4, train_loss: 0.8873, test_loss: 0.8419, test_f1: 0.5764
 epoch: 5, train_loss: 0.8535, test_loss: 0.8525, test_f1: 0.5661
 epoch: 6, train_loss: 0.8283, test_loss: 0.8108, test_f1: 0.5589
 epoch: 7, train_loss: 0.8028, test_loss: 0.8245, test_f1: 0.5950
 epoch: 8, train_loss: 0.7765, test_loss: 0.7535, test_f1: 0.6177
 epoch: 9, train_loss: 0.7685, test_loss: 0.7705, test_f1: 0.6111
 epoch: 10, train_loss: 0.7578, test_loss: 0.8000, test_f1: 0.6197
 epoch: 11, train_loss: 0.7296, test_loss: 0.7608, test_f1: 0.6800
 epoch: 12, train_loss: 0.7408, test_loss: 0.8109, test_f1: 0.6096
 epoch: 13, train_loss: 0.7188, test_loss: 0.7979, test_f1: 0.6363
 epoch: 14, train_loss: 0.6807, test_loss: 0.7412, test_f1: 0.6500
 epoch: 15, train_loss: 0.6730, test_loss: 0.7565, test_f1: 0.6500
 epoch: 16, train_loss: 0.6872, test_loss: 0.7538, test_f1: 0.6678
 epoch: 17, train_loss: 0.6494, test_loss: 0.7424, test_f1: 0.6323
 epoch: 18, train_loss: 0.6501, test_loss: 0.7649, test_f1: 0.6476
 epoch: 19, train_loss: 0.6654, test_loss: 0.8215, test_f1: 0.6310
 epoch: 20, train_loss: 0.6236, test_loss: 0.7906, test_f1: 0.6605
 epoch: 21, train_loss: 0.6329, test_loss: 0.7779, test_f1: 0.6717
 epoch: 22, train_loss: 0.6046, test_loss: 0.8520, test_f1: 0.6467
 epoch: 23, train_loss: 0.5817, test_loss: 0.8222, test_f1: 0.6635
 epoch: 24, train_loss: 0.5781, test_loss: 0.8284, test_f1: 0.6479
 epoch: 25, train_loss: 0.5921, test_loss: 0.7300, test_f1: 0.6528
 epoch: 26, train_loss: 0.5559, test_loss: 0.7564, test_f1: 0.6454
 epoch: 27, train_loss: 0.5429, test_loss: 0.8009, test_f1: 0.6605
 epoch: 28, train_loss: 0.5551, test_loss: 0.7160, test_f1: 0.6780
 epoch: 29, train_loss: 0.5451, test_loss: 0.9608, test_f1: 0.6673
 epoch: 30, train_loss: 0.5187, test_loss: 0.8281, test_f1: 0.6513
 epoch: 31, train_loss: 0.5379, test_loss: 0.8696, test_f1: 0.6528
 epoch: 32, train_loss: 0.5449, test_loss: 0.7638, test_f1: 0.6502
 epoch: 33, train_loss: 0.5130, test_loss: 0.8361, test_f1: 0.6579
 epoch: 34, train_loss: 0.5049, test_loss: 0.7454, test_f1: 0.6631
 epoch: 35, train_loss: 0.5231, test_loss: 0.8115, test_f1: 0.6622
 epoch: 36, train_loss: 0.4964, test_loss: 0.8785, test_f1: 0.6721
 epoch: 37, train_loss: 0.4760, test_loss: 0.9789, test_f1: 0.6577
 epoch: 38, train_loss: 0.4827, test_loss: 0.8357, test_f1: 0.6735
 epoch: 39, train_loss: 0.5001, test_loss: 0.9414, test_f1: 0.6642
 epoch: 40, train_loss: 0.4806, test_loss: 0.8946, test_f1: 0.6630
 epoch: 41, train_loss: 0.4718, test_loss: 0.8933, test_f1: 0.6487
 epoch: 42, train_loss: 0.4345, test_loss: 0.8131, test_f1: 0.6831
 epoch: 43, train_loss: 0.4469, test_loss: 0.8007, test_f1: 0.6459
 epoch: 44, train_loss: 0.4486, test_loss: 0.9498, test_f1: 0.6894
 epoch: 45, train_loss: 0.4478, test_loss: 0.9189, test_f1: 0.6739
 epoch: 46, train_loss: 0.4574, test_loss: 0.8985, test_f1: 0.6719
 epoch: 47, train_loss: 0.4975, test_loss: 0.9284, test_f1: 0.6542
 epoch: 48, train_loss: 0.4490, test_loss: 0.7929, test_f1: 0.6813
 epoch: 49, train_loss: 0.4351, test_loss: 0.8687, test_f1: 0.6850
 epoch: 50, train_loss: 0.4508, test_loss: 0.8445, test_f1: 0.6941
 epoch: 51, train_loss: 0.3768, test_loss: 0.9239, test_f1: 0.6651
 epoch: 52, train_loss: 0.3649, test_loss: 0.9868, test_f1: 0.6751
 epoch: 53, train_loss: 0.3571, test_loss: 0.9850, test_f1: 0.6778
 epoch: 54, train_loss: 0.3267, test_loss: 1.0958, test_f1: 0.6715
 epoch: 55, train_loss: 0.3350, test_loss: 1.0750, test_f1: 0.6744
 epoch: 56, train_loss: 0.3361, test_loss: 1.0165, test_f1: 0.6676
 epoch: 57, train_loss: 0.3154, test_loss: 1.0958, test_f1: 0.6747
 epoch: 58, train_loss: 0.3144, test_loss: 1.0674, test_f1: 0.6756
 epoch: 59, train_loss: 0.3129, test_loss: 0.9926, test_f1: 0.6767
 epoch: 60, train_loss: 0.3058, test_loss: 1.0568, test_f1: 0.6671
 epoch: 61, train_loss: 0.2963, test_loss: 1.0992, test_f1: 0.6810
 epoch: 62, train_loss: 0.3111, test_loss: 1.1533, test_f1: 0.6650
 epoch: 63, train_loss: 0.3085, test_loss: 1.1858, test_f1: 0.6632
 epoch: 64, train_loss: 0.3111, test_loss: 1.0038, test_f1: 0.6818
 epoch: 65, train_loss: 0.2925, test_loss: 1.0428, test_f1: 0.6771
 epoch: 66, train_loss: 0.2788, test_loss: 1.1338, test_f1: 0.6696
 epoch: 67, train_loss: 0.2673, test_loss: 1.0601, test_f1: 0.6672
 epoch: 68, train_loss: 0.2712, test_loss: 1.0553, test_f1: 0.6791
 epoch: 69, train_loss: 0.2851, test_loss: 0.9983, test_f1: 0.6730
 epoch: 70, train_loss: 0.2774, test_loss: 1.1499, test_f1: 0.6642
 epoch: 71, train_loss: 0.2484, test_loss: 1.2121, test_f1: 0.6664
 epoch: 72, train_loss: 0.2676, test_loss: 1.0871, test_f1: 0.6818
 epoch: 73, train_loss: 0.2610, test_loss: 1.1086, test_f1: 0.6721
 epoch: 74, train_loss: 0.2569, test_loss: 1.1412, test_f1: 0.6806
 epoch: 75, train_loss: 0.2523, test_loss: 1.2071, test_f1: 0.6693
 epoch: 76, train_loss: 0.2483, test_loss: 1.1464, test_f1: 0.6630
 epoch: 77, train_loss: 0.2473, test_loss: 1.2666, test_f1: 0.6707
 epoch: 78, train_loss: 0.2428, test_loss: 1.3580, test_f1: 0.6627
 epoch: 79, train_loss: 0.2503, test_loss: 1.2563, test_f1: 0.6826
 epoch: 80, train_loss: 0.2485, test_loss: 1.3581, test_f1: 0.6623
 epoch: 81, train_loss: 0.2345, test_loss: 1.2387, test_f1: 0.6801
 epoch: 82, train_loss: 0.2432, test_loss: 1.1655, test_f1: 0.6666
 epoch: 83, train_loss: 0.2183, test_loss: 1.3182, test_f1: 0.6711
 epoch: 84, train_loss: 0.2506, test_loss: 1.4566, test_f1: 0.6622
 epoch: 85, train_loss: 0.2340, test_loss: 1.1685, test_f1: 0.6787
 epoch: 86, train_loss: 0.2497, test_loss: 1.2337, test_f1: 0.6749
 epoch: 87, train_loss: 0.2386, test_loss: 1.3524, test_f1: 0.6676
 epoch: 88, train_loss: 0.2463, test_loss: 1.3174, test_f1: 0.6838
 epoch: 89, train_loss: 0.2478, test_loss: 1.3301, test_f1: 0.6706
 epoch: 90, train_loss: 0.2183, test_loss: 1.3387, test_f1: 0.6657
 epoch: 91, train_loss: 0.2137, test_loss: 1.2952, test_f1: 0.6545
 epoch: 92, train_loss: 0.2312, test_loss: 1.2608, test_f1: 0.6723
 epoch: 93, train_loss: 0.2026, test_loss: 1.2682, test_f1: 0.6682
 epoch: 94, train_loss: 0.2112, test_loss: 1.1414, test_f1: 0.6820
 epoch: 95, train_loss: 0.2116, test_loss: 1.3522, test_f1: 0.6732
 epoch: 96, train_loss: 0.1907, test_loss: 1.4704, test_f1: 0.6581
 epoch: 97, train_loss: 0.2024, test_loss: 1.3417, test_f1: 0.6860
 epoch: 98, train_loss: 0.2122, test_loss: 1.2743, test_f1: 0.6726
 epoch: 99, train_loss: 0.2168, test_loss: 1.4032, test_f1: 0.6670

Training completed in 1454.94 seconds
Best F1: 0.7307 at epoch 88
Mean F1 across iterations: 0.7103  0.0115
========================FINAL RESULTS================================
FEGIN weighted F1: 0.7307  0.0115
python main.py --data ltspice_examples --representation component_pin_net --model FEGIN --layers 6 --hiddens 128 --batch_size 32 --lr 0.001 --emb_size 128 --epochs 100 --save_appendix component_pin_net_L6_H128_BS32_LR0.001_E128 --no_val
-----



STDERR:
  File "main.py", line 370, in <module>
    main()
  File "main.py", line 254, in main
    dataset = dataset_class(
  File "/home/philip/projects/ltspice_examples_code_repo/Circuit-Completion-Using-GNNs/component_classification_with_link_prediction_head/evaluation/FEGIN/kernel/circuit_datasets.py", line 15, in __init__
    self.data, self.slices = torch.load(self.processed_paths[0])
  File "/home/philip/.local/lib/python3.8/site-packages/torch/serialization.py", line 1040, in load
    warnings.warn(
  File "/usr/lib/python3.8/warnings.py", line 109, in _showwarnmsg
    sw(msg.message, msg.category, msg.filename, msg.lineno,
  File "main.py", line 47, in warn_with_traceback
    traceback.print_stack(file=log)
/home/philip/projects/ltspice_examples_code_repo/Circuit-Completion-Using-GNNs/component_classification_with_link_prediction_head/evaluation/FEGIN/kernel/circuit_datasets.py:15: FutureWarning: You are using `torch.load` with `weights_only=False` (the current default value), which uses the default pickle module implicitly. It is possible to construct malicious pickle data which will execute arbitrary code during unpickling (See https://github.com/pytorch/pytorch/blob/main/SECURITY.md#untrusted-models for more details). In a future release, the default value for `weights_only` will be flipped to `True`. This limits the functions that could be executed during unpickling. Arbitrary objects will no longer be allowed to be loaded via this mode unless they are explicitly allowlisted by the user via `torch.serialization.add_safe_globals`. We recommend you start setting `weights_only=True` for any use case where you don't have full control of the loaded file. Please open an issue on GitHub for any issues related to this experimental feature.
  self.data, self.slices = torch.load(self.processed_paths[0])
