STDOUT:
Results will be saved in /home/philip/projects/ltspice_examples_code_repo/Circuit-Completion-Using-GNNs/component_classification_with_link_prediction_head/evaluation/FEGIN/results/model_FEGIN_dataset_ltspice_demos
Command line input: python main.py --data ltspice_demos --representation component_pin_net --model FEGIN --layers 6 --hiddens 32 --batch_size 128 --lr 0.0001 --emb_size 128 --epochs 100 --save_appendix component_pin_net_L6_H32_BS128_LR0.0001_E128 --no_val
 is saved.
-----
ltspice_demos - FEGIN
Using 6 layers, 32 hidden units, h = 2
Loading component_pin_net representation dataset
ENTERED
Training FEGIN on component_pin_net representation
Train: 1565, Test: 383
##################ITERATION #0 ****************************************
 epoch: 0, train_loss: 1.4095, test_loss: 1.4019, test_f1: 0.0301
 epoch: 1, train_loss: 1.4042, test_loss: 1.3985, test_f1: 0.0301
 epoch: 2, train_loss: 1.4011, test_loss: 1.3947, test_f1: 0.0301
 epoch: 3, train_loss: 1.3979, test_loss: 1.3939, test_f1: 0.0301
 epoch: 4, train_loss: 1.3952, test_loss: 1.3926, test_f1: 0.0982
 epoch: 5, train_loss: 1.3921, test_loss: 1.3906, test_f1: 0.1613
 epoch: 6, train_loss: 1.3897, test_loss: 1.3869, test_f1: 0.1904
 epoch: 7, train_loss: 1.3862, test_loss: 1.3825, test_f1: 0.3084
 epoch: 8, train_loss: 1.3834, test_loss: 1.3793, test_f1: 0.3529
 epoch: 9, train_loss: 1.3786, test_loss: 1.3753, test_f1: 0.3296
 epoch: 10, train_loss: 1.3740, test_loss: 1.3713, test_f1: 0.3176
 epoch: 11, train_loss: 1.3689, test_loss: 1.3659, test_f1: 0.3209
 epoch: 12, train_loss: 1.3631, test_loss: 1.3604, test_f1: 0.3001
 epoch: 13, train_loss: 1.3561, test_loss: 1.3539, test_f1: 0.3165
 epoch: 14, train_loss: 1.3480, test_loss: 1.3472, test_f1: 0.3051
 epoch: 15, train_loss: 1.3406, test_loss: 1.3400, test_f1: 0.2796
 epoch: 16, train_loss: 1.3322, test_loss: 1.3310, test_f1: 0.2630
 epoch: 17, train_loss: 1.3237, test_loss: 1.3231, test_f1: 0.2586
 epoch: 18, train_loss: 1.3156, test_loss: 1.3153, test_f1: 0.2630
 epoch: 19, train_loss: 1.3066, test_loss: 1.3038, test_f1: 0.2540
 epoch: 20, train_loss: 1.2946, test_loss: 1.2976, test_f1: 0.2540
 epoch: 21, train_loss: 1.2883, test_loss: 1.2905, test_f1: 0.2540
 epoch: 22, train_loss: 1.2786, test_loss: 1.2819, test_f1: 0.2586
 epoch: 23, train_loss: 1.2681, test_loss: 1.2767, test_f1: 0.2716
 epoch: 24, train_loss: 1.2617, test_loss: 1.2692, test_f1: 0.2718
 epoch: 25, train_loss: 1.2558, test_loss: 1.2615, test_f1: 0.2759
 epoch: 26, train_loss: 1.2468, test_loss: 1.2561, test_f1: 0.2793
 epoch: 27, train_loss: 1.2351, test_loss: 1.2491, test_f1: 0.2796
 epoch: 28, train_loss: 1.2230, test_loss: 1.2438, test_f1: 0.2791
 epoch: 29, train_loss: 1.2222, test_loss: 1.2392, test_f1: 0.2936
 epoch: 30, train_loss: 1.2085, test_loss: 1.2332, test_f1: 0.3215
 epoch: 31, train_loss: 1.2072, test_loss: 1.2275, test_f1: 0.3067
 epoch: 32, train_loss: 1.1964, test_loss: 1.2224, test_f1: 0.3215
 epoch: 33, train_loss: 1.1878, test_loss: 1.2176, test_f1: 0.3243
 epoch: 34, train_loss: 1.1884, test_loss: 1.2156, test_f1: 0.3222
 epoch: 35, train_loss: 1.1756, test_loss: 1.2050, test_f1: 0.3215
 epoch: 36, train_loss: 1.1642, test_loss: 1.2015, test_f1: 0.3270
 epoch: 37, train_loss: 1.1607, test_loss: 1.1981, test_f1: 0.3555
 epoch: 38, train_loss: 1.1543, test_loss: 1.1939, test_f1: 0.3782
 epoch: 39, train_loss: 1.1492, test_loss: 1.1886, test_f1: 0.4192
 epoch: 40, train_loss: 1.1361, test_loss: 1.1821, test_f1: 0.4206
 epoch: 41, train_loss: 1.1429, test_loss: 1.1778, test_f1: 0.4189
 epoch: 42, train_loss: 1.1301, test_loss: 1.1734, test_f1: 0.4219
 epoch: 43, train_loss: 1.1166, test_loss: 1.1693, test_f1: 0.4146
 epoch: 44, train_loss: 1.1150, test_loss: 1.1643, test_f1: 0.4171
 epoch: 45, train_loss: 1.1046, test_loss: 1.1567, test_f1: 0.4189
 epoch: 46, train_loss: 1.1032, test_loss: 1.1541, test_f1: 0.4165
 epoch: 47, train_loss: 1.0950, test_loss: 1.1455, test_f1: 0.4171
 epoch: 48, train_loss: 1.0863, test_loss: 1.1414, test_f1: 0.4171
 epoch: 49, train_loss: 1.0803, test_loss: 1.1388, test_f1: 0.4223
 epoch: 50, train_loss: 1.0753, test_loss: 1.1323, test_f1: 0.4260
 epoch: 51, train_loss: 1.0665, test_loss: 1.1310, test_f1: 0.4260
 epoch: 52, train_loss: 1.0639, test_loss: 1.1304, test_f1: 0.4257
 epoch: 53, train_loss: 1.0621, test_loss: 1.1261, test_f1: 0.4261
 epoch: 54, train_loss: 1.0602, test_loss: 1.1241, test_f1: 0.4337
 epoch: 55, train_loss: 1.0613, test_loss: 1.1202, test_f1: 0.4308
 epoch: 56, train_loss: 1.0629, test_loss: 1.1176, test_f1: 0.4317
 epoch: 57, train_loss: 1.0577, test_loss: 1.1174, test_f1: 0.4314
 epoch: 58, train_loss: 1.0537, test_loss: 1.1172, test_f1: 0.4313
 epoch: 59, train_loss: 1.0450, test_loss: 1.1124, test_f1: 0.4307
 epoch: 60, train_loss: 1.0465, test_loss: 1.1129, test_f1: 0.4311
 epoch: 61, train_loss: 1.0383, test_loss: 1.1100, test_f1: 0.4361
 epoch: 62, train_loss: 1.0532, test_loss: 1.1062, test_f1: 0.4346
 epoch: 63, train_loss: 1.0376, test_loss: 1.1086, test_f1: 0.4507
 epoch: 64, train_loss: 1.0426, test_loss: 1.1048, test_f1: 0.4396
 epoch: 65, train_loss: 1.0349, test_loss: 1.1001, test_f1: 0.4425
 epoch: 66, train_loss: 1.0442, test_loss: 1.1008, test_f1: 0.4402
 epoch: 67, train_loss: 1.0316, test_loss: 1.0969, test_f1: 0.4441
 epoch: 68, train_loss: 1.0321, test_loss: 1.0956, test_f1: 0.4480
 epoch: 69, train_loss: 1.0335, test_loss: 1.0962, test_f1: 0.4596
 epoch: 70, train_loss: 1.0210, test_loss: 1.0934, test_f1: 0.4522
 epoch: 71, train_loss: 1.0287, test_loss: 1.0896, test_f1: 0.4468
 epoch: 72, train_loss: 1.0157, test_loss: 1.0905, test_f1: 0.4546
 epoch: 73, train_loss: 1.0200, test_loss: 1.0905, test_f1: 0.4468
 epoch: 74, train_loss: 1.0217, test_loss: 1.0909, test_f1: 0.4668
 epoch: 75, train_loss: 1.0191, test_loss: 1.0901, test_f1: 0.4637
 epoch: 76, train_loss: 1.0108, test_loss: 1.0883, test_f1: 0.4667
 epoch: 77, train_loss: 1.0120, test_loss: 1.0873, test_f1: 0.4609
 epoch: 78, train_loss: 1.0164, test_loss: 1.0857, test_f1: 0.4673
 epoch: 79, train_loss: 1.0118, test_loss: 1.0851, test_f1: 0.4668
 epoch: 80, train_loss: 1.0056, test_loss: 1.0810, test_f1: 0.4668
 epoch: 81, train_loss: 0.9984, test_loss: 1.0835, test_f1: 0.4667
 epoch: 82, train_loss: 0.9993, test_loss: 1.0809, test_f1: 0.4625
 epoch: 83, train_loss: 1.0059, test_loss: 1.0799, test_f1: 0.4644
 epoch: 84, train_loss: 0.9997, test_loss: 1.0771, test_f1: 0.4644
 epoch: 85, train_loss: 0.9999, test_loss: 1.0790, test_f1: 0.4691
 epoch: 86, train_loss: 0.9986, test_loss: 1.0737, test_f1: 0.4668
 epoch: 87, train_loss: 0.9920, test_loss: 1.0751, test_f1: 0.4723
 epoch: 88, train_loss: 0.9963, test_loss: 1.0771, test_f1: 0.4698
 epoch: 89, train_loss: 0.9824, test_loss: 1.0740, test_f1: 0.4772
 epoch: 90, train_loss: 0.9867, test_loss: 1.0739, test_f1: 0.4702
 epoch: 91, train_loss: 0.9892, test_loss: 1.0664, test_f1: 0.4650
 epoch: 92, train_loss: 0.9863, test_loss: 1.0641, test_f1: 0.4596
 epoch: 93, train_loss: 0.9835, test_loss: 1.0722, test_f1: 0.4698
 epoch: 94, train_loss: 0.9779, test_loss: 1.0631, test_f1: 0.4596
 epoch: 95, train_loss: 0.9829, test_loss: 1.0632, test_f1: 0.4645
 epoch: 96, train_loss: 0.9790, test_loss: 1.0628, test_f1: 0.4804
 epoch: 97, train_loss: 0.9740, test_loss: 1.0662, test_f1: 0.4727
 epoch: 98, train_loss: 0.9808, test_loss: 1.0636, test_f1: 0.4727
 epoch: 99, train_loss: 0.9777, test_loss: 1.0607, test_f1: 0.4754
##################ITERATION #1 ****************************************
 epoch: 0, train_loss: 1.3793, test_loss: 1.3825, test_f1: 0.2281
 epoch: 1, train_loss: 1.3681, test_loss: 1.3801, test_f1: 0.2281
 epoch: 2, train_loss: 1.3608, test_loss: 1.3738, test_f1: 0.2281
 epoch: 3, train_loss: 1.3548, test_loss: 1.3678, test_f1: 0.2281
 epoch: 4, train_loss: 1.3478, test_loss: 1.3678, test_f1: 0.2281
 epoch: 5, train_loss: 1.3393, test_loss: 1.3595, test_f1: 0.2575
 epoch: 6, train_loss: 1.3321, test_loss: 1.3504, test_f1: 0.2882
 epoch: 7, train_loss: 1.3230, test_loss: 1.3429, test_f1: 0.3397
 epoch: 8, train_loss: 1.3150, test_loss: 1.3364, test_f1: 0.3444
 epoch: 9, train_loss: 1.3056, test_loss: 1.3294, test_f1: 0.3479
 epoch: 10, train_loss: 1.2977, test_loss: 1.3223, test_f1: 0.3444
 epoch: 11, train_loss: 1.2862, test_loss: 1.3135, test_f1: 0.3562
 epoch: 12, train_loss: 1.2756, test_loss: 1.3044, test_f1: 0.3544
 epoch: 13, train_loss: 1.2640, test_loss: 1.2979, test_f1: 0.3687
 epoch: 14, train_loss: 1.2481, test_loss: 1.2881, test_f1: 0.3455
 epoch: 15, train_loss: 1.2379, test_loss: 1.2805, test_f1: 0.3745
 epoch: 16, train_loss: 1.2247, test_loss: 1.2717, test_f1: 0.3817
 epoch: 17, train_loss: 1.2201, test_loss: 1.2632, test_f1: 0.3859
 epoch: 18, train_loss: 1.2007, test_loss: 1.2570, test_f1: 0.3856
 epoch: 19, train_loss: 1.1997, test_loss: 1.2505, test_f1: 0.4051
 epoch: 20, train_loss: 1.1843, test_loss: 1.2415, test_f1: 0.4051
 epoch: 21, train_loss: 1.1738, test_loss: 1.2349, test_f1: 0.4187
 epoch: 22, train_loss: 1.1650, test_loss: 1.2306, test_f1: 0.4220
 epoch: 23, train_loss: 1.1610, test_loss: 1.2242, test_f1: 0.4198
 epoch: 24, train_loss: 1.1528, test_loss: 1.2207, test_f1: 0.4289
 epoch: 25, train_loss: 1.1455, test_loss: 1.2135, test_f1: 0.4314
 epoch: 26, train_loss: 1.1394, test_loss: 1.2084, test_f1: 0.4362
 epoch: 27, train_loss: 1.1328, test_loss: 1.2027, test_f1: 0.4393
 epoch: 28, train_loss: 1.1204, test_loss: 1.1977, test_f1: 0.4398
 epoch: 29, train_loss: 1.1137, test_loss: 1.1944, test_f1: 0.4389
 epoch: 30, train_loss: 1.1062, test_loss: 1.1874, test_f1: 0.4416
 epoch: 31, train_loss: 1.1050, test_loss: 1.1820, test_f1: 0.4416
 epoch: 32, train_loss: 1.1063, test_loss: 1.1771, test_f1: 0.4416
 epoch: 33, train_loss: 1.0951, test_loss: 1.1749, test_f1: 0.4393
 epoch: 34, train_loss: 1.0937, test_loss: 1.1678, test_f1: 0.4393
 epoch: 35, train_loss: 1.0816, test_loss: 1.1641, test_f1: 0.4393
 epoch: 36, train_loss: 1.0775, test_loss: 1.1605, test_f1: 0.4393
 epoch: 37, train_loss: 1.0740, test_loss: 1.1599, test_f1: 0.4342
 epoch: 38, train_loss: 1.0645, test_loss: 1.1544, test_f1: 0.4389
 epoch: 39, train_loss: 1.0590, test_loss: 1.1526, test_f1: 0.4345
 epoch: 40, train_loss: 1.0481, test_loss: 1.1484, test_f1: 0.4441
 epoch: 41, train_loss: 1.0490, test_loss: 1.1408, test_f1: 0.4443
 epoch: 42, train_loss: 1.0530, test_loss: 1.1382, test_f1: 0.4417
 epoch: 43, train_loss: 1.0431, test_loss: 1.1355, test_f1: 0.4464
 epoch: 44, train_loss: 1.0419, test_loss: 1.1348, test_f1: 0.4417
 epoch: 45, train_loss: 1.0348, test_loss: 1.1337, test_f1: 0.4446
 epoch: 46, train_loss: 1.0354, test_loss: 1.1309, test_f1: 0.4377
 epoch: 47, train_loss: 1.0248, test_loss: 1.1283, test_f1: 0.4422
 epoch: 48, train_loss: 1.0246, test_loss: 1.1221, test_f1: 0.4499
 epoch: 49, train_loss: 1.0218, test_loss: 1.1211, test_f1: 0.4464
 epoch: 50, train_loss: 1.0191, test_loss: 1.1192, test_f1: 0.4513
 epoch: 51, train_loss: 1.0182, test_loss: 1.1218, test_f1: 0.4466
 epoch: 52, train_loss: 1.0184, test_loss: 1.1193, test_f1: 0.4441
 epoch: 53, train_loss: 1.0129, test_loss: 1.1225, test_f1: 0.4441
 epoch: 54, train_loss: 1.0143, test_loss: 1.1213, test_f1: 0.4466
 epoch: 55, train_loss: 1.0097, test_loss: 1.1213, test_f1: 0.4513
 epoch: 56, train_loss: 1.0078, test_loss: 1.1221, test_f1: 0.4441
 epoch: 57, train_loss: 1.0048, test_loss: 1.1217, test_f1: 0.4488
 epoch: 58, train_loss: 0.9981, test_loss: 1.1195, test_f1: 0.4513
 epoch: 59, train_loss: 1.0100, test_loss: 1.1193, test_f1: 0.4513
 epoch: 60, train_loss: 1.0010, test_loss: 1.1183, test_f1: 0.4519
 epoch: 61, train_loss: 1.0036, test_loss: 1.1184, test_f1: 0.4466
 epoch: 62, train_loss: 1.0025, test_loss: 1.1159, test_f1: 0.4466
 epoch: 63, train_loss: 0.9894, test_loss: 1.1167, test_f1: 0.4466
 epoch: 64, train_loss: 0.9966, test_loss: 1.1151, test_f1: 0.4491
 epoch: 65, train_loss: 0.9910, test_loss: 1.1116, test_f1: 0.4500
 epoch: 66, train_loss: 0.9853, test_loss: 1.1135, test_f1: 0.4495
 epoch: 67, train_loss: 0.9871, test_loss: 1.1137, test_f1: 0.4489
 epoch: 68, train_loss: 0.9932, test_loss: 1.1148, test_f1: 0.4516
 epoch: 69, train_loss: 0.9859, test_loss: 1.1135, test_f1: 0.4482
 epoch: 70, train_loss: 0.9852, test_loss: 1.1149, test_f1: 0.4467
 epoch: 71, train_loss: 0.9880, test_loss: 1.1123, test_f1: 0.4491
 epoch: 72, train_loss: 0.9866, test_loss: 1.1099, test_f1: 0.4473
 epoch: 73, train_loss: 0.9760, test_loss: 1.1112, test_f1: 0.4513
 epoch: 74, train_loss: 0.9787, test_loss: 1.1125, test_f1: 0.4469
 epoch: 75, train_loss: 0.9830, test_loss: 1.1134, test_f1: 0.4473
 epoch: 76, train_loss: 0.9799, test_loss: 1.1130, test_f1: 0.4466
 epoch: 77, train_loss: 0.9730, test_loss: 1.1116, test_f1: 0.4471
 epoch: 78, train_loss: 0.9768, test_loss: 1.1083, test_f1: 0.4491
 epoch: 79, train_loss: 0.9769, test_loss: 1.1093, test_f1: 0.4471
 epoch: 80, train_loss: 0.9730, test_loss: 1.1085, test_f1: 0.4491
 epoch: 81, train_loss: 0.9742, test_loss: 1.1073, test_f1: 0.4496
 epoch: 82, train_loss: 0.9714, test_loss: 1.1095, test_f1: 0.4467
 epoch: 83, train_loss: 0.9707, test_loss: 1.1113, test_f1: 0.4466
 epoch: 84, train_loss: 0.9687, test_loss: 1.1067, test_f1: 0.4498
 epoch: 85, train_loss: 0.9671, test_loss: 1.1114, test_f1: 0.4483
 epoch: 86, train_loss: 0.9731, test_loss: 1.1097, test_f1: 0.4491
 epoch: 87, train_loss: 0.9695, test_loss: 1.1069, test_f1: 0.4469
 epoch: 88, train_loss: 0.9631, test_loss: 1.1057, test_f1: 0.4551
 epoch: 89, train_loss: 0.9538, test_loss: 1.1080, test_f1: 0.4473
 epoch: 90, train_loss: 0.9639, test_loss: 1.1096, test_f1: 0.4478
 epoch: 91, train_loss: 0.9684, test_loss: 1.1047, test_f1: 0.4473
 epoch: 92, train_loss: 0.9590, test_loss: 1.1043, test_f1: 0.4558
 epoch: 93, train_loss: 0.9570, test_loss: 1.1045, test_f1: 0.4555
 epoch: 94, train_loss: 0.9573, test_loss: 1.1079, test_f1: 0.4484
 epoch: 95, train_loss: 0.9615, test_loss: 1.1104, test_f1: 0.4459
 epoch: 96, train_loss: 0.9596, test_loss: 1.1090, test_f1: 0.4423
 epoch: 97, train_loss: 0.9471, test_loss: 1.1083, test_f1: 0.4545
 epoch: 98, train_loss: 0.9628, test_loss: 1.1093, test_f1: 0.4622
 epoch: 99, train_loss: 0.9541, test_loss: 1.1068, test_f1: 0.4671
##################ITERATION #2 ****************************************
 epoch: 0, train_loss: 1.3572, test_loss: 1.3679, test_f1: 0.2281
 epoch: 1, train_loss: 1.3391, test_loss: 1.3718, test_f1: 0.2281
 epoch: 2, train_loss: 1.3298, test_loss: 1.3725, test_f1: 0.2281
 epoch: 3, train_loss: 1.3173, test_loss: 1.3634, test_f1: 0.2285
 epoch: 4, train_loss: 1.3067, test_loss: 1.3471, test_f1: 0.2587
 epoch: 5, train_loss: 1.2940, test_loss: 1.3337, test_f1: 0.2982
 epoch: 6, train_loss: 1.2809, test_loss: 1.3101, test_f1: 0.3162
 epoch: 7, train_loss: 1.2701, test_loss: 1.2920, test_f1: 0.2935
 epoch: 8, train_loss: 1.2541, test_loss: 1.2798, test_f1: 0.3075
 epoch: 9, train_loss: 1.2412, test_loss: 1.2695, test_f1: 0.3304
 epoch: 10, train_loss: 1.2263, test_loss: 1.2601, test_f1: 0.3630
 epoch: 11, train_loss: 1.2154, test_loss: 1.2503, test_f1: 0.3673
 epoch: 12, train_loss: 1.1930, test_loss: 1.2400, test_f1: 0.3795
 epoch: 13, train_loss: 1.1849, test_loss: 1.2320, test_f1: 0.4075
 epoch: 14, train_loss: 1.1758, test_loss: 1.2237, test_f1: 0.4052
 epoch: 15, train_loss: 1.1647, test_loss: 1.2179, test_f1: 0.4161
 epoch: 16, train_loss: 1.1493, test_loss: 1.2122, test_f1: 0.4206
 epoch: 17, train_loss: 1.1433, test_loss: 1.2055, test_f1: 0.4151
 epoch: 18, train_loss: 1.1347, test_loss: 1.1997, test_f1: 0.4206
 epoch: 19, train_loss: 1.1282, test_loss: 1.1914, test_f1: 0.4233
 epoch: 20, train_loss: 1.1240, test_loss: 1.1869, test_f1: 0.4285
 epoch: 21, train_loss: 1.1159, test_loss: 1.1812, test_f1: 0.4260
 epoch: 22, train_loss: 1.1104, test_loss: 1.1776, test_f1: 0.4131
 epoch: 23, train_loss: 1.1004, test_loss: 1.1740, test_f1: 0.4248
 epoch: 24, train_loss: 1.0926, test_loss: 1.1723, test_f1: 0.4223
 epoch: 25, train_loss: 1.0886, test_loss: 1.1652, test_f1: 0.4226
 epoch: 26, train_loss: 1.0871, test_loss: 1.1651, test_f1: 0.4225
 epoch: 27, train_loss: 1.0763, test_loss: 1.1564, test_f1: 0.4247
 epoch: 28, train_loss: 1.0699, test_loss: 1.1512, test_f1: 0.4244
 epoch: 29, train_loss: 1.0648, test_loss: 1.1492, test_f1: 0.4221
 epoch: 30, train_loss: 1.0683, test_loss: 1.1481, test_f1: 0.4214
 epoch: 31, train_loss: 1.0601, test_loss: 1.1420, test_f1: 0.4244
 epoch: 32, train_loss: 1.0593, test_loss: 1.1453, test_f1: 0.4218
 epoch: 33, train_loss: 1.0558, test_loss: 1.1393, test_f1: 0.4226
 epoch: 34, train_loss: 1.0472, test_loss: 1.1381, test_f1: 0.4253
 epoch: 35, train_loss: 1.0482, test_loss: 1.1354, test_f1: 0.4253
 epoch: 36, train_loss: 1.0391, test_loss: 1.1340, test_f1: 0.4275
 epoch: 37, train_loss: 1.0427, test_loss: 1.1325, test_f1: 0.4199
 epoch: 38, train_loss: 1.0291, test_loss: 1.1281, test_f1: 0.4204
 epoch: 39, train_loss: 1.0404, test_loss: 1.1241, test_f1: 0.4204
 epoch: 40, train_loss: 1.0278, test_loss: 1.1294, test_f1: 0.4211
 epoch: 41, train_loss: 1.0237, test_loss: 1.1240, test_f1: 0.4226
 epoch: 42, train_loss: 1.0235, test_loss: 1.1199, test_f1: 0.4225
 epoch: 43, train_loss: 1.0246, test_loss: 1.1160, test_f1: 0.4214
 epoch: 44, train_loss: 1.0123, test_loss: 1.1158, test_f1: 0.4225
 epoch: 45, train_loss: 1.0182, test_loss: 1.1142, test_f1: 0.4221
 epoch: 46, train_loss: 1.0138, test_loss: 1.1158, test_f1: 0.4235
 epoch: 47, train_loss: 1.0078, test_loss: 1.1183, test_f1: 0.4229
 epoch: 48, train_loss: 1.0064, test_loss: 1.1069, test_f1: 0.4233
 epoch: 49, train_loss: 1.0049, test_loss: 1.1137, test_f1: 0.4233
 epoch: 50, train_loss: 1.0019, test_loss: 1.1054, test_f1: 0.4255
 epoch: 51, train_loss: 1.0043, test_loss: 1.1065, test_f1: 0.4260
 epoch: 52, train_loss: 1.0030, test_loss: 1.1138, test_f1: 0.4265
 epoch: 53, train_loss: 0.9998, test_loss: 1.1128, test_f1: 0.4233
 epoch: 54, train_loss: 0.9938, test_loss: 1.1078, test_f1: 0.4242
 epoch: 55, train_loss: 0.9971, test_loss: 1.1105, test_f1: 0.4217
 epoch: 56, train_loss: 0.9922, test_loss: 1.1126, test_f1: 0.4230
 epoch: 57, train_loss: 0.9913, test_loss: 1.1057, test_f1: 0.4242
 epoch: 58, train_loss: 0.9971, test_loss: 1.1050, test_f1: 0.4242
 epoch: 59, train_loss: 0.9926, test_loss: 1.1095, test_f1: 0.4247
 epoch: 60, train_loss: 0.9898, test_loss: 1.1095, test_f1: 0.4245
 epoch: 61, train_loss: 0.9907, test_loss: 1.1085, test_f1: 0.4240
 epoch: 62, train_loss: 0.9851, test_loss: 1.1049, test_f1: 0.4240
 epoch: 63, train_loss: 0.9797, test_loss: 1.0991, test_f1: 0.4245
 epoch: 64, train_loss: 0.9800, test_loss: 1.1103, test_f1: 0.4265
 epoch: 65, train_loss: 0.9866, test_loss: 1.1042, test_f1: 0.4247
 epoch: 66, train_loss: 0.9777, test_loss: 1.1064, test_f1: 0.4291
 epoch: 67, train_loss: 0.9803, test_loss: 1.0988, test_f1: 0.4245
 epoch: 68, train_loss: 0.9772, test_loss: 1.1040, test_f1: 0.4245
 epoch: 69, train_loss: 0.9810, test_loss: 1.1023, test_f1: 0.4245
 epoch: 70, train_loss: 0.9825, test_loss: 1.1008, test_f1: 0.4265
 epoch: 71, train_loss: 0.9784, test_loss: 1.1095, test_f1: 0.4268
 epoch: 72, train_loss: 0.9760, test_loss: 1.1046, test_f1: 0.4268
 epoch: 73, train_loss: 0.9791, test_loss: 1.1040, test_f1: 0.4273
 epoch: 74, train_loss: 0.9802, test_loss: 1.0994, test_f1: 0.4265
 epoch: 75, train_loss: 0.9765, test_loss: 1.0985, test_f1: 0.4247
 epoch: 76, train_loss: 0.9720, test_loss: 1.1057, test_f1: 0.4265
 epoch: 77, train_loss: 0.9753, test_loss: 1.1130, test_f1: 0.4217
 epoch: 78, train_loss: 0.9701, test_loss: 1.0970, test_f1: 0.4270
 epoch: 79, train_loss: 0.9779, test_loss: 1.0965, test_f1: 0.4270
 epoch: 80, train_loss: 0.9727, test_loss: 1.1032, test_f1: 0.4270
 epoch: 81, train_loss: 0.9644, test_loss: 1.1007, test_f1: 0.4303
 epoch: 82, train_loss: 0.9714, test_loss: 1.0963, test_f1: 0.4256
 epoch: 83, train_loss: 0.9681, test_loss: 1.0929, test_f1: 0.4303
 epoch: 84, train_loss: 0.9657, test_loss: 1.0879, test_f1: 0.4275
 epoch: 85, train_loss: 0.9652, test_loss: 1.0960, test_f1: 0.4256
 epoch: 86, train_loss: 0.9589, test_loss: 1.1001, test_f1: 0.4265
 epoch: 87, train_loss: 0.9615, test_loss: 1.0971, test_f1: 0.4247
 epoch: 88, train_loss: 0.9623, test_loss: 1.1074, test_f1: 0.4303
 epoch: 89, train_loss: 0.9557, test_loss: 1.0965, test_f1: 0.4245
 epoch: 90, train_loss: 0.9609, test_loss: 1.0887, test_f1: 0.4247
 epoch: 91, train_loss: 0.9585, test_loss: 1.0985, test_f1: 0.4256
 epoch: 92, train_loss: 0.9723, test_loss: 1.1013, test_f1: 0.4279
 epoch: 93, train_loss: 0.9646, test_loss: 1.0975, test_f1: 0.4256
 epoch: 94, train_loss: 0.9571, test_loss: 1.0934, test_f1: 0.4272
 epoch: 95, train_loss: 0.9589, test_loss: 1.1082, test_f1: 0.4256
 epoch: 96, train_loss: 0.9566, test_loss: 1.1127, test_f1: 0.4303
 epoch: 97, train_loss: 0.9600, test_loss: 1.0909, test_f1: 0.4256
 epoch: 98, train_loss: 0.9573, test_loss: 1.0912, test_f1: 0.4256
 epoch: 99, train_loss: 0.9509, test_loss: 1.0932, test_f1: 0.4256
##################ITERATION #3 ****************************************
 epoch: 0, train_loss: 1.3465, test_loss: 1.3704, test_f1: 0.2281
 epoch: 1, train_loss: 1.3169, test_loss: 1.3689, test_f1: 0.2281
 epoch: 2, train_loss: 1.2980, test_loss: 1.3569, test_f1: 0.2281
 epoch: 3, train_loss: 1.2825, test_loss: 1.3416, test_f1: 0.2281
 epoch: 4, train_loss: 1.2621, test_loss: 1.3132, test_f1: 0.2794
 epoch: 5, train_loss: 1.2455, test_loss: 1.2903, test_f1: 0.2926
 epoch: 6, train_loss: 1.2331, test_loss: 1.2718, test_f1: 0.3117
 epoch: 7, train_loss: 1.2212, test_loss: 1.2589, test_f1: 0.3391
 epoch: 8, train_loss: 1.2056, test_loss: 1.2471, test_f1: 0.3425
 epoch: 9, train_loss: 1.1897, test_loss: 1.2345, test_f1: 0.3527
 epoch: 10, train_loss: 1.1802, test_loss: 1.2246, test_f1: 0.3590
 epoch: 11, train_loss: 1.1747, test_loss: 1.2173, test_f1: 0.3707
 epoch: 12, train_loss: 1.1631, test_loss: 1.2089, test_f1: 0.3707
 epoch: 13, train_loss: 1.1573, test_loss: 1.2030, test_f1: 0.3738
 epoch: 14, train_loss: 1.1441, test_loss: 1.1931, test_f1: 0.3765
 epoch: 15, train_loss: 1.1277, test_loss: 1.1846, test_f1: 0.3695
 epoch: 16, train_loss: 1.1313, test_loss: 1.1791, test_f1: 0.3841
 epoch: 17, train_loss: 1.1214, test_loss: 1.1733, test_f1: 0.4064
 epoch: 18, train_loss: 1.1155, test_loss: 1.1670, test_f1: 0.4327
 epoch: 19, train_loss: 1.1009, test_loss: 1.1595, test_f1: 0.4327
 epoch: 20, train_loss: 1.1026, test_loss: 1.1545, test_f1: 0.4327
 epoch: 21, train_loss: 1.1013, test_loss: 1.1509, test_f1: 0.4321
 epoch: 22, train_loss: 1.0840, test_loss: 1.1465, test_f1: 0.4321
 epoch: 23, train_loss: 1.0773, test_loss: 1.1425, test_f1: 0.4321
 epoch: 24, train_loss: 1.0737, test_loss: 1.1391, test_f1: 0.4309
 epoch: 25, train_loss: 1.0746, test_loss: 1.1346, test_f1: 0.4303
 epoch: 26, train_loss: 1.0662, test_loss: 1.1359, test_f1: 0.4305
 epoch: 27, train_loss: 1.0639, test_loss: 1.1289, test_f1: 0.4321
 epoch: 28, train_loss: 1.0578, test_loss: 1.1243, test_f1: 0.4340
 epoch: 29, train_loss: 1.0468, test_loss: 1.1209, test_f1: 0.4316
 epoch: 30, train_loss: 1.0479, test_loss: 1.1199, test_f1: 0.4305
 epoch: 31, train_loss: 1.0482, test_loss: 1.1167, test_f1: 0.4311
 epoch: 32, train_loss: 1.0359, test_loss: 1.1110, test_f1: 0.4311
 epoch: 33, train_loss: 1.0370, test_loss: 1.1110, test_f1: 0.4314
 epoch: 34, train_loss: 1.0395, test_loss: 1.1086, test_f1: 0.4305
 epoch: 35, train_loss: 1.0355, test_loss: 1.1077, test_f1: 0.4305
 epoch: 36, train_loss: 1.0236, test_loss: 1.1033, test_f1: 0.4278
 epoch: 37, train_loss: 1.0216, test_loss: 1.1008, test_f1: 0.4305
 epoch: 38, train_loss: 1.0165, test_loss: 1.0962, test_f1: 0.4336
 epoch: 39, train_loss: 1.0224, test_loss: 1.0979, test_f1: 0.4311
 epoch: 40, train_loss: 1.0137, test_loss: 1.0965, test_f1: 0.4340
 epoch: 41, train_loss: 1.0094, test_loss: 1.0926, test_f1: 0.4305
 epoch: 42, train_loss: 1.0124, test_loss: 1.0897, test_f1: 0.4305
 epoch: 43, train_loss: 1.0029, test_loss: 1.0883, test_f1: 0.4316
 epoch: 44, train_loss: 0.9980, test_loss: 1.0902, test_f1: 0.4288
 epoch: 45, train_loss: 1.0013, test_loss: 1.0871, test_f1: 0.4316
 epoch: 46, train_loss: 1.0004, test_loss: 1.0896, test_f1: 0.4334
 epoch: 47, train_loss: 1.0006, test_loss: 1.0872, test_f1: 0.4283
 epoch: 48, train_loss: 0.9871, test_loss: 1.0852, test_f1: 0.4283
 epoch: 49, train_loss: 0.9967, test_loss: 1.0786, test_f1: 0.4316
 epoch: 50, train_loss: 0.9899, test_loss: 1.0810, test_f1: 0.4318
 epoch: 51, train_loss: 0.9831, test_loss: 1.0840, test_f1: 0.4316
 epoch: 52, train_loss: 0.9918, test_loss: 1.0949, test_f1: 0.4346
 epoch: 53, train_loss: 0.9794, test_loss: 1.0870, test_f1: 0.4316
 epoch: 54, train_loss: 0.9889, test_loss: 1.0872, test_f1: 0.4288
 epoch: 55, train_loss: 0.9901, test_loss: 1.0803, test_f1: 0.4293
 epoch: 56, train_loss: 0.9902, test_loss: 1.0775, test_f1: 0.4316
 epoch: 57, train_loss: 0.9840, test_loss: 1.0767, test_f1: 0.4342
 epoch: 58, train_loss: 0.9832, test_loss: 1.0804, test_f1: 0.4322
 epoch: 59, train_loss: 0.9789, test_loss: 1.0739, test_f1: 0.4324
 epoch: 60, train_loss: 0.9815, test_loss: 1.0719, test_f1: 0.4324
 epoch: 61, train_loss: 0.9806, test_loss: 1.0797, test_f1: 0.4316
 epoch: 62, train_loss: 0.9743, test_loss: 1.0796, test_f1: 0.4293
 epoch: 63, train_loss: 0.9709, test_loss: 1.0801, test_f1: 0.4316
 epoch: 64, train_loss: 0.9801, test_loss: 1.0801, test_f1: 0.4293
 epoch: 65, train_loss: 0.9704, test_loss: 1.0751, test_f1: 0.4272
 epoch: 66, train_loss: 0.9749, test_loss: 1.0777, test_f1: 0.4293
 epoch: 67, train_loss: 0.9744, test_loss: 1.0766, test_f1: 0.4316
 epoch: 68, train_loss: 0.9748, test_loss: 1.0773, test_f1: 0.4316
 epoch: 69, train_loss: 0.9642, test_loss: 1.0783, test_f1: 0.4316
 epoch: 70, train_loss: 0.9674, test_loss: 1.0749, test_f1: 0.4299
 epoch: 71, train_loss: 0.9656, test_loss: 1.0781, test_f1: 0.4293
 epoch: 72, train_loss: 0.9674, test_loss: 1.0741, test_f1: 0.4293
 epoch: 73, train_loss: 0.9654, test_loss: 1.0761, test_f1: 0.4322
 epoch: 74, train_loss: 0.9692, test_loss: 1.0759, test_f1: 0.4275
 epoch: 75, train_loss: 0.9678, test_loss: 1.0762, test_f1: 0.4329
 epoch: 76, train_loss: 0.9685, test_loss: 1.0816, test_f1: 0.4353
 epoch: 77, train_loss: 0.9736, test_loss: 1.0768, test_f1: 0.4329
 epoch: 78, train_loss: 0.9593, test_loss: 1.0785, test_f1: 0.4290
 epoch: 79, train_loss: 0.9576, test_loss: 1.0770, test_f1: 0.4270
 epoch: 80, train_loss: 0.9602, test_loss: 1.0753, test_f1: 0.4316
 epoch: 81, train_loss: 0.9664, test_loss: 1.0784, test_f1: 0.4334
 epoch: 82, train_loss: 0.9566, test_loss: 1.0815, test_f1: 0.4346
 epoch: 83, train_loss: 0.9582, test_loss: 1.0791, test_f1: 0.4322
 epoch: 84, train_loss: 0.9660, test_loss: 1.0771, test_f1: 0.4346
 epoch: 85, train_loss: 0.9689, test_loss: 1.0709, test_f1: 0.4293
 epoch: 86, train_loss: 0.9659, test_loss: 1.0805, test_f1: 0.4353
 epoch: 87, train_loss: 0.9556, test_loss: 1.0766, test_f1: 0.4322
 epoch: 88, train_loss: 0.9590, test_loss: 1.0713, test_f1: 0.4323
 epoch: 89, train_loss: 0.9613, test_loss: 1.0754, test_f1: 0.4322
 epoch: 90, train_loss: 0.9501, test_loss: 1.0746, test_f1: 0.4353
 epoch: 91, train_loss: 0.9595, test_loss: 1.0727, test_f1: 0.4329
 epoch: 92, train_loss: 0.9591, test_loss: 1.0712, test_f1: 0.4329
 epoch: 93, train_loss: 0.9523, test_loss: 1.0742, test_f1: 0.4322
 epoch: 94, train_loss: 0.9469, test_loss: 1.0709, test_f1: 0.4306
 epoch: 95, train_loss: 0.9584, test_loss: 1.0687, test_f1: 0.4329
 epoch: 96, train_loss: 0.9510, test_loss: 1.0729, test_f1: 0.4299
 epoch: 97, train_loss: 0.9498, test_loss: 1.0710, test_f1: 0.4266
 epoch: 98, train_loss: 0.9577, test_loss: 1.0722, test_f1: 0.4341
 epoch: 99, train_loss: 0.9504, test_loss: 1.0723, test_f1: 0.4300
##################ITERATION #4 ****************************************
 epoch: 0, train_loss: 1.2915, test_loss: 1.3273, test_f1: 0.2281
 epoch: 1, train_loss: 1.2624, test_loss: 1.3220, test_f1: 0.2281
 epoch: 2, train_loss: 1.2513, test_loss: 1.3143, test_f1: 0.2281
 epoch: 3, train_loss: 1.2356, test_loss: 1.3053, test_f1: 0.2281
 epoch: 4, train_loss: 1.2296, test_loss: 1.3007, test_f1: 0.2281
 epoch: 5, train_loss: 1.2116, test_loss: 1.2848, test_f1: 0.2281
 epoch: 6, train_loss: 1.2052, test_loss: 1.2689, test_f1: 0.2281
 epoch: 7, train_loss: 1.1957, test_loss: 1.2539, test_f1: 0.2281
 epoch: 8, train_loss: 1.1840, test_loss: 1.2391, test_f1: 0.2471
 epoch: 9, train_loss: 1.1769, test_loss: 1.2331, test_f1: 0.2828
 epoch: 10, train_loss: 1.1715, test_loss: 1.2299, test_f1: 0.2979
 epoch: 11, train_loss: 1.1566, test_loss: 1.2250, test_f1: 0.3112
 epoch: 12, train_loss: 1.1534, test_loss: 1.2203, test_f1: 0.3493
 epoch: 13, train_loss: 1.1521, test_loss: 1.2168, test_f1: 0.4173
 epoch: 14, train_loss: 1.1343, test_loss: 1.2074, test_f1: 0.4174
 epoch: 15, train_loss: 1.1312, test_loss: 1.2057, test_f1: 0.4224
 epoch: 16, train_loss: 1.1260, test_loss: 1.2005, test_f1: 0.4254
 epoch: 17, train_loss: 1.1181, test_loss: 1.1923, test_f1: 0.4249
 epoch: 18, train_loss: 1.1134, test_loss: 1.1862, test_f1: 0.4270
 epoch: 19, train_loss: 1.1089, test_loss: 1.1806, test_f1: 0.4251
 epoch: 20, train_loss: 1.1048, test_loss: 1.1778, test_f1: 0.4249
 epoch: 21, train_loss: 1.0922, test_loss: 1.1700, test_f1: 0.4249
 epoch: 22, train_loss: 1.0819, test_loss: 1.1673, test_f1: 0.4226
 epoch: 23, train_loss: 1.0774, test_loss: 1.1617, test_f1: 0.4200
 epoch: 24, train_loss: 1.0840, test_loss: 1.1612, test_f1: 0.4181
 epoch: 25, train_loss: 1.0672, test_loss: 1.1603, test_f1: 0.4151
 epoch: 26, train_loss: 1.0575, test_loss: 1.1603, test_f1: 0.4084
 epoch: 27, train_loss: 1.0597, test_loss: 1.1547, test_f1: 0.4174
 epoch: 28, train_loss: 1.0532, test_loss: 1.1463, test_f1: 0.4227
 epoch: 29, train_loss: 1.0465, test_loss: 1.1474, test_f1: 0.4217
 epoch: 30, train_loss: 1.0449, test_loss: 1.1479, test_f1: 0.4253
 epoch: 31, train_loss: 1.0360, test_loss: 1.1467, test_f1: 0.4235
 epoch: 32, train_loss: 1.0322, test_loss: 1.1474, test_f1: 0.4180
 epoch: 33, train_loss: 1.0392, test_loss: 1.1468, test_f1: 0.4203
 epoch: 34, train_loss: 1.0344, test_loss: 1.1478, test_f1: 0.4204
 epoch: 35, train_loss: 1.0255, test_loss: 1.1441, test_f1: 0.4266
 epoch: 36, train_loss: 1.0212, test_loss: 1.1401, test_f1: 0.4221
 epoch: 37, train_loss: 1.0193, test_loss: 1.1415, test_f1: 0.4132
 epoch: 38, train_loss: 1.0239, test_loss: 1.1340, test_f1: 0.4288
 epoch: 39, train_loss: 1.0188, test_loss: 1.1399, test_f1: 0.4261
 epoch: 40, train_loss: 1.0121, test_loss: 1.1388, test_f1: 0.4110
 epoch: 41, train_loss: 1.0126, test_loss: 1.1355, test_f1: 0.4235
 epoch: 42, train_loss: 1.0134, test_loss: 1.1313, test_f1: 0.4243
 epoch: 43, train_loss: 1.0065, test_loss: 1.1408, test_f1: 0.4316
 epoch: 44, train_loss: 1.0110, test_loss: 1.1302, test_f1: 0.4272
 epoch: 45, train_loss: 1.0006, test_loss: 1.1336, test_f1: 0.4187
 epoch: 46, train_loss: 1.0108, test_loss: 1.1425, test_f1: 0.4024
 epoch: 47, train_loss: 0.9916, test_loss: 1.1243, test_f1: 0.4212
 epoch: 48, train_loss: 0.9946, test_loss: 1.1199, test_f1: 0.4272
 epoch: 49, train_loss: 0.9915, test_loss: 1.1238, test_f1: 0.4255
 epoch: 50, train_loss: 0.9944, test_loss: 1.1225, test_f1: 0.4203
 epoch: 51, train_loss: 0.9898, test_loss: 1.1241, test_f1: 0.4215
 epoch: 52, train_loss: 0.9846, test_loss: 1.1231, test_f1: 0.4233
 epoch: 53, train_loss: 0.9776, test_loss: 1.1228, test_f1: 0.4299
 epoch: 54, train_loss: 0.9914, test_loss: 1.1239, test_f1: 0.4260
 epoch: 55, train_loss: 0.9888, test_loss: 1.1252, test_f1: 0.4233
 epoch: 56, train_loss: 0.9836, test_loss: 1.1254, test_f1: 0.4233
 epoch: 57, train_loss: 0.9872, test_loss: 1.1259, test_f1: 0.4167
 epoch: 58, train_loss: 0.9775, test_loss: 1.1245, test_f1: 0.4252
 epoch: 59, train_loss: 0.9836, test_loss: 1.1276, test_f1: 0.4293
 epoch: 60, train_loss: 0.9837, test_loss: 1.1210, test_f1: 0.4229
 epoch: 61, train_loss: 0.9740, test_loss: 1.1270, test_f1: 0.4252
 epoch: 62, train_loss: 0.9861, test_loss: 1.1274, test_f1: 0.4193
 epoch: 63, train_loss: 0.9794, test_loss: 1.1277, test_f1: 0.4247
 epoch: 64, train_loss: 0.9768, test_loss: 1.1297, test_f1: 0.4275
 epoch: 65, train_loss: 0.9731, test_loss: 1.1274, test_f1: 0.4260
 epoch: 66, train_loss: 0.9711, test_loss: 1.1306, test_f1: 0.4247
 epoch: 67, train_loss: 0.9723, test_loss: 1.1265, test_f1: 0.4224
 epoch: 68, train_loss: 0.9700, test_loss: 1.1229, test_f1: 0.4247
 epoch: 69, train_loss: 0.9706, test_loss: 1.1255, test_f1: 0.4242
 epoch: 70, train_loss: 0.9705, test_loss: 1.1221, test_f1: 0.4270
 epoch: 71, train_loss: 0.9640, test_loss: 1.1205, test_f1: 0.4247
 epoch: 72, train_loss: 0.9656, test_loss: 1.1233, test_f1: 0.4247
 epoch: 73, train_loss: 0.9710, test_loss: 1.1241, test_f1: 0.4247
 epoch: 74, train_loss: 0.9637, test_loss: 1.1207, test_f1: 0.4270
 epoch: 75, train_loss: 0.9740, test_loss: 1.1314, test_f1: 0.4138
 epoch: 76, train_loss: 0.9704, test_loss: 1.1237, test_f1: 0.4247
 epoch: 77, train_loss: 0.9622, test_loss: 1.1252, test_f1: 0.4242
 epoch: 78, train_loss: 0.9703, test_loss: 1.1244, test_f1: 0.4247
 epoch: 79, train_loss: 0.9678, test_loss: 1.1234, test_f1: 0.4299
 epoch: 80, train_loss: 0.9631, test_loss: 1.1244, test_f1: 0.4299
 epoch: 81, train_loss: 0.9574, test_loss: 1.1285, test_f1: 0.4247
 epoch: 82, train_loss: 0.9630, test_loss: 1.1258, test_f1: 0.4275
 epoch: 83, train_loss: 0.9665, test_loss: 1.1270, test_f1: 0.4247
 epoch: 84, train_loss: 0.9535, test_loss: 1.1334, test_f1: 0.4311
 epoch: 85, train_loss: 0.9676, test_loss: 1.1323, test_f1: 0.4270
 epoch: 86, train_loss: 0.9564, test_loss: 1.1211, test_f1: 0.4224
 epoch: 87, train_loss: 0.9515, test_loss: 1.1226, test_f1: 0.4252
 epoch: 88, train_loss: 0.9597, test_loss: 1.1260, test_f1: 0.4270
 epoch: 89, train_loss: 0.9482, test_loss: 1.1263, test_f1: 0.4220
 epoch: 90, train_loss: 0.9608, test_loss: 1.1260, test_f1: 0.4293
 epoch: 91, train_loss: 0.9543, test_loss: 1.1298, test_f1: 0.4316
 epoch: 92, train_loss: 0.9597, test_loss: 1.1241, test_f1: 0.4288
 epoch: 93, train_loss: 0.9415, test_loss: 1.1184, test_f1: 0.4224
 epoch: 94, train_loss: 0.9578, test_loss: 1.1234, test_f1: 0.4224
 epoch: 95, train_loss: 0.9463, test_loss: 1.1295, test_f1: 0.4297
 epoch: 96, train_loss: 0.9503, test_loss: 1.1264, test_f1: 0.4290
 epoch: 97, train_loss: 0.9590, test_loss: 1.1220, test_f1: 0.4266
 epoch: 98, train_loss: 0.9500, test_loss: 1.1193, test_f1: 0.4280
 epoch: 99, train_loss: 0.9523, test_loss: 1.1239, test_f1: 0.4297
##################ITERATION #5 ****************************************
 epoch: 0, train_loss: 1.2837, test_loss: 1.3208, test_f1: 0.2281
 epoch: 1, train_loss: 1.2465, test_loss: 1.3116, test_f1: 0.2281
 epoch: 2, train_loss: 1.2356, test_loss: 1.2948, test_f1: 0.2281
 epoch: 3, train_loss: 1.2175, test_loss: 1.2734, test_f1: 0.2491
 epoch: 4, train_loss: 1.2016, test_loss: 1.2470, test_f1: 0.3269
 epoch: 5, train_loss: 1.1901, test_loss: 1.2325, test_f1: 0.3361
 epoch: 6, train_loss: 1.1818, test_loss: 1.2203, test_f1: 0.3385
 epoch: 7, train_loss: 1.1700, test_loss: 1.2095, test_f1: 0.3413
 epoch: 8, train_loss: 1.1546, test_loss: 1.2027, test_f1: 0.3818
 epoch: 9, train_loss: 1.1458, test_loss: 1.1944, test_f1: 0.4004
 epoch: 10, train_loss: 1.1343, test_loss: 1.1867, test_f1: 0.4251
 epoch: 11, train_loss: 1.1222, test_loss: 1.1763, test_f1: 0.4268
 epoch: 12, train_loss: 1.1157, test_loss: 1.1685, test_f1: 0.4262
 epoch: 13, train_loss: 1.1132, test_loss: 1.1621, test_f1: 0.4304
 epoch: 14, train_loss: 1.1016, test_loss: 1.1575, test_f1: 0.4309
 epoch: 15, train_loss: 1.0898, test_loss: 1.1510, test_f1: 0.4314
 epoch: 16, train_loss: 1.0826, test_loss: 1.1474, test_f1: 0.4314
 epoch: 17, train_loss: 1.0786, test_loss: 1.1390, test_f1: 0.4309
 epoch: 18, train_loss: 1.0708, test_loss: 1.1350, test_f1: 0.4298
 epoch: 19, train_loss: 1.0663, test_loss: 1.1332, test_f1: 0.4309
 epoch: 20, train_loss: 1.0623, test_loss: 1.1238, test_f1: 0.4309
 epoch: 21, train_loss: 1.0592, test_loss: 1.1222, test_f1: 0.4304
 epoch: 22, train_loss: 1.0573, test_loss: 1.1190, test_f1: 0.4309
 epoch: 23, train_loss: 1.0511, test_loss: 1.1159, test_f1: 0.4314
 epoch: 24, train_loss: 1.0484, test_loss: 1.1113, test_f1: 0.4314
 epoch: 25, train_loss: 1.0490, test_loss: 1.1136, test_f1: 0.4314
 epoch: 26, train_loss: 1.0384, test_loss: 1.1059, test_f1: 0.4314
 epoch: 27, train_loss: 1.0409, test_loss: 1.1023, test_f1: 0.4323
 epoch: 28, train_loss: 1.0324, test_loss: 1.1025, test_f1: 0.4309
 epoch: 29, train_loss: 1.0327, test_loss: 1.0997, test_f1: 0.4309
 epoch: 30, train_loss: 1.0273, test_loss: 1.1001, test_f1: 0.4315
 epoch: 31, train_loss: 1.0256, test_loss: 1.1024, test_f1: 0.4329
 epoch: 32, train_loss: 1.0254, test_loss: 1.0951, test_f1: 0.4335
 epoch: 33, train_loss: 1.0221, test_loss: 1.0911, test_f1: 0.4341
 epoch: 34, train_loss: 1.0146, test_loss: 1.0943, test_f1: 0.4315
 epoch: 35, train_loss: 1.0154, test_loss: 1.0945, test_f1: 0.4315
 epoch: 36, train_loss: 1.0101, test_loss: 1.0877, test_f1: 0.4366
 epoch: 37, train_loss: 1.0188, test_loss: 1.0859, test_f1: 0.4335
 epoch: 38, train_loss: 1.0103, test_loss: 1.0907, test_f1: 0.4315
 epoch: 39, train_loss: 1.0029, test_loss: 1.0827, test_f1: 0.4315
 epoch: 40, train_loss: 1.0072, test_loss: 1.0877, test_f1: 0.4315
 epoch: 41, train_loss: 1.0058, test_loss: 1.0812, test_f1: 0.4341
 epoch: 42, train_loss: 0.9957, test_loss: 1.0921, test_f1: 0.4315
 epoch: 43, train_loss: 1.0006, test_loss: 1.0868, test_f1: 0.4310
 epoch: 44, train_loss: 0.9961, test_loss: 1.0789, test_f1: 0.4336
 epoch: 45, train_loss: 0.9946, test_loss: 1.0764, test_f1: 0.4342
 epoch: 46, train_loss: 0.9996, test_loss: 1.0747, test_f1: 0.4347
 epoch: 47, train_loss: 0.9905, test_loss: 1.0722, test_f1: 0.4347
 epoch: 48, train_loss: 0.9931, test_loss: 1.0722, test_f1: 0.4492
 epoch: 49, train_loss: 1.0020, test_loss: 1.0712, test_f1: 0.4422
 epoch: 50, train_loss: 0.9901, test_loss: 1.0713, test_f1: 0.4335
 epoch: 51, train_loss: 0.9852, test_loss: 1.0701, test_f1: 0.4335
 epoch: 52, train_loss: 0.9866, test_loss: 1.0698, test_f1: 0.4335
 epoch: 53, train_loss: 0.9832, test_loss: 1.0687, test_f1: 0.4335
 epoch: 54, train_loss: 0.9810, test_loss: 1.0686, test_f1: 0.4335
 epoch: 55, train_loss: 0.9728, test_loss: 1.0684, test_f1: 0.4335
 epoch: 56, train_loss: 0.9785, test_loss: 1.0682, test_f1: 0.4335
 epoch: 57, train_loss: 0.9805, test_loss: 1.0686, test_f1: 0.4477
 epoch: 58, train_loss: 0.9787, test_loss: 1.0689, test_f1: 0.4341
 epoch: 59, train_loss: 0.9826, test_loss: 1.0687, test_f1: 0.4341
 epoch: 60, train_loss: 0.9747, test_loss: 1.0638, test_f1: 0.4341
 epoch: 61, train_loss: 0.9851, test_loss: 1.0632, test_f1: 0.4317
 epoch: 62, train_loss: 0.9716, test_loss: 1.0674, test_f1: 0.4526
 epoch: 63, train_loss: 0.9761, test_loss: 1.0665, test_f1: 0.4444
 epoch: 64, train_loss: 0.9729, test_loss: 1.0671, test_f1: 0.4525
 epoch: 65, train_loss: 0.9773, test_loss: 1.0601, test_f1: 0.4341
 epoch: 66, train_loss: 0.9777, test_loss: 1.0574, test_f1: 0.4341
 epoch: 67, train_loss: 0.9733, test_loss: 1.0615, test_f1: 0.4342
 epoch: 68, train_loss: 0.9726, test_loss: 1.0617, test_f1: 0.4248
 epoch: 69, train_loss: 0.9720, test_loss: 1.0630, test_f1: 0.4334
 epoch: 70, train_loss: 0.9717, test_loss: 1.0626, test_f1: 0.4294
 epoch: 71, train_loss: 0.9748, test_loss: 1.0620, test_f1: 0.4341
 epoch: 72, train_loss: 0.9678, test_loss: 1.0588, test_f1: 0.4294
 epoch: 73, train_loss: 0.9711, test_loss: 1.0592, test_f1: 0.4341
 epoch: 74, train_loss: 0.9706, test_loss: 1.0580, test_f1: 0.4271
 epoch: 75, train_loss: 0.9664, test_loss: 1.0588, test_f1: 0.4341
 epoch: 76, train_loss: 0.9679, test_loss: 1.0542, test_f1: 0.4340
 epoch: 77, train_loss: 0.9705, test_loss: 1.0577, test_f1: 0.4340
 epoch: 78, train_loss: 0.9594, test_loss: 1.0562, test_f1: 0.4341
 epoch: 79, train_loss: 0.9593, test_loss: 1.0588, test_f1: 0.4382
 epoch: 80, train_loss: 0.9630, test_loss: 1.0559, test_f1: 0.4346
 epoch: 81, train_loss: 0.9607, test_loss: 1.0519, test_f1: 0.4340
 epoch: 82, train_loss: 0.9638, test_loss: 1.0589, test_f1: 0.4405
 epoch: 83, train_loss: 0.9543, test_loss: 1.0570, test_f1: 0.4341
 epoch: 84, train_loss: 0.9595, test_loss: 1.0543, test_f1: 0.4270
 epoch: 85, train_loss: 0.9579, test_loss: 1.0527, test_f1: 0.4270
 epoch: 86, train_loss: 0.9521, test_loss: 1.0553, test_f1: 0.4271
 epoch: 87, train_loss: 0.9606, test_loss: 1.0598, test_f1: 0.4300
 epoch: 88, train_loss: 0.9513, test_loss: 1.0537, test_f1: 0.4341
 epoch: 89, train_loss: 0.9598, test_loss: 1.0504, test_f1: 0.4341
 epoch: 90, train_loss: 0.9559, test_loss: 1.0559, test_f1: 0.4346
 epoch: 91, train_loss: 0.9611, test_loss: 1.0530, test_f1: 0.4312
 epoch: 92, train_loss: 0.9506, test_loss: 1.0497, test_f1: 0.4347
 epoch: 93, train_loss: 0.9590, test_loss: 1.0549, test_f1: 0.4434
 epoch: 94, train_loss: 0.9585, test_loss: 1.0547, test_f1: 0.4271
 epoch: 95, train_loss: 0.9530, test_loss: 1.0524, test_f1: 0.4295
 epoch: 96, train_loss: 0.9430, test_loss: 1.0555, test_f1: 0.4348
 epoch: 97, train_loss: 0.9522, test_loss: 1.0500, test_f1: 0.4295
 epoch: 98, train_loss: 0.9434, test_loss: 1.0541, test_f1: 0.4271
 epoch: 99, train_loss: 0.9506, test_loss: 1.0579, test_f1: 0.4440
##################ITERATION #6 ****************************************
 epoch: 0, train_loss: 1.2504, test_loss: 1.3036, test_f1: 0.2281
 epoch: 1, train_loss: 1.2170, test_loss: 1.3029, test_f1: 0.2281
 epoch: 2, train_loss: 1.2013, test_loss: 1.2980, test_f1: 0.2281
 epoch: 3, train_loss: 1.1852, test_loss: 1.2954, test_f1: 0.2281
 epoch: 4, train_loss: 1.1727, test_loss: 1.2885, test_f1: 0.2281
 epoch: 5, train_loss: 1.1572, test_loss: 1.2791, test_f1: 0.2390
 epoch: 6, train_loss: 1.1554, test_loss: 1.2454, test_f1: 0.2491
 epoch: 7, train_loss: 1.1374, test_loss: 1.2081, test_f1: 0.2695
 epoch: 8, train_loss: 1.1333, test_loss: 1.1862, test_f1: 0.3147
 epoch: 9, train_loss: 1.1239, test_loss: 1.1795, test_f1: 0.3152
 epoch: 10, train_loss: 1.1160, test_loss: 1.1744, test_f1: 0.3454
 epoch: 11, train_loss: 1.1072, test_loss: 1.1638, test_f1: 0.3590
 epoch: 12, train_loss: 1.0989, test_loss: 1.1609, test_f1: 0.3756
 epoch: 13, train_loss: 1.0872, test_loss: 1.1550, test_f1: 0.3787
 epoch: 14, train_loss: 1.0866, test_loss: 1.1518, test_f1: 0.3763
 epoch: 15, train_loss: 1.0721, test_loss: 1.1452, test_f1: 0.4022
 epoch: 16, train_loss: 1.0647, test_loss: 1.1445, test_f1: 0.3997
 epoch: 17, train_loss: 1.0669, test_loss: 1.1346, test_f1: 0.4072
 epoch: 18, train_loss: 1.0547, test_loss: 1.1352, test_f1: 0.4085
 epoch: 19, train_loss: 1.0501, test_loss: 1.1318, test_f1: 0.4089
 epoch: 20, train_loss: 1.0478, test_loss: 1.1296, test_f1: 0.4110
 epoch: 21, train_loss: 1.0460, test_loss: 1.1284, test_f1: 0.4122
 epoch: 22, train_loss: 1.0316, test_loss: 1.1230, test_f1: 0.4052
 epoch: 23, train_loss: 1.0341, test_loss: 1.1170, test_f1: 0.4166
 epoch: 24, train_loss: 1.0284, test_loss: 1.1178, test_f1: 0.4204
 epoch: 25, train_loss: 1.0271, test_loss: 1.1245, test_f1: 0.4238
 epoch: 26, train_loss: 1.0269, test_loss: 1.1284, test_f1: 0.4262
 epoch: 27, train_loss: 1.0237, test_loss: 1.1178, test_f1: 0.4162
 epoch: 28, train_loss: 1.0151, test_loss: 1.1144, test_f1: 0.4044
 epoch: 29, train_loss: 1.0099, test_loss: 1.1141, test_f1: 0.4245
 epoch: 30, train_loss: 1.0033, test_loss: 1.1020, test_f1: 0.4233
 epoch: 31, train_loss: 0.9998, test_loss: 1.1057, test_f1: 0.4198
 epoch: 32, train_loss: 1.0020, test_loss: 1.1054, test_f1: 0.4209
 epoch: 33, train_loss: 0.9945, test_loss: 1.1003, test_f1: 0.4216
 epoch: 34, train_loss: 0.9999, test_loss: 1.1051, test_f1: 0.4120
 epoch: 35, train_loss: 0.9946, test_loss: 1.1073, test_f1: 0.4151
 epoch: 36, train_loss: 0.9887, test_loss: 1.0981, test_f1: 0.4132
 epoch: 37, train_loss: 0.9868, test_loss: 1.0945, test_f1: 0.4296
 epoch: 38, train_loss: 0.9912, test_loss: 1.0993, test_f1: 0.4257
 epoch: 39, train_loss: 0.9840, test_loss: 1.1009, test_f1: 0.4144
 epoch: 40, train_loss: 0.9813, test_loss: 1.1041, test_f1: 0.4321
 epoch: 41, train_loss: 0.9768, test_loss: 1.0980, test_f1: 0.4220
 epoch: 42, train_loss: 0.9688, test_loss: 1.0943, test_f1: 0.4262
 epoch: 43, train_loss: 0.9797, test_loss: 1.1079, test_f1: 0.4431
 epoch: 44, train_loss: 0.9697, test_loss: 1.0914, test_f1: 0.4205
 epoch: 45, train_loss: 0.9585, test_loss: 1.0981, test_f1: 0.4211
 epoch: 46, train_loss: 0.9687, test_loss: 1.0913, test_f1: 0.4201
 epoch: 47, train_loss: 0.9619, test_loss: 1.0966, test_f1: 0.4199
 epoch: 48, train_loss: 0.9644, test_loss: 1.0938, test_f1: 0.4221
 epoch: 49, train_loss: 0.9627, test_loss: 1.0921, test_f1: 0.4212
 epoch: 50, train_loss: 0.9620, test_loss: 1.0846, test_f1: 0.4175
 epoch: 51, train_loss: 0.9639, test_loss: 1.0919, test_f1: 0.4304
 epoch: 52, train_loss: 0.9439, test_loss: 1.0829, test_f1: 0.4293
 epoch: 53, train_loss: 0.9538, test_loss: 1.0757, test_f1: 0.4176
 epoch: 54, train_loss: 0.9512, test_loss: 1.0812, test_f1: 0.4227
 epoch: 55, train_loss: 0.9411, test_loss: 1.0968, test_f1: 0.4314
 epoch: 56, train_loss: 0.9439, test_loss: 1.0899, test_f1: 0.4257
 epoch: 57, train_loss: 0.9522, test_loss: 1.0907, test_f1: 0.4219
 epoch: 58, train_loss: 0.9429, test_loss: 1.0901, test_f1: 0.4252
 epoch: 59, train_loss: 0.9432, test_loss: 1.0818, test_f1: 0.4220
 epoch: 60, train_loss: 0.9461, test_loss: 1.0830, test_f1: 0.4246
 epoch: 61, train_loss: 0.9476, test_loss: 1.0919, test_f1: 0.4366
 epoch: 62, train_loss: 0.9362, test_loss: 1.0939, test_f1: 0.4280
 epoch: 63, train_loss: 0.9382, test_loss: 1.0832, test_f1: 0.4218
 epoch: 64, train_loss: 0.9314, test_loss: 1.0868, test_f1: 0.4204
 epoch: 65, train_loss: 0.9421, test_loss: 1.0930, test_f1: 0.4179
 epoch: 66, train_loss: 0.9405, test_loss: 1.0967, test_f1: 0.4328
 epoch: 67, train_loss: 0.9414, test_loss: 1.0865, test_f1: 0.4216
 epoch: 68, train_loss: 0.9340, test_loss: 1.0902, test_f1: 0.4467
 epoch: 69, train_loss: 0.9358, test_loss: 1.0920, test_f1: 0.4475
 epoch: 70, train_loss: 0.9361, test_loss: 1.0778, test_f1: 0.4350
 epoch: 71, train_loss: 0.9236, test_loss: 1.0750, test_f1: 0.4462
 epoch: 72, train_loss: 0.9316, test_loss: 1.0845, test_f1: 0.4485
 epoch: 73, train_loss: 0.9311, test_loss: 1.0864, test_f1: 0.4434
 epoch: 74, train_loss: 0.9243, test_loss: 1.0751, test_f1: 0.4461
 epoch: 75, train_loss: 0.9268, test_loss: 1.0888, test_f1: 0.4350
 epoch: 76, train_loss: 0.9257, test_loss: 1.0842, test_f1: 0.4306
 epoch: 77, train_loss: 0.9218, test_loss: 1.0784, test_f1: 0.4459
 epoch: 78, train_loss: 0.9238, test_loss: 1.0844, test_f1: 0.4459
 epoch: 79, train_loss: 0.9308, test_loss: 1.0676, test_f1: 0.4349
 epoch: 80, train_loss: 0.9244, test_loss: 1.0876, test_f1: 0.4580
 epoch: 81, train_loss: 0.9216, test_loss: 1.0789, test_f1: 0.4458
 epoch: 82, train_loss: 0.9191, test_loss: 1.0820, test_f1: 0.4535
 epoch: 83, train_loss: 0.9213, test_loss: 1.0767, test_f1: 0.4440
 epoch: 84, train_loss: 0.9327, test_loss: 1.0694, test_f1: 0.4369
 epoch: 85, train_loss: 0.9193, test_loss: 1.0792, test_f1: 0.4512
 epoch: 86, train_loss: 0.9214, test_loss: 1.0789, test_f1: 0.4540
 epoch: 87, train_loss: 0.9180, test_loss: 1.0756, test_f1: 0.4338
 epoch: 88, train_loss: 0.9180, test_loss: 1.0711, test_f1: 0.4386
 epoch: 89, train_loss: 0.9241, test_loss: 1.0735, test_f1: 0.4456
 epoch: 90, train_loss: 0.9122, test_loss: 1.0724, test_f1: 0.4475
 epoch: 91, train_loss: 0.9153, test_loss: 1.0780, test_f1: 0.4721
 epoch: 92, train_loss: 0.9176, test_loss: 1.0741, test_f1: 0.4487
 epoch: 93, train_loss: 0.9172, test_loss: 1.0709, test_f1: 0.4738
 epoch: 94, train_loss: 0.9054, test_loss: 1.0778, test_f1: 0.4683
 epoch: 95, train_loss: 0.9073, test_loss: 1.0662, test_f1: 0.4618
 epoch: 96, train_loss: 0.9110, test_loss: 1.0679, test_f1: 0.4564
 epoch: 97, train_loss: 0.9093, test_loss: 1.0728, test_f1: 0.4566
 epoch: 98, train_loss: 0.9157, test_loss: 1.0738, test_f1: 0.4546
 epoch: 99, train_loss: 0.9192, test_loss: 1.0580, test_f1: 0.4698
##################ITERATION #7 ****************************************
 epoch: 0, train_loss: 1.2721, test_loss: 1.3074, test_f1: 0.2281
 epoch: 1, train_loss: 1.2357, test_loss: 1.3042, test_f1: 0.2281
 epoch: 2, train_loss: 1.2246, test_loss: 1.2904, test_f1: 0.2281
 epoch: 3, train_loss: 1.2053, test_loss: 1.2779, test_f1: 0.2281
 epoch: 4, train_loss: 1.1927, test_loss: 1.2757, test_f1: 0.2281
 epoch: 5, train_loss: 1.1873, test_loss: 1.2676, test_f1: 0.2281
 epoch: 6, train_loss: 1.1650, test_loss: 1.2491, test_f1: 0.2336
 epoch: 7, train_loss: 1.1595, test_loss: 1.2289, test_f1: 0.2795
 epoch: 8, train_loss: 1.1526, test_loss: 1.2107, test_f1: 0.2650
 epoch: 9, train_loss: 1.1476, test_loss: 1.1985, test_f1: 0.3116
 epoch: 10, train_loss: 1.1305, test_loss: 1.1926, test_f1: 0.3462
 epoch: 11, train_loss: 1.1341, test_loss: 1.1868, test_f1: 0.3507
 epoch: 12, train_loss: 1.1195, test_loss: 1.1830, test_f1: 0.3555
 epoch: 13, train_loss: 1.1130, test_loss: 1.1805, test_f1: 0.3882
 epoch: 14, train_loss: 1.1076, test_loss: 1.1800, test_f1: 0.3601
 epoch: 15, train_loss: 1.1000, test_loss: 1.1741, test_f1: 0.3700
 epoch: 16, train_loss: 1.0931, test_loss: 1.1703, test_f1: 0.3768
 epoch: 17, train_loss: 1.0866, test_loss: 1.1657, test_f1: 0.4033
 epoch: 18, train_loss: 1.0777, test_loss: 1.1701, test_f1: 0.3744
 epoch: 19, train_loss: 1.0729, test_loss: 1.1689, test_f1: 0.3830
 epoch: 20, train_loss: 1.0722, test_loss: 1.1663, test_f1: 0.3935
 epoch: 21, train_loss: 1.0643, test_loss: 1.1618, test_f1: 0.4021
 epoch: 22, train_loss: 1.0574, test_loss: 1.1583, test_f1: 0.3947
 epoch: 23, train_loss: 1.0436, test_loss: 1.1593, test_f1: 0.4185
 epoch: 24, train_loss: 1.0427, test_loss: 1.1588, test_f1: 0.4009
 epoch: 25, train_loss: 1.0427, test_loss: 1.1599, test_f1: 0.4149
 epoch: 26, train_loss: 1.0385, test_loss: 1.1564, test_f1: 0.4009
 epoch: 27, train_loss: 1.0331, test_loss: 1.1569, test_f1: 0.3996
 epoch: 28, train_loss: 1.0342, test_loss: 1.1579, test_f1: 0.4040
 epoch: 29, train_loss: 1.0223, test_loss: 1.1584, test_f1: 0.4029
 epoch: 30, train_loss: 1.0180, test_loss: 1.1523, test_f1: 0.4081
 epoch: 31, train_loss: 1.0119, test_loss: 1.1605, test_f1: 0.4131
 epoch: 32, train_loss: 1.0141, test_loss: 1.1542, test_f1: 0.4334
 epoch: 33, train_loss: 1.0108, test_loss: 1.1541, test_f1: 0.4312
 epoch: 34, train_loss: 1.0127, test_loss: 1.1514, test_f1: 0.4347
 epoch: 35, train_loss: 1.0074, test_loss: 1.1538, test_f1: 0.4299
 epoch: 36, train_loss: 1.0040, test_loss: 1.1473, test_f1: 0.4375
 epoch: 37, train_loss: 0.9982, test_loss: 1.1455, test_f1: 0.4307
 epoch: 38, train_loss: 1.0083, test_loss: 1.1462, test_f1: 0.4360
 epoch: 39, train_loss: 0.9961, test_loss: 1.1568, test_f1: 0.4047
 epoch: 40, train_loss: 0.9993, test_loss: 1.1700, test_f1: 0.4195
 epoch: 41, train_loss: 0.9944, test_loss: 1.1599, test_f1: 0.4323
 epoch: 42, train_loss: 0.9876, test_loss: 1.1502, test_f1: 0.4315
 epoch: 43, train_loss: 0.9802, test_loss: 1.1536, test_f1: 0.4335
 epoch: 44, train_loss: 0.9782, test_loss: 1.1509, test_f1: 0.4359
 epoch: 45, train_loss: 0.9767, test_loss: 1.1475, test_f1: 0.4372
 epoch: 46, train_loss: 0.9738, test_loss: 1.1481, test_f1: 0.4293
 epoch: 47, train_loss: 0.9757, test_loss: 1.1552, test_f1: 0.4204
 epoch: 48, train_loss: 0.9695, test_loss: 1.1765, test_f1: 0.4243
 epoch: 49, train_loss: 0.9610, test_loss: 1.1646, test_f1: 0.4239
 epoch: 50, train_loss: 0.9713, test_loss: 1.1635, test_f1: 0.4481
 epoch: 51, train_loss: 0.9653, test_loss: 1.1634, test_f1: 0.4410
 epoch: 52, train_loss: 0.9678, test_loss: 1.1690, test_f1: 0.4333
 epoch: 53, train_loss: 0.9564, test_loss: 1.1595, test_f1: 0.4408
 epoch: 54, train_loss: 0.9590, test_loss: 1.1585, test_f1: 0.4495
 epoch: 55, train_loss: 0.9651, test_loss: 1.1585, test_f1: 0.4546
 epoch: 56, train_loss: 0.9525, test_loss: 1.1624, test_f1: 0.4396
 epoch: 57, train_loss: 0.9525, test_loss: 1.1625, test_f1: 0.4301
 epoch: 58, train_loss: 0.9568, test_loss: 1.1637, test_f1: 0.4206
 epoch: 59, train_loss: 0.9585, test_loss: 1.1671, test_f1: 0.4111
 epoch: 60, train_loss: 0.9542, test_loss: 1.1656, test_f1: 0.4067
 epoch: 61, train_loss: 0.9504, test_loss: 1.1658, test_f1: 0.4340
 epoch: 62, train_loss: 0.9528, test_loss: 1.1725, test_f1: 0.4371
 epoch: 63, train_loss: 0.9500, test_loss: 1.1778, test_f1: 0.4504
 epoch: 64, train_loss: 0.9524, test_loss: 1.1697, test_f1: 0.4384
 epoch: 65, train_loss: 0.9455, test_loss: 1.1688, test_f1: 0.4453
 epoch: 66, train_loss: 0.9453, test_loss: 1.1732, test_f1: 0.4512
 epoch: 67, train_loss: 0.9381, test_loss: 1.1659, test_f1: 0.4449
 epoch: 68, train_loss: 0.9482, test_loss: 1.1725, test_f1: 0.4418
 epoch: 69, train_loss: 0.9461, test_loss: 1.1761, test_f1: 0.4057
 epoch: 70, train_loss: 0.9454, test_loss: 1.1744, test_f1: 0.4425
 epoch: 71, train_loss: 0.9465, test_loss: 1.1716, test_f1: 0.4478
 epoch: 72, train_loss: 0.9333, test_loss: 1.1716, test_f1: 0.4305
 epoch: 73, train_loss: 0.9527, test_loss: 1.1716, test_f1: 0.4656
 epoch: 74, train_loss: 0.9365, test_loss: 1.1763, test_f1: 0.4462
 epoch: 75, train_loss: 0.9384, test_loss: 1.1693, test_f1: 0.4725
 epoch: 76, train_loss: 0.9288, test_loss: 1.1811, test_f1: 0.4632
 epoch: 77, train_loss: 0.9343, test_loss: 1.1782, test_f1: 0.4744
 epoch: 78, train_loss: 0.9456, test_loss: 1.1773, test_f1: 0.4768
 epoch: 79, train_loss: 0.9384, test_loss: 1.1762, test_f1: 0.4776
 epoch: 80, train_loss: 0.9246, test_loss: 1.1777, test_f1: 0.4602
 epoch: 81, train_loss: 0.9290, test_loss: 1.1846, test_f1: 0.4669
 epoch: 82, train_loss: 0.9252, test_loss: 1.1835, test_f1: 0.4851
 epoch: 83, train_loss: 0.9379, test_loss: 1.1773, test_f1: 0.4999
 epoch: 84, train_loss: 0.9381, test_loss: 1.1728, test_f1: 0.4659
 epoch: 85, train_loss: 0.9317, test_loss: 1.1826, test_f1: 0.4751
 epoch: 86, train_loss: 0.9268, test_loss: 1.1819, test_f1: 0.4798
 epoch: 87, train_loss: 0.9263, test_loss: 1.1850, test_f1: 0.4870
 epoch: 88, train_loss: 0.9298, test_loss: 1.1890, test_f1: 0.4932
 epoch: 89, train_loss: 0.9283, test_loss: 1.1836, test_f1: 0.4756
 epoch: 90, train_loss: 0.9229, test_loss: 1.1904, test_f1: 0.4960
 epoch: 91, train_loss: 0.9260, test_loss: 1.1929, test_f1: 0.4505
 epoch: 92, train_loss: 0.9222, test_loss: 1.2004, test_f1: 0.4595
 epoch: 93, train_loss: 0.9104, test_loss: 1.1967, test_f1: 0.4515
 epoch: 94, train_loss: 0.9160, test_loss: 1.2001, test_f1: 0.4840
 epoch: 95, train_loss: 0.9171, test_loss: 1.2009, test_f1: 0.4764
 epoch: 96, train_loss: 0.9276, test_loss: 1.2067, test_f1: 0.4731
 epoch: 97, train_loss: 0.9172, test_loss: 1.2154, test_f1: 0.4726
 epoch: 98, train_loss: 0.9139, test_loss: 1.2015, test_f1: 0.4604
 epoch: 99, train_loss: 0.9181, test_loss: 1.1953, test_f1: 0.4725
##################ITERATION #8 ****************************************
 epoch: 0, train_loss: 1.3071, test_loss: 1.3186, test_f1: 0.2281
 epoch: 1, train_loss: 1.2653, test_loss: 1.3171, test_f1: 0.2281
 epoch: 2, train_loss: 1.2527, test_loss: 1.3176, test_f1: 0.2281
 epoch: 3, train_loss: 1.2402, test_loss: 1.2998, test_f1: 0.2281
 epoch: 4, train_loss: 1.2261, test_loss: 1.2793, test_f1: 0.2281
 epoch: 5, train_loss: 1.2149, test_loss: 1.2678, test_f1: 0.2281
 epoch: 6, train_loss: 1.2125, test_loss: 1.2621, test_f1: 0.2281
 epoch: 7, train_loss: 1.2008, test_loss: 1.2583, test_f1: 0.2281
 epoch: 8, train_loss: 1.1912, test_loss: 1.2508, test_f1: 0.2281
 epoch: 9, train_loss: 1.1820, test_loss: 1.2397, test_f1: 0.2583
 epoch: 10, train_loss: 1.1703, test_loss: 1.2350, test_f1: 0.2583
 epoch: 11, train_loss: 1.1679, test_loss: 1.2276, test_f1: 0.2639
 epoch: 12, train_loss: 1.1596, test_loss: 1.2200, test_f1: 0.3021
 epoch: 13, train_loss: 1.1564, test_loss: 1.2113, test_f1: 0.3216
 epoch: 14, train_loss: 1.1491, test_loss: 1.2063, test_f1: 0.3387
 epoch: 15, train_loss: 1.1345, test_loss: 1.1991, test_f1: 0.3438
 epoch: 16, train_loss: 1.1255, test_loss: 1.1930, test_f1: 0.3554
 epoch: 17, train_loss: 1.1254, test_loss: 1.1830, test_f1: 0.3596
 epoch: 18, train_loss: 1.1101, test_loss: 1.1709, test_f1: 0.3548
 epoch: 19, train_loss: 1.1039, test_loss: 1.1682, test_f1: 0.3719
 epoch: 20, train_loss: 1.0932, test_loss: 1.1615, test_f1: 0.3861
 epoch: 21, train_loss: 1.0899, test_loss: 1.1531, test_f1: 0.3835
 epoch: 22, train_loss: 1.0915, test_loss: 1.1492, test_f1: 0.3848
 epoch: 23, train_loss: 1.0748, test_loss: 1.1412, test_f1: 0.3970
 epoch: 24, train_loss: 1.0626, test_loss: 1.1329, test_f1: 0.4001
 epoch: 25, train_loss: 1.0587, test_loss: 1.1310, test_f1: 0.3995
 epoch: 26, train_loss: 1.0504, test_loss: 1.1271, test_f1: 0.4011
 epoch: 27, train_loss: 1.0406, test_loss: 1.1217, test_f1: 0.4221
 epoch: 28, train_loss: 1.0414, test_loss: 1.1162, test_f1: 0.4221
 epoch: 29, train_loss: 1.0430, test_loss: 1.1132, test_f1: 0.4289
 epoch: 30, train_loss: 1.0345, test_loss: 1.1135, test_f1: 0.4299
 epoch: 31, train_loss: 1.0260, test_loss: 1.1043, test_f1: 0.4320
 epoch: 32, train_loss: 1.0233, test_loss: 1.0979, test_f1: 0.4326
 epoch: 33, train_loss: 1.0219, test_loss: 1.0949, test_f1: 0.4290
 epoch: 34, train_loss: 1.0216, test_loss: 1.0942, test_f1: 0.4234
 epoch: 35, train_loss: 1.0131, test_loss: 1.0884, test_f1: 0.4324
 epoch: 36, train_loss: 1.0039, test_loss: 1.0863, test_f1: 0.4217
 epoch: 37, train_loss: 1.0103, test_loss: 1.0937, test_f1: 0.4085
 epoch: 38, train_loss: 1.0080, test_loss: 1.0902, test_f1: 0.4046
 epoch: 39, train_loss: 1.0066, test_loss: 1.0878, test_f1: 0.4066
 epoch: 40, train_loss: 0.9925, test_loss: 1.0751, test_f1: 0.4343
 epoch: 41, train_loss: 0.9933, test_loss: 1.0794, test_f1: 0.4023
 epoch: 42, train_loss: 0.9983, test_loss: 1.0757, test_f1: 0.4092
 epoch: 43, train_loss: 0.9786, test_loss: 1.0651, test_f1: 0.4342
 epoch: 44, train_loss: 0.9782, test_loss: 1.0666, test_f1: 0.4317
 epoch: 45, train_loss: 0.9805, test_loss: 1.0651, test_f1: 0.4323
 epoch: 46, train_loss: 0.9815, test_loss: 1.0533, test_f1: 0.4348
 epoch: 47, train_loss: 0.9758, test_loss: 1.0605, test_f1: 0.4324
 epoch: 48, train_loss: 0.9662, test_loss: 1.0622, test_f1: 0.4324
 epoch: 49, train_loss: 0.9670, test_loss: 1.0686, test_f1: 0.4347
 epoch: 50, train_loss: 0.9655, test_loss: 1.0629, test_f1: 0.4341
 epoch: 51, train_loss: 0.9707, test_loss: 1.0611, test_f1: 0.4323
 epoch: 52, train_loss: 0.9578, test_loss: 1.0574, test_f1: 0.4323
 epoch: 53, train_loss: 0.9578, test_loss: 1.0575, test_f1: 0.4323
 epoch: 54, train_loss: 0.9648, test_loss: 1.0638, test_f1: 0.4324
 epoch: 55, train_loss: 0.9604, test_loss: 1.0619, test_f1: 0.4299
 epoch: 56, train_loss: 0.9560, test_loss: 1.0709, test_f1: 0.4317
 epoch: 57, train_loss: 0.9620, test_loss: 1.0702, test_f1: 0.4329
 epoch: 58, train_loss: 0.9594, test_loss: 1.0576, test_f1: 0.4293
 epoch: 59, train_loss: 0.9530, test_loss: 1.0633, test_f1: 0.4305
 epoch: 60, train_loss: 0.9605, test_loss: 1.0625, test_f1: 0.4299
 epoch: 61, train_loss: 0.9527, test_loss: 1.0658, test_f1: 0.4324
 epoch: 62, train_loss: 0.9477, test_loss: 1.0552, test_f1: 0.4347
 epoch: 63, train_loss: 0.9538, test_loss: 1.0538, test_f1: 0.4349
 epoch: 64, train_loss: 0.9470, test_loss: 1.0639, test_f1: 0.4293
 epoch: 65, train_loss: 0.9430, test_loss: 1.0602, test_f1: 0.4299
 epoch: 66, train_loss: 0.9470, test_loss: 1.0545, test_f1: 0.4324
 epoch: 67, train_loss: 0.9461, test_loss: 1.0593, test_f1: 0.4317
 epoch: 68, train_loss: 0.9387, test_loss: 1.0476, test_f1: 0.4368
 epoch: 69, train_loss: 0.9453, test_loss: 1.0530, test_f1: 0.4313
 epoch: 70, train_loss: 0.9483, test_loss: 1.0536, test_f1: 0.4322
 epoch: 71, train_loss: 0.9425, test_loss: 1.0512, test_f1: 0.4330
 epoch: 72, train_loss: 0.9391, test_loss: 1.0525, test_f1: 0.4355
 epoch: 73, train_loss: 0.9400, test_loss: 1.0526, test_f1: 0.4405
 epoch: 74, train_loss: 0.9361, test_loss: 1.0514, test_f1: 0.4354
 epoch: 75, train_loss: 0.9330, test_loss: 1.0530, test_f1: 0.4355
 epoch: 76, train_loss: 0.9368, test_loss: 1.0502, test_f1: 0.4355
 epoch: 77, train_loss: 0.9403, test_loss: 1.0553, test_f1: 0.4355
 epoch: 78, train_loss: 0.9377, test_loss: 1.0509, test_f1: 0.4323
 epoch: 79, train_loss: 0.9394, test_loss: 1.0629, test_f1: 0.4322
 epoch: 80, train_loss: 0.9371, test_loss: 1.0594, test_f1: 0.4348
 epoch: 81, train_loss: 0.9311, test_loss: 1.0500, test_f1: 0.4380
 epoch: 82, train_loss: 0.9373, test_loss: 1.0440, test_f1: 0.4380
 epoch: 83, train_loss: 0.9242, test_loss: 1.0483, test_f1: 0.4380
 epoch: 84, train_loss: 0.9268, test_loss: 1.0434, test_f1: 0.4405
 epoch: 85, train_loss: 0.9312, test_loss: 1.0450, test_f1: 0.4397
 epoch: 86, train_loss: 0.9340, test_loss: 1.0488, test_f1: 0.4373
 epoch: 87, train_loss: 0.9254, test_loss: 1.0518, test_f1: 0.4355
 epoch: 88, train_loss: 0.9209, test_loss: 1.0577, test_f1: 0.4380
 epoch: 89, train_loss: 0.9236, test_loss: 1.0523, test_f1: 0.4405
 epoch: 90, train_loss: 0.9147, test_loss: 1.0459, test_f1: 0.4380
 epoch: 91, train_loss: 0.9312, test_loss: 1.0571, test_f1: 0.4329
 epoch: 92, train_loss: 0.9313, test_loss: 1.0464, test_f1: 0.4380
 epoch: 93, train_loss: 0.9248, test_loss: 1.0434, test_f1: 0.4380
 epoch: 94, train_loss: 0.9245, test_loss: 1.0521, test_f1: 0.4355
 epoch: 95, train_loss: 0.9255, test_loss: 1.0556, test_f1: 0.4355
 epoch: 96, train_loss: 0.9216, test_loss: 1.0594, test_f1: 0.4398
 epoch: 97, train_loss: 0.9126, test_loss: 1.0643, test_f1: 0.4398
 epoch: 98, train_loss: 0.9241, test_loss: 1.0586, test_f1: 0.4373
 epoch: 99, train_loss: 0.9226, test_loss: 1.0659, test_f1: 0.4378
##################ITERATION #9 ****************************************
 epoch: 0, train_loss: 1.2680, test_loss: 1.3069, test_f1: 0.2281
 epoch: 1, train_loss: 1.2311, test_loss: 1.3156, test_f1: 0.2281
 epoch: 2, train_loss: 1.2189, test_loss: 1.3393, test_f1: 0.2281
 epoch: 3, train_loss: 1.1988, test_loss: 1.3182, test_f1: 0.2285
 epoch: 4, train_loss: 1.1870, test_loss: 1.2808, test_f1: 0.2400
 epoch: 5, train_loss: 1.1812, test_loss: 1.2557, test_f1: 0.2400
 epoch: 6, train_loss: 1.1686, test_loss: 1.2330, test_f1: 0.2974
 epoch: 7, train_loss: 1.1519, test_loss: 1.2202, test_f1: 0.3155
 epoch: 8, train_loss: 1.1421, test_loss: 1.2091, test_f1: 0.3187
 epoch: 9, train_loss: 1.1348, test_loss: 1.2029, test_f1: 0.3174
 epoch: 10, train_loss: 1.1243, test_loss: 1.1921, test_f1: 0.3194
 epoch: 11, train_loss: 1.1179, test_loss: 1.1888, test_f1: 0.3211
 epoch: 12, train_loss: 1.1166, test_loss: 1.1777, test_f1: 0.3237
 epoch: 13, train_loss: 1.1012, test_loss: 1.1749, test_f1: 0.3264
 epoch: 14, train_loss: 1.0963, test_loss: 1.1695, test_f1: 0.3258
 epoch: 15, train_loss: 1.0945, test_loss: 1.1701, test_f1: 0.3382
 epoch: 16, train_loss: 1.0920, test_loss: 1.1693, test_f1: 0.3150
 epoch: 17, train_loss: 1.0721, test_loss: 1.1649, test_f1: 0.3352
 epoch: 18, train_loss: 1.0740, test_loss: 1.1618, test_f1: 0.3393
 epoch: 19, train_loss: 1.0627, test_loss: 1.1542, test_f1: 0.3457
 epoch: 20, train_loss: 1.0745, test_loss: 1.1516, test_f1: 0.3460
 epoch: 21, train_loss: 1.0600, test_loss: 1.1433, test_f1: 0.3531
 epoch: 22, train_loss: 1.0552, test_loss: 1.1562, test_f1: 0.3375
 epoch: 23, train_loss: 1.0494, test_loss: 1.1510, test_f1: 0.3425
 epoch: 24, train_loss: 1.0446, test_loss: 1.1385, test_f1: 0.3507
 epoch: 25, train_loss: 1.0423, test_loss: 1.1412, test_f1: 0.3710
 epoch: 26, train_loss: 1.0324, test_loss: 1.1379, test_f1: 0.3785
 epoch: 27, train_loss: 1.0269, test_loss: 1.1469, test_f1: 0.3652
 epoch: 28, train_loss: 1.0209, test_loss: 1.1524, test_f1: 0.3375
 epoch: 29, train_loss: 1.0240, test_loss: 1.1360, test_f1: 0.3497
 epoch: 30, train_loss: 1.0170, test_loss: 1.1302, test_f1: 0.3822
 epoch: 31, train_loss: 1.0122, test_loss: 1.1398, test_f1: 0.3519
 epoch: 32, train_loss: 1.0102, test_loss: 1.1178, test_f1: 0.3567
 epoch: 33, train_loss: 1.0066, test_loss: 1.1307, test_f1: 0.3688
 epoch: 34, train_loss: 1.0040, test_loss: 1.1248, test_f1: 0.3884
 epoch: 35, train_loss: 0.9948, test_loss: 1.1291, test_f1: 0.3986
 epoch: 36, train_loss: 1.0041, test_loss: 1.1308, test_f1: 0.4013
 epoch: 37, train_loss: 1.0005, test_loss: 1.1167, test_f1: 0.3810
 epoch: 38, train_loss: 0.9975, test_loss: 1.1290, test_f1: 0.3754
 epoch: 39, train_loss: 0.9853, test_loss: 1.1218, test_f1: 0.3964
 epoch: 40, train_loss: 0.9876, test_loss: 1.1092, test_f1: 0.4382
 epoch: 41, train_loss: 0.9847, test_loss: 1.1115, test_f1: 0.4267
 epoch: 42, train_loss: 0.9877, test_loss: 1.1156, test_f1: 0.4384
 epoch: 43, train_loss: 0.9793, test_loss: 1.1185, test_f1: 0.4092
 epoch: 44, train_loss: 0.9860, test_loss: 1.1083, test_f1: 0.4131
 epoch: 45, train_loss: 0.9739, test_loss: 1.1067, test_f1: 0.4026
 epoch: 46, train_loss: 0.9777, test_loss: 1.1093, test_f1: 0.4120
 epoch: 47, train_loss: 0.9702, test_loss: 1.0978, test_f1: 0.4139
 epoch: 48, train_loss: 0.9621, test_loss: 1.1056, test_f1: 0.4330
 epoch: 49, train_loss: 0.9740, test_loss: 1.1081, test_f1: 0.3989
 epoch: 50, train_loss: 0.9657, test_loss: 1.0986, test_f1: 0.4172
 epoch: 51, train_loss: 0.9672, test_loss: 1.0980, test_f1: 0.4100
 epoch: 52, train_loss: 0.9632, test_loss: 1.0922, test_f1: 0.4415
 epoch: 53, train_loss: 0.9651, test_loss: 1.0927, test_f1: 0.4391
 epoch: 54, train_loss: 0.9648, test_loss: 1.0950, test_f1: 0.4409
 epoch: 55, train_loss: 0.9613, test_loss: 1.0951, test_f1: 0.4154
 epoch: 56, train_loss: 0.9639, test_loss: 1.0904, test_f1: 0.4187
 epoch: 57, train_loss: 0.9596, test_loss: 1.0915, test_f1: 0.4444
 epoch: 58, train_loss: 0.9539, test_loss: 1.0943, test_f1: 0.4347
 epoch: 59, train_loss: 0.9543, test_loss: 1.0974, test_f1: 0.4382
 epoch: 60, train_loss: 0.9532, test_loss: 1.0947, test_f1: 0.4406
 epoch: 61, train_loss: 0.9568, test_loss: 1.0973, test_f1: 0.4315
 epoch: 62, train_loss: 0.9556, test_loss: 1.0999, test_f1: 0.4287
 epoch: 63, train_loss: 0.9541, test_loss: 1.0974, test_f1: 0.4278
 epoch: 64, train_loss: 0.9421, test_loss: 1.0991, test_f1: 0.4294
 epoch: 65, train_loss: 0.9556, test_loss: 1.1015, test_f1: 0.4339
 epoch: 66, train_loss: 0.9537, test_loss: 1.0890, test_f1: 0.4368
 epoch: 67, train_loss: 0.9504, test_loss: 1.0952, test_f1: 0.4437
 epoch: 68, train_loss: 0.9510, test_loss: 1.0869, test_f1: 0.4426
 epoch: 69, train_loss: 0.9547, test_loss: 1.0895, test_f1: 0.4325
 epoch: 70, train_loss: 0.9497, test_loss: 1.0943, test_f1: 0.4294
 epoch: 71, train_loss: 0.9495, test_loss: 1.0858, test_f1: 0.4396
 epoch: 72, train_loss: 0.9453, test_loss: 1.0904, test_f1: 0.4479
 epoch: 73, train_loss: 0.9504, test_loss: 1.0873, test_f1: 0.4388
 epoch: 74, train_loss: 0.9495, test_loss: 1.0912, test_f1: 0.4414
 epoch: 75, train_loss: 0.9475, test_loss: 1.0928, test_f1: 0.4425
 epoch: 76, train_loss: 0.9455, test_loss: 1.1012, test_f1: 0.4317
 epoch: 77, train_loss: 0.9430, test_loss: 1.0979, test_f1: 0.4376
 epoch: 78, train_loss: 0.9410, test_loss: 1.0907, test_f1: 0.4444
 epoch: 79, train_loss: 0.9441, test_loss: 1.0891, test_f1: 0.4411
 epoch: 80, train_loss: 0.9435, test_loss: 1.0874, test_f1: 0.4405
 epoch: 81, train_loss: 0.9398, test_loss: 1.0917, test_f1: 0.4412
 epoch: 82, train_loss: 0.9424, test_loss: 1.0897, test_f1: 0.4411
 epoch: 83, train_loss: 0.9443, test_loss: 1.0936, test_f1: 0.4416
 epoch: 84, train_loss: 0.9366, test_loss: 1.0865, test_f1: 0.4378
 epoch: 85, train_loss: 0.9420, test_loss: 1.0908, test_f1: 0.4378
 epoch: 86, train_loss: 0.9476, test_loss: 1.0911, test_f1: 0.4355
 epoch: 87, train_loss: 0.9341, test_loss: 1.0941, test_f1: 0.4381
 epoch: 88, train_loss: 0.9365, test_loss: 1.1005, test_f1: 0.4339
 epoch: 89, train_loss: 0.9350, test_loss: 1.1009, test_f1: 0.4365
 epoch: 90, train_loss: 0.9314, test_loss: 1.1011, test_f1: 0.4364
 epoch: 91, train_loss: 0.9342, test_loss: 1.0974, test_f1: 0.4374
 epoch: 92, train_loss: 0.9326, test_loss: 1.0975, test_f1: 0.4376
 epoch: 93, train_loss: 0.9404, test_loss: 1.0908, test_f1: 0.4352
 epoch: 94, train_loss: 0.9344, test_loss: 1.0906, test_f1: 0.4400
 epoch: 95, train_loss: 0.9333, test_loss: 1.0928, test_f1: 0.4375
 epoch: 96, train_loss: 0.9306, test_loss: 1.0973, test_f1: 0.4371
 epoch: 97, train_loss: 0.9379, test_loss: 1.0964, test_f1: 0.4326
 epoch: 98, train_loss: 0.9340, test_loss: 1.0968, test_f1: 0.4335
 epoch: 99, train_loss: 0.9332, test_loss: 1.0957, test_f1: 0.4348

Training completed in 529.21 seconds
Best F1: 0.4999 at epoch 83
Mean F1 across iterations: 0.4559  0.0223
========================FINAL RESULTS================================
FEGIN weighted F1: 0.4999  0.0223
python main.py --data ltspice_demos --representation component_pin_net --model FEGIN --layers 6 --hiddens 32 --batch_size 128 --lr 0.0001 --emb_size 128 --epochs 100 --save_appendix component_pin_net_L6_H32_BS128_LR0.0001_E128 --no_val
-----



STDERR:
  File "main.py", line 370, in <module>
    main()
  File "main.py", line 254, in main
    dataset = dataset_class(
  File "/home/philip/projects/ltspice_examples_code_repo/Circuit-Completion-Using-GNNs/component_classification_with_link_prediction_head/evaluation/FEGIN/kernel/circuit_datasets.py", line 15, in __init__
    self.data, self.slices = torch.load(self.processed_paths[0])
  File "/home/philip/.local/lib/python3.8/site-packages/torch/serialization.py", line 1040, in load
    warnings.warn(
  File "/usr/lib/python3.8/warnings.py", line 109, in _showwarnmsg
    sw(msg.message, msg.category, msg.filename, msg.lineno,
  File "main.py", line 47, in warn_with_traceback
    traceback.print_stack(file=log)
/home/philip/projects/ltspice_examples_code_repo/Circuit-Completion-Using-GNNs/component_classification_with_link_prediction_head/evaluation/FEGIN/kernel/circuit_datasets.py:15: FutureWarning: You are using `torch.load` with `weights_only=False` (the current default value), which uses the default pickle module implicitly. It is possible to construct malicious pickle data which will execute arbitrary code during unpickling (See https://github.com/pytorch/pytorch/blob/main/SECURITY.md#untrusted-models for more details). In a future release, the default value for `weights_only` will be flipped to `True`. This limits the functions that could be executed during unpickling. Arbitrary objects will no longer be allowed to be loaded via this mode unless they are explicitly allowlisted by the user via `torch.serialization.add_safe_globals`. We recommend you start setting `weights_only=True` for any use case where you don't have full control of the loaded file. Please open an issue on GitHub for any issues related to this experimental feature.
  self.data, self.slices = torch.load(self.processed_paths[0])
