STDOUT:
Results will be saved in /home/philip/projects/ltspice_examples_code_repo/Circuit-Completion-Using-GNNs/component_classification_with_link_prediction_head/evaluation/FEGIN/results/model_FEGIN_dataset_ltspice_demos
Command line input: python main.py --data ltspice_demos --representation component_component --model FEGIN --layers 5 --hiddens 128 --batch_size 256 --lr 0.0001 --emb_size 250 --epochs 100 --save_appendix component_component_L5_H128_BS256_LR0.0001_E250 --no_val
 is saved.
-----
ltspice_demos - FEGIN
Using 5 layers, 128 hidden units, h = 2
Loading component_component representation dataset
ENTERED
Training FEGIN on component_component representation
Train: 1565, Test: 383
##################ITERATION #0 ****************************************
 epoch: 0, train_loss: 1.3924, test_loss: 1.3877, test_f1: 0.1365
 epoch: 1, train_loss: 1.3794, test_loss: 1.3829, test_f1: 0.1365
 epoch: 2, train_loss: 1.3718, test_loss: 1.3786, test_f1: 0.1365
 epoch: 3, train_loss: 1.3643, test_loss: 1.3739, test_f1: 0.1365
 epoch: 4, train_loss: 1.3565, test_loss: 1.3677, test_f1: 0.1365
 epoch: 5, train_loss: 1.3475, test_loss: 1.3611, test_f1: 0.1411
 epoch: 6, train_loss: 1.3381, test_loss: 1.3519, test_f1: 0.1640
 epoch: 7, train_loss: 1.3277, test_loss: 1.3428, test_f1: 0.2807
 epoch: 8, train_loss: 1.3155, test_loss: 1.3332, test_f1: 0.3206
 epoch: 9, train_loss: 1.3029, test_loss: 1.3240, test_f1: 0.3315
 epoch: 10, train_loss: 1.2886, test_loss: 1.3145, test_f1: 0.3322
 epoch: 11, train_loss: 1.2762, test_loss: 1.3037, test_f1: 0.3303
 epoch: 12, train_loss: 1.2591, test_loss: 1.2937, test_f1: 0.3318
 epoch: 13, train_loss: 1.2429, test_loss: 1.2844, test_f1: 0.3486
 epoch: 14, train_loss: 1.2266, test_loss: 1.2749, test_f1: 0.3628
 epoch: 15, train_loss: 1.2114, test_loss: 1.2654, test_f1: 0.3760
 epoch: 16, train_loss: 1.1991, test_loss: 1.2583, test_f1: 0.3854
 epoch: 17, train_loss: 1.1861, test_loss: 1.2498, test_f1: 0.4008
 epoch: 18, train_loss: 1.1705, test_loss: 1.2486, test_f1: 0.4007
 epoch: 19, train_loss: 1.1599, test_loss: 1.2469, test_f1: 0.4115
 epoch: 20, train_loss: 1.1510, test_loss: 1.2350, test_f1: 0.4146
 epoch: 21, train_loss: 1.1370, test_loss: 1.2284, test_f1: 0.4207
 epoch: 22, train_loss: 1.1256, test_loss: 1.2249, test_f1: 0.4222
 epoch: 23, train_loss: 1.1205, test_loss: 1.2200, test_f1: 0.4400
 epoch: 24, train_loss: 1.1079, test_loss: 1.2109, test_f1: 0.4552
 epoch: 25, train_loss: 1.1003, test_loss: 1.2099, test_f1: 0.4359
 epoch: 26, train_loss: 1.0878, test_loss: 1.2075, test_f1: 0.4478
 epoch: 27, train_loss: 1.0810, test_loss: 1.2017, test_f1: 0.4611
 epoch: 28, train_loss: 1.0703, test_loss: 1.1994, test_f1: 0.4526
 epoch: 29, train_loss: 1.0575, test_loss: 1.2037, test_f1: 0.4515
 epoch: 30, train_loss: 1.0498, test_loss: 1.2072, test_f1: 0.4356
 epoch: 31, train_loss: 1.0374, test_loss: 1.2217, test_f1: 0.4265
 epoch: 32, train_loss: 1.0312, test_loss: 1.2255, test_f1: 0.4414
 epoch: 33, train_loss: 1.0187, test_loss: 1.2240, test_f1: 0.4459
 epoch: 34, train_loss: 1.0134, test_loss: 1.2318, test_f1: 0.4395
 epoch: 35, train_loss: 1.0025, test_loss: 1.2392, test_f1: 0.4353
 epoch: 36, train_loss: 0.9885, test_loss: 1.2672, test_f1: 0.4283
 epoch: 37, train_loss: 0.9859, test_loss: 1.2613, test_f1: 0.4260
 epoch: 38, train_loss: 0.9775, test_loss: 1.2404, test_f1: 0.4457
 epoch: 39, train_loss: 0.9645, test_loss: 1.2350, test_f1: 0.4604
 epoch: 40, train_loss: 0.9556, test_loss: 1.2273, test_f1: 0.4538
 epoch: 41, train_loss: 0.9501, test_loss: 1.2240, test_f1: 0.4565
 epoch: 42, train_loss: 0.9433, test_loss: 1.2306, test_f1: 0.4567
 epoch: 43, train_loss: 0.9377, test_loss: 1.2527, test_f1: 0.4367
 epoch: 44, train_loss: 0.9290, test_loss: 1.2940, test_f1: 0.4456
 epoch: 45, train_loss: 0.9289, test_loss: 1.2711, test_f1: 0.4347
 epoch: 46, train_loss: 0.9102, test_loss: 1.2552, test_f1: 0.4341
 epoch: 47, train_loss: 0.9096, test_loss: 1.2300, test_f1: 0.4446
 epoch: 48, train_loss: 0.8987, test_loss: 1.2612, test_f1: 0.4452
 epoch: 49, train_loss: 0.8958, test_loss: 1.2856, test_f1: 0.4524
 epoch: 50, train_loss: 0.8862, test_loss: 1.2632, test_f1: 0.4692
 epoch: 51, train_loss: 0.8822, test_loss: 1.2574, test_f1: 0.4533
 epoch: 52, train_loss: 0.8758, test_loss: 1.2765, test_f1: 0.4462
 epoch: 53, train_loss: 0.8688, test_loss: 1.2750, test_f1: 0.4532
 epoch: 54, train_loss: 0.8790, test_loss: 1.2721, test_f1: 0.4569
 epoch: 55, train_loss: 0.8654, test_loss: 1.2746, test_f1: 0.4566
 epoch: 56, train_loss: 0.8558, test_loss: 1.2688, test_f1: 0.4728
 epoch: 57, train_loss: 0.8552, test_loss: 1.2755, test_f1: 0.4687
 epoch: 58, train_loss: 0.8563, test_loss: 1.2850, test_f1: 0.4801
 epoch: 59, train_loss: 0.8532, test_loss: 1.2844, test_f1: 0.4937
 epoch: 60, train_loss: 0.8539, test_loss: 1.2981, test_f1: 0.4883
 epoch: 61, train_loss: 0.8490, test_loss: 1.3283, test_f1: 0.4910
 epoch: 62, train_loss: 0.8489, test_loss: 1.3364, test_f1: 0.4866
 epoch: 63, train_loss: 0.8362, test_loss: 1.3218, test_f1: 0.4862
 epoch: 64, train_loss: 0.8443, test_loss: 1.3001, test_f1: 0.4990
 epoch: 65, train_loss: 0.8446, test_loss: 1.2774, test_f1: 0.4946
 epoch: 66, train_loss: 0.8362, test_loss: 1.2986, test_f1: 0.4936
 epoch: 67, train_loss: 0.8282, test_loss: 1.2992, test_f1: 0.4822
 epoch: 68, train_loss: 0.8234, test_loss: 1.2951, test_f1: 0.4860
 epoch: 69, train_loss: 0.8275, test_loss: 1.2849, test_f1: 0.4925
 epoch: 70, train_loss: 0.8275, test_loss: 1.2866, test_f1: 0.5017
 epoch: 71, train_loss: 0.8206, test_loss: 1.3143, test_f1: 0.5036
 epoch: 72, train_loss: 0.8157, test_loss: 1.3248, test_f1: 0.5128
 epoch: 73, train_loss: 0.8140, test_loss: 1.3181, test_f1: 0.5292
 epoch: 74, train_loss: 0.8092, test_loss: 1.3184, test_f1: 0.5165
 epoch: 75, train_loss: 0.8116, test_loss: 1.3557, test_f1: 0.5178
 epoch: 76, train_loss: 0.8007, test_loss: 1.3245, test_f1: 0.5074
 epoch: 77, train_loss: 0.8048, test_loss: 1.3052, test_f1: 0.5111
 epoch: 78, train_loss: 0.8063, test_loss: 1.3625, test_f1: 0.5184
 epoch: 79, train_loss: 0.8073, test_loss: 1.3830, test_f1: 0.5100
 epoch: 80, train_loss: 0.7935, test_loss: 1.3494, test_f1: 0.5131
 epoch: 81, train_loss: 0.8068, test_loss: 1.3340, test_f1: 0.5285
 epoch: 82, train_loss: 0.7866, test_loss: 1.3511, test_f1: 0.5290
 epoch: 83, train_loss: 0.7935, test_loss: 1.4126, test_f1: 0.5414
 epoch: 84, train_loss: 0.7879, test_loss: 1.4183, test_f1: 0.5256
 epoch: 85, train_loss: 0.7841, test_loss: 1.3622, test_f1: 0.5230
 epoch: 86, train_loss: 0.7814, test_loss: 1.3715, test_f1: 0.5208
 epoch: 87, train_loss: 0.7837, test_loss: 1.3604, test_f1: 0.5341
 epoch: 88, train_loss: 0.7744, test_loss: 1.4037, test_f1: 0.5330
 epoch: 89, train_loss: 0.7691, test_loss: 1.3882, test_f1: 0.5254
 epoch: 90, train_loss: 0.7728, test_loss: 1.3762, test_f1: 0.5418
 epoch: 91, train_loss: 0.7733, test_loss: 1.4309, test_f1: 0.5234
 epoch: 92, train_loss: 0.7732, test_loss: 1.4326, test_f1: 0.5265
 epoch: 93, train_loss: 0.7770, test_loss: 1.4111, test_f1: 0.5248
 epoch: 94, train_loss: 0.7564, test_loss: 1.4407, test_f1: 0.5077
 epoch: 95, train_loss: 0.7532, test_loss: 1.4437, test_f1: 0.5228
 epoch: 96, train_loss: 0.7607, test_loss: 1.4590, test_f1: 0.5193
 epoch: 97, train_loss: 0.7530, test_loss: 1.3976, test_f1: 0.5266
 epoch: 98, train_loss: 0.7575, test_loss: 1.3586, test_f1: 0.5271
 epoch: 99, train_loss: 0.7470, test_loss: 1.3783, test_f1: 0.5361
##################ITERATION #1 ****************************************
 epoch: 0, train_loss: 1.3445, test_loss: 1.3698, test_f1: 0.1836
 epoch: 1, train_loss: 1.3083, test_loss: 1.3595, test_f1: 0.1888
 epoch: 2, train_loss: 1.2915, test_loss: 1.3467, test_f1: 0.3352
 epoch: 3, train_loss: 1.2704, test_loss: 1.3304, test_f1: 0.2736
 epoch: 4, train_loss: 1.2558, test_loss: 1.3158, test_f1: 0.2494
 epoch: 5, train_loss: 1.2392, test_loss: 1.3021, test_f1: 0.2606
 epoch: 6, train_loss: 1.2243, test_loss: 1.2877, test_f1: 0.2676
 epoch: 7, train_loss: 1.2094, test_loss: 1.2807, test_f1: 0.2847
 epoch: 8, train_loss: 1.1993, test_loss: 1.2814, test_f1: 0.2896
 epoch: 9, train_loss: 1.1838, test_loss: 1.2948, test_f1: 0.3069
 epoch: 10, train_loss: 1.1700, test_loss: 1.3396, test_f1: 0.3607
 epoch: 11, train_loss: 1.1636, test_loss: 1.4008, test_f1: 0.4079
 epoch: 12, train_loss: 1.1513, test_loss: 1.4209, test_f1: 0.4059
 epoch: 13, train_loss: 1.1378, test_loss: 1.4181, test_f1: 0.4142
 epoch: 14, train_loss: 1.1288, test_loss: 1.4332, test_f1: 0.4282
 epoch: 15, train_loss: 1.1194, test_loss: 1.5205, test_f1: 0.4266
 epoch: 16, train_loss: 1.1075, test_loss: 1.4943, test_f1: 0.4286
 epoch: 17, train_loss: 1.0940, test_loss: 1.4957, test_f1: 0.4320
 epoch: 18, train_loss: 1.0910, test_loss: 1.5259, test_f1: 0.4388
 epoch: 19, train_loss: 1.0735, test_loss: 1.4999, test_f1: 0.4405
 epoch: 20, train_loss: 1.0657, test_loss: 1.5642, test_f1: 0.4408
 epoch: 21, train_loss: 1.0573, test_loss: 1.5309, test_f1: 0.4428
 epoch: 22, train_loss: 1.0473, test_loss: 1.5220, test_f1: 0.4578
 epoch: 23, train_loss: 1.0364, test_loss: 1.6016, test_f1: 0.4468
 epoch: 24, train_loss: 1.0239, test_loss: 1.6768, test_f1: 0.4396
 epoch: 25, train_loss: 1.0105, test_loss: 1.7674, test_f1: 0.4551
 epoch: 26, train_loss: 1.0033, test_loss: 1.6013, test_f1: 0.4532
 epoch: 27, train_loss: 0.9936, test_loss: 1.6547, test_f1: 0.4532
 epoch: 28, train_loss: 0.9843, test_loss: 1.6135, test_f1: 0.4607
 epoch: 29, train_loss: 0.9791, test_loss: 1.7143, test_f1: 0.4521
 epoch: 30, train_loss: 0.9723, test_loss: 1.8021, test_f1: 0.4776
 epoch: 31, train_loss: 0.9625, test_loss: 1.7534, test_f1: 0.5099
 epoch: 32, train_loss: 0.9530, test_loss: 1.5577, test_f1: 0.4802
 epoch: 33, train_loss: 0.9500, test_loss: 1.6141, test_f1: 0.4803
 epoch: 34, train_loss: 0.9378, test_loss: 1.6968, test_f1: 0.4937
 epoch: 35, train_loss: 0.9253, test_loss: 1.8284, test_f1: 0.5046
 epoch: 36, train_loss: 0.9180, test_loss: 1.8731, test_f1: 0.5146
 epoch: 37, train_loss: 0.9077, test_loss: 1.8605, test_f1: 0.5124
 epoch: 38, train_loss: 0.9121, test_loss: 1.8324, test_f1: 0.5163
 epoch: 39, train_loss: 0.9024, test_loss: 1.7238, test_f1: 0.5155
 epoch: 40, train_loss: 0.8839, test_loss: 1.6327, test_f1: 0.5313
 epoch: 41, train_loss: 0.8845, test_loss: 1.6960, test_f1: 0.5112
 epoch: 42, train_loss: 0.8744, test_loss: 1.8726, test_f1: 0.5331
 epoch: 43, train_loss: 0.8680, test_loss: 1.8275, test_f1: 0.5393
 epoch: 44, train_loss: 0.8631, test_loss: 1.7752, test_f1: 0.5505
 epoch: 45, train_loss: 0.8560, test_loss: 1.6941, test_f1: 0.5275
 epoch: 46, train_loss: 0.8505, test_loss: 1.6817, test_f1: 0.5235
 epoch: 47, train_loss: 0.8422, test_loss: 1.6709, test_f1: 0.5402
 epoch: 48, train_loss: 0.8338, test_loss: 1.7721, test_f1: 0.5371
 epoch: 49, train_loss: 0.8241, test_loss: 1.9210, test_f1: 0.5229
 epoch: 50, train_loss: 0.8291, test_loss: 1.6113, test_f1: 0.5319
 epoch: 51, train_loss: 0.8122, test_loss: 1.6819, test_f1: 0.5278
 epoch: 52, train_loss: 0.8077, test_loss: 1.7689, test_f1: 0.5229
 epoch: 53, train_loss: 0.8070, test_loss: 1.8363, test_f1: 0.5241
 epoch: 54, train_loss: 0.8058, test_loss: 1.9732, test_f1: 0.5384
 epoch: 55, train_loss: 0.7963, test_loss: 1.8393, test_f1: 0.5385
 epoch: 56, train_loss: 0.7935, test_loss: 1.9069, test_f1: 0.5211
 epoch: 57, train_loss: 0.7799, test_loss: 2.0572, test_f1: 0.5245
 epoch: 58, train_loss: 0.7834, test_loss: 1.9477, test_f1: 0.5444
 epoch: 59, train_loss: 0.7826, test_loss: 2.0650, test_f1: 0.5382
 epoch: 60, train_loss: 0.7716, test_loss: 1.9584, test_f1: 0.5304
 epoch: 61, train_loss: 0.7760, test_loss: 2.0733, test_f1: 0.5286
 epoch: 62, train_loss: 0.7689, test_loss: 1.9444, test_f1: 0.5266
 epoch: 63, train_loss: 0.7577, test_loss: 1.7387, test_f1: 0.5247
 epoch: 64, train_loss: 0.7534, test_loss: 1.7394, test_f1: 0.5118
 epoch: 65, train_loss: 0.7639, test_loss: 1.7238, test_f1: 0.5251
 epoch: 66, train_loss: 0.7560, test_loss: 1.7789, test_f1: 0.5383
 epoch: 67, train_loss: 0.7460, test_loss: 1.8409, test_f1: 0.5369
 epoch: 68, train_loss: 0.7533, test_loss: 1.8459, test_f1: 0.5357
 epoch: 69, train_loss: 0.7378, test_loss: 1.9739, test_f1: 0.5460
 epoch: 70, train_loss: 0.7289, test_loss: 2.0950, test_f1: 0.5476
 epoch: 71, train_loss: 0.7422, test_loss: 2.1361, test_f1: 0.5325
 epoch: 72, train_loss: 0.7332, test_loss: 2.3461, test_f1: 0.5422
 epoch: 73, train_loss: 0.7315, test_loss: 2.5568, test_f1: 0.5523
 epoch: 74, train_loss: 0.7235, test_loss: 2.7012, test_f1: 0.5512
 epoch: 75, train_loss: 0.7234, test_loss: 1.9183, test_f1: 0.5378
 epoch: 76, train_loss: 0.7166, test_loss: 2.1843, test_f1: 0.5480
 epoch: 77, train_loss: 0.7102, test_loss: 2.1712, test_f1: 0.5439
 epoch: 78, train_loss: 0.7123, test_loss: 2.3738, test_f1: 0.5318
 epoch: 79, train_loss: 0.7081, test_loss: 2.3044, test_f1: 0.5357
 epoch: 80, train_loss: 0.7127, test_loss: 2.6676, test_f1: 0.5638
 epoch: 81, train_loss: 0.6995, test_loss: 2.6854, test_f1: 0.5543
 epoch: 82, train_loss: 0.6929, test_loss: 2.7406, test_f1: 0.5569
 epoch: 83, train_loss: 0.6970, test_loss: 2.8576, test_f1: 0.5431
 epoch: 84, train_loss: 0.6989, test_loss: 2.8934, test_f1: 0.5473
 epoch: 85, train_loss: 0.6978, test_loss: 2.8308, test_f1: 0.5503
 epoch: 86, train_loss: 0.6863, test_loss: 2.8982, test_f1: 0.5336
 epoch: 87, train_loss: 0.6938, test_loss: 3.2185, test_f1: 0.5249
 epoch: 88, train_loss: 0.6825, test_loss: 2.8768, test_f1: 0.5252
 epoch: 89, train_loss: 0.6727, test_loss: 2.7349, test_f1: 0.5574
 epoch: 90, train_loss: 0.6790, test_loss: 2.4611, test_f1: 0.5625
 epoch: 91, train_loss: 0.6768, test_loss: 2.4025, test_f1: 0.5592
 epoch: 92, train_loss: 0.6608, test_loss: 2.2334, test_f1: 0.5664
 epoch: 93, train_loss: 0.6609, test_loss: 2.4014, test_f1: 0.5785
 epoch: 94, train_loss: 0.6682, test_loss: 2.4540, test_f1: 0.5640
 epoch: 95, train_loss: 0.6468, test_loss: 2.6462, test_f1: 0.5696
 epoch: 96, train_loss: 0.6482, test_loss: 2.7490, test_f1: 0.5679
 epoch: 97, train_loss: 0.6498, test_loss: 2.5445, test_f1: 0.5431
 epoch: 98, train_loss: 0.6536, test_loss: 2.4490, test_f1: 0.5489
 epoch: 99, train_loss: 0.6392, test_loss: 2.3042, test_f1: 0.5355
##################ITERATION #2 ****************************************
 epoch: 0, train_loss: 1.3229, test_loss: 1.3627, test_f1: 0.2014
 epoch: 1, train_loss: 1.2773, test_loss: 1.3532, test_f1: 0.2014
 epoch: 2, train_loss: 1.2516, test_loss: 1.3367, test_f1: 0.3325
 epoch: 3, train_loss: 1.2333, test_loss: 1.3181, test_f1: 0.2986
 epoch: 4, train_loss: 1.2181, test_loss: 1.3002, test_f1: 0.3272
 epoch: 5, train_loss: 1.1967, test_loss: 1.2840, test_f1: 0.3349
 epoch: 6, train_loss: 1.1795, test_loss: 1.2675, test_f1: 0.3422
 epoch: 7, train_loss: 1.1647, test_loss: 1.2479, test_f1: 0.3819
 epoch: 8, train_loss: 1.1491, test_loss: 1.2287, test_f1: 0.4281
 epoch: 9, train_loss: 1.1360, test_loss: 1.2136, test_f1: 0.4628
 epoch: 10, train_loss: 1.1190, test_loss: 1.2035, test_f1: 0.4608
 epoch: 11, train_loss: 1.1104, test_loss: 1.1962, test_f1: 0.4440
 epoch: 12, train_loss: 1.0948, test_loss: 1.1899, test_f1: 0.4460
 epoch: 13, train_loss: 1.0844, test_loss: 1.1892, test_f1: 0.4429
 epoch: 14, train_loss: 1.0763, test_loss: 1.1816, test_f1: 0.4400
 epoch: 15, train_loss: 1.0652, test_loss: 1.1742, test_f1: 0.4385
 epoch: 16, train_loss: 1.0499, test_loss: 1.1685, test_f1: 0.4536
 epoch: 17, train_loss: 1.0357, test_loss: 1.1676, test_f1: 0.4575
 epoch: 18, train_loss: 1.0366, test_loss: 1.1737, test_f1: 0.4434
 epoch: 19, train_loss: 1.0264, test_loss: 1.1755, test_f1: 0.4396
 epoch: 20, train_loss: 1.0163, test_loss: 1.1719, test_f1: 0.4501
 epoch: 21, train_loss: 1.0085, test_loss: 1.1773, test_f1: 0.4588
 epoch: 22, train_loss: 0.9944, test_loss: 1.1847, test_f1: 0.4561
 epoch: 23, train_loss: 0.9925, test_loss: 1.1816, test_f1: 0.4722
 epoch: 24, train_loss: 0.9767, test_loss: 1.1700, test_f1: 0.4701
 epoch: 25, train_loss: 0.9645, test_loss: 1.1708, test_f1: 0.4785
 epoch: 26, train_loss: 0.9612, test_loss: 1.1774, test_f1: 0.4631
 epoch: 27, train_loss: 0.9560, test_loss: 1.1664, test_f1: 0.4535
 epoch: 28, train_loss: 0.9334, test_loss: 1.1730, test_f1: 0.4561
 epoch: 29, train_loss: 0.9355, test_loss: 1.1809, test_f1: 0.4543
 epoch: 30, train_loss: 0.9237, test_loss: 1.1844, test_f1: 0.4667
 epoch: 31, train_loss: 0.9182, test_loss: 1.1867, test_f1: 0.4561
 epoch: 32, train_loss: 0.9178, test_loss: 1.1673, test_f1: 0.4774
 epoch: 33, train_loss: 0.9018, test_loss: 1.1753, test_f1: 0.4975
 epoch: 34, train_loss: 0.8922, test_loss: 1.2349, test_f1: 0.5309
 epoch: 35, train_loss: 0.8927, test_loss: 1.2301, test_f1: 0.5251
 epoch: 36, train_loss: 0.8834, test_loss: 1.2420, test_f1: 0.5208
 epoch: 37, train_loss: 0.8835, test_loss: 1.2458, test_f1: 0.5212
 epoch: 38, train_loss: 0.8683, test_loss: 1.2526, test_f1: 0.4999
 epoch: 39, train_loss: 0.8636, test_loss: 1.2531, test_f1: 0.5055
 epoch: 40, train_loss: 0.8620, test_loss: 1.2485, test_f1: 0.5112
 epoch: 41, train_loss: 0.8530, test_loss: 1.2482, test_f1: 0.5204
 epoch: 42, train_loss: 0.8495, test_loss: 1.2239, test_f1: 0.5157
 epoch: 43, train_loss: 0.8208, test_loss: 1.2372, test_f1: 0.5094
 epoch: 44, train_loss: 0.8338, test_loss: 1.2675, test_f1: 0.5199
 epoch: 45, train_loss: 0.8191, test_loss: 1.2911, test_f1: 0.5314
 epoch: 46, train_loss: 0.8147, test_loss: 1.3144, test_f1: 0.5091
 epoch: 47, train_loss: 0.8161, test_loss: 1.3516, test_f1: 0.5256
 epoch: 48, train_loss: 0.8038, test_loss: 1.2875, test_f1: 0.5174
 epoch: 49, train_loss: 0.7986, test_loss: 1.2950, test_f1: 0.5186
 epoch: 50, train_loss: 0.7867, test_loss: 1.2896, test_f1: 0.4907
 epoch: 51, train_loss: 0.7808, test_loss: 1.2832, test_f1: 0.5014
 epoch: 52, train_loss: 0.7781, test_loss: 1.2674, test_f1: 0.5242
 epoch: 53, train_loss: 0.7779, test_loss: 1.2688, test_f1: 0.5231
 epoch: 54, train_loss: 0.7575, test_loss: 1.2420, test_f1: 0.5488
 epoch: 55, train_loss: 0.7666, test_loss: 1.2232, test_f1: 0.5289
 epoch: 56, train_loss: 0.7666, test_loss: 1.2533, test_f1: 0.5187
 epoch: 57, train_loss: 0.7547, test_loss: 1.2685, test_f1: 0.5378
 epoch: 58, train_loss: 0.7510, test_loss: 1.2619, test_f1: 0.5407
 epoch: 59, train_loss: 0.7540, test_loss: 1.2856, test_f1: 0.5350
 epoch: 60, train_loss: 0.7537, test_loss: 1.3136, test_f1: 0.5379
 epoch: 61, train_loss: 0.7411, test_loss: 1.2773, test_f1: 0.5645
 epoch: 62, train_loss: 0.7406, test_loss: 1.2831, test_f1: 0.5566
 epoch: 63, train_loss: 0.7388, test_loss: 1.2890, test_f1: 0.5554
 epoch: 64, train_loss: 0.7306, test_loss: 1.2849, test_f1: 0.5423
 epoch: 65, train_loss: 0.7283, test_loss: 1.3093, test_f1: 0.5597
 epoch: 66, train_loss: 0.7387, test_loss: 1.3055, test_f1: 0.5533
 epoch: 67, train_loss: 0.7195, test_loss: 1.3066, test_f1: 0.5490
 epoch: 68, train_loss: 0.7286, test_loss: 1.3080, test_f1: 0.5478
 epoch: 69, train_loss: 0.7270, test_loss: 1.3276, test_f1: 0.5722
 epoch: 70, train_loss: 0.7076, test_loss: 1.3062, test_f1: 0.5776
 epoch: 71, train_loss: 0.6990, test_loss: 1.2976, test_f1: 0.5659
 epoch: 72, train_loss: 0.7055, test_loss: 1.3128, test_f1: 0.5503
 epoch: 73, train_loss: 0.7010, test_loss: 1.3376, test_f1: 0.5616
 epoch: 74, train_loss: 0.6933, test_loss: 1.3588, test_f1: 0.5496
 epoch: 75, train_loss: 0.7032, test_loss: 1.3395, test_f1: 0.5292
 epoch: 76, train_loss: 0.7049, test_loss: 1.3365, test_f1: 0.5461
 epoch: 77, train_loss: 0.6872, test_loss: 1.3351, test_f1: 0.5494
 epoch: 78, train_loss: 0.6875, test_loss: 1.3668, test_f1: 0.5472
 epoch: 79, train_loss: 0.6833, test_loss: 1.3948, test_f1: 0.5584
 epoch: 80, train_loss: 0.6823, test_loss: 1.3969, test_f1: 0.5556
 epoch: 81, train_loss: 0.6782, test_loss: 1.3888, test_f1: 0.5533
 epoch: 82, train_loss: 0.6842, test_loss: 1.3771, test_f1: 0.5602
 epoch: 83, train_loss: 0.6766, test_loss: 1.3692, test_f1: 0.5556
 epoch: 84, train_loss: 0.6740, test_loss: 1.3783, test_f1: 0.5547
 epoch: 85, train_loss: 0.6654, test_loss: 1.4226, test_f1: 0.5395
 epoch: 86, train_loss: 0.6685, test_loss: 1.4274, test_f1: 0.5460
 epoch: 87, train_loss: 0.6644, test_loss: 1.4319, test_f1: 0.5361
 epoch: 88, train_loss: 0.6744, test_loss: 1.4714, test_f1: 0.5202
 epoch: 89, train_loss: 0.6615, test_loss: 1.4718, test_f1: 0.5190
 epoch: 90, train_loss: 0.6712, test_loss: 1.4910, test_f1: 0.5040
 epoch: 91, train_loss: 0.6761, test_loss: 1.4600, test_f1: 0.5016
 epoch: 92, train_loss: 0.6581, test_loss: 1.4224, test_f1: 0.5288
 epoch: 93, train_loss: 0.6734, test_loss: 1.4589, test_f1: 0.5385
 epoch: 94, train_loss: 0.6566, test_loss: 1.4576, test_f1: 0.5341
 epoch: 95, train_loss: 0.6498, test_loss: 1.4633, test_f1: 0.5403
 epoch: 96, train_loss: 0.6437, test_loss: 1.4739, test_f1: 0.5091
 epoch: 97, train_loss: 0.6421, test_loss: 1.4361, test_f1: 0.5382
 epoch: 98, train_loss: 0.6298, test_loss: 1.4534, test_f1: 0.5579
 epoch: 99, train_loss: 0.6367, test_loss: 1.4690, test_f1: 0.5526
##################ITERATION #3 ****************************************
 epoch: 0, train_loss: 1.2787, test_loss: 1.3483, test_f1: 0.1374
 epoch: 1, train_loss: 1.2334, test_loss: 1.3329, test_f1: 0.3209
 epoch: 2, train_loss: 1.2151, test_loss: 1.3148, test_f1: 0.2983
 epoch: 3, train_loss: 1.1979, test_loss: 1.3014, test_f1: 0.3196
 epoch: 4, train_loss: 1.1827, test_loss: 1.2869, test_f1: 0.3274
 epoch: 5, train_loss: 1.1602, test_loss: 1.2725, test_f1: 0.3645
 epoch: 6, train_loss: 1.1520, test_loss: 1.2555, test_f1: 0.3709
 epoch: 7, train_loss: 1.1314, test_loss: 1.2575, test_f1: 0.3847
 epoch: 8, train_loss: 1.1244, test_loss: 1.2542, test_f1: 0.4241
 epoch: 9, train_loss: 1.1151, test_loss: 1.2518, test_f1: 0.4396
 epoch: 10, train_loss: 1.0994, test_loss: 1.2677, test_f1: 0.4467
 epoch: 11, train_loss: 1.0935, test_loss: 1.2562, test_f1: 0.4446
 epoch: 12, train_loss: 1.0806, test_loss: 1.2628, test_f1: 0.4374
 epoch: 13, train_loss: 1.0716, test_loss: 1.2576, test_f1: 0.4439
 epoch: 14, train_loss: 1.0655, test_loss: 1.2600, test_f1: 0.4559
 epoch: 15, train_loss: 1.0617, test_loss: 1.2471, test_f1: 0.4291
 epoch: 16, train_loss: 1.0453, test_loss: 1.2383, test_f1: 0.4225
 epoch: 17, train_loss: 1.0322, test_loss: 1.2427, test_f1: 0.4472
 epoch: 18, train_loss: 1.0209, test_loss: 1.2507, test_f1: 0.4556
 epoch: 19, train_loss: 1.0175, test_loss: 1.2572, test_f1: 0.4530
 epoch: 20, train_loss: 1.0120, test_loss: 1.2369, test_f1: 0.4677
 epoch: 21, train_loss: 1.0006, test_loss: 1.2462, test_f1: 0.4767
 epoch: 22, train_loss: 0.9831, test_loss: 1.2400, test_f1: 0.4783
 epoch: 23, train_loss: 0.9795, test_loss: 1.2428, test_f1: 0.4780
 epoch: 24, train_loss: 0.9722, test_loss: 1.2468, test_f1: 0.4833
 epoch: 25, train_loss: 0.9629, test_loss: 1.2258, test_f1: 0.4749
 epoch: 26, train_loss: 0.9511, test_loss: 1.2093, test_f1: 0.4670
 epoch: 27, train_loss: 0.9400, test_loss: 1.2440, test_f1: 0.4869
 epoch: 28, train_loss: 0.9381, test_loss: 1.2711, test_f1: 0.4997
 epoch: 29, train_loss: 0.9348, test_loss: 1.2504, test_f1: 0.4847
 epoch: 30, train_loss: 0.9188, test_loss: 1.2526, test_f1: 0.5040
 epoch: 31, train_loss: 0.9132, test_loss: 1.2559, test_f1: 0.5238
 epoch: 32, train_loss: 0.9068, test_loss: 1.2533, test_f1: 0.5218
 epoch: 33, train_loss: 0.8874, test_loss: 1.2678, test_f1: 0.5242
 epoch: 34, train_loss: 0.8791, test_loss: 1.2664, test_f1: 0.5278
 epoch: 35, train_loss: 0.8783, test_loss: 1.2741, test_f1: 0.5201
 epoch: 36, train_loss: 0.8637, test_loss: 1.2594, test_f1: 0.5179
 epoch: 37, train_loss: 0.8629, test_loss: 1.2742, test_f1: 0.5527
 epoch: 38, train_loss: 0.8518, test_loss: 1.2872, test_f1: 0.5936
 epoch: 39, train_loss: 0.8306, test_loss: 1.3709, test_f1: 0.5861
 epoch: 40, train_loss: 0.8341, test_loss: 1.4165, test_f1: 0.5873
 epoch: 41, train_loss: 0.8285, test_loss: 1.3689, test_f1: 0.5603
 epoch: 42, train_loss: 0.8228, test_loss: 1.3388, test_f1: 0.5575
 epoch: 43, train_loss: 0.8027, test_loss: 1.3207, test_f1: 0.5818
 epoch: 44, train_loss: 0.7969, test_loss: 1.3671, test_f1: 0.5952
 epoch: 45, train_loss: 0.7821, test_loss: 1.3834, test_f1: 0.5774
 epoch: 46, train_loss: 0.7894, test_loss: 1.4091, test_f1: 0.5804
 epoch: 47, train_loss: 0.7753, test_loss: 1.3827, test_f1: 0.5899
 epoch: 48, train_loss: 0.7694, test_loss: 1.3798, test_f1: 0.5901
 epoch: 49, train_loss: 0.7443, test_loss: 1.3576, test_f1: 0.5990
 epoch: 50, train_loss: 0.7556, test_loss: 1.4016, test_f1: 0.5929
 epoch: 51, train_loss: 0.7461, test_loss: 1.4023, test_f1: 0.5782
 epoch: 52, train_loss: 0.7362, test_loss: 1.3935, test_f1: 0.5987
 epoch: 53, train_loss: 0.7395, test_loss: 1.4072, test_f1: 0.5893
 epoch: 54, train_loss: 0.7278, test_loss: 1.4025, test_f1: 0.5689
 epoch: 55, train_loss: 0.7148, test_loss: 1.3945, test_f1: 0.5660
 epoch: 56, train_loss: 0.7273, test_loss: 1.3885, test_f1: 0.5834
 epoch: 57, train_loss: 0.7138, test_loss: 1.3943, test_f1: 0.5911
 epoch: 58, train_loss: 0.6970, test_loss: 1.4390, test_f1: 0.5941
 epoch: 59, train_loss: 0.7093, test_loss: 1.4791, test_f1: 0.5976
 epoch: 60, train_loss: 0.6974, test_loss: 1.5179, test_f1: 0.5782
 epoch: 61, train_loss: 0.6856, test_loss: 1.5022, test_f1: 0.5639
 epoch: 62, train_loss: 0.6861, test_loss: 1.4308, test_f1: 0.5730
 epoch: 63, train_loss: 0.6965, test_loss: 1.4422, test_f1: 0.6023
 epoch: 64, train_loss: 0.6870, test_loss: 1.4571, test_f1: 0.6247
 epoch: 65, train_loss: 0.6865, test_loss: 1.4498, test_f1: 0.6169
 epoch: 66, train_loss: 0.6772, test_loss: 1.4491, test_f1: 0.6033
 epoch: 67, train_loss: 0.6732, test_loss: 1.4991, test_f1: 0.6026
 epoch: 68, train_loss: 0.6709, test_loss: 1.5061, test_f1: 0.6085
 epoch: 69, train_loss: 0.6600, test_loss: 1.5373, test_f1: 0.5926
 epoch: 70, train_loss: 0.6656, test_loss: 1.5645, test_f1: 0.5858
 epoch: 71, train_loss: 0.6458, test_loss: 1.5344, test_f1: 0.5990
 epoch: 72, train_loss: 0.6555, test_loss: 1.4965, test_f1: 0.6155
 epoch: 73, train_loss: 0.6528, test_loss: 1.5487, test_f1: 0.5942
 epoch: 74, train_loss: 0.6339, test_loss: 1.5149, test_f1: 0.5830
 epoch: 75, train_loss: 0.6393, test_loss: 1.5097, test_f1: 0.5852
 epoch: 76, train_loss: 0.6347, test_loss: 1.5314, test_f1: 0.5924
 epoch: 77, train_loss: 0.6432, test_loss: 1.5205, test_f1: 0.5973
 epoch: 78, train_loss: 0.6316, test_loss: 1.5179, test_f1: 0.6060
 epoch: 79, train_loss: 0.6446, test_loss: 1.5416, test_f1: 0.5838
 epoch: 80, train_loss: 0.6368, test_loss: 1.5336, test_f1: 0.5849
 epoch: 81, train_loss: 0.6334, test_loss: 1.5418, test_f1: 0.5746
 epoch: 82, train_loss: 0.6158, test_loss: 1.5246, test_f1: 0.5952
 epoch: 83, train_loss: 0.6202, test_loss: 1.5113, test_f1: 0.6113
 epoch: 84, train_loss: 0.6264, test_loss: 1.5561, test_f1: 0.6213
 epoch: 85, train_loss: 0.6066, test_loss: 1.5394, test_f1: 0.6023
 epoch: 86, train_loss: 0.6081, test_loss: 1.4709, test_f1: 0.6073
 epoch: 87, train_loss: 0.6007, test_loss: 1.5171, test_f1: 0.5975
 epoch: 88, train_loss: 0.6026, test_loss: 1.5287, test_f1: 0.5920
 epoch: 89, train_loss: 0.6004, test_loss: 1.5439, test_f1: 0.5911
 epoch: 90, train_loss: 0.5785, test_loss: 1.5446, test_f1: 0.5888
 epoch: 91, train_loss: 0.5779, test_loss: 1.5431, test_f1: 0.5885
 epoch: 92, train_loss: 0.5939, test_loss: 1.5384, test_f1: 0.5968
 epoch: 93, train_loss: 0.5960, test_loss: 1.5516, test_f1: 0.5833
 epoch: 94, train_loss: 0.5738, test_loss: 1.5301, test_f1: 0.5768
 epoch: 95, train_loss: 0.5926, test_loss: 1.5375, test_f1: 0.5654
 epoch: 96, train_loss: 0.5791, test_loss: 1.5547, test_f1: 0.5896
 epoch: 97, train_loss: 0.5858, test_loss: 1.5817, test_f1: 0.5842
 epoch: 98, train_loss: 0.5724, test_loss: 1.5956, test_f1: 0.5957
 epoch: 99, train_loss: 0.5813, test_loss: 1.5993, test_f1: 0.6032
##################ITERATION #4 ****************************************
 epoch: 0, train_loss: 1.3048, test_loss: 1.3535, test_f1: 0.1365
 epoch: 1, train_loss: 1.2381, test_loss: 1.3413, test_f1: 0.2361
 epoch: 2, train_loss: 1.2161, test_loss: 1.3289, test_f1: 0.3443
 epoch: 3, train_loss: 1.1954, test_loss: 1.3240, test_f1: 0.3042
 epoch: 4, train_loss: 1.1799, test_loss: 1.3128, test_f1: 0.2808
 epoch: 5, train_loss: 1.1686, test_loss: 1.3047, test_f1: 0.2948
 epoch: 6, train_loss: 1.1551, test_loss: 1.2864, test_f1: 0.3382
 epoch: 7, train_loss: 1.1430, test_loss: 1.2790, test_f1: 0.3519
 epoch: 8, train_loss: 1.1321, test_loss: 1.2930, test_f1: 0.3600
 epoch: 9, train_loss: 1.1183, test_loss: 1.2703, test_f1: 0.3584
 epoch: 10, train_loss: 1.1120, test_loss: 1.2790, test_f1: 0.3641
 epoch: 11, train_loss: 1.1085, test_loss: 1.2521, test_f1: 0.3962
 epoch: 12, train_loss: 1.0900, test_loss: 1.2648, test_f1: 0.4089
 epoch: 13, train_loss: 1.0831, test_loss: 1.2810, test_f1: 0.4236
 epoch: 14, train_loss: 1.0763, test_loss: 1.2794, test_f1: 0.4269
 epoch: 15, train_loss: 1.0617, test_loss: 1.2573, test_f1: 0.4445
 epoch: 16, train_loss: 1.0468, test_loss: 1.2416, test_f1: 0.4406
 epoch: 17, train_loss: 1.0374, test_loss: 1.2516, test_f1: 0.4341
 epoch: 18, train_loss: 1.0288, test_loss: 1.2934, test_f1: 0.4318
 epoch: 19, train_loss: 1.0239, test_loss: 1.2664, test_f1: 0.4415
 epoch: 20, train_loss: 1.0137, test_loss: 1.2624, test_f1: 0.4429
 epoch: 21, train_loss: 0.9916, test_loss: 1.2869, test_f1: 0.4626
 epoch: 22, train_loss: 0.9945, test_loss: 1.2854, test_f1: 0.4721
 epoch: 23, train_loss: 0.9800, test_loss: 1.2689, test_f1: 0.4875
 epoch: 24, train_loss: 0.9709, test_loss: 1.2731, test_f1: 0.4892
 epoch: 25, train_loss: 0.9546, test_loss: 1.2411, test_f1: 0.4968
 epoch: 26, train_loss: 0.9549, test_loss: 1.2381, test_f1: 0.4983
 epoch: 27, train_loss: 0.9439, test_loss: 1.2375, test_f1: 0.5060
 epoch: 28, train_loss: 0.9352, test_loss: 1.2018, test_f1: 0.5127
 epoch: 29, train_loss: 0.9235, test_loss: 1.2027, test_f1: 0.4961
 epoch: 30, train_loss: 0.9275, test_loss: 1.2001, test_f1: 0.5112
 epoch: 31, train_loss: 0.9212, test_loss: 1.2090, test_f1: 0.5224
 epoch: 32, train_loss: 0.9010, test_loss: 1.1997, test_f1: 0.5129
 epoch: 33, train_loss: 0.8995, test_loss: 1.1931, test_f1: 0.5015
 epoch: 34, train_loss: 0.9006, test_loss: 1.2177, test_f1: 0.5157
 epoch: 35, train_loss: 0.8861, test_loss: 1.2402, test_f1: 0.5144
 epoch: 36, train_loss: 0.8939, test_loss: 1.2370, test_f1: 0.5168
 epoch: 37, train_loss: 0.8601, test_loss: 1.2177, test_f1: 0.5111
 epoch: 38, train_loss: 0.8724, test_loss: 1.2007, test_f1: 0.5154
 epoch: 39, train_loss: 0.8613, test_loss: 1.2184, test_f1: 0.5124
 epoch: 40, train_loss: 0.8583, test_loss: 1.2353, test_f1: 0.5145
 epoch: 41, train_loss: 0.8463, test_loss: 1.2499, test_f1: 0.5235
 epoch: 42, train_loss: 0.8502, test_loss: 1.2550, test_f1: 0.5208
 epoch: 43, train_loss: 0.8277, test_loss: 1.2609, test_f1: 0.5246
 epoch: 44, train_loss: 0.8245, test_loss: 1.2640, test_f1: 0.5293
 epoch: 45, train_loss: 0.8054, test_loss: 1.2513, test_f1: 0.5192
 epoch: 46, train_loss: 0.8039, test_loss: 1.2382, test_f1: 0.5317
 epoch: 47, train_loss: 0.8089, test_loss: 1.2371, test_f1: 0.5297
 epoch: 48, train_loss: 0.7996, test_loss: 1.2450, test_f1: 0.5283
 epoch: 49, train_loss: 0.7858, test_loss: 1.2570, test_f1: 0.5304
 epoch: 50, train_loss: 0.7942, test_loss: 1.2812, test_f1: 0.5275
 epoch: 51, train_loss: 0.7834, test_loss: 1.2668, test_f1: 0.5476
 epoch: 52, train_loss: 0.7771, test_loss: 1.2688, test_f1: 0.5398
 epoch: 53, train_loss: 0.7675, test_loss: 1.2762, test_f1: 0.5431
 epoch: 54, train_loss: 0.7569, test_loss: 1.2655, test_f1: 0.5475
 epoch: 55, train_loss: 0.7582, test_loss: 1.2658, test_f1: 0.5430
 epoch: 56, train_loss: 0.7495, test_loss: 1.2806, test_f1: 0.5252
 epoch: 57, train_loss: 0.7549, test_loss: 1.3026, test_f1: 0.5307
 epoch: 58, train_loss: 0.7659, test_loss: 1.3137, test_f1: 0.5259
 epoch: 59, train_loss: 0.7536, test_loss: 1.3267, test_f1: 0.5055
 epoch: 60, train_loss: 0.7398, test_loss: 1.3423, test_f1: 0.5187
 epoch: 61, train_loss: 0.7421, test_loss: 1.3661, test_f1: 0.5085
 epoch: 62, train_loss: 0.7298, test_loss: 1.3774, test_f1: 0.5146
 epoch: 63, train_loss: 0.7355, test_loss: 1.3725, test_f1: 0.5182
 epoch: 64, train_loss: 0.7277, test_loss: 1.3541, test_f1: 0.5108
 epoch: 65, train_loss: 0.7301, test_loss: 1.3551, test_f1: 0.5099
 epoch: 66, train_loss: 0.7339, test_loss: 1.3715, test_f1: 0.5268
 epoch: 67, train_loss: 0.7077, test_loss: 1.3622, test_f1: 0.5279
 epoch: 68, train_loss: 0.7149, test_loss: 1.3610, test_f1: 0.5164
 epoch: 69, train_loss: 0.6973, test_loss: 1.3588, test_f1: 0.5178
 epoch: 70, train_loss: 0.6918, test_loss: 1.3715, test_f1: 0.5180
 epoch: 71, train_loss: 0.7114, test_loss: 1.4020, test_f1: 0.5198
 epoch: 72, train_loss: 0.6890, test_loss: 1.3975, test_f1: 0.5287
 epoch: 73, train_loss: 0.6935, test_loss: 1.4229, test_f1: 0.5262
 epoch: 74, train_loss: 0.6986, test_loss: 1.4643, test_f1: 0.5148
 epoch: 75, train_loss: 0.7001, test_loss: 1.4691, test_f1: 0.5273
 epoch: 76, train_loss: 0.7046, test_loss: 1.4578, test_f1: 0.5450
 epoch: 77, train_loss: 0.7083, test_loss: 1.4686, test_f1: 0.5251
 epoch: 78, train_loss: 0.6941, test_loss: 1.4378, test_f1: 0.5096
 epoch: 79, train_loss: 0.6799, test_loss: 1.4491, test_f1: 0.5130
 epoch: 80, train_loss: 0.6876, test_loss: 1.4612, test_f1: 0.5051
 epoch: 81, train_loss: 0.6821, test_loss: 1.4795, test_f1: 0.5034
 epoch: 82, train_loss: 0.6790, test_loss: 1.4934, test_f1: 0.5024
 epoch: 83, train_loss: 0.6839, test_loss: 1.4906, test_f1: 0.5220
 epoch: 84, train_loss: 0.6667, test_loss: 1.4990, test_f1: 0.5261
 epoch: 85, train_loss: 0.6604, test_loss: 1.4836, test_f1: 0.5194
 epoch: 86, train_loss: 0.6666, test_loss: 1.4912, test_f1: 0.5114
 epoch: 87, train_loss: 0.6509, test_loss: 1.4859, test_f1: 0.5126
 epoch: 88, train_loss: 0.6544, test_loss: 1.5192, test_f1: 0.4924
 epoch: 89, train_loss: 0.6575, test_loss: 1.5323, test_f1: 0.4955
 epoch: 90, train_loss: 0.6604, test_loss: 1.5306, test_f1: 0.5008
 epoch: 91, train_loss: 0.6634, test_loss: 1.4932, test_f1: 0.5089
 epoch: 92, train_loss: 0.6574, test_loss: 1.5176, test_f1: 0.5059
 epoch: 93, train_loss: 0.6498, test_loss: 1.5386, test_f1: 0.5250
 epoch: 94, train_loss: 0.6306, test_loss: 1.5372, test_f1: 0.5319
 epoch: 95, train_loss: 0.6325, test_loss: 1.5746, test_f1: 0.5163
 epoch: 96, train_loss: 0.6213, test_loss: 1.5420, test_f1: 0.5291
 epoch: 97, train_loss: 0.6318, test_loss: 1.5827, test_f1: 0.5233
 epoch: 98, train_loss: 0.6111, test_loss: 1.6073, test_f1: 0.5155
 epoch: 99, train_loss: 0.6323, test_loss: 1.6480, test_f1: 0.5056
##################ITERATION #5 ****************************************
 epoch: 0, train_loss: 1.2880, test_loss: 1.3332, test_f1: 0.2378
 epoch: 1, train_loss: 1.2162, test_loss: 1.3228, test_f1: 0.3015
 epoch: 2, train_loss: 1.1844, test_loss: 1.3163, test_f1: 0.2847
 epoch: 3, train_loss: 1.1681, test_loss: 1.3073, test_f1: 0.2819
 epoch: 4, train_loss: 1.1571, test_loss: 1.2893, test_f1: 0.2969
 epoch: 5, train_loss: 1.1429, test_loss: 1.2932, test_f1: 0.3471
 epoch: 6, train_loss: 1.1225, test_loss: 1.2924, test_f1: 0.3886
 epoch: 7, train_loss: 1.1235, test_loss: 1.2895, test_f1: 0.4091
 epoch: 8, train_loss: 1.1018, test_loss: 1.2748, test_f1: 0.4376
 epoch: 9, train_loss: 1.0877, test_loss: 1.2650, test_f1: 0.4421
 epoch: 10, train_loss: 1.0701, test_loss: 1.2383, test_f1: 0.4473
 epoch: 11, train_loss: 1.0735, test_loss: 1.2194, test_f1: 0.4619
 epoch: 12, train_loss: 1.0605, test_loss: 1.2103, test_f1: 0.4796
 epoch: 13, train_loss: 1.0479, test_loss: 1.2119, test_f1: 0.4691
 epoch: 14, train_loss: 1.0351, test_loss: 1.2167, test_f1: 0.4515
 epoch: 15, train_loss: 1.0323, test_loss: 1.2213, test_f1: 0.4684
 epoch: 16, train_loss: 1.0278, test_loss: 1.2222, test_f1: 0.4634
 epoch: 17, train_loss: 1.0147, test_loss: 1.2358, test_f1: 0.4876
 epoch: 18, train_loss: 1.0030, test_loss: 1.2259, test_f1: 0.4854
 epoch: 19, train_loss: 1.0029, test_loss: 1.2291, test_f1: 0.4789
 epoch: 20, train_loss: 0.9912, test_loss: 1.2299, test_f1: 0.4642
 epoch: 21, train_loss: 0.9732, test_loss: 1.2501, test_f1: 0.4801
 epoch: 22, train_loss: 0.9633, test_loss: 1.2454, test_f1: 0.4941
 epoch: 23, train_loss: 0.9662, test_loss: 1.2377, test_f1: 0.4886
 epoch: 24, train_loss: 0.9642, test_loss: 1.2311, test_f1: 0.4851
 epoch: 25, train_loss: 0.9520, test_loss: 1.2437, test_f1: 0.4571
 epoch: 26, train_loss: 0.9498, test_loss: 1.2554, test_f1: 0.4817
 epoch: 27, train_loss: 0.9404, test_loss: 1.2393, test_f1: 0.4995
 epoch: 28, train_loss: 0.9283, test_loss: 1.2287, test_f1: 0.5133
 epoch: 29, train_loss: 0.9228, test_loss: 1.2338, test_f1: 0.5014
 epoch: 30, train_loss: 0.9144, test_loss: 1.2450, test_f1: 0.4964
 epoch: 31, train_loss: 0.9144, test_loss: 1.2584, test_f1: 0.4994
 epoch: 32, train_loss: 0.8982, test_loss: 1.2327, test_f1: 0.5100
 epoch: 33, train_loss: 0.8902, test_loss: 1.2270, test_f1: 0.5366
 epoch: 34, train_loss: 0.8905, test_loss: 1.2375, test_f1: 0.5168
 epoch: 35, train_loss: 0.8788, test_loss: 1.2478, test_f1: 0.5253
 epoch: 36, train_loss: 0.8769, test_loss: 1.2577, test_f1: 0.5347
 epoch: 37, train_loss: 0.8737, test_loss: 1.2599, test_f1: 0.5190
 epoch: 38, train_loss: 0.8699, test_loss: 1.2607, test_f1: 0.5302
 epoch: 39, train_loss: 0.8454, test_loss: 1.2904, test_f1: 0.5378
 epoch: 40, train_loss: 0.8510, test_loss: 1.2834, test_f1: 0.5251
 epoch: 41, train_loss: 0.8406, test_loss: 1.2805, test_f1: 0.5549
 epoch: 42, train_loss: 0.8267, test_loss: 1.2827, test_f1: 0.5412
 epoch: 43, train_loss: 0.8316, test_loss: 1.2745, test_f1: 0.5361
 epoch: 44, train_loss: 0.8111, test_loss: 1.2684, test_f1: 0.5477
 epoch: 45, train_loss: 0.8110, test_loss: 1.3084, test_f1: 0.5199
 epoch: 46, train_loss: 0.8084, test_loss: 1.3480, test_f1: 0.5104
 epoch: 47, train_loss: 0.7942, test_loss: 1.3302, test_f1: 0.4999
 epoch: 48, train_loss: 0.7932, test_loss: 1.3149, test_f1: 0.5125
 epoch: 49, train_loss: 0.7971, test_loss: 1.3187, test_f1: 0.5349
 epoch: 50, train_loss: 0.7821, test_loss: 1.3363, test_f1: 0.5202
 epoch: 51, train_loss: 0.7835, test_loss: 1.3116, test_f1: 0.5271
 epoch: 52, train_loss: 0.7713, test_loss: 1.3154, test_f1: 0.5219
 epoch: 53, train_loss: 0.7772, test_loss: 1.3042, test_f1: 0.5701
 epoch: 54, train_loss: 0.7768, test_loss: 1.3218, test_f1: 0.5606
 epoch: 55, train_loss: 0.7516, test_loss: 1.3307, test_f1: 0.5452
 epoch: 56, train_loss: 0.7729, test_loss: 1.3471, test_f1: 0.5402
 epoch: 57, train_loss: 0.7457, test_loss: 1.3649, test_f1: 0.5420
 epoch: 58, train_loss: 0.7534, test_loss: 1.3603, test_f1: 0.5281
 epoch: 59, train_loss: 0.7522, test_loss: 1.3808, test_f1: 0.5434
 epoch: 60, train_loss: 0.7424, test_loss: 1.3749, test_f1: 0.5635
 epoch: 61, train_loss: 0.7398, test_loss: 1.3817, test_f1: 0.5501
 epoch: 62, train_loss: 0.7410, test_loss: 1.3920, test_f1: 0.5319
 epoch: 63, train_loss: 0.7354, test_loss: 1.3987, test_f1: 0.5332
 epoch: 64, train_loss: 0.7320, test_loss: 1.3981, test_f1: 0.5492
 epoch: 65, train_loss: 0.7295, test_loss: 1.3998, test_f1: 0.5387
 epoch: 66, train_loss: 0.7199, test_loss: 1.4065, test_f1: 0.5554
 epoch: 67, train_loss: 0.7316, test_loss: 1.3803, test_f1: 0.5399
 epoch: 68, train_loss: 0.7314, test_loss: 1.3728, test_f1: 0.5317
 epoch: 69, train_loss: 0.7100, test_loss: 1.3812, test_f1: 0.5445
 epoch: 70, train_loss: 0.7218, test_loss: 1.4087, test_f1: 0.5600
 epoch: 71, train_loss: 0.7072, test_loss: 1.4131, test_f1: 0.5449
 epoch: 72, train_loss: 0.6981, test_loss: 1.4063, test_f1: 0.5219
 epoch: 73, train_loss: 0.6969, test_loss: 1.4068, test_f1: 0.5621
 epoch: 74, train_loss: 0.6957, test_loss: 1.3884, test_f1: 0.5552
 epoch: 75, train_loss: 0.7009, test_loss: 1.3958, test_f1: 0.5784
 epoch: 76, train_loss: 0.6868, test_loss: 1.3572, test_f1: 0.5759
 epoch: 77, train_loss: 0.6883, test_loss: 1.3489, test_f1: 0.5641
 epoch: 78, train_loss: 0.6900, test_loss: 1.3903, test_f1: 0.5543
 epoch: 79, train_loss: 0.6932, test_loss: 1.4225, test_f1: 0.5521
 epoch: 80, train_loss: 0.6804, test_loss: 1.4057, test_f1: 0.5559
 epoch: 81, train_loss: 0.6870, test_loss: 1.4061, test_f1: 0.5490
 epoch: 82, train_loss: 0.6812, test_loss: 1.4107, test_f1: 0.5367
 epoch: 83, train_loss: 0.6777, test_loss: 1.4760, test_f1: 0.5247
 epoch: 84, train_loss: 0.6804, test_loss: 1.4944, test_f1: 0.5456
 epoch: 85, train_loss: 0.6648, test_loss: 1.4951, test_f1: 0.5678
 epoch: 86, train_loss: 0.6752, test_loss: 1.5022, test_f1: 0.5319
 epoch: 87, train_loss: 0.6644, test_loss: 1.5036, test_f1: 0.5337
 epoch: 88, train_loss: 0.6740, test_loss: 1.5100, test_f1: 0.5406
 epoch: 89, train_loss: 0.6668, test_loss: 1.5018, test_f1: 0.5411
 epoch: 90, train_loss: 0.6588, test_loss: 1.5253, test_f1: 0.5281
 epoch: 91, train_loss: 0.6389, test_loss: 1.5212, test_f1: 0.5258
 epoch: 92, train_loss: 0.6633, test_loss: 1.5082, test_f1: 0.5386
 epoch: 93, train_loss: 0.6419, test_loss: 1.5163, test_f1: 0.5287
 epoch: 94, train_loss: 0.6460, test_loss: 1.5032, test_f1: 0.5300
 epoch: 95, train_loss: 0.6548, test_loss: 1.4957, test_f1: 0.5236
 epoch: 96, train_loss: 0.6490, test_loss: 1.5167, test_f1: 0.5422
 epoch: 97, train_loss: 0.6382, test_loss: 1.4948, test_f1: 0.5421
 epoch: 98, train_loss: 0.6504, test_loss: 1.5147, test_f1: 0.5369
 epoch: 99, train_loss: 0.6414, test_loss: 1.4972, test_f1: 0.5255
##################ITERATION #6 ****************************************
 epoch: 0, train_loss: 1.2834, test_loss: 1.3707, test_f1: 0.1365
 epoch: 1, train_loss: 1.2159, test_loss: 1.3439, test_f1: 0.3049
 epoch: 2, train_loss: 1.1844, test_loss: 1.3212, test_f1: 0.3369
 epoch: 3, train_loss: 1.1708, test_loss: 1.3055, test_f1: 0.3327
 epoch: 4, train_loss: 1.1489, test_loss: 1.2979, test_f1: 0.3422
 epoch: 5, train_loss: 1.1327, test_loss: 1.3012, test_f1: 0.3590
 epoch: 6, train_loss: 1.1130, test_loss: 1.2951, test_f1: 0.4198
 epoch: 7, train_loss: 1.1038, test_loss: 1.2962, test_f1: 0.4372
 epoch: 8, train_loss: 1.0831, test_loss: 1.3225, test_f1: 0.4599
 epoch: 9, train_loss: 1.0816, test_loss: 1.3192, test_f1: 0.4621
 epoch: 10, train_loss: 1.0764, test_loss: 1.3079, test_f1: 0.4636
 epoch: 11, train_loss: 1.0645, test_loss: 1.2921, test_f1: 0.4725
 epoch: 12, train_loss: 1.0517, test_loss: 1.2862, test_f1: 0.4824
 epoch: 13, train_loss: 1.0431, test_loss: 1.2752, test_f1: 0.4846
 epoch: 14, train_loss: 1.0377, test_loss: 1.2599, test_f1: 0.4696
 epoch: 15, train_loss: 1.0229, test_loss: 1.2643, test_f1: 0.4715
 epoch: 16, train_loss: 1.0143, test_loss: 1.2995, test_f1: 0.4811
 epoch: 17, train_loss: 1.0041, test_loss: 1.3187, test_f1: 0.4802
 epoch: 18, train_loss: 0.9959, test_loss: 1.3337, test_f1: 0.4909
 epoch: 19, train_loss: 0.9898, test_loss: 1.3190, test_f1: 0.5040
 epoch: 20, train_loss: 0.9736, test_loss: 1.3018, test_f1: 0.4992
 epoch: 21, train_loss: 0.9729, test_loss: 1.2852, test_f1: 0.5180
 epoch: 22, train_loss: 0.9692, test_loss: 1.3015, test_f1: 0.5087
 epoch: 23, train_loss: 0.9570, test_loss: 1.3401, test_f1: 0.5317
 epoch: 24, train_loss: 0.9413, test_loss: 1.3669, test_f1: 0.5152
 epoch: 25, train_loss: 0.9479, test_loss: 1.3402, test_f1: 0.5229
 epoch: 26, train_loss: 0.9276, test_loss: 1.3393, test_f1: 0.5238
 epoch: 27, train_loss: 0.9325, test_loss: 1.3453, test_f1: 0.5383
 epoch: 28, train_loss: 0.9120, test_loss: 1.3181, test_f1: 0.5291
 epoch: 29, train_loss: 0.9168, test_loss: 1.3237, test_f1: 0.5209
 epoch: 30, train_loss: 0.8959, test_loss: 1.3332, test_f1: 0.5385
 epoch: 31, train_loss: 0.8928, test_loss: 1.3447, test_f1: 0.5464
 epoch: 32, train_loss: 0.8782, test_loss: 1.3203, test_f1: 0.5497
 epoch: 33, train_loss: 0.8787, test_loss: 1.2926, test_f1: 0.5570
 epoch: 34, train_loss: 0.8637, test_loss: 1.3124, test_f1: 0.5525
 epoch: 35, train_loss: 0.8702, test_loss: 1.3431, test_f1: 0.5645
 epoch: 36, train_loss: 0.8517, test_loss: 1.3525, test_f1: 0.5523
 epoch: 37, train_loss: 0.8659, test_loss: 1.3861, test_f1: 0.5541
 epoch: 38, train_loss: 0.8567, test_loss: 1.3703, test_f1: 0.5395
 epoch: 39, train_loss: 0.8492, test_loss: 1.3200, test_f1: 0.5350
 epoch: 40, train_loss: 0.8421, test_loss: 1.3417, test_f1: 0.5548
 epoch: 41, train_loss: 0.8175, test_loss: 1.3815, test_f1: 0.5581
 epoch: 42, train_loss: 0.8217, test_loss: 1.3613, test_f1: 0.5577
 epoch: 43, train_loss: 0.8154, test_loss: 1.3692, test_f1: 0.5513
 epoch: 44, train_loss: 0.8067, test_loss: 1.3932, test_f1: 0.5375
 epoch: 45, train_loss: 0.7960, test_loss: 1.4117, test_f1: 0.5385
 epoch: 46, train_loss: 0.8044, test_loss: 1.4460, test_f1: 0.5400
 epoch: 47, train_loss: 0.7817, test_loss: 1.4587, test_f1: 0.5517
 epoch: 48, train_loss: 0.7821, test_loss: 1.4769, test_f1: 0.5359
 epoch: 49, train_loss: 0.7848, test_loss: 1.4709, test_f1: 0.5402
 epoch: 50, train_loss: 0.7802, test_loss: 1.4572, test_f1: 0.5483
 epoch: 51, train_loss: 0.7634, test_loss: 1.4647, test_f1: 0.5439
 epoch: 52, train_loss: 0.7524, test_loss: 1.4779, test_f1: 0.5498
 epoch: 53, train_loss: 0.7531, test_loss: 1.4620, test_f1: 0.5491
 epoch: 54, train_loss: 0.7356, test_loss: 1.5023, test_f1: 0.5544
 epoch: 55, train_loss: 0.7366, test_loss: 1.5432, test_f1: 0.5514
 epoch: 56, train_loss: 0.7323, test_loss: 1.5232, test_f1: 0.5501
 epoch: 57, train_loss: 0.7276, test_loss: 1.5311, test_f1: 0.5548
 epoch: 58, train_loss: 0.7340, test_loss: 1.5533, test_f1: 0.5482
 epoch: 59, train_loss: 0.7408, test_loss: 1.5316, test_f1: 0.5488
 epoch: 60, train_loss: 0.7110, test_loss: 1.5306, test_f1: 0.5459
 epoch: 61, train_loss: 0.7192, test_loss: 1.5381, test_f1: 0.5389
 epoch: 62, train_loss: 0.7156, test_loss: 1.5373, test_f1: 0.5570
 epoch: 63, train_loss: 0.7094, test_loss: 1.5427, test_f1: 0.5549
 epoch: 64, train_loss: 0.7193, test_loss: 1.5548, test_f1: 0.5547
 epoch: 65, train_loss: 0.6980, test_loss: 1.5721, test_f1: 0.5466
 epoch: 66, train_loss: 0.6962, test_loss: 1.5671, test_f1: 0.5387
 epoch: 67, train_loss: 0.6915, test_loss: 1.5397, test_f1: 0.5465
 epoch: 68, train_loss: 0.7055, test_loss: 1.5374, test_f1: 0.5436
 epoch: 69, train_loss: 0.6905, test_loss: 1.5452, test_f1: 0.5305
 epoch: 70, train_loss: 0.6878, test_loss: 1.5739, test_f1: 0.5140
 epoch: 71, train_loss: 0.6702, test_loss: 1.5881, test_f1: 0.5075
 epoch: 72, train_loss: 0.6947, test_loss: 1.6065, test_f1: 0.5220
 epoch: 73, train_loss: 0.6807, test_loss: 1.6324, test_f1: 0.5140
 epoch: 74, train_loss: 0.6756, test_loss: 1.6360, test_f1: 0.5165
 epoch: 75, train_loss: 0.6786, test_loss: 1.6914, test_f1: 0.5113
 epoch: 76, train_loss: 0.6994, test_loss: 1.6928, test_f1: 0.5111
 epoch: 77, train_loss: 0.6891, test_loss: 1.7119, test_f1: 0.5191
 epoch: 78, train_loss: 0.6739, test_loss: 1.6612, test_f1: 0.5431
 epoch: 79, train_loss: 0.6609, test_loss: 1.6416, test_f1: 0.5445
 epoch: 80, train_loss: 0.6603, test_loss: 1.6225, test_f1: 0.5488
 epoch: 81, train_loss: 0.6797, test_loss: 1.5570, test_f1: 0.5489
 epoch: 82, train_loss: 0.6496, test_loss: 1.6288, test_f1: 0.5350
 epoch: 83, train_loss: 0.6525, test_loss: 1.6239, test_f1: 0.5289
 epoch: 84, train_loss: 0.6559, test_loss: 1.6652, test_f1: 0.5394
 epoch: 85, train_loss: 0.6384, test_loss: 1.6699, test_f1: 0.5248
 epoch: 86, train_loss: 0.6434, test_loss: 1.6923, test_f1: 0.5215
 epoch: 87, train_loss: 0.6465, test_loss: 1.6500, test_f1: 0.5536
 epoch: 88, train_loss: 0.6445, test_loss: 1.6440, test_f1: 0.5686
 epoch: 89, train_loss: 0.6458, test_loss: 1.6337, test_f1: 0.5565
 epoch: 90, train_loss: 0.6297, test_loss: 1.6435, test_f1: 0.5497
 epoch: 91, train_loss: 0.6287, test_loss: 1.6873, test_f1: 0.5374
 epoch: 92, train_loss: 0.6289, test_loss: 1.7102, test_f1: 0.5372
 epoch: 93, train_loss: 0.6161, test_loss: 1.7734, test_f1: 0.5418
 epoch: 94, train_loss: 0.6242, test_loss: 1.7370, test_f1: 0.5484
 epoch: 95, train_loss: 0.6125, test_loss: 1.7164, test_f1: 0.5345
 epoch: 96, train_loss: 0.6314, test_loss: 1.7333, test_f1: 0.5489
 epoch: 97, train_loss: 0.6180, test_loss: 1.7322, test_f1: 0.5382
 epoch: 98, train_loss: 0.6145, test_loss: 1.7816, test_f1: 0.5332
 epoch: 99, train_loss: 0.6077, test_loss: 1.8210, test_f1: 0.5439
##################ITERATION #7 ****************************************
 epoch: 0, train_loss: 1.2952, test_loss: 1.3344, test_f1: 0.1738
 epoch: 1, train_loss: 1.2130, test_loss: 1.3225, test_f1: 0.3046
 epoch: 2, train_loss: 1.2030, test_loss: 1.3158, test_f1: 0.3410
 epoch: 3, train_loss: 1.1818, test_loss: 1.3076, test_f1: 0.3427
 epoch: 4, train_loss: 1.1628, test_loss: 1.2903, test_f1: 0.3428
 epoch: 5, train_loss: 1.1468, test_loss: 1.2687, test_f1: 0.3495
 epoch: 6, train_loss: 1.1364, test_loss: 1.2569, test_f1: 0.3679
 epoch: 7, train_loss: 1.1265, test_loss: 1.2570, test_f1: 0.3846
 epoch: 8, train_loss: 1.1101, test_loss: 1.2572, test_f1: 0.4096
 epoch: 9, train_loss: 1.1022, test_loss: 1.2344, test_f1: 0.4219
 epoch: 10, train_loss: 1.0911, test_loss: 1.2236, test_f1: 0.4451
 epoch: 11, train_loss: 1.0795, test_loss: 1.2101, test_f1: 0.4478
 epoch: 12, train_loss: 1.0717, test_loss: 1.2069, test_f1: 0.4565
 epoch: 13, train_loss: 1.0656, test_loss: 1.2014, test_f1: 0.4721
 epoch: 14, train_loss: 1.0440, test_loss: 1.1942, test_f1: 0.4747
 epoch: 15, train_loss: 1.0393, test_loss: 1.1849, test_f1: 0.4836
 epoch: 16, train_loss: 1.0161, test_loss: 1.1734, test_f1: 0.4839
 epoch: 17, train_loss: 1.0146, test_loss: 1.1628, test_f1: 0.4706
 epoch: 18, train_loss: 1.0083, test_loss: 1.1614, test_f1: 0.4870
 epoch: 19, train_loss: 1.0027, test_loss: 1.1531, test_f1: 0.4989
 epoch: 20, train_loss: 0.9940, test_loss: 1.1550, test_f1: 0.5171
 epoch: 21, train_loss: 0.9902, test_loss: 1.1466, test_f1: 0.5304
 epoch: 22, train_loss: 0.9608, test_loss: 1.1466, test_f1: 0.5245
 epoch: 23, train_loss: 0.9753, test_loss: 1.1466, test_f1: 0.5137
 epoch: 24, train_loss: 0.9546, test_loss: 1.1462, test_f1: 0.5271
 epoch: 25, train_loss: 0.9450, test_loss: 1.1560, test_f1: 0.5463
 epoch: 26, train_loss: 0.9383, test_loss: 1.1566, test_f1: 0.5459
 epoch: 27, train_loss: 0.9295, test_loss: 1.1612, test_f1: 0.5239
 epoch: 28, train_loss: 0.9168, test_loss: 1.1715, test_f1: 0.5350
 epoch: 29, train_loss: 0.9091, test_loss: 1.1587, test_f1: 0.5428
 epoch: 30, train_loss: 0.9026, test_loss: 1.1579, test_f1: 0.5285
 epoch: 31, train_loss: 0.8924, test_loss: 1.1690, test_f1: 0.5138
 epoch: 32, train_loss: 0.8816, test_loss: 1.1826, test_f1: 0.5324
 epoch: 33, train_loss: 0.8616, test_loss: 1.1848, test_f1: 0.5106
 epoch: 34, train_loss: 0.8586, test_loss: 1.1877, test_f1: 0.5228
 epoch: 35, train_loss: 0.8492, test_loss: 1.2008, test_f1: 0.5187
 epoch: 36, train_loss: 0.8488, test_loss: 1.2112, test_f1: 0.5158
 epoch: 37, train_loss: 0.8426, test_loss: 1.1849, test_f1: 0.5167
 epoch: 38, train_loss: 0.8366, test_loss: 1.1703, test_f1: 0.5344
 epoch: 39, train_loss: 0.8295, test_loss: 1.2046, test_f1: 0.5385
 epoch: 40, train_loss: 0.8311, test_loss: 1.2038, test_f1: 0.5364
 epoch: 41, train_loss: 0.8134, test_loss: 1.1848, test_f1: 0.5385
 epoch: 42, train_loss: 0.8068, test_loss: 1.1751, test_f1: 0.5490
 epoch: 43, train_loss: 0.7959, test_loss: 1.1857, test_f1: 0.5597
 epoch: 44, train_loss: 0.7995, test_loss: 1.1968, test_f1: 0.5688
 epoch: 45, train_loss: 0.7854, test_loss: 1.2381, test_f1: 0.5386
 epoch: 46, train_loss: 0.7927, test_loss: 1.2670, test_f1: 0.5264
 epoch: 47, train_loss: 0.7738, test_loss: 1.2919, test_f1: 0.5226
 epoch: 48, train_loss: 0.7649, test_loss: 1.2706, test_f1: 0.5539
 epoch: 49, train_loss: 0.7546, test_loss: 1.2451, test_f1: 0.5617
 epoch: 50, train_loss: 0.7514, test_loss: 1.2462, test_f1: 0.5602
 epoch: 51, train_loss: 0.7427, test_loss: 1.2524, test_f1: 0.5656
 epoch: 52, train_loss: 0.7463, test_loss: 1.2800, test_f1: 0.5615
 epoch: 53, train_loss: 0.7277, test_loss: 1.3011, test_f1: 0.5667
 epoch: 54, train_loss: 0.7297, test_loss: 1.3164, test_f1: 0.5563
 epoch: 55, train_loss: 0.7228, test_loss: 1.3135, test_f1: 0.5327
 epoch: 56, train_loss: 0.7219, test_loss: 1.3004, test_f1: 0.5613
 epoch: 57, train_loss: 0.7207, test_loss: 1.2896, test_f1: 0.5790
 epoch: 58, train_loss: 0.7205, test_loss: 1.2989, test_f1: 0.5748
 epoch: 59, train_loss: 0.7334, test_loss: 1.2878, test_f1: 0.5736
 epoch: 60, train_loss: 0.7077, test_loss: 1.2910, test_f1: 0.5734
 epoch: 61, train_loss: 0.7221, test_loss: 1.3094, test_f1: 0.5894
 epoch: 62, train_loss: 0.7051, test_loss: 1.3233, test_f1: 0.5678
 epoch: 63, train_loss: 0.7095, test_loss: 1.3049, test_f1: 0.5570
 epoch: 64, train_loss: 0.6934, test_loss: 1.3127, test_f1: 0.5468
 epoch: 65, train_loss: 0.6876, test_loss: 1.3072, test_f1: 0.5499
 epoch: 66, train_loss: 0.6980, test_loss: 1.2925, test_f1: 0.5508
 epoch: 67, train_loss: 0.6788, test_loss: 1.3287, test_f1: 0.5677
 epoch: 68, train_loss: 0.6930, test_loss: 1.3457, test_f1: 0.5500
 epoch: 69, train_loss: 0.6691, test_loss: 1.3275, test_f1: 0.5498
 epoch: 70, train_loss: 0.6802, test_loss: 1.3138, test_f1: 0.5549
 epoch: 71, train_loss: 0.6684, test_loss: 1.3347, test_f1: 0.5341
 epoch: 72, train_loss: 0.6777, test_loss: 1.3369, test_f1: 0.5346
 epoch: 73, train_loss: 0.6772, test_loss: 1.3187, test_f1: 0.5492
 epoch: 74, train_loss: 0.6785, test_loss: 1.3139, test_f1: 0.5524
 epoch: 75, train_loss: 0.6620, test_loss: 1.3600, test_f1: 0.5415
 epoch: 76, train_loss: 0.6608, test_loss: 1.3731, test_f1: 0.5445
 epoch: 77, train_loss: 0.6773, test_loss: 1.3536, test_f1: 0.5494
 epoch: 78, train_loss: 0.6629, test_loss: 1.3729, test_f1: 0.5405
 epoch: 79, train_loss: 0.6502, test_loss: 1.4272, test_f1: 0.5432
 epoch: 80, train_loss: 0.6480, test_loss: 1.4449, test_f1: 0.5384
 epoch: 81, train_loss: 0.6458, test_loss: 1.4339, test_f1: 0.5305
 epoch: 82, train_loss: 0.6389, test_loss: 1.4175, test_f1: 0.5332
 epoch: 83, train_loss: 0.6519, test_loss: 1.4214, test_f1: 0.5386
 epoch: 84, train_loss: 0.6330, test_loss: 1.4353, test_f1: 0.5391
 epoch: 85, train_loss: 0.6506, test_loss: 1.4272, test_f1: 0.5475
 epoch: 86, train_loss: 0.6426, test_loss: 1.4252, test_f1: 0.5299
 epoch: 87, train_loss: 0.6423, test_loss: 1.4121, test_f1: 0.5428
 epoch: 88, train_loss: 0.6262, test_loss: 1.3682, test_f1: 0.5488
 epoch: 89, train_loss: 0.6186, test_loss: 1.3888, test_f1: 0.5378
 epoch: 90, train_loss: 0.6320, test_loss: 1.3897, test_f1: 0.5443
 epoch: 91, train_loss: 0.6311, test_loss: 1.3885, test_f1: 0.5610
 epoch: 92, train_loss: 0.6141, test_loss: 1.4106, test_f1: 0.5420
 epoch: 93, train_loss: 0.6260, test_loss: 1.4413, test_f1: 0.5206
 epoch: 94, train_loss: 0.6371, test_loss: 1.4261, test_f1: 0.5444
 epoch: 95, train_loss: 0.6119, test_loss: 1.4612, test_f1: 0.5309
 epoch: 96, train_loss: 0.6156, test_loss: 1.4592, test_f1: 0.5246
 epoch: 97, train_loss: 0.5985, test_loss: 1.4403, test_f1: 0.5482
 epoch: 98, train_loss: 0.6016, test_loss: 1.4683, test_f1: 0.5244
 epoch: 99, train_loss: 0.6039, test_loss: 1.5041, test_f1: 0.5547
##################ITERATION #8 ****************************************
 epoch: 0, train_loss: 1.2768, test_loss: 1.3483, test_f1: 0.1365
 epoch: 1, train_loss: 1.1852, test_loss: 1.3260, test_f1: 0.1365
 epoch: 2, train_loss: 1.1637, test_loss: 1.3088, test_f1: 0.2891
 epoch: 3, train_loss: 1.1477, test_loss: 1.2862, test_f1: 0.3347
 epoch: 4, train_loss: 1.1404, test_loss: 1.2746, test_f1: 0.3618
 epoch: 5, train_loss: 1.1149, test_loss: 1.2725, test_f1: 0.3832
 epoch: 6, train_loss: 1.1210, test_loss: 1.2629, test_f1: 0.4289
 epoch: 7, train_loss: 1.1115, test_loss: 1.2459, test_f1: 0.4274
 epoch: 8, train_loss: 1.0908, test_loss: 1.2153, test_f1: 0.4514
 epoch: 9, train_loss: 1.0860, test_loss: 1.1888, test_f1: 0.4888
 epoch: 10, train_loss: 1.0661, test_loss: 1.1810, test_f1: 0.5050
 epoch: 11, train_loss: 1.0673, test_loss: 1.1885, test_f1: 0.4997
 epoch: 12, train_loss: 1.0533, test_loss: 1.1957, test_f1: 0.5024
 epoch: 13, train_loss: 1.0487, test_loss: 1.1919, test_f1: 0.4927
 epoch: 14, train_loss: 1.0442, test_loss: 1.1856, test_f1: 0.5021
 epoch: 15, train_loss: 1.0322, test_loss: 1.1928, test_f1: 0.5035
 epoch: 16, train_loss: 1.0286, test_loss: 1.2098, test_f1: 0.5135
 epoch: 17, train_loss: 1.0152, test_loss: 1.1997, test_f1: 0.5306
 epoch: 18, train_loss: 0.9950, test_loss: 1.2020, test_f1: 0.5409
 epoch: 19, train_loss: 1.0078, test_loss: 1.2052, test_f1: 0.5133
 epoch: 20, train_loss: 0.9884, test_loss: 1.2017, test_f1: 0.5214
 epoch: 21, train_loss: 0.9777, test_loss: 1.2098, test_f1: 0.5380
 epoch: 22, train_loss: 0.9714, test_loss: 1.1954, test_f1: 0.5372
 epoch: 23, train_loss: 0.9701, test_loss: 1.2212, test_f1: 0.5493
 epoch: 24, train_loss: 0.9637, test_loss: 1.2272, test_f1: 0.5404
 epoch: 25, train_loss: 0.9433, test_loss: 1.2210, test_f1: 0.5366
 epoch: 26, train_loss: 0.9436, test_loss: 1.2194, test_f1: 0.5324
 epoch: 27, train_loss: 0.9439, test_loss: 1.2184, test_f1: 0.5440
 epoch: 28, train_loss: 0.9227, test_loss: 1.2324, test_f1: 0.5436
 epoch: 29, train_loss: 0.9234, test_loss: 1.2472, test_f1: 0.5481
 epoch: 30, train_loss: 0.9191, test_loss: 1.2243, test_f1: 0.5432
 epoch: 31, train_loss: 0.9169, test_loss: 1.1960, test_f1: 0.5376
 epoch: 32, train_loss: 0.9037, test_loss: 1.1952, test_f1: 0.5346
 epoch: 33, train_loss: 0.9080, test_loss: 1.2081, test_f1: 0.5329
 epoch: 34, train_loss: 0.8883, test_loss: 1.2171, test_f1: 0.5430
 epoch: 35, train_loss: 0.8790, test_loss: 1.2328, test_f1: 0.5388
 epoch: 36, train_loss: 0.8804, test_loss: 1.2097, test_f1: 0.5501
 epoch: 37, train_loss: 0.8756, test_loss: 1.2146, test_f1: 0.5668
 epoch: 38, train_loss: 0.8648, test_loss: 1.2249, test_f1: 0.5680
 epoch: 39, train_loss: 0.8560, test_loss: 1.2071, test_f1: 0.5817
 epoch: 40, train_loss: 0.8470, test_loss: 1.1880, test_f1: 0.5722
 epoch: 41, train_loss: 0.8461, test_loss: 1.1942, test_f1: 0.5534
 epoch: 42, train_loss: 0.8486, test_loss: 1.2379, test_f1: 0.5795
 epoch: 43, train_loss: 0.8327, test_loss: 1.2608, test_f1: 0.5710
 epoch: 44, train_loss: 0.8141, test_loss: 1.2376, test_f1: 0.5572
 epoch: 45, train_loss: 0.8164, test_loss: 1.2519, test_f1: 0.5540
 epoch: 46, train_loss: 0.8200, test_loss: 1.2660, test_f1: 0.5509
 epoch: 47, train_loss: 0.8022, test_loss: 1.3133, test_f1: 0.5615
 epoch: 48, train_loss: 0.8002, test_loss: 1.3216, test_f1: 0.5714
 epoch: 49, train_loss: 0.7813, test_loss: 1.3043, test_f1: 0.5595
 epoch: 50, train_loss: 0.7900, test_loss: 1.3366, test_f1: 0.5516
 epoch: 51, train_loss: 0.7706, test_loss: 1.3170, test_f1: 0.5445
 epoch: 52, train_loss: 0.7641, test_loss: 1.3282, test_f1: 0.5461
 epoch: 53, train_loss: 0.7672, test_loss: 1.3350, test_f1: 0.5516
 epoch: 54, train_loss: 0.7548, test_loss: 1.3268, test_f1: 0.5540
 epoch: 55, train_loss: 0.7567, test_loss: 1.3556, test_f1: 0.5550
 epoch: 56, train_loss: 0.7487, test_loss: 1.3626, test_f1: 0.5499
 epoch: 57, train_loss: 0.7486, test_loss: 1.3882, test_f1: 0.5515
 epoch: 58, train_loss: 0.7463, test_loss: 1.4078, test_f1: 0.5469
 epoch: 59, train_loss: 0.7385, test_loss: 1.4045, test_f1: 0.5533
 epoch: 60, train_loss: 0.7536, test_loss: 1.4108, test_f1: 0.5558
 epoch: 61, train_loss: 0.7477, test_loss: 1.3844, test_f1: 0.5573
 epoch: 62, train_loss: 0.7428, test_loss: 1.3510, test_f1: 0.5582
 epoch: 63, train_loss: 0.7425, test_loss: 1.3246, test_f1: 0.5620
 epoch: 64, train_loss: 0.7294, test_loss: 1.2927, test_f1: 0.5612
 epoch: 65, train_loss: 0.7188, test_loss: 1.2973, test_f1: 0.5646
 epoch: 66, train_loss: 0.7264, test_loss: 1.3265, test_f1: 0.5417
 epoch: 67, train_loss: 0.7269, test_loss: 1.3876, test_f1: 0.5369
 epoch: 68, train_loss: 0.7340, test_loss: 1.3920, test_f1: 0.5270
 epoch: 69, train_loss: 0.7218, test_loss: 1.3842, test_f1: 0.5446
 epoch: 70, train_loss: 0.7208, test_loss: 1.3838, test_f1: 0.5617
 epoch: 71, train_loss: 0.7125, test_loss: 1.3684, test_f1: 0.5588
 epoch: 72, train_loss: 0.7075, test_loss: 1.3370, test_f1: 0.5476
 epoch: 73, train_loss: 0.6957, test_loss: 1.3477, test_f1: 0.5666
 epoch: 74, train_loss: 0.6915, test_loss: 1.3723, test_f1: 0.5794
 epoch: 75, train_loss: 0.7090, test_loss: 1.3993, test_f1: 0.5629
 epoch: 76, train_loss: 0.6693, test_loss: 1.3996, test_f1: 0.5429
 epoch: 77, train_loss: 0.6865, test_loss: 1.3656, test_f1: 0.5604
 epoch: 78, train_loss: 0.6876, test_loss: 1.3425, test_f1: 0.5678
 epoch: 79, train_loss: 0.6958, test_loss: 1.3489, test_f1: 0.5639
 epoch: 80, train_loss: 0.6817, test_loss: 1.3641, test_f1: 0.5540
 epoch: 81, train_loss: 0.6904, test_loss: 1.3983, test_f1: 0.5558
 epoch: 82, train_loss: 0.6576, test_loss: 1.3965, test_f1: 0.5759
 epoch: 83, train_loss: 0.6670, test_loss: 1.3812, test_f1: 0.5792
 epoch: 84, train_loss: 0.6742, test_loss: 1.3790, test_f1: 0.5801
 epoch: 85, train_loss: 0.6859, test_loss: 1.4006, test_f1: 0.5716
 epoch: 86, train_loss: 0.6572, test_loss: 1.4153, test_f1: 0.5806
 epoch: 87, train_loss: 0.6775, test_loss: 1.4637, test_f1: 0.5644
 epoch: 88, train_loss: 0.6493, test_loss: 1.4887, test_f1: 0.5654
 epoch: 89, train_loss: 0.6606, test_loss: 1.4789, test_f1: 0.5604
 epoch: 90, train_loss: 0.6468, test_loss: 1.4722, test_f1: 0.5626
 epoch: 91, train_loss: 0.6432, test_loss: 1.4695, test_f1: 0.5615
 epoch: 92, train_loss: 0.6489, test_loss: 1.4840, test_f1: 0.5470
 epoch: 93, train_loss: 0.6554, test_loss: 1.5155, test_f1: 0.5649
 epoch: 94, train_loss: 0.6552, test_loss: 1.4774, test_f1: 0.5598
 epoch: 95, train_loss: 0.6514, test_loss: 1.4971, test_f1: 0.5481
 epoch: 96, train_loss: 0.6394, test_loss: 1.5130, test_f1: 0.5459
 epoch: 97, train_loss: 0.6279, test_loss: 1.5338, test_f1: 0.5428
 epoch: 98, train_loss: 0.6526, test_loss: 1.5229, test_f1: 0.5294
 epoch: 99, train_loss: 0.6280, test_loss: 1.5114, test_f1: 0.5431
##################ITERATION #9 ****************************************
 epoch: 0, train_loss: 1.2678, test_loss: 1.3441, test_f1: 0.1718
 epoch: 1, train_loss: 1.1898, test_loss: 1.3297, test_f1: 0.2896
 epoch: 2, train_loss: 1.1748, test_loss: 1.3319, test_f1: 0.2878
 epoch: 3, train_loss: 1.1423, test_loss: 1.3275, test_f1: 0.3033
 epoch: 4, train_loss: 1.1261, test_loss: 1.3117, test_f1: 0.3252
 epoch: 5, train_loss: 1.1071, test_loss: 1.3066, test_f1: 0.4060
 epoch: 6, train_loss: 1.0847, test_loss: 1.2907, test_f1: 0.4328
 epoch: 7, train_loss: 1.0553, test_loss: 1.2590, test_f1: 0.4169
 epoch: 8, train_loss: 1.0531, test_loss: 1.2265, test_f1: 0.4380
 epoch: 9, train_loss: 1.0515, test_loss: 1.2133, test_f1: 0.4665
 epoch: 10, train_loss: 1.0357, test_loss: 1.2040, test_f1: 0.4755
 epoch: 11, train_loss: 1.0282, test_loss: 1.2043, test_f1: 0.4677
 epoch: 12, train_loss: 1.0188, test_loss: 1.2284, test_f1: 0.4803
 epoch: 13, train_loss: 1.0027, test_loss: 1.2495, test_f1: 0.4684
 epoch: 14, train_loss: 0.9899, test_loss: 1.2895, test_f1: 0.4705
 epoch: 15, train_loss: 0.9929, test_loss: 1.2867, test_f1: 0.4809
 epoch: 16, train_loss: 0.9741, test_loss: 1.2942, test_f1: 0.4868
 epoch: 17, train_loss: 0.9666, test_loss: 1.2860, test_f1: 0.4940
 epoch: 18, train_loss: 0.9665, test_loss: 1.3175, test_f1: 0.4970
 epoch: 19, train_loss: 0.9410, test_loss: 1.3375, test_f1: 0.4977
 epoch: 20, train_loss: 0.9467, test_loss: 1.3241, test_f1: 0.5047
 epoch: 21, train_loss: 0.9414, test_loss: 1.3399, test_f1: 0.5130
 epoch: 22, train_loss: 0.9214, test_loss: 1.3447, test_f1: 0.5091
 epoch: 23, train_loss: 0.9282, test_loss: 1.3276, test_f1: 0.5296
 epoch: 24, train_loss: 0.9091, test_loss: 1.3466, test_f1: 0.5300
 epoch: 25, train_loss: 0.9057, test_loss: 1.3423, test_f1: 0.5265
 epoch: 26, train_loss: 0.8995, test_loss: 1.3313, test_f1: 0.5244
 epoch: 27, train_loss: 0.8829, test_loss: 1.3425, test_f1: 0.5264
 epoch: 28, train_loss: 0.8733, test_loss: 1.3304, test_f1: 0.5406
 epoch: 29, train_loss: 0.8644, test_loss: 1.3724, test_f1: 0.5344
 epoch: 30, train_loss: 0.8698, test_loss: 1.3670, test_f1: 0.5526
 epoch: 31, train_loss: 0.8627, test_loss: 1.3553, test_f1: 0.5455
 epoch: 32, train_loss: 0.8530, test_loss: 1.3259, test_f1: 0.5388
 epoch: 33, train_loss: 0.8487, test_loss: 1.3107, test_f1: 0.5429
 epoch: 34, train_loss: 0.8310, test_loss: 1.3233, test_f1: 0.5172
 epoch: 35, train_loss: 0.8299, test_loss: 1.3368, test_f1: 0.5369
 epoch: 36, train_loss: 0.8205, test_loss: 1.3548, test_f1: 0.5267
 epoch: 37, train_loss: 0.8023, test_loss: 1.3937, test_f1: 0.5217
 epoch: 38, train_loss: 0.8014, test_loss: 1.3700, test_f1: 0.5332
 epoch: 39, train_loss: 0.8043, test_loss: 1.3629, test_f1: 0.5143
 epoch: 40, train_loss: 0.8210, test_loss: 1.3822, test_f1: 0.4862
 epoch: 41, train_loss: 0.7666, test_loss: 1.3417, test_f1: 0.5182
 epoch: 42, train_loss: 0.7879, test_loss: 1.3542, test_f1: 0.5117
 epoch: 43, train_loss: 0.7807, test_loss: 1.3642, test_f1: 0.5253
 epoch: 44, train_loss: 0.7646, test_loss: 1.4290, test_f1: 0.5091
 epoch: 45, train_loss: 0.7554, test_loss: 1.3974, test_f1: 0.5144
 epoch: 46, train_loss: 0.7478, test_loss: 1.3982, test_f1: 0.5072
 epoch: 47, train_loss: 0.7381, test_loss: 1.3826, test_f1: 0.5383
 epoch: 48, train_loss: 0.7427, test_loss: 1.4120, test_f1: 0.5474
 epoch: 49, train_loss: 0.7368, test_loss: 1.4000, test_f1: 0.5172
 epoch: 50, train_loss: 0.7292, test_loss: 1.3978, test_f1: 0.5198
 epoch: 51, train_loss: 0.7319, test_loss: 1.3871, test_f1: 0.5110
 epoch: 52, train_loss: 0.7193, test_loss: 1.4931, test_f1: 0.5163
 epoch: 53, train_loss: 0.7092, test_loss: 1.5503, test_f1: 0.5113
 epoch: 54, train_loss: 0.7102, test_loss: 1.5886, test_f1: 0.5095
 epoch: 55, train_loss: 0.6999, test_loss: 1.5586, test_f1: 0.5129
 epoch: 56, train_loss: 0.7119, test_loss: 1.5573, test_f1: 0.5018
 epoch: 57, train_loss: 0.6920, test_loss: 1.4889, test_f1: 0.4856
 epoch: 58, train_loss: 0.6779, test_loss: 1.5636, test_f1: 0.4843
 epoch: 59, train_loss: 0.6797, test_loss: 1.5087, test_f1: 0.4894
 epoch: 60, train_loss: 0.6866, test_loss: 1.5138, test_f1: 0.4912
 epoch: 61, train_loss: 0.6741, test_loss: 1.5463, test_f1: 0.5115
 epoch: 62, train_loss: 0.6683, test_loss: 1.4939, test_f1: 0.5038
 epoch: 63, train_loss: 0.6672, test_loss: 1.5154, test_f1: 0.5006
 epoch: 64, train_loss: 0.6770, test_loss: 1.5151, test_f1: 0.5278
 epoch: 65, train_loss: 0.6706, test_loss: 1.5429, test_f1: 0.5122
 epoch: 66, train_loss: 0.6676, test_loss: 1.5768, test_f1: 0.5093
 epoch: 67, train_loss: 0.6493, test_loss: 1.5951, test_f1: 0.5115
 epoch: 68, train_loss: 0.6613, test_loss: 1.5933, test_f1: 0.4909
 epoch: 69, train_loss: 0.6485, test_loss: 1.5561, test_f1: 0.4963
 epoch: 70, train_loss: 0.6555, test_loss: 1.5778, test_f1: 0.5064
 epoch: 71, train_loss: 0.6661, test_loss: 1.5229, test_f1: 0.5201
 epoch: 72, train_loss: 0.6540, test_loss: 1.5283, test_f1: 0.5065
 epoch: 73, train_loss: 0.6598, test_loss: 1.5002, test_f1: 0.5009
 epoch: 74, train_loss: 0.6394, test_loss: 1.5553, test_f1: 0.5027
 epoch: 75, train_loss: 0.6356, test_loss: 1.5249, test_f1: 0.5106
 epoch: 76, train_loss: 0.6321, test_loss: 1.5299, test_f1: 0.5096
 epoch: 77, train_loss: 0.6191, test_loss: 1.5666, test_f1: 0.4962
 epoch: 78, train_loss: 0.6283, test_loss: 1.5567, test_f1: 0.5067
 epoch: 79, train_loss: 0.6248, test_loss: 1.5834, test_f1: 0.5045
 epoch: 80, train_loss: 0.6216, test_loss: 1.5705, test_f1: 0.5179
 epoch: 81, train_loss: 0.6231, test_loss: 1.5659, test_f1: 0.5122
 epoch: 82, train_loss: 0.6197, test_loss: 1.6334, test_f1: 0.4882
 epoch: 83, train_loss: 0.6224, test_loss: 1.6126, test_f1: 0.5069
 epoch: 84, train_loss: 0.6150, test_loss: 1.6116, test_f1: 0.4930
 epoch: 85, train_loss: 0.6045, test_loss: 1.6123, test_f1: 0.4925
 epoch: 86, train_loss: 0.5992, test_loss: 1.6159, test_f1: 0.5148
 epoch: 87, train_loss: 0.6084, test_loss: 1.5813, test_f1: 0.5199
 epoch: 88, train_loss: 0.6090, test_loss: 1.5574, test_f1: 0.5017
 epoch: 89, train_loss: 0.5975, test_loss: 1.6372, test_f1: 0.4936
 epoch: 90, train_loss: 0.5939, test_loss: 1.6434, test_f1: 0.5039
 epoch: 91, train_loss: 0.6002, test_loss: 1.6533, test_f1: 0.5018
 epoch: 92, train_loss: 0.5956, test_loss: 1.6172, test_f1: 0.5024
 epoch: 93, train_loss: 0.5894, test_loss: 1.6463, test_f1: 0.4912
 epoch: 94, train_loss: 0.5908, test_loss: 1.6691, test_f1: 0.4914
 epoch: 95, train_loss: 0.5884, test_loss: 1.7265, test_f1: 0.4912
 epoch: 96, train_loss: 0.5821, test_loss: 1.7933, test_f1: 0.4966
 epoch: 97, train_loss: 0.5785, test_loss: 1.8667, test_f1: 0.4835
 epoch: 98, train_loss: 0.5942, test_loss: 1.8158, test_f1: 0.4942
 epoch: 99, train_loss: 0.5892, test_loss: 1.7665, test_f1: 0.4835

Training completed in 311.78 seconds
Best F1: 0.6247 at epoch 64
Mean F1 across iterations: 0.5741  0.0227
========================FINAL RESULTS================================
FEGIN weighted F1: 0.6247  0.0227
python main.py --data ltspice_demos --representation component_component --model FEGIN --layers 5 --hiddens 128 --batch_size 256 --lr 0.0001 --emb_size 250 --epochs 100 --save_appendix component_component_L5_H128_BS256_LR0.0001_E250 --no_val
-----



STDERR:
  File "main.py", line 370, in <module>
    main()
  File "main.py", line 254, in main
    dataset = dataset_class(
  File "/home/philip/projects/ltspice_examples_code_repo/Circuit-Completion-Using-GNNs/component_classification_with_link_prediction_head/evaluation/FEGIN/kernel/circuit_datasets.py", line 15, in __init__
    self.data, self.slices = torch.load(self.processed_paths[0])
  File "/home/philip/.local/lib/python3.8/site-packages/torch/serialization.py", line 1040, in load
    warnings.warn(
  File "/usr/lib/python3.8/warnings.py", line 109, in _showwarnmsg
    sw(msg.message, msg.category, msg.filename, msg.lineno,
  File "main.py", line 47, in warn_with_traceback
    traceback.print_stack(file=log)
/home/philip/projects/ltspice_examples_code_repo/Circuit-Completion-Using-GNNs/component_classification_with_link_prediction_head/evaluation/FEGIN/kernel/circuit_datasets.py:15: FutureWarning: You are using `torch.load` with `weights_only=False` (the current default value), which uses the default pickle module implicitly. It is possible to construct malicious pickle data which will execute arbitrary code during unpickling (See https://github.com/pytorch/pytorch/blob/main/SECURITY.md#untrusted-models for more details). In a future release, the default value for `weights_only` will be flipped to `True`. This limits the functions that could be executed during unpickling. Arbitrary objects will no longer be allowed to be loaded via this mode unless they are explicitly allowlisted by the user via `torch.serialization.add_safe_globals`. We recommend you start setting `weights_only=True` for any use case where you don't have full control of the loaded file. Please open an issue on GitHub for any issues related to this experimental feature.
  self.data, self.slices = torch.load(self.processed_paths[0])
