STDOUT:
Results will be saved in /home/philip/projects/ltspice_examples_code_repo/Circuit-Completion-Using-GNNs/component_classification_with_link_prediction_head/evaluation/FEGIN/results/model_FEGIN_dataset_ltspice_examples
Command line input: python main.py --data ltspice_examples --representation component_net --model FEGIN --layers 5 --hiddens 64 --batch_size 32 --lr 0.0001 --emb_size 250 --epochs 100 --save_appendix component_net_L5_H64_BS32_LR0.0001_E250 --no_val
 is saved.
-----
ltspice_examples - FEGIN
Using 5 layers, 64 hidden units, h = 2
Loading component_net representation dataset
ENTERED
Training FEGIN on component_net representation
Train: 3558, Test: 846
##################ITERATION #0 ****************************************
 epoch: 0, train_loss: 1.3794, test_loss: 1.3260, test_f1: 0.3005
 epoch: 1, train_loss: 1.2981, test_loss: 1.2602, test_f1: 0.2697
 epoch: 2, train_loss: 1.2530, test_loss: 1.2220, test_f1: 0.3162
 epoch: 3, train_loss: 1.2177, test_loss: 1.1840, test_f1: 0.3384
 epoch: 4, train_loss: 1.1856, test_loss: 1.1478, test_f1: 0.3487
 epoch: 5, train_loss: 1.1610, test_loss: 1.1259, test_f1: 0.3787
 epoch: 6, train_loss: 1.1379, test_loss: 1.0962, test_f1: 0.4182
 epoch: 7, train_loss: 1.1181, test_loss: 1.0707, test_f1: 0.4817
 epoch: 8, train_loss: 1.0917, test_loss: 1.0357, test_f1: 0.4952
 epoch: 9, train_loss: 1.0672, test_loss: 1.0246, test_f1: 0.4848
 epoch: 10, train_loss: 1.0419, test_loss: 1.0110, test_f1: 0.4849
 epoch: 11, train_loss: 1.0184, test_loss: 0.9877, test_f1: 0.4978
 epoch: 12, train_loss: 1.0048, test_loss: 0.9620, test_f1: 0.4992
 epoch: 13, train_loss: 0.9871, test_loss: 0.9784, test_f1: 0.4787
 epoch: 14, train_loss: 0.9816, test_loss: 0.9582, test_f1: 0.4755
 epoch: 15, train_loss: 0.9538, test_loss: 0.9779, test_f1: 0.4995
 epoch: 16, train_loss: 0.9457, test_loss: 0.9580, test_f1: 0.4874
 epoch: 17, train_loss: 0.9431, test_loss: 0.9346, test_f1: 0.5100
 epoch: 18, train_loss: 0.9242, test_loss: 0.9268, test_f1: 0.5017
 epoch: 19, train_loss: 0.9144, test_loss: 0.9278, test_f1: 0.5062
 epoch: 20, train_loss: 0.9229, test_loss: 0.9289, test_f1: 0.5059
 epoch: 21, train_loss: 0.9132, test_loss: 0.9274, test_f1: 0.5130
 epoch: 22, train_loss: 0.9015, test_loss: 0.9262, test_f1: 0.4927
 epoch: 23, train_loss: 0.8896, test_loss: 0.9376, test_f1: 0.4943
 epoch: 24, train_loss: 0.8946, test_loss: 0.9338, test_f1: 0.4949
 epoch: 25, train_loss: 0.8893, test_loss: 0.9265, test_f1: 0.5307
 epoch: 26, train_loss: 0.8863, test_loss: 0.9533, test_f1: 0.5049
 epoch: 27, train_loss: 0.8885, test_loss: 0.9362, test_f1: 0.5085
 epoch: 28, train_loss: 0.8778, test_loss: 0.9514, test_f1: 0.5161
 epoch: 29, train_loss: 0.8675, test_loss: 0.9394, test_f1: 0.5254
 epoch: 30, train_loss: 0.8671, test_loss: 0.9311, test_f1: 0.5115
 epoch: 31, train_loss: 0.8634, test_loss: 0.9394, test_f1: 0.5162
 epoch: 32, train_loss: 0.8626, test_loss: 0.9502, test_f1: 0.5192
 epoch: 33, train_loss: 0.8484, test_loss: 0.9599, test_f1: 0.5195
 epoch: 34, train_loss: 0.8532, test_loss: 0.9134, test_f1: 0.5136
 epoch: 35, train_loss: 0.8504, test_loss: 0.9357, test_f1: 0.5183
 epoch: 36, train_loss: 0.8571, test_loss: 0.9493, test_f1: 0.5221
 epoch: 37, train_loss: 0.8409, test_loss: 0.9481, test_f1: 0.5404
 epoch: 38, train_loss: 0.8459, test_loss: 0.9290, test_f1: 0.5371
 epoch: 39, train_loss: 0.8302, test_loss: 0.9436, test_f1: 0.5265
 epoch: 40, train_loss: 0.8376, test_loss: 0.9238, test_f1: 0.5450
 epoch: 41, train_loss: 0.8202, test_loss: 0.9393, test_f1: 0.5437
 epoch: 42, train_loss: 0.8269, test_loss: 0.9407, test_f1: 0.5495
 epoch: 43, train_loss: 0.8248, test_loss: 0.9445, test_f1: 0.5492
 epoch: 44, train_loss: 0.8212, test_loss: 0.9280, test_f1: 0.5636
 epoch: 45, train_loss: 0.8213, test_loss: 0.9120, test_f1: 0.5618
 epoch: 46, train_loss: 0.8154, test_loss: 0.9342, test_f1: 0.5515
 epoch: 47, train_loss: 0.8057, test_loss: 0.9288, test_f1: 0.5574
 epoch: 48, train_loss: 0.8096, test_loss: 0.9206, test_f1: 0.5702
 epoch: 49, train_loss: 0.7998, test_loss: 0.9514, test_f1: 0.5614
 epoch: 50, train_loss: 0.7997, test_loss: 0.9483, test_f1: 0.5609
 epoch: 51, train_loss: 0.8100, test_loss: 0.9474, test_f1: 0.5624
 epoch: 52, train_loss: 0.7840, test_loss: 0.9455, test_f1: 0.5686
 epoch: 53, train_loss: 0.7830, test_loss: 0.9308, test_f1: 0.5798
 epoch: 54, train_loss: 0.7847, test_loss: 0.9277, test_f1: 0.5638
 epoch: 55, train_loss: 0.7993, test_loss: 0.9385, test_f1: 0.5717
 epoch: 56, train_loss: 0.7878, test_loss: 0.9208, test_f1: 0.5730
 epoch: 57, train_loss: 0.7756, test_loss: 0.9501, test_f1: 0.5658
 epoch: 58, train_loss: 0.7812, test_loss: 0.9288, test_f1: 0.5692
 epoch: 59, train_loss: 0.7842, test_loss: 0.9262, test_f1: 0.5841
 epoch: 60, train_loss: 0.7792, test_loss: 0.9386, test_f1: 0.5818
 epoch: 61, train_loss: 0.7770, test_loss: 0.9566, test_f1: 0.5608
 epoch: 62, train_loss: 0.7905, test_loss: 0.9665, test_f1: 0.5632
 epoch: 63, train_loss: 0.7816, test_loss: 0.9507, test_f1: 0.5766
 epoch: 64, train_loss: 0.7688, test_loss: 0.9449, test_f1: 0.5819
 epoch: 65, train_loss: 0.7686, test_loss: 0.9437, test_f1: 0.5929
 epoch: 66, train_loss: 0.7586, test_loss: 0.9408, test_f1: 0.5811
 epoch: 67, train_loss: 0.7728, test_loss: 0.9409, test_f1: 0.5847
 epoch: 68, train_loss: 0.7704, test_loss: 0.9270, test_f1: 0.5838
 epoch: 69, train_loss: 0.7616, test_loss: 0.9299, test_f1: 0.5868
 epoch: 70, train_loss: 0.7670, test_loss: 0.9250, test_f1: 0.5794
 epoch: 71, train_loss: 0.7509, test_loss: 0.9203, test_f1: 0.5879
 epoch: 72, train_loss: 0.7635, test_loss: 0.9501, test_f1: 0.5746
 epoch: 73, train_loss: 0.7700, test_loss: 0.9100, test_f1: 0.6029
 epoch: 74, train_loss: 0.7614, test_loss: 0.9514, test_f1: 0.5814
 epoch: 75, train_loss: 0.7586, test_loss: 0.9545, test_f1: 0.5828
 epoch: 76, train_loss: 0.7561, test_loss: 0.9160, test_f1: 0.6063
 epoch: 77, train_loss: 0.7518, test_loss: 0.9203, test_f1: 0.5956
 epoch: 78, train_loss: 0.7466, test_loss: 0.9345, test_f1: 0.5911
 epoch: 79, train_loss: 0.7543, test_loss: 0.9280, test_f1: 0.6082
 epoch: 80, train_loss: 0.7399, test_loss: 0.9570, test_f1: 0.5788
 epoch: 81, train_loss: 0.7465, test_loss: 0.9515, test_f1: 0.5867
 epoch: 82, train_loss: 0.7488, test_loss: 0.9560, test_f1: 0.6029
 epoch: 83, train_loss: 0.7527, test_loss: 0.9389, test_f1: 0.6101
 epoch: 84, train_loss: 0.7414, test_loss: 0.9491, test_f1: 0.5970
 epoch: 85, train_loss: 0.7489, test_loss: 0.9498, test_f1: 0.5820
 epoch: 86, train_loss: 0.7363, test_loss: 0.9228, test_f1: 0.5886
 epoch: 87, train_loss: 0.7475, test_loss: 0.9260, test_f1: 0.6032
 epoch: 88, train_loss: 0.7466, test_loss: 0.9456, test_f1: 0.5852
 epoch: 89, train_loss: 0.7442, test_loss: 0.9670, test_f1: 0.5756
 epoch: 90, train_loss: 0.7364, test_loss: 0.9651, test_f1: 0.5837
 epoch: 91, train_loss: 0.7400, test_loss: 0.9231, test_f1: 0.6039
 epoch: 92, train_loss: 0.7288, test_loss: 0.9296, test_f1: 0.5829
 epoch: 93, train_loss: 0.7283, test_loss: 0.9397, test_f1: 0.5781
 epoch: 94, train_loss: 0.7394, test_loss: 0.9451, test_f1: 0.5782
 epoch: 95, train_loss: 0.7338, test_loss: 0.9594, test_f1: 0.5875
 epoch: 96, train_loss: 0.7301, test_loss: 0.9471, test_f1: 0.5862
 epoch: 97, train_loss: 0.7407, test_loss: 0.9403, test_f1: 0.6037
 epoch: 98, train_loss: 0.7335, test_loss: 0.9568, test_f1: 0.5979
 epoch: 99, train_loss: 0.7173, test_loss: 0.9591, test_f1: 0.5853
##################ITERATION #1 ****************************************
 epoch: 0, train_loss: 1.2828, test_loss: 1.2017, test_f1: 0.3038
 epoch: 1, train_loss: 1.2090, test_loss: 1.1542, test_f1: 0.3967
 epoch: 2, train_loss: 1.1690, test_loss: 1.1068, test_f1: 0.4297
 epoch: 3, train_loss: 1.1274, test_loss: 1.0730, test_f1: 0.4364
 epoch: 4, train_loss: 1.0886, test_loss: 1.0259, test_f1: 0.4578
 epoch: 5, train_loss: 1.0620, test_loss: 1.0008, test_f1: 0.4648
 epoch: 6, train_loss: 1.0279, test_loss: 0.9813, test_f1: 0.4781
 epoch: 7, train_loss: 1.0248, test_loss: 0.9577, test_f1: 0.5054
 epoch: 8, train_loss: 0.9932, test_loss: 0.9518, test_f1: 0.4953
 epoch: 9, train_loss: 0.9894, test_loss: 0.9351, test_f1: 0.5034
 epoch: 10, train_loss: 0.9634, test_loss: 0.9530, test_f1: 0.4988
 epoch: 11, train_loss: 0.9608, test_loss: 0.9481, test_f1: 0.5256
 epoch: 12, train_loss: 0.9562, test_loss: 0.9788, test_f1: 0.4964
 epoch: 13, train_loss: 0.9441, test_loss: 0.9540, test_f1: 0.5149
 epoch: 14, train_loss: 0.9472, test_loss: 0.9451, test_f1: 0.5434
 epoch: 15, train_loss: 0.9300, test_loss: 0.9521, test_f1: 0.5239
 epoch: 16, train_loss: 0.9306, test_loss: 0.9609, test_f1: 0.4955
 epoch: 17, train_loss: 0.9169, test_loss: 0.9464, test_f1: 0.4956
 epoch: 18, train_loss: 0.9068, test_loss: 0.9376, test_f1: 0.5327
 epoch: 19, train_loss: 0.9033, test_loss: 0.9287, test_f1: 0.5222
 epoch: 20, train_loss: 0.9016, test_loss: 0.9437, test_f1: 0.5163
 epoch: 21, train_loss: 0.8937, test_loss: 0.9335, test_f1: 0.5217
 epoch: 22, train_loss: 0.8940, test_loss: 0.9722, test_f1: 0.5052
 epoch: 23, train_loss: 0.8897, test_loss: 0.9580, test_f1: 0.5171
 epoch: 24, train_loss: 0.8825, test_loss: 0.9704, test_f1: 0.5063
 epoch: 25, train_loss: 0.8824, test_loss: 0.9271, test_f1: 0.5242
 epoch: 26, train_loss: 0.8774, test_loss: 0.9597, test_f1: 0.5349
 epoch: 27, train_loss: 0.8787, test_loss: 0.9848, test_f1: 0.5077
 epoch: 28, train_loss: 0.8565, test_loss: 0.9620, test_f1: 0.5338
 epoch: 29, train_loss: 0.8546, test_loss: 0.9883, test_f1: 0.5518
 epoch: 30, train_loss: 0.8648, test_loss: 0.9620, test_f1: 0.5282
 epoch: 31, train_loss: 0.8531, test_loss: 0.9680, test_f1: 0.5344
 epoch: 32, train_loss: 0.8421, test_loss: 0.9759, test_f1: 0.5287
 epoch: 33, train_loss: 0.8440, test_loss: 0.9650, test_f1: 0.5389
 epoch: 34, train_loss: 0.8373, test_loss: 0.9777, test_f1: 0.5321
 epoch: 35, train_loss: 0.8373, test_loss: 0.9793, test_f1: 0.5368
 epoch: 36, train_loss: 0.8298, test_loss: 0.9888, test_f1: 0.5368
 epoch: 37, train_loss: 0.8242, test_loss: 0.9898, test_f1: 0.5338
 epoch: 38, train_loss: 0.8336, test_loss: 0.9973, test_f1: 0.5363
 epoch: 39, train_loss: 0.8219, test_loss: 0.9720, test_f1: 0.5510
 epoch: 40, train_loss: 0.8189, test_loss: 1.0115, test_f1: 0.5365
 epoch: 41, train_loss: 0.8164, test_loss: 0.9880, test_f1: 0.5393
 epoch: 42, train_loss: 0.8106, test_loss: 1.0035, test_f1: 0.5171
 epoch: 43, train_loss: 0.8105, test_loss: 0.9954, test_f1: 0.5280
 epoch: 44, train_loss: 0.8155, test_loss: 1.0092, test_f1: 0.5481
 epoch: 45, train_loss: 0.8126, test_loss: 0.9745, test_f1: 0.5413
 epoch: 46, train_loss: 0.7999, test_loss: 0.9936, test_f1: 0.5426
 epoch: 47, train_loss: 0.8047, test_loss: 0.9843, test_f1: 0.5539
 epoch: 48, train_loss: 0.8008, test_loss: 0.9920, test_f1: 0.5489
 epoch: 49, train_loss: 0.7959, test_loss: 1.0147, test_f1: 0.5357
 epoch: 50, train_loss: 0.7921, test_loss: 0.9772, test_f1: 0.5594
 epoch: 51, train_loss: 0.7810, test_loss: 1.0125, test_f1: 0.5481
 epoch: 52, train_loss: 0.7737, test_loss: 0.9925, test_f1: 0.5597
 epoch: 53, train_loss: 0.7789, test_loss: 1.0288, test_f1: 0.5258
 epoch: 54, train_loss: 0.7785, test_loss: 1.0112, test_f1: 0.5387
 epoch: 55, train_loss: 0.7836, test_loss: 1.0368, test_f1: 0.5669
 epoch: 56, train_loss: 0.7602, test_loss: 1.0017, test_f1: 0.5551
 epoch: 57, train_loss: 0.7755, test_loss: 1.0019, test_f1: 0.5488
 epoch: 58, train_loss: 0.7598, test_loss: 1.0141, test_f1: 0.5652
 epoch: 59, train_loss: 0.7677, test_loss: 1.0023, test_f1: 0.5460
 epoch: 60, train_loss: 0.7567, test_loss: 1.0085, test_f1: 0.5394
 epoch: 61, train_loss: 0.7608, test_loss: 1.0086, test_f1: 0.5555
 epoch: 62, train_loss: 0.7663, test_loss: 1.0042, test_f1: 0.5515
 epoch: 63, train_loss: 0.7726, test_loss: 1.0353, test_f1: 0.5570
 epoch: 64, train_loss: 0.7628, test_loss: 1.0440, test_f1: 0.5477
 epoch: 65, train_loss: 0.7751, test_loss: 1.0019, test_f1: 0.5612
 epoch: 66, train_loss: 0.7565, test_loss: 1.0202, test_f1: 0.5487
 epoch: 67, train_loss: 0.7568, test_loss: 1.0101, test_f1: 0.5547
 epoch: 68, train_loss: 0.7626, test_loss: 1.0089, test_f1: 0.5767
 epoch: 69, train_loss: 0.7699, test_loss: 1.0097, test_f1: 0.5490
 epoch: 70, train_loss: 0.7530, test_loss: 0.9961, test_f1: 0.5565
 epoch: 71, train_loss: 0.7582, test_loss: 1.0011, test_f1: 0.5531
 epoch: 72, train_loss: 0.7532, test_loss: 1.0010, test_f1: 0.5591
 epoch: 73, train_loss: 0.7437, test_loss: 1.0207, test_f1: 0.5728
 epoch: 74, train_loss: 0.7448, test_loss: 1.0141, test_f1: 0.5653
 epoch: 75, train_loss: 0.7625, test_loss: 0.9863, test_f1: 0.5602
 epoch: 76, train_loss: 0.7381, test_loss: 1.0375, test_f1: 0.5530
 epoch: 77, train_loss: 0.7414, test_loss: 1.0275, test_f1: 0.5626
 epoch: 78, train_loss: 0.7461, test_loss: 1.0566, test_f1: 0.5599
 epoch: 79, train_loss: 0.7423, test_loss: 1.0111, test_f1: 0.5638
 epoch: 80, train_loss: 0.7453, test_loss: 0.9942, test_f1: 0.5527
 epoch: 81, train_loss: 0.7385, test_loss: 1.0250, test_f1: 0.5591
 epoch: 82, train_loss: 0.7496, test_loss: 1.0155, test_f1: 0.5699
 epoch: 83, train_loss: 0.7325, test_loss: 1.0234, test_f1: 0.5555
 epoch: 84, train_loss: 0.7452, test_loss: 1.0137, test_f1: 0.5598
 epoch: 85, train_loss: 0.7436, test_loss: 1.0240, test_f1: 0.5827
 epoch: 86, train_loss: 0.7451, test_loss: 1.0732, test_f1: 0.5846
 epoch: 87, train_loss: 0.7194, test_loss: 1.0358, test_f1: 0.5697
 epoch: 88, train_loss: 0.7361, test_loss: 1.0392, test_f1: 0.5620
 epoch: 89, train_loss: 0.7261, test_loss: 1.0428, test_f1: 0.5620
 epoch: 90, train_loss: 0.7354, test_loss: 1.0558, test_f1: 0.5625
 epoch: 91, train_loss: 0.7397, test_loss: 0.9991, test_f1: 0.5705
 epoch: 92, train_loss: 0.7273, test_loss: 1.0100, test_f1: 0.5788
 epoch: 93, train_loss: 0.7293, test_loss: 1.0068, test_f1: 0.5823
 epoch: 94, train_loss: 0.7322, test_loss: 1.0171, test_f1: 0.5662
 epoch: 95, train_loss: 0.7256, test_loss: 1.0113, test_f1: 0.5653
 epoch: 96, train_loss: 0.7252, test_loss: 1.0423, test_f1: 0.5555
 epoch: 97, train_loss: 0.7310, test_loss: 1.0234, test_f1: 0.5763
 epoch: 98, train_loss: 0.7322, test_loss: 1.0277, test_f1: 0.5597
 epoch: 99, train_loss: 0.7275, test_loss: 1.0502, test_f1: 0.5459
##################ITERATION #2 ****************************************
 epoch: 0, train_loss: 1.2587, test_loss: 1.1714, test_f1: 0.3675
 epoch: 1, train_loss: 1.1700, test_loss: 1.1149, test_f1: 0.4093
 epoch: 2, train_loss: 1.1293, test_loss: 1.0881, test_f1: 0.4369
 epoch: 3, train_loss: 1.0909, test_loss: 1.0547, test_f1: 0.4277
 epoch: 4, train_loss: 1.0616, test_loss: 1.0109, test_f1: 0.4587
 epoch: 5, train_loss: 1.0355, test_loss: 0.9927, test_f1: 0.4539
 epoch: 6, train_loss: 1.0091, test_loss: 0.9962, test_f1: 0.4627
 epoch: 7, train_loss: 1.0029, test_loss: 0.9789, test_f1: 0.4678
 epoch: 8, train_loss: 0.9907, test_loss: 0.9763, test_f1: 0.4745
 epoch: 9, train_loss: 0.9693, test_loss: 0.9767, test_f1: 0.4671
 epoch: 10, train_loss: 0.9547, test_loss: 0.9672, test_f1: 0.4766
 epoch: 11, train_loss: 0.9557, test_loss: 0.9580, test_f1: 0.4904
 epoch: 12, train_loss: 0.9529, test_loss: 0.9474, test_f1: 0.4795
 epoch: 13, train_loss: 0.9285, test_loss: 0.9559, test_f1: 0.4983
 epoch: 14, train_loss: 0.9295, test_loss: 0.9612, test_f1: 0.4880
 epoch: 15, train_loss: 0.9274, test_loss: 0.9512, test_f1: 0.5076
 epoch: 16, train_loss: 0.9149, test_loss: 0.9612, test_f1: 0.5097
 epoch: 17, train_loss: 0.9083, test_loss: 0.9669, test_f1: 0.5077
 epoch: 18, train_loss: 0.9035, test_loss: 0.9487, test_f1: 0.5069
 epoch: 19, train_loss: 0.9006, test_loss: 0.9276, test_f1: 0.5376
 epoch: 20, train_loss: 0.8945, test_loss: 0.9807, test_f1: 0.5107
 epoch: 21, train_loss: 0.8908, test_loss: 0.9420, test_f1: 0.5356
 epoch: 22, train_loss: 0.8887, test_loss: 0.9410, test_f1: 0.5018
 epoch: 23, train_loss: 0.8858, test_loss: 0.9419, test_f1: 0.5507
 epoch: 24, train_loss: 0.8854, test_loss: 0.9406, test_f1: 0.5179
 epoch: 25, train_loss: 0.8673, test_loss: 0.9369, test_f1: 0.5510
 epoch: 26, train_loss: 0.8622, test_loss: 0.9217, test_f1: 0.5565
 epoch: 27, train_loss: 0.8623, test_loss: 0.9312, test_f1: 0.5398
 epoch: 28, train_loss: 0.8604, test_loss: 0.9302, test_f1: 0.5519
 epoch: 29, train_loss: 0.8511, test_loss: 0.9459, test_f1: 0.5704
 epoch: 30, train_loss: 0.8505, test_loss: 0.9439, test_f1: 0.5575
 epoch: 31, train_loss: 0.8457, test_loss: 0.9349, test_f1: 0.5632
 epoch: 32, train_loss: 0.8468, test_loss: 0.9186, test_f1: 0.5618
 epoch: 33, train_loss: 0.8370, test_loss: 0.9261, test_f1: 0.5616
 epoch: 34, train_loss: 0.8300, test_loss: 0.9484, test_f1: 0.5450
 epoch: 35, train_loss: 0.8230, test_loss: 0.9157, test_f1: 0.5653
 epoch: 36, train_loss: 0.8289, test_loss: 0.9137, test_f1: 0.5728
 epoch: 37, train_loss: 0.8217, test_loss: 0.9130, test_f1: 0.5733
 epoch: 38, train_loss: 0.8186, test_loss: 0.9371, test_f1: 0.5781
 epoch: 39, train_loss: 0.8284, test_loss: 0.9265, test_f1: 0.5514
 epoch: 40, train_loss: 0.8154, test_loss: 0.9306, test_f1: 0.5538
 epoch: 41, train_loss: 0.8034, test_loss: 0.9344, test_f1: 0.5722
 epoch: 42, train_loss: 0.8075, test_loss: 0.9192, test_f1: 0.5611
 epoch: 43, train_loss: 0.7950, test_loss: 0.9180, test_f1: 0.5686
 epoch: 44, train_loss: 0.7973, test_loss: 0.9123, test_f1: 0.5788
 epoch: 45, train_loss: 0.7986, test_loss: 0.9812, test_f1: 0.5682
 epoch: 46, train_loss: 0.7926, test_loss: 0.9510, test_f1: 0.5866
 epoch: 47, train_loss: 0.7933, test_loss: 0.9557, test_f1: 0.5957
 epoch: 48, train_loss: 0.7846, test_loss: 0.9588, test_f1: 0.5872
 epoch: 49, train_loss: 0.7952, test_loss: 0.9564, test_f1: 0.5929
 epoch: 50, train_loss: 0.7771, test_loss: 0.9730, test_f1: 0.6017
 epoch: 51, train_loss: 0.7787, test_loss: 0.9414, test_f1: 0.6033
 epoch: 52, train_loss: 0.7717, test_loss: 0.9168, test_f1: 0.5934
 epoch: 53, train_loss: 0.7712, test_loss: 0.9232, test_f1: 0.5881
 epoch: 54, train_loss: 0.7713, test_loss: 0.9305, test_f1: 0.5781
 epoch: 55, train_loss: 0.7627, test_loss: 0.9412, test_f1: 0.5773
 epoch: 56, train_loss: 0.7728, test_loss: 0.9385, test_f1: 0.5949
 epoch: 57, train_loss: 0.7667, test_loss: 0.9359, test_f1: 0.5845
 epoch: 58, train_loss: 0.7612, test_loss: 0.9387, test_f1: 0.5705
 epoch: 59, train_loss: 0.7667, test_loss: 0.9224, test_f1: 0.5900
 epoch: 60, train_loss: 0.7624, test_loss: 0.9282, test_f1: 0.5905
 epoch: 61, train_loss: 0.7656, test_loss: 0.9421, test_f1: 0.5777
 epoch: 62, train_loss: 0.7626, test_loss: 0.9406, test_f1: 0.5960
 epoch: 63, train_loss: 0.7623, test_loss: 0.9463, test_f1: 0.5774
 epoch: 64, train_loss: 0.7435, test_loss: 0.9633, test_f1: 0.5878
 epoch: 65, train_loss: 0.7404, test_loss: 0.9373, test_f1: 0.5981
 epoch: 66, train_loss: 0.7406, test_loss: 0.9500, test_f1: 0.5841
 epoch: 67, train_loss: 0.7446, test_loss: 0.9332, test_f1: 0.5830
 epoch: 68, train_loss: 0.7428, test_loss: 0.9523, test_f1: 0.5807
 epoch: 69, train_loss: 0.7511, test_loss: 0.9534, test_f1: 0.5873
 epoch: 70, train_loss: 0.7458, test_loss: 0.9346, test_f1: 0.6078
 epoch: 71, train_loss: 0.7408, test_loss: 0.9304, test_f1: 0.5978
 epoch: 72, train_loss: 0.7401, test_loss: 0.9452, test_f1: 0.5952
 epoch: 73, train_loss: 0.7354, test_loss: 0.9520, test_f1: 0.6067
 epoch: 74, train_loss: 0.7413, test_loss: 0.9509, test_f1: 0.6040
 epoch: 75, train_loss: 0.7340, test_loss: 0.9550, test_f1: 0.5975
 epoch: 76, train_loss: 0.7262, test_loss: 0.9583, test_f1: 0.5903
 epoch: 77, train_loss: 0.7413, test_loss: 0.9585, test_f1: 0.5993
 epoch: 78, train_loss: 0.7374, test_loss: 0.9529, test_f1: 0.5992
 epoch: 79, train_loss: 0.7359, test_loss: 0.9457, test_f1: 0.5938
 epoch: 80, train_loss: 0.7350, test_loss: 0.9708, test_f1: 0.5878
 epoch: 81, train_loss: 0.7234, test_loss: 0.9703, test_f1: 0.6037
 epoch: 82, train_loss: 0.7267, test_loss: 0.9657, test_f1: 0.6126
 epoch: 83, train_loss: 0.7275, test_loss: 0.9626, test_f1: 0.5987
 epoch: 84, train_loss: 0.7193, test_loss: 0.9716, test_f1: 0.6198
 epoch: 85, train_loss: 0.7275, test_loss: 0.9568, test_f1: 0.6059
 epoch: 86, train_loss: 0.7271, test_loss: 0.9567, test_f1: 0.5990
 epoch: 87, train_loss: 0.7211, test_loss: 0.9479, test_f1: 0.5884
 epoch: 88, train_loss: 0.7218, test_loss: 0.9490, test_f1: 0.5995
 epoch: 89, train_loss: 0.7280, test_loss: 0.9469, test_f1: 0.6019
 epoch: 90, train_loss: 0.7203, test_loss: 0.9627, test_f1: 0.5986
 epoch: 91, train_loss: 0.7079, test_loss: 0.9586, test_f1: 0.6058
 epoch: 92, train_loss: 0.7224, test_loss: 0.9764, test_f1: 0.5975
 epoch: 93, train_loss: 0.7204, test_loss: 0.9811, test_f1: 0.5888
 epoch: 94, train_loss: 0.7224, test_loss: 0.9825, test_f1: 0.6031
 epoch: 95, train_loss: 0.7115, test_loss: 0.9639, test_f1: 0.6035
 epoch: 96, train_loss: 0.7131, test_loss: 0.9589, test_f1: 0.5910
 epoch: 97, train_loss: 0.7130, test_loss: 0.9782, test_f1: 0.6024
 epoch: 98, train_loss: 0.7152, test_loss: 0.9717, test_f1: 0.6029
 epoch: 99, train_loss: 0.7021, test_loss: 0.9595, test_f1: 0.6011
##################ITERATION #3 ****************************************
 epoch: 0, train_loss: 1.2595, test_loss: 1.1406, test_f1: 0.4369
 epoch: 1, train_loss: 1.1635, test_loss: 1.0913, test_f1: 0.4433
 epoch: 2, train_loss: 1.1215, test_loss: 1.0525, test_f1: 0.4470
 epoch: 3, train_loss: 1.0852, test_loss: 1.0170, test_f1: 0.4491
 epoch: 4, train_loss: 1.0575, test_loss: 0.9953, test_f1: 0.4500
 epoch: 5, train_loss: 1.0410, test_loss: 0.9891, test_f1: 0.4461
 epoch: 6, train_loss: 1.0120, test_loss: 0.9732, test_f1: 0.4773
 epoch: 7, train_loss: 0.9948, test_loss: 0.9480, test_f1: 0.4803
 epoch: 8, train_loss: 0.9926, test_loss: 0.9413, test_f1: 0.4937
 epoch: 9, train_loss: 0.9738, test_loss: 0.9487, test_f1: 0.4942
 epoch: 10, train_loss: 0.9606, test_loss: 0.9387, test_f1: 0.5020
 epoch: 11, train_loss: 0.9429, test_loss: 0.9240, test_f1: 0.5201
 epoch: 12, train_loss: 0.9324, test_loss: 0.9113, test_f1: 0.5165
 epoch: 13, train_loss: 0.9395, test_loss: 0.9489, test_f1: 0.5186
 epoch: 14, train_loss: 0.9273, test_loss: 0.9269, test_f1: 0.5277
 epoch: 15, train_loss: 0.9092, test_loss: 0.9271, test_f1: 0.5282
 epoch: 16, train_loss: 0.9165, test_loss: 0.9292, test_f1: 0.5199
 epoch: 17, train_loss: 0.9170, test_loss: 0.9467, test_f1: 0.5074
 epoch: 18, train_loss: 0.9110, test_loss: 0.9276, test_f1: 0.5185
 epoch: 19, train_loss: 0.8963, test_loss: 0.9435, test_f1: 0.5059
 epoch: 20, train_loss: 0.8992, test_loss: 0.9240, test_f1: 0.5123
 epoch: 21, train_loss: 0.8905, test_loss: 0.9480, test_f1: 0.5134
 epoch: 22, train_loss: 0.8925, test_loss: 0.9315, test_f1: 0.5043
 epoch: 23, train_loss: 0.8818, test_loss: 0.9143, test_f1: 0.5324
 epoch: 24, train_loss: 0.8676, test_loss: 0.9209, test_f1: 0.5263
 epoch: 25, train_loss: 0.8719, test_loss: 0.9081, test_f1: 0.5336
 epoch: 26, train_loss: 0.8722, test_loss: 0.9251, test_f1: 0.5350
 epoch: 27, train_loss: 0.8658, test_loss: 0.9378, test_f1: 0.5223
 epoch: 28, train_loss: 0.8565, test_loss: 0.9289, test_f1: 0.5538
 epoch: 29, train_loss: 0.8461, test_loss: 0.9372, test_f1: 0.5422
 epoch: 30, train_loss: 0.8384, test_loss: 0.9145, test_f1: 0.5587
 epoch: 31, train_loss: 0.8433, test_loss: 0.9151, test_f1: 0.5538
 epoch: 32, train_loss: 0.8480, test_loss: 0.9204, test_f1: 0.5373
 epoch: 33, train_loss: 0.8353, test_loss: 0.9264, test_f1: 0.5341
 epoch: 34, train_loss: 0.8321, test_loss: 0.9324, test_f1: 0.5445
 epoch: 35, train_loss: 0.8328, test_loss: 0.9403, test_f1: 0.5489
 epoch: 36, train_loss: 0.8392, test_loss: 0.9239, test_f1: 0.5497
 epoch: 37, train_loss: 0.8243, test_loss: 0.9229, test_f1: 0.5617
 epoch: 38, train_loss: 0.8277, test_loss: 0.9121, test_f1: 0.5671
 epoch: 39, train_loss: 0.8139, test_loss: 0.9122, test_f1: 0.5673
 epoch: 40, train_loss: 0.8116, test_loss: 0.9256, test_f1: 0.5606
 epoch: 41, train_loss: 0.8145, test_loss: 0.9117, test_f1: 0.5747
 epoch: 42, train_loss: 0.8066, test_loss: 0.9262, test_f1: 0.5690
 epoch: 43, train_loss: 0.8051, test_loss: 0.9286, test_f1: 0.5817
 epoch: 44, train_loss: 0.8127, test_loss: 0.9308, test_f1: 0.5853
 epoch: 45, train_loss: 0.8061, test_loss: 0.9281, test_f1: 0.5792
 epoch: 46, train_loss: 0.8049, test_loss: 0.9215, test_f1: 0.5781
 epoch: 47, train_loss: 0.7898, test_loss: 0.9247, test_f1: 0.5881
 epoch: 48, train_loss: 0.7816, test_loss: 0.9331, test_f1: 0.5628
 epoch: 49, train_loss: 0.7823, test_loss: 0.9365, test_f1: 0.5800
 epoch: 50, train_loss: 0.7930, test_loss: 0.9262, test_f1: 0.5769
 epoch: 51, train_loss: 0.7801, test_loss: 0.9427, test_f1: 0.5833
 epoch: 52, train_loss: 0.7710, test_loss: 0.9457, test_f1: 0.5710
 epoch: 53, train_loss: 0.7864, test_loss: 0.9195, test_f1: 0.5731
 epoch: 54, train_loss: 0.7731, test_loss: 0.9336, test_f1: 0.5883
 epoch: 55, train_loss: 0.7677, test_loss: 0.9348, test_f1: 0.5726
 epoch: 56, train_loss: 0.7612, test_loss: 0.9367, test_f1: 0.5784
 epoch: 57, train_loss: 0.7669, test_loss: 0.9504, test_f1: 0.5770
 epoch: 58, train_loss: 0.7730, test_loss: 0.9539, test_f1: 0.5636
 epoch: 59, train_loss: 0.7632, test_loss: 0.9581, test_f1: 0.5650
 epoch: 60, train_loss: 0.7580, test_loss: 0.9375, test_f1: 0.5749
 epoch: 61, train_loss: 0.7648, test_loss: 0.9470, test_f1: 0.5734
 epoch: 62, train_loss: 0.7457, test_loss: 0.9681, test_f1: 0.5589
 epoch: 63, train_loss: 0.7599, test_loss: 0.9291, test_f1: 0.6031
 epoch: 64, train_loss: 0.7641, test_loss: 0.9673, test_f1: 0.5568
 epoch: 65, train_loss: 0.7641, test_loss: 0.9407, test_f1: 0.5963
 epoch: 66, train_loss: 0.7584, test_loss: 0.9577, test_f1: 0.5805
 epoch: 67, train_loss: 0.7532, test_loss: 0.9465, test_f1: 0.5930
 epoch: 68, train_loss: 0.7436, test_loss: 0.9511, test_f1: 0.5848
 epoch: 69, train_loss: 0.7433, test_loss: 0.9533, test_f1: 0.5796
 epoch: 70, train_loss: 0.7410, test_loss: 0.9483, test_f1: 0.5878
 epoch: 71, train_loss: 0.7435, test_loss: 0.9742, test_f1: 0.5860
 epoch: 72, train_loss: 0.7471, test_loss: 0.9606, test_f1: 0.5819
 epoch: 73, train_loss: 0.7452, test_loss: 0.9547, test_f1: 0.5893
 epoch: 74, train_loss: 0.7350, test_loss: 0.9779, test_f1: 0.5541
 epoch: 75, train_loss: 0.7453, test_loss: 0.9533, test_f1: 0.5774
 epoch: 76, train_loss: 0.7361, test_loss: 0.9742, test_f1: 0.5702
 epoch: 77, train_loss: 0.7320, test_loss: 0.9577, test_f1: 0.5861
 epoch: 78, train_loss: 0.7235, test_loss: 0.9662, test_f1: 0.5747
 epoch: 79, train_loss: 0.7378, test_loss: 0.9654, test_f1: 0.5753
 epoch: 80, train_loss: 0.7278, test_loss: 0.9519, test_f1: 0.5747
 epoch: 81, train_loss: 0.7384, test_loss: 0.9691, test_f1: 0.5979
 epoch: 82, train_loss: 0.7283, test_loss: 0.9517, test_f1: 0.5768
 epoch: 83, train_loss: 0.7282, test_loss: 0.9702, test_f1: 0.5709
 epoch: 84, train_loss: 0.7327, test_loss: 0.9523, test_f1: 0.5883
 epoch: 85, train_loss: 0.7160, test_loss: 0.9729, test_f1: 0.5972
 epoch: 86, train_loss: 0.7203, test_loss: 0.9776, test_f1: 0.5876
 epoch: 87, train_loss: 0.7322, test_loss: 0.9480, test_f1: 0.5864
 epoch: 88, train_loss: 0.7301, test_loss: 0.9719, test_f1: 0.5831
 epoch: 89, train_loss: 0.7230, test_loss: 0.9570, test_f1: 0.5957
 epoch: 90, train_loss: 0.7217, test_loss: 0.9910, test_f1: 0.5644
 epoch: 91, train_loss: 0.7146, test_loss: 0.9729, test_f1: 0.5816
 epoch: 92, train_loss: 0.7130, test_loss: 0.9730, test_f1: 0.5945
 epoch: 93, train_loss: 0.7059, test_loss: 0.9645, test_f1: 0.5757
 epoch: 94, train_loss: 0.7106, test_loss: 1.0005, test_f1: 0.5901
 epoch: 95, train_loss: 0.7061, test_loss: 0.9923, test_f1: 0.6028
 epoch: 96, train_loss: 0.7058, test_loss: 0.9881, test_f1: 0.5682
 epoch: 97, train_loss: 0.6973, test_loss: 0.9968, test_f1: 0.5812
 epoch: 98, train_loss: 0.7138, test_loss: 0.9706, test_f1: 0.5946
 epoch: 99, train_loss: 0.7007, test_loss: 0.9941, test_f1: 0.5898
##################ITERATION #4 ****************************************
 epoch: 0, train_loss: 1.2697, test_loss: 1.1422, test_f1: 0.4028
 epoch: 1, train_loss: 1.1730, test_loss: 1.0952, test_f1: 0.4272
 epoch: 2, train_loss: 1.1261, test_loss: 1.0532, test_f1: 0.4739
 epoch: 3, train_loss: 1.0868, test_loss: 1.0262, test_f1: 0.4854
 epoch: 4, train_loss: 1.0596, test_loss: 1.0104, test_f1: 0.4949
 epoch: 5, train_loss: 1.0479, test_loss: 1.0277, test_f1: 0.4794
 epoch: 6, train_loss: 1.0299, test_loss: 0.9826, test_f1: 0.4815
 epoch: 7, train_loss: 1.0170, test_loss: 0.9762, test_f1: 0.5130
 epoch: 8, train_loss: 1.0052, test_loss: 0.9708, test_f1: 0.5133
 epoch: 9, train_loss: 0.9940, test_loss: 0.9507, test_f1: 0.5401
 epoch: 10, train_loss: 0.9899, test_loss: 0.9552, test_f1: 0.5176
 epoch: 11, train_loss: 0.9714, test_loss: 0.9633, test_f1: 0.5447
 epoch: 12, train_loss: 0.9631, test_loss: 0.9463, test_f1: 0.5277
 epoch: 13, train_loss: 0.9563, test_loss: 0.9326, test_f1: 0.5298
 epoch: 14, train_loss: 0.9529, test_loss: 0.9297, test_f1: 0.5308
 epoch: 15, train_loss: 0.9298, test_loss: 0.9096, test_f1: 0.5522
 epoch: 16, train_loss: 0.9238, test_loss: 0.9330, test_f1: 0.5373
 epoch: 17, train_loss: 0.9208, test_loss: 0.9178, test_f1: 0.5395
 epoch: 18, train_loss: 0.9212, test_loss: 0.9171, test_f1: 0.5276
 epoch: 19, train_loss: 0.9128, test_loss: 0.9390, test_f1: 0.5181
 epoch: 20, train_loss: 0.9095, test_loss: 0.9278, test_f1: 0.5369
 epoch: 21, train_loss: 0.8882, test_loss: 0.9171, test_f1: 0.5412
 epoch: 22, train_loss: 0.8870, test_loss: 0.9249, test_f1: 0.5426
 epoch: 23, train_loss: 0.8822, test_loss: 0.9126, test_f1: 0.5636
 epoch: 24, train_loss: 0.8840, test_loss: 0.9032, test_f1: 0.5706
 epoch: 25, train_loss: 0.8799, test_loss: 0.9289, test_f1: 0.5444
 epoch: 26, train_loss: 0.8757, test_loss: 0.9221, test_f1: 0.5578
 epoch: 27, train_loss: 0.8686, test_loss: 0.9186, test_f1: 0.5561
 epoch: 28, train_loss: 0.8675, test_loss: 0.9040, test_f1: 0.5648
 epoch: 29, train_loss: 0.8740, test_loss: 0.8978, test_f1: 0.5727
 epoch: 30, train_loss: 0.8669, test_loss: 0.9355, test_f1: 0.5550
 epoch: 31, train_loss: 0.8538, test_loss: 0.8952, test_f1: 0.5591
 epoch: 32, train_loss: 0.8551, test_loss: 0.9180, test_f1: 0.5606
 epoch: 33, train_loss: 0.8419, test_loss: 0.8996, test_f1: 0.5766
 epoch: 34, train_loss: 0.8484, test_loss: 0.9053, test_f1: 0.5416
 epoch: 35, train_loss: 0.8506, test_loss: 0.8943, test_f1: 0.5558
 epoch: 36, train_loss: 0.8330, test_loss: 0.9261, test_f1: 0.5706
 epoch: 37, train_loss: 0.8441, test_loss: 0.9122, test_f1: 0.5600
 epoch: 38, train_loss: 0.8293, test_loss: 0.9057, test_f1: 0.5743
 epoch: 39, train_loss: 0.8285, test_loss: 0.8868, test_f1: 0.5823
 epoch: 40, train_loss: 0.8361, test_loss: 0.8842, test_f1: 0.5818
 epoch: 41, train_loss: 0.8129, test_loss: 0.9199, test_f1: 0.5517
 epoch: 42, train_loss: 0.8076, test_loss: 0.8984, test_f1: 0.5696
 epoch: 43, train_loss: 0.8063, test_loss: 0.9522, test_f1: 0.5576
 epoch: 44, train_loss: 0.8135, test_loss: 0.8670, test_f1: 0.5565
 epoch: 45, train_loss: 0.8172, test_loss: 0.9001, test_f1: 0.5751
 epoch: 46, train_loss: 0.7968, test_loss: 0.9109, test_f1: 0.5647
 epoch: 47, train_loss: 0.7959, test_loss: 0.9034, test_f1: 0.5885
 epoch: 48, train_loss: 0.7952, test_loss: 0.9052, test_f1: 0.5758
 epoch: 49, train_loss: 0.7953, test_loss: 0.9031, test_f1: 0.5732
 epoch: 50, train_loss: 0.7935, test_loss: 0.8990, test_f1: 0.5763
 epoch: 51, train_loss: 0.7851, test_loss: 0.9023, test_f1: 0.5980
 epoch: 52, train_loss: 0.7830, test_loss: 0.9235, test_f1: 0.5887
 epoch: 53, train_loss: 0.7741, test_loss: 0.8988, test_f1: 0.5766
 epoch: 54, train_loss: 0.7786, test_loss: 0.9319, test_f1: 0.5946
 epoch: 55, train_loss: 0.7758, test_loss: 0.9119, test_f1: 0.5902
 epoch: 56, train_loss: 0.7750, test_loss: 0.9326, test_f1: 0.5900
 epoch: 57, train_loss: 0.7721, test_loss: 0.9244, test_f1: 0.5789
 epoch: 58, train_loss: 0.7630, test_loss: 0.9201, test_f1: 0.5824
 epoch: 59, train_loss: 0.7703, test_loss: 0.9280, test_f1: 0.5712
 epoch: 60, train_loss: 0.7727, test_loss: 0.9133, test_f1: 0.5809
 epoch: 61, train_loss: 0.7747, test_loss: 0.9252, test_f1: 0.5746
 epoch: 62, train_loss: 0.7695, test_loss: 0.9297, test_f1: 0.5732
 epoch: 63, train_loss: 0.7719, test_loss: 0.9258, test_f1: 0.5919
 epoch: 64, train_loss: 0.7538, test_loss: 0.9329, test_f1: 0.5743
 epoch: 65, train_loss: 0.7579, test_loss: 0.9464, test_f1: 0.5705
 epoch: 66, train_loss: 0.7623, test_loss: 0.9239, test_f1: 0.5773
 epoch: 67, train_loss: 0.7657, test_loss: 0.9242, test_f1: 0.5662
 epoch: 68, train_loss: 0.7467, test_loss: 0.9259, test_f1: 0.5791
 epoch: 69, train_loss: 0.7632, test_loss: 0.9431, test_f1: 0.5652
 epoch: 70, train_loss: 0.7556, test_loss: 0.9448, test_f1: 0.5615
 epoch: 71, train_loss: 0.7516, test_loss: 0.9198, test_f1: 0.5806
 epoch: 72, train_loss: 0.7487, test_loss: 0.9205, test_f1: 0.5927
 epoch: 73, train_loss: 0.7431, test_loss: 0.9283, test_f1: 0.5656
 epoch: 74, train_loss: 0.7507, test_loss: 0.9407, test_f1: 0.5719
 epoch: 75, train_loss: 0.7513, test_loss: 0.9347, test_f1: 0.5915
 epoch: 76, train_loss: 0.7380, test_loss: 0.9360, test_f1: 0.5831
 epoch: 77, train_loss: 0.7393, test_loss: 0.9374, test_f1: 0.5870
 epoch: 78, train_loss: 0.7403, test_loss: 0.9520, test_f1: 0.5782
 epoch: 79, train_loss: 0.7399, test_loss: 0.9620, test_f1: 0.5728
 epoch: 80, train_loss: 0.7373, test_loss: 0.9289, test_f1: 0.5823
 epoch: 81, train_loss: 0.7346, test_loss: 0.9891, test_f1: 0.5764
 epoch: 82, train_loss: 0.7464, test_loss: 0.9431, test_f1: 0.5905
 epoch: 83, train_loss: 0.7243, test_loss: 0.9313, test_f1: 0.6238
 epoch: 84, train_loss: 0.7214, test_loss: 0.9425, test_f1: 0.5925
 epoch: 85, train_loss: 0.7308, test_loss: 0.9178, test_f1: 0.6004
 epoch: 86, train_loss: 0.7288, test_loss: 0.9405, test_f1: 0.5802
 epoch: 87, train_loss: 0.7349, test_loss: 0.9183, test_f1: 0.5846
 epoch: 88, train_loss: 0.7291, test_loss: 0.9222, test_f1: 0.6080
 epoch: 89, train_loss: 0.7271, test_loss: 0.9137, test_f1: 0.5969
 epoch: 90, train_loss: 0.7243, test_loss: 0.9125, test_f1: 0.6169
 epoch: 91, train_loss: 0.7332, test_loss: 0.9224, test_f1: 0.6024
 epoch: 92, train_loss: 0.7209, test_loss: 0.9287, test_f1: 0.5844
 epoch: 93, train_loss: 0.7230, test_loss: 0.9078, test_f1: 0.5992
 epoch: 94, train_loss: 0.7232, test_loss: 0.8852, test_f1: 0.6019
 epoch: 95, train_loss: 0.7358, test_loss: 0.9104, test_f1: 0.5876
 epoch: 96, train_loss: 0.7233, test_loss: 0.9135, test_f1: 0.6047
 epoch: 97, train_loss: 0.7315, test_loss: 0.8964, test_f1: 0.5906
 epoch: 98, train_loss: 0.7176, test_loss: 0.9116, test_f1: 0.5926
 epoch: 99, train_loss: 0.7146, test_loss: 0.9125, test_f1: 0.6058
##################ITERATION #5 ****************************************
 epoch: 0, train_loss: 1.2698, test_loss: 1.1071, test_f1: 0.3903
 epoch: 1, train_loss: 1.1391, test_loss: 1.0648, test_f1: 0.3845
 epoch: 2, train_loss: 1.1046, test_loss: 1.0289, test_f1: 0.4157
 epoch: 3, train_loss: 1.0875, test_loss: 1.0364, test_f1: 0.4221
 epoch: 4, train_loss: 1.0793, test_loss: 1.0086, test_f1: 0.4449
 epoch: 5, train_loss: 1.0483, test_loss: 0.9962, test_f1: 0.4459
 epoch: 6, train_loss: 1.0290, test_loss: 0.9708, test_f1: 0.4473
 epoch: 7, train_loss: 1.0157, test_loss: 0.9730, test_f1: 0.4462
 epoch: 8, train_loss: 1.0005, test_loss: 0.9737, test_f1: 0.4672
 epoch: 9, train_loss: 0.9991, test_loss: 0.9595, test_f1: 0.4737
 epoch: 10, train_loss: 0.9918, test_loss: 0.9588, test_f1: 0.4716
 epoch: 11, train_loss: 0.9750, test_loss: 0.9500, test_f1: 0.4792
 epoch: 12, train_loss: 0.9572, test_loss: 0.9590, test_f1: 0.4774
 epoch: 13, train_loss: 0.9542, test_loss: 0.9503, test_f1: 0.4945
 epoch: 14, train_loss: 0.9547, test_loss: 0.9583, test_f1: 0.4804
 epoch: 15, train_loss: 0.9387, test_loss: 0.9814, test_f1: 0.4774
 epoch: 16, train_loss: 0.9257, test_loss: 0.9644, test_f1: 0.4758
 epoch: 17, train_loss: 0.9331, test_loss: 0.9495, test_f1: 0.5118
 epoch: 18, train_loss: 0.9272, test_loss: 0.9489, test_f1: 0.4985
 epoch: 19, train_loss: 0.9195, test_loss: 0.9471, test_f1: 0.5087
 epoch: 20, train_loss: 0.9164, test_loss: 0.9445, test_f1: 0.4941
 epoch: 21, train_loss: 0.9054, test_loss: 0.9292, test_f1: 0.5117
 epoch: 22, train_loss: 0.9047, test_loss: 0.9336, test_f1: 0.5299
 epoch: 23, train_loss: 0.9022, test_loss: 0.9511, test_f1: 0.5007
 epoch: 24, train_loss: 0.8948, test_loss: 0.9434, test_f1: 0.5173
 epoch: 25, train_loss: 0.8873, test_loss: 0.9559, test_f1: 0.4984
 epoch: 26, train_loss: 0.8828, test_loss: 0.9506, test_f1: 0.5253
 epoch: 27, train_loss: 0.8756, test_loss: 0.9453, test_f1: 0.5077
 epoch: 28, train_loss: 0.8762, test_loss: 0.9531, test_f1: 0.5146
 epoch: 29, train_loss: 0.8748, test_loss: 0.9646, test_f1: 0.5106
 epoch: 30, train_loss: 0.8724, test_loss: 0.9697, test_f1: 0.5073
 epoch: 31, train_loss: 0.8645, test_loss: 0.9598, test_f1: 0.5506
 epoch: 32, train_loss: 0.8626, test_loss: 0.9551, test_f1: 0.5105
 epoch: 33, train_loss: 0.8571, test_loss: 0.9682, test_f1: 0.5260
 epoch: 34, train_loss: 0.8575, test_loss: 0.9553, test_f1: 0.5315
 epoch: 35, train_loss: 0.8550, test_loss: 0.9782, test_f1: 0.5176
 epoch: 36, train_loss: 0.8445, test_loss: 0.9684, test_f1: 0.5278
 epoch: 37, train_loss: 0.8447, test_loss: 0.9728, test_f1: 0.5205
 epoch: 38, train_loss: 0.8331, test_loss: 0.9729, test_f1: 0.5175
 epoch: 39, train_loss: 0.8475, test_loss: 0.9737, test_f1: 0.5426
 epoch: 40, train_loss: 0.8402, test_loss: 0.9376, test_f1: 0.5344
 epoch: 41, train_loss: 0.8292, test_loss: 0.9530, test_f1: 0.5493
 epoch: 42, train_loss: 0.8267, test_loss: 0.9371, test_f1: 0.5683
 epoch: 43, train_loss: 0.8308, test_loss: 0.9654, test_f1: 0.5330
 epoch: 44, train_loss: 0.8289, test_loss: 0.9472, test_f1: 0.5620
 epoch: 45, train_loss: 0.8209, test_loss: 0.9574, test_f1: 0.5736
 epoch: 46, train_loss: 0.8182, test_loss: 0.9493, test_f1: 0.5554
 epoch: 47, train_loss: 0.8212, test_loss: 0.9448, test_f1: 0.5530
 epoch: 48, train_loss: 0.8156, test_loss: 0.9455, test_f1: 0.5609
 epoch: 49, train_loss: 0.8097, test_loss: 0.9819, test_f1: 0.5355
 epoch: 50, train_loss: 0.8043, test_loss: 0.9702, test_f1: 0.5566
 epoch: 51, train_loss: 0.8088, test_loss: 0.9732, test_f1: 0.5745
 epoch: 52, train_loss: 0.8088, test_loss: 0.9609, test_f1: 0.5712
 epoch: 53, train_loss: 0.7862, test_loss: 0.9479, test_f1: 0.5771
 epoch: 54, train_loss: 0.7866, test_loss: 0.9522, test_f1: 0.5906
 epoch: 55, train_loss: 0.7984, test_loss: 0.9548, test_f1: 0.5730
 epoch: 56, train_loss: 0.7896, test_loss: 0.9815, test_f1: 0.5635
 epoch: 57, train_loss: 0.7840, test_loss: 0.9621, test_f1: 0.5709
 epoch: 58, train_loss: 0.7758, test_loss: 0.9694, test_f1: 0.5770
 epoch: 59, train_loss: 0.7804, test_loss: 0.9746, test_f1: 0.5781
 epoch: 60, train_loss: 0.7766, test_loss: 0.9834, test_f1: 0.5769
 epoch: 61, train_loss: 0.7825, test_loss: 0.9729, test_f1: 0.5769
 epoch: 62, train_loss: 0.7803, test_loss: 0.9724, test_f1: 0.5814
 epoch: 63, train_loss: 0.7752, test_loss: 1.0064, test_f1: 0.5651
 epoch: 64, train_loss: 0.7699, test_loss: 0.9914, test_f1: 0.5658
 epoch: 65, train_loss: 0.7779, test_loss: 0.9625, test_f1: 0.5904
 epoch: 66, train_loss: 0.7675, test_loss: 0.9756, test_f1: 0.5821
 epoch: 67, train_loss: 0.7691, test_loss: 0.9723, test_f1: 0.5696
 epoch: 68, train_loss: 0.7625, test_loss: 0.9810, test_f1: 0.5870
 epoch: 69, train_loss: 0.7599, test_loss: 0.9771, test_f1: 0.5864
 epoch: 70, train_loss: 0.7654, test_loss: 0.9811, test_f1: 0.5855
 epoch: 71, train_loss: 0.7572, test_loss: 0.9782, test_f1: 0.5935
 epoch: 72, train_loss: 0.7666, test_loss: 0.9723, test_f1: 0.5871
 epoch: 73, train_loss: 0.7612, test_loss: 0.9696, test_f1: 0.5878
 epoch: 74, train_loss: 0.7638, test_loss: 0.9582, test_f1: 0.6101
 epoch: 75, train_loss: 0.7646, test_loss: 0.9677, test_f1: 0.5919
 epoch: 76, train_loss: 0.7486, test_loss: 0.9691, test_f1: 0.5775
 epoch: 77, train_loss: 0.7551, test_loss: 0.9862, test_f1: 0.5886
 epoch: 78, train_loss: 0.7606, test_loss: 0.9867, test_f1: 0.5850
 epoch: 79, train_loss: 0.7591, test_loss: 0.9711, test_f1: 0.5987
 epoch: 80, train_loss: 0.7671, test_loss: 0.9660, test_f1: 0.5772
 epoch: 81, train_loss: 0.7536, test_loss: 0.9936, test_f1: 0.5848
 epoch: 82, train_loss: 0.7354, test_loss: 0.9800, test_f1: 0.5997
 epoch: 83, train_loss: 0.7462, test_loss: 0.9665, test_f1: 0.6125
 epoch: 84, train_loss: 0.7629, test_loss: 0.9845, test_f1: 0.5861
 epoch: 85, train_loss: 0.7328, test_loss: 0.9799, test_f1: 0.5904
 epoch: 86, train_loss: 0.7436, test_loss: 0.9871, test_f1: 0.5957
 epoch: 87, train_loss: 0.7388, test_loss: 0.9879, test_f1: 0.5921
 epoch: 88, train_loss: 0.7370, test_loss: 1.0023, test_f1: 0.5957
 epoch: 89, train_loss: 0.7282, test_loss: 0.9791, test_f1: 0.5902
 epoch: 90, train_loss: 0.7416, test_loss: 0.9692, test_f1: 0.6032
 epoch: 91, train_loss: 0.7410, test_loss: 0.9947, test_f1: 0.5935
 epoch: 92, train_loss: 0.7353, test_loss: 0.9696, test_f1: 0.6069
 epoch: 93, train_loss: 0.7214, test_loss: 0.9891, test_f1: 0.6110
 epoch: 94, train_loss: 0.7329, test_loss: 0.9894, test_f1: 0.5887
 epoch: 95, train_loss: 0.7396, test_loss: 0.9900, test_f1: 0.6071
 epoch: 96, train_loss: 0.7318, test_loss: 0.9824, test_f1: 0.6111
 epoch: 97, train_loss: 0.7224, test_loss: 1.0049, test_f1: 0.5928
 epoch: 98, train_loss: 0.7260, test_loss: 0.9752, test_f1: 0.5903
 epoch: 99, train_loss: 0.7182, test_loss: 0.9821, test_f1: 0.5941
##################ITERATION #6 ****************************************
 epoch: 0, train_loss: 1.2505, test_loss: 1.1267, test_f1: 0.3387
 epoch: 1, train_loss: 1.1595, test_loss: 1.0737, test_f1: 0.4092
 epoch: 2, train_loss: 1.1150, test_loss: 1.0378, test_f1: 0.4451
 epoch: 3, train_loss: 1.0767, test_loss: 1.0129, test_f1: 0.4707
 epoch: 4, train_loss: 1.0461, test_loss: 0.9929, test_f1: 0.4680
 epoch: 5, train_loss: 1.0272, test_loss: 0.9819, test_f1: 0.4670
 epoch: 6, train_loss: 1.0181, test_loss: 0.9548, test_f1: 0.4734
 epoch: 7, train_loss: 1.0009, test_loss: 0.9444, test_f1: 0.4764
 epoch: 8, train_loss: 0.9839, test_loss: 0.9428, test_f1: 0.5078
 epoch: 9, train_loss: 0.9760, test_loss: 0.9430, test_f1: 0.5356
 epoch: 10, train_loss: 0.9703, test_loss: 0.9375, test_f1: 0.5087
 epoch: 11, train_loss: 0.9627, test_loss: 0.9583, test_f1: 0.5111
 epoch: 12, train_loss: 0.9509, test_loss: 0.9186, test_f1: 0.5229
 epoch: 13, train_loss: 0.9481, test_loss: 0.9219, test_f1: 0.5164
 epoch: 14, train_loss: 0.9385, test_loss: 0.9462, test_f1: 0.5213
 epoch: 15, train_loss: 0.9269, test_loss: 0.9411, test_f1: 0.5122
 epoch: 16, train_loss: 0.9190, test_loss: 0.9245, test_f1: 0.5138
 epoch: 17, train_loss: 0.9188, test_loss: 0.9467, test_f1: 0.5060
 epoch: 18, train_loss: 0.9158, test_loss: 0.9039, test_f1: 0.5289
 epoch: 19, train_loss: 0.9018, test_loss: 0.9228, test_f1: 0.5208
 epoch: 20, train_loss: 0.8987, test_loss: 0.9403, test_f1: 0.5138
 epoch: 21, train_loss: 0.8829, test_loss: 0.9291, test_f1: 0.5221
 epoch: 22, train_loss: 0.8940, test_loss: 0.9336, test_f1: 0.5031
 epoch: 23, train_loss: 0.8774, test_loss: 0.9410, test_f1: 0.5393
 epoch: 24, train_loss: 0.8718, test_loss: 0.9307, test_f1: 0.5681
 epoch: 25, train_loss: 0.8824, test_loss: 0.9393, test_f1: 0.5276
 epoch: 26, train_loss: 0.8789, test_loss: 0.9342, test_f1: 0.5735
 epoch: 27, train_loss: 0.8693, test_loss: 0.9245, test_f1: 0.5564
 epoch: 28, train_loss: 0.8661, test_loss: 0.9033, test_f1: 0.5581
 epoch: 29, train_loss: 0.8627, test_loss: 0.9522, test_f1: 0.5432
 epoch: 30, train_loss: 0.8559, test_loss: 0.9446, test_f1: 0.5500
 epoch: 31, train_loss: 0.8612, test_loss: 0.9543, test_f1: 0.5275
 epoch: 32, train_loss: 0.8492, test_loss: 0.9586, test_f1: 0.5348
 epoch: 33, train_loss: 0.8434, test_loss: 0.9452, test_f1: 0.5666
 epoch: 34, train_loss: 0.8363, test_loss: 0.9424, test_f1: 0.5875
 epoch: 35, train_loss: 0.8339, test_loss: 0.9307, test_f1: 0.5195
 epoch: 36, train_loss: 0.8486, test_loss: 0.9306, test_f1: 0.5744
 epoch: 37, train_loss: 0.8300, test_loss: 0.9457, test_f1: 0.5619
 epoch: 38, train_loss: 0.8345, test_loss: 0.9648, test_f1: 0.5582
 epoch: 39, train_loss: 0.8217, test_loss: 0.9651, test_f1: 0.5709
 epoch: 40, train_loss: 0.8252, test_loss: 0.9437, test_f1: 0.5917
 epoch: 41, train_loss: 0.8274, test_loss: 0.9488, test_f1: 0.5701
 epoch: 42, train_loss: 0.8139, test_loss: 0.9379, test_f1: 0.5941
 epoch: 43, train_loss: 0.8116, test_loss: 0.9368, test_f1: 0.5568
 epoch: 44, train_loss: 0.8115, test_loss: 0.9558, test_f1: 0.5353
 epoch: 45, train_loss: 0.8101, test_loss: 0.9579, test_f1: 0.5445
 epoch: 46, train_loss: 0.8065, test_loss: 0.9495, test_f1: 0.5720
 epoch: 47, train_loss: 0.7985, test_loss: 0.9428, test_f1: 0.5566
 epoch: 48, train_loss: 0.8069, test_loss: 0.9637, test_f1: 0.5796
 epoch: 49, train_loss: 0.7974, test_loss: 0.9413, test_f1: 0.6033
 epoch: 50, train_loss: 0.7986, test_loss: 0.9351, test_f1: 0.5664
 epoch: 51, train_loss: 0.7827, test_loss: 0.9294, test_f1: 0.5426
 epoch: 52, train_loss: 0.7798, test_loss: 0.9751, test_f1: 0.5448
 epoch: 53, train_loss: 0.7861, test_loss: 0.9324, test_f1: 0.5829
 epoch: 54, train_loss: 0.7773, test_loss: 0.9313, test_f1: 0.5633
 epoch: 55, train_loss: 0.7803, test_loss: 0.9354, test_f1: 0.5863
 epoch: 56, train_loss: 0.7698, test_loss: 0.9291, test_f1: 0.5920
 epoch: 57, train_loss: 0.7674, test_loss: 0.9484, test_f1: 0.5871
 epoch: 58, train_loss: 0.7749, test_loss: 0.9425, test_f1: 0.5807
 epoch: 59, train_loss: 0.7637, test_loss: 0.9634, test_f1: 0.5585
 epoch: 60, train_loss: 0.7630, test_loss: 0.9596, test_f1: 0.5800
 epoch: 61, train_loss: 0.7613, test_loss: 0.9790, test_f1: 0.5537
 epoch: 62, train_loss: 0.7657, test_loss: 0.9705, test_f1: 0.5663
 epoch: 63, train_loss: 0.7513, test_loss: 0.9574, test_f1: 0.5979
 epoch: 64, train_loss: 0.7587, test_loss: 0.9476, test_f1: 0.5780
 epoch: 65, train_loss: 0.7558, test_loss: 0.9493, test_f1: 0.5850
 epoch: 66, train_loss: 0.7649, test_loss: 0.9598, test_f1: 0.5979
 epoch: 67, train_loss: 0.7637, test_loss: 0.9497, test_f1: 0.5787
 epoch: 68, train_loss: 0.7590, test_loss: 0.9533, test_f1: 0.5854
 epoch: 69, train_loss: 0.7536, test_loss: 0.9839, test_f1: 0.5721
 epoch: 70, train_loss: 0.7555, test_loss: 0.9648, test_f1: 0.5977
 epoch: 71, train_loss: 0.7527, test_loss: 0.9673, test_f1: 0.5871
 epoch: 72, train_loss: 0.7586, test_loss: 0.9608, test_f1: 0.5826
 epoch: 73, train_loss: 0.7580, test_loss: 1.0082, test_f1: 0.5809
 epoch: 74, train_loss: 0.7490, test_loss: 0.9751, test_f1: 0.5966
 epoch: 75, train_loss: 0.7493, test_loss: 0.9731, test_f1: 0.5754
 epoch: 76, train_loss: 0.7416, test_loss: 0.9630, test_f1: 0.5549
 epoch: 77, train_loss: 0.7479, test_loss: 0.9657, test_f1: 0.5907
 epoch: 78, train_loss: 0.7400, test_loss: 0.9523, test_f1: 0.5935
 epoch: 79, train_loss: 0.7383, test_loss: 0.9574, test_f1: 0.5982
 epoch: 80, train_loss: 0.7381, test_loss: 0.9583, test_f1: 0.5867
 epoch: 81, train_loss: 0.7392, test_loss: 0.9746, test_f1: 0.5992
 epoch: 82, train_loss: 0.7296, test_loss: 0.9850, test_f1: 0.5915
 epoch: 83, train_loss: 0.7315, test_loss: 0.9706, test_f1: 0.6057
 epoch: 84, train_loss: 0.7414, test_loss: 0.9767, test_f1: 0.6008
 epoch: 85, train_loss: 0.7359, test_loss: 0.9901, test_f1: 0.6064
 epoch: 86, train_loss: 0.7356, test_loss: 0.9847, test_f1: 0.6038
 epoch: 87, train_loss: 0.7310, test_loss: 0.9774, test_f1: 0.6078
 epoch: 88, train_loss: 0.7267, test_loss: 0.9795, test_f1: 0.6192
 epoch: 89, train_loss: 0.7348, test_loss: 0.9832, test_f1: 0.6028
 epoch: 90, train_loss: 0.7273, test_loss: 0.9827, test_f1: 0.6102
 epoch: 91, train_loss: 0.7190, test_loss: 0.9555, test_f1: 0.5800
 epoch: 92, train_loss: 0.7214, test_loss: 0.9856, test_f1: 0.5865
 epoch: 93, train_loss: 0.7222, test_loss: 0.9763, test_f1: 0.5961
 epoch: 94, train_loss: 0.7132, test_loss: 0.9971, test_f1: 0.5887
 epoch: 95, train_loss: 0.7259, test_loss: 0.9816, test_f1: 0.5978
 epoch: 96, train_loss: 0.7146, test_loss: 0.9699, test_f1: 0.6032
 epoch: 97, train_loss: 0.7126, test_loss: 0.9825, test_f1: 0.6028
 epoch: 98, train_loss: 0.7311, test_loss: 0.9661, test_f1: 0.5937
 epoch: 99, train_loss: 0.7107, test_loss: 0.9712, test_f1: 0.5911
##################ITERATION #7 ****************************************
 epoch: 0, train_loss: 1.2900, test_loss: 1.1312, test_f1: 0.4095
 epoch: 1, train_loss: 1.1727, test_loss: 1.0802, test_f1: 0.4328
 epoch: 2, train_loss: 1.1345, test_loss: 1.0377, test_f1: 0.4817
 epoch: 3, train_loss: 1.0998, test_loss: 1.0202, test_f1: 0.4862
 epoch: 4, train_loss: 1.0752, test_loss: 1.0105, test_f1: 0.4959
 epoch: 5, train_loss: 1.0528, test_loss: 0.9939, test_f1: 0.4819
 epoch: 6, train_loss: 1.0436, test_loss: 0.9814, test_f1: 0.4990
 epoch: 7, train_loss: 1.0251, test_loss: 0.9798, test_f1: 0.4898
 epoch: 8, train_loss: 1.0070, test_loss: 0.9841, test_f1: 0.5150
 epoch: 9, train_loss: 0.9954, test_loss: 0.9549, test_f1: 0.4986
 epoch: 10, train_loss: 0.9788, test_loss: 0.9689, test_f1: 0.5064
 epoch: 11, train_loss: 0.9684, test_loss: 0.9404, test_f1: 0.5007
 epoch: 12, train_loss: 0.9702, test_loss: 0.9548, test_f1: 0.5218
 epoch: 13, train_loss: 0.9658, test_loss: 0.9607, test_f1: 0.5024
 epoch: 14, train_loss: 0.9528, test_loss: 0.9258, test_f1: 0.5218
 epoch: 15, train_loss: 0.9492, test_loss: 0.9569, test_f1: 0.4978
 epoch: 16, train_loss: 0.9289, test_loss: 0.9590, test_f1: 0.5037
 epoch: 17, train_loss: 0.9336, test_loss: 0.9735, test_f1: 0.4992
 epoch: 18, train_loss: 0.9289, test_loss: 0.9537, test_f1: 0.5120
 epoch: 19, train_loss: 0.9216, test_loss: 0.9492, test_f1: 0.4976
 epoch: 20, train_loss: 0.9135, test_loss: 0.9856, test_f1: 0.4984
 epoch: 21, train_loss: 0.9035, test_loss: 0.9536, test_f1: 0.5140
 epoch: 22, train_loss: 0.8958, test_loss: 0.9549, test_f1: 0.5069
 epoch: 23, train_loss: 0.9010, test_loss: 0.9625, test_f1: 0.5181
 epoch: 24, train_loss: 0.8893, test_loss: 0.9832, test_f1: 0.5108
 epoch: 25, train_loss: 0.8776, test_loss: 0.9631, test_f1: 0.5247
 epoch: 26, train_loss: 0.8829, test_loss: 0.9773, test_f1: 0.5230
 epoch: 27, train_loss: 0.8725, test_loss: 0.9864, test_f1: 0.5199
 epoch: 28, train_loss: 0.8807, test_loss: 0.9592, test_f1: 0.5198
 epoch: 29, train_loss: 0.8753, test_loss: 0.9797, test_f1: 0.5040
 epoch: 30, train_loss: 0.8655, test_loss: 0.9912, test_f1: 0.5168
 epoch: 31, train_loss: 0.8623, test_loss: 0.9784, test_f1: 0.5118
 epoch: 32, train_loss: 0.8536, test_loss: 0.9820, test_f1: 0.5261
 epoch: 33, train_loss: 0.8647, test_loss: 0.9752, test_f1: 0.5306
 epoch: 34, train_loss: 0.8427, test_loss: 0.9752, test_f1: 0.5403
 epoch: 35, train_loss: 0.8447, test_loss: 0.9775, test_f1: 0.5217
 epoch: 36, train_loss: 0.8447, test_loss: 0.9713, test_f1: 0.5278
 epoch: 37, train_loss: 0.8418, test_loss: 0.9937, test_f1: 0.5173
 epoch: 38, train_loss: 0.8290, test_loss: 0.9759, test_f1: 0.5370
 epoch: 39, train_loss: 0.8306, test_loss: 0.9789, test_f1: 0.5290
 epoch: 40, train_loss: 0.8281, test_loss: 0.9821, test_f1: 0.5298
 epoch: 41, train_loss: 0.8403, test_loss: 0.9827, test_f1: 0.5389
 epoch: 42, train_loss: 0.8369, test_loss: 0.9640, test_f1: 0.5446
 epoch: 43, train_loss: 0.8207, test_loss: 0.9770, test_f1: 0.5409
 epoch: 44, train_loss: 0.8175, test_loss: 0.9612, test_f1: 0.5398
 epoch: 45, train_loss: 0.8178, test_loss: 0.9595, test_f1: 0.5443
 epoch: 46, train_loss: 0.8053, test_loss: 0.9896, test_f1: 0.5521
 epoch: 47, train_loss: 0.8140, test_loss: 1.0240, test_f1: 0.5457
 epoch: 48, train_loss: 0.8019, test_loss: 0.9411, test_f1: 0.5592
 epoch: 49, train_loss: 0.8004, test_loss: 0.9515, test_f1: 0.5633
 epoch: 50, train_loss: 0.8051, test_loss: 0.9872, test_f1: 0.5560
 epoch: 51, train_loss: 0.7862, test_loss: 0.9541, test_f1: 0.5710
 epoch: 52, train_loss: 0.7960, test_loss: 0.9763, test_f1: 0.5493
 epoch: 53, train_loss: 0.7866, test_loss: 0.9586, test_f1: 0.5517
 epoch: 54, train_loss: 0.7836, test_loss: 0.9625, test_f1: 0.5572
 epoch: 55, train_loss: 0.7793, test_loss: 0.9718, test_f1: 0.5627
 epoch: 56, train_loss: 0.7785, test_loss: 0.9751, test_f1: 0.5545
 epoch: 57, train_loss: 0.7784, test_loss: 0.9645, test_f1: 0.5613
 epoch: 58, train_loss: 0.7687, test_loss: 0.9918, test_f1: 0.5504
 epoch: 59, train_loss: 0.7716, test_loss: 1.0022, test_f1: 0.5617
 epoch: 60, train_loss: 0.7737, test_loss: 0.9810, test_f1: 0.5624
 epoch: 61, train_loss: 0.7695, test_loss: 0.9836, test_f1: 0.5728
 epoch: 62, train_loss: 0.7738, test_loss: 0.9998, test_f1: 0.5584
 epoch: 63, train_loss: 0.7724, test_loss: 0.9731, test_f1: 0.5770
 epoch: 64, train_loss: 0.7671, test_loss: 0.9750, test_f1: 0.5553
 epoch: 65, train_loss: 0.7821, test_loss: 0.9902, test_f1: 0.5527
 epoch: 66, train_loss: 0.7574, test_loss: 0.9793, test_f1: 0.5604
 epoch: 67, train_loss: 0.7738, test_loss: 0.9745, test_f1: 0.5660
 epoch: 68, train_loss: 0.7577, test_loss: 0.9733, test_f1: 0.5900
 epoch: 69, train_loss: 0.7543, test_loss: 0.9702, test_f1: 0.5716
 epoch: 70, train_loss: 0.7639, test_loss: 0.9821, test_f1: 0.5803
 epoch: 71, train_loss: 0.7556, test_loss: 0.9817, test_f1: 0.5604
 epoch: 72, train_loss: 0.7520, test_loss: 0.9811, test_f1: 0.5660
 epoch: 73, train_loss: 0.7482, test_loss: 0.9751, test_f1: 0.5611
 epoch: 74, train_loss: 0.7603, test_loss: 0.9848, test_f1: 0.5731
 epoch: 75, train_loss: 0.7398, test_loss: 0.9861, test_f1: 0.5628
 epoch: 76, train_loss: 0.7506, test_loss: 0.9873, test_f1: 0.5702
 epoch: 77, train_loss: 0.7526, test_loss: 0.9808, test_f1: 0.5833
 epoch: 78, train_loss: 0.7521, test_loss: 0.9733, test_f1: 0.5766
 epoch: 79, train_loss: 0.7434, test_loss: 1.0103, test_f1: 0.5612
 epoch: 80, train_loss: 0.7448, test_loss: 1.0114, test_f1: 0.5705
 epoch: 81, train_loss: 0.7412, test_loss: 0.9805, test_f1: 0.5886
 epoch: 82, train_loss: 0.7226, test_loss: 0.9948, test_f1: 0.5935
 epoch: 83, train_loss: 0.7375, test_loss: 0.9984, test_f1: 0.5833
 epoch: 84, train_loss: 0.7435, test_loss: 0.9722, test_f1: 0.5824
 epoch: 85, train_loss: 0.7424, test_loss: 0.9771, test_f1: 0.5958
 epoch: 86, train_loss: 0.7535, test_loss: 1.0143, test_f1: 0.5796
 epoch: 87, train_loss: 0.7392, test_loss: 1.0171, test_f1: 0.5763
 epoch: 88, train_loss: 0.7304, test_loss: 0.9993, test_f1: 0.5917
 epoch: 89, train_loss: 0.7355, test_loss: 1.0058, test_f1: 0.5958
 epoch: 90, train_loss: 0.7260, test_loss: 0.9997, test_f1: 0.5779
 epoch: 91, train_loss: 0.7242, test_loss: 0.9981, test_f1: 0.5929
 epoch: 92, train_loss: 0.7224, test_loss: 0.9966, test_f1: 0.5833
 epoch: 93, train_loss: 0.7246, test_loss: 1.0075, test_f1: 0.5932
 epoch: 94, train_loss: 0.7341, test_loss: 1.0118, test_f1: 0.5920
 epoch: 95, train_loss: 0.7136, test_loss: 1.0072, test_f1: 0.5873
 epoch: 96, train_loss: 0.7223, test_loss: 1.0255, test_f1: 0.6000
 epoch: 97, train_loss: 0.7257, test_loss: 0.9965, test_f1: 0.5972
 epoch: 98, train_loss: 0.7215, test_loss: 0.9950, test_f1: 0.5963
 epoch: 99, train_loss: 0.7256, test_loss: 1.0235, test_f1: 0.5906
##################ITERATION #8 ****************************************
 epoch: 0, train_loss: 1.3035, test_loss: 1.1237, test_f1: 0.3761
 epoch: 1, train_loss: 1.1712, test_loss: 1.0912, test_f1: 0.4137
 epoch: 2, train_loss: 1.1189, test_loss: 1.0511, test_f1: 0.4146
 epoch: 3, train_loss: 1.0983, test_loss: 1.0235, test_f1: 0.4424
 epoch: 4, train_loss: 1.0749, test_loss: 1.0048, test_f1: 0.4538
 epoch: 5, train_loss: 1.0552, test_loss: 0.9875, test_f1: 0.4608
 epoch: 6, train_loss: 1.0469, test_loss: 0.9739, test_f1: 0.4628
 epoch: 7, train_loss: 1.0073, test_loss: 0.9707, test_f1: 0.4651
 epoch: 8, train_loss: 1.0160, test_loss: 0.9749, test_f1: 0.4867
 epoch: 9, train_loss: 0.9874, test_loss: 0.9612, test_f1: 0.4927
 epoch: 10, train_loss: 0.9784, test_loss: 0.9606, test_f1: 0.4987
 epoch: 11, train_loss: 0.9781, test_loss: 0.9773, test_f1: 0.4664
 epoch: 12, train_loss: 0.9642, test_loss: 0.9533, test_f1: 0.4909
 epoch: 13, train_loss: 0.9457, test_loss: 0.9512, test_f1: 0.5002
 epoch: 14, train_loss: 0.9460, test_loss: 0.9504, test_f1: 0.4874
 epoch: 15, train_loss: 0.9417, test_loss: 0.9505, test_f1: 0.5052
 epoch: 16, train_loss: 0.9343, test_loss: 0.9586, test_f1: 0.5074
 epoch: 17, train_loss: 0.9198, test_loss: 0.9513, test_f1: 0.4933
 epoch: 18, train_loss: 0.9244, test_loss: 0.9794, test_f1: 0.5147
 epoch: 19, train_loss: 0.9193, test_loss: 0.9601, test_f1: 0.5172
 epoch: 20, train_loss: 0.9126, test_loss: 0.9621, test_f1: 0.5093
 epoch: 21, train_loss: 0.9067, test_loss: 0.9716, test_f1: 0.4981
 epoch: 22, train_loss: 0.8906, test_loss: 0.9406, test_f1: 0.5116
 epoch: 23, train_loss: 0.8921, test_loss: 0.9722, test_f1: 0.5081
 epoch: 24, train_loss: 0.8818, test_loss: 0.9644, test_f1: 0.5041
 epoch: 25, train_loss: 0.8833, test_loss: 0.9622, test_f1: 0.5361
 epoch: 26, train_loss: 0.8639, test_loss: 0.9433, test_f1: 0.5160
 epoch: 27, train_loss: 0.8768, test_loss: 0.9563, test_f1: 0.5170
 epoch: 28, train_loss: 0.8658, test_loss: 0.9407, test_f1: 0.5212
 epoch: 29, train_loss: 0.8687, test_loss: 0.9479, test_f1: 0.5273
 epoch: 30, train_loss: 0.8587, test_loss: 0.9727, test_f1: 0.5496
 epoch: 31, train_loss: 0.8555, test_loss: 0.9498, test_f1: 0.5285
 epoch: 32, train_loss: 0.8534, test_loss: 0.9732, test_f1: 0.5249
 epoch: 33, train_loss: 0.8501, test_loss: 0.9558, test_f1: 0.5413
 epoch: 34, train_loss: 0.8472, test_loss: 0.9506, test_f1: 0.5577
 epoch: 35, train_loss: 0.8482, test_loss: 0.9666, test_f1: 0.5264
 epoch: 36, train_loss: 0.8384, test_loss: 0.9872, test_f1: 0.5069
 epoch: 37, train_loss: 0.8391, test_loss: 0.9655, test_f1: 0.5441
 epoch: 38, train_loss: 0.8316, test_loss: 0.9648, test_f1: 0.5177
 epoch: 39, train_loss: 0.8249, test_loss: 0.9596, test_f1: 0.5290
 epoch: 40, train_loss: 0.8216, test_loss: 0.9734, test_f1: 0.5528
 epoch: 41, train_loss: 0.8132, test_loss: 0.9928, test_f1: 0.5274
 epoch: 42, train_loss: 0.8203, test_loss: 0.9842, test_f1: 0.5329
 epoch: 43, train_loss: 0.8160, test_loss: 0.9752, test_f1: 0.5373
 epoch: 44, train_loss: 0.8062, test_loss: 0.9570, test_f1: 0.5668
 epoch: 45, train_loss: 0.8122, test_loss: 0.9777, test_f1: 0.5258
 epoch: 46, train_loss: 0.8034, test_loss: 0.9891, test_f1: 0.5306
 epoch: 47, train_loss: 0.8028, test_loss: 0.9850, test_f1: 0.5349
 epoch: 48, train_loss: 0.7906, test_loss: 0.9854, test_f1: 0.5446
 epoch: 49, train_loss: 0.7968, test_loss: 0.9795, test_f1: 0.5305
 epoch: 50, train_loss: 0.7853, test_loss: 1.0100, test_f1: 0.5216
 epoch: 51, train_loss: 0.7881, test_loss: 0.9720, test_f1: 0.5555
 epoch: 52, train_loss: 0.7832, test_loss: 0.9852, test_f1: 0.5561
 epoch: 53, train_loss: 0.7893, test_loss: 0.9756, test_f1: 0.5614
 epoch: 54, train_loss: 0.7788, test_loss: 1.0089, test_f1: 0.5546
 epoch: 55, train_loss: 0.7793, test_loss: 1.0050, test_f1: 0.5530
 epoch: 56, train_loss: 0.7822, test_loss: 0.9932, test_f1: 0.5399
 epoch: 57, train_loss: 0.7742, test_loss: 0.9798, test_f1: 0.5473
 epoch: 58, train_loss: 0.7635, test_loss: 0.9900, test_f1: 0.5597
 epoch: 59, train_loss: 0.7687, test_loss: 1.0039, test_f1: 0.5304
 epoch: 60, train_loss: 0.7793, test_loss: 0.9945, test_f1: 0.5437
 epoch: 61, train_loss: 0.7598, test_loss: 1.0039, test_f1: 0.5366
 epoch: 62, train_loss: 0.7655, test_loss: 0.9892, test_f1: 0.5603
 epoch: 63, train_loss: 0.7702, test_loss: 1.0053, test_f1: 0.5478
 epoch: 64, train_loss: 0.7574, test_loss: 0.9768, test_f1: 0.5497
 epoch: 65, train_loss: 0.7643, test_loss: 1.0122, test_f1: 0.5551
 epoch: 66, train_loss: 0.7463, test_loss: 0.9847, test_f1: 0.5496
 epoch: 67, train_loss: 0.7611, test_loss: 0.9722, test_f1: 0.5680
 epoch: 68, train_loss: 0.7522, test_loss: 0.9933, test_f1: 0.5613
 epoch: 69, train_loss: 0.7614, test_loss: 0.9952, test_f1: 0.5663
 epoch: 70, train_loss: 0.7590, test_loss: 1.0123, test_f1: 0.5381
 epoch: 71, train_loss: 0.7474, test_loss: 0.9813, test_f1: 0.5697
 epoch: 72, train_loss: 0.7393, test_loss: 0.9890, test_f1: 0.5590
 epoch: 73, train_loss: 0.7446, test_loss: 0.9930, test_f1: 0.5558
 epoch: 74, train_loss: 0.7391, test_loss: 1.0001, test_f1: 0.5439
 epoch: 75, train_loss: 0.7448, test_loss: 1.0031, test_f1: 0.5548
 epoch: 76, train_loss: 0.7387, test_loss: 0.9886, test_f1: 0.5540
 epoch: 77, train_loss: 0.7398, test_loss: 0.9908, test_f1: 0.5611
 epoch: 78, train_loss: 0.7421, test_loss: 0.9998, test_f1: 0.5634
 epoch: 79, train_loss: 0.7401, test_loss: 0.9979, test_f1: 0.5482
 epoch: 80, train_loss: 0.7468, test_loss: 0.9932, test_f1: 0.5529
 epoch: 81, train_loss: 0.7330, test_loss: 0.9943, test_f1: 0.5725
 epoch: 82, train_loss: 0.7249, test_loss: 1.0108, test_f1: 0.5576
 epoch: 83, train_loss: 0.7356, test_loss: 1.0172, test_f1: 0.5620
 epoch: 84, train_loss: 0.7335, test_loss: 0.9829, test_f1: 0.5653
 epoch: 85, train_loss: 0.7306, test_loss: 0.9737, test_f1: 0.5839
 epoch: 86, train_loss: 0.7313, test_loss: 0.9833, test_f1: 0.5675
 epoch: 87, train_loss: 0.7239, test_loss: 0.9918, test_f1: 0.5530
 epoch: 88, train_loss: 0.7297, test_loss: 0.9965, test_f1: 0.5738
 epoch: 89, train_loss: 0.7358, test_loss: 1.0032, test_f1: 0.5583
 epoch: 90, train_loss: 0.7275, test_loss: 0.9980, test_f1: 0.5807
 epoch: 91, train_loss: 0.7306, test_loss: 0.9945, test_f1: 0.5794
 epoch: 92, train_loss: 0.7176, test_loss: 0.9972, test_f1: 0.5851
 epoch: 93, train_loss: 0.7183, test_loss: 1.0020, test_f1: 0.5683
 epoch: 94, train_loss: 0.7039, test_loss: 1.0033, test_f1: 0.5871
 epoch: 95, train_loss: 0.7242, test_loss: 0.9979, test_f1: 0.5604
 epoch: 96, train_loss: 0.7214, test_loss: 1.0102, test_f1: 0.5551
 epoch: 97, train_loss: 0.7284, test_loss: 1.0101, test_f1: 0.5778
 epoch: 98, train_loss: 0.7151, test_loss: 1.0007, test_f1: 0.5701
 epoch: 99, train_loss: 0.7185, test_loss: 1.0153, test_f1: 0.5683
##################ITERATION #9 ****************************************
 epoch: 0, train_loss: 1.2784, test_loss: 1.1045, test_f1: 0.4035
 epoch: 1, train_loss: 1.1571, test_loss: 1.0749, test_f1: 0.4156
 epoch: 2, train_loss: 1.1215, test_loss: 1.0515, test_f1: 0.4098
 epoch: 3, train_loss: 1.1133, test_loss: 1.0167, test_f1: 0.4493
 epoch: 4, train_loss: 1.0817, test_loss: 1.0138, test_f1: 0.4520
 epoch: 5, train_loss: 1.0482, test_loss: 0.9740, test_f1: 0.4874
 epoch: 6, train_loss: 1.0377, test_loss: 0.9811, test_f1: 0.4786
 epoch: 7, train_loss: 1.0183, test_loss: 0.9779, test_f1: 0.4850
 epoch: 8, train_loss: 1.0115, test_loss: 0.9584, test_f1: 0.5067
 epoch: 9, train_loss: 1.0024, test_loss: 1.0007, test_f1: 0.4761
 epoch: 10, train_loss: 0.9832, test_loss: 0.9863, test_f1: 0.5070
 epoch: 11, train_loss: 0.9814, test_loss: 0.9561, test_f1: 0.5162
 epoch: 12, train_loss: 0.9684, test_loss: 0.9345, test_f1: 0.5115
 epoch: 13, train_loss: 0.9561, test_loss: 0.9393, test_f1: 0.5128
 epoch: 14, train_loss: 0.9443, test_loss: 0.9242, test_f1: 0.5297
 epoch: 15, train_loss: 0.9427, test_loss: 0.9340, test_f1: 0.5115
 epoch: 16, train_loss: 0.9386, test_loss: 0.9275, test_f1: 0.5208
 epoch: 17, train_loss: 0.9406, test_loss: 0.9308, test_f1: 0.5364
 epoch: 18, train_loss: 0.9214, test_loss: 0.9228, test_f1: 0.5258
 epoch: 19, train_loss: 0.9235, test_loss: 0.9335, test_f1: 0.5335
 epoch: 20, train_loss: 0.9052, test_loss: 0.9374, test_f1: 0.5226
 epoch: 21, train_loss: 0.9097, test_loss: 0.9224, test_f1: 0.5246
 epoch: 22, train_loss: 0.9083, test_loss: 0.9135, test_f1: 0.5216
 epoch: 23, train_loss: 0.9064, test_loss: 0.8978, test_f1: 0.5402
 epoch: 24, train_loss: 0.8915, test_loss: 0.9162, test_f1: 0.5433
 epoch: 25, train_loss: 0.8886, test_loss: 0.8974, test_f1: 0.5435
 epoch: 26, train_loss: 0.8829, test_loss: 0.9346, test_f1: 0.5360
 epoch: 27, train_loss: 0.8798, test_loss: 0.9165, test_f1: 0.5382
 epoch: 28, train_loss: 0.8758, test_loss: 0.9276, test_f1: 0.5316
 epoch: 29, train_loss: 0.8606, test_loss: 0.9295, test_f1: 0.5416
 epoch: 30, train_loss: 0.8623, test_loss: 0.9231, test_f1: 0.5512
 epoch: 31, train_loss: 0.8729, test_loss: 0.9328, test_f1: 0.5460
 epoch: 32, train_loss: 0.8630, test_loss: 0.9141, test_f1: 0.5379
 epoch: 33, train_loss: 0.8604, test_loss: 0.9071, test_f1: 0.5478
 epoch: 34, train_loss: 0.8580, test_loss: 0.9177, test_f1: 0.5479
 epoch: 35, train_loss: 0.8538, test_loss: 0.8845, test_f1: 0.5483
 epoch: 36, train_loss: 0.8655, test_loss: 0.9048, test_f1: 0.5496
 epoch: 37, train_loss: 0.8370, test_loss: 0.8973, test_f1: 0.5640
 epoch: 38, train_loss: 0.8308, test_loss: 0.9084, test_f1: 0.5659
 epoch: 39, train_loss: 0.8342, test_loss: 0.8904, test_f1: 0.5624
 epoch: 40, train_loss: 0.8413, test_loss: 0.9264, test_f1: 0.5536
 epoch: 41, train_loss: 0.8305, test_loss: 0.9133, test_f1: 0.5652
 epoch: 42, train_loss: 0.8302, test_loss: 0.8916, test_f1: 0.5715
 epoch: 43, train_loss: 0.8315, test_loss: 0.9213, test_f1: 0.5697
 epoch: 44, train_loss: 0.8216, test_loss: 0.8916, test_f1: 0.5696
 epoch: 45, train_loss: 0.8147, test_loss: 0.9233, test_f1: 0.5626
 epoch: 46, train_loss: 0.8153, test_loss: 0.9313, test_f1: 0.5605
 epoch: 47, train_loss: 0.8071, test_loss: 0.9284, test_f1: 0.5652
 epoch: 48, train_loss: 0.8132, test_loss: 0.9296, test_f1: 0.5773
 epoch: 49, train_loss: 0.7973, test_loss: 0.9389, test_f1: 0.5802
 epoch: 50, train_loss: 0.7981, test_loss: 0.9121, test_f1: 0.5851
 epoch: 51, train_loss: 0.7959, test_loss: 0.9195, test_f1: 0.5679
 epoch: 52, train_loss: 0.8018, test_loss: 0.9273, test_f1: 0.5730
 epoch: 53, train_loss: 0.7862, test_loss: 0.9272, test_f1: 0.5668
 epoch: 54, train_loss: 0.7853, test_loss: 0.9426, test_f1: 0.5723
 epoch: 55, train_loss: 0.7853, test_loss: 0.9344, test_f1: 0.5862
 epoch: 56, train_loss: 0.7854, test_loss: 0.9284, test_f1: 0.5761
 epoch: 57, train_loss: 0.7848, test_loss: 0.9051, test_f1: 0.5912
 epoch: 58, train_loss: 0.7774, test_loss: 0.9244, test_f1: 0.5781
 epoch: 59, train_loss: 0.7877, test_loss: 0.9244, test_f1: 0.5826
 epoch: 60, train_loss: 0.7587, test_loss: 0.9312, test_f1: 0.5845
 epoch: 61, train_loss: 0.7675, test_loss: 0.9192, test_f1: 0.5858
 epoch: 62, train_loss: 0.7645, test_loss: 0.9230, test_f1: 0.5890
 epoch: 63, train_loss: 0.7606, test_loss: 0.9418, test_f1: 0.5660
 epoch: 64, train_loss: 0.7615, test_loss: 0.9452, test_f1: 0.5844
 epoch: 65, train_loss: 0.7685, test_loss: 0.9402, test_f1: 0.5887
 epoch: 66, train_loss: 0.7765, test_loss: 0.9259, test_f1: 0.5767
 epoch: 67, train_loss: 0.7723, test_loss: 0.9319, test_f1: 0.5829
 epoch: 68, train_loss: 0.7695, test_loss: 0.9324, test_f1: 0.5823
 epoch: 69, train_loss: 0.7580, test_loss: 0.9253, test_f1: 0.5800
 epoch: 70, train_loss: 0.7633, test_loss: 0.9230, test_f1: 0.5855
 epoch: 71, train_loss: 0.7583, test_loss: 0.9446, test_f1: 0.5683
 epoch: 72, train_loss: 0.7481, test_loss: 0.9053, test_f1: 0.5819
 epoch: 73, train_loss: 0.7522, test_loss: 0.9150, test_f1: 0.5916
 epoch: 74, train_loss: 0.7501, test_loss: 0.9147, test_f1: 0.6036
 epoch: 75, train_loss: 0.7551, test_loss: 0.9207, test_f1: 0.5847
 epoch: 76, train_loss: 0.7477, test_loss: 0.9150, test_f1: 0.5903
 epoch: 77, train_loss: 0.7370, test_loss: 0.9206, test_f1: 0.5788
 epoch: 78, train_loss: 0.7559, test_loss: 0.9222, test_f1: 0.5783
 epoch: 79, train_loss: 0.7513, test_loss: 0.9245, test_f1: 0.5913
 epoch: 80, train_loss: 0.7515, test_loss: 0.9134, test_f1: 0.5914
 epoch: 81, train_loss: 0.7517, test_loss: 0.9068, test_f1: 0.6011
 epoch: 82, train_loss: 0.7351, test_loss: 0.9199, test_f1: 0.5746
 epoch: 83, train_loss: 0.7480, test_loss: 0.9204, test_f1: 0.5953
 epoch: 84, train_loss: 0.7244, test_loss: 0.9544, test_f1: 0.5889
 epoch: 85, train_loss: 0.7332, test_loss: 0.9371, test_f1: 0.5860
 epoch: 86, train_loss: 0.7282, test_loss: 0.9236, test_f1: 0.5957
 epoch: 87, train_loss: 0.7256, test_loss: 0.9514, test_f1: 0.5995
 epoch: 88, train_loss: 0.7414, test_loss: 0.9339, test_f1: 0.6086
 epoch: 89, train_loss: 0.7234, test_loss: 0.9358, test_f1: 0.5871
 epoch: 90, train_loss: 0.7445, test_loss: 0.9282, test_f1: 0.5980
 epoch: 91, train_loss: 0.7272, test_loss: 0.9292, test_f1: 0.5860
 epoch: 92, train_loss: 0.7292, test_loss: 0.9429, test_f1: 0.5909
 epoch: 93, train_loss: 0.7161, test_loss: 0.9082, test_f1: 0.5988
 epoch: 94, train_loss: 0.7350, test_loss: 0.9113, test_f1: 0.5945
 epoch: 95, train_loss: 0.7287, test_loss: 0.9322, test_f1: 0.5923
 epoch: 96, train_loss: 0.7240, test_loss: 0.9311, test_f1: 0.5982
 epoch: 97, train_loss: 0.7235, test_loss: 0.9403, test_f1: 0.5892
 epoch: 98, train_loss: 0.7227, test_loss: 0.9323, test_f1: 0.5981
 epoch: 99, train_loss: 0.7152, test_loss: 0.9354, test_f1: 0.6049

Training completed in 1273.76 seconds
Best F1: 0.6238 at epoch 83
Mean F1 across iterations: 0.6069  0.0127
========================FINAL RESULTS================================
FEGIN weighted F1: 0.6238  0.0127
python main.py --data ltspice_examples --representation component_net --model FEGIN --layers 5 --hiddens 64 --batch_size 32 --lr 0.0001 --emb_size 250 --epochs 100 --save_appendix component_net_L5_H64_BS32_LR0.0001_E250 --no_val
-----



STDERR:
  File "main.py", line 370, in <module>
    main()
  File "main.py", line 254, in main
    dataset = dataset_class(
  File "/home/philip/projects/ltspice_examples_code_repo/Circuit-Completion-Using-GNNs/component_classification_with_link_prediction_head/evaluation/FEGIN/kernel/circuit_datasets.py", line 15, in __init__
    self.data, self.slices = torch.load(self.processed_paths[0])
  File "/home/philip/.local/lib/python3.8/site-packages/torch/serialization.py", line 1040, in load
    warnings.warn(
  File "/usr/lib/python3.8/warnings.py", line 109, in _showwarnmsg
    sw(msg.message, msg.category, msg.filename, msg.lineno,
  File "main.py", line 47, in warn_with_traceback
    traceback.print_stack(file=log)
/home/philip/projects/ltspice_examples_code_repo/Circuit-Completion-Using-GNNs/component_classification_with_link_prediction_head/evaluation/FEGIN/kernel/circuit_datasets.py:15: FutureWarning: You are using `torch.load` with `weights_only=False` (the current default value), which uses the default pickle module implicitly. It is possible to construct malicious pickle data which will execute arbitrary code during unpickling (See https://github.com/pytorch/pytorch/blob/main/SECURITY.md#untrusted-models for more details). In a future release, the default value for `weights_only` will be flipped to `True`. This limits the functions that could be executed during unpickling. Arbitrary objects will no longer be allowed to be loaded via this mode unless they are explicitly allowlisted by the user via `torch.serialization.add_safe_globals`. We recommend you start setting `weights_only=True` for any use case where you don't have full control of the loaded file. Please open an issue on GitHub for any issues related to this experimental feature.
  self.data, self.slices = torch.load(self.processed_paths[0])
