STDOUT:
Results will be saved in /home/philip/projects/ltspice_examples_code_repo/Circuit-Completion-Using-GNNs/component_classification_with_link_prediction_head/evaluation/FEGIN/results/model_FEGIN_dataset_ltspice_examples
Command line input: python main.py --data ltspice_examples --representation component_component --model FEGIN --layers 5 --hiddens 128 --batch_size 256 --lr 0.001 --emb_size 250 --epochs 100 --save_appendix component_component_L5_H128_BS256_LR0.001_E250 --no_val
 is saved.
-----
ltspice_examples - FEGIN
Using 5 layers, 128 hidden units, h = 2
Loading component_component representation dataset
ENTERED
Training FEGIN on component_component representation
Train: 3556, Test: 845
##################ITERATION #0 ****************************************
 epoch: 0, train_loss: 1.3155, test_loss: 1.2869, test_f1: 0.2589
 epoch: 1, train_loss: 1.2021, test_loss: 1.2020, test_f1: 0.3656
 epoch: 2, train_loss: 1.1479, test_loss: 1.1322, test_f1: 0.3830
 epoch: 3, train_loss: 1.1015, test_loss: 1.0783, test_f1: 0.4687
 epoch: 4, train_loss: 1.0487, test_loss: 1.0057, test_f1: 0.5031
 epoch: 5, train_loss: 0.9979, test_loss: 1.0099, test_f1: 0.4916
 epoch: 6, train_loss: 0.9521, test_loss: 0.9763, test_f1: 0.5153
 epoch: 7, train_loss: 0.9178, test_loss: 1.0318, test_f1: 0.4955
 epoch: 8, train_loss: 0.8972, test_loss: 1.0174, test_f1: 0.4795
 epoch: 9, train_loss: 0.8671, test_loss: 1.0502, test_f1: 0.4903
 epoch: 10, train_loss: 0.8420, test_loss: 1.0231, test_f1: 0.4728
 epoch: 11, train_loss: 0.8270, test_loss: 1.1250, test_f1: 0.4632
 epoch: 12, train_loss: 0.8097, test_loss: 1.1441, test_f1: 0.5099
 epoch: 13, train_loss: 0.7874, test_loss: 1.1058, test_f1: 0.5256
 epoch: 14, train_loss: 0.7591, test_loss: 1.0591, test_f1: 0.5025
 epoch: 15, train_loss: 0.7382, test_loss: 1.2000, test_f1: 0.4784
 epoch: 16, train_loss: 0.7287, test_loss: 1.1456, test_f1: 0.5136
 epoch: 17, train_loss: 0.7006, test_loss: 1.3308, test_f1: 0.5122
 epoch: 18, train_loss: 0.6970, test_loss: 1.1623, test_f1: 0.5265
 epoch: 19, train_loss: 0.7034, test_loss: 1.2555, test_f1: 0.5343
 epoch: 20, train_loss: 0.6798, test_loss: 1.3277, test_f1: 0.4729
 epoch: 21, train_loss: 0.6547, test_loss: 1.2731, test_f1: 0.5186
 epoch: 22, train_loss: 0.6305, test_loss: 1.4047, test_f1: 0.5134
 epoch: 23, train_loss: 0.6083, test_loss: 1.3023, test_f1: 0.5298
 epoch: 24, train_loss: 0.5979, test_loss: 1.3775, test_f1: 0.5343
 epoch: 25, train_loss: 0.5832, test_loss: 1.3007, test_f1: 0.5527
 epoch: 26, train_loss: 0.5678, test_loss: 1.4749, test_f1: 0.5161
 epoch: 27, train_loss: 0.5775, test_loss: 1.5313, test_f1: 0.5317
 epoch: 28, train_loss: 0.5592, test_loss: 1.5851, test_f1: 0.5002
 epoch: 29, train_loss: 0.5426, test_loss: 1.5607, test_f1: 0.5343
 epoch: 30, train_loss: 0.5343, test_loss: 1.4900, test_f1: 0.5112
 epoch: 31, train_loss: 0.5328, test_loss: 1.7365, test_f1: 0.5122
 epoch: 32, train_loss: 0.5252, test_loss: 1.3941, test_f1: 0.5353
 epoch: 33, train_loss: 0.4950, test_loss: 1.4605, test_f1: 0.5140
 epoch: 34, train_loss: 0.4983, test_loss: 1.7905, test_f1: 0.4880
 epoch: 35, train_loss: 0.4714, test_loss: 1.5184, test_f1: 0.5566
 epoch: 36, train_loss: 0.4657, test_loss: 1.6167, test_f1: 0.5368
 epoch: 37, train_loss: 0.4540, test_loss: 1.6804, test_f1: 0.5201
 epoch: 38, train_loss: 0.4811, test_loss: 1.6733, test_f1: 0.5304
 epoch: 39, train_loss: 0.4789, test_loss: 1.9522, test_f1: 0.5247
 epoch: 40, train_loss: 0.4499, test_loss: 1.7005, test_f1: 0.5276
 epoch: 41, train_loss: 0.4038, test_loss: 1.7973, test_f1: 0.5396
 epoch: 42, train_loss: 0.4225, test_loss: 1.9684, test_f1: 0.4861
 epoch: 43, train_loss: 0.4458, test_loss: 1.7142, test_f1: 0.5388
 epoch: 44, train_loss: 0.4150, test_loss: 1.9503, test_f1: 0.5120
 epoch: 45, train_loss: 0.4078, test_loss: 2.0753, test_f1: 0.5177
 epoch: 46, train_loss: 0.4415, test_loss: 1.7445, test_f1: 0.5152
 epoch: 47, train_loss: 0.4420, test_loss: 1.9754, test_f1: 0.5376
 epoch: 48, train_loss: 0.4186, test_loss: 1.8417, test_f1: 0.5107
 epoch: 49, train_loss: 0.4032, test_loss: 2.0205, test_f1: 0.5246
 epoch: 50, train_loss: 0.3711, test_loss: 2.0275, test_f1: 0.5317
 epoch: 51, train_loss: 0.3392, test_loss: 1.9958, test_f1: 0.5287
 epoch: 52, train_loss: 0.2980, test_loss: 2.1568, test_f1: 0.5321
 epoch: 53, train_loss: 0.2795, test_loss: 2.1556, test_f1: 0.5194
 epoch: 54, train_loss: 0.2841, test_loss: 2.2164, test_f1: 0.5405
 epoch: 55, train_loss: 0.2595, test_loss: 2.3351, test_f1: 0.4891
 epoch: 56, train_loss: 0.2618, test_loss: 2.2679, test_f1: 0.5079
 epoch: 57, train_loss: 0.2535, test_loss: 2.2062, test_f1: 0.5331
 epoch: 58, train_loss: 0.2626, test_loss: 2.4177, test_f1: 0.5083
 epoch: 59, train_loss: 0.2546, test_loss: 2.6447, test_f1: 0.5089
 epoch: 60, train_loss: 0.2488, test_loss: 2.5132, test_f1: 0.5281
 epoch: 61, train_loss: 0.2430, test_loss: 2.5220, test_f1: 0.5298
 epoch: 62, train_loss: 0.2417, test_loss: 2.7250, test_f1: 0.5076
 epoch: 63, train_loss: 0.2381, test_loss: 2.6815, test_f1: 0.5364
 epoch: 64, train_loss: 0.2494, test_loss: 2.5255, test_f1: 0.5295
 epoch: 65, train_loss: 0.2299, test_loss: 2.4226, test_f1: 0.5230
 epoch: 66, train_loss: 0.2293, test_loss: 2.6387, test_f1: 0.5147
 epoch: 67, train_loss: 0.2327, test_loss: 2.6161, test_f1: 0.4868
 epoch: 68, train_loss: 0.2221, test_loss: 3.0089, test_f1: 0.4934
 epoch: 69, train_loss: 0.2232, test_loss: 2.6863, test_f1: 0.5263
 epoch: 70, train_loss: 0.2085, test_loss: 2.7096, test_f1: 0.5248
 epoch: 71, train_loss: 0.2221, test_loss: 2.9556, test_f1: 0.5221
 epoch: 72, train_loss: 0.2078, test_loss: 2.6711, test_f1: 0.5287
 epoch: 73, train_loss: 0.2139, test_loss: 2.6063, test_f1: 0.5582
 epoch: 74, train_loss: 0.2121, test_loss: 2.8891, test_f1: 0.5304
 epoch: 75, train_loss: 0.2009, test_loss: 2.7830, test_f1: 0.5496
 epoch: 76, train_loss: 0.1935, test_loss: 2.9840, test_f1: 0.5060
 epoch: 77, train_loss: 0.1998, test_loss: 2.7343, test_f1: 0.5353
 epoch: 78, train_loss: 0.2002, test_loss: 2.8306, test_f1: 0.5354
 epoch: 79, train_loss: 0.1928, test_loss: 2.9573, test_f1: 0.5266
 epoch: 80, train_loss: 0.1931, test_loss: 3.1702, test_f1: 0.5276
 epoch: 81, train_loss: 0.2026, test_loss: 3.0345, test_f1: 0.5117
 epoch: 82, train_loss: 0.1920, test_loss: 3.0656, test_f1: 0.5157
 epoch: 83, train_loss: 0.1958, test_loss: 3.1741, test_f1: 0.4822
 epoch: 84, train_loss: 0.1780, test_loss: 3.1604, test_f1: 0.5286
 epoch: 85, train_loss: 0.1797, test_loss: 3.1092, test_f1: 0.5419
 epoch: 86, train_loss: 0.1619, test_loss: 3.2512, test_f1: 0.5232
 epoch: 87, train_loss: 0.1733, test_loss: 3.4114, test_f1: 0.5183
 epoch: 88, train_loss: 0.1690, test_loss: 2.9557, test_f1: 0.5214
 epoch: 89, train_loss: 0.1597, test_loss: 3.4685, test_f1: 0.5072
 epoch: 90, train_loss: 0.1583, test_loss: 3.2687, test_f1: 0.5353
 epoch: 91, train_loss: 0.1598, test_loss: 3.3598, test_f1: 0.5222
 epoch: 92, train_loss: 0.1525, test_loss: 3.4224, test_f1: 0.5379
 epoch: 93, train_loss: 0.1510, test_loss: 3.2619, test_f1: 0.5533
 epoch: 94, train_loss: 0.1577, test_loss: 3.2983, test_f1: 0.5318
 epoch: 95, train_loss: 0.1773, test_loss: 3.4624, test_f1: 0.5266
 epoch: 96, train_loss: 0.1811, test_loss: 3.5409, test_f1: 0.5049
 epoch: 97, train_loss: 0.1747, test_loss: 3.5085, test_f1: 0.5300
 epoch: 98, train_loss: 0.1699, test_loss: 3.3660, test_f1: 0.5429
 epoch: 99, train_loss: 0.1499, test_loss: 3.3070, test_f1: 0.4949
##################ITERATION #1 ****************************************
 epoch: 0, train_loss: 1.2435, test_loss: 1.2664, test_f1: 0.2555
 epoch: 1, train_loss: 1.1240, test_loss: 1.1636, test_f1: 0.4082
 epoch: 2, train_loss: 1.0601, test_loss: 1.0722, test_f1: 0.4338
 epoch: 3, train_loss: 1.0255, test_loss: 1.0488, test_f1: 0.4651
 epoch: 4, train_loss: 0.9856, test_loss: 1.0066, test_f1: 0.4844
 epoch: 5, train_loss: 0.9498, test_loss: 0.9983, test_f1: 0.5026
 epoch: 6, train_loss: 0.8983, test_loss: 1.0516, test_f1: 0.4646
 epoch: 7, train_loss: 0.8628, test_loss: 1.0896, test_f1: 0.4977
 epoch: 8, train_loss: 0.8584, test_loss: 1.1188, test_f1: 0.5226
 epoch: 9, train_loss: 0.8168, test_loss: 1.0975, test_f1: 0.4999
 epoch: 10, train_loss: 0.8088, test_loss: 1.1275, test_f1: 0.5095
 epoch: 11, train_loss: 0.8025, test_loss: 1.2322, test_f1: 0.4879
 epoch: 12, train_loss: 0.7820, test_loss: 1.3043, test_f1: 0.4653
 epoch: 13, train_loss: 0.7713, test_loss: 1.1896, test_f1: 0.5140
 epoch: 14, train_loss: 0.7414, test_loss: 1.1358, test_f1: 0.5300
 epoch: 15, train_loss: 0.7016, test_loss: 1.0952, test_f1: 0.5197
 epoch: 16, train_loss: 0.7089, test_loss: 1.2560, test_f1: 0.4930
 epoch: 17, train_loss: 0.6898, test_loss: 1.4221, test_f1: 0.5020
 epoch: 18, train_loss: 0.6616, test_loss: 1.3047, test_f1: 0.5156
 epoch: 19, train_loss: 0.6629, test_loss: 1.7557, test_f1: 0.5098
 epoch: 20, train_loss: 0.6538, test_loss: 1.4345, test_f1: 0.5176
 epoch: 21, train_loss: 0.6212, test_loss: 1.2800, test_f1: 0.5393
 epoch: 22, train_loss: 0.5950, test_loss: 1.3753, test_f1: 0.5297
 epoch: 23, train_loss: 0.5991, test_loss: 2.0076, test_f1: 0.5008
 epoch: 24, train_loss: 0.6170, test_loss: 1.5097, test_f1: 0.5327
 epoch: 25, train_loss: 0.5605, test_loss: 1.6324, test_f1: 0.5067
 epoch: 26, train_loss: 0.5458, test_loss: 1.6637, test_f1: 0.5078
 epoch: 27, train_loss: 0.5414, test_loss: 1.6497, test_f1: 0.5234
 epoch: 28, train_loss: 0.5630, test_loss: 1.5391, test_f1: 0.5093
 epoch: 29, train_loss: 0.5202, test_loss: 1.5311, test_f1: 0.5338
 epoch: 30, train_loss: 0.5039, test_loss: 1.5925, test_f1: 0.5438
 epoch: 31, train_loss: 0.5084, test_loss: 1.7276, test_f1: 0.5104
 epoch: 32, train_loss: 0.4988, test_loss: 1.8366, test_f1: 0.5455
 epoch: 33, train_loss: 0.4917, test_loss: 1.8273, test_f1: 0.5058
 epoch: 34, train_loss: 0.4841, test_loss: 2.2820, test_f1: 0.5307
 epoch: 35, train_loss: 0.4876, test_loss: 1.7457, test_f1: 0.5408
 epoch: 36, train_loss: 0.4829, test_loss: 1.7150, test_f1: 0.5598
 epoch: 37, train_loss: 0.4457, test_loss: 1.7844, test_f1: 0.5312
 epoch: 38, train_loss: 0.4544, test_loss: 1.9320, test_f1: 0.5083
 epoch: 39, train_loss: 0.4384, test_loss: 1.7702, test_f1: 0.5537
 epoch: 40, train_loss: 0.4146, test_loss: 1.8789, test_f1: 0.5121
 epoch: 41, train_loss: 0.4368, test_loss: 2.2281, test_f1: 0.4989
 epoch: 42, train_loss: 0.4217, test_loss: 1.8810, test_f1: 0.5436
 epoch: 43, train_loss: 0.4142, test_loss: 1.8978, test_f1: 0.5263
 epoch: 44, train_loss: 0.3861, test_loss: 2.1254, test_f1: 0.5254
 epoch: 45, train_loss: 0.3929, test_loss: 2.0299, test_f1: 0.5057
 epoch: 46, train_loss: 0.4120, test_loss: 2.0476, test_f1: 0.5253
 epoch: 47, train_loss: 0.3971, test_loss: 1.8743, test_f1: 0.5579
 epoch: 48, train_loss: 0.3848, test_loss: 2.4336, test_f1: 0.5132
 epoch: 49, train_loss: 0.3723, test_loss: 2.0565, test_f1: 0.5034
 epoch: 50, train_loss: 0.3935, test_loss: 2.1418, test_f1: 0.5422
 epoch: 51, train_loss: 0.3334, test_loss: 2.3089, test_f1: 0.5186
 epoch: 52, train_loss: 0.2987, test_loss: 2.2466, test_f1: 0.5349
 epoch: 53, train_loss: 0.2779, test_loss: 2.2748, test_f1: 0.5357
 epoch: 54, train_loss: 0.2587, test_loss: 2.3340, test_f1: 0.5380
 epoch: 55, train_loss: 0.2489, test_loss: 2.5218, test_f1: 0.5395
 epoch: 56, train_loss: 0.2488, test_loss: 2.6294, test_f1: 0.5432
 epoch: 57, train_loss: 0.2624, test_loss: 2.4157, test_f1: 0.5393
 epoch: 58, train_loss: 0.2478, test_loss: 2.6570, test_f1: 0.5246
 epoch: 59, train_loss: 0.2482, test_loss: 2.7143, test_f1: 0.5171
 epoch: 60, train_loss: 0.2430, test_loss: 3.1114, test_f1: 0.5206
 epoch: 61, train_loss: 0.2141, test_loss: 2.7993, test_f1: 0.5191
 epoch: 62, train_loss: 0.2313, test_loss: 2.9237, test_f1: 0.5320
 epoch: 63, train_loss: 0.2229, test_loss: 2.7004, test_f1: 0.5330
 epoch: 64, train_loss: 0.2244, test_loss: 2.8169, test_f1: 0.5428
 epoch: 65, train_loss: 0.2065, test_loss: 3.1362, test_f1: 0.5079
 epoch: 66, train_loss: 0.2157, test_loss: 3.0748, test_f1: 0.5237
 epoch: 67, train_loss: 0.1936, test_loss: 3.0862, test_f1: 0.5230
 epoch: 68, train_loss: 0.1938, test_loss: 3.0365, test_f1: 0.5379
 epoch: 69, train_loss: 0.2006, test_loss: 3.0013, test_f1: 0.5559
 epoch: 70, train_loss: 0.2018, test_loss: 3.1976, test_f1: 0.5300
 epoch: 71, train_loss: 0.2168, test_loss: 3.1061, test_f1: 0.5248
 epoch: 72, train_loss: 0.2079, test_loss: 3.0318, test_f1: 0.5136
 epoch: 73, train_loss: 0.2036, test_loss: 3.2710, test_f1: 0.5145
 epoch: 74, train_loss: 0.2017, test_loss: 3.2537, test_f1: 0.5496
 epoch: 75, train_loss: 0.2107, test_loss: 3.0864, test_f1: 0.5416
 epoch: 76, train_loss: 0.1974, test_loss: 2.9646, test_f1: 0.5547
 epoch: 77, train_loss: 0.1981, test_loss: 3.2467, test_f1: 0.5222
 epoch: 78, train_loss: 0.1905, test_loss: 3.1444, test_f1: 0.5325
 epoch: 79, train_loss: 0.1826, test_loss: 3.3752, test_f1: 0.5284
 epoch: 80, train_loss: 0.1673, test_loss: 3.3406, test_f1: 0.5257
 epoch: 81, train_loss: 0.1830, test_loss: 3.1279, test_f1: 0.5333
 epoch: 82, train_loss: 0.1680, test_loss: 3.3637, test_f1: 0.5189
 epoch: 83, train_loss: 0.1708, test_loss: 3.2599, test_f1: 0.5340
 epoch: 84, train_loss: 0.1858, test_loss: 3.2278, test_f1: 0.5248
 epoch: 85, train_loss: 0.1735, test_loss: 3.2803, test_f1: 0.5404
 epoch: 86, train_loss: 0.1616, test_loss: 3.2418, test_f1: 0.5374
 epoch: 87, train_loss: 0.1644, test_loss: 3.4561, test_f1: 0.5266
 epoch: 88, train_loss: 0.1610, test_loss: 3.4512, test_f1: 0.5168
 epoch: 89, train_loss: 0.1584, test_loss: 3.3586, test_f1: 0.5361
 epoch: 90, train_loss: 0.1616, test_loss: 3.4170, test_f1: 0.5203
 epoch: 91, train_loss: 0.1592, test_loss: 3.5616, test_f1: 0.5468
 epoch: 92, train_loss: 0.1630, test_loss: 3.5999, test_f1: 0.5253
 epoch: 93, train_loss: 0.1787, test_loss: 3.7369, test_f1: 0.5270
 epoch: 94, train_loss: 0.1819, test_loss: 3.5266, test_f1: 0.5309
 epoch: 95, train_loss: 0.1786, test_loss: 3.5882, test_f1: 0.5068
 epoch: 96, train_loss: 0.1674, test_loss: 3.3944, test_f1: 0.5368
 epoch: 97, train_loss: 0.1587, test_loss: 3.3192, test_f1: 0.5376
 epoch: 98, train_loss: 0.1402, test_loss: 3.6547, test_f1: 0.5433
 epoch: 99, train_loss: 0.1411, test_loss: 3.8677, test_f1: 0.5264
##################ITERATION #2 ****************************************
 epoch: 0, train_loss: 1.2782, test_loss: 1.2676, test_f1: 0.2904
 epoch: 1, train_loss: 1.1440, test_loss: 1.2226, test_f1: 0.3810
 epoch: 2, train_loss: 1.0907, test_loss: 1.1649, test_f1: 0.4184
 epoch: 3, train_loss: 1.0475, test_loss: 1.0577, test_f1: 0.4327
 epoch: 4, train_loss: 1.0031, test_loss: 1.0105, test_f1: 0.5047
 epoch: 5, train_loss: 0.9742, test_loss: 1.0249, test_f1: 0.4645
 epoch: 6, train_loss: 0.9527, test_loss: 1.0280, test_f1: 0.4940
 epoch: 7, train_loss: 0.9263, test_loss: 0.9518, test_f1: 0.5271
 epoch: 8, train_loss: 0.9044, test_loss: 1.0648, test_f1: 0.4930
 epoch: 9, train_loss: 0.8928, test_loss: 0.9896, test_f1: 0.5027
 epoch: 10, train_loss: 0.8723, test_loss: 1.0239, test_f1: 0.5035
 epoch: 11, train_loss: 0.8351, test_loss: 1.0548, test_f1: 0.4925
 epoch: 12, train_loss: 0.8102, test_loss: 0.9731, test_f1: 0.5454
 epoch: 13, train_loss: 0.8264, test_loss: 1.1664, test_f1: 0.4627
 epoch: 14, train_loss: 0.8076, test_loss: 1.1815, test_f1: 0.4991
 epoch: 15, train_loss: 0.7791, test_loss: 1.1149, test_f1: 0.4925
 epoch: 16, train_loss: 0.7634, test_loss: 1.1418, test_f1: 0.4889
 epoch: 17, train_loss: 0.7628, test_loss: 1.1339, test_f1: 0.5028
 epoch: 18, train_loss: 0.7518, test_loss: 1.1442, test_f1: 0.4933
 epoch: 19, train_loss: 0.7404, test_loss: 1.5158, test_f1: 0.4971
 epoch: 20, train_loss: 0.7122, test_loss: 1.2200, test_f1: 0.4900
 epoch: 21, train_loss: 0.6985, test_loss: 1.2900, test_f1: 0.5281
 epoch: 22, train_loss: 0.6808, test_loss: 1.3432, test_f1: 0.4977
 epoch: 23, train_loss: 0.6825, test_loss: 1.2612, test_f1: 0.5042
 epoch: 24, train_loss: 0.6792, test_loss: 1.2224, test_f1: 0.4890
 epoch: 25, train_loss: 0.6640, test_loss: 1.4107, test_f1: 0.5044
 epoch: 26, train_loss: 0.6603, test_loss: 1.1704, test_f1: 0.5559
 epoch: 27, train_loss: 0.6199, test_loss: 1.3335, test_f1: 0.5023
 epoch: 28, train_loss: 0.6119, test_loss: 1.6865, test_f1: 0.4752
 epoch: 29, train_loss: 0.5914, test_loss: 1.4003, test_f1: 0.5338
 epoch: 30, train_loss: 0.5896, test_loss: 1.4589, test_f1: 0.5256
 epoch: 31, train_loss: 0.5774, test_loss: 1.5469, test_f1: 0.4935
 epoch: 32, train_loss: 0.5771, test_loss: 1.5227, test_f1: 0.5323
 epoch: 33, train_loss: 0.5457, test_loss: 1.3594, test_f1: 0.5397
 epoch: 34, train_loss: 0.5399, test_loss: 1.6511, test_f1: 0.5047
 epoch: 35, train_loss: 0.5244, test_loss: 1.5501, test_f1: 0.5143
 epoch: 36, train_loss: 0.5341, test_loss: 1.4237, test_f1: 0.5201
 epoch: 37, train_loss: 0.5123, test_loss: 1.5489, test_f1: 0.5453
 epoch: 38, train_loss: 0.4973, test_loss: 1.7954, test_f1: 0.5286
 epoch: 39, train_loss: 0.4999, test_loss: 1.6400, test_f1: 0.5027
 epoch: 40, train_loss: 0.5111, test_loss: 1.4338, test_f1: 0.5523
 epoch: 41, train_loss: 0.5085, test_loss: 1.7821, test_f1: 0.4920
 epoch: 42, train_loss: 0.5030, test_loss: 1.7173, test_f1: 0.5127
 epoch: 43, train_loss: 0.4847, test_loss: 1.8020, test_f1: 0.5174
 epoch: 44, train_loss: 0.4994, test_loss: 1.6358, test_f1: 0.5319
 epoch: 45, train_loss: 0.4835, test_loss: 1.7385, test_f1: 0.5261
 epoch: 46, train_loss: 0.4864, test_loss: 1.9308, test_f1: 0.4996
 epoch: 47, train_loss: 0.4745, test_loss: 2.0629, test_f1: 0.5130
 epoch: 48, train_loss: 0.4728, test_loss: 1.7146, test_f1: 0.5036
 epoch: 49, train_loss: 0.4191, test_loss: 1.8431, test_f1: 0.5265
 epoch: 50, train_loss: 0.4086, test_loss: 2.1445, test_f1: 0.5142
 epoch: 51, train_loss: 0.3920, test_loss: 1.8932, test_f1: 0.5150
 epoch: 52, train_loss: 0.3638, test_loss: 1.9050, test_f1: 0.5511
 epoch: 53, train_loss: 0.3530, test_loss: 2.0267, test_f1: 0.5386
 epoch: 54, train_loss: 0.3273, test_loss: 2.0120, test_f1: 0.5180
 epoch: 55, train_loss: 0.3192, test_loss: 2.1776, test_f1: 0.5280
 epoch: 56, train_loss: 0.3230, test_loss: 2.2428, test_f1: 0.5092
 epoch: 57, train_loss: 0.3280, test_loss: 2.1675, test_f1: 0.5390
 epoch: 58, train_loss: 0.3102, test_loss: 2.2864, test_f1: 0.5117
 epoch: 59, train_loss: 0.3239, test_loss: 2.5458, test_f1: 0.5266
 epoch: 60, train_loss: 0.3146, test_loss: 2.3684, test_f1: 0.5470
 epoch: 61, train_loss: 0.2926, test_loss: 2.2683, test_f1: 0.5365
 epoch: 62, train_loss: 0.2829, test_loss: 2.3339, test_f1: 0.5140
 epoch: 63, train_loss: 0.2744, test_loss: 2.4328, test_f1: 0.5297
 epoch: 64, train_loss: 0.2781, test_loss: 2.5295, test_f1: 0.5202
 epoch: 65, train_loss: 0.2730, test_loss: 2.3503, test_f1: 0.5074
 epoch: 66, train_loss: 0.2725, test_loss: 2.5860, test_f1: 0.5239
 epoch: 67, train_loss: 0.2742, test_loss: 2.6780, test_f1: 0.4999
 epoch: 68, train_loss: 0.2931, test_loss: 2.5642, test_f1: 0.5339
 epoch: 69, train_loss: 0.2821, test_loss: 2.5076, test_f1: 0.5103
 epoch: 70, train_loss: 0.2670, test_loss: 2.7100, test_f1: 0.5311
 epoch: 71, train_loss: 0.2715, test_loss: 2.7057, test_f1: 0.5167
 epoch: 72, train_loss: 0.2595, test_loss: 2.8697, test_f1: 0.5294
 epoch: 73, train_loss: 0.2536, test_loss: 2.5481, test_f1: 0.5490
 epoch: 74, train_loss: 0.2359, test_loss: 2.5319, test_f1: 0.5311
 epoch: 75, train_loss: 0.2517, test_loss: 2.5437, test_f1: 0.5207
 epoch: 76, train_loss: 0.2254, test_loss: 2.7809, test_f1: 0.5251
 epoch: 77, train_loss: 0.2435, test_loss: 2.6026, test_f1: 0.5423
 epoch: 78, train_loss: 0.2549, test_loss: 2.7786, test_f1: 0.5035
 epoch: 79, train_loss: 0.2301, test_loss: 2.8162, test_f1: 0.5130
 epoch: 80, train_loss: 0.2462, test_loss: 2.9247, test_f1: 0.5170
 epoch: 81, train_loss: 0.2397, test_loss: 2.7710, test_f1: 0.5190
 epoch: 82, train_loss: 0.2420, test_loss: 2.8814, test_f1: 0.5310
 epoch: 83, train_loss: 0.2326, test_loss: 2.6865, test_f1: 0.5469
 epoch: 84, train_loss: 0.2334, test_loss: 2.7533, test_f1: 0.5333
 epoch: 85, train_loss: 0.2344, test_loss: 3.0541, test_f1: 0.5187
 epoch: 86, train_loss: 0.2352, test_loss: 2.5925, test_f1: 0.5396
 epoch: 87, train_loss: 0.2174, test_loss: 2.9511, test_f1: 0.5340
 epoch: 88, train_loss: 0.2240, test_loss: 2.9482, test_f1: 0.5233
 epoch: 89, train_loss: 0.2129, test_loss: 2.9110, test_f1: 0.5396
 epoch: 90, train_loss: 0.2083, test_loss: 3.2064, test_f1: 0.5206
 epoch: 91, train_loss: 0.2132, test_loss: 3.0480, test_f1: 0.5252
 epoch: 92, train_loss: 0.2037, test_loss: 2.8700, test_f1: 0.5232
 epoch: 93, train_loss: 0.2097, test_loss: 3.0170, test_f1: 0.5048
 epoch: 94, train_loss: 0.2052, test_loss: 3.1542, test_f1: 0.5191
 epoch: 95, train_loss: 0.1916, test_loss: 3.1048, test_f1: 0.5287
 epoch: 96, train_loss: 0.2050, test_loss: 2.8631, test_f1: 0.5279
 epoch: 97, train_loss: 0.1962, test_loss: 2.9091, test_f1: 0.5411
 epoch: 98, train_loss: 0.1912, test_loss: 2.9740, test_f1: 0.5585
 epoch: 99, train_loss: 0.2084, test_loss: 2.6503, test_f1: 0.5282
##################ITERATION #3 ****************************************
 epoch: 0, train_loss: 1.3143, test_loss: 1.2539, test_f1: 0.3473
 epoch: 1, train_loss: 1.1446, test_loss: 1.1840, test_f1: 0.4149
 epoch: 2, train_loss: 1.1053, test_loss: 1.1108, test_f1: 0.4143
 epoch: 3, train_loss: 1.0513, test_loss: 1.0725, test_f1: 0.4608
 epoch: 4, train_loss: 1.0278, test_loss: 1.0338, test_f1: 0.4472
 epoch: 5, train_loss: 0.9828, test_loss: 1.0436, test_f1: 0.4891
 epoch: 6, train_loss: 0.9472, test_loss: 0.9686, test_f1: 0.5113
 epoch: 7, train_loss: 0.9277, test_loss: 1.0235, test_f1: 0.4953
 epoch: 8, train_loss: 0.9053, test_loss: 1.0343, test_f1: 0.4853
 epoch: 9, train_loss: 0.8842, test_loss: 1.0792, test_f1: 0.5055
 epoch: 10, train_loss: 0.8643, test_loss: 1.0388, test_f1: 0.5122
 epoch: 11, train_loss: 0.8168, test_loss: 1.0711, test_f1: 0.5302
 epoch: 12, train_loss: 0.8006, test_loss: 1.0156, test_f1: 0.5322
 epoch: 13, train_loss: 0.7723, test_loss: 1.1401, test_f1: 0.5034
 epoch: 14, train_loss: 0.7583, test_loss: 1.1560, test_f1: 0.5204
 epoch: 15, train_loss: 0.7404, test_loss: 1.1882, test_f1: 0.5068
 epoch: 16, train_loss: 0.7221, test_loss: 1.1299, test_f1: 0.5106
 epoch: 17, train_loss: 0.7230, test_loss: 1.1591, test_f1: 0.4963
 epoch: 18, train_loss: 0.6955, test_loss: 1.1605, test_f1: 0.5333
 epoch: 19, train_loss: 0.6702, test_loss: 1.2632, test_f1: 0.5145
 epoch: 20, train_loss: 0.6987, test_loss: 1.1600, test_f1: 0.5167
 epoch: 21, train_loss: 0.6668, test_loss: 1.3123, test_f1: 0.5153
 epoch: 22, train_loss: 0.6364, test_loss: 1.1963, test_f1: 0.5366
 epoch: 23, train_loss: 0.6185, test_loss: 1.3567, test_f1: 0.5129
 epoch: 24, train_loss: 0.6009, test_loss: 1.3923, test_f1: 0.5030
 epoch: 25, train_loss: 0.5984, test_loss: 1.4022, test_f1: 0.5389
 epoch: 26, train_loss: 0.5978, test_loss: 1.4110, test_f1: 0.5142
 epoch: 27, train_loss: 0.6156, test_loss: 1.4419, test_f1: 0.4740
 epoch: 28, train_loss: 0.6068, test_loss: 1.4069, test_f1: 0.5151
 epoch: 29, train_loss: 0.5825, test_loss: 1.4050, test_f1: 0.5372
 epoch: 30, train_loss: 0.5643, test_loss: 1.6121, test_f1: 0.5370
 epoch: 31, train_loss: 0.5680, test_loss: 1.4277, test_f1: 0.5492
 epoch: 32, train_loss: 0.5183, test_loss: 1.4598, test_f1: 0.5214
 epoch: 33, train_loss: 0.4966, test_loss: 1.6073, test_f1: 0.5288
 epoch: 34, train_loss: 0.4993, test_loss: 1.8125, test_f1: 0.5511
 epoch: 35, train_loss: 0.5127, test_loss: 1.6613, test_f1: 0.4755
 epoch: 36, train_loss: 0.4877, test_loss: 1.6025, test_f1: 0.5360
 epoch: 37, train_loss: 0.4729, test_loss: 1.7397, test_f1: 0.5256
 epoch: 38, train_loss: 0.4819, test_loss: 1.4309, test_f1: 0.5398
 epoch: 39, train_loss: 0.4727, test_loss: 1.8736, test_f1: 0.5013
 epoch: 40, train_loss: 0.4692, test_loss: 1.6189, test_f1: 0.5385
 epoch: 41, train_loss: 0.4503, test_loss: 1.6693, test_f1: 0.5427
 epoch: 42, train_loss: 0.4331, test_loss: 1.6506, test_f1: 0.5680
 epoch: 43, train_loss: 0.4224, test_loss: 1.7093, test_f1: 0.5309
 epoch: 44, train_loss: 0.4290, test_loss: 1.7350, test_f1: 0.5217
 epoch: 45, train_loss: 0.4246, test_loss: 1.7289, test_f1: 0.5395
 epoch: 46, train_loss: 0.4236, test_loss: 1.9174, test_f1: 0.5354
 epoch: 47, train_loss: 0.4021, test_loss: 1.8414, test_f1: 0.5303
 epoch: 48, train_loss: 0.3956, test_loss: 1.8370, test_f1: 0.5384
 epoch: 49, train_loss: 0.3868, test_loss: 2.0687, test_f1: 0.5313
 epoch: 50, train_loss: 0.3938, test_loss: 1.9652, test_f1: 0.5419
 epoch: 51, train_loss: 0.3608, test_loss: 1.8636, test_f1: 0.5467
 epoch: 52, train_loss: 0.3244, test_loss: 2.1389, test_f1: 0.5712
 epoch: 53, train_loss: 0.3008, test_loss: 2.0882, test_f1: 0.5498
 epoch: 54, train_loss: 0.3128, test_loss: 2.0676, test_f1: 0.5418
 epoch: 55, train_loss: 0.2749, test_loss: 2.2003, test_f1: 0.5514
 epoch: 56, train_loss: 0.2625, test_loss: 2.2141, test_f1: 0.5353
 epoch: 57, train_loss: 0.2671, test_loss: 2.4357, test_f1: 0.5525
 epoch: 58, train_loss: 0.2741, test_loss: 2.4515, test_f1: 0.5345
 epoch: 59, train_loss: 0.2616, test_loss: 2.3629, test_f1: 0.5399
 epoch: 60, train_loss: 0.2704, test_loss: 2.2069, test_f1: 0.5543
 epoch: 61, train_loss: 0.2742, test_loss: 2.3810, test_f1: 0.5346
 epoch: 62, train_loss: 0.2569, test_loss: 2.3809, test_f1: 0.5534
 epoch: 63, train_loss: 0.2584, test_loss: 2.6380, test_f1: 0.5314
 epoch: 64, train_loss: 0.2525, test_loss: 2.3999, test_f1: 0.5354
 epoch: 65, train_loss: 0.2424, test_loss: 2.5497, test_f1: 0.5460
 epoch: 66, train_loss: 0.2593, test_loss: 2.3861, test_f1: 0.5610
 epoch: 67, train_loss: 0.2387, test_loss: 2.5154, test_f1: 0.5510
 epoch: 68, train_loss: 0.2430, test_loss: 2.3263, test_f1: 0.5615
 epoch: 69, train_loss: 0.2317, test_loss: 2.5036, test_f1: 0.5511
 epoch: 70, train_loss: 0.2224, test_loss: 2.4784, test_f1: 0.5492
 epoch: 71, train_loss: 0.2434, test_loss: 2.4676, test_f1: 0.5338
 epoch: 72, train_loss: 0.2504, test_loss: 2.6026, test_f1: 0.5450
 epoch: 73, train_loss: 0.2607, test_loss: 2.5963, test_f1: 0.5354
 epoch: 74, train_loss: 0.2405, test_loss: 2.5035, test_f1: 0.5303
 epoch: 75, train_loss: 0.2401, test_loss: 2.5837, test_f1: 0.5333
 epoch: 76, train_loss: 0.2294, test_loss: 2.3905, test_f1: 0.5487
 epoch: 77, train_loss: 0.2268, test_loss: 2.6200, test_f1: 0.5311
 epoch: 78, train_loss: 0.2285, test_loss: 2.7257, test_f1: 0.5456
 epoch: 79, train_loss: 0.2604, test_loss: 2.3937, test_f1: 0.5477
 epoch: 80, train_loss: 0.2427, test_loss: 2.6672, test_f1: 0.5491
 epoch: 81, train_loss: 0.2356, test_loss: 2.4562, test_f1: 0.5521
 epoch: 82, train_loss: 0.2120, test_loss: 2.6460, test_f1: 0.5372
 epoch: 83, train_loss: 0.2076, test_loss: 2.9297, test_f1: 0.5254
 epoch: 84, train_loss: 0.1844, test_loss: 2.8288, test_f1: 0.5346
 epoch: 85, train_loss: 0.1844, test_loss: 2.7870, test_f1: 0.5387
 epoch: 86, train_loss: 0.1948, test_loss: 2.8947, test_f1: 0.5393
 epoch: 87, train_loss: 0.1937, test_loss: 2.8248, test_f1: 0.5661
 epoch: 88, train_loss: 0.1991, test_loss: 2.9817, test_f1: 0.5514
 epoch: 89, train_loss: 0.1871, test_loss: 3.0002, test_f1: 0.5385
 epoch: 90, train_loss: 0.1843, test_loss: 2.8762, test_f1: 0.5144
 epoch: 91, train_loss: 0.1763, test_loss: 2.8661, test_f1: 0.5516
 epoch: 92, train_loss: 0.1777, test_loss: 3.1987, test_f1: 0.5359
 epoch: 93, train_loss: 0.1719, test_loss: 3.0942, test_f1: 0.5332
 epoch: 94, train_loss: 0.2005, test_loss: 3.0642, test_f1: 0.5223
 epoch: 95, train_loss: 0.1900, test_loss: 3.1447, test_f1: 0.5235
 epoch: 96, train_loss: 0.1917, test_loss: 3.1472, test_f1: 0.5231
 epoch: 97, train_loss: 0.1968, test_loss: 3.1621, test_f1: 0.5382
 epoch: 98, train_loss: 0.2032, test_loss: 2.8608, test_f1: 0.5488
 epoch: 99, train_loss: 0.1839, test_loss: 3.0571, test_f1: 0.5468
##################ITERATION #4 ****************************************
 epoch: 0, train_loss: 1.3422, test_loss: 1.3261, test_f1: 0.3136
 epoch: 1, train_loss: 1.2042, test_loss: 1.1945, test_f1: 0.4884
 epoch: 2, train_loss: 1.1314, test_loss: 1.0934, test_f1: 0.4272
 epoch: 3, train_loss: 1.0618, test_loss: 1.0250, test_f1: 0.5024
 epoch: 4, train_loss: 1.0311, test_loss: 1.0198, test_f1: 0.4902
 epoch: 5, train_loss: 0.9895, test_loss: 0.9936, test_f1: 0.4644
 epoch: 6, train_loss: 0.9714, test_loss: 0.9590, test_f1: 0.5334
 epoch: 7, train_loss: 0.9304, test_loss: 1.0171, test_f1: 0.4881
 epoch: 8, train_loss: 0.9001, test_loss: 1.1069, test_f1: 0.4733
 epoch: 9, train_loss: 0.8781, test_loss: 0.9733, test_f1: 0.5023
 epoch: 10, train_loss: 0.8699, test_loss: 1.0051, test_f1: 0.5028
 epoch: 11, train_loss: 0.8402, test_loss: 1.2761, test_f1: 0.4590
 epoch: 12, train_loss: 0.8543, test_loss: 1.0363, test_f1: 0.4977
 epoch: 13, train_loss: 0.8101, test_loss: 1.0992, test_f1: 0.5070
 epoch: 14, train_loss: 0.8076, test_loss: 1.0973, test_f1: 0.5262
 epoch: 15, train_loss: 0.7891, test_loss: 1.0557, test_f1: 0.5443
 epoch: 16, train_loss: 0.7650, test_loss: 1.3419, test_f1: 0.4806
 epoch: 17, train_loss: 0.7537, test_loss: 1.1035, test_f1: 0.5075
 epoch: 18, train_loss: 0.7516, test_loss: 1.1691, test_f1: 0.4902
 epoch: 19, train_loss: 0.7285, test_loss: 1.2236, test_f1: 0.4816
 epoch: 20, train_loss: 0.7010, test_loss: 1.1581, test_f1: 0.5036
 epoch: 21, train_loss: 0.6915, test_loss: 1.1738, test_f1: 0.5262
 epoch: 22, train_loss: 0.6762, test_loss: 1.2311, test_f1: 0.5101
 epoch: 23, train_loss: 0.6803, test_loss: 1.0925, test_f1: 0.5372
 epoch: 24, train_loss: 0.6673, test_loss: 1.2172, test_f1: 0.5350
 epoch: 25, train_loss: 0.6296, test_loss: 1.1870, test_f1: 0.5246
 epoch: 26, train_loss: 0.6289, test_loss: 1.2102, test_f1: 0.5460
 epoch: 27, train_loss: 0.6228, test_loss: 1.3774, test_f1: 0.5188
 epoch: 28, train_loss: 0.6120, test_loss: 1.2089, test_f1: 0.5348
 epoch: 29, train_loss: 0.6031, test_loss: 1.5519, test_f1: 0.4949
 epoch: 30, train_loss: 0.6078, test_loss: 1.3984, test_f1: 0.5369
 epoch: 31, train_loss: 0.5748, test_loss: 1.3036, test_f1: 0.5177
 epoch: 32, train_loss: 0.5924, test_loss: 1.3636, test_f1: 0.5525
 epoch: 33, train_loss: 0.5669, test_loss: 1.4388, test_f1: 0.5344
 epoch: 34, train_loss: 0.5549, test_loss: 1.4498, test_f1: 0.5059
 epoch: 35, train_loss: 0.5706, test_loss: 1.5422, test_f1: 0.5348
 epoch: 36, train_loss: 0.5390, test_loss: 1.5211, test_f1: 0.5233
 epoch: 37, train_loss: 0.5239, test_loss: 1.3524, test_f1: 0.5418
 epoch: 38, train_loss: 0.5298, test_loss: 1.4855, test_f1: 0.5060
 epoch: 39, train_loss: 0.5130, test_loss: 1.5479, test_f1: 0.5226
 epoch: 40, train_loss: 0.4898, test_loss: 1.4569, test_f1: 0.5534
 epoch: 41, train_loss: 0.4822, test_loss: 1.4729, test_f1: 0.5396
 epoch: 42, train_loss: 0.4835, test_loss: 1.9958, test_f1: 0.5098
 epoch: 43, train_loss: 0.4761, test_loss: 1.5652, test_f1: 0.5343
 epoch: 44, train_loss: 0.4771, test_loss: 1.5597, test_f1: 0.5004
 epoch: 45, train_loss: 0.4631, test_loss: 1.4889, test_f1: 0.5392
 epoch: 46, train_loss: 0.4752, test_loss: 1.5743, test_f1: 0.5530
 epoch: 47, train_loss: 0.4628, test_loss: 1.9242, test_f1: 0.4803
 epoch: 48, train_loss: 0.4380, test_loss: 1.7007, test_f1: 0.5315
 epoch: 49, train_loss: 0.4287, test_loss: 1.6150, test_f1: 0.5687
 epoch: 50, train_loss: 0.3979, test_loss: 2.0009, test_f1: 0.5201
 epoch: 51, train_loss: 0.3729, test_loss: 1.7131, test_f1: 0.5300
 epoch: 52, train_loss: 0.3410, test_loss: 1.7510, test_f1: 0.5422
 epoch: 53, train_loss: 0.3172, test_loss: 2.0163, test_f1: 0.5418
 epoch: 54, train_loss: 0.3218, test_loss: 1.7948, test_f1: 0.5319
 epoch: 55, train_loss: 0.3166, test_loss: 2.0413, test_f1: 0.5325
 epoch: 56, train_loss: 0.3221, test_loss: 1.9852, test_f1: 0.5400
 epoch: 57, train_loss: 0.3118, test_loss: 2.0412, test_f1: 0.5415
 epoch: 58, train_loss: 0.3000, test_loss: 2.0291, test_f1: 0.5377
 epoch: 59, train_loss: 0.3027, test_loss: 2.0534, test_f1: 0.5331
 epoch: 60, train_loss: 0.2952, test_loss: 2.1285, test_f1: 0.5175
 epoch: 61, train_loss: 0.2836, test_loss: 2.0432, test_f1: 0.5349
 epoch: 62, train_loss: 0.2955, test_loss: 2.1627, test_f1: 0.5249
 epoch: 63, train_loss: 0.2947, test_loss: 2.0475, test_f1: 0.5213
 epoch: 64, train_loss: 0.2849, test_loss: 2.0998, test_f1: 0.5022
 epoch: 65, train_loss: 0.2657, test_loss: 2.1603, test_f1: 0.5528
 epoch: 66, train_loss: 0.2735, test_loss: 2.2044, test_f1: 0.5104
 epoch: 67, train_loss: 0.2752, test_loss: 2.0861, test_f1: 0.5533
 epoch: 68, train_loss: 0.2788, test_loss: 2.3060, test_f1: 0.5103
 epoch: 69, train_loss: 0.2704, test_loss: 2.2891, test_f1: 0.5293
 epoch: 70, train_loss: 0.2481, test_loss: 2.2179, test_f1: 0.5333
 epoch: 71, train_loss: 0.2387, test_loss: 2.4755, test_f1: 0.5224
 epoch: 72, train_loss: 0.2526, test_loss: 2.3178, test_f1: 0.5320
 epoch: 73, train_loss: 0.2450, test_loss: 2.3021, test_f1: 0.5228
 epoch: 74, train_loss: 0.2478, test_loss: 2.4695, test_f1: 0.5360
 epoch: 75, train_loss: 0.2471, test_loss: 2.4505, test_f1: 0.5212
 epoch: 76, train_loss: 0.2399, test_loss: 2.4176, test_f1: 0.5294
 epoch: 77, train_loss: 0.2544, test_loss: 2.2788, test_f1: 0.5574
 epoch: 78, train_loss: 0.2403, test_loss: 2.4234, test_f1: 0.5199
 epoch: 79, train_loss: 0.2336, test_loss: 2.4233, test_f1: 0.5398
 epoch: 80, train_loss: 0.2270, test_loss: 2.4816, test_f1: 0.5339
 epoch: 81, train_loss: 0.2227, test_loss: 2.4738, test_f1: 0.5439
 epoch: 82, train_loss: 0.2267, test_loss: 2.6322, test_f1: 0.5169
 epoch: 83, train_loss: 0.2442, test_loss: 2.3421, test_f1: 0.5433
 epoch: 84, train_loss: 0.2240, test_loss: 2.5448, test_f1: 0.5314
 epoch: 85, train_loss: 0.2190, test_loss: 2.5610, test_f1: 0.5278
 epoch: 86, train_loss: 0.2075, test_loss: 2.6425, test_f1: 0.5258
 epoch: 87, train_loss: 0.2379, test_loss: 2.4705, test_f1: 0.5505
 epoch: 88, train_loss: 0.1924, test_loss: 2.7596, test_f1: 0.5286
 epoch: 89, train_loss: 0.2184, test_loss: 2.4891, test_f1: 0.5368
 epoch: 90, train_loss: 0.2020, test_loss: 2.5340, test_f1: 0.5575
 epoch: 91, train_loss: 0.2020, test_loss: 2.6840, test_f1: 0.5343
 epoch: 92, train_loss: 0.2052, test_loss: 2.5578, test_f1: 0.5326
 epoch: 93, train_loss: 0.1871, test_loss: 2.6120, test_f1: 0.5453
 epoch: 94, train_loss: 0.1934, test_loss: 2.6212, test_f1: 0.5572
 epoch: 95, train_loss: 0.2062, test_loss: 2.7362, test_f1: 0.5289
 epoch: 96, train_loss: 0.1972, test_loss: 2.5720, test_f1: 0.5451
 epoch: 97, train_loss: 0.1935, test_loss: 2.4943, test_f1: 0.5302
 epoch: 98, train_loss: 0.1978, test_loss: 2.5413, test_f1: 0.5333
 epoch: 99, train_loss: 0.2057, test_loss: 2.7538, test_f1: 0.5274
##################ITERATION #5 ****************************************
 epoch: 0, train_loss: 1.3872, test_loss: 1.4081, test_f1: 0.2964
 epoch: 1, train_loss: 1.2026, test_loss: 1.2373, test_f1: 0.3986
 epoch: 2, train_loss: 1.1441, test_loss: 1.1584, test_f1: 0.4219
 epoch: 3, train_loss: 1.0603, test_loss: 1.1082, test_f1: 0.4428
 epoch: 4, train_loss: 1.0145, test_loss: 1.0248, test_f1: 0.5006
 epoch: 5, train_loss: 0.9938, test_loss: 0.9942, test_f1: 0.5250
 epoch: 6, train_loss: 0.9639, test_loss: 1.0663, test_f1: 0.4822
 epoch: 7, train_loss: 0.9427, test_loss: 1.0165, test_f1: 0.4979
 epoch: 8, train_loss: 0.9223, test_loss: 1.0157, test_f1: 0.4755
 epoch: 9, train_loss: 0.8818, test_loss: 1.0280, test_f1: 0.5139
 epoch: 10, train_loss: 0.8572, test_loss: 1.0156, test_f1: 0.5124
 epoch: 11, train_loss: 0.8406, test_loss: 1.0992, test_f1: 0.4885
 epoch: 12, train_loss: 0.8178, test_loss: 1.0960, test_f1: 0.5360
 epoch: 13, train_loss: 0.7966, test_loss: 1.0621, test_f1: 0.4902
 epoch: 14, train_loss: 0.7950, test_loss: 1.0321, test_f1: 0.5448
 epoch: 15, train_loss: 0.7786, test_loss: 1.1726, test_f1: 0.5165
 epoch: 16, train_loss: 0.7619, test_loss: 1.0647, test_f1: 0.5321
 epoch: 17, train_loss: 0.7417, test_loss: 1.0528, test_f1: 0.5322
 epoch: 18, train_loss: 0.7429, test_loss: 1.1924, test_f1: 0.4774
 epoch: 19, train_loss: 0.7218, test_loss: 1.1938, test_f1: 0.5005
 epoch: 20, train_loss: 0.7015, test_loss: 1.0841, test_f1: 0.5560
 epoch: 21, train_loss: 0.6762, test_loss: 1.1509, test_f1: 0.5414
 epoch: 22, train_loss: 0.6672, test_loss: 1.2157, test_f1: 0.5242
 epoch: 23, train_loss: 0.6491, test_loss: 1.3073, test_f1: 0.5373
 epoch: 24, train_loss: 0.6399, test_loss: 1.2142, test_f1: 0.5378
 epoch: 25, train_loss: 0.6443, test_loss: 1.4331, test_f1: 0.5051
 epoch: 26, train_loss: 0.6308, test_loss: 1.3232, test_f1: 0.4933
 epoch: 27, train_loss: 0.6246, test_loss: 1.2965, test_f1: 0.5365
 epoch: 28, train_loss: 0.6114, test_loss: 1.4103, test_f1: 0.5110
 epoch: 29, train_loss: 0.5956, test_loss: 1.2904, test_f1: 0.5259
 epoch: 30, train_loss: 0.5675, test_loss: 1.4136, test_f1: 0.5188
 epoch: 31, train_loss: 0.5916, test_loss: 1.4072, test_f1: 0.5553
 epoch: 32, train_loss: 0.5552, test_loss: 1.3261, test_f1: 0.5234
 epoch: 33, train_loss: 0.5523, test_loss: 1.5072, test_f1: 0.5057
 epoch: 34, train_loss: 0.5332, test_loss: 1.5051, test_f1: 0.5402
 epoch: 35, train_loss: 0.5377, test_loss: 1.4789, test_f1: 0.5548
 epoch: 36, train_loss: 0.5320, test_loss: 1.4749, test_f1: 0.4952
 epoch: 37, train_loss: 0.5186, test_loss: 1.4519, test_f1: 0.5422
 epoch: 38, train_loss: 0.5067, test_loss: 1.6066, test_f1: 0.5402
 epoch: 39, train_loss: 0.5015, test_loss: 1.7368, test_f1: 0.5073
 epoch: 40, train_loss: 0.5033, test_loss: 1.4786, test_f1: 0.5538
 epoch: 41, train_loss: 0.4963, test_loss: 1.7458, test_f1: 0.4972
 epoch: 42, train_loss: 0.4832, test_loss: 1.4383, test_f1: 0.5286
 epoch: 43, train_loss: 0.4686, test_loss: 1.5059, test_f1: 0.5113
 epoch: 44, train_loss: 0.4529, test_loss: 1.7299, test_f1: 0.5059
 epoch: 45, train_loss: 0.4390, test_loss: 1.8325, test_f1: 0.5185
 epoch: 46, train_loss: 0.4600, test_loss: 1.5044, test_f1: 0.5198
 epoch: 47, train_loss: 0.4171, test_loss: 1.9501, test_f1: 0.5079
 epoch: 48, train_loss: 0.4188, test_loss: 1.8047, test_f1: 0.5085
 epoch: 49, train_loss: 0.4236, test_loss: 1.7965, test_f1: 0.5179
 epoch: 50, train_loss: 0.4486, test_loss: 1.7509, test_f1: 0.4936
 epoch: 51, train_loss: 0.3945, test_loss: 1.6749, test_f1: 0.5236
 epoch: 52, train_loss: 0.3550, test_loss: 1.8162, test_f1: 0.5113
 epoch: 53, train_loss: 0.3324, test_loss: 1.8859, test_f1: 0.5096
 epoch: 54, train_loss: 0.3108, test_loss: 2.0373, test_f1: 0.5017
 epoch: 55, train_loss: 0.3179, test_loss: 2.1877, test_f1: 0.4950
 epoch: 56, train_loss: 0.3172, test_loss: 2.1007, test_f1: 0.5284
 epoch: 57, train_loss: 0.3159, test_loss: 1.9781, test_f1: 0.5183
 epoch: 58, train_loss: 0.3020, test_loss: 2.0614, test_f1: 0.5199
 epoch: 59, train_loss: 0.3046, test_loss: 2.1644, test_f1: 0.5040
 epoch: 60, train_loss: 0.3030, test_loss: 2.0807, test_f1: 0.5191
 epoch: 61, train_loss: 0.2982, test_loss: 2.1809, test_f1: 0.5219
 epoch: 62, train_loss: 0.3206, test_loss: 2.1584, test_f1: 0.5050
 epoch: 63, train_loss: 0.3028, test_loss: 2.3630, test_f1: 0.4985
 epoch: 64, train_loss: 0.3075, test_loss: 2.1155, test_f1: 0.5122
 epoch: 65, train_loss: 0.2797, test_loss: 2.2976, test_f1: 0.5250
 epoch: 66, train_loss: 0.2772, test_loss: 2.1785, test_f1: 0.5098
 epoch: 67, train_loss: 0.2737, test_loss: 2.3199, test_f1: 0.5091
 epoch: 68, train_loss: 0.2579, test_loss: 2.4252, test_f1: 0.4956
 epoch: 69, train_loss: 0.2706, test_loss: 2.2099, test_f1: 0.5272
 epoch: 70, train_loss: 0.2769, test_loss: 2.2515, test_f1: 0.5195
 epoch: 71, train_loss: 0.2581, test_loss: 2.4738, test_f1: 0.4918
 epoch: 72, train_loss: 0.2681, test_loss: 2.3461, test_f1: 0.5203
 epoch: 73, train_loss: 0.2666, test_loss: 2.2944, test_f1: 0.5033
 epoch: 74, train_loss: 0.2504, test_loss: 2.3809, test_f1: 0.5180
 epoch: 75, train_loss: 0.2533, test_loss: 2.3694, test_f1: 0.5276
 epoch: 76, train_loss: 0.2466, test_loss: 2.5796, test_f1: 0.5040
 epoch: 77, train_loss: 0.2310, test_loss: 2.5704, test_f1: 0.5161
 epoch: 78, train_loss: 0.2341, test_loss: 2.7557, test_f1: 0.5210
 epoch: 79, train_loss: 0.2522, test_loss: 2.5435, test_f1: 0.5222
 epoch: 80, train_loss: 0.2399, test_loss: 2.5466, test_f1: 0.4995
 epoch: 81, train_loss: 0.2210, test_loss: 2.6831, test_f1: 0.5120
 epoch: 82, train_loss: 0.2164, test_loss: 2.8199, test_f1: 0.5144
 epoch: 83, train_loss: 0.2324, test_loss: 2.7858, test_f1: 0.5186
 epoch: 84, train_loss: 0.2300, test_loss: 2.7516, test_f1: 0.5260
 epoch: 85, train_loss: 0.2407, test_loss: 2.6435, test_f1: 0.5038
 epoch: 86, train_loss: 0.2324, test_loss: 2.7752, test_f1: 0.5397
 epoch: 87, train_loss: 0.2278, test_loss: 2.5594, test_f1: 0.5148
 epoch: 88, train_loss: 0.2234, test_loss: 2.4708, test_f1: 0.5317
 epoch: 89, train_loss: 0.2303, test_loss: 2.7833, test_f1: 0.5319
 epoch: 90, train_loss: 0.2221, test_loss: 2.5858, test_f1: 0.5297
 epoch: 91, train_loss: 0.2160, test_loss: 2.7150, test_f1: 0.5007
 epoch: 92, train_loss: 0.1971, test_loss: 2.8431, test_f1: 0.4888
 epoch: 93, train_loss: 0.2120, test_loss: 2.7578, test_f1: 0.5078
 epoch: 94, train_loss: 0.2408, test_loss: 2.6326, test_f1: 0.5466
 epoch: 95, train_loss: 0.2105, test_loss: 2.6335, test_f1: 0.5385
 epoch: 96, train_loss: 0.2202, test_loss: 2.8127, test_f1: 0.5119
 epoch: 97, train_loss: 0.2106, test_loss: 2.8151, test_f1: 0.5269
 epoch: 98, train_loss: 0.2207, test_loss: 2.8150, test_f1: 0.5063
 epoch: 99, train_loss: 0.2032, test_loss: 2.5470, test_f1: 0.5441
##################ITERATION #6 ****************************************
 epoch: 0, train_loss: 1.4900, test_loss: 1.3113, test_f1: 0.2770
 epoch: 1, train_loss: 1.2069, test_loss: 1.1698, test_f1: 0.4515
 epoch: 2, train_loss: 1.1063, test_loss: 1.0950, test_f1: 0.4601
 epoch: 3, train_loss: 1.0454, test_loss: 1.0319, test_f1: 0.4868
 epoch: 4, train_loss: 1.0112, test_loss: 0.9770, test_f1: 0.5276
 epoch: 5, train_loss: 0.9701, test_loss: 0.9734, test_f1: 0.5140
 epoch: 6, train_loss: 0.9447, test_loss: 0.9670, test_f1: 0.5123
 epoch: 7, train_loss: 0.9119, test_loss: 1.0153, test_f1: 0.5088
 epoch: 8, train_loss: 0.9045, test_loss: 0.9803, test_f1: 0.5076
 epoch: 9, train_loss: 0.8874, test_loss: 1.0360, test_f1: 0.4825
 epoch: 10, train_loss: 0.8630, test_loss: 0.9671, test_f1: 0.5149
 epoch: 11, train_loss: 0.8396, test_loss: 0.9827, test_f1: 0.5039
 epoch: 12, train_loss: 0.7952, test_loss: 1.1270, test_f1: 0.5009
 epoch: 13, train_loss: 0.7929, test_loss: 1.0105, test_f1: 0.5085
 epoch: 14, train_loss: 0.7803, test_loss: 1.0421, test_f1: 0.5302
 epoch: 15, train_loss: 0.7517, test_loss: 1.0985, test_f1: 0.5066
 epoch: 16, train_loss: 0.7507, test_loss: 1.0976, test_f1: 0.4968
 epoch: 17, train_loss: 0.7510, test_loss: 1.0887, test_f1: 0.5420
 epoch: 18, train_loss: 0.7305, test_loss: 1.1838, test_f1: 0.5178
 epoch: 19, train_loss: 0.7086, test_loss: 1.2820, test_f1: 0.4648
 epoch: 20, train_loss: 0.6893, test_loss: 1.2847, test_f1: 0.4957
 epoch: 21, train_loss: 0.6849, test_loss: 1.1698, test_f1: 0.5216
 epoch: 22, train_loss: 0.6631, test_loss: 1.1562, test_f1: 0.5370
 epoch: 23, train_loss: 0.6697, test_loss: 1.2123, test_f1: 0.5051
 epoch: 24, train_loss: 0.6459, test_loss: 1.1567, test_f1: 0.5462
 epoch: 25, train_loss: 0.6226, test_loss: 1.2155, test_f1: 0.5289
 epoch: 26, train_loss: 0.6154, test_loss: 1.3894, test_f1: 0.5175
 epoch: 27, train_loss: 0.6450, test_loss: 1.3140, test_f1: 0.5273
 epoch: 28, train_loss: 0.6115, test_loss: 1.2566, test_f1: 0.5336
 epoch: 29, train_loss: 0.6072, test_loss: 1.2951, test_f1: 0.5182
 epoch: 30, train_loss: 0.5802, test_loss: 1.3793, test_f1: 0.5137
 epoch: 31, train_loss: 0.5637, test_loss: 1.3932, test_f1: 0.5043
 epoch: 32, train_loss: 0.5625, test_loss: 1.3688, test_f1: 0.5153
 epoch: 33, train_loss: 0.5555, test_loss: 1.5068, test_f1: 0.4997
 epoch: 34, train_loss: 0.5385, test_loss: 1.6818, test_f1: 0.4804
 epoch: 35, train_loss: 0.5395, test_loss: 1.3359, test_f1: 0.5517
 epoch: 36, train_loss: 0.5424, test_loss: 1.3084, test_f1: 0.5374
 epoch: 37, train_loss: 0.5626, test_loss: 1.5803, test_f1: 0.5261
 epoch: 38, train_loss: 0.5344, test_loss: 1.4292, test_f1: 0.5347
 epoch: 39, train_loss: 0.4980, test_loss: 1.6152, test_f1: 0.5197
 epoch: 40, train_loss: 0.4707, test_loss: 1.6916, test_f1: 0.5071
 epoch: 41, train_loss: 0.4324, test_loss: 1.5814, test_f1: 0.5331
 epoch: 42, train_loss: 0.4468, test_loss: 1.9134, test_f1: 0.4930
 epoch: 43, train_loss: 0.4374, test_loss: 1.7287, test_f1: 0.5520
 epoch: 44, train_loss: 0.4916, test_loss: 1.6788, test_f1: 0.5204
 epoch: 45, train_loss: 0.4646, test_loss: 1.6735, test_f1: 0.5054
 epoch: 46, train_loss: 0.4408, test_loss: 1.5739, test_f1: 0.5422
 epoch: 47, train_loss: 0.4348, test_loss: 1.5236, test_f1: 0.5122
 epoch: 48, train_loss: 0.4360, test_loss: 1.7065, test_f1: 0.5308
 epoch: 49, train_loss: 0.4272, test_loss: 1.6220, test_f1: 0.5246
 epoch: 50, train_loss: 0.4333, test_loss: 1.7894, test_f1: 0.5126
 epoch: 51, train_loss: 0.3859, test_loss: 1.7308, test_f1: 0.5428
 epoch: 52, train_loss: 0.3457, test_loss: 1.8619, test_f1: 0.5384
 epoch: 53, train_loss: 0.3291, test_loss: 1.9811, test_f1: 0.5314
 epoch: 54, train_loss: 0.3241, test_loss: 2.1167, test_f1: 0.5361
 epoch: 55, train_loss: 0.3230, test_loss: 2.0649, test_f1: 0.5131
 epoch: 56, train_loss: 0.3234, test_loss: 2.0364, test_f1: 0.5200
 epoch: 57, train_loss: 0.3075, test_loss: 2.0672, test_f1: 0.5237
 epoch: 58, train_loss: 0.3094, test_loss: 2.1856, test_f1: 0.5169
 epoch: 59, train_loss: 0.3084, test_loss: 2.0657, test_f1: 0.5193
 epoch: 60, train_loss: 0.3009, test_loss: 2.2104, test_f1: 0.5248
 epoch: 61, train_loss: 0.2782, test_loss: 2.3423, test_f1: 0.5279
 epoch: 62, train_loss: 0.2958, test_loss: 2.2304, test_f1: 0.5377
 epoch: 63, train_loss: 0.2976, test_loss: 2.2916, test_f1: 0.5252
 epoch: 64, train_loss: 0.2913, test_loss: 2.2010, test_f1: 0.5212
 epoch: 65, train_loss: 0.2875, test_loss: 2.2525, test_f1: 0.5018
 epoch: 66, train_loss: 0.2735, test_loss: 2.2259, test_f1: 0.5294
 epoch: 67, train_loss: 0.2814, test_loss: 2.5989, test_f1: 0.4955
 epoch: 68, train_loss: 0.2939, test_loss: 2.2352, test_f1: 0.5386
 epoch: 69, train_loss: 0.2771, test_loss: 2.1905, test_f1: 0.5495
 epoch: 70, train_loss: 0.2408, test_loss: 2.2852, test_f1: 0.5028
 epoch: 71, train_loss: 0.2495, test_loss: 2.3499, test_f1: 0.5373
 epoch: 72, train_loss: 0.2541, test_loss: 2.3108, test_f1: 0.5298
 epoch: 73, train_loss: 0.2483, test_loss: 2.2979, test_f1: 0.5283
 epoch: 74, train_loss: 0.2499, test_loss: 2.3921, test_f1: 0.5231
 epoch: 75, train_loss: 0.2655, test_loss: 2.2782, test_f1: 0.5310
 epoch: 76, train_loss: 0.2585, test_loss: 2.3681, test_f1: 0.5464
 epoch: 77, train_loss: 0.2646, test_loss: 2.4487, test_f1: 0.5530
 epoch: 78, train_loss: 0.2659, test_loss: 2.2475, test_f1: 0.5357
 epoch: 79, train_loss: 0.2577, test_loss: 2.1592, test_f1: 0.5259
 epoch: 80, train_loss: 0.2482, test_loss: 2.4952, test_f1: 0.5266
 epoch: 81, train_loss: 0.2355, test_loss: 2.4261, test_f1: 0.5295
 epoch: 82, train_loss: 0.2371, test_loss: 2.5982, test_f1: 0.5186
 epoch: 83, train_loss: 0.2211, test_loss: 2.5432, test_f1: 0.5262
 epoch: 84, train_loss: 0.2185, test_loss: 2.4955, test_f1: 0.5116
 epoch: 85, train_loss: 0.2053, test_loss: 2.5881, test_f1: 0.5199
 epoch: 86, train_loss: 0.1959, test_loss: 2.6118, test_f1: 0.5289
 epoch: 87, train_loss: 0.2061, test_loss: 2.4783, test_f1: 0.5365
 epoch: 88, train_loss: 0.2213, test_loss: 2.6495, test_f1: 0.5315
 epoch: 89, train_loss: 0.1949, test_loss: 2.5241, test_f1: 0.5169
 epoch: 90, train_loss: 0.2018, test_loss: 2.8510, test_f1: 0.5093
 epoch: 91, train_loss: 0.2067, test_loss: 2.6401, test_f1: 0.5491
 epoch: 92, train_loss: 0.2306, test_loss: 2.9884, test_f1: 0.5427
 epoch: 93, train_loss: 0.2124, test_loss: 2.5737, test_f1: 0.5555
 epoch: 94, train_loss: 0.1954, test_loss: 2.6913, test_f1: 0.5426
 epoch: 95, train_loss: 0.1984, test_loss: 2.6916, test_f1: 0.5223
 epoch: 96, train_loss: 0.2075, test_loss: 2.5831, test_f1: 0.5279
 epoch: 97, train_loss: 0.2025, test_loss: 2.6089, test_f1: 0.5233
 epoch: 98, train_loss: 0.2142, test_loss: 2.5472, test_f1: 0.5233
 epoch: 99, train_loss: 0.2152, test_loss: 3.0592, test_f1: 0.5325
##################ITERATION #7 ****************************************
 epoch: 0, train_loss: 1.4560, test_loss: 1.2952, test_f1: 0.3595
 epoch: 1, train_loss: 1.1758, test_loss: 1.2378, test_f1: 0.3514
 epoch: 2, train_loss: 1.0993, test_loss: 1.1293, test_f1: 0.4395
 epoch: 3, train_loss: 1.0593, test_loss: 1.0688, test_f1: 0.4403
 epoch: 4, train_loss: 1.0114, test_loss: 1.0048, test_f1: 0.4877
 epoch: 5, train_loss: 0.9670, test_loss: 1.0140, test_f1: 0.4730
 epoch: 6, train_loss: 0.9407, test_loss: 0.9625, test_f1: 0.5123
 epoch: 7, train_loss: 0.9076, test_loss: 0.9700, test_f1: 0.4865
 epoch: 8, train_loss: 0.8861, test_loss: 0.9878, test_f1: 0.5307
 epoch: 9, train_loss: 0.8682, test_loss: 0.9844, test_f1: 0.5077
 epoch: 10, train_loss: 0.8473, test_loss: 1.0425, test_f1: 0.5122
 epoch: 11, train_loss: 0.8401, test_loss: 0.9766, test_f1: 0.5216
 epoch: 12, train_loss: 0.8197, test_loss: 1.0053, test_f1: 0.5231
 epoch: 13, train_loss: 0.7827, test_loss: 1.0573, test_f1: 0.5178
 epoch: 14, train_loss: 0.7671, test_loss: 1.0107, test_f1: 0.5599
 epoch: 15, train_loss: 0.7411, test_loss: 1.0479, test_f1: 0.5983
 epoch: 16, train_loss: 0.7549, test_loss: 1.0830, test_f1: 0.5360
 epoch: 17, train_loss: 0.7538, test_loss: 1.1229, test_f1: 0.5262
 epoch: 18, train_loss: 0.7286, test_loss: 1.1157, test_f1: 0.5431
 epoch: 19, train_loss: 0.7164, test_loss: 1.1248, test_f1: 0.5263
 epoch: 20, train_loss: 0.6908, test_loss: 1.0849, test_f1: 0.5468
 epoch: 21, train_loss: 0.6800, test_loss: 1.1220, test_f1: 0.5362
 epoch: 22, train_loss: 0.6933, test_loss: 1.2450, test_f1: 0.5106
 epoch: 23, train_loss: 0.6775, test_loss: 1.0851, test_f1: 0.5514
 epoch: 24, train_loss: 0.6557, test_loss: 1.1975, test_f1: 0.5485
 epoch: 25, train_loss: 0.6205, test_loss: 1.3460, test_f1: 0.5230
 epoch: 26, train_loss: 0.6009, test_loss: 1.3609, test_f1: 0.5089
 epoch: 27, train_loss: 0.6034, test_loss: 1.1967, test_f1: 0.5557
 epoch: 28, train_loss: 0.6010, test_loss: 1.2581, test_f1: 0.5702
 epoch: 29, train_loss: 0.5903, test_loss: 1.3452, test_f1: 0.5432
 epoch: 30, train_loss: 0.5697, test_loss: 1.4163, test_f1: 0.5186
 epoch: 31, train_loss: 0.5588, test_loss: 1.3176, test_f1: 0.5313
 epoch: 32, train_loss: 0.5500, test_loss: 1.4201, test_f1: 0.5301
 epoch: 33, train_loss: 0.5241, test_loss: 1.3811, test_f1: 0.5140
 epoch: 34, train_loss: 0.5101, test_loss: 1.4109, test_f1: 0.5511
 epoch: 35, train_loss: 0.5156, test_loss: 1.6528, test_f1: 0.5028
 epoch: 36, train_loss: 0.5166, test_loss: 1.3819, test_f1: 0.5544
 epoch: 37, train_loss: 0.5302, test_loss: 1.5541, test_f1: 0.5579
 epoch: 38, train_loss: 0.5216, test_loss: 1.4497, test_f1: 0.5267
 epoch: 39, train_loss: 0.5213, test_loss: 1.4784, test_f1: 0.5286
 epoch: 40, train_loss: 0.4838, test_loss: 1.4634, test_f1: 0.5299
 epoch: 41, train_loss: 0.4822, test_loss: 1.5484, test_f1: 0.5420
 epoch: 42, train_loss: 0.4774, test_loss: 1.4327, test_f1: 0.5456
 epoch: 43, train_loss: 0.4724, test_loss: 1.4548, test_f1: 0.5469
 epoch: 44, train_loss: 0.4700, test_loss: 1.5108, test_f1: 0.5319
 epoch: 45, train_loss: 0.4542, test_loss: 1.6114, test_f1: 0.5409
 epoch: 46, train_loss: 0.4430, test_loss: 1.6608, test_f1: 0.5445
 epoch: 47, train_loss: 0.4260, test_loss: 1.4977, test_f1: 0.5424
 epoch: 48, train_loss: 0.4137, test_loss: 1.7019, test_f1: 0.5348
 epoch: 49, train_loss: 0.4090, test_loss: 1.6587, test_f1: 0.5528
 epoch: 50, train_loss: 0.4075, test_loss: 1.6070, test_f1: 0.5390
 epoch: 51, train_loss: 0.3765, test_loss: 1.7646, test_f1: 0.5535
 epoch: 52, train_loss: 0.3402, test_loss: 1.8174, test_f1: 0.5514
 epoch: 53, train_loss: 0.3214, test_loss: 1.8625, test_f1: 0.5483
 epoch: 54, train_loss: 0.3152, test_loss: 1.8841, test_f1: 0.5534
 epoch: 55, train_loss: 0.2973, test_loss: 1.8697, test_f1: 0.5397
 epoch: 56, train_loss: 0.3062, test_loss: 1.9179, test_f1: 0.5354
 epoch: 57, train_loss: 0.3120, test_loss: 2.1314, test_f1: 0.5374
 epoch: 58, train_loss: 0.3129, test_loss: 1.8590, test_f1: 0.5573
 epoch: 59, train_loss: 0.3044, test_loss: 1.9297, test_f1: 0.5496
 epoch: 60, train_loss: 0.2936, test_loss: 2.0922, test_f1: 0.5341
 epoch: 61, train_loss: 0.2879, test_loss: 2.0507, test_f1: 0.5393
 epoch: 62, train_loss: 0.2821, test_loss: 2.0735, test_f1: 0.5328
 epoch: 63, train_loss: 0.2762, test_loss: 2.1660, test_f1: 0.5391
 epoch: 64, train_loss: 0.2723, test_loss: 2.1447, test_f1: 0.5470
 epoch: 65, train_loss: 0.2798, test_loss: 2.0577, test_f1: 0.5511
 epoch: 66, train_loss: 0.2567, test_loss: 2.2038, test_f1: 0.5447
 epoch: 67, train_loss: 0.2580, test_loss: 2.1469, test_f1: 0.5362
 epoch: 68, train_loss: 0.2566, test_loss: 2.3191, test_f1: 0.5507
 epoch: 69, train_loss: 0.2506, test_loss: 2.1640, test_f1: 0.5514
 epoch: 70, train_loss: 0.2778, test_loss: 2.2766, test_f1: 0.5376
 epoch: 71, train_loss: 0.2747, test_loss: 2.2607, test_f1: 0.5420
 epoch: 72, train_loss: 0.2675, test_loss: 2.4083, test_f1: 0.5284
 epoch: 73, train_loss: 0.2649, test_loss: 2.2991, test_f1: 0.5295
 epoch: 74, train_loss: 0.2379, test_loss: 2.1585, test_f1: 0.5526
 epoch: 75, train_loss: 0.2560, test_loss: 2.4367, test_f1: 0.5581
 epoch: 76, train_loss: 0.2227, test_loss: 2.2158, test_f1: 0.5568
 epoch: 77, train_loss: 0.2318, test_loss: 2.6280, test_f1: 0.5396
 epoch: 78, train_loss: 0.2415, test_loss: 2.2386, test_f1: 0.5555
 epoch: 79, train_loss: 0.2570, test_loss: 2.5127, test_f1: 0.5684
 epoch: 80, train_loss: 0.2304, test_loss: 2.5811, test_f1: 0.5405
 epoch: 81, train_loss: 0.2253, test_loss: 2.6216, test_f1: 0.5468
 epoch: 82, train_loss: 0.2202, test_loss: 2.5520, test_f1: 0.5464
 epoch: 83, train_loss: 0.2242, test_loss: 2.5482, test_f1: 0.5585
 epoch: 84, train_loss: 0.2150, test_loss: 2.6264, test_f1: 0.5434
 epoch: 85, train_loss: 0.2133, test_loss: 2.4676, test_f1: 0.5653
 epoch: 86, train_loss: 0.2069, test_loss: 2.3675, test_f1: 0.5641
 epoch: 87, train_loss: 0.2291, test_loss: 2.5223, test_f1: 0.5396
 epoch: 88, train_loss: 0.2308, test_loss: 2.6361, test_f1: 0.5297
 epoch: 89, train_loss: 0.2483, test_loss: 2.4759, test_f1: 0.5493
 epoch: 90, train_loss: 0.2325, test_loss: 2.5759, test_f1: 0.5397
 epoch: 91, train_loss: 0.2078, test_loss: 2.5851, test_f1: 0.5275
 epoch: 92, train_loss: 0.1960, test_loss: 2.6892, test_f1: 0.5370
 epoch: 93, train_loss: 0.2132, test_loss: 2.5103, test_f1: 0.5625
 epoch: 94, train_loss: 0.2073, test_loss: 2.5818, test_f1: 0.5602
 epoch: 95, train_loss: 0.2186, test_loss: 2.6267, test_f1: 0.5356
 epoch: 96, train_loss: 0.2066, test_loss: 2.8647, test_f1: 0.5110
 epoch: 97, train_loss: 0.2275, test_loss: 2.5127, test_f1: 0.5459
 epoch: 98, train_loss: 0.2265, test_loss: 2.5380, test_f1: 0.5243
 epoch: 99, train_loss: 0.2058, test_loss: 2.9200, test_f1: 0.5395
##################ITERATION #8 ****************************************
 epoch: 0, train_loss: 1.5925, test_loss: 1.3888, test_f1: 0.2975
 epoch: 1, train_loss: 1.2282, test_loss: 1.2218, test_f1: 0.3613
 epoch: 2, train_loss: 1.1328, test_loss: 1.1206, test_f1: 0.4411
 epoch: 3, train_loss: 1.0703, test_loss: 1.0542, test_f1: 0.4699
 epoch: 4, train_loss: 1.0270, test_loss: 1.0323, test_f1: 0.4953
 epoch: 5, train_loss: 1.0090, test_loss: 1.0119, test_f1: 0.4788
 epoch: 6, train_loss: 0.9757, test_loss: 1.0182, test_f1: 0.4769
 epoch: 7, train_loss: 0.9459, test_loss: 0.9724, test_f1: 0.5179
 epoch: 8, train_loss: 0.9258, test_loss: 0.9864, test_f1: 0.5191
 epoch: 9, train_loss: 0.9020, test_loss: 1.0211, test_f1: 0.4985
 epoch: 10, train_loss: 0.8950, test_loss: 1.0885, test_f1: 0.5026
 epoch: 11, train_loss: 0.9173, test_loss: 1.1064, test_f1: 0.4833
 epoch: 12, train_loss: 0.8741, test_loss: 1.0524, test_f1: 0.5444
 epoch: 13, train_loss: 0.8377, test_loss: 1.0254, test_f1: 0.5117
 epoch: 14, train_loss: 0.8075, test_loss: 1.1661, test_f1: 0.5049
 epoch: 15, train_loss: 0.8082, test_loss: 1.0952, test_f1: 0.5059
 epoch: 16, train_loss: 0.7968, test_loss: 1.1151, test_f1: 0.5181
 epoch: 17, train_loss: 0.8271, test_loss: 1.0857, test_f1: 0.5114
 epoch: 18, train_loss: 0.7896, test_loss: 1.1037, test_f1: 0.5166
 epoch: 19, train_loss: 0.7703, test_loss: 1.3782, test_f1: 0.4590
 epoch: 20, train_loss: 0.7527, test_loss: 1.1193, test_f1: 0.5229
 epoch: 21, train_loss: 0.7445, test_loss: 1.1235, test_f1: 0.5256
 epoch: 22, train_loss: 0.7263, test_loss: 1.1318, test_f1: 0.5157
 epoch: 23, train_loss: 0.6983, test_loss: 1.2190, test_f1: 0.5632
 epoch: 24, train_loss: 0.6919, test_loss: 1.1476, test_f1: 0.5464
 epoch: 25, train_loss: 0.6914, test_loss: 1.2216, test_f1: 0.5223
 epoch: 26, train_loss: 0.6756, test_loss: 1.2879, test_f1: 0.5146
 epoch: 27, train_loss: 0.6646, test_loss: 1.2762, test_f1: 0.5499
 epoch: 28, train_loss: 0.6525, test_loss: 1.1426, test_f1: 0.5430
 epoch: 29, train_loss: 0.6437, test_loss: 1.2981, test_f1: 0.5520
 epoch: 30, train_loss: 0.6648, test_loss: 1.1785, test_f1: 0.5535
 epoch: 31, train_loss: 0.6367, test_loss: 1.2993, test_f1: 0.5666
 epoch: 32, train_loss: 0.6070, test_loss: 1.3292, test_f1: 0.5185
 epoch: 33, train_loss: 0.6046, test_loss: 1.2389, test_f1: 0.5653
 epoch: 34, train_loss: 0.5962, test_loss: 1.3926, test_f1: 0.5313
 epoch: 35, train_loss: 0.6000, test_loss: 1.4794, test_f1: 0.5065
 epoch: 36, train_loss: 0.6092, test_loss: 1.2801, test_f1: 0.5511
 epoch: 37, train_loss: 0.5905, test_loss: 1.2448, test_f1: 0.5541
 epoch: 38, train_loss: 0.5604, test_loss: 1.4184, test_f1: 0.5451
 epoch: 39, train_loss: 0.5542, test_loss: 1.3565, test_f1: 0.5613
 epoch: 40, train_loss: 0.5396, test_loss: 1.4247, test_f1: 0.5772
 epoch: 41, train_loss: 0.5518, test_loss: 1.3835, test_f1: 0.5506
 epoch: 42, train_loss: 0.5755, test_loss: 1.5508, test_f1: 0.5210
 epoch: 43, train_loss: 0.5489, test_loss: 1.5628, test_f1: 0.5499
 epoch: 44, train_loss: 0.5377, test_loss: 1.4083, test_f1: 0.5821
 epoch: 45, train_loss: 0.5144, test_loss: 1.3405, test_f1: 0.5235
 epoch: 46, train_loss: 0.5155, test_loss: 1.4350, test_f1: 0.5627
 epoch: 47, train_loss: 0.4967, test_loss: 1.5322, test_f1: 0.5506
 epoch: 48, train_loss: 0.4713, test_loss: 1.6882, test_f1: 0.5395
 epoch: 49, train_loss: 0.5096, test_loss: 1.4391, test_f1: 0.5454
 epoch: 50, train_loss: 0.5130, test_loss: 1.4284, test_f1: 0.5542
 epoch: 51, train_loss: 0.4571, test_loss: 1.4948, test_f1: 0.5547
 epoch: 52, train_loss: 0.4265, test_loss: 1.5917, test_f1: 0.5448
 epoch: 53, train_loss: 0.4030, test_loss: 1.6894, test_f1: 0.5282
 epoch: 54, train_loss: 0.3830, test_loss: 1.7272, test_f1: 0.5635
 epoch: 55, train_loss: 0.3700, test_loss: 1.6687, test_f1: 0.5400
 epoch: 56, train_loss: 0.3718, test_loss: 1.7322, test_f1: 0.5726
 epoch: 57, train_loss: 0.3805, test_loss: 1.8253, test_f1: 0.5580
 epoch: 58, train_loss: 0.3703, test_loss: 1.7900, test_f1: 0.5361
 epoch: 59, train_loss: 0.3511, test_loss: 1.8605, test_f1: 0.5357
 epoch: 60, train_loss: 0.3557, test_loss: 1.8526, test_f1: 0.5384
 epoch: 61, train_loss: 0.3433, test_loss: 1.7191, test_f1: 0.5730
 epoch: 62, train_loss: 0.3478, test_loss: 1.9152, test_f1: 0.5563
 epoch: 63, train_loss: 0.3445, test_loss: 1.8857, test_f1: 0.5482
 epoch: 64, train_loss: 0.3390, test_loss: 1.8511, test_f1: 0.5334
 epoch: 65, train_loss: 0.3394, test_loss: 1.9164, test_f1: 0.5327
 epoch: 66, train_loss: 0.3394, test_loss: 1.9373, test_f1: 0.5550
 epoch: 67, train_loss: 0.3384, test_loss: 1.9780, test_f1: 0.5615
 epoch: 68, train_loss: 0.3298, test_loss: 1.8482, test_f1: 0.5667
 epoch: 69, train_loss: 0.3137, test_loss: 1.8650, test_f1: 0.5342
 epoch: 70, train_loss: 0.3195, test_loss: 2.0596, test_f1: 0.5290
 epoch: 71, train_loss: 0.3233, test_loss: 2.0835, test_f1: 0.5366
 epoch: 72, train_loss: 0.3104, test_loss: 2.1891, test_f1: 0.5274
 epoch: 73, train_loss: 0.2961, test_loss: 1.9922, test_f1: 0.5604
 epoch: 74, train_loss: 0.3037, test_loss: 2.0784, test_f1: 0.5536
 epoch: 75, train_loss: 0.2974, test_loss: 2.1806, test_f1: 0.5133
 epoch: 76, train_loss: 0.2827, test_loss: 2.1806, test_f1: 0.5376
 epoch: 77, train_loss: 0.2554, test_loss: 2.2160, test_f1: 0.5193
 epoch: 78, train_loss: 0.2763, test_loss: 2.2079, test_f1: 0.5355
 epoch: 79, train_loss: 0.2838, test_loss: 2.3350, test_f1: 0.5530
 epoch: 80, train_loss: 0.3061, test_loss: 2.1909, test_f1: 0.5201
 epoch: 81, train_loss: 0.2891, test_loss: 2.1865, test_f1: 0.5272
 epoch: 82, train_loss: 0.2705, test_loss: 2.2549, test_f1: 0.5231
 epoch: 83, train_loss: 0.2629, test_loss: 2.4679, test_f1: 0.5166
 epoch: 84, train_loss: 0.2649, test_loss: 2.4126, test_f1: 0.5339
 epoch: 85, train_loss: 0.2773, test_loss: 2.2693, test_f1: 0.5289
 epoch: 86, train_loss: 0.2998, test_loss: 2.2163, test_f1: 0.5460
 epoch: 87, train_loss: 0.2816, test_loss: 2.3730, test_f1: 0.5402
 epoch: 88, train_loss: 0.2684, test_loss: 2.4106, test_f1: 0.5269
 epoch: 89, train_loss: 0.2521, test_loss: 2.4308, test_f1: 0.5329
 epoch: 90, train_loss: 0.2370, test_loss: 2.2191, test_f1: 0.5558
 epoch: 91, train_loss: 0.2486, test_loss: 2.2281, test_f1: 0.5462
 epoch: 92, train_loss: 0.2548, test_loss: 2.3138, test_f1: 0.5630
 epoch: 93, train_loss: 0.2428, test_loss: 2.4811, test_f1: 0.5449
 epoch: 94, train_loss: 0.2289, test_loss: 2.6475, test_f1: 0.5210
 epoch: 95, train_loss: 0.2389, test_loss: 2.4270, test_f1: 0.5436
 epoch: 96, train_loss: 0.2324, test_loss: 2.4985, test_f1: 0.5521
 epoch: 97, train_loss: 0.2746, test_loss: 2.2257, test_f1: 0.5432
 epoch: 98, train_loss: 0.2322, test_loss: 2.4558, test_f1: 0.5372
 epoch: 99, train_loss: 0.2467, test_loss: 2.5153, test_f1: 0.5215
##################ITERATION #9 ****************************************
 epoch: 0, train_loss: 1.5588, test_loss: 1.3078, test_f1: 0.2634
 epoch: 1, train_loss: 1.2006, test_loss: 1.2033, test_f1: 0.3401
 epoch: 2, train_loss: 1.1292, test_loss: 1.1266, test_f1: 0.4255
 epoch: 3, train_loss: 1.0844, test_loss: 1.0667, test_f1: 0.4733
 epoch: 4, train_loss: 1.0473, test_loss: 1.0406, test_f1: 0.4830
 epoch: 5, train_loss: 1.0231, test_loss: 1.0226, test_f1: 0.4883
 epoch: 6, train_loss: 0.9888, test_loss: 1.0004, test_f1: 0.4897
 epoch: 7, train_loss: 0.9606, test_loss: 1.0444, test_f1: 0.4614
 epoch: 8, train_loss: 0.9458, test_loss: 1.0085, test_f1: 0.4648
 epoch: 9, train_loss: 0.9248, test_loss: 1.0026, test_f1: 0.4777
 epoch: 10, train_loss: 0.8802, test_loss: 0.9866, test_f1: 0.5136
 epoch: 11, train_loss: 0.8764, test_loss: 1.0147, test_f1: 0.4843
 epoch: 12, train_loss: 0.8471, test_loss: 1.0245, test_f1: 0.4950
 epoch: 13, train_loss: 0.8385, test_loss: 1.0084, test_f1: 0.5161
 epoch: 14, train_loss: 0.8176, test_loss: 1.0808, test_f1: 0.4805
 epoch: 15, train_loss: 0.7974, test_loss: 1.1674, test_f1: 0.4892
 epoch: 16, train_loss: 0.7753, test_loss: 1.1239, test_f1: 0.4860
 epoch: 17, train_loss: 0.7814, test_loss: 1.1452, test_f1: 0.4820
 epoch: 18, train_loss: 0.7710, test_loss: 1.0725, test_f1: 0.5055
 epoch: 19, train_loss: 0.7451, test_loss: 1.1497, test_f1: 0.4930
 epoch: 20, train_loss: 0.7438, test_loss: 1.1163, test_f1: 0.5055
 epoch: 21, train_loss: 0.7188, test_loss: 1.1153, test_f1: 0.5204
 epoch: 22, train_loss: 0.7215, test_loss: 1.1472, test_f1: 0.5097
 epoch: 23, train_loss: 0.7183, test_loss: 1.2886, test_f1: 0.4857
 epoch: 24, train_loss: 0.7039, test_loss: 1.1488, test_f1: 0.5270
 epoch: 25, train_loss: 0.6908, test_loss: 1.2079, test_f1: 0.5127
 epoch: 26, train_loss: 0.6632, test_loss: 1.1436, test_f1: 0.5201
 epoch: 27, train_loss: 0.6664, test_loss: 1.3381, test_f1: 0.5075
 epoch: 28, train_loss: 0.6665, test_loss: 1.2678, test_f1: 0.5177
 epoch: 29, train_loss: 0.6469, test_loss: 1.2991, test_f1: 0.5086
 epoch: 30, train_loss: 0.6262, test_loss: 1.4129, test_f1: 0.5003
 epoch: 31, train_loss: 0.6169, test_loss: 1.2795, test_f1: 0.5312
 epoch: 32, train_loss: 0.6112, test_loss: 1.3428, test_f1: 0.5244
 epoch: 33, train_loss: 0.6018, test_loss: 1.4450, test_f1: 0.5291
 epoch: 34, train_loss: 0.6017, test_loss: 1.4027, test_f1: 0.5061
 epoch: 35, train_loss: 0.6084, test_loss: 1.3708, test_f1: 0.5527
 epoch: 36, train_loss: 0.5823, test_loss: 1.5108, test_f1: 0.5013
 epoch: 37, train_loss: 0.5740, test_loss: 1.4892, test_f1: 0.5132
 epoch: 38, train_loss: 0.5632, test_loss: 1.5197, test_f1: 0.5324
 epoch: 39, train_loss: 0.5417, test_loss: 1.4700, test_f1: 0.5266
 epoch: 40, train_loss: 0.5481, test_loss: 1.4352, test_f1: 0.5204
 epoch: 41, train_loss: 0.5339, test_loss: 1.6170, test_f1: 0.5169
 epoch: 42, train_loss: 0.5342, test_loss: 1.4908, test_f1: 0.5692
 epoch: 43, train_loss: 0.5345, test_loss: 1.5640, test_f1: 0.5236
 epoch: 44, train_loss: 0.5255, test_loss: 1.5458, test_f1: 0.5172
 epoch: 45, train_loss: 0.5091, test_loss: 1.5583, test_f1: 0.5411
 epoch: 46, train_loss: 0.4905, test_loss: 1.5682, test_f1: 0.5131
 epoch: 47, train_loss: 0.4818, test_loss: 1.6631, test_f1: 0.5220
 epoch: 48, train_loss: 0.4957, test_loss: 1.4623, test_f1: 0.5340
 epoch: 49, train_loss: 0.4961, test_loss: 1.8025, test_f1: 0.5264
 epoch: 50, train_loss: 0.4727, test_loss: 1.7115, test_f1: 0.5269
 epoch: 51, train_loss: 0.4469, test_loss: 1.7015, test_f1: 0.5250
 epoch: 52, train_loss: 0.4056, test_loss: 1.8308, test_f1: 0.5303
 epoch: 53, train_loss: 0.3881, test_loss: 1.8820, test_f1: 0.5111
 epoch: 54, train_loss: 0.3715, test_loss: 1.8847, test_f1: 0.5168
 epoch: 55, train_loss: 0.3590, test_loss: 1.8933, test_f1: 0.5256
 epoch: 56, train_loss: 0.3651, test_loss: 1.9358, test_f1: 0.5378
 epoch: 57, train_loss: 0.3805, test_loss: 1.8952, test_f1: 0.5372
 epoch: 58, train_loss: 0.3604, test_loss: 1.8722, test_f1: 0.5364
 epoch: 59, train_loss: 0.3526, test_loss: 2.0031, test_f1: 0.5002
 epoch: 60, train_loss: 0.3533, test_loss: 2.0466, test_f1: 0.5061
 epoch: 61, train_loss: 0.3384, test_loss: 2.1064, test_f1: 0.5160
 epoch: 62, train_loss: 0.3208, test_loss: 2.0266, test_f1: 0.5215
 epoch: 63, train_loss: 0.3230, test_loss: 2.0203, test_f1: 0.5226
 epoch: 64, train_loss: 0.3281, test_loss: 2.0576, test_f1: 0.5280
 epoch: 65, train_loss: 0.3212, test_loss: 2.0351, test_f1: 0.5086
 epoch: 66, train_loss: 0.2951, test_loss: 2.0020, test_f1: 0.5332
 epoch: 67, train_loss: 0.2994, test_loss: 2.0235, test_f1: 0.5187
 epoch: 68, train_loss: 0.2986, test_loss: 2.0872, test_f1: 0.5238
 epoch: 69, train_loss: 0.3125, test_loss: 2.2264, test_f1: 0.5013
 epoch: 70, train_loss: 0.3071, test_loss: 2.1508, test_f1: 0.5177
 epoch: 71, train_loss: 0.3184, test_loss: 2.1398, test_f1: 0.5195
 epoch: 72, train_loss: 0.3269, test_loss: 2.0219, test_f1: 0.5451
 epoch: 73, train_loss: 0.3038, test_loss: 2.0348, test_f1: 0.5346
 epoch: 74, train_loss: 0.3003, test_loss: 2.1366, test_f1: 0.5178
 epoch: 75, train_loss: 0.3085, test_loss: 2.0853, test_f1: 0.5386
 epoch: 76, train_loss: 0.2882, test_loss: 2.1319, test_f1: 0.5295
 epoch: 77, train_loss: 0.2966, test_loss: 2.0662, test_f1: 0.5195
 epoch: 78, train_loss: 0.2721, test_loss: 2.1059, test_f1: 0.5299
 epoch: 79, train_loss: 0.2688, test_loss: 2.2302, test_f1: 0.5293
 epoch: 80, train_loss: 0.2556, test_loss: 2.3541, test_f1: 0.5269
 epoch: 81, train_loss: 0.2579, test_loss: 2.3645, test_f1: 0.5568
 epoch: 82, train_loss: 0.2578, test_loss: 2.3507, test_f1: 0.5300
 epoch: 83, train_loss: 0.2672, test_loss: 2.5234, test_f1: 0.5226
 epoch: 84, train_loss: 0.2746, test_loss: 2.3423, test_f1: 0.5154
 epoch: 85, train_loss: 0.2649, test_loss: 2.1187, test_f1: 0.5385
 epoch: 86, train_loss: 0.2683, test_loss: 2.3333, test_f1: 0.5338
 epoch: 87, train_loss: 0.2569, test_loss: 2.3448, test_f1: 0.5253
 epoch: 88, train_loss: 0.2822, test_loss: 2.3665, test_f1: 0.5357
 epoch: 89, train_loss: 0.2574, test_loss: 2.3084, test_f1: 0.5419
 epoch: 90, train_loss: 0.2568, test_loss: 2.3450, test_f1: 0.5386
 epoch: 91, train_loss: 0.2642, test_loss: 2.3741, test_f1: 0.5335
 epoch: 92, train_loss: 0.2495, test_loss: 2.3944, test_f1: 0.5282
 epoch: 93, train_loss: 0.2411, test_loss: 2.4341, test_f1: 0.5388
 epoch: 94, train_loss: 0.2493, test_loss: 2.3729, test_f1: 0.5317
 epoch: 95, train_loss: 0.2327, test_loss: 2.4080, test_f1: 0.5313
 epoch: 96, train_loss: 0.2462, test_loss: 2.3367, test_f1: 0.5358
 epoch: 97, train_loss: 0.2404, test_loss: 2.2967, test_f1: 0.5377
 epoch: 98, train_loss: 0.2618, test_loss: 2.4605, test_f1: 0.5495
 epoch: 99, train_loss: 0.2513, test_loss: 2.4198, test_f1: 0.5344

Training completed in 412.70 seconds
Best F1: 0.5983 at epoch 15
Mean F1 across iterations: 0.5678  0.0130
========================FINAL RESULTS================================
FEGIN weighted F1: 0.5983  0.0130
python main.py --data ltspice_examples --representation component_component --model FEGIN --layers 5 --hiddens 128 --batch_size 256 --lr 0.001 --emb_size 250 --epochs 100 --save_appendix component_component_L5_H128_BS256_LR0.001_E250 --no_val
-----



STDERR:
  File "main.py", line 370, in <module>
    main()
  File "main.py", line 254, in main
    dataset = dataset_class(
  File "/home/philip/projects/ltspice_examples_code_repo/Circuit-Completion-Using-GNNs/component_classification_with_link_prediction_head/evaluation/FEGIN/kernel/circuit_datasets.py", line 15, in __init__
    self.data, self.slices = torch.load(self.processed_paths[0])
  File "/home/philip/.local/lib/python3.8/site-packages/torch/serialization.py", line 1040, in load
    warnings.warn(
  File "/usr/lib/python3.8/warnings.py", line 109, in _showwarnmsg
    sw(msg.message, msg.category, msg.filename, msg.lineno,
  File "main.py", line 47, in warn_with_traceback
    traceback.print_stack(file=log)
/home/philip/projects/ltspice_examples_code_repo/Circuit-Completion-Using-GNNs/component_classification_with_link_prediction_head/evaluation/FEGIN/kernel/circuit_datasets.py:15: FutureWarning: You are using `torch.load` with `weights_only=False` (the current default value), which uses the default pickle module implicitly. It is possible to construct malicious pickle data which will execute arbitrary code during unpickling (See https://github.com/pytorch/pytorch/blob/main/SECURITY.md#untrusted-models for more details). In a future release, the default value for `weights_only` will be flipped to `True`. This limits the functions that could be executed during unpickling. Arbitrary objects will no longer be allowed to be loaded via this mode unless they are explicitly allowlisted by the user via `torch.serialization.add_safe_globals`. We recommend you start setting `weights_only=True` for any use case where you don't have full control of the loaded file. Please open an issue on GitHub for any issues related to this experimental feature.
  self.data, self.slices = torch.load(self.processed_paths[0])
