STDOUT:
Results will be saved in /home/philip/projects/ltspice_examples_code_repo/Circuit-Completion-Using-GNNs/component_classification_with_link_prediction_head/evaluation/FEGIN/results/model_FEGIN_dataset_ltspice_examples
Command line input: python main.py --data ltspice_examples --representation component_component --model FEGIN --layers 3 --hiddens 32 --batch_size 256 --lr 0.01 --emb_size 250 --epochs 100 --save_appendix component_component_L3_H32_BS256_LR0.01_E250 --no_val
 is saved.
-----
ltspice_examples - FEGIN
Using 3 layers, 32 hidden units, h = 2
Loading component_component representation dataset
ENTERED
Training FEGIN on component_component representation
Train: 3556, Test: 845
##################ITERATION #0 ****************************************
 epoch: 0, train_loss: 1.2967, test_loss: 1.2606, test_f1: 0.2870
 epoch: 1, train_loss: 1.2259, test_loss: 1.2245, test_f1: 0.2708
 epoch: 2, train_loss: 1.1918, test_loss: 1.1565, test_f1: 0.3487
 epoch: 3, train_loss: 1.1494, test_loss: 1.1426, test_f1: 0.4033
 epoch: 4, train_loss: 1.1102, test_loss: 1.0545, test_f1: 0.4688
 epoch: 5, train_loss: 1.0802, test_loss: 1.0690, test_f1: 0.4577
 epoch: 6, train_loss: 1.0610, test_loss: 0.9856, test_f1: 0.4607
 epoch: 7, train_loss: 1.0104, test_loss: 0.9757, test_f1: 0.4826
 epoch: 8, train_loss: 0.9926, test_loss: 1.0050, test_f1: 0.5047
 epoch: 9, train_loss: 0.9745, test_loss: 1.0684, test_f1: 0.5091
 epoch: 10, train_loss: 0.9680, test_loss: 0.9767, test_f1: 0.4851
 epoch: 11, train_loss: 0.9437, test_loss: 0.9941, test_f1: 0.4724
 epoch: 12, train_loss: 0.9198, test_loss: 1.0143, test_f1: 0.5140
 epoch: 13, train_loss: 0.9091, test_loss: 0.9677, test_f1: 0.4995
 epoch: 14, train_loss: 0.8703, test_loss: 1.0010, test_f1: 0.5345
 epoch: 15, train_loss: 0.8571, test_loss: 1.0701, test_f1: 0.5029
 epoch: 16, train_loss: 0.8440, test_loss: 1.0584, test_f1: 0.5018
 epoch: 17, train_loss: 0.8614, test_loss: 1.3985, test_f1: 0.4723
 epoch: 18, train_loss: 0.8431, test_loss: 1.0091, test_f1: 0.5447
 epoch: 19, train_loss: 0.8394, test_loss: 1.0901, test_f1: 0.5065
 epoch: 20, train_loss: 0.8284, test_loss: 1.1069, test_f1: 0.5206
 epoch: 21, train_loss: 0.8098, test_loss: 1.0511, test_f1: 0.5234
 epoch: 22, train_loss: 0.7965, test_loss: 0.9817, test_f1: 0.5390
 epoch: 23, train_loss: 0.8259, test_loss: 0.9534, test_f1: 0.5560
 epoch: 24, train_loss: 0.8023, test_loss: 1.1265, test_f1: 0.5228
 epoch: 25, train_loss: 0.7745, test_loss: 1.0821, test_f1: 0.5042
 epoch: 26, train_loss: 0.7611, test_loss: 1.1018, test_f1: 0.5490
 epoch: 27, train_loss: 0.7797, test_loss: 1.2295, test_f1: 0.5363
 epoch: 28, train_loss: 0.7685, test_loss: 1.1202, test_f1: 0.5058
 epoch: 29, train_loss: 0.7694, test_loss: 1.0245, test_f1: 0.5146
 epoch: 30, train_loss: 0.7693, test_loss: 1.1644, test_f1: 0.5480
 epoch: 31, train_loss: 0.7617, test_loss: 1.1146, test_f1: 0.5657
 epoch: 32, train_loss: 0.7496, test_loss: 1.0906, test_f1: 0.5268
 epoch: 33, train_loss: 0.7228, test_loss: 1.0901, test_f1: 0.5570
 epoch: 34, train_loss: 0.7553, test_loss: 1.2421, test_f1: 0.5254
 epoch: 35, train_loss: 0.7456, test_loss: 1.0268, test_f1: 0.5234
 epoch: 36, train_loss: 0.7657, test_loss: 1.8913, test_f1: 0.4208
 epoch: 37, train_loss: 0.7836, test_loss: 1.0542, test_f1: 0.5457
 epoch: 38, train_loss: 0.7603, test_loss: 1.1207, test_f1: 0.5138
 epoch: 39, train_loss: 0.7157, test_loss: 1.1503, test_f1: 0.5303
 epoch: 40, train_loss: 0.7092, test_loss: 1.1511, test_f1: 0.5427
 epoch: 41, train_loss: 0.6967, test_loss: 1.2004, test_f1: 0.5750
 epoch: 42, train_loss: 0.6868, test_loss: 1.2916, test_f1: 0.5197
 epoch: 43, train_loss: 0.7086, test_loss: 1.2404, test_f1: 0.5131
 epoch: 44, train_loss: 0.7144, test_loss: 1.1835, test_f1: 0.5474
 epoch: 45, train_loss: 0.7000, test_loss: 1.1564, test_f1: 0.5476
 epoch: 46, train_loss: 0.7153, test_loss: 1.3215, test_f1: 0.5016
 epoch: 47, train_loss: 0.7707, test_loss: 1.1654, test_f1: 0.5338
 epoch: 48, train_loss: 0.7050, test_loss: 1.1313, test_f1: 0.5531
 epoch: 49, train_loss: 0.6762, test_loss: 1.3055, test_f1: 0.5143
 epoch: 50, train_loss: 0.6713, test_loss: 1.2999, test_f1: 0.5286
 epoch: 51, train_loss: 0.6449, test_loss: 1.2811, test_f1: 0.5272
 epoch: 52, train_loss: 0.6139, test_loss: 1.3971, test_f1: 0.5275
 epoch: 53, train_loss: 0.5941, test_loss: 1.3411, test_f1: 0.5308
 epoch: 54, train_loss: 0.6004, test_loss: 1.3595, test_f1: 0.5036
 epoch: 55, train_loss: 0.6001, test_loss: 1.5117, test_f1: 0.5235
 epoch: 56, train_loss: 0.5948, test_loss: 1.3145, test_f1: 0.5446
 epoch: 57, train_loss: 0.5847, test_loss: 1.4024, test_f1: 0.5254
 epoch: 58, train_loss: 0.5731, test_loss: 1.4281, test_f1: 0.5248
 epoch: 59, train_loss: 0.5724, test_loss: 1.5104, test_f1: 0.5382
 epoch: 60, train_loss: 0.5907, test_loss: 1.5649, test_f1: 0.5101
 epoch: 61, train_loss: 0.5713, test_loss: 1.4645, test_f1: 0.5365
 epoch: 62, train_loss: 0.5680, test_loss: 1.4940, test_f1: 0.5600
 epoch: 63, train_loss: 0.5609, test_loss: 1.3707, test_f1: 0.5613
 epoch: 64, train_loss: 0.5520, test_loss: 1.4892, test_f1: 0.5378
 epoch: 65, train_loss: 0.5649, test_loss: 1.6100, test_f1: 0.4903
 epoch: 66, train_loss: 0.5529, test_loss: 1.4572, test_f1: 0.5433
 epoch: 67, train_loss: 0.5696, test_loss: 1.4178, test_f1: 0.5327
 epoch: 68, train_loss: 0.5532, test_loss: 1.5584, test_f1: 0.5225
 epoch: 69, train_loss: 0.5351, test_loss: 1.5994, test_f1: 0.5295
 epoch: 70, train_loss: 0.5286, test_loss: 1.6730, test_f1: 0.5115
 epoch: 71, train_loss: 0.5334, test_loss: 1.5014, test_f1: 0.5147
 epoch: 72, train_loss: 0.5239, test_loss: 1.6306, test_f1: 0.5374
 epoch: 73, train_loss: 0.5334, test_loss: 1.6091, test_f1: 0.5216
 epoch: 74, train_loss: 0.5504, test_loss: 1.6225, test_f1: 0.5523
 epoch: 75, train_loss: 0.5420, test_loss: 1.4460, test_f1: 0.5395
 epoch: 76, train_loss: 0.5457, test_loss: 1.4873, test_f1: 0.5299
 epoch: 77, train_loss: 0.5286, test_loss: 1.6851, test_f1: 0.5088
 epoch: 78, train_loss: 0.5076, test_loss: 1.7001, test_f1: 0.5497
 epoch: 79, train_loss: 0.5404, test_loss: 1.6321, test_f1: 0.5161
 epoch: 80, train_loss: 0.5315, test_loss: 1.5933, test_f1: 0.5200
 epoch: 81, train_loss: 0.5510, test_loss: 1.5553, test_f1: 0.5448
 epoch: 82, train_loss: 0.5274, test_loss: 1.5639, test_f1: 0.5561
 epoch: 83, train_loss: 0.5283, test_loss: 1.3863, test_f1: 0.5438
 epoch: 84, train_loss: 0.5115, test_loss: 1.6561, test_f1: 0.5396
 epoch: 85, train_loss: 0.4940, test_loss: 1.5663, test_f1: 0.5233
 epoch: 86, train_loss: 0.5071, test_loss: 1.5744, test_f1: 0.5376
 epoch: 87, train_loss: 0.4847, test_loss: 1.5106, test_f1: 0.5657
 epoch: 88, train_loss: 0.4804, test_loss: 1.5879, test_f1: 0.5410
 epoch: 89, train_loss: 0.4876, test_loss: 1.6429, test_f1: 0.5328
 epoch: 90, train_loss: 0.4812, test_loss: 1.6093, test_f1: 0.5168
 epoch: 91, train_loss: 0.4858, test_loss: 1.5791, test_f1: 0.5498
 epoch: 92, train_loss: 0.4754, test_loss: 1.7954, test_f1: 0.5287
 epoch: 93, train_loss: 0.4839, test_loss: 1.6076, test_f1: 0.5390
 epoch: 94, train_loss: 0.4972, test_loss: 1.5674, test_f1: 0.5621
 epoch: 95, train_loss: 0.4609, test_loss: 1.9061, test_f1: 0.5133
 epoch: 96, train_loss: 0.4568, test_loss: 1.6510, test_f1: 0.5529
 epoch: 97, train_loss: 0.4998, test_loss: 1.5964, test_f1: 0.5412
 epoch: 98, train_loss: 0.4898, test_loss: 1.4986, test_f1: 0.5483
 epoch: 99, train_loss: 0.4866, test_loss: 1.5121, test_f1: 0.5691
##################ITERATION #1 ****************************************
 epoch: 0, train_loss: 1.2812, test_loss: 1.2579, test_f1: 0.2665
 epoch: 1, train_loss: 1.1564, test_loss: 1.1814, test_f1: 0.3344
 epoch: 2, train_loss: 1.0984, test_loss: 1.0606, test_f1: 0.4547
 epoch: 3, train_loss: 1.0548, test_loss: 1.0506, test_f1: 0.4639
 epoch: 4, train_loss: 1.0630, test_loss: 1.1102, test_f1: 0.4429
 epoch: 5, train_loss: 1.0495, test_loss: 0.9902, test_f1: 0.5067
 epoch: 6, train_loss: 1.0196, test_loss: 0.9655, test_f1: 0.4864
 epoch: 7, train_loss: 1.0057, test_loss: 0.9652, test_f1: 0.5152
 epoch: 8, train_loss: 0.9785, test_loss: 1.0504, test_f1: 0.4910
 epoch: 9, train_loss: 0.9568, test_loss: 0.9886, test_f1: 0.5171
 epoch: 10, train_loss: 0.9609, test_loss: 1.0518, test_f1: 0.5041
 epoch: 11, train_loss: 0.9471, test_loss: 1.0069, test_f1: 0.4991
 epoch: 12, train_loss: 0.9362, test_loss: 1.1511, test_f1: 0.4493
 epoch: 13, train_loss: 0.9166, test_loss: 1.0577, test_f1: 0.4612
 epoch: 14, train_loss: 0.9404, test_loss: 0.9344, test_f1: 0.5151
 epoch: 15, train_loss: 0.9194, test_loss: 1.0708, test_f1: 0.4923
 epoch: 16, train_loss: 0.9045, test_loss: 1.0928, test_f1: 0.4754
 epoch: 17, train_loss: 0.8921, test_loss: 1.2296, test_f1: 0.4686
 epoch: 18, train_loss: 0.8788, test_loss: 1.1571, test_f1: 0.5025
 epoch: 19, train_loss: 0.8779, test_loss: 1.0493, test_f1: 0.4974
 epoch: 20, train_loss: 0.8602, test_loss: 1.0508, test_f1: 0.5024
 epoch: 21, train_loss: 0.8574, test_loss: 1.1637, test_f1: 0.4916
 epoch: 22, train_loss: 0.8710, test_loss: 1.0051, test_f1: 0.5043
 epoch: 23, train_loss: 0.8507, test_loss: 1.0276, test_f1: 0.5414
 epoch: 24, train_loss: 0.8463, test_loss: 1.1495, test_f1: 0.4859
 epoch: 25, train_loss: 0.8798, test_loss: 1.0159, test_f1: 0.5232
 epoch: 26, train_loss: 0.8340, test_loss: 1.0551, test_f1: 0.5604
 epoch: 27, train_loss: 0.8275, test_loss: 1.1156, test_f1: 0.5006
 epoch: 28, train_loss: 0.8120, test_loss: 1.1479, test_f1: 0.5268
 epoch: 29, train_loss: 0.8043, test_loss: 1.0901, test_f1: 0.5163
 epoch: 30, train_loss: 0.8043, test_loss: 1.2635, test_f1: 0.4693
 epoch: 31, train_loss: 0.7985, test_loss: 1.2120, test_f1: 0.4831
 epoch: 32, train_loss: 0.7900, test_loss: 1.0861, test_f1: 0.5285
 epoch: 33, train_loss: 0.8022, test_loss: 0.9781, test_f1: 0.5425
 epoch: 34, train_loss: 0.7901, test_loss: 1.1819, test_f1: 0.5038
 epoch: 35, train_loss: 0.7801, test_loss: 1.0168, test_f1: 0.5645
 epoch: 36, train_loss: 0.7665, test_loss: 1.1005, test_f1: 0.5448
 epoch: 37, train_loss: 0.7763, test_loss: 1.1571, test_f1: 0.5212
 epoch: 38, train_loss: 0.7591, test_loss: 1.1243, test_f1: 0.5473
 epoch: 39, train_loss: 0.7557, test_loss: 1.2273, test_f1: 0.5096
 epoch: 40, train_loss: 0.7470, test_loss: 1.2313, test_f1: 0.5488
 epoch: 41, train_loss: 0.7579, test_loss: 1.2503, test_f1: 0.5176
 epoch: 42, train_loss: 0.7503, test_loss: 1.1372, test_f1: 0.5509
 epoch: 43, train_loss: 0.7426, test_loss: 1.3838, test_f1: 0.4729
 epoch: 44, train_loss: 0.7432, test_loss: 1.1744, test_f1: 0.5623
 epoch: 45, train_loss: 0.7269, test_loss: 1.2094, test_f1: 0.5526
 epoch: 46, train_loss: 0.7097, test_loss: 1.1843, test_f1: 0.5461
 epoch: 47, train_loss: 0.6880, test_loss: 1.1892, test_f1: 0.5394
 epoch: 48, train_loss: 0.6802, test_loss: 1.2737, test_f1: 0.5560
 epoch: 49, train_loss: 0.6913, test_loss: 1.2450, test_f1: 0.5337
 epoch: 50, train_loss: 0.7008, test_loss: 1.4036, test_f1: 0.5043
 epoch: 51, train_loss: 0.6808, test_loss: 1.3498, test_f1: 0.5274
 epoch: 52, train_loss: 0.6474, test_loss: 1.2945, test_f1: 0.5537
 epoch: 53, train_loss: 0.6246, test_loss: 1.3158, test_f1: 0.5414
 epoch: 54, train_loss: 0.6228, test_loss: 1.2639, test_f1: 0.5543
 epoch: 55, train_loss: 0.6103, test_loss: 1.3107, test_f1: 0.5384
 epoch: 56, train_loss: 0.6246, test_loss: 1.2708, test_f1: 0.5581
 epoch: 57, train_loss: 0.6029, test_loss: 1.3770, test_f1: 0.5452
 epoch: 58, train_loss: 0.5948, test_loss: 1.3366, test_f1: 0.5632
 epoch: 59, train_loss: 0.5907, test_loss: 1.3512, test_f1: 0.5524
 epoch: 60, train_loss: 0.5810, test_loss: 1.3907, test_f1: 0.5677
 epoch: 61, train_loss: 0.5818, test_loss: 1.3849, test_f1: 0.5421
 epoch: 62, train_loss: 0.5771, test_loss: 1.3415, test_f1: 0.5565
 epoch: 63, train_loss: 0.5560, test_loss: 1.5299, test_f1: 0.5494
 epoch: 64, train_loss: 0.5680, test_loss: 1.5280, test_f1: 0.5549
 epoch: 65, train_loss: 0.5637, test_loss: 1.4373, test_f1: 0.5431
 epoch: 66, train_loss: 0.5685, test_loss: 1.3976, test_f1: 0.5739
 epoch: 67, train_loss: 0.5645, test_loss: 1.3280, test_f1: 0.5925
 epoch: 68, train_loss: 0.5565, test_loss: 1.4541, test_f1: 0.5366
 epoch: 69, train_loss: 0.5459, test_loss: 1.5129, test_f1: 0.5364
 epoch: 70, train_loss: 0.5325, test_loss: 1.5402, test_f1: 0.5794
 epoch: 71, train_loss: 0.5370, test_loss: 1.6993, test_f1: 0.5302
 epoch: 72, train_loss: 0.5483, test_loss: 1.7380, test_f1: 0.5201
 epoch: 73, train_loss: 0.5268, test_loss: 1.6217, test_f1: 0.5610
 epoch: 74, train_loss: 0.5269, test_loss: 1.6320, test_f1: 0.5491
 epoch: 75, train_loss: 0.5620, test_loss: 1.7836, test_f1: 0.5124
 epoch: 76, train_loss: 0.5502, test_loss: 1.5754, test_f1: 0.5345
 epoch: 77, train_loss: 0.5282, test_loss: 1.8753, test_f1: 0.4832
 epoch: 78, train_loss: 0.5236, test_loss: 1.4671, test_f1: 0.5775
 epoch: 79, train_loss: 0.5410, test_loss: 1.4120, test_f1: 0.5799
 epoch: 80, train_loss: 0.5203, test_loss: 1.5578, test_f1: 0.5825
 epoch: 81, train_loss: 0.5085, test_loss: 1.5151, test_f1: 0.5708
 epoch: 82, train_loss: 0.5156, test_loss: 1.4882, test_f1: 0.5656
 epoch: 83, train_loss: 0.4897, test_loss: 1.7591, test_f1: 0.5230
 epoch: 84, train_loss: 0.5069, test_loss: 1.7052, test_f1: 0.5479
 epoch: 85, train_loss: 0.5072, test_loss: 1.7912, test_f1: 0.5167
 epoch: 86, train_loss: 0.4925, test_loss: 1.5372, test_f1: 0.5601
 epoch: 87, train_loss: 0.4982, test_loss: 1.7073, test_f1: 0.5326
 epoch: 88, train_loss: 0.5244, test_loss: 1.6777, test_f1: 0.5393
 epoch: 89, train_loss: 0.5131, test_loss: 1.9562, test_f1: 0.5226
 epoch: 90, train_loss: 0.5100, test_loss: 1.5839, test_f1: 0.5748
 epoch: 91, train_loss: 0.4809, test_loss: 1.5551, test_f1: 0.5682
 epoch: 92, train_loss: 0.5129, test_loss: 1.7328, test_f1: 0.5448
 epoch: 93, train_loss: 0.4797, test_loss: 1.6932, test_f1: 0.5362
 epoch: 94, train_loss: 0.4653, test_loss: 1.6955, test_f1: 0.5657
 epoch: 95, train_loss: 0.4844, test_loss: 1.5218, test_f1: 0.5670
 epoch: 96, train_loss: 0.4997, test_loss: 1.6900, test_f1: 0.5578
 epoch: 97, train_loss: 0.4765, test_loss: 1.6689, test_f1: 0.5488
 epoch: 98, train_loss: 0.4426, test_loss: 1.7053, test_f1: 0.5640
 epoch: 99, train_loss: 0.4591, test_loss: 1.9424, test_f1: 0.5271
##################ITERATION #2 ****************************************
 epoch: 0, train_loss: 1.3137, test_loss: 1.2832, test_f1: 0.2274
 epoch: 1, train_loss: 1.1805, test_loss: 1.2038, test_f1: 0.3518
 epoch: 2, train_loss: 1.1251, test_loss: 1.1411, test_f1: 0.3978
 epoch: 3, train_loss: 1.0854, test_loss: 1.0404, test_f1: 0.4457
 epoch: 4, train_loss: 1.0684, test_loss: 0.9657, test_f1: 0.5248
 epoch: 5, train_loss: 1.0545, test_loss: 1.0536, test_f1: 0.4415
 epoch: 6, train_loss: 1.0139, test_loss: 1.0481, test_f1: 0.4319
 epoch: 7, train_loss: 1.0090, test_loss: 1.0013, test_f1: 0.4832
 epoch: 8, train_loss: 1.0074, test_loss: 0.9740, test_f1: 0.5115
 epoch: 9, train_loss: 0.9770, test_loss: 0.9828, test_f1: 0.4548
 epoch: 10, train_loss: 0.9480, test_loss: 1.0131, test_f1: 0.4924
 epoch: 11, train_loss: 0.9420, test_loss: 0.9798, test_f1: 0.4980
 epoch: 12, train_loss: 0.9403, test_loss: 1.0494, test_f1: 0.4603
 epoch: 13, train_loss: 0.9266, test_loss: 0.9882, test_f1: 0.5059
 epoch: 14, train_loss: 0.8963, test_loss: 0.9644, test_f1: 0.5015
 epoch: 15, train_loss: 0.8992, test_loss: 0.9405, test_f1: 0.5283
 epoch: 16, train_loss: 0.8772, test_loss: 1.0136, test_f1: 0.4910
 epoch: 17, train_loss: 0.8868, test_loss: 0.9771, test_f1: 0.4921
 epoch: 18, train_loss: 0.8821, test_loss: 1.0035, test_f1: 0.5040
 epoch: 19, train_loss: 0.8751, test_loss: 0.9681, test_f1: 0.5464
 epoch: 20, train_loss: 0.8681, test_loss: 1.1279, test_f1: 0.4542
 epoch: 21, train_loss: 0.8527, test_loss: 1.1177, test_f1: 0.4613
 epoch: 22, train_loss: 0.8334, test_loss: 1.0434, test_f1: 0.5101
 epoch: 23, train_loss: 0.8410, test_loss: 1.0804, test_f1: 0.4981
 epoch: 24, train_loss: 0.8219, test_loss: 1.0053, test_f1: 0.4983
 epoch: 25, train_loss: 0.8393, test_loss: 1.0764, test_f1: 0.5041
 epoch: 26, train_loss: 0.8443, test_loss: 1.0347, test_f1: 0.5304
 epoch: 27, train_loss: 0.8199, test_loss: 0.9736, test_f1: 0.5423
 epoch: 28, train_loss: 0.8171, test_loss: 1.0553, test_f1: 0.5027
 epoch: 29, train_loss: 0.7922, test_loss: 1.0654, test_f1: 0.5092
 epoch: 30, train_loss: 0.7927, test_loss: 0.9712, test_f1: 0.5246
 epoch: 31, train_loss: 0.7836, test_loss: 1.0777, test_f1: 0.5056
 epoch: 32, train_loss: 0.7939, test_loss: 1.1655, test_f1: 0.4979
 epoch: 33, train_loss: 0.7915, test_loss: 1.0636, test_f1: 0.5255
 epoch: 34, train_loss: 0.7771, test_loss: 1.0850, test_f1: 0.5101
 epoch: 35, train_loss: 0.7707, test_loss: 1.0062, test_f1: 0.5426
 epoch: 36, train_loss: 0.7557, test_loss: 1.0947, test_f1: 0.5448
 epoch: 37, train_loss: 0.7596, test_loss: 1.0899, test_f1: 0.5114
 epoch: 38, train_loss: 0.7630, test_loss: 1.0086, test_f1: 0.5451
 epoch: 39, train_loss: 0.7622, test_loss: 1.0784, test_f1: 0.5176
 epoch: 40, train_loss: 0.7755, test_loss: 1.0689, test_f1: 0.5291
 epoch: 41, train_loss: 0.7645, test_loss: 1.0715, test_f1: 0.5402
 epoch: 42, train_loss: 0.7724, test_loss: 1.0561, test_f1: 0.5354
 epoch: 43, train_loss: 0.7443, test_loss: 0.9725, test_f1: 0.5609
 epoch: 44, train_loss: 0.7457, test_loss: 1.0085, test_f1: 0.5789
 epoch: 45, train_loss: 0.7448, test_loss: 1.0991, test_f1: 0.5120
 epoch: 46, train_loss: 0.7677, test_loss: 1.0092, test_f1: 0.5614
 epoch: 47, train_loss: 0.7479, test_loss: 0.9985, test_f1: 0.5669
 epoch: 48, train_loss: 0.7217, test_loss: 1.0453, test_f1: 0.5408
 epoch: 49, train_loss: 0.6999, test_loss: 1.0484, test_f1: 0.5726
 epoch: 50, train_loss: 0.7358, test_loss: 1.0776, test_f1: 0.5465
 epoch: 51, train_loss: 0.7096, test_loss: 1.0719, test_f1: 0.5480
 epoch: 52, train_loss: 0.6762, test_loss: 1.0679, test_f1: 0.5659
 epoch: 53, train_loss: 0.6534, test_loss: 1.1177, test_f1: 0.5461
 epoch: 54, train_loss: 0.6485, test_loss: 1.1286, test_f1: 0.5398
 epoch: 55, train_loss: 0.6455, test_loss: 1.1027, test_f1: 0.5586
 epoch: 56, train_loss: 0.6509, test_loss: 1.0872, test_f1: 0.5620
 epoch: 57, train_loss: 0.6302, test_loss: 1.1803, test_f1: 0.5558
 epoch: 58, train_loss: 0.6485, test_loss: 1.1118, test_f1: 0.5721
 epoch: 59, train_loss: 0.6283, test_loss: 1.2120, test_f1: 0.5286
 epoch: 60, train_loss: 0.6287, test_loss: 1.1615, test_f1: 0.5463
 epoch: 61, train_loss: 0.6064, test_loss: 1.1822, test_f1: 0.5695
 epoch: 62, train_loss: 0.6209, test_loss: 1.1513, test_f1: 0.5555
 epoch: 63, train_loss: 0.6177, test_loss: 1.2541, test_f1: 0.5206
 epoch: 64, train_loss: 0.6099, test_loss: 1.0942, test_f1: 0.5617
 epoch: 65, train_loss: 0.6147, test_loss: 1.2272, test_f1: 0.5279
 epoch: 66, train_loss: 0.5951, test_loss: 1.3281, test_f1: 0.5447
 epoch: 67, train_loss: 0.5909, test_loss: 1.2421, test_f1: 0.5573
 epoch: 68, train_loss: 0.6042, test_loss: 1.2596, test_f1: 0.5672
 epoch: 69, train_loss: 0.5906, test_loss: 1.2897, test_f1: 0.5251
 epoch: 70, train_loss: 0.6189, test_loss: 1.2602, test_f1: 0.5410
 epoch: 71, train_loss: 0.6017, test_loss: 1.3622, test_f1: 0.5188
 epoch: 72, train_loss: 0.5973, test_loss: 1.1745, test_f1: 0.5653
 epoch: 73, train_loss: 0.5794, test_loss: 1.2747, test_f1: 0.5441
 epoch: 74, train_loss: 0.5958, test_loss: 1.3095, test_f1: 0.5065
 epoch: 75, train_loss: 0.5716, test_loss: 1.2801, test_f1: 0.5342
 epoch: 76, train_loss: 0.5864, test_loss: 1.3308, test_f1: 0.5310
 epoch: 77, train_loss: 0.5870, test_loss: 1.1672, test_f1: 0.5694
 epoch: 78, train_loss: 0.5705, test_loss: 1.2958, test_f1: 0.5500
 epoch: 79, train_loss: 0.5487, test_loss: 1.4377, test_f1: 0.5161
 epoch: 80, train_loss: 0.5548, test_loss: 1.2451, test_f1: 0.5433
 epoch: 81, train_loss: 0.5819, test_loss: 1.3270, test_f1: 0.5563
 epoch: 82, train_loss: 0.5809, test_loss: 1.2858, test_f1: 0.5338
 epoch: 83, train_loss: 0.5595, test_loss: 1.3416, test_f1: 0.5333
 epoch: 84, train_loss: 0.5571, test_loss: 1.2437, test_f1: 0.5585
 epoch: 85, train_loss: 0.5554, test_loss: 1.3096, test_f1: 0.5599
 epoch: 86, train_loss: 0.5345, test_loss: 1.4570, test_f1: 0.5207
 epoch: 87, train_loss: 0.5481, test_loss: 1.3306, test_f1: 0.5552
 epoch: 88, train_loss: 0.5482, test_loss: 1.2770, test_f1: 0.5611
 epoch: 89, train_loss: 0.5425, test_loss: 1.4782, test_f1: 0.5274
 epoch: 90, train_loss: 0.5612, test_loss: 1.2654, test_f1: 0.5616
 epoch: 91, train_loss: 0.5301, test_loss: 1.2943, test_f1: 0.5817
 epoch: 92, train_loss: 0.5269, test_loss: 1.4047, test_f1: 0.5543
 epoch: 93, train_loss: 0.5153, test_loss: 1.3979, test_f1: 0.5580
 epoch: 94, train_loss: 0.5358, test_loss: 1.4014, test_f1: 0.5406
 epoch: 95, train_loss: 0.5231, test_loss: 1.4157, test_f1: 0.5482
 epoch: 96, train_loss: 0.5147, test_loss: 1.5084, test_f1: 0.5412
 epoch: 97, train_loss: 0.5232, test_loss: 1.3711, test_f1: 0.5629
 epoch: 98, train_loss: 0.5220, test_loss: 1.4507, test_f1: 0.5451
 epoch: 99, train_loss: 0.5227, test_loss: 1.4237, test_f1: 0.5818
##################ITERATION #3 ****************************************
 epoch: 0, train_loss: 1.3376, test_loss: 1.2634, test_f1: 0.2274
 epoch: 1, train_loss: 1.2148, test_loss: 1.1449, test_f1: 0.3902
 epoch: 2, train_loss: 1.1527, test_loss: 1.0911, test_f1: 0.4080
 epoch: 3, train_loss: 1.1072, test_loss: 1.0584, test_f1: 0.4309
 epoch: 4, train_loss: 1.0672, test_loss: 1.0353, test_f1: 0.4811
 epoch: 5, train_loss: 1.0438, test_loss: 0.9786, test_f1: 0.4627
 epoch: 6, train_loss: 1.0085, test_loss: 0.9533, test_f1: 0.4877
 epoch: 7, train_loss: 0.9790, test_loss: 0.9505, test_f1: 0.4650
 epoch: 8, train_loss: 0.9623, test_loss: 0.9658, test_f1: 0.4614
 epoch: 9, train_loss: 0.9534, test_loss: 0.9727, test_f1: 0.4903
 epoch: 10, train_loss: 0.9275, test_loss: 0.9948, test_f1: 0.4873
 epoch: 11, train_loss: 0.9120, test_loss: 1.0102, test_f1: 0.4804
 epoch: 12, train_loss: 0.9039, test_loss: 0.9701, test_f1: 0.5121
 epoch: 13, train_loss: 0.9034, test_loss: 1.0343, test_f1: 0.4484
 epoch: 14, train_loss: 0.8865, test_loss: 1.0043, test_f1: 0.5010
 epoch: 15, train_loss: 0.8806, test_loss: 1.0837, test_f1: 0.5105
 epoch: 16, train_loss: 0.8774, test_loss: 0.9995, test_f1: 0.5087
 epoch: 17, train_loss: 0.8597, test_loss: 1.0289, test_f1: 0.4842
 epoch: 18, train_loss: 0.8473, test_loss: 1.0314, test_f1: 0.5110
 epoch: 19, train_loss: 0.8387, test_loss: 0.9978, test_f1: 0.5217
 epoch: 20, train_loss: 0.8344, test_loss: 1.0173, test_f1: 0.5217
 epoch: 21, train_loss: 0.8267, test_loss: 1.0530, test_f1: 0.5116
 epoch: 22, train_loss: 0.8459, test_loss: 1.1121, test_f1: 0.5053
 epoch: 23, train_loss: 0.8174, test_loss: 1.0637, test_f1: 0.4953
 epoch: 24, train_loss: 0.8018, test_loss: 1.1364, test_f1: 0.5478
 epoch: 25, train_loss: 0.8014, test_loss: 1.1192, test_f1: 0.4983
 epoch: 26, train_loss: 0.7914, test_loss: 1.1634, test_f1: 0.5146
 epoch: 27, train_loss: 0.7951, test_loss: 1.1257, test_f1: 0.5056
 epoch: 28, train_loss: 0.8083, test_loss: 1.1019, test_f1: 0.5380
 epoch: 29, train_loss: 0.7878, test_loss: 1.0391, test_f1: 0.5316
 epoch: 30, train_loss: 0.7790, test_loss: 1.1235, test_f1: 0.5205
 epoch: 31, train_loss: 0.7742, test_loss: 1.1291, test_f1: 0.5242
 epoch: 32, train_loss: 0.7646, test_loss: 1.0612, test_f1: 0.5436
 epoch: 33, train_loss: 0.7606, test_loss: 1.1122, test_f1: 0.5567
 epoch: 34, train_loss: 0.7584, test_loss: 1.0701, test_f1: 0.5334
 epoch: 35, train_loss: 0.7585, test_loss: 1.0829, test_f1: 0.5489
 epoch: 36, train_loss: 0.7630, test_loss: 1.1401, test_f1: 0.5295
 epoch: 37, train_loss: 0.7720, test_loss: 1.1142, test_f1: 0.5439
 epoch: 38, train_loss: 0.7272, test_loss: 1.1466, test_f1: 0.5275
 epoch: 39, train_loss: 0.7205, test_loss: 1.1303, test_f1: 0.5402
 epoch: 40, train_loss: 0.7288, test_loss: 1.1374, test_f1: 0.5354
 epoch: 41, train_loss: 0.7340, test_loss: 1.1632, test_f1: 0.5407
 epoch: 42, train_loss: 0.7351, test_loss: 1.0891, test_f1: 0.5337
 epoch: 43, train_loss: 0.7435, test_loss: 1.1080, test_f1: 0.5395
 epoch: 44, train_loss: 0.7468, test_loss: 1.1514, test_f1: 0.4968
 epoch: 45, train_loss: 0.7331, test_loss: 1.1293, test_f1: 0.5213
 epoch: 46, train_loss: 0.7076, test_loss: 1.1089, test_f1: 0.5407
 epoch: 47, train_loss: 0.6751, test_loss: 1.2938, test_f1: 0.5313
 epoch: 48, train_loss: 0.6886, test_loss: 1.1617, test_f1: 0.5668
 epoch: 49, train_loss: 0.7023, test_loss: 1.1300, test_f1: 0.5501
 epoch: 50, train_loss: 0.7053, test_loss: 1.2955, test_f1: 0.5220
 epoch: 51, train_loss: 0.6671, test_loss: 1.1621, test_f1: 0.5618
 epoch: 52, train_loss: 0.6382, test_loss: 1.2617, test_f1: 0.5349
 epoch: 53, train_loss: 0.6304, test_loss: 1.2142, test_f1: 0.5492
 epoch: 54, train_loss: 0.6231, test_loss: 1.2328, test_f1: 0.5235
 epoch: 55, train_loss: 0.6327, test_loss: 1.2141, test_f1: 0.5516
 epoch: 56, train_loss: 0.6071, test_loss: 1.2295, test_f1: 0.5467
 epoch: 57, train_loss: 0.6204, test_loss: 1.2608, test_f1: 0.5720
 epoch: 58, train_loss: 0.6042, test_loss: 1.3233, test_f1: 0.5334
 epoch: 59, train_loss: 0.6234, test_loss: 1.2044, test_f1: 0.5663
 epoch: 60, train_loss: 0.6093, test_loss: 1.2755, test_f1: 0.5604
 epoch: 61, train_loss: 0.5954, test_loss: 1.2396, test_f1: 0.5377
 epoch: 62, train_loss: 0.6135, test_loss: 1.2838, test_f1: 0.5387
 epoch: 63, train_loss: 0.5955, test_loss: 1.2582, test_f1: 0.5648
 epoch: 64, train_loss: 0.5816, test_loss: 1.2448, test_f1: 0.5428
 epoch: 65, train_loss: 0.5762, test_loss: 1.2808, test_f1: 0.5682
 epoch: 66, train_loss: 0.5742, test_loss: 1.2804, test_f1: 0.5609
 epoch: 67, train_loss: 0.5760, test_loss: 1.3048, test_f1: 0.5625
 epoch: 68, train_loss: 0.5748, test_loss: 1.2993, test_f1: 0.5477
 epoch: 69, train_loss: 0.5617, test_loss: 1.3601, test_f1: 0.5537
 epoch: 70, train_loss: 0.5817, test_loss: 1.2945, test_f1: 0.5743
 epoch: 71, train_loss: 0.5762, test_loss: 1.2514, test_f1: 0.5519
 epoch: 72, train_loss: 0.6043, test_loss: 1.2558, test_f1: 0.5488
 epoch: 73, train_loss: 0.5788, test_loss: 1.4753, test_f1: 0.5290
 epoch: 74, train_loss: 0.5743, test_loss: 1.2840, test_f1: 0.5755
 epoch: 75, train_loss: 0.5712, test_loss: 1.3296, test_f1: 0.5513
 epoch: 76, train_loss: 0.5665, test_loss: 1.3775, test_f1: 0.5823
 epoch: 77, train_loss: 0.5605, test_loss: 1.4358, test_f1: 0.5625
 epoch: 78, train_loss: 0.5638, test_loss: 1.3220, test_f1: 0.5693
 epoch: 79, train_loss: 0.5475, test_loss: 1.2931, test_f1: 0.5972
 epoch: 80, train_loss: 0.5607, test_loss: 1.2685, test_f1: 0.5984
 epoch: 81, train_loss: 0.5654, test_loss: 1.3378, test_f1: 0.5670
 epoch: 82, train_loss: 0.5430, test_loss: 1.3727, test_f1: 0.5764
 epoch: 83, train_loss: 0.5235, test_loss: 1.5016, test_f1: 0.5751
 epoch: 84, train_loss: 0.5431, test_loss: 1.3663, test_f1: 0.5860
 epoch: 85, train_loss: 0.5555, test_loss: 1.3219, test_f1: 0.6035
 epoch: 86, train_loss: 0.5283, test_loss: 1.2850, test_f1: 0.5833
 epoch: 87, train_loss: 0.5339, test_loss: 1.3722, test_f1: 0.5811
 epoch: 88, train_loss: 0.5133, test_loss: 1.5020, test_f1: 0.5632
 epoch: 89, train_loss: 0.5304, test_loss: 1.3770, test_f1: 0.5979
 epoch: 90, train_loss: 0.5303, test_loss: 1.3491, test_f1: 0.5888
 epoch: 91, train_loss: 0.5232, test_loss: 1.4117, test_f1: 0.5825
 epoch: 92, train_loss: 0.5177, test_loss: 1.3801, test_f1: 0.5807
 epoch: 93, train_loss: 0.4957, test_loss: 1.5056, test_f1: 0.5730
 epoch: 94, train_loss: 0.5148, test_loss: 1.4645, test_f1: 0.5891
 epoch: 95, train_loss: 0.5453, test_loss: 1.3639, test_f1: 0.6221
 epoch: 96, train_loss: 0.5236, test_loss: 1.3615, test_f1: 0.5799
 epoch: 97, train_loss: 0.4964, test_loss: 1.3912, test_f1: 0.6065
 epoch: 98, train_loss: 0.4872, test_loss: 1.4866, test_f1: 0.5747
 epoch: 99, train_loss: 0.5067, test_loss: 1.5281, test_f1: 0.5839
##################ITERATION #4 ****************************************
 epoch: 0, train_loss: 1.4242, test_loss: 1.2316, test_f1: 0.3098
 epoch: 1, train_loss: 1.1809, test_loss: 1.1749, test_f1: 0.3525
 epoch: 2, train_loss: 1.1183, test_loss: 1.1688, test_f1: 0.4190
 epoch: 3, train_loss: 1.0855, test_loss: 1.0575, test_f1: 0.4740
 epoch: 4, train_loss: 1.0411, test_loss: 0.9936, test_f1: 0.5052
 epoch: 5, train_loss: 1.0151, test_loss: 0.9589, test_f1: 0.5173
 epoch: 6, train_loss: 0.9968, test_loss: 0.9890, test_f1: 0.4689
 epoch: 7, train_loss: 0.9663, test_loss: 0.9411, test_f1: 0.5091
 epoch: 8, train_loss: 0.9503, test_loss: 1.2707, test_f1: 0.4691
 epoch: 9, train_loss: 0.9466, test_loss: 0.9332, test_f1: 0.4996
 epoch: 10, train_loss: 0.9292, test_loss: 1.4039, test_f1: 0.4305
 epoch: 11, train_loss: 0.9186, test_loss: 1.0675, test_f1: 0.4908
 epoch: 12, train_loss: 0.9018, test_loss: 1.0041, test_f1: 0.4951
 epoch: 13, train_loss: 0.8843, test_loss: 1.0400, test_f1: 0.4904
 epoch: 14, train_loss: 0.8915, test_loss: 0.9995, test_f1: 0.5174
 epoch: 15, train_loss: 0.8991, test_loss: 0.9844, test_f1: 0.5044
 epoch: 16, train_loss: 0.8969, test_loss: 1.0123, test_f1: 0.4954
 epoch: 17, train_loss: 0.8798, test_loss: 0.9993, test_f1: 0.5047
 epoch: 18, train_loss: 0.8648, test_loss: 0.9953, test_f1: 0.5135
 epoch: 19, train_loss: 0.8539, test_loss: 1.0527, test_f1: 0.5311
 epoch: 20, train_loss: 0.8579, test_loss: 1.0596, test_f1: 0.5378
 epoch: 21, train_loss: 0.8380, test_loss: 1.0493, test_f1: 0.5490
 epoch: 22, train_loss: 0.8330, test_loss: 1.0734, test_f1: 0.5230
 epoch: 23, train_loss: 0.8343, test_loss: 0.9990, test_f1: 0.5265
 epoch: 24, train_loss: 0.8135, test_loss: 0.9966, test_f1: 0.5373
 epoch: 25, train_loss: 0.8077, test_loss: 0.9732, test_f1: 0.5251
 epoch: 26, train_loss: 0.8088, test_loss: 1.0688, test_f1: 0.4931
 epoch: 27, train_loss: 0.8039, test_loss: 1.0893, test_f1: 0.5279
 epoch: 28, train_loss: 0.8049, test_loss: 1.2358, test_f1: 0.5156
 epoch: 29, train_loss: 0.7968, test_loss: 1.3854, test_f1: 0.4696
 epoch: 30, train_loss: 0.7987, test_loss: 1.0169, test_f1: 0.5001
 epoch: 31, train_loss: 0.7936, test_loss: 1.0303, test_f1: 0.4985
 epoch: 32, train_loss: 0.7909, test_loss: 1.1262, test_f1: 0.4985
 epoch: 33, train_loss: 0.7676, test_loss: 1.0199, test_f1: 0.5186
 epoch: 34, train_loss: 0.7644, test_loss: 1.1405, test_f1: 0.4921
 epoch: 35, train_loss: 0.7776, test_loss: 1.1469, test_f1: 0.4974
 epoch: 36, train_loss: 0.7641, test_loss: 2.0400, test_f1: 0.5072
 epoch: 37, train_loss: 0.7649, test_loss: 1.0691, test_f1: 0.5652
 epoch: 38, train_loss: 0.7627, test_loss: 1.1908, test_f1: 0.5041
 epoch: 39, train_loss: 0.7451, test_loss: 1.1464, test_f1: 0.4902
 epoch: 40, train_loss: 0.7403, test_loss: 1.1683, test_f1: 0.5388
 epoch: 41, train_loss: 0.7403, test_loss: 1.1443, test_f1: 0.5505
 epoch: 42, train_loss: 0.7599, test_loss: 1.1403, test_f1: 0.5125
 epoch: 43, train_loss: 0.7437, test_loss: 1.0718, test_f1: 0.5431
 epoch: 44, train_loss: 0.7291, test_loss: 1.1127, test_f1: 0.5445
 epoch: 45, train_loss: 0.7418, test_loss: 1.1368, test_f1: 0.5040
 epoch: 46, train_loss: 0.7085, test_loss: 1.0499, test_f1: 0.5715
 epoch: 47, train_loss: 0.7011, test_loss: 1.1927, test_f1: 0.5283
 epoch: 48, train_loss: 0.7171, test_loss: 1.2849, test_f1: 0.5352
 epoch: 49, train_loss: 0.7230, test_loss: 1.2038, test_f1: 0.5376
 epoch: 50, train_loss: 0.7079, test_loss: 1.1844, test_f1: 0.5143
 epoch: 51, train_loss: 0.6917, test_loss: 1.1784, test_f1: 0.5595
 epoch: 52, train_loss: 0.6537, test_loss: 1.2637, test_f1: 0.5232
 epoch: 53, train_loss: 0.6344, test_loss: 1.2201, test_f1: 0.5535
 epoch: 54, train_loss: 0.6315, test_loss: 1.1673, test_f1: 0.5813
 epoch: 55, train_loss: 0.6370, test_loss: 1.2715, test_f1: 0.5658
 epoch: 56, train_loss: 0.6027, test_loss: 1.2240, test_f1: 0.5584
 epoch: 57, train_loss: 0.6112, test_loss: 1.3074, test_f1: 0.5435
 epoch: 58, train_loss: 0.5900, test_loss: 1.3260, test_f1: 0.5419
 epoch: 59, train_loss: 0.6010, test_loss: 1.2395, test_f1: 0.5500
 epoch: 60, train_loss: 0.5992, test_loss: 1.3623, test_f1: 0.5286
 epoch: 61, train_loss: 0.6038, test_loss: 1.2068, test_f1: 0.5545
 epoch: 62, train_loss: 0.6205, test_loss: 1.3085, test_f1: 0.5193
 epoch: 63, train_loss: 0.6012, test_loss: 1.2294, test_f1: 0.5623
 epoch: 64, train_loss: 0.5902, test_loss: 1.2856, test_f1: 0.5587
 epoch: 65, train_loss: 0.5912, test_loss: 1.2328, test_f1: 0.5677
 epoch: 66, train_loss: 0.5891, test_loss: 1.3671, test_f1: 0.5165
 epoch: 67, train_loss: 0.5756, test_loss: 1.3788, test_f1: 0.5279
 epoch: 68, train_loss: 0.5888, test_loss: 1.3214, test_f1: 0.5530
 epoch: 69, train_loss: 0.5750, test_loss: 1.2609, test_f1: 0.5511
 epoch: 70, train_loss: 0.5736, test_loss: 1.4987, test_f1: 0.5231
 epoch: 71, train_loss: 0.5921, test_loss: 1.3910, test_f1: 0.5497
 epoch: 72, train_loss: 0.6130, test_loss: 1.3296, test_f1: 0.5279
 epoch: 73, train_loss: 0.5694, test_loss: 1.6096, test_f1: 0.5307
 epoch: 74, train_loss: 0.5591, test_loss: 1.3433, test_f1: 0.5414
 epoch: 75, train_loss: 0.5644, test_loss: 1.6081, test_f1: 0.5396
 epoch: 76, train_loss: 0.5596, test_loss: 1.4094, test_f1: 0.5572
 epoch: 77, train_loss: 0.5780, test_loss: 1.4553, test_f1: 0.4986
 epoch: 78, train_loss: 0.5854, test_loss: 1.4140, test_f1: 0.5145
 epoch: 79, train_loss: 0.5707, test_loss: 1.3882, test_f1: 0.5578
 epoch: 80, train_loss: 0.5527, test_loss: 1.6122, test_f1: 0.5146
 epoch: 81, train_loss: 0.5374, test_loss: 1.2832, test_f1: 0.5665
 epoch: 82, train_loss: 0.5374, test_loss: 1.3934, test_f1: 0.5465
 epoch: 83, train_loss: 0.5392, test_loss: 1.4462, test_f1: 0.5718
 epoch: 84, train_loss: 0.5345, test_loss: 1.5640, test_f1: 0.5280
 epoch: 85, train_loss: 0.5676, test_loss: 1.3815, test_f1: 0.5368
 epoch: 86, train_loss: 0.5769, test_loss: 1.4599, test_f1: 0.5240
 epoch: 87, train_loss: 0.5583, test_loss: 1.6704, test_f1: 0.5338
 epoch: 88, train_loss: 0.5317, test_loss: 1.4802, test_f1: 0.5616
 epoch: 89, train_loss: 0.5288, test_loss: 1.7815, test_f1: 0.5269
 epoch: 90, train_loss: 0.5279, test_loss: 1.6090, test_f1: 0.5490
 epoch: 91, train_loss: 0.5422, test_loss: 1.5913, test_f1: 0.5280
 epoch: 92, train_loss: 0.5459, test_loss: 1.5645, test_f1: 0.5455
 epoch: 93, train_loss: 0.5365, test_loss: 1.3699, test_f1: 0.5791
 epoch: 94, train_loss: 0.5134, test_loss: 1.5297, test_f1: 0.5304
 epoch: 95, train_loss: 0.5105, test_loss: 1.7372, test_f1: 0.4973
 epoch: 96, train_loss: 0.5152, test_loss: 1.6939, test_f1: 0.5271
 epoch: 97, train_loss: 0.5235, test_loss: 1.4704, test_f1: 0.5335
 epoch: 98, train_loss: 0.5016, test_loss: 1.5066, test_f1: 0.5513
 epoch: 99, train_loss: 0.5199, test_loss: 1.6745, test_f1: 0.5227
##################ITERATION #5 ****************************************
 epoch: 0, train_loss: 1.3703, test_loss: 1.2643, test_f1: 0.2290
 epoch: 1, train_loss: 1.1815, test_loss: 1.1364, test_f1: 0.4077
 epoch: 2, train_loss: 1.0959, test_loss: 1.0437, test_f1: 0.4983
 epoch: 3, train_loss: 1.0580, test_loss: 0.9730, test_f1: 0.4843
 epoch: 4, train_loss: 1.0250, test_loss: 1.0705, test_f1: 0.4723
 epoch: 5, train_loss: 1.0014, test_loss: 0.9497, test_f1: 0.4987
 epoch: 6, train_loss: 0.9579, test_loss: 0.9825, test_f1: 0.4712
 epoch: 7, train_loss: 0.9478, test_loss: 0.9669, test_f1: 0.5505
 epoch: 8, train_loss: 0.9382, test_loss: 0.9905, test_f1: 0.4789
 epoch: 9, train_loss: 0.9113, test_loss: 1.0733, test_f1: 0.4952
 epoch: 10, train_loss: 0.8970, test_loss: 1.0117, test_f1: 0.5387
 epoch: 11, train_loss: 0.8821, test_loss: 1.0317, test_f1: 0.5141
 epoch: 12, train_loss: 0.8861, test_loss: 1.1722, test_f1: 0.5069
 epoch: 13, train_loss: 0.8800, test_loss: 1.2570, test_f1: 0.4974
 epoch: 14, train_loss: 0.8696, test_loss: 1.0623, test_f1: 0.5173
 epoch: 15, train_loss: 0.8786, test_loss: 1.1552, test_f1: 0.4823
 epoch: 16, train_loss: 0.8504, test_loss: 1.0592, test_f1: 0.5261
 epoch: 17, train_loss: 0.8139, test_loss: 0.9972, test_f1: 0.5230
 epoch: 18, train_loss: 0.8175, test_loss: 1.0235, test_f1: 0.5369
 epoch: 19, train_loss: 0.8029, test_loss: 1.3152, test_f1: 0.4995
 epoch: 20, train_loss: 0.8007, test_loss: 1.0100, test_f1: 0.5536
 epoch: 21, train_loss: 0.7920, test_loss: 1.1804, test_f1: 0.5248
 epoch: 22, train_loss: 0.7959, test_loss: 1.0288, test_f1: 0.5558
 epoch: 23, train_loss: 0.7655, test_loss: 1.1600, test_f1: 0.5442
 epoch: 24, train_loss: 0.7725, test_loss: 1.1038, test_f1: 0.5479
 epoch: 25, train_loss: 0.7570, test_loss: 1.2487, test_f1: 0.5051
 epoch: 26, train_loss: 0.7643, test_loss: 1.0310, test_f1: 0.5366
 epoch: 27, train_loss: 0.7802, test_loss: 1.0061, test_f1: 0.5420
 epoch: 28, train_loss: 0.7728, test_loss: 1.0058, test_f1: 0.5489
 epoch: 29, train_loss: 0.7464, test_loss: 1.0990, test_f1: 0.5261
 epoch: 30, train_loss: 0.7391, test_loss: 1.1036, test_f1: 0.5374
 epoch: 31, train_loss: 0.7464, test_loss: 1.0452, test_f1: 0.5719
 epoch: 32, train_loss: 0.7295, test_loss: 1.0505, test_f1: 0.5647
 epoch: 33, train_loss: 0.7127, test_loss: 1.0972, test_f1: 0.5570
 epoch: 34, train_loss: 0.7105, test_loss: 1.0644, test_f1: 0.5619
 epoch: 35, train_loss: 0.7360, test_loss: 1.1583, test_f1: 0.5279
 epoch: 36, train_loss: 0.7431, test_loss: 1.0392, test_f1: 0.5398
 epoch: 37, train_loss: 0.7361, test_loss: 1.1704, test_f1: 0.5138
 epoch: 38, train_loss: 0.7218, test_loss: 1.1099, test_f1: 0.5389
 epoch: 39, train_loss: 0.7127, test_loss: 1.0346, test_f1: 0.5580
 epoch: 40, train_loss: 0.7173, test_loss: 1.2414, test_f1: 0.5281
 epoch: 41, train_loss: 0.7196, test_loss: 1.0858, test_f1: 0.5367
 epoch: 42, train_loss: 0.6882, test_loss: 1.1308, test_f1: 0.5617
 epoch: 43, train_loss: 0.6936, test_loss: 1.3197, test_f1: 0.5160
 epoch: 44, train_loss: 0.7022, test_loss: 1.1723, test_f1: 0.5376
 epoch: 45, train_loss: 0.7124, test_loss: 1.2428, test_f1: 0.5341
 epoch: 46, train_loss: 0.6810, test_loss: 1.1633, test_f1: 0.5747
 epoch: 47, train_loss: 0.6453, test_loss: 1.1777, test_f1: 0.5672
 epoch: 48, train_loss: 0.6838, test_loss: 1.1933, test_f1: 0.5347
 epoch: 49, train_loss: 0.6643, test_loss: 1.3952, test_f1: 0.5422
 epoch: 50, train_loss: 0.6531, test_loss: 1.1996, test_f1: 0.5403
 epoch: 51, train_loss: 0.6096, test_loss: 1.1477, test_f1: 0.5585
 epoch: 52, train_loss: 0.5981, test_loss: 1.2103, test_f1: 0.5622
 epoch: 53, train_loss: 0.5955, test_loss: 1.2026, test_f1: 0.5649
 epoch: 54, train_loss: 0.5756, test_loss: 1.2239, test_f1: 0.5614
 epoch: 55, train_loss: 0.5770, test_loss: 1.2436, test_f1: 0.5581
 epoch: 56, train_loss: 0.5675, test_loss: 1.2054, test_f1: 0.5530
 epoch: 57, train_loss: 0.5732, test_loss: 1.2614, test_f1: 0.5469
 epoch: 58, train_loss: 0.5706, test_loss: 1.3496, test_f1: 0.5367
 epoch: 59, train_loss: 0.5561, test_loss: 1.4713, test_f1: 0.5058
 epoch: 60, train_loss: 0.5566, test_loss: 1.1979, test_f1: 0.5494
 epoch: 61, train_loss: 0.5537, test_loss: 1.3550, test_f1: 0.5503
 epoch: 62, train_loss: 0.5552, test_loss: 1.4131, test_f1: 0.5248
 epoch: 63, train_loss: 0.5485, test_loss: 1.3424, test_f1: 0.5551
 epoch: 64, train_loss: 0.5573, test_loss: 1.3753, test_f1: 0.5225
 epoch: 65, train_loss: 0.5521, test_loss: 1.3099, test_f1: 0.5717
 epoch: 66, train_loss: 0.5433, test_loss: 1.4484, test_f1: 0.5396
 epoch: 67, train_loss: 0.5436, test_loss: 1.3733, test_f1: 0.5590
 epoch: 68, train_loss: 0.5508, test_loss: 1.5550, test_f1: 0.5264
 epoch: 69, train_loss: 0.5459, test_loss: 1.6049, test_f1: 0.5053
 epoch: 70, train_loss: 0.5186, test_loss: 1.5509, test_f1: 0.5294
 epoch: 71, train_loss: 0.5234, test_loss: 1.4858, test_f1: 0.5649
 epoch: 72, train_loss: 0.5256, test_loss: 1.4756, test_f1: 0.5482
 epoch: 73, train_loss: 0.5270, test_loss: 1.4556, test_f1: 0.5650
 epoch: 74, train_loss: 0.5294, test_loss: 1.4039, test_f1: 0.5235
 epoch: 75, train_loss: 0.5269, test_loss: 1.4435, test_f1: 0.5342
 epoch: 76, train_loss: 0.5185, test_loss: 1.5155, test_f1: 0.5162
 epoch: 77, train_loss: 0.4946, test_loss: 1.7014, test_f1: 0.5091
 epoch: 78, train_loss: 0.5100, test_loss: 1.6256, test_f1: 0.5423
 epoch: 79, train_loss: 0.5136, test_loss: 1.5381, test_f1: 0.5483
 epoch: 80, train_loss: 0.5077, test_loss: 1.4791, test_f1: 0.5427
 epoch: 81, train_loss: 0.5375, test_loss: 1.6651, test_f1: 0.5330
 epoch: 82, train_loss: 0.5174, test_loss: 1.4726, test_f1: 0.5528
 epoch: 83, train_loss: 0.5184, test_loss: 1.6973, test_f1: 0.5266
 epoch: 84, train_loss: 0.4956, test_loss: 1.5314, test_f1: 0.5425
 epoch: 85, train_loss: 0.5266, test_loss: 1.3844, test_f1: 0.5722
 epoch: 86, train_loss: 0.5135, test_loss: 1.5753, test_f1: 0.5330
 epoch: 87, train_loss: 0.4894, test_loss: 1.5934, test_f1: 0.5489
 epoch: 88, train_loss: 0.4864, test_loss: 1.4541, test_f1: 0.5645
 epoch: 89, train_loss: 0.4965, test_loss: 1.5547, test_f1: 0.5650
 epoch: 90, train_loss: 0.4662, test_loss: 1.5245, test_f1: 0.5453
 epoch: 91, train_loss: 0.4951, test_loss: 1.7306, test_f1: 0.5081
 epoch: 92, train_loss: 0.4987, test_loss: 1.6555, test_f1: 0.5293
 epoch: 93, train_loss: 0.5045, test_loss: 1.7556, test_f1: 0.5076
 epoch: 94, train_loss: 0.4941, test_loss: 1.5104, test_f1: 0.5430
 epoch: 95, train_loss: 0.4911, test_loss: 1.6409, test_f1: 0.5220
 epoch: 96, train_loss: 0.4879, test_loss: 1.6304, test_f1: 0.5247
 epoch: 97, train_loss: 0.4686, test_loss: 1.6341, test_f1: 0.5208
 epoch: 98, train_loss: 0.4688, test_loss: 1.8345, test_f1: 0.5442
 epoch: 99, train_loss: 0.5039, test_loss: 1.3864, test_f1: 0.5699
##################ITERATION #6 ****************************************
 epoch: 0, train_loss: 1.4797, test_loss: 1.2851, test_f1: 0.2537
 epoch: 1, train_loss: 1.2212, test_loss: 1.1960, test_f1: 0.3454
 epoch: 2, train_loss: 1.1918, test_loss: 1.1798, test_f1: 0.4020
 epoch: 3, train_loss: 1.1617, test_loss: 1.1550, test_f1: 0.4122
 epoch: 4, train_loss: 1.1326, test_loss: 1.1047, test_f1: 0.4309
 epoch: 5, train_loss: 1.1058, test_loss: 1.0774, test_f1: 0.4456
 epoch: 6, train_loss: 1.0743, test_loss: 1.0571, test_f1: 0.4382
 epoch: 7, train_loss: 1.0634, test_loss: 0.9959, test_f1: 0.5100
 epoch: 8, train_loss: 1.0252, test_loss: 0.9924, test_f1: 0.4724
 epoch: 9, train_loss: 1.0250, test_loss: 1.0202, test_f1: 0.4695
 epoch: 10, train_loss: 1.0174, test_loss: 1.0430, test_f1: 0.4406
 epoch: 11, train_loss: 0.9846, test_loss: 0.9464, test_f1: 0.5069
 epoch: 12, train_loss: 0.9492, test_loss: 1.0434, test_f1: 0.4826
 epoch: 13, train_loss: 0.9553, test_loss: 0.9287, test_f1: 0.5307
 epoch: 14, train_loss: 0.9552, test_loss: 0.9503, test_f1: 0.5001
 epoch: 15, train_loss: 0.9322, test_loss: 0.9634, test_f1: 0.4989
 epoch: 16, train_loss: 0.9114, test_loss: 0.9586, test_f1: 0.4983
 epoch: 17, train_loss: 0.9096, test_loss: 1.0753, test_f1: 0.5150
 epoch: 18, train_loss: 0.9012, test_loss: 1.1934, test_f1: 0.4877
 epoch: 19, train_loss: 0.8864, test_loss: 0.9400, test_f1: 0.4955
 epoch: 20, train_loss: 0.8916, test_loss: 0.9398, test_f1: 0.5344
 epoch: 21, train_loss: 0.8740, test_loss: 1.1869, test_f1: 0.4908
 epoch: 22, train_loss: 0.8564, test_loss: 1.1030, test_f1: 0.4650
 epoch: 23, train_loss: 0.8718, test_loss: 0.9803, test_f1: 0.5246
 epoch: 24, train_loss: 0.8557, test_loss: 1.0265, test_f1: 0.5003
 epoch: 25, train_loss: 0.8592, test_loss: 0.9450, test_f1: 0.5354
 epoch: 26, train_loss: 0.8454, test_loss: 0.9905, test_f1: 0.5329
 epoch: 27, train_loss: 0.8336, test_loss: 0.9789, test_f1: 0.5167
 epoch: 28, train_loss: 0.8403, test_loss: 0.9703, test_f1: 0.5197
 epoch: 29, train_loss: 0.8348, test_loss: 1.1750, test_f1: 0.5139
 epoch: 30, train_loss: 0.8476, test_loss: 0.9791, test_f1: 0.5336
 epoch: 31, train_loss: 0.8173, test_loss: 1.0114, test_f1: 0.5283
 epoch: 32, train_loss: 0.8090, test_loss: 1.0255, test_f1: 0.5451
 epoch: 33, train_loss: 0.7830, test_loss: 1.0268, test_f1: 0.5292
 epoch: 34, train_loss: 0.8155, test_loss: 1.1170, test_f1: 0.5134
 epoch: 35, train_loss: 0.8306, test_loss: 0.9838, test_f1: 0.5443
 epoch: 36, train_loss: 0.8209, test_loss: 1.1343, test_f1: 0.5200
 epoch: 37, train_loss: 0.8050, test_loss: 1.0441, test_f1: 0.5015
 epoch: 38, train_loss: 0.8077, test_loss: 1.0855, test_f1: 0.5475
 epoch: 39, train_loss: 0.8054, test_loss: 1.1372, test_f1: 0.5162
 epoch: 40, train_loss: 0.7880, test_loss: 1.0171, test_f1: 0.5494
 epoch: 41, train_loss: 0.7796, test_loss: 1.1620, test_f1: 0.5113
 epoch: 42, train_loss: 0.7744, test_loss: 1.0518, test_f1: 0.5710
 epoch: 43, train_loss: 0.7664, test_loss: 1.0466, test_f1: 0.5185
 epoch: 44, train_loss: 0.7785, test_loss: 1.1075, test_f1: 0.5396
 epoch: 45, train_loss: 0.7713, test_loss: 0.9958, test_f1: 0.5579
 epoch: 46, train_loss: 0.7643, test_loss: 1.1254, test_f1: 0.5157
 epoch: 47, train_loss: 0.7421, test_loss: 1.0945, test_f1: 0.5245
 epoch: 48, train_loss: 0.7691, test_loss: 1.1234, test_f1: 0.5182
 epoch: 49, train_loss: 0.7628, test_loss: 1.0596, test_f1: 0.5378
 epoch: 50, train_loss: 0.7535, test_loss: 1.0361, test_f1: 0.5498
 epoch: 51, train_loss: 0.7126, test_loss: 1.0877, test_f1: 0.5120
 epoch: 52, train_loss: 0.6888, test_loss: 1.0765, test_f1: 0.5328
 epoch: 53, train_loss: 0.6815, test_loss: 1.0777, test_f1: 0.5537
 epoch: 54, train_loss: 0.6712, test_loss: 1.1033, test_f1: 0.5609
 epoch: 55, train_loss: 0.6817, test_loss: 1.0066, test_f1: 0.5425
 epoch: 56, train_loss: 0.6646, test_loss: 1.1031, test_f1: 0.5486
 epoch: 57, train_loss: 0.6760, test_loss: 1.1870, test_f1: 0.5234
 epoch: 58, train_loss: 0.6720, test_loss: 1.0891, test_f1: 0.5506
 epoch: 59, train_loss: 0.6676, test_loss: 1.0743, test_f1: 0.5457
 epoch: 60, train_loss: 0.6488, test_loss: 1.1407, test_f1: 0.5410
 epoch: 61, train_loss: 0.6648, test_loss: 1.1908, test_f1: 0.5698
 epoch: 62, train_loss: 0.6694, test_loss: 1.1062, test_f1: 0.5368
 epoch: 63, train_loss: 0.6420, test_loss: 1.1623, test_f1: 0.5512
 epoch: 64, train_loss: 0.6491, test_loss: 1.1258, test_f1: 0.5501
 epoch: 65, train_loss: 0.6503, test_loss: 1.1535, test_f1: 0.5653
 epoch: 66, train_loss: 0.6590, test_loss: 1.1725, test_f1: 0.5677
 epoch: 67, train_loss: 0.6545, test_loss: 1.1100, test_f1: 0.5548
 epoch: 68, train_loss: 0.6414, test_loss: 1.1677, test_f1: 0.5713
 epoch: 69, train_loss: 0.6329, test_loss: 1.0950, test_f1: 0.5534
 epoch: 70, train_loss: 0.6232, test_loss: 1.2033, test_f1: 0.5588
 epoch: 71, train_loss: 0.6089, test_loss: 1.3027, test_f1: 0.5457
 epoch: 72, train_loss: 0.6210, test_loss: 1.2511, test_f1: 0.5398
 epoch: 73, train_loss: 0.6155, test_loss: 1.2755, test_f1: 0.5456
 epoch: 74, train_loss: 0.6058, test_loss: 1.3302, test_f1: 0.5291
 epoch: 75, train_loss: 0.6142, test_loss: 1.2360, test_f1: 0.5536
 epoch: 76, train_loss: 0.6222, test_loss: 1.3630, test_f1: 0.5074
 epoch: 77, train_loss: 0.6315, test_loss: 1.1718, test_f1: 0.5492
 epoch: 78, train_loss: 0.6173, test_loss: 1.2517, test_f1: 0.5288
 epoch: 79, train_loss: 0.6009, test_loss: 1.2359, test_f1: 0.5290
 epoch: 80, train_loss: 0.6173, test_loss: 1.1751, test_f1: 0.5674
 epoch: 81, train_loss: 0.6041, test_loss: 1.2027, test_f1: 0.5402
 epoch: 82, train_loss: 0.5962, test_loss: 1.2079, test_f1: 0.5531
 epoch: 83, train_loss: 0.5882, test_loss: 1.2495, test_f1: 0.5369
 epoch: 84, train_loss: 0.5975, test_loss: 1.2797, test_f1: 0.5253
 epoch: 85, train_loss: 0.5866, test_loss: 1.4061, test_f1: 0.5377
 epoch: 86, train_loss: 0.5713, test_loss: 1.2831, test_f1: 0.5289
 epoch: 87, train_loss: 0.5844, test_loss: 1.2390, test_f1: 0.5275
 epoch: 88, train_loss: 0.5692, test_loss: 1.3671, test_f1: 0.5421
 epoch: 89, train_loss: 0.5860, test_loss: 1.2443, test_f1: 0.5485
 epoch: 90, train_loss: 0.5640, test_loss: 1.5412, test_f1: 0.4931
 epoch: 91, train_loss: 0.5959, test_loss: 1.2315, test_f1: 0.5768
 epoch: 92, train_loss: 0.6084, test_loss: 1.2536, test_f1: 0.5254
 epoch: 93, train_loss: 0.5819, test_loss: 1.2020, test_f1: 0.5346
 epoch: 94, train_loss: 0.5675, test_loss: 1.2720, test_f1: 0.5395
 epoch: 95, train_loss: 0.5675, test_loss: 1.6424, test_f1: 0.5036
 epoch: 96, train_loss: 0.5664, test_loss: 1.2926, test_f1: 0.5498
 epoch: 97, train_loss: 0.5827, test_loss: 1.3642, test_f1: 0.5435
 epoch: 98, train_loss: 0.5744, test_loss: 1.3066, test_f1: 0.5449
 epoch: 99, train_loss: 0.5520, test_loss: 1.3712, test_f1: 0.5104
##################ITERATION #7 ****************************************
 epoch: 0, train_loss: 1.4312, test_loss: 1.3112, test_f1: 0.2363
 epoch: 1, train_loss: 1.2232, test_loss: 1.1965, test_f1: 0.3498
 epoch: 2, train_loss: 1.1653, test_loss: 1.1355, test_f1: 0.4071
 epoch: 3, train_loss: 1.1507, test_loss: 1.1571, test_f1: 0.3687
 epoch: 4, train_loss: 1.1164, test_loss: 1.0689, test_f1: 0.4453
 epoch: 5, train_loss: 1.0907, test_loss: 1.0985, test_f1: 0.4189
 epoch: 6, train_loss: 1.0613, test_loss: 1.0179, test_f1: 0.4957
 epoch: 7, train_loss: 1.0313, test_loss: 0.9985, test_f1: 0.4742
 epoch: 8, train_loss: 1.0140, test_loss: 1.0624, test_f1: 0.4999
 epoch: 9, train_loss: 0.9958, test_loss: 0.9836, test_f1: 0.5087
 epoch: 10, train_loss: 0.9708, test_loss: 1.0039, test_f1: 0.4830
 epoch: 11, train_loss: 0.9514, test_loss: 1.0750, test_f1: 0.4640
 epoch: 12, train_loss: 0.9399, test_loss: 1.0107, test_f1: 0.4655
 epoch: 13, train_loss: 0.9365, test_loss: 1.1576, test_f1: 0.4367
 epoch: 14, train_loss: 0.9112, test_loss: 0.9076, test_f1: 0.5090
 epoch: 15, train_loss: 0.9387, test_loss: 1.1868, test_f1: 0.4261
 epoch: 16, train_loss: 0.9537, test_loss: 1.0620, test_f1: 0.4646
 epoch: 17, train_loss: 0.9074, test_loss: 0.9507, test_f1: 0.4870
 epoch: 18, train_loss: 0.8887, test_loss: 1.0898, test_f1: 0.4839
 epoch: 19, train_loss: 0.9005, test_loss: 1.0645, test_f1: 0.4627
 epoch: 20, train_loss: 0.8933, test_loss: 1.1471, test_f1: 0.4552
 epoch: 21, train_loss: 0.8913, test_loss: 0.9811, test_f1: 0.4764
 epoch: 22, train_loss: 0.8708, test_loss: 1.1494, test_f1: 0.4669
 epoch: 23, train_loss: 0.8608, test_loss: 1.0397, test_f1: 0.4790
 epoch: 24, train_loss: 0.8435, test_loss: 1.1708, test_f1: 0.4671
 epoch: 25, train_loss: 0.8459, test_loss: 1.0417, test_f1: 0.4718
 epoch: 26, train_loss: 0.8375, test_loss: 1.0692, test_f1: 0.4640
 epoch: 27, train_loss: 0.8494, test_loss: 1.1415, test_f1: 0.4723
 epoch: 28, train_loss: 0.8348, test_loss: 1.0255, test_f1: 0.4990
 epoch: 29, train_loss: 0.8457, test_loss: 0.9408, test_f1: 0.5155
 epoch: 30, train_loss: 0.8402, test_loss: 1.0031, test_f1: 0.4665
 epoch: 31, train_loss: 0.8501, test_loss: 1.0517, test_f1: 0.5158
 epoch: 32, train_loss: 0.8293, test_loss: 1.0609, test_f1: 0.4437
 epoch: 33, train_loss: 0.8211, test_loss: 1.2036, test_f1: 0.4603
 epoch: 34, train_loss: 0.8168, test_loss: 1.1743, test_f1: 0.4468
 epoch: 35, train_loss: 0.7886, test_loss: 1.0522, test_f1: 0.4812
 epoch: 36, train_loss: 0.7923, test_loss: 0.9831, test_f1: 0.4690
 epoch: 37, train_loss: 0.8179, test_loss: 1.0634, test_f1: 0.4879
 epoch: 38, train_loss: 0.7919, test_loss: 1.2030, test_f1: 0.4718
 epoch: 39, train_loss: 0.8125, test_loss: 1.1244, test_f1: 0.4749
 epoch: 40, train_loss: 0.8135, test_loss: 1.1456, test_f1: 0.4708
 epoch: 41, train_loss: 0.7896, test_loss: 0.9981, test_f1: 0.5001
 epoch: 42, train_loss: 0.7995, test_loss: 1.1104, test_f1: 0.4816
 epoch: 43, train_loss: 0.7655, test_loss: 1.1215, test_f1: 0.4806
 epoch: 44, train_loss: 0.7719, test_loss: 1.0455, test_f1: 0.5278
 epoch: 45, train_loss: 0.7673, test_loss: 1.0923, test_f1: 0.5111
 epoch: 46, train_loss: 0.7631, test_loss: 1.0704, test_f1: 0.5010
 epoch: 47, train_loss: 0.7529, test_loss: 1.0750, test_f1: 0.4987
 epoch: 48, train_loss: 0.7648, test_loss: 1.0459, test_f1: 0.5181
 epoch: 49, train_loss: 0.7684, test_loss: 1.1354, test_f1: 0.5354
 epoch: 50, train_loss: 0.7345, test_loss: 1.0298, test_f1: 0.4978
 epoch: 51, train_loss: 0.7245, test_loss: 1.0987, test_f1: 0.5172
 epoch: 52, train_loss: 0.7111, test_loss: 1.0789, test_f1: 0.5172
 epoch: 53, train_loss: 0.6915, test_loss: 1.0737, test_f1: 0.5352
 epoch: 54, train_loss: 0.6842, test_loss: 1.0804, test_f1: 0.5275
 epoch: 55, train_loss: 0.7087, test_loss: 1.0078, test_f1: 0.5449
 epoch: 56, train_loss: 0.6958, test_loss: 1.1130, test_f1: 0.5070
 epoch: 57, train_loss: 0.6861, test_loss: 1.1274, test_f1: 0.4983
 epoch: 58, train_loss: 0.6802, test_loss: 1.0914, test_f1: 0.5322
 epoch: 59, train_loss: 0.6713, test_loss: 1.1180, test_f1: 0.5244
 epoch: 60, train_loss: 0.6752, test_loss: 1.0987, test_f1: 0.5472
 epoch: 61, train_loss: 0.6750, test_loss: 1.1693, test_f1: 0.5139
 epoch: 62, train_loss: 0.6792, test_loss: 1.0860, test_f1: 0.5417
 epoch: 63, train_loss: 0.6668, test_loss: 1.1432, test_f1: 0.5136
 epoch: 64, train_loss: 0.6646, test_loss: 1.1384, test_f1: 0.5330
 epoch: 65, train_loss: 0.6720, test_loss: 1.1384, test_f1: 0.5223
 epoch: 66, train_loss: 0.6544, test_loss: 1.3717, test_f1: 0.4590
 epoch: 67, train_loss: 0.6620, test_loss: 1.1257, test_f1: 0.5394
 epoch: 68, train_loss: 0.6538, test_loss: 1.1033, test_f1: 0.5495
 epoch: 69, train_loss: 0.6540, test_loss: 1.1464, test_f1: 0.5507
 epoch: 70, train_loss: 0.6618, test_loss: 1.1930, test_f1: 0.5273
 epoch: 71, train_loss: 0.6622, test_loss: 1.1497, test_f1: 0.5457
 epoch: 72, train_loss: 0.6863, test_loss: 1.1124, test_f1: 0.5332
 epoch: 73, train_loss: 0.6708, test_loss: 1.1493, test_f1: 0.5339
 epoch: 74, train_loss: 0.6538, test_loss: 1.1255, test_f1: 0.5546
 epoch: 75, train_loss: 0.6347, test_loss: 1.1219, test_f1: 0.5359
 epoch: 76, train_loss: 0.6449, test_loss: 1.1174, test_f1: 0.5593
 epoch: 77, train_loss: 0.6484, test_loss: 1.1402, test_f1: 0.5480
 epoch: 78, train_loss: 0.6424, test_loss: 1.2576, test_f1: 0.5137
 epoch: 79, train_loss: 0.6379, test_loss: 1.2722, test_f1: 0.4921
 epoch: 80, train_loss: 0.6176, test_loss: 1.3079, test_f1: 0.4978
 epoch: 81, train_loss: 0.6473, test_loss: 1.1043, test_f1: 0.5388
 epoch: 82, train_loss: 0.6372, test_loss: 1.1654, test_f1: 0.5594
 epoch: 83, train_loss: 0.6192, test_loss: 1.2549, test_f1: 0.5405
 epoch: 84, train_loss: 0.6275, test_loss: 1.2963, test_f1: 0.5110
 epoch: 85, train_loss: 0.6277, test_loss: 1.1779, test_f1: 0.5532
 epoch: 86, train_loss: 0.6101, test_loss: 1.2066, test_f1: 0.5523
 epoch: 87, train_loss: 0.6404, test_loss: 1.1516, test_f1: 0.5508
 epoch: 88, train_loss: 0.6297, test_loss: 1.1737, test_f1: 0.5517
 epoch: 89, train_loss: 0.6176, test_loss: 1.2082, test_f1: 0.5488
 epoch: 90, train_loss: 0.6097, test_loss: 1.2603, test_f1: 0.5332
 epoch: 91, train_loss: 0.6269, test_loss: 1.2954, test_f1: 0.5147
 epoch: 92, train_loss: 0.6061, test_loss: 1.3209, test_f1: 0.5205
 epoch: 93, train_loss: 0.6122, test_loss: 1.3842, test_f1: 0.5301
 epoch: 94, train_loss: 0.6244, test_loss: 1.3703, test_f1: 0.5020
 epoch: 95, train_loss: 0.6247, test_loss: 1.2742, test_f1: 0.5385
 epoch: 96, train_loss: 0.6067, test_loss: 1.2210, test_f1: 0.5218
 epoch: 97, train_loss: 0.6093, test_loss: 1.2737, test_f1: 0.5542
 epoch: 98, train_loss: 0.6105, test_loss: 1.3420, test_f1: 0.5197
 epoch: 99, train_loss: 0.5808, test_loss: 1.2684, test_f1: 0.5564
##################ITERATION #8 ****************************************
 epoch: 0, train_loss: 1.3729, test_loss: 1.2235, test_f1: 0.2537
 epoch: 1, train_loss: 1.1985, test_loss: 1.1570, test_f1: 0.3823
 epoch: 2, train_loss: 1.1441, test_loss: 1.0934, test_f1: 0.4451
 epoch: 3, train_loss: 1.1019, test_loss: 1.0488, test_f1: 0.4419
 epoch: 4, train_loss: 1.0719, test_loss: 1.0364, test_f1: 0.4518
 epoch: 5, train_loss: 1.0452, test_loss: 1.0992, test_f1: 0.4145
 epoch: 6, train_loss: 1.0100, test_loss: 1.0026, test_f1: 0.4837
 epoch: 7, train_loss: 0.9938, test_loss: 0.9496, test_f1: 0.4895
 epoch: 8, train_loss: 0.9711, test_loss: 0.9793, test_f1: 0.4939
 epoch: 9, train_loss: 0.9543, test_loss: 0.9888, test_f1: 0.5261
 epoch: 10, train_loss: 0.9227, test_loss: 1.0803, test_f1: 0.4710
 epoch: 11, train_loss: 0.9174, test_loss: 1.0487, test_f1: 0.4806
 epoch: 12, train_loss: 0.9262, test_loss: 1.0031, test_f1: 0.4967
 epoch: 13, train_loss: 0.8857, test_loss: 1.0219, test_f1: 0.5291
 epoch: 14, train_loss: 0.8993, test_loss: 0.9499, test_f1: 0.5435
 epoch: 15, train_loss: 0.8625, test_loss: 1.0599, test_f1: 0.4984
 epoch: 16, train_loss: 0.9151, test_loss: 1.0177, test_f1: 0.5077
 epoch: 17, train_loss: 0.8988, test_loss: 0.9713, test_f1: 0.5286
 epoch: 18, train_loss: 0.8778, test_loss: 0.9747, test_f1: 0.5058
 epoch: 19, train_loss: 0.8529, test_loss: 1.0057, test_f1: 0.5199
 epoch: 20, train_loss: 0.8449, test_loss: 0.9782, test_f1: 0.5032
 epoch: 21, train_loss: 0.8466, test_loss: 0.9722, test_f1: 0.5204
 epoch: 22, train_loss: 0.8187, test_loss: 1.0495, test_f1: 0.5006
 epoch: 23, train_loss: 0.8102, test_loss: 1.0260, test_f1: 0.5527
 epoch: 24, train_loss: 0.8442, test_loss: 1.0322, test_f1: 0.5222
 epoch: 25, train_loss: 0.8181, test_loss: 0.9578, test_f1: 0.5668
 epoch: 26, train_loss: 0.7972, test_loss: 1.0149, test_f1: 0.5472
 epoch: 27, train_loss: 0.7750, test_loss: 0.9776, test_f1: 0.5561
 epoch: 28, train_loss: 0.7828, test_loss: 1.0019, test_f1: 0.5463
 epoch: 29, train_loss: 0.7822, test_loss: 1.0299, test_f1: 0.5316
 epoch: 30, train_loss: 0.7717, test_loss: 0.9742, test_f1: 0.5344
 epoch: 31, train_loss: 0.7711, test_loss: 0.9877, test_f1: 0.5699
 epoch: 32, train_loss: 0.7594, test_loss: 1.0695, test_f1: 0.5206
 epoch: 33, train_loss: 0.7707, test_loss: 1.0383, test_f1: 0.5168
 epoch: 34, train_loss: 0.7558, test_loss: 1.0639, test_f1: 0.5360
 epoch: 35, train_loss: 0.7559, test_loss: 1.0992, test_f1: 0.4985
 epoch: 36, train_loss: 0.7483, test_loss: 1.0431, test_f1: 0.4960
 epoch: 37, train_loss: 0.7340, test_loss: 0.9973, test_f1: 0.5509
 epoch: 38, train_loss: 0.7560, test_loss: 1.1828, test_f1: 0.5001
 epoch: 39, train_loss: 0.7515, test_loss: 1.0335, test_f1: 0.5386
 epoch: 40, train_loss: 0.7192, test_loss: 1.0775, test_f1: 0.5637
 epoch: 41, train_loss: 0.7313, test_loss: 1.0587, test_f1: 0.5431
 epoch: 42, train_loss: 0.7864, test_loss: 1.0368, test_f1: 0.5065
 epoch: 43, train_loss: 0.7458, test_loss: 1.0495, test_f1: 0.5565
 epoch: 44, train_loss: 0.7210, test_loss: 1.0315, test_f1: 0.5148
 epoch: 45, train_loss: 0.7133, test_loss: 1.0932, test_f1: 0.5568
 epoch: 46, train_loss: 0.6989, test_loss: 1.0569, test_f1: 0.5652
 epoch: 47, train_loss: 0.7073, test_loss: 1.0936, test_f1: 0.5286
 epoch: 48, train_loss: 0.7139, test_loss: 1.0532, test_f1: 0.5417
 epoch: 49, train_loss: 0.7373, test_loss: 1.1033, test_f1: 0.5136
 epoch: 50, train_loss: 0.7183, test_loss: 1.0891, test_f1: 0.5388
 epoch: 51, train_loss: 0.6989, test_loss: 1.0415, test_f1: 0.5750
 epoch: 52, train_loss: 0.6527, test_loss: 1.0940, test_f1: 0.5452
 epoch: 53, train_loss: 0.6460, test_loss: 1.0768, test_f1: 0.5657
 epoch: 54, train_loss: 0.6465, test_loss: 1.1386, test_f1: 0.5458
 epoch: 55, train_loss: 0.6359, test_loss: 1.1042, test_f1: 0.5575
 epoch: 56, train_loss: 0.6248, test_loss: 1.1469, test_f1: 0.5315
 epoch: 57, train_loss: 0.6157, test_loss: 1.1542, test_f1: 0.5370
 epoch: 58, train_loss: 0.6217, test_loss: 1.1964, test_f1: 0.5460
 epoch: 59, train_loss: 0.6117, test_loss: 1.2147, test_f1: 0.5137
 epoch: 60, train_loss: 0.6292, test_loss: 1.1938, test_f1: 0.5230
 epoch: 61, train_loss: 0.6213, test_loss: 1.2376, test_f1: 0.5323
 epoch: 62, train_loss: 0.6161, test_loss: 1.1493, test_f1: 0.5588
 epoch: 63, train_loss: 0.6053, test_loss: 1.2655, test_f1: 0.5338
 epoch: 64, train_loss: 0.6010, test_loss: 1.1642, test_f1: 0.5411
 epoch: 65, train_loss: 0.5900, test_loss: 1.2292, test_f1: 0.5337
 epoch: 66, train_loss: 0.6021, test_loss: 1.1785, test_f1: 0.5589
 epoch: 67, train_loss: 0.5941, test_loss: 1.2271, test_f1: 0.5322
 epoch: 68, train_loss: 0.5807, test_loss: 1.2126, test_f1: 0.5463
 epoch: 69, train_loss: 0.5664, test_loss: 1.2625, test_f1: 0.5466
 epoch: 70, train_loss: 0.5700, test_loss: 1.3246, test_f1: 0.5364
 epoch: 71, train_loss: 0.5858, test_loss: 1.2588, test_f1: 0.5583
 epoch: 72, train_loss: 0.5979, test_loss: 1.1789, test_f1: 0.5562
 epoch: 73, train_loss: 0.5820, test_loss: 1.2748, test_f1: 0.5373
 epoch: 74, train_loss: 0.5875, test_loss: 1.2209, test_f1: 0.5167
 epoch: 75, train_loss: 0.5831, test_loss: 1.1853, test_f1: 0.5657
 epoch: 76, train_loss: 0.5688, test_loss: 1.2628, test_f1: 0.5517
 epoch: 77, train_loss: 0.5627, test_loss: 1.2036, test_f1: 0.5495
 epoch: 78, train_loss: 0.5405, test_loss: 1.3040, test_f1: 0.5793
 epoch: 79, train_loss: 0.5594, test_loss: 1.2198, test_f1: 0.5758
 epoch: 80, train_loss: 0.5706, test_loss: 1.3111, test_f1: 0.5456
 epoch: 81, train_loss: 0.5746, test_loss: 1.2464, test_f1: 0.5644
 epoch: 82, train_loss: 0.5556, test_loss: 1.3021, test_f1: 0.5395
 epoch: 83, train_loss: 0.5657, test_loss: 1.3487, test_f1: 0.5570
 epoch: 84, train_loss: 0.5539, test_loss: 1.3118, test_f1: 0.5418
 epoch: 85, train_loss: 0.5775, test_loss: 1.1883, test_f1: 0.5687
 epoch: 86, train_loss: 0.5542, test_loss: 1.3255, test_f1: 0.5593
 epoch: 87, train_loss: 0.5333, test_loss: 1.3632, test_f1: 0.5430
 epoch: 88, train_loss: 0.5299, test_loss: 1.3379, test_f1: 0.5701
 epoch: 89, train_loss: 0.5545, test_loss: 1.2772, test_f1: 0.5616
 epoch: 90, train_loss: 0.5286, test_loss: 1.3140, test_f1: 0.5588
 epoch: 91, train_loss: 0.5241, test_loss: 1.3927, test_f1: 0.5767
 epoch: 92, train_loss: 0.5272, test_loss: 1.3378, test_f1: 0.5543
 epoch: 93, train_loss: 0.5354, test_loss: 1.3366, test_f1: 0.5586
 epoch: 94, train_loss: 0.5449, test_loss: 1.3328, test_f1: 0.5618
 epoch: 95, train_loss: 0.5246, test_loss: 1.4934, test_f1: 0.5420
 epoch: 96, train_loss: 0.5351, test_loss: 1.3663, test_f1: 0.5846
 epoch: 97, train_loss: 0.5201, test_loss: 1.4319, test_f1: 0.5403
 epoch: 98, train_loss: 0.5177, test_loss: 1.4490, test_f1: 0.5489
 epoch: 99, train_loss: 0.5006, test_loss: 1.3606, test_f1: 0.5706
##################ITERATION #9 ****************************************
 epoch: 0, train_loss: 1.5156, test_loss: 1.2982, test_f1: 0.2765
 epoch: 1, train_loss: 1.2350, test_loss: 1.2128, test_f1: 0.2693
 epoch: 2, train_loss: 1.2010, test_loss: 1.1499, test_f1: 0.4274
 epoch: 3, train_loss: 1.1638, test_loss: 1.1386, test_f1: 0.4188
 epoch: 4, train_loss: 1.1246, test_loss: 1.1027, test_f1: 0.4351
 epoch: 5, train_loss: 1.1089, test_loss: 1.0858, test_f1: 0.4289
 epoch: 6, train_loss: 1.0814, test_loss: 1.0841, test_f1: 0.4312
 epoch: 7, train_loss: 1.0569, test_loss: 1.0347, test_f1: 0.4395
 epoch: 8, train_loss: 1.0423, test_loss: 1.0155, test_f1: 0.4698
 epoch: 9, train_loss: 1.0235, test_loss: 0.9836, test_f1: 0.4799
 epoch: 10, train_loss: 1.0047, test_loss: 0.9865, test_f1: 0.4823
 epoch: 11, train_loss: 0.9727, test_loss: 1.0054, test_f1: 0.4624
 epoch: 12, train_loss: 0.9564, test_loss: 0.9752, test_f1: 0.4755
 epoch: 13, train_loss: 0.9510, test_loss: 0.9708, test_f1: 0.4766
 epoch: 14, train_loss: 0.9420, test_loss: 0.9514, test_f1: 0.5146
 epoch: 15, train_loss: 0.9242, test_loss: 1.0765, test_f1: 0.5038
 epoch: 16, train_loss: 0.9172, test_loss: 0.9659, test_f1: 0.5179
 epoch: 17, train_loss: 0.9039, test_loss: 0.9549, test_f1: 0.5151
 epoch: 18, train_loss: 0.9014, test_loss: 1.0151, test_f1: 0.5174
 epoch: 19, train_loss: 0.8964, test_loss: 0.9875, test_f1: 0.5070
 epoch: 20, train_loss: 0.8878, test_loss: 0.9443, test_f1: 0.5198
 epoch: 21, train_loss: 0.8652, test_loss: 0.9740, test_f1: 0.5044
 epoch: 22, train_loss: 0.8526, test_loss: 0.9838, test_f1: 0.5532
 epoch: 23, train_loss: 0.8619, test_loss: 1.0451, test_f1: 0.4910
 epoch: 24, train_loss: 0.8386, test_loss: 0.9562, test_f1: 0.5373
 epoch: 25, train_loss: 0.8422, test_loss: 1.0052, test_f1: 0.5391
 epoch: 26, train_loss: 0.8279, test_loss: 0.9461, test_f1: 0.5458
 epoch: 27, train_loss: 0.8203, test_loss: 1.0718, test_f1: 0.4887
 epoch: 28, train_loss: 0.8278, test_loss: 1.2018, test_f1: 0.4953
 epoch: 29, train_loss: 0.8226, test_loss: 1.0189, test_f1: 0.5447
 epoch: 30, train_loss: 0.8055, test_loss: 0.9619, test_f1: 0.5239
 epoch: 31, train_loss: 0.7927, test_loss: 0.9549, test_f1: 0.5736
 epoch: 32, train_loss: 0.7994, test_loss: 1.0534, test_f1: 0.5153
 epoch: 33, train_loss: 0.7954, test_loss: 1.1012, test_f1: 0.5263
 epoch: 34, train_loss: 0.7745, test_loss: 0.9609, test_f1: 0.5689
 epoch: 35, train_loss: 0.7675, test_loss: 1.0021, test_f1: 0.5659
 epoch: 36, train_loss: 0.7717, test_loss: 1.2661, test_f1: 0.4790
 epoch: 37, train_loss: 0.7704, test_loss: 0.9934, test_f1: 0.5694
 epoch: 38, train_loss: 0.7832, test_loss: 0.9420, test_f1: 0.5518
 epoch: 39, train_loss: 0.7620, test_loss: 1.0205, test_f1: 0.5527
 epoch: 40, train_loss: 0.7755, test_loss: 1.0064, test_f1: 0.5073
 epoch: 41, train_loss: 0.7711, test_loss: 1.1341, test_f1: 0.5252
 epoch: 42, train_loss: 0.7602, test_loss: 0.9507, test_f1: 0.5789
 epoch: 43, train_loss: 0.7646, test_loss: 1.0037, test_f1: 0.5355
 epoch: 44, train_loss: 0.7555, test_loss: 0.9679, test_f1: 0.5318
 epoch: 45, train_loss: 0.7491, test_loss: 0.9766, test_f1: 0.5864
 epoch: 46, train_loss: 0.7245, test_loss: 1.0435, test_f1: 0.5199
 epoch: 47, train_loss: 0.7325, test_loss: 1.0877, test_f1: 0.5499
 epoch: 48, train_loss: 0.6992, test_loss: 0.9877, test_f1: 0.5643
 epoch: 49, train_loss: 0.7184, test_loss: 0.9895, test_f1: 0.5484
 epoch: 50, train_loss: 0.7180, test_loss: 1.1776, test_f1: 0.5222
 epoch: 51, train_loss: 0.7100, test_loss: 1.0156, test_f1: 0.5631
 epoch: 52, train_loss: 0.6902, test_loss: 1.0186, test_f1: 0.5598
 epoch: 53, train_loss: 0.6694, test_loss: 0.9889, test_f1: 0.5544
 epoch: 54, train_loss: 0.6459, test_loss: 1.0049, test_f1: 0.5594
 epoch: 55, train_loss: 0.6358, test_loss: 1.0714, test_f1: 0.5387
 epoch: 56, train_loss: 0.6217, test_loss: 1.0070, test_f1: 0.5982
 epoch: 57, train_loss: 0.6424, test_loss: 1.1070, test_f1: 0.5432
 epoch: 58, train_loss: 0.6387, test_loss: 1.0761, test_f1: 0.5408
 epoch: 59, train_loss: 0.6183, test_loss: 1.1020, test_f1: 0.5724
 epoch: 60, train_loss: 0.6262, test_loss: 1.0036, test_f1: 0.5796
 epoch: 61, train_loss: 0.6191, test_loss: 1.1123, test_f1: 0.5337
 epoch: 62, train_loss: 0.6042, test_loss: 1.0448, test_f1: 0.5957
 epoch: 63, train_loss: 0.6066, test_loss: 1.0585, test_f1: 0.5544
 epoch: 64, train_loss: 0.5982, test_loss: 1.0298, test_f1: 0.5718
 epoch: 65, train_loss: 0.5768, test_loss: 1.0554, test_f1: 0.5621
 epoch: 66, train_loss: 0.5964, test_loss: 1.0736, test_f1: 0.5685
 epoch: 67, train_loss: 0.5972, test_loss: 1.0762, test_f1: 0.5500
 epoch: 68, train_loss: 0.6165, test_loss: 1.1457, test_f1: 0.5440
 epoch: 69, train_loss: 0.6289, test_loss: 1.0783, test_f1: 0.5815
 epoch: 70, train_loss: 0.5850, test_loss: 1.1447, test_f1: 0.5386
 epoch: 71, train_loss: 0.5975, test_loss: 1.0846, test_f1: 0.5672
 epoch: 72, train_loss: 0.5900, test_loss: 1.0870, test_f1: 0.5884
 epoch: 73, train_loss: 0.5763, test_loss: 1.0929, test_f1: 0.5509
 epoch: 74, train_loss: 0.5703, test_loss: 1.1017, test_f1: 0.5636
 epoch: 75, train_loss: 0.5542, test_loss: 1.1834, test_f1: 0.5567
 epoch: 76, train_loss: 0.5653, test_loss: 1.2128, test_f1: 0.5358
 epoch: 77, train_loss: 0.5792, test_loss: 1.2312, test_f1: 0.5371
 epoch: 78, train_loss: 0.5838, test_loss: 1.1455, test_f1: 0.5402
 epoch: 79, train_loss: 0.5808, test_loss: 1.2613, test_f1: 0.5052
 epoch: 80, train_loss: 0.5638, test_loss: 1.1444, test_f1: 0.5720
 epoch: 81, train_loss: 0.5626, test_loss: 1.1431, test_f1: 0.5437
 epoch: 82, train_loss: 0.5576, test_loss: 1.1746, test_f1: 0.5720
 epoch: 83, train_loss: 0.5536, test_loss: 1.1232, test_f1: 0.5652
 epoch: 84, train_loss: 0.5528, test_loss: 1.3002, test_f1: 0.5406
 epoch: 85, train_loss: 0.5664, test_loss: 1.1894, test_f1: 0.5270
 epoch: 86, train_loss: 0.5550, test_loss: 1.2483, test_f1: 0.5494
 epoch: 87, train_loss: 0.5612, test_loss: 1.1218, test_f1: 0.5481
 epoch: 88, train_loss: 0.5512, test_loss: 1.1827, test_f1: 0.5664
 epoch: 89, train_loss: 0.5552, test_loss: 1.2050, test_f1: 0.5269
 epoch: 90, train_loss: 0.5478, test_loss: 1.1128, test_f1: 0.5708
 epoch: 91, train_loss: 0.5495, test_loss: 1.1261, test_f1: 0.5318
 epoch: 92, train_loss: 0.5395, test_loss: 1.2150, test_f1: 0.5494
 epoch: 93, train_loss: 0.5356, test_loss: 1.2051, test_f1: 0.5832
 epoch: 94, train_loss: 0.5405, test_loss: 1.3189, test_f1: 0.4982
 epoch: 95, train_loss: 0.5454, test_loss: 1.3274, test_f1: 0.4972
 epoch: 96, train_loss: 0.5217, test_loss: 1.2783, test_f1: 0.5413
 epoch: 97, train_loss: 0.5155, test_loss: 1.3527, test_f1: 0.4946
 epoch: 98, train_loss: 0.5183, test_loss: 1.1601, test_f1: 0.5856
 epoch: 99, train_loss: 0.5165, test_loss: 1.3135, test_f1: 0.5573

Training completed in 372.42 seconds
Best F1: 0.6221 at epoch 95
Mean F1 across iterations: 0.5846  0.0160
========================FINAL RESULTS================================
FEGIN weighted F1: 0.6221  0.0160
python main.py --data ltspice_examples --representation component_component --model FEGIN --layers 3 --hiddens 32 --batch_size 256 --lr 0.01 --emb_size 250 --epochs 100 --save_appendix component_component_L3_H32_BS256_LR0.01_E250 --no_val
-----



STDERR:
  File "main.py", line 370, in <module>
    main()
  File "main.py", line 254, in main
    dataset = dataset_class(
  File "/home/philip/projects/ltspice_examples_code_repo/Circuit-Completion-Using-GNNs/component_classification_with_link_prediction_head/evaluation/FEGIN/kernel/circuit_datasets.py", line 15, in __init__
    self.data, self.slices = torch.load(self.processed_paths[0])
  File "/home/philip/.local/lib/python3.8/site-packages/torch/serialization.py", line 1040, in load
    warnings.warn(
  File "/usr/lib/python3.8/warnings.py", line 109, in _showwarnmsg
    sw(msg.message, msg.category, msg.filename, msg.lineno,
  File "main.py", line 47, in warn_with_traceback
    traceback.print_stack(file=log)
/home/philip/projects/ltspice_examples_code_repo/Circuit-Completion-Using-GNNs/component_classification_with_link_prediction_head/evaluation/FEGIN/kernel/circuit_datasets.py:15: FutureWarning: You are using `torch.load` with `weights_only=False` (the current default value), which uses the default pickle module implicitly. It is possible to construct malicious pickle data which will execute arbitrary code during unpickling (See https://github.com/pytorch/pytorch/blob/main/SECURITY.md#untrusted-models for more details). In a future release, the default value for `weights_only` will be flipped to `True`. This limits the functions that could be executed during unpickling. Arbitrary objects will no longer be allowed to be loaded via this mode unless they are explicitly allowlisted by the user via `torch.serialization.add_safe_globals`. We recommend you start setting `weights_only=True` for any use case where you don't have full control of the loaded file. Please open an issue on GitHub for any issues related to this experimental feature.
  self.data, self.slices = torch.load(self.processed_paths[0])
