STDOUT:
Results will be saved in /home/philip/projects/ltspice_examples_code_repo/Circuit-Completion-Using-GNNs/component_classification_with_link_prediction_head/evaluation/FEGIN/results/model_FEGIN_dataset_ltspice_examples
Command line input: python main.py --data ltspice_examples --representation component_pin_net --model FEGIN --layers 2 --hiddens 64 --batch_size 256 --lr 0.01 --emb_size 128 --epochs 100 --save_appendix component_pin_net_L2_H64_BS256_LR0.01_E128 --no_val
 is saved.
-----
ltspice_examples - FEGIN
Using 2 layers, 64 hidden units, h = 2
Loading component_pin_net representation dataset
ENTERED
Training FEGIN on component_pin_net representation
Train: 3558, Test: 846
##################ITERATION #0 ****************************************
 epoch: 0, train_loss: 1.2069, test_loss: 1.4534, test_f1: 0.2270
 epoch: 1, train_loss: 1.0092, test_loss: 1.5682, test_f1: 0.2415
 epoch: 2, train_loss: 0.9779, test_loss: 1.1192, test_f1: 0.4179
 epoch: 3, train_loss: 0.9591, test_loss: 1.0028, test_f1: 0.4486
 epoch: 4, train_loss: 0.9414, test_loss: 0.9935, test_f1: 0.4725
 epoch: 5, train_loss: 0.9314, test_loss: 1.1658, test_f1: 0.4259
 epoch: 6, train_loss: 0.9175, test_loss: 0.9586, test_f1: 0.4889
 epoch: 7, train_loss: 0.8948, test_loss: 1.0293, test_f1: 0.4501
 epoch: 8, train_loss: 0.8708, test_loss: 1.0065, test_f1: 0.5145
 epoch: 9, train_loss: 0.8510, test_loss: 0.8464, test_f1: 0.5445
 epoch: 10, train_loss: 0.8329, test_loss: 0.8976, test_f1: 0.5455
 epoch: 11, train_loss: 0.8207, test_loss: 0.9198, test_f1: 0.6027
 epoch: 12, train_loss: 0.8157, test_loss: 0.9310, test_f1: 0.5251
 epoch: 13, train_loss: 0.8137, test_loss: 0.9328, test_f1: 0.5529
 epoch: 14, train_loss: 0.7896, test_loss: 1.0188, test_f1: 0.4822
 epoch: 15, train_loss: 0.7857, test_loss: 0.8162, test_f1: 0.5877
 epoch: 16, train_loss: 0.7690, test_loss: 0.9026, test_f1: 0.5389
 epoch: 17, train_loss: 0.7530, test_loss: 0.8956, test_f1: 0.5851
 epoch: 18, train_loss: 0.7469, test_loss: 1.2258, test_f1: 0.4978
 epoch: 19, train_loss: 0.7367, test_loss: 0.8702, test_f1: 0.6019
 epoch: 20, train_loss: 0.7422, test_loss: 0.8784, test_f1: 0.5868
 epoch: 21, train_loss: 0.7113, test_loss: 1.3955, test_f1: 0.4279
 epoch: 22, train_loss: 0.7216, test_loss: 0.9883, test_f1: 0.5574
 epoch: 23, train_loss: 0.7035, test_loss: 0.8701, test_f1: 0.6198
 epoch: 24, train_loss: 0.6758, test_loss: 0.8938, test_f1: 0.6061
 epoch: 25, train_loss: 0.6685, test_loss: 0.8866, test_f1: 0.5896
 epoch: 26, train_loss: 0.6754, test_loss: 0.8662, test_f1: 0.6204
 epoch: 27, train_loss: 0.6668, test_loss: 0.8176, test_f1: 0.6468
 epoch: 28, train_loss: 0.6602, test_loss: 1.0324, test_f1: 0.5890
 epoch: 29, train_loss: 0.6460, test_loss: 1.4132, test_f1: 0.4984
 epoch: 30, train_loss: 0.6446, test_loss: 0.9020, test_f1: 0.5982
 epoch: 31, train_loss: 0.6122, test_loss: 0.8237, test_f1: 0.6183
 epoch: 32, train_loss: 0.5928, test_loss: 0.8537, test_f1: 0.6745
 epoch: 33, train_loss: 0.5966, test_loss: 0.9023, test_f1: 0.6000
 epoch: 34, train_loss: 0.6097, test_loss: 0.8412, test_f1: 0.6413
 epoch: 35, train_loss: 0.6037, test_loss: 0.9360, test_f1: 0.6272
 epoch: 36, train_loss: 0.5778, test_loss: 0.8286, test_f1: 0.6179
 epoch: 37, train_loss: 0.5728, test_loss: 0.9450, test_f1: 0.6373
 epoch: 38, train_loss: 0.5693, test_loss: 0.9107, test_f1: 0.6361
 epoch: 39, train_loss: 0.5668, test_loss: 0.8959, test_f1: 0.6413
 epoch: 40, train_loss: 0.5789, test_loss: 1.1467, test_f1: 0.6102
 epoch: 41, train_loss: 0.5461, test_loss: 0.9086, test_f1: 0.6501
 epoch: 42, train_loss: 0.5386, test_loss: 0.8952, test_f1: 0.6406
 epoch: 43, train_loss: 0.5259, test_loss: 0.9254, test_f1: 0.6436
 epoch: 44, train_loss: 0.5240, test_loss: 0.9540, test_f1: 0.6584
 epoch: 45, train_loss: 0.4967, test_loss: 1.1343, test_f1: 0.5789
 epoch: 46, train_loss: 0.5082, test_loss: 0.9913, test_f1: 0.6347
 epoch: 47, train_loss: 0.5423, test_loss: 1.0335, test_f1: 0.6262
 epoch: 48, train_loss: 0.5040, test_loss: 1.0964, test_f1: 0.6446
 epoch: 49, train_loss: 0.4764, test_loss: 1.0395, test_f1: 0.5916
 epoch: 50, train_loss: 0.4693, test_loss: 1.0015, test_f1: 0.6289
 epoch: 51, train_loss: 0.4515, test_loss: 1.0378, test_f1: 0.6520
 epoch: 52, train_loss: 0.4253, test_loss: 1.0534, test_f1: 0.6319
 epoch: 53, train_loss: 0.4122, test_loss: 1.0411, test_f1: 0.6360
 epoch: 54, train_loss: 0.3991, test_loss: 1.0758, test_f1: 0.6796
 epoch: 55, train_loss: 0.3950, test_loss: 1.1199, test_f1: 0.6413
 epoch: 56, train_loss: 0.4031, test_loss: 1.1015, test_f1: 0.6581
 epoch: 57, train_loss: 0.4262, test_loss: 0.9754, test_f1: 0.6712
 epoch: 58, train_loss: 0.3863, test_loss: 1.0081, test_f1: 0.6924
 epoch: 59, train_loss: 0.3800, test_loss: 1.0372, test_f1: 0.6542
 epoch: 60, train_loss: 0.3662, test_loss: 1.0820, test_f1: 0.6760
 epoch: 61, train_loss: 0.3620, test_loss: 1.1389, test_f1: 0.6509
 epoch: 62, train_loss: 0.3718, test_loss: 1.1225, test_f1: 0.6430
 epoch: 63, train_loss: 0.3715, test_loss: 1.1748, test_f1: 0.6553
 epoch: 64, train_loss: 0.3747, test_loss: 1.2265, test_f1: 0.6354
 epoch: 65, train_loss: 0.3617, test_loss: 1.0664, test_f1: 0.6468
 epoch: 66, train_loss: 0.3604, test_loss: 1.2762, test_f1: 0.6234
 epoch: 67, train_loss: 0.3337, test_loss: 1.1637, test_f1: 0.6466
 epoch: 68, train_loss: 0.3453, test_loss: 1.1311, test_f1: 0.6934
 epoch: 69, train_loss: 0.3322, test_loss: 1.0952, test_f1: 0.6655
 epoch: 70, train_loss: 0.3583, test_loss: 1.2841, test_f1: 0.6636
 epoch: 71, train_loss: 0.3485, test_loss: 1.1592, test_f1: 0.6603
 epoch: 72, train_loss: 0.3277, test_loss: 1.1649, test_f1: 0.6573
 epoch: 73, train_loss: 0.3322, test_loss: 1.1569, test_f1: 0.6582
 epoch: 74, train_loss: 0.3297, test_loss: 1.0835, test_f1: 0.6545
 epoch: 75, train_loss: 0.3356, test_loss: 1.1162, test_f1: 0.6687
 epoch: 76, train_loss: 0.3293, test_loss: 1.3037, test_f1: 0.6364
 epoch: 77, train_loss: 0.3135, test_loss: 1.1189, test_f1: 0.6948
 epoch: 78, train_loss: 0.3219, test_loss: 1.1948, test_f1: 0.6583
 epoch: 79, train_loss: 0.3340, test_loss: 1.2705, test_f1: 0.6441
 epoch: 80, train_loss: 0.3452, test_loss: 1.2704, test_f1: 0.6701
 epoch: 81, train_loss: 0.3384, test_loss: 1.1567, test_f1: 0.6629
 epoch: 82, train_loss: 0.3247, test_loss: 1.2679, test_f1: 0.6575
 epoch: 83, train_loss: 0.2982, test_loss: 1.1010, test_f1: 0.6688
 epoch: 84, train_loss: 0.3161, test_loss: 1.1791, test_f1: 0.6545
 epoch: 85, train_loss: 0.3294, test_loss: 1.2635, test_f1: 0.6517
 epoch: 86, train_loss: 0.3287, test_loss: 1.1865, test_f1: 0.6929
 epoch: 87, train_loss: 0.3113, test_loss: 1.1580, test_f1: 0.6542
 epoch: 88, train_loss: 0.3082, test_loss: 1.1130, test_f1: 0.6983
 epoch: 89, train_loss: 0.2964, test_loss: 1.1574, test_f1: 0.6805
 epoch: 90, train_loss: 0.3092, test_loss: 1.1667, test_f1: 0.6791
 epoch: 91, train_loss: 0.2682, test_loss: 1.1907, test_f1: 0.6686
 epoch: 92, train_loss: 0.2827, test_loss: 1.3177, test_f1: 0.6449
 epoch: 93, train_loss: 0.2966, test_loss: 1.1363, test_f1: 0.6785
 epoch: 94, train_loss: 0.2965, test_loss: 1.2112, test_f1: 0.6746
 epoch: 95, train_loss: 0.2861, test_loss: 1.3053, test_f1: 0.6485
 epoch: 96, train_loss: 0.2857, test_loss: 1.4297, test_f1: 0.6214
 epoch: 97, train_loss: 0.2836, test_loss: 1.2678, test_f1: 0.6498
 epoch: 98, train_loss: 0.3026, test_loss: 1.2513, test_f1: 0.6846
 epoch: 99, train_loss: 0.3127, test_loss: 1.2914, test_f1: 0.6450
##################ITERATION #1 ****************************************
 epoch: 0, train_loss: 1.2260, test_loss: 1.4700, test_f1: 0.2270
 epoch: 1, train_loss: 0.9996, test_loss: 1.4778, test_f1: 0.2270
 epoch: 2, train_loss: 0.9558, test_loss: 1.0595, test_f1: 0.4342
 epoch: 3, train_loss: 0.9143, test_loss: 0.9697, test_f1: 0.4873
 epoch: 4, train_loss: 0.8895, test_loss: 0.9510, test_f1: 0.5088
 epoch: 5, train_loss: 0.8780, test_loss: 0.8632, test_f1: 0.5609
 epoch: 6, train_loss: 0.8372, test_loss: 0.8825, test_f1: 0.5398
 epoch: 7, train_loss: 0.8191, test_loss: 0.8296, test_f1: 0.5933
 epoch: 8, train_loss: 0.7920, test_loss: 0.8653, test_f1: 0.5351
 epoch: 9, train_loss: 0.7850, test_loss: 0.9141, test_f1: 0.5675
 epoch: 10, train_loss: 0.7769, test_loss: 0.8103, test_f1: 0.6013
 epoch: 11, train_loss: 0.7681, test_loss: 1.0949, test_f1: 0.4934
 epoch: 12, train_loss: 0.7531, test_loss: 0.9655, test_f1: 0.5122
 epoch: 13, train_loss: 0.7618, test_loss: 0.8441, test_f1: 0.5359
 epoch: 14, train_loss: 0.7224, test_loss: 0.8701, test_f1: 0.6063
 epoch: 15, train_loss: 0.7145, test_loss: 0.9729, test_f1: 0.5135
 epoch: 16, train_loss: 0.7154, test_loss: 1.1287, test_f1: 0.5126
 epoch: 17, train_loss: 0.6980, test_loss: 0.7401, test_f1: 0.6310
 epoch: 18, train_loss: 0.6801, test_loss: 0.7919, test_f1: 0.6400
 epoch: 19, train_loss: 0.6720, test_loss: 0.9594, test_f1: 0.5327
 epoch: 20, train_loss: 0.6587, test_loss: 0.9303, test_f1: 0.5699
 epoch: 21, train_loss: 0.6523, test_loss: 1.0184, test_f1: 0.5792
 epoch: 22, train_loss: 0.6461, test_loss: 0.7675, test_f1: 0.6388
 epoch: 23, train_loss: 0.6378, test_loss: 0.8962, test_f1: 0.5942
 epoch: 24, train_loss: 0.6267, test_loss: 0.9423, test_f1: 0.5825
 epoch: 25, train_loss: 0.6241, test_loss: 0.8002, test_f1: 0.6291
 epoch: 26, train_loss: 0.6113, test_loss: 0.7821, test_f1: 0.6364
 epoch: 27, train_loss: 0.6176, test_loss: 0.8827, test_f1: 0.6530
 epoch: 28, train_loss: 0.5960, test_loss: 0.8241, test_f1: 0.6154
 epoch: 29, train_loss: 0.5945, test_loss: 0.8387, test_f1: 0.6322
 epoch: 30, train_loss: 0.5961, test_loss: 0.7438, test_f1: 0.6580
 epoch: 31, train_loss: 0.5679, test_loss: 0.8032, test_f1: 0.6496
 epoch: 32, train_loss: 0.5517, test_loss: 0.8379, test_f1: 0.6571
 epoch: 33, train_loss: 0.5776, test_loss: 0.8301, test_f1: 0.6539
 epoch: 34, train_loss: 0.5736, test_loss: 1.0277, test_f1: 0.6347
 epoch: 35, train_loss: 0.5518, test_loss: 0.8592, test_f1: 0.6291
 epoch: 36, train_loss: 0.5431, test_loss: 0.9243, test_f1: 0.6371
 epoch: 37, train_loss: 0.5476, test_loss: 0.8963, test_f1: 0.6482
 epoch: 38, train_loss: 0.5417, test_loss: 0.8669, test_f1: 0.6537
 epoch: 39, train_loss: 0.5390, test_loss: 0.8572, test_f1: 0.6936
 epoch: 40, train_loss: 0.5375, test_loss: 0.8654, test_f1: 0.6335
 epoch: 41, train_loss: 0.5454, test_loss: 0.9755, test_f1: 0.6267
 epoch: 42, train_loss: 0.5301, test_loss: 0.8975, test_f1: 0.6878
 epoch: 43, train_loss: 0.5348, test_loss: 0.8898, test_f1: 0.6229
 epoch: 44, train_loss: 0.4901, test_loss: 0.8364, test_f1: 0.6857
 epoch: 45, train_loss: 0.4839, test_loss: 0.8367, test_f1: 0.6753
 epoch: 46, train_loss: 0.5086, test_loss: 0.8281, test_f1: 0.6455
 epoch: 47, train_loss: 0.5388, test_loss: 1.2267, test_f1: 0.5513
 epoch: 48, train_loss: 0.5100, test_loss: 0.9322, test_f1: 0.6623
 epoch: 49, train_loss: 0.4939, test_loss: 1.0917, test_f1: 0.6766
 epoch: 50, train_loss: 0.4722, test_loss: 0.9344, test_f1: 0.6415
 epoch: 51, train_loss: 0.4501, test_loss: 0.8133, test_f1: 0.6912
 epoch: 52, train_loss: 0.4390, test_loss: 0.9315, test_f1: 0.6653
 epoch: 53, train_loss: 0.4326, test_loss: 0.8920, test_f1: 0.6636
 epoch: 54, train_loss: 0.4025, test_loss: 0.9695, test_f1: 0.6497
 epoch: 55, train_loss: 0.4098, test_loss: 0.8907, test_f1: 0.6804
 epoch: 56, train_loss: 0.3896, test_loss: 0.9921, test_f1: 0.6726
 epoch: 57, train_loss: 0.3941, test_loss: 1.0118, test_f1: 0.6636
 epoch: 58, train_loss: 0.3861, test_loss: 0.9090, test_f1: 0.6710
 epoch: 59, train_loss: 0.3736, test_loss: 0.9642, test_f1: 0.6597
 epoch: 60, train_loss: 0.3819, test_loss: 0.9212, test_f1: 0.6659
 epoch: 61, train_loss: 0.4030, test_loss: 1.0291, test_f1: 0.6546
 epoch: 62, train_loss: 0.3603, test_loss: 1.0336, test_f1: 0.6667
 epoch: 63, train_loss: 0.3569, test_loss: 0.9431, test_f1: 0.6943
 epoch: 64, train_loss: 0.3642, test_loss: 0.9577, test_f1: 0.6577
 epoch: 65, train_loss: 0.3639, test_loss: 0.9827, test_f1: 0.6515
 epoch: 66, train_loss: 0.3658, test_loss: 1.0359, test_f1: 0.6462
 epoch: 67, train_loss: 0.3425, test_loss: 0.9292, test_f1: 0.6634
 epoch: 68, train_loss: 0.3600, test_loss: 1.1987, test_f1: 0.6426
 epoch: 69, train_loss: 0.3410, test_loss: 1.1132, test_f1: 0.6587
 epoch: 70, train_loss: 0.3777, test_loss: 1.1049, test_f1: 0.6498
 epoch: 71, train_loss: 0.3754, test_loss: 1.0928, test_f1: 0.6405
 epoch: 72, train_loss: 0.3537, test_loss: 1.1974, test_f1: 0.6530
 epoch: 73, train_loss: 0.3437, test_loss: 1.0050, test_f1: 0.6623
 epoch: 74, train_loss: 0.3225, test_loss: 1.2676, test_f1: 0.6425
 epoch: 75, train_loss: 0.3313, test_loss: 1.1527, test_f1: 0.6445
 epoch: 76, train_loss: 0.3191, test_loss: 1.1380, test_f1: 0.6683
 epoch: 77, train_loss: 0.3098, test_loss: 1.3320, test_f1: 0.6253
 epoch: 78, train_loss: 0.3431, test_loss: 1.1124, test_f1: 0.6588
 epoch: 79, train_loss: 0.3315, test_loss: 1.0826, test_f1: 0.6695
 epoch: 80, train_loss: 0.3023, test_loss: 1.1459, test_f1: 0.6614
 epoch: 81, train_loss: 0.3244, test_loss: 1.2845, test_f1: 0.6580
 epoch: 82, train_loss: 0.2991, test_loss: 1.1946, test_f1: 0.6588
 epoch: 83, train_loss: 0.3152, test_loss: 1.1104, test_f1: 0.6264
 epoch: 84, train_loss: 0.2999, test_loss: 1.2116, test_f1: 0.6558
 epoch: 85, train_loss: 0.3388, test_loss: 1.1138, test_f1: 0.6470
 epoch: 86, train_loss: 0.3165, test_loss: 1.2559, test_f1: 0.6389
 epoch: 87, train_loss: 0.3034, test_loss: 1.2419, test_f1: 0.6459
 epoch: 88, train_loss: 0.3108, test_loss: 1.2063, test_f1: 0.6304
 epoch: 89, train_loss: 0.3079, test_loss: 1.3733, test_f1: 0.6335
 epoch: 90, train_loss: 0.3247, test_loss: 1.3617, test_f1: 0.6376
 epoch: 91, train_loss: 0.3357, test_loss: 1.1747, test_f1: 0.6504
 epoch: 92, train_loss: 0.3143, test_loss: 1.1661, test_f1: 0.6483
 epoch: 93, train_loss: 0.2794, test_loss: 1.3361, test_f1: 0.6424
 epoch: 94, train_loss: 0.2898, test_loss: 1.4176, test_f1: 0.6523
 epoch: 95, train_loss: 0.3159, test_loss: 1.3481, test_f1: 0.6397
 epoch: 96, train_loss: 0.2932, test_loss: 1.2625, test_f1: 0.6680
 epoch: 97, train_loss: 0.2948, test_loss: 1.1885, test_f1: 0.6517
 epoch: 98, train_loss: 0.3050, test_loss: 1.2592, test_f1: 0.6571
 epoch: 99, train_loss: 0.2898, test_loss: 1.1271, test_f1: 0.6578
##################ITERATION #2 ****************************************
 epoch: 0, train_loss: 1.2865, test_loss: 1.6799, test_f1: 0.2722
 epoch: 1, train_loss: 1.0010, test_loss: 1.2590, test_f1: 0.3084
 epoch: 2, train_loss: 0.9469, test_loss: 1.1548, test_f1: 0.3512
 epoch: 3, train_loss: 0.9264, test_loss: 0.9445, test_f1: 0.4738
 epoch: 4, train_loss: 0.9136, test_loss: 0.9341, test_f1: 0.5209
 epoch: 5, train_loss: 0.8900, test_loss: 0.9117, test_f1: 0.5509
 epoch: 6, train_loss: 0.8780, test_loss: 0.9016, test_f1: 0.5611
 epoch: 7, train_loss: 0.8540, test_loss: 0.9123, test_f1: 0.5655
 epoch: 8, train_loss: 0.8395, test_loss: 0.8644, test_f1: 0.5488
 epoch: 9, train_loss: 0.8131, test_loss: 1.2879, test_f1: 0.4303
 epoch: 10, train_loss: 0.8251, test_loss: 1.0052, test_f1: 0.5221
 epoch: 11, train_loss: 0.8082, test_loss: 0.9271, test_f1: 0.6127
 epoch: 12, train_loss: 0.7974, test_loss: 0.8501, test_f1: 0.5755
 epoch: 13, train_loss: 0.7617, test_loss: 0.9539, test_f1: 0.5209
 epoch: 14, train_loss: 0.7389, test_loss: 0.9410, test_f1: 0.5881
 epoch: 15, train_loss: 0.7649, test_loss: 0.8859, test_f1: 0.5875
 epoch: 16, train_loss: 0.7278, test_loss: 0.8211, test_f1: 0.6516
 epoch: 17, train_loss: 0.7220, test_loss: 0.8364, test_f1: 0.6191
 epoch: 18, train_loss: 0.7053, test_loss: 0.9407, test_f1: 0.5500
 epoch: 19, train_loss: 0.6846, test_loss: 0.9801, test_f1: 0.5500
 epoch: 20, train_loss: 0.6896, test_loss: 0.8069, test_f1: 0.6106
 epoch: 21, train_loss: 0.6706, test_loss: 0.9437, test_f1: 0.5987
 epoch: 22, train_loss: 0.6912, test_loss: 0.9611, test_f1: 0.5327
 epoch: 23, train_loss: 0.6695, test_loss: 0.8357, test_f1: 0.5959
 epoch: 24, train_loss: 0.6449, test_loss: 1.0605, test_f1: 0.6049
 epoch: 25, train_loss: 0.6370, test_loss: 0.9629, test_f1: 0.6113
 epoch: 26, train_loss: 0.6397, test_loss: 0.9925, test_f1: 0.5692
 epoch: 27, train_loss: 0.6405, test_loss: 1.0479, test_f1: 0.5677
 epoch: 28, train_loss: 0.6327, test_loss: 1.0733, test_f1: 0.5847
 epoch: 29, train_loss: 0.6285, test_loss: 0.9458, test_f1: 0.6018
 epoch: 30, train_loss: 0.6120, test_loss: 0.8992, test_f1: 0.6481
 epoch: 31, train_loss: 0.6137, test_loss: 0.9640, test_f1: 0.5671
 epoch: 32, train_loss: 0.6072, test_loss: 0.9116, test_f1: 0.5968
 epoch: 33, train_loss: 0.6028, test_loss: 1.3459, test_f1: 0.5103
 epoch: 34, train_loss: 0.5978, test_loss: 0.9211, test_f1: 0.6379
 epoch: 35, train_loss: 0.5942, test_loss: 0.9144, test_f1: 0.6228
 epoch: 36, train_loss: 0.5620, test_loss: 1.0052, test_f1: 0.6081
 epoch: 37, train_loss: 0.5682, test_loss: 1.4143, test_f1: 0.4957
 epoch: 38, train_loss: 0.5468, test_loss: 1.1754, test_f1: 0.5840
 epoch: 39, train_loss: 0.5564, test_loss: 0.9622, test_f1: 0.6213
 epoch: 40, train_loss: 0.5248, test_loss: 0.9186, test_f1: 0.6509
 epoch: 41, train_loss: 0.5253, test_loss: 1.1078, test_f1: 0.5829
 epoch: 42, train_loss: 0.5363, test_loss: 0.9434, test_f1: 0.6492
 epoch: 43, train_loss: 0.5365, test_loss: 0.8989, test_f1: 0.6301
 epoch: 44, train_loss: 0.5497, test_loss: 1.1382, test_f1: 0.5909
 epoch: 45, train_loss: 0.5374, test_loss: 0.9342, test_f1: 0.5973
 epoch: 46, train_loss: 0.5102, test_loss: 1.1389, test_f1: 0.5853
 epoch: 47, train_loss: 0.5092, test_loss: 1.1023, test_f1: 0.6611
 epoch: 48, train_loss: 0.4978, test_loss: 0.9766, test_f1: 0.6358
 epoch: 49, train_loss: 0.4744, test_loss: 1.0750, test_f1: 0.6319
 epoch: 50, train_loss: 0.5016, test_loss: 1.0589, test_f1: 0.6346
 epoch: 51, train_loss: 0.4619, test_loss: 1.0826, test_f1: 0.6318
 epoch: 52, train_loss: 0.4412, test_loss: 0.9155, test_f1: 0.6357
 epoch: 53, train_loss: 0.4210, test_loss: 1.0542, test_f1: 0.6342
 epoch: 54, train_loss: 0.4235, test_loss: 1.0209, test_f1: 0.6450
 epoch: 55, train_loss: 0.4279, test_loss: 1.2035, test_f1: 0.5937
 epoch: 56, train_loss: 0.4151, test_loss: 1.0955, test_f1: 0.6195
 epoch: 57, train_loss: 0.4281, test_loss: 1.2226, test_f1: 0.6087
 epoch: 58, train_loss: 0.4328, test_loss: 1.3536, test_f1: 0.5687
 epoch: 59, train_loss: 0.3987, test_loss: 1.0896, test_f1: 0.6310
 epoch: 60, train_loss: 0.3987, test_loss: 1.1708, test_f1: 0.6242
 epoch: 61, train_loss: 0.4047, test_loss: 1.1032, test_f1: 0.6527
 epoch: 62, train_loss: 0.3834, test_loss: 1.2554, test_f1: 0.6314
 epoch: 63, train_loss: 0.3874, test_loss: 1.0976, test_f1: 0.6520
 epoch: 64, train_loss: 0.3845, test_loss: 1.1166, test_f1: 0.6699
 epoch: 65, train_loss: 0.3928, test_loss: 1.2047, test_f1: 0.6173
 epoch: 66, train_loss: 0.3851, test_loss: 1.2057, test_f1: 0.6181
 epoch: 67, train_loss: 0.3704, test_loss: 1.2649, test_f1: 0.6190
 epoch: 68, train_loss: 0.3694, test_loss: 1.2284, test_f1: 0.6487
 epoch: 69, train_loss: 0.3692, test_loss: 1.3269, test_f1: 0.6504
 epoch: 70, train_loss: 0.3771, test_loss: 1.1855, test_f1: 0.6189
 epoch: 71, train_loss: 0.3529, test_loss: 1.1745, test_f1: 0.6368
 epoch: 72, train_loss: 0.3636, test_loss: 1.2959, test_f1: 0.6491
 epoch: 73, train_loss: 0.4041, test_loss: 1.3684, test_f1: 0.6224
 epoch: 74, train_loss: 0.3912, test_loss: 1.1907, test_f1: 0.6488
 epoch: 75, train_loss: 0.3487, test_loss: 1.2245, test_f1: 0.6452
 epoch: 76, train_loss: 0.3677, test_loss: 1.2775, test_f1: 0.6540
 epoch: 77, train_loss: 0.3729, test_loss: 1.3056, test_f1: 0.6611
 epoch: 78, train_loss: 0.3776, test_loss: 1.3547, test_f1: 0.6478
 epoch: 79, train_loss: 0.3897, test_loss: 1.3942, test_f1: 0.6103
 epoch: 80, train_loss: 0.3581, test_loss: 1.2971, test_f1: 0.6015
 epoch: 81, train_loss: 0.3551, test_loss: 1.3263, test_f1: 0.6375
 epoch: 82, train_loss: 0.3572, test_loss: 1.3041, test_f1: 0.6283
 epoch: 83, train_loss: 0.3394, test_loss: 1.4245, test_f1: 0.6362
 epoch: 84, train_loss: 0.3359, test_loss: 1.5569, test_f1: 0.6207
 epoch: 85, train_loss: 0.3617, test_loss: 1.4704, test_f1: 0.6326
 epoch: 86, train_loss: 0.3614, test_loss: 1.2563, test_f1: 0.6538
 epoch: 87, train_loss: 0.3538, test_loss: 1.2709, test_f1: 0.6570
 epoch: 88, train_loss: 0.3556, test_loss: 1.2992, test_f1: 0.6523
 epoch: 89, train_loss: 0.3440, test_loss: 1.3298, test_f1: 0.6562
 epoch: 90, train_loss: 0.3404, test_loss: 1.3018, test_f1: 0.6566
 epoch: 91, train_loss: 0.3409, test_loss: 1.5196, test_f1: 0.6277
 epoch: 92, train_loss: 0.3167, test_loss: 1.4419, test_f1: 0.6519
 epoch: 93, train_loss: 0.3188, test_loss: 1.2589, test_f1: 0.6504
 epoch: 94, train_loss: 0.3213, test_loss: 1.3642, test_f1: 0.6441
 epoch: 95, train_loss: 0.3151, test_loss: 1.3368, test_f1: 0.6669
 epoch: 96, train_loss: 0.3076, test_loss: 1.2944, test_f1: 0.6552
 epoch: 97, train_loss: 0.3262, test_loss: 1.3969, test_f1: 0.6484
 epoch: 98, train_loss: 0.3092, test_loss: 1.3343, test_f1: 0.6204
 epoch: 99, train_loss: 0.3044, test_loss: 1.3580, test_f1: 0.6398
##################ITERATION #3 ****************************************
 epoch: 0, train_loss: 1.5692, test_loss: 1.5167, test_f1: 0.2270
 epoch: 1, train_loss: 1.0610, test_loss: 1.2381, test_f1: 0.2800
 epoch: 2, train_loss: 1.0079, test_loss: 1.0754, test_f1: 0.3817
 epoch: 3, train_loss: 0.9684, test_loss: 0.9972, test_f1: 0.4505
 epoch: 4, train_loss: 0.9333, test_loss: 0.9637, test_f1: 0.4762
 epoch: 5, train_loss: 0.9171, test_loss: 0.9235, test_f1: 0.4812
 epoch: 6, train_loss: 0.9051, test_loss: 1.1426, test_f1: 0.4057
 epoch: 7, train_loss: 0.9009, test_loss: 1.1168, test_f1: 0.4539
 epoch: 8, train_loss: 0.8717, test_loss: 1.0304, test_f1: 0.4921
 epoch: 9, train_loss: 0.8489, test_loss: 0.8964, test_f1: 0.5156
 epoch: 10, train_loss: 0.8288, test_loss: 0.8563, test_f1: 0.5773
 epoch: 11, train_loss: 0.8171, test_loss: 0.8822, test_f1: 0.5911
 epoch: 12, train_loss: 0.8030, test_loss: 0.9418, test_f1: 0.5017
 epoch: 13, train_loss: 0.8049, test_loss: 0.8964, test_f1: 0.5517
 epoch: 14, train_loss: 0.7868, test_loss: 0.9204, test_f1: 0.5162
 epoch: 15, train_loss: 0.7865, test_loss: 0.9150, test_f1: 0.5957
 epoch: 16, train_loss: 0.7692, test_loss: 0.9609, test_f1: 0.5214
 epoch: 17, train_loss: 0.7462, test_loss: 0.9790, test_f1: 0.5170
 epoch: 18, train_loss: 0.7292, test_loss: 0.8068, test_f1: 0.6349
 epoch: 19, train_loss: 0.6936, test_loss: 0.7798, test_f1: 0.6348
 epoch: 20, train_loss: 0.6990, test_loss: 0.8708, test_f1: 0.5965
 epoch: 21, train_loss: 0.6819, test_loss: 0.8300, test_f1: 0.6295
 epoch: 22, train_loss: 0.6899, test_loss: 0.8815, test_f1: 0.5999
 epoch: 23, train_loss: 0.6655, test_loss: 1.3920, test_f1: 0.4077
 epoch: 24, train_loss: 0.6482, test_loss: 0.9789, test_f1: 0.5772
 epoch: 25, train_loss: 0.6533, test_loss: 0.9222, test_f1: 0.5756
 epoch: 26, train_loss: 0.6408, test_loss: 0.7704, test_f1: 0.6588
 epoch: 27, train_loss: 0.6326, test_loss: 0.8517, test_f1: 0.6244
 epoch: 28, train_loss: 0.6459, test_loss: 0.8285, test_f1: 0.6292
 epoch: 29, train_loss: 0.6207, test_loss: 0.9755, test_f1: 0.5621
 epoch: 30, train_loss: 0.6233, test_loss: 0.8266, test_f1: 0.6351
 epoch: 31, train_loss: 0.6081, test_loss: 0.8384, test_f1: 0.6586
 epoch: 32, train_loss: 0.6201, test_loss: 0.8409, test_f1: 0.6472
 epoch: 33, train_loss: 0.6262, test_loss: 0.8415, test_f1: 0.6483
 epoch: 34, train_loss: 0.5962, test_loss: 0.8272, test_f1: 0.6621
 epoch: 35, train_loss: 0.5819, test_loss: 0.9035, test_f1: 0.6531
 epoch: 36, train_loss: 0.5949, test_loss: 0.9475, test_f1: 0.6116
 epoch: 37, train_loss: 0.5796, test_loss: 0.8811, test_f1: 0.6481
 epoch: 38, train_loss: 0.5750, test_loss: 0.8577, test_f1: 0.6546
 epoch: 39, train_loss: 0.5529, test_loss: 1.0312, test_f1: 0.5799
 epoch: 40, train_loss: 0.5324, test_loss: 0.9489, test_f1: 0.6231
 epoch: 41, train_loss: 0.5548, test_loss: 0.8169, test_f1: 0.6681
 epoch: 42, train_loss: 0.5500, test_loss: 0.9415, test_f1: 0.6063
 epoch: 43, train_loss: 0.5608, test_loss: 0.9242, test_f1: 0.6055
 epoch: 44, train_loss: 0.5553, test_loss: 0.9900, test_f1: 0.6056
 epoch: 45, train_loss: 0.5493, test_loss: 0.8649, test_f1: 0.6607
 epoch: 46, train_loss: 0.5441, test_loss: 0.8684, test_f1: 0.7120
 epoch: 47, train_loss: 0.5313, test_loss: 1.0666, test_f1: 0.5915
 epoch: 48, train_loss: 0.5204, test_loss: 0.9266, test_f1: 0.6280
 epoch: 49, train_loss: 0.5406, test_loss: 0.8058, test_f1: 0.6731
 epoch: 50, train_loss: 0.5376, test_loss: 0.9221, test_f1: 0.6322
 epoch: 51, train_loss: 0.4852, test_loss: 0.8358, test_f1: 0.6743
 epoch: 52, train_loss: 0.4525, test_loss: 0.7890, test_f1: 0.6738
 epoch: 53, train_loss: 0.4517, test_loss: 0.7962, test_f1: 0.6804
 epoch: 54, train_loss: 0.4310, test_loss: 0.8501, test_f1: 0.6806
 epoch: 55, train_loss: 0.4254, test_loss: 0.8692, test_f1: 0.6565
 epoch: 56, train_loss: 0.4222, test_loss: 0.8729, test_f1: 0.7117
 epoch: 57, train_loss: 0.4264, test_loss: 0.8681, test_f1: 0.6809
 epoch: 58, train_loss: 0.4282, test_loss: 0.8942, test_f1: 0.6788
 epoch: 59, train_loss: 0.4259, test_loss: 1.0121, test_f1: 0.6559
 epoch: 60, train_loss: 0.4345, test_loss: 0.8682, test_f1: 0.6932
 epoch: 61, train_loss: 0.4531, test_loss: 0.8973, test_f1: 0.6879
 epoch: 62, train_loss: 0.4277, test_loss: 0.9054, test_f1: 0.6679
 epoch: 63, train_loss: 0.4085, test_loss: 0.9272, test_f1: 0.6818
 epoch: 64, train_loss: 0.4081, test_loss: 0.9551, test_f1: 0.6722
 epoch: 65, train_loss: 0.4120, test_loss: 0.9831, test_f1: 0.6575
 epoch: 66, train_loss: 0.4108, test_loss: 0.9625, test_f1: 0.6580
 epoch: 67, train_loss: 0.3787, test_loss: 1.0315, test_f1: 0.6733
 epoch: 68, train_loss: 0.3960, test_loss: 1.0025, test_f1: 0.6677
 epoch: 69, train_loss: 0.3838, test_loss: 1.0123, test_f1: 0.6545
 epoch: 70, train_loss: 0.3806, test_loss: 1.0143, test_f1: 0.6736
 epoch: 71, train_loss: 0.3765, test_loss: 1.0434, test_f1: 0.6721
 epoch: 72, train_loss: 0.3941, test_loss: 1.1316, test_f1: 0.6300
 epoch: 73, train_loss: 0.3809, test_loss: 0.9336, test_f1: 0.6903
 epoch: 74, train_loss: 0.3873, test_loss: 1.0999, test_f1: 0.6492
 epoch: 75, train_loss: 0.3998, test_loss: 1.0745, test_f1: 0.6285
 epoch: 76, train_loss: 0.3912, test_loss: 1.0668, test_f1: 0.6604
 epoch: 77, train_loss: 0.3844, test_loss: 1.0103, test_f1: 0.6918
 epoch: 78, train_loss: 0.3766, test_loss: 1.0104, test_f1: 0.6583
 epoch: 79, train_loss: 0.3493, test_loss: 1.0732, test_f1: 0.6403
 epoch: 80, train_loss: 0.3698, test_loss: 1.1073, test_f1: 0.6632
 epoch: 81, train_loss: 0.3654, test_loss: 1.0329, test_f1: 0.6767
 epoch: 82, train_loss: 0.3554, test_loss: 1.1153, test_f1: 0.6764
 epoch: 83, train_loss: 0.3773, test_loss: 1.0883, test_f1: 0.6928
 epoch: 84, train_loss: 0.3612, test_loss: 1.1983, test_f1: 0.6540
 epoch: 85, train_loss: 0.3455, test_loss: 1.0701, test_f1: 0.6514
 epoch: 86, train_loss: 0.3631, test_loss: 1.0409, test_f1: 0.6714
 epoch: 87, train_loss: 0.3770, test_loss: 1.1015, test_f1: 0.6705
 epoch: 88, train_loss: 0.3366, test_loss: 0.9888, test_f1: 0.6814
 epoch: 89, train_loss: 0.3528, test_loss: 1.1457, test_f1: 0.6383
 epoch: 90, train_loss: 0.3687, test_loss: 1.1682, test_f1: 0.6666
 epoch: 91, train_loss: 0.3365, test_loss: 1.0676, test_f1: 0.6892
 epoch: 92, train_loss: 0.3533, test_loss: 1.0587, test_f1: 0.7018
 epoch: 93, train_loss: 0.3373, test_loss: 1.1155, test_f1: 0.6443
 epoch: 94, train_loss: 0.3390, test_loss: 1.1124, test_f1: 0.6777
 epoch: 95, train_loss: 0.3382, test_loss: 1.3669, test_f1: 0.6382
 epoch: 96, train_loss: 0.3428, test_loss: 1.1658, test_f1: 0.6537
 epoch: 97, train_loss: 0.3300, test_loss: 1.2012, test_f1: 0.6668
 epoch: 98, train_loss: 0.3305, test_loss: 1.3229, test_f1: 0.6828
 epoch: 99, train_loss: 0.3554, test_loss: 1.2726, test_f1: 0.6428
##################ITERATION #4 ****************************************
 epoch: 0, train_loss: 1.7283, test_loss: 1.3603, test_f1: 0.2270
 epoch: 1, train_loss: 1.0506, test_loss: 1.1875, test_f1: 0.2699
 epoch: 2, train_loss: 1.0123, test_loss: 1.0426, test_f1: 0.4306
 epoch: 3, train_loss: 0.9767, test_loss: 0.9958, test_f1: 0.5150
 epoch: 4, train_loss: 0.9426, test_loss: 0.9900, test_f1: 0.4674
 epoch: 5, train_loss: 0.9171, test_loss: 1.0919, test_f1: 0.4949
 epoch: 6, train_loss: 0.9015, test_loss: 0.9845, test_f1: 0.4718
 epoch: 7, train_loss: 0.8842, test_loss: 0.9803, test_f1: 0.5253
 epoch: 8, train_loss: 0.8806, test_loss: 0.8830, test_f1: 0.5316
 epoch: 9, train_loss: 0.8600, test_loss: 0.9542, test_f1: 0.5440
 epoch: 10, train_loss: 0.8451, test_loss: 0.9633, test_f1: 0.5712
 epoch: 11, train_loss: 0.8370, test_loss: 1.0299, test_f1: 0.5107
 epoch: 12, train_loss: 0.8044, test_loss: 0.9781, test_f1: 0.5000
 epoch: 13, train_loss: 0.8044, test_loss: 0.8931, test_f1: 0.4683
 epoch: 14, train_loss: 0.7958, test_loss: 0.9320, test_f1: 0.4970
 epoch: 15, train_loss: 0.7768, test_loss: 0.8761, test_f1: 0.5630
 epoch: 16, train_loss: 0.7615, test_loss: 1.0236, test_f1: 0.5557
 epoch: 17, train_loss: 0.7384, test_loss: 0.9413, test_f1: 0.5658
 epoch: 18, train_loss: 0.7462, test_loss: 0.8764, test_f1: 0.5917
 epoch: 19, train_loss: 0.7331, test_loss: 0.9005, test_f1: 0.5679
 epoch: 20, train_loss: 0.7113, test_loss: 0.8325, test_f1: 0.5866
 epoch: 21, train_loss: 0.7142, test_loss: 0.8431, test_f1: 0.5910
 epoch: 22, train_loss: 0.7023, test_loss: 0.8240, test_f1: 0.6184
 epoch: 23, train_loss: 0.6809, test_loss: 0.9011, test_f1: 0.6150
 epoch: 24, train_loss: 0.6756, test_loss: 0.8338, test_f1: 0.6192
 epoch: 25, train_loss: 0.6741, test_loss: 1.0431, test_f1: 0.5698
 epoch: 26, train_loss: 0.6613, test_loss: 1.0010, test_f1: 0.5902
 epoch: 27, train_loss: 0.6612, test_loss: 0.9443, test_f1: 0.6248
 epoch: 28, train_loss: 0.6433, test_loss: 0.8268, test_f1: 0.6272
 epoch: 29, train_loss: 0.6402, test_loss: 0.8524, test_f1: 0.6400
 epoch: 30, train_loss: 0.6289, test_loss: 1.1982, test_f1: 0.5569
 epoch: 31, train_loss: 0.6444, test_loss: 0.8903, test_f1: 0.6028
 epoch: 32, train_loss: 0.6217, test_loss: 0.9330, test_f1: 0.6194
 epoch: 33, train_loss: 0.6623, test_loss: 0.9442, test_f1: 0.6116
 epoch: 34, train_loss: 0.6317, test_loss: 0.8095, test_f1: 0.6633
 epoch: 35, train_loss: 0.6011, test_loss: 0.8362, test_f1: 0.6379
 epoch: 36, train_loss: 0.5878, test_loss: 1.0151, test_f1: 0.5437
 epoch: 37, train_loss: 0.5932, test_loss: 0.9509, test_f1: 0.5698
 epoch: 38, train_loss: 0.5981, test_loss: 1.2040, test_f1: 0.5037
 epoch: 39, train_loss: 0.5893, test_loss: 1.0626, test_f1: 0.5812
 epoch: 40, train_loss: 0.6168, test_loss: 0.8948, test_f1: 0.6371
 epoch: 41, train_loss: 0.6206, test_loss: 0.8861, test_f1: 0.6202
 epoch: 42, train_loss: 0.5875, test_loss: 0.9052, test_f1: 0.6480
 epoch: 43, train_loss: 0.5996, test_loss: 0.9190, test_f1: 0.6247
 epoch: 44, train_loss: 0.5986, test_loss: 0.8872, test_f1: 0.6515
 epoch: 45, train_loss: 0.5736, test_loss: 0.8843, test_f1: 0.6372
 epoch: 46, train_loss: 0.5712, test_loss: 0.9641, test_f1: 0.6404
 epoch: 47, train_loss: 0.5721, test_loss: 0.9110, test_f1: 0.6720
 epoch: 48, train_loss: 0.5446, test_loss: 0.9385, test_f1: 0.6089
 epoch: 49, train_loss: 0.5568, test_loss: 0.9446, test_f1: 0.6479
 epoch: 50, train_loss: 0.5601, test_loss: 1.0053, test_f1: 0.5840
 epoch: 51, train_loss: 0.5216, test_loss: 0.9342, test_f1: 0.6595
 epoch: 52, train_loss: 0.4893, test_loss: 0.8467, test_f1: 0.6601
 epoch: 53, train_loss: 0.4769, test_loss: 0.8340, test_f1: 0.6657
 epoch: 54, train_loss: 0.4784, test_loss: 0.8784, test_f1: 0.6589
 epoch: 55, train_loss: 0.4609, test_loss: 0.9445, test_f1: 0.6724
 epoch: 56, train_loss: 0.4476, test_loss: 0.8906, test_f1: 0.6778
 epoch: 57, train_loss: 0.4322, test_loss: 0.9208, test_f1: 0.6824
 epoch: 58, train_loss: 0.4472, test_loss: 0.9239, test_f1: 0.6972
 epoch: 59, train_loss: 0.4387, test_loss: 0.8874, test_f1: 0.6794
 epoch: 60, train_loss: 0.4305, test_loss: 0.8938, test_f1: 0.7042
 epoch: 61, train_loss: 0.4331, test_loss: 0.9545, test_f1: 0.6850
 epoch: 62, train_loss: 0.4475, test_loss: 0.9192, test_f1: 0.6752
 epoch: 63, train_loss: 0.4168, test_loss: 0.9262, test_f1: 0.6729
 epoch: 64, train_loss: 0.4316, test_loss: 0.9505, test_f1: 0.6788
 epoch: 65, train_loss: 0.4352, test_loss: 1.0298, test_f1: 0.6136
 epoch: 66, train_loss: 0.4312, test_loss: 0.9803, test_f1: 0.6733
 epoch: 67, train_loss: 0.4325, test_loss: 0.9999, test_f1: 0.6848
 epoch: 68, train_loss: 0.4122, test_loss: 0.9975, test_f1: 0.6751
 epoch: 69, train_loss: 0.3933, test_loss: 0.9842, test_f1: 0.6936
 epoch: 70, train_loss: 0.4412, test_loss: 0.9542, test_f1: 0.6644
 epoch: 71, train_loss: 0.4256, test_loss: 0.9252, test_f1: 0.6667
 epoch: 72, train_loss: 0.4052, test_loss: 1.0603, test_f1: 0.6409
 epoch: 73, train_loss: 0.4047, test_loss: 0.9728, test_f1: 0.6850
 epoch: 74, train_loss: 0.3951, test_loss: 0.9737, test_f1: 0.6786
 epoch: 75, train_loss: 0.4015, test_loss: 0.9631, test_f1: 0.6745
 epoch: 76, train_loss: 0.3997, test_loss: 1.0403, test_f1: 0.6542
 epoch: 77, train_loss: 0.3854, test_loss: 0.9883, test_f1: 0.6776
 epoch: 78, train_loss: 0.3921, test_loss: 1.0259, test_f1: 0.6605
 epoch: 79, train_loss: 0.3724, test_loss: 1.0558, test_f1: 0.6667
 epoch: 80, train_loss: 0.3558, test_loss: 0.9850, test_f1: 0.6812
 epoch: 81, train_loss: 0.3619, test_loss: 1.0735, test_f1: 0.6898
 epoch: 82, train_loss: 0.3785, test_loss: 1.0393, test_f1: 0.6759
 epoch: 83, train_loss: 0.3810, test_loss: 1.0508, test_f1: 0.6721
 epoch: 84, train_loss: 0.3531, test_loss: 1.0049, test_f1: 0.6688
 epoch: 85, train_loss: 0.3725, test_loss: 1.0119, test_f1: 0.6799
 epoch: 86, train_loss: 0.3909, test_loss: 1.0677, test_f1: 0.6587
 epoch: 87, train_loss: 0.3820, test_loss: 0.9757, test_f1: 0.7072
 epoch: 88, train_loss: 0.3769, test_loss: 1.0485, test_f1: 0.6730
 epoch: 89, train_loss: 0.3694, test_loss: 1.1674, test_f1: 0.6266
 epoch: 90, train_loss: 0.3930, test_loss: 1.4538, test_f1: 0.5811
 epoch: 91, train_loss: 0.4003, test_loss: 1.0452, test_f1: 0.6599
 epoch: 92, train_loss: 0.3948, test_loss: 0.9991, test_f1: 0.6729
 epoch: 93, train_loss: 0.3757, test_loss: 0.9989, test_f1: 0.6652
 epoch: 94, train_loss: 0.3547, test_loss: 1.0690, test_f1: 0.6580
 epoch: 95, train_loss: 0.3640, test_loss: 1.0417, test_f1: 0.6653
 epoch: 96, train_loss: 0.3478, test_loss: 1.1047, test_f1: 0.6928
 epoch: 97, train_loss: 0.3634, test_loss: 1.1380, test_f1: 0.6422
 epoch: 98, train_loss: 0.3341, test_loss: 1.1761, test_f1: 0.6478
 epoch: 99, train_loss: 0.3582, test_loss: 1.0996, test_f1: 0.6691
##################ITERATION #5 ****************************************
 epoch: 0, train_loss: 1.4980, test_loss: 1.4101, test_f1: 0.2882
 epoch: 1, train_loss: 1.0181, test_loss: 1.1598, test_f1: 0.2873
 epoch: 2, train_loss: 0.9815, test_loss: 1.0485, test_f1: 0.4163
 epoch: 3, train_loss: 0.9423, test_loss: 0.9756, test_f1: 0.5118
 epoch: 4, train_loss: 0.9205, test_loss: 0.9328, test_f1: 0.5078
 epoch: 5, train_loss: 0.8950, test_loss: 0.9448, test_f1: 0.5206
 epoch: 6, train_loss: 0.8768, test_loss: 0.8806, test_f1: 0.5712
 epoch: 7, train_loss: 0.8544, test_loss: 0.8777, test_f1: 0.5466
 epoch: 8, train_loss: 0.8455, test_loss: 0.9073, test_f1: 0.5619
 epoch: 9, train_loss: 0.8492, test_loss: 0.9667, test_f1: 0.5100
 epoch: 10, train_loss: 0.8093, test_loss: 1.4899, test_f1: 0.3525
 epoch: 11, train_loss: 0.7809, test_loss: 0.9170, test_f1: 0.5607
 epoch: 12, train_loss: 0.7715, test_loss: 0.8329, test_f1: 0.5712
 epoch: 13, train_loss: 0.7559, test_loss: 0.8801, test_f1: 0.5853
 epoch: 14, train_loss: 0.7528, test_loss: 0.8732, test_f1: 0.5981
 epoch: 15, train_loss: 0.7466, test_loss: 0.9948, test_f1: 0.5721
 epoch: 16, train_loss: 0.7392, test_loss: 0.8350, test_f1: 0.6083
 epoch: 17, train_loss: 0.7144, test_loss: 0.9557, test_f1: 0.5694
 epoch: 18, train_loss: 0.7321, test_loss: 1.3050, test_f1: 0.4603
 epoch: 19, train_loss: 0.7319, test_loss: 1.1451, test_f1: 0.5506
 epoch: 20, train_loss: 0.7124, test_loss: 1.1205, test_f1: 0.5605
 epoch: 21, train_loss: 0.7010, test_loss: 1.0449, test_f1: 0.5773
 epoch: 22, train_loss: 0.6987, test_loss: 0.8966, test_f1: 0.6084
 epoch: 23, train_loss: 0.6945, test_loss: 1.0569, test_f1: 0.6033
 epoch: 24, train_loss: 0.6796, test_loss: 0.9598, test_f1: 0.5856
 epoch: 25, train_loss: 0.6800, test_loss: 0.8777, test_f1: 0.6157
 epoch: 26, train_loss: 0.6783, test_loss: 0.9820, test_f1: 0.5638
 epoch: 27, train_loss: 0.6675, test_loss: 1.0184, test_f1: 0.5605
 epoch: 28, train_loss: 0.6639, test_loss: 0.9900, test_f1: 0.5565
 epoch: 29, train_loss: 0.6373, test_loss: 0.9385, test_f1: 0.6189
 epoch: 30, train_loss: 0.6140, test_loss: 1.0691, test_f1: 0.5599
 epoch: 31, train_loss: 0.6235, test_loss: 1.0361, test_f1: 0.6266
 epoch: 32, train_loss: 0.6296, test_loss: 0.9472, test_f1: 0.6069
 epoch: 33, train_loss: 0.6337, test_loss: 0.9408, test_f1: 0.6040
 epoch: 34, train_loss: 0.6256, test_loss: 1.1591, test_f1: 0.5921
 epoch: 35, train_loss: 0.6247, test_loss: 0.9226, test_f1: 0.6343
 epoch: 36, train_loss: 0.6092, test_loss: 1.0733, test_f1: 0.5868
 epoch: 37, train_loss: 0.5968, test_loss: 0.9837, test_f1: 0.6033
 epoch: 38, train_loss: 0.6080, test_loss: 0.9427, test_f1: 0.6262
 epoch: 39, train_loss: 0.5959, test_loss: 0.9059, test_f1: 0.6465
 epoch: 40, train_loss: 0.5737, test_loss: 1.3704, test_f1: 0.5267
 epoch: 41, train_loss: 0.5732, test_loss: 1.3150, test_f1: 0.5944
 epoch: 42, train_loss: 0.5788, test_loss: 0.9382, test_f1: 0.6480
 epoch: 43, train_loss: 0.5908, test_loss: 0.9618, test_f1: 0.6469
 epoch: 44, train_loss: 0.5682, test_loss: 1.0343, test_f1: 0.5940
 epoch: 45, train_loss: 0.5580, test_loss: 0.9986, test_f1: 0.6171
 epoch: 46, train_loss: 0.5472, test_loss: 1.1711, test_f1: 0.6035
 epoch: 47, train_loss: 0.5617, test_loss: 0.9990, test_f1: 0.6427
 epoch: 48, train_loss: 0.5555, test_loss: 1.5588, test_f1: 0.5603
 epoch: 49, train_loss: 0.5713, test_loss: 0.9669, test_f1: 0.6186
 epoch: 50, train_loss: 0.5296, test_loss: 0.9524, test_f1: 0.6063
 epoch: 51, train_loss: 0.5101, test_loss: 0.9694, test_f1: 0.6628
 epoch: 52, train_loss: 0.4829, test_loss: 0.9450, test_f1: 0.6636
 epoch: 53, train_loss: 0.4750, test_loss: 0.9455, test_f1: 0.6818
 epoch: 54, train_loss: 0.4637, test_loss: 1.0181, test_f1: 0.6559
 epoch: 55, train_loss: 0.4537, test_loss: 0.9723, test_f1: 0.6678
 epoch: 56, train_loss: 0.4619, test_loss: 0.9398, test_f1: 0.6915
 epoch: 57, train_loss: 0.4592, test_loss: 0.9826, test_f1: 0.6721
 epoch: 58, train_loss: 0.4283, test_loss: 1.0124, test_f1: 0.6749
 epoch: 59, train_loss: 0.4439, test_loss: 1.0044, test_f1: 0.6693
 epoch: 60, train_loss: 0.4392, test_loss: 1.0534, test_f1: 0.6634
 epoch: 61, train_loss: 0.4327, test_loss: 1.0243, test_f1: 0.6625
 epoch: 62, train_loss: 0.4221, test_loss: 1.0280, test_f1: 0.6807
 epoch: 63, train_loss: 0.4164, test_loss: 1.2032, test_f1: 0.6543
 epoch: 64, train_loss: 0.4525, test_loss: 1.0681, test_f1: 0.6792
 epoch: 65, train_loss: 0.4438, test_loss: 1.1736, test_f1: 0.6537
 epoch: 66, train_loss: 0.4323, test_loss: 1.0281, test_f1: 0.6619
 epoch: 67, train_loss: 0.4235, test_loss: 1.1443, test_f1: 0.7016
 epoch: 68, train_loss: 0.4204, test_loss: 1.3668, test_f1: 0.6508
 epoch: 69, train_loss: 0.4205, test_loss: 1.1328, test_f1: 0.6720
 epoch: 70, train_loss: 0.4092, test_loss: 1.2400, test_f1: 0.6419
 epoch: 71, train_loss: 0.4106, test_loss: 1.0943, test_f1: 0.6704
 epoch: 72, train_loss: 0.3996, test_loss: 1.0583, test_f1: 0.6414
 epoch: 73, train_loss: 0.4132, test_loss: 1.1056, test_f1: 0.6761
 epoch: 74, train_loss: 0.4060, test_loss: 1.1722, test_f1: 0.6770
 epoch: 75, train_loss: 0.3800, test_loss: 1.0868, test_f1: 0.6487
 epoch: 76, train_loss: 0.3854, test_loss: 1.0034, test_f1: 0.6621
 epoch: 77, train_loss: 0.4058, test_loss: 1.2233, test_f1: 0.6510
 epoch: 78, train_loss: 0.3758, test_loss: 1.1105, test_f1: 0.7000
 epoch: 79, train_loss: 0.3806, test_loss: 1.2004, test_f1: 0.6714
 epoch: 80, train_loss: 0.4167, test_loss: 1.2258, test_f1: 0.6738
 epoch: 81, train_loss: 0.4096, test_loss: 1.2744, test_f1: 0.6360
 epoch: 82, train_loss: 0.3820, test_loss: 1.2000, test_f1: 0.6613
 epoch: 83, train_loss: 0.3982, test_loss: 1.1570, test_f1: 0.6767
 epoch: 84, train_loss: 0.3789, test_loss: 1.1919, test_f1: 0.6664
 epoch: 85, train_loss: 0.3667, test_loss: 1.2901, test_f1: 0.6797
 epoch: 86, train_loss: 0.3852, test_loss: 1.4468, test_f1: 0.6300
 epoch: 87, train_loss: 0.3943, test_loss: 1.2254, test_f1: 0.6782
 epoch: 88, train_loss: 0.3956, test_loss: 1.2658, test_f1: 0.6739
 epoch: 89, train_loss: 0.3682, test_loss: 1.1928, test_f1: 0.6845
 epoch: 90, train_loss: 0.3873, test_loss: 1.0912, test_f1: 0.6586
 epoch: 91, train_loss: 0.3564, test_loss: 1.6590, test_f1: 0.6018
 epoch: 92, train_loss: 0.3475, test_loss: 1.2496, test_f1: 0.6529
 epoch: 93, train_loss: 0.3626, test_loss: 1.1288, test_f1: 0.6637
 epoch: 94, train_loss: 0.3779, test_loss: 1.2335, test_f1: 0.6827
 epoch: 95, train_loss: 0.3784, test_loss: 1.5519, test_f1: 0.6258
 epoch: 96, train_loss: 0.3613, test_loss: 1.4459, test_f1: 0.6432
 epoch: 97, train_loss: 0.3789, test_loss: 1.0781, test_f1: 0.6541
 epoch: 98, train_loss: 0.3691, test_loss: 1.4194, test_f1: 0.6285
 epoch: 99, train_loss: 0.3446, test_loss: 1.2887, test_f1: 0.6800
##################ITERATION #6 ****************************************
 epoch: 0, train_loss: 1.5542, test_loss: 1.7498, test_f1: 0.2388
 epoch: 1, train_loss: 1.0307, test_loss: 1.2552, test_f1: 0.2717
 epoch: 2, train_loss: 0.9906, test_loss: 1.0396, test_f1: 0.4259
 epoch: 3, train_loss: 0.9603, test_loss: 0.9814, test_f1: 0.4843
 epoch: 4, train_loss: 0.9459, test_loss: 0.9673, test_f1: 0.5107
 epoch: 5, train_loss: 0.9286, test_loss: 0.9612, test_f1: 0.4529
 epoch: 6, train_loss: 0.9225, test_loss: 0.9673, test_f1: 0.4555
 epoch: 7, train_loss: 0.8988, test_loss: 0.9476, test_f1: 0.4883
 epoch: 8, train_loss: 0.8888, test_loss: 0.9951, test_f1: 0.5073
 epoch: 9, train_loss: 0.8756, test_loss: 0.9709, test_f1: 0.5128
 epoch: 10, train_loss: 0.8673, test_loss: 0.9401, test_f1: 0.5582
 epoch: 11, train_loss: 0.8647, test_loss: 0.9975, test_f1: 0.5049
 epoch: 12, train_loss: 0.8524, test_loss: 1.0688, test_f1: 0.4920
 epoch: 13, train_loss: 0.8393, test_loss: 0.9281, test_f1: 0.5195
 epoch: 14, train_loss: 0.8230, test_loss: 1.0127, test_f1: 0.4799
 epoch: 15, train_loss: 0.8266, test_loss: 0.9419, test_f1: 0.5350
 epoch: 16, train_loss: 0.8055, test_loss: 0.9024, test_f1: 0.5430
 epoch: 17, train_loss: 0.7786, test_loss: 0.9829, test_f1: 0.5138
 epoch: 18, train_loss: 0.7717, test_loss: 1.0394, test_f1: 0.5309
 epoch: 19, train_loss: 0.7729, test_loss: 0.9603, test_f1: 0.5421
 epoch: 20, train_loss: 0.7679, test_loss: 0.9903, test_f1: 0.5157
 epoch: 21, train_loss: 0.7614, test_loss: 0.8318, test_f1: 0.5993
 epoch: 22, train_loss: 0.7543, test_loss: 0.9470, test_f1: 0.5904
 epoch: 23, train_loss: 0.7336, test_loss: 1.8247, test_f1: 0.4107
 epoch: 24, train_loss: 0.7063, test_loss: 0.9967, test_f1: 0.5629
 epoch: 25, train_loss: 0.7154, test_loss: 1.0362, test_f1: 0.5697
 epoch: 26, train_loss: 0.7043, test_loss: 0.9629, test_f1: 0.5892
 epoch: 27, train_loss: 0.6828, test_loss: 1.0560, test_f1: 0.6007
 epoch: 28, train_loss: 0.6640, test_loss: 1.0720, test_f1: 0.5739
 epoch: 29, train_loss: 0.6471, test_loss: 0.9988, test_f1: 0.5966
 epoch: 30, train_loss: 0.6598, test_loss: 0.9734, test_f1: 0.5980
 epoch: 31, train_loss: 0.6665, test_loss: 1.1506, test_f1: 0.5564
 epoch: 32, train_loss: 0.6567, test_loss: 0.9653, test_f1: 0.5779
 epoch: 33, train_loss: 0.6540, test_loss: 1.0622, test_f1: 0.5889
 epoch: 34, train_loss: 0.6445, test_loss: 1.2548, test_f1: 0.5226
 epoch: 35, train_loss: 0.6469, test_loss: 0.9105, test_f1: 0.6376
 epoch: 36, train_loss: 0.6232, test_loss: 0.9779, test_f1: 0.5980
 epoch: 37, train_loss: 0.6369, test_loss: 1.1039, test_f1: 0.6013
 epoch: 38, train_loss: 0.6189, test_loss: 0.9521, test_f1: 0.6398
 epoch: 39, train_loss: 0.5919, test_loss: 1.1548, test_f1: 0.5422
 epoch: 40, train_loss: 0.6107, test_loss: 1.0507, test_f1: 0.6205
 epoch: 41, train_loss: 0.6001, test_loss: 1.1430, test_f1: 0.5914
 epoch: 42, train_loss: 0.5949, test_loss: 0.9965, test_f1: 0.6437
 epoch: 43, train_loss: 0.5931, test_loss: 0.9982, test_f1: 0.6402
 epoch: 44, train_loss: 0.5955, test_loss: 1.0334, test_f1: 0.6313
 epoch: 45, train_loss: 0.5636, test_loss: 1.1344, test_f1: 0.6331
 epoch: 46, train_loss: 0.5543, test_loss: 1.0823, test_f1: 0.5958
 epoch: 47, train_loss: 0.5548, test_loss: 1.0721, test_f1: 0.6208
 epoch: 48, train_loss: 0.5626, test_loss: 1.0487, test_f1: 0.6473
 epoch: 49, train_loss: 0.5766, test_loss: 1.2516, test_f1: 0.6306
 epoch: 50, train_loss: 0.5715, test_loss: 1.6005, test_f1: 0.5981
 epoch: 51, train_loss: 0.5574, test_loss: 1.1331, test_f1: 0.6697
 epoch: 52, train_loss: 0.5053, test_loss: 1.0308, test_f1: 0.6762
 epoch: 53, train_loss: 0.4853, test_loss: 1.0558, test_f1: 0.6542
 epoch: 54, train_loss: 0.4942, test_loss: 1.1718, test_f1: 0.6692
 epoch: 55, train_loss: 0.4857, test_loss: 1.1137, test_f1: 0.6783
 epoch: 56, train_loss: 0.4665, test_loss: 1.0549, test_f1: 0.6807
 epoch: 57, train_loss: 0.4637, test_loss: 1.1191, test_f1: 0.6654
 epoch: 58, train_loss: 0.4660, test_loss: 1.2835, test_f1: 0.6261
 epoch: 59, train_loss: 0.4610, test_loss: 1.1659, test_f1: 0.6532
 epoch: 60, train_loss: 0.4682, test_loss: 1.1483, test_f1: 0.6382
 epoch: 61, train_loss: 0.4512, test_loss: 1.1707, test_f1: 0.6552
 epoch: 62, train_loss: 0.4542, test_loss: 1.1319, test_f1: 0.6675
 epoch: 63, train_loss: 0.4366, test_loss: 1.3116, test_f1: 0.6342
 epoch: 64, train_loss: 0.4328, test_loss: 1.1579, test_f1: 0.6625
 epoch: 65, train_loss: 0.4385, test_loss: 1.1937, test_f1: 0.6576
 epoch: 66, train_loss: 0.4296, test_loss: 1.1296, test_f1: 0.6563
 epoch: 67, train_loss: 0.4405, test_loss: 1.1716, test_f1: 0.6774
 epoch: 68, train_loss: 0.4289, test_loss: 1.1624, test_f1: 0.6712
 epoch: 69, train_loss: 0.4406, test_loss: 1.1748, test_f1: 0.6703
 epoch: 70, train_loss: 0.4291, test_loss: 1.4646, test_f1: 0.6038
 epoch: 71, train_loss: 0.4037, test_loss: 1.2833, test_f1: 0.6387
 epoch: 72, train_loss: 0.4114, test_loss: 1.3880, test_f1: 0.6454
 epoch: 73, train_loss: 0.4325, test_loss: 1.1956, test_f1: 0.6536
 epoch: 74, train_loss: 0.4123, test_loss: 1.3028, test_f1: 0.6612
 epoch: 75, train_loss: 0.4163, test_loss: 1.2072, test_f1: 0.7101
 epoch: 76, train_loss: 0.3985, test_loss: 1.3355, test_f1: 0.6499
 epoch: 77, train_loss: 0.4126, test_loss: 1.3000, test_f1: 0.6762
 epoch: 78, train_loss: 0.4088, test_loss: 1.3755, test_f1: 0.6676
 epoch: 79, train_loss: 0.3996, test_loss: 1.1970, test_f1: 0.6816
 epoch: 80, train_loss: 0.3875, test_loss: 1.3276, test_f1: 0.6590
 epoch: 81, train_loss: 0.3888, test_loss: 1.3854, test_f1: 0.6658
 epoch: 82, train_loss: 0.3803, test_loss: 1.3695, test_f1: 0.6058
 epoch: 83, train_loss: 0.3891, test_loss: 1.2254, test_f1: 0.6752
 epoch: 84, train_loss: 0.3852, test_loss: 1.4354, test_f1: 0.6492
 epoch: 85, train_loss: 0.3920, test_loss: 1.3089, test_f1: 0.6490
 epoch: 86, train_loss: 0.3919, test_loss: 1.4244, test_f1: 0.6096
 epoch: 87, train_loss: 0.3807, test_loss: 1.2882, test_f1: 0.6681
 epoch: 88, train_loss: 0.3896, test_loss: 1.3084, test_f1: 0.6688
 epoch: 89, train_loss: 0.3777, test_loss: 1.5081, test_f1: 0.6618
 epoch: 90, train_loss: 0.3654, test_loss: 1.5521, test_f1: 0.6438
 epoch: 91, train_loss: 0.3677, test_loss: 1.4490, test_f1: 0.6497
 epoch: 92, train_loss: 0.3583, test_loss: 1.3447, test_f1: 0.6700
 epoch: 93, train_loss: 0.3700, test_loss: 1.3542, test_f1: 0.6380
 epoch: 94, train_loss: 0.3483, test_loss: 1.5554, test_f1: 0.6518
 epoch: 95, train_loss: 0.3598, test_loss: 1.5266, test_f1: 0.6205
 epoch: 96, train_loss: 0.3530, test_loss: 1.3976, test_f1: 0.6486
 epoch: 97, train_loss: 0.3871, test_loss: 1.4832, test_f1: 0.6573
 epoch: 98, train_loss: 0.3598, test_loss: 1.4738, test_f1: 0.6835
 epoch: 99, train_loss: 0.3598, test_loss: 1.5257, test_f1: 0.6573
##################ITERATION #7 ****************************************
 epoch: 0, train_loss: 1.5366, test_loss: 1.2753, test_f1: 0.2287
 epoch: 1, train_loss: 1.0494, test_loss: 1.1301, test_f1: 0.3299
 epoch: 2, train_loss: 0.9914, test_loss: 1.0055, test_f1: 0.4221
 epoch: 3, train_loss: 0.9685, test_loss: 0.9633, test_f1: 0.4691
 epoch: 4, train_loss: 0.9460, test_loss: 1.0069, test_f1: 0.4965
 epoch: 5, train_loss: 0.9246, test_loss: 0.9598, test_f1: 0.5305
 epoch: 6, train_loss: 0.8990, test_loss: 0.9140, test_f1: 0.5499
 epoch: 7, train_loss: 0.8764, test_loss: 1.1751, test_f1: 0.4610
 epoch: 8, train_loss: 0.8729, test_loss: 0.9873, test_f1: 0.4744
 epoch: 9, train_loss: 0.8474, test_loss: 0.9017, test_f1: 0.5247
 epoch: 10, train_loss: 0.8421, test_loss: 0.9898, test_f1: 0.4940
 epoch: 11, train_loss: 0.8240, test_loss: 0.8733, test_f1: 0.5245
 epoch: 12, train_loss: 0.8191, test_loss: 0.8529, test_f1: 0.5902
 epoch: 13, train_loss: 0.7827, test_loss: 0.9136, test_f1: 0.5864
 epoch: 14, train_loss: 0.7723, test_loss: 0.8796, test_f1: 0.5804
 epoch: 15, train_loss: 0.7559, test_loss: 0.9193, test_f1: 0.5221
 epoch: 16, train_loss: 0.7561, test_loss: 1.2181, test_f1: 0.5131
 epoch: 17, train_loss: 0.7549, test_loss: 0.8298, test_f1: 0.6199
 epoch: 18, train_loss: 0.7352, test_loss: 0.9433, test_f1: 0.6115
 epoch: 19, train_loss: 0.7453, test_loss: 0.9491, test_f1: 0.5900
 epoch: 20, train_loss: 0.7227, test_loss: 1.0108, test_f1: 0.5893
 epoch: 21, train_loss: 0.7107, test_loss: 1.0982, test_f1: 0.5100
 epoch: 22, train_loss: 0.7184, test_loss: 0.9650, test_f1: 0.5997
 epoch: 23, train_loss: 0.7138, test_loss: 0.8985, test_f1: 0.5682
 epoch: 24, train_loss: 0.6945, test_loss: 0.9541, test_f1: 0.5935
 epoch: 25, train_loss: 0.6945, test_loss: 1.0077, test_f1: 0.5852
 epoch: 26, train_loss: 0.6848, test_loss: 0.9889, test_f1: 0.5394
 epoch: 27, train_loss: 0.6761, test_loss: 0.9250, test_f1: 0.6054
 epoch: 28, train_loss: 0.6563, test_loss: 0.9624, test_f1: 0.5858
 epoch: 29, train_loss: 0.6478, test_loss: 0.9933, test_f1: 0.6221
 epoch: 30, train_loss: 0.6429, test_loss: 1.0222, test_f1: 0.5909
 epoch: 31, train_loss: 0.6361, test_loss: 0.9141, test_f1: 0.6384
 epoch: 32, train_loss: 0.6420, test_loss: 0.8950, test_f1: 0.6592
 epoch: 33, train_loss: 0.6349, test_loss: 1.0070, test_f1: 0.6263
 epoch: 34, train_loss: 0.6385, test_loss: 0.9556, test_f1: 0.6234
 epoch: 35, train_loss: 0.6423, test_loss: 0.9547, test_f1: 0.6152
 epoch: 36, train_loss: 0.6536, test_loss: 0.9171, test_f1: 0.6267
 epoch: 37, train_loss: 0.6570, test_loss: 1.0261, test_f1: 0.5520
 epoch: 38, train_loss: 0.6468, test_loss: 0.9867, test_f1: 0.6191
 epoch: 39, train_loss: 0.6206, test_loss: 0.9386, test_f1: 0.6574
 epoch: 40, train_loss: 0.6044, test_loss: 1.1380, test_f1: 0.5630
 epoch: 41, train_loss: 0.6009, test_loss: 1.1005, test_f1: 0.6277
 epoch: 42, train_loss: 0.5976, test_loss: 1.0380, test_f1: 0.5967
 epoch: 43, train_loss: 0.5737, test_loss: 1.0340, test_f1: 0.6123
 epoch: 44, train_loss: 0.5694, test_loss: 1.0484, test_f1: 0.6238
 epoch: 45, train_loss: 0.5992, test_loss: 1.2221, test_f1: 0.5542
 epoch: 46, train_loss: 0.5932, test_loss: 0.9786, test_f1: 0.6385
 epoch: 47, train_loss: 0.5882, test_loss: 1.1584, test_f1: 0.6297
 epoch: 48, train_loss: 0.5751, test_loss: 1.0850, test_f1: 0.6394
 epoch: 49, train_loss: 0.5598, test_loss: 1.0209, test_f1: 0.6562
 epoch: 50, train_loss: 0.5588, test_loss: 1.0307, test_f1: 0.6805
 epoch: 51, train_loss: 0.5165, test_loss: 1.0540, test_f1: 0.6753
 epoch: 52, train_loss: 0.4953, test_loss: 1.0625, test_f1: 0.6638
 epoch: 53, train_loss: 0.5031, test_loss: 1.1300, test_f1: 0.6426
 epoch: 54, train_loss: 0.4675, test_loss: 1.1029, test_f1: 0.6759
 epoch: 55, train_loss: 0.4590, test_loss: 1.1465, test_f1: 0.6474
 epoch: 56, train_loss: 0.4831, test_loss: 1.1348, test_f1: 0.6657
 epoch: 57, train_loss: 0.4621, test_loss: 1.0422, test_f1: 0.6602
 epoch: 58, train_loss: 0.4611, test_loss: 1.0523, test_f1: 0.6727
 epoch: 59, train_loss: 0.4499, test_loss: 1.1555, test_f1: 0.6570
 epoch: 60, train_loss: 0.4308, test_loss: 1.1387, test_f1: 0.6529
 epoch: 61, train_loss: 0.4334, test_loss: 1.1822, test_f1: 0.6740
 epoch: 62, train_loss: 0.4340, test_loss: 1.1761, test_f1: 0.6603
 epoch: 63, train_loss: 0.4271, test_loss: 1.1617, test_f1: 0.6601
 epoch: 64, train_loss: 0.4429, test_loss: 1.3487, test_f1: 0.6263
 epoch: 65, train_loss: 0.4316, test_loss: 1.2310, test_f1: 0.6443
 epoch: 66, train_loss: 0.4323, test_loss: 1.1690, test_f1: 0.6507
 epoch: 67, train_loss: 0.4234, test_loss: 1.1088, test_f1: 0.6751
 epoch: 68, train_loss: 0.4174, test_loss: 1.2185, test_f1: 0.6458
 epoch: 69, train_loss: 0.4242, test_loss: 1.2497, test_f1: 0.6538
 epoch: 70, train_loss: 0.4210, test_loss: 1.2474, test_f1: 0.6865
 epoch: 71, train_loss: 0.3991, test_loss: 1.2383, test_f1: 0.6688
 epoch: 72, train_loss: 0.4020, test_loss: 1.1685, test_f1: 0.6653
 epoch: 73, train_loss: 0.3920, test_loss: 1.2455, test_f1: 0.6857
 epoch: 74, train_loss: 0.4082, test_loss: 1.3283, test_f1: 0.6124
 epoch: 75, train_loss: 0.3977, test_loss: 1.2598, test_f1: 0.6852
 epoch: 76, train_loss: 0.3888, test_loss: 1.4381, test_f1: 0.6857
 epoch: 77, train_loss: 0.3875, test_loss: 1.2671, test_f1: 0.6616
 epoch: 78, train_loss: 0.3967, test_loss: 1.3453, test_f1: 0.6407
 epoch: 79, train_loss: 0.3819, test_loss: 1.2434, test_f1: 0.6544
 epoch: 80, train_loss: 0.3575, test_loss: 1.3623, test_f1: 0.6718
 epoch: 81, train_loss: 0.3912, test_loss: 1.4813, test_f1: 0.6897
 epoch: 82, train_loss: 0.3736, test_loss: 1.4957, test_f1: 0.6449
 epoch: 83, train_loss: 0.3762, test_loss: 1.4674, test_f1: 0.6516
 epoch: 84, train_loss: 0.3620, test_loss: 1.3294, test_f1: 0.6752
 epoch: 85, train_loss: 0.3697, test_loss: 1.4256, test_f1: 0.6239
 epoch: 86, train_loss: 0.3463, test_loss: 1.3926, test_f1: 0.6710
 epoch: 87, train_loss: 0.3485, test_loss: 1.4001, test_f1: 0.6930
 epoch: 88, train_loss: 0.3677, test_loss: 1.3740, test_f1: 0.6595
 epoch: 89, train_loss: 0.3661, test_loss: 1.4963, test_f1: 0.6674
 epoch: 90, train_loss: 0.3604, test_loss: 1.3643, test_f1: 0.6656
 epoch: 91, train_loss: 0.3568, test_loss: 1.5512, test_f1: 0.6396
 epoch: 92, train_loss: 0.3565, test_loss: 1.4893, test_f1: 0.6603
 epoch: 93, train_loss: 0.3601, test_loss: 1.5443, test_f1: 0.6494
 epoch: 94, train_loss: 0.3525, test_loss: 1.7186, test_f1: 0.6271
 epoch: 95, train_loss: 0.3287, test_loss: 1.5386, test_f1: 0.6659
 epoch: 96, train_loss: 0.3414, test_loss: 1.3683, test_f1: 0.6608
 epoch: 97, train_loss: 0.3313, test_loss: 1.4210, test_f1: 0.6556
 epoch: 98, train_loss: 0.3245, test_loss: 1.6901, test_f1: 0.6283
 epoch: 99, train_loss: 0.3260, test_loss: 1.5414, test_f1: 0.6763
##################ITERATION #8 ****************************************
 epoch: 0, train_loss: 1.4902, test_loss: 1.4888, test_f1: 0.2777
 epoch: 1, train_loss: 1.0170, test_loss: 1.3431, test_f1: 0.2936
 epoch: 2, train_loss: 0.9741, test_loss: 1.1158, test_f1: 0.4034
 epoch: 3, train_loss: 0.9407, test_loss: 1.0667, test_f1: 0.5064
 epoch: 4, train_loss: 0.9308, test_loss: 0.9304, test_f1: 0.5428
 epoch: 5, train_loss: 0.9092, test_loss: 0.9776, test_f1: 0.5159
 epoch: 6, train_loss: 0.8733, test_loss: 0.9664, test_f1: 0.5553
 epoch: 7, train_loss: 0.8710, test_loss: 1.0248, test_f1: 0.5140
 epoch: 8, train_loss: 0.8516, test_loss: 0.9075, test_f1: 0.5553
 epoch: 9, train_loss: 0.8186, test_loss: 0.8950, test_f1: 0.5846
 epoch: 10, train_loss: 0.8171, test_loss: 0.9162, test_f1: 0.5320
 epoch: 11, train_loss: 0.8146, test_loss: 0.9235, test_f1: 0.6351
 epoch: 12, train_loss: 0.7797, test_loss: 0.8590, test_f1: 0.6027
 epoch: 13, train_loss: 0.7859, test_loss: 1.0028, test_f1: 0.5754
 epoch: 14, train_loss: 0.7622, test_loss: 0.9016, test_f1: 0.5859
 epoch: 15, train_loss: 0.7389, test_loss: 0.9078, test_f1: 0.5919
 epoch: 16, train_loss: 0.7395, test_loss: 0.8432, test_f1: 0.6079
 epoch: 17, train_loss: 0.7229, test_loss: 0.7833, test_f1: 0.6013
 epoch: 18, train_loss: 0.7036, test_loss: 0.9029, test_f1: 0.5985
 epoch: 19, train_loss: 0.7043, test_loss: 0.9410, test_f1: 0.5753
 epoch: 20, train_loss: 0.6900, test_loss: 0.8377, test_f1: 0.6179
 epoch: 21, train_loss: 0.6676, test_loss: 0.9615, test_f1: 0.6028
 epoch: 22, train_loss: 0.7010, test_loss: 0.9266, test_f1: 0.6062
 epoch: 23, train_loss: 0.6754, test_loss: 0.8352, test_f1: 0.6417
 epoch: 24, train_loss: 0.6539, test_loss: 1.0105, test_f1: 0.6113
 epoch: 25, train_loss: 0.6502, test_loss: 0.8265, test_f1: 0.6269
 epoch: 26, train_loss: 0.6441, test_loss: 1.0404, test_f1: 0.6257
 epoch: 27, train_loss: 0.6334, test_loss: 1.1148, test_f1: 0.5814
 epoch: 28, train_loss: 0.6502, test_loss: 1.2101, test_f1: 0.5201
 epoch: 29, train_loss: 0.6421, test_loss: 1.0483, test_f1: 0.5605
 epoch: 30, train_loss: 0.5832, test_loss: 0.8885, test_f1: 0.6426
 epoch: 31, train_loss: 0.6159, test_loss: 0.8812, test_f1: 0.6244
 epoch: 32, train_loss: 0.5913, test_loss: 0.9222, test_f1: 0.6018
 epoch: 33, train_loss: 0.6005, test_loss: 0.8428, test_f1: 0.6357
 epoch: 34, train_loss: 0.5803, test_loss: 0.9438, test_f1: 0.6037
 epoch: 35, train_loss: 0.5690, test_loss: 0.9570, test_f1: 0.6528
 epoch: 36, train_loss: 0.5510, test_loss: 0.9086, test_f1: 0.6808
 epoch: 37, train_loss: 0.5520, test_loss: 1.0591, test_f1: 0.6220
 epoch: 38, train_loss: 0.5624, test_loss: 0.9279, test_f1: 0.6539
 epoch: 39, train_loss: 0.5498, test_loss: 0.9571, test_f1: 0.5543
 epoch: 40, train_loss: 0.5413, test_loss: 1.0031, test_f1: 0.6365
 epoch: 41, train_loss: 0.5427, test_loss: 1.0466, test_f1: 0.6479
 epoch: 42, train_loss: 0.5456, test_loss: 0.9589, test_f1: 0.6188
 epoch: 43, train_loss: 0.5462, test_loss: 1.0763, test_f1: 0.6579
 epoch: 44, train_loss: 0.5242, test_loss: 1.0927, test_f1: 0.6313
 epoch: 45, train_loss: 0.5395, test_loss: 1.0548, test_f1: 0.6313
 epoch: 46, train_loss: 0.5287, test_loss: 1.0006, test_f1: 0.6264
 epoch: 47, train_loss: 0.5466, test_loss: 1.0745, test_f1: 0.6175
 epoch: 48, train_loss: 0.5342, test_loss: 1.0415, test_f1: 0.6087
 epoch: 49, train_loss: 0.4964, test_loss: 1.0607, test_f1: 0.6423
 epoch: 50, train_loss: 0.4774, test_loss: 1.0740, test_f1: 0.6433
 epoch: 51, train_loss: 0.4716, test_loss: 1.1388, test_f1: 0.6114
 epoch: 52, train_loss: 0.4454, test_loss: 1.0533, test_f1: 0.6532
 epoch: 53, train_loss: 0.4258, test_loss: 1.0630, test_f1: 0.6623
 epoch: 54, train_loss: 0.4247, test_loss: 1.0470, test_f1: 0.6688
 epoch: 55, train_loss: 0.4121, test_loss: 1.0260, test_f1: 0.6893
 epoch: 56, train_loss: 0.3963, test_loss: 1.1072, test_f1: 0.6535
 epoch: 57, train_loss: 0.4117, test_loss: 1.1030, test_f1: 0.6576
 epoch: 58, train_loss: 0.3985, test_loss: 1.1203, test_f1: 0.6590
 epoch: 59, train_loss: 0.3964, test_loss: 1.1157, test_f1: 0.6635
 epoch: 60, train_loss: 0.4079, test_loss: 1.1079, test_f1: 0.6677
 epoch: 61, train_loss: 0.3773, test_loss: 1.0438, test_f1: 0.6522
 epoch: 62, train_loss: 0.3827, test_loss: 1.1447, test_f1: 0.6751
 epoch: 63, train_loss: 0.3695, test_loss: 1.1684, test_f1: 0.6318
 epoch: 64, train_loss: 0.3642, test_loss: 1.2508, test_f1: 0.6363
 epoch: 65, train_loss: 0.3818, test_loss: 1.1396, test_f1: 0.6759
 epoch: 66, train_loss: 0.3780, test_loss: 1.2162, test_f1: 0.6570
 epoch: 67, train_loss: 0.3834, test_loss: 1.1909, test_f1: 0.6668
 epoch: 68, train_loss: 0.3746, test_loss: 1.2292, test_f1: 0.6559
 epoch: 69, train_loss: 0.3524, test_loss: 1.2209, test_f1: 0.6527
 epoch: 70, train_loss: 0.3498, test_loss: 1.2468, test_f1: 0.6404
 epoch: 71, train_loss: 0.3476, test_loss: 1.2586, test_f1: 0.6692
 epoch: 72, train_loss: 0.3471, test_loss: 1.3443, test_f1: 0.6539
 epoch: 73, train_loss: 0.3462, test_loss: 1.2701, test_f1: 0.6809
 epoch: 74, train_loss: 0.3721, test_loss: 1.2489, test_f1: 0.6765
 epoch: 75, train_loss: 0.3616, test_loss: 1.2027, test_f1: 0.6752
 epoch: 76, train_loss: 0.3624, test_loss: 1.3070, test_f1: 0.6573
 epoch: 77, train_loss: 0.3474, test_loss: 1.2601, test_f1: 0.6497
 epoch: 78, train_loss: 0.3552, test_loss: 1.2569, test_f1: 0.6513
 epoch: 79, train_loss: 0.3562, test_loss: 1.3046, test_f1: 0.6695
 epoch: 80, train_loss: 0.3522, test_loss: 1.3295, test_f1: 0.6393
 epoch: 81, train_loss: 0.3522, test_loss: 1.2893, test_f1: 0.6714
 epoch: 82, train_loss: 0.3611, test_loss: 1.5475, test_f1: 0.6208
 epoch: 83, train_loss: 0.3526, test_loss: 1.2482, test_f1: 0.6834
 epoch: 84, train_loss: 0.3259, test_loss: 1.2209, test_f1: 0.6507
 epoch: 85, train_loss: 0.3308, test_loss: 1.3072, test_f1: 0.6787
 epoch: 86, train_loss: 0.3446, test_loss: 1.4120, test_f1: 0.6433
 epoch: 87, train_loss: 0.3242, test_loss: 1.3299, test_f1: 0.6684
 epoch: 88, train_loss: 0.3087, test_loss: 1.4101, test_f1: 0.6472
 epoch: 89, train_loss: 0.3327, test_loss: 1.3007, test_f1: 0.6354
 epoch: 90, train_loss: 0.3144, test_loss: 1.2549, test_f1: 0.6570
 epoch: 91, train_loss: 0.3270, test_loss: 1.3352, test_f1: 0.6718
 epoch: 92, train_loss: 0.3205, test_loss: 1.3845, test_f1: 0.6519
 epoch: 93, train_loss: 0.3060, test_loss: 1.3635, test_f1: 0.6748
 epoch: 94, train_loss: 0.2868, test_loss: 1.3534, test_f1: 0.6811
 epoch: 95, train_loss: 0.3047, test_loss: 1.5168, test_f1: 0.6505
 epoch: 96, train_loss: 0.3115, test_loss: 1.3643, test_f1: 0.6770
 epoch: 97, train_loss: 0.3064, test_loss: 1.4215, test_f1: 0.6595
 epoch: 98, train_loss: 0.3054, test_loss: 1.4201, test_f1: 0.6441
 epoch: 99, train_loss: 0.2998, test_loss: 1.4105, test_f1: 0.6597
##################ITERATION #9 ****************************************
 epoch: 0, train_loss: 1.3661, test_loss: 1.1564, test_f1: 0.3403
 epoch: 1, train_loss: 1.0068, test_loss: 1.1286, test_f1: 0.3743
 epoch: 2, train_loss: 0.9583, test_loss: 1.0559, test_f1: 0.3806
 epoch: 3, train_loss: 0.9281, test_loss: 0.9596, test_f1: 0.4344
 epoch: 4, train_loss: 0.9028, test_loss: 1.0030, test_f1: 0.5002
 epoch: 5, train_loss: 0.8918, test_loss: 0.9419, test_f1: 0.5172
 epoch: 6, train_loss: 0.8752, test_loss: 1.2146, test_f1: 0.4404
 epoch: 7, train_loss: 0.8532, test_loss: 0.9862, test_f1: 0.4874
 epoch: 8, train_loss: 0.8333, test_loss: 0.8593, test_f1: 0.5678
 epoch: 9, train_loss: 0.8274, test_loss: 0.9213, test_f1: 0.5388
 epoch: 10, train_loss: 0.8267, test_loss: 0.8599, test_f1: 0.5797
 epoch: 11, train_loss: 0.8120, test_loss: 0.8721, test_f1: 0.5428
 epoch: 12, train_loss: 0.7908, test_loss: 0.9943, test_f1: 0.5222
 epoch: 13, train_loss: 0.7954, test_loss: 0.8382, test_f1: 0.5747
 epoch: 14, train_loss: 0.7484, test_loss: 0.7949, test_f1: 0.5964
 epoch: 15, train_loss: 0.7575, test_loss: 0.8500, test_f1: 0.5932
 epoch: 16, train_loss: 0.7484, test_loss: 0.7918, test_f1: 0.6196
 epoch: 17, train_loss: 0.7173, test_loss: 0.7523, test_f1: 0.6236
 epoch: 18, train_loss: 0.7166, test_loss: 0.8999, test_f1: 0.5846
 epoch: 19, train_loss: 0.7047, test_loss: 0.8070, test_f1: 0.6161
 epoch: 20, train_loss: 0.7021, test_loss: 0.7867, test_f1: 0.6187
 epoch: 21, train_loss: 0.6866, test_loss: 0.7487, test_f1: 0.6268
 epoch: 22, train_loss: 0.7000, test_loss: 0.9233, test_f1: 0.5711
 epoch: 23, train_loss: 0.6733, test_loss: 0.9301, test_f1: 0.5446
 epoch: 24, train_loss: 0.6833, test_loss: 0.8888, test_f1: 0.6097
 epoch: 25, train_loss: 0.6546, test_loss: 0.7211, test_f1: 0.6519
 epoch: 26, train_loss: 0.6510, test_loss: 1.0078, test_f1: 0.5279
 epoch: 27, train_loss: 0.6699, test_loss: 0.7962, test_f1: 0.6177
 epoch: 28, train_loss: 0.6788, test_loss: 0.7874, test_f1: 0.6372
 epoch: 29, train_loss: 0.6411, test_loss: 0.8099, test_f1: 0.6288
 epoch: 30, train_loss: 0.6433, test_loss: 0.9189, test_f1: 0.5863
 epoch: 31, train_loss: 0.6431, test_loss: 0.7541, test_f1: 0.6336
 epoch: 32, train_loss: 0.6267, test_loss: 0.8584, test_f1: 0.6217
 epoch: 33, train_loss: 0.6267, test_loss: 0.7836, test_f1: 0.6069
 epoch: 34, train_loss: 0.6039, test_loss: 1.1316, test_f1: 0.5448
 epoch: 35, train_loss: 0.5907, test_loss: 0.8761, test_f1: 0.6548
 epoch: 36, train_loss: 0.6040, test_loss: 0.8401, test_f1: 0.6467
 epoch: 37, train_loss: 0.5917, test_loss: 0.7070, test_f1: 0.6907
 epoch: 38, train_loss: 0.5978, test_loss: 0.8450, test_f1: 0.6134
 epoch: 39, train_loss: 0.5976, test_loss: 0.9500, test_f1: 0.5509
 epoch: 40, train_loss: 0.5785, test_loss: 0.7706, test_f1: 0.6626
 epoch: 41, train_loss: 0.6060, test_loss: 0.9470, test_f1: 0.5862
 epoch: 42, train_loss: 0.5676, test_loss: 0.6884, test_f1: 0.6813
 epoch: 43, train_loss: 0.5600, test_loss: 0.7278, test_f1: 0.6646
 epoch: 44, train_loss: 0.5527, test_loss: 0.9268, test_f1: 0.6402
 epoch: 45, train_loss: 0.5498, test_loss: 0.9238, test_f1: 0.6348
 epoch: 46, train_loss: 0.5547, test_loss: 0.7897, test_f1: 0.6762
 epoch: 47, train_loss: 0.5539, test_loss: 0.9283, test_f1: 0.6272
 epoch: 48, train_loss: 0.5302, test_loss: 0.8375, test_f1: 0.6245
 epoch: 49, train_loss: 0.5106, test_loss: 0.8132, test_f1: 0.6746
 epoch: 50, train_loss: 0.5223, test_loss: 0.8115, test_f1: 0.6616
 epoch: 51, train_loss: 0.4883, test_loss: 0.8878, test_f1: 0.6754
 epoch: 52, train_loss: 0.4839, test_loss: 0.8049, test_f1: 0.7028
 epoch: 53, train_loss: 0.4539, test_loss: 0.7838, test_f1: 0.6831
 epoch: 54, train_loss: 0.4468, test_loss: 0.7610, test_f1: 0.7225
 epoch: 55, train_loss: 0.4332, test_loss: 0.7785, test_f1: 0.7130
 epoch: 56, train_loss: 0.4317, test_loss: 0.7870, test_f1: 0.6906
 epoch: 57, train_loss: 0.4427, test_loss: 0.8713, test_f1: 0.6789
 epoch: 58, train_loss: 0.4531, test_loss: 0.7578, test_f1: 0.6941
 epoch: 59, train_loss: 0.4393, test_loss: 0.8112, test_f1: 0.6816
 epoch: 60, train_loss: 0.4198, test_loss: 0.8297, test_f1: 0.6755
 epoch: 61, train_loss: 0.4317, test_loss: 0.8519, test_f1: 0.6996
 epoch: 62, train_loss: 0.4160, test_loss: 0.9868, test_f1: 0.6700
 epoch: 63, train_loss: 0.4117, test_loss: 0.8562, test_f1: 0.6831
 epoch: 64, train_loss: 0.4031, test_loss: 0.9355, test_f1: 0.6710
 epoch: 65, train_loss: 0.3989, test_loss: 0.9027, test_f1: 0.7042
 epoch: 66, train_loss: 0.3997, test_loss: 0.9005, test_f1: 0.6715
 epoch: 67, train_loss: 0.3966, test_loss: 0.9165, test_f1: 0.7164
 epoch: 68, train_loss: 0.3906, test_loss: 0.7840, test_f1: 0.7233
 epoch: 69, train_loss: 0.3945, test_loss: 0.8272, test_f1: 0.6987
 epoch: 70, train_loss: 0.3876, test_loss: 0.9233, test_f1: 0.6634
 epoch: 71, train_loss: 0.3805, test_loss: 1.1127, test_f1: 0.6641
 epoch: 72, train_loss: 0.3858, test_loss: 0.9076, test_f1: 0.7053
 epoch: 73, train_loss: 0.4045, test_loss: 1.0197, test_f1: 0.6620
 epoch: 74, train_loss: 0.4071, test_loss: 0.8746, test_f1: 0.6954
 epoch: 75, train_loss: 0.4043, test_loss: 0.9829, test_f1: 0.6366
 epoch: 76, train_loss: 0.3835, test_loss: 1.0581, test_f1: 0.6678
 epoch: 77, train_loss: 0.3872, test_loss: 0.9245, test_f1: 0.7103
 epoch: 78, train_loss: 0.3682, test_loss: 0.9580, test_f1: 0.6729
 epoch: 79, train_loss: 0.3760, test_loss: 0.9584, test_f1: 0.7000
 epoch: 80, train_loss: 0.3601, test_loss: 0.8947, test_f1: 0.7182
 epoch: 81, train_loss: 0.3463, test_loss: 1.0630, test_f1: 0.6594
 epoch: 82, train_loss: 0.3587, test_loss: 0.9775, test_f1: 0.6975
 epoch: 83, train_loss: 0.3597, test_loss: 0.9917, test_f1: 0.6746
 epoch: 84, train_loss: 0.3441, test_loss: 0.9322, test_f1: 0.6794
 epoch: 85, train_loss: 0.3510, test_loss: 1.1164, test_f1: 0.6680
 epoch: 86, train_loss: 0.3600, test_loss: 1.0560, test_f1: 0.7235
 epoch: 87, train_loss: 0.3692, test_loss: 0.9931, test_f1: 0.6743
 epoch: 88, train_loss: 0.3554, test_loss: 0.9402, test_f1: 0.6999
 epoch: 89, train_loss: 0.3527, test_loss: 0.9927, test_f1: 0.7027
 epoch: 90, train_loss: 0.3357, test_loss: 1.0698, test_f1: 0.7054
 epoch: 91, train_loss: 0.3455, test_loss: 0.9976, test_f1: 0.7068
 epoch: 92, train_loss: 0.3404, test_loss: 1.0446, test_f1: 0.7057
 epoch: 93, train_loss: 0.3415, test_loss: 0.9879, test_f1: 0.7011
 epoch: 94, train_loss: 0.3304, test_loss: 1.1175, test_f1: 0.6997
 epoch: 95, train_loss: 0.3263, test_loss: 1.0719, test_f1: 0.7098
 epoch: 96, train_loss: 0.3267, test_loss: 1.2011, test_f1: 0.6561
 epoch: 97, train_loss: 0.3315, test_loss: 1.0446, test_f1: 0.6870
 epoch: 98, train_loss: 0.3309, test_loss: 1.0217, test_f1: 0.7155
 epoch: 99, train_loss: 0.3228, test_loss: 1.0807, test_f1: 0.6996

Training completed in 409.25 seconds
Best F1: 0.7235 at epoch 86
Mean F1 across iterations: 0.6999  0.0140
========================FINAL RESULTS================================
FEGIN weighted F1: 0.7235  0.0140
python main.py --data ltspice_examples --representation component_pin_net --model FEGIN --layers 2 --hiddens 64 --batch_size 256 --lr 0.01 --emb_size 128 --epochs 100 --save_appendix component_pin_net_L2_H64_BS256_LR0.01_E128 --no_val
-----



STDERR:
  File "main.py", line 370, in <module>
    main()
  File "main.py", line 254, in main
    dataset = dataset_class(
  File "/home/philip/projects/ltspice_examples_code_repo/Circuit-Completion-Using-GNNs/component_classification_with_link_prediction_head/evaluation/FEGIN/kernel/circuit_datasets.py", line 15, in __init__
    self.data, self.slices = torch.load(self.processed_paths[0])
  File "/home/philip/.local/lib/python3.8/site-packages/torch/serialization.py", line 1040, in load
    warnings.warn(
  File "/usr/lib/python3.8/warnings.py", line 109, in _showwarnmsg
    sw(msg.message, msg.category, msg.filename, msg.lineno,
  File "main.py", line 47, in warn_with_traceback
    traceback.print_stack(file=log)
/home/philip/projects/ltspice_examples_code_repo/Circuit-Completion-Using-GNNs/component_classification_with_link_prediction_head/evaluation/FEGIN/kernel/circuit_datasets.py:15: FutureWarning: You are using `torch.load` with `weights_only=False` (the current default value), which uses the default pickle module implicitly. It is possible to construct malicious pickle data which will execute arbitrary code during unpickling (See https://github.com/pytorch/pytorch/blob/main/SECURITY.md#untrusted-models for more details). In a future release, the default value for `weights_only` will be flipped to `True`. This limits the functions that could be executed during unpickling. Arbitrary objects will no longer be allowed to be loaded via this mode unless they are explicitly allowlisted by the user via `torch.serialization.add_safe_globals`. We recommend you start setting `weights_only=True` for any use case where you don't have full control of the loaded file. Please open an issue on GitHub for any issues related to this experimental feature.
  self.data, self.slices = torch.load(self.processed_paths[0])
