STDOUT:
Results will be saved in /home/philip/projects/llm_inference_code_repo/Circuit-Completion-Using-GNNs/component_classification_with_link_prediction_head/evaluation/FEGIN/results/model_FEGIN_dataset_ltspice_examples
Command line input: python main.py --data ltspice_examples --representation component_pin_net --model FEGIN --layers 3 --hiddens 128 --batch_size 256 --lr 0.0001 --emb_size 128 --epochs 100 --save_appendix component_pin_net_L3_H128_BS256_LR0.0001_E128 --no_val
 is saved.
-----
ltspice_examples - FEGIN
Using 3 layers, 128 hidden units, h = 2
Loading component_pin_net representation dataset
ENTERED
Training FEGIN on component_pin_net representation
Train: 3558, Test: 846
##################ITERATION #0 ****************************************
 epoch: 0, train_loss: 1.3866, test_loss: 1.3931, test_f1: 0.0304
 epoch: 1, train_loss: 1.3633, test_loss: 1.3810, test_f1: 0.2225
 epoch: 2, train_loss: 1.3436, test_loss: 1.3643, test_f1: 0.2587
 epoch: 3, train_loss: 1.3176, test_loss: 1.3337, test_f1: 0.2270
 epoch: 4, train_loss: 1.2854, test_loss: 1.2861, test_f1: 0.2270
 epoch: 5, train_loss: 1.2522, test_loss: 1.2386, test_f1: 0.2549
 epoch: 6, train_loss: 1.2236, test_loss: 1.2044, test_f1: 0.2765
 epoch: 7, train_loss: 1.2017, test_loss: 1.1781, test_f1: 0.3236
 epoch: 8, train_loss: 1.1833, test_loss: 1.1587, test_f1: 0.3303
 epoch: 9, train_loss: 1.1675, test_loss: 1.1429, test_f1: 0.3635
 epoch: 10, train_loss: 1.1554, test_loss: 1.1269, test_f1: 0.3950
 epoch: 11, train_loss: 1.1382, test_loss: 1.1120, test_f1: 0.4151
 epoch: 12, train_loss: 1.1202, test_loss: 1.0940, test_f1: 0.4369
 epoch: 13, train_loss: 1.0983, test_loss: 1.0735, test_f1: 0.4509
 epoch: 14, train_loss: 1.0785, test_loss: 1.0486, test_f1: 0.4529
 epoch: 15, train_loss: 1.0547, test_loss: 1.0278, test_f1: 0.5029
 epoch: 16, train_loss: 1.0282, test_loss: 1.0020, test_f1: 0.5114
 epoch: 17, train_loss: 1.0051, test_loss: 0.9860, test_f1: 0.5439
 epoch: 18, train_loss: 0.9873, test_loss: 0.9817, test_f1: 0.4997
 epoch: 19, train_loss: 0.9706, test_loss: 0.9600, test_f1: 0.5365
 epoch: 20, train_loss: 0.9506, test_loss: 0.9566, test_f1: 0.5323
 epoch: 21, train_loss: 0.9356, test_loss: 0.9471, test_f1: 0.5439
 epoch: 22, train_loss: 0.9243, test_loss: 0.9425, test_f1: 0.5268
 epoch: 23, train_loss: 0.9162, test_loss: 0.9326, test_f1: 0.5503
 epoch: 24, train_loss: 0.9053, test_loss: 0.9361, test_f1: 0.5475
 epoch: 25, train_loss: 0.9001, test_loss: 0.9266, test_f1: 0.5505
 epoch: 26, train_loss: 0.8889, test_loss: 0.9232, test_f1: 0.5479
 epoch: 27, train_loss: 0.8828, test_loss: 0.9214, test_f1: 0.5482
 epoch: 28, train_loss: 0.8746, test_loss: 0.9235, test_f1: 0.5472
 epoch: 29, train_loss: 0.8670, test_loss: 0.9108, test_f1: 0.5507
 epoch: 30, train_loss: 0.8709, test_loss: 0.9200, test_f1: 0.5469
 epoch: 31, train_loss: 0.8550, test_loss: 0.9124, test_f1: 0.5403
 epoch: 32, train_loss: 0.8527, test_loss: 0.9102, test_f1: 0.5632
 epoch: 33, train_loss: 0.8453, test_loss: 0.9128, test_f1: 0.5424
 epoch: 34, train_loss: 0.8337, test_loss: 0.9319, test_f1: 0.5305
 epoch: 35, train_loss: 0.8350, test_loss: 0.9047, test_f1: 0.5598
 epoch: 36, train_loss: 0.8311, test_loss: 0.9116, test_f1: 0.5390
 epoch: 37, train_loss: 0.8203, test_loss: 0.9346, test_f1: 0.5357
 epoch: 38, train_loss: 0.8204, test_loss: 0.9102, test_f1: 0.5371
 epoch: 39, train_loss: 0.8049, test_loss: 0.9014, test_f1: 0.5514
 epoch: 40, train_loss: 0.8077, test_loss: 0.9043, test_f1: 0.5317
 epoch: 41, train_loss: 0.7999, test_loss: 0.9369, test_f1: 0.5509
 epoch: 42, train_loss: 0.7932, test_loss: 0.9182, test_f1: 0.5286
 epoch: 43, train_loss: 0.7967, test_loss: 0.9061, test_f1: 0.5533
 epoch: 44, train_loss: 0.7821, test_loss: 0.9098, test_f1: 0.5378
 epoch: 45, train_loss: 0.7875, test_loss: 0.9041, test_f1: 0.5704
 epoch: 46, train_loss: 0.7823, test_loss: 0.9116, test_f1: 0.5518
 epoch: 47, train_loss: 0.7707, test_loss: 0.9169, test_f1: 0.5487
 epoch: 48, train_loss: 0.7647, test_loss: 0.9033, test_f1: 0.5490
 epoch: 49, train_loss: 0.7635, test_loss: 0.9071, test_f1: 0.5507
 epoch: 50, train_loss: 0.7623, test_loss: 0.9234, test_f1: 0.5442
 epoch: 51, train_loss: 0.7485, test_loss: 0.9183, test_f1: 0.5571
 epoch: 52, train_loss: 0.7426, test_loss: 0.9106, test_f1: 0.5465
 epoch: 53, train_loss: 0.7473, test_loss: 0.9184, test_f1: 0.5608
 epoch: 54, train_loss: 0.7390, test_loss: 0.9201, test_f1: 0.5516
 epoch: 55, train_loss: 0.7412, test_loss: 0.9165, test_f1: 0.5587
 epoch: 56, train_loss: 0.7395, test_loss: 0.9181, test_f1: 0.5586
 epoch: 57, train_loss: 0.7342, test_loss: 0.9209, test_f1: 0.5608
 epoch: 58, train_loss: 0.7332, test_loss: 0.9287, test_f1: 0.5511
 epoch: 59, train_loss: 0.7281, test_loss: 0.9135, test_f1: 0.5585
 epoch: 60, train_loss: 0.7271, test_loss: 0.9308, test_f1: 0.5543
 epoch: 61, train_loss: 0.7221, test_loss: 0.9291, test_f1: 0.5564
 epoch: 62, train_loss: 0.7252, test_loss: 0.9263, test_f1: 0.5569
 epoch: 63, train_loss: 0.7185, test_loss: 0.9259, test_f1: 0.5671
 epoch: 64, train_loss: 0.7150, test_loss: 0.9289, test_f1: 0.5562
 epoch: 65, train_loss: 0.7176, test_loss: 0.9305, test_f1: 0.5526
 epoch: 66, train_loss: 0.7140, test_loss: 0.9269, test_f1: 0.5500
 epoch: 67, train_loss: 0.6995, test_loss: 0.9368, test_f1: 0.5648
 epoch: 68, train_loss: 0.7080, test_loss: 0.9344, test_f1: 0.5602
 epoch: 69, train_loss: 0.7076, test_loss: 0.9346, test_f1: 0.5685
 epoch: 70, train_loss: 0.7035, test_loss: 0.9310, test_f1: 0.5771
 epoch: 71, train_loss: 0.7021, test_loss: 0.9333, test_f1: 0.5624
 epoch: 72, train_loss: 0.6990, test_loss: 0.9361, test_f1: 0.5753
 epoch: 73, train_loss: 0.6951, test_loss: 0.9329, test_f1: 0.5651
 epoch: 74, train_loss: 0.6882, test_loss: 0.9409, test_f1: 0.5608
 epoch: 75, train_loss: 0.6878, test_loss: 0.9425, test_f1: 0.5696
 epoch: 76, train_loss: 0.6984, test_loss: 0.9311, test_f1: 0.5650
 epoch: 77, train_loss: 0.6880, test_loss: 0.9534, test_f1: 0.5769
 epoch: 78, train_loss: 0.6838, test_loss: 0.9355, test_f1: 0.5634
 epoch: 79, train_loss: 0.6846, test_loss: 0.9356, test_f1: 0.5863
 epoch: 80, train_loss: 0.6819, test_loss: 0.9483, test_f1: 0.5685
 epoch: 81, train_loss: 0.6757, test_loss: 0.9317, test_f1: 0.5959
 epoch: 82, train_loss: 0.6850, test_loss: 0.9475, test_f1: 0.5804
 epoch: 83, train_loss: 0.6668, test_loss: 0.9555, test_f1: 0.5581
 epoch: 84, train_loss: 0.6738, test_loss: 0.9549, test_f1: 0.5703
 epoch: 85, train_loss: 0.6814, test_loss: 0.9469, test_f1: 0.5740
 epoch: 86, train_loss: 0.6747, test_loss: 0.9347, test_f1: 0.5849
 epoch: 87, train_loss: 0.6697, test_loss: 0.9597, test_f1: 0.5787
 epoch: 88, train_loss: 0.6688, test_loss: 0.9574, test_f1: 0.5813
 epoch: 89, train_loss: 0.6699, test_loss: 0.9553, test_f1: 0.5927
 epoch: 90, train_loss: 0.6620, test_loss: 0.9584, test_f1: 0.5876
 epoch: 91, train_loss: 0.6631, test_loss: 0.9447, test_f1: 0.5838
 epoch: 92, train_loss: 0.6568, test_loss: 0.9625, test_f1: 0.5888
 epoch: 93, train_loss: 0.6498, test_loss: 0.9616, test_f1: 0.5853
 epoch: 94, train_loss: 0.6484, test_loss: 0.9600, test_f1: 0.5759
 epoch: 95, train_loss: 0.6557, test_loss: 0.9753, test_f1: 0.5840
 epoch: 96, train_loss: 0.6532, test_loss: 0.9510, test_f1: 0.5906
 epoch: 97, train_loss: 0.6439, test_loss: 0.9812, test_f1: 0.5867
 epoch: 98, train_loss: 0.6511, test_loss: 0.9648, test_f1: 0.5839
 epoch: 99, train_loss: 0.6390, test_loss: 0.9612, test_f1: 0.5872
##################ITERATION #1 ****************************************
 epoch: 0, train_loss: 1.3417, test_loss: 1.3770, test_f1: 0.2270
 epoch: 1, train_loss: 1.2791, test_loss: 1.3493, test_f1: 0.2270
 epoch: 2, train_loss: 1.2342, test_loss: 1.3003, test_f1: 0.2270
 epoch: 3, train_loss: 1.1905, test_loss: 1.2203, test_f1: 0.2631
 epoch: 4, train_loss: 1.1517, test_loss: 1.1429, test_f1: 0.3474
 epoch: 5, train_loss: 1.1139, test_loss: 1.0922, test_f1: 0.4050
 epoch: 6, train_loss: 1.0808, test_loss: 1.0554, test_f1: 0.4321
 epoch: 7, train_loss: 1.0524, test_loss: 1.0305, test_f1: 0.4434
 epoch: 8, train_loss: 1.0275, test_loss: 1.0136, test_f1: 0.4677
 epoch: 9, train_loss: 1.0079, test_loss: 0.9994, test_f1: 0.4878
 epoch: 10, train_loss: 0.9876, test_loss: 0.9888, test_f1: 0.4892
 epoch: 11, train_loss: 0.9703, test_loss: 0.9737, test_f1: 0.4934
 epoch: 12, train_loss: 0.9549, test_loss: 0.9683, test_f1: 0.5188
 epoch: 13, train_loss: 0.9461, test_loss: 0.9824, test_f1: 0.4947
 epoch: 14, train_loss: 0.9410, test_loss: 0.9524, test_f1: 0.5151
 epoch: 15, train_loss: 0.9214, test_loss: 0.9394, test_f1: 0.5258
 epoch: 16, train_loss: 0.9149, test_loss: 0.9281, test_f1: 0.5419
 epoch: 17, train_loss: 0.9029, test_loss: 0.9351, test_f1: 0.5315
 epoch: 18, train_loss: 0.8964, test_loss: 0.9162, test_f1: 0.5478
 epoch: 19, train_loss: 0.8904, test_loss: 0.9174, test_f1: 0.5393
 epoch: 20, train_loss: 0.8841, test_loss: 0.9377, test_f1: 0.5360
 epoch: 21, train_loss: 0.8719, test_loss: 0.9055, test_f1: 0.5546
 epoch: 22, train_loss: 0.8698, test_loss: 0.9037, test_f1: 0.5508
 epoch: 23, train_loss: 0.8569, test_loss: 0.9040, test_f1: 0.5466
 epoch: 24, train_loss: 0.8579, test_loss: 0.9088, test_f1: 0.5500
 epoch: 25, train_loss: 0.8428, test_loss: 0.9073, test_f1: 0.5479
 epoch: 26, train_loss: 0.8376, test_loss: 0.9141, test_f1: 0.5451
 epoch: 27, train_loss: 0.8306, test_loss: 0.8862, test_f1: 0.5549
 epoch: 28, train_loss: 0.8290, test_loss: 0.9031, test_f1: 0.5394
 epoch: 29, train_loss: 0.8233, test_loss: 0.8779, test_f1: 0.5695
 epoch: 30, train_loss: 0.8148, test_loss: 0.8924, test_f1: 0.5578
 epoch: 31, train_loss: 0.8067, test_loss: 0.8920, test_f1: 0.5481
 epoch: 32, train_loss: 0.8062, test_loss: 0.8890, test_f1: 0.5607
 epoch: 33, train_loss: 0.8051, test_loss: 0.8880, test_f1: 0.5503
 epoch: 34, train_loss: 0.8024, test_loss: 0.8859, test_f1: 0.5426
 epoch: 35, train_loss: 0.7854, test_loss: 0.8999, test_f1: 0.5577
 epoch: 36, train_loss: 0.7813, test_loss: 0.8931, test_f1: 0.5711
 epoch: 37, train_loss: 0.7780, test_loss: 0.8704, test_f1: 0.5603
 epoch: 38, train_loss: 0.7708, test_loss: 0.8962, test_f1: 0.5587
 epoch: 39, train_loss: 0.7620, test_loss: 0.8805, test_f1: 0.5618
 epoch: 40, train_loss: 0.7523, test_loss: 0.8986, test_f1: 0.5509
 epoch: 41, train_loss: 0.7530, test_loss: 0.9060, test_f1: 0.5647
 epoch: 42, train_loss: 0.7429, test_loss: 0.8995, test_f1: 0.5603
 epoch: 43, train_loss: 0.7410, test_loss: 0.9093, test_f1: 0.5703
 epoch: 44, train_loss: 0.7373, test_loss: 0.9363, test_f1: 0.5491
 epoch: 45, train_loss: 0.7267, test_loss: 0.9076, test_f1: 0.5700
 epoch: 46, train_loss: 0.7300, test_loss: 0.9060, test_f1: 0.5631
 epoch: 47, train_loss: 0.7200, test_loss: 0.8826, test_f1: 0.5802
 epoch: 48, train_loss: 0.7170, test_loss: 0.9174, test_f1: 0.5690
 epoch: 49, train_loss: 0.7197, test_loss: 0.9086, test_f1: 0.5741
 epoch: 50, train_loss: 0.7066, test_loss: 0.9148, test_f1: 0.5691
 epoch: 51, train_loss: 0.6979, test_loss: 0.9104, test_f1: 0.5647
 epoch: 52, train_loss: 0.6948, test_loss: 0.9002, test_f1: 0.5835
 epoch: 53, train_loss: 0.6886, test_loss: 0.9011, test_f1: 0.5735
 epoch: 54, train_loss: 0.6825, test_loss: 0.9260, test_f1: 0.5764
 epoch: 55, train_loss: 0.6850, test_loss: 0.9095, test_f1: 0.5782
 epoch: 56, train_loss: 0.6816, test_loss: 0.9257, test_f1: 0.5724
 epoch: 57, train_loss: 0.6794, test_loss: 0.9199, test_f1: 0.5791
 epoch: 58, train_loss: 0.6708, test_loss: 0.9194, test_f1: 0.5777
 epoch: 59, train_loss: 0.6809, test_loss: 0.9188, test_f1: 0.5869
 epoch: 60, train_loss: 0.6651, test_loss: 0.9092, test_f1: 0.5811
 epoch: 61, train_loss: 0.6689, test_loss: 0.9239, test_f1: 0.5738
 epoch: 62, train_loss: 0.6642, test_loss: 0.9248, test_f1: 0.5750
 epoch: 63, train_loss: 0.6669, test_loss: 0.9209, test_f1: 0.5797
 epoch: 64, train_loss: 0.6639, test_loss: 0.9157, test_f1: 0.5841
 epoch: 65, train_loss: 0.6618, test_loss: 0.9302, test_f1: 0.5775
 epoch: 66, train_loss: 0.6490, test_loss: 0.9131, test_f1: 0.5852
 epoch: 67, train_loss: 0.6536, test_loss: 0.9320, test_f1: 0.5701
 epoch: 68, train_loss: 0.6509, test_loss: 0.9234, test_f1: 0.5914
 epoch: 69, train_loss: 0.6491, test_loss: 0.9336, test_f1: 0.5815
 epoch: 70, train_loss: 0.6513, test_loss: 0.9136, test_f1: 0.5776
 epoch: 71, train_loss: 0.6425, test_loss: 0.9301, test_f1: 0.5802
 epoch: 72, train_loss: 0.6467, test_loss: 0.9236, test_f1: 0.5730
 epoch: 73, train_loss: 0.6400, test_loss: 0.9210, test_f1: 0.5831
 epoch: 74, train_loss: 0.6363, test_loss: 0.9385, test_f1: 0.5798
 epoch: 75, train_loss: 0.6321, test_loss: 0.9397, test_f1: 0.5771
 epoch: 76, train_loss: 0.6383, test_loss: 0.9327, test_f1: 0.5763
 epoch: 77, train_loss: 0.6350, test_loss: 0.9298, test_f1: 0.5797
 epoch: 78, train_loss: 0.6269, test_loss: 0.9392, test_f1: 0.5911
 epoch: 79, train_loss: 0.6285, test_loss: 0.9333, test_f1: 0.5848
 epoch: 80, train_loss: 0.6276, test_loss: 0.9348, test_f1: 0.5691
 epoch: 81, train_loss: 0.6140, test_loss: 0.9401, test_f1: 0.5842
 epoch: 82, train_loss: 0.6133, test_loss: 0.9381, test_f1: 0.5820
 epoch: 83, train_loss: 0.6197, test_loss: 0.9571, test_f1: 0.5933
 epoch: 84, train_loss: 0.6152, test_loss: 0.9568, test_f1: 0.5725
 epoch: 85, train_loss: 0.6184, test_loss: 0.9472, test_f1: 0.5855
 epoch: 86, train_loss: 0.6261, test_loss: 0.9445, test_f1: 0.5790
 epoch: 87, train_loss: 0.6166, test_loss: 0.9534, test_f1: 0.5782
 epoch: 88, train_loss: 0.6227, test_loss: 0.9570, test_f1: 0.5846
 epoch: 89, train_loss: 0.6120, test_loss: 0.9389, test_f1: 0.5999
 epoch: 90, train_loss: 0.5975, test_loss: 0.9552, test_f1: 0.5755
 epoch: 91, train_loss: 0.5990, test_loss: 0.9601, test_f1: 0.5848
 epoch: 92, train_loss: 0.5920, test_loss: 0.9503, test_f1: 0.5847
 epoch: 93, train_loss: 0.5964, test_loss: 0.9527, test_f1: 0.5855
 epoch: 94, train_loss: 0.5911, test_loss: 0.9852, test_f1: 0.5889
 epoch: 95, train_loss: 0.5922, test_loss: 0.9613, test_f1: 0.5868
 epoch: 96, train_loss: 0.5982, test_loss: 0.9773, test_f1: 0.5838
 epoch: 97, train_loss: 0.5957, test_loss: 0.9789, test_f1: 0.6073
 epoch: 98, train_loss: 0.5961, test_loss: 0.9649, test_f1: 0.6096
 epoch: 99, train_loss: 0.5860, test_loss: 0.9755, test_f1: 0.5773
##################ITERATION #2 ****************************************
 epoch: 0, train_loss: 1.3000, test_loss: 1.3496, test_f1: 0.2270
 epoch: 1, train_loss: 1.2073, test_loss: 1.3151, test_f1: 0.2270
 epoch: 2, train_loss: 1.1555, test_loss: 1.2470, test_f1: 0.2270
 epoch: 3, train_loss: 1.1058, test_loss: 1.1351, test_f1: 0.3541
 epoch: 4, train_loss: 1.0649, test_loss: 1.0619, test_f1: 0.4112
 epoch: 5, train_loss: 1.0284, test_loss: 1.0205, test_f1: 0.4672
 epoch: 6, train_loss: 1.0083, test_loss: 0.9973, test_f1: 0.4903
 epoch: 7, train_loss: 0.9913, test_loss: 0.9828, test_f1: 0.4859
 epoch: 8, train_loss: 0.9770, test_loss: 0.9748, test_f1: 0.4865
 epoch: 9, train_loss: 0.9608, test_loss: 0.9611, test_f1: 0.5127
 epoch: 10, train_loss: 0.9562, test_loss: 0.9539, test_f1: 0.5099
 epoch: 11, train_loss: 0.9508, test_loss: 0.9481, test_f1: 0.4973
 epoch: 12, train_loss: 0.9304, test_loss: 0.9364, test_f1: 0.5233
 epoch: 13, train_loss: 0.9249, test_loss: 0.9332, test_f1: 0.5236
 epoch: 14, train_loss: 0.9092, test_loss: 0.9224, test_f1: 0.5198
 epoch: 15, train_loss: 0.9110, test_loss: 0.9160, test_f1: 0.5211
 epoch: 16, train_loss: 0.9029, test_loss: 0.9122, test_f1: 0.5294
 epoch: 17, train_loss: 0.8929, test_loss: 0.9122, test_f1: 0.5164
 epoch: 18, train_loss: 0.8775, test_loss: 0.9018, test_f1: 0.5419
 epoch: 19, train_loss: 0.8772, test_loss: 0.8935, test_f1: 0.5505
 epoch: 20, train_loss: 0.8639, test_loss: 0.8888, test_f1: 0.5414
 epoch: 21, train_loss: 0.8571, test_loss: 0.8893, test_f1: 0.5415
 epoch: 22, train_loss: 0.8480, test_loss: 0.8899, test_f1: 0.5415
 epoch: 23, train_loss: 0.8400, test_loss: 0.8720, test_f1: 0.5304
 epoch: 24, train_loss: 0.8287, test_loss: 0.8684, test_f1: 0.5403
 epoch: 25, train_loss: 0.8303, test_loss: 0.8758, test_f1: 0.5505
 epoch: 26, train_loss: 0.8285, test_loss: 0.8636, test_f1: 0.5291
 epoch: 27, train_loss: 0.8191, test_loss: 0.8737, test_f1: 0.5406
 epoch: 28, train_loss: 0.8139, test_loss: 0.8564, test_f1: 0.5457
 epoch: 29, train_loss: 0.8028, test_loss: 0.8585, test_f1: 0.5489
 epoch: 30, train_loss: 0.7987, test_loss: 0.8500, test_f1: 0.5413
 epoch: 31, train_loss: 0.7902, test_loss: 0.8543, test_f1: 0.5582
 epoch: 32, train_loss: 0.7876, test_loss: 0.8562, test_f1: 0.5544
 epoch: 33, train_loss: 0.7856, test_loss: 0.8545, test_f1: 0.5442
 epoch: 34, train_loss: 0.7700, test_loss: 0.8655, test_f1: 0.5493
 epoch: 35, train_loss: 0.7671, test_loss: 0.8499, test_f1: 0.5491
 epoch: 36, train_loss: 0.7698, test_loss: 0.8500, test_f1: 0.5462
 epoch: 37, train_loss: 0.7608, test_loss: 0.8378, test_f1: 0.5527
 epoch: 38, train_loss: 0.7570, test_loss: 0.8474, test_f1: 0.5500
 epoch: 39, train_loss: 0.7459, test_loss: 0.8593, test_f1: 0.5435
 epoch: 40, train_loss: 0.7484, test_loss: 0.8527, test_f1: 0.5487
 epoch: 41, train_loss: 0.7431, test_loss: 0.8501, test_f1: 0.5599
 epoch: 42, train_loss: 0.7318, test_loss: 0.8333, test_f1: 0.5516
 epoch: 43, train_loss: 0.7320, test_loss: 0.8348, test_f1: 0.5672
 epoch: 44, train_loss: 0.7212, test_loss: 0.8344, test_f1: 0.5561
 epoch: 45, train_loss: 0.7199, test_loss: 0.8465, test_f1: 0.5740
 epoch: 46, train_loss: 0.7193, test_loss: 0.8344, test_f1: 0.5770
 epoch: 47, train_loss: 0.7200, test_loss: 0.8807, test_f1: 0.5502
 epoch: 48, train_loss: 0.7150, test_loss: 0.8440, test_f1: 0.5655
 epoch: 49, train_loss: 0.7049, test_loss: 0.8505, test_f1: 0.5740
 epoch: 50, train_loss: 0.7046, test_loss: 0.8554, test_f1: 0.5532
 epoch: 51, train_loss: 0.6964, test_loss: 0.8594, test_f1: 0.5609
 epoch: 52, train_loss: 0.6899, test_loss: 0.8518, test_f1: 0.5622
 epoch: 53, train_loss: 0.6756, test_loss: 0.8495, test_f1: 0.5713
 epoch: 54, train_loss: 0.6852, test_loss: 0.8503, test_f1: 0.5764
 epoch: 55, train_loss: 0.6795, test_loss: 0.8536, test_f1: 0.5775
 epoch: 56, train_loss: 0.6814, test_loss: 0.8477, test_f1: 0.5787
 epoch: 57, train_loss: 0.6720, test_loss: 0.8605, test_f1: 0.5836
 epoch: 58, train_loss: 0.6704, test_loss: 0.8582, test_f1: 0.5794
 epoch: 59, train_loss: 0.6587, test_loss: 0.8455, test_f1: 0.5803
 epoch: 60, train_loss: 0.6633, test_loss: 0.8496, test_f1: 0.5820
 epoch: 61, train_loss: 0.6727, test_loss: 0.8593, test_f1: 0.5803
 epoch: 62, train_loss: 0.6648, test_loss: 0.8788, test_f1: 0.5830
 epoch: 63, train_loss: 0.6632, test_loss: 0.8515, test_f1: 0.5884
 epoch: 64, train_loss: 0.6560, test_loss: 0.8577, test_f1: 0.5910
 epoch: 65, train_loss: 0.6547, test_loss: 0.8508, test_f1: 0.5802
 epoch: 66, train_loss: 0.6584, test_loss: 0.8581, test_f1: 0.5831
 epoch: 67, train_loss: 0.6505, test_loss: 0.8466, test_f1: 0.5902
 epoch: 68, train_loss: 0.6468, test_loss: 0.8717, test_f1: 0.5744
 epoch: 69, train_loss: 0.6506, test_loss: 0.8614, test_f1: 0.5732
 epoch: 70, train_loss: 0.6483, test_loss: 0.8570, test_f1: 0.5771
 epoch: 71, train_loss: 0.6471, test_loss: 0.8893, test_f1: 0.5873
 epoch: 72, train_loss: 0.6364, test_loss: 0.8665, test_f1: 0.5899
 epoch: 73, train_loss: 0.6340, test_loss: 0.8600, test_f1: 0.5907
 epoch: 74, train_loss: 0.6355, test_loss: 0.8659, test_f1: 0.5802
 epoch: 75, train_loss: 0.6321, test_loss: 0.8633, test_f1: 0.5802
 epoch: 76, train_loss: 0.6289, test_loss: 0.8723, test_f1: 0.5735
 epoch: 77, train_loss: 0.6311, test_loss: 0.8572, test_f1: 0.5988
 epoch: 78, train_loss: 0.6299, test_loss: 0.8678, test_f1: 0.5701
 epoch: 79, train_loss: 0.6320, test_loss: 0.8785, test_f1: 0.5814
 epoch: 80, train_loss: 0.6338, test_loss: 0.8642, test_f1: 0.5847
 epoch: 81, train_loss: 0.6145, test_loss: 0.8643, test_f1: 0.5922
 epoch: 82, train_loss: 0.6186, test_loss: 0.8513, test_f1: 0.5914
 epoch: 83, train_loss: 0.6173, test_loss: 0.8732, test_f1: 0.5935
 epoch: 84, train_loss: 0.6169, test_loss: 0.8628, test_f1: 0.5975
 epoch: 85, train_loss: 0.6078, test_loss: 0.8805, test_f1: 0.5908
 epoch: 86, train_loss: 0.6088, test_loss: 0.8730, test_f1: 0.5798
 epoch: 87, train_loss: 0.6177, test_loss: 0.8865, test_f1: 0.6029
 epoch: 88, train_loss: 0.6068, test_loss: 0.8904, test_f1: 0.5919
 epoch: 89, train_loss: 0.6129, test_loss: 0.8916, test_f1: 0.5824
 epoch: 90, train_loss: 0.6081, test_loss: 0.8805, test_f1: 0.6088
 epoch: 91, train_loss: 0.6049, test_loss: 0.8951, test_f1: 0.5919
 epoch: 92, train_loss: 0.6064, test_loss: 0.8885, test_f1: 0.6015
 epoch: 93, train_loss: 0.6047, test_loss: 0.8996, test_f1: 0.5862
 epoch: 94, train_loss: 0.5962, test_loss: 0.8915, test_f1: 0.5919
 epoch: 95, train_loss: 0.6006, test_loss: 0.8901, test_f1: 0.5906
 epoch: 96, train_loss: 0.6017, test_loss: 0.9084, test_f1: 0.6091
 epoch: 97, train_loss: 0.5950, test_loss: 0.8799, test_f1: 0.6294
 epoch: 98, train_loss: 0.5859, test_loss: 0.9233, test_f1: 0.5760
 epoch: 99, train_loss: 0.5884, test_loss: 0.8976, test_f1: 0.6250
##################ITERATION #3 ****************************************
 epoch: 0, train_loss: 1.2701, test_loss: 1.3405, test_f1: 0.2270
 epoch: 1, train_loss: 1.1569, test_loss: 1.3121, test_f1: 0.2270
 epoch: 2, train_loss: 1.1093, test_loss: 1.2328, test_f1: 0.3450
 epoch: 3, train_loss: 1.0679, test_loss: 1.1083, test_f1: 0.4031
 epoch: 4, train_loss: 1.0416, test_loss: 1.0346, test_f1: 0.4500
 epoch: 5, train_loss: 1.0156, test_loss: 0.9983, test_f1: 0.4836
 epoch: 6, train_loss: 0.9984, test_loss: 0.9784, test_f1: 0.4892
 epoch: 7, train_loss: 0.9805, test_loss: 0.9678, test_f1: 0.5115
 epoch: 8, train_loss: 0.9799, test_loss: 0.9617, test_f1: 0.5103
 epoch: 9, train_loss: 0.9597, test_loss: 0.9495, test_f1: 0.4933
 epoch: 10, train_loss: 0.9465, test_loss: 0.9424, test_f1: 0.5093
 epoch: 11, train_loss: 0.9425, test_loss: 0.9359, test_f1: 0.5293
 epoch: 12, train_loss: 0.9344, test_loss: 0.9283, test_f1: 0.5114
 epoch: 13, train_loss: 0.9263, test_loss: 0.9269, test_f1: 0.5265
 epoch: 14, train_loss: 0.9159, test_loss: 0.9160, test_f1: 0.5423
 epoch: 15, train_loss: 0.9061, test_loss: 0.9071, test_f1: 0.5391
 epoch: 16, train_loss: 0.9041, test_loss: 0.9029, test_f1: 0.5419
 epoch: 17, train_loss: 0.8920, test_loss: 0.8990, test_f1: 0.5443
 epoch: 18, train_loss: 0.8809, test_loss: 0.8931, test_f1: 0.5295
 epoch: 19, train_loss: 0.8785, test_loss: 0.8960, test_f1: 0.5474
 epoch: 20, train_loss: 0.8707, test_loss: 0.8792, test_f1: 0.5406
 epoch: 21, train_loss: 0.8584, test_loss: 0.8830, test_f1: 0.5292
 epoch: 22, train_loss: 0.8473, test_loss: 0.8725, test_f1: 0.5422
 epoch: 23, train_loss: 0.8381, test_loss: 0.8693, test_f1: 0.5588
 epoch: 24, train_loss: 0.8379, test_loss: 0.8624, test_f1: 0.5466
 epoch: 25, train_loss: 0.8317, test_loss: 0.8627, test_f1: 0.5434
 epoch: 26, train_loss: 0.8342, test_loss: 0.8581, test_f1: 0.5598
 epoch: 27, train_loss: 0.8176, test_loss: 0.8542, test_f1: 0.5670
 epoch: 28, train_loss: 0.8165, test_loss: 0.8466, test_f1: 0.5593
 epoch: 29, train_loss: 0.8066, test_loss: 0.8585, test_f1: 0.5497
 epoch: 30, train_loss: 0.8042, test_loss: 0.8553, test_f1: 0.5630
 epoch: 31, train_loss: 0.7930, test_loss: 0.8540, test_f1: 0.5632
 epoch: 32, train_loss: 0.7863, test_loss: 0.8409, test_f1: 0.5602
 epoch: 33, train_loss: 0.7795, test_loss: 0.8374, test_f1: 0.5713
 epoch: 34, train_loss: 0.7691, test_loss: 0.8519, test_f1: 0.5731
 epoch: 35, train_loss: 0.7704, test_loss: 0.8469, test_f1: 0.5657
 epoch: 36, train_loss: 0.7626, test_loss: 0.8436, test_f1: 0.5669
 epoch: 37, train_loss: 0.7579, test_loss: 0.8416, test_f1: 0.5769
 epoch: 38, train_loss: 0.7533, test_loss: 0.8360, test_f1: 0.5722
 epoch: 39, train_loss: 0.7450, test_loss: 0.8389, test_f1: 0.5701
 epoch: 40, train_loss: 0.7375, test_loss: 0.8481, test_f1: 0.5891
 epoch: 41, train_loss: 0.7382, test_loss: 0.8473, test_f1: 0.5626
 epoch: 42, train_loss: 0.7268, test_loss: 0.8422, test_f1: 0.5738
 epoch: 43, train_loss: 0.7260, test_loss: 0.8349, test_f1: 0.5693
 epoch: 44, train_loss: 0.7196, test_loss: 0.8640, test_f1: 0.5848
 epoch: 45, train_loss: 0.7166, test_loss: 0.8367, test_f1: 0.5693
 epoch: 46, train_loss: 0.7073, test_loss: 0.8389, test_f1: 0.5693
 epoch: 47, train_loss: 0.7000, test_loss: 0.8253, test_f1: 0.5937
 epoch: 48, train_loss: 0.7070, test_loss: 0.8475, test_f1: 0.5816
 epoch: 49, train_loss: 0.7006, test_loss: 0.8624, test_f1: 0.5610
 epoch: 50, train_loss: 0.6975, test_loss: 0.8346, test_f1: 0.5934
 epoch: 51, train_loss: 0.6783, test_loss: 0.8326, test_f1: 0.5773
 epoch: 52, train_loss: 0.6786, test_loss: 0.8445, test_f1: 0.5899
 epoch: 53, train_loss: 0.6782, test_loss: 0.8272, test_f1: 0.6037
 epoch: 54, train_loss: 0.6783, test_loss: 0.8316, test_f1: 0.5839
 epoch: 55, train_loss: 0.6628, test_loss: 0.8444, test_f1: 0.6218
 epoch: 56, train_loss: 0.6695, test_loss: 0.8417, test_f1: 0.5775
 epoch: 57, train_loss: 0.6659, test_loss: 0.8338, test_f1: 0.5906
 epoch: 58, train_loss: 0.6550, test_loss: 0.8441, test_f1: 0.6223
 epoch: 59, train_loss: 0.6595, test_loss: 0.8430, test_f1: 0.5951
 epoch: 60, train_loss: 0.6554, test_loss: 0.8350, test_f1: 0.6110
 epoch: 61, train_loss: 0.6500, test_loss: 0.8407, test_f1: 0.6273
 epoch: 62, train_loss: 0.6525, test_loss: 0.8416, test_f1: 0.5974
 epoch: 63, train_loss: 0.6514, test_loss: 0.8410, test_f1: 0.6277
 epoch: 64, train_loss: 0.6491, test_loss: 0.8620, test_f1: 0.6355
 epoch: 65, train_loss: 0.6455, test_loss: 0.8540, test_f1: 0.5965
 epoch: 66, train_loss: 0.6394, test_loss: 0.8556, test_f1: 0.5986
 epoch: 67, train_loss: 0.6364, test_loss: 0.8459, test_f1: 0.6248
 epoch: 68, train_loss: 0.6297, test_loss: 0.8585, test_f1: 0.6140
 epoch: 69, train_loss: 0.6322, test_loss: 0.8835, test_f1: 0.5879
 epoch: 70, train_loss: 0.6435, test_loss: 0.8582, test_f1: 0.6216
 epoch: 71, train_loss: 0.6388, test_loss: 0.8619, test_f1: 0.6064
 epoch: 72, train_loss: 0.6267, test_loss: 0.8621, test_f1: 0.6293
 epoch: 73, train_loss: 0.6300, test_loss: 0.8559, test_f1: 0.6250
 epoch: 74, train_loss: 0.6361, test_loss: 0.8588, test_f1: 0.6200
 epoch: 75, train_loss: 0.6290, test_loss: 0.8627, test_f1: 0.6293
 epoch: 76, train_loss: 0.6271, test_loss: 0.8611, test_f1: 0.6042
 epoch: 77, train_loss: 0.6215, test_loss: 0.8674, test_f1: 0.6291
 epoch: 78, train_loss: 0.6207, test_loss: 0.8640, test_f1: 0.6261
 epoch: 79, train_loss: 0.6113, test_loss: 0.8734, test_f1: 0.6295
 epoch: 80, train_loss: 0.6097, test_loss: 0.8736, test_f1: 0.6290
 epoch: 81, train_loss: 0.6139, test_loss: 0.8753, test_f1: 0.6160
 epoch: 82, train_loss: 0.6080, test_loss: 0.8765, test_f1: 0.6186
 epoch: 83, train_loss: 0.6081, test_loss: 0.8675, test_f1: 0.6296
 epoch: 84, train_loss: 0.6067, test_loss: 0.8972, test_f1: 0.6250
 epoch: 85, train_loss: 0.5992, test_loss: 0.8962, test_f1: 0.6181
 epoch: 86, train_loss: 0.6058, test_loss: 0.8965, test_f1: 0.6173
 epoch: 87, train_loss: 0.6115, test_loss: 0.8819, test_f1: 0.6343
 epoch: 88, train_loss: 0.5994, test_loss: 0.8990, test_f1: 0.6125
 epoch: 89, train_loss: 0.6012, test_loss: 0.8849, test_f1: 0.6218
 epoch: 90, train_loss: 0.6006, test_loss: 0.8953, test_f1: 0.6151
 epoch: 91, train_loss: 0.6013, test_loss: 0.9032, test_f1: 0.6157
 epoch: 92, train_loss: 0.5910, test_loss: 0.8909, test_f1: 0.6298
 epoch: 93, train_loss: 0.5911, test_loss: 0.8935, test_f1: 0.6124
 epoch: 94, train_loss: 0.5920, test_loss: 0.9033, test_f1: 0.6200
 epoch: 95, train_loss: 0.5778, test_loss: 0.9288, test_f1: 0.6157
 epoch: 96, train_loss: 0.5903, test_loss: 0.9073, test_f1: 0.6239
 epoch: 97, train_loss: 0.5796, test_loss: 0.9146, test_f1: 0.6239
 epoch: 98, train_loss: 0.5817, test_loss: 0.9197, test_f1: 0.6235
 epoch: 99, train_loss: 0.5822, test_loss: 0.9309, test_f1: 0.6262
##################ITERATION #4 ****************************************
 epoch: 0, train_loss: 1.2454, test_loss: 1.3124, test_f1: 0.2270
 epoch: 1, train_loss: 1.1266, test_loss: 1.2815, test_f1: 0.2270
 epoch: 2, train_loss: 1.0751, test_loss: 1.2178, test_f1: 0.2320
 epoch: 3, train_loss: 1.0393, test_loss: 1.0946, test_f1: 0.3893
 epoch: 4, train_loss: 1.0079, test_loss: 1.0195, test_f1: 0.4569
 epoch: 5, train_loss: 0.9907, test_loss: 0.9874, test_f1: 0.4760
 epoch: 6, train_loss: 0.9715, test_loss: 0.9619, test_f1: 0.5010
 epoch: 7, train_loss: 0.9596, test_loss: 0.9512, test_f1: 0.5301
 epoch: 8, train_loss: 0.9541, test_loss: 0.9369, test_f1: 0.5279
 epoch: 9, train_loss: 0.9337, test_loss: 0.9350, test_f1: 0.5313
 epoch: 10, train_loss: 0.9268, test_loss: 0.9299, test_f1: 0.5356
 epoch: 11, train_loss: 0.9171, test_loss: 0.9219, test_f1: 0.5291
 epoch: 12, train_loss: 0.9074, test_loss: 0.9160, test_f1: 0.5325
 epoch: 13, train_loss: 0.8939, test_loss: 0.9137, test_f1: 0.5339
 epoch: 14, train_loss: 0.8876, test_loss: 0.8982, test_f1: 0.5620
 epoch: 15, train_loss: 0.8813, test_loss: 0.8944, test_f1: 0.5822
 epoch: 16, train_loss: 0.8656, test_loss: 0.8838, test_f1: 0.5597
 epoch: 17, train_loss: 0.8614, test_loss: 0.8815, test_f1: 0.5472
 epoch: 18, train_loss: 0.8538, test_loss: 0.8705, test_f1: 0.5615
 epoch: 19, train_loss: 0.8486, test_loss: 0.8738, test_f1: 0.5679
 epoch: 20, train_loss: 0.8366, test_loss: 0.8607, test_f1: 0.5699
 epoch: 21, train_loss: 0.8413, test_loss: 0.8564, test_f1: 0.5490
 epoch: 22, train_loss: 0.8322, test_loss: 0.8541, test_f1: 0.5669
 epoch: 23, train_loss: 0.8221, test_loss: 0.8585, test_f1: 0.5559
 epoch: 24, train_loss: 0.8199, test_loss: 0.8361, test_f1: 0.5692
 epoch: 25, train_loss: 0.8072, test_loss: 0.8380, test_f1: 0.5751
 epoch: 26, train_loss: 0.7991, test_loss: 0.8277, test_f1: 0.5748
 epoch: 27, train_loss: 0.7999, test_loss: 0.8407, test_f1: 0.5794
 epoch: 28, train_loss: 0.7880, test_loss: 0.8341, test_f1: 0.5671
 epoch: 29, train_loss: 0.7889, test_loss: 0.8238, test_f1: 0.5724
 epoch: 30, train_loss: 0.7800, test_loss: 0.8630, test_f1: 0.5636
 epoch: 31, train_loss: 0.7748, test_loss: 0.8385, test_f1: 0.5761
 epoch: 32, train_loss: 0.7614, test_loss: 0.8063, test_f1: 0.5816
 epoch: 33, train_loss: 0.7649, test_loss: 0.7990, test_f1: 0.5928
 epoch: 34, train_loss: 0.7554, test_loss: 0.8157, test_f1: 0.6013
 epoch: 35, train_loss: 0.7503, test_loss: 0.8066, test_f1: 0.5761
 epoch: 36, train_loss: 0.7467, test_loss: 0.7917, test_f1: 0.5820
 epoch: 37, train_loss: 0.7416, test_loss: 0.7879, test_f1: 0.5955
 epoch: 38, train_loss: 0.7314, test_loss: 0.8447, test_f1: 0.5821
 epoch: 39, train_loss: 0.7368, test_loss: 0.7842, test_f1: 0.5892
 epoch: 40, train_loss: 0.7293, test_loss: 0.7912, test_f1: 0.5847
 epoch: 41, train_loss: 0.7192, test_loss: 0.7969, test_f1: 0.5963
 epoch: 42, train_loss: 0.7159, test_loss: 0.7811, test_f1: 0.6000
 epoch: 43, train_loss: 0.7088, test_loss: 0.7930, test_f1: 0.5992
 epoch: 44, train_loss: 0.7090, test_loss: 0.7975, test_f1: 0.5857
 epoch: 45, train_loss: 0.7109, test_loss: 0.7787, test_f1: 0.5947
 epoch: 46, train_loss: 0.6967, test_loss: 0.7886, test_f1: 0.5994
 epoch: 47, train_loss: 0.6963, test_loss: 0.7971, test_f1: 0.5845
 epoch: 48, train_loss: 0.6809, test_loss: 0.7855, test_f1: 0.6121
 epoch: 49, train_loss: 0.6837, test_loss: 0.8058, test_f1: 0.6005
 epoch: 50, train_loss: 0.6822, test_loss: 0.8022, test_f1: 0.6116
 epoch: 51, train_loss: 0.6670, test_loss: 0.7558, test_f1: 0.6235
 epoch: 52, train_loss: 0.6693, test_loss: 0.7679, test_f1: 0.6088
 epoch: 53, train_loss: 0.6613, test_loss: 0.7734, test_f1: 0.6061
 epoch: 54, train_loss: 0.6678, test_loss: 0.7779, test_f1: 0.6033
 epoch: 55, train_loss: 0.6630, test_loss: 0.7678, test_f1: 0.6094
 epoch: 56, train_loss: 0.6541, test_loss: 0.7900, test_f1: 0.5983
 epoch: 57, train_loss: 0.6506, test_loss: 0.7733, test_f1: 0.5993
 epoch: 58, train_loss: 0.6468, test_loss: 0.7737, test_f1: 0.6140
 epoch: 59, train_loss: 0.6476, test_loss: 0.7679, test_f1: 0.6043
 epoch: 60, train_loss: 0.6487, test_loss: 0.7613, test_f1: 0.6039
 epoch: 61, train_loss: 0.6369, test_loss: 0.7704, test_f1: 0.6110
 epoch: 62, train_loss: 0.6372, test_loss: 0.7836, test_f1: 0.6121
 epoch: 63, train_loss: 0.6423, test_loss: 0.7603, test_f1: 0.6207
 epoch: 64, train_loss: 0.6332, test_loss: 0.7653, test_f1: 0.6114
 epoch: 65, train_loss: 0.6406, test_loss: 0.7643, test_f1: 0.6072
 epoch: 66, train_loss: 0.6252, test_loss: 0.7672, test_f1: 0.6040
 epoch: 67, train_loss: 0.6281, test_loss: 0.7673, test_f1: 0.6172
 epoch: 68, train_loss: 0.6277, test_loss: 0.7651, test_f1: 0.6181
 epoch: 69, train_loss: 0.6256, test_loss: 0.7717, test_f1: 0.6075
 epoch: 70, train_loss: 0.6257, test_loss: 0.7776, test_f1: 0.6232
 epoch: 71, train_loss: 0.6250, test_loss: 0.7885, test_f1: 0.6228
 epoch: 72, train_loss: 0.6125, test_loss: 0.7977, test_f1: 0.5996
 epoch: 73, train_loss: 0.6137, test_loss: 0.7709, test_f1: 0.6042
 epoch: 74, train_loss: 0.6200, test_loss: 0.7644, test_f1: 0.6131
 epoch: 75, train_loss: 0.6189, test_loss: 0.7950, test_f1: 0.6157
 epoch: 76, train_loss: 0.6232, test_loss: 0.7827, test_f1: 0.6179
 epoch: 77, train_loss: 0.6143, test_loss: 0.7849, test_f1: 0.6069
 epoch: 78, train_loss: 0.5971, test_loss: 0.7882, test_f1: 0.6421
 epoch: 79, train_loss: 0.6027, test_loss: 0.7859, test_f1: 0.6203
 epoch: 80, train_loss: 0.5965, test_loss: 0.7973, test_f1: 0.6236
 epoch: 81, train_loss: 0.6054, test_loss: 0.7811, test_f1: 0.6312
 epoch: 82, train_loss: 0.5992, test_loss: 0.7979, test_f1: 0.6357
 epoch: 83, train_loss: 0.5893, test_loss: 0.7660, test_f1: 0.6400
 epoch: 84, train_loss: 0.5909, test_loss: 0.7939, test_f1: 0.6499
 epoch: 85, train_loss: 0.5992, test_loss: 0.7784, test_f1: 0.6456
 epoch: 86, train_loss: 0.5919, test_loss: 0.7849, test_f1: 0.6436
 epoch: 87, train_loss: 0.5866, test_loss: 0.8448, test_f1: 0.6262
 epoch: 88, train_loss: 0.5837, test_loss: 0.7936, test_f1: 0.6336
 epoch: 89, train_loss: 0.5923, test_loss: 0.8167, test_f1: 0.6396
 epoch: 90, train_loss: 0.5845, test_loss: 0.7925, test_f1: 0.6411
 epoch: 91, train_loss: 0.5810, test_loss: 0.8098, test_f1: 0.6419
 epoch: 92, train_loss: 0.5760, test_loss: 0.7938, test_f1: 0.6550
 epoch: 93, train_loss: 0.5802, test_loss: 0.7916, test_f1: 0.6541
 epoch: 94, train_loss: 0.5669, test_loss: 0.8302, test_f1: 0.6360
 epoch: 95, train_loss: 0.5634, test_loss: 0.8386, test_f1: 0.6419
 epoch: 96, train_loss: 0.5669, test_loss: 0.7978, test_f1: 0.6727
 epoch: 97, train_loss: 0.5608, test_loss: 0.8103, test_f1: 0.6479
 epoch: 98, train_loss: 0.5631, test_loss: 0.7973, test_f1: 0.6532
 epoch: 99, train_loss: 0.5693, test_loss: 0.8125, test_f1: 0.6513
##################ITERATION #5 ****************************************
 epoch: 0, train_loss: 1.2543, test_loss: 1.3158, test_f1: 0.2270
 epoch: 1, train_loss: 1.1264, test_loss: 1.2815, test_f1: 0.2194
 epoch: 2, train_loss: 1.0722, test_loss: 1.2315, test_f1: 0.2386
 epoch: 3, train_loss: 1.0327, test_loss: 1.1318, test_f1: 0.3985
 epoch: 4, train_loss: 1.0076, test_loss: 1.0372, test_f1: 0.4912
 epoch: 5, train_loss: 0.9915, test_loss: 1.0037, test_f1: 0.5168
 epoch: 6, train_loss: 0.9756, test_loss: 0.9864, test_f1: 0.5166
 epoch: 7, train_loss: 0.9630, test_loss: 0.9790, test_f1: 0.5246
 epoch: 8, train_loss: 0.9539, test_loss: 0.9621, test_f1: 0.5291
 epoch: 9, train_loss: 0.9423, test_loss: 0.9572, test_f1: 0.5385
 epoch: 10, train_loss: 0.9324, test_loss: 0.9476, test_f1: 0.5366
 epoch: 11, train_loss: 0.9214, test_loss: 0.9365, test_f1: 0.5406
 epoch: 12, train_loss: 0.9112, test_loss: 0.9334, test_f1: 0.5411
 epoch: 13, train_loss: 0.9059, test_loss: 0.9227, test_f1: 0.5531
 epoch: 14, train_loss: 0.8941, test_loss: 0.9301, test_f1: 0.5420
 epoch: 15, train_loss: 0.8815, test_loss: 0.9089, test_f1: 0.5482
 epoch: 16, train_loss: 0.8819, test_loss: 0.9053, test_f1: 0.5480
 epoch: 17, train_loss: 0.8703, test_loss: 0.8918, test_f1: 0.5612
 epoch: 18, train_loss: 0.8652, test_loss: 0.8817, test_f1: 0.5544
 epoch: 19, train_loss: 0.8516, test_loss: 0.8725, test_f1: 0.5774
 epoch: 20, train_loss: 0.8477, test_loss: 0.8722, test_f1: 0.5585
 epoch: 21, train_loss: 0.8423, test_loss: 0.8545, test_f1: 0.5614
 epoch: 22, train_loss: 0.8284, test_loss: 0.8459, test_f1: 0.5602
 epoch: 23, train_loss: 0.8198, test_loss: 0.8374, test_f1: 0.5623
 epoch: 24, train_loss: 0.8081, test_loss: 0.8408, test_f1: 0.5532
 epoch: 25, train_loss: 0.8092, test_loss: 0.8533, test_f1: 0.5566
 epoch: 26, train_loss: 0.7962, test_loss: 0.8560, test_f1: 0.5814
 epoch: 27, train_loss: 0.7933, test_loss: 0.8186, test_f1: 0.5672
 epoch: 28, train_loss: 0.7914, test_loss: 0.8488, test_f1: 0.5716
 epoch: 29, train_loss: 0.7739, test_loss: 0.8358, test_f1: 0.5730
 epoch: 30, train_loss: 0.7622, test_loss: 0.8269, test_f1: 0.5670
 epoch: 31, train_loss: 0.7610, test_loss: 0.8246, test_f1: 0.6001
 epoch: 32, train_loss: 0.7610, test_loss: 0.8300, test_f1: 0.5858
 epoch: 33, train_loss: 0.7506, test_loss: 0.8015, test_f1: 0.5796
 epoch: 34, train_loss: 0.7443, test_loss: 0.8354, test_f1: 0.5771
 epoch: 35, train_loss: 0.7381, test_loss: 0.8264, test_f1: 0.5764
 epoch: 36, train_loss: 0.7413, test_loss: 0.8159, test_f1: 0.5829
 epoch: 37, train_loss: 0.7247, test_loss: 0.8142, test_f1: 0.5997
 epoch: 38, train_loss: 0.7218, test_loss: 0.8441, test_f1: 0.6006
 epoch: 39, train_loss: 0.7210, test_loss: 0.8169, test_f1: 0.5818
 epoch: 40, train_loss: 0.7080, test_loss: 0.8198, test_f1: 0.6090
 epoch: 41, train_loss: 0.7087, test_loss: 0.7989, test_f1: 0.5920
 epoch: 42, train_loss: 0.6968, test_loss: 0.8187, test_f1: 0.6210
 epoch: 43, train_loss: 0.7004, test_loss: 0.7942, test_f1: 0.6232
 epoch: 44, train_loss: 0.6929, test_loss: 0.8545, test_f1: 0.6035
 epoch: 45, train_loss: 0.6808, test_loss: 0.7865, test_f1: 0.6316
 epoch: 46, train_loss: 0.6706, test_loss: 0.8100, test_f1: 0.6000
 epoch: 47, train_loss: 0.6701, test_loss: 0.8132, test_f1: 0.6315
 epoch: 48, train_loss: 0.6582, test_loss: 0.8182, test_f1: 0.6057
 epoch: 49, train_loss: 0.6682, test_loss: 0.8323, test_f1: 0.6299
 epoch: 50, train_loss: 0.6465, test_loss: 0.8104, test_f1: 0.6529
 epoch: 51, train_loss: 0.6609, test_loss: 0.8023, test_f1: 0.6182
 epoch: 52, train_loss: 0.6402, test_loss: 0.8265, test_f1: 0.6457
 epoch: 53, train_loss: 0.6471, test_loss: 0.8098, test_f1: 0.6146
 epoch: 54, train_loss: 0.6423, test_loss: 0.8182, test_f1: 0.6283
 epoch: 55, train_loss: 0.6269, test_loss: 0.8120, test_f1: 0.6498
 epoch: 56, train_loss: 0.6335, test_loss: 0.8278, test_f1: 0.6395
 epoch: 57, train_loss: 0.6304, test_loss: 0.8201, test_f1: 0.6423
 epoch: 58, train_loss: 0.6295, test_loss: 0.8500, test_f1: 0.6215
 epoch: 59, train_loss: 0.6320, test_loss: 0.7988, test_f1: 0.6456
 epoch: 60, train_loss: 0.6238, test_loss: 0.8170, test_f1: 0.6344
 epoch: 61, train_loss: 0.6129, test_loss: 0.8439, test_f1: 0.6470
 epoch: 62, train_loss: 0.6103, test_loss: 0.8365, test_f1: 0.6315
 epoch: 63, train_loss: 0.6183, test_loss: 0.8392, test_f1: 0.6430
 epoch: 64, train_loss: 0.6064, test_loss: 0.8401, test_f1: 0.6523
 epoch: 65, train_loss: 0.6082, test_loss: 0.8225, test_f1: 0.6594
 epoch: 66, train_loss: 0.6092, test_loss: 0.8478, test_f1: 0.6439
 epoch: 67, train_loss: 0.6082, test_loss: 0.8418, test_f1: 0.6572
 epoch: 68, train_loss: 0.5987, test_loss: 0.8611, test_f1: 0.6481
 epoch: 69, train_loss: 0.5924, test_loss: 0.8280, test_f1: 0.6483
 epoch: 70, train_loss: 0.5847, test_loss: 0.8497, test_f1: 0.6419
 epoch: 71, train_loss: 0.5973, test_loss: 0.8456, test_f1: 0.6565
 epoch: 72, train_loss: 0.5935, test_loss: 0.8397, test_f1: 0.6614
 epoch: 73, train_loss: 0.5958, test_loss: 0.8559, test_f1: 0.6415
 epoch: 74, train_loss: 0.5830, test_loss: 0.8854, test_f1: 0.6422
 epoch: 75, train_loss: 0.5910, test_loss: 0.8521, test_f1: 0.6592
 epoch: 76, train_loss: 0.5919, test_loss: 0.8489, test_f1: 0.6611
 epoch: 77, train_loss: 0.5791, test_loss: 0.8798, test_f1: 0.6580
 epoch: 78, train_loss: 0.5907, test_loss: 0.8778, test_f1: 0.6408
 epoch: 79, train_loss: 0.5888, test_loss: 0.8687, test_f1: 0.6706
 epoch: 80, train_loss: 0.5745, test_loss: 0.8687, test_f1: 0.6652
 epoch: 81, train_loss: 0.5795, test_loss: 0.8626, test_f1: 0.6371
 epoch: 82, train_loss: 0.5795, test_loss: 0.8691, test_f1: 0.6619
 epoch: 83, train_loss: 0.5736, test_loss: 0.8990, test_f1: 0.6386
 epoch: 84, train_loss: 0.5741, test_loss: 0.8646, test_f1: 0.6633
 epoch: 85, train_loss: 0.5732, test_loss: 0.8888, test_f1: 0.6556
 epoch: 86, train_loss: 0.5679, test_loss: 0.8567, test_f1: 0.6636
 epoch: 87, train_loss: 0.5662, test_loss: 0.8422, test_f1: 0.6598
 epoch: 88, train_loss: 0.5640, test_loss: 0.8930, test_f1: 0.6585
 epoch: 89, train_loss: 0.5568, test_loss: 0.8555, test_f1: 0.6493
 epoch: 90, train_loss: 0.5563, test_loss: 0.8689, test_f1: 0.6674
 epoch: 91, train_loss: 0.5607, test_loss: 0.8892, test_f1: 0.6572
 epoch: 92, train_loss: 0.5479, test_loss: 0.8826, test_f1: 0.6567
 epoch: 93, train_loss: 0.5516, test_loss: 0.8804, test_f1: 0.6560
 epoch: 94, train_loss: 0.5537, test_loss: 0.8849, test_f1: 0.6482
 epoch: 95, train_loss: 0.5500, test_loss: 0.8670, test_f1: 0.6628
 epoch: 96, train_loss: 0.5414, test_loss: 0.8717, test_f1: 0.6572
 epoch: 97, train_loss: 0.5438, test_loss: 0.8815, test_f1: 0.6548
 epoch: 98, train_loss: 0.5468, test_loss: 0.8988, test_f1: 0.6604
 epoch: 99, train_loss: 0.5338, test_loss: 0.8894, test_f1: 0.6531
##################ITERATION #6 ****************************************
 epoch: 0, train_loss: 1.2829, test_loss: 1.2991, test_f1: 0.2270
 epoch: 1, train_loss: 1.1031, test_loss: 1.2769, test_f1: 0.2809
 epoch: 2, train_loss: 1.0541, test_loss: 1.2231, test_f1: 0.2184
 epoch: 3, train_loss: 1.0167, test_loss: 1.0718, test_f1: 0.4619
 epoch: 4, train_loss: 1.0063, test_loss: 1.0049, test_f1: 0.4928
 epoch: 5, train_loss: 0.9838, test_loss: 0.9708, test_f1: 0.5320
 epoch: 6, train_loss: 0.9624, test_loss: 0.9612, test_f1: 0.5291
 epoch: 7, train_loss: 0.9631, test_loss: 0.9491, test_f1: 0.5094
 epoch: 8, train_loss: 0.9463, test_loss: 0.9447, test_f1: 0.5269
 epoch: 9, train_loss: 0.9345, test_loss: 0.9321, test_f1: 0.5191
 epoch: 10, train_loss: 0.9243, test_loss: 0.9291, test_f1: 0.5411
 epoch: 11, train_loss: 0.9176, test_loss: 0.9232, test_f1: 0.5358
 epoch: 12, train_loss: 0.9061, test_loss: 0.9159, test_f1: 0.5479
 epoch: 13, train_loss: 0.8934, test_loss: 0.9138, test_f1: 0.5382
 epoch: 14, train_loss: 0.8954, test_loss: 0.9029, test_f1: 0.5543
 epoch: 15, train_loss: 0.8823, test_loss: 0.8978, test_f1: 0.5479
 epoch: 16, train_loss: 0.8705, test_loss: 0.8883, test_f1: 0.5595
 epoch: 17, train_loss: 0.8697, test_loss: 0.8880, test_f1: 0.5514
 epoch: 18, train_loss: 0.8608, test_loss: 0.8788, test_f1: 0.5475
 epoch: 19, train_loss: 0.8564, test_loss: 0.8793, test_f1: 0.5443
 epoch: 20, train_loss: 0.8517, test_loss: 0.8712, test_f1: 0.5515
 epoch: 21, train_loss: 0.8396, test_loss: 0.8776, test_f1: 0.5406
 epoch: 22, train_loss: 0.8329, test_loss: 0.8648, test_f1: 0.5513
 epoch: 23, train_loss: 0.8300, test_loss: 0.8714, test_f1: 0.5555
 epoch: 24, train_loss: 0.8282, test_loss: 0.8660, test_f1: 0.5573
 epoch: 25, train_loss: 0.8062, test_loss: 0.8505, test_f1: 0.5569
 epoch: 26, train_loss: 0.8064, test_loss: 0.8647, test_f1: 0.5515
 epoch: 27, train_loss: 0.7985, test_loss: 0.8457, test_f1: 0.5693
 epoch: 28, train_loss: 0.7963, test_loss: 0.8423, test_f1: 0.5657
 epoch: 29, train_loss: 0.7848, test_loss: 0.8650, test_f1: 0.5566
 epoch: 30, train_loss: 0.7798, test_loss: 0.8405, test_f1: 0.5677
 epoch: 31, train_loss: 0.7830, test_loss: 0.8760, test_f1: 0.5692
 epoch: 32, train_loss: 0.7742, test_loss: 0.8501, test_f1: 0.5677
 epoch: 33, train_loss: 0.7681, test_loss: 0.8239, test_f1: 0.5641
 epoch: 34, train_loss: 0.7699, test_loss: 0.8516, test_f1: 0.5800
 epoch: 35, train_loss: 0.7537, test_loss: 0.8309, test_f1: 0.5924
 epoch: 36, train_loss: 0.7495, test_loss: 0.8326, test_f1: 0.5804
 epoch: 37, train_loss: 0.7419, test_loss: 0.8399, test_f1: 0.5891
 epoch: 38, train_loss: 0.7383, test_loss: 0.8204, test_f1: 0.5739
 epoch: 39, train_loss: 0.7407, test_loss: 0.8265, test_f1: 0.5864
 epoch: 40, train_loss: 0.7335, test_loss: 0.8293, test_f1: 0.6065
 epoch: 41, train_loss: 0.7406, test_loss: 0.8297, test_f1: 0.5894
 epoch: 42, train_loss: 0.7206, test_loss: 0.8371, test_f1: 0.5811
 epoch: 43, train_loss: 0.7173, test_loss: 0.8303, test_f1: 0.6066
 epoch: 44, train_loss: 0.7161, test_loss: 0.8260, test_f1: 0.5899
 epoch: 45, train_loss: 0.7143, test_loss: 0.8310, test_f1: 0.5902
 epoch: 46, train_loss: 0.6990, test_loss: 0.8238, test_f1: 0.5934
 epoch: 47, train_loss: 0.7005, test_loss: 0.8534, test_f1: 0.5756
 epoch: 48, train_loss: 0.6960, test_loss: 0.8321, test_f1: 0.5866
 epoch: 49, train_loss: 0.6884, test_loss: 0.8146, test_f1: 0.5784
 epoch: 50, train_loss: 0.6852, test_loss: 0.8197, test_f1: 0.5975
 epoch: 51, train_loss: 0.6740, test_loss: 0.8171, test_f1: 0.5940
 epoch: 52, train_loss: 0.6659, test_loss: 0.8203, test_f1: 0.5970
 epoch: 53, train_loss: 0.6784, test_loss: 0.8127, test_f1: 0.5874
 epoch: 54, train_loss: 0.6703, test_loss: 0.8156, test_f1: 0.6016
 epoch: 55, train_loss: 0.6583, test_loss: 0.8183, test_f1: 0.5993
 epoch: 56, train_loss: 0.6593, test_loss: 0.8197, test_f1: 0.6006
 epoch: 57, train_loss: 0.6597, test_loss: 0.8122, test_f1: 0.5967
 epoch: 58, train_loss: 0.6510, test_loss: 0.8130, test_f1: 0.6142
 epoch: 59, train_loss: 0.6520, test_loss: 0.8101, test_f1: 0.6138
 epoch: 60, train_loss: 0.6498, test_loss: 0.8122, test_f1: 0.6169
 epoch: 61, train_loss: 0.6525, test_loss: 0.8134, test_f1: 0.6038
 epoch: 62, train_loss: 0.6549, test_loss: 0.8139, test_f1: 0.6129
 epoch: 63, train_loss: 0.6390, test_loss: 0.8403, test_f1: 0.6067
 epoch: 64, train_loss: 0.6466, test_loss: 0.8079, test_f1: 0.6220
 epoch: 65, train_loss: 0.6410, test_loss: 0.8114, test_f1: 0.6169
 epoch: 66, train_loss: 0.6260, test_loss: 0.8072, test_f1: 0.6169
 epoch: 67, train_loss: 0.6349, test_loss: 0.8154, test_f1: 0.6048
 epoch: 68, train_loss: 0.6351, test_loss: 0.8177, test_f1: 0.6188
 epoch: 69, train_loss: 0.6425, test_loss: 0.8031, test_f1: 0.6091
 epoch: 70, train_loss: 0.6411, test_loss: 0.8210, test_f1: 0.6212
 epoch: 71, train_loss: 0.6351, test_loss: 0.8114, test_f1: 0.6082
 epoch: 72, train_loss: 0.6278, test_loss: 0.8161, test_f1: 0.6116
 epoch: 73, train_loss: 0.6330, test_loss: 0.8147, test_f1: 0.6195
 epoch: 74, train_loss: 0.6252, test_loss: 0.8092, test_f1: 0.6099
 epoch: 75, train_loss: 0.6245, test_loss: 0.8139, test_f1: 0.6162
 epoch: 76, train_loss: 0.6276, test_loss: 0.8249, test_f1: 0.6200
 epoch: 77, train_loss: 0.6208, test_loss: 0.8093, test_f1: 0.6096
 epoch: 78, train_loss: 0.6250, test_loss: 0.8232, test_f1: 0.6173
 epoch: 79, train_loss: 0.6074, test_loss: 0.8135, test_f1: 0.6135
 epoch: 80, train_loss: 0.6084, test_loss: 0.8120, test_f1: 0.6209
 epoch: 81, train_loss: 0.6144, test_loss: 0.8147, test_f1: 0.6159
 epoch: 82, train_loss: 0.6064, test_loss: 0.8055, test_f1: 0.6214
 epoch: 83, train_loss: 0.6000, test_loss: 0.8137, test_f1: 0.6207
 epoch: 84, train_loss: 0.6064, test_loss: 0.8054, test_f1: 0.6312
 epoch: 85, train_loss: 0.6039, test_loss: 0.8178, test_f1: 0.6261
 epoch: 86, train_loss: 0.6043, test_loss: 0.7960, test_f1: 0.6195
 epoch: 87, train_loss: 0.5986, test_loss: 0.8163, test_f1: 0.6223
 epoch: 88, train_loss: 0.5973, test_loss: 0.8221, test_f1: 0.6217
 epoch: 89, train_loss: 0.5958, test_loss: 0.8224, test_f1: 0.6128
 epoch: 90, train_loss: 0.5940, test_loss: 0.8285, test_f1: 0.6234
 epoch: 91, train_loss: 0.6021, test_loss: 0.8122, test_f1: 0.6188
 epoch: 92, train_loss: 0.5901, test_loss: 0.8285, test_f1: 0.6154
 epoch: 93, train_loss: 0.5816, test_loss: 0.8247, test_f1: 0.6242
 epoch: 94, train_loss: 0.5856, test_loss: 0.8136, test_f1: 0.6241
 epoch: 95, train_loss: 0.5867, test_loss: 0.8119, test_f1: 0.6209
 epoch: 96, train_loss: 0.5720, test_loss: 0.8115, test_f1: 0.6236
 epoch: 97, train_loss: 0.5776, test_loss: 0.8316, test_f1: 0.6165
 epoch: 98, train_loss: 0.5836, test_loss: 0.8231, test_f1: 0.6266
 epoch: 99, train_loss: 0.5760, test_loss: 0.8168, test_f1: 0.6327
##################ITERATION #7 ****************************************
 epoch: 0, train_loss: 1.2729, test_loss: 1.3150, test_f1: 0.2270
 epoch: 1, train_loss: 1.1022, test_loss: 1.3391, test_f1: 0.2270
 epoch: 2, train_loss: 1.0431, test_loss: 1.3484, test_f1: 0.2443
 epoch: 3, train_loss: 1.0030, test_loss: 1.1859, test_f1: 0.3258
 epoch: 4, train_loss: 0.9919, test_loss: 1.0125, test_f1: 0.4870
 epoch: 5, train_loss: 0.9733, test_loss: 0.9499, test_f1: 0.5257
 epoch: 6, train_loss: 0.9548, test_loss: 0.9282, test_f1: 0.5354
 epoch: 7, train_loss: 0.9448, test_loss: 0.9223, test_f1: 0.5347
 epoch: 8, train_loss: 0.9335, test_loss: 0.9133, test_f1: 0.5322
 epoch: 9, train_loss: 0.9180, test_loss: 0.9100, test_f1: 0.5306
 epoch: 10, train_loss: 0.9131, test_loss: 0.8972, test_f1: 0.5447
 epoch: 11, train_loss: 0.8973, test_loss: 0.8936, test_f1: 0.5390
 epoch: 12, train_loss: 0.8904, test_loss: 0.8806, test_f1: 0.5389
 epoch: 13, train_loss: 0.8766, test_loss: 0.8748, test_f1: 0.5449
 epoch: 14, train_loss: 0.8661, test_loss: 0.8796, test_f1: 0.5431
 epoch: 15, train_loss: 0.8537, test_loss: 0.8696, test_f1: 0.5459
 epoch: 16, train_loss: 0.8485, test_loss: 0.8728, test_f1: 0.5536
 epoch: 17, train_loss: 0.8420, test_loss: 0.8437, test_f1: 0.5551
 epoch: 18, train_loss: 0.8327, test_loss: 0.8493, test_f1: 0.5548
 epoch: 19, train_loss: 0.8241, test_loss: 0.8403, test_f1: 0.5624
 epoch: 20, train_loss: 0.8167, test_loss: 0.8288, test_f1: 0.5656
 epoch: 21, train_loss: 0.8063, test_loss: 0.8145, test_f1: 0.5775
 epoch: 22, train_loss: 0.8052, test_loss: 0.8128, test_f1: 0.5751
 epoch: 23, train_loss: 0.7919, test_loss: 0.8165, test_f1: 0.5779
 epoch: 24, train_loss: 0.7803, test_loss: 0.8042, test_f1: 0.5777
 epoch: 25, train_loss: 0.7826, test_loss: 0.7983, test_f1: 0.6053
 epoch: 26, train_loss: 0.7750, test_loss: 0.7996, test_f1: 0.5715
 epoch: 27, train_loss: 0.7750, test_loss: 0.7855, test_f1: 0.6108
 epoch: 28, train_loss: 0.7599, test_loss: 0.8088, test_f1: 0.5814
 epoch: 29, train_loss: 0.7520, test_loss: 0.7969, test_f1: 0.6006
 epoch: 30, train_loss: 0.7502, test_loss: 0.7861, test_f1: 0.5917
 epoch: 31, train_loss: 0.7352, test_loss: 0.7812, test_f1: 0.6170
 epoch: 32, train_loss: 0.7353, test_loss: 0.8031, test_f1: 0.5881
 epoch: 33, train_loss: 0.7383, test_loss: 0.7993, test_f1: 0.5830
 epoch: 34, train_loss: 0.7369, test_loss: 0.8035, test_f1: 0.5955
 epoch: 35, train_loss: 0.7233, test_loss: 0.7667, test_f1: 0.6081
 epoch: 36, train_loss: 0.7285, test_loss: 0.7798, test_f1: 0.5952
 epoch: 37, train_loss: 0.7141, test_loss: 0.7962, test_f1: 0.6009
 epoch: 38, train_loss: 0.7025, test_loss: 0.7880, test_f1: 0.5880
 epoch: 39, train_loss: 0.6934, test_loss: 0.7738, test_f1: 0.6121
 epoch: 40, train_loss: 0.7032, test_loss: 0.7819, test_f1: 0.6042
 epoch: 41, train_loss: 0.6958, test_loss: 0.8016, test_f1: 0.6047
 epoch: 42, train_loss: 0.6862, test_loss: 0.7663, test_f1: 0.6189
 epoch: 43, train_loss: 0.6880, test_loss: 0.7829, test_f1: 0.5995
 epoch: 44, train_loss: 0.6719, test_loss: 0.7846, test_f1: 0.6203
 epoch: 45, train_loss: 0.6729, test_loss: 0.7641, test_f1: 0.6051
 epoch: 46, train_loss: 0.6722, test_loss: 0.7883, test_f1: 0.6356
 epoch: 47, train_loss: 0.6641, test_loss: 0.7451, test_f1: 0.6223
 epoch: 48, train_loss: 0.6625, test_loss: 0.7749, test_f1: 0.6064
 epoch: 49, train_loss: 0.6522, test_loss: 0.7708, test_f1: 0.5950
 epoch: 50, train_loss: 0.6422, test_loss: 0.7569, test_f1: 0.6320
 epoch: 51, train_loss: 0.6430, test_loss: 0.7520, test_f1: 0.6049
 epoch: 52, train_loss: 0.6370, test_loss: 0.7768, test_f1: 0.6234
 epoch: 53, train_loss: 0.6240, test_loss: 0.7822, test_f1: 0.6109
 epoch: 54, train_loss: 0.6316, test_loss: 0.7670, test_f1: 0.6151
 epoch: 55, train_loss: 0.6240, test_loss: 0.7648, test_f1: 0.6138
 epoch: 56, train_loss: 0.6209, test_loss: 0.7613, test_f1: 0.6371
 epoch: 57, train_loss: 0.6275, test_loss: 0.8005, test_f1: 0.6169
 epoch: 58, train_loss: 0.6217, test_loss: 0.7620, test_f1: 0.6377
 epoch: 59, train_loss: 0.6112, test_loss: 0.7638, test_f1: 0.6297
 epoch: 60, train_loss: 0.6166, test_loss: 0.7937, test_f1: 0.5999
 epoch: 61, train_loss: 0.6071, test_loss: 0.7791, test_f1: 0.6510
 epoch: 62, train_loss: 0.6067, test_loss: 0.7766, test_f1: 0.6118
 epoch: 63, train_loss: 0.6129, test_loss: 0.7847, test_f1: 0.6395
 epoch: 64, train_loss: 0.6038, test_loss: 0.7719, test_f1: 0.6323
 epoch: 65, train_loss: 0.6051, test_loss: 0.7745, test_f1: 0.6497
 epoch: 66, train_loss: 0.6051, test_loss: 0.7904, test_f1: 0.6325
 epoch: 67, train_loss: 0.6185, test_loss: 0.7868, test_f1: 0.6439
 epoch: 68, train_loss: 0.5950, test_loss: 0.7932, test_f1: 0.6225
 epoch: 69, train_loss: 0.5914, test_loss: 0.7832, test_f1: 0.6434
 epoch: 70, train_loss: 0.5903, test_loss: 0.7874, test_f1: 0.6311
 epoch: 71, train_loss: 0.5917, test_loss: 0.7904, test_f1: 0.6323
 epoch: 72, train_loss: 0.5881, test_loss: 0.7879, test_f1: 0.6512
 epoch: 73, train_loss: 0.5844, test_loss: 0.8053, test_f1: 0.6348
 epoch: 74, train_loss: 0.5797, test_loss: 0.8204, test_f1: 0.6373
 epoch: 75, train_loss: 0.5698, test_loss: 0.8041, test_f1: 0.6405
 epoch: 76, train_loss: 0.5932, test_loss: 0.7880, test_f1: 0.6537
 epoch: 77, train_loss: 0.5836, test_loss: 0.8303, test_f1: 0.6304
 epoch: 78, train_loss: 0.5762, test_loss: 0.8266, test_f1: 0.6426
 epoch: 79, train_loss: 0.5753, test_loss: 0.8446, test_f1: 0.6325
 epoch: 80, train_loss: 0.5683, test_loss: 0.8449, test_f1: 0.6379
 epoch: 81, train_loss: 0.5666, test_loss: 0.7976, test_f1: 0.6300
 epoch: 82, train_loss: 0.5738, test_loss: 0.8582, test_f1: 0.6407
 epoch: 83, train_loss: 0.5642, test_loss: 0.8247, test_f1: 0.6393
 epoch: 84, train_loss: 0.5664, test_loss: 0.8208, test_f1: 0.6269
 epoch: 85, train_loss: 0.5594, test_loss: 0.8221, test_f1: 0.6282
 epoch: 86, train_loss: 0.5544, test_loss: 0.8275, test_f1: 0.6345
 epoch: 87, train_loss: 0.5465, test_loss: 0.8145, test_f1: 0.6243
 epoch: 88, train_loss: 0.5582, test_loss: 0.8409, test_f1: 0.6267
 epoch: 89, train_loss: 0.5482, test_loss: 0.8248, test_f1: 0.6264
 epoch: 90, train_loss: 0.5463, test_loss: 0.8724, test_f1: 0.6274
 epoch: 91, train_loss: 0.5480, test_loss: 0.8384, test_f1: 0.6272
 epoch: 92, train_loss: 0.5486, test_loss: 0.8667, test_f1: 0.6263
 epoch: 93, train_loss: 0.5426, test_loss: 0.8383, test_f1: 0.6355
 epoch: 94, train_loss: 0.5410, test_loss: 0.8393, test_f1: 0.6159
 epoch: 95, train_loss: 0.5344, test_loss: 0.8460, test_f1: 0.6378
 epoch: 96, train_loss: 0.5372, test_loss: 0.8591, test_f1: 0.6265
 epoch: 97, train_loss: 0.5347, test_loss: 0.8324, test_f1: 0.6345
 epoch: 98, train_loss: 0.5354, test_loss: 0.8555, test_f1: 0.6337
 epoch: 99, train_loss: 0.5359, test_loss: 0.8620, test_f1: 0.6290
##################ITERATION #8 ****************************************
 epoch: 0, train_loss: 1.2219, test_loss: 1.3115, test_f1: 0.2270
 epoch: 1, train_loss: 1.0747, test_loss: 1.3317, test_f1: 0.2838
 epoch: 2, train_loss: 1.0353, test_loss: 1.2554, test_f1: 0.3205
 epoch: 3, train_loss: 1.0012, test_loss: 1.0534, test_f1: 0.4613
 epoch: 4, train_loss: 0.9866, test_loss: 0.9906, test_f1: 0.5045
 epoch: 5, train_loss: 0.9635, test_loss: 0.9612, test_f1: 0.5156
 epoch: 6, train_loss: 0.9526, test_loss: 0.9339, test_f1: 0.5221
 epoch: 7, train_loss: 0.9324, test_loss: 0.9235, test_f1: 0.5307
 epoch: 8, train_loss: 0.9229, test_loss: 0.9227, test_f1: 0.5438
 epoch: 9, train_loss: 0.9169, test_loss: 0.9248, test_f1: 0.5262
 epoch: 10, train_loss: 0.9147, test_loss: 0.9089, test_f1: 0.5450
 epoch: 11, train_loss: 0.9041, test_loss: 0.8999, test_f1: 0.5481
 epoch: 12, train_loss: 0.8876, test_loss: 0.8993, test_f1: 0.5569
 epoch: 13, train_loss: 0.8828, test_loss: 0.8946, test_f1: 0.5454
 epoch: 14, train_loss: 0.8680, test_loss: 0.8823, test_f1: 0.5454
 epoch: 15, train_loss: 0.8609, test_loss: 0.8756, test_f1: 0.5596
 epoch: 16, train_loss: 0.8536, test_loss: 0.8905, test_f1: 0.5350
 epoch: 17, train_loss: 0.8499, test_loss: 0.8726, test_f1: 0.5576
 epoch: 18, train_loss: 0.8378, test_loss: 0.8641, test_f1: 0.5645
 epoch: 19, train_loss: 0.8402, test_loss: 0.8702, test_f1: 0.5758
 epoch: 20, train_loss: 0.8175, test_loss: 0.8685, test_f1: 0.5674
 epoch: 21, train_loss: 0.8069, test_loss: 0.8513, test_f1: 0.5626
 epoch: 22, train_loss: 0.8065, test_loss: 0.8454, test_f1: 0.5636
 epoch: 23, train_loss: 0.7954, test_loss: 0.8431, test_f1: 0.5812
 epoch: 24, train_loss: 0.7946, test_loss: 0.8460, test_f1: 0.5543
 epoch: 25, train_loss: 0.7763, test_loss: 0.8466, test_f1: 0.5743
 epoch: 26, train_loss: 0.7780, test_loss: 0.8440, test_f1: 0.5830
 epoch: 27, train_loss: 0.7712, test_loss: 0.8463, test_f1: 0.5703
 epoch: 28, train_loss: 0.7663, test_loss: 0.8355, test_f1: 0.5907
 epoch: 29, train_loss: 0.7552, test_loss: 0.8353, test_f1: 0.5810
 epoch: 30, train_loss: 0.7549, test_loss: 0.8305, test_f1: 0.5879
 epoch: 31, train_loss: 0.7442, test_loss: 0.8480, test_f1: 0.5788
 epoch: 32, train_loss: 0.7424, test_loss: 0.8191, test_f1: 0.5850
 epoch: 33, train_loss: 0.7349, test_loss: 0.8404, test_f1: 0.5888
 epoch: 34, train_loss: 0.7332, test_loss: 0.8385, test_f1: 0.5839
 epoch: 35, train_loss: 0.7228, test_loss: 0.8288, test_f1: 0.5863
 epoch: 36, train_loss: 0.7209, test_loss: 0.8366, test_f1: 0.5913
 epoch: 37, train_loss: 0.7151, test_loss: 0.8308, test_f1: 0.5924
 epoch: 38, train_loss: 0.7032, test_loss: 0.8095, test_f1: 0.5971
 epoch: 39, train_loss: 0.7010, test_loss: 0.8185, test_f1: 0.6003
 epoch: 40, train_loss: 0.7073, test_loss: 0.8495, test_f1: 0.5930
 epoch: 41, train_loss: 0.6945, test_loss: 0.8119, test_f1: 0.5869
 epoch: 42, train_loss: 0.6894, test_loss: 0.8175, test_f1: 0.6195
 epoch: 43, train_loss: 0.6956, test_loss: 0.8356, test_f1: 0.6087
 epoch: 44, train_loss: 0.6867, test_loss: 0.8168, test_f1: 0.5963
 epoch: 45, train_loss: 0.6733, test_loss: 0.8150, test_f1: 0.6004
 epoch: 46, train_loss: 0.6688, test_loss: 0.8204, test_f1: 0.6160
 epoch: 47, train_loss: 0.6617, test_loss: 0.8116, test_f1: 0.6054
 epoch: 48, train_loss: 0.6565, test_loss: 0.8286, test_f1: 0.5836
 epoch: 49, train_loss: 0.6485, test_loss: 0.8288, test_f1: 0.6110
 epoch: 50, train_loss: 0.6583, test_loss: 0.8128, test_f1: 0.6058
 epoch: 51, train_loss: 0.6367, test_loss: 0.8118, test_f1: 0.6365
 epoch: 52, train_loss: 0.6353, test_loss: 0.8225, test_f1: 0.6235
 epoch: 53, train_loss: 0.6390, test_loss: 0.8348, test_f1: 0.6163
 epoch: 54, train_loss: 0.6365, test_loss: 0.8237, test_f1: 0.6299
 epoch: 55, train_loss: 0.6321, test_loss: 0.8318, test_f1: 0.6117
 epoch: 56, train_loss: 0.6304, test_loss: 0.8401, test_f1: 0.6189
 epoch: 57, train_loss: 0.6293, test_loss: 0.8336, test_f1: 0.6229
 epoch: 58, train_loss: 0.6218, test_loss: 0.8222, test_f1: 0.6136
 epoch: 59, train_loss: 0.6137, test_loss: 0.8327, test_f1: 0.6121
 epoch: 60, train_loss: 0.6218, test_loss: 0.8337, test_f1: 0.6276
 epoch: 61, train_loss: 0.6132, test_loss: 0.8376, test_f1: 0.6208
 epoch: 62, train_loss: 0.6145, test_loss: 0.8396, test_f1: 0.6411
 epoch: 63, train_loss: 0.6071, test_loss: 0.8454, test_f1: 0.6168
 epoch: 64, train_loss: 0.6124, test_loss: 0.8392, test_f1: 0.6334
 epoch: 65, train_loss: 0.6088, test_loss: 0.8330, test_f1: 0.6365
 epoch: 66, train_loss: 0.6130, test_loss: 0.8458, test_f1: 0.6200
 epoch: 67, train_loss: 0.6052, test_loss: 0.8480, test_f1: 0.6327
 epoch: 68, train_loss: 0.5960, test_loss: 0.8698, test_f1: 0.6156
 epoch: 69, train_loss: 0.6029, test_loss: 0.8590, test_f1: 0.6303
 epoch: 70, train_loss: 0.6011, test_loss: 0.8565, test_f1: 0.6262
 epoch: 71, train_loss: 0.5977, test_loss: 0.8678, test_f1: 0.6227
 epoch: 72, train_loss: 0.5812, test_loss: 0.8925, test_f1: 0.5974
 epoch: 73, train_loss: 0.5918, test_loss: 0.8659, test_f1: 0.6418
 epoch: 74, train_loss: 0.5725, test_loss: 0.8493, test_f1: 0.6397
 epoch: 75, train_loss: 0.5835, test_loss: 0.8682, test_f1: 0.6246
 epoch: 76, train_loss: 0.5884, test_loss: 0.8674, test_f1: 0.6256
 epoch: 77, train_loss: 0.5959, test_loss: 0.8776, test_f1: 0.6522
 epoch: 78, train_loss: 0.5866, test_loss: 0.8652, test_f1: 0.6280
 epoch: 79, train_loss: 0.5787, test_loss: 0.8610, test_f1: 0.6331
 epoch: 80, train_loss: 0.5834, test_loss: 0.8865, test_f1: 0.6304
 epoch: 81, train_loss: 0.5704, test_loss: 0.8933, test_f1: 0.6416
 epoch: 82, train_loss: 0.5728, test_loss: 0.8713, test_f1: 0.6504
 epoch: 83, train_loss: 0.5745, test_loss: 0.8784, test_f1: 0.6372
 epoch: 84, train_loss: 0.5632, test_loss: 0.8662, test_f1: 0.6401
 epoch: 85, train_loss: 0.5562, test_loss: 0.8689, test_f1: 0.6406
 epoch: 86, train_loss: 0.5733, test_loss: 0.8856, test_f1: 0.6234
 epoch: 87, train_loss: 0.5467, test_loss: 0.8494, test_f1: 0.6469
 epoch: 88, train_loss: 0.5481, test_loss: 0.8748, test_f1: 0.6323
 epoch: 89, train_loss: 0.5548, test_loss: 0.9011, test_f1: 0.6349
 epoch: 90, train_loss: 0.5545, test_loss: 0.8863, test_f1: 0.6371
 epoch: 91, train_loss: 0.5555, test_loss: 0.8833, test_f1: 0.6348
 epoch: 92, train_loss: 0.5454, test_loss: 0.8835, test_f1: 0.6341
 epoch: 93, train_loss: 0.5515, test_loss: 0.8850, test_f1: 0.6450
 epoch: 94, train_loss: 0.5507, test_loss: 0.9109, test_f1: 0.6269
 epoch: 95, train_loss: 0.5437, test_loss: 0.9119, test_f1: 0.6359
 epoch: 96, train_loss: 0.5411, test_loss: 0.9212, test_f1: 0.6387
 epoch: 97, train_loss: 0.5380, test_loss: 0.9226, test_f1: 0.6383
 epoch: 98, train_loss: 0.5286, test_loss: 0.9476, test_f1: 0.6317
 epoch: 99, train_loss: 0.5254, test_loss: 0.9041, test_f1: 0.6447
##################ITERATION #9 ****************************************
 epoch: 0, train_loss: 1.2705, test_loss: 1.3712, test_f1: 0.2270
 epoch: 1, train_loss: 1.0570, test_loss: 1.2796, test_f1: 0.2270
 epoch: 2, train_loss: 1.0252, test_loss: 1.1564, test_f1: 0.2701
 epoch: 3, train_loss: 0.9838, test_loss: 1.0358, test_f1: 0.4392
 epoch: 4, train_loss: 0.9714, test_loss: 0.9745, test_f1: 0.5082
 epoch: 5, train_loss: 0.9524, test_loss: 0.9440, test_f1: 0.5258
 epoch: 6, train_loss: 0.9309, test_loss: 0.9288, test_f1: 0.5398
 epoch: 7, train_loss: 0.9245, test_loss: 0.9110, test_f1: 0.5350
 epoch: 8, train_loss: 0.9018, test_loss: 0.8897, test_f1: 0.5392
 epoch: 9, train_loss: 0.8952, test_loss: 0.8832, test_f1: 0.5523
 epoch: 10, train_loss: 0.8857, test_loss: 0.8756, test_f1: 0.5569
 epoch: 11, train_loss: 0.8784, test_loss: 0.8731, test_f1: 0.5552
 epoch: 12, train_loss: 0.8652, test_loss: 0.8585, test_f1: 0.5541
 epoch: 13, train_loss: 0.8520, test_loss: 0.8450, test_f1: 0.5688
 epoch: 14, train_loss: 0.8390, test_loss: 0.8519, test_f1: 0.5646
 epoch: 15, train_loss: 0.8392, test_loss: 0.8385, test_f1: 0.5589
 epoch: 16, train_loss: 0.8292, test_loss: 0.8324, test_f1: 0.5684
 epoch: 17, train_loss: 0.8242, test_loss: 0.8378, test_f1: 0.5564
 epoch: 18, train_loss: 0.8201, test_loss: 0.8206, test_f1: 0.5684
 epoch: 19, train_loss: 0.8161, test_loss: 0.8317, test_f1: 0.5720
 epoch: 20, train_loss: 0.7947, test_loss: 0.8109, test_f1: 0.5732
 epoch: 21, train_loss: 0.8016, test_loss: 0.8112, test_f1: 0.5785
 epoch: 22, train_loss: 0.7875, test_loss: 0.8032, test_f1: 0.5704
 epoch: 23, train_loss: 0.7776, test_loss: 0.8020, test_f1: 0.5690
 epoch: 24, train_loss: 0.7740, test_loss: 0.7931, test_f1: 0.5825
 epoch: 25, train_loss: 0.7667, test_loss: 0.7973, test_f1: 0.5828
 epoch: 26, train_loss: 0.7612, test_loss: 0.7867, test_f1: 0.5871
 epoch: 27, train_loss: 0.7451, test_loss: 0.7760, test_f1: 0.5861
 epoch: 28, train_loss: 0.7439, test_loss: 0.7942, test_f1: 0.5930
 epoch: 29, train_loss: 0.7398, test_loss: 0.7786, test_f1: 0.5899
 epoch: 30, train_loss: 0.7364, test_loss: 0.7795, test_f1: 0.5946
 epoch: 31, train_loss: 0.7341, test_loss: 0.7739, test_f1: 0.5912
 epoch: 32, train_loss: 0.7219, test_loss: 0.7796, test_f1: 0.5923
 epoch: 33, train_loss: 0.7226, test_loss: 0.7767, test_f1: 0.5880
 epoch: 34, train_loss: 0.7167, test_loss: 0.7714, test_f1: 0.5923
 epoch: 35, train_loss: 0.7067, test_loss: 0.7765, test_f1: 0.5927
 epoch: 36, train_loss: 0.6969, test_loss: 0.7701, test_f1: 0.6011
 epoch: 37, train_loss: 0.6944, test_loss: 0.7611, test_f1: 0.6221
 epoch: 38, train_loss: 0.6911, test_loss: 0.7613, test_f1: 0.6316
 epoch: 39, train_loss: 0.6899, test_loss: 0.7615, test_f1: 0.6166
 epoch: 40, train_loss: 0.6845, test_loss: 0.7543, test_f1: 0.6399
 epoch: 41, train_loss: 0.6814, test_loss: 0.7613, test_f1: 0.6028
 epoch: 42, train_loss: 0.6740, test_loss: 0.7694, test_f1: 0.6267
 epoch: 43, train_loss: 0.6711, test_loss: 0.7492, test_f1: 0.6060
 epoch: 44, train_loss: 0.6654, test_loss: 0.7664, test_f1: 0.6065
 epoch: 45, train_loss: 0.6604, test_loss: 0.7547, test_f1: 0.6535
 epoch: 46, train_loss: 0.6477, test_loss: 0.7554, test_f1: 0.6506
 epoch: 47, train_loss: 0.6433, test_loss: 0.7592, test_f1: 0.6441
 epoch: 48, train_loss: 0.6477, test_loss: 0.7567, test_f1: 0.6487
 epoch: 49, train_loss: 0.6319, test_loss: 0.7766, test_f1: 0.6386
 epoch: 50, train_loss: 0.6379, test_loss: 0.7506, test_f1: 0.6507
 epoch: 51, train_loss: 0.6258, test_loss: 0.7607, test_f1: 0.6446
 epoch: 52, train_loss: 0.6198, test_loss: 0.7629, test_f1: 0.6425
 epoch: 53, train_loss: 0.6312, test_loss: 0.7623, test_f1: 0.6641
 epoch: 54, train_loss: 0.6212, test_loss: 0.7711, test_f1: 0.6396
 epoch: 55, train_loss: 0.6175, test_loss: 0.7648, test_f1: 0.6492
 epoch: 56, train_loss: 0.6163, test_loss: 0.7630, test_f1: 0.6423
 epoch: 57, train_loss: 0.6144, test_loss: 0.7830, test_f1: 0.6353
 epoch: 58, train_loss: 0.6076, test_loss: 0.7545, test_f1: 0.6592
 epoch: 59, train_loss: 0.6175, test_loss: 0.7594, test_f1: 0.6522
 epoch: 60, train_loss: 0.6094, test_loss: 0.7686, test_f1: 0.6509
 epoch: 61, train_loss: 0.6025, test_loss: 0.7732, test_f1: 0.6497
 epoch: 62, train_loss: 0.6016, test_loss: 0.7744, test_f1: 0.6483
 epoch: 63, train_loss: 0.5995, test_loss: 0.7696, test_f1: 0.6599
 epoch: 64, train_loss: 0.5923, test_loss: 0.7729, test_f1: 0.6402
 epoch: 65, train_loss: 0.5946, test_loss: 0.7836, test_f1: 0.6304
 epoch: 66, train_loss: 0.5931, test_loss: 0.7851, test_f1: 0.6372
 epoch: 67, train_loss: 0.5969, test_loss: 0.7907, test_f1: 0.6242
 epoch: 68, train_loss: 0.5907, test_loss: 0.7807, test_f1: 0.6423
 epoch: 69, train_loss: 0.5907, test_loss: 0.7728, test_f1: 0.6464
 epoch: 70, train_loss: 0.5868, test_loss: 0.7733, test_f1: 0.6452
 epoch: 71, train_loss: 0.5889, test_loss: 0.7687, test_f1: 0.6423
 epoch: 72, train_loss: 0.5763, test_loss: 0.7840, test_f1: 0.6351
 epoch: 73, train_loss: 0.5852, test_loss: 0.7828, test_f1: 0.6372
 epoch: 74, train_loss: 0.5773, test_loss: 0.8039, test_f1: 0.6147
 epoch: 75, train_loss: 0.5811, test_loss: 0.7897, test_f1: 0.6305
 epoch: 76, train_loss: 0.5798, test_loss: 0.7664, test_f1: 0.6682
 epoch: 77, train_loss: 0.5723, test_loss: 0.7848, test_f1: 0.6541
 epoch: 78, train_loss: 0.5711, test_loss: 0.7836, test_f1: 0.6701
 epoch: 79, train_loss: 0.5670, test_loss: 0.7923, test_f1: 0.6445
 epoch: 80, train_loss: 0.5693, test_loss: 0.8036, test_f1: 0.6313
 epoch: 81, train_loss: 0.5686, test_loss: 0.8029, test_f1: 0.6439
 epoch: 82, train_loss: 0.5705, test_loss: 0.8187, test_f1: 0.6402
 epoch: 83, train_loss: 0.5547, test_loss: 0.8076, test_f1: 0.6356
 epoch: 84, train_loss: 0.5578, test_loss: 0.8077, test_f1: 0.6396
 epoch: 85, train_loss: 0.5625, test_loss: 0.8202, test_f1: 0.6340
 epoch: 86, train_loss: 0.5597, test_loss: 0.7994, test_f1: 0.6368
 epoch: 87, train_loss: 0.5412, test_loss: 0.7974, test_f1: 0.6452
 epoch: 88, train_loss: 0.5490, test_loss: 0.8000, test_f1: 0.6454
 epoch: 89, train_loss: 0.5405, test_loss: 0.8301, test_f1: 0.6275
 epoch: 90, train_loss: 0.5449, test_loss: 0.7954, test_f1: 0.6466
 epoch: 91, train_loss: 0.5517, test_loss: 0.7984, test_f1: 0.6604
 epoch: 92, train_loss: 0.5434, test_loss: 0.7990, test_f1: 0.6639
 epoch: 93, train_loss: 0.5470, test_loss: 0.8191, test_f1: 0.6577
 epoch: 94, train_loss: 0.5314, test_loss: 0.8155, test_f1: 0.6347
 epoch: 95, train_loss: 0.5335, test_loss: 0.8295, test_f1: 0.6430
 epoch: 96, train_loss: 0.5313, test_loss: 0.8294, test_f1: 0.6492
 epoch: 97, train_loss: 0.5384, test_loss: 0.8226, test_f1: 0.6355
 epoch: 98, train_loss: 0.5396, test_loss: 0.8183, test_f1: 0.6542
 epoch: 99, train_loss: 0.5489, test_loss: 0.8254, test_f1: 0.6752

Training completed in 1468.25 seconds
Best F1: 0.6752 at epoch 99
Mean F1 across iterations: 0.6427  0.0256
========================FINAL RESULTS================================
FEGIN weighted F1: 0.6752  0.0256
python main.py --data ltspice_examples --representation component_pin_net --model FEGIN --layers 3 --hiddens 128 --batch_size 256 --lr 0.0001 --emb_size 128 --epochs 100 --save_appendix component_pin_net_L3_H128_BS256_LR0.0001_E128 --no_val
-----



STDERR:
  File "main.py", line 370, in <module>
    main()
  File "main.py", line 254, in main
    dataset = dataset_class(
  File "/home/philip/projects/llm_inference_code_repo/Circuit-Completion-Using-GNNs/component_classification_with_link_prediction_head/evaluation/FEGIN/kernel/circuit_datasets.py", line 15, in __init__
    self.data, self.slices = torch.load(self.processed_paths[0])
  File "/home/philip/.local/lib/python3.8/site-packages/torch/serialization.py", line 1040, in load
    warnings.warn(
  File "/usr/lib/python3.8/warnings.py", line 109, in _showwarnmsg
    sw(msg.message, msg.category, msg.filename, msg.lineno,
  File "main.py", line 47, in warn_with_traceback
    traceback.print_stack(file=log)
/home/philip/projects/llm_inference_code_repo/Circuit-Completion-Using-GNNs/component_classification_with_link_prediction_head/evaluation/FEGIN/kernel/circuit_datasets.py:15: FutureWarning: You are using `torch.load` with `weights_only=False` (the current default value), which uses the default pickle module implicitly. It is possible to construct malicious pickle data which will execute arbitrary code during unpickling (See https://github.com/pytorch/pytorch/blob/main/SECURITY.md#untrusted-models for more details). In a future release, the default value for `weights_only` will be flipped to `True`. This limits the functions that could be executed during unpickling. Arbitrary objects will no longer be allowed to be loaded via this mode unless they are explicitly allowlisted by the user via `torch.serialization.add_safe_globals`. We recommend you start setting `weights_only=True` for any use case where you don't have full control of the loaded file. Please open an issue on GitHub for any issues related to this experimental feature.
  self.data, self.slices = torch.load(self.processed_paths[0])
