STDOUT:
Results will be saved in /home/philip/projects/ltspice_examples_code_repo/Circuit-Completion-Using-GNNs/component_classification_with_link_prediction_head/evaluation/FEGIN/results/model_FEGIN_dataset_ltspice_demos
Command line input: python main.py --data ltspice_demos --representation component_net --model FEGIN --layers 2 --hiddens 16 --batch_size 32 --lr 0.001 --emb_size 250 --epochs 100 --save_appendix component_net_L2_H16_BS32_LR0.001_E250 --no_val
 is saved.
-----
ltspice_demos - FEGIN
Using 2 layers, 16 hidden units, h = 2
Loading component_net representation dataset
ENTERED
Training FEGIN on component_net representation
Train: 1565, Test: 383
##################ITERATION #0 ****************************************
 epoch: 0, train_loss: 1.3694, test_loss: 1.3484, test_f1: 0.1365
 epoch: 1, train_loss: 1.2772, test_loss: 1.2921, test_f1: 0.2243
 epoch: 2, train_loss: 1.2217, test_loss: 1.2607, test_f1: 0.3189
 epoch: 3, train_loss: 1.1855, test_loss: 1.2342, test_f1: 0.3228
 epoch: 4, train_loss: 1.1649, test_loss: 1.2145, test_f1: 0.3242
 epoch: 5, train_loss: 1.1365, test_loss: 1.1846, test_f1: 0.3615
 epoch: 6, train_loss: 1.1101, test_loss: 1.1708, test_f1: 0.4230
 epoch: 7, train_loss: 1.0879, test_loss: 1.1709, test_f1: 0.4184
 epoch: 8, train_loss: 1.0433, test_loss: 1.1537, test_f1: 0.4146
 epoch: 9, train_loss: 1.0474, test_loss: 1.1442, test_f1: 0.4078
 epoch: 10, train_loss: 1.0277, test_loss: 1.1400, test_f1: 0.4141
 epoch: 11, train_loss: 1.0256, test_loss: 1.1410, test_f1: 0.4240
 epoch: 12, train_loss: 1.0107, test_loss: 1.1299, test_f1: 0.4184
 epoch: 13, train_loss: 1.0093, test_loss: 1.0926, test_f1: 0.4165
 epoch: 14, train_loss: 1.0080, test_loss: 1.0916, test_f1: 0.4258
 epoch: 15, train_loss: 1.0005, test_loss: 1.1126, test_f1: 0.4313
 epoch: 16, train_loss: 0.9830, test_loss: 1.0827, test_f1: 0.4431
 epoch: 17, train_loss: 0.9941, test_loss: 1.0722, test_f1: 0.4309
 epoch: 18, train_loss: 0.9736, test_loss: 1.0827, test_f1: 0.4260
 epoch: 19, train_loss: 0.9836, test_loss: 1.1047, test_f1: 0.4510
 epoch: 20, train_loss: 0.9755, test_loss: 1.0949, test_f1: 0.4613
 epoch: 21, train_loss: 0.9672, test_loss: 1.0976, test_f1: 0.4454
 epoch: 22, train_loss: 0.9691, test_loss: 1.0573, test_f1: 0.4557
 epoch: 23, train_loss: 0.9573, test_loss: 1.0634, test_f1: 0.4686
 epoch: 24, train_loss: 0.9614, test_loss: 1.0887, test_f1: 0.5199
 epoch: 25, train_loss: 0.9649, test_loss: 1.0858, test_f1: 0.4451
 epoch: 26, train_loss: 0.9516, test_loss: 1.0724, test_f1: 0.4898
 epoch: 27, train_loss: 0.9464, test_loss: 1.0534, test_f1: 0.5004
 epoch: 28, train_loss: 0.9584, test_loss: 1.0876, test_f1: 0.5162
 epoch: 29, train_loss: 0.9360, test_loss: 1.0544, test_f1: 0.4902
 epoch: 30, train_loss: 0.9354, test_loss: 1.0356, test_f1: 0.5318
 epoch: 31, train_loss: 0.9240, test_loss: 1.0250, test_f1: 0.5233
 epoch: 32, train_loss: 0.9320, test_loss: 1.0175, test_f1: 0.5443
 epoch: 33, train_loss: 0.9255, test_loss: 1.0411, test_f1: 0.5216
 epoch: 34, train_loss: 0.9135, test_loss: 1.0324, test_f1: 0.5514
 epoch: 35, train_loss: 0.9129, test_loss: 1.0558, test_f1: 0.5332
 epoch: 36, train_loss: 0.8997, test_loss: 1.0443, test_f1: 0.5588
 epoch: 37, train_loss: 0.9055, test_loss: 1.0449, test_f1: 0.5246
 epoch: 38, train_loss: 0.9059, test_loss: 1.0187, test_f1: 0.5624
 epoch: 39, train_loss: 0.9074, test_loss: 1.0052, test_f1: 0.5542
 epoch: 40, train_loss: 0.9012, test_loss: 1.0439, test_f1: 0.5483
 epoch: 41, train_loss: 0.8928, test_loss: 1.0261, test_f1: 0.5467
 epoch: 42, train_loss: 0.8873, test_loss: 1.0340, test_f1: 0.5410
 epoch: 43, train_loss: 0.8965, test_loss: 0.9963, test_f1: 0.5728
 epoch: 44, train_loss: 0.9002, test_loss: 1.0349, test_f1: 0.5149
 epoch: 45, train_loss: 0.9037, test_loss: 1.0137, test_f1: 0.5593
 epoch: 46, train_loss: 0.8872, test_loss: 1.0448, test_f1: 0.5315
 epoch: 47, train_loss: 0.8905, test_loss: 0.9976, test_f1: 0.5534
 epoch: 48, train_loss: 0.8806, test_loss: 1.0050, test_f1: 0.5668
 epoch: 49, train_loss: 0.8938, test_loss: 1.0130, test_f1: 0.5458
 epoch: 50, train_loss: 0.8891, test_loss: 0.9984, test_f1: 0.5644
 epoch: 51, train_loss: 0.8825, test_loss: 1.0282, test_f1: 0.5466
 epoch: 52, train_loss: 0.8599, test_loss: 1.0094, test_f1: 0.5716
 epoch: 53, train_loss: 0.8711, test_loss: 1.0191, test_f1: 0.5538
 epoch: 54, train_loss: 0.8636, test_loss: 1.0234, test_f1: 0.5430
 epoch: 55, train_loss: 0.8576, test_loss: 1.0245, test_f1: 0.5656
 epoch: 56, train_loss: 0.8627, test_loss: 1.0272, test_f1: 0.5574
 epoch: 57, train_loss: 0.8540, test_loss: 0.9965, test_f1: 0.5755
 epoch: 58, train_loss: 0.8499, test_loss: 1.0080, test_f1: 0.5803
 epoch: 59, train_loss: 0.8502, test_loss: 1.0167, test_f1: 0.5609
 epoch: 60, train_loss: 0.8555, test_loss: 1.0217, test_f1: 0.5762
 epoch: 61, train_loss: 0.8507, test_loss: 1.0190, test_f1: 0.5617
 epoch: 62, train_loss: 0.8523, test_loss: 1.0318, test_f1: 0.5625
 epoch: 63, train_loss: 0.8598, test_loss: 1.0154, test_f1: 0.5976
 epoch: 64, train_loss: 0.8401, test_loss: 1.0237, test_f1: 0.5603
 epoch: 65, train_loss: 0.8606, test_loss: 1.0459, test_f1: 0.5550
 epoch: 66, train_loss: 0.8652, test_loss: 1.0298, test_f1: 0.5819
 epoch: 67, train_loss: 0.8480, test_loss: 1.0435, test_f1: 0.5649
 epoch: 68, train_loss: 0.8681, test_loss: 1.0510, test_f1: 0.5929
 epoch: 69, train_loss: 0.8493, test_loss: 1.0674, test_f1: 0.5626
 epoch: 70, train_loss: 0.8426, test_loss: 1.0133, test_f1: 0.5620
 epoch: 71, train_loss: 0.8465, test_loss: 1.0221, test_f1: 0.5643
 epoch: 72, train_loss: 0.8439, test_loss: 1.0686, test_f1: 0.5599
 epoch: 73, train_loss: 0.8654, test_loss: 1.0667, test_f1: 0.5659
 epoch: 74, train_loss: 0.8290, test_loss: 1.0338, test_f1: 0.5604
 epoch: 75, train_loss: 0.8293, test_loss: 1.0597, test_f1: 0.5686
 epoch: 76, train_loss: 0.8419, test_loss: 1.0638, test_f1: 0.5681
 epoch: 77, train_loss: 0.8685, test_loss: 1.0401, test_f1: 0.5592
 epoch: 78, train_loss: 0.8373, test_loss: 1.0398, test_f1: 0.5616
 epoch: 79, train_loss: 0.8324, test_loss: 1.0077, test_f1: 0.5703
 epoch: 80, train_loss: 0.8322, test_loss: 1.0384, test_f1: 0.5536
 epoch: 81, train_loss: 0.8459, test_loss: 1.0643, test_f1: 0.5627
 epoch: 82, train_loss: 0.8345, test_loss: 1.0377, test_f1: 0.5560
 epoch: 83, train_loss: 0.8275, test_loss: 1.0548, test_f1: 0.5723
 epoch: 84, train_loss: 0.8339, test_loss: 1.0496, test_f1: 0.5784
 epoch: 85, train_loss: 0.8267, test_loss: 1.0782, test_f1: 0.5677
 epoch: 86, train_loss: 0.8293, test_loss: 1.0187, test_f1: 0.5768
 epoch: 87, train_loss: 0.8219, test_loss: 1.0215, test_f1: 0.5665
 epoch: 88, train_loss: 0.8150, test_loss: 1.0309, test_f1: 0.5774
 epoch: 89, train_loss: 0.8137, test_loss: 1.0256, test_f1: 0.5754
 epoch: 90, train_loss: 0.8302, test_loss: 1.0452, test_f1: 0.5748
 epoch: 91, train_loss: 0.8297, test_loss: 1.0286, test_f1: 0.5812
 epoch: 92, train_loss: 0.8184, test_loss: 1.0508, test_f1: 0.5644
 epoch: 93, train_loss: 0.8193, test_loss: 1.0319, test_f1: 0.5808
 epoch: 94, train_loss: 0.8120, test_loss: 1.0561, test_f1: 0.5682
 epoch: 95, train_loss: 0.8130, test_loss: 1.0394, test_f1: 0.5639
 epoch: 96, train_loss: 0.8279, test_loss: 1.0284, test_f1: 0.5841
 epoch: 97, train_loss: 0.8192, test_loss: 1.0618, test_f1: 0.5754
 epoch: 98, train_loss: 0.8152, test_loss: 1.0250, test_f1: 0.5631
 epoch: 99, train_loss: 0.8220, test_loss: 1.0638, test_f1: 0.5815
##################ITERATION #1 ****************************************
 epoch: 0, train_loss: 1.2880, test_loss: 1.2663, test_f1: 0.2336
 epoch: 1, train_loss: 1.1473, test_loss: 1.1824, test_f1: 0.3745
 epoch: 2, train_loss: 1.1110, test_loss: 1.1676, test_f1: 0.4051
 epoch: 3, train_loss: 1.0741, test_loss: 1.1233, test_f1: 0.4463
 epoch: 4, train_loss: 1.0691, test_loss: 1.1144, test_f1: 0.4545
 epoch: 5, train_loss: 1.0351, test_loss: 1.1203, test_f1: 0.4336
 epoch: 6, train_loss: 1.0209, test_loss: 1.1077, test_f1: 0.4432
 epoch: 7, train_loss: 1.0172, test_loss: 1.1019, test_f1: 0.4535
 epoch: 8, train_loss: 1.0063, test_loss: 1.1288, test_f1: 0.4435
 epoch: 9, train_loss: 0.9910, test_loss: 1.1401, test_f1: 0.4460
 epoch: 10, train_loss: 1.0037, test_loss: 1.1152, test_f1: 0.4511
 epoch: 11, train_loss: 0.9808, test_loss: 1.1154, test_f1: 0.4668
 epoch: 12, train_loss: 0.9816, test_loss: 1.0888, test_f1: 0.4618
 epoch: 13, train_loss: 0.9740, test_loss: 1.1193, test_f1: 0.4542
 epoch: 14, train_loss: 0.9672, test_loss: 1.0958, test_f1: 0.4707
 epoch: 15, train_loss: 0.9620, test_loss: 1.1096, test_f1: 0.4657
 epoch: 16, train_loss: 0.9558, test_loss: 1.0885, test_f1: 0.4785
 epoch: 17, train_loss: 0.9537, test_loss: 1.1064, test_f1: 0.4769
 epoch: 18, train_loss: 0.9544, test_loss: 1.0707, test_f1: 0.5219
 epoch: 19, train_loss: 0.9540, test_loss: 1.0816, test_f1: 0.5081
 epoch: 20, train_loss: 0.9426, test_loss: 1.0896, test_f1: 0.4755
 epoch: 21, train_loss: 0.9329, test_loss: 1.0802, test_f1: 0.4773
 epoch: 22, train_loss: 0.9192, test_loss: 1.0911, test_f1: 0.5073
 epoch: 23, train_loss: 0.9285, test_loss: 1.0763, test_f1: 0.5196
 epoch: 24, train_loss: 0.9237, test_loss: 1.0796, test_f1: 0.4969
 epoch: 25, train_loss: 0.9181, test_loss: 1.0548, test_f1: 0.5166
 epoch: 26, train_loss: 0.9185, test_loss: 1.0547, test_f1: 0.5153
 epoch: 27, train_loss: 0.9131, test_loss: 1.1106, test_f1: 0.5051
 epoch: 28, train_loss: 0.9048, test_loss: 1.0664, test_f1: 0.4997
 epoch: 29, train_loss: 0.9049, test_loss: 1.0914, test_f1: 0.5211
 epoch: 30, train_loss: 0.9013, test_loss: 1.0836, test_f1: 0.5447
 epoch: 31, train_loss: 0.8811, test_loss: 1.0451, test_f1: 0.5407
 epoch: 32, train_loss: 0.9016, test_loss: 1.0397, test_f1: 0.5393
 epoch: 33, train_loss: 0.8913, test_loss: 1.0648, test_f1: 0.5225
 epoch: 34, train_loss: 0.8991, test_loss: 1.0605, test_f1: 0.5371
 epoch: 35, train_loss: 0.8981, test_loss: 1.0842, test_f1: 0.5385
 epoch: 36, train_loss: 0.9086, test_loss: 1.0385, test_f1: 0.5320
 epoch: 37, train_loss: 0.8894, test_loss: 1.0671, test_f1: 0.5134
 epoch: 38, train_loss: 0.8969, test_loss: 1.0483, test_f1: 0.5418
 epoch: 39, train_loss: 0.8826, test_loss: 1.0389, test_f1: 0.5797
 epoch: 40, train_loss: 0.8791, test_loss: 1.0114, test_f1: 0.5469
 epoch: 41, train_loss: 0.8702, test_loss: 1.0221, test_f1: 0.5633
 epoch: 42, train_loss: 0.8533, test_loss: 1.0201, test_f1: 0.5538
 epoch: 43, train_loss: 0.8693, test_loss: 1.0796, test_f1: 0.5488
 epoch: 44, train_loss: 0.8587, test_loss: 1.0198, test_f1: 0.5684
 epoch: 45, train_loss: 0.8615, test_loss: 1.0242, test_f1: 0.5449
 epoch: 46, train_loss: 0.8449, test_loss: 0.9944, test_f1: 0.5766
 epoch: 47, train_loss: 0.8525, test_loss: 1.0165, test_f1: 0.5569
 epoch: 48, train_loss: 0.8600, test_loss: 1.0106, test_f1: 0.5760
 epoch: 49, train_loss: 0.8425, test_loss: 1.0185, test_f1: 0.5118
 epoch: 50, train_loss: 0.8494, test_loss: 1.0187, test_f1: 0.5738
 epoch: 51, train_loss: 0.8374, test_loss: 1.0105, test_f1: 0.5669
 epoch: 52, train_loss: 0.8456, test_loss: 1.0371, test_f1: 0.5673
 epoch: 53, train_loss: 0.8113, test_loss: 1.0129, test_f1: 0.6014
 epoch: 54, train_loss: 0.8189, test_loss: 1.0211, test_f1: 0.5788
 epoch: 55, train_loss: 0.8030, test_loss: 1.0163, test_f1: 0.5671
 epoch: 56, train_loss: 0.8265, test_loss: 1.0218, test_f1: 0.5468
 epoch: 57, train_loss: 0.8308, test_loss: 0.9998, test_f1: 0.5598
 epoch: 58, train_loss: 0.8173, test_loss: 1.0225, test_f1: 0.5858
 epoch: 59, train_loss: 0.8118, test_loss: 0.9944, test_f1: 0.5979
 epoch: 60, train_loss: 0.8264, test_loss: 1.0213, test_f1: 0.5640
 epoch: 61, train_loss: 0.8141, test_loss: 1.0021, test_f1: 0.5864
 epoch: 62, train_loss: 0.8111, test_loss: 0.9929, test_f1: 0.5645
 epoch: 63, train_loss: 0.8112, test_loss: 1.0228, test_f1: 0.5956
 epoch: 64, train_loss: 0.8146, test_loss: 1.0076, test_f1: 0.5687
 epoch: 65, train_loss: 0.8061, test_loss: 1.0202, test_f1: 0.5363
 epoch: 66, train_loss: 0.8081, test_loss: 1.0190, test_f1: 0.5835
 epoch: 67, train_loss: 0.8006, test_loss: 0.9994, test_f1: 0.5851
 epoch: 68, train_loss: 0.7995, test_loss: 1.0267, test_f1: 0.5643
 epoch: 69, train_loss: 0.7961, test_loss: 0.9952, test_f1: 0.5973
 epoch: 70, train_loss: 0.7941, test_loss: 1.0120, test_f1: 0.5724
 epoch: 71, train_loss: 0.7884, test_loss: 1.0026, test_f1: 0.6112
 epoch: 72, train_loss: 0.7933, test_loss: 0.9928, test_f1: 0.6234
 epoch: 73, train_loss: 0.7938, test_loss: 0.9993, test_f1: 0.5811
 epoch: 74, train_loss: 0.7931, test_loss: 1.0154, test_f1: 0.5718
 epoch: 75, train_loss: 0.7994, test_loss: 0.9777, test_f1: 0.5814
 epoch: 76, train_loss: 0.7871, test_loss: 0.9740, test_f1: 0.6144
 epoch: 77, train_loss: 0.7727, test_loss: 0.9941, test_f1: 0.6041
 epoch: 78, train_loss: 0.7881, test_loss: 0.9733, test_f1: 0.5770
 epoch: 79, train_loss: 0.7953, test_loss: 0.9565, test_f1: 0.6023
 epoch: 80, train_loss: 0.7949, test_loss: 1.0002, test_f1: 0.5708
 epoch: 81, train_loss: 0.7926, test_loss: 0.9832, test_f1: 0.6351
 epoch: 82, train_loss: 0.7719, test_loss: 0.9649, test_f1: 0.6312
 epoch: 83, train_loss: 0.7846, test_loss: 0.9783, test_f1: 0.6206
 epoch: 84, train_loss: 0.7782, test_loss: 0.9829, test_f1: 0.5946
 epoch: 85, train_loss: 0.7848, test_loss: 0.9761, test_f1: 0.5950
 epoch: 86, train_loss: 0.7829, test_loss: 0.9887, test_f1: 0.6290
 epoch: 87, train_loss: 0.7674, test_loss: 1.0127, test_f1: 0.5879
 epoch: 88, train_loss: 0.7807, test_loss: 1.0252, test_f1: 0.5952
 epoch: 89, train_loss: 0.7710, test_loss: 0.9713, test_f1: 0.5946
 epoch: 90, train_loss: 0.7624, test_loss: 1.0026, test_f1: 0.5835
 epoch: 91, train_loss: 0.7768, test_loss: 0.9760, test_f1: 0.5887
 epoch: 92, train_loss: 0.7451, test_loss: 0.9806, test_f1: 0.6051
 epoch: 93, train_loss: 0.7583, test_loss: 0.9799, test_f1: 0.5955
 epoch: 94, train_loss: 0.7534, test_loss: 0.9870, test_f1: 0.6043
 epoch: 95, train_loss: 0.7618, test_loss: 0.9772, test_f1: 0.5713
 epoch: 96, train_loss: 0.7506, test_loss: 0.9835, test_f1: 0.5878
 epoch: 97, train_loss: 0.7484, test_loss: 0.9785, test_f1: 0.6052
 epoch: 98, train_loss: 0.7617, test_loss: 0.9895, test_f1: 0.5846
 epoch: 99, train_loss: 0.7631, test_loss: 1.0167, test_f1: 0.6119
##################ITERATION #2 ****************************************
 epoch: 0, train_loss: 1.2691, test_loss: 1.2015, test_f1: 0.3637
 epoch: 1, train_loss: 1.1352, test_loss: 1.1560, test_f1: 0.4592
 epoch: 2, train_loss: 1.0970, test_loss: 1.1150, test_f1: 0.4569
 epoch: 3, train_loss: 1.0655, test_loss: 1.0950, test_f1: 0.4520
 epoch: 4, train_loss: 1.0412, test_loss: 1.0899, test_f1: 0.4623
 epoch: 5, train_loss: 1.0179, test_loss: 1.0979, test_f1: 0.4469
 epoch: 6, train_loss: 0.9994, test_loss: 1.0960, test_f1: 0.5132
 epoch: 7, train_loss: 0.9823, test_loss: 1.0841, test_f1: 0.5101
 epoch: 8, train_loss: 0.9758, test_loss: 1.0900, test_f1: 0.4802
 epoch: 9, train_loss: 0.9789, test_loss: 1.0714, test_f1: 0.5070
 epoch: 10, train_loss: 0.9586, test_loss: 1.0750, test_f1: 0.5053
 epoch: 11, train_loss: 0.9551, test_loss: 1.0649, test_f1: 0.5310
 epoch: 12, train_loss: 0.9472, test_loss: 1.0565, test_f1: 0.5242
 epoch: 13, train_loss: 0.9346, test_loss: 1.0646, test_f1: 0.5328
 epoch: 14, train_loss: 0.9365, test_loss: 1.0836, test_f1: 0.5202
 epoch: 15, train_loss: 0.9330, test_loss: 1.0662, test_f1: 0.5151
 epoch: 16, train_loss: 0.9376, test_loss: 1.0495, test_f1: 0.5235
 epoch: 17, train_loss: 0.9180, test_loss: 1.0883, test_f1: 0.5359
 epoch: 18, train_loss: 0.9142, test_loss: 1.0585, test_f1: 0.5383
 epoch: 19, train_loss: 0.9040, test_loss: 1.0709, test_f1: 0.5582
 epoch: 20, train_loss: 0.8952, test_loss: 1.0734, test_f1: 0.5522
 epoch: 21, train_loss: 0.8831, test_loss: 1.0686, test_f1: 0.5363
 epoch: 22, train_loss: 0.8972, test_loss: 1.0722, test_f1: 0.5697
 epoch: 23, train_loss: 0.8846, test_loss: 1.0508, test_f1: 0.5375
 epoch: 24, train_loss: 0.8809, test_loss: 1.0588, test_f1: 0.5706
 epoch: 25, train_loss: 0.8745, test_loss: 1.0640, test_f1: 0.5460
 epoch: 26, train_loss: 0.8672, test_loss: 1.0594, test_f1: 0.5457
 epoch: 27, train_loss: 0.8820, test_loss: 1.0562, test_f1: 0.5375
 epoch: 28, train_loss: 0.8540, test_loss: 1.0508, test_f1: 0.5424
 epoch: 29, train_loss: 0.8562, test_loss: 1.0768, test_f1: 0.5543
 epoch: 30, train_loss: 0.8481, test_loss: 1.0640, test_f1: 0.5361
 epoch: 31, train_loss: 0.8542, test_loss: 1.0928, test_f1: 0.5442
 epoch: 32, train_loss: 0.8477, test_loss: 1.0736, test_f1: 0.5397
 epoch: 33, train_loss: 0.8445, test_loss: 1.0825, test_f1: 0.5385
 epoch: 34, train_loss: 0.8383, test_loss: 1.0457, test_f1: 0.5527
 epoch: 35, train_loss: 0.8263, test_loss: 1.0408, test_f1: 0.5469
 epoch: 36, train_loss: 0.8316, test_loss: 1.0695, test_f1: 0.5663
 epoch: 37, train_loss: 0.8242, test_loss: 1.0570, test_f1: 0.5644
 epoch: 38, train_loss: 0.8220, test_loss: 1.0769, test_f1: 0.5584
 epoch: 39, train_loss: 0.8130, test_loss: 1.1105, test_f1: 0.5273
 epoch: 40, train_loss: 0.8082, test_loss: 1.0524, test_f1: 0.5711
 epoch: 41, train_loss: 0.8106, test_loss: 1.0469, test_f1: 0.5434
 epoch: 42, train_loss: 0.8053, test_loss: 1.0627, test_f1: 0.5233
 epoch: 43, train_loss: 0.8018, test_loss: 1.0408, test_f1: 0.5553
 epoch: 44, train_loss: 0.8083, test_loss: 1.0673, test_f1: 0.5487
 epoch: 45, train_loss: 0.8134, test_loss: 1.0668, test_f1: 0.5444
 epoch: 46, train_loss: 0.7978, test_loss: 1.0625, test_f1: 0.5699
 epoch: 47, train_loss: 0.7953, test_loss: 1.0623, test_f1: 0.5467
 epoch: 48, train_loss: 0.7715, test_loss: 1.0839, test_f1: 0.5288
 epoch: 49, train_loss: 0.7912, test_loss: 1.0394, test_f1: 0.5635
 epoch: 50, train_loss: 0.7980, test_loss: 1.0291, test_f1: 0.5696
 epoch: 51, train_loss: 0.7818, test_loss: 1.0915, test_f1: 0.5217
 epoch: 52, train_loss: 0.7528, test_loss: 1.0679, test_f1: 0.5592
 epoch: 53, train_loss: 0.7755, test_loss: 1.0614, test_f1: 0.5661
 epoch: 54, train_loss: 0.7819, test_loss: 1.0491, test_f1: 0.5562
 epoch: 55, train_loss: 0.7759, test_loss: 1.0468, test_f1: 0.5566
 epoch: 56, train_loss: 0.7583, test_loss: 1.0642, test_f1: 0.5620
 epoch: 57, train_loss: 0.7706, test_loss: 1.0789, test_f1: 0.5596
 epoch: 58, train_loss: 0.7758, test_loss: 1.0644, test_f1: 0.5609
 epoch: 59, train_loss: 0.7675, test_loss: 1.0642, test_f1: 0.5653
 epoch: 60, train_loss: 0.7500, test_loss: 1.0562, test_f1: 0.5526
 epoch: 61, train_loss: 0.7546, test_loss: 1.0339, test_f1: 0.5612
 epoch: 62, train_loss: 0.7561, test_loss: 1.0649, test_f1: 0.5549
 epoch: 63, train_loss: 0.7684, test_loss: 1.0812, test_f1: 0.5536
 epoch: 64, train_loss: 0.7476, test_loss: 1.0664, test_f1: 0.5596
 epoch: 65, train_loss: 0.7583, test_loss: 1.0827, test_f1: 0.5634
 epoch: 66, train_loss: 0.7594, test_loss: 1.0881, test_f1: 0.5650
 epoch: 67, train_loss: 0.7502, test_loss: 1.0859, test_f1: 0.5568
 epoch: 68, train_loss: 0.7495, test_loss: 1.0918, test_f1: 0.5657
 epoch: 69, train_loss: 0.7361, test_loss: 1.0803, test_f1: 0.5653
 epoch: 70, train_loss: 0.7355, test_loss: 1.0700, test_f1: 0.5627
 epoch: 71, train_loss: 0.7473, test_loss: 1.1232, test_f1: 0.5634
 epoch: 72, train_loss: 0.7490, test_loss: 1.0957, test_f1: 0.5534
 epoch: 73, train_loss: 0.7438, test_loss: 1.0591, test_f1: 0.5591
 epoch: 74, train_loss: 0.7370, test_loss: 1.0918, test_f1: 0.5698
 epoch: 75, train_loss: 0.7269, test_loss: 1.0686, test_f1: 0.5628
 epoch: 76, train_loss: 0.7590, test_loss: 1.1245, test_f1: 0.5694
 epoch: 77, train_loss: 0.7380, test_loss: 1.0348, test_f1: 0.5692
 epoch: 78, train_loss: 0.7349, test_loss: 1.0605, test_f1: 0.5651
 epoch: 79, train_loss: 0.7361, test_loss: 1.0707, test_f1: 0.5568
 epoch: 80, train_loss: 0.7333, test_loss: 1.1087, test_f1: 0.5674
 epoch: 81, train_loss: 0.7427, test_loss: 1.0620, test_f1: 0.5614
 epoch: 82, train_loss: 0.7256, test_loss: 1.0844, test_f1: 0.5585
 epoch: 83, train_loss: 0.7349, test_loss: 1.0427, test_f1: 0.5613
 epoch: 84, train_loss: 0.7289, test_loss: 1.0490, test_f1: 0.5685
 epoch: 85, train_loss: 0.7376, test_loss: 1.0612, test_f1: 0.5649
 epoch: 86, train_loss: 0.7131, test_loss: 1.0657, test_f1: 0.5548
 epoch: 87, train_loss: 0.7323, test_loss: 1.0701, test_f1: 0.5621
 epoch: 88, train_loss: 0.7317, test_loss: 1.0599, test_f1: 0.5664
 epoch: 89, train_loss: 0.7333, test_loss: 1.0702, test_f1: 0.5637
 epoch: 90, train_loss: 0.7190, test_loss: 1.0806, test_f1: 0.5500
 epoch: 91, train_loss: 0.7143, test_loss: 1.1085, test_f1: 0.5593
 epoch: 92, train_loss: 0.7235, test_loss: 1.0718, test_f1: 0.5808
 epoch: 93, train_loss: 0.7234, test_loss: 1.0734, test_f1: 0.5746
 epoch: 94, train_loss: 0.7306, test_loss: 1.0890, test_f1: 0.5612
 epoch: 95, train_loss: 0.7159, test_loss: 1.1136, test_f1: 0.5559
 epoch: 96, train_loss: 0.7147, test_loss: 1.1197, test_f1: 0.5727
 epoch: 97, train_loss: 0.7198, test_loss: 1.1018, test_f1: 0.5719
 epoch: 98, train_loss: 0.7247, test_loss: 1.0972, test_f1: 0.5643
 epoch: 99, train_loss: 0.7225, test_loss: 1.1106, test_f1: 0.5520
##################ITERATION #3 ****************************************
 epoch: 0, train_loss: 1.4258, test_loss: 1.3229, test_f1: 0.2394
 epoch: 1, train_loss: 1.1882, test_loss: 1.2083, test_f1: 0.3678
 epoch: 2, train_loss: 1.1643, test_loss: 1.1696, test_f1: 0.4083
 epoch: 3, train_loss: 1.1238, test_loss: 1.1570, test_f1: 0.4290
 epoch: 4, train_loss: 1.1073, test_loss: 1.1439, test_f1: 0.4448
 epoch: 5, train_loss: 1.0906, test_loss: 1.1222, test_f1: 0.4515
 epoch: 6, train_loss: 1.0532, test_loss: 1.1014, test_f1: 0.4567
 epoch: 7, train_loss: 1.0625, test_loss: 1.0952, test_f1: 0.4588
 epoch: 8, train_loss: 1.0332, test_loss: 1.0949, test_f1: 0.4664
 epoch: 9, train_loss: 1.0357, test_loss: 1.0783, test_f1: 0.4860
 epoch: 10, train_loss: 1.0161, test_loss: 1.0743, test_f1: 0.4972
 epoch: 11, train_loss: 1.0056, test_loss: 1.0745, test_f1: 0.5031
 epoch: 12, train_loss: 0.9870, test_loss: 1.0801, test_f1: 0.4637
 epoch: 13, train_loss: 0.9929, test_loss: 1.0424, test_f1: 0.5211
 epoch: 14, train_loss: 0.9825, test_loss: 1.0758, test_f1: 0.4740
 epoch: 15, train_loss: 0.9757, test_loss: 1.0583, test_f1: 0.4859
 epoch: 16, train_loss: 0.9648, test_loss: 1.0631, test_f1: 0.4882
 epoch: 17, train_loss: 0.9688, test_loss: 1.1058, test_f1: 0.4649
 epoch: 18, train_loss: 0.9648, test_loss: 1.0517, test_f1: 0.5147
 epoch: 19, train_loss: 0.9554, test_loss: 1.0755, test_f1: 0.5033
 epoch: 20, train_loss: 0.9590, test_loss: 1.0710, test_f1: 0.5055
 epoch: 21, train_loss: 0.9336, test_loss: 1.0644, test_f1: 0.4800
 epoch: 22, train_loss: 0.9246, test_loss: 1.0666, test_f1: 0.5102
 epoch: 23, train_loss: 0.9510, test_loss: 1.0508, test_f1: 0.4990
 epoch: 24, train_loss: 0.9392, test_loss: 1.0797, test_f1: 0.4740
 epoch: 25, train_loss: 0.9336, test_loss: 1.0686, test_f1: 0.5459
 epoch: 26, train_loss: 0.9225, test_loss: 1.0600, test_f1: 0.5290
 epoch: 27, train_loss: 0.9151, test_loss: 1.0581, test_f1: 0.5176
 epoch: 28, train_loss: 0.9146, test_loss: 1.0519, test_f1: 0.5449
 epoch: 29, train_loss: 0.9151, test_loss: 1.0698, test_f1: 0.5029
 epoch: 30, train_loss: 0.9000, test_loss: 1.0405, test_f1: 0.5153
 epoch: 31, train_loss: 0.9108, test_loss: 1.0214, test_f1: 0.5506
 epoch: 32, train_loss: 0.9187, test_loss: 1.0363, test_f1: 0.5123
 epoch: 33, train_loss: 0.9185, test_loss: 1.0277, test_f1: 0.5116
 epoch: 34, train_loss: 0.8982, test_loss: 1.0238, test_f1: 0.5440
 epoch: 35, train_loss: 0.9021, test_loss: 1.0932, test_f1: 0.4940
 epoch: 36, train_loss: 0.9146, test_loss: 1.0288, test_f1: 0.5109
 epoch: 37, train_loss: 0.9051, test_loss: 1.0454, test_f1: 0.5255
 epoch: 38, train_loss: 0.8807, test_loss: 1.0200, test_f1: 0.5279
 epoch: 39, train_loss: 0.8857, test_loss: 1.0411, test_f1: 0.5262
 epoch: 40, train_loss: 0.8785, test_loss: 1.0087, test_f1: 0.5214
 epoch: 41, train_loss: 0.8688, test_loss: 1.0117, test_f1: 0.5617
 epoch: 42, train_loss: 0.8798, test_loss: 1.0589, test_f1: 0.5283
 epoch: 43, train_loss: 0.8818, test_loss: 1.0569, test_f1: 0.5299
 epoch: 44, train_loss: 0.8743, test_loss: 1.0199, test_f1: 0.5198
 epoch: 45, train_loss: 0.8788, test_loss: 1.0052, test_f1: 0.5321
 epoch: 46, train_loss: 0.8762, test_loss: 1.0825, test_f1: 0.5023
 epoch: 47, train_loss: 0.8590, test_loss: 1.0296, test_f1: 0.5160
 epoch: 48, train_loss: 0.8699, test_loss: 1.0629, test_f1: 0.5535
 epoch: 49, train_loss: 0.8615, test_loss: 1.0653, test_f1: 0.5369
 epoch: 50, train_loss: 0.8755, test_loss: 1.0137, test_f1: 0.5518
 epoch: 51, train_loss: 0.8461, test_loss: 1.0182, test_f1: 0.5313
 epoch: 52, train_loss: 0.8326, test_loss: 0.9988, test_f1: 0.5286
 epoch: 53, train_loss: 0.8424, test_loss: 1.0216, test_f1: 0.5280
 epoch: 54, train_loss: 0.8413, test_loss: 1.0173, test_f1: 0.5327
 epoch: 55, train_loss: 0.8352, test_loss: 0.9912, test_f1: 0.5471
 epoch: 56, train_loss: 0.8226, test_loss: 1.0160, test_f1: 0.5389
 epoch: 57, train_loss: 0.8145, test_loss: 1.0035, test_f1: 0.5348
 epoch: 58, train_loss: 0.8376, test_loss: 0.9948, test_f1: 0.5479
 epoch: 59, train_loss: 0.8227, test_loss: 1.0070, test_f1: 0.5322
 epoch: 60, train_loss: 0.8321, test_loss: 0.9984, test_f1: 0.5466
 epoch: 61, train_loss: 0.8297, test_loss: 1.0196, test_f1: 0.5366
 epoch: 62, train_loss: 0.8331, test_loss: 1.0000, test_f1: 0.5357
 epoch: 63, train_loss: 0.8182, test_loss: 0.9943, test_f1: 0.5332
 epoch: 64, train_loss: 0.8105, test_loss: 1.0470, test_f1: 0.5300
 epoch: 65, train_loss: 0.8076, test_loss: 1.0140, test_f1: 0.5577
 epoch: 66, train_loss: 0.8169, test_loss: 1.0081, test_f1: 0.5426
 epoch: 67, train_loss: 0.8280, test_loss: 0.9971, test_f1: 0.5421
 epoch: 68, train_loss: 0.8142, test_loss: 1.0082, test_f1: 0.5460
 epoch: 69, train_loss: 0.8099, test_loss: 1.0022, test_f1: 0.5392
 epoch: 70, train_loss: 0.8043, test_loss: 1.0048, test_f1: 0.5343
 epoch: 71, train_loss: 0.8289, test_loss: 1.0281, test_f1: 0.5413
 epoch: 72, train_loss: 0.8081, test_loss: 0.9897, test_f1: 0.5551
 epoch: 73, train_loss: 0.8091, test_loss: 0.9934, test_f1: 0.5605
 epoch: 74, train_loss: 0.8026, test_loss: 1.0083, test_f1: 0.5674
 epoch: 75, train_loss: 0.8003, test_loss: 1.0136, test_f1: 0.5457
 epoch: 76, train_loss: 0.8111, test_loss: 0.9997, test_f1: 0.5612
 epoch: 77, train_loss: 0.8010, test_loss: 0.9929, test_f1: 0.5556
 epoch: 78, train_loss: 0.8013, test_loss: 0.9897, test_f1: 0.5446
 epoch: 79, train_loss: 0.8034, test_loss: 1.0140, test_f1: 0.5694
 epoch: 80, train_loss: 0.7872, test_loss: 1.0068, test_f1: 0.5629
 epoch: 81, train_loss: 0.8000, test_loss: 1.0164, test_f1: 0.5734
 epoch: 82, train_loss: 0.7814, test_loss: 1.0090, test_f1: 0.5519
 epoch: 83, train_loss: 0.7991, test_loss: 1.0115, test_f1: 0.5550
 epoch: 84, train_loss: 0.7806, test_loss: 1.0161, test_f1: 0.5642
 epoch: 85, train_loss: 0.7764, test_loss: 1.0238, test_f1: 0.5585
 epoch: 86, train_loss: 0.7884, test_loss: 1.0170, test_f1: 0.5666
 epoch: 87, train_loss: 0.7892, test_loss: 1.0077, test_f1: 0.5813
 epoch: 88, train_loss: 0.7861, test_loss: 1.0098, test_f1: 0.5679
 epoch: 89, train_loss: 0.7924, test_loss: 1.0005, test_f1: 0.5653
 epoch: 90, train_loss: 0.7890, test_loss: 1.0376, test_f1: 0.5723
 epoch: 91, train_loss: 0.7690, test_loss: 1.0053, test_f1: 0.5627
 epoch: 92, train_loss: 0.7957, test_loss: 1.0437, test_f1: 0.5802
 epoch: 93, train_loss: 0.7845, test_loss: 1.0223, test_f1: 0.5590
 epoch: 94, train_loss: 0.7734, test_loss: 1.0313, test_f1: 0.5627
 epoch: 95, train_loss: 0.7777, test_loss: 0.9807, test_f1: 0.5610
 epoch: 96, train_loss: 0.7822, test_loss: 1.0016, test_f1: 0.5549
 epoch: 97, train_loss: 0.7623, test_loss: 1.0413, test_f1: 0.5593
 epoch: 98, train_loss: 0.7911, test_loss: 1.0360, test_f1: 0.5630
 epoch: 99, train_loss: 0.7710, test_loss: 0.9990, test_f1: 0.5498
##################ITERATION #4 ****************************************
 epoch: 0, train_loss: 1.3155, test_loss: 1.2736, test_f1: 0.2576
 epoch: 1, train_loss: 1.2039, test_loss: 1.1824, test_f1: 0.3312
 epoch: 2, train_loss: 1.1548, test_loss: 1.1596, test_f1: 0.3664
 epoch: 3, train_loss: 1.1312, test_loss: 1.1541, test_f1: 0.3848
 epoch: 4, train_loss: 1.1110, test_loss: 1.1302, test_f1: 0.4521
 epoch: 5, train_loss: 1.0986, test_loss: 1.1143, test_f1: 0.4764
 epoch: 6, train_loss: 1.0843, test_loss: 1.1029, test_f1: 0.4660
 epoch: 7, train_loss: 1.0502, test_loss: 1.0911, test_f1: 0.4725
 epoch: 8, train_loss: 1.0451, test_loss: 1.0934, test_f1: 0.4782
 epoch: 9, train_loss: 1.0365, test_loss: 1.0842, test_f1: 0.4885
 epoch: 10, train_loss: 1.0281, test_loss: 1.0810, test_f1: 0.4656
 epoch: 11, train_loss: 1.0136, test_loss: 1.0805, test_f1: 0.4833
 epoch: 12, train_loss: 1.0064, test_loss: 1.0823, test_f1: 0.4807
 epoch: 13, train_loss: 0.9829, test_loss: 1.0629, test_f1: 0.5062
 epoch: 14, train_loss: 0.9788, test_loss: 1.0580, test_f1: 0.5028
 epoch: 15, train_loss: 0.9687, test_loss: 1.0664, test_f1: 0.4966
 epoch: 16, train_loss: 0.9704, test_loss: 1.0474, test_f1: 0.5018
 epoch: 17, train_loss: 0.9587, test_loss: 1.0590, test_f1: 0.4997
 epoch: 18, train_loss: 0.9345, test_loss: 1.0494, test_f1: 0.5086
 epoch: 19, train_loss: 0.9587, test_loss: 1.0311, test_f1: 0.5069
 epoch: 20, train_loss: 0.9354, test_loss: 1.0493, test_f1: 0.4998
 epoch: 21, train_loss: 0.9328, test_loss: 1.0500, test_f1: 0.5135
 epoch: 22, train_loss: 0.9268, test_loss: 1.0497, test_f1: 0.5168
 epoch: 23, train_loss: 0.9201, test_loss: 1.0500, test_f1: 0.5066
 epoch: 24, train_loss: 0.9083, test_loss: 1.0343, test_f1: 0.5311
 epoch: 25, train_loss: 0.9264, test_loss: 1.0315, test_f1: 0.5300
 epoch: 26, train_loss: 0.9077, test_loss: 1.0361, test_f1: 0.5120
 epoch: 27, train_loss: 0.9128, test_loss: 1.0202, test_f1: 0.5776
 epoch: 28, train_loss: 0.9153, test_loss: 1.0051, test_f1: 0.5840
 epoch: 29, train_loss: 0.9029, test_loss: 1.0199, test_f1: 0.5580
 epoch: 30, train_loss: 0.8995, test_loss: 1.0202, test_f1: 0.5326
 epoch: 31, train_loss: 0.8941, test_loss: 1.0336, test_f1: 0.5083
 epoch: 32, train_loss: 0.8880, test_loss: 1.0176, test_f1: 0.5497
 epoch: 33, train_loss: 0.8841, test_loss: 1.0000, test_f1: 0.5529
 epoch: 34, train_loss: 0.8827, test_loss: 0.9958, test_f1: 0.5820
 epoch: 35, train_loss: 0.8774, test_loss: 1.0092, test_f1: 0.5537
 epoch: 36, train_loss: 0.8760, test_loss: 1.0129, test_f1: 0.5472
 epoch: 37, train_loss: 0.8582, test_loss: 1.0041, test_f1: 0.5526
 epoch: 38, train_loss: 0.8673, test_loss: 1.0282, test_f1: 0.5172
 epoch: 39, train_loss: 0.8560, test_loss: 0.9919, test_f1: 0.5797
 epoch: 40, train_loss: 0.8576, test_loss: 1.0130, test_f1: 0.5308
 epoch: 41, train_loss: 0.8519, test_loss: 1.0073, test_f1: 0.5266
 epoch: 42, train_loss: 0.8380, test_loss: 0.9836, test_f1: 0.5860
 epoch: 43, train_loss: 0.8296, test_loss: 1.0150, test_f1: 0.5765
 epoch: 44, train_loss: 0.8362, test_loss: 1.0293, test_f1: 0.5530
 epoch: 45, train_loss: 0.8449, test_loss: 1.0159, test_f1: 0.5551
 epoch: 46, train_loss: 0.8208, test_loss: 1.0018, test_f1: 0.5802
 epoch: 47, train_loss: 0.8246, test_loss: 0.9970, test_f1: 0.5797
 epoch: 48, train_loss: 0.8136, test_loss: 1.0112, test_f1: 0.5671
 epoch: 49, train_loss: 0.8401, test_loss: 0.9718, test_f1: 0.5729
 epoch: 50, train_loss: 0.7983, test_loss: 1.0041, test_f1: 0.5639
 epoch: 51, train_loss: 0.7976, test_loss: 0.9913, test_f1: 0.5735
 epoch: 52, train_loss: 0.8046, test_loss: 1.0047, test_f1: 0.5565
 epoch: 53, train_loss: 0.7977, test_loss: 1.0025, test_f1: 0.5709
 epoch: 54, train_loss: 0.7800, test_loss: 1.0058, test_f1: 0.5714
 epoch: 55, train_loss: 0.7993, test_loss: 0.9971, test_f1: 0.5885
 epoch: 56, train_loss: 0.7904, test_loss: 0.9953, test_f1: 0.5872
 epoch: 57, train_loss: 0.7854, test_loss: 0.9938, test_f1: 0.5732
 epoch: 58, train_loss: 0.7996, test_loss: 0.9759, test_f1: 0.5826
 epoch: 59, train_loss: 0.7840, test_loss: 1.0047, test_f1: 0.5581
 epoch: 60, train_loss: 0.7880, test_loss: 0.9969, test_f1: 0.5766
 epoch: 61, train_loss: 0.8051, test_loss: 0.9966, test_f1: 0.5787
 epoch: 62, train_loss: 0.7894, test_loss: 0.9964, test_f1: 0.5924
 epoch: 63, train_loss: 0.7745, test_loss: 1.0009, test_f1: 0.5714
 epoch: 64, train_loss: 0.7834, test_loss: 1.0037, test_f1: 0.5829
 epoch: 65, train_loss: 0.7830, test_loss: 0.9964, test_f1: 0.5869
 epoch: 66, train_loss: 0.7851, test_loss: 0.9698, test_f1: 0.5932
 epoch: 67, train_loss: 0.7739, test_loss: 0.9888, test_f1: 0.6138
 epoch: 68, train_loss: 0.7660, test_loss: 1.0094, test_f1: 0.5825
 epoch: 69, train_loss: 0.7631, test_loss: 0.9964, test_f1: 0.5952
 epoch: 70, train_loss: 0.7585, test_loss: 0.9889, test_f1: 0.6043
 epoch: 71, train_loss: 0.7750, test_loss: 0.9870, test_f1: 0.6007
 epoch: 72, train_loss: 0.7694, test_loss: 0.9926, test_f1: 0.6010
 epoch: 73, train_loss: 0.7841, test_loss: 0.9937, test_f1: 0.5811
 epoch: 74, train_loss: 0.7840, test_loss: 0.9762, test_f1: 0.6118
 epoch: 75, train_loss: 0.7711, test_loss: 0.9820, test_f1: 0.6043
 epoch: 76, train_loss: 0.7630, test_loss: 0.9861, test_f1: 0.6062
 epoch: 77, train_loss: 0.7503, test_loss: 1.0008, test_f1: 0.5837
 epoch: 78, train_loss: 0.7536, test_loss: 0.9813, test_f1: 0.6114
 epoch: 79, train_loss: 0.7620, test_loss: 0.9835, test_f1: 0.5966
 epoch: 80, train_loss: 0.7487, test_loss: 0.9858, test_f1: 0.6071
 epoch: 81, train_loss: 0.7439, test_loss: 0.9748, test_f1: 0.5897
 epoch: 82, train_loss: 0.7610, test_loss: 0.9948, test_f1: 0.5986
 epoch: 83, train_loss: 0.7720, test_loss: 1.0043, test_f1: 0.6259
 epoch: 84, train_loss: 0.7544, test_loss: 1.0030, test_f1: 0.6058
 epoch: 85, train_loss: 0.7508, test_loss: 0.9814, test_f1: 0.5963
 epoch: 86, train_loss: 0.7563, test_loss: 0.9862, test_f1: 0.5956
 epoch: 87, train_loss: 0.7504, test_loss: 0.9708, test_f1: 0.6001
 epoch: 88, train_loss: 0.7590, test_loss: 0.9787, test_f1: 0.6006
 epoch: 89, train_loss: 0.7403, test_loss: 0.9899, test_f1: 0.5984
 epoch: 90, train_loss: 0.7641, test_loss: 0.9917, test_f1: 0.5920
 epoch: 91, train_loss: 0.7309, test_loss: 0.9835, test_f1: 0.5942
 epoch: 92, train_loss: 0.7423, test_loss: 0.9964, test_f1: 0.6025
 epoch: 93, train_loss: 0.7423, test_loss: 0.9898, test_f1: 0.6099
 epoch: 94, train_loss: 0.7213, test_loss: 1.0046, test_f1: 0.5760
 epoch: 95, train_loss: 0.7411, test_loss: 0.9901, test_f1: 0.6028
 epoch: 96, train_loss: 0.7400, test_loss: 0.9812, test_f1: 0.5966
 epoch: 97, train_loss: 0.7469, test_loss: 0.9782, test_f1: 0.6143
 epoch: 98, train_loss: 0.7244, test_loss: 0.9987, test_f1: 0.6121
 epoch: 99, train_loss: 0.7164, test_loss: 0.9856, test_f1: 0.5852
##################ITERATION #5 ****************************************
 epoch: 0, train_loss: 1.4157, test_loss: 1.3419, test_f1: 0.2935
 epoch: 1, train_loss: 1.1940, test_loss: 1.2042, test_f1: 0.4128
 epoch: 2, train_loss: 1.1249, test_loss: 1.1697, test_f1: 0.4274
 epoch: 3, train_loss: 1.1138, test_loss: 1.1120, test_f1: 0.4672
 epoch: 4, train_loss: 1.0926, test_loss: 1.1445, test_f1: 0.4609
 epoch: 5, train_loss: 1.0523, test_loss: 1.1237, test_f1: 0.4697
 epoch: 6, train_loss: 1.0459, test_loss: 1.1173, test_f1: 0.4931
 epoch: 7, train_loss: 1.0285, test_loss: 1.1111, test_f1: 0.4767
 epoch: 8, train_loss: 1.0274, test_loss: 1.1021, test_f1: 0.4734
 epoch: 9, train_loss: 1.0237, test_loss: 1.0807, test_f1: 0.4455
 epoch: 10, train_loss: 1.0179, test_loss: 1.0997, test_f1: 0.4992
 epoch: 11, train_loss: 0.9912, test_loss: 1.0875, test_f1: 0.4909
 epoch: 12, train_loss: 0.9990, test_loss: 1.0913, test_f1: 0.5069
 epoch: 13, train_loss: 0.9737, test_loss: 1.0739, test_f1: 0.4921
 epoch: 14, train_loss: 0.9779, test_loss: 1.0638, test_f1: 0.4948
 epoch: 15, train_loss: 0.9804, test_loss: 1.0677, test_f1: 0.5027
 epoch: 16, train_loss: 0.9664, test_loss: 1.0757, test_f1: 0.5025
 epoch: 17, train_loss: 0.9529, test_loss: 1.0623, test_f1: 0.5126
 epoch: 18, train_loss: 0.9548, test_loss: 1.0551, test_f1: 0.5231
 epoch: 19, train_loss: 0.9560, test_loss: 1.0326, test_f1: 0.5047
 epoch: 20, train_loss: 0.9378, test_loss: 1.0348, test_f1: 0.5210
 epoch: 21, train_loss: 0.9337, test_loss: 1.0264, test_f1: 0.5188
 epoch: 22, train_loss: 0.9398, test_loss: 1.0502, test_f1: 0.5102
 epoch: 23, train_loss: 0.9250, test_loss: 1.0301, test_f1: 0.5114
 epoch: 24, train_loss: 0.9242, test_loss: 1.0516, test_f1: 0.5046
 epoch: 25, train_loss: 0.9150, test_loss: 1.0241, test_f1: 0.5156
 epoch: 26, train_loss: 0.9074, test_loss: 1.0262, test_f1: 0.5093
 epoch: 27, train_loss: 0.8997, test_loss: 1.0179, test_f1: 0.5368
 epoch: 28, train_loss: 0.9077, test_loss: 1.0088, test_f1: 0.5230
 epoch: 29, train_loss: 0.8954, test_loss: 1.0114, test_f1: 0.5395
 epoch: 30, train_loss: 0.8840, test_loss: 0.9941, test_f1: 0.5559
 epoch: 31, train_loss: 0.8939, test_loss: 1.0099, test_f1: 0.5689
 epoch: 32, train_loss: 0.8705, test_loss: 0.9987, test_f1: 0.5643
 epoch: 33, train_loss: 0.8816, test_loss: 1.0038, test_f1: 0.5219
 epoch: 34, train_loss: 0.8641, test_loss: 1.0040, test_f1: 0.5495
 epoch: 35, train_loss: 0.8667, test_loss: 0.9955, test_f1: 0.5510
 epoch: 36, train_loss: 0.8533, test_loss: 0.9696, test_f1: 0.5547
 epoch: 37, train_loss: 0.8517, test_loss: 0.9910, test_f1: 0.5342
 epoch: 38, train_loss: 0.8563, test_loss: 0.9940, test_f1: 0.5707
 epoch: 39, train_loss: 0.8543, test_loss: 0.9821, test_f1: 0.5583
 epoch: 40, train_loss: 0.8391, test_loss: 0.9699, test_f1: 0.5615
 epoch: 41, train_loss: 0.8388, test_loss: 0.9874, test_f1: 0.5460
 epoch: 42, train_loss: 0.8261, test_loss: 0.9839, test_f1: 0.5574
 epoch: 43, train_loss: 0.8440, test_loss: 0.9546, test_f1: 0.5593
 epoch: 44, train_loss: 0.8458, test_loss: 0.9750, test_f1: 0.5505
 epoch: 45, train_loss: 0.8354, test_loss: 0.9816, test_f1: 0.5473
 epoch: 46, train_loss: 0.8254, test_loss: 0.9805, test_f1: 0.5403
 epoch: 47, train_loss: 0.8200, test_loss: 0.9744, test_f1: 0.5505
 epoch: 48, train_loss: 0.8155, test_loss: 0.9787, test_f1: 0.5293
 epoch: 49, train_loss: 0.8150, test_loss: 0.9433, test_f1: 0.5734
 epoch: 50, train_loss: 0.8146, test_loss: 0.9913, test_f1: 0.5672
 epoch: 51, train_loss: 0.8124, test_loss: 0.9610, test_f1: 0.5586
 epoch: 52, train_loss: 0.7964, test_loss: 0.9799, test_f1: 0.5519
 epoch: 53, train_loss: 0.8075, test_loss: 0.9720, test_f1: 0.5438
 epoch: 54, train_loss: 0.8035, test_loss: 0.9632, test_f1: 0.5657
 epoch: 55, train_loss: 0.8026, test_loss: 0.9619, test_f1: 0.5535
 epoch: 56, train_loss: 0.8058, test_loss: 0.9587, test_f1: 0.5622
 epoch: 57, train_loss: 0.7923, test_loss: 0.9563, test_f1: 0.5582
 epoch: 58, train_loss: 0.7918, test_loss: 0.9698, test_f1: 0.5601
 epoch: 59, train_loss: 0.7818, test_loss: 0.9662, test_f1: 0.5608
 epoch: 60, train_loss: 0.7889, test_loss: 0.9680, test_f1: 0.5426
 epoch: 61, train_loss: 0.7782, test_loss: 0.9710, test_f1: 0.5601
 epoch: 62, train_loss: 0.7907, test_loss: 0.9780, test_f1: 0.5670
 epoch: 63, train_loss: 0.7952, test_loss: 0.9698, test_f1: 0.5673
 epoch: 64, train_loss: 0.7986, test_loss: 0.9661, test_f1: 0.5461
 epoch: 65, train_loss: 0.7923, test_loss: 0.9733, test_f1: 0.5785
 epoch: 66, train_loss: 0.7905, test_loss: 0.9625, test_f1: 0.5554
 epoch: 67, train_loss: 0.7764, test_loss: 0.9929, test_f1: 0.5577
 epoch: 68, train_loss: 0.7962, test_loss: 0.9763, test_f1: 0.5684
 epoch: 69, train_loss: 0.7794, test_loss: 0.9680, test_f1: 0.5678
 epoch: 70, train_loss: 0.7662, test_loss: 0.9763, test_f1: 0.5764
 epoch: 71, train_loss: 0.7744, test_loss: 0.9786, test_f1: 0.5861
 epoch: 72, train_loss: 0.7964, test_loss: 0.9635, test_f1: 0.5605
 epoch: 73, train_loss: 0.7697, test_loss: 0.9893, test_f1: 0.5707
 epoch: 74, train_loss: 0.7732, test_loss: 0.9552, test_f1: 0.5706
 epoch: 75, train_loss: 0.7759, test_loss: 0.9590, test_f1: 0.5686
 epoch: 76, train_loss: 0.7666, test_loss: 0.9682, test_f1: 0.5576
 epoch: 77, train_loss: 0.7712, test_loss: 0.9612, test_f1: 0.5693
 epoch: 78, train_loss: 0.7653, test_loss: 0.9798, test_f1: 0.5635
 epoch: 79, train_loss: 0.7709, test_loss: 0.9812, test_f1: 0.5663
 epoch: 80, train_loss: 0.7672, test_loss: 0.9791, test_f1: 0.5695
 epoch: 81, train_loss: 0.7855, test_loss: 0.9704, test_f1: 0.5882
 epoch: 82, train_loss: 0.7812, test_loss: 0.9691, test_f1: 0.5595
 epoch: 83, train_loss: 0.7677, test_loss: 0.9739, test_f1: 0.5823
 epoch: 84, train_loss: 0.7842, test_loss: 0.9965, test_f1: 0.5726
 epoch: 85, train_loss: 0.7563, test_loss: 0.9888, test_f1: 0.5709
 epoch: 86, train_loss: 0.7727, test_loss: 1.0225, test_f1: 0.5742
 epoch: 87, train_loss: 0.7527, test_loss: 0.9540, test_f1: 0.5787
 epoch: 88, train_loss: 0.7642, test_loss: 0.9811, test_f1: 0.5803
 epoch: 89, train_loss: 0.7675, test_loss: 0.9866, test_f1: 0.5771
 epoch: 90, train_loss: 0.7565, test_loss: 0.9744, test_f1: 0.5740
 epoch: 91, train_loss: 0.7583, test_loss: 1.0151, test_f1: 0.5704
 epoch: 92, train_loss: 0.7550, test_loss: 0.9974, test_f1: 0.5606
 epoch: 93, train_loss: 0.7658, test_loss: 0.9860, test_f1: 0.5848
 epoch: 94, train_loss: 0.7354, test_loss: 0.9895, test_f1: 0.5782
 epoch: 95, train_loss: 0.7482, test_loss: 0.9978, test_f1: 0.5915
 epoch: 96, train_loss: 0.7431, test_loss: 1.0072, test_f1: 0.5909
 epoch: 97, train_loss: 0.7501, test_loss: 0.9768, test_f1: 0.5966
 epoch: 98, train_loss: 0.7560, test_loss: 1.0196, test_f1: 0.5842
 epoch: 99, train_loss: 0.7721, test_loss: 0.9978, test_f1: 0.5556
##################ITERATION #6 ****************************************
 epoch: 0, train_loss: 1.2350, test_loss: 1.1885, test_f1: 0.3465
 epoch: 1, train_loss: 1.1062, test_loss: 1.1042, test_f1: 0.4465
 epoch: 2, train_loss: 1.0765, test_loss: 1.0871, test_f1: 0.4363
 epoch: 3, train_loss: 1.0358, test_loss: 1.0693, test_f1: 0.4624
 epoch: 4, train_loss: 1.0172, test_loss: 1.0366, test_f1: 0.5311
 epoch: 5, train_loss: 0.9999, test_loss: 1.0560, test_f1: 0.4844
 epoch: 6, train_loss: 0.9845, test_loss: 1.0731, test_f1: 0.4707
 epoch: 7, train_loss: 0.9954, test_loss: 1.0450, test_f1: 0.5145
 epoch: 8, train_loss: 0.9746, test_loss: 1.0518, test_f1: 0.5098
 epoch: 9, train_loss: 0.9636, test_loss: 1.0457, test_f1: 0.5332
 epoch: 10, train_loss: 0.9371, test_loss: 1.0612, test_f1: 0.5371
 epoch: 11, train_loss: 0.9477, test_loss: 1.0844, test_f1: 0.5082
 epoch: 12, train_loss: 0.9392, test_loss: 1.0425, test_f1: 0.5533
 epoch: 13, train_loss: 0.9329, test_loss: 1.0366, test_f1: 0.5561
 epoch: 14, train_loss: 0.9416, test_loss: 1.0402, test_f1: 0.5514
 epoch: 15, train_loss: 0.9184, test_loss: 1.0379, test_f1: 0.5638
 epoch: 16, train_loss: 0.9214, test_loss: 1.0510, test_f1: 0.5075
 epoch: 17, train_loss: 0.9156, test_loss: 1.0622, test_f1: 0.5169
 epoch: 18, train_loss: 0.9233, test_loss: 1.0854, test_f1: 0.5366
 epoch: 19, train_loss: 0.9066, test_loss: 1.1274, test_f1: 0.5153
 epoch: 20, train_loss: 0.9106, test_loss: 1.0408, test_f1: 0.5578
 epoch: 21, train_loss: 0.8980, test_loss: 1.0650, test_f1: 0.5116
 epoch: 22, train_loss: 0.9025, test_loss: 1.0765, test_f1: 0.5188
 epoch: 23, train_loss: 0.8984, test_loss: 1.0832, test_f1: 0.5131
 epoch: 24, train_loss: 0.8922, test_loss: 1.0597, test_f1: 0.5353
 epoch: 25, train_loss: 0.8841, test_loss: 1.0492, test_f1: 0.5283
 epoch: 26, train_loss: 0.8829, test_loss: 1.0770, test_f1: 0.5306
 epoch: 27, train_loss: 0.8882, test_loss: 1.0582, test_f1: 0.5275
 epoch: 28, train_loss: 0.8737, test_loss: 1.0595, test_f1: 0.5155
 epoch: 29, train_loss: 0.8831, test_loss: 1.0274, test_f1: 0.5520
 epoch: 30, train_loss: 0.8956, test_loss: 1.0454, test_f1: 0.5435
 epoch: 31, train_loss: 0.8669, test_loss: 1.0274, test_f1: 0.5574
 epoch: 32, train_loss: 0.8701, test_loss: 1.0644, test_f1: 0.5241
 epoch: 33, train_loss: 0.8723, test_loss: 1.0156, test_f1: 0.5455
 epoch: 34, train_loss: 0.8551, test_loss: 0.9996, test_f1: 0.5713
 epoch: 35, train_loss: 0.8569, test_loss: 1.0723, test_f1: 0.5327
 epoch: 36, train_loss: 0.8579, test_loss: 1.0534, test_f1: 0.5531
 epoch: 37, train_loss: 0.8619, test_loss: 1.0218, test_f1: 0.5520
 epoch: 38, train_loss: 0.8571, test_loss: 1.0882, test_f1: 0.5168
 epoch: 39, train_loss: 0.8506, test_loss: 1.0606, test_f1: 0.5240
 epoch: 40, train_loss: 0.8424, test_loss: 1.0264, test_f1: 0.5760
 epoch: 41, train_loss: 0.8470, test_loss: 1.0261, test_f1: 0.5629
 epoch: 42, train_loss: 0.8596, test_loss: 1.0137, test_f1: 0.5666
 epoch: 43, train_loss: 0.8530, test_loss: 1.0242, test_f1: 0.5701
 epoch: 44, train_loss: 0.8324, test_loss: 1.0538, test_f1: 0.5431
 epoch: 45, train_loss: 0.8375, test_loss: 1.0933, test_f1: 0.5323
 epoch: 46, train_loss: 0.8499, test_loss: 1.0962, test_f1: 0.5191
 epoch: 47, train_loss: 0.8348, test_loss: 0.9995, test_f1: 0.6039
 epoch: 48, train_loss: 0.8176, test_loss: 1.0180, test_f1: 0.5728
 epoch: 49, train_loss: 0.8368, test_loss: 1.0187, test_f1: 0.5832
 epoch: 50, train_loss: 0.8267, test_loss: 1.0640, test_f1: 0.5731
 epoch: 51, train_loss: 0.8276, test_loss: 0.9946, test_f1: 0.5910
 epoch: 52, train_loss: 0.8212, test_loss: 1.0049, test_f1: 0.5898
 epoch: 53, train_loss: 0.7983, test_loss: 1.0542, test_f1: 0.5723
 epoch: 54, train_loss: 0.8096, test_loss: 1.0079, test_f1: 0.5722
 epoch: 55, train_loss: 0.8070, test_loss: 0.9950, test_f1: 0.6018
 epoch: 56, train_loss: 0.8022, test_loss: 1.0169, test_f1: 0.5804
 epoch: 57, train_loss: 0.7985, test_loss: 0.9833, test_f1: 0.6019
 epoch: 58, train_loss: 0.8150, test_loss: 1.0047, test_f1: 0.5931
 epoch: 59, train_loss: 0.8022, test_loss: 1.0159, test_f1: 0.5922
 epoch: 60, train_loss: 0.7796, test_loss: 1.0135, test_f1: 0.5886
 epoch: 61, train_loss: 0.7770, test_loss: 1.0465, test_f1: 0.5824
 epoch: 62, train_loss: 0.7999, test_loss: 1.0204, test_f1: 0.5830
 epoch: 63, train_loss: 0.7927, test_loss: 1.0282, test_f1: 0.5774
 epoch: 64, train_loss: 0.8029, test_loss: 1.0157, test_f1: 0.5850
 epoch: 65, train_loss: 0.8026, test_loss: 1.0141, test_f1: 0.6022
 epoch: 66, train_loss: 0.7881, test_loss: 1.0061, test_f1: 0.5808
 epoch: 67, train_loss: 0.7848, test_loss: 1.0185, test_f1: 0.5739
 epoch: 68, train_loss: 0.7891, test_loss: 1.0074, test_f1: 0.6006
 epoch: 69, train_loss: 0.7768, test_loss: 1.0096, test_f1: 0.5892
 epoch: 70, train_loss: 0.7896, test_loss: 1.0300, test_f1: 0.5738
 epoch: 71, train_loss: 0.7788, test_loss: 0.9975, test_f1: 0.6017
 epoch: 72, train_loss: 0.7777, test_loss: 1.0270, test_f1: 0.5857
 epoch: 73, train_loss: 0.7641, test_loss: 1.0216, test_f1: 0.5704
 epoch: 74, train_loss: 0.7853, test_loss: 1.0189, test_f1: 0.5830
 epoch: 75, train_loss: 0.7652, test_loss: 1.0365, test_f1: 0.5706
 epoch: 76, train_loss: 0.7763, test_loss: 1.0423, test_f1: 0.5582
 epoch: 77, train_loss: 0.7777, test_loss: 1.0343, test_f1: 0.5711
 epoch: 78, train_loss: 0.7658, test_loss: 1.0281, test_f1: 0.5610
 epoch: 79, train_loss: 0.7778, test_loss: 1.0301, test_f1: 0.5863
 epoch: 80, train_loss: 0.7501, test_loss: 1.0330, test_f1: 0.5914
 epoch: 81, train_loss: 0.7523, test_loss: 1.0151, test_f1: 0.5848
 epoch: 82, train_loss: 0.7589, test_loss: 1.0254, test_f1: 0.5584
 epoch: 83, train_loss: 0.7734, test_loss: 1.0152, test_f1: 0.5714
 epoch: 84, train_loss: 0.7701, test_loss: 1.0134, test_f1: 0.5828
 epoch: 85, train_loss: 0.7708, test_loss: 1.0210, test_f1: 0.5742
 epoch: 86, train_loss: 0.7758, test_loss: 1.0320, test_f1: 0.5959
 epoch: 87, train_loss: 0.7578, test_loss: 1.0574, test_f1: 0.5800
 epoch: 88, train_loss: 0.7468, test_loss: 1.2021, test_f1: 0.5045
 epoch: 89, train_loss: 0.7738, test_loss: 1.0540, test_f1: 0.5577
 epoch: 90, train_loss: 0.7589, test_loss: 1.0212, test_f1: 0.5654
 epoch: 91, train_loss: 0.7571, test_loss: 1.0142, test_f1: 0.5761
 epoch: 92, train_loss: 0.7620, test_loss: 1.0230, test_f1: 0.5766
 epoch: 93, train_loss: 0.7901, test_loss: 1.0259, test_f1: 0.5619
 epoch: 94, train_loss: 0.7430, test_loss: 1.0204, test_f1: 0.5806
 epoch: 95, train_loss: 0.7560, test_loss: 1.0646, test_f1: 0.5685
 epoch: 96, train_loss: 0.7430, test_loss: 1.0234, test_f1: 0.5536
 epoch: 97, train_loss: 0.7538, test_loss: 1.0349, test_f1: 0.5739
 epoch: 98, train_loss: 0.7388, test_loss: 1.0508, test_f1: 0.5751
 epoch: 99, train_loss: 0.7465, test_loss: 1.0317, test_f1: 0.5667
##################ITERATION #7 ****************************************
 epoch: 0, train_loss: 1.4530, test_loss: 1.3231, test_f1: 0.3098
 epoch: 1, train_loss: 1.2100, test_loss: 1.2116, test_f1: 0.4143
 epoch: 2, train_loss: 1.1586, test_loss: 1.2000, test_f1: 0.3912
 epoch: 3, train_loss: 1.1213, test_loss: 1.1409, test_f1: 0.4077
 epoch: 4, train_loss: 1.1020, test_loss: 1.1492, test_f1: 0.4254
 epoch: 5, train_loss: 1.0991, test_loss: 1.1220, test_f1: 0.4725
 epoch: 6, train_loss: 1.0614, test_loss: 1.1228, test_f1: 0.4781
 epoch: 7, train_loss: 1.0640, test_loss: 1.0852, test_f1: 0.4558
 epoch: 8, train_loss: 1.0657, test_loss: 1.0891, test_f1: 0.4979
 epoch: 9, train_loss: 1.0427, test_loss: 1.0865, test_f1: 0.4939
 epoch: 10, train_loss: 1.0155, test_loss: 1.0732, test_f1: 0.5011
 epoch: 11, train_loss: 1.0287, test_loss: 1.0777, test_f1: 0.5183
 epoch: 12, train_loss: 1.0213, test_loss: 1.0358, test_f1: 0.5581
 epoch: 13, train_loss: 1.0049, test_loss: 1.0385, test_f1: 0.4817
 epoch: 14, train_loss: 0.9964, test_loss: 1.0294, test_f1: 0.5182
 epoch: 15, train_loss: 1.0015, test_loss: 1.0300, test_f1: 0.4774
 epoch: 16, train_loss: 0.9811, test_loss: 1.0140, test_f1: 0.4674
 epoch: 17, train_loss: 0.9638, test_loss: 1.0331, test_f1: 0.4920
 epoch: 18, train_loss: 0.9657, test_loss: 1.0121, test_f1: 0.5304
 epoch: 19, train_loss: 0.9672, test_loss: 1.0108, test_f1: 0.4966
 epoch: 20, train_loss: 0.9609, test_loss: 0.9975, test_f1: 0.5231
 epoch: 21, train_loss: 0.9585, test_loss: 1.0025, test_f1: 0.5384
 epoch: 22, train_loss: 0.9199, test_loss: 0.9966, test_f1: 0.5254
 epoch: 23, train_loss: 0.9385, test_loss: 0.9831, test_f1: 0.5275
 epoch: 24, train_loss: 0.9339, test_loss: 1.0038, test_f1: 0.5463
 epoch: 25, train_loss: 0.9322, test_loss: 0.9674, test_f1: 0.5269
 epoch: 26, train_loss: 0.9103, test_loss: 1.0216, test_f1: 0.5036
 epoch: 27, train_loss: 0.9199, test_loss: 1.0006, test_f1: 0.5198
 epoch: 28, train_loss: 0.9199, test_loss: 0.9865, test_f1: 0.5331
 epoch: 29, train_loss: 0.9064, test_loss: 1.0002, test_f1: 0.5162
 epoch: 30, train_loss: 0.8958, test_loss: 0.9854, test_f1: 0.5389
 epoch: 31, train_loss: 0.8937, test_loss: 0.9738, test_f1: 0.5286
 epoch: 32, train_loss: 0.8827, test_loss: 0.9665, test_f1: 0.5306
 epoch: 33, train_loss: 0.8791, test_loss: 0.9732, test_f1: 0.5351
 epoch: 34, train_loss: 0.8921, test_loss: 0.9727, test_f1: 0.5315
 epoch: 35, train_loss: 0.8629, test_loss: 0.9727, test_f1: 0.5346
 epoch: 36, train_loss: 0.8740, test_loss: 1.0147, test_f1: 0.5211
 epoch: 37, train_loss: 0.8684, test_loss: 0.9768, test_f1: 0.5265
 epoch: 38, train_loss: 0.8550, test_loss: 0.9526, test_f1: 0.5311
 epoch: 39, train_loss: 0.8597, test_loss: 0.9990, test_f1: 0.5433
 epoch: 40, train_loss: 0.8665, test_loss: 0.9541, test_f1: 0.5380
 epoch: 41, train_loss: 0.8650, test_loss: 0.9634, test_f1: 0.5334
 epoch: 42, train_loss: 0.8420, test_loss: 0.9720, test_f1: 0.5477
 epoch: 43, train_loss: 0.8565, test_loss: 0.9618, test_f1: 0.5568
 epoch: 44, train_loss: 0.8276, test_loss: 0.9635, test_f1: 0.5399
 epoch: 45, train_loss: 0.8428, test_loss: 0.9638, test_f1: 0.5691
 epoch: 46, train_loss: 0.8430, test_loss: 0.9615, test_f1: 0.5658
 epoch: 47, train_loss: 0.8392, test_loss: 1.0322, test_f1: 0.5303
 epoch: 48, train_loss: 0.8450, test_loss: 1.0032, test_f1: 0.5388
 epoch: 49, train_loss: 0.8344, test_loss: 0.9886, test_f1: 0.5486
 epoch: 50, train_loss: 0.8172, test_loss: 0.9836, test_f1: 0.5419
 epoch: 51, train_loss: 0.8184, test_loss: 0.9662, test_f1: 0.5515
 epoch: 52, train_loss: 0.8013, test_loss: 1.0036, test_f1: 0.5254
 epoch: 53, train_loss: 0.8246, test_loss: 0.9969, test_f1: 0.5314
 epoch: 54, train_loss: 0.8126, test_loss: 0.9746, test_f1: 0.5558
 epoch: 55, train_loss: 0.8094, test_loss: 0.9802, test_f1: 0.5341
 epoch: 56, train_loss: 0.8157, test_loss: 0.9581, test_f1: 0.5438
 epoch: 57, train_loss: 0.8168, test_loss: 0.9789, test_f1: 0.5607
 epoch: 58, train_loss: 0.7973, test_loss: 0.9920, test_f1: 0.5400
 epoch: 59, train_loss: 0.8070, test_loss: 0.9811, test_f1: 0.5817
 epoch: 60, train_loss: 0.8201, test_loss: 0.9939, test_f1: 0.5642
 epoch: 61, train_loss: 0.7979, test_loss: 0.9879, test_f1: 0.5425
 epoch: 62, train_loss: 0.7872, test_loss: 1.0060, test_f1: 0.5594
 epoch: 63, train_loss: 0.8000, test_loss: 0.9688, test_f1: 0.5803
 epoch: 64, train_loss: 0.7955, test_loss: 0.9898, test_f1: 0.5392
 epoch: 65, train_loss: 0.8018, test_loss: 0.9694, test_f1: 0.5715
 epoch: 66, train_loss: 0.8037, test_loss: 0.9743, test_f1: 0.5743
 epoch: 67, train_loss: 0.7931, test_loss: 0.9880, test_f1: 0.5418
 epoch: 68, train_loss: 0.7893, test_loss: 0.9767, test_f1: 0.5536
 epoch: 69, train_loss: 0.7860, test_loss: 0.9599, test_f1: 0.5380
 epoch: 70, train_loss: 0.7808, test_loss: 1.0039, test_f1: 0.5351
 epoch: 71, train_loss: 0.7741, test_loss: 0.9516, test_f1: 0.5826
 epoch: 72, train_loss: 0.7933, test_loss: 0.9921, test_f1: 0.5665
 epoch: 73, train_loss: 0.7957, test_loss: 0.9825, test_f1: 0.5790
 epoch: 74, train_loss: 0.7942, test_loss: 1.0089, test_f1: 0.5648
 epoch: 75, train_loss: 0.7857, test_loss: 0.9901, test_f1: 0.5806
 epoch: 76, train_loss: 0.7798, test_loss: 0.9800, test_f1: 0.5701
 epoch: 77, train_loss: 0.7705, test_loss: 0.9566, test_f1: 0.5820
 epoch: 78, train_loss: 0.7757, test_loss: 1.0091, test_f1: 0.5544
 epoch: 79, train_loss: 0.7730, test_loss: 0.9539, test_f1: 0.5994
 epoch: 80, train_loss: 0.7769, test_loss: 1.0149, test_f1: 0.5524
 epoch: 81, train_loss: 0.7805, test_loss: 0.9924, test_f1: 0.5745
 epoch: 82, train_loss: 0.7731, test_loss: 1.0276, test_f1: 0.5254
 epoch: 83, train_loss: 0.7553, test_loss: 0.9923, test_f1: 0.5519
 epoch: 84, train_loss: 0.7711, test_loss: 0.9688, test_f1: 0.5921
 epoch: 85, train_loss: 0.7664, test_loss: 1.0158, test_f1: 0.5556
 epoch: 86, train_loss: 0.7715, test_loss: 0.9991, test_f1: 0.5760
 epoch: 87, train_loss: 0.7626, test_loss: 0.9861, test_f1: 0.5724
 epoch: 88, train_loss: 0.7703, test_loss: 0.9480, test_f1: 0.5739
 epoch: 89, train_loss: 0.7638, test_loss: 0.9871, test_f1: 0.6063
 epoch: 90, train_loss: 0.7722, test_loss: 1.0204, test_f1: 0.5999
 epoch: 91, train_loss: 0.7777, test_loss: 0.9985, test_f1: 0.5519
 epoch: 92, train_loss: 0.7635, test_loss: 0.9687, test_f1: 0.5456
 epoch: 93, train_loss: 0.7588, test_loss: 0.9556, test_f1: 0.5789
 epoch: 94, train_loss: 0.7758, test_loss: 0.9678, test_f1: 0.5757
 epoch: 95, train_loss: 0.7727, test_loss: 0.9700, test_f1: 0.5840
 epoch: 96, train_loss: 0.7524, test_loss: 0.9542, test_f1: 0.5757
 epoch: 97, train_loss: 0.7654, test_loss: 0.9860, test_f1: 0.6114
 epoch: 98, train_loss: 0.7728, test_loss: 0.9527, test_f1: 0.5991
 epoch: 99, train_loss: 0.7524, test_loss: 0.9910, test_f1: 0.5587
##################ITERATION #8 ****************************************
 epoch: 0, train_loss: 1.4432, test_loss: 1.3027, test_f1: 0.3328
 epoch: 1, train_loss: 1.1756, test_loss: 1.2620, test_f1: 0.3563
 epoch: 2, train_loss: 1.1614, test_loss: 1.2159, test_f1: 0.3563
 epoch: 3, train_loss: 1.1034, test_loss: 1.1687, test_f1: 0.3895
 epoch: 4, train_loss: 1.0828, test_loss: 1.1666, test_f1: 0.4124
 epoch: 5, train_loss: 1.0706, test_loss: 1.1602, test_f1: 0.4209
 epoch: 6, train_loss: 1.0631, test_loss: 1.1480, test_f1: 0.4380
 epoch: 7, train_loss: 1.0404, test_loss: 1.1425, test_f1: 0.4397
 epoch: 8, train_loss: 1.0266, test_loss: 1.1292, test_f1: 0.4446
 epoch: 9, train_loss: 1.0074, test_loss: 1.1045, test_f1: 0.4478
 epoch: 10, train_loss: 1.0025, test_loss: 1.1402, test_f1: 0.4365
 epoch: 11, train_loss: 1.0088, test_loss: 1.0671, test_f1: 0.4827
 epoch: 12, train_loss: 0.9917, test_loss: 1.0976, test_f1: 0.4504
 epoch: 13, train_loss: 0.9549, test_loss: 1.0768, test_f1: 0.4822
 epoch: 14, train_loss: 0.9571, test_loss: 1.0599, test_f1: 0.4514
 epoch: 15, train_loss: 0.9637, test_loss: 1.0803, test_f1: 0.4556
 epoch: 16, train_loss: 0.9612, test_loss: 1.0978, test_f1: 0.4611
 epoch: 17, train_loss: 0.9504, test_loss: 1.0595, test_f1: 0.4938
 epoch: 18, train_loss: 0.9249, test_loss: 1.0865, test_f1: 0.4939
 epoch: 19, train_loss: 0.9262, test_loss: 1.0751, test_f1: 0.5009
 epoch: 20, train_loss: 0.9360, test_loss: 1.0596, test_f1: 0.4961
 epoch: 21, train_loss: 0.9063, test_loss: 1.0720, test_f1: 0.4789
 epoch: 22, train_loss: 0.9061, test_loss: 1.0926, test_f1: 0.4843
 epoch: 23, train_loss: 0.9130, test_loss: 1.0361, test_f1: 0.5007
 epoch: 24, train_loss: 0.9137, test_loss: 1.0624, test_f1: 0.5008
 epoch: 25, train_loss: 0.8765, test_loss: 1.0738, test_f1: 0.5122
 epoch: 26, train_loss: 0.8801, test_loss: 1.0840, test_f1: 0.4818
 epoch: 27, train_loss: 0.8970, test_loss: 1.0598, test_f1: 0.4992
 epoch: 28, train_loss: 0.8813, test_loss: 1.1021, test_f1: 0.4829
 epoch: 29, train_loss: 0.8808, test_loss: 1.0735, test_f1: 0.4938
 epoch: 30, train_loss: 0.8757, test_loss: 1.1114, test_f1: 0.5023
 epoch: 31, train_loss: 0.8694, test_loss: 1.0577, test_f1: 0.4927
 epoch: 32, train_loss: 0.8619, test_loss: 1.0421, test_f1: 0.4943
 epoch: 33, train_loss: 0.8503, test_loss: 1.1205, test_f1: 0.4908
 epoch: 34, train_loss: 0.8527, test_loss: 1.0666, test_f1: 0.4752
 epoch: 35, train_loss: 0.8565, test_loss: 1.0843, test_f1: 0.4797
 epoch: 36, train_loss: 0.8546, test_loss: 1.0988, test_f1: 0.4690
 epoch: 37, train_loss: 0.8558, test_loss: 1.1421, test_f1: 0.4734
 epoch: 38, train_loss: 0.8499, test_loss: 1.0574, test_f1: 0.4841
 epoch: 39, train_loss: 0.8284, test_loss: 1.0516, test_f1: 0.5073
 epoch: 40, train_loss: 0.8373, test_loss: 1.0349, test_f1: 0.5034
 epoch: 41, train_loss: 0.8326, test_loss: 0.9947, test_f1: 0.4826
 epoch: 42, train_loss: 0.8363, test_loss: 1.0137, test_f1: 0.4915
 epoch: 43, train_loss: 0.8270, test_loss: 1.0580, test_f1: 0.5124
 epoch: 44, train_loss: 0.8180, test_loss: 1.1280, test_f1: 0.4948
 epoch: 45, train_loss: 0.8189, test_loss: 1.0783, test_f1: 0.4982
 epoch: 46, train_loss: 0.8208, test_loss: 1.0713, test_f1: 0.4902
 epoch: 47, train_loss: 0.8116, test_loss: 1.0975, test_f1: 0.4955
 epoch: 48, train_loss: 0.8170, test_loss: 1.0284, test_f1: 0.4986
 epoch: 49, train_loss: 0.8117, test_loss: 1.0592, test_f1: 0.5088
 epoch: 50, train_loss: 0.8073, test_loss: 1.0335, test_f1: 0.5442
 epoch: 51, train_loss: 0.8021, test_loss: 1.0719, test_f1: 0.4982
 epoch: 52, train_loss: 0.7850, test_loss: 1.0363, test_f1: 0.4990
 epoch: 53, train_loss: 0.7851, test_loss: 1.0256, test_f1: 0.5088
 epoch: 54, train_loss: 0.7763, test_loss: 1.0416, test_f1: 0.4859
 epoch: 55, train_loss: 0.7747, test_loss: 1.0752, test_f1: 0.4936
 epoch: 56, train_loss: 0.7631, test_loss: 1.0473, test_f1: 0.5159
 epoch: 57, train_loss: 0.7787, test_loss: 1.0057, test_f1: 0.4951
 epoch: 58, train_loss: 0.7941, test_loss: 1.0207, test_f1: 0.5457
 epoch: 59, train_loss: 0.7711, test_loss: 1.0420, test_f1: 0.5715
 epoch: 60, train_loss: 0.7844, test_loss: 1.0395, test_f1: 0.5490
 epoch: 61, train_loss: 0.7795, test_loss: 1.0633, test_f1: 0.5186
 epoch: 62, train_loss: 0.7653, test_loss: 1.0767, test_f1: 0.5084
 epoch: 63, train_loss: 0.7721, test_loss: 1.0343, test_f1: 0.5054
 epoch: 64, train_loss: 0.7753, test_loss: 1.0586, test_f1: 0.5413
 epoch: 65, train_loss: 0.7619, test_loss: 1.0486, test_f1: 0.5346
 epoch: 66, train_loss: 0.7560, test_loss: 1.0213, test_f1: 0.5471
 epoch: 67, train_loss: 0.7592, test_loss: 1.0320, test_f1: 0.5298
 epoch: 68, train_loss: 0.7628, test_loss: 1.0276, test_f1: 0.5532
 epoch: 69, train_loss: 0.7468, test_loss: 1.0566, test_f1: 0.5628
 epoch: 70, train_loss: 0.7520, test_loss: 1.0380, test_f1: 0.5261
 epoch: 71, train_loss: 0.7662, test_loss: 1.0375, test_f1: 0.5262
 epoch: 72, train_loss: 0.7545, test_loss: 1.0505, test_f1: 0.5356
 epoch: 73, train_loss: 0.7433, test_loss: 1.0309, test_f1: 0.5261
 epoch: 74, train_loss: 0.7617, test_loss: 1.0704, test_f1: 0.5781
 epoch: 75, train_loss: 0.7548, test_loss: 1.0735, test_f1: 0.5767
 epoch: 76, train_loss: 0.7478, test_loss: 1.0786, test_f1: 0.6015
 epoch: 77, train_loss: 0.7531, test_loss: 1.0191, test_f1: 0.5629
 epoch: 78, train_loss: 0.7629, test_loss: 1.0539, test_f1: 0.5635
 epoch: 79, train_loss: 0.7490, test_loss: 1.0509, test_f1: 0.5770
 epoch: 80, train_loss: 0.7559, test_loss: 1.0644, test_f1: 0.5913
 epoch: 81, train_loss: 0.7462, test_loss: 1.0904, test_f1: 0.5307
 epoch: 82, train_loss: 0.7449, test_loss: 1.0403, test_f1: 0.5608
 epoch: 83, train_loss: 0.7487, test_loss: 1.0396, test_f1: 0.5609
 epoch: 84, train_loss: 0.7472, test_loss: 1.0503, test_f1: 0.5849
 epoch: 85, train_loss: 0.7496, test_loss: 1.0300, test_f1: 0.6147
 epoch: 86, train_loss: 0.7439, test_loss: 1.0204, test_f1: 0.5365
 epoch: 87, train_loss: 0.7458, test_loss: 1.0171, test_f1: 0.6132
 epoch: 88, train_loss: 0.7280, test_loss: 1.0073, test_f1: 0.5876
 epoch: 89, train_loss: 0.7275, test_loss: 1.0583, test_f1: 0.5904
 epoch: 90, train_loss: 0.7420, test_loss: 1.0567, test_f1: 0.5954
 epoch: 91, train_loss: 0.7401, test_loss: 1.0215, test_f1: 0.5804
 epoch: 92, train_loss: 0.7382, test_loss: 1.0384, test_f1: 0.6194
 epoch: 93, train_loss: 0.7358, test_loss: 1.0070, test_f1: 0.5707
 epoch: 94, train_loss: 0.7319, test_loss: 1.0400, test_f1: 0.5433
 epoch: 95, train_loss: 0.7398, test_loss: 1.0505, test_f1: 0.5905
 epoch: 96, train_loss: 0.7344, test_loss: 1.0613, test_f1: 0.5796
 epoch: 97, train_loss: 0.7432, test_loss: 1.0327, test_f1: 0.6170
 epoch: 98, train_loss: 0.7286, test_loss: 1.0264, test_f1: 0.5772
 epoch: 99, train_loss: 0.7542, test_loss: 1.0121, test_f1: 0.5768
##################ITERATION #9 ****************************************
 epoch: 0, train_loss: 1.6353, test_loss: 1.3650, test_f1: 0.3182
 epoch: 1, train_loss: 1.2161, test_loss: 1.3213, test_f1: 0.3638
 epoch: 2, train_loss: 1.1661, test_loss: 1.2409, test_f1: 0.4166
 epoch: 3, train_loss: 1.1282, test_loss: 1.1830, test_f1: 0.4384
 epoch: 4, train_loss: 1.1042, test_loss: 1.1666, test_f1: 0.4512
 epoch: 5, train_loss: 1.0687, test_loss: 1.1701, test_f1: 0.4718
 epoch: 6, train_loss: 1.0670, test_loss: 1.1633, test_f1: 0.4885
 epoch: 7, train_loss: 1.0314, test_loss: 1.1355, test_f1: 0.4709
 epoch: 8, train_loss: 1.0190, test_loss: 1.0955, test_f1: 0.5032
 epoch: 9, train_loss: 1.0192, test_loss: 1.1552, test_f1: 0.4316
 epoch: 10, train_loss: 0.9887, test_loss: 1.1003, test_f1: 0.4778
 epoch: 11, train_loss: 0.9948, test_loss: 1.0701, test_f1: 0.5095
 epoch: 12, train_loss: 0.9743, test_loss: 1.0631, test_f1: 0.5132
 epoch: 13, train_loss: 0.9778, test_loss: 1.0556, test_f1: 0.5285
 epoch: 14, train_loss: 0.9556, test_loss: 1.0819, test_f1: 0.5164
 epoch: 15, train_loss: 0.9660, test_loss: 1.0795, test_f1: 0.5076
 epoch: 16, train_loss: 0.9534, test_loss: 1.0486, test_f1: 0.5236
 epoch: 17, train_loss: 0.9453, test_loss: 1.0769, test_f1: 0.5241
 epoch: 18, train_loss: 0.9519, test_loss: 1.0428, test_f1: 0.5426
 epoch: 19, train_loss: 0.9270, test_loss: 1.0302, test_f1: 0.5686
 epoch: 20, train_loss: 0.9388, test_loss: 1.0598, test_f1: 0.5392
 epoch: 21, train_loss: 0.9250, test_loss: 1.0683, test_f1: 0.5431
 epoch: 22, train_loss: 0.9283, test_loss: 1.0594, test_f1: 0.5345
 epoch: 23, train_loss: 0.9258, test_loss: 1.0309, test_f1: 0.5389
 epoch: 24, train_loss: 0.9045, test_loss: 1.0626, test_f1: 0.5388
 epoch: 25, train_loss: 0.8998, test_loss: 1.0524, test_f1: 0.5436
 epoch: 26, train_loss: 0.8946, test_loss: 1.0793, test_f1: 0.5403
 epoch: 27, train_loss: 0.8989, test_loss: 1.0536, test_f1: 0.5391
 epoch: 28, train_loss: 0.8792, test_loss: 1.0314, test_f1: 0.5402
 epoch: 29, train_loss: 0.8802, test_loss: 1.0982, test_f1: 0.4983
 epoch: 30, train_loss: 0.9001, test_loss: 1.0929, test_f1: 0.5225
 epoch: 31, train_loss: 0.8850, test_loss: 1.0678, test_f1: 0.5479
 epoch: 32, train_loss: 0.8827, test_loss: 1.1416, test_f1: 0.5535
 epoch: 33, train_loss: 0.9080, test_loss: 1.0677, test_f1: 0.5574
 epoch: 34, train_loss: 0.8716, test_loss: 1.0003, test_f1: 0.5716
 epoch: 35, train_loss: 0.8532, test_loss: 1.0948, test_f1: 0.5267
 epoch: 36, train_loss: 0.8805, test_loss: 1.0211, test_f1: 0.5367
 epoch: 37, train_loss: 0.8739, test_loss: 1.0342, test_f1: 0.5290
 epoch: 38, train_loss: 0.8701, test_loss: 1.1174, test_f1: 0.4990
 epoch: 39, train_loss: 0.8672, test_loss: 1.0224, test_f1: 0.5481
 epoch: 40, train_loss: 0.8429, test_loss: 1.0163, test_f1: 0.5568
 epoch: 41, train_loss: 0.8443, test_loss: 1.0629, test_f1: 0.5507
 epoch: 42, train_loss: 0.8606, test_loss: 1.0330, test_f1: 0.5564
 epoch: 43, train_loss: 0.8480, test_loss: 1.0187, test_f1: 0.5463
 epoch: 44, train_loss: 0.8288, test_loss: 1.0497, test_f1: 0.5652
 epoch: 45, train_loss: 0.8397, test_loss: 1.0443, test_f1: 0.5542
 epoch: 46, train_loss: 0.8368, test_loss: 1.0204, test_f1: 0.5523
 epoch: 47, train_loss: 0.8250, test_loss: 1.0808, test_f1: 0.5679
 epoch: 48, train_loss: 0.8268, test_loss: 1.0363, test_f1: 0.5561
 epoch: 49, train_loss: 0.8161, test_loss: 1.0002, test_f1: 0.5409
 epoch: 50, train_loss: 0.8222, test_loss: 1.0419, test_f1: 0.5434
 epoch: 51, train_loss: 0.7962, test_loss: 1.0310, test_f1: 0.5454
 epoch: 52, train_loss: 0.7948, test_loss: 0.9876, test_f1: 0.5494
 epoch: 53, train_loss: 0.8007, test_loss: 1.0303, test_f1: 0.5468
 epoch: 54, train_loss: 0.8226, test_loss: 0.9909, test_f1: 0.5626
 epoch: 55, train_loss: 0.8163, test_loss: 1.0189, test_f1: 0.5689
 epoch: 56, train_loss: 0.8051, test_loss: 1.0333, test_f1: 0.5569
 epoch: 57, train_loss: 0.7847, test_loss: 1.0341, test_f1: 0.5415
 epoch: 58, train_loss: 0.7988, test_loss: 1.0531, test_f1: 0.5412
 epoch: 59, train_loss: 0.7875, test_loss: 1.0235, test_f1: 0.5563
 epoch: 60, train_loss: 0.7909, test_loss: 1.0535, test_f1: 0.5701
 epoch: 61, train_loss: 0.8048, test_loss: 1.0743, test_f1: 0.5458
 epoch: 62, train_loss: 0.7957, test_loss: 1.0036, test_f1: 0.5406
 epoch: 63, train_loss: 0.7941, test_loss: 1.0357, test_f1: 0.5582
 epoch: 64, train_loss: 0.7780, test_loss: 0.9902, test_f1: 0.5762
 epoch: 65, train_loss: 0.7903, test_loss: 1.0404, test_f1: 0.5813
 epoch: 66, train_loss: 0.7859, test_loss: 0.9985, test_f1: 0.5606
 epoch: 67, train_loss: 0.7927, test_loss: 1.0328, test_f1: 0.5921
 epoch: 68, train_loss: 0.7618, test_loss: 1.0069, test_f1: 0.5756
 epoch: 69, train_loss: 0.7595, test_loss: 1.0509, test_f1: 0.5575
 epoch: 70, train_loss: 0.7838, test_loss: 1.0507, test_f1: 0.5457
 epoch: 71, train_loss: 0.7869, test_loss: 1.0251, test_f1: 0.5721
 epoch: 72, train_loss: 0.7782, test_loss: 0.9717, test_f1: 0.5636
 epoch: 73, train_loss: 0.7619, test_loss: 1.0325, test_f1: 0.5634
 epoch: 74, train_loss: 0.7643, test_loss: 0.9836, test_f1: 0.5652
 epoch: 75, train_loss: 0.7560, test_loss: 1.0240, test_f1: 0.5518
 epoch: 76, train_loss: 0.7534, test_loss: 0.9968, test_f1: 0.5548
 epoch: 77, train_loss: 0.7604, test_loss: 0.9878, test_f1: 0.5695
 epoch: 78, train_loss: 0.7770, test_loss: 0.9818, test_f1: 0.5911
 epoch: 79, train_loss: 0.7571, test_loss: 1.0155, test_f1: 0.5786
 epoch: 80, train_loss: 0.7588, test_loss: 1.0108, test_f1: 0.5679
 epoch: 81, train_loss: 0.7524, test_loss: 1.0501, test_f1: 0.5898
 epoch: 82, train_loss: 0.7846, test_loss: 0.9717, test_f1: 0.5923
 epoch: 83, train_loss: 0.7689, test_loss: 1.0219, test_f1: 0.5727
 epoch: 84, train_loss: 0.7596, test_loss: 1.0511, test_f1: 0.6141
 epoch: 85, train_loss: 0.7628, test_loss: 0.9836, test_f1: 0.5954
 epoch: 86, train_loss: 0.7686, test_loss: 0.9929, test_f1: 0.5824
 epoch: 87, train_loss: 0.7411, test_loss: 1.0106, test_f1: 0.5855
 epoch: 88, train_loss: 0.7521, test_loss: 1.0137, test_f1: 0.5941
 epoch: 89, train_loss: 0.7313, test_loss: 1.0331, test_f1: 0.5762
 epoch: 90, train_loss: 0.7572, test_loss: 1.0008, test_f1: 0.5641
 epoch: 91, train_loss: 0.7461, test_loss: 1.0471, test_f1: 0.6005
 epoch: 92, train_loss: 0.7488, test_loss: 1.0383, test_f1: 0.5665
 epoch: 93, train_loss: 0.7362, test_loss: 1.0031, test_f1: 0.5817
 epoch: 94, train_loss: 0.7406, test_loss: 1.0149, test_f1: 0.5690
 epoch: 95, train_loss: 0.7528, test_loss: 1.0168, test_f1: 0.5892
 epoch: 96, train_loss: 0.7271, test_loss: 1.0145, test_f1: 0.5906
 epoch: 97, train_loss: 0.7507, test_loss: 1.0161, test_f1: 0.6167
 epoch: 98, train_loss: 0.7320, test_loss: 1.0323, test_f1: 0.6070
 epoch: 99, train_loss: 0.7273, test_loss: 1.0116, test_f1: 0.5813

Training completed in 762.32 seconds
Best F1: 0.6351 at epoch 81
Mean F1 across iterations: 0.6069  0.0172
========================FINAL RESULTS================================
FEGIN weighted F1: 0.6351  0.0172
python main.py --data ltspice_demos --representation component_net --model FEGIN --layers 2 --hiddens 16 --batch_size 32 --lr 0.001 --emb_size 250 --epochs 100 --save_appendix component_net_L2_H16_BS32_LR0.001_E250 --no_val
-----



STDERR:
  File "main.py", line 370, in <module>
    main()
  File "main.py", line 254, in main
    dataset = dataset_class(
  File "/home/philip/projects/ltspice_examples_code_repo/Circuit-Completion-Using-GNNs/component_classification_with_link_prediction_head/evaluation/FEGIN/kernel/circuit_datasets.py", line 15, in __init__
    self.data, self.slices = torch.load(self.processed_paths[0])
  File "/home/philip/.local/lib/python3.8/site-packages/torch/serialization.py", line 1040, in load
    warnings.warn(
  File "/usr/lib/python3.8/warnings.py", line 109, in _showwarnmsg
    sw(msg.message, msg.category, msg.filename, msg.lineno,
  File "main.py", line 47, in warn_with_traceback
    traceback.print_stack(file=log)
/home/philip/projects/ltspice_examples_code_repo/Circuit-Completion-Using-GNNs/component_classification_with_link_prediction_head/evaluation/FEGIN/kernel/circuit_datasets.py:15: FutureWarning: You are using `torch.load` with `weights_only=False` (the current default value), which uses the default pickle module implicitly. It is possible to construct malicious pickle data which will execute arbitrary code during unpickling (See https://github.com/pytorch/pytorch/blob/main/SECURITY.md#untrusted-models for more details). In a future release, the default value for `weights_only` will be flipped to `True`. This limits the functions that could be executed during unpickling. Arbitrary objects will no longer be allowed to be loaded via this mode unless they are explicitly allowlisted by the user via `torch.serialization.add_safe_globals`. We recommend you start setting `weights_only=True` for any use case where you don't have full control of the loaded file. Please open an issue on GitHub for any issues related to this experimental feature.
  self.data, self.slices = torch.load(self.processed_paths[0])
