STDOUT:
Results will be saved in /home/philip/projects/ltspice_examples_code_repo/Circuit-Completion-Using-GNNs/component_classification_with_link_prediction_head/evaluation/FEGIN/results/model_FEGIN_dataset_ltspice_demos
Command line input: python main.py --data ltspice_demos --representation component_component --model FEGIN --layers 2 --hiddens 64 --batch_size 128 --lr 0.001 --emb_size 250 --epochs 100 --save_appendix component_component_L2_H64_BS128_LR0.001_E250 --no_val
 is saved.
-----
ltspice_demos - FEGIN
Using 2 layers, 64 hidden units, h = 2
Loading component_component representation dataset
ENTERED
Training FEGIN on component_component representation
Train: 1565, Test: 383
##################ITERATION #0 ****************************************
 epoch: 0, train_loss: 1.3633, test_loss: 1.3471, test_f1: 0.2281
 epoch: 1, train_loss: 1.2465, test_loss: 1.2924, test_f1: 0.2674
 epoch: 2, train_loss: 1.1965, test_loss: 1.2833, test_f1: 0.2705
 epoch: 3, train_loss: 1.1580, test_loss: 1.2535, test_f1: 0.2835
 epoch: 4, train_loss: 1.1334, test_loss: 1.2301, test_f1: 0.4051
 epoch: 5, train_loss: 1.0965, test_loss: 1.1940, test_f1: 0.4122
 epoch: 6, train_loss: 1.0621, test_loss: 1.1802, test_f1: 0.4084
 epoch: 7, train_loss: 1.0209, test_loss: 1.1721, test_f1: 0.4442
 epoch: 8, train_loss: 1.0033, test_loss: 1.2405, test_f1: 0.4264
 epoch: 9, train_loss: 0.9761, test_loss: 1.2126, test_f1: 0.4480
 epoch: 10, train_loss: 0.9440, test_loss: 1.1819, test_f1: 0.4187
 epoch: 11, train_loss: 0.9232, test_loss: 1.1956, test_f1: 0.5012
 epoch: 12, train_loss: 0.9041, test_loss: 1.2513, test_f1: 0.4885
 epoch: 13, train_loss: 0.9013, test_loss: 1.1675, test_f1: 0.5458
 epoch: 14, train_loss: 0.8572, test_loss: 1.2930, test_f1: 0.4889
 epoch: 15, train_loss: 0.8598, test_loss: 1.2334, test_f1: 0.5775
 epoch: 16, train_loss: 0.8461, test_loss: 1.2586, test_f1: 0.5259
 epoch: 17, train_loss: 0.8542, test_loss: 1.2422, test_f1: 0.5707
 epoch: 18, train_loss: 0.8179, test_loss: 1.3287, test_f1: 0.4990
 epoch: 19, train_loss: 0.7748, test_loss: 1.2389, test_f1: 0.5228
 epoch: 20, train_loss: 0.7624, test_loss: 1.2490, test_f1: 0.5272
 epoch: 21, train_loss: 0.7729, test_loss: 1.2487, test_f1: 0.5477
 epoch: 22, train_loss: 0.7351, test_loss: 1.2971, test_f1: 0.5470
 epoch: 23, train_loss: 0.7142, test_loss: 1.3786, test_f1: 0.4781
 epoch: 24, train_loss: 0.7071, test_loss: 1.3341, test_f1: 0.5803
 epoch: 25, train_loss: 0.7019, test_loss: 1.3075, test_f1: 0.5888
 epoch: 26, train_loss: 0.6766, test_loss: 1.1947, test_f1: 0.5653
 epoch: 27, train_loss: 0.6643, test_loss: 1.2761, test_f1: 0.5540
 epoch: 28, train_loss: 0.6580, test_loss: 1.5672, test_f1: 0.5239
 epoch: 29, train_loss: 0.6344, test_loss: 1.4891, test_f1: 0.5167
 epoch: 30, train_loss: 0.6257, test_loss: 1.4314, test_f1: 0.5874
 epoch: 31, train_loss: 0.6171, test_loss: 1.4913, test_f1: 0.5462
 epoch: 32, train_loss: 0.6029, test_loss: 1.5378, test_f1: 0.5882
 epoch: 33, train_loss: 0.5802, test_loss: 1.5231, test_f1: 0.5834
 epoch: 34, train_loss: 0.5979, test_loss: 1.7062, test_f1: 0.5415
 epoch: 35, train_loss: 0.6175, test_loss: 1.4707, test_f1: 0.5402
 epoch: 36, train_loss: 0.5646, test_loss: 1.4814, test_f1: 0.5384
 epoch: 37, train_loss: 0.5519, test_loss: 1.4971, test_f1: 0.5640
 epoch: 38, train_loss: 0.5439, test_loss: 1.6223, test_f1: 0.5445
 epoch: 39, train_loss: 0.5442, test_loss: 1.5403, test_f1: 0.5391
 epoch: 40, train_loss: 0.5837, test_loss: 1.7971, test_f1: 0.4491
 epoch: 41, train_loss: 0.5183, test_loss: 1.6404, test_f1: 0.5068
 epoch: 42, train_loss: 0.5233, test_loss: 2.1301, test_f1: 0.5028
 epoch: 43, train_loss: 0.5366, test_loss: 1.6627, test_f1: 0.5350
 epoch: 44, train_loss: 0.5088, test_loss: 1.5711, test_f1: 0.5540
 epoch: 45, train_loss: 0.5166, test_loss: 1.8217, test_f1: 0.5703
 epoch: 46, train_loss: 0.4915, test_loss: 1.7821, test_f1: 0.5362
 epoch: 47, train_loss: 0.4655, test_loss: 2.0700, test_f1: 0.5675
 epoch: 48, train_loss: 0.4622, test_loss: 1.9848, test_f1: 0.5201
 epoch: 49, train_loss: 0.4689, test_loss: 2.1014, test_f1: 0.4981
 epoch: 50, train_loss: 0.4746, test_loss: 1.9885, test_f1: 0.5733
 epoch: 51, train_loss: 0.4484, test_loss: 2.1889, test_f1: 0.5222
 epoch: 52, train_loss: 0.4257, test_loss: 1.9829, test_f1: 0.5044
 epoch: 53, train_loss: 0.4185, test_loss: 2.0269, test_f1: 0.5655
 epoch: 54, train_loss: 0.4063, test_loss: 2.2694, test_f1: 0.5475
 epoch: 55, train_loss: 0.4083, test_loss: 2.2591, test_f1: 0.5465
 epoch: 56, train_loss: 0.4099, test_loss: 2.4068, test_f1: 0.5112
 epoch: 57, train_loss: 0.3907, test_loss: 2.4428, test_f1: 0.5505
 epoch: 58, train_loss: 0.3824, test_loss: 2.3257, test_f1: 0.5390
 epoch: 59, train_loss: 0.3657, test_loss: 2.5649, test_f1: 0.5354
 epoch: 60, train_loss: 0.3792, test_loss: 2.3893, test_f1: 0.5175
 epoch: 61, train_loss: 0.3652, test_loss: 2.5664, test_f1: 0.5409
 epoch: 62, train_loss: 0.3460, test_loss: 2.8722, test_f1: 0.5204
 epoch: 63, train_loss: 0.3656, test_loss: 2.7285, test_f1: 0.5574
 epoch: 64, train_loss: 0.3882, test_loss: 2.8418, test_f1: 0.5137
 epoch: 65, train_loss: 0.3903, test_loss: 2.7972, test_f1: 0.5334
 epoch: 66, train_loss: 0.3593, test_loss: 2.6380, test_f1: 0.5509
 epoch: 67, train_loss: 0.3473, test_loss: 2.6549, test_f1: 0.5328
 epoch: 68, train_loss: 0.3672, test_loss: 2.5387, test_f1: 0.5727
 epoch: 69, train_loss: 0.3559, test_loss: 2.6754, test_f1: 0.5615
 epoch: 70, train_loss: 0.3313, test_loss: 2.9929, test_f1: 0.5574
 epoch: 71, train_loss: 0.3231, test_loss: 3.0139, test_f1: 0.5282
 epoch: 72, train_loss: 0.3135, test_loss: 2.6898, test_f1: 0.5411
 epoch: 73, train_loss: 0.3174, test_loss: 3.0761, test_f1: 0.5386
 epoch: 74, train_loss: 0.3149, test_loss: 2.9060, test_f1: 0.5848
 epoch: 75, train_loss: 0.3303, test_loss: 3.1132, test_f1: 0.5327
 epoch: 76, train_loss: 0.3380, test_loss: 2.5705, test_f1: 0.5391
 epoch: 77, train_loss: 0.3092, test_loss: 2.8717, test_f1: 0.5417
 epoch: 78, train_loss: 0.3380, test_loss: 3.1322, test_f1: 0.5280
 epoch: 79, train_loss: 0.3166, test_loss: 3.0398, test_f1: 0.5412
 epoch: 80, train_loss: 0.3017, test_loss: 3.0202, test_f1: 0.5387
 epoch: 81, train_loss: 0.3029, test_loss: 3.2226, test_f1: 0.5436
 epoch: 82, train_loss: 0.2865, test_loss: 2.9911, test_f1: 0.5320
 epoch: 83, train_loss: 0.2998, test_loss: 3.0807, test_f1: 0.5279
 epoch: 84, train_loss: 0.3079, test_loss: 2.8925, test_f1: 0.5178
 epoch: 85, train_loss: 0.2906, test_loss: 2.8579, test_f1: 0.5337
 epoch: 86, train_loss: 0.2959, test_loss: 2.9369, test_f1: 0.5295
 epoch: 87, train_loss: 0.2861, test_loss: 3.5293, test_f1: 0.5177
 epoch: 88, train_loss: 0.2748, test_loss: 3.4955, test_f1: 0.5187
 epoch: 89, train_loss: 0.2999, test_loss: 3.1061, test_f1: 0.5383
 epoch: 90, train_loss: 0.2839, test_loss: 2.9922, test_f1: 0.5727
 epoch: 91, train_loss: 0.2934, test_loss: 3.3659, test_f1: 0.5491
 epoch: 92, train_loss: 0.2982, test_loss: 2.9020, test_f1: 0.5394
 epoch: 93, train_loss: 0.2794, test_loss: 2.9839, test_f1: 0.5622
 epoch: 94, train_loss: 0.2701, test_loss: 3.6754, test_f1: 0.5198
 epoch: 95, train_loss: 0.2932, test_loss: 3.3850, test_f1: 0.5516
 epoch: 96, train_loss: 0.2865, test_loss: 3.5720, test_f1: 0.5319
 epoch: 97, train_loss: 0.2626, test_loss: 3.3765, test_f1: 0.5541
 epoch: 98, train_loss: 0.2805, test_loss: 3.8385, test_f1: 0.5581
 epoch: 99, train_loss: 0.2544, test_loss: 3.7507, test_f1: 0.5305
##################ITERATION #1 ****************************************
 epoch: 0, train_loss: 1.2843, test_loss: 1.3155, test_f1: 0.2953
 epoch: 1, train_loss: 1.1638, test_loss: 1.3034, test_f1: 0.3621
 epoch: 2, train_loss: 1.1135, test_loss: 1.2404, test_f1: 0.4264
 epoch: 3, train_loss: 1.0554, test_loss: 1.1739, test_f1: 0.4546
 epoch: 4, train_loss: 1.0271, test_loss: 1.1972, test_f1: 0.5577
 epoch: 5, train_loss: 0.9785, test_loss: 1.1809, test_f1: 0.5295
 epoch: 6, train_loss: 0.9441, test_loss: 1.1819, test_f1: 0.5318
 epoch: 7, train_loss: 0.9081, test_loss: 1.1849, test_f1: 0.5513
 epoch: 8, train_loss: 0.8813, test_loss: 1.2243, test_f1: 0.5254
 epoch: 9, train_loss: 0.8644, test_loss: 1.2430, test_f1: 0.5128
 epoch: 10, train_loss: 0.8412, test_loss: 1.2289, test_f1: 0.5670
 epoch: 11, train_loss: 0.8251, test_loss: 1.2063, test_f1: 0.6257
 epoch: 12, train_loss: 0.7978, test_loss: 1.2493, test_f1: 0.5706
 epoch: 13, train_loss: 0.7957, test_loss: 1.2197, test_f1: 0.5439
 epoch: 14, train_loss: 0.7763, test_loss: 1.2266, test_f1: 0.5978
 epoch: 15, train_loss: 0.7484, test_loss: 1.3041, test_f1: 0.5954
 epoch: 16, train_loss: 0.7505, test_loss: 1.3323, test_f1: 0.5792
 epoch: 17, train_loss: 0.7097, test_loss: 1.3351, test_f1: 0.5718
 epoch: 18, train_loss: 0.7187, test_loss: 1.3319, test_f1: 0.6018
 epoch: 19, train_loss: 0.7046, test_loss: 1.4021, test_f1: 0.6036
 epoch: 20, train_loss: 0.6983, test_loss: 1.2908, test_f1: 0.6057
 epoch: 21, train_loss: 0.6664, test_loss: 1.4313, test_f1: 0.5985
 epoch: 22, train_loss: 0.6738, test_loss: 1.4507, test_f1: 0.5400
 epoch: 23, train_loss: 0.6686, test_loss: 1.3232, test_f1: 0.6291
 epoch: 24, train_loss: 0.6363, test_loss: 1.4272, test_f1: 0.6065
 epoch: 25, train_loss: 0.5981, test_loss: 1.4307, test_f1: 0.5886
 epoch: 26, train_loss: 0.6227, test_loss: 1.8663, test_f1: 0.5133
 epoch: 27, train_loss: 0.6129, test_loss: 1.5602, test_f1: 0.5334
 epoch: 28, train_loss: 0.5806, test_loss: 1.4142, test_f1: 0.5658
 epoch: 29, train_loss: 0.5881, test_loss: 1.5580, test_f1: 0.5693
 epoch: 30, train_loss: 0.5735, test_loss: 1.5691, test_f1: 0.5973
 epoch: 31, train_loss: 0.5783, test_loss: 1.6560, test_f1: 0.5406
 epoch: 32, train_loss: 0.5594, test_loss: 1.6623, test_f1: 0.5876
 epoch: 33, train_loss: 0.5801, test_loss: 1.8269, test_f1: 0.4935
 epoch: 34, train_loss: 0.5498, test_loss: 1.5276, test_f1: 0.5884
 epoch: 35, train_loss: 0.5496, test_loss: 1.7448, test_f1: 0.5778
 epoch: 36, train_loss: 0.5734, test_loss: 1.7321, test_f1: 0.5974
 epoch: 37, train_loss: 0.5263, test_loss: 1.7162, test_f1: 0.5977
 epoch: 38, train_loss: 0.4999, test_loss: 1.7424, test_f1: 0.5941
 epoch: 39, train_loss: 0.4995, test_loss: 1.8225, test_f1: 0.5388
 epoch: 40, train_loss: 0.5004, test_loss: 1.7165, test_f1: 0.5631
 epoch: 41, train_loss: 0.4699, test_loss: 1.7487, test_f1: 0.5596
 epoch: 42, train_loss: 0.4474, test_loss: 1.8273, test_f1: 0.6032
 epoch: 43, train_loss: 0.4800, test_loss: 2.1118, test_f1: 0.5552
 epoch: 44, train_loss: 0.4883, test_loss: 1.9869, test_f1: 0.5553
 epoch: 45, train_loss: 0.4737, test_loss: 1.7142, test_f1: 0.5976
 epoch: 46, train_loss: 0.4564, test_loss: 2.0350, test_f1: 0.5732
 epoch: 47, train_loss: 0.4836, test_loss: 1.9712, test_f1: 0.5901
 epoch: 48, train_loss: 0.4584, test_loss: 2.0258, test_f1: 0.5555
 epoch: 49, train_loss: 0.4628, test_loss: 2.5079, test_f1: 0.5789
 epoch: 50, train_loss: 0.4400, test_loss: 2.3457, test_f1: 0.4798
 epoch: 51, train_loss: 0.3987, test_loss: 1.8894, test_f1: 0.6036
 epoch: 52, train_loss: 0.3890, test_loss: 2.1632, test_f1: 0.5795
 epoch: 53, train_loss: 0.3760, test_loss: 2.1363, test_f1: 0.5876
 epoch: 54, train_loss: 0.3751, test_loss: 2.0815, test_f1: 0.5843
 epoch: 55, train_loss: 0.3819, test_loss: 2.4172, test_f1: 0.5851
 epoch: 56, train_loss: 0.3780, test_loss: 2.3183, test_f1: 0.5967
 epoch: 57, train_loss: 0.3716, test_loss: 2.6360, test_f1: 0.5640
 epoch: 58, train_loss: 0.3750, test_loss: 2.5886, test_f1: 0.6215
 epoch: 59, train_loss: 0.3586, test_loss: 2.4096, test_f1: 0.5716
 epoch: 60, train_loss: 0.3593, test_loss: 2.7435, test_f1: 0.5933
 epoch: 61, train_loss: 0.3650, test_loss: 2.6496, test_f1: 0.5428
 epoch: 62, train_loss: 0.3424, test_loss: 2.3341, test_f1: 0.6002
 epoch: 63, train_loss: 0.3347, test_loss: 2.2556, test_f1: 0.6064
 epoch: 64, train_loss: 0.3192, test_loss: 2.4872, test_f1: 0.5944
 epoch: 65, train_loss: 0.3240, test_loss: 2.8753, test_f1: 0.6036
 epoch: 66, train_loss: 0.3257, test_loss: 2.6417, test_f1: 0.5948
 epoch: 67, train_loss: 0.3267, test_loss: 2.4147, test_f1: 0.6114
 epoch: 68, train_loss: 0.3216, test_loss: 3.0780, test_f1: 0.6002
 epoch: 69, train_loss: 0.3315, test_loss: 3.0943, test_f1: 0.5655
 epoch: 70, train_loss: 0.3191, test_loss: 2.9261, test_f1: 0.5847
 epoch: 71, train_loss: 0.3308, test_loss: 2.6060, test_f1: 0.5982
 epoch: 72, train_loss: 0.3279, test_loss: 2.7465, test_f1: 0.5966
 epoch: 73, train_loss: 0.3221, test_loss: 3.1954, test_f1: 0.5854
 epoch: 74, train_loss: 0.3144, test_loss: 3.5207, test_f1: 0.5708
 epoch: 75, train_loss: 0.2877, test_loss: 2.9091, test_f1: 0.5914
 epoch: 76, train_loss: 0.2848, test_loss: 3.1377, test_f1: 0.5871
 epoch: 77, train_loss: 0.3127, test_loss: 3.3795, test_f1: 0.5995
 epoch: 78, train_loss: 0.3240, test_loss: 4.1684, test_f1: 0.5857
 epoch: 79, train_loss: 0.2777, test_loss: 3.1260, test_f1: 0.5870
 epoch: 80, train_loss: 0.2768, test_loss: 2.8191, test_f1: 0.6022
 epoch: 81, train_loss: 0.2817, test_loss: 3.7731, test_f1: 0.5957
 epoch: 82, train_loss: 0.2956, test_loss: 4.5993, test_f1: 0.5898
 epoch: 83, train_loss: 0.2828, test_loss: 3.8527, test_f1: 0.6193
 epoch: 84, train_loss: 0.2723, test_loss: 3.2110, test_f1: 0.6237
 epoch: 85, train_loss: 0.2876, test_loss: 3.6242, test_f1: 0.5923
 epoch: 86, train_loss: 0.2921, test_loss: 3.4718, test_f1: 0.5828
 epoch: 87, train_loss: 0.2952, test_loss: 4.2584, test_f1: 0.5714
 epoch: 88, train_loss: 0.2856, test_loss: 3.8872, test_f1: 0.5749
 epoch: 89, train_loss: 0.2639, test_loss: 3.8549, test_f1: 0.6025
 epoch: 90, train_loss: 0.2543, test_loss: 3.3367, test_f1: 0.5756
 epoch: 91, train_loss: 0.2648, test_loss: 3.2105, test_f1: 0.6077
 epoch: 92, train_loss: 0.2484, test_loss: 3.3274, test_f1: 0.6113
 epoch: 93, train_loss: 0.2446, test_loss: 3.4567, test_f1: 0.5818
 epoch: 94, train_loss: 0.2587, test_loss: 3.8466, test_f1: 0.6111
 epoch: 95, train_loss: 0.3017, test_loss: 3.1816, test_f1: 0.5921
 epoch: 96, train_loss: 0.2660, test_loss: 3.0109, test_f1: 0.6309
 epoch: 97, train_loss: 0.2587, test_loss: 3.0624, test_f1: 0.6200
 epoch: 98, train_loss: 0.2672, test_loss: 3.0222, test_f1: 0.6045
 epoch: 99, train_loss: 0.2564, test_loss: 3.2508, test_f1: 0.6039
##################ITERATION #2 ****************************************
 epoch: 0, train_loss: 1.3047, test_loss: 1.3381, test_f1: 0.3405
 epoch: 1, train_loss: 1.1516, test_loss: 1.2801, test_f1: 0.4364
 epoch: 2, train_loss: 1.1102, test_loss: 1.2311, test_f1: 0.4849
 epoch: 3, train_loss: 1.0741, test_loss: 1.1909, test_f1: 0.5240
 epoch: 4, train_loss: 1.0188, test_loss: 1.1462, test_f1: 0.5340
 epoch: 5, train_loss: 0.9940, test_loss: 1.1256, test_f1: 0.5343
 epoch: 6, train_loss: 0.9586, test_loss: 1.1164, test_f1: 0.5423
 epoch: 7, train_loss: 0.9392, test_loss: 1.0952, test_f1: 0.5560
 epoch: 8, train_loss: 0.9251, test_loss: 1.1138, test_f1: 0.5535
 epoch: 9, train_loss: 0.8952, test_loss: 1.1011, test_f1: 0.5195
 epoch: 10, train_loss: 0.8643, test_loss: 1.0747, test_f1: 0.6076
 epoch: 11, train_loss: 0.8551, test_loss: 1.1317, test_f1: 0.5515
 epoch: 12, train_loss: 0.8354, test_loss: 1.1039, test_f1: 0.6046
 epoch: 13, train_loss: 0.8278, test_loss: 1.1235, test_f1: 0.5502
 epoch: 14, train_loss: 0.8032, test_loss: 1.1329, test_f1: 0.5420
 epoch: 15, train_loss: 0.7927, test_loss: 1.0760, test_f1: 0.6103
 epoch: 16, train_loss: 0.7693, test_loss: 1.1682, test_f1: 0.5679
 epoch: 17, train_loss: 0.7599, test_loss: 1.1677, test_f1: 0.6213
 epoch: 18, train_loss: 0.7312, test_loss: 1.4168, test_f1: 0.5514
 epoch: 19, train_loss: 0.7431, test_loss: 1.1607, test_f1: 0.5978
 epoch: 20, train_loss: 0.7346, test_loss: 1.1917, test_f1: 0.5921
 epoch: 21, train_loss: 0.7401, test_loss: 1.2207, test_f1: 0.5936
 epoch: 22, train_loss: 0.7028, test_loss: 1.1384, test_f1: 0.5975
 epoch: 23, train_loss: 0.7044, test_loss: 1.2671, test_f1: 0.6111
 epoch: 24, train_loss: 0.7017, test_loss: 1.4355, test_f1: 0.5491
 epoch: 25, train_loss: 0.6712, test_loss: 1.4796, test_f1: 0.6287
 epoch: 26, train_loss: 0.6508, test_loss: 1.1823, test_f1: 0.6374
 epoch: 27, train_loss: 0.6448, test_loss: 1.4475, test_f1: 0.4850
 epoch: 28, train_loss: 0.6628, test_loss: 1.3532, test_f1: 0.5684
 epoch: 29, train_loss: 0.6368, test_loss: 1.3825, test_f1: 0.5856
 epoch: 30, train_loss: 0.6549, test_loss: 1.2007, test_f1: 0.6394
 epoch: 31, train_loss: 0.6505, test_loss: 1.4584, test_f1: 0.4945
 epoch: 32, train_loss: 0.6489, test_loss: 1.5624, test_f1: 0.4941
 epoch: 33, train_loss: 0.6054, test_loss: 1.4219, test_f1: 0.6082
 epoch: 34, train_loss: 0.6003, test_loss: 1.2460, test_f1: 0.6096
 epoch: 35, train_loss: 0.5804, test_loss: 1.3637, test_f1: 0.5623
 epoch: 36, train_loss: 0.5764, test_loss: 1.4813, test_f1: 0.5696
 epoch: 37, train_loss: 0.5625, test_loss: 1.6316, test_f1: 0.5649
 epoch: 38, train_loss: 0.5652, test_loss: 1.4146, test_f1: 0.5915
 epoch: 39, train_loss: 0.5544, test_loss: 1.5188, test_f1: 0.5965
 epoch: 40, train_loss: 0.5710, test_loss: 1.6577, test_f1: 0.5342
 epoch: 41, train_loss: 0.5336, test_loss: 1.4740, test_f1: 0.6039
 epoch: 42, train_loss: 0.5032, test_loss: 1.3610, test_f1: 0.6280
 epoch: 43, train_loss: 0.5428, test_loss: 1.5408, test_f1: 0.5510
 epoch: 44, train_loss: 0.4981, test_loss: 1.4808, test_f1: 0.5874
 epoch: 45, train_loss: 0.4760, test_loss: 1.5506, test_f1: 0.5910
 epoch: 46, train_loss: 0.4766, test_loss: 1.4703, test_f1: 0.6340
 epoch: 47, train_loss: 0.4851, test_loss: 1.9981, test_f1: 0.4881
 epoch: 48, train_loss: 0.4953, test_loss: 1.5608, test_f1: 0.6195
 epoch: 49, train_loss: 0.4916, test_loss: 1.4747, test_f1: 0.6075
 epoch: 50, train_loss: 0.5124, test_loss: 1.5135, test_f1: 0.5637
 epoch: 51, train_loss: 0.4904, test_loss: 1.4675, test_f1: 0.6031
 epoch: 52, train_loss: 0.4206, test_loss: 1.5218, test_f1: 0.5857
 epoch: 53, train_loss: 0.4066, test_loss: 1.7003, test_f1: 0.6002
 epoch: 54, train_loss: 0.4003, test_loss: 1.5439, test_f1: 0.6047
 epoch: 55, train_loss: 0.3966, test_loss: 1.6456, test_f1: 0.5860
 epoch: 56, train_loss: 0.4067, test_loss: 1.7165, test_f1: 0.5492
 epoch: 57, train_loss: 0.4303, test_loss: 1.7934, test_f1: 0.6001
 epoch: 58, train_loss: 0.4071, test_loss: 1.7188, test_f1: 0.5834
 epoch: 59, train_loss: 0.3937, test_loss: 1.7885, test_f1: 0.6155
 epoch: 60, train_loss: 0.3634, test_loss: 1.7735, test_f1: 0.6088
 epoch: 61, train_loss: 0.3852, test_loss: 1.7518, test_f1: 0.6198
 epoch: 62, train_loss: 0.3692, test_loss: 1.8053, test_f1: 0.6066
 epoch: 63, train_loss: 0.3496, test_loss: 1.9648, test_f1: 0.6152
 epoch: 64, train_loss: 0.3811, test_loss: 1.9154, test_f1: 0.6146
 epoch: 65, train_loss: 0.3620, test_loss: 1.9056, test_f1: 0.5833
 epoch: 66, train_loss: 0.3568, test_loss: 1.9571, test_f1: 0.6130
 epoch: 67, train_loss: 0.3676, test_loss: 1.8763, test_f1: 0.5914
 epoch: 68, train_loss: 0.3244, test_loss: 1.8715, test_f1: 0.6068
 epoch: 69, train_loss: 0.3306, test_loss: 1.7782, test_f1: 0.6249
 epoch: 70, train_loss: 0.3491, test_loss: 1.8775, test_f1: 0.5910
 epoch: 71, train_loss: 0.3366, test_loss: 1.8574, test_f1: 0.6172
 epoch: 72, train_loss: 0.3361, test_loss: 2.2292, test_f1: 0.5728
 epoch: 73, train_loss: 0.3367, test_loss: 1.9772, test_f1: 0.5653
 epoch: 74, train_loss: 0.3713, test_loss: 1.9274, test_f1: 0.5843
 epoch: 75, train_loss: 0.3522, test_loss: 1.8127, test_f1: 0.5970
 epoch: 76, train_loss: 0.3334, test_loss: 1.9267, test_f1: 0.6029
 epoch: 77, train_loss: 0.3288, test_loss: 1.9125, test_f1: 0.6009
 epoch: 78, train_loss: 0.3287, test_loss: 1.8686, test_f1: 0.5990
 epoch: 79, train_loss: 0.2990, test_loss: 1.9903, test_f1: 0.6108
 epoch: 80, train_loss: 0.3281, test_loss: 1.7634, test_f1: 0.6085
 epoch: 81, train_loss: 0.3242, test_loss: 2.0084, test_f1: 0.5848
 epoch: 82, train_loss: 0.3626, test_loss: 2.1532, test_f1: 0.5388
 epoch: 83, train_loss: 0.3524, test_loss: 2.0069, test_f1: 0.5960
 epoch: 84, train_loss: 0.3351, test_loss: 2.0409, test_f1: 0.6019
 epoch: 85, train_loss: 0.3130, test_loss: 1.9595, test_f1: 0.5961
 epoch: 86, train_loss: 0.3101, test_loss: 1.9228, test_f1: 0.5885
 epoch: 87, train_loss: 0.3209, test_loss: 2.1118, test_f1: 0.5977
 epoch: 88, train_loss: 0.3557, test_loss: 2.1874, test_f1: 0.5692
 epoch: 89, train_loss: 0.3476, test_loss: 2.0589, test_f1: 0.6081
 epoch: 90, train_loss: 0.3207, test_loss: 2.0018, test_f1: 0.5780
 epoch: 91, train_loss: 0.3246, test_loss: 2.0736, test_f1: 0.5801
 epoch: 92, train_loss: 0.3398, test_loss: 1.8743, test_f1: 0.5926
 epoch: 93, train_loss: 0.3299, test_loss: 2.1584, test_f1: 0.5910
 epoch: 94, train_loss: 0.3320, test_loss: 2.0103, test_f1: 0.5770
 epoch: 95, train_loss: 0.2966, test_loss: 2.1376, test_f1: 0.5698
 epoch: 96, train_loss: 0.3046, test_loss: 2.1541, test_f1: 0.5908
 epoch: 97, train_loss: 0.2930, test_loss: 2.0496, test_f1: 0.5653
 epoch: 98, train_loss: 0.2890, test_loss: 2.2374, test_f1: 0.5803
 epoch: 99, train_loss: 0.2649, test_loss: 2.1441, test_f1: 0.5898
##################ITERATION #3 ****************************************
 epoch: 0, train_loss: 1.3869, test_loss: 1.4369, test_f1: 0.2265
 epoch: 1, train_loss: 1.1556, test_loss: 1.3368, test_f1: 0.1908
 epoch: 2, train_loss: 1.0835, test_loss: 1.2518, test_f1: 0.4112
 epoch: 3, train_loss: 1.0605, test_loss: 1.2045, test_f1: 0.4805
 epoch: 4, train_loss: 1.0329, test_loss: 1.2174, test_f1: 0.4717
 epoch: 5, train_loss: 0.9891, test_loss: 1.1784, test_f1: 0.4939
 epoch: 6, train_loss: 0.9687, test_loss: 1.1998, test_f1: 0.4949
 epoch: 7, train_loss: 0.9335, test_loss: 1.1919, test_f1: 0.5242
 epoch: 8, train_loss: 0.9315, test_loss: 1.1963, test_f1: 0.5498
 epoch: 9, train_loss: 0.9322, test_loss: 1.1568, test_f1: 0.5398
 epoch: 10, train_loss: 0.8964, test_loss: 1.2046, test_f1: 0.5029
 epoch: 11, train_loss: 0.8956, test_loss: 1.2065, test_f1: 0.5229
 epoch: 12, train_loss: 0.8850, test_loss: 1.1589, test_f1: 0.5357
 epoch: 13, train_loss: 0.8643, test_loss: 1.1284, test_f1: 0.5284
 epoch: 14, train_loss: 0.8531, test_loss: 1.1566, test_f1: 0.5236
 epoch: 15, train_loss: 0.8489, test_loss: 1.2283, test_f1: 0.5185
 epoch: 16, train_loss: 0.8206, test_loss: 1.1704, test_f1: 0.5143
 epoch: 17, train_loss: 0.8133, test_loss: 1.1659, test_f1: 0.5963
 epoch: 18, train_loss: 0.8200, test_loss: 1.1620, test_f1: 0.5298
 epoch: 19, train_loss: 0.8119, test_loss: 1.4207, test_f1: 0.4540
 epoch: 20, train_loss: 0.7956, test_loss: 1.2165, test_f1: 0.5862
 epoch: 21, train_loss: 0.8000, test_loss: 1.1993, test_f1: 0.5053
 epoch: 22, train_loss: 0.7841, test_loss: 1.2824, test_f1: 0.5029
 epoch: 23, train_loss: 0.7835, test_loss: 1.1888, test_f1: 0.5553
 epoch: 24, train_loss: 0.7661, test_loss: 1.2204, test_f1: 0.5292
 epoch: 25, train_loss: 0.7446, test_loss: 1.2064, test_f1: 0.5743
 epoch: 26, train_loss: 0.7489, test_loss: 1.2167, test_f1: 0.5549
 epoch: 27, train_loss: 0.7307, test_loss: 1.3022, test_f1: 0.4835
 epoch: 28, train_loss: 0.7141, test_loss: 1.2309, test_f1: 0.5518
 epoch: 29, train_loss: 0.7185, test_loss: 1.3150, test_f1: 0.5375
 epoch: 30, train_loss: 0.7140, test_loss: 1.1902, test_f1: 0.6100
 epoch: 31, train_loss: 0.6962, test_loss: 1.3745, test_f1: 0.4849
 epoch: 32, train_loss: 0.6879, test_loss: 1.2244, test_f1: 0.5761
 epoch: 33, train_loss: 0.6739, test_loss: 1.2444, test_f1: 0.5346
 epoch: 34, train_loss: 0.6740, test_loss: 1.2653, test_f1: 0.5551
 epoch: 35, train_loss: 0.6516, test_loss: 1.1738, test_f1: 0.5307
 epoch: 36, train_loss: 0.6654, test_loss: 1.2778, test_f1: 0.6031
 epoch: 37, train_loss: 0.6650, test_loss: 1.6078, test_f1: 0.4755
 epoch: 38, train_loss: 0.6804, test_loss: 1.2171, test_f1: 0.6112
 epoch: 39, train_loss: 0.6420, test_loss: 1.3535, test_f1: 0.5262
 epoch: 40, train_loss: 0.6590, test_loss: 1.4656, test_f1: 0.4544
 epoch: 41, train_loss: 0.6195, test_loss: 1.3827, test_f1: 0.6008
 epoch: 42, train_loss: 0.6260, test_loss: 1.4592, test_f1: 0.5145
 epoch: 43, train_loss: 0.6177, test_loss: 1.3638, test_f1: 0.5506
 epoch: 44, train_loss: 0.5982, test_loss: 1.3136, test_f1: 0.5819
 epoch: 45, train_loss: 0.6001, test_loss: 1.4671, test_f1: 0.5323
 epoch: 46, train_loss: 0.5826, test_loss: 1.2261, test_f1: 0.5874
 epoch: 47, train_loss: 0.5873, test_loss: 1.5408, test_f1: 0.4734
 epoch: 48, train_loss: 0.5877, test_loss: 1.4660, test_f1: 0.4994
 epoch: 49, train_loss: 0.5903, test_loss: 1.4283, test_f1: 0.5711
 epoch: 50, train_loss: 0.5841, test_loss: 1.4831, test_f1: 0.5475
 epoch: 51, train_loss: 0.5556, test_loss: 1.2843, test_f1: 0.5778
 epoch: 52, train_loss: 0.5326, test_loss: 1.4632, test_f1: 0.5399
 epoch: 53, train_loss: 0.5397, test_loss: 1.3707, test_f1: 0.5990
 epoch: 54, train_loss: 0.5224, test_loss: 1.5486, test_f1: 0.5420
 epoch: 55, train_loss: 0.4902, test_loss: 1.4387, test_f1: 0.5466
 epoch: 56, train_loss: 0.4726, test_loss: 1.4300, test_f1: 0.5611
 epoch: 57, train_loss: 0.4890, test_loss: 1.4762, test_f1: 0.5741
 epoch: 58, train_loss: 0.4913, test_loss: 1.6128, test_f1: 0.5591
 epoch: 59, train_loss: 0.4581, test_loss: 1.4944, test_f1: 0.5593
 epoch: 60, train_loss: 0.4911, test_loss: 1.5178, test_f1: 0.5427
 epoch: 61, train_loss: 0.4721, test_loss: 1.3932, test_f1: 0.5519
 epoch: 62, train_loss: 0.4809, test_loss: 1.4733, test_f1: 0.5638
 epoch: 63, train_loss: 0.4910, test_loss: 1.4813, test_f1: 0.5772
 epoch: 64, train_loss: 0.4911, test_loss: 1.6230, test_f1: 0.5439
 epoch: 65, train_loss: 0.4516, test_loss: 1.5670, test_f1: 0.5584
 epoch: 66, train_loss: 0.4685, test_loss: 1.4936, test_f1: 0.5898
 epoch: 67, train_loss: 0.4686, test_loss: 1.7023, test_f1: 0.5574
 epoch: 68, train_loss: 0.4495, test_loss: 1.5977, test_f1: 0.5368
 epoch: 69, train_loss: 0.4475, test_loss: 1.5547, test_f1: 0.5560
 epoch: 70, train_loss: 0.4468, test_loss: 1.6706, test_f1: 0.5291
 epoch: 71, train_loss: 0.4358, test_loss: 1.4506, test_f1: 0.5877
 epoch: 72, train_loss: 0.4576, test_loss: 1.5982, test_f1: 0.5809
 epoch: 73, train_loss: 0.4178, test_loss: 1.5399, test_f1: 0.6001
 epoch: 74, train_loss: 0.4365, test_loss: 1.7256, test_f1: 0.5104
 epoch: 75, train_loss: 0.4247, test_loss: 1.6480, test_f1: 0.5560
 epoch: 76, train_loss: 0.4112, test_loss: 1.6084, test_f1: 0.5704
 epoch: 77, train_loss: 0.4152, test_loss: 1.6812, test_f1: 0.5698
 epoch: 78, train_loss: 0.4071, test_loss: 1.6423, test_f1: 0.5380
 epoch: 79, train_loss: 0.4016, test_loss: 1.5499, test_f1: 0.5867
 epoch: 80, train_loss: 0.4021, test_loss: 1.7342, test_f1: 0.5476
 epoch: 81, train_loss: 0.4041, test_loss: 1.6171, test_f1: 0.5879
 epoch: 82, train_loss: 0.3830, test_loss: 1.6991, test_f1: 0.5869
 epoch: 83, train_loss: 0.4081, test_loss: 1.8234, test_f1: 0.5532
 epoch: 84, train_loss: 0.4240, test_loss: 1.6937, test_f1: 0.5955
 epoch: 85, train_loss: 0.4129, test_loss: 1.6934, test_f1: 0.5400
 epoch: 86, train_loss: 0.3746, test_loss: 1.5819, test_f1: 0.6025
 epoch: 87, train_loss: 0.3894, test_loss: 1.7580, test_f1: 0.5534
 epoch: 88, train_loss: 0.3868, test_loss: 1.6778, test_f1: 0.5653
 epoch: 89, train_loss: 0.3802, test_loss: 1.6651, test_f1: 0.5803
 epoch: 90, train_loss: 0.3855, test_loss: 1.8935, test_f1: 0.4902
 epoch: 91, train_loss: 0.3819, test_loss: 1.6877, test_f1: 0.5848
 epoch: 92, train_loss: 0.3575, test_loss: 1.7231, test_f1: 0.6123
 epoch: 93, train_loss: 0.3603, test_loss: 1.7345, test_f1: 0.5737
 epoch: 94, train_loss: 0.3663, test_loss: 1.7923, test_f1: 0.5520
 epoch: 95, train_loss: 0.3666, test_loss: 1.8521, test_f1: 0.5804
 epoch: 96, train_loss: 0.3942, test_loss: 1.7329, test_f1: 0.5611
 epoch: 97, train_loss: 0.3723, test_loss: 1.7987, test_f1: 0.5653
 epoch: 98, train_loss: 0.3592, test_loss: 1.7668, test_f1: 0.6070
 epoch: 99, train_loss: 0.3560, test_loss: 1.7760, test_f1: 0.5933
##################ITERATION #4 ****************************************
 epoch: 0, train_loss: 1.2963, test_loss: 1.3445, test_f1: 0.3188
 epoch: 1, train_loss: 1.1228, test_loss: 1.2652, test_f1: 0.3264
 epoch: 2, train_loss: 1.0443, test_loss: 1.1955, test_f1: 0.4547
 epoch: 3, train_loss: 1.0107, test_loss: 1.1830, test_f1: 0.5034
 epoch: 4, train_loss: 0.9687, test_loss: 1.1556, test_f1: 0.5531
 epoch: 5, train_loss: 0.9516, test_loss: 1.2083, test_f1: 0.5249
 epoch: 6, train_loss: 0.9372, test_loss: 1.1852, test_f1: 0.5410
 epoch: 7, train_loss: 0.8897, test_loss: 1.1890, test_f1: 0.5245
 epoch: 8, train_loss: 0.8893, test_loss: 1.1896, test_f1: 0.5413
 epoch: 9, train_loss: 0.8577, test_loss: 1.1307, test_f1: 0.5528
 epoch: 10, train_loss: 0.8407, test_loss: 1.2244, test_f1: 0.5504
 epoch: 11, train_loss: 0.8198, test_loss: 1.1405, test_f1: 0.5892
 epoch: 12, train_loss: 0.8139, test_loss: 1.1905, test_f1: 0.5891
 epoch: 13, train_loss: 0.8174, test_loss: 1.1368, test_f1: 0.5364
 epoch: 14, train_loss: 0.8161, test_loss: 1.1780, test_f1: 0.5578
 epoch: 15, train_loss: 0.7950, test_loss: 1.2287, test_f1: 0.5034
 epoch: 16, train_loss: 0.7784, test_loss: 1.1647, test_f1: 0.5873
 epoch: 17, train_loss: 0.7718, test_loss: 1.2469, test_f1: 0.5708
 epoch: 18, train_loss: 0.7625, test_loss: 1.2528, test_f1: 0.6046
 epoch: 19, train_loss: 0.7336, test_loss: 1.2995, test_f1: 0.5507
 epoch: 20, train_loss: 0.7145, test_loss: 1.2573, test_f1: 0.5728
 epoch: 21, train_loss: 0.7284, test_loss: 1.2568, test_f1: 0.5820
 epoch: 22, train_loss: 0.7226, test_loss: 1.2818, test_f1: 0.5756
 epoch: 23, train_loss: 0.6976, test_loss: 1.2430, test_f1: 0.5582
 epoch: 24, train_loss: 0.6857, test_loss: 1.2849, test_f1: 0.5792
 epoch: 25, train_loss: 0.6617, test_loss: 1.2304, test_f1: 0.5607
 epoch: 26, train_loss: 0.6500, test_loss: 1.2891, test_f1: 0.5883
 epoch: 27, train_loss: 0.6592, test_loss: 1.2311, test_f1: 0.5768
 epoch: 28, train_loss: 0.6616, test_loss: 1.6309, test_f1: 0.5400
 epoch: 29, train_loss: 0.6370, test_loss: 1.2465, test_f1: 0.6068
 epoch: 30, train_loss: 0.6560, test_loss: 1.3568, test_f1: 0.5733
 epoch: 31, train_loss: 0.6633, test_loss: 1.5991, test_f1: 0.5430
 epoch: 32, train_loss: 0.6735, test_loss: 1.3272, test_f1: 0.6011
 epoch: 33, train_loss: 0.6251, test_loss: 1.3460, test_f1: 0.5704
 epoch: 34, train_loss: 0.6226, test_loss: 1.3988, test_f1: 0.5622
 epoch: 35, train_loss: 0.5881, test_loss: 1.3601, test_f1: 0.6126
 epoch: 36, train_loss: 0.5895, test_loss: 1.3729, test_f1: 0.5623
 epoch: 37, train_loss: 0.5993, test_loss: 1.5599, test_f1: 0.4964
 epoch: 38, train_loss: 0.5902, test_loss: 1.3994, test_f1: 0.5713
 epoch: 39, train_loss: 0.5758, test_loss: 1.3970, test_f1: 0.5466
 epoch: 40, train_loss: 0.5820, test_loss: 1.6102, test_f1: 0.5766
 epoch: 41, train_loss: 0.5858, test_loss: 1.3211, test_f1: 0.5608
 epoch: 42, train_loss: 0.5627, test_loss: 1.2157, test_f1: 0.6005
 epoch: 43, train_loss: 0.5666, test_loss: 1.4001, test_f1: 0.6005
 epoch: 44, train_loss: 0.5340, test_loss: 1.3749, test_f1: 0.5926
 epoch: 45, train_loss: 0.5444, test_loss: 1.4737, test_f1: 0.5694
 epoch: 46, train_loss: 0.5397, test_loss: 1.5784, test_f1: 0.5194
 epoch: 47, train_loss: 0.5314, test_loss: 1.3974, test_f1: 0.5939
 epoch: 48, train_loss: 0.5149, test_loss: 1.6041, test_f1: 0.5671
 epoch: 49, train_loss: 0.4810, test_loss: 1.5181, test_f1: 0.5531
 epoch: 50, train_loss: 0.4836, test_loss: 1.7203, test_f1: 0.6029
 epoch: 51, train_loss: 0.4714, test_loss: 1.5507, test_f1: 0.6036
 epoch: 52, train_loss: 0.4697, test_loss: 1.5619, test_f1: 0.5751
 epoch: 53, train_loss: 0.4375, test_loss: 1.4610, test_f1: 0.6023
 epoch: 54, train_loss: 0.4307, test_loss: 1.6066, test_f1: 0.6088
 epoch: 55, train_loss: 0.4497, test_loss: 1.4976, test_f1: 0.6017
 epoch: 56, train_loss: 0.4237, test_loss: 1.7038, test_f1: 0.5613
 epoch: 57, train_loss: 0.4315, test_loss: 1.4816, test_f1: 0.6200
 epoch: 58, train_loss: 0.4139, test_loss: 1.5270, test_f1: 0.6396
 epoch: 59, train_loss: 0.4070, test_loss: 1.4595, test_f1: 0.6252
 epoch: 60, train_loss: 0.4213, test_loss: 1.6215, test_f1: 0.6054
 epoch: 61, train_loss: 0.4139, test_loss: 1.5555, test_f1: 0.5954
 epoch: 62, train_loss: 0.3977, test_loss: 1.7451, test_f1: 0.5761
 epoch: 63, train_loss: 0.4198, test_loss: 1.6040, test_f1: 0.5807
 epoch: 64, train_loss: 0.4144, test_loss: 1.6106, test_f1: 0.5986
 epoch: 65, train_loss: 0.4105, test_loss: 1.5809, test_f1: 0.5849
 epoch: 66, train_loss: 0.3918, test_loss: 1.7751, test_f1: 0.5656
 epoch: 67, train_loss: 0.3970, test_loss: 1.6727, test_f1: 0.6274
 epoch: 68, train_loss: 0.3850, test_loss: 1.7762, test_f1: 0.6024
 epoch: 69, train_loss: 0.3652, test_loss: 1.8690, test_f1: 0.5652
 epoch: 70, train_loss: 0.3980, test_loss: 1.8058, test_f1: 0.5806
 epoch: 71, train_loss: 0.3731, test_loss: 1.7635, test_f1: 0.6119
 epoch: 72, train_loss: 0.3834, test_loss: 1.7308, test_f1: 0.6074
 epoch: 73, train_loss: 0.3864, test_loss: 1.7479, test_f1: 0.5843
 epoch: 74, train_loss: 0.3832, test_loss: 1.8648, test_f1: 0.5889
 epoch: 75, train_loss: 0.3720, test_loss: 1.7569, test_f1: 0.6260
 epoch: 76, train_loss: 0.3480, test_loss: 1.6792, test_f1: 0.5997
 epoch: 77, train_loss: 0.3579, test_loss: 1.8715, test_f1: 0.5651
 epoch: 78, train_loss: 0.3564, test_loss: 1.8473, test_f1: 0.5594
 epoch: 79, train_loss: 0.3562, test_loss: 1.8105, test_f1: 0.5982
 epoch: 80, train_loss: 0.3338, test_loss: 1.7602, test_f1: 0.6119
 epoch: 81, train_loss: 0.3486, test_loss: 1.8635, test_f1: 0.5739
 epoch: 82, train_loss: 0.3515, test_loss: 1.6391, test_f1: 0.6265
 epoch: 83, train_loss: 0.3344, test_loss: 1.6644, test_f1: 0.6212
 epoch: 84, train_loss: 0.3590, test_loss: 1.9055, test_f1: 0.6036
 epoch: 85, train_loss: 0.3328, test_loss: 1.9055, test_f1: 0.5750
 epoch: 86, train_loss: 0.3543, test_loss: 2.0054, test_f1: 0.5822
 epoch: 87, train_loss: 0.3680, test_loss: 1.7819, test_f1: 0.6214
 epoch: 88, train_loss: 0.3822, test_loss: 2.1616, test_f1: 0.5658
 epoch: 89, train_loss: 0.3473, test_loss: 2.1255, test_f1: 0.5886
 epoch: 90, train_loss: 0.3512, test_loss: 1.8672, test_f1: 0.6172
 epoch: 91, train_loss: 0.4000, test_loss: 2.1197, test_f1: 0.5573
 epoch: 92, train_loss: 0.4134, test_loss: 1.6589, test_f1: 0.5752
 epoch: 93, train_loss: 0.3631, test_loss: 1.9742, test_f1: 0.6027
 epoch: 94, train_loss: 0.3504, test_loss: 1.7383, test_f1: 0.6112
 epoch: 95, train_loss: 0.3300, test_loss: 1.8656, test_f1: 0.6171
 epoch: 96, train_loss: 0.3295, test_loss: 1.8971, test_f1: 0.5892
 epoch: 97, train_loss: 0.3371, test_loss: 1.6773, test_f1: 0.6437
 epoch: 98, train_loss: 0.3264, test_loss: 1.8729, test_f1: 0.6321
 epoch: 99, train_loss: 0.3154, test_loss: 2.0200, test_f1: 0.6121
##################ITERATION #5 ****************************************
 epoch: 0, train_loss: 1.4084, test_loss: 1.3849, test_f1: 0.2777
 epoch: 1, train_loss: 1.1714, test_loss: 1.3139, test_f1: 0.2622
 epoch: 2, train_loss: 1.1242, test_loss: 1.2473, test_f1: 0.3410
 epoch: 3, train_loss: 1.0781, test_loss: 1.1850, test_f1: 0.4878
 epoch: 4, train_loss: 1.0295, test_loss: 1.1770, test_f1: 0.4620
 epoch: 5, train_loss: 0.9993, test_loss: 1.1860, test_f1: 0.5125
 epoch: 6, train_loss: 0.9710, test_loss: 1.1802, test_f1: 0.5297
 epoch: 7, train_loss: 0.9535, test_loss: 1.2430, test_f1: 0.5218
 epoch: 8, train_loss: 0.9371, test_loss: 1.2840, test_f1: 0.4666
 epoch: 9, train_loss: 0.9346, test_loss: 1.2884, test_f1: 0.5225
 epoch: 10, train_loss: 0.9255, test_loss: 1.2301, test_f1: 0.5346
 epoch: 11, train_loss: 0.9099, test_loss: 1.2309, test_f1: 0.4858
 epoch: 12, train_loss: 0.8789, test_loss: 1.1789, test_f1: 0.5399
 epoch: 13, train_loss: 0.8613, test_loss: 1.2326, test_f1: 0.5623
 epoch: 14, train_loss: 0.8481, test_loss: 1.2254, test_f1: 0.5297
 epoch: 15, train_loss: 0.8340, test_loss: 1.3454, test_f1: 0.5110
 epoch: 16, train_loss: 0.8210, test_loss: 1.2627, test_f1: 0.5355
 epoch: 17, train_loss: 0.8052, test_loss: 1.3660, test_f1: 0.5157
 epoch: 18, train_loss: 0.8066, test_loss: 1.3139, test_f1: 0.5209
 epoch: 19, train_loss: 0.7945, test_loss: 1.4143, test_f1: 0.5477
 epoch: 20, train_loss: 0.7925, test_loss: 1.3632, test_f1: 0.5202
 epoch: 21, train_loss: 0.7971, test_loss: 1.4741, test_f1: 0.5053
 epoch: 22, train_loss: 0.7761, test_loss: 1.4371, test_f1: 0.5322
 epoch: 23, train_loss: 0.7520, test_loss: 1.5893, test_f1: 0.5174
 epoch: 24, train_loss: 0.7517, test_loss: 1.7231, test_f1: 0.5407
 epoch: 25, train_loss: 0.7465, test_loss: 1.1986, test_f1: 0.5789
 epoch: 26, train_loss: 0.7394, test_loss: 1.4089, test_f1: 0.5127
 epoch: 27, train_loss: 0.7345, test_loss: 1.4038, test_f1: 0.6083
 epoch: 28, train_loss: 0.7206, test_loss: 1.4070, test_f1: 0.5974
 epoch: 29, train_loss: 0.6807, test_loss: 1.4599, test_f1: 0.5665
 epoch: 30, train_loss: 0.7131, test_loss: 1.5672, test_f1: 0.5830
 epoch: 31, train_loss: 0.6908, test_loss: 1.5023, test_f1: 0.5639
 epoch: 32, train_loss: 0.6894, test_loss: 1.3869, test_f1: 0.5783
 epoch: 33, train_loss: 0.6890, test_loss: 1.6518, test_f1: 0.5489
 epoch: 34, train_loss: 0.6600, test_loss: 1.4089, test_f1: 0.5675
 epoch: 35, train_loss: 0.6512, test_loss: 1.4012, test_f1: 0.5873
 epoch: 36, train_loss: 0.6566, test_loss: 1.3855, test_f1: 0.5520
 epoch: 37, train_loss: 0.6428, test_loss: 1.4196, test_f1: 0.6082
 epoch: 38, train_loss: 0.6479, test_loss: 1.4547, test_f1: 0.5864
 epoch: 39, train_loss: 0.6230, test_loss: 1.4083, test_f1: 0.6219
 epoch: 40, train_loss: 0.6859, test_loss: 1.5293, test_f1: 0.5582
 epoch: 41, train_loss: 0.7048, test_loss: 1.3241, test_f1: 0.6089
 epoch: 42, train_loss: 0.6345, test_loss: 1.3186, test_f1: 0.5642
 epoch: 43, train_loss: 0.6205, test_loss: 1.5324, test_f1: 0.5553
 epoch: 44, train_loss: 0.6057, test_loss: 1.5802, test_f1: 0.5634
 epoch: 45, train_loss: 0.5909, test_loss: 1.5609, test_f1: 0.5821
 epoch: 46, train_loss: 0.5827, test_loss: 1.4852, test_f1: 0.6063
 epoch: 47, train_loss: 0.5736, test_loss: 1.6446, test_f1: 0.5661
 epoch: 48, train_loss: 0.5548, test_loss: 1.4861, test_f1: 0.6202
 epoch: 49, train_loss: 0.5669, test_loss: 1.7052, test_f1: 0.5793
 epoch: 50, train_loss: 0.5633, test_loss: 1.5852, test_f1: 0.6052
 epoch: 51, train_loss: 0.5209, test_loss: 1.5401, test_f1: 0.5797
 epoch: 52, train_loss: 0.5160, test_loss: 1.5763, test_f1: 0.5935
 epoch: 53, train_loss: 0.4936, test_loss: 1.6635, test_f1: 0.5879
 epoch: 54, train_loss: 0.4830, test_loss: 1.7255, test_f1: 0.5939
 epoch: 55, train_loss: 0.4988, test_loss: 1.7013, test_f1: 0.5866
 epoch: 56, train_loss: 0.4733, test_loss: 1.7108, test_f1: 0.5937
 epoch: 57, train_loss: 0.4990, test_loss: 1.6549, test_f1: 0.6121
 epoch: 58, train_loss: 0.4720, test_loss: 1.6602, test_f1: 0.5990
 epoch: 59, train_loss: 0.4933, test_loss: 1.7024, test_f1: 0.6053
 epoch: 60, train_loss: 0.4825, test_loss: 1.8140, test_f1: 0.6149
 epoch: 61, train_loss: 0.4752, test_loss: 1.6961, test_f1: 0.5989
 epoch: 62, train_loss: 0.4595, test_loss: 1.7148, test_f1: 0.6150
 epoch: 63, train_loss: 0.4596, test_loss: 1.7965, test_f1: 0.5933
 epoch: 64, train_loss: 0.4401, test_loss: 1.7129, test_f1: 0.5978
 epoch: 65, train_loss: 0.4428, test_loss: 1.7162, test_f1: 0.6077
 epoch: 66, train_loss: 0.4468, test_loss: 1.7083, test_f1: 0.6091
 epoch: 67, train_loss: 0.4199, test_loss: 1.7221, test_f1: 0.6128
 epoch: 68, train_loss: 0.4479, test_loss: 1.8107, test_f1: 0.6160
 epoch: 69, train_loss: 0.4294, test_loss: 2.0737, test_f1: 0.5902
 epoch: 70, train_loss: 0.4302, test_loss: 1.8637, test_f1: 0.5752
 epoch: 71, train_loss: 0.4412, test_loss: 1.9269, test_f1: 0.5825
 epoch: 72, train_loss: 0.4184, test_loss: 1.8783, test_f1: 0.6093
 epoch: 73, train_loss: 0.4168, test_loss: 1.8619, test_f1: 0.6100
 epoch: 74, train_loss: 0.4277, test_loss: 1.9451, test_f1: 0.5755
 epoch: 75, train_loss: 0.3966, test_loss: 1.9665, test_f1: 0.6146
 epoch: 76, train_loss: 0.4368, test_loss: 1.8629, test_f1: 0.6109
 epoch: 77, train_loss: 0.4221, test_loss: 1.8498, test_f1: 0.6214
 epoch: 78, train_loss: 0.4193, test_loss: 2.0277, test_f1: 0.6077
 epoch: 79, train_loss: 0.4152, test_loss: 1.8588, test_f1: 0.6121
 epoch: 80, train_loss: 0.4092, test_loss: 1.8804, test_f1: 0.6109
 epoch: 81, train_loss: 0.3984, test_loss: 2.1252, test_f1: 0.5910
 epoch: 82, train_loss: 0.4148, test_loss: 1.8393, test_f1: 0.6249
 epoch: 83, train_loss: 0.4211, test_loss: 1.9427, test_f1: 0.6145
 epoch: 84, train_loss: 0.3960, test_loss: 2.0192, test_f1: 0.6232
 epoch: 85, train_loss: 0.4292, test_loss: 1.9678, test_f1: 0.6041
 epoch: 86, train_loss: 0.4054, test_loss: 1.8843, test_f1: 0.5946
 epoch: 87, train_loss: 0.3739, test_loss: 2.0718, test_f1: 0.5934
 epoch: 88, train_loss: 0.3959, test_loss: 2.0678, test_f1: 0.5845
 epoch: 89, train_loss: 0.3976, test_loss: 2.0397, test_f1: 0.5940
 epoch: 90, train_loss: 0.3614, test_loss: 2.0267, test_f1: 0.5948
 epoch: 91, train_loss: 0.3971, test_loss: 2.0255, test_f1: 0.6185
 epoch: 92, train_loss: 0.3792, test_loss: 2.0504, test_f1: 0.5942
 epoch: 93, train_loss: 0.3823, test_loss: 2.1363, test_f1: 0.6200
 epoch: 94, train_loss: 0.3690, test_loss: 2.1795, test_f1: 0.5948
 epoch: 95, train_loss: 0.3718, test_loss: 2.1067, test_f1: 0.6261
 epoch: 96, train_loss: 0.3833, test_loss: 2.0962, test_f1: 0.6180
 epoch: 97, train_loss: 0.3786, test_loss: 2.0549, test_f1: 0.6089
 epoch: 98, train_loss: 0.3690, test_loss: 2.2280, test_f1: 0.6044
 epoch: 99, train_loss: 0.4027, test_loss: 2.1011, test_f1: 0.6217
##################ITERATION #6 ****************************************
 epoch: 0, train_loss: 1.4221, test_loss: 1.5690, test_f1: 0.1420
 epoch: 1, train_loss: 1.1715, test_loss: 1.3703, test_f1: 0.3685
 epoch: 2, train_loss: 1.1153, test_loss: 1.2698, test_f1: 0.4293
 epoch: 3, train_loss: 1.0536, test_loss: 1.1886, test_f1: 0.4801
 epoch: 4, train_loss: 1.0268, test_loss: 1.2495, test_f1: 0.5034
 epoch: 5, train_loss: 1.0063, test_loss: 1.1950, test_f1: 0.4861
 epoch: 6, train_loss: 0.9838, test_loss: 1.2099, test_f1: 0.4909
 epoch: 7, train_loss: 0.9430, test_loss: 1.2955, test_f1: 0.4503
 epoch: 8, train_loss: 0.9307, test_loss: 1.2091, test_f1: 0.5663
 epoch: 9, train_loss: 0.8952, test_loss: 1.1420, test_f1: 0.5539
 epoch: 10, train_loss: 0.8658, test_loss: 1.1102, test_f1: 0.5466
 epoch: 11, train_loss: 0.8713, test_loss: 1.1206, test_f1: 0.5846
 epoch: 12, train_loss: 0.8666, test_loss: 1.2027, test_f1: 0.5693
 epoch: 13, train_loss: 0.8490, test_loss: 1.1225, test_f1: 0.5750
 epoch: 14, train_loss: 0.8079, test_loss: 1.1357, test_f1: 0.5737
 epoch: 15, train_loss: 0.8021, test_loss: 1.1696, test_f1: 0.5626
 epoch: 16, train_loss: 0.7681, test_loss: 1.1294, test_f1: 0.5562
 epoch: 17, train_loss: 0.7757, test_loss: 1.3075, test_f1: 0.5023
 epoch: 18, train_loss: 0.7593, test_loss: 1.1268, test_f1: 0.6014
 epoch: 19, train_loss: 0.7392, test_loss: 1.0663, test_f1: 0.6055
 epoch: 20, train_loss: 0.7364, test_loss: 1.2441, test_f1: 0.5442
 epoch: 21, train_loss: 0.7324, test_loss: 1.1868, test_f1: 0.5388
 epoch: 22, train_loss: 0.7112, test_loss: 1.1949, test_f1: 0.5790
 epoch: 23, train_loss: 0.7067, test_loss: 1.2384, test_f1: 0.5428
 epoch: 24, train_loss: 0.6832, test_loss: 1.2576, test_f1: 0.5558
 epoch: 25, train_loss: 0.6796, test_loss: 1.1192, test_f1: 0.5708
 epoch: 26, train_loss: 0.6709, test_loss: 1.3020, test_f1: 0.5453
 epoch: 27, train_loss: 0.6661, test_loss: 1.1555, test_f1: 0.6250
 epoch: 28, train_loss: 0.6648, test_loss: 1.3633, test_f1: 0.5633
 epoch: 29, train_loss: 0.6502, test_loss: 1.2429, test_f1: 0.5459
 epoch: 30, train_loss: 0.6386, test_loss: 1.1974, test_f1: 0.5601
 epoch: 31, train_loss: 0.6445, test_loss: 1.2936, test_f1: 0.5649
 epoch: 32, train_loss: 0.6204, test_loss: 1.6143, test_f1: 0.5332
 epoch: 33, train_loss: 0.6083, test_loss: 1.2633, test_f1: 0.5880
 epoch: 34, train_loss: 0.6042, test_loss: 1.3677, test_f1: 0.5629
 epoch: 35, train_loss: 0.5806, test_loss: 1.3025, test_f1: 0.5407
 epoch: 36, train_loss: 0.6492, test_loss: 1.4166, test_f1: 0.5625
 epoch: 37, train_loss: 0.5743, test_loss: 1.3701, test_f1: 0.6078
 epoch: 38, train_loss: 0.5535, test_loss: 1.3386, test_f1: 0.5952
 epoch: 39, train_loss: 0.5408, test_loss: 1.4108, test_f1: 0.5527
 epoch: 40, train_loss: 0.5289, test_loss: 1.4253, test_f1: 0.6082
 epoch: 41, train_loss: 0.5014, test_loss: 1.5002, test_f1: 0.5780
 epoch: 42, train_loss: 0.5503, test_loss: 1.4886, test_f1: 0.5798
 epoch: 43, train_loss: 0.6860, test_loss: 1.5622, test_f1: 0.5555
 epoch: 44, train_loss: 0.6540, test_loss: 1.3910, test_f1: 0.5824
 epoch: 45, train_loss: 0.6144, test_loss: 1.4194, test_f1: 0.5821
 epoch: 46, train_loss: 0.5954, test_loss: 1.3113, test_f1: 0.6160
 epoch: 47, train_loss: 0.5602, test_loss: 1.3451, test_f1: 0.5801
 epoch: 48, train_loss: 0.5492, test_loss: 1.4885, test_f1: 0.6024
 epoch: 49, train_loss: 0.5539, test_loss: 1.3537, test_f1: 0.6046
 epoch: 50, train_loss: 0.5107, test_loss: 1.3195, test_f1: 0.5736
 epoch: 51, train_loss: 0.4973, test_loss: 1.3495, test_f1: 0.6115
 epoch: 52, train_loss: 0.4885, test_loss: 1.3537, test_f1: 0.5786
 epoch: 53, train_loss: 0.5098, test_loss: 1.4293, test_f1: 0.5872
 epoch: 54, train_loss: 0.4845, test_loss: 1.4581, test_f1: 0.5992
 epoch: 55, train_loss: 0.4831, test_loss: 1.4243, test_f1: 0.5769
 epoch: 56, train_loss: 0.4728, test_loss: 1.4190, test_f1: 0.6025
 epoch: 57, train_loss: 0.4623, test_loss: 1.4592, test_f1: 0.6015
 epoch: 58, train_loss: 0.4465, test_loss: 1.4865, test_f1: 0.6057
 epoch: 59, train_loss: 0.4368, test_loss: 1.5177, test_f1: 0.5922
 epoch: 60, train_loss: 0.4182, test_loss: 1.5171, test_f1: 0.6018
 epoch: 61, train_loss: 0.4292, test_loss: 1.5200, test_f1: 0.6023
 epoch: 62, train_loss: 0.4306, test_loss: 1.5465, test_f1: 0.5711
 epoch: 63, train_loss: 0.4117, test_loss: 1.4741, test_f1: 0.5939
 epoch: 64, train_loss: 0.4362, test_loss: 1.5667, test_f1: 0.5761
 epoch: 65, train_loss: 0.4028, test_loss: 1.5367, test_f1: 0.5733
 epoch: 66, train_loss: 0.4094, test_loss: 1.6079, test_f1: 0.5864
 epoch: 67, train_loss: 0.3977, test_loss: 1.5705, test_f1: 0.5591
 epoch: 68, train_loss: 0.4048, test_loss: 1.6663, test_f1: 0.5864
 epoch: 69, train_loss: 0.4069, test_loss: 1.8121, test_f1: 0.5813
 epoch: 70, train_loss: 0.4305, test_loss: 1.7212, test_f1: 0.5908
 epoch: 71, train_loss: 0.3911, test_loss: 1.6577, test_f1: 0.5924
 epoch: 72, train_loss: 0.3902, test_loss: 1.7371, test_f1: 0.5903
 epoch: 73, train_loss: 0.3919, test_loss: 1.6559, test_f1: 0.6041
 epoch: 74, train_loss: 0.3749, test_loss: 1.6832, test_f1: 0.5887
 epoch: 75, train_loss: 0.3694, test_loss: 1.6407, test_f1: 0.5925
 epoch: 76, train_loss: 0.3554, test_loss: 1.7104, test_f1: 0.5857
 epoch: 77, train_loss: 0.3551, test_loss: 1.6335, test_f1: 0.6205
 epoch: 78, train_loss: 0.3581, test_loss: 1.7136, test_f1: 0.5889
 epoch: 79, train_loss: 0.3568, test_loss: 1.8070, test_f1: 0.6016
 epoch: 80, train_loss: 0.3437, test_loss: 1.7020, test_f1: 0.5968
 epoch: 81, train_loss: 0.3420, test_loss: 1.7382, test_f1: 0.6220
 epoch: 82, train_loss: 0.3417, test_loss: 1.7737, test_f1: 0.6281
 epoch: 83, train_loss: 0.3614, test_loss: 1.6844, test_f1: 0.6181
 epoch: 84, train_loss: 0.3719, test_loss: 1.8589, test_f1: 0.6057
 epoch: 85, train_loss: 0.3648, test_loss: 1.8347, test_f1: 0.6095
 epoch: 86, train_loss: 0.3588, test_loss: 1.8307, test_f1: 0.5919
 epoch: 87, train_loss: 0.3407, test_loss: 1.9393, test_f1: 0.5623
 epoch: 88, train_loss: 0.3800, test_loss: 1.8418, test_f1: 0.5951
 epoch: 89, train_loss: 0.3258, test_loss: 1.7588, test_f1: 0.6046
 epoch: 90, train_loss: 0.3366, test_loss: 2.0220, test_f1: 0.5857
 epoch: 91, train_loss: 0.3528, test_loss: 1.7693, test_f1: 0.6085
 epoch: 92, train_loss: 0.3530, test_loss: 1.8618, test_f1: 0.5797
 epoch: 93, train_loss: 0.3497, test_loss: 1.8700, test_f1: 0.5760
 epoch: 94, train_loss: 0.3490, test_loss: 1.9262, test_f1: 0.6028
 epoch: 95, train_loss: 0.3335, test_loss: 1.9074, test_f1: 0.5990
 epoch: 96, train_loss: 0.3521, test_loss: 1.8710, test_f1: 0.5525
 epoch: 97, train_loss: 0.3103, test_loss: 2.0637, test_f1: 0.6007
 epoch: 98, train_loss: 0.3180, test_loss: 1.8713, test_f1: 0.6260
 epoch: 99, train_loss: 0.3270, test_loss: 1.8268, test_f1: 0.6069
##################ITERATION #7 ****************************************
 epoch: 0, train_loss: 1.4166, test_loss: 1.3568, test_f1: 0.2842
 epoch: 1, train_loss: 1.1523, test_loss: 1.2952, test_f1: 0.3445
 epoch: 2, train_loss: 1.0707, test_loss: 1.2240, test_f1: 0.4913
 epoch: 3, train_loss: 1.0211, test_loss: 1.2418, test_f1: 0.4952
 epoch: 4, train_loss: 1.0072, test_loss: 1.5910, test_f1: 0.5266
 epoch: 5, train_loss: 0.9539, test_loss: 1.5382, test_f1: 0.5411
 epoch: 6, train_loss: 0.9428, test_loss: 1.8466, test_f1: 0.5599
 epoch: 7, train_loss: 0.9188, test_loss: 1.5769, test_f1: 0.5578
 epoch: 8, train_loss: 0.8893, test_loss: 1.8627, test_f1: 0.5362
 epoch: 9, train_loss: 0.8735, test_loss: 1.3295, test_f1: 0.5648
 epoch: 10, train_loss: 0.8702, test_loss: 1.3006, test_f1: 0.5703
 epoch: 11, train_loss: 0.8301, test_loss: 1.2129, test_f1: 0.5870
 epoch: 12, train_loss: 0.8467, test_loss: 1.5551, test_f1: 0.5665
 epoch: 13, train_loss: 0.8208, test_loss: 1.5296, test_f1: 0.5968
 epoch: 14, train_loss: 0.7866, test_loss: 1.2791, test_f1: 0.5764
 epoch: 15, train_loss: 0.8161, test_loss: 1.3791, test_f1: 0.5647
 epoch: 16, train_loss: 0.8032, test_loss: 1.3269, test_f1: 0.6003
 epoch: 17, train_loss: 0.7881, test_loss: 1.1957, test_f1: 0.5715
 epoch: 18, train_loss: 0.7630, test_loss: 1.1885, test_f1: 0.5932
 epoch: 19, train_loss: 0.7530, test_loss: 1.2379, test_f1: 0.5759
 epoch: 20, train_loss: 0.7334, test_loss: 1.2171, test_f1: 0.5627
 epoch: 21, train_loss: 0.7370, test_loss: 1.2248, test_f1: 0.6041
 epoch: 22, train_loss: 0.7054, test_loss: 1.2597, test_f1: 0.5844
 epoch: 23, train_loss: 0.7035, test_loss: 1.3233, test_f1: 0.6025
 epoch: 24, train_loss: 0.7165, test_loss: 1.3875, test_f1: 0.5538
 epoch: 25, train_loss: 0.7175, test_loss: 1.3044, test_f1: 0.5909
 epoch: 26, train_loss: 0.6869, test_loss: 1.4908, test_f1: 0.5905
 epoch: 27, train_loss: 0.6919, test_loss: 1.3536, test_f1: 0.5293
 epoch: 28, train_loss: 0.6883, test_loss: 1.3949, test_f1: 0.6087
 epoch: 29, train_loss: 0.6635, test_loss: 1.8338, test_f1: 0.5679
 epoch: 30, train_loss: 0.6436, test_loss: 2.8532, test_f1: 0.5611
 epoch: 31, train_loss: 0.6561, test_loss: 2.0382, test_f1: 0.6111
 epoch: 32, train_loss: 0.6358, test_loss: 1.3095, test_f1: 0.6083
 epoch: 33, train_loss: 0.6388, test_loss: 1.6798, test_f1: 0.5800
 epoch: 34, train_loss: 0.6440, test_loss: 2.6525, test_f1: 0.5704
 epoch: 35, train_loss: 0.6330, test_loss: 2.7133, test_f1: 0.6047
 epoch: 36, train_loss: 0.6141, test_loss: 2.6334, test_f1: 0.5830
 epoch: 37, train_loss: 0.6111, test_loss: 2.3163, test_f1: 0.6022
 epoch: 38, train_loss: 0.5972, test_loss: 1.9553, test_f1: 0.5834
 epoch: 39, train_loss: 0.5851, test_loss: 2.3120, test_f1: 0.5815
 epoch: 40, train_loss: 0.5983, test_loss: 2.3828, test_f1: 0.5754
 epoch: 41, train_loss: 0.5820, test_loss: 1.9941, test_f1: 0.5916
 epoch: 42, train_loss: 0.5892, test_loss: 2.9442, test_f1: 0.6064
 epoch: 43, train_loss: 0.6073, test_loss: 2.8225, test_f1: 0.5912
 epoch: 44, train_loss: 0.5575, test_loss: 3.2887, test_f1: 0.5599
 epoch: 45, train_loss: 0.5422, test_loss: 2.9703, test_f1: 0.5878
 epoch: 46, train_loss: 0.5501, test_loss: 4.1776, test_f1: 0.5715
 epoch: 47, train_loss: 0.5363, test_loss: 3.7990, test_f1: 0.5830
 epoch: 48, train_loss: 0.5389, test_loss: 2.2628, test_f1: 0.5616
 epoch: 49, train_loss: 0.5368, test_loss: 2.5100, test_f1: 0.5492
 epoch: 50, train_loss: 0.5268, test_loss: 2.2708, test_f1: 0.5810
 epoch: 51, train_loss: 0.4884, test_loss: 2.7515, test_f1: 0.6019
 epoch: 52, train_loss: 0.4785, test_loss: 2.3956, test_f1: 0.5935
 epoch: 53, train_loss: 0.4729, test_loss: 2.3907, test_f1: 0.5801
 epoch: 54, train_loss: 0.4564, test_loss: 2.9431, test_f1: 0.5992
 epoch: 55, train_loss: 0.4605, test_loss: 3.0556, test_f1: 0.5854
 epoch: 56, train_loss: 0.4334, test_loss: 3.1919, test_f1: 0.5795
 epoch: 57, train_loss: 0.4519, test_loss: 3.1788, test_f1: 0.5716
 epoch: 58, train_loss: 0.4258, test_loss: 2.9087, test_f1: 0.6045
 epoch: 59, train_loss: 0.4287, test_loss: 2.5906, test_f1: 0.5755
 epoch: 60, train_loss: 0.4556, test_loss: 3.1099, test_f1: 0.5609
 epoch: 61, train_loss: 0.4352, test_loss: 4.4823, test_f1: 0.5899
 epoch: 62, train_loss: 0.4205, test_loss: 5.0690, test_f1: 0.5847
 epoch: 63, train_loss: 0.4674, test_loss: 2.7410, test_f1: 0.5727
 epoch: 64, train_loss: 0.4438, test_loss: 1.9295, test_f1: 0.5660
 epoch: 65, train_loss: 0.4543, test_loss: 2.3069, test_f1: 0.5792
 epoch: 66, train_loss: 0.4186, test_loss: 3.2155, test_f1: 0.5689
 epoch: 67, train_loss: 0.4185, test_loss: 2.8240, test_f1: 0.5699
 epoch: 68, train_loss: 0.4141, test_loss: 2.7091, test_f1: 0.5694
 epoch: 69, train_loss: 0.3984, test_loss: 2.8971, test_f1: 0.5872
 epoch: 70, train_loss: 0.4066, test_loss: 2.5558, test_f1: 0.6058
 epoch: 71, train_loss: 0.3987, test_loss: 3.0297, test_f1: 0.5786
 epoch: 72, train_loss: 0.4143, test_loss: 2.7825, test_f1: 0.5722
 epoch: 73, train_loss: 0.4018, test_loss: 2.8362, test_f1: 0.5757
 epoch: 74, train_loss: 0.3788, test_loss: 2.8413, test_f1: 0.5871
 epoch: 75, train_loss: 0.3651, test_loss: 3.1390, test_f1: 0.5836
 epoch: 76, train_loss: 0.3616, test_loss: 3.3667, test_f1: 0.5968
 epoch: 77, train_loss: 0.3844, test_loss: 3.3143, test_f1: 0.5837
 epoch: 78, train_loss: 0.3475, test_loss: 4.3290, test_f1: 0.5992
 epoch: 79, train_loss: 0.3546, test_loss: 3.8958, test_f1: 0.5959
 epoch: 80, train_loss: 0.3656, test_loss: 3.6347, test_f1: 0.5778
 epoch: 81, train_loss: 0.3486, test_loss: 3.4955, test_f1: 0.5813
 epoch: 82, train_loss: 0.3512, test_loss: 3.2962, test_f1: 0.5729
 epoch: 83, train_loss: 0.3518, test_loss: 4.0055, test_f1: 0.5825
 epoch: 84, train_loss: 0.3418, test_loss: 3.6408, test_f1: 0.5809
 epoch: 85, train_loss: 0.3601, test_loss: 2.4690, test_f1: 0.5584
 epoch: 86, train_loss: 0.3631, test_loss: 2.8624, test_f1: 0.5831
 epoch: 87, train_loss: 0.3604, test_loss: 2.8101, test_f1: 0.5740
 epoch: 88, train_loss: 0.3352, test_loss: 2.8500, test_f1: 0.5772
 epoch: 89, train_loss: 0.3294, test_loss: 2.5363, test_f1: 0.5786
 epoch: 90, train_loss: 0.3338, test_loss: 2.4791, test_f1: 0.5823
 epoch: 91, train_loss: 0.3143, test_loss: 2.4222, test_f1: 0.5827
 epoch: 92, train_loss: 0.3219, test_loss: 3.4903, test_f1: 0.6004
 epoch: 93, train_loss: 0.3412, test_loss: 3.1852, test_f1: 0.5891
 epoch: 94, train_loss: 0.3251, test_loss: 3.4119, test_f1: 0.5772
 epoch: 95, train_loss: 0.3218, test_loss: 3.3719, test_f1: 0.5819
 epoch: 96, train_loss: 0.3318, test_loss: 2.5915, test_f1: 0.5700
 epoch: 97, train_loss: 0.3163, test_loss: 3.0511, test_f1: 0.5751
 epoch: 98, train_loss: 0.2974, test_loss: 3.3929, test_f1: 0.5955
 epoch: 99, train_loss: 0.3116, test_loss: 3.1687, test_f1: 0.6070
##################ITERATION #8 ****************************************
 epoch: 0, train_loss: 1.5180, test_loss: 1.3711, test_f1: 0.3006
 epoch: 1, train_loss: 1.2343, test_loss: 1.3422, test_f1: 0.3384
 epoch: 2, train_loss: 1.1574, test_loss: 1.3289, test_f1: 0.4908
 epoch: 3, train_loss: 1.1049, test_loss: 1.2193, test_f1: 0.5177
 epoch: 4, train_loss: 1.0437, test_loss: 1.1404, test_f1: 0.5425
 epoch: 5, train_loss: 1.0039, test_loss: 1.1412, test_f1: 0.5784
 epoch: 6, train_loss: 0.9831, test_loss: 1.1495, test_f1: 0.5665
 epoch: 7, train_loss: 0.9693, test_loss: 1.0963, test_f1: 0.6271
 epoch: 8, train_loss: 0.9194, test_loss: 1.1957, test_f1: 0.5644
 epoch: 9, train_loss: 0.9220, test_loss: 1.1432, test_f1: 0.5869
 epoch: 10, train_loss: 0.8937, test_loss: 1.1873, test_f1: 0.5623
 epoch: 11, train_loss: 0.8993, test_loss: 1.0888, test_f1: 0.6123
 epoch: 12, train_loss: 0.8892, test_loss: 1.2284, test_f1: 0.5494
 epoch: 13, train_loss: 0.8581, test_loss: 1.0769, test_f1: 0.6239
 epoch: 14, train_loss: 0.8525, test_loss: 1.1334, test_f1: 0.6074
 epoch: 15, train_loss: 0.8429, test_loss: 1.1425, test_f1: 0.6161
 epoch: 16, train_loss: 0.8023, test_loss: 1.2216, test_f1: 0.5982
 epoch: 17, train_loss: 0.8036, test_loss: 1.2024, test_f1: 0.6057
 epoch: 18, train_loss: 0.8033, test_loss: 1.1248, test_f1: 0.5936
 epoch: 19, train_loss: 0.7702, test_loss: 1.0852, test_f1: 0.5974
 epoch: 20, train_loss: 0.7593, test_loss: 1.1947, test_f1: 0.6397
 epoch: 21, train_loss: 0.7449, test_loss: 1.2067, test_f1: 0.5793
 epoch: 22, train_loss: 0.7544, test_loss: 1.0787, test_f1: 0.6352
 epoch: 23, train_loss: 0.7257, test_loss: 1.2313, test_f1: 0.6170
 epoch: 24, train_loss: 0.7336, test_loss: 1.1478, test_f1: 0.5891
 epoch: 25, train_loss: 0.7282, test_loss: 1.0842, test_f1: 0.6471
 epoch: 26, train_loss: 0.7231, test_loss: 1.1273, test_f1: 0.6482
 epoch: 27, train_loss: 0.6941, test_loss: 1.1990, test_f1: 0.6006
 epoch: 28, train_loss: 0.7077, test_loss: 1.1613, test_f1: 0.5984
 epoch: 29, train_loss: 0.6852, test_loss: 1.3012, test_f1: 0.5493
 epoch: 30, train_loss: 0.6547, test_loss: 1.3295, test_f1: 0.5182
 epoch: 31, train_loss: 0.6643, test_loss: 1.2220, test_f1: 0.5876
 epoch: 32, train_loss: 0.6356, test_loss: 1.4077, test_f1: 0.5800
 epoch: 33, train_loss: 0.6564, test_loss: 1.5474, test_f1: 0.4768
 epoch: 34, train_loss: 0.6322, test_loss: 1.3354, test_f1: 0.6115
 epoch: 35, train_loss: 0.6450, test_loss: 1.4027, test_f1: 0.5839
 epoch: 36, train_loss: 0.6174, test_loss: 1.6079, test_f1: 0.5498
 epoch: 37, train_loss: 0.6268, test_loss: 1.2368, test_f1: 0.5819
 epoch: 38, train_loss: 0.6409, test_loss: 1.2894, test_f1: 0.6162
 epoch: 39, train_loss: 0.6140, test_loss: 1.3867, test_f1: 0.5395
 epoch: 40, train_loss: 0.5919, test_loss: 1.2698, test_f1: 0.5714
 epoch: 41, train_loss: 0.5869, test_loss: 1.4647, test_f1: 0.5493
 epoch: 42, train_loss: 0.5959, test_loss: 1.5194, test_f1: 0.5809
 epoch: 43, train_loss: 0.5841, test_loss: 1.6133, test_f1: 0.5152
 epoch: 44, train_loss: 0.5522, test_loss: 1.4113, test_f1: 0.5938
 epoch: 45, train_loss: 0.5644, test_loss: 1.6047, test_f1: 0.5469
 epoch: 46, train_loss: 0.5649, test_loss: 1.7803, test_f1: 0.5334
 epoch: 47, train_loss: 0.5566, test_loss: 1.5940, test_f1: 0.5669
 epoch: 48, train_loss: 0.5135, test_loss: 1.5655, test_f1: 0.5735
 epoch: 49, train_loss: 0.5074, test_loss: 1.5207, test_f1: 0.5509
 epoch: 50, train_loss: 0.5056, test_loss: 1.6130, test_f1: 0.5553
 epoch: 51, train_loss: 0.5049, test_loss: 1.5883, test_f1: 0.5455
 epoch: 52, train_loss: 0.4893, test_loss: 1.5689, test_f1: 0.5544
 epoch: 53, train_loss: 0.4788, test_loss: 1.5711, test_f1: 0.5795
 epoch: 54, train_loss: 0.4686, test_loss: 1.6457, test_f1: 0.5832
 epoch: 55, train_loss: 0.4702, test_loss: 1.5851, test_f1: 0.5858
 epoch: 56, train_loss: 0.4656, test_loss: 1.7941, test_f1: 0.5492
 epoch: 57, train_loss: 0.4735, test_loss: 1.7537, test_f1: 0.5840
 epoch: 58, train_loss: 0.4480, test_loss: 1.7251, test_f1: 0.5264
 epoch: 59, train_loss: 0.4526, test_loss: 1.6740, test_f1: 0.5528
 epoch: 60, train_loss: 0.4510, test_loss: 1.6340, test_f1: 0.5759
 epoch: 61, train_loss: 0.4232, test_loss: 1.8868, test_f1: 0.5616
 epoch: 62, train_loss: 0.4353, test_loss: 1.7680, test_f1: 0.5571
 epoch: 63, train_loss: 0.4521, test_loss: 1.9496, test_f1: 0.5451
 epoch: 64, train_loss: 0.4351, test_loss: 1.9404, test_f1: 0.5596
 epoch: 65, train_loss: 0.4167, test_loss: 1.9531, test_f1: 0.5553
 epoch: 66, train_loss: 0.4393, test_loss: 1.7700, test_f1: 0.5344
 epoch: 67, train_loss: 0.4241, test_loss: 1.8794, test_f1: 0.5740
 epoch: 68, train_loss: 0.4277, test_loss: 1.7689, test_f1: 0.5750
 epoch: 69, train_loss: 0.4053, test_loss: 1.8220, test_f1: 0.5808
 epoch: 70, train_loss: 0.3936, test_loss: 1.8064, test_f1: 0.5813
 epoch: 71, train_loss: 0.4056, test_loss: 1.7254, test_f1: 0.5698
 epoch: 72, train_loss: 0.4152, test_loss: 1.8435, test_f1: 0.5459
 epoch: 73, train_loss: 0.3864, test_loss: 1.9203, test_f1: 0.5853
 epoch: 74, train_loss: 0.3978, test_loss: 1.9123, test_f1: 0.5943
 epoch: 75, train_loss: 0.3808, test_loss: 1.6122, test_f1: 0.5858
 epoch: 76, train_loss: 0.4017, test_loss: 1.8757, test_f1: 0.5767
 epoch: 77, train_loss: 0.3796, test_loss: 2.0844, test_f1: 0.5579
 epoch: 78, train_loss: 0.3905, test_loss: 1.8608, test_f1: 0.5730
 epoch: 79, train_loss: 0.3726, test_loss: 1.9089, test_f1: 0.5564
 epoch: 80, train_loss: 0.4082, test_loss: 1.9051, test_f1: 0.6001
 epoch: 81, train_loss: 0.3910, test_loss: 1.8850, test_f1: 0.5591
 epoch: 82, train_loss: 0.3797, test_loss: 1.8321, test_f1: 0.5751
 epoch: 83, train_loss: 0.3742, test_loss: 1.8987, test_f1: 0.5621
 epoch: 84, train_loss: 0.3437, test_loss: 1.8212, test_f1: 0.5725
 epoch: 85, train_loss: 0.3561, test_loss: 1.8891, test_f1: 0.5949
 epoch: 86, train_loss: 0.3814, test_loss: 1.9293, test_f1: 0.5616
 epoch: 87, train_loss: 0.3744, test_loss: 1.9729, test_f1: 0.5987
 epoch: 88, train_loss: 0.3465, test_loss: 2.1121, test_f1: 0.5513
 epoch: 89, train_loss: 0.3707, test_loss: 2.2261, test_f1: 0.5372
 epoch: 90, train_loss: 0.3502, test_loss: 2.0149, test_f1: 0.5517
 epoch: 91, train_loss: 0.3551, test_loss: 1.9744, test_f1: 0.5417
 epoch: 92, train_loss: 0.3376, test_loss: 1.9830, test_f1: 0.5727
 epoch: 93, train_loss: 0.3322, test_loss: 1.8604, test_f1: 0.5519
 epoch: 94, train_loss: 0.3504, test_loss: 2.2499, test_f1: 0.5401
 epoch: 95, train_loss: 0.3495, test_loss: 1.9599, test_f1: 0.5958
 epoch: 96, train_loss: 0.3316, test_loss: 2.2253, test_f1: 0.5598
 epoch: 97, train_loss: 0.3182, test_loss: 2.0653, test_f1: 0.5706
 epoch: 98, train_loss: 0.3652, test_loss: 2.1123, test_f1: 0.5697
 epoch: 99, train_loss: 0.3530, test_loss: 1.9721, test_f1: 0.5836
##################ITERATION #9 ****************************************
 epoch: 0, train_loss: 1.5199, test_loss: 1.4802, test_f1: 0.2215
 epoch: 1, train_loss: 1.2071, test_loss: 1.3935, test_f1: 0.2861
 epoch: 2, train_loss: 1.1506, test_loss: 1.3549, test_f1: 0.4152
 epoch: 3, train_loss: 1.1052, test_loss: 1.2280, test_f1: 0.5234
 epoch: 4, train_loss: 1.0426, test_loss: 1.1936, test_f1: 0.5140
 epoch: 5, train_loss: 1.0214, test_loss: 1.1269, test_f1: 0.5748
 epoch: 6, train_loss: 0.9933, test_loss: 1.1340, test_f1: 0.5567
 epoch: 7, train_loss: 0.9866, test_loss: 1.1274, test_f1: 0.5448
 epoch: 8, train_loss: 0.9457, test_loss: 1.0839, test_f1: 0.5741
 epoch: 9, train_loss: 0.9216, test_loss: 1.0776, test_f1: 0.5873
 epoch: 10, train_loss: 0.8953, test_loss: 1.0570, test_f1: 0.6484
 epoch: 11, train_loss: 0.9050, test_loss: 1.0761, test_f1: 0.6167
 epoch: 12, train_loss: 0.8675, test_loss: 1.0943, test_f1: 0.6294
 epoch: 13, train_loss: 0.8491, test_loss: 1.0461, test_f1: 0.6516
 epoch: 14, train_loss: 0.8453, test_loss: 1.0264, test_f1: 0.6496
 epoch: 15, train_loss: 0.7936, test_loss: 1.1046, test_f1: 0.6145
 epoch: 16, train_loss: 0.8026, test_loss: 1.0528, test_f1: 0.6192
 epoch: 17, train_loss: 0.8156, test_loss: 1.0483, test_f1: 0.6189
 epoch: 18, train_loss: 0.7805, test_loss: 1.0632, test_f1: 0.6291
 epoch: 19, train_loss: 0.7731, test_loss: 1.0533, test_f1: 0.6188
 epoch: 20, train_loss: 0.7927, test_loss: 1.0479, test_f1: 0.6132
 epoch: 21, train_loss: 0.7790, test_loss: 1.0983, test_f1: 0.6004
 epoch: 22, train_loss: 0.7615, test_loss: 1.1037, test_f1: 0.6269
 epoch: 23, train_loss: 0.7356, test_loss: 1.1080, test_f1: 0.5547
 epoch: 24, train_loss: 0.7213, test_loss: 1.0482, test_f1: 0.6221
 epoch: 25, train_loss: 0.6762, test_loss: 1.0780, test_f1: 0.6008
 epoch: 26, train_loss: 0.6882, test_loss: 1.0517, test_f1: 0.6634
 epoch: 27, train_loss: 0.7114, test_loss: 1.0799, test_f1: 0.6258
 epoch: 28, train_loss: 0.6760, test_loss: 1.1548, test_f1: 0.5903
 epoch: 29, train_loss: 0.6455, test_loss: 1.1060, test_f1: 0.6242
 epoch: 30, train_loss: 0.6469, test_loss: 1.1106, test_f1: 0.6375
 epoch: 31, train_loss: 0.6502, test_loss: 1.2370, test_f1: 0.5997
 epoch: 32, train_loss: 0.6428, test_loss: 1.1539, test_f1: 0.6585
 epoch: 33, train_loss: 0.6305, test_loss: 1.1389, test_f1: 0.5842
 epoch: 34, train_loss: 0.6055, test_loss: 1.1607, test_f1: 0.5884
 epoch: 35, train_loss: 0.6002, test_loss: 1.1774, test_f1: 0.6172
 epoch: 36, train_loss: 0.6027, test_loss: 1.1946, test_f1: 0.6257
 epoch: 37, train_loss: 0.5945, test_loss: 1.2336, test_f1: 0.6010
 epoch: 38, train_loss: 0.5953, test_loss: 1.2771, test_f1: 0.5856
 epoch: 39, train_loss: 0.6025, test_loss: 1.1543, test_f1: 0.6244
 epoch: 40, train_loss: 0.5760, test_loss: 1.1610, test_f1: 0.6642
 epoch: 41, train_loss: 0.5763, test_loss: 1.1932, test_f1: 0.6048
 epoch: 42, train_loss: 0.5692, test_loss: 1.2526, test_f1: 0.6201
 epoch: 43, train_loss: 0.5539, test_loss: 1.2195, test_f1: 0.6260
 epoch: 44, train_loss: 0.5539, test_loss: 1.2978, test_f1: 0.6004
 epoch: 45, train_loss: 0.5269, test_loss: 1.2005, test_f1: 0.6372
 epoch: 46, train_loss: 0.5403, test_loss: 1.5993, test_f1: 0.5686
 epoch: 47, train_loss: 0.5228, test_loss: 1.3676, test_f1: 0.5672
 epoch: 48, train_loss: 0.5456, test_loss: 1.3715, test_f1: 0.6079
 epoch: 49, train_loss: 0.4856, test_loss: 1.4898, test_f1: 0.6006
 epoch: 50, train_loss: 0.4908, test_loss: 1.3338, test_f1: 0.6040
 epoch: 51, train_loss: 0.4891, test_loss: 1.3643, test_f1: 0.6132
 epoch: 52, train_loss: 0.4607, test_loss: 1.4129, test_f1: 0.6027
 epoch: 53, train_loss: 0.4434, test_loss: 1.4112, test_f1: 0.6258
 epoch: 54, train_loss: 0.4274, test_loss: 1.3544, test_f1: 0.6287
 epoch: 55, train_loss: 0.4384, test_loss: 1.4103, test_f1: 0.6204
 epoch: 56, train_loss: 0.4273, test_loss: 1.4373, test_f1: 0.6358
 epoch: 57, train_loss: 0.4332, test_loss: 1.3805, test_f1: 0.6599
 epoch: 58, train_loss: 0.4162, test_loss: 1.4731, test_f1: 0.6100
 epoch: 59, train_loss: 0.4219, test_loss: 1.5581, test_f1: 0.6215
 epoch: 60, train_loss: 0.4019, test_loss: 1.5931, test_f1: 0.6139
 epoch: 61, train_loss: 0.4070, test_loss: 1.5784, test_f1: 0.6051
 epoch: 62, train_loss: 0.3918, test_loss: 1.5077, test_f1: 0.6179
 epoch: 63, train_loss: 0.4171, test_loss: 1.4759, test_f1: 0.6338
 epoch: 64, train_loss: 0.4126, test_loss: 1.5908, test_f1: 0.6037
 epoch: 65, train_loss: 0.3986, test_loss: 1.5814, test_f1: 0.6364
 epoch: 66, train_loss: 0.3997, test_loss: 1.5004, test_f1: 0.6105
 epoch: 67, train_loss: 0.3731, test_loss: 1.5685, test_f1: 0.6233
 epoch: 68, train_loss: 0.3490, test_loss: 1.6519, test_f1: 0.6292
 epoch: 69, train_loss: 0.3685, test_loss: 1.5599, test_f1: 0.6210
 epoch: 70, train_loss: 0.3799, test_loss: 1.6418, test_f1: 0.5842
 epoch: 71, train_loss: 0.3676, test_loss: 1.5119, test_f1: 0.6412
 epoch: 72, train_loss: 0.3833, test_loss: 1.5880, test_f1: 0.6269
 epoch: 73, train_loss: 0.4043, test_loss: 1.6448, test_f1: 0.5673
 epoch: 74, train_loss: 0.3799, test_loss: 1.6572, test_f1: 0.6206
 epoch: 75, train_loss: 0.3706, test_loss: 1.6250, test_f1: 0.6059
 epoch: 76, train_loss: 0.3784, test_loss: 1.6895, test_f1: 0.5973
 epoch: 77, train_loss: 0.3721, test_loss: 1.6276, test_f1: 0.6174
 epoch: 78, train_loss: 0.3615, test_loss: 1.6800, test_f1: 0.6097
 epoch: 79, train_loss: 0.3481, test_loss: 1.6686, test_f1: 0.6308
 epoch: 80, train_loss: 0.3430, test_loss: 1.6242, test_f1: 0.6356
 epoch: 81, train_loss: 0.3592, test_loss: 1.6655, test_f1: 0.6149
 epoch: 82, train_loss: 0.3424, test_loss: 1.7066, test_f1: 0.6343
 epoch: 83, train_loss: 0.3342, test_loss: 1.7442, test_f1: 0.6064
 epoch: 84, train_loss: 0.3339, test_loss: 1.6737, test_f1: 0.6161
 epoch: 85, train_loss: 0.3471, test_loss: 1.6687, test_f1: 0.6173
 epoch: 86, train_loss: 0.3351, test_loss: 1.7185, test_f1: 0.6441
 epoch: 87, train_loss: 0.3220, test_loss: 1.8085, test_f1: 0.6198
 epoch: 88, train_loss: 0.3393, test_loss: 1.8807, test_f1: 0.6195
 epoch: 89, train_loss: 0.2948, test_loss: 1.8186, test_f1: 0.6115
 epoch: 90, train_loss: 0.3280, test_loss: 1.7496, test_f1: 0.6115
 epoch: 91, train_loss: 0.3075, test_loss: 1.9162, test_f1: 0.6214
 epoch: 92, train_loss: 0.3069, test_loss: 1.8387, test_f1: 0.6166
 epoch: 93, train_loss: 0.3319, test_loss: 1.7955, test_f1: 0.6172
 epoch: 94, train_loss: 0.3236, test_loss: 2.0467, test_f1: 0.6045
 epoch: 95, train_loss: 0.2813, test_loss: 1.9457, test_f1: 0.6333
 epoch: 96, train_loss: 0.2994, test_loss: 1.8657, test_f1: 0.6178
 epoch: 97, train_loss: 0.3276, test_loss: 1.8733, test_f1: 0.5819
 epoch: 98, train_loss: 0.3146, test_loss: 1.7814, test_f1: 0.6109
 epoch: 99, train_loss: 0.3293, test_loss: 1.8514, test_f1: 0.6065

Training completed in 382.45 seconds
Best F1: 0.6642 at epoch 40
Mean F1 across iterations: 0.6293  0.0204
========================FINAL RESULTS================================
FEGIN weighted F1: 0.6642  0.0204
python main.py --data ltspice_demos --representation component_component --model FEGIN --layers 2 --hiddens 64 --batch_size 128 --lr 0.001 --emb_size 250 --epochs 100 --save_appendix component_component_L2_H64_BS128_LR0.001_E250 --no_val
-----



STDERR:
  File "main.py", line 370, in <module>
    main()
  File "main.py", line 254, in main
    dataset = dataset_class(
  File "/home/philip/projects/ltspice_examples_code_repo/Circuit-Completion-Using-GNNs/component_classification_with_link_prediction_head/evaluation/FEGIN/kernel/circuit_datasets.py", line 15, in __init__
    self.data, self.slices = torch.load(self.processed_paths[0])
  File "/home/philip/.local/lib/python3.8/site-packages/torch/serialization.py", line 1040, in load
    warnings.warn(
  File "/usr/lib/python3.8/warnings.py", line 109, in _showwarnmsg
    sw(msg.message, msg.category, msg.filename, msg.lineno,
  File "main.py", line 47, in warn_with_traceback
    traceback.print_stack(file=log)
/home/philip/projects/ltspice_examples_code_repo/Circuit-Completion-Using-GNNs/component_classification_with_link_prediction_head/evaluation/FEGIN/kernel/circuit_datasets.py:15: FutureWarning: You are using `torch.load` with `weights_only=False` (the current default value), which uses the default pickle module implicitly. It is possible to construct malicious pickle data which will execute arbitrary code during unpickling (See https://github.com/pytorch/pytorch/blob/main/SECURITY.md#untrusted-models for more details). In a future release, the default value for `weights_only` will be flipped to `True`. This limits the functions that could be executed during unpickling. Arbitrary objects will no longer be allowed to be loaded via this mode unless they are explicitly allowlisted by the user via `torch.serialization.add_safe_globals`. We recommend you start setting `weights_only=True` for any use case where you don't have full control of the loaded file. Please open an issue on GitHub for any issues related to this experimental feature.
  self.data, self.slices = torch.load(self.processed_paths[0])
