STDOUT:
Results will be saved in /home/philip/projects/ltspice_examples_code_repo/Circuit-Completion-Using-GNNs/component_classification_with_link_prediction_head/evaluation/FEGIN/results/model_FEGIN_dataset_ltspice_examples
Command line input: python main.py --data ltspice_examples --representation component_net --model FEGIN --layers 4 --hiddens 16 --batch_size 256 --lr 0.1 --emb_size 512 --epochs 100 --save_appendix component_net_L4_H16_BS256_LR0.1_E512 --no_val
 is saved.
-----
ltspice_examples - FEGIN
Using 4 layers, 16 hidden units, h = 2
Loading component_net representation dataset
ENTERED
Training FEGIN on component_net representation
Train: 3558, Test: 846
##################ITERATION #0 ****************************************
 epoch: 0, train_loss: 1.4398, test_loss: 1.2876, test_f1: 0.2868
 epoch: 1, train_loss: 1.2635, test_loss: 1.2395, test_f1: 0.2580
 epoch: 2, train_loss: 1.2181, test_loss: 1.1811, test_f1: 0.2908
 epoch: 3, train_loss: 1.1812, test_loss: 1.1229, test_f1: 0.3446
 epoch: 4, train_loss: 1.1496, test_loss: 1.1209, test_f1: 0.3384
 epoch: 5, train_loss: 1.1166, test_loss: 1.0722, test_f1: 0.3790
 epoch: 6, train_loss: 1.1118, test_loss: 1.0594, test_f1: 0.3559
 epoch: 7, train_loss: 1.1011, test_loss: 1.0723, test_f1: 0.3608
 epoch: 8, train_loss: 1.0986, test_loss: 1.0845, test_f1: 0.3422
 epoch: 9, train_loss: 1.0949, test_loss: 1.0611, test_f1: 0.3654
 epoch: 10, train_loss: 1.1074, test_loss: 1.2313, test_f1: 0.3307
 epoch: 11, train_loss: 1.0935, test_loss: 1.0821, test_f1: 0.3439
 epoch: 12, train_loss: 1.0818, test_loss: 1.2475, test_f1: 0.3467
 epoch: 13, train_loss: 1.1078, test_loss: 1.0664, test_f1: 0.3729
 epoch: 14, train_loss: 1.0717, test_loss: 1.1283, test_f1: 0.3583
 epoch: 15, train_loss: 1.0729, test_loss: 1.0385, test_f1: 0.3962
 epoch: 16, train_loss: 1.0501, test_loss: 1.1312, test_f1: 0.3908
 epoch: 17, train_loss: 1.0710, test_loss: 1.0408, test_f1: 0.3545
 epoch: 18, train_loss: 1.0778, test_loss: 1.0756, test_f1: 0.3422
 epoch: 19, train_loss: 1.0568, test_loss: 1.2172, test_f1: 0.3331
 epoch: 20, train_loss: 1.0461, test_loss: 1.0742, test_f1: 0.3432
 epoch: 21, train_loss: 1.0539, test_loss: 1.0289, test_f1: 0.3472
 epoch: 22, train_loss: 1.0501, test_loss: 1.0962, test_f1: 0.3448
 epoch: 23, train_loss: 1.0455, test_loss: 1.0178, test_f1: 0.3742
 epoch: 24, train_loss: 1.0317, test_loss: 1.1831, test_f1: 0.3379
 epoch: 25, train_loss: 1.0380, test_loss: 1.0773, test_f1: 0.4066
 epoch: 26, train_loss: 1.0521, test_loss: 1.0140, test_f1: 0.4093
 epoch: 27, train_loss: 1.0461, test_loss: 1.0325, test_f1: 0.3729
 epoch: 28, train_loss: 1.0315, test_loss: 1.0737, test_f1: 0.3842
 epoch: 29, train_loss: 1.0271, test_loss: 1.0413, test_f1: 0.3984
 epoch: 30, train_loss: 1.0183, test_loss: 1.2162, test_f1: 0.3975
 epoch: 31, train_loss: 1.0367, test_loss: 1.0559, test_f1: 0.4067
 epoch: 32, train_loss: 1.0309, test_loss: 1.1316, test_f1: 0.3958
 epoch: 33, train_loss: 1.0543, test_loss: 1.2571, test_f1: 0.3695
 epoch: 34, train_loss: 1.0583, test_loss: 1.0440, test_f1: 0.3915
 epoch: 35, train_loss: 1.0462, test_loss: 1.0288, test_f1: 0.3446
 epoch: 36, train_loss: 1.0343, test_loss: 1.1909, test_f1: 0.4283
 epoch: 37, train_loss: 1.0352, test_loss: 1.1777, test_f1: 0.3985
 epoch: 38, train_loss: 1.0331, test_loss: 1.0988, test_f1: 0.4305
 epoch: 39, train_loss: 1.0304, test_loss: 1.0384, test_f1: 0.4151
 epoch: 40, train_loss: 1.0411, test_loss: 1.0222, test_f1: 0.4381
 epoch: 41, train_loss: 1.0215, test_loss: 1.0828, test_f1: 0.4625
 epoch: 42, train_loss: 1.0188, test_loss: 1.0415, test_f1: 0.3949
 epoch: 43, train_loss: 1.0065, test_loss: 1.0841, test_f1: 0.4529
 epoch: 44, train_loss: 1.0231, test_loss: 1.0600, test_f1: 0.4387
 epoch: 45, train_loss: 1.0181, test_loss: 1.0177, test_f1: 0.4584
 epoch: 46, train_loss: 1.0237, test_loss: 1.0628, test_f1: 0.4108
 epoch: 47, train_loss: 1.0321, test_loss: 1.0600, test_f1: 0.3450
 epoch: 48, train_loss: 1.0250, test_loss: 1.0293, test_f1: 0.4672
 epoch: 49, train_loss: 1.0512, test_loss: 1.1811, test_f1: 0.3438
 epoch: 50, train_loss: 1.0705, test_loss: 1.1062, test_f1: 0.4584
 epoch: 51, train_loss: 1.0632, test_loss: 1.0516, test_f1: 0.4526
 epoch: 52, train_loss: 1.0456, test_loss: 1.1568, test_f1: 0.4279
 epoch: 53, train_loss: 1.0649, test_loss: 1.0475, test_f1: 0.3332
 epoch: 54, train_loss: 1.0295, test_loss: 1.1022, test_f1: 0.4749
 epoch: 55, train_loss: 1.0242, test_loss: 1.0574, test_f1: 0.4600
 epoch: 56, train_loss: 1.0320, test_loss: 1.0903, test_f1: 0.4670
 epoch: 57, train_loss: 1.0139, test_loss: 1.0430, test_f1: 0.4649
 epoch: 58, train_loss: 1.0197, test_loss: 1.0605, test_f1: 0.4796
 epoch: 59, train_loss: 1.0106, test_loss: 1.1280, test_f1: 0.4589
 epoch: 60, train_loss: 1.0107, test_loss: 1.0099, test_f1: 0.4502
 epoch: 61, train_loss: 1.0050, test_loss: 1.0404, test_f1: 0.4761
 epoch: 62, train_loss: 1.0040, test_loss: 1.0575, test_f1: 0.4756
 epoch: 63, train_loss: 1.0124, test_loss: 1.0754, test_f1: 0.4769
 epoch: 64, train_loss: 1.0208, test_loss: 1.0159, test_f1: 0.4841
 epoch: 65, train_loss: 0.9967, test_loss: 1.0368, test_f1: 0.4433
 epoch: 66, train_loss: 1.0078, test_loss: 0.9768, test_f1: 0.4886
 epoch: 67, train_loss: 1.0294, test_loss: 1.0204, test_f1: 0.4122
 epoch: 68, train_loss: 1.0135, test_loss: 1.0069, test_f1: 0.4571
 epoch: 69, train_loss: 0.9988, test_loss: 1.0518, test_f1: 0.4623
 epoch: 70, train_loss: 1.0214, test_loss: 1.0310, test_f1: 0.4762
 epoch: 71, train_loss: 1.0116, test_loss: 1.0913, test_f1: 0.4681
 epoch: 72, train_loss: 1.0063, test_loss: 1.1416, test_f1: 0.4692
 epoch: 73, train_loss: 0.9994, test_loss: 1.0293, test_f1: 0.4603
 epoch: 74, train_loss: 1.0055, test_loss: 1.5007, test_f1: 0.3901
 epoch: 75, train_loss: 1.0170, test_loss: 1.0064, test_f1: 0.4980
 epoch: 76, train_loss: 1.0103, test_loss: 1.0000, test_f1: 0.4667
 epoch: 77, train_loss: 1.0035, test_loss: 1.0292, test_f1: 0.4609
 epoch: 78, train_loss: 1.0023, test_loss: 1.0256, test_f1: 0.4631
 epoch: 79, train_loss: 0.9994, test_loss: 1.0072, test_f1: 0.4543
 epoch: 80, train_loss: 1.0170, test_loss: 1.0016, test_f1: 0.4782
 epoch: 81, train_loss: 1.0046, test_loss: 1.0273, test_f1: 0.4697
 epoch: 82, train_loss: 1.0013, test_loss: 1.1723, test_f1: 0.4425
 epoch: 83, train_loss: 1.0058, test_loss: 1.0224, test_f1: 0.4488
 epoch: 84, train_loss: 1.0004, test_loss: 1.0299, test_f1: 0.4765
 epoch: 85, train_loss: 1.0106, test_loss: 1.0712, test_f1: 0.4773
 epoch: 86, train_loss: 1.0108, test_loss: 1.0048, test_f1: 0.4592
 epoch: 87, train_loss: 1.0164, test_loss: 1.0710, test_f1: 0.4501
 epoch: 88, train_loss: 1.0133, test_loss: 1.0371, test_f1: 0.4880
 epoch: 89, train_loss: 1.0026, test_loss: 1.0361, test_f1: 0.4776
 epoch: 90, train_loss: 1.0033, test_loss: 1.0633, test_f1: 0.5092
 epoch: 91, train_loss: 1.0051, test_loss: 1.0737, test_f1: 0.4712
 epoch: 92, train_loss: 0.9929, test_loss: 1.0291, test_f1: 0.4602
 epoch: 93, train_loss: 1.0042, test_loss: 1.0616, test_f1: 0.5002
 epoch: 94, train_loss: 1.0122, test_loss: 1.0629, test_f1: 0.3675
 epoch: 95, train_loss: 1.0314, test_loss: 1.1597, test_f1: 0.3984
 epoch: 96, train_loss: 1.0568, test_loss: 1.0997, test_f1: 0.3580
 epoch: 97, train_loss: 1.0349, test_loss: 1.0802, test_f1: 0.4162
 epoch: 98, train_loss: 1.0417, test_loss: 1.1197, test_f1: 0.4377
 epoch: 99, train_loss: 1.0539, test_loss: 1.0826, test_f1: 0.4528
##################ITERATION #1 ****************************************
 epoch: 0, train_loss: 1.3661, test_loss: 1.3140, test_f1: 0.2270
 epoch: 1, train_loss: 1.3027, test_loss: 1.3160, test_f1: 0.2270
 epoch: 2, train_loss: 1.3024, test_loss: 1.3157, test_f1: 0.2270
 epoch: 3, train_loss: 1.3022, test_loss: 1.3150, test_f1: 0.2270
 epoch: 4, train_loss: 1.3023, test_loss: 1.3151, test_f1: 0.2270
 epoch: 5, train_loss: 1.3017, test_loss: 1.3149, test_f1: 0.2270
 epoch: 6, train_loss: 1.3015, test_loss: 1.3148, test_f1: 0.2270
 epoch: 7, train_loss: 1.3023, test_loss: 1.3149, test_f1: 0.2270
 epoch: 8, train_loss: 1.3028, test_loss: 1.3147, test_f1: 0.2270
 epoch: 9, train_loss: 1.3021, test_loss: 1.3159, test_f1: 0.2270
 epoch: 10, train_loss: 1.3018, test_loss: 1.3145, test_f1: 0.2270
 epoch: 11, train_loss: 1.3018, test_loss: 1.3155, test_f1: 0.2270
 epoch: 12, train_loss: 1.3017, test_loss: 1.3144, test_f1: 0.2270
 epoch: 13, train_loss: 1.3022, test_loss: 1.3165, test_f1: 0.2270
 epoch: 14, train_loss: 1.3025, test_loss: 1.3150, test_f1: 0.2270
 epoch: 15, train_loss: 1.3017, test_loss: 1.3154, test_f1: 0.2270
 epoch: 16, train_loss: 1.3018, test_loss: 1.3145, test_f1: 0.2270
 epoch: 17, train_loss: 1.3029, test_loss: 1.3149, test_f1: 0.2270
 epoch: 18, train_loss: 1.3019, test_loss: 1.3147, test_f1: 0.2270
 epoch: 19, train_loss: 1.3021, test_loss: 1.3146, test_f1: 0.2270
 epoch: 20, train_loss: 1.3027, test_loss: 1.3140, test_f1: 0.2270
 epoch: 21, train_loss: 1.3026, test_loss: 1.3171, test_f1: 0.2270
 epoch: 22, train_loss: 1.3022, test_loss: 1.3141, test_f1: 0.2270
 epoch: 23, train_loss: 1.3043, test_loss: 1.3155, test_f1: 0.2270
 epoch: 24, train_loss: 1.3026, test_loss: 1.3157, test_f1: 0.2270
 epoch: 25, train_loss: 1.3025, test_loss: 1.3154, test_f1: 0.2270
 epoch: 26, train_loss: 1.3016, test_loss: 1.3146, test_f1: 0.2270
 epoch: 27, train_loss: 1.3026, test_loss: 1.3156, test_f1: 0.2270
 epoch: 28, train_loss: 1.3027, test_loss: 1.3140, test_f1: 0.2270
 epoch: 29, train_loss: 1.3017, test_loss: 1.3148, test_f1: 0.2270
 epoch: 30, train_loss: 1.3021, test_loss: 1.3145, test_f1: 0.2270
 epoch: 31, train_loss: 1.3023, test_loss: 1.3156, test_f1: 0.2270
 epoch: 32, train_loss: 1.3023, test_loss: 1.3147, test_f1: 0.2270
 epoch: 33, train_loss: 1.3023, test_loss: 1.3176, test_f1: 0.2270
 epoch: 34, train_loss: 1.3023, test_loss: 1.3149, test_f1: 0.2270
 epoch: 35, train_loss: 1.3019, test_loss: 1.3151, test_f1: 0.2270
 epoch: 36, train_loss: 1.3022, test_loss: 1.3150, test_f1: 0.2270
 epoch: 37, train_loss: 1.3016, test_loss: 1.3157, test_f1: 0.2270
 epoch: 38, train_loss: 1.3015, test_loss: 1.3150, test_f1: 0.2270
 epoch: 39, train_loss: 1.3018, test_loss: 1.3162, test_f1: 0.2270
 epoch: 40, train_loss: 1.3020, test_loss: 1.3164, test_f1: 0.2270
 epoch: 41, train_loss: 1.3021, test_loss: 1.3154, test_f1: 0.2270
 epoch: 42, train_loss: 1.3024, test_loss: 1.3148, test_f1: 0.2270
 epoch: 43, train_loss: 1.3024, test_loss: 1.3164, test_f1: 0.2270
 epoch: 44, train_loss: 1.3025, test_loss: 1.3145, test_f1: 0.2270
 epoch: 45, train_loss: 1.3016, test_loss: 1.3165, test_f1: 0.2270
 epoch: 46, train_loss: 1.3031, test_loss: 1.3161, test_f1: 0.2270
 epoch: 47, train_loss: 1.3021, test_loss: 1.3149, test_f1: 0.2270
 epoch: 48, train_loss: 1.3021, test_loss: 1.3156, test_f1: 0.2270
 epoch: 49, train_loss: 1.3033, test_loss: 1.3177, test_f1: 0.2270
 epoch: 50, train_loss: 1.3028, test_loss: 1.3148, test_f1: 0.2270
 epoch: 51, train_loss: 1.3017, test_loss: 1.3144, test_f1: 0.2270
 epoch: 52, train_loss: 1.3019, test_loss: 1.3156, test_f1: 0.2270
 epoch: 53, train_loss: 1.3017, test_loss: 1.3146, test_f1: 0.2270
 epoch: 54, train_loss: 1.3026, test_loss: 1.3152, test_f1: 0.2270
 epoch: 55, train_loss: 1.3015, test_loss: 1.3155, test_f1: 0.2270
 epoch: 56, train_loss: 1.3015, test_loss: 1.3149, test_f1: 0.2270
 epoch: 57, train_loss: 1.3022, test_loss: 1.3157, test_f1: 0.2270
 epoch: 58, train_loss: 1.3015, test_loss: 1.3151, test_f1: 0.2270
 epoch: 59, train_loss: 1.3024, test_loss: 1.3151, test_f1: 0.2270
 epoch: 60, train_loss: 1.3016, test_loss: 1.3150, test_f1: 0.2270
 epoch: 61, train_loss: 1.3015, test_loss: 1.3158, test_f1: 0.2270
 epoch: 62, train_loss: 1.3017, test_loss: 1.3147, test_f1: 0.2270
 epoch: 63, train_loss: 1.3015, test_loss: 1.3150, test_f1: 0.2270
 epoch: 64, train_loss: 1.3016, test_loss: 1.3157, test_f1: 0.2270
 epoch: 65, train_loss: 1.3014, test_loss: 1.3152, test_f1: 0.2270
 epoch: 66, train_loss: 1.3017, test_loss: 1.3153, test_f1: 0.2270
 epoch: 67, train_loss: 1.3013, test_loss: 1.3144, test_f1: 0.2270
 epoch: 68, train_loss: 1.3016, test_loss: 1.3149, test_f1: 0.2270
 epoch: 69, train_loss: 1.3016, test_loss: 1.3155, test_f1: 0.2270
 epoch: 70, train_loss: 1.3019, test_loss: 1.3147, test_f1: 0.2270
 epoch: 71, train_loss: 1.3014, test_loss: 1.3156, test_f1: 0.2270
 epoch: 72, train_loss: 1.3020, test_loss: 1.3159, test_f1: 0.2270
 epoch: 73, train_loss: 1.3018, test_loss: 1.3142, test_f1: 0.2270
 epoch: 74, train_loss: 1.3015, test_loss: 1.3156, test_f1: 0.2270
 epoch: 75, train_loss: 1.3016, test_loss: 1.3151, test_f1: 0.2270
 epoch: 76, train_loss: 1.3017, test_loss: 1.3154, test_f1: 0.2270
 epoch: 77, train_loss: 1.3015, test_loss: 1.3152, test_f1: 0.2270
 epoch: 78, train_loss: 1.3021, test_loss: 1.3158, test_f1: 0.2270
 epoch: 79, train_loss: 1.3021, test_loss: 1.3144, test_f1: 0.2270
 epoch: 80, train_loss: 1.3019, test_loss: 1.3162, test_f1: 0.2270
 epoch: 81, train_loss: 1.3021, test_loss: 1.3140, test_f1: 0.2270
 epoch: 82, train_loss: 1.3018, test_loss: 1.3152, test_f1: 0.2270
 epoch: 83, train_loss: 1.3016, test_loss: 1.3154, test_f1: 0.2270
 epoch: 84, train_loss: 1.3017, test_loss: 1.3146, test_f1: 0.2270
 epoch: 85, train_loss: 1.3019, test_loss: 1.3161, test_f1: 0.2270
 epoch: 86, train_loss: 1.3022, test_loss: 1.3146, test_f1: 0.2270
 epoch: 87, train_loss: 1.3014, test_loss: 1.3153, test_f1: 0.2270
 epoch: 88, train_loss: 1.3015, test_loss: 1.3158, test_f1: 0.2270
 epoch: 89, train_loss: 1.3018, test_loss: 1.3152, test_f1: 0.2270
 epoch: 90, train_loss: 1.3014, test_loss: 1.3147, test_f1: 0.2270
 epoch: 91, train_loss: 1.3016, test_loss: 1.3149, test_f1: 0.2270
 epoch: 92, train_loss: 1.3016, test_loss: 1.3139, test_f1: 0.2270
 epoch: 93, train_loss: 1.3017, test_loss: 1.3164, test_f1: 0.2270
 epoch: 94, train_loss: 1.3024, test_loss: 1.3148, test_f1: 0.2270
 epoch: 95, train_loss: 1.3023, test_loss: 1.3152, test_f1: 0.2270
 epoch: 96, train_loss: 1.3021, test_loss: 1.3146, test_f1: 0.2270
 epoch: 97, train_loss: 1.3019, test_loss: 1.3167, test_f1: 0.2270
 epoch: 98, train_loss: 1.3015, test_loss: 1.3146, test_f1: 0.2270
 epoch: 99, train_loss: 1.3014, test_loss: 1.3145, test_f1: 0.2270
##################ITERATION #2 ****************************************
 epoch: 0, train_loss: 1.3191, test_loss: 1.3286, test_f1: 0.2270
 epoch: 1, train_loss: 1.3045, test_loss: 1.3176, test_f1: 0.2270
 epoch: 2, train_loss: 1.3033, test_loss: 1.3140, test_f1: 0.2270
 epoch: 3, train_loss: 1.3022, test_loss: 1.3166, test_f1: 0.2270
 epoch: 4, train_loss: 1.3026, test_loss: 1.3146, test_f1: 0.2270
 epoch: 5, train_loss: 1.3014, test_loss: 1.3178, test_f1: 0.2270
 epoch: 6, train_loss: 1.3020, test_loss: 1.3142, test_f1: 0.2270
 epoch: 7, train_loss: 1.3023, test_loss: 1.3148, test_f1: 0.2270
 epoch: 8, train_loss: 1.3019, test_loss: 1.3154, test_f1: 0.2270
 epoch: 9, train_loss: 1.3021, test_loss: 1.3163, test_f1: 0.2270
 epoch: 10, train_loss: 1.3018, test_loss: 1.3137, test_f1: 0.2270
 epoch: 11, train_loss: 1.3025, test_loss: 1.3143, test_f1: 0.2270
 epoch: 12, train_loss: 1.3018, test_loss: 1.3153, test_f1: 0.2270
 epoch: 13, train_loss: 1.3017, test_loss: 1.3143, test_f1: 0.2270
 epoch: 14, train_loss: 1.3018, test_loss: 1.3158, test_f1: 0.2270
 epoch: 15, train_loss: 1.3017, test_loss: 1.3151, test_f1: 0.2270
 epoch: 16, train_loss: 1.3016, test_loss: 1.3149, test_f1: 0.2270
 epoch: 17, train_loss: 1.3027, test_loss: 1.3150, test_f1: 0.2270
 epoch: 18, train_loss: 1.3018, test_loss: 1.3144, test_f1: 0.2270
 epoch: 19, train_loss: 1.3022, test_loss: 1.3149, test_f1: 0.2270
 epoch: 20, train_loss: 1.3018, test_loss: 1.3152, test_f1: 0.2270
 epoch: 21, train_loss: 1.3021, test_loss: 1.3160, test_f1: 0.2270
 epoch: 22, train_loss: 1.3043, test_loss: 1.3140, test_f1: 0.2270
 epoch: 23, train_loss: 1.3044, test_loss: 1.3159, test_f1: 0.2270
 epoch: 24, train_loss: 1.3027, test_loss: 1.3147, test_f1: 0.2270
 epoch: 25, train_loss: 1.3017, test_loss: 1.3154, test_f1: 0.2270
 epoch: 26, train_loss: 1.3017, test_loss: 1.3145, test_f1: 0.2270
 epoch: 27, train_loss: 1.3018, test_loss: 1.3153, test_f1: 0.2270
 epoch: 28, train_loss: 1.3015, test_loss: 1.3149, test_f1: 0.2270
 epoch: 29, train_loss: 1.3018, test_loss: 1.3155, test_f1: 0.2270
 epoch: 30, train_loss: 1.3018, test_loss: 1.3158, test_f1: 0.2270
 epoch: 31, train_loss: 1.3018, test_loss: 1.3144, test_f1: 0.2270
 epoch: 32, train_loss: 1.3022, test_loss: 1.3147, test_f1: 0.2270
 epoch: 33, train_loss: 1.3026, test_loss: 1.3150, test_f1: 0.2270
 epoch: 34, train_loss: 1.3027, test_loss: 1.3154, test_f1: 0.2270
 epoch: 35, train_loss: 1.3016, test_loss: 1.3143, test_f1: 0.2270
 epoch: 36, train_loss: 1.3018, test_loss: 1.3154, test_f1: 0.2270
 epoch: 37, train_loss: 1.3017, test_loss: 1.3152, test_f1: 0.2270
 epoch: 38, train_loss: 1.3023, test_loss: 1.3156, test_f1: 0.2270
 epoch: 39, train_loss: 1.3029, test_loss: 1.3157, test_f1: 0.2270
 epoch: 40, train_loss: 1.3022, test_loss: 1.3146, test_f1: 0.2270
 epoch: 41, train_loss: 1.3023, test_loss: 1.3154, test_f1: 0.2270
 epoch: 42, train_loss: 1.3026, test_loss: 1.3144, test_f1: 0.2270
 epoch: 43, train_loss: 1.3022, test_loss: 1.3149, test_f1: 0.2270
 epoch: 44, train_loss: 1.3023, test_loss: 1.3149, test_f1: 0.2270
 epoch: 45, train_loss: 1.3020, test_loss: 1.3153, test_f1: 0.2270
 epoch: 46, train_loss: 1.3018, test_loss: 1.3151, test_f1: 0.2270
 epoch: 47, train_loss: 1.3024, test_loss: 1.3152, test_f1: 0.2270
 epoch: 48, train_loss: 1.3026, test_loss: 1.3161, test_f1: 0.2270
 epoch: 49, train_loss: 1.3025, test_loss: 1.3138, test_f1: 0.2270
 epoch: 50, train_loss: 1.3018, test_loss: 1.3154, test_f1: 0.2270
 epoch: 51, train_loss: 1.3017, test_loss: 1.3161, test_f1: 0.2270
 epoch: 52, train_loss: 1.3015, test_loss: 1.3141, test_f1: 0.2270
 epoch: 53, train_loss: 1.3020, test_loss: 1.3163, test_f1: 0.2270
 epoch: 54, train_loss: 1.3017, test_loss: 1.3146, test_f1: 0.2270
 epoch: 55, train_loss: 1.3017, test_loss: 1.3150, test_f1: 0.2270
 epoch: 56, train_loss: 1.3014, test_loss: 1.3157, test_f1: 0.2270
 epoch: 57, train_loss: 1.3014, test_loss: 1.3152, test_f1: 0.2270
 epoch: 58, train_loss: 1.3015, test_loss: 1.3155, test_f1: 0.2270
 epoch: 59, train_loss: 1.3020, test_loss: 1.3140, test_f1: 0.2270
 epoch: 60, train_loss: 1.3017, test_loss: 1.3162, test_f1: 0.2270
 epoch: 61, train_loss: 1.3015, test_loss: 1.3158, test_f1: 0.2270
 epoch: 62, train_loss: 1.3015, test_loss: 1.3148, test_f1: 0.2270
 epoch: 63, train_loss: 1.3015, test_loss: 1.3149, test_f1: 0.2270
 epoch: 64, train_loss: 1.3016, test_loss: 1.3148, test_f1: 0.2270
 epoch: 65, train_loss: 1.3017, test_loss: 1.3164, test_f1: 0.2270
 epoch: 66, train_loss: 1.3019, test_loss: 1.3143, test_f1: 0.2270
 epoch: 67, train_loss: 1.3013, test_loss: 1.3155, test_f1: 0.2270
 epoch: 68, train_loss: 1.3016, test_loss: 1.3157, test_f1: 0.2270
 epoch: 69, train_loss: 1.3016, test_loss: 1.3146, test_f1: 0.2270
 epoch: 70, train_loss: 1.3018, test_loss: 1.3156, test_f1: 0.2270
 epoch: 71, train_loss: 1.3015, test_loss: 1.3142, test_f1: 0.2270
 epoch: 72, train_loss: 1.3022, test_loss: 1.3163, test_f1: 0.2270
 epoch: 73, train_loss: 1.3014, test_loss: 1.3143, test_f1: 0.2270
 epoch: 74, train_loss: 1.3015, test_loss: 1.3149, test_f1: 0.2270
 epoch: 75, train_loss: 1.3014, test_loss: 1.3147, test_f1: 0.2270
 epoch: 76, train_loss: 1.3015, test_loss: 1.3158, test_f1: 0.2270
 epoch: 77, train_loss: 1.3021, test_loss: 1.3150, test_f1: 0.2270
 epoch: 78, train_loss: 1.3014, test_loss: 1.3148, test_f1: 0.2270
 epoch: 79, train_loss: 1.3019, test_loss: 1.3152, test_f1: 0.2270
 epoch: 80, train_loss: 1.3014, test_loss: 1.3153, test_f1: 0.2270
 epoch: 81, train_loss: 1.3016, test_loss: 1.3147, test_f1: 0.2270
 epoch: 82, train_loss: 1.3024, test_loss: 1.3155, test_f1: 0.2270
 epoch: 83, train_loss: 1.3015, test_loss: 1.3159, test_f1: 0.2270
 epoch: 84, train_loss: 1.3016, test_loss: 1.3145, test_f1: 0.2270
 epoch: 85, train_loss: 1.3016, test_loss: 1.3157, test_f1: 0.2270
 epoch: 86, train_loss: 1.3020, test_loss: 1.3154, test_f1: 0.2270
 epoch: 87, train_loss: 1.3018, test_loss: 1.3156, test_f1: 0.2270
 epoch: 88, train_loss: 1.3021, test_loss: 1.3155, test_f1: 0.2270
 epoch: 89, train_loss: 1.3019, test_loss: 1.3144, test_f1: 0.2270
 epoch: 90, train_loss: 1.3016, test_loss: 1.3150, test_f1: 0.2270
 epoch: 91, train_loss: 1.3014, test_loss: 1.3152, test_f1: 0.2270
 epoch: 92, train_loss: 1.3019, test_loss: 1.3148, test_f1: 0.2270
 epoch: 93, train_loss: 1.3019, test_loss: 1.3158, test_f1: 0.2270
 epoch: 94, train_loss: 1.3015, test_loss: 1.3152, test_f1: 0.2270
 epoch: 95, train_loss: 1.3015, test_loss: 1.3148, test_f1: 0.2270
 epoch: 96, train_loss: 1.3013, test_loss: 1.3155, test_f1: 0.2270
 epoch: 97, train_loss: 1.3015, test_loss: 1.3150, test_f1: 0.2270
 epoch: 98, train_loss: 1.3019, test_loss: 1.3154, test_f1: 0.2270
 epoch: 99, train_loss: 1.3018, test_loss: 1.3145, test_f1: 0.2270
##################ITERATION #3 ****************************************
 epoch: 0, train_loss: 1.3074, test_loss: 1.3174, test_f1: 0.2270
 epoch: 1, train_loss: 1.3039, test_loss: 1.3155, test_f1: 0.2270
 epoch: 2, train_loss: 1.3021, test_loss: 1.3162, test_f1: 0.2270
 epoch: 3, train_loss: 1.3029, test_loss: 1.3138, test_f1: 0.2270
 epoch: 4, train_loss: 1.3027, test_loss: 1.3158, test_f1: 0.2270
 epoch: 5, train_loss: 1.3028, test_loss: 1.3144, test_f1: 0.2270
 epoch: 6, train_loss: 1.3018, test_loss: 1.3167, test_f1: 0.2270
 epoch: 7, train_loss: 1.3025, test_loss: 1.3163, test_f1: 0.2270
 epoch: 8, train_loss: 1.3019, test_loss: 1.3158, test_f1: 0.2270
 epoch: 9, train_loss: 1.3020, test_loss: 1.3141, test_f1: 0.2270
 epoch: 10, train_loss: 1.3018, test_loss: 1.3158, test_f1: 0.2270
 epoch: 11, train_loss: 1.3021, test_loss: 1.3156, test_f1: 0.2270
 epoch: 12, train_loss: 1.3020, test_loss: 1.3143, test_f1: 0.2270
 epoch: 13, train_loss: 1.3023, test_loss: 1.3158, test_f1: 0.2270
 epoch: 14, train_loss: 1.3016, test_loss: 1.3149, test_f1: 0.2270
 epoch: 15, train_loss: 1.3021, test_loss: 1.3158, test_f1: 0.2270
 epoch: 16, train_loss: 1.3022, test_loss: 1.3147, test_f1: 0.2270
 epoch: 17, train_loss: 1.3037, test_loss: 1.3148, test_f1: 0.2270
 epoch: 18, train_loss: 1.3033, test_loss: 1.3157, test_f1: 0.2270
 epoch: 19, train_loss: 1.3027, test_loss: 1.3139, test_f1: 0.2270
 epoch: 20, train_loss: 1.3031, test_loss: 1.3154, test_f1: 0.2270
 epoch: 21, train_loss: 1.3015, test_loss: 1.3152, test_f1: 0.2270
 epoch: 22, train_loss: 1.3018, test_loss: 1.3156, test_f1: 0.2270
 epoch: 23, train_loss: 1.3015, test_loss: 1.3152, test_f1: 0.2270
 epoch: 24, train_loss: 1.3025, test_loss: 1.3162, test_f1: 0.2270
 epoch: 25, train_loss: 1.3024, test_loss: 1.3142, test_f1: 0.2270
 epoch: 26, train_loss: 1.3018, test_loss: 1.3163, test_f1: 0.2270
 epoch: 27, train_loss: 1.3031, test_loss: 1.3152, test_f1: 0.2270
 epoch: 28, train_loss: 1.3026, test_loss: 1.3142, test_f1: 0.2270
 epoch: 29, train_loss: 1.3026, test_loss: 1.3156, test_f1: 0.2270
 epoch: 30, train_loss: 1.3018, test_loss: 1.3150, test_f1: 0.2270
 epoch: 31, train_loss: 1.3032, test_loss: 1.3163, test_f1: 0.2270
 epoch: 32, train_loss: 1.3021, test_loss: 1.3151, test_f1: 0.2270
 epoch: 33, train_loss: 1.3021, test_loss: 1.3160, test_f1: 0.2270
 epoch: 34, train_loss: 1.3026, test_loss: 1.3150, test_f1: 0.2270
 epoch: 35, train_loss: 1.3017, test_loss: 1.3157, test_f1: 0.2270
 epoch: 36, train_loss: 1.3020, test_loss: 1.3160, test_f1: 0.2270
 epoch: 37, train_loss: 1.3016, test_loss: 1.3146, test_f1: 0.2270
 epoch: 38, train_loss: 1.3031, test_loss: 1.3146, test_f1: 0.2270
 epoch: 39, train_loss: 1.3019, test_loss: 1.3158, test_f1: 0.2270
 epoch: 40, train_loss: 1.3024, test_loss: 1.3150, test_f1: 0.2270
 epoch: 41, train_loss: 1.3022, test_loss: 1.3148, test_f1: 0.2270
 epoch: 42, train_loss: 1.3022, test_loss: 1.3153, test_f1: 0.2270
 epoch: 43, train_loss: 1.3024, test_loss: 1.3146, test_f1: 0.2270
 epoch: 44, train_loss: 1.3027, test_loss: 1.3147, test_f1: 0.2270
 epoch: 45, train_loss: 1.3021, test_loss: 1.3147, test_f1: 0.2270
 epoch: 46, train_loss: 1.3023, test_loss: 1.3160, test_f1: 0.2270
 epoch: 47, train_loss: 1.3019, test_loss: 1.3140, test_f1: 0.2270
 epoch: 48, train_loss: 1.3015, test_loss: 1.3172, test_f1: 0.2270
 epoch: 49, train_loss: 1.3022, test_loss: 1.3147, test_f1: 0.2270
 epoch: 50, train_loss: 1.3017, test_loss: 1.3153, test_f1: 0.2270
 epoch: 51, train_loss: 1.3015, test_loss: 1.3158, test_f1: 0.2270
 epoch: 52, train_loss: 1.3019, test_loss: 1.3147, test_f1: 0.2270
 epoch: 53, train_loss: 1.3020, test_loss: 1.3154, test_f1: 0.2270
 epoch: 54, train_loss: 1.3017, test_loss: 1.3157, test_f1: 0.2270
 epoch: 55, train_loss: 1.3022, test_loss: 1.3156, test_f1: 0.2270
 epoch: 56, train_loss: 1.3019, test_loss: 1.3143, test_f1: 0.2270
 epoch: 57, train_loss: 1.3013, test_loss: 1.3162, test_f1: 0.2270
 epoch: 58, train_loss: 1.3015, test_loss: 1.3148, test_f1: 0.2270
 epoch: 59, train_loss: 1.3017, test_loss: 1.3151, test_f1: 0.2270
 epoch: 60, train_loss: 1.3015, test_loss: 1.3153, test_f1: 0.2270
 epoch: 61, train_loss: 1.3016, test_loss: 1.3145, test_f1: 0.2270
 epoch: 62, train_loss: 1.3017, test_loss: 1.3151, test_f1: 0.2270
 epoch: 63, train_loss: 1.3017, test_loss: 1.3152, test_f1: 0.2270
 epoch: 64, train_loss: 1.3013, test_loss: 1.3148, test_f1: 0.2270
 epoch: 65, train_loss: 1.3017, test_loss: 1.3146, test_f1: 0.2270
 epoch: 66, train_loss: 1.3017, test_loss: 1.3141, test_f1: 0.2270
 epoch: 67, train_loss: 1.3020, test_loss: 1.3153, test_f1: 0.2270
 epoch: 68, train_loss: 1.3022, test_loss: 1.3148, test_f1: 0.2270
 epoch: 69, train_loss: 1.3018, test_loss: 1.3148, test_f1: 0.2270
 epoch: 70, train_loss: 1.3014, test_loss: 1.3155, test_f1: 0.2270
 epoch: 71, train_loss: 1.3019, test_loss: 1.3151, test_f1: 0.2270
 epoch: 72, train_loss: 1.3015, test_loss: 1.3152, test_f1: 0.2270
 epoch: 73, train_loss: 1.3020, test_loss: 1.3147, test_f1: 0.2270
 epoch: 74, train_loss: 1.3018, test_loss: 1.3153, test_f1: 0.2270
 epoch: 75, train_loss: 1.3024, test_loss: 1.3161, test_f1: 0.2270
 epoch: 76, train_loss: 1.3020, test_loss: 1.3145, test_f1: 0.2270
 epoch: 77, train_loss: 1.3014, test_loss: 1.3156, test_f1: 0.2270
 epoch: 78, train_loss: 1.3018, test_loss: 1.3163, test_f1: 0.2270
 epoch: 79, train_loss: 1.3015, test_loss: 1.3144, test_f1: 0.2270
 epoch: 80, train_loss: 1.3017, test_loss: 1.3151, test_f1: 0.2270
 epoch: 81, train_loss: 1.3022, test_loss: 1.3145, test_f1: 0.2270
 epoch: 82, train_loss: 1.3017, test_loss: 1.3166, test_f1: 0.2270
 epoch: 83, train_loss: 1.3019, test_loss: 1.3144, test_f1: 0.2270
 epoch: 84, train_loss: 1.3017, test_loss: 1.3157, test_f1: 0.2270
 epoch: 85, train_loss: 1.3015, test_loss: 1.3150, test_f1: 0.2270
 epoch: 86, train_loss: 1.3016, test_loss: 1.3153, test_f1: 0.2270
 epoch: 87, train_loss: 1.3016, test_loss: 1.3145, test_f1: 0.2270
 epoch: 88, train_loss: 1.3017, test_loss: 1.3156, test_f1: 0.2270
 epoch: 89, train_loss: 1.3019, test_loss: 1.3152, test_f1: 0.2270
 epoch: 90, train_loss: 1.3014, test_loss: 1.3144, test_f1: 0.2270
 epoch: 91, train_loss: 1.3018, test_loss: 1.3153, test_f1: 0.2270
 epoch: 92, train_loss: 1.3021, test_loss: 1.3145, test_f1: 0.2270
 epoch: 93, train_loss: 1.3018, test_loss: 1.3157, test_f1: 0.2270
 epoch: 94, train_loss: 1.3016, test_loss: 1.3144, test_f1: 0.2270
 epoch: 95, train_loss: 1.3017, test_loss: 1.3158, test_f1: 0.2270
 epoch: 96, train_loss: 1.3018, test_loss: 1.3147, test_f1: 0.2270
 epoch: 97, train_loss: 1.3015, test_loss: 1.3149, test_f1: 0.2270
 epoch: 98, train_loss: 1.3014, test_loss: 1.3157, test_f1: 0.2270
 epoch: 99, train_loss: 1.3015, test_loss: 1.3149, test_f1: 0.2270
##################ITERATION #4 ****************************************
 epoch: 0, train_loss: 1.3091, test_loss: 1.3222, test_f1: 0.2270
 epoch: 1, train_loss: 1.3040, test_loss: 1.3148, test_f1: 0.2270
 epoch: 2, train_loss: 1.3024, test_loss: 1.3158, test_f1: 0.2270
 epoch: 3, train_loss: 1.3017, test_loss: 1.3163, test_f1: 0.2270
 epoch: 4, train_loss: 1.3017, test_loss: 1.3139, test_f1: 0.2270
 epoch: 5, train_loss: 1.3019, test_loss: 1.3157, test_f1: 0.2270
 epoch: 6, train_loss: 1.3024, test_loss: 1.3160, test_f1: 0.2270
 epoch: 7, train_loss: 1.3027, test_loss: 1.3141, test_f1: 0.2270
 epoch: 8, train_loss: 1.3013, test_loss: 1.3167, test_f1: 0.2270
 epoch: 9, train_loss: 1.3025, test_loss: 1.3146, test_f1: 0.2270
 epoch: 10, train_loss: 1.3028, test_loss: 1.3155, test_f1: 0.2270
 epoch: 11, train_loss: 1.3023, test_loss: 1.3150, test_f1: 0.2270
 epoch: 12, train_loss: 1.3014, test_loss: 1.3156, test_f1: 0.2270
 epoch: 13, train_loss: 1.3023, test_loss: 1.3145, test_f1: 0.2270
 epoch: 14, train_loss: 1.3041, test_loss: 1.3151, test_f1: 0.2270
 epoch: 15, train_loss: 1.3023, test_loss: 1.3163, test_f1: 0.2270
 epoch: 16, train_loss: 1.3022, test_loss: 1.3157, test_f1: 0.2270
 epoch: 17, train_loss: 1.3036, test_loss: 1.3146, test_f1: 0.2270
 epoch: 18, train_loss: 1.3023, test_loss: 1.3157, test_f1: 0.2270
 epoch: 19, train_loss: 1.3018, test_loss: 1.3157, test_f1: 0.2270
 epoch: 20, train_loss: 1.3017, test_loss: 1.3157, test_f1: 0.2270
 epoch: 21, train_loss: 1.3026, test_loss: 1.3163, test_f1: 0.2270
 epoch: 22, train_loss: 1.3023, test_loss: 1.3140, test_f1: 0.2270
 epoch: 23, train_loss: 1.3024, test_loss: 1.3163, test_f1: 0.2270
 epoch: 24, train_loss: 1.3019, test_loss: 1.3142, test_f1: 0.2270
 epoch: 25, train_loss: 1.3025, test_loss: 1.3162, test_f1: 0.2270
 epoch: 26, train_loss: 1.3024, test_loss: 1.3150, test_f1: 0.2270
 epoch: 27, train_loss: 1.3016, test_loss: 1.3144, test_f1: 0.2270
 epoch: 28, train_loss: 1.3020, test_loss: 1.3153, test_f1: 0.2270
 epoch: 29, train_loss: 1.3019, test_loss: 1.3156, test_f1: 0.2270
 epoch: 30, train_loss: 1.3019, test_loss: 1.3152, test_f1: 0.2270
 epoch: 31, train_loss: 1.3025, test_loss: 1.3143, test_f1: 0.2270
 epoch: 32, train_loss: 1.3022, test_loss: 1.3147, test_f1: 0.2270
 epoch: 33, train_loss: 1.3020, test_loss: 1.3147, test_f1: 0.2270
 epoch: 34, train_loss: 1.3016, test_loss: 1.3154, test_f1: 0.2270
 epoch: 35, train_loss: 1.3019, test_loss: 1.3154, test_f1: 0.2270
 epoch: 36, train_loss: 1.3020, test_loss: 1.3154, test_f1: 0.2270
 epoch: 37, train_loss: 1.3017, test_loss: 1.3141, test_f1: 0.2270
 epoch: 38, train_loss: 1.3017, test_loss: 1.3154, test_f1: 0.2270
 epoch: 39, train_loss: 1.3023, test_loss: 1.3139, test_f1: 0.2270
 epoch: 40, train_loss: 1.3018, test_loss: 1.3163, test_f1: 0.2270
 epoch: 41, train_loss: 1.3026, test_loss: 1.3160, test_f1: 0.2270
 epoch: 42, train_loss: 1.3019, test_loss: 1.3147, test_f1: 0.2270
 epoch: 43, train_loss: 1.3032, test_loss: 1.3141, test_f1: 0.2270
 epoch: 44, train_loss: 1.3020, test_loss: 1.3153, test_f1: 0.2270
 epoch: 45, train_loss: 1.3018, test_loss: 1.3152, test_f1: 0.2270
 epoch: 46, train_loss: 1.3021, test_loss: 1.3158, test_f1: 0.2270
 epoch: 47, train_loss: 1.3033, test_loss: 1.3145, test_f1: 0.2270
 epoch: 48, train_loss: 1.3020, test_loss: 1.3149, test_f1: 0.2270
 epoch: 49, train_loss: 1.3020, test_loss: 1.3144, test_f1: 0.2270
 epoch: 50, train_loss: 1.3019, test_loss: 1.3157, test_f1: 0.2270
 epoch: 51, train_loss: 1.3020, test_loss: 1.3153, test_f1: 0.2270
 epoch: 52, train_loss: 1.3017, test_loss: 1.3150, test_f1: 0.2270
 epoch: 53, train_loss: 1.3013, test_loss: 1.3146, test_f1: 0.2270
 epoch: 54, train_loss: 1.3018, test_loss: 1.3152, test_f1: 0.2270
 epoch: 55, train_loss: 1.3014, test_loss: 1.3153, test_f1: 0.2270
 epoch: 56, train_loss: 1.3016, test_loss: 1.3148, test_f1: 0.2270
 epoch: 57, train_loss: 1.3014, test_loss: 1.3160, test_f1: 0.2270
 epoch: 58, train_loss: 1.3017, test_loss: 1.3143, test_f1: 0.2270
 epoch: 59, train_loss: 1.3021, test_loss: 1.3151, test_f1: 0.2270
 epoch: 60, train_loss: 1.3023, test_loss: 1.3151, test_f1: 0.2270
 epoch: 61, train_loss: 1.3018, test_loss: 1.3147, test_f1: 0.2270
 epoch: 62, train_loss: 1.3014, test_loss: 1.3154, test_f1: 0.2270
 epoch: 63, train_loss: 1.3017, test_loss: 1.3151, test_f1: 0.2270
 epoch: 64, train_loss: 1.3017, test_loss: 1.3149, test_f1: 0.2270
 epoch: 65, train_loss: 1.3017, test_loss: 1.3157, test_f1: 0.2270
 epoch: 66, train_loss: 1.3019, test_loss: 1.3139, test_f1: 0.2270
 epoch: 67, train_loss: 1.3020, test_loss: 1.3159, test_f1: 0.2270
 epoch: 68, train_loss: 1.3018, test_loss: 1.3144, test_f1: 0.2270
 epoch: 69, train_loss: 1.3022, test_loss: 1.3164, test_f1: 0.2270
 epoch: 70, train_loss: 1.3016, test_loss: 1.3146, test_f1: 0.2270
 epoch: 71, train_loss: 1.3016, test_loss: 1.3145, test_f1: 0.2270
 epoch: 72, train_loss: 1.3018, test_loss: 1.3160, test_f1: 0.2270
 epoch: 73, train_loss: 1.3020, test_loss: 1.3142, test_f1: 0.2270
 epoch: 74, train_loss: 1.3017, test_loss: 1.3164, test_f1: 0.2270
 epoch: 75, train_loss: 1.3022, test_loss: 1.3142, test_f1: 0.2270
 epoch: 76, train_loss: 1.3015, test_loss: 1.3162, test_f1: 0.2270
 epoch: 77, train_loss: 1.3016, test_loss: 1.3150, test_f1: 0.2270
 epoch: 78, train_loss: 1.3017, test_loss: 1.3154, test_f1: 0.2270
 epoch: 79, train_loss: 1.3017, test_loss: 1.3143, test_f1: 0.2270
 epoch: 80, train_loss: 1.3017, test_loss: 1.3157, test_f1: 0.2270
 epoch: 81, train_loss: 1.3015, test_loss: 1.3158, test_f1: 0.2270
 epoch: 82, train_loss: 1.3015, test_loss: 1.3146, test_f1: 0.2270
 epoch: 83, train_loss: 1.3021, test_loss: 1.3153, test_f1: 0.2270
 epoch: 84, train_loss: 1.3017, test_loss: 1.3146, test_f1: 0.2270
 epoch: 85, train_loss: 1.3015, test_loss: 1.3154, test_f1: 0.2270
 epoch: 86, train_loss: 1.3019, test_loss: 1.3143, test_f1: 0.2270
 epoch: 87, train_loss: 1.3020, test_loss: 1.3166, test_f1: 0.2270
 epoch: 88, train_loss: 1.3016, test_loss: 1.3153, test_f1: 0.2270
 epoch: 89, train_loss: 1.3017, test_loss: 1.3146, test_f1: 0.2270
 epoch: 90, train_loss: 1.3018, test_loss: 1.3152, test_f1: 0.2270
 epoch: 91, train_loss: 1.3016, test_loss: 1.3151, test_f1: 0.2270
 epoch: 92, train_loss: 1.3017, test_loss: 1.3156, test_f1: 0.2270
 epoch: 93, train_loss: 1.3022, test_loss: 1.3145, test_f1: 0.2270
 epoch: 94, train_loss: 1.3019, test_loss: 1.3144, test_f1: 0.2270
 epoch: 95, train_loss: 1.3016, test_loss: 1.3171, test_f1: 0.2270
 epoch: 96, train_loss: 1.3017, test_loss: 1.3145, test_f1: 0.2270
 epoch: 97, train_loss: 1.3016, test_loss: 1.3149, test_f1: 0.2270
 epoch: 98, train_loss: 1.3016, test_loss: 1.3156, test_f1: 0.2270
 epoch: 99, train_loss: 1.3018, test_loss: 1.3145, test_f1: 0.2270
##################ITERATION #5 ****************************************
 epoch: 0, train_loss: 1.3041, test_loss: 1.3179, test_f1: 0.2270
 epoch: 1, train_loss: 1.3025, test_loss: 1.3152, test_f1: 0.2270
 epoch: 2, train_loss: 1.3032, test_loss: 1.3152, test_f1: 0.2270
 epoch: 3, train_loss: 1.3025, test_loss: 1.3151, test_f1: 0.2270
 epoch: 4, train_loss: 1.3015, test_loss: 1.3161, test_f1: 0.2270
 epoch: 5, train_loss: 1.3020, test_loss: 1.3151, test_f1: 0.2270
 epoch: 6, train_loss: 1.3018, test_loss: 1.3157, test_f1: 0.2270
 epoch: 7, train_loss: 1.3025, test_loss: 1.3155, test_f1: 0.2270
 epoch: 8, train_loss: 1.3033, test_loss: 1.3146, test_f1: 0.2270
 epoch: 9, train_loss: 1.3031, test_loss: 1.3160, test_f1: 0.2270
 epoch: 10, train_loss: 1.3030, test_loss: 1.3150, test_f1: 0.2270
 epoch: 11, train_loss: 1.3018, test_loss: 1.3154, test_f1: 0.2270
 epoch: 12, train_loss: 1.3018, test_loss: 1.3153, test_f1: 0.2270
 epoch: 13, train_loss: 1.3019, test_loss: 1.3153, test_f1: 0.2270
 epoch: 14, train_loss: 1.3026, test_loss: 1.3153, test_f1: 0.2270
 epoch: 15, train_loss: 1.3019, test_loss: 1.3139, test_f1: 0.2270
 epoch: 16, train_loss: 1.3016, test_loss: 1.3161, test_f1: 0.2270
 epoch: 17, train_loss: 1.3026, test_loss: 1.3160, test_f1: 0.2270
 epoch: 18, train_loss: 1.3031, test_loss: 1.3166, test_f1: 0.2270
 epoch: 19, train_loss: 1.3039, test_loss: 1.3148, test_f1: 0.2270
 epoch: 20, train_loss: 1.3038, test_loss: 1.3160, test_f1: 0.2270
 epoch: 21, train_loss: 1.3021, test_loss: 1.3155, test_f1: 0.2270
 epoch: 22, train_loss: 1.3019, test_loss: 1.3150, test_f1: 0.2270
 epoch: 23, train_loss: 1.3024, test_loss: 1.3146, test_f1: 0.2270
 epoch: 24, train_loss: 1.3022, test_loss: 1.3153, test_f1: 0.2270
 epoch: 25, train_loss: 1.3020, test_loss: 1.3148, test_f1: 0.2270
 epoch: 26, train_loss: 1.3097, test_loss: 1.3148, test_f1: 0.2270
 epoch: 27, train_loss: 1.3029, test_loss: 1.3160, test_f1: 0.2270
 epoch: 28, train_loss: 1.3015, test_loss: 1.3141, test_f1: 0.2270
 epoch: 29, train_loss: 1.3024, test_loss: 1.3148, test_f1: 0.2270
 epoch: 30, train_loss: 1.3021, test_loss: 1.3153, test_f1: 0.2270
 epoch: 31, train_loss: 1.3024, test_loss: 1.3161, test_f1: 0.2270
 epoch: 32, train_loss: 1.3016, test_loss: 1.3142, test_f1: 0.2270
 epoch: 33, train_loss: 1.3023, test_loss: 1.3145, test_f1: 0.2270
 epoch: 34, train_loss: 1.3023, test_loss: 1.3173, test_f1: 0.2270
 epoch: 35, train_loss: 1.3023, test_loss: 1.3143, test_f1: 0.2270
 epoch: 36, train_loss: 1.3021, test_loss: 1.3164, test_f1: 0.2270
 epoch: 37, train_loss: 1.3014, test_loss: 1.3156, test_f1: 0.2270
 epoch: 38, train_loss: 1.3017, test_loss: 1.3151, test_f1: 0.2270
 epoch: 39, train_loss: 1.3018, test_loss: 1.3154, test_f1: 0.2270
 epoch: 40, train_loss: 1.3024, test_loss: 1.3140, test_f1: 0.2270
 epoch: 41, train_loss: 1.3020, test_loss: 1.3150, test_f1: 0.2270
 epoch: 42, train_loss: 1.3022, test_loss: 1.3142, test_f1: 0.2270
 epoch: 43, train_loss: 1.3025, test_loss: 1.3173, test_f1: 0.2270
 epoch: 44, train_loss: 1.3023, test_loss: 1.3148, test_f1: 0.2270
 epoch: 45, train_loss: 1.3019, test_loss: 1.3176, test_f1: 0.2270
 epoch: 46, train_loss: 1.3020, test_loss: 1.3140, test_f1: 0.2270
 epoch: 47, train_loss: 1.3017, test_loss: 1.3160, test_f1: 0.2270
 epoch: 48, train_loss: 1.3027, test_loss: 1.3148, test_f1: 0.2270
 epoch: 49, train_loss: 1.3018, test_loss: 1.3178, test_f1: 0.2270
 epoch: 50, train_loss: 1.3023, test_loss: 1.3160, test_f1: 0.2270
 epoch: 51, train_loss: 1.3019, test_loss: 1.3143, test_f1: 0.2270
 epoch: 52, train_loss: 1.3017, test_loss: 1.3155, test_f1: 0.2270
 epoch: 53, train_loss: 1.3015, test_loss: 1.3145, test_f1: 0.2270
 epoch: 54, train_loss: 1.3015, test_loss: 1.3152, test_f1: 0.2270
 epoch: 55, train_loss: 1.3016, test_loss: 1.3157, test_f1: 0.2270
 epoch: 56, train_loss: 1.3017, test_loss: 1.3148, test_f1: 0.2270
 epoch: 57, train_loss: 1.3015, test_loss: 1.3153, test_f1: 0.2270
 epoch: 58, train_loss: 1.3020, test_loss: 1.3147, test_f1: 0.2270
 epoch: 59, train_loss: 1.3019, test_loss: 1.3168, test_f1: 0.2270
 epoch: 60, train_loss: 1.3016, test_loss: 1.3142, test_f1: 0.2270
 epoch: 61, train_loss: 1.3017, test_loss: 1.3159, test_f1: 0.2270
 epoch: 62, train_loss: 1.3015, test_loss: 1.3153, test_f1: 0.2270
 epoch: 63, train_loss: 1.3014, test_loss: 1.3149, test_f1: 0.2270
 epoch: 64, train_loss: 1.3024, test_loss: 1.3145, test_f1: 0.2270
 epoch: 65, train_loss: 1.3013, test_loss: 1.3170, test_f1: 0.2270
 epoch: 66, train_loss: 1.3015, test_loss: 1.3150, test_f1: 0.2270
 epoch: 67, train_loss: 1.3016, test_loss: 1.3145, test_f1: 0.2270
 epoch: 68, train_loss: 1.3014, test_loss: 1.3156, test_f1: 0.2270
 epoch: 69, train_loss: 1.3015, test_loss: 1.3148, test_f1: 0.2270
 epoch: 70, train_loss: 1.3015, test_loss: 1.3152, test_f1: 0.2270
 epoch: 71, train_loss: 1.3017, test_loss: 1.3152, test_f1: 0.2270
 epoch: 72, train_loss: 1.3016, test_loss: 1.3143, test_f1: 0.2270
 epoch: 73, train_loss: 1.3016, test_loss: 1.3158, test_f1: 0.2270
 epoch: 74, train_loss: 1.3014, test_loss: 1.3153, test_f1: 0.2270
 epoch: 75, train_loss: 1.3014, test_loss: 1.3147, test_f1: 0.2270
 epoch: 76, train_loss: 1.3014, test_loss: 1.3148, test_f1: 0.2270
 epoch: 77, train_loss: 1.3015, test_loss: 1.3157, test_f1: 0.2270
 epoch: 78, train_loss: 1.3020, test_loss: 1.3144, test_f1: 0.2270
 epoch: 79, train_loss: 1.3017, test_loss: 1.3154, test_f1: 0.2270
 epoch: 80, train_loss: 1.3018, test_loss: 1.3147, test_f1: 0.2270
 epoch: 81, train_loss: 1.3020, test_loss: 1.3147, test_f1: 0.2270
 epoch: 82, train_loss: 1.3019, test_loss: 1.3158, test_f1: 0.2270
 epoch: 83, train_loss: 1.3016, test_loss: 1.3144, test_f1: 0.2270
 epoch: 84, train_loss: 1.3019, test_loss: 1.3145, test_f1: 0.2270
 epoch: 85, train_loss: 1.3013, test_loss: 1.3162, test_f1: 0.2270
 epoch: 86, train_loss: 1.3016, test_loss: 1.3155, test_f1: 0.2270
 epoch: 87, train_loss: 1.3018, test_loss: 1.3149, test_f1: 0.2270
 epoch: 88, train_loss: 1.3013, test_loss: 1.3153, test_f1: 0.2270
 epoch: 89, train_loss: 1.3017, test_loss: 1.3153, test_f1: 0.2270
 epoch: 90, train_loss: 1.3014, test_loss: 1.3147, test_f1: 0.2270
 epoch: 91, train_loss: 1.3016, test_loss: 1.3153, test_f1: 0.2270
 epoch: 92, train_loss: 1.3019, test_loss: 1.3145, test_f1: 0.2270
 epoch: 93, train_loss: 1.3014, test_loss: 1.3160, test_f1: 0.2270
 epoch: 94, train_loss: 1.3016, test_loss: 1.3150, test_f1: 0.2270
 epoch: 95, train_loss: 1.3019, test_loss: 1.3147, test_f1: 0.2270
 epoch: 96, train_loss: 1.3016, test_loss: 1.3155, test_f1: 0.2270
 epoch: 97, train_loss: 1.3018, test_loss: 1.3150, test_f1: 0.2270
 epoch: 98, train_loss: 1.3015, test_loss: 1.3148, test_f1: 0.2270
 epoch: 99, train_loss: 1.3015, test_loss: 1.3153, test_f1: 0.2270
##################ITERATION #6 ****************************************
 epoch: 0, train_loss: 1.3046, test_loss: 1.3188, test_f1: 0.2270
 epoch: 1, train_loss: 1.3052, test_loss: 1.3148, test_f1: 0.2270
 epoch: 2, train_loss: 1.2874, test_loss: 2.5232, test_f1: 0.2270
 epoch: 3, train_loss: 1.2643, test_loss: 1.6178, test_f1: 0.2270
 epoch: 4, train_loss: 1.2336, test_loss: 1.4066, test_f1: 0.2493
 epoch: 5, train_loss: 1.2335, test_loss: 1.3206, test_f1: 0.2645
 epoch: 6, train_loss: 1.2262, test_loss: 1.1990, test_f1: 0.3198
 epoch: 7, train_loss: 1.2019, test_loss: 1.1653, test_f1: 0.2270
 epoch: 8, train_loss: 1.1571, test_loss: 1.1314, test_f1: 0.3497
 epoch: 9, train_loss: 1.1251, test_loss: 1.0941, test_f1: 0.3553
 epoch: 10, train_loss: 1.1285, test_loss: 1.1141, test_f1: 0.4070
 epoch: 11, train_loss: 1.1277, test_loss: 1.1657, test_f1: 0.3167
 epoch: 12, train_loss: 1.0851, test_loss: 1.1810, test_f1: 0.3254
 epoch: 13, train_loss: 1.0658, test_loss: 1.1136, test_f1: 0.4059
 epoch: 14, train_loss: 1.0736, test_loss: 1.0930, test_f1: 0.3569
 epoch: 15, train_loss: 1.0983, test_loss: 1.1327, test_f1: 0.3492
 epoch: 16, train_loss: 1.0956, test_loss: 1.0993, test_f1: 0.3626
 epoch: 17, train_loss: 1.0803, test_loss: 1.0639, test_f1: 0.3553
 epoch: 18, train_loss: 1.0826, test_loss: 1.1198, test_f1: 0.3262
 epoch: 19, train_loss: 1.0625, test_loss: 1.0907, test_f1: 0.3460
 epoch: 20, train_loss: 1.0661, test_loss: 1.0895, test_f1: 0.3432
 epoch: 21, train_loss: 1.0570, test_loss: 1.0856, test_f1: 0.3441
 epoch: 22, train_loss: 1.0480, test_loss: 1.0854, test_f1: 0.3448
 epoch: 23, train_loss: 1.0363, test_loss: 1.0812, test_f1: 0.3615
 epoch: 24, train_loss: 1.0311, test_loss: 1.1524, test_f1: 0.3445
 epoch: 25, train_loss: 1.0293, test_loss: 1.0969, test_f1: 0.3451
 epoch: 26, train_loss: 1.0167, test_loss: 1.0165, test_f1: 0.3566
 epoch: 27, train_loss: 1.0235, test_loss: 1.0811, test_f1: 0.3536
 epoch: 28, train_loss: 1.0379, test_loss: 1.0796, test_f1: 0.3976
 epoch: 29, train_loss: 1.0348, test_loss: 1.0477, test_f1: 0.3601
 epoch: 30, train_loss: 1.0397, test_loss: 1.1188, test_f1: 0.3436
 epoch: 31, train_loss: 1.0556, test_loss: 1.1091, test_f1: 0.3438
 epoch: 32, train_loss: 1.0454, test_loss: 1.0640, test_f1: 0.3548
 epoch: 33, train_loss: 1.0363, test_loss: 1.1442, test_f1: 0.3610
 epoch: 34, train_loss: 1.0351, test_loss: 1.0829, test_f1: 0.3467
 epoch: 35, train_loss: 1.0264, test_loss: 1.0927, test_f1: 0.3950
 epoch: 36, train_loss: 1.0283, test_loss: 1.1075, test_f1: 0.3548
 epoch: 37, train_loss: 1.0342, test_loss: 1.2343, test_f1: 0.3899
 epoch: 38, train_loss: 1.0195, test_loss: 1.0390, test_f1: 0.3571
 epoch: 39, train_loss: 1.0203, test_loss: 1.0910, test_f1: 0.3599
 epoch: 40, train_loss: 1.0097, test_loss: 1.0738, test_f1: 0.3626
 epoch: 41, train_loss: 1.0162, test_loss: 1.0721, test_f1: 0.3506
 epoch: 42, train_loss: 1.0098, test_loss: 1.0889, test_f1: 0.3595
 epoch: 43, train_loss: 1.0200, test_loss: 1.0839, test_f1: 0.3644
 epoch: 44, train_loss: 1.0293, test_loss: 1.0229, test_f1: 0.4069
 epoch: 45, train_loss: 1.0196, test_loss: 1.1728, test_f1: 0.4119
 epoch: 46, train_loss: 1.0167, test_loss: 1.0207, test_f1: 0.3593
 epoch: 47, train_loss: 1.0081, test_loss: 1.0802, test_f1: 0.4442
 epoch: 48, train_loss: 1.0237, test_loss: 1.1363, test_f1: 0.3388
 epoch: 49, train_loss: 1.0139, test_loss: 1.0929, test_f1: 0.3952
 epoch: 50, train_loss: 1.0073, test_loss: 1.0882, test_f1: 0.4327
 epoch: 51, train_loss: 1.0101, test_loss: 1.0997, test_f1: 0.3727
 epoch: 52, train_loss: 1.0045, test_loss: 1.0839, test_f1: 0.3873
 epoch: 53, train_loss: 0.9905, test_loss: 1.0696, test_f1: 0.3825
 epoch: 54, train_loss: 0.9792, test_loss: 1.0773, test_f1: 0.3656
 epoch: 55, train_loss: 0.9860, test_loss: 1.0996, test_f1: 0.3883
 epoch: 56, train_loss: 0.9866, test_loss: 1.0699, test_f1: 0.3585
 epoch: 57, train_loss: 0.9837, test_loss: 1.0751, test_f1: 0.3585
 epoch: 58, train_loss: 0.9850, test_loss: 1.0837, test_f1: 0.3684
 epoch: 59, train_loss: 0.9799, test_loss: 1.0911, test_f1: 0.3619
 epoch: 60, train_loss: 0.9766, test_loss: 1.0678, test_f1: 0.3695
 epoch: 61, train_loss: 0.9904, test_loss: 1.0914, test_f1: 0.3479
 epoch: 62, train_loss: 0.9732, test_loss: 1.0855, test_f1: 0.3877
 epoch: 63, train_loss: 0.9763, test_loss: 1.0863, test_f1: 0.3772
 epoch: 64, train_loss: 0.9949, test_loss: 1.1301, test_f1: 0.3509
 epoch: 65, train_loss: 0.9854, test_loss: 1.0883, test_f1: 0.3763
 epoch: 66, train_loss: 0.9783, test_loss: 1.0811, test_f1: 0.3989
 epoch: 67, train_loss: 0.9655, test_loss: 1.0738, test_f1: 0.4679
 epoch: 68, train_loss: 0.9878, test_loss: 1.1688, test_f1: 0.3576
 epoch: 69, train_loss: 0.9780, test_loss: 1.1022, test_f1: 0.3523
 epoch: 70, train_loss: 0.9851, test_loss: 1.0772, test_f1: 0.4931
 epoch: 71, train_loss: 0.9742, test_loss: 1.0818, test_f1: 0.3545
 epoch: 72, train_loss: 0.9753, test_loss: 1.0733, test_f1: 0.4616
 epoch: 73, train_loss: 0.9765, test_loss: 1.0770, test_f1: 0.4307
 epoch: 74, train_loss: 0.9742, test_loss: 1.1074, test_f1: 0.4311
 epoch: 75, train_loss: 0.9883, test_loss: 1.0875, test_f1: 0.3568
 epoch: 76, train_loss: 0.9869, test_loss: 1.0803, test_f1: 0.4665
 epoch: 77, train_loss: 0.9760, test_loss: 1.0960, test_f1: 0.3942
 epoch: 78, train_loss: 0.9710, test_loss: 1.0714, test_f1: 0.3931
 epoch: 79, train_loss: 0.9644, test_loss: 1.0899, test_f1: 0.3636
 epoch: 80, train_loss: 0.9762, test_loss: 1.1208, test_f1: 0.3525
 epoch: 81, train_loss: 0.9760, test_loss: 1.0994, test_f1: 0.3595
 epoch: 82, train_loss: 0.9723, test_loss: 1.0791, test_f1: 0.4790
 epoch: 83, train_loss: 0.9672, test_loss: 1.0951, test_f1: 0.4557
 epoch: 84, train_loss: 0.9740, test_loss: 1.0931, test_f1: 0.3739
 epoch: 85, train_loss: 0.9766, test_loss: 1.0927, test_f1: 0.3855
 epoch: 86, train_loss: 0.9688, test_loss: 1.0717, test_f1: 0.4541
 epoch: 87, train_loss: 0.9701, test_loss: 1.1034, test_f1: 0.3688
 epoch: 88, train_loss: 0.9638, test_loss: 1.1023, test_f1: 0.4041
 epoch: 89, train_loss: 0.9738, test_loss: 1.0834, test_f1: 0.4627
 epoch: 90, train_loss: 0.9713, test_loss: 1.1032, test_f1: 0.4505
 epoch: 91, train_loss: 0.9719, test_loss: 1.1057, test_f1: 0.4673
 epoch: 92, train_loss: 0.9700, test_loss: 1.0924, test_f1: 0.4583
 epoch: 93, train_loss: 0.9655, test_loss: 1.0812, test_f1: 0.4845
 epoch: 94, train_loss: 0.9615, test_loss: 1.0827, test_f1: 0.3664
 epoch: 95, train_loss: 0.9600, test_loss: 1.0895, test_f1: 0.4447
 epoch: 96, train_loss: 0.9658, test_loss: 1.1190, test_f1: 0.4508
 epoch: 97, train_loss: 0.9578, test_loss: 1.0848, test_f1: 0.5113
 epoch: 98, train_loss: 0.9589, test_loss: 1.0998, test_f1: 0.4898
 epoch: 99, train_loss: 0.9642, test_loss: 1.1096, test_f1: 0.3703
##################ITERATION #7 ****************************************
 epoch: 0, train_loss: 1.3781, test_loss: 1.7936, test_f1: 0.2797
 epoch: 1, train_loss: 1.2231, test_loss: 1.2375, test_f1: 0.2710
 epoch: 2, train_loss: 1.1691, test_loss: 1.1295, test_f1: 0.3299
 epoch: 3, train_loss: 1.1406, test_loss: 1.0855, test_f1: 0.3973
 epoch: 4, train_loss: 1.1871, test_loss: 1.1533, test_f1: 0.3636
 epoch: 5, train_loss: 1.1374, test_loss: 1.0808, test_f1: 0.3611
 epoch: 6, train_loss: 1.1082, test_loss: 1.0869, test_f1: 0.3534
 epoch: 7, train_loss: 1.0843, test_loss: 1.0313, test_f1: 0.3481
 epoch: 8, train_loss: 1.0632, test_loss: 1.1083, test_f1: 0.3508
 epoch: 9, train_loss: 1.0532, test_loss: 1.0103, test_f1: 0.3779
 epoch: 10, train_loss: 1.0442, test_loss: 1.0708, test_f1: 0.3534
 epoch: 11, train_loss: 1.0476, test_loss: 1.1066, test_f1: 0.3536
 epoch: 12, train_loss: 1.0622, test_loss: 1.0402, test_f1: 0.3683
 epoch: 13, train_loss: 1.0575, test_loss: 1.0305, test_f1: 0.3814
 epoch: 14, train_loss: 1.0550, test_loss: 1.0939, test_f1: 0.3636
 epoch: 15, train_loss: 1.0651, test_loss: 1.0459, test_f1: 0.3735
 epoch: 16, train_loss: 1.0500, test_loss: 1.0496, test_f1: 0.3694
 epoch: 17, train_loss: 1.0407, test_loss: 1.0767, test_f1: 0.3848
 epoch: 18, train_loss: 1.0456, test_loss: 1.1093, test_f1: 0.3831
 epoch: 19, train_loss: 1.0467, test_loss: 1.1092, test_f1: 0.3437
 epoch: 20, train_loss: 1.0497, test_loss: 1.0734, test_f1: 0.3510
 epoch: 21, train_loss: 1.0568, test_loss: 1.1040, test_f1: 0.3422
 epoch: 22, train_loss: 1.0466, test_loss: 1.1005, test_f1: 0.3460
 epoch: 23, train_loss: 1.0464, test_loss: 1.0684, test_f1: 0.3422
 epoch: 24, train_loss: 1.0337, test_loss: 1.0628, test_f1: 0.3620
 epoch: 25, train_loss: 1.0441, test_loss: 1.0727, test_f1: 0.3422
 epoch: 26, train_loss: 1.0334, test_loss: 1.0878, test_f1: 0.3832
 epoch: 27, train_loss: 1.0427, test_loss: 1.0719, test_f1: 0.3455
 epoch: 28, train_loss: 1.0449, test_loss: 1.1163, test_f1: 0.3487
 epoch: 29, train_loss: 1.0728, test_loss: 1.0932, test_f1: 0.3935
 epoch: 30, train_loss: 1.0374, test_loss: 1.1190, test_f1: 0.3444
 epoch: 31, train_loss: 1.0640, test_loss: 1.0566, test_f1: 0.3543
 epoch: 32, train_loss: 1.0628, test_loss: 1.1227, test_f1: 0.3729
 epoch: 33, train_loss: 1.0402, test_loss: 1.1003, test_f1: 0.3700
 epoch: 34, train_loss: 1.0320, test_loss: 1.0808, test_f1: 0.3821
 epoch: 35, train_loss: 1.0725, test_loss: 1.1242, test_f1: 0.3403
 epoch: 36, train_loss: 1.0787, test_loss: 1.1191, test_f1: 0.3602
 epoch: 37, train_loss: 1.0599, test_loss: 1.0664, test_f1: 0.3627
 epoch: 38, train_loss: 1.0635, test_loss: 1.0834, test_f1: 0.3733
 epoch: 39, train_loss: 1.0641, test_loss: 1.1111, test_f1: 0.3422
 epoch: 40, train_loss: 1.0639, test_loss: 1.0749, test_f1: 0.3497
 epoch: 41, train_loss: 1.0515, test_loss: 1.0331, test_f1: 0.3480
 epoch: 42, train_loss: 1.0399, test_loss: 1.0860, test_f1: 0.3495
 epoch: 43, train_loss: 1.0286, test_loss: 1.0542, test_f1: 0.3460
 epoch: 44, train_loss: 1.0438, test_loss: 1.1069, test_f1: 0.3709
 epoch: 45, train_loss: 1.0348, test_loss: 1.1641, test_f1: 0.3473
 epoch: 46, train_loss: 1.0390, test_loss: 1.0971, test_f1: 0.3864
 epoch: 47, train_loss: 1.0373, test_loss: 1.0770, test_f1: 0.4027
 epoch: 48, train_loss: 1.0246, test_loss: 1.0967, test_f1: 0.3874
 epoch: 49, train_loss: 1.0223, test_loss: 1.0392, test_f1: 0.3491
 epoch: 50, train_loss: 1.0199, test_loss: 1.0970, test_f1: 0.3641
 epoch: 51, train_loss: 1.0245, test_loss: 1.0932, test_f1: 0.3615
 epoch: 52, train_loss: 1.0196, test_loss: 0.9988, test_f1: 0.3627
 epoch: 53, train_loss: 1.0126, test_loss: 1.0430, test_f1: 0.3499
 epoch: 54, train_loss: 1.0054, test_loss: 1.0301, test_f1: 0.3441
 epoch: 55, train_loss: 1.0007, test_loss: 1.0115, test_f1: 0.3588
 epoch: 56, train_loss: 1.0011, test_loss: 1.0398, test_f1: 0.3477
 epoch: 57, train_loss: 1.0003, test_loss: 1.0843, test_f1: 0.3908
 epoch: 58, train_loss: 1.0040, test_loss: 1.0599, test_f1: 0.3808
 epoch: 59, train_loss: 0.9997, test_loss: 1.0578, test_f1: 0.3503
 epoch: 60, train_loss: 0.9954, test_loss: 1.0129, test_f1: 0.3895
 epoch: 61, train_loss: 0.9969, test_loss: 1.0781, test_f1: 0.3981
 epoch: 62, train_loss: 0.9982, test_loss: 1.0592, test_f1: 0.3927
 epoch: 63, train_loss: 0.9969, test_loss: 1.0655, test_f1: 0.3786
 epoch: 64, train_loss: 0.9972, test_loss: 0.9783, test_f1: 0.3985
 epoch: 65, train_loss: 0.9958, test_loss: 1.0713, test_f1: 0.3925
 epoch: 66, train_loss: 1.0022, test_loss: 1.0790, test_f1: 0.3484
 epoch: 67, train_loss: 0.9962, test_loss: 1.0877, test_f1: 0.3536
 epoch: 68, train_loss: 1.0166, test_loss: 1.0479, test_f1: 0.3422
 epoch: 69, train_loss: 1.0154, test_loss: 1.0963, test_f1: 0.3950
 epoch: 70, train_loss: 0.9993, test_loss: 1.0805, test_f1: 0.3530
 epoch: 71, train_loss: 0.9870, test_loss: 1.0743, test_f1: 0.3986
 epoch: 72, train_loss: 0.9953, test_loss: 1.0731, test_f1: 0.3559
 epoch: 73, train_loss: 1.0012, test_loss: 1.0719, test_f1: 0.3469
 epoch: 74, train_loss: 0.9887, test_loss: 1.0741, test_f1: 0.3473
 epoch: 75, train_loss: 0.9775, test_loss: 1.0523, test_f1: 0.3907
 epoch: 76, train_loss: 0.9759, test_loss: 0.9772, test_f1: 0.4019
 epoch: 77, train_loss: 0.9717, test_loss: 0.9657, test_f1: 0.3811
 epoch: 78, train_loss: 0.9864, test_loss: 1.0804, test_f1: 0.3926
 epoch: 79, train_loss: 0.9820, test_loss: 1.0781, test_f1: 0.3832
 epoch: 80, train_loss: 0.9747, test_loss: 1.0939, test_f1: 0.3966
 epoch: 81, train_loss: 0.9716, test_loss: 1.0779, test_f1: 0.3481
 epoch: 82, train_loss: 0.9735, test_loss: 1.0685, test_f1: 0.3569
 epoch: 83, train_loss: 0.9807, test_loss: 1.0958, test_f1: 0.3817
 epoch: 84, train_loss: 0.9905, test_loss: 1.0689, test_f1: 0.3582
 epoch: 85, train_loss: 0.9843, test_loss: 1.0723, test_f1: 0.3623
 epoch: 86, train_loss: 0.9784, test_loss: 1.0519, test_f1: 0.4139
 epoch: 87, train_loss: 0.9700, test_loss: 1.0576, test_f1: 0.4012
 epoch: 88, train_loss: 0.9765, test_loss: 1.0575, test_f1: 0.3610
 epoch: 89, train_loss: 0.9666, test_loss: 1.0530, test_f1: 0.3679
 epoch: 90, train_loss: 0.9645, test_loss: 1.0763, test_f1: 0.4148
 epoch: 91, train_loss: 0.9635, test_loss: 1.0513, test_f1: 0.3634
 epoch: 92, train_loss: 0.9696, test_loss: 1.1102, test_f1: 0.3452
 epoch: 93, train_loss: 0.9698, test_loss: 1.0507, test_f1: 0.4143
 epoch: 94, train_loss: 0.9875, test_loss: 1.1120, test_f1: 0.3969
 epoch: 95, train_loss: 0.9735, test_loss: 1.0725, test_f1: 0.3762
 epoch: 96, train_loss: 0.9697, test_loss: 1.0656, test_f1: 0.3634
 epoch: 97, train_loss: 0.9669, test_loss: 1.0592, test_f1: 0.3707
 epoch: 98, train_loss: 0.9720, test_loss: 1.0648, test_f1: 0.3580
 epoch: 99, train_loss: 0.9640, test_loss: 1.0484, test_f1: 0.3591
##################ITERATION #8 ****************************************
 epoch: 0, train_loss: 1.5391, test_loss: 1.3256, test_f1: 0.2270
 epoch: 1, train_loss: 1.2998, test_loss: 1.3052, test_f1: 0.2270
 epoch: 2, train_loss: 1.2793, test_loss: 1.2215, test_f1: 0.2586
 epoch: 3, train_loss: 1.2073, test_loss: 1.1429, test_f1: 0.3633
 epoch: 4, train_loss: 1.1445, test_loss: 1.0620, test_f1: 0.3543
 epoch: 5, train_loss: 1.1080, test_loss: 1.0692, test_f1: 0.3441
 epoch: 6, train_loss: 1.0926, test_loss: 1.0730, test_f1: 0.3422
 epoch: 7, train_loss: 1.0876, test_loss: 1.1186, test_f1: 0.3469
 epoch: 8, train_loss: 1.0930, test_loss: 1.1524, test_f1: 0.3432
 epoch: 9, train_loss: 1.0873, test_loss: 1.1394, test_f1: 0.3432
 epoch: 10, train_loss: 1.0798, test_loss: 1.0476, test_f1: 0.3550
 epoch: 11, train_loss: 1.0810, test_loss: 1.0598, test_f1: 0.3909
 epoch: 12, train_loss: 1.0857, test_loss: 1.1099, test_f1: 0.3679
 epoch: 13, train_loss: 1.0707, test_loss: 1.1177, test_f1: 0.3559
 epoch: 14, train_loss: 1.0647, test_loss: 1.0396, test_f1: 0.3571
 epoch: 15, train_loss: 1.0651, test_loss: 1.0824, test_f1: 0.3738
 epoch: 16, train_loss: 1.0623, test_loss: 1.0681, test_f1: 0.3625
 epoch: 17, train_loss: 1.0683, test_loss: 1.0471, test_f1: 0.3654
 epoch: 18, train_loss: 1.0553, test_loss: 1.0505, test_f1: 0.3835
 epoch: 19, train_loss: 1.0631, test_loss: 1.0467, test_f1: 0.4629
 epoch: 20, train_loss: 1.0605, test_loss: 1.0995, test_f1: 0.4347
 epoch: 21, train_loss: 1.0476, test_loss: 1.1405, test_f1: 0.3638
 epoch: 22, train_loss: 1.0536, test_loss: 1.1199, test_f1: 0.3553
 epoch: 23, train_loss: 1.0493, test_loss: 1.1379, test_f1: 0.3432
 epoch: 24, train_loss: 1.0586, test_loss: 1.0983, test_f1: 0.3780
 epoch: 25, train_loss: 1.0536, test_loss: 1.1069, test_f1: 0.3422
 epoch: 26, train_loss: 1.0579, test_loss: 1.1243, test_f1: 0.3657
 epoch: 27, train_loss: 1.0461, test_loss: 1.0904, test_f1: 0.3998
 epoch: 28, train_loss: 1.0580, test_loss: 1.2141, test_f1: 0.4093
 epoch: 29, train_loss: 1.0639, test_loss: 1.0669, test_f1: 0.4069
 epoch: 30, train_loss: 1.0549, test_loss: 1.0321, test_f1: 0.3914
 epoch: 31, train_loss: 1.0352, test_loss: 1.0922, test_f1: 0.3754
 epoch: 32, train_loss: 1.0371, test_loss: 1.1015, test_f1: 0.3996
 epoch: 33, train_loss: 1.0235, test_loss: 1.0982, test_f1: 0.3475
 epoch: 34, train_loss: 1.0340, test_loss: 1.0301, test_f1: 0.3657
 epoch: 35, train_loss: 1.0442, test_loss: 1.1497, test_f1: 0.3504
 epoch: 36, train_loss: 1.0290, test_loss: 1.0720, test_f1: 0.3742
 epoch: 37, train_loss: 1.0152, test_loss: 1.0738, test_f1: 0.3513
 epoch: 38, train_loss: 1.0195, test_loss: 0.9961, test_f1: 0.4128
 epoch: 39, train_loss: 1.0086, test_loss: 1.0083, test_f1: 0.4917
 epoch: 40, train_loss: 1.0261, test_loss: 1.1470, test_f1: 0.3563
 epoch: 41, train_loss: 1.0276, test_loss: 1.1106, test_f1: 0.3529
 epoch: 42, train_loss: 1.0266, test_loss: 1.0938, test_f1: 0.3513
 epoch: 43, train_loss: 1.0369, test_loss: 1.1497, test_f1: 0.3309
 epoch: 44, train_loss: 1.0140, test_loss: 1.0632, test_f1: 0.3525
 epoch: 45, train_loss: 1.0057, test_loss: 1.2300, test_f1: 0.3573
 epoch: 46, train_loss: 1.0175, test_loss: 1.1112, test_f1: 0.3498
 epoch: 47, train_loss: 1.0280, test_loss: 1.1103, test_f1: 0.3413
 epoch: 48, train_loss: 1.0208, test_loss: 1.0897, test_f1: 0.4664
 epoch: 49, train_loss: 1.0177, test_loss: 1.0718, test_f1: 0.3808
 epoch: 50, train_loss: 1.0032, test_loss: 1.0399, test_f1: 0.4760
 epoch: 51, train_loss: 0.9969, test_loss: 1.0767, test_f1: 0.3516
 epoch: 52, train_loss: 0.9916, test_loss: 1.0624, test_f1: 0.3849
 epoch: 53, train_loss: 0.9959, test_loss: 1.0629, test_f1: 0.3548
 epoch: 54, train_loss: 0.9873, test_loss: 1.0688, test_f1: 0.3665
 epoch: 55, train_loss: 0.9885, test_loss: 1.0792, test_f1: 0.3709
 epoch: 56, train_loss: 0.9854, test_loss: 1.0625, test_f1: 0.4849
 epoch: 57, train_loss: 0.9780, test_loss: 1.0755, test_f1: 0.4081
 epoch: 58, train_loss: 0.9786, test_loss: 1.0696, test_f1: 0.3582
 epoch: 59, train_loss: 0.9749, test_loss: 1.0619, test_f1: 0.3677
 epoch: 60, train_loss: 0.9883, test_loss: 1.0749, test_f1: 0.3576
 epoch: 61, train_loss: 0.9798, test_loss: 1.0625, test_f1: 0.3953
 epoch: 62, train_loss: 0.9671, test_loss: 1.0871, test_f1: 0.3579
 epoch: 63, train_loss: 0.9760, test_loss: 1.0160, test_f1: 0.4045
 epoch: 64, train_loss: 0.9880, test_loss: 1.0297, test_f1: 0.3702
 epoch: 65, train_loss: 0.9974, test_loss: 1.0701, test_f1: 0.3545
 epoch: 66, train_loss: 0.9976, test_loss: 1.0627, test_f1: 0.3592
 epoch: 67, train_loss: 0.9841, test_loss: 1.0830, test_f1: 0.3824
 epoch: 68, train_loss: 0.9815, test_loss: 1.0671, test_f1: 0.4183
 epoch: 69, train_loss: 0.9713, test_loss: 1.0649, test_f1: 0.3658
 epoch: 70, train_loss: 0.9750, test_loss: 1.1068, test_f1: 0.4979
 epoch: 71, train_loss: 0.9570, test_loss: 1.0065, test_f1: 0.5113
 epoch: 72, train_loss: 0.9706, test_loss: 1.0678, test_f1: 0.3922
 epoch: 73, train_loss: 0.9679, test_loss: 1.0722, test_f1: 0.3566
 epoch: 74, train_loss: 0.9669, test_loss: 1.0729, test_f1: 0.3557
 epoch: 75, train_loss: 0.9629, test_loss: 1.0853, test_f1: 0.3649
 epoch: 76, train_loss: 0.9697, test_loss: 1.0741, test_f1: 0.3880
 epoch: 77, train_loss: 0.9689, test_loss: 1.0606, test_f1: 0.3947
 epoch: 78, train_loss: 0.9632, test_loss: 1.2587, test_f1: 0.3471
 epoch: 79, train_loss: 0.9720, test_loss: 1.0597, test_f1: 0.4436
 epoch: 80, train_loss: 0.9836, test_loss: 1.0857, test_f1: 0.4050
 epoch: 81, train_loss: 0.9753, test_loss: 1.0841, test_f1: 0.3875
 epoch: 82, train_loss: 0.9863, test_loss: 1.1039, test_f1: 0.3673
 epoch: 83, train_loss: 0.9756, test_loss: 1.0763, test_f1: 0.3791
 epoch: 84, train_loss: 0.9771, test_loss: 1.1042, test_f1: 0.4082
 epoch: 85, train_loss: 0.9753, test_loss: 1.0892, test_f1: 0.3634
 epoch: 86, train_loss: 0.9661, test_loss: 1.0648, test_f1: 0.4009
 epoch: 87, train_loss: 0.9555, test_loss: 1.0750, test_f1: 0.3873
 epoch: 88, train_loss: 0.9624, test_loss: 1.0769, test_f1: 0.5015
 epoch: 89, train_loss: 0.9626, test_loss: 1.0894, test_f1: 0.3608
 epoch: 90, train_loss: 0.9646, test_loss: 1.0904, test_f1: 0.3725
 epoch: 91, train_loss: 0.9645, test_loss: 1.1189, test_f1: 0.3711
 epoch: 92, train_loss: 0.9706, test_loss: 1.0868, test_f1: 0.4921
 epoch: 93, train_loss: 0.9815, test_loss: 1.0589, test_f1: 0.3870
 epoch: 94, train_loss: 0.9656, test_loss: 1.0737, test_f1: 0.3587
 epoch: 95, train_loss: 0.9538, test_loss: 1.0698, test_f1: 0.4850
 epoch: 96, train_loss: 0.9586, test_loss: 1.0757, test_f1: 0.3562
 epoch: 97, train_loss: 0.9513, test_loss: 1.1394, test_f1: 0.3508
 epoch: 98, train_loss: 0.9504, test_loss: 1.0872, test_f1: 0.3537
 epoch: 99, train_loss: 0.9539, test_loss: 1.0241, test_f1: 0.3541
##################ITERATION #9 ****************************************
 epoch: 0, train_loss: 1.3266, test_loss: 2.0471, test_f1: 0.2734
 epoch: 1, train_loss: 1.2152, test_loss: 1.4868, test_f1: 0.2494
 epoch: 2, train_loss: 1.2034, test_loss: 1.1326, test_f1: 0.3672
 epoch: 3, train_loss: 1.1548, test_loss: 1.0947, test_f1: 0.4354
 epoch: 4, train_loss: 1.1241, test_loss: 1.1095, test_f1: 0.4036
 epoch: 5, train_loss: 1.1302, test_loss: 1.1316, test_f1: 0.3626
 epoch: 6, train_loss: 1.1368, test_loss: 1.0836, test_f1: 0.3821
 epoch: 7, train_loss: 1.1267, test_loss: 1.0869, test_f1: 0.3597
 epoch: 8, train_loss: 1.0843, test_loss: 1.1344, test_f1: 0.3455
 epoch: 9, train_loss: 1.0747, test_loss: 1.0591, test_f1: 0.3513
 epoch: 10, train_loss: 1.0713, test_loss: 1.0560, test_f1: 0.3533
 epoch: 11, train_loss: 1.0716, test_loss: 1.1483, test_f1: 0.3358
 epoch: 12, train_loss: 1.0813, test_loss: 1.0733, test_f1: 0.3545
 epoch: 13, train_loss: 1.0669, test_loss: 1.0657, test_f1: 0.3425
 epoch: 14, train_loss: 1.0531, test_loss: 1.0397, test_f1: 0.3677
 epoch: 15, train_loss: 1.0611, test_loss: 1.0189, test_f1: 0.3675
 epoch: 16, train_loss: 1.0389, test_loss: 1.0376, test_f1: 0.3557
 epoch: 17, train_loss: 1.0426, test_loss: 1.1306, test_f1: 0.3551
 epoch: 18, train_loss: 1.0424, test_loss: 1.1302, test_f1: 0.3432
 epoch: 19, train_loss: 1.0661, test_loss: 1.0182, test_f1: 0.3697
 epoch: 20, train_loss: 1.0566, test_loss: 1.0527, test_f1: 0.3629
 epoch: 21, train_loss: 1.0403, test_loss: 1.1387, test_f1: 0.3610
 epoch: 22, train_loss: 1.0742, test_loss: 1.1383, test_f1: 0.3508
 epoch: 23, train_loss: 1.0528, test_loss: 1.1514, test_f1: 0.3681
 epoch: 24, train_loss: 1.0567, test_loss: 1.1515, test_f1: 0.3539
 epoch: 25, train_loss: 1.0340, test_loss: 1.1513, test_f1: 0.3440
 epoch: 26, train_loss: 1.0255, test_loss: 1.2207, test_f1: 0.3313
 epoch: 27, train_loss: 1.0288, test_loss: 1.1372, test_f1: 0.3558
 epoch: 28, train_loss: 1.0281, test_loss: 1.1220, test_f1: 0.3649
 epoch: 29, train_loss: 1.0332, test_loss: 1.0682, test_f1: 0.3593
 epoch: 30, train_loss: 1.0316, test_loss: 1.1240, test_f1: 0.3580
 epoch: 31, train_loss: 1.0244, test_loss: 1.0258, test_f1: 0.3573
 epoch: 32, train_loss: 1.0276, test_loss: 1.1568, test_f1: 0.3644
 epoch: 33, train_loss: 1.0198, test_loss: 1.1041, test_f1: 0.3528
 epoch: 34, train_loss: 1.0235, test_loss: 1.1150, test_f1: 0.3574
 epoch: 35, train_loss: 1.0238, test_loss: 1.1250, test_f1: 0.3617
 epoch: 36, train_loss: 1.0277, test_loss: 1.1275, test_f1: 0.3451
 epoch: 37, train_loss: 1.0486, test_loss: 1.1240, test_f1: 0.3451
 epoch: 38, train_loss: 1.0381, test_loss: 1.1255, test_f1: 0.3586
 epoch: 39, train_loss: 1.0278, test_loss: 1.1668, test_f1: 0.3840
 epoch: 40, train_loss: 1.0362, test_loss: 1.1462, test_f1: 0.3537
 epoch: 41, train_loss: 1.0219, test_loss: 1.1102, test_f1: 0.3685
 epoch: 42, train_loss: 1.0284, test_loss: 1.1771, test_f1: 0.3668
 epoch: 43, train_loss: 1.0236, test_loss: 1.0811, test_f1: 0.3563
 epoch: 44, train_loss: 1.0253, test_loss: 1.1040, test_f1: 0.3503
 epoch: 45, train_loss: 1.0056, test_loss: 1.0964, test_f1: 0.3457
 epoch: 46, train_loss: 1.0180, test_loss: 1.1099, test_f1: 0.3579
 epoch: 47, train_loss: 1.0132, test_loss: 1.1035, test_f1: 0.3690
 epoch: 48, train_loss: 1.0147, test_loss: 1.1107, test_f1: 0.3877
 epoch: 49, train_loss: 1.0058, test_loss: 1.1128, test_f1: 0.3481
 epoch: 50, train_loss: 1.0064, test_loss: 1.1075, test_f1: 0.3436
 epoch: 51, train_loss: 1.0040, test_loss: 1.1036, test_f1: 0.3790
 epoch: 52, train_loss: 0.9853, test_loss: 1.1130, test_f1: 0.3592
 epoch: 53, train_loss: 0.9835, test_loss: 1.1037, test_f1: 0.3701
 epoch: 54, train_loss: 0.9904, test_loss: 1.0841, test_f1: 0.3634
 epoch: 55, train_loss: 0.9851, test_loss: 1.0782, test_f1: 0.3718
 epoch: 56, train_loss: 1.0061, test_loss: 1.1148, test_f1: 0.3463
 epoch: 57, train_loss: 1.0066, test_loss: 1.0859, test_f1: 0.3617
 epoch: 58, train_loss: 0.9824, test_loss: 1.0750, test_f1: 0.3724
 epoch: 59, train_loss: 0.9792, test_loss: 1.0699, test_f1: 0.3762
 epoch: 60, train_loss: 0.9837, test_loss: 1.0899, test_f1: 0.3586
 epoch: 61, train_loss: 0.9767, test_loss: 1.0825, test_f1: 0.3718
 epoch: 62, train_loss: 0.9825, test_loss: 1.0851, test_f1: 0.3643
 epoch: 63, train_loss: 0.9829, test_loss: 1.0780, test_f1: 0.3779
 epoch: 64, train_loss: 0.9834, test_loss: 1.0874, test_f1: 0.3950
 epoch: 65, train_loss: 0.9877, test_loss: 1.1058, test_f1: 0.3957
 epoch: 66, train_loss: 0.9784, test_loss: 1.0748, test_f1: 0.4025
 epoch: 67, train_loss: 0.9781, test_loss: 1.1283, test_f1: 0.3942
 epoch: 68, train_loss: 0.9813, test_loss: 1.0950, test_f1: 0.3472
 epoch: 69, train_loss: 0.9768, test_loss: 1.1131, test_f1: 0.3688
 epoch: 70, train_loss: 0.9686, test_loss: 1.0697, test_f1: 0.3825
 epoch: 71, train_loss: 0.9563, test_loss: 1.0831, test_f1: 0.3947
 epoch: 72, train_loss: 0.9636, test_loss: 1.0676, test_f1: 0.3829
 epoch: 73, train_loss: 0.9663, test_loss: 1.0631, test_f1: 0.3763
 epoch: 74, train_loss: 0.9528, test_loss: 1.0955, test_f1: 0.3846
 epoch: 75, train_loss: 0.9713, test_loss: 0.9983, test_f1: 0.3755
 epoch: 76, train_loss: 0.9793, test_loss: 1.0778, test_f1: 0.3555
 epoch: 77, train_loss: 0.9682, test_loss: 1.0724, test_f1: 0.4323
 epoch: 78, train_loss: 0.9701, test_loss: 1.0988, test_f1: 0.3617
 epoch: 79, train_loss: 0.9748, test_loss: 1.0974, test_f1: 0.3548
 epoch: 80, train_loss: 0.9534, test_loss: 1.0759, test_f1: 0.4503
 epoch: 81, train_loss: 0.9570, test_loss: 1.0691, test_f1: 0.4430
 epoch: 82, train_loss: 0.9557, test_loss: 1.0831, test_f1: 0.4705
 epoch: 83, train_loss: 0.9668, test_loss: 1.0696, test_f1: 0.4481
 epoch: 84, train_loss: 0.9602, test_loss: 1.0797, test_f1: 0.3988
 epoch: 85, train_loss: 0.9611, test_loss: 1.0774, test_f1: 0.4295
 epoch: 86, train_loss: 0.9562, test_loss: 1.1293, test_f1: 0.3624
 epoch: 87, train_loss: 0.9534, test_loss: 1.0965, test_f1: 0.4092
 epoch: 88, train_loss: 0.9658, test_loss: 1.1008, test_f1: 0.3864
 epoch: 89, train_loss: 0.9451, test_loss: 1.1699, test_f1: 0.4626
 epoch: 90, train_loss: 0.9502, test_loss: 1.0633, test_f1: 0.4710
 epoch: 91, train_loss: 0.9467, test_loss: 1.0922, test_f1: 0.3709
 epoch: 92, train_loss: 0.9482, test_loss: 1.1042, test_f1: 0.4006
 epoch: 93, train_loss: 0.9604, test_loss: 1.0875, test_f1: 0.4329
 epoch: 94, train_loss: 0.9610, test_loss: 1.1168, test_f1: 0.4498
 epoch: 95, train_loss: 0.9648, test_loss: 1.0895, test_f1: 0.4540
 epoch: 96, train_loss: 0.9587, test_loss: 1.0955, test_f1: 0.3601
 epoch: 97, train_loss: 0.9543, test_loss: 1.0637, test_f1: 0.3727
 epoch: 98, train_loss: 0.9694, test_loss: 1.1496, test_f1: 0.4708
 epoch: 99, train_loss: 0.9631, test_loss: 1.0831, test_f1: 0.3594

Training completed in 406.26 seconds
Best F1: 0.5113 at epoch 97
Mean F1 across iterations: 0.3552  0.1310
========================FINAL RESULTS================================
FEGIN weighted F1: 0.5113  0.1310
python main.py --data ltspice_examples --representation component_net --model FEGIN --layers 4 --hiddens 16 --batch_size 256 --lr 0.1 --emb_size 512 --epochs 100 --save_appendix component_net_L4_H16_BS256_LR0.1_E512 --no_val
-----



STDERR:
  File "main.py", line 370, in <module>
    main()
  File "main.py", line 254, in main
    dataset = dataset_class(
  File "/home/philip/projects/ltspice_examples_code_repo/Circuit-Completion-Using-GNNs/component_classification_with_link_prediction_head/evaluation/FEGIN/kernel/circuit_datasets.py", line 15, in __init__
    self.data, self.slices = torch.load(self.processed_paths[0])
  File "/home/philip/.local/lib/python3.8/site-packages/torch/serialization.py", line 1040, in load
    warnings.warn(
  File "/usr/lib/python3.8/warnings.py", line 109, in _showwarnmsg
    sw(msg.message, msg.category, msg.filename, msg.lineno,
  File "main.py", line 47, in warn_with_traceback
    traceback.print_stack(file=log)
/home/philip/projects/ltspice_examples_code_repo/Circuit-Completion-Using-GNNs/component_classification_with_link_prediction_head/evaluation/FEGIN/kernel/circuit_datasets.py:15: FutureWarning: You are using `torch.load` with `weights_only=False` (the current default value), which uses the default pickle module implicitly. It is possible to construct malicious pickle data which will execute arbitrary code during unpickling (See https://github.com/pytorch/pytorch/blob/main/SECURITY.md#untrusted-models for more details). In a future release, the default value for `weights_only` will be flipped to `True`. This limits the functions that could be executed during unpickling. Arbitrary objects will no longer be allowed to be loaded via this mode unless they are explicitly allowlisted by the user via `torch.serialization.add_safe_globals`. We recommend you start setting `weights_only=True` for any use case where you don't have full control of the loaded file. Please open an issue on GitHub for any issues related to this experimental feature.
  self.data, self.slices = torch.load(self.processed_paths[0])
