STDOUT:
Results will be saved in /home/philip/projects/llm_inference_code_repo/Circuit-Completion-Using-GNNs/component_classification_with_link_prediction_head/evaluation/FEGIN/results/model_FEGIN_dataset_ltspice_examples
Command line input: python main.py --data ltspice_examples --representation component_pin_net --model FEGIN --layers 2 --hiddens 128 --batch_size 64 --lr 0.001 --emb_size 128 --epochs 100 --save_appendix component_pin_net_L2_H128_BS64_LR0.001_E128 --no_val
 is saved.
-----
ltspice_examples - FEGIN
Using 2 layers, 128 hidden units, h = 2
Loading component_pin_net representation dataset
ENTERED
Training FEGIN on component_pin_net representation
Train: 3558, Test: 846
##################ITERATION #0 ****************************************
 epoch: 0, train_loss: 1.1399, test_loss: 1.0198, test_f1: 0.4133
 epoch: 1, train_loss: 0.9810, test_loss: 0.9520, test_f1: 0.4955
 epoch: 2, train_loss: 0.9454, test_loss: 0.9156, test_f1: 0.5142
 epoch: 3, train_loss: 0.9153, test_loss: 0.8828, test_f1: 0.5363
 epoch: 4, train_loss: 0.8872, test_loss: 0.8648, test_f1: 0.5272
 epoch: 5, train_loss: 0.8589, test_loss: 0.9200, test_f1: 0.5236
 epoch: 6, train_loss: 0.8537, test_loss: 0.8139, test_f1: 0.5788
 epoch: 7, train_loss: 0.8283, test_loss: 0.8668, test_f1: 0.5324
 epoch: 8, train_loss: 0.8136, test_loss: 0.7842, test_f1: 0.5838
 epoch: 9, train_loss: 0.7954, test_loss: 0.8569, test_f1: 0.5971
 epoch: 10, train_loss: 0.7743, test_loss: 0.8036, test_f1: 0.6154
 epoch: 11, train_loss: 0.7652, test_loss: 0.7820, test_f1: 0.5987
 epoch: 12, train_loss: 0.7521, test_loss: 0.7851, test_f1: 0.6094
 epoch: 13, train_loss: 0.7279, test_loss: 0.7667, test_f1: 0.6117
 epoch: 14, train_loss: 0.7248, test_loss: 0.8168, test_f1: 0.6400
 epoch: 15, train_loss: 0.7210, test_loss: 0.8106, test_f1: 0.6171
 epoch: 16, train_loss: 0.6980, test_loss: 0.8099, test_f1: 0.6300
 epoch: 17, train_loss: 0.6743, test_loss: 0.7254, test_f1: 0.6400
 epoch: 18, train_loss: 0.6630, test_loss: 0.7885, test_f1: 0.6658
 epoch: 19, train_loss: 0.6416, test_loss: 0.7965, test_f1: 0.6397
 epoch: 20, train_loss: 0.6278, test_loss: 0.8146, test_f1: 0.6507
 epoch: 21, train_loss: 0.6207, test_loss: 0.8628, test_f1: 0.6322
 epoch: 22, train_loss: 0.6257, test_loss: 0.7489, test_f1: 0.6560
 epoch: 23, train_loss: 0.5790, test_loss: 0.8014, test_f1: 0.6159
 epoch: 24, train_loss: 0.5943, test_loss: 0.8155, test_f1: 0.6643
 epoch: 25, train_loss: 0.5743, test_loss: 0.8535, test_f1: 0.6058
 epoch: 26, train_loss: 0.5685, test_loss: 0.9306, test_f1: 0.6108
 epoch: 27, train_loss: 0.5517, test_loss: 0.7622, test_f1: 0.6726
 epoch: 28, train_loss: 0.5565, test_loss: 0.8332, test_f1: 0.6445
 epoch: 29, train_loss: 0.5419, test_loss: 0.8921, test_f1: 0.6538
 epoch: 30, train_loss: 0.5316, test_loss: 0.8377, test_f1: 0.6626
 epoch: 31, train_loss: 0.5312, test_loss: 0.9370, test_f1: 0.6631
 epoch: 32, train_loss: 0.5126, test_loss: 0.8727, test_f1: 0.6450
 epoch: 33, train_loss: 0.4991, test_loss: 0.8718, test_f1: 0.6625
 epoch: 34, train_loss: 0.4938, test_loss: 0.9422, test_f1: 0.6805
 epoch: 35, train_loss: 0.4951, test_loss: 0.9189, test_f1: 0.6433
 epoch: 36, train_loss: 0.4916, test_loss: 0.9193, test_f1: 0.6562
 epoch: 37, train_loss: 0.4893, test_loss: 0.9350, test_f1: 0.6826
 epoch: 38, train_loss: 0.4599, test_loss: 0.8944, test_f1: 0.6672
 epoch: 39, train_loss: 0.4801, test_loss: 1.0360, test_f1: 0.6546
 epoch: 40, train_loss: 0.4443, test_loss: 0.9232, test_f1: 0.6755
 epoch: 41, train_loss: 0.4456, test_loss: 1.1426, test_f1: 0.6398
 epoch: 42, train_loss: 0.4460, test_loss: 0.9469, test_f1: 0.6525
 epoch: 43, train_loss: 0.4314, test_loss: 0.9087, test_f1: 0.6833
 epoch: 44, train_loss: 0.4160, test_loss: 0.9896, test_f1: 0.6920
 epoch: 45, train_loss: 0.4076, test_loss: 1.0375, test_f1: 0.6512
 epoch: 46, train_loss: 0.4022, test_loss: 0.9333, test_f1: 0.6810
 epoch: 47, train_loss: 0.4121, test_loss: 0.9736, test_f1: 0.6721
 epoch: 48, train_loss: 0.3755, test_loss: 1.1591, test_f1: 0.6661
 epoch: 49, train_loss: 0.3891, test_loss: 1.0319, test_f1: 0.6678
 epoch: 50, train_loss: 0.3840, test_loss: 1.0672, test_f1: 0.6759
 epoch: 51, train_loss: 0.3403, test_loss: 1.0776, test_f1: 0.6985
 epoch: 52, train_loss: 0.3314, test_loss: 1.2122, test_f1: 0.6823
 epoch: 53, train_loss: 0.3221, test_loss: 1.1157, test_f1: 0.6916
 epoch: 54, train_loss: 0.3112, test_loss: 1.1387, test_f1: 0.7052
 epoch: 55, train_loss: 0.3087, test_loss: 1.2233, test_f1: 0.6981
 epoch: 56, train_loss: 0.3069, test_loss: 1.2427, test_f1: 0.6888
 epoch: 57, train_loss: 0.3116, test_loss: 1.3156, test_f1: 0.6775
 epoch: 58, train_loss: 0.2832, test_loss: 1.3143, test_f1: 0.6799
 epoch: 59, train_loss: 0.3056, test_loss: 1.2625, test_f1: 0.6703
 epoch: 60, train_loss: 0.2975, test_loss: 1.2254, test_f1: 0.6758
 epoch: 61, train_loss: 0.2875, test_loss: 1.2935, test_f1: 0.7024
 epoch: 62, train_loss: 0.2925, test_loss: 1.2360, test_f1: 0.6855
 epoch: 63, train_loss: 0.2839, test_loss: 1.2449, test_f1: 0.6884
 epoch: 64, train_loss: 0.2796, test_loss: 1.3031, test_f1: 0.6980
 epoch: 65, train_loss: 0.2896, test_loss: 1.1861, test_f1: 0.7055
 epoch: 66, train_loss: 0.2692, test_loss: 1.3059, test_f1: 0.6884
 epoch: 67, train_loss: 0.2733, test_loss: 1.3373, test_f1: 0.6788
 epoch: 68, train_loss: 0.2701, test_loss: 1.3237, test_f1: 0.7056
 epoch: 69, train_loss: 0.2817, test_loss: 1.2979, test_f1: 0.7044
 epoch: 70, train_loss: 0.2683, test_loss: 1.3645, test_f1: 0.6757
 epoch: 71, train_loss: 0.2645, test_loss: 1.3835, test_f1: 0.6789
 epoch: 72, train_loss: 0.2396, test_loss: 1.4235, test_f1: 0.6952
 epoch: 73, train_loss: 0.2387, test_loss: 1.3250, test_f1: 0.6846
 epoch: 74, train_loss: 0.2601, test_loss: 1.4209, test_f1: 0.6822
 epoch: 75, train_loss: 0.2430, test_loss: 1.4697, test_f1: 0.6821
 epoch: 76, train_loss: 0.2395, test_loss: 1.4813, test_f1: 0.6753
 epoch: 77, train_loss: 0.2327, test_loss: 1.3888, test_f1: 0.6856
 epoch: 78, train_loss: 0.2264, test_loss: 1.5063, test_f1: 0.6906
 epoch: 79, train_loss: 0.2363, test_loss: 1.5181, test_f1: 0.6774
 epoch: 80, train_loss: 0.2307, test_loss: 1.4653, test_f1: 0.6795
 epoch: 81, train_loss: 0.2207, test_loss: 1.6627, test_f1: 0.6857
 epoch: 82, train_loss: 0.2206, test_loss: 1.6117, test_f1: 0.6737
 epoch: 83, train_loss: 0.2244, test_loss: 1.5035, test_f1: 0.6990
 epoch: 84, train_loss: 0.2465, test_loss: 1.5363, test_f1: 0.6745
 epoch: 85, train_loss: 0.2156, test_loss: 1.5421, test_f1: 0.6846
 epoch: 86, train_loss: 0.2233, test_loss: 1.5617, test_f1: 0.6952
 epoch: 87, train_loss: 0.2190, test_loss: 1.5008, test_f1: 0.6744
 epoch: 88, train_loss: 0.1998, test_loss: 1.5992, test_f1: 0.6928
 epoch: 89, train_loss: 0.2210, test_loss: 1.5250, test_f1: 0.6858
 epoch: 90, train_loss: 0.2219, test_loss: 1.5527, test_f1: 0.6877
 epoch: 91, train_loss: 0.2076, test_loss: 1.5945, test_f1: 0.6851
 epoch: 92, train_loss: 0.2115, test_loss: 1.6915, test_f1: 0.6858
 epoch: 93, train_loss: 0.2027, test_loss: 1.6408, test_f1: 0.6843
 epoch: 94, train_loss: 0.1882, test_loss: 1.6471, test_f1: 0.6901
 epoch: 95, train_loss: 0.2013, test_loss: 1.6397, test_f1: 0.6954
 epoch: 96, train_loss: 0.1913, test_loss: 1.7326, test_f1: 0.6685
 epoch: 97, train_loss: 0.1915, test_loss: 1.7862, test_f1: 0.6896
 epoch: 98, train_loss: 0.2019, test_loss: 1.6523, test_f1: 0.6943
 epoch: 99, train_loss: 0.1961, test_loss: 1.7863, test_f1: 0.6785
##################ITERATION #1 ****************************************
 epoch: 0, train_loss: 1.0606, test_loss: 1.0234, test_f1: 0.4647
 epoch: 1, train_loss: 0.9432, test_loss: 0.9589, test_f1: 0.5049
 epoch: 2, train_loss: 0.8997, test_loss: 0.8712, test_f1: 0.5769
 epoch: 3, train_loss: 0.8797, test_loss: 0.8808, test_f1: 0.5774
 epoch: 4, train_loss: 0.8655, test_loss: 0.8713, test_f1: 0.5563
 epoch: 5, train_loss: 0.8354, test_loss: 0.8228, test_f1: 0.5667
 epoch: 6, train_loss: 0.8111, test_loss: 0.8642, test_f1: 0.5676
 epoch: 7, train_loss: 0.8013, test_loss: 0.7918, test_f1: 0.6209
 epoch: 8, train_loss: 0.7673, test_loss: 0.8354, test_f1: 0.5850
 epoch: 9, train_loss: 0.7524, test_loss: 0.8282, test_f1: 0.6149
 epoch: 10, train_loss: 0.7601, test_loss: 0.8175, test_f1: 0.6215
 epoch: 11, train_loss: 0.7131, test_loss: 0.7801, test_f1: 0.6776
 epoch: 12, train_loss: 0.6992, test_loss: 0.7539, test_f1: 0.6563
 epoch: 13, train_loss: 0.7087, test_loss: 0.7654, test_f1: 0.6351
 epoch: 14, train_loss: 0.6919, test_loss: 0.7924, test_f1: 0.6076
 epoch: 15, train_loss: 0.6749, test_loss: 0.7560, test_f1: 0.6472
 epoch: 16, train_loss: 0.6659, test_loss: 0.7485, test_f1: 0.6499
 epoch: 17, train_loss: 0.6443, test_loss: 0.8129, test_f1: 0.6497
 epoch: 18, train_loss: 0.6215, test_loss: 0.7489, test_f1: 0.6521
 epoch: 19, train_loss: 0.6189, test_loss: 0.7456, test_f1: 0.6445
 epoch: 20, train_loss: 0.6030, test_loss: 0.8063, test_f1: 0.6683
 epoch: 21, train_loss: 0.5742, test_loss: 0.8992, test_f1: 0.6513
 epoch: 22, train_loss: 0.5858, test_loss: 0.8462, test_f1: 0.6674
 epoch: 23, train_loss: 0.5844, test_loss: 0.7983, test_f1: 0.6576
 epoch: 24, train_loss: 0.5696, test_loss: 0.8325, test_f1: 0.6495
 epoch: 25, train_loss: 0.5449, test_loss: 0.8633, test_f1: 0.6789
 epoch: 26, train_loss: 0.5306, test_loss: 0.8031, test_f1: 0.6630
 epoch: 27, train_loss: 0.5337, test_loss: 0.8784, test_f1: 0.6691
 epoch: 28, train_loss: 0.5174, test_loss: 0.9474, test_f1: 0.6543
 epoch: 29, train_loss: 0.5038, test_loss: 0.9219, test_f1: 0.6530
 epoch: 30, train_loss: 0.4956, test_loss: 0.7632, test_f1: 0.6743
 epoch: 31, train_loss: 0.4894, test_loss: 0.9753, test_f1: 0.6420
 epoch: 32, train_loss: 0.4945, test_loss: 0.9892, test_f1: 0.6807
 epoch: 33, train_loss: 0.4813, test_loss: 0.9144, test_f1: 0.6577
 epoch: 34, train_loss: 0.4549, test_loss: 1.0312, test_f1: 0.6518
 epoch: 35, train_loss: 0.4413, test_loss: 1.0667, test_f1: 0.6604
 epoch: 36, train_loss: 0.4449, test_loss: 0.9917, test_f1: 0.6491
 epoch: 37, train_loss: 0.4445, test_loss: 1.1176, test_f1: 0.6627
 epoch: 38, train_loss: 0.4230, test_loss: 1.1554, test_f1: 0.6536
 epoch: 39, train_loss: 0.4148, test_loss: 1.1016, test_f1: 0.6787
 epoch: 40, train_loss: 0.4100, test_loss: 1.1495, test_f1: 0.6596
 epoch: 41, train_loss: 0.3919, test_loss: 1.0950, test_f1: 0.6783
 epoch: 42, train_loss: 0.4075, test_loss: 1.1377, test_f1: 0.6549
 epoch: 43, train_loss: 0.3868, test_loss: 1.0424, test_f1: 0.6781
 epoch: 44, train_loss: 0.3652, test_loss: 1.1952, test_f1: 0.6476
 epoch: 45, train_loss: 0.4179, test_loss: 1.1401, test_f1: 0.6681
 epoch: 46, train_loss: 0.3824, test_loss: 1.1365, test_f1: 0.6770
 epoch: 47, train_loss: 0.3598, test_loss: 1.2234, test_f1: 0.6531
 epoch: 48, train_loss: 0.3516, test_loss: 1.2917, test_f1: 0.6633
 epoch: 49, train_loss: 0.3569, test_loss: 1.2421, test_f1: 0.6647
 epoch: 50, train_loss: 0.3548, test_loss: 1.2359, test_f1: 0.6521
 epoch: 51, train_loss: 0.3122, test_loss: 1.2637, test_f1: 0.6772
 epoch: 52, train_loss: 0.2811, test_loss: 1.2670, test_f1: 0.6891
 epoch: 53, train_loss: 0.2930, test_loss: 1.3694, test_f1: 0.6645
 epoch: 54, train_loss: 0.2645, test_loss: 1.3789, test_f1: 0.6653
 epoch: 55, train_loss: 0.2629, test_loss: 1.4434, test_f1: 0.6537
 epoch: 56, train_loss: 0.2716, test_loss: 1.3751, test_f1: 0.6882
 epoch: 57, train_loss: 0.2735, test_loss: 1.4076, test_f1: 0.6532
 epoch: 58, train_loss: 0.2628, test_loss: 1.4918, test_f1: 0.6800
 epoch: 59, train_loss: 0.2431, test_loss: 1.5808, test_f1: 0.6719
 epoch: 60, train_loss: 0.2756, test_loss: 1.5146, test_f1: 0.6868
 epoch: 61, train_loss: 0.2511, test_loss: 1.5079, test_f1: 0.6707
 epoch: 62, train_loss: 0.2378, test_loss: 1.5166, test_f1: 0.6638
 epoch: 63, train_loss: 0.2371, test_loss: 1.4619, test_f1: 0.6778
 epoch: 64, train_loss: 0.2323, test_loss: 1.5462, test_f1: 0.6717
 epoch: 65, train_loss: 0.2366, test_loss: 1.6061, test_f1: 0.6752
 epoch: 66, train_loss: 0.2280, test_loss: 1.6804, test_f1: 0.6685
 epoch: 67, train_loss: 0.2280, test_loss: 1.5926, test_f1: 0.6699
 epoch: 68, train_loss: 0.2040, test_loss: 1.6684, test_f1: 0.6752
 epoch: 69, train_loss: 0.2266, test_loss: 1.6972, test_f1: 0.6723
 epoch: 70, train_loss: 0.2308, test_loss: 1.7593, test_f1: 0.6792
 epoch: 71, train_loss: 0.2198, test_loss: 1.6655, test_f1: 0.6697
 epoch: 72, train_loss: 0.2021, test_loss: 1.6304, test_f1: 0.6662
 epoch: 73, train_loss: 0.2160, test_loss: 1.6986, test_f1: 0.6751
 epoch: 74, train_loss: 0.2118, test_loss: 1.7550, test_f1: 0.6822
 epoch: 75, train_loss: 0.2037, test_loss: 1.7634, test_f1: 0.6842
 epoch: 76, train_loss: 0.2008, test_loss: 1.7415, test_f1: 0.6778
 epoch: 77, train_loss: 0.2108, test_loss: 1.7545, test_f1: 0.6804
 epoch: 78, train_loss: 0.2072, test_loss: 1.6802, test_f1: 0.6844
 epoch: 79, train_loss: 0.1978, test_loss: 1.7558, test_f1: 0.6933
 epoch: 80, train_loss: 0.1968, test_loss: 1.9225, test_f1: 0.6738
 epoch: 81, train_loss: 0.2018, test_loss: 1.8432, test_f1: 0.6809
 epoch: 82, train_loss: 0.1716, test_loss: 1.8115, test_f1: 0.6719
 epoch: 83, train_loss: 0.2003, test_loss: 1.9513, test_f1: 0.6627
 epoch: 84, train_loss: 0.1708, test_loss: 1.9296, test_f1: 0.6746
 epoch: 85, train_loss: 0.1909, test_loss: 1.8760, test_f1: 0.6673
 epoch: 86, train_loss: 0.1979, test_loss: 1.9818, test_f1: 0.6825
 epoch: 87, train_loss: 0.1771, test_loss: 2.0457, test_f1: 0.6725
 epoch: 88, train_loss: 0.1803, test_loss: 1.9032, test_f1: 0.6705
 epoch: 89, train_loss: 0.1971, test_loss: 1.8526, test_f1: 0.6834
 epoch: 90, train_loss: 0.1721, test_loss: 1.8425, test_f1: 0.6729
 epoch: 91, train_loss: 0.1865, test_loss: 1.9067, test_f1: 0.6772
 epoch: 92, train_loss: 0.1807, test_loss: 1.8712, test_f1: 0.6675
 epoch: 93, train_loss: 0.1591, test_loss: 1.8938, test_f1: 0.6807
 epoch: 94, train_loss: 0.1633, test_loss: 2.0170, test_f1: 0.6732
 epoch: 95, train_loss: 0.1571, test_loss: 1.9788, test_f1: 0.6791
 epoch: 96, train_loss: 0.1602, test_loss: 2.0744, test_f1: 0.6746
 epoch: 97, train_loss: 0.1728, test_loss: 1.9816, test_f1: 0.6843
 epoch: 98, train_loss: 0.1579, test_loss: 2.2045, test_f1: 0.6700
 epoch: 99, train_loss: 0.1726, test_loss: 1.9764, test_f1: 0.6744
##################ITERATION #2 ****************************************
 epoch: 0, train_loss: 1.1359, test_loss: 1.0322, test_f1: 0.4026
 epoch: 1, train_loss: 0.9461, test_loss: 0.8926, test_f1: 0.5457
 epoch: 2, train_loss: 0.9118, test_loss: 0.8968, test_f1: 0.5552
 epoch: 3, train_loss: 0.8753, test_loss: 0.8427, test_f1: 0.5908
 epoch: 4, train_loss: 0.8598, test_loss: 0.8414, test_f1: 0.5712
 epoch: 5, train_loss: 0.8259, test_loss: 0.8269, test_f1: 0.5672
 epoch: 6, train_loss: 0.8137, test_loss: 0.7842, test_f1: 0.6123
 epoch: 7, train_loss: 0.7928, test_loss: 0.8219, test_f1: 0.5782
 epoch: 8, train_loss: 0.7811, test_loss: 0.7787, test_f1: 0.6034
 epoch: 9, train_loss: 0.7551, test_loss: 0.8079, test_f1: 0.6392
 epoch: 10, train_loss: 0.7389, test_loss: 0.7957, test_f1: 0.6510
 epoch: 11, train_loss: 0.7140, test_loss: 0.8270, test_f1: 0.6457
 epoch: 12, train_loss: 0.7091, test_loss: 0.7213, test_f1: 0.6521
 epoch: 13, train_loss: 0.7064, test_loss: 0.7597, test_f1: 0.6397
 epoch: 14, train_loss: 0.6824, test_loss: 0.8532, test_f1: 0.6067
 epoch: 15, train_loss: 0.6783, test_loss: 0.8145, test_f1: 0.6398
 epoch: 16, train_loss: 0.6518, test_loss: 0.7860, test_f1: 0.6463
 epoch: 17, train_loss: 0.6347, test_loss: 0.7884, test_f1: 0.6737
 epoch: 18, train_loss: 0.6258, test_loss: 0.9056, test_f1: 0.6073
 epoch: 19, train_loss: 0.6157, test_loss: 0.8137, test_f1: 0.6603
 epoch: 20, train_loss: 0.6049, test_loss: 0.8297, test_f1: 0.6756
 epoch: 21, train_loss: 0.5940, test_loss: 0.8102, test_f1: 0.6622
 epoch: 22, train_loss: 0.5963, test_loss: 0.7554, test_f1: 0.6600
 epoch: 23, train_loss: 0.5855, test_loss: 0.9041, test_f1: 0.6374
 epoch: 24, train_loss: 0.5549, test_loss: 0.9012, test_f1: 0.6509
 epoch: 25, train_loss: 0.5749, test_loss: 0.9166, test_f1: 0.6511
 epoch: 26, train_loss: 0.5461, test_loss: 0.9379, test_f1: 0.6668
 epoch: 27, train_loss: 0.5330, test_loss: 0.8885, test_f1: 0.6467
 epoch: 28, train_loss: 0.5376, test_loss: 0.9565, test_f1: 0.6831
 epoch: 29, train_loss: 0.5135, test_loss: 0.8718, test_f1: 0.6741
 epoch: 30, train_loss: 0.5150, test_loss: 0.9873, test_f1: 0.6461
 epoch: 31, train_loss: 0.4916, test_loss: 0.9099, test_f1: 0.6630
 epoch: 32, train_loss: 0.4858, test_loss: 0.9562, test_f1: 0.6454
 epoch: 33, train_loss: 0.4780, test_loss: 1.0284, test_f1: 0.6642
 epoch: 34, train_loss: 0.4824, test_loss: 0.9594, test_f1: 0.6669
 epoch: 35, train_loss: 0.4588, test_loss: 1.0239, test_f1: 0.6690
 epoch: 36, train_loss: 0.4592, test_loss: 0.9123, test_f1: 0.6543
 epoch: 37, train_loss: 0.4729, test_loss: 0.9830, test_f1: 0.6682
 epoch: 38, train_loss: 0.4439, test_loss: 1.0229, test_f1: 0.6547
 epoch: 39, train_loss: 0.4148, test_loss: 1.0591, test_f1: 0.6823
 epoch: 40, train_loss: 0.4149, test_loss: 1.1495, test_f1: 0.6617
 epoch: 41, train_loss: 0.4182, test_loss: 1.0665, test_f1: 0.6622
 epoch: 42, train_loss: 0.4050, test_loss: 1.0664, test_f1: 0.6757
 epoch: 43, train_loss: 0.4149, test_loss: 1.1368, test_f1: 0.6690
 epoch: 44, train_loss: 0.3878, test_loss: 1.1370, test_f1: 0.6674
 epoch: 45, train_loss: 0.4153, test_loss: 1.1543, test_f1: 0.6692
 epoch: 46, train_loss: 0.3915, test_loss: 1.1369, test_f1: 0.6693
 epoch: 47, train_loss: 0.4050, test_loss: 1.0751, test_f1: 0.6883
 epoch: 48, train_loss: 0.3670, test_loss: 1.1230, test_f1: 0.6812
 epoch: 49, train_loss: 0.3567, test_loss: 1.1792, test_f1: 0.6896
 epoch: 50, train_loss: 0.3662, test_loss: 1.0515, test_f1: 0.6731
 epoch: 51, train_loss: 0.3170, test_loss: 1.2562, test_f1: 0.6666
 epoch: 52, train_loss: 0.3031, test_loss: 1.1319, test_f1: 0.6962
 epoch: 53, train_loss: 0.2949, test_loss: 1.2012, test_f1: 0.6950
 epoch: 54, train_loss: 0.2839, test_loss: 1.2683, test_f1: 0.6697
 epoch: 55, train_loss: 0.2754, test_loss: 1.2905, test_f1: 0.6866
 epoch: 56, train_loss: 0.2767, test_loss: 1.3850, test_f1: 0.6611
 epoch: 57, train_loss: 0.2685, test_loss: 1.3824, test_f1: 0.6682
 epoch: 58, train_loss: 0.2746, test_loss: 1.3459, test_f1: 0.6911
 epoch: 59, train_loss: 0.2720, test_loss: 1.3254, test_f1: 0.6623
 epoch: 60, train_loss: 0.2620, test_loss: 1.4092, test_f1: 0.6716
 epoch: 61, train_loss: 0.2533, test_loss: 1.3032, test_f1: 0.6945
 epoch: 62, train_loss: 0.2659, test_loss: 1.3647, test_f1: 0.6806
 epoch: 63, train_loss: 0.2628, test_loss: 1.3643, test_f1: 0.6747
 epoch: 64, train_loss: 0.2492, test_loss: 1.4323, test_f1: 0.6707
 epoch: 65, train_loss: 0.2464, test_loss: 1.3903, test_f1: 0.6760
 epoch: 66, train_loss: 0.2380, test_loss: 1.4420, test_f1: 0.6574
 epoch: 67, train_loss: 0.2312, test_loss: 1.4658, test_f1: 0.6826
 epoch: 68, train_loss: 0.2408, test_loss: 1.4194, test_f1: 0.6853
 epoch: 69, train_loss: 0.2428, test_loss: 1.3540, test_f1: 0.6793
 epoch: 70, train_loss: 0.2336, test_loss: 1.4473, test_f1: 0.6856
 epoch: 71, train_loss: 0.2168, test_loss: 1.4340, test_f1: 0.6852
 epoch: 72, train_loss: 0.2174, test_loss: 1.4575, test_f1: 0.6833
 epoch: 73, train_loss: 0.2273, test_loss: 1.6320, test_f1: 0.6778
 epoch: 74, train_loss: 0.2136, test_loss: 1.5276, test_f1: 0.6727
 epoch: 75, train_loss: 0.2052, test_loss: 1.5727, test_f1: 0.6901
 epoch: 76, train_loss: 0.2112, test_loss: 1.4163, test_f1: 0.6798
 epoch: 77, train_loss: 0.2254, test_loss: 1.5392, test_f1: 0.6830
 epoch: 78, train_loss: 0.1964, test_loss: 1.4955, test_f1: 0.6981
 epoch: 79, train_loss: 0.1994, test_loss: 1.5350, test_f1: 0.6847
 epoch: 80, train_loss: 0.2033, test_loss: 1.5577, test_f1: 0.6839
 epoch: 81, train_loss: 0.2156, test_loss: 1.6043, test_f1: 0.6768
 epoch: 82, train_loss: 0.1908, test_loss: 1.7009, test_f1: 0.6758
 epoch: 83, train_loss: 0.1836, test_loss: 1.6791, test_f1: 0.6755
 epoch: 84, train_loss: 0.2024, test_loss: 1.5029, test_f1: 0.6961
 epoch: 85, train_loss: 0.1814, test_loss: 1.6289, test_f1: 0.6822
 epoch: 86, train_loss: 0.1970, test_loss: 1.6326, test_f1: 0.6787
 epoch: 87, train_loss: 0.1919, test_loss: 1.6530, test_f1: 0.6709
 epoch: 88, train_loss: 0.1653, test_loss: 1.6440, test_f1: 0.6803
 epoch: 89, train_loss: 0.1769, test_loss: 1.6600, test_f1: 0.6848
 epoch: 90, train_loss: 0.1845, test_loss: 1.7290, test_f1: 0.6776
 epoch: 91, train_loss: 0.1606, test_loss: 1.6733, test_f1: 0.6801
 epoch: 92, train_loss: 0.1790, test_loss: 1.6174, test_f1: 0.6720
 epoch: 93, train_loss: 0.1914, test_loss: 1.7472, test_f1: 0.6886
 epoch: 94, train_loss: 0.1850, test_loss: 1.6723, test_f1: 0.6702
 epoch: 95, train_loss: 0.1893, test_loss: 1.7157, test_f1: 0.6804
 epoch: 96, train_loss: 0.1653, test_loss: 1.6600, test_f1: 0.6857
 epoch: 97, train_loss: 0.1718, test_loss: 1.7223, test_f1: 0.6887
 epoch: 98, train_loss: 0.1662, test_loss: 1.7330, test_f1: 0.6828
 epoch: 99, train_loss: 0.1640, test_loss: 1.7707, test_f1: 0.6824
##################ITERATION #3 ****************************************
 epoch: 0, train_loss: 1.2245, test_loss: 1.0403, test_f1: 0.4446
 epoch: 1, train_loss: 0.9742, test_loss: 0.9540, test_f1: 0.5347
 epoch: 2, train_loss: 0.9194, test_loss: 0.9139, test_f1: 0.4935
 epoch: 3, train_loss: 0.8865, test_loss: 0.8841, test_f1: 0.5919
 epoch: 4, train_loss: 0.8665, test_loss: 0.8894, test_f1: 0.5998
 epoch: 5, train_loss: 0.8446, test_loss: 0.8442, test_f1: 0.5960
 epoch: 6, train_loss: 0.8207, test_loss: 0.8900, test_f1: 0.5778
 epoch: 7, train_loss: 0.7991, test_loss: 0.7942, test_f1: 0.5840
 epoch: 8, train_loss: 0.7761, test_loss: 0.7814, test_f1: 0.6507
 epoch: 9, train_loss: 0.7660, test_loss: 0.7957, test_f1: 0.6188
 epoch: 10, train_loss: 0.7363, test_loss: 0.7569, test_f1: 0.6358
 epoch: 11, train_loss: 0.7169, test_loss: 0.7632, test_f1: 0.6341
 epoch: 12, train_loss: 0.7078, test_loss: 0.7686, test_f1: 0.6502
 epoch: 13, train_loss: 0.7091, test_loss: 0.7530, test_f1: 0.6671
 epoch: 14, train_loss: 0.6712, test_loss: 0.8285, test_f1: 0.6475
 epoch: 15, train_loss: 0.6779, test_loss: 0.8619, test_f1: 0.6243
 epoch: 16, train_loss: 0.6627, test_loss: 0.8120, test_f1: 0.6462
 epoch: 17, train_loss: 0.6478, test_loss: 0.7786, test_f1: 0.6253
 epoch: 18, train_loss: 0.6315, test_loss: 0.7438, test_f1: 0.6419
 epoch: 19, train_loss: 0.6358, test_loss: 0.8331, test_f1: 0.6633
 epoch: 20, train_loss: 0.6172, test_loss: 0.7191, test_f1: 0.6636
 epoch: 21, train_loss: 0.6009, test_loss: 0.8068, test_f1: 0.6629
 epoch: 22, train_loss: 0.5859, test_loss: 0.8786, test_f1: 0.6433
 epoch: 23, train_loss: 0.5827, test_loss: 0.9056, test_f1: 0.6508
 epoch: 24, train_loss: 0.5476, test_loss: 0.8552, test_f1: 0.6663
 epoch: 25, train_loss: 0.5444, test_loss: 0.8607, test_f1: 0.6608
 epoch: 26, train_loss: 0.5518, test_loss: 0.8567, test_f1: 0.6510
 epoch: 27, train_loss: 0.5221, test_loss: 1.0432, test_f1: 0.6080
 epoch: 28, train_loss: 0.5436, test_loss: 0.7393, test_f1: 0.6829
 epoch: 29, train_loss: 0.5203, test_loss: 0.8772, test_f1: 0.6504
 epoch: 30, train_loss: 0.5137, test_loss: 0.8796, test_f1: 0.6660
 epoch: 31, train_loss: 0.5264, test_loss: 0.9923, test_f1: 0.6549
 epoch: 32, train_loss: 0.4973, test_loss: 0.8948, test_f1: 0.6626
 epoch: 33, train_loss: 0.4792, test_loss: 0.9719, test_f1: 0.6497
 epoch: 34, train_loss: 0.4892, test_loss: 0.8349, test_f1: 0.6418
 epoch: 35, train_loss: 0.4725, test_loss: 1.0957, test_f1: 0.6460
 epoch: 36, train_loss: 0.4575, test_loss: 0.9459, test_f1: 0.6796
 epoch: 37, train_loss: 0.4529, test_loss: 0.8725, test_f1: 0.6627
 epoch: 38, train_loss: 0.4262, test_loss: 1.0124, test_f1: 0.6946
 epoch: 39, train_loss: 0.4261, test_loss: 0.9668, test_f1: 0.6918
 epoch: 40, train_loss: 0.4222, test_loss: 1.0762, test_f1: 0.6648
 epoch: 41, train_loss: 0.4236, test_loss: 0.9645, test_f1: 0.6805
 epoch: 42, train_loss: 0.4075, test_loss: 1.0459, test_f1: 0.6643
 epoch: 43, train_loss: 0.4031, test_loss: 1.1218, test_f1: 0.6622
 epoch: 44, train_loss: 0.3968, test_loss: 0.9970, test_f1: 0.6745
 epoch: 45, train_loss: 0.4187, test_loss: 1.0772, test_f1: 0.6805
 epoch: 46, train_loss: 0.3891, test_loss: 1.0831, test_f1: 0.6701
 epoch: 47, train_loss: 0.3741, test_loss: 1.0659, test_f1: 0.6657
 epoch: 48, train_loss: 0.3666, test_loss: 1.1002, test_f1: 0.6566
 epoch: 49, train_loss: 0.3546, test_loss: 1.2214, test_f1: 0.6570
 epoch: 50, train_loss: 0.3656, test_loss: 1.0341, test_f1: 0.6608
 epoch: 51, train_loss: 0.3391, test_loss: 1.2027, test_f1: 0.6755
 epoch: 52, train_loss: 0.2995, test_loss: 1.1847, test_f1: 0.6906
 epoch: 53, train_loss: 0.3166, test_loss: 1.1985, test_f1: 0.6797
 epoch: 54, train_loss: 0.2815, test_loss: 1.1840, test_f1: 0.6842
 epoch: 55, train_loss: 0.2862, test_loss: 1.2010, test_f1: 0.6781
 epoch: 56, train_loss: 0.2899, test_loss: 1.3227, test_f1: 0.6678
 epoch: 57, train_loss: 0.2797, test_loss: 1.2381, test_f1: 0.6783
 epoch: 58, train_loss: 0.2587, test_loss: 1.2881, test_f1: 0.6781
 epoch: 59, train_loss: 0.2570, test_loss: 1.3093, test_f1: 0.6889
 epoch: 60, train_loss: 0.2460, test_loss: 1.3095, test_f1: 0.6806
 epoch: 61, train_loss: 0.2554, test_loss: 1.4529, test_f1: 0.6716
 epoch: 62, train_loss: 0.2437, test_loss: 1.4245, test_f1: 0.6791
 epoch: 63, train_loss: 0.2602, test_loss: 1.3558, test_f1: 0.6721
 epoch: 64, train_loss: 0.2578, test_loss: 1.3394, test_f1: 0.6845
 epoch: 65, train_loss: 0.2494, test_loss: 1.4517, test_f1: 0.6797
 epoch: 66, train_loss: 0.2419, test_loss: 1.4892, test_f1: 0.6787
 epoch: 67, train_loss: 0.2550, test_loss: 1.3953, test_f1: 0.6839
 epoch: 68, train_loss: 0.2694, test_loss: 1.4034, test_f1: 0.6819
 epoch: 69, train_loss: 0.2291, test_loss: 1.4518, test_f1: 0.6860
 epoch: 70, train_loss: 0.2385, test_loss: 1.4395, test_f1: 0.6785
 epoch: 71, train_loss: 0.2099, test_loss: 1.4848, test_f1: 0.6739
 epoch: 72, train_loss: 0.2324, test_loss: 1.4552, test_f1: 0.6728
 epoch: 73, train_loss: 0.2253, test_loss: 1.4272, test_f1: 0.6707
 epoch: 74, train_loss: 0.2169, test_loss: 1.4356, test_f1: 0.6750
 epoch: 75, train_loss: 0.2197, test_loss: 1.5406, test_f1: 0.6787
 epoch: 76, train_loss: 0.2139, test_loss: 1.5085, test_f1: 0.6701
 epoch: 77, train_loss: 0.2274, test_loss: 1.5149, test_f1: 0.6723
 epoch: 78, train_loss: 0.2156, test_loss: 1.6160, test_f1: 0.6736
 epoch: 79, train_loss: 0.2192, test_loss: 1.5668, test_f1: 0.6847
 epoch: 80, train_loss: 0.2119, test_loss: 1.5997, test_f1: 0.6670
 epoch: 81, train_loss: 0.2162, test_loss: 1.6126, test_f1: 0.6845
 epoch: 82, train_loss: 0.2045, test_loss: 1.6215, test_f1: 0.6733
 epoch: 83, train_loss: 0.2102, test_loss: 1.5282, test_f1: 0.6709
 epoch: 84, train_loss: 0.2290, test_loss: 1.5735, test_f1: 0.6767
 epoch: 85, train_loss: 0.2018, test_loss: 1.4880, test_f1: 0.6964
 epoch: 86, train_loss: 0.1984, test_loss: 1.5148, test_f1: 0.6882
 epoch: 87, train_loss: 0.2156, test_loss: 1.5879, test_f1: 0.6723
 epoch: 88, train_loss: 0.2058, test_loss: 1.6121, test_f1: 0.6822
 epoch: 89, train_loss: 0.1894, test_loss: 1.5230, test_f1: 0.6882
 epoch: 90, train_loss: 0.1896, test_loss: 1.4778, test_f1: 0.6971
 epoch: 91, train_loss: 0.1936, test_loss: 1.6671, test_f1: 0.6817
 epoch: 92, train_loss: 0.2089, test_loss: 1.6428, test_f1: 0.6841
 epoch: 93, train_loss: 0.2042, test_loss: 1.5835, test_f1: 0.6797
 epoch: 94, train_loss: 0.1729, test_loss: 1.6208, test_f1: 0.6762
 epoch: 95, train_loss: 0.2082, test_loss: 1.5315, test_f1: 0.6832
 epoch: 96, train_loss: 0.1746, test_loss: 1.6880, test_f1: 0.6809
 epoch: 97, train_loss: 0.2109, test_loss: 1.6563, test_f1: 0.6895
 epoch: 98, train_loss: 0.1950, test_loss: 1.5821, test_f1: 0.6835
 epoch: 99, train_loss: 0.1983, test_loss: 1.6188, test_f1: 0.6679
##################ITERATION #4 ****************************************
 epoch: 0, train_loss: 1.3060, test_loss: 1.0474, test_f1: 0.4076
 epoch: 1, train_loss: 0.9636, test_loss: 0.8961, test_f1: 0.5107
 epoch: 2, train_loss: 0.9233, test_loss: 0.8952, test_f1: 0.5498
 epoch: 3, train_loss: 0.8969, test_loss: 0.9158, test_f1: 0.5554
 epoch: 4, train_loss: 0.8699, test_loss: 0.8055, test_f1: 0.5997
 epoch: 5, train_loss: 0.8499, test_loss: 0.8719, test_f1: 0.6269
 epoch: 6, train_loss: 0.8145, test_loss: 0.7807, test_f1: 0.6540
 epoch: 7, train_loss: 0.8055, test_loss: 0.7838, test_f1: 0.6146
 epoch: 8, train_loss: 0.7854, test_loss: 0.7727, test_f1: 0.6335
 epoch: 9, train_loss: 0.7744, test_loss: 0.7493, test_f1: 0.6486
 epoch: 10, train_loss: 0.7521, test_loss: 0.7838, test_f1: 0.6414
 epoch: 11, train_loss: 0.7330, test_loss: 0.7853, test_f1: 0.6236
 epoch: 12, train_loss: 0.7118, test_loss: 0.7347, test_f1: 0.6476
 epoch: 13, train_loss: 0.7080, test_loss: 0.7252, test_f1: 0.6640
 epoch: 14, train_loss: 0.6799, test_loss: 0.7247, test_f1: 0.6592
 epoch: 15, train_loss: 0.6668, test_loss: 0.7597, test_f1: 0.6392
 epoch: 16, train_loss: 0.6661, test_loss: 0.7226, test_f1: 0.6748
 epoch: 17, train_loss: 0.6485, test_loss: 0.7695, test_f1: 0.6275
 epoch: 18, train_loss: 0.6263, test_loss: 0.8140, test_f1: 0.6412
 epoch: 19, train_loss: 0.6260, test_loss: 0.7980, test_f1: 0.6733
 epoch: 20, train_loss: 0.6169, test_loss: 0.7683, test_f1: 0.6555
 epoch: 21, train_loss: 0.6232, test_loss: 0.8168, test_f1: 0.6204
 epoch: 22, train_loss: 0.5890, test_loss: 0.8623, test_f1: 0.6399
 epoch: 23, train_loss: 0.5786, test_loss: 0.8455, test_f1: 0.6597
 epoch: 24, train_loss: 0.5748, test_loss: 0.8641, test_f1: 0.6397
 epoch: 25, train_loss: 0.5541, test_loss: 0.7151, test_f1: 0.6587
 epoch: 26, train_loss: 0.5534, test_loss: 0.9314, test_f1: 0.6649
 epoch: 27, train_loss: 0.5310, test_loss: 0.7915, test_f1: 0.6553
 epoch: 28, train_loss: 0.5304, test_loss: 0.8503, test_f1: 0.6936
 epoch: 29, train_loss: 0.5313, test_loss: 0.8354, test_f1: 0.6617
 epoch: 30, train_loss: 0.5262, test_loss: 0.8151, test_f1: 0.6517
 epoch: 31, train_loss: 0.5447, test_loss: 0.8139, test_f1: 0.6937
 epoch: 32, train_loss: 0.4993, test_loss: 0.7579, test_f1: 0.6805
 epoch: 33, train_loss: 0.4981, test_loss: 0.8428, test_f1: 0.6645
 epoch: 34, train_loss: 0.5088, test_loss: 0.8433, test_f1: 0.6716
 epoch: 35, train_loss: 0.4717, test_loss: 1.0101, test_f1: 0.6358
 epoch: 36, train_loss: 0.4656, test_loss: 0.9784, test_f1: 0.6907
 epoch: 37, train_loss: 0.4539, test_loss: 0.9298, test_f1: 0.6707
 epoch: 38, train_loss: 0.4628, test_loss: 0.9200, test_f1: 0.6599
 epoch: 39, train_loss: 0.4374, test_loss: 1.0622, test_f1: 0.6765
 epoch: 40, train_loss: 0.4382, test_loss: 0.9684, test_f1: 0.7111
 epoch: 41, train_loss: 0.4356, test_loss: 0.9797, test_f1: 0.6653
 epoch: 42, train_loss: 0.4082, test_loss: 0.9923, test_f1: 0.6752
 epoch: 43, train_loss: 0.4248, test_loss: 1.1366, test_f1: 0.6735
 epoch: 44, train_loss: 0.4523, test_loss: 0.9500, test_f1: 0.6552
 epoch: 45, train_loss: 0.4139, test_loss: 1.1565, test_f1: 0.6698
 epoch: 46, train_loss: 0.3779, test_loss: 1.0721, test_f1: 0.6771
 epoch: 47, train_loss: 0.3896, test_loss: 1.1413, test_f1: 0.6693
 epoch: 48, train_loss: 0.4052, test_loss: 1.0373, test_f1: 0.7075
 epoch: 49, train_loss: 0.3707, test_loss: 1.1313, test_f1: 0.6772
 epoch: 50, train_loss: 0.3842, test_loss: 1.1434, test_f1: 0.6607
 epoch: 51, train_loss: 0.3239, test_loss: 1.1364, test_f1: 0.6841
 epoch: 52, train_loss: 0.3036, test_loss: 1.1107, test_f1: 0.6820
 epoch: 53, train_loss: 0.3119, test_loss: 1.1003, test_f1: 0.6805
 epoch: 54, train_loss: 0.2901, test_loss: 1.2130, test_f1: 0.6769
 epoch: 55, train_loss: 0.3044, test_loss: 1.1694, test_f1: 0.6768
 epoch: 56, train_loss: 0.2896, test_loss: 1.1980, test_f1: 0.6856
 epoch: 57, train_loss: 0.2883, test_loss: 1.3192, test_f1: 0.6760
 epoch: 58, train_loss: 0.2874, test_loss: 1.2816, test_f1: 0.6745
 epoch: 59, train_loss: 0.2958, test_loss: 1.2965, test_f1: 0.6695
 epoch: 60, train_loss: 0.2825, test_loss: 1.3196, test_f1: 0.6769
 epoch: 61, train_loss: 0.2779, test_loss: 1.3320, test_f1: 0.6728
 epoch: 62, train_loss: 0.2686, test_loss: 1.3209, test_f1: 0.6774
 epoch: 63, train_loss: 0.2717, test_loss: 1.4504, test_f1: 0.6595
 epoch: 64, train_loss: 0.2648, test_loss: 1.3021, test_f1: 0.6772
 epoch: 65, train_loss: 0.2607, test_loss: 1.2990, test_f1: 0.6737
 epoch: 66, train_loss: 0.2583, test_loss: 1.2800, test_f1: 0.6684
 epoch: 67, train_loss: 0.2482, test_loss: 1.3546, test_f1: 0.6604
 epoch: 68, train_loss: 0.2467, test_loss: 1.3961, test_f1: 0.6690
 epoch: 69, train_loss: 0.2610, test_loss: 1.4911, test_f1: 0.6627
 epoch: 70, train_loss: 0.2452, test_loss: 1.3893, test_f1: 0.6562
 epoch: 71, train_loss: 0.2429, test_loss: 1.3993, test_f1: 0.6676
 epoch: 72, train_loss: 0.2353, test_loss: 1.4160, test_f1: 0.6800
 epoch: 73, train_loss: 0.2407, test_loss: 1.4352, test_f1: 0.6496
 epoch: 74, train_loss: 0.2367, test_loss: 1.3605, test_f1: 0.6822
 epoch: 75, train_loss: 0.2336, test_loss: 1.4110, test_f1: 0.6789
 epoch: 76, train_loss: 0.2445, test_loss: 1.4215, test_f1: 0.6727
 epoch: 77, train_loss: 0.2225, test_loss: 1.4425, test_f1: 0.6555
 epoch: 78, train_loss: 0.2345, test_loss: 1.4376, test_f1: 0.6714
 epoch: 79, train_loss: 0.2136, test_loss: 1.4621, test_f1: 0.6617
 epoch: 80, train_loss: 0.2138, test_loss: 1.4509, test_f1: 0.6474
 epoch: 81, train_loss: 0.2121, test_loss: 1.4967, test_f1: 0.6776
 epoch: 82, train_loss: 0.2216, test_loss: 1.5231, test_f1: 0.6578
 epoch: 83, train_loss: 0.2382, test_loss: 1.5697, test_f1: 0.6659
 epoch: 84, train_loss: 0.1951, test_loss: 1.5560, test_f1: 0.6635
 epoch: 85, train_loss: 0.2090, test_loss: 1.5957, test_f1: 0.6577
 epoch: 86, train_loss: 0.2271, test_loss: 1.5600, test_f1: 0.6646
 epoch: 87, train_loss: 0.2005, test_loss: 1.5659, test_f1: 0.6765
 epoch: 88, train_loss: 0.1995, test_loss: 1.4984, test_f1: 0.6706
 epoch: 89, train_loss: 0.2048, test_loss: 1.5392, test_f1: 0.6830
 epoch: 90, train_loss: 0.2050, test_loss: 1.5523, test_f1: 0.6383
 epoch: 91, train_loss: 0.1934, test_loss: 1.5357, test_f1: 0.6402
 epoch: 92, train_loss: 0.1903, test_loss: 1.6416, test_f1: 0.6522
 epoch: 93, train_loss: 0.1933, test_loss: 1.5503, test_f1: 0.7018
 epoch: 94, train_loss: 0.2040, test_loss: 1.6647, test_f1: 0.6780
 epoch: 95, train_loss: 0.2064, test_loss: 1.4864, test_f1: 0.6626
 epoch: 96, train_loss: 0.2108, test_loss: 1.4812, test_f1: 0.6712
 epoch: 97, train_loss: 0.1838, test_loss: 1.6658, test_f1: 0.6769
 epoch: 98, train_loss: 0.1738, test_loss: 1.6625, test_f1: 0.6506
 epoch: 99, train_loss: 0.1721, test_loss: 1.6070, test_f1: 0.6651
##################ITERATION #5 ****************************************
 epoch: 0, train_loss: 1.3661, test_loss: 1.0375, test_f1: 0.4136
 epoch: 1, train_loss: 0.9778, test_loss: 0.8821, test_f1: 0.5310
 epoch: 2, train_loss: 0.9331, test_loss: 0.8739, test_f1: 0.5514
 epoch: 3, train_loss: 0.8970, test_loss: 0.8955, test_f1: 0.5449
 epoch: 4, train_loss: 0.8685, test_loss: 0.8377, test_f1: 0.5424
 epoch: 5, train_loss: 0.8371, test_loss: 0.8374, test_f1: 0.5833
 epoch: 6, train_loss: 0.8260, test_loss: 0.8570, test_f1: 0.6151
 epoch: 7, train_loss: 0.8117, test_loss: 0.8046, test_f1: 0.5765
 epoch: 8, train_loss: 0.7928, test_loss: 0.7955, test_f1: 0.6090
 epoch: 9, train_loss: 0.7648, test_loss: 0.7683, test_f1: 0.6002
 epoch: 10, train_loss: 0.7648, test_loss: 0.7540, test_f1: 0.6174
 epoch: 11, train_loss: 0.7430, test_loss: 0.7666, test_f1: 0.6037
 epoch: 12, train_loss: 0.7379, test_loss: 0.7638, test_f1: 0.6451
 epoch: 13, train_loss: 0.7240, test_loss: 0.7391, test_f1: 0.6402
 epoch: 14, train_loss: 0.7083, test_loss: 0.7603, test_f1: 0.5897
 epoch: 15, train_loss: 0.6938, test_loss: 0.7701, test_f1: 0.6283
 epoch: 16, train_loss: 0.6990, test_loss: 0.7730, test_f1: 0.6105
 epoch: 17, train_loss: 0.6738, test_loss: 0.7379, test_f1: 0.6337
 epoch: 18, train_loss: 0.6565, test_loss: 0.7631, test_f1: 0.6533
 epoch: 19, train_loss: 0.6429, test_loss: 0.7560, test_f1: 0.6258
 epoch: 20, train_loss: 0.6318, test_loss: 0.7604, test_f1: 0.6546
 epoch: 21, train_loss: 0.6217, test_loss: 0.7859, test_f1: 0.6612
 epoch: 22, train_loss: 0.6089, test_loss: 0.7346, test_f1: 0.6411
 epoch: 23, train_loss: 0.5921, test_loss: 0.7918, test_f1: 0.6324
 epoch: 24, train_loss: 0.5894, test_loss: 0.7366, test_f1: 0.6400
 epoch: 25, train_loss: 0.5789, test_loss: 0.7558, test_f1: 0.6639
 epoch: 26, train_loss: 0.5743, test_loss: 0.7955, test_f1: 0.6529
 epoch: 27, train_loss: 0.5618, test_loss: 0.7091, test_f1: 0.6453
 epoch: 28, train_loss: 0.5705, test_loss: 0.7151, test_f1: 0.6804
 epoch: 29, train_loss: 0.5430, test_loss: 0.8113, test_f1: 0.6528
 epoch: 30, train_loss: 0.5496, test_loss: 0.7254, test_f1: 0.6769
 epoch: 31, train_loss: 0.5377, test_loss: 0.7628, test_f1: 0.6708
 epoch: 32, train_loss: 0.5212, test_loss: 0.7946, test_f1: 0.6567
 epoch: 33, train_loss: 0.5302, test_loss: 0.7519, test_f1: 0.6456
 epoch: 34, train_loss: 0.5071, test_loss: 0.8272, test_f1: 0.6491
 epoch: 35, train_loss: 0.5238, test_loss: 0.8178, test_f1: 0.6640
 epoch: 36, train_loss: 0.4819, test_loss: 0.8311, test_f1: 0.6336
 epoch: 37, train_loss: 0.4810, test_loss: 0.8391, test_f1: 0.6438
 epoch: 38, train_loss: 0.4661, test_loss: 0.9088, test_f1: 0.6648
 epoch: 39, train_loss: 0.4724, test_loss: 0.8446, test_f1: 0.6793
 epoch: 40, train_loss: 0.4649, test_loss: 0.7671, test_f1: 0.6677
 epoch: 41, train_loss: 0.4700, test_loss: 0.8582, test_f1: 0.6641
 epoch: 42, train_loss: 0.4571, test_loss: 0.8888, test_f1: 0.6406
 epoch: 43, train_loss: 0.4599, test_loss: 0.8438, test_f1: 0.6495
 epoch: 44, train_loss: 0.4411, test_loss: 0.8075, test_f1: 0.6743
 epoch: 45, train_loss: 0.4628, test_loss: 0.8910, test_f1: 0.6680
 epoch: 46, train_loss: 0.4193, test_loss: 0.8291, test_f1: 0.6716
 epoch: 47, train_loss: 0.4349, test_loss: 0.7743, test_f1: 0.6627
 epoch: 48, train_loss: 0.4063, test_loss: 0.8626, test_f1: 0.6657
 epoch: 49, train_loss: 0.4097, test_loss: 0.8034, test_f1: 0.6748
 epoch: 50, train_loss: 0.3914, test_loss: 0.9582, test_f1: 0.6591
 epoch: 51, train_loss: 0.3833, test_loss: 0.9199, test_f1: 0.6678
 epoch: 52, train_loss: 0.3528, test_loss: 0.9022, test_f1: 0.6759
 epoch: 53, train_loss: 0.3317, test_loss: 0.9302, test_f1: 0.6797
 epoch: 54, train_loss: 0.3260, test_loss: 0.9498, test_f1: 0.6829
 epoch: 55, train_loss: 0.3334, test_loss: 0.9101, test_f1: 0.6873
 epoch: 56, train_loss: 0.3381, test_loss: 0.9231, test_f1: 0.6675
 epoch: 57, train_loss: 0.3198, test_loss: 0.9936, test_f1: 0.6720
 epoch: 58, train_loss: 0.3048, test_loss: 1.0707, test_f1: 0.6594
 epoch: 59, train_loss: 0.3052, test_loss: 1.0247, test_f1: 0.6861
 epoch: 60, train_loss: 0.3071, test_loss: 0.9863, test_f1: 0.6804
 epoch: 61, train_loss: 0.3205, test_loss: 1.0775, test_f1: 0.6656
 epoch: 62, train_loss: 0.2906, test_loss: 1.1167, test_f1: 0.6698
 epoch: 63, train_loss: 0.2810, test_loss: 1.0783, test_f1: 0.6896
 epoch: 64, train_loss: 0.2880, test_loss: 1.0981, test_f1: 0.6719
 epoch: 65, train_loss: 0.3033, test_loss: 1.0912, test_f1: 0.6734
 epoch: 66, train_loss: 0.2784, test_loss: 1.1025, test_f1: 0.6786
 epoch: 67, train_loss: 0.2710, test_loss: 1.1590, test_f1: 0.6648
 epoch: 68, train_loss: 0.2840, test_loss: 1.1450, test_f1: 0.6774
 epoch: 69, train_loss: 0.2916, test_loss: 1.1701, test_f1: 0.6647
 epoch: 70, train_loss: 0.2771, test_loss: 1.0974, test_f1: 0.6705
 epoch: 71, train_loss: 0.2790, test_loss: 1.0395, test_f1: 0.6941
 epoch: 72, train_loss: 0.2610, test_loss: 1.0643, test_f1: 0.6701
 epoch: 73, train_loss: 0.2609, test_loss: 1.2203, test_f1: 0.6687
 epoch: 74, train_loss: 0.2565, test_loss: 1.0841, test_f1: 0.6727
 epoch: 75, train_loss: 0.2582, test_loss: 1.1385, test_f1: 0.6770
 epoch: 76, train_loss: 0.2751, test_loss: 1.0770, test_f1: 0.6875
 epoch: 77, train_loss: 0.2508, test_loss: 1.1626, test_f1: 0.6695
 epoch: 78, train_loss: 0.2615, test_loss: 1.1864, test_f1: 0.6702
 epoch: 79, train_loss: 0.2255, test_loss: 1.2018, test_f1: 0.6670
 epoch: 80, train_loss: 0.2589, test_loss: 1.2660, test_f1: 0.6560
 epoch: 81, train_loss: 0.2651, test_loss: 1.2706, test_f1: 0.6656
 epoch: 82, train_loss: 0.2455, test_loss: 1.2847, test_f1: 0.6767
 epoch: 83, train_loss: 0.2439, test_loss: 1.1645, test_f1: 0.6623
 epoch: 84, train_loss: 0.2360, test_loss: 1.1561, test_f1: 0.6765
 epoch: 85, train_loss: 0.2257, test_loss: 1.3563, test_f1: 0.6612
 epoch: 86, train_loss: 0.2339, test_loss: 1.2577, test_f1: 0.6689
 epoch: 87, train_loss: 0.2239, test_loss: 1.2522, test_f1: 0.6695
 epoch: 88, train_loss: 0.2304, test_loss: 1.3101, test_f1: 0.6625
 epoch: 89, train_loss: 0.2279, test_loss: 1.1994, test_f1: 0.6650
 epoch: 90, train_loss: 0.2434, test_loss: 1.2757, test_f1: 0.6709
 epoch: 91, train_loss: 0.2268, test_loss: 1.2538, test_f1: 0.6703
 epoch: 92, train_loss: 0.2202, test_loss: 1.2486, test_f1: 0.6647
 epoch: 93, train_loss: 0.1980, test_loss: 1.2806, test_f1: 0.6707
 epoch: 94, train_loss: 0.2327, test_loss: 1.3461, test_f1: 0.6593
 epoch: 95, train_loss: 0.2199, test_loss: 1.3933, test_f1: 0.6657
 epoch: 96, train_loss: 0.2311, test_loss: 1.3092, test_f1: 0.6812
 epoch: 97, train_loss: 0.2091, test_loss: 1.2915, test_f1: 0.6621
 epoch: 98, train_loss: 0.2214, test_loss: 1.2549, test_f1: 0.6701
 epoch: 99, train_loss: 0.2017, test_loss: 1.3976, test_f1: 0.6659
##################ITERATION #6 ****************************************
 epoch: 0, train_loss: 1.3146, test_loss: 1.0095, test_f1: 0.4226
 epoch: 1, train_loss: 0.9713, test_loss: 0.9164, test_f1: 0.5121
 epoch: 2, train_loss: 0.9286, test_loss: 0.8885, test_f1: 0.5349
 epoch: 3, train_loss: 0.8840, test_loss: 0.8960, test_f1: 0.5682
 epoch: 4, train_loss: 0.8611, test_loss: 0.8668, test_f1: 0.5840
 epoch: 5, train_loss: 0.8351, test_loss: 0.7926, test_f1: 0.6168
 epoch: 6, train_loss: 0.8254, test_loss: 0.8437, test_f1: 0.5855
 epoch: 7, train_loss: 0.7962, test_loss: 0.8671, test_f1: 0.6477
 epoch: 8, train_loss: 0.7714, test_loss: 0.7881, test_f1: 0.6362
 epoch: 9, train_loss: 0.7587, test_loss: 0.7729, test_f1: 0.6065
 epoch: 10, train_loss: 0.7614, test_loss: 0.7322, test_f1: 0.6523
 epoch: 11, train_loss: 0.7311, test_loss: 0.7952, test_f1: 0.6469
 epoch: 12, train_loss: 0.7010, test_loss: 0.7626, test_f1: 0.6420
 epoch: 13, train_loss: 0.6943, test_loss: 0.8454, test_f1: 0.6147
 epoch: 14, train_loss: 0.6842, test_loss: 0.8894, test_f1: 0.6317
 epoch: 15, train_loss: 0.6725, test_loss: 0.7980, test_f1: 0.6311
 epoch: 16, train_loss: 0.6664, test_loss: 0.7619, test_f1: 0.6572
 epoch: 17, train_loss: 0.6670, test_loss: 0.8200, test_f1: 0.6511
 epoch: 18, train_loss: 0.6418, test_loss: 0.8071, test_f1: 0.6440
 epoch: 19, train_loss: 0.6381, test_loss: 0.7438, test_f1: 0.6650
 epoch: 20, train_loss: 0.6108, test_loss: 0.7942, test_f1: 0.6312
 epoch: 21, train_loss: 0.6187, test_loss: 0.8388, test_f1: 0.6300
 epoch: 22, train_loss: 0.5951, test_loss: 0.7813, test_f1: 0.6615
 epoch: 23, train_loss: 0.5776, test_loss: 0.7637, test_f1: 0.6727
 epoch: 24, train_loss: 0.5822, test_loss: 0.7961, test_f1: 0.6601
 epoch: 25, train_loss: 0.5895, test_loss: 0.8592, test_f1: 0.6518
 epoch: 26, train_loss: 0.5844, test_loss: 0.7576, test_f1: 0.6442
 epoch: 27, train_loss: 0.5534, test_loss: 0.8287, test_f1: 0.6495
 epoch: 28, train_loss: 0.5297, test_loss: 0.8119, test_f1: 0.6490
 epoch: 29, train_loss: 0.5255, test_loss: 0.8374, test_f1: 0.6455
 epoch: 30, train_loss: 0.5236, test_loss: 0.7798, test_f1: 0.6658
 epoch: 31, train_loss: 0.5130, test_loss: 0.8073, test_f1: 0.6479
 epoch: 32, train_loss: 0.5145, test_loss: 0.8428, test_f1: 0.6695
 epoch: 33, train_loss: 0.5091, test_loss: 0.9006, test_f1: 0.6533
 epoch: 34, train_loss: 0.5099, test_loss: 0.7921, test_f1: 0.6631
 epoch: 35, train_loss: 0.4940, test_loss: 0.8849, test_f1: 0.6612
 epoch: 36, train_loss: 0.5015, test_loss: 0.7714, test_f1: 0.6831
 epoch: 37, train_loss: 0.4801, test_loss: 0.7894, test_f1: 0.6445
 epoch: 38, train_loss: 0.4605, test_loss: 0.8823, test_f1: 0.6811
 epoch: 39, train_loss: 0.4611, test_loss: 0.9167, test_f1: 0.6829
 epoch: 40, train_loss: 0.4523, test_loss: 0.9206, test_f1: 0.6744
 epoch: 41, train_loss: 0.4595, test_loss: 0.8638, test_f1: 0.6555
 epoch: 42, train_loss: 0.4475, test_loss: 0.8792, test_f1: 0.6514
 epoch: 43, train_loss: 0.4298, test_loss: 0.9067, test_f1: 0.6602
 epoch: 44, train_loss: 0.4251, test_loss: 1.0036, test_f1: 0.6269
 epoch: 45, train_loss: 0.3959, test_loss: 0.9207, test_f1: 0.6558
 epoch: 46, train_loss: 0.4196, test_loss: 0.8975, test_f1: 0.6956
 epoch: 47, train_loss: 0.3927, test_loss: 0.9992, test_f1: 0.6313
 epoch: 48, train_loss: 0.4018, test_loss: 0.8827, test_f1: 0.6522
 epoch: 49, train_loss: 0.3926, test_loss: 0.8744, test_f1: 0.6777
 epoch: 50, train_loss: 0.4031, test_loss: 0.9748, test_f1: 0.6670
 epoch: 51, train_loss: 0.3673, test_loss: 0.8691, test_f1: 0.6849
 epoch: 52, train_loss: 0.3508, test_loss: 0.9322, test_f1: 0.6720
 epoch: 53, train_loss: 0.3361, test_loss: 0.9655, test_f1: 0.6828
 epoch: 54, train_loss: 0.3176, test_loss: 1.0436, test_f1: 0.6803
 epoch: 55, train_loss: 0.3038, test_loss: 0.9776, test_f1: 0.6886
 epoch: 56, train_loss: 0.2869, test_loss: 1.0242, test_f1: 0.6801
 epoch: 57, train_loss: 0.2931, test_loss: 1.0298, test_f1: 0.6804
 epoch: 58, train_loss: 0.2973, test_loss: 1.0047, test_f1: 0.6769
 epoch: 59, train_loss: 0.2906, test_loss: 1.0197, test_f1: 0.6737
 epoch: 60, train_loss: 0.2988, test_loss: 0.9933, test_f1: 0.6765
 epoch: 61, train_loss: 0.2749, test_loss: 1.0377, test_f1: 0.6760
 epoch: 62, train_loss: 0.2837, test_loss: 1.0189, test_f1: 0.7001
 epoch: 63, train_loss: 0.2911, test_loss: 1.0467, test_f1: 0.6741
 epoch: 64, train_loss: 0.2662, test_loss: 1.0191, test_f1: 0.6854
 epoch: 65, train_loss: 0.2767, test_loss: 1.0210, test_f1: 0.6993
 epoch: 66, train_loss: 0.2760, test_loss: 0.9968, test_f1: 0.6696
 epoch: 67, train_loss: 0.2448, test_loss: 1.0605, test_f1: 0.6955
 epoch: 68, train_loss: 0.2805, test_loss: 1.0474, test_f1: 0.6540
 epoch: 69, train_loss: 0.2452, test_loss: 0.9789, test_f1: 0.6791
 epoch: 70, train_loss: 0.2665, test_loss: 0.9660, test_f1: 0.7001
 epoch: 71, train_loss: 0.2757, test_loss: 1.0851, test_f1: 0.6656
 epoch: 72, train_loss: 0.2623, test_loss: 1.0111, test_f1: 0.6721
 epoch: 73, train_loss: 0.2681, test_loss: 1.0600, test_f1: 0.6946
 epoch: 74, train_loss: 0.2636, test_loss: 1.0203, test_f1: 0.6925
 epoch: 75, train_loss: 0.2535, test_loss: 1.0305, test_f1: 0.6764
 epoch: 76, train_loss: 0.2420, test_loss: 1.0850, test_f1: 0.6778
 epoch: 77, train_loss: 0.2438, test_loss: 1.1393, test_f1: 0.6914
 epoch: 78, train_loss: 0.2248, test_loss: 1.0834, test_f1: 0.6794
 epoch: 79, train_loss: 0.2414, test_loss: 1.0654, test_f1: 0.6818
 epoch: 80, train_loss: 0.2576, test_loss: 0.9986, test_f1: 0.6876
 epoch: 81, train_loss: 0.2546, test_loss: 1.0516, test_f1: 0.6894
 epoch: 82, train_loss: 0.2456, test_loss: 1.0859, test_f1: 0.6776
 epoch: 83, train_loss: 0.2251, test_loss: 1.1440, test_f1: 0.6977
 epoch: 84, train_loss: 0.2198, test_loss: 1.0884, test_f1: 0.7012
 epoch: 85, train_loss: 0.2165, test_loss: 1.1283, test_f1: 0.6751
 epoch: 86, train_loss: 0.2294, test_loss: 1.1389, test_f1: 0.6890
 epoch: 87, train_loss: 0.2217, test_loss: 1.0790, test_f1: 0.6857
 epoch: 88, train_loss: 0.2115, test_loss: 1.0750, test_f1: 0.6777
 epoch: 89, train_loss: 0.2040, test_loss: 1.1771, test_f1: 0.6917
 epoch: 90, train_loss: 0.2176, test_loss: 1.1409, test_f1: 0.6818
 epoch: 91, train_loss: 0.2269, test_loss: 1.2573, test_f1: 0.6498
 epoch: 92, train_loss: 0.2042, test_loss: 1.1229, test_f1: 0.6740
 epoch: 93, train_loss: 0.2006, test_loss: 1.1434, test_f1: 0.6538
 epoch: 94, train_loss: 0.2109, test_loss: 1.1950, test_f1: 0.6451
 epoch: 95, train_loss: 0.1994, test_loss: 1.1599, test_f1: 0.6722
 epoch: 96, train_loss: 0.2112, test_loss: 1.2538, test_f1: 0.6841
 epoch: 97, train_loss: 0.2147, test_loss: 1.2374, test_f1: 0.6842
 epoch: 98, train_loss: 0.2238, test_loss: 1.1757, test_f1: 0.6811
 epoch: 99, train_loss: 0.1925, test_loss: 1.3468, test_f1: 0.6529
##################ITERATION #7 ****************************************
 epoch: 0, train_loss: 1.3274, test_loss: 1.0945, test_f1: 0.3897
 epoch: 1, train_loss: 0.9941, test_loss: 0.9317, test_f1: 0.5367
 epoch: 2, train_loss: 0.9502, test_loss: 0.9004, test_f1: 0.5455
 epoch: 3, train_loss: 0.9154, test_loss: 0.9075, test_f1: 0.5512
 epoch: 4, train_loss: 0.8978, test_loss: 0.9143, test_f1: 0.5070
 epoch: 5, train_loss: 0.8728, test_loss: 0.8653, test_f1: 0.5699
 epoch: 6, train_loss: 0.8493, test_loss: 0.8707, test_f1: 0.5643
 epoch: 7, train_loss: 0.8354, test_loss: 0.7940, test_f1: 0.6153
 epoch: 8, train_loss: 0.8201, test_loss: 0.8617, test_f1: 0.5982
 epoch: 9, train_loss: 0.8027, test_loss: 0.8180, test_f1: 0.5687
 epoch: 10, train_loss: 0.7835, test_loss: 0.8653, test_f1: 0.6350
 epoch: 11, train_loss: 0.7587, test_loss: 0.7479, test_f1: 0.6305
 epoch: 12, train_loss: 0.7510, test_loss: 0.7369, test_f1: 0.6203
 epoch: 13, train_loss: 0.7337, test_loss: 0.8471, test_f1: 0.6368
 epoch: 14, train_loss: 0.7292, test_loss: 0.7903, test_f1: 0.6333
 epoch: 15, train_loss: 0.6854, test_loss: 0.8364, test_f1: 0.6311
 epoch: 16, train_loss: 0.6947, test_loss: 0.7193, test_f1: 0.6344
 epoch: 17, train_loss: 0.6709, test_loss: 0.8424, test_f1: 0.6177
 epoch: 18, train_loss: 0.6656, test_loss: 0.8102, test_f1: 0.6385
 epoch: 19, train_loss: 0.6567, test_loss: 0.8404, test_f1: 0.6304
 epoch: 20, train_loss: 0.6608, test_loss: 0.7642, test_f1: 0.6631
 epoch: 21, train_loss: 0.6540, test_loss: 0.8123, test_f1: 0.6504
 epoch: 22, train_loss: 0.6362, test_loss: 0.7675, test_f1: 0.6037
 epoch: 23, train_loss: 0.6322, test_loss: 0.8766, test_f1: 0.6203
 epoch: 24, train_loss: 0.6141, test_loss: 0.7573, test_f1: 0.6399
 epoch: 25, train_loss: 0.5857, test_loss: 0.7669, test_f1: 0.6462
 epoch: 26, train_loss: 0.5816, test_loss: 0.7779, test_f1: 0.6484
 epoch: 27, train_loss: 0.6115, test_loss: 0.7820, test_f1: 0.6162
 epoch: 28, train_loss: 0.5523, test_loss: 0.7600, test_f1: 0.6547
 epoch: 29, train_loss: 0.5463, test_loss: 0.9854, test_f1: 0.5808
 epoch: 30, train_loss: 0.5367, test_loss: 0.8103, test_f1: 0.6113
 epoch: 31, train_loss: 0.5278, test_loss: 0.8983, test_f1: 0.6329
 epoch: 32, train_loss: 0.5319, test_loss: 0.8551, test_f1: 0.6284
 epoch: 33, train_loss: 0.5033, test_loss: 0.9446, test_f1: 0.6788
 epoch: 34, train_loss: 0.5188, test_loss: 0.8298, test_f1: 0.6442
 epoch: 35, train_loss: 0.5057, test_loss: 0.8332, test_f1: 0.6300
 epoch: 36, train_loss: 0.4958, test_loss: 0.8357, test_f1: 0.6333
 epoch: 37, train_loss: 0.4933, test_loss: 0.8224, test_f1: 0.6738
 epoch: 38, train_loss: 0.4782, test_loss: 0.9359, test_f1: 0.6321
 epoch: 39, train_loss: 0.4572, test_loss: 0.9324, test_f1: 0.6502
 epoch: 40, train_loss: 0.4715, test_loss: 0.9344, test_f1: 0.6538
 epoch: 41, train_loss: 0.4591, test_loss: 0.8178, test_f1: 0.6672
 epoch: 42, train_loss: 0.4538, test_loss: 0.9180, test_f1: 0.6338
 epoch: 43, train_loss: 0.4499, test_loss: 0.8518, test_f1: 0.6670
 epoch: 44, train_loss: 0.4250, test_loss: 0.9660, test_f1: 0.6769
 epoch: 45, train_loss: 0.4386, test_loss: 1.0673, test_f1: 0.6535
 epoch: 46, train_loss: 0.4101, test_loss: 0.9481, test_f1: 0.6702
 epoch: 47, train_loss: 0.4093, test_loss: 0.8951, test_f1: 0.6750
 epoch: 48, train_loss: 0.4198, test_loss: 0.9715, test_f1: 0.6669
 epoch: 49, train_loss: 0.3879, test_loss: 1.0215, test_f1: 0.6454
 epoch: 50, train_loss: 0.3989, test_loss: 0.8678, test_f1: 0.6882
 epoch: 51, train_loss: 0.3593, test_loss: 0.9239, test_f1: 0.6908
 epoch: 52, train_loss: 0.3384, test_loss: 0.9800, test_f1: 0.6894
 epoch: 53, train_loss: 0.3428, test_loss: 0.9672, test_f1: 0.6762
 epoch: 54, train_loss: 0.3279, test_loss: 1.0115, test_f1: 0.6768
 epoch: 55, train_loss: 0.3284, test_loss: 1.0012, test_f1: 0.6881
 epoch: 56, train_loss: 0.3162, test_loss: 1.1008, test_f1: 0.6812
 epoch: 57, train_loss: 0.3204, test_loss: 0.9367, test_f1: 0.6720
 epoch: 58, train_loss: 0.3057, test_loss: 0.9861, test_f1: 0.6846
 epoch: 59, train_loss: 0.2909, test_loss: 0.9553, test_f1: 0.6762
 epoch: 60, train_loss: 0.3078, test_loss: 0.9487, test_f1: 0.6896
 epoch: 61, train_loss: 0.3110, test_loss: 1.0801, test_f1: 0.6810
 epoch: 62, train_loss: 0.3118, test_loss: 1.0897, test_f1: 0.6672
 epoch: 63, train_loss: 0.2972, test_loss: 1.1695, test_f1: 0.6950
 epoch: 64, train_loss: 0.3049, test_loss: 1.0972, test_f1: 0.6875
 epoch: 65, train_loss: 0.2809, test_loss: 1.1331, test_f1: 0.6649
 epoch: 66, train_loss: 0.2661, test_loss: 1.2955, test_f1: 0.6553
 epoch: 67, train_loss: 0.2678, test_loss: 1.1124, test_f1: 0.6811
 epoch: 68, train_loss: 0.2871, test_loss: 1.2387, test_f1: 0.6528
 epoch: 69, train_loss: 0.2726, test_loss: 1.1722, test_f1: 0.6635
 epoch: 70, train_loss: 0.2532, test_loss: 1.2803, test_f1: 0.6559
 epoch: 71, train_loss: 0.2618, test_loss: 1.2099, test_f1: 0.6788
 epoch: 72, train_loss: 0.2585, test_loss: 1.2767, test_f1: 0.6836
 epoch: 73, train_loss: 0.2526, test_loss: 1.1934, test_f1: 0.6964
 epoch: 74, train_loss: 0.2747, test_loss: 1.2014, test_f1: 0.6772
 epoch: 75, train_loss: 0.2610, test_loss: 1.1864, test_f1: 0.6842
 epoch: 76, train_loss: 0.2459, test_loss: 1.2456, test_f1: 0.6691
 epoch: 77, train_loss: 0.2464, test_loss: 1.1726, test_f1: 0.6704
 epoch: 78, train_loss: 0.2499, test_loss: 1.1557, test_f1: 0.6766
 epoch: 79, train_loss: 0.2243, test_loss: 1.1740, test_f1: 0.6662
 epoch: 80, train_loss: 0.2342, test_loss: 1.1785, test_f1: 0.6765
 epoch: 81, train_loss: 0.2367, test_loss: 1.2914, test_f1: 0.6683
 epoch: 82, train_loss: 0.2384, test_loss: 1.1927, test_f1: 0.6700
 epoch: 83, train_loss: 0.2473, test_loss: 1.1212, test_f1: 0.6516
 epoch: 84, train_loss: 0.2289, test_loss: 1.2306, test_f1: 0.6691
 epoch: 85, train_loss: 0.2222, test_loss: 1.3549, test_f1: 0.6626
 epoch: 86, train_loss: 0.2375, test_loss: 1.2109, test_f1: 0.6755
 epoch: 87, train_loss: 0.2198, test_loss: 1.2148, test_f1: 0.6711
 epoch: 88, train_loss: 0.2151, test_loss: 1.2685, test_f1: 0.6767
 epoch: 89, train_loss: 0.2180, test_loss: 1.3557, test_f1: 0.6510
 epoch: 90, train_loss: 0.2339, test_loss: 1.4124, test_f1: 0.6591
 epoch: 91, train_loss: 0.2218, test_loss: 1.3148, test_f1: 0.6532
 epoch: 92, train_loss: 0.2204, test_loss: 1.3232, test_f1: 0.6642
 epoch: 93, train_loss: 0.2015, test_loss: 1.3479, test_f1: 0.6568
 epoch: 94, train_loss: 0.1993, test_loss: 1.4589, test_f1: 0.6580
 epoch: 95, train_loss: 0.1961, test_loss: 1.3673, test_f1: 0.6580
 epoch: 96, train_loss: 0.2172, test_loss: 1.2827, test_f1: 0.6543
 epoch: 97, train_loss: 0.2062, test_loss: 1.3836, test_f1: 0.6791
 epoch: 98, train_loss: 0.1881, test_loss: 1.3892, test_f1: 0.6691
 epoch: 99, train_loss: 0.1943, test_loss: 1.4482, test_f1: 0.6569
##################ITERATION #8 ****************************************
 epoch: 0, train_loss: 1.3414, test_loss: 1.0098, test_f1: 0.4516
 epoch: 1, train_loss: 0.9730, test_loss: 0.9340, test_f1: 0.4949
 epoch: 2, train_loss: 0.9407, test_loss: 0.8958, test_f1: 0.5553
 epoch: 3, train_loss: 0.8932, test_loss: 0.8395, test_f1: 0.6258
 epoch: 4, train_loss: 0.8682, test_loss: 0.8291, test_f1: 0.5564
 epoch: 5, train_loss: 0.8372, test_loss: 0.8219, test_f1: 0.6128
 epoch: 6, train_loss: 0.8191, test_loss: 0.8174, test_f1: 0.5868
 epoch: 7, train_loss: 0.7993, test_loss: 0.8230, test_f1: 0.6288
 epoch: 8, train_loss: 0.7799, test_loss: 0.8737, test_f1: 0.6055
 epoch: 9, train_loss: 0.7632, test_loss: 0.8129, test_f1: 0.6165
 epoch: 10, train_loss: 0.7483, test_loss: 0.8045, test_f1: 0.6186
 epoch: 11, train_loss: 0.7265, test_loss: 0.8149, test_f1: 0.6606
 epoch: 12, train_loss: 0.7060, test_loss: 0.7875, test_f1: 0.6125
 epoch: 13, train_loss: 0.6911, test_loss: 0.7100, test_f1: 0.6778
 epoch: 14, train_loss: 0.6973, test_loss: 0.7398, test_f1: 0.6733
 epoch: 15, train_loss: 0.6710, test_loss: 0.8372, test_f1: 0.6019
 epoch: 16, train_loss: 0.6632, test_loss: 0.8042, test_f1: 0.6502
 epoch: 17, train_loss: 0.6605, test_loss: 0.7566, test_f1: 0.6811
 epoch: 18, train_loss: 0.6404, test_loss: 0.7489, test_f1: 0.6383
 epoch: 19, train_loss: 0.6173, test_loss: 0.8631, test_f1: 0.6115
 epoch: 20, train_loss: 0.6085, test_loss: 0.7908, test_f1: 0.6087
 epoch: 21, train_loss: 0.6017, test_loss: 0.7676, test_f1: 0.6339
 epoch: 22, train_loss: 0.5943, test_loss: 0.7624, test_f1: 0.6406
 epoch: 23, train_loss: 0.5705, test_loss: 0.8580, test_f1: 0.6275
 epoch: 24, train_loss: 0.5747, test_loss: 0.8095, test_f1: 0.6462
 epoch: 25, train_loss: 0.5588, test_loss: 0.8600, test_f1: 0.6507
 epoch: 26, train_loss: 0.5603, test_loss: 0.8658, test_f1: 0.6591
 epoch: 27, train_loss: 0.5424, test_loss: 0.8290, test_f1: 0.6714
 epoch: 28, train_loss: 0.5339, test_loss: 0.8906, test_f1: 0.6194
 epoch: 29, train_loss: 0.5266, test_loss: 0.7953, test_f1: 0.6238
 epoch: 30, train_loss: 0.5211, test_loss: 0.7684, test_f1: 0.6580
 epoch: 31, train_loss: 0.5096, test_loss: 0.9318, test_f1: 0.6571
 epoch: 32, train_loss: 0.4986, test_loss: 0.8806, test_f1: 0.6430
 epoch: 33, train_loss: 0.4729, test_loss: 0.8951, test_f1: 0.6181
 epoch: 34, train_loss: 0.5130, test_loss: 0.8048, test_f1: 0.6573
 epoch: 35, train_loss: 0.4833, test_loss: 0.8866, test_f1: 0.6641
 epoch: 36, train_loss: 0.4855, test_loss: 0.8353, test_f1: 0.6626
 epoch: 37, train_loss: 0.4583, test_loss: 0.8986, test_f1: 0.6356
 epoch: 38, train_loss: 0.4596, test_loss: 0.8692, test_f1: 0.6299
 epoch: 39, train_loss: 0.4369, test_loss: 1.0016, test_f1: 0.6687
 epoch: 40, train_loss: 0.4449, test_loss: 0.8787, test_f1: 0.6668
 epoch: 41, train_loss: 0.4353, test_loss: 0.8728, test_f1: 0.6590
 epoch: 42, train_loss: 0.4179, test_loss: 0.9487, test_f1: 0.6431
 epoch: 43, train_loss: 0.4377, test_loss: 0.9374, test_f1: 0.6546
 epoch: 44, train_loss: 0.4329, test_loss: 0.9412, test_f1: 0.6277
 epoch: 45, train_loss: 0.4077, test_loss: 0.9875, test_f1: 0.6715
 epoch: 46, train_loss: 0.4036, test_loss: 0.8844, test_f1: 0.6747
 epoch: 47, train_loss: 0.3970, test_loss: 0.9384, test_f1: 0.6830
 epoch: 48, train_loss: 0.3988, test_loss: 0.9043, test_f1: 0.6825
 epoch: 49, train_loss: 0.3832, test_loss: 0.9320, test_f1: 0.6716
 epoch: 50, train_loss: 0.4152, test_loss: 0.9026, test_f1: 0.6545
 epoch: 51, train_loss: 0.3443, test_loss: 0.9455, test_f1: 0.6649
 epoch: 52, train_loss: 0.3169, test_loss: 0.9837, test_f1: 0.6629
 epoch: 53, train_loss: 0.3229, test_loss: 0.9736, test_f1: 0.6920
 epoch: 54, train_loss: 0.3092, test_loss: 1.0749, test_f1: 0.6773
 epoch: 55, train_loss: 0.3035, test_loss: 1.0395, test_f1: 0.6797
 epoch: 56, train_loss: 0.3039, test_loss: 1.0092, test_f1: 0.6708
 epoch: 57, train_loss: 0.2810, test_loss: 1.0449, test_f1: 0.6784
 epoch: 58, train_loss: 0.3029, test_loss: 1.0609, test_f1: 0.6675
 epoch: 59, train_loss: 0.2811, test_loss: 1.1320, test_f1: 0.6595
 epoch: 60, train_loss: 0.3023, test_loss: 1.0562, test_f1: 0.6697
 epoch: 61, train_loss: 0.2812, test_loss: 1.1232, test_f1: 0.6613
 epoch: 62, train_loss: 0.2592, test_loss: 1.1505, test_f1: 0.6576
 epoch: 63, train_loss: 0.2609, test_loss: 1.2198, test_f1: 0.6428
 epoch: 64, train_loss: 0.2692, test_loss: 1.1557, test_f1: 0.6474
 epoch: 65, train_loss: 0.2687, test_loss: 1.0821, test_f1: 0.6574
 epoch: 66, train_loss: 0.2590, test_loss: 1.2057, test_f1: 0.6567
 epoch: 67, train_loss: 0.2555, test_loss: 1.1683, test_f1: 0.6508
 epoch: 68, train_loss: 0.2571, test_loss: 1.2109, test_f1: 0.6640
 epoch: 69, train_loss: 0.2490, test_loss: 1.1934, test_f1: 0.6453
 epoch: 70, train_loss: 0.2410, test_loss: 1.0995, test_f1: 0.6679
 epoch: 71, train_loss: 0.2586, test_loss: 1.1199, test_f1: 0.6670
 epoch: 72, train_loss: 0.2398, test_loss: 1.2011, test_f1: 0.6557
 epoch: 73, train_loss: 0.2482, test_loss: 1.2658, test_f1: 0.6206
 epoch: 74, train_loss: 0.2407, test_loss: 1.2030, test_f1: 0.6586
 epoch: 75, train_loss: 0.2612, test_loss: 1.1433, test_f1: 0.6892
 epoch: 76, train_loss: 0.2401, test_loss: 1.2024, test_f1: 0.6648
 epoch: 77, train_loss: 0.2460, test_loss: 1.2417, test_f1: 0.6773
 epoch: 78, train_loss: 0.2227, test_loss: 1.1911, test_f1: 0.6707
 epoch: 79, train_loss: 0.2294, test_loss: 1.2304, test_f1: 0.6404
 epoch: 80, train_loss: 0.2185, test_loss: 1.2573, test_f1: 0.6535
 epoch: 81, train_loss: 0.2228, test_loss: 1.2099, test_f1: 0.6680
 epoch: 82, train_loss: 0.2267, test_loss: 1.2379, test_f1: 0.6394
 epoch: 83, train_loss: 0.2133, test_loss: 1.1375, test_f1: 0.6552
 epoch: 84, train_loss: 0.2323, test_loss: 1.2682, test_f1: 0.6460
 epoch: 85, train_loss: 0.2233, test_loss: 1.2741, test_f1: 0.6568
 epoch: 86, train_loss: 0.2224, test_loss: 1.4137, test_f1: 0.6316
 epoch: 87, train_loss: 0.2193, test_loss: 1.2631, test_f1: 0.6596
 epoch: 88, train_loss: 0.2103, test_loss: 1.3686, test_f1: 0.6450
 epoch: 89, train_loss: 0.2091, test_loss: 1.2907, test_f1: 0.6491
 epoch: 90, train_loss: 0.1982, test_loss: 1.3766, test_f1: 0.6533
 epoch: 91, train_loss: 0.1917, test_loss: 1.4001, test_f1: 0.6403
 epoch: 92, train_loss: 0.2034, test_loss: 1.3799, test_f1: 0.6580
 epoch: 93, train_loss: 0.1973, test_loss: 1.3239, test_f1: 0.6430
 epoch: 94, train_loss: 0.1966, test_loss: 1.3912, test_f1: 0.6519
 epoch: 95, train_loss: 0.1966, test_loss: 1.3471, test_f1: 0.6503
 epoch: 96, train_loss: 0.1905, test_loss: 1.4050, test_f1: 0.6494
 epoch: 97, train_loss: 0.1760, test_loss: 1.4094, test_f1: 0.6559
 epoch: 98, train_loss: 0.1955, test_loss: 1.4897, test_f1: 0.6508
 epoch: 99, train_loss: 0.2209, test_loss: 1.4503, test_f1: 0.6574
##################ITERATION #9 ****************************************
 epoch: 0, train_loss: 1.3670, test_loss: 1.1265, test_f1: 0.4262
 epoch: 1, train_loss: 0.9926, test_loss: 0.9348, test_f1: 0.5179
 epoch: 2, train_loss: 0.9595, test_loss: 0.8976, test_f1: 0.5556
 epoch: 3, train_loss: 0.9305, test_loss: 0.8940, test_f1: 0.5392
 epoch: 4, train_loss: 0.8986, test_loss: 0.9011, test_f1: 0.5635
 epoch: 5, train_loss: 0.8803, test_loss: 0.8832, test_f1: 0.5798
 epoch: 6, train_loss: 0.8400, test_loss: 0.8566, test_f1: 0.5674
 epoch: 7, train_loss: 0.8260, test_loss: 0.8468, test_f1: 0.5868
 epoch: 8, train_loss: 0.7915, test_loss: 0.8028, test_f1: 0.6090
 epoch: 9, train_loss: 0.7807, test_loss: 0.8234, test_f1: 0.5845
 epoch: 10, train_loss: 0.7678, test_loss: 0.7834, test_f1: 0.6533
 epoch: 11, train_loss: 0.7511, test_loss: 0.8274, test_f1: 0.6255
 epoch: 12, train_loss: 0.7212, test_loss: 0.7399, test_f1: 0.6645
 epoch: 13, train_loss: 0.7261, test_loss: 0.7693, test_f1: 0.6239
 epoch: 14, train_loss: 0.6859, test_loss: 0.7752, test_f1: 0.6238
 epoch: 15, train_loss: 0.7073, test_loss: 0.7403, test_f1: 0.6301
 epoch: 16, train_loss: 0.6597, test_loss: 0.7157, test_f1: 0.6704
 epoch: 17, train_loss: 0.6780, test_loss: 0.7889, test_f1: 0.6421
 epoch: 18, train_loss: 0.6373, test_loss: 0.7804, test_f1: 0.6698
 epoch: 19, train_loss: 0.6586, test_loss: 0.7395, test_f1: 0.6621
 epoch: 20, train_loss: 0.6449, test_loss: 0.7839, test_f1: 0.6596
 epoch: 21, train_loss: 0.6075, test_loss: 0.7872, test_f1: 0.6464
 epoch: 22, train_loss: 0.5924, test_loss: 0.7566, test_f1: 0.6704
 epoch: 23, train_loss: 0.6008, test_loss: 0.8004, test_f1: 0.6623
 epoch: 24, train_loss: 0.6007, test_loss: 0.7673, test_f1: 0.6489
 epoch: 25, train_loss: 0.6068, test_loss: 0.7789, test_f1: 0.6448
 epoch: 26, train_loss: 0.5720, test_loss: 0.7935, test_f1: 0.6402
 epoch: 27, train_loss: 0.5817, test_loss: 0.7726, test_f1: 0.6320
 epoch: 28, train_loss: 0.5453, test_loss: 0.8291, test_f1: 0.6616
 epoch: 29, train_loss: 0.5481, test_loss: 0.8845, test_f1: 0.6457
 epoch: 30, train_loss: 0.5392, test_loss: 0.8183, test_f1: 0.6784
 epoch: 31, train_loss: 0.5130, test_loss: 0.8328, test_f1: 0.6538
 epoch: 32, train_loss: 0.5445, test_loss: 0.8187, test_f1: 0.6483
 epoch: 33, train_loss: 0.4937, test_loss: 0.8559, test_f1: 0.6434
 epoch: 34, train_loss: 0.5003, test_loss: 0.9669, test_f1: 0.6566
 epoch: 35, train_loss: 0.5088, test_loss: 0.8915, test_f1: 0.6458
 epoch: 36, train_loss: 0.4909, test_loss: 0.8819, test_f1: 0.6449
 epoch: 37, train_loss: 0.4717, test_loss: 0.8688, test_f1: 0.6494
 epoch: 38, train_loss: 0.4593, test_loss: 1.0477, test_f1: 0.6527
 epoch: 39, train_loss: 0.4743, test_loss: 0.8500, test_f1: 0.6938
 epoch: 40, train_loss: 0.4703, test_loss: 0.9075, test_f1: 0.6661
 epoch: 41, train_loss: 0.4307, test_loss: 0.8797, test_f1: 0.6968
 epoch: 42, train_loss: 0.4431, test_loss: 0.9380, test_f1: 0.6704
 epoch: 43, train_loss: 0.4209, test_loss: 0.9373, test_f1: 0.6796
 epoch: 44, train_loss: 0.4278, test_loss: 0.8561, test_f1: 0.6602
 epoch: 45, train_loss: 0.4076, test_loss: 0.9535, test_f1: 0.6617
 epoch: 46, train_loss: 0.4174, test_loss: 0.9144, test_f1: 0.6879
 epoch: 47, train_loss: 0.4144, test_loss: 0.9692, test_f1: 0.6652
 epoch: 48, train_loss: 0.4108, test_loss: 0.9819, test_f1: 0.6868
 epoch: 49, train_loss: 0.4149, test_loss: 0.9946, test_f1: 0.6698
 epoch: 50, train_loss: 0.3890, test_loss: 0.9085, test_f1: 0.6706
 epoch: 51, train_loss: 0.3652, test_loss: 0.9585, test_f1: 0.6835
 epoch: 52, train_loss: 0.3451, test_loss: 0.9734, test_f1: 0.6723
 epoch: 53, train_loss: 0.3101, test_loss: 1.0477, test_f1: 0.6913
 epoch: 54, train_loss: 0.3076, test_loss: 1.0980, test_f1: 0.6820
 epoch: 55, train_loss: 0.3117, test_loss: 1.0509, test_f1: 0.6830
 epoch: 56, train_loss: 0.2921, test_loss: 1.0861, test_f1: 0.6885
 epoch: 57, train_loss: 0.2989, test_loss: 1.1063, test_f1: 0.6905
 epoch: 58, train_loss: 0.3020, test_loss: 1.1459, test_f1: 0.6865
 epoch: 59, train_loss: 0.2959, test_loss: 1.2057, test_f1: 0.6792
 epoch: 60, train_loss: 0.2915, test_loss: 1.1867, test_f1: 0.6754
 epoch: 61, train_loss: 0.3034, test_loss: 1.1320, test_f1: 0.6883
 epoch: 62, train_loss: 0.2869, test_loss: 1.1672, test_f1: 0.6790
 epoch: 63, train_loss: 0.2690, test_loss: 1.2409, test_f1: 0.6724
 epoch: 64, train_loss: 0.2756, test_loss: 1.2032, test_f1: 0.6852
 epoch: 65, train_loss: 0.2710, test_loss: 1.2399, test_f1: 0.6875
 epoch: 66, train_loss: 0.2820, test_loss: 1.1534, test_f1: 0.7063
 epoch: 67, train_loss: 0.2806, test_loss: 1.2041, test_f1: 0.6718
 epoch: 68, train_loss: 0.2656, test_loss: 1.1243, test_f1: 0.6856
 epoch: 69, train_loss: 0.2474, test_loss: 1.2431, test_f1: 0.6795
 epoch: 70, train_loss: 0.2532, test_loss: 1.2088, test_f1: 0.6832
 epoch: 71, train_loss: 0.2632, test_loss: 1.2155, test_f1: 0.6974
 epoch: 72, train_loss: 0.2649, test_loss: 1.2649, test_f1: 0.6755
 epoch: 73, train_loss: 0.2614, test_loss: 1.2232, test_f1: 0.6892
 epoch: 74, train_loss: 0.2634, test_loss: 1.1980, test_f1: 0.6935
 epoch: 75, train_loss: 0.2459, test_loss: 1.2726, test_f1: 0.6727
 epoch: 76, train_loss: 0.2462, test_loss: 1.1869, test_f1: 0.6840
 epoch: 77, train_loss: 0.2336, test_loss: 1.2661, test_f1: 0.6784
 epoch: 78, train_loss: 0.2340, test_loss: 1.3292, test_f1: 0.6913
 epoch: 79, train_loss: 0.2630, test_loss: 1.3351, test_f1: 0.6755
 epoch: 80, train_loss: 0.2456, test_loss: 1.3063, test_f1: 0.6853
 epoch: 81, train_loss: 0.2522, test_loss: 1.2969, test_f1: 0.7020
 epoch: 82, train_loss: 0.2248, test_loss: 1.1982, test_f1: 0.6946
 epoch: 83, train_loss: 0.2229, test_loss: 1.2944, test_f1: 0.6933
 epoch: 84, train_loss: 0.2149, test_loss: 1.2939, test_f1: 0.6972
 epoch: 85, train_loss: 0.2198, test_loss: 1.2360, test_f1: 0.6829
 epoch: 86, train_loss: 0.2136, test_loss: 1.3524, test_f1: 0.6918
 epoch: 87, train_loss: 0.2217, test_loss: 1.2969, test_f1: 0.6793
 epoch: 88, train_loss: 0.2160, test_loss: 1.4046, test_f1: 0.6722
 epoch: 89, train_loss: 0.2179, test_loss: 1.4247, test_f1: 0.6768
 epoch: 90, train_loss: 0.2297, test_loss: 1.3349, test_f1: 0.6733
 epoch: 91, train_loss: 0.2035, test_loss: 1.3476, test_f1: 0.6888
 epoch: 92, train_loss: 0.2434, test_loss: 1.3955, test_f1: 0.6895
 epoch: 93, train_loss: 0.2298, test_loss: 1.3738, test_f1: 0.6734
 epoch: 94, train_loss: 0.1989, test_loss: 1.3683, test_f1: 0.6826
 epoch: 95, train_loss: 0.2140, test_loss: 1.4802, test_f1: 0.6691
 epoch: 96, train_loss: 0.2086, test_loss: 1.4321, test_f1: 0.6916
 epoch: 97, train_loss: 0.1987, test_loss: 1.4254, test_f1: 0.6798
 epoch: 98, train_loss: 0.2138, test_loss: 1.4248, test_f1: 0.6805
 epoch: 99, train_loss: 0.2133, test_loss: 1.4666, test_f1: 0.6870

Training completed in 1183.36 seconds
Best F1: 0.7111 at epoch 40
Mean F1 across iterations: 0.6995  0.0060
========================FINAL RESULTS================================
FEGIN weighted F1: 0.7111  0.0060
python main.py --data ltspice_examples --representation component_pin_net --model FEGIN --layers 2 --hiddens 128 --batch_size 64 --lr 0.001 --emb_size 128 --epochs 100 --save_appendix component_pin_net_L2_H128_BS64_LR0.001_E128 --no_val
-----



STDERR:
  File "main.py", line 370, in <module>
    main()
  File "main.py", line 254, in main
    dataset = dataset_class(
  File "/home/philip/projects/llm_inference_code_repo/Circuit-Completion-Using-GNNs/component_classification_with_link_prediction_head/evaluation/FEGIN/kernel/circuit_datasets.py", line 15, in __init__
    self.data, self.slices = torch.load(self.processed_paths[0])
  File "/home/philip/.local/lib/python3.8/site-packages/torch/serialization.py", line 1040, in load
    warnings.warn(
  File "/usr/lib/python3.8/warnings.py", line 109, in _showwarnmsg
    sw(msg.message, msg.category, msg.filename, msg.lineno,
  File "main.py", line 47, in warn_with_traceback
    traceback.print_stack(file=log)
/home/philip/projects/llm_inference_code_repo/Circuit-Completion-Using-GNNs/component_classification_with_link_prediction_head/evaluation/FEGIN/kernel/circuit_datasets.py:15: FutureWarning: You are using `torch.load` with `weights_only=False` (the current default value), which uses the default pickle module implicitly. It is possible to construct malicious pickle data which will execute arbitrary code during unpickling (See https://github.com/pytorch/pytorch/blob/main/SECURITY.md#untrusted-models for more details). In a future release, the default value for `weights_only` will be flipped to `True`. This limits the functions that could be executed during unpickling. Arbitrary objects will no longer be allowed to be loaded via this mode unless they are explicitly allowlisted by the user via `torch.serialization.add_safe_globals`. We recommend you start setting `weights_only=True` for any use case where you don't have full control of the loaded file. Please open an issue on GitHub for any issues related to this experimental feature.
  self.data, self.slices = torch.load(self.processed_paths[0])
