STDOUT:
Results will be saved in /home/philip/projects/llm_inference_code_repo/Circuit-Completion-Using-GNNs/component_classification_with_link_prediction_head/evaluation/FEGIN/results/model_FEGIN_dataset_ltspice_examples
Command line input: python main.py --data ltspice_examples --representation component_pin --model FEGIN --layers 6 --hiddens 64 --batch_size 128 --lr 0.0001 --emb_size 250 --epochs 100 --save_appendix component_pin_L6_H64_BS128_LR0.0001_E250 --no_val
 is saved.
-----
ltspice_examples - FEGIN
Using 6 layers, 64 hidden units, h = 2
Loading component_pin representation dataset
ENTERED
Training FEGIN on component_pin representation
Train: 3560, Test: 848
##################ITERATION #0 ****************************************
 epoch: 0, train_loss: 1.3903, test_loss: 1.3851, test_f1: 0.1507
 epoch: 1, train_loss: 1.3734, test_loss: 1.3722, test_f1: 0.2942
 epoch: 2, train_loss: 1.3575, test_loss: 1.3522, test_f1: 0.2579
 epoch: 3, train_loss: 1.3359, test_loss: 1.3284, test_f1: 0.2260
 epoch: 4, train_loss: 1.3087, test_loss: 1.2987, test_f1: 0.2260
 epoch: 5, train_loss: 1.2812, test_loss: 1.2682, test_f1: 0.2260
 epoch: 6, train_loss: 1.2549, test_loss: 1.2429, test_f1: 0.2260
 epoch: 7, train_loss: 1.2371, test_loss: 1.2178, test_f1: 0.2260
 epoch: 8, train_loss: 1.2200, test_loss: 1.1996, test_f1: 0.2260
 epoch: 9, train_loss: 1.2045, test_loss: 1.1830, test_f1: 0.2311
 epoch: 10, train_loss: 1.1907, test_loss: 1.1691, test_f1: 0.3283
 epoch: 11, train_loss: 1.1748, test_loss: 1.1554, test_f1: 0.3318
 epoch: 12, train_loss: 1.1594, test_loss: 1.1365, test_f1: 0.3417
 epoch: 13, train_loss: 1.1379, test_loss: 1.1174, test_f1: 0.3553
 epoch: 14, train_loss: 1.1143, test_loss: 1.0947, test_f1: 0.3579
 epoch: 15, train_loss: 1.0976, test_loss: 1.0726, test_f1: 0.3553
 epoch: 16, train_loss: 1.0633, test_loss: 1.0585, test_f1: 0.3558
 epoch: 17, train_loss: 1.0416, test_loss: 1.0304, test_f1: 0.3629
 epoch: 18, train_loss: 1.0191, test_loss: 1.0407, test_f1: 0.3828
 epoch: 19, train_loss: 1.0078, test_loss: 1.0236, test_f1: 0.3910
 epoch: 20, train_loss: 0.9967, test_loss: 1.0198, test_f1: 0.3798
 epoch: 21, train_loss: 0.9838, test_loss: 1.0209, test_f1: 0.4150
 epoch: 22, train_loss: 0.9827, test_loss: 1.0577, test_f1: 0.4137
 epoch: 23, train_loss: 0.9708, test_loss: 1.0342, test_f1: 0.4344
 epoch: 24, train_loss: 0.9742, test_loss: 1.0384, test_f1: 0.4333
 epoch: 25, train_loss: 0.9695, test_loss: 1.0398, test_f1: 0.4421
 epoch: 26, train_loss: 0.9616, test_loss: 1.0303, test_f1: 0.4765
 epoch: 27, train_loss: 0.9622, test_loss: 1.0379, test_f1: 0.4896
 epoch: 28, train_loss: 0.9521, test_loss: 1.0216, test_f1: 0.4764
 epoch: 29, train_loss: 0.9436, test_loss: 1.0353, test_f1: 0.4808
 epoch: 30, train_loss: 0.9382, test_loss: 1.0328, test_f1: 0.4976
 epoch: 31, train_loss: 0.9436, test_loss: 1.0424, test_f1: 0.4941
 epoch: 32, train_loss: 0.9331, test_loss: 1.0145, test_f1: 0.5112
 epoch: 33, train_loss: 0.9324, test_loss: 1.0336, test_f1: 0.4948
 epoch: 34, train_loss: 0.9252, test_loss: 1.0432, test_f1: 0.4866
 epoch: 35, train_loss: 0.9140, test_loss: 1.0216, test_f1: 0.5012
 epoch: 36, train_loss: 0.9120, test_loss: 1.0429, test_f1: 0.4837
 epoch: 37, train_loss: 0.9035, test_loss: 1.0115, test_f1: 0.5236
 epoch: 38, train_loss: 0.8969, test_loss: 1.0028, test_f1: 0.5122
 epoch: 39, train_loss: 0.9015, test_loss: 1.0102, test_f1: 0.5188
 epoch: 40, train_loss: 0.8923, test_loss: 1.0138, test_f1: 0.5211
 epoch: 41, train_loss: 0.8874, test_loss: 1.0219, test_f1: 0.5085
 epoch: 42, train_loss: 0.8792, test_loss: 1.0072, test_f1: 0.5136
 epoch: 43, train_loss: 0.8755, test_loss: 1.0401, test_f1: 0.4993
 epoch: 44, train_loss: 0.8769, test_loss: 0.9914, test_f1: 0.5276
 epoch: 45, train_loss: 0.8751, test_loss: 1.0094, test_f1: 0.5133
 epoch: 46, train_loss: 0.8600, test_loss: 1.0147, test_f1: 0.5229
 epoch: 47, train_loss: 0.8621, test_loss: 1.0167, test_f1: 0.5198
 epoch: 48, train_loss: 0.8693, test_loss: 1.0049, test_f1: 0.5373
 epoch: 49, train_loss: 0.8483, test_loss: 0.9726, test_f1: 0.5265
 epoch: 50, train_loss: 0.8485, test_loss: 0.9801, test_f1: 0.5232
 epoch: 51, train_loss: 0.8366, test_loss: 0.9944, test_f1: 0.5245
 epoch: 52, train_loss: 0.8268, test_loss: 1.0019, test_f1: 0.5256
 epoch: 53, train_loss: 0.8264, test_loss: 0.9852, test_f1: 0.5183
 epoch: 54, train_loss: 0.8201, test_loss: 1.0026, test_f1: 0.5158
 epoch: 55, train_loss: 0.8276, test_loss: 0.9845, test_f1: 0.5274
 epoch: 56, train_loss: 0.8240, test_loss: 0.9824, test_f1: 0.5131
 epoch: 57, train_loss: 0.8064, test_loss: 0.9842, test_f1: 0.5109
 epoch: 58, train_loss: 0.8121, test_loss: 0.9791, test_f1: 0.5150
 epoch: 59, train_loss: 0.8155, test_loss: 0.9746, test_f1: 0.5141
 epoch: 60, train_loss: 0.8110, test_loss: 0.9920, test_f1: 0.5209
 epoch: 61, train_loss: 0.8034, test_loss: 0.9895, test_f1: 0.5162
 epoch: 62, train_loss: 0.7965, test_loss: 0.9953, test_f1: 0.5200
 epoch: 63, train_loss: 0.7975, test_loss: 0.9930, test_f1: 0.5161
 epoch: 64, train_loss: 0.7934, test_loss: 0.9846, test_f1: 0.5292
 epoch: 65, train_loss: 0.7930, test_loss: 0.9844, test_f1: 0.5275
 epoch: 66, train_loss: 0.7959, test_loss: 0.9764, test_f1: 0.5371
 epoch: 67, train_loss: 0.7796, test_loss: 0.9684, test_f1: 0.5294
 epoch: 68, train_loss: 0.7859, test_loss: 0.9685, test_f1: 0.5488
 epoch: 69, train_loss: 0.7864, test_loss: 0.9840, test_f1: 0.5195
 epoch: 70, train_loss: 0.7770, test_loss: 0.9743, test_f1: 0.5338
 epoch: 71, train_loss: 0.7730, test_loss: 0.9868, test_f1: 0.5283
 epoch: 72, train_loss: 0.7777, test_loss: 0.9812, test_f1: 0.5363
 epoch: 73, train_loss: 0.7718, test_loss: 0.9555, test_f1: 0.5527
 epoch: 74, train_loss: 0.7694, test_loss: 0.9563, test_f1: 0.5355
 epoch: 75, train_loss: 0.7677, test_loss: 0.9742, test_f1: 0.5294
 epoch: 76, train_loss: 0.7623, test_loss: 0.9760, test_f1: 0.5261
 epoch: 77, train_loss: 0.7612, test_loss: 0.9821, test_f1: 0.5281
 epoch: 78, train_loss: 0.7539, test_loss: 0.9834, test_f1: 0.5227
 epoch: 79, train_loss: 0.7686, test_loss: 0.9757, test_f1: 0.5299
 epoch: 80, train_loss: 0.7610, test_loss: 1.0052, test_f1: 0.5203
 epoch: 81, train_loss: 0.7524, test_loss: 0.9978, test_f1: 0.5212
 epoch: 82, train_loss: 0.7482, test_loss: 1.0225, test_f1: 0.5141
 epoch: 83, train_loss: 0.7517, test_loss: 1.0010, test_f1: 0.5231
 epoch: 84, train_loss: 0.7455, test_loss: 1.0087, test_f1: 0.5408
 epoch: 85, train_loss: 0.7405, test_loss: 1.0061, test_f1: 0.5346
 epoch: 86, train_loss: 0.7410, test_loss: 1.0179, test_f1: 0.5313
 epoch: 87, train_loss: 0.7395, test_loss: 1.0232, test_f1: 0.5301
 epoch: 88, train_loss: 0.7393, test_loss: 1.0078, test_f1: 0.5370
 epoch: 89, train_loss: 0.7485, test_loss: 1.0106, test_f1: 0.5351
 epoch: 90, train_loss: 0.7350, test_loss: 1.0313, test_f1: 0.5318
 epoch: 91, train_loss: 0.7212, test_loss: 1.0033, test_f1: 0.5441
 epoch: 92, train_loss: 0.7203, test_loss: 1.0004, test_f1: 0.5410
 epoch: 93, train_loss: 0.7251, test_loss: 1.0106, test_f1: 0.5317
 epoch: 94, train_loss: 0.7205, test_loss: 1.0078, test_f1: 0.5377
 epoch: 95, train_loss: 0.7251, test_loss: 1.0535, test_f1: 0.5348
 epoch: 96, train_loss: 0.7177, test_loss: 1.0359, test_f1: 0.5461
 epoch: 97, train_loss: 0.7185, test_loss: 1.0249, test_f1: 0.5396
 epoch: 98, train_loss: 0.7114, test_loss: 1.0488, test_f1: 0.5455
 epoch: 99, train_loss: 0.7067, test_loss: 1.0516, test_f1: 0.5397
##################ITERATION #1 ****************************************
 epoch: 0, train_loss: 1.3476, test_loss: 1.3484, test_f1: 0.2260
 epoch: 1, train_loss: 1.3139, test_loss: 1.3187, test_f1: 0.2260
 epoch: 2, train_loss: 1.2863, test_loss: 1.2773, test_f1: 0.2260
 epoch: 3, train_loss: 1.2574, test_loss: 1.2344, test_f1: 0.2286
 epoch: 4, train_loss: 1.2287, test_loss: 1.2000, test_f1: 0.3299
 epoch: 5, train_loss: 1.2002, test_loss: 1.1693, test_f1: 0.3271
 epoch: 6, train_loss: 1.1758, test_loss: 1.1451, test_f1: 0.3393
 epoch: 7, train_loss: 1.1531, test_loss: 1.1222, test_f1: 0.3473
 epoch: 8, train_loss: 1.1342, test_loss: 1.1012, test_f1: 0.3580
 epoch: 9, train_loss: 1.1077, test_loss: 1.0818, test_f1: 0.3796
 epoch: 10, train_loss: 1.0826, test_loss: 1.0821, test_f1: 0.3591
 epoch: 11, train_loss: 1.0746, test_loss: 1.0554, test_f1: 0.4392
 epoch: 12, train_loss: 1.0520, test_loss: 1.0505, test_f1: 0.4624
 epoch: 13, train_loss: 1.0453, test_loss: 1.0441, test_f1: 0.4440
 epoch: 14, train_loss: 1.0269, test_loss: 1.0392, test_f1: 0.4699
 epoch: 15, train_loss: 1.0194, test_loss: 1.0335, test_f1: 0.4559
 epoch: 16, train_loss: 1.0028, test_loss: 1.0201, test_f1: 0.4600
 epoch: 17, train_loss: 0.9989, test_loss: 1.0241, test_f1: 0.4782
 epoch: 18, train_loss: 0.9891, test_loss: 1.0216, test_f1: 0.4715
 epoch: 19, train_loss: 0.9882, test_loss: 1.0104, test_f1: 0.4844
 epoch: 20, train_loss: 0.9818, test_loss: 1.0241, test_f1: 0.4528
 epoch: 21, train_loss: 0.9612, test_loss: 0.9939, test_f1: 0.4727
 epoch: 22, train_loss: 0.9637, test_loss: 1.0003, test_f1: 0.4778
 epoch: 23, train_loss: 0.9455, test_loss: 0.9960, test_f1: 0.4959
 epoch: 24, train_loss: 0.9459, test_loss: 0.9993, test_f1: 0.4871
 epoch: 25, train_loss: 0.9510, test_loss: 1.0183, test_f1: 0.5118
 epoch: 26, train_loss: 0.9416, test_loss: 0.9932, test_f1: 0.4952
 epoch: 27, train_loss: 0.9310, test_loss: 0.9611, test_f1: 0.5102
 epoch: 28, train_loss: 0.9158, test_loss: 1.0200, test_f1: 0.4914
 epoch: 29, train_loss: 0.9074, test_loss: 0.9824, test_f1: 0.4967
 epoch: 30, train_loss: 0.9059, test_loss: 0.9956, test_f1: 0.4968
 epoch: 31, train_loss: 0.8946, test_loss: 0.9778, test_f1: 0.5050
 epoch: 32, train_loss: 0.8886, test_loss: 0.9604, test_f1: 0.5098
 epoch: 33, train_loss: 0.8880, test_loss: 0.9786, test_f1: 0.5032
 epoch: 34, train_loss: 0.8915, test_loss: 0.9750, test_f1: 0.5070
 epoch: 35, train_loss: 0.8853, test_loss: 0.9493, test_f1: 0.5185
 epoch: 36, train_loss: 0.8701, test_loss: 0.9599, test_f1: 0.5045
 epoch: 37, train_loss: 0.8666, test_loss: 0.9518, test_f1: 0.4968
 epoch: 38, train_loss: 0.8687, test_loss: 0.9792, test_f1: 0.5190
 epoch: 39, train_loss: 0.8628, test_loss: 0.9870, test_f1: 0.5068
 epoch: 40, train_loss: 0.8559, test_loss: 0.9543, test_f1: 0.5178
 epoch: 41, train_loss: 0.8472, test_loss: 0.9520, test_f1: 0.5099
 epoch: 42, train_loss: 0.8493, test_loss: 0.9963, test_f1: 0.5074
 epoch: 43, train_loss: 0.8334, test_loss: 1.0056, test_f1: 0.5003
 epoch: 44, train_loss: 0.8296, test_loss: 0.9950, test_f1: 0.5219
 epoch: 45, train_loss: 0.8425, test_loss: 0.9553, test_f1: 0.5121
 epoch: 46, train_loss: 0.8275, test_loss: 0.9928, test_f1: 0.5208
 epoch: 47, train_loss: 0.8251, test_loss: 0.9981, test_f1: 0.5150
 epoch: 48, train_loss: 0.8178, test_loss: 1.0039, test_f1: 0.5079
 epoch: 49, train_loss: 0.8132, test_loss: 1.0217, test_f1: 0.5194
 epoch: 50, train_loss: 0.8064, test_loss: 1.0214, test_f1: 0.5288
 epoch: 51, train_loss: 0.8030, test_loss: 1.0155, test_f1: 0.5241
 epoch: 52, train_loss: 0.7977, test_loss: 1.0182, test_f1: 0.5158
 epoch: 53, train_loss: 0.7926, test_loss: 1.0184, test_f1: 0.5240
 epoch: 54, train_loss: 0.7903, test_loss: 1.0047, test_f1: 0.5326
 epoch: 55, train_loss: 0.7936, test_loss: 1.0100, test_f1: 0.5210
 epoch: 56, train_loss: 0.7880, test_loss: 0.9811, test_f1: 0.5284
 epoch: 57, train_loss: 0.7927, test_loss: 1.0304, test_f1: 0.5338
 epoch: 58, train_loss: 0.7705, test_loss: 1.0388, test_f1: 0.5260
 epoch: 59, train_loss: 0.7781, test_loss: 0.9987, test_f1: 0.5196
 epoch: 60, train_loss: 0.7798, test_loss: 1.0439, test_f1: 0.5185
 epoch: 61, train_loss: 0.7750, test_loss: 1.0387, test_f1: 0.5176
 epoch: 62, train_loss: 0.7706, test_loss: 1.0261, test_f1: 0.5157
 epoch: 63, train_loss: 0.7705, test_loss: 1.0170, test_f1: 0.5246
 epoch: 64, train_loss: 0.7711, test_loss: 1.0531, test_f1: 0.5184
 epoch: 65, train_loss: 0.7652, test_loss: 1.0260, test_f1: 0.5131
 epoch: 66, train_loss: 0.7576, test_loss: 1.0662, test_f1: 0.5149
 epoch: 67, train_loss: 0.7728, test_loss: 1.0501, test_f1: 0.5196
 epoch: 68, train_loss: 0.7652, test_loss: 1.0511, test_f1: 0.5175
 epoch: 69, train_loss: 0.7635, test_loss: 1.0603, test_f1: 0.5211
 epoch: 70, train_loss: 0.7488, test_loss: 1.0300, test_f1: 0.5323
 epoch: 71, train_loss: 0.7512, test_loss: 1.0575, test_f1: 0.5309
 epoch: 72, train_loss: 0.7514, test_loss: 1.0449, test_f1: 0.5229
 epoch: 73, train_loss: 0.7455, test_loss: 1.0349, test_f1: 0.5324
 epoch: 74, train_loss: 0.7448, test_loss: 1.0230, test_f1: 0.5179
 epoch: 75, train_loss: 0.7563, test_loss: 1.0561, test_f1: 0.5222
 epoch: 76, train_loss: 0.7407, test_loss: 1.0657, test_f1: 0.5266
 epoch: 77, train_loss: 0.7381, test_loss: 1.0468, test_f1: 0.5259
 epoch: 78, train_loss: 0.7309, test_loss: 1.0969, test_f1: 0.5111
 epoch: 79, train_loss: 0.7402, test_loss: 1.0725, test_f1: 0.5273
 epoch: 80, train_loss: 0.7332, test_loss: 1.0377, test_f1: 0.5352
 epoch: 81, train_loss: 0.7329, test_loss: 1.0823, test_f1: 0.5189
 epoch: 82, train_loss: 0.7317, test_loss: 1.1187, test_f1: 0.5144
 epoch: 83, train_loss: 0.7219, test_loss: 1.0829, test_f1: 0.5238
 epoch: 84, train_loss: 0.7166, test_loss: 1.0674, test_f1: 0.5250
 epoch: 85, train_loss: 0.7145, test_loss: 1.0734, test_f1: 0.5252
 epoch: 86, train_loss: 0.7179, test_loss: 1.0644, test_f1: 0.5251
 epoch: 87, train_loss: 0.7275, test_loss: 1.1001, test_f1: 0.5171
 epoch: 88, train_loss: 0.7171, test_loss: 1.0871, test_f1: 0.5241
 epoch: 89, train_loss: 0.7233, test_loss: 1.0463, test_f1: 0.5408
 epoch: 90, train_loss: 0.7172, test_loss: 1.0958, test_f1: 0.5248
 epoch: 91, train_loss: 0.7096, test_loss: 1.1281, test_f1: 0.5205
 epoch: 92, train_loss: 0.6983, test_loss: 1.0745, test_f1: 0.5135
 epoch: 93, train_loss: 0.7108, test_loss: 1.0952, test_f1: 0.5291
 epoch: 94, train_loss: 0.7158, test_loss: 1.0733, test_f1: 0.5327
 epoch: 95, train_loss: 0.7046, test_loss: 1.1160, test_f1: 0.5256
 epoch: 96, train_loss: 0.7060, test_loss: 1.0796, test_f1: 0.5333
 epoch: 97, train_loss: 0.6923, test_loss: 1.1422, test_f1: 0.5186
 epoch: 98, train_loss: 0.6892, test_loss: 1.0927, test_f1: 0.5337
 epoch: 99, train_loss: 0.6916, test_loss: 1.0635, test_f1: 0.5347
##################ITERATION #2 ****************************************
 epoch: 0, train_loss: 1.3050, test_loss: 1.3151, test_f1: 0.2260
 epoch: 1, train_loss: 1.2598, test_loss: 1.2673, test_f1: 0.2260
 epoch: 2, train_loss: 1.2220, test_loss: 1.2023, test_f1: 0.3146
 epoch: 3, train_loss: 1.1871, test_loss: 1.1497, test_f1: 0.3685
 epoch: 4, train_loss: 1.1532, test_loss: 1.1182, test_f1: 0.3983
 epoch: 5, train_loss: 1.1212, test_loss: 1.0946, test_f1: 0.4129
 epoch: 6, train_loss: 1.0977, test_loss: 1.0798, test_f1: 0.4213
 epoch: 7, train_loss: 1.0744, test_loss: 1.0681, test_f1: 0.4324
 epoch: 8, train_loss: 1.0579, test_loss: 1.0534, test_f1: 0.4344
 epoch: 9, train_loss: 1.0344, test_loss: 1.0463, test_f1: 0.4360
 epoch: 10, train_loss: 1.0179, test_loss: 1.0395, test_f1: 0.4288
 epoch: 11, train_loss: 1.0098, test_loss: 1.0260, test_f1: 0.4508
 epoch: 12, train_loss: 0.9959, test_loss: 1.0509, test_f1: 0.4373
 epoch: 13, train_loss: 0.9877, test_loss: 1.0982, test_f1: 0.4294
 epoch: 14, train_loss: 0.9781, test_loss: 1.0111, test_f1: 0.4691
 epoch: 15, train_loss: 0.9630, test_loss: 1.0185, test_f1: 0.4717
 epoch: 16, train_loss: 0.9581, test_loss: 0.9927, test_f1: 0.4938
 epoch: 17, train_loss: 0.9475, test_loss: 1.0009, test_f1: 0.4804
 epoch: 18, train_loss: 0.9490, test_loss: 0.9815, test_f1: 0.4916
 epoch: 19, train_loss: 0.9291, test_loss: 1.0000, test_f1: 0.5100
 epoch: 20, train_loss: 0.9209, test_loss: 0.9499, test_f1: 0.5196
 epoch: 21, train_loss: 0.9189, test_loss: 0.9620, test_f1: 0.4947
 epoch: 22, train_loss: 0.9038, test_loss: 0.9579, test_f1: 0.5135
 epoch: 23, train_loss: 0.9029, test_loss: 0.9268, test_f1: 0.5116
 epoch: 24, train_loss: 0.8956, test_loss: 0.9500, test_f1: 0.5178
 epoch: 25, train_loss: 0.8785, test_loss: 0.9433, test_f1: 0.5419
 epoch: 26, train_loss: 0.8844, test_loss: 0.9422, test_f1: 0.5234
 epoch: 27, train_loss: 0.8690, test_loss: 0.9336, test_f1: 0.5105
 epoch: 28, train_loss: 0.8630, test_loss: 0.9361, test_f1: 0.5289
 epoch: 29, train_loss: 0.8607, test_loss: 0.9352, test_f1: 0.5467
 epoch: 30, train_loss: 0.8524, test_loss: 0.9469, test_f1: 0.5178
 epoch: 31, train_loss: 0.8532, test_loss: 0.9349, test_f1: 0.5267
 epoch: 32, train_loss: 0.8476, test_loss: 0.9458, test_f1: 0.5347
 epoch: 33, train_loss: 0.8332, test_loss: 0.9326, test_f1: 0.5333
 epoch: 34, train_loss: 0.8203, test_loss: 0.9217, test_f1: 0.5323
 epoch: 35, train_loss: 0.8306, test_loss: 0.9271, test_f1: 0.5387
 epoch: 36, train_loss: 0.8218, test_loss: 0.9163, test_f1: 0.5418
 epoch: 37, train_loss: 0.8110, test_loss: 0.9623, test_f1: 0.5319
 epoch: 38, train_loss: 0.8096, test_loss: 0.9279, test_f1: 0.5391
 epoch: 39, train_loss: 0.8023, test_loss: 0.9145, test_f1: 0.5466
 epoch: 40, train_loss: 0.7967, test_loss: 0.9180, test_f1: 0.5421
 epoch: 41, train_loss: 0.8062, test_loss: 0.9202, test_f1: 0.5324
 epoch: 42, train_loss: 0.7989, test_loss: 0.9335, test_f1: 0.5320
 epoch: 43, train_loss: 0.7870, test_loss: 0.9390, test_f1: 0.5332
 epoch: 44, train_loss: 0.7761, test_loss: 0.9379, test_f1: 0.5364
 epoch: 45, train_loss: 0.7746, test_loss: 0.9385, test_f1: 0.5360
 epoch: 46, train_loss: 0.7716, test_loss: 0.9265, test_f1: 0.5402
 epoch: 47, train_loss: 0.7669, test_loss: 0.9330, test_f1: 0.5436
 epoch: 48, train_loss: 0.7618, test_loss: 0.9292, test_f1: 0.5342
 epoch: 49, train_loss: 0.7594, test_loss: 0.9649, test_f1: 0.5280
 epoch: 50, train_loss: 0.7597, test_loss: 0.9496, test_f1: 0.5382
 epoch: 51, train_loss: 0.7489, test_loss: 0.9426, test_f1: 0.5509
 epoch: 52, train_loss: 0.7418, test_loss: 0.9485, test_f1: 0.5359
 epoch: 53, train_loss: 0.7303, test_loss: 0.9488, test_f1: 0.5349
 epoch: 54, train_loss: 0.7331, test_loss: 0.9491, test_f1: 0.5371
 epoch: 55, train_loss: 0.7297, test_loss: 0.9743, test_f1: 0.5406
 epoch: 56, train_loss: 0.7286, test_loss: 0.9558, test_f1: 0.5328
 epoch: 57, train_loss: 0.7341, test_loss: 0.9525, test_f1: 0.5371
 epoch: 58, train_loss: 0.7261, test_loss: 0.9572, test_f1: 0.5250
 epoch: 59, train_loss: 0.7249, test_loss: 0.9350, test_f1: 0.5418
 epoch: 60, train_loss: 0.7246, test_loss: 0.9508, test_f1: 0.5343
 epoch: 61, train_loss: 0.7194, test_loss: 0.9619, test_f1: 0.5406
 epoch: 62, train_loss: 0.7202, test_loss: 0.9772, test_f1: 0.5356
 epoch: 63, train_loss: 0.7115, test_loss: 0.9595, test_f1: 0.5381
 epoch: 64, train_loss: 0.7091, test_loss: 0.9649, test_f1: 0.5522
 epoch: 65, train_loss: 0.7108, test_loss: 0.9488, test_f1: 0.5300
 epoch: 66, train_loss: 0.7186, test_loss: 0.9675, test_f1: 0.5337
 epoch: 67, train_loss: 0.7063, test_loss: 0.9626, test_f1: 0.5469
 epoch: 68, train_loss: 0.6995, test_loss: 0.9703, test_f1: 0.5467
 epoch: 69, train_loss: 0.7061, test_loss: 0.9843, test_f1: 0.5137
 epoch: 70, train_loss: 0.7025, test_loss: 0.9719, test_f1: 0.5523
 epoch: 71, train_loss: 0.7055, test_loss: 0.9574, test_f1: 0.5390
 epoch: 72, train_loss: 0.6984, test_loss: 0.9495, test_f1: 0.5513
 epoch: 73, train_loss: 0.6890, test_loss: 0.9849, test_f1: 0.5147
 epoch: 74, train_loss: 0.7012, test_loss: 0.9812, test_f1: 0.5285
 epoch: 75, train_loss: 0.6888, test_loss: 0.9734, test_f1: 0.5227
 epoch: 76, train_loss: 0.7063, test_loss: 0.9896, test_f1: 0.5184
 epoch: 77, train_loss: 0.6888, test_loss: 0.9603, test_f1: 0.5276
 epoch: 78, train_loss: 0.6809, test_loss: 0.9805, test_f1: 0.5349
 epoch: 79, train_loss: 0.6964, test_loss: 0.9875, test_f1: 0.5381
 epoch: 80, train_loss: 0.6924, test_loss: 0.9908, test_f1: 0.5350
 epoch: 81, train_loss: 0.6794, test_loss: 0.9912, test_f1: 0.5296
 epoch: 82, train_loss: 0.6734, test_loss: 0.9911, test_f1: 0.5233
 epoch: 83, train_loss: 0.6770, test_loss: 1.0096, test_f1: 0.5272
 epoch: 84, train_loss: 0.6780, test_loss: 1.0167, test_f1: 0.5195
 epoch: 85, train_loss: 0.6782, test_loss: 0.9936, test_f1: 0.5328
 epoch: 86, train_loss: 0.6709, test_loss: 0.9906, test_f1: 0.5338
 epoch: 87, train_loss: 0.6835, test_loss: 0.9963, test_f1: 0.5384
 epoch: 88, train_loss: 0.6680, test_loss: 1.0023, test_f1: 0.5282
 epoch: 89, train_loss: 0.6661, test_loss: 1.0041, test_f1: 0.5287
 epoch: 90, train_loss: 0.6729, test_loss: 0.9893, test_f1: 0.5345
 epoch: 91, train_loss: 0.6707, test_loss: 1.0019, test_f1: 0.5316
 epoch: 92, train_loss: 0.6780, test_loss: 0.9778, test_f1: 0.5416
 epoch: 93, train_loss: 0.6663, test_loss: 0.9961, test_f1: 0.5307
 epoch: 94, train_loss: 0.6722, test_loss: 0.9887, test_f1: 0.5344
 epoch: 95, train_loss: 0.6692, test_loss: 0.9712, test_f1: 0.5479
 epoch: 96, train_loss: 0.6582, test_loss: 1.0081, test_f1: 0.5437
 epoch: 97, train_loss: 0.6562, test_loss: 0.9967, test_f1: 0.5381
 epoch: 98, train_loss: 0.6588, test_loss: 1.0153, test_f1: 0.5481
 epoch: 99, train_loss: 0.6463, test_loss: 0.9920, test_f1: 0.5392
##################ITERATION #3 ****************************************
 epoch: 0, train_loss: 1.2993, test_loss: 1.3020, test_f1: 0.2260
 epoch: 1, train_loss: 1.2473, test_loss: 1.2335, test_f1: 0.2648
 epoch: 2, train_loss: 1.2105, test_loss: 1.1725, test_f1: 0.3841
 epoch: 3, train_loss: 1.1744, test_loss: 1.1279, test_f1: 0.4169
 epoch: 4, train_loss: 1.1352, test_loss: 1.0898, test_f1: 0.4506
 epoch: 5, train_loss: 1.1075, test_loss: 1.0703, test_f1: 0.4566
 epoch: 6, train_loss: 1.0808, test_loss: 1.0447, test_f1: 0.4645
 epoch: 7, train_loss: 1.0571, test_loss: 1.0280, test_f1: 0.4634
 epoch: 8, train_loss: 1.0400, test_loss: 1.0280, test_f1: 0.4737
 epoch: 9, train_loss: 1.0209, test_loss: 1.0247, test_f1: 0.4326
 epoch: 10, train_loss: 1.0068, test_loss: 1.0125, test_f1: 0.4660
 epoch: 11, train_loss: 0.9979, test_loss: 1.0152, test_f1: 0.4367
 epoch: 12, train_loss: 0.9747, test_loss: 0.9878, test_f1: 0.4788
 epoch: 13, train_loss: 0.9699, test_loss: 0.9810, test_f1: 0.4813
 epoch: 14, train_loss: 0.9642, test_loss: 0.9732, test_f1: 0.4849
 epoch: 15, train_loss: 0.9480, test_loss: 0.9818, test_f1: 0.4692
 epoch: 16, train_loss: 0.9428, test_loss: 0.9681, test_f1: 0.4927
 epoch: 17, train_loss: 0.9281, test_loss: 0.9826, test_f1: 0.4769
 epoch: 18, train_loss: 0.9197, test_loss: 0.9625, test_f1: 0.4959
 epoch: 19, train_loss: 0.9224, test_loss: 0.9561, test_f1: 0.4949
 epoch: 20, train_loss: 0.8969, test_loss: 0.9679, test_f1: 0.4850
 epoch: 21, train_loss: 0.8960, test_loss: 0.9542, test_f1: 0.4918
 epoch: 22, train_loss: 0.8877, test_loss: 0.9648, test_f1: 0.5279
 epoch: 23, train_loss: 0.8879, test_loss: 0.9668, test_f1: 0.5070
 epoch: 24, train_loss: 0.8742, test_loss: 0.9439, test_f1: 0.5146
 epoch: 25, train_loss: 0.8809, test_loss: 0.9461, test_f1: 0.5268
 epoch: 26, train_loss: 0.8675, test_loss: 0.9420, test_f1: 0.5129
 epoch: 27, train_loss: 0.8582, test_loss: 0.9606, test_f1: 0.5277
 epoch: 28, train_loss: 0.8578, test_loss: 0.9552, test_f1: 0.5537
 epoch: 29, train_loss: 0.8432, test_loss: 0.9658, test_f1: 0.5455
 epoch: 30, train_loss: 0.8502, test_loss: 0.9597, test_f1: 0.5439
 epoch: 31, train_loss: 0.8364, test_loss: 0.9324, test_f1: 0.5581
 epoch: 32, train_loss: 0.8312, test_loss: 0.9982, test_f1: 0.5430
 epoch: 33, train_loss: 0.8284, test_loss: 0.9565, test_f1: 0.5440
 epoch: 34, train_loss: 0.8137, test_loss: 0.9752, test_f1: 0.5615
 epoch: 35, train_loss: 0.8150, test_loss: 0.9580, test_f1: 0.5457
 epoch: 36, train_loss: 0.8116, test_loss: 0.9568, test_f1: 0.5381
 epoch: 37, train_loss: 0.7953, test_loss: 0.9695, test_f1: 0.5416
 epoch: 38, train_loss: 0.7987, test_loss: 0.9484, test_f1: 0.5422
 epoch: 39, train_loss: 0.7989, test_loss: 0.9500, test_f1: 0.5564
 epoch: 40, train_loss: 0.7823, test_loss: 0.9326, test_f1: 0.5504
 epoch: 41, train_loss: 0.7809, test_loss: 0.9468, test_f1: 0.5532
 epoch: 42, train_loss: 0.7732, test_loss: 0.9877, test_f1: 0.5299
 epoch: 43, train_loss: 0.7710, test_loss: 0.9288, test_f1: 0.5474
 epoch: 44, train_loss: 0.7618, test_loss: 0.9526, test_f1: 0.5612
 epoch: 45, train_loss: 0.7520, test_loss: 0.9535, test_f1: 0.5380
 epoch: 46, train_loss: 0.7541, test_loss: 0.9520, test_f1: 0.5467
 epoch: 47, train_loss: 0.7461, test_loss: 1.0160, test_f1: 0.5202
 epoch: 48, train_loss: 0.7543, test_loss: 0.9457, test_f1: 0.5340
 epoch: 49, train_loss: 0.7471, test_loss: 0.9700, test_f1: 0.5251
 epoch: 50, train_loss: 0.7551, test_loss: 0.9714, test_f1: 0.5463
 epoch: 51, train_loss: 0.7359, test_loss: 0.9838, test_f1: 0.5430
 epoch: 52, train_loss: 0.7253, test_loss: 0.9513, test_f1: 0.5471
 epoch: 53, train_loss: 0.7138, test_loss: 0.9580, test_f1: 0.5436
 epoch: 54, train_loss: 0.7188, test_loss: 0.9489, test_f1: 0.5421
 epoch: 55, train_loss: 0.7277, test_loss: 0.9497, test_f1: 0.5387
 epoch: 56, train_loss: 0.7126, test_loss: 0.9559, test_f1: 0.5411
 epoch: 57, train_loss: 0.7165, test_loss: 0.9687, test_f1: 0.5498
 epoch: 58, train_loss: 0.7061, test_loss: 0.9472, test_f1: 0.5379
 epoch: 59, train_loss: 0.7098, test_loss: 0.9712, test_f1: 0.5373
 epoch: 60, train_loss: 0.7038, test_loss: 0.9607, test_f1: 0.5489
 epoch: 61, train_loss: 0.7099, test_loss: 0.9847, test_f1: 0.5474
 epoch: 62, train_loss: 0.7061, test_loss: 0.9648, test_f1: 0.5506
 epoch: 63, train_loss: 0.7036, test_loss: 0.9490, test_f1: 0.5475
 epoch: 64, train_loss: 0.6992, test_loss: 0.9734, test_f1: 0.5425
 epoch: 65, train_loss: 0.6989, test_loss: 0.9488, test_f1: 0.5513
 epoch: 66, train_loss: 0.6946, test_loss: 0.9527, test_f1: 0.5417
 epoch: 67, train_loss: 0.6914, test_loss: 0.9573, test_f1: 0.5430
 epoch: 68, train_loss: 0.6928, test_loss: 0.9782, test_f1: 0.5438
 epoch: 69, train_loss: 0.6906, test_loss: 0.9776, test_f1: 0.5379
 epoch: 70, train_loss: 0.6758, test_loss: 0.9611, test_f1: 0.5427
 epoch: 71, train_loss: 0.6846, test_loss: 0.9547, test_f1: 0.5439
 epoch: 72, train_loss: 0.6755, test_loss: 1.0239, test_f1: 0.5387
 epoch: 73, train_loss: 0.6886, test_loss: 1.0002, test_f1: 0.5216
 epoch: 74, train_loss: 0.6819, test_loss: 0.9502, test_f1: 0.5390
 epoch: 75, train_loss: 0.6849, test_loss: 0.9773, test_f1: 0.5589
 epoch: 76, train_loss: 0.6777, test_loss: 0.9802, test_f1: 0.5448
 epoch: 77, train_loss: 0.6656, test_loss: 0.9918, test_f1: 0.5232
 epoch: 78, train_loss: 0.6675, test_loss: 0.9659, test_f1: 0.5372
 epoch: 79, train_loss: 0.6711, test_loss: 0.9844, test_f1: 0.5450
 epoch: 80, train_loss: 0.6695, test_loss: 0.9925, test_f1: 0.5336
 epoch: 81, train_loss: 0.6771, test_loss: 0.9989, test_f1: 0.5451
 epoch: 82, train_loss: 0.6634, test_loss: 0.9926, test_f1: 0.5332
 epoch: 83, train_loss: 0.6522, test_loss: 0.9995, test_f1: 0.5368
 epoch: 84, train_loss: 0.6709, test_loss: 0.9840, test_f1: 0.5368
 epoch: 85, train_loss: 0.6757, test_loss: 1.0254, test_f1: 0.5374
 epoch: 86, train_loss: 0.6613, test_loss: 0.9923, test_f1: 0.5338
 epoch: 87, train_loss: 0.6561, test_loss: 0.9984, test_f1: 0.5378
 epoch: 88, train_loss: 0.6619, test_loss: 0.9948, test_f1: 0.5350
 epoch: 89, train_loss: 0.6497, test_loss: 0.9927, test_f1: 0.5301
 epoch: 90, train_loss: 0.6684, test_loss: 0.9898, test_f1: 0.5530
 epoch: 91, train_loss: 0.6508, test_loss: 1.0239, test_f1: 0.5318
 epoch: 92, train_loss: 0.6614, test_loss: 0.9712, test_f1: 0.5354
 epoch: 93, train_loss: 0.6527, test_loss: 1.0027, test_f1: 0.5290
 epoch: 94, train_loss: 0.6438, test_loss: 0.9994, test_f1: 0.5297
 epoch: 95, train_loss: 0.6389, test_loss: 0.9909, test_f1: 0.5293
 epoch: 96, train_loss: 0.6376, test_loss: 1.0111, test_f1: 0.5246
 epoch: 97, train_loss: 0.6509, test_loss: 1.0203, test_f1: 0.5234
 epoch: 98, train_loss: 0.6400, test_loss: 1.0128, test_f1: 0.5396
 epoch: 99, train_loss: 0.6314, test_loss: 0.9803, test_f1: 0.5532
##################ITERATION #4 ****************************************
 epoch: 0, train_loss: 1.2682, test_loss: 1.2916, test_f1: 0.2260
 epoch: 1, train_loss: 1.1921, test_loss: 1.2121, test_f1: 0.2540
 epoch: 2, train_loss: 1.1488, test_loss: 1.1070, test_f1: 0.4413
 epoch: 3, train_loss: 1.1129, test_loss: 1.0572, test_f1: 0.4436
 epoch: 4, train_loss: 1.0787, test_loss: 1.0311, test_f1: 0.4476
 epoch: 5, train_loss: 1.0606, test_loss: 1.0129, test_f1: 0.4622
 epoch: 6, train_loss: 1.0442, test_loss: 1.0001, test_f1: 0.4594
 epoch: 7, train_loss: 1.0196, test_loss: 0.9897, test_f1: 0.4660
 epoch: 8, train_loss: 1.0024, test_loss: 0.9805, test_f1: 0.4832
 epoch: 9, train_loss: 0.9887, test_loss: 0.9736, test_f1: 0.4788
 epoch: 10, train_loss: 0.9702, test_loss: 0.9664, test_f1: 0.4809
 epoch: 11, train_loss: 0.9558, test_loss: 0.9613, test_f1: 0.4836
 epoch: 12, train_loss: 0.9450, test_loss: 0.9488, test_f1: 0.4860
 epoch: 13, train_loss: 0.9436, test_loss: 0.9468, test_f1: 0.4815
 epoch: 14, train_loss: 0.9262, test_loss: 0.9363, test_f1: 0.4927
 epoch: 15, train_loss: 0.9209, test_loss: 0.9329, test_f1: 0.4991
 epoch: 16, train_loss: 0.9045, test_loss: 0.9333, test_f1: 0.5261
 epoch: 17, train_loss: 0.8921, test_loss: 0.9281, test_f1: 0.5171
 epoch: 18, train_loss: 0.8793, test_loss: 0.9154, test_f1: 0.5325
 epoch: 19, train_loss: 0.8747, test_loss: 0.9141, test_f1: 0.5250
 epoch: 20, train_loss: 0.8634, test_loss: 0.9140, test_f1: 0.5222
 epoch: 21, train_loss: 0.8639, test_loss: 0.9242, test_f1: 0.5236
 epoch: 22, train_loss: 0.8514, test_loss: 0.9150, test_f1: 0.5183
 epoch: 23, train_loss: 0.8431, test_loss: 0.9080, test_f1: 0.5234
 epoch: 24, train_loss: 0.8302, test_loss: 0.9047, test_f1: 0.5353
 epoch: 25, train_loss: 0.8190, test_loss: 0.9063, test_f1: 0.5343
 epoch: 26, train_loss: 0.8144, test_loss: 0.9002, test_f1: 0.5391
 epoch: 27, train_loss: 0.7998, test_loss: 0.8850, test_f1: 0.5430
 epoch: 28, train_loss: 0.8010, test_loss: 0.9047, test_f1: 0.5410
 epoch: 29, train_loss: 0.7979, test_loss: 0.9060, test_f1: 0.5252
 epoch: 30, train_loss: 0.8017, test_loss: 0.8930, test_f1: 0.5449
 epoch: 31, train_loss: 0.7922, test_loss: 0.9129, test_f1: 0.5352
 epoch: 32, train_loss: 0.7718, test_loss: 0.9076, test_f1: 0.5398
 epoch: 33, train_loss: 0.7669, test_loss: 0.8978, test_f1: 0.5448
 epoch: 34, train_loss: 0.7643, test_loss: 0.9011, test_f1: 0.5492
 epoch: 35, train_loss: 0.7558, test_loss: 0.9055, test_f1: 0.5450
 epoch: 36, train_loss: 0.7487, test_loss: 0.9086, test_f1: 0.5438
 epoch: 37, train_loss: 0.7477, test_loss: 0.9145, test_f1: 0.5408
 epoch: 38, train_loss: 0.7488, test_loss: 0.9054, test_f1: 0.5493
 epoch: 39, train_loss: 0.7362, test_loss: 0.8955, test_f1: 0.5420
 epoch: 40, train_loss: 0.7328, test_loss: 0.9255, test_f1: 0.5422
 epoch: 41, train_loss: 0.7321, test_loss: 0.9023, test_f1: 0.5483
 epoch: 42, train_loss: 0.7246, test_loss: 0.9077, test_f1: 0.5402
 epoch: 43, train_loss: 0.7190, test_loss: 0.9130, test_f1: 0.5516
 epoch: 44, train_loss: 0.7114, test_loss: 0.9071, test_f1: 0.5693
 epoch: 45, train_loss: 0.7179, test_loss: 0.9101, test_f1: 0.5521
 epoch: 46, train_loss: 0.7053, test_loss: 0.9027, test_f1: 0.5463
 epoch: 47, train_loss: 0.6936, test_loss: 0.9290, test_f1: 0.5474
 epoch: 48, train_loss: 0.6978, test_loss: 0.9392, test_f1: 0.5487
 epoch: 49, train_loss: 0.6973, test_loss: 0.9211, test_f1: 0.5463
 epoch: 50, train_loss: 0.6838, test_loss: 0.9153, test_f1: 0.5657
 epoch: 51, train_loss: 0.6755, test_loss: 0.9103, test_f1: 0.5518
 epoch: 52, train_loss: 0.6650, test_loss: 0.9243, test_f1: 0.5606
 epoch: 53, train_loss: 0.6773, test_loss: 0.9173, test_f1: 0.5654
 epoch: 54, train_loss: 0.6529, test_loss: 0.9118, test_f1: 0.5543
 epoch: 55, train_loss: 0.6645, test_loss: 0.9276, test_f1: 0.5473
 epoch: 56, train_loss: 0.6685, test_loss: 0.9330, test_f1: 0.5487
 epoch: 57, train_loss: 0.6645, test_loss: 0.9221, test_f1: 0.5570
 epoch: 58, train_loss: 0.6687, test_loss: 0.9299, test_f1: 0.5511
 epoch: 59, train_loss: 0.6475, test_loss: 0.9211, test_f1: 0.5526
 epoch: 60, train_loss: 0.6506, test_loss: 0.9283, test_f1: 0.5522
 epoch: 61, train_loss: 0.6482, test_loss: 0.9135, test_f1: 0.5583
 epoch: 62, train_loss: 0.6434, test_loss: 0.9475, test_f1: 0.5421
 epoch: 63, train_loss: 0.6527, test_loss: 0.9375, test_f1: 0.5446
 epoch: 64, train_loss: 0.6567, test_loss: 0.9479, test_f1: 0.5404
 epoch: 65, train_loss: 0.6418, test_loss: 0.9523, test_f1: 0.5418
 epoch: 66, train_loss: 0.6349, test_loss: 0.9414, test_f1: 0.5519
 epoch: 67, train_loss: 0.6402, test_loss: 0.9421, test_f1: 0.5469
 epoch: 68, train_loss: 0.6355, test_loss: 0.9207, test_f1: 0.5461
 epoch: 69, train_loss: 0.6447, test_loss: 0.9118, test_f1: 0.5532
 epoch: 70, train_loss: 0.6314, test_loss: 0.9136, test_f1: 0.5480
 epoch: 71, train_loss: 0.6320, test_loss: 0.9294, test_f1: 0.5445
 epoch: 72, train_loss: 0.6340, test_loss: 0.9328, test_f1: 0.5482
 epoch: 73, train_loss: 0.6317, test_loss: 0.9393, test_f1: 0.5502
 epoch: 74, train_loss: 0.6277, test_loss: 0.9443, test_f1: 0.5399
 epoch: 75, train_loss: 0.6271, test_loss: 0.9309, test_f1: 0.5413
 epoch: 76, train_loss: 0.6367, test_loss: 0.9629, test_f1: 0.5355
 epoch: 77, train_loss: 0.6299, test_loss: 0.9562, test_f1: 0.5377
 epoch: 78, train_loss: 0.6271, test_loss: 0.9193, test_f1: 0.5512
 epoch: 79, train_loss: 0.6168, test_loss: 0.9209, test_f1: 0.5558
 epoch: 80, train_loss: 0.6283, test_loss: 0.9534, test_f1: 0.5294
 epoch: 81, train_loss: 0.6164, test_loss: 0.9319, test_f1: 0.5513
 epoch: 82, train_loss: 0.6144, test_loss: 0.9247, test_f1: 0.5531
 epoch: 83, train_loss: 0.6074, test_loss: 0.9321, test_f1: 0.5566
 epoch: 84, train_loss: 0.6223, test_loss: 0.9459, test_f1: 0.5555
 epoch: 85, train_loss: 0.6145, test_loss: 0.9227, test_f1: 0.5589
 epoch: 86, train_loss: 0.6187, test_loss: 0.9386, test_f1: 0.5612
 epoch: 87, train_loss: 0.6032, test_loss: 0.9344, test_f1: 0.5732
 epoch: 88, train_loss: 0.6123, test_loss: 0.9174, test_f1: 0.5568
 epoch: 89, train_loss: 0.6095, test_loss: 0.9163, test_f1: 0.5724
 epoch: 90, train_loss: 0.6098, test_loss: 0.9155, test_f1: 0.5636
 epoch: 91, train_loss: 0.6156, test_loss: 0.9023, test_f1: 0.5772
 epoch: 92, train_loss: 0.6142, test_loss: 0.9151, test_f1: 0.5513
 epoch: 93, train_loss: 0.6018, test_loss: 0.9324, test_f1: 0.5516
 epoch: 94, train_loss: 0.5944, test_loss: 0.9009, test_f1: 0.5898
 epoch: 95, train_loss: 0.5980, test_loss: 0.9120, test_f1: 0.5674
 epoch: 96, train_loss: 0.5923, test_loss: 0.9319, test_f1: 0.5818
 epoch: 97, train_loss: 0.5991, test_loss: 0.9506, test_f1: 0.5428
 epoch: 98, train_loss: 0.6025, test_loss: 0.9375, test_f1: 0.5389
 epoch: 99, train_loss: 0.5893, test_loss: 0.9496, test_f1: 0.5510
##################ITERATION #5 ****************************************
 epoch: 0, train_loss: 1.2688, test_loss: 1.2768, test_f1: 0.2260
 epoch: 1, train_loss: 1.1991, test_loss: 1.2083, test_f1: 0.2464
 epoch: 2, train_loss: 1.1645, test_loss: 1.1191, test_f1: 0.4217
 epoch: 3, train_loss: 1.1318, test_loss: 1.0800, test_f1: 0.4547
 epoch: 4, train_loss: 1.1039, test_loss: 1.0601, test_f1: 0.4483
 epoch: 5, train_loss: 1.0732, test_loss: 1.0419, test_f1: 0.4446
 epoch: 6, train_loss: 1.0612, test_loss: 1.0179, test_f1: 0.4785
 epoch: 7, train_loss: 1.0347, test_loss: 1.0171, test_f1: 0.4757
 epoch: 8, train_loss: 1.0140, test_loss: 0.9959, test_f1: 0.4794
 epoch: 9, train_loss: 1.0027, test_loss: 0.9887, test_f1: 0.4890
 epoch: 10, train_loss: 0.9888, test_loss: 0.9777, test_f1: 0.4900
 epoch: 11, train_loss: 0.9777, test_loss: 0.9693, test_f1: 0.4980
 epoch: 12, train_loss: 0.9631, test_loss: 0.9670, test_f1: 0.5086
 epoch: 13, train_loss: 0.9539, test_loss: 0.9502, test_f1: 0.4941
 epoch: 14, train_loss: 0.9394, test_loss: 0.9534, test_f1: 0.4890
 epoch: 15, train_loss: 0.9389, test_loss: 0.9851, test_f1: 0.4751
 epoch: 16, train_loss: 0.9364, test_loss: 0.9613, test_f1: 0.5075
 epoch: 17, train_loss: 0.9174, test_loss: 0.9650, test_f1: 0.5286
 epoch: 18, train_loss: 0.9154, test_loss: 0.9503, test_f1: 0.5182
 epoch: 19, train_loss: 0.9040, test_loss: 0.9626, test_f1: 0.5206
 epoch: 20, train_loss: 0.8979, test_loss: 0.9545, test_f1: 0.5234
 epoch: 21, train_loss: 0.8863, test_loss: 0.9710, test_f1: 0.5172
 epoch: 22, train_loss: 0.8773, test_loss: 0.9576, test_f1: 0.5287
 epoch: 23, train_loss: 0.8786, test_loss: 0.9549, test_f1: 0.5207
 epoch: 24, train_loss: 0.8658, test_loss: 0.9585, test_f1: 0.5250
 epoch: 25, train_loss: 0.8628, test_loss: 0.9674, test_f1: 0.5311
 epoch: 26, train_loss: 0.8683, test_loss: 0.9497, test_f1: 0.5293
 epoch: 27, train_loss: 0.8539, test_loss: 0.9804, test_f1: 0.5017
 epoch: 28, train_loss: 0.8469, test_loss: 0.9520, test_f1: 0.5248
 epoch: 29, train_loss: 0.8545, test_loss: 0.9554, test_f1: 0.5206
 epoch: 30, train_loss: 0.8383, test_loss: 0.9467, test_f1: 0.5318
 epoch: 31, train_loss: 0.8305, test_loss: 0.9429, test_f1: 0.5308
 epoch: 32, train_loss: 0.8146, test_loss: 0.9548, test_f1: 0.5347
 epoch: 33, train_loss: 0.8190, test_loss: 0.9598, test_f1: 0.5272
 epoch: 34, train_loss: 0.8046, test_loss: 0.9404, test_f1: 0.5324
 epoch: 35, train_loss: 0.8120, test_loss: 1.0772, test_f1: 0.5111
 epoch: 36, train_loss: 0.7964, test_loss: 0.9491, test_f1: 0.5524
 epoch: 37, train_loss: 0.7835, test_loss: 0.9565, test_f1: 0.5371
 epoch: 38, train_loss: 0.7833, test_loss: 0.9520, test_f1: 0.5491
 epoch: 39, train_loss: 0.7864, test_loss: 0.9589, test_f1: 0.5443
 epoch: 40, train_loss: 0.7792, test_loss: 0.9474, test_f1: 0.5424
 epoch: 41, train_loss: 0.7838, test_loss: 0.9337, test_f1: 0.5542
 epoch: 42, train_loss: 0.7625, test_loss: 0.9270, test_f1: 0.5503
 epoch: 43, train_loss: 0.7726, test_loss: 0.9223, test_f1: 0.5535
 epoch: 44, train_loss: 0.7635, test_loss: 0.8984, test_f1: 0.5569
 epoch: 45, train_loss: 0.7749, test_loss: 0.9283, test_f1: 0.5538
 epoch: 46, train_loss: 0.7649, test_loss: 0.9416, test_f1: 0.5507
 epoch: 47, train_loss: 0.7584, test_loss: 0.9463, test_f1: 0.5472
 epoch: 48, train_loss: 0.7458, test_loss: 0.9352, test_f1: 0.5445
 epoch: 49, train_loss: 0.7474, test_loss: 0.9381, test_f1: 0.5409
 epoch: 50, train_loss: 0.7494, test_loss: 0.9486, test_f1: 0.5472
 epoch: 51, train_loss: 0.7401, test_loss: 0.9466, test_f1: 0.5401
 epoch: 52, train_loss: 0.7270, test_loss: 0.9445, test_f1: 0.5590
 epoch: 53, train_loss: 0.7257, test_loss: 0.9414, test_f1: 0.5513
 epoch: 54, train_loss: 0.7251, test_loss: 0.9606, test_f1: 0.5506
 epoch: 55, train_loss: 0.7237, test_loss: 0.9204, test_f1: 0.5647
 epoch: 56, train_loss: 0.7073, test_loss: 0.9659, test_f1: 0.5554
 epoch: 57, train_loss: 0.7153, test_loss: 0.9535, test_f1: 0.5563
 epoch: 58, train_loss: 0.7124, test_loss: 0.9526, test_f1: 0.5602
 epoch: 59, train_loss: 0.7032, test_loss: 0.9507, test_f1: 0.5552
 epoch: 60, train_loss: 0.7045, test_loss: 0.9446, test_f1: 0.5564
 epoch: 61, train_loss: 0.7155, test_loss: 0.9569, test_f1: 0.5532
 epoch: 62, train_loss: 0.7086, test_loss: 0.9459, test_f1: 0.5605
 epoch: 63, train_loss: 0.7061, test_loss: 0.9532, test_f1: 0.5538
 epoch: 64, train_loss: 0.7041, test_loss: 0.9596, test_f1: 0.5562
 epoch: 65, train_loss: 0.7015, test_loss: 0.9520, test_f1: 0.5487
 epoch: 66, train_loss: 0.7026, test_loss: 0.9547, test_f1: 0.5513
 epoch: 67, train_loss: 0.6990, test_loss: 0.9628, test_f1: 0.5571
 epoch: 68, train_loss: 0.7035, test_loss: 0.9627, test_f1: 0.5607
 epoch: 69, train_loss: 0.7044, test_loss: 0.9645, test_f1: 0.5456
 epoch: 70, train_loss: 0.6785, test_loss: 0.9626, test_f1: 0.5555
 epoch: 71, train_loss: 0.6902, test_loss: 0.9823, test_f1: 0.5561
 epoch: 72, train_loss: 0.6996, test_loss: 0.9604, test_f1: 0.5551
 epoch: 73, train_loss: 0.6803, test_loss: 0.9678, test_f1: 0.5532
 epoch: 74, train_loss: 0.6863, test_loss: 0.9799, test_f1: 0.5509
 epoch: 75, train_loss: 0.6869, test_loss: 0.9741, test_f1: 0.5548
 epoch: 76, train_loss: 0.6828, test_loss: 0.9695, test_f1: 0.5531
 epoch: 77, train_loss: 0.6765, test_loss: 0.9627, test_f1: 0.5543
 epoch: 78, train_loss: 0.6890, test_loss: 0.9789, test_f1: 0.5479
 epoch: 79, train_loss: 0.6898, test_loss: 0.9374, test_f1: 0.5609
 epoch: 80, train_loss: 0.6904, test_loss: 0.9706, test_f1: 0.5608
 epoch: 81, train_loss: 0.6795, test_loss: 0.9751, test_f1: 0.5489
 epoch: 82, train_loss: 0.6798, test_loss: 0.9656, test_f1: 0.5553
 epoch: 83, train_loss: 0.6705, test_loss: 0.9663, test_f1: 0.5523
 epoch: 84, train_loss: 0.6682, test_loss: 0.9719, test_f1: 0.5347
 epoch: 85, train_loss: 0.6607, test_loss: 0.9693, test_f1: 0.5439
 epoch: 86, train_loss: 0.6698, test_loss: 0.9942, test_f1: 0.5382
 epoch: 87, train_loss: 0.6749, test_loss: 0.9768, test_f1: 0.5561
 epoch: 88, train_loss: 0.6732, test_loss: 0.9749, test_f1: 0.5507
 epoch: 89, train_loss: 0.6682, test_loss: 0.9860, test_f1: 0.5437
 epoch: 90, train_loss: 0.6621, test_loss: 0.9664, test_f1: 0.5563
 epoch: 91, train_loss: 0.6615, test_loss: 0.9932, test_f1: 0.5562
 epoch: 92, train_loss: 0.6543, test_loss: 0.9721, test_f1: 0.5552
 epoch: 93, train_loss: 0.6444, test_loss: 0.9810, test_f1: 0.5523
 epoch: 94, train_loss: 0.6605, test_loss: 1.0193, test_f1: 0.5412
 epoch: 95, train_loss: 0.6734, test_loss: 0.9832, test_f1: 0.5481
 epoch: 96, train_loss: 0.6719, test_loss: 0.9808, test_f1: 0.5467
 epoch: 97, train_loss: 0.6573, test_loss: 0.9992, test_f1: 0.5459
 epoch: 98, train_loss: 0.6568, test_loss: 0.9700, test_f1: 0.5514
 epoch: 99, train_loss: 0.6562, test_loss: 0.9834, test_f1: 0.5553
##################ITERATION #6 ****************************************
 epoch: 0, train_loss: 1.2937, test_loss: 1.2912, test_f1: 0.2260
 epoch: 1, train_loss: 1.2177, test_loss: 1.2206, test_f1: 0.2869
 epoch: 2, train_loss: 1.1706, test_loss: 1.1268, test_f1: 0.4366
 epoch: 3, train_loss: 1.1375, test_loss: 1.0792, test_f1: 0.4657
 epoch: 4, train_loss: 1.1048, test_loss: 1.0539, test_f1: 0.4681
 epoch: 5, train_loss: 1.0820, test_loss: 1.0368, test_f1: 0.4507
 epoch: 6, train_loss: 1.0637, test_loss: 1.0111, test_f1: 0.4609
 epoch: 7, train_loss: 1.0359, test_loss: 0.9899, test_f1: 0.4693
 epoch: 8, train_loss: 1.0260, test_loss: 0.9756, test_f1: 0.4717
 epoch: 9, train_loss: 0.9992, test_loss: 0.9748, test_f1: 0.4576
 epoch: 10, train_loss: 0.9926, test_loss: 0.9677, test_f1: 0.4556
 epoch: 11, train_loss: 0.9891, test_loss: 0.9469, test_f1: 0.4821
 epoch: 12, train_loss: 0.9834, test_loss: 0.9420, test_f1: 0.4714
 epoch: 13, train_loss: 0.9514, test_loss: 0.9367, test_f1: 0.4990
 epoch: 14, train_loss: 0.9390, test_loss: 0.9369, test_f1: 0.4801
 epoch: 15, train_loss: 0.9383, test_loss: 0.9240, test_f1: 0.4972
 epoch: 16, train_loss: 0.9221, test_loss: 0.9048, test_f1: 0.5122
 epoch: 17, train_loss: 0.9201, test_loss: 0.9038, test_f1: 0.5138
 epoch: 18, train_loss: 0.9077, test_loss: 0.9123, test_f1: 0.5149
 epoch: 19, train_loss: 0.8969, test_loss: 0.9163, test_f1: 0.5088
 epoch: 20, train_loss: 0.8940, test_loss: 0.9292, test_f1: 0.5098
 epoch: 21, train_loss: 0.8915, test_loss: 0.9110, test_f1: 0.5127
 epoch: 22, train_loss: 0.8775, test_loss: 0.8978, test_f1: 0.5246
 epoch: 23, train_loss: 0.8725, test_loss: 0.8998, test_f1: 0.5110
 epoch: 24, train_loss: 0.8690, test_loss: 0.9064, test_f1: 0.5240
 epoch: 25, train_loss: 0.8583, test_loss: 0.8937, test_f1: 0.5252
 epoch: 26, train_loss: 0.8529, test_loss: 0.9302, test_f1: 0.5315
 epoch: 27, train_loss: 0.8429, test_loss: 0.9416, test_f1: 0.5177
 epoch: 28, train_loss: 0.8352, test_loss: 0.9423, test_f1: 0.5203
 epoch: 29, train_loss: 0.8388, test_loss: 0.8987, test_f1: 0.5344
 epoch: 30, train_loss: 0.8235, test_loss: 0.9357, test_f1: 0.5288
 epoch: 31, train_loss: 0.8273, test_loss: 0.9529, test_f1: 0.5312
 epoch: 32, train_loss: 0.8197, test_loss: 0.9156, test_f1: 0.5471
 epoch: 33, train_loss: 0.8049, test_loss: 0.9346, test_f1: 0.5379
 epoch: 34, train_loss: 0.8078, test_loss: 0.9308, test_f1: 0.5279
 epoch: 35, train_loss: 0.7955, test_loss: 0.9132, test_f1: 0.5283
 epoch: 36, train_loss: 0.7950, test_loss: 0.9469, test_f1: 0.5351
 epoch: 37, train_loss: 0.7791, test_loss: 0.9192, test_f1: 0.5493
 epoch: 38, train_loss: 0.7749, test_loss: 0.8877, test_f1: 0.5523
 epoch: 39, train_loss: 0.7812, test_loss: 0.9411, test_f1: 0.5414
 epoch: 40, train_loss: 0.7891, test_loss: 0.9478, test_f1: 0.5472
 epoch: 41, train_loss: 0.7770, test_loss: 0.9284, test_f1: 0.5462
 epoch: 42, train_loss: 0.7700, test_loss: 0.9819, test_f1: 0.5534
 epoch: 43, train_loss: 0.7582, test_loss: 0.9333, test_f1: 0.5408
 epoch: 44, train_loss: 0.7523, test_loss: 0.9927, test_f1: 0.5458
 epoch: 45, train_loss: 0.7544, test_loss: 0.9635, test_f1: 0.5468
 epoch: 46, train_loss: 0.7604, test_loss: 0.9690, test_f1: 0.5516
 epoch: 47, train_loss: 0.7448, test_loss: 0.9618, test_f1: 0.5614
 epoch: 48, train_loss: 0.7408, test_loss: 0.9760, test_f1: 0.5464
 epoch: 49, train_loss: 0.7358, test_loss: 1.0004, test_f1: 0.5513
 epoch: 50, train_loss: 0.7351, test_loss: 0.9154, test_f1: 0.5696
 epoch: 51, train_loss: 0.7240, test_loss: 0.9481, test_f1: 0.5764
 epoch: 52, train_loss: 0.7199, test_loss: 0.9618, test_f1: 0.5707
 epoch: 53, train_loss: 0.7286, test_loss: 0.9657, test_f1: 0.5678
 epoch: 54, train_loss: 0.7196, test_loss: 0.9712, test_f1: 0.5595
 epoch: 55, train_loss: 0.7069, test_loss: 0.9747, test_f1: 0.5610
 epoch: 56, train_loss: 0.7027, test_loss: 0.9963, test_f1: 0.5593
 epoch: 57, train_loss: 0.7048, test_loss: 1.0056, test_f1: 0.5595
 epoch: 58, train_loss: 0.7028, test_loss: 0.9946, test_f1: 0.5562
 epoch: 59, train_loss: 0.7008, test_loss: 0.9468, test_f1: 0.5773
 epoch: 60, train_loss: 0.6997, test_loss: 0.9506, test_f1: 0.5535
 epoch: 61, train_loss: 0.6924, test_loss: 0.9727, test_f1: 0.5479
 epoch: 62, train_loss: 0.6993, test_loss: 0.9643, test_f1: 0.5530
 epoch: 63, train_loss: 0.6981, test_loss: 0.9884, test_f1: 0.5557
 epoch: 64, train_loss: 0.6926, test_loss: 0.9764, test_f1: 0.5679
 epoch: 65, train_loss: 0.6870, test_loss: 1.0279, test_f1: 0.5436
 epoch: 66, train_loss: 0.6782, test_loss: 1.0241, test_f1: 0.5312
 epoch: 67, train_loss: 0.6723, test_loss: 0.9718, test_f1: 0.5648
 epoch: 68, train_loss: 0.6948, test_loss: 0.9753, test_f1: 0.5567
 epoch: 69, train_loss: 0.6874, test_loss: 0.9998, test_f1: 0.5639
 epoch: 70, train_loss: 0.6831, test_loss: 1.0014, test_f1: 0.5469
 epoch: 71, train_loss: 0.6797, test_loss: 0.9751, test_f1: 0.5518
 epoch: 72, train_loss: 0.6859, test_loss: 0.9776, test_f1: 0.5497
 epoch: 73, train_loss: 0.6866, test_loss: 0.9761, test_f1: 0.5538
 epoch: 74, train_loss: 0.6931, test_loss: 0.9746, test_f1: 0.5545
 epoch: 75, train_loss: 0.6776, test_loss: 1.0096, test_f1: 0.5537
 epoch: 76, train_loss: 0.6850, test_loss: 1.0095, test_f1: 0.5373
 epoch: 77, train_loss: 0.6720, test_loss: 0.9766, test_f1: 0.5461
 epoch: 78, train_loss: 0.6706, test_loss: 0.9627, test_f1: 0.5535
 epoch: 79, train_loss: 0.6739, test_loss: 0.9856, test_f1: 0.5535
 epoch: 80, train_loss: 0.6666, test_loss: 1.0089, test_f1: 0.5565
 epoch: 81, train_loss: 0.6609, test_loss: 1.0076, test_f1: 0.5554
 epoch: 82, train_loss: 0.6603, test_loss: 1.0035, test_f1: 0.5613
 epoch: 83, train_loss: 0.6540, test_loss: 0.9317, test_f1: 0.5739
 epoch: 84, train_loss: 0.6724, test_loss: 1.0221, test_f1: 0.5699
 epoch: 85, train_loss: 0.6575, test_loss: 0.9915, test_f1: 0.5679
 epoch: 86, train_loss: 0.6509, test_loss: 0.9692, test_f1: 0.5647
 epoch: 87, train_loss: 0.6513, test_loss: 1.0287, test_f1: 0.5540
 epoch: 88, train_loss: 0.6571, test_loss: 1.0193, test_f1: 0.5691
 epoch: 89, train_loss: 0.6636, test_loss: 1.0068, test_f1: 0.5618
 epoch: 90, train_loss: 0.6494, test_loss: 0.9549, test_f1: 0.5479
 epoch: 91, train_loss: 0.6498, test_loss: 1.0031, test_f1: 0.5558
 epoch: 92, train_loss: 0.6494, test_loss: 0.9962, test_f1: 0.5579
 epoch: 93, train_loss: 0.6564, test_loss: 1.0213, test_f1: 0.5623
 epoch: 94, train_loss: 0.6540, test_loss: 1.0382, test_f1: 0.5533
 epoch: 95, train_loss: 0.6423, test_loss: 1.0474, test_f1: 0.5442
 epoch: 96, train_loss: 0.6403, test_loss: 1.0609, test_f1: 0.5531
 epoch: 97, train_loss: 0.6470, test_loss: 1.0056, test_f1: 0.5662
 epoch: 98, train_loss: 0.6458, test_loss: 1.0159, test_f1: 0.5635
 epoch: 99, train_loss: 0.6501, test_loss: 1.0423, test_f1: 0.5593
##################ITERATION #7 ****************************************
 epoch: 0, train_loss: 1.2437, test_loss: 1.2702, test_f1: 0.2260
 epoch: 1, train_loss: 1.1628, test_loss: 1.1693, test_f1: 0.4123
 epoch: 2, train_loss: 1.1142, test_loss: 1.0722, test_f1: 0.4450
 epoch: 3, train_loss: 1.0839, test_loss: 1.0315, test_f1: 0.4616
 epoch: 4, train_loss: 1.0589, test_loss: 1.0114, test_f1: 0.4563
 epoch: 5, train_loss: 1.0351, test_loss: 0.9959, test_f1: 0.4683
 epoch: 6, train_loss: 1.0234, test_loss: 0.9875, test_f1: 0.4777
 epoch: 7, train_loss: 1.0018, test_loss: 0.9857, test_f1: 0.4730
 epoch: 8, train_loss: 1.0007, test_loss: 0.9779, test_f1: 0.4775
 epoch: 9, train_loss: 0.9823, test_loss: 0.9720, test_f1: 0.4788
 epoch: 10, train_loss: 0.9808, test_loss: 0.9729, test_f1: 0.4844
 epoch: 11, train_loss: 0.9630, test_loss: 0.9658, test_f1: 0.4791
 epoch: 12, train_loss: 0.9532, test_loss: 0.9704, test_f1: 0.4851
 epoch: 13, train_loss: 0.9447, test_loss: 0.9702, test_f1: 0.4953
 epoch: 14, train_loss: 0.9306, test_loss: 0.9598, test_f1: 0.4944
 epoch: 15, train_loss: 0.9324, test_loss: 0.9561, test_f1: 0.4869
 epoch: 16, train_loss: 0.9254, test_loss: 0.9456, test_f1: 0.5046
 epoch: 17, train_loss: 0.9175, test_loss: 0.9576, test_f1: 0.5032
 epoch: 18, train_loss: 0.9139, test_loss: 0.9612, test_f1: 0.5023
 epoch: 19, train_loss: 0.9114, test_loss: 0.9494, test_f1: 0.4972
 epoch: 20, train_loss: 0.8884, test_loss: 0.9538, test_f1: 0.5053
 epoch: 21, train_loss: 0.8893, test_loss: 0.9512, test_f1: 0.5065
 epoch: 22, train_loss: 0.8857, test_loss: 0.9512, test_f1: 0.5102
 epoch: 23, train_loss: 0.8725, test_loss: 0.9392, test_f1: 0.5052
 epoch: 24, train_loss: 0.8680, test_loss: 0.9604, test_f1: 0.5084
 epoch: 25, train_loss: 0.8549, test_loss: 0.9779, test_f1: 0.5036
 epoch: 26, train_loss: 0.8503, test_loss: 0.9819, test_f1: 0.4833
 epoch: 27, train_loss: 0.8479, test_loss: 0.9585, test_f1: 0.5002
 epoch: 28, train_loss: 0.8416, test_loss: 0.9536, test_f1: 0.5106
 epoch: 29, train_loss: 0.8375, test_loss: 0.9802, test_f1: 0.4981
 epoch: 30, train_loss: 0.8255, test_loss: 0.9810, test_f1: 0.4931
 epoch: 31, train_loss: 0.8245, test_loss: 0.9864, test_f1: 0.4916
 epoch: 32, train_loss: 0.8130, test_loss: 0.9648, test_f1: 0.5111
 epoch: 33, train_loss: 0.8139, test_loss: 0.9700, test_f1: 0.5202
 epoch: 34, train_loss: 0.8115, test_loss: 0.9845, test_f1: 0.5205
 epoch: 35, train_loss: 0.7917, test_loss: 0.9566, test_f1: 0.5125
 epoch: 36, train_loss: 0.7929, test_loss: 0.9639, test_f1: 0.5302
 epoch: 37, train_loss: 0.7790, test_loss: 0.9695, test_f1: 0.5292
 epoch: 38, train_loss: 0.7779, test_loss: 0.9745, test_f1: 0.5241
 epoch: 39, train_loss: 0.7835, test_loss: 0.9855, test_f1: 0.5104
 epoch: 40, train_loss: 0.7688, test_loss: 0.9957, test_f1: 0.5226
 epoch: 41, train_loss: 0.7611, test_loss: 1.0117, test_f1: 0.5191
 epoch: 42, train_loss: 0.7640, test_loss: 0.9790, test_f1: 0.5317
 epoch: 43, train_loss: 0.7632, test_loss: 0.9758, test_f1: 0.5391
 epoch: 44, train_loss: 0.7574, test_loss: 1.0158, test_f1: 0.5172
 epoch: 45, train_loss: 0.7523, test_loss: 0.9965, test_f1: 0.5129
 epoch: 46, train_loss: 0.7372, test_loss: 0.9944, test_f1: 0.5290
 epoch: 47, train_loss: 0.7365, test_loss: 0.9867, test_f1: 0.5205
 epoch: 48, train_loss: 0.7305, test_loss: 1.0302, test_f1: 0.5061
 epoch: 49, train_loss: 0.7298, test_loss: 1.0692, test_f1: 0.5075
 epoch: 50, train_loss: 0.7367, test_loss: 1.0091, test_f1: 0.5217
 epoch: 51, train_loss: 0.7124, test_loss: 1.0441, test_f1: 0.5137
 epoch: 52, train_loss: 0.7028, test_loss: 1.0692, test_f1: 0.5053
 epoch: 53, train_loss: 0.7060, test_loss: 1.0350, test_f1: 0.5101
 epoch: 54, train_loss: 0.7173, test_loss: 1.0244, test_f1: 0.5070
 epoch: 55, train_loss: 0.7111, test_loss: 1.0523, test_f1: 0.4980
 epoch: 56, train_loss: 0.7021, test_loss: 1.0473, test_f1: 0.5032
 epoch: 57, train_loss: 0.6966, test_loss: 1.0511, test_f1: 0.5051
 epoch: 58, train_loss: 0.6910, test_loss: 1.0655, test_f1: 0.5086
 epoch: 59, train_loss: 0.6958, test_loss: 1.0393, test_f1: 0.4978
 epoch: 60, train_loss: 0.6964, test_loss: 1.0215, test_f1: 0.4957
 epoch: 61, train_loss: 0.6894, test_loss: 1.0389, test_f1: 0.5089
 epoch: 62, train_loss: 0.6832, test_loss: 1.0583, test_f1: 0.5036
 epoch: 63, train_loss: 0.6764, test_loss: 1.0576, test_f1: 0.5182
 epoch: 64, train_loss: 0.6796, test_loss: 1.0517, test_f1: 0.5169
 epoch: 65, train_loss: 0.6859, test_loss: 1.0645, test_f1: 0.5071
 epoch: 66, train_loss: 0.6915, test_loss: 1.0704, test_f1: 0.4926
 epoch: 67, train_loss: 0.6837, test_loss: 1.1169, test_f1: 0.4968
 epoch: 68, train_loss: 0.6793, test_loss: 1.0508, test_f1: 0.5099
 epoch: 69, train_loss: 0.6742, test_loss: 1.0528, test_f1: 0.5163
 epoch: 70, train_loss: 0.6819, test_loss: 1.0573, test_f1: 0.5175
 epoch: 71, train_loss: 0.6683, test_loss: 1.0428, test_f1: 0.5180
 epoch: 72, train_loss: 0.6727, test_loss: 1.0453, test_f1: 0.5047
 epoch: 73, train_loss: 0.6654, test_loss: 1.0413, test_f1: 0.5138
 epoch: 74, train_loss: 0.6786, test_loss: 1.0639, test_f1: 0.4948
 epoch: 75, train_loss: 0.6628, test_loss: 1.0796, test_f1: 0.4968
 epoch: 76, train_loss: 0.6629, test_loss: 1.0615, test_f1: 0.4987
 epoch: 77, train_loss: 0.6551, test_loss: 1.0431, test_f1: 0.5045
 epoch: 78, train_loss: 0.6517, test_loss: 1.0743, test_f1: 0.4939
 epoch: 79, train_loss: 0.6523, test_loss: 1.0649, test_f1: 0.4981
 epoch: 80, train_loss: 0.6546, test_loss: 1.0653, test_f1: 0.4966
 epoch: 81, train_loss: 0.6544, test_loss: 1.0579, test_f1: 0.5038
 epoch: 82, train_loss: 0.6516, test_loss: 1.0731, test_f1: 0.4913
 epoch: 83, train_loss: 0.6419, test_loss: 1.1046, test_f1: 0.4930
 epoch: 84, train_loss: 0.6383, test_loss: 1.0910, test_f1: 0.4945
 epoch: 85, train_loss: 0.6568, test_loss: 1.0552, test_f1: 0.5172
 epoch: 86, train_loss: 0.6423, test_loss: 1.0657, test_f1: 0.4999
 epoch: 87, train_loss: 0.6638, test_loss: 1.0284, test_f1: 0.5198
 epoch: 88, train_loss: 0.6460, test_loss: 1.0657, test_f1: 0.4983
 epoch: 89, train_loss: 0.6657, test_loss: 1.0909, test_f1: 0.5090
 epoch: 90, train_loss: 0.6388, test_loss: 1.0931, test_f1: 0.5007
 epoch: 91, train_loss: 0.6382, test_loss: 1.0531, test_f1: 0.5039
 epoch: 92, train_loss: 0.6378, test_loss: 1.0766, test_f1: 0.5038
 epoch: 93, train_loss: 0.6358, test_loss: 1.0716, test_f1: 0.5086
 epoch: 94, train_loss: 0.6317, test_loss: 1.0863, test_f1: 0.5170
 epoch: 95, train_loss: 0.6378, test_loss: 1.0559, test_f1: 0.5201
 epoch: 96, train_loss: 0.6350, test_loss: 1.0835, test_f1: 0.5158
 epoch: 97, train_loss: 0.6286, test_loss: 1.0880, test_f1: 0.4978
 epoch: 98, train_loss: 0.6236, test_loss: 1.1031, test_f1: 0.5163
 epoch: 99, train_loss: 0.6388, test_loss: 1.0969, test_f1: 0.4965
##################ITERATION #8 ****************************************
 epoch: 0, train_loss: 1.2625, test_loss: 1.2579, test_f1: 0.2260
 epoch: 1, train_loss: 1.1775, test_loss: 1.1766, test_f1: 0.3555
 epoch: 2, train_loss: 1.1515, test_loss: 1.1273, test_f1: 0.3519
 epoch: 3, train_loss: 1.1225, test_loss: 1.0743, test_f1: 0.4130
 epoch: 4, train_loss: 1.0982, test_loss: 1.0573, test_f1: 0.4012
 epoch: 5, train_loss: 1.0816, test_loss: 1.0459, test_f1: 0.4360
 epoch: 6, train_loss: 1.0622, test_loss: 1.0251, test_f1: 0.4402
 epoch: 7, train_loss: 1.0393, test_loss: 1.0277, test_f1: 0.4239
 epoch: 8, train_loss: 1.0179, test_loss: 1.0153, test_f1: 0.4376
 epoch: 9, train_loss: 1.0071, test_loss: 0.9986, test_f1: 0.4641
 epoch: 10, train_loss: 1.0018, test_loss: 1.0012, test_f1: 0.4587
 epoch: 11, train_loss: 0.9888, test_loss: 0.9871, test_f1: 0.4609
 epoch: 12, train_loss: 0.9865, test_loss: 0.9732, test_f1: 0.4849
 epoch: 13, train_loss: 0.9638, test_loss: 0.9648, test_f1: 0.4815
 epoch: 14, train_loss: 0.9575, test_loss: 0.9737, test_f1: 0.4771
 epoch: 15, train_loss: 0.9458, test_loss: 0.9682, test_f1: 0.4946
 epoch: 16, train_loss: 0.9393, test_loss: 0.9473, test_f1: 0.4765
 epoch: 17, train_loss: 0.9359, test_loss: 0.9519, test_f1: 0.4922
 epoch: 18, train_loss: 0.9244, test_loss: 0.9498, test_f1: 0.4825
 epoch: 19, train_loss: 0.9248, test_loss: 0.9314, test_f1: 0.4902
 epoch: 20, train_loss: 0.9056, test_loss: 0.9483, test_f1: 0.4821
 epoch: 21, train_loss: 0.9025, test_loss: 0.9388, test_f1: 0.4809
 epoch: 22, train_loss: 0.9021, test_loss: 0.9421, test_f1: 0.4845
 epoch: 23, train_loss: 0.8901, test_loss: 0.9523, test_f1: 0.4898
 epoch: 24, train_loss: 0.8899, test_loss: 0.9438, test_f1: 0.5096
 epoch: 25, train_loss: 0.8750, test_loss: 0.9270, test_f1: 0.5084
 epoch: 26, train_loss: 0.8653, test_loss: 0.9257, test_f1: 0.5225
 epoch: 27, train_loss: 0.8634, test_loss: 0.9365, test_f1: 0.5024
 epoch: 28, train_loss: 0.8647, test_loss: 0.9388, test_f1: 0.5076
 epoch: 29, train_loss: 0.8526, test_loss: 0.9281, test_f1: 0.5175
 epoch: 30, train_loss: 0.8538, test_loss: 0.9496, test_f1: 0.5094
 epoch: 31, train_loss: 0.8502, test_loss: 0.9440, test_f1: 0.5102
 epoch: 32, train_loss: 0.8368, test_loss: 0.9306, test_f1: 0.5065
 epoch: 33, train_loss: 0.8422, test_loss: 0.9520, test_f1: 0.5190
 epoch: 34, train_loss: 0.8249, test_loss: 0.9194, test_f1: 0.5165
 epoch: 35, train_loss: 0.8290, test_loss: 0.9233, test_f1: 0.5252
 epoch: 36, train_loss: 0.8193, test_loss: 0.9526, test_f1: 0.5211
 epoch: 37, train_loss: 0.8125, test_loss: 0.9374, test_f1: 0.5265
 epoch: 38, train_loss: 0.8162, test_loss: 0.9203, test_f1: 0.5378
 epoch: 39, train_loss: 0.8105, test_loss: 0.9505, test_f1: 0.5350
 epoch: 40, train_loss: 0.8168, test_loss: 0.9265, test_f1: 0.5334
 epoch: 41, train_loss: 0.7976, test_loss: 0.9450, test_f1: 0.5387
 epoch: 42, train_loss: 0.7921, test_loss: 0.9272, test_f1: 0.5389
 epoch: 43, train_loss: 0.7920, test_loss: 0.9458, test_f1: 0.5344
 epoch: 44, train_loss: 0.7933, test_loss: 0.9205, test_f1: 0.5489
 epoch: 45, train_loss: 0.7863, test_loss: 0.9354, test_f1: 0.5272
 epoch: 46, train_loss: 0.7753, test_loss: 0.9110, test_f1: 0.5348
 epoch: 47, train_loss: 0.7796, test_loss: 0.9544, test_f1: 0.5327
 epoch: 48, train_loss: 0.7712, test_loss: 0.9347, test_f1: 0.5252
 epoch: 49, train_loss: 0.7672, test_loss: 0.9263, test_f1: 0.5378
 epoch: 50, train_loss: 0.7559, test_loss: 0.9311, test_f1: 0.5548
 epoch: 51, train_loss: 0.7554, test_loss: 0.9239, test_f1: 0.5498
 epoch: 52, train_loss: 0.7467, test_loss: 0.9223, test_f1: 0.5418
 epoch: 53, train_loss: 0.7525, test_loss: 0.9160, test_f1: 0.5505
 epoch: 54, train_loss: 0.7461, test_loss: 0.9108, test_f1: 0.5429
 epoch: 55, train_loss: 0.7529, test_loss: 0.9202, test_f1: 0.5416
 epoch: 56, train_loss: 0.7511, test_loss: 0.9359, test_f1: 0.5413
 epoch: 57, train_loss: 0.7502, test_loss: 0.9339, test_f1: 0.5450
 epoch: 58, train_loss: 0.7397, test_loss: 0.9305, test_f1: 0.5500
 epoch: 59, train_loss: 0.7304, test_loss: 0.9355, test_f1: 0.5374
 epoch: 60, train_loss: 0.7300, test_loss: 0.9404, test_f1: 0.5433
 epoch: 61, train_loss: 0.7411, test_loss: 0.9329, test_f1: 0.5480
 epoch: 62, train_loss: 0.7270, test_loss: 0.9421, test_f1: 0.5397
 epoch: 63, train_loss: 0.7278, test_loss: 0.9331, test_f1: 0.5516
 epoch: 64, train_loss: 0.7255, test_loss: 0.9401, test_f1: 0.5493
 epoch: 65, train_loss: 0.7264, test_loss: 0.9462, test_f1: 0.5570
 epoch: 66, train_loss: 0.7274, test_loss: 0.9726, test_f1: 0.5523
 epoch: 67, train_loss: 0.7220, test_loss: 0.9288, test_f1: 0.5507
 epoch: 68, train_loss: 0.7214, test_loss: 0.9393, test_f1: 0.5396
 epoch: 69, train_loss: 0.7260, test_loss: 0.9376, test_f1: 0.5566
 epoch: 70, train_loss: 0.7173, test_loss: 0.9400, test_f1: 0.5496
 epoch: 71, train_loss: 0.7067, test_loss: 0.9460, test_f1: 0.5533
 epoch: 72, train_loss: 0.7272, test_loss: 0.9711, test_f1: 0.5557
 epoch: 73, train_loss: 0.7180, test_loss: 0.9559, test_f1: 0.5489
 epoch: 74, train_loss: 0.7222, test_loss: 0.9530, test_f1: 0.5399
 epoch: 75, train_loss: 0.7087, test_loss: 0.9644, test_f1: 0.5429
 epoch: 76, train_loss: 0.6967, test_loss: 0.9596, test_f1: 0.5483
 epoch: 77, train_loss: 0.7064, test_loss: 0.9459, test_f1: 0.5578
 epoch: 78, train_loss: 0.7008, test_loss: 0.9527, test_f1: 0.5467
 epoch: 79, train_loss: 0.7050, test_loss: 0.9560, test_f1: 0.5450
 epoch: 80, train_loss: 0.7038, test_loss: 0.9629, test_f1: 0.5498
 epoch: 81, train_loss: 0.6981, test_loss: 0.9640, test_f1: 0.5491
 epoch: 82, train_loss: 0.7023, test_loss: 0.9760, test_f1: 0.5460
 epoch: 83, train_loss: 0.6973, test_loss: 0.9591, test_f1: 0.5519
 epoch: 84, train_loss: 0.6989, test_loss: 0.9631, test_f1: 0.5483
 epoch: 85, train_loss: 0.6924, test_loss: 0.9637, test_f1: 0.5485
 epoch: 86, train_loss: 0.6845, test_loss: 0.9630, test_f1: 0.5488
 epoch: 87, train_loss: 0.6964, test_loss: 0.9500, test_f1: 0.5560
 epoch: 88, train_loss: 0.6900, test_loss: 0.9704, test_f1: 0.5468
 epoch: 89, train_loss: 0.6855, test_loss: 1.0061, test_f1: 0.5434
 epoch: 90, train_loss: 0.6950, test_loss: 0.9807, test_f1: 0.5503
 epoch: 91, train_loss: 0.6799, test_loss: 0.9863, test_f1: 0.5515
 epoch: 92, train_loss: 0.6856, test_loss: 0.9687, test_f1: 0.5458
 epoch: 93, train_loss: 0.6775, test_loss: 0.9714, test_f1: 0.5555
 epoch: 94, train_loss: 0.6816, test_loss: 0.9784, test_f1: 0.5622
 epoch: 95, train_loss: 0.6726, test_loss: 0.9853, test_f1: 0.5538
 epoch: 96, train_loss: 0.6793, test_loss: 0.9861, test_f1: 0.5653
 epoch: 97, train_loss: 0.6709, test_loss: 0.9738, test_f1: 0.5645
 epoch: 98, train_loss: 0.6756, test_loss: 0.9814, test_f1: 0.5562
 epoch: 99, train_loss: 0.6705, test_loss: 0.9826, test_f1: 0.5492
##################ITERATION #9 ****************************************
 epoch: 0, train_loss: 1.3053, test_loss: 1.2771, test_f1: 0.2260
 epoch: 1, train_loss: 1.1837, test_loss: 1.1744, test_f1: 0.3199
 epoch: 2, train_loss: 1.1411, test_loss: 1.0937, test_f1: 0.4364
 epoch: 3, train_loss: 1.1059, test_loss: 1.0575, test_f1: 0.4549
 epoch: 4, train_loss: 1.0799, test_loss: 1.0368, test_f1: 0.4553
 epoch: 5, train_loss: 1.0487, test_loss: 1.0254, test_f1: 0.4515
 epoch: 6, train_loss: 1.0218, test_loss: 1.0064, test_f1: 0.4661
 epoch: 7, train_loss: 1.0078, test_loss: 1.0018, test_f1: 0.4607
 epoch: 8, train_loss: 1.0012, test_loss: 0.9911, test_f1: 0.4606
 epoch: 9, train_loss: 0.9818, test_loss: 0.9897, test_f1: 0.4792
 epoch: 10, train_loss: 0.9704, test_loss: 0.9888, test_f1: 0.4758
 epoch: 11, train_loss: 0.9668, test_loss: 0.9911, test_f1: 0.4852
 epoch: 12, train_loss: 0.9461, test_loss: 0.9820, test_f1: 0.4834
 epoch: 13, train_loss: 0.9423, test_loss: 0.9788, test_f1: 0.4636
 epoch: 14, train_loss: 0.9393, test_loss: 0.9678, test_f1: 0.4887
 epoch: 15, train_loss: 0.9256, test_loss: 0.9684, test_f1: 0.4852
 epoch: 16, train_loss: 0.9111, test_loss: 0.9629, test_f1: 0.5075
 epoch: 17, train_loss: 0.9109, test_loss: 0.9645, test_f1: 0.5053
 epoch: 18, train_loss: 0.9000, test_loss: 0.9655, test_f1: 0.4974
 epoch: 19, train_loss: 0.8933, test_loss: 0.9645, test_f1: 0.5064
 epoch: 20, train_loss: 0.8854, test_loss: 0.9550, test_f1: 0.5122
 epoch: 21, train_loss: 0.8796, test_loss: 0.9706, test_f1: 0.4894
 epoch: 22, train_loss: 0.8787, test_loss: 0.9655, test_f1: 0.4964
 epoch: 23, train_loss: 0.8787, test_loss: 0.9571, test_f1: 0.5087
 epoch: 24, train_loss: 0.8630, test_loss: 0.9651, test_f1: 0.5012
 epoch: 25, train_loss: 0.8613, test_loss: 0.9536, test_f1: 0.5116
 epoch: 26, train_loss: 0.8515, test_loss: 0.9533, test_f1: 0.5138
 epoch: 27, train_loss: 0.8434, test_loss: 0.9698, test_f1: 0.5151
 epoch: 28, train_loss: 0.8501, test_loss: 0.9555, test_f1: 0.5132
 epoch: 29, train_loss: 0.8353, test_loss: 0.9560, test_f1: 0.5177
 epoch: 30, train_loss: 0.8304, test_loss: 0.9644, test_f1: 0.5078
 epoch: 31, train_loss: 0.8278, test_loss: 0.9628, test_f1: 0.5039
 epoch: 32, train_loss: 0.8294, test_loss: 0.9560, test_f1: 0.5169
 epoch: 33, train_loss: 0.8178, test_loss: 0.9549, test_f1: 0.5133
 epoch: 34, train_loss: 0.8192, test_loss: 0.9508, test_f1: 0.5153
 epoch: 35, train_loss: 0.8109, test_loss: 0.9490, test_f1: 0.5154
 epoch: 36, train_loss: 0.8143, test_loss: 0.9304, test_f1: 0.5233
 epoch: 37, train_loss: 0.8023, test_loss: 0.9423, test_f1: 0.5195
 epoch: 38, train_loss: 0.7988, test_loss: 0.9590, test_f1: 0.5227
 epoch: 39, train_loss: 0.7860, test_loss: 0.9527, test_f1: 0.5269
 epoch: 40, train_loss: 0.7910, test_loss: 0.9639, test_f1: 0.5226
 epoch: 41, train_loss: 0.7878, test_loss: 0.9783, test_f1: 0.5143
 epoch: 42, train_loss: 0.7748, test_loss: 0.9617, test_f1: 0.5223
 epoch: 43, train_loss: 0.7801, test_loss: 0.9648, test_f1: 0.5490
 epoch: 44, train_loss: 0.7688, test_loss: 0.9714, test_f1: 0.5528
 epoch: 45, train_loss: 0.7665, test_loss: 0.9813, test_f1: 0.5310
 epoch: 46, train_loss: 0.7650, test_loss: 0.9718, test_f1: 0.5445
 epoch: 47, train_loss: 0.7605, test_loss: 0.9623, test_f1: 0.5556
 epoch: 48, train_loss: 0.7476, test_loss: 0.9918, test_f1: 0.5390
 epoch: 49, train_loss: 0.7428, test_loss: 0.9892, test_f1: 0.5476
 epoch: 50, train_loss: 0.7440, test_loss: 0.9735, test_f1: 0.5521
 epoch: 51, train_loss: 0.7393, test_loss: 0.9920, test_f1: 0.5550
 epoch: 52, train_loss: 0.7379, test_loss: 0.9746, test_f1: 0.5615
 epoch: 53, train_loss: 0.7441, test_loss: 0.9818, test_f1: 0.5591
 epoch: 54, train_loss: 0.7382, test_loss: 0.9966, test_f1: 0.5529
 epoch: 55, train_loss: 0.7329, test_loss: 0.9914, test_f1: 0.5565
 epoch: 56, train_loss: 0.7284, test_loss: 0.9743, test_f1: 0.5695
 epoch: 57, train_loss: 0.7273, test_loss: 0.9732, test_f1: 0.5641
 epoch: 58, train_loss: 0.7236, test_loss: 0.9894, test_f1: 0.5631
 epoch: 59, train_loss: 0.7236, test_loss: 0.9711, test_f1: 0.5608
 epoch: 60, train_loss: 0.7228, test_loss: 0.9872, test_f1: 0.5663
 epoch: 61, train_loss: 0.7179, test_loss: 0.9887, test_f1: 0.5663
 epoch: 62, train_loss: 0.7237, test_loss: 1.0027, test_f1: 0.5564
 epoch: 63, train_loss: 0.7181, test_loss: 0.9961, test_f1: 0.5700
 epoch: 64, train_loss: 0.7114, test_loss: 0.9742, test_f1: 0.5614
 epoch: 65, train_loss: 0.7137, test_loss: 0.9908, test_f1: 0.5432
 epoch: 66, train_loss: 0.7145, test_loss: 1.0051, test_f1: 0.5446
 epoch: 67, train_loss: 0.7020, test_loss: 0.9875, test_f1: 0.5487
 epoch: 68, train_loss: 0.7144, test_loss: 0.9881, test_f1: 0.5549
 epoch: 69, train_loss: 0.7153, test_loss: 0.9876, test_f1: 0.5525
 epoch: 70, train_loss: 0.7165, test_loss: 0.9819, test_f1: 0.5600
 epoch: 71, train_loss: 0.7076, test_loss: 0.9980, test_f1: 0.5518
 epoch: 72, train_loss: 0.6952, test_loss: 1.0115, test_f1: 0.5343
 epoch: 73, train_loss: 0.6915, test_loss: 0.9998, test_f1: 0.5568
 epoch: 74, train_loss: 0.6922, test_loss: 1.0094, test_f1: 0.5426
 epoch: 75, train_loss: 0.6850, test_loss: 0.9962, test_f1: 0.5459
 epoch: 76, train_loss: 0.6904, test_loss: 0.9939, test_f1: 0.5556
 epoch: 77, train_loss: 0.6932, test_loss: 1.0008, test_f1: 0.5554
 epoch: 78, train_loss: 0.6900, test_loss: 1.0149, test_f1: 0.5424
 epoch: 79, train_loss: 0.6861, test_loss: 1.0045, test_f1: 0.5554
 epoch: 80, train_loss: 0.6861, test_loss: 1.0142, test_f1: 0.5580
 epoch: 81, train_loss: 0.6732, test_loss: 0.9973, test_f1: 0.5558
 epoch: 82, train_loss: 0.6794, test_loss: 0.9976, test_f1: 0.5531
 epoch: 83, train_loss: 0.6753, test_loss: 0.9981, test_f1: 0.5707
 epoch: 84, train_loss: 0.6659, test_loss: 0.9965, test_f1: 0.5641
 epoch: 85, train_loss: 0.6836, test_loss: 0.9912, test_f1: 0.5701
 epoch: 86, train_loss: 0.6788, test_loss: 1.0104, test_f1: 0.5528
 epoch: 87, train_loss: 0.6723, test_loss: 1.0109, test_f1: 0.5656
 epoch: 88, train_loss: 0.6685, test_loss: 1.0151, test_f1: 0.5656
 epoch: 89, train_loss: 0.6731, test_loss: 1.0194, test_f1: 0.5570
 epoch: 90, train_loss: 0.6769, test_loss: 1.0128, test_f1: 0.5508
 epoch: 91, train_loss: 0.6545, test_loss: 1.0224, test_f1: 0.5507
 epoch: 92, train_loss: 0.6627, test_loss: 1.0285, test_f1: 0.5454
 epoch: 93, train_loss: 0.6635, test_loss: 1.0103, test_f1: 0.5641
 epoch: 94, train_loss: 0.6580, test_loss: 1.0102, test_f1: 0.5640
 epoch: 95, train_loss: 0.6593, test_loss: 1.0234, test_f1: 0.5623
 epoch: 96, train_loss: 0.6577, test_loss: 1.0355, test_f1: 0.5694
 epoch: 97, train_loss: 0.6567, test_loss: 1.0333, test_f1: 0.5662
 epoch: 98, train_loss: 0.6595, test_loss: 1.0349, test_f1: 0.5719
 epoch: 99, train_loss: 0.6557, test_loss: 1.0197, test_f1: 0.5607

Training completed in 1092.86 seconds
Best F1: 0.5898 at epoch 94
Mean F1 across iterations: 0.5615  0.0151
========================FINAL RESULTS================================
FEGIN weighted F1: 0.5898  0.0151
python main.py --data ltspice_examples --representation component_pin --model FEGIN --layers 6 --hiddens 64 --batch_size 128 --lr 0.0001 --emb_size 250 --epochs 100 --save_appendix component_pin_L6_H64_BS128_LR0.0001_E250 --no_val
-----



STDERR:
  File "main.py", line 370, in <module>
    main()
  File "main.py", line 254, in main
    dataset = dataset_class(
  File "/home/philip/projects/llm_inference_code_repo/Circuit-Completion-Using-GNNs/component_classification_with_link_prediction_head/evaluation/FEGIN/kernel/circuit_datasets.py", line 15, in __init__
    self.data, self.slices = torch.load(self.processed_paths[0])
  File "/home/philip/.local/lib/python3.8/site-packages/torch/serialization.py", line 1040, in load
    warnings.warn(
  File "/usr/lib/python3.8/warnings.py", line 109, in _showwarnmsg
    sw(msg.message, msg.category, msg.filename, msg.lineno,
  File "main.py", line 47, in warn_with_traceback
    traceback.print_stack(file=log)
/home/philip/projects/llm_inference_code_repo/Circuit-Completion-Using-GNNs/component_classification_with_link_prediction_head/evaluation/FEGIN/kernel/circuit_datasets.py:15: FutureWarning: You are using `torch.load` with `weights_only=False` (the current default value), which uses the default pickle module implicitly. It is possible to construct malicious pickle data which will execute arbitrary code during unpickling (See https://github.com/pytorch/pytorch/blob/main/SECURITY.md#untrusted-models for more details). In a future release, the default value for `weights_only` will be flipped to `True`. This limits the functions that could be executed during unpickling. Arbitrary objects will no longer be allowed to be loaded via this mode unless they are explicitly allowlisted by the user via `torch.serialization.add_safe_globals`. We recommend you start setting `weights_only=True` for any use case where you don't have full control of the loaded file. Please open an issue on GitHub for any issues related to this experimental feature.
  self.data, self.slices = torch.load(self.processed_paths[0])
