STDOUT:
Results will be saved in /home/philip/projects/ltspice_examples_code_repo/Circuit-Completion-Using-GNNs/component_classification_with_link_prediction_head/evaluation/FEGIN/results/model_FEGIN_dataset_ltspice_examples
Command line input: python main.py --data ltspice_examples --representation component_net --model FEGIN --layers 5 --hiddens 128 --batch_size 64 --lr 0.0001 --emb_size 128 --epochs 100 --save_appendix component_net_L5_H128_BS64_LR0.0001_E128 --no_val
 is saved.
-----
ltspice_examples - FEGIN
Using 5 layers, 128 hidden units, h = 2
Loading component_net representation dataset
ENTERED
Training FEGIN on component_net representation
Train: 3558, Test: 846
##################ITERATION #0 ****************************************
 epoch: 0, train_loss: 1.3415, test_loss: 1.3232, test_f1: 0.2270
 epoch: 1, train_loss: 1.2619, test_loss: 1.2339, test_f1: 0.2295
 epoch: 2, train_loss: 1.2198, test_loss: 1.1779, test_f1: 0.3030
 epoch: 3, train_loss: 1.1747, test_loss: 1.1333, test_f1: 0.3958
 epoch: 4, train_loss: 1.1265, test_loss: 1.0760, test_f1: 0.4871
 epoch: 5, train_loss: 1.0807, test_loss: 1.0265, test_f1: 0.5438
 epoch: 6, train_loss: 1.0346, test_loss: 0.9897, test_f1: 0.5262
 epoch: 7, train_loss: 0.9904, test_loss: 0.9442, test_f1: 0.5254
 epoch: 8, train_loss: 0.9516, test_loss: 0.9363, test_f1: 0.5420
 epoch: 9, train_loss: 0.9367, test_loss: 0.9322, test_f1: 0.5245
 epoch: 10, train_loss: 0.9059, test_loss: 0.9187, test_f1: 0.5174
 epoch: 11, train_loss: 0.8879, test_loss: 0.9331, test_f1: 0.5093
 epoch: 12, train_loss: 0.8794, test_loss: 0.9132, test_f1: 0.5413
 epoch: 13, train_loss: 0.8602, test_loss: 0.9212, test_f1: 0.5716
 epoch: 14, train_loss: 0.8547, test_loss: 0.9398, test_f1: 0.5506
 epoch: 15, train_loss: 0.8459, test_loss: 0.9281, test_f1: 0.5579
 epoch: 16, train_loss: 0.8350, test_loss: 0.9144, test_f1: 0.5191
 epoch: 17, train_loss: 0.8181, test_loss: 0.9335, test_f1: 0.5135
 epoch: 18, train_loss: 0.8141, test_loss: 0.9629, test_f1: 0.5557
 epoch: 19, train_loss: 0.8044, test_loss: 0.9476, test_f1: 0.5363
 epoch: 20, train_loss: 0.7936, test_loss: 0.9534, test_f1: 0.5373
 epoch: 21, train_loss: 0.7887, test_loss: 0.9491, test_f1: 0.5365
 epoch: 22, train_loss: 0.7815, test_loss: 0.9311, test_f1: 0.5657
 epoch: 23, train_loss: 0.7761, test_loss: 0.9589, test_f1: 0.5146
 epoch: 24, train_loss: 0.7684, test_loss: 0.9238, test_f1: 0.5652
 epoch: 25, train_loss: 0.7536, test_loss: 0.9341, test_f1: 0.5535
 epoch: 26, train_loss: 0.7466, test_loss: 0.9478, test_f1: 0.5661
 epoch: 27, train_loss: 0.7485, test_loss: 0.9561, test_f1: 0.5609
 epoch: 28, train_loss: 0.7322, test_loss: 0.9608, test_f1: 0.6064
 epoch: 29, train_loss: 0.7290, test_loss: 0.9833, test_f1: 0.5608
 epoch: 30, train_loss: 0.7302, test_loss: 0.9494, test_f1: 0.5834
 epoch: 31, train_loss: 0.7099, test_loss: 0.9888, test_f1: 0.5910
 epoch: 32, train_loss: 0.7019, test_loss: 0.9717, test_f1: 0.5728
 epoch: 33, train_loss: 0.7142, test_loss: 0.9662, test_f1: 0.5873
 epoch: 34, train_loss: 0.6926, test_loss: 0.9958, test_f1: 0.5958
 epoch: 35, train_loss: 0.7075, test_loss: 0.9952, test_f1: 0.6130
 epoch: 36, train_loss: 0.6923, test_loss: 0.9564, test_f1: 0.6021
 epoch: 37, train_loss: 0.6843, test_loss: 0.9589, test_f1: 0.5969
 epoch: 38, train_loss: 0.6831, test_loss: 0.9991, test_f1: 0.5831
 epoch: 39, train_loss: 0.6798, test_loss: 0.9882, test_f1: 0.5907
 epoch: 40, train_loss: 0.6686, test_loss: 0.9968, test_f1: 0.5980
 epoch: 41, train_loss: 0.6653, test_loss: 1.0028, test_f1: 0.5936
 epoch: 42, train_loss: 0.6476, test_loss: 1.0142, test_f1: 0.6164
 epoch: 43, train_loss: 0.6416, test_loss: 1.0107, test_f1: 0.5910
 epoch: 44, train_loss: 0.6579, test_loss: 1.0257, test_f1: 0.6032
 epoch: 45, train_loss: 0.6430, test_loss: 0.9997, test_f1: 0.6221
 epoch: 46, train_loss: 0.6444, test_loss: 0.9836, test_f1: 0.6217
 epoch: 47, train_loss: 0.6343, test_loss: 0.9875, test_f1: 0.5982
 epoch: 48, train_loss: 0.6289, test_loss: 1.0372, test_f1: 0.6046
 epoch: 49, train_loss: 0.6479, test_loss: 1.0263, test_f1: 0.5846
 epoch: 50, train_loss: 0.6137, test_loss: 1.0031, test_f1: 0.6191
 epoch: 51, train_loss: 0.6086, test_loss: 1.0206, test_f1: 0.6282
 epoch: 52, train_loss: 0.5916, test_loss: 1.0197, test_f1: 0.6141
 epoch: 53, train_loss: 0.5923, test_loss: 0.9989, test_f1: 0.6145
 epoch: 54, train_loss: 0.5812, test_loss: 1.0157, test_f1: 0.6077
 epoch: 55, train_loss: 0.5831, test_loss: 1.0085, test_f1: 0.6153
 epoch: 56, train_loss: 0.5775, test_loss: 1.0133, test_f1: 0.6295
 epoch: 57, train_loss: 0.5742, test_loss: 1.0220, test_f1: 0.6300
 epoch: 58, train_loss: 0.5668, test_loss: 1.0168, test_f1: 0.6353
 epoch: 59, train_loss: 0.5696, test_loss: 1.0188, test_f1: 0.6283
 epoch: 60, train_loss: 0.5564, test_loss: 1.0134, test_f1: 0.6270
 epoch: 61, train_loss: 0.5639, test_loss: 1.0129, test_f1: 0.6409
 epoch: 62, train_loss: 0.5546, test_loss: 1.0238, test_f1: 0.6441
 epoch: 63, train_loss: 0.5438, test_loss: 1.0451, test_f1: 0.6197
 epoch: 64, train_loss: 0.5539, test_loss: 1.0405, test_f1: 0.6277
 epoch: 65, train_loss: 0.5595, test_loss: 1.0527, test_f1: 0.6319
 epoch: 66, train_loss: 0.5495, test_loss: 1.0749, test_f1: 0.6319
 epoch: 67, train_loss: 0.5342, test_loss: 1.0485, test_f1: 0.6244
 epoch: 68, train_loss: 0.5339, test_loss: 1.0558, test_f1: 0.6195
 epoch: 69, train_loss: 0.5420, test_loss: 1.0334, test_f1: 0.6307
 epoch: 70, train_loss: 0.5386, test_loss: 1.0673, test_f1: 0.6268
 epoch: 71, train_loss: 0.5359, test_loss: 1.0374, test_f1: 0.6488
 epoch: 72, train_loss: 0.5227, test_loss: 1.0455, test_f1: 0.6229
 epoch: 73, train_loss: 0.5358, test_loss: 1.0649, test_f1: 0.6393
 epoch: 74, train_loss: 0.5388, test_loss: 1.0773, test_f1: 0.6154
 epoch: 75, train_loss: 0.5175, test_loss: 1.0913, test_f1: 0.6236
 epoch: 76, train_loss: 0.5150, test_loss: 1.1027, test_f1: 0.6247
 epoch: 77, train_loss: 0.5145, test_loss: 1.0631, test_f1: 0.6377
 epoch: 78, train_loss: 0.5224, test_loss: 1.0554, test_f1: 0.6349
 epoch: 79, train_loss: 0.5151, test_loss: 1.0864, test_f1: 0.6388
 epoch: 80, train_loss: 0.5131, test_loss: 1.1146, test_f1: 0.6226
 epoch: 81, train_loss: 0.5135, test_loss: 1.0992, test_f1: 0.6373
 epoch: 82, train_loss: 0.4931, test_loss: 1.0691, test_f1: 0.6582
 epoch: 83, train_loss: 0.5014, test_loss: 1.1105, test_f1: 0.6258
 epoch: 84, train_loss: 0.4991, test_loss: 1.1340, test_f1: 0.6254
 epoch: 85, train_loss: 0.5021, test_loss: 1.0899, test_f1: 0.6243
 epoch: 86, train_loss: 0.5117, test_loss: 1.1454, test_f1: 0.6105
 epoch: 87, train_loss: 0.4937, test_loss: 1.0988, test_f1: 0.6444
 epoch: 88, train_loss: 0.4948, test_loss: 1.1148, test_f1: 0.6205
 epoch: 89, train_loss: 0.4942, test_loss: 1.1273, test_f1: 0.6311
 epoch: 90, train_loss: 0.4982, test_loss: 1.1030, test_f1: 0.6304
 epoch: 91, train_loss: 0.4809, test_loss: 1.1139, test_f1: 0.6458
 epoch: 92, train_loss: 0.4875, test_loss: 1.1297, test_f1: 0.6263
 epoch: 93, train_loss: 0.4750, test_loss: 1.1158, test_f1: 0.6320
 epoch: 94, train_loss: 0.4849, test_loss: 1.1310, test_f1: 0.6287
 epoch: 95, train_loss: 0.4670, test_loss: 1.0951, test_f1: 0.6349
 epoch: 96, train_loss: 0.4691, test_loss: 1.1066, test_f1: 0.6417
 epoch: 97, train_loss: 0.4585, test_loss: 1.1166, test_f1: 0.6346
 epoch: 98, train_loss: 0.4615, test_loss: 1.1316, test_f1: 0.6144
 epoch: 99, train_loss: 0.4614, test_loss: 1.1385, test_f1: 0.6157
##################ITERATION #1 ****************************************
 epoch: 0, train_loss: 1.2389, test_loss: 1.2208, test_f1: 0.3602
 epoch: 1, train_loss: 1.1290, test_loss: 1.0599, test_f1: 0.4614
 epoch: 2, train_loss: 1.0726, test_loss: 1.0055, test_f1: 0.4634
 epoch: 3, train_loss: 1.0256, test_loss: 0.9601, test_f1: 0.4847
 epoch: 4, train_loss: 0.9866, test_loss: 0.9712, test_f1: 0.4762
 epoch: 5, train_loss: 0.9596, test_loss: 0.9139, test_f1: 0.5152
 epoch: 6, train_loss: 0.9394, test_loss: 0.9234, test_f1: 0.5132
 epoch: 7, train_loss: 0.9150, test_loss: 0.8984, test_f1: 0.5302
 epoch: 8, train_loss: 0.9013, test_loss: 0.9362, test_f1: 0.5215
 epoch: 9, train_loss: 0.8831, test_loss: 0.9188, test_f1: 0.5360
 epoch: 10, train_loss: 0.8740, test_loss: 0.9036, test_f1: 0.5298
 epoch: 11, train_loss: 0.8600, test_loss: 0.9286, test_f1: 0.5224
 epoch: 12, train_loss: 0.8547, test_loss: 0.9125, test_f1: 0.5426
 epoch: 13, train_loss: 0.8424, test_loss: 0.8920, test_f1: 0.5487
 epoch: 14, train_loss: 0.8312, test_loss: 0.9193, test_f1: 0.5427
 epoch: 15, train_loss: 0.8220, test_loss: 0.8970, test_f1: 0.5546
 epoch: 16, train_loss: 0.8015, test_loss: 0.8832, test_f1: 0.5817
 epoch: 17, train_loss: 0.8096, test_loss: 0.9348, test_f1: 0.5853
 epoch: 18, train_loss: 0.7942, test_loss: 0.9229, test_f1: 0.5647
 epoch: 19, train_loss: 0.7857, test_loss: 0.9267, test_f1: 0.5591
 epoch: 20, train_loss: 0.7697, test_loss: 0.9563, test_f1: 0.5480
 epoch: 21, train_loss: 0.7668, test_loss: 0.9345, test_f1: 0.5822
 epoch: 22, train_loss: 0.7658, test_loss: 0.8883, test_f1: 0.5695
 epoch: 23, train_loss: 0.7439, test_loss: 0.8767, test_f1: 0.6059
 epoch: 24, train_loss: 0.7429, test_loss: 0.9205, test_f1: 0.5831
 epoch: 25, train_loss: 0.7404, test_loss: 0.9011, test_f1: 0.6021
 epoch: 26, train_loss: 0.7318, test_loss: 0.9139, test_f1: 0.6080
 epoch: 27, train_loss: 0.7280, test_loss: 0.9111, test_f1: 0.5680
 epoch: 28, train_loss: 0.7235, test_loss: 0.9060, test_f1: 0.5948
 epoch: 29, train_loss: 0.7102, test_loss: 0.9266, test_f1: 0.6142
 epoch: 30, train_loss: 0.7134, test_loss: 0.9031, test_f1: 0.6458
 epoch: 31, train_loss: 0.7131, test_loss: 0.8901, test_f1: 0.6328
 epoch: 32, train_loss: 0.7000, test_loss: 0.9259, test_f1: 0.6152
 epoch: 33, train_loss: 0.6877, test_loss: 0.8842, test_f1: 0.6169
 epoch: 34, train_loss: 0.6957, test_loss: 0.9141, test_f1: 0.6171
 epoch: 35, train_loss: 0.6654, test_loss: 0.9006, test_f1: 0.6420
 epoch: 36, train_loss: 0.6691, test_loss: 0.9262, test_f1: 0.6219
 epoch: 37, train_loss: 0.6589, test_loss: 0.9057, test_f1: 0.6265
 epoch: 38, train_loss: 0.6471, test_loss: 0.9282, test_f1: 0.6520
 epoch: 39, train_loss: 0.6696, test_loss: 0.9448, test_f1: 0.6345
 epoch: 40, train_loss: 0.6482, test_loss: 0.8908, test_f1: 0.6396
 epoch: 41, train_loss: 0.6392, test_loss: 0.9473, test_f1: 0.6230
 epoch: 42, train_loss: 0.6438, test_loss: 0.9097, test_f1: 0.6513
 epoch: 43, train_loss: 0.6350, test_loss: 0.9314, test_f1: 0.6290
 epoch: 44, train_loss: 0.6361, test_loss: 0.8996, test_f1: 0.6437
 epoch: 45, train_loss: 0.6222, test_loss: 0.9199, test_f1: 0.6226
 epoch: 46, train_loss: 0.6059, test_loss: 0.9423, test_f1: 0.6295
 epoch: 47, train_loss: 0.6171, test_loss: 0.9078, test_f1: 0.6489
 epoch: 48, train_loss: 0.6112, test_loss: 0.9431, test_f1: 0.6259
 epoch: 49, train_loss: 0.5955, test_loss: 0.9468, test_f1: 0.6311
 epoch: 50, train_loss: 0.5943, test_loss: 0.9371, test_f1: 0.6298
 epoch: 51, train_loss: 0.5719, test_loss: 0.9263, test_f1: 0.6568
 epoch: 52, train_loss: 0.5890, test_loss: 0.9260, test_f1: 0.6393
 epoch: 53, train_loss: 0.5590, test_loss: 0.9482, test_f1: 0.6293
 epoch: 54, train_loss: 0.5667, test_loss: 0.9402, test_f1: 0.6461
 epoch: 55, train_loss: 0.5473, test_loss: 0.9737, test_f1: 0.6282
 epoch: 56, train_loss: 0.5399, test_loss: 0.9539, test_f1: 0.6376
 epoch: 57, train_loss: 0.5516, test_loss: 0.9614, test_f1: 0.6401
 epoch: 58, train_loss: 0.5493, test_loss: 0.9706, test_f1: 0.6393
 epoch: 59, train_loss: 0.5530, test_loss: 0.9682, test_f1: 0.6306
 epoch: 60, train_loss: 0.5307, test_loss: 0.9708, test_f1: 0.6275
 epoch: 61, train_loss: 0.5273, test_loss: 0.9607, test_f1: 0.6585
 epoch: 62, train_loss: 0.5356, test_loss: 0.9995, test_f1: 0.6348
 epoch: 63, train_loss: 0.5290, test_loss: 0.9782, test_f1: 0.6404
 epoch: 64, train_loss: 0.5299, test_loss: 0.9756, test_f1: 0.6605
 epoch: 65, train_loss: 0.5136, test_loss: 0.9854, test_f1: 0.6667
 epoch: 66, train_loss: 0.5228, test_loss: 0.9750, test_f1: 0.6401
 epoch: 67, train_loss: 0.5091, test_loss: 0.9813, test_f1: 0.6488
 epoch: 68, train_loss: 0.5212, test_loss: 0.9908, test_f1: 0.6544
 epoch: 69, train_loss: 0.5054, test_loss: 0.9794, test_f1: 0.6595
 epoch: 70, train_loss: 0.5058, test_loss: 0.9676, test_f1: 0.6470
 epoch: 71, train_loss: 0.5097, test_loss: 0.9883, test_f1: 0.6520
 epoch: 72, train_loss: 0.5134, test_loss: 1.0264, test_f1: 0.6409
 epoch: 73, train_loss: 0.4925, test_loss: 1.0508, test_f1: 0.6322
 epoch: 74, train_loss: 0.5031, test_loss: 1.0032, test_f1: 0.6430
 epoch: 75, train_loss: 0.4949, test_loss: 1.0926, test_f1: 0.6309
 epoch: 76, train_loss: 0.5045, test_loss: 1.0070, test_f1: 0.6555
 epoch: 77, train_loss: 0.4905, test_loss: 1.0399, test_f1: 0.6381
 epoch: 78, train_loss: 0.4881, test_loss: 1.0501, test_f1: 0.6307
 epoch: 79, train_loss: 0.4857, test_loss: 1.0324, test_f1: 0.6581
 epoch: 80, train_loss: 0.4747, test_loss: 1.0398, test_f1: 0.6732
 epoch: 81, train_loss: 0.4777, test_loss: 1.0165, test_f1: 0.6389
 epoch: 82, train_loss: 0.4796, test_loss: 1.0392, test_f1: 0.6621
 epoch: 83, train_loss: 0.4902, test_loss: 1.0502, test_f1: 0.6441
 epoch: 84, train_loss: 0.4809, test_loss: 1.0592, test_f1: 0.6384
 epoch: 85, train_loss: 0.4609, test_loss: 1.0480, test_f1: 0.6394
 epoch: 86, train_loss: 0.4618, test_loss: 1.0418, test_f1: 0.6468
 epoch: 87, train_loss: 0.4664, test_loss: 1.0569, test_f1: 0.6481
 epoch: 88, train_loss: 0.4573, test_loss: 1.0663, test_f1: 0.6503
 epoch: 89, train_loss: 0.4609, test_loss: 1.0699, test_f1: 0.6427
 epoch: 90, train_loss: 0.4572, test_loss: 1.0848, test_f1: 0.6532
 epoch: 91, train_loss: 0.4578, test_loss: 1.0481, test_f1: 0.6655
 epoch: 92, train_loss: 0.4726, test_loss: 1.0898, test_f1: 0.6364
 epoch: 93, train_loss: 0.4499, test_loss: 1.0742, test_f1: 0.6231
 epoch: 94, train_loss: 0.4689, test_loss: 1.0974, test_f1: 0.6462
 epoch: 95, train_loss: 0.4557, test_loss: 1.1254, test_f1: 0.6406
 epoch: 96, train_loss: 0.4409, test_loss: 1.1106, test_f1: 0.6326
 epoch: 97, train_loss: 0.4374, test_loss: 1.0926, test_f1: 0.6486
 epoch: 98, train_loss: 0.4404, test_loss: 1.0940, test_f1: 0.6590
 epoch: 99, train_loss: 0.4400, test_loss: 1.1088, test_f1: 0.6531
##################ITERATION #2 ****************************************
 epoch: 0, train_loss: 1.2189, test_loss: 1.1941, test_f1: 0.3842
 epoch: 1, train_loss: 1.1086, test_loss: 1.0465, test_f1: 0.4670
 epoch: 2, train_loss: 1.0621, test_loss: 1.0021, test_f1: 0.4827
 epoch: 3, train_loss: 1.0220, test_loss: 0.9620, test_f1: 0.4980
 epoch: 4, train_loss: 0.9941, test_loss: 0.9396, test_f1: 0.5112
 epoch: 5, train_loss: 0.9686, test_loss: 0.9395, test_f1: 0.5029
 epoch: 6, train_loss: 0.9466, test_loss: 0.9173, test_f1: 0.5130
 epoch: 7, train_loss: 0.9320, test_loss: 0.9130, test_f1: 0.5055
 epoch: 8, train_loss: 0.9124, test_loss: 0.9100, test_f1: 0.5041
 epoch: 9, train_loss: 0.8981, test_loss: 0.8983, test_f1: 0.5604
 epoch: 10, train_loss: 0.8944, test_loss: 0.9120, test_f1: 0.4950
 epoch: 11, train_loss: 0.8704, test_loss: 0.9234, test_f1: 0.5252
 epoch: 12, train_loss: 0.8724, test_loss: 0.8914, test_f1: 0.5637
 epoch: 13, train_loss: 0.8670, test_loss: 0.9257, test_f1: 0.5490
 epoch: 14, train_loss: 0.8470, test_loss: 0.9067, test_f1: 0.5487
 epoch: 15, train_loss: 0.8395, test_loss: 0.9159, test_f1: 0.5851
 epoch: 16, train_loss: 0.8249, test_loss: 0.9119, test_f1: 0.5405
 epoch: 17, train_loss: 0.8168, test_loss: 0.8960, test_f1: 0.5432
 epoch: 18, train_loss: 0.8100, test_loss: 0.9251, test_f1: 0.5666
 epoch: 19, train_loss: 0.8079, test_loss: 0.9134, test_f1: 0.5659
 epoch: 20, train_loss: 0.7987, test_loss: 0.9089, test_f1: 0.5692
 epoch: 21, train_loss: 0.7947, test_loss: 0.9127, test_f1: 0.5596
 epoch: 22, train_loss: 0.7755, test_loss: 0.9052, test_f1: 0.5751
 epoch: 23, train_loss: 0.7881, test_loss: 0.8749, test_f1: 0.5916
 epoch: 24, train_loss: 0.7689, test_loss: 0.9255, test_f1: 0.5914
 epoch: 25, train_loss: 0.7679, test_loss: 0.9543, test_f1: 0.5952
 epoch: 26, train_loss: 0.7609, test_loss: 0.8934, test_f1: 0.5718
 epoch: 27, train_loss: 0.7473, test_loss: 0.9185, test_f1: 0.6040
 epoch: 28, train_loss: 0.7491, test_loss: 0.9300, test_f1: 0.5935
 epoch: 29, train_loss: 0.7302, test_loss: 0.9199, test_f1: 0.5972
 epoch: 30, train_loss: 0.7431, test_loss: 0.9359, test_f1: 0.5958
 epoch: 31, train_loss: 0.7181, test_loss: 0.9366, test_f1: 0.5919
 epoch: 32, train_loss: 0.7206, test_loss: 0.9055, test_f1: 0.6002
 epoch: 33, train_loss: 0.7205, test_loss: 0.9063, test_f1: 0.5954
 epoch: 34, train_loss: 0.7105, test_loss: 0.9277, test_f1: 0.6037
 epoch: 35, train_loss: 0.7018, test_loss: 0.9470, test_f1: 0.6098
 epoch: 36, train_loss: 0.7112, test_loss: 0.9427, test_f1: 0.6033
 epoch: 37, train_loss: 0.6881, test_loss: 0.9271, test_f1: 0.5803
 epoch: 38, train_loss: 0.6855, test_loss: 0.9308, test_f1: 0.6253
 epoch: 39, train_loss: 0.6883, test_loss: 0.9533, test_f1: 0.6025
 epoch: 40, train_loss: 0.6795, test_loss: 0.8871, test_f1: 0.6180
 epoch: 41, train_loss: 0.6696, test_loss: 0.8841, test_f1: 0.6462
 epoch: 42, train_loss: 0.6697, test_loss: 0.9739, test_f1: 0.6098
 epoch: 43, train_loss: 0.6533, test_loss: 0.9043, test_f1: 0.6391
 epoch: 44, train_loss: 0.6532, test_loss: 0.9721, test_f1: 0.6231
 epoch: 45, train_loss: 0.6481, test_loss: 0.9173, test_f1: 0.6395
 epoch: 46, train_loss: 0.6465, test_loss: 0.9467, test_f1: 0.6497
 epoch: 47, train_loss: 0.6319, test_loss: 0.9580, test_f1: 0.6477
 epoch: 48, train_loss: 0.6369, test_loss: 0.9741, test_f1: 0.6449
 epoch: 49, train_loss: 0.6274, test_loss: 0.9592, test_f1: 0.6414
 epoch: 50, train_loss: 0.6295, test_loss: 0.9280, test_f1: 0.6330
 epoch: 51, train_loss: 0.6038, test_loss: 0.9171, test_f1: 0.6599
 epoch: 52, train_loss: 0.5936, test_loss: 0.9420, test_f1: 0.6418
 epoch: 53, train_loss: 0.5860, test_loss: 0.9556, test_f1: 0.6525
 epoch: 54, train_loss: 0.5903, test_loss: 0.9565, test_f1: 0.6433
 epoch: 55, train_loss: 0.5815, test_loss: 0.9598, test_f1: 0.6575
 epoch: 56, train_loss: 0.5794, test_loss: 0.9590, test_f1: 0.6671
 epoch: 57, train_loss: 0.5811, test_loss: 0.9683, test_f1: 0.6516
 epoch: 58, train_loss: 0.5801, test_loss: 0.9851, test_f1: 0.6526
 epoch: 59, train_loss: 0.5730, test_loss: 0.9555, test_f1: 0.6376
 epoch: 60, train_loss: 0.5766, test_loss: 0.9483, test_f1: 0.6530
 epoch: 61, train_loss: 0.5626, test_loss: 0.9825, test_f1: 0.6408
 epoch: 62, train_loss: 0.5562, test_loss: 1.0007, test_f1: 0.6422
 epoch: 63, train_loss: 0.5409, test_loss: 0.9973, test_f1: 0.6279
 epoch: 64, train_loss: 0.5486, test_loss: 0.9900, test_f1: 0.6413
 epoch: 65, train_loss: 0.5524, test_loss: 0.9870, test_f1: 0.6546
 epoch: 66, train_loss: 0.5569, test_loss: 0.9745, test_f1: 0.6688
 epoch: 67, train_loss: 0.5439, test_loss: 0.9931, test_f1: 0.6608
 epoch: 68, train_loss: 0.5384, test_loss: 0.9836, test_f1: 0.6491
 epoch: 69, train_loss: 0.5456, test_loss: 1.0082, test_f1: 0.6457
 epoch: 70, train_loss: 0.5379, test_loss: 0.9625, test_f1: 0.6737
 epoch: 71, train_loss: 0.5297, test_loss: 1.0260, test_f1: 0.6383
 epoch: 72, train_loss: 0.5242, test_loss: 1.0169, test_f1: 0.6439
 epoch: 73, train_loss: 0.5380, test_loss: 1.0009, test_f1: 0.6619
 epoch: 74, train_loss: 0.5362, test_loss: 1.0201, test_f1: 0.6433
 epoch: 75, train_loss: 0.5239, test_loss: 1.0156, test_f1: 0.6478
 epoch: 76, train_loss: 0.5218, test_loss: 1.0246, test_f1: 0.6511
 epoch: 77, train_loss: 0.5274, test_loss: 1.0233, test_f1: 0.6451
 epoch: 78, train_loss: 0.5079, test_loss: 1.0057, test_f1: 0.6520
 epoch: 79, train_loss: 0.5309, test_loss: 1.0059, test_f1: 0.6599
 epoch: 80, train_loss: 0.5143, test_loss: 1.0166, test_f1: 0.6526
 epoch: 81, train_loss: 0.5111, test_loss: 1.0245, test_f1: 0.6549
 epoch: 82, train_loss: 0.4947, test_loss: 1.0531, test_f1: 0.6604
 epoch: 83, train_loss: 0.5032, test_loss: 1.0521, test_f1: 0.6503
 epoch: 84, train_loss: 0.4968, test_loss: 1.0534, test_f1: 0.6484
 epoch: 85, train_loss: 0.5045, test_loss: 1.0302, test_f1: 0.6399
 epoch: 86, train_loss: 0.4939, test_loss: 1.0970, test_f1: 0.6418
 epoch: 87, train_loss: 0.4869, test_loss: 1.0948, test_f1: 0.6372
 epoch: 88, train_loss: 0.4956, test_loss: 1.0518, test_f1: 0.6435
 epoch: 89, train_loss: 0.4920, test_loss: 1.0766, test_f1: 0.6453
 epoch: 90, train_loss: 0.4854, test_loss: 1.0695, test_f1: 0.6464
 epoch: 91, train_loss: 0.4937, test_loss: 1.0690, test_f1: 0.6572
 epoch: 92, train_loss: 0.4817, test_loss: 1.0873, test_f1: 0.6389
 epoch: 93, train_loss: 0.4908, test_loss: 1.0927, test_f1: 0.6362
 epoch: 94, train_loss: 0.4713, test_loss: 1.1278, test_f1: 0.6366
 epoch: 95, train_loss: 0.4872, test_loss: 1.0816, test_f1: 0.6499
 epoch: 96, train_loss: 0.4752, test_loss: 1.1453, test_f1: 0.6329
 epoch: 97, train_loss: 0.4644, test_loss: 1.0606, test_f1: 0.6475
 epoch: 98, train_loss: 0.4641, test_loss: 1.0889, test_f1: 0.6573
 epoch: 99, train_loss: 0.4784, test_loss: 1.0897, test_f1: 0.6629
##################ITERATION #3 ****************************************
 epoch: 0, train_loss: 1.2018, test_loss: 1.1381, test_f1: 0.4628
 epoch: 1, train_loss: 1.0908, test_loss: 1.0297, test_f1: 0.4579
 epoch: 2, train_loss: 1.0497, test_loss: 0.9953, test_f1: 0.4631
 epoch: 3, train_loss: 1.0127, test_loss: 0.9600, test_f1: 0.4963
 epoch: 4, train_loss: 0.9868, test_loss: 0.9489, test_f1: 0.5020
 epoch: 5, train_loss: 0.9602, test_loss: 0.9521, test_f1: 0.5198
 epoch: 6, train_loss: 0.9345, test_loss: 0.9398, test_f1: 0.5026
 epoch: 7, train_loss: 0.9185, test_loss: 0.9175, test_f1: 0.5346
 epoch: 8, train_loss: 0.9028, test_loss: 0.9105, test_f1: 0.5381
 epoch: 9, train_loss: 0.8931, test_loss: 0.9204, test_f1: 0.5381
 epoch: 10, train_loss: 0.8800, test_loss: 0.9156, test_f1: 0.5517
 epoch: 11, train_loss: 0.8639, test_loss: 0.8864, test_f1: 0.5715
 epoch: 12, train_loss: 0.8611, test_loss: 0.9189, test_f1: 0.5371
 epoch: 13, train_loss: 0.8399, test_loss: 0.9122, test_f1: 0.5618
 epoch: 14, train_loss: 0.8335, test_loss: 0.9317, test_f1: 0.5649
 epoch: 15, train_loss: 0.8185, test_loss: 0.9196, test_f1: 0.5558
 epoch: 16, train_loss: 0.8113, test_loss: 0.9029, test_f1: 0.5647
 epoch: 17, train_loss: 0.7921, test_loss: 0.9619, test_f1: 0.5474
 epoch: 18, train_loss: 0.8026, test_loss: 0.9205, test_f1: 0.5670
 epoch: 19, train_loss: 0.7806, test_loss: 0.9306, test_f1: 0.5918
 epoch: 20, train_loss: 0.7738, test_loss: 0.9353, test_f1: 0.5860
 epoch: 21, train_loss: 0.7726, test_loss: 0.9080, test_f1: 0.5963
 epoch: 22, train_loss: 0.7723, test_loss: 0.9181, test_f1: 0.5958
 epoch: 23, train_loss: 0.7617, test_loss: 0.8937, test_f1: 0.6114
 epoch: 24, train_loss: 0.7443, test_loss: 0.9092, test_f1: 0.5943
 epoch: 25, train_loss: 0.7508, test_loss: 0.9030, test_f1: 0.5888
 epoch: 26, train_loss: 0.7343, test_loss: 0.9640, test_f1: 0.5762
 epoch: 27, train_loss: 0.7313, test_loss: 0.9267, test_f1: 0.5747
 epoch: 28, train_loss: 0.7303, test_loss: 0.9307, test_f1: 0.5951
 epoch: 29, train_loss: 0.7119, test_loss: 0.9301, test_f1: 0.6099
 epoch: 30, train_loss: 0.7130, test_loss: 0.9247, test_f1: 0.6381
 epoch: 31, train_loss: 0.7074, test_loss: 0.9236, test_f1: 0.5951
 epoch: 32, train_loss: 0.7057, test_loss: 0.9237, test_f1: 0.6294
 epoch: 33, train_loss: 0.6960, test_loss: 0.9248, test_f1: 0.6272
 epoch: 34, train_loss: 0.6837, test_loss: 0.9382, test_f1: 0.6094
 epoch: 35, train_loss: 0.6908, test_loss: 0.9382, test_f1: 0.6061
 epoch: 36, train_loss: 0.6825, test_loss: 0.9323, test_f1: 0.6287
 epoch: 37, train_loss: 0.6650, test_loss: 0.9481, test_f1: 0.6336
 epoch: 38, train_loss: 0.6646, test_loss: 0.9288, test_f1: 0.6199
 epoch: 39, train_loss: 0.6513, test_loss: 0.9510, test_f1: 0.6160
 epoch: 40, train_loss: 0.6409, test_loss: 0.9325, test_f1: 0.6206
 epoch: 41, train_loss: 0.6431, test_loss: 0.9662, test_f1: 0.6249
 epoch: 42, train_loss: 0.6374, test_loss: 0.9388, test_f1: 0.6393
 epoch: 43, train_loss: 0.6346, test_loss: 0.9631, test_f1: 0.6147
 epoch: 44, train_loss: 0.6410, test_loss: 0.9700, test_f1: 0.6406
 epoch: 45, train_loss: 0.6359, test_loss: 0.9860, test_f1: 0.6258
 epoch: 46, train_loss: 0.6193, test_loss: 0.9998, test_f1: 0.6238
 epoch: 47, train_loss: 0.5980, test_loss: 0.9705, test_f1: 0.6384
 epoch: 48, train_loss: 0.5999, test_loss: 0.9237, test_f1: 0.6523
 epoch: 49, train_loss: 0.5956, test_loss: 0.9522, test_f1: 0.6543
 epoch: 50, train_loss: 0.6025, test_loss: 0.9309, test_f1: 0.6653
 epoch: 51, train_loss: 0.5771, test_loss: 0.9429, test_f1: 0.6597
 epoch: 52, train_loss: 0.5661, test_loss: 0.9587, test_f1: 0.6517
 epoch: 53, train_loss: 0.5598, test_loss: 0.9495, test_f1: 0.6487
 epoch: 54, train_loss: 0.5513, test_loss: 0.9711, test_f1: 0.6590
 epoch: 55, train_loss: 0.5587, test_loss: 0.9655, test_f1: 0.6402
 epoch: 56, train_loss: 0.5468, test_loss: 0.9514, test_f1: 0.6527
 epoch: 57, train_loss: 0.5507, test_loss: 0.9685, test_f1: 0.6605
 epoch: 58, train_loss: 0.5467, test_loss: 0.9838, test_f1: 0.6305
 epoch: 59, train_loss: 0.5258, test_loss: 0.9798, test_f1: 0.6590
 epoch: 60, train_loss: 0.5255, test_loss: 1.0158, test_f1: 0.6367
 epoch: 61, train_loss: 0.5386, test_loss: 0.9942, test_f1: 0.6633
 epoch: 62, train_loss: 0.5371, test_loss: 1.0096, test_f1: 0.6340
 epoch: 63, train_loss: 0.5320, test_loss: 1.0218, test_f1: 0.6568
 epoch: 64, train_loss: 0.5224, test_loss: 0.9993, test_f1: 0.6613
 epoch: 65, train_loss: 0.5234, test_loss: 1.0377, test_f1: 0.6564
 epoch: 66, train_loss: 0.5290, test_loss: 1.0300, test_f1: 0.6562
 epoch: 67, train_loss: 0.5189, test_loss: 1.0013, test_f1: 0.6478
 epoch: 68, train_loss: 0.5099, test_loss: 1.0485, test_f1: 0.6385
 epoch: 69, train_loss: 0.5180, test_loss: 1.0089, test_f1: 0.6444
 epoch: 70, train_loss: 0.5056, test_loss: 1.0451, test_f1: 0.6319
 epoch: 71, train_loss: 0.5042, test_loss: 1.0078, test_f1: 0.6628
 epoch: 72, train_loss: 0.4976, test_loss: 1.0578, test_f1: 0.6524
 epoch: 73, train_loss: 0.5052, test_loss: 0.9911, test_f1: 0.6654
 epoch: 74, train_loss: 0.4862, test_loss: 1.0606, test_f1: 0.6161
 epoch: 75, train_loss: 0.5132, test_loss: 1.0382, test_f1: 0.6476
 epoch: 76, train_loss: 0.5026, test_loss: 1.0251, test_f1: 0.6605
 epoch: 77, train_loss: 0.4929, test_loss: 1.0527, test_f1: 0.6267
 epoch: 78, train_loss: 0.4779, test_loss: 1.0440, test_f1: 0.6646
 epoch: 79, train_loss: 0.4805, test_loss: 1.0427, test_f1: 0.6614
 epoch: 80, train_loss: 0.4835, test_loss: 1.0717, test_f1: 0.6451
 epoch: 81, train_loss: 0.4705, test_loss: 1.0878, test_f1: 0.6541
 epoch: 82, train_loss: 0.4773, test_loss: 1.0746, test_f1: 0.6524
 epoch: 83, train_loss: 0.4683, test_loss: 1.0545, test_f1: 0.6735
 epoch: 84, train_loss: 0.4574, test_loss: 1.0866, test_f1: 0.6451
 epoch: 85, train_loss: 0.4666, test_loss: 1.0811, test_f1: 0.6519
 epoch: 86, train_loss: 0.4674, test_loss: 1.1063, test_f1: 0.6428
 epoch: 87, train_loss: 0.4553, test_loss: 1.1538, test_f1: 0.6389
 epoch: 88, train_loss: 0.4655, test_loss: 1.1478, test_f1: 0.6429
 epoch: 89, train_loss: 0.4575, test_loss: 1.0946, test_f1: 0.6518
 epoch: 90, train_loss: 0.4615, test_loss: 1.1291, test_f1: 0.6579
 epoch: 91, train_loss: 0.4528, test_loss: 1.1419, test_f1: 0.6535
 epoch: 92, train_loss: 0.4617, test_loss: 1.1365, test_f1: 0.6643
 epoch: 93, train_loss: 0.4494, test_loss: 1.1481, test_f1: 0.6513
 epoch: 94, train_loss: 0.4504, test_loss: 1.0980, test_f1: 0.6732
 epoch: 95, train_loss: 0.4468, test_loss: 1.1567, test_f1: 0.6712
 epoch: 96, train_loss: 0.4489, test_loss: 1.1169, test_f1: 0.6598
 epoch: 97, train_loss: 0.4431, test_loss: 1.1225, test_f1: 0.6267
 epoch: 98, train_loss: 0.4265, test_loss: 1.1421, test_f1: 0.6574
 epoch: 99, train_loss: 0.4490, test_loss: 1.1645, test_f1: 0.6467
##################ITERATION #4 ****************************************
 epoch: 0, train_loss: 1.2009, test_loss: 1.1320, test_f1: 0.4348
 epoch: 1, train_loss: 1.0687, test_loss: 0.9940, test_f1: 0.4728
 epoch: 2, train_loss: 1.0291, test_loss: 0.9543, test_f1: 0.5022
 epoch: 3, train_loss: 0.9987, test_loss: 0.9302, test_f1: 0.5165
 epoch: 4, train_loss: 0.9684, test_loss: 0.9077, test_f1: 0.5316
 epoch: 5, train_loss: 0.9426, test_loss: 0.9214, test_f1: 0.5292
 epoch: 6, train_loss: 0.9277, test_loss: 0.8929, test_f1: 0.5313
 epoch: 7, train_loss: 0.9024, test_loss: 0.9026, test_f1: 0.5335
 epoch: 8, train_loss: 0.8993, test_loss: 0.8763, test_f1: 0.5513
 epoch: 9, train_loss: 0.8799, test_loss: 0.9036, test_f1: 0.5344
 epoch: 10, train_loss: 0.8659, test_loss: 0.8882, test_f1: 0.5523
 epoch: 11, train_loss: 0.8625, test_loss: 0.9190, test_f1: 0.5491
 epoch: 12, train_loss: 0.8441, test_loss: 0.8846, test_f1: 0.5677
 epoch: 13, train_loss: 0.8355, test_loss: 0.8724, test_f1: 0.5779
 epoch: 14, train_loss: 0.8172, test_loss: 0.8859, test_f1: 0.5804
 epoch: 15, train_loss: 0.8071, test_loss: 0.8869, test_f1: 0.5997
 epoch: 16, train_loss: 0.8216, test_loss: 0.8891, test_f1: 0.5986
 epoch: 17, train_loss: 0.8048, test_loss: 0.8720, test_f1: 0.5932
 epoch: 18, train_loss: 0.7976, test_loss: 0.8611, test_f1: 0.5995
 epoch: 19, train_loss: 0.7765, test_loss: 0.8855, test_f1: 0.6153
 epoch: 20, train_loss: 0.7772, test_loss: 0.8702, test_f1: 0.5981
 epoch: 21, train_loss: 0.7651, test_loss: 0.8797, test_f1: 0.6025
 epoch: 22, train_loss: 0.7584, test_loss: 0.8750, test_f1: 0.6106
 epoch: 23, train_loss: 0.7590, test_loss: 0.8719, test_f1: 0.6314
 epoch: 24, train_loss: 0.7396, test_loss: 0.8810, test_f1: 0.6161
 epoch: 25, train_loss: 0.7468, test_loss: 0.8551, test_f1: 0.6253
 epoch: 26, train_loss: 0.7362, test_loss: 0.8689, test_f1: 0.6274
 epoch: 27, train_loss: 0.7252, test_loss: 0.8787, test_f1: 0.6220
 epoch: 28, train_loss: 0.7261, test_loss: 0.8724, test_f1: 0.6511
 epoch: 29, train_loss: 0.7267, test_loss: 0.8638, test_f1: 0.6278
 epoch: 30, train_loss: 0.7078, test_loss: 0.8818, test_f1: 0.6153
 epoch: 31, train_loss: 0.7004, test_loss: 0.8728, test_f1: 0.6475
 epoch: 32, train_loss: 0.6948, test_loss: 0.8703, test_f1: 0.6460
 epoch: 33, train_loss: 0.6854, test_loss: 0.8996, test_f1: 0.5968
 epoch: 34, train_loss: 0.6871, test_loss: 0.8666, test_f1: 0.6387
 epoch: 35, train_loss: 0.6774, test_loss: 0.8427, test_f1: 0.6222
 epoch: 36, train_loss: 0.6880, test_loss: 0.8794, test_f1: 0.6288
 epoch: 37, train_loss: 0.6743, test_loss: 0.8874, test_f1: 0.6370
 epoch: 38, train_loss: 0.6565, test_loss: 0.8456, test_f1: 0.6696
 epoch: 39, train_loss: 0.6451, test_loss: 0.8549, test_f1: 0.6401
 epoch: 40, train_loss: 0.6453, test_loss: 0.8663, test_f1: 0.6636
 epoch: 41, train_loss: 0.6434, test_loss: 0.8761, test_f1: 0.6614
 epoch: 42, train_loss: 0.6461, test_loss: 0.8647, test_f1: 0.6524
 epoch: 43, train_loss: 0.6416, test_loss: 0.9024, test_f1: 0.6637
 epoch: 44, train_loss: 0.6246, test_loss: 0.8814, test_f1: 0.6623
 epoch: 45, train_loss: 0.6181, test_loss: 0.8710, test_f1: 0.6705
 epoch: 46, train_loss: 0.6087, test_loss: 0.8749, test_f1: 0.6509
 epoch: 47, train_loss: 0.6092, test_loss: 0.9038, test_f1: 0.6656
 epoch: 48, train_loss: 0.6199, test_loss: 0.8988, test_f1: 0.6745
 epoch: 49, train_loss: 0.5929, test_loss: 0.8869, test_f1: 0.6634
 epoch: 50, train_loss: 0.5891, test_loss: 0.8859, test_f1: 0.6770
 epoch: 51, train_loss: 0.5731, test_loss: 0.9189, test_f1: 0.6632
 epoch: 52, train_loss: 0.5494, test_loss: 0.9068, test_f1: 0.6622
 epoch: 53, train_loss: 0.5630, test_loss: 0.9074, test_f1: 0.6601
 epoch: 54, train_loss: 0.5472, test_loss: 0.8826, test_f1: 0.6660
 epoch: 55, train_loss: 0.5425, test_loss: 0.8800, test_f1: 0.7047
 epoch: 56, train_loss: 0.5336, test_loss: 0.8793, test_f1: 0.6790
 epoch: 57, train_loss: 0.5287, test_loss: 0.9152, test_f1: 0.6745
 epoch: 58, train_loss: 0.5284, test_loss: 0.9098, test_f1: 0.6607
 epoch: 59, train_loss: 0.5309, test_loss: 0.8764, test_f1: 0.6866
 epoch: 60, train_loss: 0.5245, test_loss: 0.9134, test_f1: 0.6732
 epoch: 61, train_loss: 0.5244, test_loss: 0.8944, test_f1: 0.6794
 epoch: 62, train_loss: 0.5333, test_loss: 0.9208, test_f1: 0.6874
 epoch: 63, train_loss: 0.5127, test_loss: 0.8862, test_f1: 0.6844
 epoch: 64, train_loss: 0.5167, test_loss: 0.9115, test_f1: 0.6770
 epoch: 65, train_loss: 0.5012, test_loss: 0.9171, test_f1: 0.6612
 epoch: 66, train_loss: 0.5117, test_loss: 0.9251, test_f1: 0.6768
 epoch: 67, train_loss: 0.5035, test_loss: 0.9296, test_f1: 0.6918
 epoch: 68, train_loss: 0.5104, test_loss: 0.9467, test_f1: 0.6719
 epoch: 69, train_loss: 0.5157, test_loss: 0.9254, test_f1: 0.6772
 epoch: 70, train_loss: 0.5035, test_loss: 0.9366, test_f1: 0.6895
 epoch: 71, train_loss: 0.5021, test_loss: 0.9539, test_f1: 0.6687
 epoch: 72, train_loss: 0.4909, test_loss: 0.9304, test_f1: 0.6812
 epoch: 73, train_loss: 0.4898, test_loss: 0.9383, test_f1: 0.6712
 epoch: 74, train_loss: 0.4809, test_loss: 0.9676, test_f1: 0.6713
 epoch: 75, train_loss: 0.4922, test_loss: 0.9435, test_f1: 0.6767
 epoch: 76, train_loss: 0.4768, test_loss: 0.9591, test_f1: 0.6710
 epoch: 77, train_loss: 0.4754, test_loss: 0.9483, test_f1: 0.6803
 epoch: 78, train_loss: 0.4715, test_loss: 0.9372, test_f1: 0.6793
 epoch: 79, train_loss: 0.4569, test_loss: 0.9443, test_f1: 0.6851
 epoch: 80, train_loss: 0.4742, test_loss: 0.9415, test_f1: 0.6969
 epoch: 81, train_loss: 0.4605, test_loss: 0.9505, test_f1: 0.6752
 epoch: 82, train_loss: 0.4623, test_loss: 0.9713, test_f1: 0.6748
 epoch: 83, train_loss: 0.4599, test_loss: 0.9828, test_f1: 0.6465
 epoch: 84, train_loss: 0.4577, test_loss: 0.9968, test_f1: 0.6634
 epoch: 85, train_loss: 0.4576, test_loss: 0.9566, test_f1: 0.6732
 epoch: 86, train_loss: 0.4458, test_loss: 0.9674, test_f1: 0.6703
 epoch: 87, train_loss: 0.4492, test_loss: 1.0147, test_f1: 0.6358
 epoch: 88, train_loss: 0.4460, test_loss: 0.9968, test_f1: 0.6561
 epoch: 89, train_loss: 0.4466, test_loss: 0.9687, test_f1: 0.6518
 epoch: 90, train_loss: 0.4567, test_loss: 0.9693, test_f1: 0.6731
 epoch: 91, train_loss: 0.4498, test_loss: 0.9896, test_f1: 0.6577
 epoch: 92, train_loss: 0.4423, test_loss: 1.0441, test_f1: 0.6492
 epoch: 93, train_loss: 0.4416, test_loss: 0.9908, test_f1: 0.6696
 epoch: 94, train_loss: 0.4337, test_loss: 0.9750, test_f1: 0.6561
 epoch: 95, train_loss: 0.4219, test_loss: 1.0046, test_f1: 0.6829
 epoch: 96, train_loss: 0.4278, test_loss: 1.0478, test_f1: 0.6672
 epoch: 97, train_loss: 0.4291, test_loss: 1.0704, test_f1: 0.6707
 epoch: 98, train_loss: 0.4314, test_loss: 1.0371, test_f1: 0.6780
 epoch: 99, train_loss: 0.4054, test_loss: 1.0304, test_f1: 0.6833
##################ITERATION #5 ****************************************
 epoch: 0, train_loss: 1.2271, test_loss: 1.1595, test_f1: 0.4302
 epoch: 1, train_loss: 1.0818, test_loss: 0.9834, test_f1: 0.5085
 epoch: 2, train_loss: 1.0297, test_loss: 0.9716, test_f1: 0.5161
 epoch: 3, train_loss: 1.0045, test_loss: 0.9360, test_f1: 0.4873
 epoch: 4, train_loss: 0.9703, test_loss: 0.9192, test_f1: 0.5066
 epoch: 5, train_loss: 0.9505, test_loss: 0.9234, test_f1: 0.4987
 epoch: 6, train_loss: 0.9405, test_loss: 0.8921, test_f1: 0.5277
 epoch: 7, train_loss: 0.9174, test_loss: 0.8846, test_f1: 0.5208
 epoch: 8, train_loss: 0.9126, test_loss: 0.8994, test_f1: 0.5695
 epoch: 9, train_loss: 0.8931, test_loss: 0.8650, test_f1: 0.5524
 epoch: 10, train_loss: 0.8824, test_loss: 0.8880, test_f1: 0.5358
 epoch: 11, train_loss: 0.8654, test_loss: 0.8719, test_f1: 0.5553
 epoch: 12, train_loss: 0.8507, test_loss: 0.8456, test_f1: 0.5833
 epoch: 13, train_loss: 0.8554, test_loss: 0.8517, test_f1: 0.5801
 epoch: 14, train_loss: 0.8284, test_loss: 0.8559, test_f1: 0.5688
 epoch: 15, train_loss: 0.8281, test_loss: 0.8435, test_f1: 0.6034
 epoch: 16, train_loss: 0.8194, test_loss: 0.8453, test_f1: 0.5842
 epoch: 17, train_loss: 0.8044, test_loss: 0.8536, test_f1: 0.5905
 epoch: 18, train_loss: 0.7909, test_loss: 0.8284, test_f1: 0.5940
 epoch: 19, train_loss: 0.7921, test_loss: 0.8234, test_f1: 0.5940
 epoch: 20, train_loss: 0.7898, test_loss: 0.8344, test_f1: 0.6107
 epoch: 21, train_loss: 0.7742, test_loss: 0.8707, test_f1: 0.5934
 epoch: 22, train_loss: 0.7698, test_loss: 0.8569, test_f1: 0.5906
 epoch: 23, train_loss: 0.7596, test_loss: 0.8528, test_f1: 0.5821
 epoch: 24, train_loss: 0.7475, test_loss: 0.8287, test_f1: 0.6207
 epoch: 25, train_loss: 0.7353, test_loss: 0.8388, test_f1: 0.6106
 epoch: 26, train_loss: 0.7410, test_loss: 0.8695, test_f1: 0.6001
 epoch: 27, train_loss: 0.7372, test_loss: 0.8381, test_f1: 0.6256
 epoch: 28, train_loss: 0.7118, test_loss: 0.8470, test_f1: 0.6200
 epoch: 29, train_loss: 0.7172, test_loss: 0.8724, test_f1: 0.6188
 epoch: 30, train_loss: 0.7165, test_loss: 0.8603, test_f1: 0.6221
 epoch: 31, train_loss: 0.7076, test_loss: 0.8414, test_f1: 0.6339
 epoch: 32, train_loss: 0.6960, test_loss: 0.8408, test_f1: 0.6268
 epoch: 33, train_loss: 0.7081, test_loss: 0.8386, test_f1: 0.6208
 epoch: 34, train_loss: 0.6974, test_loss: 0.8837, test_f1: 0.6259
 epoch: 35, train_loss: 0.6696, test_loss: 0.8540, test_f1: 0.6448
 epoch: 36, train_loss: 0.6786, test_loss: 0.8876, test_f1: 0.6383
 epoch: 37, train_loss: 0.6833, test_loss: 0.8599, test_f1: 0.6343
 epoch: 38, train_loss: 0.6598, test_loss: 0.8888, test_f1: 0.6403
 epoch: 39, train_loss: 0.6576, test_loss: 0.8502, test_f1: 0.6478
 epoch: 40, train_loss: 0.6442, test_loss: 0.8511, test_f1: 0.6510
 epoch: 41, train_loss: 0.6532, test_loss: 0.8493, test_f1: 0.6458
 epoch: 42, train_loss: 0.6484, test_loss: 0.8455, test_f1: 0.6337
 epoch: 43, train_loss: 0.6403, test_loss: 0.8605, test_f1: 0.6301
 epoch: 44, train_loss: 0.6194, test_loss: 0.8814, test_f1: 0.6629
 epoch: 45, train_loss: 0.6233, test_loss: 0.8771, test_f1: 0.6313
 epoch: 46, train_loss: 0.6153, test_loss: 0.8684, test_f1: 0.6434
 epoch: 47, train_loss: 0.6197, test_loss: 0.8337, test_f1: 0.6420
 epoch: 48, train_loss: 0.6007, test_loss: 0.8675, test_f1: 0.6366
 epoch: 49, train_loss: 0.6096, test_loss: 0.8566, test_f1: 0.6375
 epoch: 50, train_loss: 0.5953, test_loss: 0.8812, test_f1: 0.6557
 epoch: 51, train_loss: 0.5945, test_loss: 0.8568, test_f1: 0.6442
 epoch: 52, train_loss: 0.5713, test_loss: 0.8764, test_f1: 0.6568
 epoch: 53, train_loss: 0.5667, test_loss: 0.8758, test_f1: 0.6488
 epoch: 54, train_loss: 0.5596, test_loss: 0.8962, test_f1: 0.6458
 epoch: 55, train_loss: 0.5490, test_loss: 0.8780, test_f1: 0.6560
 epoch: 56, train_loss: 0.5562, test_loss: 0.9100, test_f1: 0.6483
 epoch: 57, train_loss: 0.5649, test_loss: 0.8974, test_f1: 0.6533
 epoch: 58, train_loss: 0.5410, test_loss: 0.8885, test_f1: 0.6568
 epoch: 59, train_loss: 0.5310, test_loss: 0.8683, test_f1: 0.6702
 epoch: 60, train_loss: 0.5383, test_loss: 0.8716, test_f1: 0.6447
 epoch: 61, train_loss: 0.5434, test_loss: 0.8962, test_f1: 0.6625
 epoch: 62, train_loss: 0.5297, test_loss: 0.8911, test_f1: 0.6690
 epoch: 63, train_loss: 0.5290, test_loss: 0.8987, test_f1: 0.6704
 epoch: 64, train_loss: 0.5239, test_loss: 0.9198, test_f1: 0.6485
 epoch: 65, train_loss: 0.5294, test_loss: 0.9261, test_f1: 0.6521
 epoch: 66, train_loss: 0.5202, test_loss: 0.9178, test_f1: 0.6473
 epoch: 67, train_loss: 0.5115, test_loss: 0.9198, test_f1: 0.6741
 epoch: 68, train_loss: 0.5272, test_loss: 0.9198, test_f1: 0.6554
 epoch: 69, train_loss: 0.4934, test_loss: 0.9159, test_f1: 0.6404
 epoch: 70, train_loss: 0.5074, test_loss: 0.9277, test_f1: 0.6714
 epoch: 71, train_loss: 0.4987, test_loss: 0.9334, test_f1: 0.6680
 epoch: 72, train_loss: 0.5030, test_loss: 0.9035, test_f1: 0.6795
 epoch: 73, train_loss: 0.4904, test_loss: 0.9452, test_f1: 0.6742
 epoch: 74, train_loss: 0.4961, test_loss: 0.9157, test_f1: 0.6709
 epoch: 75, train_loss: 0.4837, test_loss: 0.9284, test_f1: 0.6662
 epoch: 76, train_loss: 0.4977, test_loss: 0.9373, test_f1: 0.6614
 epoch: 77, train_loss: 0.4991, test_loss: 0.9397, test_f1: 0.6645
 epoch: 78, train_loss: 0.4851, test_loss: 0.9749, test_f1: 0.6711
 epoch: 79, train_loss: 0.4803, test_loss: 0.9485, test_f1: 0.6720
 epoch: 80, train_loss: 0.4649, test_loss: 0.9363, test_f1: 0.6615
 epoch: 81, train_loss: 0.4817, test_loss: 0.9818, test_f1: 0.6489
 epoch: 82, train_loss: 0.4883, test_loss: 0.9399, test_f1: 0.6717
 epoch: 83, train_loss: 0.4799, test_loss: 0.9840, test_f1: 0.6643
 epoch: 84, train_loss: 0.4728, test_loss: 0.9603, test_f1: 0.6615
 epoch: 85, train_loss: 0.4735, test_loss: 0.9619, test_f1: 0.6514
 epoch: 86, train_loss: 0.4724, test_loss: 0.9715, test_f1: 0.6547
 epoch: 87, train_loss: 0.4579, test_loss: 0.9904, test_f1: 0.6571
 epoch: 88, train_loss: 0.4666, test_loss: 0.9737, test_f1: 0.6656
 epoch: 89, train_loss: 0.4592, test_loss: 0.9731, test_f1: 0.6529
 epoch: 90, train_loss: 0.4586, test_loss: 1.0074, test_f1: 0.6516
 epoch: 91, train_loss: 0.4483, test_loss: 0.9672, test_f1: 0.6527
 epoch: 92, train_loss: 0.4437, test_loss: 0.9834, test_f1: 0.6491
 epoch: 93, train_loss: 0.4649, test_loss: 0.9546, test_f1: 0.6649
 epoch: 94, train_loss: 0.4458, test_loss: 0.9937, test_f1: 0.6515
 epoch: 95, train_loss: 0.4427, test_loss: 0.9707, test_f1: 0.6600
 epoch: 96, train_loss: 0.4421, test_loss: 0.9993, test_f1: 0.6535
 epoch: 97, train_loss: 0.4416, test_loss: 1.0480, test_f1: 0.6445
 epoch: 98, train_loss: 0.4380, test_loss: 1.0078, test_f1: 0.6573
 epoch: 99, train_loss: 0.4333, test_loss: 1.0415, test_f1: 0.6403
##################ITERATION #6 ****************************************
 epoch: 0, train_loss: 1.2362, test_loss: 1.2183, test_f1: 0.3552
 epoch: 1, train_loss: 1.1153, test_loss: 1.0071, test_f1: 0.4842
 epoch: 2, train_loss: 1.0581, test_loss: 1.0055, test_f1: 0.4949
 epoch: 3, train_loss: 1.0253, test_loss: 0.9721, test_f1: 0.5254
 epoch: 4, train_loss: 0.9882, test_loss: 0.9399, test_f1: 0.5207
 epoch: 5, train_loss: 0.9793, test_loss: 0.9742, test_f1: 0.5124
 epoch: 6, train_loss: 0.9657, test_loss: 0.9358, test_f1: 0.5210
 epoch: 7, train_loss: 0.9325, test_loss: 0.9200, test_f1: 0.5391
 epoch: 8, train_loss: 0.9290, test_loss: 0.9377, test_f1: 0.5435
 epoch: 9, train_loss: 0.9217, test_loss: 0.9365, test_f1: 0.5403
 epoch: 10, train_loss: 0.9046, test_loss: 0.9194, test_f1: 0.5439
 epoch: 11, train_loss: 0.8933, test_loss: 0.9287, test_f1: 0.5413
 epoch: 12, train_loss: 0.8845, test_loss: 0.9413, test_f1: 0.5441
 epoch: 13, train_loss: 0.8683, test_loss: 0.9169, test_f1: 0.5705
 epoch: 14, train_loss: 0.8515, test_loss: 0.9266, test_f1: 0.5613
 epoch: 15, train_loss: 0.8549, test_loss: 0.9173, test_f1: 0.5770
 epoch: 16, train_loss: 0.8436, test_loss: 0.9311, test_f1: 0.5602
 epoch: 17, train_loss: 0.8343, test_loss: 0.9103, test_f1: 0.5542
 epoch: 18, train_loss: 0.8188, test_loss: 0.9312, test_f1: 0.5712
 epoch: 19, train_loss: 0.8205, test_loss: 0.8932, test_f1: 0.6068
 epoch: 20, train_loss: 0.8020, test_loss: 0.9287, test_f1: 0.5484
 epoch: 21, train_loss: 0.8082, test_loss: 0.9174, test_f1: 0.5847
 epoch: 22, train_loss: 0.8001, test_loss: 0.8770, test_f1: 0.5971
 epoch: 23, train_loss: 0.8008, test_loss: 0.9103, test_f1: 0.6090
 epoch: 24, train_loss: 0.7797, test_loss: 0.8898, test_f1: 0.5921
 epoch: 25, train_loss: 0.7775, test_loss: 0.8812, test_f1: 0.6157
 epoch: 26, train_loss: 0.7739, test_loss: 0.8877, test_f1: 0.5876
 epoch: 27, train_loss: 0.7709, test_loss: 0.9407, test_f1: 0.5716
 epoch: 28, train_loss: 0.7574, test_loss: 0.9058, test_f1: 0.5710
 epoch: 29, train_loss: 0.7457, test_loss: 0.9081, test_f1: 0.5939
 epoch: 30, train_loss: 0.7640, test_loss: 0.9199, test_f1: 0.6018
 epoch: 31, train_loss: 0.7466, test_loss: 0.9417, test_f1: 0.5659
 epoch: 32, train_loss: 0.7322, test_loss: 0.9471, test_f1: 0.5664
 epoch: 33, train_loss: 0.7290, test_loss: 0.9041, test_f1: 0.5987
 epoch: 34, train_loss: 0.7307, test_loss: 0.9325, test_f1: 0.5925
 epoch: 35, train_loss: 0.7104, test_loss: 0.9255, test_f1: 0.5914
 epoch: 36, train_loss: 0.7048, test_loss: 0.9296, test_f1: 0.5819
 epoch: 37, train_loss: 0.6968, test_loss: 0.8979, test_f1: 0.6294
 epoch: 38, train_loss: 0.7033, test_loss: 0.9316, test_f1: 0.5871
 epoch: 39, train_loss: 0.7012, test_loss: 0.9427, test_f1: 0.5800
 epoch: 40, train_loss: 0.7020, test_loss: 0.9043, test_f1: 0.5970
 epoch: 41, train_loss: 0.6916, test_loss: 0.8984, test_f1: 0.6128
 epoch: 42, train_loss: 0.6969, test_loss: 0.9345, test_f1: 0.6208
 epoch: 43, train_loss: 0.6744, test_loss: 0.9173, test_f1: 0.6036
 epoch: 44, train_loss: 0.6728, test_loss: 0.9293, test_f1: 0.6150
 epoch: 45, train_loss: 0.6776, test_loss: 0.9447, test_f1: 0.5761
 epoch: 46, train_loss: 0.6537, test_loss: 0.9218, test_f1: 0.6225
 epoch: 47, train_loss: 0.6673, test_loss: 0.9284, test_f1: 0.6006
 epoch: 48, train_loss: 0.6572, test_loss: 0.9105, test_f1: 0.6384
 epoch: 49, train_loss: 0.6436, test_loss: 0.9396, test_f1: 0.6104
 epoch: 50, train_loss: 0.6449, test_loss: 0.9094, test_f1: 0.6333
 epoch: 51, train_loss: 0.6415, test_loss: 0.9348, test_f1: 0.6413
 epoch: 52, train_loss: 0.6202, test_loss: 0.9486, test_f1: 0.6444
 epoch: 53, train_loss: 0.6081, test_loss: 0.9510, test_f1: 0.6388
 epoch: 54, train_loss: 0.6053, test_loss: 0.9352, test_f1: 0.6268
 epoch: 55, train_loss: 0.5964, test_loss: 0.9521, test_f1: 0.6235
 epoch: 56, train_loss: 0.6032, test_loss: 0.9591, test_f1: 0.6175
 epoch: 57, train_loss: 0.5938, test_loss: 1.0161, test_f1: 0.5933
 epoch: 58, train_loss: 0.5977, test_loss: 0.9621, test_f1: 0.6343
 epoch: 59, train_loss: 0.5907, test_loss: 0.9820, test_f1: 0.6226
 epoch: 60, train_loss: 0.5825, test_loss: 0.9939, test_f1: 0.6294
 epoch: 61, train_loss: 0.5773, test_loss: 0.9626, test_f1: 0.6349
 epoch: 62, train_loss: 0.5750, test_loss: 0.9661, test_f1: 0.6198
 epoch: 63, train_loss: 0.5725, test_loss: 0.9671, test_f1: 0.6247
 epoch: 64, train_loss: 0.5695, test_loss: 0.9538, test_f1: 0.6248
 epoch: 65, train_loss: 0.5700, test_loss: 0.9738, test_f1: 0.6171
 epoch: 66, train_loss: 0.5606, test_loss: 0.9687, test_f1: 0.6269
 epoch: 67, train_loss: 0.5592, test_loss: 0.9815, test_f1: 0.6223
 epoch: 68, train_loss: 0.5571, test_loss: 0.9827, test_f1: 0.6207
 epoch: 69, train_loss: 0.5525, test_loss: 0.9556, test_f1: 0.6270
 epoch: 70, train_loss: 0.5589, test_loss: 1.0236, test_f1: 0.6125
 epoch: 71, train_loss: 0.5561, test_loss: 1.0137, test_f1: 0.6116
 epoch: 72, train_loss: 0.5583, test_loss: 1.0066, test_f1: 0.5938
 epoch: 73, train_loss: 0.5441, test_loss: 1.0175, test_f1: 0.6236
 epoch: 74, train_loss: 0.5488, test_loss: 1.0070, test_f1: 0.6450
 epoch: 75, train_loss: 0.5638, test_loss: 1.0231, test_f1: 0.6065
 epoch: 76, train_loss: 0.5311, test_loss: 0.9755, test_f1: 0.6379
 epoch: 77, train_loss: 0.5461, test_loss: 1.0255, test_f1: 0.6249
 epoch: 78, train_loss: 0.5387, test_loss: 1.0056, test_f1: 0.6113
 epoch: 79, train_loss: 0.5245, test_loss: 1.0249, test_f1: 0.6250
 epoch: 80, train_loss: 0.5154, test_loss: 1.0295, test_f1: 0.6163
 epoch: 81, train_loss: 0.5313, test_loss: 1.0495, test_f1: 0.6291
 epoch: 82, train_loss: 0.5260, test_loss: 1.0613, test_f1: 0.6028
 epoch: 83, train_loss: 0.5161, test_loss: 1.0489, test_f1: 0.6207
 epoch: 84, train_loss: 0.5112, test_loss: 1.0555, test_f1: 0.6295
 epoch: 85, train_loss: 0.5183, test_loss: 1.0519, test_f1: 0.6471
 epoch: 86, train_loss: 0.5103, test_loss: 1.0779, test_f1: 0.6385
 epoch: 87, train_loss: 0.4997, test_loss: 1.0472, test_f1: 0.6317
 epoch: 88, train_loss: 0.5046, test_loss: 1.0345, test_f1: 0.6231
 epoch: 89, train_loss: 0.4976, test_loss: 1.1246, test_f1: 0.6193
 epoch: 90, train_loss: 0.4910, test_loss: 1.0524, test_f1: 0.6210
 epoch: 91, train_loss: 0.4962, test_loss: 1.0893, test_f1: 0.6444
 epoch: 92, train_loss: 0.4921, test_loss: 1.0571, test_f1: 0.6709
 epoch: 93, train_loss: 0.4885, test_loss: 1.0500, test_f1: 0.6285
 epoch: 94, train_loss: 0.4882, test_loss: 1.0769, test_f1: 0.6263
 epoch: 95, train_loss: 0.4845, test_loss: 1.1486, test_f1: 0.6211
 epoch: 96, train_loss: 0.4844, test_loss: 1.0591, test_f1: 0.6298
 epoch: 97, train_loss: 0.4797, test_loss: 1.0556, test_f1: 0.6332
 epoch: 98, train_loss: 0.4790, test_loss: 1.1049, test_f1: 0.6356
 epoch: 99, train_loss: 0.4742, test_loss: 1.0776, test_f1: 0.6397
##################ITERATION #7 ****************************************
 epoch: 0, train_loss: 1.2586, test_loss: 1.1323, test_f1: 0.4247
 epoch: 1, train_loss: 1.0959, test_loss: 1.0077, test_f1: 0.5055
 epoch: 2, train_loss: 1.0551, test_loss: 0.9819, test_f1: 0.4996
 epoch: 3, train_loss: 1.0123, test_loss: 0.9408, test_f1: 0.5284
 epoch: 4, train_loss: 0.9929, test_loss: 0.9275, test_f1: 0.5019
 epoch: 5, train_loss: 0.9641, test_loss: 0.9344, test_f1: 0.5153
 epoch: 6, train_loss: 0.9497, test_loss: 0.9283, test_f1: 0.5203
 epoch: 7, train_loss: 0.9362, test_loss: 0.8945, test_f1: 0.5173
 epoch: 8, train_loss: 0.9166, test_loss: 0.8950, test_f1: 0.5404
 epoch: 9, train_loss: 0.8966, test_loss: 0.9024, test_f1: 0.5558
 epoch: 10, train_loss: 0.8844, test_loss: 0.9090, test_f1: 0.5590
 epoch: 11, train_loss: 0.8731, test_loss: 0.9090, test_f1: 0.5459
 epoch: 12, train_loss: 0.8759, test_loss: 0.8924, test_f1: 0.5393
 epoch: 13, train_loss: 0.8604, test_loss: 0.8656, test_f1: 0.5865
 epoch: 14, train_loss: 0.8541, test_loss: 0.8773, test_f1: 0.5801
 epoch: 15, train_loss: 0.8399, test_loss: 0.8697, test_f1: 0.5946
 epoch: 16, train_loss: 0.8289, test_loss: 0.9053, test_f1: 0.5630
 epoch: 17, train_loss: 0.8160, test_loss: 0.8892, test_f1: 0.5630
 epoch: 18, train_loss: 0.8189, test_loss: 0.9014, test_f1: 0.5760
 epoch: 19, train_loss: 0.8015, test_loss: 0.9255, test_f1: 0.5569
 epoch: 20, train_loss: 0.7996, test_loss: 0.9055, test_f1: 0.5578
 epoch: 21, train_loss: 0.7831, test_loss: 0.8944, test_f1: 0.5748
 epoch: 22, train_loss: 0.7767, test_loss: 0.9046, test_f1: 0.6135
 epoch: 23, train_loss: 0.7675, test_loss: 0.8902, test_f1: 0.5766
 epoch: 24, train_loss: 0.7695, test_loss: 0.8802, test_f1: 0.6054
 epoch: 25, train_loss: 0.7522, test_loss: 0.9090, test_f1: 0.6072
 epoch: 26, train_loss: 0.7429, test_loss: 0.8937, test_f1: 0.6039
 epoch: 27, train_loss: 0.7367, test_loss: 0.9305, test_f1: 0.6071
 epoch: 28, train_loss: 0.7499, test_loss: 0.8697, test_f1: 0.6221
 epoch: 29, train_loss: 0.7357, test_loss: 0.8791, test_f1: 0.6284
 epoch: 30, train_loss: 0.7263, test_loss: 0.9008, test_f1: 0.6257
 epoch: 31, train_loss: 0.7231, test_loss: 0.9322, test_f1: 0.6258
 epoch: 32, train_loss: 0.7153, test_loss: 0.9037, test_f1: 0.6436
 epoch: 33, train_loss: 0.7025, test_loss: 0.9314, test_f1: 0.6079
 epoch: 34, train_loss: 0.7049, test_loss: 0.8879, test_f1: 0.6349
 epoch: 35, train_loss: 0.7024, test_loss: 0.9098, test_f1: 0.6255
 epoch: 36, train_loss: 0.6996, test_loss: 0.9414, test_f1: 0.6306
 epoch: 37, train_loss: 0.7030, test_loss: 0.9273, test_f1: 0.6200
 epoch: 38, train_loss: 0.6794, test_loss: 0.9109, test_f1: 0.6364
 epoch: 39, train_loss: 0.6717, test_loss: 0.9200, test_f1: 0.5930
 epoch: 40, train_loss: 0.6622, test_loss: 0.9093, test_f1: 0.6271
 epoch: 41, train_loss: 0.6574, test_loss: 0.9396, test_f1: 0.6321
 epoch: 42, train_loss: 0.6628, test_loss: 0.9202, test_f1: 0.6125
 epoch: 43, train_loss: 0.6519, test_loss: 0.9360, test_f1: 0.6472
 epoch: 44, train_loss: 0.6465, test_loss: 0.9158, test_f1: 0.6389
 epoch: 45, train_loss: 0.6325, test_loss: 0.9494, test_f1: 0.6578
 epoch: 46, train_loss: 0.6335, test_loss: 0.9469, test_f1: 0.6583
 epoch: 47, train_loss: 0.6346, test_loss: 0.9364, test_f1: 0.6374
 epoch: 48, train_loss: 0.6144, test_loss: 0.9383, test_f1: 0.6453
 epoch: 49, train_loss: 0.6141, test_loss: 0.9571, test_f1: 0.6334
 epoch: 50, train_loss: 0.6095, test_loss: 0.9783, test_f1: 0.6127
 epoch: 51, train_loss: 0.5895, test_loss: 0.9537, test_f1: 0.6291
 epoch: 52, train_loss: 0.5693, test_loss: 0.9477, test_f1: 0.6283
 epoch: 53, train_loss: 0.5836, test_loss: 0.9618, test_f1: 0.6240
 epoch: 54, train_loss: 0.5745, test_loss: 0.9726, test_f1: 0.6363
 epoch: 55, train_loss: 0.5745, test_loss: 0.9684, test_f1: 0.6529
 epoch: 56, train_loss: 0.5555, test_loss: 0.9641, test_f1: 0.6314
 epoch: 57, train_loss: 0.5581, test_loss: 0.9386, test_f1: 0.6493
 epoch: 58, train_loss: 0.5411, test_loss: 0.9908, test_f1: 0.6211
 epoch: 59, train_loss: 0.5669, test_loss: 0.9588, test_f1: 0.6348
 epoch: 60, train_loss: 0.5599, test_loss: 0.9535, test_f1: 0.6441
 epoch: 61, train_loss: 0.5477, test_loss: 0.9601, test_f1: 0.6448
 epoch: 62, train_loss: 0.5526, test_loss: 0.9682, test_f1: 0.6281
 epoch: 63, train_loss: 0.5374, test_loss: 0.9523, test_f1: 0.6264
 epoch: 64, train_loss: 0.5347, test_loss: 0.9794, test_f1: 0.6184
 epoch: 65, train_loss: 0.5231, test_loss: 0.9996, test_f1: 0.6187
 epoch: 66, train_loss: 0.5277, test_loss: 0.9907, test_f1: 0.6253
 epoch: 67, train_loss: 0.5331, test_loss: 0.9991, test_f1: 0.6277
 epoch: 68, train_loss: 0.5303, test_loss: 0.9808, test_f1: 0.6394
 epoch: 69, train_loss: 0.5282, test_loss: 0.9933, test_f1: 0.6353
 epoch: 70, train_loss: 0.5190, test_loss: 1.0035, test_f1: 0.6282
 epoch: 71, train_loss: 0.5146, test_loss: 0.9872, test_f1: 0.6400
 epoch: 72, train_loss: 0.5047, test_loss: 0.9994, test_f1: 0.6411
 epoch: 73, train_loss: 0.5184, test_loss: 1.0145, test_f1: 0.6355
 epoch: 74, train_loss: 0.5035, test_loss: 1.0045, test_f1: 0.6435
 epoch: 75, train_loss: 0.4958, test_loss: 1.0134, test_f1: 0.6520
 epoch: 76, train_loss: 0.5072, test_loss: 0.9891, test_f1: 0.6588
 epoch: 77, train_loss: 0.4978, test_loss: 1.0010, test_f1: 0.6604
 epoch: 78, train_loss: 0.4964, test_loss: 1.0153, test_f1: 0.6613
 epoch: 79, train_loss: 0.4892, test_loss: 1.0184, test_f1: 0.6567
 epoch: 80, train_loss: 0.4873, test_loss: 1.0300, test_f1: 0.6527
 epoch: 81, train_loss: 0.4872, test_loss: 1.0054, test_f1: 0.6578
 epoch: 82, train_loss: 0.4836, test_loss: 1.0478, test_f1: 0.6403
 epoch: 83, train_loss: 0.4786, test_loss: 1.0652, test_f1: 0.6431
 epoch: 84, train_loss: 0.4814, test_loss: 1.0612, test_f1: 0.6346
 epoch: 85, train_loss: 0.4785, test_loss: 1.0159, test_f1: 0.6724
 epoch: 86, train_loss: 0.4813, test_loss: 1.0488, test_f1: 0.6554
 epoch: 87, train_loss: 0.4792, test_loss: 1.0197, test_f1: 0.6608
 epoch: 88, train_loss: 0.4652, test_loss: 1.0259, test_f1: 0.6653
 epoch: 89, train_loss: 0.4765, test_loss: 1.0072, test_f1: 0.6660
 epoch: 90, train_loss: 0.4633, test_loss: 1.0365, test_f1: 0.6684
 epoch: 91, train_loss: 0.4551, test_loss: 1.0526, test_f1: 0.6300
 epoch: 92, train_loss: 0.4533, test_loss: 1.0737, test_f1: 0.6595
 epoch: 93, train_loss: 0.4433, test_loss: 1.1056, test_f1: 0.6343
 epoch: 94, train_loss: 0.4570, test_loss: 1.0658, test_f1: 0.6589
 epoch: 95, train_loss: 0.4451, test_loss: 1.0842, test_f1: 0.6470
 epoch: 96, train_loss: 0.4448, test_loss: 1.0872, test_f1: 0.6594
 epoch: 97, train_loss: 0.4423, test_loss: 1.0690, test_f1: 0.6513
 epoch: 98, train_loss: 0.4580, test_loss: 1.0523, test_f1: 0.6573
 epoch: 99, train_loss: 0.4431, test_loss: 1.1051, test_f1: 0.6592
##################ITERATION #8 ****************************************
 epoch: 0, train_loss: 1.2585, test_loss: 1.1841, test_f1: 0.4125
 epoch: 1, train_loss: 1.1120, test_loss: 1.0066, test_f1: 0.4982
 epoch: 2, train_loss: 1.0644, test_loss: 1.0065, test_f1: 0.5028
 epoch: 3, train_loss: 1.0308, test_loss: 0.9550, test_f1: 0.5046
 epoch: 4, train_loss: 1.0136, test_loss: 0.9473, test_f1: 0.5126
 epoch: 5, train_loss: 0.9964, test_loss: 0.9702, test_f1: 0.5276
 epoch: 6, train_loss: 0.9709, test_loss: 0.9344, test_f1: 0.5257
 epoch: 7, train_loss: 0.9400, test_loss: 0.9184, test_f1: 0.5133
 epoch: 8, train_loss: 0.9237, test_loss: 0.9315, test_f1: 0.5331
 epoch: 9, train_loss: 0.9249, test_loss: 0.9438, test_f1: 0.5133
 epoch: 10, train_loss: 0.9074, test_loss: 0.9240, test_f1: 0.5218
 epoch: 11, train_loss: 0.8858, test_loss: 0.9358, test_f1: 0.5471
 epoch: 12, train_loss: 0.8865, test_loss: 0.9205, test_f1: 0.5391
 epoch: 13, train_loss: 0.8753, test_loss: 0.9292, test_f1: 0.5490
 epoch: 14, train_loss: 0.8671, test_loss: 0.9209, test_f1: 0.5325
 epoch: 15, train_loss: 0.8554, test_loss: 0.9052, test_f1: 0.5581
 epoch: 16, train_loss: 0.8420, test_loss: 0.9172, test_f1: 0.5571
 epoch: 17, train_loss: 0.8341, test_loss: 0.8991, test_f1: 0.5774
 epoch: 18, train_loss: 0.8328, test_loss: 0.9003, test_f1: 0.5802
 epoch: 19, train_loss: 0.8285, test_loss: 0.9187, test_f1: 0.5850
 epoch: 20, train_loss: 0.8124, test_loss: 0.9405, test_f1: 0.5453
 epoch: 21, train_loss: 0.8032, test_loss: 0.9075, test_f1: 0.5960
 epoch: 22, train_loss: 0.8051, test_loss: 0.9026, test_f1: 0.6011
 epoch: 23, train_loss: 0.7928, test_loss: 0.9098, test_f1: 0.5696
 epoch: 24, train_loss: 0.7946, test_loss: 0.8994, test_f1: 0.6051
 epoch: 25, train_loss: 0.7811, test_loss: 0.9087, test_f1: 0.5927
 epoch: 26, train_loss: 0.7815, test_loss: 0.9368, test_f1: 0.5829
 epoch: 27, train_loss: 0.7650, test_loss: 0.8934, test_f1: 0.5704
 epoch: 28, train_loss: 0.7697, test_loss: 0.9156, test_f1: 0.5756
 epoch: 29, train_loss: 0.7574, test_loss: 0.9305, test_f1: 0.5887
 epoch: 30, train_loss: 0.7486, test_loss: 0.9195, test_f1: 0.5802
 epoch: 31, train_loss: 0.7355, test_loss: 0.9081, test_f1: 0.6257
 epoch: 32, train_loss: 0.7341, test_loss: 0.9178, test_f1: 0.5969
 epoch: 33, train_loss: 0.7287, test_loss: 0.9190, test_f1: 0.5932
 epoch: 34, train_loss: 0.7214, test_loss: 0.8992, test_f1: 0.6156
 epoch: 35, train_loss: 0.7255, test_loss: 0.9146, test_f1: 0.6205
 epoch: 36, train_loss: 0.7153, test_loss: 0.9323, test_f1: 0.6089
 epoch: 37, train_loss: 0.7039, test_loss: 0.9329, test_f1: 0.6204
 epoch: 38, train_loss: 0.7033, test_loss: 0.9250, test_f1: 0.6113
 epoch: 39, train_loss: 0.7064, test_loss: 0.9272, test_f1: 0.5871
 epoch: 40, train_loss: 0.6790, test_loss: 0.9126, test_f1: 0.6167
 epoch: 41, train_loss: 0.6888, test_loss: 0.9380, test_f1: 0.6160
 epoch: 42, train_loss: 0.6890, test_loss: 0.9572, test_f1: 0.6149
 epoch: 43, train_loss: 0.6717, test_loss: 0.9844, test_f1: 0.6069
 epoch: 44, train_loss: 0.6824, test_loss: 0.9537, test_f1: 0.6065
 epoch: 45, train_loss: 0.6631, test_loss: 0.9288, test_f1: 0.6092
 epoch: 46, train_loss: 0.6664, test_loss: 0.9309, test_f1: 0.6224
 epoch: 47, train_loss: 0.6500, test_loss: 0.9133, test_f1: 0.6308
 epoch: 48, train_loss: 0.6444, test_loss: 0.9166, test_f1: 0.6433
 epoch: 49, train_loss: 0.6511, test_loss: 0.9311, test_f1: 0.6315
 epoch: 50, train_loss: 0.6343, test_loss: 0.9476, test_f1: 0.6027
 epoch: 51, train_loss: 0.6256, test_loss: 0.9330, test_f1: 0.6443
 epoch: 52, train_loss: 0.6037, test_loss: 0.9402, test_f1: 0.6064
 epoch: 53, train_loss: 0.6080, test_loss: 0.9318, test_f1: 0.6191
 epoch: 54, train_loss: 0.6069, test_loss: 0.9323, test_f1: 0.6078
 epoch: 55, train_loss: 0.5995, test_loss: 0.9373, test_f1: 0.6160
 epoch: 56, train_loss: 0.5957, test_loss: 0.9390, test_f1: 0.6265
 epoch: 57, train_loss: 0.5880, test_loss: 0.9469, test_f1: 0.6226
 epoch: 58, train_loss: 0.5922, test_loss: 0.9574, test_f1: 0.6443
 epoch: 59, train_loss: 0.5915, test_loss: 0.9518, test_f1: 0.6176
 epoch: 60, train_loss: 0.6000, test_loss: 0.9488, test_f1: 0.6337
 epoch: 61, train_loss: 0.5714, test_loss: 0.9556, test_f1: 0.6355
 epoch: 62, train_loss: 0.5729, test_loss: 0.9710, test_f1: 0.6247
 epoch: 63, train_loss: 0.5839, test_loss: 0.9662, test_f1: 0.6083
 epoch: 64, train_loss: 0.5699, test_loss: 0.9730, test_f1: 0.6105
 epoch: 65, train_loss: 0.5823, test_loss: 0.9687, test_f1: 0.6373
 epoch: 66, train_loss: 0.5688, test_loss: 0.9710, test_f1: 0.6421
 epoch: 67, train_loss: 0.5580, test_loss: 0.9586, test_f1: 0.6319
 epoch: 68, train_loss: 0.5739, test_loss: 0.9459, test_f1: 0.6428
 epoch: 69, train_loss: 0.5569, test_loss: 0.9864, test_f1: 0.6237
 epoch: 70, train_loss: 0.5443, test_loss: 0.9747, test_f1: 0.6462
 epoch: 71, train_loss: 0.5541, test_loss: 0.9574, test_f1: 0.6183
 epoch: 72, train_loss: 0.5440, test_loss: 0.9566, test_f1: 0.6232
 epoch: 73, train_loss: 0.5425, test_loss: 0.9698, test_f1: 0.6447
 epoch: 74, train_loss: 0.5383, test_loss: 0.9779, test_f1: 0.6497
 epoch: 75, train_loss: 0.5391, test_loss: 0.9856, test_f1: 0.6338
 epoch: 76, train_loss: 0.5342, test_loss: 0.9904, test_f1: 0.6193
 epoch: 77, train_loss: 0.5497, test_loss: 1.0017, test_f1: 0.6435
 epoch: 78, train_loss: 0.5253, test_loss: 0.9777, test_f1: 0.6556
 epoch: 79, train_loss: 0.5344, test_loss: 0.9892, test_f1: 0.6353
 epoch: 80, train_loss: 0.5097, test_loss: 0.9777, test_f1: 0.6532
 epoch: 81, train_loss: 0.5279, test_loss: 0.9719, test_f1: 0.6265
 epoch: 82, train_loss: 0.5146, test_loss: 0.9866, test_f1: 0.6482
 epoch: 83, train_loss: 0.5081, test_loss: 0.9879, test_f1: 0.6573
 epoch: 84, train_loss: 0.5159, test_loss: 0.9943, test_f1: 0.6503
 epoch: 85, train_loss: 0.5106, test_loss: 1.0223, test_f1: 0.6658
 epoch: 86, train_loss: 0.5094, test_loss: 1.0073, test_f1: 0.6255
 epoch: 87, train_loss: 0.5130, test_loss: 1.0056, test_f1: 0.6523
 epoch: 88, train_loss: 0.4924, test_loss: 1.0061, test_f1: 0.6551
 epoch: 89, train_loss: 0.4975, test_loss: 0.9939, test_f1: 0.6450
 epoch: 90, train_loss: 0.4847, test_loss: 1.0442, test_f1: 0.6432
 epoch: 91, train_loss: 0.5040, test_loss: 1.0434, test_f1: 0.6365
 epoch: 92, train_loss: 0.4893, test_loss: 1.0359, test_f1: 0.6394
 epoch: 93, train_loss: 0.4927, test_loss: 1.0497, test_f1: 0.6470
 epoch: 94, train_loss: 0.4896, test_loss: 1.0686, test_f1: 0.6396
 epoch: 95, train_loss: 0.5060, test_loss: 1.0597, test_f1: 0.6211
 epoch: 96, train_loss: 0.4860, test_loss: 1.0502, test_f1: 0.6454
 epoch: 97, train_loss: 0.4785, test_loss: 1.0378, test_f1: 0.6619
 epoch: 98, train_loss: 0.4848, test_loss: 1.0541, test_f1: 0.6592
 epoch: 99, train_loss: 0.4740, test_loss: 1.0545, test_f1: 0.6589
##################ITERATION #9 ****************************************
 epoch: 0, train_loss: 1.2906, test_loss: 1.0888, test_f1: 0.4517
 epoch: 1, train_loss: 1.1039, test_loss: 0.9946, test_f1: 0.4863
 epoch: 2, train_loss: 1.0524, test_loss: 0.9599, test_f1: 0.5014
 epoch: 3, train_loss: 1.0078, test_loss: 0.9547, test_f1: 0.4886
 epoch: 4, train_loss: 0.9982, test_loss: 0.9326, test_f1: 0.5109
 epoch: 5, train_loss: 0.9851, test_loss: 0.9050, test_f1: 0.5245
 epoch: 6, train_loss: 0.9738, test_loss: 0.8992, test_f1: 0.5316
 epoch: 7, train_loss: 0.9445, test_loss: 0.9342, test_f1: 0.4943
 epoch: 8, train_loss: 0.9451, test_loss: 0.9262, test_f1: 0.4897
 epoch: 9, train_loss: 0.9232, test_loss: 0.9237, test_f1: 0.5182
 epoch: 10, train_loss: 0.9104, test_loss: 0.8982, test_f1: 0.5190
 epoch: 11, train_loss: 0.9095, test_loss: 0.9149, test_f1: 0.5113
 epoch: 12, train_loss: 0.8943, test_loss: 0.8858, test_f1: 0.5536
 epoch: 13, train_loss: 0.8835, test_loss: 0.9084, test_f1: 0.5466
 epoch: 14, train_loss: 0.8858, test_loss: 0.8955, test_f1: 0.5649
 epoch: 15, train_loss: 0.8633, test_loss: 0.8986, test_f1: 0.5554
 epoch: 16, train_loss: 0.8495, test_loss: 0.8873, test_f1: 0.5649
 epoch: 17, train_loss: 0.8528, test_loss: 0.8905, test_f1: 0.5867
 epoch: 18, train_loss: 0.8386, test_loss: 0.8915, test_f1: 0.5705
 epoch: 19, train_loss: 0.8186, test_loss: 0.8715, test_f1: 0.6041
 epoch: 20, train_loss: 0.8223, test_loss: 0.9083, test_f1: 0.5911
 epoch: 21, train_loss: 0.8239, test_loss: 0.9354, test_f1: 0.5603
 epoch: 22, train_loss: 0.8081, test_loss: 0.8865, test_f1: 0.5919
 epoch: 23, train_loss: 0.8035, test_loss: 0.8951, test_f1: 0.5831
 epoch: 24, train_loss: 0.7982, test_loss: 0.8631, test_f1: 0.5848
 epoch: 25, train_loss: 0.7955, test_loss: 0.8699, test_f1: 0.5911
 epoch: 26, train_loss: 0.7837, test_loss: 0.9045, test_f1: 0.5732
 epoch: 27, train_loss: 0.7735, test_loss: 0.8930, test_f1: 0.5701
 epoch: 28, train_loss: 0.7730, test_loss: 0.8886, test_f1: 0.5986
 epoch: 29, train_loss: 0.7723, test_loss: 0.8731, test_f1: 0.5788
 epoch: 30, train_loss: 0.7560, test_loss: 0.8949, test_f1: 0.6036
 epoch: 31, train_loss: 0.7533, test_loss: 0.9055, test_f1: 0.5797
 epoch: 32, train_loss: 0.7485, test_loss: 0.9040, test_f1: 0.6098
 epoch: 33, train_loss: 0.7461, test_loss: 0.9075, test_f1: 0.6037
 epoch: 34, train_loss: 0.7336, test_loss: 0.9224, test_f1: 0.5883
 epoch: 35, train_loss: 0.7304, test_loss: 0.8808, test_f1: 0.6102
 epoch: 36, train_loss: 0.7270, test_loss: 0.8904, test_f1: 0.6027
 epoch: 37, train_loss: 0.7295, test_loss: 0.8647, test_f1: 0.6161
 epoch: 38, train_loss: 0.7152, test_loss: 0.8923, test_f1: 0.6178
 epoch: 39, train_loss: 0.7187, test_loss: 0.8964, test_f1: 0.6102
 epoch: 40, train_loss: 0.7146, test_loss: 0.8986, test_f1: 0.5926
 epoch: 41, train_loss: 0.6996, test_loss: 0.8831, test_f1: 0.6201
 epoch: 42, train_loss: 0.6940, test_loss: 0.8855, test_f1: 0.5999
 epoch: 43, train_loss: 0.6995, test_loss: 0.8903, test_f1: 0.6101
 epoch: 44, train_loss: 0.6798, test_loss: 0.8930, test_f1: 0.5916
 epoch: 45, train_loss: 0.6778, test_loss: 0.8986, test_f1: 0.6024
 epoch: 46, train_loss: 0.6807, test_loss: 0.8793, test_f1: 0.6190
 epoch: 47, train_loss: 0.6642, test_loss: 0.8829, test_f1: 0.6296
 epoch: 48, train_loss: 0.6732, test_loss: 0.8804, test_f1: 0.6359
 epoch: 49, train_loss: 0.6648, test_loss: 0.8848, test_f1: 0.6353
 epoch: 50, train_loss: 0.6476, test_loss: 0.8805, test_f1: 0.6301
 epoch: 51, train_loss: 0.6418, test_loss: 0.8875, test_f1: 0.6381
 epoch: 52, train_loss: 0.6388, test_loss: 0.8898, test_f1: 0.6305
 epoch: 53, train_loss: 0.6365, test_loss: 0.9063, test_f1: 0.6206
 epoch: 54, train_loss: 0.6128, test_loss: 0.8966, test_f1: 0.6343
 epoch: 55, train_loss: 0.6221, test_loss: 0.9014, test_f1: 0.6291
 epoch: 56, train_loss: 0.6203, test_loss: 0.8943, test_f1: 0.6336
 epoch: 57, train_loss: 0.6173, test_loss: 0.9247, test_f1: 0.6214
 epoch: 58, train_loss: 0.6245, test_loss: 0.8979, test_f1: 0.6320
 epoch: 59, train_loss: 0.6058, test_loss: 0.9186, test_f1: 0.6216
 epoch: 60, train_loss: 0.6133, test_loss: 0.9084, test_f1: 0.6333
 epoch: 61, train_loss: 0.6010, test_loss: 0.9181, test_f1: 0.6178
 epoch: 62, train_loss: 0.6097, test_loss: 0.9259, test_f1: 0.6314
 epoch: 63, train_loss: 0.5860, test_loss: 0.9241, test_f1: 0.6207
 epoch: 64, train_loss: 0.6072, test_loss: 0.9055, test_f1: 0.6363
 epoch: 65, train_loss: 0.5983, test_loss: 0.9123, test_f1: 0.6242
 epoch: 66, train_loss: 0.5895, test_loss: 0.9140, test_f1: 0.6293
 epoch: 67, train_loss: 0.5948, test_loss: 0.9178, test_f1: 0.6358
 epoch: 68, train_loss: 0.5820, test_loss: 0.9111, test_f1: 0.6413
 epoch: 69, train_loss: 0.5804, test_loss: 0.9019, test_f1: 0.6410
 epoch: 70, train_loss: 0.5826, test_loss: 0.8972, test_f1: 0.6386
 epoch: 71, train_loss: 0.5868, test_loss: 0.9237, test_f1: 0.6370
 epoch: 72, train_loss: 0.5755, test_loss: 0.9174, test_f1: 0.6384
 epoch: 73, train_loss: 0.5691, test_loss: 0.9381, test_f1: 0.6381
 epoch: 74, train_loss: 0.5636, test_loss: 0.9624, test_f1: 0.6354
 epoch: 75, train_loss: 0.5654, test_loss: 0.9306, test_f1: 0.6098
 epoch: 76, train_loss: 0.5608, test_loss: 0.9341, test_f1: 0.6531
 epoch: 77, train_loss: 0.5610, test_loss: 0.9212, test_f1: 0.6497
 epoch: 78, train_loss: 0.5589, test_loss: 0.9433, test_f1: 0.6281
 epoch: 79, train_loss: 0.5617, test_loss: 0.9149, test_f1: 0.6431
 epoch: 80, train_loss: 0.5554, test_loss: 0.9323, test_f1: 0.6422
 epoch: 81, train_loss: 0.5481, test_loss: 0.9567, test_f1: 0.6271
 epoch: 82, train_loss: 0.5420, test_loss: 0.9730, test_f1: 0.6314
 epoch: 83, train_loss: 0.5426, test_loss: 0.9528, test_f1: 0.6384
 epoch: 84, train_loss: 0.5397, test_loss: 0.9639, test_f1: 0.6329
 epoch: 85, train_loss: 0.5442, test_loss: 0.9714, test_f1: 0.6289
 epoch: 86, train_loss: 0.5333, test_loss: 0.9809, test_f1: 0.6307
 epoch: 87, train_loss: 0.5341, test_loss: 0.9748, test_f1: 0.6116
 epoch: 88, train_loss: 0.5322, test_loss: 0.9693, test_f1: 0.6208
 epoch: 89, train_loss: 0.5185, test_loss: 1.0028, test_f1: 0.6243
 epoch: 90, train_loss: 0.5380, test_loss: 0.9929, test_f1: 0.6198
 epoch: 91, train_loss: 0.5192, test_loss: 1.0013, test_f1: 0.6090
 epoch: 92, train_loss: 0.5145, test_loss: 0.9915, test_f1: 0.6339
 epoch: 93, train_loss: 0.5144, test_loss: 0.9931, test_f1: 0.6321
 epoch: 94, train_loss: 0.5169, test_loss: 0.9915, test_f1: 0.6324
 epoch: 95, train_loss: 0.5115, test_loss: 1.0320, test_f1: 0.6232
 epoch: 96, train_loss: 0.5284, test_loss: 1.0252, test_f1: 0.6284
 epoch: 97, train_loss: 0.5050, test_loss: 1.0039, test_f1: 0.6278
 epoch: 98, train_loss: 0.5185, test_loss: 1.0221, test_f1: 0.6310
 epoch: 99, train_loss: 0.5091, test_loss: 1.0287, test_f1: 0.6300

Training completed in 801.69 seconds
Best F1: 0.7047 at epoch 55
Mean F1 across iterations: 0.6725  0.0131
========================FINAL RESULTS================================
FEGIN weighted F1: 0.7047  0.0131
python main.py --data ltspice_examples --representation component_net --model FEGIN --layers 5 --hiddens 128 --batch_size 64 --lr 0.0001 --emb_size 128 --epochs 100 --save_appendix component_net_L5_H128_BS64_LR0.0001_E128 --no_val
-----



STDERR:
  File "main.py", line 370, in <module>
    main()
  File "main.py", line 254, in main
    dataset = dataset_class(
  File "/home/philip/projects/ltspice_examples_code_repo/Circuit-Completion-Using-GNNs/component_classification_with_link_prediction_head/evaluation/FEGIN/kernel/circuit_datasets.py", line 15, in __init__
    self.data, self.slices = torch.load(self.processed_paths[0])
  File "/home/philip/.local/lib/python3.8/site-packages/torch/serialization.py", line 1040, in load
    warnings.warn(
  File "/usr/lib/python3.8/warnings.py", line 109, in _showwarnmsg
    sw(msg.message, msg.category, msg.filename, msg.lineno,
  File "main.py", line 47, in warn_with_traceback
    traceback.print_stack(file=log)
/home/philip/projects/ltspice_examples_code_repo/Circuit-Completion-Using-GNNs/component_classification_with_link_prediction_head/evaluation/FEGIN/kernel/circuit_datasets.py:15: FutureWarning: You are using `torch.load` with `weights_only=False` (the current default value), which uses the default pickle module implicitly. It is possible to construct malicious pickle data which will execute arbitrary code during unpickling (See https://github.com/pytorch/pytorch/blob/main/SECURITY.md#untrusted-models for more details). In a future release, the default value for `weights_only` will be flipped to `True`. This limits the functions that could be executed during unpickling. Arbitrary objects will no longer be allowed to be loaded via this mode unless they are explicitly allowlisted by the user via `torch.serialization.add_safe_globals`. We recommend you start setting `weights_only=True` for any use case where you don't have full control of the loaded file. Please open an issue on GitHub for any issues related to this experimental feature.
  self.data, self.slices = torch.load(self.processed_paths[0])
