STDOUT:
Results will be saved in /home/philip/projects/ltspice_examples_code_repo/Circuit-Completion-Using-GNNs/component_classification_with_link_prediction_head/evaluation/FEGIN/results/model_FEGIN_dataset_ltspice_examples
Command line input: python main.py --data ltspice_examples --representation component_pin --model FEGIN --layers 3 --hiddens 16 --batch_size 64 --lr 0.001 --emb_size 250 --epochs 100 --save_appendix component_pin_L3_H16_BS64_LR0.001_E250 --no_val
 is saved.
-----
ltspice_examples - FEGIN
Using 3 layers, 16 hidden units, h = 2
Loading component_pin representation dataset
ENTERED
Training FEGIN on component_pin representation
Train: 3560, Test: 848
##################ITERATION #0 ****************************************
 epoch: 0, train_loss: 1.3315, test_loss: 1.3089, test_f1: 0.2260
 epoch: 1, train_loss: 1.2642, test_loss: 1.2136, test_f1: 0.3392
 epoch: 2, train_loss: 1.1633, test_loss: 1.0930, test_f1: 0.3410
 epoch: 3, train_loss: 1.0868, test_loss: 1.0490, test_f1: 0.3454
 epoch: 4, train_loss: 1.0586, test_loss: 1.0511, test_f1: 0.3551
 epoch: 5, train_loss: 1.0386, test_loss: 1.0410, test_f1: 0.3410
 epoch: 6, train_loss: 1.0222, test_loss: 1.0361, test_f1: 0.3410
 epoch: 7, train_loss: 1.0079, test_loss: 1.0665, test_f1: 0.3336
 epoch: 8, train_loss: 0.9961, test_loss: 1.0172, test_f1: 0.3670
 epoch: 9, train_loss: 0.9829, test_loss: 1.0177, test_f1: 0.4303
 epoch: 10, train_loss: 0.9775, test_loss: 1.0198, test_f1: 0.3934
 epoch: 11, train_loss: 0.9714, test_loss: 0.9685, test_f1: 0.4019
 epoch: 12, train_loss: 0.9687, test_loss: 0.9830, test_f1: 0.4320
 epoch: 13, train_loss: 0.9554, test_loss: 1.0246, test_f1: 0.4390
 epoch: 14, train_loss: 0.9545, test_loss: 0.9922, test_f1: 0.4405
 epoch: 15, train_loss: 0.9486, test_loss: 0.9688, test_f1: 0.4712
 epoch: 16, train_loss: 0.9331, test_loss: 1.0219, test_f1: 0.4584
 epoch: 17, train_loss: 0.9337, test_loss: 0.9872, test_f1: 0.4887
 epoch: 18, train_loss: 0.9267, test_loss: 0.9700, test_f1: 0.4704
 epoch: 19, train_loss: 0.9206, test_loss: 1.0110, test_f1: 0.4471
 epoch: 20, train_loss: 0.9208, test_loss: 0.9526, test_f1: 0.4849
 epoch: 21, train_loss: 0.8974, test_loss: 0.9106, test_f1: 0.5039
 epoch: 22, train_loss: 0.9046, test_loss: 1.0840, test_f1: 0.4569
 epoch: 23, train_loss: 0.8885, test_loss: 0.8962, test_f1: 0.5061
 epoch: 24, train_loss: 0.8917, test_loss: 0.9936, test_f1: 0.4686
 epoch: 25, train_loss: 0.8935, test_loss: 0.9173, test_f1: 0.4967
 epoch: 26, train_loss: 0.8757, test_loss: 0.9290, test_f1: 0.4871
 epoch: 27, train_loss: 0.8741, test_loss: 0.8871, test_f1: 0.5016
 epoch: 28, train_loss: 0.8740, test_loss: 0.9493, test_f1: 0.4912
 epoch: 29, train_loss: 0.8815, test_loss: 0.8980, test_f1: 0.4968
 epoch: 30, train_loss: 0.8676, test_loss: 0.8632, test_f1: 0.5294
 epoch: 31, train_loss: 0.8543, test_loss: 0.8888, test_f1: 0.5124
 epoch: 32, train_loss: 0.8456, test_loss: 0.9306, test_f1: 0.4977
 epoch: 33, train_loss: 0.8547, test_loss: 0.9415, test_f1: 0.5014
 epoch: 34, train_loss: 0.8507, test_loss: 0.8899, test_f1: 0.5174
 epoch: 35, train_loss: 0.8385, test_loss: 0.9212, test_f1: 0.5039
 epoch: 36, train_loss: 0.8393, test_loss: 0.8994, test_f1: 0.5336
 epoch: 37, train_loss: 0.8358, test_loss: 0.9290, test_f1: 0.5130
 epoch: 38, train_loss: 0.8318, test_loss: 0.9076, test_f1: 0.5176
 epoch: 39, train_loss: 0.8342, test_loss: 1.0074, test_f1: 0.5028
 epoch: 40, train_loss: 0.8409, test_loss: 0.8791, test_f1: 0.5162
 epoch: 41, train_loss: 0.8288, test_loss: 0.9612, test_f1: 0.5020
 epoch: 42, train_loss: 0.8262, test_loss: 0.8710, test_f1: 0.5263
 epoch: 43, train_loss: 0.8307, test_loss: 0.8811, test_f1: 0.5451
 epoch: 44, train_loss: 0.8237, test_loss: 0.8827, test_f1: 0.5099
 epoch: 45, train_loss: 0.8297, test_loss: 0.8778, test_f1: 0.5156
 epoch: 46, train_loss: 0.8190, test_loss: 0.8595, test_f1: 0.5452
 epoch: 47, train_loss: 0.8141, test_loss: 0.8614, test_f1: 0.5289
 epoch: 48, train_loss: 0.8186, test_loss: 0.8458, test_f1: 0.5186
 epoch: 49, train_loss: 0.8154, test_loss: 0.8853, test_f1: 0.5249
 epoch: 50, train_loss: 0.8177, test_loss: 0.8512, test_f1: 0.5282
 epoch: 51, train_loss: 0.7971, test_loss: 0.8425, test_f1: 0.5285
 epoch: 52, train_loss: 0.8104, test_loss: 0.8700, test_f1: 0.5314
 epoch: 53, train_loss: 0.7908, test_loss: 0.8627, test_f1: 0.5347
 epoch: 54, train_loss: 0.7813, test_loss: 0.8663, test_f1: 0.5467
 epoch: 55, train_loss: 0.7833, test_loss: 0.8736, test_f1: 0.5344
 epoch: 56, train_loss: 0.7797, test_loss: 0.8791, test_f1: 0.5372
 epoch: 57, train_loss: 0.7879, test_loss: 0.8563, test_f1: 0.5329
 epoch: 58, train_loss: 0.7808, test_loss: 0.8678, test_f1: 0.5318
 epoch: 59, train_loss: 0.7836, test_loss: 0.8565, test_f1: 0.5601
 epoch: 60, train_loss: 0.7753, test_loss: 0.8586, test_f1: 0.5264
 epoch: 61, train_loss: 0.7821, test_loss: 0.8451, test_f1: 0.5406
 epoch: 62, train_loss: 0.7761, test_loss: 0.8795, test_f1: 0.5344
 epoch: 63, train_loss: 0.7758, test_loss: 0.8906, test_f1: 0.5275
 epoch: 64, train_loss: 0.7717, test_loss: 0.8836, test_f1: 0.5461
 epoch: 65, train_loss: 0.7800, test_loss: 0.8557, test_f1: 0.5550
 epoch: 66, train_loss: 0.7793, test_loss: 0.8983, test_f1: 0.5574
 epoch: 67, train_loss: 0.7781, test_loss: 0.8616, test_f1: 0.5489
 epoch: 68, train_loss: 0.7674, test_loss: 0.8776, test_f1: 0.5594
 epoch: 69, train_loss: 0.7684, test_loss: 0.8971, test_f1: 0.5445
 epoch: 70, train_loss: 0.7648, test_loss: 0.9215, test_f1: 0.5342
 epoch: 71, train_loss: 0.7715, test_loss: 0.9421, test_f1: 0.5322
 epoch: 72, train_loss: 0.7474, test_loss: 0.8388, test_f1: 0.5403
 epoch: 73, train_loss: 0.7772, test_loss: 0.8489, test_f1: 0.5661
 epoch: 74, train_loss: 0.7718, test_loss: 0.8955, test_f1: 0.5322
 epoch: 75, train_loss: 0.7705, test_loss: 0.8700, test_f1: 0.5555
 epoch: 76, train_loss: 0.7654, test_loss: 0.8517, test_f1: 0.5533
 epoch: 77, train_loss: 0.7587, test_loss: 0.9002, test_f1: 0.5530
 epoch: 78, train_loss: 0.7596, test_loss: 0.8944, test_f1: 0.5537
 epoch: 79, train_loss: 0.7445, test_loss: 0.9050, test_f1: 0.5483
 epoch: 80, train_loss: 0.7615, test_loss: 0.8892, test_f1: 0.5386
 epoch: 81, train_loss: 0.7556, test_loss: 0.8754, test_f1: 0.5552
 epoch: 82, train_loss: 0.7517, test_loss: 0.8805, test_f1: 0.5415
 epoch: 83, train_loss: 0.7594, test_loss: 0.8839, test_f1: 0.5527
 epoch: 84, train_loss: 0.7529, test_loss: 0.8458, test_f1: 0.5510
 epoch: 85, train_loss: 0.7478, test_loss: 0.8927, test_f1: 0.5482
 epoch: 86, train_loss: 0.7480, test_loss: 0.9307, test_f1: 0.5461
 epoch: 87, train_loss: 0.7537, test_loss: 0.8905, test_f1: 0.5634
 epoch: 88, train_loss: 0.7450, test_loss: 0.9288, test_f1: 0.5350
 epoch: 89, train_loss: 0.7450, test_loss: 0.8448, test_f1: 0.5618
 epoch: 90, train_loss: 0.7461, test_loss: 0.8927, test_f1: 0.5571
 epoch: 91, train_loss: 0.7476, test_loss: 0.9178, test_f1: 0.5437
 epoch: 92, train_loss: 0.7420, test_loss: 0.8844, test_f1: 0.5489
 epoch: 93, train_loss: 0.7414, test_loss: 0.9034, test_f1: 0.5613
 epoch: 94, train_loss: 0.7481, test_loss: 0.9003, test_f1: 0.5629
 epoch: 95, train_loss: 0.7364, test_loss: 0.8903, test_f1: 0.5568
 epoch: 96, train_loss: 0.7427, test_loss: 0.9001, test_f1: 0.5552
 epoch: 97, train_loss: 0.7317, test_loss: 0.9119, test_f1: 0.5500
 epoch: 98, train_loss: 0.7445, test_loss: 0.9167, test_f1: 0.5478
 epoch: 99, train_loss: 0.7476, test_loss: 0.8636, test_f1: 0.5552
##################ITERATION #1 ****************************************
 epoch: 0, train_loss: 1.2738, test_loss: 1.1936, test_f1: 0.3160
 epoch: 1, train_loss: 1.1590, test_loss: 1.0898, test_f1: 0.3395
 epoch: 2, train_loss: 1.0712, test_loss: 1.0442, test_f1: 0.3447
 epoch: 3, train_loss: 1.0357, test_loss: 1.0327, test_f1: 0.3454
 epoch: 4, train_loss: 1.0322, test_loss: 1.0375, test_f1: 0.3470
 epoch: 5, train_loss: 1.0100, test_loss: 1.0159, test_f1: 0.3543
 epoch: 6, train_loss: 0.9972, test_loss: 0.9912, test_f1: 0.3734
 epoch: 7, train_loss: 0.9958, test_loss: 0.9856, test_f1: 0.3789
 epoch: 8, train_loss: 0.9803, test_loss: 1.0144, test_f1: 0.4091
 epoch: 9, train_loss: 0.9677, test_loss: 0.9711, test_f1: 0.4124
 epoch: 10, train_loss: 0.9594, test_loss: 0.9627, test_f1: 0.4839
 epoch: 11, train_loss: 0.9430, test_loss: 0.9651, test_f1: 0.4744
 epoch: 12, train_loss: 0.9368, test_loss: 0.9473, test_f1: 0.4924
 epoch: 13, train_loss: 0.9234, test_loss: 0.9387, test_f1: 0.4994
 epoch: 14, train_loss: 0.9197, test_loss: 0.9158, test_f1: 0.4965
 epoch: 15, train_loss: 0.9074, test_loss: 0.9406, test_f1: 0.5067
 epoch: 16, train_loss: 0.9006, test_loss: 0.9322, test_f1: 0.5042
 epoch: 17, train_loss: 0.8984, test_loss: 0.9472, test_f1: 0.5054
 epoch: 18, train_loss: 0.9024, test_loss: 0.9200, test_f1: 0.5078
 epoch: 19, train_loss: 0.8828, test_loss: 0.9139, test_f1: 0.5097
 epoch: 20, train_loss: 0.8844, test_loss: 0.8907, test_f1: 0.5231
 epoch: 21, train_loss: 0.8766, test_loss: 0.9161, test_f1: 0.4899
 epoch: 22, train_loss: 0.8609, test_loss: 0.9504, test_f1: 0.5070
 epoch: 23, train_loss: 0.8648, test_loss: 0.8764, test_f1: 0.5191
 epoch: 24, train_loss: 0.8681, test_loss: 0.9443, test_f1: 0.4997
 epoch: 25, train_loss: 0.8574, test_loss: 0.9273, test_f1: 0.5042
 epoch: 26, train_loss: 0.8534, test_loss: 0.9268, test_f1: 0.5015
 epoch: 27, train_loss: 0.8422, test_loss: 0.8848, test_f1: 0.5405
 epoch: 28, train_loss: 0.8505, test_loss: 0.9540, test_f1: 0.4989
 epoch: 29, train_loss: 0.8499, test_loss: 0.9114, test_f1: 0.5037
 epoch: 30, train_loss: 0.8518, test_loss: 0.8830, test_f1: 0.5402
 epoch: 31, train_loss: 0.8446, test_loss: 0.8840, test_f1: 0.5258
 epoch: 32, train_loss: 0.8392, test_loss: 0.8713, test_f1: 0.5340
 epoch: 33, train_loss: 0.8412, test_loss: 0.8762, test_f1: 0.5355
 epoch: 34, train_loss: 0.8308, test_loss: 0.8769, test_f1: 0.5300
 epoch: 35, train_loss: 0.8332, test_loss: 0.8898, test_f1: 0.5286
 epoch: 36, train_loss: 0.8303, test_loss: 0.9118, test_f1: 0.5214
 epoch: 37, train_loss: 0.8192, test_loss: 0.8586, test_f1: 0.5119
 epoch: 38, train_loss: 0.8327, test_loss: 0.8718, test_f1: 0.5285
 epoch: 39, train_loss: 0.8221, test_loss: 0.8959, test_f1: 0.5343
 epoch: 40, train_loss: 0.8234, test_loss: 0.8983, test_f1: 0.5241
 epoch: 41, train_loss: 0.8235, test_loss: 0.8732, test_f1: 0.5461
 epoch: 42, train_loss: 0.8087, test_loss: 0.8684, test_f1: 0.5345
 epoch: 43, train_loss: 0.8165, test_loss: 0.8805, test_f1: 0.5353
 epoch: 44, train_loss: 0.8031, test_loss: 0.8612, test_f1: 0.5492
 epoch: 45, train_loss: 0.8044, test_loss: 0.8786, test_f1: 0.5159
 epoch: 46, train_loss: 0.8070, test_loss: 0.8719, test_f1: 0.5285
 epoch: 47, train_loss: 0.7992, test_loss: 0.8690, test_f1: 0.5305
 epoch: 48, train_loss: 0.7949, test_loss: 0.8659, test_f1: 0.5386
 epoch: 49, train_loss: 0.7944, test_loss: 0.8894, test_f1: 0.5219
 epoch: 50, train_loss: 0.7788, test_loss: 0.8744, test_f1: 0.5222
 epoch: 51, train_loss: 0.7831, test_loss: 0.8473, test_f1: 0.5368
 epoch: 52, train_loss: 0.7853, test_loss: 0.8580, test_f1: 0.5365
 epoch: 53, train_loss: 0.7857, test_loss: 0.8969, test_f1: 0.5282
 epoch: 54, train_loss: 0.7872, test_loss: 0.8942, test_f1: 0.5275
 epoch: 55, train_loss: 0.7874, test_loss: 0.8728, test_f1: 0.5379
 epoch: 56, train_loss: 0.7732, test_loss: 0.8776, test_f1: 0.5375
 epoch: 57, train_loss: 0.7629, test_loss: 0.8889, test_f1: 0.5364
 epoch: 58, train_loss: 0.7810, test_loss: 0.8736, test_f1: 0.5422
 epoch: 59, train_loss: 0.7753, test_loss: 0.8801, test_f1: 0.5385
 epoch: 60, train_loss: 0.7794, test_loss: 0.8753, test_f1: 0.5482
 epoch: 61, train_loss: 0.7677, test_loss: 0.8920, test_f1: 0.5382
 epoch: 62, train_loss: 0.7672, test_loss: 0.8766, test_f1: 0.5480
 epoch: 63, train_loss: 0.7874, test_loss: 0.9246, test_f1: 0.5196
 epoch: 64, train_loss: 0.7745, test_loss: 0.8850, test_f1: 0.5368
 epoch: 65, train_loss: 0.7664, test_loss: 0.8968, test_f1: 0.5269
 epoch: 66, train_loss: 0.7608, test_loss: 0.8787, test_f1: 0.5484
 epoch: 67, train_loss: 0.7613, test_loss: 0.8950, test_f1: 0.5287
 epoch: 68, train_loss: 0.7589, test_loss: 0.9060, test_f1: 0.5283
 epoch: 69, train_loss: 0.7688, test_loss: 0.8982, test_f1: 0.5371
 epoch: 70, train_loss: 0.7581, test_loss: 0.8713, test_f1: 0.5544
 epoch: 71, train_loss: 0.7623, test_loss: 0.8906, test_f1: 0.5424
 epoch: 72, train_loss: 0.7668, test_loss: 0.8793, test_f1: 0.5473
 epoch: 73, train_loss: 0.7616, test_loss: 0.8817, test_f1: 0.5417
 epoch: 74, train_loss: 0.7546, test_loss: 0.8714, test_f1: 0.5534
 epoch: 75, train_loss: 0.7635, test_loss: 0.9024, test_f1: 0.5516
 epoch: 76, train_loss: 0.7596, test_loss: 0.9105, test_f1: 0.5328
 epoch: 77, train_loss: 0.7530, test_loss: 0.9112, test_f1: 0.5502
 epoch: 78, train_loss: 0.7642, test_loss: 0.9158, test_f1: 0.5353
 epoch: 79, train_loss: 0.7516, test_loss: 0.9208, test_f1: 0.5321
 epoch: 80, train_loss: 0.7520, test_loss: 0.8943, test_f1: 0.5469
 epoch: 81, train_loss: 0.7520, test_loss: 0.8947, test_f1: 0.5451
 epoch: 82, train_loss: 0.7498, test_loss: 0.9127, test_f1: 0.5397
 epoch: 83, train_loss: 0.7509, test_loss: 0.8989, test_f1: 0.5559
 epoch: 84, train_loss: 0.7473, test_loss: 0.9068, test_f1: 0.5421
 epoch: 85, train_loss: 0.7401, test_loss: 0.9032, test_f1: 0.5423
 epoch: 86, train_loss: 0.7522, test_loss: 0.9254, test_f1: 0.5412
 epoch: 87, train_loss: 0.7409, test_loss: 0.9047, test_f1: 0.5384
 epoch: 88, train_loss: 0.7469, test_loss: 0.8984, test_f1: 0.5471
 epoch: 89, train_loss: 0.7418, test_loss: 0.9080, test_f1: 0.5484
 epoch: 90, train_loss: 0.7430, test_loss: 0.9327, test_f1: 0.5417
 epoch: 91, train_loss: 0.7461, test_loss: 0.9062, test_f1: 0.5557
 epoch: 92, train_loss: 0.7406, test_loss: 0.9054, test_f1: 0.5390
 epoch: 93, train_loss: 0.7463, test_loss: 0.9155, test_f1: 0.5427
 epoch: 94, train_loss: 0.7391, test_loss: 0.9252, test_f1: 0.5341
 epoch: 95, train_loss: 0.7427, test_loss: 0.9183, test_f1: 0.5506
 epoch: 96, train_loss: 0.7359, test_loss: 0.8938, test_f1: 0.5449
 epoch: 97, train_loss: 0.7286, test_loss: 0.9219, test_f1: 0.5348
 epoch: 98, train_loss: 0.7525, test_loss: 0.8835, test_f1: 0.5486
 epoch: 99, train_loss: 0.7430, test_loss: 0.9015, test_f1: 0.5514
##################ITERATION #2 ****************************************
 epoch: 0, train_loss: 1.2325, test_loss: 1.1584, test_f1: 0.3076
 epoch: 1, train_loss: 1.1098, test_loss: 1.0764, test_f1: 0.3617
 epoch: 2, train_loss: 1.0661, test_loss: 1.0630, test_f1: 0.3712
 epoch: 3, train_loss: 1.0327, test_loss: 1.0488, test_f1: 0.4069
 epoch: 4, train_loss: 1.0168, test_loss: 1.0448, test_f1: 0.3925
 epoch: 5, train_loss: 1.0086, test_loss: 1.0438, test_f1: 0.4609
 epoch: 6, train_loss: 0.9930, test_loss: 1.0403, test_f1: 0.4506
 epoch: 7, train_loss: 0.9777, test_loss: 1.0128, test_f1: 0.4765
 epoch: 8, train_loss: 0.9703, test_loss: 0.9792, test_f1: 0.4985
 epoch: 9, train_loss: 0.9534, test_loss: 1.0179, test_f1: 0.4718
 epoch: 10, train_loss: 0.9527, test_loss: 0.9972, test_f1: 0.4822
 epoch: 11, train_loss: 0.9339, test_loss: 1.0059, test_f1: 0.4745
 epoch: 12, train_loss: 0.9292, test_loss: 0.9838, test_f1: 0.5006
 epoch: 13, train_loss: 0.9203, test_loss: 0.9534, test_f1: 0.5006
 epoch: 14, train_loss: 0.9215, test_loss: 0.9471, test_f1: 0.5037
 epoch: 15, train_loss: 0.9095, test_loss: 0.9714, test_f1: 0.5010
 epoch: 16, train_loss: 0.8944, test_loss: 0.9846, test_f1: 0.5004
 epoch: 17, train_loss: 0.8835, test_loss: 0.9356, test_f1: 0.5115
 epoch: 18, train_loss: 0.8909, test_loss: 0.9835, test_f1: 0.5005
 epoch: 19, train_loss: 0.8901, test_loss: 0.9543, test_f1: 0.5036
 epoch: 20, train_loss: 0.8730, test_loss: 0.9381, test_f1: 0.5025
 epoch: 21, train_loss: 0.8652, test_loss: 0.9613, test_f1: 0.4991
 epoch: 22, train_loss: 0.8532, test_loss: 0.9596, test_f1: 0.5107
 epoch: 23, train_loss: 0.8570, test_loss: 0.9505, test_f1: 0.5141
 epoch: 24, train_loss: 0.8522, test_loss: 0.8983, test_f1: 0.5141
 epoch: 25, train_loss: 0.8420, test_loss: 0.9586, test_f1: 0.5087
 epoch: 26, train_loss: 0.8399, test_loss: 0.8778, test_f1: 0.5236
 epoch: 27, train_loss: 0.8302, test_loss: 0.9019, test_f1: 0.5241
 epoch: 28, train_loss: 0.8271, test_loss: 0.9246, test_f1: 0.5307
 epoch: 29, train_loss: 0.8239, test_loss: 0.8969, test_f1: 0.5258
 epoch: 30, train_loss: 0.8269, test_loss: 0.9445, test_f1: 0.5128
 epoch: 31, train_loss: 0.8188, test_loss: 0.9005, test_f1: 0.5340
 epoch: 32, train_loss: 0.8143, test_loss: 0.9210, test_f1: 0.5110
 epoch: 33, train_loss: 0.8106, test_loss: 0.9526, test_f1: 0.5379
 epoch: 34, train_loss: 0.8093, test_loss: 0.9240, test_f1: 0.5231
 epoch: 35, train_loss: 0.7894, test_loss: 0.9313, test_f1: 0.5033
 epoch: 36, train_loss: 0.8134, test_loss: 0.8863, test_f1: 0.5372
 epoch: 37, train_loss: 0.8018, test_loss: 0.9210, test_f1: 0.5428
 epoch: 38, train_loss: 0.7929, test_loss: 0.9321, test_f1: 0.5339
 epoch: 39, train_loss: 0.7904, test_loss: 0.9040, test_f1: 0.5381
 epoch: 40, train_loss: 0.7862, test_loss: 0.9366, test_f1: 0.5244
 epoch: 41, train_loss: 0.7916, test_loss: 0.8989, test_f1: 0.5344
 epoch: 42, train_loss: 0.7757, test_loss: 0.9444, test_f1: 0.5338
 epoch: 43, train_loss: 0.7919, test_loss: 0.9978, test_f1: 0.4941
 epoch: 44, train_loss: 0.7889, test_loss: 0.9415, test_f1: 0.5375
 epoch: 45, train_loss: 0.7779, test_loss: 0.9109, test_f1: 0.5327
 epoch: 46, train_loss: 0.7765, test_loss: 0.9442, test_f1: 0.5176
 epoch: 47, train_loss: 0.7732, test_loss: 0.9155, test_f1: 0.5374
 epoch: 48, train_loss: 0.7799, test_loss: 0.9227, test_f1: 0.5221
 epoch: 49, train_loss: 0.7682, test_loss: 0.9608, test_f1: 0.5189
 epoch: 50, train_loss: 0.7703, test_loss: 0.9187, test_f1: 0.5406
 epoch: 51, train_loss: 0.7519, test_loss: 0.9621, test_f1: 0.5181
 epoch: 52, train_loss: 0.7512, test_loss: 0.9187, test_f1: 0.5278
 epoch: 53, train_loss: 0.7549, test_loss: 0.9594, test_f1: 0.5328
 epoch: 54, train_loss: 0.7548, test_loss: 0.9274, test_f1: 0.5167
 epoch: 55, train_loss: 0.7476, test_loss: 0.9001, test_f1: 0.5468
 epoch: 56, train_loss: 0.7548, test_loss: 0.9259, test_f1: 0.5392
 epoch: 57, train_loss: 0.7516, test_loss: 0.9446, test_f1: 0.5255
 epoch: 58, train_loss: 0.7443, test_loss: 0.9449, test_f1: 0.5224
 epoch: 59, train_loss: 0.7423, test_loss: 0.9603, test_f1: 0.5353
 epoch: 60, train_loss: 0.7359, test_loss: 0.9671, test_f1: 0.5380
 epoch: 61, train_loss: 0.7402, test_loss: 0.9672, test_f1: 0.5299
 epoch: 62, train_loss: 0.7407, test_loss: 0.9547, test_f1: 0.5208
 epoch: 63, train_loss: 0.7422, test_loss: 0.9665, test_f1: 0.5284
 epoch: 64, train_loss: 0.7420, test_loss: 0.9609, test_f1: 0.5224
 epoch: 65, train_loss: 0.7293, test_loss: 0.9899, test_f1: 0.5103
 epoch: 66, train_loss: 0.7309, test_loss: 0.9170, test_f1: 0.5400
 epoch: 67, train_loss: 0.7331, test_loss: 0.9773, test_f1: 0.5262
 epoch: 68, train_loss: 0.7394, test_loss: 0.9416, test_f1: 0.5386
 epoch: 69, train_loss: 0.7296, test_loss: 0.9425, test_f1: 0.5378
 epoch: 70, train_loss: 0.7410, test_loss: 0.9897, test_f1: 0.5045
 epoch: 71, train_loss: 0.7475, test_loss: 0.9639, test_f1: 0.5272
 epoch: 72, train_loss: 0.7290, test_loss: 0.9428, test_f1: 0.5348
 epoch: 73, train_loss: 0.7262, test_loss: 0.9554, test_f1: 0.5181
 epoch: 74, train_loss: 0.7291, test_loss: 0.9631, test_f1: 0.5227
 epoch: 75, train_loss: 0.7374, test_loss: 0.9498, test_f1: 0.5396
 epoch: 76, train_loss: 0.7168, test_loss: 0.9793, test_f1: 0.5392
 epoch: 77, train_loss: 0.7163, test_loss: 0.9607, test_f1: 0.5354
 epoch: 78, train_loss: 0.7155, test_loss: 0.9737, test_f1: 0.5299
 epoch: 79, train_loss: 0.7249, test_loss: 0.9350, test_f1: 0.5382
 epoch: 80, train_loss: 0.7295, test_loss: 0.9832, test_f1: 0.5236
 epoch: 81, train_loss: 0.7201, test_loss: 1.0087, test_f1: 0.5248
 epoch: 82, train_loss: 0.7144, test_loss: 1.0147, test_f1: 0.5033
 epoch: 83, train_loss: 0.7073, test_loss: 0.9536, test_f1: 0.5294
 epoch: 84, train_loss: 0.7157, test_loss: 1.0022, test_f1: 0.5032
 epoch: 85, train_loss: 0.7192, test_loss: 0.9831, test_f1: 0.5224
 epoch: 86, train_loss: 0.7071, test_loss: 0.9962, test_f1: 0.5276
 epoch: 87, train_loss: 0.7256, test_loss: 1.0056, test_f1: 0.5304
 epoch: 88, train_loss: 0.7178, test_loss: 0.9560, test_f1: 0.5307
 epoch: 89, train_loss: 0.7108, test_loss: 0.9798, test_f1: 0.5426
 epoch: 90, train_loss: 0.7200, test_loss: 0.9660, test_f1: 0.5100
 epoch: 91, train_loss: 0.7058, test_loss: 1.0043, test_f1: 0.5249
 epoch: 92, train_loss: 0.7062, test_loss: 1.0043, test_f1: 0.5084
 epoch: 93, train_loss: 0.7155, test_loss: 0.9943, test_f1: 0.5191
 epoch: 94, train_loss: 0.6955, test_loss: 1.0205, test_f1: 0.5119
 epoch: 95, train_loss: 0.7012, test_loss: 0.9813, test_f1: 0.5310
 epoch: 96, train_loss: 0.7123, test_loss: 1.0031, test_f1: 0.5220
 epoch: 97, train_loss: 0.7235, test_loss: 0.9733, test_f1: 0.5190
 epoch: 98, train_loss: 0.6990, test_loss: 0.9657, test_f1: 0.5284
 epoch: 99, train_loss: 0.7055, test_loss: 0.9532, test_f1: 0.5452
##################ITERATION #3 ****************************************
 epoch: 0, train_loss: 1.2885, test_loss: 1.1584, test_f1: 0.3516
 epoch: 1, train_loss: 1.1648, test_loss: 1.0687, test_f1: 0.4177
 epoch: 2, train_loss: 1.1187, test_loss: 1.0173, test_f1: 0.4650
 epoch: 3, train_loss: 1.0706, test_loss: 0.9930, test_f1: 0.4570
 epoch: 4, train_loss: 1.0434, test_loss: 1.0020, test_f1: 0.4525
 epoch: 5, train_loss: 1.0214, test_loss: 0.9917, test_f1: 0.4951
 epoch: 6, train_loss: 0.9994, test_loss: 0.9993, test_f1: 0.4631
 epoch: 7, train_loss: 0.9870, test_loss: 0.9666, test_f1: 0.4939
 epoch: 8, train_loss: 0.9721, test_loss: 0.9909, test_f1: 0.4623
 epoch: 9, train_loss: 0.9640, test_loss: 0.9606, test_f1: 0.4825
 epoch: 10, train_loss: 0.9528, test_loss: 0.9473, test_f1: 0.4984
 epoch: 11, train_loss: 0.9463, test_loss: 0.9402, test_f1: 0.5213
 epoch: 12, train_loss: 0.9433, test_loss: 0.9509, test_f1: 0.5220
 epoch: 13, train_loss: 0.9314, test_loss: 0.9788, test_f1: 0.5004
 epoch: 14, train_loss: 0.9210, test_loss: 0.9273, test_f1: 0.5242
 epoch: 15, train_loss: 0.9133, test_loss: 0.9413, test_f1: 0.5187
 epoch: 16, train_loss: 0.9152, test_loss: 0.9526, test_f1: 0.5129
 epoch: 17, train_loss: 0.9091, test_loss: 0.9113, test_f1: 0.5314
 epoch: 18, train_loss: 0.9089, test_loss: 0.9578, test_f1: 0.5299
 epoch: 19, train_loss: 0.9035, test_loss: 0.9394, test_f1: 0.5312
 epoch: 20, train_loss: 0.8974, test_loss: 0.9306, test_f1: 0.5557
 epoch: 21, train_loss: 0.9062, test_loss: 0.9187, test_f1: 0.5208
 epoch: 22, train_loss: 0.8870, test_loss: 0.8963, test_f1: 0.5330
 epoch: 23, train_loss: 0.8895, test_loss: 0.9082, test_f1: 0.5500
 epoch: 24, train_loss: 0.8847, test_loss: 0.9415, test_f1: 0.5468
 epoch: 25, train_loss: 0.8783, test_loss: 0.9179, test_f1: 0.5191
 epoch: 26, train_loss: 0.8789, test_loss: 0.9198, test_f1: 0.5253
 epoch: 27, train_loss: 0.8729, test_loss: 0.9221, test_f1: 0.5585
 epoch: 28, train_loss: 0.8665, test_loss: 0.9299, test_f1: 0.5332
 epoch: 29, train_loss: 0.8652, test_loss: 0.9246, test_f1: 0.5469
 epoch: 30, train_loss: 0.8568, test_loss: 0.9336, test_f1: 0.5528
 epoch: 31, train_loss: 0.8636, test_loss: 0.9364, test_f1: 0.5108
 epoch: 32, train_loss: 0.8546, test_loss: 0.9074, test_f1: 0.5406
 epoch: 33, train_loss: 0.8562, test_loss: 0.9047, test_f1: 0.5455
 epoch: 34, train_loss: 0.8465, test_loss: 0.9145, test_f1: 0.5448
 epoch: 35, train_loss: 0.8511, test_loss: 0.9404, test_f1: 0.5322
 epoch: 36, train_loss: 0.8509, test_loss: 0.9168, test_f1: 0.5349
 epoch: 37, train_loss: 0.8415, test_loss: 0.9979, test_f1: 0.5081
 epoch: 38, train_loss: 0.8347, test_loss: 0.8985, test_f1: 0.5339
 epoch: 39, train_loss: 0.8441, test_loss: 0.9389, test_f1: 0.5370
 epoch: 40, train_loss: 0.8374, test_loss: 0.8954, test_f1: 0.5393
 epoch: 41, train_loss: 0.8381, test_loss: 0.9478, test_f1: 0.5486
 epoch: 42, train_loss: 0.8456, test_loss: 0.8886, test_f1: 0.5308
 epoch: 43, train_loss: 0.8282, test_loss: 0.9163, test_f1: 0.5556
 epoch: 44, train_loss: 0.8240, test_loss: 0.9186, test_f1: 0.5630
 epoch: 45, train_loss: 0.8191, test_loss: 0.9332, test_f1: 0.5434
 epoch: 46, train_loss: 0.8304, test_loss: 0.9419, test_f1: 0.5499
 epoch: 47, train_loss: 0.8209, test_loss: 0.9072, test_f1: 0.5573
 epoch: 48, train_loss: 0.8183, test_loss: 0.9420, test_f1: 0.5338
 epoch: 49, train_loss: 0.8129, test_loss: 0.9208, test_f1: 0.5421
 epoch: 50, train_loss: 0.8260, test_loss: 0.9039, test_f1: 0.5616
 epoch: 51, train_loss: 0.8020, test_loss: 0.9375, test_f1: 0.5440
 epoch: 52, train_loss: 0.8022, test_loss: 0.9207, test_f1: 0.5368
 epoch: 53, train_loss: 0.8025, test_loss: 0.9228, test_f1: 0.5578
 epoch: 54, train_loss: 0.7924, test_loss: 0.9391, test_f1: 0.5455
 epoch: 55, train_loss: 0.7968, test_loss: 0.9125, test_f1: 0.5723
 epoch: 56, train_loss: 0.8147, test_loss: 0.9064, test_f1: 0.5640
 epoch: 57, train_loss: 0.8069, test_loss: 0.9112, test_f1: 0.5680
 epoch: 58, train_loss: 0.7992, test_loss: 0.9263, test_f1: 0.5648
 epoch: 59, train_loss: 0.7958, test_loss: 0.9139, test_f1: 0.5770
 epoch: 60, train_loss: 0.7994, test_loss: 0.9371, test_f1: 0.5216
 epoch: 61, train_loss: 0.7924, test_loss: 0.9011, test_f1: 0.5660
 epoch: 62, train_loss: 0.7979, test_loss: 0.9012, test_f1: 0.5444
 epoch: 63, train_loss: 0.7853, test_loss: 0.9135, test_f1: 0.5550
 epoch: 64, train_loss: 0.7931, test_loss: 0.9363, test_f1: 0.5562
 epoch: 65, train_loss: 0.7844, test_loss: 0.9237, test_f1: 0.5567
 epoch: 66, train_loss: 0.7920, test_loss: 0.9095, test_f1: 0.5706
 epoch: 67, train_loss: 0.7827, test_loss: 0.9020, test_f1: 0.5748
 epoch: 68, train_loss: 0.7816, test_loss: 0.9313, test_f1: 0.5327
 epoch: 69, train_loss: 0.7852, test_loss: 0.8906, test_f1: 0.5533
 epoch: 70, train_loss: 0.7802, test_loss: 0.9220, test_f1: 0.5499
 epoch: 71, train_loss: 0.7844, test_loss: 0.8997, test_f1: 0.5330
 epoch: 72, train_loss: 0.7742, test_loss: 0.9250, test_f1: 0.5657
 epoch: 73, train_loss: 0.7897, test_loss: 0.9224, test_f1: 0.5429
 epoch: 74, train_loss: 0.7839, test_loss: 0.8955, test_f1: 0.5761
 epoch: 75, train_loss: 0.7799, test_loss: 0.8883, test_f1: 0.5802
 epoch: 76, train_loss: 0.7729, test_loss: 0.8857, test_f1: 0.5764
 epoch: 77, train_loss: 0.7838, test_loss: 0.9083, test_f1: 0.5344
 epoch: 78, train_loss: 0.7670, test_loss: 0.9360, test_f1: 0.5256
 epoch: 79, train_loss: 0.7770, test_loss: 0.9428, test_f1: 0.5355
 epoch: 80, train_loss: 0.7787, test_loss: 0.9383, test_f1: 0.5529
 epoch: 81, train_loss: 0.7778, test_loss: 0.9095, test_f1: 0.5495
 epoch: 82, train_loss: 0.7740, test_loss: 0.9234, test_f1: 0.5543
 epoch: 83, train_loss: 0.7675, test_loss: 0.9004, test_f1: 0.5340
 epoch: 84, train_loss: 0.7806, test_loss: 0.9182, test_f1: 0.5340
 epoch: 85, train_loss: 0.7692, test_loss: 0.9366, test_f1: 0.5389
 epoch: 86, train_loss: 0.7695, test_loss: 0.9506, test_f1: 0.5308
 epoch: 87, train_loss: 0.7685, test_loss: 0.8876, test_f1: 0.5515
 epoch: 88, train_loss: 0.7875, test_loss: 0.9023, test_f1: 0.5354
 epoch: 89, train_loss: 0.7743, test_loss: 0.9040, test_f1: 0.5672
 epoch: 90, train_loss: 0.7657, test_loss: 0.9461, test_f1: 0.5434
 epoch: 91, train_loss: 0.7611, test_loss: 0.9248, test_f1: 0.5253
 epoch: 92, train_loss: 0.7735, test_loss: 0.9519, test_f1: 0.5395
 epoch: 93, train_loss: 0.7668, test_loss: 0.9253, test_f1: 0.5291
 epoch: 94, train_loss: 0.7674, test_loss: 0.9339, test_f1: 0.5371
 epoch: 95, train_loss: 0.7551, test_loss: 0.9589, test_f1: 0.5274
 epoch: 96, train_loss: 0.7551, test_loss: 0.9012, test_f1: 0.5266
 epoch: 97, train_loss: 0.7620, test_loss: 0.9251, test_f1: 0.5254
 epoch: 98, train_loss: 0.7608, test_loss: 0.9039, test_f1: 0.5253
 epoch: 99, train_loss: 0.7618, test_loss: 0.9052, test_f1: 0.5445
##################ITERATION #4 ****************************************
 epoch: 0, train_loss: 1.2247, test_loss: 1.0872, test_f1: 0.3581
 epoch: 1, train_loss: 1.1047, test_loss: 1.0481, test_f1: 0.4070
 epoch: 2, train_loss: 1.0725, test_loss: 1.0186, test_f1: 0.4169
 epoch: 3, train_loss: 1.0447, test_loss: 1.0248, test_f1: 0.4046
 epoch: 4, train_loss: 1.0456, test_loss: 1.0288, test_f1: 0.4306
 epoch: 5, train_loss: 1.0215, test_loss: 1.0117, test_f1: 0.4318
 epoch: 6, train_loss: 1.0104, test_loss: 0.9908, test_f1: 0.4581
 epoch: 7, train_loss: 1.0046, test_loss: 0.9915, test_f1: 0.4704
 epoch: 8, train_loss: 0.9902, test_loss: 0.9831, test_f1: 0.4810
 epoch: 9, train_loss: 0.9798, test_loss: 0.9980, test_f1: 0.4714
 epoch: 10, train_loss: 0.9769, test_loss: 1.0266, test_f1: 0.4396
 epoch: 11, train_loss: 0.9688, test_loss: 0.9862, test_f1: 0.5053
 epoch: 12, train_loss: 0.9573, test_loss: 0.9680, test_f1: 0.4977
 epoch: 13, train_loss: 0.9441, test_loss: 0.9475, test_f1: 0.4973
 epoch: 14, train_loss: 0.9568, test_loss: 0.9671, test_f1: 0.5009
 epoch: 15, train_loss: 0.9416, test_loss: 0.9421, test_f1: 0.5240
 epoch: 16, train_loss: 0.9375, test_loss: 0.9575, test_f1: 0.5071
 epoch: 17, train_loss: 0.9273, test_loss: 0.9517, test_f1: 0.5159
 epoch: 18, train_loss: 0.9402, test_loss: 0.9747, test_f1: 0.4978
 epoch: 19, train_loss: 0.9183, test_loss: 0.9383, test_f1: 0.4965
 epoch: 20, train_loss: 0.9127, test_loss: 1.0049, test_f1: 0.4955
 epoch: 21, train_loss: 0.9178, test_loss: 0.9788, test_f1: 0.5010
 epoch: 22, train_loss: 0.9263, test_loss: 0.9287, test_f1: 0.5191
 epoch: 23, train_loss: 0.9157, test_loss: 1.0173, test_f1: 0.4848
 epoch: 24, train_loss: 0.8975, test_loss: 0.9324, test_f1: 0.5144
 epoch: 25, train_loss: 0.9012, test_loss: 0.9445, test_f1: 0.5027
 epoch: 26, train_loss: 0.9021, test_loss: 0.9891, test_f1: 0.5035
 epoch: 27, train_loss: 0.8921, test_loss: 0.9290, test_f1: 0.5149
 epoch: 28, train_loss: 0.8919, test_loss: 0.9437, test_f1: 0.5225
 epoch: 29, train_loss: 0.8870, test_loss: 0.9552, test_f1: 0.4991
 epoch: 30, train_loss: 0.8813, test_loss: 0.9501, test_f1: 0.4993
 epoch: 31, train_loss: 0.8758, test_loss: 0.9689, test_f1: 0.5067
 epoch: 32, train_loss: 0.8617, test_loss: 0.9361, test_f1: 0.5072
 epoch: 33, train_loss: 0.8743, test_loss: 0.9254, test_f1: 0.5185
 epoch: 34, train_loss: 0.8643, test_loss: 0.9620, test_f1: 0.4995
 epoch: 35, train_loss: 0.8686, test_loss: 0.9199, test_f1: 0.5236
 epoch: 36, train_loss: 0.8635, test_loss: 0.9518, test_f1: 0.5105
 epoch: 37, train_loss: 0.8536, test_loss: 0.9763, test_f1: 0.4710
 epoch: 38, train_loss: 0.8612, test_loss: 0.9501, test_f1: 0.5336
 epoch: 39, train_loss: 0.8472, test_loss: 0.9752, test_f1: 0.4981
 epoch: 40, train_loss: 0.8505, test_loss: 0.9819, test_f1: 0.5067
 epoch: 41, train_loss: 0.8520, test_loss: 0.9560, test_f1: 0.4966
 epoch: 42, train_loss: 0.8506, test_loss: 0.9354, test_f1: 0.5225
 epoch: 43, train_loss: 0.8513, test_loss: 0.9192, test_f1: 0.5178
 epoch: 44, train_loss: 0.8507, test_loss: 0.9220, test_f1: 0.5098
 epoch: 45, train_loss: 0.8397, test_loss: 0.9061, test_f1: 0.5041
 epoch: 46, train_loss: 0.8402, test_loss: 0.9194, test_f1: 0.5289
 epoch: 47, train_loss: 0.8398, test_loss: 0.9075, test_f1: 0.5248
 epoch: 48, train_loss: 0.8388, test_loss: 0.9326, test_f1: 0.5295
 epoch: 49, train_loss: 0.8450, test_loss: 0.9207, test_f1: 0.5179
 epoch: 50, train_loss: 0.8419, test_loss: 0.9008, test_f1: 0.5274
 epoch: 51, train_loss: 0.8279, test_loss: 0.9267, test_f1: 0.5234
 epoch: 52, train_loss: 0.8244, test_loss: 0.9034, test_f1: 0.5195
 epoch: 53, train_loss: 0.8285, test_loss: 0.9644, test_f1: 0.5204
 epoch: 54, train_loss: 0.8240, test_loss: 0.9166, test_f1: 0.5267
 epoch: 55, train_loss: 0.8253, test_loss: 0.9110, test_f1: 0.5321
 epoch: 56, train_loss: 0.8127, test_loss: 0.9098, test_f1: 0.5262
 epoch: 57, train_loss: 0.8149, test_loss: 0.9088, test_f1: 0.5176
 epoch: 58, train_loss: 0.8166, test_loss: 0.9107, test_f1: 0.5236
 epoch: 59, train_loss: 0.8159, test_loss: 0.9102, test_f1: 0.5139
 epoch: 60, train_loss: 0.8208, test_loss: 0.9153, test_f1: 0.5142
 epoch: 61, train_loss: 0.8107, test_loss: 0.9248, test_f1: 0.5088
 epoch: 62, train_loss: 0.8097, test_loss: 0.9122, test_f1: 0.5199
 epoch: 63, train_loss: 0.7990, test_loss: 0.8998, test_f1: 0.5101
 epoch: 64, train_loss: 0.8118, test_loss: 0.9453, test_f1: 0.4953
 epoch: 65, train_loss: 0.7934, test_loss: 0.9101, test_f1: 0.5305
 epoch: 66, train_loss: 0.8136, test_loss: 0.9077, test_f1: 0.5229
 epoch: 67, train_loss: 0.8032, test_loss: 0.9340, test_f1: 0.5217
 epoch: 68, train_loss: 0.7941, test_loss: 0.8988, test_f1: 0.5307
 epoch: 69, train_loss: 0.8068, test_loss: 0.9523, test_f1: 0.5013
 epoch: 70, train_loss: 0.7995, test_loss: 0.9133, test_f1: 0.5387
 epoch: 71, train_loss: 0.7949, test_loss: 0.9162, test_f1: 0.5224
 epoch: 72, train_loss: 0.8101, test_loss: 0.9114, test_f1: 0.5293
 epoch: 73, train_loss: 0.8047, test_loss: 0.9093, test_f1: 0.5304
 epoch: 74, train_loss: 0.8038, test_loss: 0.9341, test_f1: 0.5235
 epoch: 75, train_loss: 0.7933, test_loss: 0.9018, test_f1: 0.5314
 epoch: 76, train_loss: 0.8037, test_loss: 0.9000, test_f1: 0.5228
 epoch: 77, train_loss: 0.7992, test_loss: 0.9369, test_f1: 0.5098
 epoch: 78, train_loss: 0.7866, test_loss: 0.9099, test_f1: 0.5183
 epoch: 79, train_loss: 0.7885, test_loss: 0.8932, test_f1: 0.5272
 epoch: 80, train_loss: 0.7960, test_loss: 0.9048, test_f1: 0.5231
 epoch: 81, train_loss: 0.7926, test_loss: 0.9098, test_f1: 0.5316
 epoch: 82, train_loss: 0.7899, test_loss: 0.9107, test_f1: 0.5349
 epoch: 83, train_loss: 0.7851, test_loss: 0.9126, test_f1: 0.5248
 epoch: 84, train_loss: 0.7878, test_loss: 0.9200, test_f1: 0.5264
 epoch: 85, train_loss: 0.7871, test_loss: 0.9092, test_f1: 0.5143
 epoch: 86, train_loss: 0.7840, test_loss: 0.9022, test_f1: 0.5284
 epoch: 87, train_loss: 0.7848, test_loss: 0.9303, test_f1: 0.5115
 epoch: 88, train_loss: 0.7820, test_loss: 0.9063, test_f1: 0.5203
 epoch: 89, train_loss: 0.7849, test_loss: 0.8974, test_f1: 0.5265
 epoch: 90, train_loss: 0.7822, test_loss: 0.9219, test_f1: 0.5374
 epoch: 91, train_loss: 0.7760, test_loss: 0.9085, test_f1: 0.5366
 epoch: 92, train_loss: 0.7877, test_loss: 0.9113, test_f1: 0.5369
 epoch: 93, train_loss: 0.7758, test_loss: 0.9099, test_f1: 0.5272
 epoch: 94, train_loss: 0.7800, test_loss: 0.8997, test_f1: 0.5301
 epoch: 95, train_loss: 0.7777, test_loss: 0.8966, test_f1: 0.5343
 epoch: 96, train_loss: 0.7851, test_loss: 0.9147, test_f1: 0.5391
 epoch: 97, train_loss: 0.7792, test_loss: 0.9141, test_f1: 0.5315
 epoch: 98, train_loss: 0.7651, test_loss: 0.9130, test_f1: 0.5260
 epoch: 99, train_loss: 0.7707, test_loss: 0.9329, test_f1: 0.5250
##################ITERATION #5 ****************************************
 epoch: 0, train_loss: 1.2392, test_loss: 1.1359, test_f1: 0.3407
 epoch: 1, train_loss: 1.1125, test_loss: 1.1110, test_f1: 0.3398
 epoch: 2, train_loss: 1.0771, test_loss: 1.0701, test_f1: 0.3607
 epoch: 3, train_loss: 1.0544, test_loss: 1.0634, test_f1: 0.3699
 epoch: 4, train_loss: 1.0284, test_loss: 1.0471, test_f1: 0.4197
 epoch: 5, train_loss: 1.0249, test_loss: 1.0281, test_f1: 0.4749
 epoch: 6, train_loss: 1.0094, test_loss: 1.0658, test_f1: 0.4324
 epoch: 7, train_loss: 0.9977, test_loss: 1.0043, test_f1: 0.4901
 epoch: 8, train_loss: 0.9834, test_loss: 1.0325, test_f1: 0.4778
 epoch: 9, train_loss: 0.9848, test_loss: 1.0475, test_f1: 0.4898
 epoch: 10, train_loss: 0.9588, test_loss: 1.0279, test_f1: 0.4912
 epoch: 11, train_loss: 0.9566, test_loss: 1.0356, test_f1: 0.4781
 epoch: 12, train_loss: 0.9505, test_loss: 1.0784, test_f1: 0.4767
 epoch: 13, train_loss: 0.9418, test_loss: 0.9885, test_f1: 0.5172
 epoch: 14, train_loss: 0.9287, test_loss: 1.0325, test_f1: 0.5085
 epoch: 15, train_loss: 0.9246, test_loss: 0.9975, test_f1: 0.5147
 epoch: 16, train_loss: 0.9180, test_loss: 1.0301, test_f1: 0.5107
 epoch: 17, train_loss: 0.9198, test_loss: 1.0118, test_f1: 0.5068
 epoch: 18, train_loss: 0.9163, test_loss: 0.9770, test_f1: 0.5311
 epoch: 19, train_loss: 0.8971, test_loss: 0.9875, test_f1: 0.5211
 epoch: 20, train_loss: 0.8867, test_loss: 1.0167, test_f1: 0.5303
 epoch: 21, train_loss: 0.8976, test_loss: 1.0227, test_f1: 0.5179
 epoch: 22, train_loss: 0.8861, test_loss: 0.9853, test_f1: 0.5195
 epoch: 23, train_loss: 0.8853, test_loss: 0.9972, test_f1: 0.5144
 epoch: 24, train_loss: 0.8823, test_loss: 0.9853, test_f1: 0.5284
 epoch: 25, train_loss: 0.8799, test_loss: 1.0102, test_f1: 0.5233
 epoch: 26, train_loss: 0.8724, test_loss: 0.9515, test_f1: 0.5347
 epoch: 27, train_loss: 0.8702, test_loss: 0.9919, test_f1: 0.5324
 epoch: 28, train_loss: 0.8883, test_loss: 0.9888, test_f1: 0.5414
 epoch: 29, train_loss: 0.8641, test_loss: 1.0180, test_f1: 0.5297
 epoch: 30, train_loss: 0.8536, test_loss: 1.0047, test_f1: 0.5395
 epoch: 31, train_loss: 0.8485, test_loss: 0.9562, test_f1: 0.5502
 epoch: 32, train_loss: 0.8488, test_loss: 1.0157, test_f1: 0.5236
 epoch: 33, train_loss: 0.8410, test_loss: 1.0124, test_f1: 0.5223
 epoch: 34, train_loss: 0.8346, test_loss: 0.9446, test_f1: 0.5575
 epoch: 35, train_loss: 0.8458, test_loss: 0.9536, test_f1: 0.5603
 epoch: 36, train_loss: 0.8417, test_loss: 0.9502, test_f1: 0.5520
 epoch: 37, train_loss: 0.8437, test_loss: 1.0026, test_f1: 0.5192
 epoch: 38, train_loss: 0.8295, test_loss: 0.9355, test_f1: 0.5486
 epoch: 39, train_loss: 0.8273, test_loss: 0.9074, test_f1: 0.5539
 epoch: 40, train_loss: 0.8318, test_loss: 1.0235, test_f1: 0.5206
 epoch: 41, train_loss: 0.8295, test_loss: 0.9183, test_f1: 0.5440
 epoch: 42, train_loss: 0.8350, test_loss: 0.9217, test_f1: 0.5630
 epoch: 43, train_loss: 0.8204, test_loss: 0.9132, test_f1: 0.5582
 epoch: 44, train_loss: 0.8215, test_loss: 0.9011, test_f1: 0.5455
 epoch: 45, train_loss: 0.8155, test_loss: 0.8822, test_f1: 0.5595
 epoch: 46, train_loss: 0.8134, test_loss: 0.9036, test_f1: 0.5528
 epoch: 47, train_loss: 0.8055, test_loss: 0.8901, test_f1: 0.5614
 epoch: 48, train_loss: 0.8223, test_loss: 0.9806, test_f1: 0.5133
 epoch: 49, train_loss: 0.8339, test_loss: 0.9321, test_f1: 0.5453
 epoch: 50, train_loss: 0.8004, test_loss: 0.9342, test_f1: 0.5380
 epoch: 51, train_loss: 0.7954, test_loss: 0.9351, test_f1: 0.5294
 epoch: 52, train_loss: 0.7793, test_loss: 0.9124, test_f1: 0.5400
 epoch: 53, train_loss: 0.7883, test_loss: 0.9294, test_f1: 0.5564
 epoch: 54, train_loss: 0.7868, test_loss: 0.9292, test_f1: 0.5496
 epoch: 55, train_loss: 0.7814, test_loss: 0.8876, test_f1: 0.5530
 epoch: 56, train_loss: 0.7955, test_loss: 0.9193, test_f1: 0.5435
 epoch: 57, train_loss: 0.7878, test_loss: 0.8905, test_f1: 0.5641
 epoch: 58, train_loss: 0.7778, test_loss: 0.8893, test_f1: 0.5544
 epoch: 59, train_loss: 0.7568, test_loss: 0.8927, test_f1: 0.5650
 epoch: 60, train_loss: 0.7749, test_loss: 0.9203, test_f1: 0.5533
 epoch: 61, train_loss: 0.7750, test_loss: 0.8978, test_f1: 0.5708
 epoch: 62, train_loss: 0.7890, test_loss: 0.8825, test_f1: 0.5610
 epoch: 63, train_loss: 0.7670, test_loss: 0.9007, test_f1: 0.5744
 epoch: 64, train_loss: 0.7741, test_loss: 0.8946, test_f1: 0.5664
 epoch: 65, train_loss: 0.7738, test_loss: 0.8709, test_f1: 0.5792
 epoch: 66, train_loss: 0.7774, test_loss: 0.9126, test_f1: 0.5556
 epoch: 67, train_loss: 0.7695, test_loss: 0.8819, test_f1: 0.5711
 epoch: 68, train_loss: 0.7723, test_loss: 0.9116, test_f1: 0.5623
 epoch: 69, train_loss: 0.7784, test_loss: 0.8907, test_f1: 0.5681
 epoch: 70, train_loss: 0.7644, test_loss: 0.8925, test_f1: 0.5501
 epoch: 71, train_loss: 0.7568, test_loss: 0.8996, test_f1: 0.5595
 epoch: 72, train_loss: 0.7725, test_loss: 0.9271, test_f1: 0.5492
 epoch: 73, train_loss: 0.7534, test_loss: 0.9306, test_f1: 0.5488
 epoch: 74, train_loss: 0.7809, test_loss: 0.9345, test_f1: 0.5609
 epoch: 75, train_loss: 0.7491, test_loss: 0.8925, test_f1: 0.5612
 epoch: 76, train_loss: 0.7558, test_loss: 0.8826, test_f1: 0.5625
 epoch: 77, train_loss: 0.7592, test_loss: 0.8788, test_f1: 0.5580
 epoch: 78, train_loss: 0.7577, test_loss: 0.9311, test_f1: 0.5480
 epoch: 79, train_loss: 0.7504, test_loss: 0.8994, test_f1: 0.5565
 epoch: 80, train_loss: 0.7568, test_loss: 0.9206, test_f1: 0.5620
 epoch: 81, train_loss: 0.7478, test_loss: 0.8957, test_f1: 0.5495
 epoch: 82, train_loss: 0.7559, test_loss: 0.9147, test_f1: 0.5614
 epoch: 83, train_loss: 0.7537, test_loss: 0.8977, test_f1: 0.5492
 epoch: 84, train_loss: 0.7600, test_loss: 0.8938, test_f1: 0.5463
 epoch: 85, train_loss: 0.7421, test_loss: 0.9096, test_f1: 0.5519
 epoch: 86, train_loss: 0.7488, test_loss: 0.8851, test_f1: 0.5619
 epoch: 87, train_loss: 0.7590, test_loss: 0.8854, test_f1: 0.5464
 epoch: 88, train_loss: 0.7481, test_loss: 0.9048, test_f1: 0.5424
 epoch: 89, train_loss: 0.7548, test_loss: 0.9210, test_f1: 0.5511
 epoch: 90, train_loss: 0.7378, test_loss: 0.9198, test_f1: 0.5630
 epoch: 91, train_loss: 0.7368, test_loss: 0.9069, test_f1: 0.5567
 epoch: 92, train_loss: 0.7450, test_loss: 0.9335, test_f1: 0.5665
 epoch: 93, train_loss: 0.7481, test_loss: 0.9182, test_f1: 0.5591
 epoch: 94, train_loss: 0.7473, test_loss: 0.9304, test_f1: 0.5603
 epoch: 95, train_loss: 0.7340, test_loss: 0.8739, test_f1: 0.5704
 epoch: 96, train_loss: 0.7445, test_loss: 0.9130, test_f1: 0.5570
 epoch: 97, train_loss: 0.7375, test_loss: 0.9188, test_f1: 0.5567
 epoch: 98, train_loss: 0.7490, test_loss: 0.9471, test_f1: 0.5539
 epoch: 99, train_loss: 0.7201, test_loss: 0.9039, test_f1: 0.5611
##################ITERATION #6 ****************************************
 epoch: 0, train_loss: 1.2663, test_loss: 1.2085, test_f1: 0.2818
 epoch: 1, train_loss: 1.0795, test_loss: 1.0202, test_f1: 0.4996
 epoch: 2, train_loss: 1.0530, test_loss: 0.9845, test_f1: 0.4951
 epoch: 3, train_loss: 1.0238, test_loss: 1.0012, test_f1: 0.4973
 epoch: 4, train_loss: 0.9918, test_loss: 0.9990, test_f1: 0.4872
 epoch: 5, train_loss: 0.9843, test_loss: 0.9774, test_f1: 0.4945
 epoch: 6, train_loss: 0.9711, test_loss: 0.9617, test_f1: 0.5090
 epoch: 7, train_loss: 0.9529, test_loss: 1.0038, test_f1: 0.4586
 epoch: 8, train_loss: 0.9430, test_loss: 0.9571, test_f1: 0.4869
 epoch: 9, train_loss: 0.9454, test_loss: 0.9613, test_f1: 0.4985
 epoch: 10, train_loss: 0.9220, test_loss: 0.9563, test_f1: 0.5062
 epoch: 11, train_loss: 0.9315, test_loss: 0.9817, test_f1: 0.4815
 epoch: 12, train_loss: 0.9201, test_loss: 0.9662, test_f1: 0.4748
 epoch: 13, train_loss: 0.9105, test_loss: 1.0581, test_f1: 0.4502
 epoch: 14, train_loss: 0.9038, test_loss: 0.9734, test_f1: 0.4914
 epoch: 15, train_loss: 0.8954, test_loss: 0.9578, test_f1: 0.4720
 epoch: 16, train_loss: 0.8708, test_loss: 0.9393, test_f1: 0.5088
 epoch: 17, train_loss: 0.8946, test_loss: 1.0265, test_f1: 0.4807
 epoch: 18, train_loss: 0.8816, test_loss: 0.9714, test_f1: 0.4776
 epoch: 19, train_loss: 0.8862, test_loss: 1.0122, test_f1: 0.4988
 epoch: 20, train_loss: 0.8808, test_loss: 0.9391, test_f1: 0.5170
 epoch: 21, train_loss: 0.8666, test_loss: 0.9905, test_f1: 0.4585
 epoch: 22, train_loss: 0.8555, test_loss: 0.9318, test_f1: 0.4971
 epoch: 23, train_loss: 0.8527, test_loss: 0.9117, test_f1: 0.5223
 epoch: 24, train_loss: 0.8549, test_loss: 0.9635, test_f1: 0.5048
 epoch: 25, train_loss: 0.8661, test_loss: 0.9657, test_f1: 0.4851
 epoch: 26, train_loss: 0.8535, test_loss: 0.9702, test_f1: 0.4854
 epoch: 27, train_loss: 0.8679, test_loss: 0.9211, test_f1: 0.5137
 epoch: 28, train_loss: 0.8460, test_loss: 0.9554, test_f1: 0.4909
 epoch: 29, train_loss: 0.8382, test_loss: 0.9253, test_f1: 0.5031
 epoch: 30, train_loss: 0.8358, test_loss: 0.9137, test_f1: 0.5238
 epoch: 31, train_loss: 0.8295, test_loss: 0.9514, test_f1: 0.4872
 epoch: 32, train_loss: 0.8260, test_loss: 1.0293, test_f1: 0.4714
 epoch: 33, train_loss: 0.8177, test_loss: 0.9081, test_f1: 0.5140
 epoch: 34, train_loss: 0.8268, test_loss: 0.9164, test_f1: 0.5108
 epoch: 35, train_loss: 0.8128, test_loss: 0.9104, test_f1: 0.5197
 epoch: 36, train_loss: 0.8211, test_loss: 0.9103, test_f1: 0.5294
 epoch: 37, train_loss: 0.8195, test_loss: 0.8921, test_f1: 0.5338
 epoch: 38, train_loss: 0.8124, test_loss: 0.9340, test_f1: 0.5303
 epoch: 39, train_loss: 0.8082, test_loss: 0.9328, test_f1: 0.5326
 epoch: 40, train_loss: 0.8012, test_loss: 0.9006, test_f1: 0.5332
 epoch: 41, train_loss: 0.7998, test_loss: 0.8981, test_f1: 0.5355
 epoch: 42, train_loss: 0.7948, test_loss: 0.9683, test_f1: 0.4918
 epoch: 43, train_loss: 0.7942, test_loss: 0.8953, test_f1: 0.5443
 epoch: 44, train_loss: 0.8144, test_loss: 0.9948, test_f1: 0.4917
 epoch: 45, train_loss: 0.7804, test_loss: 0.8972, test_f1: 0.5377
 epoch: 46, train_loss: 0.7865, test_loss: 0.9348, test_f1: 0.5162
 epoch: 47, train_loss: 0.7803, test_loss: 0.9110, test_f1: 0.5237
 epoch: 48, train_loss: 0.7914, test_loss: 0.8778, test_f1: 0.5700
 epoch: 49, train_loss: 0.7850, test_loss: 0.9122, test_f1: 0.5491
 epoch: 50, train_loss: 0.7823, test_loss: 0.9005, test_f1: 0.5470
 epoch: 51, train_loss: 0.7752, test_loss: 0.8990, test_f1: 0.5664
 epoch: 52, train_loss: 0.7656, test_loss: 0.9140, test_f1: 0.5327
 epoch: 53, train_loss: 0.7711, test_loss: 0.9020, test_f1: 0.5398
 epoch: 54, train_loss: 0.7596, test_loss: 0.9052, test_f1: 0.5436
 epoch: 55, train_loss: 0.7679, test_loss: 0.9155, test_f1: 0.5512
 epoch: 56, train_loss: 0.7525, test_loss: 0.9172, test_f1: 0.5399
 epoch: 57, train_loss: 0.7594, test_loss: 0.8891, test_f1: 0.5556
 epoch: 58, train_loss: 0.7597, test_loss: 0.9124, test_f1: 0.5235
 epoch: 59, train_loss: 0.7412, test_loss: 0.8996, test_f1: 0.5375
 epoch: 60, train_loss: 0.7577, test_loss: 0.9036, test_f1: 0.5629
 epoch: 61, train_loss: 0.7417, test_loss: 0.9328, test_f1: 0.5373
 epoch: 62, train_loss: 0.7494, test_loss: 0.9007, test_f1: 0.5586
 epoch: 63, train_loss: 0.7536, test_loss: 0.9032, test_f1: 0.5763
 epoch: 64, train_loss: 0.7465, test_loss: 0.9283, test_f1: 0.5638
 epoch: 65, train_loss: 0.7597, test_loss: 0.8835, test_f1: 0.5713
 epoch: 66, train_loss: 0.7421, test_loss: 0.9032, test_f1: 0.5568
 epoch: 67, train_loss: 0.7605, test_loss: 0.9357, test_f1: 0.5352
 epoch: 68, train_loss: 0.7473, test_loss: 0.9131, test_f1: 0.5728
 epoch: 69, train_loss: 0.7396, test_loss: 0.8819, test_f1: 0.5611
 epoch: 70, train_loss: 0.7483, test_loss: 0.9183, test_f1: 0.5605
 epoch: 71, train_loss: 0.7451, test_loss: 0.9270, test_f1: 0.5496
 epoch: 72, train_loss: 0.7292, test_loss: 0.8986, test_f1: 0.5495
 epoch: 73, train_loss: 0.7441, test_loss: 0.9428, test_f1: 0.5439
 epoch: 74, train_loss: 0.7448, test_loss: 0.9231, test_f1: 0.5525
 epoch: 75, train_loss: 0.7359, test_loss: 0.8997, test_f1: 0.5528
 epoch: 76, train_loss: 0.7283, test_loss: 0.8994, test_f1: 0.5813
 epoch: 77, train_loss: 0.7407, test_loss: 0.9501, test_f1: 0.5407
 epoch: 78, train_loss: 0.7295, test_loss: 0.9077, test_f1: 0.5773
 epoch: 79, train_loss: 0.7235, test_loss: 0.9160, test_f1: 0.5681
 epoch: 80, train_loss: 0.7430, test_loss: 0.9160, test_f1: 0.5573
 epoch: 81, train_loss: 0.7153, test_loss: 0.9311, test_f1: 0.5693
 epoch: 82, train_loss: 0.7174, test_loss: 0.9142, test_f1: 0.5544
 epoch: 83, train_loss: 0.7308, test_loss: 0.9172, test_f1: 0.5745
 epoch: 84, train_loss: 0.7239, test_loss: 0.8974, test_f1: 0.5669
 epoch: 85, train_loss: 0.7262, test_loss: 0.9101, test_f1: 0.5606
 epoch: 86, train_loss: 0.7295, test_loss: 0.9006, test_f1: 0.5740
 epoch: 87, train_loss: 0.7179, test_loss: 0.9187, test_f1: 0.5493
 epoch: 88, train_loss: 0.7261, test_loss: 0.9367, test_f1: 0.5535
 epoch: 89, train_loss: 0.7357, test_loss: 0.9019, test_f1: 0.5830
 epoch: 90, train_loss: 0.7237, test_loss: 0.9180, test_f1: 0.5678
 epoch: 91, train_loss: 0.7216, test_loss: 0.9099, test_f1: 0.5736
 epoch: 92, train_loss: 0.7311, test_loss: 0.9364, test_f1: 0.5637
 epoch: 93, train_loss: 0.7199, test_loss: 0.9231, test_f1: 0.5655
 epoch: 94, train_loss: 0.7159, test_loss: 0.9369, test_f1: 0.5656
 epoch: 95, train_loss: 0.7187, test_loss: 0.9258, test_f1: 0.5610
 epoch: 96, train_loss: 0.7192, test_loss: 0.9257, test_f1: 0.5674
 epoch: 97, train_loss: 0.7328, test_loss: 0.9230, test_f1: 0.5580
 epoch: 98, train_loss: 0.7250, test_loss: 0.9012, test_f1: 0.5557
 epoch: 99, train_loss: 0.7172, test_loss: 0.9048, test_f1: 0.5721
##################ITERATION #7 ****************************************
 epoch: 0, train_loss: 1.2609, test_loss: 1.3158, test_f1: 0.2508
 epoch: 1, train_loss: 1.1221, test_loss: 1.0456, test_f1: 0.4240
 epoch: 2, train_loss: 1.0889, test_loss: 1.0279, test_f1: 0.4089
 epoch: 3, train_loss: 1.0610, test_loss: 1.0176, test_f1: 0.4204
 epoch: 4, train_loss: 1.0365, test_loss: 1.0059, test_f1: 0.4480
 epoch: 5, train_loss: 1.0316, test_loss: 1.0039, test_f1: 0.4598
 epoch: 6, train_loss: 1.0186, test_loss: 0.9971, test_f1: 0.4792
 epoch: 7, train_loss: 1.0000, test_loss: 0.9941, test_f1: 0.4637
 epoch: 8, train_loss: 0.9990, test_loss: 1.0031, test_f1: 0.4999
 epoch: 9, train_loss: 0.9870, test_loss: 0.9949, test_f1: 0.4599
 epoch: 10, train_loss: 0.9789, test_loss: 0.9921, test_f1: 0.4960
 epoch: 11, train_loss: 0.9682, test_loss: 1.0053, test_f1: 0.4833
 epoch: 12, train_loss: 0.9583, test_loss: 0.9902, test_f1: 0.4994
 epoch: 13, train_loss: 0.9501, test_loss: 0.9773, test_f1: 0.5220
 epoch: 14, train_loss: 0.9458, test_loss: 0.9756, test_f1: 0.5156
 epoch: 15, train_loss: 0.9390, test_loss: 0.9644, test_f1: 0.5214
 epoch: 16, train_loss: 0.9299, test_loss: 0.9622, test_f1: 0.5217
 epoch: 17, train_loss: 0.9255, test_loss: 0.9795, test_f1: 0.5237
 epoch: 18, train_loss: 0.9290, test_loss: 0.9777, test_f1: 0.5372
 epoch: 19, train_loss: 0.9120, test_loss: 0.9622, test_f1: 0.5464
 epoch: 20, train_loss: 0.9208, test_loss: 0.9705, test_f1: 0.5228
 epoch: 21, train_loss: 0.9088, test_loss: 0.9682, test_f1: 0.5398
 epoch: 22, train_loss: 0.8988, test_loss: 0.9464, test_f1: 0.5432
 epoch: 23, train_loss: 0.8943, test_loss: 0.9341, test_f1: 0.5692
 epoch: 24, train_loss: 0.8963, test_loss: 0.9488, test_f1: 0.5591
 epoch: 25, train_loss: 0.8882, test_loss: 0.9627, test_f1: 0.5150
 epoch: 26, train_loss: 0.8721, test_loss: 0.9319, test_f1: 0.5486
 epoch: 27, train_loss: 0.8716, test_loss: 0.9219, test_f1: 0.5542
 epoch: 28, train_loss: 0.8738, test_loss: 0.9022, test_f1: 0.5598
 epoch: 29, train_loss: 0.8718, test_loss: 0.8877, test_f1: 0.5624
 epoch: 30, train_loss: 0.8654, test_loss: 0.8934, test_f1: 0.5636
 epoch: 31, train_loss: 0.8652, test_loss: 0.8932, test_f1: 0.5454
 epoch: 32, train_loss: 0.8586, test_loss: 0.8841, test_f1: 0.5589
 epoch: 33, train_loss: 0.8441, test_loss: 0.8955, test_f1: 0.5595
 epoch: 34, train_loss: 0.8367, test_loss: 0.9090, test_f1: 0.5632
 epoch: 35, train_loss: 0.8329, test_loss: 0.8684, test_f1: 0.5401
 epoch: 36, train_loss: 0.8274, test_loss: 0.8647, test_f1: 0.5435
 epoch: 37, train_loss: 0.8338, test_loss: 0.8788, test_f1: 0.5410
 epoch: 38, train_loss: 0.8260, test_loss: 0.8967, test_f1: 0.5414
 epoch: 39, train_loss: 0.8309, test_loss: 0.8755, test_f1: 0.5523
 epoch: 40, train_loss: 0.8199, test_loss: 0.9055, test_f1: 0.5348
 epoch: 41, train_loss: 0.8218, test_loss: 0.8723, test_f1: 0.5749
 epoch: 42, train_loss: 0.8212, test_loss: 0.9323, test_f1: 0.5463
 epoch: 43, train_loss: 0.8023, test_loss: 0.8738, test_f1: 0.5683
 epoch: 44, train_loss: 0.8157, test_loss: 0.8698, test_f1: 0.5604
 epoch: 45, train_loss: 0.8079, test_loss: 0.9139, test_f1: 0.5500
 epoch: 46, train_loss: 0.8123, test_loss: 0.8594, test_f1: 0.5502
 epoch: 47, train_loss: 0.8050, test_loss: 0.8644, test_f1: 0.5472
 epoch: 48, train_loss: 0.7976, test_loss: 0.8557, test_f1: 0.5849
 epoch: 49, train_loss: 0.7945, test_loss: 0.8638, test_f1: 0.5583
 epoch: 50, train_loss: 0.7946, test_loss: 0.9204, test_f1: 0.5248
 epoch: 51, train_loss: 0.7795, test_loss: 0.8781, test_f1: 0.5459
 epoch: 52, train_loss: 0.7867, test_loss: 0.8897, test_f1: 0.5619
 epoch: 53, train_loss: 0.7870, test_loss: 0.8845, test_f1: 0.5620
 epoch: 54, train_loss: 0.7771, test_loss: 0.8681, test_f1: 0.5577
 epoch: 55, train_loss: 0.7818, test_loss: 0.8742, test_f1: 0.5749
 epoch: 56, train_loss: 0.7668, test_loss: 0.8821, test_f1: 0.5708
 epoch: 57, train_loss: 0.7819, test_loss: 0.8701, test_f1: 0.5759
 epoch: 58, train_loss: 0.7759, test_loss: 0.8682, test_f1: 0.5490
 epoch: 59, train_loss: 0.7841, test_loss: 0.8839, test_f1: 0.5498
 epoch: 60, train_loss: 0.7673, test_loss: 0.8909, test_f1: 0.5541
 epoch: 61, train_loss: 0.7769, test_loss: 0.8710, test_f1: 0.5424
 epoch: 62, train_loss: 0.7766, test_loss: 0.8927, test_f1: 0.5476
 epoch: 63, train_loss: 0.7806, test_loss: 0.8936, test_f1: 0.5355
 epoch: 64, train_loss: 0.7689, test_loss: 0.8704, test_f1: 0.5454
 epoch: 65, train_loss: 0.7715, test_loss: 0.8745, test_f1: 0.5553
 epoch: 66, train_loss: 0.7717, test_loss: 0.8598, test_f1: 0.5507
 epoch: 67, train_loss: 0.7675, test_loss: 0.8602, test_f1: 0.5595
 epoch: 68, train_loss: 0.7603, test_loss: 0.8676, test_f1: 0.5507
 epoch: 69, train_loss: 0.7786, test_loss: 0.9991, test_f1: 0.5117
 epoch: 70, train_loss: 0.7486, test_loss: 0.8788, test_f1: 0.5365
 epoch: 71, train_loss: 0.7716, test_loss: 0.8724, test_f1: 0.5642
 epoch: 72, train_loss: 0.7575, test_loss: 0.8635, test_f1: 0.5732
 epoch: 73, train_loss: 0.7587, test_loss: 0.8746, test_f1: 0.5595
 epoch: 74, train_loss: 0.7466, test_loss: 0.8763, test_f1: 0.5391
 epoch: 75, train_loss: 0.7687, test_loss: 0.9208, test_f1: 0.5185
 epoch: 76, train_loss: 0.7525, test_loss: 0.8705, test_f1: 0.5496
 epoch: 77, train_loss: 0.7556, test_loss: 0.8863, test_f1: 0.5455
 epoch: 78, train_loss: 0.7473, test_loss: 0.8708, test_f1: 0.5455
 epoch: 79, train_loss: 0.7518, test_loss: 0.9000, test_f1: 0.5438
 epoch: 80, train_loss: 0.7583, test_loss: 0.8893, test_f1: 0.5435
 epoch: 81, train_loss: 0.7482, test_loss: 0.8619, test_f1: 0.5550
 epoch: 82, train_loss: 0.7582, test_loss: 0.8840, test_f1: 0.5444
 epoch: 83, train_loss: 0.7499, test_loss: 0.8720, test_f1: 0.5646
 epoch: 84, train_loss: 0.7514, test_loss: 0.8931, test_f1: 0.5631
 epoch: 85, train_loss: 0.7536, test_loss: 0.8684, test_f1: 0.5694
 epoch: 86, train_loss: 0.7412, test_loss: 0.8785, test_f1: 0.5594
 epoch: 87, train_loss: 0.7433, test_loss: 0.8871, test_f1: 0.5534
 epoch: 88, train_loss: 0.7422, test_loss: 0.8613, test_f1: 0.5616
 epoch: 89, train_loss: 0.7536, test_loss: 0.8732, test_f1: 0.5606
 epoch: 90, train_loss: 0.7440, test_loss: 0.8810, test_f1: 0.5657
 epoch: 91, train_loss: 0.7457, test_loss: 0.8692, test_f1: 0.5544
 epoch: 92, train_loss: 0.7423, test_loss: 0.8958, test_f1: 0.5520
 epoch: 93, train_loss: 0.7361, test_loss: 0.8930, test_f1: 0.5574
 epoch: 94, train_loss: 0.7355, test_loss: 0.8841, test_f1: 0.5567
 epoch: 95, train_loss: 0.7441, test_loss: 0.8634, test_f1: 0.5530
 epoch: 96, train_loss: 0.7445, test_loss: 0.9181, test_f1: 0.5474
 epoch: 97, train_loss: 0.7412, test_loss: 0.8790, test_f1: 0.5520
 epoch: 98, train_loss: 0.7418, test_loss: 0.8729, test_f1: 0.5645
 epoch: 99, train_loss: 0.7436, test_loss: 0.8688, test_f1: 0.5472
##################ITERATION #8 ****************************************
 epoch: 0, train_loss: 1.2893, test_loss: 1.2270, test_f1: 0.2751
 epoch: 1, train_loss: 1.1239, test_loss: 1.0525, test_f1: 0.3895
 epoch: 2, train_loss: 1.0995, test_loss: 0.9985, test_f1: 0.4624
 epoch: 3, train_loss: 1.0837, test_loss: 1.0012, test_f1: 0.4736
 epoch: 4, train_loss: 1.0668, test_loss: 0.9904, test_f1: 0.4773
 epoch: 5, train_loss: 1.0424, test_loss: 0.9795, test_f1: 0.4958
 epoch: 6, train_loss: 1.0365, test_loss: 1.0042, test_f1: 0.4705
 epoch: 7, train_loss: 1.0056, test_loss: 0.9945, test_f1: 0.4839
 epoch: 8, train_loss: 1.0047, test_loss: 0.9939, test_f1: 0.4867
 epoch: 9, train_loss: 0.9966, test_loss: 1.0001, test_f1: 0.5108
 epoch: 10, train_loss: 0.9891, test_loss: 0.9885, test_f1: 0.5206
 epoch: 11, train_loss: 0.9820, test_loss: 0.9797, test_f1: 0.4901
 epoch: 12, train_loss: 0.9742, test_loss: 0.9838, test_f1: 0.5031
 epoch: 13, train_loss: 0.9693, test_loss: 0.9652, test_f1: 0.4985
 epoch: 14, train_loss: 0.9580, test_loss: 0.9782, test_f1: 0.4860
 epoch: 15, train_loss: 0.9569, test_loss: 0.9801, test_f1: 0.5062
 epoch: 16, train_loss: 0.9459, test_loss: 0.9578, test_f1: 0.5039
 epoch: 17, train_loss: 0.9397, test_loss: 0.9706, test_f1: 0.4870
 epoch: 18, train_loss: 0.9379, test_loss: 0.9844, test_f1: 0.5056
 epoch: 19, train_loss: 0.9338, test_loss: 0.9518, test_f1: 0.5417
 epoch: 20, train_loss: 0.9259, test_loss: 0.9195, test_f1: 0.5105
 epoch: 21, train_loss: 0.9228, test_loss: 0.9528, test_f1: 0.5123
 epoch: 22, train_loss: 0.9257, test_loss: 0.9786, test_f1: 0.5080
 epoch: 23, train_loss: 0.9170, test_loss: 0.9574, test_f1: 0.5221
 epoch: 24, train_loss: 0.9062, test_loss: 0.9528, test_f1: 0.5039
 epoch: 25, train_loss: 0.9069, test_loss: 0.9985, test_f1: 0.5111
 epoch: 26, train_loss: 0.9004, test_loss: 0.9427, test_f1: 0.5191
 epoch: 27, train_loss: 0.8975, test_loss: 0.9283, test_f1: 0.5270
 epoch: 28, train_loss: 0.8982, test_loss: 0.9698, test_f1: 0.4959
 epoch: 29, train_loss: 0.8927, test_loss: 0.9315, test_f1: 0.5153
 epoch: 30, train_loss: 0.8836, test_loss: 0.9489, test_f1: 0.5176
 epoch: 31, train_loss: 0.8912, test_loss: 0.9390, test_f1: 0.5220
 epoch: 32, train_loss: 0.8917, test_loss: 0.9384, test_f1: 0.5100
 epoch: 33, train_loss: 0.8847, test_loss: 0.9195, test_f1: 0.5311
 epoch: 34, train_loss: 0.8843, test_loss: 0.9207, test_f1: 0.5170
 epoch: 35, train_loss: 0.8838, test_loss: 0.9378, test_f1: 0.5173
 epoch: 36, train_loss: 0.8822, test_loss: 0.9384, test_f1: 0.5421
 epoch: 37, train_loss: 0.8866, test_loss: 0.9455, test_f1: 0.4975
 epoch: 38, train_loss: 0.8750, test_loss: 0.9434, test_f1: 0.5098
 epoch: 39, train_loss: 0.8742, test_loss: 0.9461, test_f1: 0.4991
 epoch: 40, train_loss: 0.8664, test_loss: 0.9236, test_f1: 0.5206
 epoch: 41, train_loss: 0.8627, test_loss: 0.9170, test_f1: 0.5327
 epoch: 42, train_loss: 0.8601, test_loss: 0.9047, test_f1: 0.5212
 epoch: 43, train_loss: 0.8644, test_loss: 0.9174, test_f1: 0.5317
 epoch: 44, train_loss: 0.8640, test_loss: 0.9197, test_f1: 0.5430
 epoch: 45, train_loss: 0.8590, test_loss: 0.9039, test_f1: 0.5289
 epoch: 46, train_loss: 0.8594, test_loss: 0.9137, test_f1: 0.5315
 epoch: 47, train_loss: 0.8513, test_loss: 0.9113, test_f1: 0.5248
 epoch: 48, train_loss: 0.8450, test_loss: 0.9258, test_f1: 0.5264
 epoch: 49, train_loss: 0.8446, test_loss: 0.8964, test_f1: 0.5434
 epoch: 50, train_loss: 0.8411, test_loss: 0.9184, test_f1: 0.5194
 epoch: 51, train_loss: 0.8353, test_loss: 0.9215, test_f1: 0.5249
 epoch: 52, train_loss: 0.8193, test_loss: 0.8973, test_f1: 0.5406
 epoch: 53, train_loss: 0.8246, test_loss: 0.9088, test_f1: 0.5228
 epoch: 54, train_loss: 0.8389, test_loss: 0.9159, test_f1: 0.5436
 epoch: 55, train_loss: 0.8288, test_loss: 0.9358, test_f1: 0.5121
 epoch: 56, train_loss: 0.8229, test_loss: 0.9076, test_f1: 0.5282
 epoch: 57, train_loss: 0.8224, test_loss: 0.9124, test_f1: 0.5383
 epoch: 58, train_loss: 0.8139, test_loss: 0.9003, test_f1: 0.5247
 epoch: 59, train_loss: 0.8157, test_loss: 0.8898, test_f1: 0.5401
 epoch: 60, train_loss: 0.8100, test_loss: 0.9152, test_f1: 0.5243
 epoch: 61, train_loss: 0.8206, test_loss: 0.9087, test_f1: 0.5325
 epoch: 62, train_loss: 0.8175, test_loss: 0.9058, test_f1: 0.5368
 epoch: 63, train_loss: 0.8162, test_loss: 0.9009, test_f1: 0.5320
 epoch: 64, train_loss: 0.8111, test_loss: 0.8916, test_f1: 0.5337
 epoch: 65, train_loss: 0.8201, test_loss: 0.9091, test_f1: 0.5190
 epoch: 66, train_loss: 0.8121, test_loss: 0.8932, test_f1: 0.5382
 epoch: 67, train_loss: 0.8222, test_loss: 0.8750, test_f1: 0.5442
 epoch: 68, train_loss: 0.7993, test_loss: 0.9193, test_f1: 0.5246
 epoch: 69, train_loss: 0.8229, test_loss: 0.8949, test_f1: 0.5383
 epoch: 70, train_loss: 0.8175, test_loss: 0.8986, test_f1: 0.5227
 epoch: 71, train_loss: 0.8044, test_loss: 0.8949, test_f1: 0.5448
 epoch: 72, train_loss: 0.8039, test_loss: 0.8994, test_f1: 0.5287
 epoch: 73, train_loss: 0.8013, test_loss: 0.8984, test_f1: 0.5273
 epoch: 74, train_loss: 0.8046, test_loss: 0.8991, test_f1: 0.5171
 epoch: 75, train_loss: 0.8045, test_loss: 0.8914, test_f1: 0.5372
 epoch: 76, train_loss: 0.8013, test_loss: 0.8993, test_f1: 0.5493
 epoch: 77, train_loss: 0.8073, test_loss: 0.8915, test_f1: 0.5450
 epoch: 78, train_loss: 0.7920, test_loss: 0.9055, test_f1: 0.5252
 epoch: 79, train_loss: 0.7953, test_loss: 0.8989, test_f1: 0.5213
 epoch: 80, train_loss: 0.7985, test_loss: 0.8833, test_f1: 0.5527
 epoch: 81, train_loss: 0.7883, test_loss: 0.9022, test_f1: 0.5450
 epoch: 82, train_loss: 0.7899, test_loss: 0.9224, test_f1: 0.5244
 epoch: 83, train_loss: 0.7968, test_loss: 0.9080, test_f1: 0.5376
 epoch: 84, train_loss: 0.7957, test_loss: 0.8842, test_f1: 0.5423
 epoch: 85, train_loss: 0.8060, test_loss: 0.8849, test_f1: 0.5192
 epoch: 86, train_loss: 0.8028, test_loss: 0.9001, test_f1: 0.5335
 epoch: 87, train_loss: 0.7948, test_loss: 0.9014, test_f1: 0.5593
 epoch: 88, train_loss: 0.7903, test_loss: 0.9097, test_f1: 0.5235
 epoch: 89, train_loss: 0.7945, test_loss: 0.9127, test_f1: 0.5404
 epoch: 90, train_loss: 0.7866, test_loss: 0.9009, test_f1: 0.5482
 epoch: 91, train_loss: 0.7860, test_loss: 0.8794, test_f1: 0.5551
 epoch: 92, train_loss: 0.7867, test_loss: 0.8931, test_f1: 0.5407
 epoch: 93, train_loss: 0.7939, test_loss: 0.9181, test_f1: 0.5264
 epoch: 94, train_loss: 0.7871, test_loss: 0.8947, test_f1: 0.5353
 epoch: 95, train_loss: 0.7930, test_loss: 0.8924, test_f1: 0.5357
 epoch: 96, train_loss: 0.7836, test_loss: 0.8672, test_f1: 0.5671
 epoch: 97, train_loss: 0.7796, test_loss: 0.8927, test_f1: 0.5395
 epoch: 98, train_loss: 0.7941, test_loss: 0.9025, test_f1: 0.5235
 epoch: 99, train_loss: 0.7773, test_loss: 0.9012, test_f1: 0.5263
##################ITERATION #9 ****************************************
 epoch: 0, train_loss: 1.4678, test_loss: 1.2261, test_f1: 0.2752
 epoch: 1, train_loss: 1.1687, test_loss: 1.0901, test_f1: 0.3987
 epoch: 2, train_loss: 1.1022, test_loss: 1.0655, test_f1: 0.3922
 epoch: 3, train_loss: 1.0706, test_loss: 1.0520, test_f1: 0.3955
 epoch: 4, train_loss: 1.0298, test_loss: 1.0292, test_f1: 0.4036
 epoch: 5, train_loss: 1.0180, test_loss: 1.0434, test_f1: 0.3824
 epoch: 6, train_loss: 1.0067, test_loss: 1.0289, test_f1: 0.4482
 epoch: 7, train_loss: 0.9854, test_loss: 1.0029, test_f1: 0.4540
 epoch: 8, train_loss: 0.9712, test_loss: 0.9866, test_f1: 0.4600
 epoch: 9, train_loss: 0.9513, test_loss: 1.0308, test_f1: 0.4449
 epoch: 10, train_loss: 0.9491, test_loss: 0.9664, test_f1: 0.5098
 epoch: 11, train_loss: 0.9439, test_loss: 0.9683, test_f1: 0.4880
 epoch: 12, train_loss: 0.9440, test_loss: 1.0176, test_f1: 0.4599
 epoch: 13, train_loss: 0.9303, test_loss: 0.9444, test_f1: 0.4824
 epoch: 14, train_loss: 0.9219, test_loss: 0.9546, test_f1: 0.4985
 epoch: 15, train_loss: 0.9273, test_loss: 0.9604, test_f1: 0.4888
 epoch: 16, train_loss: 0.9220, test_loss: 0.9598, test_f1: 0.5180
 epoch: 17, train_loss: 0.9059, test_loss: 0.9521, test_f1: 0.4843
 epoch: 18, train_loss: 0.9157, test_loss: 0.9390, test_f1: 0.4933
 epoch: 19, train_loss: 0.9012, test_loss: 0.9067, test_f1: 0.5090
 epoch: 20, train_loss: 0.9013, test_loss: 0.9559, test_f1: 0.4833
 epoch: 21, train_loss: 0.9008, test_loss: 0.9157, test_f1: 0.4931
 epoch: 22, train_loss: 0.8843, test_loss: 0.9594, test_f1: 0.5089
 epoch: 23, train_loss: 0.8833, test_loss: 0.9295, test_f1: 0.5035
 epoch: 24, train_loss: 0.8842, test_loss: 0.9224, test_f1: 0.5001
 epoch: 25, train_loss: 0.8724, test_loss: 0.9002, test_f1: 0.5260
 epoch: 26, train_loss: 0.8770, test_loss: 0.8947, test_f1: 0.5334
 epoch: 27, train_loss: 0.8664, test_loss: 1.0176, test_f1: 0.4634
 epoch: 28, train_loss: 0.8645, test_loss: 0.9337, test_f1: 0.4881
 epoch: 29, train_loss: 0.8525, test_loss: 0.8502, test_f1: 0.5354
 epoch: 30, train_loss: 0.8542, test_loss: 0.9063, test_f1: 0.5318
 epoch: 31, train_loss: 0.8492, test_loss: 0.8612, test_f1: 0.5369
 epoch: 32, train_loss: 0.8462, test_loss: 0.9115, test_f1: 0.5057
 epoch: 33, train_loss: 0.8457, test_loss: 0.8936, test_f1: 0.5264
 epoch: 34, train_loss: 0.8433, test_loss: 0.8600, test_f1: 0.5394
 epoch: 35, train_loss: 0.8286, test_loss: 0.8738, test_f1: 0.5284
 epoch: 36, train_loss: 0.8269, test_loss: 0.8815, test_f1: 0.5263
 epoch: 37, train_loss: 0.8427, test_loss: 0.9017, test_f1: 0.5172
 epoch: 38, train_loss: 0.8160, test_loss: 0.8963, test_f1: 0.5131
 epoch: 39, train_loss: 0.8110, test_loss: 0.8694, test_f1: 0.5381
 epoch: 40, train_loss: 0.8166, test_loss: 0.8538, test_f1: 0.5394
 epoch: 41, train_loss: 0.8265, test_loss: 0.8469, test_f1: 0.5494
 epoch: 42, train_loss: 0.8204, test_loss: 0.8730, test_f1: 0.5473
 epoch: 43, train_loss: 0.8164, test_loss: 0.8762, test_f1: 0.5353
 epoch: 44, train_loss: 0.8005, test_loss: 0.8231, test_f1: 0.5381
 epoch: 45, train_loss: 0.8038, test_loss: 0.8619, test_f1: 0.5544
 epoch: 46, train_loss: 0.8117, test_loss: 0.8470, test_f1: 0.5317
 epoch: 47, train_loss: 0.8123, test_loss: 0.8840, test_f1: 0.5448
 epoch: 48, train_loss: 0.7830, test_loss: 0.8362, test_f1: 0.5464
 epoch: 49, train_loss: 0.8000, test_loss: 0.8597, test_f1: 0.5397
 epoch: 50, train_loss: 0.7879, test_loss: 0.8373, test_f1: 0.5479
 epoch: 51, train_loss: 0.7783, test_loss: 0.8333, test_f1: 0.5400
 epoch: 52, train_loss: 0.7766, test_loss: 0.8497, test_f1: 0.5501
 epoch: 53, train_loss: 0.7631, test_loss: 0.8265, test_f1: 0.5572
 epoch: 54, train_loss: 0.7668, test_loss: 0.8451, test_f1: 0.5459
 epoch: 55, train_loss: 0.7766, test_loss: 0.8226, test_f1: 0.5547
 epoch: 56, train_loss: 0.7705, test_loss: 0.8670, test_f1: 0.5455
 epoch: 57, train_loss: 0.7778, test_loss: 0.8674, test_f1: 0.5427
 epoch: 58, train_loss: 0.7818, test_loss: 0.8685, test_f1: 0.5479
 epoch: 59, train_loss: 0.7721, test_loss: 0.8672, test_f1: 0.5219
 epoch: 60, train_loss: 0.7695, test_loss: 0.8595, test_f1: 0.5426
 epoch: 61, train_loss: 0.7667, test_loss: 0.8845, test_f1: 0.5300
 epoch: 62, train_loss: 0.7624, test_loss: 0.8531, test_f1: 0.5543
 epoch: 63, train_loss: 0.7667, test_loss: 0.8885, test_f1: 0.5264
 epoch: 64, train_loss: 0.7605, test_loss: 0.8325, test_f1: 0.5476
 epoch: 65, train_loss: 0.7760, test_loss: 0.8375, test_f1: 0.5596
 epoch: 66, train_loss: 0.7682, test_loss: 0.8094, test_f1: 0.5685
 epoch: 67, train_loss: 0.7648, test_loss: 0.8687, test_f1: 0.5245
 epoch: 68, train_loss: 0.7590, test_loss: 0.8753, test_f1: 0.5211
 epoch: 69, train_loss: 0.7509, test_loss: 0.8659, test_f1: 0.5343
 epoch: 70, train_loss: 0.7535, test_loss: 0.8930, test_f1: 0.5420
 epoch: 71, train_loss: 0.7623, test_loss: 0.8832, test_f1: 0.5382
 epoch: 72, train_loss: 0.7524, test_loss: 0.8708, test_f1: 0.5378
 epoch: 73, train_loss: 0.7572, test_loss: 0.8728, test_f1: 0.5443
 epoch: 74, train_loss: 0.7538, test_loss: 0.8669, test_f1: 0.5543
 epoch: 75, train_loss: 0.7501, test_loss: 0.8504, test_f1: 0.5538
 epoch: 76, train_loss: 0.7479, test_loss: 0.8630, test_f1: 0.5481
 epoch: 77, train_loss: 0.7509, test_loss: 0.8646, test_f1: 0.5499
 epoch: 78, train_loss: 0.7464, test_loss: 0.8449, test_f1: 0.5547
 epoch: 79, train_loss: 0.7510, test_loss: 0.8804, test_f1: 0.5437
 epoch: 80, train_loss: 0.7458, test_loss: 0.8470, test_f1: 0.5546
 epoch: 81, train_loss: 0.7568, test_loss: 0.8738, test_f1: 0.5465
 epoch: 82, train_loss: 0.7547, test_loss: 0.8522, test_f1: 0.5454
 epoch: 83, train_loss: 0.7423, test_loss: 0.8809, test_f1: 0.5298
 epoch: 84, train_loss: 0.7405, test_loss: 0.8490, test_f1: 0.5507
 epoch: 85, train_loss: 0.7446, test_loss: 0.8596, test_f1: 0.5566
 epoch: 86, train_loss: 0.7589, test_loss: 0.8864, test_f1: 0.5546
 epoch: 87, train_loss: 0.7404, test_loss: 0.8677, test_f1: 0.5475
 epoch: 88, train_loss: 0.7374, test_loss: 0.8561, test_f1: 0.5562
 epoch: 89, train_loss: 0.7461, test_loss: 0.8839, test_f1: 0.5395
 epoch: 90, train_loss: 0.7381, test_loss: 0.8344, test_f1: 0.5462
 epoch: 91, train_loss: 0.7336, test_loss: 0.8678, test_f1: 0.5459
 epoch: 92, train_loss: 0.7379, test_loss: 0.8590, test_f1: 0.5452
 epoch: 93, train_loss: 0.7473, test_loss: 0.8847, test_f1: 0.5266
 epoch: 94, train_loss: 0.7343, test_loss: 0.8819, test_f1: 0.5427
 epoch: 95, train_loss: 0.7371, test_loss: 0.8654, test_f1: 0.5346
 epoch: 96, train_loss: 0.7314, test_loss: 0.8657, test_f1: 0.5510
 epoch: 97, train_loss: 0.7387, test_loss: 0.8698, test_f1: 0.5434
 epoch: 98, train_loss: 0.7323, test_loss: 0.8719, test_f1: 0.5290
 epoch: 99, train_loss: 0.7345, test_loss: 0.8765, test_f1: 0.5356

Training completed in 634.28 seconds
Best F1: 0.5849 at epoch 48
Mean F1 across iterations: 0.5671  0.0149
========================FINAL RESULTS================================
FEGIN weighted F1: 0.5849  0.0149
python main.py --data ltspice_examples --representation component_pin --model FEGIN --layers 3 --hiddens 16 --batch_size 64 --lr 0.001 --emb_size 250 --epochs 100 --save_appendix component_pin_L3_H16_BS64_LR0.001_E250 --no_val
-----



STDERR:
  File "main.py", line 370, in <module>
    main()
  File "main.py", line 254, in main
    dataset = dataset_class(
  File "/home/philip/projects/ltspice_examples_code_repo/Circuit-Completion-Using-GNNs/component_classification_with_link_prediction_head/evaluation/FEGIN/kernel/circuit_datasets.py", line 15, in __init__
    self.data, self.slices = torch.load(self.processed_paths[0])
  File "/home/philip/.local/lib/python3.8/site-packages/torch/serialization.py", line 1040, in load
    warnings.warn(
  File "/usr/lib/python3.8/warnings.py", line 109, in _showwarnmsg
    sw(msg.message, msg.category, msg.filename, msg.lineno,
  File "main.py", line 47, in warn_with_traceback
    traceback.print_stack(file=log)
/home/philip/projects/ltspice_examples_code_repo/Circuit-Completion-Using-GNNs/component_classification_with_link_prediction_head/evaluation/FEGIN/kernel/circuit_datasets.py:15: FutureWarning: You are using `torch.load` with `weights_only=False` (the current default value), which uses the default pickle module implicitly. It is possible to construct malicious pickle data which will execute arbitrary code during unpickling (See https://github.com/pytorch/pytorch/blob/main/SECURITY.md#untrusted-models for more details). In a future release, the default value for `weights_only` will be flipped to `True`. This limits the functions that could be executed during unpickling. Arbitrary objects will no longer be allowed to be loaded via this mode unless they are explicitly allowlisted by the user via `torch.serialization.add_safe_globals`. We recommend you start setting `weights_only=True` for any use case where you don't have full control of the loaded file. Please open an issue on GitHub for any issues related to this experimental feature.
  self.data, self.slices = torch.load(self.processed_paths[0])
