STDOUT:
Results will be saved in /home/philip/projects/ltspice_examples_code_repo/Circuit-Completion-Using-GNNs/component_classification_with_link_prediction_head/evaluation/FEGIN/results/model_FEGIN_dataset_ltspice_demos
Command line input: python main.py --data ltspice_demos --representation component_component --model FEGIN --layers 4 --hiddens 64 --batch_size 32 --lr 0.001 --emb_size 128 --epochs 100 --save_appendix component_component_L4_H64_BS32_LR0.001_E128 --no_val
 is saved.
-----
ltspice_demos - FEGIN
Using 4 layers, 64 hidden units, h = 2
Loading component_component representation dataset
ENTERED
Training FEGIN on component_component representation
Train: 1565, Test: 383
##################ITERATION #0 ****************************************
 epoch: 0, train_loss: 1.2535, test_loss: 1.4101, test_f1: 0.3240
 epoch: 1, train_loss: 1.1622, test_loss: 1.2777, test_f1: 0.3191
 epoch: 2, train_loss: 1.1028, test_loss: 1.2598, test_f1: 0.3977
 epoch: 3, train_loss: 1.0802, test_loss: 1.2426, test_f1: 0.3800
 epoch: 4, train_loss: 1.0468, test_loss: 1.1623, test_f1: 0.4528
 epoch: 5, train_loss: 1.0164, test_loss: 1.1767, test_f1: 0.4569
 epoch: 6, train_loss: 0.9888, test_loss: 1.1854, test_f1: 0.4839
 epoch: 7, train_loss: 0.9640, test_loss: 1.1747, test_f1: 0.4938
 epoch: 8, train_loss: 0.9169, test_loss: 1.1202, test_f1: 0.5332
 epoch: 9, train_loss: 0.8900, test_loss: 1.2177, test_f1: 0.5053
 epoch: 10, train_loss: 0.8577, test_loss: 1.1145, test_f1: 0.5819
 epoch: 11, train_loss: 0.8292, test_loss: 1.1727, test_f1: 0.5441
 epoch: 12, train_loss: 0.8394, test_loss: 1.1736, test_f1: 0.5476
 epoch: 13, train_loss: 0.8110, test_loss: 1.1832, test_f1: 0.5285
 epoch: 14, train_loss: 0.7739, test_loss: 1.1164, test_f1: 0.5682
 epoch: 15, train_loss: 0.7904, test_loss: 1.1470, test_f1: 0.5506
 epoch: 16, train_loss: 0.7497, test_loss: 1.3402, test_f1: 0.5465
 epoch: 17, train_loss: 0.7660, test_loss: 1.3087, test_f1: 0.5325
 epoch: 18, train_loss: 0.7513, test_loss: 1.1995, test_f1: 0.5828
 epoch: 19, train_loss: 0.7330, test_loss: 1.2250, test_f1: 0.6026
 epoch: 20, train_loss: 0.7183, test_loss: 1.3840, test_f1: 0.5695
 epoch: 21, train_loss: 0.7051, test_loss: 1.4198, test_f1: 0.5537
 epoch: 22, train_loss: 0.6929, test_loss: 1.4951, test_f1: 0.5223
 epoch: 23, train_loss: 0.6826, test_loss: 1.7239, test_f1: 0.5041
 epoch: 24, train_loss: 0.6819, test_loss: 1.3432, test_f1: 0.5938
 epoch: 25, train_loss: 0.6619, test_loss: 1.5765, test_f1: 0.5634
 epoch: 26, train_loss: 0.6510, test_loss: 1.5880, test_f1: 0.6397
 epoch: 27, train_loss: 0.6765, test_loss: 1.3652, test_f1: 0.5803
 epoch: 28, train_loss: 0.6168, test_loss: 1.7403, test_f1: 0.5672
 epoch: 29, train_loss: 0.5856, test_loss: 1.8869, test_f1: 0.5140
 epoch: 30, train_loss: 0.6102, test_loss: 1.6957, test_f1: 0.5244
 epoch: 31, train_loss: 0.6177, test_loss: 1.8725, test_f1: 0.5986
 epoch: 32, train_loss: 0.6182, test_loss: 1.9303, test_f1: 0.5645
 epoch: 33, train_loss: 0.5898, test_loss: 1.5692, test_f1: 0.5339
 epoch: 34, train_loss: 0.5608, test_loss: 2.1980, test_f1: 0.5746
 epoch: 35, train_loss: 0.5747, test_loss: 1.9523, test_f1: 0.5233
 epoch: 36, train_loss: 0.5643, test_loss: 1.8946, test_f1: 0.5726
 epoch: 37, train_loss: 0.5391, test_loss: 1.7618, test_f1: 0.5203
 epoch: 38, train_loss: 0.5540, test_loss: 1.7468, test_f1: 0.5534
 epoch: 39, train_loss: 0.5497, test_loss: 1.5970, test_f1: 0.5912
 epoch: 40, train_loss: 0.5478, test_loss: 1.5234, test_f1: 0.5775
 epoch: 41, train_loss: 0.5292, test_loss: 1.9287, test_f1: 0.6085
 epoch: 42, train_loss: 0.5266, test_loss: 1.9995, test_f1: 0.5709
 epoch: 43, train_loss: 0.5352, test_loss: 2.0844, test_f1: 0.5702
 epoch: 44, train_loss: 0.5070, test_loss: 2.0085, test_f1: 0.5754
 epoch: 45, train_loss: 0.5070, test_loss: 2.0184, test_f1: 0.5960
 epoch: 46, train_loss: 0.5141, test_loss: 1.9049, test_f1: 0.5909
 epoch: 47, train_loss: 0.5140, test_loss: 1.6778, test_f1: 0.5972
 epoch: 48, train_loss: 0.4824, test_loss: 2.0343, test_f1: 0.5559
 epoch: 49, train_loss: 0.4815, test_loss: 2.1450, test_f1: 0.5359
 epoch: 50, train_loss: 0.4699, test_loss: 1.9598, test_f1: 0.5716
 epoch: 51, train_loss: 0.4318, test_loss: 1.9127, test_f1: 0.5853
 epoch: 52, train_loss: 0.4065, test_loss: 2.0171, test_f1: 0.5876
 epoch: 53, train_loss: 0.4074, test_loss: 2.0097, test_f1: 0.5876
 epoch: 54, train_loss: 0.3962, test_loss: 2.1554, test_f1: 0.5627
 epoch: 55, train_loss: 0.3771, test_loss: 2.3240, test_f1: 0.5758
 epoch: 56, train_loss: 0.3850, test_loss: 2.3873, test_f1: 0.5397
 epoch: 57, train_loss: 0.4000, test_loss: 2.1841, test_f1: 0.5397
 epoch: 58, train_loss: 0.3773, test_loss: 2.1254, test_f1: 0.5805
 epoch: 59, train_loss: 0.3752, test_loss: 2.3556, test_f1: 0.5615
 epoch: 60, train_loss: 0.3522, test_loss: 2.4995, test_f1: 0.5642
 epoch: 61, train_loss: 0.3603, test_loss: 2.1859, test_f1: 0.5621
 epoch: 62, train_loss: 0.3746, test_loss: 1.9846, test_f1: 0.5975
 epoch: 63, train_loss: 0.3423, test_loss: 2.5853, test_f1: 0.6026
 epoch: 64, train_loss: 0.3322, test_loss: 3.0395, test_f1: 0.5816
 epoch: 65, train_loss: 0.3286, test_loss: 2.6952, test_f1: 0.5731
 epoch: 66, train_loss: 0.3429, test_loss: 2.4412, test_f1: 0.5941
 epoch: 67, train_loss: 0.3315, test_loss: 2.5354, test_f1: 0.5805
 epoch: 68, train_loss: 0.3356, test_loss: 2.3160, test_f1: 0.5735
 epoch: 69, train_loss: 0.3518, test_loss: 2.4341, test_f1: 0.5703
 epoch: 70, train_loss: 0.3171, test_loss: 2.5994, test_f1: 0.5553
 epoch: 71, train_loss: 0.3474, test_loss: 2.3692, test_f1: 0.5585
 epoch: 72, train_loss: 0.3203, test_loss: 2.6376, test_f1: 0.5569
 epoch: 73, train_loss: 0.3309, test_loss: 2.6420, test_f1: 0.5522
 epoch: 74, train_loss: 0.3051, test_loss: 2.6986, test_f1: 0.5488
 epoch: 75, train_loss: 0.3132, test_loss: 2.4273, test_f1: 0.5496
 epoch: 76, train_loss: 0.2970, test_loss: 2.6896, test_f1: 0.5481
 epoch: 77, train_loss: 0.3461, test_loss: 2.6491, test_f1: 0.5697
 epoch: 78, train_loss: 0.3012, test_loss: 2.7526, test_f1: 0.5704
 epoch: 79, train_loss: 0.3239, test_loss: 2.5647, test_f1: 0.5542
 epoch: 80, train_loss: 0.3011, test_loss: 2.7546, test_f1: 0.5407
 epoch: 81, train_loss: 0.2856, test_loss: 2.7170, test_f1: 0.5740
 epoch: 82, train_loss: 0.3349, test_loss: 3.2463, test_f1: 0.5525
 epoch: 83, train_loss: 0.3020, test_loss: 3.1394, test_f1: 0.5528
 epoch: 84, train_loss: 0.2847, test_loss: 3.2022, test_f1: 0.5662
 epoch: 85, train_loss: 0.2792, test_loss: 3.2150, test_f1: 0.5400
 epoch: 86, train_loss: 0.2735, test_loss: 3.4896, test_f1: 0.5466
 epoch: 87, train_loss: 0.2970, test_loss: 3.2603, test_f1: 0.5508
 epoch: 88, train_loss: 0.2879, test_loss: 3.2116, test_f1: 0.5722
 epoch: 89, train_loss: 0.2644, test_loss: 2.8669, test_f1: 0.5402
 epoch: 90, train_loss: 0.2682, test_loss: 3.3817, test_f1: 0.5512
 epoch: 91, train_loss: 0.3198, test_loss: 3.1081, test_f1: 0.5622
 epoch: 92, train_loss: 0.2872, test_loss: 3.2418, test_f1: 0.5450
 epoch: 93, train_loss: 0.2948, test_loss: 3.3529, test_f1: 0.5429
 epoch: 94, train_loss: 0.2792, test_loss: 3.6520, test_f1: 0.5204
 epoch: 95, train_loss: 0.2809, test_loss: 3.4287, test_f1: 0.5383
 epoch: 96, train_loss: 0.2878, test_loss: 3.0661, test_f1: 0.5221
 epoch: 97, train_loss: 0.2531, test_loss: 3.0279, test_f1: 0.5582
 epoch: 98, train_loss: 0.2825, test_loss: 3.5618, test_f1: 0.5400
 epoch: 99, train_loss: 0.2814, test_loss: 2.7544, test_f1: 0.5507
##################ITERATION #1 ****************************************
 epoch: 0, train_loss: 1.2064, test_loss: 1.2855, test_f1: 0.4758
 epoch: 1, train_loss: 1.0885, test_loss: 1.2729, test_f1: 0.4543
 epoch: 2, train_loss: 1.0301, test_loss: 1.3116, test_f1: 0.5159
 epoch: 3, train_loss: 1.0145, test_loss: 1.1699, test_f1: 0.5299
 epoch: 4, train_loss: 0.9946, test_loss: 1.2239, test_f1: 0.4660
 epoch: 5, train_loss: 0.9773, test_loss: 1.2610, test_f1: 0.4936
 epoch: 6, train_loss: 0.9415, test_loss: 1.2048, test_f1: 0.4923
 epoch: 7, train_loss: 0.9186, test_loss: 1.3410, test_f1: 0.5508
 epoch: 8, train_loss: 0.8761, test_loss: 1.1918, test_f1: 0.5894
 epoch: 9, train_loss: 0.8368, test_loss: 1.2367, test_f1: 0.5608
 epoch: 10, train_loss: 0.8658, test_loss: 1.2043, test_f1: 0.5130
 epoch: 11, train_loss: 0.8275, test_loss: 1.7275, test_f1: 0.5253
 epoch: 12, train_loss: 0.8143, test_loss: 1.1807, test_f1: 0.5733
 epoch: 13, train_loss: 0.7931, test_loss: 1.2421, test_f1: 0.5163
 epoch: 14, train_loss: 0.7736, test_loss: 1.2421, test_f1: 0.5473
 epoch: 15, train_loss: 0.7618, test_loss: 1.4191, test_f1: 0.5107
 epoch: 16, train_loss: 0.7416, test_loss: 1.2490, test_f1: 0.6015
 epoch: 17, train_loss: 0.7336, test_loss: 1.5866, test_f1: 0.5936
 epoch: 18, train_loss: 0.7412, test_loss: 1.4524, test_f1: 0.5897
 epoch: 19, train_loss: 0.7439, test_loss: 1.3863, test_f1: 0.5682
 epoch: 20, train_loss: 0.7128, test_loss: 1.3785, test_f1: 0.5720
 epoch: 21, train_loss: 0.6909, test_loss: 1.4015, test_f1: 0.5735
 epoch: 22, train_loss: 0.6825, test_loss: 1.3650, test_f1: 0.5796
 epoch: 23, train_loss: 0.6798, test_loss: 1.3108, test_f1: 0.6091
 epoch: 24, train_loss: 0.6828, test_loss: 1.3172, test_f1: 0.6059
 epoch: 25, train_loss: 0.6855, test_loss: 1.5651, test_f1: 0.6237
 epoch: 26, train_loss: 0.6842, test_loss: 1.4763, test_f1: 0.5543
 epoch: 27, train_loss: 0.6573, test_loss: 1.6002, test_f1: 0.5662
 epoch: 28, train_loss: 0.6429, test_loss: 1.5166, test_f1: 0.5877
 epoch: 29, train_loss: 0.6389, test_loss: 1.5725, test_f1: 0.5349
 epoch: 30, train_loss: 0.6198, test_loss: 1.3868, test_f1: 0.6231
 epoch: 31, train_loss: 0.6292, test_loss: 1.2753, test_f1: 0.6048
 epoch: 32, train_loss: 0.6141, test_loss: 1.4585, test_f1: 0.6138
 epoch: 33, train_loss: 0.6004, test_loss: 1.6794, test_f1: 0.5681
 epoch: 34, train_loss: 0.5611, test_loss: 1.7706, test_f1: 0.5570
 epoch: 35, train_loss: 0.5817, test_loss: 1.8037, test_f1: 0.5740
 epoch: 36, train_loss: 0.5794, test_loss: 1.5913, test_f1: 0.5421
 epoch: 37, train_loss: 0.5636, test_loss: 1.6679, test_f1: 0.5827
 epoch: 38, train_loss: 0.5694, test_loss: 1.9494, test_f1: 0.5923
 epoch: 39, train_loss: 0.5398, test_loss: 1.5404, test_f1: 0.5915
 epoch: 40, train_loss: 0.5873, test_loss: 1.5184, test_f1: 0.5741
 epoch: 41, train_loss: 0.5377, test_loss: 1.6948, test_f1: 0.5610
 epoch: 42, train_loss: 0.5362, test_loss: 1.6154, test_f1: 0.5781
 epoch: 43, train_loss: 0.5387, test_loss: 1.7247, test_f1: 0.5490
 epoch: 44, train_loss: 0.5309, test_loss: 1.5464, test_f1: 0.6055
 epoch: 45, train_loss: 0.4879, test_loss: 1.7874, test_f1: 0.5915
 epoch: 46, train_loss: 0.5323, test_loss: 1.9047, test_f1: 0.5612
 epoch: 47, train_loss: 0.5105, test_loss: 1.6531, test_f1: 0.5892
 epoch: 48, train_loss: 0.5296, test_loss: 1.5732, test_f1: 0.5880
 epoch: 49, train_loss: 0.5005, test_loss: 1.7087, test_f1: 0.6120
 epoch: 50, train_loss: 0.4749, test_loss: 1.9867, test_f1: 0.5920
 epoch: 51, train_loss: 0.4570, test_loss: 1.9768, test_f1: 0.5914
 epoch: 52, train_loss: 0.4161, test_loss: 1.8753, test_f1: 0.6039
 epoch: 53, train_loss: 0.4007, test_loss: 2.0878, test_f1: 0.5961
 epoch: 54, train_loss: 0.4068, test_loss: 2.0182, test_f1: 0.6219
 epoch: 55, train_loss: 0.3979, test_loss: 2.2070, test_f1: 0.5884
 epoch: 56, train_loss: 0.3926, test_loss: 2.3016, test_f1: 0.5830
 epoch: 57, train_loss: 0.3804, test_loss: 2.1892, test_f1: 0.5789
 epoch: 58, train_loss: 0.3799, test_loss: 2.0333, test_f1: 0.6177
 epoch: 59, train_loss: 0.3632, test_loss: 2.3225, test_f1: 0.5674
 epoch: 60, train_loss: 0.3654, test_loss: 2.4160, test_f1: 0.5474
 epoch: 61, train_loss: 0.3732, test_loss: 2.2188, test_f1: 0.6033
 epoch: 62, train_loss: 0.3889, test_loss: 2.0585, test_f1: 0.6134
 epoch: 63, train_loss: 0.3620, test_loss: 2.3362, test_f1: 0.5873
 epoch: 64, train_loss: 0.3220, test_loss: 2.2956, test_f1: 0.5885
 epoch: 65, train_loss: 0.3605, test_loss: 2.2786, test_f1: 0.5868
 epoch: 66, train_loss: 0.3707, test_loss: 2.2774, test_f1: 0.5912
 epoch: 67, train_loss: 0.3619, test_loss: 2.3848, test_f1: 0.5822
 epoch: 68, train_loss: 0.3523, test_loss: 2.3601, test_f1: 0.5679
 epoch: 69, train_loss: 0.3369, test_loss: 2.4166, test_f1: 0.5937
 epoch: 70, train_loss: 0.3245, test_loss: 2.3082, test_f1: 0.5805
 epoch: 71, train_loss: 0.3065, test_loss: 2.3372, test_f1: 0.5745
 epoch: 72, train_loss: 0.3717, test_loss: 2.3282, test_f1: 0.5799
 epoch: 73, train_loss: 0.3362, test_loss: 2.6123, test_f1: 0.5549
 epoch: 74, train_loss: 0.3266, test_loss: 2.6042, test_f1: 0.5990
 epoch: 75, train_loss: 0.3280, test_loss: 2.6153, test_f1: 0.5664
 epoch: 76, train_loss: 0.3144, test_loss: 2.4308, test_f1: 0.6103
 epoch: 77, train_loss: 0.3164, test_loss: 2.5874, test_f1: 0.6025
 epoch: 78, train_loss: 0.3192, test_loss: 2.6552, test_f1: 0.5883
 epoch: 79, train_loss: 0.3039, test_loss: 2.5883, test_f1: 0.5710
 epoch: 80, train_loss: 0.3021, test_loss: 2.6016, test_f1: 0.5670
 epoch: 81, train_loss: 0.3304, test_loss: 2.5661, test_f1: 0.5821
 epoch: 82, train_loss: 0.2823, test_loss: 2.7142, test_f1: 0.5760
 epoch: 83, train_loss: 0.2939, test_loss: 2.6457, test_f1: 0.5947
 epoch: 84, train_loss: 0.3207, test_loss: 2.8069, test_f1: 0.5721
 epoch: 85, train_loss: 0.3429, test_loss: 2.4149, test_f1: 0.5774
 epoch: 86, train_loss: 0.2942, test_loss: 2.5397, test_f1: 0.6112
 epoch: 87, train_loss: 0.2857, test_loss: 2.3932, test_f1: 0.6063
 epoch: 88, train_loss: 0.2724, test_loss: 2.4350, test_f1: 0.5882
 epoch: 89, train_loss: 0.2730, test_loss: 2.4547, test_f1: 0.5821
 epoch: 90, train_loss: 0.2906, test_loss: 2.4486, test_f1: 0.5869
 epoch: 91, train_loss: 0.2716, test_loss: 2.4779, test_f1: 0.6052
 epoch: 92, train_loss: 0.2805, test_loss: 2.3064, test_f1: 0.5957
 epoch: 93, train_loss: 0.2729, test_loss: 2.7115, test_f1: 0.5809
 epoch: 94, train_loss: 0.2673, test_loss: 2.7515, test_f1: 0.5770
 epoch: 95, train_loss: 0.2670, test_loss: 2.4844, test_f1: 0.6065
 epoch: 96, train_loss: 0.2708, test_loss: 2.8765, test_f1: 0.5755
 epoch: 97, train_loss: 0.2570, test_loss: 2.4916, test_f1: 0.6074
 epoch: 98, train_loss: 0.2760, test_loss: 2.5258, test_f1: 0.5841
 epoch: 99, train_loss: 0.2770, test_loss: 2.5307, test_f1: 0.6139
##################ITERATION #2 ****************************************
 epoch: 0, train_loss: 1.2128, test_loss: 1.2327, test_f1: 0.3613
 epoch: 1, train_loss: 1.1129, test_loss: 1.2643, test_f1: 0.4831
 epoch: 2, train_loss: 1.0614, test_loss: 1.2571, test_f1: 0.5257
 epoch: 3, train_loss: 0.9957, test_loss: 1.2152, test_f1: 0.5345
 epoch: 4, train_loss: 0.9750, test_loss: 1.2229, test_f1: 0.5551
 epoch: 5, train_loss: 0.9380, test_loss: 1.1129, test_f1: 0.5626
 epoch: 6, train_loss: 0.9368, test_loss: 1.1248, test_f1: 0.5753
 epoch: 7, train_loss: 0.8970, test_loss: 1.1827, test_f1: 0.5780
 epoch: 8, train_loss: 0.9100, test_loss: 1.2364, test_f1: 0.5042
 epoch: 9, train_loss: 0.8882, test_loss: 1.3129, test_f1: 0.5474
 epoch: 10, train_loss: 0.8592, test_loss: 1.1696, test_f1: 0.6097
 epoch: 11, train_loss: 0.8487, test_loss: 1.2656, test_f1: 0.5308
 epoch: 12, train_loss: 0.8303, test_loss: 1.4176, test_f1: 0.5502
 epoch: 13, train_loss: 0.8185, test_loss: 1.2415, test_f1: 0.5508
 epoch: 14, train_loss: 0.7857, test_loss: 1.2373, test_f1: 0.5314
 epoch: 15, train_loss: 0.8023, test_loss: 1.1619, test_f1: 0.5517
 epoch: 16, train_loss: 0.7912, test_loss: 1.1663, test_f1: 0.5706
 epoch: 17, train_loss: 0.7780, test_loss: 1.1598, test_f1: 0.5587
 epoch: 18, train_loss: 0.7661, test_loss: 1.2835, test_f1: 0.5190
 epoch: 19, train_loss: 0.7598, test_loss: 1.3371, test_f1: 0.5461
 epoch: 20, train_loss: 0.7443, test_loss: 1.3882, test_f1: 0.5072
 epoch: 21, train_loss: 0.7425, test_loss: 1.5068, test_f1: 0.5400
 epoch: 22, train_loss: 0.7349, test_loss: 1.4160, test_f1: 0.5695
 epoch: 23, train_loss: 0.7248, test_loss: 1.4102, test_f1: 0.5950
 epoch: 24, train_loss: 0.7567, test_loss: 1.3854, test_f1: 0.5321
 epoch: 25, train_loss: 0.7284, test_loss: 1.4543, test_f1: 0.5582
 epoch: 26, train_loss: 0.7157, test_loss: 1.3458, test_f1: 0.4862
 epoch: 27, train_loss: 0.6913, test_loss: 1.7095, test_f1: 0.5111
 epoch: 28, train_loss: 0.6920, test_loss: 1.4886, test_f1: 0.5630
 epoch: 29, train_loss: 0.6831, test_loss: 1.5544, test_f1: 0.5665
 epoch: 30, train_loss: 0.6419, test_loss: 1.7100, test_f1: 0.5429
 epoch: 31, train_loss: 0.6684, test_loss: 1.5228, test_f1: 0.5902
 epoch: 32, train_loss: 0.6965, test_loss: 1.5658, test_f1: 0.5904
 epoch: 33, train_loss: 0.7014, test_loss: 1.4384, test_f1: 0.5557
 epoch: 34, train_loss: 0.6564, test_loss: 1.6185, test_f1: 0.5725
 epoch: 35, train_loss: 0.6625, test_loss: 1.6063, test_f1: 0.5660
 epoch: 36, train_loss: 0.6249, test_loss: 1.6016, test_f1: 0.5527
 epoch: 37, train_loss: 0.6256, test_loss: 2.0266, test_f1: 0.5228
 epoch: 38, train_loss: 0.6130, test_loss: 1.5992, test_f1: 0.5607
 epoch: 39, train_loss: 0.5812, test_loss: 1.7972, test_f1: 0.5695
 epoch: 40, train_loss: 0.5940, test_loss: 1.6800, test_f1: 0.5867
 epoch: 41, train_loss: 0.6046, test_loss: 1.7868, test_f1: 0.5981
 epoch: 42, train_loss: 0.5692, test_loss: 1.8354, test_f1: 0.5310
 epoch: 43, train_loss: 0.5735, test_loss: 1.9216, test_f1: 0.5413
 epoch: 44, train_loss: 0.5999, test_loss: 1.7227, test_f1: 0.5768
 epoch: 45, train_loss: 0.5675, test_loss: 1.5759, test_f1: 0.5893
 epoch: 46, train_loss: 0.5664, test_loss: 1.7253, test_f1: 0.5651
 epoch: 47, train_loss: 0.5727, test_loss: 1.8511, test_f1: 0.5518
 epoch: 48, train_loss: 0.5572, test_loss: 1.8585, test_f1: 0.5642
 epoch: 49, train_loss: 0.5215, test_loss: 1.9422, test_f1: 0.5616
 epoch: 50, train_loss: 0.5646, test_loss: 1.9216, test_f1: 0.5961
 epoch: 51, train_loss: 0.5053, test_loss: 2.1482, test_f1: 0.5438
 epoch: 52, train_loss: 0.4754, test_loss: 2.0969, test_f1: 0.6034
 epoch: 53, train_loss: 0.4592, test_loss: 2.2019, test_f1: 0.5586
 epoch: 54, train_loss: 0.4639, test_loss: 1.8709, test_f1: 0.5879
 epoch: 55, train_loss: 0.4393, test_loss: 2.1039, test_f1: 0.5874
 epoch: 56, train_loss: 0.4537, test_loss: 2.2414, test_f1: 0.5599
 epoch: 57, train_loss: 0.4370, test_loss: 2.2930, test_f1: 0.5736
 epoch: 58, train_loss: 0.4338, test_loss: 2.2671, test_f1: 0.5872
 epoch: 59, train_loss: 0.4298, test_loss: 2.1841, test_f1: 0.6000
 epoch: 60, train_loss: 0.4096, test_loss: 2.4889, test_f1: 0.5748
 epoch: 61, train_loss: 0.4515, test_loss: 2.0820, test_f1: 0.5630
 epoch: 62, train_loss: 0.4396, test_loss: 2.1708, test_f1: 0.5551
 epoch: 63, train_loss: 0.4438, test_loss: 2.1987, test_f1: 0.5828
 epoch: 64, train_loss: 0.4220, test_loss: 2.1525, test_f1: 0.5731
 epoch: 65, train_loss: 0.4278, test_loss: 2.2277, test_f1: 0.5764
 epoch: 66, train_loss: 0.4176, test_loss: 2.1368, test_f1: 0.5727
 epoch: 67, train_loss: 0.3962, test_loss: 2.0953, test_f1: 0.5701
 epoch: 68, train_loss: 0.3801, test_loss: 2.6043, test_f1: 0.5631
 epoch: 69, train_loss: 0.4119, test_loss: 2.3187, test_f1: 0.5706
 epoch: 70, train_loss: 0.3933, test_loss: 2.6403, test_f1: 0.5647
 epoch: 71, train_loss: 0.4098, test_loss: 2.3094, test_f1: 0.5873
 epoch: 72, train_loss: 0.3970, test_loss: 2.4375, test_f1: 0.5649
 epoch: 73, train_loss: 0.3805, test_loss: 2.4485, test_f1: 0.5818
 epoch: 74, train_loss: 0.3838, test_loss: 2.1412, test_f1: 0.6094
 epoch: 75, train_loss: 0.4116, test_loss: 2.5169, test_f1: 0.5773
 epoch: 76, train_loss: 0.3992, test_loss: 2.6088, test_f1: 0.5816
 epoch: 77, train_loss: 0.3806, test_loss: 2.5040, test_f1: 0.5710
 epoch: 78, train_loss: 0.3856, test_loss: 2.6970, test_f1: 0.6003
 epoch: 79, train_loss: 0.3978, test_loss: 2.6669, test_f1: 0.5816
 epoch: 80, train_loss: 0.4135, test_loss: 2.7055, test_f1: 0.5583
 epoch: 81, train_loss: 0.3573, test_loss: 2.5302, test_f1: 0.5929
 epoch: 82, train_loss: 0.3637, test_loss: 2.7010, test_f1: 0.5642
 epoch: 83, train_loss: 0.3579, test_loss: 2.9575, test_f1: 0.5819
 epoch: 84, train_loss: 0.3685, test_loss: 2.7680, test_f1: 0.5801
 epoch: 85, train_loss: 0.3714, test_loss: 2.9877, test_f1: 0.5787
 epoch: 86, train_loss: 0.3539, test_loss: 2.8161, test_f1: 0.5958
 epoch: 87, train_loss: 0.3573, test_loss: 2.6765, test_f1: 0.5895
 epoch: 88, train_loss: 0.3579, test_loss: 2.9485, test_f1: 0.5562
 epoch: 89, train_loss: 0.3645, test_loss: 3.0373, test_f1: 0.5434
 epoch: 90, train_loss: 0.3568, test_loss: 2.9549, test_f1: 0.5540
 epoch: 91, train_loss: 0.3527, test_loss: 2.6952, test_f1: 0.5559
 epoch: 92, train_loss: 0.3104, test_loss: 2.9673, test_f1: 0.5700
 epoch: 93, train_loss: 0.3250, test_loss: 2.8608, test_f1: 0.5722
 epoch: 94, train_loss: 0.3284, test_loss: 2.7059, test_f1: 0.5756
 epoch: 95, train_loss: 0.3428, test_loss: 3.0675, test_f1: 0.5381
 epoch: 96, train_loss: 0.3140, test_loss: 3.1411, test_f1: 0.5505
 epoch: 97, train_loss: 0.3757, test_loss: 3.0406, test_f1: 0.5940
 epoch: 98, train_loss: 0.3229, test_loss: 2.7814, test_f1: 0.5749
 epoch: 99, train_loss: 0.3270, test_loss: 2.7729, test_f1: 0.5846
##################ITERATION #3 ****************************************
 epoch: 0, train_loss: 1.2590, test_loss: 1.2703, test_f1: 0.4383
 epoch: 1, train_loss: 1.1460, test_loss: 1.1675, test_f1: 0.4951
 epoch: 2, train_loss: 1.0964, test_loss: 1.1484, test_f1: 0.5452
 epoch: 3, train_loss: 1.0386, test_loss: 1.1884, test_f1: 0.4490
 epoch: 4, train_loss: 1.0057, test_loss: 1.1455, test_f1: 0.5477
 epoch: 5, train_loss: 0.9756, test_loss: 1.1102, test_f1: 0.5350
 epoch: 6, train_loss: 0.9569, test_loss: 1.1702, test_f1: 0.5650
 epoch: 7, train_loss: 0.9493, test_loss: 1.1282, test_f1: 0.5603
 epoch: 8, train_loss: 0.9256, test_loss: 1.0856, test_f1: 0.5667
 epoch: 9, train_loss: 0.8958, test_loss: 1.2552, test_f1: 0.4988
 epoch: 10, train_loss: 0.8752, test_loss: 1.2292, test_f1: 0.5610
 epoch: 11, train_loss: 0.9106, test_loss: 1.2387, test_f1: 0.5864
 epoch: 12, train_loss: 0.8638, test_loss: 1.0866, test_f1: 0.5712
 epoch: 13, train_loss: 0.8411, test_loss: 1.1699, test_f1: 0.6030
 epoch: 14, train_loss: 0.8425, test_loss: 1.1544, test_f1: 0.6020
 epoch: 15, train_loss: 0.8099, test_loss: 1.1660, test_f1: 0.5226
 epoch: 16, train_loss: 0.7856, test_loss: 1.1936, test_f1: 0.5922
 epoch: 17, train_loss: 0.8096, test_loss: 1.2444, test_f1: 0.5645
 epoch: 18, train_loss: 0.7976, test_loss: 1.2710, test_f1: 0.6047
 epoch: 19, train_loss: 0.7661, test_loss: 1.1244, test_f1: 0.6136
 epoch: 20, train_loss: 0.7791, test_loss: 1.1785, test_f1: 0.5762
 epoch: 21, train_loss: 0.7432, test_loss: 1.3172, test_f1: 0.5701
 epoch: 22, train_loss: 0.7619, test_loss: 1.2855, test_f1: 0.5565
 epoch: 23, train_loss: 0.7524, test_loss: 1.2970, test_f1: 0.5619
 epoch: 24, train_loss: 0.7456, test_loss: 1.3070, test_f1: 0.5979
 epoch: 25, train_loss: 0.7023, test_loss: 1.2585, test_f1: 0.5956
 epoch: 26, train_loss: 0.7516, test_loss: 1.5913, test_f1: 0.5335
 epoch: 27, train_loss: 0.7344, test_loss: 1.3973, test_f1: 0.5817
 epoch: 28, train_loss: 0.6916, test_loss: 1.2354, test_f1: 0.6072
 epoch: 29, train_loss: 0.7037, test_loss: 1.3424, test_f1: 0.5788
 epoch: 30, train_loss: 0.6870, test_loss: 1.4032, test_f1: 0.5140
 epoch: 31, train_loss: 0.6862, test_loss: 1.6073, test_f1: 0.5099
 epoch: 32, train_loss: 0.6921, test_loss: 1.3085, test_f1: 0.5591
 epoch: 33, train_loss: 0.6596, test_loss: 1.2645, test_f1: 0.5750
 epoch: 34, train_loss: 0.6447, test_loss: 1.6410, test_f1: 0.4836
 epoch: 35, train_loss: 0.6234, test_loss: 1.4253, test_f1: 0.5615
 epoch: 36, train_loss: 0.6596, test_loss: 1.3043, test_f1: 0.5709
 epoch: 37, train_loss: 0.6437, test_loss: 1.9373, test_f1: 0.5042
 epoch: 38, train_loss: 0.6358, test_loss: 1.4958, test_f1: 0.5274
 epoch: 39, train_loss: 0.6152, test_loss: 1.5585, test_f1: 0.5872
 epoch: 40, train_loss: 0.6260, test_loss: 1.4870, test_f1: 0.5003
 epoch: 41, train_loss: 0.6276, test_loss: 1.3592, test_f1: 0.6181
 epoch: 42, train_loss: 0.6142, test_loss: 1.3793, test_f1: 0.5858
 epoch: 43, train_loss: 0.6092, test_loss: 1.4617, test_f1: 0.5525
 epoch: 44, train_loss: 0.5942, test_loss: 1.8137, test_f1: 0.5444
 epoch: 45, train_loss: 0.5740, test_loss: 1.8765, test_f1: 0.5826
 epoch: 46, train_loss: 0.5684, test_loss: 1.4535, test_f1: 0.5852
 epoch: 47, train_loss: 0.5423, test_loss: 1.8318, test_f1: 0.5755
 epoch: 48, train_loss: 0.5664, test_loss: 1.8443, test_f1: 0.4746
 epoch: 49, train_loss: 0.5410, test_loss: 1.4598, test_f1: 0.5779
 epoch: 50, train_loss: 0.5468, test_loss: 1.4887, test_f1: 0.5623
 epoch: 51, train_loss: 0.5353, test_loss: 1.4888, test_f1: 0.5777
 epoch: 52, train_loss: 0.4938, test_loss: 1.6401, test_f1: 0.6066
 epoch: 53, train_loss: 0.4673, test_loss: 1.6148, test_f1: 0.5552
 epoch: 54, train_loss: 0.4697, test_loss: 1.5508, test_f1: 0.5874
 epoch: 55, train_loss: 0.4814, test_loss: 1.7249, test_f1: 0.6253
 epoch: 56, train_loss: 0.4268, test_loss: 1.5959, test_f1: 0.5612
 epoch: 57, train_loss: 0.4433, test_loss: 1.8701, test_f1: 0.5709
 epoch: 58, train_loss: 0.4543, test_loss: 1.8641, test_f1: 0.5623
 epoch: 59, train_loss: 0.4556, test_loss: 1.7226, test_f1: 0.6086
 epoch: 60, train_loss: 0.4427, test_loss: 1.9221, test_f1: 0.5496
 epoch: 61, train_loss: 0.4349, test_loss: 1.8323, test_f1: 0.5960
 epoch: 62, train_loss: 0.4404, test_loss: 1.8891, test_f1: 0.5978
 epoch: 63, train_loss: 0.4057, test_loss: 1.7726, test_f1: 0.5782
 epoch: 64, train_loss: 0.4108, test_loss: 1.8917, test_f1: 0.6319
 epoch: 65, train_loss: 0.4045, test_loss: 2.0666, test_f1: 0.5747
 epoch: 66, train_loss: 0.4169, test_loss: 2.3372, test_f1: 0.5861
 epoch: 67, train_loss: 0.4176, test_loss: 2.1729, test_f1: 0.5573
 epoch: 68, train_loss: 0.3906, test_loss: 2.2193, test_f1: 0.5672
 epoch: 69, train_loss: 0.4049, test_loss: 1.9659, test_f1: 0.5810
 epoch: 70, train_loss: 0.4105, test_loss: 2.1721, test_f1: 0.5577
 epoch: 71, train_loss: 0.3954, test_loss: 2.1976, test_f1: 0.5674
 epoch: 72, train_loss: 0.3987, test_loss: 2.3007, test_f1: 0.5513
 epoch: 73, train_loss: 0.3884, test_loss: 2.1863, test_f1: 0.6003
 epoch: 74, train_loss: 0.3857, test_loss: 2.1652, test_f1: 0.6339
 epoch: 75, train_loss: 0.3829, test_loss: 2.2266, test_f1: 0.6502
 epoch: 76, train_loss: 0.3959, test_loss: 1.8725, test_f1: 0.5927
 epoch: 77, train_loss: 0.3641, test_loss: 2.1322, test_f1: 0.5873
 epoch: 78, train_loss: 0.3712, test_loss: 2.3320, test_f1: 0.6120
 epoch: 79, train_loss: 0.3842, test_loss: 2.1174, test_f1: 0.5827
 epoch: 80, train_loss: 0.3757, test_loss: 2.0931, test_f1: 0.5976
 epoch: 81, train_loss: 0.3613, test_loss: 1.9295, test_f1: 0.5933
 epoch: 82, train_loss: 0.3621, test_loss: 2.1002, test_f1: 0.6245
 epoch: 83, train_loss: 0.3707, test_loss: 2.2944, test_f1: 0.6129
 epoch: 84, train_loss: 0.3539, test_loss: 2.1379, test_f1: 0.5893
 epoch: 85, train_loss: 0.3490, test_loss: 2.1726, test_f1: 0.5730
 epoch: 86, train_loss: 0.3563, test_loss: 2.3629, test_f1: 0.5758
 epoch: 87, train_loss: 0.3476, test_loss: 2.1671, test_f1: 0.6582
 epoch: 88, train_loss: 0.3575, test_loss: 2.1719, test_f1: 0.6408
 epoch: 89, train_loss: 0.3684, test_loss: 2.1558, test_f1: 0.6050
 epoch: 90, train_loss: 0.3409, test_loss: 2.2430, test_f1: 0.5750
 epoch: 91, train_loss: 0.3204, test_loss: 2.1407, test_f1: 0.6248
 epoch: 92, train_loss: 0.2927, test_loss: 2.2311, test_f1: 0.5906
 epoch: 93, train_loss: 0.3056, test_loss: 2.3737, test_f1: 0.6376
 epoch: 94, train_loss: 0.3193, test_loss: 2.2889, test_f1: 0.6399
 epoch: 95, train_loss: 0.3227, test_loss: 2.5148, test_f1: 0.5994
 epoch: 96, train_loss: 0.3276, test_loss: 2.4109, test_f1: 0.6187
 epoch: 97, train_loss: 0.3209, test_loss: 2.4599, test_f1: 0.6083
 epoch: 98, train_loss: 0.3120, test_loss: 2.3135, test_f1: 0.6233
 epoch: 99, train_loss: 0.3081, test_loss: 2.4788, test_f1: 0.6365
##################ITERATION #4 ****************************************
 epoch: 0, train_loss: 1.2846, test_loss: 1.3664, test_f1: 0.4326
 epoch: 1, train_loss: 1.1602, test_loss: 1.3235, test_f1: 0.4610
 epoch: 2, train_loss: 1.0782, test_loss: 1.3567, test_f1: 0.4871
 epoch: 3, train_loss: 1.0452, test_loss: 1.2534, test_f1: 0.4854
 epoch: 4, train_loss: 1.0305, test_loss: 1.1738, test_f1: 0.4989
 epoch: 5, train_loss: 0.9960, test_loss: 1.1624, test_f1: 0.4683
 epoch: 6, train_loss: 0.9979, test_loss: 1.1556, test_f1: 0.5387
 epoch: 7, train_loss: 0.9735, test_loss: 1.1913, test_f1: 0.5415
 epoch: 8, train_loss: 0.9394, test_loss: 1.2691, test_f1: 0.5348
 epoch: 9, train_loss: 0.9427, test_loss: 1.2256, test_f1: 0.5418
 epoch: 10, train_loss: 0.9121, test_loss: 1.2834, test_f1: 0.5359
 epoch: 11, train_loss: 0.9163, test_loss: 1.1851, test_f1: 0.5234
 epoch: 12, train_loss: 0.9216, test_loss: 1.2646, test_f1: 0.5209
 epoch: 13, train_loss: 0.9143, test_loss: 1.1762, test_f1: 0.5529
 epoch: 14, train_loss: 0.8832, test_loss: 1.2226, test_f1: 0.5418
 epoch: 15, train_loss: 0.8455, test_loss: 1.2218, test_f1: 0.5782
 epoch: 16, train_loss: 0.8423, test_loss: 1.2284, test_f1: 0.5789
 epoch: 17, train_loss: 0.8588, test_loss: 1.1643, test_f1: 0.5529
 epoch: 18, train_loss: 0.8182, test_loss: 1.2120, test_f1: 0.5711
 epoch: 19, train_loss: 0.8061, test_loss: 1.3707, test_f1: 0.5462
 epoch: 20, train_loss: 0.8077, test_loss: 1.2860, test_f1: 0.5903
 epoch: 21, train_loss: 0.8079, test_loss: 1.2495, test_f1: 0.5498
 epoch: 22, train_loss: 0.7813, test_loss: 1.5351, test_f1: 0.4911
 epoch: 23, train_loss: 0.7864, test_loss: 1.3371, test_f1: 0.5287
 epoch: 24, train_loss: 0.7907, test_loss: 1.2200, test_f1: 0.5839
 epoch: 25, train_loss: 0.7696, test_loss: 1.1385, test_f1: 0.5627
 epoch: 26, train_loss: 0.7619, test_loss: 1.1306, test_f1: 0.5873
 epoch: 27, train_loss: 0.7503, test_loss: 1.2076, test_f1: 0.5922
 epoch: 28, train_loss: 0.7810, test_loss: 1.1628, test_f1: 0.5380
 epoch: 29, train_loss: 0.7292, test_loss: 1.0521, test_f1: 0.5980
 epoch: 30, train_loss: 0.7537, test_loss: 1.1665, test_f1: 0.6135
 epoch: 31, train_loss: 0.7503, test_loss: 1.1933, test_f1: 0.5720
 epoch: 32, train_loss: 0.7130, test_loss: 1.1996, test_f1: 0.5968
 epoch: 33, train_loss: 0.7275, test_loss: 1.2256, test_f1: 0.6035
 epoch: 34, train_loss: 0.7124, test_loss: 1.2145, test_f1: 0.5827
 epoch: 35, train_loss: 0.7034, test_loss: 1.2155, test_f1: 0.6072
 epoch: 36, train_loss: 0.6910, test_loss: 1.2537, test_f1: 0.6182
 epoch: 37, train_loss: 0.6707, test_loss: 1.5083, test_f1: 0.5187
 epoch: 38, train_loss: 0.6985, test_loss: 1.5552, test_f1: 0.4947
 epoch: 39, train_loss: 0.6801, test_loss: 1.2134, test_f1: 0.5683
 epoch: 40, train_loss: 0.6905, test_loss: 1.2811, test_f1: 0.5281
 epoch: 41, train_loss: 0.6602, test_loss: 1.3693, test_f1: 0.5836
 epoch: 42, train_loss: 0.6545, test_loss: 1.2551, test_f1: 0.5866
 epoch: 43, train_loss: 0.6341, test_loss: 1.3264, test_f1: 0.6183
 epoch: 44, train_loss: 0.6648, test_loss: 1.3398, test_f1: 0.5940
 epoch: 45, train_loss: 0.6107, test_loss: 1.5056, test_f1: 0.5540
 epoch: 46, train_loss: 0.6235, test_loss: 1.6468, test_f1: 0.5818
 epoch: 47, train_loss: 0.6615, test_loss: 1.3666, test_f1: 0.5978
 epoch: 48, train_loss: 0.6399, test_loss: 1.5044, test_f1: 0.5673
 epoch: 49, train_loss: 0.6147, test_loss: 1.4076, test_f1: 0.5796
 epoch: 50, train_loss: 0.6177, test_loss: 1.5204, test_f1: 0.5684
 epoch: 51, train_loss: 0.5808, test_loss: 1.4439, test_f1: 0.5765
 epoch: 52, train_loss: 0.5800, test_loss: 1.5879, test_f1: 0.5520
 epoch: 53, train_loss: 0.5689, test_loss: 1.6128, test_f1: 0.5842
 epoch: 54, train_loss: 0.5504, test_loss: 1.5581, test_f1: 0.6001
 epoch: 55, train_loss: 0.5301, test_loss: 1.6212, test_f1: 0.5951
 epoch: 56, train_loss: 0.5370, test_loss: 1.6118, test_f1: 0.5477
 epoch: 57, train_loss: 0.5304, test_loss: 1.6241, test_f1: 0.5964
 epoch: 58, train_loss: 0.5214, test_loss: 1.6018, test_f1: 0.5997
 epoch: 59, train_loss: 0.5063, test_loss: 1.7713, test_f1: 0.5242
 epoch: 60, train_loss: 0.5148, test_loss: 1.7177, test_f1: 0.5689
 epoch: 61, train_loss: 0.5046, test_loss: 1.6647, test_f1: 0.5430
 epoch: 62, train_loss: 0.5235, test_loss: 1.7859, test_f1: 0.5775
 epoch: 63, train_loss: 0.5017, test_loss: 1.7503, test_f1: 0.5721
 epoch: 64, train_loss: 0.5037, test_loss: 1.6842, test_f1: 0.5724
 epoch: 65, train_loss: 0.5015, test_loss: 1.7300, test_f1: 0.5651
 epoch: 66, train_loss: 0.5176, test_loss: 1.6438, test_f1: 0.5722
 epoch: 67, train_loss: 0.4999, test_loss: 1.6408, test_f1: 0.5940
 epoch: 68, train_loss: 0.4896, test_loss: 1.8132, test_f1: 0.5635
 epoch: 69, train_loss: 0.4711, test_loss: 1.7698, test_f1: 0.5606
 epoch: 70, train_loss: 0.4753, test_loss: 1.6607, test_f1: 0.5830
 epoch: 71, train_loss: 0.4673, test_loss: 1.8105, test_f1: 0.5894
 epoch: 72, train_loss: 0.4537, test_loss: 2.0612, test_f1: 0.5664
 epoch: 73, train_loss: 0.4730, test_loss: 1.7258, test_f1: 0.5873
 epoch: 74, train_loss: 0.4946, test_loss: 1.8082, test_f1: 0.5677
 epoch: 75, train_loss: 0.4808, test_loss: 1.7914, test_f1: 0.5786
 epoch: 76, train_loss: 0.4973, test_loss: 1.6290, test_f1: 0.5610
 epoch: 77, train_loss: 0.4645, test_loss: 1.9164, test_f1: 0.5659
 epoch: 78, train_loss: 0.4695, test_loss: 1.8434, test_f1: 0.5712
 epoch: 79, train_loss: 0.4563, test_loss: 1.9516, test_f1: 0.5480
 epoch: 80, train_loss: 0.4692, test_loss: 1.7681, test_f1: 0.5575
 epoch: 81, train_loss: 0.4466, test_loss: 1.8666, test_f1: 0.5945
 epoch: 82, train_loss: 0.4544, test_loss: 1.8887, test_f1: 0.5697
 epoch: 83, train_loss: 0.4730, test_loss: 1.7600, test_f1: 0.6160
 epoch: 84, train_loss: 0.3936, test_loss: 2.1176, test_f1: 0.5654
 epoch: 85, train_loss: 0.4031, test_loss: 2.0074, test_f1: 0.5730
 epoch: 86, train_loss: 0.4234, test_loss: 2.0479, test_f1: 0.5617
 epoch: 87, train_loss: 0.4480, test_loss: 1.9135, test_f1: 0.5636
 epoch: 88, train_loss: 0.4184, test_loss: 2.0396, test_f1: 0.5261
 epoch: 89, train_loss: 0.4474, test_loss: 1.8331, test_f1: 0.5992
 epoch: 90, train_loss: 0.4591, test_loss: 1.9867, test_f1: 0.5838
 epoch: 91, train_loss: 0.4253, test_loss: 2.2096, test_f1: 0.5384
 epoch: 92, train_loss: 0.4623, test_loss: 2.0957, test_f1: 0.5547
 epoch: 93, train_loss: 0.4514, test_loss: 1.8455, test_f1: 0.5679
 epoch: 94, train_loss: 0.4383, test_loss: 1.7409, test_f1: 0.5625
 epoch: 95, train_loss: 0.4101, test_loss: 1.7418, test_f1: 0.5894
 epoch: 96, train_loss: 0.3954, test_loss: 1.8566, test_f1: 0.5851
 epoch: 97, train_loss: 0.3938, test_loss: 2.0771, test_f1: 0.5344
 epoch: 98, train_loss: 0.4505, test_loss: 2.0156, test_f1: 0.5708
 epoch: 99, train_loss: 0.3898, test_loss: 1.8500, test_f1: 0.5755
##################ITERATION #5 ****************************************
 epoch: 0, train_loss: 1.3061, test_loss: 1.2633, test_f1: 0.3928
 epoch: 1, train_loss: 1.1515, test_loss: 1.2090, test_f1: 0.4649
 epoch: 2, train_loss: 1.0996, test_loss: 1.2294, test_f1: 0.4789
 epoch: 3, train_loss: 1.0403, test_loss: 1.1926, test_f1: 0.4790
 epoch: 4, train_loss: 1.0254, test_loss: 1.1711, test_f1: 0.5401
 epoch: 5, train_loss: 1.0041, test_loss: 1.1454, test_f1: 0.5362
 epoch: 6, train_loss: 0.9833, test_loss: 1.1246, test_f1: 0.5282
 epoch: 7, train_loss: 0.9316, test_loss: 1.2011, test_f1: 0.5692
 epoch: 8, train_loss: 0.9169, test_loss: 1.3582, test_f1: 0.5640
 epoch: 9, train_loss: 0.9006, test_loss: 1.1194, test_f1: 0.5913
 epoch: 10, train_loss: 0.8795, test_loss: 1.1616, test_f1: 0.5431
 epoch: 11, train_loss: 0.8884, test_loss: 1.1911, test_f1: 0.5105
 epoch: 12, train_loss: 0.8626, test_loss: 1.2163, test_f1: 0.5562
 epoch: 13, train_loss: 0.8457, test_loss: 1.1357, test_f1: 0.5633
 epoch: 14, train_loss: 0.8188, test_loss: 1.1313, test_f1: 0.6060
 epoch: 15, train_loss: 0.8340, test_loss: 1.2319, test_f1: 0.5708
 epoch: 16, train_loss: 0.8351, test_loss: 1.1005, test_f1: 0.6100
 epoch: 17, train_loss: 0.8084, test_loss: 1.1688, test_f1: 0.5482
 epoch: 18, train_loss: 0.8177, test_loss: 1.2824, test_f1: 0.5566
 epoch: 19, train_loss: 0.8058, test_loss: 1.1699, test_f1: 0.5880
 epoch: 20, train_loss: 0.7980, test_loss: 1.2485, test_f1: 0.5426
 epoch: 21, train_loss: 0.7677, test_loss: 1.1335, test_f1: 0.5876
 epoch: 22, train_loss: 0.7536, test_loss: 1.3928, test_f1: 0.5055
 epoch: 23, train_loss: 0.7687, test_loss: 1.1826, test_f1: 0.5779
 epoch: 24, train_loss: 0.7654, test_loss: 1.2518, test_f1: 0.5758
 epoch: 25, train_loss: 0.7182, test_loss: 1.3262, test_f1: 0.5247
 epoch: 26, train_loss: 0.7374, test_loss: 1.4083, test_f1: 0.5214
 epoch: 27, train_loss: 0.7263, test_loss: 1.1240, test_f1: 0.5808
 epoch: 28, train_loss: 0.7179, test_loss: 1.3290, test_f1: 0.5645
 epoch: 29, train_loss: 0.7229, test_loss: 1.2074, test_f1: 0.6037
 epoch: 30, train_loss: 0.6769, test_loss: 1.1506, test_f1: 0.6082
 epoch: 31, train_loss: 0.6920, test_loss: 1.3372, test_f1: 0.5507
 epoch: 32, train_loss: 0.7053, test_loss: 1.3647, test_f1: 0.5548
 epoch: 33, train_loss: 0.7088, test_loss: 1.1335, test_f1: 0.5551
 epoch: 34, train_loss: 0.7033, test_loss: 1.2239, test_f1: 0.5785
 epoch: 35, train_loss: 0.6577, test_loss: 1.1751, test_f1: 0.5776
 epoch: 36, train_loss: 0.6310, test_loss: 1.3818, test_f1: 0.5373
 epoch: 37, train_loss: 0.6626, test_loss: 1.3714, test_f1: 0.6171
 epoch: 38, train_loss: 0.6711, test_loss: 1.2117, test_f1: 0.5940
 epoch: 39, train_loss: 0.6464, test_loss: 1.3114, test_f1: 0.6080
 epoch: 40, train_loss: 0.6359, test_loss: 1.3978, test_f1: 0.5646
 epoch: 41, train_loss: 0.6402, test_loss: 1.3250, test_f1: 0.5999
 epoch: 42, train_loss: 0.6304, test_loss: 1.3803, test_f1: 0.5672
 epoch: 43, train_loss: 0.6101, test_loss: 1.2390, test_f1: 0.6109
 epoch: 44, train_loss: 0.5957, test_loss: 1.3957, test_f1: 0.6130
 epoch: 45, train_loss: 0.6042, test_loss: 1.4460, test_f1: 0.5881
 epoch: 46, train_loss: 0.6262, test_loss: 1.4559, test_f1: 0.5809
 epoch: 47, train_loss: 0.5969, test_loss: 1.4586, test_f1: 0.5672
 epoch: 48, train_loss: 0.5877, test_loss: 1.4787, test_f1: 0.5706
 epoch: 49, train_loss: 0.5846, test_loss: 1.4287, test_f1: 0.5791
 epoch: 50, train_loss: 0.5801, test_loss: 1.3326, test_f1: 0.5767
 epoch: 51, train_loss: 0.5395, test_loss: 1.4699, test_f1: 0.5601
 epoch: 52, train_loss: 0.5361, test_loss: 1.5326, test_f1: 0.5561
 epoch: 53, train_loss: 0.5200, test_loss: 1.5309, test_f1: 0.5579
 epoch: 54, train_loss: 0.4958, test_loss: 1.5843, test_f1: 0.5526
 epoch: 55, train_loss: 0.4916, test_loss: 1.6005, test_f1: 0.5447
 epoch: 56, train_loss: 0.4865, test_loss: 1.5237, test_f1: 0.5678
 epoch: 57, train_loss: 0.4949, test_loss: 1.4992, test_f1: 0.6283
 epoch: 58, train_loss: 0.4716, test_loss: 1.5805, test_f1: 0.5803
 epoch: 59, train_loss: 0.4791, test_loss: 1.5210, test_f1: 0.5971
 epoch: 60, train_loss: 0.4528, test_loss: 1.5199, test_f1: 0.5913
 epoch: 61, train_loss: 0.4602, test_loss: 1.6719, test_f1: 0.5775
 epoch: 62, train_loss: 0.4476, test_loss: 1.6255, test_f1: 0.5677
 epoch: 63, train_loss: 0.4453, test_loss: 1.7580, test_f1: 0.5624
 epoch: 64, train_loss: 0.4559, test_loss: 1.7648, test_f1: 0.5888
 epoch: 65, train_loss: 0.4502, test_loss: 1.8425, test_f1: 0.5437
 epoch: 66, train_loss: 0.4615, test_loss: 1.8097, test_f1: 0.5651
 epoch: 67, train_loss: 0.4469, test_loss: 1.9242, test_f1: 0.5215
 epoch: 68, train_loss: 0.4324, test_loss: 1.7600, test_f1: 0.5717
 epoch: 69, train_loss: 0.4294, test_loss: 1.9380, test_f1: 0.6015
 epoch: 70, train_loss: 0.4307, test_loss: 1.7780, test_f1: 0.5995
 epoch: 71, train_loss: 0.4271, test_loss: 1.9350, test_f1: 0.5702
 epoch: 72, train_loss: 0.4226, test_loss: 1.7719, test_f1: 0.5926
 epoch: 73, train_loss: 0.4096, test_loss: 1.9131, test_f1: 0.5940
 epoch: 74, train_loss: 0.4355, test_loss: 1.6866, test_f1: 0.6017
 epoch: 75, train_loss: 0.4239, test_loss: 1.8381, test_f1: 0.6140
 epoch: 76, train_loss: 0.4218, test_loss: 1.8488, test_f1: 0.5901
 epoch: 77, train_loss: 0.3964, test_loss: 2.0982, test_f1: 0.5439
 epoch: 78, train_loss: 0.4289, test_loss: 2.0060, test_f1: 0.5528
 epoch: 79, train_loss: 0.4116, test_loss: 1.7533, test_f1: 0.5901
 epoch: 80, train_loss: 0.3849, test_loss: 1.8070, test_f1: 0.5964
 epoch: 81, train_loss: 0.3818, test_loss: 2.3337, test_f1: 0.5512
 epoch: 82, train_loss: 0.3900, test_loss: 1.9237, test_f1: 0.5953
 epoch: 83, train_loss: 0.3996, test_loss: 1.8059, test_f1: 0.6162
 epoch: 84, train_loss: 0.3803, test_loss: 1.7019, test_f1: 0.6087
 epoch: 85, train_loss: 0.3717, test_loss: 2.0480, test_f1: 0.6172
 epoch: 86, train_loss: 0.3768, test_loss: 1.9271, test_f1: 0.6246
 epoch: 87, train_loss: 0.3686, test_loss: 2.3179, test_f1: 0.5606
 epoch: 88, train_loss: 0.3807, test_loss: 2.1205, test_f1: 0.5736
 epoch: 89, train_loss: 0.3773, test_loss: 2.2337, test_f1: 0.5806
 epoch: 90, train_loss: 0.3455, test_loss: 2.5199, test_f1: 0.5789
 epoch: 91, train_loss: 0.3665, test_loss: 1.9782, test_f1: 0.6104
 epoch: 92, train_loss: 0.3522, test_loss: 2.2791, test_f1: 0.5804
 epoch: 93, train_loss: 0.3738, test_loss: 1.9354, test_f1: 0.5780
 epoch: 94, train_loss: 0.3465, test_loss: 2.0429, test_f1: 0.5442
 epoch: 95, train_loss: 0.3694, test_loss: 2.0951, test_f1: 0.5731
 epoch: 96, train_loss: 0.3254, test_loss: 1.8370, test_f1: 0.5783
 epoch: 97, train_loss: 0.3451, test_loss: 2.0040, test_f1: 0.5601
 epoch: 98, train_loss: 0.3642, test_loss: 2.2578, test_f1: 0.5967
 epoch: 99, train_loss: 0.3439, test_loss: 2.2419, test_f1: 0.5406
##################ITERATION #6 ****************************************
 epoch: 0, train_loss: 1.3011, test_loss: 1.3110, test_f1: 0.4398
 epoch: 1, train_loss: 1.1267, test_loss: 1.1852, test_f1: 0.4695
 epoch: 2, train_loss: 1.0836, test_loss: 1.2017, test_f1: 0.5027
 epoch: 3, train_loss: 1.0323, test_loss: 1.0352, test_f1: 0.5646
 epoch: 4, train_loss: 0.9943, test_loss: 1.1489, test_f1: 0.5437
 epoch: 5, train_loss: 0.9866, test_loss: 1.1173, test_f1: 0.5621
 epoch: 6, train_loss: 0.9617, test_loss: 1.1795, test_f1: 0.5192
 epoch: 7, train_loss: 0.9198, test_loss: 1.1717, test_f1: 0.5392
 epoch: 8, train_loss: 0.9255, test_loss: 1.1737, test_f1: 0.5473
 epoch: 9, train_loss: 0.8886, test_loss: 1.2790, test_f1: 0.5152
 epoch: 10, train_loss: 0.8658, test_loss: 1.0739, test_f1: 0.5655
 epoch: 11, train_loss: 0.8579, test_loss: 1.1398, test_f1: 0.5746
 epoch: 12, train_loss: 0.8611, test_loss: 1.0928, test_f1: 0.5379
 epoch: 13, train_loss: 0.8431, test_loss: 1.1998, test_f1: 0.5965
 epoch: 14, train_loss: 0.8150, test_loss: 1.1117, test_f1: 0.5917
 epoch: 15, train_loss: 0.8151, test_loss: 1.2379, test_f1: 0.5573
 epoch: 16, train_loss: 0.8063, test_loss: 1.2285, test_f1: 0.5957
 epoch: 17, train_loss: 0.7816, test_loss: 1.2081, test_f1: 0.6079
 epoch: 18, train_loss: 0.7667, test_loss: 1.3070, test_f1: 0.5830
 epoch: 19, train_loss: 0.7885, test_loss: 1.2000, test_f1: 0.5867
 epoch: 20, train_loss: 0.7765, test_loss: 1.3146, test_f1: 0.5597
 epoch: 21, train_loss: 0.7607, test_loss: 1.1585, test_f1: 0.5931
 epoch: 22, train_loss: 0.7360, test_loss: 1.1583, test_f1: 0.5800
 epoch: 23, train_loss: 0.7236, test_loss: 1.1654, test_f1: 0.5665
 epoch: 24, train_loss: 0.7230, test_loss: 1.2390, test_f1: 0.5845
 epoch: 25, train_loss: 0.7082, test_loss: 1.1684, test_f1: 0.5990
 epoch: 26, train_loss: 0.7328, test_loss: 1.5329, test_f1: 0.5364
 epoch: 27, train_loss: 0.7004, test_loss: 1.2293, test_f1: 0.5839
 epoch: 28, train_loss: 0.6808, test_loss: 1.2044, test_f1: 0.5813
 epoch: 29, train_loss: 0.6949, test_loss: 1.3880, test_f1: 0.5926
 epoch: 30, train_loss: 0.6698, test_loss: 1.5187, test_f1: 0.5717
 epoch: 31, train_loss: 0.6782, test_loss: 1.5315, test_f1: 0.5497
 epoch: 32, train_loss: 0.6493, test_loss: 1.4301, test_f1: 0.5702
 epoch: 33, train_loss: 0.6280, test_loss: 1.4470, test_f1: 0.6124
 epoch: 34, train_loss: 0.6568, test_loss: 1.5804, test_f1: 0.5871
 epoch: 35, train_loss: 0.6232, test_loss: 1.3231, test_f1: 0.5915
 epoch: 36, train_loss: 0.6270, test_loss: 1.5952, test_f1: 0.6063
 epoch: 37, train_loss: 0.6012, test_loss: 1.6664, test_f1: 0.5833
 epoch: 38, train_loss: 0.6414, test_loss: 1.5253, test_f1: 0.5940
 epoch: 39, train_loss: 0.6258, test_loss: 1.6060, test_f1: 0.5775
 epoch: 40, train_loss: 0.6031, test_loss: 1.4374, test_f1: 0.5975
 epoch: 41, train_loss: 0.6116, test_loss: 1.3821, test_f1: 0.6107
 epoch: 42, train_loss: 0.6059, test_loss: 1.3451, test_f1: 0.5873
 epoch: 43, train_loss: 0.6193, test_loss: 1.4037, test_f1: 0.5750
 epoch: 44, train_loss: 0.5809, test_loss: 1.6856, test_f1: 0.5696
 epoch: 45, train_loss: 0.5631, test_loss: 1.8566, test_f1: 0.5626
 epoch: 46, train_loss: 0.5653, test_loss: 1.7823, test_f1: 0.5657
 epoch: 47, train_loss: 0.5953, test_loss: 1.5608, test_f1: 0.6015
 epoch: 48, train_loss: 0.5626, test_loss: 1.7788, test_f1: 0.6188
 epoch: 49, train_loss: 0.5637, test_loss: 1.4694, test_f1: 0.5727
 epoch: 50, train_loss: 0.5551, test_loss: 1.6752, test_f1: 0.5720
 epoch: 51, train_loss: 0.5233, test_loss: 1.8345, test_f1: 0.5821
 epoch: 52, train_loss: 0.5059, test_loss: 1.7361, test_f1: 0.6260
 epoch: 53, train_loss: 0.4784, test_loss: 1.8304, test_f1: 0.6161
 epoch: 54, train_loss: 0.4750, test_loss: 1.8196, test_f1: 0.5588
 epoch: 55, train_loss: 0.4554, test_loss: 1.7005, test_f1: 0.5724
 epoch: 56, train_loss: 0.4487, test_loss: 1.7951, test_f1: 0.5726
 epoch: 57, train_loss: 0.4516, test_loss: 2.0792, test_f1: 0.5892
 epoch: 58, train_loss: 0.4327, test_loss: 2.2055, test_f1: 0.6160
 epoch: 59, train_loss: 0.4263, test_loss: 1.9767, test_f1: 0.5540
 epoch: 60, train_loss: 0.4572, test_loss: 1.8940, test_f1: 0.6314
 epoch: 61, train_loss: 0.4291, test_loss: 1.9045, test_f1: 0.6012
 epoch: 62, train_loss: 0.4217, test_loss: 1.8508, test_f1: 0.6456
 epoch: 63, train_loss: 0.4196, test_loss: 2.0957, test_f1: 0.6528
 epoch: 64, train_loss: 0.4185, test_loss: 2.1625, test_f1: 0.5767
 epoch: 65, train_loss: 0.4240, test_loss: 2.1457, test_f1: 0.5955
 epoch: 66, train_loss: 0.4360, test_loss: 1.9182, test_f1: 0.5954
 epoch: 67, train_loss: 0.4190, test_loss: 2.0881, test_f1: 0.6210
 epoch: 68, train_loss: 0.4147, test_loss: 2.2659, test_f1: 0.5829
 epoch: 69, train_loss: 0.4186, test_loss: 1.9651, test_f1: 0.6401
 epoch: 70, train_loss: 0.4035, test_loss: 2.1847, test_f1: 0.6168
 epoch: 71, train_loss: 0.4176, test_loss: 2.0829, test_f1: 0.5827
 epoch: 72, train_loss: 0.4067, test_loss: 1.9669, test_f1: 0.6190
 epoch: 73, train_loss: 0.3837, test_loss: 2.2340, test_f1: 0.6198
 epoch: 74, train_loss: 0.3760, test_loss: 2.5660, test_f1: 0.5913
 epoch: 75, train_loss: 0.3759, test_loss: 2.2218, test_f1: 0.6267
 epoch: 76, train_loss: 0.3764, test_loss: 2.4208, test_f1: 0.6207
 epoch: 77, train_loss: 0.3865, test_loss: 2.2592, test_f1: 0.6246
 epoch: 78, train_loss: 0.3768, test_loss: 2.2270, test_f1: 0.6240
 epoch: 79, train_loss: 0.3548, test_loss: 2.1417, test_f1: 0.5959
 epoch: 80, train_loss: 0.3694, test_loss: 2.0279, test_f1: 0.6578
 epoch: 81, train_loss: 0.3551, test_loss: 2.4333, test_f1: 0.6188
 epoch: 82, train_loss: 0.3319, test_loss: 2.3847, test_f1: 0.6151
 epoch: 83, train_loss: 0.3514, test_loss: 2.3045, test_f1: 0.6120
 epoch: 84, train_loss: 0.3692, test_loss: 2.4566, test_f1: 0.6094
 epoch: 85, train_loss: 0.3327, test_loss: 2.6967, test_f1: 0.6097
 epoch: 86, train_loss: 0.3578, test_loss: 2.5719, test_f1: 0.5930
 epoch: 87, train_loss: 0.3494, test_loss: 2.9179, test_f1: 0.6299
 epoch: 88, train_loss: 0.3387, test_loss: 2.4729, test_f1: 0.6311
 epoch: 89, train_loss: 0.3551, test_loss: 2.5368, test_f1: 0.6357
 epoch: 90, train_loss: 0.3354, test_loss: 3.1561, test_f1: 0.6002
 epoch: 91, train_loss: 0.3157, test_loss: 2.9184, test_f1: 0.6020
 epoch: 92, train_loss: 0.3249, test_loss: 2.7567, test_f1: 0.6065
 epoch: 93, train_loss: 0.3447, test_loss: 2.5910, test_f1: 0.6494
 epoch: 94, train_loss: 0.3448, test_loss: 3.1064, test_f1: 0.6058
 epoch: 95, train_loss: 0.3307, test_loss: 2.9809, test_f1: 0.6103
 epoch: 96, train_loss: 0.2948, test_loss: 2.2303, test_f1: 0.5962
 epoch: 97, train_loss: 0.3423, test_loss: 2.5445, test_f1: 0.5910
 epoch: 98, train_loss: 0.3096, test_loss: 2.6870, test_f1: 0.6395
 epoch: 99, train_loss: 0.3306, test_loss: 3.2836, test_f1: 0.5600
##################ITERATION #7 ****************************************
 epoch: 0, train_loss: 1.3239, test_loss: 1.2770, test_f1: 0.3371
 epoch: 1, train_loss: 1.1350, test_loss: 1.3521, test_f1: 0.4491
 epoch: 2, train_loss: 1.0667, test_loss: 1.3856, test_f1: 0.5354
 epoch: 3, train_loss: 1.0232, test_loss: 1.3107, test_f1: 0.5535
 epoch: 4, train_loss: 1.0035, test_loss: 1.2541, test_f1: 0.5368
 epoch: 5, train_loss: 0.9873, test_loss: 1.0842, test_f1: 0.5665
 epoch: 6, train_loss: 0.9358, test_loss: 1.0306, test_f1: 0.6061
 epoch: 7, train_loss: 0.9075, test_loss: 1.0469, test_f1: 0.5471
 epoch: 8, train_loss: 0.8905, test_loss: 1.0859, test_f1: 0.5559
 epoch: 9, train_loss: 0.8860, test_loss: 1.0654, test_f1: 0.5614
 epoch: 10, train_loss: 0.8785, test_loss: 1.0806, test_f1: 0.5500
 epoch: 11, train_loss: 0.8444, test_loss: 1.0944, test_f1: 0.5953
 epoch: 12, train_loss: 0.8110, test_loss: 1.0334, test_f1: 0.5791
 epoch: 13, train_loss: 0.8351, test_loss: 1.0970, test_f1: 0.6219
 epoch: 14, train_loss: 0.8119, test_loss: 1.1661, test_f1: 0.5327
 epoch: 15, train_loss: 0.7916, test_loss: 1.0993, test_f1: 0.5886
 epoch: 16, train_loss: 0.7756, test_loss: 1.1028, test_f1: 0.6179
 epoch: 17, train_loss: 0.7768, test_loss: 1.0508, test_f1: 0.6020
 epoch: 18, train_loss: 0.7692, test_loss: 1.1414, test_f1: 0.5858
 epoch: 19, train_loss: 0.7386, test_loss: 1.0851, test_f1: 0.6089
 epoch: 20, train_loss: 0.7169, test_loss: 1.2538, test_f1: 0.5853
 epoch: 21, train_loss: 0.7077, test_loss: 1.2532, test_f1: 0.5748
 epoch: 22, train_loss: 0.7328, test_loss: 1.1867, test_f1: 0.5886
 epoch: 23, train_loss: 0.7233, test_loss: 1.0918, test_f1: 0.6285
 epoch: 24, train_loss: 0.7025, test_loss: 1.2331, test_f1: 0.5362
 epoch: 25, train_loss: 0.7225, test_loss: 1.2981, test_f1: 0.5622
 epoch: 26, train_loss: 0.6953, test_loss: 1.2706, test_f1: 0.5785
 epoch: 27, train_loss: 0.6601, test_loss: 1.3085, test_f1: 0.5817
 epoch: 28, train_loss: 0.6812, test_loss: 1.4426, test_f1: 0.5395
 epoch: 29, train_loss: 0.6325, test_loss: 1.4268, test_f1: 0.5223
 epoch: 30, train_loss: 0.6281, test_loss: 1.3860, test_f1: 0.5502
 epoch: 31, train_loss: 0.6319, test_loss: 1.5088, test_f1: 0.5630
 epoch: 32, train_loss: 0.6201, test_loss: 1.4961, test_f1: 0.5908
 epoch: 33, train_loss: 0.6292, test_loss: 1.4529, test_f1: 0.5734
 epoch: 34, train_loss: 0.6208, test_loss: 1.5028, test_f1: 0.5724
 epoch: 35, train_loss: 0.6140, test_loss: 1.2860, test_f1: 0.5797
 epoch: 36, train_loss: 0.5820, test_loss: 1.3090, test_f1: 0.6207
 epoch: 37, train_loss: 0.5649, test_loss: 1.5360, test_f1: 0.5977
 epoch: 38, train_loss: 0.5684, test_loss: 1.6829, test_f1: 0.5327
 epoch: 39, train_loss: 0.5979, test_loss: 1.6211, test_f1: 0.5418
 epoch: 40, train_loss: 0.5662, test_loss: 1.5593, test_f1: 0.6165
 epoch: 41, train_loss: 0.5852, test_loss: 1.3092, test_f1: 0.5866
 epoch: 42, train_loss: 0.5677, test_loss: 1.3813, test_f1: 0.5873
 epoch: 43, train_loss: 0.5560, test_loss: 1.4272, test_f1: 0.5820
 epoch: 44, train_loss: 0.5490, test_loss: 1.3357, test_f1: 0.5663
 epoch: 45, train_loss: 0.5252, test_loss: 1.5236, test_f1: 0.5872
 epoch: 46, train_loss: 0.5299, test_loss: 1.3536, test_f1: 0.5973
 epoch: 47, train_loss: 0.5225, test_loss: 1.3561, test_f1: 0.6062
 epoch: 48, train_loss: 0.4880, test_loss: 1.7241, test_f1: 0.5573
 epoch: 49, train_loss: 0.5169, test_loss: 1.4979, test_f1: 0.5694
 epoch: 50, train_loss: 0.5156, test_loss: 1.7061, test_f1: 0.5627
 epoch: 51, train_loss: 0.4664, test_loss: 1.5105, test_f1: 0.5818
 epoch: 52, train_loss: 0.4281, test_loss: 1.5954, test_f1: 0.5776
 epoch: 53, train_loss: 0.4293, test_loss: 1.7188, test_f1: 0.5820
 epoch: 54, train_loss: 0.4198, test_loss: 1.7505, test_f1: 0.6200
 epoch: 55, train_loss: 0.4288, test_loss: 1.6116, test_f1: 0.6132
 epoch: 56, train_loss: 0.4360, test_loss: 1.6585, test_f1: 0.6051
 epoch: 57, train_loss: 0.4137, test_loss: 1.6579, test_f1: 0.5907
 epoch: 58, train_loss: 0.4008, test_loss: 1.7839, test_f1: 0.5858
 epoch: 59, train_loss: 0.3876, test_loss: 1.7690, test_f1: 0.5915
 epoch: 60, train_loss: 0.3802, test_loss: 1.9210, test_f1: 0.6237
 epoch: 61, train_loss: 0.3860, test_loss: 2.0698, test_f1: 0.5978
 epoch: 62, train_loss: 0.3869, test_loss: 1.8719, test_f1: 0.6022
 epoch: 63, train_loss: 0.4046, test_loss: 1.8937, test_f1: 0.5769
 epoch: 64, train_loss: 0.3778, test_loss: 1.9385, test_f1: 0.5708
 epoch: 65, train_loss: 0.3751, test_loss: 1.9947, test_f1: 0.5927
 epoch: 66, train_loss: 0.3648, test_loss: 2.1344, test_f1: 0.5953
 epoch: 67, train_loss: 0.3886, test_loss: 2.1278, test_f1: 0.5796
 epoch: 68, train_loss: 0.3647, test_loss: 2.2934, test_f1: 0.5560
 epoch: 69, train_loss: 0.3728, test_loss: 2.2853, test_f1: 0.5589
 epoch: 70, train_loss: 0.3810, test_loss: 2.1882, test_f1: 0.5615
 epoch: 71, train_loss: 0.3531, test_loss: 2.1397, test_f1: 0.5620
 epoch: 72, train_loss: 0.3502, test_loss: 1.9863, test_f1: 0.5822
 epoch: 73, train_loss: 0.3388, test_loss: 2.2826, test_f1: 0.5627
 epoch: 74, train_loss: 0.3343, test_loss: 2.3207, test_f1: 0.5741
 epoch: 75, train_loss: 0.3456, test_loss: 2.2137, test_f1: 0.5968
 epoch: 76, train_loss: 0.3441, test_loss: 2.4403, test_f1: 0.5643
 epoch: 77, train_loss: 0.3544, test_loss: 2.2087, test_f1: 0.6078
 epoch: 78, train_loss: 0.3325, test_loss: 2.2725, test_f1: 0.5744
 epoch: 79, train_loss: 0.3305, test_loss: 2.2056, test_f1: 0.6034
 epoch: 80, train_loss: 0.3597, test_loss: 2.2786, test_f1: 0.5935
 epoch: 81, train_loss: 0.3205, test_loss: 2.2796, test_f1: 0.5803
 epoch: 82, train_loss: 0.3317, test_loss: 2.7194, test_f1: 0.5917
 epoch: 83, train_loss: 0.2898, test_loss: 2.3412, test_f1: 0.5964
 epoch: 84, train_loss: 0.3189, test_loss: 2.3904, test_f1: 0.5985
 epoch: 85, train_loss: 0.3248, test_loss: 2.3898, test_f1: 0.6025
 epoch: 86, train_loss: 0.3294, test_loss: 2.6061, test_f1: 0.5887
 epoch: 87, train_loss: 0.3214, test_loss: 2.8034, test_f1: 0.5838
 epoch: 88, train_loss: 0.3109, test_loss: 2.7338, test_f1: 0.5684
 epoch: 89, train_loss: 0.3032, test_loss: 2.6807, test_f1: 0.5977
 epoch: 90, train_loss: 0.3128, test_loss: 2.5766, test_f1: 0.6174
 epoch: 91, train_loss: 0.3279, test_loss: 2.5326, test_f1: 0.5970
 epoch: 92, train_loss: 0.3173, test_loss: 2.6291, test_f1: 0.5934
 epoch: 93, train_loss: 0.3150, test_loss: 2.9116, test_f1: 0.5950
 epoch: 94, train_loss: 0.2962, test_loss: 2.6675, test_f1: 0.5990
 epoch: 95, train_loss: 0.2968, test_loss: 3.0284, test_f1: 0.5641
 epoch: 96, train_loss: 0.3063, test_loss: 2.6248, test_f1: 0.5926
 epoch: 97, train_loss: 0.2883, test_loss: 2.8823, test_f1: 0.5619
 epoch: 98, train_loss: 0.2994, test_loss: 3.0436, test_f1: 0.5713
 epoch: 99, train_loss: 0.2880, test_loss: 3.1551, test_f1: 0.5505
##################ITERATION #8 ****************************************
 epoch: 0, train_loss: 1.2990, test_loss: 1.2489, test_f1: 0.4779
 epoch: 1, train_loss: 1.1410, test_loss: 1.1416, test_f1: 0.5468
 epoch: 2, train_loss: 1.0686, test_loss: 1.1048, test_f1: 0.5437
 epoch: 3, train_loss: 1.0439, test_loss: 1.1661, test_f1: 0.5999
 epoch: 4, train_loss: 0.9832, test_loss: 1.1416, test_f1: 0.5141
 epoch: 5, train_loss: 0.9799, test_loss: 1.2140, test_f1: 0.5613
 epoch: 6, train_loss: 0.9660, test_loss: 1.1152, test_f1: 0.5827
 epoch: 7, train_loss: 0.9390, test_loss: 1.1611, test_f1: 0.5298
 epoch: 8, train_loss: 0.9030, test_loss: 1.0711, test_f1: 0.5638
 epoch: 9, train_loss: 0.9118, test_loss: 1.1105, test_f1: 0.5879
 epoch: 10, train_loss: 0.9040, test_loss: 1.2664, test_f1: 0.5609
 epoch: 11, train_loss: 0.8592, test_loss: 1.2530, test_f1: 0.4954
 epoch: 12, train_loss: 0.8457, test_loss: 1.1128, test_f1: 0.5565
 epoch: 13, train_loss: 0.8237, test_loss: 1.1265, test_f1: 0.5957
 epoch: 14, train_loss: 0.8236, test_loss: 1.1656, test_f1: 0.5892
 epoch: 15, train_loss: 0.7838, test_loss: 1.2021, test_f1: 0.5402
 epoch: 16, train_loss: 0.8092, test_loss: 1.2490, test_f1: 0.5513
 epoch: 17, train_loss: 0.7543, test_loss: 1.1607, test_f1: 0.5573
 epoch: 18, train_loss: 0.7614, test_loss: 1.2665, test_f1: 0.5878
 epoch: 19, train_loss: 0.7714, test_loss: 1.2187, test_f1: 0.5895
 epoch: 20, train_loss: 0.7674, test_loss: 1.2241, test_f1: 0.5556
 epoch: 21, train_loss: 0.7311, test_loss: 1.3461, test_f1: 0.5779
 epoch: 22, train_loss: 0.7488, test_loss: 1.3735, test_f1: 0.5828
 epoch: 23, train_loss: 0.7252, test_loss: 1.2127, test_f1: 0.5646
 epoch: 24, train_loss: 0.7186, test_loss: 1.2485, test_f1: 0.6045
 epoch: 25, train_loss: 0.7456, test_loss: 1.3576, test_f1: 0.5554
 epoch: 26, train_loss: 0.7056, test_loss: 1.2051, test_f1: 0.5879
 epoch: 27, train_loss: 0.6927, test_loss: 1.2495, test_f1: 0.5860
 epoch: 28, train_loss: 0.6921, test_loss: 1.3081, test_f1: 0.5688
 epoch: 29, train_loss: 0.6991, test_loss: 1.3999, test_f1: 0.5425
 epoch: 30, train_loss: 0.6910, test_loss: 1.2653, test_f1: 0.6111
 epoch: 31, train_loss: 0.6863, test_loss: 1.2640, test_f1: 0.5977
 epoch: 32, train_loss: 0.6673, test_loss: 1.3277, test_f1: 0.6135
 epoch: 33, train_loss: 0.6615, test_loss: 1.6207, test_f1: 0.5413
 epoch: 34, train_loss: 0.6551, test_loss: 1.3968, test_f1: 0.5616
 epoch: 35, train_loss: 0.6157, test_loss: 1.4678, test_f1: 0.5931
 epoch: 36, train_loss: 0.6261, test_loss: 1.3882, test_f1: 0.5735
 epoch: 37, train_loss: 0.6462, test_loss: 1.5951, test_f1: 0.6008
 epoch: 38, train_loss: 0.6555, test_loss: 1.3543, test_f1: 0.5908
 epoch: 39, train_loss: 0.6198, test_loss: 1.6287, test_f1: 0.5325
 epoch: 40, train_loss: 0.6066, test_loss: 1.5844, test_f1: 0.6050
 epoch: 41, train_loss: 0.6053, test_loss: 1.4016, test_f1: 0.6273
 epoch: 42, train_loss: 0.5784, test_loss: 1.4460, test_f1: 0.6013
 epoch: 43, train_loss: 0.5910, test_loss: 1.4724, test_f1: 0.6224
 epoch: 44, train_loss: 0.5879, test_loss: 1.8023, test_f1: 0.5671
 epoch: 45, train_loss: 0.5907, test_loss: 1.5294, test_f1: 0.5855
 epoch: 46, train_loss: 0.5879, test_loss: 1.4985, test_f1: 0.5845
 epoch: 47, train_loss: 0.5695, test_loss: 1.6818, test_f1: 0.6032
 epoch: 48, train_loss: 0.5615, test_loss: 1.4716, test_f1: 0.5750
 epoch: 49, train_loss: 0.5871, test_loss: 1.6365, test_f1: 0.5130
 epoch: 50, train_loss: 0.5896, test_loss: 1.5460, test_f1: 0.6033
 epoch: 51, train_loss: 0.5140, test_loss: 1.4675, test_f1: 0.5716
 epoch: 52, train_loss: 0.4875, test_loss: 1.7069, test_f1: 0.5992
 epoch: 53, train_loss: 0.4870, test_loss: 1.6813, test_f1: 0.5840
 epoch: 54, train_loss: 0.4621, test_loss: 1.7216, test_f1: 0.5870
 epoch: 55, train_loss: 0.4688, test_loss: 1.6803, test_f1: 0.5853
 epoch: 56, train_loss: 0.4808, test_loss: 1.8869, test_f1: 0.5833
 epoch: 57, train_loss: 0.4567, test_loss: 1.6425, test_f1: 0.5939
 epoch: 58, train_loss: 0.4588, test_loss: 1.8416, test_f1: 0.5584
 epoch: 59, train_loss: 0.4510, test_loss: 1.7677, test_f1: 0.6016
 epoch: 60, train_loss: 0.4637, test_loss: 1.8990, test_f1: 0.5768
 epoch: 61, train_loss: 0.4343, test_loss: 1.8492, test_f1: 0.5897
 epoch: 62, train_loss: 0.4539, test_loss: 1.8253, test_f1: 0.5644
 epoch: 63, train_loss: 0.4063, test_loss: 1.7790, test_f1: 0.5920
 epoch: 64, train_loss: 0.4187, test_loss: 1.9093, test_f1: 0.6140
 epoch: 65, train_loss: 0.4360, test_loss: 2.1249, test_f1: 0.5820
 epoch: 66, train_loss: 0.4021, test_loss: 2.0690, test_f1: 0.6051
 epoch: 67, train_loss: 0.4155, test_loss: 1.9499, test_f1: 0.5789
 epoch: 68, train_loss: 0.4025, test_loss: 1.8666, test_f1: 0.5906
 epoch: 69, train_loss: 0.4331, test_loss: 1.9375, test_f1: 0.5770
 epoch: 70, train_loss: 0.3950, test_loss: 2.0439, test_f1: 0.5916
 epoch: 71, train_loss: 0.3907, test_loss: 2.0259, test_f1: 0.6029
 epoch: 72, train_loss: 0.4181, test_loss: 2.0662, test_f1: 0.5759
 epoch: 73, train_loss: 0.3883, test_loss: 2.1159, test_f1: 0.6161
 epoch: 74, train_loss: 0.3966, test_loss: 2.2315, test_f1: 0.5797
 epoch: 75, train_loss: 0.3975, test_loss: 2.3292, test_f1: 0.5885
 epoch: 76, train_loss: 0.4083, test_loss: 2.6158, test_f1: 0.5657
 epoch: 77, train_loss: 0.3983, test_loss: 2.0986, test_f1: 0.5992
 epoch: 78, train_loss: 0.3959, test_loss: 2.2708, test_f1: 0.5727
 epoch: 79, train_loss: 0.3925, test_loss: 2.4250, test_f1: 0.5663
 epoch: 80, train_loss: 0.3948, test_loss: 2.4636, test_f1: 0.5935
 epoch: 81, train_loss: 0.3796, test_loss: 2.4291, test_f1: 0.5831
 epoch: 82, train_loss: 0.3719, test_loss: 2.4535, test_f1: 0.6040
 epoch: 83, train_loss: 0.3629, test_loss: 2.5810, test_f1: 0.5982
 epoch: 84, train_loss: 0.3494, test_loss: 2.4345, test_f1: 0.5984
 epoch: 85, train_loss: 0.3475, test_loss: 2.4975, test_f1: 0.5657
 epoch: 86, train_loss: 0.3761, test_loss: 2.3157, test_f1: 0.5742
 epoch: 87, train_loss: 0.3643, test_loss: 2.2732, test_f1: 0.5591
 epoch: 88, train_loss: 0.3476, test_loss: 2.7367, test_f1: 0.5892
 epoch: 89, train_loss: 0.4040, test_loss: 2.3899, test_f1: 0.5572
 epoch: 90, train_loss: 0.3849, test_loss: 2.5713, test_f1: 0.6000
 epoch: 91, train_loss: 0.3691, test_loss: 2.5821, test_f1: 0.5910
 epoch: 92, train_loss: 0.3931, test_loss: 2.2017, test_f1: 0.5826
 epoch: 93, train_loss: 0.3892, test_loss: 2.2644, test_f1: 0.6066
 epoch: 94, train_loss: 0.3525, test_loss: 2.3837, test_f1: 0.5856
 epoch: 95, train_loss: 0.3527, test_loss: 2.3084, test_f1: 0.5915
 epoch: 96, train_loss: 0.3395, test_loss: 2.2065, test_f1: 0.5963
 epoch: 97, train_loss: 0.3441, test_loss: 2.3374, test_f1: 0.5847
 epoch: 98, train_loss: 0.3497, test_loss: 2.0786, test_f1: 0.5850
 epoch: 99, train_loss: 0.3573, test_loss: 2.3274, test_f1: 0.5654
##################ITERATION #9 ****************************************
 epoch: 0, train_loss: 1.3449, test_loss: 1.2991, test_f1: 0.4425
 epoch: 1, train_loss: 1.1791, test_loss: 1.2321, test_f1: 0.4674
 epoch: 2, train_loss: 1.0825, test_loss: 1.2248, test_f1: 0.4764
 epoch: 3, train_loss: 1.0233, test_loss: 1.1075, test_f1: 0.5357
 epoch: 4, train_loss: 0.9941, test_loss: 1.1170, test_f1: 0.5433
 epoch: 5, train_loss: 0.9744, test_loss: 1.1471, test_f1: 0.5307
 epoch: 6, train_loss: 0.9248, test_loss: 1.2303, test_f1: 0.5042
 epoch: 7, train_loss: 0.9196, test_loss: 1.1372, test_f1: 0.5886
 epoch: 8, train_loss: 0.8761, test_loss: 1.1010, test_f1: 0.6001
 epoch: 9, train_loss: 0.8815, test_loss: 1.1143, test_f1: 0.5848
 epoch: 10, train_loss: 0.8405, test_loss: 1.3232, test_f1: 0.5153
 epoch: 11, train_loss: 0.8517, test_loss: 1.3306, test_f1: 0.5461
 epoch: 12, train_loss: 0.8143, test_loss: 1.1824, test_f1: 0.5788
 epoch: 13, train_loss: 0.7836, test_loss: 1.3301, test_f1: 0.5745
 epoch: 14, train_loss: 0.8099, test_loss: 1.3693, test_f1: 0.5156
 epoch: 15, train_loss: 0.7565, test_loss: 1.6047, test_f1: 0.5728
 epoch: 16, train_loss: 0.7731, test_loss: 1.3710, test_f1: 0.5252
 epoch: 17, train_loss: 0.7436, test_loss: 1.2447, test_f1: 0.5701
 epoch: 18, train_loss: 0.7412, test_loss: 1.3330, test_f1: 0.5258
 epoch: 19, train_loss: 0.7347, test_loss: 1.2441, test_f1: 0.6037
 epoch: 20, train_loss: 0.7133, test_loss: 1.4646, test_f1: 0.5569
 epoch: 21, train_loss: 0.7176, test_loss: 1.6076, test_f1: 0.4755
 epoch: 22, train_loss: 0.6891, test_loss: 1.5483, test_f1: 0.5255
 epoch: 23, train_loss: 0.6904, test_loss: 1.5027, test_f1: 0.5771
 epoch: 24, train_loss: 0.7339, test_loss: 1.7340, test_f1: 0.5557
 epoch: 25, train_loss: 0.7018, test_loss: 1.5723, test_f1: 0.5806
 epoch: 26, train_loss: 0.6745, test_loss: 1.5166, test_f1: 0.5875
 epoch: 27, train_loss: 0.6577, test_loss: 1.7643, test_f1: 0.5607
 epoch: 28, train_loss: 0.6308, test_loss: 1.5556, test_f1: 0.5591
 epoch: 29, train_loss: 0.6188, test_loss: 1.6746, test_f1: 0.5697
 epoch: 30, train_loss: 0.6205, test_loss: 1.4319, test_f1: 0.5726
 epoch: 31, train_loss: 0.6153, test_loss: 1.9408, test_f1: 0.5672
 epoch: 32, train_loss: 0.6347, test_loss: 1.6200, test_f1: 0.5421
 epoch: 33, train_loss: 0.5955, test_loss: 1.9005, test_f1: 0.5415
 epoch: 34, train_loss: 0.5817, test_loss: 1.6968, test_f1: 0.5924
 epoch: 35, train_loss: 0.5567, test_loss: 1.5597, test_f1: 0.5772
 epoch: 36, train_loss: 0.6007, test_loss: 1.4983, test_f1: 0.5782
 epoch: 37, train_loss: 0.5641, test_loss: 1.7417, test_f1: 0.5421
 epoch: 38, train_loss: 0.5537, test_loss: 1.7691, test_f1: 0.5807
 epoch: 39, train_loss: 0.5391, test_loss: 1.8878, test_f1: 0.5887
 epoch: 40, train_loss: 0.5386, test_loss: 1.8448, test_f1: 0.5310
 epoch: 41, train_loss: 0.5113, test_loss: 1.8552, test_f1: 0.5598
 epoch: 42, train_loss: 0.5207, test_loss: 2.0435, test_f1: 0.5662
 epoch: 43, train_loss: 0.5285, test_loss: 1.6475, test_f1: 0.6181
 epoch: 44, train_loss: 0.5725, test_loss: 2.0086, test_f1: 0.5789
 epoch: 45, train_loss: 0.4922, test_loss: 1.8228, test_f1: 0.5743
 epoch: 46, train_loss: 0.4720, test_loss: 2.0503, test_f1: 0.5648
 epoch: 47, train_loss: 0.5125, test_loss: 2.1129, test_f1: 0.5786
 epoch: 48, train_loss: 0.4929, test_loss: 2.2708, test_f1: 0.5543
 epoch: 49, train_loss: 0.4859, test_loss: 2.0300, test_f1: 0.5853
 epoch: 50, train_loss: 0.4782, test_loss: 2.2762, test_f1: 0.5958
 epoch: 51, train_loss: 0.4218, test_loss: 2.2642, test_f1: 0.5493
 epoch: 52, train_loss: 0.3932, test_loss: 2.1767, test_f1: 0.6000
 epoch: 53, train_loss: 0.3884, test_loss: 2.0445, test_f1: 0.5672
 epoch: 54, train_loss: 0.4071, test_loss: 2.5526, test_f1: 0.5947
 epoch: 55, train_loss: 0.3859, test_loss: 2.2588, test_f1: 0.5662
 epoch: 56, train_loss: 0.3857, test_loss: 2.4272, test_f1: 0.6226
 epoch: 57, train_loss: 0.3657, test_loss: 2.1124, test_f1: 0.6089
 epoch: 58, train_loss: 0.3912, test_loss: 2.1367, test_f1: 0.5225
 epoch: 59, train_loss: 0.3841, test_loss: 2.0722, test_f1: 0.5665
 epoch: 60, train_loss: 0.3718, test_loss: 2.3871, test_f1: 0.5713
 epoch: 61, train_loss: 0.3636, test_loss: 2.2980, test_f1: 0.5498
 epoch: 62, train_loss: 0.3423, test_loss: 2.6409, test_f1: 0.5729
 epoch: 63, train_loss: 0.3364, test_loss: 2.3954, test_f1: 0.5974
 epoch: 64, train_loss: 0.3286, test_loss: 2.4659, test_f1: 0.5689
 epoch: 65, train_loss: 0.3194, test_loss: 2.5969, test_f1: 0.5210
 epoch: 66, train_loss: 0.3579, test_loss: 2.2335, test_f1: 0.5608
 epoch: 67, train_loss: 0.3211, test_loss: 2.4551, test_f1: 0.5928
 epoch: 68, train_loss: 0.3580, test_loss: 2.4125, test_f1: 0.5695
 epoch: 69, train_loss: 0.3508, test_loss: 2.1726, test_f1: 0.5594
 epoch: 70, train_loss: 0.3493, test_loss: 2.1743, test_f1: 0.5560
 epoch: 71, train_loss: 0.3327, test_loss: 2.3002, test_f1: 0.5559
 epoch: 72, train_loss: 0.3353, test_loss: 2.4975, test_f1: 0.5303
 epoch: 73, train_loss: 0.3348, test_loss: 2.2635, test_f1: 0.5483
 epoch: 74, train_loss: 0.3251, test_loss: 2.4193, test_f1: 0.5831
 epoch: 75, train_loss: 0.3224, test_loss: 2.3557, test_f1: 0.5494
 epoch: 76, train_loss: 0.3009, test_loss: 2.4719, test_f1: 0.5380
 epoch: 77, train_loss: 0.3129, test_loss: 2.4728, test_f1: 0.5624
 epoch: 78, train_loss: 0.3192, test_loss: 2.2394, test_f1: 0.5539
 epoch: 79, train_loss: 0.3002, test_loss: 2.4802, test_f1: 0.5704
 epoch: 80, train_loss: 0.2812, test_loss: 2.4202, test_f1: 0.5790
 epoch: 81, train_loss: 0.2822, test_loss: 2.5739, test_f1: 0.5841
 epoch: 82, train_loss: 0.3074, test_loss: 3.0126, test_f1: 0.5880
 epoch: 83, train_loss: 0.3026, test_loss: 2.8078, test_f1: 0.5632
 epoch: 84, train_loss: 0.2983, test_loss: 2.5932, test_f1: 0.5608
 epoch: 85, train_loss: 0.2937, test_loss: 2.7951, test_f1: 0.5465
 epoch: 86, train_loss: 0.3043, test_loss: 2.8247, test_f1: 0.5827
 epoch: 87, train_loss: 0.3221, test_loss: 2.8891, test_f1: 0.5847
 epoch: 88, train_loss: 0.2709, test_loss: 2.6987, test_f1: 0.6049
 epoch: 89, train_loss: 0.2979, test_loss: 2.7144, test_f1: 0.5940
 epoch: 90, train_loss: 0.2960, test_loss: 2.6291, test_f1: 0.6013
 epoch: 91, train_loss: 0.2934, test_loss: 2.7056, test_f1: 0.5910
 epoch: 92, train_loss: 0.2649, test_loss: 2.9266, test_f1: 0.6103
 epoch: 93, train_loss: 0.3022, test_loss: 2.7743, test_f1: 0.5525
 epoch: 94, train_loss: 0.2957, test_loss: 2.9681, test_f1: 0.5584
 epoch: 95, train_loss: 0.2810, test_loss: 3.0167, test_f1: 0.6078
 epoch: 96, train_loss: 0.2753, test_loss: 2.6315, test_f1: 0.5881
 epoch: 97, train_loss: 0.3162, test_loss: 2.8409, test_f1: 0.5498
 epoch: 98, train_loss: 0.2849, test_loss: 2.9509, test_f1: 0.5883
 epoch: 99, train_loss: 0.2548, test_loss: 2.6401, test_f1: 0.5628

Training completed in 664.15 seconds
Best F1: 0.6582 at epoch 87
Mean F1 across iterations: 0.6314  0.0152
========================FINAL RESULTS================================
FEGIN weighted F1: 0.6582  0.0152
python main.py --data ltspice_demos --representation component_component --model FEGIN --layers 4 --hiddens 64 --batch_size 32 --lr 0.001 --emb_size 128 --epochs 100 --save_appendix component_component_L4_H64_BS32_LR0.001_E128 --no_val
-----



STDERR:
  File "main.py", line 370, in <module>
    main()
  File "main.py", line 254, in main
    dataset = dataset_class(
  File "/home/philip/projects/ltspice_examples_code_repo/Circuit-Completion-Using-GNNs/component_classification_with_link_prediction_head/evaluation/FEGIN/kernel/circuit_datasets.py", line 15, in __init__
    self.data, self.slices = torch.load(self.processed_paths[0])
  File "/home/philip/.local/lib/python3.8/site-packages/torch/serialization.py", line 1040, in load
    warnings.warn(
  File "/usr/lib/python3.8/warnings.py", line 109, in _showwarnmsg
    sw(msg.message, msg.category, msg.filename, msg.lineno,
  File "main.py", line 47, in warn_with_traceback
    traceback.print_stack(file=log)
/home/philip/projects/ltspice_examples_code_repo/Circuit-Completion-Using-GNNs/component_classification_with_link_prediction_head/evaluation/FEGIN/kernel/circuit_datasets.py:15: FutureWarning: You are using `torch.load` with `weights_only=False` (the current default value), which uses the default pickle module implicitly. It is possible to construct malicious pickle data which will execute arbitrary code during unpickling (See https://github.com/pytorch/pytorch/blob/main/SECURITY.md#untrusted-models for more details). In a future release, the default value for `weights_only` will be flipped to `True`. This limits the functions that could be executed during unpickling. Arbitrary objects will no longer be allowed to be loaded via this mode unless they are explicitly allowlisted by the user via `torch.serialization.add_safe_globals`. We recommend you start setting `weights_only=True` for any use case where you don't have full control of the loaded file. Please open an issue on GitHub for any issues related to this experimental feature.
  self.data, self.slices = torch.load(self.processed_paths[0])
