STDOUT:
Results will be saved in /home/philip/projects/ltspice_examples_code_repo/Circuit-Completion-Using-GNNs/component_classification_with_link_prediction_head/evaluation/FEGIN/results/model_FEGIN_dataset_ltspice_demos
Command line input: python main.py --data ltspice_demos --representation component_net --model FEGIN --layers 5 --hiddens 64 --batch_size 32 --lr 0.0001 --emb_size 250 --epochs 100 --save_appendix component_net_L5_H64_BS32_LR0.0001_E250 --no_val
 is saved.
-----
ltspice_demos - FEGIN
Using 5 layers, 64 hidden units, h = 2
Loading component_net representation dataset
ENTERED
Training FEGIN on component_net representation
Train: 1565, Test: 383
##################ITERATION #0 ****************************************
 epoch: 0, train_loss: 1.3810, test_loss: 1.3765, test_f1: 0.1365
 epoch: 1, train_loss: 1.3391, test_loss: 1.3425, test_f1: 0.2527
 epoch: 2, train_loss: 1.2973, test_loss: 1.3028, test_f1: 0.2836
 epoch: 3, train_loss: 1.2485, test_loss: 1.2615, test_f1: 0.2801
 epoch: 4, train_loss: 1.2108, test_loss: 1.2396, test_f1: 0.2813
 epoch: 5, train_loss: 1.1811, test_loss: 1.2244, test_f1: 0.2772
 epoch: 6, train_loss: 1.1630, test_loss: 1.2076, test_f1: 0.2909
 epoch: 7, train_loss: 1.1465, test_loss: 1.1924, test_f1: 0.2779
 epoch: 8, train_loss: 1.1402, test_loss: 1.1841, test_f1: 0.2894
 epoch: 9, train_loss: 1.1304, test_loss: 1.1739, test_f1: 0.2898
 epoch: 10, train_loss: 1.1149, test_loss: 1.1691, test_f1: 0.3249
 epoch: 11, train_loss: 1.1100, test_loss: 1.1562, test_f1: 0.3574
 epoch: 12, train_loss: 1.1010, test_loss: 1.1498, test_f1: 0.4095
 epoch: 13, train_loss: 1.0911, test_loss: 1.1422, test_f1: 0.4019
 epoch: 14, train_loss: 1.0923, test_loss: 1.1314, test_f1: 0.4403
 epoch: 15, train_loss: 1.0826, test_loss: 1.1252, test_f1: 0.4921
 epoch: 16, train_loss: 1.0677, test_loss: 1.1118, test_f1: 0.4926
 epoch: 17, train_loss: 1.0589, test_loss: 1.1159, test_f1: 0.4835
 epoch: 18, train_loss: 1.0420, test_loss: 1.0976, test_f1: 0.4885
 epoch: 19, train_loss: 1.0320, test_loss: 1.0870, test_f1: 0.4813
 epoch: 20, train_loss: 1.0298, test_loss: 1.0785, test_f1: 0.5184
 epoch: 21, train_loss: 1.0264, test_loss: 1.0863, test_f1: 0.5134
 epoch: 22, train_loss: 1.0068, test_loss: 1.0710, test_f1: 0.5090
 epoch: 23, train_loss: 0.9921, test_loss: 1.0579, test_f1: 0.5297
 epoch: 24, train_loss: 0.9882, test_loss: 1.0406, test_f1: 0.5209
 epoch: 25, train_loss: 0.9787, test_loss: 1.0383, test_f1: 0.5450
 epoch: 26, train_loss: 0.9684, test_loss: 1.0289, test_f1: 0.5351
 epoch: 27, train_loss: 0.9649, test_loss: 1.0440, test_f1: 0.5397
 epoch: 28, train_loss: 0.9516, test_loss: 1.0349, test_f1: 0.5363
 epoch: 29, train_loss: 0.9372, test_loss: 1.0603, test_f1: 0.5485
 epoch: 30, train_loss: 0.9427, test_loss: 1.0198, test_f1: 0.5418
 epoch: 31, train_loss: 0.9260, test_loss: 1.0542, test_f1: 0.5461
 epoch: 32, train_loss: 0.9108, test_loss: 1.0594, test_f1: 0.5396
 epoch: 33, train_loss: 0.9073, test_loss: 1.0375, test_f1: 0.5624
 epoch: 34, train_loss: 0.9167, test_loss: 1.0202, test_f1: 0.5643
 epoch: 35, train_loss: 0.8934, test_loss: 1.0277, test_f1: 0.5555
 epoch: 36, train_loss: 0.8964, test_loss: 1.0382, test_f1: 0.5618
 epoch: 37, train_loss: 0.8844, test_loss: 1.0491, test_f1: 0.5471
 epoch: 38, train_loss: 0.8758, test_loss: 1.0349, test_f1: 0.5632
 epoch: 39, train_loss: 0.8765, test_loss: 1.0640, test_f1: 0.5688
 epoch: 40, train_loss: 0.8713, test_loss: 1.0343, test_f1: 0.5635
 epoch: 41, train_loss: 0.8769, test_loss: 1.0558, test_f1: 0.5652
 epoch: 42, train_loss: 0.8612, test_loss: 1.1001, test_f1: 0.5808
 epoch: 43, train_loss: 0.8579, test_loss: 1.1133, test_f1: 0.5677
 epoch: 44, train_loss: 0.8721, test_loss: 1.0983, test_f1: 0.5814
 epoch: 45, train_loss: 0.8431, test_loss: 1.1058, test_f1: 0.5919
 epoch: 46, train_loss: 0.8490, test_loss: 1.0455, test_f1: 0.5645
 epoch: 47, train_loss: 0.8319, test_loss: 1.0925, test_f1: 0.5697
 epoch: 48, train_loss: 0.8336, test_loss: 1.0473, test_f1: 0.5682
 epoch: 49, train_loss: 0.8287, test_loss: 1.0881, test_f1: 0.5467
 epoch: 50, train_loss: 0.8329, test_loss: 1.0904, test_f1: 0.5780
 epoch: 51, train_loss: 0.8194, test_loss: 1.0812, test_f1: 0.5751
 epoch: 52, train_loss: 0.8106, test_loss: 1.0664, test_f1: 0.5760
 epoch: 53, train_loss: 0.8048, test_loss: 1.0785, test_f1: 0.5669
 epoch: 54, train_loss: 0.8075, test_loss: 1.0845, test_f1: 0.5719
 epoch: 55, train_loss: 0.8067, test_loss: 1.0860, test_f1: 0.5676
 epoch: 56, train_loss: 0.7923, test_loss: 1.0765, test_f1: 0.5608
 epoch: 57, train_loss: 0.8120, test_loss: 1.0823, test_f1: 0.5764
 epoch: 58, train_loss: 0.8136, test_loss: 1.0682, test_f1: 0.5709
 epoch: 59, train_loss: 0.8038, test_loss: 1.0792, test_f1: 0.5711
 epoch: 60, train_loss: 0.7965, test_loss: 1.1206, test_f1: 0.5548
 epoch: 61, train_loss: 0.7918, test_loss: 1.1282, test_f1: 0.5717
 epoch: 62, train_loss: 0.7985, test_loss: 1.1084, test_f1: 0.5733
 epoch: 63, train_loss: 0.7883, test_loss: 1.0966, test_f1: 0.5796
 epoch: 64, train_loss: 0.7990, test_loss: 1.1028, test_f1: 0.5622
 epoch: 65, train_loss: 0.7803, test_loss: 1.1062, test_f1: 0.5864
 epoch: 66, train_loss: 0.7784, test_loss: 1.1382, test_f1: 0.5690
 epoch: 67, train_loss: 0.7793, test_loss: 1.1016, test_f1: 0.5930
 epoch: 68, train_loss: 0.7868, test_loss: 1.0816, test_f1: 0.5773
 epoch: 69, train_loss: 0.7742, test_loss: 1.1065, test_f1: 0.5765
 epoch: 70, train_loss: 0.8050, test_loss: 1.1001, test_f1: 0.5740
 epoch: 71, train_loss: 0.7816, test_loss: 1.1105, test_f1: 0.5824
 epoch: 72, train_loss: 0.7620, test_loss: 1.1078, test_f1: 0.5837
 epoch: 73, train_loss: 0.7811, test_loss: 1.1183, test_f1: 0.5774
 epoch: 74, train_loss: 0.7649, test_loss: 1.1107, test_f1: 0.5830
 epoch: 75, train_loss: 0.7789, test_loss: 1.1189, test_f1: 0.5895
 epoch: 76, train_loss: 0.7778, test_loss: 1.1410, test_f1: 0.5826
 epoch: 77, train_loss: 0.7663, test_loss: 1.1745, test_f1: 0.5835
 epoch: 78, train_loss: 0.7839, test_loss: 1.1478, test_f1: 0.5952
 epoch: 79, train_loss: 0.7993, test_loss: 1.1428, test_f1: 0.6001
 epoch: 80, train_loss: 0.7731, test_loss: 1.1111, test_f1: 0.5763
 epoch: 81, train_loss: 0.7827, test_loss: 1.1043, test_f1: 0.5906
 epoch: 82, train_loss: 0.7734, test_loss: 1.0896, test_f1: 0.6003
 epoch: 83, train_loss: 0.7706, test_loss: 1.1317, test_f1: 0.5929
 epoch: 84, train_loss: 0.7587, test_loss: 1.0974, test_f1: 0.5840
 epoch: 85, train_loss: 0.7652, test_loss: 1.1507, test_f1: 0.5846
 epoch: 86, train_loss: 0.7646, test_loss: 1.1312, test_f1: 0.5900
 epoch: 87, train_loss: 0.7668, test_loss: 1.1691, test_f1: 0.5669
 epoch: 88, train_loss: 0.7538, test_loss: 1.1329, test_f1: 0.5874
 epoch: 89, train_loss: 0.7551, test_loss: 1.1505, test_f1: 0.5828
 epoch: 90, train_loss: 0.7537, test_loss: 1.1278, test_f1: 0.5877
 epoch: 91, train_loss: 0.7419, test_loss: 1.1279, test_f1: 0.5919
 epoch: 92, train_loss: 0.7424, test_loss: 1.1772, test_f1: 0.5668
 epoch: 93, train_loss: 0.7619, test_loss: 1.1656, test_f1: 0.5911
 epoch: 94, train_loss: 0.7661, test_loss: 1.1645, test_f1: 0.5886
 epoch: 95, train_loss: 0.7553, test_loss: 1.1626, test_f1: 0.5770
 epoch: 96, train_loss: 0.7399, test_loss: 1.1690, test_f1: 0.5867
 epoch: 97, train_loss: 0.7519, test_loss: 1.1926, test_f1: 0.5719
 epoch: 98, train_loss: 0.7404, test_loss: 1.1845, test_f1: 0.5810
 epoch: 99, train_loss: 0.7341, test_loss: 1.1294, test_f1: 0.5913
##################ITERATION #1 ****************************************
 epoch: 0, train_loss: 1.3010, test_loss: 1.3268, test_f1: 0.1524
 epoch: 1, train_loss: 1.2161, test_loss: 1.2625, test_f1: 0.3436
 epoch: 2, train_loss: 1.1876, test_loss: 1.2371, test_f1: 0.3149
 epoch: 3, train_loss: 1.1595, test_loss: 1.2136, test_f1: 0.3206
 epoch: 4, train_loss: 1.1461, test_loss: 1.1984, test_f1: 0.3054
 epoch: 5, train_loss: 1.1289, test_loss: 1.1852, test_f1: 0.3334
 epoch: 6, train_loss: 1.1127, test_loss: 1.1740, test_f1: 0.3150
 epoch: 7, train_loss: 1.1028, test_loss: 1.1611, test_f1: 0.3729
 epoch: 8, train_loss: 1.0877, test_loss: 1.1471, test_f1: 0.3956
 epoch: 9, train_loss: 1.0810, test_loss: 1.1385, test_f1: 0.4056
 epoch: 10, train_loss: 1.0701, test_loss: 1.1376, test_f1: 0.3663
 epoch: 11, train_loss: 1.0543, test_loss: 1.1168, test_f1: 0.4558
 epoch: 12, train_loss: 1.0440, test_loss: 1.1153, test_f1: 0.4484
 epoch: 13, train_loss: 1.0324, test_loss: 1.1122, test_f1: 0.4692
 epoch: 14, train_loss: 1.0172, test_loss: 1.0929, test_f1: 0.5008
 epoch: 15, train_loss: 1.0189, test_loss: 1.0915, test_f1: 0.5067
 epoch: 16, train_loss: 1.0059, test_loss: 1.0760, test_f1: 0.5237
 epoch: 17, train_loss: 0.9985, test_loss: 1.0654, test_f1: 0.5076
 epoch: 18, train_loss: 0.9771, test_loss: 1.0674, test_f1: 0.5189
 epoch: 19, train_loss: 0.9703, test_loss: 1.0526, test_f1: 0.5215
 epoch: 20, train_loss: 0.9797, test_loss: 1.0734, test_f1: 0.5159
 epoch: 21, train_loss: 0.9632, test_loss: 1.0702, test_f1: 0.5198
 epoch: 22, train_loss: 0.9588, test_loss: 1.0575, test_f1: 0.5467
 epoch: 23, train_loss: 0.9461, test_loss: 1.0620, test_f1: 0.5230
 epoch: 24, train_loss: 0.9417, test_loss: 1.0588, test_f1: 0.5393
 epoch: 25, train_loss: 0.9215, test_loss: 1.0619, test_f1: 0.5229
 epoch: 26, train_loss: 0.9260, test_loss: 1.0842, test_f1: 0.5430
 epoch: 27, train_loss: 0.9138, test_loss: 1.0639, test_f1: 0.5516
 epoch: 28, train_loss: 0.9121, test_loss: 1.0394, test_f1: 0.5548
 epoch: 29, train_loss: 0.9085, test_loss: 1.0368, test_f1: 0.5486
 epoch: 30, train_loss: 0.9011, test_loss: 1.0487, test_f1: 0.5496
 epoch: 31, train_loss: 0.8924, test_loss: 1.0634, test_f1: 0.5381
 epoch: 32, train_loss: 0.8960, test_loss: 1.0455, test_f1: 0.5642
 epoch: 33, train_loss: 0.8916, test_loss: 1.0715, test_f1: 0.5408
 epoch: 34, train_loss: 0.8644, test_loss: 1.0614, test_f1: 0.5299
 epoch: 35, train_loss: 0.8795, test_loss: 1.0578, test_f1: 0.5578
 epoch: 36, train_loss: 0.8702, test_loss: 1.0371, test_f1: 0.5671
 epoch: 37, train_loss: 0.8657, test_loss: 1.0351, test_f1: 0.5862
 epoch: 38, train_loss: 0.8633, test_loss: 1.0338, test_f1: 0.5676
 epoch: 39, train_loss: 0.8592, test_loss: 1.0630, test_f1: 0.5809
 epoch: 40, train_loss: 0.8648, test_loss: 1.0587, test_f1: 0.5535
 epoch: 41, train_loss: 0.8525, test_loss: 1.0374, test_f1: 0.5730
 epoch: 42, train_loss: 0.8479, test_loss: 1.0493, test_f1: 0.5899
 epoch: 43, train_loss: 0.8420, test_loss: 1.0315, test_f1: 0.5815
 epoch: 44, train_loss: 0.8462, test_loss: 1.0409, test_f1: 0.5891
 epoch: 45, train_loss: 0.8403, test_loss: 1.0558, test_f1: 0.5944
 epoch: 46, train_loss: 0.8488, test_loss: 1.0704, test_f1: 0.5687
 epoch: 47, train_loss: 0.8328, test_loss: 1.0582, test_f1: 0.5723
 epoch: 48, train_loss: 0.8241, test_loss: 1.0859, test_f1: 0.5760
 epoch: 49, train_loss: 0.8232, test_loss: 1.0689, test_f1: 0.5782
 epoch: 50, train_loss: 0.8178, test_loss: 1.0492, test_f1: 0.5910
 epoch: 51, train_loss: 0.8089, test_loss: 1.0507, test_f1: 0.5872
 epoch: 52, train_loss: 0.8124, test_loss: 1.0744, test_f1: 0.5835
 epoch: 53, train_loss: 0.7973, test_loss: 1.0689, test_f1: 0.5875
 epoch: 54, train_loss: 0.7978, test_loss: 1.0380, test_f1: 0.6114
 epoch: 55, train_loss: 0.8164, test_loss: 1.0688, test_f1: 0.5874
 epoch: 56, train_loss: 0.7985, test_loss: 1.0675, test_f1: 0.6000
 epoch: 57, train_loss: 0.8107, test_loss: 1.0617, test_f1: 0.5979
 epoch: 58, train_loss: 0.7937, test_loss: 1.0739, test_f1: 0.6056
 epoch: 59, train_loss: 0.7836, test_loss: 1.0594, test_f1: 0.5881
 epoch: 60, train_loss: 0.7820, test_loss: 1.0660, test_f1: 0.6080
 epoch: 61, train_loss: 0.7939, test_loss: 1.0747, test_f1: 0.5977
 epoch: 62, train_loss: 0.7862, test_loss: 1.0611, test_f1: 0.5952
 epoch: 63, train_loss: 0.7969, test_loss: 1.0423, test_f1: 0.6083
 epoch: 64, train_loss: 0.7857, test_loss: 1.0288, test_f1: 0.6163
 epoch: 65, train_loss: 0.7911, test_loss: 1.0362, test_f1: 0.6028
 epoch: 66, train_loss: 0.7843, test_loss: 1.0421, test_f1: 0.6000
 epoch: 67, train_loss: 0.7775, test_loss: 1.0452, test_f1: 0.6083
 epoch: 68, train_loss: 0.7877, test_loss: 1.0864, test_f1: 0.5968
 epoch: 69, train_loss: 0.7744, test_loss: 1.0759, test_f1: 0.6048
 epoch: 70, train_loss: 0.7637, test_loss: 1.0873, test_f1: 0.6049
 epoch: 71, train_loss: 0.7796, test_loss: 1.1020, test_f1: 0.5915
 epoch: 72, train_loss: 0.7802, test_loss: 1.1055, test_f1: 0.5913
 epoch: 73, train_loss: 0.7762, test_loss: 1.0890, test_f1: 0.5945
 epoch: 74, train_loss: 0.7701, test_loss: 1.0611, test_f1: 0.6069
 epoch: 75, train_loss: 0.7787, test_loss: 1.0890, test_f1: 0.6075
 epoch: 76, train_loss: 0.7717, test_loss: 1.1008, test_f1: 0.6077
 epoch: 77, train_loss: 0.7608, test_loss: 1.0690, test_f1: 0.6111
 epoch: 78, train_loss: 0.7794, test_loss: 1.0913, test_f1: 0.6073
 epoch: 79, train_loss: 0.7578, test_loss: 1.1221, test_f1: 0.6079
 epoch: 80, train_loss: 0.7595, test_loss: 1.0949, test_f1: 0.6097
 epoch: 81, train_loss: 0.7609, test_loss: 1.1218, test_f1: 0.5947
 epoch: 82, train_loss: 0.7457, test_loss: 1.0921, test_f1: 0.6162
 epoch: 83, train_loss: 0.7635, test_loss: 1.1074, test_f1: 0.6029
 epoch: 84, train_loss: 0.7527, test_loss: 1.1150, test_f1: 0.6121
 epoch: 85, train_loss: 0.7669, test_loss: 1.1029, test_f1: 0.5952
 epoch: 86, train_loss: 0.7653, test_loss: 1.0855, test_f1: 0.6077
 epoch: 87, train_loss: 0.7512, test_loss: 1.1082, test_f1: 0.6109
 epoch: 88, train_loss: 0.7486, test_loss: 1.1091, test_f1: 0.5976
 epoch: 89, train_loss: 0.7528, test_loss: 1.1047, test_f1: 0.6079
 epoch: 90, train_loss: 0.7371, test_loss: 1.0749, test_f1: 0.5972
 epoch: 91, train_loss: 0.7463, test_loss: 1.0888, test_f1: 0.6081
 epoch: 92, train_loss: 0.7468, test_loss: 1.1351, test_f1: 0.6176
 epoch: 93, train_loss: 0.7369, test_loss: 1.0913, test_f1: 0.6003
 epoch: 94, train_loss: 0.7431, test_loss: 1.0792, test_f1: 0.6098
 epoch: 95, train_loss: 0.7467, test_loss: 1.1255, test_f1: 0.5951
 epoch: 96, train_loss: 0.7526, test_loss: 1.1154, test_f1: 0.6076
 epoch: 97, train_loss: 0.7435, test_loss: 1.1302, test_f1: 0.6031
 epoch: 98, train_loss: 0.7473, test_loss: 1.1371, test_f1: 0.5955
 epoch: 99, train_loss: 0.7363, test_loss: 1.1337, test_f1: 0.5916
##################ITERATION #2 ****************************************
 epoch: 0, train_loss: 1.2565, test_loss: 1.3222, test_f1: 0.2281
 epoch: 1, train_loss: 1.1845, test_loss: 1.2346, test_f1: 0.2565
 epoch: 2, train_loss: 1.1432, test_loss: 1.2344, test_f1: 0.3096
 epoch: 3, train_loss: 1.1279, test_loss: 1.2136, test_f1: 0.3407
 epoch: 4, train_loss: 1.0982, test_loss: 1.2028, test_f1: 0.3948
 epoch: 5, train_loss: 1.0936, test_loss: 1.2134, test_f1: 0.4093
 epoch: 6, train_loss: 1.0764, test_loss: 1.1904, test_f1: 0.4172
 epoch: 7, train_loss: 1.0561, test_loss: 1.1760, test_f1: 0.4336
 epoch: 8, train_loss: 1.0471, test_loss: 1.1590, test_f1: 0.4133
 epoch: 9, train_loss: 1.0394, test_loss: 1.1560, test_f1: 0.4610
 epoch: 10, train_loss: 1.0274, test_loss: 1.1445, test_f1: 0.4602
 epoch: 11, train_loss: 1.0149, test_loss: 1.1483, test_f1: 0.4879
 epoch: 12, train_loss: 1.0085, test_loss: 1.1331, test_f1: 0.4834
 epoch: 13, train_loss: 0.9888, test_loss: 1.1043, test_f1: 0.4872
 epoch: 14, train_loss: 0.9857, test_loss: 1.1082, test_f1: 0.4861
 epoch: 15, train_loss: 0.9730, test_loss: 1.0971, test_f1: 0.5078
 epoch: 16, train_loss: 0.9699, test_loss: 1.0967, test_f1: 0.4968
 epoch: 17, train_loss: 0.9687, test_loss: 1.1210, test_f1: 0.5130
 epoch: 18, train_loss: 0.9588, test_loss: 1.0729, test_f1: 0.5154
 epoch: 19, train_loss: 0.9388, test_loss: 1.1037, test_f1: 0.5123
 epoch: 20, train_loss: 0.9252, test_loss: 1.0799, test_f1: 0.5206
 epoch: 21, train_loss: 0.9215, test_loss: 1.0855, test_f1: 0.5252
 epoch: 22, train_loss: 0.9288, test_loss: 1.0947, test_f1: 0.5129
 epoch: 23, train_loss: 0.9248, test_loss: 1.0791, test_f1: 0.5457
 epoch: 24, train_loss: 0.9057, test_loss: 1.0749, test_f1: 0.5247
 epoch: 25, train_loss: 0.9203, test_loss: 1.0750, test_f1: 0.5298
 epoch: 26, train_loss: 0.8994, test_loss: 1.1100, test_f1: 0.5365
 epoch: 27, train_loss: 0.9039, test_loss: 1.1339, test_f1: 0.5447
 epoch: 28, train_loss: 0.8962, test_loss: 1.1354, test_f1: 0.5450
 epoch: 29, train_loss: 0.8914, test_loss: 1.1239, test_f1: 0.5585
 epoch: 30, train_loss: 0.8858, test_loss: 1.0958, test_f1: 0.5326
 epoch: 31, train_loss: 0.8642, test_loss: 1.1627, test_f1: 0.5356
 epoch: 32, train_loss: 0.8680, test_loss: 1.1517, test_f1: 0.5534
 epoch: 33, train_loss: 0.8531, test_loss: 1.1547, test_f1: 0.5528
 epoch: 34, train_loss: 0.8743, test_loss: 1.1662, test_f1: 0.5631
 epoch: 35, train_loss: 0.8537, test_loss: 1.1279, test_f1: 0.5720
 epoch: 36, train_loss: 0.8687, test_loss: 1.1750, test_f1: 0.5578
 epoch: 37, train_loss: 0.8588, test_loss: 1.1293, test_f1: 0.5791
 epoch: 38, train_loss: 0.8435, test_loss: 1.0858, test_f1: 0.5707
 epoch: 39, train_loss: 0.8457, test_loss: 1.1540, test_f1: 0.5640
 epoch: 40, train_loss: 0.8353, test_loss: 1.1035, test_f1: 0.5692
 epoch: 41, train_loss: 0.8430, test_loss: 1.0841, test_f1: 0.5762
 epoch: 42, train_loss: 0.8439, test_loss: 1.1507, test_f1: 0.5686
 epoch: 43, train_loss: 0.8378, test_loss: 1.1583, test_f1: 0.5618
 epoch: 44, train_loss: 0.8279, test_loss: 1.0729, test_f1: 0.5771
 epoch: 45, train_loss: 0.8207, test_loss: 1.1417, test_f1: 0.5771
 epoch: 46, train_loss: 0.8289, test_loss: 1.1626, test_f1: 0.5597
 epoch: 47, train_loss: 0.8291, test_loss: 1.1561, test_f1: 0.5822
 epoch: 48, train_loss: 0.8166, test_loss: 1.1185, test_f1: 0.5614
 epoch: 49, train_loss: 0.7949, test_loss: 1.1534, test_f1: 0.5603
 epoch: 50, train_loss: 0.8077, test_loss: 1.1620, test_f1: 0.5631
 epoch: 51, train_loss: 0.7850, test_loss: 1.1898, test_f1: 0.5675
 epoch: 52, train_loss: 0.7825, test_loss: 1.1906, test_f1: 0.5876
 epoch: 53, train_loss: 0.7941, test_loss: 1.1697, test_f1: 0.5773
 epoch: 54, train_loss: 0.7927, test_loss: 1.1532, test_f1: 0.5838
 epoch: 55, train_loss: 0.7696, test_loss: 1.1890, test_f1: 0.5696
 epoch: 56, train_loss: 0.7833, test_loss: 1.1242, test_f1: 0.6035
 epoch: 57, train_loss: 0.7719, test_loss: 1.1829, test_f1: 0.5925
 epoch: 58, train_loss: 0.7813, test_loss: 1.1671, test_f1: 0.5785
 epoch: 59, train_loss: 0.7779, test_loss: 1.1538, test_f1: 0.5869
 epoch: 60, train_loss: 0.7772, test_loss: 1.1826, test_f1: 0.5793
 epoch: 61, train_loss: 0.7681, test_loss: 1.1814, test_f1: 0.5847
 epoch: 62, train_loss: 0.7870, test_loss: 1.2037, test_f1: 0.5810
 epoch: 63, train_loss: 0.7843, test_loss: 1.1293, test_f1: 0.5862
 epoch: 64, train_loss: 0.7662, test_loss: 1.1606, test_f1: 0.5833
 epoch: 65, train_loss: 0.7677, test_loss: 1.2338, test_f1: 0.5763
 epoch: 66, train_loss: 0.7539, test_loss: 1.1782, test_f1: 0.5878
 epoch: 67, train_loss: 0.7705, test_loss: 1.2558, test_f1: 0.5522
 epoch: 68, train_loss: 0.7746, test_loss: 1.2027, test_f1: 0.5839
 epoch: 69, train_loss: 0.7583, test_loss: 1.2195, test_f1: 0.5823
 epoch: 70, train_loss: 0.7514, test_loss: 1.2308, test_f1: 0.5712
 epoch: 71, train_loss: 0.7680, test_loss: 1.2506, test_f1: 0.5588
 epoch: 72, train_loss: 0.7635, test_loss: 1.2478, test_f1: 0.5490
 epoch: 73, train_loss: 0.7502, test_loss: 1.2810, test_f1: 0.5572
 epoch: 74, train_loss: 0.7558, test_loss: 1.2353, test_f1: 0.5752
 epoch: 75, train_loss: 0.7503, test_loss: 1.2719, test_f1: 0.5702
 epoch: 76, train_loss: 0.7587, test_loss: 1.2705, test_f1: 0.5681
 epoch: 77, train_loss: 0.7335, test_loss: 1.2781, test_f1: 0.5821
 epoch: 78, train_loss: 0.7461, test_loss: 1.3143, test_f1: 0.5623
 epoch: 79, train_loss: 0.7497, test_loss: 1.2456, test_f1: 0.5820
 epoch: 80, train_loss: 0.7452, test_loss: 1.2633, test_f1: 0.5620
 epoch: 81, train_loss: 0.7484, test_loss: 1.2559, test_f1: 0.5696
 epoch: 82, train_loss: 0.7278, test_loss: 1.2908, test_f1: 0.5752
 epoch: 83, train_loss: 0.7334, test_loss: 1.2829, test_f1: 0.5935
 epoch: 84, train_loss: 0.7444, test_loss: 1.2010, test_f1: 0.5984
 epoch: 85, train_loss: 0.7448, test_loss: 1.2794, test_f1: 0.5714
 epoch: 86, train_loss: 0.7360, test_loss: 1.2861, test_f1: 0.5832
 epoch: 87, train_loss: 0.7472, test_loss: 1.3402, test_f1: 0.5730
 epoch: 88, train_loss: 0.7398, test_loss: 1.2942, test_f1: 0.5768
 epoch: 89, train_loss: 0.7398, test_loss: 1.2944, test_f1: 0.5604
 epoch: 90, train_loss: 0.7283, test_loss: 1.2576, test_f1: 0.5606
 epoch: 91, train_loss: 0.7227, test_loss: 1.2980, test_f1: 0.5761
 epoch: 92, train_loss: 0.7337, test_loss: 1.2998, test_f1: 0.5746
 epoch: 93, train_loss: 0.7395, test_loss: 1.2654, test_f1: 0.5970
 epoch: 94, train_loss: 0.7319, test_loss: 1.3293, test_f1: 0.5711
 epoch: 95, train_loss: 0.7311, test_loss: 1.3658, test_f1: 0.5690
 epoch: 96, train_loss: 0.7186, test_loss: 1.3500, test_f1: 0.5599
 epoch: 97, train_loss: 0.7332, test_loss: 1.3307, test_f1: 0.5706
 epoch: 98, train_loss: 0.7091, test_loss: 1.3367, test_f1: 0.5637
 epoch: 99, train_loss: 0.7262, test_loss: 1.3325, test_f1: 0.5668
##################ITERATION #3 ****************************************
 epoch: 0, train_loss: 1.2351, test_loss: 1.2607, test_f1: 0.2489
 epoch: 1, train_loss: 1.1526, test_loss: 1.2095, test_f1: 0.3305
 epoch: 2, train_loss: 1.1256, test_loss: 1.1945, test_f1: 0.3597
 epoch: 3, train_loss: 1.1006, test_loss: 1.1669, test_f1: 0.3920
 epoch: 4, train_loss: 1.0858, test_loss: 1.1518, test_f1: 0.3959
 epoch: 5, train_loss: 1.0701, test_loss: 1.1373, test_f1: 0.4410
 epoch: 6, train_loss: 1.0479, test_loss: 1.1223, test_f1: 0.4534
 epoch: 7, train_loss: 1.0431, test_loss: 1.0960, test_f1: 0.4659
 epoch: 8, train_loss: 1.0292, test_loss: 1.0971, test_f1: 0.4710
 epoch: 9, train_loss: 1.0111, test_loss: 1.0841, test_f1: 0.4755
 epoch: 10, train_loss: 0.9946, test_loss: 1.0682, test_f1: 0.4797
 epoch: 11, train_loss: 1.0066, test_loss: 1.0731, test_f1: 0.4889
 epoch: 12, train_loss: 0.9958, test_loss: 1.0643, test_f1: 0.4880
 epoch: 13, train_loss: 0.9638, test_loss: 1.0527, test_f1: 0.5005
 epoch: 14, train_loss: 0.9567, test_loss: 1.0529, test_f1: 0.5010
 epoch: 15, train_loss: 0.9480, test_loss: 1.0338, test_f1: 0.5192
 epoch: 16, train_loss: 0.9444, test_loss: 1.0341, test_f1: 0.5432
 epoch: 17, train_loss: 0.9411, test_loss: 1.0288, test_f1: 0.5162
 epoch: 18, train_loss: 0.9287, test_loss: 1.0402, test_f1: 0.5424
 epoch: 19, train_loss: 0.9445, test_loss: 1.0206, test_f1: 0.5477
 epoch: 20, train_loss: 0.9129, test_loss: 1.0218, test_f1: 0.5433
 epoch: 21, train_loss: 0.9102, test_loss: 1.0272, test_f1: 0.5566
 epoch: 22, train_loss: 0.9046, test_loss: 1.0167, test_f1: 0.5615
 epoch: 23, train_loss: 0.9053, test_loss: 1.0195, test_f1: 0.5329
 epoch: 24, train_loss: 0.8947, test_loss: 1.0171, test_f1: 0.5733
 epoch: 25, train_loss: 0.8937, test_loss: 1.0056, test_f1: 0.5592
 epoch: 26, train_loss: 0.8802, test_loss: 0.9972, test_f1: 0.5793
 epoch: 27, train_loss: 0.8764, test_loss: 0.9949, test_f1: 0.5892
 epoch: 28, train_loss: 0.8720, test_loss: 0.9946, test_f1: 0.5681
 epoch: 29, train_loss: 0.8701, test_loss: 1.0186, test_f1: 0.5688
 epoch: 30, train_loss: 0.8663, test_loss: 0.9958, test_f1: 0.5701
 epoch: 31, train_loss: 0.8587, test_loss: 1.0255, test_f1: 0.5489
 epoch: 32, train_loss: 0.8620, test_loss: 1.0100, test_f1: 0.5750
 epoch: 33, train_loss: 0.8539, test_loss: 1.0332, test_f1: 0.5891
 epoch: 34, train_loss: 0.8574, test_loss: 0.9887, test_f1: 0.6011
 epoch: 35, train_loss: 0.8332, test_loss: 0.9984, test_f1: 0.5984
 epoch: 36, train_loss: 0.8247, test_loss: 1.0223, test_f1: 0.5647
 epoch: 37, train_loss: 0.8329, test_loss: 1.0096, test_f1: 0.5923
 epoch: 38, train_loss: 0.8151, test_loss: 1.0222, test_f1: 0.5812
 epoch: 39, train_loss: 0.8185, test_loss: 0.9779, test_f1: 0.6174
 epoch: 40, train_loss: 0.8114, test_loss: 0.9923, test_f1: 0.5965
 epoch: 41, train_loss: 0.8156, test_loss: 1.0054, test_f1: 0.5939
 epoch: 42, train_loss: 0.8063, test_loss: 1.0025, test_f1: 0.5964
 epoch: 43, train_loss: 0.8124, test_loss: 1.0112, test_f1: 0.6037
 epoch: 44, train_loss: 0.7981, test_loss: 1.0400, test_f1: 0.6009
 epoch: 45, train_loss: 0.7997, test_loss: 1.0276, test_f1: 0.5921
 epoch: 46, train_loss: 0.7841, test_loss: 1.0356, test_f1: 0.6062
 epoch: 47, train_loss: 0.7751, test_loss: 1.0335, test_f1: 0.5931
 epoch: 48, train_loss: 0.7829, test_loss: 1.0084, test_f1: 0.5964
 epoch: 49, train_loss: 0.7849, test_loss: 1.0085, test_f1: 0.5935
 epoch: 50, train_loss: 0.7834, test_loss: 1.0064, test_f1: 0.5917
 epoch: 51, train_loss: 0.7685, test_loss: 1.0365, test_f1: 0.5952
 epoch: 52, train_loss: 0.7767, test_loss: 1.0357, test_f1: 0.5960
 epoch: 53, train_loss: 0.7785, test_loss: 1.0264, test_f1: 0.6012
 epoch: 54, train_loss: 0.7648, test_loss: 1.0450, test_f1: 0.5853
 epoch: 55, train_loss: 0.7498, test_loss: 1.0310, test_f1: 0.6079
 epoch: 56, train_loss: 0.7358, test_loss: 1.0462, test_f1: 0.5929
 epoch: 57, train_loss: 0.7583, test_loss: 1.0549, test_f1: 0.6026
 epoch: 58, train_loss: 0.7652, test_loss: 1.0438, test_f1: 0.5973
 epoch: 59, train_loss: 0.7585, test_loss: 1.0391, test_f1: 0.5912
 epoch: 60, train_loss: 0.7587, test_loss: 1.0527, test_f1: 0.5855
 epoch: 61, train_loss: 0.7302, test_loss: 1.0560, test_f1: 0.6009
 epoch: 62, train_loss: 0.7426, test_loss: 1.0739, test_f1: 0.5955
 epoch: 63, train_loss: 0.7525, test_loss: 1.0645, test_f1: 0.6107
 epoch: 64, train_loss: 0.7538, test_loss: 1.0373, test_f1: 0.6034
 epoch: 65, train_loss: 0.7345, test_loss: 1.0614, test_f1: 0.6004
 epoch: 66, train_loss: 0.7308, test_loss: 1.0695, test_f1: 0.6085
 epoch: 67, train_loss: 0.7262, test_loss: 1.0433, test_f1: 0.6061
 epoch: 68, train_loss: 0.7398, test_loss: 1.0702, test_f1: 0.5930
 epoch: 69, train_loss: 0.7289, test_loss: 1.0659, test_f1: 0.5914
 epoch: 70, train_loss: 0.7361, test_loss: 1.0754, test_f1: 0.5931
 epoch: 71, train_loss: 0.7256, test_loss: 1.0851, test_f1: 0.6022
 epoch: 72, train_loss: 0.7267, test_loss: 1.1113, test_f1: 0.6029
 epoch: 73, train_loss: 0.7114, test_loss: 1.0756, test_f1: 0.6005
 epoch: 74, train_loss: 0.7230, test_loss: 1.1006, test_f1: 0.5932
 epoch: 75, train_loss: 0.7277, test_loss: 1.0630, test_f1: 0.6160
 epoch: 76, train_loss: 0.7062, test_loss: 1.0983, test_f1: 0.6011
 epoch: 77, train_loss: 0.7079, test_loss: 1.0981, test_f1: 0.6142
 epoch: 78, train_loss: 0.7159, test_loss: 1.1102, test_f1: 0.5982
 epoch: 79, train_loss: 0.7139, test_loss: 1.1190, test_f1: 0.6117
 epoch: 80, train_loss: 0.7152, test_loss: 1.1032, test_f1: 0.6008
 epoch: 81, train_loss: 0.7182, test_loss: 1.0908, test_f1: 0.6268
 epoch: 82, train_loss: 0.7171, test_loss: 1.0876, test_f1: 0.6167
 epoch: 83, train_loss: 0.7176, test_loss: 1.0975, test_f1: 0.6123
 epoch: 84, train_loss: 0.7086, test_loss: 1.0798, test_f1: 0.6125
 epoch: 85, train_loss: 0.7082, test_loss: 1.1062, test_f1: 0.6040
 epoch: 86, train_loss: 0.6997, test_loss: 1.1102, test_f1: 0.5721
 epoch: 87, train_loss: 0.7086, test_loss: 1.1190, test_f1: 0.5920
 epoch: 88, train_loss: 0.6925, test_loss: 1.1146, test_f1: 0.6096
 epoch: 89, train_loss: 0.6902, test_loss: 1.1449, test_f1: 0.5909
 epoch: 90, train_loss: 0.6931, test_loss: 1.1553, test_f1: 0.5979
 epoch: 91, train_loss: 0.6878, test_loss: 1.1234, test_f1: 0.6062
 epoch: 92, train_loss: 0.7069, test_loss: 1.1036, test_f1: 0.6188
 epoch: 93, train_loss: 0.6897, test_loss: 1.1150, test_f1: 0.6077
 epoch: 94, train_loss: 0.7004, test_loss: 1.1305, test_f1: 0.5978
 epoch: 95, train_loss: 0.6758, test_loss: 1.1689, test_f1: 0.5889
 epoch: 96, train_loss: 0.6842, test_loss: 1.1851, test_f1: 0.6002
 epoch: 97, train_loss: 0.6962, test_loss: 1.1555, test_f1: 0.6066
 epoch: 98, train_loss: 0.6886, test_loss: 1.1785, test_f1: 0.5898
 epoch: 99, train_loss: 0.6680, test_loss: 1.1592, test_f1: 0.6140
##################ITERATION #4 ****************************************
 epoch: 0, train_loss: 1.2222, test_loss: 1.2768, test_f1: 0.2734
 epoch: 1, train_loss: 1.1519, test_loss: 1.2159, test_f1: 0.3579
 epoch: 2, train_loss: 1.1335, test_loss: 1.1703, test_f1: 0.4118
 epoch: 3, train_loss: 1.1116, test_loss: 1.1574, test_f1: 0.4257
 epoch: 4, train_loss: 1.0815, test_loss: 1.1379, test_f1: 0.4354
 epoch: 5, train_loss: 1.0877, test_loss: 1.1275, test_f1: 0.4416
 epoch: 6, train_loss: 1.0660, test_loss: 1.1009, test_f1: 0.4745
 epoch: 7, train_loss: 1.0504, test_loss: 1.1058, test_f1: 0.4859
 epoch: 8, train_loss: 1.0467, test_loss: 1.0965, test_f1: 0.4520
 epoch: 9, train_loss: 1.0249, test_loss: 1.0947, test_f1: 0.4999
 epoch: 10, train_loss: 1.0130, test_loss: 1.0862, test_f1: 0.4903
 epoch: 11, train_loss: 1.0177, test_loss: 1.0669, test_f1: 0.5153
 epoch: 12, train_loss: 0.9979, test_loss: 1.0584, test_f1: 0.5216
 epoch: 13, train_loss: 0.9944, test_loss: 1.0588, test_f1: 0.5094
 epoch: 14, train_loss: 0.9933, test_loss: 1.0630, test_f1: 0.5150
 epoch: 15, train_loss: 0.9730, test_loss: 1.0548, test_f1: 0.5240
 epoch: 16, train_loss: 0.9706, test_loss: 1.0401, test_f1: 0.5235
 epoch: 17, train_loss: 0.9706, test_loss: 1.0539, test_f1: 0.5184
 epoch: 18, train_loss: 0.9534, test_loss: 1.0383, test_f1: 0.5252
 epoch: 19, train_loss: 0.9499, test_loss: 1.0376, test_f1: 0.5228
 epoch: 20, train_loss: 0.9397, test_loss: 1.0477, test_f1: 0.5335
 epoch: 21, train_loss: 0.9415, test_loss: 1.0833, test_f1: 0.5112
 epoch: 22, train_loss: 0.9459, test_loss: 1.0491, test_f1: 0.5230
 epoch: 23, train_loss: 0.9450, test_loss: 1.0351, test_f1: 0.5366
 epoch: 24, train_loss: 0.9386, test_loss: 1.0284, test_f1: 0.5247
 epoch: 25, train_loss: 0.9233, test_loss: 1.0290, test_f1: 0.5432
 epoch: 26, train_loss: 0.9165, test_loss: 1.0444, test_f1: 0.5260
 epoch: 27, train_loss: 0.9131, test_loss: 1.0323, test_f1: 0.5325
 epoch: 28, train_loss: 0.9130, test_loss: 1.0481, test_f1: 0.5231
 epoch: 29, train_loss: 0.9016, test_loss: 1.0649, test_f1: 0.5259
 epoch: 30, train_loss: 0.8982, test_loss: 1.0558, test_f1: 0.5320
 epoch: 31, train_loss: 0.8977, test_loss: 1.0208, test_f1: 0.5301
 epoch: 32, train_loss: 0.8794, test_loss: 1.0402, test_f1: 0.5369
 epoch: 33, train_loss: 0.8808, test_loss: 1.0285, test_f1: 0.5422
 epoch: 34, train_loss: 0.8727, test_loss: 1.0697, test_f1: 0.5267
 epoch: 35, train_loss: 0.8696, test_loss: 1.0448, test_f1: 0.5413
 epoch: 36, train_loss: 0.8550, test_loss: 1.0550, test_f1: 0.5480
 epoch: 37, train_loss: 0.8718, test_loss: 1.0660, test_f1: 0.5465
 epoch: 38, train_loss: 0.8626, test_loss: 1.0663, test_f1: 0.5407
 epoch: 39, train_loss: 0.8651, test_loss: 1.0338, test_f1: 0.5704
 epoch: 40, train_loss: 0.8624, test_loss: 1.0408, test_f1: 0.5658
 epoch: 41, train_loss: 0.8580, test_loss: 1.0103, test_f1: 0.5613
 epoch: 42, train_loss: 0.8439, test_loss: 1.0512, test_f1: 0.5415
 epoch: 43, train_loss: 0.8514, test_loss: 1.0462, test_f1: 0.5560
 epoch: 44, train_loss: 0.8416, test_loss: 1.0440, test_f1: 0.5468
 epoch: 45, train_loss: 0.8361, test_loss: 1.0489, test_f1: 0.5399
 epoch: 46, train_loss: 0.8205, test_loss: 1.0488, test_f1: 0.5593
 epoch: 47, train_loss: 0.8203, test_loss: 1.0466, test_f1: 0.5332
 epoch: 48, train_loss: 0.8100, test_loss: 1.0495, test_f1: 0.5593
 epoch: 49, train_loss: 0.8159, test_loss: 1.0573, test_f1: 0.5467
 epoch: 50, train_loss: 0.8018, test_loss: 1.0548, test_f1: 0.5437
 epoch: 51, train_loss: 0.8177, test_loss: 1.0505, test_f1: 0.5723
 epoch: 52, train_loss: 0.8207, test_loss: 1.0427, test_f1: 0.5680
 epoch: 53, train_loss: 0.7896, test_loss: 1.0677, test_f1: 0.5589
 epoch: 54, train_loss: 0.7947, test_loss: 1.0900, test_f1: 0.5617
 epoch: 55, train_loss: 0.7933, test_loss: 1.0881, test_f1: 0.5470
 epoch: 56, train_loss: 0.7940, test_loss: 1.0384, test_f1: 0.5656
 epoch: 57, train_loss: 0.7901, test_loss: 1.0939, test_f1: 0.5683
 epoch: 58, train_loss: 0.7941, test_loss: 1.0798, test_f1: 0.5692
 epoch: 59, train_loss: 0.7923, test_loss: 1.0691, test_f1: 0.5491
 epoch: 60, train_loss: 0.7854, test_loss: 1.0814, test_f1: 0.5634
 epoch: 61, train_loss: 0.7892, test_loss: 1.0856, test_f1: 0.5710
 epoch: 62, train_loss: 0.7790, test_loss: 1.0913, test_f1: 0.5628
 epoch: 63, train_loss: 0.7775, test_loss: 1.0818, test_f1: 0.5756
 epoch: 64, train_loss: 0.7790, test_loss: 1.0669, test_f1: 0.5729
 epoch: 65, train_loss: 0.7828, test_loss: 1.0902, test_f1: 0.5527
 epoch: 66, train_loss: 0.7753, test_loss: 1.0874, test_f1: 0.5775
 epoch: 67, train_loss: 0.7887, test_loss: 1.0629, test_f1: 0.5522
 epoch: 68, train_loss: 0.7842, test_loss: 1.0976, test_f1: 0.5610
 epoch: 69, train_loss: 0.7617, test_loss: 1.1229, test_f1: 0.5617
 epoch: 70, train_loss: 0.7731, test_loss: 1.0991, test_f1: 0.5579
 epoch: 71, train_loss: 0.7571, test_loss: 1.1090, test_f1: 0.5681
 epoch: 72, train_loss: 0.7608, test_loss: 1.0863, test_f1: 0.5765
 epoch: 73, train_loss: 0.7752, test_loss: 1.0874, test_f1: 0.5886
 epoch: 74, train_loss: 0.7642, test_loss: 1.1009, test_f1: 0.5703
 epoch: 75, train_loss: 0.7709, test_loss: 1.1731, test_f1: 0.5563
 epoch: 76, train_loss: 0.7592, test_loss: 1.0950, test_f1: 0.5799
 epoch: 77, train_loss: 0.7644, test_loss: 1.0977, test_f1: 0.5632
 epoch: 78, train_loss: 0.7599, test_loss: 1.1110, test_f1: 0.5524
 epoch: 79, train_loss: 0.7502, test_loss: 1.1208, test_f1: 0.5658
 epoch: 80, train_loss: 0.7524, test_loss: 1.1551, test_f1: 0.5773
 epoch: 81, train_loss: 0.7490, test_loss: 1.1253, test_f1: 0.5767
 epoch: 82, train_loss: 0.7559, test_loss: 1.1469, test_f1: 0.5775
 epoch: 83, train_loss: 0.7421, test_loss: 1.1240, test_f1: 0.5727
 epoch: 84, train_loss: 0.7392, test_loss: 1.1605, test_f1: 0.5757
 epoch: 85, train_loss: 0.7242, test_loss: 1.1358, test_f1: 0.5461
 epoch: 86, train_loss: 0.7381, test_loss: 1.1491, test_f1: 0.5522
 epoch: 87, train_loss: 0.7330, test_loss: 1.1345, test_f1: 0.5492
 epoch: 88, train_loss: 0.7306, test_loss: 1.1424, test_f1: 0.5611
 epoch: 89, train_loss: 0.7222, test_loss: 1.1688, test_f1: 0.5712
 epoch: 90, train_loss: 0.7399, test_loss: 1.1346, test_f1: 0.5433
 epoch: 91, train_loss: 0.7224, test_loss: 1.1269, test_f1: 0.5607
 epoch: 92, train_loss: 0.7344, test_loss: 1.1281, test_f1: 0.5504
 epoch: 93, train_loss: 0.7233, test_loss: 1.1476, test_f1: 0.5653
 epoch: 94, train_loss: 0.7206, test_loss: 1.1831, test_f1: 0.5592
 epoch: 95, train_loss: 0.7213, test_loss: 1.1455, test_f1: 0.5726
 epoch: 96, train_loss: 0.7220, test_loss: 1.1657, test_f1: 0.5529
 epoch: 97, train_loss: 0.7209, test_loss: 1.1330, test_f1: 0.5656
 epoch: 98, train_loss: 0.7241, test_loss: 1.1608, test_f1: 0.5554
 epoch: 99, train_loss: 0.7029, test_loss: 1.1258, test_f1: 0.5596
##################ITERATION #5 ****************************************
 epoch: 0, train_loss: 1.2261, test_loss: 1.2796, test_f1: 0.3534
 epoch: 1, train_loss: 1.1365, test_loss: 1.2000, test_f1: 0.4273
 epoch: 2, train_loss: 1.1068, test_loss: 1.1600, test_f1: 0.4398
 epoch: 3, train_loss: 1.0970, test_loss: 1.1350, test_f1: 0.4809
 epoch: 4, train_loss: 1.0723, test_loss: 1.1145, test_f1: 0.4868
 epoch: 5, train_loss: 1.0632, test_loss: 1.1007, test_f1: 0.5073
 epoch: 6, train_loss: 1.0358, test_loss: 1.0845, test_f1: 0.4999
 epoch: 7, train_loss: 1.0323, test_loss: 1.0852, test_f1: 0.4889
 epoch: 8, train_loss: 0.9993, test_loss: 1.0734, test_f1: 0.4962
 epoch: 9, train_loss: 1.0078, test_loss: 1.0620, test_f1: 0.5084
 epoch: 10, train_loss: 1.0025, test_loss: 1.0588, test_f1: 0.5272
 epoch: 11, train_loss: 0.9876, test_loss: 1.0507, test_f1: 0.5092
 epoch: 12, train_loss: 0.9666, test_loss: 1.0535, test_f1: 0.5325
 epoch: 13, train_loss: 0.9643, test_loss: 1.0178, test_f1: 0.5488
 epoch: 14, train_loss: 0.9717, test_loss: 1.0639, test_f1: 0.5210
 epoch: 15, train_loss: 0.9592, test_loss: 1.0358, test_f1: 0.5232
 epoch: 16, train_loss: 0.9342, test_loss: 1.0759, test_f1: 0.5261
 epoch: 17, train_loss: 0.9398, test_loss: 1.0545, test_f1: 0.5205
 epoch: 18, train_loss: 0.9292, test_loss: 1.0409, test_f1: 0.5536
 epoch: 19, train_loss: 0.9144, test_loss: 1.0369, test_f1: 0.5439
 epoch: 20, train_loss: 0.9272, test_loss: 1.0306, test_f1: 0.5390
 epoch: 21, train_loss: 0.9134, test_loss: 1.0224, test_f1: 0.5512
 epoch: 22, train_loss: 0.9108, test_loss: 1.0649, test_f1: 0.5445
 epoch: 23, train_loss: 0.8816, test_loss: 1.0409, test_f1: 0.5673
 epoch: 24, train_loss: 0.8901, test_loss: 1.0583, test_f1: 0.5493
 epoch: 25, train_loss: 0.8810, test_loss: 1.0380, test_f1: 0.5745
 epoch: 26, train_loss: 0.8799, test_loss: 1.0344, test_f1: 0.5473
 epoch: 27, train_loss: 0.8735, test_loss: 1.0245, test_f1: 0.5637
 epoch: 28, train_loss: 0.8549, test_loss: 1.0715, test_f1: 0.5539
 epoch: 29, train_loss: 0.8750, test_loss: 1.0670, test_f1: 0.5560
 epoch: 30, train_loss: 0.8542, test_loss: 1.0563, test_f1: 0.5635
 epoch: 31, train_loss: 0.8540, test_loss: 1.0685, test_f1: 0.5649
 epoch: 32, train_loss: 0.8556, test_loss: 1.0874, test_f1: 0.5615
 epoch: 33, train_loss: 0.8517, test_loss: 1.0593, test_f1: 0.5625
 epoch: 34, train_loss: 0.8301, test_loss: 1.0539, test_f1: 0.5616
 epoch: 35, train_loss: 0.8263, test_loss: 1.0750, test_f1: 0.5558
 epoch: 36, train_loss: 0.8262, test_loss: 1.0853, test_f1: 0.5651
 epoch: 37, train_loss: 0.8383, test_loss: 1.0910, test_f1: 0.5615
 epoch: 38, train_loss: 0.8243, test_loss: 1.1017, test_f1: 0.5602
 epoch: 39, train_loss: 0.8211, test_loss: 1.0986, test_f1: 0.5538
 epoch: 40, train_loss: 0.8205, test_loss: 1.0694, test_f1: 0.5560
 epoch: 41, train_loss: 0.8149, test_loss: 1.0754, test_f1: 0.5647
 epoch: 42, train_loss: 0.7958, test_loss: 1.1139, test_f1: 0.5550
 epoch: 43, train_loss: 0.8149, test_loss: 1.1348, test_f1: 0.5659
 epoch: 44, train_loss: 0.8028, test_loss: 1.0760, test_f1: 0.5640
 epoch: 45, train_loss: 0.8063, test_loss: 1.1039, test_f1: 0.5487
 epoch: 46, train_loss: 0.8002, test_loss: 1.0900, test_f1: 0.5490
 epoch: 47, train_loss: 0.7881, test_loss: 1.1363, test_f1: 0.5539
 epoch: 48, train_loss: 0.7829, test_loss: 1.1012, test_f1: 0.5464
 epoch: 49, train_loss: 0.7819, test_loss: 1.1035, test_f1: 0.5646
 epoch: 50, train_loss: 0.7757, test_loss: 1.1032, test_f1: 0.5475
 epoch: 51, train_loss: 0.7538, test_loss: 1.1390, test_f1: 0.5648
 epoch: 52, train_loss: 0.7652, test_loss: 1.1353, test_f1: 0.5624
 epoch: 53, train_loss: 0.7779, test_loss: 1.1264, test_f1: 0.5620
 epoch: 54, train_loss: 0.7908, test_loss: 1.1282, test_f1: 0.5522
 epoch: 55, train_loss: 0.7533, test_loss: 1.1392, test_f1: 0.5576
 epoch: 56, train_loss: 0.7605, test_loss: 1.1607, test_f1: 0.5616
 epoch: 57, train_loss: 0.7717, test_loss: 1.1276, test_f1: 0.5718
 epoch: 58, train_loss: 0.7508, test_loss: 1.1091, test_f1: 0.5751
 epoch: 59, train_loss: 0.7505, test_loss: 1.1438, test_f1: 0.5605
 epoch: 60, train_loss: 0.7559, test_loss: 1.1314, test_f1: 0.5605
 epoch: 61, train_loss: 0.7589, test_loss: 1.1524, test_f1: 0.5572
 epoch: 62, train_loss: 0.7403, test_loss: 1.1356, test_f1: 0.5682
 epoch: 63, train_loss: 0.7479, test_loss: 1.1835, test_f1: 0.5573
 epoch: 64, train_loss: 0.7517, test_loss: 1.1528, test_f1: 0.5633
 epoch: 65, train_loss: 0.7539, test_loss: 1.1328, test_f1: 0.5574
 epoch: 66, train_loss: 0.7346, test_loss: 1.1827, test_f1: 0.5631
 epoch: 67, train_loss: 0.7390, test_loss: 1.1868, test_f1: 0.5561
 epoch: 68, train_loss: 0.7366, test_loss: 1.2153, test_f1: 0.5695
 epoch: 69, train_loss: 0.7258, test_loss: 1.1659, test_f1: 0.5700
 epoch: 70, train_loss: 0.7197, test_loss: 1.1543, test_f1: 0.5714
 epoch: 71, train_loss: 0.7303, test_loss: 1.2176, test_f1: 0.5703
 epoch: 72, train_loss: 0.7319, test_loss: 1.1865, test_f1: 0.5664
 epoch: 73, train_loss: 0.7234, test_loss: 1.1813, test_f1: 0.5707
 epoch: 74, train_loss: 0.7310, test_loss: 1.2435, test_f1: 0.5655
 epoch: 75, train_loss: 0.7126, test_loss: 1.2388, test_f1: 0.5655
 epoch: 76, train_loss: 0.7242, test_loss: 1.2395, test_f1: 0.5628
 epoch: 77, train_loss: 0.7171, test_loss: 1.2309, test_f1: 0.5654
 epoch: 78, train_loss: 0.7023, test_loss: 1.2204, test_f1: 0.5687
 epoch: 79, train_loss: 0.7189, test_loss: 1.2422, test_f1: 0.5784
 epoch: 80, train_loss: 0.7261, test_loss: 1.2168, test_f1: 0.5759
 epoch: 81, train_loss: 0.7135, test_loss: 1.2437, test_f1: 0.5642
 epoch: 82, train_loss: 0.7117, test_loss: 1.2577, test_f1: 0.5816
 epoch: 83, train_loss: 0.7085, test_loss: 1.2405, test_f1: 0.5813
 epoch: 84, train_loss: 0.7114, test_loss: 1.2289, test_f1: 0.5779
 epoch: 85, train_loss: 0.7071, test_loss: 1.2089, test_f1: 0.5809
 epoch: 86, train_loss: 0.6874, test_loss: 1.2208, test_f1: 0.5699
 epoch: 87, train_loss: 0.7022, test_loss: 1.2505, test_f1: 0.5698
 epoch: 88, train_loss: 0.6887, test_loss: 1.2405, test_f1: 0.5661
 epoch: 89, train_loss: 0.6910, test_loss: 1.2480, test_f1: 0.5748
 epoch: 90, train_loss: 0.6799, test_loss: 1.2638, test_f1: 0.5785
 epoch: 91, train_loss: 0.6950, test_loss: 1.2723, test_f1: 0.5731
 epoch: 92, train_loss: 0.7253, test_loss: 1.2234, test_f1: 0.5795
 epoch: 93, train_loss: 0.6958, test_loss: 1.2726, test_f1: 0.5785
 epoch: 94, train_loss: 0.6990, test_loss: 1.2587, test_f1: 0.5755
 epoch: 95, train_loss: 0.6946, test_loss: 1.2616, test_f1: 0.5751
 epoch: 96, train_loss: 0.7041, test_loss: 1.2766, test_f1: 0.5749
 epoch: 97, train_loss: 0.6739, test_loss: 1.2964, test_f1: 0.5701
 epoch: 98, train_loss: 0.7000, test_loss: 1.2787, test_f1: 0.5806
 epoch: 99, train_loss: 0.6734, test_loss: 1.2839, test_f1: 0.5731
##################ITERATION #6 ****************************************
 epoch: 0, train_loss: 1.2386, test_loss: 1.2881, test_f1: 0.2340
 epoch: 1, train_loss: 1.1395, test_loss: 1.1839, test_f1: 0.3663
 epoch: 2, train_loss: 1.1044, test_loss: 1.1496, test_f1: 0.4185
 epoch: 3, train_loss: 1.0960, test_loss: 1.1374, test_f1: 0.4552
 epoch: 4, train_loss: 1.0688, test_loss: 1.1154, test_f1: 0.4780
 epoch: 5, train_loss: 1.0602, test_loss: 1.1058, test_f1: 0.4740
 epoch: 6, train_loss: 1.0338, test_loss: 1.0916, test_f1: 0.5226
 epoch: 7, train_loss: 1.0187, test_loss: 1.0966, test_f1: 0.5048
 epoch: 8, train_loss: 1.0050, test_loss: 1.0915, test_f1: 0.5079
 epoch: 9, train_loss: 0.9997, test_loss: 1.0912, test_f1: 0.4990
 epoch: 10, train_loss: 0.9787, test_loss: 1.0819, test_f1: 0.5196
 epoch: 11, train_loss: 0.9667, test_loss: 1.0690, test_f1: 0.5272
 epoch: 12, train_loss: 0.9858, test_loss: 1.0852, test_f1: 0.5295
 epoch: 13, train_loss: 0.9596, test_loss: 1.0962, test_f1: 0.5167
 epoch: 14, train_loss: 0.9737, test_loss: 1.0875, test_f1: 0.5441
 epoch: 15, train_loss: 0.9469, test_loss: 1.0743, test_f1: 0.5330
 epoch: 16, train_loss: 0.9393, test_loss: 1.0797, test_f1: 0.5395
 epoch: 17, train_loss: 0.9463, test_loss: 1.0768, test_f1: 0.5461
 epoch: 18, train_loss: 0.9311, test_loss: 1.0633, test_f1: 0.5483
 epoch: 19, train_loss: 0.9233, test_loss: 1.0857, test_f1: 0.5467
 epoch: 20, train_loss: 0.9147, test_loss: 1.0791, test_f1: 0.5537
 epoch: 21, train_loss: 0.9078, test_loss: 1.0605, test_f1: 0.5538
 epoch: 22, train_loss: 0.9010, test_loss: 1.0887, test_f1: 0.5715
 epoch: 23, train_loss: 0.8961, test_loss: 1.0995, test_f1: 0.5643
 epoch: 24, train_loss: 0.8877, test_loss: 1.0951, test_f1: 0.5515
 epoch: 25, train_loss: 0.8807, test_loss: 1.1068, test_f1: 0.5511
 epoch: 26, train_loss: 0.8770, test_loss: 1.1054, test_f1: 0.5572
 epoch: 27, train_loss: 0.8719, test_loss: 1.1220, test_f1: 0.5575
 epoch: 28, train_loss: 0.8698, test_loss: 1.0941, test_f1: 0.5642
 epoch: 29, train_loss: 0.8559, test_loss: 1.0983, test_f1: 0.5674
 epoch: 30, train_loss: 0.8678, test_loss: 1.1377, test_f1: 0.5587
 epoch: 31, train_loss: 0.8560, test_loss: 1.1267, test_f1: 0.5460
 epoch: 32, train_loss: 0.8597, test_loss: 1.1326, test_f1: 0.5544
 epoch: 33, train_loss: 0.8537, test_loss: 1.0993, test_f1: 0.5543
 epoch: 34, train_loss: 0.8535, test_loss: 1.0908, test_f1: 0.5673
 epoch: 35, train_loss: 0.8476, test_loss: 1.1197, test_f1: 0.5517
 epoch: 36, train_loss: 0.8278, test_loss: 1.1292, test_f1: 0.5542
 epoch: 37, train_loss: 0.8221, test_loss: 1.1055, test_f1: 0.5713
 epoch: 38, train_loss: 0.8265, test_loss: 1.1347, test_f1: 0.5408
 epoch: 39, train_loss: 0.8326, test_loss: 1.1254, test_f1: 0.5597
 epoch: 40, train_loss: 0.8236, test_loss: 1.1117, test_f1: 0.5645
 epoch: 41, train_loss: 0.8091, test_loss: 1.1440, test_f1: 0.5452
 epoch: 42, train_loss: 0.8201, test_loss: 1.1265, test_f1: 0.5826
 epoch: 43, train_loss: 0.8211, test_loss: 1.1130, test_f1: 0.5807
 epoch: 44, train_loss: 0.7979, test_loss: 1.1441, test_f1: 0.5548
 epoch: 45, train_loss: 0.8060, test_loss: 1.1604, test_f1: 0.5564
 epoch: 46, train_loss: 0.8051, test_loss: 1.1288, test_f1: 0.5728
 epoch: 47, train_loss: 0.8071, test_loss: 1.1251, test_f1: 0.5569
 epoch: 48, train_loss: 0.8081, test_loss: 1.1142, test_f1: 0.5858
 epoch: 49, train_loss: 0.8036, test_loss: 1.1442, test_f1: 0.5483
 epoch: 50, train_loss: 0.7903, test_loss: 1.1378, test_f1: 0.5539
 epoch: 51, train_loss: 0.7910, test_loss: 1.1585, test_f1: 0.5683
 epoch: 52, train_loss: 0.7831, test_loss: 1.1509, test_f1: 0.5657
 epoch: 53, train_loss: 0.7672, test_loss: 1.1539, test_f1: 0.5574
 epoch: 54, train_loss: 0.7639, test_loss: 1.1706, test_f1: 0.5652
 epoch: 55, train_loss: 0.7767, test_loss: 1.1554, test_f1: 0.5742
 epoch: 56, train_loss: 0.7656, test_loss: 1.1321, test_f1: 0.5823
 epoch: 57, train_loss: 0.7645, test_loss: 1.1583, test_f1: 0.5729
 epoch: 58, train_loss: 0.7703, test_loss: 1.1575, test_f1: 0.5622
 epoch: 59, train_loss: 0.7582, test_loss: 1.1504, test_f1: 0.5671
 epoch: 60, train_loss: 0.7400, test_loss: 1.1702, test_f1: 0.5643
 epoch: 61, train_loss: 0.7642, test_loss: 1.1904, test_f1: 0.5698
 epoch: 62, train_loss: 0.7605, test_loss: 1.1711, test_f1: 0.5665
 epoch: 63, train_loss: 0.7434, test_loss: 1.1835, test_f1: 0.5565
 epoch: 64, train_loss: 0.7476, test_loss: 1.1793, test_f1: 0.5572
 epoch: 65, train_loss: 0.7475, test_loss: 1.1966, test_f1: 0.5562
 epoch: 66, train_loss: 0.7335, test_loss: 1.1769, test_f1: 0.5578
 epoch: 67, train_loss: 0.7468, test_loss: 1.2151, test_f1: 0.5574
 epoch: 68, train_loss: 0.7362, test_loss: 1.1900, test_f1: 0.5651
 epoch: 69, train_loss: 0.7374, test_loss: 1.1904, test_f1: 0.5676
 epoch: 70, train_loss: 0.7453, test_loss: 1.2020, test_f1: 0.5642
 epoch: 71, train_loss: 0.7547, test_loss: 1.2218, test_f1: 0.5714
 epoch: 72, train_loss: 0.7457, test_loss: 1.2064, test_f1: 0.5651
 epoch: 73, train_loss: 0.7562, test_loss: 1.2052, test_f1: 0.5594
 epoch: 74, train_loss: 0.7516, test_loss: 1.2422, test_f1: 0.5539
 epoch: 75, train_loss: 0.7256, test_loss: 1.2103, test_f1: 0.5675
 epoch: 76, train_loss: 0.7381, test_loss: 1.2254, test_f1: 0.5545
 epoch: 77, train_loss: 0.7216, test_loss: 1.2136, test_f1: 0.5729
 epoch: 78, train_loss: 0.7362, test_loss: 1.2542, test_f1: 0.5566
 epoch: 79, train_loss: 0.7030, test_loss: 1.2281, test_f1: 0.5696
 epoch: 80, train_loss: 0.7270, test_loss: 1.2406, test_f1: 0.5855
 epoch: 81, train_loss: 0.7279, test_loss: 1.2545, test_f1: 0.5711
 epoch: 82, train_loss: 0.7297, test_loss: 1.2288, test_f1: 0.5857
 epoch: 83, train_loss: 0.7212, test_loss: 1.2229, test_f1: 0.5702
 epoch: 84, train_loss: 0.7139, test_loss: 1.2514, test_f1: 0.5751
 epoch: 85, train_loss: 0.7261, test_loss: 1.2341, test_f1: 0.5694
 epoch: 86, train_loss: 0.7113, test_loss: 1.2905, test_f1: 0.5509
 epoch: 87, train_loss: 0.7112, test_loss: 1.2338, test_f1: 0.5622
 epoch: 88, train_loss: 0.7296, test_loss: 1.2306, test_f1: 0.5806
 epoch: 89, train_loss: 0.7072, test_loss: 1.2405, test_f1: 0.5615
 epoch: 90, train_loss: 0.7158, test_loss: 1.2391, test_f1: 0.5644
 epoch: 91, train_loss: 0.7013, test_loss: 1.2600, test_f1: 0.5686
 epoch: 92, train_loss: 0.7122, test_loss: 1.2464, test_f1: 0.5868
 epoch: 93, train_loss: 0.7173, test_loss: 1.2408, test_f1: 0.5705
 epoch: 94, train_loss: 0.7080, test_loss: 1.2503, test_f1: 0.5705
 epoch: 95, train_loss: 0.6914, test_loss: 1.2308, test_f1: 0.5781
 epoch: 96, train_loss: 0.7089, test_loss: 1.2593, test_f1: 0.5744
 epoch: 97, train_loss: 0.7101, test_loss: 1.2544, test_f1: 0.5806
 epoch: 98, train_loss: 0.6891, test_loss: 1.2538, test_f1: 0.5696
 epoch: 99, train_loss: 0.6975, test_loss: 1.2580, test_f1: 0.5720
##################ITERATION #7 ****************************************
 epoch: 0, train_loss: 1.2461, test_loss: 1.3211, test_f1: 0.2677
 epoch: 1, train_loss: 1.1451, test_loss: 1.1922, test_f1: 0.4238
 epoch: 2, train_loss: 1.1235, test_loss: 1.1700, test_f1: 0.4616
 epoch: 3, train_loss: 1.1021, test_loss: 1.1695, test_f1: 0.4717
 epoch: 4, train_loss: 1.0810, test_loss: 1.1562, test_f1: 0.4558
 epoch: 5, train_loss: 1.0743, test_loss: 1.1425, test_f1: 0.4775
 epoch: 6, train_loss: 1.0538, test_loss: 1.1263, test_f1: 0.4903
 epoch: 7, train_loss: 1.0321, test_loss: 1.1204, test_f1: 0.5154
 epoch: 8, train_loss: 1.0304, test_loss: 1.1169, test_f1: 0.4994
 epoch: 9, train_loss: 1.0216, test_loss: 1.0921, test_f1: 0.5200
 epoch: 10, train_loss: 1.0269, test_loss: 1.0890, test_f1: 0.5096
 epoch: 11, train_loss: 0.9875, test_loss: 1.1061, test_f1: 0.5079
 epoch: 12, train_loss: 0.9837, test_loss: 1.0964, test_f1: 0.4968
 epoch: 13, train_loss: 0.9766, test_loss: 1.0995, test_f1: 0.5055
 epoch: 14, train_loss: 0.9670, test_loss: 1.1009, test_f1: 0.5053
 epoch: 15, train_loss: 0.9809, test_loss: 1.0908, test_f1: 0.5147
 epoch: 16, train_loss: 0.9658, test_loss: 1.0717, test_f1: 0.5249
 epoch: 17, train_loss: 0.9487, test_loss: 1.1043, test_f1: 0.4873
 epoch: 18, train_loss: 0.9351, test_loss: 1.0738, test_f1: 0.5390
 epoch: 19, train_loss: 0.9401, test_loss: 1.0678, test_f1: 0.5288
 epoch: 20, train_loss: 0.9388, test_loss: 1.0643, test_f1: 0.5550
 epoch: 21, train_loss: 0.9457, test_loss: 1.0645, test_f1: 0.5242
 epoch: 22, train_loss: 0.9325, test_loss: 1.0449, test_f1: 0.5476
 epoch: 23, train_loss: 0.9307, test_loss: 1.0732, test_f1: 0.5313
 epoch: 24, train_loss: 0.9269, test_loss: 1.0433, test_f1: 0.5479
 epoch: 25, train_loss: 0.8925, test_loss: 1.0667, test_f1: 0.5386
 epoch: 26, train_loss: 0.8897, test_loss: 1.0622, test_f1: 0.5469
 epoch: 27, train_loss: 0.8981, test_loss: 1.0520, test_f1: 0.5588
 epoch: 28, train_loss: 0.8882, test_loss: 1.0551, test_f1: 0.5579
 epoch: 29, train_loss: 0.8813, test_loss: 1.0656, test_f1: 0.5544
 epoch: 30, train_loss: 0.8917, test_loss: 1.0535, test_f1: 0.5568
 epoch: 31, train_loss: 0.8540, test_loss: 1.0447, test_f1: 0.5675
 epoch: 32, train_loss: 0.8861, test_loss: 1.0396, test_f1: 0.5776
 epoch: 33, train_loss: 0.8656, test_loss: 1.0388, test_f1: 0.5696
 epoch: 34, train_loss: 0.8562, test_loss: 1.0462, test_f1: 0.5803
 epoch: 35, train_loss: 0.8685, test_loss: 1.0690, test_f1: 0.5408
 epoch: 36, train_loss: 0.8725, test_loss: 1.0384, test_f1: 0.5739
 epoch: 37, train_loss: 0.8533, test_loss: 1.0341, test_f1: 0.5868
 epoch: 38, train_loss: 0.8607, test_loss: 1.0329, test_f1: 0.5701
 epoch: 39, train_loss: 0.8518, test_loss: 1.0605, test_f1: 0.5629
 epoch: 40, train_loss: 0.8431, test_loss: 1.0378, test_f1: 0.5781
 epoch: 41, train_loss: 0.8411, test_loss: 1.0443, test_f1: 0.5738
 epoch: 42, train_loss: 0.8409, test_loss: 1.0596, test_f1: 0.5656
 epoch: 43, train_loss: 0.8438, test_loss: 1.0380, test_f1: 0.5746
 epoch: 44, train_loss: 0.8428, test_loss: 1.0258, test_f1: 0.5764
 epoch: 45, train_loss: 0.8290, test_loss: 1.0213, test_f1: 0.5842
 epoch: 46, train_loss: 0.8230, test_loss: 1.0363, test_f1: 0.5756
 epoch: 47, train_loss: 0.8278, test_loss: 1.0616, test_f1: 0.5758
 epoch: 48, train_loss: 0.8319, test_loss: 1.0639, test_f1: 0.5587
 epoch: 49, train_loss: 0.8148, test_loss: 1.0248, test_f1: 0.5926
 epoch: 50, train_loss: 0.7980, test_loss: 1.0452, test_f1: 0.5952
 epoch: 51, train_loss: 0.7933, test_loss: 1.0434, test_f1: 0.5815
 epoch: 52, train_loss: 0.8059, test_loss: 1.0367, test_f1: 0.5944
 epoch: 53, train_loss: 0.8043, test_loss: 1.0592, test_f1: 0.5823
 epoch: 54, train_loss: 0.7954, test_loss: 1.0625, test_f1: 0.5864
 epoch: 55, train_loss: 0.7953, test_loss: 1.0630, test_f1: 0.5873
 epoch: 56, train_loss: 0.7936, test_loss: 1.0418, test_f1: 0.5820
 epoch: 57, train_loss: 0.7886, test_loss: 1.0478, test_f1: 0.5955
 epoch: 58, train_loss: 0.7931, test_loss: 1.0510, test_f1: 0.5895
 epoch: 59, train_loss: 0.7891, test_loss: 1.0444, test_f1: 0.5951
 epoch: 60, train_loss: 0.8046, test_loss: 1.0146, test_f1: 0.5955
 epoch: 61, train_loss: 0.7928, test_loss: 1.0806, test_f1: 0.5809
 epoch: 62, train_loss: 0.7772, test_loss: 1.0582, test_f1: 0.5787
 epoch: 63, train_loss: 0.7893, test_loss: 1.0327, test_f1: 0.5954
 epoch: 64, train_loss: 0.7856, test_loss: 1.0666, test_f1: 0.5781
 epoch: 65, train_loss: 0.7739, test_loss: 1.0834, test_f1: 0.5836
 epoch: 66, train_loss: 0.7749, test_loss: 1.0628, test_f1: 0.5957
 epoch: 67, train_loss: 0.7924, test_loss: 1.0624, test_f1: 0.5925
 epoch: 68, train_loss: 0.7771, test_loss: 1.0741, test_f1: 0.5896
 epoch: 69, train_loss: 0.7665, test_loss: 1.0796, test_f1: 0.5874
 epoch: 70, train_loss: 0.7569, test_loss: 1.0520, test_f1: 0.6010
 epoch: 71, train_loss: 0.7630, test_loss: 1.1014, test_f1: 0.5809
 epoch: 72, train_loss: 0.7677, test_loss: 1.0579, test_f1: 0.5904
 epoch: 73, train_loss: 0.7656, test_loss: 1.0762, test_f1: 0.5905
 epoch: 74, train_loss: 0.7790, test_loss: 1.0824, test_f1: 0.5980
 epoch: 75, train_loss: 0.7465, test_loss: 1.0619, test_f1: 0.5769
 epoch: 76, train_loss: 0.7599, test_loss: 1.0824, test_f1: 0.5874
 epoch: 77, train_loss: 0.7566, test_loss: 1.0554, test_f1: 0.5908
 epoch: 78, train_loss: 0.7665, test_loss: 1.0807, test_f1: 0.5924
 epoch: 79, train_loss: 0.7628, test_loss: 1.1152, test_f1: 0.5680
 epoch: 80, train_loss: 0.7630, test_loss: 1.0664, test_f1: 0.6000
 epoch: 81, train_loss: 0.7420, test_loss: 1.0611, test_f1: 0.5850
 epoch: 82, train_loss: 0.7621, test_loss: 1.1018, test_f1: 0.5961
 epoch: 83, train_loss: 0.7478, test_loss: 1.1191, test_f1: 0.5832
 epoch: 84, train_loss: 0.7562, test_loss: 1.1119, test_f1: 0.5908
 epoch: 85, train_loss: 0.7557, test_loss: 1.0937, test_f1: 0.5871
 epoch: 86, train_loss: 0.7673, test_loss: 1.1003, test_f1: 0.5927
 epoch: 87, train_loss: 0.7476, test_loss: 1.1111, test_f1: 0.5929
 epoch: 88, train_loss: 0.7391, test_loss: 1.1090, test_f1: 0.6027
 epoch: 89, train_loss: 0.7559, test_loss: 1.1206, test_f1: 0.6026
 epoch: 90, train_loss: 0.7360, test_loss: 1.0982, test_f1: 0.5901
 epoch: 91, train_loss: 0.7555, test_loss: 1.0885, test_f1: 0.5897
 epoch: 92, train_loss: 0.7275, test_loss: 1.1208, test_f1: 0.6106
 epoch: 93, train_loss: 0.7396, test_loss: 1.1369, test_f1: 0.5947
 epoch: 94, train_loss: 0.7393, test_loss: 1.1245, test_f1: 0.5988
 epoch: 95, train_loss: 0.7303, test_loss: 1.1523, test_f1: 0.5911
 epoch: 96, train_loss: 0.7302, test_loss: 1.1682, test_f1: 0.5902
 epoch: 97, train_loss: 0.7351, test_loss: 1.1190, test_f1: 0.5987
 epoch: 98, train_loss: 0.7310, test_loss: 1.1314, test_f1: 0.5968
 epoch: 99, train_loss: 0.7205, test_loss: 1.1207, test_f1: 0.5867
##################ITERATION #8 ****************************************
 epoch: 0, train_loss: 1.2794, test_loss: 1.2007, test_f1: 0.3306
 epoch: 1, train_loss: 1.1479, test_loss: 1.1511, test_f1: 0.3994
 epoch: 2, train_loss: 1.1166, test_loss: 1.1296, test_f1: 0.4771
 epoch: 3, train_loss: 1.0909, test_loss: 1.1202, test_f1: 0.4607
 epoch: 4, train_loss: 1.1075, test_loss: 1.1170, test_f1: 0.4715
 epoch: 5, train_loss: 1.0769, test_loss: 1.1065, test_f1: 0.4957
 epoch: 6, train_loss: 1.0593, test_loss: 1.1533, test_f1: 0.4756
 epoch: 7, train_loss: 1.0327, test_loss: 1.1730, test_f1: 0.4842
 epoch: 8, train_loss: 1.0410, test_loss: 1.1428, test_f1: 0.5230
 epoch: 9, train_loss: 1.0168, test_loss: 1.1230, test_f1: 0.5151
 epoch: 10, train_loss: 1.0052, test_loss: 1.1142, test_f1: 0.5141
 epoch: 11, train_loss: 0.9909, test_loss: 1.1114, test_f1: 0.5124
 epoch: 12, train_loss: 0.9942, test_loss: 1.1023, test_f1: 0.5282
 epoch: 13, train_loss: 0.9882, test_loss: 1.0581, test_f1: 0.5304
 epoch: 14, train_loss: 0.9909, test_loss: 1.0819, test_f1: 0.5318
 epoch: 15, train_loss: 0.9508, test_loss: 1.0801, test_f1: 0.5410
 epoch: 16, train_loss: 0.9628, test_loss: 1.0621, test_f1: 0.5515
 epoch: 17, train_loss: 0.9467, test_loss: 1.0779, test_f1: 0.5372
 epoch: 18, train_loss: 0.9395, test_loss: 1.0972, test_f1: 0.5152
 epoch: 19, train_loss: 0.9384, test_loss: 1.1390, test_f1: 0.5364
 epoch: 20, train_loss: 0.9329, test_loss: 1.1146, test_f1: 0.5402
 epoch: 21, train_loss: 0.9441, test_loss: 1.0935, test_f1: 0.5605
 epoch: 22, train_loss: 0.9276, test_loss: 1.0955, test_f1: 0.5541
 epoch: 23, train_loss: 0.9174, test_loss: 1.1035, test_f1: 0.5460
 epoch: 24, train_loss: 0.9111, test_loss: 1.0926, test_f1: 0.5848
 epoch: 25, train_loss: 0.9065, test_loss: 1.1169, test_f1: 0.5464
 epoch: 26, train_loss: 0.9006, test_loss: 1.0471, test_f1: 0.5762
 epoch: 27, train_loss: 0.9088, test_loss: 1.0454, test_f1: 0.5723
 epoch: 28, train_loss: 0.8802, test_loss: 1.0751, test_f1: 0.5692
 epoch: 29, train_loss: 0.8859, test_loss: 1.0776, test_f1: 0.5471
 epoch: 30, train_loss: 0.8876, test_loss: 1.1120, test_f1: 0.5506
 epoch: 31, train_loss: 0.8894, test_loss: 1.0223, test_f1: 0.5699
 epoch: 32, train_loss: 0.8794, test_loss: 1.0375, test_f1: 0.5778
 epoch: 33, train_loss: 0.8849, test_loss: 1.0837, test_f1: 0.5799
 epoch: 34, train_loss: 0.8539, test_loss: 1.0567, test_f1: 0.5675
 epoch: 35, train_loss: 0.8693, test_loss: 1.0873, test_f1: 0.5808
 epoch: 36, train_loss: 0.8584, test_loss: 1.1179, test_f1: 0.5644
 epoch: 37, train_loss: 0.8693, test_loss: 1.0934, test_f1: 0.5672
 epoch: 38, train_loss: 0.8620, test_loss: 1.0826, test_f1: 0.5972
 epoch: 39, train_loss: 0.8537, test_loss: 1.1146, test_f1: 0.5684
 epoch: 40, train_loss: 0.8288, test_loss: 1.0973, test_f1: 0.5844
 epoch: 41, train_loss: 0.8436, test_loss: 1.0418, test_f1: 0.5612
 epoch: 42, train_loss: 0.8498, test_loss: 1.1155, test_f1: 0.5838
 epoch: 43, train_loss: 0.8453, test_loss: 1.0862, test_f1: 0.5799
 epoch: 44, train_loss: 0.8173, test_loss: 1.1072, test_f1: 0.5725
 epoch: 45, train_loss: 0.8265, test_loss: 1.0632, test_f1: 0.5815
 epoch: 46, train_loss: 0.8445, test_loss: 1.0251, test_f1: 0.5988
 epoch: 47, train_loss: 0.8167, test_loss: 1.0691, test_f1: 0.5842
 epoch: 48, train_loss: 0.8234, test_loss: 1.1040, test_f1: 0.6012
 epoch: 49, train_loss: 0.8098, test_loss: 1.1086, test_f1: 0.6039
 epoch: 50, train_loss: 0.8187, test_loss: 1.0622, test_f1: 0.5822
 epoch: 51, train_loss: 0.8089, test_loss: 1.0854, test_f1: 0.5998
 epoch: 52, train_loss: 0.8035, test_loss: 1.0969, test_f1: 0.6047
 epoch: 53, train_loss: 0.7899, test_loss: 1.1112, test_f1: 0.5981
 epoch: 54, train_loss: 0.7949, test_loss: 1.1008, test_f1: 0.6053
 epoch: 55, train_loss: 0.7961, test_loss: 1.1268, test_f1: 0.6006
 epoch: 56, train_loss: 0.7818, test_loss: 1.1101, test_f1: 0.5916
 epoch: 57, train_loss: 0.7673, test_loss: 1.0868, test_f1: 0.5951
 epoch: 58, train_loss: 0.7973, test_loss: 1.1112, test_f1: 0.6019
 epoch: 59, train_loss: 0.7837, test_loss: 1.0741, test_f1: 0.6027
 epoch: 60, train_loss: 0.7723, test_loss: 1.1087, test_f1: 0.5973
 epoch: 61, train_loss: 0.7727, test_loss: 1.1264, test_f1: 0.6092
 epoch: 62, train_loss: 0.7838, test_loss: 1.1185, test_f1: 0.6135
 epoch: 63, train_loss: 0.7962, test_loss: 1.0942, test_f1: 0.5998
 epoch: 64, train_loss: 0.7748, test_loss: 1.0925, test_f1: 0.6027
 epoch: 65, train_loss: 0.7540, test_loss: 1.0673, test_f1: 0.6005
 epoch: 66, train_loss: 0.7608, test_loss: 1.0952, test_f1: 0.5887
 epoch: 67, train_loss: 0.7695, test_loss: 1.0890, test_f1: 0.6146
 epoch: 68, train_loss: 0.7662, test_loss: 1.0725, test_f1: 0.5899
 epoch: 69, train_loss: 0.7644, test_loss: 1.0870, test_f1: 0.6011
 epoch: 70, train_loss: 0.7822, test_loss: 1.1212, test_f1: 0.5936
 epoch: 71, train_loss: 0.7576, test_loss: 1.0823, test_f1: 0.6102
 epoch: 72, train_loss: 0.7455, test_loss: 1.1404, test_f1: 0.6022
 epoch: 73, train_loss: 0.7623, test_loss: 1.0877, test_f1: 0.5965
 epoch: 74, train_loss: 0.7540, test_loss: 1.0761, test_f1: 0.6071
 epoch: 75, train_loss: 0.7321, test_loss: 1.0995, test_f1: 0.5978
 epoch: 76, train_loss: 0.7483, test_loss: 1.0767, test_f1: 0.6031
 epoch: 77, train_loss: 0.7573, test_loss: 1.1039, test_f1: 0.6093
 epoch: 78, train_loss: 0.7543, test_loss: 1.1100, test_f1: 0.6109
 epoch: 79, train_loss: 0.7530, test_loss: 1.1081, test_f1: 0.6070
 epoch: 80, train_loss: 0.7488, test_loss: 1.0655, test_f1: 0.6084
 epoch: 81, train_loss: 0.7347, test_loss: 1.1136, test_f1: 0.5966
 epoch: 82, train_loss: 0.7297, test_loss: 1.1120, test_f1: 0.6078
 epoch: 83, train_loss: 0.7396, test_loss: 1.1164, test_f1: 0.6082
 epoch: 84, train_loss: 0.7332, test_loss: 1.0801, test_f1: 0.6289
 epoch: 85, train_loss: 0.7290, test_loss: 1.0905, test_f1: 0.6129
 epoch: 86, train_loss: 0.7314, test_loss: 1.1301, test_f1: 0.6088
 epoch: 87, train_loss: 0.7460, test_loss: 1.1024, test_f1: 0.6133
 epoch: 88, train_loss: 0.7350, test_loss: 1.1224, test_f1: 0.6051
 epoch: 89, train_loss: 0.7125, test_loss: 1.0766, test_f1: 0.6145
 epoch: 90, train_loss: 0.7417, test_loss: 1.0726, test_f1: 0.6196
 epoch: 91, train_loss: 0.7336, test_loss: 1.0693, test_f1: 0.6058
 epoch: 92, train_loss: 0.7249, test_loss: 1.1434, test_f1: 0.6195
 epoch: 93, train_loss: 0.7177, test_loss: 1.1248, test_f1: 0.6307
 epoch: 94, train_loss: 0.7136, test_loss: 1.1322, test_f1: 0.6362
 epoch: 95, train_loss: 0.7179, test_loss: 1.1173, test_f1: 0.6215
 epoch: 96, train_loss: 0.7117, test_loss: 1.1118, test_f1: 0.6371
 epoch: 97, train_loss: 0.7242, test_loss: 1.1168, test_f1: 0.6188
 epoch: 98, train_loss: 0.7267, test_loss: 1.1657, test_f1: 0.6233
 epoch: 99, train_loss: 0.7031, test_loss: 1.1978, test_f1: 0.6207
##################ITERATION #9 ****************************************
 epoch: 0, train_loss: 1.2627, test_loss: 1.2739, test_f1: 0.3092
 epoch: 1, train_loss: 1.1471, test_loss: 1.2169, test_f1: 0.4200
 epoch: 2, train_loss: 1.1251, test_loss: 1.1791, test_f1: 0.4511
 epoch: 3, train_loss: 1.0681, test_loss: 1.1806, test_f1: 0.4563
 epoch: 4, train_loss: 1.0709, test_loss: 1.1941, test_f1: 0.4683
 epoch: 5, train_loss: 1.0400, test_loss: 1.1825, test_f1: 0.4912
 epoch: 6, train_loss: 1.0332, test_loss: 1.1643, test_f1: 0.4860
 epoch: 7, train_loss: 1.0263, test_loss: 1.1594, test_f1: 0.4928
 epoch: 8, train_loss: 1.0009, test_loss: 1.1567, test_f1: 0.5122
 epoch: 9, train_loss: 0.9938, test_loss: 1.1572, test_f1: 0.5199
 epoch: 10, train_loss: 0.9854, test_loss: 1.1560, test_f1: 0.5257
 epoch: 11, train_loss: 0.9912, test_loss: 1.1523, test_f1: 0.5375
 epoch: 12, train_loss: 0.9618, test_loss: 1.1273, test_f1: 0.5378
 epoch: 13, train_loss: 0.9660, test_loss: 1.1405, test_f1: 0.5408
 epoch: 14, train_loss: 0.9489, test_loss: 1.0967, test_f1: 0.5338
 epoch: 15, train_loss: 0.9497, test_loss: 1.1105, test_f1: 0.5394
 epoch: 16, train_loss: 0.9347, test_loss: 1.0951, test_f1: 0.5552
 epoch: 17, train_loss: 0.9265, test_loss: 1.0996, test_f1: 0.5559
 epoch: 18, train_loss: 0.9129, test_loss: 1.1137, test_f1: 0.5470
 epoch: 19, train_loss: 0.9156, test_loss: 1.0913, test_f1: 0.5494
 epoch: 20, train_loss: 0.9068, test_loss: 1.1033, test_f1: 0.5430
 epoch: 21, train_loss: 0.8945, test_loss: 1.0756, test_f1: 0.5516
 epoch: 22, train_loss: 0.8938, test_loss: 1.1214, test_f1: 0.5436
 epoch: 23, train_loss: 0.8868, test_loss: 1.0493, test_f1: 0.5655
 epoch: 24, train_loss: 0.8866, test_loss: 1.0698, test_f1: 0.5609
 epoch: 25, train_loss: 0.8692, test_loss: 1.0644, test_f1: 0.5523
 epoch: 26, train_loss: 0.8567, test_loss: 1.0626, test_f1: 0.5440
 epoch: 27, train_loss: 0.8666, test_loss: 1.0889, test_f1: 0.5481
 epoch: 28, train_loss: 0.8650, test_loss: 1.0830, test_f1: 0.5513
 epoch: 29, train_loss: 0.8578, test_loss: 1.0663, test_f1: 0.5561
 epoch: 30, train_loss: 0.8434, test_loss: 1.0662, test_f1: 0.5719
 epoch: 31, train_loss: 0.8372, test_loss: 1.0711, test_f1: 0.5712
 epoch: 32, train_loss: 0.8454, test_loss: 1.0933, test_f1: 0.5791
 epoch: 33, train_loss: 0.8363, test_loss: 1.0978, test_f1: 0.5948
 epoch: 34, train_loss: 0.8308, test_loss: 1.1439, test_f1: 0.5381
 epoch: 35, train_loss: 0.8452, test_loss: 1.0801, test_f1: 0.5684
 epoch: 36, train_loss: 0.8198, test_loss: 1.1169, test_f1: 0.5451
 epoch: 37, train_loss: 0.8115, test_loss: 1.1030, test_f1: 0.5860
 epoch: 38, train_loss: 0.8089, test_loss: 1.1178, test_f1: 0.5828
 epoch: 39, train_loss: 0.8057, test_loss: 1.1028, test_f1: 0.5787
 epoch: 40, train_loss: 0.8020, test_loss: 1.0698, test_f1: 0.5856
 epoch: 41, train_loss: 0.8138, test_loss: 1.1131, test_f1: 0.5932
 epoch: 42, train_loss: 0.7920, test_loss: 1.1203, test_f1: 0.5892
 epoch: 43, train_loss: 0.7893, test_loss: 1.1373, test_f1: 0.5483
 epoch: 44, train_loss: 0.7742, test_loss: 1.1107, test_f1: 0.5637
 epoch: 45, train_loss: 0.7910, test_loss: 1.0906, test_f1: 0.5789
 epoch: 46, train_loss: 0.7894, test_loss: 1.1040, test_f1: 0.5765
 epoch: 47, train_loss: 0.7854, test_loss: 1.1084, test_f1: 0.5903
 epoch: 48, train_loss: 0.7802, test_loss: 1.0648, test_f1: 0.5885
 epoch: 49, train_loss: 0.7601, test_loss: 1.0648, test_f1: 0.6095
 epoch: 50, train_loss: 0.7738, test_loss: 1.1243, test_f1: 0.5849
 epoch: 51, train_loss: 0.7582, test_loss: 1.1296, test_f1: 0.5793
 epoch: 52, train_loss: 0.7573, test_loss: 1.1146, test_f1: 0.5990
 epoch: 53, train_loss: 0.7568, test_loss: 1.1086, test_f1: 0.5798
 epoch: 54, train_loss: 0.7411, test_loss: 1.1058, test_f1: 0.5929
 epoch: 55, train_loss: 0.7486, test_loss: 1.1220, test_f1: 0.5867
 epoch: 56, train_loss: 0.7495, test_loss: 1.1027, test_f1: 0.5827
 epoch: 57, train_loss: 0.7486, test_loss: 1.1099, test_f1: 0.5912
 epoch: 58, train_loss: 0.7543, test_loss: 1.1218, test_f1: 0.5854
 epoch: 59, train_loss: 0.7351, test_loss: 1.1148, test_f1: 0.5748
 epoch: 60, train_loss: 0.7417, test_loss: 1.0977, test_f1: 0.5771
 epoch: 61, train_loss: 0.7423, test_loss: 1.1343, test_f1: 0.5603
 epoch: 62, train_loss: 0.7281, test_loss: 1.1210, test_f1: 0.5795
 epoch: 63, train_loss: 0.7213, test_loss: 1.1224, test_f1: 0.5879
 epoch: 64, train_loss: 0.7256, test_loss: 1.1074, test_f1: 0.5825
 epoch: 65, train_loss: 0.7377, test_loss: 1.1693, test_f1: 0.5634
 epoch: 66, train_loss: 0.7310, test_loss: 1.1192, test_f1: 0.5824
 epoch: 67, train_loss: 0.7329, test_loss: 1.1098, test_f1: 0.5898
 epoch: 68, train_loss: 0.7163, test_loss: 1.1145, test_f1: 0.5939
 epoch: 69, train_loss: 0.7221, test_loss: 1.1053, test_f1: 0.5835
 epoch: 70, train_loss: 0.7201, test_loss: 1.1432, test_f1: 0.5780
 epoch: 71, train_loss: 0.7176, test_loss: 1.1140, test_f1: 0.5884
 epoch: 72, train_loss: 0.7220, test_loss: 1.1273, test_f1: 0.5854
 epoch: 73, train_loss: 0.7159, test_loss: 1.1426, test_f1: 0.5786
 epoch: 74, train_loss: 0.7008, test_loss: 1.1427, test_f1: 0.5864
 epoch: 75, train_loss: 0.7096, test_loss: 1.1160, test_f1: 0.5938
 epoch: 76, train_loss: 0.7106, test_loss: 1.1769, test_f1: 0.5562
 epoch: 77, train_loss: 0.7111, test_loss: 1.1507, test_f1: 0.5779
 epoch: 78, train_loss: 0.6938, test_loss: 1.1792, test_f1: 0.5462
 epoch: 79, train_loss: 0.6963, test_loss: 1.1981, test_f1: 0.5610
 epoch: 80, train_loss: 0.7165, test_loss: 1.1738, test_f1: 0.5725
 epoch: 81, train_loss: 0.6951, test_loss: 1.1710, test_f1: 0.5830
 epoch: 82, train_loss: 0.6863, test_loss: 1.1928, test_f1: 0.5705
 epoch: 83, train_loss: 0.6814, test_loss: 1.1704, test_f1: 0.5725
 epoch: 84, train_loss: 0.6984, test_loss: 1.1791, test_f1: 0.5863
 epoch: 85, train_loss: 0.6937, test_loss: 1.1489, test_f1: 0.5863
 epoch: 86, train_loss: 0.6707, test_loss: 1.1885, test_f1: 0.5838
 epoch: 87, train_loss: 0.6867, test_loss: 1.1491, test_f1: 0.5936
 epoch: 88, train_loss: 0.6721, test_loss: 1.1625, test_f1: 0.5909
 epoch: 89, train_loss: 0.6941, test_loss: 1.2080, test_f1: 0.5808
 epoch: 90, train_loss: 0.6758, test_loss: 1.1683, test_f1: 0.5838
 epoch: 91, train_loss: 0.6814, test_loss: 1.1706, test_f1: 0.5858
 epoch: 92, train_loss: 0.6798, test_loss: 1.2069, test_f1: 0.5707
 epoch: 93, train_loss: 0.6749, test_loss: 1.1889, test_f1: 0.5995
 epoch: 94, train_loss: 0.6630, test_loss: 1.2095, test_f1: 0.5792
 epoch: 95, train_loss: 0.6656, test_loss: 1.2036, test_f1: 0.5791
 epoch: 96, train_loss: 0.6753, test_loss: 1.2064, test_f1: 0.5843
 epoch: 97, train_loss: 0.6671, test_loss: 1.2069, test_f1: 0.5969
 epoch: 98, train_loss: 0.6569, test_loss: 1.2031, test_f1: 0.5770
 epoch: 99, train_loss: 0.6774, test_loss: 1.2040, test_f1: 0.6099

Training completed in 721.53 seconds
Best F1: 0.6371 at epoch 96
Mean F1 across iterations: 0.6063  0.0170
========================FINAL RESULTS================================
FEGIN weighted F1: 0.6371  0.0170
python main.py --data ltspice_demos --representation component_net --model FEGIN --layers 5 --hiddens 64 --batch_size 32 --lr 0.0001 --emb_size 250 --epochs 100 --save_appendix component_net_L5_H64_BS32_LR0.0001_E250 --no_val
-----



STDERR:
  File "main.py", line 370, in <module>
    main()
  File "main.py", line 254, in main
    dataset = dataset_class(
  File "/home/philip/projects/ltspice_examples_code_repo/Circuit-Completion-Using-GNNs/component_classification_with_link_prediction_head/evaluation/FEGIN/kernel/circuit_datasets.py", line 15, in __init__
    self.data, self.slices = torch.load(self.processed_paths[0])
  File "/home/philip/.local/lib/python3.8/site-packages/torch/serialization.py", line 1040, in load
    warnings.warn(
  File "/usr/lib/python3.8/warnings.py", line 109, in _showwarnmsg
    sw(msg.message, msg.category, msg.filename, msg.lineno,
  File "main.py", line 47, in warn_with_traceback
    traceback.print_stack(file=log)
/home/philip/projects/ltspice_examples_code_repo/Circuit-Completion-Using-GNNs/component_classification_with_link_prediction_head/evaluation/FEGIN/kernel/circuit_datasets.py:15: FutureWarning: You are using `torch.load` with `weights_only=False` (the current default value), which uses the default pickle module implicitly. It is possible to construct malicious pickle data which will execute arbitrary code during unpickling (See https://github.com/pytorch/pytorch/blob/main/SECURITY.md#untrusted-models for more details). In a future release, the default value for `weights_only` will be flipped to `True`. This limits the functions that could be executed during unpickling. Arbitrary objects will no longer be allowed to be loaded via this mode unless they are explicitly allowlisted by the user via `torch.serialization.add_safe_globals`. We recommend you start setting `weights_only=True` for any use case where you don't have full control of the loaded file. Please open an issue on GitHub for any issues related to this experimental feature.
  self.data, self.slices = torch.load(self.processed_paths[0])
