STDOUT:
Results will be saved in /home/philip/projects/ltspice_examples_code_repo/Circuit-Completion-Using-GNNs/component_classification_with_link_prediction_head/evaluation/FEGIN/results/model_FEGIN_dataset_ltspice_examples
Command line input: python main.py --data ltspice_examples --representation component_component --model FEGIN --layers 2 --hiddens 64 --batch_size 32 --lr 0.01 --emb_size 512 --epochs 100 --save_appendix component_component_L2_H64_BS32_LR0.01_E512 --no_val
 is saved.
-----
ltspice_examples - FEGIN
Using 2 layers, 64 hidden units, h = 2
Loading component_component representation dataset
ENTERED
Training FEGIN on component_component representation
Train: 3556, Test: 845
##################ITERATION #0 ****************************************
 epoch: 0, train_loss: 1.2388, test_loss: 1.0956, test_f1: 0.3721
 epoch: 1, train_loss: 1.1181, test_loss: 1.0744, test_f1: 0.3981
 epoch: 2, train_loss: 1.0758, test_loss: 1.0396, test_f1: 0.4473
 epoch: 3, train_loss: 1.0339, test_loss: 1.0050, test_f1: 0.4761
 epoch: 4, train_loss: 1.0144, test_loss: 1.0377, test_f1: 0.4860
 epoch: 5, train_loss: 1.0044, test_loss: 0.9987, test_f1: 0.5540
 epoch: 6, train_loss: 0.9872, test_loss: 1.1676, test_f1: 0.4803
 epoch: 7, train_loss: 0.9792, test_loss: 1.0871, test_f1: 0.5239
 epoch: 8, train_loss: 0.9705, test_loss: 1.0290, test_f1: 0.4717
 epoch: 9, train_loss: 0.9365, test_loss: 1.1513, test_f1: 0.4761
 epoch: 10, train_loss: 0.9483, test_loss: 1.0371, test_f1: 0.4936
 epoch: 11, train_loss: 0.9491, test_loss: 1.1615, test_f1: 0.5248
 epoch: 12, train_loss: 0.9372, test_loss: 1.0075, test_f1: 0.4993
 epoch: 13, train_loss: 0.9110, test_loss: 1.1058, test_f1: 0.4847
 epoch: 14, train_loss: 0.9261, test_loss: 1.0751, test_f1: 0.4959
 epoch: 15, train_loss: 0.9107, test_loss: 1.1227, test_f1: 0.4799
 epoch: 16, train_loss: 0.9150, test_loss: 1.0701, test_f1: 0.5743
 epoch: 17, train_loss: 0.8902, test_loss: 1.1071, test_f1: 0.5278
 epoch: 18, train_loss: 0.9066, test_loss: 1.4500, test_f1: 0.4762
 epoch: 19, train_loss: 0.8976, test_loss: 1.0617, test_f1: 0.4843
 epoch: 20, train_loss: 0.8959, test_loss: 1.0067, test_f1: 0.5649
 epoch: 21, train_loss: 0.8909, test_loss: 1.0161, test_f1: 0.5598
 epoch: 22, train_loss: 0.8851, test_loss: 0.9806, test_f1: 0.5453
 epoch: 23, train_loss: 0.8766, test_loss: 1.0740, test_f1: 0.5391
 epoch: 24, train_loss: 0.8722, test_loss: 1.1103, test_f1: 0.4819
 epoch: 25, train_loss: 0.8741, test_loss: 1.0238, test_f1: 0.5459
 epoch: 26, train_loss: 0.8866, test_loss: 1.0256, test_f1: 0.5154
 epoch: 27, train_loss: 0.8567, test_loss: 1.0606, test_f1: 0.5203
 epoch: 28, train_loss: 0.8500, test_loss: 1.0594, test_f1: 0.5127
 epoch: 29, train_loss: 0.8673, test_loss: 1.1393, test_f1: 0.4827
 epoch: 30, train_loss: 0.8472, test_loss: 1.1722, test_f1: 0.5433
 epoch: 31, train_loss: 0.8650, test_loss: 1.0655, test_f1: 0.5044
 epoch: 32, train_loss: 0.8426, test_loss: 1.2219, test_f1: 0.5455
 epoch: 33, train_loss: 0.8568, test_loss: 1.0971, test_f1: 0.5391
 epoch: 34, train_loss: 0.8374, test_loss: 1.1582, test_f1: 0.5423
 epoch: 35, train_loss: 0.8222, test_loss: 1.0717, test_f1: 0.5192
 epoch: 36, train_loss: 0.8428, test_loss: 1.0644, test_f1: 0.5283
 epoch: 37, train_loss: 0.8773, test_loss: 1.1423, test_f1: 0.5421
 epoch: 38, train_loss: 0.8245, test_loss: 1.0321, test_f1: 0.5206
 epoch: 39, train_loss: 0.8153, test_loss: 1.0310, test_f1: 0.5438
 epoch: 40, train_loss: 0.8099, test_loss: 1.1752, test_f1: 0.5040
 epoch: 41, train_loss: 0.8471, test_loss: 1.0658, test_f1: 0.5407
 epoch: 42, train_loss: 0.8190, test_loss: 1.0352, test_f1: 0.5399
 epoch: 43, train_loss: 0.7904, test_loss: 1.2279, test_f1: 0.5621
 epoch: 44, train_loss: 0.8542, test_loss: 1.0682, test_f1: 0.5343
 epoch: 45, train_loss: 0.8315, test_loss: 1.1843, test_f1: 0.5278
 epoch: 46, train_loss: 0.8082, test_loss: 1.1148, test_f1: 0.5219
 epoch: 47, train_loss: 0.8150, test_loss: 1.1592, test_f1: 0.5480
 epoch: 48, train_loss: 0.8105, test_loss: 1.0356, test_f1: 0.5394
 epoch: 49, train_loss: 0.8139, test_loss: 1.1624, test_f1: 0.5416
 epoch: 50, train_loss: 0.8034, test_loss: 1.1184, test_f1: 0.5600
 epoch: 51, train_loss: 0.7641, test_loss: 1.0671, test_f1: 0.5553
 epoch: 52, train_loss: 0.7523, test_loss: 1.0629, test_f1: 0.5622
 epoch: 53, train_loss: 0.7333, test_loss: 1.2042, test_f1: 0.5651
 epoch: 54, train_loss: 0.7276, test_loss: 1.1516, test_f1: 0.5547
 epoch: 55, train_loss: 0.7282, test_loss: 1.1294, test_f1: 0.5870
 epoch: 56, train_loss: 0.7291, test_loss: 1.1013, test_f1: 0.5884
 epoch: 57, train_loss: 0.7158, test_loss: 1.2187, test_f1: 0.5634
 epoch: 58, train_loss: 0.7182, test_loss: 1.1732, test_f1: 0.5883
 epoch: 59, train_loss: 0.7140, test_loss: 1.2369, test_f1: 0.5675
 epoch: 60, train_loss: 0.7209, test_loss: 1.5773, test_f1: 0.5905
 epoch: 61, train_loss: 0.7040, test_loss: 1.2163, test_f1: 0.5699
 epoch: 62, train_loss: 0.7323, test_loss: 1.2005, test_f1: 0.5646
 epoch: 63, train_loss: 0.7107, test_loss: 1.2062, test_f1: 0.5343
 epoch: 64, train_loss: 0.7058, test_loss: 1.2951, test_f1: 0.5858
 epoch: 65, train_loss: 0.6935, test_loss: 1.2451, test_f1: 0.5641
 epoch: 66, train_loss: 0.7001, test_loss: 1.3638, test_f1: 0.5578
 epoch: 67, train_loss: 0.7078, test_loss: 1.2653, test_f1: 0.5872
 epoch: 68, train_loss: 0.6818, test_loss: 1.3050, test_f1: 0.5846
 epoch: 69, train_loss: 0.6971, test_loss: 1.3842, test_f1: 0.5380
 epoch: 70, train_loss: 0.7014, test_loss: 1.2155, test_f1: 0.5714
 epoch: 71, train_loss: 0.6825, test_loss: 1.2447, test_f1: 0.5792
 epoch: 72, train_loss: 0.6744, test_loss: 1.2385, test_f1: 0.5542
 epoch: 73, train_loss: 0.6991, test_loss: 1.3733, test_f1: 0.5519
 epoch: 74, train_loss: 0.6694, test_loss: 1.4157, test_f1: 0.5400
 epoch: 75, train_loss: 0.6812, test_loss: 1.3050, test_f1: 0.5650
 epoch: 76, train_loss: 0.6947, test_loss: 1.2305, test_f1: 0.5601
 epoch: 77, train_loss: 0.6836, test_loss: 1.3220, test_f1: 0.6069
 epoch: 78, train_loss: 0.7000, test_loss: 1.1732, test_f1: 0.5799
 epoch: 79, train_loss: 0.6682, test_loss: 1.3412, test_f1: 0.5586
 epoch: 80, train_loss: 0.6818, test_loss: 1.2943, test_f1: 0.5652
 epoch: 81, train_loss: 0.6585, test_loss: 1.3253, test_f1: 0.5640
 epoch: 82, train_loss: 0.6743, test_loss: 1.4629, test_f1: 0.5235
 epoch: 83, train_loss: 0.6546, test_loss: 1.3362, test_f1: 0.5890
 epoch: 84, train_loss: 0.6584, test_loss: 1.2127, test_f1: 0.5716
 epoch: 85, train_loss: 0.6554, test_loss: 1.2146, test_f1: 0.5980
 epoch: 86, train_loss: 0.6925, test_loss: 1.1726, test_f1: 0.5383
 epoch: 87, train_loss: 0.6558, test_loss: 1.4337, test_f1: 0.5783
 epoch: 88, train_loss: 0.6516, test_loss: 1.2060, test_f1: 0.5708
 epoch: 89, train_loss: 0.6400, test_loss: 1.3543, test_f1: 0.5787
 epoch: 90, train_loss: 0.6456, test_loss: 1.3853, test_f1: 0.5995
 epoch: 91, train_loss: 0.6562, test_loss: 1.2725, test_f1: 0.5869
 epoch: 92, train_loss: 0.6504, test_loss: 1.3510, test_f1: 0.5804
 epoch: 93, train_loss: 0.6436, test_loss: 1.6465, test_f1: 0.5384
 epoch: 94, train_loss: 0.6567, test_loss: 1.2751, test_f1: 0.5603
 epoch: 95, train_loss: 0.6378, test_loss: 1.2815, test_f1: 0.5714
 epoch: 96, train_loss: 0.6331, test_loss: 1.3587, test_f1: 0.5515
 epoch: 97, train_loss: 0.6480, test_loss: 1.2763, test_f1: 0.5757
 epoch: 98, train_loss: 0.6550, test_loss: 1.3494, test_f1: 0.5672
 epoch: 99, train_loss: 0.6650, test_loss: 1.0783, test_f1: 0.5839
##################ITERATION #1 ****************************************
 epoch: 0, train_loss: 1.2465, test_loss: 1.1442, test_f1: 0.3944
 epoch: 1, train_loss: 1.1102, test_loss: 1.0064, test_f1: 0.4420
 epoch: 2, train_loss: 1.0401, test_loss: 1.0166, test_f1: 0.4764
 epoch: 3, train_loss: 1.0225, test_loss: 1.0194, test_f1: 0.4801
 epoch: 4, train_loss: 0.9896, test_loss: 1.0293, test_f1: 0.4780
 epoch: 5, train_loss: 0.9672, test_loss: 1.0386, test_f1: 0.5030
 epoch: 6, train_loss: 0.9772, test_loss: 1.0233, test_f1: 0.4738
 epoch: 7, train_loss: 0.9598, test_loss: 1.0651, test_f1: 0.5215
 epoch: 8, train_loss: 0.9464, test_loss: 1.0338, test_f1: 0.4849
 epoch: 9, train_loss: 0.9470, test_loss: 1.0095, test_f1: 0.4773
 epoch: 10, train_loss: 0.9205, test_loss: 1.1328, test_f1: 0.4959
 epoch: 11, train_loss: 0.9202, test_loss: 1.0405, test_f1: 0.5134
 epoch: 12, train_loss: 0.9496, test_loss: 1.0717, test_f1: 0.4936
 epoch: 13, train_loss: 0.9272, test_loss: 0.9483, test_f1: 0.4811
 epoch: 14, train_loss: 0.9020, test_loss: 1.0138, test_f1: 0.5028
 epoch: 15, train_loss: 0.8962, test_loss: 1.1484, test_f1: 0.4878
 epoch: 16, train_loss: 0.8824, test_loss: 1.1560, test_f1: 0.4818
 epoch: 17, train_loss: 0.9020, test_loss: 0.9948, test_f1: 0.5292
 epoch: 18, train_loss: 0.8704, test_loss: 0.9715, test_f1: 0.5258
 epoch: 19, train_loss: 0.8834, test_loss: 1.0849, test_f1: 0.4597
 epoch: 20, train_loss: 0.8652, test_loss: 1.0581, test_f1: 0.5044
 epoch: 21, train_loss: 0.8769, test_loss: 1.0719, test_f1: 0.4934
 epoch: 22, train_loss: 0.8668, test_loss: 1.1021, test_f1: 0.5171
 epoch: 23, train_loss: 0.8769, test_loss: 1.0448, test_f1: 0.5385
 epoch: 24, train_loss: 0.8669, test_loss: 1.0447, test_f1: 0.5257
 epoch: 25, train_loss: 0.8622, test_loss: 1.2994, test_f1: 0.4959
 epoch: 26, train_loss: 0.8482, test_loss: 1.5345, test_f1: 0.5184
 epoch: 27, train_loss: 0.8862, test_loss: 1.1727, test_f1: 0.5069
 epoch: 28, train_loss: 0.8529, test_loss: 1.2569, test_f1: 0.5269
 epoch: 29, train_loss: 0.8556, test_loss: 1.0009, test_f1: 0.5344
 epoch: 30, train_loss: 0.8287, test_loss: 1.0799, test_f1: 0.5412
 epoch: 31, train_loss: 0.8330, test_loss: 1.2832, test_f1: 0.5321
 epoch: 32, train_loss: 0.8321, test_loss: 1.2130, test_f1: 0.5560
 epoch: 33, train_loss: 0.8289, test_loss: 1.0946, test_f1: 0.5419
 epoch: 34, train_loss: 0.8208, test_loss: 1.2042, test_f1: 0.5115
 epoch: 35, train_loss: 0.8163, test_loss: 1.2718, test_f1: 0.5247
 epoch: 36, train_loss: 0.8157, test_loss: 1.0512, test_f1: 0.5627
 epoch: 37, train_loss: 0.8278, test_loss: 1.0460, test_f1: 0.5641
 epoch: 38, train_loss: 0.8157, test_loss: 1.0990, test_f1: 0.5602
 epoch: 39, train_loss: 0.8304, test_loss: 1.3925, test_f1: 0.4748
 epoch: 40, train_loss: 0.9796, test_loss: 0.9826, test_f1: 0.5239
 epoch: 41, train_loss: 0.9056, test_loss: 1.0964, test_f1: 0.5021
 epoch: 42, train_loss: 0.8775, test_loss: 0.9788, test_f1: 0.5572
 epoch: 43, train_loss: 0.8601, test_loss: 0.9342, test_f1: 0.5654
 epoch: 44, train_loss: 0.8360, test_loss: 1.0675, test_f1: 0.5173
 epoch: 45, train_loss: 0.8327, test_loss: 1.0031, test_f1: 0.5750
 epoch: 46, train_loss: 0.8206, test_loss: 1.0232, test_f1: 0.5693
 epoch: 47, train_loss: 0.8331, test_loss: 1.0069, test_f1: 0.5719
 epoch: 48, train_loss: 0.8060, test_loss: 1.0649, test_f1: 0.5361
 epoch: 49, train_loss: 0.8009, test_loss: 0.9846, test_f1: 0.5834
 epoch: 50, train_loss: 0.8093, test_loss: 1.0787, test_f1: 0.5528
 epoch: 51, train_loss: 0.7793, test_loss: 1.0407, test_f1: 0.5911
 epoch: 52, train_loss: 0.7635, test_loss: 1.0108, test_f1: 0.5678
 epoch: 53, train_loss: 0.7524, test_loss: 1.2079, test_f1: 0.5607
 epoch: 54, train_loss: 0.7485, test_loss: 1.1592, test_f1: 0.5726
 epoch: 55, train_loss: 0.7470, test_loss: 1.1250, test_f1: 0.5544
 epoch: 56, train_loss: 0.7349, test_loss: 1.0585, test_f1: 0.5668
 epoch: 57, train_loss: 0.7333, test_loss: 1.0982, test_f1: 0.5559
 epoch: 58, train_loss: 0.7272, test_loss: 1.0651, test_f1: 0.5494
 epoch: 59, train_loss: 0.7263, test_loss: 1.0813, test_f1: 0.5501
 epoch: 60, train_loss: 0.7368, test_loss: 1.2276, test_f1: 0.5646
 epoch: 61, train_loss: 0.7203, test_loss: 1.0480, test_f1: 0.5564
 epoch: 62, train_loss: 0.7204, test_loss: 1.1243, test_f1: 0.5588
 epoch: 63, train_loss: 0.7137, test_loss: 1.0433, test_f1: 0.5760
 epoch: 64, train_loss: 0.7166, test_loss: 1.1619, test_f1: 0.5775
 epoch: 65, train_loss: 0.7206, test_loss: 1.3188, test_f1: 0.5381
 epoch: 66, train_loss: 0.7163, test_loss: 1.0162, test_f1: 0.5388
 epoch: 67, train_loss: 0.7008, test_loss: 0.9992, test_f1: 0.5933
 epoch: 68, train_loss: 0.6920, test_loss: 1.1752, test_f1: 0.5401
 epoch: 69, train_loss: 0.7029, test_loss: 1.0005, test_f1: 0.5889
 epoch: 70, train_loss: 0.6869, test_loss: 1.0965, test_f1: 0.5699
 epoch: 71, train_loss: 0.6945, test_loss: 1.1532, test_f1: 0.5673
 epoch: 72, train_loss: 0.6918, test_loss: 1.0375, test_f1: 0.5755
 epoch: 73, train_loss: 0.6835, test_loss: 1.0997, test_f1: 0.5471
 epoch: 74, train_loss: 0.6972, test_loss: 1.1018, test_f1: 0.5721
 epoch: 75, train_loss: 0.6811, test_loss: 1.1369, test_f1: 0.5418
 epoch: 76, train_loss: 0.6852, test_loss: 0.9847, test_f1: 0.5783
 epoch: 77, train_loss: 0.6753, test_loss: 1.1165, test_f1: 0.5715
 epoch: 78, train_loss: 0.6879, test_loss: 0.9638, test_f1: 0.5822
 epoch: 79, train_loss: 0.6722, test_loss: 1.1874, test_f1: 0.5622
 epoch: 80, train_loss: 0.6588, test_loss: 1.1392, test_f1: 0.5652
 epoch: 81, train_loss: 0.6656, test_loss: 0.9888, test_f1: 0.5859
 epoch: 82, train_loss: 0.6613, test_loss: 1.2630, test_f1: 0.5420
 epoch: 83, train_loss: 0.6586, test_loss: 1.1241, test_f1: 0.5444
 epoch: 84, train_loss: 0.6688, test_loss: 1.1016, test_f1: 0.5472
 epoch: 85, train_loss: 0.6690, test_loss: 1.0471, test_f1: 0.5874
 epoch: 86, train_loss: 0.7058, test_loss: 0.9516, test_f1: 0.5881
 epoch: 87, train_loss: 0.6557, test_loss: 1.1332, test_f1: 0.5852
 epoch: 88, train_loss: 0.6484, test_loss: 1.0629, test_f1: 0.5850
 epoch: 89, train_loss: 0.6584, test_loss: 1.0910, test_f1: 0.5896
 epoch: 90, train_loss: 0.6575, test_loss: 1.0191, test_f1: 0.5869
 epoch: 91, train_loss: 0.6524, test_loss: 1.1613, test_f1: 0.5935
 epoch: 92, train_loss: 0.6591, test_loss: 1.0195, test_f1: 0.5798
 epoch: 93, train_loss: 0.6391, test_loss: 1.2064, test_f1: 0.5926
 epoch: 94, train_loss: 0.6600, test_loss: 1.0735, test_f1: 0.6018
 epoch: 95, train_loss: 0.6567, test_loss: 1.0022, test_f1: 0.6025
 epoch: 96, train_loss: 0.6421, test_loss: 1.0535, test_f1: 0.5991
 epoch: 97, train_loss: 0.6271, test_loss: 1.1149, test_f1: 0.5783
 epoch: 98, train_loss: 0.6221, test_loss: 1.1523, test_f1: 0.5868
 epoch: 99, train_loss: 0.6422, test_loss: 1.0473, test_f1: 0.5793
##################ITERATION #2 ****************************************
 epoch: 0, train_loss: 1.2604, test_loss: 1.1721, test_f1: 0.3895
 epoch: 1, train_loss: 1.1558, test_loss: 1.2129, test_f1: 0.4382
 epoch: 2, train_loss: 1.1264, test_loss: 1.0725, test_f1: 0.4629
 epoch: 3, train_loss: 1.1270, test_loss: 1.0807, test_f1: 0.4700
 epoch: 4, train_loss: 1.0727, test_loss: 0.9917, test_f1: 0.4713
 epoch: 5, train_loss: 1.0484, test_loss: 1.0834, test_f1: 0.4943
 epoch: 6, train_loss: 1.0298, test_loss: 0.9924, test_f1: 0.4980
 epoch: 7, train_loss: 1.0165, test_loss: 1.1157, test_f1: 0.5046
 epoch: 8, train_loss: 1.0120, test_loss: 1.1030, test_f1: 0.4815
 epoch: 9, train_loss: 0.9943, test_loss: 1.0262, test_f1: 0.4991
 epoch: 10, train_loss: 0.9790, test_loss: 1.0389, test_f1: 0.4882
 epoch: 11, train_loss: 0.9935, test_loss: 0.9420, test_f1: 0.5260
 epoch: 12, train_loss: 0.9709, test_loss: 0.9641, test_f1: 0.4949
 epoch: 13, train_loss: 0.9499, test_loss: 1.0557, test_f1: 0.5237
 epoch: 14, train_loss: 0.9410, test_loss: 1.0012, test_f1: 0.4984
 epoch: 15, train_loss: 0.9490, test_loss: 0.9862, test_f1: 0.5102
 epoch: 16, train_loss: 0.9402, test_loss: 0.9557, test_f1: 0.5054
 epoch: 17, train_loss: 0.9224, test_loss: 0.9674, test_f1: 0.5154
 epoch: 18, train_loss: 0.9517, test_loss: 0.9879, test_f1: 0.5089
 epoch: 19, train_loss: 0.9044, test_loss: 1.0507, test_f1: 0.4882
 epoch: 20, train_loss: 0.9003, test_loss: 0.9883, test_f1: 0.5280
 epoch: 21, train_loss: 0.9212, test_loss: 1.0287, test_f1: 0.5559
 epoch: 22, train_loss: 0.9127, test_loss: 1.0456, test_f1: 0.5183
 epoch: 23, train_loss: 0.9084, test_loss: 0.9776, test_f1: 0.5200
 epoch: 24, train_loss: 0.9087, test_loss: 0.9520, test_f1: 0.5245
 epoch: 25, train_loss: 0.8853, test_loss: 1.0233, test_f1: 0.5300
 epoch: 26, train_loss: 0.8845, test_loss: 1.0102, test_f1: 0.5349
 epoch: 27, train_loss: 0.8701, test_loss: 1.0275, test_f1: 0.5539
 epoch: 28, train_loss: 0.8752, test_loss: 0.9564, test_f1: 0.5318
 epoch: 29, train_loss: 0.8606, test_loss: 1.0051, test_f1: 0.5537
 epoch: 30, train_loss: 0.8545, test_loss: 1.0541, test_f1: 0.4829
 epoch: 31, train_loss: 0.8424, test_loss: 1.0393, test_f1: 0.5567
 epoch: 32, train_loss: 0.8550, test_loss: 1.1324, test_f1: 0.5570
 epoch: 33, train_loss: 0.8465, test_loss: 1.0757, test_f1: 0.5415
 epoch: 34, train_loss: 0.8460, test_loss: 1.2030, test_f1: 0.5442
 epoch: 35, train_loss: 0.8292, test_loss: 1.1917, test_f1: 0.5575
 epoch: 36, train_loss: 0.8430, test_loss: 1.2367, test_f1: 0.5316
 epoch: 37, train_loss: 0.8691, test_loss: 1.2923, test_f1: 0.4925
 epoch: 38, train_loss: 0.8793, test_loss: 0.9773, test_f1: 0.5471
 epoch: 39, train_loss: 0.8331, test_loss: 1.0181, test_f1: 0.5522
 epoch: 40, train_loss: 0.8214, test_loss: 1.0774, test_f1: 0.5684
 epoch: 41, train_loss: 0.8330, test_loss: 1.1069, test_f1: 0.5378
 epoch: 42, train_loss: 0.8129, test_loss: 1.0130, test_f1: 0.5611
 epoch: 43, train_loss: 0.8124, test_loss: 1.2931, test_f1: 0.5265
 epoch: 44, train_loss: 0.8181, test_loss: 1.1328, test_f1: 0.5503
 epoch: 45, train_loss: 0.8186, test_loss: 1.1399, test_f1: 0.5360
 epoch: 46, train_loss: 0.7994, test_loss: 1.0976, test_f1: 0.5774
 epoch: 47, train_loss: 0.8278, test_loss: 0.9983, test_f1: 0.5645
 epoch: 48, train_loss: 0.8156, test_loss: 1.1305, test_f1: 0.5656
 epoch: 49, train_loss: 0.7904, test_loss: 1.1173, test_f1: 0.5507
 epoch: 50, train_loss: 0.8009, test_loss: 1.0629, test_f1: 0.5475
 epoch: 51, train_loss: 0.7721, test_loss: 1.0889, test_f1: 0.5593
 epoch: 52, train_loss: 0.7443, test_loss: 1.1663, test_f1: 0.5644
 epoch: 53, train_loss: 0.7307, test_loss: 1.1396, test_f1: 0.5587
 epoch: 54, train_loss: 0.7371, test_loss: 1.1510, test_f1: 0.5721
 epoch: 55, train_loss: 0.7271, test_loss: 1.1273, test_f1: 0.5637
 epoch: 56, train_loss: 0.7255, test_loss: 1.1352, test_f1: 0.5643
 epoch: 57, train_loss: 0.7355, test_loss: 1.2083, test_f1: 0.5429
 epoch: 58, train_loss: 0.7863, test_loss: 1.1776, test_f1: 0.5562
 epoch: 59, train_loss: 0.7373, test_loss: 1.2229, test_f1: 0.5731
 epoch: 60, train_loss: 0.7219, test_loss: 1.6732, test_f1: 0.5206
 epoch: 61, train_loss: 0.7283, test_loss: 1.1006, test_f1: 0.5696
 epoch: 62, train_loss: 0.7188, test_loss: 1.3229, test_f1: 0.5139
 epoch: 63, train_loss: 0.7090, test_loss: 1.4907, test_f1: 0.5337
 epoch: 64, train_loss: 0.6993, test_loss: 1.1885, test_f1: 0.5916
 epoch: 65, train_loss: 0.6956, test_loss: 1.4168, test_f1: 0.5525
 epoch: 66, train_loss: 0.7796, test_loss: 1.0574, test_f1: 0.5505
 epoch: 67, train_loss: 0.7023, test_loss: 1.2199, test_f1: 0.5574
 epoch: 68, train_loss: 0.6907, test_loss: 1.2770, test_f1: 0.5394
 epoch: 69, train_loss: 0.7006, test_loss: 1.1733, test_f1: 0.5535
 epoch: 70, train_loss: 0.6957, test_loss: 1.2406, test_f1: 0.5637
 epoch: 71, train_loss: 0.6754, test_loss: 1.2144, test_f1: 0.5741
 epoch: 72, train_loss: 0.6650, test_loss: 1.2868, test_f1: 0.5652
 epoch: 73, train_loss: 0.6711, test_loss: 1.2495, test_f1: 0.5559
 epoch: 74, train_loss: 0.6633, test_loss: 1.2031, test_f1: 0.5850
 epoch: 75, train_loss: 0.6710, test_loss: 1.3746, test_f1: 0.5455
 epoch: 76, train_loss: 0.6814, test_loss: 1.2364, test_f1: 0.5725
 epoch: 77, train_loss: 0.6687, test_loss: 1.4046, test_f1: 0.5350
 epoch: 78, train_loss: 0.6643, test_loss: 1.2251, test_f1: 0.5684
 epoch: 79, train_loss: 0.6603, test_loss: 1.2641, test_f1: 0.5700
 epoch: 80, train_loss: 0.6581, test_loss: 1.2774, test_f1: 0.5648
 epoch: 81, train_loss: 0.6569, test_loss: 1.2687, test_f1: 0.5926
 epoch: 82, train_loss: 0.6499, test_loss: 1.2613, test_f1: 0.5649
 epoch: 83, train_loss: 0.6534, test_loss: 1.4061, test_f1: 0.5558
 epoch: 84, train_loss: 0.6355, test_loss: 1.3648, test_f1: 0.5957
 epoch: 85, train_loss: 0.6290, test_loss: 1.3192, test_f1: 0.5934
 epoch: 86, train_loss: 0.6580, test_loss: 1.6058, test_f1: 0.5479
 epoch: 87, train_loss: 0.6389, test_loss: 1.3248, test_f1: 0.6069
 epoch: 88, train_loss: 0.6345, test_loss: 1.3576, test_f1: 0.5772
 epoch: 89, train_loss: 0.6351, test_loss: 1.3490, test_f1: 0.5626
 epoch: 90, train_loss: 0.6426, test_loss: 1.4807, test_f1: 0.5489
 epoch: 91, train_loss: 0.6278, test_loss: 1.4563, test_f1: 0.5599
 epoch: 92, train_loss: 0.6317, test_loss: 1.7445, test_f1: 0.5467
 epoch: 93, train_loss: 0.6343, test_loss: 1.5691, test_f1: 0.5527
 epoch: 94, train_loss: 0.6263, test_loss: 1.9681, test_f1: 0.5747
 epoch: 95, train_loss: 0.6087, test_loss: 1.6060, test_f1: 0.5517
 epoch: 96, train_loss: 0.6413, test_loss: 1.3774, test_f1: 0.5707
 epoch: 97, train_loss: 0.6142, test_loss: 1.6217, test_f1: 0.5399
 epoch: 98, train_loss: 0.6248, test_loss: 1.6633, test_f1: 0.5181
 epoch: 99, train_loss: 0.6063, test_loss: 1.5314, test_f1: 0.5738
##################ITERATION #3 ****************************************
 epoch: 0, train_loss: 1.2877, test_loss: 1.2027, test_f1: 0.3659
 epoch: 1, train_loss: 1.2030, test_loss: 1.1950, test_f1: 0.3539
 epoch: 2, train_loss: 1.1623, test_loss: 1.0641, test_f1: 0.4477
 epoch: 3, train_loss: 1.0911, test_loss: 1.0172, test_f1: 0.4742
 epoch: 4, train_loss: 1.0612, test_loss: 1.2865, test_f1: 0.4364
 epoch: 5, train_loss: 1.0300, test_loss: 0.9647, test_f1: 0.4951
 epoch: 6, train_loss: 1.0438, test_loss: 1.0807, test_f1: 0.4656
 epoch: 7, train_loss: 1.0046, test_loss: 0.9699, test_f1: 0.5129
 epoch: 8, train_loss: 0.9895, test_loss: 0.9900, test_f1: 0.5096
 epoch: 9, train_loss: 0.9712, test_loss: 0.9840, test_f1: 0.5534
 epoch: 10, train_loss: 0.9587, test_loss: 0.9834, test_f1: 0.5187
 epoch: 11, train_loss: 0.9407, test_loss: 0.9719, test_f1: 0.5053
 epoch: 12, train_loss: 0.9464, test_loss: 0.9521, test_f1: 0.4847
 epoch: 13, train_loss: 0.9642, test_loss: 0.9787, test_f1: 0.4823
 epoch: 14, train_loss: 0.9273, test_loss: 1.1429, test_f1: 0.5470
 epoch: 15, train_loss: 0.9343, test_loss: 0.9752, test_f1: 0.5057
 epoch: 16, train_loss: 0.9247, test_loss: 1.0079, test_f1: 0.5306
 epoch: 17, train_loss: 0.9107, test_loss: 1.0025, test_f1: 0.5612
 epoch: 18, train_loss: 0.9212, test_loss: 0.9875, test_f1: 0.5605
 epoch: 19, train_loss: 0.8948, test_loss: 0.9939, test_f1: 0.5341
 epoch: 20, train_loss: 0.8965, test_loss: 1.0072, test_f1: 0.5508
 epoch: 21, train_loss: 0.9013, test_loss: 1.0673, test_f1: 0.5046
 epoch: 22, train_loss: 0.8846, test_loss: 1.1165, test_f1: 0.5043
 epoch: 23, train_loss: 0.8767, test_loss: 1.3001, test_f1: 0.5200
 epoch: 24, train_loss: 0.8764, test_loss: 1.0308, test_f1: 0.5102
 epoch: 25, train_loss: 0.8887, test_loss: 0.9961, test_f1: 0.5242
 epoch: 26, train_loss: 0.8978, test_loss: 1.0340, test_f1: 0.5123
 epoch: 27, train_loss: 0.8853, test_loss: 0.9514, test_f1: 0.5037
 epoch: 28, train_loss: 0.8758, test_loss: 1.0385, test_f1: 0.5234
 epoch: 29, train_loss: 0.8631, test_loss: 1.2124, test_f1: 0.5406
 epoch: 30, train_loss: 0.8621, test_loss: 1.0323, test_f1: 0.5464
 epoch: 31, train_loss: 0.8586, test_loss: 1.0016, test_f1: 0.5796
 epoch: 32, train_loss: 0.8819, test_loss: 1.0082, test_f1: 0.5438
 epoch: 33, train_loss: 0.8525, test_loss: 1.1357, test_f1: 0.4833
 epoch: 34, train_loss: 0.8372, test_loss: 1.1847, test_f1: 0.5256
 epoch: 35, train_loss: 0.8578, test_loss: 1.0915, test_f1: 0.5176
 epoch: 36, train_loss: 0.8492, test_loss: 1.1919, test_f1: 0.4190
 epoch: 37, train_loss: 0.8491, test_loss: 1.0947, test_f1: 0.4971
 epoch: 38, train_loss: 0.8323, test_loss: 1.0188, test_f1: 0.5313
 epoch: 39, train_loss: 0.8376, test_loss: 1.0496, test_f1: 0.5319
 epoch: 40, train_loss: 0.8162, test_loss: 1.0585, test_f1: 0.5569
 epoch: 41, train_loss: 0.8114, test_loss: 1.0978, test_f1: 0.5392
 epoch: 42, train_loss: 0.8117, test_loss: 1.0566, test_f1: 0.4935
 epoch: 43, train_loss: 0.7962, test_loss: 1.0353, test_f1: 0.5458
 epoch: 44, train_loss: 0.8114, test_loss: 1.0200, test_f1: 0.5213
 epoch: 45, train_loss: 0.7996, test_loss: 1.1494, test_f1: 0.5137
 epoch: 46, train_loss: 0.8026, test_loss: 1.0429, test_f1: 0.5730
 epoch: 47, train_loss: 0.7914, test_loss: 1.0393, test_f1: 0.5371
 epoch: 48, train_loss: 0.7908, test_loss: 1.1012, test_f1: 0.5296
 epoch: 49, train_loss: 0.7929, test_loss: 1.2091, test_f1: 0.5356
 epoch: 50, train_loss: 0.7978, test_loss: 1.0906, test_f1: 0.5650
 epoch: 51, train_loss: 0.7735, test_loss: 1.1233, test_f1: 0.5493
 epoch: 52, train_loss: 0.7380, test_loss: 1.1621, test_f1: 0.5623
 epoch: 53, train_loss: 0.7518, test_loss: 1.1680, test_f1: 0.5204
 epoch: 54, train_loss: 0.7326, test_loss: 1.1748, test_f1: 0.5574
 epoch: 55, train_loss: 0.7223, test_loss: 1.2188, test_f1: 0.5517
 epoch: 56, train_loss: 0.7204, test_loss: 1.2385, test_f1: 0.5473
 epoch: 57, train_loss: 0.7278, test_loss: 1.1931, test_f1: 0.5498
 epoch: 58, train_loss: 0.7407, test_loss: 1.0861, test_f1: 0.5681
 epoch: 59, train_loss: 0.7219, test_loss: 1.1368, test_f1: 0.5266
 epoch: 60, train_loss: 0.7170, test_loss: 1.2599, test_f1: 0.5186
 epoch: 61, train_loss: 0.7028, test_loss: 1.1627, test_f1: 0.5469
 epoch: 62, train_loss: 0.7323, test_loss: 1.4566, test_f1: 0.5223
 epoch: 63, train_loss: 0.7013, test_loss: 1.1497, test_f1: 0.5263
 epoch: 64, train_loss: 0.7012, test_loss: 1.3309, test_f1: 0.5645
 epoch: 65, train_loss: 0.7023, test_loss: 1.2247, test_f1: 0.5511
 epoch: 66, train_loss: 0.7124, test_loss: 1.1930, test_f1: 0.5740
 epoch: 67, train_loss: 0.6906, test_loss: 1.3751, test_f1: 0.5253
 epoch: 68, train_loss: 0.7175, test_loss: 1.1479, test_f1: 0.5228
 epoch: 69, train_loss: 0.6863, test_loss: 1.2248, test_f1: 0.5478
 epoch: 70, train_loss: 0.6845, test_loss: 1.2208, test_f1: 0.5413
 epoch: 71, train_loss: 0.6948, test_loss: 1.3872, test_f1: 0.5305
 epoch: 72, train_loss: 0.6818, test_loss: 1.2083, test_f1: 0.5693
 epoch: 73, train_loss: 0.6728, test_loss: 1.2984, test_f1: 0.5524
 epoch: 74, train_loss: 0.6697, test_loss: 1.3909, test_f1: 0.5322
 epoch: 75, train_loss: 0.6727, test_loss: 1.1878, test_f1: 0.5956
 epoch: 76, train_loss: 0.6697, test_loss: 1.4916, test_f1: 0.5238
 epoch: 77, train_loss: 0.6600, test_loss: 1.3093, test_f1: 0.5465
 epoch: 78, train_loss: 0.6697, test_loss: 1.4303, test_f1: 0.5617
 epoch: 79, train_loss: 0.6666, test_loss: 1.2915, test_f1: 0.5278
 epoch: 80, train_loss: 0.6625, test_loss: 1.4751, test_f1: 0.5601
 epoch: 81, train_loss: 0.6760, test_loss: 1.2577, test_f1: 0.5540
 epoch: 82, train_loss: 0.6579, test_loss: 1.5928, test_f1: 0.5449
 epoch: 83, train_loss: 0.6345, test_loss: 1.4628, test_f1: 0.5252
 epoch: 84, train_loss: 0.6516, test_loss: 1.5034, test_f1: 0.5476
 epoch: 85, train_loss: 0.6504, test_loss: 1.2772, test_f1: 0.5805
 epoch: 86, train_loss: 0.6587, test_loss: 1.2890, test_f1: 0.5876
 epoch: 87, train_loss: 0.6702, test_loss: 1.4183, test_f1: 0.5328
 epoch: 88, train_loss: 0.6511, test_loss: 1.3779, test_f1: 0.5991
 epoch: 89, train_loss: 0.6459, test_loss: 1.6507, test_f1: 0.5321
 epoch: 90, train_loss: 0.6357, test_loss: 1.3246, test_f1: 0.5626
 epoch: 91, train_loss: 0.6301, test_loss: 1.5356, test_f1: 0.5719
 epoch: 92, train_loss: 0.6289, test_loss: 1.3775, test_f1: 0.5588
 epoch: 93, train_loss: 0.6180, test_loss: 1.4930, test_f1: 0.5655
 epoch: 94, train_loss: 0.6252, test_loss: 1.6582, test_f1: 0.5362
 epoch: 95, train_loss: 0.6462, test_loss: 1.4384, test_f1: 0.5812
 epoch: 96, train_loss: 0.6127, test_loss: 1.7845, test_f1: 0.5443
 epoch: 97, train_loss: 0.6101, test_loss: 1.7225, test_f1: 0.5657
 epoch: 98, train_loss: 0.6102, test_loss: 1.7073, test_f1: 0.5489
 epoch: 99, train_loss: 0.6325, test_loss: 1.5345, test_f1: 0.5284
##################ITERATION #4 ****************************************
 epoch: 0, train_loss: 1.3012, test_loss: 1.2078, test_f1: 0.3101
 epoch: 1, train_loss: 1.1925, test_loss: 1.1646, test_f1: 0.3111
 epoch: 2, train_loss: 1.1585, test_loss: 1.1472, test_f1: 0.3767
 epoch: 3, train_loss: 1.0752, test_loss: 0.9780, test_f1: 0.4657
 epoch: 4, train_loss: 1.0306, test_loss: 1.1009, test_f1: 0.4457
 epoch: 5, train_loss: 1.0126, test_loss: 1.0429, test_f1: 0.4821
 epoch: 6, train_loss: 0.9881, test_loss: 1.0183, test_f1: 0.4564
 epoch: 7, train_loss: 0.9952, test_loss: 1.0808, test_f1: 0.4832
 epoch: 8, train_loss: 0.9704, test_loss: 1.0250, test_f1: 0.5108
 epoch: 9, train_loss: 0.9751, test_loss: 0.9912, test_f1: 0.4704
 epoch: 10, train_loss: 0.9477, test_loss: 1.0664, test_f1: 0.4896
 epoch: 11, train_loss: 0.9450, test_loss: 1.0106, test_f1: 0.5006
 epoch: 12, train_loss: 0.9289, test_loss: 1.0922, test_f1: 0.4554
 epoch: 13, train_loss: 0.9985, test_loss: 1.2043, test_f1: 0.5122
 epoch: 14, train_loss: 0.9339, test_loss: 1.0057, test_f1: 0.4966
 epoch: 15, train_loss: 0.9263, test_loss: 1.1712, test_f1: 0.4828
 epoch: 16, train_loss: 0.9120, test_loss: 1.3087, test_f1: 0.4519
 epoch: 17, train_loss: 0.9211, test_loss: 1.0136, test_f1: 0.4629
 epoch: 18, train_loss: 0.9031, test_loss: 1.0140, test_f1: 0.5129
 epoch: 19, train_loss: 0.8911, test_loss: 0.9955, test_f1: 0.4787
 epoch: 20, train_loss: 0.9030, test_loss: 1.0135, test_f1: 0.4950
 epoch: 21, train_loss: 0.8806, test_loss: 0.9811, test_f1: 0.5163
 epoch: 22, train_loss: 0.8949, test_loss: 0.9507, test_f1: 0.5489
 epoch: 23, train_loss: 0.8800, test_loss: 1.0167, test_f1: 0.4840
 epoch: 24, train_loss: 0.8864, test_loss: 1.1638, test_f1: 0.4301
 epoch: 25, train_loss: 0.8692, test_loss: 1.0775, test_f1: 0.5270
 epoch: 26, train_loss: 0.8802, test_loss: 0.9611, test_f1: 0.5294
 epoch: 27, train_loss: 0.8921, test_loss: 1.0469, test_f1: 0.4863
 epoch: 28, train_loss: 0.8578, test_loss: 0.9726, test_f1: 0.5230
 epoch: 29, train_loss: 0.8440, test_loss: 1.0163, test_f1: 0.5415
 epoch: 30, train_loss: 0.8716, test_loss: 1.1054, test_f1: 0.5150
 epoch: 31, train_loss: 0.8765, test_loss: 0.9856, test_f1: 0.5208
 epoch: 32, train_loss: 0.8438, test_loss: 1.0887, test_f1: 0.5026
 epoch: 33, train_loss: 0.8665, test_loss: 1.0023, test_f1: 0.5329
 epoch: 34, train_loss: 0.8493, test_loss: 0.9837, test_f1: 0.5362
 epoch: 35, train_loss: 0.8473, test_loss: 1.1870, test_f1: 0.5111
 epoch: 36, train_loss: 0.8874, test_loss: 0.9520, test_f1: 0.5679
 epoch: 37, train_loss: 0.8393, test_loss: 1.0272, test_f1: 0.5816
 epoch: 38, train_loss: 0.8150, test_loss: 1.1046, test_f1: 0.4898
 epoch: 39, train_loss: 0.8314, test_loss: 1.1890, test_f1: 0.5252
 epoch: 40, train_loss: 0.8566, test_loss: 0.9706, test_f1: 0.4974
 epoch: 41, train_loss: 0.8328, test_loss: 1.0596, test_f1: 0.5215
 epoch: 42, train_loss: 0.8099, test_loss: 0.9936, test_f1: 0.5506
 epoch: 43, train_loss: 0.8142, test_loss: 1.0435, test_f1: 0.5315
 epoch: 44, train_loss: 0.8010, test_loss: 0.9731, test_f1: 0.5668
 epoch: 45, train_loss: 0.8160, test_loss: 1.1728, test_f1: 0.5100
 epoch: 46, train_loss: 0.8132, test_loss: 1.3170, test_f1: 0.5147
 epoch: 47, train_loss: 0.7995, test_loss: 1.0157, test_f1: 0.5689
 epoch: 48, train_loss: 0.7999, test_loss: 1.2088, test_f1: 0.5132
 epoch: 49, train_loss: 0.8146, test_loss: 1.1051, test_f1: 0.5426
 epoch: 50, train_loss: 0.8010, test_loss: 1.1656, test_f1: 0.5227
 epoch: 51, train_loss: 0.7791, test_loss: 1.1539, test_f1: 0.5419
 epoch: 52, train_loss: 0.7702, test_loss: 1.1661, test_f1: 0.5294
 epoch: 53, train_loss: 0.7498, test_loss: 1.2453, test_f1: 0.5502
 epoch: 54, train_loss: 0.7485, test_loss: 1.1891, test_f1: 0.5193
 epoch: 55, train_loss: 0.7371, test_loss: 0.9980, test_f1: 0.5600
 epoch: 56, train_loss: 0.7373, test_loss: 1.2625, test_f1: 0.5651
 epoch: 57, train_loss: 0.7301, test_loss: 1.1312, test_f1: 0.5380
 epoch: 58, train_loss: 0.7394, test_loss: 1.0674, test_f1: 0.5747
 epoch: 59, train_loss: 0.7203, test_loss: 1.1102, test_f1: 0.5585
 epoch: 60, train_loss: 0.7290, test_loss: 1.0674, test_f1: 0.5587
 epoch: 61, train_loss: 0.7374, test_loss: 1.0617, test_f1: 0.5436
 epoch: 62, train_loss: 0.7273, test_loss: 1.2131, test_f1: 0.5375
 epoch: 63, train_loss: 0.7268, test_loss: 1.1734, test_f1: 0.5462
 epoch: 64, train_loss: 0.7237, test_loss: 1.1125, test_f1: 0.5735
 epoch: 65, train_loss: 0.7258, test_loss: 1.0261, test_f1: 0.5787
 epoch: 66, train_loss: 0.7028, test_loss: 1.0799, test_f1: 0.5708
 epoch: 67, train_loss: 0.7027, test_loss: 1.0268, test_f1: 0.5907
 epoch: 68, train_loss: 0.6935, test_loss: 0.9744, test_f1: 0.5882
 epoch: 69, train_loss: 0.6834, test_loss: 1.2346, test_f1: 0.5539
 epoch: 70, train_loss: 0.7100, test_loss: 0.9637, test_f1: 0.5785
 epoch: 71, train_loss: 0.7114, test_loss: 0.9566, test_f1: 0.5891
 epoch: 72, train_loss: 0.7088, test_loss: 0.9443, test_f1: 0.5850
 epoch: 73, train_loss: 0.6930, test_loss: 0.9418, test_f1: 0.5656
 epoch: 74, train_loss: 0.7117, test_loss: 1.0875, test_f1: 0.5627
 epoch: 75, train_loss: 0.6848, test_loss: 1.0064, test_f1: 0.6166
 epoch: 76, train_loss: 0.6782, test_loss: 1.1756, test_f1: 0.5825
 epoch: 77, train_loss: 0.6792, test_loss: 1.0019, test_f1: 0.5991
 epoch: 78, train_loss: 0.6786, test_loss: 0.9903, test_f1: 0.5753
 epoch: 79, train_loss: 0.6811, test_loss: 1.0886, test_f1: 0.5846
 epoch: 80, train_loss: 0.6721, test_loss: 1.0163, test_f1: 0.5632
 epoch: 81, train_loss: 0.6731, test_loss: 1.0984, test_f1: 0.5864
 epoch: 82, train_loss: 0.6784, test_loss: 1.0121, test_f1: 0.6055
 epoch: 83, train_loss: 0.6571, test_loss: 1.3200, test_f1: 0.5395
 epoch: 84, train_loss: 0.6889, test_loss: 1.2023, test_f1: 0.5402
 epoch: 85, train_loss: 0.6612, test_loss: 1.0335, test_f1: 0.5581
 epoch: 86, train_loss: 0.6581, test_loss: 1.1113, test_f1: 0.5642
 epoch: 87, train_loss: 0.6605, test_loss: 1.2883, test_f1: 0.5702
 epoch: 88, train_loss: 0.6619, test_loss: 1.1783, test_f1: 0.5687
 epoch: 89, train_loss: 0.6803, test_loss: 1.4102, test_f1: 0.5312
 epoch: 90, train_loss: 0.6729, test_loss: 1.1236, test_f1: 0.5781
 epoch: 91, train_loss: 0.6455, test_loss: 1.3667, test_f1: 0.5339
 epoch: 92, train_loss: 0.6379, test_loss: 1.2431, test_f1: 0.5405
 epoch: 93, train_loss: 0.6517, test_loss: 1.2025, test_f1: 0.5634
 epoch: 94, train_loss: 0.6530, test_loss: 1.1848, test_f1: 0.5488
 epoch: 95, train_loss: 0.6483, test_loss: 1.1563, test_f1: 0.5699
 epoch: 96, train_loss: 0.6477, test_loss: 1.2016, test_f1: 0.5430
 epoch: 97, train_loss: 0.6439, test_loss: 1.1324, test_f1: 0.5367
 epoch: 98, train_loss: 0.6471, test_loss: 1.1690, test_f1: 0.5589
 epoch: 99, train_loss: 0.6424, test_loss: 1.3132, test_f1: 0.5501
##################ITERATION #5 ****************************************
 epoch: 0, train_loss: 1.2872, test_loss: 1.1923, test_f1: 0.3455
 epoch: 1, train_loss: 1.1590, test_loss: 1.0301, test_f1: 0.4632
 epoch: 2, train_loss: 1.0806, test_loss: 0.9736, test_f1: 0.4919
 epoch: 3, train_loss: 1.0606, test_loss: 1.0174, test_f1: 0.4700
 epoch: 4, train_loss: 1.0104, test_loss: 1.1015, test_f1: 0.4341
 epoch: 5, train_loss: 1.0071, test_loss: 0.9759, test_f1: 0.4896
 epoch: 6, train_loss: 0.9792, test_loss: 0.9825, test_f1: 0.4869
 epoch: 7, train_loss: 0.9720, test_loss: 0.9516, test_f1: 0.5087
 epoch: 8, train_loss: 0.9533, test_loss: 0.9993, test_f1: 0.5203
 epoch: 9, train_loss: 0.9531, test_loss: 0.9573, test_f1: 0.5063
 epoch: 10, train_loss: 0.9492, test_loss: 1.0472, test_f1: 0.4818
 epoch: 11, train_loss: 0.9670, test_loss: 0.9528, test_f1: 0.5194
 epoch: 12, train_loss: 0.9408, test_loss: 1.0976, test_f1: 0.4989
 epoch: 13, train_loss: 0.9135, test_loss: 0.9945, test_f1: 0.5552
 epoch: 14, train_loss: 0.9155, test_loss: 1.0418, test_f1: 0.5461
 epoch: 15, train_loss: 0.9182, test_loss: 0.9864, test_f1: 0.5448
 epoch: 16, train_loss: 0.8855, test_loss: 1.0416, test_f1: 0.5235
 epoch: 17, train_loss: 0.8882, test_loss: 0.9885, test_f1: 0.5461
 epoch: 18, train_loss: 0.9021, test_loss: 0.9690, test_f1: 0.5072
 epoch: 19, train_loss: 0.8986, test_loss: 0.9755, test_f1: 0.5341
 epoch: 20, train_loss: 0.8707, test_loss: 1.0809, test_f1: 0.5232
 epoch: 21, train_loss: 0.8728, test_loss: 1.0712, test_f1: 0.5230
 epoch: 22, train_loss: 0.8809, test_loss: 0.9861, test_f1: 0.5463
 epoch: 23, train_loss: 0.8666, test_loss: 0.9818, test_f1: 0.5291
 epoch: 24, train_loss: 0.8648, test_loss: 1.0660, test_f1: 0.5348
 epoch: 25, train_loss: 0.8588, test_loss: 1.1920, test_f1: 0.4842
 epoch: 26, train_loss: 0.8874, test_loss: 0.9583, test_f1: 0.5617
 epoch: 27, train_loss: 0.8664, test_loss: 1.0328, test_f1: 0.5671
 epoch: 28, train_loss: 0.8710, test_loss: 1.0968, test_f1: 0.5489
 epoch: 29, train_loss: 0.8513, test_loss: 1.0450, test_f1: 0.5364
 epoch: 30, train_loss: 0.8716, test_loss: 1.1630, test_f1: 0.5236
 epoch: 31, train_loss: 0.8495, test_loss: 1.1108, test_f1: 0.5579
 epoch: 32, train_loss: 0.8277, test_loss: 1.0732, test_f1: 0.5551
 epoch: 33, train_loss: 0.8364, test_loss: 1.0373, test_f1: 0.5537
 epoch: 34, train_loss: 0.8408, test_loss: 1.0248, test_f1: 0.5441
 epoch: 35, train_loss: 0.8110, test_loss: 1.0757, test_f1: 0.5679
 epoch: 36, train_loss: 0.8066, test_loss: 1.0933, test_f1: 0.5521
 epoch: 37, train_loss: 0.8259, test_loss: 1.0361, test_f1: 0.5467
 epoch: 38, train_loss: 0.8047, test_loss: 1.0901, test_f1: 0.5785
 epoch: 39, train_loss: 0.7910, test_loss: 1.1176, test_f1: 0.5916
 epoch: 40, train_loss: 0.8094, test_loss: 1.2196, test_f1: 0.5446
 epoch: 41, train_loss: 0.7936, test_loss: 1.1631, test_f1: 0.5334
 epoch: 42, train_loss: 0.7941, test_loss: 1.0017, test_f1: 0.5698
 epoch: 43, train_loss: 0.8010, test_loss: 1.0967, test_f1: 0.5364
 epoch: 44, train_loss: 0.8005, test_loss: 1.1172, test_f1: 0.5464
 epoch: 45, train_loss: 0.8061, test_loss: 1.0605, test_f1: 0.5167
 epoch: 46, train_loss: 0.7872, test_loss: 1.1833, test_f1: 0.5302
 epoch: 47, train_loss: 0.7579, test_loss: 1.0627, test_f1: 0.5540
 epoch: 48, train_loss: 0.7752, test_loss: 1.1635, test_f1: 0.5528
 epoch: 49, train_loss: 0.7564, test_loss: 0.8769, test_f1: 0.5946
 epoch: 50, train_loss: 0.7752, test_loss: 1.5481, test_f1: 0.5430
 epoch: 51, train_loss: 0.7304, test_loss: 1.0785, test_f1: 0.5547
 epoch: 52, train_loss: 0.7115, test_loss: 1.0615, test_f1: 0.5677
 epoch: 53, train_loss: 0.6959, test_loss: 1.1181, test_f1: 0.5786
 epoch: 54, train_loss: 0.7050, test_loss: 1.1258, test_f1: 0.5875
 epoch: 55, train_loss: 0.6983, test_loss: 0.9742, test_f1: 0.5953
 epoch: 56, train_loss: 0.6770, test_loss: 1.0718, test_f1: 0.5817
 epoch: 57, train_loss: 0.6915, test_loss: 1.3085, test_f1: 0.5704
 epoch: 58, train_loss: 0.7079, test_loss: 1.1298, test_f1: 0.6043
 epoch: 59, train_loss: 0.6651, test_loss: 1.2278, test_f1: 0.5914
 epoch: 60, train_loss: 0.6773, test_loss: 1.1892, test_f1: 0.5596
 epoch: 61, train_loss: 0.7032, test_loss: 1.2644, test_f1: 0.5566
 epoch: 62, train_loss: 0.6705, test_loss: 1.2446, test_f1: 0.5630
 epoch: 63, train_loss: 0.6521, test_loss: 1.2972, test_f1: 0.5485
 epoch: 64, train_loss: 0.6838, test_loss: 1.3623, test_f1: 0.5429
 epoch: 65, train_loss: 0.6788, test_loss: 1.4856, test_f1: 0.5573
 epoch: 66, train_loss: 0.6740, test_loss: 1.1871, test_f1: 0.5830
 epoch: 67, train_loss: 0.6571, test_loss: 1.2046, test_f1: 0.5960
 epoch: 68, train_loss: 0.6400, test_loss: 1.2273, test_f1: 0.5919
 epoch: 69, train_loss: 0.6767, test_loss: 1.2058, test_f1: 0.5598
 epoch: 70, train_loss: 0.6382, test_loss: 1.2518, test_f1: 0.5925
 epoch: 71, train_loss: 0.6531, test_loss: 1.2677, test_f1: 0.5757
 epoch: 72, train_loss: 0.6564, test_loss: 1.2828, test_f1: 0.5867
 epoch: 73, train_loss: 0.6342, test_loss: 1.2103, test_f1: 0.5876
 epoch: 74, train_loss: 0.6260, test_loss: 1.2830, test_f1: 0.5805
 epoch: 75, train_loss: 0.6225, test_loss: 1.2197, test_f1: 0.5854
 epoch: 76, train_loss: 0.6462, test_loss: 1.4381, test_f1: 0.5615
 epoch: 77, train_loss: 0.6603, test_loss: 1.1706, test_f1: 0.5809
 epoch: 78, train_loss: 0.6154, test_loss: 1.2166, test_f1: 0.5961
 epoch: 79, train_loss: 0.6442, test_loss: 1.2378, test_f1: 0.5815
 epoch: 80, train_loss: 0.6312, test_loss: 1.1734, test_f1: 0.5853
 epoch: 81, train_loss: 0.6219, test_loss: 1.1710, test_f1: 0.5949
 epoch: 82, train_loss: 0.6114, test_loss: 1.5623, test_f1: 0.5676
 epoch: 83, train_loss: 0.6235, test_loss: 1.4028, test_f1: 0.5759
 epoch: 84, train_loss: 0.6099, test_loss: 1.8546, test_f1: 0.5718
 epoch: 85, train_loss: 0.6192, test_loss: 1.2903, test_f1: 0.5900
 epoch: 86, train_loss: 0.6081, test_loss: 1.2654, test_f1: 0.5779
 epoch: 87, train_loss: 0.6162, test_loss: 1.2651, test_f1: 0.5947
 epoch: 88, train_loss: 0.6014, test_loss: 1.2252, test_f1: 0.5943
 epoch: 89, train_loss: 0.6064, test_loss: 1.1886, test_f1: 0.6054
 epoch: 90, train_loss: 0.6173, test_loss: 1.1039, test_f1: 0.5988
 epoch: 91, train_loss: 0.6028, test_loss: 1.2898, test_f1: 0.5917
 epoch: 92, train_loss: 0.6039, test_loss: 1.2044, test_f1: 0.5868
 epoch: 93, train_loss: 0.6180, test_loss: 1.2094, test_f1: 0.6276
 epoch: 94, train_loss: 0.5852, test_loss: 1.1360, test_f1: 0.6023
 epoch: 95, train_loss: 0.6138, test_loss: 1.2890, test_f1: 0.5997
 epoch: 96, train_loss: 0.5855, test_loss: 1.3782, test_f1: 0.6101
 epoch: 97, train_loss: 0.6064, test_loss: 1.1856, test_f1: 0.6152
 epoch: 98, train_loss: 0.5968, test_loss: 1.3224, test_f1: 0.6107
 epoch: 99, train_loss: 0.5764, test_loss: 1.5177, test_f1: 0.5672
##################ITERATION #6 ****************************************
 epoch: 0, train_loss: 1.2824, test_loss: 1.2650, test_f1: 0.2666
 epoch: 1, train_loss: 1.1887, test_loss: 1.1112, test_f1: 0.3722
 epoch: 2, train_loss: 1.1063, test_loss: 1.0311, test_f1: 0.4728
 epoch: 3, train_loss: 1.0682, test_loss: 1.0506, test_f1: 0.4754
 epoch: 4, train_loss: 1.0578, test_loss: 1.0298, test_f1: 0.5077
 epoch: 5, train_loss: 1.0233, test_loss: 1.0369, test_f1: 0.4582
 epoch: 6, train_loss: 1.0330, test_loss: 0.9866, test_f1: 0.4444
 epoch: 7, train_loss: 1.0049, test_loss: 1.0080, test_f1: 0.4784
 epoch: 8, train_loss: 0.9998, test_loss: 1.0147, test_f1: 0.4814
 epoch: 9, train_loss: 0.9888, test_loss: 1.0415, test_f1: 0.4827
 epoch: 10, train_loss: 0.9868, test_loss: 1.0449, test_f1: 0.4674
 epoch: 11, train_loss: 0.9775, test_loss: 1.0824, test_f1: 0.4651
 epoch: 12, train_loss: 0.9791, test_loss: 1.0461, test_f1: 0.4977
 epoch: 13, train_loss: 0.9688, test_loss: 0.9751, test_f1: 0.5001
 epoch: 14, train_loss: 0.9449, test_loss: 1.0203, test_f1: 0.5145
 epoch: 15, train_loss: 0.9383, test_loss: 1.0221, test_f1: 0.5071
 epoch: 16, train_loss: 0.9313, test_loss: 1.0584, test_f1: 0.5009
 epoch: 17, train_loss: 0.9198, test_loss: 0.9886, test_f1: 0.5485
 epoch: 18, train_loss: 0.9156, test_loss: 0.9615, test_f1: 0.5530
 epoch: 19, train_loss: 0.9131, test_loss: 1.0438, test_f1: 0.5125
 epoch: 20, train_loss: 0.9055, test_loss: 0.9901, test_f1: 0.5530
 epoch: 21, train_loss: 0.9067, test_loss: 0.9875, test_f1: 0.5318
 epoch: 22, train_loss: 0.8991, test_loss: 0.9684, test_f1: 0.5557
 epoch: 23, train_loss: 0.8913, test_loss: 0.9642, test_f1: 0.5259
 epoch: 24, train_loss: 0.8901, test_loss: 1.0154, test_f1: 0.5489
 epoch: 25, train_loss: 0.8917, test_loss: 1.0988, test_f1: 0.5189
 epoch: 26, train_loss: 0.8868, test_loss: 1.0140, test_f1: 0.5479
 epoch: 27, train_loss: 0.9737, test_loss: 1.0210, test_f1: 0.4843
 epoch: 28, train_loss: 0.9465, test_loss: 1.0402, test_f1: 0.4836
 epoch: 29, train_loss: 0.9074, test_loss: 1.0231, test_f1: 0.5199
 epoch: 30, train_loss: 0.9052, test_loss: 1.1579, test_f1: 0.5098
 epoch: 31, train_loss: 0.8984, test_loss: 0.9755, test_f1: 0.5599
 epoch: 32, train_loss: 0.8775, test_loss: 1.1289, test_f1: 0.5095
 epoch: 33, train_loss: 0.8700, test_loss: 1.0260, test_f1: 0.5262
 epoch: 34, train_loss: 0.8690, test_loss: 1.0182, test_f1: 0.5387
 epoch: 35, train_loss: 0.8520, test_loss: 1.0335, test_f1: 0.5218
 epoch: 36, train_loss: 0.8677, test_loss: 1.0760, test_f1: 0.5152
 epoch: 37, train_loss: 0.8665, test_loss: 1.0799, test_f1: 0.5544
 epoch: 38, train_loss: 0.8451, test_loss: 0.9739, test_f1: 0.5265
 epoch: 39, train_loss: 0.8407, test_loss: 1.2062, test_f1: 0.5462
 epoch: 40, train_loss: 0.8404, test_loss: 1.0102, test_f1: 0.5509
 epoch: 41, train_loss: 0.8464, test_loss: 1.0552, test_f1: 0.5055
 epoch: 42, train_loss: 0.8267, test_loss: 1.0975, test_f1: 0.5216
 epoch: 43, train_loss: 0.8444, test_loss: 1.2421, test_f1: 0.5196
 epoch: 44, train_loss: 0.8508, test_loss: 1.2347, test_f1: 0.4989
 epoch: 45, train_loss: 0.8254, test_loss: 1.0861, test_f1: 0.5671
 epoch: 46, train_loss: 0.8175, test_loss: 0.9363, test_f1: 0.5364
 epoch: 47, train_loss: 0.8117, test_loss: 1.0024, test_f1: 0.5587
 epoch: 48, train_loss: 0.8193, test_loss: 1.2139, test_f1: 0.5166
 epoch: 49, train_loss: 0.7948, test_loss: 0.9502, test_f1: 0.5345
 epoch: 50, train_loss: 0.8063, test_loss: 1.1147, test_f1: 0.5396
 epoch: 51, train_loss: 0.7772, test_loss: 1.0879, test_f1: 0.5343
 epoch: 52, train_loss: 0.7619, test_loss: 1.0427, test_f1: 0.5426
 epoch: 53, train_loss: 0.7587, test_loss: 1.1536, test_f1: 0.5330
 epoch: 54, train_loss: 0.7601, test_loss: 1.0932, test_f1: 0.5778
 epoch: 55, train_loss: 0.7428, test_loss: 1.0034, test_f1: 0.5794
 epoch: 56, train_loss: 0.7526, test_loss: 1.1162, test_f1: 0.5550
 epoch: 57, train_loss: 0.7411, test_loss: 1.1517, test_f1: 0.5519
 epoch: 58, train_loss: 0.7534, test_loss: 1.0712, test_f1: 0.5865
 epoch: 59, train_loss: 0.7350, test_loss: 1.3066, test_f1: 0.5498
 epoch: 60, train_loss: 0.7207, test_loss: 1.1641, test_f1: 0.5323
 epoch: 61, train_loss: 0.7219, test_loss: 1.2047, test_f1: 0.5742
 epoch: 62, train_loss: 0.7060, test_loss: 1.1648, test_f1: 0.5613
 epoch: 63, train_loss: 0.7340, test_loss: 1.1728, test_f1: 0.5356
 epoch: 64, train_loss: 0.7120, test_loss: 1.3338, test_f1: 0.5413
 epoch: 65, train_loss: 0.7286, test_loss: 1.1902, test_f1: 0.5780
 epoch: 66, train_loss: 0.7187, test_loss: 1.0800, test_f1: 0.5926
 epoch: 67, train_loss: 0.7699, test_loss: 1.0729, test_f1: 0.5825
 epoch: 68, train_loss: 0.7348, test_loss: 1.0613, test_f1: 0.5655
 epoch: 69, train_loss: 0.7181, test_loss: 1.1471, test_f1: 0.5875
 epoch: 70, train_loss: 0.7046, test_loss: 1.1036, test_f1: 0.5649
 epoch: 71, train_loss: 0.7052, test_loss: 1.3394, test_f1: 0.5667
 epoch: 72, train_loss: 0.7095, test_loss: 1.5094, test_f1: 0.5447
 epoch: 73, train_loss: 0.6723, test_loss: 1.0828, test_f1: 0.5756
 epoch: 74, train_loss: 0.7006, test_loss: 1.1707, test_f1: 0.5405
 epoch: 75, train_loss: 0.6893, test_loss: 1.1469, test_f1: 0.5829
 epoch: 76, train_loss: 0.6828, test_loss: 1.0698, test_f1: 0.5898
 epoch: 77, train_loss: 0.6802, test_loss: 1.1394, test_f1: 0.5412
 epoch: 78, train_loss: 0.6765, test_loss: 1.0711, test_f1: 0.5823
 epoch: 79, train_loss: 0.6823, test_loss: 1.0598, test_f1: 0.5873
 epoch: 80, train_loss: 0.7072, test_loss: 1.1381, test_f1: 0.5608
 epoch: 81, train_loss: 0.6916, test_loss: 1.0870, test_f1: 0.5595
 epoch: 82, train_loss: 0.6739, test_loss: 0.9586, test_f1: 0.5604
 epoch: 83, train_loss: 0.6798, test_loss: 1.1494, test_f1: 0.5849
 epoch: 84, train_loss: 0.6770, test_loss: 1.1239, test_f1: 0.5696
 epoch: 85, train_loss: 0.6609, test_loss: 1.0039, test_f1: 0.5914
 epoch: 86, train_loss: 0.6705, test_loss: 0.8959, test_f1: 0.6048
 epoch: 87, train_loss: 0.6610, test_loss: 1.1632, test_f1: 0.5753
 epoch: 88, train_loss: 0.6686, test_loss: 1.1737, test_f1: 0.5901
 epoch: 89, train_loss: 0.6715, test_loss: 1.0638, test_f1: 0.5893
 epoch: 90, train_loss: 0.6599, test_loss: 1.1219, test_f1: 0.5808
 epoch: 91, train_loss: 0.6696, test_loss: 1.1521, test_f1: 0.5872
 epoch: 92, train_loss: 0.6541, test_loss: 1.1260, test_f1: 0.5850
 epoch: 93, train_loss: 0.6555, test_loss: 1.3002, test_f1: 0.5731
 epoch: 94, train_loss: 0.6471, test_loss: 1.2468, test_f1: 0.6032
 epoch: 95, train_loss: 0.6456, test_loss: 1.3200, test_f1: 0.5630
 epoch: 96, train_loss: 0.6591, test_loss: 1.0408, test_f1: 0.5912
 epoch: 97, train_loss: 0.6463, test_loss: 1.2050, test_f1: 0.6065
 epoch: 98, train_loss: 0.6503, test_loss: 1.2503, test_f1: 0.5959
 epoch: 99, train_loss: 0.6330, test_loss: 1.1512, test_f1: 0.5951
##################ITERATION #7 ****************************************
 epoch: 0, train_loss: 1.2921, test_loss: 1.1283, test_f1: 0.4085
 epoch: 1, train_loss: 1.1350, test_loss: 1.0563, test_f1: 0.5044
 epoch: 2, train_loss: 1.0786, test_loss: 1.0534, test_f1: 0.4507
 epoch: 3, train_loss: 1.0521, test_loss: 1.0045, test_f1: 0.4744
 epoch: 4, train_loss: 1.0257, test_loss: 0.9754, test_f1: 0.4853
 epoch: 5, train_loss: 1.0319, test_loss: 0.9716, test_f1: 0.4965
 epoch: 6, train_loss: 1.0047, test_loss: 1.0453, test_f1: 0.4878
 epoch: 7, train_loss: 0.9900, test_loss: 1.0086, test_f1: 0.4726
 epoch: 8, train_loss: 0.9628, test_loss: 0.9977, test_f1: 0.5358
 epoch: 9, train_loss: 0.9763, test_loss: 0.9623, test_f1: 0.5522
 epoch: 10, train_loss: 0.9610, test_loss: 1.0037, test_f1: 0.5052
 epoch: 11, train_loss: 0.9446, test_loss: 1.0123, test_f1: 0.5196
 epoch: 12, train_loss: 0.9459, test_loss: 0.9486, test_f1: 0.5153
 epoch: 13, train_loss: 0.9423, test_loss: 0.9439, test_f1: 0.5150
 epoch: 14, train_loss: 0.9252, test_loss: 0.9859, test_f1: 0.4915
 epoch: 15, train_loss: 0.9438, test_loss: 1.0918, test_f1: 0.4622
 epoch: 16, train_loss: 0.9279, test_loss: 1.0223, test_f1: 0.5545
 epoch: 17, train_loss: 0.9205, test_loss: 1.0254, test_f1: 0.5359
 epoch: 18, train_loss: 0.8949, test_loss: 0.9722, test_f1: 0.5542
 epoch: 19, train_loss: 0.9187, test_loss: 0.9881, test_f1: 0.5594
 epoch: 20, train_loss: 0.8860, test_loss: 0.9955, test_f1: 0.5389
 epoch: 21, train_loss: 0.9085, test_loss: 1.0173, test_f1: 0.5601
 epoch: 22, train_loss: 0.8818, test_loss: 0.9763, test_f1: 0.5491
 epoch: 23, train_loss: 0.8948, test_loss: 1.1101, test_f1: 0.5368
 epoch: 24, train_loss: 0.8888, test_loss: 0.9892, test_f1: 0.5596
 epoch: 25, train_loss: 0.8649, test_loss: 1.0422, test_f1: 0.5163
 epoch: 26, train_loss: 0.9238, test_loss: 0.9327, test_f1: 0.5581
 epoch: 27, train_loss: 0.8858, test_loss: 0.9714, test_f1: 0.5473
 epoch: 28, train_loss: 0.8796, test_loss: 0.9489, test_f1: 0.5338
 epoch: 29, train_loss: 0.8674, test_loss: 1.0118, test_f1: 0.5559
 epoch: 30, train_loss: 0.8636, test_loss: 0.9735, test_f1: 0.5398
 epoch: 31, train_loss: 0.8597, test_loss: 0.9759, test_f1: 0.5207
 epoch: 32, train_loss: 0.8637, test_loss: 0.9944, test_f1: 0.5383
 epoch: 33, train_loss: 0.8403, test_loss: 0.9909, test_f1: 0.5187
 epoch: 34, train_loss: 0.8475, test_loss: 1.0363, test_f1: 0.5592
 epoch: 35, train_loss: 0.8372, test_loss: 1.1059, test_f1: 0.5267
 epoch: 36, train_loss: 0.8336, test_loss: 0.9694, test_f1: 0.5516
 epoch: 37, train_loss: 0.8548, test_loss: 1.1811, test_f1: 0.5001
 epoch: 38, train_loss: 0.8428, test_loss: 1.1690, test_f1: 0.5381
 epoch: 39, train_loss: 0.8397, test_loss: 1.0950, test_f1: 0.5322
 epoch: 40, train_loss: 0.8999, test_loss: 1.1795, test_f1: 0.4978
 epoch: 41, train_loss: 0.8647, test_loss: 1.0231, test_f1: 0.5276
 epoch: 42, train_loss: 0.8481, test_loss: 1.0579, test_f1: 0.5606
 epoch: 43, train_loss: 0.8189, test_loss: 1.0420, test_f1: 0.5670
 epoch: 44, train_loss: 0.8310, test_loss: 1.0665, test_f1: 0.5267
 epoch: 45, train_loss: 0.8696, test_loss: 1.0918, test_f1: 0.5362
 epoch: 46, train_loss: 0.8247, test_loss: 1.1128, test_f1: 0.5262
 epoch: 47, train_loss: 0.8345, test_loss: 1.2590, test_f1: 0.5256
 epoch: 48, train_loss: 0.8318, test_loss: 1.0402, test_f1: 0.5351
 epoch: 49, train_loss: 0.8364, test_loss: 1.0491, test_f1: 0.5533
 epoch: 50, train_loss: 0.8377, test_loss: 1.1217, test_f1: 0.5201
 epoch: 51, train_loss: 0.7866, test_loss: 1.0757, test_f1: 0.5579
 epoch: 52, train_loss: 0.7796, test_loss: 1.0878, test_f1: 0.5577
 epoch: 53, train_loss: 0.7700, test_loss: 1.1815, test_f1: 0.5417
 epoch: 54, train_loss: 0.7612, test_loss: 1.2033, test_f1: 0.5434
 epoch: 55, train_loss: 0.7681, test_loss: 1.0782, test_f1: 0.5574
 epoch: 56, train_loss: 0.7524, test_loss: 1.1757, test_f1: 0.5643
 epoch: 57, train_loss: 0.7472, test_loss: 1.1962, test_f1: 0.5513
 epoch: 58, train_loss: 0.7436, test_loss: 1.0984, test_f1: 0.5728
 epoch: 59, train_loss: 0.7530, test_loss: 1.1626, test_f1: 0.5516
 epoch: 60, train_loss: 0.7198, test_loss: 1.2089, test_f1: 0.5699
 epoch: 61, train_loss: 0.7502, test_loss: 1.2086, test_f1: 0.5598
 epoch: 62, train_loss: 0.7406, test_loss: 1.1535, test_f1: 0.5570
 epoch: 63, train_loss: 0.7336, test_loss: 1.1891, test_f1: 0.5568
 epoch: 64, train_loss: 0.7232, test_loss: 1.1003, test_f1: 0.5464
 epoch: 65, train_loss: 0.7134, test_loss: 1.2022, test_f1: 0.5577
 epoch: 66, train_loss: 0.7328, test_loss: 1.1926, test_f1: 0.5484
 epoch: 67, train_loss: 0.7130, test_loss: 1.2092, test_f1: 0.5574
 epoch: 68, train_loss: 0.7155, test_loss: 1.4046, test_f1: 0.5403
 epoch: 69, train_loss: 0.7033, test_loss: 1.1961, test_f1: 0.5199
 epoch: 70, train_loss: 0.7078, test_loss: 1.3912, test_f1: 0.5310
 epoch: 71, train_loss: 0.7129, test_loss: 1.2213, test_f1: 0.5457
 epoch: 72, train_loss: 0.7006, test_loss: 1.1297, test_f1: 0.5271
 epoch: 73, train_loss: 0.6985, test_loss: 1.1369, test_f1: 0.5438
 epoch: 74, train_loss: 0.6877, test_loss: 1.3673, test_f1: 0.5383
 epoch: 75, train_loss: 0.6929, test_loss: 1.2648, test_f1: 0.5489
 epoch: 76, train_loss: 0.6861, test_loss: 1.1798, test_f1: 0.5693
 epoch: 77, train_loss: 0.6619, test_loss: 1.1851, test_f1: 0.5848
 epoch: 78, train_loss: 0.6599, test_loss: 1.2768, test_f1: 0.5556
 epoch: 79, train_loss: 0.6621, test_loss: 1.3371, test_f1: 0.5323
 epoch: 80, train_loss: 0.6709, test_loss: 1.1857, test_f1: 0.5611
 epoch: 81, train_loss: 0.6674, test_loss: 1.2991, test_f1: 0.5597
 epoch: 82, train_loss: 0.6704, test_loss: 1.3281, test_f1: 0.5744
 epoch: 83, train_loss: 0.6577, test_loss: 1.1142, test_f1: 0.5546
 epoch: 84, train_loss: 0.6479, test_loss: 1.1224, test_f1: 0.5576
 epoch: 85, train_loss: 0.6668, test_loss: 1.2361, test_f1: 0.5921
 epoch: 86, train_loss: 0.6606, test_loss: 1.3261, test_f1: 0.5727
 epoch: 87, train_loss: 0.6603, test_loss: 1.3107, test_f1: 0.5525
 epoch: 88, train_loss: 0.6620, test_loss: 1.2403, test_f1: 0.5603
 epoch: 89, train_loss: 0.6529, test_loss: 1.4399, test_f1: 0.5569
 epoch: 90, train_loss: 0.6730, test_loss: 1.1629, test_f1: 0.5673
 epoch: 91, train_loss: 0.6442, test_loss: 1.3451, test_f1: 0.5550
 epoch: 92, train_loss: 0.6509, test_loss: 1.1372, test_f1: 0.5660
 epoch: 93, train_loss: 0.6373, test_loss: 1.2758, test_f1: 0.5251
 epoch: 94, train_loss: 0.6510, test_loss: 1.3010, test_f1: 0.5638
 epoch: 95, train_loss: 0.6340, test_loss: 1.4254, test_f1: 0.5418
 epoch: 96, train_loss: 0.6451, test_loss: 1.2468, test_f1: 0.5544
 epoch: 97, train_loss: 0.6378, test_loss: 1.3059, test_f1: 0.5418
 epoch: 98, train_loss: 0.6502, test_loss: 1.2327, test_f1: 0.5425
 epoch: 99, train_loss: 0.6254, test_loss: 1.1981, test_f1: 0.5855
##################ITERATION #8 ****************************************
 epoch: 0, train_loss: 1.2552, test_loss: 1.1722, test_f1: 0.3863
 epoch: 1, train_loss: 1.1218, test_loss: 1.0318, test_f1: 0.4423
 epoch: 2, train_loss: 1.0835, test_loss: 1.0467, test_f1: 0.4352
 epoch: 3, train_loss: 1.0519, test_loss: 1.0264, test_f1: 0.4786
 epoch: 4, train_loss: 1.0221, test_loss: 1.0258, test_f1: 0.4764
 epoch: 5, train_loss: 0.9941, test_loss: 0.9318, test_f1: 0.4957
 epoch: 6, train_loss: 0.9858, test_loss: 0.9396, test_f1: 0.4919
 epoch: 7, train_loss: 0.9597, test_loss: 0.9839, test_f1: 0.5052
 epoch: 8, train_loss: 0.9598, test_loss: 1.0180, test_f1: 0.4659
 epoch: 9, train_loss: 0.9386, test_loss: 1.0298, test_f1: 0.4613
 epoch: 10, train_loss: 0.9379, test_loss: 0.9743, test_f1: 0.5430
 epoch: 11, train_loss: 0.9405, test_loss: 0.9195, test_f1: 0.5278
 epoch: 12, train_loss: 0.9359, test_loss: 0.9945, test_f1: 0.5179
 epoch: 13, train_loss: 0.9137, test_loss: 0.9342, test_f1: 0.4943
 epoch: 14, train_loss: 0.9010, test_loss: 0.9828, test_f1: 0.4611
 epoch: 15, train_loss: 0.9130, test_loss: 0.9341, test_f1: 0.5486
 epoch: 16, train_loss: 0.9128, test_loss: 1.0512, test_f1: 0.5020
 epoch: 17, train_loss: 0.9244, test_loss: 0.9780, test_f1: 0.5712
 epoch: 18, train_loss: 0.8722, test_loss: 1.0114, test_f1: 0.5346
 epoch: 19, train_loss: 0.8816, test_loss: 0.9662, test_f1: 0.5165
 epoch: 20, train_loss: 0.8776, test_loss: 1.0161, test_f1: 0.5309
 epoch: 21, train_loss: 0.8662, test_loss: 1.0335, test_f1: 0.5069
 epoch: 22, train_loss: 0.8722, test_loss: 1.0589, test_f1: 0.5162
 epoch: 23, train_loss: 0.8740, test_loss: 0.9832, test_f1: 0.5548
 epoch: 24, train_loss: 0.8542, test_loss: 0.9715, test_f1: 0.5512
 epoch: 25, train_loss: 0.8352, test_loss: 1.2108, test_f1: 0.5094
 epoch: 26, train_loss: 0.9315, test_loss: 0.9749, test_f1: 0.5718
 epoch: 27, train_loss: 0.8899, test_loss: 0.9911, test_f1: 0.5320
 epoch: 28, train_loss: 0.8747, test_loss: 0.9513, test_f1: 0.5598
 epoch: 29, train_loss: 0.8484, test_loss: 0.9607, test_f1: 0.5505
 epoch: 30, train_loss: 0.8385, test_loss: 1.0595, test_f1: 0.5233
 epoch: 31, train_loss: 0.8272, test_loss: 1.2952, test_f1: 0.5235
 epoch: 32, train_loss: 0.8155, test_loss: 1.0833, test_f1: 0.5569
 epoch: 33, train_loss: 0.7978, test_loss: 1.1103, test_f1: 0.5513
 epoch: 34, train_loss: 0.8227, test_loss: 0.9996, test_f1: 0.5366
 epoch: 35, train_loss: 0.8087, test_loss: 1.0739, test_f1: 0.5578
 epoch: 36, train_loss: 0.8132, test_loss: 0.9733, test_f1: 0.5743
 epoch: 37, train_loss: 0.8037, test_loss: 0.9964, test_f1: 0.5650
 epoch: 38, train_loss: 0.7881, test_loss: 1.0137, test_f1: 0.5786
 epoch: 39, train_loss: 0.7903, test_loss: 1.0682, test_f1: 0.5576
 epoch: 40, train_loss: 0.7994, test_loss: 1.1708, test_f1: 0.5458
 epoch: 41, train_loss: 0.7887, test_loss: 1.1952, test_f1: 0.5529
 epoch: 42, train_loss: 0.7766, test_loss: 1.2906, test_f1: 0.5822
 epoch: 43, train_loss: 0.7743, test_loss: 1.0772, test_f1: 0.5709
 epoch: 44, train_loss: 0.7724, test_loss: 0.9279, test_f1: 0.5831
 epoch: 45, train_loss: 0.9032, test_loss: 1.1846, test_f1: 0.5711
 epoch: 46, train_loss: 0.8391, test_loss: 1.0167, test_f1: 0.5676
 epoch: 47, train_loss: 0.8036, test_loss: 1.2088, test_f1: 0.5535
 epoch: 48, train_loss: 0.7866, test_loss: 1.2124, test_f1: 0.5532
 epoch: 49, train_loss: 0.7886, test_loss: 1.0546, test_f1: 0.5792
 epoch: 50, train_loss: 0.7677, test_loss: 1.1018, test_f1: 0.5476
 epoch: 51, train_loss: 0.7515, test_loss: 1.1296, test_f1: 0.5632
 epoch: 52, train_loss: 0.7389, test_loss: 1.1386, test_f1: 0.5578
 epoch: 53, train_loss: 0.7281, test_loss: 1.1929, test_f1: 0.5552
 epoch: 54, train_loss: 0.7141, test_loss: 1.0941, test_f1: 0.5748
 epoch: 55, train_loss: 0.7014, test_loss: 1.1299, test_f1: 0.5859
 epoch: 56, train_loss: 0.7238, test_loss: 1.1891, test_f1: 0.5418
 epoch: 57, train_loss: 0.7044, test_loss: 1.2049, test_f1: 0.5674
 epoch: 58, train_loss: 0.7034, test_loss: 1.2247, test_f1: 0.5671
 epoch: 59, train_loss: 0.7049, test_loss: 1.1214, test_f1: 0.5727
 epoch: 60, train_loss: 0.6932, test_loss: 1.1320, test_f1: 0.5785
 epoch: 61, train_loss: 0.6808, test_loss: 1.2226, test_f1: 0.5698
 epoch: 62, train_loss: 0.6754, test_loss: 1.1754, test_f1: 0.5761
 epoch: 63, train_loss: 0.6735, test_loss: 1.3064, test_f1: 0.5493
 epoch: 64, train_loss: 0.6829, test_loss: 1.3430, test_f1: 0.5719
 epoch: 65, train_loss: 0.6741, test_loss: 1.2725, test_f1: 0.5763
 epoch: 66, train_loss: 0.6646, test_loss: 1.2677, test_f1: 0.5865
 epoch: 67, train_loss: 0.6603, test_loss: 1.3061, test_f1: 0.5564
 epoch: 68, train_loss: 0.6631, test_loss: 1.2693, test_f1: 0.5977
 epoch: 69, train_loss: 0.6598, test_loss: 1.3878, test_f1: 0.5556
 epoch: 70, train_loss: 0.6459, test_loss: 1.2652, test_f1: 0.5594
 epoch: 71, train_loss: 0.6731, test_loss: 1.0586, test_f1: 0.5837
 epoch: 72, train_loss: 0.6491, test_loss: 1.2215, test_f1: 0.5807
 epoch: 73, train_loss: 0.6347, test_loss: 1.2141, test_f1: 0.5727
 epoch: 74, train_loss: 0.6473, test_loss: 1.2734, test_f1: 0.5819
 epoch: 75, train_loss: 0.6596, test_loss: 1.2766, test_f1: 0.5756
 epoch: 76, train_loss: 0.6387, test_loss: 1.2676, test_f1: 0.5749
 epoch: 77, train_loss: 0.6355, test_loss: 1.2402, test_f1: 0.5925
 epoch: 78, train_loss: 0.6334, test_loss: 1.1518, test_f1: 0.5874
 epoch: 79, train_loss: 0.6364, test_loss: 1.2364, test_f1: 0.5943
 epoch: 80, train_loss: 0.6256, test_loss: 1.2020, test_f1: 0.5914
 epoch: 81, train_loss: 0.6249, test_loss: 1.4008, test_f1: 0.5926
 epoch: 82, train_loss: 0.6290, test_loss: 1.4237, test_f1: 0.5998
 epoch: 83, train_loss: 0.6469, test_loss: 1.3595, test_f1: 0.6005
 epoch: 84, train_loss: 0.6154, test_loss: 1.1302, test_f1: 0.5972
 epoch: 85, train_loss: 0.6075, test_loss: 1.3794, test_f1: 0.5915
 epoch: 86, train_loss: 0.6247, test_loss: 1.2087, test_f1: 0.6106
 epoch: 87, train_loss: 0.6158, test_loss: 1.2716, test_f1: 0.5972
 epoch: 88, train_loss: 0.6017, test_loss: 1.2491, test_f1: 0.6118
 epoch: 89, train_loss: 0.6048, test_loss: 1.2219, test_f1: 0.6121
 epoch: 90, train_loss: 0.6179, test_loss: 1.3010, test_f1: 0.6010
 epoch: 91, train_loss: 0.6023, test_loss: 1.2655, test_f1: 0.5878
 epoch: 92, train_loss: 0.5944, test_loss: 1.7246, test_f1: 0.5678
 epoch: 93, train_loss: 0.5996, test_loss: 1.4659, test_f1: 0.6084
 epoch: 94, train_loss: 0.5921, test_loss: 1.5094, test_f1: 0.5786
 epoch: 95, train_loss: 0.5849, test_loss: 1.3287, test_f1: 0.5945
 epoch: 96, train_loss: 0.6130, test_loss: 1.2962, test_f1: 0.6163
 epoch: 97, train_loss: 0.5951, test_loss: 1.5102, test_f1: 0.6156
 epoch: 98, train_loss: 0.5828, test_loss: 1.4455, test_f1: 0.6120
 epoch: 99, train_loss: 0.5755, test_loss: 1.2616, test_f1: 0.6056
##################ITERATION #9 ****************************************
 epoch: 0, train_loss: 1.2516, test_loss: 1.1123, test_f1: 0.4529
 epoch: 1, train_loss: 1.1018, test_loss: 1.0539, test_f1: 0.4659
 epoch: 2, train_loss: 1.0448, test_loss: 1.0327, test_f1: 0.5069
 epoch: 3, train_loss: 1.0253, test_loss: 1.0279, test_f1: 0.5169
 epoch: 4, train_loss: 1.0006, test_loss: 0.9968, test_f1: 0.5252
 epoch: 5, train_loss: 0.9809, test_loss: 1.0098, test_f1: 0.4855
 epoch: 6, train_loss: 0.9684, test_loss: 0.9834, test_f1: 0.5344
 epoch: 7, train_loss: 0.9973, test_loss: 1.0170, test_f1: 0.5043
 epoch: 8, train_loss: 0.9556, test_loss: 1.0941, test_f1: 0.5462
 epoch: 9, train_loss: 0.9447, test_loss: 1.0531, test_f1: 0.5154
 epoch: 10, train_loss: 0.9249, test_loss: 1.0479, test_f1: 0.5154
 epoch: 11, train_loss: 0.9246, test_loss: 0.9946, test_f1: 0.5327
 epoch: 12, train_loss: 0.9085, test_loss: 1.0399, test_f1: 0.5570
 epoch: 13, train_loss: 0.9047, test_loss: 1.0592, test_f1: 0.5765
 epoch: 14, train_loss: 0.8995, test_loss: 1.0205, test_f1: 0.5117
 epoch: 15, train_loss: 0.8966, test_loss: 0.9726, test_f1: 0.5494
 epoch: 16, train_loss: 0.9017, test_loss: 1.1117, test_f1: 0.5142
 epoch: 17, train_loss: 0.8827, test_loss: 1.2118, test_f1: 0.5077
 epoch: 18, train_loss: 0.8711, test_loss: 1.0315, test_f1: 0.5178
 epoch: 19, train_loss: 0.8660, test_loss: 0.9653, test_f1: 0.4756
 epoch: 20, train_loss: 0.8690, test_loss: 0.9664, test_f1: 0.5068
 epoch: 21, train_loss: 0.8708, test_loss: 1.1733, test_f1: 0.4374
 epoch: 22, train_loss: 0.8641, test_loss: 1.0375, test_f1: 0.5271
 epoch: 23, train_loss: 0.8802, test_loss: 1.0281, test_f1: 0.5632
 epoch: 24, train_loss: 0.8613, test_loss: 1.0264, test_f1: 0.5737
 epoch: 25, train_loss: 0.8382, test_loss: 1.0124, test_f1: 0.5553
 epoch: 26, train_loss: 0.8547, test_loss: 0.9443, test_f1: 0.5199
 epoch: 27, train_loss: 0.8469, test_loss: 1.0269, test_f1: 0.4899
 epoch: 28, train_loss: 0.8412, test_loss: 1.0285, test_f1: 0.5528
 epoch: 29, train_loss: 0.8196, test_loss: 1.0052, test_f1: 0.5514
 epoch: 30, train_loss: 0.8499, test_loss: 0.9942, test_f1: 0.5079
 epoch: 31, train_loss: 0.8152, test_loss: 0.9888, test_f1: 0.5532
 epoch: 32, train_loss: 0.8245, test_loss: 1.0733, test_f1: 0.5316
 epoch: 33, train_loss: 0.8178, test_loss: 1.0879, test_f1: 0.5366
 epoch: 34, train_loss: 0.8353, test_loss: 0.9456, test_f1: 0.5654
 epoch: 35, train_loss: 0.8405, test_loss: 0.9177, test_f1: 0.5522
 epoch: 36, train_loss: 0.8035, test_loss: 1.0026, test_f1: 0.5593
 epoch: 37, train_loss: 0.8164, test_loss: 0.9849, test_f1: 0.5307
 epoch: 38, train_loss: 0.7936, test_loss: 0.9693, test_f1: 0.5567
 epoch: 39, train_loss: 0.7810, test_loss: 0.9830, test_f1: 0.5332
 epoch: 40, train_loss: 0.7810, test_loss: 1.1524, test_f1: 0.5146
 epoch: 41, train_loss: 0.7941, test_loss: 1.1313, test_f1: 0.5200
 epoch: 42, train_loss: 0.7770, test_loss: 1.0539, test_f1: 0.5805
 epoch: 43, train_loss: 0.7889, test_loss: 1.0789, test_f1: 0.5375
 epoch: 44, train_loss: 0.7820, test_loss: 1.1661, test_f1: 0.5379
 epoch: 45, train_loss: 0.7702, test_loss: 1.2872, test_f1: 0.5467
 epoch: 46, train_loss: 0.7661, test_loss: 1.1023, test_f1: 0.5335
 epoch: 47, train_loss: 0.7671, test_loss: 1.0152, test_f1: 0.5842
 epoch: 48, train_loss: 0.7736, test_loss: 1.2406, test_f1: 0.5499
 epoch: 49, train_loss: 0.7933, test_loss: 1.0086, test_f1: 0.5909
 epoch: 50, train_loss: 0.7787, test_loss: 1.0147, test_f1: 0.5506
 epoch: 51, train_loss: 0.7422, test_loss: 1.0740, test_f1: 0.5830
 epoch: 52, train_loss: 0.7127, test_loss: 0.9991, test_f1: 0.5864
 epoch: 53, train_loss: 0.7113, test_loss: 1.0021, test_f1: 0.5819
 epoch: 54, train_loss: 0.7169, test_loss: 1.0726, test_f1: 0.5974
 epoch: 55, train_loss: 0.7011, test_loss: 1.0266, test_f1: 0.5826
 epoch: 56, train_loss: 0.6957, test_loss: 1.0748, test_f1: 0.5831
 epoch: 57, train_loss: 0.6895, test_loss: 1.3935, test_f1: 0.5831
 epoch: 58, train_loss: 0.6815, test_loss: 1.2804, test_f1: 0.5839
 epoch: 59, train_loss: 0.6894, test_loss: 1.0807, test_f1: 0.5806
 epoch: 60, train_loss: 0.6899, test_loss: 1.2041, test_f1: 0.5358
 epoch: 61, train_loss: 0.6931, test_loss: 0.9773, test_f1: 0.6014
 epoch: 62, train_loss: 0.6970, test_loss: 1.1452, test_f1: 0.6124
 epoch: 63, train_loss: 0.6845, test_loss: 1.1299, test_f1: 0.5860
 epoch: 64, train_loss: 0.6624, test_loss: 1.0404, test_f1: 0.5951
 epoch: 65, train_loss: 0.6723, test_loss: 1.0935, test_f1: 0.6038
 epoch: 66, train_loss: 0.6760, test_loss: 1.1309, test_f1: 0.6033
 epoch: 67, train_loss: 0.6601, test_loss: 1.1993, test_f1: 0.5720
 epoch: 68, train_loss: 0.6675, test_loss: 1.1298, test_f1: 0.5928
 epoch: 69, train_loss: 0.6666, test_loss: 1.2363, test_f1: 0.5863
 epoch: 70, train_loss: 0.6479, test_loss: 1.0788, test_f1: 0.6034
 epoch: 71, train_loss: 0.6511, test_loss: 1.3137, test_f1: 0.6088
 epoch: 72, train_loss: 0.6882, test_loss: 1.1580, test_f1: 0.5811
 epoch: 73, train_loss: 0.6576, test_loss: 1.1700, test_f1: 0.5925
 epoch: 74, train_loss: 0.6526, test_loss: 1.1742, test_f1: 0.6124
 epoch: 75, train_loss: 0.6618, test_loss: 1.1967, test_f1: 0.5587
 epoch: 76, train_loss: 0.6511, test_loss: 1.2238, test_f1: 0.5964
 epoch: 77, train_loss: 0.6331, test_loss: 1.1814, test_f1: 0.6172
 epoch: 78, train_loss: 0.6445, test_loss: 1.2404, test_f1: 0.5508
 epoch: 79, train_loss: 0.6472, test_loss: 1.0466, test_f1: 0.5841
 epoch: 80, train_loss: 0.6493, test_loss: 1.5253, test_f1: 0.5853
 epoch: 81, train_loss: 0.6317, test_loss: 1.2493, test_f1: 0.6001
 epoch: 82, train_loss: 0.6158, test_loss: 1.2304, test_f1: 0.6036
 epoch: 83, train_loss: 0.6351, test_loss: 1.1910, test_f1: 0.5958
 epoch: 84, train_loss: 0.6384, test_loss: 1.3029, test_f1: 0.5771
 epoch: 85, train_loss: 0.6250, test_loss: 1.1669, test_f1: 0.6180
 epoch: 86, train_loss: 0.6093, test_loss: 1.2918, test_f1: 0.6335
 epoch: 87, train_loss: 0.6202, test_loss: 1.1879, test_f1: 0.5810
 epoch: 88, train_loss: 0.6272, test_loss: 1.2508, test_f1: 0.6137
 epoch: 89, train_loss: 0.6235, test_loss: 1.3142, test_f1: 0.6099
 epoch: 90, train_loss: 0.6395, test_loss: 1.8993, test_f1: 0.5417
 epoch: 91, train_loss: 0.6556, test_loss: 1.1872, test_f1: 0.5815
 epoch: 92, train_loss: 0.6346, test_loss: 1.2643, test_f1: 0.5587
 epoch: 93, train_loss: 0.6193, test_loss: 1.1404, test_f1: 0.5918
 epoch: 94, train_loss: 0.6459, test_loss: 1.0478, test_f1: 0.6188
 epoch: 95, train_loss: 0.6298, test_loss: 1.4117, test_f1: 0.5696
 epoch: 96, train_loss: 0.6135, test_loss: 1.3086, test_f1: 0.5734
 epoch: 97, train_loss: 0.6671, test_loss: 1.0147, test_f1: 0.5875
 epoch: 98, train_loss: 0.6221, test_loss: 1.2091, test_f1: 0.5745
 epoch: 99, train_loss: 0.5964, test_loss: 1.3063, test_f1: 0.5541

Training completed in 786.69 seconds
Best F1: 0.6335 at epoch 86
Mean F1 across iterations: 0.6108  0.0121
========================FINAL RESULTS================================
FEGIN weighted F1: 0.6335  0.0121
python main.py --data ltspice_examples --representation component_component --model FEGIN --layers 2 --hiddens 64 --batch_size 32 --lr 0.01 --emb_size 512 --epochs 100 --save_appendix component_component_L2_H64_BS32_LR0.01_E512 --no_val
-----



STDERR:
  File "main.py", line 370, in <module>
    main()
  File "main.py", line 254, in main
    dataset = dataset_class(
  File "/home/philip/projects/ltspice_examples_code_repo/Circuit-Completion-Using-GNNs/component_classification_with_link_prediction_head/evaluation/FEGIN/kernel/circuit_datasets.py", line 15, in __init__
    self.data, self.slices = torch.load(self.processed_paths[0])
  File "/home/philip/.local/lib/python3.8/site-packages/torch/serialization.py", line 1040, in load
    warnings.warn(
  File "/usr/lib/python3.8/warnings.py", line 109, in _showwarnmsg
    sw(msg.message, msg.category, msg.filename, msg.lineno,
  File "main.py", line 47, in warn_with_traceback
    traceback.print_stack(file=log)
/home/philip/projects/ltspice_examples_code_repo/Circuit-Completion-Using-GNNs/component_classification_with_link_prediction_head/evaluation/FEGIN/kernel/circuit_datasets.py:15: FutureWarning: You are using `torch.load` with `weights_only=False` (the current default value), which uses the default pickle module implicitly. It is possible to construct malicious pickle data which will execute arbitrary code during unpickling (See https://github.com/pytorch/pytorch/blob/main/SECURITY.md#untrusted-models for more details). In a future release, the default value for `weights_only` will be flipped to `True`. This limits the functions that could be executed during unpickling. Arbitrary objects will no longer be allowed to be loaded via this mode unless they are explicitly allowlisted by the user via `torch.serialization.add_safe_globals`. We recommend you start setting `weights_only=True` for any use case where you don't have full control of the loaded file. Please open an issue on GitHub for any issues related to this experimental feature.
  self.data, self.slices = torch.load(self.processed_paths[0])
