STDOUT:
Results will be saved in /home/philip/projects/llm_inference_code_repo/Circuit-Completion-Using-GNNs/component_classification_with_link_prediction_head/evaluation/FEGIN/results/model_FEGIN_dataset_ltspice_examples
Command line input: python main.py --data ltspice_examples --representation component_net --model FEGIN --layers 5 --hiddens 16 --batch_size 256 --lr 0.001 --emb_size 512 --epochs 100 --save_appendix component_net_L5_H16_BS256_LR0.001_E512 --no_val
 is saved.
-----
ltspice_examples - FEGIN
Using 5 layers, 16 hidden units, h = 2
Loading component_net representation dataset
ENTERED
Training FEGIN on component_net representation
Train: 3558, Test: 846
##################ITERATION #0 ****************************************
 epoch: 0, train_loss: 1.4188, test_loss: 1.4104, test_f1: 0.1004
 epoch: 1, train_loss: 1.3969, test_loss: 1.3948, test_f1: 0.1004
 epoch: 2, train_loss: 1.3789, test_loss: 1.3787, test_f1: 0.2304
 epoch: 3, train_loss: 1.3531, test_loss: 1.3545, test_f1: 0.2947
 epoch: 4, train_loss: 1.3266, test_loss: 1.3224, test_f1: 0.2629
 epoch: 5, train_loss: 1.2979, test_loss: 1.2905, test_f1: 0.2509
 epoch: 6, train_loss: 1.2721, test_loss: 1.2618, test_f1: 0.2493
 epoch: 7, train_loss: 1.2527, test_loss: 1.2369, test_f1: 0.2750
 epoch: 8, train_loss: 1.2364, test_loss: 1.2150, test_f1: 0.2830
 epoch: 9, train_loss: 1.2293, test_loss: 1.1996, test_f1: 0.3206
 epoch: 10, train_loss: 1.2095, test_loss: 1.1857, test_f1: 0.3518
 epoch: 11, train_loss: 1.1981, test_loss: 1.1722, test_f1: 0.3603
 epoch: 12, train_loss: 1.1868, test_loss: 1.1574, test_f1: 0.3650
 epoch: 13, train_loss: 1.1759, test_loss: 1.1444, test_f1: 0.3670
 epoch: 14, train_loss: 1.1754, test_loss: 1.1348, test_f1: 0.3983
 epoch: 15, train_loss: 1.1576, test_loss: 1.1320, test_f1: 0.4021
 epoch: 16, train_loss: 1.1526, test_loss: 1.1268, test_f1: 0.4320
 epoch: 17, train_loss: 1.1378, test_loss: 1.1025, test_f1: 0.4899
 epoch: 18, train_loss: 1.1240, test_loss: 1.0942, test_f1: 0.4737
 epoch: 19, train_loss: 1.1177, test_loss: 1.0758, test_f1: 0.4776
 epoch: 20, train_loss: 1.1005, test_loss: 1.0650, test_f1: 0.5017
 epoch: 21, train_loss: 1.0948, test_loss: 1.0511, test_f1: 0.5123
 epoch: 22, train_loss: 1.0752, test_loss: 1.0262, test_f1: 0.5042
 epoch: 23, train_loss: 1.0680, test_loss: 1.0184, test_f1: 0.4825
 epoch: 24, train_loss: 1.0515, test_loss: 1.0075, test_f1: 0.4836
 epoch: 25, train_loss: 1.0442, test_loss: 0.9799, test_f1: 0.5027
 epoch: 26, train_loss: 1.0294, test_loss: 0.9687, test_f1: 0.5080
 epoch: 27, train_loss: 1.0152, test_loss: 0.9558, test_f1: 0.5068
 epoch: 28, train_loss: 1.0001, test_loss: 0.9490, test_f1: 0.5079
 epoch: 29, train_loss: 1.0070, test_loss: 0.9487, test_f1: 0.5095
 epoch: 30, train_loss: 0.9955, test_loss: 0.9371, test_f1: 0.5295
 epoch: 31, train_loss: 0.9877, test_loss: 0.9470, test_f1: 0.5004
 epoch: 32, train_loss: 0.9838, test_loss: 0.9480, test_f1: 0.4911
 epoch: 33, train_loss: 0.9808, test_loss: 0.9387, test_f1: 0.5084
 epoch: 34, train_loss: 0.9716, test_loss: 0.9454, test_f1: 0.5077
 epoch: 35, train_loss: 0.9575, test_loss: 0.9476, test_f1: 0.4949
 epoch: 36, train_loss: 0.9655, test_loss: 0.9365, test_f1: 0.5147
 epoch: 37, train_loss: 0.9451, test_loss: 0.9252, test_f1: 0.5071
 epoch: 38, train_loss: 0.9514, test_loss: 0.9343, test_f1: 0.5174
 epoch: 39, train_loss: 0.9460, test_loss: 0.9394, test_f1: 0.5155
 epoch: 40, train_loss: 0.9398, test_loss: 0.9328, test_f1: 0.5207
 epoch: 41, train_loss: 0.9273, test_loss: 0.9160, test_f1: 0.5275
 epoch: 42, train_loss: 0.9185, test_loss: 0.9106, test_f1: 0.5250
 epoch: 43, train_loss: 0.9299, test_loss: 0.9315, test_f1: 0.5419
 epoch: 44, train_loss: 0.9269, test_loss: 0.9077, test_f1: 0.5302
 epoch: 45, train_loss: 0.9180, test_loss: 0.9171, test_f1: 0.5227
 epoch: 46, train_loss: 0.9288, test_loss: 0.9125, test_f1: 0.5264
 epoch: 47, train_loss: 0.9158, test_loss: 0.9425, test_f1: 0.5167
 epoch: 48, train_loss: 0.8958, test_loss: 0.9196, test_f1: 0.5150
 epoch: 49, train_loss: 0.9098, test_loss: 0.9262, test_f1: 0.5517
 epoch: 50, train_loss: 0.8962, test_loss: 0.9404, test_f1: 0.5203
 epoch: 51, train_loss: 0.8852, test_loss: 0.9408, test_f1: 0.5399
 epoch: 52, train_loss: 0.8959, test_loss: 0.9299, test_f1: 0.5249
 epoch: 53, train_loss: 0.8865, test_loss: 0.9153, test_f1: 0.5413
 epoch: 54, train_loss: 0.8818, test_loss: 0.9209, test_f1: 0.5385
 epoch: 55, train_loss: 0.8757, test_loss: 0.9302, test_f1: 0.5286
 epoch: 56, train_loss: 0.8712, test_loss: 0.9173, test_f1: 0.5303
 epoch: 57, train_loss: 0.8797, test_loss: 0.9182, test_f1: 0.5383
 epoch: 58, train_loss: 0.8748, test_loss: 0.9491, test_f1: 0.5335
 epoch: 59, train_loss: 0.8755, test_loss: 0.9381, test_f1: 0.5310
 epoch: 60, train_loss: 0.8722, test_loss: 0.9224, test_f1: 0.5346
 epoch: 61, train_loss: 0.8803, test_loss: 0.9315, test_f1: 0.5384
 epoch: 62, train_loss: 0.8792, test_loss: 0.9200, test_f1: 0.5280
 epoch: 63, train_loss: 0.8611, test_loss: 0.9518, test_f1: 0.5116
 epoch: 64, train_loss: 0.8637, test_loss: 0.9429, test_f1: 0.5254
 epoch: 65, train_loss: 0.8675, test_loss: 0.9200, test_f1: 0.5331
 epoch: 66, train_loss: 0.8716, test_loss: 0.9276, test_f1: 0.5381
 epoch: 67, train_loss: 0.8689, test_loss: 0.9481, test_f1: 0.5405
 epoch: 68, train_loss: 0.8545, test_loss: 0.9342, test_f1: 0.5294
 epoch: 69, train_loss: 0.8625, test_loss: 0.9365, test_f1: 0.5288
 epoch: 70, train_loss: 0.8510, test_loss: 0.9452, test_f1: 0.5273
 epoch: 71, train_loss: 0.8497, test_loss: 0.9333, test_f1: 0.5203
 epoch: 72, train_loss: 0.8530, test_loss: 0.9484, test_f1: 0.5254
 epoch: 73, train_loss: 0.8646, test_loss: 0.9443, test_f1: 0.5258
 epoch: 74, train_loss: 0.8526, test_loss: 0.9477, test_f1: 0.5302
 epoch: 75, train_loss: 0.8472, test_loss: 0.9600, test_f1: 0.5173
 epoch: 76, train_loss: 0.8475, test_loss: 0.9404, test_f1: 0.5220
 epoch: 77, train_loss: 0.8464, test_loss: 0.9611, test_f1: 0.5248
 epoch: 78, train_loss: 0.8486, test_loss: 0.9453, test_f1: 0.5038
 epoch: 79, train_loss: 0.8460, test_loss: 0.9533, test_f1: 0.5129
 epoch: 80, train_loss: 0.8465, test_loss: 0.9547, test_f1: 0.5174
 epoch: 81, train_loss: 0.8426, test_loss: 0.9471, test_f1: 0.5195
 epoch: 82, train_loss: 0.8381, test_loss: 0.9574, test_f1: 0.5223
 epoch: 83, train_loss: 0.8347, test_loss: 0.9695, test_f1: 0.5253
 epoch: 84, train_loss: 0.8494, test_loss: 0.9579, test_f1: 0.5205
 epoch: 85, train_loss: 0.8402, test_loss: 0.9740, test_f1: 0.5185
 epoch: 86, train_loss: 0.8318, test_loss: 0.9169, test_f1: 0.5062
 epoch: 87, train_loss: 0.8323, test_loss: 0.9753, test_f1: 0.5161
 epoch: 88, train_loss: 0.8370, test_loss: 0.9593, test_f1: 0.5140
 epoch: 89, train_loss: 0.8297, test_loss: 0.9625, test_f1: 0.5130
 epoch: 90, train_loss: 0.8245, test_loss: 0.9735, test_f1: 0.5019
 epoch: 91, train_loss: 0.8310, test_loss: 0.9670, test_f1: 0.5251
 epoch: 92, train_loss: 0.8157, test_loss: 0.9553, test_f1: 0.5231
 epoch: 93, train_loss: 0.8405, test_loss: 0.9574, test_f1: 0.5259
 epoch: 94, train_loss: 0.8335, test_loss: 0.9311, test_f1: 0.5002
 epoch: 95, train_loss: 0.8289, test_loss: 0.9689, test_f1: 0.5198
 epoch: 96, train_loss: 0.8231, test_loss: 0.9999, test_f1: 0.5094
 epoch: 97, train_loss: 0.8236, test_loss: 0.9659, test_f1: 0.5092
 epoch: 98, train_loss: 0.8330, test_loss: 0.9257, test_f1: 0.5182
 epoch: 99, train_loss: 0.8308, test_loss: 0.9566, test_f1: 0.5165
##################ITERATION #1 ****************************************
 epoch: 0, train_loss: 1.3539, test_loss: 1.3324, test_f1: 0.2270
 epoch: 1, train_loss: 1.2850, test_loss: 1.3040, test_f1: 0.2270
 epoch: 2, train_loss: 1.2557, test_loss: 1.2644, test_f1: 0.2344
 epoch: 3, train_loss: 1.2341, test_loss: 1.2187, test_f1: 0.2858
 epoch: 4, train_loss: 1.2005, test_loss: 1.1895, test_f1: 0.3410
 epoch: 5, train_loss: 1.1844, test_loss: 1.1553, test_f1: 0.4083
 epoch: 6, train_loss: 1.1576, test_loss: 1.1206, test_f1: 0.4185
 epoch: 7, train_loss: 1.1373, test_loss: 1.0938, test_f1: 0.4237
 epoch: 8, train_loss: 1.1114, test_loss: 1.0727, test_f1: 0.4318
 epoch: 9, train_loss: 1.1000, test_loss: 1.0476, test_f1: 0.4338
 epoch: 10, train_loss: 1.0738, test_loss: 1.0359, test_f1: 0.4513
 epoch: 11, train_loss: 1.0698, test_loss: 1.0294, test_f1: 0.4731
 epoch: 12, train_loss: 1.0556, test_loss: 1.0164, test_f1: 0.4711
 epoch: 13, train_loss: 1.0314, test_loss: 1.0113, test_f1: 0.4780
 epoch: 14, train_loss: 1.0344, test_loss: 0.9856, test_f1: 0.4811
 epoch: 15, train_loss: 1.0201, test_loss: 0.9928, test_f1: 0.4820
 epoch: 16, train_loss: 1.0049, test_loss: 0.9772, test_f1: 0.4880
 epoch: 17, train_loss: 0.9926, test_loss: 0.9754, test_f1: 0.4848
 epoch: 18, train_loss: 0.9926, test_loss: 0.9763, test_f1: 0.5035
 epoch: 19, train_loss: 0.9881, test_loss: 0.9720, test_f1: 0.4892
 epoch: 20, train_loss: 0.9772, test_loss: 0.9592, test_f1: 0.5221
 epoch: 21, train_loss: 0.9783, test_loss: 0.9679, test_f1: 0.4915
 epoch: 22, train_loss: 0.9705, test_loss: 0.9768, test_f1: 0.5196
 epoch: 23, train_loss: 0.9614, test_loss: 0.9727, test_f1: 0.4916
 epoch: 24, train_loss: 0.9598, test_loss: 0.9501, test_f1: 0.5073
 epoch: 25, train_loss: 0.9476, test_loss: 0.9450, test_f1: 0.5050
 epoch: 26, train_loss: 0.9422, test_loss: 0.9610, test_f1: 0.5028
 epoch: 27, train_loss: 0.9447, test_loss: 0.9663, test_f1: 0.5147
 epoch: 28, train_loss: 0.9439, test_loss: 0.9491, test_f1: 0.5283
 epoch: 29, train_loss: 0.9338, test_loss: 0.9426, test_f1: 0.5062
 epoch: 30, train_loss: 0.9290, test_loss: 0.9622, test_f1: 0.5111
 epoch: 31, train_loss: 0.9456, test_loss: 0.9680, test_f1: 0.5036
 epoch: 32, train_loss: 0.9336, test_loss: 0.9663, test_f1: 0.5129
 epoch: 33, train_loss: 0.9233, test_loss: 0.9614, test_f1: 0.5223
 epoch: 34, train_loss: 0.9150, test_loss: 0.9541, test_f1: 0.5203
 epoch: 35, train_loss: 0.9085, test_loss: 0.9740, test_f1: 0.4992
 epoch: 36, train_loss: 0.9042, test_loss: 0.9591, test_f1: 0.5373
 epoch: 37, train_loss: 0.9106, test_loss: 0.9573, test_f1: 0.5260
 epoch: 38, train_loss: 0.9046, test_loss: 0.9440, test_f1: 0.5364
 epoch: 39, train_loss: 0.9068, test_loss: 0.9552, test_f1: 0.5107
 epoch: 40, train_loss: 0.9058, test_loss: 0.9488, test_f1: 0.5310
 epoch: 41, train_loss: 0.8935, test_loss: 0.9496, test_f1: 0.5418
 epoch: 42, train_loss: 0.8994, test_loss: 0.9358, test_f1: 0.5434
 epoch: 43, train_loss: 0.8891, test_loss: 0.9341, test_f1: 0.5189
 epoch: 44, train_loss: 0.8940, test_loss: 0.9405, test_f1: 0.5357
 epoch: 45, train_loss: 0.8959, test_loss: 0.9767, test_f1: 0.5426
 epoch: 46, train_loss: 0.8885, test_loss: 0.9605, test_f1: 0.5314
 epoch: 47, train_loss: 0.8744, test_loss: 0.9771, test_f1: 0.5462
 epoch: 48, train_loss: 0.8970, test_loss: 0.9738, test_f1: 0.5344
 epoch: 49, train_loss: 0.8746, test_loss: 0.9854, test_f1: 0.5321
 epoch: 50, train_loss: 0.8677, test_loss: 0.9450, test_f1: 0.5403
 epoch: 51, train_loss: 0.8675, test_loss: 0.9522, test_f1: 0.5422
 epoch: 52, train_loss: 0.8578, test_loss: 0.9508, test_f1: 0.5283
 epoch: 53, train_loss: 0.8640, test_loss: 0.9571, test_f1: 0.5356
 epoch: 54, train_loss: 0.8674, test_loss: 0.9621, test_f1: 0.5327
 epoch: 55, train_loss: 0.8557, test_loss: 0.9553, test_f1: 0.5433
 epoch: 56, train_loss: 0.8566, test_loss: 0.9554, test_f1: 0.5414
 epoch: 57, train_loss: 0.8625, test_loss: 0.9574, test_f1: 0.5483
 epoch: 58, train_loss: 0.8694, test_loss: 0.9596, test_f1: 0.5259
 epoch: 59, train_loss: 0.8529, test_loss: 0.9644, test_f1: 0.5383
 epoch: 60, train_loss: 0.8519, test_loss: 0.9644, test_f1: 0.5429
 epoch: 61, train_loss: 0.8528, test_loss: 0.9568, test_f1: 0.5405
 epoch: 62, train_loss: 0.8554, test_loss: 0.9569, test_f1: 0.5481
 epoch: 63, train_loss: 0.8500, test_loss: 0.9681, test_f1: 0.5311
 epoch: 64, train_loss: 0.8429, test_loss: 0.9670, test_f1: 0.5382
 epoch: 65, train_loss: 0.8504, test_loss: 0.9600, test_f1: 0.5508
 epoch: 66, train_loss: 0.8542, test_loss: 0.9748, test_f1: 0.5257
 epoch: 67, train_loss: 0.8337, test_loss: 0.9585, test_f1: 0.5471
 epoch: 68, train_loss: 0.8435, test_loss: 0.9617, test_f1: 0.5585
 epoch: 69, train_loss: 0.8520, test_loss: 0.9612, test_f1: 0.5381
 epoch: 70, train_loss: 0.8422, test_loss: 0.9700, test_f1: 0.5364
 epoch: 71, train_loss: 0.8406, test_loss: 0.9662, test_f1: 0.5399
 epoch: 72, train_loss: 0.8463, test_loss: 0.9766, test_f1: 0.5265
 epoch: 73, train_loss: 0.8313, test_loss: 0.9568, test_f1: 0.5371
 epoch: 74, train_loss: 0.8326, test_loss: 0.9601, test_f1: 0.5466
 epoch: 75, train_loss: 0.8367, test_loss: 0.9770, test_f1: 0.5564
 epoch: 76, train_loss: 0.8381, test_loss: 0.9647, test_f1: 0.5511
 epoch: 77, train_loss: 0.8407, test_loss: 0.9652, test_f1: 0.5547
 epoch: 78, train_loss: 0.8341, test_loss: 0.9665, test_f1: 0.5497
 epoch: 79, train_loss: 0.8378, test_loss: 0.9687, test_f1: 0.5357
 epoch: 80, train_loss: 0.8368, test_loss: 0.9710, test_f1: 0.5495
 epoch: 81, train_loss: 0.8396, test_loss: 0.9627, test_f1: 0.5461
 epoch: 82, train_loss: 0.8304, test_loss: 0.9832, test_f1: 0.5462
 epoch: 83, train_loss: 0.8301, test_loss: 0.9920, test_f1: 0.5374
 epoch: 84, train_loss: 0.8372, test_loss: 0.9578, test_f1: 0.5460
 epoch: 85, train_loss: 0.8214, test_loss: 0.9680, test_f1: 0.5333
 epoch: 86, train_loss: 0.8267, test_loss: 0.9646, test_f1: 0.5549
 epoch: 87, train_loss: 0.8323, test_loss: 1.0039, test_f1: 0.5442
 epoch: 88, train_loss: 0.8386, test_loss: 0.9707, test_f1: 0.5408
 epoch: 89, train_loss: 0.8290, test_loss: 0.9678, test_f1: 0.5348
 epoch: 90, train_loss: 0.8264, test_loss: 0.9565, test_f1: 0.5564
 epoch: 91, train_loss: 0.8237, test_loss: 0.9635, test_f1: 0.5493
 epoch: 92, train_loss: 0.8219, test_loss: 0.9677, test_f1: 0.5427
 epoch: 93, train_loss: 0.8206, test_loss: 0.9703, test_f1: 0.5711
 epoch: 94, train_loss: 0.8208, test_loss: 0.9725, test_f1: 0.5393
 epoch: 95, train_loss: 0.8241, test_loss: 0.9617, test_f1: 0.5592
 epoch: 96, train_loss: 0.8211, test_loss: 0.9773, test_f1: 0.5598
 epoch: 97, train_loss: 0.8208, test_loss: 0.9752, test_f1: 0.5466
 epoch: 98, train_loss: 0.8256, test_loss: 0.9815, test_f1: 0.5466
 epoch: 99, train_loss: 0.8317, test_loss: 0.9840, test_f1: 0.5356
##################ITERATION #2 ****************************************
 epoch: 0, train_loss: 1.2767, test_loss: 1.3212, test_f1: 0.2270
 epoch: 1, train_loss: 1.2231, test_loss: 1.2965, test_f1: 0.2270
 epoch: 2, train_loss: 1.2062, test_loss: 1.2737, test_f1: 0.2270
 epoch: 3, train_loss: 1.1782, test_loss: 1.2339, test_f1: 0.2527
 epoch: 4, train_loss: 1.1575, test_loss: 1.1982, test_f1: 0.2920
 epoch: 5, train_loss: 1.1400, test_loss: 1.1284, test_f1: 0.4446
 epoch: 6, train_loss: 1.1108, test_loss: 1.0791, test_f1: 0.4415
 epoch: 7, train_loss: 1.1049, test_loss: 1.0336, test_f1: 0.4835
 epoch: 8, train_loss: 1.0800, test_loss: 1.0211, test_f1: 0.4825
 epoch: 9, train_loss: 1.0625, test_loss: 0.9961, test_f1: 0.5085
 epoch: 10, train_loss: 1.0570, test_loss: 0.9881, test_f1: 0.4936
 epoch: 11, train_loss: 1.0421, test_loss: 0.9945, test_f1: 0.4811
 epoch: 12, train_loss: 1.0304, test_loss: 0.9838, test_f1: 0.4811
 epoch: 13, train_loss: 1.0233, test_loss: 0.9734, test_f1: 0.4877
 epoch: 14, train_loss: 1.0057, test_loss: 0.9739, test_f1: 0.4957
 epoch: 15, train_loss: 1.0060, test_loss: 0.9534, test_f1: 0.5072
 epoch: 16, train_loss: 0.9877, test_loss: 0.9704, test_f1: 0.5106
 epoch: 17, train_loss: 0.9872, test_loss: 0.9578, test_f1: 0.5190
 epoch: 18, train_loss: 0.9778, test_loss: 0.9620, test_f1: 0.5199
 epoch: 19, train_loss: 0.9757, test_loss: 0.9694, test_f1: 0.5094
 epoch: 20, train_loss: 0.9790, test_loss: 0.9575, test_f1: 0.5252
 epoch: 21, train_loss: 0.9580, test_loss: 0.9613, test_f1: 0.5184
 epoch: 22, train_loss: 0.9630, test_loss: 0.9510, test_f1: 0.5186
 epoch: 23, train_loss: 0.9498, test_loss: 0.9590, test_f1: 0.5235
 epoch: 24, train_loss: 0.9495, test_loss: 0.9493, test_f1: 0.5359
 epoch: 25, train_loss: 0.9506, test_loss: 0.9636, test_f1: 0.5191
 epoch: 26, train_loss: 0.9359, test_loss: 0.9577, test_f1: 0.5268
 epoch: 27, train_loss: 0.9383, test_loss: 0.9480, test_f1: 0.5239
 epoch: 28, train_loss: 0.9282, test_loss: 0.9676, test_f1: 0.5360
 epoch: 29, train_loss: 0.9348, test_loss: 0.9720, test_f1: 0.5260
 epoch: 30, train_loss: 0.9234, test_loss: 0.9466, test_f1: 0.5290
 epoch: 31, train_loss: 0.9176, test_loss: 0.9766, test_f1: 0.5296
 epoch: 32, train_loss: 0.9192, test_loss: 0.9528, test_f1: 0.5336
 epoch: 33, train_loss: 0.9065, test_loss: 0.9655, test_f1: 0.5357
 epoch: 34, train_loss: 0.9055, test_loss: 0.9537, test_f1: 0.5448
 epoch: 35, train_loss: 0.9058, test_loss: 0.9648, test_f1: 0.5146
 epoch: 36, train_loss: 0.9038, test_loss: 0.9603, test_f1: 0.5362
 epoch: 37, train_loss: 0.8890, test_loss: 0.9684, test_f1: 0.5246
 epoch: 38, train_loss: 0.8974, test_loss: 0.9375, test_f1: 0.5600
 epoch: 39, train_loss: 0.8885, test_loss: 0.9671, test_f1: 0.5401
 epoch: 40, train_loss: 0.8951, test_loss: 0.9535, test_f1: 0.5220
 epoch: 41, train_loss: 0.8877, test_loss: 0.9694, test_f1: 0.5080
 epoch: 42, train_loss: 0.8819, test_loss: 0.9286, test_f1: 0.5438
 epoch: 43, train_loss: 0.8862, test_loss: 0.9478, test_f1: 0.5199
 epoch: 44, train_loss: 0.8838, test_loss: 0.9578, test_f1: 0.5453
 epoch: 45, train_loss: 0.8736, test_loss: 0.9594, test_f1: 0.5318
 epoch: 46, train_loss: 0.8621, test_loss: 0.9484, test_f1: 0.5436
 epoch: 47, train_loss: 0.8709, test_loss: 0.9534, test_f1: 0.5434
 epoch: 48, train_loss: 0.8617, test_loss: 0.9551, test_f1: 0.5418
 epoch: 49, train_loss: 0.8744, test_loss: 0.9447, test_f1: 0.5363
 epoch: 50, train_loss: 0.8680, test_loss: 0.9589, test_f1: 0.5526
 epoch: 51, train_loss: 0.8633, test_loss: 0.9469, test_f1: 0.5387
 epoch: 52, train_loss: 0.8534, test_loss: 0.9331, test_f1: 0.5658
 epoch: 53, train_loss: 0.8398, test_loss: 0.9417, test_f1: 0.5314
 epoch: 54, train_loss: 0.8491, test_loss: 0.9354, test_f1: 0.5403
 epoch: 55, train_loss: 0.8476, test_loss: 0.9502, test_f1: 0.5430
 epoch: 56, train_loss: 0.8463, test_loss: 0.9468, test_f1: 0.5362
 epoch: 57, train_loss: 0.8333, test_loss: 0.9504, test_f1: 0.5363
 epoch: 58, train_loss: 0.8400, test_loss: 0.9368, test_f1: 0.5471
 epoch: 59, train_loss: 0.8408, test_loss: 0.9487, test_f1: 0.5420
 epoch: 60, train_loss: 0.8406, test_loss: 0.9421, test_f1: 0.5471
 epoch: 61, train_loss: 0.8370, test_loss: 0.9440, test_f1: 0.5563
 epoch: 62, train_loss: 0.8374, test_loss: 0.9509, test_f1: 0.5547
 epoch: 63, train_loss: 0.8287, test_loss: 0.9415, test_f1: 0.5474
 epoch: 64, train_loss: 0.8220, test_loss: 0.9530, test_f1: 0.5487
 epoch: 65, train_loss: 0.8288, test_loss: 0.9422, test_f1: 0.5343
 epoch: 66, train_loss: 0.8329, test_loss: 0.9645, test_f1: 0.5502
 epoch: 67, train_loss: 0.8290, test_loss: 0.9472, test_f1: 0.5603
 epoch: 68, train_loss: 0.8250, test_loss: 0.9508, test_f1: 0.5539
 epoch: 69, train_loss: 0.8249, test_loss: 0.9410, test_f1: 0.5461
 epoch: 70, train_loss: 0.8191, test_loss: 0.9443, test_f1: 0.5363
 epoch: 71, train_loss: 0.8294, test_loss: 0.9373, test_f1: 0.5563
 epoch: 72, train_loss: 0.8255, test_loss: 0.9455, test_f1: 0.5428
 epoch: 73, train_loss: 0.8252, test_loss: 0.9654, test_f1: 0.5355
 epoch: 74, train_loss: 0.8380, test_loss: 0.9425, test_f1: 0.5337
 epoch: 75, train_loss: 0.8192, test_loss: 0.9589, test_f1: 0.5421
 epoch: 76, train_loss: 0.8086, test_loss: 0.9491, test_f1: 0.5475
 epoch: 77, train_loss: 0.8151, test_loss: 0.9337, test_f1: 0.5517
 epoch: 78, train_loss: 0.8141, test_loss: 0.9444, test_f1: 0.5503
 epoch: 79, train_loss: 0.8154, test_loss: 0.9760, test_f1: 0.5378
 epoch: 80, train_loss: 0.8054, test_loss: 0.9545, test_f1: 0.5514
 epoch: 81, train_loss: 0.8099, test_loss: 0.9269, test_f1: 0.5514
 epoch: 82, train_loss: 0.7997, test_loss: 0.9497, test_f1: 0.5534
 epoch: 83, train_loss: 0.8069, test_loss: 0.9648, test_f1: 0.5360
 epoch: 84, train_loss: 0.8158, test_loss: 0.9514, test_f1: 0.5610
 epoch: 85, train_loss: 0.8178, test_loss: 0.9534, test_f1: 0.5605
 epoch: 86, train_loss: 0.8156, test_loss: 0.9450, test_f1: 0.5490
 epoch: 87, train_loss: 0.8037, test_loss: 0.9426, test_f1: 0.5432
 epoch: 88, train_loss: 0.8128, test_loss: 0.9574, test_f1: 0.5492
 epoch: 89, train_loss: 0.8028, test_loss: 0.9392, test_f1: 0.5512
 epoch: 90, train_loss: 0.8026, test_loss: 0.9631, test_f1: 0.5364
 epoch: 91, train_loss: 0.8145, test_loss: 0.9540, test_f1: 0.5364
 epoch: 92, train_loss: 0.7943, test_loss: 0.9624, test_f1: 0.5473
 epoch: 93, train_loss: 0.7938, test_loss: 0.9511, test_f1: 0.5339
 epoch: 94, train_loss: 0.7981, test_loss: 0.9483, test_f1: 0.5391
 epoch: 95, train_loss: 0.7988, test_loss: 0.9740, test_f1: 0.5435
 epoch: 96, train_loss: 0.8197, test_loss: 0.9591, test_f1: 0.5514
 epoch: 97, train_loss: 0.8127, test_loss: 0.9364, test_f1: 0.5460
 epoch: 98, train_loss: 0.8068, test_loss: 0.9534, test_f1: 0.5469
 epoch: 99, train_loss: 0.8064, test_loss: 0.9632, test_f1: 0.5442
##################ITERATION #3 ****************************************
 epoch: 0, train_loss: 1.3343, test_loss: 1.3402, test_f1: 0.2270
 epoch: 1, train_loss: 1.2255, test_loss: 1.2944, test_f1: 0.2270
 epoch: 2, train_loss: 1.1995, test_loss: 1.2256, test_f1: 0.2881
 epoch: 3, train_loss: 1.1600, test_loss: 1.1391, test_f1: 0.3966
 epoch: 4, train_loss: 1.1434, test_loss: 1.0893, test_f1: 0.4207
 epoch: 5, train_loss: 1.1147, test_loss: 1.0539, test_f1: 0.4590
 epoch: 6, train_loss: 1.1047, test_loss: 1.0330, test_f1: 0.4552
 epoch: 7, train_loss: 1.0885, test_loss: 1.0151, test_f1: 0.4623
 epoch: 8, train_loss: 1.0737, test_loss: 1.0123, test_f1: 0.4575
 epoch: 9, train_loss: 1.0616, test_loss: 0.9960, test_f1: 0.4818
 epoch: 10, train_loss: 1.0470, test_loss: 0.9810, test_f1: 0.4875
 epoch: 11, train_loss: 1.0340, test_loss: 0.9705, test_f1: 0.4927
 epoch: 12, train_loss: 1.0186, test_loss: 0.9866, test_f1: 0.4768
 epoch: 13, train_loss: 1.0053, test_loss: 0.9718, test_f1: 0.4900
 epoch: 14, train_loss: 1.0071, test_loss: 0.9746, test_f1: 0.4930
 epoch: 15, train_loss: 0.9986, test_loss: 0.9699, test_f1: 0.4887
 epoch: 16, train_loss: 0.9847, test_loss: 0.9747, test_f1: 0.4965
 epoch: 17, train_loss: 0.9804, test_loss: 0.9857, test_f1: 0.4709
 epoch: 18, train_loss: 0.9711, test_loss: 0.9739, test_f1: 0.4976
 epoch: 19, train_loss: 0.9670, test_loss: 0.9722, test_f1: 0.5105
 epoch: 20, train_loss: 0.9758, test_loss: 0.9585, test_f1: 0.5050
 epoch: 21, train_loss: 0.9612, test_loss: 0.9447, test_f1: 0.5029
 epoch: 22, train_loss: 0.9618, test_loss: 0.9676, test_f1: 0.5117
 epoch: 23, train_loss: 0.9591, test_loss: 0.9834, test_f1: 0.5088
 epoch: 24, train_loss: 0.9455, test_loss: 0.9714, test_f1: 0.4932
 epoch: 25, train_loss: 0.9461, test_loss: 0.9825, test_f1: 0.4913
 epoch: 26, train_loss: 0.9481, test_loss: 0.9871, test_f1: 0.5104
 epoch: 27, train_loss: 0.9341, test_loss: 0.9591, test_f1: 0.5075
 epoch: 28, train_loss: 0.9467, test_loss: 0.9543, test_f1: 0.5045
 epoch: 29, train_loss: 0.9318, test_loss: 0.9787, test_f1: 0.5126
 epoch: 30, train_loss: 0.9319, test_loss: 0.9560, test_f1: 0.5072
 epoch: 31, train_loss: 0.9272, test_loss: 0.9803, test_f1: 0.5041
 epoch: 32, train_loss: 0.9272, test_loss: 0.9734, test_f1: 0.5081
 epoch: 33, train_loss: 0.9173, test_loss: 0.9586, test_f1: 0.5111
 epoch: 34, train_loss: 0.9175, test_loss: 0.9376, test_f1: 0.5170
 epoch: 35, train_loss: 0.9141, test_loss: 0.9649, test_f1: 0.5087
 epoch: 36, train_loss: 0.9149, test_loss: 0.9735, test_f1: 0.5308
 epoch: 37, train_loss: 0.9206, test_loss: 0.9753, test_f1: 0.5048
 epoch: 38, train_loss: 0.9014, test_loss: 0.9576, test_f1: 0.5369
 epoch: 39, train_loss: 0.9216, test_loss: 0.9195, test_f1: 0.4995
 epoch: 40, train_loss: 0.9053, test_loss: 0.9672, test_f1: 0.5238
 epoch: 41, train_loss: 0.9084, test_loss: 0.9656, test_f1: 0.5127
 epoch: 42, train_loss: 0.9024, test_loss: 0.9715, test_f1: 0.5150
 epoch: 43, train_loss: 0.9016, test_loss: 0.9907, test_f1: 0.5000
 epoch: 44, train_loss: 0.9103, test_loss: 0.9634, test_f1: 0.5051
 epoch: 45, train_loss: 0.8939, test_loss: 0.9706, test_f1: 0.5193
 epoch: 46, train_loss: 0.8942, test_loss: 0.9752, test_f1: 0.5147
 epoch: 47, train_loss: 0.8933, test_loss: 0.9669, test_f1: 0.5174
 epoch: 48, train_loss: 0.8952, test_loss: 0.9416, test_f1: 0.5310
 epoch: 49, train_loss: 0.8899, test_loss: 0.9658, test_f1: 0.5195
 epoch: 50, train_loss: 0.8805, test_loss: 0.9661, test_f1: 0.5341
 epoch: 51, train_loss: 0.8747, test_loss: 0.9661, test_f1: 0.5215
 epoch: 52, train_loss: 0.8761, test_loss: 0.9828, test_f1: 0.5228
 epoch: 53, train_loss: 0.8745, test_loss: 0.9663, test_f1: 0.5264
 epoch: 54, train_loss: 0.8698, test_loss: 0.9537, test_f1: 0.5324
 epoch: 55, train_loss: 0.8702, test_loss: 0.9588, test_f1: 0.5257
 epoch: 56, train_loss: 0.8718, test_loss: 0.9653, test_f1: 0.5268
 epoch: 57, train_loss: 0.8624, test_loss: 0.9679, test_f1: 0.5349
 epoch: 58, train_loss: 0.8712, test_loss: 0.9763, test_f1: 0.5277
 epoch: 59, train_loss: 0.8684, test_loss: 0.9672, test_f1: 0.5216
 epoch: 60, train_loss: 0.8622, test_loss: 0.9709, test_f1: 0.5225
 epoch: 61, train_loss: 0.8548, test_loss: 0.9686, test_f1: 0.5251
 epoch: 62, train_loss: 0.8567, test_loss: 0.9643, test_f1: 0.5309
 epoch: 63, train_loss: 0.8703, test_loss: 0.9771, test_f1: 0.5260
 epoch: 64, train_loss: 0.8626, test_loss: 0.9782, test_f1: 0.5349
 epoch: 65, train_loss: 0.8678, test_loss: 0.9709, test_f1: 0.5302
 epoch: 66, train_loss: 0.8660, test_loss: 0.9779, test_f1: 0.5199
 epoch: 67, train_loss: 0.8463, test_loss: 0.9679, test_f1: 0.5273
 epoch: 68, train_loss: 0.8581, test_loss: 0.9740, test_f1: 0.5259
 epoch: 69, train_loss: 0.8620, test_loss: 0.9691, test_f1: 0.5262
 epoch: 70, train_loss: 0.8514, test_loss: 0.9537, test_f1: 0.5313
 epoch: 71, train_loss: 0.8564, test_loss: 0.9711, test_f1: 0.5327
 epoch: 72, train_loss: 0.8617, test_loss: 0.9657, test_f1: 0.5308
 epoch: 73, train_loss: 0.8558, test_loss: 0.9587, test_f1: 0.5353
 epoch: 74, train_loss: 0.8440, test_loss: 0.9647, test_f1: 0.5375
 epoch: 75, train_loss: 0.8540, test_loss: 0.9662, test_f1: 0.5417
 epoch: 76, train_loss: 0.8455, test_loss: 0.9729, test_f1: 0.5478
 epoch: 77, train_loss: 0.8457, test_loss: 0.9675, test_f1: 0.5391
 epoch: 78, train_loss: 0.8475, test_loss: 0.9755, test_f1: 0.5326
 epoch: 79, train_loss: 0.8487, test_loss: 0.9717, test_f1: 0.5497
 epoch: 80, train_loss: 0.8383, test_loss: 0.9788, test_f1: 0.5313
 epoch: 81, train_loss: 0.8412, test_loss: 0.9642, test_f1: 0.5361
 epoch: 82, train_loss: 0.8483, test_loss: 0.9761, test_f1: 0.5283
 epoch: 83, train_loss: 0.8494, test_loss: 0.9655, test_f1: 0.5389
 epoch: 84, train_loss: 0.8437, test_loss: 0.9649, test_f1: 0.5337
 epoch: 85, train_loss: 0.8376, test_loss: 0.9727, test_f1: 0.5382
 epoch: 86, train_loss: 0.8390, test_loss: 0.9712, test_f1: 0.5518
 epoch: 87, train_loss: 0.8367, test_loss: 0.9801, test_f1: 0.5558
 epoch: 88, train_loss: 0.8331, test_loss: 0.9883, test_f1: 0.5230
 epoch: 89, train_loss: 0.8374, test_loss: 0.9770, test_f1: 0.5290
 epoch: 90, train_loss: 0.8401, test_loss: 0.9758, test_f1: 0.5364
 epoch: 91, train_loss: 0.8315, test_loss: 0.9927, test_f1: 0.5271
 epoch: 92, train_loss: 0.8390, test_loss: 0.9707, test_f1: 0.5504
 epoch: 93, train_loss: 0.8389, test_loss: 0.9744, test_f1: 0.5528
 epoch: 94, train_loss: 0.8315, test_loss: 0.9639, test_f1: 0.5372
 epoch: 95, train_loss: 0.8295, test_loss: 0.9703, test_f1: 0.5391
 epoch: 96, train_loss: 0.8233, test_loss: 0.9689, test_f1: 0.5382
 epoch: 97, train_loss: 0.8290, test_loss: 0.9712, test_f1: 0.5353
 epoch: 98, train_loss: 0.8233, test_loss: 0.9621, test_f1: 0.5397
 epoch: 99, train_loss: 0.8284, test_loss: 0.9856, test_f1: 0.5336
##################ITERATION #4 ****************************************
 epoch: 0, train_loss: 1.3393, test_loss: 1.3278, test_f1: 0.2270
 epoch: 1, train_loss: 1.2239, test_loss: 1.2881, test_f1: 0.2270
 epoch: 2, train_loss: 1.1861, test_loss: 1.2212, test_f1: 0.2666
 epoch: 3, train_loss: 1.1579, test_loss: 1.1558, test_f1: 0.3881
 epoch: 4, train_loss: 1.1390, test_loss: 1.1072, test_f1: 0.4368
 epoch: 5, train_loss: 1.1090, test_loss: 1.0695, test_f1: 0.4375
 epoch: 6, train_loss: 1.0847, test_loss: 1.0245, test_f1: 0.4660
 epoch: 7, train_loss: 1.0658, test_loss: 1.0019, test_f1: 0.4648
 epoch: 8, train_loss: 1.0535, test_loss: 1.0102, test_f1: 0.4678
 epoch: 9, train_loss: 1.0293, test_loss: 1.0166, test_f1: 0.4569
 epoch: 10, train_loss: 1.0198, test_loss: 0.9935, test_f1: 0.4830
 epoch: 11, train_loss: 1.0149, test_loss: 1.0060, test_f1: 0.4757
 epoch: 12, train_loss: 0.9994, test_loss: 1.0061, test_f1: 0.4807
 epoch: 13, train_loss: 0.9971, test_loss: 1.0068, test_f1: 0.4795
 epoch: 14, train_loss: 0.9862, test_loss: 0.9995, test_f1: 0.4682
 epoch: 15, train_loss: 0.9816, test_loss: 1.0151, test_f1: 0.4871
 epoch: 16, train_loss: 0.9722, test_loss: 1.0041, test_f1: 0.4809
 epoch: 17, train_loss: 0.9704, test_loss: 0.9981, test_f1: 0.4819
 epoch: 18, train_loss: 0.9649, test_loss: 0.9957, test_f1: 0.4835
 epoch: 19, train_loss: 0.9531, test_loss: 1.0370, test_f1: 0.4677
 epoch: 20, train_loss: 0.9520, test_loss: 1.0065, test_f1: 0.4911
 epoch: 21, train_loss: 0.9506, test_loss: 1.0123, test_f1: 0.4800
 epoch: 22, train_loss: 0.9528, test_loss: 0.9993, test_f1: 0.4832
 epoch: 23, train_loss: 0.9416, test_loss: 0.9824, test_f1: 0.4919
 epoch: 24, train_loss: 0.9429, test_loss: 0.9909, test_f1: 0.4978
 epoch: 25, train_loss: 0.9280, test_loss: 0.9874, test_f1: 0.4907
 epoch: 26, train_loss: 0.9257, test_loss: 1.0099, test_f1: 0.4800
 epoch: 27, train_loss: 0.9297, test_loss: 1.0174, test_f1: 0.4931
 epoch: 28, train_loss: 0.9211, test_loss: 1.0074, test_f1: 0.5084
 epoch: 29, train_loss: 0.9261, test_loss: 1.0132, test_f1: 0.5022
 epoch: 30, train_loss: 0.9106, test_loss: 1.0025, test_f1: 0.5069
 epoch: 31, train_loss: 0.9122, test_loss: 1.0262, test_f1: 0.4987
 epoch: 32, train_loss: 0.9014, test_loss: 0.9955, test_f1: 0.5155
 epoch: 33, train_loss: 0.9051, test_loss: 1.0199, test_f1: 0.5079
 epoch: 34, train_loss: 0.9160, test_loss: 0.9889, test_f1: 0.5138
 epoch: 35, train_loss: 0.8953, test_loss: 0.9949, test_f1: 0.5175
 epoch: 36, train_loss: 0.8902, test_loss: 1.0163, test_f1: 0.4975
 epoch: 37, train_loss: 0.8989, test_loss: 1.0175, test_f1: 0.5189
 epoch: 38, train_loss: 0.8943, test_loss: 1.0149, test_f1: 0.5186
 epoch: 39, train_loss: 0.8973, test_loss: 1.0389, test_f1: 0.5153
 epoch: 40, train_loss: 0.8938, test_loss: 1.0275, test_f1: 0.5186
 epoch: 41, train_loss: 0.8943, test_loss: 1.0319, test_f1: 0.5195
 epoch: 42, train_loss: 0.8812, test_loss: 1.0383, test_f1: 0.5140
 epoch: 43, train_loss: 0.8779, test_loss: 1.0281, test_f1: 0.5143
 epoch: 44, train_loss: 0.8816, test_loss: 1.0309, test_f1: 0.5110
 epoch: 45, train_loss: 0.8753, test_loss: 1.0074, test_f1: 0.5126
 epoch: 46, train_loss: 0.8801, test_loss: 1.0119, test_f1: 0.5174
 epoch: 47, train_loss: 0.8791, test_loss: 1.0018, test_f1: 0.5229
 epoch: 48, train_loss: 0.8671, test_loss: 1.0058, test_f1: 0.5294
 epoch: 49, train_loss: 0.8754, test_loss: 1.0176, test_f1: 0.5322
 epoch: 50, train_loss: 0.8648, test_loss: 0.9907, test_f1: 0.5249
 epoch: 51, train_loss: 0.8658, test_loss: 1.0300, test_f1: 0.5273
 epoch: 52, train_loss: 0.8601, test_loss: 1.0145, test_f1: 0.5206
 epoch: 53, train_loss: 0.8535, test_loss: 1.0252, test_f1: 0.5091
 epoch: 54, train_loss: 0.8580, test_loss: 1.0482, test_f1: 0.5092
 epoch: 55, train_loss: 0.8439, test_loss: 1.0489, test_f1: 0.5088
 epoch: 56, train_loss: 0.8522, test_loss: 1.0321, test_f1: 0.5122
 epoch: 57, train_loss: 0.8513, test_loss: 1.0230, test_f1: 0.5291
 epoch: 58, train_loss: 0.8633, test_loss: 0.9984, test_f1: 0.5343
 epoch: 59, train_loss: 0.8516, test_loss: 1.0115, test_f1: 0.5249
 epoch: 60, train_loss: 0.8458, test_loss: 1.0086, test_f1: 0.5394
 epoch: 61, train_loss: 0.8401, test_loss: 1.0103, test_f1: 0.5331
 epoch: 62, train_loss: 0.8409, test_loss: 0.9980, test_f1: 0.5473
 epoch: 63, train_loss: 0.8398, test_loss: 0.9946, test_f1: 0.5407
 epoch: 64, train_loss: 0.8485, test_loss: 0.9946, test_f1: 0.5331
 epoch: 65, train_loss: 0.8439, test_loss: 0.9942, test_f1: 0.5461
 epoch: 66, train_loss: 0.8442, test_loss: 1.0126, test_f1: 0.5407
 epoch: 67, train_loss: 0.8327, test_loss: 1.0176, test_f1: 0.5291
 epoch: 68, train_loss: 0.8413, test_loss: 1.0167, test_f1: 0.5358
 epoch: 69, train_loss: 0.8332, test_loss: 1.0398, test_f1: 0.5293
 epoch: 70, train_loss: 0.8408, test_loss: 1.0294, test_f1: 0.5251
 epoch: 71, train_loss: 0.8391, test_loss: 0.9982, test_f1: 0.5469
 epoch: 72, train_loss: 0.8362, test_loss: 0.9981, test_f1: 0.5431
 epoch: 73, train_loss: 0.8325, test_loss: 1.0141, test_f1: 0.5479
 epoch: 74, train_loss: 0.8323, test_loss: 1.0063, test_f1: 0.5415
 epoch: 75, train_loss: 0.8372, test_loss: 0.9978, test_f1: 0.5463
 epoch: 76, train_loss: 0.8285, test_loss: 1.0030, test_f1: 0.5383
 epoch: 77, train_loss: 0.8256, test_loss: 1.0515, test_f1: 0.5259
 epoch: 78, train_loss: 0.8372, test_loss: 0.9975, test_f1: 0.5420
 epoch: 79, train_loss: 0.8348, test_loss: 1.0583, test_f1: 0.5360
 epoch: 80, train_loss: 0.8291, test_loss: 1.0082, test_f1: 0.5456
 epoch: 81, train_loss: 0.8262, test_loss: 1.0178, test_f1: 0.5401
 epoch: 82, train_loss: 0.8192, test_loss: 1.0014, test_f1: 0.5370
 epoch: 83, train_loss: 0.8208, test_loss: 1.0090, test_f1: 0.5398
 epoch: 84, train_loss: 0.8186, test_loss: 0.9914, test_f1: 0.5595
 epoch: 85, train_loss: 0.8337, test_loss: 1.0067, test_f1: 0.5512
 epoch: 86, train_loss: 0.8227, test_loss: 1.0076, test_f1: 0.5485
 epoch: 87, train_loss: 0.8105, test_loss: 1.0514, test_f1: 0.5280
 epoch: 88, train_loss: 0.8145, test_loss: 1.0063, test_f1: 0.5607
 epoch: 89, train_loss: 0.8223, test_loss: 1.0302, test_f1: 0.5415
 epoch: 90, train_loss: 0.8138, test_loss: 1.0191, test_f1: 0.5498
 epoch: 91, train_loss: 0.8107, test_loss: 1.0036, test_f1: 0.5494
 epoch: 92, train_loss: 0.8221, test_loss: 1.0416, test_f1: 0.5333
 epoch: 93, train_loss: 0.8257, test_loss: 1.0408, test_f1: 0.5276
 epoch: 94, train_loss: 0.8040, test_loss: 1.1038, test_f1: 0.5245
 epoch: 95, train_loss: 0.8115, test_loss: 1.0084, test_f1: 0.5623
 epoch: 96, train_loss: 0.8136, test_loss: 1.0269, test_f1: 0.5436
 epoch: 97, train_loss: 0.8025, test_loss: 1.0333, test_f1: 0.5538
 epoch: 98, train_loss: 0.8078, test_loss: 1.0088, test_f1: 0.5531
 epoch: 99, train_loss: 0.8062, test_loss: 0.9984, test_f1: 0.5511
##################ITERATION #5 ****************************************
 epoch: 0, train_loss: 1.3556, test_loss: 1.3620, test_f1: 0.2270
 epoch: 1, train_loss: 1.2048, test_loss: 1.3308, test_f1: 0.2690
 epoch: 2, train_loss: 1.1749, test_loss: 1.2431, test_f1: 0.3268
 epoch: 3, train_loss: 1.1464, test_loss: 1.1376, test_f1: 0.3936
 epoch: 4, train_loss: 1.1287, test_loss: 1.0710, test_f1: 0.4586
 epoch: 5, train_loss: 1.1079, test_loss: 1.0362, test_f1: 0.4734
 epoch: 6, train_loss: 1.0911, test_loss: 1.0199, test_f1: 0.4578
 epoch: 7, train_loss: 1.0656, test_loss: 1.0002, test_f1: 0.4662
 epoch: 8, train_loss: 1.0613, test_loss: 0.9928, test_f1: 0.4880
 epoch: 9, train_loss: 1.0395, test_loss: 0.9803, test_f1: 0.4812
 epoch: 10, train_loss: 1.0299, test_loss: 0.9759, test_f1: 0.4792
 epoch: 11, train_loss: 1.0324, test_loss: 0.9807, test_f1: 0.4806
 epoch: 12, train_loss: 1.0133, test_loss: 0.9545, test_f1: 0.4813
 epoch: 13, train_loss: 1.0082, test_loss: 0.9610, test_f1: 0.4982
 epoch: 14, train_loss: 0.9932, test_loss: 0.9485, test_f1: 0.5065
 epoch: 15, train_loss: 1.0006, test_loss: 0.9420, test_f1: 0.4723
 epoch: 16, train_loss: 0.9777, test_loss: 0.9318, test_f1: 0.4818
 epoch: 17, train_loss: 0.9760, test_loss: 0.9479, test_f1: 0.5040
 epoch: 18, train_loss: 0.9707, test_loss: 0.9414, test_f1: 0.5002
 epoch: 19, train_loss: 0.9740, test_loss: 0.9362, test_f1: 0.4998
 epoch: 20, train_loss: 0.9705, test_loss: 0.9275, test_f1: 0.5112
 epoch: 21, train_loss: 0.9654, test_loss: 0.9350, test_f1: 0.5040
 epoch: 22, train_loss: 0.9552, test_loss: 0.9417, test_f1: 0.5122
 epoch: 23, train_loss: 0.9466, test_loss: 0.9156, test_f1: 0.5166
 epoch: 24, train_loss: 0.9410, test_loss: 0.9572, test_f1: 0.4792
 epoch: 25, train_loss: 0.9444, test_loss: 0.9539, test_f1: 0.5057
 epoch: 26, train_loss: 0.9399, test_loss: 0.8994, test_f1: 0.5217
 epoch: 27, train_loss: 0.9433, test_loss: 0.8914, test_f1: 0.5200
 epoch: 28, train_loss: 0.9336, test_loss: 0.9404, test_f1: 0.4878
 epoch: 29, train_loss: 0.9205, test_loss: 0.9627, test_f1: 0.4963
 epoch: 30, train_loss: 0.9134, test_loss: 0.9226, test_f1: 0.5097
 epoch: 31, train_loss: 0.9233, test_loss: 0.9212, test_f1: 0.4931
 epoch: 32, train_loss: 0.9156, test_loss: 0.9046, test_f1: 0.5145
 epoch: 33, train_loss: 0.9144, test_loss: 0.9009, test_f1: 0.5143
 epoch: 34, train_loss: 0.9003, test_loss: 0.9582, test_f1: 0.4841
 epoch: 35, train_loss: 0.9022, test_loss: 0.9353, test_f1: 0.4949
 epoch: 36, train_loss: 0.8910, test_loss: 0.9598, test_f1: 0.5013
 epoch: 37, train_loss: 0.8942, test_loss: 0.9287, test_f1: 0.5100
 epoch: 38, train_loss: 0.8825, test_loss: 0.9391, test_f1: 0.5114
 epoch: 39, train_loss: 0.8773, test_loss: 0.9160, test_f1: 0.5118
 epoch: 40, train_loss: 0.8860, test_loss: 0.8927, test_f1: 0.5214
 epoch: 41, train_loss: 0.8881, test_loss: 0.9552, test_f1: 0.4972
 epoch: 42, train_loss: 0.8835, test_loss: 0.8889, test_f1: 0.5161
 epoch: 43, train_loss: 0.8880, test_loss: 0.9337, test_f1: 0.5147
 epoch: 44, train_loss: 0.8730, test_loss: 0.8529, test_f1: 0.5354
 epoch: 45, train_loss: 0.8850, test_loss: 0.9276, test_f1: 0.5166
 epoch: 46, train_loss: 0.8646, test_loss: 0.8776, test_f1: 0.5213
 epoch: 47, train_loss: 0.8700, test_loss: 0.9186, test_f1: 0.5092
 epoch: 48, train_loss: 0.8631, test_loss: 0.9282, test_f1: 0.5124
 epoch: 49, train_loss: 0.8710, test_loss: 0.8840, test_f1: 0.5290
 epoch: 50, train_loss: 0.8577, test_loss: 0.9331, test_f1: 0.5140
 epoch: 51, train_loss: 0.8584, test_loss: 0.9225, test_f1: 0.5235
 epoch: 52, train_loss: 0.8428, test_loss: 0.8870, test_f1: 0.5187
 epoch: 53, train_loss: 0.8473, test_loss: 0.9148, test_f1: 0.5241
 epoch: 54, train_loss: 0.8552, test_loss: 0.8983, test_f1: 0.5208
 epoch: 55, train_loss: 0.8451, test_loss: 0.9187, test_f1: 0.5201
 epoch: 56, train_loss: 0.8432, test_loss: 0.9545, test_f1: 0.5203
 epoch: 57, train_loss: 0.8443, test_loss: 0.8860, test_f1: 0.5250
 epoch: 58, train_loss: 0.8342, test_loss: 0.9387, test_f1: 0.5163
 epoch: 59, train_loss: 0.8519, test_loss: 0.9451, test_f1: 0.5168
 epoch: 60, train_loss: 0.8433, test_loss: 0.8889, test_f1: 0.5236
 epoch: 61, train_loss: 0.8362, test_loss: 0.9168, test_f1: 0.5283
 epoch: 62, train_loss: 0.8428, test_loss: 0.9091, test_f1: 0.5129
 epoch: 63, train_loss: 0.8323, test_loss: 0.9228, test_f1: 0.5242
 epoch: 64, train_loss: 0.8335, test_loss: 0.9073, test_f1: 0.5258
 epoch: 65, train_loss: 0.8376, test_loss: 0.8806, test_f1: 0.5324
 epoch: 66, train_loss: 0.8224, test_loss: 0.9175, test_f1: 0.5253
 epoch: 67, train_loss: 0.8251, test_loss: 0.9248, test_f1: 0.5321
 epoch: 68, train_loss: 0.8374, test_loss: 0.9045, test_f1: 0.5295
 epoch: 69, train_loss: 0.8277, test_loss: 0.8902, test_f1: 0.5356
 epoch: 70, train_loss: 0.8315, test_loss: 0.9243, test_f1: 0.5339
 epoch: 71, train_loss: 0.8269, test_loss: 0.8952, test_f1: 0.5279
 epoch: 72, train_loss: 0.8324, test_loss: 0.9128, test_f1: 0.5380
 epoch: 73, train_loss: 0.8216, test_loss: 0.9053, test_f1: 0.5365
 epoch: 74, train_loss: 0.8325, test_loss: 0.9012, test_f1: 0.5360
 epoch: 75, train_loss: 0.8232, test_loss: 0.9021, test_f1: 0.5439
 epoch: 76, train_loss: 0.8302, test_loss: 0.9213, test_f1: 0.5341
 epoch: 77, train_loss: 0.8301, test_loss: 0.9393, test_f1: 0.5323
 epoch: 78, train_loss: 0.8175, test_loss: 0.8878, test_f1: 0.5297
 epoch: 79, train_loss: 0.8224, test_loss: 0.9442, test_f1: 0.5367
 epoch: 80, train_loss: 0.8062, test_loss: 0.9081, test_f1: 0.5406
 epoch: 81, train_loss: 0.8161, test_loss: 0.9154, test_f1: 0.5407
 epoch: 82, train_loss: 0.8145, test_loss: 0.9536, test_f1: 0.5298
 epoch: 83, train_loss: 0.8274, test_loss: 0.9289, test_f1: 0.5411
 epoch: 84, train_loss: 0.8236, test_loss: 0.9510, test_f1: 0.5301
 epoch: 85, train_loss: 0.8170, test_loss: 0.9062, test_f1: 0.5442
 epoch: 86, train_loss: 0.8221, test_loss: 0.9567, test_f1: 0.5383
 epoch: 87, train_loss: 0.8209, test_loss: 0.8708, test_f1: 0.5511
 epoch: 88, train_loss: 0.8116, test_loss: 0.9350, test_f1: 0.5326
 epoch: 89, train_loss: 0.8220, test_loss: 0.9168, test_f1: 0.5409
 epoch: 90, train_loss: 0.8199, test_loss: 0.9292, test_f1: 0.5431
 epoch: 91, train_loss: 0.8157, test_loss: 0.9433, test_f1: 0.5379
 epoch: 92, train_loss: 0.8139, test_loss: 0.9202, test_f1: 0.5451
 epoch: 93, train_loss: 0.8106, test_loss: 0.8830, test_f1: 0.5393
 epoch: 94, train_loss: 0.8146, test_loss: 0.9070, test_f1: 0.5449
 epoch: 95, train_loss: 0.8109, test_loss: 0.9219, test_f1: 0.5494
 epoch: 96, train_loss: 0.8170, test_loss: 0.8396, test_f1: 0.5569
 epoch: 97, train_loss: 0.8023, test_loss: 0.9291, test_f1: 0.5519
 epoch: 98, train_loss: 0.8158, test_loss: 0.9167, test_f1: 0.5461
 epoch: 99, train_loss: 0.7955, test_loss: 0.9126, test_f1: 0.5536
##################ITERATION #6 ****************************************
 epoch: 0, train_loss: 1.3931, test_loss: 1.3517, test_f1: 0.2270
 epoch: 1, train_loss: 1.2284, test_loss: 1.2932, test_f1: 0.2270
 epoch: 2, train_loss: 1.1773, test_loss: 1.2225, test_f1: 0.4170
 epoch: 3, train_loss: 1.1447, test_loss: 1.1745, test_f1: 0.3957
 epoch: 4, train_loss: 1.1200, test_loss: 1.0899, test_f1: 0.4606
 epoch: 5, train_loss: 1.1076, test_loss: 1.0356, test_f1: 0.4553
 epoch: 6, train_loss: 1.0745, test_loss: 0.9979, test_f1: 0.4591
 epoch: 7, train_loss: 1.0583, test_loss: 0.9872, test_f1: 0.4619
 epoch: 8, train_loss: 1.0444, test_loss: 0.9913, test_f1: 0.4686
 epoch: 9, train_loss: 1.0274, test_loss: 0.9971, test_f1: 0.4710
 epoch: 10, train_loss: 1.0218, test_loss: 0.9756, test_f1: 0.4791
 epoch: 11, train_loss: 1.0156, test_loss: 0.9785, test_f1: 0.4847
 epoch: 12, train_loss: 1.0018, test_loss: 0.9765, test_f1: 0.4786
 epoch: 13, train_loss: 0.9963, test_loss: 0.9895, test_f1: 0.5013
 epoch: 14, train_loss: 0.9998, test_loss: 0.9789, test_f1: 0.4884
 epoch: 15, train_loss: 0.9753, test_loss: 0.9588, test_f1: 0.5051
 epoch: 16, train_loss: 0.9784, test_loss: 0.9730, test_f1: 0.5173
 epoch: 17, train_loss: 0.9751, test_loss: 0.9772, test_f1: 0.5012
 epoch: 18, train_loss: 0.9632, test_loss: 0.9737, test_f1: 0.5076
 epoch: 19, train_loss: 0.9504, test_loss: 0.9629, test_f1: 0.5062
 epoch: 20, train_loss: 0.9511, test_loss: 0.9909, test_f1: 0.5135
 epoch: 21, train_loss: 0.9430, test_loss: 0.9857, test_f1: 0.5129
 epoch: 22, train_loss: 0.9536, test_loss: 0.9799, test_f1: 0.4984
 epoch: 23, train_loss: 0.9426, test_loss: 0.9923, test_f1: 0.5014
 epoch: 24, train_loss: 0.9459, test_loss: 0.9598, test_f1: 0.5085
 epoch: 25, train_loss: 0.9356, test_loss: 0.9989, test_f1: 0.5104
 epoch: 26, train_loss: 0.9331, test_loss: 0.9876, test_f1: 0.5255
 epoch: 27, train_loss: 0.9251, test_loss: 0.9791, test_f1: 0.5122
 epoch: 28, train_loss: 0.9204, test_loss: 0.9696, test_f1: 0.4951
 epoch: 29, train_loss: 0.9237, test_loss: 0.9916, test_f1: 0.5008
 epoch: 30, train_loss: 0.9076, test_loss: 0.9882, test_f1: 0.5173
 epoch: 31, train_loss: 0.9168, test_loss: 0.9965, test_f1: 0.5017
 epoch: 32, train_loss: 0.9149, test_loss: 0.9805, test_f1: 0.5175
 epoch: 33, train_loss: 0.8993, test_loss: 0.9796, test_f1: 0.5136
 epoch: 34, train_loss: 0.9025, test_loss: 0.9983, test_f1: 0.5001
 epoch: 35, train_loss: 0.8984, test_loss: 0.9760, test_f1: 0.5167
 epoch: 36, train_loss: 0.8889, test_loss: 0.9671, test_f1: 0.5128
 epoch: 37, train_loss: 0.8980, test_loss: 0.9845, test_f1: 0.5101
 epoch: 38, train_loss: 0.8955, test_loss: 0.9915, test_f1: 0.5120
 epoch: 39, train_loss: 0.8854, test_loss: 0.9665, test_f1: 0.5063
 epoch: 40, train_loss: 0.8841, test_loss: 0.9826, test_f1: 0.5111
 epoch: 41, train_loss: 0.8875, test_loss: 0.9592, test_f1: 0.5275
 epoch: 42, train_loss: 0.8846, test_loss: 0.9996, test_f1: 0.5132
 epoch: 43, train_loss: 0.8841, test_loss: 0.9769, test_f1: 0.5346
 epoch: 44, train_loss: 0.8655, test_loss: 0.9780, test_f1: 0.5280
 epoch: 45, train_loss: 0.8758, test_loss: 0.9902, test_f1: 0.5264
 epoch: 46, train_loss: 0.8599, test_loss: 0.9767, test_f1: 0.5176
 epoch: 47, train_loss: 0.8590, test_loss: 0.9779, test_f1: 0.5341
 epoch: 48, train_loss: 0.8646, test_loss: 0.9948, test_f1: 0.5301
 epoch: 49, train_loss: 0.8738, test_loss: 0.9776, test_f1: 0.5209
 epoch: 50, train_loss: 0.8612, test_loss: 0.9789, test_f1: 0.5309
 epoch: 51, train_loss: 0.8635, test_loss: 0.9744, test_f1: 0.5196
 epoch: 52, train_loss: 0.8642, test_loss: 0.9618, test_f1: 0.5264
 epoch: 53, train_loss: 0.8371, test_loss: 0.9791, test_f1: 0.5257
 epoch: 54, train_loss: 0.8539, test_loss: 0.9688, test_f1: 0.5165
 epoch: 55, train_loss: 0.8402, test_loss: 0.9575, test_f1: 0.5198
 epoch: 56, train_loss: 0.8339, test_loss: 0.9773, test_f1: 0.5148
 epoch: 57, train_loss: 0.8379, test_loss: 0.9687, test_f1: 0.5211
 epoch: 58, train_loss: 0.8377, test_loss: 0.9802, test_f1: 0.5135
 epoch: 59, train_loss: 0.8339, test_loss: 0.9580, test_f1: 0.5235
 epoch: 60, train_loss: 0.8381, test_loss: 0.9616, test_f1: 0.5254
 epoch: 61, train_loss: 0.8356, test_loss: 0.9757, test_f1: 0.5196
 epoch: 62, train_loss: 0.8368, test_loss: 0.9598, test_f1: 0.5354
 epoch: 63, train_loss: 0.8405, test_loss: 0.9691, test_f1: 0.5183
 epoch: 64, train_loss: 0.8296, test_loss: 0.9571, test_f1: 0.5276
 epoch: 65, train_loss: 0.8245, test_loss: 0.9542, test_f1: 0.5264
 epoch: 66, train_loss: 0.8258, test_loss: 0.9526, test_f1: 0.5305
 epoch: 67, train_loss: 0.8293, test_loss: 0.9691, test_f1: 0.5249
 epoch: 68, train_loss: 0.8318, test_loss: 0.9675, test_f1: 0.5238
 epoch: 69, train_loss: 0.8266, test_loss: 0.9800, test_f1: 0.5172
 epoch: 70, train_loss: 0.8224, test_loss: 0.9677, test_f1: 0.5243
 epoch: 71, train_loss: 0.8242, test_loss: 0.9581, test_f1: 0.5256
 epoch: 72, train_loss: 0.8148, test_loss: 0.9624, test_f1: 0.5246
 epoch: 73, train_loss: 0.8192, test_loss: 0.9621, test_f1: 0.5279
 epoch: 74, train_loss: 0.8269, test_loss: 0.9729, test_f1: 0.5315
 epoch: 75, train_loss: 0.8096, test_loss: 0.9714, test_f1: 0.5264
 epoch: 76, train_loss: 0.8128, test_loss: 0.9585, test_f1: 0.5224
 epoch: 77, train_loss: 0.8173, test_loss: 0.9901, test_f1: 0.5261
 epoch: 78, train_loss: 0.8207, test_loss: 0.9573, test_f1: 0.5330
 epoch: 79, train_loss: 0.8083, test_loss: 0.9702, test_f1: 0.5256
 epoch: 80, train_loss: 0.8130, test_loss: 0.9581, test_f1: 0.5379
 epoch: 81, train_loss: 0.8112, test_loss: 0.9685, test_f1: 0.5254
 epoch: 82, train_loss: 0.8079, test_loss: 0.9722, test_f1: 0.5310
 epoch: 83, train_loss: 0.8061, test_loss: 0.9628, test_f1: 0.5177
 epoch: 84, train_loss: 0.8047, test_loss: 0.9741, test_f1: 0.5208
 epoch: 85, train_loss: 0.7967, test_loss: 0.9526, test_f1: 0.5384
 epoch: 86, train_loss: 0.7990, test_loss: 0.9759, test_f1: 0.5384
 epoch: 87, train_loss: 0.8148, test_loss: 0.9604, test_f1: 0.5286
 epoch: 88, train_loss: 0.8093, test_loss: 0.9642, test_f1: 0.5323
 epoch: 89, train_loss: 0.7962, test_loss: 0.9597, test_f1: 0.5403
 epoch: 90, train_loss: 0.8048, test_loss: 0.9669, test_f1: 0.5296
 epoch: 91, train_loss: 0.7984, test_loss: 0.9541, test_f1: 0.5292
 epoch: 92, train_loss: 0.7944, test_loss: 0.9630, test_f1: 0.5297
 epoch: 93, train_loss: 0.7921, test_loss: 0.9595, test_f1: 0.5286
 epoch: 94, train_loss: 0.7939, test_loss: 0.9744, test_f1: 0.5222
 epoch: 95, train_loss: 0.8000, test_loss: 0.9601, test_f1: 0.5346
 epoch: 96, train_loss: 0.7952, test_loss: 0.9764, test_f1: 0.5205
 epoch: 97, train_loss: 0.7956, test_loss: 0.9645, test_f1: 0.5308
 epoch: 98, train_loss: 0.7965, test_loss: 0.9513, test_f1: 0.5421
 epoch: 99, train_loss: 0.7955, test_loss: 0.9416, test_f1: 0.5382
##################ITERATION #7 ****************************************
 epoch: 0, train_loss: 1.3365, test_loss: 1.3359, test_f1: 0.2270
 epoch: 1, train_loss: 1.2033, test_loss: 1.3087, test_f1: 0.2499
 epoch: 2, train_loss: 1.1738, test_loss: 1.2368, test_f1: 0.3034
 epoch: 3, train_loss: 1.1558, test_loss: 1.1789, test_f1: 0.3128
 epoch: 4, train_loss: 1.1366, test_loss: 1.0961, test_f1: 0.3898
 epoch: 5, train_loss: 1.1115, test_loss: 1.0433, test_f1: 0.4268
 epoch: 6, train_loss: 1.0968, test_loss: 1.0188, test_f1: 0.4688
 epoch: 7, train_loss: 1.0859, test_loss: 0.9941, test_f1: 0.4676
 epoch: 8, train_loss: 1.0785, test_loss: 0.9873, test_f1: 0.4703
 epoch: 9, train_loss: 1.0611, test_loss: 0.9908, test_f1: 0.4532
 epoch: 10, train_loss: 1.0565, test_loss: 0.9795, test_f1: 0.4741
 epoch: 11, train_loss: 1.0418, test_loss: 0.9856, test_f1: 0.4650
 epoch: 12, train_loss: 1.0436, test_loss: 0.9794, test_f1: 0.4620
 epoch: 13, train_loss: 1.0206, test_loss: 0.9670, test_f1: 0.4745
 epoch: 14, train_loss: 1.0290, test_loss: 0.9664, test_f1: 0.4649
 epoch: 15, train_loss: 1.0114, test_loss: 0.9782, test_f1: 0.4752
 epoch: 16, train_loss: 1.0057, test_loss: 0.9612, test_f1: 0.4684
 epoch: 17, train_loss: 0.9950, test_loss: 0.9525, test_f1: 0.4646
 epoch: 18, train_loss: 1.0017, test_loss: 0.9587, test_f1: 0.4592
 epoch: 19, train_loss: 0.9905, test_loss: 0.9617, test_f1: 0.4804
 epoch: 20, train_loss: 0.9871, test_loss: 0.9264, test_f1: 0.4881
 epoch: 21, train_loss: 0.9796, test_loss: 0.9441, test_f1: 0.4637
 epoch: 22, train_loss: 0.9805, test_loss: 0.9880, test_f1: 0.4732
 epoch: 23, train_loss: 0.9662, test_loss: 0.9568, test_f1: 0.4876
 epoch: 24, train_loss: 0.9633, test_loss: 0.9629, test_f1: 0.4745
 epoch: 25, train_loss: 0.9693, test_loss: 0.9354, test_f1: 0.4886
 epoch: 26, train_loss: 0.9548, test_loss: 0.9437, test_f1: 0.4873
 epoch: 27, train_loss: 0.9432, test_loss: 0.9629, test_f1: 0.4877
 epoch: 28, train_loss: 0.9474, test_loss: 0.9505, test_f1: 0.5069
 epoch: 29, train_loss: 0.9471, test_loss: 0.9844, test_f1: 0.4935
 epoch: 30, train_loss: 0.9413, test_loss: 0.9583, test_f1: 0.4984
 epoch: 31, train_loss: 0.9411, test_loss: 0.9535, test_f1: 0.4800
 epoch: 32, train_loss: 0.9251, test_loss: 0.9663, test_f1: 0.5031
 epoch: 33, train_loss: 0.9370, test_loss: 0.9762, test_f1: 0.4823
 epoch: 34, train_loss: 0.9496, test_loss: 0.9938, test_f1: 0.5145
 epoch: 35, train_loss: 0.9264, test_loss: 0.9510, test_f1: 0.5330
 epoch: 36, train_loss: 0.9194, test_loss: 0.9612, test_f1: 0.5234
 epoch: 37, train_loss: 0.9103, test_loss: 0.9820, test_f1: 0.5067
 epoch: 38, train_loss: 0.9264, test_loss: 0.9433, test_f1: 0.5286
 epoch: 39, train_loss: 0.9103, test_loss: 0.9541, test_f1: 0.5113
 epoch: 40, train_loss: 0.9029, test_loss: 0.9827, test_f1: 0.5169
 epoch: 41, train_loss: 0.9101, test_loss: 0.9410, test_f1: 0.5047
 epoch: 42, train_loss: 0.9012, test_loss: 0.9688, test_f1: 0.5165
 epoch: 43, train_loss: 0.9061, test_loss: 0.9588, test_f1: 0.5155
 epoch: 44, train_loss: 0.8984, test_loss: 0.9794, test_f1: 0.5000
 epoch: 45, train_loss: 0.8855, test_loss: 0.9674, test_f1: 0.5143
 epoch: 46, train_loss: 0.8986, test_loss: 0.9619, test_f1: 0.5270
 epoch: 47, train_loss: 0.8954, test_loss: 0.9550, test_f1: 0.5358
 epoch: 48, train_loss: 0.8895, test_loss: 0.9603, test_f1: 0.5087
 epoch: 49, train_loss: 0.8811, test_loss: 0.9877, test_f1: 0.4904
 epoch: 50, train_loss: 0.8821, test_loss: 0.9434, test_f1: 0.5501
 epoch: 51, train_loss: 0.8692, test_loss: 0.9750, test_f1: 0.5246
 epoch: 52, train_loss: 0.8735, test_loss: 0.9895, test_f1: 0.5239
 epoch: 53, train_loss: 0.8685, test_loss: 0.9530, test_f1: 0.5406
 epoch: 54, train_loss: 0.8700, test_loss: 0.9719, test_f1: 0.5393
 epoch: 55, train_loss: 0.8677, test_loss: 0.9751, test_f1: 0.5239
 epoch: 56, train_loss: 0.8680, test_loss: 0.9861, test_f1: 0.5608
 epoch: 57, train_loss: 0.8746, test_loss: 0.9932, test_f1: 0.5256
 epoch: 58, train_loss: 0.8544, test_loss: 0.9679, test_f1: 0.5243
 epoch: 59, train_loss: 0.8700, test_loss: 0.9604, test_f1: 0.5484
 epoch: 60, train_loss: 0.8589, test_loss: 0.9689, test_f1: 0.5385
 epoch: 61, train_loss: 0.8644, test_loss: 0.9668, test_f1: 0.5531
 epoch: 62, train_loss: 0.8537, test_loss: 0.9661, test_f1: 0.5412
 epoch: 63, train_loss: 0.8608, test_loss: 0.9802, test_f1: 0.5442
 epoch: 64, train_loss: 0.8581, test_loss: 0.9821, test_f1: 0.5473
 epoch: 65, train_loss: 0.8607, test_loss: 0.9649, test_f1: 0.5508
 epoch: 66, train_loss: 0.8589, test_loss: 0.9635, test_f1: 0.5646
 epoch: 67, train_loss: 0.8598, test_loss: 0.9705, test_f1: 0.5532
 epoch: 68, train_loss: 0.8458, test_loss: 0.9844, test_f1: 0.5563
 epoch: 69, train_loss: 0.8497, test_loss: 0.9769, test_f1: 0.5509
 epoch: 70, train_loss: 0.8441, test_loss: 0.9576, test_f1: 0.5552
 epoch: 71, train_loss: 0.8459, test_loss: 0.9601, test_f1: 0.5391
 epoch: 72, train_loss: 0.8481, test_loss: 0.9682, test_f1: 0.5587
 epoch: 73, train_loss: 0.8440, test_loss: 0.9813, test_f1: 0.5530
 epoch: 74, train_loss: 0.8422, test_loss: 0.9652, test_f1: 0.5437
 epoch: 75, train_loss: 0.8349, test_loss: 0.9889, test_f1: 0.5483
 epoch: 76, train_loss: 0.8509, test_loss: 0.9942, test_f1: 0.5366
 epoch: 77, train_loss: 0.8488, test_loss: 0.9652, test_f1: 0.5364
 epoch: 78, train_loss: 0.8457, test_loss: 0.9672, test_f1: 0.5214
 epoch: 79, train_loss: 0.8523, test_loss: 0.9767, test_f1: 0.5635
 epoch: 80, train_loss: 0.8457, test_loss: 0.9511, test_f1: 0.5359
 epoch: 81, train_loss: 0.8329, test_loss: 0.9902, test_f1: 0.5512
 epoch: 82, train_loss: 0.8540, test_loss: 0.9929, test_f1: 0.5476
 epoch: 83, train_loss: 0.8479, test_loss: 0.9725, test_f1: 0.5578
 epoch: 84, train_loss: 0.8417, test_loss: 0.9603, test_f1: 0.5391
 epoch: 85, train_loss: 0.8416, test_loss: 0.9975, test_f1: 0.5495
 epoch: 86, train_loss: 0.8284, test_loss: 0.9714, test_f1: 0.5508
 epoch: 87, train_loss: 0.8427, test_loss: 0.9811, test_f1: 0.5440
 epoch: 88, train_loss: 0.8298, test_loss: 0.9710, test_f1: 0.5451
 epoch: 89, train_loss: 0.8283, test_loss: 0.9725, test_f1: 0.5461
 epoch: 90, train_loss: 0.8371, test_loss: 0.9744, test_f1: 0.5624
 epoch: 91, train_loss: 0.8412, test_loss: 0.9963, test_f1: 0.5563
 epoch: 92, train_loss: 0.8429, test_loss: 0.9766, test_f1: 0.5341
 epoch: 93, train_loss: 0.8267, test_loss: 0.9487, test_f1: 0.5660
 epoch: 94, train_loss: 0.8302, test_loss: 0.9702, test_f1: 0.5624
 epoch: 95, train_loss: 0.8238, test_loss: 0.9726, test_f1: 0.5659
 epoch: 96, train_loss: 0.8217, test_loss: 0.9831, test_f1: 0.5645
 epoch: 97, train_loss: 0.8244, test_loss: 0.9685, test_f1: 0.5668
 epoch: 98, train_loss: 0.8304, test_loss: 0.9865, test_f1: 0.5564
 epoch: 99, train_loss: 0.8299, test_loss: 1.0066, test_f1: 0.5353
##################ITERATION #8 ****************************************
 epoch: 0, train_loss: 1.3671, test_loss: 1.3552, test_f1: 0.2270
 epoch: 1, train_loss: 1.2375, test_loss: 1.2928, test_f1: 0.2270
 epoch: 2, train_loss: 1.1972, test_loss: 1.2148, test_f1: 0.3382
 epoch: 3, train_loss: 1.1775, test_loss: 1.1398, test_f1: 0.3658
 epoch: 4, train_loss: 1.1503, test_loss: 1.0927, test_f1: 0.3996
 epoch: 5, train_loss: 1.1411, test_loss: 1.0684, test_f1: 0.4240
 epoch: 6, train_loss: 1.1062, test_loss: 1.0550, test_f1: 0.4246
 epoch: 7, train_loss: 1.1044, test_loss: 1.0518, test_f1: 0.4458
 epoch: 8, train_loss: 1.0844, test_loss: 1.0126, test_f1: 0.4332
 epoch: 9, train_loss: 1.0623, test_loss: 1.0099, test_f1: 0.4580
 epoch: 10, train_loss: 1.0467, test_loss: 1.0176, test_f1: 0.4480
 epoch: 11, train_loss: 1.0344, test_loss: 0.9906, test_f1: 0.4559
 epoch: 12, train_loss: 1.0317, test_loss: 0.9865, test_f1: 0.4709
 epoch: 13, train_loss: 1.0207, test_loss: 0.9919, test_f1: 0.4506
 epoch: 14, train_loss: 1.0123, test_loss: 0.9870, test_f1: 0.4646
 epoch: 15, train_loss: 1.0100, test_loss: 0.9973, test_f1: 0.4730
 epoch: 16, train_loss: 1.0029, test_loss: 0.9828, test_f1: 0.4734
 epoch: 17, train_loss: 1.0006, test_loss: 0.9773, test_f1: 0.4635
 epoch: 18, train_loss: 0.9917, test_loss: 0.9893, test_f1: 0.4693
 epoch: 19, train_loss: 0.9683, test_loss: 0.9920, test_f1: 0.4780
 epoch: 20, train_loss: 0.9618, test_loss: 0.9909, test_f1: 0.4808
 epoch: 21, train_loss: 0.9632, test_loss: 0.9766, test_f1: 0.4756
 epoch: 22, train_loss: 0.9661, test_loss: 0.9965, test_f1: 0.4698
 epoch: 23, train_loss: 0.9654, test_loss: 0.9716, test_f1: 0.4828
 epoch: 24, train_loss: 0.9573, test_loss: 0.9813, test_f1: 0.4759
 epoch: 25, train_loss: 0.9545, test_loss: 0.9814, test_f1: 0.4798
 epoch: 26, train_loss: 0.9551, test_loss: 0.9563, test_f1: 0.4861
 epoch: 27, train_loss: 0.9462, test_loss: 0.9780, test_f1: 0.4736
 epoch: 28, train_loss: 0.9446, test_loss: 1.0129, test_f1: 0.4827
 epoch: 29, train_loss: 0.9431, test_loss: 0.9611, test_f1: 0.4842
 epoch: 30, train_loss: 0.9536, test_loss: 0.9952, test_f1: 0.4716
 epoch: 31, train_loss: 0.9352, test_loss: 0.9586, test_f1: 0.4881
 epoch: 32, train_loss: 0.9424, test_loss: 0.9671, test_f1: 0.4888
 epoch: 33, train_loss: 0.9284, test_loss: 0.9846, test_f1: 0.4867
 epoch: 34, train_loss: 0.9276, test_loss: 0.9904, test_f1: 0.4877
 epoch: 35, train_loss: 0.9235, test_loss: 0.9990, test_f1: 0.4873
 epoch: 36, train_loss: 0.9238, test_loss: 0.9789, test_f1: 0.4918
 epoch: 37, train_loss: 0.9293, test_loss: 0.9899, test_f1: 0.4819
 epoch: 38, train_loss: 0.9208, test_loss: 0.9959, test_f1: 0.4792
 epoch: 39, train_loss: 0.9274, test_loss: 0.9853, test_f1: 0.4891
 epoch: 40, train_loss: 0.9265, test_loss: 1.0275, test_f1: 0.4863
 epoch: 41, train_loss: 0.9136, test_loss: 1.0001, test_f1: 0.4876
 epoch: 42, train_loss: 0.9079, test_loss: 0.9988, test_f1: 0.4860
 epoch: 43, train_loss: 0.9108, test_loss: 1.0094, test_f1: 0.5011
 epoch: 44, train_loss: 0.9166, test_loss: 0.9916, test_f1: 0.5019
 epoch: 45, train_loss: 0.9082, test_loss: 1.0253, test_f1: 0.4751
 epoch: 46, train_loss: 0.9063, test_loss: 1.0008, test_f1: 0.5083
 epoch: 47, train_loss: 0.9055, test_loss: 1.0082, test_f1: 0.4928
 epoch: 48, train_loss: 0.8994, test_loss: 0.9962, test_f1: 0.4990
 epoch: 49, train_loss: 0.9056, test_loss: 1.0059, test_f1: 0.5012
 epoch: 50, train_loss: 0.9044, test_loss: 0.9875, test_f1: 0.5071
 epoch: 51, train_loss: 0.8986, test_loss: 1.0061, test_f1: 0.4880
 epoch: 52, train_loss: 0.8946, test_loss: 1.0178, test_f1: 0.5009
 epoch: 53, train_loss: 0.8917, test_loss: 1.0116, test_f1: 0.5055
 epoch: 54, train_loss: 0.8961, test_loss: 1.0117, test_f1: 0.4936
 epoch: 55, train_loss: 0.8822, test_loss: 1.0048, test_f1: 0.4939
 epoch: 56, train_loss: 0.8835, test_loss: 1.0045, test_f1: 0.5039
 epoch: 57, train_loss: 0.8769, test_loss: 1.0085, test_f1: 0.5075
 epoch: 58, train_loss: 0.8803, test_loss: 1.0100, test_f1: 0.5109
 epoch: 59, train_loss: 0.8846, test_loss: 1.0267, test_f1: 0.5050
 epoch: 60, train_loss: 0.8831, test_loss: 1.0319, test_f1: 0.5019
 epoch: 61, train_loss: 0.8809, test_loss: 1.0043, test_f1: 0.5034
 epoch: 62, train_loss: 0.8791, test_loss: 0.9999, test_f1: 0.5029
 epoch: 63, train_loss: 0.8701, test_loss: 1.0221, test_f1: 0.4993
 epoch: 64, train_loss: 0.8748, test_loss: 1.0104, test_f1: 0.4919
 epoch: 65, train_loss: 0.8775, test_loss: 1.0000, test_f1: 0.5068
 epoch: 66, train_loss: 0.8832, test_loss: 1.0008, test_f1: 0.5020
 epoch: 67, train_loss: 0.8722, test_loss: 0.9921, test_f1: 0.5099
 epoch: 68, train_loss: 0.8767, test_loss: 1.0161, test_f1: 0.5000
 epoch: 69, train_loss: 0.8730, test_loss: 1.0105, test_f1: 0.5026
 epoch: 70, train_loss: 0.8628, test_loss: 1.0005, test_f1: 0.5134
 epoch: 71, train_loss: 0.8749, test_loss: 0.9934, test_f1: 0.5164
 epoch: 72, train_loss: 0.8703, test_loss: 1.0034, test_f1: 0.5153
 epoch: 73, train_loss: 0.8689, test_loss: 1.0178, test_f1: 0.5028
 epoch: 74, train_loss: 0.8665, test_loss: 1.0065, test_f1: 0.5134
 epoch: 75, train_loss: 0.8769, test_loss: 1.0044, test_f1: 0.5042
 epoch: 76, train_loss: 0.8706, test_loss: 1.0082, test_f1: 0.5255
 epoch: 77, train_loss: 0.8675, test_loss: 1.0025, test_f1: 0.5125
 epoch: 78, train_loss: 0.8646, test_loss: 0.9944, test_f1: 0.5180
 epoch: 79, train_loss: 0.8614, test_loss: 0.9979, test_f1: 0.5141
 epoch: 80, train_loss: 0.8577, test_loss: 0.9931, test_f1: 0.5083
 epoch: 81, train_loss: 0.8586, test_loss: 1.0203, test_f1: 0.5263
 epoch: 82, train_loss: 0.8651, test_loss: 1.0222, test_f1: 0.4974
 epoch: 83, train_loss: 0.8701, test_loss: 1.0153, test_f1: 0.5011
 epoch: 84, train_loss: 0.8576, test_loss: 1.0065, test_f1: 0.5135
 epoch: 85, train_loss: 0.8604, test_loss: 0.9944, test_f1: 0.5088
 epoch: 86, train_loss: 0.8666, test_loss: 1.0142, test_f1: 0.5072
 epoch: 87, train_loss: 0.8529, test_loss: 1.0107, test_f1: 0.5019
 epoch: 88, train_loss: 0.8584, test_loss: 0.9969, test_f1: 0.5083
 epoch: 89, train_loss: 0.8532, test_loss: 1.0003, test_f1: 0.5076
 epoch: 90, train_loss: 0.8585, test_loss: 1.0078, test_f1: 0.5038
 epoch: 91, train_loss: 0.8672, test_loss: 1.0048, test_f1: 0.5047
 epoch: 92, train_loss: 0.8470, test_loss: 1.0003, test_f1: 0.5011
 epoch: 93, train_loss: 0.8488, test_loss: 1.0085, test_f1: 0.5233
 epoch: 94, train_loss: 0.8526, test_loss: 1.0177, test_f1: 0.5151
 epoch: 95, train_loss: 0.8662, test_loss: 1.0024, test_f1: 0.5128
 epoch: 96, train_loss: 0.8549, test_loss: 1.0156, test_f1: 0.4989
 epoch: 97, train_loss: 0.8500, test_loss: 0.9947, test_f1: 0.5086
 epoch: 98, train_loss: 0.8607, test_loss: 1.0081, test_f1: 0.5129
 epoch: 99, train_loss: 0.8499, test_loss: 1.0202, test_f1: 0.5156
##################ITERATION #9 ****************************************
 epoch: 0, train_loss: 1.3845, test_loss: 1.3549, test_f1: 0.2270
 epoch: 1, train_loss: 1.2254, test_loss: 1.2936, test_f1: 0.2392
 epoch: 2, train_loss: 1.2032, test_loss: 1.2107, test_f1: 0.3142
 epoch: 3, train_loss: 1.1557, test_loss: 1.1516, test_f1: 0.3934
 epoch: 4, train_loss: 1.1273, test_loss: 1.1133, test_f1: 0.4066
 epoch: 5, train_loss: 1.1131, test_loss: 1.0689, test_f1: 0.4375
 epoch: 6, train_loss: 1.0945, test_loss: 1.0589, test_f1: 0.4439
 epoch: 7, train_loss: 1.0808, test_loss: 1.0575, test_f1: 0.4499
 epoch: 8, train_loss: 1.0699, test_loss: 1.0400, test_f1: 0.4556
 epoch: 9, train_loss: 1.0501, test_loss: 1.0250, test_f1: 0.4649
 epoch: 10, train_loss: 1.0425, test_loss: 1.0219, test_f1: 0.4596
 epoch: 11, train_loss: 1.0297, test_loss: 1.0201, test_f1: 0.4631
 epoch: 12, train_loss: 1.0253, test_loss: 1.0095, test_f1: 0.4663
 epoch: 13, train_loss: 1.0079, test_loss: 1.0228, test_f1: 0.4635
 epoch: 14, train_loss: 0.9987, test_loss: 1.0190, test_f1: 0.4586
 epoch: 15, train_loss: 0.9926, test_loss: 0.9962, test_f1: 0.4736
 epoch: 16, train_loss: 0.9910, test_loss: 0.9918, test_f1: 0.4650
 epoch: 17, train_loss: 0.9802, test_loss: 1.0078, test_f1: 0.4607
 epoch: 18, train_loss: 0.9927, test_loss: 1.0000, test_f1: 0.4700
 epoch: 19, train_loss: 0.9780, test_loss: 0.9953, test_f1: 0.4766
 epoch: 20, train_loss: 0.9674, test_loss: 1.0570, test_f1: 0.4673
 epoch: 21, train_loss: 0.9692, test_loss: 0.9858, test_f1: 0.4866
 epoch: 22, train_loss: 0.9456, test_loss: 1.0203, test_f1: 0.4959
 epoch: 23, train_loss: 0.9441, test_loss: 0.9859, test_f1: 0.5023
 epoch: 24, train_loss: 0.9510, test_loss: 0.9855, test_f1: 0.4961
 epoch: 25, train_loss: 0.9463, test_loss: 0.9854, test_f1: 0.5107
 epoch: 26, train_loss: 0.9327, test_loss: 0.9765, test_f1: 0.5129
 epoch: 27, train_loss: 0.9417, test_loss: 1.0005, test_f1: 0.5121
 epoch: 28, train_loss: 0.9271, test_loss: 0.9829, test_f1: 0.5192
 epoch: 29, train_loss: 0.9311, test_loss: 0.9783, test_f1: 0.5163
 epoch: 30, train_loss: 0.9234, test_loss: 0.9839, test_f1: 0.5230
 epoch: 31, train_loss: 0.9245, test_loss: 0.9788, test_f1: 0.5166
 epoch: 32, train_loss: 0.9048, test_loss: 0.9787, test_f1: 0.5135
 epoch: 33, train_loss: 0.9136, test_loss: 1.0062, test_f1: 0.5110
 epoch: 34, train_loss: 0.9027, test_loss: 0.9819, test_f1: 0.5193
 epoch: 35, train_loss: 0.9175, test_loss: 0.9747, test_f1: 0.5174
 epoch: 36, train_loss: 0.9060, test_loss: 1.0084, test_f1: 0.5100
 epoch: 37, train_loss: 0.9043, test_loss: 0.9876, test_f1: 0.5009
 epoch: 38, train_loss: 0.9029, test_loss: 0.9695, test_f1: 0.5115
 epoch: 39, train_loss: 0.8964, test_loss: 0.9760, test_f1: 0.5121
 epoch: 40, train_loss: 0.8997, test_loss: 0.9863, test_f1: 0.5194
 epoch: 41, train_loss: 0.8935, test_loss: 0.9732, test_f1: 0.5219
 epoch: 42, train_loss: 0.8988, test_loss: 0.9654, test_f1: 0.5238
 epoch: 43, train_loss: 0.8879, test_loss: 0.9812, test_f1: 0.5178
 epoch: 44, train_loss: 0.8854, test_loss: 0.9561, test_f1: 0.5250
 epoch: 45, train_loss: 0.8834, test_loss: 1.0150, test_f1: 0.4921
 epoch: 46, train_loss: 0.8911, test_loss: 0.9624, test_f1: 0.5307
 epoch: 47, train_loss: 0.8688, test_loss: 0.9674, test_f1: 0.5340
 epoch: 48, train_loss: 0.8789, test_loss: 1.1243, test_f1: 0.4995
 epoch: 49, train_loss: 0.8682, test_loss: 0.9928, test_f1: 0.5045
 epoch: 50, train_loss: 0.8699, test_loss: 0.9707, test_f1: 0.5167
 epoch: 51, train_loss: 0.8604, test_loss: 0.9829, test_f1: 0.5129
 epoch: 52, train_loss: 0.8581, test_loss: 0.9736, test_f1: 0.5201
 epoch: 53, train_loss: 0.8464, test_loss: 0.9665, test_f1: 0.5239
 epoch: 54, train_loss: 0.8674, test_loss: 0.9701, test_f1: 0.5248
 epoch: 55, train_loss: 0.8442, test_loss: 0.9845, test_f1: 0.5185
 epoch: 56, train_loss: 0.8553, test_loss: 0.9678, test_f1: 0.5219
 epoch: 57, train_loss: 0.8522, test_loss: 1.0506, test_f1: 0.5110
 epoch: 58, train_loss: 0.8506, test_loss: 0.9688, test_f1: 0.5291
 epoch: 59, train_loss: 0.8441, test_loss: 0.9878, test_f1: 0.5048
 epoch: 60, train_loss: 0.8495, test_loss: 0.9744, test_f1: 0.5117
 epoch: 61, train_loss: 0.8495, test_loss: 0.9698, test_f1: 0.5237
 epoch: 62, train_loss: 0.8411, test_loss: 1.0127, test_f1: 0.5196
 epoch: 63, train_loss: 0.8458, test_loss: 0.9764, test_f1: 0.5156
 epoch: 64, train_loss: 0.8367, test_loss: 0.9830, test_f1: 0.5184
 epoch: 65, train_loss: 0.8439, test_loss: 0.9742, test_f1: 0.5103
 epoch: 66, train_loss: 0.8430, test_loss: 0.9723, test_f1: 0.5249
 epoch: 67, train_loss: 0.8339, test_loss: 1.0197, test_f1: 0.5069
 epoch: 68, train_loss: 0.8330, test_loss: 0.9748, test_f1: 0.5231
 epoch: 69, train_loss: 0.8417, test_loss: 0.9994, test_f1: 0.5100
 epoch: 70, train_loss: 0.8323, test_loss: 1.0114, test_f1: 0.5151
 epoch: 71, train_loss: 0.8447, test_loss: 0.9731, test_f1: 0.5223
 epoch: 72, train_loss: 0.8303, test_loss: 1.0365, test_f1: 0.5106
 epoch: 73, train_loss: 0.8286, test_loss: 0.9804, test_f1: 0.5205
 epoch: 74, train_loss: 0.8385, test_loss: 0.9927, test_f1: 0.5191
 epoch: 75, train_loss: 0.8341, test_loss: 0.9748, test_f1: 0.5197
 epoch: 76, train_loss: 0.8290, test_loss: 0.9845, test_f1: 0.5141
 epoch: 77, train_loss: 0.8296, test_loss: 1.0107, test_f1: 0.5155
 epoch: 78, train_loss: 0.8322, test_loss: 1.0055, test_f1: 0.5089
 epoch: 79, train_loss: 0.8299, test_loss: 1.0116, test_f1: 0.5128
 epoch: 80, train_loss: 0.8262, test_loss: 0.9763, test_f1: 0.5204
 epoch: 81, train_loss: 0.8251, test_loss: 0.9821, test_f1: 0.5209
 epoch: 82, train_loss: 0.8345, test_loss: 1.0277, test_f1: 0.5147
 epoch: 83, train_loss: 0.8199, test_loss: 0.9728, test_f1: 0.5326
 epoch: 84, train_loss: 0.8266, test_loss: 1.0303, test_f1: 0.5135
 epoch: 85, train_loss: 0.8288, test_loss: 1.0229, test_f1: 0.5061
 epoch: 86, train_loss: 0.8152, test_loss: 1.0095, test_f1: 0.5006
 epoch: 87, train_loss: 0.8141, test_loss: 1.0268, test_f1: 0.5129
 epoch: 88, train_loss: 0.8236, test_loss: 1.0042, test_f1: 0.5183
 epoch: 89, train_loss: 0.8188, test_loss: 1.0055, test_f1: 0.5184
 epoch: 90, train_loss: 0.8192, test_loss: 1.0425, test_f1: 0.5107
 epoch: 91, train_loss: 0.8176, test_loss: 0.9842, test_f1: 0.5368
 epoch: 92, train_loss: 0.8194, test_loss: 1.0394, test_f1: 0.5053
 epoch: 93, train_loss: 0.8183, test_loss: 1.0017, test_f1: 0.5173
 epoch: 94, train_loss: 0.8180, test_loss: 0.9892, test_f1: 0.5263
 epoch: 95, train_loss: 0.8233, test_loss: 1.0285, test_f1: 0.5079
 epoch: 96, train_loss: 0.8082, test_loss: 0.9832, test_f1: 0.5285
 epoch: 97, train_loss: 0.8134, test_loss: 0.9943, test_f1: 0.5197
 epoch: 98, train_loss: 0.8042, test_loss: 1.0351, test_f1: 0.5075
 epoch: 99, train_loss: 0.8121, test_loss: 1.0350, test_f1: 0.5198

Training completed in 544.27 seconds
Best F1: 0.5711 at epoch 93
Mean F1 across iterations: 0.5536  0.0137
========================FINAL RESULTS================================
FEGIN weighted F1: 0.5711  0.0137
python main.py --data ltspice_examples --representation component_net --model FEGIN --layers 5 --hiddens 16 --batch_size 256 --lr 0.001 --emb_size 512 --epochs 100 --save_appendix component_net_L5_H16_BS256_LR0.001_E512 --no_val
-----



STDERR:
  File "main.py", line 370, in <module>
    main()
  File "main.py", line 254, in main
    dataset = dataset_class(
  File "/home/philip/projects/llm_inference_code_repo/Circuit-Completion-Using-GNNs/component_classification_with_link_prediction_head/evaluation/FEGIN/kernel/circuit_datasets.py", line 15, in __init__
    self.data, self.slices = torch.load(self.processed_paths[0])
  File "/home/philip/.local/lib/python3.8/site-packages/torch/serialization.py", line 1040, in load
    warnings.warn(
  File "/usr/lib/python3.8/warnings.py", line 109, in _showwarnmsg
    sw(msg.message, msg.category, msg.filename, msg.lineno,
  File "main.py", line 47, in warn_with_traceback
    traceback.print_stack(file=log)
/home/philip/projects/llm_inference_code_repo/Circuit-Completion-Using-GNNs/component_classification_with_link_prediction_head/evaluation/FEGIN/kernel/circuit_datasets.py:15: FutureWarning: You are using `torch.load` with `weights_only=False` (the current default value), which uses the default pickle module implicitly. It is possible to construct malicious pickle data which will execute arbitrary code during unpickling (See https://github.com/pytorch/pytorch/blob/main/SECURITY.md#untrusted-models for more details). In a future release, the default value for `weights_only` will be flipped to `True`. This limits the functions that could be executed during unpickling. Arbitrary objects will no longer be allowed to be loaded via this mode unless they are explicitly allowlisted by the user via `torch.serialization.add_safe_globals`. We recommend you start setting `weights_only=True` for any use case where you don't have full control of the loaded file. Please open an issue on GitHub for any issues related to this experimental feature.
  self.data, self.slices = torch.load(self.processed_paths[0])
