STDOUT:
Results will be saved in /home/philip/projects/ltspice_examples_code_repo/Circuit-Completion-Using-GNNs/component_classification_with_link_prediction_head/evaluation/FEGIN/results/model_FEGIN_dataset_ltspice_examples
Command line input: python main.py --data ltspice_examples --representation component_pin_net --model FEGIN --layers 3 --hiddens 128 --batch_size 32 --lr 0.0001 --emb_size 128 --epochs 100 --save_appendix component_pin_net_L3_H128_BS32_LR0.0001_E128 --no_val
 is saved.
-----
ltspice_examples - FEGIN
Using 3 layers, 128 hidden units, h = 2
Loading component_pin_net representation dataset
ENTERED
Training FEGIN on component_pin_net representation
Train: 3558, Test: 846
##################ITERATION #0 ****************************************
 epoch: 0, train_loss: 1.3111, test_loss: 1.1890, test_f1: 0.2983
 epoch: 1, train_loss: 1.1823, test_loss: 1.1295, test_f1: 0.3821
 epoch: 2, train_loss: 1.1183, test_loss: 1.0550, test_f1: 0.4535
 epoch: 3, train_loss: 1.0484, test_loss: 1.0185, test_f1: 0.4720
 epoch: 4, train_loss: 1.0053, test_loss: 1.0004, test_f1: 0.5098
 epoch: 5, train_loss: 0.9806, test_loss: 0.9531, test_f1: 0.5094
 epoch: 6, train_loss: 0.9522, test_loss: 0.9543, test_f1: 0.5224
 epoch: 7, train_loss: 0.9272, test_loss: 0.9472, test_f1: 0.5309
 epoch: 8, train_loss: 0.9257, test_loss: 0.9068, test_f1: 0.5096
 epoch: 9, train_loss: 0.9121, test_loss: 0.9255, test_f1: 0.5155
 epoch: 10, train_loss: 0.8996, test_loss: 0.8965, test_f1: 0.5199
 epoch: 11, train_loss: 0.8823, test_loss: 0.9172, test_f1: 0.5276
 epoch: 12, train_loss: 0.8786, test_loss: 0.8666, test_f1: 0.5354
 epoch: 13, train_loss: 0.8672, test_loss: 0.8635, test_f1: 0.5517
 epoch: 14, train_loss: 0.8491, test_loss: 0.8453, test_f1: 0.5520
 epoch: 15, train_loss: 0.8520, test_loss: 0.8744, test_f1: 0.5299
 epoch: 16, train_loss: 0.8413, test_loss: 0.9004, test_f1: 0.5113
 epoch: 17, train_loss: 0.8417, test_loss: 0.8341, test_f1: 0.5604
 epoch: 18, train_loss: 0.8236, test_loss: 0.8319, test_f1: 0.5473
 epoch: 19, train_loss: 0.8164, test_loss: 0.8436, test_f1: 0.5490
 epoch: 20, train_loss: 0.8172, test_loss: 0.8223, test_f1: 0.5629
 epoch: 21, train_loss: 0.8020, test_loss: 0.8224, test_f1: 0.5670
 epoch: 22, train_loss: 0.7961, test_loss: 0.8471, test_f1: 0.5445
 epoch: 23, train_loss: 0.7842, test_loss: 0.8463, test_f1: 0.5419
 epoch: 24, train_loss: 0.7813, test_loss: 0.8075, test_f1: 0.5418
 epoch: 25, train_loss: 0.7763, test_loss: 0.7869, test_f1: 0.5728
 epoch: 26, train_loss: 0.7713, test_loss: 0.8021, test_f1: 0.5855
 epoch: 27, train_loss: 0.7596, test_loss: 0.8048, test_f1: 0.5768
 epoch: 28, train_loss: 0.7629, test_loss: 0.8430, test_f1: 0.5818
 epoch: 29, train_loss: 0.7559, test_loss: 0.8227, test_f1: 0.6024
 epoch: 30, train_loss: 0.7422, test_loss: 0.7634, test_f1: 0.6125
 epoch: 31, train_loss: 0.7390, test_loss: 0.8259, test_f1: 0.5512
 epoch: 32, train_loss: 0.7308, test_loss: 0.8204, test_f1: 0.5939
 epoch: 33, train_loss: 0.7247, test_loss: 0.7703, test_f1: 0.5892
 epoch: 34, train_loss: 0.7216, test_loss: 0.8270, test_f1: 0.5861
 epoch: 35, train_loss: 0.7210, test_loss: 0.8097, test_f1: 0.5985
 epoch: 36, train_loss: 0.7119, test_loss: 0.8227, test_f1: 0.6223
 epoch: 37, train_loss: 0.7009, test_loss: 0.8163, test_f1: 0.5980
 epoch: 38, train_loss: 0.7067, test_loss: 0.8642, test_f1: 0.5911
 epoch: 39, train_loss: 0.6835, test_loss: 0.8345, test_f1: 0.5857
 epoch: 40, train_loss: 0.6924, test_loss: 0.8256, test_f1: 0.5837
 epoch: 41, train_loss: 0.6769, test_loss: 0.8054, test_f1: 0.6125
 epoch: 42, train_loss: 0.6779, test_loss: 0.8178, test_f1: 0.6065
 epoch: 43, train_loss: 0.6770, test_loss: 0.8131, test_f1: 0.6237
 epoch: 44, train_loss: 0.6697, test_loss: 0.8525, test_f1: 0.5848
 epoch: 45, train_loss: 0.6633, test_loss: 0.8925, test_f1: 0.6069
 epoch: 46, train_loss: 0.6519, test_loss: 0.8566, test_f1: 0.5712
 epoch: 47, train_loss: 0.6602, test_loss: 0.8527, test_f1: 0.5997
 epoch: 48, train_loss: 0.6484, test_loss: 0.8031, test_f1: 0.6087
 epoch: 49, train_loss: 0.6468, test_loss: 0.8193, test_f1: 0.6015
 epoch: 50, train_loss: 0.6303, test_loss: 0.8433, test_f1: 0.6316
 epoch: 51, train_loss: 0.6181, test_loss: 0.7999, test_f1: 0.6198
 epoch: 52, train_loss: 0.6175, test_loss: 0.8042, test_f1: 0.6535
 epoch: 53, train_loss: 0.6088, test_loss: 0.8035, test_f1: 0.6489
 epoch: 54, train_loss: 0.6000, test_loss: 0.8281, test_f1: 0.6430
 epoch: 55, train_loss: 0.6027, test_loss: 0.8151, test_f1: 0.6515
 epoch: 56, train_loss: 0.6098, test_loss: 0.8322, test_f1: 0.6339
 epoch: 57, train_loss: 0.5980, test_loss: 0.8375, test_f1: 0.6574
 epoch: 58, train_loss: 0.5979, test_loss: 0.8400, test_f1: 0.6246
 epoch: 59, train_loss: 0.5870, test_loss: 0.8673, test_f1: 0.6226
 epoch: 60, train_loss: 0.5812, test_loss: 0.8517, test_f1: 0.6313
 epoch: 61, train_loss: 0.5840, test_loss: 0.8738, test_f1: 0.6356
 epoch: 62, train_loss: 0.5873, test_loss: 0.8568, test_f1: 0.6447
 epoch: 63, train_loss: 0.5847, test_loss: 0.8475, test_f1: 0.6292
 epoch: 64, train_loss: 0.5720, test_loss: 0.8867, test_f1: 0.6316
 epoch: 65, train_loss: 0.5823, test_loss: 0.8526, test_f1: 0.6411
 epoch: 66, train_loss: 0.5723, test_loss: 0.8631, test_f1: 0.6582
 epoch: 67, train_loss: 0.5730, test_loss: 0.8558, test_f1: 0.6385
 epoch: 68, train_loss: 0.5684, test_loss: 0.8609, test_f1: 0.6453
 epoch: 69, train_loss: 0.5609, test_loss: 0.9186, test_f1: 0.6253
 epoch: 70, train_loss: 0.5745, test_loss: 0.8442, test_f1: 0.6519
 epoch: 71, train_loss: 0.5540, test_loss: 0.8784, test_f1: 0.6424
 epoch: 72, train_loss: 0.5590, test_loss: 0.8627, test_f1: 0.6518
 epoch: 73, train_loss: 0.5585, test_loss: 0.8506, test_f1: 0.6488
 epoch: 74, train_loss: 0.5528, test_loss: 0.8687, test_f1: 0.6543
 epoch: 75, train_loss: 0.5484, test_loss: 0.9150, test_f1: 0.6367
 epoch: 76, train_loss: 0.5444, test_loss: 0.8984, test_f1: 0.6530
 epoch: 77, train_loss: 0.5457, test_loss: 0.8846, test_f1: 0.6495
 epoch: 78, train_loss: 0.5372, test_loss: 0.8913, test_f1: 0.6451
 epoch: 79, train_loss: 0.5358, test_loss: 0.8592, test_f1: 0.6510
 epoch: 80, train_loss: 0.5450, test_loss: 0.8718, test_f1: 0.6413
 epoch: 81, train_loss: 0.5468, test_loss: 0.8286, test_f1: 0.6558
 epoch: 82, train_loss: 0.5321, test_loss: 0.9234, test_f1: 0.6534
 epoch: 83, train_loss: 0.5236, test_loss: 0.9464, test_f1: 0.6451
 epoch: 84, train_loss: 0.5265, test_loss: 0.9016, test_f1: 0.6549
 epoch: 85, train_loss: 0.5250, test_loss: 0.8702, test_f1: 0.6328
 epoch: 86, train_loss: 0.5363, test_loss: 0.9305, test_f1: 0.6449
 epoch: 87, train_loss: 0.5320, test_loss: 0.9028, test_f1: 0.6598
 epoch: 88, train_loss: 0.5225, test_loss: 0.9307, test_f1: 0.6517
 epoch: 89, train_loss: 0.5059, test_loss: 0.9397, test_f1: 0.6484
 epoch: 90, train_loss: 0.5207, test_loss: 0.9628, test_f1: 0.6434
 epoch: 91, train_loss: 0.4980, test_loss: 0.9330, test_f1: 0.6541
 epoch: 92, train_loss: 0.4915, test_loss: 0.9441, test_f1: 0.6517
 epoch: 93, train_loss: 0.5071, test_loss: 0.9389, test_f1: 0.6538
 epoch: 94, train_loss: 0.5110, test_loss: 0.9777, test_f1: 0.6378
 epoch: 95, train_loss: 0.5071, test_loss: 0.9865, test_f1: 0.6435
 epoch: 96, train_loss: 0.5087, test_loss: 0.9874, test_f1: 0.6395
 epoch: 97, train_loss: 0.4983, test_loss: 1.0051, test_f1: 0.6372
 epoch: 98, train_loss: 0.4956, test_loss: 0.9735, test_f1: 0.6371
 epoch: 99, train_loss: 0.4859, test_loss: 0.9597, test_f1: 0.6479
##################ITERATION #1 ****************************************
 epoch: 0, train_loss: 1.2077, test_loss: 1.0495, test_f1: 0.4101
 epoch: 1, train_loss: 1.0403, test_loss: 0.9908, test_f1: 0.4911
 epoch: 2, train_loss: 0.9866, test_loss: 0.9516, test_f1: 0.5105
 epoch: 3, train_loss: 0.9606, test_loss: 0.9389, test_f1: 0.5374
 epoch: 4, train_loss: 0.9382, test_loss: 0.9213, test_f1: 0.5194
 epoch: 5, train_loss: 0.9233, test_loss: 0.9022, test_f1: 0.5339
 epoch: 6, train_loss: 0.9043, test_loss: 0.9236, test_f1: 0.5378
 epoch: 7, train_loss: 0.8953, test_loss: 0.8957, test_f1: 0.5593
 epoch: 8, train_loss: 0.8646, test_loss: 0.8402, test_f1: 0.5694
 epoch: 9, train_loss: 0.8617, test_loss: 0.8417, test_f1: 0.5774
 epoch: 10, train_loss: 0.8381, test_loss: 0.8435, test_f1: 0.5593
 epoch: 11, train_loss: 0.8310, test_loss: 0.8256, test_f1: 0.5698
 epoch: 12, train_loss: 0.8277, test_loss: 0.8107, test_f1: 0.5866
 epoch: 13, train_loss: 0.8188, test_loss: 0.8069, test_f1: 0.5744
 epoch: 14, train_loss: 0.8033, test_loss: 0.8198, test_f1: 0.5540
 epoch: 15, train_loss: 0.8031, test_loss: 0.7969, test_f1: 0.5903
 epoch: 16, train_loss: 0.7872, test_loss: 0.7824, test_f1: 0.5949
 epoch: 17, train_loss: 0.7782, test_loss: 0.7647, test_f1: 0.6009
 epoch: 18, train_loss: 0.7707, test_loss: 0.7870, test_f1: 0.6030
 epoch: 19, train_loss: 0.7570, test_loss: 0.8158, test_f1: 0.6275
 epoch: 20, train_loss: 0.7542, test_loss: 0.7730, test_f1: 0.5925
 epoch: 21, train_loss: 0.7385, test_loss: 0.7563, test_f1: 0.6062
 epoch: 22, train_loss: 0.7304, test_loss: 0.7985, test_f1: 0.5891
 epoch: 23, train_loss: 0.7300, test_loss: 0.7250, test_f1: 0.6487
 epoch: 24, train_loss: 0.7206, test_loss: 0.7586, test_f1: 0.6338
 epoch: 25, train_loss: 0.7015, test_loss: 0.7880, test_f1: 0.6038
 epoch: 26, train_loss: 0.7059, test_loss: 0.7701, test_f1: 0.6102
 epoch: 27, train_loss: 0.6906, test_loss: 0.7772, test_f1: 0.5927
 epoch: 28, train_loss: 0.6937, test_loss: 0.8019, test_f1: 0.6007
 epoch: 29, train_loss: 0.6741, test_loss: 0.7372, test_f1: 0.6554
 epoch: 30, train_loss: 0.6720, test_loss: 0.7693, test_f1: 0.6331
 epoch: 31, train_loss: 0.6621, test_loss: 0.7500, test_f1: 0.6028
 epoch: 32, train_loss: 0.6682, test_loss: 0.7560, test_f1: 0.6360
 epoch: 33, train_loss: 0.6560, test_loss: 0.7485, test_f1: 0.6290
 epoch: 34, train_loss: 0.6541, test_loss: 0.7536, test_f1: 0.6330
 epoch: 35, train_loss: 0.6344, test_loss: 0.7940, test_f1: 0.6677
 epoch: 36, train_loss: 0.6306, test_loss: 0.7653, test_f1: 0.6282
 epoch: 37, train_loss: 0.6177, test_loss: 0.7877, test_f1: 0.6287
 epoch: 38, train_loss: 0.6279, test_loss: 0.7914, test_f1: 0.6507
 epoch: 39, train_loss: 0.6180, test_loss: 0.8089, test_f1: 0.6348
 epoch: 40, train_loss: 0.6030, test_loss: 0.7964, test_f1: 0.6235
 epoch: 41, train_loss: 0.6019, test_loss: 0.7868, test_f1: 0.6578
 epoch: 42, train_loss: 0.6046, test_loss: 0.7973, test_f1: 0.6278
 epoch: 43, train_loss: 0.5978, test_loss: 0.8184, test_f1: 0.6531
 epoch: 44, train_loss: 0.5823, test_loss: 0.7920, test_f1: 0.6516
 epoch: 45, train_loss: 0.5852, test_loss: 0.8257, test_f1: 0.6344
 epoch: 46, train_loss: 0.6056, test_loss: 0.8160, test_f1: 0.6391
 epoch: 47, train_loss: 0.5738, test_loss: 0.7945, test_f1: 0.6265
 epoch: 48, train_loss: 0.5689, test_loss: 0.7904, test_f1: 0.6278
 epoch: 49, train_loss: 0.5659, test_loss: 0.8268, test_f1: 0.6340
 epoch: 50, train_loss: 0.5560, test_loss: 0.8628, test_f1: 0.6522
 epoch: 51, train_loss: 0.5427, test_loss: 0.8321, test_f1: 0.6607
 epoch: 52, train_loss: 0.5368, test_loss: 0.8246, test_f1: 0.6659
 epoch: 53, train_loss: 0.5210, test_loss: 0.8518, test_f1: 0.6413
 epoch: 54, train_loss: 0.5313, test_loss: 0.8726, test_f1: 0.6503
 epoch: 55, train_loss: 0.5101, test_loss: 0.8342, test_f1: 0.6562
 epoch: 56, train_loss: 0.5054, test_loss: 0.8577, test_f1: 0.6570
 epoch: 57, train_loss: 0.5175, test_loss: 0.8261, test_f1: 0.6601
 epoch: 58, train_loss: 0.5096, test_loss: 0.8471, test_f1: 0.6441
 epoch: 59, train_loss: 0.5044, test_loss: 0.8716, test_f1: 0.6542
 epoch: 60, train_loss: 0.5015, test_loss: 0.8840, test_f1: 0.6593
 epoch: 61, train_loss: 0.5010, test_loss: 0.8697, test_f1: 0.6386
 epoch: 62, train_loss: 0.4989, test_loss: 0.8697, test_f1: 0.6497
 epoch: 63, train_loss: 0.4956, test_loss: 0.9234, test_f1: 0.6443
 epoch: 64, train_loss: 0.4936, test_loss: 0.8781, test_f1: 0.6424
 epoch: 65, train_loss: 0.4919, test_loss: 0.8730, test_f1: 0.6382
 epoch: 66, train_loss: 0.4933, test_loss: 0.8811, test_f1: 0.6556
 epoch: 67, train_loss: 0.4856, test_loss: 0.8714, test_f1: 0.6434
 epoch: 68, train_loss: 0.4704, test_loss: 0.9020, test_f1: 0.6619
 epoch: 69, train_loss: 0.4727, test_loss: 0.8969, test_f1: 0.6576
 epoch: 70, train_loss: 0.4839, test_loss: 0.9244, test_f1: 0.6364
 epoch: 71, train_loss: 0.4829, test_loss: 0.9087, test_f1: 0.6578
 epoch: 72, train_loss: 0.4773, test_loss: 0.9104, test_f1: 0.6315
 epoch: 73, train_loss: 0.4702, test_loss: 0.9123, test_f1: 0.6526
 epoch: 74, train_loss: 0.4629, test_loss: 0.9217, test_f1: 0.6829
 epoch: 75, train_loss: 0.4574, test_loss: 0.9434, test_f1: 0.6450
 epoch: 76, train_loss: 0.4672, test_loss: 0.9489, test_f1: 0.6382
 epoch: 77, train_loss: 0.4600, test_loss: 0.9603, test_f1: 0.6491
 epoch: 78, train_loss: 0.4474, test_loss: 0.9196, test_f1: 0.6434
 epoch: 79, train_loss: 0.4506, test_loss: 0.9771, test_f1: 0.6430
 epoch: 80, train_loss: 0.4536, test_loss: 0.9656, test_f1: 0.6403
 epoch: 81, train_loss: 0.4356, test_loss: 0.9869, test_f1: 0.6494
 epoch: 82, train_loss: 0.4436, test_loss: 0.9641, test_f1: 0.6594
 epoch: 83, train_loss: 0.4414, test_loss: 0.9744, test_f1: 0.6313
 epoch: 84, train_loss: 0.4401, test_loss: 0.9936, test_f1: 0.6422
 epoch: 85, train_loss: 0.4306, test_loss: 1.0255, test_f1: 0.6321
 epoch: 86, train_loss: 0.4322, test_loss: 1.0123, test_f1: 0.6531
 epoch: 87, train_loss: 0.4306, test_loss: 0.9770, test_f1: 0.6516
 epoch: 88, train_loss: 0.4366, test_loss: 1.0463, test_f1: 0.6387
 epoch: 89, train_loss: 0.4202, test_loss: 1.0633, test_f1: 0.6460
 epoch: 90, train_loss: 0.4280, test_loss: 0.9885, test_f1: 0.6546
 epoch: 91, train_loss: 0.4329, test_loss: 1.0294, test_f1: 0.6576
 epoch: 92, train_loss: 0.4169, test_loss: 1.0048, test_f1: 0.6362
 epoch: 93, train_loss: 0.4212, test_loss: 1.0531, test_f1: 0.6573
 epoch: 94, train_loss: 0.4210, test_loss: 1.0471, test_f1: 0.6447
 epoch: 95, train_loss: 0.4164, test_loss: 1.0252, test_f1: 0.6395
 epoch: 96, train_loss: 0.4383, test_loss: 1.0340, test_f1: 0.6611
 epoch: 97, train_loss: 0.4095, test_loss: 1.0734, test_f1: 0.6364
 epoch: 98, train_loss: 0.4020, test_loss: 1.0354, test_f1: 0.6499
 epoch: 99, train_loss: 0.4104, test_loss: 1.0518, test_f1: 0.6568
##################ITERATION #2 ****************************************
 epoch: 0, train_loss: 1.1473, test_loss: 1.0232, test_f1: 0.4860
 epoch: 1, train_loss: 1.0144, test_loss: 0.9834, test_f1: 0.4889
 epoch: 2, train_loss: 0.9656, test_loss: 0.9605, test_f1: 0.5255
 epoch: 3, train_loss: 0.9511, test_loss: 0.9235, test_f1: 0.5377
 epoch: 4, train_loss: 0.9376, test_loss: 0.9034, test_f1: 0.5413
 epoch: 5, train_loss: 0.9258, test_loss: 0.8766, test_f1: 0.5333
 epoch: 6, train_loss: 0.9067, test_loss: 0.8697, test_f1: 0.5408
 epoch: 7, train_loss: 0.8921, test_loss: 0.8473, test_f1: 0.5449
 epoch: 8, train_loss: 0.8703, test_loss: 0.8462, test_f1: 0.5468
 epoch: 9, train_loss: 0.8587, test_loss: 0.8381, test_f1: 0.5546
 epoch: 10, train_loss: 0.8500, test_loss: 0.8183, test_f1: 0.5636
 epoch: 11, train_loss: 0.8414, test_loss: 0.7848, test_f1: 0.5809
 epoch: 12, train_loss: 0.8191, test_loss: 0.7892, test_f1: 0.6004
 epoch: 13, train_loss: 0.8144, test_loss: 0.7789, test_f1: 0.6314
 epoch: 14, train_loss: 0.8180, test_loss: 0.7736, test_f1: 0.6063
 epoch: 15, train_loss: 0.7933, test_loss: 0.7816, test_f1: 0.6244
 epoch: 16, train_loss: 0.7818, test_loss: 0.7557, test_f1: 0.6240
 epoch: 17, train_loss: 0.7742, test_loss: 0.7487, test_f1: 0.6094
 epoch: 18, train_loss: 0.7722, test_loss: 0.7572, test_f1: 0.6240
 epoch: 19, train_loss: 0.7596, test_loss: 0.7549, test_f1: 0.6522
 epoch: 20, train_loss: 0.7599, test_loss: 0.7711, test_f1: 0.5979
 epoch: 21, train_loss: 0.7488, test_loss: 0.7861, test_f1: 0.5928
 epoch: 22, train_loss: 0.7241, test_loss: 0.7533, test_f1: 0.6122
 epoch: 23, train_loss: 0.7206, test_loss: 0.7172, test_f1: 0.6585
 epoch: 24, train_loss: 0.7130, test_loss: 0.7372, test_f1: 0.6779
 epoch: 25, train_loss: 0.7005, test_loss: 0.7264, test_f1: 0.6454
 epoch: 26, train_loss: 0.6999, test_loss: 0.7385, test_f1: 0.6728
 epoch: 27, train_loss: 0.7018, test_loss: 0.7354, test_f1: 0.6576
 epoch: 28, train_loss: 0.6885, test_loss: 0.7142, test_f1: 0.6634
 epoch: 29, train_loss: 0.6734, test_loss: 0.7609, test_f1: 0.6368
 epoch: 30, train_loss: 0.6587, test_loss: 0.7265, test_f1: 0.6446
 epoch: 31, train_loss: 0.6579, test_loss: 0.7077, test_f1: 0.6393
 epoch: 32, train_loss: 0.6570, test_loss: 0.7387, test_f1: 0.6292
 epoch: 33, train_loss: 0.6529, test_loss: 0.7220, test_f1: 0.6437
 epoch: 34, train_loss: 0.6331, test_loss: 0.7751, test_f1: 0.6569
 epoch: 35, train_loss: 0.6400, test_loss: 0.7283, test_f1: 0.6642
 epoch: 36, train_loss: 0.6319, test_loss: 0.7335, test_f1: 0.6760
 epoch: 37, train_loss: 0.6302, test_loss: 0.7434, test_f1: 0.6548
 epoch: 38, train_loss: 0.6291, test_loss: 0.7632, test_f1: 0.6568
 epoch: 39, train_loss: 0.6197, test_loss: 0.7781, test_f1: 0.6680
 epoch: 40, train_loss: 0.6052, test_loss: 0.7681, test_f1: 0.6583
 epoch: 41, train_loss: 0.5861, test_loss: 0.8087, test_f1: 0.6462
 epoch: 42, train_loss: 0.5975, test_loss: 0.7463, test_f1: 0.6515
 epoch: 43, train_loss: 0.6070, test_loss: 0.8307, test_f1: 0.6388
 epoch: 44, train_loss: 0.5849, test_loss: 0.7313, test_f1: 0.6374
 epoch: 45, train_loss: 0.5870, test_loss: 0.7953, test_f1: 0.6359
 epoch: 46, train_loss: 0.5804, test_loss: 0.7360, test_f1: 0.6422
 epoch: 47, train_loss: 0.5734, test_loss: 0.7475, test_f1: 0.6405
 epoch: 48, train_loss: 0.5713, test_loss: 0.7668, test_f1: 0.6314
 epoch: 49, train_loss: 0.5680, test_loss: 0.8169, test_f1: 0.6271
 epoch: 50, train_loss: 0.5560, test_loss: 0.7522, test_f1: 0.6356
 epoch: 51, train_loss: 0.5334, test_loss: 0.7942, test_f1: 0.6384
 epoch: 52, train_loss: 0.5375, test_loss: 0.8273, test_f1: 0.6343
 epoch: 53, train_loss: 0.5249, test_loss: 0.8243, test_f1: 0.6403
 epoch: 54, train_loss: 0.5215, test_loss: 0.7968, test_f1: 0.6334
 epoch: 55, train_loss: 0.5015, test_loss: 0.7817, test_f1: 0.6525
 epoch: 56, train_loss: 0.5193, test_loss: 0.7937, test_f1: 0.6518
 epoch: 57, train_loss: 0.5158, test_loss: 0.8243, test_f1: 0.6366
 epoch: 58, train_loss: 0.4951, test_loss: 0.8424, test_f1: 0.6427
 epoch: 59, train_loss: 0.5046, test_loss: 0.8213, test_f1: 0.6371
 epoch: 60, train_loss: 0.4972, test_loss: 0.8313, test_f1: 0.6473
 epoch: 61, train_loss: 0.4936, test_loss: 0.8268, test_f1: 0.6332
 epoch: 62, train_loss: 0.4904, test_loss: 0.8199, test_f1: 0.6581
 epoch: 63, train_loss: 0.4984, test_loss: 0.9072, test_f1: 0.6437
 epoch: 64, train_loss: 0.4932, test_loss: 0.9053, test_f1: 0.6325
 epoch: 65, train_loss: 0.4982, test_loss: 0.8248, test_f1: 0.6437
 epoch: 66, train_loss: 0.4845, test_loss: 0.8498, test_f1: 0.6373
 epoch: 67, train_loss: 0.4831, test_loss: 0.8235, test_f1: 0.6512
 epoch: 68, train_loss: 0.4786, test_loss: 0.8724, test_f1: 0.6352
 epoch: 69, train_loss: 0.4787, test_loss: 0.8689, test_f1: 0.6445
 epoch: 70, train_loss: 0.4722, test_loss: 0.8290, test_f1: 0.6648
 epoch: 71, train_loss: 0.4724, test_loss: 0.8473, test_f1: 0.6613
 epoch: 72, train_loss: 0.4616, test_loss: 0.8563, test_f1: 0.6424
 epoch: 73, train_loss: 0.4703, test_loss: 0.9164, test_f1: 0.6231
 epoch: 74, train_loss: 0.4579, test_loss: 0.9411, test_f1: 0.6353
 epoch: 75, train_loss: 0.4601, test_loss: 0.9892, test_f1: 0.6323
 epoch: 76, train_loss: 0.4622, test_loss: 0.9057, test_f1: 0.6479
 epoch: 77, train_loss: 0.4557, test_loss: 0.9351, test_f1: 0.6501
 epoch: 78, train_loss: 0.4613, test_loss: 0.9590, test_f1: 0.6374
 epoch: 79, train_loss: 0.4419, test_loss: 1.0081, test_f1: 0.6389
 epoch: 80, train_loss: 0.4436, test_loss: 0.9967, test_f1: 0.6406
 epoch: 81, train_loss: 0.4498, test_loss: 0.9349, test_f1: 0.6509
 epoch: 82, train_loss: 0.4290, test_loss: 0.9482, test_f1: 0.6534
 epoch: 83, train_loss: 0.4372, test_loss: 0.9909, test_f1: 0.6484
 epoch: 84, train_loss: 0.4388, test_loss: 1.0524, test_f1: 0.6497
 epoch: 85, train_loss: 0.4280, test_loss: 1.0259, test_f1: 0.6538
 epoch: 86, train_loss: 0.4454, test_loss: 0.9394, test_f1: 0.6475
 epoch: 87, train_loss: 0.4262, test_loss: 0.9488, test_f1: 0.6473
 epoch: 88, train_loss: 0.4214, test_loss: 1.0170, test_f1: 0.6491
 epoch: 89, train_loss: 0.4111, test_loss: 0.9443, test_f1: 0.6577
 epoch: 90, train_loss: 0.4253, test_loss: 0.9688, test_f1: 0.6532
 epoch: 91, train_loss: 0.4128, test_loss: 1.0794, test_f1: 0.6273
 epoch: 92, train_loss: 0.4476, test_loss: 1.1027, test_f1: 0.6377
 epoch: 93, train_loss: 0.4255, test_loss: 1.0550, test_f1: 0.6555
 epoch: 94, train_loss: 0.4124, test_loss: 1.0576, test_f1: 0.6142
 epoch: 95, train_loss: 0.4110, test_loss: 1.1105, test_f1: 0.6371
 epoch: 96, train_loss: 0.4228, test_loss: 1.0965, test_f1: 0.6337
 epoch: 97, train_loss: 0.4113, test_loss: 1.0933, test_f1: 0.6566
 epoch: 98, train_loss: 0.4154, test_loss: 1.1270, test_f1: 0.6373
 epoch: 99, train_loss: 0.4129, test_loss: 1.0985, test_f1: 0.6302
##################ITERATION #3 ****************************************
 epoch: 0, train_loss: 1.1162, test_loss: 1.0064, test_f1: 0.4684
 epoch: 1, train_loss: 1.0089, test_loss: 0.9617, test_f1: 0.4838
 epoch: 2, train_loss: 0.9753, test_loss: 0.9500, test_f1: 0.5049
 epoch: 3, train_loss: 0.9527, test_loss: 0.9328, test_f1: 0.5029
 epoch: 4, train_loss: 0.9413, test_loss: 0.9231, test_f1: 0.4919
 epoch: 5, train_loss: 0.9298, test_loss: 0.9311, test_f1: 0.5201
 epoch: 6, train_loss: 0.9127, test_loss: 0.9074, test_f1: 0.5368
 epoch: 7, train_loss: 0.8955, test_loss: 0.9076, test_f1: 0.5389
 epoch: 8, train_loss: 0.8786, test_loss: 0.8760, test_f1: 0.5214
 epoch: 9, train_loss: 0.8632, test_loss: 0.8793, test_f1: 0.5311
 epoch: 10, train_loss: 0.8475, test_loss: 0.8682, test_f1: 0.5817
 epoch: 11, train_loss: 0.8441, test_loss: 0.8398, test_f1: 0.5341
 epoch: 12, train_loss: 0.8327, test_loss: 0.8289, test_f1: 0.5566
 epoch: 13, train_loss: 0.8179, test_loss: 0.8227, test_f1: 0.5759
 epoch: 14, train_loss: 0.8141, test_loss: 0.8330, test_f1: 0.5868
 epoch: 15, train_loss: 0.7958, test_loss: 0.7959, test_f1: 0.5952
 epoch: 16, train_loss: 0.7863, test_loss: 0.7847, test_f1: 0.6093
 epoch: 17, train_loss: 0.7878, test_loss: 0.8038, test_f1: 0.5606
 epoch: 18, train_loss: 0.7733, test_loss: 0.7914, test_f1: 0.6001
 epoch: 19, train_loss: 0.7667, test_loss: 0.8162, test_f1: 0.5960
 epoch: 20, train_loss: 0.7633, test_loss: 0.7913, test_f1: 0.6261
 epoch: 21, train_loss: 0.7584, test_loss: 0.7877, test_f1: 0.6157
 epoch: 22, train_loss: 0.7504, test_loss: 0.7610, test_f1: 0.6077
 epoch: 23, train_loss: 0.7283, test_loss: 0.7673, test_f1: 0.6213
 epoch: 24, train_loss: 0.7231, test_loss: 0.7460, test_f1: 0.6370
 epoch: 25, train_loss: 0.7229, test_loss: 0.7682, test_f1: 0.6232
 epoch: 26, train_loss: 0.7028, test_loss: 0.7473, test_f1: 0.6491
 epoch: 27, train_loss: 0.7094, test_loss: 0.7309, test_f1: 0.6868
 epoch: 28, train_loss: 0.6999, test_loss: 0.7791, test_f1: 0.6487
 epoch: 29, train_loss: 0.6757, test_loss: 0.7520, test_f1: 0.6489
 epoch: 30, train_loss: 0.6891, test_loss: 0.7445, test_f1: 0.6551
 epoch: 31, train_loss: 0.6729, test_loss: 0.7569, test_f1: 0.6509
 epoch: 32, train_loss: 0.6642, test_loss: 0.7634, test_f1: 0.6360
 epoch: 33, train_loss: 0.6613, test_loss: 0.7715, test_f1: 0.6346
 epoch: 34, train_loss: 0.6507, test_loss: 0.7641, test_f1: 0.6292
 epoch: 35, train_loss: 0.6608, test_loss: 0.7657, test_f1: 0.6268
 epoch: 36, train_loss: 0.6478, test_loss: 0.7336, test_f1: 0.6517
 epoch: 37, train_loss: 0.6407, test_loss: 0.7392, test_f1: 0.6757
 epoch: 38, train_loss: 0.6348, test_loss: 0.7469, test_f1: 0.6326
 epoch: 39, train_loss: 0.6276, test_loss: 0.7623, test_f1: 0.6417
 epoch: 40, train_loss: 0.6195, test_loss: 0.7633, test_f1: 0.6474
 epoch: 41, train_loss: 0.6137, test_loss: 0.7564, test_f1: 0.6571
 epoch: 42, train_loss: 0.6205, test_loss: 0.7940, test_f1: 0.6758
 epoch: 43, train_loss: 0.6060, test_loss: 0.7819, test_f1: 0.6477
 epoch: 44, train_loss: 0.6081, test_loss: 0.8522, test_f1: 0.6361
 epoch: 45, train_loss: 0.5910, test_loss: 0.8077, test_f1: 0.6521
 epoch: 46, train_loss: 0.5849, test_loss: 0.7662, test_f1: 0.6568
 epoch: 47, train_loss: 0.5849, test_loss: 0.7435, test_f1: 0.6393
 epoch: 48, train_loss: 0.5686, test_loss: 0.8358, test_f1: 0.6315
 epoch: 49, train_loss: 0.5734, test_loss: 0.8130, test_f1: 0.6483
 epoch: 50, train_loss: 0.5598, test_loss: 0.8120, test_f1: 0.6234
 epoch: 51, train_loss: 0.5448, test_loss: 0.8501, test_f1: 0.6263
 epoch: 52, train_loss: 0.5282, test_loss: 0.8396, test_f1: 0.6528
 epoch: 53, train_loss: 0.5407, test_loss: 0.8450, test_f1: 0.6418
 epoch: 54, train_loss: 0.5321, test_loss: 0.8666, test_f1: 0.6712
 epoch: 55, train_loss: 0.5447, test_loss: 0.8231, test_f1: 0.6504
 epoch: 56, train_loss: 0.5309, test_loss: 0.8428, test_f1: 0.6597
 epoch: 57, train_loss: 0.5179, test_loss: 0.8107, test_f1: 0.6515
 epoch: 58, train_loss: 0.5312, test_loss: 0.8108, test_f1: 0.6481
 epoch: 59, train_loss: 0.5107, test_loss: 0.8679, test_f1: 0.6608
 epoch: 60, train_loss: 0.5091, test_loss: 0.8084, test_f1: 0.6677
 epoch: 61, train_loss: 0.5204, test_loss: 0.8553, test_f1: 0.6607
 epoch: 62, train_loss: 0.5122, test_loss: 0.8507, test_f1: 0.6340
 epoch: 63, train_loss: 0.5053, test_loss: 0.8648, test_f1: 0.6373
 epoch: 64, train_loss: 0.5014, test_loss: 0.9066, test_f1: 0.6562
 epoch: 65, train_loss: 0.4985, test_loss: 0.8903, test_f1: 0.6339
 epoch: 66, train_loss: 0.5006, test_loss: 0.8300, test_f1: 0.6454
 epoch: 67, train_loss: 0.4851, test_loss: 0.8753, test_f1: 0.6381
 epoch: 68, train_loss: 0.4901, test_loss: 0.9256, test_f1: 0.6688
 epoch: 69, train_loss: 0.4800, test_loss: 0.8928, test_f1: 0.6150
 epoch: 70, train_loss: 0.4852, test_loss: 0.8962, test_f1: 0.6466
 epoch: 71, train_loss: 0.4763, test_loss: 0.9128, test_f1: 0.6365
 epoch: 72, train_loss: 0.4785, test_loss: 0.9792, test_f1: 0.6546
 epoch: 73, train_loss: 0.4734, test_loss: 0.9511, test_f1: 0.6410
 epoch: 74, train_loss: 0.4769, test_loss: 0.9551, test_f1: 0.6360
 epoch: 75, train_loss: 0.4672, test_loss: 0.8965, test_f1: 0.6329
 epoch: 76, train_loss: 0.4660, test_loss: 0.9769, test_f1: 0.6334
 epoch: 77, train_loss: 0.4695, test_loss: 0.9668, test_f1: 0.6437
 epoch: 78, train_loss: 0.4590, test_loss: 0.9992, test_f1: 0.6549
 epoch: 79, train_loss: 0.4634, test_loss: 1.0429, test_f1: 0.6665
 epoch: 80, train_loss: 0.4481, test_loss: 0.9978, test_f1: 0.6571
 epoch: 81, train_loss: 0.4562, test_loss: 1.0057, test_f1: 0.6450
 epoch: 82, train_loss: 0.4510, test_loss: 0.9878, test_f1: 0.6634
 epoch: 83, train_loss: 0.4531, test_loss: 1.0117, test_f1: 0.6636
 epoch: 84, train_loss: 0.4390, test_loss: 0.9865, test_f1: 0.6707
 epoch: 85, train_loss: 0.4609, test_loss: 1.0569, test_f1: 0.6516
 epoch: 86, train_loss: 0.4317, test_loss: 1.0341, test_f1: 0.6681
 epoch: 87, train_loss: 0.4383, test_loss: 1.0344, test_f1: 0.6332
 epoch: 88, train_loss: 0.4383, test_loss: 1.0102, test_f1: 0.6308
 epoch: 89, train_loss: 0.4448, test_loss: 0.9968, test_f1: 0.6503
 epoch: 90, train_loss: 0.4302, test_loss: 1.0358, test_f1: 0.6482
 epoch: 91, train_loss: 0.4332, test_loss: 1.0539, test_f1: 0.6541
 epoch: 92, train_loss: 0.4187, test_loss: 1.1022, test_f1: 0.6371
 epoch: 93, train_loss: 0.4391, test_loss: 1.0782, test_f1: 0.6585
 epoch: 94, train_loss: 0.4301, test_loss: 1.0443, test_f1: 0.6292
 epoch: 95, train_loss: 0.4182, test_loss: 0.9915, test_f1: 0.6561
 epoch: 96, train_loss: 0.4165, test_loss: 1.0254, test_f1: 0.6378
 epoch: 97, train_loss: 0.4182, test_loss: 1.0698, test_f1: 0.6570
 epoch: 98, train_loss: 0.4113, test_loss: 1.1211, test_f1: 0.6599
 epoch: 99, train_loss: 0.4143, test_loss: 1.1446, test_f1: 0.6464
##################ITERATION #4 ****************************************
 epoch: 0, train_loss: 1.1320, test_loss: 0.9761, test_f1: 0.4699
 epoch: 1, train_loss: 0.9907, test_loss: 0.9575, test_f1: 0.4719
 epoch: 2, train_loss: 0.9684, test_loss: 0.9469, test_f1: 0.5101
 epoch: 3, train_loss: 0.9345, test_loss: 0.9012, test_f1: 0.4855
 epoch: 4, train_loss: 0.9264, test_loss: 0.8954, test_f1: 0.5476
 epoch: 5, train_loss: 0.9143, test_loss: 0.8779, test_f1: 0.5505
 epoch: 6, train_loss: 0.8913, test_loss: 0.8464, test_f1: 0.5589
 epoch: 7, train_loss: 0.8816, test_loss: 0.8426, test_f1: 0.5762
 epoch: 8, train_loss: 0.8607, test_loss: 0.8239, test_f1: 0.5784
 epoch: 9, train_loss: 0.8497, test_loss: 0.8204, test_f1: 0.5721
 epoch: 10, train_loss: 0.8366, test_loss: 0.8282, test_f1: 0.6077
 epoch: 11, train_loss: 0.8209, test_loss: 0.7980, test_f1: 0.5844
 epoch: 12, train_loss: 0.8186, test_loss: 0.8005, test_f1: 0.5860
 epoch: 13, train_loss: 0.7959, test_loss: 0.7898, test_f1: 0.6101
 epoch: 14, train_loss: 0.7855, test_loss: 0.8179, test_f1: 0.6370
 epoch: 15, train_loss: 0.7729, test_loss: 0.7761, test_f1: 0.6208
 epoch: 16, train_loss: 0.7773, test_loss: 0.7886, test_f1: 0.6380
 epoch: 17, train_loss: 0.7662, test_loss: 0.7618, test_f1: 0.6546
 epoch: 18, train_loss: 0.7571, test_loss: 0.7926, test_f1: 0.6254
 epoch: 19, train_loss: 0.7557, test_loss: 0.7777, test_f1: 0.6125
 epoch: 20, train_loss: 0.7356, test_loss: 0.7999, test_f1: 0.6550
 epoch: 21, train_loss: 0.7307, test_loss: 0.7762, test_f1: 0.6429
 epoch: 22, train_loss: 0.7226, test_loss: 0.7928, test_f1: 0.6446
 epoch: 23, train_loss: 0.7093, test_loss: 0.7672, test_f1: 0.6436
 epoch: 24, train_loss: 0.6996, test_loss: 0.8236, test_f1: 0.6308
 epoch: 25, train_loss: 0.7072, test_loss: 0.8020, test_f1: 0.6401
 epoch: 26, train_loss: 0.6899, test_loss: 0.7535, test_f1: 0.6457
 epoch: 27, train_loss: 0.6789, test_loss: 0.7432, test_f1: 0.6763
 epoch: 28, train_loss: 0.6665, test_loss: 0.7734, test_f1: 0.6602
 epoch: 29, train_loss: 0.6768, test_loss: 0.7742, test_f1: 0.6660
 epoch: 30, train_loss: 0.6603, test_loss: 0.8430, test_f1: 0.6353
 epoch: 31, train_loss: 0.6452, test_loss: 0.7413, test_f1: 0.6605
 epoch: 32, train_loss: 0.6637, test_loss: 0.7711, test_f1: 0.6720
 epoch: 33, train_loss: 0.6428, test_loss: 0.7679, test_f1: 0.6762
 epoch: 34, train_loss: 0.6448, test_loss: 0.7819, test_f1: 0.6527
 epoch: 35, train_loss: 0.6435, test_loss: 0.7711, test_f1: 0.6648
 epoch: 36, train_loss: 0.6214, test_loss: 0.7863, test_f1: 0.6556
 epoch: 37, train_loss: 0.6159, test_loss: 0.7127, test_f1: 0.6606
 epoch: 38, train_loss: 0.6214, test_loss: 0.7701, test_f1: 0.6543
 epoch: 39, train_loss: 0.6085, test_loss: 0.7171, test_f1: 0.6623
 epoch: 40, train_loss: 0.6010, test_loss: 0.8043, test_f1: 0.6433
 epoch: 41, train_loss: 0.5927, test_loss: 0.7739, test_f1: 0.6469
 epoch: 42, train_loss: 0.5983, test_loss: 0.7747, test_f1: 0.6404
 epoch: 43, train_loss: 0.5936, test_loss: 0.7728, test_f1: 0.6475
 epoch: 44, train_loss: 0.5655, test_loss: 0.7449, test_f1: 0.6548
 epoch: 45, train_loss: 0.5735, test_loss: 0.7497, test_f1: 0.6576
 epoch: 46, train_loss: 0.5666, test_loss: 0.7827, test_f1: 0.6601
 epoch: 47, train_loss: 0.5654, test_loss: 0.8136, test_f1: 0.6461
 epoch: 48, train_loss: 0.5646, test_loss: 0.7248, test_f1: 0.6794
 epoch: 49, train_loss: 0.5602, test_loss: 0.7911, test_f1: 0.6605
 epoch: 50, train_loss: 0.5440, test_loss: 0.7499, test_f1: 0.6536
 epoch: 51, train_loss: 0.5181, test_loss: 0.8513, test_f1: 0.6588
 epoch: 52, train_loss: 0.5187, test_loss: 0.7866, test_f1: 0.6556
 epoch: 53, train_loss: 0.5194, test_loss: 0.8553, test_f1: 0.6554
 epoch: 54, train_loss: 0.5093, test_loss: 0.8268, test_f1: 0.6609
 epoch: 55, train_loss: 0.5024, test_loss: 0.8308, test_f1: 0.6637
 epoch: 56, train_loss: 0.5015, test_loss: 0.8690, test_f1: 0.6337
 epoch: 57, train_loss: 0.5096, test_loss: 0.8195, test_f1: 0.6559
 epoch: 58, train_loss: 0.4914, test_loss: 0.8753, test_f1: 0.6648
 epoch: 59, train_loss: 0.4846, test_loss: 0.8363, test_f1: 0.6422
 epoch: 60, train_loss: 0.4940, test_loss: 0.8382, test_f1: 0.6473
 epoch: 61, train_loss: 0.4785, test_loss: 0.8398, test_f1: 0.6529
 epoch: 62, train_loss: 0.4884, test_loss: 0.8238, test_f1: 0.6631
 epoch: 63, train_loss: 0.4820, test_loss: 0.8511, test_f1: 0.6475
 epoch: 64, train_loss: 0.4849, test_loss: 0.8842, test_f1: 0.6371
 epoch: 65, train_loss: 0.4741, test_loss: 0.8959, test_f1: 0.6384
 epoch: 66, train_loss: 0.4725, test_loss: 0.8329, test_f1: 0.6343
 epoch: 67, train_loss: 0.4611, test_loss: 0.9502, test_f1: 0.6534
 epoch: 68, train_loss: 0.4584, test_loss: 0.8484, test_f1: 0.6713
 epoch: 69, train_loss: 0.4602, test_loss: 0.9330, test_f1: 0.6384
 epoch: 70, train_loss: 0.4711, test_loss: 0.8886, test_f1: 0.6424
 epoch: 71, train_loss: 0.4546, test_loss: 0.8582, test_f1: 0.6560
 epoch: 72, train_loss: 0.4683, test_loss: 0.8512, test_f1: 0.6443
 epoch: 73, train_loss: 0.4625, test_loss: 0.8653, test_f1: 0.6478
 epoch: 74, train_loss: 0.4457, test_loss: 0.9096, test_f1: 0.6461
 epoch: 75, train_loss: 0.4538, test_loss: 0.9002, test_f1: 0.6664
 epoch: 76, train_loss: 0.4473, test_loss: 0.8488, test_f1: 0.6553
 epoch: 77, train_loss: 0.4382, test_loss: 0.9197, test_f1: 0.6685
 epoch: 78, train_loss: 0.4337, test_loss: 0.9454, test_f1: 0.6529
 epoch: 79, train_loss: 0.4369, test_loss: 0.9347, test_f1: 0.6481
 epoch: 80, train_loss: 0.4308, test_loss: 0.9334, test_f1: 0.6545
 epoch: 81, train_loss: 0.4409, test_loss: 0.9328, test_f1: 0.6516
 epoch: 82, train_loss: 0.4335, test_loss: 0.9606, test_f1: 0.6424
 epoch: 83, train_loss: 0.4330, test_loss: 1.0364, test_f1: 0.6348
 epoch: 84, train_loss: 0.4338, test_loss: 1.0075, test_f1: 0.6407
 epoch: 85, train_loss: 0.4128, test_loss: 0.9970, test_f1: 0.6440
 epoch: 86, train_loss: 0.4207, test_loss: 0.9645, test_f1: 0.6652
 epoch: 87, train_loss: 0.4144, test_loss: 1.0037, test_f1: 0.6270
 epoch: 88, train_loss: 0.4074, test_loss: 0.9690, test_f1: 0.6526
 epoch: 89, train_loss: 0.4056, test_loss: 1.0119, test_f1: 0.6572
 epoch: 90, train_loss: 0.4247, test_loss: 0.9896, test_f1: 0.6551
 epoch: 91, train_loss: 0.4145, test_loss: 0.9542, test_f1: 0.6383
 epoch: 92, train_loss: 0.4011, test_loss: 1.0144, test_f1: 0.6340
 epoch: 93, train_loss: 0.4122, test_loss: 1.0336, test_f1: 0.6615
 epoch: 94, train_loss: 0.3979, test_loss: 0.9877, test_f1: 0.6518
 epoch: 95, train_loss: 0.4038, test_loss: 1.0493, test_f1: 0.6589
 epoch: 96, train_loss: 0.3962, test_loss: 1.0630, test_f1: 0.6487
 epoch: 97, train_loss: 0.3957, test_loss: 1.1167, test_f1: 0.6605
 epoch: 98, train_loss: 0.4038, test_loss: 1.0777, test_f1: 0.6644
 epoch: 99, train_loss: 0.3990, test_loss: 1.0620, test_f1: 0.6648
##################ITERATION #5 ****************************************
 epoch: 0, train_loss: 1.1371, test_loss: 0.9642, test_f1: 0.4746
 epoch: 1, train_loss: 1.0026, test_loss: 0.9246, test_f1: 0.4957
 epoch: 2, train_loss: 0.9778, test_loss: 0.8952, test_f1: 0.5411
 epoch: 3, train_loss: 0.9408, test_loss: 0.8801, test_f1: 0.5158
 epoch: 4, train_loss: 0.9185, test_loss: 0.8690, test_f1: 0.5263
 epoch: 5, train_loss: 0.8983, test_loss: 0.8603, test_f1: 0.5340
 epoch: 6, train_loss: 0.8779, test_loss: 0.8344, test_f1: 0.5576
 epoch: 7, train_loss: 0.8674, test_loss: 0.8234, test_f1: 0.5876
 epoch: 8, train_loss: 0.8544, test_loss: 0.8210, test_f1: 0.5575
 epoch: 9, train_loss: 0.8459, test_loss: 0.7829, test_f1: 0.6253
 epoch: 10, train_loss: 0.8213, test_loss: 0.7861, test_f1: 0.5967
 epoch: 11, train_loss: 0.8113, test_loss: 0.7921, test_f1: 0.5870
 epoch: 12, train_loss: 0.7966, test_loss: 0.7893, test_f1: 0.6146
 epoch: 13, train_loss: 0.7948, test_loss: 0.7659, test_f1: 0.6006
 epoch: 14, train_loss: 0.7824, test_loss: 0.7545, test_f1: 0.6071
 epoch: 15, train_loss: 0.7613, test_loss: 0.7542, test_f1: 0.6126
 epoch: 16, train_loss: 0.7609, test_loss: 0.7354, test_f1: 0.6086
 epoch: 17, train_loss: 0.7508, test_loss: 0.7536, test_f1: 0.6037
 epoch: 18, train_loss: 0.7504, test_loss: 0.7301, test_f1: 0.6249
 epoch: 19, train_loss: 0.7240, test_loss: 0.7174, test_f1: 0.6196
 epoch: 20, train_loss: 0.7241, test_loss: 0.7355, test_f1: 0.6158
 epoch: 21, train_loss: 0.7295, test_loss: 0.7236, test_f1: 0.6334
 epoch: 22, train_loss: 0.7153, test_loss: 0.7240, test_f1: 0.6560
 epoch: 23, train_loss: 0.7079, test_loss: 0.7342, test_f1: 0.6296
 epoch: 24, train_loss: 0.7009, test_loss: 0.7188, test_f1: 0.6416
 epoch: 25, train_loss: 0.6803, test_loss: 0.7315, test_f1: 0.6424
 epoch: 26, train_loss: 0.6818, test_loss: 0.7469, test_f1: 0.6498
 epoch: 27, train_loss: 0.6691, test_loss: 0.7444, test_f1: 0.6232
 epoch: 28, train_loss: 0.6638, test_loss: 0.7438, test_f1: 0.6630
 epoch: 29, train_loss: 0.6589, test_loss: 0.7244, test_f1: 0.6705
 epoch: 30, train_loss: 0.6567, test_loss: 0.7464, test_f1: 0.6613
 epoch: 31, train_loss: 0.6620, test_loss: 0.7597, test_f1: 0.6511
 epoch: 32, train_loss: 0.6492, test_loss: 0.7174, test_f1: 0.6595
 epoch: 33, train_loss: 0.6348, test_loss: 0.7020, test_f1: 0.6851
 epoch: 34, train_loss: 0.6363, test_loss: 0.7248, test_f1: 0.6623
 epoch: 35, train_loss: 0.6113, test_loss: 0.7608, test_f1: 0.6341
 epoch: 36, train_loss: 0.6198, test_loss: 0.7491, test_f1: 0.6689
 epoch: 37, train_loss: 0.6139, test_loss: 0.7339, test_f1: 0.6469
 epoch: 38, train_loss: 0.6151, test_loss: 0.7804, test_f1: 0.6559
 epoch: 39, train_loss: 0.6087, test_loss: 0.7392, test_f1: 0.6800
 epoch: 40, train_loss: 0.6025, test_loss: 0.7461, test_f1: 0.6475
 epoch: 41, train_loss: 0.5913, test_loss: 0.7431, test_f1: 0.6587
 epoch: 42, train_loss: 0.5839, test_loss: 0.8501, test_f1: 0.6473
 epoch: 43, train_loss: 0.5955, test_loss: 0.7616, test_f1: 0.6582
 epoch: 44, train_loss: 0.5723, test_loss: 0.7980, test_f1: 0.6470
 epoch: 45, train_loss: 0.5688, test_loss: 0.7803, test_f1: 0.6391
 epoch: 46, train_loss: 0.5771, test_loss: 0.7784, test_f1: 0.6332
 epoch: 47, train_loss: 0.5728, test_loss: 0.7717, test_f1: 0.6764
 epoch: 48, train_loss: 0.5600, test_loss: 0.8302, test_f1: 0.6614
 epoch: 49, train_loss: 0.5603, test_loss: 0.7889, test_f1: 0.6492
 epoch: 50, train_loss: 0.5484, test_loss: 0.8435, test_f1: 0.6439
 epoch: 51, train_loss: 0.5250, test_loss: 0.7633, test_f1: 0.6795
 epoch: 52, train_loss: 0.5379, test_loss: 0.7728, test_f1: 0.6480
 epoch: 53, train_loss: 0.5191, test_loss: 0.8167, test_f1: 0.6496
 epoch: 54, train_loss: 0.5223, test_loss: 0.8294, test_f1: 0.6472
 epoch: 55, train_loss: 0.5253, test_loss: 0.8079, test_f1: 0.6573
 epoch: 56, train_loss: 0.5106, test_loss: 0.8333, test_f1: 0.6360
 epoch: 57, train_loss: 0.5072, test_loss: 0.8089, test_f1: 0.6431
 epoch: 58, train_loss: 0.5096, test_loss: 0.8272, test_f1: 0.6516
 epoch: 59, train_loss: 0.5244, test_loss: 0.8124, test_f1: 0.6231
 epoch: 60, train_loss: 0.5106, test_loss: 0.8068, test_f1: 0.6579
 epoch: 61, train_loss: 0.5029, test_loss: 0.8143, test_f1: 0.6538
 epoch: 62, train_loss: 0.4978, test_loss: 0.7717, test_f1: 0.6323
 epoch: 63, train_loss: 0.4819, test_loss: 0.7655, test_f1: 0.6547
 epoch: 64, train_loss: 0.4946, test_loss: 0.8609, test_f1: 0.6516
 epoch: 65, train_loss: 0.4887, test_loss: 0.8718, test_f1: 0.6523
 epoch: 66, train_loss: 0.4804, test_loss: 0.8627, test_f1: 0.6536
 epoch: 67, train_loss: 0.4798, test_loss: 0.8465, test_f1: 0.6457
 epoch: 68, train_loss: 0.4940, test_loss: 0.8009, test_f1: 0.6436
 epoch: 69, train_loss: 0.4710, test_loss: 0.8405, test_f1: 0.6395
 epoch: 70, train_loss: 0.4653, test_loss: 0.8766, test_f1: 0.6353
 epoch: 71, train_loss: 0.4824, test_loss: 0.8600, test_f1: 0.6520
 epoch: 72, train_loss: 0.4757, test_loss: 0.8614, test_f1: 0.6422
 epoch: 73, train_loss: 0.4748, test_loss: 0.8945, test_f1: 0.6522
 epoch: 74, train_loss: 0.4615, test_loss: 0.9361, test_f1: 0.6407
 epoch: 75, train_loss: 0.4666, test_loss: 0.9309, test_f1: 0.6647
 epoch: 76, train_loss: 0.4728, test_loss: 0.9406, test_f1: 0.6612
 epoch: 77, train_loss: 0.4701, test_loss: 0.9190, test_f1: 0.6458
 epoch: 78, train_loss: 0.4601, test_loss: 0.8980, test_f1: 0.6646
 epoch: 79, train_loss: 0.4485, test_loss: 0.9146, test_f1: 0.6606
 epoch: 80, train_loss: 0.4552, test_loss: 0.8390, test_f1: 0.6523
 epoch: 81, train_loss: 0.4527, test_loss: 0.8777, test_f1: 0.6527
 epoch: 82, train_loss: 0.4565, test_loss: 0.9343, test_f1: 0.6551
 epoch: 83, train_loss: 0.4680, test_loss: 0.8801, test_f1: 0.6500
 epoch: 84, train_loss: 0.4436, test_loss: 0.8735, test_f1: 0.6585
 epoch: 85, train_loss: 0.4423, test_loss: 0.9218, test_f1: 0.6682
 epoch: 86, train_loss: 0.4328, test_loss: 0.9228, test_f1: 0.6624
 epoch: 87, train_loss: 0.4414, test_loss: 0.8847, test_f1: 0.6619
 epoch: 88, train_loss: 0.4317, test_loss: 0.8641, test_f1: 0.6806
 epoch: 89, train_loss: 0.4260, test_loss: 0.8945, test_f1: 0.6665
 epoch: 90, train_loss: 0.4292, test_loss: 0.9664, test_f1: 0.6533
 epoch: 91, train_loss: 0.4213, test_loss: 0.9830, test_f1: 0.6686
 epoch: 92, train_loss: 0.4259, test_loss: 0.9508, test_f1: 0.6583
 epoch: 93, train_loss: 0.4258, test_loss: 1.0117, test_f1: 0.6401
 epoch: 94, train_loss: 0.4270, test_loss: 0.9723, test_f1: 0.6330
 epoch: 95, train_loss: 0.4161, test_loss: 0.9918, test_f1: 0.6520
 epoch: 96, train_loss: 0.4072, test_loss: 1.0124, test_f1: 0.6649
 epoch: 97, train_loss: 0.4196, test_loss: 1.0134, test_f1: 0.6560
 epoch: 98, train_loss: 0.4185, test_loss: 0.9781, test_f1: 0.6608
 epoch: 99, train_loss: 0.4209, test_loss: 0.9660, test_f1: 0.6564
##################ITERATION #6 ****************************************
 epoch: 0, train_loss: 1.1884, test_loss: 0.9514, test_f1: 0.5209
 epoch: 1, train_loss: 1.0100, test_loss: 0.9338, test_f1: 0.5162
 epoch: 2, train_loss: 0.9841, test_loss: 0.9115, test_f1: 0.5467
 epoch: 3, train_loss: 0.9373, test_loss: 0.9018, test_f1: 0.5433
 epoch: 4, train_loss: 0.9264, test_loss: 0.9126, test_f1: 0.5471
 epoch: 5, train_loss: 0.9151, test_loss: 0.8827, test_f1: 0.5691
 epoch: 6, train_loss: 0.8930, test_loss: 0.8844, test_f1: 0.5730
 epoch: 7, train_loss: 0.8815, test_loss: 0.8619, test_f1: 0.5864
 epoch: 8, train_loss: 0.8813, test_loss: 0.8683, test_f1: 0.5655
 epoch: 9, train_loss: 0.8459, test_loss: 0.8515, test_f1: 0.6118
 epoch: 10, train_loss: 0.8516, test_loss: 0.8203, test_f1: 0.5976
 epoch: 11, train_loss: 0.8159, test_loss: 0.8120, test_f1: 0.5818
 epoch: 12, train_loss: 0.8111, test_loss: 0.8210, test_f1: 0.5875
 epoch: 13, train_loss: 0.8034, test_loss: 0.8279, test_f1: 0.5786
 epoch: 14, train_loss: 0.7937, test_loss: 0.8025, test_f1: 0.5963
 epoch: 15, train_loss: 0.7936, test_loss: 0.8095, test_f1: 0.6151
 epoch: 16, train_loss: 0.7782, test_loss: 0.7833, test_f1: 0.6146
 epoch: 17, train_loss: 0.7618, test_loss: 0.7807, test_f1: 0.5961
 epoch: 18, train_loss: 0.7589, test_loss: 0.8105, test_f1: 0.5831
 epoch: 19, train_loss: 0.7503, test_loss: 0.7572, test_f1: 0.6328
 epoch: 20, train_loss: 0.7347, test_loss: 0.7820, test_f1: 0.6162
 epoch: 21, train_loss: 0.7363, test_loss: 0.7807, test_f1: 0.6250
 epoch: 22, train_loss: 0.7240, test_loss: 0.7602, test_f1: 0.6208
 epoch: 23, train_loss: 0.7286, test_loss: 0.7674, test_f1: 0.6288
 epoch: 24, train_loss: 0.7149, test_loss: 0.7560, test_f1: 0.6378
 epoch: 25, train_loss: 0.6976, test_loss: 0.7799, test_f1: 0.6248
 epoch: 26, train_loss: 0.6961, test_loss: 0.7806, test_f1: 0.6296
 epoch: 27, train_loss: 0.6952, test_loss: 0.7784, test_f1: 0.6457
 epoch: 28, train_loss: 0.6721, test_loss: 0.7396, test_f1: 0.6726
 epoch: 29, train_loss: 0.6711, test_loss: 0.7834, test_f1: 0.6255
 epoch: 30, train_loss: 0.6579, test_loss: 0.7695, test_f1: 0.6235
 epoch: 31, train_loss: 0.6693, test_loss: 0.7589, test_f1: 0.6485
 epoch: 32, train_loss: 0.6594, test_loss: 0.7742, test_f1: 0.6341
 epoch: 33, train_loss: 0.6436, test_loss: 0.7831, test_f1: 0.6309
 epoch: 34, train_loss: 0.6530, test_loss: 0.8129, test_f1: 0.6150
 epoch: 35, train_loss: 0.6405, test_loss: 0.7938, test_f1: 0.6368
 epoch: 36, train_loss: 0.6294, test_loss: 0.7591, test_f1: 0.6644
 epoch: 37, train_loss: 0.6215, test_loss: 0.7738, test_f1: 0.6281
 epoch: 38, train_loss: 0.6092, test_loss: 0.8092, test_f1: 0.5978
 epoch: 39, train_loss: 0.6110, test_loss: 0.8062, test_f1: 0.6187
 epoch: 40, train_loss: 0.5979, test_loss: 0.7975, test_f1: 0.6425
 epoch: 41, train_loss: 0.6116, test_loss: 0.7973, test_f1: 0.6318
 epoch: 42, train_loss: 0.6040, test_loss: 0.7713, test_f1: 0.6373
 epoch: 43, train_loss: 0.5875, test_loss: 0.8141, test_f1: 0.6564
 epoch: 44, train_loss: 0.5933, test_loss: 0.8430, test_f1: 0.6377
 epoch: 45, train_loss: 0.5940, test_loss: 0.8031, test_f1: 0.6370
 epoch: 46, train_loss: 0.5795, test_loss: 0.8831, test_f1: 0.6252
 epoch: 47, train_loss: 0.5556, test_loss: 0.8032, test_f1: 0.6298
 epoch: 48, train_loss: 0.5713, test_loss: 0.8260, test_f1: 0.6360
 epoch: 49, train_loss: 0.5713, test_loss: 0.8410, test_f1: 0.6332
 epoch: 50, train_loss: 0.5694, test_loss: 0.8682, test_f1: 0.6375
 epoch: 51, train_loss: 0.5506, test_loss: 0.8404, test_f1: 0.6401
 epoch: 52, train_loss: 0.5257, test_loss: 0.8510, test_f1: 0.6350
 epoch: 53, train_loss: 0.5212, test_loss: 0.8389, test_f1: 0.6322
 epoch: 54, train_loss: 0.5206, test_loss: 0.8503, test_f1: 0.6470
 epoch: 55, train_loss: 0.5163, test_loss: 0.8859, test_f1: 0.6508
 epoch: 56, train_loss: 0.5117, test_loss: 0.8634, test_f1: 0.6388
 epoch: 57, train_loss: 0.5249, test_loss: 0.9271, test_f1: 0.6433
 epoch: 58, train_loss: 0.5037, test_loss: 0.8691, test_f1: 0.6584
 epoch: 59, train_loss: 0.5087, test_loss: 0.9191, test_f1: 0.6425
 epoch: 60, train_loss: 0.5034, test_loss: 0.9048, test_f1: 0.6434
 epoch: 61, train_loss: 0.4871, test_loss: 0.9451, test_f1: 0.6428
 epoch: 62, train_loss: 0.4931, test_loss: 0.9497, test_f1: 0.6446
 epoch: 63, train_loss: 0.5048, test_loss: 0.8910, test_f1: 0.6349
 epoch: 64, train_loss: 0.4972, test_loss: 0.9252, test_f1: 0.6456
 epoch: 65, train_loss: 0.4799, test_loss: 0.9755, test_f1: 0.6448
 epoch: 66, train_loss: 0.4820, test_loss: 0.9541, test_f1: 0.6487
 epoch: 67, train_loss: 0.4773, test_loss: 0.9729, test_f1: 0.6521
 epoch: 68, train_loss: 0.4881, test_loss: 0.9519, test_f1: 0.6424
 epoch: 69, train_loss: 0.4772, test_loss: 0.9420, test_f1: 0.6502
 epoch: 70, train_loss: 0.4830, test_loss: 1.0012, test_f1: 0.6288
 epoch: 71, train_loss: 0.4726, test_loss: 1.0275, test_f1: 0.6455
 epoch: 72, train_loss: 0.4754, test_loss: 1.0760, test_f1: 0.6419
 epoch: 73, train_loss: 0.4585, test_loss: 0.9777, test_f1: 0.6374
 epoch: 74, train_loss: 0.4615, test_loss: 0.9826, test_f1: 0.6499
 epoch: 75, train_loss: 0.4779, test_loss: 1.0095, test_f1: 0.6348
 epoch: 76, train_loss: 0.4567, test_loss: 1.0284, test_f1: 0.6410
 epoch: 77, train_loss: 0.4621, test_loss: 1.0286, test_f1: 0.6341
 epoch: 78, train_loss: 0.4515, test_loss: 1.0520, test_f1: 0.6435
 epoch: 79, train_loss: 0.4567, test_loss: 1.0278, test_f1: 0.6438
 epoch: 80, train_loss: 0.4471, test_loss: 1.0314, test_f1: 0.6411
 epoch: 81, train_loss: 0.4363, test_loss: 1.0283, test_f1: 0.6389
 epoch: 82, train_loss: 0.4421, test_loss: 1.0844, test_f1: 0.6430
 epoch: 83, train_loss: 0.4371, test_loss: 1.0627, test_f1: 0.6492
 epoch: 84, train_loss: 0.4414, test_loss: 1.0861, test_f1: 0.6449
 epoch: 85, train_loss: 0.4510, test_loss: 1.0911, test_f1: 0.6505
 epoch: 86, train_loss: 0.4292, test_loss: 1.1090, test_f1: 0.6430
 epoch: 87, train_loss: 0.4278, test_loss: 1.1208, test_f1: 0.6351
 epoch: 88, train_loss: 0.4261, test_loss: 1.1121, test_f1: 0.6362
 epoch: 89, train_loss: 0.4179, test_loss: 1.1184, test_f1: 0.6458
 epoch: 90, train_loss: 0.4148, test_loss: 1.1153, test_f1: 0.6493
 epoch: 91, train_loss: 0.4250, test_loss: 1.1631, test_f1: 0.6419
 epoch: 92, train_loss: 0.4268, test_loss: 1.1573, test_f1: 0.6281
 epoch: 93, train_loss: 0.4252, test_loss: 1.2069, test_f1: 0.6463
 epoch: 94, train_loss: 0.4187, test_loss: 1.1775, test_f1: 0.6347
 epoch: 95, train_loss: 0.4165, test_loss: 1.1663, test_f1: 0.6411
 epoch: 96, train_loss: 0.4144, test_loss: 1.1437, test_f1: 0.6499
 epoch: 97, train_loss: 0.4028, test_loss: 1.1563, test_f1: 0.6333
 epoch: 98, train_loss: 0.4054, test_loss: 1.1940, test_f1: 0.6518
 epoch: 99, train_loss: 0.4120, test_loss: 1.2222, test_f1: 0.6486
##################ITERATION #7 ****************************************
 epoch: 0, train_loss: 1.2142, test_loss: 0.9714, test_f1: 0.5482
 epoch: 1, train_loss: 1.0291, test_loss: 0.9332, test_f1: 0.4930
 epoch: 2, train_loss: 0.9889, test_loss: 0.9593, test_f1: 0.5257
 epoch: 3, train_loss: 0.9557, test_loss: 0.9220, test_f1: 0.5390
 epoch: 4, train_loss: 0.9313, test_loss: 0.9140, test_f1: 0.5495
 epoch: 5, train_loss: 0.9158, test_loss: 0.8802, test_f1: 0.5453
 epoch: 6, train_loss: 0.9064, test_loss: 0.8649, test_f1: 0.5415
 epoch: 7, train_loss: 0.8885, test_loss: 0.8642, test_f1: 0.5951
 epoch: 8, train_loss: 0.8695, test_loss: 0.8622, test_f1: 0.6002
 epoch: 9, train_loss: 0.8675, test_loss: 0.8775, test_f1: 0.5624
 epoch: 10, train_loss: 0.8402, test_loss: 0.8485, test_f1: 0.6193
 epoch: 11, train_loss: 0.8360, test_loss: 0.8434, test_f1: 0.5930
 epoch: 12, train_loss: 0.8182, test_loss: 0.8347, test_f1: 0.6233
 epoch: 13, train_loss: 0.7994, test_loss: 0.8498, test_f1: 0.6193
 epoch: 14, train_loss: 0.8038, test_loss: 0.8387, test_f1: 0.6160
 epoch: 15, train_loss: 0.7980, test_loss: 0.8525, test_f1: 0.5980
 epoch: 16, train_loss: 0.7821, test_loss: 0.8175, test_f1: 0.6163
 epoch: 17, train_loss: 0.7682, test_loss: 0.8378, test_f1: 0.6397
 epoch: 18, train_loss: 0.7684, test_loss: 0.8060, test_f1: 0.6274
 epoch: 19, train_loss: 0.7597, test_loss: 0.8546, test_f1: 0.6275
 epoch: 20, train_loss: 0.7422, test_loss: 0.8104, test_f1: 0.6367
 epoch: 21, train_loss: 0.7353, test_loss: 0.7612, test_f1: 0.6274
 epoch: 22, train_loss: 0.7394, test_loss: 0.7726, test_f1: 0.6257
 epoch: 23, train_loss: 0.7361, test_loss: 0.7647, test_f1: 0.6276
 epoch: 24, train_loss: 0.7045, test_loss: 0.7749, test_f1: 0.6293
 epoch: 25, train_loss: 0.7042, test_loss: 0.7535, test_f1: 0.6338
 epoch: 26, train_loss: 0.7053, test_loss: 0.7680, test_f1: 0.6523
 epoch: 27, train_loss: 0.6902, test_loss: 0.7522, test_f1: 0.6406
 epoch: 28, train_loss: 0.6863, test_loss: 0.7768, test_f1: 0.6274
 epoch: 29, train_loss: 0.6721, test_loss: 0.8202, test_f1: 0.6184
 epoch: 30, train_loss: 0.6777, test_loss: 0.7773, test_f1: 0.6197
 epoch: 31, train_loss: 0.6691, test_loss: 0.7409, test_f1: 0.6659
 epoch: 32, train_loss: 0.6572, test_loss: 0.7633, test_f1: 0.6367
 epoch: 33, train_loss: 0.6570, test_loss: 0.7668, test_f1: 0.6259
 epoch: 34, train_loss: 0.6497, test_loss: 0.7432, test_f1: 0.6416
 epoch: 35, train_loss: 0.6401, test_loss: 0.7414, test_f1: 0.6451
 epoch: 36, train_loss: 0.6372, test_loss: 0.7584, test_f1: 0.6274
 epoch: 37, train_loss: 0.6179, test_loss: 0.7938, test_f1: 0.6530
 epoch: 38, train_loss: 0.6167, test_loss: 0.7392, test_f1: 0.6443
 epoch: 39, train_loss: 0.6243, test_loss: 0.7924, test_f1: 0.6547
 epoch: 40, train_loss: 0.6040, test_loss: 0.7694, test_f1: 0.6512
 epoch: 41, train_loss: 0.6257, test_loss: 0.8108, test_f1: 0.6578
 epoch: 42, train_loss: 0.6031, test_loss: 0.7979, test_f1: 0.6300
 epoch: 43, train_loss: 0.5934, test_loss: 0.7272, test_f1: 0.6581
 epoch: 44, train_loss: 0.6077, test_loss: 0.7595, test_f1: 0.6474
 epoch: 45, train_loss: 0.6021, test_loss: 0.7711, test_f1: 0.6525
 epoch: 46, train_loss: 0.5801, test_loss: 0.7476, test_f1: 0.6488
 epoch: 47, train_loss: 0.5809, test_loss: 0.7819, test_f1: 0.6405
 epoch: 48, train_loss: 0.5803, test_loss: 0.7871, test_f1: 0.6563
 epoch: 49, train_loss: 0.5807, test_loss: 0.8597, test_f1: 0.6554
 epoch: 50, train_loss: 0.5624, test_loss: 0.8311, test_f1: 0.6434
 epoch: 51, train_loss: 0.5603, test_loss: 0.8179, test_f1: 0.6516
 epoch: 52, train_loss: 0.5419, test_loss: 0.8153, test_f1: 0.6626
 epoch: 53, train_loss: 0.5354, test_loss: 0.8092, test_f1: 0.6462
 epoch: 54, train_loss: 0.5204, test_loss: 0.8509, test_f1: 0.6406
 epoch: 55, train_loss: 0.5264, test_loss: 0.8860, test_f1: 0.6611
 epoch: 56, train_loss: 0.5193, test_loss: 0.8581, test_f1: 0.6545
 epoch: 57, train_loss: 0.5211, test_loss: 0.8292, test_f1: 0.6304
 epoch: 58, train_loss: 0.5165, test_loss: 0.8308, test_f1: 0.6593
 epoch: 59, train_loss: 0.5050, test_loss: 0.8719, test_f1: 0.6142
 epoch: 60, train_loss: 0.5015, test_loss: 0.8323, test_f1: 0.6265
 epoch: 61, train_loss: 0.5181, test_loss: 0.8683, test_f1: 0.6633
 epoch: 62, train_loss: 0.5031, test_loss: 0.8914, test_f1: 0.6522
 epoch: 63, train_loss: 0.5025, test_loss: 0.8254, test_f1: 0.6579
 epoch: 64, train_loss: 0.5010, test_loss: 0.9166, test_f1: 0.6510
 epoch: 65, train_loss: 0.5050, test_loss: 0.9187, test_f1: 0.6576
 epoch: 66, train_loss: 0.4949, test_loss: 0.8791, test_f1: 0.6447
 epoch: 67, train_loss: 0.5087, test_loss: 0.8679, test_f1: 0.6360
 epoch: 68, train_loss: 0.4914, test_loss: 0.8712, test_f1: 0.6410
 epoch: 69, train_loss: 0.4985, test_loss: 0.9486, test_f1: 0.6707
 epoch: 70, train_loss: 0.4846, test_loss: 0.9305, test_f1: 0.6490
 epoch: 71, train_loss: 0.4834, test_loss: 0.9255, test_f1: 0.6596
 epoch: 72, train_loss: 0.4803, test_loss: 0.9573, test_f1: 0.6372
 epoch: 73, train_loss: 0.4713, test_loss: 0.9160, test_f1: 0.6473
 epoch: 74, train_loss: 0.4686, test_loss: 0.9205, test_f1: 0.6442
 epoch: 75, train_loss: 0.4843, test_loss: 0.9684, test_f1: 0.6399
 epoch: 76, train_loss: 0.4602, test_loss: 1.0074, test_f1: 0.6633
 epoch: 77, train_loss: 0.4719, test_loss: 0.9434, test_f1: 0.6581
 epoch: 78, train_loss: 0.4618, test_loss: 0.9584, test_f1: 0.6458
 epoch: 79, train_loss: 0.4543, test_loss: 1.0002, test_f1: 0.6392
 epoch: 80, train_loss: 0.4623, test_loss: 0.9394, test_f1: 0.6555
 epoch: 81, train_loss: 0.4689, test_loss: 0.9838, test_f1: 0.6307
 epoch: 82, train_loss: 0.4567, test_loss: 0.9677, test_f1: 0.6548
 epoch: 83, train_loss: 0.4613, test_loss: 0.9833, test_f1: 0.6299
 epoch: 84, train_loss: 0.4592, test_loss: 0.9624, test_f1: 0.6555
 epoch: 85, train_loss: 0.4515, test_loss: 0.9928, test_f1: 0.6505
 epoch: 86, train_loss: 0.4547, test_loss: 1.0434, test_f1: 0.6618
 epoch: 87, train_loss: 0.4556, test_loss: 1.0112, test_f1: 0.6412
 epoch: 88, train_loss: 0.4444, test_loss: 0.9745, test_f1: 0.6361
 epoch: 89, train_loss: 0.4327, test_loss: 0.9962, test_f1: 0.6377
 epoch: 90, train_loss: 0.4273, test_loss: 1.0172, test_f1: 0.6396
 epoch: 91, train_loss: 0.4402, test_loss: 1.0326, test_f1: 0.6608
 epoch: 92, train_loss: 0.4291, test_loss: 1.1416, test_f1: 0.6502
 epoch: 93, train_loss: 0.4204, test_loss: 1.0400, test_f1: 0.6363
 epoch: 94, train_loss: 0.4353, test_loss: 1.0761, test_f1: 0.6517
 epoch: 95, train_loss: 0.4176, test_loss: 1.0118, test_f1: 0.6451
 epoch: 96, train_loss: 0.4169, test_loss: 1.0347, test_f1: 0.6508
 epoch: 97, train_loss: 0.4302, test_loss: 1.0939, test_f1: 0.6363
 epoch: 98, train_loss: 0.4115, test_loss: 1.0400, test_f1: 0.6369
 epoch: 99, train_loss: 0.4129, test_loss: 1.0313, test_f1: 0.6496
##################ITERATION #8 ****************************************
 epoch: 0, train_loss: 1.2115, test_loss: 0.9954, test_f1: 0.5156
 epoch: 1, train_loss: 1.0527, test_loss: 0.9448, test_f1: 0.5160
 epoch: 2, train_loss: 0.9938, test_loss: 0.9451, test_f1: 0.5469
 epoch: 3, train_loss: 0.9769, test_loss: 0.9422, test_f1: 0.5455
 epoch: 4, train_loss: 0.9493, test_loss: 0.9238, test_f1: 0.5487
 epoch: 5, train_loss: 0.9087, test_loss: 0.8987, test_f1: 0.5518
 epoch: 6, train_loss: 0.8884, test_loss: 0.8438, test_f1: 0.5620
 epoch: 7, train_loss: 0.8894, test_loss: 0.8289, test_f1: 0.5922
 epoch: 8, train_loss: 0.8633, test_loss: 0.8209, test_f1: 0.5790
 epoch: 9, train_loss: 0.8485, test_loss: 0.8351, test_f1: 0.5662
 epoch: 10, train_loss: 0.8518, test_loss: 0.8182, test_f1: 0.5813
 epoch: 11, train_loss: 0.8283, test_loss: 0.8188, test_f1: 0.5784
 epoch: 12, train_loss: 0.8099, test_loss: 0.7702, test_f1: 0.5913
 epoch: 13, train_loss: 0.8105, test_loss: 0.8022, test_f1: 0.5981
 epoch: 14, train_loss: 0.7944, test_loss: 0.7834, test_f1: 0.6067
 epoch: 15, train_loss: 0.7696, test_loss: 0.7643, test_f1: 0.6081
 epoch: 16, train_loss: 0.7859, test_loss: 0.7705, test_f1: 0.6180
 epoch: 17, train_loss: 0.7534, test_loss: 0.7640, test_f1: 0.6343
 epoch: 18, train_loss: 0.7515, test_loss: 0.7391, test_f1: 0.6359
 epoch: 19, train_loss: 0.7361, test_loss: 0.7315, test_f1: 0.6369
 epoch: 20, train_loss: 0.7330, test_loss: 0.7523, test_f1: 0.6206
 epoch: 21, train_loss: 0.7280, test_loss: 0.7552, test_f1: 0.6442
 epoch: 22, train_loss: 0.7256, test_loss: 0.7525, test_f1: 0.6353
 epoch: 23, train_loss: 0.7165, test_loss: 0.7280, test_f1: 0.6574
 epoch: 24, train_loss: 0.7086, test_loss: 0.7200, test_f1: 0.6697
 epoch: 25, train_loss: 0.6930, test_loss: 0.7414, test_f1: 0.6529
 epoch: 26, train_loss: 0.6923, test_loss: 0.7441, test_f1: 0.6165
 epoch: 27, train_loss: 0.6863, test_loss: 0.7101, test_f1: 0.6769
 epoch: 28, train_loss: 0.6581, test_loss: 0.7171, test_f1: 0.6613
 epoch: 29, train_loss: 0.6572, test_loss: 0.7171, test_f1: 0.6529
 epoch: 30, train_loss: 0.6594, test_loss: 0.7335, test_f1: 0.6651
 epoch: 31, train_loss: 0.6583, test_loss: 0.7324, test_f1: 0.6630
 epoch: 32, train_loss: 0.6460, test_loss: 0.7487, test_f1: 0.6474
 epoch: 33, train_loss: 0.6481, test_loss: 0.7236, test_f1: 0.6474
 epoch: 34, train_loss: 0.6313, test_loss: 0.7296, test_f1: 0.6586
 epoch: 35, train_loss: 0.6382, test_loss: 0.7357, test_f1: 0.6548
 epoch: 36, train_loss: 0.6230, test_loss: 0.7137, test_f1: 0.6568
 epoch: 37, train_loss: 0.6232, test_loss: 0.7448, test_f1: 0.6637
 epoch: 38, train_loss: 0.6242, test_loss: 0.7436, test_f1: 0.6472
 epoch: 39, train_loss: 0.6017, test_loss: 0.7486, test_f1: 0.6541
 epoch: 40, train_loss: 0.5994, test_loss: 0.7715, test_f1: 0.6519
 epoch: 41, train_loss: 0.5932, test_loss: 0.7327, test_f1: 0.6593
 epoch: 42, train_loss: 0.5837, test_loss: 0.7410, test_f1: 0.6652
 epoch: 43, train_loss: 0.5889, test_loss: 0.7800, test_f1: 0.6404
 epoch: 44, train_loss: 0.5721, test_loss: 0.7818, test_f1: 0.6477
 epoch: 45, train_loss: 0.5794, test_loss: 0.7801, test_f1: 0.6377
 epoch: 46, train_loss: 0.5774, test_loss: 0.8423, test_f1: 0.6259
 epoch: 47, train_loss: 0.5702, test_loss: 0.7763, test_f1: 0.6466
 epoch: 48, train_loss: 0.5472, test_loss: 0.7735, test_f1: 0.6422
 epoch: 49, train_loss: 0.5397, test_loss: 0.7534, test_f1: 0.6624
 epoch: 50, train_loss: 0.5520, test_loss: 0.8036, test_f1: 0.6266
 epoch: 51, train_loss: 0.5279, test_loss: 0.8067, test_f1: 0.6374
 epoch: 52, train_loss: 0.5159, test_loss: 0.8055, test_f1: 0.6346
 epoch: 53, train_loss: 0.5026, test_loss: 0.7862, test_f1: 0.6409
 epoch: 54, train_loss: 0.5007, test_loss: 0.7904, test_f1: 0.6580
 epoch: 55, train_loss: 0.5189, test_loss: 0.8009, test_f1: 0.6608
 epoch: 56, train_loss: 0.5086, test_loss: 0.7879, test_f1: 0.6634
 epoch: 57, train_loss: 0.5000, test_loss: 0.8301, test_f1: 0.6383
 epoch: 58, train_loss: 0.5048, test_loss: 0.8057, test_f1: 0.6546
 epoch: 59, train_loss: 0.4975, test_loss: 0.8070, test_f1: 0.6698
 epoch: 60, train_loss: 0.4868, test_loss: 0.8390, test_f1: 0.6413
 epoch: 61, train_loss: 0.4951, test_loss: 0.8034, test_f1: 0.6649
 epoch: 62, train_loss: 0.5002, test_loss: 0.8394, test_f1: 0.6298
 epoch: 63, train_loss: 0.4841, test_loss: 0.8219, test_f1: 0.6525
 epoch: 64, train_loss: 0.4862, test_loss: 0.9174, test_f1: 0.6362
 epoch: 65, train_loss: 0.4861, test_loss: 0.9012, test_f1: 0.6579
 epoch: 66, train_loss: 0.4751, test_loss: 0.9259, test_f1: 0.6530
 epoch: 67, train_loss: 0.4633, test_loss: 0.8936, test_f1: 0.6355
 epoch: 68, train_loss: 0.4522, test_loss: 0.8886, test_f1: 0.6630
 epoch: 69, train_loss: 0.4716, test_loss: 0.9557, test_f1: 0.6466
 epoch: 70, train_loss: 0.4699, test_loss: 0.9056, test_f1: 0.6315
 epoch: 71, train_loss: 0.4686, test_loss: 0.9285, test_f1: 0.6353
 epoch: 72, train_loss: 0.4462, test_loss: 0.9436, test_f1: 0.6330
 epoch: 73, train_loss: 0.4455, test_loss: 0.8902, test_f1: 0.6566
 epoch: 74, train_loss: 0.4667, test_loss: 0.9486, test_f1: 0.6388
 epoch: 75, train_loss: 0.4495, test_loss: 0.9225, test_f1: 0.6577
 epoch: 76, train_loss: 0.4526, test_loss: 0.9096, test_f1: 0.6313
 epoch: 77, train_loss: 0.4396, test_loss: 0.9404, test_f1: 0.6338
 epoch: 78, train_loss: 0.4557, test_loss: 0.9619, test_f1: 0.6400
 epoch: 79, train_loss: 0.4293, test_loss: 0.9727, test_f1: 0.6355
 epoch: 80, train_loss: 0.4453, test_loss: 1.0334, test_f1: 0.6358
 epoch: 81, train_loss: 0.4371, test_loss: 0.9162, test_f1: 0.6502
 epoch: 82, train_loss: 0.4347, test_loss: 1.0203, test_f1: 0.6407
 epoch: 83, train_loss: 0.4343, test_loss: 0.9936, test_f1: 0.6483
 epoch: 84, train_loss: 0.4380, test_loss: 0.9852, test_f1: 0.6384
 epoch: 85, train_loss: 0.4125, test_loss: 1.0232, test_f1: 0.6443
 epoch: 86, train_loss: 0.4169, test_loss: 0.9830, test_f1: 0.6613
 epoch: 87, train_loss: 0.4287, test_loss: 1.0227, test_f1: 0.6460
 epoch: 88, train_loss: 0.4246, test_loss: 1.0934, test_f1: 0.6301
 epoch: 89, train_loss: 0.4176, test_loss: 1.0177, test_f1: 0.6475
 epoch: 90, train_loss: 0.4152, test_loss: 0.9986, test_f1: 0.6482
 epoch: 91, train_loss: 0.4142, test_loss: 1.0224, test_f1: 0.6370
 epoch: 92, train_loss: 0.4114, test_loss: 1.0286, test_f1: 0.6333
 epoch: 93, train_loss: 0.3949, test_loss: 1.0563, test_f1: 0.6344
 epoch: 94, train_loss: 0.3964, test_loss: 1.0338, test_f1: 0.6538
 epoch: 95, train_loss: 0.4089, test_loss: 1.0761, test_f1: 0.6279
 epoch: 96, train_loss: 0.3925, test_loss: 1.0929, test_f1: 0.6523
 epoch: 97, train_loss: 0.3983, test_loss: 1.1383, test_f1: 0.6458
 epoch: 98, train_loss: 0.4015, test_loss: 1.1232, test_f1: 0.6471
 epoch: 99, train_loss: 0.3938, test_loss: 1.1187, test_f1: 0.6409
##################ITERATION #9 ****************************************
 epoch: 0, train_loss: 1.2010, test_loss: 1.0233, test_f1: 0.5080
 epoch: 1, train_loss: 1.0427, test_loss: 0.9806, test_f1: 0.5211
 epoch: 2, train_loss: 0.9955, test_loss: 0.9322, test_f1: 0.5354
 epoch: 3, train_loss: 0.9557, test_loss: 0.9149, test_f1: 0.5503
 epoch: 4, train_loss: 0.9534, test_loss: 0.9082, test_f1: 0.5830
 epoch: 5, train_loss: 0.9247, test_loss: 0.9134, test_f1: 0.5583
 epoch: 6, train_loss: 0.9082, test_loss: 0.9013, test_f1: 0.5448
 epoch: 7, train_loss: 0.8953, test_loss: 0.8786, test_f1: 0.5307
 epoch: 8, train_loss: 0.8633, test_loss: 0.8611, test_f1: 0.5551
 epoch: 9, train_loss: 0.8747, test_loss: 0.8735, test_f1: 0.5391
 epoch: 10, train_loss: 0.8408, test_loss: 0.8321, test_f1: 0.5678
 epoch: 11, train_loss: 0.8362, test_loss: 0.8653, test_f1: 0.6207
 epoch: 12, train_loss: 0.8244, test_loss: 0.8703, test_f1: 0.6297
 epoch: 13, train_loss: 0.8211, test_loss: 0.8653, test_f1: 0.5533
 epoch: 14, train_loss: 0.8094, test_loss: 0.8510, test_f1: 0.5809
 epoch: 15, train_loss: 0.7916, test_loss: 0.8787, test_f1: 0.5675
 epoch: 16, train_loss: 0.7845, test_loss: 0.8766, test_f1: 0.5972
 epoch: 17, train_loss: 0.7733, test_loss: 0.7986, test_f1: 0.6154
 epoch: 18, train_loss: 0.7661, test_loss: 0.8051, test_f1: 0.6438
 epoch: 19, train_loss: 0.7576, test_loss: 0.8529, test_f1: 0.6298
 epoch: 20, train_loss: 0.7527, test_loss: 0.8108, test_f1: 0.6393
 epoch: 21, train_loss: 0.7310, test_loss: 0.7862, test_f1: 0.5862
 epoch: 22, train_loss: 0.7376, test_loss: 0.7640, test_f1: 0.6144
 epoch: 23, train_loss: 0.7275, test_loss: 0.7537, test_f1: 0.6436
 epoch: 24, train_loss: 0.7106, test_loss: 0.7936, test_f1: 0.6581
 epoch: 25, train_loss: 0.7175, test_loss: 0.7738, test_f1: 0.6206
 epoch: 26, train_loss: 0.7045, test_loss: 0.7982, test_f1: 0.6121
 epoch: 27, train_loss: 0.7025, test_loss: 0.7750, test_f1: 0.6557
 epoch: 28, train_loss: 0.6882, test_loss: 0.7463, test_f1: 0.6491
 epoch: 29, train_loss: 0.6864, test_loss: 0.7632, test_f1: 0.6555
 epoch: 30, train_loss: 0.6946, test_loss: 0.7590, test_f1: 0.6501
 epoch: 31, train_loss: 0.6774, test_loss: 0.8364, test_f1: 0.6732
 epoch: 32, train_loss: 0.6715, test_loss: 0.7306, test_f1: 0.6693
 epoch: 33, train_loss: 0.6841, test_loss: 0.7149, test_f1: 0.6920
 epoch: 34, train_loss: 0.6482, test_loss: 0.7767, test_f1: 0.6670
 epoch: 35, train_loss: 0.6453, test_loss: 0.7584, test_f1: 0.6584
 epoch: 36, train_loss: 0.6425, test_loss: 0.8054, test_f1: 0.6603
 epoch: 37, train_loss: 0.6435, test_loss: 0.7593, test_f1: 0.6600
 epoch: 38, train_loss: 0.6288, test_loss: 0.7342, test_f1: 0.6525
 epoch: 39, train_loss: 0.6464, test_loss: 0.7995, test_f1: 0.6244
 epoch: 40, train_loss: 0.6174, test_loss: 0.7552, test_f1: 0.6292
 epoch: 41, train_loss: 0.6118, test_loss: 0.7694, test_f1: 0.6520
 epoch: 42, train_loss: 0.6115, test_loss: 0.7974, test_f1: 0.6736
 epoch: 43, train_loss: 0.6121, test_loss: 0.7458, test_f1: 0.6587
 epoch: 44, train_loss: 0.6271, test_loss: 0.8025, test_f1: 0.6621
 epoch: 45, train_loss: 0.6031, test_loss: 0.8231, test_f1: 0.6320
 epoch: 46, train_loss: 0.5876, test_loss: 0.8782, test_f1: 0.6411
 epoch: 47, train_loss: 0.5899, test_loss: 0.8234, test_f1: 0.6429
 epoch: 48, train_loss: 0.5944, test_loss: 0.8540, test_f1: 0.6425
 epoch: 49, train_loss: 0.5824, test_loss: 0.8109, test_f1: 0.6580
 epoch: 50, train_loss: 0.5650, test_loss: 0.8250, test_f1: 0.6452
 epoch: 51, train_loss: 0.5492, test_loss: 0.8150, test_f1: 0.6364
 epoch: 52, train_loss: 0.5542, test_loss: 0.8475, test_f1: 0.6546
 epoch: 53, train_loss: 0.5449, test_loss: 0.8123, test_f1: 0.6520
 epoch: 54, train_loss: 0.5339, test_loss: 0.7994, test_f1: 0.6525
 epoch: 55, train_loss: 0.5331, test_loss: 0.7895, test_f1: 0.6431
 epoch: 56, train_loss: 0.5400, test_loss: 0.7895, test_f1: 0.6550
 epoch: 57, train_loss: 0.5398, test_loss: 0.8585, test_f1: 0.6499
 epoch: 58, train_loss: 0.5299, test_loss: 0.8113, test_f1: 0.6483
 epoch: 59, train_loss: 0.5147, test_loss: 0.8777, test_f1: 0.6524
 epoch: 60, train_loss: 0.5160, test_loss: 0.8432, test_f1: 0.6486
 epoch: 61, train_loss: 0.5146, test_loss: 0.8421, test_f1: 0.6501
 epoch: 62, train_loss: 0.5095, test_loss: 0.8033, test_f1: 0.6484
 epoch: 63, train_loss: 0.4991, test_loss: 0.8391, test_f1: 0.6687
 epoch: 64, train_loss: 0.5078, test_loss: 0.8294, test_f1: 0.6472
 epoch: 65, train_loss: 0.5062, test_loss: 0.8522, test_f1: 0.6654
 epoch: 66, train_loss: 0.4983, test_loss: 0.8633, test_f1: 0.6570
 epoch: 67, train_loss: 0.5074, test_loss: 0.8256, test_f1: 0.6701
 epoch: 68, train_loss: 0.4929, test_loss: 0.8544, test_f1: 0.6756
 epoch: 69, train_loss: 0.4982, test_loss: 0.8473, test_f1: 0.6615
 epoch: 70, train_loss: 0.4784, test_loss: 0.8927, test_f1: 0.6695
 epoch: 71, train_loss: 0.4762, test_loss: 0.9206, test_f1: 0.6552
 epoch: 72, train_loss: 0.4938, test_loss: 0.9144, test_f1: 0.6630
 epoch: 73, train_loss: 0.4848, test_loss: 0.9032, test_f1: 0.6682
 epoch: 74, train_loss: 0.4826, test_loss: 0.9178, test_f1: 0.6462
 epoch: 75, train_loss: 0.4737, test_loss: 0.8978, test_f1: 0.6543
 epoch: 76, train_loss: 0.4683, test_loss: 0.9186, test_f1: 0.6630
 epoch: 77, train_loss: 0.4721, test_loss: 0.8836, test_f1: 0.6608
 epoch: 78, train_loss: 0.4632, test_loss: 0.9290, test_f1: 0.6680
 epoch: 79, train_loss: 0.4704, test_loss: 0.9053, test_f1: 0.6756
 epoch: 80, train_loss: 0.4737, test_loss: 0.9198, test_f1: 0.6618
 epoch: 81, train_loss: 0.4737, test_loss: 0.8769, test_f1: 0.6653
 epoch: 82, train_loss: 0.4555, test_loss: 0.9676, test_f1: 0.6507
 epoch: 83, train_loss: 0.4664, test_loss: 1.0301, test_f1: 0.6608
 epoch: 84, train_loss: 0.4604, test_loss: 0.9750, test_f1: 0.6445
 epoch: 85, train_loss: 0.4587, test_loss: 0.9594, test_f1: 0.6574
 epoch: 86, train_loss: 0.4483, test_loss: 0.9755, test_f1: 0.6574
 epoch: 87, train_loss: 0.4503, test_loss: 1.0169, test_f1: 0.6613
 epoch: 88, train_loss: 0.4500, test_loss: 1.0000, test_f1: 0.6669
 epoch: 89, train_loss: 0.4366, test_loss: 1.0045, test_f1: 0.6620
 epoch: 90, train_loss: 0.4372, test_loss: 1.0487, test_f1: 0.6574
 epoch: 91, train_loss: 0.4338, test_loss: 0.9705, test_f1: 0.6569
 epoch: 92, train_loss: 0.4273, test_loss: 1.0052, test_f1: 0.6779
 epoch: 93, train_loss: 0.4289, test_loss: 1.0860, test_f1: 0.6725
 epoch: 94, train_loss: 0.4377, test_loss: 1.0195, test_f1: 0.6658
 epoch: 95, train_loss: 0.4390, test_loss: 1.0159, test_f1: 0.6796
 epoch: 96, train_loss: 0.4351, test_loss: 1.0672, test_f1: 0.6621
 epoch: 97, train_loss: 0.4244, test_loss: 1.0640, test_f1: 0.6680
 epoch: 98, train_loss: 0.4235, test_loss: 1.0576, test_f1: 0.6704
 epoch: 99, train_loss: 0.4206, test_loss: 1.0652, test_f1: 0.6718

Training completed in 966.19 seconds
Best F1: 0.6920 at epoch 33
Mean F1 across iterations: 0.6784  0.0087
========================FINAL RESULTS================================
FEGIN weighted F1: 0.6920  0.0087
python main.py --data ltspice_examples --representation component_pin_net --model FEGIN --layers 3 --hiddens 128 --batch_size 32 --lr 0.0001 --emb_size 128 --epochs 100 --save_appendix component_pin_net_L3_H128_BS32_LR0.0001_E128 --no_val
-----



STDERR:
  File "main.py", line 370, in <module>
    main()
  File "main.py", line 254, in main
    dataset = dataset_class(
  File "/home/philip/projects/ltspice_examples_code_repo/Circuit-Completion-Using-GNNs/component_classification_with_link_prediction_head/evaluation/FEGIN/kernel/circuit_datasets.py", line 15, in __init__
    self.data, self.slices = torch.load(self.processed_paths[0])
  File "/home/philip/.local/lib/python3.8/site-packages/torch/serialization.py", line 1040, in load
    warnings.warn(
  File "/usr/lib/python3.8/warnings.py", line 109, in _showwarnmsg
    sw(msg.message, msg.category, msg.filename, msg.lineno,
  File "main.py", line 47, in warn_with_traceback
    traceback.print_stack(file=log)
/home/philip/projects/ltspice_examples_code_repo/Circuit-Completion-Using-GNNs/component_classification_with_link_prediction_head/evaluation/FEGIN/kernel/circuit_datasets.py:15: FutureWarning: You are using `torch.load` with `weights_only=False` (the current default value), which uses the default pickle module implicitly. It is possible to construct malicious pickle data which will execute arbitrary code during unpickling (See https://github.com/pytorch/pytorch/blob/main/SECURITY.md#untrusted-models for more details). In a future release, the default value for `weights_only` will be flipped to `True`. This limits the functions that could be executed during unpickling. Arbitrary objects will no longer be allowed to be loaded via this mode unless they are explicitly allowlisted by the user via `torch.serialization.add_safe_globals`. We recommend you start setting `weights_only=True` for any use case where you don't have full control of the loaded file. Please open an issue on GitHub for any issues related to this experimental feature.
  self.data, self.slices = torch.load(self.processed_paths[0])
