STDOUT:
Results will be saved in /home/philip/projects/ltspice_examples_code_repo/Circuit-Completion-Using-GNNs/component_classification_with_link_prediction_head/evaluation/FEGIN/results/model_FEGIN_dataset_ltspice_examples
Command line input: python main.py --data ltspice_examples --representation component_component --model FEGIN --layers 4 --hiddens 16 --batch_size 32 --lr 0.01 --emb_size 512 --epochs 100 --save_appendix component_component_L4_H16_BS32_LR0.01_E512 --no_val
 is saved.
-----
ltspice_examples - FEGIN
Using 4 layers, 16 hidden units, h = 2
Loading component_component representation dataset
ENTERED
Training FEGIN on component_component representation
Train: 3556, Test: 845
##################ITERATION #0 ****************************************
 epoch: 0, train_loss: 1.2892, test_loss: 1.2822, test_f1: 0.2274
 epoch: 1, train_loss: 1.2467, test_loss: 1.1854, test_f1: 0.3275
 epoch: 2, train_loss: 1.1902, test_loss: 1.1139, test_f1: 0.3546
 epoch: 3, train_loss: 1.1292, test_loss: 1.0481, test_f1: 0.4488
 epoch: 4, train_loss: 1.0943, test_loss: 1.0094, test_f1: 0.4601
 epoch: 5, train_loss: 1.0578, test_loss: 1.0282, test_f1: 0.4376
 epoch: 6, train_loss: 1.0476, test_loss: 1.0188, test_f1: 0.4562
 epoch: 7, train_loss: 1.0366, test_loss: 1.0662, test_f1: 0.4608
 epoch: 8, train_loss: 1.0256, test_loss: 2.1625, test_f1: 0.4038
 epoch: 9, train_loss: 1.1349, test_loss: 0.9768, test_f1: 0.4330
 epoch: 10, train_loss: 1.0565, test_loss: 0.9897, test_f1: 0.4443
 epoch: 11, train_loss: 1.0158, test_loss: 0.9693, test_f1: 0.4450
 epoch: 12, train_loss: 1.0026, test_loss: 1.0190, test_f1: 0.4531
 epoch: 13, train_loss: 1.0076, test_loss: 0.9855, test_f1: 0.4653
 epoch: 14, train_loss: 0.9959, test_loss: 1.0031, test_f1: 0.4836
 epoch: 15, train_loss: 0.9861, test_loss: 0.9958, test_f1: 0.4542
 epoch: 16, train_loss: 0.9730, test_loss: 1.0151, test_f1: 0.4558
 epoch: 17, train_loss: 0.9717, test_loss: 1.0488, test_f1: 0.4281
 epoch: 18, train_loss: 1.0094, test_loss: 0.9802, test_f1: 0.4625
 epoch: 19, train_loss: 0.9890, test_loss: 1.0011, test_f1: 0.4451
 epoch: 20, train_loss: 0.9742, test_loss: 0.9681, test_f1: 0.4524
 epoch: 21, train_loss: 0.9827, test_loss: 1.0401, test_f1: 0.4637
 epoch: 22, train_loss: 0.9795, test_loss: 1.0763, test_f1: 0.4668
 epoch: 23, train_loss: 0.9574, test_loss: 1.0360, test_f1: 0.4853
 epoch: 24, train_loss: 0.9513, test_loss: 1.0420, test_f1: 0.4641
 epoch: 25, train_loss: 0.9552, test_loss: 0.9981, test_f1: 0.4572
 epoch: 26, train_loss: 0.9653, test_loss: 1.1322, test_f1: 0.4712
 epoch: 27, train_loss: 0.9588, test_loss: 1.1487, test_f1: 0.4451
 epoch: 28, train_loss: 0.9462, test_loss: 1.0955, test_f1: 0.4549
 epoch: 29, train_loss: 0.9514, test_loss: 0.9896, test_f1: 0.4831
 epoch: 30, train_loss: 0.9497, test_loss: 1.0211, test_f1: 0.4585
 epoch: 31, train_loss: 0.9564, test_loss: 1.0342, test_f1: 0.4600
 epoch: 32, train_loss: 0.9603, test_loss: 1.2163, test_f1: 0.4943
 epoch: 33, train_loss: 0.9490, test_loss: 1.0295, test_f1: 0.4487
 epoch: 34, train_loss: 0.9511, test_loss: 1.0235, test_f1: 0.4639
 epoch: 35, train_loss: 0.9946, test_loss: 1.0299, test_f1: 0.4665
 epoch: 36, train_loss: 0.9606, test_loss: 1.0066, test_f1: 0.4872
 epoch: 37, train_loss: 0.9529, test_loss: 1.0723, test_f1: 0.4611
 epoch: 38, train_loss: 0.9449, test_loss: 1.1073, test_f1: 0.4675
 epoch: 39, train_loss: 0.9465, test_loss: 1.1505, test_f1: 0.4584
 epoch: 40, train_loss: 0.9351, test_loss: 1.3862, test_f1: 0.4640
 epoch: 41, train_loss: 0.9344, test_loss: 1.2667, test_f1: 0.4492
 epoch: 42, train_loss: 0.9306, test_loss: 1.2950, test_f1: 0.4364
 epoch: 43, train_loss: 0.9236, test_loss: 1.0190, test_f1: 0.4997
 epoch: 44, train_loss: 0.9203, test_loss: 1.0164, test_f1: 0.4818
 epoch: 45, train_loss: 0.9289, test_loss: 0.9865, test_f1: 0.4679
 epoch: 46, train_loss: 0.9454, test_loss: 1.0121, test_f1: 0.4755
 epoch: 47, train_loss: 0.9563, test_loss: 0.9824, test_f1: 0.4950
 epoch: 48, train_loss: 0.9291, test_loss: 1.0526, test_f1: 0.4701
 epoch: 49, train_loss: 0.9396, test_loss: 1.0788, test_f1: 0.4485
 epoch: 50, train_loss: 0.9229, test_loss: 0.9571, test_f1: 0.4958
 epoch: 51, train_loss: 0.9090, test_loss: 1.0053, test_f1: 0.4830
 epoch: 52, train_loss: 0.9090, test_loss: 1.0333, test_f1: 0.4950
 epoch: 53, train_loss: 0.9070, test_loss: 1.1351, test_f1: 0.4657
 epoch: 54, train_loss: 0.8953, test_loss: 1.1835, test_f1: 0.4758
 epoch: 55, train_loss: 0.9049, test_loss: 0.9895, test_f1: 0.5099
 epoch: 56, train_loss: 0.8982, test_loss: 1.0388, test_f1: 0.5171
 epoch: 57, train_loss: 0.8914, test_loss: 1.0402, test_f1: 0.5318
 epoch: 58, train_loss: 0.8811, test_loss: 1.0022, test_f1: 0.5396
 epoch: 59, train_loss: 0.8862, test_loss: 1.1040, test_f1: 0.4820
 epoch: 60, train_loss: 0.8870, test_loss: 1.0765, test_f1: 0.5028
 epoch: 61, train_loss: 0.8844, test_loss: 0.9928, test_f1: 0.5027
 epoch: 62, train_loss: 0.8755, test_loss: 0.9871, test_f1: 0.5461
 epoch: 63, train_loss: 0.8928, test_loss: 1.0892, test_f1: 0.4874
 epoch: 64, train_loss: 0.8887, test_loss: 0.9881, test_f1: 0.5038
 epoch: 65, train_loss: 0.8831, test_loss: 0.9533, test_f1: 0.5507
 epoch: 66, train_loss: 0.8837, test_loss: 1.0025, test_f1: 0.5366
 epoch: 67, train_loss: 0.8877, test_loss: 0.9809, test_f1: 0.5542
 epoch: 68, train_loss: 0.8804, test_loss: 1.0051, test_f1: 0.5130
 epoch: 69, train_loss: 0.8947, test_loss: 1.2201, test_f1: 0.5390
 epoch: 70, train_loss: 0.8825, test_loss: 0.9769, test_f1: 0.5546
 epoch: 71, train_loss: 0.8755, test_loss: 0.9930, test_f1: 0.5317
 epoch: 72, train_loss: 0.8677, test_loss: 1.0930, test_f1: 0.5261
 epoch: 73, train_loss: 0.8759, test_loss: 1.0269, test_f1: 0.5411
 epoch: 74, train_loss: 0.8847, test_loss: 1.1740, test_f1: 0.5066
 epoch: 75, train_loss: 0.8960, test_loss: 1.0036, test_f1: 0.5806
 epoch: 76, train_loss: 0.8743, test_loss: 0.9792, test_f1: 0.5600
 epoch: 77, train_loss: 0.8751, test_loss: 1.0188, test_f1: 0.5451
 epoch: 78, train_loss: 0.8661, test_loss: 1.0115, test_f1: 0.5484
 epoch: 79, train_loss: 0.8804, test_loss: 1.0317, test_f1: 0.5485
 epoch: 80, train_loss: 0.8959, test_loss: 1.0204, test_f1: 0.5439
 epoch: 81, train_loss: 0.8777, test_loss: 1.0324, test_f1: 0.5213
 epoch: 82, train_loss: 0.8770, test_loss: 1.0259, test_f1: 0.5485
 epoch: 83, train_loss: 0.8738, test_loss: 0.9675, test_f1: 0.5667
 epoch: 84, train_loss: 0.8794, test_loss: 0.9926, test_f1: 0.5401
 epoch: 85, train_loss: 0.8755, test_loss: 0.9939, test_f1: 0.5547
 epoch: 86, train_loss: 0.8624, test_loss: 1.0197, test_f1: 0.5736
 epoch: 87, train_loss: 0.8577, test_loss: 0.9983, test_f1: 0.5500
 epoch: 88, train_loss: 0.8708, test_loss: 0.9879, test_f1: 0.5558
 epoch: 89, train_loss: 0.8714, test_loss: 0.9674, test_f1: 0.5666
 epoch: 90, train_loss: 0.8804, test_loss: 1.0181, test_f1: 0.5810
 epoch: 91, train_loss: 0.8619, test_loss: 1.0698, test_f1: 0.5503
 epoch: 92, train_loss: 0.8695, test_loss: 1.0231, test_f1: 0.5912
 epoch: 93, train_loss: 0.8847, test_loss: 1.0336, test_f1: 0.5249
 epoch: 94, train_loss: 0.8884, test_loss: 0.9992, test_f1: 0.5512
 epoch: 95, train_loss: 0.8705, test_loss: 1.1452, test_f1: 0.5479
 epoch: 96, train_loss: 0.8503, test_loss: 1.0357, test_f1: 0.5760
 epoch: 97, train_loss: 0.8616, test_loss: 1.0361, test_f1: 0.5319
 epoch: 98, train_loss: 0.8575, test_loss: 0.9815, test_f1: 0.5660
 epoch: 99, train_loss: 0.8549, test_loss: 0.9952, test_f1: 0.5723
##################ITERATION #1 ****************************************
 epoch: 0, train_loss: 1.2703, test_loss: 1.2497, test_f1: 0.3736
 epoch: 1, train_loss: 1.1982, test_loss: 1.1132, test_f1: 0.4539
 epoch: 2, train_loss: 1.1499, test_loss: 1.0855, test_f1: 0.4239
 epoch: 3, train_loss: 1.1198, test_loss: 1.1030, test_f1: 0.4470
 epoch: 4, train_loss: 1.0867, test_loss: 1.5037, test_f1: 0.3223
 epoch: 5, train_loss: 1.1126, test_loss: 0.9886, test_f1: 0.5091
 epoch: 6, train_loss: 1.0928, test_loss: 0.9916, test_f1: 0.4746
 epoch: 7, train_loss: 1.0539, test_loss: 1.0056, test_f1: 0.4252
 epoch: 8, train_loss: 1.0435, test_loss: 1.0073, test_f1: 0.4728
 epoch: 9, train_loss: 1.0217, test_loss: 1.0140, test_f1: 0.4569
 epoch: 10, train_loss: 1.0098, test_loss: 1.0358, test_f1: 0.4803
 epoch: 11, train_loss: 0.9980, test_loss: 0.9810, test_f1: 0.4844
 epoch: 12, train_loss: 0.9978, test_loss: 1.0373, test_f1: 0.4782
 epoch: 13, train_loss: 0.9992, test_loss: 0.9474, test_f1: 0.4631
 epoch: 14, train_loss: 0.9803, test_loss: 1.0196, test_f1: 0.4795
 epoch: 15, train_loss: 0.9639, test_loss: 0.9931, test_f1: 0.4562
 epoch: 16, train_loss: 0.9781, test_loss: 1.0490, test_f1: 0.4726
 epoch: 17, train_loss: 1.0450, test_loss: 0.9810, test_f1: 0.4934
 epoch: 18, train_loss: 0.9825, test_loss: 1.0128, test_f1: 0.4585
 epoch: 19, train_loss: 0.9645, test_loss: 1.0733, test_f1: 0.4394
 epoch: 20, train_loss: 0.9486, test_loss: 1.0391, test_f1: 0.4764
 epoch: 21, train_loss: 0.9537, test_loss: 1.0146, test_f1: 0.4840
 epoch: 22, train_loss: 0.9484, test_loss: 1.0299, test_f1: 0.4742
 epoch: 23, train_loss: 0.9375, test_loss: 1.0470, test_f1: 0.4604
 epoch: 24, train_loss: 0.9464, test_loss: 1.0622, test_f1: 0.4653
 epoch: 25, train_loss: 0.9717, test_loss: 0.9985, test_f1: 0.4877
 epoch: 26, train_loss: 0.9805, test_loss: 1.0927, test_f1: 0.4758
 epoch: 27, train_loss: 0.9821, test_loss: 0.9786, test_f1: 0.4744
 epoch: 28, train_loss: 0.9640, test_loss: 1.0681, test_f1: 0.4803
 epoch: 29, train_loss: 0.9575, test_loss: 1.0178, test_f1: 0.4773
 epoch: 30, train_loss: 0.9533, test_loss: 0.9993, test_f1: 0.4828
 epoch: 31, train_loss: 0.9368, test_loss: 1.0549, test_f1: 0.4867
 epoch: 32, train_loss: 0.9444, test_loss: 0.9905, test_f1: 0.4924
 epoch: 33, train_loss: 0.9387, test_loss: 1.0711, test_f1: 0.5023
 epoch: 34, train_loss: 0.9483, test_loss: 1.0212, test_f1: 0.5105
 epoch: 35, train_loss: 0.9450, test_loss: 1.0555, test_f1: 0.5127
 epoch: 36, train_loss: 0.9271, test_loss: 1.1260, test_f1: 0.4601
 epoch: 37, train_loss: 0.9304, test_loss: 1.0528, test_f1: 0.4871
 epoch: 38, train_loss: 0.9277, test_loss: 0.9823, test_f1: 0.5109
 epoch: 39, train_loss: 0.9269, test_loss: 1.1018, test_f1: 0.5107
 epoch: 40, train_loss: 0.9417, test_loss: 1.0498, test_f1: 0.5261
 epoch: 41, train_loss: 0.9161, test_loss: 1.0400, test_f1: 0.5000
 epoch: 42, train_loss: 0.9113, test_loss: 1.0697, test_f1: 0.5087
 epoch: 43, train_loss: 0.9248, test_loss: 1.0526, test_f1: 0.4654
 epoch: 44, train_loss: 0.9219, test_loss: 1.0444, test_f1: 0.4967
 epoch: 45, train_loss: 0.9138, test_loss: 1.1030, test_f1: 0.4945
 epoch: 46, train_loss: 0.9105, test_loss: 1.0328, test_f1: 0.5062
 epoch: 47, train_loss: 0.9078, test_loss: 1.0972, test_f1: 0.4926
 epoch: 48, train_loss: 0.9080, test_loss: 1.1146, test_f1: 0.4947
 epoch: 49, train_loss: 0.9134, test_loss: 1.0856, test_f1: 0.4977
 epoch: 50, train_loss: 0.9139, test_loss: 1.0708, test_f1: 0.4966
 epoch: 51, train_loss: 0.9045, test_loss: 1.0318, test_f1: 0.4950
 epoch: 52, train_loss: 0.8824, test_loss: 1.0408, test_f1: 0.5048
 epoch: 53, train_loss: 0.8819, test_loss: 1.0261, test_f1: 0.5191
 epoch: 54, train_loss: 0.8839, test_loss: 1.0563, test_f1: 0.5197
 epoch: 55, train_loss: 0.8885, test_loss: 1.0730, test_f1: 0.5139
 epoch: 56, train_loss: 0.8778, test_loss: 1.0408, test_f1: 0.5097
 epoch: 57, train_loss: 0.8777, test_loss: 1.0794, test_f1: 0.5110
 epoch: 58, train_loss: 0.8771, test_loss: 1.0672, test_f1: 0.5134
 epoch: 59, train_loss: 0.8795, test_loss: 1.0579, test_f1: 0.5015
 epoch: 60, train_loss: 0.8691, test_loss: 1.0516, test_f1: 0.5211
 epoch: 61, train_loss: 0.8795, test_loss: 1.0482, test_f1: 0.5122
 epoch: 62, train_loss: 0.8782, test_loss: 1.0309, test_f1: 0.5199
 epoch: 63, train_loss: 0.8671, test_loss: 1.0686, test_f1: 0.5019
 epoch: 64, train_loss: 0.8677, test_loss: 1.0980, test_f1: 0.5062
 epoch: 65, train_loss: 0.8894, test_loss: 1.0665, test_f1: 0.4975
 epoch: 66, train_loss: 0.8631, test_loss: 1.0705, test_f1: 0.5147
 epoch: 67, train_loss: 0.8798, test_loss: 1.0689, test_f1: 0.5064
 epoch: 68, train_loss: 0.8880, test_loss: 1.1277, test_f1: 0.4882
 epoch: 69, train_loss: 0.8671, test_loss: 1.0813, test_f1: 0.5135
 epoch: 70, train_loss: 0.8639, test_loss: 1.0833, test_f1: 0.5113
 epoch: 71, train_loss: 0.8623, test_loss: 1.0676, test_f1: 0.5125
 epoch: 72, train_loss: 0.8731, test_loss: 1.0406, test_f1: 0.5242
 epoch: 73, train_loss: 0.8677, test_loss: 1.0715, test_f1: 0.5056
 epoch: 74, train_loss: 0.8670, test_loss: 1.0823, test_f1: 0.5034
 epoch: 75, train_loss: 0.8554, test_loss: 1.0745, test_f1: 0.5115
 epoch: 76, train_loss: 0.8634, test_loss: 1.0872, test_f1: 0.5041
 epoch: 77, train_loss: 0.8664, test_loss: 1.0409, test_f1: 0.5302
 epoch: 78, train_loss: 0.8550, test_loss: 1.0353, test_f1: 0.5017
 epoch: 79, train_loss: 0.8767, test_loss: 1.0187, test_f1: 0.5184
 epoch: 80, train_loss: 0.8571, test_loss: 1.0677, test_f1: 0.5268
 epoch: 81, train_loss: 0.8549, test_loss: 1.0736, test_f1: 0.5158
 epoch: 82, train_loss: 0.8559, test_loss: 1.0787, test_f1: 0.5230
 epoch: 83, train_loss: 0.8638, test_loss: 1.0652, test_f1: 0.5119
 epoch: 84, train_loss: 0.8533, test_loss: 1.0855, test_f1: 0.5032
 epoch: 85, train_loss: 0.8442, test_loss: 1.0849, test_f1: 0.5117
 epoch: 86, train_loss: 0.8491, test_loss: 1.0678, test_f1: 0.5076
 epoch: 87, train_loss: 0.8701, test_loss: 1.0909, test_f1: 0.5056
 epoch: 88, train_loss: 0.8541, test_loss: 1.0731, test_f1: 0.5219
 epoch: 89, train_loss: 0.8585, test_loss: 1.0936, test_f1: 0.5016
 epoch: 90, train_loss: 0.8699, test_loss: 1.0736, test_f1: 0.5331
 epoch: 91, train_loss: 0.8489, test_loss: 1.0461, test_f1: 0.5222
 epoch: 92, train_loss: 0.8542, test_loss: 1.0421, test_f1: 0.5234
 epoch: 93, train_loss: 0.8453, test_loss: 1.0909, test_f1: 0.5048
 epoch: 94, train_loss: 0.8475, test_loss: 1.0789, test_f1: 0.5177
 epoch: 95, train_loss: 0.8410, test_loss: 1.0967, test_f1: 0.5117
 epoch: 96, train_loss: 0.8619, test_loss: 1.0459, test_f1: 0.5009
 epoch: 97, train_loss: 0.8436, test_loss: 1.0930, test_f1: 0.5130
 epoch: 98, train_loss: 0.8368, test_loss: 1.0699, test_f1: 0.5034
 epoch: 99, train_loss: 0.8542, test_loss: 1.0340, test_f1: 0.5126
##################ITERATION #2 ****************************************
 epoch: 0, train_loss: 1.2912, test_loss: 1.3395, test_f1: 0.2987
 epoch: 1, train_loss: 1.2485, test_loss: 1.1846, test_f1: 0.3798
 epoch: 2, train_loss: 1.1990, test_loss: 1.1461, test_f1: 0.4265
 epoch: 3, train_loss: 1.1647, test_loss: 1.0799, test_f1: 0.4390
 epoch: 4, train_loss: 1.1187, test_loss: 1.0121, test_f1: 0.4839
 epoch: 5, train_loss: 1.0923, test_loss: 1.0640, test_f1: 0.4752
 epoch: 6, train_loss: 1.0806, test_loss: 1.0122, test_f1: 0.4692
 epoch: 7, train_loss: 1.0711, test_loss: 1.1177, test_f1: 0.4730
 epoch: 8, train_loss: 1.0419, test_loss: 0.9583, test_f1: 0.5009
 epoch: 9, train_loss: 1.0353, test_loss: 1.0246, test_f1: 0.4598
 epoch: 10, train_loss: 1.0085, test_loss: 1.1002, test_f1: 0.4571
 epoch: 11, train_loss: 1.0082, test_loss: 1.0703, test_f1: 0.4723
 epoch: 12, train_loss: 1.0009, test_loss: 1.1282, test_f1: 0.4781
 epoch: 13, train_loss: 0.9982, test_loss: 1.1696, test_f1: 0.4744
 epoch: 14, train_loss: 0.9932, test_loss: 1.1702, test_f1: 0.4583
 epoch: 15, train_loss: 0.9788, test_loss: 1.0284, test_f1: 0.4630
 epoch: 16, train_loss: 0.9731, test_loss: 1.1334, test_f1: 0.4557
 epoch: 17, train_loss: 0.9857, test_loss: 1.0894, test_f1: 0.4828
 epoch: 18, train_loss: 0.9632, test_loss: 1.1817, test_f1: 0.4678
 epoch: 19, train_loss: 0.9598, test_loss: 1.2162, test_f1: 0.4787
 epoch: 20, train_loss: 0.9698, test_loss: 1.1741, test_f1: 0.4995
 epoch: 21, train_loss: 0.9454, test_loss: 1.2780, test_f1: 0.4736
 epoch: 22, train_loss: 0.9494, test_loss: 1.3549, test_f1: 0.4520
 epoch: 23, train_loss: 0.9613, test_loss: 1.1952, test_f1: 0.4586
 epoch: 24, train_loss: 0.9435, test_loss: 1.1529, test_f1: 0.4662
 epoch: 25, train_loss: 0.9567, test_loss: 1.1266, test_f1: 0.4460
 epoch: 26, train_loss: 0.9518, test_loss: 1.1280, test_f1: 0.4460
 epoch: 27, train_loss: 0.9403, test_loss: 1.3839, test_f1: 0.4717
 epoch: 28, train_loss: 0.9496, test_loss: 1.0862, test_f1: 0.4901
 epoch: 29, train_loss: 0.9419, test_loss: 1.1421, test_f1: 0.4608
 epoch: 30, train_loss: 0.9445, test_loss: 1.1637, test_f1: 0.4682
 epoch: 31, train_loss: 0.9612, test_loss: 1.0483, test_f1: 0.4729
 epoch: 32, train_loss: 0.9340, test_loss: 1.5059, test_f1: 0.4458
 epoch: 33, train_loss: 0.9635, test_loss: 1.2921, test_f1: 0.4501
 epoch: 34, train_loss: 0.9609, test_loss: 1.0552, test_f1: 0.4730
 epoch: 35, train_loss: 0.9596, test_loss: 0.9080, test_f1: 0.4756
 epoch: 36, train_loss: 0.9578, test_loss: 1.1775, test_f1: 0.4491
 epoch: 37, train_loss: 0.9419, test_loss: 1.2838, test_f1: 0.4818
 epoch: 38, train_loss: 0.9246, test_loss: 1.5520, test_f1: 0.4800
 epoch: 39, train_loss: 0.9590, test_loss: 1.1693, test_f1: 0.4526
 epoch: 40, train_loss: 0.9360, test_loss: 1.0638, test_f1: 0.4916
 epoch: 41, train_loss: 0.9319, test_loss: 1.0425, test_f1: 0.4833
 epoch: 42, train_loss: 0.9331, test_loss: 1.1579, test_f1: 0.4744
 epoch: 43, train_loss: 0.9193, test_loss: 1.1052, test_f1: 0.4744
 epoch: 44, train_loss: 0.9164, test_loss: 1.1039, test_f1: 0.4578
 epoch: 45, train_loss: 0.9355, test_loss: 1.1222, test_f1: 0.4748
 epoch: 46, train_loss: 0.9208, test_loss: 1.0531, test_f1: 0.4867
 epoch: 47, train_loss: 0.9220, test_loss: 1.0858, test_f1: 0.4557
 epoch: 48, train_loss: 0.9283, test_loss: 1.2336, test_f1: 0.4533
 epoch: 49, train_loss: 0.9231, test_loss: 1.1638, test_f1: 0.4554
 epoch: 50, train_loss: 0.9153, test_loss: 1.1334, test_f1: 0.4707
 epoch: 51, train_loss: 0.9097, test_loss: 1.0986, test_f1: 0.4843
 epoch: 52, train_loss: 0.9090, test_loss: 1.0387, test_f1: 0.4848
 epoch: 53, train_loss: 0.8933, test_loss: 1.0749, test_f1: 0.4902
 epoch: 54, train_loss: 0.8983, test_loss: 1.1760, test_f1: 0.4738
 epoch: 55, train_loss: 0.8879, test_loss: 1.2891, test_f1: 0.4715
 epoch: 56, train_loss: 0.8902, test_loss: 1.2561, test_f1: 0.4848
 epoch: 57, train_loss: 0.8818, test_loss: 1.2857, test_f1: 0.4851
 epoch: 58, train_loss: 0.8771, test_loss: 1.3995, test_f1: 0.4854
 epoch: 59, train_loss: 0.8857, test_loss: 1.1521, test_f1: 0.4962
 epoch: 60, train_loss: 0.8761, test_loss: 1.4794, test_f1: 0.4791
 epoch: 61, train_loss: 0.8833, test_loss: 1.1467, test_f1: 0.5039
 epoch: 62, train_loss: 0.8794, test_loss: 1.1850, test_f1: 0.4881
 epoch: 63, train_loss: 0.8832, test_loss: 1.1025, test_f1: 0.5081
 epoch: 64, train_loss: 0.8687, test_loss: 1.1330, test_f1: 0.5050
 epoch: 65, train_loss: 0.8742, test_loss: 1.2723, test_f1: 0.4789
 epoch: 66, train_loss: 0.8684, test_loss: 1.2133, test_f1: 0.4836
 epoch: 67, train_loss: 0.8691, test_loss: 1.2931, test_f1: 0.4837
 epoch: 68, train_loss: 0.8766, test_loss: 1.2877, test_f1: 0.4719
 epoch: 69, train_loss: 0.8864, test_loss: 1.2710, test_f1: 0.4881
 epoch: 70, train_loss: 0.8787, test_loss: 1.1573, test_f1: 0.4789
 epoch: 71, train_loss: 0.8820, test_loss: 1.1959, test_f1: 0.4880
 epoch: 72, train_loss: 0.8825, test_loss: 1.1955, test_f1: 0.5132
 epoch: 73, train_loss: 0.8680, test_loss: 1.1067, test_f1: 0.5241
 epoch: 74, train_loss: 0.8765, test_loss: 1.2570, test_f1: 0.5024
 epoch: 75, train_loss: 0.8667, test_loss: 1.4423, test_f1: 0.4835
 epoch: 76, train_loss: 0.8710, test_loss: 1.3426, test_f1: 0.4967
 epoch: 77, train_loss: 0.8848, test_loss: 1.2698, test_f1: 0.4828
 epoch: 78, train_loss: 0.8629, test_loss: 1.3712, test_f1: 0.4968
 epoch: 79, train_loss: 0.8899, test_loss: 1.3363, test_f1: 0.4875
 epoch: 80, train_loss: 0.8819, test_loss: 1.2847, test_f1: 0.5098
 epoch: 81, train_loss: 0.8634, test_loss: 1.2347, test_f1: 0.5059
 epoch: 82, train_loss: 0.8739, test_loss: 1.2240, test_f1: 0.5001
 epoch: 83, train_loss: 0.8698, test_loss: 1.3185, test_f1: 0.4991
 epoch: 84, train_loss: 0.8690, test_loss: 1.4318, test_f1: 0.4848
 epoch: 85, train_loss: 0.8690, test_loss: 1.3155, test_f1: 0.4880
 epoch: 86, train_loss: 0.8608, test_loss: 1.3570, test_f1: 0.5174
 epoch: 87, train_loss: 0.8465, test_loss: 1.2636, test_f1: 0.5026
 epoch: 88, train_loss: 0.8665, test_loss: 1.2641, test_f1: 0.4973
 epoch: 89, train_loss: 0.8527, test_loss: 1.4114, test_f1: 0.4925
 epoch: 90, train_loss: 0.8471, test_loss: 1.4261, test_f1: 0.4919
 epoch: 91, train_loss: 0.8598, test_loss: 1.3711, test_f1: 0.4985
 epoch: 92, train_loss: 0.8574, test_loss: 1.3178, test_f1: 0.4891
 epoch: 93, train_loss: 0.8689, test_loss: 1.1891, test_f1: 0.5069
 epoch: 94, train_loss: 0.8713, test_loss: 1.2481, test_f1: 0.4973
 epoch: 95, train_loss: 0.8419, test_loss: 1.2673, test_f1: 0.4775
 epoch: 96, train_loss: 0.8654, test_loss: 1.1195, test_f1: 0.4975
 epoch: 97, train_loss: 0.8451, test_loss: 1.0959, test_f1: 0.5190
 epoch: 98, train_loss: 0.8492, test_loss: 1.1452, test_f1: 0.4884
 epoch: 99, train_loss: 0.8541, test_loss: 1.2012, test_f1: 0.5057
##################ITERATION #3 ****************************************
 epoch: 0, train_loss: 1.2461, test_loss: 1.2609, test_f1: 0.3052
 epoch: 1, train_loss: 1.1686, test_loss: 1.0865, test_f1: 0.4280
 epoch: 2, train_loss: 1.1318, test_loss: 1.0488, test_f1: 0.3812
 epoch: 3, train_loss: 1.1044, test_loss: 1.0549, test_f1: 0.4630
 epoch: 4, train_loss: 1.0749, test_loss: 1.0148, test_f1: 0.4677
 epoch: 5, train_loss: 1.0650, test_loss: 1.0076, test_f1: 0.4866
 epoch: 6, train_loss: 1.0609, test_loss: 0.9602, test_f1: 0.4593
 epoch: 7, train_loss: 1.0226, test_loss: 1.0055, test_f1: 0.4520
 epoch: 8, train_loss: 1.0236, test_loss: 0.9689, test_f1: 0.4610
 epoch: 9, train_loss: 1.0148, test_loss: 1.0120, test_f1: 0.4577
 epoch: 10, train_loss: 0.9971, test_loss: 1.0112, test_f1: 0.4765
 epoch: 11, train_loss: 1.0228, test_loss: 0.9715, test_f1: 0.4675
 epoch: 12, train_loss: 1.0022, test_loss: 0.9670, test_f1: 0.4699
 epoch: 13, train_loss: 0.9960, test_loss: 1.0074, test_f1: 0.4774
 epoch: 14, train_loss: 0.9937, test_loss: 0.9938, test_f1: 0.4739
 epoch: 15, train_loss: 0.9944, test_loss: 1.0224, test_f1: 0.4679
 epoch: 16, train_loss: 1.0030, test_loss: 0.9616, test_f1: 0.4752
 epoch: 17, train_loss: 0.9745, test_loss: 1.0402, test_f1: 0.4604
 epoch: 18, train_loss: 0.9730, test_loss: 0.9953, test_f1: 0.4846
 epoch: 19, train_loss: 0.9655, test_loss: 0.9888, test_f1: 0.4830
 epoch: 20, train_loss: 0.9739, test_loss: 0.9764, test_f1: 0.4880
 epoch: 21, train_loss: 0.9810, test_loss: 1.0010, test_f1: 0.4992
 epoch: 22, train_loss: 0.9656, test_loss: 1.0111, test_f1: 0.4762
 epoch: 23, train_loss: 0.9638, test_loss: 1.0616, test_f1: 0.4683
 epoch: 24, train_loss: 0.9715, test_loss: 1.0101, test_f1: 0.4992
 epoch: 25, train_loss: 0.9653, test_loss: 1.0261, test_f1: 0.4715
 epoch: 26, train_loss: 0.9703, test_loss: 0.9737, test_f1: 0.4767
 epoch: 27, train_loss: 0.9477, test_loss: 1.0216, test_f1: 0.4766
 epoch: 28, train_loss: 0.9439, test_loss: 0.9498, test_f1: 0.4829
 epoch: 29, train_loss: 0.9547, test_loss: 0.9862, test_f1: 0.4690
 epoch: 30, train_loss: 0.9470, test_loss: 1.1028, test_f1: 0.4650
 epoch: 31, train_loss: 0.9482, test_loss: 0.9892, test_f1: 0.4991
 epoch: 32, train_loss: 0.9549, test_loss: 1.0062, test_f1: 0.4682
 epoch: 33, train_loss: 0.9507, test_loss: 1.2309, test_f1: 0.4629
 epoch: 34, train_loss: 0.9486, test_loss: 1.0048, test_f1: 0.4634
 epoch: 35, train_loss: 0.9498, test_loss: 1.0206, test_f1: 0.4873
 epoch: 36, train_loss: 0.9495, test_loss: 1.1566, test_f1: 0.4666
 epoch: 37, train_loss: 0.9364, test_loss: 1.0063, test_f1: 0.4952
 epoch: 38, train_loss: 0.9328, test_loss: 0.9950, test_f1: 0.4820
 epoch: 39, train_loss: 0.9417, test_loss: 0.9826, test_f1: 0.5156
 epoch: 40, train_loss: 0.9406, test_loss: 1.0266, test_f1: 0.4941
 epoch: 41, train_loss: 0.9333, test_loss: 1.0500, test_f1: 0.4890
 epoch: 42, train_loss: 0.9465, test_loss: 1.0454, test_f1: 0.4765
 epoch: 43, train_loss: 0.9335, test_loss: 0.9638, test_f1: 0.5066
 epoch: 44, train_loss: 0.9499, test_loss: 1.0162, test_f1: 0.4656
 epoch: 45, train_loss: 0.9340, test_loss: 0.9859, test_f1: 0.4957
 epoch: 46, train_loss: 0.9645, test_loss: 0.9710, test_f1: 0.4857
 epoch: 47, train_loss: 0.9458, test_loss: 1.0307, test_f1: 0.4890
 epoch: 48, train_loss: 0.9428, test_loss: 1.0158, test_f1: 0.4779
 epoch: 49, train_loss: 0.9473, test_loss: 1.0322, test_f1: 0.4716
 epoch: 50, train_loss: 0.9370, test_loss: 0.9671, test_f1: 0.4941
 epoch: 51, train_loss: 0.9289, test_loss: 1.0516, test_f1: 0.4926
 epoch: 52, train_loss: 0.9161, test_loss: 1.0381, test_f1: 0.4949
 epoch: 53, train_loss: 0.9146, test_loss: 0.9646, test_f1: 0.5079
 epoch: 54, train_loss: 0.9163, test_loss: 0.9517, test_f1: 0.5301
 epoch: 55, train_loss: 0.9122, test_loss: 1.0312, test_f1: 0.5050
 epoch: 56, train_loss: 0.9123, test_loss: 0.9738, test_f1: 0.4880
 epoch: 57, train_loss: 0.9050, test_loss: 1.0274, test_f1: 0.4863
 epoch: 58, train_loss: 0.9038, test_loss: 1.0149, test_f1: 0.5101
 epoch: 59, train_loss: 0.8980, test_loss: 0.9940, test_f1: 0.4934
 epoch: 60, train_loss: 0.9018, test_loss: 0.9490, test_f1: 0.4888
 epoch: 61, train_loss: 0.8915, test_loss: 0.9699, test_f1: 0.4896
 epoch: 62, train_loss: 0.9088, test_loss: 1.1234, test_f1: 0.4900
 epoch: 63, train_loss: 0.9024, test_loss: 1.0759, test_f1: 0.5021
 epoch: 64, train_loss: 0.8887, test_loss: 0.9658, test_f1: 0.5081
 epoch: 65, train_loss: 0.8980, test_loss: 0.9983, test_f1: 0.4964
 epoch: 66, train_loss: 0.8938, test_loss: 0.9817, test_f1: 0.4998
 epoch: 67, train_loss: 0.8857, test_loss: 0.9994, test_f1: 0.5229
 epoch: 68, train_loss: 0.8835, test_loss: 0.9373, test_f1: 0.5099
 epoch: 69, train_loss: 0.8897, test_loss: 0.9578, test_f1: 0.5155
 epoch: 70, train_loss: 0.8941, test_loss: 0.9721, test_f1: 0.5151
 epoch: 71, train_loss: 0.8875, test_loss: 1.0004, test_f1: 0.5154
 epoch: 72, train_loss: 0.8810, test_loss: 0.9962, test_f1: 0.4957
 epoch: 73, train_loss: 0.8872, test_loss: 1.0009, test_f1: 0.5019
 epoch: 74, train_loss: 0.8848, test_loss: 0.9893, test_f1: 0.5146
 epoch: 75, train_loss: 0.8796, test_loss: 0.9309, test_f1: 0.5113
 epoch: 76, train_loss: 0.8805, test_loss: 1.0150, test_f1: 0.5050
 epoch: 77, train_loss: 0.8826, test_loss: 0.9645, test_f1: 0.5042
 epoch: 78, train_loss: 0.8807, test_loss: 0.9696, test_f1: 0.5032
 epoch: 79, train_loss: 0.8708, test_loss: 1.0131, test_f1: 0.5119
 epoch: 80, train_loss: 0.8790, test_loss: 0.9253, test_f1: 0.5315
 epoch: 81, train_loss: 0.8783, test_loss: 1.0573, test_f1: 0.4829
 epoch: 82, train_loss: 0.8688, test_loss: 0.9809, test_f1: 0.5268
 epoch: 83, train_loss: 0.8764, test_loss: 0.9522, test_f1: 0.5297
 epoch: 84, train_loss: 0.8813, test_loss: 1.0516, test_f1: 0.4954
 epoch: 85, train_loss: 0.8771, test_loss: 1.0001, test_f1: 0.4957
 epoch: 86, train_loss: 0.8672, test_loss: 0.9574, test_f1: 0.5270
 epoch: 87, train_loss: 0.8820, test_loss: 0.9623, test_f1: 0.5290
 epoch: 88, train_loss: 0.8736, test_loss: 1.1665, test_f1: 0.5004
 epoch: 89, train_loss: 0.8836, test_loss: 1.0568, test_f1: 0.5096
 epoch: 90, train_loss: 0.8657, test_loss: 1.0080, test_f1: 0.4985
 epoch: 91, train_loss: 0.8631, test_loss: 1.0109, test_f1: 0.5175
 epoch: 92, train_loss: 0.9046, test_loss: 0.9855, test_f1: 0.5054
 epoch: 93, train_loss: 0.9586, test_loss: 0.9878, test_f1: 0.5085
 epoch: 94, train_loss: 0.9008, test_loss: 1.1017, test_f1: 0.5002
 epoch: 95, train_loss: 0.8874, test_loss: 1.0226, test_f1: 0.4646
 epoch: 96, train_loss: 0.8949, test_loss: 0.9313, test_f1: 0.5251
 epoch: 97, train_loss: 0.8727, test_loss: 0.9484, test_f1: 0.5139
 epoch: 98, train_loss: 0.8678, test_loss: 0.9473, test_f1: 0.5188
 epoch: 99, train_loss: 0.8783, test_loss: 0.9852, test_f1: 0.5141
##################ITERATION #4 ****************************************
 epoch: 0, train_loss: 1.2699, test_loss: 1.1471, test_f1: 0.4195
 epoch: 1, train_loss: 1.1492, test_loss: 1.0573, test_f1: 0.4327
 epoch: 2, train_loss: 1.0870, test_loss: 0.9724, test_f1: 0.4402
 epoch: 3, train_loss: 1.0667, test_loss: 1.1289, test_f1: 0.4535
 epoch: 4, train_loss: 1.0407, test_loss: 0.9771, test_f1: 0.5010
 epoch: 5, train_loss: 1.0239, test_loss: 1.0174, test_f1: 0.5003
 epoch: 6, train_loss: 1.0162, test_loss: 0.9806, test_f1: 0.4797
 epoch: 7, train_loss: 1.0157, test_loss: 1.0475, test_f1: 0.4567
 epoch: 8, train_loss: 1.0030, test_loss: 1.0582, test_f1: 0.4279
 epoch: 9, train_loss: 0.9966, test_loss: 0.9955, test_f1: 0.4642
 epoch: 10, train_loss: 0.9867, test_loss: 0.9890, test_f1: 0.4817
 epoch: 11, train_loss: 0.9822, test_loss: 1.0022, test_f1: 0.4865
 epoch: 12, train_loss: 0.9745, test_loss: 1.0031, test_f1: 0.4974
 epoch: 13, train_loss: 0.9770, test_loss: 0.9950, test_f1: 0.4916
 epoch: 14, train_loss: 0.9617, test_loss: 0.9872, test_f1: 0.4760
 epoch: 15, train_loss: 0.9647, test_loss: 1.0012, test_f1: 0.4861
 epoch: 16, train_loss: 0.9492, test_loss: 0.9931, test_f1: 0.4979
 epoch: 17, train_loss: 0.9438, test_loss: 0.9818, test_f1: 0.5053
 epoch: 18, train_loss: 0.9532, test_loss: 1.0256, test_f1: 0.5051
 epoch: 19, train_loss: 0.9477, test_loss: 0.9944, test_f1: 0.4761
 epoch: 20, train_loss: 0.9720, test_loss: 1.0010, test_f1: 0.4798
 epoch: 21, train_loss: 0.9521, test_loss: 0.9902, test_f1: 0.5117
 epoch: 22, train_loss: 0.9537, test_loss: 0.9622, test_f1: 0.5039
 epoch: 23, train_loss: 0.9430, test_loss: 1.0204, test_f1: 0.4852
 epoch: 24, train_loss: 0.9321, test_loss: 1.0732, test_f1: 0.4846
 epoch: 25, train_loss: 0.9350, test_loss: 0.9851, test_f1: 0.4884
 epoch: 26, train_loss: 0.9436, test_loss: 0.9352, test_f1: 0.5127
 epoch: 27, train_loss: 0.9457, test_loss: 0.9312, test_f1: 0.5253
 epoch: 28, train_loss: 0.9270, test_loss: 0.9488, test_f1: 0.5019
 epoch: 29, train_loss: 0.9351, test_loss: 0.9267, test_f1: 0.5194
 epoch: 30, train_loss: 0.9266, test_loss: 1.0340, test_f1: 0.4711
 epoch: 31, train_loss: 0.9321, test_loss: 0.9534, test_f1: 0.5141
 epoch: 32, train_loss: 0.9269, test_loss: 1.0540, test_f1: 0.4653
 epoch: 33, train_loss: 0.9230, test_loss: 1.0332, test_f1: 0.4798
 epoch: 34, train_loss: 0.9220, test_loss: 0.9651, test_f1: 0.5191
 epoch: 35, train_loss: 0.9757, test_loss: 1.1335, test_f1: 0.4776
 epoch: 36, train_loss: 0.9358, test_loss: 0.9806, test_f1: 0.4954
 epoch: 37, train_loss: 0.9233, test_loss: 0.9874, test_f1: 0.4866
 epoch: 38, train_loss: 0.9458, test_loss: 0.9736, test_f1: 0.5085
 epoch: 39, train_loss: 0.9212, test_loss: 0.9476, test_f1: 0.5058
 epoch: 40, train_loss: 0.9183, test_loss: 0.9733, test_f1: 0.4835
 epoch: 41, train_loss: 0.9232, test_loss: 0.9763, test_f1: 0.5005
 epoch: 42, train_loss: 0.9140, test_loss: 0.9733, test_f1: 0.5242
 epoch: 43, train_loss: 0.9308, test_loss: 0.9946, test_f1: 0.5068
 epoch: 44, train_loss: 0.9111, test_loss: 0.9601, test_f1: 0.5108
 epoch: 45, train_loss: 0.9150, test_loss: 0.9517, test_f1: 0.5017
 epoch: 46, train_loss: 0.9289, test_loss: 1.0578, test_f1: 0.4785
 epoch: 47, train_loss: 0.9118, test_loss: 0.9744, test_f1: 0.5062
 epoch: 48, train_loss: 0.9253, test_loss: 1.0777, test_f1: 0.4795
 epoch: 49, train_loss: 0.9096, test_loss: 0.9462, test_f1: 0.5156
 epoch: 50, train_loss: 0.9349, test_loss: 1.0006, test_f1: 0.4943
 epoch: 51, train_loss: 0.9100, test_loss: 1.0019, test_f1: 0.4953
 epoch: 52, train_loss: 0.8959, test_loss: 0.9954, test_f1: 0.4826
 epoch: 53, train_loss: 0.8825, test_loss: 0.9576, test_f1: 0.5068
 epoch: 54, train_loss: 0.8811, test_loss: 0.9487, test_f1: 0.5194
 epoch: 55, train_loss: 0.8824, test_loss: 0.9554, test_f1: 0.5183
 epoch: 56, train_loss: 0.8814, test_loss: 0.9553, test_f1: 0.4997
 epoch: 57, train_loss: 0.8883, test_loss: 0.9795, test_f1: 0.4992
 epoch: 58, train_loss: 0.8803, test_loss: 0.9976, test_f1: 0.4947
 epoch: 59, train_loss: 0.8810, test_loss: 0.9757, test_f1: 0.4924
 epoch: 60, train_loss: 0.8815, test_loss: 0.9323, test_f1: 0.5238
 epoch: 61, train_loss: 0.8768, test_loss: 1.0017, test_f1: 0.4792
 epoch: 62, train_loss: 0.8823, test_loss: 1.0633, test_f1: 0.4787
 epoch: 63, train_loss: 0.8733, test_loss: 1.0392, test_f1: 0.4899
 epoch: 64, train_loss: 0.8636, test_loss: 0.9702, test_f1: 0.5220
 epoch: 65, train_loss: 0.8741, test_loss: 0.9642, test_f1: 0.5125
 epoch: 66, train_loss: 0.8706, test_loss: 0.9396, test_f1: 0.5181
 epoch: 67, train_loss: 0.8831, test_loss: 0.9897, test_f1: 0.5097
 epoch: 68, train_loss: 0.8627, test_loss: 1.0115, test_f1: 0.5026
 epoch: 69, train_loss: 0.8693, test_loss: 0.9956, test_f1: 0.4943
 epoch: 70, train_loss: 0.8680, test_loss: 0.9560, test_f1: 0.5143
 epoch: 71, train_loss: 0.8725, test_loss: 0.9592, test_f1: 0.4970
 epoch: 72, train_loss: 0.8616, test_loss: 0.9530, test_f1: 0.4970
 epoch: 73, train_loss: 0.8628, test_loss: 1.2246, test_f1: 0.4725
 epoch: 74, train_loss: 0.8646, test_loss: 0.9949, test_f1: 0.4846
 epoch: 75, train_loss: 0.8767, test_loss: 1.0651, test_f1: 0.4784
 epoch: 76, train_loss: 0.8627, test_loss: 0.9581, test_f1: 0.5140
 epoch: 77, train_loss: 0.8656, test_loss: 0.9920, test_f1: 0.4931
 epoch: 78, train_loss: 0.8721, test_loss: 0.9475, test_f1: 0.5180
 epoch: 79, train_loss: 0.8509, test_loss: 0.9688, test_f1: 0.5104
 epoch: 80, train_loss: 0.8669, test_loss: 0.9966, test_f1: 0.5017
 epoch: 81, train_loss: 0.8524, test_loss: 0.9934, test_f1: 0.5157
 epoch: 82, train_loss: 0.8550, test_loss: 0.9620, test_f1: 0.5170
 epoch: 83, train_loss: 0.8586, test_loss: 0.9773, test_f1: 0.5145
 epoch: 84, train_loss: 0.8595, test_loss: 0.9840, test_f1: 0.5054
 epoch: 85, train_loss: 0.8705, test_loss: 0.9786, test_f1: 0.5090
 epoch: 86, train_loss: 0.8584, test_loss: 0.9674, test_f1: 0.5155
 epoch: 87, train_loss: 0.8760, test_loss: 1.0168, test_f1: 0.5085
 epoch: 88, train_loss: 0.8718, test_loss: 0.9847, test_f1: 0.5092
 epoch: 89, train_loss: 0.8469, test_loss: 0.9587, test_f1: 0.5146
 epoch: 90, train_loss: 0.8715, test_loss: 0.9616, test_f1: 0.5009
 epoch: 91, train_loss: 0.8627, test_loss: 0.9711, test_f1: 0.5162
 epoch: 92, train_loss: 0.8690, test_loss: 0.9732, test_f1: 0.5164
 epoch: 93, train_loss: 0.8530, test_loss: 0.9880, test_f1: 0.5138
 epoch: 94, train_loss: 0.8614, test_loss: 1.0280, test_f1: 0.5076
 epoch: 95, train_loss: 0.8582, test_loss: 1.0875, test_f1: 0.5242
 epoch: 96, train_loss: 0.8597, test_loss: 0.9893, test_f1: 0.5111
 epoch: 97, train_loss: 0.8562, test_loss: 0.9729, test_f1: 0.5339
 epoch: 98, train_loss: 0.8637, test_loss: 1.0040, test_f1: 0.5480
 epoch: 99, train_loss: 0.8668, test_loss: 0.9573, test_f1: 0.5481
##################ITERATION #5 ****************************************
 epoch: 0, train_loss: 1.2935, test_loss: 1.2402, test_f1: 0.2397
 epoch: 1, train_loss: 1.2157, test_loss: 1.1561, test_f1: 0.3378
 epoch: 2, train_loss: 1.1804, test_loss: 1.1381, test_f1: 0.3479
 epoch: 3, train_loss: 1.1265, test_loss: 1.0814, test_f1: 0.4098
 epoch: 4, train_loss: 1.1199, test_loss: 1.0783, test_f1: 0.3691
 epoch: 5, train_loss: 1.0934, test_loss: 0.9422, test_f1: 0.4989
 epoch: 6, train_loss: 1.0465, test_loss: 0.9738, test_f1: 0.4661
 epoch: 7, train_loss: 1.0287, test_loss: 0.9904, test_f1: 0.4698
 epoch: 8, train_loss: 1.0158, test_loss: 0.9243, test_f1: 0.4862
 epoch: 9, train_loss: 1.0013, test_loss: 0.9304, test_f1: 0.4933
 epoch: 10, train_loss: 0.9808, test_loss: 0.9726, test_f1: 0.4761
 epoch: 11, train_loss: 0.9703, test_loss: 1.0322, test_f1: 0.4906
 epoch: 12, train_loss: 1.0630, test_loss: 0.9531, test_f1: 0.4912
 epoch: 13, train_loss: 1.0162, test_loss: 0.9288, test_f1: 0.4700
 epoch: 14, train_loss: 0.9979, test_loss: 0.9256, test_f1: 0.4964
 epoch: 15, train_loss: 0.9819, test_loss: 0.9223, test_f1: 0.5078
 epoch: 16, train_loss: 0.9957, test_loss: 0.9074, test_f1: 0.5065
 epoch: 17, train_loss: 0.9697, test_loss: 0.9863, test_f1: 0.5007
 epoch: 18, train_loss: 0.9760, test_loss: 0.9191, test_f1: 0.4912
 epoch: 19, train_loss: 0.9685, test_loss: 0.9336, test_f1: 0.4886
 epoch: 20, train_loss: 0.9785, test_loss: 0.9363, test_f1: 0.5058
 epoch: 21, train_loss: 0.9550, test_loss: 0.9670, test_f1: 0.4614
 epoch: 22, train_loss: 0.9534, test_loss: 0.9696, test_f1: 0.4879
 epoch: 23, train_loss: 0.9504, test_loss: 0.9425, test_f1: 0.4865
 epoch: 24, train_loss: 0.9501, test_loss: 0.9224, test_f1: 0.4974
 epoch: 25, train_loss: 0.9312, test_loss: 0.9866, test_f1: 0.5024
 epoch: 26, train_loss: 0.9432, test_loss: 0.9535, test_f1: 0.4990
 epoch: 27, train_loss: 0.9370, test_loss: 1.0022, test_f1: 0.4806
 epoch: 28, train_loss: 0.9347, test_loss: 1.0177, test_f1: 0.5057
 epoch: 29, train_loss: 0.9312, test_loss: 0.9703, test_f1: 0.5118
 epoch: 30, train_loss: 0.9677, test_loss: 0.9650, test_f1: 0.4807
 epoch: 31, train_loss: 0.9406, test_loss: 0.9532, test_f1: 0.5000
 epoch: 32, train_loss: 0.9320, test_loss: 0.9586, test_f1: 0.4866
 epoch: 33, train_loss: 0.9250, test_loss: 1.0104, test_f1: 0.4864
 epoch: 34, train_loss: 0.9702, test_loss: 0.9664, test_f1: 0.4827
 epoch: 35, train_loss: 0.9582, test_loss: 1.0056, test_f1: 0.4794
 epoch: 36, train_loss: 0.9646, test_loss: 1.0214, test_f1: 0.4569
 epoch: 37, train_loss: 0.9626, test_loss: 0.9701, test_f1: 0.4927
 epoch: 38, train_loss: 0.9425, test_loss: 1.0022, test_f1: 0.4829
 epoch: 39, train_loss: 0.9322, test_loss: 0.9752, test_f1: 0.5023
 epoch: 40, train_loss: 0.9322, test_loss: 0.9586, test_f1: 0.4853
 epoch: 41, train_loss: 0.9229, test_loss: 0.9166, test_f1: 0.5130
 epoch: 42, train_loss: 0.9317, test_loss: 0.9408, test_f1: 0.5087
 epoch: 43, train_loss: 0.9298, test_loss: 0.9258, test_f1: 0.4950
 epoch: 44, train_loss: 0.9265, test_loss: 0.9740, test_f1: 0.4913
 epoch: 45, train_loss: 0.9245, test_loss: 0.9280, test_f1: 0.4962
 epoch: 46, train_loss: 0.9293, test_loss: 0.9524, test_f1: 0.4753
 epoch: 47, train_loss: 0.9216, test_loss: 1.1043, test_f1: 0.4245
 epoch: 48, train_loss: 0.9699, test_loss: 0.9266, test_f1: 0.4981
 epoch: 49, train_loss: 0.9107, test_loss: 0.9292, test_f1: 0.5039
 epoch: 50, train_loss: 0.9241, test_loss: 0.9314, test_f1: 0.5098
 epoch: 51, train_loss: 0.9150, test_loss: 0.9185, test_f1: 0.5080
 epoch: 52, train_loss: 0.9169, test_loss: 0.9167, test_f1: 0.5056
 epoch: 53, train_loss: 0.9078, test_loss: 0.9329, test_f1: 0.5228
 epoch: 54, train_loss: 0.9042, test_loss: 0.9735, test_f1: 0.5220
 epoch: 55, train_loss: 0.9027, test_loss: 0.9140, test_f1: 0.5265
 epoch: 56, train_loss: 0.8923, test_loss: 0.9219, test_f1: 0.5066
 epoch: 57, train_loss: 0.8909, test_loss: 0.9297, test_f1: 0.5079
 epoch: 58, train_loss: 0.8984, test_loss: 0.9162, test_f1: 0.5148
 epoch: 59, train_loss: 0.8784, test_loss: 0.9363, test_f1: 0.5277
 epoch: 60, train_loss: 0.8823, test_loss: 0.9288, test_f1: 0.5276
 epoch: 61, train_loss: 0.8926, test_loss: 0.9521, test_f1: 0.5502
 epoch: 62, train_loss: 0.8847, test_loss: 0.9427, test_f1: 0.5371
 epoch: 63, train_loss: 0.8872, test_loss: 0.9688, test_f1: 0.5303
 epoch: 64, train_loss: 0.8939, test_loss: 0.9645, test_f1: 0.5064
 epoch: 65, train_loss: 0.8782, test_loss: 0.9750, test_f1: 0.5354
 epoch: 66, train_loss: 0.8794, test_loss: 0.9897, test_f1: 0.5176
 epoch: 67, train_loss: 0.8838, test_loss: 0.9145, test_f1: 0.5289
 epoch: 68, train_loss: 0.8732, test_loss: 0.9238, test_f1: 0.5292
 epoch: 69, train_loss: 0.8765, test_loss: 0.9256, test_f1: 0.5540
 epoch: 70, train_loss: 0.8798, test_loss: 0.9441, test_f1: 0.5298
 epoch: 71, train_loss: 0.8978, test_loss: 0.9322, test_f1: 0.5228
 epoch: 72, train_loss: 0.8855, test_loss: 0.9005, test_f1: 0.5130
 epoch: 73, train_loss: 0.8726, test_loss: 0.9260, test_f1: 0.5180
 epoch: 74, train_loss: 0.8707, test_loss: 0.9207, test_f1: 0.5449
 epoch: 75, train_loss: 0.8676, test_loss: 0.9250, test_f1: 0.5564
 epoch: 76, train_loss: 0.8794, test_loss: 0.9427, test_f1: 0.5173
 epoch: 77, train_loss: 0.8740, test_loss: 0.9364, test_f1: 0.5296
 epoch: 78, train_loss: 0.8629, test_loss: 0.9721, test_f1: 0.5169
 epoch: 79, train_loss: 0.8582, test_loss: 0.9986, test_f1: 0.5165
 epoch: 80, train_loss: 0.8786, test_loss: 0.9330, test_f1: 0.5089
 epoch: 81, train_loss: 0.8822, test_loss: 0.9367, test_f1: 0.5469
 epoch: 82, train_loss: 0.8706, test_loss: 0.9432, test_f1: 0.5558
 epoch: 83, train_loss: 0.8620, test_loss: 0.9052, test_f1: 0.5590
 epoch: 84, train_loss: 0.8735, test_loss: 0.8985, test_f1: 0.5324
 epoch: 85, train_loss: 0.8632, test_loss: 0.9363, test_f1: 0.5040
 epoch: 86, train_loss: 0.8700, test_loss: 0.9211, test_f1: 0.5409
 epoch: 87, train_loss: 0.8777, test_loss: 0.9107, test_f1: 0.5569
 epoch: 88, train_loss: 0.8699, test_loss: 0.9291, test_f1: 0.5445
 epoch: 89, train_loss: 0.8679, test_loss: 0.9422, test_f1: 0.5449
 epoch: 90, train_loss: 0.8882, test_loss: 0.9599, test_f1: 0.5057
 epoch: 91, train_loss: 0.8774, test_loss: 0.9304, test_f1: 0.5574
 epoch: 92, train_loss: 0.8605, test_loss: 0.9435, test_f1: 0.5235
 epoch: 93, train_loss: 0.8603, test_loss: 0.9428, test_f1: 0.5106
 epoch: 94, train_loss: 0.8582, test_loss: 0.9130, test_f1: 0.5586
 epoch: 95, train_loss: 0.8492, test_loss: 0.9241, test_f1: 0.5440
 epoch: 96, train_loss: 0.8581, test_loss: 0.9161, test_f1: 0.5388
 epoch: 97, train_loss: 0.8561, test_loss: 0.9257, test_f1: 0.5839
 epoch: 98, train_loss: 0.8707, test_loss: 0.9550, test_f1: 0.5082
 epoch: 99, train_loss: 0.8511, test_loss: 0.9343, test_f1: 0.4910
##################ITERATION #6 ****************************************
 epoch: 0, train_loss: 1.2819, test_loss: 1.2518, test_f1: 0.2737
 epoch: 1, train_loss: 1.2413, test_loss: 1.1912, test_f1: 0.3245
 epoch: 2, train_loss: 1.2064, test_loss: 1.1370, test_f1: 0.4297
 epoch: 3, train_loss: 1.1735, test_loss: 1.1053, test_f1: 0.3866
 epoch: 4, train_loss: 1.1372, test_loss: 1.0828, test_f1: 0.3401
 epoch: 5, train_loss: 1.1399, test_loss: 1.0839, test_f1: 0.3608
 epoch: 6, train_loss: 1.1193, test_loss: 1.0869, test_f1: 0.4063
 epoch: 7, train_loss: 1.1109, test_loss: 1.1048, test_f1: 0.3352
 epoch: 8, train_loss: 1.0982, test_loss: 1.0770, test_f1: 0.4312
 epoch: 9, train_loss: 1.0855, test_loss: 1.1045, test_f1: 0.4396
 epoch: 10, train_loss: 1.0920, test_loss: 1.0794, test_f1: 0.4123
 epoch: 11, train_loss: 1.0575, test_loss: 1.1159, test_f1: 0.4653
 epoch: 12, train_loss: 1.0303, test_loss: 1.1450, test_f1: 0.4609
 epoch: 13, train_loss: 1.0399, test_loss: 1.1477, test_f1: 0.4396
 epoch: 14, train_loss: 1.0138, test_loss: 1.0232, test_f1: 0.4517
 epoch: 15, train_loss: 1.0409, test_loss: 0.9435, test_f1: 0.4556
 epoch: 16, train_loss: 1.0169, test_loss: 0.9996, test_f1: 0.4535
 epoch: 17, train_loss: 0.9931, test_loss: 1.0994, test_f1: 0.4506
 epoch: 18, train_loss: 0.9870, test_loss: 1.0542, test_f1: 0.4758
 epoch: 19, train_loss: 0.9973, test_loss: 0.9498, test_f1: 0.4535
 epoch: 20, train_loss: 0.9949, test_loss: 1.0707, test_f1: 0.4339
 epoch: 21, train_loss: 0.9763, test_loss: 1.0248, test_f1: 0.4650
 epoch: 22, train_loss: 0.9820, test_loss: 1.0485, test_f1: 0.4531
 epoch: 23, train_loss: 0.9810, test_loss: 1.1446, test_f1: 0.4676
 epoch: 24, train_loss: 0.9730, test_loss: 1.0873, test_f1: 0.4459
 epoch: 25, train_loss: 0.9644, test_loss: 1.0762, test_f1: 0.4549
 epoch: 26, train_loss: 0.9643, test_loss: 0.9869, test_f1: 0.4817
 epoch: 27, train_loss: 0.9742, test_loss: 1.0739, test_f1: 0.4748
 epoch: 28, train_loss: 0.9692, test_loss: 1.1004, test_f1: 0.4622
 epoch: 29, train_loss: 0.9717, test_loss: 1.1254, test_f1: 0.4363
 epoch: 30, train_loss: 0.9568, test_loss: 1.0512, test_f1: 0.4890
 epoch: 31, train_loss: 0.9669, test_loss: 1.1396, test_f1: 0.4192
 epoch: 32, train_loss: 0.9585, test_loss: 1.0259, test_f1: 0.4504
 epoch: 33, train_loss: 0.9552, test_loss: 1.1050, test_f1: 0.4560
 epoch: 34, train_loss: 0.9636, test_loss: 1.0966, test_f1: 0.4589
 epoch: 35, train_loss: 0.9478, test_loss: 1.0694, test_f1: 0.4638
 epoch: 36, train_loss: 0.9413, test_loss: 1.1088, test_f1: 0.4799
 epoch: 37, train_loss: 0.9517, test_loss: 1.0700, test_f1: 0.4596
 epoch: 38, train_loss: 0.9511, test_loss: 1.0854, test_f1: 0.4549
 epoch: 39, train_loss: 0.9428, test_loss: 1.0223, test_f1: 0.4503
 epoch: 40, train_loss: 0.9448, test_loss: 1.0087, test_f1: 0.4495
 epoch: 41, train_loss: 0.9367, test_loss: 1.0875, test_f1: 0.4488
 epoch: 42, train_loss: 0.9584, test_loss: 1.0759, test_f1: 0.4530
 epoch: 43, train_loss: 0.9346, test_loss: 1.0970, test_f1: 0.4469
 epoch: 44, train_loss: 0.9585, test_loss: 1.0336, test_f1: 0.4719
 epoch: 45, train_loss: 0.9266, test_loss: 1.0636, test_f1: 0.4917
 epoch: 46, train_loss: 0.9352, test_loss: 1.0252, test_f1: 0.4858
 epoch: 47, train_loss: 0.9297, test_loss: 1.0608, test_f1: 0.4726
 epoch: 48, train_loss: 0.9501, test_loss: 0.9959, test_f1: 0.4724
 epoch: 49, train_loss: 0.9281, test_loss: 0.9565, test_f1: 0.5023
 epoch: 50, train_loss: 0.9296, test_loss: 0.9806, test_f1: 0.5046
 epoch: 51, train_loss: 0.9093, test_loss: 0.9803, test_f1: 0.4927
 epoch: 52, train_loss: 0.9100, test_loss: 0.9711, test_f1: 0.4791
 epoch: 53, train_loss: 0.8963, test_loss: 0.9548, test_f1: 0.4849
 epoch: 54, train_loss: 0.9112, test_loss: 1.0191, test_f1: 0.4964
 epoch: 55, train_loss: 0.8987, test_loss: 1.0391, test_f1: 0.4904
 epoch: 56, train_loss: 0.8928, test_loss: 1.0615, test_f1: 0.5057
 epoch: 57, train_loss: 0.8855, test_loss: 1.0171, test_f1: 0.5036
 epoch: 58, train_loss: 0.8978, test_loss: 1.0064, test_f1: 0.4822
 epoch: 59, train_loss: 0.8997, test_loss: 1.0264, test_f1: 0.4996
 epoch: 60, train_loss: 0.8947, test_loss: 1.0282, test_f1: 0.5064
 epoch: 61, train_loss: 0.9054, test_loss: 1.0754, test_f1: 0.5120
 epoch: 62, train_loss: 0.8813, test_loss: 1.0461, test_f1: 0.4944
 epoch: 63, train_loss: 0.8961, test_loss: 1.0983, test_f1: 0.4733
 epoch: 64, train_loss: 0.8949, test_loss: 1.0499, test_f1: 0.4766
 epoch: 65, train_loss: 0.8827, test_loss: 1.0450, test_f1: 0.5185
 epoch: 66, train_loss: 0.8852, test_loss: 1.0490, test_f1: 0.4931
 epoch: 67, train_loss: 0.8841, test_loss: 1.0565, test_f1: 0.5066
 epoch: 68, train_loss: 0.8810, test_loss: 1.0542, test_f1: 0.5063
 epoch: 69, train_loss: 0.8951, test_loss: 1.0710, test_f1: 0.4752
 epoch: 70, train_loss: 0.8711, test_loss: 1.0522, test_f1: 0.4949
 epoch: 71, train_loss: 0.8733, test_loss: 1.0415, test_f1: 0.4794
 epoch: 72, train_loss: 0.8821, test_loss: 1.0457, test_f1: 0.4767
 epoch: 73, train_loss: 0.8747, test_loss: 1.0161, test_f1: 0.4896
 epoch: 74, train_loss: 0.8752, test_loss: 1.0353, test_f1: 0.4961
 epoch: 75, train_loss: 0.8673, test_loss: 1.0831, test_f1: 0.4741
 epoch: 76, train_loss: 0.8737, test_loss: 1.0642, test_f1: 0.4952
 epoch: 77, train_loss: 0.8766, test_loss: 1.1041, test_f1: 0.4857
 epoch: 78, train_loss: 0.8759, test_loss: 0.9958, test_f1: 0.4991
 epoch: 79, train_loss: 0.8687, test_loss: 1.0498, test_f1: 0.4880
 epoch: 80, train_loss: 0.8663, test_loss: 1.0205, test_f1: 0.5129
 epoch: 81, train_loss: 0.8745, test_loss: 1.0102, test_f1: 0.5129
 epoch: 82, train_loss: 0.8696, test_loss: 0.9699, test_f1: 0.5115
 epoch: 83, train_loss: 0.8870, test_loss: 0.9891, test_f1: 0.4922
 epoch: 84, train_loss: 0.8622, test_loss: 0.9980, test_f1: 0.4908
 epoch: 85, train_loss: 0.8727, test_loss: 0.9853, test_f1: 0.5023
 epoch: 86, train_loss: 0.8630, test_loss: 1.0518, test_f1: 0.4901
 epoch: 87, train_loss: 0.8729, test_loss: 1.0044, test_f1: 0.5043
 epoch: 88, train_loss: 0.8590, test_loss: 1.0141, test_f1: 0.5093
 epoch: 89, train_loss: 0.8716, test_loss: 0.9975, test_f1: 0.4898
 epoch: 90, train_loss: 0.8620, test_loss: 1.1012, test_f1: 0.5043
 epoch: 91, train_loss: 0.8444, test_loss: 1.1064, test_f1: 0.5064
 epoch: 92, train_loss: 0.8614, test_loss: 1.0155, test_f1: 0.5247
 epoch: 93, train_loss: 0.8701, test_loss: 1.0675, test_f1: 0.4948
 epoch: 94, train_loss: 0.8585, test_loss: 1.0346, test_f1: 0.4870
 epoch: 95, train_loss: 0.8558, test_loss: 1.2134, test_f1: 0.4663
 epoch: 96, train_loss: 0.8785, test_loss: 0.9550, test_f1: 0.5054
 epoch: 97, train_loss: 0.8534, test_loss: 1.0459, test_f1: 0.4904
 epoch: 98, train_loss: 0.8600, test_loss: 1.0147, test_f1: 0.4983
 epoch: 99, train_loss: 0.8550, test_loss: 1.1359, test_f1: 0.4823
##################ITERATION #7 ****************************************
 epoch: 0, train_loss: 1.2693, test_loss: 1.1810, test_f1: 0.3887
 epoch: 1, train_loss: 1.2097, test_loss: 1.1217, test_f1: 0.4530
 epoch: 2, train_loss: 1.1690, test_loss: 1.0922, test_f1: 0.4360
 epoch: 3, train_loss: 1.1351, test_loss: 1.0109, test_f1: 0.4674
 epoch: 4, train_loss: 1.0968, test_loss: 1.0299, test_f1: 0.4434
 epoch: 5, train_loss: 1.0657, test_loss: 0.9975, test_f1: 0.4427
 epoch: 6, train_loss: 1.0412, test_loss: 0.9124, test_f1: 0.5092
 epoch: 7, train_loss: 1.0393, test_loss: 0.9629, test_f1: 0.4872
 epoch: 8, train_loss: 1.0389, test_loss: 0.9314, test_f1: 0.4721
 epoch: 9, train_loss: 1.0294, test_loss: 1.0018, test_f1: 0.4929
 epoch: 10, train_loss: 1.0337, test_loss: 0.9862, test_f1: 0.4666
 epoch: 11, train_loss: 1.0086, test_loss: 0.9934, test_f1: 0.4856
 epoch: 12, train_loss: 0.9905, test_loss: 0.9907, test_f1: 0.4996
 epoch: 13, train_loss: 0.9793, test_loss: 0.9536, test_f1: 0.4948
 epoch: 14, train_loss: 0.9886, test_loss: 0.9719, test_f1: 0.4812
 epoch: 15, train_loss: 0.9829, test_loss: 0.9672, test_f1: 0.4822
 epoch: 16, train_loss: 0.9891, test_loss: 0.9971, test_f1: 0.4560
 epoch: 17, train_loss: 0.9719, test_loss: 0.9709, test_f1: 0.4896
 epoch: 18, train_loss: 0.9539, test_loss: 0.9557, test_f1: 0.4762
 epoch: 19, train_loss: 0.9528, test_loss: 0.9846, test_f1: 0.5190
 epoch: 20, train_loss: 0.9583, test_loss: 0.9937, test_f1: 0.4781
 epoch: 21, train_loss: 0.9547, test_loss: 0.9595, test_f1: 0.4909
 epoch: 22, train_loss: 0.9644, test_loss: 0.9940, test_f1: 0.4795
 epoch: 23, train_loss: 0.9594, test_loss: 1.0031, test_f1: 0.4936
 epoch: 24, train_loss: 0.9477, test_loss: 0.9731, test_f1: 0.4703
 epoch: 25, train_loss: 0.9488, test_loss: 0.9850, test_f1: 0.4849
 epoch: 26, train_loss: 0.9471, test_loss: 1.0196, test_f1: 0.4838
 epoch: 27, train_loss: 0.9508, test_loss: 1.0037, test_f1: 0.4902
 epoch: 28, train_loss: 0.9467, test_loss: 0.9572, test_f1: 0.5425
 epoch: 29, train_loss: 0.9347, test_loss: 0.9796, test_f1: 0.4924
 epoch: 30, train_loss: 0.9543, test_loss: 0.9594, test_f1: 0.4950
 epoch: 31, train_loss: 0.9499, test_loss: 0.9772, test_f1: 0.5121
 epoch: 32, train_loss: 0.9287, test_loss: 1.0266, test_f1: 0.4814
 epoch: 33, train_loss: 0.9258, test_loss: 1.0018, test_f1: 0.4986
 epoch: 34, train_loss: 0.9390, test_loss: 0.9768, test_f1: 0.4707
 epoch: 35, train_loss: 0.9254, test_loss: 0.9798, test_f1: 0.5181
 epoch: 36, train_loss: 0.9206, test_loss: 1.0035, test_f1: 0.4976
 epoch: 37, train_loss: 0.9214, test_loss: 0.9882, test_f1: 0.5088
 epoch: 38, train_loss: 0.9290, test_loss: 0.9788, test_f1: 0.5040
 epoch: 39, train_loss: 0.9137, test_loss: 0.9979, test_f1: 0.4988
 epoch: 40, train_loss: 0.9251, test_loss: 0.9704, test_f1: 0.5115
 epoch: 41, train_loss: 0.9247, test_loss: 0.9481, test_f1: 0.5021
 epoch: 42, train_loss: 0.9238, test_loss: 0.9973, test_f1: 0.5130
 epoch: 43, train_loss: 0.9211, test_loss: 0.9560, test_f1: 0.5297
 epoch: 44, train_loss: 0.9235, test_loss: 1.0005, test_f1: 0.4843
 epoch: 45, train_loss: 0.9241, test_loss: 0.9960, test_f1: 0.4635
 epoch: 46, train_loss: 0.9314, test_loss: 0.9920, test_f1: 0.5045
 epoch: 47, train_loss: 0.9094, test_loss: 1.0144, test_f1: 0.5140
 epoch: 48, train_loss: 0.9426, test_loss: 0.9826, test_f1: 0.5042
 epoch: 49, train_loss: 0.9196, test_loss: 0.9826, test_f1: 0.4967
 epoch: 50, train_loss: 0.9358, test_loss: 0.9824, test_f1: 0.5004
 epoch: 51, train_loss: 0.8992, test_loss: 1.0599, test_f1: 0.5043
 epoch: 52, train_loss: 0.9066, test_loss: 0.9693, test_f1: 0.5137
 epoch: 53, train_loss: 0.8952, test_loss: 0.9654, test_f1: 0.5150
 epoch: 54, train_loss: 0.8859, test_loss: 0.9939, test_f1: 0.5045
 epoch: 55, train_loss: 0.8927, test_loss: 1.1954, test_f1: 0.4796
 epoch: 56, train_loss: 0.8980, test_loss: 0.9270, test_f1: 0.5272
 epoch: 57, train_loss: 0.8825, test_loss: 0.9332, test_f1: 0.5529
 epoch: 58, train_loss: 0.8707, test_loss: 0.9521, test_f1: 0.5193
 epoch: 59, train_loss: 0.8868, test_loss: 0.9571, test_f1: 0.5531
 epoch: 60, train_loss: 0.8672, test_loss: 1.0371, test_f1: 0.4889
 epoch: 61, train_loss: 0.8793, test_loss: 0.9587, test_f1: 0.5406
 epoch: 62, train_loss: 0.8733, test_loss: 1.0317, test_f1: 0.5056
 epoch: 63, train_loss: 0.8731, test_loss: 0.9356, test_f1: 0.5256
 epoch: 64, train_loss: 0.8768, test_loss: 1.0057, test_f1: 0.5108
 epoch: 65, train_loss: 0.8915, test_loss: 0.9253, test_f1: 0.5504
 epoch: 66, train_loss: 0.8723, test_loss: 0.9612, test_f1: 0.5303
 epoch: 67, train_loss: 0.8654, test_loss: 1.0082, test_f1: 0.5086
 epoch: 68, train_loss: 0.8689, test_loss: 0.9376, test_f1: 0.5424
 epoch: 69, train_loss: 0.8832, test_loss: 0.9493, test_f1: 0.5156
 epoch: 70, train_loss: 0.8662, test_loss: 0.9361, test_f1: 0.5330
 epoch: 71, train_loss: 0.8643, test_loss: 0.9729, test_f1: 0.5132
 epoch: 72, train_loss: 0.8670, test_loss: 0.9842, test_f1: 0.5262
 epoch: 73, train_loss: 0.8708, test_loss: 0.9172, test_f1: 0.5366
 epoch: 74, train_loss: 0.8630, test_loss: 0.9389, test_f1: 0.5588
 epoch: 75, train_loss: 0.8614, test_loss: 0.9307, test_f1: 0.5512
 epoch: 76, train_loss: 0.8621, test_loss: 1.0115, test_f1: 0.5029
 epoch: 77, train_loss: 0.8660, test_loss: 0.9455, test_f1: 0.5358
 epoch: 78, train_loss: 0.8623, test_loss: 0.9433, test_f1: 0.5355
 epoch: 79, train_loss: 0.8495, test_loss: 0.9249, test_f1: 0.5341
 epoch: 80, train_loss: 0.8496, test_loss: 0.9821, test_f1: 0.5341
 epoch: 81, train_loss: 0.8529, test_loss: 0.9563, test_f1: 0.5200
 epoch: 82, train_loss: 0.8780, test_loss: 0.9628, test_f1: 0.5169
 epoch: 83, train_loss: 0.8502, test_loss: 0.9831, test_f1: 0.5180
 epoch: 84, train_loss: 0.8408, test_loss: 0.9420, test_f1: 0.5171
 epoch: 85, train_loss: 0.8544, test_loss: 0.9667, test_f1: 0.5275
 epoch: 86, train_loss: 0.8583, test_loss: 0.9500, test_f1: 0.5321
 epoch: 87, train_loss: 0.8461, test_loss: 0.9887, test_f1: 0.5463
 epoch: 88, train_loss: 0.8331, test_loss: 0.9267, test_f1: 0.5443
 epoch: 89, train_loss: 0.8563, test_loss: 0.9944, test_f1: 0.5136
 epoch: 90, train_loss: 0.8457, test_loss: 0.9339, test_f1: 0.5700
 epoch: 91, train_loss: 0.8335, test_loss: 1.0011, test_f1: 0.5573
 epoch: 92, train_loss: 0.8616, test_loss: 0.9482, test_f1: 0.5456
 epoch: 93, train_loss: 0.8428, test_loss: 0.9335, test_f1: 0.5507
 epoch: 94, train_loss: 0.8574, test_loss: 0.9877, test_f1: 0.5297
 epoch: 95, train_loss: 0.8438, test_loss: 0.9858, test_f1: 0.5632
 epoch: 96, train_loss: 0.8459, test_loss: 0.9359, test_f1: 0.5666
 epoch: 97, train_loss: 0.8748, test_loss: 1.0242, test_f1: 0.5081
 epoch: 98, train_loss: 0.8470, test_loss: 1.0026, test_f1: 0.5343
 epoch: 99, train_loss: 0.8465, test_loss: 0.9278, test_f1: 0.5758
##################ITERATION #8 ****************************************
 epoch: 0, train_loss: 1.2907, test_loss: 1.2505, test_f1: 0.3223
 epoch: 1, train_loss: 1.2119, test_loss: 1.1160, test_f1: 0.3771
 epoch: 2, train_loss: 1.1547, test_loss: 1.0791, test_f1: 0.4598
 epoch: 3, train_loss: 1.1147, test_loss: 1.0624, test_f1: 0.4577
 epoch: 4, train_loss: 1.0674, test_loss: 1.0183, test_f1: 0.4556
 epoch: 5, train_loss: 1.0447, test_loss: 0.9507, test_f1: 0.4650
 epoch: 6, train_loss: 1.0479, test_loss: 0.9701, test_f1: 0.4941
 epoch: 7, train_loss: 1.0323, test_loss: 0.9661, test_f1: 0.4860
 epoch: 8, train_loss: 1.0187, test_loss: 1.0159, test_f1: 0.4458
 epoch: 9, train_loss: 1.0173, test_loss: 1.0126, test_f1: 0.5005
 epoch: 10, train_loss: 0.9907, test_loss: 0.9633, test_f1: 0.4623
 epoch: 11, train_loss: 0.9773, test_loss: 1.0344, test_f1: 0.4719
 epoch: 12, train_loss: 0.9943, test_loss: 1.0313, test_f1: 0.4704
 epoch: 13, train_loss: 0.9913, test_loss: 1.0146, test_f1: 0.4682
 epoch: 14, train_loss: 1.0048, test_loss: 0.9934, test_f1: 0.4751
 epoch: 15, train_loss: 0.9770, test_loss: 1.0209, test_f1: 0.5018
 epoch: 16, train_loss: 0.9815, test_loss: 0.9712, test_f1: 0.4894
 epoch: 17, train_loss: 0.9823, test_loss: 0.9972, test_f1: 0.4687
 epoch: 18, train_loss: 0.9533, test_loss: 1.0212, test_f1: 0.4859
 epoch: 19, train_loss: 0.9862, test_loss: 0.9661, test_f1: 0.4783
 epoch: 20, train_loss: 0.9687, test_loss: 0.9958, test_f1: 0.4946
 epoch: 21, train_loss: 0.9597, test_loss: 1.0243, test_f1: 0.4969
 epoch: 22, train_loss: 0.9607, test_loss: 1.0457, test_f1: 0.4680
 epoch: 23, train_loss: 0.9531, test_loss: 1.0210, test_f1: 0.4691
 epoch: 24, train_loss: 0.9359, test_loss: 1.0350, test_f1: 0.5085
 epoch: 25, train_loss: 0.9519, test_loss: 0.9850, test_f1: 0.4856
 epoch: 26, train_loss: 0.9529, test_loss: 1.0059, test_f1: 0.4702
 epoch: 27, train_loss: 0.9551, test_loss: 1.0046, test_f1: 0.4972
 epoch: 28, train_loss: 0.9422, test_loss: 1.0096, test_f1: 0.5054
 epoch: 29, train_loss: 0.9458, test_loss: 1.0277, test_f1: 0.4541
 epoch: 30, train_loss: 0.9584, test_loss: 1.0310, test_f1: 0.5012
 epoch: 31, train_loss: 0.9496, test_loss: 1.0262, test_f1: 0.5370
 epoch: 32, train_loss: 0.9327, test_loss: 1.0008, test_f1: 0.5074
 epoch: 33, train_loss: 0.9367, test_loss: 1.0784, test_f1: 0.4366
 epoch: 34, train_loss: 0.9308, test_loss: 1.0081, test_f1: 0.4952
 epoch: 35, train_loss: 0.9372, test_loss: 0.9949, test_f1: 0.4662
 epoch: 36, train_loss: 0.9356, test_loss: 1.0136, test_f1: 0.5001
 epoch: 37, train_loss: 0.9418, test_loss: 1.0512, test_f1: 0.4660
 epoch: 38, train_loss: 0.9314, test_loss: 1.0113, test_f1: 0.4815
 epoch: 39, train_loss: 0.9489, test_loss: 1.0155, test_f1: 0.4876
 epoch: 40, train_loss: 0.9096, test_loss: 1.0133, test_f1: 0.4971
 epoch: 41, train_loss: 0.9296, test_loss: 1.0189, test_f1: 0.4871
 epoch: 42, train_loss: 0.9227, test_loss: 0.9742, test_f1: 0.4906
 epoch: 43, train_loss: 0.9165, test_loss: 0.9755, test_f1: 0.4750
 epoch: 44, train_loss: 0.9253, test_loss: 1.0160, test_f1: 0.5224
 epoch: 45, train_loss: 0.9049, test_loss: 0.9919, test_f1: 0.5059
 epoch: 46, train_loss: 0.9126, test_loss: 1.2063, test_f1: 0.4499
 epoch: 47, train_loss: 0.9240, test_loss: 0.9565, test_f1: 0.4882
 epoch: 48, train_loss: 0.9087, test_loss: 1.0211, test_f1: 0.4761
 epoch: 49, train_loss: 0.9273, test_loss: 1.0162, test_f1: 0.4603
 epoch: 50, train_loss: 0.9146, test_loss: 1.0040, test_f1: 0.4792
 epoch: 51, train_loss: 0.9084, test_loss: 0.9742, test_f1: 0.4807
 epoch: 52, train_loss: 0.8811, test_loss: 0.9756, test_f1: 0.5157
 epoch: 53, train_loss: 0.8848, test_loss: 0.9916, test_f1: 0.5001
 epoch: 54, train_loss: 0.8705, test_loss: 0.9698, test_f1: 0.4990
 epoch: 55, train_loss: 0.8763, test_loss: 0.9954, test_f1: 0.4888
 epoch: 56, train_loss: 0.8724, test_loss: 0.9646, test_f1: 0.5030
 epoch: 57, train_loss: 0.8884, test_loss: 0.9749, test_f1: 0.4940
 epoch: 58, train_loss: 0.8746, test_loss: 0.9963, test_f1: 0.4652
 epoch: 59, train_loss: 0.8672, test_loss: 0.9946, test_f1: 0.4977
 epoch: 60, train_loss: 0.8679, test_loss: 0.9776, test_f1: 0.4924
 epoch: 61, train_loss: 0.8606, test_loss: 1.0213, test_f1: 0.5043
 epoch: 62, train_loss: 0.8666, test_loss: 0.9829, test_f1: 0.4912
 epoch: 63, train_loss: 0.8578, test_loss: 0.9752, test_f1: 0.4956
 epoch: 64, train_loss: 0.8557, test_loss: 0.9919, test_f1: 0.4920
 epoch: 65, train_loss: 0.8595, test_loss: 0.9723, test_f1: 0.5089
 epoch: 66, train_loss: 0.8580, test_loss: 1.0489, test_f1: 0.4675
 epoch: 67, train_loss: 0.8656, test_loss: 1.0159, test_f1: 0.4920
 epoch: 68, train_loss: 0.8682, test_loss: 0.9930, test_f1: 0.4998
 epoch: 69, train_loss: 0.8515, test_loss: 0.9886, test_f1: 0.5089
 epoch: 70, train_loss: 0.8959, test_loss: 1.0083, test_f1: 0.5099
 epoch: 71, train_loss: 0.8797, test_loss: 1.0430, test_f1: 0.4981
 epoch: 72, train_loss: 0.8505, test_loss: 1.0028, test_f1: 0.5024
 epoch: 73, train_loss: 0.8609, test_loss: 1.0153, test_f1: 0.4895
 epoch: 74, train_loss: 0.8501, test_loss: 1.0043, test_f1: 0.5018
 epoch: 75, train_loss: 0.8630, test_loss: 1.0099, test_f1: 0.4945
 epoch: 76, train_loss: 0.8521, test_loss: 0.9584, test_f1: 0.4972
 epoch: 77, train_loss: 0.8578, test_loss: 1.0048, test_f1: 0.5022
 epoch: 78, train_loss: 0.8542, test_loss: 1.0020, test_f1: 0.4809
 epoch: 79, train_loss: 0.8381, test_loss: 0.9795, test_f1: 0.4962
 epoch: 80, train_loss: 0.8510, test_loss: 0.9695, test_f1: 0.5018
 epoch: 81, train_loss: 0.8447, test_loss: 0.9737, test_f1: 0.4998
 epoch: 82, train_loss: 0.8413, test_loss: 1.0182, test_f1: 0.4986
 epoch: 83, train_loss: 0.8475, test_loss: 1.0114, test_f1: 0.4953
 epoch: 84, train_loss: 0.8403, test_loss: 0.9837, test_f1: 0.5449
 epoch: 85, train_loss: 0.8404, test_loss: 1.0236, test_f1: 0.4973
 epoch: 86, train_loss: 0.8426, test_loss: 0.9904, test_f1: 0.5436
 epoch: 87, train_loss: 0.8495, test_loss: 0.9709, test_f1: 0.5275
 epoch: 88, train_loss: 0.8406, test_loss: 0.9743, test_f1: 0.5319
 epoch: 89, train_loss: 0.8333, test_loss: 0.9969, test_f1: 0.5097
 epoch: 90, train_loss: 0.8403, test_loss: 1.0155, test_f1: 0.5343
 epoch: 91, train_loss: 0.8408, test_loss: 1.0022, test_f1: 0.5517
 epoch: 92, train_loss: 0.8595, test_loss: 0.9889, test_f1: 0.5395
 epoch: 93, train_loss: 0.8385, test_loss: 1.0007, test_f1: 0.5447
 epoch: 94, train_loss: 0.8392, test_loss: 1.0137, test_f1: 0.5607
 epoch: 95, train_loss: 0.8401, test_loss: 0.9831, test_f1: 0.5108
 epoch: 96, train_loss: 0.8321, test_loss: 0.9890, test_f1: 0.5474
 epoch: 97, train_loss: 0.8391, test_loss: 0.9762, test_f1: 0.5369
 epoch: 98, train_loss: 0.8312, test_loss: 0.9856, test_f1: 0.5077
 epoch: 99, train_loss: 0.8261, test_loss: 0.9791, test_f1: 0.5346
##################ITERATION #9 ****************************************
 epoch: 0, train_loss: 1.2731, test_loss: 1.2126, test_f1: 0.3875
 epoch: 1, train_loss: 1.1951, test_loss: 1.1114, test_f1: 0.4380
 epoch: 2, train_loss: 1.1607, test_loss: 1.0976, test_f1: 0.4492
 epoch: 3, train_loss: 1.1452, test_loss: 1.0484, test_f1: 0.4818
 epoch: 4, train_loss: 1.1315, test_loss: 1.0360, test_f1: 0.4771
 epoch: 5, train_loss: 1.1035, test_loss: 0.9721, test_f1: 0.4823
 epoch: 6, train_loss: 1.0772, test_loss: 0.9561, test_f1: 0.4855
 epoch: 7, train_loss: 1.0618, test_loss: 0.9728, test_f1: 0.4829
 epoch: 8, train_loss: 1.0666, test_loss: 0.9190, test_f1: 0.5254
 epoch: 9, train_loss: 1.0544, test_loss: 0.9377, test_f1: 0.4854
 epoch: 10, train_loss: 1.0384, test_loss: 0.9787, test_f1: 0.4664
 epoch: 11, train_loss: 1.0198, test_loss: 0.9733, test_f1: 0.4574
 epoch: 12, train_loss: 1.0248, test_loss: 0.9154, test_f1: 0.4859
 epoch: 13, train_loss: 1.0230, test_loss: 0.9631, test_f1: 0.5240
 epoch: 14, train_loss: 1.0233, test_loss: 0.9169, test_f1: 0.4914
 epoch: 15, train_loss: 1.0042, test_loss: 0.8815, test_f1: 0.5268
 epoch: 16, train_loss: 1.0048, test_loss: 0.9079, test_f1: 0.4889
 epoch: 17, train_loss: 0.9971, test_loss: 0.9513, test_f1: 0.5058
 epoch: 18, train_loss: 1.0106, test_loss: 0.9048, test_f1: 0.4700
 epoch: 19, train_loss: 0.9845, test_loss: 0.8934, test_f1: 0.4815
 epoch: 20, train_loss: 0.9935, test_loss: 0.9400, test_f1: 0.4827
 epoch: 21, train_loss: 0.9874, test_loss: 0.8923, test_f1: 0.4761
 epoch: 22, train_loss: 0.9921, test_loss: 0.8740, test_f1: 0.4913
 epoch: 23, train_loss: 0.9749, test_loss: 0.9213, test_f1: 0.4771
 epoch: 24, train_loss: 0.9863, test_loss: 0.8935, test_f1: 0.4922
 epoch: 25, train_loss: 0.9911, test_loss: 0.9169, test_f1: 0.4941
 epoch: 26, train_loss: 0.9907, test_loss: 0.9725, test_f1: 0.4660
 epoch: 27, train_loss: 0.9732, test_loss: 0.9490, test_f1: 0.4925
 epoch: 28, train_loss: 0.9750, test_loss: 0.8905, test_f1: 0.5017
 epoch: 29, train_loss: 0.9768, test_loss: 0.9074, test_f1: 0.5065
 epoch: 30, train_loss: 0.9702, test_loss: 0.8551, test_f1: 0.5224
 epoch: 31, train_loss: 0.9715, test_loss: 0.8899, test_f1: 0.5017
 epoch: 32, train_loss: 0.9562, test_loss: 0.9072, test_f1: 0.4879
 epoch: 33, train_loss: 0.9697, test_loss: 0.8582, test_f1: 0.5076
 epoch: 34, train_loss: 0.9673, test_loss: 0.9187, test_f1: 0.4680
 epoch: 35, train_loss: 0.9633, test_loss: 1.0288, test_f1: 0.4999
 epoch: 36, train_loss: 0.9918, test_loss: 0.9144, test_f1: 0.4967
 epoch: 37, train_loss: 0.9748, test_loss: 0.9615, test_f1: 0.4864
 epoch: 38, train_loss: 0.9831, test_loss: 0.9933, test_f1: 0.4765
 epoch: 39, train_loss: 0.9606, test_loss: 1.0649, test_f1: 0.4884
 epoch: 40, train_loss: 0.9927, test_loss: 0.9466, test_f1: 0.4741
 epoch: 41, train_loss: 0.9791, test_loss: 1.1043, test_f1: 0.4557
 epoch: 42, train_loss: 0.9650, test_loss: 1.0355, test_f1: 0.4618
 epoch: 43, train_loss: 0.9516, test_loss: 0.9348, test_f1: 0.4822
 epoch: 44, train_loss: 0.9526, test_loss: 0.9249, test_f1: 0.4850
 epoch: 45, train_loss: 0.9782, test_loss: 0.9550, test_f1: 0.4849
 epoch: 46, train_loss: 0.9544, test_loss: 0.9957, test_f1: 0.4838
 epoch: 47, train_loss: 0.9600, test_loss: 0.8874, test_f1: 0.5115
 epoch: 48, train_loss: 0.9457, test_loss: 0.9308, test_f1: 0.5252
 epoch: 49, train_loss: 0.9476, test_loss: 0.9185, test_f1: 0.5231
 epoch: 50, train_loss: 0.9309, test_loss: 0.9831, test_f1: 0.4900
 epoch: 51, train_loss: 0.9231, test_loss: 0.9440, test_f1: 0.5063
 epoch: 52, train_loss: 0.9218, test_loss: 0.9531, test_f1: 0.5077
 epoch: 53, train_loss: 0.9216, test_loss: 0.9079, test_f1: 0.5031
 epoch: 54, train_loss: 0.9127, test_loss: 0.9190, test_f1: 0.5343
 epoch: 55, train_loss: 0.9218, test_loss: 0.9331, test_f1: 0.5094
 epoch: 56, train_loss: 0.9237, test_loss: 0.9233, test_f1: 0.5357
 epoch: 57, train_loss: 0.9220, test_loss: 0.8955, test_f1: 0.5066
 epoch: 58, train_loss: 0.9216, test_loss: 0.9292, test_f1: 0.5125
 epoch: 59, train_loss: 0.9194, test_loss: 0.9234, test_f1: 0.5073
 epoch: 60, train_loss: 0.9057, test_loss: 0.9832, test_f1: 0.4914
 epoch: 61, train_loss: 0.9084, test_loss: 1.0437, test_f1: 0.4791
 epoch: 62, train_loss: 0.9164, test_loss: 1.0043, test_f1: 0.5088
 epoch: 63, train_loss: 0.9229, test_loss: 0.9389, test_f1: 0.4994
 epoch: 64, train_loss: 0.9144, test_loss: 1.0045, test_f1: 0.5138
 epoch: 65, train_loss: 0.9201, test_loss: 0.9644, test_f1: 0.4728
 epoch: 66, train_loss: 0.9145, test_loss: 0.9432, test_f1: 0.5035
 epoch: 67, train_loss: 0.9101, test_loss: 0.9219, test_f1: 0.5057
 epoch: 68, train_loss: 0.9102, test_loss: 0.9547, test_f1: 0.5024
 epoch: 69, train_loss: 0.9022, test_loss: 1.0067, test_f1: 0.5087
 epoch: 70, train_loss: 0.9063, test_loss: 1.0929, test_f1: 0.4836
 epoch: 71, train_loss: 0.8960, test_loss: 1.0082, test_f1: 0.4949
 epoch: 72, train_loss: 0.9031, test_loss: 0.9977, test_f1: 0.5007
 epoch: 73, train_loss: 0.9086, test_loss: 0.9484, test_f1: 0.4774
 epoch: 74, train_loss: 0.9074, test_loss: 0.9111, test_f1: 0.4931
 epoch: 75, train_loss: 0.9001, test_loss: 0.9736, test_f1: 0.5008
 epoch: 76, train_loss: 0.8971, test_loss: 0.9756, test_f1: 0.4912
 epoch: 77, train_loss: 0.8993, test_loss: 0.9008, test_f1: 0.4983
 epoch: 78, train_loss: 0.9017, test_loss: 0.9695, test_f1: 0.4981
 epoch: 79, train_loss: 0.8973, test_loss: 1.0007, test_f1: 0.5057
 epoch: 80, train_loss: 0.9073, test_loss: 0.9325, test_f1: 0.5308
 epoch: 81, train_loss: 0.8993, test_loss: 0.9377, test_f1: 0.4836
 epoch: 82, train_loss: 0.9000, test_loss: 1.0199, test_f1: 0.4924
 epoch: 83, train_loss: 0.8905, test_loss: 1.0793, test_f1: 0.4814
 epoch: 84, train_loss: 0.8897, test_loss: 1.0218, test_f1: 0.4880
 epoch: 85, train_loss: 0.8893, test_loss: 1.0485, test_f1: 0.4778
 epoch: 86, train_loss: 0.8884, test_loss: 1.1335, test_f1: 0.5020
 epoch: 87, train_loss: 0.8976, test_loss: 1.1339, test_f1: 0.4890
 epoch: 88, train_loss: 0.8847, test_loss: 1.0838, test_f1: 0.4877
 epoch: 89, train_loss: 0.8911, test_loss: 0.9477, test_f1: 0.4981
 epoch: 90, train_loss: 0.8848, test_loss: 0.9402, test_f1: 0.5018
 epoch: 91, train_loss: 0.8855, test_loss: 1.0580, test_f1: 0.4897
 epoch: 92, train_loss: 0.8858, test_loss: 1.0331, test_f1: 0.4954
 epoch: 93, train_loss: 0.8940, test_loss: 1.0218, test_f1: 0.5004
 epoch: 94, train_loss: 0.8886, test_loss: 0.9744, test_f1: 0.5009
 epoch: 95, train_loss: 0.8853, test_loss: 1.0810, test_f1: 0.4996
 epoch: 96, train_loss: 0.8828, test_loss: 1.0502, test_f1: 0.5140
 epoch: 97, train_loss: 0.8775, test_loss: 1.0080, test_f1: 0.4969
 epoch: 98, train_loss: 0.8781, test_loss: 1.0678, test_f1: 0.5203
 epoch: 99, train_loss: 0.9020, test_loss: 1.0411, test_f1: 0.5016

Training completed in 1121.47 seconds
Best F1: 0.5912 at epoch 92
Mean F1 across iterations: 0.5509  0.0240
========================FINAL RESULTS================================
FEGIN weighted F1: 0.5912  0.0240
python main.py --data ltspice_examples --representation component_component --model FEGIN --layers 4 --hiddens 16 --batch_size 32 --lr 0.01 --emb_size 512 --epochs 100 --save_appendix component_component_L4_H16_BS32_LR0.01_E512 --no_val
-----



STDERR:
  File "main.py", line 370, in <module>
    main()
  File "main.py", line 254, in main
    dataset = dataset_class(
  File "/home/philip/projects/ltspice_examples_code_repo/Circuit-Completion-Using-GNNs/component_classification_with_link_prediction_head/evaluation/FEGIN/kernel/circuit_datasets.py", line 15, in __init__
    self.data, self.slices = torch.load(self.processed_paths[0])
  File "/home/philip/.local/lib/python3.8/site-packages/torch/serialization.py", line 1040, in load
    warnings.warn(
  File "/usr/lib/python3.8/warnings.py", line 109, in _showwarnmsg
    sw(msg.message, msg.category, msg.filename, msg.lineno,
  File "main.py", line 47, in warn_with_traceback
    traceback.print_stack(file=log)
/home/philip/projects/ltspice_examples_code_repo/Circuit-Completion-Using-GNNs/component_classification_with_link_prediction_head/evaluation/FEGIN/kernel/circuit_datasets.py:15: FutureWarning: You are using `torch.load` with `weights_only=False` (the current default value), which uses the default pickle module implicitly. It is possible to construct malicious pickle data which will execute arbitrary code during unpickling (See https://github.com/pytorch/pytorch/blob/main/SECURITY.md#untrusted-models for more details). In a future release, the default value for `weights_only` will be flipped to `True`. This limits the functions that could be executed during unpickling. Arbitrary objects will no longer be allowed to be loaded via this mode unless they are explicitly allowlisted by the user via `torch.serialization.add_safe_globals`. We recommend you start setting `weights_only=True` for any use case where you don't have full control of the loaded file. Please open an issue on GitHub for any issues related to this experimental feature.
  self.data, self.slices = torch.load(self.processed_paths[0])
