STDOUT:
Results will be saved in /home/philip/projects/ltspice_examples_code_repo/Circuit-Completion-Using-GNNs/component_classification_with_link_prediction_head/evaluation/FEGIN/results/model_FEGIN_dataset_ltspice_examples
Command line input: python main.py --data ltspice_examples --representation component_component --model FEGIN --layers 4 --hiddens 16 --batch_size 128 --lr 0.001 --emb_size 250 --epochs 100 --save_appendix component_component_L4_H16_BS128_LR0.001_E250 --no_val
 is saved.
-----
ltspice_examples - FEGIN
Using 4 layers, 16 hidden units, h = 2
Loading component_component representation dataset
ENTERED
Training FEGIN on component_component representation
Train: 3556, Test: 845
##################ITERATION #0 ****************************************
 epoch: 0, train_loss: 1.3474, test_loss: 1.3455, test_f1: 0.2274
 epoch: 1, train_loss: 1.3261, test_loss: 1.3283, test_f1: 0.2274
 epoch: 2, train_loss: 1.3083, test_loss: 1.3086, test_f1: 0.2274
 epoch: 3, train_loss: 1.2887, test_loss: 1.2872, test_f1: 0.2274
 epoch: 4, train_loss: 1.2705, test_loss: 1.2565, test_f1: 0.2274
 epoch: 5, train_loss: 1.2554, test_loss: 1.2318, test_f1: 0.2274
 epoch: 6, train_loss: 1.2418, test_loss: 1.2202, test_f1: 0.2274
 epoch: 7, train_loss: 1.2362, test_loss: 1.2104, test_f1: 0.2425
 epoch: 8, train_loss: 1.2236, test_loss: 1.2034, test_f1: 0.3144
 epoch: 9, train_loss: 1.2186, test_loss: 1.1927, test_f1: 0.3455
 epoch: 10, train_loss: 1.2099, test_loss: 1.1817, test_f1: 0.3778
 epoch: 11, train_loss: 1.1934, test_loss: 1.1703, test_f1: 0.3659
 epoch: 12, train_loss: 1.1887, test_loss: 1.1632, test_f1: 0.3661
 epoch: 13, train_loss: 1.1736, test_loss: 1.1685, test_f1: 0.3879
 epoch: 14, train_loss: 1.1714, test_loss: 1.1463, test_f1: 0.4290
 epoch: 15, train_loss: 1.1557, test_loss: 1.1369, test_f1: 0.4323
 epoch: 16, train_loss: 1.1442, test_loss: 1.1467, test_f1: 0.4465
 epoch: 17, train_loss: 1.1414, test_loss: 1.1195, test_f1: 0.4578
 epoch: 18, train_loss: 1.1286, test_loss: 1.1418, test_f1: 0.4429
 epoch: 19, train_loss: 1.1181, test_loss: 1.0954, test_f1: 0.4584
 epoch: 20, train_loss: 1.1041, test_loss: 1.0734, test_f1: 0.4747
 epoch: 21, train_loss: 1.1023, test_loss: 1.0805, test_f1: 0.4822
 epoch: 22, train_loss: 1.0897, test_loss: 1.0638, test_f1: 0.4428
 epoch: 23, train_loss: 1.0689, test_loss: 1.0936, test_f1: 0.4345
 epoch: 24, train_loss: 1.0652, test_loss: 1.1469, test_f1: 0.4686
 epoch: 25, train_loss: 1.0596, test_loss: 1.1031, test_f1: 0.4630
 epoch: 26, train_loss: 1.0436, test_loss: 1.0547, test_f1: 0.4571
 epoch: 27, train_loss: 1.0418, test_loss: 1.0379, test_f1: 0.4620
 epoch: 28, train_loss: 1.0187, test_loss: 1.0616, test_f1: 0.4594
 epoch: 29, train_loss: 1.0123, test_loss: 1.0459, test_f1: 0.4467
 epoch: 30, train_loss: 1.0113, test_loss: 1.0032, test_f1: 0.4904
 epoch: 31, train_loss: 0.9989, test_loss: 1.0098, test_f1: 0.4749
 epoch: 32, train_loss: 0.9948, test_loss: 1.0082, test_f1: 0.4528
 epoch: 33, train_loss: 0.9736, test_loss: 1.0124, test_f1: 0.4854
 epoch: 34, train_loss: 0.9817, test_loss: 1.0588, test_f1: 0.4630
 epoch: 35, train_loss: 0.9733, test_loss: 1.0112, test_f1: 0.4718
 epoch: 36, train_loss: 0.9647, test_loss: 0.9973, test_f1: 0.4873
 epoch: 37, train_loss: 0.9635, test_loss: 0.9764, test_f1: 0.4692
 epoch: 38, train_loss: 0.9628, test_loss: 1.0917, test_f1: 0.4568
 epoch: 39, train_loss: 0.9452, test_loss: 0.9807, test_f1: 0.4876
 epoch: 40, train_loss: 0.9486, test_loss: 0.9887, test_f1: 0.4835
 epoch: 41, train_loss: 0.9414, test_loss: 0.9624, test_f1: 0.4647
 epoch: 42, train_loss: 0.9442, test_loss: 1.0031, test_f1: 0.4980
 epoch: 43, train_loss: 0.9353, test_loss: 0.9841, test_f1: 0.4619
 epoch: 44, train_loss: 0.9241, test_loss: 0.9967, test_f1: 0.4840
 epoch: 45, train_loss: 0.9272, test_loss: 1.0080, test_f1: 0.4598
 epoch: 46, train_loss: 0.9251, test_loss: 0.9515, test_f1: 0.4917
 epoch: 47, train_loss: 0.9046, test_loss: 0.9626, test_f1: 0.5161
 epoch: 48, train_loss: 0.9159, test_loss: 0.9933, test_f1: 0.4818
 epoch: 49, train_loss: 0.9110, test_loss: 0.9795, test_f1: 0.4790
 epoch: 50, train_loss: 0.8998, test_loss: 0.9727, test_f1: 0.4885
 epoch: 51, train_loss: 0.8917, test_loss: 1.0153, test_f1: 0.4833
 epoch: 52, train_loss: 0.8913, test_loss: 1.0135, test_f1: 0.4686
 epoch: 53, train_loss: 0.8860, test_loss: 1.0153, test_f1: 0.4702
 epoch: 54, train_loss: 0.8879, test_loss: 0.9905, test_f1: 0.5027
 epoch: 55, train_loss: 0.8839, test_loss: 0.9988, test_f1: 0.4990
 epoch: 56, train_loss: 0.8863, test_loss: 0.9994, test_f1: 0.4967
 epoch: 57, train_loss: 0.8809, test_loss: 0.9915, test_f1: 0.4847
 epoch: 58, train_loss: 0.8808, test_loss: 1.0218, test_f1: 0.4627
 epoch: 59, train_loss: 0.8646, test_loss: 0.9937, test_f1: 0.5012
 epoch: 60, train_loss: 0.8693, test_loss: 1.0038, test_f1: 0.4924
 epoch: 61, train_loss: 0.8695, test_loss: 1.0051, test_f1: 0.5031
 epoch: 62, train_loss: 0.8650, test_loss: 1.0252, test_f1: 0.5021
 epoch: 63, train_loss: 0.8608, test_loss: 1.0343, test_f1: 0.4716
 epoch: 64, train_loss: 0.8606, test_loss: 1.0331, test_f1: 0.4750
 epoch: 65, train_loss: 0.8565, test_loss: 1.0257, test_f1: 0.5026
 epoch: 66, train_loss: 0.8622, test_loss: 1.0373, test_f1: 0.4879
 epoch: 67, train_loss: 0.8544, test_loss: 1.0622, test_f1: 0.4626
 epoch: 68, train_loss: 0.8622, test_loss: 1.0735, test_f1: 0.4758
 epoch: 69, train_loss: 0.8564, test_loss: 1.0891, test_f1: 0.4534
 epoch: 70, train_loss: 0.8568, test_loss: 1.0829, test_f1: 0.4654
 epoch: 71, train_loss: 0.8569, test_loss: 1.0755, test_f1: 0.4617
 epoch: 72, train_loss: 0.8605, test_loss: 1.0590, test_f1: 0.4722
 epoch: 73, train_loss: 0.8498, test_loss: 1.0754, test_f1: 0.4547
 epoch: 74, train_loss: 0.8479, test_loss: 1.0787, test_f1: 0.4710
 epoch: 75, train_loss: 0.8599, test_loss: 1.0656, test_f1: 0.4670
 epoch: 76, train_loss: 0.8393, test_loss: 1.0691, test_f1: 0.4648
 epoch: 77, train_loss: 0.8542, test_loss: 1.0365, test_f1: 0.5094
 epoch: 78, train_loss: 0.8421, test_loss: 1.0652, test_f1: 0.4699
 epoch: 79, train_loss: 0.8424, test_loss: 1.0512, test_f1: 0.4951
 epoch: 80, train_loss: 0.8453, test_loss: 1.1069, test_f1: 0.4537
 epoch: 81, train_loss: 0.8421, test_loss: 1.0501, test_f1: 0.4812
 epoch: 82, train_loss: 0.8340, test_loss: 1.0571, test_f1: 0.4926
 epoch: 83, train_loss: 0.8453, test_loss: 1.1179, test_f1: 0.4481
 epoch: 84, train_loss: 0.8344, test_loss: 1.0351, test_f1: 0.4971
 epoch: 85, train_loss: 0.8346, test_loss: 1.1299, test_f1: 0.4418
 epoch: 86, train_loss: 0.8439, test_loss: 1.1015, test_f1: 0.4573
 epoch: 87, train_loss: 0.8346, test_loss: 1.0305, test_f1: 0.5008
 epoch: 88, train_loss: 0.8369, test_loss: 1.0974, test_f1: 0.4503
 epoch: 89, train_loss: 0.8314, test_loss: 1.0586, test_f1: 0.4739
 epoch: 90, train_loss: 0.8289, test_loss: 1.0614, test_f1: 0.4862
 epoch: 91, train_loss: 0.8299, test_loss: 1.0531, test_f1: 0.5039
 epoch: 92, train_loss: 0.8475, test_loss: 1.0749, test_f1: 0.4450
 epoch: 93, train_loss: 0.8290, test_loss: 1.1839, test_f1: 0.4536
 epoch: 94, train_loss: 0.8370, test_loss: 1.0917, test_f1: 0.4688
 epoch: 95, train_loss: 0.8156, test_loss: 1.0724, test_f1: 0.4705
 epoch: 96, train_loss: 0.8185, test_loss: 1.0785, test_f1: 0.4658
 epoch: 97, train_loss: 0.8269, test_loss: 1.0335, test_f1: 0.5129
 epoch: 98, train_loss: 0.8421, test_loss: 1.0958, test_f1: 0.4556
 epoch: 99, train_loss: 0.8158, test_loss: 1.0731, test_f1: 0.4799
##################ITERATION #1 ****************************************
 epoch: 0, train_loss: 1.3636, test_loss: 1.3228, test_f1: 0.2274
 epoch: 1, train_loss: 1.2829, test_loss: 1.2747, test_f1: 0.2555
 epoch: 2, train_loss: 1.2614, test_loss: 1.2410, test_f1: 0.2742
 epoch: 3, train_loss: 1.2430, test_loss: 1.2187, test_f1: 0.2734
 epoch: 4, train_loss: 1.2293, test_loss: 1.1954, test_f1: 0.3294
 epoch: 5, train_loss: 1.2170, test_loss: 1.1780, test_f1: 0.3866
 epoch: 6, train_loss: 1.1930, test_loss: 1.1569, test_f1: 0.4139
 epoch: 7, train_loss: 1.1865, test_loss: 1.1421, test_f1: 0.4138
 epoch: 8, train_loss: 1.1676, test_loss: 1.1162, test_f1: 0.4337
 epoch: 9, train_loss: 1.1506, test_loss: 1.0901, test_f1: 0.4272
 epoch: 10, train_loss: 1.1388, test_loss: 1.0810, test_f1: 0.4411
 epoch: 11, train_loss: 1.1278, test_loss: 1.0761, test_f1: 0.4499
 epoch: 12, train_loss: 1.1149, test_loss: 1.0336, test_f1: 0.4521
 epoch: 13, train_loss: 1.1038, test_loss: 1.0309, test_f1: 0.4536
 epoch: 14, train_loss: 1.1032, test_loss: 1.0217, test_f1: 0.4569
 epoch: 15, train_loss: 1.0861, test_loss: 1.0156, test_f1: 0.4729
 epoch: 16, train_loss: 1.0756, test_loss: 1.0043, test_f1: 0.4674
 epoch: 17, train_loss: 1.0654, test_loss: 1.0056, test_f1: 0.4637
 epoch: 18, train_loss: 1.0591, test_loss: 0.9914, test_f1: 0.4681
 epoch: 19, train_loss: 1.0536, test_loss: 1.0133, test_f1: 0.4501
 epoch: 20, train_loss: 1.0385, test_loss: 0.9904, test_f1: 0.4613
 epoch: 21, train_loss: 1.0465, test_loss: 0.9999, test_f1: 0.4559
 epoch: 22, train_loss: 1.0378, test_loss: 0.9785, test_f1: 0.4674
 epoch: 23, train_loss: 1.0200, test_loss: 0.9640, test_f1: 0.4804
 epoch: 24, train_loss: 1.0269, test_loss: 1.0451, test_f1: 0.4479
 epoch: 25, train_loss: 1.0168, test_loss: 1.0176, test_f1: 0.4568
 epoch: 26, train_loss: 1.0138, test_loss: 0.9916, test_f1: 0.4697
 epoch: 27, train_loss: 1.0147, test_loss: 0.9974, test_f1: 0.4637
 epoch: 28, train_loss: 1.0122, test_loss: 0.9672, test_f1: 0.4894
 epoch: 29, train_loss: 0.9984, test_loss: 0.9713, test_f1: 0.4738
 epoch: 30, train_loss: 0.9964, test_loss: 0.9643, test_f1: 0.4817
 epoch: 31, train_loss: 0.9841, test_loss: 0.9746, test_f1: 0.4866
 epoch: 32, train_loss: 0.9862, test_loss: 0.9762, test_f1: 0.4881
 epoch: 33, train_loss: 0.9796, test_loss: 0.9981, test_f1: 0.4721
 epoch: 34, train_loss: 0.9887, test_loss: 0.9542, test_f1: 0.5004
 epoch: 35, train_loss: 0.9772, test_loss: 0.9580, test_f1: 0.4947
 epoch: 36, train_loss: 0.9747, test_loss: 0.9891, test_f1: 0.4801
 epoch: 37, train_loss: 0.9666, test_loss: 0.9392, test_f1: 0.4943
 epoch: 38, train_loss: 0.9674, test_loss: 0.9634, test_f1: 0.4810
 epoch: 39, train_loss: 0.9450, test_loss: 0.9658, test_f1: 0.4847
 epoch: 40, train_loss: 0.9537, test_loss: 0.9760, test_f1: 0.4918
 epoch: 41, train_loss: 0.9522, test_loss: 0.9861, test_f1: 0.4874
 epoch: 42, train_loss: 0.9478, test_loss: 1.0012, test_f1: 0.4788
 epoch: 43, train_loss: 0.9570, test_loss: 0.9840, test_f1: 0.4870
 epoch: 44, train_loss: 0.9402, test_loss: 0.9993, test_f1: 0.4665
 epoch: 45, train_loss: 0.9292, test_loss: 1.0012, test_f1: 0.4819
 epoch: 46, train_loss: 0.9344, test_loss: 0.9859, test_f1: 0.4781
 epoch: 47, train_loss: 0.9235, test_loss: 0.9456, test_f1: 0.5056
 epoch: 48, train_loss: 0.9333, test_loss: 0.9768, test_f1: 0.4870
 epoch: 49, train_loss: 0.9260, test_loss: 1.0216, test_f1: 0.4747
 epoch: 50, train_loss: 0.9119, test_loss: 0.9762, test_f1: 0.4863
 epoch: 51, train_loss: 0.9063, test_loss: 1.0179, test_f1: 0.4748
 epoch: 52, train_loss: 0.9082, test_loss: 1.0059, test_f1: 0.4809
 epoch: 53, train_loss: 0.9077, test_loss: 1.0142, test_f1: 0.4873
 epoch: 54, train_loss: 0.9073, test_loss: 1.0193, test_f1: 0.4700
 epoch: 55, train_loss: 0.9067, test_loss: 0.9862, test_f1: 0.4841
 epoch: 56, train_loss: 0.8987, test_loss: 1.0001, test_f1: 0.4794
 epoch: 57, train_loss: 0.9015, test_loss: 1.0276, test_f1: 0.4587
 epoch: 58, train_loss: 0.8957, test_loss: 0.9970, test_f1: 0.4703
 epoch: 59, train_loss: 0.8924, test_loss: 1.0024, test_f1: 0.4802
 epoch: 60, train_loss: 0.8839, test_loss: 1.0033, test_f1: 0.4727
 epoch: 61, train_loss: 0.9011, test_loss: 0.9853, test_f1: 0.4932
 epoch: 62, train_loss: 0.9029, test_loss: 1.0539, test_f1: 0.4442
 epoch: 63, train_loss: 0.8813, test_loss: 0.9857, test_f1: 0.4840
 epoch: 64, train_loss: 0.8905, test_loss: 1.0023, test_f1: 0.4799
 epoch: 65, train_loss: 0.8923, test_loss: 1.0056, test_f1: 0.4896
 epoch: 66, train_loss: 0.8806, test_loss: 1.0288, test_f1: 0.4454
 epoch: 67, train_loss: 0.8825, test_loss: 1.0134, test_f1: 0.4759
 epoch: 68, train_loss: 0.8727, test_loss: 1.0224, test_f1: 0.4751
 epoch: 69, train_loss: 0.8825, test_loss: 1.0035, test_f1: 0.4888
 epoch: 70, train_loss: 0.8770, test_loss: 1.0345, test_f1: 0.4652
 epoch: 71, train_loss: 0.8724, test_loss: 1.0027, test_f1: 0.4913
 epoch: 72, train_loss: 0.8612, test_loss: 1.0389, test_f1: 0.4647
 epoch: 73, train_loss: 0.8767, test_loss: 1.0147, test_f1: 0.4763
 epoch: 74, train_loss: 0.8847, test_loss: 1.0273, test_f1: 0.4744
 epoch: 75, train_loss: 0.8715, test_loss: 1.0363, test_f1: 0.4896
 epoch: 76, train_loss: 0.8615, test_loss: 1.0721, test_f1: 0.4401
 epoch: 77, train_loss: 0.8764, test_loss: 1.1520, test_f1: 0.4458
 epoch: 78, train_loss: 0.8616, test_loss: 1.0199, test_f1: 0.4875
 epoch: 79, train_loss: 0.8680, test_loss: 1.0221, test_f1: 0.4772
 epoch: 80, train_loss: 0.8631, test_loss: 1.0492, test_f1: 0.4629
 epoch: 81, train_loss: 0.8540, test_loss: 1.0209, test_f1: 0.4825
 epoch: 82, train_loss: 0.8567, test_loss: 1.0231, test_f1: 0.4963
 epoch: 83, train_loss: 0.8567, test_loss: 1.0721, test_f1: 0.4795
 epoch: 84, train_loss: 0.8491, test_loss: 1.0294, test_f1: 0.4871
 epoch: 85, train_loss: 0.8488, test_loss: 1.0137, test_f1: 0.4821
 epoch: 86, train_loss: 0.8556, test_loss: 1.0415, test_f1: 0.4869
 epoch: 87, train_loss: 0.8542, test_loss: 1.0226, test_f1: 0.4880
 epoch: 88, train_loss: 0.8523, test_loss: 1.0266, test_f1: 0.4763
 epoch: 89, train_loss: 0.8515, test_loss: 1.0365, test_f1: 0.4672
 epoch: 90, train_loss: 0.8489, test_loss: 1.1207, test_f1: 0.4592
 epoch: 91, train_loss: 0.8560, test_loss: 1.0296, test_f1: 0.4946
 epoch: 92, train_loss: 0.8393, test_loss: 1.0089, test_f1: 0.4920
 epoch: 93, train_loss: 0.8423, test_loss: 1.0484, test_f1: 0.4850
 epoch: 94, train_loss: 0.8396, test_loss: 1.0143, test_f1: 0.5234
 epoch: 95, train_loss: 0.8409, test_loss: 1.0586, test_f1: 0.4998
 epoch: 96, train_loss: 0.8493, test_loss: 1.0509, test_f1: 0.5000
 epoch: 97, train_loss: 0.8487, test_loss: 1.0590, test_f1: 0.4887
 epoch: 98, train_loss: 0.8334, test_loss: 1.0977, test_f1: 0.4695
 epoch: 99, train_loss: 0.8438, test_loss: 1.0789, test_f1: 0.4936
##################ITERATION #2 ****************************************
 epoch: 0, train_loss: 1.3805, test_loss: 1.3248, test_f1: 0.2274
 epoch: 1, train_loss: 1.2928, test_loss: 1.2753, test_f1: 0.2274
 epoch: 2, train_loss: 1.2678, test_loss: 1.2501, test_f1: 0.2613
 epoch: 3, train_loss: 1.2551, test_loss: 1.2407, test_f1: 0.2555
 epoch: 4, train_loss: 1.2460, test_loss: 1.2280, test_f1: 0.2691
 epoch: 5, train_loss: 1.2436, test_loss: 1.2142, test_f1: 0.2994
 epoch: 6, train_loss: 1.2333, test_loss: 1.2027, test_f1: 0.3153
 epoch: 7, train_loss: 1.2228, test_loss: 1.1933, test_f1: 0.3285
 epoch: 8, train_loss: 1.2155, test_loss: 1.1812, test_f1: 0.3631
 epoch: 9, train_loss: 1.2010, test_loss: 1.1661, test_f1: 0.3640
 epoch: 10, train_loss: 1.1970, test_loss: 1.1583, test_f1: 0.3783
 epoch: 11, train_loss: 1.1787, test_loss: 1.1490, test_f1: 0.4034
 epoch: 12, train_loss: 1.1756, test_loss: 1.1362, test_f1: 0.4081
 epoch: 13, train_loss: 1.1643, test_loss: 1.1256, test_f1: 0.4356
 epoch: 14, train_loss: 1.1578, test_loss: 1.1222, test_f1: 0.4257
 epoch: 15, train_loss: 1.1469, test_loss: 1.1201, test_f1: 0.4283
 epoch: 16, train_loss: 1.1480, test_loss: 1.1108, test_f1: 0.4282
 epoch: 17, train_loss: 1.1411, test_loss: 1.1038, test_f1: 0.4242
 epoch: 18, train_loss: 1.1318, test_loss: 1.0914, test_f1: 0.4409
 epoch: 19, train_loss: 1.1220, test_loss: 1.1009, test_f1: 0.4359
 epoch: 20, train_loss: 1.1215, test_loss: 1.0705, test_f1: 0.4513
 epoch: 21, train_loss: 1.1114, test_loss: 1.0687, test_f1: 0.4578
 epoch: 22, train_loss: 1.0977, test_loss: 1.0553, test_f1: 0.4424
 epoch: 23, train_loss: 1.0948, test_loss: 1.0580, test_f1: 0.4655
 epoch: 24, train_loss: 1.0968, test_loss: 1.0587, test_f1: 0.4778
 epoch: 25, train_loss: 1.0910, test_loss: 1.0485, test_f1: 0.4708
 epoch: 26, train_loss: 1.0873, test_loss: 1.0423, test_f1: 0.4558
 epoch: 27, train_loss: 1.0738, test_loss: 1.0475, test_f1: 0.4658
 epoch: 28, train_loss: 1.0664, test_loss: 1.0471, test_f1: 0.4551
 epoch: 29, train_loss: 1.0615, test_loss: 1.0268, test_f1: 0.4633
 epoch: 30, train_loss: 1.0559, test_loss: 1.0229, test_f1: 0.4493
 epoch: 31, train_loss: 1.0525, test_loss: 1.0323, test_f1: 0.4584
 epoch: 32, train_loss: 1.0487, test_loss: 1.0217, test_f1: 0.4573
 epoch: 33, train_loss: 1.0557, test_loss: 1.0185, test_f1: 0.4542
 epoch: 34, train_loss: 1.0422, test_loss: 1.0175, test_f1: 0.4571
 epoch: 35, train_loss: 1.0289, test_loss: 1.0257, test_f1: 0.4833
 epoch: 36, train_loss: 1.0208, test_loss: 1.0080, test_f1: 0.4643
 epoch: 37, train_loss: 1.0244, test_loss: 1.0097, test_f1: 0.4592
 epoch: 38, train_loss: 1.0265, test_loss: 1.0205, test_f1: 0.4570
 epoch: 39, train_loss: 1.0131, test_loss: 1.0180, test_f1: 0.4699
 epoch: 40, train_loss: 1.0141, test_loss: 1.0129, test_f1: 0.4601
 epoch: 41, train_loss: 1.0210, test_loss: 1.0208, test_f1: 0.4582
 epoch: 42, train_loss: 1.0060, test_loss: 1.0221, test_f1: 0.4597
 epoch: 43, train_loss: 0.9962, test_loss: 1.0259, test_f1: 0.4508
 epoch: 44, train_loss: 1.0052, test_loss: 1.0132, test_f1: 0.4666
 epoch: 45, train_loss: 0.9913, test_loss: 1.0033, test_f1: 0.4592
 epoch: 46, train_loss: 0.9909, test_loss: 1.0272, test_f1: 0.4638
 epoch: 47, train_loss: 0.9984, test_loss: 1.0317, test_f1: 0.4709
 epoch: 48, train_loss: 0.9942, test_loss: 1.0261, test_f1: 0.4795
 epoch: 49, train_loss: 0.9906, test_loss: 1.0504, test_f1: 0.4707
 epoch: 50, train_loss: 0.9829, test_loss: 1.0844, test_f1: 0.4582
 epoch: 51, train_loss: 0.9781, test_loss: 1.0196, test_f1: 0.4783
 epoch: 52, train_loss: 0.9832, test_loss: 1.0182, test_f1: 0.4699
 epoch: 53, train_loss: 0.9564, test_loss: 1.0331, test_f1: 0.4701
 epoch: 54, train_loss: 0.9556, test_loss: 1.0381, test_f1: 0.4766
 epoch: 55, train_loss: 0.9701, test_loss: 1.0417, test_f1: 0.4807
 epoch: 56, train_loss: 0.9700, test_loss: 1.0424, test_f1: 0.4781
 epoch: 57, train_loss: 0.9623, test_loss: 1.0387, test_f1: 0.4715
 epoch: 58, train_loss: 0.9556, test_loss: 1.0279, test_f1: 0.4755
 epoch: 59, train_loss: 0.9551, test_loss: 1.0386, test_f1: 0.4723
 epoch: 60, train_loss: 0.9569, test_loss: 1.0279, test_f1: 0.4732
 epoch: 61, train_loss: 0.9556, test_loss: 1.0488, test_f1: 0.4882
 epoch: 62, train_loss: 0.9441, test_loss: 1.0460, test_f1: 0.4760
 epoch: 63, train_loss: 0.9551, test_loss: 1.0485, test_f1: 0.4688
 epoch: 64, train_loss: 0.9390, test_loss: 1.0380, test_f1: 0.4765
 epoch: 65, train_loss: 0.9441, test_loss: 1.0293, test_f1: 0.4735
 epoch: 66, train_loss: 0.9561, test_loss: 1.0669, test_f1: 0.4481
 epoch: 67, train_loss: 0.9425, test_loss: 1.0385, test_f1: 0.4860
 epoch: 68, train_loss: 0.9443, test_loss: 1.0585, test_f1: 0.4838
 epoch: 69, train_loss: 0.9353, test_loss: 1.0499, test_f1: 0.4811
 epoch: 70, train_loss: 0.9385, test_loss: 1.0349, test_f1: 0.4796
 epoch: 71, train_loss: 0.9312, test_loss: 1.0557, test_f1: 0.4864
 epoch: 72, train_loss: 0.9343, test_loss: 1.0557, test_f1: 0.5027
 epoch: 73, train_loss: 0.9371, test_loss: 1.0420, test_f1: 0.4769
 epoch: 74, train_loss: 0.9250, test_loss: 1.0572, test_f1: 0.4741
 epoch: 75, train_loss: 0.9261, test_loss: 1.0484, test_f1: 0.4891
 epoch: 76, train_loss: 0.9335, test_loss: 1.0392, test_f1: 0.4883
 epoch: 77, train_loss: 0.9337, test_loss: 1.0464, test_f1: 0.4898
 epoch: 78, train_loss: 0.9243, test_loss: 1.0607, test_f1: 0.4761
 epoch: 79, train_loss: 0.9185, test_loss: 1.0606, test_f1: 0.4880
 epoch: 80, train_loss: 0.9205, test_loss: 1.0401, test_f1: 0.4950
 epoch: 81, train_loss: 0.9293, test_loss: 1.0524, test_f1: 0.4890
 epoch: 82, train_loss: 0.9187, test_loss: 1.0437, test_f1: 0.4933
 epoch: 83, train_loss: 0.9162, test_loss: 1.0477, test_f1: 0.4927
 epoch: 84, train_loss: 0.9260, test_loss: 1.0662, test_f1: 0.4932
 epoch: 85, train_loss: 0.9180, test_loss: 1.0944, test_f1: 0.4699
 epoch: 86, train_loss: 0.9178, test_loss: 1.0789, test_f1: 0.4868
 epoch: 87, train_loss: 0.9079, test_loss: 1.0655, test_f1: 0.4905
 epoch: 88, train_loss: 0.9111, test_loss: 1.0827, test_f1: 0.4800
 epoch: 89, train_loss: 0.9256, test_loss: 1.0523, test_f1: 0.4923
 epoch: 90, train_loss: 0.9110, test_loss: 1.0550, test_f1: 0.4929
 epoch: 91, train_loss: 0.9014, test_loss: 1.0807, test_f1: 0.5036
 epoch: 92, train_loss: 0.9135, test_loss: 1.0544, test_f1: 0.4791
 epoch: 93, train_loss: 0.9209, test_loss: 1.1053, test_f1: 0.4789
 epoch: 94, train_loss: 0.9046, test_loss: 1.0547, test_f1: 0.4840
 epoch: 95, train_loss: 0.9023, test_loss: 1.0583, test_f1: 0.4990
 epoch: 96, train_loss: 0.9079, test_loss: 1.0627, test_f1: 0.4886
 epoch: 97, train_loss: 0.8932, test_loss: 1.0779, test_f1: 0.4856
 epoch: 98, train_loss: 0.9041, test_loss: 1.0688, test_f1: 0.4970
 epoch: 99, train_loss: 0.8947, test_loss: 1.0738, test_f1: 0.4851
##################ITERATION #3 ****************************************
 epoch: 0, train_loss: 1.3244, test_loss: 1.2879, test_f1: 0.2274
 epoch: 1, train_loss: 1.2614, test_loss: 1.2361, test_f1: 0.3196
 epoch: 2, train_loss: 1.2376, test_loss: 1.1984, test_f1: 0.3732
 epoch: 3, train_loss: 1.2228, test_loss: 1.1729, test_f1: 0.3914
 epoch: 4, train_loss: 1.2080, test_loss: 1.1658, test_f1: 0.3938
 epoch: 5, train_loss: 1.2012, test_loss: 1.1404, test_f1: 0.4117
 epoch: 6, train_loss: 1.1863, test_loss: 1.1273, test_f1: 0.4191
 epoch: 7, train_loss: 1.1799, test_loss: 1.1181, test_f1: 0.4426
 epoch: 8, train_loss: 1.1713, test_loss: 1.0990, test_f1: 0.4522
 epoch: 9, train_loss: 1.1538, test_loss: 1.0895, test_f1: 0.4409
 epoch: 10, train_loss: 1.1484, test_loss: 1.0782, test_f1: 0.4430
 epoch: 11, train_loss: 1.1447, test_loss: 1.0679, test_f1: 0.4573
 epoch: 12, train_loss: 1.1294, test_loss: 1.0581, test_f1: 0.4524
 epoch: 13, train_loss: 1.1275, test_loss: 1.0485, test_f1: 0.4584
 epoch: 14, train_loss: 1.1137, test_loss: 1.0491, test_f1: 0.4594
 epoch: 15, train_loss: 1.1200, test_loss: 1.0359, test_f1: 0.4698
 epoch: 16, train_loss: 1.1077, test_loss: 1.0353, test_f1: 0.4634
 epoch: 17, train_loss: 1.0964, test_loss: 1.0219, test_f1: 0.4755
 epoch: 18, train_loss: 1.0945, test_loss: 1.0210, test_f1: 0.4741
 epoch: 19, train_loss: 1.0814, test_loss: 1.0126, test_f1: 0.4710
 epoch: 20, train_loss: 1.0893, test_loss: 1.0082, test_f1: 0.4807
 epoch: 21, train_loss: 1.0787, test_loss: 0.9971, test_f1: 0.4865
 epoch: 22, train_loss: 1.0694, test_loss: 0.9981, test_f1: 0.4796
 epoch: 23, train_loss: 1.0694, test_loss: 0.9826, test_f1: 0.4959
 epoch: 24, train_loss: 1.0616, test_loss: 0.9905, test_f1: 0.4821
 epoch: 25, train_loss: 1.0598, test_loss: 0.9915, test_f1: 0.4826
 epoch: 26, train_loss: 1.0477, test_loss: 0.9683, test_f1: 0.4879
 epoch: 27, train_loss: 1.0487, test_loss: 0.9585, test_f1: 0.4895
 epoch: 28, train_loss: 1.0503, test_loss: 0.9546, test_f1: 0.4988
 epoch: 29, train_loss: 1.0410, test_loss: 0.9525, test_f1: 0.5049
 epoch: 30, train_loss: 1.0218, test_loss: 0.9599, test_f1: 0.4974
 epoch: 31, train_loss: 1.0179, test_loss: 0.9469, test_f1: 0.4952
 epoch: 32, train_loss: 1.0208, test_loss: 0.9368, test_f1: 0.5012
 epoch: 33, train_loss: 1.0160, test_loss: 0.9373, test_f1: 0.5025
 epoch: 34, train_loss: 1.0087, test_loss: 0.9273, test_f1: 0.4990
 epoch: 35, train_loss: 1.0080, test_loss: 0.9281, test_f1: 0.4965
 epoch: 36, train_loss: 0.9980, test_loss: 0.9263, test_f1: 0.5001
 epoch: 37, train_loss: 1.0001, test_loss: 0.9317, test_f1: 0.5073
 epoch: 38, train_loss: 0.9978, test_loss: 0.9200, test_f1: 0.4982
 epoch: 39, train_loss: 0.9986, test_loss: 0.9206, test_f1: 0.5023
 epoch: 40, train_loss: 0.9945, test_loss: 0.9264, test_f1: 0.4995
 epoch: 41, train_loss: 0.9839, test_loss: 0.9085, test_f1: 0.5133
 epoch: 42, train_loss: 0.9902, test_loss: 0.9155, test_f1: 0.4967
 epoch: 43, train_loss: 0.9808, test_loss: 0.9121, test_f1: 0.4957
 epoch: 44, train_loss: 0.9840, test_loss: 0.9099, test_f1: 0.5123
 epoch: 45, train_loss: 0.9724, test_loss: 0.9131, test_f1: 0.5063
 epoch: 46, train_loss: 0.9666, test_loss: 0.9048, test_f1: 0.5106
 epoch: 47, train_loss: 0.9744, test_loss: 0.9030, test_f1: 0.5143
 epoch: 48, train_loss: 0.9553, test_loss: 0.9338, test_f1: 0.4963
 epoch: 49, train_loss: 0.9555, test_loss: 0.9041, test_f1: 0.5024
 epoch: 50, train_loss: 0.9655, test_loss: 0.9205, test_f1: 0.4936
 epoch: 51, train_loss: 0.9520, test_loss: 0.9059, test_f1: 0.5066
 epoch: 52, train_loss: 0.9437, test_loss: 0.9040, test_f1: 0.4954
 epoch: 53, train_loss: 0.9478, test_loss: 0.9072, test_f1: 0.5011
 epoch: 54, train_loss: 0.9387, test_loss: 0.9116, test_f1: 0.5079
 epoch: 55, train_loss: 0.9410, test_loss: 0.9302, test_f1: 0.4779
 epoch: 56, train_loss: 0.9367, test_loss: 0.9161, test_f1: 0.4927
 epoch: 57, train_loss: 0.9267, test_loss: 0.9119, test_f1: 0.4950
 epoch: 58, train_loss: 0.9354, test_loss: 0.9260, test_f1: 0.4868
 epoch: 59, train_loss: 0.9499, test_loss: 0.9278, test_f1: 0.4897
 epoch: 60, train_loss: 0.9390, test_loss: 0.9415, test_f1: 0.4800
 epoch: 61, train_loss: 0.9396, test_loss: 0.9357, test_f1: 0.4886
 epoch: 62, train_loss: 0.9389, test_loss: 0.9352, test_f1: 0.4811
 epoch: 63, train_loss: 0.9293, test_loss: 0.9225, test_f1: 0.4921
 epoch: 64, train_loss: 0.9246, test_loss: 0.9289, test_f1: 0.4945
 epoch: 65, train_loss: 0.9285, test_loss: 0.9488, test_f1: 0.4895
 epoch: 66, train_loss: 0.9391, test_loss: 0.9558, test_f1: 0.4859
 epoch: 67, train_loss: 0.9315, test_loss: 0.9484, test_f1: 0.4778
 epoch: 68, train_loss: 0.9191, test_loss: 0.9436, test_f1: 0.4869
 epoch: 69, train_loss: 0.9206, test_loss: 0.9541, test_f1: 0.4824
 epoch: 70, train_loss: 0.9171, test_loss: 0.9502, test_f1: 0.4756
 epoch: 71, train_loss: 0.9207, test_loss: 0.9568, test_f1: 0.4843
 epoch: 72, train_loss: 0.9221, test_loss: 0.9566, test_f1: 0.4892
 epoch: 73, train_loss: 0.9104, test_loss: 0.9516, test_f1: 0.4732
 epoch: 74, train_loss: 0.9197, test_loss: 0.9507, test_f1: 0.4761
 epoch: 75, train_loss: 0.9166, test_loss: 0.9508, test_f1: 0.4866
 epoch: 76, train_loss: 0.9111, test_loss: 0.9540, test_f1: 0.4875
 epoch: 77, train_loss: 0.9174, test_loss: 0.9245, test_f1: 0.5018
 epoch: 78, train_loss: 0.9123, test_loss: 0.9370, test_f1: 0.5031
 epoch: 79, train_loss: 0.9106, test_loss: 0.9451, test_f1: 0.4933
 epoch: 80, train_loss: 0.9033, test_loss: 0.9488, test_f1: 0.4992
 epoch: 81, train_loss: 0.9020, test_loss: 0.9371, test_f1: 0.4977
 epoch: 82, train_loss: 0.9078, test_loss: 0.9524, test_f1: 0.4993
 epoch: 83, train_loss: 0.9009, test_loss: 0.9468, test_f1: 0.5049
 epoch: 84, train_loss: 0.9052, test_loss: 0.9365, test_f1: 0.5019
 epoch: 85, train_loss: 0.9110, test_loss: 0.9616, test_f1: 0.4926
 epoch: 86, train_loss: 0.8936, test_loss: 0.9499, test_f1: 0.4899
 epoch: 87, train_loss: 0.9050, test_loss: 0.9533, test_f1: 0.4904
 epoch: 88, train_loss: 0.9013, test_loss: 0.9548, test_f1: 0.4833
 epoch: 89, train_loss: 0.8898, test_loss: 0.9569, test_f1: 0.5078
 epoch: 90, train_loss: 0.9051, test_loss: 0.9443, test_f1: 0.5033
 epoch: 91, train_loss: 0.9079, test_loss: 0.9393, test_f1: 0.5019
 epoch: 92, train_loss: 0.8934, test_loss: 0.9550, test_f1: 0.4844
 epoch: 93, train_loss: 0.8907, test_loss: 0.9418, test_f1: 0.4862
 epoch: 94, train_loss: 0.8956, test_loss: 0.9434, test_f1: 0.4976
 epoch: 95, train_loss: 0.8948, test_loss: 0.9602, test_f1: 0.4946
 epoch: 96, train_loss: 0.8965, test_loss: 0.9447, test_f1: 0.4836
 epoch: 97, train_loss: 0.8824, test_loss: 0.9539, test_f1: 0.4991
 epoch: 98, train_loss: 0.8838, test_loss: 0.9703, test_f1: 0.4963
 epoch: 99, train_loss: 0.8861, test_loss: 0.9661, test_f1: 0.4959
##################ITERATION #4 ****************************************
 epoch: 0, train_loss: 1.3645, test_loss: 1.3027, test_f1: 0.2274
 epoch: 1, train_loss: 1.2624, test_loss: 1.2534, test_f1: 0.2264
 epoch: 2, train_loss: 1.2369, test_loss: 1.2230, test_f1: 0.2296
 epoch: 3, train_loss: 1.2408, test_loss: 1.2033, test_f1: 0.2678
 epoch: 4, train_loss: 1.2149, test_loss: 1.1951, test_f1: 0.3153
 epoch: 5, train_loss: 1.2107, test_loss: 1.1869, test_f1: 0.3460
 epoch: 6, train_loss: 1.2024, test_loss: 1.1695, test_f1: 0.3370
 epoch: 7, train_loss: 1.1959, test_loss: 1.1588, test_f1: 0.3831
 epoch: 8, train_loss: 1.1922, test_loss: 1.1625, test_f1: 0.3995
 epoch: 9, train_loss: 1.1730, test_loss: 1.1491, test_f1: 0.4121
 epoch: 10, train_loss: 1.1676, test_loss: 1.1367, test_f1: 0.4037
 epoch: 11, train_loss: 1.1621, test_loss: 1.1392, test_f1: 0.4179
 epoch: 12, train_loss: 1.1583, test_loss: 1.1280, test_f1: 0.3920
 epoch: 13, train_loss: 1.1441, test_loss: 1.1177, test_f1: 0.4081
 epoch: 14, train_loss: 1.1422, test_loss: 1.1144, test_f1: 0.4225
 epoch: 15, train_loss: 1.1341, test_loss: 1.1145, test_f1: 0.4161
 epoch: 16, train_loss: 1.1298, test_loss: 1.1194, test_f1: 0.3962
 epoch: 17, train_loss: 1.1212, test_loss: 1.1003, test_f1: 0.4097
 epoch: 18, train_loss: 1.1084, test_loss: 1.0821, test_f1: 0.4437
 epoch: 19, train_loss: 1.1143, test_loss: 1.0897, test_f1: 0.4051
 epoch: 20, train_loss: 1.1035, test_loss: 1.0733, test_f1: 0.4346
 epoch: 21, train_loss: 1.1040, test_loss: 1.0766, test_f1: 0.4105
 epoch: 22, train_loss: 1.1045, test_loss: 1.0724, test_f1: 0.4185
 epoch: 23, train_loss: 1.0849, test_loss: 1.0585, test_f1: 0.4224
 epoch: 24, train_loss: 1.0891, test_loss: 1.0685, test_f1: 0.4210
 epoch: 25, train_loss: 1.0883, test_loss: 1.0549, test_f1: 0.4318
 epoch: 26, train_loss: 1.0805, test_loss: 1.0536, test_f1: 0.4320
 epoch: 27, train_loss: 1.0858, test_loss: 1.0588, test_f1: 0.4355
 epoch: 28, train_loss: 1.0764, test_loss: 1.0383, test_f1: 0.4490
 epoch: 29, train_loss: 1.0582, test_loss: 1.0428, test_f1: 0.4525
 epoch: 30, train_loss: 1.0543, test_loss: 1.0430, test_f1: 0.4258
 epoch: 31, train_loss: 1.0492, test_loss: 1.0275, test_f1: 0.4432
 epoch: 32, train_loss: 1.0421, test_loss: 1.0573, test_f1: 0.4257
 epoch: 33, train_loss: 1.0487, test_loss: 1.0155, test_f1: 0.4547
 epoch: 34, train_loss: 1.0450, test_loss: 1.0354, test_f1: 0.4349
 epoch: 35, train_loss: 1.0311, test_loss: 1.0217, test_f1: 0.4387
 epoch: 36, train_loss: 1.0180, test_loss: 1.0081, test_f1: 0.4666
 epoch: 37, train_loss: 1.0244, test_loss: 1.0179, test_f1: 0.4620
 epoch: 38, train_loss: 1.0250, test_loss: 1.0123, test_f1: 0.4779
 epoch: 39, train_loss: 1.0194, test_loss: 0.9928, test_f1: 0.4664
 epoch: 40, train_loss: 1.0118, test_loss: 1.0027, test_f1: 0.4602
 epoch: 41, train_loss: 1.0081, test_loss: 0.9958, test_f1: 0.4808
 epoch: 42, train_loss: 0.9916, test_loss: 0.9969, test_f1: 0.4681
 epoch: 43, train_loss: 0.9990, test_loss: 1.0219, test_f1: 0.4561
 epoch: 44, train_loss: 1.0043, test_loss: 1.0120, test_f1: 0.4911
 epoch: 45, train_loss: 0.9997, test_loss: 0.9667, test_f1: 0.4936
 epoch: 46, train_loss: 1.0012, test_loss: 0.9740, test_f1: 0.4727
 epoch: 47, train_loss: 0.9925, test_loss: 0.9951, test_f1: 0.4669
 epoch: 48, train_loss: 0.9906, test_loss: 0.9684, test_f1: 0.4824
 epoch: 49, train_loss: 0.9834, test_loss: 1.0047, test_f1: 0.4582
 epoch: 50, train_loss: 0.9760, test_loss: 0.9749, test_f1: 0.4795
 epoch: 51, train_loss: 0.9707, test_loss: 0.9784, test_f1: 0.4783
 epoch: 52, train_loss: 0.9600, test_loss: 0.9981, test_f1: 0.4687
 epoch: 53, train_loss: 0.9599, test_loss: 0.9699, test_f1: 0.4867
 epoch: 54, train_loss: 0.9614, test_loss: 0.9889, test_f1: 0.4874
 epoch: 55, train_loss: 0.9505, test_loss: 0.9891, test_f1: 0.4726
 epoch: 56, train_loss: 0.9525, test_loss: 0.9967, test_f1: 0.4696
 epoch: 57, train_loss: 0.9456, test_loss: 1.0011, test_f1: 0.4667
 epoch: 58, train_loss: 0.9683, test_loss: 0.9757, test_f1: 0.4901
 epoch: 59, train_loss: 0.9379, test_loss: 0.9776, test_f1: 0.4835
 epoch: 60, train_loss: 0.9483, test_loss: 0.9984, test_f1: 0.4841
 epoch: 61, train_loss: 0.9586, test_loss: 1.0097, test_f1: 0.4719
 epoch: 62, train_loss: 0.9518, test_loss: 0.9774, test_f1: 0.4981
 epoch: 63, train_loss: 0.9311, test_loss: 1.0247, test_f1: 0.4620
 epoch: 64, train_loss: 0.9403, test_loss: 0.9995, test_f1: 0.4644
 epoch: 65, train_loss: 0.9339, test_loss: 0.9896, test_f1: 0.4743
 epoch: 66, train_loss: 0.9317, test_loss: 0.9808, test_f1: 0.4964
 epoch: 67, train_loss: 0.9356, test_loss: 0.9793, test_f1: 0.4889
 epoch: 68, train_loss: 0.9335, test_loss: 1.0238, test_f1: 0.4658
 epoch: 69, train_loss: 0.9278, test_loss: 0.9975, test_f1: 0.4785
 epoch: 70, train_loss: 0.9298, test_loss: 0.9962, test_f1: 0.4741
 epoch: 71, train_loss: 0.9327, test_loss: 0.9871, test_f1: 0.4712
 epoch: 72, train_loss: 0.9235, test_loss: 0.9807, test_f1: 0.4873
 epoch: 73, train_loss: 0.9283, test_loss: 1.0153, test_f1: 0.4648
 epoch: 74, train_loss: 0.9279, test_loss: 0.9945, test_f1: 0.4737
 epoch: 75, train_loss: 0.9203, test_loss: 0.9844, test_f1: 0.4654
 epoch: 76, train_loss: 0.9138, test_loss: 1.0005, test_f1: 0.4625
 epoch: 77, train_loss: 0.9229, test_loss: 0.9939, test_f1: 0.4844
 epoch: 78, train_loss: 0.9054, test_loss: 0.9952, test_f1: 0.4899
 epoch: 79, train_loss: 0.9109, test_loss: 1.0112, test_f1: 0.4676
 epoch: 80, train_loss: 0.9035, test_loss: 1.0070, test_f1: 0.4786
 epoch: 81, train_loss: 0.9080, test_loss: 0.9996, test_f1: 0.4891
 epoch: 82, train_loss: 0.9086, test_loss: 1.0132, test_f1: 0.4742
 epoch: 83, train_loss: 0.9096, test_loss: 1.0257, test_f1: 0.4682
 epoch: 84, train_loss: 0.9034, test_loss: 1.0106, test_f1: 0.4790
 epoch: 85, train_loss: 0.9022, test_loss: 1.0178, test_f1: 0.4672
 epoch: 86, train_loss: 0.9028, test_loss: 1.0106, test_f1: 0.4674
 epoch: 87, train_loss: 0.8954, test_loss: 0.9983, test_f1: 0.4709
 epoch: 88, train_loss: 0.8993, test_loss: 1.0429, test_f1: 0.4595
 epoch: 89, train_loss: 0.8861, test_loss: 1.0324, test_f1: 0.4581
 epoch: 90, train_loss: 0.8870, test_loss: 1.0242, test_f1: 0.4708
 epoch: 91, train_loss: 0.8935, test_loss: 1.0144, test_f1: 0.4711
 epoch: 92, train_loss: 0.8829, test_loss: 1.0486, test_f1: 0.4473
 epoch: 93, train_loss: 0.8864, test_loss: 1.0245, test_f1: 0.4695
 epoch: 94, train_loss: 0.8844, test_loss: 1.0194, test_f1: 0.4768
 epoch: 95, train_loss: 0.8930, test_loss: 0.9967, test_f1: 0.4915
 epoch: 96, train_loss: 0.8751, test_loss: 1.0299, test_f1: 0.4757
 epoch: 97, train_loss: 0.8817, test_loss: 1.0440, test_f1: 0.4727
 epoch: 98, train_loss: 0.8824, test_loss: 1.0481, test_f1: 0.4656
 epoch: 99, train_loss: 0.8788, test_loss: 1.0260, test_f1: 0.4910
##################ITERATION #5 ****************************************
 epoch: 0, train_loss: 1.3461, test_loss: 1.3358, test_f1: 0.2274
 epoch: 1, train_loss: 1.2620, test_loss: 1.2599, test_f1: 0.2292
 epoch: 2, train_loss: 1.2428, test_loss: 1.2281, test_f1: 0.2717
 epoch: 3, train_loss: 1.2246, test_loss: 1.2173, test_f1: 0.3099
 epoch: 4, train_loss: 1.2077, test_loss: 1.2013, test_f1: 0.3542
 epoch: 5, train_loss: 1.2095, test_loss: 1.1986, test_f1: 0.3206
 epoch: 6, train_loss: 1.1864, test_loss: 1.1882, test_f1: 0.3723
 epoch: 7, train_loss: 1.1911, test_loss: 1.1691, test_f1: 0.4088
 epoch: 8, train_loss: 1.1794, test_loss: 1.1633, test_f1: 0.4344
 epoch: 9, train_loss: 1.1715, test_loss: 1.1425, test_f1: 0.4210
 epoch: 10, train_loss: 1.1482, test_loss: 1.1444, test_f1: 0.4357
 epoch: 11, train_loss: 1.1546, test_loss: 1.1223, test_f1: 0.4354
 epoch: 12, train_loss: 1.1464, test_loss: 1.1081, test_f1: 0.4434
 epoch: 13, train_loss: 1.1345, test_loss: 1.0985, test_f1: 0.4575
 epoch: 14, train_loss: 1.1214, test_loss: 1.0837, test_f1: 0.4510
 epoch: 15, train_loss: 1.1201, test_loss: 1.0747, test_f1: 0.4520
 epoch: 16, train_loss: 1.1100, test_loss: 1.0640, test_f1: 0.4603
 epoch: 17, train_loss: 1.1071, test_loss: 1.0593, test_f1: 0.4574
 epoch: 18, train_loss: 1.0954, test_loss: 1.0685, test_f1: 0.4629
 epoch: 19, train_loss: 1.0798, test_loss: 1.0451, test_f1: 0.4592
 epoch: 20, train_loss: 1.0829, test_loss: 1.1111, test_f1: 0.4613
 epoch: 21, train_loss: 1.0740, test_loss: 1.0342, test_f1: 0.4645
 epoch: 22, train_loss: 1.0656, test_loss: 1.0389, test_f1: 0.4709
 epoch: 23, train_loss: 1.0576, test_loss: 1.0116, test_f1: 0.4731
 epoch: 24, train_loss: 1.0550, test_loss: 1.0020, test_f1: 0.4912
 epoch: 25, train_loss: 1.0415, test_loss: 1.0194, test_f1: 0.4697
 epoch: 26, train_loss: 1.0426, test_loss: 1.0211, test_f1: 0.4869
 epoch: 27, train_loss: 1.0313, test_loss: 1.0021, test_f1: 0.4917
 epoch: 28, train_loss: 1.0345, test_loss: 1.0110, test_f1: 0.4855
 epoch: 29, train_loss: 1.0071, test_loss: 1.0011, test_f1: 0.4677
 epoch: 30, train_loss: 1.0163, test_loss: 0.9913, test_f1: 0.4832
 epoch: 31, train_loss: 1.0042, test_loss: 0.9869, test_f1: 0.4765
 epoch: 32, train_loss: 0.9963, test_loss: 1.0136, test_f1: 0.4709
 epoch: 33, train_loss: 0.9949, test_loss: 0.9718, test_f1: 0.4867
 epoch: 34, train_loss: 0.9944, test_loss: 0.9847, test_f1: 0.4832
 epoch: 35, train_loss: 0.9778, test_loss: 0.9818, test_f1: 0.5034
 epoch: 36, train_loss: 0.9810, test_loss: 0.9724, test_f1: 0.4986
 epoch: 37, train_loss: 0.9791, test_loss: 0.9956, test_f1: 0.4858
 epoch: 38, train_loss: 0.9769, test_loss: 0.9953, test_f1: 0.4984
 epoch: 39, train_loss: 0.9687, test_loss: 0.9974, test_f1: 0.4946
 epoch: 40, train_loss: 0.9602, test_loss: 1.0120, test_f1: 0.4882
 epoch: 41, train_loss: 0.9564, test_loss: 0.9903, test_f1: 0.4881
 epoch: 42, train_loss: 0.9555, test_loss: 0.9996, test_f1: 0.4902
 epoch: 43, train_loss: 0.9484, test_loss: 1.0019, test_f1: 0.4870
 epoch: 44, train_loss: 0.9533, test_loss: 1.0179, test_f1: 0.4608
 epoch: 45, train_loss: 0.9488, test_loss: 1.0827, test_f1: 0.4725
 epoch: 46, train_loss: 0.9482, test_loss: 1.0257, test_f1: 0.4818
 epoch: 47, train_loss: 0.9470, test_loss: 0.9909, test_f1: 0.5001
 epoch: 48, train_loss: 0.9439, test_loss: 1.0212, test_f1: 0.4949
 epoch: 49, train_loss: 0.9269, test_loss: 0.9993, test_f1: 0.4812
 epoch: 50, train_loss: 0.9294, test_loss: 1.0449, test_f1: 0.4900
 epoch: 51, train_loss: 0.9163, test_loss: 1.0244, test_f1: 0.4983
 epoch: 52, train_loss: 0.9188, test_loss: 1.0484, test_f1: 0.4889
 epoch: 53, train_loss: 0.9190, test_loss: 1.0429, test_f1: 0.4939
 epoch: 54, train_loss: 0.9210, test_loss: 1.0508, test_f1: 0.4895
 epoch: 55, train_loss: 0.9076, test_loss: 1.0250, test_f1: 0.4991
 epoch: 56, train_loss: 0.9146, test_loss: 1.0736, test_f1: 0.4785
 epoch: 57, train_loss: 0.9094, test_loss: 1.0293, test_f1: 0.4908
 epoch: 58, train_loss: 0.9113, test_loss: 1.0284, test_f1: 0.4869
 epoch: 59, train_loss: 0.9183, test_loss: 1.0210, test_f1: 0.5044
 epoch: 60, train_loss: 0.9013, test_loss: 1.0740, test_f1: 0.4860
 epoch: 61, train_loss: 0.9065, test_loss: 1.0031, test_f1: 0.4976
 epoch: 62, train_loss: 0.9114, test_loss: 1.0849, test_f1: 0.4867
 epoch: 63, train_loss: 0.9086, test_loss: 1.0403, test_f1: 0.4913
 epoch: 64, train_loss: 0.8937, test_loss: 1.0633, test_f1: 0.4846
 epoch: 65, train_loss: 0.9046, test_loss: 1.0414, test_f1: 0.4954
 epoch: 66, train_loss: 0.8900, test_loss: 1.1045, test_f1: 0.4614
 epoch: 67, train_loss: 0.8959, test_loss: 1.0539, test_f1: 0.4935
 epoch: 68, train_loss: 0.8980, test_loss: 1.0258, test_f1: 0.5075
 epoch: 69, train_loss: 0.8898, test_loss: 1.0388, test_f1: 0.4985
 epoch: 70, train_loss: 0.8956, test_loss: 1.0680, test_f1: 0.4913
 epoch: 71, train_loss: 0.8924, test_loss: 1.0807, test_f1: 0.4916
 epoch: 72, train_loss: 0.8919, test_loss: 1.0716, test_f1: 0.4913
 epoch: 73, train_loss: 0.8908, test_loss: 1.0825, test_f1: 0.4804
 epoch: 74, train_loss: 0.8835, test_loss: 1.0992, test_f1: 0.4915
 epoch: 75, train_loss: 0.8775, test_loss: 1.0737, test_f1: 0.4865
 epoch: 76, train_loss: 0.8868, test_loss: 1.0210, test_f1: 0.4936
 epoch: 77, train_loss: 0.8900, test_loss: 1.0416, test_f1: 0.4980
 epoch: 78, train_loss: 0.8847, test_loss: 1.0648, test_f1: 0.4912
 epoch: 79, train_loss: 0.8821, test_loss: 1.0406, test_f1: 0.4780
 epoch: 80, train_loss: 0.8776, test_loss: 1.0712, test_f1: 0.4915
 epoch: 81, train_loss: 0.8824, test_loss: 1.0670, test_f1: 0.4887
 epoch: 82, train_loss: 0.8799, test_loss: 1.1168, test_f1: 0.4896
 epoch: 83, train_loss: 0.8812, test_loss: 1.1145, test_f1: 0.4853
 epoch: 84, train_loss: 0.8597, test_loss: 1.1038, test_f1: 0.4902
 epoch: 85, train_loss: 0.8689, test_loss: 1.0830, test_f1: 0.4884
 epoch: 86, train_loss: 0.8821, test_loss: 1.0692, test_f1: 0.4994
 epoch: 87, train_loss: 0.8757, test_loss: 1.1133, test_f1: 0.4843
 epoch: 88, train_loss: 0.8774, test_loss: 1.1030, test_f1: 0.4962
 epoch: 89, train_loss: 0.8618, test_loss: 1.0992, test_f1: 0.4912
 epoch: 90, train_loss: 0.8636, test_loss: 1.1481, test_f1: 0.4743
 epoch: 91, train_loss: 0.8657, test_loss: 1.0997, test_f1: 0.4967
 epoch: 92, train_loss: 0.8680, test_loss: 1.1528, test_f1: 0.4788
 epoch: 93, train_loss: 0.8581, test_loss: 1.1999, test_f1: 0.4763
 epoch: 94, train_loss: 0.8519, test_loss: 1.1809, test_f1: 0.4689
 epoch: 95, train_loss: 0.8639, test_loss: 1.1594, test_f1: 0.4834
 epoch: 96, train_loss: 0.8768, test_loss: 1.1383, test_f1: 0.4806
 epoch: 97, train_loss: 0.8660, test_loss: 1.1363, test_f1: 0.4947
 epoch: 98, train_loss: 0.8661, test_loss: 1.1209, test_f1: 0.4853
 epoch: 99, train_loss: 0.8607, test_loss: 1.1269, test_f1: 0.4780
##################ITERATION #6 ****************************************
 epoch: 0, train_loss: 1.4295, test_loss: 1.3412, test_f1: 0.2274
 epoch: 1, train_loss: 1.3032, test_loss: 1.2882, test_f1: 0.2294
 epoch: 2, train_loss: 1.2784, test_loss: 1.2517, test_f1: 0.2794
 epoch: 3, train_loss: 1.2540, test_loss: 1.2320, test_f1: 0.2988
 epoch: 4, train_loss: 1.2511, test_loss: 1.2138, test_f1: 0.3361
 epoch: 5, train_loss: 1.2379, test_loss: 1.1944, test_f1: 0.3615
 epoch: 6, train_loss: 1.2250, test_loss: 1.1819, test_f1: 0.3853
 epoch: 7, train_loss: 1.2189, test_loss: 1.1740, test_f1: 0.4263
 epoch: 8, train_loss: 1.2147, test_loss: 1.1721, test_f1: 0.3813
 epoch: 9, train_loss: 1.2132, test_loss: 1.1678, test_f1: 0.3977
 epoch: 10, train_loss: 1.2040, test_loss: 1.1590, test_f1: 0.4011
 epoch: 11, train_loss: 1.1933, test_loss: 1.1541, test_f1: 0.3950
 epoch: 12, train_loss: 1.1887, test_loss: 1.1361, test_f1: 0.4095
 epoch: 13, train_loss: 1.1821, test_loss: 1.1327, test_f1: 0.3950
 epoch: 14, train_loss: 1.1804, test_loss: 1.1185, test_f1: 0.4061
 epoch: 15, train_loss: 1.1710, test_loss: 1.1278, test_f1: 0.4163
 epoch: 16, train_loss: 1.1774, test_loss: 1.1109, test_f1: 0.4103
 epoch: 17, train_loss: 1.1658, test_loss: 1.1150, test_f1: 0.4149
 epoch: 18, train_loss: 1.1543, test_loss: 1.0994, test_f1: 0.4041
 epoch: 19, train_loss: 1.1509, test_loss: 1.0977, test_f1: 0.4028
 epoch: 20, train_loss: 1.1554, test_loss: 1.0878, test_f1: 0.4176
 epoch: 21, train_loss: 1.1405, test_loss: 1.0841, test_f1: 0.3953
 epoch: 22, train_loss: 1.1464, test_loss: 1.0840, test_f1: 0.4101
 epoch: 23, train_loss: 1.1393, test_loss: 1.0854, test_f1: 0.3908
 epoch: 24, train_loss: 1.1342, test_loss: 1.0718, test_f1: 0.4178
 epoch: 25, train_loss: 1.1416, test_loss: 1.0761, test_f1: 0.4058
 epoch: 26, train_loss: 1.1398, test_loss: 1.0666, test_f1: 0.4184
 epoch: 27, train_loss: 1.1350, test_loss: 1.0703, test_f1: 0.4169
 epoch: 28, train_loss: 1.1305, test_loss: 1.0602, test_f1: 0.4142
 epoch: 29, train_loss: 1.1125, test_loss: 1.0613, test_f1: 0.4136
 epoch: 30, train_loss: 1.1218, test_loss: 1.0623, test_f1: 0.4191
 epoch: 31, train_loss: 1.1109, test_loss: 1.0529, test_f1: 0.4235
 epoch: 32, train_loss: 1.1130, test_loss: 1.0442, test_f1: 0.4503
 epoch: 33, train_loss: 1.1064, test_loss: 1.0368, test_f1: 0.4564
 epoch: 34, train_loss: 1.1067, test_loss: 1.0533, test_f1: 0.4113
 epoch: 35, train_loss: 1.0866, test_loss: 1.0360, test_f1: 0.4593
 epoch: 36, train_loss: 1.0814, test_loss: 1.0330, test_f1: 0.4371
 epoch: 37, train_loss: 1.0927, test_loss: 1.0332, test_f1: 0.4507
 epoch: 38, train_loss: 1.0843, test_loss: 1.0210, test_f1: 0.4536
 epoch: 39, train_loss: 1.0757, test_loss: 1.0148, test_f1: 0.4507
 epoch: 40, train_loss: 1.0616, test_loss: 1.0250, test_f1: 0.4505
 epoch: 41, train_loss: 1.0683, test_loss: 1.0030, test_f1: 0.4507
 epoch: 42, train_loss: 1.0506, test_loss: 1.0128, test_f1: 0.4418
 epoch: 43, train_loss: 1.0535, test_loss: 1.0015, test_f1: 0.4490
 epoch: 44, train_loss: 1.0446, test_loss: 0.9981, test_f1: 0.4398
 epoch: 45, train_loss: 1.0479, test_loss: 0.9956, test_f1: 0.4364
 epoch: 46, train_loss: 1.0397, test_loss: 0.9770, test_f1: 0.4556
 epoch: 47, train_loss: 1.0425, test_loss: 0.9924, test_f1: 0.4525
 epoch: 48, train_loss: 1.0282, test_loss: 0.9903, test_f1: 0.4472
 epoch: 49, train_loss: 1.0337, test_loss: 0.9976, test_f1: 0.4549
 epoch: 50, train_loss: 1.0186, test_loss: 0.9891, test_f1: 0.4519
 epoch: 51, train_loss: 1.0116, test_loss: 0.9945, test_f1: 0.4489
 epoch: 52, train_loss: 1.0151, test_loss: 0.9767, test_f1: 0.4604
 epoch: 53, train_loss: 1.0050, test_loss: 0.9856, test_f1: 0.4540
 epoch: 54, train_loss: 1.0026, test_loss: 0.9824, test_f1: 0.4527
 epoch: 55, train_loss: 0.9972, test_loss: 0.9859, test_f1: 0.4547
 epoch: 56, train_loss: 1.0015, test_loss: 0.9826, test_f1: 0.4578
 epoch: 57, train_loss: 1.0040, test_loss: 0.9727, test_f1: 0.4590
 epoch: 58, train_loss: 0.9942, test_loss: 0.9884, test_f1: 0.4544
 epoch: 59, train_loss: 0.9929, test_loss: 0.9853, test_f1: 0.4530
 epoch: 60, train_loss: 0.9915, test_loss: 0.9679, test_f1: 0.4588
 epoch: 61, train_loss: 0.9909, test_loss: 0.9808, test_f1: 0.4528
 epoch: 62, train_loss: 0.9912, test_loss: 0.9779, test_f1: 0.4573
 epoch: 63, train_loss: 0.9848, test_loss: 0.9720, test_f1: 0.4579
 epoch: 64, train_loss: 0.9933, test_loss: 0.9943, test_f1: 0.4511
 epoch: 65, train_loss: 0.9918, test_loss: 0.9778, test_f1: 0.4569
 epoch: 66, train_loss: 0.9888, test_loss: 0.9679, test_f1: 0.4531
 epoch: 67, train_loss: 0.9846, test_loss: 0.9720, test_f1: 0.4577
 epoch: 68, train_loss: 0.9812, test_loss: 0.9852, test_f1: 0.4586
 epoch: 69, train_loss: 0.9747, test_loss: 0.9707, test_f1: 0.4661
 epoch: 70, train_loss: 0.9729, test_loss: 0.9707, test_f1: 0.4583
 epoch: 71, train_loss: 0.9688, test_loss: 0.9705, test_f1: 0.4636
 epoch: 72, train_loss: 0.9709, test_loss: 0.9743, test_f1: 0.4613
 epoch: 73, train_loss: 0.9629, test_loss: 0.9550, test_f1: 0.4684
 epoch: 74, train_loss: 0.9679, test_loss: 0.9609, test_f1: 0.4760
 epoch: 75, train_loss: 0.9625, test_loss: 0.9880, test_f1: 0.4504
 epoch: 76, train_loss: 0.9661, test_loss: 0.9659, test_f1: 0.4637
 epoch: 77, train_loss: 0.9572, test_loss: 0.9703, test_f1: 0.4570
 epoch: 78, train_loss: 0.9627, test_loss: 0.9940, test_f1: 0.4591
 epoch: 79, train_loss: 0.9581, test_loss: 0.9815, test_f1: 0.4614
 epoch: 80, train_loss: 0.9521, test_loss: 0.9924, test_f1: 0.4567
 epoch: 81, train_loss: 0.9604, test_loss: 0.9686, test_f1: 0.4654
 epoch: 82, train_loss: 0.9555, test_loss: 0.9823, test_f1: 0.4695
 epoch: 83, train_loss: 0.9530, test_loss: 0.9742, test_f1: 0.4700
 epoch: 84, train_loss: 0.9568, test_loss: 0.9914, test_f1: 0.4690
 epoch: 85, train_loss: 0.9576, test_loss: 0.9967, test_f1: 0.4846
 epoch: 86, train_loss: 0.9548, test_loss: 0.9940, test_f1: 0.4647
 epoch: 87, train_loss: 0.9566, test_loss: 0.9984, test_f1: 0.4689
 epoch: 88, train_loss: 0.9473, test_loss: 0.9800, test_f1: 0.4665
 epoch: 89, train_loss: 0.9601, test_loss: 0.9748, test_f1: 0.4701
 epoch: 90, train_loss: 0.9443, test_loss: 0.9983, test_f1: 0.4546
 epoch: 91, train_loss: 0.9512, test_loss: 0.9938, test_f1: 0.4660
 epoch: 92, train_loss: 0.9451, test_loss: 0.9942, test_f1: 0.4605
 epoch: 93, train_loss: 0.9431, test_loss: 1.0044, test_f1: 0.4596
 epoch: 94, train_loss: 0.9390, test_loss: 0.9855, test_f1: 0.4687
 epoch: 95, train_loss: 0.9425, test_loss: 1.0047, test_f1: 0.4583
 epoch: 96, train_loss: 0.9443, test_loss: 1.0018, test_f1: 0.4543
 epoch: 97, train_loss: 0.9305, test_loss: 0.9944, test_f1: 0.4637
 epoch: 98, train_loss: 0.9426, test_loss: 0.9935, test_f1: 0.4659
 epoch: 99, train_loss: 0.9348, test_loss: 0.9954, test_f1: 0.4673
##################ITERATION #7 ****************************************
 epoch: 0, train_loss: 1.4269, test_loss: 1.3369, test_f1: 0.2831
 epoch: 1, train_loss: 1.2739, test_loss: 1.2703, test_f1: 0.2422
 epoch: 2, train_loss: 1.2629, test_loss: 1.2288, test_f1: 0.3134
 epoch: 3, train_loss: 1.2482, test_loss: 1.2051, test_f1: 0.3329
 epoch: 4, train_loss: 1.2351, test_loss: 1.2027, test_f1: 0.3244
 epoch: 5, train_loss: 1.2264, test_loss: 1.2000, test_f1: 0.3223
 epoch: 6, train_loss: 1.2252, test_loss: 1.1809, test_f1: 0.3508
 epoch: 7, train_loss: 1.2120, test_loss: 1.1757, test_f1: 0.3744
 epoch: 8, train_loss: 1.2138, test_loss: 1.1570, test_f1: 0.4046
 epoch: 9, train_loss: 1.1983, test_loss: 1.1507, test_f1: 0.3954
 epoch: 10, train_loss: 1.1917, test_loss: 1.1426, test_f1: 0.3911
 epoch: 11, train_loss: 1.1750, test_loss: 1.1204, test_f1: 0.4295
 epoch: 12, train_loss: 1.1752, test_loss: 1.1109, test_f1: 0.4177
 epoch: 13, train_loss: 1.1603, test_loss: 1.0994, test_f1: 0.4250
 epoch: 14, train_loss: 1.1664, test_loss: 1.0998, test_f1: 0.4309
 epoch: 15, train_loss: 1.1495, test_loss: 1.0899, test_f1: 0.4325
 epoch: 16, train_loss: 1.1511, test_loss: 1.0807, test_f1: 0.4353
 epoch: 17, train_loss: 1.1354, test_loss: 1.0771, test_f1: 0.4246
 epoch: 18, train_loss: 1.1263, test_loss: 1.0635, test_f1: 0.4506
 epoch: 19, train_loss: 1.1286, test_loss: 1.0539, test_f1: 0.4542
 epoch: 20, train_loss: 1.1271, test_loss: 1.0499, test_f1: 0.4465
 epoch: 21, train_loss: 1.1211, test_loss: 1.0523, test_f1: 0.4423
 epoch: 22, train_loss: 1.1185, test_loss: 1.0427, test_f1: 0.4426
 epoch: 23, train_loss: 1.1118, test_loss: 1.0417, test_f1: 0.4593
 epoch: 24, train_loss: 1.1017, test_loss: 1.0322, test_f1: 0.4617
 epoch: 25, train_loss: 1.0990, test_loss: 1.0330, test_f1: 0.4635
 epoch: 26, train_loss: 1.0937, test_loss: 1.0331, test_f1: 0.4701
 epoch: 27, train_loss: 1.0738, test_loss: 1.0149, test_f1: 0.4701
 epoch: 28, train_loss: 1.0867, test_loss: 1.0070, test_f1: 0.4669
 epoch: 29, train_loss: 1.0772, test_loss: 1.0254, test_f1: 0.4609
 epoch: 30, train_loss: 1.0646, test_loss: 1.0044, test_f1: 0.4562
 epoch: 31, train_loss: 1.0679, test_loss: 1.0003, test_f1: 0.4600
 epoch: 32, train_loss: 1.0614, test_loss: 1.0001, test_f1: 0.4665
 epoch: 33, train_loss: 1.0597, test_loss: 1.0009, test_f1: 0.4576
 epoch: 34, train_loss: 1.0613, test_loss: 0.9877, test_f1: 0.4573
 epoch: 35, train_loss: 1.0543, test_loss: 0.9939, test_f1: 0.4652
 epoch: 36, train_loss: 1.0537, test_loss: 0.9673, test_f1: 0.4776
 epoch: 37, train_loss: 1.0449, test_loss: 0.9751, test_f1: 0.4599
 epoch: 38, train_loss: 1.0387, test_loss: 0.9624, test_f1: 0.4631
 epoch: 39, train_loss: 1.0296, test_loss: 0.9648, test_f1: 0.4677
 epoch: 40, train_loss: 1.0378, test_loss: 0.9657, test_f1: 0.4561
 epoch: 41, train_loss: 1.0190, test_loss: 1.0212, test_f1: 0.4478
 epoch: 42, train_loss: 1.0264, test_loss: 0.9578, test_f1: 0.4615
 epoch: 43, train_loss: 1.0217, test_loss: 0.9407, test_f1: 0.4749
 epoch: 44, train_loss: 1.0133, test_loss: 0.9440, test_f1: 0.4860
 epoch: 45, train_loss: 1.0106, test_loss: 0.9434, test_f1: 0.4758
 epoch: 46, train_loss: 1.0118, test_loss: 0.9450, test_f1: 0.4843
 epoch: 47, train_loss: 0.9972, test_loss: 0.9422, test_f1: 0.4785
 epoch: 48, train_loss: 1.0012, test_loss: 0.9581, test_f1: 0.4622
 epoch: 49, train_loss: 0.9938, test_loss: 0.9393, test_f1: 0.4793
 epoch: 50, train_loss: 0.9949, test_loss: 0.9334, test_f1: 0.4896
 epoch: 51, train_loss: 0.9920, test_loss: 0.9464, test_f1: 0.4773
 epoch: 52, train_loss: 0.9711, test_loss: 0.9501, test_f1: 0.4794
 epoch: 53, train_loss: 0.9849, test_loss: 0.9412, test_f1: 0.4792
 epoch: 54, train_loss: 0.9767, test_loss: 0.9495, test_f1: 0.4864
 epoch: 55, train_loss: 0.9811, test_loss: 0.9672, test_f1: 0.4883
 epoch: 56, train_loss: 0.9814, test_loss: 0.9562, test_f1: 0.4876
 epoch: 57, train_loss: 0.9710, test_loss: 0.9382, test_f1: 0.4943
 epoch: 58, train_loss: 0.9716, test_loss: 0.9416, test_f1: 0.4811
 epoch: 59, train_loss: 0.9851, test_loss: 0.9391, test_f1: 0.4941
 epoch: 60, train_loss: 0.9659, test_loss: 0.9498, test_f1: 0.4964
 epoch: 61, train_loss: 0.9741, test_loss: 0.9267, test_f1: 0.4884
 epoch: 62, train_loss: 0.9711, test_loss: 0.9474, test_f1: 0.4899
 epoch: 63, train_loss: 0.9621, test_loss: 0.9468, test_f1: 0.4961
 epoch: 64, train_loss: 0.9732, test_loss: 0.9586, test_f1: 0.4953
 epoch: 65, train_loss: 0.9533, test_loss: 0.9623, test_f1: 0.4863
 epoch: 66, train_loss: 0.9644, test_loss: 0.9495, test_f1: 0.4898
 epoch: 67, train_loss: 0.9699, test_loss: 0.9384, test_f1: 0.4974
 epoch: 68, train_loss: 0.9662, test_loss: 0.9417, test_f1: 0.4879
 epoch: 69, train_loss: 0.9565, test_loss: 0.9654, test_f1: 0.4825
 epoch: 70, train_loss: 0.9582, test_loss: 0.9654, test_f1: 0.4807
 epoch: 71, train_loss: 0.9592, test_loss: 0.9592, test_f1: 0.4842
 epoch: 72, train_loss: 0.9645, test_loss: 0.9778, test_f1: 0.4831
 epoch: 73, train_loss: 0.9527, test_loss: 0.9783, test_f1: 0.4776
 epoch: 74, train_loss: 0.9455, test_loss: 0.9796, test_f1: 0.4860
 epoch: 75, train_loss: 0.9342, test_loss: 0.9592, test_f1: 0.4839
 epoch: 76, train_loss: 0.9389, test_loss: 0.9635, test_f1: 0.4889
 epoch: 77, train_loss: 0.9391, test_loss: 1.0100, test_f1: 0.4858
 epoch: 78, train_loss: 0.9493, test_loss: 0.9782, test_f1: 0.5019
 epoch: 79, train_loss: 0.9456, test_loss: 0.9815, test_f1: 0.4830
 epoch: 80, train_loss: 0.9355, test_loss: 0.9810, test_f1: 0.4807
 epoch: 81, train_loss: 0.9349, test_loss: 0.9884, test_f1: 0.4773
 epoch: 82, train_loss: 0.9304, test_loss: 0.9898, test_f1: 0.4636
 epoch: 83, train_loss: 0.9423, test_loss: 0.9999, test_f1: 0.4744
 epoch: 84, train_loss: 0.9295, test_loss: 1.0206, test_f1: 0.4844
 epoch: 85, train_loss: 0.9411, test_loss: 0.9819, test_f1: 0.4780
 epoch: 86, train_loss: 0.9228, test_loss: 0.9483, test_f1: 0.4771
 epoch: 87, train_loss: 0.9373, test_loss: 1.0147, test_f1: 0.4757
 epoch: 88, train_loss: 0.9330, test_loss: 0.9880, test_f1: 0.4785
 epoch: 89, train_loss: 0.9250, test_loss: 0.9842, test_f1: 0.4781
 epoch: 90, train_loss: 0.9333, test_loss: 0.9775, test_f1: 0.4754
 epoch: 91, train_loss: 0.9312, test_loss: 0.9733, test_f1: 0.4797
 epoch: 92, train_loss: 0.9201, test_loss: 0.9885, test_f1: 0.4718
 epoch: 93, train_loss: 0.9210, test_loss: 0.9897, test_f1: 0.4756
 epoch: 94, train_loss: 0.9192, test_loss: 0.9880, test_f1: 0.4693
 epoch: 95, train_loss: 0.9225, test_loss: 0.9937, test_f1: 0.4759
 epoch: 96, train_loss: 0.9150, test_loss: 1.0077, test_f1: 0.4778
 epoch: 97, train_loss: 0.9292, test_loss: 0.9809, test_f1: 0.4817
 epoch: 98, train_loss: 0.9254, test_loss: 1.0077, test_f1: 0.4749
 epoch: 99, train_loss: 0.9187, test_loss: 0.9849, test_f1: 0.4762
##################ITERATION #8 ****************************************
 epoch: 0, train_loss: 1.6621, test_loss: 1.3742, test_f1: 0.2352
 epoch: 1, train_loss: 1.3694, test_loss: 1.3036, test_f1: 0.2397
 epoch: 2, train_loss: 1.3234, test_loss: 1.2630, test_f1: 0.2841
 epoch: 3, train_loss: 1.2951, test_loss: 1.2442, test_f1: 0.2903
 epoch: 4, train_loss: 1.2702, test_loss: 1.2243, test_f1: 0.2791
 epoch: 5, train_loss: 1.2670, test_loss: 1.2181, test_f1: 0.2921
 epoch: 6, train_loss: 1.2557, test_loss: 1.2065, test_f1: 0.3238
 epoch: 7, train_loss: 1.2391, test_loss: 1.1964, test_f1: 0.3189
 epoch: 8, train_loss: 1.2272, test_loss: 1.1810, test_f1: 0.3306
 epoch: 9, train_loss: 1.2247, test_loss: 1.1720, test_f1: 0.3674
 epoch: 10, train_loss: 1.2084, test_loss: 1.1561, test_f1: 0.4098
 epoch: 11, train_loss: 1.1997, test_loss: 1.1438, test_f1: 0.4097
 epoch: 12, train_loss: 1.1895, test_loss: 1.1372, test_f1: 0.4162
 epoch: 13, train_loss: 1.1841, test_loss: 1.1251, test_f1: 0.4351
 epoch: 14, train_loss: 1.1728, test_loss: 1.1121, test_f1: 0.4592
 epoch: 15, train_loss: 1.1652, test_loss: 1.1014, test_f1: 0.4628
 epoch: 16, train_loss: 1.1574, test_loss: 1.0907, test_f1: 0.4654
 epoch: 17, train_loss: 1.1443, test_loss: 1.0821, test_f1: 0.4869
 epoch: 18, train_loss: 1.1428, test_loss: 1.0752, test_f1: 0.4824
 epoch: 19, train_loss: 1.1275, test_loss: 1.0654, test_f1: 0.4702
 epoch: 20, train_loss: 1.1072, test_loss: 1.0526, test_f1: 0.4650
 epoch: 21, train_loss: 1.1004, test_loss: 1.0274, test_f1: 0.4835
 epoch: 22, train_loss: 1.1007, test_loss: 1.0251, test_f1: 0.4863
 epoch: 23, train_loss: 1.0913, test_loss: 1.0221, test_f1: 0.4829
 epoch: 24, train_loss: 1.0814, test_loss: 1.0085, test_f1: 0.4695
 epoch: 25, train_loss: 1.0681, test_loss: 0.9966, test_f1: 0.4675
 epoch: 26, train_loss: 1.0674, test_loss: 1.0003, test_f1: 0.4743
 epoch: 27, train_loss: 1.0651, test_loss: 0.9954, test_f1: 0.4506
 epoch: 28, train_loss: 1.0553, test_loss: 0.9825, test_f1: 0.4586
 epoch: 29, train_loss: 1.0489, test_loss: 0.9793, test_f1: 0.4760
 epoch: 30, train_loss: 1.0388, test_loss: 0.9741, test_f1: 0.4719
 epoch: 31, train_loss: 1.0391, test_loss: 0.9658, test_f1: 0.4824
 epoch: 32, train_loss: 1.0246, test_loss: 0.9618, test_f1: 0.4786
 epoch: 33, train_loss: 1.0137, test_loss: 0.9766, test_f1: 0.4626
 epoch: 34, train_loss: 1.0283, test_loss: 0.9440, test_f1: 0.4995
 epoch: 35, train_loss: 1.0254, test_loss: 0.9522, test_f1: 0.4916
 epoch: 36, train_loss: 1.0215, test_loss: 0.9349, test_f1: 0.4900
 epoch: 37, train_loss: 1.0086, test_loss: 0.9583, test_f1: 0.4814
 epoch: 38, train_loss: 1.0082, test_loss: 0.9382, test_f1: 0.4853
 epoch: 39, train_loss: 0.9967, test_loss: 0.9278, test_f1: 0.4988
 epoch: 40, train_loss: 0.9883, test_loss: 0.9349, test_f1: 0.4884
 epoch: 41, train_loss: 0.9892, test_loss: 0.9339, test_f1: 0.4957
 epoch: 42, train_loss: 0.9810, test_loss: 0.9526, test_f1: 0.4788
 epoch: 43, train_loss: 0.9910, test_loss: 0.9201, test_f1: 0.5032
 epoch: 44, train_loss: 0.9850, test_loss: 0.9325, test_f1: 0.5014
 epoch: 45, train_loss: 0.9816, test_loss: 0.9140, test_f1: 0.5043
 epoch: 46, train_loss: 0.9664, test_loss: 0.9070, test_f1: 0.4980
 epoch: 47, train_loss: 0.9656, test_loss: 0.8989, test_f1: 0.5187
 epoch: 48, train_loss: 0.9678, test_loss: 0.9123, test_f1: 0.5173
 epoch: 49, train_loss: 0.9659, test_loss: 0.9222, test_f1: 0.4757
 epoch: 50, train_loss: 0.9632, test_loss: 0.9044, test_f1: 0.4967
 epoch: 51, train_loss: 0.9639, test_loss: 0.9057, test_f1: 0.5062
 epoch: 52, train_loss: 0.9603, test_loss: 0.9005, test_f1: 0.5064
 epoch: 53, train_loss: 0.9535, test_loss: 0.8963, test_f1: 0.4920
 epoch: 54, train_loss: 0.9610, test_loss: 0.9096, test_f1: 0.4988
 epoch: 55, train_loss: 0.9600, test_loss: 0.9007, test_f1: 0.4814
 epoch: 56, train_loss: 0.9487, test_loss: 0.8964, test_f1: 0.4959
 epoch: 57, train_loss: 0.9392, test_loss: 0.8987, test_f1: 0.4963
 epoch: 58, train_loss: 0.9338, test_loss: 0.9017, test_f1: 0.4927
 epoch: 59, train_loss: 0.9515, test_loss: 0.8899, test_f1: 0.5019
 epoch: 60, train_loss: 0.9409, test_loss: 0.9064, test_f1: 0.5018
 epoch: 61, train_loss: 0.9382, test_loss: 0.9159, test_f1: 0.4928
 epoch: 62, train_loss: 0.9371, test_loss: 0.8933, test_f1: 0.5020
 epoch: 63, train_loss: 0.9348, test_loss: 0.8961, test_f1: 0.4963
 epoch: 64, train_loss: 0.9374, test_loss: 0.9105, test_f1: 0.4857
 epoch: 65, train_loss: 0.9271, test_loss: 0.8949, test_f1: 0.4987
 epoch: 66, train_loss: 0.9355, test_loss: 0.9011, test_f1: 0.5395
 epoch: 67, train_loss: 0.9222, test_loss: 0.9001, test_f1: 0.5135
 epoch: 68, train_loss: 0.9247, test_loss: 0.9060, test_f1: 0.4937
 epoch: 69, train_loss: 0.9234, test_loss: 0.8850, test_f1: 0.5143
 epoch: 70, train_loss: 0.9125, test_loss: 0.8907, test_f1: 0.5284
 epoch: 71, train_loss: 0.9181, test_loss: 0.8855, test_f1: 0.5055
 epoch: 72, train_loss: 0.9308, test_loss: 0.8985, test_f1: 0.4834
 epoch: 73, train_loss: 0.9219, test_loss: 0.9009, test_f1: 0.4943
 epoch: 74, train_loss: 0.9162, test_loss: 0.9039, test_f1: 0.5136
 epoch: 75, train_loss: 0.9177, test_loss: 0.8933, test_f1: 0.4963
 epoch: 76, train_loss: 0.9098, test_loss: 0.8917, test_f1: 0.5062
 epoch: 77, train_loss: 0.9227, test_loss: 0.8989, test_f1: 0.4986
 epoch: 78, train_loss: 0.9117, test_loss: 0.9009, test_f1: 0.5212
 epoch: 79, train_loss: 0.9164, test_loss: 0.8937, test_f1: 0.4981
 epoch: 80, train_loss: 0.9138, test_loss: 0.8981, test_f1: 0.4925
 epoch: 81, train_loss: 0.9122, test_loss: 0.8927, test_f1: 0.5050
 epoch: 82, train_loss: 0.9162, test_loss: 0.8849, test_f1: 0.5160
 epoch: 83, train_loss: 0.9174, test_loss: 0.8904, test_f1: 0.5375
 epoch: 84, train_loss: 0.9045, test_loss: 0.8831, test_f1: 0.5146
 epoch: 85, train_loss: 0.9021, test_loss: 0.8924, test_f1: 0.5289
 epoch: 86, train_loss: 0.9030, test_loss: 0.8925, test_f1: 0.5215
 epoch: 87, train_loss: 0.9080, test_loss: 0.8803, test_f1: 0.5480
 epoch: 88, train_loss: 0.9200, test_loss: 0.8795, test_f1: 0.5294
 epoch: 89, train_loss: 0.9056, test_loss: 0.8899, test_f1: 0.5182
 epoch: 90, train_loss: 0.8931, test_loss: 0.8941, test_f1: 0.5247
 epoch: 91, train_loss: 0.9056, test_loss: 0.8957, test_f1: 0.4955
 epoch: 92, train_loss: 0.9086, test_loss: 0.8886, test_f1: 0.4906
 epoch: 93, train_loss: 0.8933, test_loss: 0.8957, test_f1: 0.5140
 epoch: 94, train_loss: 0.8958, test_loss: 0.8886, test_f1: 0.5144
 epoch: 95, train_loss: 0.8965, test_loss: 0.8908, test_f1: 0.5025
 epoch: 96, train_loss: 0.8941, test_loss: 0.8885, test_f1: 0.5040
 epoch: 97, train_loss: 0.9048, test_loss: 0.8857, test_f1: 0.4940
 epoch: 98, train_loss: 0.8868, test_loss: 0.8846, test_f1: 0.5099
 epoch: 99, train_loss: 0.8984, test_loss: 0.8884, test_f1: 0.5072
##################ITERATION #9 ****************************************
 epoch: 0, train_loss: 1.4742, test_loss: 1.3214, test_f1: 0.2479
 epoch: 1, train_loss: 1.2971, test_loss: 1.2164, test_f1: 0.3120
 epoch: 2, train_loss: 1.2643, test_loss: 1.1796, test_f1: 0.3370
 epoch: 3, train_loss: 1.2349, test_loss: 1.1542, test_f1: 0.3833
 epoch: 4, train_loss: 1.2103, test_loss: 1.1282, test_f1: 0.3972
 epoch: 5, train_loss: 1.1948, test_loss: 1.1119, test_f1: 0.4232
 epoch: 6, train_loss: 1.1810, test_loss: 1.1108, test_f1: 0.4154
 epoch: 7, train_loss: 1.1634, test_loss: 1.0853, test_f1: 0.4354
 epoch: 8, train_loss: 1.1532, test_loss: 1.0436, test_f1: 0.4727
 epoch: 9, train_loss: 1.1305, test_loss: 1.0501, test_f1: 0.4419
 epoch: 10, train_loss: 1.1218, test_loss: 1.0484, test_f1: 0.4396
 epoch: 11, train_loss: 1.1022, test_loss: 1.0266, test_f1: 0.4511
 epoch: 12, train_loss: 1.0826, test_loss: 1.0172, test_f1: 0.4491
 epoch: 13, train_loss: 1.0875, test_loss: 1.0172, test_f1: 0.4620
 epoch: 14, train_loss: 1.0814, test_loss: 0.9904, test_f1: 0.4816
 epoch: 15, train_loss: 1.0646, test_loss: 0.9826, test_f1: 0.4688
 epoch: 16, train_loss: 1.0629, test_loss: 0.9712, test_f1: 0.4779
 epoch: 17, train_loss: 1.0571, test_loss: 0.9731, test_f1: 0.4669
 epoch: 18, train_loss: 1.0478, test_loss: 0.9702, test_f1: 0.4712
 epoch: 19, train_loss: 1.0346, test_loss: 0.9497, test_f1: 0.4707
 epoch: 20, train_loss: 1.0266, test_loss: 0.9523, test_f1: 0.4917
 epoch: 21, train_loss: 1.0258, test_loss: 0.9482, test_f1: 0.4826
 epoch: 22, train_loss: 1.0310, test_loss: 0.9497, test_f1: 0.4799
 epoch: 23, train_loss: 1.0249, test_loss: 0.9334, test_f1: 0.4855
 epoch: 24, train_loss: 1.0273, test_loss: 0.9604, test_f1: 0.4828
 epoch: 25, train_loss: 1.0218, test_loss: 0.9420, test_f1: 0.4908
 epoch: 26, train_loss: 1.0187, test_loss: 0.9386, test_f1: 0.4883
 epoch: 27, train_loss: 1.0081, test_loss: 0.9302, test_f1: 0.4913
 epoch: 28, train_loss: 1.0154, test_loss: 0.9328, test_f1: 0.4857
 epoch: 29, train_loss: 1.0044, test_loss: 0.9223, test_f1: 0.4860
 epoch: 30, train_loss: 1.0017, test_loss: 0.9368, test_f1: 0.4951
 epoch: 31, train_loss: 0.9890, test_loss: 0.9177, test_f1: 0.4715
 epoch: 32, train_loss: 0.9852, test_loss: 0.9253, test_f1: 0.4942
 epoch: 33, train_loss: 0.9969, test_loss: 0.9115, test_f1: 0.4890
 epoch: 34, train_loss: 0.9852, test_loss: 0.9203, test_f1: 0.4916
 epoch: 35, train_loss: 0.9816, test_loss: 0.9143, test_f1: 0.4951
 epoch: 36, train_loss: 0.9758, test_loss: 0.9018, test_f1: 0.5110
 epoch: 37, train_loss: 0.9861, test_loss: 1.0204, test_f1: 0.4737
 epoch: 38, train_loss: 0.9919, test_loss: 0.8942, test_f1: 0.5086
 epoch: 39, train_loss: 0.9757, test_loss: 0.9107, test_f1: 0.4911
 epoch: 40, train_loss: 0.9684, test_loss: 0.8791, test_f1: 0.5149
 epoch: 41, train_loss: 0.9684, test_loss: 0.9036, test_f1: 0.5053
 epoch: 42, train_loss: 0.9640, test_loss: 0.8818, test_f1: 0.5051
 epoch: 43, train_loss: 0.9566, test_loss: 0.8920, test_f1: 0.5092
 epoch: 44, train_loss: 0.9639, test_loss: 0.8805, test_f1: 0.5110
 epoch: 45, train_loss: 0.9629, test_loss: 0.8870, test_f1: 0.5100
 epoch: 46, train_loss: 0.9544, test_loss: 0.8805, test_f1: 0.5091
 epoch: 47, train_loss: 0.9571, test_loss: 0.9316, test_f1: 0.4964
 epoch: 48, train_loss: 0.9611, test_loss: 0.9176, test_f1: 0.4802
 epoch: 49, train_loss: 0.9448, test_loss: 0.8929, test_f1: 0.4912
 epoch: 50, train_loss: 0.9538, test_loss: 0.8768, test_f1: 0.4978
 epoch: 51, train_loss: 0.9410, test_loss: 0.8802, test_f1: 0.5189
 epoch: 52, train_loss: 0.9416, test_loss: 0.8760, test_f1: 0.5149
 epoch: 53, train_loss: 0.9296, test_loss: 0.8841, test_f1: 0.5072
 epoch: 54, train_loss: 0.9285, test_loss: 0.8869, test_f1: 0.5087
 epoch: 55, train_loss: 0.9307, test_loss: 0.8961, test_f1: 0.5018
 epoch: 56, train_loss: 0.9312, test_loss: 0.9106, test_f1: 0.4970
 epoch: 57, train_loss: 0.9318, test_loss: 0.8805, test_f1: 0.5090
 epoch: 58, train_loss: 0.9198, test_loss: 0.8724, test_f1: 0.5086
 epoch: 59, train_loss: 0.9286, test_loss: 0.8895, test_f1: 0.5086
 epoch: 60, train_loss: 0.9170, test_loss: 0.8821, test_f1: 0.5102
 epoch: 61, train_loss: 0.9209, test_loss: 0.8752, test_f1: 0.5103
 epoch: 62, train_loss: 0.9160, test_loss: 0.8839, test_f1: 0.5098
 epoch: 63, train_loss: 0.9176, test_loss: 0.8764, test_f1: 0.5040
 epoch: 64, train_loss: 0.9265, test_loss: 0.8724, test_f1: 0.5263
 epoch: 65, train_loss: 0.9109, test_loss: 0.9097, test_f1: 0.5102
 epoch: 66, train_loss: 0.9212, test_loss: 0.9067, test_f1: 0.5032
 epoch: 67, train_loss: 0.9153, test_loss: 0.9065, test_f1: 0.5048
 epoch: 68, train_loss: 0.9169, test_loss: 0.8956, test_f1: 0.5146
 epoch: 69, train_loss: 0.9129, test_loss: 0.8791, test_f1: 0.5063
 epoch: 70, train_loss: 0.9023, test_loss: 0.9021, test_f1: 0.5077
 epoch: 71, train_loss: 0.8977, test_loss: 0.9032, test_f1: 0.5192
 epoch: 72, train_loss: 0.9086, test_loss: 0.8863, test_f1: 0.5134
 epoch: 73, train_loss: 0.9158, test_loss: 0.9054, test_f1: 0.5087
 epoch: 74, train_loss: 0.9097, test_loss: 0.8689, test_f1: 0.5142
 epoch: 75, train_loss: 0.9038, test_loss: 0.9087, test_f1: 0.5199
 epoch: 76, train_loss: 0.9029, test_loss: 0.9193, test_f1: 0.5097
 epoch: 77, train_loss: 0.8987, test_loss: 0.9397, test_f1: 0.5089
 epoch: 78, train_loss: 0.9118, test_loss: 0.8844, test_f1: 0.5204
 epoch: 79, train_loss: 0.9014, test_loss: 0.9283, test_f1: 0.5194
 epoch: 80, train_loss: 0.9049, test_loss: 0.9307, test_f1: 0.5144
 epoch: 81, train_loss: 0.9017, test_loss: 0.9308, test_f1: 0.5109
 epoch: 82, train_loss: 0.8976, test_loss: 0.9353, test_f1: 0.5229
 epoch: 83, train_loss: 0.8960, test_loss: 0.9483, test_f1: 0.5172
 epoch: 84, train_loss: 0.8781, test_loss: 0.9493, test_f1: 0.4924
 epoch: 85, train_loss: 0.9018, test_loss: 0.9387, test_f1: 0.5145
 epoch: 86, train_loss: 0.8911, test_loss: 0.9580, test_f1: 0.5112
 epoch: 87, train_loss: 0.8917, test_loss: 0.9441, test_f1: 0.5146
 epoch: 88, train_loss: 0.9036, test_loss: 0.9526, test_f1: 0.5152
 epoch: 89, train_loss: 0.8921, test_loss: 0.9246, test_f1: 0.5220
 epoch: 90, train_loss: 0.8897, test_loss: 0.9390, test_f1: 0.5094
 epoch: 91, train_loss: 0.8870, test_loss: 0.9547, test_f1: 0.5161
 epoch: 92, train_loss: 0.8875, test_loss: 0.9708, test_f1: 0.5181
 epoch: 93, train_loss: 0.8799, test_loss: 0.9097, test_f1: 0.5181
 epoch: 94, train_loss: 0.8838, test_loss: 0.9350, test_f1: 0.5133
 epoch: 95, train_loss: 0.8815, test_loss: 0.9653, test_f1: 0.5105
 epoch: 96, train_loss: 0.8809, test_loss: 1.0108, test_f1: 0.4840
 epoch: 97, train_loss: 0.8966, test_loss: 0.9460, test_f1: 0.5182
 epoch: 98, train_loss: 0.8787, test_loss: 0.9341, test_f1: 0.5181
 epoch: 99, train_loss: 0.8808, test_loss: 0.9499, test_f1: 0.5091

Training completed in 480.54 seconds
Best F1: 0.5480 at epoch 87
Mean F1 across iterations: 0.5124  0.0167
========================FINAL RESULTS================================
FEGIN weighted F1: 0.5480  0.0167
python main.py --data ltspice_examples --representation component_component --model FEGIN --layers 4 --hiddens 16 --batch_size 128 --lr 0.001 --emb_size 250 --epochs 100 --save_appendix component_component_L4_H16_BS128_LR0.001_E250 --no_val
-----



STDERR:
  File "main.py", line 370, in <module>
    main()
  File "main.py", line 254, in main
    dataset = dataset_class(
  File "/home/philip/projects/ltspice_examples_code_repo/Circuit-Completion-Using-GNNs/component_classification_with_link_prediction_head/evaluation/FEGIN/kernel/circuit_datasets.py", line 15, in __init__
    self.data, self.slices = torch.load(self.processed_paths[0])
  File "/home/philip/.local/lib/python3.8/site-packages/torch/serialization.py", line 1040, in load
    warnings.warn(
  File "/usr/lib/python3.8/warnings.py", line 109, in _showwarnmsg
    sw(msg.message, msg.category, msg.filename, msg.lineno,
  File "main.py", line 47, in warn_with_traceback
    traceback.print_stack(file=log)
/home/philip/projects/ltspice_examples_code_repo/Circuit-Completion-Using-GNNs/component_classification_with_link_prediction_head/evaluation/FEGIN/kernel/circuit_datasets.py:15: FutureWarning: You are using `torch.load` with `weights_only=False` (the current default value), which uses the default pickle module implicitly. It is possible to construct malicious pickle data which will execute arbitrary code during unpickling (See https://github.com/pytorch/pytorch/blob/main/SECURITY.md#untrusted-models for more details). In a future release, the default value for `weights_only` will be flipped to `True`. This limits the functions that could be executed during unpickling. Arbitrary objects will no longer be allowed to be loaded via this mode unless they are explicitly allowlisted by the user via `torch.serialization.add_safe_globals`. We recommend you start setting `weights_only=True` for any use case where you don't have full control of the loaded file. Please open an issue on GitHub for any issues related to this experimental feature.
  self.data, self.slices = torch.load(self.processed_paths[0])
