STDOUT:
Results will be saved in /home/philip/projects/ltspice_examples_code_repo/Circuit-Completion-Using-GNNs/component_classification_with_link_prediction_head/evaluation/FEGIN/results/model_FEGIN_dataset_ltspice_examples
Command line input: python main.py --data ltspice_examples --representation component_net --model FEGIN --layers 4 --hiddens 128 --batch_size 64 --lr 0.001 --emb_size 128 --epochs 100 --save_appendix component_net_L4_H128_BS64_LR0.001_E128 --no_val
 is saved.
-----
ltspice_examples - FEGIN
Using 4 layers, 128 hidden units, h = 2
Loading component_net representation dataset
Loading component_net representation data...
Loaded 4404 examples (component_net)
saving path: data/processed/ltspice_examples_component_net_processed.pt
ENTERED
Training FEGIN on component_net representation
Train: 3558, Test: 846
##################ITERATION #0 ****************************************
 epoch: 0, train_loss: 1.1837, test_loss: 1.0899, test_f1: 0.4665
 epoch: 1, train_loss: 0.9839, test_loss: 0.9904, test_f1: 0.4829
 epoch: 2, train_loss: 0.9374, test_loss: 0.9610, test_f1: 0.5281
 epoch: 3, train_loss: 0.9164, test_loss: 0.9170, test_f1: 0.5414
 epoch: 4, train_loss: 0.8993, test_loss: 0.8414, test_f1: 0.5625
 epoch: 5, train_loss: 0.8787, test_loss: 0.9129, test_f1: 0.5315
 epoch: 6, train_loss: 0.8511, test_loss: 0.9453, test_f1: 0.5493
 epoch: 7, train_loss: 0.8446, test_loss: 0.9268, test_f1: 0.5761
 epoch: 8, train_loss: 0.8216, test_loss: 1.0093, test_f1: 0.5256
 epoch: 9, train_loss: 0.7940, test_loss: 0.9555, test_f1: 0.5701
 epoch: 10, train_loss: 0.7884, test_loss: 0.9603, test_f1: 0.5702
 epoch: 11, train_loss: 0.7838, test_loss: 0.9412, test_f1: 0.5790
 epoch: 12, train_loss: 0.7720, test_loss: 0.9739, test_f1: 0.6002
 epoch: 13, train_loss: 0.7530, test_loss: 0.9360, test_f1: 0.5831
 epoch: 14, train_loss: 0.7426, test_loss: 0.9309, test_f1: 0.6088
 epoch: 15, train_loss: 0.7307, test_loss: 0.9099, test_f1: 0.6292
 epoch: 16, train_loss: 0.7248, test_loss: 0.8914, test_f1: 0.6061
 epoch: 17, train_loss: 0.7043, test_loss: 1.0082, test_f1: 0.5722
 epoch: 18, train_loss: 0.7016, test_loss: 0.9697, test_f1: 0.5843
 epoch: 19, train_loss: 0.6918, test_loss: 1.0474, test_f1: 0.5728
 epoch: 20, train_loss: 0.6837, test_loss: 0.9149, test_f1: 0.6225
 epoch: 21, train_loss: 0.6952, test_loss: 0.9352, test_f1: 0.6334
 epoch: 22, train_loss: 0.6740, test_loss: 0.9789, test_f1: 0.6314
 epoch: 23, train_loss: 0.6595, test_loss: 1.0823, test_f1: 0.5989
 epoch: 24, train_loss: 0.6499, test_loss: 1.0041, test_f1: 0.6227
 epoch: 25, train_loss: 0.6292, test_loss: 0.9657, test_f1: 0.6446
 epoch: 26, train_loss: 0.6061, test_loss: 1.0442, test_f1: 0.6210
 epoch: 27, train_loss: 0.5983, test_loss: 1.0361, test_f1: 0.6216
 epoch: 28, train_loss: 0.5828, test_loss: 1.0992, test_f1: 0.6271
 epoch: 29, train_loss: 0.5847, test_loss: 0.9863, test_f1: 0.6358
 epoch: 30, train_loss: 0.5883, test_loss: 1.0459, test_f1: 0.6250
 epoch: 31, train_loss: 0.5637, test_loss: 1.0300, test_f1: 0.6460
 epoch: 32, train_loss: 0.5457, test_loss: 1.0529, test_f1: 0.6358
 epoch: 33, train_loss: 0.5345, test_loss: 1.0816, test_f1: 0.6294
 epoch: 34, train_loss: 0.5194, test_loss: 1.0711, test_f1: 0.6607
 epoch: 35, train_loss: 0.5432, test_loss: 1.1363, test_f1: 0.6015
 epoch: 36, train_loss: 0.5291, test_loss: 0.9752, test_f1: 0.6647
 epoch: 37, train_loss: 0.5211, test_loss: 1.1178, test_f1: 0.6681
 epoch: 38, train_loss: 0.4766, test_loss: 1.1598, test_f1: 0.6306
 epoch: 39, train_loss: 0.4673, test_loss: 1.0944, test_f1: 0.6539
 epoch: 40, train_loss: 0.4747, test_loss: 1.1389, test_f1: 0.6395
 epoch: 41, train_loss: 0.4549, test_loss: 1.0997, test_f1: 0.6377
 epoch: 42, train_loss: 0.4463, test_loss: 1.2146, test_f1: 0.6654
 epoch: 43, train_loss: 0.4561, test_loss: 1.1209, test_f1: 0.6836
 epoch: 44, train_loss: 0.4283, test_loss: 1.2716, test_f1: 0.6624
 epoch: 45, train_loss: 0.4391, test_loss: 1.1923, test_f1: 0.6577
 epoch: 46, train_loss: 0.4415, test_loss: 1.2427, test_f1: 0.6757
 epoch: 47, train_loss: 0.4198, test_loss: 1.2043, test_f1: 0.6858
 epoch: 48, train_loss: 0.4007, test_loss: 1.2488, test_f1: 0.6717
 epoch: 49, train_loss: 0.3869, test_loss: 1.3085, test_f1: 0.6481
 epoch: 50, train_loss: 0.3837, test_loss: 1.3567, test_f1: 0.6354
 epoch: 51, train_loss: 0.3306, test_loss: 1.4086, test_f1: 0.6464
 epoch: 52, train_loss: 0.3311, test_loss: 1.4203, test_f1: 0.6503
 epoch: 53, train_loss: 0.3074, test_loss: 1.5071, test_f1: 0.6529
 epoch: 54, train_loss: 0.2980, test_loss: 1.5158, test_f1: 0.6463
 epoch: 55, train_loss: 0.2912, test_loss: 1.4329, test_f1: 0.6539
 epoch: 56, train_loss: 0.2984, test_loss: 1.5175, test_f1: 0.6594
 epoch: 57, train_loss: 0.2723, test_loss: 1.6042, test_f1: 0.6514
 epoch: 58, train_loss: 0.3065, test_loss: 1.4762, test_f1: 0.6641
 epoch: 59, train_loss: 0.3042, test_loss: 1.5136, test_f1: 0.6585
 epoch: 60, train_loss: 0.2908, test_loss: 1.7183, test_f1: 0.6394
 epoch: 61, train_loss: 0.2563, test_loss: 1.5668, test_f1: 0.6536
 epoch: 62, train_loss: 0.2648, test_loss: 1.6738, test_f1: 0.6776
 epoch: 63, train_loss: 0.2586, test_loss: 1.6392, test_f1: 0.6892
 epoch: 64, train_loss: 0.2598, test_loss: 1.6681, test_f1: 0.6666
 epoch: 65, train_loss: 0.2521, test_loss: 1.6380, test_f1: 0.6767
 epoch: 66, train_loss: 0.2436, test_loss: 1.7139, test_f1: 0.6588
 epoch: 67, train_loss: 0.2316, test_loss: 1.7861, test_f1: 0.6528
 epoch: 68, train_loss: 0.2499, test_loss: 1.8673, test_f1: 0.6611
 epoch: 69, train_loss: 0.2357, test_loss: 1.8652, test_f1: 0.6493
 epoch: 70, train_loss: 0.2279, test_loss: 1.7721, test_f1: 0.6557
 epoch: 71, train_loss: 0.2395, test_loss: 1.9323, test_f1: 0.6480
 epoch: 72, train_loss: 0.2321, test_loss: 1.9275, test_f1: 0.6452
 epoch: 73, train_loss: 0.2221, test_loss: 1.8507, test_f1: 0.6696
 epoch: 74, train_loss: 0.2257, test_loss: 1.8845, test_f1: 0.6782
 epoch: 75, train_loss: 0.2248, test_loss: 2.1011, test_f1: 0.6685
 epoch: 76, train_loss: 0.2182, test_loss: 1.9891, test_f1: 0.6859
 epoch: 77, train_loss: 0.2141, test_loss: 1.8680, test_f1: 0.6526
 epoch: 78, train_loss: 0.2201, test_loss: 2.0012, test_f1: 0.6272
 epoch: 79, train_loss: 0.2036, test_loss: 2.0713, test_f1: 0.6639
 epoch: 80, train_loss: 0.2020, test_loss: 1.9882, test_f1: 0.6297
 epoch: 81, train_loss: 0.2068, test_loss: 2.0554, test_f1: 0.6607
 epoch: 82, train_loss: 0.2157, test_loss: 1.8715, test_f1: 0.6452
 epoch: 83, train_loss: 0.2292, test_loss: 1.9706, test_f1: 0.6426
 epoch: 84, train_loss: 0.1997, test_loss: 1.9496, test_f1: 0.6555
 epoch: 85, train_loss: 0.2012, test_loss: 1.9632, test_f1: 0.6947
 epoch: 86, train_loss: 0.1778, test_loss: 2.1688, test_f1: 0.6635
 epoch: 87, train_loss: 0.1856, test_loss: 2.2542, test_f1: 0.6550
 epoch: 88, train_loss: 0.1907, test_loss: 2.2040, test_f1: 0.6727
 epoch: 89, train_loss: 0.1926, test_loss: 2.1850, test_f1: 0.6386
 epoch: 90, train_loss: 0.1870, test_loss: 2.2680, test_f1: 0.6735
 epoch: 91, train_loss: 0.1792, test_loss: 2.1010, test_f1: 0.6691
 epoch: 92, train_loss: 0.1869, test_loss: 2.2219, test_f1: 0.6774
 epoch: 93, train_loss: 0.1827, test_loss: 2.2847, test_f1: 0.6397
 epoch: 94, train_loss: 0.1688, test_loss: 2.3277, test_f1: 0.6863
 epoch: 95, train_loss: 0.1861, test_loss: 2.2401, test_f1: 0.6725
 epoch: 96, train_loss: 0.1706, test_loss: 2.2647, test_f1: 0.6653
 epoch: 97, train_loss: 0.1741, test_loss: 2.4229, test_f1: 0.6737
 epoch: 98, train_loss: 0.1787, test_loss: 2.2139, test_f1: 0.6592
 epoch: 99, train_loss: 0.1816, test_loss: 2.3428, test_f1: 0.6316
##################ITERATION #1 ****************************************
 epoch: 0, train_loss: 1.1359, test_loss: 1.0090, test_f1: 0.4511
 epoch: 1, train_loss: 0.9674, test_loss: 0.9238, test_f1: 0.5207
 epoch: 2, train_loss: 0.9297, test_loss: 0.9368, test_f1: 0.5408
 epoch: 3, train_loss: 0.9047, test_loss: 0.9424, test_f1: 0.5288
 epoch: 4, train_loss: 0.8643, test_loss: 0.8883, test_f1: 0.5735
 epoch: 5, train_loss: 0.8625, test_loss: 0.9049, test_f1: 0.5743
 epoch: 6, train_loss: 0.8590, test_loss: 0.9479, test_f1: 0.6090
 epoch: 7, train_loss: 0.8392, test_loss: 0.9492, test_f1: 0.5862
 epoch: 8, train_loss: 0.8209, test_loss: 0.9861, test_f1: 0.5969
 epoch: 9, train_loss: 0.8022, test_loss: 0.9831, test_f1: 0.5836
 epoch: 10, train_loss: 0.7982, test_loss: 0.9159, test_f1: 0.6098
 epoch: 11, train_loss: 0.7736, test_loss: 0.9590, test_f1: 0.5908
 epoch: 12, train_loss: 0.7632, test_loss: 0.9782, test_f1: 0.6140
 epoch: 13, train_loss: 0.7553, test_loss: 0.9738, test_f1: 0.5816
 epoch: 14, train_loss: 0.7529, test_loss: 1.0834, test_f1: 0.5449
 epoch: 15, train_loss: 0.7218, test_loss: 0.9456, test_f1: 0.5870
 epoch: 16, train_loss: 0.7147, test_loss: 0.9391, test_f1: 0.6447
 epoch: 17, train_loss: 0.7007, test_loss: 1.0092, test_f1: 0.6288
 epoch: 18, train_loss: 0.7110, test_loss: 1.0242, test_f1: 0.5837
 epoch: 19, train_loss: 0.6895, test_loss: 0.9225, test_f1: 0.6101
 epoch: 20, train_loss: 0.6937, test_loss: 1.0369, test_f1: 0.6169
 epoch: 21, train_loss: 0.6669, test_loss: 0.9353, test_f1: 0.6074
 epoch: 22, train_loss: 0.6660, test_loss: 0.9101, test_f1: 0.6334
 epoch: 23, train_loss: 0.6535, test_loss: 1.0523, test_f1: 0.5998
 epoch: 24, train_loss: 0.6242, test_loss: 1.0360, test_f1: 0.5861
 epoch: 25, train_loss: 0.6219, test_loss: 1.0675, test_f1: 0.6265
 epoch: 26, train_loss: 0.6333, test_loss: 0.9919, test_f1: 0.6121
 epoch: 27, train_loss: 0.6084, test_loss: 0.9759, test_f1: 0.6487
 epoch: 28, train_loss: 0.5977, test_loss: 1.0057, test_f1: 0.6388
 epoch: 29, train_loss: 0.5817, test_loss: 1.0452, test_f1: 0.6466
 epoch: 30, train_loss: 0.5896, test_loss: 1.0350, test_f1: 0.6505
 epoch: 31, train_loss: 0.5732, test_loss: 1.0617, test_f1: 0.6405
 epoch: 32, train_loss: 0.5576, test_loss: 1.0977, test_f1: 0.6721
 epoch: 33, train_loss: 0.5702, test_loss: 1.3203, test_f1: 0.6123
 epoch: 34, train_loss: 0.5515, test_loss: 1.1125, test_f1: 0.6525
 epoch: 35, train_loss: 0.5529, test_loss: 1.1598, test_f1: 0.6460
 epoch: 36, train_loss: 0.5333, test_loss: 1.1482, test_f1: 0.6726
 epoch: 37, train_loss: 0.4935, test_loss: 1.1490, test_f1: 0.6321
 epoch: 38, train_loss: 0.4970, test_loss: 1.1069, test_f1: 0.6406
 epoch: 39, train_loss: 0.5010, test_loss: 1.1636, test_f1: 0.6004
 epoch: 40, train_loss: 0.4913, test_loss: 1.1497, test_f1: 0.6591
 epoch: 41, train_loss: 0.4985, test_loss: 1.1328, test_f1: 0.6663
 epoch: 42, train_loss: 0.4711, test_loss: 1.2057, test_f1: 0.6587
 epoch: 43, train_loss: 0.4792, test_loss: 1.1202, test_f1: 0.6556
 epoch: 44, train_loss: 0.4607, test_loss: 1.1262, test_f1: 0.6832
 epoch: 45, train_loss: 0.4567, test_loss: 1.1217, test_f1: 0.6746
 epoch: 46, train_loss: 0.4222, test_loss: 1.3041, test_f1: 0.6584
 epoch: 47, train_loss: 0.4191, test_loss: 1.3308, test_f1: 0.6806
 epoch: 48, train_loss: 0.4309, test_loss: 1.2803, test_f1: 0.6579
 epoch: 49, train_loss: 0.4128, test_loss: 1.3532, test_f1: 0.6649
 epoch: 50, train_loss: 0.4106, test_loss: 1.1961, test_f1: 0.6693
 epoch: 51, train_loss: 0.3614, test_loss: 1.3741, test_f1: 0.6837
 epoch: 52, train_loss: 0.3268, test_loss: 1.4452, test_f1: 0.6861
 epoch: 53, train_loss: 0.3257, test_loss: 1.5375, test_f1: 0.6753
 epoch: 54, train_loss: 0.3091, test_loss: 1.4689, test_f1: 0.6634
 epoch: 55, train_loss: 0.3037, test_loss: 1.5703, test_f1: 0.6705
 epoch: 56, train_loss: 0.3028, test_loss: 1.5146, test_f1: 0.6649
 epoch: 57, train_loss: 0.3060, test_loss: 1.6601, test_f1: 0.6499
 epoch: 58, train_loss: 0.2709, test_loss: 1.6003, test_f1: 0.6698
 epoch: 59, train_loss: 0.2794, test_loss: 1.6265, test_f1: 0.6846
 epoch: 60, train_loss: 0.2875, test_loss: 1.6705, test_f1: 0.6915
 epoch: 61, train_loss: 0.2731, test_loss: 1.6468, test_f1: 0.6778
 epoch: 62, train_loss: 0.2668, test_loss: 1.6866, test_f1: 0.6780
 epoch: 63, train_loss: 0.2913, test_loss: 1.7047, test_f1: 0.6634
 epoch: 64, train_loss: 0.2545, test_loss: 1.7697, test_f1: 0.6406
 epoch: 65, train_loss: 0.2729, test_loss: 1.8905, test_f1: 0.6541
 epoch: 66, train_loss: 0.2494, test_loss: 1.7314, test_f1: 0.6863
 epoch: 67, train_loss: 0.2329, test_loss: 1.8894, test_f1: 0.6678
 epoch: 68, train_loss: 0.2424, test_loss: 1.8593, test_f1: 0.6901
 epoch: 69, train_loss: 0.2764, test_loss: 1.6419, test_f1: 0.6695
 epoch: 70, train_loss: 0.2441, test_loss: 1.7404, test_f1: 0.6567
 epoch: 71, train_loss: 0.2383, test_loss: 1.7228, test_f1: 0.6759
 epoch: 72, train_loss: 0.2284, test_loss: 1.8634, test_f1: 0.6696
 epoch: 73, train_loss: 0.2294, test_loss: 1.9678, test_f1: 0.6569
 epoch: 74, train_loss: 0.2206, test_loss: 1.9180, test_f1: 0.6644
 epoch: 75, train_loss: 0.2185, test_loss: 1.9203, test_f1: 0.6523
 epoch: 76, train_loss: 0.2202, test_loss: 2.0521, test_f1: 0.6529
 epoch: 77, train_loss: 0.2205, test_loss: 2.0370, test_f1: 0.6623
 epoch: 78, train_loss: 0.2221, test_loss: 1.9179, test_f1: 0.6692
 epoch: 79, train_loss: 0.1963, test_loss: 2.0835, test_f1: 0.6584
 epoch: 80, train_loss: 0.2293, test_loss: 1.8382, test_f1: 0.6786
 epoch: 81, train_loss: 0.2103, test_loss: 1.9244, test_f1: 0.6665
 epoch: 82, train_loss: 0.2174, test_loss: 1.9617, test_f1: 0.6620
 epoch: 83, train_loss: 0.2163, test_loss: 1.9574, test_f1: 0.6962
 epoch: 84, train_loss: 0.1978, test_loss: 2.0379, test_f1: 0.6796
 epoch: 85, train_loss: 0.1972, test_loss: 1.8342, test_f1: 0.6599
 epoch: 86, train_loss: 0.1824, test_loss: 2.0881, test_f1: 0.6961
 epoch: 87, train_loss: 0.1863, test_loss: 2.3455, test_f1: 0.6527
 epoch: 88, train_loss: 0.1822, test_loss: 2.1011, test_f1: 0.6649
 epoch: 89, train_loss: 0.1919, test_loss: 2.1951, test_f1: 0.6685
 epoch: 90, train_loss: 0.1839, test_loss: 2.2352, test_f1: 0.6490
 epoch: 91, train_loss: 0.1798, test_loss: 2.2118, test_f1: 0.6618
 epoch: 92, train_loss: 0.1872, test_loss: 2.3083, test_f1: 0.6577
 epoch: 93, train_loss: 0.1954, test_loss: 2.2168, test_f1: 0.6701
 epoch: 94, train_loss: 0.1942, test_loss: 2.2346, test_f1: 0.6483
 epoch: 95, train_loss: 0.1688, test_loss: 2.3325, test_f1: 0.6762
 epoch: 96, train_loss: 0.1838, test_loss: 2.1390, test_f1: 0.6628
 epoch: 97, train_loss: 0.1587, test_loss: 2.1961, test_f1: 0.6645
 epoch: 98, train_loss: 0.1575, test_loss: 2.5474, test_f1: 0.6382
 epoch: 99, train_loss: 0.1908, test_loss: 2.3235, test_f1: 0.6558
##################ITERATION #2 ****************************************
 epoch: 0, train_loss: 1.1964, test_loss: 1.0189, test_f1: 0.4167
 epoch: 1, train_loss: 0.9892, test_loss: 0.9214, test_f1: 0.4896
 epoch: 2, train_loss: 0.9372, test_loss: 0.9104, test_f1: 0.5040
 epoch: 3, train_loss: 0.9198, test_loss: 0.9684, test_f1: 0.4905
 epoch: 4, train_loss: 0.8824, test_loss: 0.8952, test_f1: 0.5341
 epoch: 5, train_loss: 0.8719, test_loss: 1.0452, test_f1: 0.4628
 epoch: 6, train_loss: 0.8778, test_loss: 0.9378, test_f1: 0.5409
 epoch: 7, train_loss: 0.8383, test_loss: 0.9350, test_f1: 0.5241
 epoch: 8, train_loss: 0.8371, test_loss: 0.9622, test_f1: 0.5194
 epoch: 9, train_loss: 0.8083, test_loss: 0.9131, test_f1: 0.5689
 epoch: 10, train_loss: 0.8168, test_loss: 0.9552, test_f1: 0.5280
 epoch: 11, train_loss: 0.8019, test_loss: 0.8720, test_f1: 0.5937
 epoch: 12, train_loss: 0.7927, test_loss: 0.9498, test_f1: 0.5645
 epoch: 13, train_loss: 0.7658, test_loss: 0.8635, test_f1: 0.5656
 epoch: 14, train_loss: 0.7598, test_loss: 0.9429, test_f1: 0.5809
 epoch: 15, train_loss: 0.7408, test_loss: 0.9022, test_f1: 0.5804
 epoch: 16, train_loss: 0.7312, test_loss: 0.8615, test_f1: 0.5522
 epoch: 17, train_loss: 0.7356, test_loss: 0.9736, test_f1: 0.5821
 epoch: 18, train_loss: 0.7340, test_loss: 0.9615, test_f1: 0.5880
 epoch: 19, train_loss: 0.7180, test_loss: 0.9809, test_f1: 0.5833
 epoch: 20, train_loss: 0.7057, test_loss: 0.9720, test_f1: 0.6091
 epoch: 21, train_loss: 0.6945, test_loss: 0.9882, test_f1: 0.5982
 epoch: 22, train_loss: 0.6883, test_loss: 0.9761, test_f1: 0.5966
 epoch: 23, train_loss: 0.6786, test_loss: 1.0847, test_f1: 0.5880
 epoch: 24, train_loss: 0.6839, test_loss: 0.9809, test_f1: 0.6065
 epoch: 25, train_loss: 0.6583, test_loss: 0.9535, test_f1: 0.6147
 epoch: 26, train_loss: 0.6407, test_loss: 0.9884, test_f1: 0.5721
 epoch: 27, train_loss: 0.6369, test_loss: 0.9932, test_f1: 0.5788
 epoch: 28, train_loss: 0.6057, test_loss: 0.9814, test_f1: 0.6160
 epoch: 29, train_loss: 0.6204, test_loss: 0.9542, test_f1: 0.6440
 epoch: 30, train_loss: 0.6282, test_loss: 0.9338, test_f1: 0.6135
 epoch: 31, train_loss: 0.6002, test_loss: 0.9775, test_f1: 0.6102
 epoch: 32, train_loss: 0.5901, test_loss: 0.9917, test_f1: 0.6213
 epoch: 33, train_loss: 0.5695, test_loss: 1.0269, test_f1: 0.6188
 epoch: 34, train_loss: 0.5977, test_loss: 0.9811, test_f1: 0.6295
 epoch: 35, train_loss: 0.5826, test_loss: 0.9994, test_f1: 0.6230
 epoch: 36, train_loss: 0.5430, test_loss: 1.0909, test_f1: 0.5939
 epoch: 37, train_loss: 0.5424, test_loss: 0.9947, test_f1: 0.6621
 epoch: 38, train_loss: 0.5616, test_loss: 1.0072, test_f1: 0.6557
 epoch: 39, train_loss: 0.5204, test_loss: 1.0066, test_f1: 0.6544
 epoch: 40, train_loss: 0.5167, test_loss: 1.0787, test_f1: 0.6504
 epoch: 41, train_loss: 0.5434, test_loss: 1.2179, test_f1: 0.6441
 epoch: 42, train_loss: 0.5101, test_loss: 1.1353, test_f1: 0.6592
 epoch: 43, train_loss: 0.5147, test_loss: 1.1432, test_f1: 0.6117
 epoch: 44, train_loss: 0.5076, test_loss: 1.0880, test_f1: 0.6336
 epoch: 45, train_loss: 0.4778, test_loss: 1.1867, test_f1: 0.6326
 epoch: 46, train_loss: 0.4512, test_loss: 1.3281, test_f1: 0.6348
 epoch: 47, train_loss: 0.4568, test_loss: 1.2921, test_f1: 0.6462
 epoch: 48, train_loss: 0.4607, test_loss: 1.1877, test_f1: 0.6263
 epoch: 49, train_loss: 0.4677, test_loss: 1.0488, test_f1: 0.6596
 epoch: 50, train_loss: 0.4433, test_loss: 1.2329, test_f1: 0.6399
 epoch: 51, train_loss: 0.3974, test_loss: 1.2443, test_f1: 0.6432
 epoch: 52, train_loss: 0.3697, test_loss: 1.2685, test_f1: 0.6773
 epoch: 53, train_loss: 0.3382, test_loss: 1.3634, test_f1: 0.6685
 epoch: 54, train_loss: 0.3399, test_loss: 1.3657, test_f1: 0.6566
 epoch: 55, train_loss: 0.3281, test_loss: 1.4255, test_f1: 0.6477
 epoch: 56, train_loss: 0.3383, test_loss: 1.3938, test_f1: 0.6429
 epoch: 57, train_loss: 0.3361, test_loss: 1.4490, test_f1: 0.6362
 epoch: 58, train_loss: 0.2997, test_loss: 1.3828, test_f1: 0.6833
 epoch: 59, train_loss: 0.3359, test_loss: 1.3741, test_f1: 0.6442
 epoch: 60, train_loss: 0.3024, test_loss: 1.4169, test_f1: 0.6714
 epoch: 61, train_loss: 0.3059, test_loss: 1.3877, test_f1: 0.6655
 epoch: 62, train_loss: 0.2840, test_loss: 1.5186, test_f1: 0.6549
 epoch: 63, train_loss: 0.2819, test_loss: 1.5623, test_f1: 0.6665
 epoch: 64, train_loss: 0.2981, test_loss: 1.4849, test_f1: 0.6719
 epoch: 65, train_loss: 0.2943, test_loss: 1.5115, test_f1: 0.6802
 epoch: 66, train_loss: 0.2725, test_loss: 1.4419, test_f1: 0.6604
 epoch: 67, train_loss: 0.2681, test_loss: 1.5899, test_f1: 0.6688
 epoch: 68, train_loss: 0.2869, test_loss: 1.5613, test_f1: 0.6728
 epoch: 69, train_loss: 0.2707, test_loss: 1.5656, test_f1: 0.6476
 epoch: 70, train_loss: 0.2559, test_loss: 1.5942, test_f1: 0.6569
 epoch: 71, train_loss: 0.2633, test_loss: 1.6198, test_f1: 0.6584
 epoch: 72, train_loss: 0.2559, test_loss: 1.6540, test_f1: 0.6557
 epoch: 73, train_loss: 0.2498, test_loss: 1.6708, test_f1: 0.6618
 epoch: 74, train_loss: 0.2621, test_loss: 1.6805, test_f1: 0.6607
 epoch: 75, train_loss: 0.2378, test_loss: 1.7698, test_f1: 0.6669
 epoch: 76, train_loss: 0.2465, test_loss: 1.7626, test_f1: 0.6448
 epoch: 77, train_loss: 0.2604, test_loss: 1.7179, test_f1: 0.6780
 epoch: 78, train_loss: 0.2416, test_loss: 1.6962, test_f1: 0.6712
 epoch: 79, train_loss: 0.2385, test_loss: 1.8756, test_f1: 0.6314
 epoch: 80, train_loss: 0.2536, test_loss: 1.6965, test_f1: 0.6675
 epoch: 81, train_loss: 0.2331, test_loss: 1.7167, test_f1: 0.6785
 epoch: 82, train_loss: 0.2162, test_loss: 1.8127, test_f1: 0.6829
 epoch: 83, train_loss: 0.2380, test_loss: 2.0483, test_f1: 0.6419
 epoch: 84, train_loss: 0.2171, test_loss: 2.0031, test_f1: 0.6466
 epoch: 85, train_loss: 0.2323, test_loss: 1.8791, test_f1: 0.6237
 epoch: 86, train_loss: 0.2104, test_loss: 1.8969, test_f1: 0.6510
 epoch: 87, train_loss: 0.2143, test_loss: 2.1187, test_f1: 0.6278
 epoch: 88, train_loss: 0.2394, test_loss: 1.8923, test_f1: 0.6484
 epoch: 89, train_loss: 0.2069, test_loss: 1.9547, test_f1: 0.6368
 epoch: 90, train_loss: 0.1988, test_loss: 1.9473, test_f1: 0.6692
 epoch: 91, train_loss: 0.1950, test_loss: 2.0565, test_f1: 0.6538
 epoch: 92, train_loss: 0.2151, test_loss: 1.8412, test_f1: 0.6668
 epoch: 93, train_loss: 0.2161, test_loss: 2.0199, test_f1: 0.6254
 epoch: 94, train_loss: 0.2115, test_loss: 1.8415, test_f1: 0.6473
 epoch: 95, train_loss: 0.2056, test_loss: 1.9708, test_f1: 0.6890
 epoch: 96, train_loss: 0.1849, test_loss: 2.0749, test_f1: 0.6164
 epoch: 97, train_loss: 0.1997, test_loss: 1.8151, test_f1: 0.6658
 epoch: 98, train_loss: 0.2151, test_loss: 1.9876, test_f1: 0.6615
 epoch: 99, train_loss: 0.2093, test_loss: 2.0059, test_f1: 0.6318
##################ITERATION #3 ****************************************
 epoch: 0, train_loss: 1.2024, test_loss: 1.0750, test_f1: 0.4197
 epoch: 1, train_loss: 0.9662, test_loss: 0.9282, test_f1: 0.5005
 epoch: 2, train_loss: 0.9343, test_loss: 0.9269, test_f1: 0.5221
 epoch: 3, train_loss: 0.9047, test_loss: 0.9657, test_f1: 0.5165
 epoch: 4, train_loss: 0.8870, test_loss: 0.9503, test_f1: 0.5614
 epoch: 5, train_loss: 0.8772, test_loss: 0.9269, test_f1: 0.5041
 epoch: 6, train_loss: 0.8599, test_loss: 0.9631, test_f1: 0.5357
 epoch: 7, train_loss: 0.8316, test_loss: 0.9159, test_f1: 0.5965
 epoch: 8, train_loss: 0.8269, test_loss: 0.9825, test_f1: 0.5795
 epoch: 9, train_loss: 0.8087, test_loss: 0.9016, test_f1: 0.5593
 epoch: 10, train_loss: 0.7941, test_loss: 0.9280, test_f1: 0.5669
 epoch: 11, train_loss: 0.7735, test_loss: 0.9857, test_f1: 0.6009
 epoch: 12, train_loss: 0.7776, test_loss: 0.8853, test_f1: 0.5986
 epoch: 13, train_loss: 0.7640, test_loss: 0.8791, test_f1: 0.5736
 epoch: 14, train_loss: 0.7497, test_loss: 0.9299, test_f1: 0.5846
 epoch: 15, train_loss: 0.7462, test_loss: 0.9656, test_f1: 0.5921
 epoch: 16, train_loss: 0.7216, test_loss: 0.9726, test_f1: 0.5976
 epoch: 17, train_loss: 0.7171, test_loss: 0.8951, test_f1: 0.5881
 epoch: 18, train_loss: 0.7315, test_loss: 1.0262, test_f1: 0.5660
 epoch: 19, train_loss: 0.7205, test_loss: 0.9687, test_f1: 0.5901
 epoch: 20, train_loss: 0.6997, test_loss: 0.9413, test_f1: 0.6308
 epoch: 21, train_loss: 0.6817, test_loss: 0.9533, test_f1: 0.6194
 epoch: 22, train_loss: 0.6782, test_loss: 0.9630, test_f1: 0.5930
 epoch: 23, train_loss: 0.6809, test_loss: 1.0358, test_f1: 0.6001
 epoch: 24, train_loss: 0.6585, test_loss: 1.0287, test_f1: 0.5683
 epoch: 25, train_loss: 0.6467, test_loss: 1.0172, test_f1: 0.6285
 epoch: 26, train_loss: 0.6507, test_loss: 1.0724, test_f1: 0.6105
 epoch: 27, train_loss: 0.6383, test_loss: 1.1100, test_f1: 0.5964
 epoch: 28, train_loss: 0.6389, test_loss: 1.0418, test_f1: 0.6308
 epoch: 29, train_loss: 0.6207, test_loss: 0.9684, test_f1: 0.6278
 epoch: 30, train_loss: 0.5942, test_loss: 1.0306, test_f1: 0.5976
 epoch: 31, train_loss: 0.5860, test_loss: 1.1090, test_f1: 0.5968
 epoch: 32, train_loss: 0.5939, test_loss: 1.0340, test_f1: 0.6082
 epoch: 33, train_loss: 0.5686, test_loss: 1.0022, test_f1: 0.6254
 epoch: 34, train_loss: 0.5604, test_loss: 0.9999, test_f1: 0.6084
 epoch: 35, train_loss: 0.5586, test_loss: 1.0924, test_f1: 0.6303
 epoch: 36, train_loss: 0.5454, test_loss: 1.1537, test_f1: 0.6113
 epoch: 37, train_loss: 0.5379, test_loss: 1.1164, test_f1: 0.6477
 epoch: 38, train_loss: 0.5172, test_loss: 1.1407, test_f1: 0.6505
 epoch: 39, train_loss: 0.5089, test_loss: 1.0961, test_f1: 0.6523
 epoch: 40, train_loss: 0.4932, test_loss: 1.0893, test_f1: 0.6355
 epoch: 41, train_loss: 0.4881, test_loss: 1.1779, test_f1: 0.6414
 epoch: 42, train_loss: 0.4889, test_loss: 1.1837, test_f1: 0.6333
 epoch: 43, train_loss: 0.4718, test_loss: 1.3132, test_f1: 0.5814
 epoch: 44, train_loss: 0.4564, test_loss: 1.2223, test_f1: 0.6372
 epoch: 45, train_loss: 0.4414, test_loss: 1.2854, test_f1: 0.6393
 epoch: 46, train_loss: 0.4599, test_loss: 1.2771, test_f1: 0.6227
 epoch: 47, train_loss: 0.4604, test_loss: 1.2387, test_f1: 0.6295
 epoch: 48, train_loss: 0.4561, test_loss: 1.2055, test_f1: 0.6552
 epoch: 49, train_loss: 0.4261, test_loss: 1.3173, test_f1: 0.6131
 epoch: 50, train_loss: 0.4331, test_loss: 1.3412, test_f1: 0.6312
 epoch: 51, train_loss: 0.3799, test_loss: 1.3221, test_f1: 0.6408
 epoch: 52, train_loss: 0.3366, test_loss: 1.3335, test_f1: 0.6414
 epoch: 53, train_loss: 0.3370, test_loss: 1.4377, test_f1: 0.6409
 epoch: 54, train_loss: 0.3305, test_loss: 1.3543, test_f1: 0.6310
 epoch: 55, train_loss: 0.3167, test_loss: 1.4790, test_f1: 0.6715
 epoch: 56, train_loss: 0.3042, test_loss: 1.4520, test_f1: 0.6766
 epoch: 57, train_loss: 0.3321, test_loss: 1.4839, test_f1: 0.6495
 epoch: 58, train_loss: 0.2934, test_loss: 1.4841, test_f1: 0.6779
 epoch: 59, train_loss: 0.3043, test_loss: 1.4384, test_f1: 0.6285
 epoch: 60, train_loss: 0.2959, test_loss: 1.4242, test_f1: 0.6617
 epoch: 61, train_loss: 0.3125, test_loss: 1.4897, test_f1: 0.6298
 epoch: 62, train_loss: 0.2780, test_loss: 1.5998, test_f1: 0.6258
 epoch: 63, train_loss: 0.2891, test_loss: 1.6214, test_f1: 0.6497
 epoch: 64, train_loss: 0.2752, test_loss: 1.6768, test_f1: 0.6379
 epoch: 65, train_loss: 0.2859, test_loss: 1.5576, test_f1: 0.6865
 epoch: 66, train_loss: 0.2790, test_loss: 1.5758, test_f1: 0.6181
 epoch: 67, train_loss: 0.2570, test_loss: 1.5052, test_f1: 0.6638
 epoch: 68, train_loss: 0.2684, test_loss: 1.5852, test_f1: 0.6474
 epoch: 69, train_loss: 0.2617, test_loss: 1.6917, test_f1: 0.6392
 epoch: 70, train_loss: 0.2527, test_loss: 1.6958, test_f1: 0.6513
 epoch: 71, train_loss: 0.2539, test_loss: 1.8058, test_f1: 0.6238
 epoch: 72, train_loss: 0.2579, test_loss: 1.8000, test_f1: 0.6544
 epoch: 73, train_loss: 0.2418, test_loss: 1.6873, test_f1: 0.6513
 epoch: 74, train_loss: 0.2374, test_loss: 1.7461, test_f1: 0.6494
 epoch: 75, train_loss: 0.2375, test_loss: 1.7658, test_f1: 0.6444
 epoch: 76, train_loss: 0.2229, test_loss: 1.8298, test_f1: 0.6454
 epoch: 77, train_loss: 0.2382, test_loss: 1.8695, test_f1: 0.6234
 epoch: 78, train_loss: 0.2169, test_loss: 1.8245, test_f1: 0.6457
 epoch: 79, train_loss: 0.2296, test_loss: 1.7864, test_f1: 0.6407
 epoch: 80, train_loss: 0.2164, test_loss: 1.7826, test_f1: 0.6227
 epoch: 81, train_loss: 0.2373, test_loss: 1.7015, test_f1: 0.6332
 epoch: 82, train_loss: 0.2271, test_loss: 1.8508, test_f1: 0.6361
 epoch: 83, train_loss: 0.2409, test_loss: 1.6496, test_f1: 0.6355
 epoch: 84, train_loss: 0.2239, test_loss: 1.8385, test_f1: 0.6431
 epoch: 85, train_loss: 0.2203, test_loss: 1.9063, test_f1: 0.6385
 epoch: 86, train_loss: 0.2133, test_loss: 1.7905, test_f1: 0.6467
 epoch: 87, train_loss: 0.1993, test_loss: 1.8551, test_f1: 0.6385
 epoch: 88, train_loss: 0.2137, test_loss: 1.8273, test_f1: 0.6195
 epoch: 89, train_loss: 0.2165, test_loss: 1.8620, test_f1: 0.6604
 epoch: 90, train_loss: 0.2037, test_loss: 1.8574, test_f1: 0.6336
 epoch: 91, train_loss: 0.1748, test_loss: 2.1497, test_f1: 0.6301
 epoch: 92, train_loss: 0.2135, test_loss: 2.0197, test_f1: 0.6416
 epoch: 93, train_loss: 0.2436, test_loss: 1.8224, test_f1: 0.6494
 epoch: 94, train_loss: 0.2080, test_loss: 2.0837, test_f1: 0.6090
 epoch: 95, train_loss: 0.1991, test_loss: 1.9092, test_f1: 0.6307
 epoch: 96, train_loss: 0.2061, test_loss: 1.9569, test_f1: 0.6379
 epoch: 97, train_loss: 0.1797, test_loss: 1.9668, test_f1: 0.6361
 epoch: 98, train_loss: 0.1940, test_loss: 2.0186, test_f1: 0.6399
 epoch: 99, train_loss: 0.1712, test_loss: 2.0010, test_f1: 0.6550
##################ITERATION #4 ****************************************
 epoch: 0, train_loss: 1.2501, test_loss: 0.9930, test_f1: 0.5207
 epoch: 1, train_loss: 0.9870, test_loss: 0.9343, test_f1: 0.4956
 epoch: 2, train_loss: 0.9380, test_loss: 0.9383, test_f1: 0.5157
 epoch: 3, train_loss: 0.9092, test_loss: 0.9400, test_f1: 0.5276
 epoch: 4, train_loss: 0.8910, test_loss: 0.9418, test_f1: 0.5678
 epoch: 5, train_loss: 0.8822, test_loss: 0.9914, test_f1: 0.5312
 epoch: 6, train_loss: 0.8658, test_loss: 0.9715, test_f1: 0.5340
 epoch: 7, train_loss: 0.8568, test_loss: 0.9594, test_f1: 0.5804
 epoch: 8, train_loss: 0.8439, test_loss: 0.9532, test_f1: 0.5860
 epoch: 9, train_loss: 0.8208, test_loss: 0.9340, test_f1: 0.5619
 epoch: 10, train_loss: 0.8204, test_loss: 0.9643, test_f1: 0.5666
 epoch: 11, train_loss: 0.8092, test_loss: 0.9374, test_f1: 0.5477
 epoch: 12, train_loss: 0.7858, test_loss: 0.9877, test_f1: 0.6056
 epoch: 13, train_loss: 0.7746, test_loss: 0.9983, test_f1: 0.5739
 epoch: 14, train_loss: 0.7800, test_loss: 0.9477, test_f1: 0.5928
 epoch: 15, train_loss: 0.7532, test_loss: 0.9610, test_f1: 0.6185
 epoch: 16, train_loss: 0.7439, test_loss: 0.9713, test_f1: 0.6313
 epoch: 17, train_loss: 0.7360, test_loss: 0.9495, test_f1: 0.6060
 epoch: 18, train_loss: 0.7514, test_loss: 0.9166, test_f1: 0.6151
 epoch: 19, train_loss: 0.7173, test_loss: 0.9716, test_f1: 0.5836
 epoch: 20, train_loss: 0.7120, test_loss: 0.9907, test_f1: 0.6057
 epoch: 21, train_loss: 0.7071, test_loss: 0.9897, test_f1: 0.5890
 epoch: 22, train_loss: 0.6892, test_loss: 1.0598, test_f1: 0.6201
 epoch: 23, train_loss: 0.6628, test_loss: 0.9719, test_f1: 0.6356
 epoch: 24, train_loss: 0.6693, test_loss: 0.9865, test_f1: 0.6094
 epoch: 25, train_loss: 0.6694, test_loss: 0.9534, test_f1: 0.6303
 epoch: 26, train_loss: 0.6397, test_loss: 1.0256, test_f1: 0.6387
 epoch: 27, train_loss: 0.6349, test_loss: 1.1329, test_f1: 0.6099
 epoch: 28, train_loss: 0.6469, test_loss: 1.0956, test_f1: 0.6207
 epoch: 29, train_loss: 0.6325, test_loss: 1.0425, test_f1: 0.6037
 epoch: 30, train_loss: 0.6072, test_loss: 1.0306, test_f1: 0.6181
 epoch: 31, train_loss: 0.6153, test_loss: 1.0299, test_f1: 0.6216
 epoch: 32, train_loss: 0.6017, test_loss: 1.0162, test_f1: 0.5958
 epoch: 33, train_loss: 0.5710, test_loss: 1.0150, test_f1: 0.6554
 epoch: 34, train_loss: 0.5829, test_loss: 1.0579, test_f1: 0.6404
 epoch: 35, train_loss: 0.5773, test_loss: 1.1943, test_f1: 0.6076
 epoch: 36, train_loss: 0.5614, test_loss: 1.1516, test_f1: 0.6157
 epoch: 37, train_loss: 0.5603, test_loss: 1.0942, test_f1: 0.6194
 epoch: 38, train_loss: 0.5716, test_loss: 1.0317, test_f1: 0.5965
 epoch: 39, train_loss: 0.5351, test_loss: 1.0488, test_f1: 0.6245
 epoch: 40, train_loss: 0.5254, test_loss: 1.1972, test_f1: 0.6164
 epoch: 41, train_loss: 0.5140, test_loss: 1.0254, test_f1: 0.6536
 epoch: 42, train_loss: 0.5233, test_loss: 1.0497, test_f1: 0.6572
 epoch: 43, train_loss: 0.5083, test_loss: 1.2107, test_f1: 0.6117
 epoch: 44, train_loss: 0.4926, test_loss: 1.1553, test_f1: 0.6660
 epoch: 45, train_loss: 0.4862, test_loss: 1.1664, test_f1: 0.6245
 epoch: 46, train_loss: 0.4929, test_loss: 1.1416, test_f1: 0.6425
 epoch: 47, train_loss: 0.4815, test_loss: 1.2121, test_f1: 0.6385
 epoch: 48, train_loss: 0.4755, test_loss: 1.1045, test_f1: 0.6569
 epoch: 49, train_loss: 0.4522, test_loss: 1.2533, test_f1: 0.6316
 epoch: 50, train_loss: 0.4317, test_loss: 1.1167, test_f1: 0.6369
 epoch: 51, train_loss: 0.4102, test_loss: 1.1731, test_f1: 0.6411
 epoch: 52, train_loss: 0.3608, test_loss: 1.1782, test_f1: 0.6481
 epoch: 53, train_loss: 0.3809, test_loss: 1.3180, test_f1: 0.6357
 epoch: 54, train_loss: 0.3685, test_loss: 1.3691, test_f1: 0.6378
 epoch: 55, train_loss: 0.3471, test_loss: 1.2932, test_f1: 0.6369
 epoch: 56, train_loss: 0.3364, test_loss: 1.3597, test_f1: 0.6608
 epoch: 57, train_loss: 0.3330, test_loss: 1.3820, test_f1: 0.6504
 epoch: 58, train_loss: 0.3392, test_loss: 1.3482, test_f1: 0.6265
 epoch: 59, train_loss: 0.3190, test_loss: 1.4694, test_f1: 0.6349
 epoch: 60, train_loss: 0.3384, test_loss: 1.4015, test_f1: 0.6564
 epoch: 61, train_loss: 0.3185, test_loss: 1.4613, test_f1: 0.6448
 epoch: 62, train_loss: 0.3181, test_loss: 1.4474, test_f1: 0.6078
 epoch: 63, train_loss: 0.3106, test_loss: 1.5056, test_f1: 0.6551
 epoch: 64, train_loss: 0.3190, test_loss: 1.4088, test_f1: 0.6301
 epoch: 65, train_loss: 0.3013, test_loss: 1.5064, test_f1: 0.6338
 epoch: 66, train_loss: 0.2981, test_loss: 1.5645, test_f1: 0.6337
 epoch: 67, train_loss: 0.2953, test_loss: 1.5115, test_f1: 0.6460
 epoch: 68, train_loss: 0.3092, test_loss: 1.5087, test_f1: 0.6484
 epoch: 69, train_loss: 0.2864, test_loss: 1.6182, test_f1: 0.6589
 epoch: 70, train_loss: 0.2847, test_loss: 1.6143, test_f1: 0.6608
 epoch: 71, train_loss: 0.2762, test_loss: 1.6237, test_f1: 0.6419
 epoch: 72, train_loss: 0.2779, test_loss: 1.6166, test_f1: 0.6602
 epoch: 73, train_loss: 0.2573, test_loss: 1.6244, test_f1: 0.6449
 epoch: 74, train_loss: 0.2555, test_loss: 1.7892, test_f1: 0.6394
 epoch: 75, train_loss: 0.2519, test_loss: 1.7704, test_f1: 0.6360
 epoch: 76, train_loss: 0.2702, test_loss: 1.6566, test_f1: 0.6678
 epoch: 77, train_loss: 0.2669, test_loss: 1.7868, test_f1: 0.6477
 epoch: 78, train_loss: 0.2608, test_loss: 1.7158, test_f1: 0.6650
 epoch: 79, train_loss: 0.2518, test_loss: 1.8128, test_f1: 0.6157
 epoch: 80, train_loss: 0.2592, test_loss: 1.7968, test_f1: 0.6509
 epoch: 81, train_loss: 0.2498, test_loss: 1.7555, test_f1: 0.6534
 epoch: 82, train_loss: 0.2525, test_loss: 1.8402, test_f1: 0.6341
 epoch: 83, train_loss: 0.2470, test_loss: 1.8411, test_f1: 0.6371
 epoch: 84, train_loss: 0.2452, test_loss: 1.7749, test_f1: 0.6537
 epoch: 85, train_loss: 0.2355, test_loss: 1.8938, test_f1: 0.6301
 epoch: 86, train_loss: 0.2437, test_loss: 1.8554, test_f1: 0.6600
 epoch: 87, train_loss: 0.2477, test_loss: 1.8807, test_f1: 0.6675
 epoch: 88, train_loss: 0.2343, test_loss: 1.9024, test_f1: 0.6421
 epoch: 89, train_loss: 0.2146, test_loss: 1.9248, test_f1: 0.6492
 epoch: 90, train_loss: 0.2258, test_loss: 1.9502, test_f1: 0.6479
 epoch: 91, train_loss: 0.2243, test_loss: 1.9218, test_f1: 0.6192
 epoch: 92, train_loss: 0.2341, test_loss: 1.7080, test_f1: 0.6459
 epoch: 93, train_loss: 0.2233, test_loss: 1.8063, test_f1: 0.6441
 epoch: 94, train_loss: 0.2171, test_loss: 1.8124, test_f1: 0.6745
 epoch: 95, train_loss: 0.2094, test_loss: 2.0146, test_f1: 0.6293
 epoch: 96, train_loss: 0.1949, test_loss: 2.0233, test_f1: 0.6446
 epoch: 97, train_loss: 0.2148, test_loss: 1.9804, test_f1: 0.6283
 epoch: 98, train_loss: 0.2135, test_loss: 1.9004, test_f1: 0.6488
 epoch: 99, train_loss: 0.2124, test_loss: 1.9103, test_f1: 0.6197
##################ITERATION #5 ****************************************
 epoch: 0, train_loss: 1.2555, test_loss: 0.9940, test_f1: 0.4318
 epoch: 1, train_loss: 0.9862, test_loss: 0.9522, test_f1: 0.4761
 epoch: 2, train_loss: 0.9580, test_loss: 0.9795, test_f1: 0.4711
 epoch: 3, train_loss: 0.9274, test_loss: 0.9967, test_f1: 0.4922
 epoch: 4, train_loss: 0.9258, test_loss: 0.9859, test_f1: 0.5203
 epoch: 5, train_loss: 0.9002, test_loss: 0.9760, test_f1: 0.5740
 epoch: 6, train_loss: 0.8758, test_loss: 0.9171, test_f1: 0.5565
 epoch: 7, train_loss: 0.8607, test_loss: 0.9722, test_f1: 0.5333
 epoch: 8, train_loss: 0.8488, test_loss: 0.9371, test_f1: 0.5337
 epoch: 9, train_loss: 0.8400, test_loss: 0.9281, test_f1: 0.5712
 epoch: 10, train_loss: 0.8148, test_loss: 1.0073, test_f1: 0.5640
 epoch: 11, train_loss: 0.8063, test_loss: 0.8898, test_f1: 0.5721
 epoch: 12, train_loss: 0.8007, test_loss: 0.9151, test_f1: 0.5390
 epoch: 13, train_loss: 0.7831, test_loss: 1.0052, test_f1: 0.5555
 epoch: 14, train_loss: 0.7739, test_loss: 0.9266, test_f1: 0.5609
 epoch: 15, train_loss: 0.7638, test_loss: 0.9946, test_f1: 0.5499
 epoch: 16, train_loss: 0.7670, test_loss: 0.9093, test_f1: 0.6022
 epoch: 17, train_loss: 0.7322, test_loss: 0.9369, test_f1: 0.6091
 epoch: 18, train_loss: 0.7283, test_loss: 0.9935, test_f1: 0.6021
 epoch: 19, train_loss: 0.7310, test_loss: 1.0764, test_f1: 0.6280
 epoch: 20, train_loss: 0.7132, test_loss: 0.9578, test_f1: 0.6067
 epoch: 21, train_loss: 0.6831, test_loss: 0.9646, test_f1: 0.6196
 epoch: 22, train_loss: 0.7048, test_loss: 0.9497, test_f1: 0.6218
 epoch: 23, train_loss: 0.6743, test_loss: 0.9058, test_f1: 0.6232
 epoch: 24, train_loss: 0.6715, test_loss: 1.0071, test_f1: 0.5929
 epoch: 25, train_loss: 0.6659, test_loss: 0.9520, test_f1: 0.6382
 epoch: 26, train_loss: 0.6573, test_loss: 0.9164, test_f1: 0.6275
 epoch: 27, train_loss: 0.6307, test_loss: 0.9434, test_f1: 0.6347
 epoch: 28, train_loss: 0.6208, test_loss: 1.0005, test_f1: 0.6314
 epoch: 29, train_loss: 0.5962, test_loss: 1.0023, test_f1: 0.5672
 epoch: 30, train_loss: 0.5993, test_loss: 0.9629, test_f1: 0.6196
 epoch: 31, train_loss: 0.6038, test_loss: 0.9229, test_f1: 0.6156
 epoch: 32, train_loss: 0.5836, test_loss: 1.1552, test_f1: 0.6193
 epoch: 33, train_loss: 0.5776, test_loss: 0.9872, test_f1: 0.6690
 epoch: 34, train_loss: 0.5470, test_loss: 0.9946, test_f1: 0.6011
 epoch: 35, train_loss: 0.5579, test_loss: 1.0156, test_f1: 0.6386
 epoch: 36, train_loss: 0.5576, test_loss: 0.9857, test_f1: 0.6442
 epoch: 37, train_loss: 0.5357, test_loss: 1.0340, test_f1: 0.6175
 epoch: 38, train_loss: 0.5187, test_loss: 1.1720, test_f1: 0.6321
 epoch: 39, train_loss: 0.5158, test_loss: 1.1664, test_f1: 0.6378
 epoch: 40, train_loss: 0.5176, test_loss: 1.1330, test_f1: 0.6520
 epoch: 41, train_loss: 0.4937, test_loss: 0.9803, test_f1: 0.6635
 epoch: 42, train_loss: 0.4930, test_loss: 1.1991, test_f1: 0.6485
 epoch: 43, train_loss: 0.4785, test_loss: 1.0499, test_f1: 0.6921
 epoch: 44, train_loss: 0.4771, test_loss: 1.2247, test_f1: 0.6589
 epoch: 45, train_loss: 0.4538, test_loss: 1.2975, test_f1: 0.6469
 epoch: 46, train_loss: 0.4954, test_loss: 1.1626, test_f1: 0.6426
 epoch: 47, train_loss: 0.4618, test_loss: 1.2370, test_f1: 0.6673
 epoch: 48, train_loss: 0.4308, test_loss: 1.2158, test_f1: 0.6742
 epoch: 49, train_loss: 0.4345, test_loss: 1.0994, test_f1: 0.6744
 epoch: 50, train_loss: 0.4467, test_loss: 1.1746, test_f1: 0.6293
 epoch: 51, train_loss: 0.4013, test_loss: 1.2787, test_f1: 0.6669
 epoch: 52, train_loss: 0.3666, test_loss: 1.1322, test_f1: 0.6856
 epoch: 53, train_loss: 0.3498, test_loss: 1.3336, test_f1: 0.6508
 epoch: 54, train_loss: 0.3463, test_loss: 1.3750, test_f1: 0.6624
 epoch: 55, train_loss: 0.3228, test_loss: 1.3795, test_f1: 0.6342
 epoch: 56, train_loss: 0.3165, test_loss: 1.3297, test_f1: 0.6591
 epoch: 57, train_loss: 0.3254, test_loss: 1.3386, test_f1: 0.6745
 epoch: 58, train_loss: 0.3221, test_loss: 1.2864, test_f1: 0.6567
 epoch: 59, train_loss: 0.3149, test_loss: 1.4049, test_f1: 0.7091
 epoch: 60, train_loss: 0.3120, test_loss: 1.3804, test_f1: 0.6754
 epoch: 61, train_loss: 0.2951, test_loss: 1.5642, test_f1: 0.6514
 epoch: 62, train_loss: 0.2753, test_loss: 1.4373, test_f1: 0.6609
 epoch: 63, train_loss: 0.2908, test_loss: 1.5697, test_f1: 0.6545
 epoch: 64, train_loss: 0.2868, test_loss: 1.5486, test_f1: 0.6503
 epoch: 65, train_loss: 0.2884, test_loss: 1.5573, test_f1: 0.6480
 epoch: 66, train_loss: 0.2851, test_loss: 1.5012, test_f1: 0.6617
 epoch: 67, train_loss: 0.2871, test_loss: 1.5101, test_f1: 0.6530
 epoch: 68, train_loss: 0.2701, test_loss: 1.5169, test_f1: 0.6656
 epoch: 69, train_loss: 0.2634, test_loss: 1.5122, test_f1: 0.6481
 epoch: 70, train_loss: 0.2771, test_loss: 1.6591, test_f1: 0.6334
 epoch: 71, train_loss: 0.2635, test_loss: 1.5924, test_f1: 0.6357
 epoch: 72, train_loss: 0.2576, test_loss: 1.4044, test_f1: 0.6646
 epoch: 73, train_loss: 0.2517, test_loss: 1.5681, test_f1: 0.6425
 epoch: 74, train_loss: 0.2488, test_loss: 1.5971, test_f1: 0.6546
 epoch: 75, train_loss: 0.2401, test_loss: 1.4565, test_f1: 0.6699
 epoch: 76, train_loss: 0.2443, test_loss: 1.4498, test_f1: 0.6517
 epoch: 77, train_loss: 0.2413, test_loss: 1.6033, test_f1: 0.6290
 epoch: 78, train_loss: 0.2350, test_loss: 1.6480, test_f1: 0.6462
 epoch: 79, train_loss: 0.2233, test_loss: 1.7155, test_f1: 0.6247
 epoch: 80, train_loss: 0.2250, test_loss: 1.7212, test_f1: 0.6486
 epoch: 81, train_loss: 0.2346, test_loss: 1.8188, test_f1: 0.6274
 epoch: 82, train_loss: 0.2220, test_loss: 1.7519, test_f1: 0.6289
 epoch: 83, train_loss: 0.2061, test_loss: 1.7792, test_f1: 0.6414
 epoch: 84, train_loss: 0.2168, test_loss: 1.8339, test_f1: 0.6499
 epoch: 85, train_loss: 0.2105, test_loss: 1.8370, test_f1: 0.6581
 epoch: 86, train_loss: 0.2014, test_loss: 1.8815, test_f1: 0.6413
 epoch: 87, train_loss: 0.2114, test_loss: 1.8019, test_f1: 0.6324
 epoch: 88, train_loss: 0.2037, test_loss: 1.7118, test_f1: 0.6347
 epoch: 89, train_loss: 0.2318, test_loss: 1.8286, test_f1: 0.6300
 epoch: 90, train_loss: 0.2045, test_loss: 1.8991, test_f1: 0.6455
 epoch: 91, train_loss: 0.2007, test_loss: 1.9043, test_f1: 0.6294
 epoch: 92, train_loss: 0.1960, test_loss: 1.9177, test_f1: 0.6267
 epoch: 93, train_loss: 0.1935, test_loss: 1.7088, test_f1: 0.6563
 epoch: 94, train_loss: 0.1867, test_loss: 2.0465, test_f1: 0.6411
 epoch: 95, train_loss: 0.1872, test_loss: 1.9794, test_f1: 0.6505
 epoch: 96, train_loss: 0.2011, test_loss: 2.0726, test_f1: 0.6377
 epoch: 97, train_loss: 0.1999, test_loss: 2.0630, test_f1: 0.6307
 epoch: 98, train_loss: 0.1843, test_loss: 1.8763, test_f1: 0.6619
 epoch: 99, train_loss: 0.1716, test_loss: 2.0852, test_f1: 0.6651
##################ITERATION #6 ****************************************
 epoch: 0, train_loss: 1.2888, test_loss: 0.9798, test_f1: 0.4463
 epoch: 1, train_loss: 0.9800, test_loss: 0.9192, test_f1: 0.4759
 epoch: 2, train_loss: 0.9583, test_loss: 0.9393, test_f1: 0.5143
 epoch: 3, train_loss: 0.9219, test_loss: 0.9786, test_f1: 0.4665
 epoch: 4, train_loss: 0.9092, test_loss: 0.9093, test_f1: 0.5347
 epoch: 5, train_loss: 0.8911, test_loss: 0.9500, test_f1: 0.5464
 epoch: 6, train_loss: 0.8668, test_loss: 0.9352, test_f1: 0.5299
 epoch: 7, train_loss: 0.8636, test_loss: 0.9034, test_f1: 0.5482
 epoch: 8, train_loss: 0.8332, test_loss: 0.9579, test_f1: 0.5433
 epoch: 9, train_loss: 0.8213, test_loss: 0.9068, test_f1: 0.5426
 epoch: 10, train_loss: 0.8058, test_loss: 0.9171, test_f1: 0.5624
 epoch: 11, train_loss: 0.8131, test_loss: 0.9705, test_f1: 0.5666
 epoch: 12, train_loss: 0.7897, test_loss: 0.9594, test_f1: 0.5965
 epoch: 13, train_loss: 0.7669, test_loss: 0.9892, test_f1: 0.5783
 epoch: 14, train_loss: 0.7670, test_loss: 0.9923, test_f1: 0.5528
 epoch: 15, train_loss: 0.7619, test_loss: 0.9349, test_f1: 0.5685
 epoch: 16, train_loss: 0.7439, test_loss: 0.9902, test_f1: 0.5890
 epoch: 17, train_loss: 0.7443, test_loss: 0.9378, test_f1: 0.5767
 epoch: 18, train_loss: 0.7218, test_loss: 0.9546, test_f1: 0.6409
 epoch: 19, train_loss: 0.7277, test_loss: 1.0483, test_f1: 0.6120
 epoch: 20, train_loss: 0.6942, test_loss: 0.9367, test_f1: 0.5840
 epoch: 21, train_loss: 0.7189, test_loss: 0.9244, test_f1: 0.5881
 epoch: 22, train_loss: 0.6718, test_loss: 1.0014, test_f1: 0.6299
 epoch: 23, train_loss: 0.6913, test_loss: 0.9971, test_f1: 0.6106
 epoch: 24, train_loss: 0.6656, test_loss: 1.0186, test_f1: 0.5677
 epoch: 25, train_loss: 0.6559, test_loss: 0.9365, test_f1: 0.6310
 epoch: 26, train_loss: 0.6420, test_loss: 0.9347, test_f1: 0.6313
 epoch: 27, train_loss: 0.6416, test_loss: 0.9521, test_f1: 0.6153
 epoch: 28, train_loss: 0.6254, test_loss: 1.0721, test_f1: 0.5848
 epoch: 29, train_loss: 0.6346, test_loss: 1.0548, test_f1: 0.6603
 epoch: 30, train_loss: 0.5912, test_loss: 0.9414, test_f1: 0.6473
 epoch: 31, train_loss: 0.5972, test_loss: 1.0832, test_f1: 0.6142
 epoch: 32, train_loss: 0.5783, test_loss: 1.2005, test_f1: 0.6368
 epoch: 33, train_loss: 0.5860, test_loss: 1.0734, test_f1: 0.6213
 epoch: 34, train_loss: 0.5540, test_loss: 1.0955, test_f1: 0.6266
 epoch: 35, train_loss: 0.5623, test_loss: 1.0157, test_f1: 0.6207
 epoch: 36, train_loss: 0.5465, test_loss: 1.1265, test_f1: 0.6483
 epoch: 37, train_loss: 0.5437, test_loss: 1.1192, test_f1: 0.6426
 epoch: 38, train_loss: 0.5495, test_loss: 1.0671, test_f1: 0.6228
 epoch: 39, train_loss: 0.5343, test_loss: 1.2499, test_f1: 0.6076
 epoch: 40, train_loss: 0.5279, test_loss: 1.0945, test_f1: 0.6672
 epoch: 41, train_loss: 0.5106, test_loss: 1.1230, test_f1: 0.6200
 epoch: 42, train_loss: 0.4939, test_loss: 1.1216, test_f1: 0.6539
 epoch: 43, train_loss: 0.4798, test_loss: 1.1694, test_f1: 0.6418
 epoch: 44, train_loss: 0.4963, test_loss: 1.2374, test_f1: 0.6455
 epoch: 45, train_loss: 0.4797, test_loss: 1.2921, test_f1: 0.6280
 epoch: 46, train_loss: 0.4969, test_loss: 1.1126, test_f1: 0.6587
 epoch: 47, train_loss: 0.4711, test_loss: 1.1351, test_f1: 0.6335
 epoch: 48, train_loss: 0.4764, test_loss: 1.2551, test_f1: 0.6474
 epoch: 49, train_loss: 0.4550, test_loss: 1.3944, test_f1: 0.6247
 epoch: 50, train_loss: 0.4530, test_loss: 1.3397, test_f1: 0.6355
 epoch: 51, train_loss: 0.3796, test_loss: 1.4730, test_f1: 0.6390
 epoch: 52, train_loss: 0.3616, test_loss: 1.4699, test_f1: 0.6341
 epoch: 53, train_loss: 0.3500, test_loss: 1.5412, test_f1: 0.6257
 epoch: 54, train_loss: 0.3282, test_loss: 1.5066, test_f1: 0.6487
 epoch: 55, train_loss: 0.3335, test_loss: 1.5903, test_f1: 0.6339
 epoch: 56, train_loss: 0.3211, test_loss: 1.5796, test_f1: 0.6494
 epoch: 57, train_loss: 0.3285, test_loss: 1.6341, test_f1: 0.6529
 epoch: 58, train_loss: 0.3170, test_loss: 1.7109, test_f1: 0.6435
 epoch: 59, train_loss: 0.3154, test_loss: 1.5328, test_f1: 0.6316
 epoch: 60, train_loss: 0.2967, test_loss: 1.5463, test_f1: 0.6662
 epoch: 61, train_loss: 0.2993, test_loss: 1.6285, test_f1: 0.6385
 epoch: 62, train_loss: 0.2774, test_loss: 1.7594, test_f1: 0.6399
 epoch: 63, train_loss: 0.2795, test_loss: 1.8028, test_f1: 0.6347
 epoch: 64, train_loss: 0.2971, test_loss: 1.8046, test_f1: 0.6175
 epoch: 65, train_loss: 0.2848, test_loss: 1.7660, test_f1: 0.6132
 epoch: 66, train_loss: 0.2766, test_loss: 1.8290, test_f1: 0.6400
 epoch: 67, train_loss: 0.2640, test_loss: 1.9141, test_f1: 0.6304
 epoch: 68, train_loss: 0.2875, test_loss: 1.9307, test_f1: 0.6068
 epoch: 69, train_loss: 0.2723, test_loss: 1.8404, test_f1: 0.6431
 epoch: 70, train_loss: 0.2713, test_loss: 1.8143, test_f1: 0.6339
 epoch: 71, train_loss: 0.2434, test_loss: 1.8764, test_f1: 0.6418
 epoch: 72, train_loss: 0.2541, test_loss: 1.7696, test_f1: 0.6358
 epoch: 73, train_loss: 0.2347, test_loss: 1.9362, test_f1: 0.6101
 epoch: 74, train_loss: 0.2430, test_loss: 1.9330, test_f1: 0.6079
 epoch: 75, train_loss: 0.2338, test_loss: 1.9060, test_f1: 0.6150
 epoch: 76, train_loss: 0.2448, test_loss: 1.9920, test_f1: 0.6377
 epoch: 77, train_loss: 0.2356, test_loss: 2.0752, test_f1: 0.6319
 epoch: 78, train_loss: 0.2364, test_loss: 1.9063, test_f1: 0.6352
 epoch: 79, train_loss: 0.2385, test_loss: 2.0598, test_f1: 0.6130
 epoch: 80, train_loss: 0.2288, test_loss: 2.0894, test_f1: 0.6241
 epoch: 81, train_loss: 0.2395, test_loss: 2.1414, test_f1: 0.6275
 epoch: 82, train_loss: 0.2228, test_loss: 2.1174, test_f1: 0.6246
 epoch: 83, train_loss: 0.2261, test_loss: 1.9597, test_f1: 0.6128
 epoch: 84, train_loss: 0.1947, test_loss: 2.0449, test_f1: 0.6316
 epoch: 85, train_loss: 0.2250, test_loss: 1.9456, test_f1: 0.6296
 epoch: 86, train_loss: 0.2373, test_loss: 2.0420, test_f1: 0.6192
 epoch: 87, train_loss: 0.2152, test_loss: 2.1243, test_f1: 0.6167
 epoch: 88, train_loss: 0.2041, test_loss: 2.2312, test_f1: 0.6321
 epoch: 89, train_loss: 0.2156, test_loss: 2.2004, test_f1: 0.6163
 epoch: 90, train_loss: 0.2003, test_loss: 2.2103, test_f1: 0.6327
 epoch: 91, train_loss: 0.2068, test_loss: 2.2031, test_f1: 0.6247
 epoch: 92, train_loss: 0.2189, test_loss: 2.1741, test_f1: 0.6207
 epoch: 93, train_loss: 0.1964, test_loss: 2.1598, test_f1: 0.6194
 epoch: 94, train_loss: 0.1940, test_loss: 2.1738, test_f1: 0.6308
 epoch: 95, train_loss: 0.1867, test_loss: 2.3903, test_f1: 0.5820
 epoch: 96, train_loss: 0.1890, test_loss: 2.2753, test_f1: 0.6217
 epoch: 97, train_loss: 0.1996, test_loss: 2.2157, test_f1: 0.6018
 epoch: 98, train_loss: 0.1849, test_loss: 2.3670, test_f1: 0.6266
 epoch: 99, train_loss: 0.2040, test_loss: 2.1971, test_f1: 0.6230
##################ITERATION #7 ****************************************
 epoch: 0, train_loss: 1.2900, test_loss: 0.9937, test_f1: 0.4657
 epoch: 1, train_loss: 1.0022, test_loss: 0.9454, test_f1: 0.4836
 epoch: 2, train_loss: 0.9545, test_loss: 0.9803, test_f1: 0.4846
 epoch: 3, train_loss: 0.9166, test_loss: 0.9724, test_f1: 0.4895
 epoch: 4, train_loss: 0.9130, test_loss: 0.8925, test_f1: 0.5195
 epoch: 5, train_loss: 0.8836, test_loss: 0.9116, test_f1: 0.5282
 epoch: 6, train_loss: 0.8868, test_loss: 0.9459, test_f1: 0.5547
 epoch: 7, train_loss: 0.8562, test_loss: 0.9418, test_f1: 0.5202
 epoch: 8, train_loss: 0.8407, test_loss: 0.9717, test_f1: 0.5088
 epoch: 9, train_loss: 0.8445, test_loss: 0.9387, test_f1: 0.5095
 epoch: 10, train_loss: 0.8406, test_loss: 0.9076, test_f1: 0.5127
 epoch: 11, train_loss: 0.8050, test_loss: 0.9105, test_f1: 0.5188
 epoch: 12, train_loss: 0.8067, test_loss: 0.9036, test_f1: 0.5710
 epoch: 13, train_loss: 0.7965, test_loss: 0.9487, test_f1: 0.5895
 epoch: 14, train_loss: 0.7842, test_loss: 0.9602, test_f1: 0.5739
 epoch: 15, train_loss: 0.7931, test_loss: 0.9118, test_f1: 0.5657
 epoch: 16, train_loss: 0.7582, test_loss: 1.0117, test_f1: 0.5694
 epoch: 17, train_loss: 0.7699, test_loss: 0.9992, test_f1: 0.5853
 epoch: 18, train_loss: 0.7486, test_loss: 0.8703, test_f1: 0.5940
 epoch: 19, train_loss: 0.7381, test_loss: 0.9107, test_f1: 0.5806
 epoch: 20, train_loss: 0.7228, test_loss: 0.9634, test_f1: 0.5508
 epoch: 21, train_loss: 0.7336, test_loss: 0.8725, test_f1: 0.6446
 epoch: 22, train_loss: 0.7353, test_loss: 0.9326, test_f1: 0.6091
 epoch: 23, train_loss: 0.6956, test_loss: 0.9591, test_f1: 0.6287
 epoch: 24, train_loss: 0.6934, test_loss: 0.9579, test_f1: 0.5692
 epoch: 25, train_loss: 0.6853, test_loss: 0.9611, test_f1: 0.5863
 epoch: 26, train_loss: 0.6835, test_loss: 1.0461, test_f1: 0.5701
 epoch: 27, train_loss: 0.6983, test_loss: 1.0134, test_f1: 0.6349
 epoch: 28, train_loss: 0.6496, test_loss: 1.0378, test_f1: 0.5968
 epoch: 29, train_loss: 0.6688, test_loss: 0.9532, test_f1: 0.6009
 epoch: 30, train_loss: 0.6490, test_loss: 0.9739, test_f1: 0.5729
 epoch: 31, train_loss: 0.6535, test_loss: 0.9651, test_f1: 0.6395
 epoch: 32, train_loss: 0.6425, test_loss: 0.9244, test_f1: 0.6255
 epoch: 33, train_loss: 0.6243, test_loss: 0.9639, test_f1: 0.6223
 epoch: 34, train_loss: 0.6030, test_loss: 0.9630, test_f1: 0.6342
 epoch: 35, train_loss: 0.5831, test_loss: 1.0033, test_f1: 0.6523
 epoch: 36, train_loss: 0.6155, test_loss: 1.2330, test_f1: 0.6254
 epoch: 37, train_loss: 0.5912, test_loss: 1.0422, test_f1: 0.6530
 epoch: 38, train_loss: 0.5798, test_loss: 1.0401, test_f1: 0.6283
 epoch: 39, train_loss: 0.5784, test_loss: 0.9941, test_f1: 0.6203
 epoch: 40, train_loss: 0.5745, test_loss: 0.9796, test_f1: 0.6523
 epoch: 41, train_loss: 0.5505, test_loss: 1.0785, test_f1: 0.5988
 epoch: 42, train_loss: 0.5604, test_loss: 1.1200, test_f1: 0.6152
 epoch: 43, train_loss: 0.5570, test_loss: 1.0240, test_f1: 0.6574
 epoch: 44, train_loss: 0.5294, test_loss: 1.0602, test_f1: 0.6467
 epoch: 45, train_loss: 0.5469, test_loss: 1.1351, test_f1: 0.6342
 epoch: 46, train_loss: 0.5111, test_loss: 1.1783, test_f1: 0.6450
 epoch: 47, train_loss: 0.5073, test_loss: 1.0977, test_f1: 0.5945
 epoch: 48, train_loss: 0.5025, test_loss: 1.0513, test_f1: 0.6457
 epoch: 49, train_loss: 0.5012, test_loss: 1.0911, test_f1: 0.6524
 epoch: 50, train_loss: 0.4917, test_loss: 1.2635, test_f1: 0.6085
 epoch: 51, train_loss: 0.4442, test_loss: 1.2369, test_f1: 0.6206
 epoch: 52, train_loss: 0.4220, test_loss: 1.1032, test_f1: 0.6553
 epoch: 53, train_loss: 0.3970, test_loss: 1.1906, test_f1: 0.6444
 epoch: 54, train_loss: 0.3981, test_loss: 1.2669, test_f1: 0.6773
 epoch: 55, train_loss: 0.3937, test_loss: 1.2367, test_f1: 0.6477
 epoch: 56, train_loss: 0.3746, test_loss: 1.2820, test_f1: 0.6373
 epoch: 57, train_loss: 0.3721, test_loss: 1.2453, test_f1: 0.6550
 epoch: 58, train_loss: 0.3735, test_loss: 1.4492, test_f1: 0.6541
 epoch: 59, train_loss: 0.3665, test_loss: 1.2756, test_f1: 0.6385
 epoch: 60, train_loss: 0.3624, test_loss: 1.3731, test_f1: 0.6497
 epoch: 61, train_loss: 0.3539, test_loss: 1.3625, test_f1: 0.6705
 epoch: 62, train_loss: 0.3654, test_loss: 1.3536, test_f1: 0.6517
 epoch: 63, train_loss: 0.3359, test_loss: 1.3604, test_f1: 0.6592
 epoch: 64, train_loss: 0.3408, test_loss: 1.3461, test_f1: 0.6618
 epoch: 65, train_loss: 0.3402, test_loss: 1.4703, test_f1: 0.6614
 epoch: 66, train_loss: 0.3216, test_loss: 1.4253, test_f1: 0.6276
 epoch: 67, train_loss: 0.3075, test_loss: 1.4589, test_f1: 0.6383
 epoch: 68, train_loss: 0.3206, test_loss: 1.4228, test_f1: 0.6415
 epoch: 69, train_loss: 0.3294, test_loss: 1.3800, test_f1: 0.6824
 epoch: 70, train_loss: 0.3141, test_loss: 1.4931, test_f1: 0.6520
 epoch: 71, train_loss: 0.3156, test_loss: 1.3670, test_f1: 0.6700
 epoch: 72, train_loss: 0.3118, test_loss: 1.4546, test_f1: 0.6561
 epoch: 73, train_loss: 0.2992, test_loss: 1.4553, test_f1: 0.6339
 epoch: 74, train_loss: 0.2844, test_loss: 1.4245, test_f1: 0.6579
 epoch: 75, train_loss: 0.2882, test_loss: 1.5297, test_f1: 0.6362
 epoch: 76, train_loss: 0.2799, test_loss: 1.6030, test_f1: 0.6402
 epoch: 77, train_loss: 0.2899, test_loss: 1.5170, test_f1: 0.6731
 epoch: 78, train_loss: 0.2852, test_loss: 1.6001, test_f1: 0.6672
 epoch: 79, train_loss: 0.2793, test_loss: 1.4715, test_f1: 0.6263
 epoch: 80, train_loss: 0.2875, test_loss: 1.4590, test_f1: 0.6375
 epoch: 81, train_loss: 0.2842, test_loss: 1.4608, test_f1: 0.6475
 epoch: 82, train_loss: 0.2876, test_loss: 1.4756, test_f1: 0.6673
 epoch: 83, train_loss: 0.2651, test_loss: 1.6860, test_f1: 0.6345
 epoch: 84, train_loss: 0.2522, test_loss: 1.5156, test_f1: 0.6242
 epoch: 85, train_loss: 0.2676, test_loss: 1.5750, test_f1: 0.6708
 epoch: 86, train_loss: 0.2597, test_loss: 1.5719, test_f1: 0.6525
 epoch: 87, train_loss: 0.2545, test_loss: 1.6156, test_f1: 0.6201
 epoch: 88, train_loss: 0.2513, test_loss: 1.6293, test_f1: 0.6565
 epoch: 89, train_loss: 0.2520, test_loss: 1.6511, test_f1: 0.6465
 epoch: 90, train_loss: 0.2565, test_loss: 1.5809, test_f1: 0.6420
 epoch: 91, train_loss: 0.2448, test_loss: 1.7580, test_f1: 0.6633
 epoch: 92, train_loss: 0.2563, test_loss: 1.6857, test_f1: 0.6457
 epoch: 93, train_loss: 0.2190, test_loss: 1.6190, test_f1: 0.6722
 epoch: 94, train_loss: 0.2588, test_loss: 1.5238, test_f1: 0.6520
 epoch: 95, train_loss: 0.2454, test_loss: 1.6443, test_f1: 0.6505
 epoch: 96, train_loss: 0.2378, test_loss: 1.6715, test_f1: 0.6651
 epoch: 97, train_loss: 0.2398, test_loss: 1.6346, test_f1: 0.6557
 epoch: 98, train_loss: 0.2250, test_loss: 1.6834, test_f1: 0.6498
 epoch: 99, train_loss: 0.2236, test_loss: 1.7246, test_f1: 0.6598
##################ITERATION #8 ****************************************
 epoch: 0, train_loss: 1.3105, test_loss: 1.0284, test_f1: 0.4534
 epoch: 1, train_loss: 1.0204, test_loss: 0.9848, test_f1: 0.4953
 epoch: 2, train_loss: 0.9508, test_loss: 0.9557, test_f1: 0.5022
 epoch: 3, train_loss: 0.9296, test_loss: 0.8966, test_f1: 0.5151
 epoch: 4, train_loss: 0.8982, test_loss: 0.9645, test_f1: 0.5158
 epoch: 5, train_loss: 0.8981, test_loss: 0.9364, test_f1: 0.5188
 epoch: 6, train_loss: 0.8678, test_loss: 0.9386, test_f1: 0.5511
 epoch: 7, train_loss: 0.8503, test_loss: 0.9113, test_f1: 0.5567
 epoch: 8, train_loss: 0.8365, test_loss: 0.9363, test_f1: 0.5324
 epoch: 9, train_loss: 0.8325, test_loss: 0.8770, test_f1: 0.5490
 epoch: 10, train_loss: 0.8000, test_loss: 0.9274, test_f1: 0.5403
 epoch: 11, train_loss: 0.7788, test_loss: 0.9261, test_f1: 0.5717
 epoch: 12, train_loss: 0.7921, test_loss: 0.8586, test_f1: 0.5735
 epoch: 13, train_loss: 0.7916, test_loss: 0.9642, test_f1: 0.5887
 epoch: 14, train_loss: 0.7616, test_loss: 0.9525, test_f1: 0.5662
 epoch: 15, train_loss: 0.7607, test_loss: 0.9294, test_f1: 0.5579
 epoch: 16, train_loss: 0.7467, test_loss: 0.9399, test_f1: 0.5873
 epoch: 17, train_loss: 0.7361, test_loss: 1.0006, test_f1: 0.5974
 epoch: 18, train_loss: 0.7202, test_loss: 0.9783, test_f1: 0.5598
 epoch: 19, train_loss: 0.7325, test_loss: 0.9248, test_f1: 0.6100
 epoch: 20, train_loss: 0.6984, test_loss: 0.9366, test_f1: 0.6139
 epoch: 21, train_loss: 0.7010, test_loss: 0.9432, test_f1: 0.5601
 epoch: 22, train_loss: 0.6820, test_loss: 0.9872, test_f1: 0.5840
 epoch: 23, train_loss: 0.6742, test_loss: 0.9531, test_f1: 0.6148
 epoch: 24, train_loss: 0.6582, test_loss: 1.0376, test_f1: 0.5493
 epoch: 25, train_loss: 0.6600, test_loss: 0.9766, test_f1: 0.6011
 epoch: 26, train_loss: 0.6598, test_loss: 1.0484, test_f1: 0.6105
 epoch: 27, train_loss: 0.6358, test_loss: 0.9870, test_f1: 0.6042
 epoch: 28, train_loss: 0.6434, test_loss: 0.9641, test_f1: 0.6064
 epoch: 29, train_loss: 0.6319, test_loss: 1.0561, test_f1: 0.5665
 epoch: 30, train_loss: 0.6179, test_loss: 0.9920, test_f1: 0.6019
 epoch: 31, train_loss: 0.6052, test_loss: 1.0406, test_f1: 0.5890
 epoch: 32, train_loss: 0.5812, test_loss: 1.0272, test_f1: 0.6146
 epoch: 33, train_loss: 0.5722, test_loss: 0.9525, test_f1: 0.6411
 epoch: 34, train_loss: 0.5806, test_loss: 1.1559, test_f1: 0.6191
 epoch: 35, train_loss: 0.5734, test_loss: 0.9854, test_f1: 0.6296
 epoch: 36, train_loss: 0.5516, test_loss: 1.2087, test_f1: 0.5652
 epoch: 37, train_loss: 0.5602, test_loss: 1.1254, test_f1: 0.6189
 epoch: 38, train_loss: 0.5573, test_loss: 1.0210, test_f1: 0.6291
 epoch: 39, train_loss: 0.5370, test_loss: 1.2108, test_f1: 0.6202
 epoch: 40, train_loss: 0.5240, test_loss: 1.1704, test_f1: 0.5931
 epoch: 41, train_loss: 0.5040, test_loss: 1.1820, test_f1: 0.5967
 epoch: 42, train_loss: 0.4970, test_loss: 1.1073, test_f1: 0.6433
 epoch: 43, train_loss: 0.4910, test_loss: 1.1128, test_f1: 0.6353
 epoch: 44, train_loss: 0.4696, test_loss: 1.3147, test_f1: 0.6319
 epoch: 45, train_loss: 0.4593, test_loss: 1.1240, test_f1: 0.5899
 epoch: 46, train_loss: 0.4911, test_loss: 1.2266, test_f1: 0.6183
 epoch: 47, train_loss: 0.4700, test_loss: 1.0969, test_f1: 0.6484
 epoch: 48, train_loss: 0.4411, test_loss: 1.2737, test_f1: 0.6380
 epoch: 49, train_loss: 0.4483, test_loss: 1.1830, test_f1: 0.6640
 epoch: 50, train_loss: 0.4293, test_loss: 1.2581, test_f1: 0.6173
 epoch: 51, train_loss: 0.4057, test_loss: 1.2487, test_f1: 0.6443
 epoch: 52, train_loss: 0.3670, test_loss: 1.2676, test_f1: 0.6483
 epoch: 53, train_loss: 0.3541, test_loss: 1.3138, test_f1: 0.6610
 epoch: 54, train_loss: 0.3585, test_loss: 1.3389, test_f1: 0.6742
 epoch: 55, train_loss: 0.3360, test_loss: 1.3917, test_f1: 0.6342
 epoch: 56, train_loss: 0.3319, test_loss: 1.4601, test_f1: 0.6318
 epoch: 57, train_loss: 0.3161, test_loss: 1.4694, test_f1: 0.6469
 epoch: 58, train_loss: 0.3115, test_loss: 1.4530, test_f1: 0.6358
 epoch: 59, train_loss: 0.3121, test_loss: 1.6186, test_f1: 0.6450
 epoch: 60, train_loss: 0.3105, test_loss: 1.5552, test_f1: 0.6241
 epoch: 61, train_loss: 0.3012, test_loss: 1.6763, test_f1: 0.6429
 epoch: 62, train_loss: 0.3298, test_loss: 1.5268, test_f1: 0.6402
 epoch: 63, train_loss: 0.3093, test_loss: 1.5616, test_f1: 0.6384
 epoch: 64, train_loss: 0.2944, test_loss: 1.3679, test_f1: 0.6760
 epoch: 65, train_loss: 0.3197, test_loss: 1.5435, test_f1: 0.6488
 epoch: 66, train_loss: 0.2984, test_loss: 1.4513, test_f1: 0.6564
 epoch: 67, train_loss: 0.3075, test_loss: 1.5195, test_f1: 0.6369
 epoch: 68, train_loss: 0.2920, test_loss: 1.6523, test_f1: 0.6452
 epoch: 69, train_loss: 0.2875, test_loss: 1.5813, test_f1: 0.6546
 epoch: 70, train_loss: 0.2779, test_loss: 1.6075, test_f1: 0.6578
 epoch: 71, train_loss: 0.2570, test_loss: 1.6420, test_f1: 0.6190
 epoch: 72, train_loss: 0.2799, test_loss: 1.5918, test_f1: 0.6369
 epoch: 73, train_loss: 0.2651, test_loss: 1.7395, test_f1: 0.6621
 epoch: 74, train_loss: 0.2568, test_loss: 1.5246, test_f1: 0.6552
 epoch: 75, train_loss: 0.2588, test_loss: 1.8375, test_f1: 0.6161
 epoch: 76, train_loss: 0.2560, test_loss: 1.6163, test_f1: 0.6446
 epoch: 77, train_loss: 0.2392, test_loss: 1.5631, test_f1: 0.6413
 epoch: 78, train_loss: 0.2339, test_loss: 1.9240, test_f1: 0.6393
 epoch: 79, train_loss: 0.2521, test_loss: 1.5969, test_f1: 0.6383
 epoch: 80, train_loss: 0.2272, test_loss: 1.6768, test_f1: 0.6342
 epoch: 81, train_loss: 0.2247, test_loss: 1.9412, test_f1: 0.6264
 epoch: 82, train_loss: 0.2350, test_loss: 1.7481, test_f1: 0.6444
 epoch: 83, train_loss: 0.2197, test_loss: 1.7241, test_f1: 0.6432
 epoch: 84, train_loss: 0.2339, test_loss: 1.7939, test_f1: 0.6410
 epoch: 85, train_loss: 0.2170, test_loss: 1.7997, test_f1: 0.6431
 epoch: 86, train_loss: 0.2104, test_loss: 1.8258, test_f1: 0.6382
 epoch: 87, train_loss: 0.2180, test_loss: 1.7944, test_f1: 0.6416
 epoch: 88, train_loss: 0.2175, test_loss: 1.7092, test_f1: 0.6463
 epoch: 89, train_loss: 0.2159, test_loss: 1.8267, test_f1: 0.6342
 epoch: 90, train_loss: 0.2117, test_loss: 1.5683, test_f1: 0.6469
 epoch: 91, train_loss: 0.2246, test_loss: 1.7504, test_f1: 0.6305
 epoch: 92, train_loss: 0.2202, test_loss: 1.8088, test_f1: 0.6633
 epoch: 93, train_loss: 0.2142, test_loss: 1.9415, test_f1: 0.6340
 epoch: 94, train_loss: 0.2093, test_loss: 1.7979, test_f1: 0.6564
 epoch: 95, train_loss: 0.1942, test_loss: 1.8603, test_f1: 0.6496
 epoch: 96, train_loss: 0.2015, test_loss: 1.8003, test_f1: 0.6311
 epoch: 97, train_loss: 0.2027, test_loss: 1.8346, test_f1: 0.6409
 epoch: 98, train_loss: 0.1985, test_loss: 1.7921, test_f1: 0.6515
 epoch: 99, train_loss: 0.1941, test_loss: 1.8526, test_f1: 0.6468
##################ITERATION #9 ****************************************
 epoch: 0, train_loss: 1.2665, test_loss: 1.0602, test_f1: 0.3934
 epoch: 1, train_loss: 0.9808, test_loss: 0.9756, test_f1: 0.4715
 epoch: 2, train_loss: 0.9413, test_loss: 0.9648, test_f1: 0.4764
 epoch: 3, train_loss: 0.9246, test_loss: 0.9283, test_f1: 0.4990
 epoch: 4, train_loss: 0.8851, test_loss: 0.9526, test_f1: 0.4901
 epoch: 5, train_loss: 0.8637, test_loss: 0.9690, test_f1: 0.5034
 epoch: 6, train_loss: 0.8547, test_loss: 0.9594, test_f1: 0.5262
 epoch: 7, train_loss: 0.8314, test_loss: 0.9297, test_f1: 0.5229
 epoch: 8, train_loss: 0.8232, test_loss: 0.9283, test_f1: 0.5484
 epoch: 9, train_loss: 0.8097, test_loss: 0.9546, test_f1: 0.5526
 epoch: 10, train_loss: 0.7916, test_loss: 0.9967, test_f1: 0.5583
 epoch: 11, train_loss: 0.7878, test_loss: 0.9504, test_f1: 0.5821
 epoch: 12, train_loss: 0.7958, test_loss: 0.9954, test_f1: 0.5662
 epoch: 13, train_loss: 0.7664, test_loss: 0.9246, test_f1: 0.5564
 epoch: 14, train_loss: 0.7616, test_loss: 0.9481, test_f1: 0.5723
 epoch: 15, train_loss: 0.7325, test_loss: 0.8895, test_f1: 0.5737
 epoch: 16, train_loss: 0.7413, test_loss: 0.8803, test_f1: 0.5988
 epoch: 17, train_loss: 0.7137, test_loss: 0.9326, test_f1: 0.5984
 epoch: 18, train_loss: 0.7163, test_loss: 0.9180, test_f1: 0.6240
 epoch: 19, train_loss: 0.7251, test_loss: 0.9245, test_f1: 0.6365
 epoch: 20, train_loss: 0.7005, test_loss: 1.0405, test_f1: 0.5571
 epoch: 21, train_loss: 0.6859, test_loss: 0.9095, test_f1: 0.6168
 epoch: 22, train_loss: 0.6716, test_loss: 0.9436, test_f1: 0.5770
 epoch: 23, train_loss: 0.6747, test_loss: 0.9719, test_f1: 0.6109
 epoch: 24, train_loss: 0.7030, test_loss: 0.9239, test_f1: 0.6101
 epoch: 25, train_loss: 0.6480, test_loss: 1.0136, test_f1: 0.5955
 epoch: 26, train_loss: 0.6319, test_loss: 0.9438, test_f1: 0.6291
 epoch: 27, train_loss: 0.6377, test_loss: 1.0335, test_f1: 0.5973
 epoch: 28, train_loss: 0.6282, test_loss: 1.0038, test_f1: 0.6146
 epoch: 29, train_loss: 0.6152, test_loss: 1.0171, test_f1: 0.6188
 epoch: 30, train_loss: 0.6183, test_loss: 0.9483, test_f1: 0.6091
 epoch: 31, train_loss: 0.5750, test_loss: 0.8900, test_f1: 0.6744
 epoch: 32, train_loss: 0.5867, test_loss: 0.9401, test_f1: 0.6463
 epoch: 33, train_loss: 0.5673, test_loss: 1.0099, test_f1: 0.6186
 epoch: 34, train_loss: 0.5617, test_loss: 0.9935, test_f1: 0.6465
 epoch: 35, train_loss: 0.5568, test_loss: 1.0435, test_f1: 0.6480
 epoch: 36, train_loss: 0.5323, test_loss: 1.1006, test_f1: 0.6225
 epoch: 37, train_loss: 0.5447, test_loss: 0.9845, test_f1: 0.6400
 epoch: 38, train_loss: 0.5363, test_loss: 0.9917, test_f1: 0.6242
 epoch: 39, train_loss: 0.5203, test_loss: 0.9270, test_f1: 0.6800
 epoch: 40, train_loss: 0.5291, test_loss: 1.0565, test_f1: 0.6239
 epoch: 41, train_loss: 0.5430, test_loss: 1.0673, test_f1: 0.6241
 epoch: 42, train_loss: 0.5138, test_loss: 0.9926, test_f1: 0.6379
 epoch: 43, train_loss: 0.5034, test_loss: 1.0128, test_f1: 0.6064
 epoch: 44, train_loss: 0.5320, test_loss: 1.0591, test_f1: 0.6130
 epoch: 45, train_loss: 0.4718, test_loss: 1.0944, test_f1: 0.6315
 epoch: 46, train_loss: 0.4891, test_loss: 1.1123, test_f1: 0.6263
 epoch: 47, train_loss: 0.4864, test_loss: 0.9889, test_f1: 0.6715
 epoch: 48, train_loss: 0.4664, test_loss: 1.0545, test_f1: 0.6448
 epoch: 49, train_loss: 0.4586, test_loss: 1.0995, test_f1: 0.6525
 epoch: 50, train_loss: 0.4512, test_loss: 1.1774, test_f1: 0.6326
 epoch: 51, train_loss: 0.3775, test_loss: 1.2910, test_f1: 0.6351
 epoch: 52, train_loss: 0.3687, test_loss: 1.2278, test_f1: 0.6574
 epoch: 53, train_loss: 0.3550, test_loss: 1.3303, test_f1: 0.6421
 epoch: 54, train_loss: 0.3403, test_loss: 1.2392, test_f1: 0.6442
 epoch: 55, train_loss: 0.3379, test_loss: 1.2965, test_f1: 0.6512
 epoch: 56, train_loss: 0.3466, test_loss: 1.2993, test_f1: 0.6674
 epoch: 57, train_loss: 0.3211, test_loss: 1.3118, test_f1: 0.6558
 epoch: 58, train_loss: 0.3223, test_loss: 1.3859, test_f1: 0.6452
 epoch: 59, train_loss: 0.3086, test_loss: 1.5248, test_f1: 0.6576
 epoch: 60, train_loss: 0.3130, test_loss: 1.4944, test_f1: 0.6688
 epoch: 61, train_loss: 0.3201, test_loss: 1.4441, test_f1: 0.6375
 epoch: 62, train_loss: 0.2949, test_loss: 1.4742, test_f1: 0.6623
 epoch: 63, train_loss: 0.3007, test_loss: 1.4400, test_f1: 0.6632
 epoch: 64, train_loss: 0.2827, test_loss: 1.5646, test_f1: 0.6397
 epoch: 65, train_loss: 0.2829, test_loss: 1.4412, test_f1: 0.6607
 epoch: 66, train_loss: 0.2822, test_loss: 1.5746, test_f1: 0.6486
 epoch: 67, train_loss: 0.2859, test_loss: 1.4020, test_f1: 0.6673
 epoch: 68, train_loss: 0.2783, test_loss: 1.5990, test_f1: 0.6476
 epoch: 69, train_loss: 0.2943, test_loss: 1.5840, test_f1: 0.6615
 epoch: 70, train_loss: 0.2633, test_loss: 1.5874, test_f1: 0.6331
 epoch: 71, train_loss: 0.2720, test_loss: 1.5748, test_f1: 0.6460
 epoch: 72, train_loss: 0.2546, test_loss: 1.5380, test_f1: 0.6426
 epoch: 73, train_loss: 0.2399, test_loss: 1.5561, test_f1: 0.6547
 epoch: 74, train_loss: 0.2604, test_loss: 1.6159, test_f1: 0.6523
 epoch: 75, train_loss: 0.2686, test_loss: 1.4960, test_f1: 0.6790
 epoch: 76, train_loss: 0.2564, test_loss: 1.4557, test_f1: 0.6566
 epoch: 77, train_loss: 0.2340, test_loss: 1.6666, test_f1: 0.6391
 epoch: 78, train_loss: 0.2472, test_loss: 1.7803, test_f1: 0.6590
 epoch: 79, train_loss: 0.2399, test_loss: 1.6981, test_f1: 0.6421
 epoch: 80, train_loss: 0.2371, test_loss: 1.6930, test_f1: 0.6732
 epoch: 81, train_loss: 0.2524, test_loss: 1.6780, test_f1: 0.6556
 epoch: 82, train_loss: 0.2337, test_loss: 1.6164, test_f1: 0.6445
 epoch: 83, train_loss: 0.2467, test_loss: 1.7642, test_f1: 0.6618
 epoch: 84, train_loss: 0.2237, test_loss: 1.6848, test_f1: 0.6392
 epoch: 85, train_loss: 0.2333, test_loss: 1.7047, test_f1: 0.6671
 epoch: 86, train_loss: 0.2100, test_loss: 1.8388, test_f1: 0.6407
 epoch: 87, train_loss: 0.2100, test_loss: 1.7633, test_f1: 0.6514
 epoch: 88, train_loss: 0.2244, test_loss: 1.7450, test_f1: 0.6590
 epoch: 89, train_loss: 0.2185, test_loss: 1.7773, test_f1: 0.6486
 epoch: 90, train_loss: 0.2038, test_loss: 1.7554, test_f1: 0.6628
 epoch: 91, train_loss: 0.2144, test_loss: 1.8081, test_f1: 0.6613
 epoch: 92, train_loss: 0.2075, test_loss: 1.8358, test_f1: 0.6400
 epoch: 93, train_loss: 0.2038, test_loss: 1.8411, test_f1: 0.6428
 epoch: 94, train_loss: 0.2047, test_loss: 1.9355, test_f1: 0.6396
 epoch: 95, train_loss: 0.2082, test_loss: 1.8771, test_f1: 0.6562
 epoch: 96, train_loss: 0.1986, test_loss: 1.7708, test_f1: 0.6602
 epoch: 97, train_loss: 0.2112, test_loss: 1.8349, test_f1: 0.6504
 epoch: 98, train_loss: 0.1956, test_loss: 1.8129, test_f1: 0.6587
 epoch: 99, train_loss: 0.2181, test_loss: 1.7090, test_f1: 0.6552

Training completed in 692.01 seconds
Best F1: 0.7091 at epoch 59
Mean F1 across iterations: 0.6856  0.0116
========================FINAL RESULTS================================
FEGIN weighted F1: 0.7091  0.0116
python main.py --data ltspice_examples --representation component_net --model FEGIN --layers 4 --hiddens 128 --batch_size 64 --lr 0.001 --emb_size 128 --epochs 100 --save_appendix component_net_L4_H128_BS64_LR0.001_E128 --no_val
-----



STDERR:
Processing...
Done!
  File "main.py", line 370, in <module>
    main()
  File "main.py", line 254, in main
    dataset = dataset_class(
  File "/home/philip/projects/ltspice_examples_code_repo/Circuit-Completion-Using-GNNs/component_classification_with_link_prediction_head/evaluation/FEGIN/kernel/circuit_datasets.py", line 15, in __init__
    self.data, self.slices = torch.load(self.processed_paths[0])
  File "/home/philip/.local/lib/python3.8/site-packages/torch/serialization.py", line 1040, in load
    warnings.warn(
  File "/usr/lib/python3.8/warnings.py", line 109, in _showwarnmsg
    sw(msg.message, msg.category, msg.filename, msg.lineno,
  File "main.py", line 47, in warn_with_traceback
    traceback.print_stack(file=log)
/home/philip/projects/ltspice_examples_code_repo/Circuit-Completion-Using-GNNs/component_classification_with_link_prediction_head/evaluation/FEGIN/kernel/circuit_datasets.py:15: FutureWarning: You are using `torch.load` with `weights_only=False` (the current default value), which uses the default pickle module implicitly. It is possible to construct malicious pickle data which will execute arbitrary code during unpickling (See https://github.com/pytorch/pytorch/blob/main/SECURITY.md#untrusted-models for more details). In a future release, the default value for `weights_only` will be flipped to `True`. This limits the functions that could be executed during unpickling. Arbitrary objects will no longer be allowed to be loaded via this mode unless they are explicitly allowlisted by the user via `torch.serialization.add_safe_globals`. We recommend you start setting `weights_only=True` for any use case where you don't have full control of the loaded file. Please open an issue on GitHub for any issues related to this experimental feature.
  self.data, self.slices = torch.load(self.processed_paths[0])
