STDOUT:
Results will be saved in /home/philip/projects/llm_inference_code_repo/Circuit-Completion-Using-GNNs/component_classification_with_link_prediction_head/evaluation/FEGIN/results/model_FEGIN_dataset_ltspice_examples
Command line input: python main.py --data ltspice_examples --representation component_pin --model FEGIN --layers 3 --hiddens 128 --batch_size 32 --lr 0.001 --emb_size 128 --epochs 100 --save_appendix component_pin_L3_H128_BS32_LR0.001_E128 --no_val
 is saved.
-----
ltspice_examples - FEGIN
Using 3 layers, 128 hidden units, h = 2
Loading component_pin representation dataset
ENTERED
Training FEGIN on component_pin representation
Train: 3560, Test: 848
##################ITERATION #0 ****************************************
 epoch: 0, train_loss: 1.1400, test_loss: 1.0687, test_f1: 0.3978
 epoch: 1, train_loss: 0.9830, test_loss: 0.9799, test_f1: 0.4745
 epoch: 2, train_loss: 0.9195, test_loss: 0.9209, test_f1: 0.5237
 epoch: 3, train_loss: 0.8760, test_loss: 0.9110, test_f1: 0.4773
 epoch: 4, train_loss: 0.8511, test_loss: 0.7965, test_f1: 0.6118
 epoch: 5, train_loss: 0.8235, test_loss: 0.8700, test_f1: 0.5995
 epoch: 6, train_loss: 0.8061, test_loss: 0.9935, test_f1: 0.5124
 epoch: 7, train_loss: 0.7745, test_loss: 0.8787, test_f1: 0.5411
 epoch: 8, train_loss: 0.7646, test_loss: 0.8376, test_f1: 0.5950
 epoch: 9, train_loss: 0.7425, test_loss: 0.9133, test_f1: 0.5415
 epoch: 10, train_loss: 0.7449, test_loss: 0.8638, test_f1: 0.5771
 epoch: 11, train_loss: 0.7240, test_loss: 0.8435, test_f1: 0.5979
 epoch: 12, train_loss: 0.7270, test_loss: 0.8379, test_f1: 0.5901
 epoch: 13, train_loss: 0.7125, test_loss: 0.8400, test_f1: 0.5899
 epoch: 14, train_loss: 0.6829, test_loss: 0.8732, test_f1: 0.6108
 epoch: 15, train_loss: 0.6801, test_loss: 0.8182, test_f1: 0.5955
 epoch: 16, train_loss: 0.6589, test_loss: 0.9314, test_f1: 0.5889
 epoch: 17, train_loss: 0.6562, test_loss: 0.9007, test_f1: 0.6227
 epoch: 18, train_loss: 0.6367, test_loss: 0.8302, test_f1: 0.6528
 epoch: 19, train_loss: 0.6516, test_loss: 0.8718, test_f1: 0.6497
 epoch: 20, train_loss: 0.6408, test_loss: 0.8374, test_f1: 0.6100
 epoch: 21, train_loss: 0.6124, test_loss: 0.8129, test_f1: 0.6280
 epoch: 22, train_loss: 0.6143, test_loss: 0.8299, test_f1: 0.6464
 epoch: 23, train_loss: 0.6147, test_loss: 0.9367, test_f1: 0.5997
 epoch: 24, train_loss: 0.6060, test_loss: 0.7632, test_f1: 0.6530
 epoch: 25, train_loss: 0.5924, test_loss: 0.8065, test_f1: 0.6476
 epoch: 26, train_loss: 0.6027, test_loss: 0.8169, test_f1: 0.6704
 epoch: 27, train_loss: 0.5730, test_loss: 1.0143, test_f1: 0.6264
 epoch: 28, train_loss: 0.5683, test_loss: 0.9194, test_f1: 0.6500
 epoch: 29, train_loss: 0.5533, test_loss: 1.1685, test_f1: 0.5952
 epoch: 30, train_loss: 0.5250, test_loss: 1.0899, test_f1: 0.6328
 epoch: 31, train_loss: 0.5232, test_loss: 0.9702, test_f1: 0.6272
 epoch: 32, train_loss: 0.5246, test_loss: 0.8931, test_f1: 0.6629
 epoch: 33, train_loss: 0.5076, test_loss: 0.8786, test_f1: 0.6738
 epoch: 34, train_loss: 0.5103, test_loss: 0.9471, test_f1: 0.6855
 epoch: 35, train_loss: 0.4946, test_loss: 1.1044, test_f1: 0.6202
 epoch: 36, train_loss: 0.4740, test_loss: 1.0105, test_f1: 0.6375
 epoch: 37, train_loss: 0.4579, test_loss: 1.0923, test_f1: 0.6341
 epoch: 38, train_loss: 0.4678, test_loss: 1.0231, test_f1: 0.6863
 epoch: 39, train_loss: 0.4781, test_loss: 0.8562, test_f1: 0.6820
 epoch: 40, train_loss: 0.4507, test_loss: 0.9386, test_f1: 0.6999
 epoch: 41, train_loss: 0.4486, test_loss: 1.0434, test_f1: 0.6738
 epoch: 42, train_loss: 0.4289, test_loss: 0.9708, test_f1: 0.6536
 epoch: 43, train_loss: 0.4645, test_loss: 0.9837, test_f1: 0.6286
 epoch: 44, train_loss: 0.4708, test_loss: 1.0730, test_f1: 0.6686
 epoch: 45, train_loss: 0.4169, test_loss: 1.0372, test_f1: 0.6719
 epoch: 46, train_loss: 0.4058, test_loss: 1.0238, test_f1: 0.6724
 epoch: 47, train_loss: 0.3871, test_loss: 1.1965, test_f1: 0.6298
 epoch: 48, train_loss: 0.3858, test_loss: 1.0350, test_f1: 0.6804
 epoch: 49, train_loss: 0.4011, test_loss: 1.0995, test_f1: 0.6795
 epoch: 50, train_loss: 0.3714, test_loss: 1.1316, test_f1: 0.6914
 epoch: 51, train_loss: 0.3347, test_loss: 1.1260, test_f1: 0.6917
 epoch: 52, train_loss: 0.3035, test_loss: 1.0858, test_f1: 0.6782
 epoch: 53, train_loss: 0.3162, test_loss: 1.2497, test_f1: 0.6865
 epoch: 54, train_loss: 0.3118, test_loss: 1.2058, test_f1: 0.6523
 epoch: 55, train_loss: 0.2960, test_loss: 1.2861, test_f1: 0.6851
 epoch: 56, train_loss: 0.2876, test_loss: 1.1872, test_f1: 0.6903
 epoch: 57, train_loss: 0.3079, test_loss: 1.2285, test_f1: 0.6786
 epoch: 58, train_loss: 0.2720, test_loss: 1.2236, test_f1: 0.6810
 epoch: 59, train_loss: 0.2660, test_loss: 1.3960, test_f1: 0.6742
 epoch: 60, train_loss: 0.2651, test_loss: 1.4188, test_f1: 0.6558
 epoch: 61, train_loss: 0.2441, test_loss: 1.4666, test_f1: 0.7016
 epoch: 62, train_loss: 0.2604, test_loss: 1.3173, test_f1: 0.6705
 epoch: 63, train_loss: 0.2564, test_loss: 1.3010, test_f1: 0.6833
 epoch: 64, train_loss: 0.2612, test_loss: 1.3196, test_f1: 0.6835
 epoch: 65, train_loss: 0.2449, test_loss: 1.3159, test_f1: 0.6623
 epoch: 66, train_loss: 0.2330, test_loss: 1.4262, test_f1: 0.6832
 epoch: 67, train_loss: 0.2388, test_loss: 1.3123, test_f1: 0.6659
 epoch: 68, train_loss: 0.2365, test_loss: 1.4704, test_f1: 0.6719
 epoch: 69, train_loss: 0.2165, test_loss: 1.3621, test_f1: 0.6823
 epoch: 70, train_loss: 0.2298, test_loss: 1.4052, test_f1: 0.6693
 epoch: 71, train_loss: 0.1994, test_loss: 1.4326, test_f1: 0.7126
 epoch: 72, train_loss: 0.2223, test_loss: 1.4288, test_f1: 0.6963
 epoch: 73, train_loss: 0.2108, test_loss: 1.4513, test_f1: 0.6554
 epoch: 74, train_loss: 0.2038, test_loss: 1.6806, test_f1: 0.6720
 epoch: 75, train_loss: 0.2136, test_loss: 1.6698, test_f1: 0.6649
 epoch: 76, train_loss: 0.2103, test_loss: 1.6686, test_f1: 0.6604
 epoch: 77, train_loss: 0.1991, test_loss: 1.7313, test_f1: 0.6656
 epoch: 78, train_loss: 0.2023, test_loss: 1.5154, test_f1: 0.6836
 epoch: 79, train_loss: 0.2147, test_loss: 1.6176, test_f1: 0.6675
 epoch: 80, train_loss: 0.2708, test_loss: 1.5241, test_f1: 0.6474
 epoch: 81, train_loss: 0.2467, test_loss: 1.5450, test_f1: 0.6676
 epoch: 82, train_loss: 0.2127, test_loss: 1.5311, test_f1: 0.6853
 epoch: 83, train_loss: 0.2113, test_loss: 1.5736, test_f1: 0.6438
 epoch: 84, train_loss: 0.2080, test_loss: 1.6341, test_f1: 0.6647
 epoch: 85, train_loss: 0.2052, test_loss: 1.5037, test_f1: 0.6877
 epoch: 86, train_loss: 0.1840, test_loss: 1.6867, test_f1: 0.6795
 epoch: 87, train_loss: 0.1930, test_loss: 1.6564, test_f1: 0.6623
 epoch: 88, train_loss: 0.1894, test_loss: 1.5250, test_f1: 0.6771
 epoch: 89, train_loss: 0.1793, test_loss: 1.6175, test_f1: 0.6836
 epoch: 90, train_loss: 0.1805, test_loss: 1.7000, test_f1: 0.6650
 epoch: 91, train_loss: 0.1980, test_loss: 1.5083, test_f1: 0.7013
 epoch: 92, train_loss: 0.1907, test_loss: 1.6813, test_f1: 0.6765
 epoch: 93, train_loss: 0.1878, test_loss: 1.7446, test_f1: 0.6820
 epoch: 94, train_loss: 0.1803, test_loss: 1.6005, test_f1: 0.7208
 epoch: 95, train_loss: 0.1687, test_loss: 1.5896, test_f1: 0.6975
 epoch: 96, train_loss: 0.1710, test_loss: 1.7270, test_f1: 0.6933
 epoch: 97, train_loss: 0.1790, test_loss: 1.7085, test_f1: 0.6704
 epoch: 98, train_loss: 0.1631, test_loss: 1.6939, test_f1: 0.6770
 epoch: 99, train_loss: 0.1594, test_loss: 1.6811, test_f1: 0.6728
##################ITERATION #1 ****************************************
 epoch: 0, train_loss: 1.0846, test_loss: 0.9633, test_f1: 0.5106
 epoch: 1, train_loss: 0.9314, test_loss: 0.8868, test_f1: 0.5651
 epoch: 2, train_loss: 0.8965, test_loss: 0.9276, test_f1: 0.5358
 epoch: 3, train_loss: 0.8758, test_loss: 0.9226, test_f1: 0.5336
 epoch: 4, train_loss: 0.8581, test_loss: 0.8981, test_f1: 0.5501
 epoch: 5, train_loss: 0.8296, test_loss: 0.7912, test_f1: 0.5499
 epoch: 6, train_loss: 0.8081, test_loss: 0.9009, test_f1: 0.5318
 epoch: 7, train_loss: 0.7799, test_loss: 0.7876, test_f1: 0.5849
 epoch: 8, train_loss: 0.7881, test_loss: 0.7924, test_f1: 0.6316
 epoch: 9, train_loss: 0.7539, test_loss: 0.9324, test_f1: 0.5659
 epoch: 10, train_loss: 0.7406, test_loss: 0.8403, test_f1: 0.6222
 epoch: 11, train_loss: 0.7321, test_loss: 0.8273, test_f1: 0.5963
 epoch: 12, train_loss: 0.7224, test_loss: 0.8063, test_f1: 0.5988
 epoch: 13, train_loss: 0.7052, test_loss: 0.9152, test_f1: 0.5872
 epoch: 14, train_loss: 0.7120, test_loss: 0.8318, test_f1: 0.6211
 epoch: 15, train_loss: 0.6991, test_loss: 0.8851, test_f1: 0.6306
 epoch: 16, train_loss: 0.6836, test_loss: 0.8718, test_f1: 0.6570
 epoch: 17, train_loss: 0.6545, test_loss: 0.9224, test_f1: 0.6147
 epoch: 18, train_loss: 0.6687, test_loss: 0.9541, test_f1: 0.5767
 epoch: 19, train_loss: 0.6468, test_loss: 0.8564, test_f1: 0.6268
 epoch: 20, train_loss: 0.6466, test_loss: 0.8789, test_f1: 0.6325
 epoch: 21, train_loss: 0.6175, test_loss: 0.8384, test_f1: 0.6569
 epoch: 22, train_loss: 0.6132, test_loss: 0.8261, test_f1: 0.6444
 epoch: 23, train_loss: 0.5932, test_loss: 0.8181, test_f1: 0.6462
 epoch: 24, train_loss: 0.5825, test_loss: 0.9086, test_f1: 0.6329
 epoch: 25, train_loss: 0.5989, test_loss: 0.8060, test_f1: 0.6643
 epoch: 26, train_loss: 0.5935, test_loss: 0.8399, test_f1: 0.6273
 epoch: 27, train_loss: 0.5590, test_loss: 0.9052, test_f1: 0.6242
 epoch: 28, train_loss: 0.5598, test_loss: 0.8824, test_f1: 0.6591
 epoch: 29, train_loss: 0.5294, test_loss: 0.9025, test_f1: 0.6494
 epoch: 30, train_loss: 0.5392, test_loss: 0.9248, test_f1: 0.6299
 epoch: 31, train_loss: 0.5467, test_loss: 0.9333, test_f1: 0.6644
 epoch: 32, train_loss: 0.5203, test_loss: 0.9429, test_f1: 0.6423
 epoch: 33, train_loss: 0.5196, test_loss: 0.8501, test_f1: 0.6453
 epoch: 34, train_loss: 0.5065, test_loss: 0.9185, test_f1: 0.6337
 epoch: 35, train_loss: 0.5242, test_loss: 0.9162, test_f1: 0.6729
 epoch: 36, train_loss: 0.5099, test_loss: 0.8412, test_f1: 0.6642
 epoch: 37, train_loss: 0.4885, test_loss: 0.9201, test_f1: 0.6423
 epoch: 38, train_loss: 0.4737, test_loss: 0.9669, test_f1: 0.6589
 epoch: 39, train_loss: 0.4640, test_loss: 1.1030, test_f1: 0.6171
 epoch: 40, train_loss: 0.4487, test_loss: 0.8637, test_f1: 0.6804
 epoch: 41, train_loss: 0.4673, test_loss: 0.9111, test_f1: 0.6606
 epoch: 42, train_loss: 0.4282, test_loss: 0.9655, test_f1: 0.6781
 epoch: 43, train_loss: 0.4366, test_loss: 0.9163, test_f1: 0.6966
 epoch: 44, train_loss: 0.4248, test_loss: 0.9410, test_f1: 0.6914
 epoch: 45, train_loss: 0.4248, test_loss: 0.9802, test_f1: 0.6718
 epoch: 46, train_loss: 0.4240, test_loss: 0.9604, test_f1: 0.6503
 epoch: 47, train_loss: 0.4377, test_loss: 0.9594, test_f1: 0.6625
 epoch: 48, train_loss: 0.3835, test_loss: 0.9259, test_f1: 0.6824
 epoch: 49, train_loss: 0.3851, test_loss: 0.9380, test_f1: 0.6661
 epoch: 50, train_loss: 0.3655, test_loss: 1.0694, test_f1: 0.6528
 epoch: 51, train_loss: 0.3448, test_loss: 1.1174, test_f1: 0.6763
 epoch: 52, train_loss: 0.3040, test_loss: 1.2269, test_f1: 0.6659
 epoch: 53, train_loss: 0.3053, test_loss: 1.1551, test_f1: 0.6476
 epoch: 54, train_loss: 0.3098, test_loss: 1.1388, test_f1: 0.6945
 epoch: 55, train_loss: 0.3116, test_loss: 1.1977, test_f1: 0.6554
 epoch: 56, train_loss: 0.2916, test_loss: 1.1223, test_f1: 0.6825
 epoch: 57, train_loss: 0.2907, test_loss: 1.2439, test_f1: 0.6695
 epoch: 58, train_loss: 0.2863, test_loss: 1.2664, test_f1: 0.6799
 epoch: 59, train_loss: 0.2786, test_loss: 1.2086, test_f1: 0.6798
 epoch: 60, train_loss: 0.2759, test_loss: 1.1901, test_f1: 0.6968
 epoch: 61, train_loss: 0.2564, test_loss: 1.4221, test_f1: 0.5971
 epoch: 62, train_loss: 0.2667, test_loss: 1.1997, test_f1: 0.6768
 epoch: 63, train_loss: 0.2643, test_loss: 1.2221, test_f1: 0.6745
 epoch: 64, train_loss: 0.2626, test_loss: 1.2716, test_f1: 0.6568
 epoch: 65, train_loss: 0.2527, test_loss: 1.3025, test_f1: 0.6821
 epoch: 66, train_loss: 0.2583, test_loss: 1.1864, test_f1: 0.6809
 epoch: 67, train_loss: 0.2545, test_loss: 1.3202, test_f1: 0.6664
 epoch: 68, train_loss: 0.2376, test_loss: 1.3142, test_f1: 0.6630
 epoch: 69, train_loss: 0.2375, test_loss: 1.3775, test_f1: 0.6950
 epoch: 70, train_loss: 0.2495, test_loss: 1.4846, test_f1: 0.6445
 epoch: 71, train_loss: 0.2379, test_loss: 1.3513, test_f1: 0.6587
 epoch: 72, train_loss: 0.2392, test_loss: 1.4020, test_f1: 0.6505
 epoch: 73, train_loss: 0.2184, test_loss: 1.4171, test_f1: 0.6596
 epoch: 74, train_loss: 0.2138, test_loss: 1.5568, test_f1: 0.6662
 epoch: 75, train_loss: 0.2328, test_loss: 1.4382, test_f1: 0.6613
 epoch: 76, train_loss: 0.2169, test_loss: 1.5013, test_f1: 0.6300
 epoch: 77, train_loss: 0.2347, test_loss: 1.4645, test_f1: 0.6586
 epoch: 78, train_loss: 0.1966, test_loss: 1.5041, test_f1: 0.6446
 epoch: 79, train_loss: 0.2159, test_loss: 1.5476, test_f1: 0.6671
 epoch: 80, train_loss: 0.2133, test_loss: 1.5720, test_f1: 0.6477
 epoch: 81, train_loss: 0.2002, test_loss: 1.4750, test_f1: 0.6733
 epoch: 82, train_loss: 0.2134, test_loss: 1.6338, test_f1: 0.6557
 epoch: 83, train_loss: 0.2252, test_loss: 1.3943, test_f1: 0.6856
 epoch: 84, train_loss: 0.2029, test_loss: 1.5297, test_f1: 0.6749
 epoch: 85, train_loss: 0.1964, test_loss: 1.5411, test_f1: 0.6761
 epoch: 86, train_loss: 0.1964, test_loss: 1.5626, test_f1: 0.6397
 epoch: 87, train_loss: 0.1970, test_loss: 1.4837, test_f1: 0.6896
 epoch: 88, train_loss: 0.1848, test_loss: 1.5545, test_f1: 0.6783
 epoch: 89, train_loss: 0.1813, test_loss: 1.5876, test_f1: 0.6655
 epoch: 90, train_loss: 0.1975, test_loss: 1.6251, test_f1: 0.6629
 epoch: 91, train_loss: 0.1764, test_loss: 1.5745, test_f1: 0.6685
 epoch: 92, train_loss: 0.1788, test_loss: 1.5851, test_f1: 0.6600
 epoch: 93, train_loss: 0.1957, test_loss: 1.5103, test_f1: 0.6681
 epoch: 94, train_loss: 0.1557, test_loss: 1.5272, test_f1: 0.6756
 epoch: 95, train_loss: 0.1673, test_loss: 1.6132, test_f1: 0.6589
 epoch: 96, train_loss: 0.1790, test_loss: 1.6781, test_f1: 0.6577
 epoch: 97, train_loss: 0.1598, test_loss: 1.6066, test_f1: 0.6564
 epoch: 98, train_loss: 0.1738, test_loss: 1.7509, test_f1: 0.6516
 epoch: 99, train_loss: 0.1839, test_loss: 1.6196, test_f1: 0.6532
##################ITERATION #2 ****************************************
 epoch: 0, train_loss: 1.1161, test_loss: 0.9739, test_f1: 0.4987
 epoch: 1, train_loss: 0.9467, test_loss: 0.9375, test_f1: 0.5131
 epoch: 2, train_loss: 0.9077, test_loss: 0.8830, test_f1: 0.5314
 epoch: 3, train_loss: 0.8838, test_loss: 0.9163, test_f1: 0.5278
 epoch: 4, train_loss: 0.8625, test_loss: 0.8885, test_f1: 0.5275
 epoch: 5, train_loss: 0.8481, test_loss: 0.8020, test_f1: 0.5819
 epoch: 6, train_loss: 0.8132, test_loss: 0.7987, test_f1: 0.5886
 epoch: 7, train_loss: 0.7954, test_loss: 0.8021, test_f1: 0.5435
 epoch: 8, train_loss: 0.7761, test_loss: 0.8121, test_f1: 0.6217
 epoch: 9, train_loss: 0.7588, test_loss: 0.8380, test_f1: 0.6142
 epoch: 10, train_loss: 0.7472, test_loss: 0.7964, test_f1: 0.6136
 epoch: 11, train_loss: 0.7249, test_loss: 0.7899, test_f1: 0.5768
 epoch: 12, train_loss: 0.7059, test_loss: 0.8768, test_f1: 0.5835
 epoch: 13, train_loss: 0.6966, test_loss: 0.8974, test_f1: 0.5788
 epoch: 14, train_loss: 0.6973, test_loss: 0.8039, test_f1: 0.6236
 epoch: 15, train_loss: 0.6723, test_loss: 0.8828, test_f1: 0.6452
 epoch: 16, train_loss: 0.6577, test_loss: 0.8374, test_f1: 0.6138
 epoch: 17, train_loss: 0.6545, test_loss: 0.7995, test_f1: 0.6356
 epoch: 18, train_loss: 0.6626, test_loss: 0.8344, test_f1: 0.6425
 epoch: 19, train_loss: 0.6325, test_loss: 0.7896, test_f1: 0.6298
 epoch: 20, train_loss: 0.6078, test_loss: 0.7423, test_f1: 0.6370
 epoch: 21, train_loss: 0.6078, test_loss: 0.8464, test_f1: 0.6295
 epoch: 22, train_loss: 0.5974, test_loss: 0.8905, test_f1: 0.6060
 epoch: 23, train_loss: 0.5846, test_loss: 0.8212, test_f1: 0.6426
 epoch: 24, train_loss: 0.5564, test_loss: 0.8770, test_f1: 0.6328
 epoch: 25, train_loss: 0.5671, test_loss: 0.8006, test_f1: 0.6489
 epoch: 26, train_loss: 0.5408, test_loss: 0.8261, test_f1: 0.6555
 epoch: 27, train_loss: 0.5513, test_loss: 0.8087, test_f1: 0.6555
 epoch: 28, train_loss: 0.5502, test_loss: 0.8244, test_f1: 0.6713
 epoch: 29, train_loss: 0.5190, test_loss: 0.8897, test_f1: 0.6703
 epoch: 30, train_loss: 0.5420, test_loss: 0.7814, test_f1: 0.6706
 epoch: 31, train_loss: 0.5131, test_loss: 7.0948, test_f1: 0.5884
 epoch: 32, train_loss: 0.5071, test_loss: 0.9727, test_f1: 0.6632
 epoch: 33, train_loss: 0.5259, test_loss: 0.7817, test_f1: 0.6651
 epoch: 34, train_loss: 0.4807, test_loss: 0.8096, test_f1: 0.6551
 epoch: 35, train_loss: 0.4626, test_loss: 0.9650, test_f1: 0.6487
 epoch: 36, train_loss: 0.4892, test_loss: 0.9070, test_f1: 0.6554
 epoch: 37, train_loss: 0.4746, test_loss: 0.8671, test_f1: 0.6692
 epoch: 38, train_loss: 0.4613, test_loss: 0.7252, test_f1: 0.7160
 epoch: 39, train_loss: 0.4635, test_loss: 0.8373, test_f1: 0.6833
 epoch: 40, train_loss: 0.4487, test_loss: 0.7722, test_f1: 0.7029
 epoch: 41, train_loss: 0.4331, test_loss: 0.8378, test_f1: 0.6852
 epoch: 42, train_loss: 0.4483, test_loss: 0.8981, test_f1: 0.6741
 epoch: 43, train_loss: 0.4147, test_loss: 0.9356, test_f1: 0.6585
 epoch: 44, train_loss: 0.4106, test_loss: 0.8766, test_f1: 0.6708
 epoch: 45, train_loss: 0.4208, test_loss: 0.8647, test_f1: 0.6814
 epoch: 46, train_loss: 0.4070, test_loss: 0.8109, test_f1: 0.6749
 epoch: 47, train_loss: 0.4360, test_loss: 0.8557, test_f1: 0.6937
 epoch: 48, train_loss: 0.4112, test_loss: 0.8771, test_f1: 0.7002
 epoch: 49, train_loss: 0.3963, test_loss: 0.9418, test_f1: 0.6655
 epoch: 50, train_loss: 0.3750, test_loss: 0.8477, test_f1: 0.7129
 epoch: 51, train_loss: 0.3362, test_loss: 0.9244, test_f1: 0.7001
 epoch: 52, train_loss: 0.3075, test_loss: 0.9388, test_f1: 0.6870
 epoch: 53, train_loss: 0.3068, test_loss: 0.9732, test_f1: 0.7003
 epoch: 54, train_loss: 0.3003, test_loss: 1.0322, test_f1: 0.6552
 epoch: 55, train_loss: 0.2939, test_loss: 1.0720, test_f1: 0.6614
 epoch: 56, train_loss: 0.2810, test_loss: 1.0427, test_f1: 0.6725
 epoch: 57, train_loss: 0.2796, test_loss: 1.0306, test_f1: 0.6761
 epoch: 58, train_loss: 0.2842, test_loss: 1.0538, test_f1: 0.7039
 epoch: 59, train_loss: 0.2702, test_loss: 1.1485, test_f1: 0.6712
 epoch: 60, train_loss: 0.2734, test_loss: 1.1271, test_f1: 0.6919
 epoch: 61, train_loss: 0.2734, test_loss: 1.0836, test_f1: 0.6906
 epoch: 62, train_loss: 0.2613, test_loss: 1.0413, test_f1: 0.7011
 epoch: 63, train_loss: 0.2591, test_loss: 1.0528, test_f1: 0.6975
 epoch: 64, train_loss: 0.2579, test_loss: 1.1706, test_f1: 0.7112
 epoch: 65, train_loss: 0.2426, test_loss: 1.1912, test_f1: 0.7123
 epoch: 66, train_loss: 0.2532, test_loss: 1.2256, test_f1: 0.6908
 epoch: 67, train_loss: 0.2462, test_loss: 1.0757, test_f1: 0.6926
 epoch: 68, train_loss: 0.2352, test_loss: 1.2028, test_f1: 0.6735
 epoch: 69, train_loss: 0.2491, test_loss: 1.1161, test_f1: 0.7151
 epoch: 70, train_loss: 0.2436, test_loss: 1.3228, test_f1: 0.6833
 epoch: 71, train_loss: 0.2288, test_loss: 1.2731, test_f1: 0.6832
 epoch: 72, train_loss: 0.2357, test_loss: 1.1112, test_f1: 0.6684
 epoch: 73, train_loss: 0.2215, test_loss: 1.1691, test_f1: 0.6978
 epoch: 74, train_loss: 0.2555, test_loss: 1.1899, test_f1: 0.6839
 epoch: 75, train_loss: 0.2368, test_loss: 1.0886, test_f1: 0.7180
 epoch: 76, train_loss: 0.2270, test_loss: 1.1709, test_f1: 0.7035
 epoch: 77, train_loss: 0.2254, test_loss: 1.2116, test_f1: 0.7178
 epoch: 78, train_loss: 0.2165, test_loss: 1.2931, test_f1: 0.7037
 epoch: 79, train_loss: 0.2243, test_loss: 1.2052, test_f1: 0.7166
 epoch: 80, train_loss: 0.2011, test_loss: 1.2866, test_f1: 0.6979
 epoch: 81, train_loss: 0.2050, test_loss: 1.2385, test_f1: 0.6994
 epoch: 82, train_loss: 0.1984, test_loss: 1.2758, test_f1: 0.6904
 epoch: 83, train_loss: 0.2001, test_loss: 1.3322, test_f1: 0.7026
 epoch: 84, train_loss: 0.2006, test_loss: 1.2346, test_f1: 0.7044
 epoch: 85, train_loss: 0.1857, test_loss: 1.4087, test_f1: 0.6772
 epoch: 86, train_loss: 0.1912, test_loss: 1.3690, test_f1: 0.6930
 epoch: 87, train_loss: 0.1962, test_loss: 1.4798, test_f1: 0.6687
 epoch: 88, train_loss: 0.1765, test_loss: 1.4331, test_f1: 0.6834
 epoch: 89, train_loss: 0.1960, test_loss: 1.3333, test_f1: 0.6855
 epoch: 90, train_loss: 0.1753, test_loss: 1.3751, test_f1: 0.6883
 epoch: 91, train_loss: 0.2040, test_loss: 1.3820, test_f1: 0.6934
 epoch: 92, train_loss: 0.1892, test_loss: 1.3911, test_f1: 0.6883
 epoch: 93, train_loss: 0.1803, test_loss: 1.4174, test_f1: 0.6938
 epoch: 94, train_loss: 0.1662, test_loss: 1.4012, test_f1: 0.6916
 epoch: 95, train_loss: 0.1872, test_loss: 1.3914, test_f1: 0.7045
 epoch: 96, train_loss: 0.2039, test_loss: 1.3652, test_f1: 0.7063
 epoch: 97, train_loss: 0.1662, test_loss: 1.2947, test_f1: 0.6914
 epoch: 98, train_loss: 0.1706, test_loss: 1.3976, test_f1: 0.6839
 epoch: 99, train_loss: 0.1727, test_loss: 1.5903, test_f1: 0.6696
##################ITERATION #3 ****************************************
 epoch: 0, train_loss: 1.1447, test_loss: 1.0376, test_f1: 0.4770
 epoch: 1, train_loss: 0.9629, test_loss: 0.9488, test_f1: 0.4977
 epoch: 2, train_loss: 0.9223, test_loss: 0.8962, test_f1: 0.5285
 epoch: 3, train_loss: 0.8774, test_loss: 0.8666, test_f1: 0.5613
 epoch: 4, train_loss: 0.8498, test_loss: 0.8264, test_f1: 0.5423
 epoch: 5, train_loss: 0.8449, test_loss: 0.8746, test_f1: 0.5269
 epoch: 6, train_loss: 0.8104, test_loss: 0.8286, test_f1: 0.5497
 epoch: 7, train_loss: 0.8042, test_loss: 0.7935, test_f1: 0.5823
 epoch: 8, train_loss: 0.7736, test_loss: 0.8570, test_f1: 0.5395
 epoch: 9, train_loss: 0.7532, test_loss: 0.8370, test_f1: 0.5849
 epoch: 10, train_loss: 0.7507, test_loss: 0.8073, test_f1: 0.5998
 epoch: 11, train_loss: 0.7308, test_loss: 0.7605, test_f1: 0.5985
 epoch: 12, train_loss: 0.7235, test_loss: 0.7533, test_f1: 0.6354
 epoch: 13, train_loss: 0.7095, test_loss: 0.7308, test_f1: 0.6332
 epoch: 14, train_loss: 0.6995, test_loss: 0.7370, test_f1: 0.5883
 epoch: 15, train_loss: 0.6721, test_loss: 0.8996, test_f1: 0.5986
 epoch: 16, train_loss: 0.6661, test_loss: 0.6903, test_f1: 0.6520
 epoch: 17, train_loss: 0.6647, test_loss: 0.8199, test_f1: 0.6086
 epoch: 18, train_loss: 0.6614, test_loss: 0.7196, test_f1: 0.6161
 epoch: 19, train_loss: 0.6479, test_loss: 0.7597, test_f1: 0.6220
 epoch: 20, train_loss: 0.6189, test_loss: 0.8012, test_f1: 0.6220
 epoch: 21, train_loss: 0.5979, test_loss: 0.7555, test_f1: 0.6395
 epoch: 22, train_loss: 0.6089, test_loss: 0.7610, test_f1: 0.6576
 epoch: 23, train_loss: 0.5977, test_loss: 0.7554, test_f1: 0.6113
 epoch: 24, train_loss: 0.5951, test_loss: 0.7419, test_f1: 0.6504
 epoch: 25, train_loss: 0.5992, test_loss: 0.7542, test_f1: 0.6271
 epoch: 26, train_loss: 0.5745, test_loss: 0.8321, test_f1: 0.6273
 epoch: 27, train_loss: 0.5557, test_loss: 0.8162, test_f1: 0.6416
 epoch: 28, train_loss: 0.5425, test_loss: 0.7721, test_f1: 0.6715
 epoch: 29, train_loss: 0.5479, test_loss: 0.8790, test_f1: 0.6681
 epoch: 30, train_loss: 0.5232, test_loss: 0.8341, test_f1: 0.6706
 epoch: 31, train_loss: 0.5235, test_loss: 0.8602, test_f1: 0.6478
 epoch: 32, train_loss: 0.5138, test_loss: 0.8149, test_f1: 0.6785
 epoch: 33, train_loss: 0.5015, test_loss: 0.7927, test_f1: 0.6607
 epoch: 34, train_loss: 0.5176, test_loss: 0.8235, test_f1: 0.6771
 epoch: 35, train_loss: 0.4971, test_loss: 0.7784, test_f1: 0.6801
 epoch: 36, train_loss: 0.5072, test_loss: 0.7915, test_f1: 0.6645
 epoch: 37, train_loss: 0.4840, test_loss: 0.9265, test_f1: 0.6302
 epoch: 38, train_loss: 0.4689, test_loss: 0.8101, test_f1: 0.6730
 epoch: 39, train_loss: 0.4791, test_loss: 0.7732, test_f1: 0.6766
 epoch: 40, train_loss: 0.4544, test_loss: 0.9417, test_f1: 0.6668
 epoch: 41, train_loss: 0.4465, test_loss: 0.8273, test_f1: 0.6754
 epoch: 42, train_loss: 0.4300, test_loss: 0.9688, test_f1: 0.6400
 epoch: 43, train_loss: 0.4282, test_loss: 0.8842, test_f1: 0.6663
 epoch: 44, train_loss: 0.4299, test_loss: 0.8229, test_f1: 0.7001
 epoch: 45, train_loss: 0.4394, test_loss: 1.1815, test_f1: 0.6324
 epoch: 46, train_loss: 0.4364, test_loss: 0.8429, test_f1: 0.6780
 epoch: 47, train_loss: 0.4072, test_loss: 0.9116, test_f1: 0.6693
 epoch: 48, train_loss: 0.4246, test_loss: 0.8601, test_f1: 0.6884
 epoch: 49, train_loss: 0.4077, test_loss: 0.8562, test_f1: 0.6919
 epoch: 50, train_loss: 0.4038, test_loss: 0.8836, test_f1: 0.6711
 epoch: 51, train_loss: 0.3449, test_loss: 0.8714, test_f1: 0.7070
 epoch: 52, train_loss: 0.3406, test_loss: 0.8685, test_f1: 0.7293
 epoch: 53, train_loss: 0.3276, test_loss: 0.9277, test_f1: 0.6690
 epoch: 54, train_loss: 0.3006, test_loss: 0.9686, test_f1: 0.6723
 epoch: 55, train_loss: 0.3164, test_loss: 1.0726, test_f1: 0.6669
 epoch: 56, train_loss: 0.3065, test_loss: 0.9927, test_f1: 0.6587
 epoch: 57, train_loss: 0.2995, test_loss: 0.9693, test_f1: 0.6726
 epoch: 58, train_loss: 0.3038, test_loss: 1.0679, test_f1: 0.6429
 epoch: 59, train_loss: 0.3010, test_loss: 1.0213, test_f1: 0.6902
 epoch: 60, train_loss: 0.2835, test_loss: 1.0505, test_f1: 0.6696
 epoch: 61, train_loss: 0.2845, test_loss: 1.0472, test_f1: 0.6713
 epoch: 62, train_loss: 0.2764, test_loss: 0.9571, test_f1: 0.6938
 epoch: 63, train_loss: 0.2868, test_loss: 1.0976, test_f1: 0.6674
 epoch: 64, train_loss: 0.2679, test_loss: 1.0203, test_f1: 0.6838
 epoch: 65, train_loss: 0.2846, test_loss: 1.0096, test_f1: 0.6719
 epoch: 66, train_loss: 0.2795, test_loss: 1.0996, test_f1: 0.6859
 epoch: 67, train_loss: 0.2650, test_loss: 1.0798, test_f1: 0.6631
 epoch: 68, train_loss: 0.2658, test_loss: 0.9989, test_f1: 0.7035
 epoch: 69, train_loss: 0.2411, test_loss: 1.1044, test_f1: 0.6648
 epoch: 70, train_loss: 0.2654, test_loss: 0.9993, test_f1: 0.6608
 epoch: 71, train_loss: 0.2728, test_loss: 1.0263, test_f1: 0.6626
 epoch: 72, train_loss: 0.2543, test_loss: 1.0924, test_f1: 0.6970
 epoch: 73, train_loss: 0.2515, test_loss: 0.9695, test_f1: 0.7051
 epoch: 74, train_loss: 0.2435, test_loss: 1.1272, test_f1: 0.6464
 epoch: 75, train_loss: 0.2270, test_loss: 1.0927, test_f1: 0.6994
 epoch: 76, train_loss: 0.2267, test_loss: 1.2025, test_f1: 0.6728
 epoch: 77, train_loss: 0.2293, test_loss: 1.2441, test_f1: 0.6543
 epoch: 78, train_loss: 0.2392, test_loss: 1.2816, test_f1: 0.6571
 epoch: 79, train_loss: 0.2396, test_loss: 1.2321, test_f1: 0.6573
 epoch: 80, train_loss: 0.2275, test_loss: 1.3008, test_f1: 0.6857
 epoch: 81, train_loss: 0.2344, test_loss: 1.1760, test_f1: 0.6940
 epoch: 82, train_loss: 0.2117, test_loss: 1.2110, test_f1: 0.6777
 epoch: 83, train_loss: 0.2207, test_loss: 1.2071, test_f1: 0.6684
 epoch: 84, train_loss: 0.2446, test_loss: 1.1677, test_f1: 0.6562
 epoch: 85, train_loss: 0.2280, test_loss: 1.2523, test_f1: 0.6664
 epoch: 86, train_loss: 0.2147, test_loss: 1.2106, test_f1: 0.6576
 epoch: 87, train_loss: 0.2237, test_loss: 1.1356, test_f1: 0.7006
 epoch: 88, train_loss: 0.2318, test_loss: 1.2508, test_f1: 0.6789
 epoch: 89, train_loss: 0.2284, test_loss: 1.2219, test_f1: 0.6678
 epoch: 90, train_loss: 0.2042, test_loss: 1.2657, test_f1: 0.6949
 epoch: 91, train_loss: 0.2126, test_loss: 1.2638, test_f1: 0.6867
 epoch: 92, train_loss: 0.2311, test_loss: 1.2450, test_f1: 0.6825
 epoch: 93, train_loss: 0.2290, test_loss: 1.1939, test_f1: 0.6577
 epoch: 94, train_loss: 0.2048, test_loss: 1.1862, test_f1: 0.6778
 epoch: 95, train_loss: 0.1850, test_loss: 1.3197, test_f1: 0.6504
 epoch: 96, train_loss: 0.2192, test_loss: 1.2175, test_f1: 0.6893
 epoch: 97, train_loss: 0.2003, test_loss: 1.1845, test_f1: 0.7029
 epoch: 98, train_loss: 0.1966, test_loss: 1.2748, test_f1: 0.6569
 epoch: 99, train_loss: 0.1779, test_loss: 1.3241, test_f1: 0.6540
##################ITERATION #4 ****************************************
 epoch: 0, train_loss: 1.2043, test_loss: 1.0106, test_f1: 0.4842
 epoch: 1, train_loss: 0.9629, test_loss: 0.9157, test_f1: 0.5155
 epoch: 2, train_loss: 0.9258, test_loss: 0.9375, test_f1: 0.5194
 epoch: 3, train_loss: 0.8737, test_loss: 1.0272, test_f1: 0.4954
 epoch: 4, train_loss: 0.8722, test_loss: 0.8313, test_f1: 0.6242
 epoch: 5, train_loss: 0.8213, test_loss: 0.8685, test_f1: 0.5643
 epoch: 6, train_loss: 0.8137, test_loss: 0.8514, test_f1: 0.5746
 epoch: 7, train_loss: 0.7892, test_loss: 0.8175, test_f1: 0.5938
 epoch: 8, train_loss: 0.7673, test_loss: 0.8291, test_f1: 0.5508
 epoch: 9, train_loss: 0.7530, test_loss: 0.8531, test_f1: 0.5869
 epoch: 10, train_loss: 0.7324, test_loss: 0.8100, test_f1: 0.5844
 epoch: 11, train_loss: 0.7193, test_loss: 0.8358, test_f1: 0.6045
 epoch: 12, train_loss: 0.7131, test_loss: 0.9445, test_f1: 0.5720
 epoch: 13, train_loss: 0.6994, test_loss: 0.9315, test_f1: 0.5661
 epoch: 14, train_loss: 0.6858, test_loss: 0.7131, test_f1: 0.6596
 epoch: 15, train_loss: 0.6829, test_loss: 0.8233, test_f1: 0.6247
 epoch: 16, train_loss: 0.6675, test_loss: 0.7886, test_f1: 0.6243
 epoch: 17, train_loss: 0.6567, test_loss: 0.8348, test_f1: 0.6185
 epoch: 18, train_loss: 0.6398, test_loss: 0.8192, test_f1: 0.6036
 epoch: 19, train_loss: 0.6359, test_loss: 0.7403, test_f1: 0.6556
 epoch: 20, train_loss: 0.6279, test_loss: 0.7920, test_f1: 0.6552
 epoch: 21, train_loss: 0.6163, test_loss: 0.8905, test_f1: 0.6416
 epoch: 22, train_loss: 0.6028, test_loss: 0.7783, test_f1: 0.6486
 epoch: 23, train_loss: 0.5790, test_loss: 0.8337, test_f1: 0.6468
 epoch: 24, train_loss: 0.5974, test_loss: 0.8571, test_f1: 0.6015
 epoch: 25, train_loss: 0.5782, test_loss: 0.7175, test_f1: 0.6651
 epoch: 26, train_loss: 0.5448, test_loss: 0.7730, test_f1: 0.6467
 epoch: 27, train_loss: 0.5501, test_loss: 0.7934, test_f1: 0.6311
 epoch: 28, train_loss: 0.5384, test_loss: 0.9336, test_f1: 0.6358
 epoch: 29, train_loss: 0.5296, test_loss: 0.8257, test_f1: 0.6564
 epoch: 30, train_loss: 0.5406, test_loss: 0.8537, test_f1: 0.6476
 epoch: 31, train_loss: 0.5265, test_loss: 0.8065, test_f1: 0.6592
 epoch: 32, train_loss: 0.5029, test_loss: 0.7320, test_f1: 0.6582
 epoch: 33, train_loss: 0.4957, test_loss: 0.8294, test_f1: 0.6443
 epoch: 34, train_loss: 0.4835, test_loss: 0.8736, test_f1: 0.6240
 epoch: 35, train_loss: 0.4865, test_loss: 0.8184, test_f1: 0.6469
 epoch: 36, train_loss: 0.4905, test_loss: 0.8222, test_f1: 0.6688
 epoch: 37, train_loss: 0.4694, test_loss: 0.8805, test_f1: 0.6544
 epoch: 38, train_loss: 0.4575, test_loss: 0.8498, test_f1: 0.6512
 epoch: 39, train_loss: 0.4703, test_loss: 0.8478, test_f1: 0.6879
 epoch: 40, train_loss: 0.4568, test_loss: 0.8396, test_f1: 0.6495
 epoch: 41, train_loss: 0.4394, test_loss: 0.8500, test_f1: 0.6855
 epoch: 42, train_loss: 0.4236, test_loss: 0.8438, test_f1: 0.6841
 epoch: 43, train_loss: 0.4178, test_loss: 0.8693, test_f1: 0.6831
 epoch: 44, train_loss: 0.4233, test_loss: 0.8337, test_f1: 0.6866
 epoch: 45, train_loss: 0.4037, test_loss: 0.9556, test_f1: 0.6428
 epoch: 46, train_loss: 0.3952, test_loss: 0.9626, test_f1: 0.6525
 epoch: 47, train_loss: 0.4147, test_loss: 0.9615, test_f1: 0.6884
 epoch: 48, train_loss: 0.3836, test_loss: 0.9052, test_f1: 0.7054
 epoch: 49, train_loss: 0.3959, test_loss: 1.0085, test_f1: 0.6664
 epoch: 50, train_loss: 0.3713, test_loss: 1.0226, test_f1: 0.6574
 epoch: 51, train_loss: 0.3260, test_loss: 0.9811, test_f1: 0.6759
 epoch: 52, train_loss: 0.3189, test_loss: 0.9199, test_f1: 0.7018
 epoch: 53, train_loss: 0.3071, test_loss: 1.0331, test_f1: 0.6675
 epoch: 54, train_loss: 0.2816, test_loss: 1.0332, test_f1: 0.6696
 epoch: 55, train_loss: 0.2882, test_loss: 0.9793, test_f1: 0.6917
 epoch: 56, train_loss: 0.2885, test_loss: 1.1006, test_f1: 0.6600
 epoch: 57, train_loss: 0.2612, test_loss: 1.1769, test_f1: 0.6583
 epoch: 58, train_loss: 0.2811, test_loss: 1.0463, test_f1: 0.7022
 epoch: 59, train_loss: 0.2762, test_loss: 1.1153, test_f1: 0.6906
 epoch: 60, train_loss: 0.2593, test_loss: 1.1537, test_f1: 0.6816
 epoch: 61, train_loss: 0.2605, test_loss: 1.1516, test_f1: 0.6954
 epoch: 62, train_loss: 0.2403, test_loss: 1.1562, test_f1: 0.6918
 epoch: 63, train_loss: 0.2466, test_loss: 1.0903, test_f1: 0.6816
 epoch: 64, train_loss: 0.2468, test_loss: 1.0765, test_f1: 0.6995
 epoch: 65, train_loss: 0.2415, test_loss: 1.0848, test_f1: 0.7026
 epoch: 66, train_loss: 0.2393, test_loss: 1.0417, test_f1: 0.6910
 epoch: 67, train_loss: 0.2319, test_loss: 1.2675, test_f1: 0.6960
 epoch: 68, train_loss: 0.2155, test_loss: 1.1521, test_f1: 0.7137
 epoch: 69, train_loss: 0.2370, test_loss: 1.3168, test_f1: 0.6539
 epoch: 70, train_loss: 0.2306, test_loss: 1.2317, test_f1: 0.6912
 epoch: 71, train_loss: 0.2276, test_loss: 1.2736, test_f1: 0.7020
 epoch: 72, train_loss: 0.2156, test_loss: 1.3064, test_f1: 0.6501
 epoch: 73, train_loss: 0.2263, test_loss: 1.2440, test_f1: 0.6828
 epoch: 74, train_loss: 0.2154, test_loss: 1.3605, test_f1: 0.6731
 epoch: 75, train_loss: 0.1998, test_loss: 1.2814, test_f1: 0.6930
 epoch: 76, train_loss: 0.2198, test_loss: 1.3421, test_f1: 0.6888
 epoch: 77, train_loss: 0.2079, test_loss: 1.4598, test_f1: 0.6778
 epoch: 78, train_loss: 0.1973, test_loss: 1.5234, test_f1: 0.6832
 epoch: 79, train_loss: 0.1852, test_loss: 1.5420, test_f1: 0.6860
 epoch: 80, train_loss: 0.1899, test_loss: 1.3706, test_f1: 0.6963
 epoch: 81, train_loss: 0.2050, test_loss: 1.5416, test_f1: 0.6695
 epoch: 82, train_loss: 0.2049, test_loss: 1.4007, test_f1: 0.6869
 epoch: 83, train_loss: 0.1872, test_loss: 1.5023, test_f1: 0.6721
 epoch: 84, train_loss: 0.2000, test_loss: 1.3556, test_f1: 0.6675
 epoch: 85, train_loss: 0.1901, test_loss: 1.5421, test_f1: 0.6476
 epoch: 86, train_loss: 0.1842, test_loss: 1.4522, test_f1: 0.7033
 epoch: 87, train_loss: 0.1774, test_loss: 1.5290, test_f1: 0.6826
 epoch: 88, train_loss: 0.2076, test_loss: 1.4078, test_f1: 0.6673
 epoch: 89, train_loss: 0.1942, test_loss: 1.3222, test_f1: 0.6757
 epoch: 90, train_loss: 0.1584, test_loss: 1.4268, test_f1: 0.6770
 epoch: 91, train_loss: 0.1484, test_loss: 1.4352, test_f1: 0.6827
 epoch: 92, train_loss: 0.1700, test_loss: 1.4219, test_f1: 0.6958
 epoch: 93, train_loss: 0.1847, test_loss: 1.4719, test_f1: 0.6795
 epoch: 94, train_loss: 0.1604, test_loss: 1.6165, test_f1: 0.6752
 epoch: 95, train_loss: 0.1653, test_loss: 1.4639, test_f1: 0.6887
 epoch: 96, train_loss: 0.1578, test_loss: 1.6643, test_f1: 0.6717
 epoch: 97, train_loss: 0.1763, test_loss: 1.4264, test_f1: 0.6971
 epoch: 98, train_loss: 0.1695, test_loss: 1.6369, test_f1: 0.6696
 epoch: 99, train_loss: 0.1544, test_loss: 1.5447, test_f1: 0.6766
##################ITERATION #5 ****************************************
 epoch: 0, train_loss: 1.2220, test_loss: 1.0323, test_f1: 0.5277
 epoch: 1, train_loss: 0.9743, test_loss: 0.9966, test_f1: 0.5049
 epoch: 2, train_loss: 0.9187, test_loss: 1.0174, test_f1: 0.4881
 epoch: 3, train_loss: 0.9002, test_loss: 0.9296, test_f1: 0.5515
 epoch: 4, train_loss: 0.8754, test_loss: 0.8546, test_f1: 0.5615
 epoch: 5, train_loss: 0.8360, test_loss: 0.8923, test_f1: 0.5892
 epoch: 6, train_loss: 0.8178, test_loss: 0.8780, test_f1: 0.5622
 epoch: 7, train_loss: 0.8010, test_loss: 0.8670, test_f1: 0.5708
 epoch: 8, train_loss: 0.7772, test_loss: 0.9093, test_f1: 0.5790
 epoch: 9, train_loss: 0.7539, test_loss: 0.9951, test_f1: 0.5238
 epoch: 10, train_loss: 0.7683, test_loss: 0.9553, test_f1: 0.5466
 epoch: 11, train_loss: 0.7297, test_loss: 0.7773, test_f1: 0.6327
 epoch: 12, train_loss: 0.7308, test_loss: 0.8596, test_f1: 0.6060
 epoch: 13, train_loss: 0.7152, test_loss: 0.9890, test_f1: 0.5531
 epoch: 14, train_loss: 0.7189, test_loss: 0.8348, test_f1: 0.5978
 epoch: 15, train_loss: 0.7086, test_loss: 0.9043, test_f1: 0.5807
 epoch: 16, train_loss: 0.6785, test_loss: 0.8379, test_f1: 0.6120
 epoch: 17, train_loss: 0.6746, test_loss: 0.8902, test_f1: 0.6347
 epoch: 18, train_loss: 0.6641, test_loss: 0.8466, test_f1: 0.6295
 epoch: 19, train_loss: 0.6570, test_loss: 0.8520, test_f1: 0.6470
 epoch: 20, train_loss: 0.6410, test_loss: 0.8598, test_f1: 0.6564
 epoch: 21, train_loss: 0.6215, test_loss: 0.7693, test_f1: 0.6518
 epoch: 22, train_loss: 0.6273, test_loss: 0.7867, test_f1: 0.6268
 epoch: 23, train_loss: 0.6041, test_loss: 0.8551, test_f1: 0.6503
 epoch: 24, train_loss: 0.5889, test_loss: 0.9263, test_f1: 0.6252
 epoch: 25, train_loss: 0.5769, test_loss: 0.8733, test_f1: 0.6616
 epoch: 26, train_loss: 0.6027, test_loss: 0.8993, test_f1: 0.6163
 epoch: 27, train_loss: 0.5963, test_loss: 0.7707, test_f1: 0.6420
 epoch: 28, train_loss: 0.5646, test_loss: 0.8459, test_f1: 0.6638
 epoch: 29, train_loss: 0.5727, test_loss: 0.8530, test_f1: 0.6436
 epoch: 30, train_loss: 0.5248, test_loss: 1.0024, test_f1: 0.6431
 epoch: 31, train_loss: 0.5226, test_loss: 0.9299, test_f1: 0.6647
 epoch: 32, train_loss: 0.5220, test_loss: 1.0010, test_f1: 0.6279
 epoch: 33, train_loss: 0.5228, test_loss: 0.9459, test_f1: 0.6764
 epoch: 34, train_loss: 0.4997, test_loss: 0.8922, test_f1: 0.6874
 epoch: 35, train_loss: 0.4845, test_loss: 0.9545, test_f1: 0.6832
 epoch: 36, train_loss: 0.5103, test_loss: 0.8148, test_f1: 0.6927
 epoch: 37, train_loss: 0.4942, test_loss: 0.9289, test_f1: 0.6707
 epoch: 38, train_loss: 0.4788, test_loss: 1.0283, test_f1: 0.6497
 epoch: 39, train_loss: 0.4715, test_loss: 0.9873, test_f1: 0.6441
 epoch: 40, train_loss: 0.4585, test_loss: 1.0074, test_f1: 0.6144
 epoch: 41, train_loss: 0.4498, test_loss: 1.0395, test_f1: 0.6449
 epoch: 42, train_loss: 0.4747, test_loss: 0.9530, test_f1: 0.6757
 epoch: 43, train_loss: 0.4431, test_loss: 0.9504, test_f1: 0.6642
 epoch: 44, train_loss: 0.4245, test_loss: 0.9870, test_f1: 0.6668
 epoch: 45, train_loss: 0.4324, test_loss: 0.9880, test_f1: 0.6794
 epoch: 46, train_loss: 0.4174, test_loss: 1.0836, test_f1: 0.6694
 epoch: 47, train_loss: 0.4037, test_loss: 1.0722, test_f1: 0.7088
 epoch: 48, train_loss: 0.4064, test_loss: 1.0459, test_f1: 0.6824
 epoch: 49, train_loss: 0.4065, test_loss: 1.1270, test_f1: 0.6938
 epoch: 50, train_loss: 0.3983, test_loss: 1.0955, test_f1: 0.6935
 epoch: 51, train_loss: 0.3588, test_loss: 1.2309, test_f1: 0.6673
 epoch: 52, train_loss: 0.3311, test_loss: 1.1552, test_f1: 0.6781
 epoch: 53, train_loss: 0.3219, test_loss: 1.1445, test_f1: 0.6860
 epoch: 54, train_loss: 0.3144, test_loss: 1.1503, test_f1: 0.6745
 epoch: 55, train_loss: 0.3043, test_loss: 1.1777, test_f1: 0.6853
 epoch: 56, train_loss: 0.3105, test_loss: 1.2808, test_f1: 0.6837
 epoch: 57, train_loss: 0.3137, test_loss: 1.2005, test_f1: 0.7060
 epoch: 58, train_loss: 0.2818, test_loss: 1.3816, test_f1: 0.6858
 epoch: 59, train_loss: 0.2842, test_loss: 1.2255, test_f1: 0.6931
 epoch: 60, train_loss: 0.2734, test_loss: 1.3087, test_f1: 0.6758
 epoch: 61, train_loss: 0.2972, test_loss: 1.2981, test_f1: 0.6961
 epoch: 62, train_loss: 0.2652, test_loss: 1.2645, test_f1: 0.7079
 epoch: 63, train_loss: 0.2784, test_loss: 1.2611, test_f1: 0.6634
 epoch: 64, train_loss: 0.2646, test_loss: 1.3341, test_f1: 0.6524
 epoch: 65, train_loss: 0.2608, test_loss: 1.3076, test_f1: 0.6829
 epoch: 66, train_loss: 0.2409, test_loss: 1.3635, test_f1: 0.6969
 epoch: 67, train_loss: 0.2581, test_loss: 1.3196, test_f1: 0.7042
 epoch: 68, train_loss: 0.2466, test_loss: 1.2114, test_f1: 0.6942
 epoch: 69, train_loss: 0.2558, test_loss: 1.3331, test_f1: 0.6902
 epoch: 70, train_loss: 0.2539, test_loss: 1.3553, test_f1: 0.6943
 epoch: 71, train_loss: 0.2410, test_loss: 1.4599, test_f1: 0.6854
 epoch: 72, train_loss: 0.2319, test_loss: 1.3105, test_f1: 0.6983
 epoch: 73, train_loss: 0.2335, test_loss: 1.3373, test_f1: 0.6880
 epoch: 74, train_loss: 0.2267, test_loss: 1.4014, test_f1: 0.6972
 epoch: 75, train_loss: 0.2191, test_loss: 1.4854, test_f1: 0.6930
 epoch: 76, train_loss: 0.2279, test_loss: 1.3331, test_f1: 0.7005
 epoch: 77, train_loss: 0.2090, test_loss: 1.4069, test_f1: 0.6850
 epoch: 78, train_loss: 0.2197, test_loss: 1.4981, test_f1: 0.6903
 epoch: 79, train_loss: 0.2143, test_loss: 1.5095, test_f1: 0.6731
 epoch: 80, train_loss: 0.2089, test_loss: 1.4742, test_f1: 0.6771
 epoch: 81, train_loss: 0.2130, test_loss: 1.4741, test_f1: 0.6854
 epoch: 82, train_loss: 0.2102, test_loss: 1.5734, test_f1: 0.6914
 epoch: 83, train_loss: 0.2118, test_loss: 1.5916, test_f1: 0.6982
 epoch: 84, train_loss: 0.2167, test_loss: 1.5399, test_f1: 0.6511
 epoch: 85, train_loss: 0.2581, test_loss: 1.4711, test_f1: 0.6920
 epoch: 86, train_loss: 0.2104, test_loss: 1.4458, test_f1: 0.6940
 epoch: 87, train_loss: 0.2093, test_loss: 1.5917, test_f1: 0.6853
 epoch: 88, train_loss: 0.2052, test_loss: 1.5987, test_f1: 0.6737
 epoch: 89, train_loss: 0.1871, test_loss: 1.5138, test_f1: 0.6648
 epoch: 90, train_loss: 0.2197, test_loss: 1.6920, test_f1: 0.6786
 epoch: 91, train_loss: 0.1875, test_loss: 1.4694, test_f1: 0.6821
 epoch: 92, train_loss: 0.2021, test_loss: 1.5727, test_f1: 0.7104
 epoch: 93, train_loss: 0.1901, test_loss: 1.5779, test_f1: 0.6920
 epoch: 94, train_loss: 0.1676, test_loss: 1.6847, test_f1: 0.6787
 epoch: 95, train_loss: 0.1868, test_loss: 1.4729, test_f1: 0.7031
 epoch: 96, train_loss: 0.2015, test_loss: 1.7059, test_f1: 0.6938
 epoch: 97, train_loss: 0.1868, test_loss: 1.4878, test_f1: 0.6978
 epoch: 98, train_loss: 0.1726, test_loss: 1.5756, test_f1: 0.6796
 epoch: 99, train_loss: 0.1614, test_loss: 1.7355, test_f1: 0.6746
##################ITERATION #6 ****************************************
 epoch: 0, train_loss: 1.1754, test_loss: 1.0724, test_f1: 0.4484
 epoch: 1, train_loss: 0.9607, test_loss: 0.9343, test_f1: 0.5236
 epoch: 2, train_loss: 0.9359, test_loss: 0.9524, test_f1: 0.4708
 epoch: 3, train_loss: 0.9072, test_loss: 0.8715, test_f1: 0.5292
 epoch: 4, train_loss: 0.8962, test_loss: 0.9606, test_f1: 0.4939
 epoch: 5, train_loss: 0.8471, test_loss: 0.9499, test_f1: 0.4705
 epoch: 6, train_loss: 0.8354, test_loss: 0.8793, test_f1: 0.6003
 epoch: 7, train_loss: 0.8378, test_loss: 0.8889, test_f1: 0.5917
 epoch: 8, train_loss: 0.8185, test_loss: 0.8451, test_f1: 0.5798
 epoch: 9, train_loss: 0.7955, test_loss: 0.9507, test_f1: 0.5684
 epoch: 10, train_loss: 0.7867, test_loss: 0.7928, test_f1: 0.5899
 epoch: 11, train_loss: 0.7606, test_loss: 0.8358, test_f1: 0.5752
 epoch: 12, train_loss: 0.7484, test_loss: 0.8592, test_f1: 0.5879
 epoch: 13, train_loss: 0.7320, test_loss: 0.8389, test_f1: 0.5878
 epoch: 14, train_loss: 0.7329, test_loss: 0.7700, test_f1: 0.6276
 epoch: 15, train_loss: 0.7006, test_loss: 0.8996, test_f1: 0.6125
 epoch: 16, train_loss: 0.6843, test_loss: 0.9290, test_f1: 0.6120
 epoch: 17, train_loss: 0.6645, test_loss: 0.8331, test_f1: 0.6284
 epoch: 18, train_loss: 0.6734, test_loss: 0.8382, test_f1: 0.6360
 epoch: 19, train_loss: 0.6510, test_loss: 0.8236, test_f1: 0.6180
 epoch: 20, train_loss: 0.6498, test_loss: 0.8002, test_f1: 0.6517
 epoch: 21, train_loss: 0.6363, test_loss: 0.8929, test_f1: 0.6232
 epoch: 22, train_loss: 0.6172, test_loss: 0.9034, test_f1: 0.6185
 epoch: 23, train_loss: 0.6238, test_loss: 0.9694, test_f1: 0.6051
 epoch: 24, train_loss: 0.6187, test_loss: 0.7987, test_f1: 0.6625
 epoch: 25, train_loss: 0.5855, test_loss: 0.8398, test_f1: 0.6184
 epoch: 26, train_loss: 0.5962, test_loss: 0.8374, test_f1: 0.6299
 epoch: 27, train_loss: 0.5697, test_loss: 0.8997, test_f1: 0.6384
 epoch: 28, train_loss: 0.5604, test_loss: 0.9195, test_f1: 0.6452
 epoch: 29, train_loss: 0.5787, test_loss: 0.7712, test_f1: 0.6359
 epoch: 30, train_loss: 0.5739, test_loss: 0.9044, test_f1: 0.6659
 epoch: 31, train_loss: 0.5463, test_loss: 0.8589, test_f1: 0.6787
 epoch: 32, train_loss: 0.5368, test_loss: 0.8570, test_f1: 0.6562
 epoch: 33, train_loss: 0.5157, test_loss: 0.9278, test_f1: 0.6434
 epoch: 34, train_loss: 0.5133, test_loss: 0.9644, test_f1: 0.6457
 epoch: 35, train_loss: 0.5063, test_loss: 0.9128, test_f1: 0.6870
 epoch: 36, train_loss: 0.5026, test_loss: 0.9456, test_f1: 0.6454
 epoch: 37, train_loss: 0.4847, test_loss: 0.9659, test_f1: 0.6580
 epoch: 38, train_loss: 0.4752, test_loss: 0.9075, test_f1: 0.6551
 epoch: 39, train_loss: 0.4845, test_loss: 0.9439, test_f1: 0.6679
 epoch: 40, train_loss: 0.4667, test_loss: 0.8206, test_f1: 0.7014
 epoch: 41, train_loss: 0.4318, test_loss: 0.8565, test_f1: 0.6668
 epoch: 42, train_loss: 0.4392, test_loss: 0.9224, test_f1: 0.6907
 epoch: 43, train_loss: 0.4917, test_loss: 0.9399, test_f1: 0.6724
 epoch: 44, train_loss: 0.4516, test_loss: 1.0038, test_f1: 0.6480
 epoch: 45, train_loss: 0.4375, test_loss: 0.9031, test_f1: 0.6588
 epoch: 46, train_loss: 0.4267, test_loss: 0.8630, test_f1: 0.6619
 epoch: 47, train_loss: 0.4076, test_loss: 0.8872, test_f1: 0.6694
 epoch: 48, train_loss: 0.4148, test_loss: 1.0364, test_f1: 0.6741
 epoch: 49, train_loss: 0.4140, test_loss: 1.0413, test_f1: 0.6518
 epoch: 50, train_loss: 0.4042, test_loss: 0.9703, test_f1: 0.6750
 epoch: 51, train_loss: 0.3539, test_loss: 0.9329, test_f1: 0.6712
 epoch: 52, train_loss: 0.3303, test_loss: 1.0158, test_f1: 0.6569
 epoch: 53, train_loss: 0.3178, test_loss: 0.9659, test_f1: 0.6774
 epoch: 54, train_loss: 0.3167, test_loss: 1.0833, test_f1: 0.6789
 epoch: 55, train_loss: 0.3014, test_loss: 1.0949, test_f1: 0.6960
 epoch: 56, train_loss: 0.2912, test_loss: 1.1549, test_f1: 0.6408
 epoch: 57, train_loss: 0.2947, test_loss: 1.0928, test_f1: 0.6900
 epoch: 58, train_loss: 0.2784, test_loss: 1.2628, test_f1: 0.6705
 epoch: 59, train_loss: 0.2810, test_loss: 1.1869, test_f1: 0.6579
 epoch: 60, train_loss: 0.3100, test_loss: 1.0927, test_f1: 0.6957
 epoch: 61, train_loss: 0.2842, test_loss: 1.2491, test_f1: 0.6798
 epoch: 62, train_loss: 0.2765, test_loss: 1.2570, test_f1: 0.6773
 epoch: 63, train_loss: 0.2765, test_loss: 1.1885, test_f1: 0.6883
 epoch: 64, train_loss: 0.2670, test_loss: 1.1553, test_f1: 0.6744
 epoch: 65, train_loss: 0.2668, test_loss: 1.1617, test_f1: 0.6661
 epoch: 66, train_loss: 0.2542, test_loss: 1.2301, test_f1: 0.6730
 epoch: 67, train_loss: 0.2527, test_loss: 1.1755, test_f1: 0.6751
 epoch: 68, train_loss: 0.2605, test_loss: 1.3562, test_f1: 0.6752
 epoch: 69, train_loss: 0.2447, test_loss: 1.1473, test_f1: 0.6688
 epoch: 70, train_loss: 0.2305, test_loss: 1.2690, test_f1: 0.6878
 epoch: 71, train_loss: 0.2501, test_loss: 1.4175, test_f1: 0.6290
 epoch: 72, train_loss: 0.2545, test_loss: 1.2275, test_f1: 0.6877
 epoch: 73, train_loss: 0.2565, test_loss: 1.3699, test_f1: 0.6857
 epoch: 74, train_loss: 0.2510, test_loss: 1.2314, test_f1: 0.6804
 epoch: 75, train_loss: 0.2368, test_loss: 1.1914, test_f1: 0.6661
 epoch: 76, train_loss: 0.2445, test_loss: 1.2275, test_f1: 0.6770
 epoch: 77, train_loss: 0.2539, test_loss: 1.2739, test_f1: 0.6859
 epoch: 78, train_loss: 0.2274, test_loss: 1.1945, test_f1: 0.7158
 epoch: 79, train_loss: 0.2209, test_loss: 1.3794, test_f1: 0.6818
 epoch: 80, train_loss: 0.2139, test_loss: 1.1715, test_f1: 0.6643
 epoch: 81, train_loss: 0.2172, test_loss: 1.2627, test_f1: 0.6956
 epoch: 82, train_loss: 0.2204, test_loss: 1.5171, test_f1: 0.6928
 epoch: 83, train_loss: 0.2274, test_loss: 1.2904, test_f1: 0.6972
 epoch: 84, train_loss: 0.2144, test_loss: 1.4336, test_f1: 0.7053
 epoch: 85, train_loss: 0.2102, test_loss: 1.4649, test_f1: 0.6752
 epoch: 86, train_loss: 0.2217, test_loss: 1.4624, test_f1: 0.6777
 epoch: 87, train_loss: 0.1987, test_loss: 1.4946, test_f1: 0.6610
 epoch: 88, train_loss: 0.1943, test_loss: 1.3360, test_f1: 0.6787
 epoch: 89, train_loss: 0.2215, test_loss: 1.3032, test_f1: 0.6801
 epoch: 90, train_loss: 0.1947, test_loss: 1.4024, test_f1: 0.6496
 epoch: 91, train_loss: 0.1912, test_loss: 1.4650, test_f1: 0.7055
 epoch: 92, train_loss: 0.1904, test_loss: 1.3284, test_f1: 0.6518
 epoch: 93, train_loss: 0.1967, test_loss: 1.3296, test_f1: 0.6748
 epoch: 94, train_loss: 0.1969, test_loss: 1.4075, test_f1: 0.6936
 epoch: 95, train_loss: 0.1873, test_loss: 1.2576, test_f1: 0.6916
 epoch: 96, train_loss: 0.1969, test_loss: 1.3816, test_f1: 0.6736
 epoch: 97, train_loss: 0.1884, test_loss: 1.4774, test_f1: 0.6711
 epoch: 98, train_loss: 0.1895, test_loss: 1.5970, test_f1: 0.6338
 epoch: 99, train_loss: 0.1981, test_loss: 1.3622, test_f1: 0.6681
##################ITERATION #7 ****************************************
 epoch: 0, train_loss: 1.1836, test_loss: 0.9476, test_f1: 0.4759
 epoch: 1, train_loss: 0.9673, test_loss: 0.9202, test_f1: 0.5071
 epoch: 2, train_loss: 0.9035, test_loss: 0.9348, test_f1: 0.5077
 epoch: 3, train_loss: 0.8827, test_loss: 0.9084, test_f1: 0.5504
 epoch: 4, train_loss: 0.8549, test_loss: 0.8785, test_f1: 0.5595
 epoch: 5, train_loss: 0.8398, test_loss: 0.9102, test_f1: 0.5287
 epoch: 6, train_loss: 0.8157, test_loss: 0.8597, test_f1: 0.6055
 epoch: 7, train_loss: 0.7761, test_loss: 0.8143, test_f1: 0.5678
 epoch: 8, train_loss: 0.7833, test_loss: 0.7953, test_f1: 0.5734
 epoch: 9, train_loss: 0.7520, test_loss: 0.9278, test_f1: 0.5675
 epoch: 10, train_loss: 0.7456, test_loss: 0.8391, test_f1: 0.5837
 epoch: 11, train_loss: 0.7313, test_loss: 0.8009, test_f1: 0.6058
 epoch: 12, train_loss: 0.7058, test_loss: 0.8322, test_f1: 0.5874
 epoch: 13, train_loss: 0.6894, test_loss: 0.8857, test_f1: 0.5718
 epoch: 14, train_loss: 0.6745, test_loss: 0.8726, test_f1: 0.5846
 epoch: 15, train_loss: 0.6651, test_loss: 0.8266, test_f1: 0.6164
 epoch: 16, train_loss: 0.6435, test_loss: 0.8113, test_f1: 0.6270
 epoch: 17, train_loss: 0.6560, test_loss: 0.8123, test_f1: 0.6190
 epoch: 18, train_loss: 0.6394, test_loss: 0.8759, test_f1: 0.6211
 epoch: 19, train_loss: 0.6202, test_loss: 0.8434, test_f1: 0.6375
 epoch: 20, train_loss: 0.6224, test_loss: 0.7924, test_f1: 0.6423
 epoch: 21, train_loss: 0.6243, test_loss: 0.8294, test_f1: 0.6524
 epoch: 22, train_loss: 0.5826, test_loss: 0.8796, test_f1: 0.6348
 epoch: 23, train_loss: 0.5639, test_loss: 0.8258, test_f1: 0.6256
 epoch: 24, train_loss: 0.5629, test_loss: 0.8393, test_f1: 0.6855
 epoch: 25, train_loss: 0.5527, test_loss: 0.8667, test_f1: 0.6183
 epoch: 26, train_loss: 0.5677, test_loss: 0.7708, test_f1: 0.6736
 epoch: 27, train_loss: 0.5129, test_loss: 0.8680, test_f1: 0.6326
 epoch: 28, train_loss: 0.5087, test_loss: 0.8987, test_f1: 0.6576
 epoch: 29, train_loss: 0.5223, test_loss: 0.9014, test_f1: 0.6751
 epoch: 30, train_loss: 0.5240, test_loss: 0.8729, test_f1: 0.6933
 epoch: 31, train_loss: 0.4856, test_loss: 0.9050, test_f1: 0.6584
 epoch: 32, train_loss: 0.5144, test_loss: 0.9575, test_f1: 0.6788
 epoch: 33, train_loss: 0.4784, test_loss: 0.9970, test_f1: 0.6406
 epoch: 34, train_loss: 0.4768, test_loss: 0.8216, test_f1: 0.6609
 epoch: 35, train_loss: 0.4491, test_loss: 0.9330, test_f1: 0.6661
 epoch: 36, train_loss: 0.4389, test_loss: 1.0086, test_f1: 0.6293
 epoch: 37, train_loss: 0.4573, test_loss: 1.0124, test_f1: 0.6582
 epoch: 38, train_loss: 0.4730, test_loss: 0.9478, test_f1: 0.6648
 epoch: 39, train_loss: 0.4214, test_loss: 0.9679, test_f1: 0.6688
 epoch: 40, train_loss: 0.4220, test_loss: 1.0526, test_f1: 0.6361
 epoch: 41, train_loss: 0.4227, test_loss: 0.9730, test_f1: 0.6612
 epoch: 42, train_loss: 0.4077, test_loss: 0.9561, test_f1: 0.6528
 epoch: 43, train_loss: 0.4100, test_loss: 0.9595, test_f1: 0.6414
 epoch: 44, train_loss: 0.4205, test_loss: 0.9998, test_f1: 0.6756
 epoch: 45, train_loss: 0.4010, test_loss: 0.9354, test_f1: 0.6612
 epoch: 46, train_loss: 0.3887, test_loss: 0.9755, test_f1: 0.6808
 epoch: 47, train_loss: 0.3870, test_loss: 1.0083, test_f1: 0.6949
 epoch: 48, train_loss: 0.3671, test_loss: 1.0355, test_f1: 0.6868
 epoch: 49, train_loss: 0.3782, test_loss: 0.9360, test_f1: 0.6539
 epoch: 50, train_loss: 0.3628, test_loss: 0.9441, test_f1: 0.6925
 epoch: 51, train_loss: 0.3167, test_loss: 1.0248, test_f1: 0.6912
 epoch: 52, train_loss: 0.2926, test_loss: 1.0125, test_f1: 0.6826
 epoch: 53, train_loss: 0.2814, test_loss: 1.0804, test_f1: 0.6931
 epoch: 54, train_loss: 0.3043, test_loss: 1.0364, test_f1: 0.6908
 epoch: 55, train_loss: 0.2688, test_loss: 1.1038, test_f1: 0.6841
 epoch: 56, train_loss: 0.2755, test_loss: 1.0090, test_f1: 0.6915
 epoch: 57, train_loss: 0.2634, test_loss: 1.1677, test_f1: 0.6741
 epoch: 58, train_loss: 0.2449, test_loss: 1.1587, test_f1: 0.6718
 epoch: 59, train_loss: 0.2537, test_loss: 1.1953, test_f1: 0.6796
 epoch: 60, train_loss: 0.2443, test_loss: 1.2018, test_f1: 0.6788
 epoch: 61, train_loss: 0.2533, test_loss: 1.1699, test_f1: 0.6688
 epoch: 62, train_loss: 0.2484, test_loss: 1.2667, test_f1: 0.6815
 epoch: 63, train_loss: 0.2500, test_loss: 1.2136, test_f1: 0.6822
 epoch: 64, train_loss: 0.2350, test_loss: 1.1856, test_f1: 0.6916
 epoch: 65, train_loss: 0.2300, test_loss: 1.2838, test_f1: 0.6867
 epoch: 66, train_loss: 0.2320, test_loss: 1.3430, test_f1: 0.6597
 epoch: 67, train_loss: 0.2332, test_loss: 1.2344, test_f1: 0.6832
 epoch: 68, train_loss: 0.2621, test_loss: 1.3203, test_f1: 0.6528
 epoch: 69, train_loss: 0.2315, test_loss: 1.2640, test_f1: 0.6841
 epoch: 70, train_loss: 0.2113, test_loss: 1.3259, test_f1: 0.6726
 epoch: 71, train_loss: 0.2102, test_loss: 1.3631, test_f1: 0.6602
 epoch: 72, train_loss: 0.2236, test_loss: 1.3389, test_f1: 0.6890
 epoch: 73, train_loss: 0.2193, test_loss: 1.4092, test_f1: 0.6596
 epoch: 74, train_loss: 0.2215, test_loss: 1.4542, test_f1: 0.6900
 epoch: 75, train_loss: 0.2309, test_loss: 1.3116, test_f1: 0.6950
 epoch: 76, train_loss: 0.2096, test_loss: 1.4234, test_f1: 0.6678
 epoch: 77, train_loss: 0.2042, test_loss: 1.2794, test_f1: 0.6877
 epoch: 78, train_loss: 0.2043, test_loss: 1.4170, test_f1: 0.6862
 epoch: 79, train_loss: 0.1920, test_loss: 1.4462, test_f1: 0.6885
 epoch: 80, train_loss: 0.2117, test_loss: 1.3604, test_f1: 0.6857
 epoch: 81, train_loss: 0.1920, test_loss: 1.3795, test_f1: 0.6670
 epoch: 82, train_loss: 0.1962, test_loss: 1.5491, test_f1: 0.6831
 epoch: 83, train_loss: 0.1800, test_loss: 1.3747, test_f1: 0.6837
 epoch: 84, train_loss: 0.1847, test_loss: 1.4000, test_f1: 0.6800
 epoch: 85, train_loss: 0.2076, test_loss: 1.4597, test_f1: 0.6671
 epoch: 86, train_loss: 0.1782, test_loss: 1.5712, test_f1: 0.6807
 epoch: 87, train_loss: 0.1796, test_loss: 1.5318, test_f1: 0.6756
 epoch: 88, train_loss: 0.1723, test_loss: 1.5144, test_f1: 0.6756
 epoch: 89, train_loss: 0.1716, test_loss: 1.6646, test_f1: 0.6777
 epoch: 90, train_loss: 0.1839, test_loss: 1.5516, test_f1: 0.6878
 epoch: 91, train_loss: 0.1643, test_loss: 1.5511, test_f1: 0.6894
 epoch: 92, train_loss: 0.1848, test_loss: 1.5799, test_f1: 0.6885
 epoch: 93, train_loss: 0.1753, test_loss: 1.5586, test_f1: 0.6993
 epoch: 94, train_loss: 0.1838, test_loss: 1.4660, test_f1: 0.6948
 epoch: 95, train_loss: 0.1697, test_loss: 1.5261, test_f1: 0.6971
 epoch: 96, train_loss: 0.1677, test_loss: 1.5711, test_f1: 0.6832
 epoch: 97, train_loss: 0.1610, test_loss: 1.6375, test_f1: 0.6811
 epoch: 98, train_loss: 0.1653, test_loss: 1.5121, test_f1: 0.6878
 epoch: 99, train_loss: 0.1667, test_loss: 1.7364, test_f1: 0.6731
##################ITERATION #8 ****************************************
 epoch: 0, train_loss: 1.1601, test_loss: 1.0448, test_f1: 0.4849
 epoch: 1, train_loss: 0.9478, test_loss: 0.9213, test_f1: 0.5080
 epoch: 2, train_loss: 0.9009, test_loss: 1.0373, test_f1: 0.4863
 epoch: 3, train_loss: 0.8821, test_loss: 0.8546, test_f1: 0.5618
 epoch: 4, train_loss: 0.8539, test_loss: 0.8550, test_f1: 0.5767
 epoch: 5, train_loss: 0.8319, test_loss: 0.9347, test_f1: 0.5470
 epoch: 6, train_loss: 0.8135, test_loss: 0.9154, test_f1: 0.5918
 epoch: 7, train_loss: 0.7973, test_loss: 1.3133, test_f1: 0.4920
 epoch: 8, train_loss: 0.7886, test_loss: 0.8011, test_f1: 0.6261
 epoch: 9, train_loss: 0.7568, test_loss: 0.8473, test_f1: 0.6147
 epoch: 10, train_loss: 0.7583, test_loss: 0.8200, test_f1: 0.5852
 epoch: 11, train_loss: 0.7356, test_loss: 0.8484, test_f1: 0.6276
 epoch: 12, train_loss: 0.7152, test_loss: 0.9844, test_f1: 0.5469
 epoch: 13, train_loss: 0.7339, test_loss: 0.8702, test_f1: 0.6034
 epoch: 14, train_loss: 0.7149, test_loss: 0.8851, test_f1: 0.6053
 epoch: 15, train_loss: 0.6963, test_loss: 0.7903, test_f1: 0.5954
 epoch: 16, train_loss: 0.6834, test_loss: 0.8168, test_f1: 0.6350
 epoch: 17, train_loss: 0.6647, test_loss: 0.8480, test_f1: 0.5857
 epoch: 18, train_loss: 0.6564, test_loss: 0.8320, test_f1: 0.6322
 epoch: 19, train_loss: 0.6558, test_loss: 0.7899, test_f1: 0.6122
 epoch: 20, train_loss: 0.6281, test_loss: 0.8102, test_f1: 0.6244
 epoch: 21, train_loss: 0.6299, test_loss: 0.8090, test_f1: 0.6139
 epoch: 22, train_loss: 0.6172, test_loss: 0.7398, test_f1: 0.6642
 epoch: 23, train_loss: 0.6140, test_loss: 0.8725, test_f1: 0.6315
 epoch: 24, train_loss: 0.5877, test_loss: 0.8679, test_f1: 0.6512
 epoch: 25, train_loss: 0.5759, test_loss: 0.9172, test_f1: 0.6181
 epoch: 26, train_loss: 0.5685, test_loss: 0.8295, test_f1: 0.6203
 epoch: 27, train_loss: 0.5725, test_loss: 0.8510, test_f1: 0.6435
 epoch: 28, train_loss: 0.5475, test_loss: 0.8852, test_f1: 0.6262
 epoch: 29, train_loss: 0.5407, test_loss: 0.8291, test_f1: 0.6537
 epoch: 30, train_loss: 0.5493, test_loss: 0.9680, test_f1: 0.6121
 epoch: 31, train_loss: 0.5488, test_loss: 0.9402, test_f1: 0.6151
 epoch: 32, train_loss: 0.5336, test_loss: 0.7556, test_f1: 0.6699
 epoch: 33, train_loss: 0.5192, test_loss: 1.0060, test_f1: 0.6195
 epoch: 34, train_loss: 0.5080, test_loss: 0.8732, test_f1: 0.6449
 epoch: 35, train_loss: 0.4900, test_loss: 0.8763, test_f1: 0.6569
 epoch: 36, train_loss: 0.4842, test_loss: 0.8749, test_f1: 0.6665
 epoch: 37, train_loss: 0.4704, test_loss: 0.8708, test_f1: 0.6391
 epoch: 38, train_loss: 0.4734, test_loss: 0.8674, test_f1: 0.6708
 epoch: 39, train_loss: 0.4792, test_loss: 0.9339, test_f1: 0.6541
 epoch: 40, train_loss: 0.4653, test_loss: 0.8734, test_f1: 0.6841
 epoch: 41, train_loss: 0.4630, test_loss: 1.0078, test_f1: 0.6280
 epoch: 42, train_loss: 0.4388, test_loss: 1.0255, test_f1: 0.6492
 epoch: 43, train_loss: 0.4481, test_loss: 0.8814, test_f1: 0.6915
 epoch: 44, train_loss: 0.4287, test_loss: 1.0904, test_f1: 0.6368
 epoch: 45, train_loss: 0.4488, test_loss: 1.0022, test_f1: 0.6598
 epoch: 46, train_loss: 0.4094, test_loss: 0.9059, test_f1: 0.6689
 epoch: 47, train_loss: 0.4114, test_loss: 0.9328, test_f1: 0.6593
 epoch: 48, train_loss: 0.4217, test_loss: 0.9377, test_f1: 0.6640
 epoch: 49, train_loss: 0.4080, test_loss: 0.9969, test_f1: 0.6561
 epoch: 50, train_loss: 0.4046, test_loss: 0.9799, test_f1: 0.6747
 epoch: 51, train_loss: 0.3575, test_loss: 1.0123, test_f1: 0.6637
 epoch: 52, train_loss: 0.3290, test_loss: 1.0659, test_f1: 0.6678
 epoch: 53, train_loss: 0.3205, test_loss: 1.0403, test_f1: 0.6887
 epoch: 54, train_loss: 0.3136, test_loss: 1.0364, test_f1: 0.7016
 epoch: 55, train_loss: 0.3107, test_loss: 1.1160, test_f1: 0.6765
 epoch: 56, train_loss: 0.3137, test_loss: 1.1620, test_f1: 0.6726
 epoch: 57, train_loss: 0.3050, test_loss: 1.1755, test_f1: 0.6399
 epoch: 58, train_loss: 0.3107, test_loss: 1.1465, test_f1: 0.6680
 epoch: 59, train_loss: 0.2915, test_loss: 1.1429, test_f1: 0.6901
 epoch: 60, train_loss: 0.2727, test_loss: 1.2818, test_f1: 0.6537
 epoch: 61, train_loss: 0.2904, test_loss: 1.2843, test_f1: 0.6756
 epoch: 62, train_loss: 0.2696, test_loss: 1.2224, test_f1: 0.6774
 epoch: 63, train_loss: 0.2944, test_loss: 1.2209, test_f1: 0.6611
 epoch: 64, train_loss: 0.2707, test_loss: 1.1645, test_f1: 0.6866
 epoch: 65, train_loss: 0.2778, test_loss: 1.1824, test_f1: 0.6725
 epoch: 66, train_loss: 0.2674, test_loss: 1.2346, test_f1: 0.6867
 epoch: 67, train_loss: 0.2572, test_loss: 1.2781, test_f1: 0.6816
 epoch: 68, train_loss: 0.2503, test_loss: 1.1822, test_f1: 0.6771
 epoch: 69, train_loss: 0.2652, test_loss: 1.2661, test_f1: 0.6824
 epoch: 70, train_loss: 0.2181, test_loss: 1.2389, test_f1: 0.6615
 epoch: 71, train_loss: 0.2503, test_loss: 1.4221, test_f1: 0.6796
 epoch: 72, train_loss: 0.2686, test_loss: 1.3232, test_f1: 0.6983
 epoch: 73, train_loss: 0.2491, test_loss: 1.2414, test_f1: 0.6696
 epoch: 74, train_loss: 0.2336, test_loss: 1.1727, test_f1: 0.6908
 epoch: 75, train_loss: 0.2533, test_loss: 1.2998, test_f1: 0.6691
 epoch: 76, train_loss: 0.2436, test_loss: 1.1912, test_f1: 0.6732
 epoch: 77, train_loss: 0.2308, test_loss: 1.3419, test_f1: 0.6720
 epoch: 78, train_loss: 0.2258, test_loss: 1.3327, test_f1: 0.6774
 epoch: 79, train_loss: 0.2253, test_loss: 1.2907, test_f1: 0.6656
 epoch: 80, train_loss: 0.2165, test_loss: 1.3245, test_f1: 0.6867
 epoch: 81, train_loss: 0.2189, test_loss: 1.4226, test_f1: 0.6534
 epoch: 82, train_loss: 0.2387, test_loss: 1.3850, test_f1: 0.6737
 epoch: 83, train_loss: 0.2241, test_loss: 1.3847, test_f1: 0.6796
 epoch: 84, train_loss: 0.2216, test_loss: 1.3559, test_f1: 0.7028
 epoch: 85, train_loss: 0.2314, test_loss: 1.3186, test_f1: 0.6767
 epoch: 86, train_loss: 0.2269, test_loss: 1.2116, test_f1: 0.7162
 epoch: 87, train_loss: 0.2043, test_loss: 1.3293, test_f1: 0.6951
 epoch: 88, train_loss: 0.1964, test_loss: 1.4519, test_f1: 0.6618
 epoch: 89, train_loss: 0.2117, test_loss: 1.3187, test_f1: 0.7004
 epoch: 90, train_loss: 0.1887, test_loss: 1.4919, test_f1: 0.6690
 epoch: 91, train_loss: 0.1971, test_loss: 1.5285, test_f1: 0.6618
 epoch: 92, train_loss: 0.1951, test_loss: 1.4123, test_f1: 0.6860
 epoch: 93, train_loss: 0.1927, test_loss: 1.4211, test_f1: 0.6919
 epoch: 94, train_loss: 0.1961, test_loss: 1.6406, test_f1: 0.6415
 epoch: 95, train_loss: 0.1998, test_loss: 1.4585, test_f1: 0.6814
 epoch: 96, train_loss: 0.1996, test_loss: 1.3448, test_f1: 0.6891
 epoch: 97, train_loss: 0.1947, test_loss: 1.6118, test_f1: 0.6622
 epoch: 98, train_loss: 0.2060, test_loss: 1.5839, test_f1: 0.6907
 epoch: 99, train_loss: 0.1952, test_loss: 1.4951, test_f1: 0.6614
##################ITERATION #9 ****************************************
 epoch: 0, train_loss: 1.1953, test_loss: 1.0219, test_f1: 0.5302
 epoch: 1, train_loss: 0.9501, test_loss: 0.8846, test_f1: 0.5246
 epoch: 2, train_loss: 0.9261, test_loss: 0.9214, test_f1: 0.5018
 epoch: 3, train_loss: 0.8779, test_loss: 0.9256, test_f1: 0.5220
 epoch: 4, train_loss: 0.8474, test_loss: 0.9089, test_f1: 0.5119
 epoch: 5, train_loss: 0.8286, test_loss: 0.8839, test_f1: 0.5330
 epoch: 6, train_loss: 0.8091, test_loss: 0.8698, test_f1: 0.5566
 epoch: 7, train_loss: 0.7896, test_loss: 0.7817, test_f1: 0.5962
 epoch: 8, train_loss: 0.7636, test_loss: 0.8967, test_f1: 0.5444
 epoch: 9, train_loss: 0.7638, test_loss: 0.8390, test_f1: 0.5960
 epoch: 10, train_loss: 0.7412, test_loss: 0.8911, test_f1: 0.5980
 epoch: 11, train_loss: 0.7270, test_loss: 0.9033, test_f1: 0.6252
 epoch: 12, train_loss: 0.7189, test_loss: 0.8415, test_f1: 0.6074
 epoch: 13, train_loss: 0.7137, test_loss: 0.8713, test_f1: 0.5786
 epoch: 14, train_loss: 0.6734, test_loss: 0.8701, test_f1: 0.6124
 epoch: 15, train_loss: 0.6797, test_loss: 0.7485, test_f1: 0.6555
 epoch: 16, train_loss: 0.6667, test_loss: 0.8326, test_f1: 0.6215
 epoch: 17, train_loss: 0.6634, test_loss: 0.9060, test_f1: 0.6220
 epoch: 18, train_loss: 0.6411, test_loss: 0.8653, test_f1: 0.6485
 epoch: 19, train_loss: 0.6286, test_loss: 0.9005, test_f1: 0.6402
 epoch: 20, train_loss: 0.6276, test_loss: 0.8851, test_f1: 0.6331
 epoch: 21, train_loss: 0.6003, test_loss: 1.0043, test_f1: 0.6010
 epoch: 22, train_loss: 0.5986, test_loss: 0.8795, test_f1: 0.6396
 epoch: 23, train_loss: 0.6049, test_loss: 0.8581, test_f1: 0.6256
 epoch: 24, train_loss: 0.5604, test_loss: 0.9168, test_f1: 0.6118
 epoch: 25, train_loss: 0.5553, test_loss: 0.8997, test_f1: 0.6204
 epoch: 26, train_loss: 0.5649, test_loss: 0.8411, test_f1: 0.6452
 epoch: 27, train_loss: 0.5526, test_loss: 0.8524, test_f1: 0.6495
 epoch: 28, train_loss: 0.5098, test_loss: 0.9539, test_f1: 0.6439
 epoch: 29, train_loss: 0.5181, test_loss: 0.9166, test_f1: 0.6581
 epoch: 30, train_loss: 0.5304, test_loss: 0.9176, test_f1: 0.6345
 epoch: 31, train_loss: 0.5257, test_loss: 0.9496, test_f1: 0.6598
 epoch: 32, train_loss: 0.4990, test_loss: 0.9246, test_f1: 0.6481
 epoch: 33, train_loss: 0.4933, test_loss: 0.9354, test_f1: 0.6559
 epoch: 34, train_loss: 0.4916, test_loss: 1.0162, test_f1: 0.6379
 epoch: 35, train_loss: 0.4639, test_loss: 0.9192, test_f1: 0.6620
 epoch: 36, train_loss: 0.4574, test_loss: 0.8951, test_f1: 0.6755
 epoch: 37, train_loss: 0.4609, test_loss: 0.9202, test_f1: 0.6489
 epoch: 38, train_loss: 0.4545, test_loss: 0.9652, test_f1: 0.6695
 epoch: 39, train_loss: 0.4441, test_loss: 0.9308, test_f1: 0.6644
 epoch: 40, train_loss: 0.4511, test_loss: 0.9003, test_f1: 0.6495
 epoch: 41, train_loss: 0.4461, test_loss: 0.9668, test_f1: 0.6296
 epoch: 42, train_loss: 0.4363, test_loss: 0.8687, test_f1: 0.6354
 epoch: 43, train_loss: 0.4418, test_loss: 0.9693, test_f1: 0.6563
 epoch: 44, train_loss: 0.4188, test_loss: 0.9897, test_f1: 0.6402
 epoch: 45, train_loss: 0.4232, test_loss: 0.8761, test_f1: 0.6910
 epoch: 46, train_loss: 0.3977, test_loss: 1.0597, test_f1: 0.6846
 epoch: 47, train_loss: 0.3902, test_loss: 1.1118, test_f1: 0.6463
 epoch: 48, train_loss: 0.3971, test_loss: 1.1113, test_f1: 0.6876
 epoch: 49, train_loss: 0.3951, test_loss: 0.9631, test_f1: 0.6921
 epoch: 50, train_loss: 0.3797, test_loss: 0.9934, test_f1: 0.6609
 epoch: 51, train_loss: 0.3450, test_loss: 1.0965, test_f1: 0.6987
 epoch: 52, train_loss: 0.3233, test_loss: 1.1359, test_f1: 0.6868
 epoch: 53, train_loss: 0.3120, test_loss: 1.1014, test_f1: 0.6775
 epoch: 54, train_loss: 0.2886, test_loss: 1.1314, test_f1: 0.6745
 epoch: 55, train_loss: 0.2961, test_loss: 1.1664, test_f1: 0.6678
 epoch: 56, train_loss: 0.3008, test_loss: 1.1116, test_f1: 0.6748
 epoch: 57, train_loss: 0.2605, test_loss: 1.1770, test_f1: 0.6764
 epoch: 58, train_loss: 0.2825, test_loss: 1.0146, test_f1: 0.6768
 epoch: 59, train_loss: 0.2791, test_loss: 1.1550, test_f1: 0.6804
 epoch: 60, train_loss: 0.2825, test_loss: 1.1028, test_f1: 0.6965
 epoch: 61, train_loss: 0.2587, test_loss: 1.1536, test_f1: 0.6951
 epoch: 62, train_loss: 0.2650, test_loss: 1.1980, test_f1: 0.6725
 epoch: 63, train_loss: 0.2532, test_loss: 1.1161, test_f1: 0.6779
 epoch: 64, train_loss: 0.2531, test_loss: 1.1614, test_f1: 0.6875
 epoch: 65, train_loss: 0.2510, test_loss: 1.2899, test_f1: 0.6593
 epoch: 66, train_loss: 0.2502, test_loss: 1.2281, test_f1: 0.6911
 epoch: 67, train_loss: 0.2470, test_loss: 1.2571, test_f1: 0.6677
 epoch: 68, train_loss: 0.2370, test_loss: 1.1853, test_f1: 0.6708
 epoch: 69, train_loss: 0.2379, test_loss: 1.2847, test_f1: 0.6767
 epoch: 70, train_loss: 0.2399, test_loss: 1.2116, test_f1: 0.6738
 epoch: 71, train_loss: 0.2390, test_loss: 1.3292, test_f1: 0.6893
 epoch: 72, train_loss: 0.2179, test_loss: 1.2574, test_f1: 0.6932
 epoch: 73, train_loss: 0.2221, test_loss: 1.1924, test_f1: 0.6849
 epoch: 74, train_loss: 0.2093, test_loss: 1.3232, test_f1: 0.7034
 epoch: 75, train_loss: 0.2175, test_loss: 1.4218, test_f1: 0.6447
 epoch: 76, train_loss: 0.2343, test_loss: 1.3191, test_f1: 0.6709
 epoch: 77, train_loss: 0.2351, test_loss: 1.3363, test_f1: 0.6866
 epoch: 78, train_loss: 0.2098, test_loss: 1.2505, test_f1: 0.6801
 epoch: 79, train_loss: 0.2125, test_loss: 1.3068, test_f1: 0.6844
 epoch: 80, train_loss: 0.2031, test_loss: 1.2487, test_f1: 0.6853
 epoch: 81, train_loss: 0.2013, test_loss: 1.4350, test_f1: 0.6719
 epoch: 82, train_loss: 0.2096, test_loss: 1.3720, test_f1: 0.6999
 epoch: 83, train_loss: 0.2094, test_loss: 1.4829, test_f1: 0.6803
 epoch: 84, train_loss: 0.1913, test_loss: 1.3562, test_f1: 0.6496
 epoch: 85, train_loss: 0.1912, test_loss: 1.3796, test_f1: 0.6812
 epoch: 86, train_loss: 0.2016, test_loss: 1.4375, test_f1: 0.6598
 epoch: 87, train_loss: 0.1887, test_loss: 1.3626, test_f1: 0.6760
 epoch: 88, train_loss: 0.1961, test_loss: 1.3213, test_f1: 0.6864
 epoch: 89, train_loss: 0.1783, test_loss: 1.4214, test_f1: 0.6774
 epoch: 90, train_loss: 0.1877, test_loss: 1.4931, test_f1: 0.6628
 epoch: 91, train_loss: 0.1662, test_loss: 1.3147, test_f1: 0.6961
 epoch: 92, train_loss: 0.1728, test_loss: 1.4652, test_f1: 0.6928
 epoch: 93, train_loss: 0.1761, test_loss: 1.3727, test_f1: 0.7114
 epoch: 94, train_loss: 0.1911, test_loss: 1.3760, test_f1: 0.6649
 epoch: 95, train_loss: 0.2196, test_loss: 1.4135, test_f1: 0.6648
 epoch: 96, train_loss: 0.1850, test_loss: 1.4710, test_f1: 0.6484
 epoch: 97, train_loss: 0.1886, test_loss: 1.5813, test_f1: 0.6562
 epoch: 98, train_loss: 0.1833, test_loss: 1.3645, test_f1: 0.6826
 epoch: 99, train_loss: 0.1775, test_loss: 1.4141, test_f1: 0.6685

Training completed in 1640.98 seconds
Best F1: 0.7293 at epoch 52
Mean F1 across iterations: 0.7131  0.0091
========================FINAL RESULTS================================
FEGIN weighted F1: 0.7293  0.0091
python main.py --data ltspice_examples --representation component_pin --model FEGIN --layers 3 --hiddens 128 --batch_size 32 --lr 0.001 --emb_size 128 --epochs 100 --save_appendix component_pin_L3_H128_BS32_LR0.001_E128 --no_val
-----



STDERR:
  File "main.py", line 370, in <module>
    main()
  File "main.py", line 254, in main
    dataset = dataset_class(
  File "/home/philip/projects/llm_inference_code_repo/Circuit-Completion-Using-GNNs/component_classification_with_link_prediction_head/evaluation/FEGIN/kernel/circuit_datasets.py", line 15, in __init__
    self.data, self.slices = torch.load(self.processed_paths[0])
  File "/home/philip/.local/lib/python3.8/site-packages/torch/serialization.py", line 1040, in load
    warnings.warn(
  File "/usr/lib/python3.8/warnings.py", line 109, in _showwarnmsg
    sw(msg.message, msg.category, msg.filename, msg.lineno,
  File "main.py", line 47, in warn_with_traceback
    traceback.print_stack(file=log)
/home/philip/projects/llm_inference_code_repo/Circuit-Completion-Using-GNNs/component_classification_with_link_prediction_head/evaluation/FEGIN/kernel/circuit_datasets.py:15: FutureWarning: You are using `torch.load` with `weights_only=False` (the current default value), which uses the default pickle module implicitly. It is possible to construct malicious pickle data which will execute arbitrary code during unpickling (See https://github.com/pytorch/pytorch/blob/main/SECURITY.md#untrusted-models for more details). In a future release, the default value for `weights_only` will be flipped to `True`. This limits the functions that could be executed during unpickling. Arbitrary objects will no longer be allowed to be loaded via this mode unless they are explicitly allowlisted by the user via `torch.serialization.add_safe_globals`. We recommend you start setting `weights_only=True` for any use case where you don't have full control of the loaded file. Please open an issue on GitHub for any issues related to this experimental feature.
  self.data, self.slices = torch.load(self.processed_paths[0])
