STDOUT:
Results will be saved in /home/philip/projects/ltspice_examples_code_repo/Circuit-Completion-Using-GNNs/component_classification_with_link_prediction_head/evaluation/FEGIN/results/model_FEGIN_dataset_ltspice_demos
Command line input: python main.py --data ltspice_demos --representation component_pin_net --model FEGIN --layers 5 --hiddens 128 --batch_size 256 --lr 0.01 --emb_size 512 --epochs 100 --save_appendix component_pin_net_L5_H128_BS256_LR0.01_E512 --no_val
 is saved.
-----
ltspice_demos - FEGIN
Using 5 layers, 128 hidden units, h = 2
Loading component_pin_net representation dataset
Loading component_pin_net representation data...
Loaded 1948 examples (component_pin_net)
saving path: data/processed/ltspice_demos_component_pin_net_processed.pt
ENTERED
Training FEGIN on component_pin_net representation
Train: 1565, Test: 383
##################ITERATION #0 ****************************************
 epoch: 0, train_loss: 1.3138, test_loss: 1.2968, test_f1: 0.2281
 epoch: 1, train_loss: 1.1651, test_loss: 1.3596, test_f1: 0.1365
 epoch: 2, train_loss: 1.0397, test_loss: 1.3395, test_f1: 0.2441
 epoch: 3, train_loss: 1.0104, test_loss: 1.4552, test_f1: 0.2187
 epoch: 4, train_loss: 0.9746, test_loss: 1.3708, test_f1: 0.2799
 epoch: 5, train_loss: 0.9690, test_loss: 1.0598, test_f1: 0.5103
 epoch: 6, train_loss: 0.9642, test_loss: 1.5360, test_f1: 0.3442
 epoch: 7, train_loss: 0.9336, test_loss: 1.6103, test_f1: 0.3503
 epoch: 8, train_loss: 0.9071, test_loss: 1.4009, test_f1: 0.4257
 epoch: 9, train_loss: 0.8799, test_loss: 1.0266, test_f1: 0.5583
 epoch: 10, train_loss: 0.8847, test_loss: 1.0823, test_f1: 0.5663
 epoch: 11, train_loss: 0.8692, test_loss: 1.0490, test_f1: 0.5341
 epoch: 12, train_loss: 0.8559, test_loss: 1.1869, test_f1: 0.5100
 epoch: 13, train_loss: 0.8172, test_loss: 1.6735, test_f1: 0.4455
 epoch: 14, train_loss: 0.8661, test_loss: 1.2772, test_f1: 0.4538
 epoch: 15, train_loss: 0.8857, test_loss: 1.3096, test_f1: 0.4920
 epoch: 16, train_loss: 0.8455, test_loss: 1.3219, test_f1: 0.4186
 epoch: 17, train_loss: 0.8253, test_loss: 1.3111, test_f1: 0.4422
 epoch: 18, train_loss: 0.7983, test_loss: 1.0869, test_f1: 0.5589
 epoch: 19, train_loss: 0.7931, test_loss: 1.1936, test_f1: 0.4792
 epoch: 20, train_loss: 0.7891, test_loss: 1.0995, test_f1: 0.4080
 epoch: 21, train_loss: 0.8710, test_loss: 1.7102, test_f1: 0.3881
 epoch: 22, train_loss: 0.7962, test_loss: 1.0862, test_f1: 0.4210
 epoch: 23, train_loss: 0.7851, test_loss: 1.0120, test_f1: 0.5544
 epoch: 24, train_loss: 0.7424, test_loss: 1.0296, test_f1: 0.5181
 epoch: 25, train_loss: 0.8086, test_loss: 1.1085, test_f1: 0.4859
 epoch: 26, train_loss: 0.8128, test_loss: 1.2551, test_f1: 0.4626
 epoch: 27, train_loss: 0.7881, test_loss: 1.1582, test_f1: 0.5284
 epoch: 28, train_loss: 0.7555, test_loss: 1.1253, test_f1: 0.4965
 epoch: 29, train_loss: 0.7353, test_loss: 1.1505, test_f1: 0.4767
 epoch: 30, train_loss: 0.7135, test_loss: 1.5437, test_f1: 0.4022
 epoch: 31, train_loss: 0.6858, test_loss: 1.8068, test_f1: 0.4135
 epoch: 32, train_loss: 0.6960, test_loss: 1.1900, test_f1: 0.5798
 epoch: 33, train_loss: 0.6800, test_loss: 1.7469, test_f1: 0.4225
 epoch: 34, train_loss: 0.7592, test_loss: 1.7765, test_f1: 0.4407
 epoch: 35, train_loss: 0.7518, test_loss: 1.7672, test_f1: 0.4637
 epoch: 36, train_loss: 0.7101, test_loss: 1.3229, test_f1: 0.5421
 epoch: 37, train_loss: 0.6761, test_loss: 1.1713, test_f1: 0.6118
 epoch: 38, train_loss: 0.7636, test_loss: 1.1167, test_f1: 0.4965
 epoch: 39, train_loss: 0.6720, test_loss: 1.1668, test_f1: 0.5295
 epoch: 40, train_loss: 0.6773, test_loss: 1.2322, test_f1: 0.5342
 epoch: 41, train_loss: 0.7595, test_loss: 1.2415, test_f1: 0.5284
 epoch: 42, train_loss: 0.6914, test_loss: 1.2358, test_f1: 0.5389
 epoch: 43, train_loss: 0.6515, test_loss: 1.2524, test_f1: 0.5967
 epoch: 44, train_loss: 0.6545, test_loss: 1.6699, test_f1: 0.5314
 epoch: 45, train_loss: 0.6521, test_loss: 1.7538, test_f1: 0.4840
 epoch: 46, train_loss: 0.6379, test_loss: 1.6476, test_f1: 0.5488
 epoch: 47, train_loss: 0.6220, test_loss: 1.8018, test_f1: 0.5503
 epoch: 48, train_loss: 0.6609, test_loss: 1.1783, test_f1: 0.5111
 epoch: 49, train_loss: 0.6662, test_loss: 1.3390, test_f1: 0.4875
 epoch: 50, train_loss: 0.6292, test_loss: 1.1438, test_f1: 0.5340
 epoch: 51, train_loss: 0.6162, test_loss: 1.1288, test_f1: 0.5659
 epoch: 52, train_loss: 0.5659, test_loss: 1.4049, test_f1: 0.5366
 epoch: 53, train_loss: 0.5493, test_loss: 1.5043, test_f1: 0.5249
 epoch: 54, train_loss: 0.5373, test_loss: 1.2138, test_f1: 0.5923
 epoch: 55, train_loss: 0.5234, test_loss: 1.2451, test_f1: 0.5608
 epoch: 56, train_loss: 0.5312, test_loss: 1.2568, test_f1: 0.5791
 epoch: 57, train_loss: 0.5178, test_loss: 1.3510, test_f1: 0.6020
 epoch: 58, train_loss: 0.4942, test_loss: 1.3642, test_f1: 0.5691
 epoch: 59, train_loss: 0.5059, test_loss: 1.5718, test_f1: 0.5815
 epoch: 60, train_loss: 0.4945, test_loss: 1.5742, test_f1: 0.5119
 epoch: 61, train_loss: 0.5221, test_loss: 1.7296, test_f1: 0.5593
 epoch: 62, train_loss: 0.5092, test_loss: 1.9805, test_f1: 0.5226
 epoch: 63, train_loss: 0.5120, test_loss: 1.5369, test_f1: 0.5949
 epoch: 64, train_loss: 0.4658, test_loss: 1.4087, test_f1: 0.5636
 epoch: 65, train_loss: 0.4570, test_loss: 1.4323, test_f1: 0.6180
 epoch: 66, train_loss: 0.4413, test_loss: 1.4515, test_f1: 0.6004
 epoch: 67, train_loss: 0.4371, test_loss: 1.4831, test_f1: 0.5950
 epoch: 68, train_loss: 0.4510, test_loss: 1.4703, test_f1: 0.6096
 epoch: 69, train_loss: 0.4328, test_loss: 1.7879, test_f1: 0.5589
 epoch: 70, train_loss: 0.4417, test_loss: 1.8244, test_f1: 0.5597
 epoch: 71, train_loss: 0.4123, test_loss: 1.4939, test_f1: 0.5878
 epoch: 72, train_loss: 0.4308, test_loss: 1.4723, test_f1: 0.4997
 epoch: 73, train_loss: 0.4399, test_loss: 1.7407, test_f1: 0.5544
 epoch: 74, train_loss: 0.4136, test_loss: 1.8428, test_f1: 0.5266
 epoch: 75, train_loss: 0.4040, test_loss: 1.9804, test_f1: 0.5141
 epoch: 76, train_loss: 0.3943, test_loss: 2.0890, test_f1: 0.5273
 epoch: 77, train_loss: 0.3828, test_loss: 1.8704, test_f1: 0.5722
 epoch: 78, train_loss: 0.3564, test_loss: 2.0022, test_f1: 0.5531
 epoch: 79, train_loss: 0.3475, test_loss: 1.9206, test_f1: 0.5535
 epoch: 80, train_loss: 0.3647, test_loss: 1.7264, test_f1: 0.5729
 epoch: 81, train_loss: 0.3984, test_loss: 1.6585, test_f1: 0.6112
 epoch: 82, train_loss: 0.4523, test_loss: 1.9032, test_f1: 0.6007
 epoch: 83, train_loss: 0.4669, test_loss: 2.0773, test_f1: 0.5794
 epoch: 84, train_loss: 0.3976, test_loss: 1.9207, test_f1: 0.6001
 epoch: 85, train_loss: 0.3753, test_loss: 1.9848, test_f1: 0.5426
 epoch: 86, train_loss: 0.4207, test_loss: 2.4145, test_f1: 0.5295
 epoch: 87, train_loss: 0.4328, test_loss: 1.7919, test_f1: 0.5767
 epoch: 88, train_loss: 0.3926, test_loss: 1.8214, test_f1: 0.5859
 epoch: 89, train_loss: 0.4172, test_loss: 2.1368, test_f1: 0.5179
 epoch: 90, train_loss: 0.4473, test_loss: 1.8907, test_f1: 0.5493
 epoch: 91, train_loss: 0.4521, test_loss: 1.9972, test_f1: 0.5189
 epoch: 92, train_loss: 0.3886, test_loss: 1.5693, test_f1: 0.5750
 epoch: 93, train_loss: 0.3527, test_loss: 1.8577, test_f1: 0.5777
 epoch: 94, train_loss: 0.3362, test_loss: 1.9256, test_f1: 0.5505
 epoch: 95, train_loss: 0.3431, test_loss: 1.9207, test_f1: 0.5473
 epoch: 96, train_loss: 0.3546, test_loss: 1.8240, test_f1: 0.5606
 epoch: 97, train_loss: 0.3224, test_loss: 2.5704, test_f1: 0.5815
 epoch: 98, train_loss: 0.3292, test_loss: 2.4600, test_f1: 0.5529
 epoch: 99, train_loss: 0.3505, test_loss: 1.8588, test_f1: 0.5692
##################ITERATION #1 ****************************************
 epoch: 0, train_loss: 1.2942, test_loss: 1.3119, test_f1: 0.2425
 epoch: 1, train_loss: 1.1085, test_loss: 1.2497, test_f1: 0.3076
 epoch: 2, train_loss: 0.9957, test_loss: 1.2054, test_f1: 0.3863
 epoch: 3, train_loss: 0.9684, test_loss: 1.2447, test_f1: 0.4317
 epoch: 4, train_loss: 0.9520, test_loss: 1.2372, test_f1: 0.4737
 epoch: 5, train_loss: 0.9177, test_loss: 1.1288, test_f1: 0.4738
 epoch: 6, train_loss: 0.8869, test_loss: 1.0616, test_f1: 0.4434
 epoch: 7, train_loss: 0.8655, test_loss: 1.0212, test_f1: 0.4933
 epoch: 8, train_loss: 0.8885, test_loss: 1.1617, test_f1: 0.4928
 epoch: 9, train_loss: 0.8636, test_loss: 1.2010, test_f1: 0.4680
 epoch: 10, train_loss: 0.8452, test_loss: 0.9862, test_f1: 0.5295
 epoch: 11, train_loss: 0.8061, test_loss: 1.0876, test_f1: 0.4731
 epoch: 12, train_loss: 0.8205, test_loss: 1.2148, test_f1: 0.5093
 epoch: 13, train_loss: 0.7793, test_loss: 1.0767, test_f1: 0.5134
 epoch: 14, train_loss: 0.7889, test_loss: 1.1983, test_f1: 0.4099
 epoch: 15, train_loss: 0.7972, test_loss: 1.1569, test_f1: 0.4542
 epoch: 16, train_loss: 0.7788, test_loss: 1.1651, test_f1: 0.5492
 epoch: 17, train_loss: 0.7496, test_loss: 1.3573, test_f1: 0.4247
 epoch: 18, train_loss: 0.7232, test_loss: 1.0343, test_f1: 0.5591
 epoch: 19, train_loss: 0.7617, test_loss: 1.0746, test_f1: 0.4843
 epoch: 20, train_loss: 0.7752, test_loss: 1.1921, test_f1: 0.5016
 epoch: 21, train_loss: 0.7795, test_loss: 1.1445, test_f1: 0.4432
 epoch: 22, train_loss: 0.7506, test_loss: 1.1569, test_f1: 0.4948
 epoch: 23, train_loss: 0.7406, test_loss: 1.1596, test_f1: 0.5728
 epoch: 24, train_loss: 0.7091, test_loss: 1.2938, test_f1: 0.4990
 epoch: 25, train_loss: 0.6731, test_loss: 1.3139, test_f1: 0.5382
 epoch: 26, train_loss: 0.6860, test_loss: 1.2313, test_f1: 0.5192
 epoch: 27, train_loss: 0.6639, test_loss: 1.2606, test_f1: 0.5221
 epoch: 28, train_loss: 0.6183, test_loss: 1.3201, test_f1: 0.5274
 epoch: 29, train_loss: 0.6423, test_loss: 1.4985, test_f1: 0.4807
 epoch: 30, train_loss: 0.6540, test_loss: 1.2236, test_f1: 0.5369
 epoch: 31, train_loss: 0.6712, test_loss: 1.3412, test_f1: 0.5176
 epoch: 32, train_loss: 0.6525, test_loss: 1.4336, test_f1: 0.5198
 epoch: 33, train_loss: 0.6176, test_loss: 1.5104, test_f1: 0.5410
 epoch: 34, train_loss: 0.6164, test_loss: 1.5105, test_f1: 0.5390
 epoch: 35, train_loss: 0.5940, test_loss: 1.2187, test_f1: 0.6239
 epoch: 36, train_loss: 0.6019, test_loss: 1.3893, test_f1: 0.5161
 epoch: 37, train_loss: 0.6243, test_loss: 1.7444, test_f1: 0.4680
 epoch: 38, train_loss: 0.5997, test_loss: 1.3699, test_f1: 0.5467
 epoch: 39, train_loss: 0.5911, test_loss: 1.5578, test_f1: 0.5858
 epoch: 40, train_loss: 0.6215, test_loss: 1.1405, test_f1: 0.5534
 epoch: 41, train_loss: 0.6118, test_loss: 1.1867, test_f1: 0.5431
 epoch: 42, train_loss: 0.6059, test_loss: 1.3265, test_f1: 0.5103
 epoch: 43, train_loss: 0.5938, test_loss: 1.3019, test_f1: 0.5903
 epoch: 44, train_loss: 0.5625, test_loss: 1.4056, test_f1: 0.5777
 epoch: 45, train_loss: 0.5268, test_loss: 2.1030, test_f1: 0.4419
 epoch: 46, train_loss: 0.5804, test_loss: 1.3762, test_f1: 0.5506
 epoch: 47, train_loss: 0.6006, test_loss: 1.5102, test_f1: 0.5745
 epoch: 48, train_loss: 0.6892, test_loss: 1.7403, test_f1: 0.4795
 epoch: 49, train_loss: 0.6662, test_loss: 1.7782, test_f1: 0.4603
 epoch: 50, train_loss: 0.6504, test_loss: 1.4468, test_f1: 0.5294
 epoch: 51, train_loss: 0.5758, test_loss: 1.3356, test_f1: 0.5400
 epoch: 52, train_loss: 0.5572, test_loss: 1.3467, test_f1: 0.5496
 epoch: 53, train_loss: 0.5132, test_loss: 1.3182, test_f1: 0.5950
 epoch: 54, train_loss: 0.4957, test_loss: 1.3197, test_f1: 0.6034
 epoch: 55, train_loss: 0.5345, test_loss: 1.3326, test_f1: 0.6197
 epoch: 56, train_loss: 0.5383, test_loss: 1.3793, test_f1: 0.5760
 epoch: 57, train_loss: 0.5188, test_loss: 1.3817, test_f1: 0.6025
 epoch: 58, train_loss: 0.4742, test_loss: 1.3449, test_f1: 0.6306
 epoch: 59, train_loss: 0.4754, test_loss: 1.6268, test_f1: 0.5330
 epoch: 60, train_loss: 0.4703, test_loss: 1.6759, test_f1: 0.5464
 epoch: 61, train_loss: 0.4572, test_loss: 1.7272, test_f1: 0.5729
 epoch: 62, train_loss: 0.4927, test_loss: 1.7188, test_f1: 0.5956
 epoch: 63, train_loss: 0.4687, test_loss: 1.4223, test_f1: 0.6108
 epoch: 64, train_loss: 0.4296, test_loss: 1.6037, test_f1: 0.6028
 epoch: 65, train_loss: 0.4165, test_loss: 1.6210, test_f1: 0.5983
 epoch: 66, train_loss: 0.4145, test_loss: 1.7085, test_f1: 0.5989
 epoch: 67, train_loss: 0.3964, test_loss: 1.8035, test_f1: 0.6048
 epoch: 68, train_loss: 0.4091, test_loss: 1.7936, test_f1: 0.5709
 epoch: 69, train_loss: 0.4321, test_loss: 1.8133, test_f1: 0.5692
 epoch: 70, train_loss: 0.3975, test_loss: 1.8691, test_f1: 0.5979
 epoch: 71, train_loss: 0.4168, test_loss: 1.6822, test_f1: 0.5966
 epoch: 72, train_loss: 0.4034, test_loss: 1.7489, test_f1: 0.5865
 epoch: 73, train_loss: 0.4093, test_loss: 1.7339, test_f1: 0.6206
 epoch: 74, train_loss: 0.3940, test_loss: 1.8752, test_f1: 0.6200
 epoch: 75, train_loss: 0.3778, test_loss: 2.1586, test_f1: 0.5658
 epoch: 76, train_loss: 0.3899, test_loss: 2.4576, test_f1: 0.5510
 epoch: 77, train_loss: 0.3850, test_loss: 1.9871, test_f1: 0.5929
 epoch: 78, train_loss: 0.3851, test_loss: 2.1320, test_f1: 0.5881
 epoch: 79, train_loss: 0.3707, test_loss: 1.7102, test_f1: 0.5838
 epoch: 80, train_loss: 0.3788, test_loss: 1.6518, test_f1: 0.5983
 epoch: 81, train_loss: 0.3684, test_loss: 1.8524, test_f1: 0.6086
 epoch: 82, train_loss: 0.3745, test_loss: 1.8842, test_f1: 0.5942
 epoch: 83, train_loss: 0.3500, test_loss: 1.7107, test_f1: 0.6061
 epoch: 84, train_loss: 0.3865, test_loss: 1.7241, test_f1: 0.5911
 epoch: 85, train_loss: 0.3473, test_loss: 2.0019, test_f1: 0.5726
 epoch: 86, train_loss: 0.3422, test_loss: 2.1495, test_f1: 0.6166
 epoch: 87, train_loss: 0.3292, test_loss: 2.0356, test_f1: 0.6250
 epoch: 88, train_loss: 0.3253, test_loss: 2.1478, test_f1: 0.6204
 epoch: 89, train_loss: 0.3082, test_loss: 2.1205, test_f1: 0.6322
 epoch: 90, train_loss: 0.2911, test_loss: 2.1470, test_f1: 0.5901
 epoch: 91, train_loss: 0.3088, test_loss: 2.1835, test_f1: 0.6147
 epoch: 92, train_loss: 0.2871, test_loss: 2.2400, test_f1: 0.6251
 epoch: 93, train_loss: 0.3028, test_loss: 2.1574, test_f1: 0.5682
 epoch: 94, train_loss: 0.3037, test_loss: 2.3014, test_f1: 0.5867
 epoch: 95, train_loss: 0.3255, test_loss: 2.5296, test_f1: 0.5966
 epoch: 96, train_loss: 0.2783, test_loss: 2.4423, test_f1: 0.6306
 epoch: 97, train_loss: 0.2866, test_loss: 2.7018, test_f1: 0.5968
 epoch: 98, train_loss: 0.3449, test_loss: 2.6356, test_f1: 0.5685
 epoch: 99, train_loss: 0.3361, test_loss: 2.3938, test_f1: 0.5662
##################ITERATION #2 ****************************************
 epoch: 0, train_loss: 1.3090, test_loss: 1.4161, test_f1: 0.1365
 epoch: 1, train_loss: 1.0787, test_loss: 1.4111, test_f1: 0.2281
 epoch: 2, train_loss: 1.0130, test_loss: 1.5117, test_f1: 0.3206
 epoch: 3, train_loss: 0.9650, test_loss: 1.2329, test_f1: 0.3893
 epoch: 4, train_loss: 0.9355, test_loss: 1.1452, test_f1: 0.4524
 epoch: 5, train_loss: 0.9376, test_loss: 1.0211, test_f1: 0.5790
 epoch: 6, train_loss: 0.9164, test_loss: 1.3127, test_f1: 0.4452
 epoch: 7, train_loss: 0.8878, test_loss: 1.1835, test_f1: 0.4823
 epoch: 8, train_loss: 0.8679, test_loss: 1.1000, test_f1: 0.5060
 epoch: 9, train_loss: 0.8784, test_loss: 1.4039, test_f1: 0.4635
 epoch: 10, train_loss: 0.8856, test_loss: 1.1865, test_f1: 0.4525
 epoch: 11, train_loss: 0.8351, test_loss: 1.3841, test_f1: 0.4360
 epoch: 12, train_loss: 0.8954, test_loss: 1.2900, test_f1: 0.4064
 epoch: 13, train_loss: 0.8611, test_loss: 1.6112, test_f1: 0.3534
 epoch: 14, train_loss: 0.8567, test_loss: 1.1032, test_f1: 0.4998
 epoch: 15, train_loss: 0.8030, test_loss: 1.4241, test_f1: 0.5278
 epoch: 16, train_loss: 0.7938, test_loss: 1.2113, test_f1: 0.5311
 epoch: 17, train_loss: 0.7543, test_loss: 1.4636, test_f1: 0.5400
 epoch: 18, train_loss: 0.7869, test_loss: 1.3270, test_f1: 0.5109
 epoch: 19, train_loss: 0.7671, test_loss: 1.3409, test_f1: 0.4264
 epoch: 20, train_loss: 0.7405, test_loss: 1.5019, test_f1: 0.4445
 epoch: 21, train_loss: 0.7794, test_loss: 1.4579, test_f1: 0.4337
 epoch: 22, train_loss: 0.7322, test_loss: 1.0244, test_f1: 0.5584
 epoch: 23, train_loss: 0.6890, test_loss: 1.1927, test_f1: 0.5017
 epoch: 24, train_loss: 0.6696, test_loss: 1.3482, test_f1: 0.5481
 epoch: 25, train_loss: 0.6826, test_loss: 1.5200, test_f1: 0.4856
 epoch: 26, train_loss: 0.6811, test_loss: 1.4521, test_f1: 0.5501
 epoch: 27, train_loss: 0.6523, test_loss: 1.2095, test_f1: 0.6130
 epoch: 28, train_loss: 0.6450, test_loss: 1.5577, test_f1: 0.4930
 epoch: 29, train_loss: 0.6743, test_loss: 1.5047, test_f1: 0.5042
 epoch: 30, train_loss: 0.6331, test_loss: 1.3505, test_f1: 0.5797
 epoch: 31, train_loss: 0.6245, test_loss: 1.6552, test_f1: 0.4765
 epoch: 32, train_loss: 0.5848, test_loss: 1.9973, test_f1: 0.4858
 epoch: 33, train_loss: 0.6373, test_loss: 2.1075, test_f1: 0.4993
 epoch: 34, train_loss: 0.6535, test_loss: 1.3314, test_f1: 0.5545
 epoch: 35, train_loss: 0.7000, test_loss: 1.1551, test_f1: 0.5889
 epoch: 36, train_loss: 0.6268, test_loss: 1.2843, test_f1: 0.5563
 epoch: 37, train_loss: 0.6187, test_loss: 1.3083, test_f1: 0.4963
 epoch: 38, train_loss: 0.5899, test_loss: 2.2336, test_f1: 0.4818
 epoch: 39, train_loss: 0.5695, test_loss: 1.7963, test_f1: 0.5195
 epoch: 40, train_loss: 0.6393, test_loss: 1.9039, test_f1: 0.5072
 epoch: 41, train_loss: 0.5810, test_loss: 1.6977, test_f1: 0.5078
 epoch: 42, train_loss: 0.5520, test_loss: 1.5026, test_f1: 0.5550
 epoch: 43, train_loss: 0.5161, test_loss: 1.9015, test_f1: 0.5685
 epoch: 44, train_loss: 0.5625, test_loss: 1.6141, test_f1: 0.5032
 epoch: 45, train_loss: 0.5549, test_loss: 1.7014, test_f1: 0.5277
 epoch: 46, train_loss: 0.6016, test_loss: 1.4521, test_f1: 0.5740
 epoch: 47, train_loss: 0.5260, test_loss: 1.2660, test_f1: 0.5739
 epoch: 48, train_loss: 0.5145, test_loss: 1.8120, test_f1: 0.5477
 epoch: 49, train_loss: 0.5383, test_loss: 2.2438, test_f1: 0.5192
 epoch: 50, train_loss: 0.5487, test_loss: 1.8736, test_f1: 0.4883
 epoch: 51, train_loss: 0.4717, test_loss: 1.7368, test_f1: 0.5121
 epoch: 52, train_loss: 0.4746, test_loss: 1.6422, test_f1: 0.5862
 epoch: 53, train_loss: 0.4657, test_loss: 1.6987, test_f1: 0.5536
 epoch: 54, train_loss: 0.4375, test_loss: 1.9752, test_f1: 0.5751
 epoch: 55, train_loss: 0.4259, test_loss: 2.0666, test_f1: 0.5791
 epoch: 56, train_loss: 0.4360, test_loss: 2.1639, test_f1: 0.5113
 epoch: 57, train_loss: 0.4824, test_loss: 1.9144, test_f1: 0.6049
 epoch: 58, train_loss: 0.4740, test_loss: 1.5290, test_f1: 0.5706
 epoch: 59, train_loss: 0.4318, test_loss: 1.7237, test_f1: 0.5599
 epoch: 60, train_loss: 0.4164, test_loss: 1.9276, test_f1: 0.5998
 epoch: 61, train_loss: 0.4104, test_loss: 1.9761, test_f1: 0.5603
 epoch: 62, train_loss: 0.3901, test_loss: 2.0437, test_f1: 0.5706
 epoch: 63, train_loss: 0.4148, test_loss: 2.2440, test_f1: 0.5681
 epoch: 64, train_loss: 0.3818, test_loss: 2.0992, test_f1: 0.5868
 epoch: 65, train_loss: 0.3497, test_loss: 2.1642, test_f1: 0.5573
 epoch: 66, train_loss: 0.3452, test_loss: 2.3959, test_f1: 0.5649
 epoch: 67, train_loss: 0.3824, test_loss: 2.5048, test_f1: 0.5981
 epoch: 68, train_loss: 0.3952, test_loss: 2.9640, test_f1: 0.5538
 epoch: 69, train_loss: 0.3793, test_loss: 2.3680, test_f1: 0.5693
 epoch: 70, train_loss: 0.3688, test_loss: 2.3791, test_f1: 0.5464
 epoch: 71, train_loss: 0.3916, test_loss: 2.1273, test_f1: 0.5787
 epoch: 72, train_loss: 0.3786, test_loss: 2.1074, test_f1: 0.5848
 epoch: 73, train_loss: 0.4030, test_loss: 2.0837, test_f1: 0.6133
 epoch: 74, train_loss: 0.3634, test_loss: 2.2700, test_f1: 0.5772
 epoch: 75, train_loss: 0.3348, test_loss: 2.2984, test_f1: 0.5457
 epoch: 76, train_loss: 0.3016, test_loss: 2.1193, test_f1: 0.6171
 epoch: 77, train_loss: 0.3140, test_loss: 2.2547, test_f1: 0.6097
 epoch: 78, train_loss: 0.3350, test_loss: 2.2066, test_f1: 0.5816
 epoch: 79, train_loss: 0.3156, test_loss: 2.1797, test_f1: 0.5524
 epoch: 80, train_loss: 0.2992, test_loss: 2.2831, test_f1: 0.5904
 epoch: 81, train_loss: 0.2726, test_loss: 2.2922, test_f1: 0.5526
 epoch: 82, train_loss: 0.2739, test_loss: 2.4805, test_f1: 0.5316
 epoch: 83, train_loss: 0.2937, test_loss: 2.7444, test_f1: 0.5888
 epoch: 84, train_loss: 0.3174, test_loss: 2.5823, test_f1: 0.5641
 epoch: 85, train_loss: 0.3061, test_loss: 2.4104, test_f1: 0.6230
 epoch: 86, train_loss: 0.3147, test_loss: 2.2838, test_f1: 0.5803
 epoch: 87, train_loss: 0.2927, test_loss: 1.8934, test_f1: 0.5647
 epoch: 88, train_loss: 0.2993, test_loss: 1.9756, test_f1: 0.6003
 epoch: 89, train_loss: 0.2918, test_loss: 2.0754, test_f1: 0.6027
 epoch: 90, train_loss: 0.2696, test_loss: 2.3021, test_f1: 0.6288
 epoch: 91, train_loss: 0.3009, test_loss: 2.3036, test_f1: 0.6296
 epoch: 92, train_loss: 0.3023, test_loss: 2.3090, test_f1: 0.6249
 epoch: 93, train_loss: 0.3187, test_loss: 1.8876, test_f1: 0.6164
 epoch: 94, train_loss: 0.3134, test_loss: 2.1541, test_f1: 0.5960
 epoch: 95, train_loss: 0.3208, test_loss: 2.0542, test_f1: 0.5606
 epoch: 96, train_loss: 0.3115, test_loss: 1.9669, test_f1: 0.5750
 epoch: 97, train_loss: 0.3000, test_loss: 2.0244, test_f1: 0.6005
 epoch: 98, train_loss: 0.2962, test_loss: 2.2937, test_f1: 0.6030
 epoch: 99, train_loss: 0.2572, test_loss: 2.3417, test_f1: 0.5592
##################ITERATION #3 ****************************************
 epoch: 0, train_loss: 1.6224, test_loss: 1.3971, test_f1: 0.1675
 epoch: 1, train_loss: 1.0608, test_loss: 1.4109, test_f1: 0.2397
 epoch: 2, train_loss: 1.0023, test_loss: 1.4398, test_f1: 0.2818
 epoch: 3, train_loss: 0.9572, test_loss: 1.1523, test_f1: 0.4592
 epoch: 4, train_loss: 0.9345, test_loss: 1.3016, test_f1: 0.5108
 epoch: 5, train_loss: 0.9248, test_loss: 1.2592, test_f1: 0.4798
 epoch: 6, train_loss: 0.9093, test_loss: 1.1536, test_f1: 0.4648
 epoch: 7, train_loss: 0.8954, test_loss: 1.1113, test_f1: 0.4315
 epoch: 8, train_loss: 0.8951, test_loss: 1.1096, test_f1: 0.5394
 epoch: 9, train_loss: 0.8698, test_loss: 1.1084, test_f1: 0.5570
 epoch: 10, train_loss: 0.8242, test_loss: 1.3679, test_f1: 0.4415
 epoch: 11, train_loss: 0.8122, test_loss: 1.2045, test_f1: 0.5322
 epoch: 12, train_loss: 0.8134, test_loss: 1.4674, test_f1: 0.3882
 epoch: 13, train_loss: 0.7656, test_loss: 1.0613, test_f1: 0.4808
 epoch: 14, train_loss: 0.7756, test_loss: 1.7533, test_f1: 0.3436
 epoch: 15, train_loss: 0.7749, test_loss: 1.8457, test_f1: 0.3665
 epoch: 16, train_loss: 0.7829, test_loss: 1.3203, test_f1: 0.4867
 epoch: 17, train_loss: 0.8206, test_loss: 1.3295, test_f1: 0.4809
 epoch: 18, train_loss: 0.7793, test_loss: 1.2133, test_f1: 0.4997
 epoch: 19, train_loss: 0.7787, test_loss: 1.1572, test_f1: 0.5000
 epoch: 20, train_loss: 0.7410, test_loss: 1.1189, test_f1: 0.5359
 epoch: 21, train_loss: 0.7133, test_loss: 1.0719, test_f1: 0.6178
 epoch: 22, train_loss: 0.6808, test_loss: 1.3267, test_f1: 0.4992
 epoch: 23, train_loss: 0.7190, test_loss: 1.3996, test_f1: 0.3902
 epoch: 24, train_loss: 0.7534, test_loss: 1.3233, test_f1: 0.4656
 epoch: 25, train_loss: 0.7000, test_loss: 1.3371, test_f1: 0.4881
 epoch: 26, train_loss: 0.6974, test_loss: 1.2074, test_f1: 0.5187
 epoch: 27, train_loss: 0.7426, test_loss: 2.5361, test_f1: 0.3186
 epoch: 28, train_loss: 0.7154, test_loss: 1.4229, test_f1: 0.5139
 epoch: 29, train_loss: 0.6746, test_loss: 1.3905, test_f1: 0.5058
 epoch: 30, train_loss: 0.6723, test_loss: 1.1936, test_f1: 0.5547
 epoch: 31, train_loss: 0.6293, test_loss: 1.4329, test_f1: 0.4844
 epoch: 32, train_loss: 0.6713, test_loss: 1.1169, test_f1: 0.5515
 epoch: 33, train_loss: 0.6341, test_loss: 1.2067, test_f1: 0.4636
 epoch: 34, train_loss: 0.6330, test_loss: 1.4895, test_f1: 0.5076
 epoch: 35, train_loss: 0.6560, test_loss: 1.4632, test_f1: 0.5719
 epoch: 36, train_loss: 0.6215, test_loss: 1.2271, test_f1: 0.5641
 epoch: 37, train_loss: 0.6049, test_loss: 1.4663, test_f1: 0.5591
 epoch: 38, train_loss: 0.5913, test_loss: 1.5286, test_f1: 0.5702
 epoch: 39, train_loss: 0.6542, test_loss: 1.4718, test_f1: 0.5251
 epoch: 40, train_loss: 0.6481, test_loss: 1.3418, test_f1: 0.5338
 epoch: 41, train_loss: 0.6461, test_loss: 1.3206, test_f1: 0.5391
 epoch: 42, train_loss: 0.6189, test_loss: 1.2839, test_f1: 0.5204
 epoch: 43, train_loss: 0.5890, test_loss: 1.3673, test_f1: 0.6049
 epoch: 44, train_loss: 0.5577, test_loss: 1.5449, test_f1: 0.5249
 epoch: 45, train_loss: 0.5687, test_loss: 1.3343, test_f1: 0.5057
 epoch: 46, train_loss: 0.5665, test_loss: 1.8154, test_f1: 0.5128
 epoch: 47, train_loss: 0.5951, test_loss: 1.4573, test_f1: 0.5713
 epoch: 48, train_loss: 0.5996, test_loss: 1.7393, test_f1: 0.4661
 epoch: 49, train_loss: 0.5926, test_loss: 2.2908, test_f1: 0.4728
 epoch: 50, train_loss: 0.5821, test_loss: 2.1203, test_f1: 0.5276
 epoch: 51, train_loss: 0.5403, test_loss: 1.6991, test_f1: 0.5556
 epoch: 52, train_loss: 0.5170, test_loss: 1.3821, test_f1: 0.6043
 epoch: 53, train_loss: 0.5045, test_loss: 1.4476, test_f1: 0.6331
 epoch: 54, train_loss: 0.4644, test_loss: 1.7630, test_f1: 0.5716
 epoch: 55, train_loss: 0.4714, test_loss: 2.0389, test_f1: 0.4872
 epoch: 56, train_loss: 0.4645, test_loss: 1.7338, test_f1: 0.6001
 epoch: 57, train_loss: 0.4387, test_loss: 1.7718, test_f1: 0.5992
 epoch: 58, train_loss: 0.4450, test_loss: 1.6941, test_f1: 0.5881
 epoch: 59, train_loss: 0.4271, test_loss: 2.0909, test_f1: 0.6019
 epoch: 60, train_loss: 0.4101, test_loss: 1.8186, test_f1: 0.5854
 epoch: 61, train_loss: 0.4666, test_loss: 3.0446, test_f1: 0.4024
 epoch: 62, train_loss: 0.4313, test_loss: 1.7542, test_f1: 0.5552
 epoch: 63, train_loss: 0.4325, test_loss: 1.8395, test_f1: 0.6172
 epoch: 64, train_loss: 0.4275, test_loss: 2.0203, test_f1: 0.4941
 epoch: 65, train_loss: 0.4316, test_loss: 1.9963, test_f1: 0.6086
 epoch: 66, train_loss: 0.4348, test_loss: 1.8613, test_f1: 0.5656
 epoch: 67, train_loss: 0.4838, test_loss: 2.0346, test_f1: 0.5168
 epoch: 68, train_loss: 0.4926, test_loss: 1.6620, test_f1: 0.5932
 epoch: 69, train_loss: 0.4489, test_loss: 1.7684, test_f1: 0.5824
 epoch: 70, train_loss: 0.4456, test_loss: 2.0258, test_f1: 0.5697
 epoch: 71, train_loss: 0.4167, test_loss: 1.3649, test_f1: 0.6241
 epoch: 72, train_loss: 0.4474, test_loss: 2.2218, test_f1: 0.5478
 epoch: 73, train_loss: 0.4814, test_loss: 1.9547, test_f1: 0.5641
 epoch: 74, train_loss: 0.4462, test_loss: 2.0741, test_f1: 0.5085
 epoch: 75, train_loss: 0.4344, test_loss: 1.7808, test_f1: 0.5940
 epoch: 76, train_loss: 0.3987, test_loss: 1.6652, test_f1: 0.5224
 epoch: 77, train_loss: 0.3955, test_loss: 1.6859, test_f1: 0.5494
 epoch: 78, train_loss: 0.3689, test_loss: 1.6584, test_f1: 0.6086
 epoch: 79, train_loss: 0.3814, test_loss: 2.4028, test_f1: 0.5436
 epoch: 80, train_loss: 0.4205, test_loss: 1.7142, test_f1: 0.5839
 epoch: 81, train_loss: 0.4402, test_loss: 1.7847, test_f1: 0.5734
 epoch: 82, train_loss: 0.4762, test_loss: 1.7051, test_f1: 0.5400
 epoch: 83, train_loss: 0.4254, test_loss: 1.8445, test_f1: 0.5977
 epoch: 84, train_loss: 0.4391, test_loss: 1.9579, test_f1: 0.5845
 epoch: 85, train_loss: 0.3683, test_loss: 1.9372, test_f1: 0.5236
 epoch: 86, train_loss: 0.3783, test_loss: 1.9595, test_f1: 0.5929
 epoch: 87, train_loss: 0.3281, test_loss: 2.0617, test_f1: 0.5883
 epoch: 88, train_loss: 0.3349, test_loss: 2.3498, test_f1: 0.5825
 epoch: 89, train_loss: 0.3304, test_loss: 2.3280, test_f1: 0.5938
 epoch: 90, train_loss: 0.3301, test_loss: 1.9849, test_f1: 0.5969
 epoch: 91, train_loss: 0.3423, test_loss: 2.4354, test_f1: 0.5468
 epoch: 92, train_loss: 0.3342, test_loss: 2.0481, test_f1: 0.6088
 epoch: 93, train_loss: 0.3280, test_loss: 1.9605, test_f1: 0.5856
 epoch: 94, train_loss: 0.3367, test_loss: 2.2402, test_f1: 0.5317
 epoch: 95, train_loss: 0.3595, test_loss: 2.3151, test_f1: 0.5752
 epoch: 96, train_loss: 0.4090, test_loss: 2.6072, test_f1: 0.5726
 epoch: 97, train_loss: 0.3852, test_loss: 2.1870, test_f1: 0.5648
 epoch: 98, train_loss: 0.3383, test_loss: 1.8275, test_f1: 0.5807
 epoch: 99, train_loss: 0.3353, test_loss: 2.0972, test_f1: 0.5293
##################ITERATION #4 ****************************************
 epoch: 0, train_loss: 1.2744, test_loss: 1.5329, test_f1: 0.1365
 epoch: 1, train_loss: 1.0214, test_loss: 1.4402, test_f1: 0.3334
 epoch: 2, train_loss: 0.9670, test_loss: 1.2156, test_f1: 0.3822
 epoch: 3, train_loss: 0.9644, test_loss: 1.2271, test_f1: 0.3149
 epoch: 4, train_loss: 0.9203, test_loss: 1.1418, test_f1: 0.4747
 epoch: 5, train_loss: 0.9163, test_loss: 1.0813, test_f1: 0.5239
 epoch: 6, train_loss: 0.9154, test_loss: 1.0630, test_f1: 0.4415
 epoch: 7, train_loss: 0.8967, test_loss: 1.0633, test_f1: 0.5167
 epoch: 8, train_loss: 0.8712, test_loss: 1.5967, test_f1: 0.3763
 epoch: 9, train_loss: 0.8674, test_loss: 1.1193, test_f1: 0.5162
 epoch: 10, train_loss: 0.8554, test_loss: 1.0346, test_f1: 0.5664
 epoch: 11, train_loss: 0.8209, test_loss: 1.0561, test_f1: 0.4483
 epoch: 12, train_loss: 0.8310, test_loss: 1.1116, test_f1: 0.4733
 epoch: 13, train_loss: 0.8430, test_loss: 1.0944, test_f1: 0.5094
 epoch: 14, train_loss: 0.8135, test_loss: 1.0323, test_f1: 0.5650
 epoch: 15, train_loss: 0.7758, test_loss: 1.1755, test_f1: 0.5314
 epoch: 16, train_loss: 0.7662, test_loss: 1.2214, test_f1: 0.4433
 epoch: 17, train_loss: 0.7536, test_loss: 1.3102, test_f1: 0.5044
 epoch: 18, train_loss: 0.7406, test_loss: 1.1133, test_f1: 0.4678
 epoch: 19, train_loss: 0.7387, test_loss: 1.2455, test_f1: 0.4688
 epoch: 20, train_loss: 0.7174, test_loss: 1.2717, test_f1: 0.6069
 epoch: 21, train_loss: 0.7303, test_loss: 1.2197, test_f1: 0.5719
 epoch: 22, train_loss: 0.7203, test_loss: 1.1242, test_f1: 0.5161
 epoch: 23, train_loss: 0.6863, test_loss: 1.2634, test_f1: 0.5602
 epoch: 24, train_loss: 0.6588, test_loss: 1.2100, test_f1: 0.6217
 epoch: 25, train_loss: 0.6681, test_loss: 1.2812, test_f1: 0.5361
 epoch: 26, train_loss: 0.7065, test_loss: 1.2280, test_f1: 0.5620
 epoch: 27, train_loss: 0.6650, test_loss: 1.3354, test_f1: 0.5536
 epoch: 28, train_loss: 0.6651, test_loss: 1.4048, test_f1: 0.5166
 epoch: 29, train_loss: 0.6636, test_loss: 1.6505, test_f1: 0.5450
 epoch: 30, train_loss: 0.6603, test_loss: 1.4273, test_f1: 0.4709
 epoch: 31, train_loss: 0.7139, test_loss: 1.4478, test_f1: 0.4529
 epoch: 32, train_loss: 0.6936, test_loss: 1.0795, test_f1: 0.5407
 epoch: 33, train_loss: 0.6824, test_loss: 1.2544, test_f1: 0.5624
 epoch: 34, train_loss: 0.6622, test_loss: 1.2318, test_f1: 0.5466
 epoch: 35, train_loss: 0.6574, test_loss: 1.3958, test_f1: 0.5483
 epoch: 36, train_loss: 0.6385, test_loss: 1.4560, test_f1: 0.5134
 epoch: 37, train_loss: 0.6193, test_loss: 1.2367, test_f1: 0.5517
 epoch: 38, train_loss: 0.6838, test_loss: 1.3533, test_f1: 0.5458
 epoch: 39, train_loss: 0.6384, test_loss: 1.1461, test_f1: 0.5828
 epoch: 40, train_loss: 0.7006, test_loss: 1.1461, test_f1: 0.5308
 epoch: 41, train_loss: 0.6308, test_loss: 1.1659, test_f1: 0.5659
 epoch: 42, train_loss: 0.5935, test_loss: 1.6888, test_f1: 0.5312
 epoch: 43, train_loss: 0.5605, test_loss: 1.5514, test_f1: 0.5443
 epoch: 44, train_loss: 0.6014, test_loss: 1.3607, test_f1: 0.5747
 epoch: 45, train_loss: 0.6692, test_loss: 1.1331, test_f1: 0.5376
 epoch: 46, train_loss: 0.6298, test_loss: 1.1111, test_f1: 0.4923
 epoch: 47, train_loss: 0.6166, test_loss: 1.1247, test_f1: 0.5233
 epoch: 48, train_loss: 0.6259, test_loss: 1.3051, test_f1: 0.6155
 epoch: 49, train_loss: 0.6300, test_loss: 1.1269, test_f1: 0.6080
 epoch: 50, train_loss: 0.5808, test_loss: 1.6674, test_f1: 0.4614
 epoch: 51, train_loss: 0.5560, test_loss: 1.2560, test_f1: 0.5615
 epoch: 52, train_loss: 0.5016, test_loss: 1.2434, test_f1: 0.5939
 epoch: 53, train_loss: 0.5361, test_loss: 1.5213, test_f1: 0.5442
 epoch: 54, train_loss: 0.5314, test_loss: 1.4297, test_f1: 0.5450
 epoch: 55, train_loss: 0.4871, test_loss: 1.3179, test_f1: 0.6029
 epoch: 56, train_loss: 0.4802, test_loss: 1.3359, test_f1: 0.6163
 epoch: 57, train_loss: 0.4643, test_loss: 1.3876, test_f1: 0.5737
 epoch: 58, train_loss: 0.4569, test_loss: 1.5017, test_f1: 0.5793
 epoch: 59, train_loss: 0.4442, test_loss: 1.6446, test_f1: 0.5773
 epoch: 60, train_loss: 0.4343, test_loss: 1.5549, test_f1: 0.5883
 epoch: 61, train_loss: 0.4220, test_loss: 1.5927, test_f1: 0.5552
 epoch: 62, train_loss: 0.3959, test_loss: 1.7382, test_f1: 0.5674
 epoch: 63, train_loss: 0.4081, test_loss: 1.6802, test_f1: 0.5930
 epoch: 64, train_loss: 0.3957, test_loss: 1.6508, test_f1: 0.5690
 epoch: 65, train_loss: 0.4000, test_loss: 1.5354, test_f1: 0.6340
 epoch: 66, train_loss: 0.4270, test_loss: 1.6128, test_f1: 0.5801
 epoch: 67, train_loss: 0.4235, test_loss: 1.4938, test_f1: 0.6174
 epoch: 68, train_loss: 0.3951, test_loss: 2.0502, test_f1: 0.4864
 epoch: 69, train_loss: 0.4100, test_loss: 1.6255, test_f1: 0.5978
 epoch: 70, train_loss: 0.3859, test_loss: 1.9255, test_f1: 0.5778
 epoch: 71, train_loss: 0.3657, test_loss: 1.9142, test_f1: 0.5814
 epoch: 72, train_loss: 0.3644, test_loss: 1.9849, test_f1: 0.5977
 epoch: 73, train_loss: 0.3936, test_loss: 1.9446, test_f1: 0.5440
 epoch: 74, train_loss: 0.3777, test_loss: 1.9279, test_f1: 0.5862
 epoch: 75, train_loss: 0.3871, test_loss: 1.9333, test_f1: 0.5601
 epoch: 76, train_loss: 0.3721, test_loss: 1.9187, test_f1: 0.5528
 epoch: 77, train_loss: 0.3925, test_loss: 1.8055, test_f1: 0.6013
 epoch: 78, train_loss: 0.3702, test_loss: 1.8709, test_f1: 0.5829
 epoch: 79, train_loss: 0.3758, test_loss: 2.0595, test_f1: 0.5792
 epoch: 80, train_loss: 0.3841, test_loss: 1.7906, test_f1: 0.6000
 epoch: 81, train_loss: 0.4236, test_loss: 1.9667, test_f1: 0.5940
 epoch: 82, train_loss: 0.3881, test_loss: 2.1815, test_f1: 0.5564
 epoch: 83, train_loss: 0.3681, test_loss: 1.9722, test_f1: 0.6115
 epoch: 84, train_loss: 0.3462, test_loss: 1.8782, test_f1: 0.5894
 epoch: 85, train_loss: 0.3372, test_loss: 2.1105, test_f1: 0.5681
 epoch: 86, train_loss: 0.3261, test_loss: 2.2717, test_f1: 0.5765
 epoch: 87, train_loss: 0.3238, test_loss: 1.9676, test_f1: 0.5883
 epoch: 88, train_loss: 0.3150, test_loss: 1.8756, test_f1: 0.5614
 epoch: 89, train_loss: 0.3171, test_loss: 2.1449, test_f1: 0.5994
 epoch: 90, train_loss: 0.3154, test_loss: 2.0916, test_f1: 0.5907
 epoch: 91, train_loss: 0.3016, test_loss: 2.0121, test_f1: 0.6245
 epoch: 92, train_loss: 0.4736, test_loss: 2.3663, test_f1: 0.5584
 epoch: 93, train_loss: 0.4339, test_loss: 2.1774, test_f1: 0.5567
 epoch: 94, train_loss: 0.4161, test_loss: 2.0584, test_f1: 0.6083
 epoch: 95, train_loss: 0.3755, test_loss: 2.2956, test_f1: 0.5874
 epoch: 96, train_loss: 0.3792, test_loss: 2.4976, test_f1: 0.5603
 epoch: 97, train_loss: 0.3850, test_loss: 2.3437, test_f1: 0.5610
 epoch: 98, train_loss: 0.3524, test_loss: 13.2517, test_f1: 0.4847
 epoch: 99, train_loss: 0.3122, test_loss: 2.1101, test_f1: 0.6117
##################ITERATION #5 ****************************************
 epoch: 0, train_loss: 1.3316, test_loss: 1.3156, test_f1: 0.2556
 epoch: 1, train_loss: 1.0756, test_loss: 1.3367, test_f1: 0.3572
 epoch: 2, train_loss: 0.9773, test_loss: 1.1999, test_f1: 0.4494
 epoch: 3, train_loss: 0.9596, test_loss: 1.1390, test_f1: 0.4725
 epoch: 4, train_loss: 0.9341, test_loss: 1.0894, test_f1: 0.4683
 epoch: 5, train_loss: 0.9011, test_loss: 1.0487, test_f1: 0.5185
 epoch: 6, train_loss: 0.8844, test_loss: 1.1694, test_f1: 0.4441
 epoch: 7, train_loss: 0.8766, test_loss: 1.1218, test_f1: 0.4565
 epoch: 8, train_loss: 0.8896, test_loss: 0.9845, test_f1: 0.4768
 epoch: 9, train_loss: 0.8480, test_loss: 0.9893, test_f1: 0.5555
 epoch: 10, train_loss: 0.8325, test_loss: 1.0690, test_f1: 0.5223
 epoch: 11, train_loss: 0.8127, test_loss: 1.1240, test_f1: 0.5063
 epoch: 12, train_loss: 0.7728, test_loss: 0.9492, test_f1: 0.5573
 epoch: 13, train_loss: 0.7789, test_loss: 1.0284, test_f1: 0.5063
 epoch: 14, train_loss: 0.7478, test_loss: 2.6552, test_f1: 0.3154
 epoch: 15, train_loss: 0.7375, test_loss: 1.4697, test_f1: 0.4740
 epoch: 16, train_loss: 0.7437, test_loss: 1.6449, test_f1: 0.4029
 epoch: 17, train_loss: 0.7610, test_loss: 1.3746, test_f1: 0.4651
 epoch: 18, train_loss: 0.7501, test_loss: 1.1607, test_f1: 0.5264
 epoch: 19, train_loss: 0.7361, test_loss: 1.2233, test_f1: 0.4713
 epoch: 20, train_loss: 0.7534, test_loss: 0.9853, test_f1: 0.6603
 epoch: 21, train_loss: 0.7054, test_loss: 1.1211, test_f1: 0.5261
 epoch: 22, train_loss: 0.6904, test_loss: 1.1546, test_f1: 0.6060
 epoch: 23, train_loss: 0.6481, test_loss: 1.1632, test_f1: 0.5356
 epoch: 24, train_loss: 0.6371, test_loss: 1.9112, test_f1: 0.4628
 epoch: 25, train_loss: 0.7068, test_loss: 1.1318, test_f1: 0.5249
 epoch: 26, train_loss: 0.6656, test_loss: 1.6091, test_f1: 0.4203
 epoch: 27, train_loss: 0.6840, test_loss: 1.3054, test_f1: 0.5868
 epoch: 28, train_loss: 0.6337, test_loss: 1.4175, test_f1: 0.5285
 epoch: 29, train_loss: 0.6244, test_loss: 1.0348, test_f1: 0.6195
 epoch: 30, train_loss: 0.6331, test_loss: 1.5219, test_f1: 0.5147
 epoch: 31, train_loss: 0.6158, test_loss: 1.3592, test_f1: 0.5721
 epoch: 32, train_loss: 0.6146, test_loss: 2.2338, test_f1: 0.4945
 epoch: 33, train_loss: 0.6337, test_loss: 1.2652, test_f1: 0.5704
 epoch: 34, train_loss: 0.6335, test_loss: 1.2880, test_f1: 0.5229
 epoch: 35, train_loss: 0.5854, test_loss: 1.3325, test_f1: 0.5643
 epoch: 36, train_loss: 0.5945, test_loss: 1.1903, test_f1: 0.6384
 epoch: 37, train_loss: 0.5536, test_loss: 1.5804, test_f1: 0.5643
 epoch: 38, train_loss: 0.5418, test_loss: 1.5617, test_f1: 0.5924
 epoch: 39, train_loss: 0.5384, test_loss: 1.5540, test_f1: 0.6057
 epoch: 40, train_loss: 0.5303, test_loss: 1.6320, test_f1: 0.5236
 epoch: 41, train_loss: 0.5393, test_loss: 2.0568, test_f1: 0.5318
 epoch: 42, train_loss: 0.5218, test_loss: 2.9169, test_f1: 0.5545
 epoch: 43, train_loss: 0.5359, test_loss: 1.6080, test_f1: 0.5370
 epoch: 44, train_loss: 0.5436, test_loss: 1.2849, test_f1: 0.6402
 epoch: 45, train_loss: 0.5831, test_loss: 1.1743, test_f1: 0.5732
 epoch: 46, train_loss: 0.5775, test_loss: 1.3028, test_f1: 0.5713
 epoch: 47, train_loss: 0.5709, test_loss: 1.4136, test_f1: 0.5328
 epoch: 48, train_loss: 0.5347, test_loss: 1.4455, test_f1: 0.5761
 epoch: 49, train_loss: 0.4867, test_loss: 1.3757, test_f1: 0.5951
 epoch: 50, train_loss: 0.4802, test_loss: 1.8275, test_f1: 0.5589
 epoch: 51, train_loss: 0.4728, test_loss: 1.4436, test_f1: 0.5731
 epoch: 52, train_loss: 0.4664, test_loss: 1.4754, test_f1: 0.5792
 epoch: 53, train_loss: 0.4051, test_loss: 1.4410, test_f1: 0.6243
 epoch: 54, train_loss: 0.3850, test_loss: 1.4997, test_f1: 0.6010
 epoch: 55, train_loss: 0.3869, test_loss: 1.4689, test_f1: 0.5426
 epoch: 56, train_loss: 0.4081, test_loss: 1.4838, test_f1: 0.6028
 epoch: 57, train_loss: 0.4049, test_loss: 1.8107, test_f1: 0.6086
 epoch: 58, train_loss: 0.3978, test_loss: 1.8740, test_f1: 0.5826
 epoch: 59, train_loss: 0.3731, test_loss: 2.0053, test_f1: 0.4892
 epoch: 60, train_loss: 0.3827, test_loss: 2.3795, test_f1: 0.5555
 epoch: 61, train_loss: 0.3871, test_loss: 1.7072, test_f1: 0.6185
 epoch: 62, train_loss: 0.3556, test_loss: 1.6093, test_f1: 0.5708
 epoch: 63, train_loss: 0.3955, test_loss: 2.2256, test_f1: 0.6032
 epoch: 64, train_loss: 0.3472, test_loss: 1.7036, test_f1: 0.5914
 epoch: 65, train_loss: 0.3420, test_loss: 1.8757, test_f1: 0.5722
 epoch: 66, train_loss: 0.3548, test_loss: 1.8117, test_f1: 0.5805
 epoch: 67, train_loss: 0.3432, test_loss: 1.9224, test_f1: 0.5641
 epoch: 68, train_loss: 0.3264, test_loss: 2.5517, test_f1: 0.5365
 epoch: 69, train_loss: 0.3684, test_loss: 1.9868, test_f1: 0.4781
 epoch: 70, train_loss: 0.3595, test_loss: 1.5862, test_f1: 0.6243
 epoch: 71, train_loss: 0.3304, test_loss: 1.6504, test_f1: 0.5961
 epoch: 72, train_loss: 0.3159, test_loss: 1.8332, test_f1: 0.5886
 epoch: 73, train_loss: 0.3053, test_loss: 1.7873, test_f1: 0.6341
 epoch: 74, train_loss: 0.3256, test_loss: 1.8327, test_f1: 0.5788
 epoch: 75, train_loss: 0.3180, test_loss: 1.7505, test_f1: 0.5998
 epoch: 76, train_loss: 0.3140, test_loss: 1.8043, test_f1: 0.5928
 epoch: 77, train_loss: 0.3160, test_loss: 2.2218, test_f1: 0.6050
 epoch: 78, train_loss: 0.3335, test_loss: 2.0680, test_f1: 0.5990
 epoch: 79, train_loss: 0.3314, test_loss: 1.7716, test_f1: 0.6317
 epoch: 80, train_loss: 0.2908, test_loss: 2.0620, test_f1: 0.6190
 epoch: 81, train_loss: 0.2807, test_loss: 2.2596, test_f1: 0.5990
 epoch: 82, train_loss: 0.2964, test_loss: 2.3736, test_f1: 0.5592
 epoch: 83, train_loss: 0.3341, test_loss: 2.0008, test_f1: 0.5747
 epoch: 84, train_loss: 0.3127, test_loss: 2.2518, test_f1: 0.5576
 epoch: 85, train_loss: 0.3211, test_loss: 2.0960, test_f1: 0.5695
 epoch: 86, train_loss: 0.2933, test_loss: 1.9243, test_f1: 0.6018
 epoch: 87, train_loss: 0.2920, test_loss: 1.8819, test_f1: 0.5469
 epoch: 88, train_loss: 0.2755, test_loss: 2.0464, test_f1: 0.6465
 epoch: 89, train_loss: 0.2915, test_loss: 2.3884, test_f1: 0.6190
 epoch: 90, train_loss: 0.2706, test_loss: 2.1344, test_f1: 0.5954
 epoch: 91, train_loss: 0.2943, test_loss: 1.9240, test_f1: 0.6194
 epoch: 92, train_loss: 0.3500, test_loss: 1.9009, test_f1: 0.6373
 epoch: 93, train_loss: 0.2708, test_loss: 2.1251, test_f1: 0.6090
 epoch: 94, train_loss: 0.2732, test_loss: 2.1213, test_f1: 0.5888
 epoch: 95, train_loss: 0.3102, test_loss: 1.9368, test_f1: 0.5170
 epoch: 96, train_loss: 0.3375, test_loss: 1.8872, test_f1: 0.5826
 epoch: 97, train_loss: 0.3069, test_loss: 1.6981, test_f1: 0.6260
 epoch: 98, train_loss: 0.2805, test_loss: 1.7636, test_f1: 0.6301
 epoch: 99, train_loss: 0.2423, test_loss: 1.7789, test_f1: 0.6404
##################ITERATION #6 ****************************************
 epoch: 0, train_loss: 1.3916, test_loss: 1.7974, test_f1: 0.2281
 epoch: 1, train_loss: 1.1395, test_loss: 1.6994, test_f1: 0.1980
 epoch: 2, train_loss: 1.0199, test_loss: 1.9158, test_f1: 0.1347
 epoch: 3, train_loss: 0.9824, test_loss: 1.3211, test_f1: 0.3314
 epoch: 4, train_loss: 0.9590, test_loss: 1.2028, test_f1: 0.4531
 epoch: 5, train_loss: 0.9400, test_loss: 1.2189, test_f1: 0.4595
 epoch: 6, train_loss: 0.9161, test_loss: 1.2350, test_f1: 0.4474
 epoch: 7, train_loss: 0.9146, test_loss: 1.0297, test_f1: 0.5453
 epoch: 8, train_loss: 0.9000, test_loss: 1.1117, test_f1: 0.5115
 epoch: 9, train_loss: 0.8913, test_loss: 1.1050, test_f1: 0.4882
 epoch: 10, train_loss: 0.8863, test_loss: 1.1281, test_f1: 0.4485
 epoch: 11, train_loss: 0.8596, test_loss: 1.0386, test_f1: 0.5257
 epoch: 12, train_loss: 0.8478, test_loss: 1.0779, test_f1: 0.4991
 epoch: 13, train_loss: 0.8420, test_loss: 1.0161, test_f1: 0.5669
 epoch: 14, train_loss: 0.8441, test_loss: 2.2756, test_f1: 0.3684
 epoch: 15, train_loss: 0.8166, test_loss: 1.1660, test_f1: 0.4903
 epoch: 16, train_loss: 0.8078, test_loss: 1.0333, test_f1: 0.5727
 epoch: 17, train_loss: 0.7772, test_loss: 1.1456, test_f1: 0.5749
 epoch: 18, train_loss: 0.7585, test_loss: 1.0893, test_f1: 0.5082
 epoch: 19, train_loss: 0.7403, test_loss: 1.1834, test_f1: 0.5086
 epoch: 20, train_loss: 0.7262, test_loss: 1.2115, test_f1: 0.5361
 epoch: 21, train_loss: 0.6977, test_loss: 1.1007, test_f1: 0.6140
 epoch: 22, train_loss: 0.7316, test_loss: 1.3592, test_f1: 0.4543
 epoch: 23, train_loss: 0.7012, test_loss: 1.3925, test_f1: 0.4625
 epoch: 24, train_loss: 0.7007, test_loss: 1.1323, test_f1: 0.5894
 epoch: 25, train_loss: 0.6676, test_loss: 1.0688, test_f1: 0.6152
 epoch: 26, train_loss: 0.6457, test_loss: 2.2064, test_f1: 0.5311
 epoch: 27, train_loss: 0.6670, test_loss: 1.3171, test_f1: 0.5194
 epoch: 28, train_loss: 0.6208, test_loss: 1.3398, test_f1: 0.5325
 epoch: 29, train_loss: 0.6473, test_loss: 1.1663, test_f1: 0.5594
 epoch: 30, train_loss: 0.6363, test_loss: 1.5167, test_f1: 0.5033
 epoch: 31, train_loss: 0.6834, test_loss: 1.2818, test_f1: 0.5527
 epoch: 32, train_loss: 0.7356, test_loss: 1.2697, test_f1: 0.5096
 epoch: 33, train_loss: 0.6763, test_loss: 1.2691, test_f1: 0.5278
 epoch: 34, train_loss: 0.6463, test_loss: 1.1734, test_f1: 0.5737
 epoch: 35, train_loss: 0.6388, test_loss: 1.2116, test_f1: 0.4836
 epoch: 36, train_loss: 0.6418, test_loss: 1.1414, test_f1: 0.5432
 epoch: 37, train_loss: 0.6295, test_loss: 1.1737, test_f1: 0.5300
 epoch: 38, train_loss: 0.6448, test_loss: 1.3682, test_f1: 0.5143
 epoch: 39, train_loss: 0.6468, test_loss: 1.3605, test_f1: 0.4831
 epoch: 40, train_loss: 0.6328, test_loss: 1.1729, test_f1: 0.5814
 epoch: 41, train_loss: 0.6303, test_loss: 1.2505, test_f1: 0.5077
 epoch: 42, train_loss: 0.5879, test_loss: 1.3433, test_f1: 0.5567
 epoch: 43, train_loss: 0.5939, test_loss: 1.5331, test_f1: 0.5822
 epoch: 44, train_loss: 0.6042, test_loss: 1.1912, test_f1: 0.5729
 epoch: 45, train_loss: 0.6085, test_loss: 1.4314, test_f1: 0.4528
 epoch: 46, train_loss: 0.5921, test_loss: 1.8539, test_f1: 0.5016
 epoch: 47, train_loss: 0.5967, test_loss: 2.0985, test_f1: 0.4509
 epoch: 48, train_loss: 0.6795, test_loss: 1.5681, test_f1: 0.5274
 epoch: 49, train_loss: 0.6785, test_loss: 1.1883, test_f1: 0.5813
 epoch: 50, train_loss: 0.6292, test_loss: 1.3375, test_f1: 0.6178
 epoch: 51, train_loss: 0.5848, test_loss: 1.2792, test_f1: 0.6352
 epoch: 52, train_loss: 0.5339, test_loss: 1.2369, test_f1: 0.6405
 epoch: 53, train_loss: 0.5244, test_loss: 1.5341, test_f1: 0.5102
 epoch: 54, train_loss: 0.5141, test_loss: 1.1862, test_f1: 0.6514
 epoch: 55, train_loss: 0.4849, test_loss: 1.3089, test_f1: 0.5642
 epoch: 56, train_loss: 0.4713, test_loss: 1.3416, test_f1: 0.6288
 epoch: 57, train_loss: 0.4652, test_loss: 1.3654, test_f1: 0.5938
 epoch: 58, train_loss: 0.4572, test_loss: 1.3419, test_f1: 0.6234
 epoch: 59, train_loss: 0.4542, test_loss: 1.5805, test_f1: 0.6313
 epoch: 60, train_loss: 0.4354, test_loss: 1.8003, test_f1: 0.6134
 epoch: 61, train_loss: 0.4154, test_loss: 2.3423, test_f1: 0.5307
 epoch: 62, train_loss: 0.5362, test_loss: 1.8195, test_f1: 0.5072
 epoch: 63, train_loss: 0.4523, test_loss: 1.4657, test_f1: 0.5607
 epoch: 64, train_loss: 0.4625, test_loss: 1.4310, test_f1: 0.6354
 epoch: 65, train_loss: 0.4431, test_loss: 1.5395, test_f1: 0.6411
 epoch: 66, train_loss: 0.4086, test_loss: 1.7189, test_f1: 0.6236
 epoch: 67, train_loss: 0.4207, test_loss: 1.8604, test_f1: 0.5623
 epoch: 68, train_loss: 0.3852, test_loss: 1.9533, test_f1: 0.5702
 epoch: 69, train_loss: 0.3882, test_loss: 2.0207, test_f1: 0.5978
 epoch: 70, train_loss: 0.3945, test_loss: 1.9152, test_f1: 0.5982
 epoch: 71, train_loss: 0.3816, test_loss: 1.6805, test_f1: 0.6133
 epoch: 72, train_loss: 0.3702, test_loss: 1.7193, test_f1: 0.6002
 epoch: 73, train_loss: 0.3568, test_loss: 1.9880, test_f1: 0.5808
 epoch: 74, train_loss: 0.4188, test_loss: 2.0080, test_f1: 0.5469
 epoch: 75, train_loss: 0.4415, test_loss: 2.1964, test_f1: 0.5399
 epoch: 76, train_loss: 0.4214, test_loss: 2.1124, test_f1: 0.5360
 epoch: 77, train_loss: 0.3987, test_loss: 1.9404, test_f1: 0.6314
 epoch: 78, train_loss: 0.3459, test_loss: 1.7353, test_f1: 0.6315
 epoch: 79, train_loss: 0.3543, test_loss: 1.8630, test_f1: 0.6020
 epoch: 80, train_loss: 0.3439, test_loss: 2.3246, test_f1: 0.6039
 epoch: 81, train_loss: 0.4145, test_loss: 2.1915, test_f1: 0.5080
 epoch: 82, train_loss: 0.4222, test_loss: 1.9294, test_f1: 0.5963
 epoch: 83, train_loss: 0.3993, test_loss: 1.9532, test_f1: 0.5498
 epoch: 84, train_loss: 0.3378, test_loss: 2.1074, test_f1: 0.4999
 epoch: 85, train_loss: 0.3161, test_loss: 2.0469, test_f1: 0.5873
 epoch: 86, train_loss: 0.3307, test_loss: 2.2607, test_f1: 0.5815
 epoch: 87, train_loss: 0.3696, test_loss: 2.0000, test_f1: 0.6442
 epoch: 88, train_loss: 0.3378, test_loss: 1.9785, test_f1: 0.5609
 epoch: 89, train_loss: 0.3012, test_loss: 1.9393, test_f1: 0.5724
 epoch: 90, train_loss: 0.3267, test_loss: 2.5488, test_f1: 0.5918
 epoch: 91, train_loss: 0.4031, test_loss: 2.7120, test_f1: 0.5051
 epoch: 92, train_loss: 0.3405, test_loss: 2.1923, test_f1: 0.5389
 epoch: 93, train_loss: 0.3817, test_loss: 2.3258, test_f1: 0.5932
 epoch: 94, train_loss: 0.3370, test_loss: 1.7962, test_f1: 0.5826
 epoch: 95, train_loss: 0.3256, test_loss: 2.0627, test_f1: 0.5532
 epoch: 96, train_loss: 0.3111, test_loss: 1.9423, test_f1: 0.5817
 epoch: 97, train_loss: 0.2843, test_loss: 1.8311, test_f1: 0.6388
 epoch: 98, train_loss: 0.2833, test_loss: 1.8010, test_f1: 0.6420
 epoch: 99, train_loss: 0.3219, test_loss: 1.9441, test_f1: 0.6488
##################ITERATION #7 ****************************************
 epoch: 0, train_loss: 1.4121, test_loss: 1.3729, test_f1: 0.2406
 epoch: 1, train_loss: 1.0499, test_loss: 1.3119, test_f1: 0.2339
 epoch: 2, train_loss: 1.0185, test_loss: 1.2060, test_f1: 0.2384
 epoch: 3, train_loss: 0.9704, test_loss: 1.1527, test_f1: 0.3890
 epoch: 4, train_loss: 0.9358, test_loss: 1.0790, test_f1: 0.4604
 epoch: 5, train_loss: 0.9295, test_loss: 1.2135, test_f1: 0.4767
 epoch: 6, train_loss: 0.9250, test_loss: 1.1059, test_f1: 0.4227
 epoch: 7, train_loss: 0.8773, test_loss: 1.3200, test_f1: 0.4550
 epoch: 8, train_loss: 0.8788, test_loss: 1.7385, test_f1: 0.4463
 epoch: 9, train_loss: 0.9052, test_loss: 1.0937, test_f1: 0.5243
 epoch: 10, train_loss: 0.8500, test_loss: 1.2152, test_f1: 0.5314
 epoch: 11, train_loss: 0.8443, test_loss: 1.1446, test_f1: 0.4428
 epoch: 12, train_loss: 0.8215, test_loss: 1.1077, test_f1: 0.5336
 epoch: 13, train_loss: 0.7826, test_loss: 1.1609, test_f1: 0.5525
 epoch: 14, train_loss: 0.7494, test_loss: 1.0856, test_f1: 0.5034
 epoch: 15, train_loss: 0.7854, test_loss: 2.1026, test_f1: 0.4053
 epoch: 16, train_loss: 0.7702, test_loss: 1.2743, test_f1: 0.4944
 epoch: 17, train_loss: 0.8123, test_loss: 1.5255, test_f1: 0.4089
 epoch: 18, train_loss: 0.7638, test_loss: 1.1510, test_f1: 0.4398
 epoch: 19, train_loss: 0.7184, test_loss: 1.1113, test_f1: 0.5648
 epoch: 20, train_loss: 0.6987, test_loss: 1.1856, test_f1: 0.5376
 epoch: 21, train_loss: 0.6936, test_loss: 1.2278, test_f1: 0.5425
 epoch: 22, train_loss: 0.7319, test_loss: 1.3027, test_f1: 0.5471
 epoch: 23, train_loss: 0.7131, test_loss: 1.1257, test_f1: 0.5236
 epoch: 24, train_loss: 0.6889, test_loss: 1.3207, test_f1: 0.4758
 epoch: 25, train_loss: 0.6477, test_loss: 1.2843, test_f1: 0.4935
 epoch: 26, train_loss: 0.6380, test_loss: 1.8349, test_f1: 0.4872
 epoch: 27, train_loss: 0.6516, test_loss: 1.3031, test_f1: 0.5174
 epoch: 28, train_loss: 0.6696, test_loss: 1.5261, test_f1: 0.5251
 epoch: 29, train_loss: 0.6660, test_loss: 1.2126, test_f1: 0.5927
 epoch: 30, train_loss: 0.6963, test_loss: 2.6257, test_f1: 0.4679
 epoch: 31, train_loss: 0.6763, test_loss: 1.9623, test_f1: 0.4087
 epoch: 32, train_loss: 0.6457, test_loss: 2.4262, test_f1: 0.4441
 epoch: 33, train_loss: 0.6283, test_loss: 1.5389, test_f1: 0.5901
 epoch: 34, train_loss: 0.6710, test_loss: 2.0674, test_f1: 0.5161
 epoch: 35, train_loss: 0.6773, test_loss: 1.1368, test_f1: 0.5886
 epoch: 36, train_loss: 0.6737, test_loss: 1.2666, test_f1: 0.5056
 epoch: 37, train_loss: 0.6444, test_loss: 1.1134, test_f1: 0.5995
 epoch: 38, train_loss: 0.6316, test_loss: 1.1584, test_f1: 0.5660
 epoch: 39, train_loss: 0.5769, test_loss: 1.4504, test_f1: 0.6130
 epoch: 40, train_loss: 0.5576, test_loss: 1.4765, test_f1: 0.5897
 epoch: 41, train_loss: 0.6321, test_loss: 1.7039, test_f1: 0.4892
 epoch: 42, train_loss: 0.6116, test_loss: 1.3818, test_f1: 0.6114
 epoch: 43, train_loss: 0.5910, test_loss: 1.6278, test_f1: 0.5133
 epoch: 44, train_loss: 0.5997, test_loss: 1.3577, test_f1: 0.5783
 epoch: 45, train_loss: 0.5812, test_loss: 1.3072, test_f1: 0.5673
 epoch: 46, train_loss: 0.6210, test_loss: 1.4358, test_f1: 0.5608
 epoch: 47, train_loss: 0.6640, test_loss: 1.4912, test_f1: 0.5275
 epoch: 48, train_loss: 0.5947, test_loss: 2.0646, test_f1: 0.4909
 epoch: 49, train_loss: 0.5980, test_loss: 2.3700, test_f1: 0.4856
 epoch: 50, train_loss: 0.5961, test_loss: 1.5936, test_f1: 0.5771
 epoch: 51, train_loss: 0.5451, test_loss: 1.5015, test_f1: 0.5480
 epoch: 52, train_loss: 0.5415, test_loss: 1.4348, test_f1: 0.5894
 epoch: 53, train_loss: 0.5210, test_loss: 1.3426, test_f1: 0.6517
 epoch: 54, train_loss: 0.5189, test_loss: 1.5169, test_f1: 0.6057
 epoch: 55, train_loss: 0.4771, test_loss: 1.5081, test_f1: 0.5988
 epoch: 56, train_loss: 0.4834, test_loss: 1.3651, test_f1: 0.6294
 epoch: 57, train_loss: 0.4800, test_loss: 1.6952, test_f1: 0.5810
 epoch: 58, train_loss: 0.4721, test_loss: 1.6488, test_f1: 0.5945
 epoch: 59, train_loss: 0.4135, test_loss: 1.6496, test_f1: 0.6094
 epoch: 60, train_loss: 0.4003, test_loss: 1.7487, test_f1: 0.6095
 epoch: 61, train_loss: 0.3811, test_loss: 1.8537, test_f1: 0.5719
 epoch: 62, train_loss: 0.3851, test_loss: 1.6957, test_f1: 0.5956
 epoch: 63, train_loss: 0.3689, test_loss: 2.1230, test_f1: 0.6128
 epoch: 64, train_loss: 0.4057, test_loss: 2.0228, test_f1: 0.5397
 epoch: 65, train_loss: 0.4505, test_loss: 1.8128, test_f1: 0.5929
 epoch: 66, train_loss: 0.4701, test_loss: 2.0229, test_f1: 0.6069
 epoch: 67, train_loss: 0.4614, test_loss: 2.5167, test_f1: 0.5464
 epoch: 68, train_loss: 0.4253, test_loss: 2.8925, test_f1: 0.4647
 epoch: 69, train_loss: 0.4093, test_loss: 2.0640, test_f1: 0.5809
 epoch: 70, train_loss: 0.4127, test_loss: 1.7524, test_f1: 0.6053
 epoch: 71, train_loss: 0.3987, test_loss: 1.7818, test_f1: 0.6362
 epoch: 72, train_loss: 0.4404, test_loss: 1.6551, test_f1: 0.6231
 epoch: 73, train_loss: 0.4026, test_loss: 1.9333, test_f1: 0.6320
 epoch: 74, train_loss: 0.4070, test_loss: 1.7560, test_f1: 0.5727
 epoch: 75, train_loss: 0.4459, test_loss: 1.8074, test_f1: 0.6032
 epoch: 76, train_loss: 0.3701, test_loss: 1.8964, test_f1: 0.5635
 epoch: 77, train_loss: 0.3729, test_loss: 1.7784, test_f1: 0.6032
 epoch: 78, train_loss: 0.4631, test_loss: 2.4101, test_f1: 0.5365
 epoch: 79, train_loss: 0.4350, test_loss: 2.4024, test_f1: 0.5352
 epoch: 80, train_loss: 0.4156, test_loss: 1.9112, test_f1: 0.5789
 epoch: 81, train_loss: 0.3565, test_loss: 1.8314, test_f1: 0.6186
 epoch: 82, train_loss: 0.3486, test_loss: 1.9184, test_f1: 0.5652
 epoch: 83, train_loss: 0.3246, test_loss: 2.0330, test_f1: 0.5896
 epoch: 84, train_loss: 0.3111, test_loss: 2.0670, test_f1: 0.5938
 epoch: 85, train_loss: 0.3215, test_loss: 1.9081, test_f1: 0.6124
 epoch: 86, train_loss: 0.3267, test_loss: 2.2375, test_f1: 0.5774
 epoch: 87, train_loss: 0.2880, test_loss: 2.1817, test_f1: 0.5919
 epoch: 88, train_loss: 0.3046, test_loss: 2.0925, test_f1: 0.5824
 epoch: 89, train_loss: 0.3100, test_loss: 2.5916, test_f1: 0.5571
 epoch: 90, train_loss: 0.3088, test_loss: 1.9602, test_f1: 0.5939
 epoch: 91, train_loss: 0.3779, test_loss: 2.0262, test_f1: 0.5944
 epoch: 92, train_loss: 0.3508, test_loss: 2.5175, test_f1: 0.5703
 epoch: 93, train_loss: 0.3654, test_loss: 1.9442, test_f1: 0.6165
 epoch: 94, train_loss: 0.3569, test_loss: 1.9152, test_f1: 0.5517
 epoch: 95, train_loss: 0.3894, test_loss: 2.0406, test_f1: 0.5385
 epoch: 96, train_loss: 0.3669, test_loss: 1.7104, test_f1: 0.5874
 epoch: 97, train_loss: 0.3180, test_loss: 1.8909, test_f1: 0.5759
 epoch: 98, train_loss: 0.3066, test_loss: 1.8781, test_f1: 0.6294
 epoch: 99, train_loss: 0.3330, test_loss: 2.2119, test_f1: 0.6301
##################ITERATION #8 ****************************************
 epoch: 0, train_loss: 1.2612, test_loss: 1.4563, test_f1: 0.3392
 epoch: 1, train_loss: 1.0553, test_loss: 1.3490, test_f1: 0.2894
 epoch: 2, train_loss: 0.9795, test_loss: 1.1579, test_f1: 0.4422
 epoch: 3, train_loss: 0.9474, test_loss: 1.0477, test_f1: 0.5113
 epoch: 4, train_loss: 0.9478, test_loss: 1.0687, test_f1: 0.4395
 epoch: 5, train_loss: 0.9206, test_loss: 1.0349, test_f1: 0.5277
 epoch: 6, train_loss: 0.9015, test_loss: 1.0119, test_f1: 0.5563
 epoch: 7, train_loss: 0.8738, test_loss: 0.9917, test_f1: 0.5785
 epoch: 8, train_loss: 0.8661, test_loss: 1.0467, test_f1: 0.5384
 epoch: 9, train_loss: 0.8594, test_loss: 1.1894, test_f1: 0.4766
 epoch: 10, train_loss: 0.8619, test_loss: 1.1007, test_f1: 0.4320
 epoch: 11, train_loss: 0.8696, test_loss: 1.0485, test_f1: 0.5548
 epoch: 12, train_loss: 0.8225, test_loss: 1.1596, test_f1: 0.5379
 epoch: 13, train_loss: 0.8108, test_loss: 1.1420, test_f1: 0.4859
 epoch: 14, train_loss: 0.7846, test_loss: 1.1225, test_f1: 0.5142
 epoch: 15, train_loss: 0.7620, test_loss: 1.0406, test_f1: 0.4945
 epoch: 16, train_loss: 0.7368, test_loss: 1.1989, test_f1: 0.5175
 epoch: 17, train_loss: 0.7499, test_loss: 1.2279, test_f1: 0.5213
 epoch: 18, train_loss: 0.7476, test_loss: 1.1193, test_f1: 0.5387
 epoch: 19, train_loss: 0.7472, test_loss: 1.2259, test_f1: 0.5015
 epoch: 20, train_loss: 0.7137, test_loss: 1.3550, test_f1: 0.4871
 epoch: 21, train_loss: 0.7100, test_loss: 1.1620, test_f1: 0.5608
 epoch: 22, train_loss: 0.7234, test_loss: 1.5809, test_f1: 0.4330
 epoch: 23, train_loss: 0.7249, test_loss: 1.2325, test_f1: 0.4795
 epoch: 24, train_loss: 0.7027, test_loss: 1.2830, test_f1: 0.4977
 epoch: 25, train_loss: 0.7056, test_loss: 1.2465, test_f1: 0.5346
 epoch: 26, train_loss: 0.7130, test_loss: 1.2443, test_f1: 0.5243
 epoch: 27, train_loss: 0.6766, test_loss: 2.0282, test_f1: 0.4001
 epoch: 28, train_loss: 0.6927, test_loss: 1.4361, test_f1: 0.5242
 epoch: 29, train_loss: 0.6896, test_loss: 1.3974, test_f1: 0.5653
 epoch: 30, train_loss: 0.6484, test_loss: 1.2646, test_f1: 0.5824
 epoch: 31, train_loss: 0.6336, test_loss: 1.8003, test_f1: 0.5234
 epoch: 32, train_loss: 0.6382, test_loss: 2.0472, test_f1: 0.4979
 epoch: 33, train_loss: 0.6091, test_loss: 1.4173, test_f1: 0.5284
 epoch: 34, train_loss: 0.6211, test_loss: 1.5983, test_f1: 0.5018
 epoch: 35, train_loss: 0.6189, test_loss: 1.7700, test_f1: 0.4549
 epoch: 36, train_loss: 0.6006, test_loss: 1.2544, test_f1: 0.5201
 epoch: 37, train_loss: 0.5964, test_loss: 1.2556, test_f1: 0.5352
 epoch: 38, train_loss: 0.6314, test_loss: 1.2706, test_f1: 0.5012
 epoch: 39, train_loss: 0.6344, test_loss: 1.9945, test_f1: 0.5123
 epoch: 40, train_loss: 0.6331, test_loss: 2.6501, test_f1: 0.4612
 epoch: 41, train_loss: 0.5973, test_loss: 1.6927, test_f1: 0.4439
 epoch: 42, train_loss: 0.5969, test_loss: 1.4384, test_f1: 0.4705
 epoch: 43, train_loss: 0.6045, test_loss: 1.3492, test_f1: 0.5783
 epoch: 44, train_loss: 0.5751, test_loss: 1.4982, test_f1: 0.5972
 epoch: 45, train_loss: 0.5654, test_loss: 1.3303, test_f1: 0.5701
 epoch: 46, train_loss: 0.5884, test_loss: 1.7350, test_f1: 0.4359
 epoch: 47, train_loss: 0.5993, test_loss: 1.1617, test_f1: 0.5610
 epoch: 48, train_loss: 0.5805, test_loss: 1.2048, test_f1: 0.6091
 epoch: 49, train_loss: 0.5993, test_loss: 1.4341, test_f1: 0.5345
 epoch: 50, train_loss: 0.5526, test_loss: 1.5262, test_f1: 0.5614
 epoch: 51, train_loss: 0.5580, test_loss: 1.5166, test_f1: 0.5505
 epoch: 52, train_loss: 0.5129, test_loss: 1.4983, test_f1: 0.5300
 epoch: 53, train_loss: 0.4941, test_loss: 1.3834, test_f1: 0.5806
 epoch: 54, train_loss: 0.4908, test_loss: 1.7563, test_f1: 0.5620
 epoch: 55, train_loss: 0.4480, test_loss: 1.6076, test_f1: 0.5598
 epoch: 56, train_loss: 0.4512, test_loss: 1.5299, test_f1: 0.5407
 epoch: 57, train_loss: 0.4621, test_loss: 1.7177, test_f1: 0.5300
 epoch: 58, train_loss: 0.4990, test_loss: 1.6050, test_f1: 0.5095
 epoch: 59, train_loss: 0.4671, test_loss: 1.2621, test_f1: 0.5536
 epoch: 60, train_loss: 0.4304, test_loss: 1.4474, test_f1: 0.5751
 epoch: 61, train_loss: 0.4419, test_loss: 1.6266, test_f1: 0.5483
 epoch: 62, train_loss: 0.4618, test_loss: 1.9121, test_f1: 0.5649
 epoch: 63, train_loss: 0.4376, test_loss: 1.6808, test_f1: 0.5045
 epoch: 64, train_loss: 0.4855, test_loss: 2.7947, test_f1: 0.4725
 epoch: 65, train_loss: 0.4840, test_loss: 1.9151, test_f1: 0.5456
 epoch: 66, train_loss: 0.4284, test_loss: 1.4646, test_f1: 0.5708
 epoch: 67, train_loss: 0.4096, test_loss: 1.4230, test_f1: 0.6143
 epoch: 68, train_loss: 0.4487, test_loss: 1.5572, test_f1: 0.5345
 epoch: 69, train_loss: 0.4238, test_loss: 1.5007, test_f1: 0.5784
 epoch: 70, train_loss: 0.4496, test_loss: 1.4966, test_f1: 0.5626
 epoch: 71, train_loss: 0.4031, test_loss: 1.5323, test_f1: 0.6211
 epoch: 72, train_loss: 0.4609, test_loss: 1.4297, test_f1: 0.6101
 epoch: 73, train_loss: 0.3950, test_loss: 1.5046, test_f1: 0.6201
 epoch: 74, train_loss: 0.3872, test_loss: 1.6965, test_f1: 0.5844
 epoch: 75, train_loss: 0.3673, test_loss: 2.3187, test_f1: 0.5532
 epoch: 76, train_loss: 0.3608, test_loss: 1.8083, test_f1: 0.5780
 epoch: 77, train_loss: 0.3601, test_loss: 1.9300, test_f1: 0.5569
 epoch: 78, train_loss: 0.3601, test_loss: 1.7122, test_f1: 0.5942
 epoch: 79, train_loss: 0.3874, test_loss: 1.6258, test_f1: 0.5818
 epoch: 80, train_loss: 0.3842, test_loss: 1.8499, test_f1: 0.5642
 epoch: 81, train_loss: 0.3913, test_loss: 1.4298, test_f1: 0.5954
 epoch: 82, train_loss: 0.3463, test_loss: 1.6147, test_f1: 0.5491
 epoch: 83, train_loss: 0.3468, test_loss: 1.9249, test_f1: 0.5318
 epoch: 84, train_loss: 0.3446, test_loss: 1.9440, test_f1: 0.5848
 epoch: 85, train_loss: 0.3572, test_loss: 1.7980, test_f1: 0.6048
 epoch: 86, train_loss: 0.3428, test_loss: 1.7870, test_f1: 0.5514
 epoch: 87, train_loss: 0.3146, test_loss: 1.8746, test_f1: 0.6018
 epoch: 88, train_loss: 0.3325, test_loss: 2.1639, test_f1: 0.5523
 epoch: 89, train_loss: 0.3327, test_loss: 1.7003, test_f1: 0.6344
 epoch: 90, train_loss: 0.3178, test_loss: 1.8942, test_f1: 0.5103
 epoch: 91, train_loss: 0.3245, test_loss: 2.0379, test_f1: 0.5625
 epoch: 92, train_loss: 0.3285, test_loss: 1.6974, test_f1: 0.6104
 epoch: 93, train_loss: 0.3301, test_loss: 2.0093, test_f1: 0.5757
 epoch: 94, train_loss: 0.3320, test_loss: 1.9287, test_f1: 0.5682
 epoch: 95, train_loss: 0.3405, test_loss: 1.9384, test_f1: 0.6044
 epoch: 96, train_loss: 0.3257, test_loss: 1.9111, test_f1: 0.5939
 epoch: 97, train_loss: 0.2926, test_loss: 2.1486, test_f1: 0.5624
 epoch: 98, train_loss: 0.3371, test_loss: 1.9499, test_f1: 0.6028
 epoch: 99, train_loss: 0.3229, test_loss: 2.4289, test_f1: 0.5520
##################ITERATION #9 ****************************************
 epoch: 0, train_loss: 1.3880, test_loss: 1.5550, test_f1: 0.2281
 epoch: 1, train_loss: 1.0130, test_loss: 1.2440, test_f1: 0.3457
 epoch: 2, train_loss: 0.9836, test_loss: 1.2152, test_f1: 0.3992
 epoch: 3, train_loss: 0.9473, test_loss: 1.2360, test_f1: 0.4327
 epoch: 4, train_loss: 0.9331, test_loss: 1.1347, test_f1: 0.4655
 epoch: 5, train_loss: 0.8968, test_loss: 1.1038, test_f1: 0.5129
 epoch: 6, train_loss: 0.8855, test_loss: 1.1151, test_f1: 0.5183
 epoch: 7, train_loss: 0.8750, test_loss: 1.0800, test_f1: 0.5283
 epoch: 8, train_loss: 0.8790, test_loss: 1.0543, test_f1: 0.5284
 epoch: 9, train_loss: 0.8637, test_loss: 1.0173, test_f1: 0.5006
 epoch: 10, train_loss: 0.8421, test_loss: 1.0549, test_f1: 0.5363
 epoch: 11, train_loss: 0.8202, test_loss: 1.1121, test_f1: 0.4797
 epoch: 12, train_loss: 0.8010, test_loss: 1.0601, test_f1: 0.4742
 epoch: 13, train_loss: 0.7940, test_loss: 0.9889, test_f1: 0.5254
 epoch: 14, train_loss: 0.7794, test_loss: 1.0387, test_f1: 0.5456
 epoch: 15, train_loss: 0.7582, test_loss: 1.2218, test_f1: 0.4554
 epoch: 16, train_loss: 0.7884, test_loss: 1.1162, test_f1: 0.4987
 epoch: 17, train_loss: 0.8174, test_loss: 1.0399, test_f1: 0.5485
 epoch: 18, train_loss: 0.8100, test_loss: 1.1340, test_f1: 0.5358
 epoch: 19, train_loss: 0.7848, test_loss: 1.1318, test_f1: 0.5296
 epoch: 20, train_loss: 0.7473, test_loss: 1.0629, test_f1: 0.5347
 epoch: 21, train_loss: 0.7624, test_loss: 1.1359, test_f1: 0.5455
 epoch: 22, train_loss: 0.7553, test_loss: 1.2829, test_f1: 0.4478
 epoch: 23, train_loss: 0.7594, test_loss: 0.9968, test_f1: 0.5449
 epoch: 24, train_loss: 0.7582, test_loss: 1.0122, test_f1: 0.5576
 epoch: 25, train_loss: 0.7335, test_loss: 1.0331, test_f1: 0.5721
 epoch: 26, train_loss: 0.7163, test_loss: 1.1012, test_f1: 0.5228
 epoch: 27, train_loss: 0.7182, test_loss: 1.0690, test_f1: 0.5070
 epoch: 28, train_loss: 0.7031, test_loss: 1.1148, test_f1: 0.5327
 epoch: 29, train_loss: 0.6721, test_loss: 1.2784, test_f1: 0.4818
 epoch: 30, train_loss: 0.6877, test_loss: 1.1053, test_f1: 0.5973
 epoch: 31, train_loss: 0.6968, test_loss: 1.0654, test_f1: 0.6178
 epoch: 32, train_loss: 0.6694, test_loss: 1.0986, test_f1: 0.5650
 epoch: 33, train_loss: 0.6734, test_loss: 1.0779, test_f1: 0.6012
 epoch: 34, train_loss: 0.6488, test_loss: 1.2357, test_f1: 0.5829
 epoch: 35, train_loss: 0.6533, test_loss: 1.6924, test_f1: 0.3941
 epoch: 36, train_loss: 0.6328, test_loss: 1.3794, test_f1: 0.4604
 epoch: 37, train_loss: 0.6739, test_loss: 1.3434, test_f1: 0.5020
 epoch: 38, train_loss: 0.6547, test_loss: 1.1657, test_f1: 0.5777
 epoch: 39, train_loss: 0.6915, test_loss: 1.8189, test_f1: 0.3732
 epoch: 40, train_loss: 0.7593, test_loss: 1.1271, test_f1: 0.6042
 epoch: 41, train_loss: 0.7091, test_loss: 1.1424, test_f1: 0.5944
 epoch: 42, train_loss: 0.6697, test_loss: 1.0827, test_f1: 0.5732
 epoch: 43, train_loss: 0.6575, test_loss: 1.2166, test_f1: 0.5955
 epoch: 44, train_loss: 0.6247, test_loss: 1.2567, test_f1: 0.6180
 epoch: 45, train_loss: 0.6064, test_loss: 1.3799, test_f1: 0.5094
 epoch: 46, train_loss: 0.6127, test_loss: 1.2248, test_f1: 0.6041
 epoch: 47, train_loss: 0.6583, test_loss: 1.3406, test_f1: 0.5486
 epoch: 48, train_loss: 0.6514, test_loss: 1.2989, test_f1: 0.4851
 epoch: 49, train_loss: 0.6159, test_loss: 1.1294, test_f1: 0.6001
 epoch: 50, train_loss: 0.6017, test_loss: 1.3224, test_f1: 0.5207
 epoch: 51, train_loss: 0.5823, test_loss: 1.2004, test_f1: 0.5605
 epoch: 52, train_loss: 0.5429, test_loss: 1.3568, test_f1: 0.5807
 epoch: 53, train_loss: 0.5685, test_loss: 1.3904, test_f1: 0.5645
 epoch: 54, train_loss: 0.5198, test_loss: 1.3880, test_f1: 0.5739
 epoch: 55, train_loss: 0.5028, test_loss: 1.4915, test_f1: 0.5816
 epoch: 56, train_loss: 0.5036, test_loss: 1.4650, test_f1: 0.6074
 epoch: 57, train_loss: 0.4883, test_loss: 1.5626, test_f1: 0.5673
 epoch: 58, train_loss: 0.5033, test_loss: 1.4239, test_f1: 0.5902
 epoch: 59, train_loss: 0.4780, test_loss: 1.4302, test_f1: 0.5791
 epoch: 60, train_loss: 0.4581, test_loss: 1.4191, test_f1: 0.5675
 epoch: 61, train_loss: 0.4659, test_loss: 1.7509, test_f1: 0.6072
 epoch: 62, train_loss: 0.5201, test_loss: 1.2498, test_f1: 0.6224
 epoch: 63, train_loss: 0.4617, test_loss: 1.3449, test_f1: 0.5734
 epoch: 64, train_loss: 0.4504, test_loss: 1.2704, test_f1: 0.6379
 epoch: 65, train_loss: 0.4361, test_loss: 1.4423, test_f1: 0.6180
 epoch: 66, train_loss: 0.4336, test_loss: 1.7711, test_f1: 0.5551
 epoch: 67, train_loss: 0.4185, test_loss: 1.7502, test_f1: 0.6033
 epoch: 68, train_loss: 0.4147, test_loss: 2.2341, test_f1: 0.5716
 epoch: 69, train_loss: 0.4278, test_loss: 1.7173, test_f1: 0.6233
 epoch: 70, train_loss: 0.4204, test_loss: 1.6664, test_f1: 0.5885
 epoch: 71, train_loss: 0.4368, test_loss: 1.5754, test_f1: 0.5923
 epoch: 72, train_loss: 0.4517, test_loss: 1.6260, test_f1: 0.5930
 epoch: 73, train_loss: 0.4331, test_loss: 1.5479, test_f1: 0.6420
 epoch: 74, train_loss: 0.4129, test_loss: 2.4059, test_f1: 0.4749
 epoch: 75, train_loss: 0.4905, test_loss: 1.5968, test_f1: 0.6008
 epoch: 76, train_loss: 0.4912, test_loss: 2.0493, test_f1: 0.5543
 epoch: 77, train_loss: 0.4213, test_loss: 1.5937, test_f1: 0.5825
 epoch: 78, train_loss: 0.4185, test_loss: 1.4643, test_f1: 0.6416
 epoch: 79, train_loss: 0.3918, test_loss: 1.5310, test_f1: 0.6446
 epoch: 80, train_loss: 0.3767, test_loss: 1.7338, test_f1: 0.6153
 epoch: 81, train_loss: 0.3961, test_loss: 1.8686, test_f1: 0.5681
 epoch: 82, train_loss: 0.3656, test_loss: 1.7417, test_f1: 0.5757
 epoch: 83, train_loss: 0.3764, test_loss: 1.5449, test_f1: 0.6113
 epoch: 84, train_loss: 0.3569, test_loss: 1.6384, test_f1: 0.6407
 epoch: 85, train_loss: 0.3336, test_loss: 1.8021, test_f1: 0.6134
 epoch: 86, train_loss: 0.3295, test_loss: 1.7655, test_f1: 0.6096
 epoch: 87, train_loss: 0.3229, test_loss: 1.7895, test_f1: 0.6335
 epoch: 88, train_loss: 0.3293, test_loss: 1.8640, test_f1: 0.6157
 epoch: 89, train_loss: 0.3557, test_loss: 1.7212, test_f1: 0.6129
 epoch: 90, train_loss: 0.3534, test_loss: 1.8181, test_f1: 0.6199
 epoch: 91, train_loss: 0.3623, test_loss: 1.9551, test_f1: 0.5765
 epoch: 92, train_loss: 0.3785, test_loss: 1.7103, test_f1: 0.6331
 epoch: 93, train_loss: 0.3821, test_loss: 1.6400, test_f1: 0.6469
 epoch: 94, train_loss: 0.3128, test_loss: 1.9460, test_f1: 0.6114
 epoch: 95, train_loss: 0.3592, test_loss: 1.9828, test_f1: 0.6010
 epoch: 96, train_loss: 0.3246, test_loss: 1.9762, test_f1: 0.5790
 epoch: 97, train_loss: 0.3302, test_loss: 2.2704, test_f1: 0.5926
 epoch: 98, train_loss: 0.3581, test_loss: 2.3267, test_f1: 0.5934
 epoch: 99, train_loss: 0.3808, test_loss: 1.9059, test_f1: 0.5709

Training completed in 356.06 seconds
Best F1: 0.6603 at epoch 20
Mean F1 across iterations: 0.6392  0.0122
========================FINAL RESULTS================================
FEGIN weighted F1: 0.6603  0.0122
python main.py --data ltspice_demos --representation component_pin_net --model FEGIN --layers 5 --hiddens 128 --batch_size 256 --lr 0.01 --emb_size 512 --epochs 100 --save_appendix component_pin_net_L5_H128_BS256_LR0.01_E512 --no_val
-----



STDERR:
Processing...
Done!
  File "main.py", line 370, in <module>
    main()
  File "main.py", line 254, in main
    dataset = dataset_class(
  File "/home/philip/projects/ltspice_examples_code_repo/Circuit-Completion-Using-GNNs/component_classification_with_link_prediction_head/evaluation/FEGIN/kernel/circuit_datasets.py", line 15, in __init__
    self.data, self.slices = torch.load(self.processed_paths[0])
  File "/home/philip/.local/lib/python3.8/site-packages/torch/serialization.py", line 1040, in load
    warnings.warn(
  File "/usr/lib/python3.8/warnings.py", line 109, in _showwarnmsg
    sw(msg.message, msg.category, msg.filename, msg.lineno,
  File "main.py", line 47, in warn_with_traceback
    traceback.print_stack(file=log)
/home/philip/projects/ltspice_examples_code_repo/Circuit-Completion-Using-GNNs/component_classification_with_link_prediction_head/evaluation/FEGIN/kernel/circuit_datasets.py:15: FutureWarning: You are using `torch.load` with `weights_only=False` (the current default value), which uses the default pickle module implicitly. It is possible to construct malicious pickle data which will execute arbitrary code during unpickling (See https://github.com/pytorch/pytorch/blob/main/SECURITY.md#untrusted-models for more details). In a future release, the default value for `weights_only` will be flipped to `True`. This limits the functions that could be executed during unpickling. Arbitrary objects will no longer be allowed to be loaded via this mode unless they are explicitly allowlisted by the user via `torch.serialization.add_safe_globals`. We recommend you start setting `weights_only=True` for any use case where you don't have full control of the loaded file. Please open an issue on GitHub for any issues related to this experimental feature.
  self.data, self.slices = torch.load(self.processed_paths[0])
