STDOUT:
Results will be saved in /home/philip/projects/ltspice_examples_code_repo/Circuit-Completion-Using-GNNs/component_classification_with_link_prediction_head/evaluation/FEGIN/results/model_FEGIN_dataset_ltspice_demos
Command line input: python main.py --data ltspice_demos --representation component_pin --model FEGIN --layers 3 --hiddens 32 --batch_size 128 --lr 0.01 --emb_size 128 --epochs 100 --save_appendix component_pin_L3_H32_BS128_LR0.01_E128 --no_val
 is saved.
-----
ltspice_demos - FEGIN
Using 3 layers, 32 hidden units, h = 2
Loading component_pin representation dataset
ENTERED
Training FEGIN on component_pin representation
Train: 1565, Test: 383
##################ITERATION #0 ****************************************
 epoch: 0, train_loss: 1.2594, test_loss: 1.3628, test_f1: 0.2404
 epoch: 1, train_loss: 1.1500, test_loss: 1.5500, test_f1: 0.3441
 epoch: 2, train_loss: 1.0935, test_loss: 1.3643, test_f1: 0.3345
 epoch: 3, train_loss: 1.0153, test_loss: 1.3892, test_f1: 0.2774
 epoch: 4, train_loss: 0.9910, test_loss: 1.3236, test_f1: 0.4335
 epoch: 5, train_loss: 0.9527, test_loss: 0.9850, test_f1: 0.5419
 epoch: 6, train_loss: 0.9119, test_loss: 1.0772, test_f1: 0.3915
 epoch: 7, train_loss: 0.8548, test_loss: 1.0710, test_f1: 0.4511
 epoch: 8, train_loss: 0.8179, test_loss: 1.2050, test_f1: 0.5296
 epoch: 9, train_loss: 0.7843, test_loss: 1.1304, test_f1: 0.5634
 epoch: 10, train_loss: 0.7904, test_loss: 0.9066, test_f1: 0.5969
 epoch: 11, train_loss: 0.8058, test_loss: 1.5797, test_f1: 0.3450
 epoch: 12, train_loss: 0.7784, test_loss: 1.0733, test_f1: 0.5604
 epoch: 13, train_loss: 0.7729, test_loss: 0.9772, test_f1: 0.5883
 epoch: 14, train_loss: 0.7853, test_loss: 1.0801, test_f1: 0.4968
 epoch: 15, train_loss: 0.7684, test_loss: 1.0154, test_f1: 0.5987
 epoch: 16, train_loss: 0.7734, test_loss: 1.0245, test_f1: 0.5684
 epoch: 17, train_loss: 0.7654, test_loss: 2.5726, test_f1: 0.3910
 epoch: 18, train_loss: 0.7777, test_loss: 0.9750, test_f1: 0.5451
 epoch: 19, train_loss: 0.7984, test_loss: 0.9393, test_f1: 0.4665
 epoch: 20, train_loss: 0.7556, test_loss: 1.1817, test_f1: 0.5821
 epoch: 21, train_loss: 0.7184, test_loss: 1.3417, test_f1: 0.5296
 epoch: 22, train_loss: 0.7188, test_loss: 1.1983, test_f1: 0.5957
 epoch: 23, train_loss: 0.7045, test_loss: 1.2766, test_f1: 0.5715
 epoch: 24, train_loss: 0.7118, test_loss: 0.9784, test_f1: 0.6056
 epoch: 25, train_loss: 0.7279, test_loss: 1.1355, test_f1: 0.5775
 epoch: 26, train_loss: 0.7222, test_loss: 1.0538, test_f1: 0.5291
 epoch: 27, train_loss: 0.7216, test_loss: 1.1406, test_f1: 0.5608
 epoch: 28, train_loss: 0.6850, test_loss: 1.1790, test_f1: 0.6038
 epoch: 29, train_loss: 0.6800, test_loss: 1.1072, test_f1: 0.5332
 epoch: 30, train_loss: 0.6819, test_loss: 1.2125, test_f1: 0.6179
 epoch: 31, train_loss: 0.6530, test_loss: 1.5953, test_f1: 0.4855
 epoch: 32, train_loss: 0.6972, test_loss: 1.1541, test_f1: 0.4715
 epoch: 33, train_loss: 0.7099, test_loss: 1.1376, test_f1: 0.5836
 epoch: 34, train_loss: 0.6773, test_loss: 1.2840, test_f1: 0.5882
 epoch: 35, train_loss: 0.6826, test_loss: 1.1665, test_f1: 0.5913
 epoch: 36, train_loss: 0.6685, test_loss: 1.2299, test_f1: 0.5638
 epoch: 37, train_loss: 0.6348, test_loss: 1.0625, test_f1: 0.5646
 epoch: 38, train_loss: 0.6963, test_loss: 0.9875, test_f1: 0.6179
 epoch: 39, train_loss: 0.6670, test_loss: 0.9776, test_f1: 0.6352
 epoch: 40, train_loss: 0.6381, test_loss: 1.1242, test_f1: 0.6035
 epoch: 41, train_loss: 0.6205, test_loss: 1.2573, test_f1: 0.5624
 epoch: 42, train_loss: 0.6263, test_loss: 1.3358, test_f1: 0.5532
 epoch: 43, train_loss: 0.6317, test_loss: 1.1643, test_f1: 0.5159
 epoch: 44, train_loss: 0.5967, test_loss: 1.2309, test_f1: 0.6006
 epoch: 45, train_loss: 0.5838, test_loss: 1.1235, test_f1: 0.5909
 epoch: 46, train_loss: 0.5799, test_loss: 1.3743, test_f1: 0.5412
 epoch: 47, train_loss: 0.5834, test_loss: 1.3009, test_f1: 0.4876
 epoch: 48, train_loss: 0.5743, test_loss: 1.6143, test_f1: 0.5782
 epoch: 49, train_loss: 0.5560, test_loss: 1.5196, test_f1: 0.5975
 epoch: 50, train_loss: 0.5725, test_loss: 1.5246, test_f1: 0.4624
 epoch: 51, train_loss: 0.5550, test_loss: 1.5768, test_f1: 0.5827
 epoch: 52, train_loss: 0.5364, test_loss: 1.2404, test_f1: 0.6288
 epoch: 53, train_loss: 0.5155, test_loss: 1.3121, test_f1: 0.6420
 epoch: 54, train_loss: 0.4977, test_loss: 1.4136, test_f1: 0.6688
 epoch: 55, train_loss: 0.5044, test_loss: 1.2684, test_f1: 0.6514
 epoch: 56, train_loss: 0.4960, test_loss: 1.7005, test_f1: 0.5760
 epoch: 57, train_loss: 0.5536, test_loss: 1.6078, test_f1: 0.6062
 epoch: 58, train_loss: 0.4963, test_loss: 1.3703, test_f1: 0.6044
 epoch: 59, train_loss: 0.5135, test_loss: 1.4653, test_f1: 0.6071
 epoch: 60, train_loss: 0.4868, test_loss: 1.4110, test_f1: 0.6516
 epoch: 61, train_loss: 0.4654, test_loss: 1.4753, test_f1: 0.6335
 epoch: 62, train_loss: 0.4497, test_loss: 1.3885, test_f1: 0.6325
 epoch: 63, train_loss: 0.4407, test_loss: 1.7361, test_f1: 0.5900
 epoch: 64, train_loss: 0.4670, test_loss: 1.4323, test_f1: 0.5992
 epoch: 65, train_loss: 0.4632, test_loss: 1.7131, test_f1: 0.6066
 epoch: 66, train_loss: 0.4778, test_loss: 1.4188, test_f1: 0.6326
 epoch: 67, train_loss: 0.4621, test_loss: 1.4056, test_f1: 0.5677
 epoch: 68, train_loss: 0.5538, test_loss: 1.8670, test_f1: 0.5632
 epoch: 69, train_loss: 0.4640, test_loss: 1.8566, test_f1: 0.6259
 epoch: 70, train_loss: 0.4673, test_loss: 1.5610, test_f1: 0.5961
 epoch: 71, train_loss: 0.5133, test_loss: 1.4614, test_f1: 0.6008
 epoch: 72, train_loss: 0.4699, test_loss: 1.7804, test_f1: 0.6127
 epoch: 73, train_loss: 0.4257, test_loss: 2.0277, test_f1: 0.6274
 epoch: 74, train_loss: 0.4156, test_loss: 1.6009, test_f1: 0.6183
 epoch: 75, train_loss: 0.4207, test_loss: 1.9950, test_f1: 0.6196
 epoch: 76, train_loss: 0.4043, test_loss: 2.0637, test_f1: 0.6220
 epoch: 77, train_loss: 0.4171, test_loss: 2.2051, test_f1: 0.6012
 epoch: 78, train_loss: 0.4523, test_loss: 1.7221, test_f1: 0.5780
 epoch: 79, train_loss: 0.4654, test_loss: 1.9548, test_f1: 0.5983
 epoch: 80, train_loss: 0.4180, test_loss: 2.2186, test_f1: 0.6066
 epoch: 81, train_loss: 0.4344, test_loss: 1.8841, test_f1: 0.5438
 epoch: 82, train_loss: 0.4266, test_loss: 1.9574, test_f1: 0.6142
 epoch: 83, train_loss: 0.4100, test_loss: 1.7340, test_f1: 0.6430
 epoch: 84, train_loss: 0.3985, test_loss: 1.8543, test_f1: 0.6246
 epoch: 85, train_loss: 0.3890, test_loss: 2.1380, test_f1: 0.6181
 epoch: 86, train_loss: 0.3990, test_loss: 2.0208, test_f1: 0.6091
 epoch: 87, train_loss: 0.4005, test_loss: 2.3145, test_f1: 0.6035
 epoch: 88, train_loss: 0.3773, test_loss: 2.1599, test_f1: 0.6096
 epoch: 89, train_loss: 0.4316, test_loss: 2.2411, test_f1: 0.5775
 epoch: 90, train_loss: 0.4400, test_loss: 1.7918, test_f1: 0.6124
 epoch: 91, train_loss: 0.3826, test_loss: 1.9022, test_f1: 0.6227
 epoch: 92, train_loss: 0.4107, test_loss: 2.2608, test_f1: 0.6213
 epoch: 93, train_loss: 0.4346, test_loss: 2.0050, test_f1: 0.5893
 epoch: 94, train_loss: 0.4335, test_loss: 1.8734, test_f1: 0.6106
 epoch: 95, train_loss: 0.4172, test_loss: 2.1510, test_f1: 0.6265
 epoch: 96, train_loss: 0.3884, test_loss: 1.6938, test_f1: 0.6378
 epoch: 97, train_loss: 0.3692, test_loss: 2.2289, test_f1: 0.6329
 epoch: 98, train_loss: 0.3505, test_loss: 2.2343, test_f1: 0.6196
 epoch: 99, train_loss: 0.3493, test_loss: 2.1987, test_f1: 0.6263
##################ITERATION #1 ****************************************
 epoch: 0, train_loss: 1.1504, test_loss: 1.3920, test_f1: 0.3041
 epoch: 1, train_loss: 0.9937, test_loss: 1.3032, test_f1: 0.4337
 epoch: 2, train_loss: 0.9311, test_loss: 1.4358, test_f1: 0.2310
 epoch: 3, train_loss: 0.8722, test_loss: 1.1624, test_f1: 0.4953
 epoch: 4, train_loss: 0.8413, test_loss: 2.8462, test_f1: 0.2373
 epoch: 5, train_loss: 0.8483, test_loss: 1.2719, test_f1: 0.5024
 epoch: 6, train_loss: 0.8106, test_loss: 1.1332, test_f1: 0.5938
 epoch: 7, train_loss: 0.7906, test_loss: 1.6047, test_f1: 0.3644
 epoch: 8, train_loss: 0.7636, test_loss: 1.0449, test_f1: 0.5532
 epoch: 9, train_loss: 0.7327, test_loss: 0.9982, test_f1: 0.6124
 epoch: 10, train_loss: 0.7420, test_loss: 1.0854, test_f1: 0.5598
 epoch: 11, train_loss: 0.7734, test_loss: 1.1738, test_f1: 0.4142
 epoch: 12, train_loss: 0.7798, test_loss: 1.0052, test_f1: 0.5634
 epoch: 13, train_loss: 0.7544, test_loss: 1.0314, test_f1: 0.5523
 epoch: 14, train_loss: 0.7213, test_loss: 1.9679, test_f1: 0.4593
 epoch: 15, train_loss: 0.7251, test_loss: 1.0572, test_f1: 0.5383
 epoch: 16, train_loss: 0.7144, test_loss: 3.0565, test_f1: 0.3022
 epoch: 17, train_loss: 0.6994, test_loss: 1.3848, test_f1: 0.4790
 epoch: 18, train_loss: 0.6800, test_loss: 1.3410, test_f1: 0.5561
 epoch: 19, train_loss: 0.6722, test_loss: 1.1655, test_f1: 0.5349
 epoch: 20, train_loss: 0.6988, test_loss: 1.9982, test_f1: 0.3850
 epoch: 21, train_loss: 0.6737, test_loss: 1.3721, test_f1: 0.5253
 epoch: 22, train_loss: 0.6498, test_loss: 1.4016, test_f1: 0.5263
 epoch: 23, train_loss: 0.6782, test_loss: 1.2391, test_f1: 0.5309
 epoch: 24, train_loss: 0.6847, test_loss: 1.3653, test_f1: 0.4483
 epoch: 25, train_loss: 0.6558, test_loss: 1.3413, test_f1: 0.5422
 epoch: 26, train_loss: 0.6381, test_loss: 1.2440, test_f1: 0.5710
 epoch: 27, train_loss: 0.6290, test_loss: 1.2911, test_f1: 0.5641
 epoch: 28, train_loss: 0.6706, test_loss: 1.0169, test_f1: 0.6007
 epoch: 29, train_loss: 0.6220, test_loss: 1.0813, test_f1: 0.6690
 epoch: 30, train_loss: 0.6115, test_loss: 1.1277, test_f1: 0.6144
 epoch: 31, train_loss: 0.5914, test_loss: 1.2723, test_f1: 0.6335
 epoch: 32, train_loss: 0.5961, test_loss: 1.1768, test_f1: 0.5857
 epoch: 33, train_loss: 0.5851, test_loss: 1.2259, test_f1: 0.6034
 epoch: 34, train_loss: 0.6079, test_loss: 1.2262, test_f1: 0.5345
 epoch: 35, train_loss: 0.6648, test_loss: 1.3918, test_f1: 0.5513
 epoch: 36, train_loss: 0.6164, test_loss: 1.4205, test_f1: 0.5998
 epoch: 37, train_loss: 0.5871, test_loss: 1.4587, test_f1: 0.5782
 epoch: 38, train_loss: 0.6225, test_loss: 1.0564, test_f1: 0.6619
 epoch: 39, train_loss: 0.6229, test_loss: 1.3503, test_f1: 0.5089
 epoch: 40, train_loss: 0.6344, test_loss: 1.0950, test_f1: 0.5853
 epoch: 41, train_loss: 0.6053, test_loss: 1.1438, test_f1: 0.6198
 epoch: 42, train_loss: 0.5998, test_loss: 1.8676, test_f1: 0.4742
 epoch: 43, train_loss: 0.6039, test_loss: 1.6338, test_f1: 0.4389
 epoch: 44, train_loss: 0.5950, test_loss: 1.3836, test_f1: 0.6000
 epoch: 45, train_loss: 0.5638, test_loss: 1.1550, test_f1: 0.6063
 epoch: 46, train_loss: 0.5733, test_loss: 1.3694, test_f1: 0.6041
 epoch: 47, train_loss: 0.5659, test_loss: 1.3655, test_f1: 0.6321
 epoch: 48, train_loss: 0.5999, test_loss: 1.3722, test_f1: 0.5812
 epoch: 49, train_loss: 0.6194, test_loss: 1.8508, test_f1: 0.4973
 epoch: 50, train_loss: 0.6201, test_loss: 1.7093, test_f1: 0.5889
 epoch: 51, train_loss: 0.5798, test_loss: 1.3089, test_f1: 0.6215
 epoch: 52, train_loss: 0.5546, test_loss: 1.1572, test_f1: 0.6487
 epoch: 53, train_loss: 0.5347, test_loss: 1.1916, test_f1: 0.6168
 epoch: 54, train_loss: 0.5296, test_loss: 1.2105, test_f1: 0.6976
 epoch: 55, train_loss: 0.5274, test_loss: 1.1744, test_f1: 0.6222
 epoch: 56, train_loss: 0.4917, test_loss: 1.3463, test_f1: 0.6457
 epoch: 57, train_loss: 0.4978, test_loss: 1.4945, test_f1: 0.5921
 epoch: 58, train_loss: 0.4734, test_loss: 1.4707, test_f1: 0.6176
 epoch: 59, train_loss: 0.4585, test_loss: 1.5339, test_f1: 0.5936
 epoch: 60, train_loss: 0.4691, test_loss: 1.4296, test_f1: 0.6591
 epoch: 61, train_loss: 0.4549, test_loss: 1.4897, test_f1: 0.6452
 epoch: 62, train_loss: 0.4607, test_loss: 1.3463, test_f1: 0.6505
 epoch: 63, train_loss: 0.4585, test_loss: 1.3801, test_f1: 0.5753
 epoch: 64, train_loss: 0.4459, test_loss: 1.6723, test_f1: 0.5782
 epoch: 65, train_loss: 0.4772, test_loss: 1.6639, test_f1: 0.6026
 epoch: 66, train_loss: 0.5006, test_loss: 1.5866, test_f1: 0.5825
 epoch: 67, train_loss: 0.4713, test_loss: 1.2806, test_f1: 0.6180
 epoch: 68, train_loss: 0.4791, test_loss: 1.3705, test_f1: 0.5823
 epoch: 69, train_loss: 0.4392, test_loss: 1.5174, test_f1: 0.5997
 epoch: 70, train_loss: 0.4582, test_loss: 1.6152, test_f1: 0.5867
 epoch: 71, train_loss: 0.4467, test_loss: 1.4161, test_f1: 0.6384
 epoch: 72, train_loss: 0.4367, test_loss: 1.6148, test_f1: 0.5840
 epoch: 73, train_loss: 0.4266, test_loss: 1.9523, test_f1: 0.5824
 epoch: 74, train_loss: 0.4301, test_loss: 1.4441, test_f1: 0.6167
 epoch: 75, train_loss: 0.4456, test_loss: 1.6331, test_f1: 0.6068
 epoch: 76, train_loss: 0.4187, test_loss: 1.9088, test_f1: 0.5731
 epoch: 77, train_loss: 0.4372, test_loss: 2.2742, test_f1: 0.5247
 epoch: 78, train_loss: 0.4441, test_loss: 1.5189, test_f1: 0.6539
 epoch: 79, train_loss: 0.4287, test_loss: 1.5715, test_f1: 0.6046
 epoch: 80, train_loss: 0.4345, test_loss: 1.5933, test_f1: 0.5876
 epoch: 81, train_loss: 0.3791, test_loss: 1.7034, test_f1: 0.6031
 epoch: 82, train_loss: 0.3886, test_loss: 1.8785, test_f1: 0.6081
 epoch: 83, train_loss: 0.4412, test_loss: 1.5260, test_f1: 0.5950
 epoch: 84, train_loss: 0.4092, test_loss: 1.8042, test_f1: 0.5902
 epoch: 85, train_loss: 0.3919, test_loss: 1.7234, test_f1: 0.5996
 epoch: 86, train_loss: 0.4034, test_loss: 1.7377, test_f1: 0.6077
 epoch: 87, train_loss: 0.4054, test_loss: 1.7961, test_f1: 0.5839
 epoch: 88, train_loss: 0.3949, test_loss: 1.8662, test_f1: 0.6040
 epoch: 89, train_loss: 0.3885, test_loss: 1.9931, test_f1: 0.5842
 epoch: 90, train_loss: 0.3651, test_loss: 1.6034, test_f1: 0.6034
 epoch: 91, train_loss: 0.3748, test_loss: 1.9567, test_f1: 0.5669
 epoch: 92, train_loss: 0.3895, test_loss: 1.8066, test_f1: 0.5925
 epoch: 93, train_loss: 0.3919, test_loss: 2.1370, test_f1: 0.5558
 epoch: 94, train_loss: 0.3787, test_loss: 2.5696, test_f1: 0.5386
 epoch: 95, train_loss: 0.3668, test_loss: 1.8504, test_f1: 0.6105
 epoch: 96, train_loss: 0.3604, test_loss: 1.8947, test_f1: 0.5958
 epoch: 97, train_loss: 0.3849, test_loss: 2.0186, test_f1: 0.5783
 epoch: 98, train_loss: 0.3541, test_loss: 2.1926, test_f1: 0.5366
 epoch: 99, train_loss: 0.3614, test_loss: 1.9590, test_f1: 0.5509
##################ITERATION #2 ****************************************
 epoch: 0, train_loss: 1.1751, test_loss: 1.2862, test_f1: 0.2281
 epoch: 1, train_loss: 0.9715, test_loss: 1.2224, test_f1: 0.4310
 epoch: 2, train_loss: 0.8829, test_loss: 1.2397, test_f1: 0.4586
 epoch: 3, train_loss: 0.8535, test_loss: 1.0293, test_f1: 0.5348
 epoch: 4, train_loss: 0.8140, test_loss: 1.4936, test_f1: 0.3595
 epoch: 5, train_loss: 0.7965, test_loss: 0.9673, test_f1: 0.5712
 epoch: 6, train_loss: 0.7771, test_loss: 1.0064, test_f1: 0.5588
 epoch: 7, train_loss: 0.7796, test_loss: 1.4303, test_f1: 0.4212
 epoch: 8, train_loss: 0.7746, test_loss: 1.0023, test_f1: 0.4492
 epoch: 9, train_loss: 0.7842, test_loss: 1.3175, test_f1: 0.4526
 epoch: 10, train_loss: 0.7397, test_loss: 1.0379, test_f1: 0.5417
 epoch: 11, train_loss: 0.7594, test_loss: 0.9961, test_f1: 0.5530
 epoch: 12, train_loss: 0.7335, test_loss: 0.9935, test_f1: 0.5258
 epoch: 13, train_loss: 0.7347, test_loss: 0.9865, test_f1: 0.5858
 epoch: 14, train_loss: 0.7199, test_loss: 0.9827, test_f1: 0.5997
 epoch: 15, train_loss: 0.6975, test_loss: 1.0236, test_f1: 0.5747
 epoch: 16, train_loss: 0.7194, test_loss: 1.1252, test_f1: 0.5589
 epoch: 17, train_loss: 0.7317, test_loss: 1.1853, test_f1: 0.5047
 epoch: 18, train_loss: 0.7368, test_loss: 1.3595, test_f1: 0.5301
 epoch: 19, train_loss: 0.7689, test_loss: 1.0823, test_f1: 0.5362
 epoch: 20, train_loss: 0.7382, test_loss: 1.1591, test_f1: 0.5383
 epoch: 21, train_loss: 0.7316, test_loss: 0.9735, test_f1: 0.5752
 epoch: 22, train_loss: 0.6991, test_loss: 0.9851, test_f1: 0.6006
 epoch: 23, train_loss: 0.7043, test_loss: 1.0298, test_f1: 0.6268
 epoch: 24, train_loss: 0.6854, test_loss: 0.9837, test_f1: 0.6448
 epoch: 25, train_loss: 0.6642, test_loss: 1.0156, test_f1: 0.6030
 epoch: 26, train_loss: 0.6525, test_loss: 0.9774, test_f1: 0.5907
 epoch: 27, train_loss: 0.6332, test_loss: 0.9644, test_f1: 0.5994
 epoch: 28, train_loss: 0.6321, test_loss: 1.1672, test_f1: 0.5264
 epoch: 29, train_loss: 0.6387, test_loss: 1.1314, test_f1: 0.5681
 epoch: 30, train_loss: 0.6438, test_loss: 1.1945, test_f1: 0.5623
 epoch: 31, train_loss: 0.6441, test_loss: 1.0644, test_f1: 0.5641
 epoch: 32, train_loss: 0.6433, test_loss: 1.0531, test_f1: 0.5706
 epoch: 33, train_loss: 0.6213, test_loss: 1.1112, test_f1: 0.5894
 epoch: 34, train_loss: 0.6341, test_loss: 1.0485, test_f1: 0.5832
 epoch: 35, train_loss: 0.6312, test_loss: 1.0819, test_f1: 0.4972
 epoch: 36, train_loss: 0.6271, test_loss: 1.0199, test_f1: 0.5406
 epoch: 37, train_loss: 0.6231, test_loss: 1.0548, test_f1: 0.6266
 epoch: 38, train_loss: 0.6114, test_loss: 1.0037, test_f1: 0.5910
 epoch: 39, train_loss: 0.6027, test_loss: 1.2120, test_f1: 0.6269
 epoch: 40, train_loss: 0.5929, test_loss: 1.1385, test_f1: 0.6279
 epoch: 41, train_loss: 0.5833, test_loss: 1.1538, test_f1: 0.5916
 epoch: 42, train_loss: 0.5683, test_loss: 1.1814, test_f1: 0.5824
 epoch: 43, train_loss: 0.6196, test_loss: 1.2665, test_f1: 0.4381
 epoch: 44, train_loss: 0.5831, test_loss: 1.2318, test_f1: 0.5537
 epoch: 45, train_loss: 0.5720, test_loss: 1.3043, test_f1: 0.5269
 epoch: 46, train_loss: 0.5576, test_loss: 1.2558, test_f1: 0.5825
 epoch: 47, train_loss: 0.5717, test_loss: 1.2713, test_f1: 0.5314
 epoch: 48, train_loss: 0.5951, test_loss: 1.2995, test_f1: 0.5599
 epoch: 49, train_loss: 0.6070, test_loss: 1.0741, test_f1: 0.5582
 epoch: 50, train_loss: 0.5889, test_loss: 1.1169, test_f1: 0.5431
 epoch: 51, train_loss: 0.5610, test_loss: 1.0351, test_f1: 0.6172
 epoch: 52, train_loss: 0.5310, test_loss: 0.9799, test_f1: 0.6778
 epoch: 53, train_loss: 0.5200, test_loss: 1.0001, test_f1: 0.6634
 epoch: 54, train_loss: 0.4888, test_loss: 1.2014, test_f1: 0.5849
 epoch: 55, train_loss: 0.4931, test_loss: 1.0712, test_f1: 0.6646
 epoch: 56, train_loss: 0.4935, test_loss: 1.2229, test_f1: 0.6313
 epoch: 57, train_loss: 0.4900, test_loss: 1.0581, test_f1: 0.6743
 epoch: 58, train_loss: 0.4874, test_loss: 1.0430, test_f1: 0.6165
 epoch: 59, train_loss: 0.4680, test_loss: 1.2537, test_f1: 0.5533
 epoch: 60, train_loss: 0.4715, test_loss: 1.1411, test_f1: 0.6332
 epoch: 61, train_loss: 0.4660, test_loss: 1.2256, test_f1: 0.6626
 epoch: 62, train_loss: 0.4291, test_loss: 1.1648, test_f1: 0.6187
 epoch: 63, train_loss: 0.4405, test_loss: 1.3146, test_f1: 0.6579
 epoch: 64, train_loss: 0.4604, test_loss: 1.4102, test_f1: 0.6257
 epoch: 65, train_loss: 0.4385, test_loss: 1.2405, test_f1: 0.6900
 epoch: 66, train_loss: 0.4398, test_loss: 1.2664, test_f1: 0.5771
 epoch: 67, train_loss: 0.4440, test_loss: 1.5798, test_f1: 0.5576
 epoch: 68, train_loss: 0.4477, test_loss: 1.2999, test_f1: 0.6080
 epoch: 69, train_loss: 0.4050, test_loss: 1.4122, test_f1: 0.5712
 epoch: 70, train_loss: 0.4379, test_loss: 1.1777, test_f1: 0.6327
 epoch: 71, train_loss: 0.4600, test_loss: 1.3643, test_f1: 0.6335
 epoch: 72, train_loss: 0.4752, test_loss: 1.1564, test_f1: 0.6773
 epoch: 73, train_loss: 0.4580, test_loss: 1.4248, test_f1: 0.5821
 epoch: 74, train_loss: 0.4035, test_loss: 1.3461, test_f1: 0.6249
 epoch: 75, train_loss: 0.4271, test_loss: 1.2122, test_f1: 0.6128
 epoch: 76, train_loss: 0.4016, test_loss: 1.1939, test_f1: 0.6498
 epoch: 77, train_loss: 0.4260, test_loss: 1.3225, test_f1: 0.6745
 epoch: 78, train_loss: 0.3986, test_loss: 1.3921, test_f1: 0.6211
 epoch: 79, train_loss: 0.3757, test_loss: 1.4102, test_f1: 0.6008
 epoch: 80, train_loss: 0.3951, test_loss: 1.5109, test_f1: 0.6365
 epoch: 81, train_loss: 0.4044, test_loss: 1.4322, test_f1: 0.6509
 epoch: 82, train_loss: 0.4279, test_loss: 1.3770, test_f1: 0.6232
 epoch: 83, train_loss: 0.3788, test_loss: 1.3040, test_f1: 0.6700
 epoch: 84, train_loss: 0.3720, test_loss: 1.4774, test_f1: 0.6203
 epoch: 85, train_loss: 0.3486, test_loss: 1.3514, test_f1: 0.6432
 epoch: 86, train_loss: 0.3914, test_loss: 1.6632, test_f1: 0.5554
 epoch: 87, train_loss: 0.4035, test_loss: 1.3462, test_f1: 0.6447
 epoch: 88, train_loss: 0.3565, test_loss: 1.4138, test_f1: 0.6466
 epoch: 89, train_loss: 0.3253, test_loss: 1.5066, test_f1: 0.6349
 epoch: 90, train_loss: 0.3485, test_loss: 1.4149, test_f1: 0.6680
 epoch: 91, train_loss: 0.3576, test_loss: 1.7418, test_f1: 0.6154
 epoch: 92, train_loss: 0.3466, test_loss: 1.5333, test_f1: 0.5727
 epoch: 93, train_loss: 0.3522, test_loss: 1.7218, test_f1: 0.5784
 epoch: 94, train_loss: 0.3524, test_loss: 1.4602, test_f1: 0.6307
 epoch: 95, train_loss: 0.3418, test_loss: 1.5217, test_f1: 0.6398
 epoch: 96, train_loss: 0.3926, test_loss: 1.7081, test_f1: 0.6015
 epoch: 97, train_loss: 0.3528, test_loss: 1.8373, test_f1: 0.5504
 epoch: 98, train_loss: 0.3644, test_loss: 1.5810, test_f1: 0.6282
 epoch: 99, train_loss: 0.3671, test_loss: 1.4827, test_f1: 0.6609
##################ITERATION #3 ****************************************
 epoch: 0, train_loss: 1.2202, test_loss: 1.6450, test_f1: 0.2160
 epoch: 1, train_loss: 0.9874, test_loss: 1.3090, test_f1: 0.3759
 epoch: 2, train_loss: 0.9589, test_loss: 1.2423, test_f1: 0.4150
 epoch: 3, train_loss: 0.9260, test_loss: 1.1135, test_f1: 0.5039
 epoch: 4, train_loss: 0.8954, test_loss: 1.0942, test_f1: 0.4907
 epoch: 5, train_loss: 0.8857, test_loss: 1.0522, test_f1: 0.4977
 epoch: 6, train_loss: 0.8796, test_loss: 1.0787, test_f1: 0.5241
 epoch: 7, train_loss: 0.8440, test_loss: 1.0922, test_f1: 0.5203
 epoch: 8, train_loss: 0.8302, test_loss: 1.0498, test_f1: 0.5673
 epoch: 9, train_loss: 0.7986, test_loss: 1.1873, test_f1: 0.5633
 epoch: 10, train_loss: 0.8143, test_loss: 1.0273, test_f1: 0.5768
 epoch: 11, train_loss: 0.8157, test_loss: 1.1094, test_f1: 0.5168
 epoch: 12, train_loss: 0.8030, test_loss: 0.9929, test_f1: 0.5745
 epoch: 13, train_loss: 0.8054, test_loss: 1.0150, test_f1: 0.5943
 epoch: 14, train_loss: 0.7737, test_loss: 1.0747, test_f1: 0.5597
 epoch: 15, train_loss: 0.8011, test_loss: 1.0620, test_f1: 0.5540
 epoch: 16, train_loss: 0.7772, test_loss: 1.0850, test_f1: 0.5652
 epoch: 17, train_loss: 0.7441, test_loss: 1.0203, test_f1: 0.5986
 epoch: 18, train_loss: 0.7658, test_loss: 1.0968, test_f1: 0.5837
 epoch: 19, train_loss: 0.7541, test_loss: 1.0437, test_f1: 0.5493
 epoch: 20, train_loss: 0.7383, test_loss: 1.4226, test_f1: 0.5512
 epoch: 21, train_loss: 0.7142, test_loss: 1.2183, test_f1: 0.5876
 epoch: 22, train_loss: 0.7495, test_loss: 0.9931, test_f1: 0.6127
 epoch: 23, train_loss: 0.7304, test_loss: 1.0505, test_f1: 0.6014
 epoch: 24, train_loss: 0.7209, test_loss: 0.9133, test_f1: 0.6204
 epoch: 25, train_loss: 0.6966, test_loss: 1.1748, test_f1: 0.4979
 epoch: 26, train_loss: 0.7074, test_loss: 1.9905, test_f1: 0.4094
 epoch: 27, train_loss: 0.7426, test_loss: 1.2978, test_f1: 0.5076
 epoch: 28, train_loss: 0.7271, test_loss: 0.9725, test_f1: 0.6119
 epoch: 29, train_loss: 0.7117, test_loss: 1.0096, test_f1: 0.6113
 epoch: 30, train_loss: 0.6861, test_loss: 1.0183, test_f1: 0.5911
 epoch: 31, train_loss: 0.7459, test_loss: 0.9925, test_f1: 0.6326
 epoch: 32, train_loss: 0.7024, test_loss: 1.0609, test_f1: 0.5996
 epoch: 33, train_loss: 0.6930, test_loss: 1.1006, test_f1: 0.6427
 epoch: 34, train_loss: 0.7070, test_loss: 1.2163, test_f1: 0.5462
 epoch: 35, train_loss: 0.6889, test_loss: 1.0770, test_f1: 0.5962
 epoch: 36, train_loss: 0.6805, test_loss: 1.0426, test_f1: 0.5853
 epoch: 37, train_loss: 0.6526, test_loss: 1.2422, test_f1: 0.6175
 epoch: 38, train_loss: 0.6727, test_loss: 1.2156, test_f1: 0.5941
 epoch: 39, train_loss: 0.6439, test_loss: 1.1484, test_f1: 0.6274
 epoch: 40, train_loss: 0.6821, test_loss: 1.2650, test_f1: 0.6438
 epoch: 41, train_loss: 0.6482, test_loss: 1.1102, test_f1: 0.6073
 epoch: 42, train_loss: 0.6275, test_loss: 1.1133, test_f1: 0.6212
 epoch: 43, train_loss: 0.6169, test_loss: 1.3008, test_f1: 0.5208
 epoch: 44, train_loss: 0.6419, test_loss: 1.0954, test_f1: 0.6010
 epoch: 45, train_loss: 0.6387, test_loss: 1.4848, test_f1: 0.5588
 epoch: 46, train_loss: 0.6243, test_loss: 1.1640, test_f1: 0.5702
 epoch: 47, train_loss: 0.6441, test_loss: 1.9251, test_f1: 0.5981
 epoch: 48, train_loss: 0.6268, test_loss: 1.5720, test_f1: 0.5267
 epoch: 49, train_loss: 0.6390, test_loss: 1.0118, test_f1: 0.6199
 epoch: 50, train_loss: 0.6225, test_loss: 1.1314, test_f1: 0.6510
 epoch: 51, train_loss: 0.5851, test_loss: 1.0142, test_f1: 0.6580
 epoch: 52, train_loss: 0.5776, test_loss: 1.0309, test_f1: 0.6719
 epoch: 53, train_loss: 0.5496, test_loss: 1.1326, test_f1: 0.6284
 epoch: 54, train_loss: 0.5464, test_loss: 1.0293, test_f1: 0.6902
 epoch: 55, train_loss: 0.5332, test_loss: 1.1068, test_f1: 0.6534
 epoch: 56, train_loss: 0.5166, test_loss: 1.1275, test_f1: 0.6605
 epoch: 57, train_loss: 0.5394, test_loss: 1.0566, test_f1: 0.6620
 epoch: 58, train_loss: 0.5305, test_loss: 1.1824, test_f1: 0.6166
 epoch: 59, train_loss: 0.5102, test_loss: 1.2270, test_f1: 0.6078
 epoch: 60, train_loss: 0.5061, test_loss: 1.2263, test_f1: 0.6485
 epoch: 61, train_loss: 0.5193, test_loss: 1.1528, test_f1: 0.6535
 epoch: 62, train_loss: 0.5332, test_loss: 1.1130, test_f1: 0.7178
 epoch: 63, train_loss: 0.5175, test_loss: 1.1243, test_f1: 0.6451
 epoch: 64, train_loss: 0.4970, test_loss: 1.1998, test_f1: 0.6663
 epoch: 65, train_loss: 0.4904, test_loss: 1.1689, test_f1: 0.6640
 epoch: 66, train_loss: 0.4961, test_loss: 1.2980, test_f1: 0.6543
 epoch: 67, train_loss: 0.5023, test_loss: 1.2913, test_f1: 0.6492
 epoch: 68, train_loss: 0.4875, test_loss: 1.3485, test_f1: 0.6120
 epoch: 69, train_loss: 0.4937, test_loss: 1.3489, test_f1: 0.5566
 epoch: 70, train_loss: 0.5082, test_loss: 1.3314, test_f1: 0.6030
 epoch: 71, train_loss: 0.5036, test_loss: 1.2880, test_f1: 0.6010
 epoch: 72, train_loss: 0.4949, test_loss: 1.2978, test_f1: 0.6109
 epoch: 73, train_loss: 0.4759, test_loss: 1.3733, test_f1: 0.6108
 epoch: 74, train_loss: 0.5178, test_loss: 1.4013, test_f1: 0.6535
 epoch: 75, train_loss: 0.4803, test_loss: 1.2477, test_f1: 0.6162
 epoch: 76, train_loss: 0.4578, test_loss: 1.3018, test_f1: 0.6402
 epoch: 77, train_loss: 0.4668, test_loss: 1.3117, test_f1: 0.5861
 epoch: 78, train_loss: 0.4953, test_loss: 1.1490, test_f1: 0.5807
 epoch: 79, train_loss: 0.4813, test_loss: 1.1555, test_f1: 0.6511
 epoch: 80, train_loss: 0.4676, test_loss: 1.2706, test_f1: 0.6307
 epoch: 81, train_loss: 0.4508, test_loss: 1.3626, test_f1: 0.6669
 epoch: 82, train_loss: 0.4575, test_loss: 1.4697, test_f1: 0.6318
 epoch: 83, train_loss: 0.4644, test_loss: 1.3900, test_f1: 0.5023
 epoch: 84, train_loss: 0.5468, test_loss: 1.3252, test_f1: 0.5767
 epoch: 85, train_loss: 0.5517, test_loss: 1.1737, test_f1: 0.5964
 epoch: 86, train_loss: 0.5115, test_loss: 1.4841, test_f1: 0.6293
 epoch: 87, train_loss: 0.4565, test_loss: 1.2893, test_f1: 0.6072
 epoch: 88, train_loss: 0.4415, test_loss: 1.2583, test_f1: 0.6469
 epoch: 89, train_loss: 0.4688, test_loss: 1.1997, test_f1: 0.5816
 epoch: 90, train_loss: 0.4726, test_loss: 1.1989, test_f1: 0.6128
 epoch: 91, train_loss: 0.4459, test_loss: 1.1724, test_f1: 0.6369
 epoch: 92, train_loss: 0.4446, test_loss: 1.3227, test_f1: 0.5746
 epoch: 93, train_loss: 0.4450, test_loss: 1.5939, test_f1: 0.5757
 epoch: 94, train_loss: 0.4929, test_loss: 1.6627, test_f1: 0.5751
 epoch: 95, train_loss: 0.4585, test_loss: 1.7014, test_f1: 0.6089
 epoch: 96, train_loss: 0.4418, test_loss: 1.2250, test_f1: 0.6396
 epoch: 97, train_loss: 0.4427, test_loss: 1.1971, test_f1: 0.6287
 epoch: 98, train_loss: 0.4219, test_loss: 1.4374, test_f1: 0.6014
 epoch: 99, train_loss: 0.3912, test_loss: 1.2868, test_f1: 0.6648
##################ITERATION #4 ****************************************
 epoch: 0, train_loss: 1.1569, test_loss: 1.4784, test_f1: 0.1368
 epoch: 1, train_loss: 0.9793, test_loss: 1.2300, test_f1: 0.3245
 epoch: 2, train_loss: 0.9072, test_loss: 1.1807, test_f1: 0.4720
 epoch: 3, train_loss: 0.8672, test_loss: 1.0246, test_f1: 0.5172
 epoch: 4, train_loss: 0.8406, test_loss: 1.0433, test_f1: 0.5236
 epoch: 5, train_loss: 0.8158, test_loss: 1.3740, test_f1: 0.4936
 epoch: 6, train_loss: 0.8003, test_loss: 1.2620, test_f1: 0.5495
 epoch: 7, train_loss: 0.7936, test_loss: 0.9468, test_f1: 0.5626
 epoch: 8, train_loss: 0.7916, test_loss: 0.9328, test_f1: 0.6082
 epoch: 9, train_loss: 0.7874, test_loss: 1.1181, test_f1: 0.5710
 epoch: 10, train_loss: 0.7470, test_loss: 0.9526, test_f1: 0.5972
 epoch: 11, train_loss: 0.7183, test_loss: 1.0736, test_f1: 0.5545
 epoch: 12, train_loss: 0.7242, test_loss: 1.1960, test_f1: 0.5588
 epoch: 13, train_loss: 0.7037, test_loss: 1.0375, test_f1: 0.5562
 epoch: 14, train_loss: 0.7278, test_loss: 1.0924, test_f1: 0.5186
 epoch: 15, train_loss: 0.7263, test_loss: 2.0550, test_f1: 0.4196
 epoch: 16, train_loss: 0.7141, test_loss: 1.0228, test_f1: 0.5718
 epoch: 17, train_loss: 0.7399, test_loss: 1.0927, test_f1: 0.5891
 epoch: 18, train_loss: 0.7424, test_loss: 1.6691, test_f1: 0.4928
 epoch: 19, train_loss: 0.6976, test_loss: 0.9265, test_f1: 0.6232
 epoch: 20, train_loss: 0.6774, test_loss: 1.0893, test_f1: 0.5845
 epoch: 21, train_loss: 0.6701, test_loss: 0.9157, test_f1: 0.6409
 epoch: 22, train_loss: 0.6873, test_loss: 1.0412, test_f1: 0.6345
 epoch: 23, train_loss: 0.6362, test_loss: 0.9650, test_f1: 0.6460
 epoch: 24, train_loss: 0.6580, test_loss: 1.3384, test_f1: 0.5567
 epoch: 25, train_loss: 0.6467, test_loss: 1.2488, test_f1: 0.6395
 epoch: 26, train_loss: 0.6338, test_loss: 1.2801, test_f1: 0.5297
 epoch: 27, train_loss: 0.6566, test_loss: 1.2595, test_f1: 0.6029
 epoch: 28, train_loss: 0.6563, test_loss: 1.3307, test_f1: 0.5223
 epoch: 29, train_loss: 0.6345, test_loss: 1.8213, test_f1: 0.5681
 epoch: 30, train_loss: 0.6133, test_loss: 1.1260, test_f1: 0.5562
 epoch: 31, train_loss: 0.6189, test_loss: 1.3969, test_f1: 0.5443
 epoch: 32, train_loss: 0.6202, test_loss: 1.1153, test_f1: 0.5483
 epoch: 33, train_loss: 0.6362, test_loss: 1.3474, test_f1: 0.5874
 epoch: 34, train_loss: 0.6760, test_loss: 1.0655, test_f1: 0.5859
 epoch: 35, train_loss: 0.6446, test_loss: 1.1851, test_f1: 0.5607
 epoch: 36, train_loss: 0.6113, test_loss: 1.1146, test_f1: 0.5851
 epoch: 37, train_loss: 0.6165, test_loss: 0.9995, test_f1: 0.6158
 epoch: 38, train_loss: 0.6187, test_loss: 1.1070, test_f1: 0.5971
 epoch: 39, train_loss: 0.5967, test_loss: 1.1362, test_f1: 0.6069
 epoch: 40, train_loss: 0.6246, test_loss: 1.1301, test_f1: 0.5825
 epoch: 41, train_loss: 0.5827, test_loss: 1.4065, test_f1: 0.5233
 epoch: 42, train_loss: 0.5985, test_loss: 1.2094, test_f1: 0.5791
 epoch: 43, train_loss: 0.6361, test_loss: 1.1130, test_f1: 0.5587
 epoch: 44, train_loss: 0.5940, test_loss: 1.1417, test_f1: 0.6079
 epoch: 45, train_loss: 0.5936, test_loss: 1.1101, test_f1: 0.5809
 epoch: 46, train_loss: 0.5754, test_loss: 1.2360, test_f1: 0.5975
 epoch: 47, train_loss: 0.5607, test_loss: 1.1282, test_f1: 0.6239
 epoch: 48, train_loss: 0.5545, test_loss: 1.1080, test_f1: 0.6080
 epoch: 49, train_loss: 0.5735, test_loss: 1.1446, test_f1: 0.5693
 epoch: 50, train_loss: 0.5733, test_loss: 1.6317, test_f1: 0.5523
 epoch: 51, train_loss: 0.5206, test_loss: 1.3570, test_f1: 0.6015
 epoch: 52, train_loss: 0.4915, test_loss: 1.2720, test_f1: 0.5347
 epoch: 53, train_loss: 0.5289, test_loss: 1.2921, test_f1: 0.5848
 epoch: 54, train_loss: 0.5291, test_loss: 1.2007, test_f1: 0.6440
 epoch: 55, train_loss: 0.5204, test_loss: 1.1172, test_f1: 0.6337
 epoch: 56, train_loss: 0.4923, test_loss: 1.2644, test_f1: 0.6322
 epoch: 57, train_loss: 0.4815, test_loss: 1.2927, test_f1: 0.5848
 epoch: 58, train_loss: 0.4918, test_loss: 1.4189, test_f1: 0.5506
 epoch: 59, train_loss: 0.4564, test_loss: 1.4833, test_f1: 0.5913
 epoch: 60, train_loss: 0.4652, test_loss: 1.5851, test_f1: 0.5965
 epoch: 61, train_loss: 0.4938, test_loss: 1.4234, test_f1: 0.6033
 epoch: 62, train_loss: 0.4936, test_loss: 1.4034, test_f1: 0.5206
 epoch: 63, train_loss: 0.4844, test_loss: 1.7046, test_f1: 0.5655
 epoch: 64, train_loss: 0.4736, test_loss: 1.4429, test_f1: 0.6171
 epoch: 65, train_loss: 0.4696, test_loss: 1.4971, test_f1: 0.5385
 epoch: 66, train_loss: 0.4776, test_loss: 1.2942, test_f1: 0.6603
 epoch: 67, train_loss: 0.4374, test_loss: 1.3776, test_f1: 0.5315
 epoch: 68, train_loss: 0.4892, test_loss: 1.3358, test_f1: 0.6040
 epoch: 69, train_loss: 0.4582, test_loss: 1.4358, test_f1: 0.5808
 epoch: 70, train_loss: 0.4530, test_loss: 1.5437, test_f1: 0.5688
 epoch: 71, train_loss: 0.4566, test_loss: 1.4556, test_f1: 0.5876
 epoch: 72, train_loss: 0.4203, test_loss: 1.3492, test_f1: 0.6295
 epoch: 73, train_loss: 0.4284, test_loss: 1.7245, test_f1: 0.5359
 epoch: 74, train_loss: 0.4251, test_loss: 1.3065, test_f1: 0.6346
 epoch: 75, train_loss: 0.4239, test_loss: 1.4856, test_f1: 0.6215
 epoch: 76, train_loss: 0.4473, test_loss: 1.7007, test_f1: 0.5974
 epoch: 77, train_loss: 0.4343, test_loss: 1.4089, test_f1: 0.5649
 epoch: 78, train_loss: 0.4911, test_loss: 1.4214, test_f1: 0.5388
 epoch: 79, train_loss: 0.4189, test_loss: 1.7232, test_f1: 0.5489
 epoch: 80, train_loss: 0.4342, test_loss: 1.4268, test_f1: 0.6071
 epoch: 81, train_loss: 0.4042, test_loss: 1.3910, test_f1: 0.6238
 epoch: 82, train_loss: 0.3910, test_loss: 1.4024, test_f1: 0.6103
 epoch: 83, train_loss: 0.3953, test_loss: 1.5794, test_f1: 0.5610
 epoch: 84, train_loss: 0.4358, test_loss: 1.6042, test_f1: 0.6124
 epoch: 85, train_loss: 0.4432, test_loss: 1.4634, test_f1: 0.5667
 epoch: 86, train_loss: 0.4284, test_loss: 1.7323, test_f1: 0.5765
 epoch: 87, train_loss: 0.3798, test_loss: 1.4905, test_f1: 0.5916
 epoch: 88, train_loss: 0.3786, test_loss: 1.7382, test_f1: 0.5562
 epoch: 89, train_loss: 0.4080, test_loss: 1.5899, test_f1: 0.5705
 epoch: 90, train_loss: 0.3716, test_loss: 1.7505, test_f1: 0.5244
 epoch: 91, train_loss: 0.4048, test_loss: 1.6368, test_f1: 0.5686
 epoch: 92, train_loss: 0.4118, test_loss: 1.6719, test_f1: 0.5402
 epoch: 93, train_loss: 0.4165, test_loss: 1.7969, test_f1: 0.6137
 epoch: 94, train_loss: 0.3650, test_loss: 1.6690, test_f1: 0.6035
 epoch: 95, train_loss: 0.3853, test_loss: 1.7110, test_f1: 0.6040
 epoch: 96, train_loss: 0.3857, test_loss: 1.8504, test_f1: 0.5953
 epoch: 97, train_loss: 0.4136, test_loss: 1.5746, test_f1: 0.6221
 epoch: 98, train_loss: 0.4580, test_loss: 1.3126, test_f1: 0.5944
 epoch: 99, train_loss: 0.4334, test_loss: 1.7979, test_f1: 0.6100
##################ITERATION #5 ****************************************
 epoch: 0, train_loss: 1.2189, test_loss: 1.4143, test_f1: 0.3311
 epoch: 1, train_loss: 1.0201, test_loss: 1.3145, test_f1: 0.2887
 epoch: 2, train_loss: 0.9595, test_loss: 1.3003, test_f1: 0.3707
 epoch: 3, train_loss: 0.8999, test_loss: 1.2533, test_f1: 0.4213
 epoch: 4, train_loss: 0.8616, test_loss: 1.1303, test_f1: 0.4461
 epoch: 5, train_loss: 0.8357, test_loss: 1.0397, test_f1: 0.5702
 epoch: 6, train_loss: 0.8562, test_loss: 1.0125, test_f1: 0.5533
 epoch: 7, train_loss: 0.8332, test_loss: 1.1672, test_f1: 0.5028
 epoch: 8, train_loss: 0.8022, test_loss: 1.0365, test_f1: 0.5693
 epoch: 9, train_loss: 0.8097, test_loss: 1.0883, test_f1: 0.5891
 epoch: 10, train_loss: 0.7829, test_loss: 1.3185, test_f1: 0.4664
 epoch: 11, train_loss: 0.7729, test_loss: 1.1073, test_f1: 0.5119
 epoch: 12, train_loss: 0.7529, test_loss: 1.1397, test_f1: 0.5864
 epoch: 13, train_loss: 0.7681, test_loss: 1.0553, test_f1: 0.5528
 epoch: 14, train_loss: 0.7526, test_loss: 1.7790, test_f1: 0.4897
 epoch: 15, train_loss: 0.7534, test_loss: 1.4338, test_f1: 0.5302
 epoch: 16, train_loss: 0.7439, test_loss: 1.3116, test_f1: 0.5398
 epoch: 17, train_loss: 0.7616, test_loss: 1.0557, test_f1: 0.5596
 epoch: 18, train_loss: 0.7407, test_loss: 1.0844, test_f1: 0.5546
 epoch: 19, train_loss: 0.7590, test_loss: 2.7649, test_f1: 0.3393
 epoch: 20, train_loss: 0.7215, test_loss: 1.0798, test_f1: 0.5863
 epoch: 21, train_loss: 0.7172, test_loss: 1.3239, test_f1: 0.4522
 epoch: 22, train_loss: 0.6917, test_loss: 1.6958, test_f1: 0.5072
 epoch: 23, train_loss: 0.7239, test_loss: 1.2448, test_f1: 0.5710
 epoch: 24, train_loss: 0.6985, test_loss: 1.3754, test_f1: 0.4904
 epoch: 25, train_loss: 0.7015, test_loss: 1.1093, test_f1: 0.5520
 epoch: 26, train_loss: 0.6952, test_loss: 1.2097, test_f1: 0.4586
 epoch: 27, train_loss: 0.7257, test_loss: 1.0954, test_f1: 0.5374
 epoch: 28, train_loss: 0.7317, test_loss: 1.6364, test_f1: 0.4238
 epoch: 29, train_loss: 0.7089, test_loss: 2.0368, test_f1: 0.4287
 epoch: 30, train_loss: 0.7568, test_loss: 1.2825, test_f1: 0.4710
 epoch: 31, train_loss: 0.7139, test_loss: 1.4492, test_f1: 0.4869
 epoch: 32, train_loss: 0.6706, test_loss: 2.7276, test_f1: 0.4223
 epoch: 33, train_loss: 0.6457, test_loss: 1.2974, test_f1: 0.5479
 epoch: 34, train_loss: 0.6450, test_loss: 1.6735, test_f1: 0.5173
 epoch: 35, train_loss: 0.6423, test_loss: 1.5084, test_f1: 0.5427
 epoch: 36, train_loss: 0.6583, test_loss: 1.1437, test_f1: 0.5745
 epoch: 37, train_loss: 0.6288, test_loss: 1.1477, test_f1: 0.6056
 epoch: 38, train_loss: 0.6043, test_loss: 1.6429, test_f1: 0.5298
 epoch: 39, train_loss: 0.7041, test_loss: 1.2841, test_f1: 0.5527
 epoch: 40, train_loss: 0.6464, test_loss: 1.7249, test_f1: 0.5632
 epoch: 41, train_loss: 0.6398, test_loss: 1.3048, test_f1: 0.5325
 epoch: 42, train_loss: 0.5960, test_loss: 1.4860, test_f1: 0.4996
 epoch: 43, train_loss: 0.5910, test_loss: 1.3260, test_f1: 0.5975
 epoch: 44, train_loss: 0.6030, test_loss: 1.2815, test_f1: 0.5791
 epoch: 45, train_loss: 0.6140, test_loss: 1.2440, test_f1: 0.6316
 epoch: 46, train_loss: 0.6272, test_loss: 1.4453, test_f1: 0.5767
 epoch: 47, train_loss: 0.5969, test_loss: 1.2797, test_f1: 0.6353
 epoch: 48, train_loss: 0.5847, test_loss: 1.1577, test_f1: 0.5903
 epoch: 49, train_loss: 0.5917, test_loss: 1.5814, test_f1: 0.5170
 epoch: 50, train_loss: 0.6388, test_loss: 1.8162, test_f1: 0.5974
 epoch: 51, train_loss: 0.5598, test_loss: 1.3582, test_f1: 0.6027
 epoch: 52, train_loss: 0.5509, test_loss: 1.2232, test_f1: 0.6127
 epoch: 53, train_loss: 0.5349, test_loss: 1.1969, test_f1: 0.6477
 epoch: 54, train_loss: 0.5322, test_loss: 1.3825, test_f1: 0.6386
 epoch: 55, train_loss: 0.5003, test_loss: 1.3736, test_f1: 0.6082
 epoch: 56, train_loss: 0.5174, test_loss: 1.3154, test_f1: 0.6483
 epoch: 57, train_loss: 0.4937, test_loss: 1.3275, test_f1: 0.6244
 epoch: 58, train_loss: 0.4867, test_loss: 1.4189, test_f1: 0.6040
 epoch: 59, train_loss: 0.5254, test_loss: 1.3215, test_f1: 0.6528
 epoch: 60, train_loss: 0.5129, test_loss: 1.3127, test_f1: 0.6410
 epoch: 61, train_loss: 0.4773, test_loss: 1.4828, test_f1: 0.6717
 epoch: 62, train_loss: 0.4871, test_loss: 1.8050, test_f1: 0.6275
 epoch: 63, train_loss: 0.5066, test_loss: 1.3030, test_f1: 0.6243
 epoch: 64, train_loss: 0.5231, test_loss: 1.9661, test_f1: 0.6099
 epoch: 65, train_loss: 0.4989, test_loss: 1.9807, test_f1: 0.5728
 epoch: 66, train_loss: 0.5053, test_loss: 1.6345, test_f1: 0.6239
 epoch: 67, train_loss: 0.4941, test_loss: 1.4522, test_f1: 0.6790
 epoch: 68, train_loss: 0.4975, test_loss: 1.6079, test_f1: 0.5760
 epoch: 69, train_loss: 0.4995, test_loss: 1.8686, test_f1: 0.6222
 epoch: 70, train_loss: 0.4855, test_loss: 1.6490, test_f1: 0.6706
 epoch: 71, train_loss: 0.4532, test_loss: 1.2557, test_f1: 0.6348
 epoch: 72, train_loss: 0.4784, test_loss: 1.5030, test_f1: 0.6186
 epoch: 73, train_loss: 0.4791, test_loss: 2.2072, test_f1: 0.5550
 epoch: 74, train_loss: 0.4522, test_loss: 1.8440, test_f1: 0.5905
 epoch: 75, train_loss: 0.4557, test_loss: 1.5797, test_f1: 0.5994
 epoch: 76, train_loss: 0.4542, test_loss: 1.9268, test_f1: 0.6261
 epoch: 77, train_loss: 0.4324, test_loss: 1.8646, test_f1: 0.5993
 epoch: 78, train_loss: 0.4215, test_loss: 1.7121, test_f1: 0.6323
 epoch: 79, train_loss: 0.4576, test_loss: 1.6224, test_f1: 0.6031
 epoch: 80, train_loss: 0.4545, test_loss: 1.9382, test_f1: 0.6331
 epoch: 81, train_loss: 0.4409, test_loss: 1.9610, test_f1: 0.6043
 epoch: 82, train_loss: 0.4411, test_loss: 1.6073, test_f1: 0.5544
 epoch: 83, train_loss: 0.4327, test_loss: 1.6415, test_f1: 0.6189
 epoch: 84, train_loss: 0.4633, test_loss: 2.2706, test_f1: 0.5635
 epoch: 85, train_loss: 0.4481, test_loss: 1.8442, test_f1: 0.5762
 epoch: 86, train_loss: 0.4539, test_loss: 1.7302, test_f1: 0.6316
 epoch: 87, train_loss: 0.4483, test_loss: 1.6852, test_f1: 0.5651
 epoch: 88, train_loss: 0.4633, test_loss: 1.9275, test_f1: 0.6119
 epoch: 89, train_loss: 0.4979, test_loss: 1.7137, test_f1: 0.5941
 epoch: 90, train_loss: 0.4501, test_loss: 1.7873, test_f1: 0.6385
 epoch: 91, train_loss: 0.4183, test_loss: 1.5157, test_f1: 0.6456
 epoch: 92, train_loss: 0.4239, test_loss: 2.1572, test_f1: 0.6001
 epoch: 93, train_loss: 0.4452, test_loss: 2.1719, test_f1: 0.6570
 epoch: 94, train_loss: 0.4287, test_loss: 2.2619, test_f1: 0.5541
 epoch: 95, train_loss: 0.4258, test_loss: 1.9223, test_f1: 0.6513
 epoch: 96, train_loss: 0.3950, test_loss: 2.2771, test_f1: 0.6330
 epoch: 97, train_loss: 0.3995, test_loss: 2.3876, test_f1: 0.5985
 epoch: 98, train_loss: 0.3955, test_loss: 2.0147, test_f1: 0.6255
 epoch: 99, train_loss: 0.3857, test_loss: 1.7327, test_f1: 0.6285
##################ITERATION #6 ****************************************
 epoch: 0, train_loss: 1.2600, test_loss: 1.4587, test_f1: 0.3347
 epoch: 1, train_loss: 1.0466, test_loss: 1.4152, test_f1: 0.1438
 epoch: 2, train_loss: 0.9727, test_loss: 1.4936, test_f1: 0.3510
 epoch: 3, train_loss: 0.9786, test_loss: 1.0693, test_f1: 0.4906
 epoch: 4, train_loss: 0.9126, test_loss: 0.9927, test_f1: 0.5642
 epoch: 5, train_loss: 0.8793, test_loss: 1.2197, test_f1: 0.4875
 epoch: 6, train_loss: 0.8564, test_loss: 1.1931, test_f1: 0.4684
 epoch: 7, train_loss: 0.8502, test_loss: 0.9993, test_f1: 0.5291
 epoch: 8, train_loss: 0.8300, test_loss: 1.0364, test_f1: 0.5837
 epoch: 9, train_loss: 0.8160, test_loss: 1.0472, test_f1: 0.4300
 epoch: 10, train_loss: 0.8047, test_loss: 1.1761, test_f1: 0.5326
 epoch: 11, train_loss: 0.7898, test_loss: 1.0709, test_f1: 0.5299
 epoch: 12, train_loss: 0.7932, test_loss: 1.0584, test_f1: 0.5141
 epoch: 13, train_loss: 0.7766, test_loss: 0.9657, test_f1: 0.5649
 epoch: 14, train_loss: 0.7749, test_loss: 1.2939, test_f1: 0.4873
 epoch: 15, train_loss: 0.7612, test_loss: 0.9881, test_f1: 0.5885
 epoch: 16, train_loss: 0.7625, test_loss: 1.0507, test_f1: 0.5762
 epoch: 17, train_loss: 0.7863, test_loss: 3.0639, test_f1: 0.3748
 epoch: 18, train_loss: 0.7403, test_loss: 1.6919, test_f1: 0.4155
 epoch: 19, train_loss: 0.7416, test_loss: 1.2353, test_f1: 0.5712
 epoch: 20, train_loss: 0.7294, test_loss: 1.0293, test_f1: 0.5248
 epoch: 21, train_loss: 0.7213, test_loss: 1.6514, test_f1: 0.4275
 epoch: 22, train_loss: 0.7249, test_loss: 1.4278, test_f1: 0.5396
 epoch: 23, train_loss: 0.7226, test_loss: 1.1774, test_f1: 0.6429
 epoch: 24, train_loss: 0.7040, test_loss: 1.0685, test_f1: 0.6127
 epoch: 25, train_loss: 0.7226, test_loss: 1.3368, test_f1: 0.5032
 epoch: 26, train_loss: 0.7329, test_loss: 1.0751, test_f1: 0.6686
 epoch: 27, train_loss: 0.7118, test_loss: 0.9653, test_f1: 0.6090
 epoch: 28, train_loss: 0.7353, test_loss: 1.0182, test_f1: 0.6022
 epoch: 29, train_loss: 0.7030, test_loss: 1.0346, test_f1: 0.6047
 epoch: 30, train_loss: 0.6942, test_loss: 1.0352, test_f1: 0.5762
 epoch: 31, train_loss: 0.7077, test_loss: 1.0004, test_f1: 0.5479
 epoch: 32, train_loss: 0.6924, test_loss: 1.0518, test_f1: 0.5569
 epoch: 33, train_loss: 0.6943, test_loss: 1.0929, test_f1: 0.5287
 epoch: 34, train_loss: 0.6750, test_loss: 1.1496, test_f1: 0.5584
 epoch: 35, train_loss: 0.6889, test_loss: 1.0963, test_f1: 0.6192
 epoch: 36, train_loss: 0.6774, test_loss: 1.1148, test_f1: 0.5559
 epoch: 37, train_loss: 0.6941, test_loss: 1.0307, test_f1: 0.5851
 epoch: 38, train_loss: 0.6534, test_loss: 1.1613, test_f1: 0.5519
 epoch: 39, train_loss: 0.6826, test_loss: 1.4300, test_f1: 0.5118
 epoch: 40, train_loss: 0.6706, test_loss: 1.4482, test_f1: 0.4794
 epoch: 41, train_loss: 0.6676, test_loss: 1.1942, test_f1: 0.5350
 epoch: 42, train_loss: 0.6747, test_loss: 1.2516, test_f1: 0.5225
 epoch: 43, train_loss: 0.6859, test_loss: 1.5030, test_f1: 0.5322
 epoch: 44, train_loss: 0.6627, test_loss: 1.2895, test_f1: 0.5734
 epoch: 45, train_loss: 0.6742, test_loss: 0.9645, test_f1: 0.6327
 epoch: 46, train_loss: 0.6704, test_loss: 1.1063, test_f1: 0.5653
 epoch: 47, train_loss: 0.6409, test_loss: 1.0618, test_f1: 0.5866
 epoch: 48, train_loss: 0.6243, test_loss: 1.2867, test_f1: 0.5872
 epoch: 49, train_loss: 0.6094, test_loss: 1.3240, test_f1: 0.5101
 epoch: 50, train_loss: 0.5980, test_loss: 1.2613, test_f1: 0.5176
 epoch: 51, train_loss: 0.6210, test_loss: 1.3713, test_f1: 0.5897
 epoch: 52, train_loss: 0.5995, test_loss: 1.1869, test_f1: 0.6261
 epoch: 53, train_loss: 0.5757, test_loss: 1.1334, test_f1: 0.5827
 epoch: 54, train_loss: 0.5764, test_loss: 1.2153, test_f1: 0.6139
 epoch: 55, train_loss: 0.5936, test_loss: 1.1433, test_f1: 0.5918
 epoch: 56, train_loss: 0.5696, test_loss: 1.1679, test_f1: 0.6219
 epoch: 57, train_loss: 0.5613, test_loss: 1.3371, test_f1: 0.5704
 epoch: 58, train_loss: 0.5498, test_loss: 1.2712, test_f1: 0.5793
 epoch: 59, train_loss: 0.5618, test_loss: 1.2527, test_f1: 0.5809
 epoch: 60, train_loss: 0.5830, test_loss: 1.5281, test_f1: 0.5248
 epoch: 61, train_loss: 0.5477, test_loss: 1.4356, test_f1: 0.5991
 epoch: 62, train_loss: 0.5561, test_loss: 1.2785, test_f1: 0.5919
 epoch: 63, train_loss: 0.5243, test_loss: 1.3050, test_f1: 0.6091
 epoch: 64, train_loss: 0.5169, test_loss: 1.3256, test_f1: 0.5844
 epoch: 65, train_loss: 0.5517, test_loss: 1.2466, test_f1: 0.5510
 epoch: 66, train_loss: 0.5464, test_loss: 1.4837, test_f1: 0.5899
 epoch: 67, train_loss: 0.5767, test_loss: 1.7323, test_f1: 0.5678
 epoch: 68, train_loss: 0.5440, test_loss: 1.5638, test_f1: 0.6190
 epoch: 69, train_loss: 0.5339, test_loss: 1.1396, test_f1: 0.5812
 epoch: 70, train_loss: 0.5340, test_loss: 1.3358, test_f1: 0.5674
 epoch: 71, train_loss: 0.5497, test_loss: 1.4425, test_f1: 0.5672
 epoch: 72, train_loss: 0.5221, test_loss: 1.3700, test_f1: 0.5781
 epoch: 73, train_loss: 0.5333, test_loss: 1.1733, test_f1: 0.6229
 epoch: 74, train_loss: 0.5256, test_loss: 1.3763, test_f1: 0.5525
 epoch: 75, train_loss: 0.5161, test_loss: 1.2832, test_f1: 0.5639
 epoch: 76, train_loss: 0.5035, test_loss: 1.4115, test_f1: 0.6151
 epoch: 77, train_loss: 0.4897, test_loss: 1.3235, test_f1: 0.6262
 epoch: 78, train_loss: 0.5249, test_loss: 1.4056, test_f1: 0.5603
 epoch: 79, train_loss: 0.5066, test_loss: 1.4392, test_f1: 0.6016
 epoch: 80, train_loss: 0.4800, test_loss: 1.3770, test_f1: 0.6326
 epoch: 81, train_loss: 0.4855, test_loss: 1.3060, test_f1: 0.6416
 epoch: 82, train_loss: 0.4933, test_loss: 1.4133, test_f1: 0.5440
 epoch: 83, train_loss: 0.4652, test_loss: 1.5642, test_f1: 0.6186
 epoch: 84, train_loss: 0.4956, test_loss: 1.3841, test_f1: 0.6057
 epoch: 85, train_loss: 0.5148, test_loss: 1.4309, test_f1: 0.6241
 epoch: 86, train_loss: 0.5013, test_loss: 1.4714, test_f1: 0.5775
 epoch: 87, train_loss: 0.4726, test_loss: 1.7265, test_f1: 0.5648
 epoch: 88, train_loss: 0.4839, test_loss: 1.3955, test_f1: 0.5999
 epoch: 89, train_loss: 0.4678, test_loss: 1.4473, test_f1: 0.5774
 epoch: 90, train_loss: 0.4498, test_loss: 1.2090, test_f1: 0.6227
 epoch: 91, train_loss: 0.4551, test_loss: 1.4992, test_f1: 0.5655
 epoch: 92, train_loss: 0.5288, test_loss: 1.5890, test_f1: 0.5924
 epoch: 93, train_loss: 0.4970, test_loss: 1.3023, test_f1: 0.5939
 epoch: 94, train_loss: 0.4654, test_loss: 1.4517, test_f1: 0.6278
 epoch: 95, train_loss: 0.5008, test_loss: 1.5792, test_f1: 0.6067
 epoch: 96, train_loss: 0.4648, test_loss: 1.4053, test_f1: 0.6106
 epoch: 97, train_loss: 0.4603, test_loss: 1.3332, test_f1: 0.6101
 epoch: 98, train_loss: 0.4416, test_loss: 1.3224, test_f1: 0.6148
 epoch: 99, train_loss: 0.4805, test_loss: 1.3156, test_f1: 0.6130
##################ITERATION #7 ****************************************
 epoch: 0, train_loss: 1.2218, test_loss: 1.4286, test_f1: 0.3388
 epoch: 1, train_loss: 1.0460, test_loss: 1.2461, test_f1: 0.3376
 epoch: 2, train_loss: 0.9309, test_loss: 1.1103, test_f1: 0.4594
 epoch: 3, train_loss: 0.8670, test_loss: 1.3142, test_f1: 0.5724
 epoch: 4, train_loss: 0.8575, test_loss: 1.1649, test_f1: 0.4728
 epoch: 5, train_loss: 0.8448, test_loss: 1.3256, test_f1: 0.5005
 epoch: 6, train_loss: 0.8264, test_loss: 1.0619, test_f1: 0.5753
 epoch: 7, train_loss: 0.8242, test_loss: 1.0122, test_f1: 0.5490
 epoch: 8, train_loss: 0.7847, test_loss: 1.1400, test_f1: 0.5258
 epoch: 9, train_loss: 0.7658, test_loss: 1.3220, test_f1: 0.6088
 epoch: 10, train_loss: 0.7734, test_loss: 1.0767, test_f1: 0.5481
 epoch: 11, train_loss: 0.7664, test_loss: 1.3718, test_f1: 0.4378
 epoch: 12, train_loss: 0.7530, test_loss: 1.3288, test_f1: 0.5210
 epoch: 13, train_loss: 0.7677, test_loss: 0.9707, test_f1: 0.5800
 epoch: 14, train_loss: 0.7619, test_loss: 1.1523, test_f1: 0.5350
 epoch: 15, train_loss: 0.7454, test_loss: 1.1533, test_f1: 0.5434
 epoch: 16, train_loss: 0.7469, test_loss: 1.0791, test_f1: 0.5516
 epoch: 17, train_loss: 0.7269, test_loss: 1.1272, test_f1: 0.5738
 epoch: 18, train_loss: 0.7161, test_loss: 0.9620, test_f1: 0.5716
 epoch: 19, train_loss: 0.6952, test_loss: 0.9931, test_f1: 0.6092
 epoch: 20, train_loss: 0.6905, test_loss: 1.1054, test_f1: 0.5877
 epoch: 21, train_loss: 0.7326, test_loss: 1.0119, test_f1: 0.5939
 epoch: 22, train_loss: 0.7232, test_loss: 1.1468, test_f1: 0.5664
 epoch: 23, train_loss: 0.6977, test_loss: 1.2849, test_f1: 0.5999
 epoch: 24, train_loss: 0.6584, test_loss: 1.2805, test_f1: 0.5806
 epoch: 25, train_loss: 0.6500, test_loss: 1.2145, test_f1: 0.5711
 epoch: 26, train_loss: 0.6518, test_loss: 1.0240, test_f1: 0.6020
 epoch: 27, train_loss: 0.6996, test_loss: 1.0196, test_f1: 0.6167
 epoch: 28, train_loss: 0.6793, test_loss: 1.6109, test_f1: 0.5131
 epoch: 29, train_loss: 0.6581, test_loss: 0.9728, test_f1: 0.6673
 epoch: 30, train_loss: 0.6431, test_loss: 1.0345, test_f1: 0.6305
 epoch: 31, train_loss: 0.6388, test_loss: 1.0493, test_f1: 0.6432
 epoch: 32, train_loss: 0.6276, test_loss: 1.1770, test_f1: 0.6268
 epoch: 33, train_loss: 0.6472, test_loss: 1.1669, test_f1: 0.6097
 epoch: 34, train_loss: 0.6218, test_loss: 0.9762, test_f1: 0.6620
 epoch: 35, train_loss: 0.6201, test_loss: 1.3605, test_f1: 0.5773
 epoch: 36, train_loss: 0.6037, test_loss: 1.0521, test_f1: 0.6755
 epoch: 37, train_loss: 0.6003, test_loss: 1.1741, test_f1: 0.6434
 epoch: 38, train_loss: 0.5931, test_loss: 1.2455, test_f1: 0.5979
 epoch: 39, train_loss: 0.6055, test_loss: 1.6420, test_f1: 0.5465
 epoch: 40, train_loss: 0.6066, test_loss: 2.2389, test_f1: 0.4378
 epoch: 41, train_loss: 0.5983, test_loss: 1.1709, test_f1: 0.6444
 epoch: 42, train_loss: 0.5913, test_loss: 1.3482, test_f1: 0.6586
 epoch: 43, train_loss: 0.5877, test_loss: 1.0572, test_f1: 0.6307
 epoch: 44, train_loss: 0.5550, test_loss: 1.0223, test_f1: 0.6610
 epoch: 45, train_loss: 0.5814, test_loss: 1.1460, test_f1: 0.6520
 epoch: 46, train_loss: 0.5435, test_loss: 1.1291, test_f1: 0.6462
 epoch: 47, train_loss: 0.5476, test_loss: 1.3772, test_f1: 0.4563
 epoch: 48, train_loss: 0.6189, test_loss: 1.4533, test_f1: 0.5408
 epoch: 49, train_loss: 0.6108, test_loss: 1.6262, test_f1: 0.4951
 epoch: 50, train_loss: 0.5632, test_loss: 1.4123, test_f1: 0.6163
 epoch: 51, train_loss: 0.5361, test_loss: 1.1151, test_f1: 0.6702
 epoch: 52, train_loss: 0.5241, test_loss: 1.2384, test_f1: 0.6591
 epoch: 53, train_loss: 0.5002, test_loss: 1.1075, test_f1: 0.6857
 epoch: 54, train_loss: 0.4915, test_loss: 1.2930, test_f1: 0.6788
 epoch: 55, train_loss: 0.4954, test_loss: 1.3783, test_f1: 0.6553
 epoch: 56, train_loss: 0.4692, test_loss: 1.1529, test_f1: 0.6978
 epoch: 57, train_loss: 0.4737, test_loss: 1.4143, test_f1: 0.6531
 epoch: 58, train_loss: 0.4758, test_loss: 1.1285, test_f1: 0.6790
 epoch: 59, train_loss: 0.4640, test_loss: 1.3305, test_f1: 0.6952
 epoch: 60, train_loss: 0.4705, test_loss: 1.0301, test_f1: 0.6604
 epoch: 61, train_loss: 0.4912, test_loss: 1.6589, test_f1: 0.6383
 epoch: 62, train_loss: 0.4696, test_loss: 1.3143, test_f1: 0.6535
 epoch: 63, train_loss: 0.4492, test_loss: 1.1021, test_f1: 0.6947
 epoch: 64, train_loss: 0.4811, test_loss: 1.2907, test_f1: 0.6493
 epoch: 65, train_loss: 0.4870, test_loss: 1.3694, test_f1: 0.6138
 epoch: 66, train_loss: 0.4496, test_loss: 1.4788, test_f1: 0.6782
 epoch: 67, train_loss: 0.4442, test_loss: 1.2635, test_f1: 0.6792
 epoch: 68, train_loss: 0.4251, test_loss: 1.3279, test_f1: 0.6805
 epoch: 69, train_loss: 0.4302, test_loss: 1.4116, test_f1: 0.6535
 epoch: 70, train_loss: 0.4311, test_loss: 1.3855, test_f1: 0.6469
 epoch: 71, train_loss: 0.4150, test_loss: 1.2896, test_f1: 0.6766
 epoch: 72, train_loss: 0.4367, test_loss: 1.5207, test_f1: 0.6637
 epoch: 73, train_loss: 0.4142, test_loss: 1.2948, test_f1: 0.6700
 epoch: 74, train_loss: 0.4356, test_loss: 1.6370, test_f1: 0.6071
 epoch: 75, train_loss: 0.4506, test_loss: 1.6946, test_f1: 0.6232
 epoch: 76, train_loss: 0.4130, test_loss: 1.3100, test_f1: 0.6361
 epoch: 77, train_loss: 0.4134, test_loss: 1.5259, test_f1: 0.6715
 epoch: 78, train_loss: 0.4391, test_loss: 1.1857, test_f1: 0.6396
 epoch: 79, train_loss: 0.4530, test_loss: 1.3738, test_f1: 0.6136
 epoch: 80, train_loss: 0.4430, test_loss: 1.7234, test_f1: 0.6500
 epoch: 81, train_loss: 0.4339, test_loss: 1.4643, test_f1: 0.5930
 epoch: 82, train_loss: 0.4302, test_loss: 1.2158, test_f1: 0.6623
 epoch: 83, train_loss: 0.4290, test_loss: 1.9514, test_f1: 0.6341
 epoch: 84, train_loss: 0.4074, test_loss: 1.7008, test_f1: 0.6404
 epoch: 85, train_loss: 0.3914, test_loss: 1.5771, test_f1: 0.6675
 epoch: 86, train_loss: 0.4097, test_loss: 1.9765, test_f1: 0.6433
 epoch: 87, train_loss: 0.4335, test_loss: 1.6249, test_f1: 0.6276
 epoch: 88, train_loss: 0.3980, test_loss: 1.9174, test_f1: 0.6555
 epoch: 89, train_loss: 0.4057, test_loss: 1.6927, test_f1: 0.6604
 epoch: 90, train_loss: 0.4018, test_loss: 1.4587, test_f1: 0.6422
 epoch: 91, train_loss: 0.4153, test_loss: 1.7376, test_f1: 0.6143
 epoch: 92, train_loss: 0.3988, test_loss: 1.5403, test_f1: 0.6592
 epoch: 93, train_loss: 0.3734, test_loss: 1.6304, test_f1: 0.6473
 epoch: 94, train_loss: 0.3467, test_loss: 1.8404, test_f1: 0.6467
 epoch: 95, train_loss: 0.3830, test_loss: 1.4514, test_f1: 0.6665
 epoch: 96, train_loss: 0.3815, test_loss: 1.3250, test_f1: 0.6231
 epoch: 97, train_loss: 0.5191, test_loss: 1.8475, test_f1: 0.5904
 epoch: 98, train_loss: 0.4265, test_loss: 1.8199, test_f1: 0.5866
 epoch: 99, train_loss: 0.4441, test_loss: 1.3569, test_f1: 0.6267
##################ITERATION #8 ****************************************
 epoch: 0, train_loss: 1.2875, test_loss: 1.4134, test_f1: 0.3325
 epoch: 1, train_loss: 1.0158, test_loss: 1.3984, test_f1: 0.4054
 epoch: 2, train_loss: 0.9301, test_loss: 1.1477, test_f1: 0.5050
 epoch: 3, train_loss: 0.9024, test_loss: 1.1858, test_f1: 0.4567
 epoch: 4, train_loss: 0.8642, test_loss: 1.0494, test_f1: 0.5231
 epoch: 5, train_loss: 0.8590, test_loss: 1.8150, test_f1: 0.3738
 epoch: 6, train_loss: 0.8232, test_loss: 1.0090, test_f1: 0.5278
 epoch: 7, train_loss: 0.8256, test_loss: 1.2796, test_f1: 0.5277
 epoch: 8, train_loss: 0.8174, test_loss: 0.9495, test_f1: 0.5889
 epoch: 9, train_loss: 0.8349, test_loss: 1.0090, test_f1: 0.5769
 epoch: 10, train_loss: 0.8346, test_loss: 0.9410, test_f1: 0.5851
 epoch: 11, train_loss: 0.8129, test_loss: 1.3241, test_f1: 0.4427
 epoch: 12, train_loss: 0.7848, test_loss: 0.9704, test_f1: 0.5828
 epoch: 13, train_loss: 0.7946, test_loss: 0.9400, test_f1: 0.5893
 epoch: 14, train_loss: 0.7540, test_loss: 0.9592, test_f1: 0.6023
 epoch: 15, train_loss: 0.7396, test_loss: 1.2210, test_f1: 0.5183
 epoch: 16, train_loss: 0.7544, test_loss: 1.0531, test_f1: 0.5879
 epoch: 17, train_loss: 0.7518, test_loss: 3.4871, test_f1: 0.3102
 epoch: 18, train_loss: 0.7614, test_loss: 1.1067, test_f1: 0.5585
 epoch: 19, train_loss: 0.7653, test_loss: 1.1677, test_f1: 0.5219
 epoch: 20, train_loss: 0.7427, test_loss: 1.0364, test_f1: 0.6081
 epoch: 21, train_loss: 0.7404, test_loss: 0.9817, test_f1: 0.5878
 epoch: 22, train_loss: 0.7482, test_loss: 1.1742, test_f1: 0.5369
 epoch: 23, train_loss: 0.7168, test_loss: 1.0000, test_f1: 0.6275
 epoch: 24, train_loss: 0.7104, test_loss: 1.0101, test_f1: 0.6022
 epoch: 25, train_loss: 0.6967, test_loss: 1.0306, test_f1: 0.6380
 epoch: 26, train_loss: 0.8027, test_loss: 1.2235, test_f1: 0.5305
 epoch: 27, train_loss: 0.7946, test_loss: 1.0662, test_f1: 0.5541
 epoch: 28, train_loss: 0.7623, test_loss: 1.0566, test_f1: 0.5688
 epoch: 29, train_loss: 0.7315, test_loss: 1.4342, test_f1: 0.5384
 epoch: 30, train_loss: 0.7160, test_loss: 1.1387, test_f1: 0.5856
 epoch: 31, train_loss: 0.7124, test_loss: 1.0117, test_f1: 0.6076
 epoch: 32, train_loss: 0.6957, test_loss: 1.2160, test_f1: 0.5545
 epoch: 33, train_loss: 0.6814, test_loss: 1.1208, test_f1: 0.5780
 epoch: 34, train_loss: 0.6850, test_loss: 1.0576, test_f1: 0.5617
 epoch: 35, train_loss: 0.6755, test_loss: 0.9695, test_f1: 0.6059
 epoch: 36, train_loss: 0.6657, test_loss: 1.0420, test_f1: 0.6100
 epoch: 37, train_loss: 0.6666, test_loss: 1.2188, test_f1: 0.5706
 epoch: 38, train_loss: 0.6750, test_loss: 1.1286, test_f1: 0.5502
 epoch: 39, train_loss: 0.6602, test_loss: 1.0258, test_f1: 0.5738
 epoch: 40, train_loss: 0.6702, test_loss: 1.0169, test_f1: 0.6024
 epoch: 41, train_loss: 0.6372, test_loss: 1.0671, test_f1: 0.5846
 epoch: 42, train_loss: 0.6499, test_loss: 1.0746, test_f1: 0.5888
 epoch: 43, train_loss: 0.6340, test_loss: 1.2077, test_f1: 0.5279
 epoch: 44, train_loss: 0.6333, test_loss: 1.1483, test_f1: 0.5739
 epoch: 45, train_loss: 0.6152, test_loss: 1.9251, test_f1: 0.4918
 epoch: 46, train_loss: 0.6322, test_loss: 1.0392, test_f1: 0.6186
 epoch: 47, train_loss: 0.6155, test_loss: 1.4009, test_f1: 0.5826
 epoch: 48, train_loss: 0.6003, test_loss: 1.4898, test_f1: 0.5708
 epoch: 49, train_loss: 0.6434, test_loss: 1.1061, test_f1: 0.6592
 epoch: 50, train_loss: 0.6081, test_loss: 1.1546, test_f1: 0.5654
 epoch: 51, train_loss: 0.6178, test_loss: 1.0502, test_f1: 0.5693
 epoch: 52, train_loss: 0.5606, test_loss: 1.0476, test_f1: 0.6042
 epoch: 53, train_loss: 0.5533, test_loss: 1.1739, test_f1: 0.6095
 epoch: 54, train_loss: 0.5379, test_loss: 1.1336, test_f1: 0.6393
 epoch: 55, train_loss: 0.5348, test_loss: 1.2634, test_f1: 0.5604
 epoch: 56, train_loss: 0.5317, test_loss: 1.1813, test_f1: 0.6049
 epoch: 57, train_loss: 0.5239, test_loss: 1.2058, test_f1: 0.6025
 epoch: 58, train_loss: 0.5347, test_loss: 1.2789, test_f1: 0.5890
 epoch: 59, train_loss: 0.5263, test_loss: 1.2606, test_f1: 0.5805
 epoch: 60, train_loss: 0.5081, test_loss: 1.1349, test_f1: 0.6058
 epoch: 61, train_loss: 0.5125, test_loss: 1.3127, test_f1: 0.5718
 epoch: 62, train_loss: 0.5017, test_loss: 1.2197, test_f1: 0.5976
 epoch: 63, train_loss: 0.4978, test_loss: 1.2318, test_f1: 0.6295
 epoch: 64, train_loss: 0.4924, test_loss: 1.3095, test_f1: 0.6130
 epoch: 65, train_loss: 0.5111, test_loss: 1.4665, test_f1: 0.6004
 epoch: 66, train_loss: 0.4825, test_loss: 1.1783, test_f1: 0.5733
 epoch: 67, train_loss: 0.5119, test_loss: 1.3947, test_f1: 0.5640
 epoch: 68, train_loss: 0.4937, test_loss: 1.1816, test_f1: 0.6147
 epoch: 69, train_loss: 0.4789, test_loss: 1.6059, test_f1: 0.5993
 epoch: 70, train_loss: 0.4720, test_loss: 1.2918, test_f1: 0.6107
 epoch: 71, train_loss: 0.4759, test_loss: 1.5739, test_f1: 0.5723
 epoch: 72, train_loss: 0.5168, test_loss: 1.3737, test_f1: 0.5615
 epoch: 73, train_loss: 0.5155, test_loss: 1.3453, test_f1: 0.6379
 epoch: 74, train_loss: 0.5054, test_loss: 1.3771, test_f1: 0.6250
 epoch: 75, train_loss: 0.4671, test_loss: 1.3595, test_f1: 0.6035
 epoch: 76, train_loss: 0.4609, test_loss: 1.5249, test_f1: 0.5564
 epoch: 77, train_loss: 0.4511, test_loss: 1.2992, test_f1: 0.5880
 epoch: 78, train_loss: 0.4687, test_loss: 1.4406, test_f1: 0.6145
 epoch: 79, train_loss: 0.4454, test_loss: 1.5275, test_f1: 0.6005
 epoch: 80, train_loss: 0.4662, test_loss: 1.2570, test_f1: 0.5898
 epoch: 81, train_loss: 0.4738, test_loss: 1.5677, test_f1: 0.6210
 epoch: 82, train_loss: 0.4583, test_loss: 1.6202, test_f1: 0.5445
 epoch: 83, train_loss: 0.4603, test_loss: 1.2981, test_f1: 0.5987
 epoch: 84, train_loss: 0.4663, test_loss: 1.7190, test_f1: 0.5764
 epoch: 85, train_loss: 0.4610, test_loss: 1.6817, test_f1: 0.5709
 epoch: 86, train_loss: 0.4271, test_loss: 1.6541, test_f1: 0.5592
 epoch: 87, train_loss: 0.4679, test_loss: 1.6906, test_f1: 0.6185
 epoch: 88, train_loss: 0.4271, test_loss: 1.3845, test_f1: 0.6282
 epoch: 89, train_loss: 0.4186, test_loss: 1.4503, test_f1: 0.5820
 epoch: 90, train_loss: 0.4151, test_loss: 1.7372, test_f1: 0.6032
 epoch: 91, train_loss: 0.4324, test_loss: 1.5007, test_f1: 0.5868
 epoch: 92, train_loss: 0.4578, test_loss: 2.0907, test_f1: 0.5651
 epoch: 93, train_loss: 0.4281, test_loss: 1.4370, test_f1: 0.5846
 epoch: 94, train_loss: 0.4263, test_loss: 1.7441, test_f1: 0.5823
 epoch: 95, train_loss: 0.4153, test_loss: 1.8337, test_f1: 0.5600
 epoch: 96, train_loss: 0.4198, test_loss: 1.9127, test_f1: 0.6006
 epoch: 97, train_loss: 0.4286, test_loss: 1.5730, test_f1: 0.5837
 epoch: 98, train_loss: 0.4055, test_loss: 1.5198, test_f1: 0.5949
 epoch: 99, train_loss: 0.4051, test_loss: 1.6550, test_f1: 0.5979
##################ITERATION #9 ****************************************
 epoch: 0, train_loss: 1.3412, test_loss: 1.4114, test_f1: 0.2682
 epoch: 1, train_loss: 1.0439, test_loss: 1.2237, test_f1: 0.4612
 epoch: 2, train_loss: 0.9819, test_loss: 1.1067, test_f1: 0.4044
 epoch: 3, train_loss: 0.9726, test_loss: 1.1091, test_f1: 0.4657
 epoch: 4, train_loss: 0.8958, test_loss: 1.0263, test_f1: 0.5351
 epoch: 5, train_loss: 0.8610, test_loss: 1.0373, test_f1: 0.5233
 epoch: 6, train_loss: 0.8495, test_loss: 1.0203, test_f1: 0.5463
 epoch: 7, train_loss: 0.8498, test_loss: 0.9254, test_f1: 0.5663
 epoch: 8, train_loss: 0.8203, test_loss: 1.1112, test_f1: 0.5678
 epoch: 9, train_loss: 0.8118, test_loss: 0.9630, test_f1: 0.5202
 epoch: 10, train_loss: 0.8192, test_loss: 1.1999, test_f1: 0.5008
 epoch: 11, train_loss: 0.7994, test_loss: 1.0842, test_f1: 0.5161
 epoch: 12, train_loss: 0.7592, test_loss: 0.9758, test_f1: 0.5901
 epoch: 13, train_loss: 0.7468, test_loss: 1.1043, test_f1: 0.4694
 epoch: 14, train_loss: 0.7889, test_loss: 1.1652, test_f1: 0.5590
 epoch: 15, train_loss: 0.7725, test_loss: 1.0689, test_f1: 0.5272
 epoch: 16, train_loss: 0.7719, test_loss: 1.0433, test_f1: 0.5318
 epoch: 17, train_loss: 0.7580, test_loss: 1.1886, test_f1: 0.5601
 epoch: 18, train_loss: 0.8050, test_loss: 1.5932, test_f1: 0.3908
 epoch: 19, train_loss: 0.7817, test_loss: 1.1140, test_f1: 0.5804
 epoch: 20, train_loss: 0.7474, test_loss: 1.2482, test_f1: 0.5822
 epoch: 21, train_loss: 0.7356, test_loss: 1.1145, test_f1: 0.6212
 epoch: 22, train_loss: 0.7187, test_loss: 1.0466, test_f1: 0.5738
 epoch: 23, train_loss: 0.7148, test_loss: 1.0719, test_f1: 0.6091
 epoch: 24, train_loss: 0.6953, test_loss: 1.2760, test_f1: 0.6057
 epoch: 25, train_loss: 0.6988, test_loss: 1.0115, test_f1: 0.6068
 epoch: 26, train_loss: 0.7259, test_loss: 1.3123, test_f1: 0.5901
 epoch: 27, train_loss: 0.7273, test_loss: 1.1458, test_f1: 0.6090
 epoch: 28, train_loss: 0.7229, test_loss: 1.2062, test_f1: 0.5903
 epoch: 29, train_loss: 0.7081, test_loss: 1.0688, test_f1: 0.5401
 epoch: 30, train_loss: 0.6775, test_loss: 1.4446, test_f1: 0.6109
 epoch: 31, train_loss: 0.7133, test_loss: 1.1167, test_f1: 0.5279
 epoch: 32, train_loss: 0.6807, test_loss: 1.2204, test_f1: 0.5914
 epoch: 33, train_loss: 0.6625, test_loss: 1.0510, test_f1: 0.6155
 epoch: 34, train_loss: 0.6747, test_loss: 1.1580, test_f1: 0.5805
 epoch: 35, train_loss: 0.6897, test_loss: 1.0534, test_f1: 0.6232
 epoch: 36, train_loss: 0.6519, test_loss: 1.0860, test_f1: 0.5848
 epoch: 37, train_loss: 0.6577, test_loss: 1.1587, test_f1: 0.6446
 epoch: 38, train_loss: 0.6297, test_loss: 1.1640, test_f1: 0.6342
 epoch: 39, train_loss: 0.6187, test_loss: 1.2327, test_f1: 0.5952
 epoch: 40, train_loss: 0.6393, test_loss: 1.2195, test_f1: 0.5868
 epoch: 41, train_loss: 0.6292, test_loss: 1.2312, test_f1: 0.6282
 epoch: 42, train_loss: 0.5846, test_loss: 1.2625, test_f1: 0.6217
 epoch: 43, train_loss: 0.6069, test_loss: 1.5267, test_f1: 0.5852
 epoch: 44, train_loss: 0.6334, test_loss: 1.2325, test_f1: 0.5631
 epoch: 45, train_loss: 0.6532, test_loss: 0.9716, test_f1: 0.6066
 epoch: 46, train_loss: 0.6722, test_loss: 1.0920, test_f1: 0.6183
 epoch: 47, train_loss: 0.6312, test_loss: 1.1085, test_f1: 0.6008
 epoch: 48, train_loss: 0.6145, test_loss: 1.0967, test_f1: 0.5999
 epoch: 49, train_loss: 0.6028, test_loss: 1.1278, test_f1: 0.6586
 epoch: 50, train_loss: 0.5733, test_loss: 1.1412, test_f1: 0.6442
 epoch: 51, train_loss: 0.5306, test_loss: 1.2269, test_f1: 0.6546
 epoch: 52, train_loss: 0.5320, test_loss: 1.3817, test_f1: 0.6584
 epoch: 53, train_loss: 0.5315, test_loss: 1.1731, test_f1: 0.6857
 epoch: 54, train_loss: 0.5288, test_loss: 1.2645, test_f1: 0.6099
 epoch: 55, train_loss: 0.5464, test_loss: 1.3702, test_f1: 0.6079
 epoch: 56, train_loss: 0.5830, test_loss: 1.3429, test_f1: 0.6192
 epoch: 57, train_loss: 0.5147, test_loss: 1.2535, test_f1: 0.6157
 epoch: 58, train_loss: 0.5023, test_loss: 1.3363, test_f1: 0.6202
 epoch: 59, train_loss: 0.4962, test_loss: 1.3355, test_f1: 0.6180
 epoch: 60, train_loss: 0.4891, test_loss: 1.3939, test_f1: 0.6008
 epoch: 61, train_loss: 0.4544, test_loss: 1.2790, test_f1: 0.6249
 epoch: 62, train_loss: 0.4659, test_loss: 1.4629, test_f1: 0.6187
 epoch: 63, train_loss: 0.5064, test_loss: 1.3426, test_f1: 0.6111
 epoch: 64, train_loss: 0.4769, test_loss: 1.3949, test_f1: 0.5970
 epoch: 65, train_loss: 0.5032, test_loss: 1.3503, test_f1: 0.6043
 epoch: 66, train_loss: 0.4816, test_loss: 1.2204, test_f1: 0.6158
 epoch: 67, train_loss: 0.4777, test_loss: 1.4897, test_f1: 0.6119
 epoch: 68, train_loss: 0.4818, test_loss: 1.2195, test_f1: 0.6285
 epoch: 69, train_loss: 0.5078, test_loss: 1.3535, test_f1: 0.6248
 epoch: 70, train_loss: 0.4598, test_loss: 1.4677, test_f1: 0.6155
 epoch: 71, train_loss: 0.4630, test_loss: 1.6172, test_f1: 0.6068
 epoch: 72, train_loss: 0.4537, test_loss: 1.5752, test_f1: 0.6066
 epoch: 73, train_loss: 0.4699, test_loss: 1.5634, test_f1: 0.6178
 epoch: 74, train_loss: 0.4687, test_loss: 1.6032, test_f1: 0.6000
 epoch: 75, train_loss: 0.4840, test_loss: 1.3447, test_f1: 0.6036
 epoch: 76, train_loss: 0.4368, test_loss: 1.4488, test_f1: 0.6063
 epoch: 77, train_loss: 0.4291, test_loss: 1.4467, test_f1: 0.5815
 epoch: 78, train_loss: 0.4334, test_loss: 1.5945, test_f1: 0.6122
 epoch: 79, train_loss: 0.4278, test_loss: 1.8073, test_f1: 0.6057
 epoch: 80, train_loss: 0.4488, test_loss: 1.4795, test_f1: 0.6348
 epoch: 81, train_loss: 0.4466, test_loss: 1.3690, test_f1: 0.5966
 epoch: 82, train_loss: 0.4405, test_loss: 1.5208, test_f1: 0.6398
 epoch: 83, train_loss: 0.4552, test_loss: 1.5394, test_f1: 0.6578
 epoch: 84, train_loss: 0.4383, test_loss: 1.5056, test_f1: 0.5929
 epoch: 85, train_loss: 0.4195, test_loss: 1.4281, test_f1: 0.6249
 epoch: 86, train_loss: 0.4080, test_loss: 1.5493, test_f1: 0.6160
 epoch: 87, train_loss: 0.3921, test_loss: 1.6135, test_f1: 0.6231
 epoch: 88, train_loss: 0.4180, test_loss: 1.8095, test_f1: 0.5805
 epoch: 89, train_loss: 0.3894, test_loss: 1.4736, test_f1: 0.6277
 epoch: 90, train_loss: 0.4273, test_loss: 1.6138, test_f1: 0.6063
 epoch: 91, train_loss: 0.4232, test_loss: 1.6148, test_f1: 0.6248
 epoch: 92, train_loss: 0.4165, test_loss: 1.6684, test_f1: 0.6261
 epoch: 93, train_loss: 0.3859, test_loss: 1.9081, test_f1: 0.5988
 epoch: 94, train_loss: 0.4163, test_loss: 1.5365, test_f1: 0.6382
 epoch: 95, train_loss: 0.3877, test_loss: 1.6780, test_f1: 0.5927
 epoch: 96, train_loss: 0.4074, test_loss: 1.4946, test_f1: 0.6179
 epoch: 97, train_loss: 0.3782, test_loss: 1.5558, test_f1: 0.5993
 epoch: 98, train_loss: 0.3685, test_loss: 1.7207, test_f1: 0.6288
 epoch: 99, train_loss: 0.3819, test_loss: 1.6686, test_f1: 0.6141

Training completed in 440.91 seconds
Best F1: 0.7178 at epoch 62
Mean F1 across iterations: 0.6825  0.0179
========================FINAL RESULTS================================
FEGIN weighted F1: 0.7178  0.0179
python main.py --data ltspice_demos --representation component_pin --model FEGIN --layers 3 --hiddens 32 --batch_size 128 --lr 0.01 --emb_size 128 --epochs 100 --save_appendix component_pin_L3_H32_BS128_LR0.01_E128 --no_val
-----



STDERR:
  File "main.py", line 370, in <module>
    main()
  File "main.py", line 254, in main
    dataset = dataset_class(
  File "/home/philip/projects/ltspice_examples_code_repo/Circuit-Completion-Using-GNNs/component_classification_with_link_prediction_head/evaluation/FEGIN/kernel/circuit_datasets.py", line 15, in __init__
    self.data, self.slices = torch.load(self.processed_paths[0])
  File "/home/philip/.local/lib/python3.8/site-packages/torch/serialization.py", line 1040, in load
    warnings.warn(
  File "/usr/lib/python3.8/warnings.py", line 109, in _showwarnmsg
    sw(msg.message, msg.category, msg.filename, msg.lineno,
  File "main.py", line 47, in warn_with_traceback
    traceback.print_stack(file=log)
/home/philip/projects/ltspice_examples_code_repo/Circuit-Completion-Using-GNNs/component_classification_with_link_prediction_head/evaluation/FEGIN/kernel/circuit_datasets.py:15: FutureWarning: You are using `torch.load` with `weights_only=False` (the current default value), which uses the default pickle module implicitly. It is possible to construct malicious pickle data which will execute arbitrary code during unpickling (See https://github.com/pytorch/pytorch/blob/main/SECURITY.md#untrusted-models for more details). In a future release, the default value for `weights_only` will be flipped to `True`. This limits the functions that could be executed during unpickling. Arbitrary objects will no longer be allowed to be loaded via this mode unless they are explicitly allowlisted by the user via `torch.serialization.add_safe_globals`. We recommend you start setting `weights_only=True` for any use case where you don't have full control of the loaded file. Please open an issue on GitHub for any issues related to this experimental feature.
  self.data, self.slices = torch.load(self.processed_paths[0])
