STDOUT:
Results will be saved in /home/philip/projects/ltspice_examples_code_repo/Circuit-Completion-Using-GNNs/component_classification_with_link_prediction_head/evaluation/FEGIN/results/model_FEGIN_dataset_ltspice_demos
Command line input: python main.py --data ltspice_demos --representation component_net --model FEGIN --layers 2 --hiddens 64 --batch_size 128 --lr 0.0001 --emb_size 512 --epochs 100 --save_appendix component_net_L2_H64_BS128_LR0.0001_E512 --no_val
 is saved.
-----
ltspice_demos - FEGIN
Using 2 layers, 64 hidden units, h = 2
Loading component_net representation dataset
ENTERED
Training FEGIN on component_net representation
Train: 1565, Test: 383
##################ITERATION #0 ****************************************
 epoch: 0, train_loss: 1.3729, test_loss: 1.3675, test_f1: 0.2281
 epoch: 1, train_loss: 1.3663, test_loss: 1.3651, test_f1: 0.2281
 epoch: 2, train_loss: 1.3625, test_loss: 1.3625, test_f1: 0.2281
 epoch: 3, train_loss: 1.3589, test_loss: 1.3600, test_f1: 0.2281
 epoch: 4, train_loss: 1.3552, test_loss: 1.3573, test_f1: 0.2281
 epoch: 5, train_loss: 1.3512, test_loss: 1.3545, test_f1: 0.2281
 epoch: 6, train_loss: 1.3466, test_loss: 1.3516, test_f1: 0.2281
 epoch: 7, train_loss: 1.3421, test_loss: 1.3485, test_f1: 0.2281
 epoch: 8, train_loss: 1.3366, test_loss: 1.3447, test_f1: 0.2281
 epoch: 9, train_loss: 1.3315, test_loss: 1.3406, test_f1: 0.2281
 epoch: 10, train_loss: 1.3239, test_loss: 1.3359, test_f1: 0.2281
 epoch: 11, train_loss: 1.3171, test_loss: 1.3306, test_f1: 0.2281
 epoch: 12, train_loss: 1.3089, test_loss: 1.3250, test_f1: 0.2281
 epoch: 13, train_loss: 1.2980, test_loss: 1.3194, test_f1: 0.2281
 epoch: 14, train_loss: 1.2878, test_loss: 1.3123, test_f1: 0.2357
 epoch: 15, train_loss: 1.2781, test_loss: 1.3050, test_f1: 0.2719
 epoch: 16, train_loss: 1.2665, test_loss: 1.2972, test_f1: 0.2775
 epoch: 17, train_loss: 1.2517, test_loss: 1.2883, test_f1: 0.2731
 epoch: 18, train_loss: 1.2415, test_loss: 1.2802, test_f1: 0.2775
 epoch: 19, train_loss: 1.2311, test_loss: 1.2722, test_f1: 0.2775
 epoch: 20, train_loss: 1.2170, test_loss: 1.2629, test_f1: 0.2775
 epoch: 21, train_loss: 1.2041, test_loss: 1.2548, test_f1: 0.2818
 epoch: 22, train_loss: 1.1940, test_loss: 1.2471, test_f1: 0.2975
 epoch: 23, train_loss: 1.1867, test_loss: 1.2402, test_f1: 0.3366
 epoch: 24, train_loss: 1.1720, test_loss: 1.2339, test_f1: 0.3294
 epoch: 25, train_loss: 1.1692, test_loss: 1.2277, test_f1: 0.3382
 epoch: 26, train_loss: 1.1581, test_loss: 1.2202, test_f1: 0.3368
 epoch: 27, train_loss: 1.1478, test_loss: 1.2145, test_f1: 0.3408
 epoch: 28, train_loss: 1.1392, test_loss: 1.2098, test_f1: 0.3408
 epoch: 29, train_loss: 1.1343, test_loss: 1.2053, test_f1: 0.3495
 epoch: 30, train_loss: 1.1208, test_loss: 1.1995, test_f1: 0.3505
 epoch: 31, train_loss: 1.1185, test_loss: 1.1948, test_f1: 0.3508
 epoch: 32, train_loss: 1.1080, test_loss: 1.1891, test_f1: 0.3619
 epoch: 33, train_loss: 1.1038, test_loss: 1.1854, test_f1: 0.3706
 epoch: 34, train_loss: 1.0967, test_loss: 1.1816, test_f1: 0.3703
 epoch: 35, train_loss: 1.0903, test_loss: 1.1770, test_f1: 0.3807
 epoch: 36, train_loss: 1.0836, test_loss: 1.1751, test_f1: 0.3842
 epoch: 37, train_loss: 1.0755, test_loss: 1.1692, test_f1: 0.3922
 epoch: 38, train_loss: 1.0756, test_loss: 1.1659, test_f1: 0.4091
 epoch: 39, train_loss: 1.0661, test_loss: 1.1612, test_f1: 0.3933
 epoch: 40, train_loss: 1.0606, test_loss: 1.1515, test_f1: 0.3929
 epoch: 41, train_loss: 1.0545, test_loss: 1.1532, test_f1: 0.3909
 epoch: 42, train_loss: 1.0514, test_loss: 1.1523, test_f1: 0.3925
 epoch: 43, train_loss: 1.0432, test_loss: 1.1500, test_f1: 0.3961
 epoch: 44, train_loss: 1.0459, test_loss: 1.1422, test_f1: 0.4047
 epoch: 45, train_loss: 1.0344, test_loss: 1.1398, test_f1: 0.4121
 epoch: 46, train_loss: 1.0327, test_loss: 1.1415, test_f1: 0.4237
 epoch: 47, train_loss: 1.0322, test_loss: 1.1350, test_f1: 0.4222
 epoch: 48, train_loss: 1.0221, test_loss: 1.1365, test_f1: 0.4279
 epoch: 49, train_loss: 1.0187, test_loss: 1.1354, test_f1: 0.4250
 epoch: 50, train_loss: 1.0139, test_loss: 1.1342, test_f1: 0.4362
 epoch: 51, train_loss: 1.0122, test_loss: 1.1295, test_f1: 0.4350
 epoch: 52, train_loss: 1.0077, test_loss: 1.1308, test_f1: 0.4385
 epoch: 53, train_loss: 1.0045, test_loss: 1.1309, test_f1: 0.4321
 epoch: 54, train_loss: 1.0035, test_loss: 1.1241, test_f1: 0.4366
 epoch: 55, train_loss: 1.0048, test_loss: 1.1263, test_f1: 0.4446
 epoch: 56, train_loss: 0.9964, test_loss: 1.1231, test_f1: 0.4430
 epoch: 57, train_loss: 1.0023, test_loss: 1.1199, test_f1: 0.4408
 epoch: 58, train_loss: 0.9964, test_loss: 1.1170, test_f1: 0.4451
 epoch: 59, train_loss: 0.9983, test_loss: 1.1146, test_f1: 0.4472
 epoch: 60, train_loss: 0.9941, test_loss: 1.1065, test_f1: 0.4542
 epoch: 61, train_loss: 0.9914, test_loss: 1.1052, test_f1: 0.4542
 epoch: 62, train_loss: 0.9923, test_loss: 1.1076, test_f1: 0.4563
 epoch: 63, train_loss: 0.9884, test_loss: 1.1059, test_f1: 0.4523
 epoch: 64, train_loss: 0.9883, test_loss: 1.1082, test_f1: 0.4628
 epoch: 65, train_loss: 0.9829, test_loss: 1.1106, test_f1: 0.4579
 epoch: 66, train_loss: 0.9790, test_loss: 1.1110, test_f1: 0.4646
 epoch: 67, train_loss: 0.9867, test_loss: 1.1093, test_f1: 0.4608
 epoch: 68, train_loss: 0.9802, test_loss: 1.1039, test_f1: 0.4608
 epoch: 69, train_loss: 0.9752, test_loss: 1.1036, test_f1: 0.4630
 epoch: 70, train_loss: 0.9796, test_loss: 1.0983, test_f1: 0.4641
 epoch: 71, train_loss: 0.9750, test_loss: 1.0982, test_f1: 0.4676
 epoch: 72, train_loss: 0.9699, test_loss: 1.1055, test_f1: 0.4456
 epoch: 73, train_loss: 0.9705, test_loss: 1.0972, test_f1: 0.4632
 epoch: 74, train_loss: 0.9690, test_loss: 1.0974, test_f1: 0.4654
 epoch: 75, train_loss: 0.9729, test_loss: 1.0993, test_f1: 0.4654
 epoch: 76, train_loss: 0.9623, test_loss: 1.0964, test_f1: 0.4729
 epoch: 77, train_loss: 0.9598, test_loss: 1.0917, test_f1: 0.4729
 epoch: 78, train_loss: 0.9684, test_loss: 1.0980, test_f1: 0.4791
 epoch: 79, train_loss: 0.9620, test_loss: 1.0942, test_f1: 0.4791
 epoch: 80, train_loss: 0.9613, test_loss: 1.0946, test_f1: 0.4830
 epoch: 81, train_loss: 0.9616, test_loss: 1.0929, test_f1: 0.4760
 epoch: 82, train_loss: 0.9569, test_loss: 1.0938, test_f1: 0.4760
 epoch: 83, train_loss: 0.9599, test_loss: 1.0904, test_f1: 0.4686
 epoch: 84, train_loss: 0.9495, test_loss: 1.0945, test_f1: 0.4698
 epoch: 85, train_loss: 0.9567, test_loss: 1.0853, test_f1: 0.4659
 epoch: 86, train_loss: 0.9483, test_loss: 1.0790, test_f1: 0.4684
 epoch: 87, train_loss: 0.9556, test_loss: 1.0860, test_f1: 0.4853
 epoch: 88, train_loss: 0.9504, test_loss: 1.0870, test_f1: 0.4659
 epoch: 89, train_loss: 0.9469, test_loss: 1.0928, test_f1: 0.4764
 epoch: 90, train_loss: 0.9423, test_loss: 1.0860, test_f1: 0.4806
 epoch: 91, train_loss: 0.9435, test_loss: 1.0814, test_f1: 0.4798
 epoch: 92, train_loss: 0.9336, test_loss: 1.0890, test_f1: 0.4758
 epoch: 93, train_loss: 0.9444, test_loss: 1.0878, test_f1: 0.4773
 epoch: 94, train_loss: 0.9353, test_loss: 1.0871, test_f1: 0.4862
 epoch: 95, train_loss: 0.9386, test_loss: 1.0869, test_f1: 0.4779
 epoch: 96, train_loss: 0.9472, test_loss: 1.0916, test_f1: 0.4798
 epoch: 97, train_loss: 0.9308, test_loss: 1.0845, test_f1: 0.4696
 epoch: 98, train_loss: 0.9390, test_loss: 1.0820, test_f1: 0.4826
 epoch: 99, train_loss: 0.9311, test_loss: 1.0896, test_f1: 0.4850
##################ITERATION #1 ****************************************
 epoch: 0, train_loss: 1.3196, test_loss: 1.3378, test_f1: 0.2281
 epoch: 1, train_loss: 1.2994, test_loss: 1.3313, test_f1: 0.2281
 epoch: 2, train_loss: 1.2859, test_loss: 1.3230, test_f1: 0.2281
 epoch: 3, train_loss: 1.2740, test_loss: 1.3114, test_f1: 0.2281
 epoch: 4, train_loss: 1.2642, test_loss: 1.2991, test_f1: 0.2583
 epoch: 5, train_loss: 1.2517, test_loss: 1.2884, test_f1: 0.2583
 epoch: 6, train_loss: 1.2375, test_loss: 1.2813, test_f1: 0.2641
 epoch: 7, train_loss: 1.2249, test_loss: 1.2732, test_f1: 0.2777
 epoch: 8, train_loss: 1.2125, test_loss: 1.2650, test_f1: 0.2831
 epoch: 9, train_loss: 1.2009, test_loss: 1.2573, test_f1: 0.2831
 epoch: 10, train_loss: 1.1894, test_loss: 1.2480, test_f1: 0.2883
 epoch: 11, train_loss: 1.1762, test_loss: 1.2392, test_f1: 0.2934
 epoch: 12, train_loss: 1.1676, test_loss: 1.2312, test_f1: 0.2921
 epoch: 13, train_loss: 1.1510, test_loss: 1.2222, test_f1: 0.3012
 epoch: 14, train_loss: 1.1432, test_loss: 1.2137, test_f1: 0.3460
 epoch: 15, train_loss: 1.1321, test_loss: 1.2063, test_f1: 0.3615
 epoch: 16, train_loss: 1.1223, test_loss: 1.1983, test_f1: 0.3721
 epoch: 17, train_loss: 1.1090, test_loss: 1.1901, test_f1: 0.3877
 epoch: 18, train_loss: 1.1020, test_loss: 1.1828, test_f1: 0.3947
 epoch: 19, train_loss: 1.0934, test_loss: 1.1770, test_f1: 0.3989
 epoch: 20, train_loss: 1.0856, test_loss: 1.1686, test_f1: 0.4006
 epoch: 21, train_loss: 1.0782, test_loss: 1.1619, test_f1: 0.4029
 epoch: 22, train_loss: 1.0683, test_loss: 1.1591, test_f1: 0.4029
 epoch: 23, train_loss: 1.0568, test_loss: 1.1581, test_f1: 0.4069
 epoch: 24, train_loss: 1.0612, test_loss: 1.1502, test_f1: 0.4058
 epoch: 25, train_loss: 1.0437, test_loss: 1.1451, test_f1: 0.4058
 epoch: 26, train_loss: 1.0452, test_loss: 1.1407, test_f1: 0.4078
 epoch: 27, train_loss: 1.0413, test_loss: 1.1389, test_f1: 0.4082
 epoch: 28, train_loss: 1.0319, test_loss: 1.1357, test_f1: 0.4140
 epoch: 29, train_loss: 1.0356, test_loss: 1.1280, test_f1: 0.4119
 epoch: 30, train_loss: 1.0248, test_loss: 1.1229, test_f1: 0.4227
 epoch: 31, train_loss: 1.0104, test_loss: 1.1225, test_f1: 0.4263
 epoch: 32, train_loss: 1.0121, test_loss: 1.1175, test_f1: 0.4203
 epoch: 33, train_loss: 1.0190, test_loss: 1.1134, test_f1: 0.4262
 epoch: 34, train_loss: 1.0047, test_loss: 1.1062, test_f1: 0.4378
 epoch: 35, train_loss: 1.0097, test_loss: 1.1078, test_f1: 0.4388
 epoch: 36, train_loss: 0.9863, test_loss: 1.0975, test_f1: 0.4458
 epoch: 37, train_loss: 0.9919, test_loss: 1.1018, test_f1: 0.4335
 epoch: 38, train_loss: 0.9846, test_loss: 1.0942, test_f1: 0.4364
 epoch: 39, train_loss: 0.9853, test_loss: 1.0948, test_f1: 0.4420
 epoch: 40, train_loss: 0.9842, test_loss: 1.0884, test_f1: 0.4406
 epoch: 41, train_loss: 0.9720, test_loss: 1.0858, test_f1: 0.4490
 epoch: 42, train_loss: 0.9741, test_loss: 1.0814, test_f1: 0.4425
 epoch: 43, train_loss: 0.9700, test_loss: 1.0898, test_f1: 0.4479
 epoch: 44, train_loss: 0.9619, test_loss: 1.0799, test_f1: 0.4560
 epoch: 45, train_loss: 0.9581, test_loss: 1.0832, test_f1: 0.4536
 epoch: 46, train_loss: 0.9605, test_loss: 1.0748, test_f1: 0.4616
 epoch: 47, train_loss: 0.9588, test_loss: 1.0764, test_f1: 0.4609
 epoch: 48, train_loss: 0.9508, test_loss: 1.0835, test_f1: 0.4760
 epoch: 49, train_loss: 0.9456, test_loss: 1.0789, test_f1: 0.4962
 epoch: 50, train_loss: 0.9449, test_loss: 1.0872, test_f1: 0.4819
 epoch: 51, train_loss: 0.9394, test_loss: 1.0852, test_f1: 0.4837
 epoch: 52, train_loss: 0.9371, test_loss: 1.0803, test_f1: 0.4750
 epoch: 53, train_loss: 0.9325, test_loss: 1.0800, test_f1: 0.4751
 epoch: 54, train_loss: 0.9441, test_loss: 1.0831, test_f1: 0.4912
 epoch: 55, train_loss: 0.9324, test_loss: 1.0836, test_f1: 0.4681
 epoch: 56, train_loss: 0.9290, test_loss: 1.0848, test_f1: 0.4703
 epoch: 57, train_loss: 0.9283, test_loss: 1.0824, test_f1: 0.4649
 epoch: 58, train_loss: 0.9329, test_loss: 1.0823, test_f1: 0.4671
 epoch: 59, train_loss: 0.9269, test_loss: 1.0775, test_f1: 0.4712
 epoch: 60, train_loss: 0.9261, test_loss: 1.0825, test_f1: 0.4668
 epoch: 61, train_loss: 0.9266, test_loss: 1.0892, test_f1: 0.4794
 epoch: 62, train_loss: 0.9249, test_loss: 1.0947, test_f1: 0.4666
 epoch: 63, train_loss: 0.9267, test_loss: 1.0867, test_f1: 0.4869
 epoch: 64, train_loss: 0.9214, test_loss: 1.0863, test_f1: 0.5008
 epoch: 65, train_loss: 0.9243, test_loss: 1.0860, test_f1: 0.4731
 epoch: 66, train_loss: 0.9224, test_loss: 1.0792, test_f1: 0.4914
 epoch: 67, train_loss: 0.9209, test_loss: 1.0871, test_f1: 0.4873
 epoch: 68, train_loss: 0.9188, test_loss: 1.0853, test_f1: 0.4945
 epoch: 69, train_loss: 0.9159, test_loss: 1.0843, test_f1: 0.4796
 epoch: 70, train_loss: 0.9271, test_loss: 1.0856, test_f1: 0.4898
 epoch: 71, train_loss: 0.9178, test_loss: 1.0836, test_f1: 0.5069
 epoch: 72, train_loss: 0.9117, test_loss: 1.0888, test_f1: 0.4903
 epoch: 73, train_loss: 0.9152, test_loss: 1.0941, test_f1: 0.4910
 epoch: 74, train_loss: 0.9069, test_loss: 1.0849, test_f1: 0.4738
 epoch: 75, train_loss: 0.9132, test_loss: 1.1011, test_f1: 0.4964
 epoch: 76, train_loss: 0.9120, test_loss: 1.0966, test_f1: 0.4901
 epoch: 77, train_loss: 0.9157, test_loss: 1.0945, test_f1: 0.5060
 epoch: 78, train_loss: 0.9124, test_loss: 1.0922, test_f1: 0.5035
 epoch: 79, train_loss: 0.9082, test_loss: 1.0878, test_f1: 0.5020
 epoch: 80, train_loss: 0.9077, test_loss: 1.0970, test_f1: 0.5026
 epoch: 81, train_loss: 0.9144, test_loss: 1.0968, test_f1: 0.5075
 epoch: 82, train_loss: 0.9103, test_loss: 1.0884, test_f1: 0.5079
 epoch: 83, train_loss: 0.9008, test_loss: 1.0891, test_f1: 0.5038
 epoch: 84, train_loss: 0.9136, test_loss: 1.1002, test_f1: 0.5048
 epoch: 85, train_loss: 0.9043, test_loss: 1.0862, test_f1: 0.5072
 epoch: 86, train_loss: 0.8987, test_loss: 1.0732, test_f1: 0.5084
 epoch: 87, train_loss: 0.9006, test_loss: 1.0918, test_f1: 0.5070
 epoch: 88, train_loss: 0.8965, test_loss: 1.0910, test_f1: 0.5070
 epoch: 89, train_loss: 0.9112, test_loss: 1.0930, test_f1: 0.5044
 epoch: 90, train_loss: 0.9046, test_loss: 1.0903, test_f1: 0.5090
 epoch: 91, train_loss: 0.8999, test_loss: 1.1025, test_f1: 0.5031
 epoch: 92, train_loss: 0.8973, test_loss: 1.1024, test_f1: 0.5127
 epoch: 93, train_loss: 0.8962, test_loss: 1.1010, test_f1: 0.5054
 epoch: 94, train_loss: 0.8955, test_loss: 1.0979, test_f1: 0.5022
 epoch: 95, train_loss: 0.8921, test_loss: 1.0958, test_f1: 0.5056
 epoch: 96, train_loss: 0.8941, test_loss: 1.0898, test_f1: 0.5107
 epoch: 97, train_loss: 0.8947, test_loss: 1.0962, test_f1: 0.5127
 epoch: 98, train_loss: 0.8954, test_loss: 1.0902, test_f1: 0.5043
 epoch: 99, train_loss: 0.8867, test_loss: 1.0935, test_f1: 0.5060
##################ITERATION #2 ****************************************
 epoch: 0, train_loss: 1.3123, test_loss: 1.3321, test_f1: 0.2281
 epoch: 1, train_loss: 1.2857, test_loss: 1.3243, test_f1: 0.2281
 epoch: 2, train_loss: 1.2702, test_loss: 1.3159, test_f1: 0.2281
 epoch: 3, train_loss: 1.2555, test_loss: 1.3032, test_f1: 0.2281
 epoch: 4, train_loss: 1.2448, test_loss: 1.2895, test_f1: 0.2281
 epoch: 5, train_loss: 1.2267, test_loss: 1.2757, test_f1: 0.2281
 epoch: 6, train_loss: 1.2165, test_loss: 1.2633, test_f1: 0.2746
 epoch: 7, train_loss: 1.2006, test_loss: 1.2517, test_f1: 0.2744
 epoch: 8, train_loss: 1.1886, test_loss: 1.2422, test_f1: 0.2842
 epoch: 9, train_loss: 1.1766, test_loss: 1.2322, test_f1: 0.2873
 epoch: 10, train_loss: 1.1592, test_loss: 1.2222, test_f1: 0.2899
 epoch: 11, train_loss: 1.1500, test_loss: 1.2125, test_f1: 0.2923
 epoch: 12, train_loss: 1.1321, test_loss: 1.2049, test_f1: 0.2998
 epoch: 13, train_loss: 1.1262, test_loss: 1.1941, test_f1: 0.3183
 epoch: 14, train_loss: 1.1130, test_loss: 1.1836, test_f1: 0.3428
 epoch: 15, train_loss: 1.1087, test_loss: 1.1742, test_f1: 0.3398
 epoch: 16, train_loss: 1.0994, test_loss: 1.1679, test_f1: 0.3479
 epoch: 17, train_loss: 1.0767, test_loss: 1.1655, test_f1: 0.3476
 epoch: 18, train_loss: 1.0777, test_loss: 1.1593, test_f1: 0.3701
 epoch: 19, train_loss: 1.0709, test_loss: 1.1564, test_f1: 0.4050
 epoch: 20, train_loss: 1.0647, test_loss: 1.1494, test_f1: 0.4037
 epoch: 21, train_loss: 1.0614, test_loss: 1.1459, test_f1: 0.4012
 epoch: 22, train_loss: 1.0526, test_loss: 1.1408, test_f1: 0.4082
 epoch: 23, train_loss: 1.0425, test_loss: 1.1394, test_f1: 0.4120
 epoch: 24, train_loss: 1.0367, test_loss: 1.1361, test_f1: 0.4116
 epoch: 25, train_loss: 1.0293, test_loss: 1.1305, test_f1: 0.4104
 epoch: 26, train_loss: 1.0252, test_loss: 1.1314, test_f1: 0.4211
 epoch: 27, train_loss: 1.0234, test_loss: 1.1316, test_f1: 0.4155
 epoch: 28, train_loss: 1.0217, test_loss: 1.1298, test_f1: 0.4202
 epoch: 29, train_loss: 1.0061, test_loss: 1.1273, test_f1: 0.4155
 epoch: 30, train_loss: 1.0063, test_loss: 1.1262, test_f1: 0.4174
 epoch: 31, train_loss: 1.0053, test_loss: 1.1236, test_f1: 0.4155
 epoch: 32, train_loss: 1.0092, test_loss: 1.1251, test_f1: 0.4203
 epoch: 33, train_loss: 0.9916, test_loss: 1.1178, test_f1: 0.4219
 epoch: 34, train_loss: 0.9937, test_loss: 1.1161, test_f1: 0.4267
 epoch: 35, train_loss: 0.9854, test_loss: 1.1147, test_f1: 0.4279
 epoch: 36, train_loss: 0.9829, test_loss: 1.1269, test_f1: 0.4287
 epoch: 37, train_loss: 0.9742, test_loss: 1.1079, test_f1: 0.4299
 epoch: 38, train_loss: 0.9748, test_loss: 1.1054, test_f1: 0.4387
 epoch: 39, train_loss: 0.9762, test_loss: 1.1038, test_f1: 0.4318
 epoch: 40, train_loss: 0.9761, test_loss: 1.1086, test_f1: 0.4309
 epoch: 41, train_loss: 0.9714, test_loss: 1.1097, test_f1: 0.4358
 epoch: 42, train_loss: 0.9651, test_loss: 1.1205, test_f1: 0.4427
 epoch: 43, train_loss: 0.9604, test_loss: 1.1049, test_f1: 0.4335
 epoch: 44, train_loss: 0.9596, test_loss: 1.1158, test_f1: 0.4409
 epoch: 45, train_loss: 0.9530, test_loss: 1.1050, test_f1: 0.4413
 epoch: 46, train_loss: 0.9484, test_loss: 1.1100, test_f1: 0.4390
 epoch: 47, train_loss: 0.9488, test_loss: 1.1036, test_f1: 0.4405
 epoch: 48, train_loss: 0.9457, test_loss: 1.1073, test_f1: 0.4445
 epoch: 49, train_loss: 0.9447, test_loss: 1.1089, test_f1: 0.4425
 epoch: 50, train_loss: 0.9418, test_loss: 1.1071, test_f1: 0.4563
 epoch: 51, train_loss: 0.9300, test_loss: 1.0951, test_f1: 0.4508
 epoch: 52, train_loss: 0.9336, test_loss: 1.0977, test_f1: 0.4482
 epoch: 53, train_loss: 0.9312, test_loss: 1.1049, test_f1: 0.4470
 epoch: 54, train_loss: 0.9277, test_loss: 1.1054, test_f1: 0.4542
 epoch: 55, train_loss: 0.9313, test_loss: 1.1046, test_f1: 0.4609
 epoch: 56, train_loss: 0.9270, test_loss: 1.1008, test_f1: 0.4495
 epoch: 57, train_loss: 0.9363, test_loss: 1.1013, test_f1: 0.4577
 epoch: 58, train_loss: 0.9220, test_loss: 1.1022, test_f1: 0.4607
 epoch: 59, train_loss: 0.9257, test_loss: 1.1070, test_f1: 0.4624
 epoch: 60, train_loss: 0.9212, test_loss: 1.1038, test_f1: 0.4724
 epoch: 61, train_loss: 0.9227, test_loss: 1.1062, test_f1: 0.4713
 epoch: 62, train_loss: 0.9163, test_loss: 1.1076, test_f1: 0.4786
 epoch: 63, train_loss: 0.9279, test_loss: 1.1070, test_f1: 0.4674
 epoch: 64, train_loss: 0.9123, test_loss: 1.1032, test_f1: 0.4702
 epoch: 65, train_loss: 0.9181, test_loss: 1.0970, test_f1: 0.4630
 epoch: 66, train_loss: 0.9181, test_loss: 1.1044, test_f1: 0.4593
 epoch: 67, train_loss: 0.9250, test_loss: 1.0955, test_f1: 0.4590
 epoch: 68, train_loss: 0.9234, test_loss: 1.1005, test_f1: 0.4743
 epoch: 69, train_loss: 0.9094, test_loss: 1.0968, test_f1: 0.4724
 epoch: 70, train_loss: 0.9088, test_loss: 1.0978, test_f1: 0.4743
 epoch: 71, train_loss: 0.9067, test_loss: 1.0933, test_f1: 0.4759
 epoch: 72, train_loss: 0.9092, test_loss: 1.0932, test_f1: 0.4717
 epoch: 73, train_loss: 0.9055, test_loss: 1.0931, test_f1: 0.4807
 epoch: 74, train_loss: 0.9038, test_loss: 1.0886, test_f1: 0.4749
 epoch: 75, train_loss: 0.9070, test_loss: 1.0925, test_f1: 0.4729
 epoch: 76, train_loss: 0.9030, test_loss: 1.0961, test_f1: 0.4653
 epoch: 77, train_loss: 0.9000, test_loss: 1.0917, test_f1: 0.4811
 epoch: 78, train_loss: 0.9051, test_loss: 1.0950, test_f1: 0.4813
 epoch: 79, train_loss: 0.9061, test_loss: 1.0882, test_f1: 0.4721
 epoch: 80, train_loss: 0.9055, test_loss: 1.0885, test_f1: 0.4790
 epoch: 81, train_loss: 0.9016, test_loss: 1.0969, test_f1: 0.4868
 epoch: 82, train_loss: 0.8877, test_loss: 1.0792, test_f1: 0.4855
 epoch: 83, train_loss: 0.8924, test_loss: 1.0928, test_f1: 0.4844
 epoch: 84, train_loss: 0.8902, test_loss: 1.0888, test_f1: 0.4844
 epoch: 85, train_loss: 0.8925, test_loss: 1.0948, test_f1: 0.4796
 epoch: 86, train_loss: 0.8860, test_loss: 1.0833, test_f1: 0.4892
 epoch: 87, train_loss: 0.8945, test_loss: 1.0909, test_f1: 0.4884
 epoch: 88, train_loss: 0.8952, test_loss: 1.0833, test_f1: 0.4846
 epoch: 89, train_loss: 0.8896, test_loss: 1.1025, test_f1: 0.4973
 epoch: 90, train_loss: 0.8904, test_loss: 1.0822, test_f1: 0.4929
 epoch: 91, train_loss: 0.8854, test_loss: 1.0899, test_f1: 0.4918
 epoch: 92, train_loss: 0.8893, test_loss: 1.0905, test_f1: 0.4954
 epoch: 93, train_loss: 0.8951, test_loss: 1.0914, test_f1: 0.5007
 epoch: 94, train_loss: 0.8886, test_loss: 1.0783, test_f1: 0.4957
 epoch: 95, train_loss: 0.8906, test_loss: 1.0811, test_f1: 0.5080
 epoch: 96, train_loss: 0.8792, test_loss: 1.0811, test_f1: 0.5054
 epoch: 97, train_loss: 0.8877, test_loss: 1.0865, test_f1: 0.5174
 epoch: 98, train_loss: 0.8869, test_loss: 1.1063, test_f1: 0.5107
 epoch: 99, train_loss: 0.8862, test_loss: 1.0876, test_f1: 0.5140
##################ITERATION #3 ****************************************
 epoch: 0, train_loss: 1.3058, test_loss: 1.3342, test_f1: 0.2281
 epoch: 1, train_loss: 1.2651, test_loss: 1.3249, test_f1: 0.2281
 epoch: 2, train_loss: 1.2459, test_loss: 1.3144, test_f1: 0.2281
 epoch: 3, train_loss: 1.2262, test_loss: 1.3025, test_f1: 0.2281
 epoch: 4, train_loss: 1.2122, test_loss: 1.2829, test_f1: 0.2336
 epoch: 5, train_loss: 1.1959, test_loss: 1.2631, test_f1: 0.2444
 epoch: 6, train_loss: 1.1788, test_loss: 1.2497, test_f1: 0.2540
 epoch: 7, train_loss: 1.1715, test_loss: 1.2374, test_f1: 0.2570
 epoch: 8, train_loss: 1.1570, test_loss: 1.2264, test_f1: 0.2538
 epoch: 9, train_loss: 1.1428, test_loss: 1.2167, test_f1: 0.2964
 epoch: 10, train_loss: 1.1263, test_loss: 1.2073, test_f1: 0.3015
 epoch: 11, train_loss: 1.1230, test_loss: 1.1995, test_f1: 0.3112
 epoch: 12, train_loss: 1.1106, test_loss: 1.1911, test_f1: 0.3163
 epoch: 13, train_loss: 1.1006, test_loss: 1.1856, test_f1: 0.3451
 epoch: 14, train_loss: 1.1019, test_loss: 1.1824, test_f1: 0.3498
 epoch: 15, train_loss: 1.0879, test_loss: 1.1775, test_f1: 0.3500
 epoch: 16, train_loss: 1.0790, test_loss: 1.1729, test_f1: 0.3971
 epoch: 17, train_loss: 1.0654, test_loss: 1.1708, test_f1: 0.3972
 epoch: 18, train_loss: 1.0626, test_loss: 1.1657, test_f1: 0.3950
 epoch: 19, train_loss: 1.0556, test_loss: 1.1627, test_f1: 0.3973
 epoch: 20, train_loss: 1.0508, test_loss: 1.1581, test_f1: 0.3979
 epoch: 21, train_loss: 1.0495, test_loss: 1.1525, test_f1: 0.4009
 epoch: 22, train_loss: 1.0351, test_loss: 1.1462, test_f1: 0.3988
 epoch: 23, train_loss: 1.0379, test_loss: 1.1472, test_f1: 0.4068
 epoch: 24, train_loss: 1.0248, test_loss: 1.1433, test_f1: 0.4048
 epoch: 25, train_loss: 1.0289, test_loss: 1.1419, test_f1: 0.4049
 epoch: 26, train_loss: 1.0220, test_loss: 1.1368, test_f1: 0.4023
 epoch: 27, train_loss: 1.0214, test_loss: 1.1378, test_f1: 0.4147
 epoch: 28, train_loss: 1.0191, test_loss: 1.1268, test_f1: 0.4124
 epoch: 29, train_loss: 1.0001, test_loss: 1.1262, test_f1: 0.4210
 epoch: 30, train_loss: 0.9906, test_loss: 1.1266, test_f1: 0.4253
 epoch: 31, train_loss: 0.9940, test_loss: 1.1253, test_f1: 0.4325
 epoch: 32, train_loss: 0.9908, test_loss: 1.1215, test_f1: 0.4318
 epoch: 33, train_loss: 0.9804, test_loss: 1.1213, test_f1: 0.4346
 epoch: 34, train_loss: 0.9813, test_loss: 1.1188, test_f1: 0.4322
 epoch: 35, train_loss: 0.9735, test_loss: 1.1082, test_f1: 0.4337
 epoch: 36, train_loss: 0.9761, test_loss: 1.1232, test_f1: 0.4473
 epoch: 37, train_loss: 0.9731, test_loss: 1.1036, test_f1: 0.4511
 epoch: 38, train_loss: 0.9589, test_loss: 1.1018, test_f1: 0.4439
 epoch: 39, train_loss: 0.9549, test_loss: 1.1025, test_f1: 0.4649
 epoch: 40, train_loss: 0.9455, test_loss: 1.0961, test_f1: 0.4719
 epoch: 41, train_loss: 0.9454, test_loss: 1.1034, test_f1: 0.4514
 epoch: 42, train_loss: 0.9516, test_loss: 1.1011, test_f1: 0.4616
 epoch: 43, train_loss: 0.9360, test_loss: 1.0932, test_f1: 0.4760
 epoch: 44, train_loss: 0.9415, test_loss: 1.0958, test_f1: 0.4808
 epoch: 45, train_loss: 0.9279, test_loss: 1.1044, test_f1: 0.4814
 epoch: 46, train_loss: 0.9381, test_loss: 1.0987, test_f1: 0.4781
 epoch: 47, train_loss: 0.9260, test_loss: 1.0902, test_f1: 0.4794
 epoch: 48, train_loss: 0.9260, test_loss: 1.1022, test_f1: 0.4778
 epoch: 49, train_loss: 0.9183, test_loss: 1.0893, test_f1: 0.4826
 epoch: 50, train_loss: 0.9145, test_loss: 1.0963, test_f1: 0.4841
 epoch: 51, train_loss: 0.9100, test_loss: 1.0949, test_f1: 0.4861
 epoch: 52, train_loss: 0.9135, test_loss: 1.0940, test_f1: 0.4877
 epoch: 53, train_loss: 0.9161, test_loss: 1.1100, test_f1: 0.4824
 epoch: 54, train_loss: 0.9048, test_loss: 1.1049, test_f1: 0.4865
 epoch: 55, train_loss: 0.9043, test_loss: 1.1013, test_f1: 0.4861
 epoch: 56, train_loss: 0.9021, test_loss: 1.1040, test_f1: 0.4881
 epoch: 57, train_loss: 0.9023, test_loss: 1.1104, test_f1: 0.4855
 epoch: 58, train_loss: 0.8973, test_loss: 1.1009, test_f1: 0.4879
 epoch: 59, train_loss: 0.9072, test_loss: 1.1096, test_f1: 0.4884
 epoch: 60, train_loss: 0.8991, test_loss: 1.1043, test_f1: 0.4888
 epoch: 61, train_loss: 0.8952, test_loss: 1.0985, test_f1: 0.5009
 epoch: 62, train_loss: 0.8975, test_loss: 1.1012, test_f1: 0.4928
 epoch: 63, train_loss: 0.9011, test_loss: 1.0953, test_f1: 0.4996
 epoch: 64, train_loss: 0.8950, test_loss: 1.1019, test_f1: 0.5076
 epoch: 65, train_loss: 0.8975, test_loss: 1.1001, test_f1: 0.5107
 epoch: 66, train_loss: 0.8845, test_loss: 1.0897, test_f1: 0.5010
 epoch: 67, train_loss: 0.8814, test_loss: 1.1001, test_f1: 0.5045
 epoch: 68, train_loss: 0.8896, test_loss: 1.0936, test_f1: 0.5363
 epoch: 69, train_loss: 0.8866, test_loss: 1.0933, test_f1: 0.5165
 epoch: 70, train_loss: 0.8799, test_loss: 1.1036, test_f1: 0.5305
 epoch: 71, train_loss: 0.8788, test_loss: 1.1012, test_f1: 0.5256
 epoch: 72, train_loss: 0.8813, test_loss: 1.1005, test_f1: 0.5098
 epoch: 73, train_loss: 0.8817, test_loss: 1.1020, test_f1: 0.5051
 epoch: 74, train_loss: 0.8778, test_loss: 1.0946, test_f1: 0.5204
 epoch: 75, train_loss: 0.8819, test_loss: 1.1014, test_f1: 0.5328
 epoch: 76, train_loss: 0.8896, test_loss: 1.1002, test_f1: 0.5179
 epoch: 77, train_loss: 0.8811, test_loss: 1.0907, test_f1: 0.5141
 epoch: 78, train_loss: 0.8752, test_loss: 1.1005, test_f1: 0.5204
 epoch: 79, train_loss: 0.8852, test_loss: 1.1008, test_f1: 0.5256
 epoch: 80, train_loss: 0.8758, test_loss: 1.1140, test_f1: 0.5309
 epoch: 81, train_loss: 0.8766, test_loss: 1.0915, test_f1: 0.5384
 epoch: 82, train_loss: 0.8674, test_loss: 1.0981, test_f1: 0.5382
 epoch: 83, train_loss: 0.8731, test_loss: 1.1139, test_f1: 0.5195
 epoch: 84, train_loss: 0.8734, test_loss: 1.1096, test_f1: 0.5292
 epoch: 85, train_loss: 0.8719, test_loss: 1.1107, test_f1: 0.5317
 epoch: 86, train_loss: 0.8807, test_loss: 1.1119, test_f1: 0.5334
 epoch: 87, train_loss: 0.8681, test_loss: 1.0980, test_f1: 0.5407
 epoch: 88, train_loss: 0.8713, test_loss: 1.1240, test_f1: 0.5253
 epoch: 89, train_loss: 0.8703, test_loss: 1.1068, test_f1: 0.5327
 epoch: 90, train_loss: 0.8555, test_loss: 1.0964, test_f1: 0.5372
 epoch: 91, train_loss: 0.8664, test_loss: 1.1052, test_f1: 0.5376
 epoch: 92, train_loss: 0.8650, test_loss: 1.0982, test_f1: 0.5341
 epoch: 93, train_loss: 0.8582, test_loss: 1.0944, test_f1: 0.5321
 epoch: 94, train_loss: 0.8669, test_loss: 1.0926, test_f1: 0.5413
 epoch: 95, train_loss: 0.8578, test_loss: 1.0904, test_f1: 0.5388
 epoch: 96, train_loss: 0.8619, test_loss: 1.1029, test_f1: 0.5268
 epoch: 97, train_loss: 0.8604, test_loss: 1.1067, test_f1: 0.5348
 epoch: 98, train_loss: 0.8601, test_loss: 1.1068, test_f1: 0.5411
 epoch: 99, train_loss: 0.8551, test_loss: 1.0904, test_f1: 0.5455
##################ITERATION #4 ****************************************
 epoch: 0, train_loss: 1.3037, test_loss: 1.3250, test_f1: 0.2281
 epoch: 1, train_loss: 1.2358, test_loss: 1.3059, test_f1: 0.2281
 epoch: 2, train_loss: 1.2130, test_loss: 1.2813, test_f1: 0.2281
 epoch: 3, train_loss: 1.1945, test_loss: 1.2594, test_f1: 0.2583
 epoch: 4, train_loss: 1.1663, test_loss: 1.2399, test_f1: 0.2829
 epoch: 5, train_loss: 1.1522, test_loss: 1.2224, test_f1: 0.3070
 epoch: 6, train_loss: 1.1471, test_loss: 1.2070, test_f1: 0.3231
 epoch: 7, train_loss: 1.1253, test_loss: 1.1975, test_f1: 0.3265
 epoch: 8, train_loss: 1.1189, test_loss: 1.1866, test_f1: 0.3404
 epoch: 9, train_loss: 1.1021, test_loss: 1.1767, test_f1: 0.3438
 epoch: 10, train_loss: 1.0991, test_loss: 1.1700, test_f1: 0.3542
 epoch: 11, train_loss: 1.0871, test_loss: 1.1634, test_f1: 0.3518
 epoch: 12, train_loss: 1.0812, test_loss: 1.1564, test_f1: 0.3769
 epoch: 13, train_loss: 1.0755, test_loss: 1.1480, test_f1: 0.4111
 epoch: 14, train_loss: 1.0652, test_loss: 1.1399, test_f1: 0.4143
 epoch: 15, train_loss: 1.0519, test_loss: 1.1333, test_f1: 0.4122
 epoch: 16, train_loss: 1.0490, test_loss: 1.1276, test_f1: 0.4184
 epoch: 17, train_loss: 1.0458, test_loss: 1.1221, test_f1: 0.4132
 epoch: 18, train_loss: 1.0420, test_loss: 1.1155, test_f1: 0.4152
 epoch: 19, train_loss: 1.0344, test_loss: 1.1136, test_f1: 0.4168
 epoch: 20, train_loss: 1.0195, test_loss: 1.1154, test_f1: 0.4304
 epoch: 21, train_loss: 1.0202, test_loss: 1.1047, test_f1: 0.4236
 epoch: 22, train_loss: 1.0222, test_loss: 1.1046, test_f1: 0.4309
 epoch: 23, train_loss: 1.0122, test_loss: 1.0973, test_f1: 0.4346
 epoch: 24, train_loss: 1.0063, test_loss: 1.0965, test_f1: 0.4394
 epoch: 25, train_loss: 1.0012, test_loss: 1.1002, test_f1: 0.4353
 epoch: 26, train_loss: 0.9978, test_loss: 1.0863, test_f1: 0.4409
 epoch: 27, train_loss: 0.9923, test_loss: 1.0871, test_f1: 0.4437
 epoch: 28, train_loss: 0.9809, test_loss: 1.0788, test_f1: 0.4491
 epoch: 29, train_loss: 0.9758, test_loss: 1.0685, test_f1: 0.4759
 epoch: 30, train_loss: 0.9737, test_loss: 1.0738, test_f1: 0.4699
 epoch: 31, train_loss: 0.9675, test_loss: 1.0699, test_f1: 0.4716
 epoch: 32, train_loss: 0.9753, test_loss: 1.0612, test_f1: 0.4813
 epoch: 33, train_loss: 0.9669, test_loss: 1.0655, test_f1: 0.4803
 epoch: 34, train_loss: 0.9602, test_loss: 1.0596, test_f1: 0.4829
 epoch: 35, train_loss: 0.9530, test_loss: 1.0602, test_f1: 0.4975
 epoch: 36, train_loss: 0.9567, test_loss: 1.0547, test_f1: 0.4903
 epoch: 37, train_loss: 0.9469, test_loss: 1.0581, test_f1: 0.4925
 epoch: 38, train_loss: 0.9494, test_loss: 1.0567, test_f1: 0.4992
 epoch: 39, train_loss: 0.9446, test_loss: 1.0524, test_f1: 0.5003
 epoch: 40, train_loss: 0.9333, test_loss: 1.0464, test_f1: 0.4988
 epoch: 41, train_loss: 0.9335, test_loss: 1.0502, test_f1: 0.5251
 epoch: 42, train_loss: 0.9262, test_loss: 1.0363, test_f1: 0.5195
 epoch: 43, train_loss: 0.9246, test_loss: 1.0378, test_f1: 0.5137
 epoch: 44, train_loss: 0.9183, test_loss: 1.0419, test_f1: 0.5103
 epoch: 45, train_loss: 0.9188, test_loss: 1.0408, test_f1: 0.5177
 epoch: 46, train_loss: 0.9181, test_loss: 1.0452, test_f1: 0.5200
 epoch: 47, train_loss: 0.9063, test_loss: 1.0341, test_f1: 0.5338
 epoch: 48, train_loss: 0.9075, test_loss: 1.0517, test_f1: 0.5280
 epoch: 49, train_loss: 0.9060, test_loss: 1.0329, test_f1: 0.5543
 epoch: 50, train_loss: 0.9025, test_loss: 1.0324, test_f1: 0.5613
 epoch: 51, train_loss: 0.9029, test_loss: 1.0302, test_f1: 0.5588
 epoch: 52, train_loss: 0.8975, test_loss: 1.0283, test_f1: 0.5637
 epoch: 53, train_loss: 0.8990, test_loss: 1.0316, test_f1: 0.5561
 epoch: 54, train_loss: 0.9013, test_loss: 1.0249, test_f1: 0.5409
 epoch: 55, train_loss: 0.8980, test_loss: 1.0260, test_f1: 0.5449
 epoch: 56, train_loss: 0.8918, test_loss: 1.0416, test_f1: 0.5406
 epoch: 57, train_loss: 0.9016, test_loss: 1.0309, test_f1: 0.5536
 epoch: 58, train_loss: 0.8828, test_loss: 1.0249, test_f1: 0.5553
 epoch: 59, train_loss: 0.8904, test_loss: 1.0349, test_f1: 0.5507
 epoch: 60, train_loss: 0.8858, test_loss: 1.0373, test_f1: 0.5446
 epoch: 61, train_loss: 0.8923, test_loss: 1.0271, test_f1: 0.5553
 epoch: 62, train_loss: 0.8909, test_loss: 1.0270, test_f1: 0.5520
 epoch: 63, train_loss: 0.8804, test_loss: 1.0264, test_f1: 0.5650
 epoch: 64, train_loss: 0.8780, test_loss: 1.0292, test_f1: 0.5614
 epoch: 65, train_loss: 0.8876, test_loss: 1.0252, test_f1: 0.5605
 epoch: 66, train_loss: 0.8901, test_loss: 1.0248, test_f1: 0.5593
 epoch: 67, train_loss: 0.8750, test_loss: 1.0329, test_f1: 0.5676
 epoch: 68, train_loss: 0.8796, test_loss: 1.0304, test_f1: 0.5674
 epoch: 69, train_loss: 0.8784, test_loss: 1.0359, test_f1: 0.5690
 epoch: 70, train_loss: 0.8821, test_loss: 1.0266, test_f1: 0.5729
 epoch: 71, train_loss: 0.8833, test_loss: 1.0265, test_f1: 0.5725
 epoch: 72, train_loss: 0.8675, test_loss: 1.0251, test_f1: 0.5707
 epoch: 73, train_loss: 0.8834, test_loss: 1.0275, test_f1: 0.5699
 epoch: 74, train_loss: 0.8742, test_loss: 1.0354, test_f1: 0.5646
 epoch: 75, train_loss: 0.8688, test_loss: 1.0251, test_f1: 0.5811
 epoch: 76, train_loss: 0.8728, test_loss: 1.0295, test_f1: 0.5700
 epoch: 77, train_loss: 0.8762, test_loss: 1.0227, test_f1: 0.5697
 epoch: 78, train_loss: 0.8768, test_loss: 1.0331, test_f1: 0.5767
 epoch: 79, train_loss: 0.8663, test_loss: 1.0292, test_f1: 0.5728
 epoch: 80, train_loss: 0.8677, test_loss: 1.0275, test_f1: 0.5663
 epoch: 81, train_loss: 0.8690, test_loss: 1.0232, test_f1: 0.5666
 epoch: 82, train_loss: 0.8709, test_loss: 1.0217, test_f1: 0.5788
 epoch: 83, train_loss: 0.8664, test_loss: 1.0329, test_f1: 0.5737
 epoch: 84, train_loss: 0.8655, test_loss: 1.0251, test_f1: 0.5726
 epoch: 85, train_loss: 0.8642, test_loss: 1.0255, test_f1: 0.5763
 epoch: 86, train_loss: 0.8616, test_loss: 1.0287, test_f1: 0.5738
 epoch: 87, train_loss: 0.8533, test_loss: 1.0197, test_f1: 0.5714
 epoch: 88, train_loss: 0.8623, test_loss: 1.0257, test_f1: 0.5721
 epoch: 89, train_loss: 0.8618, test_loss: 1.0283, test_f1: 0.5665
 epoch: 90, train_loss: 0.8587, test_loss: 1.0228, test_f1: 0.5759
 epoch: 91, train_loss: 0.8473, test_loss: 1.0338, test_f1: 0.5798
 epoch: 92, train_loss: 0.8587, test_loss: 1.0332, test_f1: 0.5602
 epoch: 93, train_loss: 0.8491, test_loss: 1.0384, test_f1: 0.5691
 epoch: 94, train_loss: 0.8631, test_loss: 1.0315, test_f1: 0.5796
 epoch: 95, train_loss: 0.8562, test_loss: 1.0268, test_f1: 0.5828
 epoch: 96, train_loss: 0.8526, test_loss: 1.0209, test_f1: 0.5770
 epoch: 97, train_loss: 0.8517, test_loss: 1.0335, test_f1: 0.5718
 epoch: 98, train_loss: 0.8484, test_loss: 1.0287, test_f1: 0.5764
 epoch: 99, train_loss: 0.8503, test_loss: 1.0263, test_f1: 0.5816
##################ITERATION #5 ****************************************
 epoch: 0, train_loss: 1.2607, test_loss: 1.3108, test_f1: 0.2281
 epoch: 1, train_loss: 1.2048, test_loss: 1.2923, test_f1: 0.2281
 epoch: 2, train_loss: 1.1716, test_loss: 1.2601, test_f1: 0.2336
 epoch: 3, train_loss: 1.1549, test_loss: 1.2271, test_f1: 0.2979
 epoch: 4, train_loss: 1.1350, test_loss: 1.2023, test_f1: 0.3227
 epoch: 5, train_loss: 1.1164, test_loss: 1.1814, test_f1: 0.3203
 epoch: 6, train_loss: 1.1065, test_loss: 1.1664, test_f1: 0.3168
 epoch: 7, train_loss: 1.0908, test_loss: 1.1570, test_f1: 0.3162
 epoch: 8, train_loss: 1.0815, test_loss: 1.1503, test_f1: 0.3501
 epoch: 9, train_loss: 1.0797, test_loss: 1.1422, test_f1: 0.3522
 epoch: 10, train_loss: 1.0657, test_loss: 1.1355, test_f1: 0.3554
 epoch: 11, train_loss: 1.0556, test_loss: 1.1312, test_f1: 0.3881
 epoch: 12, train_loss: 1.0567, test_loss: 1.1286, test_f1: 0.3958
 epoch: 13, train_loss: 1.0550, test_loss: 1.1220, test_f1: 0.4075
 epoch: 14, train_loss: 1.0422, test_loss: 1.1194, test_f1: 0.4211
 epoch: 15, train_loss: 1.0401, test_loss: 1.1175, test_f1: 0.4360
 epoch: 16, train_loss: 1.0458, test_loss: 1.1150, test_f1: 0.4275
 epoch: 17, train_loss: 1.0332, test_loss: 1.1116, test_f1: 0.4271
 epoch: 18, train_loss: 1.0252, test_loss: 1.1072, test_f1: 0.4377
 epoch: 19, train_loss: 1.0275, test_loss: 1.1046, test_f1: 0.4343
 epoch: 20, train_loss: 1.0160, test_loss: 1.1015, test_f1: 0.4365
 epoch: 21, train_loss: 1.0089, test_loss: 1.0996, test_f1: 0.4390
 epoch: 22, train_loss: 1.0042, test_loss: 1.1005, test_f1: 0.4416
 epoch: 23, train_loss: 1.0021, test_loss: 1.0951, test_f1: 0.4419
 epoch: 24, train_loss: 1.0016, test_loss: 1.0894, test_f1: 0.4541
 epoch: 25, train_loss: 0.9933, test_loss: 1.0907, test_f1: 0.4611
 epoch: 26, train_loss: 0.9980, test_loss: 1.0843, test_f1: 0.4529
 epoch: 27, train_loss: 0.9950, test_loss: 1.0804, test_f1: 0.4569
 epoch: 28, train_loss: 0.9913, test_loss: 1.0775, test_f1: 0.4569
 epoch: 29, train_loss: 0.9815, test_loss: 1.0660, test_f1: 0.4615
 epoch: 30, train_loss: 0.9776, test_loss: 1.0670, test_f1: 0.4632
 epoch: 31, train_loss: 0.9777, test_loss: 1.0703, test_f1: 0.4691
 epoch: 32, train_loss: 0.9749, test_loss: 1.0677, test_f1: 0.4669
 epoch: 33, train_loss: 0.9691, test_loss: 1.0667, test_f1: 0.4716
 epoch: 34, train_loss: 0.9681, test_loss: 1.0624, test_f1: 0.4570
 epoch: 35, train_loss: 0.9667, test_loss: 1.0631, test_f1: 0.4675
 epoch: 36, train_loss: 0.9565, test_loss: 1.0608, test_f1: 0.4653
 epoch: 37, train_loss: 0.9646, test_loss: 1.0638, test_f1: 0.4633
 epoch: 38, train_loss: 0.9646, test_loss: 1.0477, test_f1: 0.4685
 epoch: 39, train_loss: 0.9562, test_loss: 1.0484, test_f1: 0.4702
 epoch: 40, train_loss: 0.9477, test_loss: 1.0602, test_f1: 0.4678
 epoch: 41, train_loss: 0.9436, test_loss: 1.0485, test_f1: 0.4702
 epoch: 42, train_loss: 0.9497, test_loss: 1.0431, test_f1: 0.4851
 epoch: 43, train_loss: 0.9389, test_loss: 1.0365, test_f1: 0.4988
 epoch: 44, train_loss: 0.9409, test_loss: 1.0438, test_f1: 0.4935
 epoch: 45, train_loss: 0.9408, test_loss: 1.0366, test_f1: 0.4977
 epoch: 46, train_loss: 0.9252, test_loss: 1.0395, test_f1: 0.4939
 epoch: 47, train_loss: 0.9335, test_loss: 1.0329, test_f1: 0.5062
 epoch: 48, train_loss: 0.9312, test_loss: 1.0263, test_f1: 0.5098
 epoch: 49, train_loss: 0.9170, test_loss: 1.0282, test_f1: 0.5162
 epoch: 50, train_loss: 0.9167, test_loss: 1.0306, test_f1: 0.5173
 epoch: 51, train_loss: 0.9129, test_loss: 1.0232, test_f1: 0.5219
 epoch: 52, train_loss: 0.9247, test_loss: 1.0227, test_f1: 0.5177
 epoch: 53, train_loss: 0.9189, test_loss: 1.0302, test_f1: 0.5156
 epoch: 54, train_loss: 0.9192, test_loss: 1.0261, test_f1: 0.5143
 epoch: 55, train_loss: 0.9203, test_loss: 1.0266, test_f1: 0.5195
 epoch: 56, train_loss: 0.9062, test_loss: 1.0297, test_f1: 0.5147
 epoch: 57, train_loss: 0.9167, test_loss: 1.0243, test_f1: 0.5226
 epoch: 58, train_loss: 0.9122, test_loss: 1.0209, test_f1: 0.5204
 epoch: 59, train_loss: 0.9165, test_loss: 1.0156, test_f1: 0.5255
 epoch: 60, train_loss: 0.9065, test_loss: 1.0181, test_f1: 0.5304
 epoch: 61, train_loss: 0.9033, test_loss: 1.0239, test_f1: 0.5447
 epoch: 62, train_loss: 0.9042, test_loss: 1.0217, test_f1: 0.5358
 epoch: 63, train_loss: 0.9097, test_loss: 1.0207, test_f1: 0.5271
 epoch: 64, train_loss: 0.9013, test_loss: 1.0177, test_f1: 0.5230
 epoch: 65, train_loss: 0.8907, test_loss: 1.0188, test_f1: 0.5220
 epoch: 66, train_loss: 0.8950, test_loss: 1.0168, test_f1: 0.5264
 epoch: 67, train_loss: 0.8935, test_loss: 1.0206, test_f1: 0.5242
 epoch: 68, train_loss: 0.8871, test_loss: 1.0113, test_f1: 0.5332
 epoch: 69, train_loss: 0.8980, test_loss: 1.0214, test_f1: 0.5225
 epoch: 70, train_loss: 0.8936, test_loss: 1.0082, test_f1: 0.5312
 epoch: 71, train_loss: 0.8948, test_loss: 1.0128, test_f1: 0.5285
 epoch: 72, train_loss: 0.8929, test_loss: 1.0162, test_f1: 0.5254
 epoch: 73, train_loss: 0.8877, test_loss: 1.0105, test_f1: 0.5269
 epoch: 74, train_loss: 0.8904, test_loss: 1.0059, test_f1: 0.5315
 epoch: 75, train_loss: 0.8931, test_loss: 1.0068, test_f1: 0.5306
 epoch: 76, train_loss: 0.8826, test_loss: 1.0097, test_f1: 0.5238
 epoch: 77, train_loss: 0.8910, test_loss: 1.0211, test_f1: 0.5179
 epoch: 78, train_loss: 0.8892, test_loss: 1.0125, test_f1: 0.5213
 epoch: 79, train_loss: 0.8906, test_loss: 1.0072, test_f1: 0.5396
 epoch: 80, train_loss: 0.8812, test_loss: 1.0074, test_f1: 0.5355
 epoch: 81, train_loss: 0.8849, test_loss: 1.0152, test_f1: 0.5175
 epoch: 82, train_loss: 0.8901, test_loss: 1.0082, test_f1: 0.5314
 epoch: 83, train_loss: 0.8893, test_loss: 1.0046, test_f1: 0.5306
 epoch: 84, train_loss: 0.8696, test_loss: 1.0067, test_f1: 0.5330
 epoch: 85, train_loss: 0.8783, test_loss: 1.0028, test_f1: 0.5387
 epoch: 86, train_loss: 0.8728, test_loss: 1.0131, test_f1: 0.5200
 epoch: 87, train_loss: 0.8754, test_loss: 0.9984, test_f1: 0.5449
 epoch: 88, train_loss: 0.8766, test_loss: 1.0132, test_f1: 0.5291
 epoch: 89, train_loss: 0.8781, test_loss: 1.0106, test_f1: 0.5261
 epoch: 90, train_loss: 0.8784, test_loss: 0.9935, test_f1: 0.5449
 epoch: 91, train_loss: 0.8749, test_loss: 1.0021, test_f1: 0.5387
 epoch: 92, train_loss: 0.8701, test_loss: 1.0000, test_f1: 0.5369
 epoch: 93, train_loss: 0.8673, test_loss: 0.9962, test_f1: 0.5480
 epoch: 94, train_loss: 0.8702, test_loss: 1.0103, test_f1: 0.5328
 epoch: 95, train_loss: 0.8558, test_loss: 1.0034, test_f1: 0.5331
 epoch: 96, train_loss: 0.8726, test_loss: 1.0095, test_f1: 0.5340
 epoch: 97, train_loss: 0.8632, test_loss: 1.0072, test_f1: 0.5435
 epoch: 98, train_loss: 0.8571, test_loss: 1.0102, test_f1: 0.5306
 epoch: 99, train_loss: 0.8712, test_loss: 0.9990, test_f1: 0.5347
##################ITERATION #6 ****************************************
 epoch: 0, train_loss: 1.2718, test_loss: 1.3063, test_f1: 0.2281
 epoch: 1, train_loss: 1.2181, test_loss: 1.2935, test_f1: 0.2281
 epoch: 2, train_loss: 1.1906, test_loss: 1.2790, test_f1: 0.2281
 epoch: 3, train_loss: 1.1693, test_loss: 1.2568, test_f1: 0.2336
 epoch: 4, train_loss: 1.1531, test_loss: 1.2337, test_f1: 0.2889
 epoch: 5, train_loss: 1.1404, test_loss: 1.2152, test_f1: 0.3015
 epoch: 6, train_loss: 1.1207, test_loss: 1.1999, test_f1: 0.3210
 epoch: 7, train_loss: 1.1185, test_loss: 1.1891, test_f1: 0.3704
 epoch: 8, train_loss: 1.1070, test_loss: 1.1808, test_f1: 0.4075
 epoch: 9, train_loss: 1.0951, test_loss: 1.1742, test_f1: 0.4269
 epoch: 10, train_loss: 1.0915, test_loss: 1.1658, test_f1: 0.4390
 epoch: 11, train_loss: 1.0766, test_loss: 1.1624, test_f1: 0.4439
 epoch: 12, train_loss: 1.0736, test_loss: 1.1566, test_f1: 0.4416
 epoch: 13, train_loss: 1.0677, test_loss: 1.1513, test_f1: 0.4560
 epoch: 14, train_loss: 1.0666, test_loss: 1.1513, test_f1: 0.4432
 epoch: 15, train_loss: 1.0541, test_loss: 1.1534, test_f1: 0.4391
 epoch: 16, train_loss: 1.0544, test_loss: 1.1502, test_f1: 0.4418
 epoch: 17, train_loss: 1.0475, test_loss: 1.1424, test_f1: 0.4543
 epoch: 18, train_loss: 1.0420, test_loss: 1.1347, test_f1: 0.4544
 epoch: 19, train_loss: 1.0327, test_loss: 1.1303, test_f1: 0.4565
 epoch: 20, train_loss: 1.0250, test_loss: 1.1322, test_f1: 0.4393
 epoch: 21, train_loss: 1.0256, test_loss: 1.1257, test_f1: 0.4494
 epoch: 22, train_loss: 1.0179, test_loss: 1.1239, test_f1: 0.4473
 epoch: 23, train_loss: 1.0092, test_loss: 1.1172, test_f1: 0.4596
 epoch: 24, train_loss: 1.0086, test_loss: 1.1167, test_f1: 0.4536
 epoch: 25, train_loss: 1.0106, test_loss: 1.1118, test_f1: 0.4638
 epoch: 26, train_loss: 0.9979, test_loss: 1.1036, test_f1: 0.4580
 epoch: 27, train_loss: 1.0011, test_loss: 1.1017, test_f1: 0.4561
 epoch: 28, train_loss: 0.9844, test_loss: 1.1032, test_f1: 0.4670
 epoch: 29, train_loss: 0.9897, test_loss: 1.0986, test_f1: 0.4729
 epoch: 30, train_loss: 0.9791, test_loss: 1.0947, test_f1: 0.4863
 epoch: 31, train_loss: 0.9801, test_loss: 1.0896, test_f1: 0.4900
 epoch: 32, train_loss: 0.9726, test_loss: 1.0813, test_f1: 0.4896
 epoch: 33, train_loss: 0.9797, test_loss: 1.0838, test_f1: 0.4988
 epoch: 34, train_loss: 0.9624, test_loss: 1.0868, test_f1: 0.5026
 epoch: 35, train_loss: 0.9615, test_loss: 1.0803, test_f1: 0.5016
 epoch: 36, train_loss: 0.9627, test_loss: 1.0770, test_f1: 0.5083
 epoch: 37, train_loss: 0.9572, test_loss: 1.0747, test_f1: 0.5108
 epoch: 38, train_loss: 0.9484, test_loss: 1.0741, test_f1: 0.5198
 epoch: 39, train_loss: 0.9455, test_loss: 1.0698, test_f1: 0.5167
 epoch: 40, train_loss: 0.9521, test_loss: 1.0659, test_f1: 0.5132
 epoch: 41, train_loss: 0.9358, test_loss: 1.0632, test_f1: 0.5074
 epoch: 42, train_loss: 0.9460, test_loss: 1.0606, test_f1: 0.5279
 epoch: 43, train_loss: 0.9374, test_loss: 1.0523, test_f1: 0.5220
 epoch: 44, train_loss: 0.9292, test_loss: 1.0486, test_f1: 0.5161
 epoch: 45, train_loss: 0.9302, test_loss: 1.0418, test_f1: 0.5203
 epoch: 46, train_loss: 0.9244, test_loss: 1.0456, test_f1: 0.5222
 epoch: 47, train_loss: 0.9286, test_loss: 1.0538, test_f1: 0.5209
 epoch: 48, train_loss: 0.9153, test_loss: 1.0552, test_f1: 0.5148
 epoch: 49, train_loss: 0.9153, test_loss: 1.0445, test_f1: 0.5231
 epoch: 50, train_loss: 0.9158, test_loss: 1.0442, test_f1: 0.5223
 epoch: 51, train_loss: 0.9054, test_loss: 1.0481, test_f1: 0.5176
 epoch: 52, train_loss: 0.9125, test_loss: 1.0460, test_f1: 0.5191
 epoch: 53, train_loss: 0.9167, test_loss: 1.0471, test_f1: 0.5267
 epoch: 54, train_loss: 0.8964, test_loss: 1.0470, test_f1: 0.5267
 epoch: 55, train_loss: 0.9126, test_loss: 1.0458, test_f1: 0.5234
 epoch: 56, train_loss: 0.9034, test_loss: 1.0461, test_f1: 0.5317
 epoch: 57, train_loss: 0.9080, test_loss: 1.0499, test_f1: 0.5248
 epoch: 58, train_loss: 0.9064, test_loss: 1.0404, test_f1: 0.5344
 epoch: 59, train_loss: 0.8984, test_loss: 1.0466, test_f1: 0.5233
 epoch: 60, train_loss: 0.9050, test_loss: 1.0570, test_f1: 0.5267
 epoch: 61, train_loss: 0.9013, test_loss: 1.0473, test_f1: 0.5291
 epoch: 62, train_loss: 0.8984, test_loss: 1.0412, test_f1: 0.5316
 epoch: 63, train_loss: 0.9023, test_loss: 1.0470, test_f1: 0.5327
 epoch: 64, train_loss: 0.8964, test_loss: 1.0521, test_f1: 0.5284
 epoch: 65, train_loss: 0.8940, test_loss: 1.0503, test_f1: 0.5315
 epoch: 66, train_loss: 0.8944, test_loss: 1.0497, test_f1: 0.5305
 epoch: 67, train_loss: 0.8902, test_loss: 1.0529, test_f1: 0.5229
 epoch: 68, train_loss: 0.8918, test_loss: 1.0634, test_f1: 0.5316
 epoch: 69, train_loss: 0.8837, test_loss: 1.0485, test_f1: 0.5281
 epoch: 70, train_loss: 0.8867, test_loss: 1.0531, test_f1: 0.5281
 epoch: 71, train_loss: 0.8903, test_loss: 1.0467, test_f1: 0.5281
 epoch: 72, train_loss: 0.8814, test_loss: 1.0555, test_f1: 0.5168
 epoch: 73, train_loss: 0.8838, test_loss: 1.0515, test_f1: 0.5246
 epoch: 74, train_loss: 0.8910, test_loss: 1.0431, test_f1: 0.5369
 epoch: 75, train_loss: 0.8840, test_loss: 1.0561, test_f1: 0.5248
 epoch: 76, train_loss: 0.8926, test_loss: 1.0482, test_f1: 0.5316
 epoch: 77, train_loss: 0.8870, test_loss: 1.0570, test_f1: 0.5176
 epoch: 78, train_loss: 0.8730, test_loss: 1.0515, test_f1: 0.5250
 epoch: 79, train_loss: 0.8844, test_loss: 1.0425, test_f1: 0.5310
 epoch: 80, train_loss: 0.8761, test_loss: 1.0455, test_f1: 0.5322
 epoch: 81, train_loss: 0.8740, test_loss: 1.0598, test_f1: 0.5201
 epoch: 82, train_loss: 0.8744, test_loss: 1.0494, test_f1: 0.5292
 epoch: 83, train_loss: 0.8723, test_loss: 1.0485, test_f1: 0.5304
 epoch: 84, train_loss: 0.8715, test_loss: 1.0450, test_f1: 0.5280
 epoch: 85, train_loss: 0.8662, test_loss: 1.0533, test_f1: 0.5293
 epoch: 86, train_loss: 0.8615, test_loss: 1.0436, test_f1: 0.5344
 epoch: 87, train_loss: 0.8691, test_loss: 1.0547, test_f1: 0.5344
 epoch: 88, train_loss: 0.8659, test_loss: 1.0649, test_f1: 0.5263
 epoch: 89, train_loss: 0.8581, test_loss: 1.0586, test_f1: 0.5250
 epoch: 90, train_loss: 0.8604, test_loss: 1.0533, test_f1: 0.5295
 epoch: 91, train_loss: 0.8656, test_loss: 1.0449, test_f1: 0.5318
 epoch: 92, train_loss: 0.8614, test_loss: 1.0558, test_f1: 0.5397
 epoch: 93, train_loss: 0.8676, test_loss: 1.0530, test_f1: 0.5330
 epoch: 94, train_loss: 0.8531, test_loss: 1.0396, test_f1: 0.5367
 epoch: 95, train_loss: 0.8745, test_loss: 1.0336, test_f1: 0.5176
 epoch: 96, train_loss: 0.8596, test_loss: 1.0444, test_f1: 0.5347
 epoch: 97, train_loss: 0.8561, test_loss: 1.0543, test_f1: 0.5277
 epoch: 98, train_loss: 0.8662, test_loss: 1.0480, test_f1: 0.5317
 epoch: 99, train_loss: 0.8534, test_loss: 1.0521, test_f1: 0.5350
##################ITERATION #7 ****************************************
 epoch: 0, train_loss: 1.3004, test_loss: 1.3184, test_f1: 0.2281
 epoch: 1, train_loss: 1.2201, test_loss: 1.3076, test_f1: 0.2281
 epoch: 2, train_loss: 1.1971, test_loss: 1.2909, test_f1: 0.2281
 epoch: 3, train_loss: 1.1785, test_loss: 1.2722, test_f1: 0.2336
 epoch: 4, train_loss: 1.1708, test_loss: 1.2528, test_f1: 0.2336
 epoch: 5, train_loss: 1.1503, test_loss: 1.2392, test_f1: 0.2452
 epoch: 6, train_loss: 1.1469, test_loss: 1.2292, test_f1: 0.2856
 epoch: 7, train_loss: 1.1424, test_loss: 1.2216, test_f1: 0.2891
 epoch: 8, train_loss: 1.1267, test_loss: 1.2147, test_f1: 0.2968
 epoch: 9, train_loss: 1.1343, test_loss: 1.2075, test_f1: 0.3137
 epoch: 10, train_loss: 1.1134, test_loss: 1.2017, test_f1: 0.3180
 epoch: 11, train_loss: 1.1154, test_loss: 1.1932, test_f1: 0.3679
 epoch: 12, train_loss: 1.1010, test_loss: 1.1851, test_f1: 0.3718
 epoch: 13, train_loss: 1.0952, test_loss: 1.1795, test_f1: 0.3840
 epoch: 14, train_loss: 1.0890, test_loss: 1.1717, test_f1: 0.3857
 epoch: 15, train_loss: 1.0856, test_loss: 1.1695, test_f1: 0.3868
 epoch: 16, train_loss: 1.0744, test_loss: 1.1660, test_f1: 0.3947
 epoch: 17, train_loss: 1.0692, test_loss: 1.1567, test_f1: 0.3991
 epoch: 18, train_loss: 1.0655, test_loss: 1.1521, test_f1: 0.4028
 epoch: 19, train_loss: 1.0591, test_loss: 1.1491, test_f1: 0.4086
 epoch: 20, train_loss: 1.0581, test_loss: 1.1444, test_f1: 0.4109
 epoch: 21, train_loss: 1.0443, test_loss: 1.1424, test_f1: 0.4215
 epoch: 22, train_loss: 1.0425, test_loss: 1.1351, test_f1: 0.4230
 epoch: 23, train_loss: 1.0361, test_loss: 1.1293, test_f1: 0.4359
 epoch: 24, train_loss: 1.0299, test_loss: 1.1283, test_f1: 0.4351
 epoch: 25, train_loss: 1.0216, test_loss: 1.1243, test_f1: 0.4499
 epoch: 26, train_loss: 1.0216, test_loss: 1.1217, test_f1: 0.4499
 epoch: 27, train_loss: 1.0162, test_loss: 1.1158, test_f1: 0.4521
 epoch: 28, train_loss: 1.0165, test_loss: 1.1136, test_f1: 0.4501
 epoch: 29, train_loss: 1.0070, test_loss: 1.1133, test_f1: 0.4580
 epoch: 30, train_loss: 0.9973, test_loss: 1.1043, test_f1: 0.4627
 epoch: 31, train_loss: 0.9984, test_loss: 1.1032, test_f1: 0.4684
 epoch: 32, train_loss: 0.9948, test_loss: 1.0970, test_f1: 0.4727
 epoch: 33, train_loss: 0.9929, test_loss: 1.0866, test_f1: 0.4878
 epoch: 34, train_loss: 0.9934, test_loss: 1.0879, test_f1: 0.4794
 epoch: 35, train_loss: 0.9852, test_loss: 1.0819, test_f1: 0.4735
 epoch: 36, train_loss: 0.9777, test_loss: 1.0809, test_f1: 0.4793
 epoch: 37, train_loss: 0.9775, test_loss: 1.0767, test_f1: 0.4882
 epoch: 38, train_loss: 0.9657, test_loss: 1.0709, test_f1: 0.4826
 epoch: 39, train_loss: 0.9633, test_loss: 1.0708, test_f1: 0.4842
 epoch: 40, train_loss: 0.9640, test_loss: 1.0657, test_f1: 0.4844
 epoch: 41, train_loss: 0.9574, test_loss: 1.0686, test_f1: 0.4876
 epoch: 42, train_loss: 0.9587, test_loss: 1.0653, test_f1: 0.4816
 epoch: 43, train_loss: 0.9571, test_loss: 1.0587, test_f1: 0.4865
 epoch: 44, train_loss: 0.9446, test_loss: 1.0556, test_f1: 0.4949
 epoch: 45, train_loss: 0.9440, test_loss: 1.0556, test_f1: 0.4905
 epoch: 46, train_loss: 0.9336, test_loss: 1.0500, test_f1: 0.4928
 epoch: 47, train_loss: 0.9253, test_loss: 1.0508, test_f1: 0.4928
 epoch: 48, train_loss: 0.9224, test_loss: 1.0440, test_f1: 0.4915
 epoch: 49, train_loss: 0.9318, test_loss: 1.0453, test_f1: 0.5043
 epoch: 50, train_loss: 0.9258, test_loss: 1.0499, test_f1: 0.4937
 epoch: 51, train_loss: 0.9248, test_loss: 1.0512, test_f1: 0.4956
 epoch: 52, train_loss: 0.9352, test_loss: 1.0483, test_f1: 0.5017
 epoch: 53, train_loss: 0.9186, test_loss: 1.0471, test_f1: 0.5053
 epoch: 54, train_loss: 0.9169, test_loss: 1.0491, test_f1: 0.4973
 epoch: 55, train_loss: 0.9168, test_loss: 1.0485, test_f1: 0.4997
 epoch: 56, train_loss: 0.9134, test_loss: 1.0471, test_f1: 0.5033
 epoch: 57, train_loss: 0.9196, test_loss: 1.0447, test_f1: 0.5043
 epoch: 58, train_loss: 0.9193, test_loss: 1.0459, test_f1: 0.5107
 epoch: 59, train_loss: 0.9248, test_loss: 1.0469, test_f1: 0.5124
 epoch: 60, train_loss: 0.9149, test_loss: 1.0458, test_f1: 0.5127
 epoch: 61, train_loss: 0.9218, test_loss: 1.0464, test_f1: 0.5078
 epoch: 62, train_loss: 0.9152, test_loss: 1.0472, test_f1: 0.5106
 epoch: 63, train_loss: 0.9133, test_loss: 1.0521, test_f1: 0.5075
 epoch: 64, train_loss: 0.9013, test_loss: 1.0462, test_f1: 0.5102
 epoch: 65, train_loss: 0.9125, test_loss: 1.0449, test_f1: 0.5121
 epoch: 66, train_loss: 0.9044, test_loss: 1.0407, test_f1: 0.5106
 epoch: 67, train_loss: 0.9090, test_loss: 1.0404, test_f1: 0.5102
 epoch: 68, train_loss: 0.9083, test_loss: 1.0443, test_f1: 0.5130
 epoch: 69, train_loss: 0.8966, test_loss: 1.0495, test_f1: 0.5130
 epoch: 70, train_loss: 0.9027, test_loss: 1.0487, test_f1: 0.5178
 epoch: 71, train_loss: 0.8990, test_loss: 1.0508, test_f1: 0.5108
 epoch: 72, train_loss: 0.8946, test_loss: 1.0425, test_f1: 0.5152
 epoch: 73, train_loss: 0.9005, test_loss: 1.0441, test_f1: 0.5113
 epoch: 74, train_loss: 0.9015, test_loss: 1.0434, test_f1: 0.5027
 epoch: 75, train_loss: 0.8996, test_loss: 1.0452, test_f1: 0.5117
 epoch: 76, train_loss: 0.8983, test_loss: 1.0437, test_f1: 0.5158
 epoch: 77, train_loss: 0.8892, test_loss: 1.0424, test_f1: 0.5153
 epoch: 78, train_loss: 0.8907, test_loss: 1.0424, test_f1: 0.5143
 epoch: 79, train_loss: 0.8922, test_loss: 1.0396, test_f1: 0.5191
 epoch: 80, train_loss: 0.8902, test_loss: 1.0426, test_f1: 0.5201
 epoch: 81, train_loss: 0.8885, test_loss: 1.0368, test_f1: 0.5197
 epoch: 82, train_loss: 0.8844, test_loss: 1.0396, test_f1: 0.5270
 epoch: 83, train_loss: 0.8878, test_loss: 1.0387, test_f1: 0.5240
 epoch: 84, train_loss: 0.8862, test_loss: 1.0389, test_f1: 0.5258
 epoch: 85, train_loss: 0.8885, test_loss: 1.0490, test_f1: 0.5155
 epoch: 86, train_loss: 0.8896, test_loss: 1.0462, test_f1: 0.5152
 epoch: 87, train_loss: 0.8815, test_loss: 1.0424, test_f1: 0.5218
 epoch: 88, train_loss: 0.8732, test_loss: 1.0424, test_f1: 0.5221
 epoch: 89, train_loss: 0.8840, test_loss: 1.0422, test_f1: 0.5254
 epoch: 90, train_loss: 0.8835, test_loss: 1.0385, test_f1: 0.5254
 epoch: 91, train_loss: 0.8939, test_loss: 1.0383, test_f1: 0.5280
 epoch: 92, train_loss: 0.8756, test_loss: 1.0390, test_f1: 0.5280
 epoch: 93, train_loss: 0.8665, test_loss: 1.0387, test_f1: 0.5346
 epoch: 94, train_loss: 0.8721, test_loss: 1.0361, test_f1: 0.5320
 epoch: 95, train_loss: 0.8739, test_loss: 1.0368, test_f1: 0.5312
 epoch: 96, train_loss: 0.8839, test_loss: 1.0394, test_f1: 0.5287
 epoch: 97, train_loss: 0.8802, test_loss: 1.0379, test_f1: 0.5246
 epoch: 98, train_loss: 0.8675, test_loss: 1.0413, test_f1: 0.5138
 epoch: 99, train_loss: 0.8744, test_loss: 1.0382, test_f1: 0.5346
##################ITERATION #8 ****************************************
 epoch: 0, train_loss: 1.2717, test_loss: 1.3375, test_f1: 0.2281
 epoch: 1, train_loss: 1.1943, test_loss: 1.3278, test_f1: 0.2583
 epoch: 2, train_loss: 1.1651, test_loss: 1.2969, test_f1: 0.2722
 epoch: 3, train_loss: 1.1505, test_loss: 1.2501, test_f1: 0.3260
 epoch: 4, train_loss: 1.1365, test_loss: 1.2054, test_f1: 0.3803
 epoch: 5, train_loss: 1.1346, test_loss: 1.1810, test_f1: 0.3945
 epoch: 6, train_loss: 1.1142, test_loss: 1.1697, test_f1: 0.4056
 epoch: 7, train_loss: 1.1077, test_loss: 1.1607, test_f1: 0.4124
 epoch: 8, train_loss: 1.0909, test_loss: 1.1505, test_f1: 0.4222
 epoch: 9, train_loss: 1.0957, test_loss: 1.1433, test_f1: 0.4301
 epoch: 10, train_loss: 1.0837, test_loss: 1.1309, test_f1: 0.4337
 epoch: 11, train_loss: 1.0772, test_loss: 1.1212, test_f1: 0.4261
 epoch: 12, train_loss: 1.0508, test_loss: 1.1160, test_f1: 0.4410
 epoch: 13, train_loss: 1.0526, test_loss: 1.1110, test_f1: 0.4566
 epoch: 14, train_loss: 1.0369, test_loss: 1.1052, test_f1: 0.4486
 epoch: 15, train_loss: 1.0342, test_loss: 1.1024, test_f1: 0.4542
 epoch: 16, train_loss: 1.0379, test_loss: 1.0958, test_f1: 0.4560
 epoch: 17, train_loss: 1.0316, test_loss: 1.0888, test_f1: 0.4650
 epoch: 18, train_loss: 1.0316, test_loss: 1.0858, test_f1: 0.4705
 epoch: 19, train_loss: 1.0239, test_loss: 1.0837, test_f1: 0.4805
 epoch: 20, train_loss: 1.0143, test_loss: 1.0788, test_f1: 0.4827
 epoch: 21, train_loss: 1.0111, test_loss: 1.0742, test_f1: 0.4824
 epoch: 22, train_loss: 1.0026, test_loss: 1.0691, test_f1: 0.4899
 epoch: 23, train_loss: 0.9985, test_loss: 1.0605, test_f1: 0.4953
 epoch: 24, train_loss: 1.0027, test_loss: 1.0576, test_f1: 0.4993
 epoch: 25, train_loss: 0.9854, test_loss: 1.0519, test_f1: 0.4964
 epoch: 26, train_loss: 0.9941, test_loss: 1.0430, test_f1: 0.4973
 epoch: 27, train_loss: 0.9844, test_loss: 1.0472, test_f1: 0.5037
 epoch: 28, train_loss: 0.9783, test_loss: 1.0457, test_f1: 0.5052
 epoch: 29, train_loss: 0.9783, test_loss: 1.0387, test_f1: 0.5029
 epoch: 30, train_loss: 0.9746, test_loss: 1.0445, test_f1: 0.4972
 epoch: 31, train_loss: 0.9691, test_loss: 1.0360, test_f1: 0.4957
 epoch: 32, train_loss: 0.9646, test_loss: 1.0373, test_f1: 0.5058
 epoch: 33, train_loss: 0.9677, test_loss: 1.0358, test_f1: 0.5058
 epoch: 34, train_loss: 0.9525, test_loss: 1.0301, test_f1: 0.5078
 epoch: 35, train_loss: 0.9581, test_loss: 1.0298, test_f1: 0.5109
 epoch: 36, train_loss: 0.9508, test_loss: 1.0238, test_f1: 0.5166
 epoch: 37, train_loss: 0.9506, test_loss: 1.0264, test_f1: 0.5134
 epoch: 38, train_loss: 0.9515, test_loss: 1.0284, test_f1: 0.5123
 epoch: 39, train_loss: 0.9421, test_loss: 1.0134, test_f1: 0.5213
 epoch: 40, train_loss: 0.9418, test_loss: 1.0151, test_f1: 0.5178
 epoch: 41, train_loss: 0.9391, test_loss: 1.0166, test_f1: 0.5319
 epoch: 42, train_loss: 0.9289, test_loss: 1.0153, test_f1: 0.5220
 epoch: 43, train_loss: 0.9321, test_loss: 1.0075, test_f1: 0.5395
 epoch: 44, train_loss: 0.9415, test_loss: 1.0123, test_f1: 0.5302
 epoch: 45, train_loss: 0.9318, test_loss: 1.0005, test_f1: 0.5456
 epoch: 46, train_loss: 0.9242, test_loss: 1.0054, test_f1: 0.5492
 epoch: 47, train_loss: 0.9266, test_loss: 1.0108, test_f1: 0.5472
 epoch: 48, train_loss: 0.9175, test_loss: 1.0012, test_f1: 0.5473
 epoch: 49, train_loss: 0.9198, test_loss: 1.0029, test_f1: 0.5364
 epoch: 50, train_loss: 0.9144, test_loss: 1.0072, test_f1: 0.5433
 epoch: 51, train_loss: 0.9088, test_loss: 0.9997, test_f1: 0.5423
 epoch: 52, train_loss: 0.9160, test_loss: 0.9968, test_f1: 0.5486
 epoch: 53, train_loss: 0.9115, test_loss: 0.9943, test_f1: 0.5409
 epoch: 54, train_loss: 0.9050, test_loss: 0.9944, test_f1: 0.5482
 epoch: 55, train_loss: 0.9054, test_loss: 0.9989, test_f1: 0.5385
 epoch: 56, train_loss: 0.9014, test_loss: 1.0052, test_f1: 0.5378
 epoch: 57, train_loss: 0.8968, test_loss: 0.9985, test_f1: 0.5464
 epoch: 58, train_loss: 0.8963, test_loss: 0.9965, test_f1: 0.5443
 epoch: 59, train_loss: 0.8995, test_loss: 1.0006, test_f1: 0.5383
 epoch: 60, train_loss: 0.9083, test_loss: 1.0045, test_f1: 0.5429
 epoch: 61, train_loss: 0.9032, test_loss: 0.9979, test_f1: 0.5408
 epoch: 62, train_loss: 0.9007, test_loss: 0.9945, test_f1: 0.5399
 epoch: 63, train_loss: 0.8908, test_loss: 0.9940, test_f1: 0.5311
 epoch: 64, train_loss: 0.9039, test_loss: 0.9956, test_f1: 0.5400
 epoch: 65, train_loss: 0.8947, test_loss: 0.9972, test_f1: 0.5310
 epoch: 66, train_loss: 0.8919, test_loss: 0.9981, test_f1: 0.5317
 epoch: 67, train_loss: 0.8968, test_loss: 0.9994, test_f1: 0.5383
 epoch: 68, train_loss: 0.8905, test_loss: 0.9936, test_f1: 0.5396
 epoch: 69, train_loss: 0.8983, test_loss: 0.9936, test_f1: 0.5498
 epoch: 70, train_loss: 0.8961, test_loss: 0.9970, test_f1: 0.5436
 epoch: 71, train_loss: 0.8912, test_loss: 0.9992, test_f1: 0.5399
 epoch: 72, train_loss: 0.8874, test_loss: 1.0046, test_f1: 0.5404
 epoch: 73, train_loss: 0.8795, test_loss: 0.9986, test_f1: 0.5472
 epoch: 74, train_loss: 0.8859, test_loss: 0.9989, test_f1: 0.5451
 epoch: 75, train_loss: 0.8810, test_loss: 0.9984, test_f1: 0.5395
 epoch: 76, train_loss: 0.8840, test_loss: 1.0038, test_f1: 0.5367
 epoch: 77, train_loss: 0.8880, test_loss: 1.0055, test_f1: 0.5367
 epoch: 78, train_loss: 0.8827, test_loss: 1.0007, test_f1: 0.5254
 epoch: 79, train_loss: 0.8866, test_loss: 0.9975, test_f1: 0.5286
 epoch: 80, train_loss: 0.8748, test_loss: 1.0058, test_f1: 0.5254
 epoch: 81, train_loss: 0.8792, test_loss: 1.0085, test_f1: 0.5240
 epoch: 82, train_loss: 0.8763, test_loss: 1.0068, test_f1: 0.5350
 epoch: 83, train_loss: 0.8682, test_loss: 1.0063, test_f1: 0.5359
 epoch: 84, train_loss: 0.8750, test_loss: 1.0070, test_f1: 0.5310
 epoch: 85, train_loss: 0.8636, test_loss: 1.0063, test_f1: 0.5205
 epoch: 86, train_loss: 0.8692, test_loss: 1.0080, test_f1: 0.5234
 epoch: 87, train_loss: 0.8763, test_loss: 1.0038, test_f1: 0.5173
 epoch: 88, train_loss: 0.8736, test_loss: 1.0029, test_f1: 0.5217
 epoch: 89, train_loss: 0.8712, test_loss: 1.0035, test_f1: 0.5155
 epoch: 90, train_loss: 0.8649, test_loss: 1.0024, test_f1: 0.5202
 epoch: 91, train_loss: 0.8774, test_loss: 0.9997, test_f1: 0.5283
 epoch: 92, train_loss: 0.8689, test_loss: 0.9986, test_f1: 0.5327
 epoch: 93, train_loss: 0.8621, test_loss: 1.0073, test_f1: 0.5292
 epoch: 94, train_loss: 0.8684, test_loss: 1.0059, test_f1: 0.5272
 epoch: 95, train_loss: 0.8619, test_loss: 1.0012, test_f1: 0.5278
 epoch: 96, train_loss: 0.8652, test_loss: 1.0003, test_f1: 0.5283
 epoch: 97, train_loss: 0.8634, test_loss: 1.0046, test_f1: 0.5281
 epoch: 98, train_loss: 0.8630, test_loss: 1.0087, test_f1: 0.5277
 epoch: 99, train_loss: 0.8530, test_loss: 1.0066, test_f1: 0.5259
##################ITERATION #9 ****************************************
 epoch: 0, train_loss: 1.2918, test_loss: 1.3078, test_f1: 0.2281
 epoch: 1, train_loss: 1.2101, test_loss: 1.2947, test_f1: 0.2281
 epoch: 2, train_loss: 1.1847, test_loss: 1.2799, test_f1: 0.2336
 epoch: 3, train_loss: 1.1649, test_loss: 1.2480, test_f1: 0.2867
 epoch: 4, train_loss: 1.1476, test_loss: 1.2092, test_f1: 0.3078
 epoch: 5, train_loss: 1.1336, test_loss: 1.1819, test_f1: 0.3058
 epoch: 6, train_loss: 1.1185, test_loss: 1.1663, test_f1: 0.3136
 epoch: 7, train_loss: 1.1059, test_loss: 1.1569, test_f1: 0.3156
 epoch: 8, train_loss: 1.1019, test_loss: 1.1469, test_f1: 0.3115
 epoch: 9, train_loss: 1.0905, test_loss: 1.1401, test_f1: 0.3156
 epoch: 10, train_loss: 1.0760, test_loss: 1.1338, test_f1: 0.3293
 epoch: 11, train_loss: 1.0707, test_loss: 1.1282, test_f1: 0.3422
 epoch: 12, train_loss: 1.0648, test_loss: 1.1223, test_f1: 0.3542
 epoch: 13, train_loss: 1.0626, test_loss: 1.1191, test_f1: 0.3566
 epoch: 14, train_loss: 1.0415, test_loss: 1.1098, test_f1: 0.3646
 epoch: 15, train_loss: 1.0381, test_loss: 1.1107, test_f1: 0.3591
 epoch: 16, train_loss: 1.0381, test_loss: 1.1035, test_f1: 0.3674
 epoch: 17, train_loss: 1.0231, test_loss: 1.0990, test_f1: 0.3704
 epoch: 18, train_loss: 1.0183, test_loss: 1.0962, test_f1: 0.3736
 epoch: 19, train_loss: 1.0117, test_loss: 1.0912, test_f1: 0.3835
 epoch: 20, train_loss: 1.0009, test_loss: 1.0865, test_f1: 0.3906
 epoch: 21, train_loss: 1.0110, test_loss: 1.0799, test_f1: 0.4050
 epoch: 22, train_loss: 1.0020, test_loss: 1.0776, test_f1: 0.4099
 epoch: 23, train_loss: 0.9968, test_loss: 1.0805, test_f1: 0.4064
 epoch: 24, train_loss: 0.9963, test_loss: 1.0746, test_f1: 0.4190
 epoch: 25, train_loss: 0.9878, test_loss: 1.0758, test_f1: 0.4200
 epoch: 26, train_loss: 0.9957, test_loss: 1.0709, test_f1: 0.4100
 epoch: 27, train_loss: 0.9763, test_loss: 1.0662, test_f1: 0.4058
 epoch: 28, train_loss: 0.9753, test_loss: 1.0588, test_f1: 0.4220
 epoch: 29, train_loss: 0.9752, test_loss: 1.0588, test_f1: 0.4458
 epoch: 30, train_loss: 0.9669, test_loss: 1.0561, test_f1: 0.4826
 epoch: 31, train_loss: 0.9725, test_loss: 1.0501, test_f1: 0.5035
 epoch: 32, train_loss: 0.9612, test_loss: 1.0462, test_f1: 0.5028
 epoch: 33, train_loss: 0.9631, test_loss: 1.0536, test_f1: 0.4900
 epoch: 34, train_loss: 0.9575, test_loss: 1.0474, test_f1: 0.4835
 epoch: 35, train_loss: 0.9481, test_loss: 1.0602, test_f1: 0.4880
 epoch: 36, train_loss: 0.9484, test_loss: 1.0595, test_f1: 0.5028
 epoch: 37, train_loss: 0.9511, test_loss: 1.0533, test_f1: 0.4972
 epoch: 38, train_loss: 0.9334, test_loss: 1.0516, test_f1: 0.5040
 epoch: 39, train_loss: 0.9348, test_loss: 1.0539, test_f1: 0.5151
 epoch: 40, train_loss: 0.9269, test_loss: 1.0525, test_f1: 0.5134
 epoch: 41, train_loss: 0.9339, test_loss: 1.0555, test_f1: 0.5220
 epoch: 42, train_loss: 0.9193, test_loss: 1.0535, test_f1: 0.5128
 epoch: 43, train_loss: 0.9139, test_loss: 1.0461, test_f1: 0.5209
 epoch: 44, train_loss: 0.9157, test_loss: 1.0450, test_f1: 0.5324
 epoch: 45, train_loss: 0.9147, test_loss: 1.0515, test_f1: 0.5242
 epoch: 46, train_loss: 0.9250, test_loss: 1.0442, test_f1: 0.5393
 epoch: 47, train_loss: 0.9122, test_loss: 1.0479, test_f1: 0.5262
 epoch: 48, train_loss: 0.9135, test_loss: 1.0582, test_f1: 0.5487
 epoch: 49, train_loss: 0.9120, test_loss: 1.0530, test_f1: 0.5438
 epoch: 50, train_loss: 0.8967, test_loss: 1.0519, test_f1: 0.5216
 epoch: 51, train_loss: 0.8953, test_loss: 1.0505, test_f1: 0.5325
 epoch: 52, train_loss: 0.9033, test_loss: 1.0545, test_f1: 0.5321
 epoch: 53, train_loss: 0.8876, test_loss: 1.0555, test_f1: 0.5296
 epoch: 54, train_loss: 0.8929, test_loss: 1.0504, test_f1: 0.5297
 epoch: 55, train_loss: 0.8949, test_loss: 1.0514, test_f1: 0.5366
 epoch: 56, train_loss: 0.8895, test_loss: 1.0541, test_f1: 0.5320
 epoch: 57, train_loss: 0.8973, test_loss: 1.0530, test_f1: 0.5310
 epoch: 58, train_loss: 0.8976, test_loss: 1.0542, test_f1: 0.5286
 epoch: 59, train_loss: 0.8930, test_loss: 1.0589, test_f1: 0.5390
 epoch: 60, train_loss: 0.8894, test_loss: 1.0571, test_f1: 0.5358
 epoch: 61, train_loss: 0.8922, test_loss: 1.0617, test_f1: 0.5275
 epoch: 62, train_loss: 0.8817, test_loss: 1.0548, test_f1: 0.5318
 epoch: 63, train_loss: 0.8867, test_loss: 1.0564, test_f1: 0.5341
 epoch: 64, train_loss: 0.8765, test_loss: 1.0595, test_f1: 0.5284
 epoch: 65, train_loss: 0.8807, test_loss: 1.0607, test_f1: 0.5327
 epoch: 66, train_loss: 0.8846, test_loss: 1.0601, test_f1: 0.5323
 epoch: 67, train_loss: 0.8774, test_loss: 1.0641, test_f1: 0.5300
 epoch: 68, train_loss: 0.8828, test_loss: 1.0599, test_f1: 0.5320
 epoch: 69, train_loss: 0.8792, test_loss: 1.0590, test_f1: 0.5328
 epoch: 70, train_loss: 0.8730, test_loss: 1.0587, test_f1: 0.5332
 epoch: 71, train_loss: 0.8804, test_loss: 1.0612, test_f1: 0.5310
 epoch: 72, train_loss: 0.8741, test_loss: 1.0658, test_f1: 0.5293
 epoch: 73, train_loss: 0.8676, test_loss: 1.0690, test_f1: 0.5290
 epoch: 74, train_loss: 0.8723, test_loss: 1.0738, test_f1: 0.5377
 epoch: 75, train_loss: 0.8670, test_loss: 1.0716, test_f1: 0.5320
 epoch: 76, train_loss: 0.8726, test_loss: 1.0658, test_f1: 0.5291
 epoch: 77, train_loss: 0.8774, test_loss: 1.0661, test_f1: 0.5313
 epoch: 78, train_loss: 0.8660, test_loss: 1.0710, test_f1: 0.5315
 epoch: 79, train_loss: 0.8715, test_loss: 1.0772, test_f1: 0.5310
 epoch: 80, train_loss: 0.8659, test_loss: 1.0721, test_f1: 0.5344
 epoch: 81, train_loss: 0.8647, test_loss: 1.0776, test_f1: 0.5380
 epoch: 82, train_loss: 0.8569, test_loss: 1.0726, test_f1: 0.5323
 epoch: 83, train_loss: 0.8714, test_loss: 1.0712, test_f1: 0.5230
 epoch: 84, train_loss: 0.8608, test_loss: 1.0724, test_f1: 0.5273
 epoch: 85, train_loss: 0.8491, test_loss: 1.0763, test_f1: 0.5327
 epoch: 86, train_loss: 0.8561, test_loss: 1.0756, test_f1: 0.5269
 epoch: 87, train_loss: 0.8581, test_loss: 1.0772, test_f1: 0.5323
 epoch: 88, train_loss: 0.8674, test_loss: 1.0722, test_f1: 0.5350
 epoch: 89, train_loss: 0.8547, test_loss: 1.0803, test_f1: 0.5323
 epoch: 90, train_loss: 0.8603, test_loss: 1.0866, test_f1: 0.5377
 epoch: 91, train_loss: 0.8614, test_loss: 1.0834, test_f1: 0.5424
 epoch: 92, train_loss: 0.8519, test_loss: 1.0775, test_f1: 0.5287
 epoch: 93, train_loss: 0.8600, test_loss: 1.0806, test_f1: 0.5254
 epoch: 94, train_loss: 0.8524, test_loss: 1.0799, test_f1: 0.5309
 epoch: 95, train_loss: 0.8560, test_loss: 1.0786, test_f1: 0.5353
 epoch: 96, train_loss: 0.8457, test_loss: 1.0863, test_f1: 0.5357
 epoch: 97, train_loss: 0.8451, test_loss: 1.0880, test_f1: 0.5333
 epoch: 98, train_loss: 0.8455, test_loss: 1.0888, test_f1: 0.5254
 epoch: 99, train_loss: 0.8457, test_loss: 1.0837, test_f1: 0.5356

Training completed in 397.32 seconds
Best F1: 0.5828 at epoch 95
Mean F1 across iterations: 0.5365  0.0248
========================FINAL RESULTS================================
FEGIN weighted F1: 0.5828  0.0248
python main.py --data ltspice_demos --representation component_net --model FEGIN --layers 2 --hiddens 64 --batch_size 128 --lr 0.0001 --emb_size 512 --epochs 100 --save_appendix component_net_L2_H64_BS128_LR0.0001_E512 --no_val
-----



STDERR:
  File "main.py", line 370, in <module>
    main()
  File "main.py", line 254, in main
    dataset = dataset_class(
  File "/home/philip/projects/ltspice_examples_code_repo/Circuit-Completion-Using-GNNs/component_classification_with_link_prediction_head/evaluation/FEGIN/kernel/circuit_datasets.py", line 15, in __init__
    self.data, self.slices = torch.load(self.processed_paths[0])
  File "/home/philip/.local/lib/python3.8/site-packages/torch/serialization.py", line 1040, in load
    warnings.warn(
  File "/usr/lib/python3.8/warnings.py", line 109, in _showwarnmsg
    sw(msg.message, msg.category, msg.filename, msg.lineno,
  File "main.py", line 47, in warn_with_traceback
    traceback.print_stack(file=log)
/home/philip/projects/ltspice_examples_code_repo/Circuit-Completion-Using-GNNs/component_classification_with_link_prediction_head/evaluation/FEGIN/kernel/circuit_datasets.py:15: FutureWarning: You are using `torch.load` with `weights_only=False` (the current default value), which uses the default pickle module implicitly. It is possible to construct malicious pickle data which will execute arbitrary code during unpickling (See https://github.com/pytorch/pytorch/blob/main/SECURITY.md#untrusted-models for more details). In a future release, the default value for `weights_only` will be flipped to `True`. This limits the functions that could be executed during unpickling. Arbitrary objects will no longer be allowed to be loaded via this mode unless they are explicitly allowlisted by the user via `torch.serialization.add_safe_globals`. We recommend you start setting `weights_only=True` for any use case where you don't have full control of the loaded file. Please open an issue on GitHub for any issues related to this experimental feature.
  self.data, self.slices = torch.load(self.processed_paths[0])
