STDOUT:
Results will be saved in /home/philip/projects/ltspice_examples_code_repo/Circuit-Completion-Using-GNNs/component_classification_with_link_prediction_head/evaluation/FEGIN/results/model_FEGIN_dataset_ltspice_demos
Command line input: python main.py --data ltspice_demos --representation component_pin_net --model FEGIN --layers 4 --hiddens 128 --batch_size 32 --lr 0.0001 --emb_size 512 --epochs 100 --save_appendix component_pin_net_L4_H128_BS32_LR0.0001_E512 --no_val
 is saved.
-----
ltspice_demos - FEGIN
Using 4 layers, 128 hidden units, h = 2
Loading component_pin_net representation dataset
ENTERED
Training FEGIN on component_pin_net representation
Train: 1565, Test: 383
##################ITERATION #0 ****************************************
 epoch: 0, train_loss: 1.3515, test_loss: 1.3434, test_f1: 0.1382
 epoch: 1, train_loss: 1.2674, test_loss: 1.2648, test_f1: 0.3350
 epoch: 2, train_loss: 1.1846, test_loss: 1.2084, test_f1: 0.3534
 epoch: 3, train_loss: 1.1302, test_loss: 1.1899, test_f1: 0.4386
 epoch: 4, train_loss: 1.0988, test_loss: 1.1622, test_f1: 0.4426
 epoch: 5, train_loss: 1.0611, test_loss: 1.1324, test_f1: 0.4488
 epoch: 6, train_loss: 1.0287, test_loss: 1.0996, test_f1: 0.4496
 epoch: 7, train_loss: 0.9997, test_loss: 1.0917, test_f1: 0.4568
 epoch: 8, train_loss: 0.9823, test_loss: 1.0844, test_f1: 0.4582
 epoch: 9, train_loss: 0.9755, test_loss: 1.0789, test_f1: 0.4671
 epoch: 10, train_loss: 0.9650, test_loss: 1.0760, test_f1: 0.4753
 epoch: 11, train_loss: 0.9500, test_loss: 1.0599, test_f1: 0.5075
 epoch: 12, train_loss: 0.9477, test_loss: 1.0594, test_f1: 0.5229
 epoch: 13, train_loss: 0.9387, test_loss: 1.0845, test_f1: 0.5327
 epoch: 14, train_loss: 0.9295, test_loss: 1.0771, test_f1: 0.5481
 epoch: 15, train_loss: 0.9224, test_loss: 1.0617, test_f1: 0.5476
 epoch: 16, train_loss: 0.9120, test_loss: 1.0304, test_f1: 0.5235
 epoch: 17, train_loss: 0.9001, test_loss: 1.0387, test_f1: 0.5423
 epoch: 18, train_loss: 0.8922, test_loss: 1.0431, test_f1: 0.5530
 epoch: 19, train_loss: 0.8822, test_loss: 1.0327, test_f1: 0.5661
 epoch: 20, train_loss: 0.8717, test_loss: 1.0444, test_f1: 0.5230
 epoch: 21, train_loss: 0.8593, test_loss: 1.0141, test_f1: 0.5392
 epoch: 22, train_loss: 0.8488, test_loss: 1.0464, test_f1: 0.5319
 epoch: 23, train_loss: 0.8272, test_loss: 1.0620, test_f1: 0.5322
 epoch: 24, train_loss: 0.8230, test_loss: 1.0205, test_f1: 0.5308
 epoch: 25, train_loss: 0.8186, test_loss: 1.0247, test_f1: 0.5672
 epoch: 26, train_loss: 0.8004, test_loss: 1.0105, test_f1: 0.5679
 epoch: 27, train_loss: 0.8045, test_loss: 1.0170, test_f1: 0.5593
 epoch: 28, train_loss: 0.7906, test_loss: 0.9888, test_f1: 0.5706
 epoch: 29, train_loss: 0.7642, test_loss: 1.0108, test_f1: 0.5899
 epoch: 30, train_loss: 0.7459, test_loss: 0.9896, test_f1: 0.5796
 epoch: 31, train_loss: 0.7311, test_loss: 1.0262, test_f1: 0.5729
 epoch: 32, train_loss: 0.7171, test_loss: 1.0623, test_f1: 0.5710
 epoch: 33, train_loss: 0.7216, test_loss: 1.0384, test_f1: 0.5877
 epoch: 34, train_loss: 0.7001, test_loss: 1.0212, test_f1: 0.5895
 epoch: 35, train_loss: 0.6840, test_loss: 1.0560, test_f1: 0.5629
 epoch: 36, train_loss: 0.6859, test_loss: 0.9802, test_f1: 0.5794
 epoch: 37, train_loss: 0.6635, test_loss: 0.9780, test_f1: 0.5957
 epoch: 38, train_loss: 0.6720, test_loss: 1.1064, test_f1: 0.6167
 epoch: 39, train_loss: 0.6325, test_loss: 1.0356, test_f1: 0.5970
 epoch: 40, train_loss: 0.6425, test_loss: 1.0320, test_f1: 0.5852
 epoch: 41, train_loss: 0.6367, test_loss: 1.0715, test_f1: 0.5974
 epoch: 42, train_loss: 0.6156, test_loss: 1.0259, test_f1: 0.6016
 epoch: 43, train_loss: 0.5928, test_loss: 1.0370, test_f1: 0.6017
 epoch: 44, train_loss: 0.6001, test_loss: 1.0719, test_f1: 0.6169
 epoch: 45, train_loss: 0.5806, test_loss: 1.0678, test_f1: 0.6177
 epoch: 46, train_loss: 0.5822, test_loss: 1.0613, test_f1: 0.6049
 epoch: 47, train_loss: 0.5676, test_loss: 1.0424, test_f1: 0.6012
 epoch: 48, train_loss: 0.5698, test_loss: 1.0698, test_f1: 0.6117
 epoch: 49, train_loss: 0.5486, test_loss: 1.0858, test_f1: 0.6000
 epoch: 50, train_loss: 0.5288, test_loss: 1.1098, test_f1: 0.6126
 epoch: 51, train_loss: 0.5090, test_loss: 1.1001, test_f1: 0.6162
 epoch: 52, train_loss: 0.5052, test_loss: 1.1027, test_f1: 0.6335
 epoch: 53, train_loss: 0.5127, test_loss: 1.0966, test_f1: 0.6242
 epoch: 54, train_loss: 0.5113, test_loss: 1.1493, test_f1: 0.6368
 epoch: 55, train_loss: 0.4942, test_loss: 1.1463, test_f1: 0.6151
 epoch: 56, train_loss: 0.4996, test_loss: 1.1524, test_f1: 0.6389
 epoch: 57, train_loss: 0.4865, test_loss: 1.1685, test_f1: 0.6356
 epoch: 58, train_loss: 0.4800, test_loss: 1.1674, test_f1: 0.6271
 epoch: 59, train_loss: 0.4773, test_loss: 1.2152, test_f1: 0.6216
 epoch: 60, train_loss: 0.4599, test_loss: 1.1894, test_f1: 0.6113
 epoch: 61, train_loss: 0.4534, test_loss: 1.2375, test_f1: 0.6091
 epoch: 62, train_loss: 0.4656, test_loss: 1.2079, test_f1: 0.6101
 epoch: 63, train_loss: 0.4370, test_loss: 1.2552, test_f1: 0.6211
 epoch: 64, train_loss: 0.4453, test_loss: 1.2521, test_f1: 0.6276
 epoch: 65, train_loss: 0.4469, test_loss: 1.2609, test_f1: 0.6287
 epoch: 66, train_loss: 0.4607, test_loss: 1.2577, test_f1: 0.6269
 epoch: 67, train_loss: 0.4354, test_loss: 1.2181, test_f1: 0.6590
 epoch: 68, train_loss: 0.4334, test_loss: 1.2383, test_f1: 0.5979
 epoch: 69, train_loss: 0.4197, test_loss: 1.2475, test_f1: 0.6107
 epoch: 70, train_loss: 0.4332, test_loss: 1.3098, test_f1: 0.6024
 epoch: 71, train_loss: 0.4287, test_loss: 1.3175, test_f1: 0.6135
 epoch: 72, train_loss: 0.4078, test_loss: 1.3482, test_f1: 0.5936
 epoch: 73, train_loss: 0.4100, test_loss: 1.3272, test_f1: 0.6182
 epoch: 74, train_loss: 0.4053, test_loss: 1.3484, test_f1: 0.5838
 epoch: 75, train_loss: 0.4306, test_loss: 1.3262, test_f1: 0.5935
 epoch: 76, train_loss: 0.4162, test_loss: 1.3305, test_f1: 0.5988
 epoch: 77, train_loss: 0.3738, test_loss: 1.3736, test_f1: 0.5847
 epoch: 78, train_loss: 0.3947, test_loss: 1.3494, test_f1: 0.6022
 epoch: 79, train_loss: 0.3781, test_loss: 1.3782, test_f1: 0.6141
 epoch: 80, train_loss: 0.3863, test_loss: 1.4213, test_f1: 0.5685
 epoch: 81, train_loss: 0.3779, test_loss: 1.4383, test_f1: 0.5855
 epoch: 82, train_loss: 0.3885, test_loss: 1.4951, test_f1: 0.6193
 epoch: 83, train_loss: 0.3731, test_loss: 1.4632, test_f1: 0.5863
 epoch: 84, train_loss: 0.3660, test_loss: 1.4557, test_f1: 0.6231
 epoch: 85, train_loss: 0.3647, test_loss: 1.4832, test_f1: 0.5630
 epoch: 86, train_loss: 0.3635, test_loss: 1.4738, test_f1: 0.5836
 epoch: 87, train_loss: 0.3625, test_loss: 1.4819, test_f1: 0.5731
 epoch: 88, train_loss: 0.3505, test_loss: 1.4761, test_f1: 0.5893
 epoch: 89, train_loss: 0.3418, test_loss: 1.5101, test_f1: 0.5848
 epoch: 90, train_loss: 0.3484, test_loss: 1.5243, test_f1: 0.5752
 epoch: 91, train_loss: 0.3476, test_loss: 1.5180, test_f1: 0.5918
 epoch: 92, train_loss: 0.3461, test_loss: 1.5493, test_f1: 0.6121
 epoch: 93, train_loss: 0.3311, test_loss: 1.5251, test_f1: 0.6105
 epoch: 94, train_loss: 0.3233, test_loss: 1.6421, test_f1: 0.6109
 epoch: 95, train_loss: 0.3070, test_loss: 1.6167, test_f1: 0.5727
 epoch: 96, train_loss: 0.3209, test_loss: 1.5987, test_f1: 0.5773
 epoch: 97, train_loss: 0.3085, test_loss: 1.6158, test_f1: 0.5896
 epoch: 98, train_loss: 0.3222, test_loss: 1.5898, test_f1: 0.5976
 epoch: 99, train_loss: 0.3273, test_loss: 1.6976, test_f1: 0.5789
##################ITERATION #1 ****************************************
 epoch: 0, train_loss: 1.2395, test_loss: 1.2765, test_f1: 0.3327
 epoch: 1, train_loss: 1.1042, test_loss: 1.1511, test_f1: 0.4415
 epoch: 2, train_loss: 1.0509, test_loss: 1.0984, test_f1: 0.4806
 epoch: 3, train_loss: 1.0077, test_loss: 1.0775, test_f1: 0.5072
 epoch: 4, train_loss: 0.9854, test_loss: 1.0540, test_f1: 0.5022
 epoch: 5, train_loss: 0.9677, test_loss: 1.0446, test_f1: 0.5293
 epoch: 6, train_loss: 0.9421, test_loss: 1.0336, test_f1: 0.5323
 epoch: 7, train_loss: 0.9280, test_loss: 1.0419, test_f1: 0.5181
 epoch: 8, train_loss: 0.9071, test_loss: 1.0228, test_f1: 0.5243
 epoch: 9, train_loss: 0.8917, test_loss: 1.0327, test_f1: 0.5112
 epoch: 10, train_loss: 0.8834, test_loss: 1.0192, test_f1: 0.5278
 epoch: 11, train_loss: 0.8753, test_loss: 1.0122, test_f1: 0.5294
 epoch: 12, train_loss: 0.8593, test_loss: 1.0140, test_f1: 0.5845
 epoch: 13, train_loss: 0.8398, test_loss: 1.0165, test_f1: 0.5665
 epoch: 14, train_loss: 0.8318, test_loss: 1.0212, test_f1: 0.5340
 epoch: 15, train_loss: 0.8189, test_loss: 1.0031, test_f1: 0.5688
 epoch: 16, train_loss: 0.7957, test_loss: 1.0035, test_f1: 0.5829
 epoch: 17, train_loss: 0.7875, test_loss: 1.0120, test_f1: 0.5797
 epoch: 18, train_loss: 0.7733, test_loss: 1.0229, test_f1: 0.5747
 epoch: 19, train_loss: 0.7646, test_loss: 1.0087, test_f1: 0.5596
 epoch: 20, train_loss: 0.7490, test_loss: 0.9984, test_f1: 0.5828
 epoch: 21, train_loss: 0.7347, test_loss: 1.0150, test_f1: 0.5946
 epoch: 22, train_loss: 0.7193, test_loss: 1.0249, test_f1: 0.5895
 epoch: 23, train_loss: 0.6930, test_loss: 1.0462, test_f1: 0.5883
 epoch: 24, train_loss: 0.7013, test_loss: 1.0370, test_f1: 0.5873
 epoch: 25, train_loss: 0.6733, test_loss: 1.0363, test_f1: 0.5966
 epoch: 26, train_loss: 0.6551, test_loss: 1.0790, test_f1: 0.6157
 epoch: 27, train_loss: 0.6665, test_loss: 1.0231, test_f1: 0.6133
 epoch: 28, train_loss: 0.6479, test_loss: 1.0474, test_f1: 0.6154
 epoch: 29, train_loss: 0.6292, test_loss: 1.0979, test_f1: 0.5914
 epoch: 30, train_loss: 0.6366, test_loss: 1.0498, test_f1: 0.6086
 epoch: 31, train_loss: 0.6079, test_loss: 1.0829, test_f1: 0.6336
 epoch: 32, train_loss: 0.6004, test_loss: 1.0760, test_f1: 0.6116
 epoch: 33, train_loss: 0.5953, test_loss: 1.0836, test_f1: 0.6032
 epoch: 34, train_loss: 0.5743, test_loss: 1.1576, test_f1: 0.5997
 epoch: 35, train_loss: 0.5727, test_loss: 1.0799, test_f1: 0.6189
 epoch: 36, train_loss: 0.5770, test_loss: 1.0880, test_f1: 0.6366
 epoch: 37, train_loss: 0.5626, test_loss: 1.0642, test_f1: 0.6469
 epoch: 38, train_loss: 0.5397, test_loss: 1.1735, test_f1: 0.6151
 epoch: 39, train_loss: 0.5376, test_loss: 1.0520, test_f1: 0.6658
 epoch: 40, train_loss: 0.5384, test_loss: 1.0919, test_f1: 0.6675
 epoch: 41, train_loss: 0.5339, test_loss: 1.1915, test_f1: 0.6101
 epoch: 42, train_loss: 0.5065, test_loss: 1.2433, test_f1: 0.6383
 epoch: 43, train_loss: 0.5166, test_loss: 1.1058, test_f1: 0.6564
 epoch: 44, train_loss: 0.4805, test_loss: 1.2623, test_f1: 0.6452
 epoch: 45, train_loss: 0.4925, test_loss: 1.2604, test_f1: 0.6463
 epoch: 46, train_loss: 0.4766, test_loss: 1.2819, test_f1: 0.6235
 epoch: 47, train_loss: 0.4758, test_loss: 1.2046, test_f1: 0.6619
 epoch: 48, train_loss: 0.4482, test_loss: 1.3020, test_f1: 0.6362
 epoch: 49, train_loss: 0.4672, test_loss: 1.2850, test_f1: 0.6424
 epoch: 50, train_loss: 0.4548, test_loss: 1.2979, test_f1: 0.6249
 epoch: 51, train_loss: 0.4282, test_loss: 1.3137, test_f1: 0.6353
 epoch: 52, train_loss: 0.4187, test_loss: 1.3020, test_f1: 0.6502
 epoch: 53, train_loss: 0.4019, test_loss: 1.3230, test_f1: 0.6409
 epoch: 54, train_loss: 0.3982, test_loss: 1.3411, test_f1: 0.6442
 epoch: 55, train_loss: 0.3968, test_loss: 1.4123, test_f1: 0.6321
 epoch: 56, train_loss: 0.3932, test_loss: 1.3558, test_f1: 0.6520
 epoch: 57, train_loss: 0.3975, test_loss: 1.3558, test_f1: 0.6472
 epoch: 58, train_loss: 0.3903, test_loss: 1.4380, test_f1: 0.6252
 epoch: 59, train_loss: 0.3777, test_loss: 1.4214, test_f1: 0.6238
 epoch: 60, train_loss: 0.3768, test_loss: 1.3716, test_f1: 0.6405
 epoch: 61, train_loss: 0.3702, test_loss: 1.4726, test_f1: 0.6414
 epoch: 62, train_loss: 0.3666, test_loss: 1.4835, test_f1: 0.6393
 epoch: 63, train_loss: 0.3648, test_loss: 1.4715, test_f1: 0.6224
 epoch: 64, train_loss: 0.3446, test_loss: 1.4893, test_f1: 0.6305
 epoch: 65, train_loss: 0.3502, test_loss: 1.5590, test_f1: 0.6321
 epoch: 66, train_loss: 0.3372, test_loss: 1.5525, test_f1: 0.6126
 epoch: 67, train_loss: 0.3395, test_loss: 1.5590, test_f1: 0.5995
 epoch: 68, train_loss: 0.3347, test_loss: 1.5987, test_f1: 0.6193
 epoch: 69, train_loss: 0.3296, test_loss: 1.5431, test_f1: 0.6304
 epoch: 70, train_loss: 0.3206, test_loss: 1.5615, test_f1: 0.6263
 epoch: 71, train_loss: 0.3326, test_loss: 1.5984, test_f1: 0.6119
 epoch: 72, train_loss: 0.3252, test_loss: 1.5411, test_f1: 0.6290
 epoch: 73, train_loss: 0.3107, test_loss: 1.5971, test_f1: 0.6180
 epoch: 74, train_loss: 0.3094, test_loss: 1.5805, test_f1: 0.6144
 epoch: 75, train_loss: 0.3055, test_loss: 1.6165, test_f1: 0.6067
 epoch: 76, train_loss: 0.3199, test_loss: 1.6146, test_f1: 0.6268
 epoch: 77, train_loss: 0.3141, test_loss: 1.6589, test_f1: 0.6256
 epoch: 78, train_loss: 0.3111, test_loss: 1.6055, test_f1: 0.6568
 epoch: 79, train_loss: 0.2871, test_loss: 1.6760, test_f1: 0.6173
 epoch: 80, train_loss: 0.3045, test_loss: 1.6991, test_f1: 0.6134
 epoch: 81, train_loss: 0.3033, test_loss: 1.6250, test_f1: 0.6053
 epoch: 82, train_loss: 0.2810, test_loss: 1.6828, test_f1: 0.6206
 epoch: 83, train_loss: 0.2678, test_loss: 1.7171, test_f1: 0.6252
 epoch: 84, train_loss: 0.2950, test_loss: 1.6920, test_f1: 0.6143
 epoch: 85, train_loss: 0.2781, test_loss: 1.7073, test_f1: 0.6357
 epoch: 86, train_loss: 0.2885, test_loss: 1.7458, test_f1: 0.6207
 epoch: 87, train_loss: 0.2903, test_loss: 1.7819, test_f1: 0.6129
 epoch: 88, train_loss: 0.2608, test_loss: 1.8093, test_f1: 0.6253
 epoch: 89, train_loss: 0.2561, test_loss: 1.7704, test_f1: 0.6218
 epoch: 90, train_loss: 0.2580, test_loss: 1.7598, test_f1: 0.6222
 epoch: 91, train_loss: 0.2517, test_loss: 1.9189, test_f1: 0.6102
 epoch: 92, train_loss: 0.2633, test_loss: 1.8402, test_f1: 0.5994
 epoch: 93, train_loss: 0.2590, test_loss: 1.9042, test_f1: 0.6184
 epoch: 94, train_loss: 0.2499, test_loss: 1.9062, test_f1: 0.5955
 epoch: 95, train_loss: 0.2426, test_loss: 1.8603, test_f1: 0.6296
 epoch: 96, train_loss: 0.2394, test_loss: 1.8972, test_f1: 0.6086
 epoch: 97, train_loss: 0.2467, test_loss: 1.9008, test_f1: 0.6228
 epoch: 98, train_loss: 0.2268, test_loss: 1.9864, test_f1: 0.5988
 epoch: 99, train_loss: 0.2407, test_loss: 1.9409, test_f1: 0.6190
##################ITERATION #2 ****************************************
 epoch: 0, train_loss: 1.1714, test_loss: 1.2096, test_f1: 0.4392
 epoch: 1, train_loss: 1.0404, test_loss: 1.0838, test_f1: 0.4647
 epoch: 2, train_loss: 0.9989, test_loss: 1.0650, test_f1: 0.5073
 epoch: 3, train_loss: 0.9712, test_loss: 1.0511, test_f1: 0.5218
 epoch: 4, train_loss: 0.9482, test_loss: 1.0282, test_f1: 0.5088
 epoch: 5, train_loss: 0.9309, test_loss: 1.0286, test_f1: 0.5204
 epoch: 6, train_loss: 0.9092, test_loss: 1.0190, test_f1: 0.5498
 epoch: 7, train_loss: 0.8968, test_loss: 1.0092, test_f1: 0.5240
 epoch: 8, train_loss: 0.8675, test_loss: 1.0137, test_f1: 0.5473
 epoch: 9, train_loss: 0.8628, test_loss: 1.0026, test_f1: 0.5409
 epoch: 10, train_loss: 0.8471, test_loss: 1.0129, test_f1: 0.5430
 epoch: 11, train_loss: 0.8464, test_loss: 0.9960, test_f1: 0.5565
 epoch: 12, train_loss: 0.8176, test_loss: 0.9908, test_f1: 0.5945
 epoch: 13, train_loss: 0.8010, test_loss: 0.9957, test_f1: 0.5743
 epoch: 14, train_loss: 0.7893, test_loss: 1.0062, test_f1: 0.5906
 epoch: 15, train_loss: 0.7774, test_loss: 0.9844, test_f1: 0.6003
 epoch: 16, train_loss: 0.7595, test_loss: 0.9981, test_f1: 0.5641
 epoch: 17, train_loss: 0.7409, test_loss: 1.0226, test_f1: 0.6077
 epoch: 18, train_loss: 0.7352, test_loss: 1.0090, test_f1: 0.6088
 epoch: 19, train_loss: 0.7077, test_loss: 1.0080, test_f1: 0.6227
 epoch: 20, train_loss: 0.7020, test_loss: 1.0114, test_f1: 0.5893
 epoch: 21, train_loss: 0.6906, test_loss: 1.0501, test_f1: 0.5862
 epoch: 22, train_loss: 0.6677, test_loss: 1.0395, test_f1: 0.5770
 epoch: 23, train_loss: 0.6650, test_loss: 1.0650, test_f1: 0.6111
 epoch: 24, train_loss: 0.6456, test_loss: 1.0645, test_f1: 0.6140
 epoch: 25, train_loss: 0.6498, test_loss: 1.0566, test_f1: 0.6166
 epoch: 26, train_loss: 0.6325, test_loss: 1.0598, test_f1: 0.6118
 epoch: 27, train_loss: 0.6161, test_loss: 1.0714, test_f1: 0.6051
 epoch: 28, train_loss: 0.6034, test_loss: 1.0812, test_f1: 0.6166
 epoch: 29, train_loss: 0.5830, test_loss: 1.1069, test_f1: 0.6098
 epoch: 30, train_loss: 0.5853, test_loss: 1.0850, test_f1: 0.6098
 epoch: 31, train_loss: 0.5805, test_loss: 1.1231, test_f1: 0.6053
 epoch: 32, train_loss: 0.5698, test_loss: 1.1537, test_f1: 0.5861
 epoch: 33, train_loss: 0.5620, test_loss: 1.0918, test_f1: 0.6405
 epoch: 34, train_loss: 0.5457, test_loss: 1.1345, test_f1: 0.6118
 epoch: 35, train_loss: 0.5246, test_loss: 1.1550, test_f1: 0.6050
 epoch: 36, train_loss: 0.5282, test_loss: 1.1548, test_f1: 0.6467
 epoch: 37, train_loss: 0.5095, test_loss: 1.2046, test_f1: 0.6281
 epoch: 38, train_loss: 0.4980, test_loss: 1.1343, test_f1: 0.6349
 epoch: 39, train_loss: 0.4963, test_loss: 1.2550, test_f1: 0.6231
 epoch: 40, train_loss: 0.4960, test_loss: 1.1727, test_f1: 0.6437
 epoch: 41, train_loss: 0.4800, test_loss: 1.2633, test_f1: 0.6152
 epoch: 42, train_loss: 0.5001, test_loss: 1.2353, test_f1: 0.6487
 epoch: 43, train_loss: 0.4590, test_loss: 1.2635, test_f1: 0.6218
 epoch: 44, train_loss: 0.4596, test_loss: 1.3099, test_f1: 0.6235
 epoch: 45, train_loss: 0.4329, test_loss: 1.2607, test_f1: 0.6294
 epoch: 46, train_loss: 0.4400, test_loss: 1.2711, test_f1: 0.6395
 epoch: 47, train_loss: 0.4371, test_loss: 1.2794, test_f1: 0.6497
 epoch: 48, train_loss: 0.4216, test_loss: 1.2498, test_f1: 0.6435
 epoch: 49, train_loss: 0.4108, test_loss: 1.3103, test_f1: 0.6517
 epoch: 50, train_loss: 0.4054, test_loss: 1.3376, test_f1: 0.6309
 epoch: 51, train_loss: 0.3928, test_loss: 1.3469, test_f1: 0.6524
 epoch: 52, train_loss: 0.3549, test_loss: 1.3611, test_f1: 0.6514
 epoch: 53, train_loss: 0.3470, test_loss: 1.3887, test_f1: 0.6357
 epoch: 54, train_loss: 0.3694, test_loss: 1.3722, test_f1: 0.6402
 epoch: 55, train_loss: 0.3479, test_loss: 1.4620, test_f1: 0.6616
 epoch: 56, train_loss: 0.3421, test_loss: 1.4214, test_f1: 0.6406
 epoch: 57, train_loss: 0.3648, test_loss: 1.4081, test_f1: 0.6337
 epoch: 58, train_loss: 0.3452, test_loss: 1.4390, test_f1: 0.6263
 epoch: 59, train_loss: 0.3299, test_loss: 1.4243, test_f1: 0.6459
 epoch: 60, train_loss: 0.3382, test_loss: 1.4598, test_f1: 0.6406
 epoch: 61, train_loss: 0.3301, test_loss: 1.4556, test_f1: 0.6359
 epoch: 62, train_loss: 0.3339, test_loss: 1.4472, test_f1: 0.6539
 epoch: 63, train_loss: 0.3391, test_loss: 1.4955, test_f1: 0.6218
 epoch: 64, train_loss: 0.3161, test_loss: 1.4784, test_f1: 0.6362
 epoch: 65, train_loss: 0.3195, test_loss: 1.4763, test_f1: 0.6244
 epoch: 66, train_loss: 0.3146, test_loss: 1.5281, test_f1: 0.6330
 epoch: 67, train_loss: 0.3156, test_loss: 1.4901, test_f1: 0.6333
 epoch: 68, train_loss: 0.3049, test_loss: 1.5541, test_f1: 0.6404
 epoch: 69, train_loss: 0.2997, test_loss: 1.5261, test_f1: 0.6210
 epoch: 70, train_loss: 0.2907, test_loss: 1.5714, test_f1: 0.6353
 epoch: 71, train_loss: 0.2884, test_loss: 1.5753, test_f1: 0.6374
 epoch: 72, train_loss: 0.2818, test_loss: 1.5822, test_f1: 0.6338
 epoch: 73, train_loss: 0.2924, test_loss: 1.6520, test_f1: 0.6134
 epoch: 74, train_loss: 0.2773, test_loss: 1.6197, test_f1: 0.6315
 epoch: 75, train_loss: 0.2766, test_loss: 1.6664, test_f1: 0.6153
 epoch: 76, train_loss: 0.2846, test_loss: 1.6462, test_f1: 0.6215
 epoch: 77, train_loss: 0.2569, test_loss: 1.6065, test_f1: 0.6391
 epoch: 78, train_loss: 0.2590, test_loss: 1.6747, test_f1: 0.6311
 epoch: 79, train_loss: 0.2771, test_loss: 1.6997, test_f1: 0.6258
 epoch: 80, train_loss: 0.2613, test_loss: 1.6834, test_f1: 0.6099
 epoch: 81, train_loss: 0.2692, test_loss: 1.7382, test_f1: 0.6220
 epoch: 82, train_loss: 0.2630, test_loss: 1.7448, test_f1: 0.6278
 epoch: 83, train_loss: 0.2450, test_loss: 1.7516, test_f1: 0.6155
 epoch: 84, train_loss: 0.2519, test_loss: 1.7882, test_f1: 0.6088
 epoch: 85, train_loss: 0.2441, test_loss: 1.7396, test_f1: 0.6260
 epoch: 86, train_loss: 0.2350, test_loss: 1.8578, test_f1: 0.6169
 epoch: 87, train_loss: 0.2477, test_loss: 1.8145, test_f1: 0.6101
 epoch: 88, train_loss: 0.2378, test_loss: 1.7852, test_f1: 0.6315
 epoch: 89, train_loss: 0.2415, test_loss: 1.8145, test_f1: 0.6501
 epoch: 90, train_loss: 0.2344, test_loss: 1.9008, test_f1: 0.6399
 epoch: 91, train_loss: 0.2444, test_loss: 1.8421, test_f1: 0.6092
 epoch: 92, train_loss: 0.2247, test_loss: 1.9509, test_f1: 0.6123
 epoch: 93, train_loss: 0.2416, test_loss: 1.9245, test_f1: 0.5969
 epoch: 94, train_loss: 0.2194, test_loss: 1.9726, test_f1: 0.6130
 epoch: 95, train_loss: 0.2193, test_loss: 1.9657, test_f1: 0.6263
 epoch: 96, train_loss: 0.2305, test_loss: 1.9500, test_f1: 0.6187
 epoch: 97, train_loss: 0.2214, test_loss: 1.9184, test_f1: 0.6175
 epoch: 98, train_loss: 0.2053, test_loss: 2.0093, test_f1: 0.6073
 epoch: 99, train_loss: 0.2028, test_loss: 2.0051, test_f1: 0.6115
##################ITERATION #3 ****************************************
 epoch: 0, train_loss: 1.1561, test_loss: 1.2323, test_f1: 0.3232
 epoch: 1, train_loss: 1.0264, test_loss: 1.0641, test_f1: 0.5072
 epoch: 2, train_loss: 0.9928, test_loss: 1.0525, test_f1: 0.5374
 epoch: 3, train_loss: 0.9805, test_loss: 1.0288, test_f1: 0.5382
 epoch: 4, train_loss: 0.9581, test_loss: 1.0226, test_f1: 0.5272
 epoch: 5, train_loss: 0.9207, test_loss: 1.0173, test_f1: 0.5500
 epoch: 6, train_loss: 0.9176, test_loss: 1.0078, test_f1: 0.5475
 epoch: 7, train_loss: 0.9023, test_loss: 0.9895, test_f1: 0.5513
 epoch: 8, train_loss: 0.8821, test_loss: 0.9970, test_f1: 0.5522
 epoch: 9, train_loss: 0.8877, test_loss: 0.9770, test_f1: 0.5753
 epoch: 10, train_loss: 0.8640, test_loss: 0.9801, test_f1: 0.5829
 epoch: 11, train_loss: 0.8527, test_loss: 0.9751, test_f1: 0.5889
 epoch: 12, train_loss: 0.8317, test_loss: 0.9884, test_f1: 0.5809
 epoch: 13, train_loss: 0.8203, test_loss: 0.9832, test_f1: 0.5696
 epoch: 14, train_loss: 0.8083, test_loss: 0.9947, test_f1: 0.5802
 epoch: 15, train_loss: 0.8023, test_loss: 0.9678, test_f1: 0.5869
 epoch: 16, train_loss: 0.7831, test_loss: 1.0008, test_f1: 0.5858
 epoch: 17, train_loss: 0.7614, test_loss: 0.9879, test_f1: 0.5965
 epoch: 18, train_loss: 0.7600, test_loss: 1.0073, test_f1: 0.5994
 epoch: 19, train_loss: 0.7415, test_loss: 1.0133, test_f1: 0.6016
 epoch: 20, train_loss: 0.7297, test_loss: 1.0130, test_f1: 0.6160
 epoch: 21, train_loss: 0.7136, test_loss: 1.0247, test_f1: 0.5969
 epoch: 22, train_loss: 0.6900, test_loss: 1.0086, test_f1: 0.5965
 epoch: 23, train_loss: 0.6926, test_loss: 1.0222, test_f1: 0.6083
 epoch: 24, train_loss: 0.6899, test_loss: 1.0266, test_f1: 0.6204
 epoch: 25, train_loss: 0.6773, test_loss: 1.0400, test_f1: 0.6213
 epoch: 26, train_loss: 0.6555, test_loss: 1.0705, test_f1: 0.6266
 epoch: 27, train_loss: 0.6641, test_loss: 1.0609, test_f1: 0.6388
 epoch: 28, train_loss: 0.6123, test_loss: 1.0804, test_f1: 0.6168
 epoch: 29, train_loss: 0.6293, test_loss: 1.1187, test_f1: 0.6060
 epoch: 30, train_loss: 0.6190, test_loss: 1.1011, test_f1: 0.6257
 epoch: 31, train_loss: 0.5940, test_loss: 1.1017, test_f1: 0.6287
 epoch: 32, train_loss: 0.5770, test_loss: 1.1261, test_f1: 0.6513
 epoch: 33, train_loss: 0.5704, test_loss: 1.1619, test_f1: 0.6180
 epoch: 34, train_loss: 0.5712, test_loss: 1.1518, test_f1: 0.6013
 epoch: 35, train_loss: 0.5502, test_loss: 1.1851, test_f1: 0.6332
 epoch: 36, train_loss: 0.5562, test_loss: 1.1793, test_f1: 0.6299
 epoch: 37, train_loss: 0.5429, test_loss: 1.1789, test_f1: 0.6086
 epoch: 38, train_loss: 0.5559, test_loss: 1.2564, test_f1: 0.6124
 epoch: 39, train_loss: 0.5199, test_loss: 1.1979, test_f1: 0.6158
 epoch: 40, train_loss: 0.5065, test_loss: 1.2295, test_f1: 0.6487
 epoch: 41, train_loss: 0.4972, test_loss: 1.2582, test_f1: 0.5955
 epoch: 42, train_loss: 0.4964, test_loss: 1.2544, test_f1: 0.6132
 epoch: 43, train_loss: 0.4979, test_loss: 1.2406, test_f1: 0.6113
 epoch: 44, train_loss: 0.4841, test_loss: 1.2787, test_f1: 0.6322
 epoch: 45, train_loss: 0.4728, test_loss: 1.2879, test_f1: 0.6204
 epoch: 46, train_loss: 0.4637, test_loss: 1.2904, test_f1: 0.6171
 epoch: 47, train_loss: 0.4490, test_loss: 1.3328, test_f1: 0.6232
 epoch: 48, train_loss: 0.4636, test_loss: 1.3346, test_f1: 0.6350
 epoch: 49, train_loss: 0.4556, test_loss: 1.3542, test_f1: 0.6126
 epoch: 50, train_loss: 0.4199, test_loss: 1.3769, test_f1: 0.6109
 epoch: 51, train_loss: 0.4082, test_loss: 1.3751, test_f1: 0.6098
 epoch: 52, train_loss: 0.4126, test_loss: 1.4067, test_f1: 0.6280
 epoch: 53, train_loss: 0.3960, test_loss: 1.4243, test_f1: 0.6171
 epoch: 54, train_loss: 0.3708, test_loss: 1.4389, test_f1: 0.6390
 epoch: 55, train_loss: 0.3703, test_loss: 1.4313, test_f1: 0.6202
 epoch: 56, train_loss: 0.3808, test_loss: 1.4452, test_f1: 0.6209
 epoch: 57, train_loss: 0.3550, test_loss: 1.4556, test_f1: 0.6162
 epoch: 58, train_loss: 0.3687, test_loss: 1.4835, test_f1: 0.6200
 epoch: 59, train_loss: 0.3638, test_loss: 1.4647, test_f1: 0.6221
 epoch: 60, train_loss: 0.3551, test_loss: 1.5175, test_f1: 0.6203
 epoch: 61, train_loss: 0.3511, test_loss: 1.4707, test_f1: 0.6129
 epoch: 62, train_loss: 0.3530, test_loss: 1.4808, test_f1: 0.6276
 epoch: 63, train_loss: 0.3566, test_loss: 1.4575, test_f1: 0.6090
 epoch: 64, train_loss: 0.3437, test_loss: 1.5125, test_f1: 0.6160
 epoch: 65, train_loss: 0.3320, test_loss: 1.5087, test_f1: 0.6325
 epoch: 66, train_loss: 0.3335, test_loss: 1.5136, test_f1: 0.6398
 epoch: 67, train_loss: 0.3280, test_loss: 1.5671, test_f1: 0.6232
 epoch: 68, train_loss: 0.3182, test_loss: 1.5725, test_f1: 0.6148
 epoch: 69, train_loss: 0.3176, test_loss: 1.5802, test_f1: 0.6248
 epoch: 70, train_loss: 0.2972, test_loss: 1.6399, test_f1: 0.6240
 epoch: 71, train_loss: 0.3009, test_loss: 1.6451, test_f1: 0.6135
 epoch: 72, train_loss: 0.2924, test_loss: 1.6715, test_f1: 0.6282
 epoch: 73, train_loss: 0.3070, test_loss: 1.6682, test_f1: 0.6219
 epoch: 74, train_loss: 0.3015, test_loss: 1.7019, test_f1: 0.6019
 epoch: 75, train_loss: 0.2968, test_loss: 1.6698, test_f1: 0.6209
 epoch: 76, train_loss: 0.3160, test_loss: 1.7048, test_f1: 0.6112
 epoch: 77, train_loss: 0.3150, test_loss: 1.6960, test_f1: 0.6183
 epoch: 78, train_loss: 0.3027, test_loss: 1.7089, test_f1: 0.6196
 epoch: 79, train_loss: 0.2989, test_loss: 1.7371, test_f1: 0.6187
 epoch: 80, train_loss: 0.2952, test_loss: 1.7252, test_f1: 0.6096
 epoch: 81, train_loss: 0.2661, test_loss: 1.7618, test_f1: 0.6054
 epoch: 82, train_loss: 0.2706, test_loss: 1.7439, test_f1: 0.6251
 epoch: 83, train_loss: 0.2832, test_loss: 1.7818, test_f1: 0.6226
 epoch: 84, train_loss: 0.2825, test_loss: 1.8088, test_f1: 0.5999
 epoch: 85, train_loss: 0.2637, test_loss: 1.8278, test_f1: 0.6098
 epoch: 86, train_loss: 0.2901, test_loss: 1.7467, test_f1: 0.6205
 epoch: 87, train_loss: 0.2620, test_loss: 1.8143, test_f1: 0.6231
 epoch: 88, train_loss: 0.2701, test_loss: 1.8266, test_f1: 0.6291
 epoch: 89, train_loss: 0.2690, test_loss: 1.8476, test_f1: 0.6266
 epoch: 90, train_loss: 0.2879, test_loss: 1.9011, test_f1: 0.6270
 epoch: 91, train_loss: 0.2449, test_loss: 1.8513, test_f1: 0.6336
 epoch: 92, train_loss: 0.2506, test_loss: 1.9274, test_f1: 0.5940
 epoch: 93, train_loss: 0.2391, test_loss: 1.8377, test_f1: 0.6250
 epoch: 94, train_loss: 0.2268, test_loss: 1.8393, test_f1: 0.6300
 epoch: 95, train_loss: 0.2481, test_loss: 1.9124, test_f1: 0.6217
 epoch: 96, train_loss: 0.2440, test_loss: 1.8951, test_f1: 0.6191
 epoch: 97, train_loss: 0.2341, test_loss: 1.9034, test_f1: 0.6280
 epoch: 98, train_loss: 0.2475, test_loss: 1.9540, test_f1: 0.6250
 epoch: 99, train_loss: 0.2324, test_loss: 1.9170, test_f1: 0.6213
##################ITERATION #4 ****************************************
 epoch: 0, train_loss: 1.1475, test_loss: 1.2746, test_f1: 0.3422
 epoch: 1, train_loss: 1.0129, test_loss: 1.0558, test_f1: 0.5097
 epoch: 2, train_loss: 0.9685, test_loss: 1.0405, test_f1: 0.5481
 epoch: 3, train_loss: 0.9433, test_loss: 1.0258, test_f1: 0.5305
 epoch: 4, train_loss: 0.9276, test_loss: 1.0129, test_f1: 0.5632
 epoch: 5, train_loss: 0.9098, test_loss: 1.0195, test_f1: 0.5315
 epoch: 6, train_loss: 0.8867, test_loss: 0.9986, test_f1: 0.5474
 epoch: 7, train_loss: 0.8891, test_loss: 1.0112, test_f1: 0.5633
 epoch: 8, train_loss: 0.8712, test_loss: 1.0040, test_f1: 0.5555
 epoch: 9, train_loss: 0.8483, test_loss: 1.0043, test_f1: 0.5769
 epoch: 10, train_loss: 0.8326, test_loss: 1.0079, test_f1: 0.5613
 epoch: 11, train_loss: 0.8208, test_loss: 0.9940, test_f1: 0.5796
 epoch: 12, train_loss: 0.8044, test_loss: 0.9986, test_f1: 0.6059
 epoch: 13, train_loss: 0.7834, test_loss: 1.0924, test_f1: 0.5718
 epoch: 14, train_loss: 0.7587, test_loss: 1.0144, test_f1: 0.5797
 epoch: 15, train_loss: 0.7595, test_loss: 1.0454, test_f1: 0.5562
 epoch: 16, train_loss: 0.7568, test_loss: 1.0671, test_f1: 0.5929
 epoch: 17, train_loss: 0.7510, test_loss: 1.0259, test_f1: 0.5798
 epoch: 18, train_loss: 0.7337, test_loss: 1.0590, test_f1: 0.6011
 epoch: 19, train_loss: 0.7226, test_loss: 1.0554, test_f1: 0.6025
 epoch: 20, train_loss: 0.6963, test_loss: 1.0527, test_f1: 0.5979
 epoch: 21, train_loss: 0.6895, test_loss: 1.0730, test_f1: 0.6054
 epoch: 22, train_loss: 0.6798, test_loss: 1.0924, test_f1: 0.5733
 epoch: 23, train_loss: 0.6749, test_loss: 1.0996, test_f1: 0.6045
 epoch: 24, train_loss: 0.6716, test_loss: 1.0898, test_f1: 0.6293
 epoch: 25, train_loss: 0.6357, test_loss: 1.1192, test_f1: 0.5969
 epoch: 26, train_loss: 0.6357, test_loss: 1.1550, test_f1: 0.5942
 epoch: 27, train_loss: 0.6382, test_loss: 1.0794, test_f1: 0.6233
 epoch: 28, train_loss: 0.6131, test_loss: 1.1012, test_f1: 0.6164
 epoch: 29, train_loss: 0.6063, test_loss: 1.1176, test_f1: 0.6252
 epoch: 30, train_loss: 0.6038, test_loss: 1.1511, test_f1: 0.6188
 epoch: 31, train_loss: 0.5950, test_loss: 1.1070, test_f1: 0.6527
 epoch: 32, train_loss: 0.5832, test_loss: 1.1432, test_f1: 0.6212
 epoch: 33, train_loss: 0.5728, test_loss: 1.1559, test_f1: 0.6143
 epoch: 34, train_loss: 0.5567, test_loss: 1.1598, test_f1: 0.6361
 epoch: 35, train_loss: 0.5518, test_loss: 1.2121, test_f1: 0.5941
 epoch: 36, train_loss: 0.5496, test_loss: 1.2280, test_f1: 0.6207
 epoch: 37, train_loss: 0.5352, test_loss: 1.2339, test_f1: 0.6290
 epoch: 38, train_loss: 0.5309, test_loss: 1.2201, test_f1: 0.6333
 epoch: 39, train_loss: 0.5286, test_loss: 1.2625, test_f1: 0.6328
 epoch: 40, train_loss: 0.5115, test_loss: 1.2959, test_f1: 0.6186
 epoch: 41, train_loss: 0.5194, test_loss: 1.3216, test_f1: 0.6431
 epoch: 42, train_loss: 0.5101, test_loss: 1.2473, test_f1: 0.6363
 epoch: 43, train_loss: 0.5032, test_loss: 1.2885, test_f1: 0.6530
 epoch: 44, train_loss: 0.4907, test_loss: 1.2839, test_f1: 0.6376
 epoch: 45, train_loss: 0.4591, test_loss: 1.3222, test_f1: 0.6518
 epoch: 46, train_loss: 0.4658, test_loss: 1.3044, test_f1: 0.6402
 epoch: 47, train_loss: 0.4507, test_loss: 1.3601, test_f1: 0.6373
 epoch: 48, train_loss: 0.4607, test_loss: 1.3530, test_f1: 0.6591
 epoch: 49, train_loss: 0.4522, test_loss: 1.3794, test_f1: 0.6344
 epoch: 50, train_loss: 0.4377, test_loss: 1.3817, test_f1: 0.6246
 epoch: 51, train_loss: 0.4186, test_loss: 1.3779, test_f1: 0.6433
 epoch: 52, train_loss: 0.3923, test_loss: 1.4163, test_f1: 0.6513
 epoch: 53, train_loss: 0.3825, test_loss: 1.3999, test_f1: 0.6507
 epoch: 54, train_loss: 0.3917, test_loss: 1.4318, test_f1: 0.6391
 epoch: 55, train_loss: 0.3978, test_loss: 1.4523, test_f1: 0.6571
 epoch: 56, train_loss: 0.3792, test_loss: 1.4977, test_f1: 0.6265
 epoch: 57, train_loss: 0.3718, test_loss: 1.4786, test_f1: 0.6363
 epoch: 58, train_loss: 0.3802, test_loss: 1.4551, test_f1: 0.6464
 epoch: 59, train_loss: 0.3632, test_loss: 1.4514, test_f1: 0.6621
 epoch: 60, train_loss: 0.3542, test_loss: 1.5011, test_f1: 0.6533
 epoch: 61, train_loss: 0.3699, test_loss: 1.5089, test_f1: 0.6577
 epoch: 62, train_loss: 0.3721, test_loss: 1.5638, test_f1: 0.6502
 epoch: 63, train_loss: 0.3659, test_loss: 1.5024, test_f1: 0.6405
 epoch: 64, train_loss: 0.3464, test_loss: 1.5609, test_f1: 0.6513
 epoch: 65, train_loss: 0.3485, test_loss: 1.6115, test_f1: 0.6374
 epoch: 66, train_loss: 0.3483, test_loss: 1.6259, test_f1: 0.6291
 epoch: 67, train_loss: 0.3516, test_loss: 1.6324, test_f1: 0.6309
 epoch: 68, train_loss: 0.3479, test_loss: 1.6256, test_f1: 0.6389
 epoch: 69, train_loss: 0.3251, test_loss: 1.6183, test_f1: 0.6668
 epoch: 70, train_loss: 0.3338, test_loss: 1.6133, test_f1: 0.6588
 epoch: 71, train_loss: 0.3369, test_loss: 1.6155, test_f1: 0.6485
 epoch: 72, train_loss: 0.3253, test_loss: 1.5980, test_f1: 0.6532
 epoch: 73, train_loss: 0.3031, test_loss: 1.6664, test_f1: 0.6504
 epoch: 74, train_loss: 0.3105, test_loss: 1.6765, test_f1: 0.6488
 epoch: 75, train_loss: 0.3091, test_loss: 1.6838, test_f1: 0.6498
 epoch: 76, train_loss: 0.3166, test_loss: 1.7684, test_f1: 0.6393
 epoch: 77, train_loss: 0.3074, test_loss: 1.7156, test_f1: 0.6344
 epoch: 78, train_loss: 0.2904, test_loss: 1.7263, test_f1: 0.6399
 epoch: 79, train_loss: 0.3178, test_loss: 1.7194, test_f1: 0.6438
 epoch: 80, train_loss: 0.3090, test_loss: 1.7531, test_f1: 0.6506
 epoch: 81, train_loss: 0.2814, test_loss: 1.8162, test_f1: 0.6339
 epoch: 82, train_loss: 0.2731, test_loss: 1.8065, test_f1: 0.6456
 epoch: 83, train_loss: 0.2868, test_loss: 1.8603, test_f1: 0.6329
 epoch: 84, train_loss: 0.2819, test_loss: 1.8217, test_f1: 0.6223
 epoch: 85, train_loss: 0.2868, test_loss: 1.8809, test_f1: 0.6488
 epoch: 86, train_loss: 0.2866, test_loss: 1.8284, test_f1: 0.6540
 epoch: 87, train_loss: 0.2438, test_loss: 1.8993, test_f1: 0.6323
 epoch: 88, train_loss: 0.2711, test_loss: 1.9390, test_f1: 0.6156
 epoch: 89, train_loss: 0.2680, test_loss: 1.9140, test_f1: 0.6394
 epoch: 90, train_loss: 0.2853, test_loss: 1.9159, test_f1: 0.6333
 epoch: 91, train_loss: 0.2643, test_loss: 1.9723, test_f1: 0.6586
 epoch: 92, train_loss: 0.2600, test_loss: 1.9211, test_f1: 0.6427
 epoch: 93, train_loss: 0.2519, test_loss: 1.9807, test_f1: 0.6484
 epoch: 94, train_loss: 0.2515, test_loss: 1.9509, test_f1: 0.6433
 epoch: 95, train_loss: 0.2516, test_loss: 2.0406, test_f1: 0.6274
 epoch: 96, train_loss: 0.2478, test_loss: 2.1368, test_f1: 0.6220
 epoch: 97, train_loss: 0.2344, test_loss: 1.9691, test_f1: 0.6588
 epoch: 98, train_loss: 0.2462, test_loss: 2.0201, test_f1: 0.6416
 epoch: 99, train_loss: 0.2611, test_loss: 2.1128, test_f1: 0.6239
##################ITERATION #5 ****************************************
 epoch: 0, train_loss: 1.1769, test_loss: 1.2450, test_f1: 0.3745
 epoch: 1, train_loss: 1.0121, test_loss: 1.0613, test_f1: 0.5097
 epoch: 2, train_loss: 0.9864, test_loss: 1.0422, test_f1: 0.5091
 epoch: 3, train_loss: 0.9509, test_loss: 1.0367, test_f1: 0.5260
 epoch: 4, train_loss: 0.9282, test_loss: 1.0327, test_f1: 0.5122
 epoch: 5, train_loss: 0.9112, test_loss: 1.0177, test_f1: 0.5760
 epoch: 6, train_loss: 0.9006, test_loss: 1.0218, test_f1: 0.5198
 epoch: 7, train_loss: 0.8870, test_loss: 1.0187, test_f1: 0.5529
 epoch: 8, train_loss: 0.8637, test_loss: 1.0275, test_f1: 0.5413
 epoch: 9, train_loss: 0.8603, test_loss: 1.0250, test_f1: 0.5788
 epoch: 10, train_loss: 0.8254, test_loss: 1.0214, test_f1: 0.5488
 epoch: 11, train_loss: 0.8205, test_loss: 1.0198, test_f1: 0.5864
 epoch: 12, train_loss: 0.8138, test_loss: 1.0091, test_f1: 0.6034
 epoch: 13, train_loss: 0.7879, test_loss: 1.0089, test_f1: 0.5924
 epoch: 14, train_loss: 0.7725, test_loss: 1.0290, test_f1: 0.5752
 epoch: 15, train_loss: 0.7581, test_loss: 1.0176, test_f1: 0.5722
 epoch: 16, train_loss: 0.7502, test_loss: 1.0477, test_f1: 0.5740
 epoch: 17, train_loss: 0.7258, test_loss: 1.0362, test_f1: 0.5757
 epoch: 18, train_loss: 0.7148, test_loss: 1.0402, test_f1: 0.5712
 epoch: 19, train_loss: 0.7058, test_loss: 1.0479, test_f1: 0.5623
 epoch: 20, train_loss: 0.6974, test_loss: 1.0367, test_f1: 0.6113
 epoch: 21, train_loss: 0.6841, test_loss: 1.0688, test_f1: 0.5896
 epoch: 22, train_loss: 0.6708, test_loss: 1.0543, test_f1: 0.6049
 epoch: 23, train_loss: 0.6621, test_loss: 1.0570, test_f1: 0.5868
 epoch: 24, train_loss: 0.6447, test_loss: 1.0723, test_f1: 0.5981
 epoch: 25, train_loss: 0.6262, test_loss: 1.0440, test_f1: 0.6155
 epoch: 26, train_loss: 0.6521, test_loss: 1.0687, test_f1: 0.6117
 epoch: 27, train_loss: 0.5975, test_loss: 1.0768, test_f1: 0.6113
 epoch: 28, train_loss: 0.5950, test_loss: 1.0959, test_f1: 0.6232
 epoch: 29, train_loss: 0.5794, test_loss: 1.0818, test_f1: 0.6039
 epoch: 30, train_loss: 0.5592, test_loss: 1.1104, test_f1: 0.6078
 epoch: 31, train_loss: 0.5690, test_loss: 1.1178, test_f1: 0.6113
 epoch: 32, train_loss: 0.5636, test_loss: 1.0957, test_f1: 0.6172
 epoch: 33, train_loss: 0.5416, test_loss: 1.1493, test_f1: 0.6248
 epoch: 34, train_loss: 0.5394, test_loss: 1.1851, test_f1: 0.6090
 epoch: 35, train_loss: 0.5224, test_loss: 1.1672, test_f1: 0.6258
 epoch: 36, train_loss: 0.5275, test_loss: 1.1627, test_f1: 0.6325
 epoch: 37, train_loss: 0.5333, test_loss: 1.1593, test_f1: 0.6373
 epoch: 38, train_loss: 0.5139, test_loss: 1.2932, test_f1: 0.6250
 epoch: 39, train_loss: 0.4999, test_loss: 1.2421, test_f1: 0.6518
 epoch: 40, train_loss: 0.4907, test_loss: 1.2700, test_f1: 0.6501
 epoch: 41, train_loss: 0.4885, test_loss: 1.2274, test_f1: 0.6267
 epoch: 42, train_loss: 0.4673, test_loss: 1.2777, test_f1: 0.6209
 epoch: 43, train_loss: 0.4737, test_loss: 1.3152, test_f1: 0.6208
 epoch: 44, train_loss: 0.4487, test_loss: 1.3131, test_f1: 0.6275
 epoch: 45, train_loss: 0.4369, test_loss: 1.3440, test_f1: 0.6302
 epoch: 46, train_loss: 0.4468, test_loss: 1.3536, test_f1: 0.6467
 epoch: 47, train_loss: 0.4148, test_loss: 1.3554, test_f1: 0.6199
 epoch: 48, train_loss: 0.4148, test_loss: 1.4191, test_f1: 0.6271
 epoch: 49, train_loss: 0.4030, test_loss: 1.4212, test_f1: 0.6369
 epoch: 50, train_loss: 0.4103, test_loss: 1.4878, test_f1: 0.6509
 epoch: 51, train_loss: 0.3934, test_loss: 1.4074, test_f1: 0.6273
 epoch: 52, train_loss: 0.3678, test_loss: 1.4236, test_f1: 0.6346
 epoch: 53, train_loss: 0.3692, test_loss: 1.4835, test_f1: 0.6312
 epoch: 54, train_loss: 0.3754, test_loss: 1.5097, test_f1: 0.6299
 epoch: 55, train_loss: 0.3763, test_loss: 1.4757, test_f1: 0.6268
 epoch: 56, train_loss: 0.3471, test_loss: 1.4890, test_f1: 0.6376
 epoch: 57, train_loss: 0.3557, test_loss: 1.5322, test_f1: 0.6404
 epoch: 58, train_loss: 0.3309, test_loss: 1.4725, test_f1: 0.6454
 epoch: 59, train_loss: 0.3165, test_loss: 1.5194, test_f1: 0.6590
 epoch: 60, train_loss: 0.3294, test_loss: 1.5035, test_f1: 0.6587
 epoch: 61, train_loss: 0.3225, test_loss: 1.5533, test_f1: 0.6190
 epoch: 62, train_loss: 0.3284, test_loss: 1.5689, test_f1: 0.6257
 epoch: 63, train_loss: 0.3148, test_loss: 1.5859, test_f1: 0.6175
 epoch: 64, train_loss: 0.3304, test_loss: 1.6167, test_f1: 0.6402
 epoch: 65, train_loss: 0.3108, test_loss: 1.6166, test_f1: 0.6267
 epoch: 66, train_loss: 0.2989, test_loss: 1.6168, test_f1: 0.6476
 epoch: 67, train_loss: 0.3178, test_loss: 1.6675, test_f1: 0.6173
 epoch: 68, train_loss: 0.3166, test_loss: 1.6979, test_f1: 0.6525
 epoch: 69, train_loss: 0.3184, test_loss: 1.6292, test_f1: 0.6379
 epoch: 70, train_loss: 0.3010, test_loss: 1.6963, test_f1: 0.6175
 epoch: 71, train_loss: 0.2912, test_loss: 1.6879, test_f1: 0.6145
 epoch: 72, train_loss: 0.2995, test_loss: 1.7183, test_f1: 0.6222
 epoch: 73, train_loss: 0.2869, test_loss: 1.7086, test_f1: 0.6291
 epoch: 74, train_loss: 0.2670, test_loss: 1.6991, test_f1: 0.6370
 epoch: 75, train_loss: 0.2789, test_loss: 1.7122, test_f1: 0.6305
 epoch: 76, train_loss: 0.2916, test_loss: 1.7854, test_f1: 0.6153
 epoch: 77, train_loss: 0.2754, test_loss: 1.7563, test_f1: 0.6184
 epoch: 78, train_loss: 0.2663, test_loss: 1.8031, test_f1: 0.6303
 epoch: 79, train_loss: 0.2525, test_loss: 1.8054, test_f1: 0.6325
 epoch: 80, train_loss: 0.2733, test_loss: 1.8172, test_f1: 0.6135
 epoch: 81, train_loss: 0.2542, test_loss: 1.8574, test_f1: 0.6230
 epoch: 82, train_loss: 0.2586, test_loss: 1.8407, test_f1: 0.6251
 epoch: 83, train_loss: 0.2630, test_loss: 1.8883, test_f1: 0.6210
 epoch: 84, train_loss: 0.2594, test_loss: 1.9070, test_f1: 0.6010
 epoch: 85, train_loss: 0.2676, test_loss: 1.8444, test_f1: 0.5985
 epoch: 86, train_loss: 0.2638, test_loss: 1.9395, test_f1: 0.6015
 epoch: 87, train_loss: 0.2471, test_loss: 1.9602, test_f1: 0.6327
 epoch: 88, train_loss: 0.2378, test_loss: 1.9408, test_f1: 0.6236
 epoch: 89, train_loss: 0.2485, test_loss: 1.9936, test_f1: 0.5985
 epoch: 90, train_loss: 0.2291, test_loss: 1.9751, test_f1: 0.6300
 epoch: 91, train_loss: 0.2277, test_loss: 1.9586, test_f1: 0.6122
 epoch: 92, train_loss: 0.2437, test_loss: 2.0087, test_f1: 0.6086
 epoch: 93, train_loss: 0.2323, test_loss: 2.0090, test_f1: 0.5916
 epoch: 94, train_loss: 0.2409, test_loss: 2.0144, test_f1: 0.6106
 epoch: 95, train_loss: 0.2384, test_loss: 2.0015, test_f1: 0.6404
 epoch: 96, train_loss: 0.2264, test_loss: 2.0459, test_f1: 0.6241
 epoch: 97, train_loss: 0.2075, test_loss: 2.0989, test_f1: 0.6022
 epoch: 98, train_loss: 0.2089, test_loss: 2.0913, test_f1: 0.6026
 epoch: 99, train_loss: 0.2107, test_loss: 2.1577, test_f1: 0.6132
##################ITERATION #6 ****************************************
 epoch: 0, train_loss: 1.1876, test_loss: 1.3670, test_f1: 0.2727
 epoch: 1, train_loss: 1.0096, test_loss: 1.0631, test_f1: 0.5422
 epoch: 2, train_loss: 0.9972, test_loss: 1.0566, test_f1: 0.5393
 epoch: 3, train_loss: 0.9412, test_loss: 1.0372, test_f1: 0.5351
 epoch: 4, train_loss: 0.9245, test_loss: 1.0354, test_f1: 0.5677
 epoch: 5, train_loss: 0.8928, test_loss: 1.0248, test_f1: 0.5424
 epoch: 6, train_loss: 0.8729, test_loss: 1.0018, test_f1: 0.5684
 epoch: 7, train_loss: 0.8475, test_loss: 1.0096, test_f1: 0.5770
 epoch: 8, train_loss: 0.8316, test_loss: 1.0044, test_f1: 0.5703
 epoch: 9, train_loss: 0.8256, test_loss: 1.0294, test_f1: 0.5670
 epoch: 10, train_loss: 0.8047, test_loss: 0.9872, test_f1: 0.5824
 epoch: 11, train_loss: 0.7732, test_loss: 1.0323, test_f1: 0.5460
 epoch: 12, train_loss: 0.7665, test_loss: 1.0114, test_f1: 0.5963
 epoch: 13, train_loss: 0.7480, test_loss: 1.0071, test_f1: 0.6090
 epoch: 14, train_loss: 0.7339, test_loss: 1.0112, test_f1: 0.5903
 epoch: 15, train_loss: 0.7310, test_loss: 1.0400, test_f1: 0.5928
 epoch: 16, train_loss: 0.7287, test_loss: 0.9971, test_f1: 0.6094
 epoch: 17, train_loss: 0.7123, test_loss: 1.0467, test_f1: 0.5703
 epoch: 18, train_loss: 0.6959, test_loss: 1.0067, test_f1: 0.5849
 epoch: 19, train_loss: 0.6656, test_loss: 1.0256, test_f1: 0.6095
 epoch: 20, train_loss: 0.6440, test_loss: 1.0489, test_f1: 0.5856
 epoch: 21, train_loss: 0.6318, test_loss: 0.9994, test_f1: 0.5936
 epoch: 22, train_loss: 0.6309, test_loss: 1.0371, test_f1: 0.5935
 epoch: 23, train_loss: 0.6160, test_loss: 1.0195, test_f1: 0.6113
 epoch: 24, train_loss: 0.6010, test_loss: 1.0973, test_f1: 0.6141
 epoch: 25, train_loss: 0.6145, test_loss: 1.0431, test_f1: 0.5906
 epoch: 26, train_loss: 0.5907, test_loss: 1.0358, test_f1: 0.6129
 epoch: 27, train_loss: 0.5846, test_loss: 1.0815, test_f1: 0.5977
 epoch: 28, train_loss: 0.5527, test_loss: 1.1236, test_f1: 0.5861
 epoch: 29, train_loss: 0.5808, test_loss: 1.1620, test_f1: 0.6075
 epoch: 30, train_loss: 0.5654, test_loss: 1.0832, test_f1: 0.6117
 epoch: 31, train_loss: 0.5154, test_loss: 1.1164, test_f1: 0.6390
 epoch: 32, train_loss: 0.5363, test_loss: 1.1465, test_f1: 0.6284
 epoch: 33, train_loss: 0.5264, test_loss: 1.1458, test_f1: 0.6037
 epoch: 34, train_loss: 0.5029, test_loss: 1.2042, test_f1: 0.6263
 epoch: 35, train_loss: 0.4999, test_loss: 1.1914, test_f1: 0.5960
 epoch: 36, train_loss: 0.4845, test_loss: 1.2742, test_f1: 0.6112
 epoch: 37, train_loss: 0.4786, test_loss: 1.1920, test_f1: 0.6026
 epoch: 38, train_loss: 0.4783, test_loss: 1.2355, test_f1: 0.6141
 epoch: 39, train_loss: 0.4568, test_loss: 1.2572, test_f1: 0.6288
 epoch: 40, train_loss: 0.4374, test_loss: 1.2455, test_f1: 0.6194
 epoch: 41, train_loss: 0.4635, test_loss: 1.2695, test_f1: 0.6220
 epoch: 42, train_loss: 0.4736, test_loss: 1.2955, test_f1: 0.6216
 epoch: 43, train_loss: 0.4490, test_loss: 1.2489, test_f1: 0.6177
 epoch: 44, train_loss: 0.4148, test_loss: 1.3162, test_f1: 0.6116
 epoch: 45, train_loss: 0.4128, test_loss: 1.3232, test_f1: 0.6292
 epoch: 46, train_loss: 0.4196, test_loss: 1.3393, test_f1: 0.6046
 epoch: 47, train_loss: 0.3979, test_loss: 1.4776, test_f1: 0.5873
 epoch: 48, train_loss: 0.3955, test_loss: 1.4594, test_f1: 0.5962
 epoch: 49, train_loss: 0.4117, test_loss: 1.3825, test_f1: 0.6044
 epoch: 50, train_loss: 0.3801, test_loss: 1.4030, test_f1: 0.6218
 epoch: 51, train_loss: 0.3591, test_loss: 1.3765, test_f1: 0.6378
 epoch: 52, train_loss: 0.3405, test_loss: 1.4777, test_f1: 0.6129
 epoch: 53, train_loss: 0.3459, test_loss: 1.4946, test_f1: 0.6200
 epoch: 54, train_loss: 0.3276, test_loss: 1.5050, test_f1: 0.6233
 epoch: 55, train_loss: 0.3372, test_loss: 1.4742, test_f1: 0.6137
 epoch: 56, train_loss: 0.3110, test_loss: 1.5872, test_f1: 0.6067
 epoch: 57, train_loss: 0.3082, test_loss: 1.5330, test_f1: 0.6089
 epoch: 58, train_loss: 0.3333, test_loss: 1.5543, test_f1: 0.5964
 epoch: 59, train_loss: 0.3252, test_loss: 1.5827, test_f1: 0.5909
 epoch: 60, train_loss: 0.3220, test_loss: 1.5494, test_f1: 0.6077
 epoch: 61, train_loss: 0.3093, test_loss: 1.5924, test_f1: 0.6063
 epoch: 62, train_loss: 0.2841, test_loss: 1.5976, test_f1: 0.6043
 epoch: 63, train_loss: 0.3035, test_loss: 1.5424, test_f1: 0.6080
 epoch: 64, train_loss: 0.2925, test_loss: 1.6454, test_f1: 0.6069
 epoch: 65, train_loss: 0.2986, test_loss: 1.6386, test_f1: 0.5881
 epoch: 66, train_loss: 0.2834, test_loss: 1.5924, test_f1: 0.6076
 epoch: 67, train_loss: 0.2846, test_loss: 1.6135, test_f1: 0.5982
 epoch: 68, train_loss: 0.2802, test_loss: 1.6840, test_f1: 0.5923
 epoch: 69, train_loss: 0.2813, test_loss: 1.5983, test_f1: 0.6080
 epoch: 70, train_loss: 0.2778, test_loss: 1.7222, test_f1: 0.5943
 epoch: 71, train_loss: 0.2694, test_loss: 1.6952, test_f1: 0.5741
 epoch: 72, train_loss: 0.2529, test_loss: 1.6833, test_f1: 0.5880
 epoch: 73, train_loss: 0.2726, test_loss: 1.7172, test_f1: 0.5722
 epoch: 74, train_loss: 0.2840, test_loss: 1.7223, test_f1: 0.5876
 epoch: 75, train_loss: 0.2635, test_loss: 1.7880, test_f1: 0.5984
 epoch: 76, train_loss: 0.2727, test_loss: 1.7550, test_f1: 0.5967
 epoch: 77, train_loss: 0.2620, test_loss: 1.7236, test_f1: 0.6080
 epoch: 78, train_loss: 0.2318, test_loss: 1.7659, test_f1: 0.6027
 epoch: 79, train_loss: 0.2568, test_loss: 1.6327, test_f1: 0.6174
 epoch: 80, train_loss: 0.2535, test_loss: 1.8095, test_f1: 0.5771
 epoch: 81, train_loss: 0.2293, test_loss: 1.7900, test_f1: 0.6025
 epoch: 82, train_loss: 0.2361, test_loss: 1.8639, test_f1: 0.5960
 epoch: 83, train_loss: 0.2376, test_loss: 1.7883, test_f1: 0.5999
 epoch: 84, train_loss: 0.2449, test_loss: 1.7848, test_f1: 0.6058
 epoch: 85, train_loss: 0.2460, test_loss: 1.8727, test_f1: 0.5901
 epoch: 86, train_loss: 0.2286, test_loss: 1.9213, test_f1: 0.5715
 epoch: 87, train_loss: 0.2225, test_loss: 1.8542, test_f1: 0.6187
 epoch: 88, train_loss: 0.2493, test_loss: 1.8894, test_f1: 0.6059
 epoch: 89, train_loss: 0.2224, test_loss: 1.9312, test_f1: 0.5774
 epoch: 90, train_loss: 0.2283, test_loss: 1.9139, test_f1: 0.5813
 epoch: 91, train_loss: 0.2209, test_loss: 1.8570, test_f1: 0.6209
 epoch: 92, train_loss: 0.2322, test_loss: 1.9369, test_f1: 0.6032
 epoch: 93, train_loss: 0.2242, test_loss: 2.0044, test_f1: 0.5997
 epoch: 94, train_loss: 0.2050, test_loss: 1.8705, test_f1: 0.6172
 epoch: 95, train_loss: 0.1996, test_loss: 1.9225, test_f1: 0.6146
 epoch: 96, train_loss: 0.2315, test_loss: 1.9203, test_f1: 0.5885
 epoch: 97, train_loss: 0.1846, test_loss: 1.8963, test_f1: 0.6119
 epoch: 98, train_loss: 0.2125, test_loss: 2.0120, test_f1: 0.5808
 epoch: 99, train_loss: 0.2153, test_loss: 2.0094, test_f1: 0.5709
##################ITERATION #7 ****************************************
 epoch: 0, train_loss: 1.1968, test_loss: 1.2801, test_f1: 0.4229
 epoch: 1, train_loss: 1.0369, test_loss: 1.0881, test_f1: 0.4734
 epoch: 2, train_loss: 1.0120, test_loss: 1.0502, test_f1: 0.5242
 epoch: 3, train_loss: 0.9712, test_loss: 1.0404, test_f1: 0.5257
 epoch: 4, train_loss: 0.9248, test_loss: 1.0261, test_f1: 0.5772
 epoch: 5, train_loss: 0.9089, test_loss: 1.0315, test_f1: 0.5442
 epoch: 6, train_loss: 0.8851, test_loss: 1.0240, test_f1: 0.5720
 epoch: 7, train_loss: 0.8661, test_loss: 1.0147, test_f1: 0.5945
 epoch: 8, train_loss: 0.8409, test_loss: 1.0349, test_f1: 0.5601
 epoch: 9, train_loss: 0.8342, test_loss: 1.0379, test_f1: 0.5403
 epoch: 10, train_loss: 0.7898, test_loss: 1.0537, test_f1: 0.5329
 epoch: 11, train_loss: 0.8085, test_loss: 1.0257, test_f1: 0.5639
 epoch: 12, train_loss: 0.7804, test_loss: 1.0362, test_f1: 0.5695
 epoch: 13, train_loss: 0.7339, test_loss: 1.0306, test_f1: 0.5784
 epoch: 14, train_loss: 0.7496, test_loss: 1.0422, test_f1: 0.5828
 epoch: 15, train_loss: 0.7300, test_loss: 1.0445, test_f1: 0.6133
 epoch: 16, train_loss: 0.7214, test_loss: 1.0362, test_f1: 0.6008
 epoch: 17, train_loss: 0.7088, test_loss: 1.0557, test_f1: 0.5755
 epoch: 18, train_loss: 0.7093, test_loss: 1.0337, test_f1: 0.5974
 epoch: 19, train_loss: 0.6881, test_loss: 1.0495, test_f1: 0.5897
 epoch: 20, train_loss: 0.6749, test_loss: 1.0908, test_f1: 0.6035
 epoch: 21, train_loss: 0.6534, test_loss: 1.1227, test_f1: 0.6060
 epoch: 22, train_loss: 0.6433, test_loss: 1.1266, test_f1: 0.5767
 epoch: 23, train_loss: 0.6380, test_loss: 1.1178, test_f1: 0.5935
 epoch: 24, train_loss: 0.6129, test_loss: 1.1547, test_f1: 0.5648
 epoch: 25, train_loss: 0.6247, test_loss: 1.1367, test_f1: 0.5950
 epoch: 26, train_loss: 0.5925, test_loss: 1.1467, test_f1: 0.5892
 epoch: 27, train_loss: 0.6010, test_loss: 1.1197, test_f1: 0.5978
 epoch: 28, train_loss: 0.5902, test_loss: 1.1743, test_f1: 0.6168
 epoch: 29, train_loss: 0.5752, test_loss: 1.2448, test_f1: 0.5778
 epoch: 30, train_loss: 0.5464, test_loss: 1.2178, test_f1: 0.5801
 epoch: 31, train_loss: 0.5767, test_loss: 1.2369, test_f1: 0.5888
 epoch: 32, train_loss: 0.5374, test_loss: 1.2190, test_f1: 0.6223
 epoch: 33, train_loss: 0.5317, test_loss: 1.2658, test_f1: 0.5994
 epoch: 34, train_loss: 0.5116, test_loss: 1.2458, test_f1: 0.5999
 epoch: 35, train_loss: 0.5106, test_loss: 1.3004, test_f1: 0.5833
 epoch: 36, train_loss: 0.4891, test_loss: 1.2591, test_f1: 0.6049
 epoch: 37, train_loss: 0.4891, test_loss: 1.2986, test_f1: 0.6014
 epoch: 38, train_loss: 0.4934, test_loss: 1.2818, test_f1: 0.6135
 epoch: 39, train_loss: 0.4700, test_loss: 1.3138, test_f1: 0.6020
 epoch: 40, train_loss: 0.4558, test_loss: 1.3094, test_f1: 0.6187
 epoch: 41, train_loss: 0.4404, test_loss: 1.3863, test_f1: 0.6281
 epoch: 42, train_loss: 0.4488, test_loss: 1.3700, test_f1: 0.6265
 epoch: 43, train_loss: 0.4574, test_loss: 1.3730, test_f1: 0.6310
 epoch: 44, train_loss: 0.4356, test_loss: 1.3794, test_f1: 0.6160
 epoch: 45, train_loss: 0.4280, test_loss: 1.4288, test_f1: 0.6100
 epoch: 46, train_loss: 0.4259, test_loss: 1.3919, test_f1: 0.6160
 epoch: 47, train_loss: 0.4194, test_loss: 1.5084, test_f1: 0.6238
 epoch: 48, train_loss: 0.4160, test_loss: 1.5449, test_f1: 0.6035
 epoch: 49, train_loss: 0.4136, test_loss: 1.4483, test_f1: 0.6179
 epoch: 50, train_loss: 0.3834, test_loss: 1.5361, test_f1: 0.6079
 epoch: 51, train_loss: 0.3476, test_loss: 1.5378, test_f1: 0.6112
 epoch: 52, train_loss: 0.3631, test_loss: 1.6137, test_f1: 0.6201
 epoch: 53, train_loss: 0.3429, test_loss: 1.5348, test_f1: 0.6171
 epoch: 54, train_loss: 0.3425, test_loss: 1.6211, test_f1: 0.6099
 epoch: 55, train_loss: 0.3325, test_loss: 1.5885, test_f1: 0.6094
 epoch: 56, train_loss: 0.3318, test_loss: 1.6169, test_f1: 0.6234
 epoch: 57, train_loss: 0.3262, test_loss: 1.6734, test_f1: 0.6175
 epoch: 58, train_loss: 0.3278, test_loss: 1.6497, test_f1: 0.6187
 epoch: 59, train_loss: 0.3112, test_loss: 1.7138, test_f1: 0.6094
 epoch: 60, train_loss: 0.2955, test_loss: 1.7050, test_f1: 0.6174
 epoch: 61, train_loss: 0.3089, test_loss: 1.6820, test_f1: 0.6202
 epoch: 62, train_loss: 0.2942, test_loss: 1.7143, test_f1: 0.6176
 epoch: 63, train_loss: 0.2995, test_loss: 1.6848, test_f1: 0.6274
 epoch: 64, train_loss: 0.2878, test_loss: 1.7248, test_f1: 0.6300
 epoch: 65, train_loss: 0.2759, test_loss: 1.8193, test_f1: 0.6070
 epoch: 66, train_loss: 0.2913, test_loss: 1.7894, test_f1: 0.6265
 epoch: 67, train_loss: 0.2866, test_loss: 1.7838, test_f1: 0.6208
 epoch: 68, train_loss: 0.2891, test_loss: 1.8029, test_f1: 0.6223
 epoch: 69, train_loss: 0.2865, test_loss: 1.8569, test_f1: 0.6213
 epoch: 70, train_loss: 0.3046, test_loss: 1.8078, test_f1: 0.6058
 epoch: 71, train_loss: 0.2642, test_loss: 1.8542, test_f1: 0.6219
 epoch: 72, train_loss: 0.2775, test_loss: 1.8432, test_f1: 0.6239
 epoch: 73, train_loss: 0.2826, test_loss: 1.9270, test_f1: 0.6157
 epoch: 74, train_loss: 0.2764, test_loss: 1.8588, test_f1: 0.6179
 epoch: 75, train_loss: 0.2549, test_loss: 1.9015, test_f1: 0.6216
 epoch: 76, train_loss: 0.2695, test_loss: 1.9899, test_f1: 0.6157
 epoch: 77, train_loss: 0.2435, test_loss: 1.9207, test_f1: 0.6140
 epoch: 78, train_loss: 0.2708, test_loss: 1.9580, test_f1: 0.6195
 epoch: 79, train_loss: 0.2624, test_loss: 1.9507, test_f1: 0.6105
 epoch: 80, train_loss: 0.2540, test_loss: 1.9996, test_f1: 0.6215
 epoch: 81, train_loss: 0.2609, test_loss: 1.9663, test_f1: 0.6199
 epoch: 82, train_loss: 0.2395, test_loss: 1.9992, test_f1: 0.6181
 epoch: 83, train_loss: 0.2421, test_loss: 2.0548, test_f1: 0.6231
 epoch: 84, train_loss: 0.2710, test_loss: 2.0052, test_f1: 0.6199
 epoch: 85, train_loss: 0.2643, test_loss: 2.1305, test_f1: 0.6052
 epoch: 86, train_loss: 0.2396, test_loss: 2.0291, test_f1: 0.6187
 epoch: 87, train_loss: 0.2387, test_loss: 2.0993, test_f1: 0.6167
 epoch: 88, train_loss: 0.2234, test_loss: 2.0322, test_f1: 0.6260
 epoch: 89, train_loss: 0.2081, test_loss: 2.1093, test_f1: 0.6097
 epoch: 90, train_loss: 0.2070, test_loss: 2.1761, test_f1: 0.6162
 epoch: 91, train_loss: 0.2282, test_loss: 2.1660, test_f1: 0.6116
 epoch: 92, train_loss: 0.2050, test_loss: 2.1779, test_f1: 0.6251
 epoch: 93, train_loss: 0.2130, test_loss: 2.2111, test_f1: 0.6164
 epoch: 94, train_loss: 0.2219, test_loss: 2.1177, test_f1: 0.6119
 epoch: 95, train_loss: 0.2069, test_loss: 2.2875, test_f1: 0.6137
 epoch: 96, train_loss: 0.2249, test_loss: 2.2375, test_f1: 0.6128
 epoch: 97, train_loss: 0.2157, test_loss: 2.2218, test_f1: 0.6126
 epoch: 98, train_loss: 0.2134, test_loss: 2.2882, test_f1: 0.6226
 epoch: 99, train_loss: 0.1992, test_loss: 2.2587, test_f1: 0.6166
##################ITERATION #8 ****************************************
 epoch: 0, train_loss: 1.2311, test_loss: 1.3655, test_f1: 0.3147
 epoch: 1, train_loss: 1.0558, test_loss: 1.0797, test_f1: 0.4956
 epoch: 2, train_loss: 0.9957, test_loss: 1.0566, test_f1: 0.4881
 epoch: 3, train_loss: 0.9665, test_loss: 1.0316, test_f1: 0.5139
 epoch: 4, train_loss: 0.9189, test_loss: 1.0065, test_f1: 0.5301
 epoch: 5, train_loss: 0.9055, test_loss: 1.0042, test_f1: 0.5204
 epoch: 6, train_loss: 0.8826, test_loss: 0.9958, test_f1: 0.5508
 epoch: 7, train_loss: 0.8733, test_loss: 1.0076, test_f1: 0.5679
 epoch: 8, train_loss: 0.8469, test_loss: 1.0203, test_f1: 0.5798
 epoch: 9, train_loss: 0.8163, test_loss: 1.0143, test_f1: 0.6015
 epoch: 10, train_loss: 0.8199, test_loss: 1.0042, test_f1: 0.6031
 epoch: 11, train_loss: 0.7920, test_loss: 1.0038, test_f1: 0.6186
 epoch: 12, train_loss: 0.7692, test_loss: 1.0363, test_f1: 0.5967
 epoch: 13, train_loss: 0.7680, test_loss: 0.9977, test_f1: 0.5888
 epoch: 14, train_loss: 0.7471, test_loss: 1.0326, test_f1: 0.6109
 epoch: 15, train_loss: 0.7504, test_loss: 1.0154, test_f1: 0.6560
 epoch: 16, train_loss: 0.7309, test_loss: 1.0090, test_f1: 0.6232
 epoch: 17, train_loss: 0.7283, test_loss: 1.0298, test_f1: 0.6244
 epoch: 18, train_loss: 0.6985, test_loss: 1.0414, test_f1: 0.6362
 epoch: 19, train_loss: 0.7019, test_loss: 1.0546, test_f1: 0.6077
 epoch: 20, train_loss: 0.6824, test_loss: 1.0520, test_f1: 0.6148
 epoch: 21, train_loss: 0.6677, test_loss: 1.0395, test_f1: 0.6214
 epoch: 22, train_loss: 0.6691, test_loss: 1.0490, test_f1: 0.6320
 epoch: 23, train_loss: 0.6429, test_loss: 1.0770, test_f1: 0.6148
 epoch: 24, train_loss: 0.6495, test_loss: 1.0742, test_f1: 0.6272
 epoch: 25, train_loss: 0.6312, test_loss: 1.1158, test_f1: 0.6322
 epoch: 26, train_loss: 0.6267, test_loss: 1.0866, test_f1: 0.6740
 epoch: 27, train_loss: 0.6111, test_loss: 1.1320, test_f1: 0.6139
 epoch: 28, train_loss: 0.5899, test_loss: 1.1343, test_f1: 0.6224
 epoch: 29, train_loss: 0.5868, test_loss: 1.1075, test_f1: 0.6410
 epoch: 30, train_loss: 0.5753, test_loss: 1.1580, test_f1: 0.6477
 epoch: 31, train_loss: 0.5579, test_loss: 1.1305, test_f1: 0.6701
 epoch: 32, train_loss: 0.5556, test_loss: 1.1612, test_f1: 0.6558
 epoch: 33, train_loss: 0.5299, test_loss: 1.1903, test_f1: 0.6402
 epoch: 34, train_loss: 0.5554, test_loss: 1.1636, test_f1: 0.6600
 epoch: 35, train_loss: 0.5184, test_loss: 1.1762, test_f1: 0.6442
 epoch: 36, train_loss: 0.5368, test_loss: 1.2273, test_f1: 0.6353
 epoch: 37, train_loss: 0.5221, test_loss: 1.2805, test_f1: 0.6299
 epoch: 38, train_loss: 0.4971, test_loss: 1.2786, test_f1: 0.6175
 epoch: 39, train_loss: 0.5042, test_loss: 1.2341, test_f1: 0.6279
 epoch: 40, train_loss: 0.4852, test_loss: 1.2304, test_f1: 0.6463
 epoch: 41, train_loss: 0.4797, test_loss: 1.2339, test_f1: 0.6402
 epoch: 42, train_loss: 0.4764, test_loss: 1.2487, test_f1: 0.6328
 epoch: 43, train_loss: 0.4577, test_loss: 1.2848, test_f1: 0.6546
 epoch: 44, train_loss: 0.4702, test_loss: 1.2355, test_f1: 0.6659
 epoch: 45, train_loss: 0.4347, test_loss: 1.2872, test_f1: 0.6669
 epoch: 46, train_loss: 0.4415, test_loss: 1.3396, test_f1: 0.6612
 epoch: 47, train_loss: 0.4379, test_loss: 1.3692, test_f1: 0.6463
 epoch: 48, train_loss: 0.4506, test_loss: 1.3414, test_f1: 0.6489
 epoch: 49, train_loss: 0.4389, test_loss: 1.3135, test_f1: 0.6543
 epoch: 50, train_loss: 0.4172, test_loss: 1.3772, test_f1: 0.6329
 epoch: 51, train_loss: 0.3978, test_loss: 1.3880, test_f1: 0.6307
 epoch: 52, train_loss: 0.3633, test_loss: 1.3358, test_f1: 0.6737
 epoch: 53, train_loss: 0.3628, test_loss: 1.4118, test_f1: 0.6552
 epoch: 54, train_loss: 0.3748, test_loss: 1.4110, test_f1: 0.6473
 epoch: 55, train_loss: 0.3557, test_loss: 1.4608, test_f1: 0.6351
 epoch: 56, train_loss: 0.3730, test_loss: 1.3960, test_f1: 0.6580
 epoch: 57, train_loss: 0.3761, test_loss: 1.4376, test_f1: 0.6465
 epoch: 58, train_loss: 0.3385, test_loss: 1.4383, test_f1: 0.6538
 epoch: 59, train_loss: 0.3465, test_loss: 1.4463, test_f1: 0.6436
 epoch: 60, train_loss: 0.3445, test_loss: 1.4923, test_f1: 0.6577
 epoch: 61, train_loss: 0.3380, test_loss: 1.4705, test_f1: 0.6574
 epoch: 62, train_loss: 0.3321, test_loss: 1.4903, test_f1: 0.6608
 epoch: 63, train_loss: 0.3111, test_loss: 1.5133, test_f1: 0.6244
 epoch: 64, train_loss: 0.3176, test_loss: 1.5434, test_f1: 0.6538
 epoch: 65, train_loss: 0.3273, test_loss: 1.5586, test_f1: 0.6420
 epoch: 66, train_loss: 0.3029, test_loss: 1.5578, test_f1: 0.6371
 epoch: 67, train_loss: 0.3042, test_loss: 1.5140, test_f1: 0.6551
 epoch: 68, train_loss: 0.3176, test_loss: 1.5901, test_f1: 0.6278
 epoch: 69, train_loss: 0.3059, test_loss: 1.5774, test_f1: 0.6435
 epoch: 70, train_loss: 0.2960, test_loss: 1.6136, test_f1: 0.6511
 epoch: 71, train_loss: 0.2976, test_loss: 1.6367, test_f1: 0.6140
 epoch: 72, train_loss: 0.2929, test_loss: 1.6257, test_f1: 0.6438
 epoch: 73, train_loss: 0.3023, test_loss: 1.6259, test_f1: 0.6468
 epoch: 74, train_loss: 0.3025, test_loss: 1.6812, test_f1: 0.6337
 epoch: 75, train_loss: 0.2887, test_loss: 1.6743, test_f1: 0.6379
 epoch: 76, train_loss: 0.2888, test_loss: 1.6663, test_f1: 0.6451
 epoch: 77, train_loss: 0.2811, test_loss: 1.7003, test_f1: 0.6502
 epoch: 78, train_loss: 0.2921, test_loss: 1.7531, test_f1: 0.6445
 epoch: 79, train_loss: 0.2803, test_loss: 1.7416, test_f1: 0.6419
 epoch: 80, train_loss: 0.2870, test_loss: 1.7640, test_f1: 0.6362
 epoch: 81, train_loss: 0.2695, test_loss: 1.7157, test_f1: 0.6374
 epoch: 82, train_loss: 0.2597, test_loss: 1.7818, test_f1: 0.6007
 epoch: 83, train_loss: 0.2747, test_loss: 1.6852, test_f1: 0.6452
 epoch: 84, train_loss: 0.2597, test_loss: 1.7434, test_f1: 0.6323
 epoch: 85, train_loss: 0.2854, test_loss: 1.7274, test_f1: 0.6399
 epoch: 86, train_loss: 0.2499, test_loss: 1.7874, test_f1: 0.6425
 epoch: 87, train_loss: 0.2589, test_loss: 1.8033, test_f1: 0.6302
 epoch: 88, train_loss: 0.2612, test_loss: 1.8310, test_f1: 0.6441
 epoch: 89, train_loss: 0.2393, test_loss: 1.8330, test_f1: 0.6409
 epoch: 90, train_loss: 0.2517, test_loss: 1.8602, test_f1: 0.6202
 epoch: 91, train_loss: 0.2461, test_loss: 1.8671, test_f1: 0.6485
 epoch: 92, train_loss: 0.2353, test_loss: 1.8275, test_f1: 0.6457
 epoch: 93, train_loss: 0.2260, test_loss: 1.8075, test_f1: 0.6384
 epoch: 94, train_loss: 0.2256, test_loss: 1.8993, test_f1: 0.6333
 epoch: 95, train_loss: 0.2392, test_loss: 1.9272, test_f1: 0.6291
 epoch: 96, train_loss: 0.2269, test_loss: 1.9101, test_f1: 0.6478
 epoch: 97, train_loss: 0.2546, test_loss: 2.0177, test_f1: 0.6179
 epoch: 98, train_loss: 0.2389, test_loss: 1.9299, test_f1: 0.6454
 epoch: 99, train_loss: 0.2357, test_loss: 1.8935, test_f1: 0.6507
##################ITERATION #9 ****************************************
 epoch: 0, train_loss: 1.2621, test_loss: 1.3924, test_f1: 0.3110
 epoch: 1, train_loss: 1.0420, test_loss: 1.0602, test_f1: 0.5173
 epoch: 2, train_loss: 1.0216, test_loss: 1.0338, test_f1: 0.4936
 epoch: 3, train_loss: 0.9422, test_loss: 1.0108, test_f1: 0.5551
 epoch: 4, train_loss: 0.9266, test_loss: 0.9962, test_f1: 0.5490
 epoch: 5, train_loss: 0.9036, test_loss: 1.0034, test_f1: 0.5210
 epoch: 6, train_loss: 0.8934, test_loss: 1.0097, test_f1: 0.5224
 epoch: 7, train_loss: 0.8439, test_loss: 0.9925, test_f1: 0.5526
 epoch: 8, train_loss: 0.8522, test_loss: 1.0059, test_f1: 0.5578
 epoch: 9, train_loss: 0.8247, test_loss: 1.0011, test_f1: 0.5410
 epoch: 10, train_loss: 0.8000, test_loss: 1.0196, test_f1: 0.5419
 epoch: 11, train_loss: 0.7769, test_loss: 1.0214, test_f1: 0.5444
 epoch: 12, train_loss: 0.7751, test_loss: 0.9860, test_f1: 0.5799
 epoch: 13, train_loss: 0.7572, test_loss: 1.0466, test_f1: 0.5525
 epoch: 14, train_loss: 0.7593, test_loss: 1.0245, test_f1: 0.6019
 epoch: 15, train_loss: 0.7204, test_loss: 1.0277, test_f1: 0.5925
 epoch: 16, train_loss: 0.7270, test_loss: 1.0227, test_f1: 0.6075
 epoch: 17, train_loss: 0.7403, test_loss: 1.0262, test_f1: 0.6094
 epoch: 18, train_loss: 0.6981, test_loss: 1.0174, test_f1: 0.6116
 epoch: 19, train_loss: 0.6908, test_loss: 1.0312, test_f1: 0.6326
 epoch: 20, train_loss: 0.6850, test_loss: 1.0132, test_f1: 0.6050
 epoch: 21, train_loss: 0.6472, test_loss: 1.0651, test_f1: 0.6088
 epoch: 22, train_loss: 0.6555, test_loss: 1.0525, test_f1: 0.6253
 epoch: 23, train_loss: 0.6373, test_loss: 1.0404, test_f1: 0.6260
 epoch: 24, train_loss: 0.6434, test_loss: 1.0646, test_f1: 0.6222
 epoch: 25, train_loss: 0.6324, test_loss: 1.0905, test_f1: 0.6193
 epoch: 26, train_loss: 0.6372, test_loss: 1.0637, test_f1: 0.6438
 epoch: 27, train_loss: 0.6161, test_loss: 1.0880, test_f1: 0.6369
 epoch: 28, train_loss: 0.5988, test_loss: 1.1124, test_f1: 0.6272
 epoch: 29, train_loss: 0.5906, test_loss: 1.1265, test_f1: 0.6117
 epoch: 30, train_loss: 0.5906, test_loss: 1.1180, test_f1: 0.6245
 epoch: 31, train_loss: 0.5603, test_loss: 1.1361, test_f1: 0.6195
 epoch: 32, train_loss: 0.5959, test_loss: 1.1400, test_f1: 0.6024
 epoch: 33, train_loss: 0.5300, test_loss: 1.1423, test_f1: 0.6238
 epoch: 34, train_loss: 0.5406, test_loss: 1.2314, test_f1: 0.6353
 epoch: 35, train_loss: 0.5345, test_loss: 1.1832, test_f1: 0.6097
 epoch: 36, train_loss: 0.5111, test_loss: 1.1543, test_f1: 0.6216
 epoch: 37, train_loss: 0.5011, test_loss: 1.2007, test_f1: 0.6106
 epoch: 38, train_loss: 0.5122, test_loss: 1.1939, test_f1: 0.6277
 epoch: 39, train_loss: 0.5193, test_loss: 1.2135, test_f1: 0.6362
 epoch: 40, train_loss: 0.4955, test_loss: 1.2762, test_f1: 0.6191
 epoch: 41, train_loss: 0.4854, test_loss: 1.2511, test_f1: 0.6232
 epoch: 42, train_loss: 0.4705, test_loss: 1.2808, test_f1: 0.6270
 epoch: 43, train_loss: 0.4706, test_loss: 1.2743, test_f1: 0.6110
 epoch: 44, train_loss: 0.4597, test_loss: 1.2658, test_f1: 0.6322
 epoch: 45, train_loss: 0.4623, test_loss: 1.2734, test_f1: 0.6197
 epoch: 46, train_loss: 0.4393, test_loss: 1.3503, test_f1: 0.6228
 epoch: 47, train_loss: 0.4392, test_loss: 1.3308, test_f1: 0.6269
 epoch: 48, train_loss: 0.4284, test_loss: 1.3370, test_f1: 0.6267
 epoch: 49, train_loss: 0.4541, test_loss: 1.3428, test_f1: 0.6090
 epoch: 50, train_loss: 0.4370, test_loss: 1.3515, test_f1: 0.6096
 epoch: 51, train_loss: 0.4109, test_loss: 1.3316, test_f1: 0.6336
 epoch: 52, train_loss: 0.3979, test_loss: 1.3430, test_f1: 0.6396
 epoch: 53, train_loss: 0.3900, test_loss: 1.3594, test_f1: 0.6445
 epoch: 54, train_loss: 0.3919, test_loss: 1.4138, test_f1: 0.6310
 epoch: 55, train_loss: 0.3801, test_loss: 1.3867, test_f1: 0.6310
 epoch: 56, train_loss: 0.3599, test_loss: 1.4099, test_f1: 0.6187
 epoch: 57, train_loss: 0.3716, test_loss: 1.4117, test_f1: 0.6257
 epoch: 58, train_loss: 0.3725, test_loss: 1.4631, test_f1: 0.6031
 epoch: 59, train_loss: 0.3594, test_loss: 1.4997, test_f1: 0.6254
 epoch: 60, train_loss: 0.3505, test_loss: 1.4827, test_f1: 0.6314
 epoch: 61, train_loss: 0.3439, test_loss: 1.4545, test_f1: 0.6206
 epoch: 62, train_loss: 0.3339, test_loss: 1.5220, test_f1: 0.6108
 epoch: 63, train_loss: 0.3407, test_loss: 1.5290, test_f1: 0.6301
 epoch: 64, train_loss: 0.3369, test_loss: 1.5067, test_f1: 0.6099
 epoch: 65, train_loss: 0.3378, test_loss: 1.5473, test_f1: 0.6088
 epoch: 66, train_loss: 0.3399, test_loss: 1.5751, test_f1: 0.6230
 epoch: 67, train_loss: 0.3184, test_loss: 1.5330, test_f1: 0.6303
 epoch: 68, train_loss: 0.3350, test_loss: 1.5689, test_f1: 0.6232
 epoch: 69, train_loss: 0.3160, test_loss: 1.5720, test_f1: 0.6359
 epoch: 70, train_loss: 0.3060, test_loss: 1.6382, test_f1: 0.6183
 epoch: 71, train_loss: 0.3176, test_loss: 1.6087, test_f1: 0.6279
 epoch: 72, train_loss: 0.3152, test_loss: 1.5855, test_f1: 0.6243
 epoch: 73, train_loss: 0.3235, test_loss: 1.6334, test_f1: 0.6255
 epoch: 74, train_loss: 0.3075, test_loss: 1.5978, test_f1: 0.6277
 epoch: 75, train_loss: 0.2990, test_loss: 1.5901, test_f1: 0.6404
 epoch: 76, train_loss: 0.3150, test_loss: 1.5748, test_f1: 0.6456
 epoch: 77, train_loss: 0.2834, test_loss: 1.6214, test_f1: 0.6367
 epoch: 78, train_loss: 0.2833, test_loss: 1.6640, test_f1: 0.6311
 epoch: 79, train_loss: 0.2747, test_loss: 1.6646, test_f1: 0.6304
 epoch: 80, train_loss: 0.2994, test_loss: 1.7463, test_f1: 0.6287
 epoch: 81, train_loss: 0.2723, test_loss: 1.7237, test_f1: 0.6401
 epoch: 82, train_loss: 0.2954, test_loss: 1.7455, test_f1: 0.6340
 epoch: 83, train_loss: 0.2874, test_loss: 1.7935, test_f1: 0.6273
 epoch: 84, train_loss: 0.2864, test_loss: 1.7567, test_f1: 0.6407
 epoch: 85, train_loss: 0.2897, test_loss: 1.6990, test_f1: 0.6266
 epoch: 86, train_loss: 0.2706, test_loss: 1.7473, test_f1: 0.6274
 epoch: 87, train_loss: 0.2811, test_loss: 1.7850, test_f1: 0.6406
 epoch: 88, train_loss: 0.2560, test_loss: 1.7368, test_f1: 0.6370
 epoch: 89, train_loss: 0.2614, test_loss: 1.8336, test_f1: 0.6244
 epoch: 90, train_loss: 0.2697, test_loss: 1.8126, test_f1: 0.6405
 epoch: 91, train_loss: 0.2694, test_loss: 1.8165, test_f1: 0.6407
 epoch: 92, train_loss: 0.2614, test_loss: 1.8105, test_f1: 0.6423
 epoch: 93, train_loss: 0.2402, test_loss: 1.8450, test_f1: 0.6439
 epoch: 94, train_loss: 0.2406, test_loss: 1.9055, test_f1: 0.6239
 epoch: 95, train_loss: 0.2514, test_loss: 1.8563, test_f1: 0.6384
 epoch: 96, train_loss: 0.2390, test_loss: 1.8363, test_f1: 0.6479
 epoch: 97, train_loss: 0.2337, test_loss: 1.8933, test_f1: 0.6460
 epoch: 98, train_loss: 0.2305, test_loss: 1.9528, test_f1: 0.6261
 epoch: 99, train_loss: 0.2463, test_loss: 1.8853, test_f1: 0.6344

Training completed in 692.77 seconds
Best F1: 0.6740 at epoch 26
Mean F1 across iterations: 0.6557  0.0127
========================FINAL RESULTS================================
FEGIN weighted F1: 0.6740  0.0127
python main.py --data ltspice_demos --representation component_pin_net --model FEGIN --layers 4 --hiddens 128 --batch_size 32 --lr 0.0001 --emb_size 512 --epochs 100 --save_appendix component_pin_net_L4_H128_BS32_LR0.0001_E512 --no_val
-----



STDERR:
  File "main.py", line 370, in <module>
    main()
  File "main.py", line 254, in main
    dataset = dataset_class(
  File "/home/philip/projects/ltspice_examples_code_repo/Circuit-Completion-Using-GNNs/component_classification_with_link_prediction_head/evaluation/FEGIN/kernel/circuit_datasets.py", line 15, in __init__
    self.data, self.slices = torch.load(self.processed_paths[0])
  File "/home/philip/.local/lib/python3.8/site-packages/torch/serialization.py", line 1040, in load
    warnings.warn(
  File "/usr/lib/python3.8/warnings.py", line 109, in _showwarnmsg
    sw(msg.message, msg.category, msg.filename, msg.lineno,
  File "main.py", line 47, in warn_with_traceback
    traceback.print_stack(file=log)
/home/philip/projects/ltspice_examples_code_repo/Circuit-Completion-Using-GNNs/component_classification_with_link_prediction_head/evaluation/FEGIN/kernel/circuit_datasets.py:15: FutureWarning: You are using `torch.load` with `weights_only=False` (the current default value), which uses the default pickle module implicitly. It is possible to construct malicious pickle data which will execute arbitrary code during unpickling (See https://github.com/pytorch/pytorch/blob/main/SECURITY.md#untrusted-models for more details). In a future release, the default value for `weights_only` will be flipped to `True`. This limits the functions that could be executed during unpickling. Arbitrary objects will no longer be allowed to be loaded via this mode unless they are explicitly allowlisted by the user via `torch.serialization.add_safe_globals`. We recommend you start setting `weights_only=True` for any use case where you don't have full control of the loaded file. Please open an issue on GitHub for any issues related to this experimental feature.
  self.data, self.slices = torch.load(self.processed_paths[0])
