STDOUT:
Results will be saved in /home/philip/projects/ltspice_examples_code_repo/Circuit-Completion-Using-GNNs/component_classification_with_link_prediction_head/evaluation/FEGIN/results/model_FEGIN_dataset_ltspice_examples
Command line input: python main.py --data ltspice_examples --representation component_component --model FEGIN --layers 4 --hiddens 32 --batch_size 32 --lr 0.0001 --emb_size 250 --epochs 100 --save_appendix component_component_L4_H32_BS32_LR0.0001_E250 --no_val
 is saved.
-----
ltspice_examples - FEGIN
Using 4 layers, 32 hidden units, h = 2
Loading component_component representation dataset
ENTERED
Training FEGIN on component_component representation
Train: 3556, Test: 845
##################ITERATION #0 ****************************************
 epoch: 0, train_loss: 1.3803, test_loss: 1.3721, test_f1: 0.1604
 epoch: 1, train_loss: 1.3623, test_loss: 1.3588, test_f1: 0.1983
 epoch: 2, train_loss: 1.3461, test_loss: 1.3396, test_f1: 0.2658
 epoch: 3, train_loss: 1.3290, test_loss: 1.3191, test_f1: 0.2307
 epoch: 4, train_loss: 1.3114, test_loss: 1.3017, test_f1: 0.2274
 epoch: 5, train_loss: 1.2963, test_loss: 1.2913, test_f1: 0.2274
 epoch: 6, train_loss: 1.2829, test_loss: 1.2769, test_f1: 0.2274
 epoch: 7, train_loss: 1.2708, test_loss: 1.2632, test_f1: 0.2274
 epoch: 8, train_loss: 1.2610, test_loss: 1.2514, test_f1: 0.2274
 epoch: 9, train_loss: 1.2554, test_loss: 1.2436, test_f1: 0.2327
 epoch: 10, train_loss: 1.2429, test_loss: 1.2327, test_f1: 0.2423
 epoch: 11, train_loss: 1.2402, test_loss: 1.2296, test_f1: 0.2771
 epoch: 12, train_loss: 1.2334, test_loss: 1.2192, test_f1: 0.2866
 epoch: 13, train_loss: 1.2280, test_loss: 1.2093, test_f1: 0.2940
 epoch: 14, train_loss: 1.2246, test_loss: 1.2063, test_f1: 0.3036
 epoch: 15, train_loss: 1.2181, test_loss: 1.2024, test_f1: 0.2999
 epoch: 16, train_loss: 1.2144, test_loss: 1.1954, test_f1: 0.3174
 epoch: 17, train_loss: 1.2084, test_loss: 1.1907, test_f1: 0.3130
 epoch: 18, train_loss: 1.1999, test_loss: 1.1832, test_f1: 0.3600
 epoch: 19, train_loss: 1.1955, test_loss: 1.1795, test_f1: 0.3413
 epoch: 20, train_loss: 1.1914, test_loss: 1.1741, test_f1: 0.3575
 epoch: 21, train_loss: 1.1880, test_loss: 1.1655, test_f1: 0.3688
 epoch: 22, train_loss: 1.1827, test_loss: 1.1598, test_f1: 0.3621
 epoch: 23, train_loss: 1.1773, test_loss: 1.1532, test_f1: 0.3641
 epoch: 24, train_loss: 1.1746, test_loss: 1.1462, test_f1: 0.3641
 epoch: 25, train_loss: 1.1676, test_loss: 1.1424, test_f1: 0.3645
 epoch: 26, train_loss: 1.1609, test_loss: 1.1354, test_f1: 0.3555
 epoch: 27, train_loss: 1.1599, test_loss: 1.1313, test_f1: 0.3677
 epoch: 28, train_loss: 1.1508, test_loss: 1.1261, test_f1: 0.3584
 epoch: 29, train_loss: 1.1494, test_loss: 1.1230, test_f1: 0.3864
 epoch: 30, train_loss: 1.1540, test_loss: 1.1194, test_f1: 0.3806
 epoch: 31, train_loss: 1.1410, test_loss: 1.1151, test_f1: 0.4138
 epoch: 32, train_loss: 1.1399, test_loss: 1.1117, test_f1: 0.4105
 epoch: 33, train_loss: 1.1282, test_loss: 1.1030, test_f1: 0.4207
 epoch: 34, train_loss: 1.1351, test_loss: 1.1004, test_f1: 0.4312
 epoch: 35, train_loss: 1.1259, test_loss: 1.0967, test_f1: 0.4366
 epoch: 36, train_loss: 1.1186, test_loss: 1.0959, test_f1: 0.4501
 epoch: 37, train_loss: 1.1166, test_loss: 1.0920, test_f1: 0.4291
 epoch: 38, train_loss: 1.1144, test_loss: 1.0821, test_f1: 0.4372
 epoch: 39, train_loss: 1.1163, test_loss: 1.1006, test_f1: 0.4397
 epoch: 40, train_loss: 1.1115, test_loss: 1.0839, test_f1: 0.4634
 epoch: 41, train_loss: 1.1050, test_loss: 1.0851, test_f1: 0.4274
 epoch: 42, train_loss: 1.1044, test_loss: 1.0785, test_f1: 0.4401
 epoch: 43, train_loss: 1.1038, test_loss: 1.0994, test_f1: 0.4405
 epoch: 44, train_loss: 1.0911, test_loss: 1.0751, test_f1: 0.4492
 epoch: 45, train_loss: 1.0942, test_loss: 1.0683, test_f1: 0.4446
 epoch: 46, train_loss: 1.0944, test_loss: 1.1095, test_f1: 0.4421
 epoch: 47, train_loss: 1.0882, test_loss: 1.0892, test_f1: 0.4278
 epoch: 48, train_loss: 1.0839, test_loss: 1.0914, test_f1: 0.4273
 epoch: 49, train_loss: 1.0839, test_loss: 1.0646, test_f1: 0.4411
 epoch: 50, train_loss: 1.0755, test_loss: 1.0887, test_f1: 0.4264
 epoch: 51, train_loss: 1.0774, test_loss: 1.0741, test_f1: 0.4438
 epoch: 52, train_loss: 1.0807, test_loss: 1.0682, test_f1: 0.4475
 epoch: 53, train_loss: 1.0730, test_loss: 1.0760, test_f1: 0.4377
 epoch: 54, train_loss: 1.0650, test_loss: 1.0608, test_f1: 0.4456
 epoch: 55, train_loss: 1.0637, test_loss: 1.0584, test_f1: 0.4439
 epoch: 56, train_loss: 1.0686, test_loss: 1.0644, test_f1: 0.4476
 epoch: 57, train_loss: 1.0669, test_loss: 1.0592, test_f1: 0.4510
 epoch: 58, train_loss: 1.0606, test_loss: 1.0906, test_f1: 0.4316
 epoch: 59, train_loss: 1.0531, test_loss: 1.0788, test_f1: 0.4361
 epoch: 60, train_loss: 1.0649, test_loss: 1.0736, test_f1: 0.4310
 epoch: 61, train_loss: 1.0702, test_loss: 1.0663, test_f1: 0.4385
 epoch: 62, train_loss: 1.0548, test_loss: 1.0997, test_f1: 0.4398
 epoch: 63, train_loss: 1.0491, test_loss: 1.0565, test_f1: 0.4467
 epoch: 64, train_loss: 1.0642, test_loss: 1.0594, test_f1: 0.4528
 epoch: 65, train_loss: 1.0570, test_loss: 1.0734, test_f1: 0.4426
 epoch: 66, train_loss: 1.0542, test_loss: 1.0512, test_f1: 0.4476
 epoch: 67, train_loss: 1.0492, test_loss: 1.0913, test_f1: 0.4548
 epoch: 68, train_loss: 1.0548, test_loss: 1.0644, test_f1: 0.4441
 epoch: 69, train_loss: 1.0506, test_loss: 1.0586, test_f1: 0.4537
 epoch: 70, train_loss: 1.0599, test_loss: 1.0792, test_f1: 0.4410
 epoch: 71, train_loss: 1.0481, test_loss: 1.0543, test_f1: 0.4658
 epoch: 72, train_loss: 1.0476, test_loss: 1.0593, test_f1: 0.4571
 epoch: 73, train_loss: 1.0516, test_loss: 1.0489, test_f1: 0.4592
 epoch: 74, train_loss: 1.0521, test_loss: 1.0682, test_f1: 0.4414
 epoch: 75, train_loss: 1.0500, test_loss: 1.0759, test_f1: 0.4482
 epoch: 76, train_loss: 1.0529, test_loss: 1.0590, test_f1: 0.4648
 epoch: 77, train_loss: 1.0458, test_loss: 1.0617, test_f1: 0.4576
 epoch: 78, train_loss: 1.0433, test_loss: 1.0575, test_f1: 0.4542
 epoch: 79, train_loss: 1.0457, test_loss: 1.0726, test_f1: 0.4177
 epoch: 80, train_loss: 1.0391, test_loss: 1.0692, test_f1: 0.4496
 epoch: 81, train_loss: 1.0335, test_loss: 1.0717, test_f1: 0.4320
 epoch: 82, train_loss: 1.0393, test_loss: 1.0555, test_f1: 0.4564
 epoch: 83, train_loss: 1.0432, test_loss: 1.0448, test_f1: 0.4503
 epoch: 84, train_loss: 1.0410, test_loss: 1.0602, test_f1: 0.4517
 epoch: 85, train_loss: 1.0429, test_loss: 1.0735, test_f1: 0.4249
 epoch: 86, train_loss: 1.0405, test_loss: 1.0810, test_f1: 0.4233
 epoch: 87, train_loss: 1.0397, test_loss: 1.0679, test_f1: 0.4472
 epoch: 88, train_loss: 1.0412, test_loss: 1.0568, test_f1: 0.4508
 epoch: 89, train_loss: 1.0336, test_loss: 1.0653, test_f1: 0.4249
 epoch: 90, train_loss: 1.0333, test_loss: 1.0473, test_f1: 0.4425
 epoch: 91, train_loss: 1.0239, test_loss: 1.0536, test_f1: 0.4344
 epoch: 92, train_loss: 1.0395, test_loss: 1.0783, test_f1: 0.4229
 epoch: 93, train_loss: 1.0284, test_loss: 1.0547, test_f1: 0.4525
 epoch: 94, train_loss: 1.0370, test_loss: 1.0524, test_f1: 0.4567
 epoch: 95, train_loss: 1.0245, test_loss: 1.0786, test_f1: 0.4408
 epoch: 96, train_loss: 1.0273, test_loss: 1.0582, test_f1: 0.4422
 epoch: 97, train_loss: 1.0240, test_loss: 1.0605, test_f1: 0.4348
 epoch: 98, train_loss: 1.0174, test_loss: 1.0575, test_f1: 0.4446
 epoch: 99, train_loss: 1.0204, test_loss: 1.0696, test_f1: 0.4318
##################ITERATION #1 ****************************************
 epoch: 0, train_loss: 1.3634, test_loss: 1.3431, test_f1: 0.2634
 epoch: 1, train_loss: 1.3157, test_loss: 1.3050, test_f1: 0.2474
 epoch: 2, train_loss: 1.2926, test_loss: 1.2817, test_f1: 0.2525
 epoch: 3, train_loss: 1.2746, test_loss: 1.2609, test_f1: 0.2860
 epoch: 4, train_loss: 1.2640, test_loss: 1.2395, test_f1: 0.3141
 epoch: 5, train_loss: 1.2518, test_loss: 1.2299, test_f1: 0.3273
 epoch: 6, train_loss: 1.2435, test_loss: 1.2206, test_f1: 0.3303
 epoch: 7, train_loss: 1.2343, test_loss: 1.2120, test_f1: 0.3305
 epoch: 8, train_loss: 1.2271, test_loss: 1.2072, test_f1: 0.3400
 epoch: 9, train_loss: 1.2221, test_loss: 1.1979, test_f1: 0.3660
 epoch: 10, train_loss: 1.2169, test_loss: 1.1907, test_f1: 0.3887
 epoch: 11, train_loss: 1.2103, test_loss: 1.1860, test_f1: 0.3955
 epoch: 12, train_loss: 1.2028, test_loss: 1.1792, test_f1: 0.3979
 epoch: 13, train_loss: 1.1992, test_loss: 1.1714, test_f1: 0.4039
 epoch: 14, train_loss: 1.1925, test_loss: 1.1669, test_f1: 0.4069
 epoch: 15, train_loss: 1.1971, test_loss: 1.1557, test_f1: 0.4145
 epoch: 16, train_loss: 1.1893, test_loss: 1.1568, test_f1: 0.4046
 epoch: 17, train_loss: 1.1810, test_loss: 1.1474, test_f1: 0.4127
 epoch: 18, train_loss: 1.1889, test_loss: 1.1404, test_f1: 0.4149
 epoch: 19, train_loss: 1.1753, test_loss: 1.1328, test_f1: 0.4360
 epoch: 20, train_loss: 1.1738, test_loss: 1.1310, test_f1: 0.4128
 epoch: 21, train_loss: 1.1774, test_loss: 1.1287, test_f1: 0.4246
 epoch: 22, train_loss: 1.1688, test_loss: 1.1175, test_f1: 0.4226
 epoch: 23, train_loss: 1.1579, test_loss: 1.1159, test_f1: 0.4349
 epoch: 24, train_loss: 1.1570, test_loss: 1.1115, test_f1: 0.4229
 epoch: 25, train_loss: 1.1501, test_loss: 1.1040, test_f1: 0.4398
 epoch: 26, train_loss: 1.1573, test_loss: 1.0942, test_f1: 0.4503
 epoch: 27, train_loss: 1.1539, test_loss: 1.0911, test_f1: 0.4479
 epoch: 28, train_loss: 1.1435, test_loss: 1.0946, test_f1: 0.4389
 epoch: 29, train_loss: 1.1412, test_loss: 1.0900, test_f1: 0.4403
 epoch: 30, train_loss: 1.1371, test_loss: 1.0846, test_f1: 0.4410
 epoch: 31, train_loss: 1.1304, test_loss: 1.0829, test_f1: 0.4391
 epoch: 32, train_loss: 1.1352, test_loss: 1.0763, test_f1: 0.4388
 epoch: 33, train_loss: 1.1400, test_loss: 1.0722, test_f1: 0.4343
 epoch: 34, train_loss: 1.1197, test_loss: 1.0702, test_f1: 0.4407
 epoch: 35, train_loss: 1.1229, test_loss: 1.0719, test_f1: 0.4358
 epoch: 36, train_loss: 1.1281, test_loss: 1.0653, test_f1: 0.4411
 epoch: 37, train_loss: 1.1170, test_loss: 1.0686, test_f1: 0.4448
 epoch: 38, train_loss: 1.1159, test_loss: 1.0608, test_f1: 0.4438
 epoch: 39, train_loss: 1.1143, test_loss: 1.0566, test_f1: 0.4401
 epoch: 40, train_loss: 1.1049, test_loss: 1.0567, test_f1: 0.4467
 epoch: 41, train_loss: 1.1086, test_loss: 1.0680, test_f1: 0.4415
 epoch: 42, train_loss: 1.0991, test_loss: 1.0560, test_f1: 0.4427
 epoch: 43, train_loss: 1.0948, test_loss: 1.0567, test_f1: 0.4515
 epoch: 44, train_loss: 1.0934, test_loss: 1.0436, test_f1: 0.4508
 epoch: 45, train_loss: 1.0963, test_loss: 1.0439, test_f1: 0.4362
 epoch: 46, train_loss: 1.0934, test_loss: 1.0538, test_f1: 0.4369
 epoch: 47, train_loss: 1.0864, test_loss: 1.0444, test_f1: 0.4504
 epoch: 48, train_loss: 1.0818, test_loss: 1.0365, test_f1: 0.4534
 epoch: 49, train_loss: 1.0835, test_loss: 1.0372, test_f1: 0.4484
 epoch: 50, train_loss: 1.0798, test_loss: 1.0410, test_f1: 0.4433
 epoch: 51, train_loss: 1.0782, test_loss: 1.0389, test_f1: 0.4416
 epoch: 52, train_loss: 1.0817, test_loss: 1.0369, test_f1: 0.4546
 epoch: 53, train_loss: 1.0740, test_loss: 1.0361, test_f1: 0.4522
 epoch: 54, train_loss: 1.0785, test_loss: 1.0288, test_f1: 0.4507
 epoch: 55, train_loss: 1.0707, test_loss: 1.0301, test_f1: 0.4455
 epoch: 56, train_loss: 1.0769, test_loss: 1.0284, test_f1: 0.4495
 epoch: 57, train_loss: 1.0674, test_loss: 1.0264, test_f1: 0.4594
 epoch: 58, train_loss: 1.0729, test_loss: 1.0235, test_f1: 0.4670
 epoch: 59, train_loss: 1.0645, test_loss: 1.0231, test_f1: 0.4590
 epoch: 60, train_loss: 1.0723, test_loss: 1.0224, test_f1: 0.4521
 epoch: 61, train_loss: 1.0665, test_loss: 1.0392, test_f1: 0.4474
 epoch: 62, train_loss: 1.0559, test_loss: 1.0225, test_f1: 0.4505
 epoch: 63, train_loss: 1.0637, test_loss: 1.0327, test_f1: 0.4427
 epoch: 64, train_loss: 1.0466, test_loss: 1.0397, test_f1: 0.4316
 epoch: 65, train_loss: 1.0550, test_loss: 1.0273, test_f1: 0.4369
 epoch: 66, train_loss: 1.0553, test_loss: 1.0359, test_f1: 0.4532
 epoch: 67, train_loss: 1.0592, test_loss: 1.0269, test_f1: 0.4375
 epoch: 68, train_loss: 1.0589, test_loss: 1.0139, test_f1: 0.4510
 epoch: 69, train_loss: 1.0632, test_loss: 1.0202, test_f1: 0.4477
 epoch: 70, train_loss: 1.0614, test_loss: 1.0227, test_f1: 0.4586
 epoch: 71, train_loss: 1.0570, test_loss: 1.0174, test_f1: 0.4483
 epoch: 72, train_loss: 1.0533, test_loss: 1.0301, test_f1: 0.4403
 epoch: 73, train_loss: 1.0614, test_loss: 1.0260, test_f1: 0.4433
 epoch: 74, train_loss: 1.0629, test_loss: 1.0083, test_f1: 0.4711
 epoch: 75, train_loss: 1.0424, test_loss: 1.0202, test_f1: 0.4639
 epoch: 76, train_loss: 1.0527, test_loss: 1.0086, test_f1: 0.4608
 epoch: 77, train_loss: 1.0483, test_loss: 1.0224, test_f1: 0.4685
 epoch: 78, train_loss: 1.0488, test_loss: 1.0144, test_f1: 0.4579
 epoch: 79, train_loss: 1.0467, test_loss: 1.0248, test_f1: 0.4610
 epoch: 80, train_loss: 1.0518, test_loss: 1.0218, test_f1: 0.4472
 epoch: 81, train_loss: 1.0504, test_loss: 1.0119, test_f1: 0.4721
 epoch: 82, train_loss: 1.0455, test_loss: 1.0236, test_f1: 0.4546
 epoch: 83, train_loss: 1.0518, test_loss: 1.0132, test_f1: 0.4586
 epoch: 84, train_loss: 1.0360, test_loss: 1.0067, test_f1: 0.4572
 epoch: 85, train_loss: 1.0457, test_loss: 1.0094, test_f1: 0.4542
 epoch: 86, train_loss: 1.0449, test_loss: 1.0260, test_f1: 0.4600
 epoch: 87, train_loss: 1.0409, test_loss: 1.0163, test_f1: 0.4517
 epoch: 88, train_loss: 1.0356, test_loss: 1.0080, test_f1: 0.4462
 epoch: 89, train_loss: 1.0429, test_loss: 1.0128, test_f1: 0.4575
 epoch: 90, train_loss: 1.0317, test_loss: 1.0147, test_f1: 0.4582
 epoch: 91, train_loss: 1.0380, test_loss: 1.0053, test_f1: 0.4690
 epoch: 92, train_loss: 1.0318, test_loss: 1.0099, test_f1: 0.4547
 epoch: 93, train_loss: 1.0343, test_loss: 1.0286, test_f1: 0.4519
 epoch: 94, train_loss: 1.0368, test_loss: 1.0136, test_f1: 0.4493
 epoch: 95, train_loss: 1.0362, test_loss: 1.0079, test_f1: 0.4546
 epoch: 96, train_loss: 1.0452, test_loss: 1.0044, test_f1: 0.4459
 epoch: 97, train_loss: 1.0315, test_loss: 1.0219, test_f1: 0.4439
 epoch: 98, train_loss: 1.0281, test_loss: 1.0036, test_f1: 0.4493
 epoch: 99, train_loss: 1.0364, test_loss: 1.0105, test_f1: 0.4626
##################ITERATION #2 ****************************************
 epoch: 0, train_loss: 1.3105, test_loss: 1.2878, test_f1: 0.2856
 epoch: 1, train_loss: 1.2779, test_loss: 1.2705, test_f1: 0.2904
 epoch: 2, train_loss: 1.2659, test_loss: 1.2536, test_f1: 0.2859
 epoch: 3, train_loss: 1.2528, test_loss: 1.2374, test_f1: 0.2856
 epoch: 4, train_loss: 1.2402, test_loss: 1.2199, test_f1: 0.2913
 epoch: 5, train_loss: 1.2300, test_loss: 1.2101, test_f1: 0.2943
 epoch: 6, train_loss: 1.2229, test_loss: 1.1932, test_f1: 0.3440
 epoch: 7, train_loss: 1.2187, test_loss: 1.1878, test_f1: 0.3534
 epoch: 8, train_loss: 1.2079, test_loss: 1.1771, test_f1: 0.3971
 epoch: 9, train_loss: 1.1979, test_loss: 1.1649, test_f1: 0.4036
 epoch: 10, train_loss: 1.1934, test_loss: 1.1609, test_f1: 0.4023
 epoch: 11, train_loss: 1.1930, test_loss: 1.1568, test_f1: 0.4115
 epoch: 12, train_loss: 1.1767, test_loss: 1.1392, test_f1: 0.4319
 epoch: 13, train_loss: 1.1716, test_loss: 1.1383, test_f1: 0.4336
 epoch: 14, train_loss: 1.1699, test_loss: 1.1284, test_f1: 0.4342
 epoch: 15, train_loss: 1.1607, test_loss: 1.1253, test_f1: 0.4425
 epoch: 16, train_loss: 1.1529, test_loss: 1.1139, test_f1: 0.4478
 epoch: 17, train_loss: 1.1468, test_loss: 1.1189, test_f1: 0.4291
 epoch: 18, train_loss: 1.1408, test_loss: 1.1074, test_f1: 0.4407
 epoch: 19, train_loss: 1.1412, test_loss: 1.1068, test_f1: 0.4229
 epoch: 20, train_loss: 1.1323, test_loss: 1.0926, test_f1: 0.4510
 epoch: 21, train_loss: 1.1291, test_loss: 1.0902, test_f1: 0.4402
 epoch: 22, train_loss: 1.1239, test_loss: 1.0862, test_f1: 0.4545
 epoch: 23, train_loss: 1.1271, test_loss: 1.0897, test_f1: 0.4339
 epoch: 24, train_loss: 1.1167, test_loss: 1.0864, test_f1: 0.4429
 epoch: 25, train_loss: 1.1086, test_loss: 1.0831, test_f1: 0.4317
 epoch: 26, train_loss: 1.1128, test_loss: 1.0845, test_f1: 0.4436
 epoch: 27, train_loss: 1.1216, test_loss: 1.0738, test_f1: 0.4556
 epoch: 28, train_loss: 1.1097, test_loss: 1.0640, test_f1: 0.4577
 epoch: 29, train_loss: 1.1043, test_loss: 1.0605, test_f1: 0.4503
 epoch: 30, train_loss: 1.0873, test_loss: 1.0599, test_f1: 0.4624
 epoch: 31, train_loss: 1.0937, test_loss: 1.0527, test_f1: 0.4658
 epoch: 32, train_loss: 1.0906, test_loss: 1.0461, test_f1: 0.4529
 epoch: 33, train_loss: 1.0880, test_loss: 1.0478, test_f1: 0.4518
 epoch: 34, train_loss: 1.0812, test_loss: 1.0440, test_f1: 0.4588
 epoch: 35, train_loss: 1.0819, test_loss: 1.0472, test_f1: 0.4473
 epoch: 36, train_loss: 1.0804, test_loss: 1.0350, test_f1: 0.4549
 epoch: 37, train_loss: 1.0787, test_loss: 1.0310, test_f1: 0.4613
 epoch: 38, train_loss: 1.0680, test_loss: 1.0268, test_f1: 0.4600
 epoch: 39, train_loss: 1.0708, test_loss: 1.0399, test_f1: 0.4375
 epoch: 40, train_loss: 1.0616, test_loss: 1.0378, test_f1: 0.4424
 epoch: 41, train_loss: 1.0563, test_loss: 1.0323, test_f1: 0.4492
 epoch: 42, train_loss: 1.0679, test_loss: 1.0579, test_f1: 0.4222
 epoch: 43, train_loss: 1.0604, test_loss: 1.0469, test_f1: 0.4374
 epoch: 44, train_loss: 1.0683, test_loss: 1.0320, test_f1: 0.4414
 epoch: 45, train_loss: 1.0616, test_loss: 1.0298, test_f1: 0.4430
 epoch: 46, train_loss: 1.0618, test_loss: 1.0281, test_f1: 0.4615
 epoch: 47, train_loss: 1.0561, test_loss: 1.0045, test_f1: 0.4585
 epoch: 48, train_loss: 1.0497, test_loss: 1.0428, test_f1: 0.4341
 epoch: 49, train_loss: 1.0475, test_loss: 1.0058, test_f1: 0.4609
 epoch: 50, train_loss: 1.0455, test_loss: 1.0197, test_f1: 0.4354
 epoch: 51, train_loss: 1.0384, test_loss: 1.0097, test_f1: 0.4668
 epoch: 52, train_loss: 1.0362, test_loss: 1.0168, test_f1: 0.4618
 epoch: 53, train_loss: 1.0394, test_loss: 1.0235, test_f1: 0.4431
 epoch: 54, train_loss: 1.0439, test_loss: 1.0355, test_f1: 0.4421
 epoch: 55, train_loss: 1.0411, test_loss: 1.0134, test_f1: 0.4530
 epoch: 56, train_loss: 1.0451, test_loss: 1.0153, test_f1: 0.4432
 epoch: 57, train_loss: 1.0284, test_loss: 1.0219, test_f1: 0.4303
 epoch: 58, train_loss: 1.0394, test_loss: 1.0210, test_f1: 0.4394
 epoch: 59, train_loss: 1.0370, test_loss: 1.0279, test_f1: 0.4430
 epoch: 60, train_loss: 1.0323, test_loss: 1.0195, test_f1: 0.4404
 epoch: 61, train_loss: 1.0454, test_loss: 1.0102, test_f1: 0.4553
 epoch: 62, train_loss: 1.0359, test_loss: 1.0072, test_f1: 0.4463
 epoch: 63, train_loss: 1.0298, test_loss: 1.0050, test_f1: 0.4631
 epoch: 64, train_loss: 1.0321, test_loss: 1.0201, test_f1: 0.4526
 epoch: 65, train_loss: 1.0170, test_loss: 0.9957, test_f1: 0.4621
 epoch: 66, train_loss: 1.0177, test_loss: 1.0039, test_f1: 0.4540
 epoch: 67, train_loss: 1.0257, test_loss: 1.0063, test_f1: 0.4554
 epoch: 68, train_loss: 1.0245, test_loss: 1.0423, test_f1: 0.4521
 epoch: 69, train_loss: 1.0213, test_loss: 1.0164, test_f1: 0.4385
 epoch: 70, train_loss: 1.0359, test_loss: 1.0093, test_f1: 0.4452
 epoch: 71, train_loss: 1.0182, test_loss: 1.0297, test_f1: 0.4369
 epoch: 72, train_loss: 1.0177, test_loss: 1.0031, test_f1: 0.4572
 epoch: 73, train_loss: 1.0252, test_loss: 1.0073, test_f1: 0.4472
 epoch: 74, train_loss: 1.0091, test_loss: 0.9966, test_f1: 0.4535
 epoch: 75, train_loss: 1.0128, test_loss: 0.9904, test_f1: 0.4498
 epoch: 76, train_loss: 1.0188, test_loss: 1.0250, test_f1: 0.4545
 epoch: 77, train_loss: 1.0243, test_loss: 0.9951, test_f1: 0.4439
 epoch: 78, train_loss: 1.0165, test_loss: 0.9987, test_f1: 0.4506
 epoch: 79, train_loss: 1.0217, test_loss: 0.9889, test_f1: 0.4598
 epoch: 80, train_loss: 1.0167, test_loss: 1.0203, test_f1: 0.4388
 epoch: 81, train_loss: 1.0167, test_loss: 1.0097, test_f1: 0.4626
 epoch: 82, train_loss: 1.0115, test_loss: 1.0065, test_f1: 0.4553
 epoch: 83, train_loss: 1.0149, test_loss: 1.0018, test_f1: 0.4363
 epoch: 84, train_loss: 1.0009, test_loss: 0.9969, test_f1: 0.4513
 epoch: 85, train_loss: 1.0156, test_loss: 0.9921, test_f1: 0.4551
 epoch: 86, train_loss: 1.0067, test_loss: 0.9903, test_f1: 0.4569
 epoch: 87, train_loss: 1.0125, test_loss: 0.9829, test_f1: 0.4650
 epoch: 88, train_loss: 1.0131, test_loss: 1.0037, test_f1: 0.4502
 epoch: 89, train_loss: 1.0110, test_loss: 1.0075, test_f1: 0.4410
 epoch: 90, train_loss: 1.0094, test_loss: 0.9913, test_f1: 0.4542
 epoch: 91, train_loss: 1.0082, test_loss: 1.0103, test_f1: 0.4441
 epoch: 92, train_loss: 1.0026, test_loss: 1.0081, test_f1: 0.4485
 epoch: 93, train_loss: 1.0096, test_loss: 1.0141, test_f1: 0.4602
 epoch: 94, train_loss: 0.9939, test_loss: 1.0286, test_f1: 0.4592
 epoch: 95, train_loss: 0.9994, test_loss: 1.0516, test_f1: 0.4383
 epoch: 96, train_loss: 1.0018, test_loss: 0.9871, test_f1: 0.4648
 epoch: 97, train_loss: 0.9960, test_loss: 1.0340, test_f1: 0.4499
 epoch: 98, train_loss: 1.0026, test_loss: 1.0615, test_f1: 0.4484
 epoch: 99, train_loss: 1.0065, test_loss: 0.9793, test_f1: 0.4514
##################ITERATION #3 ****************************************
 epoch: 0, train_loss: 1.3158, test_loss: 1.2949, test_f1: 0.2276
 epoch: 1, train_loss: 1.2727, test_loss: 1.2770, test_f1: 0.2318
 epoch: 2, train_loss: 1.2612, test_loss: 1.2570, test_f1: 0.2300
 epoch: 3, train_loss: 1.2557, test_loss: 1.2531, test_f1: 0.2303
 epoch: 4, train_loss: 1.2474, test_loss: 1.2336, test_f1: 0.2464
 epoch: 5, train_loss: 1.2344, test_loss: 1.2190, test_f1: 0.2747
 epoch: 6, train_loss: 1.2233, test_loss: 1.2105, test_f1: 0.3009
 epoch: 7, train_loss: 1.2149, test_loss: 1.2057, test_f1: 0.3290
 epoch: 8, train_loss: 1.2130, test_loss: 1.1820, test_f1: 0.3777
 epoch: 9, train_loss: 1.1996, test_loss: 1.1714, test_f1: 0.4042
 epoch: 10, train_loss: 1.1949, test_loss: 1.1666, test_f1: 0.4044
 epoch: 11, train_loss: 1.1860, test_loss: 1.1569, test_f1: 0.4131
 epoch: 12, train_loss: 1.1799, test_loss: 1.1451, test_f1: 0.4091
 epoch: 13, train_loss: 1.1678, test_loss: 1.1439, test_f1: 0.4136
 epoch: 14, train_loss: 1.1715, test_loss: 1.1303, test_f1: 0.4164
 epoch: 15, train_loss: 1.1655, test_loss: 1.1370, test_f1: 0.4200
 epoch: 16, train_loss: 1.1570, test_loss: 1.1240, test_f1: 0.4126
 epoch: 17, train_loss: 1.1541, test_loss: 1.1131, test_f1: 0.4164
 epoch: 18, train_loss: 1.1563, test_loss: 1.1116, test_f1: 0.4173
 epoch: 19, train_loss: 1.1485, test_loss: 1.1079, test_f1: 0.4352
 epoch: 20, train_loss: 1.1434, test_loss: 1.0987, test_f1: 0.4235
 epoch: 21, train_loss: 1.1465, test_loss: 1.0978, test_f1: 0.4367
 epoch: 22, train_loss: 1.1378, test_loss: 1.0886, test_f1: 0.4380
 epoch: 23, train_loss: 1.1360, test_loss: 1.0886, test_f1: 0.4337
 epoch: 24, train_loss: 1.1252, test_loss: 1.0895, test_f1: 0.4243
 epoch: 25, train_loss: 1.1250, test_loss: 1.0737, test_f1: 0.4510
 epoch: 26, train_loss: 1.1250, test_loss: 1.0788, test_f1: 0.4481
 epoch: 27, train_loss: 1.1168, test_loss: 1.0654, test_f1: 0.4769
 epoch: 28, train_loss: 1.1066, test_loss: 1.0598, test_f1: 0.4620
 epoch: 29, train_loss: 1.1044, test_loss: 1.0572, test_f1: 0.4552
 epoch: 30, train_loss: 1.1054, test_loss: 1.0478, test_f1: 0.4551
 epoch: 31, train_loss: 1.0981, test_loss: 1.0550, test_f1: 0.4676
 epoch: 32, train_loss: 1.0964, test_loss: 1.0427, test_f1: 0.4708
 epoch: 33, train_loss: 1.1029, test_loss: 1.0524, test_f1: 0.4650
 epoch: 34, train_loss: 1.0903, test_loss: 1.0319, test_f1: 0.4555
 epoch: 35, train_loss: 1.0878, test_loss: 1.0314, test_f1: 0.4634
 epoch: 36, train_loss: 1.0878, test_loss: 1.0253, test_f1: 0.4660
 epoch: 37, train_loss: 1.0819, test_loss: 1.0282, test_f1: 0.4690
 epoch: 38, train_loss: 1.0808, test_loss: 1.0176, test_f1: 0.4699
 epoch: 39, train_loss: 1.0703, test_loss: 1.0093, test_f1: 0.4868
 epoch: 40, train_loss: 1.0759, test_loss: 1.0097, test_f1: 0.4809
 epoch: 41, train_loss: 1.0684, test_loss: 1.0070, test_f1: 0.4864
 epoch: 42, train_loss: 1.0588, test_loss: 0.9996, test_f1: 0.5125
 epoch: 43, train_loss: 1.0571, test_loss: 1.0088, test_f1: 0.4978
 epoch: 44, train_loss: 1.0681, test_loss: 0.9945, test_f1: 0.4904
 epoch: 45, train_loss: 1.0510, test_loss: 1.0017, test_f1: 0.4883
 epoch: 46, train_loss: 1.0497, test_loss: 0.9912, test_f1: 0.4932
 epoch: 47, train_loss: 1.0554, test_loss: 0.9955, test_f1: 0.4631
 epoch: 48, train_loss: 1.0516, test_loss: 0.9868, test_f1: 0.4813
 epoch: 49, train_loss: 1.0477, test_loss: 1.0011, test_f1: 0.4764
 epoch: 50, train_loss: 1.0365, test_loss: 0.9779, test_f1: 0.4841
 epoch: 51, train_loss: 1.0343, test_loss: 0.9926, test_f1: 0.5018
 epoch: 52, train_loss: 1.0352, test_loss: 0.9740, test_f1: 0.4947
 epoch: 53, train_loss: 1.0322, test_loss: 0.9926, test_f1: 0.4694
 epoch: 54, train_loss: 1.0380, test_loss: 0.9835, test_f1: 0.4815
 epoch: 55, train_loss: 1.0335, test_loss: 0.9979, test_f1: 0.4683
 epoch: 56, train_loss: 1.0312, test_loss: 0.9817, test_f1: 0.4878
 epoch: 57, train_loss: 1.0366, test_loss: 0.9871, test_f1: 0.4712
 epoch: 58, train_loss: 1.0216, test_loss: 0.9693, test_f1: 0.4982
 epoch: 59, train_loss: 1.0290, test_loss: 0.9676, test_f1: 0.4933
 epoch: 60, train_loss: 1.0320, test_loss: 0.9802, test_f1: 0.4719
 epoch: 61, train_loss: 1.0278, test_loss: 0.9737, test_f1: 0.4719
 epoch: 62, train_loss: 1.0208, test_loss: 0.9677, test_f1: 0.4783
 epoch: 63, train_loss: 1.0258, test_loss: 0.9781, test_f1: 0.4962
 epoch: 64, train_loss: 1.0225, test_loss: 0.9729, test_f1: 0.4789
 epoch: 65, train_loss: 1.0249, test_loss: 0.9606, test_f1: 0.4914
 epoch: 66, train_loss: 1.0144, test_loss: 0.9979, test_f1: 0.4613
 epoch: 67, train_loss: 1.0243, test_loss: 0.9929, test_f1: 0.4611
 epoch: 68, train_loss: 1.0166, test_loss: 0.9658, test_f1: 0.4840
 epoch: 69, train_loss: 1.0142, test_loss: 0.9614, test_f1: 0.4765
 epoch: 70, train_loss: 1.0019, test_loss: 0.9798, test_f1: 0.4731
 epoch: 71, train_loss: 1.0177, test_loss: 0.9663, test_f1: 0.4977
 epoch: 72, train_loss: 1.0080, test_loss: 0.9640, test_f1: 0.4877
 epoch: 73, train_loss: 1.0211, test_loss: 0.9737, test_f1: 0.4816
 epoch: 74, train_loss: 1.0072, test_loss: 0.9579, test_f1: 0.4916
 epoch: 75, train_loss: 0.9968, test_loss: 0.9665, test_f1: 0.4811
 epoch: 76, train_loss: 1.0104, test_loss: 0.9626, test_f1: 0.4925
 epoch: 77, train_loss: 1.0084, test_loss: 0.9443, test_f1: 0.5062
 epoch: 78, train_loss: 1.0028, test_loss: 0.9737, test_f1: 0.4802
 epoch: 79, train_loss: 1.0056, test_loss: 0.9622, test_f1: 0.4804
 epoch: 80, train_loss: 0.9920, test_loss: 0.9589, test_f1: 0.4829
 epoch: 81, train_loss: 0.9990, test_loss: 0.9625, test_f1: 0.5009
 epoch: 82, train_loss: 0.9978, test_loss: 0.9652, test_f1: 0.4853
 epoch: 83, train_loss: 1.0042, test_loss: 0.9580, test_f1: 0.4972
 epoch: 84, train_loss: 1.0027, test_loss: 0.9483, test_f1: 0.5121
 epoch: 85, train_loss: 1.0074, test_loss: 0.9680, test_f1: 0.4881
 epoch: 86, train_loss: 0.9925, test_loss: 0.9481, test_f1: 0.4968
 epoch: 87, train_loss: 0.9878, test_loss: 0.9517, test_f1: 0.5006
 epoch: 88, train_loss: 0.9983, test_loss: 1.0016, test_f1: 0.4614
 epoch: 89, train_loss: 0.9848, test_loss: 0.9436, test_f1: 0.4949
 epoch: 90, train_loss: 0.9902, test_loss: 0.9549, test_f1: 0.4911
 epoch: 91, train_loss: 0.9869, test_loss: 0.9397, test_f1: 0.4978
 epoch: 92, train_loss: 0.9972, test_loss: 0.9649, test_f1: 0.4834
 epoch: 93, train_loss: 0.9883, test_loss: 0.9742, test_f1: 0.4690
 epoch: 94, train_loss: 0.9833, test_loss: 0.9582, test_f1: 0.4966
 epoch: 95, train_loss: 0.9844, test_loss: 0.9681, test_f1: 0.4843
 epoch: 96, train_loss: 0.9829, test_loss: 0.9527, test_f1: 0.4711
 epoch: 97, train_loss: 0.9864, test_loss: 0.9778, test_f1: 0.4767
 epoch: 98, train_loss: 0.9885, test_loss: 0.9430, test_f1: 0.5101
 epoch: 99, train_loss: 0.9810, test_loss: 0.9423, test_f1: 0.5047
##################ITERATION #4 ****************************************
 epoch: 0, train_loss: 1.2926, test_loss: 1.2611, test_f1: 0.2602
 epoch: 1, train_loss: 1.2574, test_loss: 1.2355, test_f1: 0.2687
 epoch: 2, train_loss: 1.2468, test_loss: 1.2217, test_f1: 0.2543
 epoch: 3, train_loss: 1.2369, test_loss: 1.2069, test_f1: 0.2735
 epoch: 4, train_loss: 1.2263, test_loss: 1.1966, test_f1: 0.3110
 epoch: 5, train_loss: 1.2220, test_loss: 1.1880, test_f1: 0.3351
 epoch: 6, train_loss: 1.2136, test_loss: 1.1756, test_f1: 0.3566
 epoch: 7, train_loss: 1.2069, test_loss: 1.1712, test_f1: 0.3604
 epoch: 8, train_loss: 1.1996, test_loss: 1.1611, test_f1: 0.3742
 epoch: 9, train_loss: 1.1996, test_loss: 1.1543, test_f1: 0.4068
 epoch: 10, train_loss: 1.1906, test_loss: 1.1456, test_f1: 0.4374
 epoch: 11, train_loss: 1.1828, test_loss: 1.1433, test_f1: 0.4287
 epoch: 12, train_loss: 1.1761, test_loss: 1.1349, test_f1: 0.4376
 epoch: 13, train_loss: 1.1653, test_loss: 1.1367, test_f1: 0.4465
 epoch: 14, train_loss: 1.1642, test_loss: 1.1233, test_f1: 0.4643
 epoch: 15, train_loss: 1.1596, test_loss: 1.1109, test_f1: 0.4391
 epoch: 16, train_loss: 1.1556, test_loss: 1.1112, test_f1: 0.4363
 epoch: 17, train_loss: 1.1528, test_loss: 1.1054, test_f1: 0.4289
 epoch: 18, train_loss: 1.1428, test_loss: 1.1039, test_f1: 0.4359
 epoch: 19, train_loss: 1.1427, test_loss: 1.0953, test_f1: 0.4691
 epoch: 20, train_loss: 1.1384, test_loss: 1.0942, test_f1: 0.4599
 epoch: 21, train_loss: 1.1295, test_loss: 1.0860, test_f1: 0.4564
 epoch: 22, train_loss: 1.1269, test_loss: 1.0873, test_f1: 0.4412
 epoch: 23, train_loss: 1.1218, test_loss: 1.0787, test_f1: 0.4517
 epoch: 24, train_loss: 1.1108, test_loss: 1.0893, test_f1: 0.4406
 epoch: 25, train_loss: 1.1084, test_loss: 1.0722, test_f1: 0.4549
 epoch: 26, train_loss: 1.0975, test_loss: 1.0700, test_f1: 0.4715
 epoch: 27, train_loss: 1.1016, test_loss: 1.0732, test_f1: 0.4536
 epoch: 28, train_loss: 1.0950, test_loss: 1.0591, test_f1: 0.4649
 epoch: 29, train_loss: 1.0874, test_loss: 1.0614, test_f1: 0.4426
 epoch: 30, train_loss: 1.0847, test_loss: 1.0574, test_f1: 0.4565
 epoch: 31, train_loss: 1.0886, test_loss: 1.0582, test_f1: 0.4619
 epoch: 32, train_loss: 1.0746, test_loss: 1.0528, test_f1: 0.4443
 epoch: 33, train_loss: 1.0919, test_loss: 1.0625, test_f1: 0.4505
 epoch: 34, train_loss: 1.0707, test_loss: 1.0537, test_f1: 0.4268
 epoch: 35, train_loss: 1.0709, test_loss: 1.0523, test_f1: 0.4269
 epoch: 36, train_loss: 1.0608, test_loss: 1.0539, test_f1: 0.4395
 epoch: 37, train_loss: 1.0641, test_loss: 1.0323, test_f1: 0.4404
 epoch: 38, train_loss: 1.0627, test_loss: 1.0321, test_f1: 0.4524
 epoch: 39, train_loss: 1.0665, test_loss: 1.0324, test_f1: 0.4413
 epoch: 40, train_loss: 1.0517, test_loss: 1.0386, test_f1: 0.4464
 epoch: 41, train_loss: 1.0488, test_loss: 1.0279, test_f1: 0.4413
 epoch: 42, train_loss: 1.0540, test_loss: 1.0205, test_f1: 0.4598
 epoch: 43, train_loss: 1.0489, test_loss: 1.0271, test_f1: 0.4345
 epoch: 44, train_loss: 1.0428, test_loss: 1.0194, test_f1: 0.4433
 epoch: 45, train_loss: 1.0385, test_loss: 1.0276, test_f1: 0.4444
 epoch: 46, train_loss: 1.0338, test_loss: 1.0484, test_f1: 0.4299
 epoch: 47, train_loss: 1.0410, test_loss: 1.0251, test_f1: 0.4444
 epoch: 48, train_loss: 1.0321, test_loss: 1.0165, test_f1: 0.4477
 epoch: 49, train_loss: 1.0243, test_loss: 1.0064, test_f1: 0.4428
 epoch: 50, train_loss: 1.0306, test_loss: 1.0198, test_f1: 0.4359
 epoch: 51, train_loss: 1.0305, test_loss: 1.0115, test_f1: 0.4612
 epoch: 52, train_loss: 1.0226, test_loss: 1.0158, test_f1: 0.4479
 epoch: 53, train_loss: 1.0182, test_loss: 1.0055, test_f1: 0.4384
 epoch: 54, train_loss: 1.0157, test_loss: 1.0087, test_f1: 0.4376
 epoch: 55, train_loss: 1.0242, test_loss: 1.0256, test_f1: 0.4289
 epoch: 56, train_loss: 1.0126, test_loss: 1.0177, test_f1: 0.4364
 epoch: 57, train_loss: 1.0136, test_loss: 1.0142, test_f1: 0.4508
 epoch: 58, train_loss: 1.0229, test_loss: 1.0211, test_f1: 0.4424
 epoch: 59, train_loss: 1.0223, test_loss: 1.0012, test_f1: 0.4448
 epoch: 60, train_loss: 1.0146, test_loss: 1.0255, test_f1: 0.4391
 epoch: 61, train_loss: 1.0155, test_loss: 1.0130, test_f1: 0.4546
 epoch: 62, train_loss: 1.0095, test_loss: 1.0146, test_f1: 0.4452
 epoch: 63, train_loss: 1.0061, test_loss: 1.0034, test_f1: 0.4420
 epoch: 64, train_loss: 1.0045, test_loss: 1.0144, test_f1: 0.4413
 epoch: 65, train_loss: 1.0081, test_loss: 1.0084, test_f1: 0.4433
 epoch: 66, train_loss: 1.0060, test_loss: 1.0041, test_f1: 0.4547
 epoch: 67, train_loss: 1.0116, test_loss: 1.0090, test_f1: 0.4437
 epoch: 68, train_loss: 1.0058, test_loss: 1.0090, test_f1: 0.4478
 epoch: 69, train_loss: 1.0008, test_loss: 1.0096, test_f1: 0.4709
 epoch: 70, train_loss: 1.0086, test_loss: 1.0148, test_f1: 0.4375
 epoch: 71, train_loss: 0.9917, test_loss: 1.0108, test_f1: 0.4651
 epoch: 72, train_loss: 0.9978, test_loss: 1.0037, test_f1: 0.4491
 epoch: 73, train_loss: 1.0063, test_loss: 1.0234, test_f1: 0.4375
 epoch: 74, train_loss: 1.0014, test_loss: 1.0256, test_f1: 0.4314
 epoch: 75, train_loss: 0.9921, test_loss: 1.0159, test_f1: 0.4552
 epoch: 76, train_loss: 1.0009, test_loss: 1.0180, test_f1: 0.4466
 epoch: 77, train_loss: 0.9977, test_loss: 1.0161, test_f1: 0.4402
 epoch: 78, train_loss: 1.0017, test_loss: 1.0177, test_f1: 0.4486
 epoch: 79, train_loss: 1.0025, test_loss: 1.0271, test_f1: 0.4603
 epoch: 80, train_loss: 0.9937, test_loss: 1.0340, test_f1: 0.4404
 epoch: 81, train_loss: 1.0008, test_loss: 1.0060, test_f1: 0.4639
 epoch: 82, train_loss: 0.9907, test_loss: 1.0260, test_f1: 0.4319
 epoch: 83, train_loss: 0.9934, test_loss: 1.0384, test_f1: 0.4618
 epoch: 84, train_loss: 0.9890, test_loss: 1.0433, test_f1: 0.4433
 epoch: 85, train_loss: 0.9914, test_loss: 1.0245, test_f1: 0.4432
 epoch: 86, train_loss: 0.9841, test_loss: 1.0167, test_f1: 0.4393
 epoch: 87, train_loss: 0.9848, test_loss: 1.0626, test_f1: 0.4403
 epoch: 88, train_loss: 0.9912, test_loss: 1.0227, test_f1: 0.4508
 epoch: 89, train_loss: 0.9771, test_loss: 1.0069, test_f1: 0.4701
 epoch: 90, train_loss: 0.9875, test_loss: 1.0434, test_f1: 0.4652
 epoch: 91, train_loss: 0.9839, test_loss: 1.0173, test_f1: 0.4514
 epoch: 92, train_loss: 0.9839, test_loss: 1.0369, test_f1: 0.4486
 epoch: 93, train_loss: 0.9850, test_loss: 1.0185, test_f1: 0.4461
 epoch: 94, train_loss: 0.9858, test_loss: 1.0214, test_f1: 0.4532
 epoch: 95, train_loss: 0.9821, test_loss: 1.0199, test_f1: 0.4455
 epoch: 96, train_loss: 0.9741, test_loss: 1.0039, test_f1: 0.4742
 epoch: 97, train_loss: 0.9717, test_loss: 1.0010, test_f1: 0.4478
 epoch: 98, train_loss: 0.9668, test_loss: 1.0235, test_f1: 0.4659
 epoch: 99, train_loss: 0.9735, test_loss: 1.0180, test_f1: 0.4498
##################ITERATION #5 ****************************************
 epoch: 0, train_loss: 1.2951, test_loss: 1.2566, test_f1: 0.2510
 epoch: 1, train_loss: 1.2530, test_loss: 1.2439, test_f1: 0.2989
 epoch: 2, train_loss: 1.2395, test_loss: 1.2280, test_f1: 0.3220
 epoch: 3, train_loss: 1.2300, test_loss: 1.2094, test_f1: 0.3793
 epoch: 4, train_loss: 1.2307, test_loss: 1.1978, test_f1: 0.3989
 epoch: 5, train_loss: 1.2224, test_loss: 1.1891, test_f1: 0.4064
 epoch: 6, train_loss: 1.2152, test_loss: 1.1739, test_f1: 0.4093
 epoch: 7, train_loss: 1.2091, test_loss: 1.1750, test_f1: 0.3984
 epoch: 8, train_loss: 1.2078, test_loss: 1.1612, test_f1: 0.4238
 epoch: 9, train_loss: 1.2035, test_loss: 1.1581, test_f1: 0.4281
 epoch: 10, train_loss: 1.2054, test_loss: 1.1489, test_f1: 0.4330
 epoch: 11, train_loss: 1.1907, test_loss: 1.1408, test_f1: 0.4329
 epoch: 12, train_loss: 1.1822, test_loss: 1.1322, test_f1: 0.4294
 epoch: 13, train_loss: 1.1806, test_loss: 1.1278, test_f1: 0.4378
 epoch: 14, train_loss: 1.1816, test_loss: 1.1320, test_f1: 0.4329
 epoch: 15, train_loss: 1.1763, test_loss: 1.1170, test_f1: 0.4409
 epoch: 16, train_loss: 1.1729, test_loss: 1.1086, test_f1: 0.4515
 epoch: 17, train_loss: 1.1778, test_loss: 1.1076, test_f1: 0.4533
 epoch: 18, train_loss: 1.1646, test_loss: 1.1042, test_f1: 0.4537
 epoch: 19, train_loss: 1.1666, test_loss: 1.1013, test_f1: 0.4598
 epoch: 20, train_loss: 1.1556, test_loss: 1.0967, test_f1: 0.4642
 epoch: 21, train_loss: 1.1630, test_loss: 1.0938, test_f1: 0.4531
 epoch: 22, train_loss: 1.1550, test_loss: 1.0881, test_f1: 0.4740
 epoch: 23, train_loss: 1.1514, test_loss: 1.0868, test_f1: 0.4631
 epoch: 24, train_loss: 1.1422, test_loss: 1.0823, test_f1: 0.4753
 epoch: 25, train_loss: 1.1440, test_loss: 1.0846, test_f1: 0.4682
 epoch: 26, train_loss: 1.1323, test_loss: 1.0759, test_f1: 0.4804
 epoch: 27, train_loss: 1.1387, test_loss: 1.0805, test_f1: 0.4577
 epoch: 28, train_loss: 1.1444, test_loss: 1.0731, test_f1: 0.4654
 epoch: 29, train_loss: 1.1504, test_loss: 1.0624, test_f1: 0.4769
 epoch: 30, train_loss: 1.1292, test_loss: 1.0596, test_f1: 0.4558
 epoch: 31, train_loss: 1.1229, test_loss: 1.0555, test_f1: 0.4727
 epoch: 32, train_loss: 1.1158, test_loss: 1.0651, test_f1: 0.4593
 epoch: 33, train_loss: 1.1211, test_loss: 1.0555, test_f1: 0.4737
 epoch: 34, train_loss: 1.1153, test_loss: 1.0555, test_f1: 0.4643
 epoch: 35, train_loss: 1.1065, test_loss: 1.0558, test_f1: 0.4602
 epoch: 36, train_loss: 1.1078, test_loss: 1.0488, test_f1: 0.4620
 epoch: 37, train_loss: 1.1091, test_loss: 1.0423, test_f1: 0.4743
 epoch: 38, train_loss: 1.1119, test_loss: 1.0463, test_f1: 0.4585
 epoch: 39, train_loss: 1.1105, test_loss: 1.0411, test_f1: 0.4799
 epoch: 40, train_loss: 1.1074, test_loss: 1.0396, test_f1: 0.4842
 epoch: 41, train_loss: 1.1111, test_loss: 1.0299, test_f1: 0.4745
 epoch: 42, train_loss: 1.0916, test_loss: 1.0259, test_f1: 0.4858
 epoch: 43, train_loss: 1.0908, test_loss: 1.0280, test_f1: 0.4827
 epoch: 44, train_loss: 1.1048, test_loss: 1.0266, test_f1: 0.4866
 epoch: 45, train_loss: 1.0909, test_loss: 1.0175, test_f1: 0.4692
 epoch: 46, train_loss: 1.0845, test_loss: 1.0211, test_f1: 0.4746
 epoch: 47, train_loss: 1.0835, test_loss: 1.0185, test_f1: 0.4739
 epoch: 48, train_loss: 1.0846, test_loss: 1.0132, test_f1: 0.4710
 epoch: 49, train_loss: 1.0820, test_loss: 1.0244, test_f1: 0.4795
 epoch: 50, train_loss: 1.0755, test_loss: 1.0080, test_f1: 0.4794
 epoch: 51, train_loss: 1.0656, test_loss: 1.0110, test_f1: 0.4842
 epoch: 52, train_loss: 1.0650, test_loss: 1.0121, test_f1: 0.4834
 epoch: 53, train_loss: 1.0712, test_loss: 1.0008, test_f1: 0.4790
 epoch: 54, train_loss: 1.0728, test_loss: 1.0063, test_f1: 0.4816
 epoch: 55, train_loss: 1.0709, test_loss: 1.0012, test_f1: 0.4830
 epoch: 56, train_loss: 1.0649, test_loss: 1.0073, test_f1: 0.4829
 epoch: 57, train_loss: 1.0599, test_loss: 1.0040, test_f1: 0.4769
 epoch: 58, train_loss: 1.0659, test_loss: 1.0025, test_f1: 0.4808
 epoch: 59, train_loss: 1.0679, test_loss: 0.9952, test_f1: 0.4847
 epoch: 60, train_loss: 1.0585, test_loss: 1.0006, test_f1: 0.4803
 epoch: 61, train_loss: 1.0660, test_loss: 0.9959, test_f1: 0.4783
 epoch: 62, train_loss: 1.0642, test_loss: 1.0097, test_f1: 0.4758
 epoch: 63, train_loss: 1.0610, test_loss: 1.0005, test_f1: 0.4834
 epoch: 64, train_loss: 1.0532, test_loss: 0.9907, test_f1: 0.4819
 epoch: 65, train_loss: 1.0555, test_loss: 0.9913, test_f1: 0.4877
 epoch: 66, train_loss: 1.0580, test_loss: 0.9960, test_f1: 0.4802
 epoch: 67, train_loss: 1.0564, test_loss: 0.9841, test_f1: 0.4887
 epoch: 68, train_loss: 1.0501, test_loss: 0.9875, test_f1: 0.4706
 epoch: 69, train_loss: 1.0543, test_loss: 0.9916, test_f1: 0.4864
 epoch: 70, train_loss: 1.0468, test_loss: 0.9854, test_f1: 0.4826
 epoch: 71, train_loss: 1.0526, test_loss: 0.9890, test_f1: 0.4885
 epoch: 72, train_loss: 1.0465, test_loss: 0.9912, test_f1: 0.4805
 epoch: 73, train_loss: 1.0435, test_loss: 0.9877, test_f1: 0.4855
 epoch: 74, train_loss: 1.0437, test_loss: 0.9863, test_f1: 0.4854
 epoch: 75, train_loss: 1.0484, test_loss: 0.9782, test_f1: 0.4950
 epoch: 76, train_loss: 1.0473, test_loss: 0.9804, test_f1: 0.4929
 epoch: 77, train_loss: 1.0430, test_loss: 0.9901, test_f1: 0.4857
 epoch: 78, train_loss: 1.0421, test_loss: 0.9879, test_f1: 0.4804
 epoch: 79, train_loss: 1.0406, test_loss: 0.9833, test_f1: 0.4948
 epoch: 80, train_loss: 1.0367, test_loss: 0.9864, test_f1: 0.4823
 epoch: 81, train_loss: 1.0498, test_loss: 0.9913, test_f1: 0.4854
 epoch: 82, train_loss: 1.0418, test_loss: 0.9769, test_f1: 0.4885
 epoch: 83, train_loss: 1.0395, test_loss: 0.9916, test_f1: 0.4873
 epoch: 84, train_loss: 1.0269, test_loss: 0.9748, test_f1: 0.4945
 epoch: 85, train_loss: 1.0268, test_loss: 0.9941, test_f1: 0.4864
 epoch: 86, train_loss: 1.0269, test_loss: 0.9815, test_f1: 0.4778
 epoch: 87, train_loss: 1.0327, test_loss: 0.9816, test_f1: 0.4798
 epoch: 88, train_loss: 1.0286, test_loss: 0.9691, test_f1: 0.4985
 epoch: 89, train_loss: 1.0274, test_loss: 0.9721, test_f1: 0.4927
 epoch: 90, train_loss: 1.0316, test_loss: 0.9786, test_f1: 0.4930
 epoch: 91, train_loss: 1.0339, test_loss: 0.9747, test_f1: 0.4711
 epoch: 92, train_loss: 1.0374, test_loss: 0.9627, test_f1: 0.4994
 epoch: 93, train_loss: 1.0321, test_loss: 0.9705, test_f1: 0.4868
 epoch: 94, train_loss: 1.0263, test_loss: 0.9651, test_f1: 0.4958
 epoch: 95, train_loss: 1.0077, test_loss: 0.9753, test_f1: 0.4897
 epoch: 96, train_loss: 1.0365, test_loss: 0.9754, test_f1: 0.5038
 epoch: 97, train_loss: 1.0195, test_loss: 0.9633, test_f1: 0.5007
 epoch: 98, train_loss: 1.0235, test_loss: 0.9671, test_f1: 0.4942
 epoch: 99, train_loss: 1.0214, test_loss: 0.9773, test_f1: 0.4944
##################ITERATION #6 ****************************************
 epoch: 0, train_loss: 1.3111, test_loss: 1.2372, test_f1: 0.2543
 epoch: 1, train_loss: 1.2596, test_loss: 1.2134, test_f1: 0.2588
 epoch: 2, train_loss: 1.2457, test_loss: 1.2037, test_f1: 0.2930
 epoch: 3, train_loss: 1.2425, test_loss: 1.1951, test_f1: 0.3334
 epoch: 4, train_loss: 1.2370, test_loss: 1.1863, test_f1: 0.3775
 epoch: 5, train_loss: 1.2214, test_loss: 1.1770, test_f1: 0.4050
 epoch: 6, train_loss: 1.2157, test_loss: 1.1705, test_f1: 0.3799
 epoch: 7, train_loss: 1.2037, test_loss: 1.1664, test_f1: 0.4330
 epoch: 8, train_loss: 1.1978, test_loss: 1.1596, test_f1: 0.4188
 epoch: 9, train_loss: 1.1839, test_loss: 1.1477, test_f1: 0.4325
 epoch: 10, train_loss: 1.1928, test_loss: 1.1467, test_f1: 0.4105
 epoch: 11, train_loss: 1.1905, test_loss: 1.1444, test_f1: 0.4323
 epoch: 12, train_loss: 1.1772, test_loss: 1.1396, test_f1: 0.4527
 epoch: 13, train_loss: 1.1804, test_loss: 1.1313, test_f1: 0.4442
 epoch: 14, train_loss: 1.1761, test_loss: 1.1344, test_f1: 0.4386
 epoch: 15, train_loss: 1.1710, test_loss: 1.1264, test_f1: 0.4383
 epoch: 16, train_loss: 1.1602, test_loss: 1.1227, test_f1: 0.4343
 epoch: 17, train_loss: 1.1634, test_loss: 1.1250, test_f1: 0.4310
 epoch: 18, train_loss: 1.1478, test_loss: 1.1173, test_f1: 0.4446
 epoch: 19, train_loss: 1.1510, test_loss: 1.1071, test_f1: 0.4443
 epoch: 20, train_loss: 1.1541, test_loss: 1.1096, test_f1: 0.4262
 epoch: 21, train_loss: 1.1480, test_loss: 1.1034, test_f1: 0.4301
 epoch: 22, train_loss: 1.1465, test_loss: 1.1005, test_f1: 0.4334
 epoch: 23, train_loss: 1.1414, test_loss: 1.0933, test_f1: 0.4327
 epoch: 24, train_loss: 1.1395, test_loss: 1.1048, test_f1: 0.4381
 epoch: 25, train_loss: 1.1439, test_loss: 1.0968, test_f1: 0.4367
 epoch: 26, train_loss: 1.1358, test_loss: 1.0908, test_f1: 0.4495
 epoch: 27, train_loss: 1.1278, test_loss: 1.0897, test_f1: 0.4384
 epoch: 28, train_loss: 1.1327, test_loss: 1.0839, test_f1: 0.4409
 epoch: 29, train_loss: 1.1270, test_loss: 1.0873, test_f1: 0.4374
 epoch: 30, train_loss: 1.1182, test_loss: 1.0842, test_f1: 0.4286
 epoch: 31, train_loss: 1.1146, test_loss: 1.0796, test_f1: 0.4648
 epoch: 32, train_loss: 1.1259, test_loss: 1.0841, test_f1: 0.4539
 epoch: 33, train_loss: 1.1153, test_loss: 1.0753, test_f1: 0.4383
 epoch: 34, train_loss: 1.1074, test_loss: 1.0674, test_f1: 0.4358
 epoch: 35, train_loss: 1.1183, test_loss: 1.0531, test_f1: 0.4799
 epoch: 36, train_loss: 1.1068, test_loss: 1.0639, test_f1: 0.4597
 epoch: 37, train_loss: 1.1042, test_loss: 1.0634, test_f1: 0.4551
 epoch: 38, train_loss: 1.1036, test_loss: 1.0518, test_f1: 0.4520
 epoch: 39, train_loss: 1.0989, test_loss: 1.0509, test_f1: 0.4788
 epoch: 40, train_loss: 1.0937, test_loss: 1.0523, test_f1: 0.4758
 epoch: 41, train_loss: 1.1029, test_loss: 1.0575, test_f1: 0.4736
 epoch: 42, train_loss: 1.0946, test_loss: 1.0527, test_f1: 0.4681
 epoch: 43, train_loss: 1.0891, test_loss: 1.0477, test_f1: 0.4589
 epoch: 44, train_loss: 1.0946, test_loss: 1.0404, test_f1: 0.4468
 epoch: 45, train_loss: 1.0905, test_loss: 1.0524, test_f1: 0.4690
 epoch: 46, train_loss: 1.0812, test_loss: 1.0334, test_f1: 0.4686
 epoch: 47, train_loss: 1.0810, test_loss: 1.0262, test_f1: 0.4726
 epoch: 48, train_loss: 1.0716, test_loss: 1.0254, test_f1: 0.4838
 epoch: 49, train_loss: 1.0704, test_loss: 1.0206, test_f1: 0.4728
 epoch: 50, train_loss: 1.0699, test_loss: 1.0294, test_f1: 0.4710
 epoch: 51, train_loss: 1.0717, test_loss: 1.0251, test_f1: 0.4790
 epoch: 52, train_loss: 1.0720, test_loss: 1.0373, test_f1: 0.4717
 epoch: 53, train_loss: 1.0616, test_loss: 1.0078, test_f1: 0.4761
 epoch: 54, train_loss: 1.0602, test_loss: 1.0322, test_f1: 0.4884
 epoch: 55, train_loss: 1.0597, test_loss: 1.0219, test_f1: 0.4860
 epoch: 56, train_loss: 1.0639, test_loss: 1.0165, test_f1: 0.4765
 epoch: 57, train_loss: 1.0574, test_loss: 1.0170, test_f1: 0.4768
 epoch: 58, train_loss: 1.0604, test_loss: 1.0017, test_f1: 0.4777
 epoch: 59, train_loss: 1.0646, test_loss: 1.0073, test_f1: 0.4796
 epoch: 60, train_loss: 1.0563, test_loss: 1.0099, test_f1: 0.4759
 epoch: 61, train_loss: 1.0578, test_loss: 1.0155, test_f1: 0.4625
 epoch: 62, train_loss: 1.0574, test_loss: 0.9981, test_f1: 0.4930
 epoch: 63, train_loss: 1.0504, test_loss: 1.0053, test_f1: 0.5014
 epoch: 64, train_loss: 1.0577, test_loss: 1.0115, test_f1: 0.4735
 epoch: 65, train_loss: 1.0501, test_loss: 1.0179, test_f1: 0.4819
 epoch: 66, train_loss: 1.0483, test_loss: 1.0033, test_f1: 0.4856
 epoch: 67, train_loss: 1.0546, test_loss: 1.0014, test_f1: 0.4886
 epoch: 68, train_loss: 1.0479, test_loss: 1.0029, test_f1: 0.4900
 epoch: 69, train_loss: 1.0419, test_loss: 1.0010, test_f1: 0.4805
 epoch: 70, train_loss: 1.0545, test_loss: 1.0153, test_f1: 0.4876
 epoch: 71, train_loss: 1.0398, test_loss: 1.0245, test_f1: 0.4864
 epoch: 72, train_loss: 1.0495, test_loss: 1.0087, test_f1: 0.4941
 epoch: 73, train_loss: 1.0459, test_loss: 1.0063, test_f1: 0.4919
 epoch: 74, train_loss: 1.0433, test_loss: 1.0261, test_f1: 0.4771
 epoch: 75, train_loss: 1.0526, test_loss: 0.9941, test_f1: 0.4821
 epoch: 76, train_loss: 1.0439, test_loss: 0.9935, test_f1: 0.4837
 epoch: 77, train_loss: 1.0460, test_loss: 1.0060, test_f1: 0.4840
 epoch: 78, train_loss: 1.0385, test_loss: 0.9992, test_f1: 0.4832
 epoch: 79, train_loss: 1.0415, test_loss: 0.9996, test_f1: 0.4887
 epoch: 80, train_loss: 1.0354, test_loss: 0.9880, test_f1: 0.4852
 epoch: 81, train_loss: 1.0379, test_loss: 0.9930, test_f1: 0.4807
 epoch: 82, train_loss: 1.0358, test_loss: 0.9953, test_f1: 0.4805
 epoch: 83, train_loss: 1.0323, test_loss: 1.0087, test_f1: 0.4850
 epoch: 84, train_loss: 1.0396, test_loss: 0.9974, test_f1: 0.4828
 epoch: 85, train_loss: 1.0490, test_loss: 1.0009, test_f1: 0.4826
 epoch: 86, train_loss: 1.0336, test_loss: 0.9924, test_f1: 0.4845
 epoch: 87, train_loss: 1.0340, test_loss: 0.9958, test_f1: 0.4919
 epoch: 88, train_loss: 1.0330, test_loss: 0.9968, test_f1: 0.5052
 epoch: 89, train_loss: 1.0302, test_loss: 0.9947, test_f1: 0.4745
 epoch: 90, train_loss: 1.0298, test_loss: 0.9973, test_f1: 0.4872
 epoch: 91, train_loss: 1.0251, test_loss: 0.9923, test_f1: 0.4931
 epoch: 92, train_loss: 1.0361, test_loss: 1.0016, test_f1: 0.4844
 epoch: 93, train_loss: 1.0296, test_loss: 0.9941, test_f1: 0.4863
 epoch: 94, train_loss: 1.0289, test_loss: 0.9960, test_f1: 0.4904
 epoch: 95, train_loss: 1.0226, test_loss: 0.9994, test_f1: 0.4730
 epoch: 96, train_loss: 1.0271, test_loss: 0.9913, test_f1: 0.4811
 epoch: 97, train_loss: 1.0205, test_loss: 0.9956, test_f1: 0.4980
 epoch: 98, train_loss: 1.0202, test_loss: 0.9872, test_f1: 0.4839
 epoch: 99, train_loss: 1.0224, test_loss: 1.0084, test_f1: 0.4798
##################ITERATION #7 ****************************************
 epoch: 0, train_loss: 1.3285, test_loss: 1.3544, test_f1: 0.2765
 epoch: 1, train_loss: 1.2836, test_loss: 1.2995, test_f1: 0.2855
 epoch: 2, train_loss: 1.2670, test_loss: 1.2610, test_f1: 0.2903
 epoch: 3, train_loss: 1.2549, test_loss: 1.3402, test_f1: 0.3054
 epoch: 4, train_loss: 1.2494, test_loss: 1.3050, test_f1: 0.3191
 epoch: 5, train_loss: 1.2384, test_loss: 1.2192, test_f1: 0.3445
 epoch: 6, train_loss: 1.2364, test_loss: 1.2878, test_f1: 0.3453
 epoch: 7, train_loss: 1.2318, test_loss: 1.2233, test_f1: 0.3627
 epoch: 8, train_loss: 1.2200, test_loss: 1.2371, test_f1: 0.3408
 epoch: 9, train_loss: 1.2181, test_loss: 1.2012, test_f1: 0.3638
 epoch: 10, train_loss: 1.2148, test_loss: 1.2007, test_f1: 0.3579
 epoch: 11, train_loss: 1.2081, test_loss: 1.1648, test_f1: 0.3994
 epoch: 12, train_loss: 1.1964, test_loss: 1.2413, test_f1: 0.4078
 epoch: 13, train_loss: 1.1925, test_loss: 1.1737, test_f1: 0.3993
 epoch: 14, train_loss: 1.1939, test_loss: 1.3387, test_f1: 0.4115
 epoch: 15, train_loss: 1.1975, test_loss: 1.1480, test_f1: 0.4189
 epoch: 16, train_loss: 1.1779, test_loss: 1.1350, test_f1: 0.4300
 epoch: 17, train_loss: 1.1727, test_loss: 1.2114, test_f1: 0.4036
 epoch: 18, train_loss: 1.1771, test_loss: 1.1340, test_f1: 0.4419
 epoch: 19, train_loss: 1.1758, test_loss: 1.1595, test_f1: 0.4506
 epoch: 20, train_loss: 1.1669, test_loss: 1.1361, test_f1: 0.4314
 epoch: 21, train_loss: 1.1572, test_loss: 1.1220, test_f1: 0.4319
 epoch: 22, train_loss: 1.1659, test_loss: 1.1158, test_f1: 0.4361
 epoch: 23, train_loss: 1.1548, test_loss: 1.1560, test_f1: 0.4330
 epoch: 24, train_loss: 1.1476, test_loss: 1.1175, test_f1: 0.4557
 epoch: 25, train_loss: 1.1375, test_loss: 1.1075, test_f1: 0.4499
 epoch: 26, train_loss: 1.1527, test_loss: 1.1077, test_f1: 0.4224
 epoch: 27, train_loss: 1.1333, test_loss: 1.1198, test_f1: 0.4225
 epoch: 28, train_loss: 1.1290, test_loss: 1.0956, test_f1: 0.4414
 epoch: 29, train_loss: 1.1245, test_loss: 1.1064, test_f1: 0.4411
 epoch: 30, train_loss: 1.1304, test_loss: 1.0826, test_f1: 0.4270
 epoch: 31, train_loss: 1.1281, test_loss: 1.0816, test_f1: 0.4469
 epoch: 32, train_loss: 1.1152, test_loss: 1.0821, test_f1: 0.4537
 epoch: 33, train_loss: 1.1198, test_loss: 1.1079, test_f1: 0.4523
 epoch: 34, train_loss: 1.1124, test_loss: 1.0802, test_f1: 0.4626
 epoch: 35, train_loss: 1.1116, test_loss: 1.0884, test_f1: 0.4516
 epoch: 36, train_loss: 1.1048, test_loss: 1.1074, test_f1: 0.4503
 epoch: 37, train_loss: 1.1048, test_loss: 1.0921, test_f1: 0.4511
 epoch: 38, train_loss: 1.1060, test_loss: 1.1060, test_f1: 0.4518
 epoch: 39, train_loss: 1.1083, test_loss: 1.0980, test_f1: 0.4573
 epoch: 40, train_loss: 1.1012, test_loss: 1.0722, test_f1: 0.4536
 epoch: 41, train_loss: 1.0958, test_loss: 1.1305, test_f1: 0.4541
 epoch: 42, train_loss: 1.1030, test_loss: 1.0865, test_f1: 0.4587
 epoch: 43, train_loss: 1.0964, test_loss: 1.0733, test_f1: 0.4664
 epoch: 44, train_loss: 1.0923, test_loss: 1.0722, test_f1: 0.4579
 epoch: 45, train_loss: 1.0824, test_loss: 1.0604, test_f1: 0.4593
 epoch: 46, train_loss: 1.0832, test_loss: 1.0672, test_f1: 0.4636
 epoch: 47, train_loss: 1.0911, test_loss: 1.0636, test_f1: 0.4538
 epoch: 48, train_loss: 1.0888, test_loss: 1.0476, test_f1: 0.4621
 epoch: 49, train_loss: 1.0781, test_loss: 1.0965, test_f1: 0.4426
 epoch: 50, train_loss: 1.0745, test_loss: 1.0935, test_f1: 0.4475
 epoch: 51, train_loss: 1.0761, test_loss: 1.0674, test_f1: 0.4616
 epoch: 52, train_loss: 1.0757, test_loss: 1.1824, test_f1: 0.4471
 epoch: 53, train_loss: 1.0742, test_loss: 1.1250, test_f1: 0.4664
 epoch: 54, train_loss: 1.0818, test_loss: 1.0652, test_f1: 0.4619
 epoch: 55, train_loss: 1.0665, test_loss: 1.1000, test_f1: 0.4643
 epoch: 56, train_loss: 1.0746, test_loss: 1.0498, test_f1: 0.4615
 epoch: 57, train_loss: 1.0715, test_loss: 1.0958, test_f1: 0.4617
 epoch: 58, train_loss: 1.0559, test_loss: 1.1425, test_f1: 0.4542
 epoch: 59, train_loss: 1.0612, test_loss: 1.0612, test_f1: 0.4614
 epoch: 60, train_loss: 1.0587, test_loss: 1.0581, test_f1: 0.4443
 epoch: 61, train_loss: 1.0540, test_loss: 1.0565, test_f1: 0.4510
 epoch: 62, train_loss: 1.0535, test_loss: 1.0620, test_f1: 0.4575
 epoch: 63, train_loss: 1.0549, test_loss: 1.0617, test_f1: 0.4579
 epoch: 64, train_loss: 1.0577, test_loss: 1.0658, test_f1: 0.4640
 epoch: 65, train_loss: 1.0599, test_loss: 1.0930, test_f1: 0.4436
 epoch: 66, train_loss: 1.0513, test_loss: 1.0729, test_f1: 0.4555
 epoch: 67, train_loss: 1.0540, test_loss: 1.1448, test_f1: 0.4646
 epoch: 68, train_loss: 1.0566, test_loss: 1.0595, test_f1: 0.4655
 epoch: 69, train_loss: 1.0520, test_loss: 1.0648, test_f1: 0.4548
 epoch: 70, train_loss: 1.0581, test_loss: 1.0377, test_f1: 0.4716
 epoch: 71, train_loss: 1.0473, test_loss: 1.0345, test_f1: 0.4436
 epoch: 72, train_loss: 1.0438, test_loss: 1.0490, test_f1: 0.4746
 epoch: 73, train_loss: 1.0452, test_loss: 1.1342, test_f1: 0.4765
 epoch: 74, train_loss: 1.0448, test_loss: 1.1048, test_f1: 0.4568
 epoch: 75, train_loss: 1.0467, test_loss: 1.0592, test_f1: 0.4587
 epoch: 76, train_loss: 1.0390, test_loss: 1.0955, test_f1: 0.4645
 epoch: 77, train_loss: 1.0485, test_loss: 1.0571, test_f1: 0.4730
 epoch: 78, train_loss: 1.0326, test_loss: 1.0245, test_f1: 0.4582
 epoch: 79, train_loss: 1.0407, test_loss: 1.0611, test_f1: 0.4511
 epoch: 80, train_loss: 1.0312, test_loss: 1.0321, test_f1: 0.4679
 epoch: 81, train_loss: 1.0379, test_loss: 1.0368, test_f1: 0.4693
 epoch: 82, train_loss: 1.0543, test_loss: 1.0520, test_f1: 0.4742
 epoch: 83, train_loss: 1.0393, test_loss: 1.0214, test_f1: 0.4652
 epoch: 84, train_loss: 1.0334, test_loss: 1.0651, test_f1: 0.4855
 epoch: 85, train_loss: 1.0369, test_loss: 1.0821, test_f1: 0.4619
 epoch: 86, train_loss: 1.0320, test_loss: 1.0375, test_f1: 0.4741
 epoch: 87, train_loss: 1.0364, test_loss: 1.0548, test_f1: 0.4591
 epoch: 88, train_loss: 1.0336, test_loss: 1.0274, test_f1: 0.4729
 epoch: 89, train_loss: 1.0289, test_loss: 1.0324, test_f1: 0.4791
 epoch: 90, train_loss: 1.0391, test_loss: 1.0336, test_f1: 0.4729
 epoch: 91, train_loss: 1.0271, test_loss: 1.0932, test_f1: 0.4782
 epoch: 92, train_loss: 1.0220, test_loss: 1.2226, test_f1: 0.4718
 epoch: 93, train_loss: 1.0254, test_loss: 1.0428, test_f1: 0.4784
 epoch: 94, train_loss: 1.0346, test_loss: 1.0711, test_f1: 0.4841
 epoch: 95, train_loss: 1.0377, test_loss: 1.1329, test_f1: 0.4682
 epoch: 96, train_loss: 1.0244, test_loss: 1.0366, test_f1: 0.4720
 epoch: 97, train_loss: 1.0326, test_loss: 1.0400, test_f1: 0.4826
 epoch: 98, train_loss: 1.0202, test_loss: 1.0431, test_f1: 0.4790
 epoch: 99, train_loss: 1.0286, test_loss: 1.0456, test_f1: 0.4818
##################ITERATION #8 ****************************************
 epoch: 0, train_loss: 1.2991, test_loss: 1.2575, test_f1: 0.2931
 epoch: 1, train_loss: 1.2568, test_loss: 1.2299, test_f1: 0.3494
 epoch: 2, train_loss: 1.2485, test_loss: 1.2144, test_f1: 0.3295
 epoch: 3, train_loss: 1.2368, test_loss: 1.2037, test_f1: 0.3467
 epoch: 4, train_loss: 1.2218, test_loss: 1.1871, test_f1: 0.3682
 epoch: 5, train_loss: 1.2068, test_loss: 1.1861, test_f1: 0.3971
 epoch: 6, train_loss: 1.2097, test_loss: 1.1655, test_f1: 0.4223
 epoch: 7, train_loss: 1.2047, test_loss: 1.1564, test_f1: 0.4341
 epoch: 8, train_loss: 1.1926, test_loss: 1.1480, test_f1: 0.4335
 epoch: 9, train_loss: 1.1864, test_loss: 1.1426, test_f1: 0.4370
 epoch: 10, train_loss: 1.1809, test_loss: 1.1245, test_f1: 0.4552
 epoch: 11, train_loss: 1.1757, test_loss: 1.1216, test_f1: 0.4423
 epoch: 12, train_loss: 1.1602, test_loss: 1.1131, test_f1: 0.4378
 epoch: 13, train_loss: 1.1536, test_loss: 1.1052, test_f1: 0.4717
 epoch: 14, train_loss: 1.1483, test_loss: 1.0962, test_f1: 0.4460
 epoch: 15, train_loss: 1.1444, test_loss: 1.0986, test_f1: 0.4572
 epoch: 16, train_loss: 1.1394, test_loss: 1.0944, test_f1: 0.4572
 epoch: 17, train_loss: 1.1347, test_loss: 1.0911, test_f1: 0.4474
 epoch: 18, train_loss: 1.1335, test_loss: 1.0837, test_f1: 0.4490
 epoch: 19, train_loss: 1.1318, test_loss: 1.0794, test_f1: 0.4563
 epoch: 20, train_loss: 1.1192, test_loss: 1.0752, test_f1: 0.4477
 epoch: 21, train_loss: 1.1212, test_loss: 1.0653, test_f1: 0.4739
 epoch: 22, train_loss: 1.1130, test_loss: 1.0711, test_f1: 0.4542
 epoch: 23, train_loss: 1.1132, test_loss: 1.0665, test_f1: 0.4475
 epoch: 24, train_loss: 1.1082, test_loss: 1.0597, test_f1: 0.4515
 epoch: 25, train_loss: 1.0991, test_loss: 1.0592, test_f1: 0.4472
 epoch: 26, train_loss: 1.1021, test_loss: 1.0478, test_f1: 0.4521
 epoch: 27, train_loss: 1.0946, test_loss: 1.0395, test_f1: 0.4719
 epoch: 28, train_loss: 1.0973, test_loss: 1.0383, test_f1: 0.4572
 epoch: 29, train_loss: 1.0868, test_loss: 1.0382, test_f1: 0.4667
 epoch: 30, train_loss: 1.0845, test_loss: 1.0382, test_f1: 0.4499
 epoch: 31, train_loss: 1.0828, test_loss: 1.0326, test_f1: 0.4632
 epoch: 32, train_loss: 1.0746, test_loss: 1.0239, test_f1: 0.4598
 epoch: 33, train_loss: 1.0667, test_loss: 1.0174, test_f1: 0.4776
 epoch: 34, train_loss: 1.0708, test_loss: 1.0122, test_f1: 0.4916
 epoch: 35, train_loss: 1.0733, test_loss: 1.0050, test_f1: 0.5025
 epoch: 36, train_loss: 1.0570, test_loss: 1.0158, test_f1: 0.4826
 epoch: 37, train_loss: 1.0665, test_loss: 1.0091, test_f1: 0.4806
 epoch: 38, train_loss: 1.0647, test_loss: 1.0172, test_f1: 0.4715
 epoch: 39, train_loss: 1.0580, test_loss: 1.0100, test_f1: 0.4689
 epoch: 40, train_loss: 1.0589, test_loss: 1.0161, test_f1: 0.4475
 epoch: 41, train_loss: 1.0539, test_loss: 0.9916, test_f1: 0.4788
 epoch: 42, train_loss: 1.0487, test_loss: 1.0082, test_f1: 0.4683
 epoch: 43, train_loss: 1.0571, test_loss: 0.9972, test_f1: 0.4706
 epoch: 44, train_loss: 1.0453, test_loss: 1.0145, test_f1: 0.4762
 epoch: 45, train_loss: 1.0434, test_loss: 1.0112, test_f1: 0.4750
 epoch: 46, train_loss: 1.0411, test_loss: 0.9940, test_f1: 0.4774
 epoch: 47, train_loss: 1.0342, test_loss: 1.0031, test_f1: 0.4649
 epoch: 48, train_loss: 1.0345, test_loss: 1.0066, test_f1: 0.4701
 epoch: 49, train_loss: 1.0227, test_loss: 0.9866, test_f1: 0.4909
 epoch: 50, train_loss: 1.0327, test_loss: 1.0133, test_f1: 0.4636
 epoch: 51, train_loss: 1.0229, test_loss: 0.9878, test_f1: 0.4814
 epoch: 52, train_loss: 1.0217, test_loss: 0.9912, test_f1: 0.4781
 epoch: 53, train_loss: 1.0297, test_loss: 0.9849, test_f1: 0.4807
 epoch: 54, train_loss: 1.0166, test_loss: 1.0088, test_f1: 0.4678
 epoch: 55, train_loss: 1.0289, test_loss: 0.9784, test_f1: 0.4850
 epoch: 56, train_loss: 1.0162, test_loss: 0.9882, test_f1: 0.4661
 epoch: 57, train_loss: 1.0168, test_loss: 0.9716, test_f1: 0.4755
 epoch: 58, train_loss: 1.0149, test_loss: 1.0078, test_f1: 0.4709
 epoch: 59, train_loss: 0.9992, test_loss: 0.9728, test_f1: 0.4772
 epoch: 60, train_loss: 1.0118, test_loss: 0.9974, test_f1: 0.4655
 epoch: 61, train_loss: 1.0114, test_loss: 0.9860, test_f1: 0.4785
 epoch: 62, train_loss: 1.0070, test_loss: 0.9846, test_f1: 0.4736
 epoch: 63, train_loss: 1.0175, test_loss: 0.9934, test_f1: 0.4583
 epoch: 64, train_loss: 1.0166, test_loss: 0.9845, test_f1: 0.4768
 epoch: 65, train_loss: 1.0125, test_loss: 0.9874, test_f1: 0.4662
 epoch: 66, train_loss: 1.0048, test_loss: 0.9661, test_f1: 0.4809
 epoch: 67, train_loss: 1.0075, test_loss: 0.9775, test_f1: 0.4752
 epoch: 68, train_loss: 1.0020, test_loss: 0.9809, test_f1: 0.4798
 epoch: 69, train_loss: 1.0011, test_loss: 0.9765, test_f1: 0.4627
 epoch: 70, train_loss: 1.0102, test_loss: 0.9711, test_f1: 0.4818
 epoch: 71, train_loss: 1.0035, test_loss: 0.9852, test_f1: 0.4701
 epoch: 72, train_loss: 1.0029, test_loss: 0.9965, test_f1: 0.4760
 epoch: 73, train_loss: 1.0018, test_loss: 0.9857, test_f1: 0.4686
 epoch: 74, train_loss: 1.0066, test_loss: 0.9817, test_f1: 0.4784
 epoch: 75, train_loss: 1.0023, test_loss: 0.9725, test_f1: 0.4847
 epoch: 76, train_loss: 1.0027, test_loss: 0.9734, test_f1: 0.4743
 epoch: 77, train_loss: 0.9914, test_loss: 0.9696, test_f1: 0.4776
 epoch: 78, train_loss: 0.9994, test_loss: 0.9798, test_f1: 0.4886
 epoch: 79, train_loss: 0.9940, test_loss: 0.9858, test_f1: 0.4794
 epoch: 80, train_loss: 1.0019, test_loss: 0.9919, test_f1: 0.4775
 epoch: 81, train_loss: 0.9909, test_loss: 0.9744, test_f1: 0.4781
 epoch: 82, train_loss: 0.9924, test_loss: 0.9883, test_f1: 0.4730
 epoch: 83, train_loss: 0.9836, test_loss: 0.9766, test_f1: 0.4736
 epoch: 84, train_loss: 0.9904, test_loss: 0.9768, test_f1: 0.4801
 epoch: 85, train_loss: 0.9913, test_loss: 0.9802, test_f1: 0.4813
 epoch: 86, train_loss: 0.9806, test_loss: 0.9816, test_f1: 0.4589
 epoch: 87, train_loss: 0.9890, test_loss: 1.0084, test_f1: 0.4479
 epoch: 88, train_loss: 0.9781, test_loss: 1.0007, test_f1: 0.4717
 epoch: 89, train_loss: 0.9833, test_loss: 0.9809, test_f1: 0.4783
 epoch: 90, train_loss: 0.9896, test_loss: 0.9896, test_f1: 0.4691
 epoch: 91, train_loss: 0.9885, test_loss: 0.9996, test_f1: 0.4712
 epoch: 92, train_loss: 0.9880, test_loss: 0.9775, test_f1: 0.4660
 epoch: 93, train_loss: 0.9806, test_loss: 0.9761, test_f1: 0.4794
 epoch: 94, train_loss: 0.9831, test_loss: 0.9807, test_f1: 0.4644
 epoch: 95, train_loss: 0.9818, test_loss: 0.9776, test_f1: 0.4581
 epoch: 96, train_loss: 0.9818, test_loss: 0.9806, test_f1: 0.4659
 epoch: 97, train_loss: 0.9698, test_loss: 1.0006, test_f1: 0.4677
 epoch: 98, train_loss: 0.9699, test_loss: 1.0021, test_f1: 0.4600
 epoch: 99, train_loss: 0.9879, test_loss: 1.0223, test_f1: 0.4514
##################ITERATION #9 ****************************************
 epoch: 0, train_loss: 1.3501, test_loss: 1.2673, test_f1: 0.2669
 epoch: 1, train_loss: 1.2698, test_loss: 1.2286, test_f1: 0.3298
 epoch: 2, train_loss: 1.2508, test_loss: 1.2233, test_f1: 0.3791
 epoch: 3, train_loss: 1.2414, test_loss: 1.2144, test_f1: 0.3638
 epoch: 4, train_loss: 1.2268, test_loss: 1.1954, test_f1: 0.3790
 epoch: 5, train_loss: 1.2250, test_loss: 1.1845, test_f1: 0.3921
 epoch: 6, train_loss: 1.2126, test_loss: 1.1710, test_f1: 0.3949
 epoch: 7, train_loss: 1.2077, test_loss: 1.1651, test_f1: 0.4032
 epoch: 8, train_loss: 1.2013, test_loss: 1.1571, test_f1: 0.4035
 epoch: 9, train_loss: 1.1983, test_loss: 1.1560, test_f1: 0.3854
 epoch: 10, train_loss: 1.1981, test_loss: 1.1488, test_f1: 0.3989
 epoch: 11, train_loss: 1.1937, test_loss: 1.1400, test_f1: 0.4061
 epoch: 12, train_loss: 1.1846, test_loss: 1.1417, test_f1: 0.4068
 epoch: 13, train_loss: 1.1730, test_loss: 1.1331, test_f1: 0.4102
 epoch: 14, train_loss: 1.1764, test_loss: 1.1286, test_f1: 0.4233
 epoch: 15, train_loss: 1.1681, test_loss: 1.1223, test_f1: 0.4140
 epoch: 16, train_loss: 1.1639, test_loss: 1.1172, test_f1: 0.4294
 epoch: 17, train_loss: 1.1604, test_loss: 1.1130, test_f1: 0.4303
 epoch: 18, train_loss: 1.1547, test_loss: 1.1064, test_f1: 0.4361
 epoch: 19, train_loss: 1.1477, test_loss: 1.1061, test_f1: 0.4285
 epoch: 20, train_loss: 1.1454, test_loss: 1.0994, test_f1: 0.4268
 epoch: 21, train_loss: 1.1426, test_loss: 1.0979, test_f1: 0.4206
 epoch: 22, train_loss: 1.1372, test_loss: 1.0930, test_f1: 0.4387
 epoch: 23, train_loss: 1.1366, test_loss: 1.0853, test_f1: 0.4363
 epoch: 24, train_loss: 1.1333, test_loss: 1.0841, test_f1: 0.4476
 epoch: 25, train_loss: 1.1341, test_loss: 1.0828, test_f1: 0.4341
 epoch: 26, train_loss: 1.1284, test_loss: 1.0693, test_f1: 0.4427
 epoch: 27, train_loss: 1.1281, test_loss: 1.0650, test_f1: 0.4352
 epoch: 28, train_loss: 1.1290, test_loss: 1.0627, test_f1: 0.4296
 epoch: 29, train_loss: 1.1141, test_loss: 1.0546, test_f1: 0.4435
 epoch: 30, train_loss: 1.1138, test_loss: 1.0684, test_f1: 0.4316
 epoch: 31, train_loss: 1.1115, test_loss: 1.0484, test_f1: 0.4421
 epoch: 32, train_loss: 1.1064, test_loss: 1.0576, test_f1: 0.4383
 epoch: 33, train_loss: 1.1156, test_loss: 1.0573, test_f1: 0.4399
 epoch: 34, train_loss: 1.1006, test_loss: 1.0422, test_f1: 0.4467
 epoch: 35, train_loss: 1.1043, test_loss: 1.0418, test_f1: 0.4486
 epoch: 36, train_loss: 1.1098, test_loss: 1.0441, test_f1: 0.4360
 epoch: 37, train_loss: 1.1016, test_loss: 1.0455, test_f1: 0.4427
 epoch: 38, train_loss: 1.0875, test_loss: 1.0493, test_f1: 0.4443
 epoch: 39, train_loss: 1.0832, test_loss: 1.0473, test_f1: 0.4393
 epoch: 40, train_loss: 1.0850, test_loss: 1.0510, test_f1: 0.4415
 epoch: 41, train_loss: 1.0814, test_loss: 1.0430, test_f1: 0.4399
 epoch: 42, train_loss: 1.0847, test_loss: 1.0186, test_f1: 0.4459
 epoch: 43, train_loss: 1.0781, test_loss: 1.0400, test_f1: 0.4555
 epoch: 44, train_loss: 1.0793, test_loss: 1.0265, test_f1: 0.4369
 epoch: 45, train_loss: 1.0640, test_loss: 1.0094, test_f1: 0.4600
 epoch: 46, train_loss: 1.0679, test_loss: 1.0265, test_f1: 0.4317
 epoch: 47, train_loss: 1.0611, test_loss: 1.0349, test_f1: 0.4423
 epoch: 48, train_loss: 1.0614, test_loss: 1.0428, test_f1: 0.4459
 epoch: 49, train_loss: 1.0643, test_loss: 1.0104, test_f1: 0.4400
 epoch: 50, train_loss: 1.0508, test_loss: 1.0176, test_f1: 0.4410
 epoch: 51, train_loss: 1.0608, test_loss: 1.0466, test_f1: 0.4400
 epoch: 52, train_loss: 1.0522, test_loss: 1.0564, test_f1: 0.4470
 epoch: 53, train_loss: 1.0519, test_loss: 1.0297, test_f1: 0.4526
 epoch: 54, train_loss: 1.0489, test_loss: 1.0477, test_f1: 0.4416
 epoch: 55, train_loss: 1.0434, test_loss: 1.0426, test_f1: 0.4543
 epoch: 56, train_loss: 1.0581, test_loss: 1.0308, test_f1: 0.4453
 epoch: 57, train_loss: 1.0426, test_loss: 1.0152, test_f1: 0.4601
 epoch: 58, train_loss: 1.0328, test_loss: 1.0149, test_f1: 0.4593
 epoch: 59, train_loss: 1.0369, test_loss: 1.0068, test_f1: 0.4590
 epoch: 60, train_loss: 1.0533, test_loss: 0.9894, test_f1: 0.4535
 epoch: 61, train_loss: 1.0414, test_loss: 1.0109, test_f1: 0.4456
 epoch: 62, train_loss: 1.0360, test_loss: 1.0314, test_f1: 0.4520
 epoch: 63, train_loss: 1.0403, test_loss: 1.0122, test_f1: 0.4445
 epoch: 64, train_loss: 1.0355, test_loss: 1.0006, test_f1: 0.4613
 epoch: 65, train_loss: 1.0322, test_loss: 0.9997, test_f1: 0.4648
 epoch: 66, train_loss: 1.0360, test_loss: 0.9891, test_f1: 0.4676
 epoch: 67, train_loss: 1.0388, test_loss: 1.0099, test_f1: 0.4549
 epoch: 68, train_loss: 1.0407, test_loss: 1.0419, test_f1: 0.4500
 epoch: 69, train_loss: 1.0232, test_loss: 1.0141, test_f1: 0.4645
 epoch: 70, train_loss: 1.0284, test_loss: 1.0392, test_f1: 0.4441
 epoch: 71, train_loss: 1.0188, test_loss: 1.0897, test_f1: 0.4735
 epoch: 72, train_loss: 1.0341, test_loss: 1.0065, test_f1: 0.4544
 epoch: 73, train_loss: 1.0340, test_loss: 0.9813, test_f1: 0.4675
 epoch: 74, train_loss: 1.0143, test_loss: 0.9829, test_f1: 0.4598
 epoch: 75, train_loss: 1.0285, test_loss: 1.0059, test_f1: 0.4509
 epoch: 76, train_loss: 1.0284, test_loss: 1.0304, test_f1: 0.4656
 epoch: 77, train_loss: 1.0205, test_loss: 1.0180, test_f1: 0.4665
 epoch: 78, train_loss: 1.0197, test_loss: 0.9936, test_f1: 0.4769
 epoch: 79, train_loss: 1.0189, test_loss: 0.9959, test_f1: 0.4625
 epoch: 80, train_loss: 1.0301, test_loss: 1.0334, test_f1: 0.4461
 epoch: 81, train_loss: 1.0173, test_loss: 0.9795, test_f1: 0.4707
 epoch: 82, train_loss: 1.0200, test_loss: 1.0088, test_f1: 0.4684
 epoch: 83, train_loss: 1.0159, test_loss: 0.9663, test_f1: 0.4539
 epoch: 84, train_loss: 1.0185, test_loss: 0.9737, test_f1: 0.4536
 epoch: 85, train_loss: 1.0199, test_loss: 0.9848, test_f1: 0.4567
 epoch: 86, train_loss: 1.0168, test_loss: 0.9755, test_f1: 0.4899
 epoch: 87, train_loss: 1.0217, test_loss: 0.9543, test_f1: 0.4686
 epoch: 88, train_loss: 1.0071, test_loss: 0.9936, test_f1: 0.4430
 epoch: 89, train_loss: 1.0013, test_loss: 0.9918, test_f1: 0.4621
 epoch: 90, train_loss: 1.0070, test_loss: 0.9913, test_f1: 0.4436
 epoch: 91, train_loss: 1.0065, test_loss: 0.9919, test_f1: 0.4458
 epoch: 92, train_loss: 1.0081, test_loss: 0.9815, test_f1: 0.4784
 epoch: 93, train_loss: 1.0088, test_loss: 0.9821, test_f1: 0.4605
 epoch: 94, train_loss: 1.0065, test_loss: 0.9901, test_f1: 0.4467
 epoch: 95, train_loss: 0.9979, test_loss: 1.1109, test_f1: 0.4694
 epoch: 96, train_loss: 0.9977, test_loss: 0.9375, test_f1: 0.4806
 epoch: 97, train_loss: 0.9890, test_loss: 0.9593, test_f1: 0.4656
 epoch: 98, train_loss: 1.0111, test_loss: 0.9438, test_f1: 0.4768
 epoch: 99, train_loss: 0.9985, test_loss: 0.9541, test_f1: 0.4778

Training completed in 1127.79 seconds
Best F1: 0.5125 at epoch 42
Mean F1 across iterations: 0.4878  0.0166
========================FINAL RESULTS================================
FEGIN weighted F1: 0.5125  0.0166
python main.py --data ltspice_examples --representation component_component --model FEGIN --layers 4 --hiddens 32 --batch_size 32 --lr 0.0001 --emb_size 250 --epochs 100 --save_appendix component_component_L4_H32_BS32_LR0.0001_E250 --no_val
-----



STDERR:
  File "main.py", line 370, in <module>
    main()
  File "main.py", line 254, in main
    dataset = dataset_class(
  File "/home/philip/projects/ltspice_examples_code_repo/Circuit-Completion-Using-GNNs/component_classification_with_link_prediction_head/evaluation/FEGIN/kernel/circuit_datasets.py", line 15, in __init__
    self.data, self.slices = torch.load(self.processed_paths[0])
  File "/home/philip/.local/lib/python3.8/site-packages/torch/serialization.py", line 1040, in load
    warnings.warn(
  File "/usr/lib/python3.8/warnings.py", line 109, in _showwarnmsg
    sw(msg.message, msg.category, msg.filename, msg.lineno,
  File "main.py", line 47, in warn_with_traceback
    traceback.print_stack(file=log)
/home/philip/projects/ltspice_examples_code_repo/Circuit-Completion-Using-GNNs/component_classification_with_link_prediction_head/evaluation/FEGIN/kernel/circuit_datasets.py:15: FutureWarning: You are using `torch.load` with `weights_only=False` (the current default value), which uses the default pickle module implicitly. It is possible to construct malicious pickle data which will execute arbitrary code during unpickling (See https://github.com/pytorch/pytorch/blob/main/SECURITY.md#untrusted-models for more details). In a future release, the default value for `weights_only` will be flipped to `True`. This limits the functions that could be executed during unpickling. Arbitrary objects will no longer be allowed to be loaded via this mode unless they are explicitly allowlisted by the user via `torch.serialization.add_safe_globals`. We recommend you start setting `weights_only=True` for any use case where you don't have full control of the loaded file. Please open an issue on GitHub for any issues related to this experimental feature.
  self.data, self.slices = torch.load(self.processed_paths[0])
