STDOUT:
Results will be saved in /home/philip/projects/ltspice_examples_code_repo/Circuit-Completion-Using-GNNs/component_classification_with_link_prediction_head/evaluation/FEGIN/results/model_FEGIN_dataset_ltspice_examples
Command line input: python main.py --data ltspice_examples --representation component_net --model FEGIN --layers 5 --hiddens 128 --batch_size 64 --lr 0.001 --emb_size 250 --epochs 100 --save_appendix component_net_L5_H128_BS64_LR0.001_E250 --no_val
 is saved.
-----
ltspice_examples - FEGIN
Using 5 layers, 128 hidden units, h = 2
Loading component_net representation dataset
ENTERED
Training FEGIN on component_net representation
Train: 3558, Test: 846
##################ITERATION #0 ****************************************
 epoch: 0, train_loss: 1.1953, test_loss: 1.0463, test_f1: 0.4416
 epoch: 1, train_loss: 0.9888, test_loss: 1.0083, test_f1: 0.5034
 epoch: 2, train_loss: 0.9445, test_loss: 0.9549, test_f1: 0.5126
 epoch: 3, train_loss: 0.9058, test_loss: 0.9091, test_f1: 0.5107
 epoch: 4, train_loss: 0.8807, test_loss: 0.8994, test_f1: 0.5583
 epoch: 5, train_loss: 0.8672, test_loss: 0.9958, test_f1: 0.5129
 epoch: 6, train_loss: 0.8591, test_loss: 0.8901, test_f1: 0.5470
 epoch: 7, train_loss: 0.8404, test_loss: 0.9416, test_f1: 0.5303
 epoch: 8, train_loss: 0.8253, test_loss: 0.9014, test_f1: 0.5610
 epoch: 9, train_loss: 0.8281, test_loss: 0.9420, test_f1: 0.5803
 epoch: 10, train_loss: 0.8157, test_loss: 0.9415, test_f1: 0.5982
 epoch: 11, train_loss: 0.8006, test_loss: 0.9166, test_f1: 0.5531
 epoch: 12, train_loss: 0.7847, test_loss: 0.9357, test_f1: 0.6090
 epoch: 13, train_loss: 0.7774, test_loss: 0.9900, test_f1: 0.5880
 epoch: 14, train_loss: 0.7693, test_loss: 0.9523, test_f1: 0.6003
 epoch: 15, train_loss: 0.7628, test_loss: 0.8665, test_f1: 0.5788
 epoch: 16, train_loss: 0.7386, test_loss: 0.9722, test_f1: 0.5783
 epoch: 17, train_loss: 0.7453, test_loss: 0.9751, test_f1: 0.5857
 epoch: 18, train_loss: 0.7291, test_loss: 0.9831, test_f1: 0.6028
 epoch: 19, train_loss: 0.7331, test_loss: 1.0325, test_f1: 0.5865
 epoch: 20, train_loss: 0.7043, test_loss: 0.9440, test_f1: 0.6302
 epoch: 21, train_loss: 0.7182, test_loss: 1.0869, test_f1: 0.5762
 epoch: 22, train_loss: 0.6959, test_loss: 0.9538, test_f1: 0.6235
 epoch: 23, train_loss: 0.6939, test_loss: 0.9527, test_f1: 0.6155
 epoch: 24, train_loss: 0.6841, test_loss: 0.9609, test_f1: 0.6215
 epoch: 25, train_loss: 0.6598, test_loss: 0.9594, test_f1: 0.6204
 epoch: 26, train_loss: 0.6569, test_loss: 1.0373, test_f1: 0.6166
 epoch: 27, train_loss: 0.6596, test_loss: 0.9993, test_f1: 0.6171
 epoch: 28, train_loss: 0.6312, test_loss: 1.0292, test_f1: 0.5899
 epoch: 29, train_loss: 0.6256, test_loss: 1.0316, test_f1: 0.5981
 epoch: 30, train_loss: 0.6495, test_loss: 1.0813, test_f1: 0.6141
 epoch: 31, train_loss: 0.6203, test_loss: 1.0239, test_f1: 0.6063
 epoch: 32, train_loss: 0.5945, test_loss: 0.8966, test_f1: 0.6479
 epoch: 33, train_loss: 0.5894, test_loss: 1.0171, test_f1: 0.6211
 epoch: 34, train_loss: 0.5574, test_loss: 0.9715, test_f1: 0.6106
 epoch: 35, train_loss: 0.5751, test_loss: 1.0933, test_f1: 0.6208
 epoch: 36, train_loss: 0.5713, test_loss: 1.0134, test_f1: 0.6450
 epoch: 37, train_loss: 0.5443, test_loss: 1.0650, test_f1: 0.6046
 epoch: 38, train_loss: 0.5299, test_loss: 1.1248, test_f1: 0.6093
 epoch: 39, train_loss: 0.5346, test_loss: 1.1484, test_f1: 0.6242
 epoch: 40, train_loss: 0.5199, test_loss: 1.1631, test_f1: 0.6393
 epoch: 41, train_loss: 0.5168, test_loss: 1.1778, test_f1: 0.6140
 epoch: 42, train_loss: 0.5247, test_loss: 1.1376, test_f1: 0.6326
 epoch: 43, train_loss: 0.4962, test_loss: 1.1133, test_f1: 0.6244
 epoch: 44, train_loss: 0.4956, test_loss: 1.1575, test_f1: 0.6374
 epoch: 45, train_loss: 0.4820, test_loss: 1.0347, test_f1: 0.6613
 epoch: 46, train_loss: 0.4833, test_loss: 1.2404, test_f1: 0.6280
 epoch: 47, train_loss: 0.4782, test_loss: 1.0542, test_f1: 0.6488
 epoch: 48, train_loss: 0.4734, test_loss: 1.2859, test_f1: 0.6309
 epoch: 49, train_loss: 0.4835, test_loss: 1.2269, test_f1: 0.6106
 epoch: 50, train_loss: 0.4469, test_loss: 1.0932, test_f1: 0.6440
 epoch: 51, train_loss: 0.4177, test_loss: 1.2324, test_f1: 0.6493
 epoch: 52, train_loss: 0.3689, test_loss: 1.3202, test_f1: 0.6392
 epoch: 53, train_loss: 0.3661, test_loss: 1.2337, test_f1: 0.6700
 epoch: 54, train_loss: 0.3554, test_loss: 1.4127, test_f1: 0.6429
 epoch: 55, train_loss: 0.3468, test_loss: 1.3901, test_f1: 0.6547
 epoch: 56, train_loss: 0.3375, test_loss: 1.3523, test_f1: 0.6466
 epoch: 57, train_loss: 0.3346, test_loss: 1.3747, test_f1: 0.6289
 epoch: 58, train_loss: 0.3289, test_loss: 1.3320, test_f1: 0.6415
 epoch: 59, train_loss: 0.3175, test_loss: 1.6284, test_f1: 0.6456
 epoch: 60, train_loss: 0.3072, test_loss: 1.4606, test_f1: 0.6515
 epoch: 61, train_loss: 0.3089, test_loss: 1.4132, test_f1: 0.6741
 epoch: 62, train_loss: 0.3150, test_loss: 1.3992, test_f1: 0.6664
 epoch: 63, train_loss: 0.2789, test_loss: 1.5826, test_f1: 0.6556
 epoch: 64, train_loss: 0.3029, test_loss: 1.5738, test_f1: 0.6406
 epoch: 65, train_loss: 0.2859, test_loss: 1.5925, test_f1: 0.6578
 epoch: 66, train_loss: 0.2930, test_loss: 1.5384, test_f1: 0.6384
 epoch: 67, train_loss: 0.2824, test_loss: 1.4980, test_f1: 0.6777
 epoch: 68, train_loss: 0.2819, test_loss: 1.6851, test_f1: 0.6498
 epoch: 69, train_loss: 0.2841, test_loss: 1.5794, test_f1: 0.6421
 epoch: 70, train_loss: 0.2854, test_loss: 1.6823, test_f1: 0.6528
 epoch: 71, train_loss: 0.2866, test_loss: 1.6132, test_f1: 0.6606
 epoch: 72, train_loss: 0.2779, test_loss: 1.8141, test_f1: 0.6435
 epoch: 73, train_loss: 0.2498, test_loss: 1.6164, test_f1: 0.6515
 epoch: 74, train_loss: 0.2634, test_loss: 1.7204, test_f1: 0.6560
 epoch: 75, train_loss: 0.2472, test_loss: 1.7215, test_f1: 0.6446
 epoch: 76, train_loss: 0.2576, test_loss: 1.7344, test_f1: 0.6525
 epoch: 77, train_loss: 0.2405, test_loss: 1.8247, test_f1: 0.6490
 epoch: 78, train_loss: 0.2267, test_loss: 1.7559, test_f1: 0.6721
 epoch: 79, train_loss: 0.2454, test_loss: 1.9348, test_f1: 0.6340
 epoch: 80, train_loss: 0.2255, test_loss: 1.9665, test_f1: 0.6399
 epoch: 81, train_loss: 0.2301, test_loss: 1.8329, test_f1: 0.6537
 epoch: 82, train_loss: 0.2214, test_loss: 1.9651, test_f1: 0.6473
 epoch: 83, train_loss: 0.2405, test_loss: 1.8875, test_f1: 0.6468
 epoch: 84, train_loss: 0.2313, test_loss: 1.8215, test_f1: 0.6415
 epoch: 85, train_loss: 0.2236, test_loss: 1.8744, test_f1: 0.6514
 epoch: 86, train_loss: 0.2154, test_loss: 2.0786, test_f1: 0.6373
 epoch: 87, train_loss: 0.2343, test_loss: 1.9991, test_f1: 0.6352
 epoch: 88, train_loss: 0.2155, test_loss: 1.9650, test_f1: 0.6363
 epoch: 89, train_loss: 0.2289, test_loss: 2.0649, test_f1: 0.6205
 epoch: 90, train_loss: 0.2147, test_loss: 1.8757, test_f1: 0.6645
 epoch: 91, train_loss: 0.2287, test_loss: 1.9697, test_f1: 0.6573
 epoch: 92, train_loss: 0.2252, test_loss: 2.0470, test_f1: 0.6458
 epoch: 93, train_loss: 0.1974, test_loss: 1.9605, test_f1: 0.6564
 epoch: 94, train_loss: 0.2202, test_loss: 2.0205, test_f1: 0.6501
 epoch: 95, train_loss: 0.1961, test_loss: 2.1760, test_f1: 0.6424
 epoch: 96, train_loss: 0.2189, test_loss: 2.2245, test_f1: 0.6102
 epoch: 97, train_loss: 0.1938, test_loss: 1.9664, test_f1: 0.6583
 epoch: 98, train_loss: 0.1941, test_loss: 2.0263, test_f1: 0.6385
 epoch: 99, train_loss: 0.2034, test_loss: 2.1211, test_f1: 0.6307
##################ITERATION #1 ****************************************
 epoch: 0, train_loss: 1.1245, test_loss: 1.0117, test_f1: 0.4381
 epoch: 1, train_loss: 0.9856, test_loss: 0.9879, test_f1: 0.5202
 epoch: 2, train_loss: 0.9402, test_loss: 0.9349, test_f1: 0.5573
 epoch: 3, train_loss: 0.9035, test_loss: 0.9139, test_f1: 0.5549
 epoch: 4, train_loss: 0.8986, test_loss: 0.9347, test_f1: 0.5640
 epoch: 5, train_loss: 0.8820, test_loss: 0.9711, test_f1: 0.5310
 epoch: 6, train_loss: 0.8782, test_loss: 0.9532, test_f1: 0.5664
 epoch: 7, train_loss: 0.8481, test_loss: 0.9169, test_f1: 0.5764
 epoch: 8, train_loss: 0.8349, test_loss: 0.9410, test_f1: 0.6144
 epoch: 9, train_loss: 0.8187, test_loss: 0.9376, test_f1: 0.5877
 epoch: 10, train_loss: 0.8110, test_loss: 0.8936, test_f1: 0.5924
 epoch: 11, train_loss: 0.7934, test_loss: 0.9440, test_f1: 0.6240
 epoch: 12, train_loss: 0.7903, test_loss: 0.9073, test_f1: 0.5788
 epoch: 13, train_loss: 0.7702, test_loss: 0.9438, test_f1: 0.5795
 epoch: 14, train_loss: 0.7638, test_loss: 0.9377, test_f1: 0.5811
 epoch: 15, train_loss: 0.7470, test_loss: 0.9727, test_f1: 0.6010
 epoch: 16, train_loss: 0.7212, test_loss: 0.9532, test_f1: 0.6092
 epoch: 17, train_loss: 0.7565, test_loss: 1.0235, test_f1: 0.5985
 epoch: 18, train_loss: 0.7187, test_loss: 0.9819, test_f1: 0.6190
 epoch: 19, train_loss: 0.7166, test_loss: 0.9480, test_f1: 0.6055
 epoch: 20, train_loss: 0.7105, test_loss: 1.0061, test_f1: 0.5977
 epoch: 21, train_loss: 0.7002, test_loss: 1.0242, test_f1: 0.6033
 epoch: 22, train_loss: 0.6798, test_loss: 1.0077, test_f1: 0.6228
 epoch: 23, train_loss: 0.6634, test_loss: 0.9855, test_f1: 0.6097
 epoch: 24, train_loss: 0.6695, test_loss: 0.9440, test_f1: 0.6032
 epoch: 25, train_loss: 0.6485, test_loss: 1.0263, test_f1: 0.6180
 epoch: 26, train_loss: 0.6476, test_loss: 1.0934, test_f1: 0.5980
 epoch: 27, train_loss: 0.6570, test_loss: 0.9919, test_f1: 0.6173
 epoch: 28, train_loss: 0.6255, test_loss: 0.9696, test_f1: 0.6517
 epoch: 29, train_loss: 0.6174, test_loss: 1.0067, test_f1: 0.6493
 epoch: 30, train_loss: 0.6271, test_loss: 1.0973, test_f1: 0.6201
 epoch: 31, train_loss: 0.5982, test_loss: 1.0643, test_f1: 0.6258
 epoch: 32, train_loss: 0.5718, test_loss: 1.0969, test_f1: 0.6294
 epoch: 33, train_loss: 0.5859, test_loss: 1.0125, test_f1: 0.6419
 epoch: 34, train_loss: 0.5729, test_loss: 1.0477, test_f1: 0.6104
 epoch: 35, train_loss: 0.5529, test_loss: 1.0848, test_f1: 0.6634
 epoch: 36, train_loss: 0.5589, test_loss: 1.0772, test_f1: 0.6286
 epoch: 37, train_loss: 0.5377, test_loss: 1.0633, test_f1: 0.6581
 epoch: 38, train_loss: 0.5152, test_loss: 1.0498, test_f1: 0.6584
 epoch: 39, train_loss: 0.5317, test_loss: 1.1489, test_f1: 0.6171
 epoch: 40, train_loss: 0.5118, test_loss: 1.1369, test_f1: 0.6297
 epoch: 41, train_loss: 0.4986, test_loss: 1.2787, test_f1: 0.6000
 epoch: 42, train_loss: 0.5053, test_loss: 1.2391, test_f1: 0.6034
 epoch: 43, train_loss: 0.4880, test_loss: 1.1580, test_f1: 0.6517
 epoch: 44, train_loss: 0.4942, test_loss: 1.2082, test_f1: 0.6311
 epoch: 45, train_loss: 0.4698, test_loss: 1.1180, test_f1: 0.6206
 epoch: 46, train_loss: 0.4532, test_loss: 1.1367, test_f1: 0.6751
 epoch: 47, train_loss: 0.4624, test_loss: 1.2062, test_f1: 0.6352
 epoch: 48, train_loss: 0.4545, test_loss: 1.3327, test_f1: 0.6360
 epoch: 49, train_loss: 0.4153, test_loss: 1.2938, test_f1: 0.6318
 epoch: 50, train_loss: 0.4314, test_loss: 1.3015, test_f1: 0.6477
 epoch: 51, train_loss: 0.3911, test_loss: 1.2388, test_f1: 0.6724
 epoch: 52, train_loss: 0.3788, test_loss: 1.3207, test_f1: 0.6792
 epoch: 53, train_loss: 0.3714, test_loss: 1.4388, test_f1: 0.6592
 epoch: 54, train_loss: 0.3426, test_loss: 1.3543, test_f1: 0.6354
 epoch: 55, train_loss: 0.3445, test_loss: 1.4015, test_f1: 0.6453
 epoch: 56, train_loss: 0.3149, test_loss: 1.4550, test_f1: 0.6300
 epoch: 57, train_loss: 0.3308, test_loss: 1.5599, test_f1: 0.6276
 epoch: 58, train_loss: 0.3207, test_loss: 1.4138, test_f1: 0.6545
 epoch: 59, train_loss: 0.3173, test_loss: 1.4941, test_f1: 0.6316
 epoch: 60, train_loss: 0.2907, test_loss: 1.5665, test_f1: 0.6399
 epoch: 61, train_loss: 0.3051, test_loss: 1.5281, test_f1: 0.6592
 epoch: 62, train_loss: 0.2928, test_loss: 1.5647, test_f1: 0.6464
 epoch: 63, train_loss: 0.2867, test_loss: 1.6438, test_f1: 0.6359
 epoch: 64, train_loss: 0.3035, test_loss: 1.5800, test_f1: 0.6516
 epoch: 65, train_loss: 0.2773, test_loss: 1.5423, test_f1: 0.6383
 epoch: 66, train_loss: 0.2876, test_loss: 1.6549, test_f1: 0.6311
 epoch: 67, train_loss: 0.2826, test_loss: 1.5919, test_f1: 0.6244
 epoch: 68, train_loss: 0.2987, test_loss: 1.5938, test_f1: 0.6344
 epoch: 69, train_loss: 0.2508, test_loss: 1.6352, test_f1: 0.6450
 epoch: 70, train_loss: 0.2745, test_loss: 1.6373, test_f1: 0.6427
 epoch: 71, train_loss: 0.2783, test_loss: 1.7460, test_f1: 0.6369
 epoch: 72, train_loss: 0.2845, test_loss: 1.6938, test_f1: 0.6412
 epoch: 73, train_loss: 0.2648, test_loss: 1.7298, test_f1: 0.6452
 epoch: 74, train_loss: 0.2459, test_loss: 1.7013, test_f1: 0.6351
 epoch: 75, train_loss: 0.2572, test_loss: 1.8301, test_f1: 0.6304
 epoch: 76, train_loss: 0.2523, test_loss: 1.6902, test_f1: 0.6252
 epoch: 77, train_loss: 0.2486, test_loss: 1.7658, test_f1: 0.6326
 epoch: 78, train_loss: 0.2292, test_loss: 1.8395, test_f1: 0.6413
 epoch: 79, train_loss: 0.2268, test_loss: 1.7257, test_f1: 0.6475
 epoch: 80, train_loss: 0.2443, test_loss: 1.7597, test_f1: 0.6174
 epoch: 81, train_loss: 0.2338, test_loss: 1.8613, test_f1: 0.6218
 epoch: 82, train_loss: 0.2193, test_loss: 1.7958, test_f1: 0.6647
 epoch: 83, train_loss: 0.2249, test_loss: 1.7595, test_f1: 0.6511
 epoch: 84, train_loss: 0.2260, test_loss: 1.9286, test_f1: 0.6469
 epoch: 85, train_loss: 0.2055, test_loss: 2.0484, test_f1: 0.6324
 epoch: 86, train_loss: 0.2108, test_loss: 2.0986, test_f1: 0.6219
 epoch: 87, train_loss: 0.2223, test_loss: 2.0065, test_f1: 0.6233
 epoch: 88, train_loss: 0.2304, test_loss: 1.8052, test_f1: 0.6379
 epoch: 89, train_loss: 0.2310, test_loss: 1.9543, test_f1: 0.6380
 epoch: 90, train_loss: 0.2453, test_loss: 1.8616, test_f1: 0.6356
 epoch: 91, train_loss: 0.2463, test_loss: 1.7545, test_f1: 0.6297
 epoch: 92, train_loss: 0.2095, test_loss: 1.9192, test_f1: 0.6391
 epoch: 93, train_loss: 0.1976, test_loss: 2.0088, test_f1: 0.6588
 epoch: 94, train_loss: 0.2148, test_loss: 1.9492, test_f1: 0.6347
 epoch: 95, train_loss: 0.2079, test_loss: 2.0799, test_f1: 0.6361
 epoch: 96, train_loss: 0.2119, test_loss: 2.0189, test_f1: 0.6345
 epoch: 97, train_loss: 0.1913, test_loss: 2.1317, test_f1: 0.6358
 epoch: 98, train_loss: 0.2030, test_loss: 2.0134, test_f1: 0.6315
 epoch: 99, train_loss: 0.2033, test_loss: 1.9521, test_f1: 0.6537
##################ITERATION #2 ****************************************
 epoch: 0, train_loss: 1.1903, test_loss: 1.0299, test_f1: 0.4800
 epoch: 1, train_loss: 0.9922, test_loss: 0.9601, test_f1: 0.5407
 epoch: 2, train_loss: 0.9483, test_loss: 0.9599, test_f1: 0.5475
 epoch: 3, train_loss: 0.9262, test_loss: 0.9391, test_f1: 0.5031
 epoch: 4, train_loss: 0.9020, test_loss: 0.9729, test_f1: 0.5045
 epoch: 5, train_loss: 0.8998, test_loss: 0.9105, test_f1: 0.5399
 epoch: 6, train_loss: 0.8738, test_loss: 0.9514, test_f1: 0.5426
 epoch: 7, train_loss: 0.8483, test_loss: 0.9672, test_f1: 0.5518
 epoch: 8, train_loss: 0.8374, test_loss: 0.9581, test_f1: 0.5563
 epoch: 9, train_loss: 0.8332, test_loss: 0.9833, test_f1: 0.5556
 epoch: 10, train_loss: 0.8229, test_loss: 0.9200, test_f1: 0.5676
 epoch: 11, train_loss: 0.8149, test_loss: 0.9480, test_f1: 0.5810
 epoch: 12, train_loss: 0.8049, test_loss: 0.9781, test_f1: 0.5296
 epoch: 13, train_loss: 0.7908, test_loss: 0.9989, test_f1: 0.5748
 epoch: 14, train_loss: 0.7963, test_loss: 1.0236, test_f1: 0.5573
 epoch: 15, train_loss: 0.7893, test_loss: 0.9568, test_f1: 0.5974
 epoch: 16, train_loss: 0.7639, test_loss: 0.9436, test_f1: 0.5894
 epoch: 17, train_loss: 0.7553, test_loss: 0.9667, test_f1: 0.5815
 epoch: 18, train_loss: 0.7527, test_loss: 0.9543, test_f1: 0.5836
 epoch: 19, train_loss: 0.7346, test_loss: 1.0027, test_f1: 0.5903
 epoch: 20, train_loss: 0.7400, test_loss: 0.9471, test_f1: 0.5790
 epoch: 21, train_loss: 0.7121, test_loss: 0.9839, test_f1: 0.6094
 epoch: 22, train_loss: 0.7000, test_loss: 0.9805, test_f1: 0.6035
 epoch: 23, train_loss: 0.7276, test_loss: 0.9634, test_f1: 0.5803
 epoch: 24, train_loss: 0.6991, test_loss: 0.9493, test_f1: 0.5749
 epoch: 25, train_loss: 0.6877, test_loss: 1.1215, test_f1: 0.5717
 epoch: 26, train_loss: 0.6752, test_loss: 0.9736, test_f1: 0.5679
 epoch: 27, train_loss: 0.6742, test_loss: 0.9839, test_f1: 0.5515
 epoch: 28, train_loss: 0.6768, test_loss: 0.9561, test_f1: 0.5869
 epoch: 29, train_loss: 0.6486, test_loss: 0.9747, test_f1: 0.6246
 epoch: 30, train_loss: 0.6458, test_loss: 1.0425, test_f1: 0.5749
 epoch: 31, train_loss: 0.6337, test_loss: 0.9969, test_f1: 0.6005
 epoch: 32, train_loss: 0.6399, test_loss: 0.9456, test_f1: 0.5871
 epoch: 33, train_loss: 0.6144, test_loss: 1.0429, test_f1: 0.6108
 epoch: 34, train_loss: 0.6201, test_loss: 1.0413, test_f1: 0.6277
 epoch: 35, train_loss: 0.5840, test_loss: 1.0548, test_f1: 0.6128
 epoch: 36, train_loss: 0.6037, test_loss: 1.1181, test_f1: 0.5876
 epoch: 37, train_loss: 0.5985, test_loss: 1.0746, test_f1: 0.6109
 epoch: 38, train_loss: 0.5693, test_loss: 1.1646, test_f1: 0.6110
 epoch: 39, train_loss: 0.5845, test_loss: 1.0553, test_f1: 0.6130
 epoch: 40, train_loss: 0.5505, test_loss: 1.0369, test_f1: 0.6349
 epoch: 41, train_loss: 0.5410, test_loss: 1.0101, test_f1: 0.6326
 epoch: 42, train_loss: 0.5436, test_loss: 1.1404, test_f1: 0.6288
 epoch: 43, train_loss: 0.5349, test_loss: 1.2378, test_f1: 0.6163
 epoch: 44, train_loss: 0.5238, test_loss: 1.1111, test_f1: 0.6314
 epoch: 45, train_loss: 0.5313, test_loss: 1.1356, test_f1: 0.6213
 epoch: 46, train_loss: 0.5070, test_loss: 1.0892, test_f1: 0.6302
 epoch: 47, train_loss: 0.4889, test_loss: 1.2019, test_f1: 0.6442
 epoch: 48, train_loss: 0.4730, test_loss: 1.1554, test_f1: 0.6321
 epoch: 49, train_loss: 0.4584, test_loss: 1.1986, test_f1: 0.6501
 epoch: 50, train_loss: 0.4592, test_loss: 1.0577, test_f1: 0.6463
 epoch: 51, train_loss: 0.4072, test_loss: 1.2273, test_f1: 0.6346
 epoch: 52, train_loss: 0.3876, test_loss: 1.3239, test_f1: 0.6539
 epoch: 53, train_loss: 0.3783, test_loss: 1.2358, test_f1: 0.6590
 epoch: 54, train_loss: 0.3740, test_loss: 1.4663, test_f1: 0.6407
 epoch: 55, train_loss: 0.3559, test_loss: 1.3016, test_f1: 0.6468
 epoch: 56, train_loss: 0.3454, test_loss: 1.3794, test_f1: 0.6556
 epoch: 57, train_loss: 0.3419, test_loss: 1.4786, test_f1: 0.6646
 epoch: 58, train_loss: 0.3613, test_loss: 1.3419, test_f1: 0.6568
 epoch: 59, train_loss: 0.3529, test_loss: 1.4179, test_f1: 0.6535
 epoch: 60, train_loss: 0.3392, test_loss: 1.3960, test_f1: 0.6517
 epoch: 61, train_loss: 0.3249, test_loss: 1.4502, test_f1: 0.6598
 epoch: 62, train_loss: 0.3302, test_loss: 1.4970, test_f1: 0.6377
 epoch: 63, train_loss: 0.3066, test_loss: 1.4570, test_f1: 0.6434
 epoch: 64, train_loss: 0.3091, test_loss: 1.5367, test_f1: 0.6632
 epoch: 65, train_loss: 0.3316, test_loss: 1.4643, test_f1: 0.6472
 epoch: 66, train_loss: 0.2990, test_loss: 1.4057, test_f1: 0.6540
 epoch: 67, train_loss: 0.3150, test_loss: 1.5717, test_f1: 0.6295
 epoch: 68, train_loss: 0.2898, test_loss: 1.5219, test_f1: 0.6567
 epoch: 69, train_loss: 0.2884, test_loss: 1.5589, test_f1: 0.6467
 epoch: 70, train_loss: 0.2811, test_loss: 1.5509, test_f1: 0.6606
 epoch: 71, train_loss: 0.2870, test_loss: 1.6777, test_f1: 0.6322
 epoch: 72, train_loss: 0.2611, test_loss: 1.5684, test_f1: 0.6561
 epoch: 73, train_loss: 0.2649, test_loss: 1.6252, test_f1: 0.6469
 epoch: 74, train_loss: 0.2792, test_loss: 1.5450, test_f1: 0.6517
 epoch: 75, train_loss: 0.2626, test_loss: 1.6615, test_f1: 0.6677
 epoch: 76, train_loss: 0.2689, test_loss: 1.6101, test_f1: 0.6666
 epoch: 77, train_loss: 0.2799, test_loss: 1.6596, test_f1: 0.6483
 epoch: 78, train_loss: 0.2615, test_loss: 1.7853, test_f1: 0.6401
 epoch: 79, train_loss: 0.2456, test_loss: 1.7653, test_f1: 0.6543
 epoch: 80, train_loss: 0.2446, test_loss: 1.8293, test_f1: 0.6368
 epoch: 81, train_loss: 0.2535, test_loss: 1.7176, test_f1: 0.6487
 epoch: 82, train_loss: 0.2398, test_loss: 1.8201, test_f1: 0.6429
 epoch: 83, train_loss: 0.2554, test_loss: 1.8638, test_f1: 0.6766
 epoch: 84, train_loss: 0.2399, test_loss: 1.8562, test_f1: 0.6498
 epoch: 85, train_loss: 0.2381, test_loss: 1.7390, test_f1: 0.6827
 epoch: 86, train_loss: 0.2320, test_loss: 1.7352, test_f1: 0.6560
 epoch: 87, train_loss: 0.2427, test_loss: 1.8353, test_f1: 0.6443
 epoch: 88, train_loss: 0.2120, test_loss: 1.9398, test_f1: 0.6603
 epoch: 89, train_loss: 0.2332, test_loss: 2.0481, test_f1: 0.6564
 epoch: 90, train_loss: 0.2096, test_loss: 1.9757, test_f1: 0.6457
 epoch: 91, train_loss: 0.2145, test_loss: 1.9829, test_f1: 0.6551
 epoch: 92, train_loss: 0.2138, test_loss: 2.0806, test_f1: 0.6258
 epoch: 93, train_loss: 0.2190, test_loss: 2.1360, test_f1: 0.6542
 epoch: 94, train_loss: 0.2169, test_loss: 1.8781, test_f1: 0.6529
 epoch: 95, train_loss: 0.2314, test_loss: 1.9461, test_f1: 0.6542
 epoch: 96, train_loss: 0.2027, test_loss: 2.0899, test_f1: 0.6479
 epoch: 97, train_loss: 0.1962, test_loss: 2.1075, test_f1: 0.6234
 epoch: 98, train_loss: 0.1848, test_loss: 2.1039, test_f1: 0.6487
 epoch: 99, train_loss: 0.2054, test_loss: 2.2052, test_f1: 0.6690
##################ITERATION #3 ****************************************
 epoch: 0, train_loss: 1.3196, test_loss: 1.0116, test_f1: 0.4893
 epoch: 1, train_loss: 1.0114, test_loss: 0.9675, test_f1: 0.5223
 epoch: 2, train_loss: 0.9481, test_loss: 0.9334, test_f1: 0.5537
 epoch: 3, train_loss: 0.9201, test_loss: 0.9558, test_f1: 0.5638
 epoch: 4, train_loss: 0.9132, test_loss: 0.9270, test_f1: 0.5717
 epoch: 5, train_loss: 0.8961, test_loss: 0.9609, test_f1: 0.5633
 epoch: 6, train_loss: 0.8776, test_loss: 0.9863, test_f1: 0.5552
 epoch: 7, train_loss: 0.8621, test_loss: 0.9830, test_f1: 0.5458
 epoch: 8, train_loss: 0.8493, test_loss: 0.9772, test_f1: 0.5491
 epoch: 9, train_loss: 0.8417, test_loss: 0.9779, test_f1: 0.5377
 epoch: 10, train_loss: 0.8259, test_loss: 0.9324, test_f1: 0.5791
 epoch: 11, train_loss: 0.8043, test_loss: 0.9061, test_f1: 0.5721
 epoch: 12, train_loss: 0.7978, test_loss: 0.9250, test_f1: 0.5883
 epoch: 13, train_loss: 0.7723, test_loss: 0.9974, test_f1: 0.5906
 epoch: 14, train_loss: 0.7746, test_loss: 0.9943, test_f1: 0.5780
 epoch: 15, train_loss: 0.7750, test_loss: 1.0016, test_f1: 0.5780
 epoch: 16, train_loss: 0.7554, test_loss: 0.9633, test_f1: 0.6020
 epoch: 17, train_loss: 0.7522, test_loss: 0.8811, test_f1: 0.6029
 epoch: 18, train_loss: 0.7291, test_loss: 0.9243, test_f1: 0.6021
 epoch: 19, train_loss: 0.7183, test_loss: 0.9814, test_f1: 0.6058
 epoch: 20, train_loss: 0.7134, test_loss: 1.0086, test_f1: 0.5841
 epoch: 21, train_loss: 0.6976, test_loss: 0.9804, test_f1: 0.6269
 epoch: 22, train_loss: 0.6784, test_loss: 0.9637, test_f1: 0.6064
 epoch: 23, train_loss: 0.6986, test_loss: 0.9282, test_f1: 0.6127
 epoch: 24, train_loss: 0.6954, test_loss: 1.0638, test_f1: 0.6128
 epoch: 25, train_loss: 0.6754, test_loss: 1.0793, test_f1: 0.6078
 epoch: 26, train_loss: 0.6537, test_loss: 0.9155, test_f1: 0.6306
 epoch: 27, train_loss: 0.6554, test_loss: 1.0042, test_f1: 0.6150
 epoch: 28, train_loss: 0.6453, test_loss: 1.0106, test_f1: 0.6227
 epoch: 29, train_loss: 0.6195, test_loss: 0.9601, test_f1: 0.6348
 epoch: 30, train_loss: 0.6247, test_loss: 0.9669, test_f1: 0.6240
 epoch: 31, train_loss: 0.6375, test_loss: 0.9701, test_f1: 0.6201
 epoch: 32, train_loss: 0.6171, test_loss: 0.9047, test_f1: 0.6758
 epoch: 33, train_loss: 0.5912, test_loss: 1.0069, test_f1: 0.6389
 epoch: 34, train_loss: 0.6244, test_loss: 0.9406, test_f1: 0.6431
 epoch: 35, train_loss: 0.5783, test_loss: 0.9112, test_f1: 0.6345
 epoch: 36, train_loss: 0.5659, test_loss: 1.1319, test_f1: 0.6129
 epoch: 37, train_loss: 0.5665, test_loss: 1.0212, test_f1: 0.6679
 epoch: 38, train_loss: 0.5725, test_loss: 1.0216, test_f1: 0.6406
 epoch: 39, train_loss: 0.5505, test_loss: 0.9822, test_f1: 0.6270
 epoch: 40, train_loss: 0.5453, test_loss: 0.9916, test_f1: 0.6581
 epoch: 41, train_loss: 0.5327, test_loss: 1.0687, test_f1: 0.6156
 epoch: 42, train_loss: 0.5076, test_loss: 1.0247, test_f1: 0.6291
 epoch: 43, train_loss: 0.5227, test_loss: 0.9294, test_f1: 0.6596
 epoch: 44, train_loss: 0.5359, test_loss: 1.0860, test_f1: 0.6254
 epoch: 45, train_loss: 0.5336, test_loss: 1.0355, test_f1: 0.6406
 epoch: 46, train_loss: 0.4964, test_loss: 1.1431, test_f1: 0.6458
 epoch: 47, train_loss: 0.4731, test_loss: 1.0887, test_f1: 0.6468
 epoch: 48, train_loss: 0.4898, test_loss: 1.0374, test_f1: 0.6418
 epoch: 49, train_loss: 0.4806, test_loss: 1.1338, test_f1: 0.6303
 epoch: 50, train_loss: 0.4997, test_loss: 1.1199, test_f1: 0.6293
 epoch: 51, train_loss: 0.4328, test_loss: 1.0865, test_f1: 0.6566
 epoch: 52, train_loss: 0.4017, test_loss: 1.1474, test_f1: 0.6547
 epoch: 53, train_loss: 0.3838, test_loss: 1.0290, test_f1: 0.6614
 epoch: 54, train_loss: 0.3745, test_loss: 1.1884, test_f1: 0.6704
 epoch: 55, train_loss: 0.3797, test_loss: 1.1912, test_f1: 0.6569
 epoch: 56, train_loss: 0.3586, test_loss: 1.1374, test_f1: 0.6667
 epoch: 57, train_loss: 0.3601, test_loss: 1.1987, test_f1: 0.6496
 epoch: 58, train_loss: 0.3508, test_loss: 1.1619, test_f1: 0.6430
 epoch: 59, train_loss: 0.3393, test_loss: 1.1598, test_f1: 0.6674
 epoch: 60, train_loss: 0.3324, test_loss: 1.2684, test_f1: 0.6563
 epoch: 61, train_loss: 0.3249, test_loss: 1.2719, test_f1: 0.6624
 epoch: 62, train_loss: 0.2997, test_loss: 1.3113, test_f1: 0.6514
 epoch: 63, train_loss: 0.3277, test_loss: 1.3818, test_f1: 0.6683
 epoch: 64, train_loss: 0.2969, test_loss: 1.3678, test_f1: 0.6571
 epoch: 65, train_loss: 0.2980, test_loss: 1.3104, test_f1: 0.6539
 epoch: 66, train_loss: 0.3099, test_loss: 1.3564, test_f1: 0.6503
 epoch: 67, train_loss: 0.3014, test_loss: 1.4688, test_f1: 0.6604
 epoch: 68, train_loss: 0.2978, test_loss: 1.4342, test_f1: 0.6618
 epoch: 69, train_loss: 0.2877, test_loss: 1.4140, test_f1: 0.6307
 epoch: 70, train_loss: 0.2840, test_loss: 1.4429, test_f1: 0.6575
 epoch: 71, train_loss: 0.2967, test_loss: 1.3782, test_f1: 0.6593
 epoch: 72, train_loss: 0.2779, test_loss: 1.3929, test_f1: 0.6534
 epoch: 73, train_loss: 0.2882, test_loss: 1.4614, test_f1: 0.6536
 epoch: 74, train_loss: 0.2621, test_loss: 1.4568, test_f1: 0.6354
 epoch: 75, train_loss: 0.2772, test_loss: 1.5077, test_f1: 0.6365
 epoch: 76, train_loss: 0.2866, test_loss: 1.5622, test_f1: 0.6373
 epoch: 77, train_loss: 0.2614, test_loss: 1.5169, test_f1: 0.6566
 epoch: 78, train_loss: 0.2601, test_loss: 1.4271, test_f1: 0.6747
 epoch: 79, train_loss: 0.2576, test_loss: 1.4936, test_f1: 0.6376
 epoch: 80, train_loss: 0.2585, test_loss: 1.5309, test_f1: 0.6423
 epoch: 81, train_loss: 0.2582, test_loss: 1.5557, test_f1: 0.6548
 epoch: 82, train_loss: 0.2576, test_loss: 1.5770, test_f1: 0.6390
 epoch: 83, train_loss: 0.2490, test_loss: 1.6096, test_f1: 0.6457
 epoch: 84, train_loss: 0.2622, test_loss: 1.6084, test_f1: 0.6454
 epoch: 85, train_loss: 0.2365, test_loss: 1.6742, test_f1: 0.6569
 epoch: 86, train_loss: 0.2453, test_loss: 1.6482, test_f1: 0.6451
 epoch: 87, train_loss: 0.2368, test_loss: 1.8278, test_f1: 0.6305
 epoch: 88, train_loss: 0.2368, test_loss: 1.6768, test_f1: 0.6561
 epoch: 89, train_loss: 0.2494, test_loss: 1.6103, test_f1: 0.6430
 epoch: 90, train_loss: 0.2600, test_loss: 1.5569, test_f1: 0.6623
 epoch: 91, train_loss: 0.2356, test_loss: 1.7398, test_f1: 0.6418
 epoch: 92, train_loss: 0.2308, test_loss: 1.6788, test_f1: 0.6329
 epoch: 93, train_loss: 0.2249, test_loss: 1.7778, test_f1: 0.6522
 epoch: 94, train_loss: 0.2279, test_loss: 1.7199, test_f1: 0.6411
 epoch: 95, train_loss: 0.2364, test_loss: 1.7493, test_f1: 0.6309
 epoch: 96, train_loss: 0.2314, test_loss: 1.6542, test_f1: 0.6437
 epoch: 97, train_loss: 0.2219, test_loss: 1.7187, test_f1: 0.6422
 epoch: 98, train_loss: 0.2231, test_loss: 1.7345, test_f1: 0.6389
 epoch: 99, train_loss: 0.2102, test_loss: 1.8090, test_f1: 0.6264
##################ITERATION #4 ****************************************
 epoch: 0, train_loss: 1.2079, test_loss: 0.9621, test_f1: 0.4683
 epoch: 1, train_loss: 0.9789, test_loss: 0.9378, test_f1: 0.4888
 epoch: 2, train_loss: 0.9438, test_loss: 0.9858, test_f1: 0.5096
 epoch: 3, train_loss: 0.9167, test_loss: 0.9750, test_f1: 0.5303
 epoch: 4, train_loss: 0.9000, test_loss: 0.9882, test_f1: 0.4987
 epoch: 5, train_loss: 0.8719, test_loss: 0.9710, test_f1: 0.5011
 epoch: 6, train_loss: 0.8584, test_loss: 0.9383, test_f1: 0.5585
 epoch: 7, train_loss: 0.8442, test_loss: 0.9602, test_f1: 0.5662
 epoch: 8, train_loss: 0.8321, test_loss: 0.8969, test_f1: 0.5322
 epoch: 9, train_loss: 0.8316, test_loss: 0.9806, test_f1: 0.5563
 epoch: 10, train_loss: 0.7997, test_loss: 0.9615, test_f1: 0.5593
 epoch: 11, train_loss: 0.8006, test_loss: 1.0479, test_f1: 0.5638
 epoch: 12, train_loss: 0.7940, test_loss: 0.8966, test_f1: 0.5571
 epoch: 13, train_loss: 0.7679, test_loss: 1.0362, test_f1: 0.5813
 epoch: 14, train_loss: 0.7545, test_loss: 0.9331, test_f1: 0.5967
 epoch: 15, train_loss: 0.7448, test_loss: 0.9601, test_f1: 0.5831
 epoch: 16, train_loss: 0.7363, test_loss: 0.9742, test_f1: 0.5913
 epoch: 17, train_loss: 0.7352, test_loss: 1.0026, test_f1: 0.6056
 epoch: 18, train_loss: 0.7136, test_loss: 1.0674, test_f1: 0.5831
 epoch: 19, train_loss: 0.7141, test_loss: 1.0512, test_f1: 0.5784
 epoch: 20, train_loss: 0.7155, test_loss: 1.0314, test_f1: 0.5897
 epoch: 21, train_loss: 0.6826, test_loss: 0.9835, test_f1: 0.5648
 epoch: 22, train_loss: 0.6683, test_loss: 1.0647, test_f1: 0.5994
 epoch: 23, train_loss: 0.6868, test_loss: 0.9367, test_f1: 0.5843
 epoch: 24, train_loss: 0.6625, test_loss: 1.0373, test_f1: 0.6174
 epoch: 25, train_loss: 0.6337, test_loss: 1.0503, test_f1: 0.6064
 epoch: 26, train_loss: 0.6542, test_loss: 0.9568, test_f1: 0.6285
 epoch: 27, train_loss: 0.6304, test_loss: 0.9941, test_f1: 0.6324
 epoch: 28, train_loss: 0.6276, test_loss: 1.0598, test_f1: 0.5819
 epoch: 29, train_loss: 0.6127, test_loss: 1.1087, test_f1: 0.5773
 epoch: 30, train_loss: 0.5993, test_loss: 1.0884, test_f1: 0.6030
 epoch: 31, train_loss: 0.5884, test_loss: 1.1057, test_f1: 0.5907
 epoch: 32, train_loss: 0.5963, test_loss: 1.0140, test_f1: 0.6067
 epoch: 33, train_loss: 0.5749, test_loss: 0.8868, test_f1: 0.6185
 epoch: 34, train_loss: 0.5984, test_loss: 1.2615, test_f1: 0.5566
 epoch: 35, train_loss: 0.5779, test_loss: 1.1218, test_f1: 0.6169
 epoch: 36, train_loss: 0.5732, test_loss: 0.9976, test_f1: 0.6545
 epoch: 37, train_loss: 0.5450, test_loss: 1.0382, test_f1: 0.6259
 epoch: 38, train_loss: 0.5260, test_loss: 1.0245, test_f1: 0.6376
 epoch: 39, train_loss: 0.5150, test_loss: 1.0825, test_f1: 0.6370
 epoch: 40, train_loss: 0.5230, test_loss: 1.1234, test_f1: 0.6261
 epoch: 41, train_loss: 0.5084, test_loss: 1.1714, test_f1: 0.6326
 epoch: 42, train_loss: 0.5310, test_loss: 1.0790, test_f1: 0.6524
 epoch: 43, train_loss: 0.5103, test_loss: 1.1015, test_f1: 0.6069
 epoch: 44, train_loss: 0.4870, test_loss: 1.1444, test_f1: 0.6579
 epoch: 45, train_loss: 0.4805, test_loss: 1.3959, test_f1: 0.6274
 epoch: 46, train_loss: 0.4681, test_loss: 1.1362, test_f1: 0.6778
 epoch: 47, train_loss: 0.4708, test_loss: 1.1370, test_f1: 0.6642
 epoch: 48, train_loss: 0.4799, test_loss: 1.2326, test_f1: 0.6710
 epoch: 49, train_loss: 0.4852, test_loss: 1.1089, test_f1: 0.5998
 epoch: 50, train_loss: 0.4567, test_loss: 1.1128, test_f1: 0.6994
 epoch: 51, train_loss: 0.4082, test_loss: 1.2018, test_f1: 0.6749
 epoch: 52, train_loss: 0.3836, test_loss: 1.2584, test_f1: 0.6579
 epoch: 53, train_loss: 0.3768, test_loss: 1.2356, test_f1: 0.6757
 epoch: 54, train_loss: 0.3590, test_loss: 1.2397, test_f1: 0.6750
 epoch: 55, train_loss: 0.3323, test_loss: 1.2989, test_f1: 0.6737
 epoch: 56, train_loss: 0.3409, test_loss: 1.3921, test_f1: 0.6791
 epoch: 57, train_loss: 0.3333, test_loss: 1.3938, test_f1: 0.6725
 epoch: 58, train_loss: 0.3244, test_loss: 1.3931, test_f1: 0.6611
 epoch: 59, train_loss: 0.3089, test_loss: 1.3422, test_f1: 0.6755
 epoch: 60, train_loss: 0.3030, test_loss: 1.4379, test_f1: 0.6911
 epoch: 61, train_loss: 0.3211, test_loss: 1.4944, test_f1: 0.6558
 epoch: 62, train_loss: 0.3096, test_loss: 1.3993, test_f1: 0.6584
 epoch: 63, train_loss: 0.3079, test_loss: 1.4747, test_f1: 0.6747
 epoch: 64, train_loss: 0.2892, test_loss: 1.5575, test_f1: 0.6729
 epoch: 65, train_loss: 0.2829, test_loss: 1.5459, test_f1: 0.6663
 epoch: 66, train_loss: 0.2718, test_loss: 1.4892, test_f1: 0.6485
 epoch: 67, train_loss: 0.2789, test_loss: 1.5016, test_f1: 0.6583
 epoch: 68, train_loss: 0.2836, test_loss: 1.5243, test_f1: 0.6519
 epoch: 69, train_loss: 0.3062, test_loss: 1.5893, test_f1: 0.6369
 epoch: 70, train_loss: 0.2939, test_loss: 1.5160, test_f1: 0.6619
 epoch: 71, train_loss: 0.2783, test_loss: 1.5657, test_f1: 0.6640
 epoch: 72, train_loss: 0.2693, test_loss: 1.5054, test_f1: 0.6658
 epoch: 73, train_loss: 0.2880, test_loss: 1.4734, test_f1: 0.6654
 epoch: 74, train_loss: 0.2557, test_loss: 1.5312, test_f1: 0.6617
 epoch: 75, train_loss: 0.2657, test_loss: 1.4545, test_f1: 0.6865
 epoch: 76, train_loss: 0.2459, test_loss: 1.5315, test_f1: 0.6789
 epoch: 77, train_loss: 0.2528, test_loss: 1.5316, test_f1: 0.6687
 epoch: 78, train_loss: 0.2574, test_loss: 1.4981, test_f1: 0.6609
 epoch: 79, train_loss: 0.2414, test_loss: 1.6630, test_f1: 0.6698
 epoch: 80, train_loss: 0.2479, test_loss: 1.6018, test_f1: 0.6517
 epoch: 81, train_loss: 0.2200, test_loss: 1.5895, test_f1: 0.6675
 epoch: 82, train_loss: 0.2339, test_loss: 1.5332, test_f1: 0.6856
 epoch: 83, train_loss: 0.2596, test_loss: 1.6051, test_f1: 0.6541
 epoch: 84, train_loss: 0.2486, test_loss: 1.6469, test_f1: 0.6771
 epoch: 85, train_loss: 0.2464, test_loss: 1.6306, test_f1: 0.6793
 epoch: 86, train_loss: 0.2359, test_loss: 1.6326, test_f1: 0.6489
 epoch: 87, train_loss: 0.2263, test_loss: 1.6962, test_f1: 0.6466
 epoch: 88, train_loss: 0.2141, test_loss: 1.7020, test_f1: 0.6601
 epoch: 89, train_loss: 0.2113, test_loss: 1.7070, test_f1: 0.6230
 epoch: 90, train_loss: 0.2272, test_loss: 1.5628, test_f1: 0.6635
 epoch: 91, train_loss: 0.2206, test_loss: 1.6760, test_f1: 0.6382
 epoch: 92, train_loss: 0.2238, test_loss: 1.8106, test_f1: 0.6507
 epoch: 93, train_loss: 0.2018, test_loss: 1.7884, test_f1: 0.6420
 epoch: 94, train_loss: 0.2032, test_loss: 1.6960, test_f1: 0.6486
 epoch: 95, train_loss: 0.2132, test_loss: 1.6016, test_f1: 0.6363
 epoch: 96, train_loss: 0.2243, test_loss: 1.5365, test_f1: 0.6547
 epoch: 97, train_loss: 0.2162, test_loss: 1.6465, test_f1: 0.6535
 epoch: 98, train_loss: 0.2035, test_loss: 1.6624, test_f1: 0.6784
 epoch: 99, train_loss: 0.2372, test_loss: 1.6228, test_f1: 0.6363
##################ITERATION #5 ****************************************
 epoch: 0, train_loss: 1.3103, test_loss: 1.0335, test_f1: 0.4552
 epoch: 1, train_loss: 0.9934, test_loss: 0.9751, test_f1: 0.4986
 epoch: 2, train_loss: 0.9414, test_loss: 0.9931, test_f1: 0.4735
 epoch: 3, train_loss: 0.9353, test_loss: 0.9701, test_f1: 0.5227
 epoch: 4, train_loss: 0.9100, test_loss: 0.9714, test_f1: 0.5276
 epoch: 5, train_loss: 0.8923, test_loss: 0.9553, test_f1: 0.5489
 epoch: 6, train_loss: 0.8726, test_loss: 0.9997, test_f1: 0.5485
 epoch: 7, train_loss: 0.8533, test_loss: 0.9839, test_f1: 0.5332
 epoch: 8, train_loss: 0.8401, test_loss: 0.9572, test_f1: 0.5732
 epoch: 9, train_loss: 0.8268, test_loss: 0.9884, test_f1: 0.5704
 epoch: 10, train_loss: 0.8339, test_loss: 0.9895, test_f1: 0.5196
 epoch: 11, train_loss: 0.8057, test_loss: 0.9459, test_f1: 0.5854
 epoch: 12, train_loss: 0.7937, test_loss: 0.9831, test_f1: 0.5933
 epoch: 13, train_loss: 0.7885, test_loss: 0.9502, test_f1: 0.5869
 epoch: 14, train_loss: 0.7614, test_loss: 0.9079, test_f1: 0.6025
 epoch: 15, train_loss: 0.7684, test_loss: 0.9522, test_f1: 0.6282
 epoch: 16, train_loss: 0.7604, test_loss: 0.9315, test_f1: 0.5755
 epoch: 17, train_loss: 0.7505, test_loss: 0.9907, test_f1: 0.6023
 epoch: 18, train_loss: 0.7319, test_loss: 0.9533, test_f1: 0.5897
 epoch: 19, train_loss: 0.7238, test_loss: 0.9972, test_f1: 0.6265
 epoch: 20, train_loss: 0.7235, test_loss: 0.9562, test_f1: 0.6097
 epoch: 21, train_loss: 0.7038, test_loss: 1.0635, test_f1: 0.5840
 epoch: 22, train_loss: 0.6982, test_loss: 1.0494, test_f1: 0.6262
 epoch: 23, train_loss: 0.6743, test_loss: 1.0559, test_f1: 0.6010
 epoch: 24, train_loss: 0.6734, test_loss: 1.0394, test_f1: 0.6234
 epoch: 25, train_loss: 0.6826, test_loss: 1.0912, test_f1: 0.6443
 epoch: 26, train_loss: 0.6833, test_loss: 1.0492, test_f1: 0.6085
 epoch: 27, train_loss: 0.6543, test_loss: 1.0512, test_f1: 0.6326
 epoch: 28, train_loss: 0.6400, test_loss: 1.0010, test_f1: 0.6453
 epoch: 29, train_loss: 0.6383, test_loss: 1.2037, test_f1: 0.5935
 epoch: 30, train_loss: 0.6235, test_loss: 1.0063, test_f1: 0.6032
 epoch: 31, train_loss: 0.6052, test_loss: 1.1178, test_f1: 0.6678
 epoch: 32, train_loss: 0.6110, test_loss: 1.1125, test_f1: 0.6219
 epoch: 33, train_loss: 0.6039, test_loss: 1.0422, test_f1: 0.6333
 epoch: 34, train_loss: 0.5874, test_loss: 1.0634, test_f1: 0.6313
 epoch: 35, train_loss: 0.5681, test_loss: 1.0761, test_f1: 0.6649
 epoch: 36, train_loss: 0.5589, test_loss: 1.1686, test_f1: 0.6441
 epoch: 37, train_loss: 0.5739, test_loss: 1.2116, test_f1: 0.6309
 epoch: 38, train_loss: 0.5574, test_loss: 1.1324, test_f1: 0.6376
 epoch: 39, train_loss: 0.5516, test_loss: 1.0835, test_f1: 0.6859
 epoch: 40, train_loss: 0.5273, test_loss: 1.1682, test_f1: 0.6198
 epoch: 41, train_loss: 0.5333, test_loss: 1.1294, test_f1: 0.6224
 epoch: 42, train_loss: 0.5259, test_loss: 1.1863, test_f1: 0.6197
 epoch: 43, train_loss: 0.5257, test_loss: 1.0857, test_f1: 0.6472
 epoch: 44, train_loss: 0.4812, test_loss: 1.2381, test_f1: 0.6151
 epoch: 45, train_loss: 0.4885, test_loss: 1.2138, test_f1: 0.6380
 epoch: 46, train_loss: 0.4999, test_loss: 1.1215, test_f1: 0.6538
 epoch: 47, train_loss: 0.4764, test_loss: 1.2153, test_f1: 0.6446
 epoch: 48, train_loss: 0.4837, test_loss: 1.1093, test_f1: 0.6453
 epoch: 49, train_loss: 0.4756, test_loss: 1.1448, test_f1: 0.6233
 epoch: 50, train_loss: 0.4542, test_loss: 1.1803, test_f1: 0.6648
 epoch: 51, train_loss: 0.4132, test_loss: 1.2018, test_f1: 0.6572
 epoch: 52, train_loss: 0.3823, test_loss: 1.2400, test_f1: 0.6744
 epoch: 53, train_loss: 0.3593, test_loss: 1.3456, test_f1: 0.6592
 epoch: 54, train_loss: 0.3755, test_loss: 1.3733, test_f1: 0.6824
 epoch: 55, train_loss: 0.3437, test_loss: 1.3247, test_f1: 0.6434
 epoch: 56, train_loss: 0.3559, test_loss: 1.4241, test_f1: 0.6540
 epoch: 57, train_loss: 0.3489, test_loss: 1.4388, test_f1: 0.6684
 epoch: 58, train_loss: 0.3303, test_loss: 1.4324, test_f1: 0.6587
 epoch: 59, train_loss: 0.3241, test_loss: 1.4900, test_f1: 0.6628
 epoch: 60, train_loss: 0.3310, test_loss: 1.4307, test_f1: 0.6763
 epoch: 61, train_loss: 0.3274, test_loss: 1.3823, test_f1: 0.6753
 epoch: 62, train_loss: 0.2973, test_loss: 1.5295, test_f1: 0.6446
 epoch: 63, train_loss: 0.3216, test_loss: 1.5151, test_f1: 0.6604
 epoch: 64, train_loss: 0.3104, test_loss: 1.4329, test_f1: 0.6564
 epoch: 65, train_loss: 0.2966, test_loss: 1.4593, test_f1: 0.6666
 epoch: 66, train_loss: 0.2879, test_loss: 1.5879, test_f1: 0.6550
 epoch: 67, train_loss: 0.2852, test_loss: 1.6377, test_f1: 0.6295
 epoch: 68, train_loss: 0.2975, test_loss: 1.5949, test_f1: 0.6537
 epoch: 69, train_loss: 0.2727, test_loss: 1.6228, test_f1: 0.6561
 epoch: 70, train_loss: 0.2816, test_loss: 1.5075, test_f1: 0.6806
 epoch: 71, train_loss: 0.2671, test_loss: 1.6421, test_f1: 0.6452
 epoch: 72, train_loss: 0.2625, test_loss: 1.6498, test_f1: 0.6471
 epoch: 73, train_loss: 0.2641, test_loss: 1.6186, test_f1: 0.6590
 epoch: 74, train_loss: 0.2804, test_loss: 1.6496, test_f1: 0.6404
 epoch: 75, train_loss: 0.2774, test_loss: 1.6863, test_f1: 0.6427
 epoch: 76, train_loss: 0.2500, test_loss: 1.6178, test_f1: 0.6587
 epoch: 77, train_loss: 0.2632, test_loss: 1.6886, test_f1: 0.6754
 epoch: 78, train_loss: 0.2512, test_loss: 1.7623, test_f1: 0.6514
 epoch: 79, train_loss: 0.2716, test_loss: 1.7301, test_f1: 0.6730
 epoch: 80, train_loss: 0.2605, test_loss: 1.7700, test_f1: 0.6601
 epoch: 81, train_loss: 0.2521, test_loss: 1.7567, test_f1: 0.6539
 epoch: 82, train_loss: 0.2617, test_loss: 1.6129, test_f1: 0.6839
 epoch: 83, train_loss: 0.2387, test_loss: 1.8162, test_f1: 0.6345
 epoch: 84, train_loss: 0.2297, test_loss: 1.7657, test_f1: 0.6582
 epoch: 85, train_loss: 0.2374, test_loss: 1.8252, test_f1: 0.6626
 epoch: 86, train_loss: 0.2234, test_loss: 1.8069, test_f1: 0.6518
 epoch: 87, train_loss: 0.2371, test_loss: 1.7961, test_f1: 0.6765
 epoch: 88, train_loss: 0.2401, test_loss: 1.8331, test_f1: 0.6591
 epoch: 89, train_loss: 0.2310, test_loss: 1.7971, test_f1: 0.6541
 epoch: 90, train_loss: 0.2095, test_loss: 1.8058, test_f1: 0.6772
 epoch: 91, train_loss: 0.2144, test_loss: 1.9016, test_f1: 0.6728
 epoch: 92, train_loss: 0.2066, test_loss: 1.8279, test_f1: 0.6584
 epoch: 93, train_loss: 0.2189, test_loss: 1.8887, test_f1: 0.6477
 epoch: 94, train_loss: 0.2216, test_loss: 1.9310, test_f1: 0.6375
 epoch: 95, train_loss: 0.2114, test_loss: 1.8256, test_f1: 0.6504
 epoch: 96, train_loss: 0.2142, test_loss: 1.9169, test_f1: 0.6522
 epoch: 97, train_loss: 0.2262, test_loss: 1.9722, test_f1: 0.6497
 epoch: 98, train_loss: 0.2074, test_loss: 1.9551, test_f1: 0.6481
 epoch: 99, train_loss: 0.1971, test_loss: 2.0810, test_f1: 0.6505
##################ITERATION #6 ****************************************
 epoch: 0, train_loss: 1.3031, test_loss: 1.0372, test_f1: 0.4623
 epoch: 1, train_loss: 1.0161, test_loss: 0.9655, test_f1: 0.5319
 epoch: 2, train_loss: 0.9578, test_loss: 0.9590, test_f1: 0.5332
 epoch: 3, train_loss: 0.9292, test_loss: 0.9004, test_f1: 0.5348
 epoch: 4, train_loss: 0.9190, test_loss: 0.9496, test_f1: 0.5508
 epoch: 5, train_loss: 0.8670, test_loss: 0.9313, test_f1: 0.5211
 epoch: 6, train_loss: 0.8633, test_loss: 0.9016, test_f1: 0.5795
 epoch: 7, train_loss: 0.8605, test_loss: 0.9523, test_f1: 0.5470
 epoch: 8, train_loss: 0.8306, test_loss: 0.9380, test_f1: 0.5955
 epoch: 9, train_loss: 0.8295, test_loss: 0.9462, test_f1: 0.5778
 epoch: 10, train_loss: 0.8153, test_loss: 0.9081, test_f1: 0.5862
 epoch: 11, train_loss: 0.7973, test_loss: 0.9276, test_f1: 0.5837
 epoch: 12, train_loss: 0.7932, test_loss: 0.9151, test_f1: 0.5824
 epoch: 13, train_loss: 0.7720, test_loss: 0.8863, test_f1: 0.5947
 epoch: 14, train_loss: 0.7788, test_loss: 0.9379, test_f1: 0.5685
 epoch: 15, train_loss: 0.7746, test_loss: 0.9156, test_f1: 0.6101
 epoch: 16, train_loss: 0.7672, test_loss: 0.9413, test_f1: 0.5874
 epoch: 17, train_loss: 0.7443, test_loss: 0.9176, test_f1: 0.6072
 epoch: 18, train_loss: 0.7385, test_loss: 0.9713, test_f1: 0.6196
 epoch: 19, train_loss: 0.7428, test_loss: 0.9082, test_f1: 0.5998
 epoch: 20, train_loss: 0.7258, test_loss: 0.9601, test_f1: 0.5947
 epoch: 21, train_loss: 0.7246, test_loss: 0.9501, test_f1: 0.5896
 epoch: 22, train_loss: 0.7015, test_loss: 0.9419, test_f1: 0.6307
 epoch: 23, train_loss: 0.7136, test_loss: 0.9101, test_f1: 0.6199
 epoch: 24, train_loss: 0.6880, test_loss: 0.9801, test_f1: 0.6297
 epoch: 25, train_loss: 0.7009, test_loss: 0.9526, test_f1: 0.5803
 epoch: 26, train_loss: 0.6786, test_loss: 0.9603, test_f1: 0.6104
 epoch: 27, train_loss: 0.6643, test_loss: 1.0503, test_f1: 0.6198
 epoch: 28, train_loss: 0.6578, test_loss: 0.9265, test_f1: 0.6161
 epoch: 29, train_loss: 0.6599, test_loss: 0.9869, test_f1: 0.6278
 epoch: 30, train_loss: 0.6585, test_loss: 0.9916, test_f1: 0.6294
 epoch: 31, train_loss: 0.6398, test_loss: 1.0821, test_f1: 0.6340
 epoch: 32, train_loss: 0.6478, test_loss: 1.0680, test_f1: 0.5894
 epoch: 33, train_loss: 0.6360, test_loss: 0.9587, test_f1: 0.6155
 epoch: 34, train_loss: 0.6374, test_loss: 1.2024, test_f1: 0.6065
 epoch: 35, train_loss: 0.6301, test_loss: 1.0627, test_f1: 0.6421
 epoch: 36, train_loss: 0.6145, test_loss: 1.0530, test_f1: 0.6390
 epoch: 37, train_loss: 0.5873, test_loss: 1.0057, test_f1: 0.6196
 epoch: 38, train_loss: 0.5955, test_loss: 1.0048, test_f1: 0.6540
 epoch: 39, train_loss: 0.5866, test_loss: 1.0338, test_f1: 0.6382
 epoch: 40, train_loss: 0.5666, test_loss: 1.1104, test_f1: 0.6400
 epoch: 41, train_loss: 0.5739, test_loss: 0.9999, test_f1: 0.6642
 epoch: 42, train_loss: 0.5538, test_loss: 1.1374, test_f1: 0.6562
 epoch: 43, train_loss: 0.5411, test_loss: 1.1808, test_f1: 0.6266
 epoch: 44, train_loss: 0.5591, test_loss: 1.1364, test_f1: 0.6489
 epoch: 45, train_loss: 0.5516, test_loss: 1.0764, test_f1: 0.6708
 epoch: 46, train_loss: 0.5236, test_loss: 1.1816, test_f1: 0.6340
 epoch: 47, train_loss: 0.5309, test_loss: 1.1914, test_f1: 0.6547
 epoch: 48, train_loss: 0.5110, test_loss: 1.2239, test_f1: 0.6396
 epoch: 49, train_loss: 0.4880, test_loss: 1.1932, test_f1: 0.6427
 epoch: 50, train_loss: 0.4720, test_loss: 1.1061, test_f1: 0.6427
 epoch: 51, train_loss: 0.4513, test_loss: 1.1803, test_f1: 0.6692
 epoch: 52, train_loss: 0.4176, test_loss: 1.2675, test_f1: 0.6473
 epoch: 53, train_loss: 0.4149, test_loss: 1.3047, test_f1: 0.6591
 epoch: 54, train_loss: 0.3974, test_loss: 1.2253, test_f1: 0.6455
 epoch: 55, train_loss: 0.3726, test_loss: 1.3290, test_f1: 0.6612
 epoch: 56, train_loss: 0.3658, test_loss: 1.3888, test_f1: 0.6363
 epoch: 57, train_loss: 0.3681, test_loss: 1.3874, test_f1: 0.6554
 epoch: 58, train_loss: 0.3607, test_loss: 1.4440, test_f1: 0.6579
 epoch: 59, train_loss: 0.3494, test_loss: 1.5154, test_f1: 0.6386
 epoch: 60, train_loss: 0.3531, test_loss: 1.3874, test_f1: 0.6518
 epoch: 61, train_loss: 0.3462, test_loss: 1.3738, test_f1: 0.6455
 epoch: 62, train_loss: 0.3435, test_loss: 1.5769, test_f1: 0.6268
 epoch: 63, train_loss: 0.3455, test_loss: 1.4449, test_f1: 0.6402
 epoch: 64, train_loss: 0.3542, test_loss: 1.5289, test_f1: 0.6337
 epoch: 65, train_loss: 0.3461, test_loss: 1.5087, test_f1: 0.6452
 epoch: 66, train_loss: 0.3232, test_loss: 1.4601, test_f1: 0.6641
 epoch: 67, train_loss: 0.3313, test_loss: 1.3692, test_f1: 0.6585
 epoch: 68, train_loss: 0.3324, test_loss: 1.4544, test_f1: 0.6492
 epoch: 69, train_loss: 0.3203, test_loss: 1.6021, test_f1: 0.6414
 epoch: 70, train_loss: 0.3005, test_loss: 1.5902, test_f1: 0.6259
 epoch: 71, train_loss: 0.3011, test_loss: 1.4766, test_f1: 0.6658
 epoch: 72, train_loss: 0.2944, test_loss: 1.4507, test_f1: 0.6513
 epoch: 73, train_loss: 0.2984, test_loss: 1.3967, test_f1: 0.6638
 epoch: 74, train_loss: 0.2920, test_loss: 1.5285, test_f1: 0.6660
 epoch: 75, train_loss: 0.2947, test_loss: 1.5954, test_f1: 0.6283
 epoch: 76, train_loss: 0.2933, test_loss: 1.5367, test_f1: 0.6461
 epoch: 77, train_loss: 0.2956, test_loss: 1.6900, test_f1: 0.6282
 epoch: 78, train_loss: 0.2779, test_loss: 1.8003, test_f1: 0.6514
 epoch: 79, train_loss: 0.2760, test_loss: 1.6277, test_f1: 0.6453
 epoch: 80, train_loss: 0.2686, test_loss: 1.6036, test_f1: 0.6391
 epoch: 81, train_loss: 0.2574, test_loss: 1.6657, test_f1: 0.6494
 epoch: 82, train_loss: 0.2703, test_loss: 1.6656, test_f1: 0.6575
 epoch: 83, train_loss: 0.2508, test_loss: 1.7686, test_f1: 0.6382
 epoch: 84, train_loss: 0.2524, test_loss: 1.8301, test_f1: 0.6292
 epoch: 85, train_loss: 0.2592, test_loss: 1.6802, test_f1: 0.6477
 epoch: 86, train_loss: 0.2721, test_loss: 1.5494, test_f1: 0.6399
 epoch: 87, train_loss: 0.2608, test_loss: 1.6361, test_f1: 0.6147
 epoch: 88, train_loss: 0.2640, test_loss: 1.6289, test_f1: 0.6267
 epoch: 89, train_loss: 0.2243, test_loss: 1.8589, test_f1: 0.6396
 epoch: 90, train_loss: 0.2438, test_loss: 1.6646, test_f1: 0.6353
 epoch: 91, train_loss: 0.2536, test_loss: 1.6921, test_f1: 0.6520
 epoch: 92, train_loss: 0.2331, test_loss: 1.7482, test_f1: 0.6386
 epoch: 93, train_loss: 0.2301, test_loss: 1.7618, test_f1: 0.6400
 epoch: 94, train_loss: 0.2436, test_loss: 1.7867, test_f1: 0.6550
 epoch: 95, train_loss: 0.2304, test_loss: 1.6749, test_f1: 0.6522
 epoch: 96, train_loss: 0.2308, test_loss: 1.9808, test_f1: 0.6316
 epoch: 97, train_loss: 0.2315, test_loss: 1.7708, test_f1: 0.6514
 epoch: 98, train_loss: 0.1953, test_loss: 1.9040, test_f1: 0.6197
 epoch: 99, train_loss: 0.2013, test_loss: 1.7927, test_f1: 0.6460
##################ITERATION #7 ****************************************
 epoch: 0, train_loss: 1.2439, test_loss: 1.0486, test_f1: 0.4581
 epoch: 1, train_loss: 0.9936, test_loss: 0.9396, test_f1: 0.4952
 epoch: 2, train_loss: 0.9410, test_loss: 0.9218, test_f1: 0.5101
 epoch: 3, train_loss: 0.9162, test_loss: 0.9093, test_f1: 0.5063
 epoch: 4, train_loss: 0.9023, test_loss: 0.8718, test_f1: 0.5206
 epoch: 5, train_loss: 0.8676, test_loss: 0.8585, test_f1: 0.5535
 epoch: 6, train_loss: 0.8608, test_loss: 0.9176, test_f1: 0.5329
 epoch: 7, train_loss: 0.8403, test_loss: 1.0135, test_f1: 0.5093
 epoch: 8, train_loss: 0.8430, test_loss: 0.9059, test_f1: 0.5607
 epoch: 9, train_loss: 0.8254, test_loss: 0.9138, test_f1: 0.5580
 epoch: 10, train_loss: 0.7991, test_loss: 0.9322, test_f1: 0.5680
 epoch: 11, train_loss: 0.8103, test_loss: 0.9456, test_f1: 0.5537
 epoch: 12, train_loss: 0.7998, test_loss: 1.0348, test_f1: 0.5162
 epoch: 13, train_loss: 0.7804, test_loss: 0.9106, test_f1: 0.5678
 epoch: 14, train_loss: 0.7646, test_loss: 0.8954, test_f1: 0.5915
 epoch: 15, train_loss: 0.7509, test_loss: 0.9023, test_f1: 0.5981
 epoch: 16, train_loss: 0.7439, test_loss: 0.9203, test_f1: 0.5689
 epoch: 17, train_loss: 0.7372, test_loss: 0.9331, test_f1: 0.6061
 epoch: 18, train_loss: 0.7280, test_loss: 0.9759, test_f1: 0.6284
 epoch: 19, train_loss: 0.7170, test_loss: 0.9400, test_f1: 0.6123
 epoch: 20, train_loss: 0.7026, test_loss: 0.9230, test_f1: 0.6179
 epoch: 21, train_loss: 0.6998, test_loss: 0.9465, test_f1: 0.5928
 epoch: 22, train_loss: 0.6894, test_loss: 1.0092, test_f1: 0.6063
 epoch: 23, train_loss: 0.6850, test_loss: 0.9530, test_f1: 0.6260
 epoch: 24, train_loss: 0.6763, test_loss: 0.9086, test_f1: 0.6301
 epoch: 25, train_loss: 0.6587, test_loss: 0.9360, test_f1: 0.6375
 epoch: 26, train_loss: 0.6507, test_loss: 1.0719, test_f1: 0.5898
 epoch: 27, train_loss: 0.6570, test_loss: 0.9826, test_f1: 0.6428
 epoch: 28, train_loss: 0.6319, test_loss: 0.9742, test_f1: 0.6531
 epoch: 29, train_loss: 0.6407, test_loss: 0.9749, test_f1: 0.6348
 epoch: 30, train_loss: 0.6203, test_loss: 1.0018, test_f1: 0.6239
 epoch: 31, train_loss: 0.6142, test_loss: 0.9634, test_f1: 0.6542
 epoch: 32, train_loss: 0.6122, test_loss: 0.9155, test_f1: 0.6336
 epoch: 33, train_loss: 0.6027, test_loss: 0.9639, test_f1: 0.6299
 epoch: 34, train_loss: 0.5747, test_loss: 1.0643, test_f1: 0.6551
 epoch: 35, train_loss: 0.5776, test_loss: 1.0956, test_f1: 0.6176
 epoch: 36, train_loss: 0.5776, test_loss: 1.0285, test_f1: 0.6346
 epoch: 37, train_loss: 0.5553, test_loss: 1.0024, test_f1: 0.6562
 epoch: 38, train_loss: 0.5745, test_loss: 1.0997, test_f1: 0.6483
 epoch: 39, train_loss: 0.5296, test_loss: 1.0526, test_f1: 0.6571
 epoch: 40, train_loss: 0.5428, test_loss: 1.0171, test_f1: 0.6367
 epoch: 41, train_loss: 0.5081, test_loss: 1.0425, test_f1: 0.6502
 epoch: 42, train_loss: 0.5236, test_loss: 1.0472, test_f1: 0.6519
 epoch: 43, train_loss: 0.5074, test_loss: 1.0906, test_f1: 0.6438
 epoch: 44, train_loss: 0.4912, test_loss: 1.0283, test_f1: 0.6253
 epoch: 45, train_loss: 0.4880, test_loss: 1.0446, test_f1: 0.6625
 epoch: 46, train_loss: 0.4903, test_loss: 1.1386, test_f1: 0.6545
 epoch: 47, train_loss: 0.4829, test_loss: 1.0528, test_f1: 0.6334
 epoch: 48, train_loss: 0.4693, test_loss: 1.1589, test_f1: 0.6320
 epoch: 49, train_loss: 0.4588, test_loss: 1.1204, test_f1: 0.6741
 epoch: 50, train_loss: 0.4362, test_loss: 1.1610, test_f1: 0.6640
 epoch: 51, train_loss: 0.3913, test_loss: 1.1472, test_f1: 0.6414
 epoch: 52, train_loss: 0.3568, test_loss: 1.1931, test_f1: 0.6566
 epoch: 53, train_loss: 0.3651, test_loss: 1.1956, test_f1: 0.6504
 epoch: 54, train_loss: 0.3516, test_loss: 1.2372, test_f1: 0.6347
 epoch: 55, train_loss: 0.3466, test_loss: 1.2556, test_f1: 0.6507
 epoch: 56, train_loss: 0.3209, test_loss: 1.3223, test_f1: 0.6454
 epoch: 57, train_loss: 0.3252, test_loss: 1.3626, test_f1: 0.6420
 epoch: 58, train_loss: 0.3066, test_loss: 1.3498, test_f1: 0.6450
 epoch: 59, train_loss: 0.3131, test_loss: 1.4455, test_f1: 0.6590
 epoch: 60, train_loss: 0.3116, test_loss: 1.4404, test_f1: 0.6293
 epoch: 61, train_loss: 0.3146, test_loss: 1.4049, test_f1: 0.6546
 epoch: 62, train_loss: 0.2936, test_loss: 1.5179, test_f1: 0.6275
 epoch: 63, train_loss: 0.3125, test_loss: 1.4018, test_f1: 0.6519
 epoch: 64, train_loss: 0.3013, test_loss: 1.3946, test_f1: 0.6592
 epoch: 65, train_loss: 0.2969, test_loss: 1.3461, test_f1: 0.6408
 epoch: 66, train_loss: 0.3099, test_loss: 1.3898, test_f1: 0.6436
 epoch: 67, train_loss: 0.2902, test_loss: 1.3857, test_f1: 0.6597
 epoch: 68, train_loss: 0.2923, test_loss: 1.5436, test_f1: 0.6365
 epoch: 69, train_loss: 0.2741, test_loss: 1.4461, test_f1: 0.6604
 epoch: 70, train_loss: 0.2724, test_loss: 1.4136, test_f1: 0.6500
 epoch: 71, train_loss: 0.2528, test_loss: 1.5758, test_f1: 0.6488
 epoch: 72, train_loss: 0.2554, test_loss: 1.5733, test_f1: 0.6343
 epoch: 73, train_loss: 0.2628, test_loss: 1.5922, test_f1: 0.6536
 epoch: 74, train_loss: 0.2477, test_loss: 1.5740, test_f1: 0.6393
 epoch: 75, train_loss: 0.2473, test_loss: 1.5148, test_f1: 0.6244
 epoch: 76, train_loss: 0.2580, test_loss: 1.5318, test_f1: 0.6402
 epoch: 77, train_loss: 0.2614, test_loss: 1.5030, test_f1: 0.6654
 epoch: 78, train_loss: 0.2579, test_loss: 1.6212, test_f1: 0.6386
 epoch: 79, train_loss: 0.2357, test_loss: 1.7513, test_f1: 0.6323
 epoch: 80, train_loss: 0.2297, test_loss: 1.7259, test_f1: 0.6373
 epoch: 81, train_loss: 0.2243, test_loss: 1.6869, test_f1: 0.6583
 epoch: 82, train_loss: 0.2303, test_loss: 1.7392, test_f1: 0.6364
 epoch: 83, train_loss: 0.2324, test_loss: 1.6811, test_f1: 0.6463
 epoch: 84, train_loss: 0.2176, test_loss: 1.7260, test_f1: 0.6420
 epoch: 85, train_loss: 0.2193, test_loss: 1.6827, test_f1: 0.6345
 epoch: 86, train_loss: 0.2148, test_loss: 1.7266, test_f1: 0.6400
 epoch: 87, train_loss: 0.2130, test_loss: 1.6435, test_f1: 0.6374
 epoch: 88, train_loss: 0.2202, test_loss: 1.6685, test_f1: 0.6321
 epoch: 89, train_loss: 0.2382, test_loss: 1.5986, test_f1: 0.6380
 epoch: 90, train_loss: 0.2368, test_loss: 1.6737, test_f1: 0.6329
 epoch: 91, train_loss: 0.2207, test_loss: 1.7346, test_f1: 0.6356
 epoch: 92, train_loss: 0.1934, test_loss: 1.6649, test_f1: 0.6464
 epoch: 93, train_loss: 0.2181, test_loss: 1.8140, test_f1: 0.6506
 epoch: 94, train_loss: 0.2182, test_loss: 1.7985, test_f1: 0.6320
 epoch: 95, train_loss: 0.2005, test_loss: 1.7346, test_f1: 0.6374
 epoch: 96, train_loss: 0.1878, test_loss: 1.7402, test_f1: 0.6540
 epoch: 97, train_loss: 0.2129, test_loss: 1.6940, test_f1: 0.6822
 epoch: 98, train_loss: 0.1985, test_loss: 1.7450, test_f1: 0.6394
 epoch: 99, train_loss: 0.1963, test_loss: 1.8166, test_f1: 0.6471
##################ITERATION #8 ****************************************
 epoch: 0, train_loss: 1.2963, test_loss: 1.0586, test_f1: 0.4515
 epoch: 1, train_loss: 1.0151, test_loss: 0.9152, test_f1: 0.5163
 epoch: 2, train_loss: 0.9761, test_loss: 0.9276, test_f1: 0.5230
 epoch: 3, train_loss: 0.9352, test_loss: 0.9543, test_f1: 0.5313
 epoch: 4, train_loss: 0.9284, test_loss: 0.9185, test_f1: 0.4910
 epoch: 5, train_loss: 0.9157, test_loss: 0.9433, test_f1: 0.5371
 epoch: 6, train_loss: 0.9027, test_loss: 0.9132, test_f1: 0.5231
 epoch: 7, train_loss: 0.8749, test_loss: 0.9065, test_f1: 0.5896
 epoch: 8, train_loss: 0.8504, test_loss: 0.9912, test_f1: 0.5209
 epoch: 9, train_loss: 0.8400, test_loss: 0.9663, test_f1: 0.5550
 epoch: 10, train_loss: 0.8244, test_loss: 0.9253, test_f1: 0.5978
 epoch: 11, train_loss: 0.8222, test_loss: 0.8923, test_f1: 0.5332
 epoch: 12, train_loss: 0.8056, test_loss: 0.9901, test_f1: 0.5555
 epoch: 13, train_loss: 0.8052, test_loss: 0.9847, test_f1: 0.5595
 epoch: 14, train_loss: 0.7762, test_loss: 0.9682, test_f1: 0.5865
 epoch: 15, train_loss: 0.7633, test_loss: 0.9240, test_f1: 0.5862
 epoch: 16, train_loss: 0.7832, test_loss: 0.9302, test_f1: 0.5951
 epoch: 17, train_loss: 0.7541, test_loss: 0.9545, test_f1: 0.5803
 epoch: 18, train_loss: 0.7486, test_loss: 0.9076, test_f1: 0.5962
 epoch: 19, train_loss: 0.7334, test_loss: 0.9773, test_f1: 0.5955
 epoch: 20, train_loss: 0.7323, test_loss: 0.9382, test_f1: 0.5928
 epoch: 21, train_loss: 0.7222, test_loss: 1.0552, test_f1: 0.6062
 epoch: 22, train_loss: 0.7133, test_loss: 0.9177, test_f1: 0.6405
 epoch: 23, train_loss: 0.6888, test_loss: 0.9666, test_f1: 0.6181
 epoch: 24, train_loss: 0.6966, test_loss: 1.0067, test_f1: 0.5661
 epoch: 25, train_loss: 0.7108, test_loss: 0.9429, test_f1: 0.6182
 epoch: 26, train_loss: 0.6671, test_loss: 0.9854, test_f1: 0.6013
 epoch: 27, train_loss: 0.6737, test_loss: 0.9663, test_f1: 0.5997
 epoch: 28, train_loss: 0.6714, test_loss: 1.0225, test_f1: 0.6147
 epoch: 29, train_loss: 0.6685, test_loss: 1.0868, test_f1: 0.5806
 epoch: 30, train_loss: 0.6381, test_loss: 0.9882, test_f1: 0.6152
 epoch: 31, train_loss: 0.6300, test_loss: 1.0049, test_f1: 0.5885
 epoch: 32, train_loss: 0.6311, test_loss: 1.0392, test_f1: 0.6006
 epoch: 33, train_loss: 0.6236, test_loss: 1.1361, test_f1: 0.5926
 epoch: 34, train_loss: 0.6064, test_loss: 1.0860, test_f1: 0.6230
 epoch: 35, train_loss: 0.5943, test_loss: 1.1015, test_f1: 0.6326
 epoch: 36, train_loss: 0.5988, test_loss: 1.1437, test_f1: 0.6321
 epoch: 37, train_loss: 0.5525, test_loss: 1.0679, test_f1: 0.6220
 epoch: 38, train_loss: 0.5666, test_loss: 1.2127, test_f1: 0.6359
 epoch: 39, train_loss: 0.5634, test_loss: 1.1230, test_f1: 0.6578
 epoch: 40, train_loss: 0.5548, test_loss: 1.3115, test_f1: 0.6103
 epoch: 41, train_loss: 0.5541, test_loss: 1.0762, test_f1: 0.6120
 epoch: 42, train_loss: 0.5479, test_loss: 1.1650, test_f1: 0.6338
 epoch: 43, train_loss: 0.5469, test_loss: 1.2080, test_f1: 0.5945
 epoch: 44, train_loss: 0.5417, test_loss: 1.1458, test_f1: 0.6259
 epoch: 45, train_loss: 0.5044, test_loss: 1.1358, test_f1: 0.6253
 epoch: 46, train_loss: 0.4972, test_loss: 1.2028, test_f1: 0.6337
 epoch: 47, train_loss: 0.4865, test_loss: 1.0965, test_f1: 0.6471
 epoch: 48, train_loss: 0.4886, test_loss: 1.0462, test_f1: 0.6519
 epoch: 49, train_loss: 0.5075, test_loss: 1.0643, test_f1: 0.6164
 epoch: 50, train_loss: 0.4907, test_loss: 1.1668, test_f1: 0.6363
 epoch: 51, train_loss: 0.4460, test_loss: 1.1593, test_f1: 0.6746
 epoch: 52, train_loss: 0.3986, test_loss: 1.2372, test_f1: 0.6447
 epoch: 53, train_loss: 0.3934, test_loss: 1.2029, test_f1: 0.6325
 epoch: 54, train_loss: 0.3666, test_loss: 1.3349, test_f1: 0.6559
 epoch: 55, train_loss: 0.3739, test_loss: 1.3244, test_f1: 0.6476
 epoch: 56, train_loss: 0.3493, test_loss: 1.3245, test_f1: 0.6609
 epoch: 57, train_loss: 0.3570, test_loss: 1.3561, test_f1: 0.6516
 epoch: 58, train_loss: 0.3488, test_loss: 1.3661, test_f1: 0.6396
 epoch: 59, train_loss: 0.3517, test_loss: 1.3524, test_f1: 0.6555
 epoch: 60, train_loss: 0.3471, test_loss: 1.3577, test_f1: 0.6367
 epoch: 61, train_loss: 0.3284, test_loss: 1.4305, test_f1: 0.6242
 epoch: 62, train_loss: 0.3534, test_loss: 1.4324, test_f1: 0.6313
 epoch: 63, train_loss: 0.3671, test_loss: 1.2906, test_f1: 0.6329
 epoch: 64, train_loss: 0.3368, test_loss: 1.4366, test_f1: 0.6172
 epoch: 65, train_loss: 0.3150, test_loss: 1.3391, test_f1: 0.6602
 epoch: 66, train_loss: 0.3155, test_loss: 1.3671, test_f1: 0.6487
 epoch: 67, train_loss: 0.3029, test_loss: 1.4640, test_f1: 0.6399
 epoch: 68, train_loss: 0.2960, test_loss: 1.5633, test_f1: 0.6532
 epoch: 69, train_loss: 0.3056, test_loss: 1.4284, test_f1: 0.6301
 epoch: 70, train_loss: 0.3027, test_loss: 1.5282, test_f1: 0.6078
 epoch: 71, train_loss: 0.3164, test_loss: 1.4831, test_f1: 0.6169
 epoch: 72, train_loss: 0.3000, test_loss: 1.5240, test_f1: 0.6315
 epoch: 73, train_loss: 0.2920, test_loss: 1.5390, test_f1: 0.6378
 epoch: 74, train_loss: 0.2748, test_loss: 1.6008, test_f1: 0.6075
 epoch: 75, train_loss: 0.2721, test_loss: 1.5378, test_f1: 0.6377
 epoch: 76, train_loss: 0.2808, test_loss: 1.6005, test_f1: 0.6221
 epoch: 77, train_loss: 0.2819, test_loss: 1.5858, test_f1: 0.6167
 epoch: 78, train_loss: 0.2774, test_loss: 1.6839, test_f1: 0.6206
 epoch: 79, train_loss: 0.2796, test_loss: 1.5366, test_f1: 0.6488
 epoch: 80, train_loss: 0.2470, test_loss: 1.6221, test_f1: 0.6276
 epoch: 81, train_loss: 0.2531, test_loss: 1.6304, test_f1: 0.6150
 epoch: 82, train_loss: 0.2590, test_loss: 1.5925, test_f1: 0.6141
 epoch: 83, train_loss: 0.2570, test_loss: 1.6297, test_f1: 0.6234
 epoch: 84, train_loss: 0.2573, test_loss: 1.5909, test_f1: 0.6340
 epoch: 85, train_loss: 0.2484, test_loss: 1.6116, test_f1: 0.6358
 epoch: 86, train_loss: 0.2708, test_loss: 1.6034, test_f1: 0.6309
 epoch: 87, train_loss: 0.2538, test_loss: 1.6327, test_f1: 0.6297
 epoch: 88, train_loss: 0.2455, test_loss: 1.5884, test_f1: 0.6393
 epoch: 89, train_loss: 0.2509, test_loss: 1.6863, test_f1: 0.6290
 epoch: 90, train_loss: 0.2393, test_loss: 1.7139, test_f1: 0.6292
 epoch: 91, train_loss: 0.2436, test_loss: 1.8139, test_f1: 0.6175
 epoch: 92, train_loss: 0.2354, test_loss: 1.9034, test_f1: 0.6305
 epoch: 93, train_loss: 0.2218, test_loss: 1.8087, test_f1: 0.6190
 epoch: 94, train_loss: 0.2248, test_loss: 1.7773, test_f1: 0.6268
 epoch: 95, train_loss: 0.2242, test_loss: 1.8349, test_f1: 0.6491
 epoch: 96, train_loss: 0.2268, test_loss: 1.9211, test_f1: 0.6193
 epoch: 97, train_loss: 0.2237, test_loss: 1.7679, test_f1: 0.6166
 epoch: 98, train_loss: 0.2163, test_loss: 1.9206, test_f1: 0.6210
 epoch: 99, train_loss: 0.2283, test_loss: 1.9233, test_f1: 0.6040
##################ITERATION #9 ****************************************
 epoch: 0, train_loss: 1.2659, test_loss: 1.0434, test_f1: 0.4441
 epoch: 1, train_loss: 0.9912, test_loss: 1.0107, test_f1: 0.4862
 epoch: 2, train_loss: 0.9424, test_loss: 1.0370, test_f1: 0.5065
 epoch: 3, train_loss: 0.9199, test_loss: 0.9430, test_f1: 0.4687
 epoch: 4, train_loss: 0.9055, test_loss: 0.9565, test_f1: 0.5094
 epoch: 5, train_loss: 0.8732, test_loss: 0.9251, test_f1: 0.5325
 epoch: 6, train_loss: 0.8594, test_loss: 0.9110, test_f1: 0.5403
 epoch: 7, train_loss: 0.8525, test_loss: 0.9487, test_f1: 0.5456
 epoch: 8, train_loss: 0.8421, test_loss: 0.9950, test_f1: 0.5230
 epoch: 9, train_loss: 0.8278, test_loss: 0.9521, test_f1: 0.5706
 epoch: 10, train_loss: 0.8225, test_loss: 0.9147, test_f1: 0.5558
 epoch: 11, train_loss: 0.7899, test_loss: 1.0365, test_f1: 0.5661
 epoch: 12, train_loss: 0.7908, test_loss: 0.8959, test_f1: 0.6063
 epoch: 13, train_loss: 0.7792, test_loss: 0.9506, test_f1: 0.5491
 epoch: 14, train_loss: 0.7727, test_loss: 0.9349, test_f1: 0.6195
 epoch: 15, train_loss: 0.7635, test_loss: 0.9089, test_f1: 0.5674
 epoch: 16, train_loss: 0.7510, test_loss: 0.9663, test_f1: 0.6214
 epoch: 17, train_loss: 0.7569, test_loss: 0.9322, test_f1: 0.6003
 epoch: 18, train_loss: 0.7228, test_loss: 0.9547, test_f1: 0.6000
 epoch: 19, train_loss: 0.7088, test_loss: 0.9509, test_f1: 0.6261
 epoch: 20, train_loss: 0.7032, test_loss: 0.9457, test_f1: 0.6327
 epoch: 21, train_loss: 0.7173, test_loss: 1.0192, test_f1: 0.5676
 epoch: 22, train_loss: 0.7115, test_loss: 0.9445, test_f1: 0.6324
 epoch: 23, train_loss: 0.6871, test_loss: 0.9506, test_f1: 0.6019
 epoch: 24, train_loss: 0.6940, test_loss: 0.9656, test_f1: 0.6135
 epoch: 25, train_loss: 0.6666, test_loss: 1.0220, test_f1: 0.5942
 epoch: 26, train_loss: 0.6681, test_loss: 0.9503, test_f1: 0.6060
 epoch: 27, train_loss: 0.6464, test_loss: 1.0811, test_f1: 0.6348
 epoch: 28, train_loss: 0.6369, test_loss: 1.1089, test_f1: 0.6141
 epoch: 29, train_loss: 0.6290, test_loss: 0.8966, test_f1: 0.6178
 epoch: 30, train_loss: 0.6133, test_loss: 1.1128, test_f1: 0.6098
 epoch: 31, train_loss: 0.6247, test_loss: 0.9442, test_f1: 0.6462
 epoch: 32, train_loss: 0.5866, test_loss: 1.0125, test_f1: 0.6477
 epoch: 33, train_loss: 0.5859, test_loss: 1.2951, test_f1: 0.5864
 epoch: 34, train_loss: 0.5786, test_loss: 0.9479, test_f1: 0.6443
 epoch: 35, train_loss: 0.5583, test_loss: 0.9998, test_f1: 0.6122
 epoch: 36, train_loss: 0.5689, test_loss: 1.0662, test_f1: 0.6269
 epoch: 37, train_loss: 0.5810, test_loss: 1.1086, test_f1: 0.6533
 epoch: 38, train_loss: 0.5513, test_loss: 1.1452, test_f1: 0.6419
 epoch: 39, train_loss: 0.5467, test_loss: 1.2230, test_f1: 0.6245
 epoch: 40, train_loss: 0.5340, test_loss: 1.1471, test_f1: 0.6451
 epoch: 41, train_loss: 0.5350, test_loss: 1.0621, test_f1: 0.6495
 epoch: 42, train_loss: 0.5154, test_loss: 1.0805, test_f1: 0.6188
 epoch: 43, train_loss: 0.5119, test_loss: 1.0792, test_f1: 0.6406
 epoch: 44, train_loss: 0.4933, test_loss: 1.1439, test_f1: 0.6463
 epoch: 45, train_loss: 0.4948, test_loss: 1.2411, test_f1: 0.5853
 epoch: 46, train_loss: 0.5142, test_loss: 1.0121, test_f1: 0.6153
 epoch: 47, train_loss: 0.4729, test_loss: 1.0265, test_f1: 0.6531
 epoch: 48, train_loss: 0.4790, test_loss: 0.9726, test_f1: 0.6576
 epoch: 49, train_loss: 0.4838, test_loss: 1.0127, test_f1: 0.6655
 epoch: 50, train_loss: 0.4762, test_loss: 1.1319, test_f1: 0.6384
 epoch: 51, train_loss: 0.4244, test_loss: 1.1004, test_f1: 0.6251
 epoch: 52, train_loss: 0.3966, test_loss: 1.2060, test_f1: 0.6398
 epoch: 53, train_loss: 0.3869, test_loss: 1.2600, test_f1: 0.6627
 epoch: 54, train_loss: 0.3667, test_loss: 1.2647, test_f1: 0.6271
 epoch: 55, train_loss: 0.3656, test_loss: 1.1904, test_f1: 0.6770
 epoch: 56, train_loss: 0.3624, test_loss: 1.2225, test_f1: 0.6757
 epoch: 57, train_loss: 0.3457, test_loss: 1.2971, test_f1: 0.6336
 epoch: 58, train_loss: 0.3531, test_loss: 1.3234, test_f1: 0.6426
 epoch: 59, train_loss: 0.3413, test_loss: 1.2536, test_f1: 0.6618
 epoch: 60, train_loss: 0.3205, test_loss: 1.2582, test_f1: 0.6783
 epoch: 61, train_loss: 0.3195, test_loss: 1.3530, test_f1: 0.6567
 epoch: 62, train_loss: 0.3184, test_loss: 1.4052, test_f1: 0.6458
 epoch: 63, train_loss: 0.3148, test_loss: 1.3628, test_f1: 0.6709
 epoch: 64, train_loss: 0.3175, test_loss: 1.3496, test_f1: 0.6456
 epoch: 65, train_loss: 0.3043, test_loss: 1.4100, test_f1: 0.6527
 epoch: 66, train_loss: 0.3120, test_loss: 1.4423, test_f1: 0.6179
 epoch: 67, train_loss: 0.2978, test_loss: 1.4869, test_f1: 0.6401
 epoch: 68, train_loss: 0.2913, test_loss: 1.4306, test_f1: 0.6436
 epoch: 69, train_loss: 0.2819, test_loss: 1.4404, test_f1: 0.6264
 epoch: 70, train_loss: 0.2711, test_loss: 1.4291, test_f1: 0.6612
 epoch: 71, train_loss: 0.2911, test_loss: 1.5480, test_f1: 0.6446
 epoch: 72, train_loss: 0.2796, test_loss: 1.4900, test_f1: 0.6570
 epoch: 73, train_loss: 0.2720, test_loss: 1.5233, test_f1: 0.6405
 epoch: 74, train_loss: 0.2540, test_loss: 1.6960, test_f1: 0.6227
 epoch: 75, train_loss: 0.2717, test_loss: 1.5378, test_f1: 0.6448
 epoch: 76, train_loss: 0.2566, test_loss: 1.4567, test_f1: 0.6709
 epoch: 77, train_loss: 0.2612, test_loss: 1.6439, test_f1: 0.6393
 epoch: 78, train_loss: 0.2411, test_loss: 1.4837, test_f1: 0.6631
 epoch: 79, train_loss: 0.2642, test_loss: 1.5463, test_f1: 0.6491
 epoch: 80, train_loss: 0.2588, test_loss: 1.6550, test_f1: 0.6404
 epoch: 81, train_loss: 0.2441, test_loss: 1.4142, test_f1: 0.6750
 epoch: 82, train_loss: 0.2552, test_loss: 1.5945, test_f1: 0.6470
 epoch: 83, train_loss: 0.2518, test_loss: 1.5651, test_f1: 0.6638
 epoch: 84, train_loss: 0.2461, test_loss: 1.6575, test_f1: 0.6346
 epoch: 85, train_loss: 0.2429, test_loss: 1.6084, test_f1: 0.6571
 epoch: 86, train_loss: 0.2591, test_loss: 1.7008, test_f1: 0.6153
 epoch: 87, train_loss: 0.2444, test_loss: 1.6398, test_f1: 0.6311
 epoch: 88, train_loss: 0.2332, test_loss: 1.7406, test_f1: 0.6095
 epoch: 89, train_loss: 0.2193, test_loss: 1.7451, test_f1: 0.6297
 epoch: 90, train_loss: 0.2307, test_loss: 1.6550, test_f1: 0.6591
 epoch: 91, train_loss: 0.2191, test_loss: 1.8304, test_f1: 0.6514
 epoch: 92, train_loss: 0.2145, test_loss: 1.8033, test_f1: 0.6481
 epoch: 93, train_loss: 0.2288, test_loss: 1.6130, test_f1: 0.6645
 epoch: 94, train_loss: 0.2165, test_loss: 1.8131, test_f1: 0.6354
 epoch: 95, train_loss: 0.2163, test_loss: 1.8540, test_f1: 0.6073
 epoch: 96, train_loss: 0.2113, test_loss: 1.9708, test_f1: 0.6501
 epoch: 97, train_loss: 0.2095, test_loss: 1.8660, test_f1: 0.6516
 epoch: 98, train_loss: 0.2118, test_loss: 1.9371, test_f1: 0.6286
 epoch: 99, train_loss: 0.2061, test_loss: 1.9334, test_f1: 0.6101

Training completed in 795.78 seconds
Best F1: 0.6994 at epoch 50
Mean F1 across iterations: 0.6807  0.0075
========================FINAL RESULTS================================
FEGIN weighted F1: 0.6994  0.0075
python main.py --data ltspice_examples --representation component_net --model FEGIN --layers 5 --hiddens 128 --batch_size 64 --lr 0.001 --emb_size 250 --epochs 100 --save_appendix component_net_L5_H128_BS64_LR0.001_E250 --no_val
-----



STDERR:
  File "main.py", line 370, in <module>
    main()
  File "main.py", line 254, in main
    dataset = dataset_class(
  File "/home/philip/projects/ltspice_examples_code_repo/Circuit-Completion-Using-GNNs/component_classification_with_link_prediction_head/evaluation/FEGIN/kernel/circuit_datasets.py", line 15, in __init__
    self.data, self.slices = torch.load(self.processed_paths[0])
  File "/home/philip/.local/lib/python3.8/site-packages/torch/serialization.py", line 1040, in load
    warnings.warn(
  File "/usr/lib/python3.8/warnings.py", line 109, in _showwarnmsg
    sw(msg.message, msg.category, msg.filename, msg.lineno,
  File "main.py", line 47, in warn_with_traceback
    traceback.print_stack(file=log)
/home/philip/projects/ltspice_examples_code_repo/Circuit-Completion-Using-GNNs/component_classification_with_link_prediction_head/evaluation/FEGIN/kernel/circuit_datasets.py:15: FutureWarning: You are using `torch.load` with `weights_only=False` (the current default value), which uses the default pickle module implicitly. It is possible to construct malicious pickle data which will execute arbitrary code during unpickling (See https://github.com/pytorch/pytorch/blob/main/SECURITY.md#untrusted-models for more details). In a future release, the default value for `weights_only` will be flipped to `True`. This limits the functions that could be executed during unpickling. Arbitrary objects will no longer be allowed to be loaded via this mode unless they are explicitly allowlisted by the user via `torch.serialization.add_safe_globals`. We recommend you start setting `weights_only=True` for any use case where you don't have full control of the loaded file. Please open an issue on GitHub for any issues related to this experimental feature.
  self.data, self.slices = torch.load(self.processed_paths[0])
