STDOUT:
Results will be saved in /home/philip/projects/ltspice_examples_code_repo/Circuit-Completion-Using-GNNs/component_classification_with_link_prediction_head/evaluation/FEGIN/results/model_FEGIN_dataset_ltspice_examples
Command line input: python main.py --data ltspice_examples --representation component_pin_net --model FEGIN --layers 4 --hiddens 128 --batch_size 32 --lr 0.0001 --emb_size 512 --epochs 100 --save_appendix component_pin_net_L4_H128_BS32_LR0.0001_E512 --no_val
 is saved.
-----
ltspice_examples - FEGIN
Using 4 layers, 128 hidden units, h = 2
Loading component_pin_net representation dataset
ENTERED
Training FEGIN on component_pin_net representation
Train: 3558, Test: 846
##################ITERATION #0 ****************************************
 epoch: 0, train_loss: 1.3060, test_loss: 1.1750, test_f1: 0.2968
 epoch: 1, train_loss: 1.1459, test_loss: 1.0667, test_f1: 0.3430
 epoch: 2, train_loss: 1.0631, test_loss: 1.0430, test_f1: 0.3634
 epoch: 3, train_loss: 1.0294, test_loss: 1.0159, test_f1: 0.4471
 epoch: 4, train_loss: 1.0020, test_loss: 0.9990, test_f1: 0.4690
 epoch: 5, train_loss: 0.9816, test_loss: 0.9732, test_f1: 0.4980
 epoch: 6, train_loss: 0.9646, test_loss: 0.9743, test_f1: 0.4991
 epoch: 7, train_loss: 0.9379, test_loss: 0.9199, test_f1: 0.5190
 epoch: 8, train_loss: 0.9072, test_loss: 0.9147, test_f1: 0.5202
 epoch: 9, train_loss: 0.9113, test_loss: 0.9205, test_f1: 0.5198
 epoch: 10, train_loss: 0.8991, test_loss: 0.8999, test_f1: 0.5198
 epoch: 11, train_loss: 0.8921, test_loss: 0.9020, test_f1: 0.5221
 epoch: 12, train_loss: 0.8698, test_loss: 0.8794, test_f1: 0.5361
 epoch: 13, train_loss: 0.8723, test_loss: 0.8735, test_f1: 0.5194
 epoch: 14, train_loss: 0.8563, test_loss: 0.8803, test_f1: 0.5245
 epoch: 15, train_loss: 0.8421, test_loss: 0.8743, test_f1: 0.5202
 epoch: 16, train_loss: 0.8458, test_loss: 0.8728, test_f1: 0.5362
 epoch: 17, train_loss: 0.8350, test_loss: 0.8498, test_f1: 0.5424
 epoch: 18, train_loss: 0.8178, test_loss: 0.8573, test_f1: 0.5501
 epoch: 19, train_loss: 0.8080, test_loss: 0.8059, test_f1: 0.5609
 epoch: 20, train_loss: 0.8125, test_loss: 0.8584, test_f1: 0.5413
 epoch: 21, train_loss: 0.7988, test_loss: 0.8605, test_f1: 0.5539
 epoch: 22, train_loss: 0.7872, test_loss: 0.8255, test_f1: 0.5532
 epoch: 23, train_loss: 0.7811, test_loss: 0.8307, test_f1: 0.5801
 epoch: 24, train_loss: 0.7692, test_loss: 0.8099, test_f1: 0.5657
 epoch: 25, train_loss: 0.7593, test_loss: 0.7880, test_f1: 0.5809
 epoch: 26, train_loss: 0.7507, test_loss: 0.8001, test_f1: 0.5978
 epoch: 27, train_loss: 0.7546, test_loss: 0.8348, test_f1: 0.5984
 epoch: 28, train_loss: 0.7532, test_loss: 0.8472, test_f1: 0.5587
 epoch: 29, train_loss: 0.7429, test_loss: 0.8273, test_f1: 0.5673
 epoch: 30, train_loss: 0.7318, test_loss: 0.8580, test_f1: 0.5742
 epoch: 31, train_loss: 0.7306, test_loss: 0.8606, test_f1: 0.6000
 epoch: 32, train_loss: 0.7148, test_loss: 0.8111, test_f1: 0.5970
 epoch: 33, train_loss: 0.7156, test_loss: 0.8729, test_f1: 0.5718
 epoch: 34, train_loss: 0.7107, test_loss: 0.8376, test_f1: 0.6112
 epoch: 35, train_loss: 0.7012, test_loss: 0.8034, test_f1: 0.5758
 epoch: 36, train_loss: 0.6882, test_loss: 0.8414, test_f1: 0.5905
 epoch: 37, train_loss: 0.6841, test_loss: 0.8742, test_f1: 0.5882
 epoch: 38, train_loss: 0.6858, test_loss: 0.8666, test_f1: 0.5904
 epoch: 39, train_loss: 0.6845, test_loss: 0.8470, test_f1: 0.5974
 epoch: 40, train_loss: 0.6860, test_loss: 0.8134, test_f1: 0.6024
 epoch: 41, train_loss: 0.6672, test_loss: 0.9258, test_f1: 0.6083
 epoch: 42, train_loss: 0.6584, test_loss: 0.8687, test_f1: 0.6194
 epoch: 43, train_loss: 0.6593, test_loss: 0.8438, test_f1: 0.6056
 epoch: 44, train_loss: 0.6475, test_loss: 0.8661, test_f1: 0.5957
 epoch: 45, train_loss: 0.6397, test_loss: 0.7780, test_f1: 0.6634
 epoch: 46, train_loss: 0.6455, test_loss: 0.8567, test_f1: 0.6424
 epoch: 47, train_loss: 0.6325, test_loss: 0.8063, test_f1: 0.6346
 epoch: 48, train_loss: 0.6321, test_loss: 0.8639, test_f1: 0.6222
 epoch: 49, train_loss: 0.6271, test_loss: 0.9035, test_f1: 0.6233
 epoch: 50, train_loss: 0.6233, test_loss: 0.8789, test_f1: 0.6088
 epoch: 51, train_loss: 0.6136, test_loss: 0.8876, test_f1: 0.6307
 epoch: 52, train_loss: 0.5944, test_loss: 0.8601, test_f1: 0.6425
 epoch: 53, train_loss: 0.5837, test_loss: 0.8777, test_f1: 0.6330
 epoch: 54, train_loss: 0.5798, test_loss: 0.8786, test_f1: 0.6245
 epoch: 55, train_loss: 0.5798, test_loss: 0.8554, test_f1: 0.6323
 epoch: 56, train_loss: 0.5820, test_loss: 0.8879, test_f1: 0.6393
 epoch: 57, train_loss: 0.5693, test_loss: 0.8986, test_f1: 0.6374
 epoch: 58, train_loss: 0.5675, test_loss: 0.9359, test_f1: 0.6294
 epoch: 59, train_loss: 0.5624, test_loss: 0.9059, test_f1: 0.6154
 epoch: 60, train_loss: 0.5719, test_loss: 0.8885, test_f1: 0.6332
 epoch: 61, train_loss: 0.5681, test_loss: 0.9234, test_f1: 0.6236
 epoch: 62, train_loss: 0.5560, test_loss: 0.9234, test_f1: 0.6397
 epoch: 63, train_loss: 0.5528, test_loss: 0.8640, test_f1: 0.6388
 epoch: 64, train_loss: 0.5657, test_loss: 0.9106, test_f1: 0.6494
 epoch: 65, train_loss: 0.5452, test_loss: 0.9148, test_f1: 0.6329
 epoch: 66, train_loss: 0.5619, test_loss: 0.8582, test_f1: 0.6406
 epoch: 67, train_loss: 0.5389, test_loss: 0.9265, test_f1: 0.6448
 epoch: 68, train_loss: 0.5384, test_loss: 0.8865, test_f1: 0.6302
 epoch: 69, train_loss: 0.5314, test_loss: 0.9117, test_f1: 0.6437
 epoch: 70, train_loss: 0.5385, test_loss: 0.9341, test_f1: 0.6416
 epoch: 71, train_loss: 0.5397, test_loss: 0.9637, test_f1: 0.6189
 epoch: 72, train_loss: 0.5356, test_loss: 0.9354, test_f1: 0.6530
 epoch: 73, train_loss: 0.5304, test_loss: 0.9687, test_f1: 0.6323
 epoch: 74, train_loss: 0.5266, test_loss: 0.8798, test_f1: 0.6295
 epoch: 75, train_loss: 0.5145, test_loss: 0.9661, test_f1: 0.6416
 epoch: 76, train_loss: 0.5377, test_loss: 0.9535, test_f1: 0.6489
 epoch: 77, train_loss: 0.5178, test_loss: 0.9999, test_f1: 0.6497
 epoch: 78, train_loss: 0.5147, test_loss: 0.9641, test_f1: 0.6513
 epoch: 79, train_loss: 0.5167, test_loss: 0.9763, test_f1: 0.6554
 epoch: 80, train_loss: 0.5040, test_loss: 0.9547, test_f1: 0.6445
 epoch: 81, train_loss: 0.5146, test_loss: 0.9573, test_f1: 0.6470
 epoch: 82, train_loss: 0.5168, test_loss: 1.0033, test_f1: 0.6432
 epoch: 83, train_loss: 0.5063, test_loss: 0.9937, test_f1: 0.6337
 epoch: 84, train_loss: 0.4955, test_loss: 0.9963, test_f1: 0.6556
 epoch: 85, train_loss: 0.4939, test_loss: 1.0260, test_f1: 0.6599
 epoch: 86, train_loss: 0.4939, test_loss: 1.0390, test_f1: 0.6409
 epoch: 87, train_loss: 0.4997, test_loss: 0.9839, test_f1: 0.6658
 epoch: 88, train_loss: 0.5048, test_loss: 1.0097, test_f1: 0.6473
 epoch: 89, train_loss: 0.4838, test_loss: 1.0358, test_f1: 0.6322
 epoch: 90, train_loss: 0.4967, test_loss: 1.0771, test_f1: 0.6379
 epoch: 91, train_loss: 0.4830, test_loss: 1.0350, test_f1: 0.6725
 epoch: 92, train_loss: 0.4739, test_loss: 1.0695, test_f1: 0.6440
 epoch: 93, train_loss: 0.4873, test_loss: 1.0613, test_f1: 0.6614
 epoch: 94, train_loss: 0.4887, test_loss: 1.0819, test_f1: 0.6481
 epoch: 95, train_loss: 0.4645, test_loss: 1.0576, test_f1: 0.6398
 epoch: 96, train_loss: 0.4908, test_loss: 1.0422, test_f1: 0.6307
 epoch: 97, train_loss: 0.4664, test_loss: 1.0635, test_f1: 0.6593
 epoch: 98, train_loss: 0.4707, test_loss: 1.0575, test_f1: 0.6469
 epoch: 99, train_loss: 0.4600, test_loss: 1.0404, test_f1: 0.6545
##################ITERATION #1 ****************************************
 epoch: 0, train_loss: 1.1636, test_loss: 1.0227, test_f1: 0.4617
 epoch: 1, train_loss: 1.0081, test_loss: 0.9906, test_f1: 0.4883
 epoch: 2, train_loss: 0.9779, test_loss: 0.9650, test_f1: 0.5064
 epoch: 3, train_loss: 0.9480, test_loss: 0.9427, test_f1: 0.5168
 epoch: 4, train_loss: 0.9292, test_loss: 0.9393, test_f1: 0.5430
 epoch: 5, train_loss: 0.9078, test_loss: 0.9126, test_f1: 0.5527
 epoch: 6, train_loss: 0.8995, test_loss: 0.9075, test_f1: 0.5504
 epoch: 7, train_loss: 0.8973, test_loss: 0.9076, test_f1: 0.5427
 epoch: 8, train_loss: 0.8676, test_loss: 0.8762, test_f1: 0.5671
 epoch: 9, train_loss: 0.8587, test_loss: 0.8580, test_f1: 0.5470
 epoch: 10, train_loss: 0.8519, test_loss: 0.8617, test_f1: 0.5637
 epoch: 11, train_loss: 0.8366, test_loss: 0.8626, test_f1: 0.5584
 epoch: 12, train_loss: 0.8310, test_loss: 0.8587, test_f1: 0.5441
 epoch: 13, train_loss: 0.8269, test_loss: 0.7982, test_f1: 0.6155
 epoch: 14, train_loss: 0.8066, test_loss: 0.7949, test_f1: 0.5775
 epoch: 15, train_loss: 0.7973, test_loss: 0.8047, test_f1: 0.6097
 epoch: 16, train_loss: 0.7929, test_loss: 0.7875, test_f1: 0.5916
 epoch: 17, train_loss: 0.7791, test_loss: 0.7834, test_f1: 0.5868
 epoch: 18, train_loss: 0.7708, test_loss: 0.7884, test_f1: 0.6007
 epoch: 19, train_loss: 0.7679, test_loss: 0.7839, test_f1: 0.5611
 epoch: 20, train_loss: 0.7436, test_loss: 0.7594, test_f1: 0.6306
 epoch: 21, train_loss: 0.7404, test_loss: 0.7897, test_f1: 0.6180
 epoch: 22, train_loss: 0.7352, test_loss: 0.7997, test_f1: 0.6178
 epoch: 23, train_loss: 0.7279, test_loss: 0.7846, test_f1: 0.6423
 epoch: 24, train_loss: 0.7236, test_loss: 0.7871, test_f1: 0.6159
 epoch: 25, train_loss: 0.7271, test_loss: 0.7414, test_f1: 0.6120
 epoch: 26, train_loss: 0.7076, test_loss: 0.8104, test_f1: 0.5930
 epoch: 27, train_loss: 0.6973, test_loss: 0.7454, test_f1: 0.6442
 epoch: 28, train_loss: 0.6905, test_loss: 0.7524, test_f1: 0.6234
 epoch: 29, train_loss: 0.6896, test_loss: 0.7534, test_f1: 0.6330
 epoch: 30, train_loss: 0.6674, test_loss: 0.7034, test_f1: 0.6680
 epoch: 31, train_loss: 0.6765, test_loss: 0.7387, test_f1: 0.6574
 epoch: 32, train_loss: 0.6600, test_loss: 0.7184, test_f1: 0.6300
 epoch: 33, train_loss: 0.6529, test_loss: 0.7502, test_f1: 0.6640
 epoch: 34, train_loss: 0.6499, test_loss: 0.7415, test_f1: 0.6377
 epoch: 35, train_loss: 0.6351, test_loss: 0.7529, test_f1: 0.6100
 epoch: 36, train_loss: 0.6185, test_loss: 0.7500, test_f1: 0.6517
 epoch: 37, train_loss: 0.6312, test_loss: 0.7719, test_f1: 0.6373
 epoch: 38, train_loss: 0.6088, test_loss: 0.8231, test_f1: 0.6168
 epoch: 39, train_loss: 0.6167, test_loss: 0.9095, test_f1: 0.6319
 epoch: 40, train_loss: 0.6097, test_loss: 0.7520, test_f1: 0.6498
 epoch: 41, train_loss: 0.5925, test_loss: 0.8655, test_f1: 0.6282
 epoch: 42, train_loss: 0.6027, test_loss: 0.8324, test_f1: 0.6125
 epoch: 43, train_loss: 0.5830, test_loss: 0.9339, test_f1: 0.6188
 epoch: 44, train_loss: 0.5767, test_loss: 0.8468, test_f1: 0.6540
 epoch: 45, train_loss: 0.5535, test_loss: 0.8743, test_f1: 0.6274
 epoch: 46, train_loss: 0.5685, test_loss: 0.9571, test_f1: 0.6400
 epoch: 47, train_loss: 0.5623, test_loss: 0.8495, test_f1: 0.6370
 epoch: 48, train_loss: 0.5644, test_loss: 0.9678, test_f1: 0.6211
 epoch: 49, train_loss: 0.5477, test_loss: 0.8742, test_f1: 0.6363
 epoch: 50, train_loss: 0.5459, test_loss: 1.0153, test_f1: 0.6244
 epoch: 51, train_loss: 0.5280, test_loss: 0.9080, test_f1: 0.6424
 epoch: 52, train_loss: 0.5269, test_loss: 0.9033, test_f1: 0.6498
 epoch: 53, train_loss: 0.5174, test_loss: 0.9637, test_f1: 0.6272
 epoch: 54, train_loss: 0.5243, test_loss: 1.0053, test_f1: 0.6463
 epoch: 55, train_loss: 0.5270, test_loss: 1.0180, test_f1: 0.6422
 epoch: 56, train_loss: 0.5134, test_loss: 0.9722, test_f1: 0.6478
 epoch: 57, train_loss: 0.5020, test_loss: 0.9693, test_f1: 0.6404
 epoch: 58, train_loss: 0.4913, test_loss: 0.9227, test_f1: 0.6402
 epoch: 59, train_loss: 0.4954, test_loss: 1.0096, test_f1: 0.6404
 epoch: 60, train_loss: 0.4910, test_loss: 0.9711, test_f1: 0.6484
 epoch: 61, train_loss: 0.4907, test_loss: 0.9918, test_f1: 0.6425
 epoch: 62, train_loss: 0.4881, test_loss: 1.0261, test_f1: 0.6488
 epoch: 63, train_loss: 0.4729, test_loss: 0.9923, test_f1: 0.6354
 epoch: 64, train_loss: 0.4826, test_loss: 1.0702, test_f1: 0.6259
 epoch: 65, train_loss: 0.4579, test_loss: 1.0107, test_f1: 0.6434
 epoch: 66, train_loss: 0.4829, test_loss: 1.0406, test_f1: 0.6373
 epoch: 67, train_loss: 0.4601, test_loss: 1.0513, test_f1: 0.6411
 epoch: 68, train_loss: 0.4727, test_loss: 1.1675, test_f1: 0.6466
 epoch: 69, train_loss: 0.4708, test_loss: 1.0431, test_f1: 0.6406
 epoch: 70, train_loss: 0.4632, test_loss: 1.0417, test_f1: 0.6537
 epoch: 71, train_loss: 0.4702, test_loss: 1.0062, test_f1: 0.6478
 epoch: 72, train_loss: 0.4560, test_loss: 1.0254, test_f1: 0.6458
 epoch: 73, train_loss: 0.4528, test_loss: 1.0748, test_f1: 0.6389
 epoch: 74, train_loss: 0.4545, test_loss: 1.1980, test_f1: 0.6095
 epoch: 75, train_loss: 0.4510, test_loss: 1.1033, test_f1: 0.6414
 epoch: 76, train_loss: 0.4496, test_loss: 1.0761, test_f1: 0.6377
 epoch: 77, train_loss: 0.4559, test_loss: 1.0957, test_f1: 0.6603
 epoch: 78, train_loss: 0.4437, test_loss: 1.0989, test_f1: 0.6490
 epoch: 79, train_loss: 0.4457, test_loss: 1.1477, test_f1: 0.6453
 epoch: 80, train_loss: 0.4350, test_loss: 1.1247, test_f1: 0.6519
 epoch: 81, train_loss: 0.4248, test_loss: 1.2004, test_f1: 0.6488
 epoch: 82, train_loss: 0.4385, test_loss: 1.1622, test_f1: 0.6451
 epoch: 83, train_loss: 0.4301, test_loss: 1.1303, test_f1: 0.6496
 epoch: 84, train_loss: 0.4279, test_loss: 1.1433, test_f1: 0.6498
 epoch: 85, train_loss: 0.4281, test_loss: 1.1087, test_f1: 0.6579
 epoch: 86, train_loss: 0.4308, test_loss: 1.2192, test_f1: 0.6633
 epoch: 87, train_loss: 0.4323, test_loss: 1.1858, test_f1: 0.6604
 epoch: 88, train_loss: 0.4138, test_loss: 1.1844, test_f1: 0.6621
 epoch: 89, train_loss: 0.4210, test_loss: 1.2488, test_f1: 0.6549
 epoch: 90, train_loss: 0.4155, test_loss: 1.2724, test_f1: 0.6553
 epoch: 91, train_loss: 0.4154, test_loss: 1.1816, test_f1: 0.6549
 epoch: 92, train_loss: 0.4144, test_loss: 1.2363, test_f1: 0.6687
 epoch: 93, train_loss: 0.4041, test_loss: 1.1547, test_f1: 0.6379
 epoch: 94, train_loss: 0.4008, test_loss: 1.2124, test_f1: 0.6664
 epoch: 95, train_loss: 0.4181, test_loss: 1.2569, test_f1: 0.6593
 epoch: 96, train_loss: 0.4150, test_loss: 1.2282, test_f1: 0.6634
 epoch: 97, train_loss: 0.3969, test_loss: 1.3117, test_f1: 0.6506
 epoch: 98, train_loss: 0.3916, test_loss: 1.3150, test_f1: 0.6561
 epoch: 99, train_loss: 0.3920, test_loss: 1.2639, test_f1: 0.6619
##################ITERATION #2 ****************************************
 epoch: 0, train_loss: 1.1201, test_loss: 1.0241, test_f1: 0.4822
 epoch: 1, train_loss: 0.9962, test_loss: 0.9595, test_f1: 0.5058
 epoch: 2, train_loss: 0.9644, test_loss: 0.9348, test_f1: 0.5203
 epoch: 3, train_loss: 0.9411, test_loss: 0.9331, test_f1: 0.5167
 epoch: 4, train_loss: 0.9230, test_loss: 0.8885, test_f1: 0.5334
 epoch: 5, train_loss: 0.9023, test_loss: 0.8807, test_f1: 0.5279
 epoch: 6, train_loss: 0.8871, test_loss: 0.8495, test_f1: 0.5679
 epoch: 7, train_loss: 0.8683, test_loss: 0.8395, test_f1: 0.5612
 epoch: 8, train_loss: 0.8628, test_loss: 0.8387, test_f1: 0.5604
 epoch: 9, train_loss: 0.8528, test_loss: 0.8198, test_f1: 0.5818
 epoch: 10, train_loss: 0.8385, test_loss: 0.8246, test_f1: 0.5839
 epoch: 11, train_loss: 0.8246, test_loss: 0.8304, test_f1: 0.5795
 epoch: 12, train_loss: 0.8213, test_loss: 0.8220, test_f1: 0.5985
 epoch: 13, train_loss: 0.8164, test_loss: 0.7996, test_f1: 0.5860
 epoch: 14, train_loss: 0.7922, test_loss: 0.8027, test_f1: 0.6085
 epoch: 15, train_loss: 0.7869, test_loss: 0.8126, test_f1: 0.5809
 epoch: 16, train_loss: 0.7815, test_loss: 0.7816, test_f1: 0.6019
 epoch: 17, train_loss: 0.7700, test_loss: 0.7729, test_f1: 0.6444
 epoch: 18, train_loss: 0.7415, test_loss: 0.8119, test_f1: 0.5789
 epoch: 19, train_loss: 0.7558, test_loss: 0.8144, test_f1: 0.6224
 epoch: 20, train_loss: 0.7445, test_loss: 0.7706, test_f1: 0.5990
 epoch: 21, train_loss: 0.7305, test_loss: 0.7670, test_f1: 0.6189
 epoch: 22, train_loss: 0.7220, test_loss: 0.7624, test_f1: 0.6361
 epoch: 23, train_loss: 0.7109, test_loss: 0.7919, test_f1: 0.6183
 epoch: 24, train_loss: 0.7114, test_loss: 0.7571, test_f1: 0.6550
 epoch: 25, train_loss: 0.6993, test_loss: 0.7486, test_f1: 0.6485
 epoch: 26, train_loss: 0.6947, test_loss: 0.7508, test_f1: 0.6477
 epoch: 27, train_loss: 0.6875, test_loss: 0.7619, test_f1: 0.6257
 epoch: 28, train_loss: 0.6812, test_loss: 0.7668, test_f1: 0.6283
 epoch: 29, train_loss: 0.6635, test_loss: 0.7485, test_f1: 0.6531
 epoch: 30, train_loss: 0.6692, test_loss: 0.7636, test_f1: 0.6427
 epoch: 31, train_loss: 0.6384, test_loss: 0.7943, test_f1: 0.6241
 epoch: 32, train_loss: 0.6420, test_loss: 0.7603, test_f1: 0.6436
 epoch: 33, train_loss: 0.6368, test_loss: 0.8290, test_f1: 0.6253
 epoch: 34, train_loss: 0.6374, test_loss: 0.7426, test_f1: 0.6717
 epoch: 35, train_loss: 0.6236, test_loss: 0.7629, test_f1: 0.6635
 epoch: 36, train_loss: 0.6243, test_loss: 0.7817, test_f1: 0.6373
 epoch: 37, train_loss: 0.6112, test_loss: 0.8141, test_f1: 0.6413
 epoch: 38, train_loss: 0.6029, test_loss: 0.7986, test_f1: 0.6236
 epoch: 39, train_loss: 0.6052, test_loss: 0.8212, test_f1: 0.6116
 epoch: 40, train_loss: 0.5992, test_loss: 0.8136, test_f1: 0.6213
 epoch: 41, train_loss: 0.6015, test_loss: 0.8186, test_f1: 0.6066
 epoch: 42, train_loss: 0.5826, test_loss: 0.7454, test_f1: 0.6629
 epoch: 43, train_loss: 0.5928, test_loss: 0.7986, test_f1: 0.6141
 epoch: 44, train_loss: 0.5648, test_loss: 0.8279, test_f1: 0.6294
 epoch: 45, train_loss: 0.5669, test_loss: 0.7960, test_f1: 0.6332
 epoch: 46, train_loss: 0.5558, test_loss: 0.7722, test_f1: 0.6496
 epoch: 47, train_loss: 0.5526, test_loss: 0.7728, test_f1: 0.6411
 epoch: 48, train_loss: 0.5584, test_loss: 0.8134, test_f1: 0.6328
 epoch: 49, train_loss: 0.5320, test_loss: 0.8620, test_f1: 0.6189
 epoch: 50, train_loss: 0.5280, test_loss: 0.9454, test_f1: 0.6408
 epoch: 51, train_loss: 0.5188, test_loss: 0.8645, test_f1: 0.6340
 epoch: 52, train_loss: 0.5172, test_loss: 0.9011, test_f1: 0.6317
 epoch: 53, train_loss: 0.4992, test_loss: 0.9075, test_f1: 0.6451
 epoch: 54, train_loss: 0.4877, test_loss: 0.8534, test_f1: 0.6482
 epoch: 55, train_loss: 0.4912, test_loss: 0.8757, test_f1: 0.6370
 epoch: 56, train_loss: 0.4799, test_loss: 0.9532, test_f1: 0.6362
 epoch: 57, train_loss: 0.4988, test_loss: 0.8717, test_f1: 0.6295
 epoch: 58, train_loss: 0.4814, test_loss: 0.9710, test_f1: 0.6418
 epoch: 59, train_loss: 0.4762, test_loss: 0.9668, test_f1: 0.6452
 epoch: 60, train_loss: 0.4697, test_loss: 0.9437, test_f1: 0.6322
 epoch: 61, train_loss: 0.4658, test_loss: 0.9815, test_f1: 0.6429
 epoch: 62, train_loss: 0.4631, test_loss: 0.9518, test_f1: 0.6342
 epoch: 63, train_loss: 0.4579, test_loss: 0.9340, test_f1: 0.6344
 epoch: 64, train_loss: 0.4594, test_loss: 1.0157, test_f1: 0.6394
 epoch: 65, train_loss: 0.4699, test_loss: 1.0465, test_f1: 0.6241
 epoch: 66, train_loss: 0.4654, test_loss: 0.9280, test_f1: 0.6401
 epoch: 67, train_loss: 0.4572, test_loss: 0.9490, test_f1: 0.6326
 epoch: 68, train_loss: 0.4471, test_loss: 1.0597, test_f1: 0.6443
 epoch: 69, train_loss: 0.4510, test_loss: 1.0280, test_f1: 0.6277
 epoch: 70, train_loss: 0.4339, test_loss: 1.0524, test_f1: 0.6246
 epoch: 71, train_loss: 0.4582, test_loss: 0.9685, test_f1: 0.6282
 epoch: 72, train_loss: 0.4507, test_loss: 1.0033, test_f1: 0.6425
 epoch: 73, train_loss: 0.4430, test_loss: 1.0014, test_f1: 0.6286
 epoch: 74, train_loss: 0.4315, test_loss: 1.0756, test_f1: 0.6456
 epoch: 75, train_loss: 0.4237, test_loss: 1.1038, test_f1: 0.6309
 epoch: 76, train_loss: 0.4175, test_loss: 1.0057, test_f1: 0.6299
 epoch: 77, train_loss: 0.4343, test_loss: 1.0435, test_f1: 0.6440
 epoch: 78, train_loss: 0.4196, test_loss: 1.0080, test_f1: 0.6429
 epoch: 79, train_loss: 0.4203, test_loss: 1.0693, test_f1: 0.6294
 epoch: 80, train_loss: 0.4009, test_loss: 1.0114, test_f1: 0.6383
 epoch: 81, train_loss: 0.4031, test_loss: 1.1324, test_f1: 0.6461
 epoch: 82, train_loss: 0.4165, test_loss: 1.0816, test_f1: 0.6332
 epoch: 83, train_loss: 0.4104, test_loss: 1.1582, test_f1: 0.6402
 epoch: 84, train_loss: 0.4118, test_loss: 1.1924, test_f1: 0.6483
 epoch: 85, train_loss: 0.3987, test_loss: 1.1458, test_f1: 0.6216
 epoch: 86, train_loss: 0.4044, test_loss: 1.0633, test_f1: 0.6348
 epoch: 87, train_loss: 0.4059, test_loss: 1.1522, test_f1: 0.6465
 epoch: 88, train_loss: 0.3848, test_loss: 1.1682, test_f1: 0.6405
 epoch: 89, train_loss: 0.3818, test_loss: 1.1524, test_f1: 0.6540
 epoch: 90, train_loss: 0.3771, test_loss: 1.1795, test_f1: 0.6502
 epoch: 91, train_loss: 0.3869, test_loss: 1.2534, test_f1: 0.6516
 epoch: 92, train_loss: 0.3836, test_loss: 1.0970, test_f1: 0.6469
 epoch: 93, train_loss: 0.3901, test_loss: 1.2370, test_f1: 0.6474
 epoch: 94, train_loss: 0.3671, test_loss: 1.1601, test_f1: 0.6454
 epoch: 95, train_loss: 0.3751, test_loss: 1.1878, test_f1: 0.6427
 epoch: 96, train_loss: 0.3710, test_loss: 1.2479, test_f1: 0.6404
 epoch: 97, train_loss: 0.3904, test_loss: 1.2685, test_f1: 0.6466
 epoch: 98, train_loss: 0.3819, test_loss: 1.3226, test_f1: 0.6437
 epoch: 99, train_loss: 0.3544, test_loss: 1.3365, test_f1: 0.6456
##################ITERATION #3 ****************************************
 epoch: 0, train_loss: 1.1045, test_loss: 0.9791, test_f1: 0.5050
 epoch: 1, train_loss: 0.9858, test_loss: 0.9523, test_f1: 0.5345
 epoch: 2, train_loss: 0.9641, test_loss: 0.9281, test_f1: 0.5093
 epoch: 3, train_loss: 0.9417, test_loss: 0.9031, test_f1: 0.5302
 epoch: 4, train_loss: 0.9215, test_loss: 0.8965, test_f1: 0.5368
 epoch: 5, train_loss: 0.8977, test_loss: 0.8675, test_f1: 0.5487
 epoch: 6, train_loss: 0.8784, test_loss: 0.8685, test_f1: 0.5403
 epoch: 7, train_loss: 0.8729, test_loss: 0.8395, test_f1: 0.5365
 epoch: 8, train_loss: 0.8515, test_loss: 0.8188, test_f1: 0.5377
 epoch: 9, train_loss: 0.8306, test_loss: 0.8193, test_f1: 0.5578
 epoch: 10, train_loss: 0.8330, test_loss: 0.8101, test_f1: 0.5840
 epoch: 11, train_loss: 0.8142, test_loss: 0.7927, test_f1: 0.5782
 epoch: 12, train_loss: 0.7920, test_loss: 0.7848, test_f1: 0.5739
 epoch: 13, train_loss: 0.7954, test_loss: 0.7783, test_f1: 0.5914
 epoch: 14, train_loss: 0.7768, test_loss: 0.7522, test_f1: 0.5981
 epoch: 15, train_loss: 0.7865, test_loss: 0.7375, test_f1: 0.6503
 epoch: 16, train_loss: 0.7574, test_loss: 0.7418, test_f1: 0.6652
 epoch: 17, train_loss: 0.7564, test_loss: 0.7550, test_f1: 0.6292
 epoch: 18, train_loss: 0.7343, test_loss: 0.7547, test_f1: 0.6329
 epoch: 19, train_loss: 0.7251, test_loss: 0.7194, test_f1: 0.6492
 epoch: 20, train_loss: 0.7141, test_loss: 0.7093, test_f1: 0.6451
 epoch: 21, train_loss: 0.7104, test_loss: 0.7063, test_f1: 0.6505
 epoch: 22, train_loss: 0.6891, test_loss: 0.7600, test_f1: 0.6310
 epoch: 23, train_loss: 0.6963, test_loss: 0.7254, test_f1: 0.6412
 epoch: 24, train_loss: 0.6812, test_loss: 0.7265, test_f1: 0.6382
 epoch: 25, train_loss: 0.6813, test_loss: 0.7544, test_f1: 0.6427
 epoch: 26, train_loss: 0.6705, test_loss: 0.7011, test_f1: 0.6514
 epoch: 27, train_loss: 0.6569, test_loss: 0.7553, test_f1: 0.6562
 epoch: 28, train_loss: 0.6511, test_loss: 0.6907, test_f1: 0.6798
 epoch: 29, train_loss: 0.6408, test_loss: 0.6971, test_f1: 0.6762
 epoch: 30, train_loss: 0.6336, test_loss: 0.6911, test_f1: 0.6707
 epoch: 31, train_loss: 0.6397, test_loss: 0.7054, test_f1: 0.6574
 epoch: 32, train_loss: 0.6129, test_loss: 0.7462, test_f1: 0.6344
 epoch: 33, train_loss: 0.6044, test_loss: 0.6753, test_f1: 0.6556
 epoch: 34, train_loss: 0.6045, test_loss: 0.7252, test_f1: 0.6418
 epoch: 35, train_loss: 0.5970, test_loss: 0.7166, test_f1: 0.6570
 epoch: 36, train_loss: 0.5964, test_loss: 0.6988, test_f1: 0.6854
 epoch: 37, train_loss: 0.5792, test_loss: 0.8630, test_f1: 0.6404
 epoch: 38, train_loss: 0.5935, test_loss: 0.6863, test_f1: 0.6776
 epoch: 39, train_loss: 0.5727, test_loss: 0.7511, test_f1: 0.6264
 epoch: 40, train_loss: 0.5636, test_loss: 0.7326, test_f1: 0.6585
 epoch: 41, train_loss: 0.5650, test_loss: 0.9056, test_f1: 0.6259
 epoch: 42, train_loss: 0.5677, test_loss: 0.7389, test_f1: 0.6782
 epoch: 43, train_loss: 0.5525, test_loss: 0.7637, test_f1: 0.6591
 epoch: 44, train_loss: 0.5313, test_loss: 0.7771, test_f1: 0.6693
 epoch: 45, train_loss: 0.5296, test_loss: 0.7881, test_f1: 0.6519
 epoch: 46, train_loss: 0.5205, test_loss: 0.7711, test_f1: 0.6736
 epoch: 47, train_loss: 0.5285, test_loss: 0.7808, test_f1: 0.6712
 epoch: 48, train_loss: 0.5349, test_loss: 0.7959, test_f1: 0.6506
 epoch: 49, train_loss: 0.5301, test_loss: 0.9633, test_f1: 0.6387
 epoch: 50, train_loss: 0.5235, test_loss: 0.7843, test_f1: 0.6528
 epoch: 51, train_loss: 0.4957, test_loss: 0.8281, test_f1: 0.6607
 epoch: 52, train_loss: 0.4809, test_loss: 0.7713, test_f1: 0.6627
 epoch: 53, train_loss: 0.4707, test_loss: 0.8256, test_f1: 0.6540
 epoch: 54, train_loss: 0.4673, test_loss: 0.8311, test_f1: 0.6634
 epoch: 55, train_loss: 0.4576, test_loss: 0.8369, test_f1: 0.6614
 epoch: 56, train_loss: 0.4608, test_loss: 0.8905, test_f1: 0.6364
 epoch: 57, train_loss: 0.4645, test_loss: 0.8446, test_f1: 0.6783
 epoch: 58, train_loss: 0.4547, test_loss: 0.8454, test_f1: 0.6687
 epoch: 59, train_loss: 0.4511, test_loss: 0.8449, test_f1: 0.6702
 epoch: 60, train_loss: 0.4429, test_loss: 0.9030, test_f1: 0.6484
 epoch: 61, train_loss: 0.4525, test_loss: 0.9230, test_f1: 0.6365
 epoch: 62, train_loss: 0.4541, test_loss: 0.9529, test_f1: 0.6640
 epoch: 63, train_loss: 0.4486, test_loss: 0.9252, test_f1: 0.6687
 epoch: 64, train_loss: 0.4443, test_loss: 0.8601, test_f1: 0.6651
 epoch: 65, train_loss: 0.4337, test_loss: 0.9472, test_f1: 0.6551
 epoch: 66, train_loss: 0.4332, test_loss: 0.9379, test_f1: 0.6513
 epoch: 67, train_loss: 0.4272, test_loss: 0.9233, test_f1: 0.6660
 epoch: 68, train_loss: 0.4239, test_loss: 0.9739, test_f1: 0.6639
 epoch: 69, train_loss: 0.4326, test_loss: 1.0049, test_f1: 0.6534
 epoch: 70, train_loss: 0.4131, test_loss: 1.0130, test_f1: 0.6497
 epoch: 71, train_loss: 0.4164, test_loss: 0.9698, test_f1: 0.6428
 epoch: 72, train_loss: 0.4270, test_loss: 0.9686, test_f1: 0.6657
 epoch: 73, train_loss: 0.4196, test_loss: 1.0129, test_f1: 0.6387
 epoch: 74, train_loss: 0.4098, test_loss: 1.0377, test_f1: 0.6573
 epoch: 75, train_loss: 0.4011, test_loss: 0.9644, test_f1: 0.6680
 epoch: 76, train_loss: 0.4046, test_loss: 0.9637, test_f1: 0.6703
 epoch: 77, train_loss: 0.4077, test_loss: 1.0148, test_f1: 0.6614
 epoch: 78, train_loss: 0.4029, test_loss: 1.0607, test_f1: 0.6537
 epoch: 79, train_loss: 0.4032, test_loss: 1.0902, test_f1: 0.6608
 epoch: 80, train_loss: 0.3767, test_loss: 1.0601, test_f1: 0.6551
 epoch: 81, train_loss: 0.4051, test_loss: 1.1467, test_f1: 0.6454
 epoch: 82, train_loss: 0.4044, test_loss: 1.1286, test_f1: 0.6469
 epoch: 83, train_loss: 0.3829, test_loss: 1.0356, test_f1: 0.6685
 epoch: 84, train_loss: 0.3793, test_loss: 1.0501, test_f1: 0.6622
 epoch: 85, train_loss: 0.3907, test_loss: 1.1143, test_f1: 0.6585
 epoch: 86, train_loss: 0.3738, test_loss: 1.1499, test_f1: 0.6518
 epoch: 87, train_loss: 0.3682, test_loss: 1.0948, test_f1: 0.6717
 epoch: 88, train_loss: 0.3772, test_loss: 1.1497, test_f1: 0.6564
 epoch: 89, train_loss: 0.3842, test_loss: 1.0312, test_f1: 0.6673
 epoch: 90, train_loss: 0.3554, test_loss: 1.1293, test_f1: 0.6587
 epoch: 91, train_loss: 0.3766, test_loss: 1.2604, test_f1: 0.6589
 epoch: 92, train_loss: 0.3743, test_loss: 1.2706, test_f1: 0.6435
 epoch: 93, train_loss: 0.3695, test_loss: 1.2436, test_f1: 0.6471
 epoch: 94, train_loss: 0.3832, test_loss: 1.1010, test_f1: 0.6785
 epoch: 95, train_loss: 0.3588, test_loss: 1.1380, test_f1: 0.6719
 epoch: 96, train_loss: 0.3602, test_loss: 1.1750, test_f1: 0.6560
 epoch: 97, train_loss: 0.3568, test_loss: 1.1160, test_f1: 0.6690
 epoch: 98, train_loss: 0.3408, test_loss: 1.0991, test_f1: 0.6682
 epoch: 99, train_loss: 0.3557, test_loss: 1.1351, test_f1: 0.6643
##################ITERATION #4 ****************************************
 epoch: 0, train_loss: 1.1211, test_loss: 0.9678, test_f1: 0.5233
 epoch: 1, train_loss: 0.9961, test_loss: 0.9236, test_f1: 0.5168
 epoch: 2, train_loss: 0.9684, test_loss: 0.8899, test_f1: 0.5191
 epoch: 3, train_loss: 0.9358, test_loss: 0.8937, test_f1: 0.5181
 epoch: 4, train_loss: 0.9242, test_loss: 0.8710, test_f1: 0.5504
 epoch: 5, train_loss: 0.9040, test_loss: 0.8669, test_f1: 0.5392
 epoch: 6, train_loss: 0.8952, test_loss: 0.8654, test_f1: 0.5471
 epoch: 7, train_loss: 0.8628, test_loss: 0.8418, test_f1: 0.5701
 epoch: 8, train_loss: 0.8541, test_loss: 0.8879, test_f1: 0.5619
 epoch: 9, train_loss: 0.8439, test_loss: 0.8308, test_f1: 0.5700
 epoch: 10, train_loss: 0.8272, test_loss: 0.7841, test_f1: 0.5852
 epoch: 11, train_loss: 0.8027, test_loss: 0.8113, test_f1: 0.5606
 epoch: 12, train_loss: 0.7963, test_loss: 0.8299, test_f1: 0.5507
 epoch: 13, train_loss: 0.7851, test_loss: 0.7784, test_f1: 0.5579
 epoch: 14, train_loss: 0.7756, test_loss: 0.7856, test_f1: 0.5575
 epoch: 15, train_loss: 0.7549, test_loss: 0.7824, test_f1: 0.5802
 epoch: 16, train_loss: 0.7588, test_loss: 0.7753, test_f1: 0.6068
 epoch: 17, train_loss: 0.7495, test_loss: 0.7905, test_f1: 0.6105
 epoch: 18, train_loss: 0.7263, test_loss: 0.7525, test_f1: 0.6616
 epoch: 19, train_loss: 0.7235, test_loss: 0.7435, test_f1: 0.6593
 epoch: 20, train_loss: 0.7097, test_loss: 0.7465, test_f1: 0.6476
 epoch: 21, train_loss: 0.6886, test_loss: 0.7553, test_f1: 0.6165
 epoch: 22, train_loss: 0.6919, test_loss: 0.7776, test_f1: 0.6238
 epoch: 23, train_loss: 0.6681, test_loss: 0.7460, test_f1: 0.6451
 epoch: 24, train_loss: 0.6753, test_loss: 0.7571, test_f1: 0.6273
 epoch: 25, train_loss: 0.6605, test_loss: 0.7248, test_f1: 0.6255
 epoch: 26, train_loss: 0.6572, test_loss: 0.7900, test_f1: 0.6435
 epoch: 27, train_loss: 0.6473, test_loss: 0.7827, test_f1: 0.6291
 epoch: 28, train_loss: 0.6460, test_loss: 0.7353, test_f1: 0.6378
 epoch: 29, train_loss: 0.6316, test_loss: 0.7601, test_f1: 0.6282
 epoch: 30, train_loss: 0.6223, test_loss: 0.7163, test_f1: 0.6526
 epoch: 31, train_loss: 0.6187, test_loss: 0.7256, test_f1: 0.6750
 epoch: 32, train_loss: 0.6245, test_loss: 0.8137, test_f1: 0.6284
 epoch: 33, train_loss: 0.6122, test_loss: 0.7328, test_f1: 0.6341
 epoch: 34, train_loss: 0.5925, test_loss: 0.7614, test_f1: 0.6431
 epoch: 35, train_loss: 0.5887, test_loss: 0.7162, test_f1: 0.6421
 epoch: 36, train_loss: 0.6002, test_loss: 0.7648, test_f1: 0.6470
 epoch: 37, train_loss: 0.5783, test_loss: 0.7241, test_f1: 0.6679
 epoch: 38, train_loss: 0.5785, test_loss: 0.7162, test_f1: 0.6610
 epoch: 39, train_loss: 0.5607, test_loss: 0.7752, test_f1: 0.6574
 epoch: 40, train_loss: 0.5539, test_loss: 0.7973, test_f1: 0.6217
 epoch: 41, train_loss: 0.5454, test_loss: 0.7449, test_f1: 0.6691
 epoch: 42, train_loss: 0.5503, test_loss: 0.8354, test_f1: 0.6379
 epoch: 43, train_loss: 0.5438, test_loss: 0.8249, test_f1: 0.6741
 epoch: 44, train_loss: 0.5402, test_loss: 0.8845, test_f1: 0.6441
 epoch: 45, train_loss: 0.5369, test_loss: 0.7878, test_f1: 0.6569
 epoch: 46, train_loss: 0.5317, test_loss: 0.8241, test_f1: 0.6363
 epoch: 47, train_loss: 0.5213, test_loss: 0.8024, test_f1: 0.6667
 epoch: 48, train_loss: 0.5268, test_loss: 0.7845, test_f1: 0.6605
 epoch: 49, train_loss: 0.5156, test_loss: 0.8858, test_f1: 0.6461
 epoch: 50, train_loss: 0.5232, test_loss: 0.8700, test_f1: 0.6567
 epoch: 51, train_loss: 0.4885, test_loss: 0.8719, test_f1: 0.6438
 epoch: 52, train_loss: 0.4779, test_loss: 0.8696, test_f1: 0.6405
 epoch: 53, train_loss: 0.4761, test_loss: 0.8558, test_f1: 0.6751
 epoch: 54, train_loss: 0.4720, test_loss: 0.8821, test_f1: 0.6439
 epoch: 55, train_loss: 0.4541, test_loss: 0.8461, test_f1: 0.6448
 epoch: 56, train_loss: 0.4440, test_loss: 0.9025, test_f1: 0.6437
 epoch: 57, train_loss: 0.4553, test_loss: 0.9242, test_f1: 0.6512
 epoch: 58, train_loss: 0.4505, test_loss: 0.9113, test_f1: 0.6402
 epoch: 59, train_loss: 0.4484, test_loss: 0.9782, test_f1: 0.6665
 epoch: 60, train_loss: 0.4478, test_loss: 0.9470, test_f1: 0.6511
 epoch: 61, train_loss: 0.4462, test_loss: 1.0087, test_f1: 0.6605
 epoch: 62, train_loss: 0.4385, test_loss: 0.9440, test_f1: 0.6639
 epoch: 63, train_loss: 0.4292, test_loss: 1.0019, test_f1: 0.6633
 epoch: 64, train_loss: 0.4103, test_loss: 1.0292, test_f1: 0.6418
 epoch: 65, train_loss: 0.4222, test_loss: 0.9898, test_f1: 0.6598
 epoch: 66, train_loss: 0.4119, test_loss: 0.9190, test_f1: 0.6622
 epoch: 67, train_loss: 0.4127, test_loss: 0.9301, test_f1: 0.6483
 epoch: 68, train_loss: 0.4188, test_loss: 1.0068, test_f1: 0.6537
 epoch: 69, train_loss: 0.4213, test_loss: 1.0402, test_f1: 0.6656
 epoch: 70, train_loss: 0.4106, test_loss: 1.0215, test_f1: 0.6541
 epoch: 71, train_loss: 0.4085, test_loss: 1.0000, test_f1: 0.6549
 epoch: 72, train_loss: 0.4102, test_loss: 1.1143, test_f1: 0.6383
 epoch: 73, train_loss: 0.4128, test_loss: 1.0823, test_f1: 0.6531
 epoch: 74, train_loss: 0.3977, test_loss: 1.0464, test_f1: 0.6597
 epoch: 75, train_loss: 0.3946, test_loss: 1.1746, test_f1: 0.6552
 epoch: 76, train_loss: 0.4022, test_loss: 0.9926, test_f1: 0.6679
 epoch: 77, train_loss: 0.4131, test_loss: 1.0852, test_f1: 0.6776
 epoch: 78, train_loss: 0.3922, test_loss: 1.0768, test_f1: 0.6362
 epoch: 79, train_loss: 0.3900, test_loss: 1.1826, test_f1: 0.6744
 epoch: 80, train_loss: 0.3882, test_loss: 1.1143, test_f1: 0.6519
 epoch: 81, train_loss: 0.3762, test_loss: 1.1169, test_f1: 0.6647
 epoch: 82, train_loss: 0.3853, test_loss: 1.1199, test_f1: 0.6646
 epoch: 83, train_loss: 0.3769, test_loss: 1.1075, test_f1: 0.6575
 epoch: 84, train_loss: 0.3739, test_loss: 1.1695, test_f1: 0.6632
 epoch: 85, train_loss: 0.3841, test_loss: 1.0958, test_f1: 0.6694
 epoch: 86, train_loss: 0.3653, test_loss: 1.1948, test_f1: 0.6576
 epoch: 87, train_loss: 0.3759, test_loss: 1.0967, test_f1: 0.6924
 epoch: 88, train_loss: 0.3557, test_loss: 1.1240, test_f1: 0.6616
 epoch: 89, train_loss: 0.3605, test_loss: 1.2345, test_f1: 0.6539
 epoch: 90, train_loss: 0.3681, test_loss: 1.1598, test_f1: 0.6594
 epoch: 91, train_loss: 0.3643, test_loss: 1.1508, test_f1: 0.6648
 epoch: 92, train_loss: 0.3618, test_loss: 1.1686, test_f1: 0.6737
 epoch: 93, train_loss: 0.3592, test_loss: 1.2536, test_f1: 0.6579
 epoch: 94, train_loss: 0.3527, test_loss: 1.1997, test_f1: 0.6564
 epoch: 95, train_loss: 0.3577, test_loss: 1.3087, test_f1: 0.6413
 epoch: 96, train_loss: 0.3430, test_loss: 1.2920, test_f1: 0.6219
 epoch: 97, train_loss: 0.3402, test_loss: 1.2961, test_f1: 0.6618
 epoch: 98, train_loss: 0.3479, test_loss: 1.2614, test_f1: 0.6397
 epoch: 99, train_loss: 0.3381, test_loss: 1.2689, test_f1: 0.6651
##################ITERATION #5 ****************************************
 epoch: 0, train_loss: 1.1684, test_loss: 0.9932, test_f1: 0.5022
 epoch: 1, train_loss: 1.0102, test_loss: 0.9613, test_f1: 0.5227
 epoch: 2, train_loss: 0.9675, test_loss: 0.9407, test_f1: 0.5217
 epoch: 3, train_loss: 0.9433, test_loss: 0.9537, test_f1: 0.4889
 epoch: 4, train_loss: 0.9280, test_loss: 0.9240, test_f1: 0.5340
 epoch: 5, train_loss: 0.8978, test_loss: 0.9206, test_f1: 0.5272
 epoch: 6, train_loss: 0.8902, test_loss: 0.8640, test_f1: 0.5668
 epoch: 7, train_loss: 0.8636, test_loss: 0.8772, test_f1: 0.5440
 epoch: 8, train_loss: 0.8472, test_loss: 0.8569, test_f1: 0.5514
 epoch: 9, train_loss: 0.8424, test_loss: 0.8222, test_f1: 0.5696
 epoch: 10, train_loss: 0.8298, test_loss: 0.8858, test_f1: 0.5338
 epoch: 11, train_loss: 0.8166, test_loss: 0.8335, test_f1: 0.5410
 epoch: 12, train_loss: 0.8102, test_loss: 0.8186, test_f1: 0.5926
 epoch: 13, train_loss: 0.7949, test_loss: 0.8424, test_f1: 0.5672
 epoch: 14, train_loss: 0.7789, test_loss: 0.8281, test_f1: 0.5625
 epoch: 15, train_loss: 0.7862, test_loss: 0.8832, test_f1: 0.5629
 epoch: 16, train_loss: 0.7608, test_loss: 0.8241, test_f1: 0.6050
 epoch: 17, train_loss: 0.7571, test_loss: 0.8363, test_f1: 0.5792
 epoch: 18, train_loss: 0.7360, test_loss: 0.8027, test_f1: 0.5908
 epoch: 19, train_loss: 0.7298, test_loss: 0.7821, test_f1: 0.6307
 epoch: 20, train_loss: 0.7263, test_loss: 0.8139, test_f1: 0.6651
 epoch: 21, train_loss: 0.7168, test_loss: 0.8122, test_f1: 0.6310
 epoch: 22, train_loss: 0.6929, test_loss: 0.7790, test_f1: 0.6119
 epoch: 23, train_loss: 0.6983, test_loss: 0.7853, test_f1: 0.6532
 epoch: 24, train_loss: 0.6833, test_loss: 0.8528, test_f1: 0.6249
 epoch: 25, train_loss: 0.6774, test_loss: 0.7875, test_f1: 0.6399
 epoch: 26, train_loss: 0.6694, test_loss: 0.7582, test_f1: 0.6308
 epoch: 27, train_loss: 0.6738, test_loss: 0.7853, test_f1: 0.6501
 epoch: 28, train_loss: 0.6547, test_loss: 0.8076, test_f1: 0.6246
 epoch: 29, train_loss: 0.6512, test_loss: 0.7911, test_f1: 0.6312
 epoch: 30, train_loss: 0.6438, test_loss: 0.7654, test_f1: 0.6280
 epoch: 31, train_loss: 0.6299, test_loss: 0.8369, test_f1: 0.6074
 epoch: 32, train_loss: 0.6403, test_loss: 0.8285, test_f1: 0.6286
 epoch: 33, train_loss: 0.6235, test_loss: 0.7804, test_f1: 0.6480
 epoch: 34, train_loss: 0.6154, test_loss: 0.8336, test_f1: 0.6671
 epoch: 35, train_loss: 0.6236, test_loss: 0.8082, test_f1: 0.6289
 epoch: 36, train_loss: 0.6032, test_loss: 0.7824, test_f1: 0.6518
 epoch: 37, train_loss: 0.5892, test_loss: 0.8580, test_f1: 0.6415
 epoch: 38, train_loss: 0.5857, test_loss: 0.7965, test_f1: 0.6635
 epoch: 39, train_loss: 0.5795, test_loss: 0.8565, test_f1: 0.6151
 epoch: 40, train_loss: 0.5702, test_loss: 0.9457, test_f1: 0.6199
 epoch: 41, train_loss: 0.5738, test_loss: 0.8365, test_f1: 0.6552
 epoch: 42, train_loss: 0.5655, test_loss: 0.8450, test_f1: 0.6473
 epoch: 43, train_loss: 0.5610, test_loss: 0.8350, test_f1: 0.6341
 epoch: 44, train_loss: 0.5611, test_loss: 0.9679, test_f1: 0.6584
 epoch: 45, train_loss: 0.5478, test_loss: 1.0068, test_f1: 0.6175
 epoch: 46, train_loss: 0.5411, test_loss: 1.0130, test_f1: 0.6479
 epoch: 47, train_loss: 0.5410, test_loss: 0.9411, test_f1: 0.6331
 epoch: 48, train_loss: 0.5389, test_loss: 0.9187, test_f1: 0.6610
 epoch: 49, train_loss: 0.5247, test_loss: 0.9758, test_f1: 0.6338
 epoch: 50, train_loss: 0.5306, test_loss: 0.9025, test_f1: 0.6247
 epoch: 51, train_loss: 0.5078, test_loss: 0.9732, test_f1: 0.6574
 epoch: 52, train_loss: 0.4942, test_loss: 0.9386, test_f1: 0.6662
 epoch: 53, train_loss: 0.4672, test_loss: 0.9659, test_f1: 0.6438
 epoch: 54, train_loss: 0.4869, test_loss: 1.0866, test_f1: 0.6469
 epoch: 55, train_loss: 0.4866, test_loss: 1.0086, test_f1: 0.6758
 epoch: 56, train_loss: 0.4763, test_loss: 1.0327, test_f1: 0.6456
 epoch: 57, train_loss: 0.4791, test_loss: 1.0081, test_f1: 0.6507
 epoch: 58, train_loss: 0.4713, test_loss: 1.0239, test_f1: 0.6469
 epoch: 59, train_loss: 0.4596, test_loss: 1.0616, test_f1: 0.6591
 epoch: 60, train_loss: 0.4506, test_loss: 1.1189, test_f1: 0.6359
 epoch: 61, train_loss: 0.4482, test_loss: 1.0454, test_f1: 0.6413
 epoch: 62, train_loss: 0.4630, test_loss: 1.0574, test_f1: 0.6486
 epoch: 63, train_loss: 0.4483, test_loss: 1.0500, test_f1: 0.6481
 epoch: 64, train_loss: 0.4372, test_loss: 1.0864, test_f1: 0.6423
 epoch: 65, train_loss: 0.4380, test_loss: 1.0310, test_f1: 0.6641
 epoch: 66, train_loss: 0.4302, test_loss: 1.0708, test_f1: 0.6554
 epoch: 67, train_loss: 0.4343, test_loss: 1.1126, test_f1: 0.6453
 epoch: 68, train_loss: 0.4275, test_loss: 1.1045, test_f1: 0.6612
 epoch: 69, train_loss: 0.4136, test_loss: 1.1050, test_f1: 0.6608
 epoch: 70, train_loss: 0.4216, test_loss: 1.0581, test_f1: 0.6662
 epoch: 71, train_loss: 0.4325, test_loss: 1.1402, test_f1: 0.6659
 epoch: 72, train_loss: 0.4287, test_loss: 1.1856, test_f1: 0.6629
 epoch: 73, train_loss: 0.4244, test_loss: 1.2190, test_f1: 0.6484
 epoch: 74, train_loss: 0.4242, test_loss: 1.1145, test_f1: 0.6387
 epoch: 75, train_loss: 0.4075, test_loss: 1.1617, test_f1: 0.6634
 epoch: 76, train_loss: 0.4123, test_loss: 1.2229, test_f1: 0.6575
 epoch: 77, train_loss: 0.4097, test_loss: 1.2022, test_f1: 0.6682
 epoch: 78, train_loss: 0.3863, test_loss: 1.1979, test_f1: 0.6685
 epoch: 79, train_loss: 0.4013, test_loss: 1.2105, test_f1: 0.6640
 epoch: 80, train_loss: 0.3988, test_loss: 1.2129, test_f1: 0.6525
 epoch: 81, train_loss: 0.3921, test_loss: 1.1891, test_f1: 0.6670
 epoch: 82, train_loss: 0.3875, test_loss: 1.2036, test_f1: 0.6614
 epoch: 83, train_loss: 0.3929, test_loss: 1.2022, test_f1: 0.6752
 epoch: 84, train_loss: 0.3744, test_loss: 1.2252, test_f1: 0.6675
 epoch: 85, train_loss: 0.3806, test_loss: 1.2536, test_f1: 0.6564
 epoch: 86, train_loss: 0.3863, test_loss: 1.3409, test_f1: 0.6677
 epoch: 87, train_loss: 0.3789, test_loss: 1.2946, test_f1: 0.6574
 epoch: 88, train_loss: 0.3704, test_loss: 1.2231, test_f1: 0.6626
 epoch: 89, train_loss: 0.3789, test_loss: 1.2629, test_f1: 0.6643
 epoch: 90, train_loss: 0.3710, test_loss: 1.2447, test_f1: 0.6664
 epoch: 91, train_loss: 0.3602, test_loss: 1.3089, test_f1: 0.6659
 epoch: 92, train_loss: 0.3679, test_loss: 1.2761, test_f1: 0.6517
 epoch: 93, train_loss: 0.3513, test_loss: 1.3240, test_f1: 0.6639
 epoch: 94, train_loss: 0.3572, test_loss: 1.3147, test_f1: 0.6787
 epoch: 95, train_loss: 0.3699, test_loss: 1.3744, test_f1: 0.6948
 epoch: 96, train_loss: 0.3548, test_loss: 1.3775, test_f1: 0.6693
 epoch: 97, train_loss: 0.3511, test_loss: 1.3421, test_f1: 0.6571
 epoch: 98, train_loss: 0.3454, test_loss: 1.4074, test_f1: 0.6791
 epoch: 99, train_loss: 0.3481, test_loss: 1.4528, test_f1: 0.6555
##################ITERATION #6 ****************************************
 epoch: 0, train_loss: 1.1725, test_loss: 1.0233, test_f1: 0.4624
 epoch: 1, train_loss: 1.0143, test_loss: 0.9583, test_f1: 0.5265
 epoch: 2, train_loss: 0.9761, test_loss: 0.9321, test_f1: 0.5218
 epoch: 3, train_loss: 0.9697, test_loss: 0.9191, test_f1: 0.5339
 epoch: 4, train_loss: 0.9433, test_loss: 0.9092, test_f1: 0.5323
 epoch: 5, train_loss: 0.9144, test_loss: 0.8790, test_f1: 0.5568
 epoch: 6, train_loss: 0.8987, test_loss: 0.9069, test_f1: 0.5246
 epoch: 7, train_loss: 0.8949, test_loss: 0.8652, test_f1: 0.5463
 epoch: 8, train_loss: 0.8681, test_loss: 0.8315, test_f1: 0.5899
 epoch: 9, train_loss: 0.8603, test_loss: 0.8264, test_f1: 0.5537
 epoch: 10, train_loss: 0.8590, test_loss: 0.7935, test_f1: 0.6088
 epoch: 11, train_loss: 0.8319, test_loss: 0.8067, test_f1: 0.5852
 epoch: 12, train_loss: 0.8218, test_loss: 0.7917, test_f1: 0.6015
 epoch: 13, train_loss: 0.8067, test_loss: 0.7930, test_f1: 0.6424
 epoch: 14, train_loss: 0.8045, test_loss: 0.7821, test_f1: 0.6285
 epoch: 15, train_loss: 0.7912, test_loss: 0.7856, test_f1: 0.6386
 epoch: 16, train_loss: 0.7712, test_loss: 0.7408, test_f1: 0.6653
 epoch: 17, train_loss: 0.7695, test_loss: 0.7840, test_f1: 0.6177
 epoch: 18, train_loss: 0.7593, test_loss: 0.7696, test_f1: 0.6354
 epoch: 19, train_loss: 0.7471, test_loss: 0.7673, test_f1: 0.6199
 epoch: 20, train_loss: 0.7433, test_loss: 0.7607, test_f1: 0.6354
 epoch: 21, train_loss: 0.7316, test_loss: 0.7565, test_f1: 0.6523
 epoch: 22, train_loss: 0.7189, test_loss: 0.7860, test_f1: 0.6059
 epoch: 23, train_loss: 0.7224, test_loss: 0.7423, test_f1: 0.6836
 epoch: 24, train_loss: 0.6998, test_loss: 0.7788, test_f1: 0.6317
 epoch: 25, train_loss: 0.7023, test_loss: 0.7558, test_f1: 0.6661
 epoch: 26, train_loss: 0.6920, test_loss: 0.7481, test_f1: 0.6543
 epoch: 27, train_loss: 0.6768, test_loss: 0.7601, test_f1: 0.6570
 epoch: 28, train_loss: 0.6908, test_loss: 0.7448, test_f1: 0.6477
 epoch: 29, train_loss: 0.6644, test_loss: 0.7561, test_f1: 0.6350
 epoch: 30, train_loss: 0.6705, test_loss: 0.7523, test_f1: 0.6492
 epoch: 31, train_loss: 0.6414, test_loss: 0.7383, test_f1: 0.6375
 epoch: 32, train_loss: 0.6583, test_loss: 0.7345, test_f1: 0.6344
 epoch: 33, train_loss: 0.6439, test_loss: 0.7754, test_f1: 0.6333
 epoch: 34, train_loss: 0.6362, test_loss: 0.7740, test_f1: 0.6272
 epoch: 35, train_loss: 0.6446, test_loss: 0.7461, test_f1: 0.6459
 epoch: 36, train_loss: 0.6280, test_loss: 0.7446, test_f1: 0.6337
 epoch: 37, train_loss: 0.6206, test_loss: 0.8056, test_f1: 0.6254
 epoch: 38, train_loss: 0.6119, test_loss: 0.7943, test_f1: 0.6330
 epoch: 39, train_loss: 0.6023, test_loss: 0.7847, test_f1: 0.6456
 epoch: 40, train_loss: 0.5993, test_loss: 0.8000, test_f1: 0.6377
 epoch: 41, train_loss: 0.5881, test_loss: 0.8234, test_f1: 0.6310
 epoch: 42, train_loss: 0.6145, test_loss: 0.8360, test_f1: 0.6130
 epoch: 43, train_loss: 0.5826, test_loss: 0.8668, test_f1: 0.6224
 epoch: 44, train_loss: 0.5687, test_loss: 0.8463, test_f1: 0.6278
 epoch: 45, train_loss: 0.5696, test_loss: 0.8093, test_f1: 0.6722
 epoch: 46, train_loss: 0.5644, test_loss: 0.8392, test_f1: 0.6477
 epoch: 47, train_loss: 0.5622, test_loss: 0.8627, test_f1: 0.6179
 epoch: 48, train_loss: 0.5502, test_loss: 0.8505, test_f1: 0.6414
 epoch: 49, train_loss: 0.5509, test_loss: 0.9091, test_f1: 0.6646
 epoch: 50, train_loss: 0.5492, test_loss: 0.9145, test_f1: 0.6416
 epoch: 51, train_loss: 0.5199, test_loss: 0.8565, test_f1: 0.6337
 epoch: 52, train_loss: 0.5143, test_loss: 0.8755, test_f1: 0.6381
 epoch: 53, train_loss: 0.5065, test_loss: 0.9142, test_f1: 0.6332
 epoch: 54, train_loss: 0.4981, test_loss: 0.9600, test_f1: 0.6316
 epoch: 55, train_loss: 0.4965, test_loss: 0.9039, test_f1: 0.6320
 epoch: 56, train_loss: 0.4880, test_loss: 0.8919, test_f1: 0.6413
 epoch: 57, train_loss: 0.4849, test_loss: 0.8778, test_f1: 0.6399
 epoch: 58, train_loss: 0.4872, test_loss: 0.8890, test_f1: 0.6329
 epoch: 59, train_loss: 0.4720, test_loss: 0.9361, test_f1: 0.6391
 epoch: 60, train_loss: 0.4750, test_loss: 0.9199, test_f1: 0.6342
 epoch: 61, train_loss: 0.4586, test_loss: 0.9788, test_f1: 0.6346
 epoch: 62, train_loss: 0.4735, test_loss: 0.9359, test_f1: 0.6249
 epoch: 63, train_loss: 0.4571, test_loss: 1.0000, test_f1: 0.6437
 epoch: 64, train_loss: 0.4505, test_loss: 0.9596, test_f1: 0.6245
 epoch: 65, train_loss: 0.4667, test_loss: 0.9481, test_f1: 0.6373
 epoch: 66, train_loss: 0.4552, test_loss: 1.0259, test_f1: 0.6341
 epoch: 67, train_loss: 0.4526, test_loss: 1.0131, test_f1: 0.6330
 epoch: 68, train_loss: 0.4581, test_loss: 0.9905, test_f1: 0.6442
 epoch: 69, train_loss: 0.4598, test_loss: 1.0097, test_f1: 0.6237
 epoch: 70, train_loss: 0.4427, test_loss: 0.9254, test_f1: 0.6391
 epoch: 71, train_loss: 0.4293, test_loss: 0.9770, test_f1: 0.6387
 epoch: 72, train_loss: 0.4325, test_loss: 1.0667, test_f1: 0.6420
 epoch: 73, train_loss: 0.4335, test_loss: 1.0625, test_f1: 0.6417
 epoch: 74, train_loss: 0.4354, test_loss: 1.0282, test_f1: 0.6272
 epoch: 75, train_loss: 0.4256, test_loss: 1.0867, test_f1: 0.6376
 epoch: 76, train_loss: 0.4274, test_loss: 1.0566, test_f1: 0.6369
 epoch: 77, train_loss: 0.4328, test_loss: 1.0424, test_f1: 0.6310
 epoch: 78, train_loss: 0.4207, test_loss: 1.0863, test_f1: 0.6417
 epoch: 79, train_loss: 0.4254, test_loss: 1.1310, test_f1: 0.6449
 epoch: 80, train_loss: 0.4051, test_loss: 1.0963, test_f1: 0.6443
 epoch: 81, train_loss: 0.4238, test_loss: 1.1950, test_f1: 0.6395
 epoch: 82, train_loss: 0.4054, test_loss: 1.0923, test_f1: 0.6335
 epoch: 83, train_loss: 0.3974, test_loss: 1.1395, test_f1: 0.6483
 epoch: 84, train_loss: 0.4196, test_loss: 1.1276, test_f1: 0.6508
 epoch: 85, train_loss: 0.3945, test_loss: 1.1482, test_f1: 0.6496
 epoch: 86, train_loss: 0.3892, test_loss: 1.2219, test_f1: 0.6353
 epoch: 87, train_loss: 0.3918, test_loss: 1.1869, test_f1: 0.6472
 epoch: 88, train_loss: 0.3960, test_loss: 1.1800, test_f1: 0.6526
 epoch: 89, train_loss: 0.3939, test_loss: 1.1518, test_f1: 0.6436
 epoch: 90, train_loss: 0.3768, test_loss: 1.2207, test_f1: 0.6561
 epoch: 91, train_loss: 0.3823, test_loss: 1.1868, test_f1: 0.6447
 epoch: 92, train_loss: 0.3967, test_loss: 1.1998, test_f1: 0.6569
 epoch: 93, train_loss: 0.3778, test_loss: 1.2661, test_f1: 0.6415
 epoch: 94, train_loss: 0.3800, test_loss: 1.1907, test_f1: 0.6586
 epoch: 95, train_loss: 0.3658, test_loss: 1.3657, test_f1: 0.6502
 epoch: 96, train_loss: 0.3630, test_loss: 1.2888, test_f1: 0.6392
 epoch: 97, train_loss: 0.3646, test_loss: 1.2901, test_f1: 0.6436
 epoch: 98, train_loss: 0.3766, test_loss: 1.2541, test_f1: 0.6465
 epoch: 99, train_loss: 0.3545, test_loss: 1.3823, test_f1: 0.6324
##################ITERATION #7 ****************************************
 epoch: 0, train_loss: 1.1600, test_loss: 0.9608, test_f1: 0.4972
 epoch: 1, train_loss: 1.0365, test_loss: 0.9106, test_f1: 0.5181
 epoch: 2, train_loss: 0.9787, test_loss: 0.8781, test_f1: 0.4977
 epoch: 3, train_loss: 0.9411, test_loss: 0.8570, test_f1: 0.5672
 epoch: 4, train_loss: 0.9195, test_loss: 0.8428, test_f1: 0.5372
 epoch: 5, train_loss: 0.9043, test_loss: 0.8588, test_f1: 0.5613
 epoch: 6, train_loss: 0.8821, test_loss: 0.7994, test_f1: 0.5746
 epoch: 7, train_loss: 0.8656, test_loss: 0.8010, test_f1: 0.5681
 epoch: 8, train_loss: 0.8546, test_loss: 0.7975, test_f1: 0.5848
 epoch: 9, train_loss: 0.8425, test_loss: 0.8267, test_f1: 0.5613
 epoch: 10, train_loss: 0.8250, test_loss: 0.8298, test_f1: 0.5537
 epoch: 11, train_loss: 0.8192, test_loss: 0.7837, test_f1: 0.5900
 epoch: 12, train_loss: 0.8041, test_loss: 0.7735, test_f1: 0.5947
 epoch: 13, train_loss: 0.7877, test_loss: 0.7572, test_f1: 0.6091
 epoch: 14, train_loss: 0.7666, test_loss: 0.7527, test_f1: 0.6049
 epoch: 15, train_loss: 0.7622, test_loss: 0.7290, test_f1: 0.6571
 epoch: 16, train_loss: 0.7603, test_loss: 0.7398, test_f1: 0.6487
 epoch: 17, train_loss: 0.7567, test_loss: 0.7408, test_f1: 0.6440
 epoch: 18, train_loss: 0.7389, test_loss: 0.7214, test_f1: 0.6694
 epoch: 19, train_loss: 0.7336, test_loss: 0.7184, test_f1: 0.6706
 epoch: 20, train_loss: 0.7243, test_loss: 0.7111, test_f1: 0.6361
 epoch: 21, train_loss: 0.7012, test_loss: 0.7273, test_f1: 0.6295
 epoch: 22, train_loss: 0.7222, test_loss: 0.7169, test_f1: 0.6283
 epoch: 23, train_loss: 0.6965, test_loss: 0.7012, test_f1: 0.6671
 epoch: 24, train_loss: 0.6803, test_loss: 0.6904, test_f1: 0.6892
 epoch: 25, train_loss: 0.6806, test_loss: 0.6971, test_f1: 0.6565
 epoch: 26, train_loss: 0.6762, test_loss: 0.6875, test_f1: 0.6410
 epoch: 27, train_loss: 0.6690, test_loss: 0.7085, test_f1: 0.6589
 epoch: 28, train_loss: 0.6626, test_loss: 0.7109, test_f1: 0.6734
 epoch: 29, train_loss: 0.6653, test_loss: 0.7293, test_f1: 0.6444
 epoch: 30, train_loss: 0.6485, test_loss: 0.7303, test_f1: 0.6643
 epoch: 31, train_loss: 0.6402, test_loss: 0.7007, test_f1: 0.6883
 epoch: 32, train_loss: 0.6274, test_loss: 0.7059, test_f1: 0.6574
 epoch: 33, train_loss: 0.6287, test_loss: 0.7091, test_f1: 0.6613
 epoch: 34, train_loss: 0.6171, test_loss: 0.7183, test_f1: 0.6401
 epoch: 35, train_loss: 0.6121, test_loss: 0.7059, test_f1: 0.6714
 epoch: 36, train_loss: 0.6154, test_loss: 0.7179, test_f1: 0.6669
 epoch: 37, train_loss: 0.5911, test_loss: 0.6915, test_f1: 0.6604
 epoch: 38, train_loss: 0.6016, test_loss: 0.6688, test_f1: 0.6959
 epoch: 39, train_loss: 0.5821, test_loss: 0.7014, test_f1: 0.6702
 epoch: 40, train_loss: 0.5831, test_loss: 0.7145, test_f1: 0.6893
 epoch: 41, train_loss: 0.5843, test_loss: 0.7174, test_f1: 0.6637
 epoch: 42, train_loss: 0.5719, test_loss: 0.7258, test_f1: 0.6725
 epoch: 43, train_loss: 0.5679, test_loss: 0.7491, test_f1: 0.6811
 epoch: 44, train_loss: 0.5568, test_loss: 0.7391, test_f1: 0.6741
 epoch: 45, train_loss: 0.5589, test_loss: 0.7020, test_f1: 0.6913
 epoch: 46, train_loss: 0.5489, test_loss: 0.6881, test_f1: 0.7045
 epoch: 47, train_loss: 0.5596, test_loss: 0.6976, test_f1: 0.6812
 epoch: 48, train_loss: 0.5508, test_loss: 0.7743, test_f1: 0.6682
 epoch: 49, train_loss: 0.5277, test_loss: 0.7359, test_f1: 0.6816
 epoch: 50, train_loss: 0.5369, test_loss: 0.7603, test_f1: 0.6825
 epoch: 51, train_loss: 0.5014, test_loss: 0.7473, test_f1: 0.6790
 epoch: 52, train_loss: 0.4846, test_loss: 0.7476, test_f1: 0.6915
 epoch: 53, train_loss: 0.4924, test_loss: 0.8303, test_f1: 0.6698
 epoch: 54, train_loss: 0.4994, test_loss: 0.7444, test_f1: 0.6929
 epoch: 55, train_loss: 0.4896, test_loss: 0.7801, test_f1: 0.6824
 epoch: 56, train_loss: 0.4881, test_loss: 0.7872, test_f1: 0.6693
 epoch: 57, train_loss: 0.4739, test_loss: 0.8347, test_f1: 0.6731
 epoch: 58, train_loss: 0.4674, test_loss: 0.8341, test_f1: 0.6825
 epoch: 59, train_loss: 0.4815, test_loss: 0.8041, test_f1: 0.6818
 epoch: 60, train_loss: 0.4711, test_loss: 0.7890, test_f1: 0.6880
 epoch: 61, train_loss: 0.4575, test_loss: 0.7803, test_f1: 0.6961
 epoch: 62, train_loss: 0.4617, test_loss: 0.8062, test_f1: 0.6820
 epoch: 63, train_loss: 0.4641, test_loss: 0.8025, test_f1: 0.6872
 epoch: 64, train_loss: 0.4528, test_loss: 0.8540, test_f1: 0.6599
 epoch: 65, train_loss: 0.4494, test_loss: 0.8463, test_f1: 0.6710
 epoch: 66, train_loss: 0.4506, test_loss: 0.8294, test_f1: 0.6820
 epoch: 67, train_loss: 0.4469, test_loss: 0.8430, test_f1: 0.6645
 epoch: 68, train_loss: 0.4467, test_loss: 0.8761, test_f1: 0.6763
 epoch: 69, train_loss: 0.4489, test_loss: 0.8967, test_f1: 0.6621
 epoch: 70, train_loss: 0.4526, test_loss: 0.8153, test_f1: 0.6841
 epoch: 71, train_loss: 0.4231, test_loss: 0.8748, test_f1: 0.6655
 epoch: 72, train_loss: 0.4354, test_loss: 0.8811, test_f1: 0.6659
 epoch: 73, train_loss: 0.4326, test_loss: 0.8076, test_f1: 0.6948
 epoch: 74, train_loss: 0.4393, test_loss: 0.8625, test_f1: 0.6613
 epoch: 75, train_loss: 0.4272, test_loss: 0.8616, test_f1: 0.6724
 epoch: 76, train_loss: 0.4274, test_loss: 0.8590, test_f1: 0.7000
 epoch: 77, train_loss: 0.4157, test_loss: 0.8877, test_f1: 0.6766
 epoch: 78, train_loss: 0.4176, test_loss: 0.9901, test_f1: 0.6566
 epoch: 79, train_loss: 0.4068, test_loss: 0.9380, test_f1: 0.6775
 epoch: 80, train_loss: 0.4152, test_loss: 0.9582, test_f1: 0.6717
 epoch: 81, train_loss: 0.4123, test_loss: 0.9744, test_f1: 0.6706
 epoch: 82, train_loss: 0.3934, test_loss: 0.9579, test_f1: 0.6764
 epoch: 83, train_loss: 0.4094, test_loss: 0.9403, test_f1: 0.6865
 epoch: 84, train_loss: 0.3965, test_loss: 0.9959, test_f1: 0.6715
 epoch: 85, train_loss: 0.3934, test_loss: 0.9434, test_f1: 0.6616
 epoch: 86, train_loss: 0.3935, test_loss: 0.9482, test_f1: 0.6719
 epoch: 87, train_loss: 0.4065, test_loss: 0.9448, test_f1: 0.6626
 epoch: 88, train_loss: 0.3911, test_loss: 0.9359, test_f1: 0.6715
 epoch: 89, train_loss: 0.3905, test_loss: 0.9803, test_f1: 0.6833
 epoch: 90, train_loss: 0.3910, test_loss: 0.9410, test_f1: 0.6696
 epoch: 91, train_loss: 0.3753, test_loss: 1.0216, test_f1: 0.6761
 epoch: 92, train_loss: 0.3867, test_loss: 0.9894, test_f1: 0.6904
 epoch: 93, train_loss: 0.3653, test_loss: 1.0151, test_f1: 0.6697
 epoch: 94, train_loss: 0.3794, test_loss: 0.9702, test_f1: 0.6925
 epoch: 95, train_loss: 0.3770, test_loss: 0.9713, test_f1: 0.6889
 epoch: 96, train_loss: 0.3704, test_loss: 1.0319, test_f1: 0.6802
 epoch: 97, train_loss: 0.3786, test_loss: 1.0799, test_f1: 0.6689
 epoch: 98, train_loss: 0.3760, test_loss: 1.1022, test_f1: 0.6685
 epoch: 99, train_loss: 0.3629, test_loss: 0.9987, test_f1: 0.7126
##################ITERATION #8 ****************************************
 epoch: 0, train_loss: 1.2337, test_loss: 0.9797, test_f1: 0.5100
 epoch: 1, train_loss: 1.0556, test_loss: 0.9597, test_f1: 0.5033
 epoch: 2, train_loss: 0.9974, test_loss: 0.9333, test_f1: 0.4989
 epoch: 3, train_loss: 0.9469, test_loss: 0.9181, test_f1: 0.5198
 epoch: 4, train_loss: 0.9323, test_loss: 0.8829, test_f1: 0.5187
 epoch: 5, train_loss: 0.9101, test_loss: 0.8787, test_f1: 0.5314
 epoch: 6, train_loss: 0.9182, test_loss: 0.8701, test_f1: 0.5588
 epoch: 7, train_loss: 0.8802, test_loss: 0.8345, test_f1: 0.5580
 epoch: 8, train_loss: 0.8803, test_loss: 0.8310, test_f1: 0.5796
 epoch: 9, train_loss: 0.8769, test_loss: 0.8391, test_f1: 0.5782
 epoch: 10, train_loss: 0.8447, test_loss: 0.8304, test_f1: 0.5590
 epoch: 11, train_loss: 0.8257, test_loss: 0.8039, test_f1: 0.5873
 epoch: 12, train_loss: 0.8230, test_loss: 0.8039, test_f1: 0.5906
 epoch: 13, train_loss: 0.8113, test_loss: 0.7983, test_f1: 0.6114
 epoch: 14, train_loss: 0.8019, test_loss: 0.7830, test_f1: 0.6136
 epoch: 15, train_loss: 0.7838, test_loss: 0.7841, test_f1: 0.6287
 epoch: 16, train_loss: 0.7785, test_loss: 0.7689, test_f1: 0.6306
 epoch: 17, train_loss: 0.7902, test_loss: 0.7846, test_f1: 0.6117
 epoch: 18, train_loss: 0.7675, test_loss: 0.8000, test_f1: 0.6235
 epoch: 19, train_loss: 0.7590, test_loss: 0.7914, test_f1: 0.6174
 epoch: 20, train_loss: 0.7420, test_loss: 0.7496, test_f1: 0.6326
 epoch: 21, train_loss: 0.7367, test_loss: 0.7572, test_f1: 0.6429
 epoch: 22, train_loss: 0.7141, test_loss: 0.7608, test_f1: 0.6376
 epoch: 23, train_loss: 0.7254, test_loss: 0.7521, test_f1: 0.6642
 epoch: 24, train_loss: 0.7231, test_loss: 0.7497, test_f1: 0.6382
 epoch: 25, train_loss: 0.7087, test_loss: 0.7567, test_f1: 0.6366
 epoch: 26, train_loss: 0.6919, test_loss: 0.7603, test_f1: 0.6484
 epoch: 27, train_loss: 0.7087, test_loss: 0.7400, test_f1: 0.6548
 epoch: 28, train_loss: 0.6922, test_loss: 0.7475, test_f1: 0.6517
 epoch: 29, train_loss: 0.6818, test_loss: 0.7366, test_f1: 0.6682
 epoch: 30, train_loss: 0.6787, test_loss: 0.7525, test_f1: 0.6427
 epoch: 31, train_loss: 0.6834, test_loss: 0.7231, test_f1: 0.6702
 epoch: 32, train_loss: 0.6580, test_loss: 0.7094, test_f1: 0.6860
 epoch: 33, train_loss: 0.6650, test_loss: 0.7182, test_f1: 0.6754
 epoch: 34, train_loss: 0.6483, test_loss: 0.7281, test_f1: 0.6470
 epoch: 35, train_loss: 0.6335, test_loss: 0.7867, test_f1: 0.6397
 epoch: 36, train_loss: 0.6361, test_loss: 0.7150, test_f1: 0.6835
 epoch: 37, train_loss: 0.6304, test_loss: 0.7435, test_f1: 0.6430
 epoch: 38, train_loss: 0.6293, test_loss: 0.7174, test_f1: 0.6850
 epoch: 39, train_loss: 0.6217, test_loss: 0.7405, test_f1: 0.6646
 epoch: 40, train_loss: 0.6140, test_loss: 0.7503, test_f1: 0.6726
 epoch: 41, train_loss: 0.5896, test_loss: 0.7322, test_f1: 0.6395
 epoch: 42, train_loss: 0.5922, test_loss: 0.7958, test_f1: 0.6393
 epoch: 43, train_loss: 0.5783, test_loss: 0.7783, test_f1: 0.6681
 epoch: 44, train_loss: 0.5997, test_loss: 0.7909, test_f1: 0.6518
 epoch: 45, train_loss: 0.5860, test_loss: 0.7510, test_f1: 0.6672
 epoch: 46, train_loss: 0.5827, test_loss: 0.7477, test_f1: 0.6668
 epoch: 47, train_loss: 0.5740, test_loss: 0.7621, test_f1: 0.6584
 epoch: 48, train_loss: 0.5774, test_loss: 0.7709, test_f1: 0.6466
 epoch: 49, train_loss: 0.5602, test_loss: 0.7623, test_f1: 0.6499
 epoch: 50, train_loss: 0.5470, test_loss: 0.7395, test_f1: 0.6786
 epoch: 51, train_loss: 0.5363, test_loss: 0.7957, test_f1: 0.6682
 epoch: 52, train_loss: 0.5340, test_loss: 0.7560, test_f1: 0.6616
 epoch: 53, train_loss: 0.5202, test_loss: 0.7635, test_f1: 0.6511
 epoch: 54, train_loss: 0.5038, test_loss: 0.7948, test_f1: 0.6458
 epoch: 55, train_loss: 0.5128, test_loss: 0.8343, test_f1: 0.6521
 epoch: 56, train_loss: 0.5053, test_loss: 0.8036, test_f1: 0.6507
 epoch: 57, train_loss: 0.5099, test_loss: 0.7735, test_f1: 0.6503
 epoch: 58, train_loss: 0.5022, test_loss: 0.8124, test_f1: 0.6385
 epoch: 59, train_loss: 0.5074, test_loss: 0.8195, test_f1: 0.6579
 epoch: 60, train_loss: 0.5145, test_loss: 0.7692, test_f1: 0.6564
 epoch: 61, train_loss: 0.4872, test_loss: 0.7849, test_f1: 0.6536
 epoch: 62, train_loss: 0.4944, test_loss: 0.8556, test_f1: 0.6401
 epoch: 63, train_loss: 0.4937, test_loss: 0.7689, test_f1: 0.6724
 epoch: 64, train_loss: 0.4858, test_loss: 0.8206, test_f1: 0.6523
 epoch: 65, train_loss: 0.4794, test_loss: 0.8551, test_f1: 0.6668
 epoch: 66, train_loss: 0.4816, test_loss: 0.8551, test_f1: 0.6497
 epoch: 67, train_loss: 0.4711, test_loss: 0.8617, test_f1: 0.6582
 epoch: 68, train_loss: 0.4636, test_loss: 0.8444, test_f1: 0.6646
 epoch: 69, train_loss: 0.4678, test_loss: 0.8881, test_f1: 0.6517
 epoch: 70, train_loss: 0.4575, test_loss: 0.8570, test_f1: 0.6570
 epoch: 71, train_loss: 0.4471, test_loss: 0.8688, test_f1: 0.6484
 epoch: 72, train_loss: 0.4535, test_loss: 0.8616, test_f1: 0.6725
 epoch: 73, train_loss: 0.4585, test_loss: 0.8744, test_f1: 0.6503
 epoch: 74, train_loss: 0.4459, test_loss: 0.9544, test_f1: 0.6107
 epoch: 75, train_loss: 0.4427, test_loss: 0.8666, test_f1: 0.6712
 epoch: 76, train_loss: 0.4310, test_loss: 0.8896, test_f1: 0.6544
 epoch: 77, train_loss: 0.4513, test_loss: 0.9113, test_f1: 0.6476
 epoch: 78, train_loss: 0.4356, test_loss: 0.8895, test_f1: 0.6437
 epoch: 79, train_loss: 0.4314, test_loss: 0.9107, test_f1: 0.6700
 epoch: 80, train_loss: 0.4247, test_loss: 0.9549, test_f1: 0.6566
 epoch: 81, train_loss: 0.4457, test_loss: 0.8849, test_f1: 0.6421
 epoch: 82, train_loss: 0.4209, test_loss: 0.9070, test_f1: 0.6623
 epoch: 83, train_loss: 0.4353, test_loss: 0.8819, test_f1: 0.6593
 epoch: 84, train_loss: 0.4456, test_loss: 0.9193, test_f1: 0.6523
 epoch: 85, train_loss: 0.4191, test_loss: 0.9421, test_f1: 0.6675
 epoch: 86, train_loss: 0.4174, test_loss: 0.9451, test_f1: 0.6741
 epoch: 87, train_loss: 0.4242, test_loss: 1.0008, test_f1: 0.6827
 epoch: 88, train_loss: 0.4237, test_loss: 0.9140, test_f1: 0.6660
 epoch: 89, train_loss: 0.4176, test_loss: 0.9546, test_f1: 0.6744
 epoch: 90, train_loss: 0.4015, test_loss: 0.9781, test_f1: 0.6523
 epoch: 91, train_loss: 0.4175, test_loss: 1.0114, test_f1: 0.6715
 epoch: 92, train_loss: 0.4044, test_loss: 0.9939, test_f1: 0.6702
 epoch: 93, train_loss: 0.4075, test_loss: 1.0443, test_f1: 0.6485
 epoch: 94, train_loss: 0.4052, test_loss: 1.0354, test_f1: 0.6627
 epoch: 95, train_loss: 0.3989, test_loss: 1.0739, test_f1: 0.6330
 epoch: 96, train_loss: 0.3969, test_loss: 1.0674, test_f1: 0.6746
 epoch: 97, train_loss: 0.3988, test_loss: 1.0856, test_f1: 0.6673
 epoch: 98, train_loss: 0.3867, test_loss: 1.1973, test_f1: 0.6587
 epoch: 99, train_loss: 0.3769, test_loss: 1.0089, test_f1: 0.6716
##################ITERATION #9 ****************************************
 epoch: 0, train_loss: 1.2707, test_loss: 0.9525, test_f1: 0.5046
 epoch: 1, train_loss: 1.0492, test_loss: 0.9792, test_f1: 0.4937
 epoch: 2, train_loss: 0.9951, test_loss: 0.9789, test_f1: 0.5074
 epoch: 3, train_loss: 0.9559, test_loss: 0.9198, test_f1: 0.5238
 epoch: 4, train_loss: 0.9409, test_loss: 0.9394, test_f1: 0.5122
 epoch: 5, train_loss: 0.9131, test_loss: 0.9344, test_f1: 0.5082
 epoch: 6, train_loss: 0.9036, test_loss: 0.8812, test_f1: 0.5768
 epoch: 7, train_loss: 0.9043, test_loss: 0.8774, test_f1: 0.5280
 epoch: 8, train_loss: 0.8648, test_loss: 0.8901, test_f1: 0.5347
 epoch: 9, train_loss: 0.8564, test_loss: 0.8611, test_f1: 0.5497
 epoch: 10, train_loss: 0.8421, test_loss: 0.8455, test_f1: 0.5620
 epoch: 11, train_loss: 0.8335, test_loss: 0.8372, test_f1: 0.5595
 epoch: 12, train_loss: 0.8188, test_loss: 0.8290, test_f1: 0.5732
 epoch: 13, train_loss: 0.7987, test_loss: 0.8548, test_f1: 0.5753
 epoch: 14, train_loss: 0.7948, test_loss: 0.8396, test_f1: 0.5742
 epoch: 15, train_loss: 0.7967, test_loss: 0.8001, test_f1: 0.6186
 epoch: 16, train_loss: 0.7850, test_loss: 0.7931, test_f1: 0.6035
 epoch: 17, train_loss: 0.7665, test_loss: 0.8233, test_f1: 0.6184
 epoch: 18, train_loss: 0.7537, test_loss: 0.8239, test_f1: 0.6249
 epoch: 19, train_loss: 0.7430, test_loss: 0.8085, test_f1: 0.6044
 epoch: 20, train_loss: 0.7477, test_loss: 0.8511, test_f1: 0.6403
 epoch: 21, train_loss: 0.7305, test_loss: 0.7943, test_f1: 0.6349
 epoch: 22, train_loss: 0.7154, test_loss: 0.8648, test_f1: 0.6395
 epoch: 23, train_loss: 0.7204, test_loss: 0.7940, test_f1: 0.6709
 epoch: 24, train_loss: 0.7140, test_loss: 0.8225, test_f1: 0.6387
 epoch: 25, train_loss: 0.7049, test_loss: 0.8044, test_f1: 0.6610
 epoch: 26, train_loss: 0.6928, test_loss: 0.7489, test_f1: 0.6475
 epoch: 27, train_loss: 0.6892, test_loss: 0.8873, test_f1: 0.6454
 epoch: 28, train_loss: 0.6895, test_loss: 0.7792, test_f1: 0.6273
 epoch: 29, train_loss: 0.6796, test_loss: 0.7953, test_f1: 0.6507
 epoch: 30, train_loss: 0.6766, test_loss: 0.7376, test_f1: 0.6699
 epoch: 31, train_loss: 0.6779, test_loss: 0.8389, test_f1: 0.6555
 epoch: 32, train_loss: 0.6576, test_loss: 0.8117, test_f1: 0.6513
 epoch: 33, train_loss: 0.6485, test_loss: 0.7867, test_f1: 0.6785
 epoch: 34, train_loss: 0.6553, test_loss: 0.7970, test_f1: 0.6576
 epoch: 35, train_loss: 0.6518, test_loss: 0.7842, test_f1: 0.6412
 epoch: 36, train_loss: 0.6331, test_loss: 0.8248, test_f1: 0.6568
 epoch: 37, train_loss: 0.6415, test_loss: 0.8307, test_f1: 0.6730
 epoch: 38, train_loss: 0.6277, test_loss: 0.7886, test_f1: 0.6318
 epoch: 39, train_loss: 0.6228, test_loss: 0.7906, test_f1: 0.6574
 epoch: 40, train_loss: 0.6025, test_loss: 0.8359, test_f1: 0.6594
 epoch: 41, train_loss: 0.6195, test_loss: 0.8862, test_f1: 0.6390
 epoch: 42, train_loss: 0.6251, test_loss: 0.8328, test_f1: 0.6881
 epoch: 43, train_loss: 0.5984, test_loss: 0.7946, test_f1: 0.6417
 epoch: 44, train_loss: 0.5964, test_loss: 0.8434, test_f1: 0.6605
 epoch: 45, train_loss: 0.5854, test_loss: 0.7972, test_f1: 0.6586
 epoch: 46, train_loss: 0.5775, test_loss: 0.8120, test_f1: 0.6758
 epoch: 47, train_loss: 0.5806, test_loss: 0.7427, test_f1: 0.6762
 epoch: 48, train_loss: 0.5823, test_loss: 0.7988, test_f1: 0.6545
 epoch: 49, train_loss: 0.5685, test_loss: 0.8025, test_f1: 0.6510
 epoch: 50, train_loss: 0.5651, test_loss: 0.7795, test_f1: 0.6502
 epoch: 51, train_loss: 0.5486, test_loss: 0.8185, test_f1: 0.6534
 epoch: 52, train_loss: 0.5197, test_loss: 0.7921, test_f1: 0.6562
 epoch: 53, train_loss: 0.5224, test_loss: 0.8063, test_f1: 0.6495
 epoch: 54, train_loss: 0.5340, test_loss: 0.8484, test_f1: 0.6562
 epoch: 55, train_loss: 0.5114, test_loss: 0.8642, test_f1: 0.6449
 epoch: 56, train_loss: 0.5134, test_loss: 0.7751, test_f1: 0.6625
 epoch: 57, train_loss: 0.4908, test_loss: 0.8134, test_f1: 0.6510
 epoch: 58, train_loss: 0.5134, test_loss: 0.8798, test_f1: 0.6430
 epoch: 59, train_loss: 0.5052, test_loss: 0.8529, test_f1: 0.6563
 epoch: 60, train_loss: 0.5190, test_loss: 0.8368, test_f1: 0.6450
 epoch: 61, train_loss: 0.4988, test_loss: 0.9173, test_f1: 0.6301
 epoch: 62, train_loss: 0.4982, test_loss: 0.9055, test_f1: 0.6505
 epoch: 63, train_loss: 0.4823, test_loss: 0.9180, test_f1: 0.6356
 epoch: 64, train_loss: 0.4831, test_loss: 0.8709, test_f1: 0.6599
 epoch: 65, train_loss: 0.4861, test_loss: 0.8599, test_f1: 0.6494
 epoch: 66, train_loss: 0.4774, test_loss: 0.8676, test_f1: 0.6482
 epoch: 67, train_loss: 0.4833, test_loss: 0.8361, test_f1: 0.6515
 epoch: 68, train_loss: 0.4763, test_loss: 0.8402, test_f1: 0.6624
 epoch: 69, train_loss: 0.4752, test_loss: 0.8579, test_f1: 0.6698
 epoch: 70, train_loss: 0.4862, test_loss: 0.8871, test_f1: 0.6646
 epoch: 71, train_loss: 0.4757, test_loss: 0.9029, test_f1: 0.6626
 epoch: 72, train_loss: 0.4578, test_loss: 0.9072, test_f1: 0.6394
 epoch: 73, train_loss: 0.4536, test_loss: 0.8630, test_f1: 0.6574
 epoch: 74, train_loss: 0.4683, test_loss: 0.8669, test_f1: 0.6744
 epoch: 75, train_loss: 0.4512, test_loss: 0.8882, test_f1: 0.6664
 epoch: 76, train_loss: 0.4626, test_loss: 0.9435, test_f1: 0.6386
 epoch: 77, train_loss: 0.4555, test_loss: 0.9449, test_f1: 0.6414
 epoch: 78, train_loss: 0.4526, test_loss: 0.9440, test_f1: 0.6636
 epoch: 79, train_loss: 0.4397, test_loss: 0.9050, test_f1: 0.6608
 epoch: 80, train_loss: 0.4533, test_loss: 0.9353, test_f1: 0.6602
 epoch: 81, train_loss: 0.4391, test_loss: 0.9230, test_f1: 0.6571
 epoch: 82, train_loss: 0.4465, test_loss: 1.0483, test_f1: 0.6381
 epoch: 83, train_loss: 0.4209, test_loss: 0.9880, test_f1: 0.6646
 epoch: 84, train_loss: 0.4396, test_loss: 0.9824, test_f1: 0.6597
 epoch: 85, train_loss: 0.4389, test_loss: 0.9649, test_f1: 0.6463
 epoch: 86, train_loss: 0.4298, test_loss: 1.0402, test_f1: 0.6392
 epoch: 87, train_loss: 0.4246, test_loss: 1.0667, test_f1: 0.6519
 epoch: 88, train_loss: 0.4310, test_loss: 1.0327, test_f1: 0.6612
 epoch: 89, train_loss: 0.4282, test_loss: 0.9803, test_f1: 0.6409
 epoch: 90, train_loss: 0.4373, test_loss: 1.0249, test_f1: 0.6445
 epoch: 91, train_loss: 0.4166, test_loss: 1.0265, test_f1: 0.6560
 epoch: 92, train_loss: 0.4242, test_loss: 1.0388, test_f1: 0.6493
 epoch: 93, train_loss: 0.4164, test_loss: 1.0778, test_f1: 0.6687
 epoch: 94, train_loss: 0.3965, test_loss: 0.9592, test_f1: 0.6744
 epoch: 95, train_loss: 0.4184, test_loss: 1.0563, test_f1: 0.6560
 epoch: 96, train_loss: 0.3978, test_loss: 1.1033, test_f1: 0.6427
 epoch: 97, train_loss: 0.4120, test_loss: 0.9793, test_f1: 0.6643
 epoch: 98, train_loss: 0.4114, test_loss: 0.9540, test_f1: 0.6574
 epoch: 99, train_loss: 0.3965, test_loss: 1.1118, test_f1: 0.6540

Training completed in 1196.91 seconds
Best F1: 0.7126 at epoch 99
Mean F1 across iterations: 0.6856  0.0123
========================FINAL RESULTS================================
FEGIN weighted F1: 0.7126  0.0123
python main.py --data ltspice_examples --representation component_pin_net --model FEGIN --layers 4 --hiddens 128 --batch_size 32 --lr 0.0001 --emb_size 512 --epochs 100 --save_appendix component_pin_net_L4_H128_BS32_LR0.0001_E512 --no_val
-----



STDERR:
  File "main.py", line 370, in <module>
    main()
  File "main.py", line 254, in main
    dataset = dataset_class(
  File "/home/philip/projects/ltspice_examples_code_repo/Circuit-Completion-Using-GNNs/component_classification_with_link_prediction_head/evaluation/FEGIN/kernel/circuit_datasets.py", line 15, in __init__
    self.data, self.slices = torch.load(self.processed_paths[0])
  File "/home/philip/.local/lib/python3.8/site-packages/torch/serialization.py", line 1040, in load
    warnings.warn(
  File "/usr/lib/python3.8/warnings.py", line 109, in _showwarnmsg
    sw(msg.message, msg.category, msg.filename, msg.lineno,
  File "main.py", line 47, in warn_with_traceback
    traceback.print_stack(file=log)
/home/philip/projects/ltspice_examples_code_repo/Circuit-Completion-Using-GNNs/component_classification_with_link_prediction_head/evaluation/FEGIN/kernel/circuit_datasets.py:15: FutureWarning: You are using `torch.load` with `weights_only=False` (the current default value), which uses the default pickle module implicitly. It is possible to construct malicious pickle data which will execute arbitrary code during unpickling (See https://github.com/pytorch/pytorch/blob/main/SECURITY.md#untrusted-models for more details). In a future release, the default value for `weights_only` will be flipped to `True`. This limits the functions that could be executed during unpickling. Arbitrary objects will no longer be allowed to be loaded via this mode unless they are explicitly allowlisted by the user via `torch.serialization.add_safe_globals`. We recommend you start setting `weights_only=True` for any use case where you don't have full control of the loaded file. Please open an issue on GitHub for any issues related to this experimental feature.
  self.data, self.slices = torch.load(self.processed_paths[0])
