STDOUT:
Results will be saved in /home/philip/projects/ltspice_examples_code_repo/Circuit-Completion-Using-GNNs/component_classification_with_link_prediction_head/evaluation/FEGIN/results/model_FEGIN_dataset_ltspice_examples
Command line input: python main.py --data ltspice_examples --representation component_net --model FEGIN --layers 2 --hiddens 128 --batch_size 32 --lr 0.0001 --emb_size 128 --epochs 100 --save_appendix component_net_L2_H128_BS32_LR0.0001_E128 --no_val
 is saved.
-----
ltspice_examples - FEGIN
Using 2 layers, 128 hidden units, h = 2
Loading component_net representation dataset
ENTERED
Training FEGIN on component_net representation
Train: 3558, Test: 846
##################ITERATION #0 ****************************************
 epoch: 0, train_loss: 1.3299, test_loss: 1.2623, test_f1: 0.2270
 epoch: 1, train_loss: 1.2369, test_loss: 1.1999, test_f1: 0.2801
 epoch: 2, train_loss: 1.1863, test_loss: 1.1226, test_f1: 0.3600
 epoch: 3, train_loss: 1.1271, test_loss: 1.0598, test_f1: 0.4242
 epoch: 4, train_loss: 1.0623, test_loss: 1.0145, test_f1: 0.4441
 epoch: 5, train_loss: 1.0235, test_loss: 0.9976, test_f1: 0.4724
 epoch: 6, train_loss: 0.9876, test_loss: 0.9693, test_f1: 0.4762
 epoch: 7, train_loss: 0.9713, test_loss: 0.9544, test_f1: 0.4896
 epoch: 8, train_loss: 0.9548, test_loss: 0.9321, test_f1: 0.5014
 epoch: 9, train_loss: 0.9501, test_loss: 0.9408, test_f1: 0.5010
 epoch: 10, train_loss: 0.9313, test_loss: 0.9314, test_f1: 0.5030
 epoch: 11, train_loss: 0.9283, test_loss: 0.9287, test_f1: 0.4879
 epoch: 12, train_loss: 0.9194, test_loss: 0.9072, test_f1: 0.5019
 epoch: 13, train_loss: 0.9033, test_loss: 0.9256, test_f1: 0.5170
 epoch: 14, train_loss: 0.9022, test_loss: 0.9227, test_f1: 0.5129
 epoch: 15, train_loss: 0.8931, test_loss: 0.9268, test_f1: 0.5097
 epoch: 16, train_loss: 0.8827, test_loss: 0.9185, test_f1: 0.5360
 epoch: 17, train_loss: 0.8809, test_loss: 0.9107, test_f1: 0.5278
 epoch: 18, train_loss: 0.8717, test_loss: 0.9559, test_f1: 0.5129
 epoch: 19, train_loss: 0.8712, test_loss: 0.9218, test_f1: 0.5379
 epoch: 20, train_loss: 0.8567, test_loss: 0.9219, test_f1: 0.5199
 epoch: 21, train_loss: 0.8629, test_loss: 0.9106, test_f1: 0.5228
 epoch: 22, train_loss: 0.8419, test_loss: 0.9059, test_f1: 0.5359
 epoch: 23, train_loss: 0.8405, test_loss: 0.9351, test_f1: 0.5431
 epoch: 24, train_loss: 0.8363, test_loss: 0.9271, test_f1: 0.5278
 epoch: 25, train_loss: 0.8417, test_loss: 0.8848, test_f1: 0.5328
 epoch: 26, train_loss: 0.8255, test_loss: 0.9500, test_f1: 0.5335
 epoch: 27, train_loss: 0.8256, test_loss: 0.9034, test_f1: 0.5422
 epoch: 28, train_loss: 0.8123, test_loss: 0.8965, test_f1: 0.5394
 epoch: 29, train_loss: 0.8149, test_loss: 0.9236, test_f1: 0.5259
 epoch: 30, train_loss: 0.8006, test_loss: 0.9437, test_f1: 0.5512
 epoch: 31, train_loss: 0.8087, test_loss: 0.9259, test_f1: 0.5555
 epoch: 32, train_loss: 0.8049, test_loss: 0.9450, test_f1: 0.5568
 epoch: 33, train_loss: 0.7983, test_loss: 0.9134, test_f1: 0.5378
 epoch: 34, train_loss: 0.8024, test_loss: 0.9168, test_f1: 0.5579
 epoch: 35, train_loss: 0.7807, test_loss: 0.9045, test_f1: 0.5560
 epoch: 36, train_loss: 0.7838, test_loss: 0.9359, test_f1: 0.5361
 epoch: 37, train_loss: 0.7800, test_loss: 0.9448, test_f1: 0.5736
 epoch: 38, train_loss: 0.7720, test_loss: 0.9680, test_f1: 0.5359
 epoch: 39, train_loss: 0.7751, test_loss: 0.9162, test_f1: 0.5617
 epoch: 40, train_loss: 0.7665, test_loss: 0.9409, test_f1: 0.5669
 epoch: 41, train_loss: 0.7650, test_loss: 0.9248, test_f1: 0.5539
 epoch: 42, train_loss: 0.7647, test_loss: 0.9371, test_f1: 0.5727
 epoch: 43, train_loss: 0.7613, test_loss: 0.9317, test_f1: 0.5714
 epoch: 44, train_loss: 0.7662, test_loss: 0.9616, test_f1: 0.5289
 epoch: 45, train_loss: 0.7535, test_loss: 0.9207, test_f1: 0.5650
 epoch: 46, train_loss: 0.7393, test_loss: 0.9774, test_f1: 0.5358
 epoch: 47, train_loss: 0.7471, test_loss: 0.9190, test_f1: 0.5716
 epoch: 48, train_loss: 0.7488, test_loss: 0.9395, test_f1: 0.5885
 epoch: 49, train_loss: 0.7350, test_loss: 0.9340, test_f1: 0.5642
 epoch: 50, train_loss: 0.7311, test_loss: 0.9235, test_f1: 0.5793
 epoch: 51, train_loss: 0.7218, test_loss: 0.9214, test_f1: 0.5965
 epoch: 52, train_loss: 0.7175, test_loss: 0.9268, test_f1: 0.5720
 epoch: 53, train_loss: 0.7264, test_loss: 0.9343, test_f1: 0.5990
 epoch: 54, train_loss: 0.7001, test_loss: 0.9253, test_f1: 0.6153
 epoch: 55, train_loss: 0.7146, test_loss: 0.9262, test_f1: 0.6066
 epoch: 56, train_loss: 0.7046, test_loss: 0.9348, test_f1: 0.5941
 epoch: 57, train_loss: 0.7063, test_loss: 0.9292, test_f1: 0.6117
 epoch: 58, train_loss: 0.7053, test_loss: 0.9470, test_f1: 0.5804
 epoch: 59, train_loss: 0.7043, test_loss: 0.9413, test_f1: 0.6186
 epoch: 60, train_loss: 0.7032, test_loss: 0.9275, test_f1: 0.6160
 epoch: 61, train_loss: 0.7019, test_loss: 0.9619, test_f1: 0.5986
 epoch: 62, train_loss: 0.6985, test_loss: 0.9671, test_f1: 0.5819
 epoch: 63, train_loss: 0.6995, test_loss: 0.9475, test_f1: 0.6037
 epoch: 64, train_loss: 0.7008, test_loss: 0.9531, test_f1: 0.6078
 epoch: 65, train_loss: 0.6955, test_loss: 0.9358, test_f1: 0.6107
 epoch: 66, train_loss: 0.6875, test_loss: 0.9432, test_f1: 0.6239
 epoch: 67, train_loss: 0.6925, test_loss: 0.9219, test_f1: 0.6338
 epoch: 68, train_loss: 0.6916, test_loss: 0.9463, test_f1: 0.6094
 epoch: 69, train_loss: 0.7017, test_loss: 0.9560, test_f1: 0.5970
 epoch: 70, train_loss: 0.6857, test_loss: 0.9271, test_f1: 0.6184
 epoch: 71, train_loss: 0.6874, test_loss: 0.9474, test_f1: 0.6122
 epoch: 72, train_loss: 0.6828, test_loss: 0.9239, test_f1: 0.6208
 epoch: 73, train_loss: 0.6843, test_loss: 0.9503, test_f1: 0.6175
 epoch: 74, train_loss: 0.6825, test_loss: 0.9432, test_f1: 0.6143
 epoch: 75, train_loss: 0.6709, test_loss: 0.9523, test_f1: 0.6054
 epoch: 76, train_loss: 0.6737, test_loss: 0.9321, test_f1: 0.6140
 epoch: 77, train_loss: 0.6763, test_loss: 0.9517, test_f1: 0.5963
 epoch: 78, train_loss: 0.6759, test_loss: 0.9835, test_f1: 0.6042
 epoch: 79, train_loss: 0.6772, test_loss: 0.9569, test_f1: 0.6163
 epoch: 80, train_loss: 0.6680, test_loss: 0.9662, test_f1: 0.6080
 epoch: 81, train_loss: 0.6605, test_loss: 0.9418, test_f1: 0.6262
 epoch: 82, train_loss: 0.6700, test_loss: 0.9737, test_f1: 0.6215
 epoch: 83, train_loss: 0.6616, test_loss: 0.9403, test_f1: 0.6164
 epoch: 84, train_loss: 0.6671, test_loss: 0.9763, test_f1: 0.6033
 epoch: 85, train_loss: 0.6656, test_loss: 0.9551, test_f1: 0.6272
 epoch: 86, train_loss: 0.6613, test_loss: 0.9856, test_f1: 0.6158
 epoch: 87, train_loss: 0.6648, test_loss: 0.9690, test_f1: 0.6381
 epoch: 88, train_loss: 0.6606, test_loss: 0.9980, test_f1: 0.6200
 epoch: 89, train_loss: 0.6427, test_loss: 0.9917, test_f1: 0.6282
 epoch: 90, train_loss: 0.6578, test_loss: 0.9878, test_f1: 0.6300
 epoch: 91, train_loss: 0.6512, test_loss: 0.9562, test_f1: 0.6392
 epoch: 92, train_loss: 0.6439, test_loss: 0.9584, test_f1: 0.6445
 epoch: 93, train_loss: 0.6540, test_loss: 0.9800, test_f1: 0.6323
 epoch: 94, train_loss: 0.6399, test_loss: 0.9838, test_f1: 0.6298
 epoch: 95, train_loss: 0.6369, test_loss: 0.9769, test_f1: 0.6189
 epoch: 96, train_loss: 0.6620, test_loss: 0.9784, test_f1: 0.6404
 epoch: 97, train_loss: 0.6450, test_loss: 0.9755, test_f1: 0.6508
 epoch: 98, train_loss: 0.6281, test_loss: 0.9713, test_f1: 0.6351
 epoch: 99, train_loss: 0.6336, test_loss: 0.9922, test_f1: 0.6346
##################ITERATION #1 ****************************************
 epoch: 0, train_loss: 1.2288, test_loss: 1.1148, test_f1: 0.3711
 epoch: 1, train_loss: 1.1107, test_loss: 1.0378, test_f1: 0.4475
 epoch: 2, train_loss: 1.0523, test_loss: 0.9818, test_f1: 0.4682
 epoch: 3, train_loss: 1.0108, test_loss: 0.9582, test_f1: 0.4764
 epoch: 4, train_loss: 0.9863, test_loss: 0.9461, test_f1: 0.5009
 epoch: 5, train_loss: 0.9635, test_loss: 0.9433, test_f1: 0.4987
 epoch: 6, train_loss: 0.9437, test_loss: 0.9339, test_f1: 0.4932
 epoch: 7, train_loss: 0.9277, test_loss: 0.9162, test_f1: 0.5134
 epoch: 8, train_loss: 0.9161, test_loss: 0.9196, test_f1: 0.5330
 epoch: 9, train_loss: 0.9081, test_loss: 0.9012, test_f1: 0.5095
 epoch: 10, train_loss: 0.8954, test_loss: 0.8946, test_f1: 0.5471
 epoch: 11, train_loss: 0.8861, test_loss: 0.8793, test_f1: 0.5446
 epoch: 12, train_loss: 0.8806, test_loss: 0.8683, test_f1: 0.5553
 epoch: 13, train_loss: 0.8629, test_loss: 0.8749, test_f1: 0.5483
 epoch: 14, train_loss: 0.8662, test_loss: 0.8469, test_f1: 0.5390
 epoch: 15, train_loss: 0.8521, test_loss: 0.8986, test_f1: 0.5361
 epoch: 16, train_loss: 0.8453, test_loss: 0.8985, test_f1: 0.5378
 epoch: 17, train_loss: 0.8414, test_loss: 0.8660, test_f1: 0.5471
 epoch: 18, train_loss: 0.8379, test_loss: 0.9034, test_f1: 0.5415
 epoch: 19, train_loss: 0.8149, test_loss: 0.8857, test_f1: 0.5428
 epoch: 20, train_loss: 0.8120, test_loss: 0.8810, test_f1: 0.5524
 epoch: 21, train_loss: 0.8144, test_loss: 0.8615, test_f1: 0.5777
 epoch: 22, train_loss: 0.8187, test_loss: 0.8989, test_f1: 0.5481
 epoch: 23, train_loss: 0.8043, test_loss: 0.8419, test_f1: 0.5537
 epoch: 24, train_loss: 0.8011, test_loss: 0.8600, test_f1: 0.5754
 epoch: 25, train_loss: 0.7934, test_loss: 0.8588, test_f1: 0.5588
 epoch: 26, train_loss: 0.7851, test_loss: 0.8626, test_f1: 0.5769
 epoch: 27, train_loss: 0.7855, test_loss: 0.8702, test_f1: 0.5865
 epoch: 28, train_loss: 0.7814, test_loss: 0.8723, test_f1: 0.5891
 epoch: 29, train_loss: 0.7797, test_loss: 0.8796, test_f1: 0.5760
 epoch: 30, train_loss: 0.7653, test_loss: 0.8853, test_f1: 0.5896
 epoch: 31, train_loss: 0.7612, test_loss: 0.8761, test_f1: 0.5978
 epoch: 32, train_loss: 0.7688, test_loss: 0.8946, test_f1: 0.6043
 epoch: 33, train_loss: 0.7620, test_loss: 0.8642, test_f1: 0.5961
 epoch: 34, train_loss: 0.7488, test_loss: 0.9034, test_f1: 0.5987
 epoch: 35, train_loss: 0.7433, test_loss: 0.8931, test_f1: 0.5877
 epoch: 36, train_loss: 0.7478, test_loss: 0.8779, test_f1: 0.6120
 epoch: 37, train_loss: 0.7359, test_loss: 0.8793, test_f1: 0.6119
 epoch: 38, train_loss: 0.7296, test_loss: 0.8873, test_f1: 0.6172
 epoch: 39, train_loss: 0.7234, test_loss: 0.8938, test_f1: 0.6041
 epoch: 40, train_loss: 0.7096, test_loss: 0.8911, test_f1: 0.6141
 epoch: 41, train_loss: 0.7127, test_loss: 0.8866, test_f1: 0.6079
 epoch: 42, train_loss: 0.7097, test_loss: 0.8533, test_f1: 0.6155
 epoch: 43, train_loss: 0.7038, test_loss: 0.8698, test_f1: 0.6152
 epoch: 44, train_loss: 0.7085, test_loss: 0.8348, test_f1: 0.6236
 epoch: 45, train_loss: 0.7001, test_loss: 0.8667, test_f1: 0.6237
 epoch: 46, train_loss: 0.6866, test_loss: 0.8794, test_f1: 0.6362
 epoch: 47, train_loss: 0.6965, test_loss: 0.8781, test_f1: 0.6263
 epoch: 48, train_loss: 0.7001, test_loss: 0.8913, test_f1: 0.6165
 epoch: 49, train_loss: 0.6908, test_loss: 0.8862, test_f1: 0.6414
 epoch: 50, train_loss: 0.6660, test_loss: 0.8909, test_f1: 0.6277
 epoch: 51, train_loss: 0.6783, test_loss: 0.8987, test_f1: 0.6447
 epoch: 52, train_loss: 0.6583, test_loss: 0.8833, test_f1: 0.6469
 epoch: 53, train_loss: 0.6582, test_loss: 0.8845, test_f1: 0.6231
 epoch: 54, train_loss: 0.6545, test_loss: 0.9057, test_f1: 0.6601
 epoch: 55, train_loss: 0.6596, test_loss: 0.8889, test_f1: 0.6522
 epoch: 56, train_loss: 0.6671, test_loss: 0.9074, test_f1: 0.6666
 epoch: 57, train_loss: 0.6619, test_loss: 0.8917, test_f1: 0.6471
 epoch: 58, train_loss: 0.6525, test_loss: 0.8713, test_f1: 0.6736
 epoch: 59, train_loss: 0.6479, test_loss: 0.8801, test_f1: 0.6597
 epoch: 60, train_loss: 0.6492, test_loss: 0.8858, test_f1: 0.6508
 epoch: 61, train_loss: 0.6482, test_loss: 0.8952, test_f1: 0.6408
 epoch: 62, train_loss: 0.6387, test_loss: 0.9107, test_f1: 0.6501
 epoch: 63, train_loss: 0.6448, test_loss: 0.8981, test_f1: 0.6517
 epoch: 64, train_loss: 0.6431, test_loss: 0.8981, test_f1: 0.6378
 epoch: 65, train_loss: 0.6351, test_loss: 0.9134, test_f1: 0.6469
 epoch: 66, train_loss: 0.6349, test_loss: 0.9012, test_f1: 0.6577
 epoch: 67, train_loss: 0.6384, test_loss: 0.8820, test_f1: 0.6461
 epoch: 68, train_loss: 0.6268, test_loss: 0.9100, test_f1: 0.6473
 epoch: 69, train_loss: 0.6256, test_loss: 0.8867, test_f1: 0.6600
 epoch: 70, train_loss: 0.6310, test_loss: 0.9096, test_f1: 0.6456
 epoch: 71, train_loss: 0.6161, test_loss: 0.9153, test_f1: 0.6534
 epoch: 72, train_loss: 0.6071, test_loss: 0.9179, test_f1: 0.6608
 epoch: 73, train_loss: 0.6171, test_loss: 0.9218, test_f1: 0.6572
 epoch: 74, train_loss: 0.6161, test_loss: 0.9016, test_f1: 0.6328
 epoch: 75, train_loss: 0.6112, test_loss: 0.9275, test_f1: 0.6661
 epoch: 76, train_loss: 0.6081, test_loss: 0.9164, test_f1: 0.6636
 epoch: 77, train_loss: 0.6121, test_loss: 0.9094, test_f1: 0.6632
 epoch: 78, train_loss: 0.6097, test_loss: 0.9301, test_f1: 0.6727
 epoch: 79, train_loss: 0.6038, test_loss: 0.9062, test_f1: 0.6640
 epoch: 80, train_loss: 0.6098, test_loss: 0.9385, test_f1: 0.6744
 epoch: 81, train_loss: 0.6103, test_loss: 0.9390, test_f1: 0.6527
 epoch: 82, train_loss: 0.6219, test_loss: 0.9370, test_f1: 0.6510
 epoch: 83, train_loss: 0.6077, test_loss: 0.9640, test_f1: 0.6561
 epoch: 84, train_loss: 0.5958, test_loss: 0.9352, test_f1: 0.6538
 epoch: 85, train_loss: 0.5934, test_loss: 0.9312, test_f1: 0.6486
 epoch: 86, train_loss: 0.5994, test_loss: 0.9739, test_f1: 0.6480
 epoch: 87, train_loss: 0.6092, test_loss: 0.9316, test_f1: 0.6722
 epoch: 88, train_loss: 0.5994, test_loss: 0.9307, test_f1: 0.6682
 epoch: 89, train_loss: 0.5980, test_loss: 0.9460, test_f1: 0.6677
 epoch: 90, train_loss: 0.5970, test_loss: 0.9467, test_f1: 0.6572
 epoch: 91, train_loss: 0.5937, test_loss: 0.9587, test_f1: 0.6613
 epoch: 92, train_loss: 0.5928, test_loss: 0.9496, test_f1: 0.6630
 epoch: 93, train_loss: 0.5872, test_loss: 0.9469, test_f1: 0.6803
 epoch: 94, train_loss: 0.5846, test_loss: 0.9689, test_f1: 0.6509
 epoch: 95, train_loss: 0.5797, test_loss: 0.9638, test_f1: 0.6568
 epoch: 96, train_loss: 0.5929, test_loss: 0.9476, test_f1: 0.6710
 epoch: 97, train_loss: 0.5929, test_loss: 0.9375, test_f1: 0.6692
 epoch: 98, train_loss: 0.5688, test_loss: 0.9362, test_f1: 0.6730
 epoch: 99, train_loss: 0.5798, test_loss: 0.9348, test_f1: 0.6499
##################ITERATION #2 ****************************************
 epoch: 0, train_loss: 1.2012, test_loss: 1.0460, test_f1: 0.4748
 epoch: 1, train_loss: 1.0731, test_loss: 1.0001, test_f1: 0.4691
 epoch: 2, train_loss: 1.0317, test_loss: 0.9699, test_f1: 0.4792
 epoch: 3, train_loss: 0.9911, test_loss: 0.9603, test_f1: 0.4765
 epoch: 4, train_loss: 0.9740, test_loss: 0.9306, test_f1: 0.4985
 epoch: 5, train_loss: 0.9599, test_loss: 0.9335, test_f1: 0.5053
 epoch: 6, train_loss: 0.9456, test_loss: 0.9158, test_f1: 0.5155
 epoch: 7, train_loss: 0.9386, test_loss: 0.9056, test_f1: 0.5173
 epoch: 8, train_loss: 0.9187, test_loss: 0.9039, test_f1: 0.5407
 epoch: 9, train_loss: 0.9122, test_loss: 0.9000, test_f1: 0.5425
 epoch: 10, train_loss: 0.8960, test_loss: 0.8797, test_f1: 0.5539
 epoch: 11, train_loss: 0.8984, test_loss: 0.8878, test_f1: 0.5428
 epoch: 12, train_loss: 0.8852, test_loss: 0.8765, test_f1: 0.5299
 epoch: 13, train_loss: 0.8753, test_loss: 0.8773, test_f1: 0.5341
 epoch: 14, train_loss: 0.8711, test_loss: 0.8450, test_f1: 0.5369
 epoch: 15, train_loss: 0.8602, test_loss: 0.8844, test_f1: 0.5614
 epoch: 16, train_loss: 0.8505, test_loss: 0.8861, test_f1: 0.5765
 epoch: 17, train_loss: 0.8383, test_loss: 0.8515, test_f1: 0.5778
 epoch: 18, train_loss: 0.8316, test_loss: 0.8662, test_f1: 0.5586
 epoch: 19, train_loss: 0.8331, test_loss: 0.9012, test_f1: 0.5481
 epoch: 20, train_loss: 0.8122, test_loss: 0.8633, test_f1: 0.5654
 epoch: 21, train_loss: 0.8102, test_loss: 0.8870, test_f1: 0.5616
 epoch: 22, train_loss: 0.8062, test_loss: 0.8983, test_f1: 0.5531
 epoch: 23, train_loss: 0.8031, test_loss: 0.8702, test_f1: 0.5554
 epoch: 24, train_loss: 0.8030, test_loss: 0.9029, test_f1: 0.5651
 epoch: 25, train_loss: 0.7968, test_loss: 0.8924, test_f1: 0.5827
 epoch: 26, train_loss: 0.8060, test_loss: 0.8887, test_f1: 0.5692
 epoch: 27, train_loss: 0.7868, test_loss: 0.8736, test_f1: 0.6014
 epoch: 28, train_loss: 0.7878, test_loss: 0.8740, test_f1: 0.5704
 epoch: 29, train_loss: 0.7768, test_loss: 0.8637, test_f1: 0.5760
 epoch: 30, train_loss: 0.7727, test_loss: 0.9096, test_f1: 0.5835
 epoch: 31, train_loss: 0.7677, test_loss: 0.9558, test_f1: 0.5480
 epoch: 32, train_loss: 0.7669, test_loss: 0.9123, test_f1: 0.5901
 epoch: 33, train_loss: 0.7463, test_loss: 0.8849, test_f1: 0.5742
 epoch: 34, train_loss: 0.7539, test_loss: 0.8886, test_f1: 0.5970
 epoch: 35, train_loss: 0.7406, test_loss: 0.9083, test_f1: 0.6246
 epoch: 36, train_loss: 0.7400, test_loss: 0.9089, test_f1: 0.6275
 epoch: 37, train_loss: 0.7393, test_loss: 0.8813, test_f1: 0.6074
 epoch: 38, train_loss: 0.7440, test_loss: 0.9034, test_f1: 0.5950
 epoch: 39, train_loss: 0.7361, test_loss: 0.8940, test_f1: 0.6244
 epoch: 40, train_loss: 0.7279, test_loss: 0.8843, test_f1: 0.6125
 epoch: 41, train_loss: 0.7218, test_loss: 0.9038, test_f1: 0.6009
 epoch: 42, train_loss: 0.7108, test_loss: 0.9125, test_f1: 0.5918
 epoch: 43, train_loss: 0.7183, test_loss: 0.9000, test_f1: 0.6202
 epoch: 44, train_loss: 0.7136, test_loss: 0.8907, test_f1: 0.6093
 epoch: 45, train_loss: 0.7166, test_loss: 0.9430, test_f1: 0.6052
 epoch: 46, train_loss: 0.7026, test_loss: 0.9452, test_f1: 0.6131
 epoch: 47, train_loss: 0.6974, test_loss: 0.8853, test_f1: 0.6211
 epoch: 48, train_loss: 0.6935, test_loss: 0.9043, test_f1: 0.6429
 epoch: 49, train_loss: 0.6900, test_loss: 0.9459, test_f1: 0.6335
 epoch: 50, train_loss: 0.6904, test_loss: 0.9379, test_f1: 0.6158
 epoch: 51, train_loss: 0.6756, test_loss: 0.8618, test_f1: 0.6396
 epoch: 52, train_loss: 0.6743, test_loss: 0.9113, test_f1: 0.6328
 epoch: 53, train_loss: 0.6649, test_loss: 0.9461, test_f1: 0.6184
 epoch: 54, train_loss: 0.6619, test_loss: 0.8936, test_f1: 0.6494
 epoch: 55, train_loss: 0.6560, test_loss: 0.9124, test_f1: 0.6278
 epoch: 56, train_loss: 0.6623, test_loss: 0.9186, test_f1: 0.6525
 epoch: 57, train_loss: 0.6570, test_loss: 0.9490, test_f1: 0.6343
 epoch: 58, train_loss: 0.6536, test_loss: 0.9289, test_f1: 0.6451
 epoch: 59, train_loss: 0.6584, test_loss: 0.9145, test_f1: 0.6470
 epoch: 60, train_loss: 0.6441, test_loss: 0.9504, test_f1: 0.6493
 epoch: 61, train_loss: 0.6506, test_loss: 0.9054, test_f1: 0.6165
 epoch: 62, train_loss: 0.6486, test_loss: 0.9413, test_f1: 0.6468
 epoch: 63, train_loss: 0.6530, test_loss: 0.9508, test_f1: 0.6288
 epoch: 64, train_loss: 0.6459, test_loss: 0.9101, test_f1: 0.6389
 epoch: 65, train_loss: 0.6395, test_loss: 0.9281, test_f1: 0.6469
 epoch: 66, train_loss: 0.6381, test_loss: 0.9449, test_f1: 0.6344
 epoch: 67, train_loss: 0.6455, test_loss: 0.9134, test_f1: 0.6344
 epoch: 68, train_loss: 0.6324, test_loss: 0.9063, test_f1: 0.6454
 epoch: 69, train_loss: 0.6403, test_loss: 0.9373, test_f1: 0.6557
 epoch: 70, train_loss: 0.6268, test_loss: 0.9319, test_f1: 0.6491
 epoch: 71, train_loss: 0.6286, test_loss: 0.9303, test_f1: 0.6474
 epoch: 72, train_loss: 0.6372, test_loss: 0.9230, test_f1: 0.6448
 epoch: 73, train_loss: 0.6253, test_loss: 0.9180, test_f1: 0.6566
 epoch: 74, train_loss: 0.6346, test_loss: 0.9174, test_f1: 0.6671
 epoch: 75, train_loss: 0.6390, test_loss: 0.9198, test_f1: 0.6526
 epoch: 76, train_loss: 0.6241, test_loss: 0.9190, test_f1: 0.6694
 epoch: 77, train_loss: 0.6317, test_loss: 0.9434, test_f1: 0.6351
 epoch: 78, train_loss: 0.6231, test_loss: 0.9480, test_f1: 0.6535
 epoch: 79, train_loss: 0.6218, test_loss: 0.9508, test_f1: 0.6644
 epoch: 80, train_loss: 0.6142, test_loss: 0.9476, test_f1: 0.6657
 epoch: 81, train_loss: 0.6202, test_loss: 0.9279, test_f1: 0.6419
 epoch: 82, train_loss: 0.6190, test_loss: 0.9826, test_f1: 0.6305
 epoch: 83, train_loss: 0.6284, test_loss: 0.9510, test_f1: 0.6590
 epoch: 84, train_loss: 0.5991, test_loss: 0.9364, test_f1: 0.6635
 epoch: 85, train_loss: 0.6147, test_loss: 0.9424, test_f1: 0.6578
 epoch: 86, train_loss: 0.6003, test_loss: 0.9364, test_f1: 0.6526
 epoch: 87, train_loss: 0.6102, test_loss: 0.9282, test_f1: 0.6794
 epoch: 88, train_loss: 0.6065, test_loss: 0.9587, test_f1: 0.6732
 epoch: 89, train_loss: 0.6038, test_loss: 0.9374, test_f1: 0.6579
 epoch: 90, train_loss: 0.6032, test_loss: 0.9484, test_f1: 0.6448
 epoch: 91, train_loss: 0.5981, test_loss: 0.9577, test_f1: 0.6518
 epoch: 92, train_loss: 0.5943, test_loss: 0.9835, test_f1: 0.6759
 epoch: 93, train_loss: 0.6071, test_loss: 0.9695, test_f1: 0.6599
 epoch: 94, train_loss: 0.5919, test_loss: 0.9382, test_f1: 0.6476
 epoch: 95, train_loss: 0.5888, test_loss: 0.9610, test_f1: 0.6632
 epoch: 96, train_loss: 0.6003, test_loss: 0.9898, test_f1: 0.6563
 epoch: 97, train_loss: 0.5993, test_loss: 0.9662, test_f1: 0.6468
 epoch: 98, train_loss: 0.5766, test_loss: 0.9787, test_f1: 0.6455
 epoch: 99, train_loss: 0.5765, test_loss: 0.9741, test_f1: 0.6670
##################ITERATION #3 ****************************************
 epoch: 0, train_loss: 1.1884, test_loss: 1.0267, test_f1: 0.5155
 epoch: 1, train_loss: 1.0673, test_loss: 0.9899, test_f1: 0.4781
 epoch: 2, train_loss: 1.0344, test_loss: 0.9720, test_f1: 0.5023
 epoch: 3, train_loss: 0.9946, test_loss: 0.9577, test_f1: 0.5267
 epoch: 4, train_loss: 0.9809, test_loss: 0.9511, test_f1: 0.5031
 epoch: 5, train_loss: 0.9614, test_loss: 0.9404, test_f1: 0.5162
 epoch: 6, train_loss: 0.9465, test_loss: 0.9390, test_f1: 0.5184
 epoch: 7, train_loss: 0.9305, test_loss: 0.9372, test_f1: 0.5192
 epoch: 8, train_loss: 0.9270, test_loss: 0.9260, test_f1: 0.5221
 epoch: 9, train_loss: 0.9108, test_loss: 0.9158, test_f1: 0.5192
 epoch: 10, train_loss: 0.8903, test_loss: 0.9184, test_f1: 0.5434
 epoch: 11, train_loss: 0.8926, test_loss: 0.9201, test_f1: 0.5420
 epoch: 12, train_loss: 0.8922, test_loss: 0.9106, test_f1: 0.5441
 epoch: 13, train_loss: 0.8705, test_loss: 0.9133, test_f1: 0.5532
 epoch: 14, train_loss: 0.8582, test_loss: 0.9100, test_f1: 0.5420
 epoch: 15, train_loss: 0.8556, test_loss: 0.9061, test_f1: 0.5809
 epoch: 16, train_loss: 0.8574, test_loss: 0.9033, test_f1: 0.5840
 epoch: 17, train_loss: 0.8374, test_loss: 0.8946, test_f1: 0.5698
 epoch: 18, train_loss: 0.8317, test_loss: 0.9186, test_f1: 0.5423
 epoch: 19, train_loss: 0.8353, test_loss: 0.8903, test_f1: 0.5766
 epoch: 20, train_loss: 0.8299, test_loss: 0.9142, test_f1: 0.5972
 epoch: 21, train_loss: 0.8191, test_loss: 0.9031, test_f1: 0.5913
 epoch: 22, train_loss: 0.8181, test_loss: 0.9174, test_f1: 0.5873
 epoch: 23, train_loss: 0.8065, test_loss: 0.9057, test_f1: 0.5701
 epoch: 24, train_loss: 0.8010, test_loss: 0.8991, test_f1: 0.6142
 epoch: 25, train_loss: 0.7987, test_loss: 0.8795, test_f1: 0.6138
 epoch: 26, train_loss: 0.7973, test_loss: 0.9242, test_f1: 0.5766
 epoch: 27, train_loss: 0.7900, test_loss: 0.9060, test_f1: 0.5983
 epoch: 28, train_loss: 0.7890, test_loss: 0.8920, test_f1: 0.6153
 epoch: 29, train_loss: 0.7805, test_loss: 0.9005, test_f1: 0.6211
 epoch: 30, train_loss: 0.7848, test_loss: 0.9142, test_f1: 0.6418
 epoch: 31, train_loss: 0.7706, test_loss: 0.8816, test_f1: 0.6030
 epoch: 32, train_loss: 0.7662, test_loss: 0.9108, test_f1: 0.6314
 epoch: 33, train_loss: 0.7618, test_loss: 0.9017, test_f1: 0.6091
 epoch: 34, train_loss: 0.7541, test_loss: 0.9122, test_f1: 0.5966
 epoch: 35, train_loss: 0.7607, test_loss: 0.9116, test_f1: 0.6240
 epoch: 36, train_loss: 0.7611, test_loss: 0.9215, test_f1: 0.6137
 epoch: 37, train_loss: 0.7480, test_loss: 0.9173, test_f1: 0.6405
 epoch: 38, train_loss: 0.7333, test_loss: 0.9230, test_f1: 0.6393
 epoch: 39, train_loss: 0.7347, test_loss: 0.9221, test_f1: 0.6116
 epoch: 40, train_loss: 0.7335, test_loss: 0.9097, test_f1: 0.6268
 epoch: 41, train_loss: 0.7339, test_loss: 0.9466, test_f1: 0.6172
 epoch: 42, train_loss: 0.7373, test_loss: 0.9158, test_f1: 0.6317
 epoch: 43, train_loss: 0.7320, test_loss: 0.9255, test_f1: 0.6307
 epoch: 44, train_loss: 0.7187, test_loss: 0.8862, test_f1: 0.6603
 epoch: 45, train_loss: 0.7124, test_loss: 0.9156, test_f1: 0.6495
 epoch: 46, train_loss: 0.7068, test_loss: 0.9210, test_f1: 0.6326
 epoch: 47, train_loss: 0.7177, test_loss: 0.9323, test_f1: 0.6416
 epoch: 48, train_loss: 0.7065, test_loss: 0.9303, test_f1: 0.6405
 epoch: 49, train_loss: 0.7103, test_loss: 0.9245, test_f1: 0.6487
 epoch: 50, train_loss: 0.6901, test_loss: 0.9093, test_f1: 0.6109
 epoch: 51, train_loss: 0.6879, test_loss: 0.9069, test_f1: 0.6397
 epoch: 52, train_loss: 0.6829, test_loss: 0.9255, test_f1: 0.6490
 epoch: 53, train_loss: 0.6865, test_loss: 0.9282, test_f1: 0.6505
 epoch: 54, train_loss: 0.6837, test_loss: 0.9366, test_f1: 0.6427
 epoch: 55, train_loss: 0.6778, test_loss: 0.9365, test_f1: 0.6313
 epoch: 56, train_loss: 0.6700, test_loss: 0.9297, test_f1: 0.6299
 epoch: 57, train_loss: 0.6773, test_loss: 0.9388, test_f1: 0.6517
 epoch: 58, train_loss: 0.6682, test_loss: 0.9141, test_f1: 0.6574
 epoch: 59, train_loss: 0.6734, test_loss: 0.9384, test_f1: 0.6328
 epoch: 60, train_loss: 0.6746, test_loss: 0.9296, test_f1: 0.6441
 epoch: 61, train_loss: 0.6695, test_loss: 0.9220, test_f1: 0.6488
 epoch: 62, train_loss: 0.6650, test_loss: 0.9186, test_f1: 0.6518
 epoch: 63, train_loss: 0.6676, test_loss: 0.9179, test_f1: 0.6465
 epoch: 64, train_loss: 0.6621, test_loss: 0.9201, test_f1: 0.6554
 epoch: 65, train_loss: 0.6654, test_loss: 0.9122, test_f1: 0.6571
 epoch: 66, train_loss: 0.6644, test_loss: 0.9326, test_f1: 0.6503
 epoch: 67, train_loss: 0.6567, test_loss: 0.9241, test_f1: 0.6599
 epoch: 68, train_loss: 0.6544, test_loss: 0.9367, test_f1: 0.6584
 epoch: 69, train_loss: 0.6409, test_loss: 0.9305, test_f1: 0.6523
 epoch: 70, train_loss: 0.6553, test_loss: 0.9191, test_f1: 0.6656
 epoch: 71, train_loss: 0.6441, test_loss: 0.9235, test_f1: 0.6494
 epoch: 72, train_loss: 0.6482, test_loss: 0.9389, test_f1: 0.6675
 epoch: 73, train_loss: 0.6424, test_loss: 0.9445, test_f1: 0.6805
 epoch: 74, train_loss: 0.6486, test_loss: 0.9492, test_f1: 0.6606
 epoch: 75, train_loss: 0.6410, test_loss: 0.9379, test_f1: 0.6716
 epoch: 76, train_loss: 0.6468, test_loss: 0.9513, test_f1: 0.6854
 epoch: 77, train_loss: 0.6282, test_loss: 0.9503, test_f1: 0.6656
 epoch: 78, train_loss: 0.6315, test_loss: 0.9307, test_f1: 0.6851
 epoch: 79, train_loss: 0.6419, test_loss: 0.9404, test_f1: 0.6713
 epoch: 80, train_loss: 0.6337, test_loss: 0.9488, test_f1: 0.6628
 epoch: 81, train_loss: 0.6389, test_loss: 0.9379, test_f1: 0.6613
 epoch: 82, train_loss: 0.6243, test_loss: 0.9464, test_f1: 0.6471
 epoch: 83, train_loss: 0.6314, test_loss: 0.9361, test_f1: 0.6627
 epoch: 84, train_loss: 0.6299, test_loss: 0.9550, test_f1: 0.6516
 epoch: 85, train_loss: 0.6269, test_loss: 0.9635, test_f1: 0.6555
 epoch: 86, train_loss: 0.6252, test_loss: 0.9559, test_f1: 0.6736
 epoch: 87, train_loss: 0.6191, test_loss: 0.9512, test_f1: 0.6669
 epoch: 88, train_loss: 0.6185, test_loss: 0.9533, test_f1: 0.6722
 epoch: 89, train_loss: 0.6297, test_loss: 0.9536, test_f1: 0.6752
 epoch: 90, train_loss: 0.6117, test_loss: 0.9528, test_f1: 0.6614
 epoch: 91, train_loss: 0.6104, test_loss: 0.9351, test_f1: 0.6796
 epoch: 92, train_loss: 0.6140, test_loss: 0.9598, test_f1: 0.6723
 epoch: 93, train_loss: 0.6166, test_loss: 0.9459, test_f1: 0.6643
 epoch: 94, train_loss: 0.6058, test_loss: 0.9430, test_f1: 0.6691
 epoch: 95, train_loss: 0.6032, test_loss: 0.9767, test_f1: 0.6850
 epoch: 96, train_loss: 0.6163, test_loss: 0.9791, test_f1: 0.6657
 epoch: 97, train_loss: 0.6057, test_loss: 0.9446, test_f1: 0.6741
 epoch: 98, train_loss: 0.6069, test_loss: 0.9732, test_f1: 0.6517
 epoch: 99, train_loss: 0.6007, test_loss: 0.9809, test_f1: 0.6876
##################ITERATION #4 ****************************************
 epoch: 0, train_loss: 1.2043, test_loss: 1.0295, test_f1: 0.4504
 epoch: 1, train_loss: 1.0590, test_loss: 0.9746, test_f1: 0.4844
 epoch: 2, train_loss: 1.0176, test_loss: 0.9493, test_f1: 0.4884
 epoch: 3, train_loss: 0.9992, test_loss: 0.9487, test_f1: 0.4800
 epoch: 4, train_loss: 0.9720, test_loss: 0.9358, test_f1: 0.5296
 epoch: 5, train_loss: 0.9585, test_loss: 0.9309, test_f1: 0.5175
 epoch: 6, train_loss: 0.9515, test_loss: 0.9102, test_f1: 0.5213
 epoch: 7, train_loss: 0.9302, test_loss: 0.9185, test_f1: 0.5342
 epoch: 8, train_loss: 0.9141, test_loss: 0.9174, test_f1: 0.5242
 epoch: 9, train_loss: 0.9110, test_loss: 0.8979, test_f1: 0.5399
 epoch: 10, train_loss: 0.9017, test_loss: 0.8969, test_f1: 0.5562
 epoch: 11, train_loss: 0.8875, test_loss: 0.8940, test_f1: 0.5201
 epoch: 12, train_loss: 0.8868, test_loss: 0.8780, test_f1: 0.5459
 epoch: 13, train_loss: 0.8730, test_loss: 0.8957, test_f1: 0.5218
 epoch: 14, train_loss: 0.8694, test_loss: 0.8868, test_f1: 0.5287
 epoch: 15, train_loss: 0.8680, test_loss: 0.8778, test_f1: 0.5717
 epoch: 16, train_loss: 0.8710, test_loss: 0.8814, test_f1: 0.5374
 epoch: 17, train_loss: 0.8416, test_loss: 0.8552, test_f1: 0.5485
 epoch: 18, train_loss: 0.8523, test_loss: 0.8616, test_f1: 0.5760
 epoch: 19, train_loss: 0.8396, test_loss: 0.8959, test_f1: 0.5378
 epoch: 20, train_loss: 0.8421, test_loss: 0.8846, test_f1: 0.5850
 epoch: 21, train_loss: 0.8285, test_loss: 0.8997, test_f1: 0.5546
 epoch: 22, train_loss: 0.8216, test_loss: 0.8921, test_f1: 0.5276
 epoch: 23, train_loss: 0.8162, test_loss: 0.9062, test_f1: 0.5503
 epoch: 24, train_loss: 0.8007, test_loss: 0.8831, test_f1: 0.5652
 epoch: 25, train_loss: 0.8011, test_loss: 0.8504, test_f1: 0.5664
 epoch: 26, train_loss: 0.8014, test_loss: 0.8193, test_f1: 0.5899
 epoch: 27, train_loss: 0.7926, test_loss: 0.8496, test_f1: 0.5986
 epoch: 28, train_loss: 0.7889, test_loss: 0.8656, test_f1: 0.5785
 epoch: 29, train_loss: 0.7810, test_loss: 0.8314, test_f1: 0.5622
 epoch: 30, train_loss: 0.7760, test_loss: 0.9059, test_f1: 0.5607
 epoch: 31, train_loss: 0.7867, test_loss: 0.9023, test_f1: 0.5695
 epoch: 32, train_loss: 0.7769, test_loss: 0.8505, test_f1: 0.5756
 epoch: 33, train_loss: 0.7650, test_loss: 0.8584, test_f1: 0.5821
 epoch: 34, train_loss: 0.7574, test_loss: 0.9106, test_f1: 0.5946
 epoch: 35, train_loss: 0.7546, test_loss: 0.8680, test_f1: 0.6040
 epoch: 36, train_loss: 0.7603, test_loss: 0.8675, test_f1: 0.5903
 epoch: 37, train_loss: 0.7485, test_loss: 0.8612, test_f1: 0.5972
 epoch: 38, train_loss: 0.7391, test_loss: 0.8643, test_f1: 0.5883
 epoch: 39, train_loss: 0.7491, test_loss: 0.8918, test_f1: 0.5800
 epoch: 40, train_loss: 0.7526, test_loss: 0.8857, test_f1: 0.6044
 epoch: 41, train_loss: 0.7415, test_loss: 0.8740, test_f1: 0.6194
 epoch: 42, train_loss: 0.7356, test_loss: 0.9024, test_f1: 0.5905
 epoch: 43, train_loss: 0.7264, test_loss: 0.9041, test_f1: 0.5970
 epoch: 44, train_loss: 0.7305, test_loss: 0.8956, test_f1: 0.6306
 epoch: 45, train_loss: 0.7240, test_loss: 0.9007, test_f1: 0.6140
 epoch: 46, train_loss: 0.7173, test_loss: 0.8484, test_f1: 0.6211
 epoch: 47, train_loss: 0.7154, test_loss: 0.8949, test_f1: 0.6190
 epoch: 48, train_loss: 0.7108, test_loss: 0.8630, test_f1: 0.6429
 epoch: 49, train_loss: 0.7121, test_loss: 0.8593, test_f1: 0.6628
 epoch: 50, train_loss: 0.7018, test_loss: 0.8753, test_f1: 0.5914
 epoch: 51, train_loss: 0.6852, test_loss: 0.8689, test_f1: 0.6360
 epoch: 52, train_loss: 0.6865, test_loss: 0.9153, test_f1: 0.6423
 epoch: 53, train_loss: 0.6785, test_loss: 0.8616, test_f1: 0.6324
 epoch: 54, train_loss: 0.6880, test_loss: 0.8870, test_f1: 0.6374
 epoch: 55, train_loss: 0.6830, test_loss: 0.9477, test_f1: 0.6432
 epoch: 56, train_loss: 0.6840, test_loss: 0.8905, test_f1: 0.6233
 epoch: 57, train_loss: 0.6769, test_loss: 0.9319, test_f1: 0.6214
 epoch: 58, train_loss: 0.6749, test_loss: 0.8769, test_f1: 0.6384
 epoch: 59, train_loss: 0.6619, test_loss: 0.9188, test_f1: 0.6298
 epoch: 60, train_loss: 0.6610, test_loss: 0.9292, test_f1: 0.6037
 epoch: 61, train_loss: 0.6749, test_loss: 0.9276, test_f1: 0.6188
 epoch: 62, train_loss: 0.6625, test_loss: 0.8971, test_f1: 0.6401
 epoch: 63, train_loss: 0.6626, test_loss: 0.9156, test_f1: 0.6536
 epoch: 64, train_loss: 0.6570, test_loss: 0.8947, test_f1: 0.6372
 epoch: 65, train_loss: 0.6581, test_loss: 0.8998, test_f1: 0.6248
 epoch: 66, train_loss: 0.6533, test_loss: 0.9273, test_f1: 0.6430
 epoch: 67, train_loss: 0.6530, test_loss: 0.9400, test_f1: 0.6277
 epoch: 68, train_loss: 0.6505, test_loss: 0.9258, test_f1: 0.6403
 epoch: 69, train_loss: 0.6472, test_loss: 0.9296, test_f1: 0.6523
 epoch: 70, train_loss: 0.6496, test_loss: 0.9483, test_f1: 0.6391
 epoch: 71, train_loss: 0.6456, test_loss: 0.9391, test_f1: 0.6537
 epoch: 72, train_loss: 0.6420, test_loss: 0.9002, test_f1: 0.6302
 epoch: 73, train_loss: 0.6325, test_loss: 0.9916, test_f1: 0.6165
 epoch: 74, train_loss: 0.6319, test_loss: 0.9502, test_f1: 0.6407
 epoch: 75, train_loss: 0.6227, test_loss: 0.9813, test_f1: 0.6356
 epoch: 76, train_loss: 0.6432, test_loss: 0.9373, test_f1: 0.6322
 epoch: 77, train_loss: 0.6327, test_loss: 0.9407, test_f1: 0.6458
 epoch: 78, train_loss: 0.6199, test_loss: 0.9627, test_f1: 0.6292
 epoch: 79, train_loss: 0.6195, test_loss: 0.9614, test_f1: 0.6318
 epoch: 80, train_loss: 0.6131, test_loss: 0.9527, test_f1: 0.6423
 epoch: 81, train_loss: 0.6186, test_loss: 0.9378, test_f1: 0.6350
 epoch: 82, train_loss: 0.6167, test_loss: 0.9476, test_f1: 0.6356
 epoch: 83, train_loss: 0.6196, test_loss: 0.9298, test_f1: 0.6486
 epoch: 84, train_loss: 0.6278, test_loss: 0.9954, test_f1: 0.6319
 epoch: 85, train_loss: 0.6110, test_loss: 0.9852, test_f1: 0.6468
 epoch: 86, train_loss: 0.6174, test_loss: 0.9735, test_f1: 0.6292
 epoch: 87, train_loss: 0.5973, test_loss: 0.9705, test_f1: 0.6429
 epoch: 88, train_loss: 0.6018, test_loss: 0.9735, test_f1: 0.6373
 epoch: 89, train_loss: 0.6068, test_loss: 0.9988, test_f1: 0.6260
 epoch: 90, train_loss: 0.6102, test_loss: 0.9670, test_f1: 0.6230
 epoch: 91, train_loss: 0.5999, test_loss: 0.9825, test_f1: 0.6124
 epoch: 92, train_loss: 0.6138, test_loss: 0.9992, test_f1: 0.6304
 epoch: 93, train_loss: 0.6137, test_loss: 0.9756, test_f1: 0.6429
 epoch: 94, train_loss: 0.6127, test_loss: 0.9410, test_f1: 0.6272
 epoch: 95, train_loss: 0.5929, test_loss: 0.9372, test_f1: 0.6220
 epoch: 96, train_loss: 0.5874, test_loss: 0.9940, test_f1: 0.6280
 epoch: 97, train_loss: 0.6009, test_loss: 1.0007, test_f1: 0.6383
 epoch: 98, train_loss: 0.5985, test_loss: 0.9759, test_f1: 0.6518
 epoch: 99, train_loss: 0.5927, test_loss: 0.9880, test_f1: 0.6289
##################ITERATION #5 ****************************************
 epoch: 0, train_loss: 1.2162, test_loss: 1.0061, test_f1: 0.4807
 epoch: 1, train_loss: 1.0712, test_loss: 0.9812, test_f1: 0.4934
 epoch: 2, train_loss: 1.0357, test_loss: 0.9578, test_f1: 0.5307
 epoch: 3, train_loss: 1.0069, test_loss: 0.9486, test_f1: 0.5082
 epoch: 4, train_loss: 0.9792, test_loss: 0.9371, test_f1: 0.4984
 epoch: 5, train_loss: 0.9726, test_loss: 0.9111, test_f1: 0.5133
 epoch: 6, train_loss: 0.9558, test_loss: 0.9184, test_f1: 0.5270
 epoch: 7, train_loss: 0.9492, test_loss: 0.9068, test_f1: 0.5463
 epoch: 8, train_loss: 0.9342, test_loss: 0.9196, test_f1: 0.5430
 epoch: 9, train_loss: 0.9234, test_loss: 0.8953, test_f1: 0.5316
 epoch: 10, train_loss: 0.9150, test_loss: 0.9019, test_f1: 0.5376
 epoch: 11, train_loss: 0.9029, test_loss: 0.9091, test_f1: 0.5304
 epoch: 12, train_loss: 0.9019, test_loss: 0.9029, test_f1: 0.5205
 epoch: 13, train_loss: 0.8958, test_loss: 0.8849, test_f1: 0.5365
 epoch: 14, train_loss: 0.8799, test_loss: 0.8730, test_f1: 0.5294
 epoch: 15, train_loss: 0.8822, test_loss: 0.8698, test_f1: 0.5625
 epoch: 16, train_loss: 0.8706, test_loss: 0.8798, test_f1: 0.5378
 epoch: 17, train_loss: 0.8572, test_loss: 0.8712, test_f1: 0.5361
 epoch: 18, train_loss: 0.8496, test_loss: 0.9000, test_f1: 0.5577
 epoch: 19, train_loss: 0.8417, test_loss: 0.8761, test_f1: 0.5711
 epoch: 20, train_loss: 0.8489, test_loss: 0.8867, test_f1: 0.5460
 epoch: 21, train_loss: 0.8383, test_loss: 0.8532, test_f1: 0.5777
 epoch: 22, train_loss: 0.8348, test_loss: 0.8912, test_f1: 0.5619
 epoch: 23, train_loss: 0.8252, test_loss: 0.8695, test_f1: 0.5664
 epoch: 24, train_loss: 0.8285, test_loss: 0.8770, test_f1: 0.5785
 epoch: 25, train_loss: 0.8125, test_loss: 0.8697, test_f1: 0.5723
 epoch: 26, train_loss: 0.8008, test_loss: 0.8952, test_f1: 0.5726
 epoch: 27, train_loss: 0.8064, test_loss: 0.9383, test_f1: 0.5392
 epoch: 28, train_loss: 0.8036, test_loss: 0.8930, test_f1: 0.5873
 epoch: 29, train_loss: 0.8008, test_loss: 0.8537, test_f1: 0.5844
 epoch: 30, train_loss: 0.7929, test_loss: 0.8834, test_f1: 0.5528
 epoch: 31, train_loss: 0.7813, test_loss: 0.8633, test_f1: 0.6114
 epoch: 32, train_loss: 0.7971, test_loss: 0.8777, test_f1: 0.6026
 epoch: 33, train_loss: 0.7743, test_loss: 0.8656, test_f1: 0.5820
 epoch: 34, train_loss: 0.7749, test_loss: 0.9035, test_f1: 0.5828
 epoch: 35, train_loss: 0.7832, test_loss: 0.8597, test_f1: 0.6108
 epoch: 36, train_loss: 0.7671, test_loss: 0.9093, test_f1: 0.5958
 epoch: 37, train_loss: 0.7577, test_loss: 0.8901, test_f1: 0.6113
 epoch: 38, train_loss: 0.7681, test_loss: 0.8774, test_f1: 0.5967
 epoch: 39, train_loss: 0.7519, test_loss: 0.8549, test_f1: 0.6147
 epoch: 40, train_loss: 0.7455, test_loss: 0.8566, test_f1: 0.6008
 epoch: 41, train_loss: 0.7545, test_loss: 0.8794, test_f1: 0.6303
 epoch: 42, train_loss: 0.7538, test_loss: 0.9039, test_f1: 0.5974
 epoch: 43, train_loss: 0.7329, test_loss: 0.8840, test_f1: 0.6344
 epoch: 44, train_loss: 0.7346, test_loss: 0.8950, test_f1: 0.6340
 epoch: 45, train_loss: 0.7410, test_loss: 0.8534, test_f1: 0.6383
 epoch: 46, train_loss: 0.7234, test_loss: 0.9099, test_f1: 0.6319
 epoch: 47, train_loss: 0.7305, test_loss: 0.8773, test_f1: 0.6125
 epoch: 48, train_loss: 0.7172, test_loss: 0.8984, test_f1: 0.6238
 epoch: 49, train_loss: 0.7303, test_loss: 0.9060, test_f1: 0.6065
 epoch: 50, train_loss: 0.7105, test_loss: 0.8689, test_f1: 0.6428
 epoch: 51, train_loss: 0.7078, test_loss: 0.8637, test_f1: 0.6393
 epoch: 52, train_loss: 0.7051, test_loss: 0.8823, test_f1: 0.6346
 epoch: 53, train_loss: 0.6967, test_loss: 0.8890, test_f1: 0.6289
 epoch: 54, train_loss: 0.6957, test_loss: 0.8889, test_f1: 0.6140
 epoch: 55, train_loss: 0.6952, test_loss: 0.8902, test_f1: 0.6236
 epoch: 56, train_loss: 0.6995, test_loss: 0.9030, test_f1: 0.6449
 epoch: 57, train_loss: 0.6905, test_loss: 0.8878, test_f1: 0.6380
 epoch: 58, train_loss: 0.6855, test_loss: 0.9013, test_f1: 0.6279
 epoch: 59, train_loss: 0.6709, test_loss: 0.8930, test_f1: 0.6404
 epoch: 60, train_loss: 0.6686, test_loss: 0.9302, test_f1: 0.6436
 epoch: 61, train_loss: 0.6800, test_loss: 0.9046, test_f1: 0.6444
 epoch: 62, train_loss: 0.6703, test_loss: 0.8934, test_f1: 0.6364
 epoch: 63, train_loss: 0.6715, test_loss: 0.8956, test_f1: 0.6505
 epoch: 64, train_loss: 0.6628, test_loss: 0.9107, test_f1: 0.6488
 epoch: 65, train_loss: 0.6578, test_loss: 0.9187, test_f1: 0.6270
 epoch: 66, train_loss: 0.6705, test_loss: 0.8889, test_f1: 0.6583
 epoch: 67, train_loss: 0.6685, test_loss: 0.8995, test_f1: 0.6462
 epoch: 68, train_loss: 0.6559, test_loss: 0.9346, test_f1: 0.6363
 epoch: 69, train_loss: 0.6699, test_loss: 0.9370, test_f1: 0.6218
 epoch: 70, train_loss: 0.6542, test_loss: 0.9279, test_f1: 0.6574
 epoch: 71, train_loss: 0.6621, test_loss: 0.9422, test_f1: 0.6373
 epoch: 72, train_loss: 0.6574, test_loss: 0.9456, test_f1: 0.6356
 epoch: 73, train_loss: 0.6554, test_loss: 0.9063, test_f1: 0.6312
 epoch: 74, train_loss: 0.6589, test_loss: 0.9267, test_f1: 0.6616
 epoch: 75, train_loss: 0.6571, test_loss: 0.9300, test_f1: 0.6477
 epoch: 76, train_loss: 0.6416, test_loss: 0.9400, test_f1: 0.6594
 epoch: 77, train_loss: 0.6465, test_loss: 0.9586, test_f1: 0.6300
 epoch: 78, train_loss: 0.6540, test_loss: 0.9268, test_f1: 0.6370
 epoch: 79, train_loss: 0.6398, test_loss: 0.9380, test_f1: 0.6383
 epoch: 80, train_loss: 0.6357, test_loss: 0.9370, test_f1: 0.6519
 epoch: 81, train_loss: 0.6403, test_loss: 0.9291, test_f1: 0.6345
 epoch: 82, train_loss: 0.6468, test_loss: 0.9244, test_f1: 0.6459
 epoch: 83, train_loss: 0.6289, test_loss: 0.9192, test_f1: 0.6584
 epoch: 84, train_loss: 0.6339, test_loss: 0.9324, test_f1: 0.6466
 epoch: 85, train_loss: 0.6413, test_loss: 0.9169, test_f1: 0.6395
 epoch: 86, train_loss: 0.6414, test_loss: 0.9333, test_f1: 0.6378
 epoch: 87, train_loss: 0.6343, test_loss: 0.9563, test_f1: 0.6380
 epoch: 88, train_loss: 0.6312, test_loss: 0.9340, test_f1: 0.6489
 epoch: 89, train_loss: 0.6270, test_loss: 0.9696, test_f1: 0.6532
 epoch: 90, train_loss: 0.6318, test_loss: 0.9565, test_f1: 0.6446
 epoch: 91, train_loss: 0.6230, test_loss: 0.9210, test_f1: 0.6503
 epoch: 92, train_loss: 0.6318, test_loss: 0.9407, test_f1: 0.6354
 epoch: 93, train_loss: 0.6278, test_loss: 0.9412, test_f1: 0.6314
 epoch: 94, train_loss: 0.6221, test_loss: 0.9517, test_f1: 0.6449
 epoch: 95, train_loss: 0.6083, test_loss: 0.9508, test_f1: 0.6550
 epoch: 96, train_loss: 0.6104, test_loss: 0.9604, test_f1: 0.6293
 epoch: 97, train_loss: 0.6097, test_loss: 0.9490, test_f1: 0.6497
 epoch: 98, train_loss: 0.6266, test_loss: 0.9756, test_f1: 0.6272
 epoch: 99, train_loss: 0.6130, test_loss: 0.9426, test_f1: 0.6544
##################ITERATION #6 ****************************************
 epoch: 0, train_loss: 1.2369, test_loss: 1.0076, test_f1: 0.4604
 epoch: 1, train_loss: 1.0643, test_loss: 0.9538, test_f1: 0.5220
 epoch: 2, train_loss: 1.0291, test_loss: 0.9454, test_f1: 0.5135
 epoch: 3, train_loss: 1.0048, test_loss: 0.9447, test_f1: 0.4912
 epoch: 4, train_loss: 0.9823, test_loss: 0.9014, test_f1: 0.5099
 epoch: 5, train_loss: 0.9772, test_loss: 0.9240, test_f1: 0.4994
 epoch: 6, train_loss: 0.9541, test_loss: 0.9098, test_f1: 0.5595
 epoch: 7, train_loss: 0.9382, test_loss: 0.9189, test_f1: 0.5265
 epoch: 8, train_loss: 0.9335, test_loss: 0.9050, test_f1: 0.5202
 epoch: 9, train_loss: 0.9226, test_loss: 0.9029, test_f1: 0.5446
 epoch: 10, train_loss: 0.9106, test_loss: 0.8969, test_f1: 0.5223
 epoch: 11, train_loss: 0.9039, test_loss: 0.9095, test_f1: 0.5263
 epoch: 12, train_loss: 0.8921, test_loss: 0.8778, test_f1: 0.5246
 epoch: 13, train_loss: 0.8901, test_loss: 0.9002, test_f1: 0.5208
 epoch: 14, train_loss: 0.8867, test_loss: 0.9071, test_f1: 0.5244
 epoch: 15, train_loss: 0.8849, test_loss: 0.8867, test_f1: 0.5300
 epoch: 16, train_loss: 0.8624, test_loss: 0.8771, test_f1: 0.5362
 epoch: 17, train_loss: 0.8650, test_loss: 0.8901, test_f1: 0.5219
 epoch: 18, train_loss: 0.8555, test_loss: 0.8838, test_f1: 0.5192
 epoch: 19, train_loss: 0.8511, test_loss: 0.8796, test_f1: 0.5401
 epoch: 20, train_loss: 0.8403, test_loss: 0.8637, test_f1: 0.5304
 epoch: 21, train_loss: 0.8303, test_loss: 0.8701, test_f1: 0.5492
 epoch: 22, train_loss: 0.8343, test_loss: 0.8872, test_f1: 0.5438
 epoch: 23, train_loss: 0.8257, test_loss: 0.8783, test_f1: 0.5424
 epoch: 24, train_loss: 0.8384, test_loss: 0.8863, test_f1: 0.5432
 epoch: 25, train_loss: 0.8200, test_loss: 0.8941, test_f1: 0.5528
 epoch: 26, train_loss: 0.8196, test_loss: 0.8539, test_f1: 0.5521
 epoch: 27, train_loss: 0.8067, test_loss: 0.8711, test_f1: 0.5541
 epoch: 28, train_loss: 0.8013, test_loss: 0.8877, test_f1: 0.5811
 epoch: 29, train_loss: 0.7985, test_loss: 0.8996, test_f1: 0.5580
 epoch: 30, train_loss: 0.8087, test_loss: 0.8768, test_f1: 0.5573
 epoch: 31, train_loss: 0.7879, test_loss: 0.8757, test_f1: 0.5678
 epoch: 32, train_loss: 0.7835, test_loss: 0.8834, test_f1: 0.5835
 epoch: 33, train_loss: 0.7819, test_loss: 0.8993, test_f1: 0.5808
 epoch: 34, train_loss: 0.7751, test_loss: 0.8902, test_f1: 0.5551
 epoch: 35, train_loss: 0.7750, test_loss: 0.9143, test_f1: 0.5641
 epoch: 36, train_loss: 0.7759, test_loss: 0.9113, test_f1: 0.5873
 epoch: 37, train_loss: 0.7659, test_loss: 0.8959, test_f1: 0.5648
 epoch: 38, train_loss: 0.7562, test_loss: 0.8749, test_f1: 0.5747
 epoch: 39, train_loss: 0.7708, test_loss: 0.8859, test_f1: 0.5751
 epoch: 40, train_loss: 0.7565, test_loss: 0.8874, test_f1: 0.5819
 epoch: 41, train_loss: 0.7560, test_loss: 0.8801, test_f1: 0.5999
 epoch: 42, train_loss: 0.7619, test_loss: 0.8981, test_f1: 0.5765
 epoch: 43, train_loss: 0.7509, test_loss: 0.8828, test_f1: 0.5855
 epoch: 44, train_loss: 0.7417, test_loss: 0.8829, test_f1: 0.5961
 epoch: 45, train_loss: 0.7326, test_loss: 0.9198, test_f1: 0.6075
 epoch: 46, train_loss: 0.7384, test_loss: 0.9185, test_f1: 0.5825
 epoch: 47, train_loss: 0.7314, test_loss: 0.8923, test_f1: 0.5847
 epoch: 48, train_loss: 0.7337, test_loss: 0.8921, test_f1: 0.6085
 epoch: 49, train_loss: 0.7228, test_loss: 0.8995, test_f1: 0.6166
 epoch: 50, train_loss: 0.7270, test_loss: 0.8974, test_f1: 0.5874
 epoch: 51, train_loss: 0.7097, test_loss: 0.8933, test_f1: 0.5851
 epoch: 52, train_loss: 0.7062, test_loss: 0.8876, test_f1: 0.5930
 epoch: 53, train_loss: 0.7092, test_loss: 0.9017, test_f1: 0.5911
 epoch: 54, train_loss: 0.7030, test_loss: 0.8992, test_f1: 0.5944
 epoch: 55, train_loss: 0.7022, test_loss: 0.9060, test_f1: 0.5837
 epoch: 56, train_loss: 0.6885, test_loss: 0.8858, test_f1: 0.6037
 epoch: 57, train_loss: 0.6908, test_loss: 0.9068, test_f1: 0.5940
 epoch: 58, train_loss: 0.6856, test_loss: 0.8988, test_f1: 0.5947
 epoch: 59, train_loss: 0.6915, test_loss: 0.9269, test_f1: 0.6091
 epoch: 60, train_loss: 0.6971, test_loss: 0.9054, test_f1: 0.6066
 epoch: 61, train_loss: 0.6970, test_loss: 0.9011, test_f1: 0.5920
 epoch: 62, train_loss: 0.6842, test_loss: 0.8956, test_f1: 0.6050
 epoch: 63, train_loss: 0.6766, test_loss: 0.8974, test_f1: 0.6194
 epoch: 64, train_loss: 0.6904, test_loss: 0.9047, test_f1: 0.6106
 epoch: 65, train_loss: 0.6783, test_loss: 0.9079, test_f1: 0.6107
 epoch: 66, train_loss: 0.6717, test_loss: 0.9091, test_f1: 0.6308
 epoch: 67, train_loss: 0.6869, test_loss: 0.8789, test_f1: 0.6157
 epoch: 68, train_loss: 0.6786, test_loss: 0.9075, test_f1: 0.6117
 epoch: 69, train_loss: 0.6742, test_loss: 0.9201, test_f1: 0.6072
 epoch: 70, train_loss: 0.6662, test_loss: 0.9228, test_f1: 0.6195
 epoch: 71, train_loss: 0.6866, test_loss: 0.9278, test_f1: 0.5940
 epoch: 72, train_loss: 0.6701, test_loss: 0.9296, test_f1: 0.6257
 epoch: 73, train_loss: 0.6695, test_loss: 0.9164, test_f1: 0.6109
 epoch: 74, train_loss: 0.6583, test_loss: 0.9399, test_f1: 0.6075
 epoch: 75, train_loss: 0.6813, test_loss: 0.9231, test_f1: 0.6283
 epoch: 76, train_loss: 0.6551, test_loss: 0.9000, test_f1: 0.6180
 epoch: 77, train_loss: 0.6676, test_loss: 0.9105, test_f1: 0.6235
 epoch: 78, train_loss: 0.6591, test_loss: 0.9058, test_f1: 0.6371
 epoch: 79, train_loss: 0.6543, test_loss: 0.9301, test_f1: 0.6022
 epoch: 80, train_loss: 0.6621, test_loss: 0.9191, test_f1: 0.6055
 epoch: 81, train_loss: 0.6519, test_loss: 0.9307, test_f1: 0.6175
 epoch: 82, train_loss: 0.6550, test_loss: 0.9276, test_f1: 0.6388
 epoch: 83, train_loss: 0.6511, test_loss: 0.9255, test_f1: 0.6061
 epoch: 84, train_loss: 0.6453, test_loss: 0.9344, test_f1: 0.6365
 epoch: 85, train_loss: 0.6423, test_loss: 0.9303, test_f1: 0.6323
 epoch: 86, train_loss: 0.6466, test_loss: 0.9299, test_f1: 0.6700
 epoch: 87, train_loss: 0.6439, test_loss: 0.9200, test_f1: 0.6044
 epoch: 88, train_loss: 0.6584, test_loss: 0.9447, test_f1: 0.6084
 epoch: 89, train_loss: 0.6463, test_loss: 0.9104, test_f1: 0.6369
 epoch: 90, train_loss: 0.6304, test_loss: 0.8820, test_f1: 0.6171
 epoch: 91, train_loss: 0.6489, test_loss: 0.9498, test_f1: 0.6172
 epoch: 92, train_loss: 0.6350, test_loss: 0.9187, test_f1: 0.6426
 epoch: 93, train_loss: 0.6448, test_loss: 0.9365, test_f1: 0.6072
 epoch: 94, train_loss: 0.6470, test_loss: 0.9368, test_f1: 0.6417
 epoch: 95, train_loss: 0.6300, test_loss: 0.9261, test_f1: 0.6555
 epoch: 96, train_loss: 0.6299, test_loss: 0.9254, test_f1: 0.6388
 epoch: 97, train_loss: 0.6193, test_loss: 0.9454, test_f1: 0.6483
 epoch: 98, train_loss: 0.6195, test_loss: 0.9380, test_f1: 0.6273
 epoch: 99, train_loss: 0.6263, test_loss: 0.9481, test_f1: 0.6392
##################ITERATION #7 ****************************************
 epoch: 0, train_loss: 1.2538, test_loss: 1.0044, test_f1: 0.4817
 epoch: 1, train_loss: 1.0913, test_loss: 0.9664, test_f1: 0.4612
 epoch: 2, train_loss: 1.0355, test_loss: 0.9329, test_f1: 0.4587
 epoch: 3, train_loss: 1.0027, test_loss: 0.9209, test_f1: 0.4788
 epoch: 4, train_loss: 0.9855, test_loss: 0.9048, test_f1: 0.4904
 epoch: 5, train_loss: 0.9586, test_loss: 0.9053, test_f1: 0.4793
 epoch: 6, train_loss: 0.9500, test_loss: 0.8899, test_f1: 0.4873
 epoch: 7, train_loss: 0.9216, test_loss: 0.9251, test_f1: 0.4965
 epoch: 8, train_loss: 0.9178, test_loss: 0.8881, test_f1: 0.5139
 epoch: 9, train_loss: 0.9107, test_loss: 0.8718, test_f1: 0.4997
 epoch: 10, train_loss: 0.8994, test_loss: 0.8737, test_f1: 0.5320
 epoch: 11, train_loss: 0.8751, test_loss: 0.8711, test_f1: 0.5317
 epoch: 12, train_loss: 0.8757, test_loss: 0.8733, test_f1: 0.5737
 epoch: 13, train_loss: 0.8722, test_loss: 0.8654, test_f1: 0.5437
 epoch: 14, train_loss: 0.8641, test_loss: 0.8719, test_f1: 0.5490
 epoch: 15, train_loss: 0.8463, test_loss: 0.8641, test_f1: 0.5457
 epoch: 16, train_loss: 0.8402, test_loss: 0.8566, test_f1: 0.5735
 epoch: 17, train_loss: 0.8301, test_loss: 0.8933, test_f1: 0.5496
 epoch: 18, train_loss: 0.8247, test_loss: 0.8739, test_f1: 0.5576
 epoch: 19, train_loss: 0.8309, test_loss: 0.8684, test_f1: 0.5781
 epoch: 20, train_loss: 0.8186, test_loss: 0.8369, test_f1: 0.5731
 epoch: 21, train_loss: 0.8059, test_loss: 0.8429, test_f1: 0.5619
 epoch: 22, train_loss: 0.7969, test_loss: 0.8736, test_f1: 0.5685
 epoch: 23, train_loss: 0.7915, test_loss: 0.8532, test_f1: 0.5727
 epoch: 24, train_loss: 0.7929, test_loss: 0.8609, test_f1: 0.5899
 epoch: 25, train_loss: 0.7894, test_loss: 0.8362, test_f1: 0.5881
 epoch: 26, train_loss: 0.7752, test_loss: 0.8602, test_f1: 0.6004
 epoch: 27, train_loss: 0.7745, test_loss: 0.8521, test_f1: 0.6231
 epoch: 28, train_loss: 0.7562, test_loss: 0.8321, test_f1: 0.5794
 epoch: 29, train_loss: 0.7595, test_loss: 0.8346, test_f1: 0.6214
 epoch: 30, train_loss: 0.7628, test_loss: 0.8508, test_f1: 0.5884
 epoch: 31, train_loss: 0.7546, test_loss: 0.8207, test_f1: 0.6130
 epoch: 32, train_loss: 0.7593, test_loss: 0.8568, test_f1: 0.6023
 epoch: 33, train_loss: 0.7455, test_loss: 0.8250, test_f1: 0.5697
 epoch: 34, train_loss: 0.7364, test_loss: 0.8564, test_f1: 0.6024
 epoch: 35, train_loss: 0.7325, test_loss: 0.8441, test_f1: 0.6163
 epoch: 36, train_loss: 0.7453, test_loss: 0.8958, test_f1: 0.6100
 epoch: 37, train_loss: 0.7220, test_loss: 0.8775, test_f1: 0.6283
 epoch: 38, train_loss: 0.7309, test_loss: 0.8514, test_f1: 0.6157
 epoch: 39, train_loss: 0.7199, test_loss: 0.8476, test_f1: 0.6213
 epoch: 40, train_loss: 0.7184, test_loss: 0.8289, test_f1: 0.5913
 epoch: 41, train_loss: 0.7037, test_loss: 0.8561, test_f1: 0.6078
 epoch: 42, train_loss: 0.7047, test_loss: 0.8844, test_f1: 0.6239
 epoch: 43, train_loss: 0.7014, test_loss: 0.8522, test_f1: 0.5907
 epoch: 44, train_loss: 0.7051, test_loss: 0.8668, test_f1: 0.6145
 epoch: 45, train_loss: 0.6996, test_loss: 0.8946, test_f1: 0.6400
 epoch: 46, train_loss: 0.6893, test_loss: 0.8900, test_f1: 0.6001
 epoch: 47, train_loss: 0.6930, test_loss: 0.8971, test_f1: 0.6473
 epoch: 48, train_loss: 0.6797, test_loss: 0.8661, test_f1: 0.6178
 epoch: 49, train_loss: 0.6758, test_loss: 0.8558, test_f1: 0.6411
 epoch: 50, train_loss: 0.6843, test_loss: 0.8762, test_f1: 0.6168
 epoch: 51, train_loss: 0.6654, test_loss: 0.8510, test_f1: 0.6344
 epoch: 52, train_loss: 0.6441, test_loss: 0.8744, test_f1: 0.6186
 epoch: 53, train_loss: 0.6558, test_loss: 0.8365, test_f1: 0.6338
 epoch: 54, train_loss: 0.6544, test_loss: 0.8716, test_f1: 0.6460
 epoch: 55, train_loss: 0.6439, test_loss: 0.8739, test_f1: 0.6417
 epoch: 56, train_loss: 0.6320, test_loss: 0.8496, test_f1: 0.6447
 epoch: 57, train_loss: 0.6511, test_loss: 0.8980, test_f1: 0.6405
 epoch: 58, train_loss: 0.6410, test_loss: 0.8532, test_f1: 0.6551
 epoch: 59, train_loss: 0.6480, test_loss: 0.8788, test_f1: 0.6623
 epoch: 60, train_loss: 0.6440, test_loss: 0.8668, test_f1: 0.6597
 epoch: 61, train_loss: 0.6388, test_loss: 0.8311, test_f1: 0.6494
 epoch: 62, train_loss: 0.6361, test_loss: 0.8730, test_f1: 0.6504
 epoch: 63, train_loss: 0.6280, test_loss: 0.8562, test_f1: 0.6573
 epoch: 64, train_loss: 0.6272, test_loss: 0.8539, test_f1: 0.6526
 epoch: 65, train_loss: 0.6359, test_loss: 0.8724, test_f1: 0.6301
 epoch: 66, train_loss: 0.6249, test_loss: 0.8578, test_f1: 0.6414
 epoch: 67, train_loss: 0.6360, test_loss: 0.8677, test_f1: 0.6422
 epoch: 68, train_loss: 0.6211, test_loss: 0.8678, test_f1: 0.6311
 epoch: 69, train_loss: 0.6233, test_loss: 0.8616, test_f1: 0.6588
 epoch: 70, train_loss: 0.6153, test_loss: 0.8830, test_f1: 0.6353
 epoch: 71, train_loss: 0.6231, test_loss: 0.8634, test_f1: 0.6509
 epoch: 72, train_loss: 0.6119, test_loss: 0.8863, test_f1: 0.6544
 epoch: 73, train_loss: 0.6220, test_loss: 0.8694, test_f1: 0.6380
 epoch: 74, train_loss: 0.6048, test_loss: 0.8353, test_f1: 0.6772
 epoch: 75, train_loss: 0.6144, test_loss: 0.8829, test_f1: 0.6316
 epoch: 76, train_loss: 0.6050, test_loss: 0.8872, test_f1: 0.6477
 epoch: 77, train_loss: 0.6119, test_loss: 0.9154, test_f1: 0.6605
 epoch: 78, train_loss: 0.6006, test_loss: 0.9101, test_f1: 0.6642
 epoch: 79, train_loss: 0.6046, test_loss: 0.8796, test_f1: 0.6619
 epoch: 80, train_loss: 0.6058, test_loss: 0.8740, test_f1: 0.6604
 epoch: 81, train_loss: 0.6027, test_loss: 0.8700, test_f1: 0.6555
 epoch: 82, train_loss: 0.5956, test_loss: 0.9087, test_f1: 0.6607
 epoch: 83, train_loss: 0.6077, test_loss: 0.8608, test_f1: 0.6622
 epoch: 84, train_loss: 0.5881, test_loss: 0.8718, test_f1: 0.6772
 epoch: 85, train_loss: 0.5907, test_loss: 0.8976, test_f1: 0.6557
 epoch: 86, train_loss: 0.5951, test_loss: 0.8837, test_f1: 0.6621
 epoch: 87, train_loss: 0.5712, test_loss: 0.8684, test_f1: 0.6460
 epoch: 88, train_loss: 0.5893, test_loss: 0.8988, test_f1: 0.6397
 epoch: 89, train_loss: 0.5764, test_loss: 0.8969, test_f1: 0.6643
 epoch: 90, train_loss: 0.5736, test_loss: 0.9012, test_f1: 0.6626
 epoch: 91, train_loss: 0.5717, test_loss: 0.8899, test_f1: 0.6736
 epoch: 92, train_loss: 0.5780, test_loss: 0.9200, test_f1: 0.6355
 epoch: 93, train_loss: 0.5900, test_loss: 0.8951, test_f1: 0.6491
 epoch: 94, train_loss: 0.5727, test_loss: 0.8896, test_f1: 0.6639
 epoch: 95, train_loss: 0.5750, test_loss: 0.9368, test_f1: 0.6689
 epoch: 96, train_loss: 0.5628, test_loss: 0.9135, test_f1: 0.6513
 epoch: 97, train_loss: 0.5829, test_loss: 0.9202, test_f1: 0.6627
 epoch: 98, train_loss: 0.5731, test_loss: 0.9102, test_f1: 0.6657
 epoch: 99, train_loss: 0.5719, test_loss: 0.8788, test_f1: 0.6709
##################ITERATION #8 ****************************************
 epoch: 0, train_loss: 1.2596, test_loss: 1.0385, test_f1: 0.4649
 epoch: 1, train_loss: 1.0931, test_loss: 1.0082, test_f1: 0.4913
 epoch: 2, train_loss: 1.0363, test_loss: 0.9812, test_f1: 0.4716
 epoch: 3, train_loss: 1.0309, test_loss: 0.9510, test_f1: 0.4907
 epoch: 4, train_loss: 1.0055, test_loss: 0.9443, test_f1: 0.5071
 epoch: 5, train_loss: 0.9759, test_loss: 0.9413, test_f1: 0.5253
 epoch: 6, train_loss: 0.9695, test_loss: 0.9294, test_f1: 0.5052
 epoch: 7, train_loss: 0.9464, test_loss: 0.9273, test_f1: 0.5291
 epoch: 8, train_loss: 0.9411, test_loss: 0.9373, test_f1: 0.5342
 epoch: 9, train_loss: 0.9289, test_loss: 0.9358, test_f1: 0.5105
 epoch: 10, train_loss: 0.9139, test_loss: 0.9285, test_f1: 0.5195
 epoch: 11, train_loss: 0.9042, test_loss: 0.9087, test_f1: 0.5424
 epoch: 12, train_loss: 0.9031, test_loss: 0.9284, test_f1: 0.5097
 epoch: 13, train_loss: 0.8853, test_loss: 0.9101, test_f1: 0.5216
 epoch: 14, train_loss: 0.8815, test_loss: 0.8932, test_f1: 0.5247
 epoch: 15, train_loss: 0.8735, test_loss: 0.8936, test_f1: 0.5383
 epoch: 16, train_loss: 0.8628, test_loss: 0.9042, test_f1: 0.5301
 epoch: 17, train_loss: 0.8615, test_loss: 0.9084, test_f1: 0.5329
 epoch: 18, train_loss: 0.8562, test_loss: 0.9236, test_f1: 0.5395
 epoch: 19, train_loss: 0.8487, test_loss: 0.9133, test_f1: 0.5359
 epoch: 20, train_loss: 0.8440, test_loss: 0.8920, test_f1: 0.5619
 epoch: 21, train_loss: 0.8340, test_loss: 0.9262, test_f1: 0.5588
 epoch: 22, train_loss: 0.8372, test_loss: 0.8902, test_f1: 0.5348
 epoch: 23, train_loss: 0.8224, test_loss: 0.8872, test_f1: 0.5530
 epoch: 24, train_loss: 0.8163, test_loss: 0.8951, test_f1: 0.5653
 epoch: 25, train_loss: 0.8239, test_loss: 0.9013, test_f1: 0.5404
 epoch: 26, train_loss: 0.8189, test_loss: 0.8896, test_f1: 0.5727
 epoch: 27, train_loss: 0.8085, test_loss: 0.8851, test_f1: 0.5715
 epoch: 28, train_loss: 0.8168, test_loss: 0.9085, test_f1: 0.5630
 epoch: 29, train_loss: 0.8060, test_loss: 0.8839, test_f1: 0.5828
 epoch: 30, train_loss: 0.7970, test_loss: 0.8968, test_f1: 0.5815
 epoch: 31, train_loss: 0.7938, test_loss: 0.8782, test_f1: 0.5642
 epoch: 32, train_loss: 0.7853, test_loss: 0.8986, test_f1: 0.5462
 epoch: 33, train_loss: 0.7907, test_loss: 0.8903, test_f1: 0.5668
 epoch: 34, train_loss: 0.7842, test_loss: 0.9012, test_f1: 0.5866
 epoch: 35, train_loss: 0.7735, test_loss: 0.8892, test_f1: 0.5974
 epoch: 36, train_loss: 0.7585, test_loss: 0.8756, test_f1: 0.6207
 epoch: 37, train_loss: 0.7668, test_loss: 0.8732, test_f1: 0.5950
 epoch: 38, train_loss: 0.7507, test_loss: 0.8746, test_f1: 0.6018
 epoch: 39, train_loss: 0.7580, test_loss: 0.8689, test_f1: 0.6012
 epoch: 40, train_loss: 0.7491, test_loss: 0.8970, test_f1: 0.6468
 epoch: 41, train_loss: 0.7513, test_loss: 0.8747, test_f1: 0.6111
 epoch: 42, train_loss: 0.7409, test_loss: 0.8718, test_f1: 0.6284
 epoch: 43, train_loss: 0.7451, test_loss: 0.8911, test_f1: 0.6332
 epoch: 44, train_loss: 0.7355, test_loss: 0.8781, test_f1: 0.6202
 epoch: 45, train_loss: 0.7378, test_loss: 0.8740, test_f1: 0.6218
 epoch: 46, train_loss: 0.7248, test_loss: 0.8785, test_f1: 0.6282
 epoch: 47, train_loss: 0.7174, test_loss: 0.8653, test_f1: 0.6059
 epoch: 48, train_loss: 0.7143, test_loss: 0.8856, test_f1: 0.6243
 epoch: 49, train_loss: 0.7163, test_loss: 0.8934, test_f1: 0.6327
 epoch: 50, train_loss: 0.7283, test_loss: 0.8670, test_f1: 0.6088
 epoch: 51, train_loss: 0.7051, test_loss: 0.8907, test_f1: 0.6096
 epoch: 52, train_loss: 0.6895, test_loss: 0.8931, test_f1: 0.6124
 epoch: 53, train_loss: 0.6842, test_loss: 0.8816, test_f1: 0.6438
 epoch: 54, train_loss: 0.6958, test_loss: 0.8963, test_f1: 0.6226
 epoch: 55, train_loss: 0.6971, test_loss: 0.8875, test_f1: 0.6193
 epoch: 56, train_loss: 0.6878, test_loss: 0.8773, test_f1: 0.6433
 epoch: 57, train_loss: 0.6950, test_loss: 0.8851, test_f1: 0.6586
 epoch: 58, train_loss: 0.6800, test_loss: 0.8788, test_f1: 0.6429
 epoch: 59, train_loss: 0.6649, test_loss: 0.9050, test_f1: 0.6093
 epoch: 60, train_loss: 0.6718, test_loss: 0.9053, test_f1: 0.6173
 epoch: 61, train_loss: 0.6757, test_loss: 0.9121, test_f1: 0.5922
 epoch: 62, train_loss: 0.6673, test_loss: 0.9024, test_f1: 0.6197
 epoch: 63, train_loss: 0.6683, test_loss: 0.9137, test_f1: 0.6155
 epoch: 64, train_loss: 0.6689, test_loss: 0.8875, test_f1: 0.6118
 epoch: 65, train_loss: 0.6594, test_loss: 0.8843, test_f1: 0.6406
 epoch: 66, train_loss: 0.6602, test_loss: 0.8803, test_f1: 0.6338
 epoch: 67, train_loss: 0.6627, test_loss: 0.9208, test_f1: 0.6254
 epoch: 68, train_loss: 0.6540, test_loss: 0.9171, test_f1: 0.6355
 epoch: 69, train_loss: 0.6626, test_loss: 0.8994, test_f1: 0.6332
 epoch: 70, train_loss: 0.6448, test_loss: 0.8844, test_f1: 0.6091
 epoch: 71, train_loss: 0.6494, test_loss: 0.8935, test_f1: 0.6578
 epoch: 72, train_loss: 0.6466, test_loss: 0.8939, test_f1: 0.6176
 epoch: 73, train_loss: 0.6468, test_loss: 0.8873, test_f1: 0.6077
 epoch: 74, train_loss: 0.6392, test_loss: 0.9187, test_f1: 0.6454
 epoch: 75, train_loss: 0.6435, test_loss: 0.9427, test_f1: 0.6298
 epoch: 76, train_loss: 0.6585, test_loss: 0.9424, test_f1: 0.6157
 epoch: 77, train_loss: 0.6472, test_loss: 0.9302, test_f1: 0.6332
 epoch: 78, train_loss: 0.6303, test_loss: 0.9263, test_f1: 0.6306
 epoch: 79, train_loss: 0.6335, test_loss: 0.8944, test_f1: 0.6520
 epoch: 80, train_loss: 0.6196, test_loss: 0.8918, test_f1: 0.6103
 epoch: 81, train_loss: 0.6227, test_loss: 0.9266, test_f1: 0.6492
 epoch: 82, train_loss: 0.6273, test_loss: 0.9245, test_f1: 0.6119
 epoch: 83, train_loss: 0.6370, test_loss: 0.8997, test_f1: 0.6634
 epoch: 84, train_loss: 0.6302, test_loss: 0.9240, test_f1: 0.6142
 epoch: 85, train_loss: 0.6286, test_loss: 0.9407, test_f1: 0.6283
 epoch: 86, train_loss: 0.6201, test_loss: 0.9595, test_f1: 0.6081
 epoch: 87, train_loss: 0.6179, test_loss: 0.9460, test_f1: 0.6317
 epoch: 88, train_loss: 0.6160, test_loss: 0.9244, test_f1: 0.6268
 epoch: 89, train_loss: 0.6119, test_loss: 0.9343, test_f1: 0.6240
 epoch: 90, train_loss: 0.6276, test_loss: 0.9505, test_f1: 0.6441
 epoch: 91, train_loss: 0.6138, test_loss: 0.9527, test_f1: 0.6289
 epoch: 92, train_loss: 0.6104, test_loss: 0.9277, test_f1: 0.6458
 epoch: 93, train_loss: 0.6085, test_loss: 0.9477, test_f1: 0.6304
 epoch: 94, train_loss: 0.6107, test_loss: 0.9247, test_f1: 0.6410
 epoch: 95, train_loss: 0.6067, test_loss: 0.9084, test_f1: 0.6389
 epoch: 96, train_loss: 0.6119, test_loss: 0.9298, test_f1: 0.6295
 epoch: 97, train_loss: 0.6083, test_loss: 0.9576, test_f1: 0.6172
 epoch: 98, train_loss: 0.5905, test_loss: 0.9577, test_f1: 0.6453
 epoch: 99, train_loss: 0.5936, test_loss: 0.9865, test_f1: 0.6409
##################ITERATION #9 ****************************************
 epoch: 0, train_loss: 1.3138, test_loss: 1.0228, test_f1: 0.4650
 epoch: 1, train_loss: 1.1121, test_loss: 0.9906, test_f1: 0.4807
 epoch: 2, train_loss: 1.0689, test_loss: 0.9833, test_f1: 0.4766
 epoch: 3, train_loss: 1.0317, test_loss: 0.9618, test_f1: 0.5016
 epoch: 4, train_loss: 1.0104, test_loss: 0.9528, test_f1: 0.5045
 epoch: 5, train_loss: 0.9916, test_loss: 0.9400, test_f1: 0.5047
 epoch: 6, train_loss: 0.9626, test_loss: 0.9282, test_f1: 0.5163
 epoch: 7, train_loss: 0.9508, test_loss: 0.9202, test_f1: 0.5445
 epoch: 8, train_loss: 0.9385, test_loss: 0.9159, test_f1: 0.5194
 epoch: 9, train_loss: 0.9341, test_loss: 0.9227, test_f1: 0.5088
 epoch: 10, train_loss: 0.9255, test_loss: 0.9214, test_f1: 0.5056
 epoch: 11, train_loss: 0.9113, test_loss: 0.9123, test_f1: 0.5158
 epoch: 12, train_loss: 0.9005, test_loss: 0.9225, test_f1: 0.5215
 epoch: 13, train_loss: 0.8933, test_loss: 0.9096, test_f1: 0.5281
 epoch: 14, train_loss: 0.8886, test_loss: 0.9033, test_f1: 0.5243
 epoch: 15, train_loss: 0.8821, test_loss: 0.9197, test_f1: 0.5417
 epoch: 16, train_loss: 0.8580, test_loss: 0.9068, test_f1: 0.5330
 epoch: 17, train_loss: 0.8681, test_loss: 0.9083, test_f1: 0.5538
 epoch: 18, train_loss: 0.8517, test_loss: 0.8919, test_f1: 0.5524
 epoch: 19, train_loss: 0.8442, test_loss: 0.9102, test_f1: 0.5571
 epoch: 20, train_loss: 0.8400, test_loss: 0.9123, test_f1: 0.5741
 epoch: 21, train_loss: 0.8439, test_loss: 0.9059, test_f1: 0.5602
 epoch: 22, train_loss: 0.8375, test_loss: 0.9015, test_f1: 0.5268
 epoch: 23, train_loss: 0.8355, test_loss: 0.9005, test_f1: 0.5488
 epoch: 24, train_loss: 0.8320, test_loss: 0.8996, test_f1: 0.5513
 epoch: 25, train_loss: 0.8199, test_loss: 0.9119, test_f1: 0.5476
 epoch: 26, train_loss: 0.8232, test_loss: 0.9244, test_f1: 0.5754
 epoch: 27, train_loss: 0.8017, test_loss: 0.8934, test_f1: 0.5712
 epoch: 28, train_loss: 0.7985, test_loss: 0.8818, test_f1: 0.5619
 epoch: 29, train_loss: 0.7937, test_loss: 0.8795, test_f1: 0.5694
 epoch: 30, train_loss: 0.8005, test_loss: 0.9043, test_f1: 0.5586
 epoch: 31, train_loss: 0.7847, test_loss: 0.8999, test_f1: 0.5679
 epoch: 32, train_loss: 0.7814, test_loss: 0.8981, test_f1: 0.5765
 epoch: 33, train_loss: 0.7913, test_loss: 0.9038, test_f1: 0.5807
 epoch: 34, train_loss: 0.7754, test_loss: 0.9012, test_f1: 0.5806
 epoch: 35, train_loss: 0.7599, test_loss: 0.9087, test_f1: 0.5775
 epoch: 36, train_loss: 0.7749, test_loss: 0.9023, test_f1: 0.5970
 epoch: 37, train_loss: 0.7547, test_loss: 0.9278, test_f1: 0.5895
 epoch: 38, train_loss: 0.7564, test_loss: 0.9133, test_f1: 0.5717
 epoch: 39, train_loss: 0.7572, test_loss: 0.8985, test_f1: 0.5876
 epoch: 40, train_loss: 0.7554, test_loss: 0.9151, test_f1: 0.5862
 epoch: 41, train_loss: 0.7476, test_loss: 0.9324, test_f1: 0.5846
 epoch: 42, train_loss: 0.7547, test_loss: 0.9115, test_f1: 0.5830
 epoch: 43, train_loss: 0.7438, test_loss: 0.8889, test_f1: 0.5850
 epoch: 44, train_loss: 0.7455, test_loss: 0.9077, test_f1: 0.5699
 epoch: 45, train_loss: 0.7418, test_loss: 0.9202, test_f1: 0.6008
 epoch: 46, train_loss: 0.7267, test_loss: 0.8757, test_f1: 0.5989
 epoch: 47, train_loss: 0.7215, test_loss: 0.9132, test_f1: 0.6141
 epoch: 48, train_loss: 0.7289, test_loss: 0.8784, test_f1: 0.5929
 epoch: 49, train_loss: 0.7241, test_loss: 0.9067, test_f1: 0.6153
 epoch: 50, train_loss: 0.7143, test_loss: 0.9272, test_f1: 0.5936
 epoch: 51, train_loss: 0.7018, test_loss: 0.9259, test_f1: 0.6052
 epoch: 52, train_loss: 0.7134, test_loss: 0.9448, test_f1: 0.6043
 epoch: 53, train_loss: 0.6890, test_loss: 0.8942, test_f1: 0.6190
 epoch: 54, train_loss: 0.6954, test_loss: 0.9097, test_f1: 0.6104
 epoch: 55, train_loss: 0.7007, test_loss: 0.9249, test_f1: 0.6172
 epoch: 56, train_loss: 0.6768, test_loss: 0.9050, test_f1: 0.6196
 epoch: 57, train_loss: 0.6962, test_loss: 0.9147, test_f1: 0.6141
 epoch: 58, train_loss: 0.6898, test_loss: 0.9109, test_f1: 0.6054
 epoch: 59, train_loss: 0.6875, test_loss: 0.9063, test_f1: 0.6015
 epoch: 60, train_loss: 0.6877, test_loss: 0.9131, test_f1: 0.6173
 epoch: 61, train_loss: 0.6953, test_loss: 0.9186, test_f1: 0.6157
 epoch: 62, train_loss: 0.6786, test_loss: 0.9298, test_f1: 0.6097
 epoch: 63, train_loss: 0.6823, test_loss: 0.9309, test_f1: 0.6144
 epoch: 64, train_loss: 0.6672, test_loss: 0.9299, test_f1: 0.6075
 epoch: 65, train_loss: 0.6776, test_loss: 0.9052, test_f1: 0.6114
 epoch: 66, train_loss: 0.6677, test_loss: 0.9278, test_f1: 0.6063
 epoch: 67, train_loss: 0.6717, test_loss: 0.9185, test_f1: 0.6086
 epoch: 68, train_loss: 0.6790, test_loss: 0.9361, test_f1: 0.6027
 epoch: 69, train_loss: 0.6688, test_loss: 0.9134, test_f1: 0.6130
 epoch: 70, train_loss: 0.6561, test_loss: 0.9517, test_f1: 0.5962
 epoch: 71, train_loss: 0.6688, test_loss: 0.9418, test_f1: 0.6050
 epoch: 72, train_loss: 0.6777, test_loss: 0.9240, test_f1: 0.6136
 epoch: 73, train_loss: 0.6552, test_loss: 0.9519, test_f1: 0.5952
 epoch: 74, train_loss: 0.6539, test_loss: 0.9228, test_f1: 0.6182
 epoch: 75, train_loss: 0.6662, test_loss: 0.9462, test_f1: 0.6126
 epoch: 76, train_loss: 0.6581, test_loss: 0.9554, test_f1: 0.6222
 epoch: 77, train_loss: 0.6534, test_loss: 0.9409, test_f1: 0.6253
 epoch: 78, train_loss: 0.6477, test_loss: 0.9595, test_f1: 0.6100
 epoch: 79, train_loss: 0.6515, test_loss: 0.9069, test_f1: 0.6166
 epoch: 80, train_loss: 0.6532, test_loss: 0.9507, test_f1: 0.6117
 epoch: 81, train_loss: 0.6465, test_loss: 0.9496, test_f1: 0.6005
 epoch: 82, train_loss: 0.6447, test_loss: 0.9656, test_f1: 0.6016
 epoch: 83, train_loss: 0.6576, test_loss: 0.9675, test_f1: 0.6070
 epoch: 84, train_loss: 0.6315, test_loss: 0.9488, test_f1: 0.6075
 epoch: 85, train_loss: 0.6513, test_loss: 0.9467, test_f1: 0.6138
 epoch: 86, train_loss: 0.6433, test_loss: 0.9492, test_f1: 0.6195
 epoch: 87, train_loss: 0.6529, test_loss: 0.9512, test_f1: 0.6349
 epoch: 88, train_loss: 0.6366, test_loss: 0.9591, test_f1: 0.6181
 epoch: 89, train_loss: 0.6394, test_loss: 0.9574, test_f1: 0.6214
 epoch: 90, train_loss: 0.6400, test_loss: 0.9569, test_f1: 0.6372
 epoch: 91, train_loss: 0.6279, test_loss: 0.9729, test_f1: 0.6169
 epoch: 92, train_loss: 0.6262, test_loss: 0.9321, test_f1: 0.6208
 epoch: 93, train_loss: 0.6307, test_loss: 0.9769, test_f1: 0.6278
 epoch: 94, train_loss: 0.6251, test_loss: 0.9506, test_f1: 0.6131
 epoch: 95, train_loss: 0.6129, test_loss: 0.9824, test_f1: 0.6272
 epoch: 96, train_loss: 0.6342, test_loss: 0.9748, test_f1: 0.6158
 epoch: 97, train_loss: 0.6133, test_loss: 0.9556, test_f1: 0.6179
 epoch: 98, train_loss: 0.6216, test_loss: 0.9679, test_f1: 0.6299
 epoch: 99, train_loss: 0.6161, test_loss: 0.9509, test_f1: 0.6043

Training completed in 795.92 seconds
Best F1: 0.6876 at epoch 99
Mean F1 across iterations: 0.6670  0.0144
========================FINAL RESULTS================================
FEGIN weighted F1: 0.6876  0.0144
python main.py --data ltspice_examples --representation component_net --model FEGIN --layers 2 --hiddens 128 --batch_size 32 --lr 0.0001 --emb_size 128 --epochs 100 --save_appendix component_net_L2_H128_BS32_LR0.0001_E128 --no_val
-----



STDERR:
  File "main.py", line 370, in <module>
    main()
  File "main.py", line 254, in main
    dataset = dataset_class(
  File "/home/philip/projects/ltspice_examples_code_repo/Circuit-Completion-Using-GNNs/component_classification_with_link_prediction_head/evaluation/FEGIN/kernel/circuit_datasets.py", line 15, in __init__
    self.data, self.slices = torch.load(self.processed_paths[0])
  File "/home/philip/.local/lib/python3.8/site-packages/torch/serialization.py", line 1040, in load
    warnings.warn(
  File "/usr/lib/python3.8/warnings.py", line 109, in _showwarnmsg
    sw(msg.message, msg.category, msg.filename, msg.lineno,
  File "main.py", line 47, in warn_with_traceback
    traceback.print_stack(file=log)
/home/philip/projects/ltspice_examples_code_repo/Circuit-Completion-Using-GNNs/component_classification_with_link_prediction_head/evaluation/FEGIN/kernel/circuit_datasets.py:15: FutureWarning: You are using `torch.load` with `weights_only=False` (the current default value), which uses the default pickle module implicitly. It is possible to construct malicious pickle data which will execute arbitrary code during unpickling (See https://github.com/pytorch/pytorch/blob/main/SECURITY.md#untrusted-models for more details). In a future release, the default value for `weights_only` will be flipped to `True`. This limits the functions that could be executed during unpickling. Arbitrary objects will no longer be allowed to be loaded via this mode unless they are explicitly allowlisted by the user via `torch.serialization.add_safe_globals`. We recommend you start setting `weights_only=True` for any use case where you don't have full control of the loaded file. Please open an issue on GitHub for any issues related to this experimental feature.
  self.data, self.slices = torch.load(self.processed_paths[0])
