STDOUT:
Results will be saved in /home/philip/projects/ltspice_examples_code_repo/Circuit-Completion-Using-GNNs/component_classification_with_link_prediction_head/evaluation/FEGIN/results/model_FEGIN_dataset_ltspice_examples
Command line input: python main.py --data ltspice_examples --representation component_net --model FEGIN --layers 4 --hiddens 32 --batch_size 256 --lr 0.0001 --emb_size 512 --epochs 100 --save_appendix component_net_L4_H32_BS256_LR0.0001_E512 --no_val
 is saved.
-----
ltspice_examples - FEGIN
Using 4 layers, 32 hidden units, h = 2
Loading component_net representation dataset
ENTERED
Training FEGIN on component_net representation
Train: 3558, Test: 846
##################ITERATION #0 ****************************************
 epoch: 0, train_loss: 1.3614, test_loss: 1.3607, test_f1: 0.2270
 epoch: 1, train_loss: 1.3572, test_loss: 1.3602, test_f1: 0.2270
 epoch: 2, train_loss: 1.3549, test_loss: 1.3598, test_f1: 0.2270
 epoch: 3, train_loss: 1.3517, test_loss: 1.3572, test_f1: 0.2270
 epoch: 4, train_loss: 1.3491, test_loss: 1.3531, test_f1: 0.2270
 epoch: 5, train_loss: 1.3461, test_loss: 1.3482, test_f1: 0.2270
 epoch: 6, train_loss: 1.3440, test_loss: 1.3441, test_f1: 0.2270
 epoch: 7, train_loss: 1.3394, test_loss: 1.3404, test_f1: 0.2270
 epoch: 8, train_loss: 1.3358, test_loss: 1.3360, test_f1: 0.2270
 epoch: 9, train_loss: 1.3329, test_loss: 1.3316, test_f1: 0.2270
 epoch: 10, train_loss: 1.3286, test_loss: 1.3278, test_f1: 0.2270
 epoch: 11, train_loss: 1.3254, test_loss: 1.3246, test_f1: 0.2270
 epoch: 12, train_loss: 1.3212, test_loss: 1.3201, test_f1: 0.2270
 epoch: 13, train_loss: 1.3176, test_loss: 1.3156, test_f1: 0.2270
 epoch: 14, train_loss: 1.3137, test_loss: 1.3115, test_f1: 0.2270
 epoch: 15, train_loss: 1.3089, test_loss: 1.3079, test_f1: 0.2320
 epoch: 16, train_loss: 1.3057, test_loss: 1.3042, test_f1: 0.2344
 epoch: 17, train_loss: 1.3003, test_loss: 1.3004, test_f1: 0.2392
 epoch: 18, train_loss: 1.2971, test_loss: 1.2955, test_f1: 0.2461
 epoch: 19, train_loss: 1.2937, test_loss: 1.2912, test_f1: 0.2484
 epoch: 20, train_loss: 1.2891, test_loss: 1.2874, test_f1: 0.2570
 epoch: 21, train_loss: 1.2823, test_loss: 1.2838, test_f1: 0.2591
 epoch: 22, train_loss: 1.2814, test_loss: 1.2803, test_f1: 0.2631
 epoch: 23, train_loss: 1.2758, test_loss: 1.2759, test_f1: 0.2737
 epoch: 24, train_loss: 1.2706, test_loss: 1.2710, test_f1: 0.2781
 epoch: 25, train_loss: 1.2665, test_loss: 1.2670, test_f1: 0.2866
 epoch: 26, train_loss: 1.2604, test_loss: 1.2624, test_f1: 0.2866
 epoch: 27, train_loss: 1.2586, test_loss: 1.2567, test_f1: 0.2953
 epoch: 28, train_loss: 1.2540, test_loss: 1.2526, test_f1: 0.3111
 epoch: 29, train_loss: 1.2462, test_loss: 1.2477, test_f1: 0.3143
 epoch: 30, train_loss: 1.2428, test_loss: 1.2415, test_f1: 0.3203
 epoch: 31, train_loss: 1.2373, test_loss: 1.2360, test_f1: 0.3279
 epoch: 32, train_loss: 1.2316, test_loss: 1.2306, test_f1: 0.3421
 epoch: 33, train_loss: 1.2280, test_loss: 1.2239, test_f1: 0.3462
 epoch: 34, train_loss: 1.2218, test_loss: 1.2175, test_f1: 0.3536
 epoch: 35, train_loss: 1.2171, test_loss: 1.2112, test_f1: 0.3651
 epoch: 36, train_loss: 1.2150, test_loss: 1.2030, test_f1: 0.3706
 epoch: 37, train_loss: 1.2047, test_loss: 1.1971, test_f1: 0.3696
 epoch: 38, train_loss: 1.1988, test_loss: 1.1895, test_f1: 0.3688
 epoch: 39, train_loss: 1.1941, test_loss: 1.1821, test_f1: 0.3740
 epoch: 40, train_loss: 1.1885, test_loss: 1.1740, test_f1: 0.3862
 epoch: 41, train_loss: 1.1799, test_loss: 1.1670, test_f1: 0.3910
 epoch: 42, train_loss: 1.1741, test_loss: 1.1599, test_f1: 0.3957
 epoch: 43, train_loss: 1.1637, test_loss: 1.1524, test_f1: 0.3973
 epoch: 44, train_loss: 1.1577, test_loss: 1.1446, test_f1: 0.4034
 epoch: 45, train_loss: 1.1508, test_loss: 1.1366, test_f1: 0.4121
 epoch: 46, train_loss: 1.1488, test_loss: 1.1299, test_f1: 0.4119
 epoch: 47, train_loss: 1.1371, test_loss: 1.1199, test_f1: 0.4147
 epoch: 48, train_loss: 1.1299, test_loss: 1.1129, test_f1: 0.4216
 epoch: 49, train_loss: 1.1265, test_loss: 1.1078, test_f1: 0.4234
 epoch: 50, train_loss: 1.1203, test_loss: 1.1005, test_f1: 0.4395
 epoch: 51, train_loss: 1.1185, test_loss: 1.0953, test_f1: 0.4489
 epoch: 52, train_loss: 1.1131, test_loss: 1.0921, test_f1: 0.4527
 epoch: 53, train_loss: 1.1068, test_loss: 1.0870, test_f1: 0.4492
 epoch: 54, train_loss: 1.1032, test_loss: 1.0825, test_f1: 0.4538
 epoch: 55, train_loss: 1.1046, test_loss: 1.0797, test_f1: 0.4582
 epoch: 56, train_loss: 1.0988, test_loss: 1.0765, test_f1: 0.4612
 epoch: 57, train_loss: 1.0943, test_loss: 1.0725, test_f1: 0.4707
 epoch: 58, train_loss: 1.0879, test_loss: 1.0697, test_f1: 0.4644
 epoch: 59, train_loss: 1.0872, test_loss: 1.0664, test_f1: 0.4656
 epoch: 60, train_loss: 1.0817, test_loss: 1.0634, test_f1: 0.4728
 epoch: 61, train_loss: 1.0831, test_loss: 1.0589, test_f1: 0.4754
 epoch: 62, train_loss: 1.0765, test_loss: 1.0560, test_f1: 0.4763
 epoch: 63, train_loss: 1.0761, test_loss: 1.0531, test_f1: 0.4800
 epoch: 64, train_loss: 1.0747, test_loss: 1.0500, test_f1: 0.4793
 epoch: 65, train_loss: 1.0645, test_loss: 1.0460, test_f1: 0.4850
 epoch: 66, train_loss: 1.0598, test_loss: 1.0409, test_f1: 0.4863
 epoch: 67, train_loss: 1.0637, test_loss: 1.0389, test_f1: 0.4870
 epoch: 68, train_loss: 1.0634, test_loss: 1.0378, test_f1: 0.4914
 epoch: 69, train_loss: 1.0580, test_loss: 1.0321, test_f1: 0.4921
 epoch: 70, train_loss: 1.0579, test_loss: 1.0308, test_f1: 0.4942
 epoch: 71, train_loss: 1.0554, test_loss: 1.0269, test_f1: 0.4968
 epoch: 72, train_loss: 1.0547, test_loss: 1.0242, test_f1: 0.4951
 epoch: 73, train_loss: 1.0435, test_loss: 1.0218, test_f1: 0.4956
 epoch: 74, train_loss: 1.0424, test_loss: 1.0192, test_f1: 0.4967
 epoch: 75, train_loss: 1.0424, test_loss: 1.0173, test_f1: 0.5010
 epoch: 76, train_loss: 1.0413, test_loss: 1.0128, test_f1: 0.4984
 epoch: 77, train_loss: 1.0355, test_loss: 1.0091, test_f1: 0.4981
 epoch: 78, train_loss: 1.0312, test_loss: 1.0074, test_f1: 0.4996
 epoch: 79, train_loss: 1.0261, test_loss: 1.0032, test_f1: 0.5030
 epoch: 80, train_loss: 1.0271, test_loss: 1.0019, test_f1: 0.5019
 epoch: 81, train_loss: 1.0301, test_loss: 1.0004, test_f1: 0.5011
 epoch: 82, train_loss: 1.0232, test_loss: 0.9979, test_f1: 0.4986
 epoch: 83, train_loss: 1.0214, test_loss: 0.9926, test_f1: 0.5001
 epoch: 84, train_loss: 1.0148, test_loss: 0.9879, test_f1: 0.4995
 epoch: 85, train_loss: 1.0170, test_loss: 0.9871, test_f1: 0.5009
 epoch: 86, train_loss: 1.0083, test_loss: 0.9840, test_f1: 0.4957
 epoch: 87, train_loss: 1.0149, test_loss: 0.9814, test_f1: 0.4912
 epoch: 88, train_loss: 1.0086, test_loss: 0.9774, test_f1: 0.5013
 epoch: 89, train_loss: 1.0112, test_loss: 0.9791, test_f1: 0.4959
 epoch: 90, train_loss: 1.0016, test_loss: 0.9769, test_f1: 0.4948
 epoch: 91, train_loss: 0.9994, test_loss: 0.9756, test_f1: 0.4907
 epoch: 92, train_loss: 1.0006, test_loss: 0.9735, test_f1: 0.4920
 epoch: 93, train_loss: 0.9962, test_loss: 0.9698, test_f1: 0.4980
 epoch: 94, train_loss: 0.9971, test_loss: 0.9664, test_f1: 0.5012
 epoch: 95, train_loss: 0.9879, test_loss: 0.9665, test_f1: 0.4940
 epoch: 96, train_loss: 0.9902, test_loss: 0.9612, test_f1: 0.4994
 epoch: 97, train_loss: 0.9826, test_loss: 0.9604, test_f1: 0.5034
 epoch: 98, train_loss: 0.9862, test_loss: 0.9579, test_f1: 0.4999
 epoch: 99, train_loss: 0.9812, test_loss: 0.9573, test_f1: 0.5024
##################ITERATION #1 ****************************************
 epoch: 0, train_loss: 1.3276, test_loss: 1.3362, test_f1: 0.2270
 epoch: 1, train_loss: 1.3202, test_loss: 1.3313, test_f1: 0.2270
 epoch: 2, train_loss: 1.3166, test_loss: 1.3253, test_f1: 0.2270
 epoch: 3, train_loss: 1.3118, test_loss: 1.3186, test_f1: 0.2270
 epoch: 4, train_loss: 1.3071, test_loss: 1.3136, test_f1: 0.2270
 epoch: 5, train_loss: 1.3012, test_loss: 1.3074, test_f1: 0.2270
 epoch: 6, train_loss: 1.2975, test_loss: 1.3017, test_f1: 0.2270
 epoch: 7, train_loss: 1.2916, test_loss: 1.2958, test_f1: 0.2270
 epoch: 8, train_loss: 1.2844, test_loss: 1.2899, test_f1: 0.2270
 epoch: 9, train_loss: 1.2808, test_loss: 1.2837, test_f1: 0.2270
 epoch: 10, train_loss: 1.2762, test_loss: 1.2782, test_f1: 0.2270
 epoch: 11, train_loss: 1.2684, test_loss: 1.2723, test_f1: 0.2270
 epoch: 12, train_loss: 1.2659, test_loss: 1.2663, test_f1: 0.2270
 epoch: 13, train_loss: 1.2605, test_loss: 1.2601, test_f1: 0.2270
 epoch: 14, train_loss: 1.2542, test_loss: 1.2543, test_f1: 0.2270
 epoch: 15, train_loss: 1.2502, test_loss: 1.2483, test_f1: 0.2270
 epoch: 16, train_loss: 1.2426, test_loss: 1.2424, test_f1: 0.2270
 epoch: 17, train_loss: 1.2380, test_loss: 1.2366, test_f1: 0.2484
 epoch: 18, train_loss: 1.2356, test_loss: 1.2303, test_f1: 0.2570
 epoch: 19, train_loss: 1.2278, test_loss: 1.2244, test_f1: 0.2709
 epoch: 20, train_loss: 1.2270, test_loss: 1.2196, test_f1: 0.2728
 epoch: 21, train_loss: 1.2216, test_loss: 1.2142, test_f1: 0.2783
 epoch: 22, train_loss: 1.2171, test_loss: 1.2085, test_f1: 0.2819
 epoch: 23, train_loss: 1.2126, test_loss: 1.2035, test_f1: 0.2879
 epoch: 24, train_loss: 1.2031, test_loss: 1.1963, test_f1: 0.3157
 epoch: 25, train_loss: 1.1988, test_loss: 1.1910, test_f1: 0.3326
 epoch: 26, train_loss: 1.1964, test_loss: 1.1853, test_f1: 0.3427
 epoch: 27, train_loss: 1.1935, test_loss: 1.1800, test_f1: 0.3622
 epoch: 28, train_loss: 1.1869, test_loss: 1.1738, test_f1: 0.3772
 epoch: 29, train_loss: 1.1835, test_loss: 1.1673, test_f1: 0.3947
 epoch: 30, train_loss: 1.1732, test_loss: 1.1614, test_f1: 0.4055
 epoch: 31, train_loss: 1.1679, test_loss: 1.1547, test_f1: 0.4055
 epoch: 32, train_loss: 1.1644, test_loss: 1.1483, test_f1: 0.4158
 epoch: 33, train_loss: 1.1625, test_loss: 1.1410, test_f1: 0.4262
 epoch: 34, train_loss: 1.1571, test_loss: 1.1337, test_f1: 0.4251
 epoch: 35, train_loss: 1.1425, test_loss: 1.1266, test_f1: 0.4420
 epoch: 36, train_loss: 1.1399, test_loss: 1.1199, test_f1: 0.4561
 epoch: 37, train_loss: 1.1371, test_loss: 1.1126, test_f1: 0.4578
 epoch: 38, train_loss: 1.1262, test_loss: 1.1052, test_f1: 0.4618
 epoch: 39, train_loss: 1.1207, test_loss: 1.0988, test_f1: 0.4654
 epoch: 40, train_loss: 1.1130, test_loss: 1.0918, test_f1: 0.4679
 epoch: 41, train_loss: 1.1160, test_loss: 1.0904, test_f1: 0.4631
 epoch: 42, train_loss: 1.1041, test_loss: 1.0781, test_f1: 0.4779
 epoch: 43, train_loss: 1.0962, test_loss: 1.0703, test_f1: 0.4769
 epoch: 44, train_loss: 1.0916, test_loss: 1.0648, test_f1: 0.4763
 epoch: 45, train_loss: 1.0836, test_loss: 1.0602, test_f1: 0.4831
 epoch: 46, train_loss: 1.0797, test_loss: 1.0531, test_f1: 0.4806
 epoch: 47, train_loss: 1.0711, test_loss: 1.0514, test_f1: 0.4777
 epoch: 48, train_loss: 1.0681, test_loss: 1.0417, test_f1: 0.4851
 epoch: 49, train_loss: 1.0599, test_loss: 1.0413, test_f1: 0.4781
 epoch: 50, train_loss: 1.0542, test_loss: 1.0317, test_f1: 0.4826
 epoch: 51, train_loss: 1.0481, test_loss: 1.0278, test_f1: 0.4786
 epoch: 52, train_loss: 1.0431, test_loss: 1.0260, test_f1: 0.4787
 epoch: 53, train_loss: 1.0393, test_loss: 1.0242, test_f1: 0.4796
 epoch: 54, train_loss: 1.0406, test_loss: 1.0171, test_f1: 0.4821
 epoch: 55, train_loss: 1.0324, test_loss: 1.0197, test_f1: 0.4807
 epoch: 56, train_loss: 1.0346, test_loss: 1.0170, test_f1: 0.4787
 epoch: 57, train_loss: 1.0332, test_loss: 1.0173, test_f1: 0.4831
 epoch: 58, train_loss: 1.0262, test_loss: 1.0115, test_f1: 0.4786
 epoch: 59, train_loss: 1.0238, test_loss: 1.0122, test_f1: 0.4839
 epoch: 60, train_loss: 1.0148, test_loss: 1.0080, test_f1: 0.4830
 epoch: 61, train_loss: 1.0160, test_loss: 1.0026, test_f1: 0.4799
 epoch: 62, train_loss: 1.0179, test_loss: 1.0043, test_f1: 0.4837
 epoch: 63, train_loss: 1.0047, test_loss: 0.9995, test_f1: 0.4810
 epoch: 64, train_loss: 1.0117, test_loss: 0.9941, test_f1: 0.4892
 epoch: 65, train_loss: 1.0016, test_loss: 0.9952, test_f1: 0.4872
 epoch: 66, train_loss: 1.0024, test_loss: 0.9939, test_f1: 0.4841
 epoch: 67, train_loss: 1.0038, test_loss: 0.9902, test_f1: 0.4906
 epoch: 68, train_loss: 1.0045, test_loss: 0.9909, test_f1: 0.4867
 epoch: 69, train_loss: 0.9996, test_loss: 0.9874, test_f1: 0.4838
 epoch: 70, train_loss: 0.9963, test_loss: 0.9906, test_f1: 0.4843
 epoch: 71, train_loss: 0.9931, test_loss: 0.9848, test_f1: 0.4837
 epoch: 72, train_loss: 0.9914, test_loss: 0.9849, test_f1: 0.4855
 epoch: 73, train_loss: 0.9821, test_loss: 0.9805, test_f1: 0.4885
 epoch: 74, train_loss: 0.9803, test_loss: 0.9821, test_f1: 0.4879
 epoch: 75, train_loss: 0.9895, test_loss: 0.9828, test_f1: 0.4860
 epoch: 76, train_loss: 0.9789, test_loss: 0.9797, test_f1: 0.4838
 epoch: 77, train_loss: 0.9818, test_loss: 0.9765, test_f1: 0.4850
 epoch: 78, train_loss: 0.9852, test_loss: 0.9772, test_f1: 0.4826
 epoch: 79, train_loss: 0.9751, test_loss: 0.9707, test_f1: 0.4862
 epoch: 80, train_loss: 0.9787, test_loss: 0.9678, test_f1: 0.4902
 epoch: 81, train_loss: 0.9720, test_loss: 0.9705, test_f1: 0.4896
 epoch: 82, train_loss: 0.9700, test_loss: 0.9673, test_f1: 0.4891
 epoch: 83, train_loss: 0.9599, test_loss: 0.9649, test_f1: 0.4900
 epoch: 84, train_loss: 0.9685, test_loss: 0.9631, test_f1: 0.4836
 epoch: 85, train_loss: 0.9693, test_loss: 0.9673, test_f1: 0.4918
 epoch: 86, train_loss: 0.9637, test_loss: 0.9644, test_f1: 0.4921
 epoch: 87, train_loss: 0.9671, test_loss: 0.9626, test_f1: 0.4904
 epoch: 88, train_loss: 0.9596, test_loss: 0.9584, test_f1: 0.4924
 epoch: 89, train_loss: 0.9605, test_loss: 0.9594, test_f1: 0.4880
 epoch: 90, train_loss: 0.9528, test_loss: 0.9575, test_f1: 0.4827
 epoch: 91, train_loss: 0.9564, test_loss: 0.9555, test_f1: 0.4912
 epoch: 92, train_loss: 0.9439, test_loss: 0.9608, test_f1: 0.4892
 epoch: 93, train_loss: 0.9549, test_loss: 0.9618, test_f1: 0.4842
 epoch: 94, train_loss: 0.9483, test_loss: 0.9565, test_f1: 0.4932
 epoch: 95, train_loss: 0.9422, test_loss: 0.9536, test_f1: 0.4902
 epoch: 96, train_loss: 0.9453, test_loss: 0.9533, test_f1: 0.4855
 epoch: 97, train_loss: 0.9493, test_loss: 0.9511, test_f1: 0.4881
 epoch: 98, train_loss: 0.9407, test_loss: 0.9501, test_f1: 0.4853
 epoch: 99, train_loss: 0.9400, test_loss: 0.9501, test_f1: 0.4866
##################ITERATION #2 ****************************************
 epoch: 0, train_loss: 1.3193, test_loss: 1.3272, test_f1: 0.2270
 epoch: 1, train_loss: 1.3086, test_loss: 1.3250, test_f1: 0.2270
 epoch: 2, train_loss: 1.2994, test_loss: 1.3159, test_f1: 0.2270
 epoch: 3, train_loss: 1.2880, test_loss: 1.3040, test_f1: 0.2270
 epoch: 4, train_loss: 1.2844, test_loss: 1.2928, test_f1: 0.2270
 epoch: 5, train_loss: 1.2774, test_loss: 1.2814, test_f1: 0.2852
 epoch: 6, train_loss: 1.2709, test_loss: 1.2606, test_f1: 0.3146
 epoch: 7, train_loss: 1.2613, test_loss: 1.2450, test_f1: 0.3237
 epoch: 8, train_loss: 1.2565, test_loss: 1.2349, test_f1: 0.3276
 epoch: 9, train_loss: 1.2479, test_loss: 1.2279, test_f1: 0.3321
 epoch: 10, train_loss: 1.2399, test_loss: 1.2198, test_f1: 0.3341
 epoch: 11, train_loss: 1.2373, test_loss: 1.2129, test_f1: 0.3425
 epoch: 12, train_loss: 1.2311, test_loss: 1.2058, test_f1: 0.3457
 epoch: 13, train_loss: 1.2248, test_loss: 1.1990, test_f1: 0.3583
 epoch: 14, train_loss: 1.2187, test_loss: 1.1930, test_f1: 0.3635
 epoch: 15, train_loss: 1.2187, test_loss: 1.1880, test_f1: 0.3706
 epoch: 16, train_loss: 1.2098, test_loss: 1.1829, test_f1: 0.3650
 epoch: 17, train_loss: 1.2051, test_loss: 1.1772, test_f1: 0.3627
 epoch: 18, train_loss: 1.1961, test_loss: 1.1716, test_f1: 0.3643
 epoch: 19, train_loss: 1.1977, test_loss: 1.1674, test_f1: 0.3676
 epoch: 20, train_loss: 1.1879, test_loss: 1.1618, test_f1: 0.3820
 epoch: 21, train_loss: 1.1827, test_loss: 1.1557, test_f1: 0.3830
 epoch: 22, train_loss: 1.1843, test_loss: 1.1512, test_f1: 0.3779
 epoch: 23, train_loss: 1.1742, test_loss: 1.1478, test_f1: 0.3817
 epoch: 24, train_loss: 1.1731, test_loss: 1.1435, test_f1: 0.3869
 epoch: 25, train_loss: 1.1639, test_loss: 1.1379, test_f1: 0.3995
 epoch: 26, train_loss: 1.1622, test_loss: 1.1328, test_f1: 0.4018
 epoch: 27, train_loss: 1.1573, test_loss: 1.1281, test_f1: 0.4019
 epoch: 28, train_loss: 1.1534, test_loss: 1.1238, test_f1: 0.4045
 epoch: 29, train_loss: 1.1543, test_loss: 1.1192, test_f1: 0.4116
 epoch: 30, train_loss: 1.1430, test_loss: 1.1140, test_f1: 0.4113
 epoch: 31, train_loss: 1.1418, test_loss: 1.1103, test_f1: 0.4288
 epoch: 32, train_loss: 1.1329, test_loss: 1.1056, test_f1: 0.4275
 epoch: 33, train_loss: 1.1261, test_loss: 1.1013, test_f1: 0.4274
 epoch: 34, train_loss: 1.1252, test_loss: 1.0983, test_f1: 0.4386
 epoch: 35, train_loss: 1.1244, test_loss: 1.0935, test_f1: 0.4448
 epoch: 36, train_loss: 1.1240, test_loss: 1.0898, test_f1: 0.4497
 epoch: 37, train_loss: 1.1187, test_loss: 1.0842, test_f1: 0.4538
 epoch: 38, train_loss: 1.1145, test_loss: 1.0802, test_f1: 0.4604
 epoch: 39, train_loss: 1.1104, test_loss: 1.0791, test_f1: 0.4561
 epoch: 40, train_loss: 1.1033, test_loss: 1.0721, test_f1: 0.4645
 epoch: 41, train_loss: 1.0972, test_loss: 1.0674, test_f1: 0.4661
 epoch: 42, train_loss: 1.0901, test_loss: 1.0622, test_f1: 0.4717
 epoch: 43, train_loss: 1.0849, test_loss: 1.0584, test_f1: 0.4695
 epoch: 44, train_loss: 1.0851, test_loss: 1.0539, test_f1: 0.4703
 epoch: 45, train_loss: 1.0807, test_loss: 1.0492, test_f1: 0.4724
 epoch: 46, train_loss: 1.0730, test_loss: 1.0439, test_f1: 0.4700
 epoch: 47, train_loss: 1.0732, test_loss: 1.0442, test_f1: 0.4668
 epoch: 48, train_loss: 1.0631, test_loss: 1.0397, test_f1: 0.4648
 epoch: 49, train_loss: 1.0598, test_loss: 1.0368, test_f1: 0.4663
 epoch: 50, train_loss: 1.0597, test_loss: 1.0343, test_f1: 0.4603
 epoch: 51, train_loss: 1.0506, test_loss: 1.0307, test_f1: 0.4584
 epoch: 52, train_loss: 1.0535, test_loss: 1.0284, test_f1: 0.4604
 epoch: 53, train_loss: 1.0500, test_loss: 1.0259, test_f1: 0.4626
 epoch: 54, train_loss: 1.0466, test_loss: 1.0246, test_f1: 0.4700
 epoch: 55, train_loss: 1.0485, test_loss: 1.0230, test_f1: 0.4671
 epoch: 56, train_loss: 1.0410, test_loss: 1.0212, test_f1: 0.4678
 epoch: 57, train_loss: 1.0381, test_loss: 1.0190, test_f1: 0.4708
 epoch: 58, train_loss: 1.0399, test_loss: 1.0188, test_f1: 0.4728
 epoch: 59, train_loss: 1.0383, test_loss: 1.0194, test_f1: 0.4763
 epoch: 60, train_loss: 1.0323, test_loss: 1.0166, test_f1: 0.4802
 epoch: 61, train_loss: 1.0311, test_loss: 1.0146, test_f1: 0.4759
 epoch: 62, train_loss: 1.0299, test_loss: 1.0144, test_f1: 0.4778
 epoch: 63, train_loss: 1.0318, test_loss: 1.0131, test_f1: 0.4722
 epoch: 64, train_loss: 1.0249, test_loss: 1.0106, test_f1: 0.4754
 epoch: 65, train_loss: 1.0208, test_loss: 1.0091, test_f1: 0.4765
 epoch: 66, train_loss: 1.0221, test_loss: 1.0092, test_f1: 0.4793
 epoch: 67, train_loss: 1.0184, test_loss: 1.0062, test_f1: 0.4823
 epoch: 68, train_loss: 1.0177, test_loss: 1.0053, test_f1: 0.4796
 epoch: 69, train_loss: 1.0206, test_loss: 1.0058, test_f1: 0.4859
 epoch: 70, train_loss: 1.0144, test_loss: 1.0041, test_f1: 0.4787
 epoch: 71, train_loss: 1.0082, test_loss: 1.0035, test_f1: 0.4897
 epoch: 72, train_loss: 1.0124, test_loss: 1.0004, test_f1: 0.4848
 epoch: 73, train_loss: 1.0072, test_loss: 0.9989, test_f1: 0.4806
 epoch: 74, train_loss: 1.0081, test_loss: 0.9980, test_f1: 0.4822
 epoch: 75, train_loss: 1.0079, test_loss: 0.9985, test_f1: 0.4802
 epoch: 76, train_loss: 1.0048, test_loss: 0.9985, test_f1: 0.4888
 epoch: 77, train_loss: 1.0048, test_loss: 0.9955, test_f1: 0.4823
 epoch: 78, train_loss: 0.9994, test_loss: 0.9944, test_f1: 0.4931
 epoch: 79, train_loss: 1.0095, test_loss: 0.9928, test_f1: 0.4886
 epoch: 80, train_loss: 0.9952, test_loss: 0.9922, test_f1: 0.4916
 epoch: 81, train_loss: 0.9969, test_loss: 0.9905, test_f1: 0.4891
 epoch: 82, train_loss: 0.9962, test_loss: 0.9893, test_f1: 0.4862
 epoch: 83, train_loss: 0.9890, test_loss: 0.9896, test_f1: 0.4924
 epoch: 84, train_loss: 0.9955, test_loss: 0.9884, test_f1: 0.4897
 epoch: 85, train_loss: 0.9820, test_loss: 0.9852, test_f1: 0.4928
 epoch: 86, train_loss: 0.9937, test_loss: 0.9857, test_f1: 0.4919
 epoch: 87, train_loss: 0.9872, test_loss: 0.9855, test_f1: 0.4928
 epoch: 88, train_loss: 0.9888, test_loss: 0.9843, test_f1: 0.4917
 epoch: 89, train_loss: 0.9830, test_loss: 0.9833, test_f1: 0.4938
 epoch: 90, train_loss: 0.9802, test_loss: 0.9828, test_f1: 0.4899
 epoch: 91, train_loss: 0.9820, test_loss: 0.9811, test_f1: 0.4872
 epoch: 92, train_loss: 0.9814, test_loss: 0.9796, test_f1: 0.4932
 epoch: 93, train_loss: 0.9837, test_loss: 0.9766, test_f1: 0.4966
 epoch: 94, train_loss: 0.9783, test_loss: 0.9764, test_f1: 0.4897
 epoch: 95, train_loss: 0.9778, test_loss: 0.9774, test_f1: 0.4957
 epoch: 96, train_loss: 0.9821, test_loss: 0.9763, test_f1: 0.4970
 epoch: 97, train_loss: 0.9722, test_loss: 0.9739, test_f1: 0.4925
 epoch: 98, train_loss: 0.9711, test_loss: 0.9726, test_f1: 0.4985
 epoch: 99, train_loss: 0.9692, test_loss: 0.9730, test_f1: 0.4962
##################ITERATION #3 ****************************************
 epoch: 0, train_loss: 1.3126, test_loss: 1.3198, test_f1: 0.2270
 epoch: 1, train_loss: 1.2945, test_loss: 1.3191, test_f1: 0.2270
 epoch: 2, train_loss: 1.2857, test_loss: 1.3093, test_f1: 0.2270
 epoch: 3, train_loss: 1.2769, test_loss: 1.2907, test_f1: 0.2270
 epoch: 4, train_loss: 1.2672, test_loss: 1.2719, test_f1: 0.2270
 epoch: 5, train_loss: 1.2605, test_loss: 1.2529, test_f1: 0.2270
 epoch: 6, train_loss: 1.2513, test_loss: 1.2386, test_f1: 0.2466
 epoch: 7, train_loss: 1.2422, test_loss: 1.2275, test_f1: 0.2723
 epoch: 8, train_loss: 1.2366, test_loss: 1.2202, test_f1: 0.2788
 epoch: 9, train_loss: 1.2293, test_loss: 1.2130, test_f1: 0.2923
 epoch: 10, train_loss: 1.2216, test_loss: 1.2058, test_f1: 0.3155
 epoch: 11, train_loss: 1.2139, test_loss: 1.1988, test_f1: 0.3350
 epoch: 12, train_loss: 1.2078, test_loss: 1.1921, test_f1: 0.3600
 epoch: 13, train_loss: 1.2030, test_loss: 1.1827, test_f1: 0.3699
 epoch: 14, train_loss: 1.1921, test_loss: 1.1738, test_f1: 0.3925
 epoch: 15, train_loss: 1.1848, test_loss: 1.1660, test_f1: 0.4079
 epoch: 16, train_loss: 1.1766, test_loss: 1.1577, test_f1: 0.4132
 epoch: 17, train_loss: 1.1678, test_loss: 1.1512, test_f1: 0.4189
 epoch: 18, train_loss: 1.1644, test_loss: 1.1426, test_f1: 0.4218
 epoch: 19, train_loss: 1.1619, test_loss: 1.1350, test_f1: 0.4230
 epoch: 20, train_loss: 1.1518, test_loss: 1.1274, test_f1: 0.4292
 epoch: 21, train_loss: 1.1446, test_loss: 1.1205, test_f1: 0.4316
 epoch: 22, train_loss: 1.1336, test_loss: 1.1127, test_f1: 0.4390
 epoch: 23, train_loss: 1.1294, test_loss: 1.1049, test_f1: 0.4372
 epoch: 24, train_loss: 1.1195, test_loss: 1.0964, test_f1: 0.4471
 epoch: 25, train_loss: 1.1159, test_loss: 1.0883, test_f1: 0.4447
 epoch: 26, train_loss: 1.1094, test_loss: 1.0826, test_f1: 0.4492
 epoch: 27, train_loss: 1.1030, test_loss: 1.0756, test_f1: 0.4465
 epoch: 28, train_loss: 1.0978, test_loss: 1.0692, test_f1: 0.4369
 epoch: 29, train_loss: 1.0892, test_loss: 1.0633, test_f1: 0.4398
 epoch: 30, train_loss: 1.0845, test_loss: 1.0572, test_f1: 0.4374
 epoch: 31, train_loss: 1.0760, test_loss: 1.0524, test_f1: 0.4443
 epoch: 32, train_loss: 1.0710, test_loss: 1.0497, test_f1: 0.4419
 epoch: 33, train_loss: 1.0686, test_loss: 1.0439, test_f1: 0.4448
 epoch: 34, train_loss: 1.0598, test_loss: 1.0389, test_f1: 0.4491
 epoch: 35, train_loss: 1.0545, test_loss: 1.0287, test_f1: 0.4525
 epoch: 36, train_loss: 1.0445, test_loss: 1.0275, test_f1: 0.4570
 epoch: 37, train_loss: 1.0423, test_loss: 1.0232, test_f1: 0.4585
 epoch: 38, train_loss: 1.0271, test_loss: 1.0138, test_f1: 0.4593
 epoch: 39, train_loss: 1.0273, test_loss: 1.0089, test_f1: 0.4629
 epoch: 40, train_loss: 1.0235, test_loss: 1.0110, test_f1: 0.4645
 epoch: 41, train_loss: 1.0126, test_loss: 1.0076, test_f1: 0.4627
 epoch: 42, train_loss: 1.0160, test_loss: 1.0009, test_f1: 0.4642
 epoch: 43, train_loss: 1.0136, test_loss: 1.0018, test_f1: 0.4685
 epoch: 44, train_loss: 0.9975, test_loss: 0.9995, test_f1: 0.4631
 epoch: 45, train_loss: 1.0015, test_loss: 0.9937, test_f1: 0.4719
 epoch: 46, train_loss: 0.9932, test_loss: 0.9924, test_f1: 0.4723
 epoch: 47, train_loss: 0.9933, test_loss: 0.9858, test_f1: 0.4646
 epoch: 48, train_loss: 0.9943, test_loss: 0.9850, test_f1: 0.4747
 epoch: 49, train_loss: 0.9819, test_loss: 0.9859, test_f1: 0.4761
 epoch: 50, train_loss: 0.9799, test_loss: 0.9798, test_f1: 0.4802
 epoch: 51, train_loss: 0.9792, test_loss: 0.9809, test_f1: 0.4760
 epoch: 52, train_loss: 0.9747, test_loss: 0.9812, test_f1: 0.4768
 epoch: 53, train_loss: 0.9725, test_loss: 0.9777, test_f1: 0.4764
 epoch: 54, train_loss: 0.9649, test_loss: 0.9801, test_f1: 0.4783
 epoch: 55, train_loss: 0.9614, test_loss: 0.9749, test_f1: 0.4774
 epoch: 56, train_loss: 0.9739, test_loss: 0.9754, test_f1: 0.4800
 epoch: 57, train_loss: 0.9644, test_loss: 0.9768, test_f1: 0.4762
 epoch: 58, train_loss: 0.9684, test_loss: 0.9745, test_f1: 0.4773
 epoch: 59, train_loss: 0.9629, test_loss: 0.9700, test_f1: 0.4768
 epoch: 60, train_loss: 0.9630, test_loss: 0.9682, test_f1: 0.4805
 epoch: 61, train_loss: 0.9625, test_loss: 0.9704, test_f1: 0.4803
 epoch: 62, train_loss: 0.9624, test_loss: 0.9693, test_f1: 0.4775
 epoch: 63, train_loss: 0.9557, test_loss: 0.9727, test_f1: 0.4805
 epoch: 64, train_loss: 0.9533, test_loss: 0.9738, test_f1: 0.4827
 epoch: 65, train_loss: 0.9514, test_loss: 0.9727, test_f1: 0.4828
 epoch: 66, train_loss: 0.9524, test_loss: 0.9715, test_f1: 0.4826
 epoch: 67, train_loss: 0.9485, test_loss: 0.9637, test_f1: 0.4827
 epoch: 68, train_loss: 0.9558, test_loss: 0.9648, test_f1: 0.4816
 epoch: 69, train_loss: 0.9438, test_loss: 0.9678, test_f1: 0.4835
 epoch: 70, train_loss: 0.9476, test_loss: 0.9661, test_f1: 0.4811
 epoch: 71, train_loss: 0.9378, test_loss: 0.9633, test_f1: 0.4797
 epoch: 72, train_loss: 0.9439, test_loss: 0.9697, test_f1: 0.4770
 epoch: 73, train_loss: 0.9447, test_loss: 0.9657, test_f1: 0.4786
 epoch: 74, train_loss: 0.9431, test_loss: 0.9706, test_f1: 0.4791
 epoch: 75, train_loss: 0.9453, test_loss: 0.9659, test_f1: 0.4832
 epoch: 76, train_loss: 0.9403, test_loss: 0.9651, test_f1: 0.4837
 epoch: 77, train_loss: 0.9339, test_loss: 0.9648, test_f1: 0.4837
 epoch: 78, train_loss: 0.9375, test_loss: 0.9654, test_f1: 0.4837
 epoch: 79, train_loss: 0.9344, test_loss: 0.9643, test_f1: 0.4848
 epoch: 80, train_loss: 0.9316, test_loss: 0.9630, test_f1: 0.4856
 epoch: 81, train_loss: 0.9359, test_loss: 0.9614, test_f1: 0.4897
 epoch: 82, train_loss: 0.9290, test_loss: 0.9576, test_f1: 0.4870
 epoch: 83, train_loss: 0.9328, test_loss: 0.9623, test_f1: 0.4891
 epoch: 84, train_loss: 0.9261, test_loss: 0.9631, test_f1: 0.4887
 epoch: 85, train_loss: 0.9202, test_loss: 0.9662, test_f1: 0.4920
 epoch: 86, train_loss: 0.9177, test_loss: 0.9584, test_f1: 0.4878
 epoch: 87, train_loss: 0.9188, test_loss: 0.9557, test_f1: 0.4932
 epoch: 88, train_loss: 0.9253, test_loss: 0.9555, test_f1: 0.5011
 epoch: 89, train_loss: 0.9148, test_loss: 0.9557, test_f1: 0.5011
 epoch: 90, train_loss: 0.9165, test_loss: 0.9582, test_f1: 0.5034
 epoch: 91, train_loss: 0.9273, test_loss: 0.9618, test_f1: 0.5014
 epoch: 92, train_loss: 0.9190, test_loss: 0.9649, test_f1: 0.5000
 epoch: 93, train_loss: 0.9160, test_loss: 0.9599, test_f1: 0.5065
 epoch: 94, train_loss: 0.9153, test_loss: 0.9590, test_f1: 0.5020
 epoch: 95, train_loss: 0.9201, test_loss: 0.9600, test_f1: 0.5052
 epoch: 96, train_loss: 0.9071, test_loss: 0.9589, test_f1: 0.5021
 epoch: 97, train_loss: 0.9095, test_loss: 0.9575, test_f1: 0.5021
 epoch: 98, train_loss: 0.9074, test_loss: 0.9562, test_f1: 0.5084
 epoch: 99, train_loss: 0.9107, test_loss: 0.9558, test_f1: 0.5084
##################ITERATION #4 ****************************************
 epoch: 0, train_loss: 1.3047, test_loss: 1.3172, test_f1: 0.2270
 epoch: 1, train_loss: 1.2793, test_loss: 1.3078, test_f1: 0.2270
 epoch: 2, train_loss: 1.2660, test_loss: 1.2904, test_f1: 0.2270
 epoch: 3, train_loss: 1.2582, test_loss: 1.2659, test_f1: 0.2270
 epoch: 4, train_loss: 1.2480, test_loss: 1.2438, test_f1: 0.2374
 epoch: 5, train_loss: 1.2416, test_loss: 1.2224, test_f1: 0.2686
 epoch: 6, train_loss: 1.2374, test_loss: 1.2073, test_f1: 0.2963
 epoch: 7, train_loss: 1.2271, test_loss: 1.1973, test_f1: 0.3044
 epoch: 8, train_loss: 1.2215, test_loss: 1.1892, test_f1: 0.3059
 epoch: 9, train_loss: 1.2160, test_loss: 1.1801, test_f1: 0.3140
 epoch: 10, train_loss: 1.2101, test_loss: 1.1722, test_f1: 0.3293
 epoch: 11, train_loss: 1.2062, test_loss: 1.1638, test_f1: 0.3344
 epoch: 12, train_loss: 1.1943, test_loss: 1.1586, test_f1: 0.3443
 epoch: 13, train_loss: 1.1920, test_loss: 1.1512, test_f1: 0.3597
 epoch: 14, train_loss: 1.1863, test_loss: 1.1428, test_f1: 0.3789
 epoch: 15, train_loss: 1.1719, test_loss: 1.1352, test_f1: 0.3797
 epoch: 16, train_loss: 1.1610, test_loss: 1.1307, test_f1: 0.4009
 epoch: 17, train_loss: 1.1602, test_loss: 1.1236, test_f1: 0.4099
 epoch: 18, train_loss: 1.1575, test_loss: 1.1146, test_f1: 0.4093
 epoch: 19, train_loss: 1.1436, test_loss: 1.1071, test_f1: 0.4117
 epoch: 20, train_loss: 1.1427, test_loss: 1.1009, test_f1: 0.4187
 epoch: 21, train_loss: 1.1360, test_loss: 1.0935, test_f1: 0.4188
 epoch: 22, train_loss: 1.1267, test_loss: 1.0881, test_f1: 0.4197
 epoch: 23, train_loss: 1.1202, test_loss: 1.0799, test_f1: 0.4271
 epoch: 24, train_loss: 1.1155, test_loss: 1.0726, test_f1: 0.4409
 epoch: 25, train_loss: 1.1118, test_loss: 1.0667, test_f1: 0.4525
 epoch: 26, train_loss: 1.0963, test_loss: 1.0597, test_f1: 0.4521
 epoch: 27, train_loss: 1.0909, test_loss: 1.0553, test_f1: 0.4501
 epoch: 28, train_loss: 1.0907, test_loss: 1.0470, test_f1: 0.4541
 epoch: 29, train_loss: 1.0803, test_loss: 1.0422, test_f1: 0.4519
 epoch: 30, train_loss: 1.0774, test_loss: 1.0344, test_f1: 0.4597
 epoch: 31, train_loss: 1.0605, test_loss: 1.0289, test_f1: 0.4602
 epoch: 32, train_loss: 1.0574, test_loss: 1.0183, test_f1: 0.4686
 epoch: 33, train_loss: 1.0525, test_loss: 1.0144, test_f1: 0.4681
 epoch: 34, train_loss: 1.0436, test_loss: 1.0124, test_f1: 0.4642
 epoch: 35, train_loss: 1.0376, test_loss: 1.0054, test_f1: 0.4707
 epoch: 36, train_loss: 1.0365, test_loss: 0.9985, test_f1: 0.4704
 epoch: 37, train_loss: 1.0287, test_loss: 0.9964, test_f1: 0.4701
 epoch: 38, train_loss: 1.0277, test_loss: 0.9889, test_f1: 0.4729
 epoch: 39, train_loss: 1.0202, test_loss: 0.9833, test_f1: 0.4750
 epoch: 40, train_loss: 1.0196, test_loss: 0.9864, test_f1: 0.4766
 epoch: 41, train_loss: 1.0183, test_loss: 0.9782, test_f1: 0.4830
 epoch: 42, train_loss: 1.0106, test_loss: 0.9722, test_f1: 0.4861
 epoch: 43, train_loss: 0.9967, test_loss: 0.9684, test_f1: 0.4838
 epoch: 44, train_loss: 1.0014, test_loss: 0.9644, test_f1: 0.4867
 epoch: 45, train_loss: 0.9984, test_loss: 0.9639, test_f1: 0.4833
 epoch: 46, train_loss: 0.9921, test_loss: 0.9616, test_f1: 0.4833
 epoch: 47, train_loss: 0.9790, test_loss: 0.9578, test_f1: 0.4849
 epoch: 48, train_loss: 0.9854, test_loss: 0.9557, test_f1: 0.4860
 epoch: 49, train_loss: 0.9768, test_loss: 0.9552, test_f1: 0.4860
 epoch: 50, train_loss: 0.9755, test_loss: 0.9606, test_f1: 0.4805
 epoch: 51, train_loss: 0.9714, test_loss: 0.9518, test_f1: 0.4895
 epoch: 52, train_loss: 0.9767, test_loss: 0.9539, test_f1: 0.4869
 epoch: 53, train_loss: 0.9657, test_loss: 0.9524, test_f1: 0.4897
 epoch: 54, train_loss: 0.9524, test_loss: 0.9492, test_f1: 0.4956
 epoch: 55, train_loss: 0.9709, test_loss: 0.9474, test_f1: 0.4915
 epoch: 56, train_loss: 0.9687, test_loss: 0.9476, test_f1: 0.4967
 epoch: 57, train_loss: 0.9616, test_loss: 0.9454, test_f1: 0.4975
 epoch: 58, train_loss: 0.9594, test_loss: 0.9472, test_f1: 0.5017
 epoch: 59, train_loss: 0.9552, test_loss: 0.9481, test_f1: 0.4936
 epoch: 60, train_loss: 0.9516, test_loss: 0.9483, test_f1: 0.4939
 epoch: 61, train_loss: 0.9552, test_loss: 0.9516, test_f1: 0.4925
 epoch: 62, train_loss: 0.9558, test_loss: 0.9496, test_f1: 0.5009
 epoch: 63, train_loss: 0.9620, test_loss: 0.9500, test_f1: 0.4987
 epoch: 64, train_loss: 0.9494, test_loss: 0.9452, test_f1: 0.5050
 epoch: 65, train_loss: 0.9477, test_loss: 0.9481, test_f1: 0.5015
 epoch: 66, train_loss: 0.9482, test_loss: 0.9454, test_f1: 0.5018
 epoch: 67, train_loss: 0.9438, test_loss: 0.9463, test_f1: 0.4995
 epoch: 68, train_loss: 0.9518, test_loss: 0.9479, test_f1: 0.4985
 epoch: 69, train_loss: 0.9486, test_loss: 0.9470, test_f1: 0.4955
 epoch: 70, train_loss: 0.9344, test_loss: 0.9433, test_f1: 0.5056
 epoch: 71, train_loss: 0.9428, test_loss: 0.9445, test_f1: 0.4994
 epoch: 72, train_loss: 0.9392, test_loss: 0.9449, test_f1: 0.5016
 epoch: 73, train_loss: 0.9375, test_loss: 0.9437, test_f1: 0.5034
 epoch: 74, train_loss: 0.9440, test_loss: 0.9458, test_f1: 0.5018
 epoch: 75, train_loss: 0.9306, test_loss: 0.9453, test_f1: 0.5028
 epoch: 76, train_loss: 0.9437, test_loss: 0.9401, test_f1: 0.5081
 epoch: 77, train_loss: 0.9272, test_loss: 0.9422, test_f1: 0.5028
 epoch: 78, train_loss: 0.9331, test_loss: 0.9448, test_f1: 0.5035
 epoch: 79, train_loss: 0.9279, test_loss: 0.9429, test_f1: 0.5026
 epoch: 80, train_loss: 0.9321, test_loss: 0.9439, test_f1: 0.4975
 epoch: 81, train_loss: 0.9328, test_loss: 0.9438, test_f1: 0.4966
 epoch: 82, train_loss: 0.9275, test_loss: 0.9415, test_f1: 0.5081
 epoch: 83, train_loss: 0.9265, test_loss: 0.9441, test_f1: 0.4985
 epoch: 84, train_loss: 0.9307, test_loss: 0.9445, test_f1: 0.4985
 epoch: 85, train_loss: 0.9221, test_loss: 0.9449, test_f1: 0.5000
 epoch: 86, train_loss: 0.9231, test_loss: 0.9473, test_f1: 0.4977
 epoch: 87, train_loss: 0.9178, test_loss: 0.9444, test_f1: 0.4990
 epoch: 88, train_loss: 0.9131, test_loss: 0.9442, test_f1: 0.4945
 epoch: 89, train_loss: 0.9238, test_loss: 0.9462, test_f1: 0.4955
 epoch: 90, train_loss: 0.9209, test_loss: 0.9514, test_f1: 0.4933
 epoch: 91, train_loss: 0.9148, test_loss: 0.9485, test_f1: 0.4961
 epoch: 92, train_loss: 0.9198, test_loss: 0.9443, test_f1: 0.5012
 epoch: 93, train_loss: 0.9202, test_loss: 0.9427, test_f1: 0.5048
 epoch: 94, train_loss: 0.9114, test_loss: 0.9436, test_f1: 0.5081
 epoch: 95, train_loss: 0.9085, test_loss: 0.9449, test_f1: 0.5110
 epoch: 96, train_loss: 0.9215, test_loss: 0.9432, test_f1: 0.5048
 epoch: 97, train_loss: 0.9181, test_loss: 0.9486, test_f1: 0.4966
 epoch: 98, train_loss: 0.9071, test_loss: 0.9514, test_f1: 0.4940
 epoch: 99, train_loss: 0.9061, test_loss: 0.9495, test_f1: 0.5024
##################ITERATION #5 ****************************************
 epoch: 0, train_loss: 1.3077, test_loss: 1.3309, test_f1: 0.2270
 epoch: 1, train_loss: 1.2769, test_loss: 1.3321, test_f1: 0.2270
 epoch: 2, train_loss: 1.2671, test_loss: 1.3293, test_f1: 0.2270
 epoch: 3, train_loss: 1.2512, test_loss: 1.3293, test_f1: 0.2270
 epoch: 4, train_loss: 1.2368, test_loss: 1.3070, test_f1: 0.2532
 epoch: 5, train_loss: 1.2279, test_loss: 1.2431, test_f1: 0.2345
 epoch: 6, train_loss: 1.2202, test_loss: 1.1971, test_f1: 0.2957
 epoch: 7, train_loss: 1.2157, test_loss: 1.1784, test_f1: 0.3023
 epoch: 8, train_loss: 1.2030, test_loss: 1.1690, test_f1: 0.3051
 epoch: 9, train_loss: 1.1942, test_loss: 1.1590, test_f1: 0.3366
 epoch: 10, train_loss: 1.1878, test_loss: 1.1522, test_f1: 0.3507
 epoch: 11, train_loss: 1.1871, test_loss: 1.1444, test_f1: 0.3632
 epoch: 12, train_loss: 1.1719, test_loss: 1.1357, test_f1: 0.3712
 epoch: 13, train_loss: 1.1736, test_loss: 1.1305, test_f1: 0.3806
 epoch: 14, train_loss: 1.1588, test_loss: 1.1232, test_f1: 0.4015
 epoch: 15, train_loss: 1.1560, test_loss: 1.1121, test_f1: 0.4135
 epoch: 16, train_loss: 1.1490, test_loss: 1.1086, test_f1: 0.4209
 epoch: 17, train_loss: 1.1438, test_loss: 1.1016, test_f1: 0.4243
 epoch: 18, train_loss: 1.1397, test_loss: 1.0951, test_f1: 0.4309
 epoch: 19, train_loss: 1.1330, test_loss: 1.0888, test_f1: 0.4462
 epoch: 20, train_loss: 1.1286, test_loss: 1.0855, test_f1: 0.4536
 epoch: 21, train_loss: 1.1202, test_loss: 1.0760, test_f1: 0.4554
 epoch: 22, train_loss: 1.1133, test_loss: 1.0698, test_f1: 0.4606
 epoch: 23, train_loss: 1.1138, test_loss: 1.0645, test_f1: 0.4599
 epoch: 24, train_loss: 1.1060, test_loss: 1.0604, test_f1: 0.4536
 epoch: 25, train_loss: 1.1051, test_loss: 1.0589, test_f1: 0.4521
 epoch: 26, train_loss: 1.1017, test_loss: 1.0513, test_f1: 0.4596
 epoch: 27, train_loss: 1.0880, test_loss: 1.0464, test_f1: 0.4548
 epoch: 28, train_loss: 1.0866, test_loss: 1.0383, test_f1: 0.4665
 epoch: 29, train_loss: 1.0837, test_loss: 1.0325, test_f1: 0.4688
 epoch: 30, train_loss: 1.0777, test_loss: 1.0304, test_f1: 0.4575
 epoch: 31, train_loss: 1.0729, test_loss: 1.0234, test_f1: 0.4718
 epoch: 32, train_loss: 1.0716, test_loss: 1.0217, test_f1: 0.4635
 epoch: 33, train_loss: 1.0613, test_loss: 1.0174, test_f1: 0.4578
 epoch: 34, train_loss: 1.0567, test_loss: 1.0099, test_f1: 0.4636
 epoch: 35, train_loss: 1.0509, test_loss: 1.0079, test_f1: 0.4669
 epoch: 36, train_loss: 1.0439, test_loss: 1.0040, test_f1: 0.4676
 epoch: 37, train_loss: 1.0427, test_loss: 1.0038, test_f1: 0.4700
 epoch: 38, train_loss: 1.0391, test_loss: 0.9964, test_f1: 0.4730
 epoch: 39, train_loss: 1.0405, test_loss: 0.9975, test_f1: 0.4651
 epoch: 40, train_loss: 1.0358, test_loss: 0.9936, test_f1: 0.4747
 epoch: 41, train_loss: 1.0274, test_loss: 0.9887, test_f1: 0.4751
 epoch: 42, train_loss: 1.0303, test_loss: 0.9821, test_f1: 0.4770
 epoch: 43, train_loss: 1.0291, test_loss: 0.9828, test_f1: 0.4747
 epoch: 44, train_loss: 1.0138, test_loss: 0.9798, test_f1: 0.4767
 epoch: 45, train_loss: 1.0091, test_loss: 0.9765, test_f1: 0.4757
 epoch: 46, train_loss: 1.0060, test_loss: 0.9731, test_f1: 0.4794
 epoch: 47, train_loss: 1.0023, test_loss: 0.9749, test_f1: 0.4898
 epoch: 48, train_loss: 1.0065, test_loss: 0.9688, test_f1: 0.4840
 epoch: 49, train_loss: 1.0043, test_loss: 0.9668, test_f1: 0.4870
 epoch: 50, train_loss: 0.9940, test_loss: 0.9690, test_f1: 0.4865
 epoch: 51, train_loss: 0.9924, test_loss: 0.9667, test_f1: 0.4838
 epoch: 52, train_loss: 0.9901, test_loss: 0.9674, test_f1: 0.4891
 epoch: 53, train_loss: 0.9882, test_loss: 0.9646, test_f1: 0.4870
 epoch: 54, train_loss: 0.9853, test_loss: 0.9673, test_f1: 0.4868
 epoch: 55, train_loss: 0.9970, test_loss: 0.9617, test_f1: 0.4887
 epoch: 56, train_loss: 0.9689, test_loss: 0.9608, test_f1: 0.4870
 epoch: 57, train_loss: 0.9877, test_loss: 0.9602, test_f1: 0.4873
 epoch: 58, train_loss: 0.9819, test_loss: 0.9592, test_f1: 0.4886
 epoch: 59, train_loss: 0.9686, test_loss: 0.9596, test_f1: 0.4862
 epoch: 60, train_loss: 0.9815, test_loss: 0.9576, test_f1: 0.4939
 epoch: 61, train_loss: 0.9770, test_loss: 0.9570, test_f1: 0.4916
 epoch: 62, train_loss: 0.9714, test_loss: 0.9562, test_f1: 0.4934
 epoch: 63, train_loss: 0.9679, test_loss: 0.9545, test_f1: 0.4839
 epoch: 64, train_loss: 0.9653, test_loss: 0.9539, test_f1: 0.4892
 epoch: 65, train_loss: 0.9714, test_loss: 0.9533, test_f1: 0.4956
 epoch: 66, train_loss: 0.9703, test_loss: 0.9535, test_f1: 0.4926
 epoch: 67, train_loss: 0.9693, test_loss: 0.9504, test_f1: 0.4880
 epoch: 68, train_loss: 0.9608, test_loss: 0.9508, test_f1: 0.4877
 epoch: 69, train_loss: 0.9702, test_loss: 0.9548, test_f1: 0.4861
 epoch: 70, train_loss: 0.9627, test_loss: 0.9520, test_f1: 0.4901
 epoch: 71, train_loss: 0.9732, test_loss: 0.9452, test_f1: 0.4871
 epoch: 72, train_loss: 0.9604, test_loss: 0.9502, test_f1: 0.4871
 epoch: 73, train_loss: 0.9563, test_loss: 0.9502, test_f1: 0.4917
 epoch: 74, train_loss: 0.9620, test_loss: 0.9509, test_f1: 0.4867
 epoch: 75, train_loss: 0.9529, test_loss: 0.9494, test_f1: 0.4895
 epoch: 76, train_loss: 0.9473, test_loss: 0.9481, test_f1: 0.4875
 epoch: 77, train_loss: 0.9453, test_loss: 0.9497, test_f1: 0.4878
 epoch: 78, train_loss: 0.9549, test_loss: 0.9523, test_f1: 0.4886
 epoch: 79, train_loss: 0.9495, test_loss: 0.9553, test_f1: 0.4834
 epoch: 80, train_loss: 0.9504, test_loss: 0.9541, test_f1: 0.4885
 epoch: 81, train_loss: 0.9555, test_loss: 0.9481, test_f1: 0.4863
 epoch: 82, train_loss: 0.9521, test_loss: 0.9496, test_f1: 0.4937
 epoch: 83, train_loss: 0.9485, test_loss: 0.9491, test_f1: 0.4887
 epoch: 84, train_loss: 0.9421, test_loss: 0.9479, test_f1: 0.4841
 epoch: 85, train_loss: 0.9446, test_loss: 0.9474, test_f1: 0.4895
 epoch: 86, train_loss: 0.9454, test_loss: 0.9449, test_f1: 0.4958
 epoch: 87, train_loss: 0.9430, test_loss: 0.9526, test_f1: 0.4924
 epoch: 88, train_loss: 0.9419, test_loss: 0.9539, test_f1: 0.4835
 epoch: 89, train_loss: 0.9395, test_loss: 0.9532, test_f1: 0.4854
 epoch: 90, train_loss: 0.9438, test_loss: 0.9539, test_f1: 0.4944
 epoch: 91, train_loss: 0.9382, test_loss: 0.9516, test_f1: 0.4995
 epoch: 92, train_loss: 0.9381, test_loss: 0.9499, test_f1: 0.4938
 epoch: 93, train_loss: 0.9325, test_loss: 0.9518, test_f1: 0.4870
 epoch: 94, train_loss: 0.9421, test_loss: 0.9488, test_f1: 0.4851
 epoch: 95, train_loss: 0.9359, test_loss: 0.9488, test_f1: 0.4992
 epoch: 96, train_loss: 0.9377, test_loss: 0.9539, test_f1: 0.4956
 epoch: 97, train_loss: 0.9370, test_loss: 0.9518, test_f1: 0.4932
 epoch: 98, train_loss: 0.9339, test_loss: 0.9464, test_f1: 0.4977
 epoch: 99, train_loss: 0.9298, test_loss: 0.9567, test_f1: 0.4933
##################ITERATION #6 ****************************************
 epoch: 0, train_loss: 1.3232, test_loss: 1.3130, test_f1: 0.2270
 epoch: 1, train_loss: 1.2804, test_loss: 1.3132, test_f1: 0.2270
 epoch: 2, train_loss: 1.2664, test_loss: 1.2963, test_f1: 0.2270
 epoch: 3, train_loss: 1.2436, test_loss: 1.2664, test_f1: 0.2270
 epoch: 4, train_loss: 1.2338, test_loss: 1.2238, test_f1: 0.2690
 epoch: 5, train_loss: 1.2292, test_loss: 1.1944, test_f1: 0.2783
 epoch: 6, train_loss: 1.2160, test_loss: 1.1763, test_f1: 0.2929
 epoch: 7, train_loss: 1.2064, test_loss: 1.1669, test_f1: 0.3045
 epoch: 8, train_loss: 1.1959, test_loss: 1.1565, test_f1: 0.3221
 epoch: 9, train_loss: 1.1899, test_loss: 1.1492, test_f1: 0.3311
 epoch: 10, train_loss: 1.1831, test_loss: 1.1406, test_f1: 0.3468
 epoch: 11, train_loss: 1.1770, test_loss: 1.1339, test_f1: 0.3590
 epoch: 12, train_loss: 1.1681, test_loss: 1.1245, test_f1: 0.3638
 epoch: 13, train_loss: 1.1612, test_loss: 1.1170, test_f1: 0.3738
 epoch: 14, train_loss: 1.1505, test_loss: 1.1088, test_f1: 0.3772
 epoch: 15, train_loss: 1.1454, test_loss: 1.1000, test_f1: 0.3958
 epoch: 16, train_loss: 1.1423, test_loss: 1.0916, test_f1: 0.4026
 epoch: 17, train_loss: 1.1378, test_loss: 1.0850, test_f1: 0.4230
 epoch: 18, train_loss: 1.1261, test_loss: 1.0774, test_f1: 0.4247
 epoch: 19, train_loss: 1.1221, test_loss: 1.0714, test_f1: 0.4251
 epoch: 20, train_loss: 1.1253, test_loss: 1.0647, test_f1: 0.4300
 epoch: 21, train_loss: 1.1061, test_loss: 1.0596, test_f1: 0.4359
 epoch: 22, train_loss: 1.1079, test_loss: 1.0547, test_f1: 0.4444
 epoch: 23, train_loss: 1.1041, test_loss: 1.0480, test_f1: 0.4457
 epoch: 24, train_loss: 1.0913, test_loss: 1.0420, test_f1: 0.4478
 epoch: 25, train_loss: 1.0902, test_loss: 1.0389, test_f1: 0.4537
 epoch: 26, train_loss: 1.0786, test_loss: 1.0334, test_f1: 0.4569
 epoch: 27, train_loss: 1.0844, test_loss: 1.0263, test_f1: 0.4536
 epoch: 28, train_loss: 1.0814, test_loss: 1.0194, test_f1: 0.4599
 epoch: 29, train_loss: 1.0652, test_loss: 1.0180, test_f1: 0.4590
 epoch: 30, train_loss: 1.0599, test_loss: 1.0152, test_f1: 0.4715
 epoch: 31, train_loss: 1.0574, test_loss: 1.0118, test_f1: 0.4587
 epoch: 32, train_loss: 1.0498, test_loss: 1.0091, test_f1: 0.4536
 epoch: 33, train_loss: 1.0526, test_loss: 1.0037, test_f1: 0.4610
 epoch: 34, train_loss: 1.0472, test_loss: 0.9989, test_f1: 0.4643
 epoch: 35, train_loss: 1.0531, test_loss: 0.9985, test_f1: 0.4592
 epoch: 36, train_loss: 1.0376, test_loss: 0.9931, test_f1: 0.4598
 epoch: 37, train_loss: 1.0327, test_loss: 0.9877, test_f1: 0.4658
 epoch: 38, train_loss: 1.0340, test_loss: 0.9865, test_f1: 0.4608
 epoch: 39, train_loss: 1.0261, test_loss: 0.9842, test_f1: 0.4605
 epoch: 40, train_loss: 1.0232, test_loss: 0.9790, test_f1: 0.4634
 epoch: 41, train_loss: 1.0178, test_loss: 0.9764, test_f1: 0.4736
 epoch: 42, train_loss: 1.0116, test_loss: 0.9732, test_f1: 0.4748
 epoch: 43, train_loss: 1.0141, test_loss: 0.9696, test_f1: 0.4780
 epoch: 44, train_loss: 1.0040, test_loss: 0.9643, test_f1: 0.4928
 epoch: 45, train_loss: 1.0051, test_loss: 0.9623, test_f1: 0.4920
 epoch: 46, train_loss: 0.9941, test_loss: 0.9613, test_f1: 0.4741
 epoch: 47, train_loss: 0.9924, test_loss: 0.9583, test_f1: 0.4901
 epoch: 48, train_loss: 0.9901, test_loss: 0.9505, test_f1: 0.5070
 epoch: 49, train_loss: 0.9974, test_loss: 0.9491, test_f1: 0.5076
 epoch: 50, train_loss: 0.9874, test_loss: 0.9447, test_f1: 0.5082
 epoch: 51, train_loss: 0.9902, test_loss: 0.9438, test_f1: 0.5081
 epoch: 52, train_loss: 0.9762, test_loss: 0.9424, test_f1: 0.5120
 epoch: 53, train_loss: 0.9778, test_loss: 0.9421, test_f1: 0.5129
 epoch: 54, train_loss: 0.9817, test_loss: 0.9401, test_f1: 0.5119
 epoch: 55, train_loss: 0.9824, test_loss: 0.9400, test_f1: 0.5147
 epoch: 56, train_loss: 0.9742, test_loss: 0.9375, test_f1: 0.5057
 epoch: 57, train_loss: 0.9790, test_loss: 0.9381, test_f1: 0.5150
 epoch: 58, train_loss: 0.9771, test_loss: 0.9357, test_f1: 0.5157
 epoch: 59, train_loss: 0.9767, test_loss: 0.9347, test_f1: 0.5154
 epoch: 60, train_loss: 0.9786, test_loss: 0.9334, test_f1: 0.5162
 epoch: 61, train_loss: 0.9807, test_loss: 0.9345, test_f1: 0.5149
 epoch: 62, train_loss: 0.9719, test_loss: 0.9321, test_f1: 0.5200
 epoch: 63, train_loss: 0.9647, test_loss: 0.9300, test_f1: 0.5195
 epoch: 64, train_loss: 0.9642, test_loss: 0.9281, test_f1: 0.5230
 epoch: 65, train_loss: 0.9642, test_loss: 0.9270, test_f1: 0.5258
 epoch: 66, train_loss: 0.9613, test_loss: 0.9267, test_f1: 0.5251
 epoch: 67, train_loss: 0.9587, test_loss: 0.9245, test_f1: 0.5248
 epoch: 68, train_loss: 0.9597, test_loss: 0.9250, test_f1: 0.5266
 epoch: 69, train_loss: 0.9571, test_loss: 0.9250, test_f1: 0.5206
 epoch: 70, train_loss: 0.9656, test_loss: 0.9254, test_f1: 0.5252
 epoch: 71, train_loss: 0.9631, test_loss: 0.9244, test_f1: 0.5198
 epoch: 72, train_loss: 0.9569, test_loss: 0.9219, test_f1: 0.5195
 epoch: 73, train_loss: 0.9591, test_loss: 0.9191, test_f1: 0.5260
 epoch: 74, train_loss: 0.9592, test_loss: 0.9206, test_f1: 0.5225
 epoch: 75, train_loss: 0.9505, test_loss: 0.9214, test_f1: 0.5306
 epoch: 76, train_loss: 0.9600, test_loss: 0.9185, test_f1: 0.5277
 epoch: 77, train_loss: 0.9474, test_loss: 0.9171, test_f1: 0.5298
 epoch: 78, train_loss: 0.9512, test_loss: 0.9168, test_f1: 0.5254
 epoch: 79, train_loss: 0.9484, test_loss: 0.9142, test_f1: 0.5284
 epoch: 80, train_loss: 0.9403, test_loss: 0.9148, test_f1: 0.5260
 epoch: 81, train_loss: 0.9423, test_loss: 0.9115, test_f1: 0.5268
 epoch: 82, train_loss: 0.9394, test_loss: 0.9110, test_f1: 0.5278
 epoch: 83, train_loss: 0.9444, test_loss: 0.9116, test_f1: 0.5288
 epoch: 84, train_loss: 0.9479, test_loss: 0.9102, test_f1: 0.5272
 epoch: 85, train_loss: 0.9428, test_loss: 0.9111, test_f1: 0.5253
 epoch: 86, train_loss: 0.9402, test_loss: 0.9101, test_f1: 0.5284
 epoch: 87, train_loss: 0.9443, test_loss: 0.9109, test_f1: 0.5239
 epoch: 88, train_loss: 0.9345, test_loss: 0.9077, test_f1: 0.5250
 epoch: 89, train_loss: 0.9341, test_loss: 0.9084, test_f1: 0.5251
 epoch: 90, train_loss: 0.9440, test_loss: 0.9093, test_f1: 0.5235
 epoch: 91, train_loss: 0.9335, test_loss: 0.9065, test_f1: 0.5288
 epoch: 92, train_loss: 0.9359, test_loss: 0.9058, test_f1: 0.5195
 epoch: 93, train_loss: 0.9324, test_loss: 0.9064, test_f1: 0.5224
 epoch: 94, train_loss: 0.9382, test_loss: 0.9089, test_f1: 0.5179
 epoch: 95, train_loss: 0.9302, test_loss: 0.9086, test_f1: 0.5224
 epoch: 96, train_loss: 0.9250, test_loss: 0.9093, test_f1: 0.5160
 epoch: 97, train_loss: 0.9316, test_loss: 0.9063, test_f1: 0.5242
 epoch: 98, train_loss: 0.9271, test_loss: 0.9046, test_f1: 0.5265
 epoch: 99, train_loss: 0.9222, test_loss: 0.9067, test_f1: 0.5240
##################ITERATION #7 ****************************************
 epoch: 0, train_loss: 1.3631, test_loss: 1.3360, test_f1: 0.2270
 epoch: 1, train_loss: 1.3122, test_loss: 1.3198, test_f1: 0.2270
 epoch: 2, train_loss: 1.2802, test_loss: 1.3115, test_f1: 0.2270
 epoch: 3, train_loss: 1.2731, test_loss: 1.2835, test_f1: 0.2270
 epoch: 4, train_loss: 1.2522, test_loss: 1.2431, test_f1: 0.2270
 epoch: 5, train_loss: 1.2360, test_loss: 1.2179, test_f1: 0.2392
 epoch: 6, train_loss: 1.2284, test_loss: 1.2070, test_f1: 0.2549
 epoch: 7, train_loss: 1.2214, test_loss: 1.1963, test_f1: 0.2764
 epoch: 8, train_loss: 1.2116, test_loss: 1.1852, test_f1: 0.3060
 epoch: 9, train_loss: 1.1973, test_loss: 1.1765, test_f1: 0.3376
 epoch: 10, train_loss: 1.1915, test_loss: 1.1676, test_f1: 0.3512
 epoch: 11, train_loss: 1.1836, test_loss: 1.1569, test_f1: 0.3702
 epoch: 12, train_loss: 1.1805, test_loss: 1.1482, test_f1: 0.3765
 epoch: 13, train_loss: 1.1785, test_loss: 1.1388, test_f1: 0.4012
 epoch: 14, train_loss: 1.1603, test_loss: 1.1310, test_f1: 0.4170
 epoch: 15, train_loss: 1.1552, test_loss: 1.1223, test_f1: 0.4315
 epoch: 16, train_loss: 1.1476, test_loss: 1.1146, test_f1: 0.4301
 epoch: 17, train_loss: 1.1332, test_loss: 1.1049, test_f1: 0.4321
 epoch: 18, train_loss: 1.1264, test_loss: 1.0931, test_f1: 0.4370
 epoch: 19, train_loss: 1.1167, test_loss: 1.0849, test_f1: 0.4420
 epoch: 20, train_loss: 1.1146, test_loss: 1.0780, test_f1: 0.4420
 epoch: 21, train_loss: 1.1043, test_loss: 1.0720, test_f1: 0.4419
 epoch: 22, train_loss: 1.0967, test_loss: 1.0644, test_f1: 0.4469
 epoch: 23, train_loss: 1.0839, test_loss: 1.0566, test_f1: 0.4571
 epoch: 24, train_loss: 1.0869, test_loss: 1.0476, test_f1: 0.4591
 epoch: 25, train_loss: 1.0823, test_loss: 1.0407, test_f1: 0.4604
 epoch: 26, train_loss: 1.0720, test_loss: 1.0336, test_f1: 0.4671
 epoch: 27, train_loss: 1.0696, test_loss: 1.0265, test_f1: 0.4622
 epoch: 28, train_loss: 1.0590, test_loss: 1.0215, test_f1: 0.4635
 epoch: 29, train_loss: 1.0567, test_loss: 1.0152, test_f1: 0.4644
 epoch: 30, train_loss: 1.0480, test_loss: 1.0096, test_f1: 0.4643
 epoch: 31, train_loss: 1.0495, test_loss: 1.0053, test_f1: 0.4711
 epoch: 32, train_loss: 1.0395, test_loss: 1.0008, test_f1: 0.4658
 epoch: 33, train_loss: 1.0310, test_loss: 0.9947, test_f1: 0.4735
 epoch: 34, train_loss: 1.0246, test_loss: 0.9903, test_f1: 0.4731
 epoch: 35, train_loss: 1.0259, test_loss: 0.9881, test_f1: 0.4731
 epoch: 36, train_loss: 1.0137, test_loss: 0.9874, test_f1: 0.4825
 epoch: 37, train_loss: 1.0143, test_loss: 0.9852, test_f1: 0.4800
 epoch: 38, train_loss: 1.0087, test_loss: 0.9793, test_f1: 0.4820
 epoch: 39, train_loss: 1.0018, test_loss: 0.9752, test_f1: 0.4819
 epoch: 40, train_loss: 1.0074, test_loss: 0.9730, test_f1: 0.4900
 epoch: 41, train_loss: 0.9922, test_loss: 0.9761, test_f1: 0.4878
 epoch: 42, train_loss: 1.0011, test_loss: 0.9770, test_f1: 0.4807
 epoch: 43, train_loss: 0.9882, test_loss: 0.9720, test_f1: 0.4811
 epoch: 44, train_loss: 0.9850, test_loss: 0.9751, test_f1: 0.4896
 epoch: 45, train_loss: 0.9821, test_loss: 0.9733, test_f1: 0.4873
 epoch: 46, train_loss: 0.9817, test_loss: 0.9685, test_f1: 0.4921
 epoch: 47, train_loss: 0.9774, test_loss: 0.9662, test_f1: 0.5038
 epoch: 48, train_loss: 0.9742, test_loss: 0.9632, test_f1: 0.4987
 epoch: 49, train_loss: 0.9732, test_loss: 0.9598, test_f1: 0.5026
 epoch: 50, train_loss: 0.9656, test_loss: 0.9606, test_f1: 0.5041
 epoch: 51, train_loss: 0.9593, test_loss: 0.9590, test_f1: 0.5039
 epoch: 52, train_loss: 0.9708, test_loss: 0.9641, test_f1: 0.5023
 epoch: 53, train_loss: 0.9721, test_loss: 0.9679, test_f1: 0.5062
 epoch: 54, train_loss: 0.9620, test_loss: 0.9683, test_f1: 0.4972
 epoch: 55, train_loss: 0.9599, test_loss: 0.9657, test_f1: 0.5010
 epoch: 56, train_loss: 0.9555, test_loss: 0.9623, test_f1: 0.5031
 epoch: 57, train_loss: 0.9592, test_loss: 0.9624, test_f1: 0.5047
 epoch: 58, train_loss: 0.9496, test_loss: 0.9648, test_f1: 0.5009
 epoch: 59, train_loss: 0.9559, test_loss: 0.9602, test_f1: 0.5006
 epoch: 60, train_loss: 0.9580, test_loss: 0.9628, test_f1: 0.5038
 epoch: 61, train_loss: 0.9535, test_loss: 0.9626, test_f1: 0.5070
 epoch: 62, train_loss: 0.9546, test_loss: 0.9617, test_f1: 0.5038
 epoch: 63, train_loss: 0.9618, test_loss: 0.9579, test_f1: 0.5058
 epoch: 64, train_loss: 0.9598, test_loss: 0.9654, test_f1: 0.5071
 epoch: 65, train_loss: 0.9558, test_loss: 0.9652, test_f1: 0.5092
 epoch: 66, train_loss: 0.9525, test_loss: 0.9609, test_f1: 0.5075
 epoch: 67, train_loss: 0.9529, test_loss: 0.9597, test_f1: 0.5090
 epoch: 68, train_loss: 0.9461, test_loss: 0.9594, test_f1: 0.5076
 epoch: 69, train_loss: 0.9478, test_loss: 0.9598, test_f1: 0.5061
 epoch: 70, train_loss: 0.9424, test_loss: 0.9694, test_f1: 0.5081
 epoch: 71, train_loss: 0.9493, test_loss: 0.9642, test_f1: 0.5088
 epoch: 72, train_loss: 0.9416, test_loss: 0.9646, test_f1: 0.5070
 epoch: 73, train_loss: 0.9444, test_loss: 0.9656, test_f1: 0.5103
 epoch: 74, train_loss: 0.9427, test_loss: 0.9661, test_f1: 0.5021
 epoch: 75, train_loss: 0.9441, test_loss: 0.9611, test_f1: 0.5023
 epoch: 76, train_loss: 0.9342, test_loss: 0.9676, test_f1: 0.5075
 epoch: 77, train_loss: 0.9370, test_loss: 0.9660, test_f1: 0.5111
 epoch: 78, train_loss: 0.9342, test_loss: 0.9637, test_f1: 0.5111
 epoch: 79, train_loss: 0.9363, test_loss: 0.9642, test_f1: 0.5050
 epoch: 80, train_loss: 0.9328, test_loss: 0.9694, test_f1: 0.5015
 epoch: 81, train_loss: 0.9392, test_loss: 0.9671, test_f1: 0.5106
 epoch: 82, train_loss: 0.9364, test_loss: 0.9643, test_f1: 0.5022
 epoch: 83, train_loss: 0.9337, test_loss: 0.9653, test_f1: 0.4987
 epoch: 84, train_loss: 0.9348, test_loss: 0.9664, test_f1: 0.5014
 epoch: 85, train_loss: 0.9333, test_loss: 0.9673, test_f1: 0.5009
 epoch: 86, train_loss: 0.9320, test_loss: 0.9704, test_f1: 0.4982
 epoch: 87, train_loss: 0.9226, test_loss: 0.9716, test_f1: 0.5009
 epoch: 88, train_loss: 0.9211, test_loss: 0.9717, test_f1: 0.5030
 epoch: 89, train_loss: 0.9392, test_loss: 0.9697, test_f1: 0.4989
 epoch: 90, train_loss: 0.9309, test_loss: 0.9706, test_f1: 0.5018
 epoch: 91, train_loss: 0.9215, test_loss: 0.9687, test_f1: 0.5161
 epoch: 92, train_loss: 0.9313, test_loss: 0.9679, test_f1: 0.5060
 epoch: 93, train_loss: 0.9326, test_loss: 0.9755, test_f1: 0.5128
 epoch: 94, train_loss: 0.9244, test_loss: 0.9727, test_f1: 0.4997
 epoch: 95, train_loss: 0.9224, test_loss: 0.9744, test_f1: 0.5038
 epoch: 96, train_loss: 0.9191, test_loss: 0.9735, test_f1: 0.5100
 epoch: 97, train_loss: 0.9163, test_loss: 0.9712, test_f1: 0.5179
 epoch: 98, train_loss: 0.9136, test_loss: 0.9724, test_f1: 0.5101
 epoch: 99, train_loss: 0.9187, test_loss: 0.9672, test_f1: 0.5039
##################ITERATION #8 ****************************************
 epoch: 0, train_loss: 1.3439, test_loss: 1.3133, test_f1: 0.2270
 epoch: 1, train_loss: 1.2749, test_loss: 1.2963, test_f1: 0.2270
 epoch: 2, train_loss: 1.2500, test_loss: 1.2833, test_f1: 0.2270
 epoch: 3, train_loss: 1.2291, test_loss: 1.2543, test_f1: 0.2526
 epoch: 4, train_loss: 1.2201, test_loss: 1.2119, test_f1: 0.2587
 epoch: 5, train_loss: 1.2082, test_loss: 1.1707, test_f1: 0.3348
 epoch: 6, train_loss: 1.2027, test_loss: 1.1527, test_f1: 0.3546
 epoch: 7, train_loss: 1.1884, test_loss: 1.1386, test_f1: 0.3694
 epoch: 8, train_loss: 1.1767, test_loss: 1.1292, test_f1: 0.3888
 epoch: 9, train_loss: 1.1756, test_loss: 1.1208, test_f1: 0.4005
 epoch: 10, train_loss: 1.1621, test_loss: 1.1121, test_f1: 0.4133
 epoch: 11, train_loss: 1.1577, test_loss: 1.1047, test_f1: 0.4231
 epoch: 12, train_loss: 1.1498, test_loss: 1.0975, test_f1: 0.4306
 epoch: 13, train_loss: 1.1391, test_loss: 1.0927, test_f1: 0.4383
 epoch: 14, train_loss: 1.1326, test_loss: 1.0852, test_f1: 0.4355
 epoch: 15, train_loss: 1.1384, test_loss: 1.0792, test_f1: 0.4493
 epoch: 16, train_loss: 1.1265, test_loss: 1.0709, test_f1: 0.4541
 epoch: 17, train_loss: 1.1153, test_loss: 1.0653, test_f1: 0.4553
 epoch: 18, train_loss: 1.1082, test_loss: 1.0585, test_f1: 0.4552
 epoch: 19, train_loss: 1.0983, test_loss: 1.0522, test_f1: 0.4587
 epoch: 20, train_loss: 1.1014, test_loss: 1.0456, test_f1: 0.4616
 epoch: 21, train_loss: 1.0832, test_loss: 1.0391, test_f1: 0.4635
 epoch: 22, train_loss: 1.0881, test_loss: 1.0329, test_f1: 0.4733
 epoch: 23, train_loss: 1.0898, test_loss: 1.0282, test_f1: 0.4728
 epoch: 24, train_loss: 1.0753, test_loss: 1.0210, test_f1: 0.4779
 epoch: 25, train_loss: 1.0599, test_loss: 1.0142, test_f1: 0.4726
 epoch: 26, train_loss: 1.0647, test_loss: 1.0102, test_f1: 0.4761
 epoch: 27, train_loss: 1.0581, test_loss: 1.0056, test_f1: 0.4766
 epoch: 28, train_loss: 1.0530, test_loss: 1.0013, test_f1: 0.4796
 epoch: 29, train_loss: 1.0471, test_loss: 0.9964, test_f1: 0.4787
 epoch: 30, train_loss: 1.0410, test_loss: 0.9918, test_f1: 0.4829
 epoch: 31, train_loss: 1.0320, test_loss: 0.9884, test_f1: 0.4801
 epoch: 32, train_loss: 1.0354, test_loss: 0.9848, test_f1: 0.4843
 epoch: 33, train_loss: 1.0252, test_loss: 0.9799, test_f1: 0.4848
 epoch: 34, train_loss: 1.0219, test_loss: 0.9783, test_f1: 0.4865
 epoch: 35, train_loss: 1.0183, test_loss: 0.9748, test_f1: 0.4751
 epoch: 36, train_loss: 1.0096, test_loss: 0.9730, test_f1: 0.4768
 epoch: 37, train_loss: 1.0028, test_loss: 0.9721, test_f1: 0.4768
 epoch: 38, train_loss: 1.0031, test_loss: 0.9676, test_f1: 0.4825
 epoch: 39, train_loss: 1.0008, test_loss: 0.9631, test_f1: 0.4804
 epoch: 40, train_loss: 1.0013, test_loss: 0.9595, test_f1: 0.4859
 epoch: 41, train_loss: 0.9868, test_loss: 0.9588, test_f1: 0.4837
 epoch: 42, train_loss: 0.9888, test_loss: 0.9593, test_f1: 0.4814
 epoch: 43, train_loss: 0.9871, test_loss: 0.9597, test_f1: 0.4820
 epoch: 44, train_loss: 0.9882, test_loss: 0.9559, test_f1: 0.4862
 epoch: 45, train_loss: 0.9791, test_loss: 0.9563, test_f1: 0.4814
 epoch: 46, train_loss: 0.9884, test_loss: 0.9519, test_f1: 0.4817
 epoch: 47, train_loss: 0.9745, test_loss: 0.9549, test_f1: 0.4912
 epoch: 48, train_loss: 0.9682, test_loss: 0.9535, test_f1: 0.5032
 epoch: 49, train_loss: 0.9747, test_loss: 0.9583, test_f1: 0.5000
 epoch: 50, train_loss: 0.9633, test_loss: 0.9538, test_f1: 0.4999
 epoch: 51, train_loss: 0.9665, test_loss: 0.9547, test_f1: 0.4978
 epoch: 52, train_loss: 0.9620, test_loss: 0.9541, test_f1: 0.5028
 epoch: 53, train_loss: 0.9500, test_loss: 0.9519, test_f1: 0.5027
 epoch: 54, train_loss: 0.9612, test_loss: 0.9497, test_f1: 0.5017
 epoch: 55, train_loss: 0.9552, test_loss: 0.9481, test_f1: 0.5007
 epoch: 56, train_loss: 0.9568, test_loss: 0.9495, test_f1: 0.5062
 epoch: 57, train_loss: 0.9613, test_loss: 0.9501, test_f1: 0.5022
 epoch: 58, train_loss: 0.9525, test_loss: 0.9510, test_f1: 0.5026
 epoch: 59, train_loss: 0.9452, test_loss: 0.9517, test_f1: 0.5016
 epoch: 60, train_loss: 0.9497, test_loss: 0.9461, test_f1: 0.5032
 epoch: 61, train_loss: 0.9523, test_loss: 0.9441, test_f1: 0.4993
 epoch: 62, train_loss: 0.9436, test_loss: 0.9492, test_f1: 0.5001
 epoch: 63, train_loss: 0.9530, test_loss: 0.9493, test_f1: 0.5037
 epoch: 64, train_loss: 0.9443, test_loss: 0.9527, test_f1: 0.5041
 epoch: 65, train_loss: 0.9469, test_loss: 0.9523, test_f1: 0.5036
 epoch: 66, train_loss: 0.9439, test_loss: 0.9442, test_f1: 0.4989
 epoch: 67, train_loss: 0.9482, test_loss: 0.9416, test_f1: 0.4999
 epoch: 68, train_loss: 0.9428, test_loss: 0.9438, test_f1: 0.5033
 epoch: 69, train_loss: 0.9528, test_loss: 0.9432, test_f1: 0.5064
 epoch: 70, train_loss: 0.9382, test_loss: 0.9487, test_f1: 0.5066
 epoch: 71, train_loss: 0.9380, test_loss: 0.9499, test_f1: 0.5085
 epoch: 72, train_loss: 0.9429, test_loss: 0.9461, test_f1: 0.5118
 epoch: 73, train_loss: 0.9318, test_loss: 0.9516, test_f1: 0.5074
 epoch: 74, train_loss: 0.9302, test_loss: 0.9424, test_f1: 0.5120
 epoch: 75, train_loss: 0.9329, test_loss: 0.9433, test_f1: 0.5095
 epoch: 76, train_loss: 0.9274, test_loss: 0.9424, test_f1: 0.5083
 epoch: 77, train_loss: 0.9307, test_loss: 0.9456, test_f1: 0.5063
 epoch: 78, train_loss: 0.9325, test_loss: 0.9460, test_f1: 0.5147
 epoch: 79, train_loss: 0.9336, test_loss: 0.9515, test_f1: 0.5084
 epoch: 80, train_loss: 0.9314, test_loss: 0.9477, test_f1: 0.5135
 epoch: 81, train_loss: 0.9286, test_loss: 0.9417, test_f1: 0.5183
 epoch: 82, train_loss: 0.9332, test_loss: 0.9467, test_f1: 0.5122
 epoch: 83, train_loss: 0.9209, test_loss: 0.9474, test_f1: 0.5150
 epoch: 84, train_loss: 0.9255, test_loss: 0.9455, test_f1: 0.5124
 epoch: 85, train_loss: 0.9264, test_loss: 0.9459, test_f1: 0.5129
 epoch: 86, train_loss: 0.9198, test_loss: 0.9447, test_f1: 0.5112
 epoch: 87, train_loss: 0.9280, test_loss: 0.9405, test_f1: 0.5081
 epoch: 88, train_loss: 0.9203, test_loss: 0.9394, test_f1: 0.5121
 epoch: 89, train_loss: 0.9219, test_loss: 0.9436, test_f1: 0.5129
 epoch: 90, train_loss: 0.9172, test_loss: 0.9388, test_f1: 0.5166
 epoch: 91, train_loss: 0.9165, test_loss: 0.9416, test_f1: 0.5155
 epoch: 92, train_loss: 0.9200, test_loss: 0.9447, test_f1: 0.5139
 epoch: 93, train_loss: 0.9143, test_loss: 0.9432, test_f1: 0.5142
 epoch: 94, train_loss: 0.9252, test_loss: 0.9461, test_f1: 0.5059
 epoch: 95, train_loss: 0.9167, test_loss: 0.9502, test_f1: 0.5123
 epoch: 96, train_loss: 0.9167, test_loss: 0.9488, test_f1: 0.5091
 epoch: 97, train_loss: 0.9104, test_loss: 0.9441, test_f1: 0.5113
 epoch: 98, train_loss: 0.9121, test_loss: 0.9419, test_f1: 0.5104
 epoch: 99, train_loss: 0.9126, test_loss: 0.9436, test_f1: 0.5137
##################ITERATION #9 ****************************************
 epoch: 0, train_loss: 1.4111, test_loss: 1.3765, test_f1: 0.2270
 epoch: 1, train_loss: 1.3332, test_loss: 1.3631, test_f1: 0.2270
 epoch: 2, train_loss: 1.2882, test_loss: 1.3343, test_f1: 0.2270
 epoch: 3, train_loss: 1.2644, test_loss: 1.2734, test_f1: 0.2576
 epoch: 4, train_loss: 1.2498, test_loss: 1.2193, test_f1: 0.3278
 epoch: 5, train_loss: 1.2312, test_loss: 1.1904, test_f1: 0.3470
 epoch: 6, train_loss: 1.2175, test_loss: 1.1738, test_f1: 0.3522
 epoch: 7, train_loss: 1.2057, test_loss: 1.1631, test_f1: 0.3707
 epoch: 8, train_loss: 1.1920, test_loss: 1.1522, test_f1: 0.3707
 epoch: 9, train_loss: 1.1849, test_loss: 1.1425, test_f1: 0.3706
 epoch: 10, train_loss: 1.1744, test_loss: 1.1330, test_f1: 0.3832
 epoch: 11, train_loss: 1.1646, test_loss: 1.1241, test_f1: 0.3954
 epoch: 12, train_loss: 1.1543, test_loss: 1.1132, test_f1: 0.4083
 epoch: 13, train_loss: 1.1535, test_loss: 1.1029, test_f1: 0.4231
 epoch: 14, train_loss: 1.1439, test_loss: 1.0944, test_f1: 0.4264
 epoch: 15, train_loss: 1.1323, test_loss: 1.0854, test_f1: 0.4330
 epoch: 16, train_loss: 1.1243, test_loss: 1.0793, test_f1: 0.4358
 epoch: 17, train_loss: 1.1133, test_loss: 1.0701, test_f1: 0.4364
 epoch: 18, train_loss: 1.1099, test_loss: 1.0642, test_f1: 0.4435
 epoch: 19, train_loss: 1.1044, test_loss: 1.0555, test_f1: 0.4444
 epoch: 20, train_loss: 1.0948, test_loss: 1.0487, test_f1: 0.4461
 epoch: 21, train_loss: 1.0924, test_loss: 1.0412, test_f1: 0.4481
 epoch: 22, train_loss: 1.0779, test_loss: 1.0355, test_f1: 0.4500
 epoch: 23, train_loss: 1.0738, test_loss: 1.0318, test_f1: 0.4538
 epoch: 24, train_loss: 1.0627, test_loss: 1.0261, test_f1: 0.4460
 epoch: 25, train_loss: 1.0635, test_loss: 1.0182, test_f1: 0.4641
 epoch: 26, train_loss: 1.0583, test_loss: 1.0178, test_f1: 0.4501
 epoch: 27, train_loss: 1.0548, test_loss: 1.0123, test_f1: 0.4587
 epoch: 28, train_loss: 1.0518, test_loss: 1.0087, test_f1: 0.4477
 epoch: 29, train_loss: 1.0362, test_loss: 1.0042, test_f1: 0.4691
 epoch: 30, train_loss: 1.0289, test_loss: 1.0008, test_f1: 0.4753
 epoch: 31, train_loss: 1.0274, test_loss: 0.9957, test_f1: 0.4746
 epoch: 32, train_loss: 1.0237, test_loss: 0.9938, test_f1: 0.4652
 epoch: 33, train_loss: 1.0283, test_loss: 0.9898, test_f1: 0.4836
 epoch: 34, train_loss: 1.0138, test_loss: 0.9894, test_f1: 0.4867
 epoch: 35, train_loss: 1.0102, test_loss: 0.9832, test_f1: 0.4883
 epoch: 36, train_loss: 1.0063, test_loss: 0.9840, test_f1: 0.4850
 epoch: 37, train_loss: 1.0052, test_loss: 0.9825, test_f1: 0.4848
 epoch: 38, train_loss: 1.0057, test_loss: 0.9774, test_f1: 0.4841
 epoch: 39, train_loss: 1.0010, test_loss: 0.9784, test_f1: 0.4935
 epoch: 40, train_loss: 0.9968, test_loss: 0.9759, test_f1: 0.4822
 epoch: 41, train_loss: 0.9907, test_loss: 0.9732, test_f1: 0.4751
 epoch: 42, train_loss: 0.9854, test_loss: 0.9708, test_f1: 0.4853
 epoch: 43, train_loss: 0.9905, test_loss: 0.9703, test_f1: 0.4903
 epoch: 44, train_loss: 0.9853, test_loss: 0.9720, test_f1: 0.4927
 epoch: 45, train_loss: 0.9728, test_loss: 0.9669, test_f1: 0.4995
 epoch: 46, train_loss: 0.9852, test_loss: 0.9694, test_f1: 0.5019
 epoch: 47, train_loss: 0.9686, test_loss: 0.9700, test_f1: 0.5014
 epoch: 48, train_loss: 0.9708, test_loss: 0.9671, test_f1: 0.4919
 epoch: 49, train_loss: 0.9701, test_loss: 0.9645, test_f1: 0.4925
 epoch: 50, train_loss: 0.9576, test_loss: 0.9637, test_f1: 0.4971
 epoch: 51, train_loss: 0.9617, test_loss: 0.9639, test_f1: 0.4974
 epoch: 52, train_loss: 0.9626, test_loss: 0.9614, test_f1: 0.4933
 epoch: 53, train_loss: 0.9578, test_loss: 0.9604, test_f1: 0.4929
 epoch: 54, train_loss: 0.9570, test_loss: 0.9596, test_f1: 0.4936
 epoch: 55, train_loss: 0.9559, test_loss: 0.9599, test_f1: 0.4963
 epoch: 56, train_loss: 0.9541, test_loss: 0.9601, test_f1: 0.5003
 epoch: 57, train_loss: 0.9478, test_loss: 0.9574, test_f1: 0.5035
 epoch: 58, train_loss: 0.9478, test_loss: 0.9564, test_f1: 0.5011
 epoch: 59, train_loss: 0.9433, test_loss: 0.9585, test_f1: 0.5001
 epoch: 60, train_loss: 0.9425, test_loss: 0.9540, test_f1: 0.4951
 epoch: 61, train_loss: 0.9431, test_loss: 0.9517, test_f1: 0.4965
 epoch: 62, train_loss: 0.9509, test_loss: 0.9519, test_f1: 0.4987
 epoch: 63, train_loss: 0.9456, test_loss: 0.9510, test_f1: 0.4994
 epoch: 64, train_loss: 0.9418, test_loss: 0.9530, test_f1: 0.4949
 epoch: 65, train_loss: 0.9409, test_loss: 0.9533, test_f1: 0.4937
 epoch: 66, train_loss: 0.9341, test_loss: 0.9530, test_f1: 0.4909
 epoch: 67, train_loss: 0.9377, test_loss: 0.9504, test_f1: 0.4993
 epoch: 68, train_loss: 0.9318, test_loss: 0.9509, test_f1: 0.5010
 epoch: 69, train_loss: 0.9348, test_loss: 0.9503, test_f1: 0.5005
 epoch: 70, train_loss: 0.9364, test_loss: 0.9496, test_f1: 0.4936
 epoch: 71, train_loss: 0.9314, test_loss: 0.9482, test_f1: 0.4975
 epoch: 72, train_loss: 0.9280, test_loss: 0.9469, test_f1: 0.4975
 epoch: 73, train_loss: 0.9322, test_loss: 0.9471, test_f1: 0.4960
 epoch: 74, train_loss: 0.9272, test_loss: 0.9468, test_f1: 0.4942
 epoch: 75, train_loss: 0.9284, test_loss: 0.9478, test_f1: 0.4942
 epoch: 76, train_loss: 0.9313, test_loss: 0.9470, test_f1: 0.5121
 epoch: 77, train_loss: 0.9188, test_loss: 0.9469, test_f1: 0.4957
 epoch: 78, train_loss: 0.9289, test_loss: 0.9447, test_f1: 0.5007
 epoch: 79, train_loss: 0.9185, test_loss: 0.9461, test_f1: 0.4909
 epoch: 80, train_loss: 0.9205, test_loss: 0.9437, test_f1: 0.4978
 epoch: 81, train_loss: 0.9122, test_loss: 0.9429, test_f1: 0.5040
 epoch: 82, train_loss: 0.9193, test_loss: 0.9448, test_f1: 0.4965
 epoch: 83, train_loss: 0.9175, test_loss: 0.9463, test_f1: 0.4866
 epoch: 84, train_loss: 0.9166, test_loss: 0.9411, test_f1: 0.4929
 epoch: 85, train_loss: 0.9178, test_loss: 0.9452, test_f1: 0.4935
 epoch: 86, train_loss: 0.9160, test_loss: 0.9431, test_f1: 0.4959
 epoch: 87, train_loss: 0.9167, test_loss: 0.9417, test_f1: 0.4869
 epoch: 88, train_loss: 0.9148, test_loss: 0.9420, test_f1: 0.4902
 epoch: 89, train_loss: 0.9065, test_loss: 0.9393, test_f1: 0.4999
 epoch: 90, train_loss: 0.9110, test_loss: 0.9385, test_f1: 0.5106
 epoch: 91, train_loss: 0.9080, test_loss: 0.9371, test_f1: 0.4888
 epoch: 92, train_loss: 0.9015, test_loss: 0.9351, test_f1: 0.5109
 epoch: 93, train_loss: 0.9096, test_loss: 0.9378, test_f1: 0.4922
 epoch: 94, train_loss: 0.9004, test_loss: 0.9383, test_f1: 0.5040
 epoch: 95, train_loss: 0.9001, test_loss: 0.9400, test_f1: 0.5052
 epoch: 96, train_loss: 0.9160, test_loss: 0.9379, test_f1: 0.4895
 epoch: 97, train_loss: 0.9019, test_loss: 0.9386, test_f1: 0.5071
 epoch: 98, train_loss: 0.9044, test_loss: 0.9402, test_f1: 0.5100
 epoch: 99, train_loss: 0.9022, test_loss: 0.9387, test_f1: 0.5017

Training completed in 398.67 seconds
Best F1: 0.5306 at epoch 75
Mean F1 across iterations: 0.5093  0.0106
========================FINAL RESULTS================================
FEGIN weighted F1: 0.5306  0.0106
python main.py --data ltspice_examples --representation component_net --model FEGIN --layers 4 --hiddens 32 --batch_size 256 --lr 0.0001 --emb_size 512 --epochs 100 --save_appendix component_net_L4_H32_BS256_LR0.0001_E512 --no_val
-----



STDERR:
  File "main.py", line 370, in <module>
    main()
  File "main.py", line 254, in main
    dataset = dataset_class(
  File "/home/philip/projects/ltspice_examples_code_repo/Circuit-Completion-Using-GNNs/component_classification_with_link_prediction_head/evaluation/FEGIN/kernel/circuit_datasets.py", line 15, in __init__
    self.data, self.slices = torch.load(self.processed_paths[0])
  File "/home/philip/.local/lib/python3.8/site-packages/torch/serialization.py", line 1040, in load
    warnings.warn(
  File "/usr/lib/python3.8/warnings.py", line 109, in _showwarnmsg
    sw(msg.message, msg.category, msg.filename, msg.lineno,
  File "main.py", line 47, in warn_with_traceback
    traceback.print_stack(file=log)
/home/philip/projects/ltspice_examples_code_repo/Circuit-Completion-Using-GNNs/component_classification_with_link_prediction_head/evaluation/FEGIN/kernel/circuit_datasets.py:15: FutureWarning: You are using `torch.load` with `weights_only=False` (the current default value), which uses the default pickle module implicitly. It is possible to construct malicious pickle data which will execute arbitrary code during unpickling (See https://github.com/pytorch/pytorch/blob/main/SECURITY.md#untrusted-models for more details). In a future release, the default value for `weights_only` will be flipped to `True`. This limits the functions that could be executed during unpickling. Arbitrary objects will no longer be allowed to be loaded via this mode unless they are explicitly allowlisted by the user via `torch.serialization.add_safe_globals`. We recommend you start setting `weights_only=True` for any use case where you don't have full control of the loaded file. Please open an issue on GitHub for any issues related to this experimental feature.
  self.data, self.slices = torch.load(self.processed_paths[0])
