STDOUT:
Results will be saved in /home/philip/projects/ltspice_examples_code_repo/Circuit-Completion-Using-GNNs/component_classification_with_link_prediction_head/evaluation/FEGIN/results/model_FEGIN_dataset_ltspice_examples
Command line input: python main.py --data ltspice_examples --representation component_component --model FEGIN --layers 2 --hiddens 128 --batch_size 256 --lr 0.0001 --emb_size 128 --epochs 100 --save_appendix component_component_L2_H128_BS256_LR0.0001_E128 --no_val
 is saved.
-----
ltspice_examples - FEGIN
Using 2 layers, 128 hidden units, h = 2
Loading component_component representation dataset
ENTERED
Training FEGIN on component_component representation
Train: 3556, Test: 845
##################ITERATION #0 ****************************************
 epoch: 0, train_loss: 1.3704, test_loss: 1.3678, test_f1: 0.2274
 epoch: 1, train_loss: 1.3539, test_loss: 1.3580, test_f1: 0.2274
 epoch: 2, train_loss: 1.3434, test_loss: 1.3445, test_f1: 0.2274
 epoch: 3, train_loss: 1.3307, test_loss: 1.3278, test_f1: 0.2274
 epoch: 4, train_loss: 1.3162, test_loss: 1.3093, test_f1: 0.2274
 epoch: 5, train_loss: 1.2989, test_loss: 1.2904, test_f1: 0.2274
 epoch: 6, train_loss: 1.2840, test_loss: 1.2726, test_f1: 0.2274
 epoch: 7, train_loss: 1.2666, test_loss: 1.2556, test_f1: 0.2276
 epoch: 8, train_loss: 1.2508, test_loss: 1.2397, test_f1: 0.2271
 epoch: 9, train_loss: 1.2365, test_loss: 1.2252, test_f1: 0.2578
 epoch: 10, train_loss: 1.2208, test_loss: 1.2111, test_f1: 0.2879
 epoch: 11, train_loss: 1.2074, test_loss: 1.1984, test_f1: 0.3432
 epoch: 12, train_loss: 1.1944, test_loss: 1.1837, test_f1: 0.3549
 epoch: 13, train_loss: 1.1828, test_loss: 1.1727, test_f1: 0.3586
 epoch: 14, train_loss: 1.1686, test_loss: 1.1609, test_f1: 0.3595
 epoch: 15, train_loss: 1.1565, test_loss: 1.1495, test_f1: 0.3708
 epoch: 16, train_loss: 1.1473, test_loss: 1.1415, test_f1: 0.4130
 epoch: 17, train_loss: 1.1324, test_loss: 1.1301, test_f1: 0.4335
 epoch: 18, train_loss: 1.1162, test_loss: 1.1211, test_f1: 0.4324
 epoch: 19, train_loss: 1.1085, test_loss: 1.1135, test_f1: 0.4431
 epoch: 20, train_loss: 1.0985, test_loss: 1.1013, test_f1: 0.4466
 epoch: 21, train_loss: 1.0863, test_loss: 1.0935, test_f1: 0.4557
 epoch: 22, train_loss: 1.0716, test_loss: 1.0856, test_f1: 0.4355
 epoch: 23, train_loss: 1.0605, test_loss: 1.0758, test_f1: 0.4400
 epoch: 24, train_loss: 1.0507, test_loss: 1.0660, test_f1: 0.4487
 epoch: 25, train_loss: 1.0310, test_loss: 1.0586, test_f1: 0.4488
 epoch: 26, train_loss: 1.0289, test_loss: 1.0511, test_f1: 0.4641
 epoch: 27, train_loss: 1.0187, test_loss: 1.0429, test_f1: 0.4633
 epoch: 28, train_loss: 1.0097, test_loss: 1.0333, test_f1: 0.4708
 epoch: 29, train_loss: 0.9969, test_loss: 1.0271, test_f1: 0.4638
 epoch: 30, train_loss: 0.9850, test_loss: 1.0236, test_f1: 0.4763
 epoch: 31, train_loss: 0.9792, test_loss: 1.0160, test_f1: 0.4712
 epoch: 32, train_loss: 0.9690, test_loss: 1.0195, test_f1: 0.4810
 epoch: 33, train_loss: 0.9531, test_loss: 1.0087, test_f1: 0.4700
 epoch: 34, train_loss: 0.9459, test_loss: 1.0110, test_f1: 0.4867
 epoch: 35, train_loss: 0.9385, test_loss: 0.9966, test_f1: 0.4876
 epoch: 36, train_loss: 0.9265, test_loss: 0.9999, test_f1: 0.4837
 epoch: 37, train_loss: 0.9239, test_loss: 1.0004, test_f1: 0.4813
 epoch: 38, train_loss: 0.9117, test_loss: 0.9941, test_f1: 0.4906
 epoch: 39, train_loss: 0.9093, test_loss: 0.9830, test_f1: 0.4777
 epoch: 40, train_loss: 0.9014, test_loss: 1.0025, test_f1: 0.4798
 epoch: 41, train_loss: 0.8942, test_loss: 0.9946, test_f1: 0.4872
 epoch: 42, train_loss: 0.8838, test_loss: 0.9897, test_f1: 0.4921
 epoch: 43, train_loss: 0.8752, test_loss: 0.9896, test_f1: 0.4989
 epoch: 44, train_loss: 0.8665, test_loss: 1.0120, test_f1: 0.4911
 epoch: 45, train_loss: 0.8578, test_loss: 0.9924, test_f1: 0.4965
 epoch: 46, train_loss: 0.8555, test_loss: 1.0022, test_f1: 0.4939
 epoch: 47, train_loss: 0.8412, test_loss: 0.9956, test_f1: 0.5016
 epoch: 48, train_loss: 0.8331, test_loss: 0.9970, test_f1: 0.5009
 epoch: 49, train_loss: 0.8214, test_loss: 1.0019, test_f1: 0.4926
 epoch: 50, train_loss: 0.8288, test_loss: 1.0007, test_f1: 0.4991
 epoch: 51, train_loss: 0.8209, test_loss: 1.0047, test_f1: 0.5014
 epoch: 52, train_loss: 0.8048, test_loss: 1.0143, test_f1: 0.4982
 epoch: 53, train_loss: 0.8048, test_loss: 1.0199, test_f1: 0.4978
 epoch: 54, train_loss: 0.7961, test_loss: 1.0178, test_f1: 0.5008
 epoch: 55, train_loss: 0.7943, test_loss: 1.0157, test_f1: 0.4995
 epoch: 56, train_loss: 0.7878, test_loss: 1.0165, test_f1: 0.4975
 epoch: 57, train_loss: 0.7856, test_loss: 1.0317, test_f1: 0.4899
 epoch: 58, train_loss: 0.7842, test_loss: 1.0235, test_f1: 0.5004
 epoch: 59, train_loss: 0.7773, test_loss: 1.0208, test_f1: 0.4995
 epoch: 60, train_loss: 0.7781, test_loss: 1.0419, test_f1: 0.5108
 epoch: 61, train_loss: 0.7681, test_loss: 1.0379, test_f1: 0.4926
 epoch: 62, train_loss: 0.7705, test_loss: 1.0416, test_f1: 0.5075
 epoch: 63, train_loss: 0.7634, test_loss: 1.0416, test_f1: 0.5003
 epoch: 64, train_loss: 0.7639, test_loss: 1.0425, test_f1: 0.5034
 epoch: 65, train_loss: 0.7551, test_loss: 1.0481, test_f1: 0.5053
 epoch: 66, train_loss: 0.7551, test_loss: 1.0503, test_f1: 0.5060
 epoch: 67, train_loss: 0.7525, test_loss: 1.0499, test_f1: 0.4889
 epoch: 68, train_loss: 0.7510, test_loss: 1.0484, test_f1: 0.4885
 epoch: 69, train_loss: 0.7395, test_loss: 1.0559, test_f1: 0.5001
 epoch: 70, train_loss: 0.7441, test_loss: 1.0541, test_f1: 0.5029
 epoch: 71, train_loss: 0.7346, test_loss: 1.0579, test_f1: 0.5078
 epoch: 72, train_loss: 0.7412, test_loss: 1.0549, test_f1: 0.4988
 epoch: 73, train_loss: 0.7360, test_loss: 1.0716, test_f1: 0.5090
 epoch: 74, train_loss: 0.7300, test_loss: 1.0690, test_f1: 0.5082
 epoch: 75, train_loss: 0.7313, test_loss: 1.0702, test_f1: 0.4943
 epoch: 76, train_loss: 0.7222, test_loss: 1.0816, test_f1: 0.5039
 epoch: 77, train_loss: 0.7333, test_loss: 1.0764, test_f1: 0.4980
 epoch: 78, train_loss: 0.7265, test_loss: 1.0786, test_f1: 0.5044
 epoch: 79, train_loss: 0.7247, test_loss: 1.0742, test_f1: 0.5051
 epoch: 80, train_loss: 0.7173, test_loss: 1.0905, test_f1: 0.4991
 epoch: 81, train_loss: 0.7075, test_loss: 1.0909, test_f1: 0.4981
 epoch: 82, train_loss: 0.7049, test_loss: 1.0936, test_f1: 0.5014
 epoch: 83, train_loss: 0.7022, test_loss: 1.0858, test_f1: 0.5042
 epoch: 84, train_loss: 0.6983, test_loss: 1.1058, test_f1: 0.5072
 epoch: 85, train_loss: 0.7040, test_loss: 1.0933, test_f1: 0.5004
 epoch: 86, train_loss: 0.6936, test_loss: 1.0988, test_f1: 0.5048
 epoch: 87, train_loss: 0.7077, test_loss: 1.1030, test_f1: 0.5003
 epoch: 88, train_loss: 0.6882, test_loss: 1.0982, test_f1: 0.5152
 epoch: 89, train_loss: 0.6868, test_loss: 1.1227, test_f1: 0.5106
 epoch: 90, train_loss: 0.6849, test_loss: 1.1212, test_f1: 0.5125
 epoch: 91, train_loss: 0.6839, test_loss: 1.1285, test_f1: 0.5054
 epoch: 92, train_loss: 0.6790, test_loss: 1.1252, test_f1: 0.5000
 epoch: 93, train_loss: 0.6718, test_loss: 1.1152, test_f1: 0.5068
 epoch: 94, train_loss: 0.6739, test_loss: 1.1154, test_f1: 0.5142
 epoch: 95, train_loss: 0.6715, test_loss: 1.1282, test_f1: 0.5247
 epoch: 96, train_loss: 0.6659, test_loss: 1.1328, test_f1: 0.5177
 epoch: 97, train_loss: 0.6652, test_loss: 1.1376, test_f1: 0.5166
 epoch: 98, train_loss: 0.6701, test_loss: 1.1434, test_f1: 0.5129
 epoch: 99, train_loss: 0.6644, test_loss: 1.1390, test_f1: 0.5091
##################ITERATION #1 ****************************************
 epoch: 0, train_loss: 1.3351, test_loss: 1.3360, test_f1: 0.2274
 epoch: 1, train_loss: 1.2924, test_loss: 1.3051, test_f1: 0.2533
 epoch: 2, train_loss: 1.2716, test_loss: 1.2735, test_f1: 0.2603
 epoch: 3, train_loss: 1.2521, test_loss: 1.2412, test_f1: 0.2582
 epoch: 4, train_loss: 1.2357, test_loss: 1.2147, test_f1: 0.3135
 epoch: 5, train_loss: 1.2174, test_loss: 1.1927, test_f1: 0.3342
 epoch: 6, train_loss: 1.2072, test_loss: 1.1744, test_f1: 0.3639
 epoch: 7, train_loss: 1.1901, test_loss: 1.1592, test_f1: 0.4000
 epoch: 8, train_loss: 1.1732, test_loss: 1.1452, test_f1: 0.4209
 epoch: 9, train_loss: 1.1660, test_loss: 1.1331, test_f1: 0.4501
 epoch: 10, train_loss: 1.1511, test_loss: 1.1186, test_f1: 0.4486
 epoch: 11, train_loss: 1.1385, test_loss: 1.1054, test_f1: 0.4421
 epoch: 12, train_loss: 1.1234, test_loss: 1.0940, test_f1: 0.4525
 epoch: 13, train_loss: 1.1120, test_loss: 1.0782, test_f1: 0.4476
 epoch: 14, train_loss: 1.0989, test_loss: 1.0654, test_f1: 0.4485
 epoch: 15, train_loss: 1.0921, test_loss: 1.0560, test_f1: 0.4509
 epoch: 16, train_loss: 1.0750, test_loss: 1.0465, test_f1: 0.4642
 epoch: 17, train_loss: 1.0665, test_loss: 1.0359, test_f1: 0.4693
 epoch: 18, train_loss: 1.0526, test_loss: 1.0260, test_f1: 0.4562
 epoch: 19, train_loss: 1.0456, test_loss: 1.0197, test_f1: 0.4542
 epoch: 20, train_loss: 1.0395, test_loss: 1.0090, test_f1: 0.4556
 epoch: 21, train_loss: 1.0313, test_loss: 1.0036, test_f1: 0.4747
 epoch: 22, train_loss: 1.0228, test_loss: 0.9981, test_f1: 0.4828
 epoch: 23, train_loss: 1.0062, test_loss: 0.9861, test_f1: 0.4723
 epoch: 24, train_loss: 1.0024, test_loss: 0.9810, test_f1: 0.4839
 epoch: 25, train_loss: 0.9839, test_loss: 0.9777, test_f1: 0.4767
 epoch: 26, train_loss: 0.9816, test_loss: 0.9785, test_f1: 0.4894
 epoch: 27, train_loss: 0.9774, test_loss: 0.9697, test_f1: 0.4939
 epoch: 28, train_loss: 0.9640, test_loss: 0.9643, test_f1: 0.4859
 epoch: 29, train_loss: 0.9536, test_loss: 0.9557, test_f1: 0.4985
 epoch: 30, train_loss: 0.9553, test_loss: 0.9619, test_f1: 0.4921
 epoch: 31, train_loss: 0.9403, test_loss: 0.9531, test_f1: 0.4869
 epoch: 32, train_loss: 0.9375, test_loss: 0.9510, test_f1: 0.4830
 epoch: 33, train_loss: 0.9256, test_loss: 0.9538, test_f1: 0.4744
 epoch: 34, train_loss: 0.9242, test_loss: 0.9430, test_f1: 0.5013
 epoch: 35, train_loss: 0.9115, test_loss: 0.9477, test_f1: 0.4969
 epoch: 36, train_loss: 0.9044, test_loss: 0.9526, test_f1: 0.5059
 epoch: 37, train_loss: 0.8982, test_loss: 0.9387, test_f1: 0.4909
 epoch: 38, train_loss: 0.8955, test_loss: 0.9365, test_f1: 0.5165
 epoch: 39, train_loss: 0.8869, test_loss: 0.9570, test_f1: 0.4987
 epoch: 40, train_loss: 0.8810, test_loss: 0.9456, test_f1: 0.5109
 epoch: 41, train_loss: 0.8816, test_loss: 0.9376, test_f1: 0.5183
 epoch: 42, train_loss: 0.8687, test_loss: 0.9427, test_f1: 0.5145
 epoch: 43, train_loss: 0.8564, test_loss: 0.9507, test_f1: 0.5133
 epoch: 44, train_loss: 0.8583, test_loss: 0.9486, test_f1: 0.5196
 epoch: 45, train_loss: 0.8500, test_loss: 0.9512, test_f1: 0.5051
 epoch: 46, train_loss: 0.8481, test_loss: 0.9321, test_f1: 0.5444
 epoch: 47, train_loss: 0.8442, test_loss: 0.9507, test_f1: 0.5165
 epoch: 48, train_loss: 0.8321, test_loss: 0.9526, test_f1: 0.5273
 epoch: 49, train_loss: 0.8244, test_loss: 0.9456, test_f1: 0.5210
 epoch: 50, train_loss: 0.8185, test_loss: 0.9636, test_f1: 0.5225
 epoch: 51, train_loss: 0.8159, test_loss: 0.9597, test_f1: 0.5180
 epoch: 52, train_loss: 0.8065, test_loss: 0.9574, test_f1: 0.5332
 epoch: 53, train_loss: 0.8105, test_loss: 0.9632, test_f1: 0.5260
 epoch: 54, train_loss: 0.8037, test_loss: 0.9501, test_f1: 0.5311
 epoch: 55, train_loss: 0.7978, test_loss: 0.9487, test_f1: 0.5232
 epoch: 56, train_loss: 0.7950, test_loss: 0.9561, test_f1: 0.5277
 epoch: 57, train_loss: 0.7929, test_loss: 0.9591, test_f1: 0.5242
 epoch: 58, train_loss: 0.8012, test_loss: 0.9584, test_f1: 0.5248
 epoch: 59, train_loss: 0.7894, test_loss: 0.9658, test_f1: 0.5217
 epoch: 60, train_loss: 0.7914, test_loss: 0.9639, test_f1: 0.5120
 epoch: 61, train_loss: 0.7774, test_loss: 0.9600, test_f1: 0.5261
 epoch: 62, train_loss: 0.7797, test_loss: 0.9604, test_f1: 0.5194
 epoch: 63, train_loss: 0.7748, test_loss: 0.9692, test_f1: 0.5166
 epoch: 64, train_loss: 0.7776, test_loss: 0.9735, test_f1: 0.4965
 epoch: 65, train_loss: 0.7668, test_loss: 0.9685, test_f1: 0.5202
 epoch: 66, train_loss: 0.7790, test_loss: 0.9743, test_f1: 0.5089
 epoch: 67, train_loss: 0.7667, test_loss: 0.9681, test_f1: 0.5141
 epoch: 68, train_loss: 0.7684, test_loss: 0.9733, test_f1: 0.5192
 epoch: 69, train_loss: 0.7577, test_loss: 0.9757, test_f1: 0.5224
 epoch: 70, train_loss: 0.7682, test_loss: 0.9873, test_f1: 0.5242
 epoch: 71, train_loss: 0.7550, test_loss: 0.9877, test_f1: 0.5293
 epoch: 72, train_loss: 0.7468, test_loss: 0.9818, test_f1: 0.5195
 epoch: 73, train_loss: 0.7423, test_loss: 0.9853, test_f1: 0.5217
 epoch: 74, train_loss: 0.7454, test_loss: 0.9941, test_f1: 0.5237
 epoch: 75, train_loss: 0.7526, test_loss: 0.9979, test_f1: 0.5178
 epoch: 76, train_loss: 0.7334, test_loss: 1.0037, test_f1: 0.5059
 epoch: 77, train_loss: 0.7439, test_loss: 0.9961, test_f1: 0.5094
 epoch: 78, train_loss: 0.7425, test_loss: 0.9903, test_f1: 0.5273
 epoch: 79, train_loss: 0.7456, test_loss: 1.0072, test_f1: 0.5211
 epoch: 80, train_loss: 0.7344, test_loss: 0.9992, test_f1: 0.5060
 epoch: 81, train_loss: 0.7330, test_loss: 1.0047, test_f1: 0.5041
 epoch: 82, train_loss: 0.7186, test_loss: 1.0068, test_f1: 0.5139
 epoch: 83, train_loss: 0.7273, test_loss: 1.0142, test_f1: 0.5236
 epoch: 84, train_loss: 0.7293, test_loss: 1.0122, test_f1: 0.5262
 epoch: 85, train_loss: 0.7210, test_loss: 1.0211, test_f1: 0.5154
 epoch: 86, train_loss: 0.7167, test_loss: 1.0193, test_f1: 0.5252
 epoch: 87, train_loss: 0.7219, test_loss: 1.0347, test_f1: 0.5261
 epoch: 88, train_loss: 0.7288, test_loss: 1.0182, test_f1: 0.5134
 epoch: 89, train_loss: 0.6986, test_loss: 1.0259, test_f1: 0.5131
 epoch: 90, train_loss: 0.7113, test_loss: 1.0240, test_f1: 0.5112
 epoch: 91, train_loss: 0.7192, test_loss: 1.0366, test_f1: 0.5225
 epoch: 92, train_loss: 0.7065, test_loss: 1.0544, test_f1: 0.5111
 epoch: 93, train_loss: 0.7108, test_loss: 1.0433, test_f1: 0.5164
 epoch: 94, train_loss: 0.6949, test_loss: 1.0413, test_f1: 0.5185
 epoch: 95, train_loss: 0.6984, test_loss: 1.0573, test_f1: 0.5116
 epoch: 96, train_loss: 0.7008, test_loss: 1.0634, test_f1: 0.5143
 epoch: 97, train_loss: 0.6866, test_loss: 1.0658, test_f1: 0.5185
 epoch: 98, train_loss: 0.6880, test_loss: 1.0561, test_f1: 0.5211
 epoch: 99, train_loss: 0.6867, test_loss: 1.0590, test_f1: 0.5137
##################ITERATION #2 ****************************************
 epoch: 0, train_loss: 1.3050, test_loss: 1.3046, test_f1: 0.2274
 epoch: 1, train_loss: 1.2357, test_loss: 1.2731, test_f1: 0.2555
 epoch: 2, train_loss: 1.2171, test_loss: 1.2279, test_f1: 0.2838
 epoch: 3, train_loss: 1.1931, test_loss: 1.1882, test_f1: 0.3757
 epoch: 4, train_loss: 1.1735, test_loss: 1.1588, test_f1: 0.4172
 epoch: 5, train_loss: 1.1558, test_loss: 1.1393, test_f1: 0.4422
 epoch: 6, train_loss: 1.1428, test_loss: 1.1217, test_f1: 0.4693
 epoch: 7, train_loss: 1.1265, test_loss: 1.1055, test_f1: 0.4556
 epoch: 8, train_loss: 1.1140, test_loss: 1.0911, test_f1: 0.4678
 epoch: 9, train_loss: 1.0982, test_loss: 1.0777, test_f1: 0.4672
 epoch: 10, train_loss: 1.0891, test_loss: 1.0709, test_f1: 0.4669
 epoch: 11, train_loss: 1.0750, test_loss: 1.0587, test_f1: 0.4747
 epoch: 12, train_loss: 1.0698, test_loss: 1.0509, test_f1: 0.4595
 epoch: 13, train_loss: 1.0576, test_loss: 1.0486, test_f1: 0.4617
 epoch: 14, train_loss: 1.0502, test_loss: 1.0345, test_f1: 0.4684
 epoch: 15, train_loss: 1.0411, test_loss: 1.0277, test_f1: 0.4688
 epoch: 16, train_loss: 1.0405, test_loss: 1.0217, test_f1: 0.4765
 epoch: 17, train_loss: 1.0223, test_loss: 1.0155, test_f1: 0.4666
 epoch: 18, train_loss: 1.0241, test_loss: 1.0138, test_f1: 0.4710
 epoch: 19, train_loss: 1.0117, test_loss: 1.0102, test_f1: 0.4757
 epoch: 20, train_loss: 1.0062, test_loss: 1.0000, test_f1: 0.4831
 epoch: 21, train_loss: 0.9943, test_loss: 1.0028, test_f1: 0.4791
 epoch: 22, train_loss: 0.9885, test_loss: 0.9970, test_f1: 0.4910
 epoch: 23, train_loss: 0.9789, test_loss: 0.9902, test_f1: 0.4836
 epoch: 24, train_loss: 0.9787, test_loss: 0.9910, test_f1: 0.4909
 epoch: 25, train_loss: 0.9681, test_loss: 0.9820, test_f1: 0.4984
 epoch: 26, train_loss: 0.9583, test_loss: 0.9872, test_f1: 0.4823
 epoch: 27, train_loss: 0.9556, test_loss: 0.9833, test_f1: 0.5003
 epoch: 28, train_loss: 0.9521, test_loss: 0.9718, test_f1: 0.5122
 epoch: 29, train_loss: 0.9402, test_loss: 0.9821, test_f1: 0.4921
 epoch: 30, train_loss: 0.9368, test_loss: 0.9719, test_f1: 0.4990
 epoch: 31, train_loss: 0.9264, test_loss: 0.9717, test_f1: 0.4978
 epoch: 32, train_loss: 0.9281, test_loss: 0.9751, test_f1: 0.4929
 epoch: 33, train_loss: 0.9151, test_loss: 0.9565, test_f1: 0.5003
 epoch: 34, train_loss: 0.9028, test_loss: 0.9722, test_f1: 0.4955
 epoch: 35, train_loss: 0.9071, test_loss: 0.9598, test_f1: 0.5031
 epoch: 36, train_loss: 0.9014, test_loss: 0.9836, test_f1: 0.4938
 epoch: 37, train_loss: 0.9075, test_loss: 0.9694, test_f1: 0.4903
 epoch: 38, train_loss: 0.8956, test_loss: 0.9554, test_f1: 0.4895
 epoch: 39, train_loss: 0.8843, test_loss: 0.9665, test_f1: 0.4905
 epoch: 40, train_loss: 0.8861, test_loss: 0.9606, test_f1: 0.5003
 epoch: 41, train_loss: 0.8779, test_loss: 0.9702, test_f1: 0.4926
 epoch: 42, train_loss: 0.8732, test_loss: 0.9707, test_f1: 0.4982
 epoch: 43, train_loss: 0.8627, test_loss: 0.9595, test_f1: 0.5062
 epoch: 44, train_loss: 0.8601, test_loss: 0.9651, test_f1: 0.5008
 epoch: 45, train_loss: 0.8486, test_loss: 0.9560, test_f1: 0.5123
 epoch: 46, train_loss: 0.8606, test_loss: 0.9778, test_f1: 0.4981
 epoch: 47, train_loss: 0.8470, test_loss: 0.9743, test_f1: 0.5031
 epoch: 48, train_loss: 0.8423, test_loss: 0.9647, test_f1: 0.5035
 epoch: 49, train_loss: 0.8285, test_loss: 0.9782, test_f1: 0.4896
 epoch: 50, train_loss: 0.8300, test_loss: 0.9714, test_f1: 0.5071
 epoch: 51, train_loss: 0.8369, test_loss: 0.9773, test_f1: 0.5052
 epoch: 52, train_loss: 0.8196, test_loss: 0.9713, test_f1: 0.5105
 epoch: 53, train_loss: 0.8181, test_loss: 0.9729, test_f1: 0.5152
 epoch: 54, train_loss: 0.8124, test_loss: 0.9766, test_f1: 0.5119
 epoch: 55, train_loss: 0.8090, test_loss: 0.9832, test_f1: 0.5080
 epoch: 56, train_loss: 0.8161, test_loss: 0.9839, test_f1: 0.5002
 epoch: 57, train_loss: 0.8020, test_loss: 0.9768, test_f1: 0.5111
 epoch: 58, train_loss: 0.8050, test_loss: 0.9818, test_f1: 0.5000
 epoch: 59, train_loss: 0.7996, test_loss: 0.9864, test_f1: 0.5073
 epoch: 60, train_loss: 0.7968, test_loss: 0.9886, test_f1: 0.4918
 epoch: 61, train_loss: 0.7950, test_loss: 0.9932, test_f1: 0.5032
 epoch: 62, train_loss: 0.7899, test_loss: 1.0050, test_f1: 0.4951
 epoch: 63, train_loss: 0.7892, test_loss: 0.9787, test_f1: 0.5101
 epoch: 64, train_loss: 0.7916, test_loss: 0.9968, test_f1: 0.5055
 epoch: 65, train_loss: 0.7835, test_loss: 0.9959, test_f1: 0.4860
 epoch: 66, train_loss: 0.7911, test_loss: 1.0055, test_f1: 0.4936
 epoch: 67, train_loss: 0.7895, test_loss: 0.9982, test_f1: 0.4983
 epoch: 68, train_loss: 0.7793, test_loss: 1.0055, test_f1: 0.4963
 epoch: 69, train_loss: 0.7746, test_loss: 0.9944, test_f1: 0.5057
 epoch: 70, train_loss: 0.7771, test_loss: 1.0048, test_f1: 0.4971
 epoch: 71, train_loss: 0.7707, test_loss: 1.0097, test_f1: 0.4969
 epoch: 72, train_loss: 0.7620, test_loss: 1.0177, test_f1: 0.4855
 epoch: 73, train_loss: 0.7715, test_loss: 1.0236, test_f1: 0.4837
 epoch: 74, train_loss: 0.7653, test_loss: 1.0095, test_f1: 0.5036
 epoch: 75, train_loss: 0.7603, test_loss: 1.0128, test_f1: 0.5032
 epoch: 76, train_loss: 0.7546, test_loss: 1.0194, test_f1: 0.5049
 epoch: 77, train_loss: 0.7569, test_loss: 1.0196, test_f1: 0.4951
 epoch: 78, train_loss: 0.7536, test_loss: 1.0288, test_f1: 0.4851
 epoch: 79, train_loss: 0.7495, test_loss: 1.0233, test_f1: 0.4901
 epoch: 80, train_loss: 0.7427, test_loss: 1.0292, test_f1: 0.4847
 epoch: 81, train_loss: 0.7477, test_loss: 1.0195, test_f1: 0.5082
 epoch: 82, train_loss: 0.7477, test_loss: 1.0408, test_f1: 0.4683
 epoch: 83, train_loss: 0.7423, test_loss: 1.0424, test_f1: 0.4881
 epoch: 84, train_loss: 0.7381, test_loss: 1.0375, test_f1: 0.4810
 epoch: 85, train_loss: 0.7278, test_loss: 1.0391, test_f1: 0.4860
 epoch: 86, train_loss: 0.7403, test_loss: 1.0473, test_f1: 0.4888
 epoch: 87, train_loss: 0.7348, test_loss: 1.0477, test_f1: 0.4874
 epoch: 88, train_loss: 0.7328, test_loss: 1.0418, test_f1: 0.4803
 epoch: 89, train_loss: 0.7250, test_loss: 1.0524, test_f1: 0.4859
 epoch: 90, train_loss: 0.7225, test_loss: 1.0477, test_f1: 0.4913
 epoch: 91, train_loss: 0.7295, test_loss: 1.0579, test_f1: 0.4951
 epoch: 92, train_loss: 0.7304, test_loss: 1.0571, test_f1: 0.4907
 epoch: 93, train_loss: 0.7123, test_loss: 1.0511, test_f1: 0.4930
 epoch: 94, train_loss: 0.7158, test_loss: 1.0599, test_f1: 0.4730
 epoch: 95, train_loss: 0.7101, test_loss: 1.0808, test_f1: 0.4975
 epoch: 96, train_loss: 0.7179, test_loss: 1.0659, test_f1: 0.4954
 epoch: 97, train_loss: 0.7203, test_loss: 1.0466, test_f1: 0.4898
 epoch: 98, train_loss: 0.7170, test_loss: 1.0438, test_f1: 0.4790
 epoch: 99, train_loss: 0.7122, test_loss: 1.0791, test_f1: 0.5025
##################ITERATION #3 ****************************************
 epoch: 0, train_loss: 1.3270, test_loss: 1.3011, test_f1: 0.2274
 epoch: 1, train_loss: 1.2415, test_loss: 1.2574, test_f1: 0.2859
 epoch: 2, train_loss: 1.2127, test_loss: 1.2055, test_f1: 0.3602
 epoch: 3, train_loss: 1.1868, test_loss: 1.1668, test_f1: 0.4185
 epoch: 4, train_loss: 1.1729, test_loss: 1.1423, test_f1: 0.4418
 epoch: 5, train_loss: 1.1507, test_loss: 1.1278, test_f1: 0.4493
 epoch: 6, train_loss: 1.1373, test_loss: 1.1155, test_f1: 0.4647
 epoch: 7, train_loss: 1.1272, test_loss: 1.1058, test_f1: 0.4596
 epoch: 8, train_loss: 1.1077, test_loss: 1.0987, test_f1: 0.4623
 epoch: 9, train_loss: 1.1071, test_loss: 1.0948, test_f1: 0.4564
 epoch: 10, train_loss: 1.0842, test_loss: 1.0806, test_f1: 0.4603
 epoch: 11, train_loss: 1.0803, test_loss: 1.0718, test_f1: 0.4601
 epoch: 12, train_loss: 1.0761, test_loss: 1.0646, test_f1: 0.4566
 epoch: 13, train_loss: 1.0610, test_loss: 1.0673, test_f1: 0.4555
 epoch: 14, train_loss: 1.0470, test_loss: 1.0651, test_f1: 0.4478
 epoch: 15, train_loss: 1.0431, test_loss: 1.0483, test_f1: 0.4590
 epoch: 16, train_loss: 1.0287, test_loss: 1.0414, test_f1: 0.4506
 epoch: 17, train_loss: 1.0154, test_loss: 1.0312, test_f1: 0.4589
 epoch: 18, train_loss: 1.0165, test_loss: 1.0226, test_f1: 0.4715
 epoch: 19, train_loss: 1.0093, test_loss: 1.0133, test_f1: 0.4707
 epoch: 20, train_loss: 0.9937, test_loss: 1.0050, test_f1: 0.4833
 epoch: 21, train_loss: 0.9889, test_loss: 1.0075, test_f1: 0.4629
 epoch: 22, train_loss: 0.9878, test_loss: 0.9958, test_f1: 0.4682
 epoch: 23, train_loss: 0.9723, test_loss: 0.9986, test_f1: 0.4805
 epoch: 24, train_loss: 0.9756, test_loss: 0.9924, test_f1: 0.4794
 epoch: 25, train_loss: 0.9618, test_loss: 0.9785, test_f1: 0.4959
 epoch: 26, train_loss: 0.9581, test_loss: 0.9843, test_f1: 0.4918
 epoch: 27, train_loss: 0.9441, test_loss: 0.9770, test_f1: 0.4936
 epoch: 28, train_loss: 0.9354, test_loss: 0.9820, test_f1: 0.4933
 epoch: 29, train_loss: 0.9275, test_loss: 0.9741, test_f1: 0.4976
 epoch: 30, train_loss: 0.9275, test_loss: 0.9741, test_f1: 0.4932
 epoch: 31, train_loss: 0.9266, test_loss: 0.9673, test_f1: 0.5103
 epoch: 32, train_loss: 0.9115, test_loss: 0.9688, test_f1: 0.5006
 epoch: 33, train_loss: 0.9090, test_loss: 0.9568, test_f1: 0.5032
 epoch: 34, train_loss: 0.9032, test_loss: 0.9701, test_f1: 0.5065
 epoch: 35, train_loss: 0.8969, test_loss: 0.9696, test_f1: 0.5056
 epoch: 36, train_loss: 0.8903, test_loss: 0.9647, test_f1: 0.5048
 epoch: 37, train_loss: 0.8866, test_loss: 0.9716, test_f1: 0.5044
 epoch: 38, train_loss: 0.8809, test_loss: 0.9752, test_f1: 0.4987
 epoch: 39, train_loss: 0.8731, test_loss: 0.9732, test_f1: 0.5117
 epoch: 40, train_loss: 0.8599, test_loss: 0.9725, test_f1: 0.5040
 epoch: 41, train_loss: 0.8617, test_loss: 0.9948, test_f1: 0.5101
 epoch: 42, train_loss: 0.8531, test_loss: 0.9987, test_f1: 0.5155
 epoch: 43, train_loss: 0.8543, test_loss: 0.9826, test_f1: 0.4933
 epoch: 44, train_loss: 0.8501, test_loss: 0.9780, test_f1: 0.4928
 epoch: 45, train_loss: 0.8478, test_loss: 1.0109, test_f1: 0.4799
 epoch: 46, train_loss: 0.8367, test_loss: 0.9958, test_f1: 0.5086
 epoch: 47, train_loss: 0.8356, test_loss: 0.9957, test_f1: 0.5142
 epoch: 48, train_loss: 0.8264, test_loss: 0.9887, test_f1: 0.5006
 epoch: 49, train_loss: 0.8264, test_loss: 1.0038, test_f1: 0.5057
 epoch: 50, train_loss: 0.8269, test_loss: 1.0095, test_f1: 0.5085
 epoch: 51, train_loss: 0.8101, test_loss: 0.9955, test_f1: 0.5149
 epoch: 52, train_loss: 0.8085, test_loss: 1.0053, test_f1: 0.5049
 epoch: 53, train_loss: 0.8002, test_loss: 1.0074, test_f1: 0.5100
 epoch: 54, train_loss: 0.8030, test_loss: 1.0034, test_f1: 0.5115
 epoch: 55, train_loss: 0.8073, test_loss: 1.0043, test_f1: 0.5151
 epoch: 56, train_loss: 0.7962, test_loss: 0.9988, test_f1: 0.5222
 epoch: 57, train_loss: 0.7959, test_loss: 1.0073, test_f1: 0.5202
 epoch: 58, train_loss: 0.7893, test_loss: 1.0170, test_f1: 0.5105
 epoch: 59, train_loss: 0.7876, test_loss: 1.0265, test_f1: 0.5213
 epoch: 60, train_loss: 0.7880, test_loss: 1.0338, test_f1: 0.5093
 epoch: 61, train_loss: 0.7838, test_loss: 1.0134, test_f1: 0.5222
 epoch: 62, train_loss: 0.7901, test_loss: 1.0249, test_f1: 0.5236
 epoch: 63, train_loss: 0.7794, test_loss: 1.0337, test_f1: 0.5166
 epoch: 64, train_loss: 0.7822, test_loss: 1.0446, test_f1: 0.5030
 epoch: 65, train_loss: 0.7692, test_loss: 1.0428, test_f1: 0.5194
 epoch: 66, train_loss: 0.7784, test_loss: 1.0408, test_f1: 0.5156
 epoch: 67, train_loss: 0.7772, test_loss: 1.0362, test_f1: 0.5262
 epoch: 68, train_loss: 0.7686, test_loss: 1.0400, test_f1: 0.5330
 epoch: 69, train_loss: 0.7683, test_loss: 1.0584, test_f1: 0.5306
 epoch: 70, train_loss: 0.7616, test_loss: 1.0773, test_f1: 0.5291
 epoch: 71, train_loss: 0.7649, test_loss: 1.0677, test_f1: 0.5128
 epoch: 72, train_loss: 0.7506, test_loss: 1.0796, test_f1: 0.5048
 epoch: 73, train_loss: 0.7548, test_loss: 1.0670, test_f1: 0.5282
 epoch: 74, train_loss: 0.7548, test_loss: 1.0633, test_f1: 0.5346
 epoch: 75, train_loss: 0.7582, test_loss: 1.0779, test_f1: 0.5306
 epoch: 76, train_loss: 0.7510, test_loss: 1.0905, test_f1: 0.5015
 epoch: 77, train_loss: 0.7509, test_loss: 1.0666, test_f1: 0.5242
 epoch: 78, train_loss: 0.7472, test_loss: 1.0822, test_f1: 0.5176
 epoch: 79, train_loss: 0.7464, test_loss: 1.0744, test_f1: 0.5203
 epoch: 80, train_loss: 0.7461, test_loss: 1.0827, test_f1: 0.5194
 epoch: 81, train_loss: 0.7419, test_loss: 1.0814, test_f1: 0.5176
 epoch: 82, train_loss: 0.7473, test_loss: 1.0985, test_f1: 0.5134
 epoch: 83, train_loss: 0.7438, test_loss: 1.0676, test_f1: 0.5303
 epoch: 84, train_loss: 0.7367, test_loss: 1.0845, test_f1: 0.5250
 epoch: 85, train_loss: 0.7335, test_loss: 1.1090, test_f1: 0.5134
 epoch: 86, train_loss: 0.7312, test_loss: 1.1040, test_f1: 0.5195
 epoch: 87, train_loss: 0.7335, test_loss: 1.0977, test_f1: 0.5045
 epoch: 88, train_loss: 0.7158, test_loss: 1.1088, test_f1: 0.5251
 epoch: 89, train_loss: 0.7391, test_loss: 1.1134, test_f1: 0.5227
 epoch: 90, train_loss: 0.7188, test_loss: 1.1124, test_f1: 0.5205
 epoch: 91, train_loss: 0.7234, test_loss: 1.1055, test_f1: 0.5337
 epoch: 92, train_loss: 0.7277, test_loss: 1.1371, test_f1: 0.5133
 epoch: 93, train_loss: 0.7098, test_loss: 1.1180, test_f1: 0.5111
 epoch: 94, train_loss: 0.7101, test_loss: 1.1381, test_f1: 0.5083
 epoch: 95, train_loss: 0.7095, test_loss: 1.1086, test_f1: 0.5309
 epoch: 96, train_loss: 0.7040, test_loss: 1.1274, test_f1: 0.5231
 epoch: 97, train_loss: 0.7092, test_loss: 1.1179, test_f1: 0.5251
 epoch: 98, train_loss: 0.7148, test_loss: 1.1623, test_f1: 0.5104
 epoch: 99, train_loss: 0.7080, test_loss: 1.1484, test_f1: 0.5320
##################ITERATION #4 ****************************************
 epoch: 0, train_loss: 1.3315, test_loss: 1.2917, test_f1: 0.2288
 epoch: 1, train_loss: 1.2409, test_loss: 1.2546, test_f1: 0.3254
 epoch: 2, train_loss: 1.2067, test_loss: 1.2149, test_f1: 0.3952
 epoch: 3, train_loss: 1.1895, test_loss: 1.1745, test_f1: 0.4304
 epoch: 4, train_loss: 1.1656, test_loss: 1.1389, test_f1: 0.4485
 epoch: 5, train_loss: 1.1468, test_loss: 1.1185, test_f1: 0.4608
 epoch: 6, train_loss: 1.1270, test_loss: 1.1100, test_f1: 0.4452
 epoch: 7, train_loss: 1.1287, test_loss: 1.0939, test_f1: 0.4615
 epoch: 8, train_loss: 1.1039, test_loss: 1.0798, test_f1: 0.4594
 epoch: 9, train_loss: 1.1018, test_loss: 1.0709, test_f1: 0.4599
 epoch: 10, train_loss: 1.0878, test_loss: 1.0608, test_f1: 0.4611
 epoch: 11, train_loss: 1.0848, test_loss: 1.0486, test_f1: 0.4646
 epoch: 12, train_loss: 1.0629, test_loss: 1.0420, test_f1: 0.4597
 epoch: 13, train_loss: 1.0509, test_loss: 1.0370, test_f1: 0.4584
 epoch: 14, train_loss: 1.0423, test_loss: 1.0318, test_f1: 0.4559
 epoch: 15, train_loss: 1.0387, test_loss: 1.0218, test_f1: 0.4560
 epoch: 16, train_loss: 1.0311, test_loss: 1.0143, test_f1: 0.4716
 epoch: 17, train_loss: 1.0249, test_loss: 1.0072, test_f1: 0.4592
 epoch: 18, train_loss: 1.0169, test_loss: 1.0053, test_f1: 0.4515
 epoch: 19, train_loss: 1.0004, test_loss: 0.9965, test_f1: 0.4622
 epoch: 20, train_loss: 1.0003, test_loss: 1.0000, test_f1: 0.4683
 epoch: 21, train_loss: 0.9951, test_loss: 0.9885, test_f1: 0.4685
 epoch: 22, train_loss: 0.9943, test_loss: 0.9895, test_f1: 0.4718
 epoch: 23, train_loss: 0.9815, test_loss: 0.9841, test_f1: 0.4659
 epoch: 24, train_loss: 0.9771, test_loss: 0.9776, test_f1: 0.4737
 epoch: 25, train_loss: 0.9612, test_loss: 0.9824, test_f1: 0.4637
 epoch: 26, train_loss: 0.9569, test_loss: 0.9776, test_f1: 0.4657
 epoch: 27, train_loss: 0.9601, test_loss: 0.9766, test_f1: 0.4735
 epoch: 28, train_loss: 0.9582, test_loss: 0.9719, test_f1: 0.4763
 epoch: 29, train_loss: 0.9487, test_loss: 0.9863, test_f1: 0.4687
 epoch: 30, train_loss: 0.9456, test_loss: 0.9722, test_f1: 0.4746
 epoch: 31, train_loss: 0.9364, test_loss: 0.9697, test_f1: 0.4736
 epoch: 32, train_loss: 0.9310, test_loss: 0.9847, test_f1: 0.4595
 epoch: 33, train_loss: 0.9344, test_loss: 0.9848, test_f1: 0.4700
 epoch: 34, train_loss: 0.9177, test_loss: 0.9826, test_f1: 0.4698
 epoch: 35, train_loss: 0.9163, test_loss: 0.9907, test_f1: 0.4642
 epoch: 36, train_loss: 0.9154, test_loss: 0.9732, test_f1: 0.4577
 epoch: 37, train_loss: 0.8970, test_loss: 0.9926, test_f1: 0.4756
 epoch: 38, train_loss: 0.9054, test_loss: 0.9852, test_f1: 0.4801
 epoch: 39, train_loss: 0.8860, test_loss: 0.9773, test_f1: 0.4908
 epoch: 40, train_loss: 0.8806, test_loss: 0.9862, test_f1: 0.4729
 epoch: 41, train_loss: 0.8767, test_loss: 0.9883, test_f1: 0.4647
 epoch: 42, train_loss: 0.8783, test_loss: 0.9879, test_f1: 0.4864
 epoch: 43, train_loss: 0.8667, test_loss: 0.9853, test_f1: 0.4659
 epoch: 44, train_loss: 0.8713, test_loss: 0.9921, test_f1: 0.4840
 epoch: 45, train_loss: 0.8619, test_loss: 0.9990, test_f1: 0.4697
 epoch: 46, train_loss: 0.8599, test_loss: 0.9920, test_f1: 0.4567
 epoch: 47, train_loss: 0.8480, test_loss: 1.0032, test_f1: 0.4784
 epoch: 48, train_loss: 0.8406, test_loss: 0.9929, test_f1: 0.4833
 epoch: 49, train_loss: 0.8471, test_loss: 1.0072, test_f1: 0.4875
 epoch: 50, train_loss: 0.8350, test_loss: 1.0075, test_f1: 0.4925
 epoch: 51, train_loss: 0.8296, test_loss: 0.9960, test_f1: 0.4761
 epoch: 52, train_loss: 0.8225, test_loss: 0.9930, test_f1: 0.4835
 epoch: 53, train_loss: 0.8176, test_loss: 1.0093, test_f1: 0.4795
 epoch: 54, train_loss: 0.8141, test_loss: 1.0059, test_f1: 0.4894
 epoch: 55, train_loss: 0.8119, test_loss: 1.0093, test_f1: 0.4784
 epoch: 56, train_loss: 0.8053, test_loss: 1.0212, test_f1: 0.4807
 epoch: 57, train_loss: 0.8168, test_loss: 1.0115, test_f1: 0.4994
 epoch: 58, train_loss: 0.8021, test_loss: 1.0257, test_f1: 0.4843
 epoch: 59, train_loss: 0.8075, test_loss: 1.0177, test_f1: 0.4800
 epoch: 60, train_loss: 0.8076, test_loss: 1.0235, test_f1: 0.4858
 epoch: 61, train_loss: 0.7971, test_loss: 1.0316, test_f1: 0.4877
 epoch: 62, train_loss: 0.8018, test_loss: 1.0222, test_f1: 0.4951
 epoch: 63, train_loss: 0.7961, test_loss: 1.0287, test_f1: 0.4808
 epoch: 64, train_loss: 0.7879, test_loss: 1.0325, test_f1: 0.4788
 epoch: 65, train_loss: 0.7893, test_loss: 1.0263, test_f1: 0.4868
 epoch: 66, train_loss: 0.7870, test_loss: 1.0295, test_f1: 0.4865
 epoch: 67, train_loss: 0.7746, test_loss: 1.0345, test_f1: 0.4920
 epoch: 68, train_loss: 0.7863, test_loss: 1.0317, test_f1: 0.4911
 epoch: 69, train_loss: 0.7855, test_loss: 1.0414, test_f1: 0.4943
 epoch: 70, train_loss: 0.7811, test_loss: 1.0434, test_f1: 0.4864
 epoch: 71, train_loss: 0.7700, test_loss: 1.0406, test_f1: 0.4948
 epoch: 72, train_loss: 0.7710, test_loss: 1.0502, test_f1: 0.4870
 epoch: 73, train_loss: 0.7710, test_loss: 1.0532, test_f1: 0.4978
 epoch: 74, train_loss: 0.7771, test_loss: 1.0531, test_f1: 0.4956
 epoch: 75, train_loss: 0.7729, test_loss: 1.0477, test_f1: 0.5030
 epoch: 76, train_loss: 0.7682, test_loss: 1.0544, test_f1: 0.4862
 epoch: 77, train_loss: 0.7573, test_loss: 1.0680, test_f1: 0.4893
 epoch: 78, train_loss: 0.7701, test_loss: 1.0611, test_f1: 0.4989
 epoch: 79, train_loss: 0.7455, test_loss: 1.0579, test_f1: 0.5099
 epoch: 80, train_loss: 0.7465, test_loss: 1.0669, test_f1: 0.5011
 epoch: 81, train_loss: 0.7571, test_loss: 1.0661, test_f1: 0.5098
 epoch: 82, train_loss: 0.7565, test_loss: 1.0716, test_f1: 0.5073
 epoch: 83, train_loss: 0.7443, test_loss: 1.0800, test_f1: 0.5008
 epoch: 84, train_loss: 0.7563, test_loss: 1.0866, test_f1: 0.5041
 epoch: 85, train_loss: 0.7464, test_loss: 1.0816, test_f1: 0.5005
 epoch: 86, train_loss: 0.7374, test_loss: 1.0876, test_f1: 0.5046
 epoch: 87, train_loss: 0.7425, test_loss: 1.0967, test_f1: 0.5089
 epoch: 88, train_loss: 0.7355, test_loss: 1.0900, test_f1: 0.5078
 epoch: 89, train_loss: 0.7353, test_loss: 1.0994, test_f1: 0.5061
 epoch: 90, train_loss: 0.7399, test_loss: 1.0959, test_f1: 0.4968
 epoch: 91, train_loss: 0.7327, test_loss: 1.1028, test_f1: 0.5018
 epoch: 92, train_loss: 0.7267, test_loss: 1.1041, test_f1: 0.5116
 epoch: 93, train_loss: 0.7255, test_loss: 1.0973, test_f1: 0.4971
 epoch: 94, train_loss: 0.7187, test_loss: 1.1065, test_f1: 0.5080
 epoch: 95, train_loss: 0.7232, test_loss: 1.1118, test_f1: 0.5051
 epoch: 96, train_loss: 0.7154, test_loss: 1.1174, test_f1: 0.5081
 epoch: 97, train_loss: 0.7242, test_loss: 1.1185, test_f1: 0.5038
 epoch: 98, train_loss: 0.7108, test_loss: 1.1214, test_f1: 0.5057
 epoch: 99, train_loss: 0.7235, test_loss: 1.1180, test_f1: 0.5052
##################ITERATION #5 ****************************************
 epoch: 0, train_loss: 1.2993, test_loss: 1.2838, test_f1: 0.2274
 epoch: 1, train_loss: 1.2191, test_loss: 1.2530, test_f1: 0.2269
 epoch: 2, train_loss: 1.1946, test_loss: 1.2077, test_f1: 0.2875
 epoch: 3, train_loss: 1.1739, test_loss: 1.1583, test_f1: 0.3991
 epoch: 4, train_loss: 1.1575, test_loss: 1.1211, test_f1: 0.4473
 epoch: 5, train_loss: 1.1361, test_loss: 1.0913, test_f1: 0.4590
 epoch: 6, train_loss: 1.1274, test_loss: 1.0733, test_f1: 0.4619
 epoch: 7, train_loss: 1.1192, test_loss: 1.0647, test_f1: 0.4499
 epoch: 8, train_loss: 1.1084, test_loss: 1.0537, test_f1: 0.4681
 epoch: 9, train_loss: 1.0873, test_loss: 1.0398, test_f1: 0.4739
 epoch: 10, train_loss: 1.0732, test_loss: 1.0323, test_f1: 0.4685
 epoch: 11, train_loss: 1.0659, test_loss: 1.0254, test_f1: 0.4729
 epoch: 12, train_loss: 1.0503, test_loss: 1.0195, test_f1: 0.4764
 epoch: 13, train_loss: 1.0405, test_loss: 1.0121, test_f1: 0.4749
 epoch: 14, train_loss: 1.0381, test_loss: 1.0038, test_f1: 0.4781
 epoch: 15, train_loss: 1.0313, test_loss: 1.0000, test_f1: 0.4765
 epoch: 16, train_loss: 1.0212, test_loss: 0.9983, test_f1: 0.4838
 epoch: 17, train_loss: 1.0132, test_loss: 0.9921, test_f1: 0.4871
 epoch: 18, train_loss: 1.0069, test_loss: 0.9874, test_f1: 0.4858
 epoch: 19, train_loss: 0.9983, test_loss: 0.9790, test_f1: 0.4904
 epoch: 20, train_loss: 0.9858, test_loss: 0.9858, test_f1: 0.4734
 epoch: 21, train_loss: 0.9795, test_loss: 0.9779, test_f1: 0.4966
 epoch: 22, train_loss: 0.9794, test_loss: 0.9648, test_f1: 0.5003
 epoch: 23, train_loss: 0.9730, test_loss: 0.9564, test_f1: 0.5060
 epoch: 24, train_loss: 0.9625, test_loss: 0.9598, test_f1: 0.4957
 epoch: 25, train_loss: 0.9507, test_loss: 0.9578, test_f1: 0.5014
 epoch: 26, train_loss: 0.9498, test_loss: 0.9585, test_f1: 0.5025
 epoch: 27, train_loss: 0.9379, test_loss: 0.9499, test_f1: 0.5021
 epoch: 28, train_loss: 0.9385, test_loss: 0.9498, test_f1: 0.5087
 epoch: 29, train_loss: 0.9229, test_loss: 0.9559, test_f1: 0.4846
 epoch: 30, train_loss: 0.9185, test_loss: 1.0094, test_f1: 0.4707
 epoch: 31, train_loss: 0.9121, test_loss: 0.9486, test_f1: 0.5053
 epoch: 32, train_loss: 0.9166, test_loss: 0.9540, test_f1: 0.5041
 epoch: 33, train_loss: 0.9055, test_loss: 0.9429, test_f1: 0.5012
 epoch: 34, train_loss: 0.8915, test_loss: 0.9366, test_f1: 0.5215
 epoch: 35, train_loss: 0.8920, test_loss: 0.9444, test_f1: 0.5223
 epoch: 36, train_loss: 0.8908, test_loss: 0.9489, test_f1: 0.5179
 epoch: 37, train_loss: 0.8896, test_loss: 0.9437, test_f1: 0.5104
 epoch: 38, train_loss: 0.8770, test_loss: 0.9337, test_f1: 0.5105
 epoch: 39, train_loss: 0.8719, test_loss: 0.9467, test_f1: 0.5158
 epoch: 40, train_loss: 0.8655, test_loss: 0.9502, test_f1: 0.4994
 epoch: 41, train_loss: 0.8590, test_loss: 0.9470, test_f1: 0.5101
 epoch: 42, train_loss: 0.8631, test_loss: 0.9281, test_f1: 0.5279
 epoch: 43, train_loss: 0.8591, test_loss: 0.9491, test_f1: 0.5094
 epoch: 44, train_loss: 0.8437, test_loss: 0.9503, test_f1: 0.5125
 epoch: 45, train_loss: 0.8440, test_loss: 0.9560, test_f1: 0.5048
 epoch: 46, train_loss: 0.8394, test_loss: 0.9461, test_f1: 0.5180
 epoch: 47, train_loss: 0.8391, test_loss: 0.9459, test_f1: 0.5236
 epoch: 48, train_loss: 0.8307, test_loss: 0.9448, test_f1: 0.5234
 epoch: 49, train_loss: 0.8246, test_loss: 0.9724, test_f1: 0.4819
 epoch: 50, train_loss: 0.8189, test_loss: 0.9495, test_f1: 0.5150
 epoch: 51, train_loss: 0.8094, test_loss: 0.9484, test_f1: 0.5256
 epoch: 52, train_loss: 0.8070, test_loss: 0.9503, test_f1: 0.5225
 epoch: 53, train_loss: 0.7996, test_loss: 0.9407, test_f1: 0.5202
 epoch: 54, train_loss: 0.8017, test_loss: 0.9423, test_f1: 0.5151
 epoch: 55, train_loss: 0.7975, test_loss: 0.9485, test_f1: 0.5354
 epoch: 56, train_loss: 0.7956, test_loss: 0.9648, test_f1: 0.5149
 epoch: 57, train_loss: 0.7931, test_loss: 0.9542, test_f1: 0.5213
 epoch: 58, train_loss: 0.7906, test_loss: 0.9602, test_f1: 0.5098
 epoch: 59, train_loss: 0.7874, test_loss: 0.9598, test_f1: 0.5199
 epoch: 60, train_loss: 0.7874, test_loss: 0.9618, test_f1: 0.5114
 epoch: 61, train_loss: 0.7891, test_loss: 0.9753, test_f1: 0.5089
 epoch: 62, train_loss: 0.7777, test_loss: 0.9714, test_f1: 0.5250
 epoch: 63, train_loss: 0.7785, test_loss: 0.9703, test_f1: 0.5280
 epoch: 64, train_loss: 0.7741, test_loss: 0.9581, test_f1: 0.5247
 epoch: 65, train_loss: 0.7741, test_loss: 0.9617, test_f1: 0.5282
 epoch: 66, train_loss: 0.7785, test_loss: 0.9690, test_f1: 0.5273
 epoch: 67, train_loss: 0.7714, test_loss: 0.9773, test_f1: 0.5218
 epoch: 68, train_loss: 0.7581, test_loss: 0.9852, test_f1: 0.5077
 epoch: 69, train_loss: 0.7514, test_loss: 0.9745, test_f1: 0.5135
 epoch: 70, train_loss: 0.7584, test_loss: 0.9734, test_f1: 0.5241
 epoch: 71, train_loss: 0.7656, test_loss: 0.9952, test_f1: 0.4999
 epoch: 72, train_loss: 0.7606, test_loss: 1.0002, test_f1: 0.5151
 epoch: 73, train_loss: 0.7597, test_loss: 1.0136, test_f1: 0.5011
 epoch: 74, train_loss: 0.7569, test_loss: 0.9976, test_f1: 0.5092
 epoch: 75, train_loss: 0.7462, test_loss: 1.0046, test_f1: 0.5056
 epoch: 76, train_loss: 0.7536, test_loss: 1.0099, test_f1: 0.5077
 epoch: 77, train_loss: 0.7377, test_loss: 0.9894, test_f1: 0.5173
 epoch: 78, train_loss: 0.7487, test_loss: 0.9886, test_f1: 0.5250
 epoch: 79, train_loss: 0.7418, test_loss: 0.9968, test_f1: 0.5264
 epoch: 80, train_loss: 0.7421, test_loss: 1.0118, test_f1: 0.5180
 epoch: 81, train_loss: 0.7348, test_loss: 1.0075, test_f1: 0.5241
 epoch: 82, train_loss: 0.7381, test_loss: 1.0031, test_f1: 0.5204
 epoch: 83, train_loss: 0.7269, test_loss: 1.0195, test_f1: 0.5148
 epoch: 84, train_loss: 0.7173, test_loss: 1.0120, test_f1: 0.5231
 epoch: 85, train_loss: 0.7236, test_loss: 1.0685, test_f1: 0.4869
 epoch: 86, train_loss: 0.7231, test_loss: 1.0147, test_f1: 0.5148
 epoch: 87, train_loss: 0.7196, test_loss: 1.0057, test_f1: 0.5177
 epoch: 88, train_loss: 0.7205, test_loss: 1.0187, test_f1: 0.5053
 epoch: 89, train_loss: 0.7087, test_loss: 1.0112, test_f1: 0.5132
 epoch: 90, train_loss: 0.7132, test_loss: 1.0385, test_f1: 0.5027
 epoch: 91, train_loss: 0.7197, test_loss: 1.0144, test_f1: 0.5239
 epoch: 92, train_loss: 0.7141, test_loss: 1.0232, test_f1: 0.5153
 epoch: 93, train_loss: 0.7132, test_loss: 1.0184, test_f1: 0.5335
 epoch: 94, train_loss: 0.7029, test_loss: 1.0203, test_f1: 0.5269
 epoch: 95, train_loss: 0.6955, test_loss: 1.0476, test_f1: 0.5099
 epoch: 96, train_loss: 0.6939, test_loss: 1.0379, test_f1: 0.5174
 epoch: 97, train_loss: 0.7010, test_loss: 1.0274, test_f1: 0.5135
 epoch: 98, train_loss: 0.7000, test_loss: 1.0518, test_f1: 0.5067
 epoch: 99, train_loss: 0.6971, test_loss: 1.0458, test_f1: 0.5086
##################ITERATION #6 ****************************************
 epoch: 0, train_loss: 1.3522, test_loss: 1.2800, test_f1: 0.2276
 epoch: 1, train_loss: 1.2681, test_loss: 1.2350, test_f1: 0.2869
 epoch: 2, train_loss: 1.2223, test_loss: 1.1880, test_f1: 0.4030
 epoch: 3, train_loss: 1.2018, test_loss: 1.1486, test_f1: 0.4551
 epoch: 4, train_loss: 1.1899, test_loss: 1.1240, test_f1: 0.4568
 epoch: 5, train_loss: 1.1619, test_loss: 1.1090, test_f1: 0.4576
 epoch: 6, train_loss: 1.1437, test_loss: 1.0997, test_f1: 0.4468
 epoch: 7, train_loss: 1.1329, test_loss: 1.0882, test_f1: 0.4525
 epoch: 8, train_loss: 1.1258, test_loss: 1.0781, test_f1: 0.4399
 epoch: 9, train_loss: 1.1122, test_loss: 1.0706, test_f1: 0.4468
 epoch: 10, train_loss: 1.0911, test_loss: 1.0662, test_f1: 0.4491
 epoch: 11, train_loss: 1.0849, test_loss: 1.0593, test_f1: 0.4474
 epoch: 12, train_loss: 1.0889, test_loss: 1.0527, test_f1: 0.4516
 epoch: 13, train_loss: 1.0766, test_loss: 1.0478, test_f1: 0.4436
 epoch: 14, train_loss: 1.0590, test_loss: 1.0415, test_f1: 0.4640
 epoch: 15, train_loss: 1.0631, test_loss: 1.0356, test_f1: 0.4575
 epoch: 16, train_loss: 1.0436, test_loss: 1.0329, test_f1: 0.4462
 epoch: 17, train_loss: 1.0376, test_loss: 1.0258, test_f1: 0.4525
 epoch: 18, train_loss: 1.0259, test_loss: 1.0163, test_f1: 0.4620
 epoch: 19, train_loss: 1.0218, test_loss: 1.0115, test_f1: 0.4724
 epoch: 20, train_loss: 1.0126, test_loss: 1.0071, test_f1: 0.4626
 epoch: 21, train_loss: 1.0051, test_loss: 1.0026, test_f1: 0.4776
 epoch: 22, train_loss: 0.9978, test_loss: 0.9988, test_f1: 0.4573
 epoch: 23, train_loss: 0.9955, test_loss: 0.9936, test_f1: 0.4653
 epoch: 24, train_loss: 0.9916, test_loss: 0.9877, test_f1: 0.4714
 epoch: 25, train_loss: 0.9817, test_loss: 0.9882, test_f1: 0.4553
 epoch: 26, train_loss: 0.9729, test_loss: 0.9816, test_f1: 0.4764
 epoch: 27, train_loss: 0.9731, test_loss: 0.9772, test_f1: 0.4723
 epoch: 28, train_loss: 0.9627, test_loss: 0.9732, test_f1: 0.4677
 epoch: 29, train_loss: 0.9474, test_loss: 0.9737, test_f1: 0.4728
 epoch: 30, train_loss: 0.9437, test_loss: 0.9649, test_f1: 0.4776
 epoch: 31, train_loss: 0.9470, test_loss: 0.9747, test_f1: 0.4840
 epoch: 32, train_loss: 0.9392, test_loss: 0.9685, test_f1: 0.4798
 epoch: 33, train_loss: 0.9206, test_loss: 0.9716, test_f1: 0.4837
 epoch: 34, train_loss: 0.9259, test_loss: 0.9563, test_f1: 0.4928
 epoch: 35, train_loss: 0.9191, test_loss: 0.9598, test_f1: 0.4824
 epoch: 36, train_loss: 0.9186, test_loss: 0.9557, test_f1: 0.5010
 epoch: 37, train_loss: 0.9147, test_loss: 0.9559, test_f1: 0.4955
 epoch: 38, train_loss: 0.9051, test_loss: 0.9589, test_f1: 0.4998
 epoch: 39, train_loss: 0.9111, test_loss: 0.9525, test_f1: 0.5053
 epoch: 40, train_loss: 0.8944, test_loss: 0.9563, test_f1: 0.5015
 epoch: 41, train_loss: 0.8862, test_loss: 0.9459, test_f1: 0.5101
 epoch: 42, train_loss: 0.8956, test_loss: 0.9474, test_f1: 0.5056
 epoch: 43, train_loss: 0.8814, test_loss: 0.9484, test_f1: 0.5053
 epoch: 44, train_loss: 0.8867, test_loss: 0.9384, test_f1: 0.5134
 epoch: 45, train_loss: 0.8772, test_loss: 0.9578, test_f1: 0.4981
 epoch: 46, train_loss: 0.8816, test_loss: 0.9512, test_f1: 0.4931
 epoch: 47, train_loss: 0.8683, test_loss: 0.9593, test_f1: 0.4970
 epoch: 48, train_loss: 0.8549, test_loss: 0.9448, test_f1: 0.5242
 epoch: 49, train_loss: 0.8521, test_loss: 0.9453, test_f1: 0.4849
 epoch: 50, train_loss: 0.8589, test_loss: 0.9548, test_f1: 0.4782
 epoch: 51, train_loss: 0.8512, test_loss: 0.9501, test_f1: 0.5017
 epoch: 52, train_loss: 0.8476, test_loss: 0.9605, test_f1: 0.4884
 epoch: 53, train_loss: 0.8367, test_loss: 0.9498, test_f1: 0.5164
 epoch: 54, train_loss: 0.8235, test_loss: 0.9523, test_f1: 0.5201
 epoch: 55, train_loss: 0.8387, test_loss: 0.9475, test_f1: 0.5090
 epoch: 56, train_loss: 0.8307, test_loss: 0.9541, test_f1: 0.5182
 epoch: 57, train_loss: 0.8290, test_loss: 0.9578, test_f1: 0.5128
 epoch: 58, train_loss: 0.8311, test_loss: 0.9585, test_f1: 0.5009
 epoch: 59, train_loss: 0.8356, test_loss: 0.9529, test_f1: 0.5035
 epoch: 60, train_loss: 0.8221, test_loss: 0.9659, test_f1: 0.4926
 epoch: 61, train_loss: 0.8296, test_loss: 0.9562, test_f1: 0.5084
 epoch: 62, train_loss: 0.8146, test_loss: 0.9548, test_f1: 0.5108
 epoch: 63, train_loss: 0.8156, test_loss: 0.9698, test_f1: 0.4973
 epoch: 64, train_loss: 0.8204, test_loss: 0.9712, test_f1: 0.5067
 epoch: 65, train_loss: 0.8168, test_loss: 0.9643, test_f1: 0.5177
 epoch: 66, train_loss: 0.8071, test_loss: 0.9695, test_f1: 0.5081
 epoch: 67, train_loss: 0.8075, test_loss: 0.9705, test_f1: 0.5043
 epoch: 68, train_loss: 0.8109, test_loss: 0.9776, test_f1: 0.4972
 epoch: 69, train_loss: 0.7985, test_loss: 0.9764, test_f1: 0.4884
 epoch: 70, train_loss: 0.8121, test_loss: 0.9778, test_f1: 0.5023
 epoch: 71, train_loss: 0.8003, test_loss: 0.9879, test_f1: 0.4963
 epoch: 72, train_loss: 0.7919, test_loss: 0.9722, test_f1: 0.5107
 epoch: 73, train_loss: 0.7923, test_loss: 0.9783, test_f1: 0.5073
 epoch: 74, train_loss: 0.7942, test_loss: 0.9615, test_f1: 0.5087
 epoch: 75, train_loss: 0.7934, test_loss: 0.9734, test_f1: 0.5159
 epoch: 76, train_loss: 0.7972, test_loss: 0.9781, test_f1: 0.5076
 epoch: 77, train_loss: 0.7967, test_loss: 0.9691, test_f1: 0.5200
 epoch: 78, train_loss: 0.7788, test_loss: 0.9905, test_f1: 0.5055
 epoch: 79, train_loss: 0.7843, test_loss: 0.9861, test_f1: 0.5084
 epoch: 80, train_loss: 0.7810, test_loss: 0.9822, test_f1: 0.5179
 epoch: 81, train_loss: 0.7828, test_loss: 1.0067, test_f1: 0.4979
 epoch: 82, train_loss: 0.7859, test_loss: 0.9849, test_f1: 0.5288
 epoch: 83, train_loss: 0.7796, test_loss: 0.9995, test_f1: 0.5096
 epoch: 84, train_loss: 0.7792, test_loss: 0.9899, test_f1: 0.5034
 epoch: 85, train_loss: 0.7879, test_loss: 1.0001, test_f1: 0.4834
 epoch: 86, train_loss: 0.7646, test_loss: 0.9894, test_f1: 0.5057
 epoch: 87, train_loss: 0.7720, test_loss: 0.9785, test_f1: 0.5233
 epoch: 88, train_loss: 0.7673, test_loss: 1.0144, test_f1: 0.5197
 epoch: 89, train_loss: 0.7597, test_loss: 0.9922, test_f1: 0.5213
 epoch: 90, train_loss: 0.7608, test_loss: 0.9883, test_f1: 0.5207
 epoch: 91, train_loss: 0.7765, test_loss: 1.0153, test_f1: 0.5197
 epoch: 92, train_loss: 0.7644, test_loss: 1.0150, test_f1: 0.5280
 epoch: 93, train_loss: 0.7641, test_loss: 1.0000, test_f1: 0.5181
 epoch: 94, train_loss: 0.7472, test_loss: 1.0169, test_f1: 0.5134
 epoch: 95, train_loss: 0.7638, test_loss: 1.0147, test_f1: 0.5120
 epoch: 96, train_loss: 0.7449, test_loss: 1.0183, test_f1: 0.5175
 epoch: 97, train_loss: 0.7441, test_loss: 1.0213, test_f1: 0.5185
 epoch: 98, train_loss: 0.7572, test_loss: 1.0293, test_f1: 0.5183
 epoch: 99, train_loss: 0.7457, test_loss: 1.0234, test_f1: 0.5167
##################ITERATION #7 ****************************************
 epoch: 0, train_loss: 1.3575, test_loss: 1.2649, test_f1: 0.2274
 epoch: 1, train_loss: 1.2473, test_loss: 1.2308, test_f1: 0.2870
 epoch: 2, train_loss: 1.2138, test_loss: 1.1957, test_f1: 0.2920
 epoch: 3, train_loss: 1.1916, test_loss: 1.1522, test_f1: 0.4118
 epoch: 4, train_loss: 1.1755, test_loss: 1.1187, test_f1: 0.4637
 epoch: 5, train_loss: 1.1698, test_loss: 1.0921, test_f1: 0.4866
 epoch: 6, train_loss: 1.1379, test_loss: 1.0791, test_f1: 0.4869
 epoch: 7, train_loss: 1.1408, test_loss: 1.0629, test_f1: 0.4896
 epoch: 8, train_loss: 1.1109, test_loss: 1.0587, test_f1: 0.4851
 epoch: 9, train_loss: 1.1056, test_loss: 1.0459, test_f1: 0.4859
 epoch: 10, train_loss: 1.0906, test_loss: 1.0367, test_f1: 0.4843
 epoch: 11, train_loss: 1.0773, test_loss: 1.0324, test_f1: 0.4848
 epoch: 12, train_loss: 1.0679, test_loss: 1.0263, test_f1: 0.4835
 epoch: 13, train_loss: 1.0607, test_loss: 1.0182, test_f1: 0.4925
 epoch: 14, train_loss: 1.0443, test_loss: 1.0140, test_f1: 0.4848
 epoch: 15, train_loss: 1.0454, test_loss: 1.0067, test_f1: 0.4811
 epoch: 16, train_loss: 1.0244, test_loss: 0.9992, test_f1: 0.4877
 epoch: 17, train_loss: 1.0239, test_loss: 0.9969, test_f1: 0.4813
 epoch: 18, train_loss: 1.0173, test_loss: 0.9939, test_f1: 0.4863
 epoch: 19, train_loss: 1.0112, test_loss: 0.9897, test_f1: 0.4784
 epoch: 20, train_loss: 0.9970, test_loss: 0.9742, test_f1: 0.4895
 epoch: 21, train_loss: 0.9840, test_loss: 0.9767, test_f1: 0.4879
 epoch: 22, train_loss: 0.9771, test_loss: 0.9743, test_f1: 0.4942
 epoch: 23, train_loss: 0.9684, test_loss: 0.9729, test_f1: 0.4878
 epoch: 24, train_loss: 0.9546, test_loss: 0.9765, test_f1: 0.4875
 epoch: 25, train_loss: 0.9676, test_loss: 0.9736, test_f1: 0.4950
 epoch: 26, train_loss: 0.9546, test_loss: 0.9702, test_f1: 0.4927
 epoch: 27, train_loss: 0.9378, test_loss: 0.9674, test_f1: 0.4916
 epoch: 28, train_loss: 0.9339, test_loss: 0.9719, test_f1: 0.4994
 epoch: 29, train_loss: 0.9303, test_loss: 0.9545, test_f1: 0.4899
 epoch: 30, train_loss: 0.9098, test_loss: 0.9571, test_f1: 0.4940
 epoch: 31, train_loss: 0.9164, test_loss: 0.9637, test_f1: 0.4979
 epoch: 32, train_loss: 0.9086, test_loss: 0.9651, test_f1: 0.4895
 epoch: 33, train_loss: 0.9072, test_loss: 0.9603, test_f1: 0.4926
 epoch: 34, train_loss: 0.8916, test_loss: 0.9682, test_f1: 0.4936
 epoch: 35, train_loss: 0.8997, test_loss: 0.9714, test_f1: 0.4859
 epoch: 36, train_loss: 0.8854, test_loss: 0.9665, test_f1: 0.4995
 epoch: 37, train_loss: 0.8791, test_loss: 0.9702, test_f1: 0.4935
 epoch: 38, train_loss: 0.8746, test_loss: 0.9752, test_f1: 0.5049
 epoch: 39, train_loss: 0.8753, test_loss: 0.9812, test_f1: 0.5101
 epoch: 40, train_loss: 0.8605, test_loss: 0.9750, test_f1: 0.5055
 epoch: 41, train_loss: 0.8616, test_loss: 0.9895, test_f1: 0.4930
 epoch: 42, train_loss: 0.8478, test_loss: 0.9963, test_f1: 0.5094
 epoch: 43, train_loss: 0.8527, test_loss: 0.9934, test_f1: 0.5165
 epoch: 44, train_loss: 0.8338, test_loss: 0.9961, test_f1: 0.4997
 epoch: 45, train_loss: 0.8354, test_loss: 1.0084, test_f1: 0.5005
 epoch: 46, train_loss: 0.8265, test_loss: 1.0244, test_f1: 0.4960
 epoch: 47, train_loss: 0.8258, test_loss: 1.0235, test_f1: 0.4946
 epoch: 48, train_loss: 0.8232, test_loss: 1.0355, test_f1: 0.5103
 epoch: 49, train_loss: 0.8104, test_loss: 1.0406, test_f1: 0.5154
 epoch: 50, train_loss: 0.8060, test_loss: 1.0421, test_f1: 0.5092
 epoch: 51, train_loss: 0.7963, test_loss: 1.0429, test_f1: 0.5113
 epoch: 52, train_loss: 0.7972, test_loss: 1.0450, test_f1: 0.5087
 epoch: 53, train_loss: 0.7855, test_loss: 1.0338, test_f1: 0.5103
 epoch: 54, train_loss: 0.7891, test_loss: 1.0404, test_f1: 0.5071
 epoch: 55, train_loss: 0.7964, test_loss: 1.0477, test_f1: 0.5049
 epoch: 56, train_loss: 0.7923, test_loss: 1.0423, test_f1: 0.5173
 epoch: 57, train_loss: 0.7837, test_loss: 1.0404, test_f1: 0.5195
 epoch: 58, train_loss: 0.7725, test_loss: 1.0494, test_f1: 0.5162
 epoch: 59, train_loss: 0.7733, test_loss: 1.0592, test_f1: 0.5234
 epoch: 60, train_loss: 0.7616, test_loss: 1.0543, test_f1: 0.5267
 epoch: 61, train_loss: 0.7662, test_loss: 1.0656, test_f1: 0.5155
 epoch: 62, train_loss: 0.7624, test_loss: 1.0651, test_f1: 0.5134
 epoch: 63, train_loss: 0.7715, test_loss: 1.0590, test_f1: 0.5213
 epoch: 64, train_loss: 0.7622, test_loss: 1.0732, test_f1: 0.5245
 epoch: 65, train_loss: 0.7573, test_loss: 1.0654, test_f1: 0.5191
 epoch: 66, train_loss: 0.7513, test_loss: 1.0681, test_f1: 0.5147
 epoch: 67, train_loss: 0.7666, test_loss: 1.0693, test_f1: 0.5253
 epoch: 68, train_loss: 0.7489, test_loss: 1.0791, test_f1: 0.5320
 epoch: 69, train_loss: 0.7474, test_loss: 1.0847, test_f1: 0.5182
 epoch: 70, train_loss: 0.7546, test_loss: 1.0799, test_f1: 0.5287
 epoch: 71, train_loss: 0.7402, test_loss: 1.0877, test_f1: 0.5347
 epoch: 72, train_loss: 0.7338, test_loss: 1.0895, test_f1: 0.5206
 epoch: 73, train_loss: 0.7369, test_loss: 1.0893, test_f1: 0.5217
 epoch: 74, train_loss: 0.7415, test_loss: 1.0937, test_f1: 0.5235
 epoch: 75, train_loss: 0.7300, test_loss: 1.0961, test_f1: 0.5216
 epoch: 76, train_loss: 0.7296, test_loss: 1.1033, test_f1: 0.5098
 epoch: 77, train_loss: 0.7257, test_loss: 1.0890, test_f1: 0.5187
 epoch: 78, train_loss: 0.7275, test_loss: 1.0951, test_f1: 0.5247
 epoch: 79, train_loss: 0.7259, test_loss: 1.1052, test_f1: 0.5293
 epoch: 80, train_loss: 0.7275, test_loss: 1.0924, test_f1: 0.5301
 epoch: 81, train_loss: 0.7261, test_loss: 1.1076, test_f1: 0.5383
 epoch: 82, train_loss: 0.7236, test_loss: 1.1181, test_f1: 0.5200
 epoch: 83, train_loss: 0.7210, test_loss: 1.1232, test_f1: 0.5206
 epoch: 84, train_loss: 0.7085, test_loss: 1.1247, test_f1: 0.5119
 epoch: 85, train_loss: 0.7312, test_loss: 1.1166, test_f1: 0.5083
 epoch: 86, train_loss: 0.7112, test_loss: 1.1133, test_f1: 0.5250
 epoch: 87, train_loss: 0.7028, test_loss: 1.1213, test_f1: 0.5273
 epoch: 88, train_loss: 0.7125, test_loss: 1.1419, test_f1: 0.5376
 epoch: 89, train_loss: 0.7093, test_loss: 1.1465, test_f1: 0.5379
 epoch: 90, train_loss: 0.7012, test_loss: 1.1449, test_f1: 0.5421
 epoch: 91, train_loss: 0.7026, test_loss: 1.1512, test_f1: 0.5256
 epoch: 92, train_loss: 0.6933, test_loss: 1.1451, test_f1: 0.5307
 epoch: 93, train_loss: 0.7055, test_loss: 1.1539, test_f1: 0.5300
 epoch: 94, train_loss: 0.6851, test_loss: 1.1463, test_f1: 0.5287
 epoch: 95, train_loss: 0.7040, test_loss: 1.1530, test_f1: 0.5220
 epoch: 96, train_loss: 0.6869, test_loss: 1.1355, test_f1: 0.5317
 epoch: 97, train_loss: 0.6838, test_loss: 1.1407, test_f1: 0.5317
 epoch: 98, train_loss: 0.6915, test_loss: 1.1377, test_f1: 0.5255
 epoch: 99, train_loss: 0.6879, test_loss: 1.1499, test_f1: 0.5350
##################ITERATION #8 ****************************************
 epoch: 0, train_loss: 1.4139, test_loss: 1.2944, test_f1: 0.2459
 epoch: 1, train_loss: 1.2798, test_loss: 1.2575, test_f1: 0.2871
 epoch: 2, train_loss: 1.2379, test_loss: 1.2152, test_f1: 0.3516
 epoch: 3, train_loss: 1.1983, test_loss: 1.1623, test_f1: 0.4314
 epoch: 4, train_loss: 1.1894, test_loss: 1.1258, test_f1: 0.4459
 epoch: 5, train_loss: 1.1691, test_loss: 1.1075, test_f1: 0.4475
 epoch: 6, train_loss: 1.1499, test_loss: 1.0925, test_f1: 0.4520
 epoch: 7, train_loss: 1.1369, test_loss: 1.0806, test_f1: 0.4488
 epoch: 8, train_loss: 1.1280, test_loss: 1.0697, test_f1: 0.4517
 epoch: 9, train_loss: 1.1098, test_loss: 1.0624, test_f1: 0.4586
 epoch: 10, train_loss: 1.0799, test_loss: 1.0528, test_f1: 0.4609
 epoch: 11, train_loss: 1.0791, test_loss: 1.0422, test_f1: 0.4642
 epoch: 12, train_loss: 1.0767, test_loss: 1.0283, test_f1: 0.4700
 epoch: 13, train_loss: 1.0648, test_loss: 1.0183, test_f1: 0.4626
 epoch: 14, train_loss: 1.0584, test_loss: 1.0208, test_f1: 0.4613
 epoch: 15, train_loss: 1.0470, test_loss: 1.0056, test_f1: 0.4617
 epoch: 16, train_loss: 1.0340, test_loss: 1.0009, test_f1: 0.4691
 epoch: 17, train_loss: 1.0190, test_loss: 1.0005, test_f1: 0.4706
 epoch: 18, train_loss: 1.0111, test_loss: 0.9933, test_f1: 0.4710
 epoch: 19, train_loss: 1.0028, test_loss: 0.9856, test_f1: 0.4835
 epoch: 20, train_loss: 0.9876, test_loss: 0.9829, test_f1: 0.4637
 epoch: 21, train_loss: 0.9874, test_loss: 0.9732, test_f1: 0.4819
 epoch: 22, train_loss: 0.9786, test_loss: 0.9817, test_f1: 0.4761
 epoch: 23, train_loss: 0.9723, test_loss: 0.9764, test_f1: 0.4794
 epoch: 24, train_loss: 0.9706, test_loss: 0.9629, test_f1: 0.4813
 epoch: 25, train_loss: 0.9531, test_loss: 0.9607, test_f1: 0.4672
 epoch: 26, train_loss: 0.9625, test_loss: 0.9659, test_f1: 0.4825
 epoch: 27, train_loss: 0.9520, test_loss: 0.9593, test_f1: 0.4836
 epoch: 28, train_loss: 0.9444, test_loss: 0.9658, test_f1: 0.4699
 epoch: 29, train_loss: 0.9307, test_loss: 0.9608, test_f1: 0.4731
 epoch: 30, train_loss: 0.9341, test_loss: 0.9627, test_f1: 0.4800
 epoch: 31, train_loss: 0.9254, test_loss: 0.9563, test_f1: 0.4744
 epoch: 32, train_loss: 0.9168, test_loss: 0.9544, test_f1: 0.4949
 epoch: 33, train_loss: 0.9055, test_loss: 0.9544, test_f1: 0.4743
 epoch: 34, train_loss: 0.9083, test_loss: 0.9592, test_f1: 0.4897
 epoch: 35, train_loss: 0.9137, test_loss: 0.9698, test_f1: 0.4693
 epoch: 36, train_loss: 0.8963, test_loss: 0.9566, test_f1: 0.4747
 epoch: 37, train_loss: 0.8904, test_loss: 0.9691, test_f1: 0.4712
 epoch: 38, train_loss: 0.8813, test_loss: 0.9657, test_f1: 0.4837
 epoch: 39, train_loss: 0.8769, test_loss: 0.9632, test_f1: 0.4861
 epoch: 40, train_loss: 0.8725, test_loss: 0.9482, test_f1: 0.4810
 epoch: 41, train_loss: 0.8672, test_loss: 0.9546, test_f1: 0.4852
 epoch: 42, train_loss: 0.8647, test_loss: 0.9573, test_f1: 0.4889
 epoch: 43, train_loss: 0.8586, test_loss: 0.9728, test_f1: 0.4766
 epoch: 44, train_loss: 0.8488, test_loss: 0.9577, test_f1: 0.4739
 epoch: 45, train_loss: 0.8593, test_loss: 0.9595, test_f1: 0.4789
 epoch: 46, train_loss: 0.8451, test_loss: 0.9505, test_f1: 0.5072
 epoch: 47, train_loss: 0.8518, test_loss: 0.9584, test_f1: 0.4907
 epoch: 48, train_loss: 0.8426, test_loss: 0.9517, test_f1: 0.4971
 epoch: 49, train_loss: 0.8310, test_loss: 0.9603, test_f1: 0.5068
 epoch: 50, train_loss: 0.8279, test_loss: 0.9602, test_f1: 0.4966
 epoch: 51, train_loss: 0.8145, test_loss: 0.9648, test_f1: 0.4854
 epoch: 52, train_loss: 0.8145, test_loss: 0.9594, test_f1: 0.4874
 epoch: 53, train_loss: 0.8137, test_loss: 0.9562, test_f1: 0.4899
 epoch: 54, train_loss: 0.8189, test_loss: 0.9550, test_f1: 0.4974
 epoch: 55, train_loss: 0.7967, test_loss: 0.9610, test_f1: 0.4819
 epoch: 56, train_loss: 0.8005, test_loss: 0.9729, test_f1: 0.4683
 epoch: 57, train_loss: 0.8033, test_loss: 0.9705, test_f1: 0.4746
 epoch: 58, train_loss: 0.7973, test_loss: 0.9610, test_f1: 0.4734
 epoch: 59, train_loss: 0.8043, test_loss: 0.9559, test_f1: 0.4768
 epoch: 60, train_loss: 0.7984, test_loss: 0.9597, test_f1: 0.4818
 epoch: 61, train_loss: 0.7952, test_loss: 0.9642, test_f1: 0.4739
 epoch: 62, train_loss: 0.7955, test_loss: 0.9674, test_f1: 0.4793
 epoch: 63, train_loss: 0.7886, test_loss: 0.9694, test_f1: 0.4685
 epoch: 64, train_loss: 0.7943, test_loss: 0.9661, test_f1: 0.4842
 epoch: 65, train_loss: 0.7968, test_loss: 0.9709, test_f1: 0.4667
 epoch: 66, train_loss: 0.7813, test_loss: 0.9730, test_f1: 0.4824
 epoch: 67, train_loss: 0.7823, test_loss: 0.9741, test_f1: 0.4848
 epoch: 68, train_loss: 0.7795, test_loss: 0.9721, test_f1: 0.4900
 epoch: 69, train_loss: 0.7768, test_loss: 0.9834, test_f1: 0.4733
 epoch: 70, train_loss: 0.7721, test_loss: 0.9780, test_f1: 0.4704
 epoch: 71, train_loss: 0.7727, test_loss: 0.9761, test_f1: 0.4973
 epoch: 72, train_loss: 0.7774, test_loss: 0.9789, test_f1: 0.5010
 epoch: 73, train_loss: 0.7714, test_loss: 0.9799, test_f1: 0.4876
 epoch: 74, train_loss: 0.7595, test_loss: 0.9787, test_f1: 0.4783
 epoch: 75, train_loss: 0.7649, test_loss: 0.9913, test_f1: 0.4987
 epoch: 76, train_loss: 0.7667, test_loss: 0.9853, test_f1: 0.4990
 epoch: 77, train_loss: 0.7643, test_loss: 0.9964, test_f1: 0.4758
 epoch: 78, train_loss: 0.7660, test_loss: 0.9846, test_f1: 0.5009
 epoch: 79, train_loss: 0.7717, test_loss: 0.9860, test_f1: 0.5084
 epoch: 80, train_loss: 0.7564, test_loss: 0.9951, test_f1: 0.4875
 epoch: 81, train_loss: 0.7455, test_loss: 1.0032, test_f1: 0.4794
 epoch: 82, train_loss: 0.7595, test_loss: 0.9921, test_f1: 0.4953
 epoch: 83, train_loss: 0.7440, test_loss: 1.0046, test_f1: 0.4930
 epoch: 84, train_loss: 0.7536, test_loss: 0.9867, test_f1: 0.4856
 epoch: 85, train_loss: 0.7379, test_loss: 0.9901, test_f1: 0.5014
 epoch: 86, train_loss: 0.7472, test_loss: 0.9847, test_f1: 0.5160
 epoch: 87, train_loss: 0.7509, test_loss: 0.9990, test_f1: 0.4695
 epoch: 88, train_loss: 0.7432, test_loss: 0.9775, test_f1: 0.5141
 epoch: 89, train_loss: 0.7416, test_loss: 0.9811, test_f1: 0.5153
 epoch: 90, train_loss: 0.7380, test_loss: 0.9957, test_f1: 0.4820
 epoch: 91, train_loss: 0.7236, test_loss: 0.9879, test_f1: 0.5235
 epoch: 92, train_loss: 0.7387, test_loss: 0.9864, test_f1: 0.5122
 epoch: 93, train_loss: 0.7358, test_loss: 1.0151, test_f1: 0.4813
 epoch: 94, train_loss: 0.7256, test_loss: 1.0118, test_f1: 0.4943
 epoch: 95, train_loss: 0.7277, test_loss: 1.0169, test_f1: 0.4944
 epoch: 96, train_loss: 0.7209, test_loss: 1.0119, test_f1: 0.5025
 epoch: 97, train_loss: 0.7248, test_loss: 0.9877, test_f1: 0.4931
 epoch: 98, train_loss: 0.7121, test_loss: 1.0164, test_f1: 0.4985
 epoch: 99, train_loss: 0.7096, test_loss: 1.0089, test_f1: 0.5056
##################ITERATION #9 ****************************************
 epoch: 0, train_loss: 1.3599, test_loss: 1.2610, test_f1: 0.3251
 epoch: 1, train_loss: 1.2590, test_loss: 1.1881, test_f1: 0.3637
 epoch: 2, train_loss: 1.2191, test_loss: 1.1431, test_f1: 0.4311
 epoch: 3, train_loss: 1.1811, test_loss: 1.1020, test_f1: 0.4805
 epoch: 4, train_loss: 1.1634, test_loss: 1.0805, test_f1: 0.4828
 epoch: 5, train_loss: 1.1691, test_loss: 1.0681, test_f1: 0.4648
 epoch: 6, train_loss: 1.1413, test_loss: 1.0651, test_f1: 0.4693
 epoch: 7, train_loss: 1.1186, test_loss: 1.0521, test_f1: 0.4733
 epoch: 8, train_loss: 1.1100, test_loss: 1.0492, test_f1: 0.4674
 epoch: 9, train_loss: 1.1067, test_loss: 1.0436, test_f1: 0.4464
 epoch: 10, train_loss: 1.1037, test_loss: 1.0383, test_f1: 0.4400
 epoch: 11, train_loss: 1.0743, test_loss: 1.0317, test_f1: 0.4561
 epoch: 12, train_loss: 1.0771, test_loss: 1.0210, test_f1: 0.4733
 epoch: 13, train_loss: 1.0595, test_loss: 1.0165, test_f1: 0.4837
 epoch: 14, train_loss: 1.0535, test_loss: 1.0083, test_f1: 0.4770
 epoch: 15, train_loss: 1.0535, test_loss: 1.0097, test_f1: 0.4887
 epoch: 16, train_loss: 1.0467, test_loss: 1.0042, test_f1: 0.4989
 epoch: 17, train_loss: 1.0159, test_loss: 0.9988, test_f1: 0.5060
 epoch: 18, train_loss: 1.0277, test_loss: 0.9899, test_f1: 0.4972
 epoch: 19, train_loss: 1.0264, test_loss: 0.9862, test_f1: 0.5039
 epoch: 20, train_loss: 1.0073, test_loss: 0.9904, test_f1: 0.4985
 epoch: 21, train_loss: 1.0059, test_loss: 0.9963, test_f1: 0.4825
 epoch: 22, train_loss: 1.0007, test_loss: 0.9833, test_f1: 0.5076
 epoch: 23, train_loss: 0.9976, test_loss: 0.9828, test_f1: 0.5075
 epoch: 24, train_loss: 0.9824, test_loss: 0.9761, test_f1: 0.5073
 epoch: 25, train_loss: 0.9768, test_loss: 0.9735, test_f1: 0.5120
 epoch: 26, train_loss: 0.9734, test_loss: 0.9738, test_f1: 0.5118
 epoch: 27, train_loss: 0.9683, test_loss: 0.9769, test_f1: 0.5032
 epoch: 28, train_loss: 0.9644, test_loss: 0.9692, test_f1: 0.4978
 epoch: 29, train_loss: 0.9643, test_loss: 0.9838, test_f1: 0.4857
 epoch: 30, train_loss: 0.9419, test_loss: 0.9969, test_f1: 0.5017
 epoch: 31, train_loss: 0.9543, test_loss: 0.9691, test_f1: 0.4980
 epoch: 32, train_loss: 0.9532, test_loss: 1.0276, test_f1: 0.4889
 epoch: 33, train_loss: 0.9389, test_loss: 1.0088, test_f1: 0.4847
 epoch: 34, train_loss: 0.9411, test_loss: 0.9577, test_f1: 0.4933
 epoch: 35, train_loss: 0.9314, test_loss: 1.0262, test_f1: 0.4821
 epoch: 36, train_loss: 0.9176, test_loss: 0.9802, test_f1: 0.4995
 epoch: 37, train_loss: 0.9134, test_loss: 0.9706, test_f1: 0.4989
 epoch: 38, train_loss: 0.9110, test_loss: 1.0121, test_f1: 0.4954
 epoch: 39, train_loss: 0.9124, test_loss: 1.0259, test_f1: 0.4934
 epoch: 40, train_loss: 0.8986, test_loss: 0.9605, test_f1: 0.5054
 epoch: 41, train_loss: 0.9042, test_loss: 1.0108, test_f1: 0.4954
 epoch: 42, train_loss: 0.8940, test_loss: 1.0533, test_f1: 0.4943
 epoch: 43, train_loss: 0.8839, test_loss: 1.0026, test_f1: 0.4866
 epoch: 44, train_loss: 0.8766, test_loss: 1.0791, test_f1: 0.4863
 epoch: 45, train_loss: 0.8729, test_loss: 0.9841, test_f1: 0.4974
 epoch: 46, train_loss: 0.8763, test_loss: 1.1075, test_f1: 0.4824
 epoch: 47, train_loss: 0.8665, test_loss: 1.0027, test_f1: 0.4907
 epoch: 48, train_loss: 0.8640, test_loss: 1.0805, test_f1: 0.4757
 epoch: 49, train_loss: 0.8595, test_loss: 1.0145, test_f1: 0.4949
 epoch: 50, train_loss: 0.8579, test_loss: 1.1034, test_f1: 0.4960
 epoch: 51, train_loss: 0.8499, test_loss: 1.0641, test_f1: 0.4948
 epoch: 52, train_loss: 0.8484, test_loss: 1.0590, test_f1: 0.4899
 epoch: 53, train_loss: 0.8340, test_loss: 1.0698, test_f1: 0.4977
 epoch: 54, train_loss: 0.8474, test_loss: 1.0364, test_f1: 0.5018
 epoch: 55, train_loss: 0.8407, test_loss: 1.0462, test_f1: 0.4864
 epoch: 56, train_loss: 0.8279, test_loss: 1.0458, test_f1: 0.4910
 epoch: 57, train_loss: 0.8331, test_loss: 1.0933, test_f1: 0.4849
 epoch: 58, train_loss: 0.8294, test_loss: 1.0627, test_f1: 0.4795
 epoch: 59, train_loss: 0.8299, test_loss: 1.0459, test_f1: 0.4848
 epoch: 60, train_loss: 0.8227, test_loss: 1.0589, test_f1: 0.4753
 epoch: 61, train_loss: 0.8146, test_loss: 1.0680, test_f1: 0.4878
 epoch: 62, train_loss: 0.8159, test_loss: 1.0778, test_f1: 0.4846
 epoch: 63, train_loss: 0.8161, test_loss: 1.0990, test_f1: 0.4849
 epoch: 64, train_loss: 0.8100, test_loss: 1.1069, test_f1: 0.4736
 epoch: 65, train_loss: 0.8070, test_loss: 1.1008, test_f1: 0.4744
 epoch: 66, train_loss: 0.8180, test_loss: 1.1011, test_f1: 0.4807
 epoch: 67, train_loss: 0.8019, test_loss: 1.0578, test_f1: 0.4779
 epoch: 68, train_loss: 0.8030, test_loss: 1.0740, test_f1: 0.4780
 epoch: 69, train_loss: 0.8090, test_loss: 1.1178, test_f1: 0.4736
 epoch: 70, train_loss: 0.8097, test_loss: 1.0698, test_f1: 0.4873
 epoch: 71, train_loss: 0.8035, test_loss: 1.0904, test_f1: 0.4855
 epoch: 72, train_loss: 0.8059, test_loss: 1.0630, test_f1: 0.4951
 epoch: 73, train_loss: 0.7902, test_loss: 1.0768, test_f1: 0.4807
 epoch: 74, train_loss: 0.7863, test_loss: 1.1186, test_f1: 0.4775
 epoch: 75, train_loss: 0.7943, test_loss: 1.1216, test_f1: 0.4808
 epoch: 76, train_loss: 0.7897, test_loss: 1.1003, test_f1: 0.4834
 epoch: 77, train_loss: 0.7803, test_loss: 1.0913, test_f1: 0.4778
 epoch: 78, train_loss: 0.7760, test_loss: 1.0902, test_f1: 0.4708
 epoch: 79, train_loss: 0.7937, test_loss: 1.0684, test_f1: 0.4850
 epoch: 80, train_loss: 0.7741, test_loss: 1.0838, test_f1: 0.4810
 epoch: 81, train_loss: 0.7809, test_loss: 1.0781, test_f1: 0.4879
 epoch: 82, train_loss: 0.7695, test_loss: 1.1273, test_f1: 0.4824
 epoch: 83, train_loss: 0.7623, test_loss: 1.1073, test_f1: 0.4870
 epoch: 84, train_loss: 0.7675, test_loss: 1.1209, test_f1: 0.4782
 epoch: 85, train_loss: 0.7710, test_loss: 1.1141, test_f1: 0.4777
 epoch: 86, train_loss: 0.7563, test_loss: 1.1444, test_f1: 0.4744
 epoch: 87, train_loss: 0.7927, test_loss: 1.1034, test_f1: 0.4801
 epoch: 88, train_loss: 0.7710, test_loss: 1.1111, test_f1: 0.4849
 epoch: 89, train_loss: 0.7694, test_loss: 1.0794, test_f1: 0.4889
 epoch: 90, train_loss: 0.7570, test_loss: 1.1092, test_f1: 0.4802
 epoch: 91, train_loss: 0.7592, test_loss: 1.0861, test_f1: 0.4860
 epoch: 92, train_loss: 0.7620, test_loss: 1.1190, test_f1: 0.4841
 epoch: 93, train_loss: 0.7576, test_loss: 1.0892, test_f1: 0.4914
 epoch: 94, train_loss: 0.7456, test_loss: 1.1314, test_f1: 0.4852
 epoch: 95, train_loss: 0.7493, test_loss: 1.1331, test_f1: 0.4857
 epoch: 96, train_loss: 0.7457, test_loss: 1.0834, test_f1: 0.4853
 epoch: 97, train_loss: 0.7331, test_loss: 1.1061, test_f1: 0.4875
 epoch: 98, train_loss: 0.7483, test_loss: 1.1326, test_f1: 0.4824
 epoch: 99, train_loss: 0.7391, test_loss: 1.1023, test_f1: 0.4834

Training completed in 361.09 seconds
Best F1: 0.5444 at epoch 46
Mean F1 across iterations: 0.5272  0.0113
========================FINAL RESULTS================================
FEGIN weighted F1: 0.5444  0.0113
python main.py --data ltspice_examples --representation component_component --model FEGIN --layers 2 --hiddens 128 --batch_size 256 --lr 0.0001 --emb_size 128 --epochs 100 --save_appendix component_component_L2_H128_BS256_LR0.0001_E128 --no_val
-----



STDERR:
  File "main.py", line 370, in <module>
    main()
  File "main.py", line 254, in main
    dataset = dataset_class(
  File "/home/philip/projects/ltspice_examples_code_repo/Circuit-Completion-Using-GNNs/component_classification_with_link_prediction_head/evaluation/FEGIN/kernel/circuit_datasets.py", line 15, in __init__
    self.data, self.slices = torch.load(self.processed_paths[0])
  File "/home/philip/.local/lib/python3.8/site-packages/torch/serialization.py", line 1040, in load
    warnings.warn(
  File "/usr/lib/python3.8/warnings.py", line 109, in _showwarnmsg
    sw(msg.message, msg.category, msg.filename, msg.lineno,
  File "main.py", line 47, in warn_with_traceback
    traceback.print_stack(file=log)
/home/philip/projects/ltspice_examples_code_repo/Circuit-Completion-Using-GNNs/component_classification_with_link_prediction_head/evaluation/FEGIN/kernel/circuit_datasets.py:15: FutureWarning: You are using `torch.load` with `weights_only=False` (the current default value), which uses the default pickle module implicitly. It is possible to construct malicious pickle data which will execute arbitrary code during unpickling (See https://github.com/pytorch/pytorch/blob/main/SECURITY.md#untrusted-models for more details). In a future release, the default value for `weights_only` will be flipped to `True`. This limits the functions that could be executed during unpickling. Arbitrary objects will no longer be allowed to be loaded via this mode unless they are explicitly allowlisted by the user via `torch.serialization.add_safe_globals`. We recommend you start setting `weights_only=True` for any use case where you don't have full control of the loaded file. Please open an issue on GitHub for any issues related to this experimental feature.
  self.data, self.slices = torch.load(self.processed_paths[0])
