STDOUT:
Results will be saved in /home/philip/projects/ltspice_examples_code_repo/Circuit-Completion-Using-GNNs/component_classification_with_link_prediction_head/evaluation/FEGIN/results/model_FEGIN_dataset_ltspice_examples
Command line input: python main.py --data ltspice_examples --representation component_net --model FEGIN --layers 2 --hiddens 64 --batch_size 128 --lr 0.0001 --emb_size 512 --epochs 100 --save_appendix component_net_L2_H64_BS128_LR0.0001_E512 --no_val
 is saved.
-----
ltspice_examples - FEGIN
Using 2 layers, 64 hidden units, h = 2
Loading component_net representation dataset
ENTERED
Training FEGIN on component_net representation
Train: 3558, Test: 846
##################ITERATION #0 ****************************************
 epoch: 0, train_loss: 1.3645, test_loss: 1.3617, test_f1: 0.2270
 epoch: 1, train_loss: 1.3549, test_loss: 1.3554, test_f1: 0.2270
 epoch: 2, train_loss: 1.3486, test_loss: 1.3487, test_f1: 0.2270
 epoch: 3, train_loss: 1.3414, test_loss: 1.3414, test_f1: 0.2270
 epoch: 4, train_loss: 1.3329, test_loss: 1.3315, test_f1: 0.2270
 epoch: 5, train_loss: 1.3214, test_loss: 1.3189, test_f1: 0.2271
 epoch: 6, train_loss: 1.3075, test_loss: 1.3036, test_f1: 0.2273
 epoch: 7, train_loss: 1.2910, test_loss: 1.2848, test_f1: 0.2270
 epoch: 8, train_loss: 1.2739, test_loss: 1.2665, test_f1: 0.2275
 epoch: 9, train_loss: 1.2573, test_loss: 1.2492, test_f1: 0.2611
 epoch: 10, train_loss: 1.2395, test_loss: 1.2320, test_f1: 0.2709
 epoch: 11, train_loss: 1.2271, test_loss: 1.2149, test_f1: 0.2928
 epoch: 12, train_loss: 1.2155, test_loss: 1.1975, test_f1: 0.3182
 epoch: 13, train_loss: 1.1982, test_loss: 1.1796, test_f1: 0.3505
 epoch: 14, train_loss: 1.1844, test_loss: 1.1611, test_f1: 0.3683
 epoch: 15, train_loss: 1.1695, test_loss: 1.1439, test_f1: 0.3729
 epoch: 16, train_loss: 1.1507, test_loss: 1.1248, test_f1: 0.3899
 epoch: 17, train_loss: 1.1385, test_loss: 1.1058, test_f1: 0.4103
 epoch: 18, train_loss: 1.1243, test_loss: 1.0877, test_f1: 0.4305
 epoch: 19, train_loss: 1.1034, test_loss: 1.0704, test_f1: 0.4365
 epoch: 20, train_loss: 1.0883, test_loss: 1.0526, test_f1: 0.4432
 epoch: 21, train_loss: 1.0708, test_loss: 1.0387, test_f1: 0.4548
 epoch: 22, train_loss: 1.0544, test_loss: 1.0180, test_f1: 0.4671
 epoch: 23, train_loss: 1.0384, test_loss: 1.0057, test_f1: 0.4439
 epoch: 24, train_loss: 1.0300, test_loss: 0.9922, test_f1: 0.4642
 epoch: 25, train_loss: 1.0242, test_loss: 0.9863, test_f1: 0.4542
 epoch: 26, train_loss: 1.0088, test_loss: 0.9769, test_f1: 0.4732
 epoch: 27, train_loss: 0.9997, test_loss: 0.9707, test_f1: 0.4687
 epoch: 28, train_loss: 0.9870, test_loss: 0.9660, test_f1: 0.4639
 epoch: 29, train_loss: 0.9830, test_loss: 0.9620, test_f1: 0.4673
 epoch: 30, train_loss: 0.9718, test_loss: 0.9519, test_f1: 0.4721
 epoch: 31, train_loss: 0.9614, test_loss: 0.9510, test_f1: 0.4722
 epoch: 32, train_loss: 0.9555, test_loss: 0.9472, test_f1: 0.4800
 epoch: 33, train_loss: 0.9551, test_loss: 0.9391, test_f1: 0.4789
 epoch: 34, train_loss: 0.9491, test_loss: 0.9335, test_f1: 0.4760
 epoch: 35, train_loss: 0.9494, test_loss: 0.9338, test_f1: 0.4850
 epoch: 36, train_loss: 0.9478, test_loss: 0.9298, test_f1: 0.4920
 epoch: 37, train_loss: 0.9386, test_loss: 0.9260, test_f1: 0.4905
 epoch: 38, train_loss: 0.9351, test_loss: 0.9265, test_f1: 0.5008
 epoch: 39, train_loss: 0.9266, test_loss: 0.9195, test_f1: 0.4960
 epoch: 40, train_loss: 0.9256, test_loss: 0.9183, test_f1: 0.4962
 epoch: 41, train_loss: 0.9153, test_loss: 0.9289, test_f1: 0.4998
 epoch: 42, train_loss: 0.9196, test_loss: 0.9130, test_f1: 0.5039
 epoch: 43, train_loss: 0.9147, test_loss: 0.9146, test_f1: 0.4979
 epoch: 44, train_loss: 0.9136, test_loss: 0.9177, test_f1: 0.5042
 epoch: 45, train_loss: 0.9143, test_loss: 0.9140, test_f1: 0.5133
 epoch: 46, train_loss: 0.9103, test_loss: 0.9096, test_f1: 0.5004
 epoch: 47, train_loss: 0.8991, test_loss: 0.9193, test_f1: 0.5076
 epoch: 48, train_loss: 0.9020, test_loss: 0.9150, test_f1: 0.5075
 epoch: 49, train_loss: 0.9016, test_loss: 0.9078, test_f1: 0.5128
 epoch: 50, train_loss: 0.8986, test_loss: 0.9097, test_f1: 0.5201
 epoch: 51, train_loss: 0.8985, test_loss: 0.9095, test_f1: 0.5168
 epoch: 52, train_loss: 0.8919, test_loss: 0.9109, test_f1: 0.5118
 epoch: 53, train_loss: 0.8949, test_loss: 0.9112, test_f1: 0.5143
 epoch: 54, train_loss: 0.8924, test_loss: 0.9071, test_f1: 0.5189
 epoch: 55, train_loss: 0.8918, test_loss: 0.9020, test_f1: 0.5150
 epoch: 56, train_loss: 0.8948, test_loss: 0.9025, test_f1: 0.5248
 epoch: 57, train_loss: 0.8817, test_loss: 0.9042, test_f1: 0.5176
 epoch: 58, train_loss: 0.8888, test_loss: 0.9113, test_f1: 0.5124
 epoch: 59, train_loss: 0.8829, test_loss: 0.9106, test_f1: 0.5106
 epoch: 60, train_loss: 0.8761, test_loss: 0.9057, test_f1: 0.5107
 epoch: 61, train_loss: 0.8817, test_loss: 0.9077, test_f1: 0.5074
 epoch: 62, train_loss: 0.8845, test_loss: 0.9008, test_f1: 0.5123
 epoch: 63, train_loss: 0.8789, test_loss: 0.9026, test_f1: 0.5144
 epoch: 64, train_loss: 0.8772, test_loss: 0.9014, test_f1: 0.5111
 epoch: 65, train_loss: 0.8835, test_loss: 0.9042, test_f1: 0.5109
 epoch: 66, train_loss: 0.8694, test_loss: 0.8976, test_f1: 0.5098
 epoch: 67, train_loss: 0.8799, test_loss: 0.9069, test_f1: 0.5123
 epoch: 68, train_loss: 0.8724, test_loss: 0.9005, test_f1: 0.5108
 epoch: 69, train_loss: 0.8728, test_loss: 0.9084, test_f1: 0.5122
 epoch: 70, train_loss: 0.8728, test_loss: 0.8970, test_f1: 0.5125
 epoch: 71, train_loss: 0.8686, test_loss: 0.9012, test_f1: 0.5075
 epoch: 72, train_loss: 0.8702, test_loss: 0.9092, test_f1: 0.5059
 epoch: 73, train_loss: 0.8659, test_loss: 0.8937, test_f1: 0.5116
 epoch: 74, train_loss: 0.8730, test_loss: 0.9047, test_f1: 0.5085
 epoch: 75, train_loss: 0.8606, test_loss: 0.9014, test_f1: 0.5076
 epoch: 76, train_loss: 0.8663, test_loss: 0.9116, test_f1: 0.5072
 epoch: 77, train_loss: 0.8610, test_loss: 0.8969, test_f1: 0.5158
 epoch: 78, train_loss: 0.8652, test_loss: 0.9023, test_f1: 0.5200
 epoch: 79, train_loss: 0.8588, test_loss: 0.9024, test_f1: 0.5089
 epoch: 80, train_loss: 0.8562, test_loss: 0.8985, test_f1: 0.5101
 epoch: 81, train_loss: 0.8585, test_loss: 0.9024, test_f1: 0.5171
 epoch: 82, train_loss: 0.8656, test_loss: 0.9052, test_f1: 0.5163
 epoch: 83, train_loss: 0.8612, test_loss: 0.9055, test_f1: 0.5040
 epoch: 84, train_loss: 0.8570, test_loss: 0.9076, test_f1: 0.5170
 epoch: 85, train_loss: 0.8519, test_loss: 0.9010, test_f1: 0.5143
 epoch: 86, train_loss: 0.8526, test_loss: 0.9111, test_f1: 0.5160
 epoch: 87, train_loss: 0.8531, test_loss: 0.8935, test_f1: 0.5138
 epoch: 88, train_loss: 0.8492, test_loss: 0.9140, test_f1: 0.5133
 epoch: 89, train_loss: 0.8574, test_loss: 0.9074, test_f1: 0.5161
 epoch: 90, train_loss: 0.8547, test_loss: 0.9095, test_f1: 0.5105
 epoch: 91, train_loss: 0.8534, test_loss: 0.9197, test_f1: 0.5184
 epoch: 92, train_loss: 0.8523, test_loss: 0.9215, test_f1: 0.5159
 epoch: 93, train_loss: 0.8459, test_loss: 0.9090, test_f1: 0.5229
 epoch: 94, train_loss: 0.8452, test_loss: 0.9156, test_f1: 0.5198
 epoch: 95, train_loss: 0.8467, test_loss: 0.9066, test_f1: 0.5201
 epoch: 96, train_loss: 0.8470, test_loss: 0.9087, test_f1: 0.5187
 epoch: 97, train_loss: 0.8519, test_loss: 0.9205, test_f1: 0.5225
 epoch: 98, train_loss: 0.8424, test_loss: 0.9123, test_f1: 0.5246
 epoch: 99, train_loss: 0.8458, test_loss: 0.9164, test_f1: 0.5161
##################ITERATION #1 ****************************************
 epoch: 0, train_loss: 1.3191, test_loss: 1.3293, test_f1: 0.2270
 epoch: 1, train_loss: 1.2896, test_loss: 1.2958, test_f1: 0.2270
 epoch: 2, train_loss: 1.2695, test_loss: 1.2609, test_f1: 0.2819
 epoch: 3, train_loss: 1.2519, test_loss: 1.2380, test_f1: 0.2851
 epoch: 4, train_loss: 1.2374, test_loss: 1.2199, test_f1: 0.2945
 epoch: 5, train_loss: 1.2197, test_loss: 1.2018, test_f1: 0.2944
 epoch: 6, train_loss: 1.2028, test_loss: 1.1843, test_f1: 0.3024
 epoch: 7, train_loss: 1.1899, test_loss: 1.1668, test_f1: 0.3145
 epoch: 8, train_loss: 1.1774, test_loss: 1.1491, test_f1: 0.3387
 epoch: 9, train_loss: 1.1582, test_loss: 1.1299, test_f1: 0.3636
 epoch: 10, train_loss: 1.1410, test_loss: 1.1116, test_f1: 0.3841
 epoch: 11, train_loss: 1.1300, test_loss: 1.0928, test_f1: 0.3901
 epoch: 12, train_loss: 1.1120, test_loss: 1.0759, test_f1: 0.3940
 epoch: 13, train_loss: 1.0975, test_loss: 1.0615, test_f1: 0.4016
 epoch: 14, train_loss: 1.0790, test_loss: 1.0442, test_f1: 0.4168
 epoch: 15, train_loss: 1.0613, test_loss: 1.0328, test_f1: 0.4284
 epoch: 16, train_loss: 1.0504, test_loss: 1.0208, test_f1: 0.4317
 epoch: 17, train_loss: 1.0355, test_loss: 1.0116, test_f1: 0.4418
 epoch: 18, train_loss: 1.0257, test_loss: 0.9991, test_f1: 0.4426
 epoch: 19, train_loss: 1.0220, test_loss: 0.9954, test_f1: 0.4491
 epoch: 20, train_loss: 1.0096, test_loss: 0.9821, test_f1: 0.4623
 epoch: 21, train_loss: 1.0055, test_loss: 0.9815, test_f1: 0.4637
 epoch: 22, train_loss: 0.9895, test_loss: 0.9720, test_f1: 0.4667
 epoch: 23, train_loss: 0.9842, test_loss: 0.9786, test_f1: 0.4683
 epoch: 24, train_loss: 0.9789, test_loss: 0.9696, test_f1: 0.4724
 epoch: 25, train_loss: 0.9756, test_loss: 0.9681, test_f1: 0.4716
 epoch: 26, train_loss: 0.9708, test_loss: 0.9553, test_f1: 0.4783
 epoch: 27, train_loss: 0.9618, test_loss: 0.9579, test_f1: 0.4801
 epoch: 28, train_loss: 0.9558, test_loss: 0.9615, test_f1: 0.4929
 epoch: 29, train_loss: 0.9533, test_loss: 0.9526, test_f1: 0.4783
 epoch: 30, train_loss: 0.9466, test_loss: 0.9532, test_f1: 0.4781
 epoch: 31, train_loss: 0.9421, test_loss: 0.9489, test_f1: 0.4813
 epoch: 32, train_loss: 0.9412, test_loss: 0.9561, test_f1: 0.4808
 epoch: 33, train_loss: 0.9324, test_loss: 0.9437, test_f1: 0.4744
 epoch: 34, train_loss: 0.9365, test_loss: 0.9454, test_f1: 0.4835
 epoch: 35, train_loss: 0.9311, test_loss: 0.9480, test_f1: 0.4826
 epoch: 36, train_loss: 0.9214, test_loss: 0.9431, test_f1: 0.4775
 epoch: 37, train_loss: 0.9202, test_loss: 0.9437, test_f1: 0.5081
 epoch: 38, train_loss: 0.9164, test_loss: 0.9397, test_f1: 0.4927
 epoch: 39, train_loss: 0.9150, test_loss: 0.9482, test_f1: 0.4758
 epoch: 40, train_loss: 0.9099, test_loss: 0.9492, test_f1: 0.4845
 epoch: 41, train_loss: 0.9029, test_loss: 0.9452, test_f1: 0.5025
 epoch: 42, train_loss: 0.9127, test_loss: 0.9460, test_f1: 0.4796
 epoch: 43, train_loss: 0.8972, test_loss: 0.9417, test_f1: 0.4803
 epoch: 44, train_loss: 0.8953, test_loss: 0.9482, test_f1: 0.4954
 epoch: 45, train_loss: 0.8923, test_loss: 0.9334, test_f1: 0.4995
 epoch: 46, train_loss: 0.8952, test_loss: 0.9421, test_f1: 0.4870
 epoch: 47, train_loss: 0.8871, test_loss: 0.9528, test_f1: 0.4799
 epoch: 48, train_loss: 0.8887, test_loss: 0.9347, test_f1: 0.4881
 epoch: 49, train_loss: 0.8786, test_loss: 0.9381, test_f1: 0.5028
 epoch: 50, train_loss: 0.8806, test_loss: 0.9587, test_f1: 0.4990
 epoch: 51, train_loss: 0.8784, test_loss: 0.9518, test_f1: 0.4995
 epoch: 52, train_loss: 0.8784, test_loss: 0.9560, test_f1: 0.4944
 epoch: 53, train_loss: 0.8734, test_loss: 0.9477, test_f1: 0.4860
 epoch: 54, train_loss: 0.8732, test_loss: 0.9512, test_f1: 0.4879
 epoch: 55, train_loss: 0.8777, test_loss: 0.9498, test_f1: 0.4892
 epoch: 56, train_loss: 0.8719, test_loss: 0.9425, test_f1: 0.4995
 epoch: 57, train_loss: 0.8712, test_loss: 0.9450, test_f1: 0.4935
 epoch: 58, train_loss: 0.8708, test_loss: 0.9424, test_f1: 0.5020
 epoch: 59, train_loss: 0.8684, test_loss: 0.9479, test_f1: 0.5049
 epoch: 60, train_loss: 0.8652, test_loss: 0.9476, test_f1: 0.4955
 epoch: 61, train_loss: 0.8654, test_loss: 0.9454, test_f1: 0.5062
 epoch: 62, train_loss: 0.8621, test_loss: 0.9399, test_f1: 0.4991
 epoch: 63, train_loss: 0.8635, test_loss: 0.9488, test_f1: 0.5003
 epoch: 64, train_loss: 0.8588, test_loss: 0.9445, test_f1: 0.5100
 epoch: 65, train_loss: 0.8553, test_loss: 0.9502, test_f1: 0.5096
 epoch: 66, train_loss: 0.8538, test_loss: 0.9513, test_f1: 0.5049
 epoch: 67, train_loss: 0.8561, test_loss: 0.9496, test_f1: 0.5086
 epoch: 68, train_loss: 0.8554, test_loss: 0.9451, test_f1: 0.5109
 epoch: 69, train_loss: 0.8510, test_loss: 0.9519, test_f1: 0.5075
 epoch: 70, train_loss: 0.8516, test_loss: 0.9394, test_f1: 0.4969
 epoch: 71, train_loss: 0.8498, test_loss: 0.9476, test_f1: 0.5185
 epoch: 72, train_loss: 0.8494, test_loss: 0.9427, test_f1: 0.4974
 epoch: 73, train_loss: 0.8559, test_loss: 0.9477, test_f1: 0.5094
 epoch: 74, train_loss: 0.8424, test_loss: 0.9550, test_f1: 0.5035
 epoch: 75, train_loss: 0.8449, test_loss: 0.9510, test_f1: 0.5176
 epoch: 76, train_loss: 0.8543, test_loss: 0.9482, test_f1: 0.5080
 epoch: 77, train_loss: 0.8549, test_loss: 0.9425, test_f1: 0.5145
 epoch: 78, train_loss: 0.8445, test_loss: 0.9513, test_f1: 0.5155
 epoch: 79, train_loss: 0.8421, test_loss: 0.9413, test_f1: 0.5072
 epoch: 80, train_loss: 0.8437, test_loss: 0.9464, test_f1: 0.4998
 epoch: 81, train_loss: 0.8398, test_loss: 0.9582, test_f1: 0.5102
 epoch: 82, train_loss: 0.8465, test_loss: 0.9485, test_f1: 0.5211
 epoch: 83, train_loss: 0.8399, test_loss: 0.9557, test_f1: 0.5137
 epoch: 84, train_loss: 0.8370, test_loss: 0.9548, test_f1: 0.5116
 epoch: 85, train_loss: 0.8420, test_loss: 0.9497, test_f1: 0.5117
 epoch: 86, train_loss: 0.8322, test_loss: 0.9507, test_f1: 0.5082
 epoch: 87, train_loss: 0.8391, test_loss: 0.9406, test_f1: 0.5094
 epoch: 88, train_loss: 0.8399, test_loss: 0.9571, test_f1: 0.5156
 epoch: 89, train_loss: 0.8296, test_loss: 0.9501, test_f1: 0.5197
 epoch: 90, train_loss: 0.8432, test_loss: 0.9346, test_f1: 0.5166
 epoch: 91, train_loss: 0.8304, test_loss: 0.9437, test_f1: 0.5157
 epoch: 92, train_loss: 0.8313, test_loss: 0.9496, test_f1: 0.5136
 epoch: 93, train_loss: 0.8342, test_loss: 0.9524, test_f1: 0.5174
 epoch: 94, train_loss: 0.8339, test_loss: 0.9538, test_f1: 0.5168
 epoch: 95, train_loss: 0.8313, test_loss: 0.9541, test_f1: 0.5202
 epoch: 96, train_loss: 0.8369, test_loss: 0.9447, test_f1: 0.5202
 epoch: 97, train_loss: 0.8354, test_loss: 0.9523, test_f1: 0.5213
 epoch: 98, train_loss: 0.8307, test_loss: 0.9607, test_f1: 0.5201
 epoch: 99, train_loss: 0.8258, test_loss: 0.9605, test_f1: 0.5115
##################ITERATION #2 ****************************************
 epoch: 0, train_loss: 1.2811, test_loss: 1.3067, test_f1: 0.2270
 epoch: 1, train_loss: 1.2326, test_loss: 1.2531, test_f1: 0.2270
 epoch: 2, train_loss: 1.2108, test_loss: 1.1941, test_f1: 0.3115
 epoch: 3, train_loss: 1.1909, test_loss: 1.1642, test_f1: 0.3328
 epoch: 4, train_loss: 1.1747, test_loss: 1.1458, test_f1: 0.3410
 epoch: 5, train_loss: 1.1563, test_loss: 1.1233, test_f1: 0.3481
 epoch: 6, train_loss: 1.1359, test_loss: 1.1045, test_f1: 0.3585
 epoch: 7, train_loss: 1.1208, test_loss: 1.0832, test_f1: 0.3716
 epoch: 8, train_loss: 1.0989, test_loss: 1.0655, test_f1: 0.3857
 epoch: 9, train_loss: 1.0810, test_loss: 1.0488, test_f1: 0.3968
 epoch: 10, train_loss: 1.0645, test_loss: 1.0374, test_f1: 0.4088
 epoch: 11, train_loss: 1.0457, test_loss: 1.0229, test_f1: 0.4166
 epoch: 12, train_loss: 1.0333, test_loss: 1.0113, test_f1: 0.4307
 epoch: 13, train_loss: 1.0203, test_loss: 0.9998, test_f1: 0.4390
 epoch: 14, train_loss: 1.0075, test_loss: 0.9863, test_f1: 0.4344
 epoch: 15, train_loss: 1.0028, test_loss: 0.9867, test_f1: 0.4608
 epoch: 16, train_loss: 0.9899, test_loss: 0.9768, test_f1: 0.4694
 epoch: 17, train_loss: 0.9896, test_loss: 0.9684, test_f1: 0.4706
 epoch: 18, train_loss: 0.9743, test_loss: 0.9744, test_f1: 0.4662
 epoch: 19, train_loss: 0.9658, test_loss: 0.9783, test_f1: 0.4658
 epoch: 20, train_loss: 0.9667, test_loss: 0.9604, test_f1: 0.4714
 epoch: 21, train_loss: 0.9603, test_loss: 0.9593, test_f1: 0.4789
 epoch: 22, train_loss: 0.9499, test_loss: 0.9629, test_f1: 0.4892
 epoch: 23, train_loss: 0.9459, test_loss: 0.9603, test_f1: 0.4788
 epoch: 24, train_loss: 0.9438, test_loss: 0.9557, test_f1: 0.4886
 epoch: 25, train_loss: 0.9304, test_loss: 0.9597, test_f1: 0.4797
 epoch: 26, train_loss: 0.9253, test_loss: 0.9514, test_f1: 0.4898
 epoch: 27, train_loss: 0.9207, test_loss: 0.9682, test_f1: 0.4759
 epoch: 28, train_loss: 0.9261, test_loss: 0.9529, test_f1: 0.4875
 epoch: 29, train_loss: 0.9112, test_loss: 0.9615, test_f1: 0.4749
 epoch: 30, train_loss: 0.9122, test_loss: 0.9341, test_f1: 0.5035
 epoch: 31, train_loss: 0.9046, test_loss: 0.9428, test_f1: 0.4969
 epoch: 32, train_loss: 0.9024, test_loss: 0.9661, test_f1: 0.4962
 epoch: 33, train_loss: 0.8963, test_loss: 0.9462, test_f1: 0.5105
 epoch: 34, train_loss: 0.8943, test_loss: 0.9532, test_f1: 0.5118
 epoch: 35, train_loss: 0.8895, test_loss: 0.9447, test_f1: 0.5111
 epoch: 36, train_loss: 0.8905, test_loss: 0.9745, test_f1: 0.4993
 epoch: 37, train_loss: 0.8824, test_loss: 0.9317, test_f1: 0.5192
 epoch: 38, train_loss: 0.8747, test_loss: 0.9417, test_f1: 0.5217
 epoch: 39, train_loss: 0.8755, test_loss: 0.9664, test_f1: 0.5117
 epoch: 40, train_loss: 0.8725, test_loss: 0.9520, test_f1: 0.5205
 epoch: 41, train_loss: 0.8701, test_loss: 0.9722, test_f1: 0.5147
 epoch: 42, train_loss: 0.8677, test_loss: 0.9478, test_f1: 0.5223
 epoch: 43, train_loss: 0.8614, test_loss: 0.9335, test_f1: 0.5230
 epoch: 44, train_loss: 0.8558, test_loss: 0.9658, test_f1: 0.5220
 epoch: 45, train_loss: 0.8598, test_loss: 0.9712, test_f1: 0.5175
 epoch: 46, train_loss: 0.8582, test_loss: 0.9684, test_f1: 0.5282
 epoch: 47, train_loss: 0.8526, test_loss: 0.9425, test_f1: 0.5208
 epoch: 48, train_loss: 0.8454, test_loss: 0.9299, test_f1: 0.5258
 epoch: 49, train_loss: 0.8448, test_loss: 0.9587, test_f1: 0.5158
 epoch: 50, train_loss: 0.8375, test_loss: 0.9504, test_f1: 0.5326
 epoch: 51, train_loss: 0.8457, test_loss: 0.9460, test_f1: 0.5285
 epoch: 52, train_loss: 0.8385, test_loss: 0.9489, test_f1: 0.5296
 epoch: 53, train_loss: 0.8302, test_loss: 0.9698, test_f1: 0.5236
 epoch: 54, train_loss: 0.8404, test_loss: 0.9330, test_f1: 0.5358
 epoch: 55, train_loss: 0.8371, test_loss: 0.9512, test_f1: 0.5247
 epoch: 56, train_loss: 0.8277, test_loss: 0.9593, test_f1: 0.5341
 epoch: 57, train_loss: 0.8259, test_loss: 0.9439, test_f1: 0.5327
 epoch: 58, train_loss: 0.8312, test_loss: 0.9707, test_f1: 0.5204
 epoch: 59, train_loss: 0.8244, test_loss: 0.9676, test_f1: 0.5307
 epoch: 60, train_loss: 0.8222, test_loss: 0.9487, test_f1: 0.5345
 epoch: 61, train_loss: 0.8269, test_loss: 0.9605, test_f1: 0.5331
 epoch: 62, train_loss: 0.8289, test_loss: 0.9752, test_f1: 0.5324
 epoch: 63, train_loss: 0.8221, test_loss: 0.9672, test_f1: 0.5320
 epoch: 64, train_loss: 0.8150, test_loss: 0.9623, test_f1: 0.5353
 epoch: 65, train_loss: 0.8257, test_loss: 0.9704, test_f1: 0.5353
 epoch: 66, train_loss: 0.8179, test_loss: 0.9626, test_f1: 0.5349
 epoch: 67, train_loss: 0.8086, test_loss: 0.9639, test_f1: 0.5242
 epoch: 68, train_loss: 0.8169, test_loss: 0.9657, test_f1: 0.5350
 epoch: 69, train_loss: 0.8095, test_loss: 0.9628, test_f1: 0.5366
 epoch: 70, train_loss: 0.8133, test_loss: 0.9681, test_f1: 0.5372
 epoch: 71, train_loss: 0.8143, test_loss: 0.9654, test_f1: 0.5309
 epoch: 72, train_loss: 0.8088, test_loss: 0.9598, test_f1: 0.5328
 epoch: 73, train_loss: 0.8096, test_loss: 0.9668, test_f1: 0.5362
 epoch: 74, train_loss: 0.8182, test_loss: 0.9678, test_f1: 0.5316
 epoch: 75, train_loss: 0.8139, test_loss: 0.9630, test_f1: 0.5326
 epoch: 76, train_loss: 0.8048, test_loss: 0.9669, test_f1: 0.5368
 epoch: 77, train_loss: 0.8100, test_loss: 0.9772, test_f1: 0.5352
 epoch: 78, train_loss: 0.7994, test_loss: 0.9706, test_f1: 0.5271
 epoch: 79, train_loss: 0.8032, test_loss: 0.9825, test_f1: 0.5250
 epoch: 80, train_loss: 0.8039, test_loss: 0.9527, test_f1: 0.5341
 epoch: 81, train_loss: 0.8006, test_loss: 0.9851, test_f1: 0.5315
 epoch: 82, train_loss: 0.7934, test_loss: 0.9808, test_f1: 0.5246
 epoch: 83, train_loss: 0.7921, test_loss: 0.9615, test_f1: 0.5257
 epoch: 84, train_loss: 0.7962, test_loss: 0.9888, test_f1: 0.5325
 epoch: 85, train_loss: 0.7946, test_loss: 0.9951, test_f1: 0.5255
 epoch: 86, train_loss: 0.7990, test_loss: 0.9790, test_f1: 0.5258
 epoch: 87, train_loss: 0.7938, test_loss: 0.9837, test_f1: 0.5334
 epoch: 88, train_loss: 0.7902, test_loss: 0.9694, test_f1: 0.5244
 epoch: 89, train_loss: 0.7913, test_loss: 0.9971, test_f1: 0.5234
 epoch: 90, train_loss: 0.7987, test_loss: 0.9837, test_f1: 0.5310
 epoch: 91, train_loss: 0.7870, test_loss: 0.9798, test_f1: 0.5275
 epoch: 92, train_loss: 0.7872, test_loss: 0.9620, test_f1: 0.5324
 epoch: 93, train_loss: 0.7905, test_loss: 0.9699, test_f1: 0.5315
 epoch: 94, train_loss: 0.8009, test_loss: 0.9844, test_f1: 0.5258
 epoch: 95, train_loss: 0.7854, test_loss: 0.9901, test_f1: 0.5326
 epoch: 96, train_loss: 0.7897, test_loss: 0.9855, test_f1: 0.5233
 epoch: 97, train_loss: 0.7757, test_loss: 0.9722, test_f1: 0.5294
 epoch: 98, train_loss: 0.7765, test_loss: 0.9756, test_f1: 0.5284
 epoch: 99, train_loss: 0.7835, test_loss: 0.9849, test_f1: 0.5230
##################ITERATION #3 ****************************************
 epoch: 0, train_loss: 1.2870, test_loss: 1.2934, test_f1: 0.2270
 epoch: 1, train_loss: 1.2250, test_loss: 1.2382, test_f1: 0.2270
 epoch: 2, train_loss: 1.2052, test_loss: 1.1816, test_f1: 0.3073
 epoch: 3, train_loss: 1.1815, test_loss: 1.1509, test_f1: 0.3310
 epoch: 4, train_loss: 1.1601, test_loss: 1.1290, test_f1: 0.3379
 epoch: 5, train_loss: 1.1451, test_loss: 1.1066, test_f1: 0.3463
 epoch: 6, train_loss: 1.1235, test_loss: 1.0853, test_f1: 0.3499
 epoch: 7, train_loss: 1.1047, test_loss: 1.0674, test_f1: 0.3577
 epoch: 8, train_loss: 1.0957, test_loss: 1.0494, test_f1: 0.3743
 epoch: 9, train_loss: 1.0762, test_loss: 1.0379, test_f1: 0.4043
 epoch: 10, train_loss: 1.0580, test_loss: 1.0228, test_f1: 0.4126
 epoch: 11, train_loss: 1.0451, test_loss: 1.0125, test_f1: 0.4201
 epoch: 12, train_loss: 1.0349, test_loss: 1.0055, test_f1: 0.4385
 epoch: 13, train_loss: 1.0271, test_loss: 0.9991, test_f1: 0.4381
 epoch: 14, train_loss: 1.0109, test_loss: 0.9840, test_f1: 0.4443
 epoch: 15, train_loss: 1.0024, test_loss: 0.9745, test_f1: 0.4577
 epoch: 16, train_loss: 0.9923, test_loss: 0.9688, test_f1: 0.4570
 epoch: 17, train_loss: 0.9850, test_loss: 0.9585, test_f1: 0.4568
 epoch: 18, train_loss: 0.9875, test_loss: 0.9580, test_f1: 0.4626
 epoch: 19, train_loss: 0.9697, test_loss: 0.9536, test_f1: 0.4682
 epoch: 20, train_loss: 0.9697, test_loss: 0.9447, test_f1: 0.4813
 epoch: 21, train_loss: 0.9553, test_loss: 0.9380, test_f1: 0.4934
 epoch: 22, train_loss: 0.9531, test_loss: 0.9439, test_f1: 0.4927
 epoch: 23, train_loss: 0.9491, test_loss: 0.9334, test_f1: 0.4964
 epoch: 24, train_loss: 0.9389, test_loss: 0.9248, test_f1: 0.4959
 epoch: 25, train_loss: 0.9373, test_loss: 0.9224, test_f1: 0.4937
 epoch: 26, train_loss: 0.9315, test_loss: 0.9184, test_f1: 0.5072
 epoch: 27, train_loss: 0.9265, test_loss: 0.9247, test_f1: 0.5045
 epoch: 28, train_loss: 0.9226, test_loss: 0.9198, test_f1: 0.4956
 epoch: 29, train_loss: 0.9236, test_loss: 0.9126, test_f1: 0.5085
 epoch: 30, train_loss: 0.9144, test_loss: 0.9108, test_f1: 0.5127
 epoch: 31, train_loss: 0.9127, test_loss: 0.9153, test_f1: 0.5131
 epoch: 32, train_loss: 0.9133, test_loss: 0.9101, test_f1: 0.5150
 epoch: 33, train_loss: 0.9005, test_loss: 0.9069, test_f1: 0.5181
 epoch: 34, train_loss: 0.9006, test_loss: 0.9071, test_f1: 0.5189
 epoch: 35, train_loss: 0.8980, test_loss: 0.9011, test_f1: 0.5306
 epoch: 36, train_loss: 0.8919, test_loss: 0.9062, test_f1: 0.5060
 epoch: 37, train_loss: 0.8835, test_loss: 0.8962, test_f1: 0.5390
 epoch: 38, train_loss: 0.8918, test_loss: 0.8992, test_f1: 0.5336
 epoch: 39, train_loss: 0.8865, test_loss: 0.8964, test_f1: 0.5317
 epoch: 40, train_loss: 0.8780, test_loss: 0.8977, test_f1: 0.5113
 epoch: 41, train_loss: 0.8838, test_loss: 0.8942, test_f1: 0.5304
 epoch: 42, train_loss: 0.8786, test_loss: 0.8894, test_f1: 0.5279
 epoch: 43, train_loss: 0.8739, test_loss: 0.8919, test_f1: 0.5390
 epoch: 44, train_loss: 0.8679, test_loss: 0.9009, test_f1: 0.5159
 epoch: 45, train_loss: 0.8575, test_loss: 0.8930, test_f1: 0.5174
 epoch: 46, train_loss: 0.8681, test_loss: 0.8975, test_f1: 0.5228
 epoch: 47, train_loss: 0.8660, test_loss: 0.8985, test_f1: 0.5307
 epoch: 48, train_loss: 0.8639, test_loss: 0.8886, test_f1: 0.5275
 epoch: 49, train_loss: 0.8572, test_loss: 0.8967, test_f1: 0.5287
 epoch: 50, train_loss: 0.8609, test_loss: 0.8995, test_f1: 0.5332
 epoch: 51, train_loss: 0.8586, test_loss: 0.8969, test_f1: 0.5284
 epoch: 52, train_loss: 0.8548, test_loss: 0.8904, test_f1: 0.5303
 epoch: 53, train_loss: 0.8473, test_loss: 0.8963, test_f1: 0.5292
 epoch: 54, train_loss: 0.8366, test_loss: 0.8840, test_f1: 0.5270
 epoch: 55, train_loss: 0.8452, test_loss: 0.8909, test_f1: 0.5318
 epoch: 56, train_loss: 0.8423, test_loss: 0.8824, test_f1: 0.5336
 epoch: 57, train_loss: 0.8388, test_loss: 0.8875, test_f1: 0.5441
 epoch: 58, train_loss: 0.8386, test_loss: 0.8867, test_f1: 0.5329
 epoch: 59, train_loss: 0.8366, test_loss: 0.8919, test_f1: 0.5308
 epoch: 60, train_loss: 0.8387, test_loss: 0.8900, test_f1: 0.5406
 epoch: 61, train_loss: 0.8419, test_loss: 0.8889, test_f1: 0.5304
 epoch: 62, train_loss: 0.8332, test_loss: 0.8821, test_f1: 0.5407
 epoch: 63, train_loss: 0.8287, test_loss: 0.8909, test_f1: 0.5442
 epoch: 64, train_loss: 0.8394, test_loss: 0.8936, test_f1: 0.5446
 epoch: 65, train_loss: 0.8202, test_loss: 0.8915, test_f1: 0.5511
 epoch: 66, train_loss: 0.8406, test_loss: 0.8866, test_f1: 0.5463
 epoch: 67, train_loss: 0.8285, test_loss: 0.8881, test_f1: 0.5444
 epoch: 68, train_loss: 0.8303, test_loss: 0.8901, test_f1: 0.5452
 epoch: 69, train_loss: 0.8328, test_loss: 0.8824, test_f1: 0.5375
 epoch: 70, train_loss: 0.8273, test_loss: 0.8852, test_f1: 0.5506
 epoch: 71, train_loss: 0.8237, test_loss: 0.8955, test_f1: 0.5370
 epoch: 72, train_loss: 0.8306, test_loss: 0.8852, test_f1: 0.5394
 epoch: 73, train_loss: 0.8190, test_loss: 0.8876, test_f1: 0.5516
 epoch: 74, train_loss: 0.8122, test_loss: 0.8812, test_f1: 0.5367
 epoch: 75, train_loss: 0.8276, test_loss: 0.8860, test_f1: 0.5473
 epoch: 76, train_loss: 0.8128, test_loss: 0.8953, test_f1: 0.5556
 epoch: 77, train_loss: 0.8210, test_loss: 0.8864, test_f1: 0.5551
 epoch: 78, train_loss: 0.8148, test_loss: 0.8819, test_f1: 0.5431
 epoch: 79, train_loss: 0.8185, test_loss: 0.8924, test_f1: 0.5476
 epoch: 80, train_loss: 0.8135, test_loss: 0.8892, test_f1: 0.5432
 epoch: 81, train_loss: 0.8191, test_loss: 0.8963, test_f1: 0.5455
 epoch: 82, train_loss: 0.8115, test_loss: 0.8836, test_f1: 0.5352
 epoch: 83, train_loss: 0.8106, test_loss: 0.9019, test_f1: 0.5480
 epoch: 84, train_loss: 0.8095, test_loss: 0.8872, test_f1: 0.5504
 epoch: 85, train_loss: 0.8080, test_loss: 0.8905, test_f1: 0.5472
 epoch: 86, train_loss: 0.8049, test_loss: 0.8789, test_f1: 0.5519
 epoch: 87, train_loss: 0.8131, test_loss: 0.9024, test_f1: 0.5550
 epoch: 88, train_loss: 0.8103, test_loss: 0.8864, test_f1: 0.5537
 epoch: 89, train_loss: 0.8122, test_loss: 0.8949, test_f1: 0.5461
 epoch: 90, train_loss: 0.8015, test_loss: 0.8876, test_f1: 0.5462
 epoch: 91, train_loss: 0.8031, test_loss: 0.8815, test_f1: 0.5485
 epoch: 92, train_loss: 0.8009, test_loss: 0.9100, test_f1: 0.5557
 epoch: 93, train_loss: 0.8098, test_loss: 0.8960, test_f1: 0.5322
 epoch: 94, train_loss: 0.8029, test_loss: 0.9023, test_f1: 0.5440
 epoch: 95, train_loss: 0.8091, test_loss: 0.8844, test_f1: 0.5495
 epoch: 96, train_loss: 0.8047, test_loss: 0.8860, test_f1: 0.5553
 epoch: 97, train_loss: 0.8006, test_loss: 0.8907, test_f1: 0.5513
 epoch: 98, train_loss: 0.7995, test_loss: 0.8873, test_f1: 0.5441
 epoch: 99, train_loss: 0.7925, test_loss: 0.8885, test_f1: 0.5512
##################ITERATION #4 ****************************************
 epoch: 0, train_loss: 1.2800, test_loss: 1.2910, test_f1: 0.2270
 epoch: 1, train_loss: 1.2061, test_loss: 1.2072, test_f1: 0.3285
 epoch: 2, train_loss: 1.1854, test_loss: 1.1511, test_f1: 0.3682
 epoch: 3, train_loss: 1.1615, test_loss: 1.1202, test_f1: 0.3903
 epoch: 4, train_loss: 1.1419, test_loss: 1.0988, test_f1: 0.4029
 epoch: 5, train_loss: 1.1315, test_loss: 1.0820, test_f1: 0.4105
 epoch: 6, train_loss: 1.1039, test_loss: 1.0709, test_f1: 0.4249
 epoch: 7, train_loss: 1.0911, test_loss: 1.0509, test_f1: 0.4269
 epoch: 8, train_loss: 1.0766, test_loss: 1.0366, test_f1: 0.4373
 epoch: 9, train_loss: 1.0707, test_loss: 1.0238, test_f1: 0.4551
 epoch: 10, train_loss: 1.0509, test_loss: 1.0137, test_f1: 0.4591
 epoch: 11, train_loss: 1.0440, test_loss: 1.0010, test_f1: 0.4609
 epoch: 12, train_loss: 1.0272, test_loss: 0.9875, test_f1: 0.4762
 epoch: 13, train_loss: 1.0215, test_loss: 0.9839, test_f1: 0.4760
 epoch: 14, train_loss: 1.0110, test_loss: 0.9811, test_f1: 0.4688
 epoch: 15, train_loss: 0.9970, test_loss: 0.9686, test_f1: 0.4781
 epoch: 16, train_loss: 0.9913, test_loss: 0.9555, test_f1: 0.4852
 epoch: 17, train_loss: 0.9851, test_loss: 0.9572, test_f1: 0.4960
 epoch: 18, train_loss: 0.9737, test_loss: 0.9555, test_f1: 0.4899
 epoch: 19, train_loss: 0.9684, test_loss: 0.9479, test_f1: 0.4987
 epoch: 20, train_loss: 0.9591, test_loss: 0.9435, test_f1: 0.4913
 epoch: 21, train_loss: 0.9572, test_loss: 0.9389, test_f1: 0.4963
 epoch: 22, train_loss: 0.9495, test_loss: 0.9331, test_f1: 0.5076
 epoch: 23, train_loss: 0.9499, test_loss: 0.9294, test_f1: 0.5035
 epoch: 24, train_loss: 0.9363, test_loss: 0.9268, test_f1: 0.4974
 epoch: 25, train_loss: 0.9396, test_loss: 0.9181, test_f1: 0.5006
 epoch: 26, train_loss: 0.9314, test_loss: 0.9256, test_f1: 0.5026
 epoch: 27, train_loss: 0.9264, test_loss: 0.9178, test_f1: 0.5063
 epoch: 28, train_loss: 0.9319, test_loss: 0.9193, test_f1: 0.5063
 epoch: 29, train_loss: 0.9231, test_loss: 0.9115, test_f1: 0.5126
 epoch: 30, train_loss: 0.9145, test_loss: 0.9168, test_f1: 0.5113
 epoch: 31, train_loss: 0.9105, test_loss: 0.9021, test_f1: 0.5135
 epoch: 32, train_loss: 0.9056, test_loss: 0.9013, test_f1: 0.5184
 epoch: 33, train_loss: 0.9015, test_loss: 0.9047, test_f1: 0.5193
 epoch: 34, train_loss: 0.9018, test_loss: 0.9055, test_f1: 0.5108
 epoch: 35, train_loss: 0.8945, test_loss: 0.8984, test_f1: 0.5240
 epoch: 36, train_loss: 0.8953, test_loss: 0.8943, test_f1: 0.5241
 epoch: 37, train_loss: 0.8979, test_loss: 0.8926, test_f1: 0.5260
 epoch: 38, train_loss: 0.8979, test_loss: 0.8893, test_f1: 0.5276
 epoch: 39, train_loss: 0.8894, test_loss: 0.8886, test_f1: 0.5241
 epoch: 40, train_loss: 0.8827, test_loss: 0.8844, test_f1: 0.5293
 epoch: 41, train_loss: 0.8770, test_loss: 0.8880, test_f1: 0.5466
 epoch: 42, train_loss: 0.8718, test_loss: 0.8818, test_f1: 0.5308
 epoch: 43, train_loss: 0.8710, test_loss: 0.8882, test_f1: 0.5183
 epoch: 44, train_loss: 0.8640, test_loss: 0.8983, test_f1: 0.5316
 epoch: 45, train_loss: 0.8730, test_loss: 0.8849, test_f1: 0.5324
 epoch: 46, train_loss: 0.8701, test_loss: 0.8756, test_f1: 0.5313
 epoch: 47, train_loss: 0.8633, test_loss: 0.8728, test_f1: 0.5430
 epoch: 48, train_loss: 0.8612, test_loss: 0.8808, test_f1: 0.5369
 epoch: 49, train_loss: 0.8670, test_loss: 0.8745, test_f1: 0.5275
 epoch: 50, train_loss: 0.8528, test_loss: 0.8723, test_f1: 0.5354
 epoch: 51, train_loss: 0.8532, test_loss: 0.8728, test_f1: 0.5367
 epoch: 52, train_loss: 0.8502, test_loss: 0.8739, test_f1: 0.5396
 epoch: 53, train_loss: 0.8558, test_loss: 0.8726, test_f1: 0.5402
 epoch: 54, train_loss: 0.8492, test_loss: 0.8729, test_f1: 0.5365
 epoch: 55, train_loss: 0.8451, test_loss: 0.8725, test_f1: 0.5336
 epoch: 56, train_loss: 0.8549, test_loss: 0.8759, test_f1: 0.5455
 epoch: 57, train_loss: 0.8353, test_loss: 0.8721, test_f1: 0.5345
 epoch: 58, train_loss: 0.8512, test_loss: 0.8753, test_f1: 0.5413
 epoch: 59, train_loss: 0.8442, test_loss: 0.8777, test_f1: 0.5384
 epoch: 60, train_loss: 0.8463, test_loss: 0.8719, test_f1: 0.5353
 epoch: 61, train_loss: 0.8412, test_loss: 0.8751, test_f1: 0.5508
 epoch: 62, train_loss: 0.8442, test_loss: 0.8730, test_f1: 0.5417
 epoch: 63, train_loss: 0.8362, test_loss: 0.8684, test_f1: 0.5387
 epoch: 64, train_loss: 0.8425, test_loss: 0.8693, test_f1: 0.5517
 epoch: 65, train_loss: 0.8402, test_loss: 0.8710, test_f1: 0.5493
 epoch: 66, train_loss: 0.8298, test_loss: 0.8745, test_f1: 0.5594
 epoch: 67, train_loss: 0.8306, test_loss: 0.8665, test_f1: 0.5543
 epoch: 68, train_loss: 0.8311, test_loss: 0.8669, test_f1: 0.5447
 epoch: 69, train_loss: 0.8348, test_loss: 0.8697, test_f1: 0.5623
 epoch: 70, train_loss: 0.8393, test_loss: 0.8739, test_f1: 0.5518
 epoch: 71, train_loss: 0.8368, test_loss: 0.8730, test_f1: 0.5463
 epoch: 72, train_loss: 0.8266, test_loss: 0.8683, test_f1: 0.5532
 epoch: 73, train_loss: 0.8316, test_loss: 0.8681, test_f1: 0.5565
 epoch: 74, train_loss: 0.8274, test_loss: 0.8706, test_f1: 0.5600
 epoch: 75, train_loss: 0.8260, test_loss: 0.8667, test_f1: 0.5659
 epoch: 76, train_loss: 0.8239, test_loss: 0.8655, test_f1: 0.5595
 epoch: 77, train_loss: 0.8342, test_loss: 0.8679, test_f1: 0.5633
 epoch: 78, train_loss: 0.8209, test_loss: 0.8674, test_f1: 0.5554
 epoch: 79, train_loss: 0.8275, test_loss: 0.8731, test_f1: 0.5661
 epoch: 80, train_loss: 0.8234, test_loss: 0.8688, test_f1: 0.5646
 epoch: 81, train_loss: 0.8282, test_loss: 0.8763, test_f1: 0.5608
 epoch: 82, train_loss: 0.8247, test_loss: 0.8671, test_f1: 0.5654
 epoch: 83, train_loss: 0.8203, test_loss: 0.8640, test_f1: 0.5653
 epoch: 84, train_loss: 0.8169, test_loss: 0.8707, test_f1: 0.5680
 epoch: 85, train_loss: 0.8159, test_loss: 0.8642, test_f1: 0.5499
 epoch: 86, train_loss: 0.8141, test_loss: 0.8622, test_f1: 0.5482
 epoch: 87, train_loss: 0.8126, test_loss: 0.8625, test_f1: 0.5664
 epoch: 88, train_loss: 0.8176, test_loss: 0.8605, test_f1: 0.5656
 epoch: 89, train_loss: 0.8171, test_loss: 0.8681, test_f1: 0.5531
 epoch: 90, train_loss: 0.8191, test_loss: 0.8607, test_f1: 0.5691
 epoch: 91, train_loss: 0.8128, test_loss: 0.8646, test_f1: 0.5619
 epoch: 92, train_loss: 0.8144, test_loss: 0.8683, test_f1: 0.5617
 epoch: 93, train_loss: 0.8093, test_loss: 0.8628, test_f1: 0.5612
 epoch: 94, train_loss: 0.8135, test_loss: 0.8671, test_f1: 0.5567
 epoch: 95, train_loss: 0.8078, test_loss: 0.8662, test_f1: 0.5527
 epoch: 96, train_loss: 0.8116, test_loss: 0.8675, test_f1: 0.5598
 epoch: 97, train_loss: 0.8011, test_loss: 0.8705, test_f1: 0.5531
 epoch: 98, train_loss: 0.8086, test_loss: 0.8648, test_f1: 0.5633
 epoch: 99, train_loss: 0.8075, test_loss: 0.8647, test_f1: 0.5584
##################ITERATION #5 ****************************************
 epoch: 0, train_loss: 1.2770, test_loss: 1.2464, test_f1: 0.2270
 epoch: 1, train_loss: 1.2032, test_loss: 1.1665, test_f1: 0.3373
 epoch: 2, train_loss: 1.1683, test_loss: 1.1173, test_f1: 0.3672
 epoch: 3, train_loss: 1.1482, test_loss: 1.0940, test_f1: 0.3854
 epoch: 4, train_loss: 1.1337, test_loss: 1.0763, test_f1: 0.4013
 epoch: 5, train_loss: 1.1091, test_loss: 1.0612, test_f1: 0.4280
 epoch: 6, train_loss: 1.0966, test_loss: 1.0458, test_f1: 0.4415
 epoch: 7, train_loss: 1.0776, test_loss: 1.0370, test_f1: 0.4470
 epoch: 8, train_loss: 1.0630, test_loss: 1.0208, test_f1: 0.4580
 epoch: 9, train_loss: 1.0517, test_loss: 1.0096, test_f1: 0.4562
 epoch: 10, train_loss: 1.0391, test_loss: 0.9965, test_f1: 0.4654
 epoch: 11, train_loss: 1.0293, test_loss: 0.9862, test_f1: 0.4661
 epoch: 12, train_loss: 1.0190, test_loss: 0.9827, test_f1: 0.4701
 epoch: 13, train_loss: 1.0034, test_loss: 0.9708, test_f1: 0.4710
 epoch: 14, train_loss: 0.9892, test_loss: 0.9631, test_f1: 0.4823
 epoch: 15, train_loss: 0.9910, test_loss: 0.9638, test_f1: 0.4801
 epoch: 16, train_loss: 0.9853, test_loss: 0.9566, test_f1: 0.4819
 epoch: 17, train_loss: 0.9809, test_loss: 0.9505, test_f1: 0.4820
 epoch: 18, train_loss: 0.9734, test_loss: 0.9460, test_f1: 0.4831
 epoch: 19, train_loss: 0.9660, test_loss: 0.9453, test_f1: 0.4864
 epoch: 20, train_loss: 0.9600, test_loss: 0.9404, test_f1: 0.4947
 epoch: 21, train_loss: 0.9610, test_loss: 0.9402, test_f1: 0.4849
 epoch: 22, train_loss: 0.9508, test_loss: 0.9368, test_f1: 0.4845
 epoch: 23, train_loss: 0.9480, test_loss: 0.9339, test_f1: 0.4846
 epoch: 24, train_loss: 0.9458, test_loss: 0.9393, test_f1: 0.4949
 epoch: 25, train_loss: 0.9349, test_loss: 0.9391, test_f1: 0.4962
 epoch: 26, train_loss: 0.9391, test_loss: 0.9369, test_f1: 0.5030
 epoch: 27, train_loss: 0.9353, test_loss: 0.9334, test_f1: 0.5035
 epoch: 28, train_loss: 0.9326, test_loss: 0.9243, test_f1: 0.5049
 epoch: 29, train_loss: 0.9207, test_loss: 0.9266, test_f1: 0.5022
 epoch: 30, train_loss: 0.9179, test_loss: 0.9289, test_f1: 0.5155
 epoch: 31, train_loss: 0.9165, test_loss: 0.9291, test_f1: 0.5020
 epoch: 32, train_loss: 0.9212, test_loss: 0.9240, test_f1: 0.4926
 epoch: 33, train_loss: 0.9230, test_loss: 0.9337, test_f1: 0.5077
 epoch: 34, train_loss: 0.9174, test_loss: 0.9220, test_f1: 0.5075
 epoch: 35, train_loss: 0.9049, test_loss: 0.9321, test_f1: 0.5088
 epoch: 36, train_loss: 0.9039, test_loss: 0.9261, test_f1: 0.5131
 epoch: 37, train_loss: 0.9048, test_loss: 0.9279, test_f1: 0.5071
 epoch: 38, train_loss: 0.8999, test_loss: 0.9253, test_f1: 0.5112
 epoch: 39, train_loss: 0.8979, test_loss: 0.9230, test_f1: 0.5073
 epoch: 40, train_loss: 0.9007, test_loss: 0.9268, test_f1: 0.5017
 epoch: 41, train_loss: 0.8910, test_loss: 0.9324, test_f1: 0.4984
 epoch: 42, train_loss: 0.8932, test_loss: 0.9194, test_f1: 0.5153
 epoch: 43, train_loss: 0.8944, test_loss: 0.9368, test_f1: 0.5037
 epoch: 44, train_loss: 0.8842, test_loss: 0.9292, test_f1: 0.4918
 epoch: 45, train_loss: 0.8763, test_loss: 0.9231, test_f1: 0.5040
 epoch: 46, train_loss: 0.8783, test_loss: 0.9192, test_f1: 0.5145
 epoch: 47, train_loss: 0.8720, test_loss: 0.9207, test_f1: 0.5058
 epoch: 48, train_loss: 0.8801, test_loss: 0.9180, test_f1: 0.5138
 epoch: 49, train_loss: 0.8795, test_loss: 0.9263, test_f1: 0.5188
 epoch: 50, train_loss: 0.8722, test_loss: 0.9192, test_f1: 0.5178
 epoch: 51, train_loss: 0.8719, test_loss: 0.9115, test_f1: 0.5126
 epoch: 52, train_loss: 0.8673, test_loss: 0.9189, test_f1: 0.5075
 epoch: 53, train_loss: 0.8672, test_loss: 0.9147, test_f1: 0.5088
 epoch: 54, train_loss: 0.8611, test_loss: 0.9242, test_f1: 0.5146
 epoch: 55, train_loss: 0.8574, test_loss: 0.9303, test_f1: 0.5073
 epoch: 56, train_loss: 0.8546, test_loss: 0.9219, test_f1: 0.5225
 epoch: 57, train_loss: 0.8552, test_loss: 0.9218, test_f1: 0.5134
 epoch: 58, train_loss: 0.8594, test_loss: 0.9339, test_f1: 0.5153
 epoch: 59, train_loss: 0.8476, test_loss: 0.9209, test_f1: 0.5200
 epoch: 60, train_loss: 0.8538, test_loss: 0.9225, test_f1: 0.5153
 epoch: 61, train_loss: 0.8554, test_loss: 0.9228, test_f1: 0.5227
 epoch: 62, train_loss: 0.8596, test_loss: 0.9295, test_f1: 0.5245
 epoch: 63, train_loss: 0.8583, test_loss: 0.9155, test_f1: 0.5122
 epoch: 64, train_loss: 0.8558, test_loss: 0.9314, test_f1: 0.5201
 epoch: 65, train_loss: 0.8480, test_loss: 0.9235, test_f1: 0.5180
 epoch: 66, train_loss: 0.8462, test_loss: 0.9300, test_f1: 0.5200
 epoch: 67, train_loss: 0.8471, test_loss: 0.9234, test_f1: 0.5181
 epoch: 68, train_loss: 0.8492, test_loss: 0.9283, test_f1: 0.5196
 epoch: 69, train_loss: 0.8436, test_loss: 0.9240, test_f1: 0.5172
 epoch: 70, train_loss: 0.8423, test_loss: 0.9167, test_f1: 0.5218
 epoch: 71, train_loss: 0.8462, test_loss: 0.9227, test_f1: 0.5174
 epoch: 72, train_loss: 0.8497, test_loss: 0.9274, test_f1: 0.5222
 epoch: 73, train_loss: 0.8412, test_loss: 0.9336, test_f1: 0.5150
 epoch: 74, train_loss: 0.8383, test_loss: 0.9230, test_f1: 0.5190
 epoch: 75, train_loss: 0.8384, test_loss: 0.9236, test_f1: 0.5185
 epoch: 76, train_loss: 0.8361, test_loss: 0.9264, test_f1: 0.5201
 epoch: 77, train_loss: 0.8373, test_loss: 0.9319, test_f1: 0.5213
 epoch: 78, train_loss: 0.8370, test_loss: 0.9206, test_f1: 0.5210
 epoch: 79, train_loss: 0.8378, test_loss: 0.9229, test_f1: 0.5186
 epoch: 80, train_loss: 0.8366, test_loss: 0.9375, test_f1: 0.5184
 epoch: 81, train_loss: 0.8333, test_loss: 0.9252, test_f1: 0.5153
 epoch: 82, train_loss: 0.8429, test_loss: 0.9251, test_f1: 0.5194
 epoch: 83, train_loss: 0.8359, test_loss: 0.9247, test_f1: 0.5209
 epoch: 84, train_loss: 0.8268, test_loss: 0.9301, test_f1: 0.5242
 epoch: 85, train_loss: 0.8231, test_loss: 0.9263, test_f1: 0.5245
 epoch: 86, train_loss: 0.8291, test_loss: 0.9286, test_f1: 0.5231
 epoch: 87, train_loss: 0.8393, test_loss: 0.9345, test_f1: 0.5257
 epoch: 88, train_loss: 0.8343, test_loss: 0.9301, test_f1: 0.5196
 epoch: 89, train_loss: 0.8331, test_loss: 0.9192, test_f1: 0.5263
 epoch: 90, train_loss: 0.8263, test_loss: 0.9334, test_f1: 0.5208
 epoch: 91, train_loss: 0.8289, test_loss: 0.9321, test_f1: 0.5269
 epoch: 92, train_loss: 0.8256, test_loss: 0.9255, test_f1: 0.5200
 epoch: 93, train_loss: 0.8195, test_loss: 0.9298, test_f1: 0.5280
 epoch: 94, train_loss: 0.8229, test_loss: 0.9256, test_f1: 0.5318
 epoch: 95, train_loss: 0.8123, test_loss: 0.9297, test_f1: 0.5232
 epoch: 96, train_loss: 0.8202, test_loss: 0.9296, test_f1: 0.5314
 epoch: 97, train_loss: 0.8241, test_loss: 0.9181, test_f1: 0.5242
 epoch: 98, train_loss: 0.8188, test_loss: 0.9239, test_f1: 0.5287
 epoch: 99, train_loss: 0.8141, test_loss: 0.9326, test_f1: 0.5299
##################ITERATION #6 ****************************************
 epoch: 0, train_loss: 1.3159, test_loss: 1.3120, test_f1: 0.2270
 epoch: 1, train_loss: 1.2089, test_loss: 1.2125, test_f1: 0.2519
 epoch: 2, train_loss: 1.1794, test_loss: 1.1384, test_f1: 0.3460
 epoch: 3, train_loss: 1.1528, test_loss: 1.1022, test_f1: 0.3576
 epoch: 4, train_loss: 1.1367, test_loss: 1.0813, test_f1: 0.3865
 epoch: 5, train_loss: 1.1073, test_loss: 1.0659, test_f1: 0.4106
 epoch: 6, train_loss: 1.0912, test_loss: 1.0530, test_f1: 0.4212
 epoch: 7, train_loss: 1.0744, test_loss: 1.0384, test_f1: 0.4387
 epoch: 8, train_loss: 1.0568, test_loss: 1.0256, test_f1: 0.4567
 epoch: 9, train_loss: 1.0436, test_loss: 1.0216, test_f1: 0.4682
 epoch: 10, train_loss: 1.0295, test_loss: 1.0131, test_f1: 0.4607
 epoch: 11, train_loss: 1.0239, test_loss: 1.0016, test_f1: 0.4801
 epoch: 12, train_loss: 1.0129, test_loss: 1.0041, test_f1: 0.4563
 epoch: 13, train_loss: 1.0044, test_loss: 1.0025, test_f1: 0.4685
 epoch: 14, train_loss: 0.9954, test_loss: 0.9927, test_f1: 0.4797
 epoch: 15, train_loss: 0.9878, test_loss: 0.9933, test_f1: 0.4827
 epoch: 16, train_loss: 0.9841, test_loss: 0.9917, test_f1: 0.4855
 epoch: 17, train_loss: 0.9796, test_loss: 0.9826, test_f1: 0.4963
 epoch: 18, train_loss: 0.9725, test_loss: 0.9855, test_f1: 0.4882
 epoch: 19, train_loss: 0.9663, test_loss: 0.9814, test_f1: 0.4828
 epoch: 20, train_loss: 0.9561, test_loss: 0.9762, test_f1: 0.4887
 epoch: 21, train_loss: 0.9554, test_loss: 0.9870, test_f1: 0.4931
 epoch: 22, train_loss: 0.9415, test_loss: 0.9814, test_f1: 0.5127
 epoch: 23, train_loss: 0.9429, test_loss: 0.9716, test_f1: 0.5112
 epoch: 24, train_loss: 0.9356, test_loss: 0.9820, test_f1: 0.5098
 epoch: 25, train_loss: 0.9337, test_loss: 0.9765, test_f1: 0.5074
 epoch: 26, train_loss: 0.9318, test_loss: 0.9702, test_f1: 0.5070
 epoch: 27, train_loss: 0.9286, test_loss: 0.9730, test_f1: 0.5215
 epoch: 28, train_loss: 0.9201, test_loss: 0.9769, test_f1: 0.5067
 epoch: 29, train_loss: 0.9223, test_loss: 0.9800, test_f1: 0.5249
 epoch: 30, train_loss: 0.9233, test_loss: 0.9789, test_f1: 0.5268
 epoch: 31, train_loss: 0.9104, test_loss: 0.9820, test_f1: 0.5182
 epoch: 32, train_loss: 0.9096, test_loss: 0.9812, test_f1: 0.5233
 epoch: 33, train_loss: 0.9056, test_loss: 0.9720, test_f1: 0.5302
 epoch: 34, train_loss: 0.9003, test_loss: 0.9842, test_f1: 0.5136
 epoch: 35, train_loss: 0.9085, test_loss: 0.9855, test_f1: 0.5353
 epoch: 36, train_loss: 0.9004, test_loss: 0.9692, test_f1: 0.5409
 epoch: 37, train_loss: 0.8872, test_loss: 0.9714, test_f1: 0.5238
 epoch: 38, train_loss: 0.8842, test_loss: 0.9870, test_f1: 0.5274
 epoch: 39, train_loss: 0.8917, test_loss: 0.9847, test_f1: 0.5230
 epoch: 40, train_loss: 0.8830, test_loss: 0.9819, test_f1: 0.5237
 epoch: 41, train_loss: 0.8764, test_loss: 0.9774, test_f1: 0.5339
 epoch: 42, train_loss: 0.8756, test_loss: 0.9782, test_f1: 0.5393
 epoch: 43, train_loss: 0.8779, test_loss: 0.9879, test_f1: 0.5330
 epoch: 44, train_loss: 0.8718, test_loss: 0.9746, test_f1: 0.5363
 epoch: 45, train_loss: 0.8707, test_loss: 0.9866, test_f1: 0.5399
 epoch: 46, train_loss: 0.8658, test_loss: 0.9749, test_f1: 0.5294
 epoch: 47, train_loss: 0.8667, test_loss: 0.9775, test_f1: 0.5528
 epoch: 48, train_loss: 0.8579, test_loss: 0.9792, test_f1: 0.5445
 epoch: 49, train_loss: 0.8573, test_loss: 0.9911, test_f1: 0.5481
 epoch: 50, train_loss: 0.8551, test_loss: 0.9812, test_f1: 0.5441
 epoch: 51, train_loss: 0.8565, test_loss: 0.9851, test_f1: 0.5328
 epoch: 52, train_loss: 0.8469, test_loss: 0.9861, test_f1: 0.5477
 epoch: 53, train_loss: 0.8436, test_loss: 0.9836, test_f1: 0.5391
 epoch: 54, train_loss: 0.8492, test_loss: 0.9820, test_f1: 0.5405
 epoch: 55, train_loss: 0.8497, test_loss: 0.9814, test_f1: 0.5516
 epoch: 56, train_loss: 0.8466, test_loss: 0.9751, test_f1: 0.5509
 epoch: 57, train_loss: 0.8476, test_loss: 0.9864, test_f1: 0.5428
 epoch: 58, train_loss: 0.8381, test_loss: 0.9822, test_f1: 0.5447
 epoch: 59, train_loss: 0.8456, test_loss: 0.9888, test_f1: 0.5543
 epoch: 60, train_loss: 0.8415, test_loss: 0.9802, test_f1: 0.5457
 epoch: 61, train_loss: 0.8426, test_loss: 0.9838, test_f1: 0.5440
 epoch: 62, train_loss: 0.8355, test_loss: 0.9849, test_f1: 0.5440
 epoch: 63, train_loss: 0.8337, test_loss: 0.9830, test_f1: 0.5512
 epoch: 64, train_loss: 0.8325, test_loss: 0.9841, test_f1: 0.5489
 epoch: 65, train_loss: 0.8419, test_loss: 0.9881, test_f1: 0.5435
 epoch: 66, train_loss: 0.8362, test_loss: 0.9800, test_f1: 0.5528
 epoch: 67, train_loss: 0.8306, test_loss: 0.9867, test_f1: 0.5476
 epoch: 68, train_loss: 0.8324, test_loss: 0.9895, test_f1: 0.5567
 epoch: 69, train_loss: 0.8216, test_loss: 0.9834, test_f1: 0.5431
 epoch: 70, train_loss: 0.8326, test_loss: 0.9812, test_f1: 0.5535
 epoch: 71, train_loss: 0.8291, test_loss: 0.9963, test_f1: 0.5521
 epoch: 72, train_loss: 0.8261, test_loss: 0.9860, test_f1: 0.5511
 epoch: 73, train_loss: 0.8291, test_loss: 0.9908, test_f1: 0.5446
 epoch: 74, train_loss: 0.8312, test_loss: 0.9889, test_f1: 0.5541
 epoch: 75, train_loss: 0.8275, test_loss: 1.0015, test_f1: 0.5481
 epoch: 76, train_loss: 0.8278, test_loss: 0.9936, test_f1: 0.5415
 epoch: 77, train_loss: 0.8297, test_loss: 0.9882, test_f1: 0.5495
 epoch: 78, train_loss: 0.8182, test_loss: 0.9937, test_f1: 0.5499
 epoch: 79, train_loss: 0.8255, test_loss: 0.9902, test_f1: 0.5497
 epoch: 80, train_loss: 0.8216, test_loss: 0.9826, test_f1: 0.5487
 epoch: 81, train_loss: 0.8159, test_loss: 1.0011, test_f1: 0.5487
 epoch: 82, train_loss: 0.8070, test_loss: 0.9901, test_f1: 0.5581
 epoch: 83, train_loss: 0.8224, test_loss: 0.9896, test_f1: 0.5501
 epoch: 84, train_loss: 0.8184, test_loss: 0.9969, test_f1: 0.5505
 epoch: 85, train_loss: 0.8158, test_loss: 0.9938, test_f1: 0.5456
 epoch: 86, train_loss: 0.8157, test_loss: 0.9930, test_f1: 0.5531
 epoch: 87, train_loss: 0.8131, test_loss: 0.9859, test_f1: 0.5614
 epoch: 88, train_loss: 0.8085, test_loss: 0.9935, test_f1: 0.5493
 epoch: 89, train_loss: 0.8053, test_loss: 0.9947, test_f1: 0.5612
 epoch: 90, train_loss: 0.8096, test_loss: 0.9947, test_f1: 0.5490
 epoch: 91, train_loss: 0.8177, test_loss: 0.9930, test_f1: 0.5579
 epoch: 92, train_loss: 0.8049, test_loss: 0.9964, test_f1: 0.5441
 epoch: 93, train_loss: 0.8052, test_loss: 0.9872, test_f1: 0.5485
 epoch: 94, train_loss: 0.8087, test_loss: 0.9892, test_f1: 0.5473
 epoch: 95, train_loss: 0.8034, test_loss: 0.9913, test_f1: 0.5590
 epoch: 96, train_loss: 0.8018, test_loss: 0.9845, test_f1: 0.5554
 epoch: 97, train_loss: 0.8071, test_loss: 0.9857, test_f1: 0.5645
 epoch: 98, train_loss: 0.8009, test_loss: 0.9967, test_f1: 0.5529
 epoch: 99, train_loss: 0.8004, test_loss: 0.9901, test_f1: 0.5532
##################ITERATION #7 ****************************************
 epoch: 0, train_loss: 1.3423, test_loss: 1.3180, test_f1: 0.2270
 epoch: 1, train_loss: 1.2138, test_loss: 1.2129, test_f1: 0.2320
 epoch: 2, train_loss: 1.1842, test_loss: 1.1192, test_f1: 0.3503
 epoch: 3, train_loss: 1.1589, test_loss: 1.0865, test_f1: 0.3932
 epoch: 4, train_loss: 1.1357, test_loss: 1.0686, test_f1: 0.3930
 epoch: 5, train_loss: 1.1164, test_loss: 1.0547, test_f1: 0.4170
 epoch: 6, train_loss: 1.0997, test_loss: 1.0408, test_f1: 0.4276
 epoch: 7, train_loss: 1.0841, test_loss: 1.0289, test_f1: 0.4355
 epoch: 8, train_loss: 1.0707, test_loss: 1.0227, test_f1: 0.4342
 epoch: 9, train_loss: 1.0558, test_loss: 1.0093, test_f1: 0.4433
 epoch: 10, train_loss: 1.0604, test_loss: 1.0033, test_f1: 0.4497
 epoch: 11, train_loss: 1.0363, test_loss: 1.0027, test_f1: 0.4584
 epoch: 12, train_loss: 1.0226, test_loss: 0.9925, test_f1: 0.4445
 epoch: 13, train_loss: 1.0238, test_loss: 0.9886, test_f1: 0.4498
 epoch: 14, train_loss: 1.0085, test_loss: 0.9874, test_f1: 0.4521
 epoch: 15, train_loss: 1.0042, test_loss: 0.9777, test_f1: 0.4697
 epoch: 16, train_loss: 0.9876, test_loss: 0.9776, test_f1: 0.4685
 epoch: 17, train_loss: 0.9945, test_loss: 0.9705, test_f1: 0.4714
 epoch: 18, train_loss: 0.9831, test_loss: 0.9655, test_f1: 0.4591
 epoch: 19, train_loss: 0.9794, test_loss: 0.9684, test_f1: 0.4731
 epoch: 20, train_loss: 0.9745, test_loss: 0.9652, test_f1: 0.4654
 epoch: 21, train_loss: 0.9668, test_loss: 0.9693, test_f1: 0.4675
 epoch: 22, train_loss: 0.9625, test_loss: 0.9662, test_f1: 0.4808
 epoch: 23, train_loss: 0.9666, test_loss: 0.9540, test_f1: 0.4886
 epoch: 24, train_loss: 0.9464, test_loss: 0.9514, test_f1: 0.4869
 epoch: 25, train_loss: 0.9456, test_loss: 0.9550, test_f1: 0.4947
 epoch: 26, train_loss: 0.9450, test_loss: 0.9522, test_f1: 0.4949
 epoch: 27, train_loss: 0.9453, test_loss: 0.9483, test_f1: 0.4971
 epoch: 28, train_loss: 0.9354, test_loss: 0.9488, test_f1: 0.5114
 epoch: 29, train_loss: 0.9333, test_loss: 0.9415, test_f1: 0.5153
 epoch: 30, train_loss: 0.9313, test_loss: 0.9392, test_f1: 0.5055
 epoch: 31, train_loss: 0.9394, test_loss: 0.9438, test_f1: 0.5202
 epoch: 32, train_loss: 0.9217, test_loss: 0.9374, test_f1: 0.5253
 epoch: 33, train_loss: 0.9183, test_loss: 0.9369, test_f1: 0.5122
 epoch: 34, train_loss: 0.9141, test_loss: 0.9381, test_f1: 0.5251
 epoch: 35, train_loss: 0.9141, test_loss: 0.9335, test_f1: 0.5301
 epoch: 36, train_loss: 0.9054, test_loss: 0.9265, test_f1: 0.5352
 epoch: 37, train_loss: 0.9158, test_loss: 0.9274, test_f1: 0.5327
 epoch: 38, train_loss: 0.9028, test_loss: 0.9257, test_f1: 0.5346
 epoch: 39, train_loss: 0.9003, test_loss: 0.9327, test_f1: 0.5240
 epoch: 40, train_loss: 0.8967, test_loss: 0.9249, test_f1: 0.5312
 epoch: 41, train_loss: 0.8991, test_loss: 0.9166, test_f1: 0.5324
 epoch: 42, train_loss: 0.8885, test_loss: 0.9276, test_f1: 0.5224
 epoch: 43, train_loss: 0.8854, test_loss: 0.9221, test_f1: 0.5318
 epoch: 44, train_loss: 0.8832, test_loss: 0.9292, test_f1: 0.5310
 epoch: 45, train_loss: 0.8829, test_loss: 0.9181, test_f1: 0.5287
 epoch: 46, train_loss: 0.8839, test_loss: 0.9265, test_f1: 0.5355
 epoch: 47, train_loss: 0.8881, test_loss: 0.9157, test_f1: 0.5290
 epoch: 48, train_loss: 0.8731, test_loss: 0.9159, test_f1: 0.5390
 epoch: 49, train_loss: 0.8766, test_loss: 0.9283, test_f1: 0.5389
 epoch: 50, train_loss: 0.8733, test_loss: 0.9250, test_f1: 0.5394
 epoch: 51, train_loss: 0.8719, test_loss: 0.9188, test_f1: 0.5383
 epoch: 52, train_loss: 0.8618, test_loss: 0.9194, test_f1: 0.5332
 epoch: 53, train_loss: 0.8680, test_loss: 0.9133, test_f1: 0.5385
 epoch: 54, train_loss: 0.8635, test_loss: 0.9229, test_f1: 0.5395
 epoch: 55, train_loss: 0.8657, test_loss: 0.9204, test_f1: 0.5355
 epoch: 56, train_loss: 0.8586, test_loss: 0.9202, test_f1: 0.5360
 epoch: 57, train_loss: 0.8641, test_loss: 0.9160, test_f1: 0.5391
 epoch: 58, train_loss: 0.8606, test_loss: 0.9307, test_f1: 0.5361
 epoch: 59, train_loss: 0.8544, test_loss: 0.9103, test_f1: 0.5412
 epoch: 60, train_loss: 0.8566, test_loss: 0.9242, test_f1: 0.5400
 epoch: 61, train_loss: 0.8612, test_loss: 0.9233, test_f1: 0.5386
 epoch: 62, train_loss: 0.8529, test_loss: 0.9169, test_f1: 0.5449
 epoch: 63, train_loss: 0.8622, test_loss: 0.9110, test_f1: 0.5355
 epoch: 64, train_loss: 0.8474, test_loss: 0.9132, test_f1: 0.5388
 epoch: 65, train_loss: 0.8570, test_loss: 0.9190, test_f1: 0.5357
 epoch: 66, train_loss: 0.8442, test_loss: 0.9162, test_f1: 0.5420
 epoch: 67, train_loss: 0.8569, test_loss: 0.9136, test_f1: 0.5450
 epoch: 68, train_loss: 0.8479, test_loss: 0.9193, test_f1: 0.5382
 epoch: 69, train_loss: 0.8468, test_loss: 0.9169, test_f1: 0.5429
 epoch: 70, train_loss: 0.8459, test_loss: 0.9208, test_f1: 0.5407
 epoch: 71, train_loss: 0.8538, test_loss: 0.9230, test_f1: 0.5456
 epoch: 72, train_loss: 0.8472, test_loss: 0.9233, test_f1: 0.5388
 epoch: 73, train_loss: 0.8443, test_loss: 0.9277, test_f1: 0.5337
 epoch: 74, train_loss: 0.8463, test_loss: 0.9247, test_f1: 0.5435
 epoch: 75, train_loss: 0.8438, test_loss: 0.9202, test_f1: 0.5445
 epoch: 76, train_loss: 0.8447, test_loss: 0.9216, test_f1: 0.5403
 epoch: 77, train_loss: 0.8432, test_loss: 0.9157, test_f1: 0.5399
 epoch: 78, train_loss: 0.8408, test_loss: 0.9208, test_f1: 0.5426
 epoch: 79, train_loss: 0.8379, test_loss: 0.9149, test_f1: 0.5419
 epoch: 80, train_loss: 0.8408, test_loss: 0.9176, test_f1: 0.5456
 epoch: 81, train_loss: 0.8355, test_loss: 0.9118, test_f1: 0.5424
 epoch: 82, train_loss: 0.8317, test_loss: 0.9171, test_f1: 0.5445
 epoch: 83, train_loss: 0.8315, test_loss: 0.9204, test_f1: 0.5437
 epoch: 84, train_loss: 0.8317, test_loss: 0.9145, test_f1: 0.5411
 epoch: 85, train_loss: 0.8288, test_loss: 0.9221, test_f1: 0.5397
 epoch: 86, train_loss: 0.8377, test_loss: 0.9151, test_f1: 0.5455
 epoch: 87, train_loss: 0.8314, test_loss: 0.9187, test_f1: 0.5441
 epoch: 88, train_loss: 0.8261, test_loss: 0.9180, test_f1: 0.5447
 epoch: 89, train_loss: 0.8268, test_loss: 0.9165, test_f1: 0.5457
 epoch: 90, train_loss: 0.8267, test_loss: 0.9106, test_f1: 0.5470
 epoch: 91, train_loss: 0.8375, test_loss: 0.9114, test_f1: 0.5441
 epoch: 92, train_loss: 0.8361, test_loss: 0.9239, test_f1: 0.5419
 epoch: 93, train_loss: 0.8237, test_loss: 0.9218, test_f1: 0.5428
 epoch: 94, train_loss: 0.8266, test_loss: 0.9149, test_f1: 0.5454
 epoch: 95, train_loss: 0.8204, test_loss: 0.9265, test_f1: 0.5426
 epoch: 96, train_loss: 0.8221, test_loss: 0.9263, test_f1: 0.5420
 epoch: 97, train_loss: 0.8247, test_loss: 0.9267, test_f1: 0.5410
 epoch: 98, train_loss: 0.8085, test_loss: 0.9220, test_f1: 0.5404
 epoch: 99, train_loss: 0.8149, test_loss: 0.9136, test_f1: 0.5453
##################ITERATION #8 ****************************************
 epoch: 0, train_loss: 1.2848, test_loss: 1.2396, test_f1: 0.2295
 epoch: 1, train_loss: 1.1918, test_loss: 1.1647, test_f1: 0.3095
 epoch: 2, train_loss: 1.1687, test_loss: 1.0974, test_f1: 0.3738
 epoch: 3, train_loss: 1.1445, test_loss: 1.0764, test_f1: 0.3960
 epoch: 4, train_loss: 1.1074, test_loss: 1.0535, test_f1: 0.4090
 epoch: 5, train_loss: 1.1052, test_loss: 1.0352, test_f1: 0.4254
 epoch: 6, train_loss: 1.0736, test_loss: 1.0194, test_f1: 0.4259
 epoch: 7, train_loss: 1.0636, test_loss: 1.0099, test_f1: 0.4334
 epoch: 8, train_loss: 1.0438, test_loss: 0.9989, test_f1: 0.4448
 epoch: 9, train_loss: 1.0327, test_loss: 0.9921, test_f1: 0.4471
 epoch: 10, train_loss: 1.0271, test_loss: 0.9863, test_f1: 0.4553
 epoch: 11, train_loss: 1.0161, test_loss: 0.9770, test_f1: 0.4666
 epoch: 12, train_loss: 1.0000, test_loss: 0.9706, test_f1: 0.4725
 epoch: 13, train_loss: 0.9931, test_loss: 0.9635, test_f1: 0.4970
 epoch: 14, train_loss: 0.9880, test_loss: 0.9689, test_f1: 0.4777
 epoch: 15, train_loss: 0.9812, test_loss: 0.9664, test_f1: 0.5037
 epoch: 16, train_loss: 0.9754, test_loss: 0.9624, test_f1: 0.5019
 epoch: 17, train_loss: 0.9739, test_loss: 0.9612, test_f1: 0.5133
 epoch: 18, train_loss: 0.9681, test_loss: 0.9549, test_f1: 0.5038
 epoch: 19, train_loss: 0.9669, test_loss: 0.9538, test_f1: 0.5140
 epoch: 20, train_loss: 0.9531, test_loss: 0.9537, test_f1: 0.5171
 epoch: 21, train_loss: 0.9491, test_loss: 0.9503, test_f1: 0.5135
 epoch: 22, train_loss: 0.9478, test_loss: 0.9509, test_f1: 0.5107
 epoch: 23, train_loss: 0.9456, test_loss: 0.9591, test_f1: 0.5068
 epoch: 24, train_loss: 0.9358, test_loss: 0.9445, test_f1: 0.5134
 epoch: 25, train_loss: 0.9288, test_loss: 0.9459, test_f1: 0.5238
 epoch: 26, train_loss: 0.9333, test_loss: 0.9467, test_f1: 0.5302
 epoch: 27, train_loss: 0.9212, test_loss: 0.9590, test_f1: 0.5071
 epoch: 28, train_loss: 0.9187, test_loss: 0.9504, test_f1: 0.5072
 epoch: 29, train_loss: 0.9293, test_loss: 0.9458, test_f1: 0.5333
 epoch: 30, train_loss: 0.9169, test_loss: 0.9428, test_f1: 0.5206
 epoch: 31, train_loss: 0.9236, test_loss: 0.9448, test_f1: 0.5171
 epoch: 32, train_loss: 0.9112, test_loss: 0.9457, test_f1: 0.5251
 epoch: 33, train_loss: 0.9144, test_loss: 0.9381, test_f1: 0.5106
 epoch: 34, train_loss: 0.9049, test_loss: 0.9509, test_f1: 0.5108
 epoch: 35, train_loss: 0.9009, test_loss: 0.9400, test_f1: 0.5287
 epoch: 36, train_loss: 0.9083, test_loss: 0.9411, test_f1: 0.5218
 epoch: 37, train_loss: 0.9027, test_loss: 0.9507, test_f1: 0.5273
 epoch: 38, train_loss: 0.8914, test_loss: 0.9452, test_f1: 0.5264
 epoch: 39, train_loss: 0.8947, test_loss: 0.9444, test_f1: 0.5245
 epoch: 40, train_loss: 0.8876, test_loss: 0.9499, test_f1: 0.5302
 epoch: 41, train_loss: 0.8926, test_loss: 0.9444, test_f1: 0.5333
 epoch: 42, train_loss: 0.8875, test_loss: 0.9364, test_f1: 0.5327
 epoch: 43, train_loss: 0.8910, test_loss: 0.9552, test_f1: 0.5170
 epoch: 44, train_loss: 0.8849, test_loss: 0.9399, test_f1: 0.5262
 epoch: 45, train_loss: 0.8840, test_loss: 0.9356, test_f1: 0.5297
 epoch: 46, train_loss: 0.8799, test_loss: 0.9453, test_f1: 0.5291
 epoch: 47, train_loss: 0.8755, test_loss: 0.9452, test_f1: 0.5328
 epoch: 48, train_loss: 0.8745, test_loss: 0.9370, test_f1: 0.5219
 epoch: 49, train_loss: 0.8764, test_loss: 0.9488, test_f1: 0.5200
 epoch: 50, train_loss: 0.8695, test_loss: 0.9460, test_f1: 0.5311
 epoch: 51, train_loss: 0.8605, test_loss: 0.9391, test_f1: 0.5369
 epoch: 52, train_loss: 0.8755, test_loss: 0.9361, test_f1: 0.5351
 epoch: 53, train_loss: 0.8567, test_loss: 0.9449, test_f1: 0.5326
 epoch: 54, train_loss: 0.8597, test_loss: 0.9372, test_f1: 0.5330
 epoch: 55, train_loss: 0.8601, test_loss: 0.9363, test_f1: 0.5295
 epoch: 56, train_loss: 0.8626, test_loss: 0.9420, test_f1: 0.5324
 epoch: 57, train_loss: 0.8567, test_loss: 0.9467, test_f1: 0.5373
 epoch: 58, train_loss: 0.8545, test_loss: 0.9415, test_f1: 0.5268
 epoch: 59, train_loss: 0.8574, test_loss: 0.9451, test_f1: 0.5337
 epoch: 60, train_loss: 0.8526, test_loss: 0.9457, test_f1: 0.5222
 epoch: 61, train_loss: 0.8538, test_loss: 0.9476, test_f1: 0.5316
 epoch: 62, train_loss: 0.8553, test_loss: 0.9488, test_f1: 0.5324
 epoch: 63, train_loss: 0.8557, test_loss: 0.9509, test_f1: 0.5253
 epoch: 64, train_loss: 0.8522, test_loss: 0.9458, test_f1: 0.5266
 epoch: 65, train_loss: 0.8496, test_loss: 0.9476, test_f1: 0.5211
 epoch: 66, train_loss: 0.8537, test_loss: 0.9356, test_f1: 0.5194
 epoch: 67, train_loss: 0.8476, test_loss: 0.9441, test_f1: 0.5227
 epoch: 68, train_loss: 0.8482, test_loss: 0.9429, test_f1: 0.5343
 epoch: 69, train_loss: 0.8466, test_loss: 0.9402, test_f1: 0.5240
 epoch: 70, train_loss: 0.8413, test_loss: 0.9469, test_f1: 0.5214
 epoch: 71, train_loss: 0.8462, test_loss: 0.9489, test_f1: 0.5263
 epoch: 72, train_loss: 0.8409, test_loss: 0.9450, test_f1: 0.5291
 epoch: 73, train_loss: 0.8404, test_loss: 0.9432, test_f1: 0.5265
 epoch: 74, train_loss: 0.8519, test_loss: 0.9521, test_f1: 0.5308
 epoch: 75, train_loss: 0.8435, test_loss: 0.9499, test_f1: 0.5224
 epoch: 76, train_loss: 0.8376, test_loss: 0.9457, test_f1: 0.5211
 epoch: 77, train_loss: 0.8352, test_loss: 0.9508, test_f1: 0.5171
 epoch: 78, train_loss: 0.8453, test_loss: 0.9491, test_f1: 0.5201
 epoch: 79, train_loss: 0.8393, test_loss: 0.9495, test_f1: 0.5256
 epoch: 80, train_loss: 0.8346, test_loss: 0.9485, test_f1: 0.5197
 epoch: 81, train_loss: 0.8362, test_loss: 0.9457, test_f1: 0.5215
 epoch: 82, train_loss: 0.8352, test_loss: 0.9514, test_f1: 0.5250
 epoch: 83, train_loss: 0.8328, test_loss: 0.9565, test_f1: 0.5199
 epoch: 84, train_loss: 0.8421, test_loss: 0.9560, test_f1: 0.5171
 epoch: 85, train_loss: 0.8339, test_loss: 0.9511, test_f1: 0.5209
 epoch: 86, train_loss: 0.8327, test_loss: 0.9436, test_f1: 0.5250
 epoch: 87, train_loss: 0.8291, test_loss: 0.9544, test_f1: 0.5188
 epoch: 88, train_loss: 0.8314, test_loss: 0.9546, test_f1: 0.5185
 epoch: 89, train_loss: 0.8213, test_loss: 0.9535, test_f1: 0.5212
 epoch: 90, train_loss: 0.8321, test_loss: 0.9527, test_f1: 0.5270
 epoch: 91, train_loss: 0.8257, test_loss: 0.9575, test_f1: 0.5227
 epoch: 92, train_loss: 0.8212, test_loss: 0.9462, test_f1: 0.5302
 epoch: 93, train_loss: 0.8169, test_loss: 0.9481, test_f1: 0.5317
 epoch: 94, train_loss: 0.8355, test_loss: 0.9457, test_f1: 0.5327
 epoch: 95, train_loss: 0.8220, test_loss: 0.9559, test_f1: 0.5263
 epoch: 96, train_loss: 0.8213, test_loss: 0.9523, test_f1: 0.5218
 epoch: 97, train_loss: 0.8176, test_loss: 0.9547, test_f1: 0.5206
 epoch: 98, train_loss: 0.8206, test_loss: 0.9592, test_f1: 0.5196
 epoch: 99, train_loss: 0.8145, test_loss: 0.9492, test_f1: 0.5334
##################ITERATION #9 ****************************************
 epoch: 0, train_loss: 1.3741, test_loss: 1.2923, test_f1: 0.2270
 epoch: 1, train_loss: 1.2392, test_loss: 1.1587, test_f1: 0.3207
 epoch: 2, train_loss: 1.2003, test_loss: 1.1021, test_f1: 0.3715
 epoch: 3, train_loss: 1.1711, test_loss: 1.0689, test_f1: 0.3811
 epoch: 4, train_loss: 1.1437, test_loss: 1.0512, test_f1: 0.4006
 epoch: 5, train_loss: 1.1254, test_loss: 1.0373, test_f1: 0.4053
 epoch: 6, train_loss: 1.0963, test_loss: 1.0280, test_f1: 0.4103
 epoch: 7, train_loss: 1.0847, test_loss: 1.0146, test_f1: 0.4256
 epoch: 8, train_loss: 1.0769, test_loss: 1.0087, test_f1: 0.4364
 epoch: 9, train_loss: 1.0675, test_loss: 1.0027, test_f1: 0.4444
 epoch: 10, train_loss: 1.0528, test_loss: 0.9907, test_f1: 0.4552
 epoch: 11, train_loss: 1.0378, test_loss: 0.9885, test_f1: 0.4641
 epoch: 12, train_loss: 1.0367, test_loss: 0.9803, test_f1: 0.4619
 epoch: 13, train_loss: 1.0181, test_loss: 0.9750, test_f1: 0.4595
 epoch: 14, train_loss: 1.0104, test_loss: 0.9700, test_f1: 0.4606
 epoch: 15, train_loss: 1.0151, test_loss: 0.9663, test_f1: 0.4653
 epoch: 16, train_loss: 0.9936, test_loss: 0.9560, test_f1: 0.4617
 epoch: 17, train_loss: 1.0023, test_loss: 0.9598, test_f1: 0.4612
 epoch: 18, train_loss: 0.9845, test_loss: 0.9572, test_f1: 0.4737
 epoch: 19, train_loss: 0.9914, test_loss: 0.9553, test_f1: 0.4733
 epoch: 20, train_loss: 0.9787, test_loss: 0.9432, test_f1: 0.4764
 epoch: 21, train_loss: 0.9793, test_loss: 0.9456, test_f1: 0.4746
 epoch: 22, train_loss: 0.9668, test_loss: 0.9418, test_f1: 0.4769
 epoch: 23, train_loss: 0.9588, test_loss: 0.9405, test_f1: 0.4750
 epoch: 24, train_loss: 0.9638, test_loss: 0.9433, test_f1: 0.4871
 epoch: 25, train_loss: 0.9553, test_loss: 0.9334, test_f1: 0.4943
 epoch: 26, train_loss: 0.9538, test_loss: 0.9362, test_f1: 0.4892
 epoch: 27, train_loss: 0.9455, test_loss: 0.9330, test_f1: 0.4982
 epoch: 28, train_loss: 0.9450, test_loss: 0.9318, test_f1: 0.4991
 epoch: 29, train_loss: 0.9403, test_loss: 0.9226, test_f1: 0.4969
 epoch: 30, train_loss: 0.9355, test_loss: 0.9268, test_f1: 0.5004
 epoch: 31, train_loss: 0.9258, test_loss: 0.9288, test_f1: 0.5010
 epoch: 32, train_loss: 0.9194, test_loss: 0.9264, test_f1: 0.5028
 epoch: 33, train_loss: 0.9193, test_loss: 0.9250, test_f1: 0.5000
 epoch: 34, train_loss: 0.9299, test_loss: 0.9220, test_f1: 0.5091
 epoch: 35, train_loss: 0.9168, test_loss: 0.9247, test_f1: 0.5108
 epoch: 36, train_loss: 0.9239, test_loss: 0.9348, test_f1: 0.5020
 epoch: 37, train_loss: 0.9115, test_loss: 0.9245, test_f1: 0.5072
 epoch: 38, train_loss: 0.9113, test_loss: 0.9239, test_f1: 0.5155
 epoch: 39, train_loss: 0.9091, test_loss: 0.9141, test_f1: 0.5132
 epoch: 40, train_loss: 0.9019, test_loss: 0.9214, test_f1: 0.5161
 epoch: 41, train_loss: 0.9006, test_loss: 0.9142, test_f1: 0.5227
 epoch: 42, train_loss: 0.9030, test_loss: 0.9141, test_f1: 0.5218
 epoch: 43, train_loss: 0.8961, test_loss: 0.9145, test_f1: 0.5194
 epoch: 44, train_loss: 0.8916, test_loss: 0.9238, test_f1: 0.5165
 epoch: 45, train_loss: 0.8967, test_loss: 0.9127, test_f1: 0.5159
 epoch: 46, train_loss: 0.8898, test_loss: 0.9216, test_f1: 0.5240
 epoch: 47, train_loss: 0.8838, test_loss: 0.9221, test_f1: 0.5250
 epoch: 48, train_loss: 0.8805, test_loss: 0.9037, test_f1: 0.5253
 epoch: 49, train_loss: 0.8809, test_loss: 0.9022, test_f1: 0.5249
 epoch: 50, train_loss: 0.8749, test_loss: 0.9126, test_f1: 0.5241
 epoch: 51, train_loss: 0.8692, test_loss: 0.9087, test_f1: 0.5237
 epoch: 52, train_loss: 0.8711, test_loss: 0.9087, test_f1: 0.5276
 epoch: 53, train_loss: 0.8742, test_loss: 0.9083, test_f1: 0.5355
 epoch: 54, train_loss: 0.8731, test_loss: 0.9062, test_f1: 0.5330
 epoch: 55, train_loss: 0.8740, test_loss: 0.9122, test_f1: 0.5239
 epoch: 56, train_loss: 0.8631, test_loss: 0.9050, test_f1: 0.5295
 epoch: 57, train_loss: 0.8766, test_loss: 0.9053, test_f1: 0.5256
 epoch: 58, train_loss: 0.8614, test_loss: 0.9099, test_f1: 0.5294
 epoch: 59, train_loss: 0.8644, test_loss: 0.9175, test_f1: 0.5417
 epoch: 60, train_loss: 0.8608, test_loss: 0.9101, test_f1: 0.5315
 epoch: 61, train_loss: 0.8658, test_loss: 0.9039, test_f1: 0.5311
 epoch: 62, train_loss: 0.8529, test_loss: 0.9175, test_f1: 0.5361
 epoch: 63, train_loss: 0.8620, test_loss: 0.9078, test_f1: 0.5394
 epoch: 64, train_loss: 0.8678, test_loss: 0.9076, test_f1: 0.5336
 epoch: 65, train_loss: 0.8599, test_loss: 0.9052, test_f1: 0.5431
 epoch: 66, train_loss: 0.8525, test_loss: 0.9132, test_f1: 0.5362
 epoch: 67, train_loss: 0.8498, test_loss: 0.9100, test_f1: 0.5322
 epoch: 68, train_loss: 0.8519, test_loss: 0.9033, test_f1: 0.5343
 epoch: 69, train_loss: 0.8469, test_loss: 0.9077, test_f1: 0.5449
 epoch: 70, train_loss: 0.8441, test_loss: 0.9080, test_f1: 0.5330
 epoch: 71, train_loss: 0.8508, test_loss: 0.9148, test_f1: 0.5348
 epoch: 72, train_loss: 0.8509, test_loss: 0.9095, test_f1: 0.5394
 epoch: 73, train_loss: 0.8576, test_loss: 0.9171, test_f1: 0.5354
 epoch: 74, train_loss: 0.8506, test_loss: 0.9078, test_f1: 0.5355
 epoch: 75, train_loss: 0.8479, test_loss: 0.9100, test_f1: 0.5350
 epoch: 76, train_loss: 0.8472, test_loss: 0.9095, test_f1: 0.5438
 epoch: 77, train_loss: 0.8533, test_loss: 0.9074, test_f1: 0.5461
 epoch: 78, train_loss: 0.8470, test_loss: 0.9093, test_f1: 0.5385
 epoch: 79, train_loss: 0.8479, test_loss: 0.9117, test_f1: 0.5391
 epoch: 80, train_loss: 0.8419, test_loss: 0.9063, test_f1: 0.5261
 epoch: 81, train_loss: 0.8299, test_loss: 0.9087, test_f1: 0.5342
 epoch: 82, train_loss: 0.8473, test_loss: 0.9172, test_f1: 0.5298
 epoch: 83, train_loss: 0.8367, test_loss: 0.9191, test_f1: 0.5407
 epoch: 84, train_loss: 0.8457, test_loss: 0.9160, test_f1: 0.5331
 epoch: 85, train_loss: 0.8397, test_loss: 0.9076, test_f1: 0.5363
 epoch: 86, train_loss: 0.8403, test_loss: 0.9162, test_f1: 0.5360
 epoch: 87, train_loss: 0.8390, test_loss: 0.9258, test_f1: 0.5348
 epoch: 88, train_loss: 0.8358, test_loss: 0.9087, test_f1: 0.5371
 epoch: 89, train_loss: 0.8368, test_loss: 0.9147, test_f1: 0.5321
 epoch: 90, train_loss: 0.8264, test_loss: 0.9101, test_f1: 0.5313
 epoch: 91, train_loss: 0.8413, test_loss: 0.9175, test_f1: 0.5352
 epoch: 92, train_loss: 0.8364, test_loss: 0.9141, test_f1: 0.5325
 epoch: 93, train_loss: 0.8250, test_loss: 0.9152, test_f1: 0.5321
 epoch: 94, train_loss: 0.8327, test_loss: 0.9202, test_f1: 0.5314
 epoch: 95, train_loss: 0.8255, test_loss: 0.8999, test_f1: 0.5346
 epoch: 96, train_loss: 0.8283, test_loss: 0.9077, test_f1: 0.5334
 epoch: 97, train_loss: 0.8358, test_loss: 0.9066, test_f1: 0.5440
 epoch: 98, train_loss: 0.8356, test_loss: 0.9033, test_f1: 0.5442
 epoch: 99, train_loss: 0.8306, test_loss: 0.9150, test_f1: 0.5402

Training completed in 429.43 seconds
Best F1: 0.5691 at epoch 90
Mean F1 across iterations: 0.5435  0.0152
========================FINAL RESULTS================================
FEGIN weighted F1: 0.5691  0.0152
python main.py --data ltspice_examples --representation component_net --model FEGIN --layers 2 --hiddens 64 --batch_size 128 --lr 0.0001 --emb_size 512 --epochs 100 --save_appendix component_net_L2_H64_BS128_LR0.0001_E512 --no_val
-----



STDERR:
  File "main.py", line 370, in <module>
    main()
  File "main.py", line 254, in main
    dataset = dataset_class(
  File "/home/philip/projects/ltspice_examples_code_repo/Circuit-Completion-Using-GNNs/component_classification_with_link_prediction_head/evaluation/FEGIN/kernel/circuit_datasets.py", line 15, in __init__
    self.data, self.slices = torch.load(self.processed_paths[0])
  File "/home/philip/.local/lib/python3.8/site-packages/torch/serialization.py", line 1040, in load
    warnings.warn(
  File "/usr/lib/python3.8/warnings.py", line 109, in _showwarnmsg
    sw(msg.message, msg.category, msg.filename, msg.lineno,
  File "main.py", line 47, in warn_with_traceback
    traceback.print_stack(file=log)
/home/philip/projects/ltspice_examples_code_repo/Circuit-Completion-Using-GNNs/component_classification_with_link_prediction_head/evaluation/FEGIN/kernel/circuit_datasets.py:15: FutureWarning: You are using `torch.load` with `weights_only=False` (the current default value), which uses the default pickle module implicitly. It is possible to construct malicious pickle data which will execute arbitrary code during unpickling (See https://github.com/pytorch/pytorch/blob/main/SECURITY.md#untrusted-models for more details). In a future release, the default value for `weights_only` will be flipped to `True`. This limits the functions that could be executed during unpickling. Arbitrary objects will no longer be allowed to be loaded via this mode unless they are explicitly allowlisted by the user via `torch.serialization.add_safe_globals`. We recommend you start setting `weights_only=True` for any use case where you don't have full control of the loaded file. Please open an issue on GitHub for any issues related to this experimental feature.
  self.data, self.slices = torch.load(self.processed_paths[0])
