STDOUT:
Results will be saved in /home/philip/projects/llm_inference_code_repo/Circuit-Completion-Using-GNNs/component_classification_with_link_prediction_head/evaluation/FEGIN/results/model_FEGIN_dataset_ltspice_examples
Command line input: python main.py --data ltspice_examples --representation component_component --model FEGIN --layers 4 --hiddens 64 --batch_size 64 --lr 0.0001 --emb_size 250 --epochs 100 --save_appendix component_component_L4_H64_BS64_LR0.0001_E250 --no_val
 is saved.
-----
ltspice_examples - FEGIN
Using 4 layers, 64 hidden units, h = 2
Loading component_component representation dataset
ENTERED
Training FEGIN on component_component representation
Train: 3556, Test: 845
##################ITERATION #0 ****************************************
 epoch: 0, train_loss: 1.3602, test_loss: 1.3504, test_f1: 0.2274
 epoch: 1, train_loss: 1.3294, test_loss: 1.3172, test_f1: 0.2274
 epoch: 2, train_loss: 1.3041, test_loss: 1.2939, test_f1: 0.2274
 epoch: 3, train_loss: 1.2772, test_loss: 1.2694, test_f1: 0.2274
 epoch: 4, train_loss: 1.2625, test_loss: 1.2491, test_f1: 0.2274
 epoch: 5, train_loss: 1.2467, test_loss: 1.2329, test_f1: 0.2274
 epoch: 6, train_loss: 1.2336, test_loss: 1.2171, test_f1: 0.2274
 epoch: 7, train_loss: 1.2216, test_loss: 1.2041, test_f1: 0.2295
 epoch: 8, train_loss: 1.2135, test_loss: 1.1925, test_f1: 0.2702
 epoch: 9, train_loss: 1.1997, test_loss: 1.1797, test_f1: 0.2975
 epoch: 10, train_loss: 1.1902, test_loss: 1.1669, test_f1: 0.3619
 epoch: 11, train_loss: 1.1741, test_loss: 1.1581, test_f1: 0.3445
 epoch: 12, train_loss: 1.1643, test_loss: 1.1445, test_f1: 0.3527
 epoch: 13, train_loss: 1.1522, test_loss: 1.1350, test_f1: 0.3507
 epoch: 14, train_loss: 1.1401, test_loss: 1.1248, test_f1: 0.3627
 epoch: 15, train_loss: 1.1253, test_loss: 1.1227, test_f1: 0.3703
 epoch: 16, train_loss: 1.1173, test_loss: 1.1080, test_f1: 0.4025
 epoch: 17, train_loss: 1.1052, test_loss: 1.1135, test_f1: 0.4500
 epoch: 18, train_loss: 1.1010, test_loss: 1.0981, test_f1: 0.4411
 epoch: 19, train_loss: 1.0816, test_loss: 1.0984, test_f1: 0.4382
 epoch: 20, train_loss: 1.0788, test_loss: 1.0905, test_f1: 0.4268
 epoch: 21, train_loss: 1.0663, test_loss: 1.0813, test_f1: 0.4362
 epoch: 22, train_loss: 1.0652, test_loss: 1.0777, test_f1: 0.4321
 epoch: 23, train_loss: 1.0467, test_loss: 1.0690, test_f1: 0.4579
 epoch: 24, train_loss: 1.0401, test_loss: 1.0657, test_f1: 0.4633
 epoch: 25, train_loss: 1.0347, test_loss: 1.0646, test_f1: 0.4410
 epoch: 26, train_loss: 1.0299, test_loss: 1.0522, test_f1: 0.4611
 epoch: 27, train_loss: 1.0156, test_loss: 1.0543, test_f1: 0.4641
 epoch: 28, train_loss: 1.0096, test_loss: 1.0773, test_f1: 0.4684
 epoch: 29, train_loss: 1.0018, test_loss: 1.0234, test_f1: 0.4758
 epoch: 30, train_loss: 0.9986, test_loss: 1.0481, test_f1: 0.4722
 epoch: 31, train_loss: 0.9931, test_loss: 1.0283, test_f1: 0.4838
 epoch: 32, train_loss: 0.9864, test_loss: 1.0380, test_f1: 0.4726
 epoch: 33, train_loss: 0.9779, test_loss: 1.0440, test_f1: 0.4755
 epoch: 34, train_loss: 0.9696, test_loss: 1.0625, test_f1: 0.4656
 epoch: 35, train_loss: 0.9666, test_loss: 1.0514, test_f1: 0.4524
 epoch: 36, train_loss: 0.9622, test_loss: 1.0273, test_f1: 0.4925
 epoch: 37, train_loss: 0.9447, test_loss: 1.0439, test_f1: 0.4848
 epoch: 38, train_loss: 0.9463, test_loss: 1.0318, test_f1: 0.4881
 epoch: 39, train_loss: 0.9461, test_loss: 1.0460, test_f1: 0.4971
 epoch: 40, train_loss: 0.9426, test_loss: 1.0327, test_f1: 0.4612
 epoch: 41, train_loss: 0.9305, test_loss: 1.0432, test_f1: 0.4798
 epoch: 42, train_loss: 0.9342, test_loss: 1.0266, test_f1: 0.4767
 epoch: 43, train_loss: 0.9248, test_loss: 1.0424, test_f1: 0.4894
 epoch: 44, train_loss: 0.9179, test_loss: 1.0672, test_f1: 0.4691
 epoch: 45, train_loss: 0.9211, test_loss: 1.0646, test_f1: 0.4546
 epoch: 46, train_loss: 0.9134, test_loss: 1.0322, test_f1: 0.4855
 epoch: 47, train_loss: 0.9091, test_loss: 1.0556, test_f1: 0.4659
 epoch: 48, train_loss: 0.9090, test_loss: 1.0755, test_f1: 0.4775
 epoch: 49, train_loss: 0.9033, test_loss: 1.0213, test_f1: 0.5164
 epoch: 50, train_loss: 0.8978, test_loss: 1.0516, test_f1: 0.4959
 epoch: 51, train_loss: 0.8955, test_loss: 1.0478, test_f1: 0.5058
 epoch: 52, train_loss: 0.8904, test_loss: 1.0523, test_f1: 0.4994
 epoch: 53, train_loss: 0.8962, test_loss: 1.0299, test_f1: 0.4983
 epoch: 54, train_loss: 0.8804, test_loss: 1.0288, test_f1: 0.5295
 epoch: 55, train_loss: 0.8826, test_loss: 1.0238, test_f1: 0.4924
 epoch: 56, train_loss: 0.8794, test_loss: 1.0417, test_f1: 0.5037
 epoch: 57, train_loss: 0.8792, test_loss: 1.0342, test_f1: 0.4952
 epoch: 58, train_loss: 0.8734, test_loss: 1.0567, test_f1: 0.4926
 epoch: 59, train_loss: 0.8769, test_loss: 1.0442, test_f1: 0.4998
 epoch: 60, train_loss: 0.8687, test_loss: 1.0549, test_f1: 0.4974
 epoch: 61, train_loss: 0.8711, test_loss: 1.0424, test_f1: 0.5024
 epoch: 62, train_loss: 0.8632, test_loss: 1.0544, test_f1: 0.4900
 epoch: 63, train_loss: 0.8568, test_loss: 1.0433, test_f1: 0.4852
 epoch: 64, train_loss: 0.8673, test_loss: 1.0387, test_f1: 0.4978
 epoch: 65, train_loss: 0.8585, test_loss: 1.0437, test_f1: 0.4949
 epoch: 66, train_loss: 0.8619, test_loss: 1.0652, test_f1: 0.4800
 epoch: 67, train_loss: 0.8691, test_loss: 1.0773, test_f1: 0.4823
 epoch: 68, train_loss: 0.8587, test_loss: 1.0781, test_f1: 0.4765
 epoch: 69, train_loss: 0.8562, test_loss: 1.0599, test_f1: 0.4812
 epoch: 70, train_loss: 0.8581, test_loss: 1.0946, test_f1: 0.4719
 epoch: 71, train_loss: 0.8553, test_loss: 1.0945, test_f1: 0.4608
 epoch: 72, train_loss: 0.8458, test_loss: 1.0887, test_f1: 0.4702
 epoch: 73, train_loss: 0.8468, test_loss: 1.0925, test_f1: 0.4670
 epoch: 74, train_loss: 0.8494, test_loss: 1.1082, test_f1: 0.4609
 epoch: 75, train_loss: 0.8438, test_loss: 1.0565, test_f1: 0.5062
 epoch: 76, train_loss: 0.8374, test_loss: 1.0744, test_f1: 0.4947
 epoch: 77, train_loss: 0.8441, test_loss: 1.0734, test_f1: 0.5015
 epoch: 78, train_loss: 0.8382, test_loss: 1.0692, test_f1: 0.4976
 epoch: 79, train_loss: 0.8437, test_loss: 1.0545, test_f1: 0.5547
 epoch: 80, train_loss: 0.8454, test_loss: 1.0758, test_f1: 0.5281
 epoch: 81, train_loss: 0.8372, test_loss: 1.0675, test_f1: 0.5157
 epoch: 82, train_loss: 0.8303, test_loss: 1.0699, test_f1: 0.5151
 epoch: 83, train_loss: 0.8352, test_loss: 1.0788, test_f1: 0.5059
 epoch: 84, train_loss: 0.8365, test_loss: 1.0890, test_f1: 0.5102
 epoch: 85, train_loss: 0.8354, test_loss: 1.0641, test_f1: 0.5095
 epoch: 86, train_loss: 0.8130, test_loss: 1.0747, test_f1: 0.5187
 epoch: 87, train_loss: 0.8191, test_loss: 1.0677, test_f1: 0.5080
 epoch: 88, train_loss: 0.8314, test_loss: 1.0937, test_f1: 0.4883
 epoch: 89, train_loss: 0.8222, test_loss: 1.0734, test_f1: 0.5084
 epoch: 90, train_loss: 0.8368, test_loss: 1.0967, test_f1: 0.4946
 epoch: 91, train_loss: 0.8149, test_loss: 1.1075, test_f1: 0.5058
 epoch: 92, train_loss: 0.8092, test_loss: 1.0991, test_f1: 0.5037
 epoch: 93, train_loss: 0.8246, test_loss: 1.0752, test_f1: 0.5093
 epoch: 94, train_loss: 0.8206, test_loss: 1.0627, test_f1: 0.5336
 epoch: 95, train_loss: 0.8091, test_loss: 1.1116, test_f1: 0.5106
 epoch: 96, train_loss: 0.8120, test_loss: 1.1501, test_f1: 0.4937
 epoch: 97, train_loss: 0.8103, test_loss: 1.1131, test_f1: 0.5112
 epoch: 98, train_loss: 0.8263, test_loss: 1.1214, test_f1: 0.4975
 epoch: 99, train_loss: 0.8094, test_loss: 1.1178, test_f1: 0.5052
##################ITERATION #1 ****************************************
 epoch: 0, train_loss: 1.3157, test_loss: 1.2772, test_f1: 0.2274
 epoch: 1, train_loss: 1.2635, test_loss: 1.2252, test_f1: 0.3028
 epoch: 2, train_loss: 1.2427, test_loss: 1.2066, test_f1: 0.3338
 epoch: 3, train_loss: 1.2253, test_loss: 1.1887, test_f1: 0.3508
 epoch: 4, train_loss: 1.2115, test_loss: 1.1744, test_f1: 0.3847
 epoch: 5, train_loss: 1.1979, test_loss: 1.1617, test_f1: 0.3957
 epoch: 6, train_loss: 1.1849, test_loss: 1.1524, test_f1: 0.4135
 epoch: 7, train_loss: 1.1748, test_loss: 1.1403, test_f1: 0.4313
 epoch: 8, train_loss: 1.1679, test_loss: 1.1252, test_f1: 0.4491
 epoch: 9, train_loss: 1.1522, test_loss: 1.1167, test_f1: 0.4358
 epoch: 10, train_loss: 1.1402, test_loss: 1.1072, test_f1: 0.4511
 epoch: 11, train_loss: 1.1277, test_loss: 1.1024, test_f1: 0.4428
 epoch: 12, train_loss: 1.1233, test_loss: 1.0907, test_f1: 0.4652
 epoch: 13, train_loss: 1.1065, test_loss: 1.0838, test_f1: 0.4585
 epoch: 14, train_loss: 1.0966, test_loss: 1.0801, test_f1: 0.4738
 epoch: 15, train_loss: 1.0886, test_loss: 1.0698, test_f1: 0.4605
 epoch: 16, train_loss: 1.0884, test_loss: 1.0702, test_f1: 0.4660
 epoch: 17, train_loss: 1.0716, test_loss: 1.0579, test_f1: 0.4748
 epoch: 18, train_loss: 1.0723, test_loss: 1.0581, test_f1: 0.4622
 epoch: 19, train_loss: 1.0563, test_loss: 1.0487, test_f1: 0.4781
 epoch: 20, train_loss: 1.0503, test_loss: 1.0483, test_f1: 0.4847
 epoch: 21, train_loss: 1.0370, test_loss: 1.0430, test_f1: 0.4723
 epoch: 22, train_loss: 1.0360, test_loss: 1.0311, test_f1: 0.4642
 epoch: 23, train_loss: 1.0349, test_loss: 1.0430, test_f1: 0.4726
 epoch: 24, train_loss: 1.0262, test_loss: 1.0326, test_f1: 0.4825
 epoch: 25, train_loss: 1.0114, test_loss: 1.0121, test_f1: 0.4770
 epoch: 26, train_loss: 1.0037, test_loss: 1.0136, test_f1: 0.4862
 epoch: 27, train_loss: 0.9925, test_loss: 1.0288, test_f1: 0.4808
 epoch: 28, train_loss: 0.9991, test_loss: 1.0207, test_f1: 0.4856
 epoch: 29, train_loss: 0.9914, test_loss: 1.0192, test_f1: 0.4849
 epoch: 30, train_loss: 0.9867, test_loss: 1.0214, test_f1: 0.4714
 epoch: 31, train_loss: 0.9814, test_loss: 1.0125, test_f1: 0.4960
 epoch: 32, train_loss: 0.9672, test_loss: 1.0176, test_f1: 0.4812
 epoch: 33, train_loss: 0.9543, test_loss: 1.0043, test_f1: 0.5097
 epoch: 34, train_loss: 0.9622, test_loss: 1.0079, test_f1: 0.4789
 epoch: 35, train_loss: 0.9528, test_loss: 0.9874, test_f1: 0.4999
 epoch: 36, train_loss: 0.9404, test_loss: 1.0013, test_f1: 0.4917
 epoch: 37, train_loss: 0.9439, test_loss: 1.0089, test_f1: 0.4633
 epoch: 38, train_loss: 0.9442, test_loss: 0.9924, test_f1: 0.4957
 epoch: 39, train_loss: 0.9286, test_loss: 0.9911, test_f1: 0.4902
 epoch: 40, train_loss: 0.9277, test_loss: 1.0107, test_f1: 0.4791
 epoch: 41, train_loss: 0.9194, test_loss: 1.0135, test_f1: 0.4759
 epoch: 42, train_loss: 0.9134, test_loss: 1.0076, test_f1: 0.4828
 epoch: 43, train_loss: 0.9077, test_loss: 0.9968, test_f1: 0.5027
 epoch: 44, train_loss: 0.9139, test_loss: 1.0083, test_f1: 0.4998
 epoch: 45, train_loss: 0.8963, test_loss: 1.0324, test_f1: 0.4841
 epoch: 46, train_loss: 0.9024, test_loss: 1.0153, test_f1: 0.4890
 epoch: 47, train_loss: 0.8882, test_loss: 1.0234, test_f1: 0.5071
 epoch: 48, train_loss: 0.8862, test_loss: 1.0215, test_f1: 0.4932
 epoch: 49, train_loss: 0.8857, test_loss: 1.0346, test_f1: 0.4918
 epoch: 50, train_loss: 0.8731, test_loss: 1.0276, test_f1: 0.4900
 epoch: 51, train_loss: 0.8721, test_loss: 1.0226, test_f1: 0.4879
 epoch: 52, train_loss: 0.8646, test_loss: 1.0224, test_f1: 0.4997
 epoch: 53, train_loss: 0.8668, test_loss: 1.0232, test_f1: 0.4915
 epoch: 54, train_loss: 0.8620, test_loss: 1.0183, test_f1: 0.4860
 epoch: 55, train_loss: 0.8628, test_loss: 1.0226, test_f1: 0.4913
 epoch: 56, train_loss: 0.8508, test_loss: 1.0354, test_f1: 0.4914
 epoch: 57, train_loss: 0.8569, test_loss: 1.0275, test_f1: 0.5022
 epoch: 58, train_loss: 0.8489, test_loss: 1.0204, test_f1: 0.5170
 epoch: 59, train_loss: 0.8451, test_loss: 1.0164, test_f1: 0.5099
 epoch: 60, train_loss: 0.8445, test_loss: 1.0391, test_f1: 0.4942
 epoch: 61, train_loss: 0.8423, test_loss: 1.0274, test_f1: 0.4997
 epoch: 62, train_loss: 0.8445, test_loss: 1.0428, test_f1: 0.4923
 epoch: 63, train_loss: 0.8502, test_loss: 1.0576, test_f1: 0.4898
 epoch: 64, train_loss: 0.8419, test_loss: 1.0470, test_f1: 0.5006
 epoch: 65, train_loss: 0.8345, test_loss: 1.0599, test_f1: 0.4974
 epoch: 66, train_loss: 0.8280, test_loss: 1.0527, test_f1: 0.5029
 epoch: 67, train_loss: 0.8328, test_loss: 1.0615, test_f1: 0.5032
 epoch: 68, train_loss: 0.8396, test_loss: 1.0289, test_f1: 0.5101
 epoch: 69, train_loss: 0.8324, test_loss: 1.0558, test_f1: 0.5039
 epoch: 70, train_loss: 0.8362, test_loss: 1.0342, test_f1: 0.5022
 epoch: 71, train_loss: 0.8249, test_loss: 1.0591, test_f1: 0.5136
 epoch: 72, train_loss: 0.8325, test_loss: 1.0529, test_f1: 0.5016
 epoch: 73, train_loss: 0.8220, test_loss: 1.0569, test_f1: 0.4930
 epoch: 74, train_loss: 0.8220, test_loss: 1.0621, test_f1: 0.5063
 epoch: 75, train_loss: 0.8183, test_loss: 1.0716, test_f1: 0.4992
 epoch: 76, train_loss: 0.8171, test_loss: 1.0479, test_f1: 0.5090
 epoch: 77, train_loss: 0.8176, test_loss: 1.0738, test_f1: 0.4873
 epoch: 78, train_loss: 0.8066, test_loss: 1.0636, test_f1: 0.4999
 epoch: 79, train_loss: 0.8308, test_loss: 1.0594, test_f1: 0.5122
 epoch: 80, train_loss: 0.8113, test_loss: 1.0451, test_f1: 0.5186
 epoch: 81, train_loss: 0.8088, test_loss: 1.0466, test_f1: 0.5021
 epoch: 82, train_loss: 0.8071, test_loss: 1.0702, test_f1: 0.4995
 epoch: 83, train_loss: 0.8034, test_loss: 1.0677, test_f1: 0.5031
 epoch: 84, train_loss: 0.8054, test_loss: 1.0493, test_f1: 0.5129
 epoch: 85, train_loss: 0.7943, test_loss: 1.0903, test_f1: 0.4968
 epoch: 86, train_loss: 0.7998, test_loss: 1.0867, test_f1: 0.4966
 epoch: 87, train_loss: 0.7929, test_loss: 1.0554, test_f1: 0.5068
 epoch: 88, train_loss: 0.7903, test_loss: 1.0795, test_f1: 0.5182
 epoch: 89, train_loss: 0.7929, test_loss: 1.0887, test_f1: 0.5013
 epoch: 90, train_loss: 0.8049, test_loss: 1.0892, test_f1: 0.5054
 epoch: 91, train_loss: 0.7933, test_loss: 1.0587, test_f1: 0.5040
 epoch: 92, train_loss: 0.7939, test_loss: 1.1018, test_f1: 0.5086
 epoch: 93, train_loss: 0.7941, test_loss: 1.0982, test_f1: 0.5046
 epoch: 94, train_loss: 0.7910, test_loss: 1.0923, test_f1: 0.5056
 epoch: 95, train_loss: 0.7915, test_loss: 1.0976, test_f1: 0.4953
 epoch: 96, train_loss: 0.7983, test_loss: 1.0753, test_f1: 0.5037
 epoch: 97, train_loss: 0.7855, test_loss: 1.0926, test_f1: 0.4998
 epoch: 98, train_loss: 0.7738, test_loss: 1.0837, test_f1: 0.5079
 epoch: 99, train_loss: 0.7696, test_loss: 1.1033, test_f1: 0.5141
##################ITERATION #2 ****************************************
 epoch: 0, train_loss: 1.3190, test_loss: 1.2664, test_f1: 0.2893
 epoch: 1, train_loss: 1.2533, test_loss: 1.2294, test_f1: 0.3347
 epoch: 2, train_loss: 1.2326, test_loss: 1.1997, test_f1: 0.4044
 epoch: 3, train_loss: 1.2196, test_loss: 1.1827, test_f1: 0.4106
 epoch: 4, train_loss: 1.2015, test_loss: 1.1739, test_f1: 0.4057
 epoch: 5, train_loss: 1.1882, test_loss: 1.1593, test_f1: 0.4168
 epoch: 6, train_loss: 1.1804, test_loss: 1.1427, test_f1: 0.4073
 epoch: 7, train_loss: 1.1707, test_loss: 1.1341, test_f1: 0.4236
 epoch: 8, train_loss: 1.1595, test_loss: 1.1227, test_f1: 0.4316
 epoch: 9, train_loss: 1.1485, test_loss: 1.1116, test_f1: 0.4351
 epoch: 10, train_loss: 1.1300, test_loss: 1.1039, test_f1: 0.4259
 epoch: 11, train_loss: 1.1292, test_loss: 1.0880, test_f1: 0.4361
 epoch: 12, train_loss: 1.1232, test_loss: 1.0893, test_f1: 0.4392
 epoch: 13, train_loss: 1.1050, test_loss: 1.0726, test_f1: 0.4418
 epoch: 14, train_loss: 1.1120, test_loss: 1.0668, test_f1: 0.4364
 epoch: 15, train_loss: 1.0894, test_loss: 1.0641, test_f1: 0.4467
 epoch: 16, train_loss: 1.0859, test_loss: 1.0623, test_f1: 0.4342
 epoch: 17, train_loss: 1.0805, test_loss: 1.0605, test_f1: 0.4462
 epoch: 18, train_loss: 1.0700, test_loss: 1.0537, test_f1: 0.4587
 epoch: 19, train_loss: 1.0599, test_loss: 1.0448, test_f1: 0.4528
 epoch: 20, train_loss: 1.0624, test_loss: 1.0429, test_f1: 0.4675
 epoch: 21, train_loss: 1.0521, test_loss: 1.0275, test_f1: 0.4599
 epoch: 22, train_loss: 1.0425, test_loss: 1.0383, test_f1: 0.4329
 epoch: 23, train_loss: 1.0389, test_loss: 1.0179, test_f1: 0.4512
 epoch: 24, train_loss: 1.0354, test_loss: 1.0187, test_f1: 0.4561
 epoch: 25, train_loss: 1.0390, test_loss: 1.0096, test_f1: 0.4554
 epoch: 26, train_loss: 1.0183, test_loss: 1.0197, test_f1: 0.4498
 epoch: 27, train_loss: 1.0128, test_loss: 1.0220, test_f1: 0.4451
 epoch: 28, train_loss: 1.0017, test_loss: 1.0131, test_f1: 0.4708
 epoch: 29, train_loss: 1.0009, test_loss: 1.0309, test_f1: 0.4688
 epoch: 30, train_loss: 0.9942, test_loss: 1.0117, test_f1: 0.4734
 epoch: 31, train_loss: 0.9870, test_loss: 1.0006, test_f1: 0.4853
 epoch: 32, train_loss: 0.9765, test_loss: 1.0177, test_f1: 0.4837
 epoch: 33, train_loss: 0.9746, test_loss: 1.0185, test_f1: 0.4833
 epoch: 34, train_loss: 0.9752, test_loss: 1.0099, test_f1: 0.4830
 epoch: 35, train_loss: 0.9781, test_loss: 0.9892, test_f1: 0.4930
 epoch: 36, train_loss: 0.9662, test_loss: 1.0196, test_f1: 0.4938
 epoch: 37, train_loss: 0.9595, test_loss: 0.9927, test_f1: 0.4962
 epoch: 38, train_loss: 0.9442, test_loss: 1.0063, test_f1: 0.4843
 epoch: 39, train_loss: 0.9524, test_loss: 1.0142, test_f1: 0.4790
 epoch: 40, train_loss: 0.9313, test_loss: 1.0203, test_f1: 0.5026
 epoch: 41, train_loss: 0.9274, test_loss: 1.0183, test_f1: 0.5082
 epoch: 42, train_loss: 0.9380, test_loss: 1.0300, test_f1: 0.4804
 epoch: 43, train_loss: 0.9172, test_loss: 1.0363, test_f1: 0.4943
 epoch: 44, train_loss: 0.9132, test_loss: 1.0330, test_f1: 0.4838
 epoch: 45, train_loss: 0.9021, test_loss: 1.0284, test_f1: 0.4819
 epoch: 46, train_loss: 0.9108, test_loss: 1.0237, test_f1: 0.4957
 epoch: 47, train_loss: 0.9165, test_loss: 1.0399, test_f1: 0.5083
 epoch: 48, train_loss: 0.9027, test_loss: 1.0326, test_f1: 0.4970
 epoch: 49, train_loss: 0.9019, test_loss: 1.0438, test_f1: 0.4944
 epoch: 50, train_loss: 0.8955, test_loss: 1.0342, test_f1: 0.5035
 epoch: 51, train_loss: 0.8896, test_loss: 1.0465, test_f1: 0.5034
 epoch: 52, train_loss: 0.8826, test_loss: 1.0392, test_f1: 0.4934
 epoch: 53, train_loss: 0.8759, test_loss: 1.0333, test_f1: 0.4974
 epoch: 54, train_loss: 0.8684, test_loss: 1.0580, test_f1: 0.4971
 epoch: 55, train_loss: 0.8718, test_loss: 1.0381, test_f1: 0.4964
 epoch: 56, train_loss: 0.8687, test_loss: 1.0490, test_f1: 0.5050
 epoch: 57, train_loss: 0.8640, test_loss: 1.0423, test_f1: 0.4924
 epoch: 58, train_loss: 0.8632, test_loss: 1.0729, test_f1: 0.4914
 epoch: 59, train_loss: 0.8625, test_loss: 1.0561, test_f1: 0.4993
 epoch: 60, train_loss: 0.8550, test_loss: 1.0364, test_f1: 0.4950
 epoch: 61, train_loss: 0.8577, test_loss: 1.0311, test_f1: 0.5105
 epoch: 62, train_loss: 0.8617, test_loss: 1.0584, test_f1: 0.4996
 epoch: 63, train_loss: 0.8526, test_loss: 1.0498, test_f1: 0.5093
 epoch: 64, train_loss: 0.8492, test_loss: 1.0440, test_f1: 0.5052
 epoch: 65, train_loss: 0.8546, test_loss: 1.0414, test_f1: 0.5115
 epoch: 66, train_loss: 0.8478, test_loss: 1.0365, test_f1: 0.5106
 epoch: 67, train_loss: 0.8381, test_loss: 1.0494, test_f1: 0.4962
 epoch: 68, train_loss: 0.8340, test_loss: 1.0728, test_f1: 0.4886
 epoch: 69, train_loss: 0.8340, test_loss: 1.0971, test_f1: 0.4945
 epoch: 70, train_loss: 0.8314, test_loss: 1.0847, test_f1: 0.5015
 epoch: 71, train_loss: 0.8445, test_loss: 1.0562, test_f1: 0.5171
 epoch: 72, train_loss: 0.8271, test_loss: 1.0890, test_f1: 0.5026
 epoch: 73, train_loss: 0.8474, test_loss: 1.0497, test_f1: 0.5178
 epoch: 74, train_loss: 0.8414, test_loss: 1.0965, test_f1: 0.5078
 epoch: 75, train_loss: 0.8226, test_loss: 1.0915, test_f1: 0.5153
 epoch: 76, train_loss: 0.8317, test_loss: 1.0775, test_f1: 0.5168
 epoch: 77, train_loss: 0.8247, test_loss: 1.0991, test_f1: 0.5176
 epoch: 78, train_loss: 0.8167, test_loss: 1.0885, test_f1: 0.5184
 epoch: 79, train_loss: 0.8196, test_loss: 1.0694, test_f1: 0.5285
 epoch: 80, train_loss: 0.8123, test_loss: 1.0955, test_f1: 0.5114
 epoch: 81, train_loss: 0.8164, test_loss: 1.0953, test_f1: 0.5149
 epoch: 82, train_loss: 0.8166, test_loss: 1.1044, test_f1: 0.5064
 epoch: 83, train_loss: 0.8236, test_loss: 1.1008, test_f1: 0.5024
 epoch: 84, train_loss: 0.8074, test_loss: 1.1218, test_f1: 0.5156
 epoch: 85, train_loss: 0.8198, test_loss: 1.0956, test_f1: 0.5120
 epoch: 86, train_loss: 0.8114, test_loss: 1.1328, test_f1: 0.5167
 epoch: 87, train_loss: 0.7990, test_loss: 1.1214, test_f1: 0.5106
 epoch: 88, train_loss: 0.7957, test_loss: 1.0838, test_f1: 0.5108
 epoch: 89, train_loss: 0.8106, test_loss: 1.0790, test_f1: 0.5250
 epoch: 90, train_loss: 0.8065, test_loss: 1.0908, test_f1: 0.5197
 epoch: 91, train_loss: 0.8049, test_loss: 1.1011, test_f1: 0.5245
 epoch: 92, train_loss: 0.8003, test_loss: 1.0838, test_f1: 0.5150
 epoch: 93, train_loss: 0.7881, test_loss: 1.1040, test_f1: 0.5230
 epoch: 94, train_loss: 0.7948, test_loss: 1.0976, test_f1: 0.5223
 epoch: 95, train_loss: 0.7949, test_loss: 1.0996, test_f1: 0.5215
 epoch: 96, train_loss: 0.7845, test_loss: 1.1094, test_f1: 0.5229
 epoch: 97, train_loss: 0.7935, test_loss: 1.1283, test_f1: 0.5095
 epoch: 98, train_loss: 0.7998, test_loss: 1.0797, test_f1: 0.5307
 epoch: 99, train_loss: 0.7862, test_loss: 1.1041, test_f1: 0.5252
##################ITERATION #3 ****************************************
 epoch: 0, train_loss: 1.3094, test_loss: 1.2730, test_f1: 0.2288
 epoch: 1, train_loss: 1.2608, test_loss: 1.2282, test_f1: 0.3193
 epoch: 2, train_loss: 1.2401, test_loss: 1.1987, test_f1: 0.3543
 epoch: 3, train_loss: 1.2250, test_loss: 1.1836, test_f1: 0.3797
 epoch: 4, train_loss: 1.2079, test_loss: 1.1702, test_f1: 0.4095
 epoch: 5, train_loss: 1.1987, test_loss: 1.1560, test_f1: 0.4034
 epoch: 6, train_loss: 1.1839, test_loss: 1.1455, test_f1: 0.4131
 epoch: 7, train_loss: 1.1707, test_loss: 1.1345, test_f1: 0.4193
 epoch: 8, train_loss: 1.1638, test_loss: 1.1276, test_f1: 0.4089
 epoch: 9, train_loss: 1.1512, test_loss: 1.1132, test_f1: 0.4437
 epoch: 10, train_loss: 1.1423, test_loss: 1.1080, test_f1: 0.4482
 epoch: 11, train_loss: 1.1276, test_loss: 1.0912, test_f1: 0.4409
 epoch: 12, train_loss: 1.1166, test_loss: 1.0837, test_f1: 0.4347
 epoch: 13, train_loss: 1.1058, test_loss: 1.0760, test_f1: 0.4465
 epoch: 14, train_loss: 1.1001, test_loss: 1.0670, test_f1: 0.4469
 epoch: 15, train_loss: 1.0899, test_loss: 1.0658, test_f1: 0.4388
 epoch: 16, train_loss: 1.0812, test_loss: 1.0547, test_f1: 0.4518
 epoch: 17, train_loss: 1.0739, test_loss: 1.0591, test_f1: 0.4412
 epoch: 18, train_loss: 1.0691, test_loss: 1.0579, test_f1: 0.4417
 epoch: 19, train_loss: 1.0556, test_loss: 1.0569, test_f1: 0.4498
 epoch: 20, train_loss: 1.0573, test_loss: 1.0384, test_f1: 0.4477
 epoch: 21, train_loss: 1.0478, test_loss: 1.0498, test_f1: 0.4338
 epoch: 22, train_loss: 1.0405, test_loss: 1.0287, test_f1: 0.4635
 epoch: 23, train_loss: 1.0297, test_loss: 1.0358, test_f1: 0.4515
 epoch: 24, train_loss: 1.0211, test_loss: 1.0346, test_f1: 0.4669
 epoch: 25, train_loss: 1.0264, test_loss: 1.0347, test_f1: 0.4676
 epoch: 26, train_loss: 1.0145, test_loss: 1.0283, test_f1: 0.4688
 epoch: 27, train_loss: 1.0052, test_loss: 1.0499, test_f1: 0.4384
 epoch: 28, train_loss: 1.0046, test_loss: 1.0307, test_f1: 0.4650
 epoch: 29, train_loss: 1.0036, test_loss: 1.0189, test_f1: 0.4752
 epoch: 30, train_loss: 0.9937, test_loss: 1.0151, test_f1: 0.4729
 epoch: 31, train_loss: 0.9871, test_loss: 1.0212, test_f1: 0.4768
 epoch: 32, train_loss: 0.9787, test_loss: 1.0167, test_f1: 0.4856
 epoch: 33, train_loss: 0.9797, test_loss: 1.0099, test_f1: 0.4759
 epoch: 34, train_loss: 0.9713, test_loss: 1.0261, test_f1: 0.4721
 epoch: 35, train_loss: 0.9694, test_loss: 1.0279, test_f1: 0.4591
 epoch: 36, train_loss: 0.9563, test_loss: 1.0086, test_f1: 0.4768
 epoch: 37, train_loss: 0.9602, test_loss: 1.0226, test_f1: 0.4604
 epoch: 38, train_loss: 0.9620, test_loss: 1.0205, test_f1: 0.4926
 epoch: 39, train_loss: 0.9586, test_loss: 1.0234, test_f1: 0.4644
 epoch: 40, train_loss: 0.9366, test_loss: 0.9887, test_f1: 0.4930
 epoch: 41, train_loss: 0.9367, test_loss: 1.0031, test_f1: 0.4735
 epoch: 42, train_loss: 0.9279, test_loss: 0.9931, test_f1: 0.4963
 epoch: 43, train_loss: 0.9441, test_loss: 1.0105, test_f1: 0.4786
 epoch: 44, train_loss: 0.9246, test_loss: 1.0011, test_f1: 0.4920
 epoch: 45, train_loss: 0.9193, test_loss: 1.0185, test_f1: 0.4563
 epoch: 46, train_loss: 0.9217, test_loss: 1.0178, test_f1: 0.4753
 epoch: 47, train_loss: 0.9156, test_loss: 1.0093, test_f1: 0.4647
 epoch: 48, train_loss: 0.9086, test_loss: 1.0192, test_f1: 0.4632
 epoch: 49, train_loss: 0.9161, test_loss: 1.0241, test_f1: 0.4810
 epoch: 50, train_loss: 0.9059, test_loss: 1.0193, test_f1: 0.4679
 epoch: 51, train_loss: 0.8982, test_loss: 1.0195, test_f1: 0.4629
 epoch: 52, train_loss: 0.8984, test_loss: 1.0264, test_f1: 0.4612
 epoch: 53, train_loss: 0.8917, test_loss: 1.0056, test_f1: 0.4703
 epoch: 54, train_loss: 0.8941, test_loss: 1.0189, test_f1: 0.4695
 epoch: 55, train_loss: 0.8705, test_loss: 1.0260, test_f1: 0.4721
 epoch: 56, train_loss: 0.8910, test_loss: 1.0276, test_f1: 0.4654
 epoch: 57, train_loss: 0.8851, test_loss: 1.0474, test_f1: 0.4726
 epoch: 58, train_loss: 0.8746, test_loss: 1.0214, test_f1: 0.4957
 epoch: 59, train_loss: 0.8768, test_loss: 1.0250, test_f1: 0.4961
 epoch: 60, train_loss: 0.8704, test_loss: 1.0282, test_f1: 0.4813
 epoch: 61, train_loss: 0.8749, test_loss: 1.0356, test_f1: 0.4776
 epoch: 62, train_loss: 0.8706, test_loss: 1.0412, test_f1: 0.4864
 epoch: 63, train_loss: 0.8686, test_loss: 1.0408, test_f1: 0.4760
 epoch: 64, train_loss: 0.8762, test_loss: 1.0086, test_f1: 0.4889
 epoch: 65, train_loss: 0.8571, test_loss: 1.0431, test_f1: 0.4799
 epoch: 66, train_loss: 0.8623, test_loss: 1.0331, test_f1: 0.4775
 epoch: 67, train_loss: 0.8619, test_loss: 1.0559, test_f1: 0.4687
 epoch: 68, train_loss: 0.8587, test_loss: 1.0593, test_f1: 0.4614
 epoch: 69, train_loss: 0.8620, test_loss: 1.0491, test_f1: 0.4713
 epoch: 70, train_loss: 0.8493, test_loss: 1.0580, test_f1: 0.4751
 epoch: 71, train_loss: 0.8513, test_loss: 1.0353, test_f1: 0.4707
 epoch: 72, train_loss: 0.8494, test_loss: 1.0680, test_f1: 0.4779
 epoch: 73, train_loss: 0.8517, test_loss: 1.0361, test_f1: 0.4738
 epoch: 74, train_loss: 0.8490, test_loss: 1.0612, test_f1: 0.4729
 epoch: 75, train_loss: 0.8469, test_loss: 1.0404, test_f1: 0.4741
 epoch: 76, train_loss: 0.8395, test_loss: 1.0422, test_f1: 0.4813
 epoch: 77, train_loss: 0.8565, test_loss: 1.0449, test_f1: 0.4775
 epoch: 78, train_loss: 0.8444, test_loss: 1.0469, test_f1: 0.4842
 epoch: 79, train_loss: 0.8373, test_loss: 1.0509, test_f1: 0.4782
 epoch: 80, train_loss: 0.8382, test_loss: 1.0789, test_f1: 0.4644
 epoch: 81, train_loss: 0.8295, test_loss: 1.0632, test_f1: 0.4832
 epoch: 82, train_loss: 0.8244, test_loss: 1.0667, test_f1: 0.4690
 epoch: 83, train_loss: 0.8300, test_loss: 1.0521, test_f1: 0.4824
 epoch: 84, train_loss: 0.8445, test_loss: 1.0540, test_f1: 0.4821
 epoch: 85, train_loss: 0.8297, test_loss: 1.0711, test_f1: 0.4822
 epoch: 86, train_loss: 0.8223, test_loss: 1.0874, test_f1: 0.4871
 epoch: 87, train_loss: 0.8345, test_loss: 1.0707, test_f1: 0.4825
 epoch: 88, train_loss: 0.8236, test_loss: 1.0592, test_f1: 0.4997
 epoch: 89, train_loss: 0.8356, test_loss: 1.1014, test_f1: 0.4660
 epoch: 90, train_loss: 0.8216, test_loss: 1.0989, test_f1: 0.4681
 epoch: 91, train_loss: 0.8178, test_loss: 1.0703, test_f1: 0.4884
 epoch: 92, train_loss: 0.8164, test_loss: 1.0846, test_f1: 0.4895
 epoch: 93, train_loss: 0.8209, test_loss: 1.0930, test_f1: 0.4823
 epoch: 94, train_loss: 0.8173, test_loss: 1.0725, test_f1: 0.4827
 epoch: 95, train_loss: 0.8088, test_loss: 1.0935, test_f1: 0.4905
 epoch: 96, train_loss: 0.8144, test_loss: 1.0643, test_f1: 0.4947
 epoch: 97, train_loss: 0.8020, test_loss: 1.0914, test_f1: 0.4773
 epoch: 98, train_loss: 0.8079, test_loss: 1.0952, test_f1: 0.4772
 epoch: 99, train_loss: 0.8216, test_loss: 1.0743, test_f1: 0.4850
##################ITERATION #4 ****************************************
 epoch: 0, train_loss: 1.3204, test_loss: 1.2635, test_f1: 0.2606
 epoch: 1, train_loss: 1.2589, test_loss: 1.2093, test_f1: 0.3715
 epoch: 2, train_loss: 1.2344, test_loss: 1.1891, test_f1: 0.4000
 epoch: 3, train_loss: 1.2209, test_loss: 1.1773, test_f1: 0.4347
 epoch: 4, train_loss: 1.2059, test_loss: 1.1625, test_f1: 0.4529
 epoch: 5, train_loss: 1.1909, test_loss: 1.1536, test_f1: 0.4500
 epoch: 6, train_loss: 1.1785, test_loss: 1.1474, test_f1: 0.4581
 epoch: 7, train_loss: 1.1668, test_loss: 1.1345, test_f1: 0.4547
 epoch: 8, train_loss: 1.1704, test_loss: 1.1291, test_f1: 0.4402
 epoch: 9, train_loss: 1.1556, test_loss: 1.1171, test_f1: 0.4465
 epoch: 10, train_loss: 1.1339, test_loss: 1.1139, test_f1: 0.4533
 epoch: 11, train_loss: 1.1308, test_loss: 1.1066, test_f1: 0.4474
 epoch: 12, train_loss: 1.1310, test_loss: 1.1016, test_f1: 0.4410
 epoch: 13, train_loss: 1.1162, test_loss: 1.0975, test_f1: 0.4582
 epoch: 14, train_loss: 1.1048, test_loss: 1.0919, test_f1: 0.4395
 epoch: 15, train_loss: 1.0975, test_loss: 1.0833, test_f1: 0.4445
 epoch: 16, train_loss: 1.0852, test_loss: 1.0716, test_f1: 0.4533
 epoch: 17, train_loss: 1.0805, test_loss: 1.0750, test_f1: 0.4420
 epoch: 18, train_loss: 1.0937, test_loss: 1.0616, test_f1: 0.4498
 epoch: 19, train_loss: 1.0715, test_loss: 1.0530, test_f1: 0.4611
 epoch: 20, train_loss: 1.0497, test_loss: 1.0570, test_f1: 0.4537
 epoch: 21, train_loss: 1.0591, test_loss: 1.0505, test_f1: 0.4611
 epoch: 22, train_loss: 1.0489, test_loss: 1.0451, test_f1: 0.4641
 epoch: 23, train_loss: 1.0490, test_loss: 1.0413, test_f1: 0.4551
 epoch: 24, train_loss: 1.0375, test_loss: 1.0404, test_f1: 0.4769
 epoch: 25, train_loss: 1.0245, test_loss: 1.0252, test_f1: 0.4710
 epoch: 26, train_loss: 1.0251, test_loss: 1.0313, test_f1: 0.4686
 epoch: 27, train_loss: 1.0128, test_loss: 1.0283, test_f1: 0.4740
 epoch: 28, train_loss: 1.0036, test_loss: 1.0358, test_f1: 0.4525
 epoch: 29, train_loss: 1.0030, test_loss: 1.0126, test_f1: 0.4831
 epoch: 30, train_loss: 0.9971, test_loss: 1.0067, test_f1: 0.4797
 epoch: 31, train_loss: 0.9876, test_loss: 1.0232, test_f1: 0.4730
 epoch: 32, train_loss: 0.9943, test_loss: 1.0183, test_f1: 0.4765
 epoch: 33, train_loss: 0.9877, test_loss: 1.0305, test_f1: 0.4586
 epoch: 34, train_loss: 0.9870, test_loss: 1.0181, test_f1: 0.4647
 epoch: 35, train_loss: 0.9664, test_loss: 1.0161, test_f1: 0.4736
 epoch: 36, train_loss: 0.9614, test_loss: 1.0124, test_f1: 0.4663
 epoch: 37, train_loss: 0.9596, test_loss: 0.9893, test_f1: 0.4782
 epoch: 38, train_loss: 0.9459, test_loss: 1.0129, test_f1: 0.4751
 epoch: 39, train_loss: 0.9528, test_loss: 0.9963, test_f1: 0.4708
 epoch: 40, train_loss: 0.9335, test_loss: 1.0126, test_f1: 0.4763
 epoch: 41, train_loss: 0.9330, test_loss: 1.0133, test_f1: 0.4858
 epoch: 42, train_loss: 0.9471, test_loss: 0.9779, test_f1: 0.5000
 epoch: 43, train_loss: 0.9383, test_loss: 0.9918, test_f1: 0.5033
 epoch: 44, train_loss: 0.9222, test_loss: 0.9838, test_f1: 0.4925
 epoch: 45, train_loss: 0.9228, test_loss: 0.9763, test_f1: 0.4962
 epoch: 46, train_loss: 0.9090, test_loss: 0.9977, test_f1: 0.4910
 epoch: 47, train_loss: 0.9169, test_loss: 1.0065, test_f1: 0.4822
 epoch: 48, train_loss: 0.9167, test_loss: 1.0013, test_f1: 0.4933
 epoch: 49, train_loss: 0.9019, test_loss: 0.9923, test_f1: 0.4900
 epoch: 50, train_loss: 0.8935, test_loss: 1.0028, test_f1: 0.5034
 epoch: 51, train_loss: 0.9003, test_loss: 0.9940, test_f1: 0.4785
 epoch: 52, train_loss: 0.8936, test_loss: 1.0036, test_f1: 0.4980
 epoch: 53, train_loss: 0.8817, test_loss: 1.0045, test_f1: 0.4824
 epoch: 54, train_loss: 0.8897, test_loss: 0.9959, test_f1: 0.5006
 epoch: 55, train_loss: 0.8913, test_loss: 0.9969, test_f1: 0.4990
 epoch: 56, train_loss: 0.8864, test_loss: 0.9909, test_f1: 0.4868
 epoch: 57, train_loss: 0.8699, test_loss: 1.0016, test_f1: 0.5023
 epoch: 58, train_loss: 0.8783, test_loss: 0.9891, test_f1: 0.5101
 epoch: 59, train_loss: 0.8839, test_loss: 1.0077, test_f1: 0.4885
 epoch: 60, train_loss: 0.8755, test_loss: 1.0049, test_f1: 0.5081
 epoch: 61, train_loss: 0.8665, test_loss: 1.0018, test_f1: 0.5062
 epoch: 62, train_loss: 0.8647, test_loss: 1.0206, test_f1: 0.5021
 epoch: 63, train_loss: 0.8692, test_loss: 0.9959, test_f1: 0.5146
 epoch: 64, train_loss: 0.8615, test_loss: 0.9931, test_f1: 0.5147
 epoch: 65, train_loss: 0.8715, test_loss: 0.9941, test_f1: 0.5054
 epoch: 66, train_loss: 0.8574, test_loss: 0.9973, test_f1: 0.5083
 epoch: 67, train_loss: 0.8627, test_loss: 1.0067, test_f1: 0.5082
 epoch: 68, train_loss: 0.8552, test_loss: 1.0052, test_f1: 0.5102
 epoch: 69, train_loss: 0.8480, test_loss: 1.0034, test_f1: 0.5118
 epoch: 70, train_loss: 0.8513, test_loss: 1.0008, test_f1: 0.5085
 epoch: 71, train_loss: 0.8506, test_loss: 1.0126, test_f1: 0.5129
 epoch: 72, train_loss: 0.8491, test_loss: 1.0113, test_f1: 0.5117
 epoch: 73, train_loss: 0.8542, test_loss: 1.0218, test_f1: 0.4981
 epoch: 74, train_loss: 0.8489, test_loss: 1.0208, test_f1: 0.5035
 epoch: 75, train_loss: 0.8596, test_loss: 1.0129, test_f1: 0.5194
 epoch: 76, train_loss: 0.8473, test_loss: 1.0053, test_f1: 0.5121
 epoch: 77, train_loss: 0.8489, test_loss: 1.0113, test_f1: 0.5259
 epoch: 78, train_loss: 0.8400, test_loss: 1.0000, test_f1: 0.5231
 epoch: 79, train_loss: 0.8387, test_loss: 1.0233, test_f1: 0.5056
 epoch: 80, train_loss: 0.8595, test_loss: 1.0030, test_f1: 0.5235
 epoch: 81, train_loss: 0.8405, test_loss: 0.9991, test_f1: 0.5292
 epoch: 82, train_loss: 0.8503, test_loss: 1.0335, test_f1: 0.5001
 epoch: 83, train_loss: 0.8285, test_loss: 1.0217, test_f1: 0.5130
 epoch: 84, train_loss: 0.8272, test_loss: 1.0355, test_f1: 0.5107
 epoch: 85, train_loss: 0.8271, test_loss: 1.0721, test_f1: 0.5196
 epoch: 86, train_loss: 0.8369, test_loss: 1.0182, test_f1: 0.5232
 epoch: 87, train_loss: 0.8080, test_loss: 1.0235, test_f1: 0.5169
 epoch: 88, train_loss: 0.8168, test_loss: 1.0200, test_f1: 0.5180
 epoch: 89, train_loss: 0.8199, test_loss: 1.0272, test_f1: 0.5155
 epoch: 90, train_loss: 0.8223, test_loss: 1.0575, test_f1: 0.5083
 epoch: 91, train_loss: 0.8199, test_loss: 1.0407, test_f1: 0.5089
 epoch: 92, train_loss: 0.8091, test_loss: 1.0580, test_f1: 0.5072
 epoch: 93, train_loss: 0.8139, test_loss: 1.0494, test_f1: 0.5060
 epoch: 94, train_loss: 0.8041, test_loss: 1.0422, test_f1: 0.5257
 epoch: 95, train_loss: 0.8088, test_loss: 1.0651, test_f1: 0.4972
 epoch: 96, train_loss: 0.8071, test_loss: 1.0377, test_f1: 0.5186
 epoch: 97, train_loss: 0.8078, test_loss: 1.0434, test_f1: 0.5205
 epoch: 98, train_loss: 0.8186, test_loss: 1.0734, test_f1: 0.5136
 epoch: 99, train_loss: 0.8147, test_loss: 1.0325, test_f1: 0.5040
##################ITERATION #5 ****************************************
 epoch: 0, train_loss: 1.3146, test_loss: 1.2392, test_f1: 0.3264
 epoch: 1, train_loss: 1.2443, test_loss: 1.1947, test_f1: 0.3957
 epoch: 2, train_loss: 1.2202, test_loss: 1.1874, test_f1: 0.4148
 epoch: 3, train_loss: 1.1998, test_loss: 1.2153, test_f1: 0.4189
 epoch: 4, train_loss: 1.1861, test_loss: 1.2004, test_f1: 0.4242
 epoch: 5, train_loss: 1.1830, test_loss: 1.1255, test_f1: 0.4364
 epoch: 6, train_loss: 1.1631, test_loss: 1.1245, test_f1: 0.4402
 epoch: 7, train_loss: 1.1536, test_loss: 1.1116, test_f1: 0.4652
 epoch: 8, train_loss: 1.1410, test_loss: 1.1030, test_f1: 0.4345
 epoch: 9, train_loss: 1.1412, test_loss: 1.1114, test_f1: 0.4234
 epoch: 10, train_loss: 1.1251, test_loss: 1.0899, test_f1: 0.4238
 epoch: 11, train_loss: 1.1291, test_loss: 1.1013, test_f1: 0.4217
 epoch: 12, train_loss: 1.1199, test_loss: 1.0844, test_f1: 0.4292
 epoch: 13, train_loss: 1.1047, test_loss: 1.0856, test_f1: 0.4092
 epoch: 14, train_loss: 1.0993, test_loss: 1.0839, test_f1: 0.4273
 epoch: 15, train_loss: 1.0941, test_loss: 1.0826, test_f1: 0.4297
 epoch: 16, train_loss: 1.0792, test_loss: 1.0654, test_f1: 0.4334
 epoch: 17, train_loss: 1.0831, test_loss: 1.0694, test_f1: 0.4274
 epoch: 18, train_loss: 1.0724, test_loss: 1.0617, test_f1: 0.4375
 epoch: 19, train_loss: 1.0649, test_loss: 1.0673, test_f1: 0.4279
 epoch: 20, train_loss: 1.0590, test_loss: 1.0442, test_f1: 0.4416
 epoch: 21, train_loss: 1.0464, test_loss: 1.0375, test_f1: 0.4465
 epoch: 22, train_loss: 1.0461, test_loss: 1.1376, test_f1: 0.4189
 epoch: 23, train_loss: 1.0409, test_loss: 1.0280, test_f1: 0.4429
 epoch: 24, train_loss: 1.0406, test_loss: 1.0255, test_f1: 0.4646
 epoch: 25, train_loss: 1.0256, test_loss: 1.0256, test_f1: 0.4592
 epoch: 26, train_loss: 1.0218, test_loss: 1.0278, test_f1: 0.4686
 epoch: 27, train_loss: 1.0196, test_loss: 1.0407, test_f1: 0.4466
 epoch: 28, train_loss: 1.0234, test_loss: 1.0271, test_f1: 0.4448
 epoch: 29, train_loss: 1.0087, test_loss: 1.0188, test_f1: 0.4548
 epoch: 30, train_loss: 1.0155, test_loss: 1.0197, test_f1: 0.4533
 epoch: 31, train_loss: 1.0034, test_loss: 1.0185, test_f1: 0.4386
 epoch: 32, train_loss: 0.9869, test_loss: 1.0143, test_f1: 0.4501
 epoch: 33, train_loss: 0.9873, test_loss: 0.9998, test_f1: 0.4607
 epoch: 34, train_loss: 0.9869, test_loss: 1.0026, test_f1: 0.4514
 epoch: 35, train_loss: 0.9839, test_loss: 1.0031, test_f1: 0.4649
 epoch: 36, train_loss: 0.9783, test_loss: 1.0038, test_f1: 0.4714
 epoch: 37, train_loss: 0.9726, test_loss: 1.0032, test_f1: 0.4846
 epoch: 38, train_loss: 0.9660, test_loss: 0.9922, test_f1: 0.4840
 epoch: 39, train_loss: 0.9610, test_loss: 1.0065, test_f1: 0.4681
 epoch: 40, train_loss: 0.9581, test_loss: 1.0060, test_f1: 0.4675
 epoch: 41, train_loss: 0.9598, test_loss: 1.0019, test_f1: 0.4799
 epoch: 42, train_loss: 0.9585, test_loss: 1.0104, test_f1: 0.4752
 epoch: 43, train_loss: 0.9486, test_loss: 1.0043, test_f1: 0.4767
 epoch: 44, train_loss: 0.9352, test_loss: 0.9977, test_f1: 0.4800
 epoch: 45, train_loss: 0.9460, test_loss: 0.9997, test_f1: 0.4899
 epoch: 46, train_loss: 0.9398, test_loss: 1.0164, test_f1: 0.4773
 epoch: 47, train_loss: 0.9217, test_loss: 1.0118, test_f1: 0.4818
 epoch: 48, train_loss: 0.9221, test_loss: 1.0122, test_f1: 0.4794
 epoch: 49, train_loss: 0.9289, test_loss: 1.0116, test_f1: 0.4850
 epoch: 50, train_loss: 0.9257, test_loss: 0.9923, test_f1: 0.4886
 epoch: 51, train_loss: 0.9159, test_loss: 1.0042, test_f1: 0.4818
 epoch: 52, train_loss: 0.9139, test_loss: 1.0084, test_f1: 0.4846
 epoch: 53, train_loss: 0.9059, test_loss: 1.0059, test_f1: 0.4809
 epoch: 54, train_loss: 0.9117, test_loss: 1.0053, test_f1: 0.4831
 epoch: 55, train_loss: 0.8920, test_loss: 1.0005, test_f1: 0.4837
 epoch: 56, train_loss: 0.8995, test_loss: 1.0202, test_f1: 0.4850
 epoch: 57, train_loss: 0.8951, test_loss: 1.0143, test_f1: 0.4795
 epoch: 58, train_loss: 0.8903, test_loss: 0.9951, test_f1: 0.4870
 epoch: 59, train_loss: 0.8947, test_loss: 1.0057, test_f1: 0.4785
 epoch: 60, train_loss: 0.8858, test_loss: 1.0114, test_f1: 0.4841
 epoch: 61, train_loss: 0.8794, test_loss: 0.9997, test_f1: 0.4896
 epoch: 62, train_loss: 0.8762, test_loss: 1.0029, test_f1: 0.4870
 epoch: 63, train_loss: 0.8928, test_loss: 1.0082, test_f1: 0.5057
 epoch: 64, train_loss: 0.8786, test_loss: 1.0148, test_f1: 0.4860
 epoch: 65, train_loss: 0.8840, test_loss: 1.0078, test_f1: 0.4961
 epoch: 66, train_loss: 0.8835, test_loss: 1.0002, test_f1: 0.5003
 epoch: 67, train_loss: 0.8711, test_loss: 1.0056, test_f1: 0.4838
 epoch: 68, train_loss: 0.8767, test_loss: 1.0083, test_f1: 0.4858
 epoch: 69, train_loss: 0.8766, test_loss: 1.0065, test_f1: 0.4975
 epoch: 70, train_loss: 0.8753, test_loss: 0.9992, test_f1: 0.4925
 epoch: 71, train_loss: 0.8735, test_loss: 0.9972, test_f1: 0.4914
 epoch: 72, train_loss: 0.8673, test_loss: 1.0051, test_f1: 0.4882
 epoch: 73, train_loss: 0.8847, test_loss: 1.0004, test_f1: 0.4925
 epoch: 74, train_loss: 0.8610, test_loss: 1.0083, test_f1: 0.4861
 epoch: 75, train_loss: 0.8709, test_loss: 1.0006, test_f1: 0.4829
 epoch: 76, train_loss: 0.8752, test_loss: 1.0073, test_f1: 0.4895
 epoch: 77, train_loss: 0.8525, test_loss: 1.0144, test_f1: 0.4927
 epoch: 78, train_loss: 0.8595, test_loss: 1.0102, test_f1: 0.5069
 epoch: 79, train_loss: 0.8546, test_loss: 1.0191, test_f1: 0.4899
 epoch: 80, train_loss: 0.8609, test_loss: 1.0266, test_f1: 0.4916
 epoch: 81, train_loss: 0.8502, test_loss: 1.0197, test_f1: 0.4929
 epoch: 82, train_loss: 0.8529, test_loss: 1.0164, test_f1: 0.4862
 epoch: 83, train_loss: 0.8482, test_loss: 1.0140, test_f1: 0.4989
 epoch: 84, train_loss: 0.8460, test_loss: 1.0212, test_f1: 0.5023
 epoch: 85, train_loss: 0.8297, test_loss: 1.0197, test_f1: 0.4965
 epoch: 86, train_loss: 0.8491, test_loss: 1.0349, test_f1: 0.4973
 epoch: 87, train_loss: 0.8511, test_loss: 1.0224, test_f1: 0.5103
 epoch: 88, train_loss: 0.8336, test_loss: 1.0309, test_f1: 0.4913
 epoch: 89, train_loss: 0.8471, test_loss: 1.0235, test_f1: 0.4941
 epoch: 90, train_loss: 0.8282, test_loss: 1.0207, test_f1: 0.4875
 epoch: 91, train_loss: 0.8409, test_loss: 1.0160, test_f1: 0.4955
 epoch: 92, train_loss: 0.8446, test_loss: 1.0295, test_f1: 0.4901
 epoch: 93, train_loss: 0.8373, test_loss: 1.0218, test_f1: 0.4864
 epoch: 94, train_loss: 0.8225, test_loss: 1.0362, test_f1: 0.4973
 epoch: 95, train_loss: 0.8369, test_loss: 1.0192, test_f1: 0.4944
 epoch: 96, train_loss: 0.8199, test_loss: 1.0363, test_f1: 0.4990
 epoch: 97, train_loss: 0.8160, test_loss: 1.0168, test_f1: 0.5013
 epoch: 98, train_loss: 0.8276, test_loss: 1.0205, test_f1: 0.5082
 epoch: 99, train_loss: 0.8162, test_loss: 1.0472, test_f1: 0.4982
##################ITERATION #6 ****************************************
 epoch: 0, train_loss: 1.3393, test_loss: 1.2424, test_f1: 0.3194
 epoch: 1, train_loss: 1.2355, test_loss: 1.1876, test_f1: 0.3678
 epoch: 2, train_loss: 1.2095, test_loss: 1.1676, test_f1: 0.3865
 epoch: 3, train_loss: 1.2011, test_loss: 1.1613, test_f1: 0.3862
 epoch: 4, train_loss: 1.1912, test_loss: 1.1576, test_f1: 0.3746
 epoch: 5, train_loss: 1.1738, test_loss: 1.1405, test_f1: 0.3816
 epoch: 6, train_loss: 1.1553, test_loss: 1.1276, test_f1: 0.3890
 epoch: 7, train_loss: 1.1491, test_loss: 1.1318, test_f1: 0.3854
 epoch: 8, train_loss: 1.1403, test_loss: 1.1096, test_f1: 0.4109
 epoch: 9, train_loss: 1.1241, test_loss: 1.1093, test_f1: 0.4066
 epoch: 10, train_loss: 1.1142, test_loss: 1.1034, test_f1: 0.4337
 epoch: 11, train_loss: 1.1092, test_loss: 1.0812, test_f1: 0.4338
 epoch: 12, train_loss: 1.1002, test_loss: 1.0850, test_f1: 0.4301
 epoch: 13, train_loss: 1.0943, test_loss: 1.0800, test_f1: 0.4257
 epoch: 14, train_loss: 1.0863, test_loss: 1.0598, test_f1: 0.4320
 epoch: 15, train_loss: 1.0798, test_loss: 1.0973, test_f1: 0.4157
 epoch: 16, train_loss: 1.0771, test_loss: 1.1072, test_f1: 0.4187
 epoch: 17, train_loss: 1.0673, test_loss: 1.0697, test_f1: 0.4398
 epoch: 18, train_loss: 1.0534, test_loss: 1.0538, test_f1: 0.4366
 epoch: 19, train_loss: 1.0651, test_loss: 1.1126, test_f1: 0.4253
 epoch: 20, train_loss: 1.0557, test_loss: 1.0374, test_f1: 0.4581
 epoch: 21, train_loss: 1.0403, test_loss: 1.0587, test_f1: 0.4525
 epoch: 22, train_loss: 1.0437, test_loss: 1.0266, test_f1: 0.4657
 epoch: 23, train_loss: 1.0293, test_loss: 1.0295, test_f1: 0.4520
 epoch: 24, train_loss: 1.0281, test_loss: 1.0255, test_f1: 0.4648
 epoch: 25, train_loss: 1.0184, test_loss: 1.0207, test_f1: 0.4788
 epoch: 26, train_loss: 1.0187, test_loss: 1.0189, test_f1: 0.4782
 epoch: 27, train_loss: 1.0087, test_loss: 1.0092, test_f1: 0.4859
 epoch: 28, train_loss: 1.0065, test_loss: 1.0198, test_f1: 0.4638
 epoch: 29, train_loss: 1.0006, test_loss: 1.0119, test_f1: 0.4634
 epoch: 30, train_loss: 0.9991, test_loss: 1.0040, test_f1: 0.4903
 epoch: 31, train_loss: 0.9812, test_loss: 0.9953, test_f1: 0.4953
 epoch: 32, train_loss: 0.9874, test_loss: 0.9982, test_f1: 0.4854
 epoch: 33, train_loss: 0.9844, test_loss: 0.9879, test_f1: 0.4908
 epoch: 34, train_loss: 0.9737, test_loss: 0.9989, test_f1: 0.4814
 epoch: 35, train_loss: 0.9844, test_loss: 1.0022, test_f1: 0.4918
 epoch: 36, train_loss: 0.9795, test_loss: 1.0006, test_f1: 0.4839
 epoch: 37, train_loss: 0.9712, test_loss: 0.9913, test_f1: 0.4816
 epoch: 38, train_loss: 0.9642, test_loss: 0.9877, test_f1: 0.4884
 epoch: 39, train_loss: 0.9395, test_loss: 0.9960, test_f1: 0.4772
 epoch: 40, train_loss: 0.9479, test_loss: 0.9972, test_f1: 0.4694
 epoch: 41, train_loss: 0.9410, test_loss: 0.9698, test_f1: 0.5002
 epoch: 42, train_loss: 0.9385, test_loss: 0.9936, test_f1: 0.4878
 epoch: 43, train_loss: 0.9360, test_loss: 0.9931, test_f1: 0.4773
 epoch: 44, train_loss: 0.9295, test_loss: 0.9981, test_f1: 0.4923
 epoch: 45, train_loss: 0.9319, test_loss: 0.9781, test_f1: 0.4889
 epoch: 46, train_loss: 0.9287, test_loss: 0.9907, test_f1: 0.5018
 epoch: 47, train_loss: 0.9333, test_loss: 0.9855, test_f1: 0.5056
 epoch: 48, train_loss: 0.9116, test_loss: 0.9894, test_f1: 0.5008
 epoch: 49, train_loss: 0.9095, test_loss: 0.9751, test_f1: 0.4933
 epoch: 50, train_loss: 0.9195, test_loss: 0.9666, test_f1: 0.5036
 epoch: 51, train_loss: 0.9050, test_loss: 0.9642, test_f1: 0.5117
 epoch: 52, train_loss: 0.8996, test_loss: 0.9916, test_f1: 0.5079
 epoch: 53, train_loss: 0.8972, test_loss: 0.9905, test_f1: 0.5067
 epoch: 54, train_loss: 0.8926, test_loss: 0.9789, test_f1: 0.5333
 epoch: 55, train_loss: 0.8982, test_loss: 0.9651, test_f1: 0.5155
 epoch: 56, train_loss: 0.8995, test_loss: 0.9914, test_f1: 0.4832
 epoch: 57, train_loss: 0.8782, test_loss: 0.9866, test_f1: 0.4983
 epoch: 58, train_loss: 0.8911, test_loss: 0.9800, test_f1: 0.5085
 epoch: 59, train_loss: 0.8923, test_loss: 0.9789, test_f1: 0.5100
 epoch: 60, train_loss: 0.8862, test_loss: 0.9718, test_f1: 0.4977
 epoch: 61, train_loss: 0.8839, test_loss: 0.9818, test_f1: 0.5205
 epoch: 62, train_loss: 0.8716, test_loss: 0.9769, test_f1: 0.5076
 epoch: 63, train_loss: 0.8798, test_loss: 0.9631, test_f1: 0.5172
 epoch: 64, train_loss: 0.8760, test_loss: 0.9871, test_f1: 0.4890
 epoch: 65, train_loss: 0.8640, test_loss: 0.9861, test_f1: 0.5003
 epoch: 66, train_loss: 0.8726, test_loss: 0.9822, test_f1: 0.5091
 epoch: 67, train_loss: 0.8654, test_loss: 0.9673, test_f1: 0.5270
 epoch: 68, train_loss: 0.8554, test_loss: 0.9711, test_f1: 0.5274
 epoch: 69, train_loss: 0.8699, test_loss: 0.9766, test_f1: 0.5238
 epoch: 70, train_loss: 0.8681, test_loss: 0.9840, test_f1: 0.5225
 epoch: 71, train_loss: 0.8614, test_loss: 0.9909, test_f1: 0.5160
 epoch: 72, train_loss: 0.8638, test_loss: 0.9991, test_f1: 0.5068
 epoch: 73, train_loss: 0.8518, test_loss: 0.9969, test_f1: 0.5231
 epoch: 74, train_loss: 0.8502, test_loss: 0.9885, test_f1: 0.5054
 epoch: 75, train_loss: 0.8635, test_loss: 0.9838, test_f1: 0.5198
 epoch: 76, train_loss: 0.8513, test_loss: 1.0018, test_f1: 0.5105
 epoch: 77, train_loss: 0.8485, test_loss: 0.9900, test_f1: 0.5109
 epoch: 78, train_loss: 0.8452, test_loss: 0.9932, test_f1: 0.5191
 epoch: 79, train_loss: 0.8409, test_loss: 0.9979, test_f1: 0.5329
 epoch: 80, train_loss: 0.8402, test_loss: 1.0232, test_f1: 0.5081
 epoch: 81, train_loss: 0.8405, test_loss: 1.0175, test_f1: 0.4978
 epoch: 82, train_loss: 0.8475, test_loss: 0.9952, test_f1: 0.5209
 epoch: 83, train_loss: 0.8411, test_loss: 0.9839, test_f1: 0.5208
 epoch: 84, train_loss: 0.8429, test_loss: 0.9882, test_f1: 0.5306
 epoch: 85, train_loss: 0.8435, test_loss: 0.9848, test_f1: 0.5290
 epoch: 86, train_loss: 0.8319, test_loss: 1.0031, test_f1: 0.5207
 epoch: 87, train_loss: 0.8274, test_loss: 1.0034, test_f1: 0.5069
 epoch: 88, train_loss: 0.8445, test_loss: 0.9993, test_f1: 0.5216
 epoch: 89, train_loss: 0.8310, test_loss: 1.0106, test_f1: 0.5009
 epoch: 90, train_loss: 0.8281, test_loss: 1.0049, test_f1: 0.5104
 epoch: 91, train_loss: 0.8308, test_loss: 1.0143, test_f1: 0.4995
 epoch: 92, train_loss: 0.8224, test_loss: 1.0074, test_f1: 0.5034
 epoch: 93, train_loss: 0.8117, test_loss: 0.9936, test_f1: 0.5179
 epoch: 94, train_loss: 0.8208, test_loss: 1.0020, test_f1: 0.5057
 epoch: 95, train_loss: 0.8120, test_loss: 1.0239, test_f1: 0.5024
 epoch: 96, train_loss: 0.8101, test_loss: 1.0048, test_f1: 0.5053
 epoch: 97, train_loss: 0.8127, test_loss: 1.0063, test_f1: 0.5059
 epoch: 98, train_loss: 0.8127, test_loss: 1.0159, test_f1: 0.5104
 epoch: 99, train_loss: 0.8069, test_loss: 0.9957, test_f1: 0.5373
##################ITERATION #7 ****************************************
 epoch: 0, train_loss: 1.3226, test_loss: 1.2552, test_f1: 0.2736
 epoch: 1, train_loss: 1.2509, test_loss: 1.2229, test_f1: 0.3739
 epoch: 2, train_loss: 1.2348, test_loss: 1.2096, test_f1: 0.3785
 epoch: 3, train_loss: 1.2183, test_loss: 1.1957, test_f1: 0.3580
 epoch: 4, train_loss: 1.2050, test_loss: 1.1900, test_f1: 0.3599
 epoch: 5, train_loss: 1.1883, test_loss: 1.1728, test_f1: 0.3805
 epoch: 6, train_loss: 1.1887, test_loss: 1.1596, test_f1: 0.3992
 epoch: 7, train_loss: 1.1819, test_loss: 1.1627, test_f1: 0.3922
 epoch: 8, train_loss: 1.1834, test_loss: 1.1540, test_f1: 0.4006
 epoch: 9, train_loss: 1.1621, test_loss: 1.1534, test_f1: 0.3957
 epoch: 10, train_loss: 1.1567, test_loss: 1.1424, test_f1: 0.4006
 epoch: 11, train_loss: 1.1533, test_loss: 1.1312, test_f1: 0.4177
 epoch: 12, train_loss: 1.1532, test_loss: 1.1291, test_f1: 0.4071
 epoch: 13, train_loss: 1.1424, test_loss: 1.1300, test_f1: 0.4107
 epoch: 14, train_loss: 1.1336, test_loss: 1.1304, test_f1: 0.4098
 epoch: 15, train_loss: 1.1347, test_loss: 1.1226, test_f1: 0.4063
 epoch: 16, train_loss: 1.1227, test_loss: 1.1299, test_f1: 0.4097
 epoch: 17, train_loss: 1.1267, test_loss: 1.1240, test_f1: 0.4098
 epoch: 18, train_loss: 1.1211, test_loss: 1.1257, test_f1: 0.4025
 epoch: 19, train_loss: 1.1139, test_loss: 1.1130, test_f1: 0.4177
 epoch: 20, train_loss: 1.1093, test_loss: 1.1066, test_f1: 0.4222
 epoch: 21, train_loss: 1.1025, test_loss: 1.0924, test_f1: 0.4289
 epoch: 22, train_loss: 1.0969, test_loss: 1.0912, test_f1: 0.4255
 epoch: 23, train_loss: 1.0902, test_loss: 1.0966, test_f1: 0.4248
 epoch: 24, train_loss: 1.0946, test_loss: 1.0943, test_f1: 0.4152
 epoch: 25, train_loss: 1.0861, test_loss: 1.0981, test_f1: 0.4142
 epoch: 26, train_loss: 1.0762, test_loss: 1.0855, test_f1: 0.4241
 epoch: 27, train_loss: 1.0726, test_loss: 1.0876, test_f1: 0.4162
 epoch: 28, train_loss: 1.0713, test_loss: 1.0847, test_f1: 0.4179
 epoch: 29, train_loss: 1.0647, test_loss: 1.0806, test_f1: 0.4217
 epoch: 30, train_loss: 1.0677, test_loss: 1.0809, test_f1: 0.4275
 epoch: 31, train_loss: 1.0620, test_loss: 1.0738, test_f1: 0.4292
 epoch: 32, train_loss: 1.0529, test_loss: 1.0822, test_f1: 0.4219
 epoch: 33, train_loss: 1.0406, test_loss: 1.0695, test_f1: 0.4268
 epoch: 34, train_loss: 1.0386, test_loss: 1.0689, test_f1: 0.4302
 epoch: 35, train_loss: 1.0372, test_loss: 1.0705, test_f1: 0.4276
 epoch: 36, train_loss: 1.0357, test_loss: 1.0603, test_f1: 0.4368
 epoch: 37, train_loss: 1.0284, test_loss: 1.0669, test_f1: 0.4297
 epoch: 38, train_loss: 1.0348, test_loss: 1.0605, test_f1: 0.4407
 epoch: 39, train_loss: 1.0197, test_loss: 1.0723, test_f1: 0.4269
 epoch: 40, train_loss: 1.0208, test_loss: 1.0695, test_f1: 0.4329
 epoch: 41, train_loss: 1.0208, test_loss: 1.0658, test_f1: 0.4321
 epoch: 42, train_loss: 0.9954, test_loss: 1.0693, test_f1: 0.4368
 epoch: 43, train_loss: 1.0161, test_loss: 1.0626, test_f1: 0.4423
 epoch: 44, train_loss: 1.0076, test_loss: 1.0676, test_f1: 0.4428
 epoch: 45, train_loss: 0.9898, test_loss: 1.0515, test_f1: 0.4391
 epoch: 46, train_loss: 1.0042, test_loss: 1.0520, test_f1: 0.4444
 epoch: 47, train_loss: 0.9921, test_loss: 1.0534, test_f1: 0.4375
 epoch: 48, train_loss: 0.9839, test_loss: 1.0437, test_f1: 0.4411
 epoch: 49, train_loss: 0.9852, test_loss: 1.0491, test_f1: 0.4495
 epoch: 50, train_loss: 0.9834, test_loss: 1.0588, test_f1: 0.4412
 epoch: 51, train_loss: 0.9711, test_loss: 1.0545, test_f1: 0.4437
 epoch: 52, train_loss: 0.9745, test_loss: 1.0606, test_f1: 0.4375
 epoch: 53, train_loss: 0.9793, test_loss: 1.0622, test_f1: 0.4474
 epoch: 54, train_loss: 0.9645, test_loss: 1.0518, test_f1: 0.4541
 epoch: 55, train_loss: 0.9576, test_loss: 1.0612, test_f1: 0.4361
 epoch: 56, train_loss: 0.9521, test_loss: 1.0486, test_f1: 0.4436
 epoch: 57, train_loss: 0.9650, test_loss: 1.0534, test_f1: 0.4468
 epoch: 58, train_loss: 0.9528, test_loss: 1.0641, test_f1: 0.4381
 epoch: 59, train_loss: 0.9579, test_loss: 1.0614, test_f1: 0.4404
 epoch: 60, train_loss: 0.9506, test_loss: 1.0588, test_f1: 0.4380
 epoch: 61, train_loss: 0.9439, test_loss: 1.0594, test_f1: 0.4490
 epoch: 62, train_loss: 0.9506, test_loss: 1.0729, test_f1: 0.4418
 epoch: 63, train_loss: 0.9411, test_loss: 1.0592, test_f1: 0.4494
 epoch: 64, train_loss: 0.9451, test_loss: 1.0609, test_f1: 0.4499
 epoch: 65, train_loss: 0.9392, test_loss: 1.0649, test_f1: 0.4442
 epoch: 66, train_loss: 0.9395, test_loss: 1.0793, test_f1: 0.4443
 epoch: 67, train_loss: 0.9418, test_loss: 1.0534, test_f1: 0.4499
 epoch: 68, train_loss: 0.9374, test_loss: 1.0660, test_f1: 0.4519
 epoch: 69, train_loss: 0.9398, test_loss: 1.0610, test_f1: 0.4533
 epoch: 70, train_loss: 0.9319, test_loss: 1.0742, test_f1: 0.4540
 epoch: 71, train_loss: 0.9308, test_loss: 1.0710, test_f1: 0.4453
 epoch: 72, train_loss: 0.9281, test_loss: 1.0777, test_f1: 0.4420
 epoch: 73, train_loss: 0.9122, test_loss: 1.0663, test_f1: 0.4491
 epoch: 74, train_loss: 0.9218, test_loss: 1.0904, test_f1: 0.4469
 epoch: 75, train_loss: 0.9011, test_loss: 1.0745, test_f1: 0.4533
 epoch: 76, train_loss: 0.9252, test_loss: 1.0906, test_f1: 0.4381
 epoch: 77, train_loss: 0.9124, test_loss: 1.0713, test_f1: 0.4457
 epoch: 78, train_loss: 0.9197, test_loss: 1.0732, test_f1: 0.4517
 epoch: 79, train_loss: 0.9171, test_loss: 1.0920, test_f1: 0.4527
 epoch: 80, train_loss: 0.9070, test_loss: 1.0898, test_f1: 0.4475
 epoch: 81, train_loss: 0.9061, test_loss: 1.0690, test_f1: 0.4481
 epoch: 82, train_loss: 0.9278, test_loss: 1.0807, test_f1: 0.4521
 epoch: 83, train_loss: 0.9054, test_loss: 1.1436, test_f1: 0.4545
 epoch: 84, train_loss: 0.9148, test_loss: 1.0874, test_f1: 0.4554
 epoch: 85, train_loss: 0.9034, test_loss: 1.0844, test_f1: 0.4447
 epoch: 86, train_loss: 0.9148, test_loss: 1.0862, test_f1: 0.4487
 epoch: 87, train_loss: 0.8983, test_loss: 1.0885, test_f1: 0.4523
 epoch: 88, train_loss: 0.9005, test_loss: 1.0889, test_f1: 0.4473
 epoch: 89, train_loss: 0.9031, test_loss: 1.0938, test_f1: 0.4481
 epoch: 90, train_loss: 0.9048, test_loss: 1.0961, test_f1: 0.4501
 epoch: 91, train_loss: 0.9043, test_loss: 1.0977, test_f1: 0.4526
 epoch: 92, train_loss: 0.9090, test_loss: 1.1085, test_f1: 0.4454
 epoch: 93, train_loss: 0.8956, test_loss: 1.0982, test_f1: 0.4427
 epoch: 94, train_loss: 0.8985, test_loss: 1.0912, test_f1: 0.4495
 epoch: 95, train_loss: 0.8817, test_loss: 1.0909, test_f1: 0.4492
 epoch: 96, train_loss: 0.8928, test_loss: 1.1161, test_f1: 0.4535
 epoch: 97, train_loss: 0.8967, test_loss: 1.0957, test_f1: 0.4557
 epoch: 98, train_loss: 0.8927, test_loss: 1.0946, test_f1: 0.4524
 epoch: 99, train_loss: 0.8871, test_loss: 1.1051, test_f1: 0.4519
##################ITERATION #8 ****************************************
 epoch: 0, train_loss: 1.3452, test_loss: 1.2704, test_f1: 0.2740
 epoch: 1, train_loss: 1.2690, test_loss: 1.2276, test_f1: 0.3425
 epoch: 2, train_loss: 1.2395, test_loss: 1.2124, test_f1: 0.3606
 epoch: 3, train_loss: 1.2336, test_loss: 1.1938, test_f1: 0.3732
 epoch: 4, train_loss: 1.2099, test_loss: 1.1890, test_f1: 0.4191
 epoch: 5, train_loss: 1.2029, test_loss: 1.1738, test_f1: 0.4185
 epoch: 6, train_loss: 1.1846, test_loss: 1.1633, test_f1: 0.4124
 epoch: 7, train_loss: 1.1754, test_loss: 1.1512, test_f1: 0.4266
 epoch: 8, train_loss: 1.1701, test_loss: 1.1419, test_f1: 0.4452
 epoch: 9, train_loss: 1.1617, test_loss: 1.1243, test_f1: 0.4565
 epoch: 10, train_loss: 1.1551, test_loss: 1.1285, test_f1: 0.4476
 epoch: 11, train_loss: 1.1511, test_loss: 1.1146, test_f1: 0.4498
 epoch: 12, train_loss: 1.1388, test_loss: 1.1128, test_f1: 0.4263
 epoch: 13, train_loss: 1.1281, test_loss: 1.1050, test_f1: 0.4357
 epoch: 14, train_loss: 1.1258, test_loss: 1.1083, test_f1: 0.4434
 epoch: 15, train_loss: 1.1284, test_loss: 1.1030, test_f1: 0.4495
 epoch: 16, train_loss: 1.1216, test_loss: 1.1071, test_f1: 0.4519
 epoch: 17, train_loss: 1.1056, test_loss: 1.0960, test_f1: 0.4550
 epoch: 18, train_loss: 1.1003, test_loss: 1.1008, test_f1: 0.4408
 epoch: 19, train_loss: 1.0972, test_loss: 1.0995, test_f1: 0.4470
 epoch: 20, train_loss: 1.1005, test_loss: 1.0948, test_f1: 0.4501
 epoch: 21, train_loss: 1.0792, test_loss: 1.0825, test_f1: 0.4527
 epoch: 22, train_loss: 1.0900, test_loss: 1.0867, test_f1: 0.4467
 epoch: 23, train_loss: 1.0666, test_loss: 1.0770, test_f1: 0.4397
 epoch: 24, train_loss: 1.0718, test_loss: 1.0844, test_f1: 0.4440
 epoch: 25, train_loss: 1.0663, test_loss: 1.0812, test_f1: 0.4393
 epoch: 26, train_loss: 1.0590, test_loss: 1.0731, test_f1: 0.4426
 epoch: 27, train_loss: 1.0504, test_loss: 1.0689, test_f1: 0.4489
 epoch: 28, train_loss: 1.0531, test_loss: 1.0656, test_f1: 0.4524
 epoch: 29, train_loss: 1.0517, test_loss: 1.0783, test_f1: 0.4336
 epoch: 30, train_loss: 1.0424, test_loss: 1.0613, test_f1: 0.4623
 epoch: 31, train_loss: 1.0425, test_loss: 1.0786, test_f1: 0.4374
 epoch: 32, train_loss: 1.0342, test_loss: 1.0621, test_f1: 0.4483
 epoch: 33, train_loss: 1.0326, test_loss: 1.0644, test_f1: 0.4387
 epoch: 34, train_loss: 1.0195, test_loss: 1.0551, test_f1: 0.4487
 epoch: 35, train_loss: 1.0086, test_loss: 1.0666, test_f1: 0.4550
 epoch: 36, train_loss: 1.0099, test_loss: 1.0622, test_f1: 0.4578
 epoch: 37, train_loss: 1.0299, test_loss: 1.0712, test_f1: 0.4330
 epoch: 38, train_loss: 1.0144, test_loss: 1.0643, test_f1: 0.4572
 epoch: 39, train_loss: 1.0081, test_loss: 1.0721, test_f1: 0.4490
 epoch: 40, train_loss: 1.0243, test_loss: 1.0805, test_f1: 0.4473
 epoch: 41, train_loss: 1.0015, test_loss: 1.0553, test_f1: 0.4528
 epoch: 42, train_loss: 1.0042, test_loss: 1.0782, test_f1: 0.4681
 epoch: 43, train_loss: 0.9868, test_loss: 1.0630, test_f1: 0.4584
 epoch: 44, train_loss: 0.9834, test_loss: 1.0715, test_f1: 0.4526
 epoch: 45, train_loss: 0.9904, test_loss: 1.0458, test_f1: 0.4643
 epoch: 46, train_loss: 0.9860, test_loss: 1.0885, test_f1: 0.4758
 epoch: 47, train_loss: 0.9824, test_loss: 1.0604, test_f1: 0.4750
 epoch: 48, train_loss: 0.9784, test_loss: 1.0697, test_f1: 0.4598
 epoch: 49, train_loss: 0.9664, test_loss: 1.0633, test_f1: 0.4829
 epoch: 50, train_loss: 0.9616, test_loss: 1.0703, test_f1: 0.4536
 epoch: 51, train_loss: 0.9656, test_loss: 1.0756, test_f1: 0.4496
 epoch: 52, train_loss: 0.9530, test_loss: 1.0627, test_f1: 0.4654
 epoch: 53, train_loss: 0.9550, test_loss: 1.0602, test_f1: 0.4516
 epoch: 54, train_loss: 0.9580, test_loss: 1.0540, test_f1: 0.4619
 epoch: 55, train_loss: 0.9495, test_loss: 1.0637, test_f1: 0.4862
 epoch: 56, train_loss: 0.9571, test_loss: 1.0780, test_f1: 0.4709
 epoch: 57, train_loss: 0.9397, test_loss: 1.0541, test_f1: 0.4544
 epoch: 58, train_loss: 0.9334, test_loss: 1.0741, test_f1: 0.4656
 epoch: 59, train_loss: 0.9449, test_loss: 1.0824, test_f1: 0.4864
 epoch: 60, train_loss: 0.9449, test_loss: 1.0704, test_f1: 0.4747
 epoch: 61, train_loss: 0.9322, test_loss: 1.0828, test_f1: 0.4610
 epoch: 62, train_loss: 0.9391, test_loss: 1.0749, test_f1: 0.4849
 epoch: 63, train_loss: 0.9261, test_loss: 1.0638, test_f1: 0.4803
 epoch: 64, train_loss: 0.9410, test_loss: 1.0794, test_f1: 0.4781
 epoch: 65, train_loss: 0.9356, test_loss: 1.0694, test_f1: 0.4974
 epoch: 66, train_loss: 0.9266, test_loss: 1.1005, test_f1: 0.4743
 epoch: 67, train_loss: 0.9247, test_loss: 1.0504, test_f1: 0.4851
 epoch: 68, train_loss: 0.9307, test_loss: 1.0580, test_f1: 0.4785
 epoch: 69, train_loss: 0.9200, test_loss: 1.0873, test_f1: 0.4806
 epoch: 70, train_loss: 0.9199, test_loss: 1.0591, test_f1: 0.4863
 epoch: 71, train_loss: 0.9305, test_loss: 1.0833, test_f1: 0.4853
 epoch: 72, train_loss: 0.9225, test_loss: 1.0494, test_f1: 0.4759
 epoch: 73, train_loss: 0.9153, test_loss: 1.0673, test_f1: 0.4679
 epoch: 74, train_loss: 0.9149, test_loss: 1.0790, test_f1: 0.4929
 epoch: 75, train_loss: 0.9142, test_loss: 1.0790, test_f1: 0.4886
 epoch: 76, train_loss: 0.9015, test_loss: 1.0698, test_f1: 0.4669
 epoch: 77, train_loss: 0.9045, test_loss: 1.0909, test_f1: 0.4746
 epoch: 78, train_loss: 0.9141, test_loss: 1.0939, test_f1: 0.4689
 epoch: 79, train_loss: 0.9147, test_loss: 1.0960, test_f1: 0.4587
 epoch: 80, train_loss: 0.9075, test_loss: 1.0762, test_f1: 0.4677
 epoch: 81, train_loss: 0.8993, test_loss: 1.0910, test_f1: 0.4715
 epoch: 82, train_loss: 0.9104, test_loss: 1.0854, test_f1: 0.4562
 epoch: 83, train_loss: 0.9097, test_loss: 1.0816, test_f1: 0.4609
 epoch: 84, train_loss: 0.8968, test_loss: 1.0507, test_f1: 0.4680
 epoch: 85, train_loss: 0.8818, test_loss: 1.0734, test_f1: 0.4625
 epoch: 86, train_loss: 0.8950, test_loss: 1.0940, test_f1: 0.4751
 epoch: 87, train_loss: 0.8919, test_loss: 1.0779, test_f1: 0.4649
 epoch: 88, train_loss: 0.8972, test_loss: 1.0860, test_f1: 0.4500
 epoch: 89, train_loss: 0.8843, test_loss: 1.0819, test_f1: 0.4755
 epoch: 90, train_loss: 0.8983, test_loss: 1.0746, test_f1: 0.4731
 epoch: 91, train_loss: 0.8803, test_loss: 1.0879, test_f1: 0.4707
 epoch: 92, train_loss: 0.8839, test_loss: 1.0529, test_f1: 0.5026
 epoch: 93, train_loss: 0.8991, test_loss: 1.0656, test_f1: 0.4809
 epoch: 94, train_loss: 0.8911, test_loss: 1.0562, test_f1: 0.4737
 epoch: 95, train_loss: 0.8788, test_loss: 1.0894, test_f1: 0.4730
 epoch: 96, train_loss: 0.8919, test_loss: 1.1072, test_f1: 0.4555
 epoch: 97, train_loss: 0.8881, test_loss: 1.0911, test_f1: 0.4602
 epoch: 98, train_loss: 0.8693, test_loss: 1.1025, test_f1: 0.4662
 epoch: 99, train_loss: 0.8796, test_loss: 1.1081, test_f1: 0.4798
##################ITERATION #9 ****************************************
 epoch: 0, train_loss: 1.3227, test_loss: 1.2437, test_f1: 0.4036
 epoch: 1, train_loss: 1.2471, test_loss: 1.1958, test_f1: 0.4159
 epoch: 2, train_loss: 1.2232, test_loss: 1.1726, test_f1: 0.4290
 epoch: 3, train_loss: 1.2015, test_loss: 1.1524, test_f1: 0.4315
 epoch: 4, train_loss: 1.1851, test_loss: 1.1434, test_f1: 0.4427
 epoch: 5, train_loss: 1.1869, test_loss: 1.1296, test_f1: 0.4490
 epoch: 6, train_loss: 1.1642, test_loss: 1.1201, test_f1: 0.4653
 epoch: 7, train_loss: 1.1597, test_loss: 1.0932, test_f1: 0.4657
 epoch: 8, train_loss: 1.1515, test_loss: 1.0867, test_f1: 0.4709
 epoch: 9, train_loss: 1.1281, test_loss: 1.0719, test_f1: 0.4624
 epoch: 10, train_loss: 1.1290, test_loss: 1.0719, test_f1: 0.4645
 epoch: 11, train_loss: 1.1298, test_loss: 1.0606, test_f1: 0.4735
 epoch: 12, train_loss: 1.0967, test_loss: 1.0514, test_f1: 0.4766
 epoch: 13, train_loss: 1.0932, test_loss: 1.0352, test_f1: 0.4790
 epoch: 14, train_loss: 1.0843, test_loss: 1.0296, test_f1: 0.4869
 epoch: 15, train_loss: 1.0816, test_loss: 1.0218, test_f1: 0.4890
 epoch: 16, train_loss: 1.0740, test_loss: 1.0118, test_f1: 0.4798
 epoch: 17, train_loss: 1.0717, test_loss: 1.0062, test_f1: 0.4714
 epoch: 18, train_loss: 1.0688, test_loss: 0.9926, test_f1: 0.4636
 epoch: 19, train_loss: 1.0509, test_loss: 1.0018, test_f1: 0.4667
 epoch: 20, train_loss: 1.0549, test_loss: 0.9943, test_f1: 0.4601
 epoch: 21, train_loss: 1.0496, test_loss: 0.9901, test_f1: 0.4493
 epoch: 22, train_loss: 1.0368, test_loss: 0.9870, test_f1: 0.4800
 epoch: 23, train_loss: 1.0387, test_loss: 0.9850, test_f1: 0.4715
 epoch: 24, train_loss: 1.0191, test_loss: 0.9714, test_f1: 0.4662
 epoch: 25, train_loss: 1.0301, test_loss: 0.9707, test_f1: 0.4745
 epoch: 26, train_loss: 1.0202, test_loss: 0.9809, test_f1: 0.4672
 epoch: 27, train_loss: 1.0212, test_loss: 0.9824, test_f1: 0.4632
 epoch: 28, train_loss: 1.0014, test_loss: 0.9769, test_f1: 0.4757
 epoch: 29, train_loss: 1.0019, test_loss: 0.9647, test_f1: 0.4823
 epoch: 30, train_loss: 1.0088, test_loss: 0.9894, test_f1: 0.4560
 epoch: 31, train_loss: 0.9921, test_loss: 0.9863, test_f1: 0.4542
 epoch: 32, train_loss: 0.9921, test_loss: 0.9642, test_f1: 0.4592
 epoch: 33, train_loss: 0.9979, test_loss: 0.9762, test_f1: 0.4621
 epoch: 34, train_loss: 0.9808, test_loss: 0.9834, test_f1: 0.4440
 epoch: 35, train_loss: 0.9869, test_loss: 0.9791, test_f1: 0.4622
 epoch: 36, train_loss: 0.9771, test_loss: 0.9718, test_f1: 0.4661
 epoch: 37, train_loss: 0.9654, test_loss: 0.9736, test_f1: 0.4687
 epoch: 38, train_loss: 0.9671, test_loss: 0.9821, test_f1: 0.4543
 epoch: 39, train_loss: 0.9686, test_loss: 0.9735, test_f1: 0.4711
 epoch: 40, train_loss: 0.9572, test_loss: 0.9903, test_f1: 0.4599
 epoch: 41, train_loss: 0.9554, test_loss: 0.9778, test_f1: 0.4673
 epoch: 42, train_loss: 0.9513, test_loss: 0.9728, test_f1: 0.4800
 epoch: 43, train_loss: 0.9520, test_loss: 0.9777, test_f1: 0.4697
 epoch: 44, train_loss: 0.9656, test_loss: 0.9883, test_f1: 0.4642
 epoch: 45, train_loss: 0.9400, test_loss: 0.9579, test_f1: 0.4806
 epoch: 46, train_loss: 0.9437, test_loss: 0.9723, test_f1: 0.4613
 epoch: 47, train_loss: 0.9465, test_loss: 0.9890, test_f1: 0.4580
 epoch: 48, train_loss: 0.9409, test_loss: 0.9937, test_f1: 0.4655
 epoch: 49, train_loss: 0.9280, test_loss: 1.0077, test_f1: 0.4629
 epoch: 50, train_loss: 0.9253, test_loss: 1.0051, test_f1: 0.4718
 epoch: 51, train_loss: 0.9185, test_loss: 0.9910, test_f1: 0.4737
 epoch: 52, train_loss: 0.9268, test_loss: 0.9903, test_f1: 0.4724
 epoch: 53, train_loss: 0.9179, test_loss: 0.9730, test_f1: 0.4813
 epoch: 54, train_loss: 0.9290, test_loss: 0.9867, test_f1: 0.4928
 epoch: 55, train_loss: 0.9138, test_loss: 0.9925, test_f1: 0.4767
 epoch: 56, train_loss: 0.9128, test_loss: 0.9934, test_f1: 0.4858
 epoch: 57, train_loss: 0.9076, test_loss: 0.9897, test_f1: 0.4859
 epoch: 58, train_loss: 0.9056, test_loss: 0.9932, test_f1: 0.4781
 epoch: 59, train_loss: 0.8998, test_loss: 0.9958, test_f1: 0.4607
 epoch: 60, train_loss: 0.8931, test_loss: 0.9903, test_f1: 0.4802
 epoch: 61, train_loss: 0.9027, test_loss: 0.9986, test_f1: 0.4840
 epoch: 62, train_loss: 0.8905, test_loss: 0.9858, test_f1: 0.4924
 epoch: 63, train_loss: 0.8984, test_loss: 0.9892, test_f1: 0.4853
 epoch: 64, train_loss: 0.8994, test_loss: 0.9981, test_f1: 0.4817
 epoch: 65, train_loss: 0.8920, test_loss: 0.9913, test_f1: 0.4854
 epoch: 66, train_loss: 0.8919, test_loss: 0.9936, test_f1: 0.4775
 epoch: 67, train_loss: 0.8903, test_loss: 0.9955, test_f1: 0.4762
 epoch: 68, train_loss: 0.8906, test_loss: 1.0128, test_f1: 0.4841
 epoch: 69, train_loss: 0.8841, test_loss: 0.9987, test_f1: 0.4888
 epoch: 70, train_loss: 0.8762, test_loss: 1.0076, test_f1: 0.4872
 epoch: 71, train_loss: 0.8853, test_loss: 1.0068, test_f1: 0.4952
 epoch: 72, train_loss: 0.8835, test_loss: 1.0020, test_f1: 0.4837
 epoch: 73, train_loss: 0.8836, test_loss: 1.0076, test_f1: 0.4955
 epoch: 74, train_loss: 0.8753, test_loss: 1.0093, test_f1: 0.4851
 epoch: 75, train_loss: 0.8779, test_loss: 1.0072, test_f1: 0.4872
 epoch: 76, train_loss: 0.8725, test_loss: 1.0052, test_f1: 0.4901
 epoch: 77, train_loss: 0.8663, test_loss: 1.0131, test_f1: 0.4836
 epoch: 78, train_loss: 0.8645, test_loss: 1.0117, test_f1: 0.4977
 epoch: 79, train_loss: 0.8593, test_loss: 1.0070, test_f1: 0.4985
 epoch: 80, train_loss: 0.8689, test_loss: 1.0138, test_f1: 0.4911
 epoch: 81, train_loss: 0.8805, test_loss: 1.0147, test_f1: 0.4852
 epoch: 82, train_loss: 0.8654, test_loss: 1.0196, test_f1: 0.4890
 epoch: 83, train_loss: 0.8639, test_loss: 1.0249, test_f1: 0.4900
 epoch: 84, train_loss: 0.8489, test_loss: 1.0194, test_f1: 0.4800
 epoch: 85, train_loss: 0.8606, test_loss: 1.0249, test_f1: 0.4899
 epoch: 86, train_loss: 0.8580, test_loss: 1.0154, test_f1: 0.4957
 epoch: 87, train_loss: 0.8585, test_loss: 1.0294, test_f1: 0.5007
 epoch: 88, train_loss: 0.8660, test_loss: 1.0189, test_f1: 0.5010
 epoch: 89, train_loss: 0.8534, test_loss: 1.0250, test_f1: 0.4981
 epoch: 90, train_loss: 0.8542, test_loss: 1.0219, test_f1: 0.5008
 epoch: 91, train_loss: 0.8628, test_loss: 1.0186, test_f1: 0.4927
 epoch: 92, train_loss: 0.8527, test_loss: 1.0217, test_f1: 0.4930
 epoch: 93, train_loss: 0.8391, test_loss: 1.0236, test_f1: 0.4918
 epoch: 94, train_loss: 0.8601, test_loss: 1.0242, test_f1: 0.4992
 epoch: 95, train_loss: 0.8544, test_loss: 1.0263, test_f1: 0.4872
 epoch: 96, train_loss: 0.8518, test_loss: 1.0221, test_f1: 0.5095
 epoch: 97, train_loss: 0.8494, test_loss: 1.0229, test_f1: 0.5072
 epoch: 98, train_loss: 0.8341, test_loss: 1.0246, test_f1: 0.4938
 epoch: 99, train_loss: 0.8441, test_loss: 1.0342, test_f1: 0.4953

Training completed in 843.51 seconds
Best F1: 0.5547 at epoch 79
Mean F1 across iterations: 0.5148  0.0255
========================FINAL RESULTS================================
FEGIN weighted F1: 0.5547  0.0255
python main.py --data ltspice_examples --representation component_component --model FEGIN --layers 4 --hiddens 64 --batch_size 64 --lr 0.0001 --emb_size 250 --epochs 100 --save_appendix component_component_L4_H64_BS64_LR0.0001_E250 --no_val
-----



STDERR:
  File "main.py", line 370, in <module>
    main()
  File "main.py", line 254, in main
    dataset = dataset_class(
  File "/home/philip/projects/llm_inference_code_repo/Circuit-Completion-Using-GNNs/component_classification_with_link_prediction_head/evaluation/FEGIN/kernel/circuit_datasets.py", line 15, in __init__
    self.data, self.slices = torch.load(self.processed_paths[0])
  File "/home/philip/.local/lib/python3.8/site-packages/torch/serialization.py", line 1040, in load
    warnings.warn(
  File "/usr/lib/python3.8/warnings.py", line 109, in _showwarnmsg
    sw(msg.message, msg.category, msg.filename, msg.lineno,
  File "main.py", line 47, in warn_with_traceback
    traceback.print_stack(file=log)
/home/philip/projects/llm_inference_code_repo/Circuit-Completion-Using-GNNs/component_classification_with_link_prediction_head/evaluation/FEGIN/kernel/circuit_datasets.py:15: FutureWarning: You are using `torch.load` with `weights_only=False` (the current default value), which uses the default pickle module implicitly. It is possible to construct malicious pickle data which will execute arbitrary code during unpickling (See https://github.com/pytorch/pytorch/blob/main/SECURITY.md#untrusted-models for more details). In a future release, the default value for `weights_only` will be flipped to `True`. This limits the functions that could be executed during unpickling. Arbitrary objects will no longer be allowed to be loaded via this mode unless they are explicitly allowlisted by the user via `torch.serialization.add_safe_globals`. We recommend you start setting `weights_only=True` for any use case where you don't have full control of the loaded file. Please open an issue on GitHub for any issues related to this experimental feature.
  self.data, self.slices = torch.load(self.processed_paths[0])
