STDOUT:
Results will be saved in /home/philip/projects/ltspice_examples_code_repo/Circuit-Completion-Using-GNNs/component_classification_with_link_prediction_head/evaluation/FEGIN/results/model_FEGIN_dataset_ltspice_examples
Command line input: python main.py --data ltspice_examples --representation component_pin_net --model FEGIN --layers 3 --hiddens 32 --batch_size 64 --lr 0.01 --emb_size 512 --epochs 100 --save_appendix component_pin_net_L3_H32_BS64_LR0.01_E512 --no_val
 is saved.
-----
ltspice_examples - FEGIN
Using 3 layers, 32 hidden units, h = 2
Loading component_pin_net representation dataset
ENTERED
Training FEGIN on component_pin_net representation
Train: 3558, Test: 846
##################ITERATION #0 ****************************************
 epoch: 0, train_loss: 1.1918, test_loss: 1.2622, test_f1: 0.4053
 epoch: 1, train_loss: 1.0204, test_loss: 1.1276, test_f1: 0.4371
 epoch: 2, train_loss: 1.0034, test_loss: 0.9959, test_f1: 0.4839
 epoch: 3, train_loss: 0.9607, test_loss: 1.1350, test_f1: 0.3717
 epoch: 4, train_loss: 0.9595, test_loss: 1.0084, test_f1: 0.5012
 epoch: 5, train_loss: 0.9487, test_loss: 1.0195, test_f1: 0.4918
 epoch: 6, train_loss: 0.9277, test_loss: 0.9571, test_f1: 0.5382
 epoch: 7, train_loss: 0.9182, test_loss: 0.9967, test_f1: 0.5449
 epoch: 8, train_loss: 0.9154, test_loss: 0.9079, test_f1: 0.5393
 epoch: 9, train_loss: 0.8792, test_loss: 0.9300, test_f1: 0.5118
 epoch: 10, train_loss: 0.8972, test_loss: 0.9611, test_f1: 0.5216
 epoch: 11, train_loss: 0.8762, test_loss: 0.9452, test_f1: 0.5025
 epoch: 12, train_loss: 0.8654, test_loss: 0.8677, test_f1: 0.5701
 epoch: 13, train_loss: 0.8404, test_loss: 0.8584, test_f1: 0.5774
 epoch: 14, train_loss: 0.8300, test_loss: 0.8952, test_f1: 0.5396
 epoch: 15, train_loss: 0.8351, test_loss: 0.9535, test_f1: 0.5213
 epoch: 16, train_loss: 0.8346, test_loss: 0.9920, test_f1: 0.5093
 epoch: 17, train_loss: 0.8135, test_loss: 0.8599, test_f1: 0.5981
 epoch: 18, train_loss: 0.8014, test_loss: 1.0045, test_f1: 0.5495
 epoch: 19, train_loss: 0.7974, test_loss: 0.9170, test_f1: 0.5553
 epoch: 20, train_loss: 0.8055, test_loss: 1.0325, test_f1: 0.5328
 epoch: 21, train_loss: 0.7896, test_loss: 1.2835, test_f1: 0.4276
 epoch: 22, train_loss: 0.7920, test_loss: 0.9360, test_f1: 0.6153
 epoch: 23, train_loss: 0.7869, test_loss: 0.8980, test_f1: 0.6116
 epoch: 24, train_loss: 0.7787, test_loss: 0.9127, test_f1: 0.5584
 epoch: 25, train_loss: 0.7655, test_loss: 0.9119, test_f1: 0.5826
 epoch: 26, train_loss: 0.7643, test_loss: 1.1163, test_f1: 0.5397
 epoch: 27, train_loss: 0.7583, test_loss: 0.9448, test_f1: 0.6265
 epoch: 28, train_loss: 0.7826, test_loss: 0.9855, test_f1: 0.5562
 epoch: 29, train_loss: 0.7562, test_loss: 0.8680, test_f1: 0.5405
 epoch: 30, train_loss: 0.7457, test_loss: 1.1206, test_f1: 0.5991
 epoch: 31, train_loss: 0.7305, test_loss: 0.9357, test_f1: 0.5600
 epoch: 32, train_loss: 0.7341, test_loss: 1.0270, test_f1: 0.6126
 epoch: 33, train_loss: 0.7478, test_loss: 0.9456, test_f1: 0.5818
 epoch: 34, train_loss: 0.7616, test_loss: 1.0075, test_f1: 0.6128
 epoch: 35, train_loss: 0.7360, test_loss: 0.9152, test_f1: 0.5745
 epoch: 36, train_loss: 0.7122, test_loss: 0.8662, test_f1: 0.6348
 epoch: 37, train_loss: 0.7297, test_loss: 0.8852, test_f1: 0.6061
 epoch: 38, train_loss: 0.7238, test_loss: 0.9413, test_f1: 0.6162
 epoch: 39, train_loss: 0.7167, test_loss: 0.8624, test_f1: 0.6448
 epoch: 40, train_loss: 0.6992, test_loss: 0.8841, test_f1: 0.6322
 epoch: 41, train_loss: 0.7043, test_loss: 0.9405, test_f1: 0.6406
 epoch: 42, train_loss: 0.7108, test_loss: 0.9189, test_f1: 0.6310
 epoch: 43, train_loss: 0.7051, test_loss: 0.9581, test_f1: 0.5850
 epoch: 44, train_loss: 0.7061, test_loss: 0.9857, test_f1: 0.6005
 epoch: 45, train_loss: 0.7159, test_loss: 0.9315, test_f1: 0.6048
 epoch: 46, train_loss: 0.6923, test_loss: 0.9638, test_f1: 0.6595
 epoch: 47, train_loss: 0.7034, test_loss: 1.0490, test_f1: 0.6388
 epoch: 48, train_loss: 0.6996, test_loss: 0.9446, test_f1: 0.6197
 epoch: 49, train_loss: 0.6939, test_loss: 0.9630, test_f1: 0.6082
 epoch: 50, train_loss: 0.6989, test_loss: 0.9490, test_f1: 0.6142
 epoch: 51, train_loss: 0.6654, test_loss: 0.9425, test_f1: 0.6610
 epoch: 52, train_loss: 0.6410, test_loss: 0.9177, test_f1: 0.6487
 epoch: 53, train_loss: 0.6268, test_loss: 0.9024, test_f1: 0.6703
 epoch: 54, train_loss: 0.6407, test_loss: 0.9434, test_f1: 0.6558
 epoch: 55, train_loss: 0.6353, test_loss: 0.9802, test_f1: 0.6363
 epoch: 56, train_loss: 0.6394, test_loss: 1.0065, test_f1: 0.6651
 epoch: 57, train_loss: 0.6351, test_loss: 0.9867, test_f1: 0.6678
 epoch: 58, train_loss: 0.6343, test_loss: 0.9482, test_f1: 0.6647
 epoch: 59, train_loss: 0.6236, test_loss: 0.9451, test_f1: 0.6612
 epoch: 60, train_loss: 0.6151, test_loss: 0.9494, test_f1: 0.6545
 epoch: 61, train_loss: 0.6188, test_loss: 0.9683, test_f1: 0.6591
 epoch: 62, train_loss: 0.6118, test_loss: 1.0698, test_f1: 0.6238
 epoch: 63, train_loss: 0.6098, test_loss: 0.9451, test_f1: 0.6594
 epoch: 64, train_loss: 0.6113, test_loss: 0.9776, test_f1: 0.6817
 epoch: 65, train_loss: 0.6089, test_loss: 1.0047, test_f1: 0.6719
 epoch: 66, train_loss: 0.6155, test_loss: 0.9386, test_f1: 0.6603
 epoch: 67, train_loss: 0.5889, test_loss: 0.9435, test_f1: 0.6860
 epoch: 68, train_loss: 0.5947, test_loss: 1.0770, test_f1: 0.6184
 epoch: 69, train_loss: 0.6041, test_loss: 0.9573, test_f1: 0.6745
 epoch: 70, train_loss: 0.5907, test_loss: 0.9938, test_f1: 0.6506
 epoch: 71, train_loss: 0.5873, test_loss: 0.9834, test_f1: 0.6855
 epoch: 72, train_loss: 0.5964, test_loss: 1.0002, test_f1: 0.6428
 epoch: 73, train_loss: 0.5923, test_loss: 1.0396, test_f1: 0.6599
 epoch: 74, train_loss: 0.5874, test_loss: 1.0800, test_f1: 0.6574
 epoch: 75, train_loss: 0.5878, test_loss: 1.0761, test_f1: 0.6688
 epoch: 76, train_loss: 0.5842, test_loss: 1.0363, test_f1: 0.6528
 epoch: 77, train_loss: 0.5918, test_loss: 1.1086, test_f1: 0.6424
 epoch: 78, train_loss: 0.5632, test_loss: 1.0873, test_f1: 0.6520
 epoch: 79, train_loss: 0.5760, test_loss: 1.0896, test_f1: 0.6815
 epoch: 80, train_loss: 0.5760, test_loss: 1.1542, test_f1: 0.6657
 epoch: 81, train_loss: 0.5917, test_loss: 1.0475, test_f1: 0.6805
 epoch: 82, train_loss: 0.5852, test_loss: 1.1139, test_f1: 0.6513
 epoch: 83, train_loss: 0.5775, test_loss: 1.0630, test_f1: 0.6846
 epoch: 84, train_loss: 0.5679, test_loss: 1.1518, test_f1: 0.6463
 epoch: 85, train_loss: 0.5429, test_loss: 1.1109, test_f1: 0.6721
 epoch: 86, train_loss: 0.5839, test_loss: 1.0674, test_f1: 0.6365
 epoch: 87, train_loss: 0.5764, test_loss: 1.1450, test_f1: 0.6370
 epoch: 88, train_loss: 0.5503, test_loss: 1.1860, test_f1: 0.6504
 epoch: 89, train_loss: 0.5527, test_loss: 1.1816, test_f1: 0.6581
 epoch: 90, train_loss: 0.5687, test_loss: 0.9919, test_f1: 0.6545
 epoch: 91, train_loss: 0.5546, test_loss: 1.0930, test_f1: 0.6347
 epoch: 92, train_loss: 0.5609, test_loss: 1.0403, test_f1: 0.6549
 epoch: 93, train_loss: 0.5558, test_loss: 1.1729, test_f1: 0.6451
 epoch: 94, train_loss: 0.5448, test_loss: 1.1541, test_f1: 0.6455
 epoch: 95, train_loss: 0.5567, test_loss: 1.0927, test_f1: 0.6717
 epoch: 96, train_loss: 0.5533, test_loss: 1.1514, test_f1: 0.6337
 epoch: 97, train_loss: 0.5382, test_loss: 1.1071, test_f1: 0.6427
 epoch: 98, train_loss: 0.5575, test_loss: 1.2303, test_f1: 0.6419
 epoch: 99, train_loss: 0.5666, test_loss: 1.1177, test_f1: 0.6497
##################ITERATION #1 ****************************************
 epoch: 0, train_loss: 1.0988, test_loss: 1.1153, test_f1: 0.4057
 epoch: 1, train_loss: 1.0031, test_loss: 1.0387, test_f1: 0.4520
 epoch: 2, train_loss: 0.9595, test_loss: 1.0069, test_f1: 0.4745
 epoch: 3, train_loss: 0.9520, test_loss: 0.9552, test_f1: 0.4888
 epoch: 4, train_loss: 0.9440, test_loss: 0.9855, test_f1: 0.4938
 epoch: 5, train_loss: 0.9202, test_loss: 0.8947, test_f1: 0.5215
 epoch: 6, train_loss: 0.8994, test_loss: 0.9198, test_f1: 0.4985
 epoch: 7, train_loss: 0.8872, test_loss: 0.8460, test_f1: 0.5700
 epoch: 8, train_loss: 0.8734, test_loss: 0.9174, test_f1: 0.5466
 epoch: 9, train_loss: 0.8605, test_loss: 0.8826, test_f1: 0.5737
 epoch: 10, train_loss: 0.8617, test_loss: 0.8937, test_f1: 0.5016
 epoch: 11, train_loss: 0.8239, test_loss: 0.9106, test_f1: 0.5366
 epoch: 12, train_loss: 0.8378, test_loss: 0.9821, test_f1: 0.5216
 epoch: 13, train_loss: 0.8220, test_loss: 0.8221, test_f1: 0.5426
 epoch: 14, train_loss: 0.8255, test_loss: 0.9193, test_f1: 0.5610
 epoch: 15, train_loss: 0.8068, test_loss: 0.8299, test_f1: 0.5537
 epoch: 16, train_loss: 0.8077, test_loss: 0.8050, test_f1: 0.5791
 epoch: 17, train_loss: 0.8100, test_loss: 0.8835, test_f1: 0.5461
 epoch: 18, train_loss: 0.8077, test_loss: 0.9197, test_f1: 0.5203
 epoch: 19, train_loss: 0.7949, test_loss: 0.8581, test_f1: 0.5808
 epoch: 20, train_loss: 0.7921, test_loss: 0.9345, test_f1: 0.5834
 epoch: 21, train_loss: 0.7789, test_loss: 0.8393, test_f1: 0.5322
 epoch: 22, train_loss: 0.7848, test_loss: 0.8137, test_f1: 0.5508
 epoch: 23, train_loss: 0.7816, test_loss: 0.9492, test_f1: 0.5701
 epoch: 24, train_loss: 0.7723, test_loss: 0.8321, test_f1: 0.5861
 epoch: 25, train_loss: 0.7648, test_loss: 0.8871, test_f1: 0.6131
 epoch: 26, train_loss: 0.7827, test_loss: 0.8199, test_f1: 0.6234
 epoch: 27, train_loss: 0.7422, test_loss: 0.8403, test_f1: 0.6134
 epoch: 28, train_loss: 0.7479, test_loss: 0.8085, test_f1: 0.5969
 epoch: 29, train_loss: 0.7549, test_loss: 0.9138, test_f1: 0.5513
 epoch: 30, train_loss: 0.7514, test_loss: 0.9285, test_f1: 0.5594
 epoch: 31, train_loss: 0.7467, test_loss: 1.0201, test_f1: 0.5274
 epoch: 32, train_loss: 0.7461, test_loss: 0.7875, test_f1: 0.6018
 epoch: 33, train_loss: 0.7495, test_loss: 0.7621, test_f1: 0.6409
 epoch: 34, train_loss: 0.7348, test_loss: 0.8146, test_f1: 0.6231
 epoch: 35, train_loss: 0.7342, test_loss: 0.8534, test_f1: 0.5686
 epoch: 36, train_loss: 0.7264, test_loss: 0.8444, test_f1: 0.6125
 epoch: 37, train_loss: 0.7318, test_loss: 0.8443, test_f1: 0.6406
 epoch: 38, train_loss: 0.7296, test_loss: 0.8658, test_f1: 0.6407
 epoch: 39, train_loss: 0.7171, test_loss: 0.8615, test_f1: 0.5865
 epoch: 40, train_loss: 0.7073, test_loss: 0.9316, test_f1: 0.6346
 epoch: 41, train_loss: 0.6947, test_loss: 0.8837, test_f1: 0.5909
 epoch: 42, train_loss: 0.6983, test_loss: 0.8443, test_f1: 0.6412
 epoch: 43, train_loss: 0.7092, test_loss: 0.8142, test_f1: 0.6057
 epoch: 44, train_loss: 0.6993, test_loss: 0.9149, test_f1: 0.6067
 epoch: 45, train_loss: 0.7159, test_loss: 0.8227, test_f1: 0.6458
 epoch: 46, train_loss: 0.6985, test_loss: 0.8651, test_f1: 0.5917
 epoch: 47, train_loss: 0.6745, test_loss: 0.9481, test_f1: 0.6311
 epoch: 48, train_loss: 0.6912, test_loss: 0.9208, test_f1: 0.6320
 epoch: 49, train_loss: 0.6742, test_loss: 0.7909, test_f1: 0.6124
 epoch: 50, train_loss: 0.6906, test_loss: 0.8989, test_f1: 0.6206
 epoch: 51, train_loss: 0.6601, test_loss: 0.7639, test_f1: 0.6426
 epoch: 52, train_loss: 0.6594, test_loss: 0.8911, test_f1: 0.6398
 epoch: 53, train_loss: 0.6423, test_loss: 0.8253, test_f1: 0.6441
 epoch: 54, train_loss: 0.6250, test_loss: 0.8818, test_f1: 0.6357
 epoch: 55, train_loss: 0.6534, test_loss: 0.8968, test_f1: 0.6379
 epoch: 56, train_loss: 0.6293, test_loss: 0.8613, test_f1: 0.6552
 epoch: 57, train_loss: 0.6328, test_loss: 0.9070, test_f1: 0.6353
 epoch: 58, train_loss: 0.6210, test_loss: 0.8341, test_f1: 0.6313
 epoch: 59, train_loss: 0.6282, test_loss: 0.8436, test_f1: 0.6326
 epoch: 60, train_loss: 0.6302, test_loss: 0.9757, test_f1: 0.6289
 epoch: 61, train_loss: 0.6350, test_loss: 0.8711, test_f1: 0.6328
 epoch: 62, train_loss: 0.6122, test_loss: 0.8688, test_f1: 0.6623
 epoch: 63, train_loss: 0.6240, test_loss: 0.8264, test_f1: 0.6364
 epoch: 64, train_loss: 0.5912, test_loss: 0.9641, test_f1: 0.6304
 epoch: 65, train_loss: 0.6090, test_loss: 1.0186, test_f1: 0.6280
 epoch: 66, train_loss: 0.6016, test_loss: 0.9261, test_f1: 0.6405
 epoch: 67, train_loss: 0.6020, test_loss: 0.9860, test_f1: 0.6031
 epoch: 68, train_loss: 0.6140, test_loss: 0.9485, test_f1: 0.6292
 epoch: 69, train_loss: 0.6207, test_loss: 0.9020, test_f1: 0.6054
 epoch: 70, train_loss: 0.5959, test_loss: 0.9897, test_f1: 0.6329
 epoch: 71, train_loss: 0.5704, test_loss: 1.0084, test_f1: 0.6427
 epoch: 72, train_loss: 0.5936, test_loss: 0.9447, test_f1: 0.6546
 epoch: 73, train_loss: 0.5887, test_loss: 0.9563, test_f1: 0.6488
 epoch: 74, train_loss: 0.6136, test_loss: 1.0622, test_f1: 0.6160
 epoch: 75, train_loss: 0.5938, test_loss: 0.9318, test_f1: 0.6395
 epoch: 76, train_loss: 0.5877, test_loss: 0.8723, test_f1: 0.6629
 epoch: 77, train_loss: 0.5870, test_loss: 0.8949, test_f1: 0.6538
 epoch: 78, train_loss: 0.5793, test_loss: 0.9330, test_f1: 0.6324
 epoch: 79, train_loss: 0.5769, test_loss: 0.9124, test_f1: 0.6465
 epoch: 80, train_loss: 0.5866, test_loss: 0.9290, test_f1: 0.6677
 epoch: 81, train_loss: 0.5778, test_loss: 1.0297, test_f1: 0.6462
 epoch: 82, train_loss: 0.5929, test_loss: 0.9210, test_f1: 0.6126
 epoch: 83, train_loss: 0.5710, test_loss: 0.8467, test_f1: 0.6756
 epoch: 84, train_loss: 0.5805, test_loss: 0.9005, test_f1: 0.6357
 epoch: 85, train_loss: 0.5756, test_loss: 0.8892, test_f1: 0.6570
 epoch: 86, train_loss: 0.5621, test_loss: 0.9604, test_f1: 0.6564
 epoch: 87, train_loss: 0.5582, test_loss: 0.9063, test_f1: 0.6490
 epoch: 88, train_loss: 0.5789, test_loss: 0.9717, test_f1: 0.6202
 epoch: 89, train_loss: 0.5450, test_loss: 0.9154, test_f1: 0.6515
 epoch: 90, train_loss: 0.5566, test_loss: 0.9528, test_f1: 0.6391
 epoch: 91, train_loss: 0.5554, test_loss: 0.8820, test_f1: 0.6639
 epoch: 92, train_loss: 0.5665, test_loss: 0.9108, test_f1: 0.6755
 epoch: 93, train_loss: 0.5484, test_loss: 0.9625, test_f1: 0.6483
 epoch: 94, train_loss: 0.5547, test_loss: 0.9527, test_f1: 0.6545
 epoch: 95, train_loss: 0.5517, test_loss: 0.9364, test_f1: 0.6267
 epoch: 96, train_loss: 0.5400, test_loss: 0.9925, test_f1: 0.6357
 epoch: 97, train_loss: 0.5340, test_loss: 0.9688, test_f1: 0.6837
 epoch: 98, train_loss: 0.5503, test_loss: 0.9789, test_f1: 0.6616
 epoch: 99, train_loss: 0.5541, test_loss: 0.8915, test_f1: 0.6458
##################ITERATION #2 ****************************************
 epoch: 0, train_loss: 1.1122, test_loss: 1.3305, test_f1: 0.3758
 epoch: 1, train_loss: 0.9999, test_loss: 1.0680, test_f1: 0.4280
 epoch: 2, train_loss: 0.9637, test_loss: 1.0636, test_f1: 0.4734
 epoch: 3, train_loss: 0.9593, test_loss: 0.9577, test_f1: 0.4788
 epoch: 4, train_loss: 0.9402, test_loss: 0.9464, test_f1: 0.4909
 epoch: 5, train_loss: 0.9328, test_loss: 0.9439, test_f1: 0.5168
 epoch: 6, train_loss: 0.9151, test_loss: 0.9352, test_f1: 0.5140
 epoch: 7, train_loss: 0.9087, test_loss: 0.8847, test_f1: 0.5285
 epoch: 8, train_loss: 0.8940, test_loss: 0.9367, test_f1: 0.5053
 epoch: 9, train_loss: 0.8894, test_loss: 0.8764, test_f1: 0.5562
 epoch: 10, train_loss: 0.8710, test_loss: 0.9623, test_f1: 0.5373
 epoch: 11, train_loss: 0.8639, test_loss: 0.8654, test_f1: 0.5260
 epoch: 12, train_loss: 0.8507, test_loss: 0.8357, test_f1: 0.5359
 epoch: 13, train_loss: 0.8450, test_loss: 0.9177, test_f1: 0.5326
 epoch: 14, train_loss: 0.8407, test_loss: 0.8678, test_f1: 0.5693
 epoch: 15, train_loss: 0.8345, test_loss: 0.9448, test_f1: 0.5427
 epoch: 16, train_loss: 0.8138, test_loss: 0.8538, test_f1: 0.5952
 epoch: 17, train_loss: 0.8023, test_loss: 0.8646, test_f1: 0.5493
 epoch: 18, train_loss: 0.8257, test_loss: 0.8053, test_f1: 0.6167
 epoch: 19, train_loss: 0.8082, test_loss: 0.9729, test_f1: 0.5193
 epoch: 20, train_loss: 0.8072, test_loss: 0.8858, test_f1: 0.5497
 epoch: 21, train_loss: 0.8022, test_loss: 1.0089, test_f1: 0.5430
 epoch: 22, train_loss: 0.7990, test_loss: 0.8710, test_f1: 0.5959
 epoch: 23, train_loss: 0.7910, test_loss: 0.9060, test_f1: 0.5936
 epoch: 24, train_loss: 0.7721, test_loss: 0.8372, test_f1: 0.5970
 epoch: 25, train_loss: 0.7657, test_loss: 0.8919, test_f1: 0.5455
 epoch: 26, train_loss: 0.7915, test_loss: 0.8174, test_f1: 0.5784
 epoch: 27, train_loss: 0.7747, test_loss: 0.9518, test_f1: 0.5758
 epoch: 28, train_loss: 0.7905, test_loss: 0.8824, test_f1: 0.5295
 epoch: 29, train_loss: 0.7715, test_loss: 0.8253, test_f1: 0.6112
 epoch: 30, train_loss: 0.7747, test_loss: 0.9510, test_f1: 0.5255
 epoch: 31, train_loss: 0.7714, test_loss: 0.7581, test_f1: 0.6377
 epoch: 32, train_loss: 0.7597, test_loss: 0.7534, test_f1: 0.6093
 epoch: 33, train_loss: 0.7478, test_loss: 0.8206, test_f1: 0.5928
 epoch: 34, train_loss: 0.7439, test_loss: 0.8498, test_f1: 0.6106
 epoch: 35, train_loss: 0.7365, test_loss: 0.7622, test_f1: 0.6439
 epoch: 36, train_loss: 0.7482, test_loss: 0.8442, test_f1: 0.6160
 epoch: 37, train_loss: 0.7360, test_loss: 0.8587, test_f1: 0.5993
 epoch: 38, train_loss: 0.7461, test_loss: 0.8058, test_f1: 0.6103
 epoch: 39, train_loss: 0.7375, test_loss: 0.8348, test_f1: 0.6438
 epoch: 40, train_loss: 0.7065, test_loss: 0.8334, test_f1: 0.6047
 epoch: 41, train_loss: 0.7211, test_loss: 0.8835, test_f1: 0.5845
 epoch: 42, train_loss: 0.7144, test_loss: 0.9352, test_f1: 0.5834
 epoch: 43, train_loss: 0.7222, test_loss: 0.8612, test_f1: 0.6019
 epoch: 44, train_loss: 0.6977, test_loss: 0.8604, test_f1: 0.6381
 epoch: 45, train_loss: 0.7118, test_loss: 0.8919, test_f1: 0.6373
 epoch: 46, train_loss: 0.7101, test_loss: 0.8272, test_f1: 0.5889
 epoch: 47, train_loss: 0.6958, test_loss: 1.0159, test_f1: 0.5570
 epoch: 48, train_loss: 0.6938, test_loss: 0.8481, test_f1: 0.6438
 epoch: 49, train_loss: 0.7025, test_loss: 0.7569, test_f1: 0.6167
 epoch: 50, train_loss: 0.6690, test_loss: 0.7665, test_f1: 0.6631
 epoch: 51, train_loss: 0.6564, test_loss: 0.8107, test_f1: 0.6240
 epoch: 52, train_loss: 0.6554, test_loss: 0.8400, test_f1: 0.6592
 epoch: 53, train_loss: 0.6391, test_loss: 0.7901, test_f1: 0.6221
 epoch: 54, train_loss: 0.6359, test_loss: 0.8069, test_f1: 0.6256
 epoch: 55, train_loss: 0.6317, test_loss: 0.8660, test_f1: 0.6612
 epoch: 56, train_loss: 0.6349, test_loss: 0.8601, test_f1: 0.6100
 epoch: 57, train_loss: 0.6396, test_loss: 0.9121, test_f1: 0.6517
 epoch: 58, train_loss: 0.6340, test_loss: 0.7834, test_f1: 0.6608
 epoch: 59, train_loss: 0.6372, test_loss: 0.8031, test_f1: 0.6326
 epoch: 60, train_loss: 0.6401, test_loss: 0.8479, test_f1: 0.6523
 epoch: 61, train_loss: 0.6293, test_loss: 0.7821, test_f1: 0.6531
 epoch: 62, train_loss: 0.6421, test_loss: 0.7399, test_f1: 0.6529
 epoch: 63, train_loss: 0.6069, test_loss: 0.8498, test_f1: 0.6409
 epoch: 64, train_loss: 0.6174, test_loss: 0.8672, test_f1: 0.6508
 epoch: 65, train_loss: 0.6271, test_loss: 0.7183, test_f1: 0.6762
 epoch: 66, train_loss: 0.6044, test_loss: 0.7630, test_f1: 0.6510
 epoch: 67, train_loss: 0.6157, test_loss: 0.8922, test_f1: 0.6263
 epoch: 68, train_loss: 0.6222, test_loss: 0.8517, test_f1: 0.6680
 epoch: 69, train_loss: 0.6095, test_loss: 0.8370, test_f1: 0.6522
 epoch: 70, train_loss: 0.6080, test_loss: 0.8326, test_f1: 0.6569
 epoch: 71, train_loss: 0.5926, test_loss: 0.7598, test_f1: 0.6516
 epoch: 72, train_loss: 0.6143, test_loss: 0.8547, test_f1: 0.6472
 epoch: 73, train_loss: 0.5976, test_loss: 0.9485, test_f1: 0.6029
 epoch: 74, train_loss: 0.6056, test_loss: 0.9651, test_f1: 0.6583
 epoch: 75, train_loss: 0.5871, test_loss: 0.8971, test_f1: 0.6756
 epoch: 76, train_loss: 0.5735, test_loss: 0.8780, test_f1: 0.6351
 epoch: 77, train_loss: 0.5993, test_loss: 0.8765, test_f1: 0.6579
 epoch: 78, train_loss: 0.5951, test_loss: 0.7633, test_f1: 0.6538
 epoch: 79, train_loss: 0.6112, test_loss: 0.9372, test_f1: 0.6685
 epoch: 80, train_loss: 0.5924, test_loss: 0.8293, test_f1: 0.6469
 epoch: 81, train_loss: 0.5855, test_loss: 0.8911, test_f1: 0.6365
 epoch: 82, train_loss: 0.5744, test_loss: 0.8184, test_f1: 0.6631
 epoch: 83, train_loss: 0.5856, test_loss: 0.8418, test_f1: 0.6217
 epoch: 84, train_loss: 0.5850, test_loss: 0.7844, test_f1: 0.6551
 epoch: 85, train_loss: 0.5622, test_loss: 0.9297, test_f1: 0.6586
 epoch: 86, train_loss: 0.5744, test_loss: 0.8557, test_f1: 0.6410
 epoch: 87, train_loss: 0.5839, test_loss: 0.8868, test_f1: 0.6540
 epoch: 88, train_loss: 0.5782, test_loss: 0.9047, test_f1: 0.6411
 epoch: 89, train_loss: 0.5718, test_loss: 0.9366, test_f1: 0.6768
 epoch: 90, train_loss: 0.5722, test_loss: 0.9364, test_f1: 0.6537
 epoch: 91, train_loss: 0.5743, test_loss: 0.9163, test_f1: 0.6574
 epoch: 92, train_loss: 0.5809, test_loss: 0.9108, test_f1: 0.6584
 epoch: 93, train_loss: 0.5865, test_loss: 0.9161, test_f1: 0.6495
 epoch: 94, train_loss: 0.5629, test_loss: 0.9525, test_f1: 0.6674
 epoch: 95, train_loss: 0.5508, test_loss: 0.9977, test_f1: 0.6730
 epoch: 96, train_loss: 0.5671, test_loss: 0.9044, test_f1: 0.6784
 epoch: 97, train_loss: 0.5504, test_loss: 1.0667, test_f1: 0.6582
 epoch: 98, train_loss: 0.5557, test_loss: 0.9711, test_f1: 0.6564
 epoch: 99, train_loss: 0.5547, test_loss: 1.0225, test_f1: 0.6602
##################ITERATION #3 ****************************************
 epoch: 0, train_loss: 1.0986, test_loss: 1.0926, test_f1: 0.4558
 epoch: 1, train_loss: 0.9768, test_loss: 0.9873, test_f1: 0.4672
 epoch: 2, train_loss: 0.9474, test_loss: 0.9560, test_f1: 0.5075
 epoch: 3, train_loss: 0.9397, test_loss: 0.9830, test_f1: 0.4727
 epoch: 4, train_loss: 0.9181, test_loss: 1.1455, test_f1: 0.4499
 epoch: 5, train_loss: 0.9119, test_loss: 0.9408, test_f1: 0.5143
 epoch: 6, train_loss: 0.8950, test_loss: 0.9857, test_f1: 0.5061
 epoch: 7, train_loss: 0.8709, test_loss: 0.9239, test_f1: 0.4843
 epoch: 8, train_loss: 0.8498, test_loss: 0.9300, test_f1: 0.4981
 epoch: 9, train_loss: 0.8536, test_loss: 0.8627, test_f1: 0.5310
 epoch: 10, train_loss: 0.8447, test_loss: 0.8770, test_f1: 0.5859
 epoch: 11, train_loss: 0.8438, test_loss: 0.9328, test_f1: 0.5118
 epoch: 12, train_loss: 0.8401, test_loss: 1.0624, test_f1: 0.5116
 epoch: 13, train_loss: 0.8351, test_loss: 0.8626, test_f1: 0.5308
 epoch: 14, train_loss: 0.8416, test_loss: 0.9754, test_f1: 0.5428
 epoch: 15, train_loss: 0.8327, test_loss: 0.8325, test_f1: 0.5486
 epoch: 16, train_loss: 0.8079, test_loss: 0.8247, test_f1: 0.6288
 epoch: 17, train_loss: 0.7985, test_loss: 0.9425, test_f1: 0.5339
 epoch: 18, train_loss: 0.7950, test_loss: 0.8633, test_f1: 0.5732
 epoch: 19, train_loss: 0.8195, test_loss: 0.8000, test_f1: 0.5842
 epoch: 20, train_loss: 0.7891, test_loss: 0.8111, test_f1: 0.6056
 epoch: 21, train_loss: 0.7911, test_loss: 0.8277, test_f1: 0.6020
 epoch: 22, train_loss: 0.7627, test_loss: 0.8810, test_f1: 0.5860
 epoch: 23, train_loss: 0.7663, test_loss: 0.8264, test_f1: 0.5782
 epoch: 24, train_loss: 0.7660, test_loss: 0.7770, test_f1: 0.6054
 epoch: 25, train_loss: 0.7634, test_loss: 0.9024, test_f1: 0.5855
 epoch: 26, train_loss: 0.7631, test_loss: 0.9299, test_f1: 0.5612
 epoch: 27, train_loss: 0.7939, test_loss: 0.8299, test_f1: 0.6117
 epoch: 28, train_loss: 0.7767, test_loss: 0.9512, test_f1: 0.5473
 epoch: 29, train_loss: 0.7577, test_loss: 0.9572, test_f1: 0.5767
 epoch: 30, train_loss: 0.7536, test_loss: 0.7579, test_f1: 0.6468
 epoch: 31, train_loss: 0.7461, test_loss: 0.7617, test_f1: 0.6345
 epoch: 32, train_loss: 0.7320, test_loss: 0.7867, test_f1: 0.6179
 epoch: 33, train_loss: 0.7362, test_loss: 0.8446, test_f1: 0.6397
 epoch: 34, train_loss: 0.7210, test_loss: 0.7605, test_f1: 0.6328
 epoch: 35, train_loss: 0.7355, test_loss: 0.9346, test_f1: 0.6044
 epoch: 36, train_loss: 0.7406, test_loss: 0.9267, test_f1: 0.5834
 epoch: 37, train_loss: 0.7330, test_loss: 0.9563, test_f1: 0.6020
 epoch: 38, train_loss: 0.7259, test_loss: 0.9861, test_f1: 0.6100
 epoch: 39, train_loss: 0.7401, test_loss: 0.8115, test_f1: 0.6406
 epoch: 40, train_loss: 0.7068, test_loss: 0.9327, test_f1: 0.6280
 epoch: 41, train_loss: 0.7199, test_loss: 0.8219, test_f1: 0.6254
 epoch: 42, train_loss: 0.6929, test_loss: 0.8230, test_f1: 0.6457
 epoch: 43, train_loss: 0.6897, test_loss: 0.8844, test_f1: 0.6317
 epoch: 44, train_loss: 0.7045, test_loss: 0.8603, test_f1: 0.6208
 epoch: 45, train_loss: 0.6881, test_loss: 1.3814, test_f1: 0.4803
 epoch: 46, train_loss: 0.7100, test_loss: 0.8357, test_f1: 0.6395
 epoch: 47, train_loss: 0.6875, test_loss: 0.8909, test_f1: 0.6365
 epoch: 48, train_loss: 0.6994, test_loss: 0.8920, test_f1: 0.6375
 epoch: 49, train_loss: 0.6914, test_loss: 0.8782, test_f1: 0.6378
 epoch: 50, train_loss: 0.6972, test_loss: 0.8297, test_f1: 0.6529
 epoch: 51, train_loss: 0.6595, test_loss: 0.8581, test_f1: 0.6871
 epoch: 52, train_loss: 0.6338, test_loss: 0.9323, test_f1: 0.6492
 epoch: 53, train_loss: 0.6382, test_loss: 0.9829, test_f1: 0.6600
 epoch: 54, train_loss: 0.6214, test_loss: 0.8819, test_f1: 0.6558
 epoch: 55, train_loss: 0.6252, test_loss: 0.9096, test_f1: 0.6623
 epoch: 56, train_loss: 0.6333, test_loss: 0.9415, test_f1: 0.6911
 epoch: 57, train_loss: 0.6155, test_loss: 1.0841, test_f1: 0.6705
 epoch: 58, train_loss: 0.6263, test_loss: 0.9260, test_f1: 0.6489
 epoch: 59, train_loss: 0.6244, test_loss: 1.0030, test_f1: 0.6225
 epoch: 60, train_loss: 0.5928, test_loss: 0.9972, test_f1: 0.6520
 epoch: 61, train_loss: 0.6290, test_loss: 0.9400, test_f1: 0.6621
 epoch: 62, train_loss: 0.6057, test_loss: 0.9850, test_f1: 0.6457
 epoch: 63, train_loss: 0.6148, test_loss: 1.0304, test_f1: 0.6316
 epoch: 64, train_loss: 0.5975, test_loss: 1.0799, test_f1: 0.6584
 epoch: 65, train_loss: 0.5942, test_loss: 0.9758, test_f1: 0.6596
 epoch: 66, train_loss: 0.5881, test_loss: 0.9593, test_f1: 0.6401
 epoch: 67, train_loss: 0.5908, test_loss: 1.0531, test_f1: 0.6195
 epoch: 68, train_loss: 0.5961, test_loss: 1.0477, test_f1: 0.6558
 epoch: 69, train_loss: 0.5756, test_loss: 1.0784, test_f1: 0.6530
 epoch: 70, train_loss: 0.5768, test_loss: 1.1444, test_f1: 0.6490
 epoch: 71, train_loss: 0.6077, test_loss: 1.0660, test_f1: 0.6490
 epoch: 72, train_loss: 0.5906, test_loss: 1.0994, test_f1: 0.6615
 epoch: 73, train_loss: 0.5678, test_loss: 1.0648, test_f1: 0.6670
 epoch: 74, train_loss: 0.5768, test_loss: 1.0269, test_f1: 0.6564
 epoch: 75, train_loss: 0.5834, test_loss: 1.0925, test_f1: 0.6567
 epoch: 76, train_loss: 0.5914, test_loss: 1.0794, test_f1: 0.6141
 epoch: 77, train_loss: 0.5947, test_loss: 1.0080, test_f1: 0.6456
 epoch: 78, train_loss: 0.5708, test_loss: 0.9462, test_f1: 0.6498
 epoch: 79, train_loss: 0.5860, test_loss: 1.0065, test_f1: 0.6391
 epoch: 80, train_loss: 0.5706, test_loss: 1.0630, test_f1: 0.6437
 epoch: 81, train_loss: 0.5772, test_loss: 1.0256, test_f1: 0.6600
 epoch: 82, train_loss: 0.5666, test_loss: 1.0657, test_f1: 0.6438
 epoch: 83, train_loss: 0.5591, test_loss: 1.1265, test_f1: 0.6337
 epoch: 84, train_loss: 0.5400, test_loss: 1.1500, test_f1: 0.6447
 epoch: 85, train_loss: 0.5561, test_loss: 1.1550, test_f1: 0.6309
 epoch: 86, train_loss: 0.5370, test_loss: 1.2587, test_f1: 0.6408
 epoch: 87, train_loss: 0.5427, test_loss: 1.1299, test_f1: 0.6650
 epoch: 88, train_loss: 0.5712, test_loss: 1.2323, test_f1: 0.6461
 epoch: 89, train_loss: 0.5722, test_loss: 1.0949, test_f1: 0.6355
 epoch: 90, train_loss: 0.5577, test_loss: 1.1934, test_f1: 0.6544
 epoch: 91, train_loss: 0.5489, test_loss: 1.1334, test_f1: 0.6293
 epoch: 92, train_loss: 0.5528, test_loss: 1.2214, test_f1: 0.6392
 epoch: 93, train_loss: 0.5455, test_loss: 1.1119, test_f1: 0.6465
 epoch: 94, train_loss: 0.5478, test_loss: 1.1446, test_f1: 0.6500
 epoch: 95, train_loss: 0.5680, test_loss: 1.0449, test_f1: 0.6661
 epoch: 96, train_loss: 0.5422, test_loss: 1.1678, test_f1: 0.6409
 epoch: 97, train_loss: 0.5338, test_loss: 1.1980, test_f1: 0.6344
 epoch: 98, train_loss: 0.5431, test_loss: 1.0973, test_f1: 0.6545
 epoch: 99, train_loss: 0.5612, test_loss: 1.1276, test_f1: 0.6487
##################ITERATION #4 ****************************************
 epoch: 0, train_loss: 1.0790, test_loss: 1.0055, test_f1: 0.4702
 epoch: 1, train_loss: 0.9854, test_loss: 1.0022, test_f1: 0.5016
 epoch: 2, train_loss: 0.9573, test_loss: 0.9748, test_f1: 0.4553
 epoch: 3, train_loss: 0.9379, test_loss: 1.0645, test_f1: 0.4536
 epoch: 4, train_loss: 0.9262, test_loss: 0.9436, test_f1: 0.5165
 epoch: 5, train_loss: 0.8983, test_loss: 0.9962, test_f1: 0.5184
 epoch: 6, train_loss: 0.8880, test_loss: 0.8761, test_f1: 0.6019
 epoch: 7, train_loss: 0.8715, test_loss: 0.9485, test_f1: 0.4582
 epoch: 8, train_loss: 0.8614, test_loss: 1.0623, test_f1: 0.5262
 epoch: 9, train_loss: 0.8519, test_loss: 0.8630, test_f1: 0.5247
 epoch: 10, train_loss: 0.8541, test_loss: 0.9522, test_f1: 0.5194
 epoch: 11, train_loss: 0.8466, test_loss: 0.9105, test_f1: 0.5317
 epoch: 12, train_loss: 0.8329, test_loss: 0.8460, test_f1: 0.5854
 epoch: 13, train_loss: 0.8170, test_loss: 0.8757, test_f1: 0.5570
 epoch: 14, train_loss: 0.8172, test_loss: 0.9559, test_f1: 0.5422
 epoch: 15, train_loss: 0.8082, test_loss: 0.9176, test_f1: 0.5554
 epoch: 16, train_loss: 0.8147, test_loss: 0.9261, test_f1: 0.5058
 epoch: 17, train_loss: 0.7948, test_loss: 0.9905, test_f1: 0.5650
 epoch: 18, train_loss: 0.7859, test_loss: 1.0358, test_f1: 0.5223
 epoch: 19, train_loss: 0.7902, test_loss: 0.9227, test_f1: 0.6139
 epoch: 20, train_loss: 0.7840, test_loss: 0.8734, test_f1: 0.5872
 epoch: 21, train_loss: 0.7578, test_loss: 1.0715, test_f1: 0.5352
 epoch: 22, train_loss: 0.7957, test_loss: 0.8684, test_f1: 0.6080
 epoch: 23, train_loss: 0.7668, test_loss: 0.8188, test_f1: 0.6093
 epoch: 24, train_loss: 0.7761, test_loss: 0.8412, test_f1: 0.6244
 epoch: 25, train_loss: 0.7404, test_loss: 0.8252, test_f1: 0.6195
 epoch: 26, train_loss: 0.7570, test_loss: 0.8669, test_f1: 0.6063
 epoch: 27, train_loss: 0.7441, test_loss: 0.8357, test_f1: 0.6306
 epoch: 28, train_loss: 0.7366, test_loss: 0.9365, test_f1: 0.6019
 epoch: 29, train_loss: 0.7246, test_loss: 0.7676, test_f1: 0.6356
 epoch: 30, train_loss: 0.7432, test_loss: 0.8031, test_f1: 0.6195
 epoch: 31, train_loss: 0.7412, test_loss: 0.8707, test_f1: 0.6113
 epoch: 32, train_loss: 0.7424, test_loss: 1.0213, test_f1: 0.6170
 epoch: 33, train_loss: 0.7271, test_loss: 1.0248, test_f1: 0.6319
 epoch: 34, train_loss: 0.7418, test_loss: 0.8341, test_f1: 0.6004
 epoch: 35, train_loss: 0.7127, test_loss: 1.1020, test_f1: 0.5551
 epoch: 36, train_loss: 0.7060, test_loss: 0.9056, test_f1: 0.5970
 epoch: 37, train_loss: 0.7120, test_loss: 1.0394, test_f1: 0.6244
 epoch: 38, train_loss: 0.7080, test_loss: 0.8619, test_f1: 0.6006
 epoch: 39, train_loss: 0.7181, test_loss: 0.8534, test_f1: 0.6341
 epoch: 40, train_loss: 0.7023, test_loss: 0.8054, test_f1: 0.6379
 epoch: 41, train_loss: 0.6914, test_loss: 0.8459, test_f1: 0.6327
 epoch: 42, train_loss: 0.6964, test_loss: 0.8563, test_f1: 0.6540
 epoch: 43, train_loss: 0.6861, test_loss: 1.0560, test_f1: 0.5992
 epoch: 44, train_loss: 0.7049, test_loss: 1.0589, test_f1: 0.6208
 epoch: 45, train_loss: 0.6814, test_loss: 0.8660, test_f1: 0.5897
 epoch: 46, train_loss: 0.6989, test_loss: 1.0049, test_f1: 0.6147
 epoch: 47, train_loss: 0.6925, test_loss: 0.8415, test_f1: 0.6319
 epoch: 48, train_loss: 0.6961, test_loss: 0.8704, test_f1: 0.6187
 epoch: 49, train_loss: 0.6871, test_loss: 0.9039, test_f1: 0.6524
 epoch: 50, train_loss: 0.6712, test_loss: 0.8246, test_f1: 0.6231
 epoch: 51, train_loss: 0.6469, test_loss: 0.8961, test_f1: 0.6502
 epoch: 52, train_loss: 0.6265, test_loss: 0.9774, test_f1: 0.6542
 epoch: 53, train_loss: 0.6168, test_loss: 0.9934, test_f1: 0.6605
 epoch: 54, train_loss: 0.6153, test_loss: 0.9949, test_f1: 0.6367
 epoch: 55, train_loss: 0.6300, test_loss: 1.0485, test_f1: 0.6410
 epoch: 56, train_loss: 0.6148, test_loss: 0.9459, test_f1: 0.6511
 epoch: 57, train_loss: 0.6119, test_loss: 0.9522, test_f1: 0.6503
 epoch: 58, train_loss: 0.6155, test_loss: 0.9582, test_f1: 0.6525
 epoch: 59, train_loss: 0.6162, test_loss: 1.0113, test_f1: 0.6115
 epoch: 60, train_loss: 0.6140, test_loss: 0.9417, test_f1: 0.6618
 epoch: 61, train_loss: 0.6175, test_loss: 0.8915, test_f1: 0.6465
 epoch: 62, train_loss: 0.6132, test_loss: 0.9878, test_f1: 0.6388
 epoch: 63, train_loss: 0.5930, test_loss: 0.9600, test_f1: 0.6626
 epoch: 64, train_loss: 0.5940, test_loss: 0.9833, test_f1: 0.6648
 epoch: 65, train_loss: 0.5880, test_loss: 0.9698, test_f1: 0.6304
 epoch: 66, train_loss: 0.5895, test_loss: 0.9588, test_f1: 0.6231
 epoch: 67, train_loss: 0.5675, test_loss: 1.0018, test_f1: 0.6329
 epoch: 68, train_loss: 0.5893, test_loss: 0.9565, test_f1: 0.6589
 epoch: 69, train_loss: 0.5757, test_loss: 1.0068, test_f1: 0.6331
 epoch: 70, train_loss: 0.5706, test_loss: 1.1567, test_f1: 0.6214
 epoch: 71, train_loss: 0.5736, test_loss: 1.0614, test_f1: 0.6250
 epoch: 72, train_loss: 0.5698, test_loss: 0.9935, test_f1: 0.6485
 epoch: 73, train_loss: 0.5842, test_loss: 1.0379, test_f1: 0.6432
 epoch: 74, train_loss: 0.5536, test_loss: 1.1311, test_f1: 0.6626
 epoch: 75, train_loss: 0.5790, test_loss: 0.9916, test_f1: 0.6091
 epoch: 76, train_loss: 0.5712, test_loss: 1.1364, test_f1: 0.6431
 epoch: 77, train_loss: 0.5714, test_loss: 1.0491, test_f1: 0.6544
 epoch: 78, train_loss: 0.5866, test_loss: 1.1471, test_f1: 0.6334
 epoch: 79, train_loss: 0.5676, test_loss: 1.0795, test_f1: 0.6713
 epoch: 80, train_loss: 0.5837, test_loss: 0.9246, test_f1: 0.6396
 epoch: 81, train_loss: 0.5630, test_loss: 1.0203, test_f1: 0.6490
 epoch: 82, train_loss: 0.5609, test_loss: 1.1217, test_f1: 0.6445
 epoch: 83, train_loss: 0.5623, test_loss: 1.0896, test_f1: 0.6404
 epoch: 84, train_loss: 0.5674, test_loss: 0.9899, test_f1: 0.6591
 epoch: 85, train_loss: 0.5456, test_loss: 1.1647, test_f1: 0.6383
 epoch: 86, train_loss: 0.5609, test_loss: 1.0530, test_f1: 0.6500
 epoch: 87, train_loss: 0.5575, test_loss: 1.0445, test_f1: 0.6609
 epoch: 88, train_loss: 0.5569, test_loss: 1.1715, test_f1: 0.6625
 epoch: 89, train_loss: 0.5517, test_loss: 1.0462, test_f1: 0.6665
 epoch: 90, train_loss: 0.5471, test_loss: 1.1341, test_f1: 0.6644
 epoch: 91, train_loss: 0.5412, test_loss: 1.0836, test_f1: 0.6257
 epoch: 92, train_loss: 0.5599, test_loss: 1.0090, test_f1: 0.6580
 epoch: 93, train_loss: 0.5531, test_loss: 1.0307, test_f1: 0.6325
 epoch: 94, train_loss: 0.5506, test_loss: 0.9755, test_f1: 0.6528
 epoch: 95, train_loss: 0.5291, test_loss: 1.0227, test_f1: 0.6315
 epoch: 96, train_loss: 0.5217, test_loss: 1.0762, test_f1: 0.6467
 epoch: 97, train_loss: 0.5425, test_loss: 1.2021, test_f1: 0.6521
 epoch: 98, train_loss: 0.5487, test_loss: 1.1041, test_f1: 0.6671
 epoch: 99, train_loss: 0.5323, test_loss: 0.9443, test_f1: 0.6583
##################ITERATION #5 ****************************************
 epoch: 0, train_loss: 1.1326, test_loss: 1.1207, test_f1: 0.4177
 epoch: 1, train_loss: 1.0028, test_loss: 0.9816, test_f1: 0.4763
 epoch: 2, train_loss: 0.9668, test_loss: 0.9319, test_f1: 0.5542
 epoch: 3, train_loss: 0.9482, test_loss: 0.9557, test_f1: 0.5376
 epoch: 4, train_loss: 0.9241, test_loss: 0.9592, test_f1: 0.4701
 epoch: 5, train_loss: 0.9017, test_loss: 0.9941, test_f1: 0.5042
 epoch: 6, train_loss: 0.8950, test_loss: 0.8619, test_f1: 0.5532
 epoch: 7, train_loss: 0.8862, test_loss: 0.8727, test_f1: 0.5932
 epoch: 8, train_loss: 0.8619, test_loss: 0.9012, test_f1: 0.5278
 epoch: 9, train_loss: 0.8672, test_loss: 0.8639, test_f1: 0.5476
 epoch: 10, train_loss: 0.8719, test_loss: 0.9974, test_f1: 0.4829
 epoch: 11, train_loss: 0.8359, test_loss: 0.8701, test_f1: 0.5086
 epoch: 12, train_loss: 0.8364, test_loss: 0.8435, test_f1: 0.5614
 epoch: 13, train_loss: 0.8218, test_loss: 0.8472, test_f1: 0.5495
 epoch: 14, train_loss: 0.8337, test_loss: 0.8801, test_f1: 0.5926
 epoch: 15, train_loss: 0.8137, test_loss: 0.8272, test_f1: 0.5677
 epoch: 16, train_loss: 0.8021, test_loss: 0.8354, test_f1: 0.5992
 epoch: 17, train_loss: 0.8162, test_loss: 0.8446, test_f1: 0.5843
 epoch: 18, train_loss: 0.8146, test_loss: 0.8212, test_f1: 0.5832
 epoch: 19, train_loss: 0.8010, test_loss: 0.8866, test_f1: 0.5808
 epoch: 20, train_loss: 0.8040, test_loss: 0.8381, test_f1: 0.6306
 epoch: 21, train_loss: 0.7819, test_loss: 0.8054, test_f1: 0.5646
 epoch: 22, train_loss: 0.7804, test_loss: 0.7748, test_f1: 0.6320
 epoch: 23, train_loss: 0.7938, test_loss: 0.8506, test_f1: 0.5596
 epoch: 24, train_loss: 0.7804, test_loss: 0.7953, test_f1: 0.5926
 epoch: 25, train_loss: 0.7750, test_loss: 0.7966, test_f1: 0.6244
 epoch: 26, train_loss: 0.7942, test_loss: 0.8968, test_f1: 0.5506
 epoch: 27, train_loss: 0.7640, test_loss: 0.7868, test_f1: 0.6274
 epoch: 28, train_loss: 0.7794, test_loss: 0.8163, test_f1: 0.5860
 epoch: 29, train_loss: 0.7706, test_loss: 0.8394, test_f1: 0.5912
 epoch: 30, train_loss: 0.7692, test_loss: 0.9223, test_f1: 0.6136
 epoch: 31, train_loss: 0.7648, test_loss: 0.8274, test_f1: 0.6256
 epoch: 32, train_loss: 0.7519, test_loss: 0.8634, test_f1: 0.5892
 epoch: 33, train_loss: 0.7526, test_loss: 0.7761, test_f1: 0.6253
 epoch: 34, train_loss: 0.7299, test_loss: 0.7932, test_f1: 0.6338
 epoch: 35, train_loss: 0.7389, test_loss: 0.8496, test_f1: 0.5903
 epoch: 36, train_loss: 0.7496, test_loss: 0.8616, test_f1: 0.6381
 epoch: 37, train_loss: 0.7283, test_loss: 0.8013, test_f1: 0.6394
 epoch: 38, train_loss: 0.7478, test_loss: 0.8337, test_f1: 0.6137
 epoch: 39, train_loss: 0.7244, test_loss: 0.8187, test_f1: 0.6411
 epoch: 40, train_loss: 0.7436, test_loss: 0.8259, test_f1: 0.5887
 epoch: 41, train_loss: 0.7272, test_loss: 0.7951, test_f1: 0.6478
 epoch: 42, train_loss: 0.7248, test_loss: 0.7946, test_f1: 0.6461
 epoch: 43, train_loss: 0.7264, test_loss: 0.8222, test_f1: 0.6292
 epoch: 44, train_loss: 0.7069, test_loss: 0.8603, test_f1: 0.6209
 epoch: 45, train_loss: 0.7135, test_loss: 0.7833, test_f1: 0.6095
 epoch: 46, train_loss: 0.7174, test_loss: 0.8383, test_f1: 0.6210
 epoch: 47, train_loss: 0.7136, test_loss: 0.8500, test_f1: 0.6418
 epoch: 48, train_loss: 0.7200, test_loss: 0.7644, test_f1: 0.6309
 epoch: 49, train_loss: 0.7159, test_loss: 0.7630, test_f1: 0.6175
 epoch: 50, train_loss: 0.7238, test_loss: 0.7979, test_f1: 0.6051
 epoch: 51, train_loss: 0.6856, test_loss: 0.7762, test_f1: 0.6378
 epoch: 52, train_loss: 0.6637, test_loss: 0.7375, test_f1: 0.6492
 epoch: 53, train_loss: 0.6630, test_loss: 0.7548, test_f1: 0.6492
 epoch: 54, train_loss: 0.6563, test_loss: 0.7362, test_f1: 0.6571
 epoch: 55, train_loss: 0.6542, test_loss: 0.7434, test_f1: 0.6375
 epoch: 56, train_loss: 0.6584, test_loss: 0.8123, test_f1: 0.6545
 epoch: 57, train_loss: 0.6514, test_loss: 0.7405, test_f1: 0.6545
 epoch: 58, train_loss: 0.6463, test_loss: 0.7680, test_f1: 0.6441
 epoch: 59, train_loss: 0.6427, test_loss: 0.8189, test_f1: 0.6240
 epoch: 60, train_loss: 0.6356, test_loss: 0.7757, test_f1: 0.6445
 epoch: 61, train_loss: 0.6505, test_loss: 0.8547, test_f1: 0.6186
 epoch: 62, train_loss: 0.6364, test_loss: 0.7554, test_f1: 0.6417
 epoch: 63, train_loss: 0.6438, test_loss: 0.8077, test_f1: 0.6254
 epoch: 64, train_loss: 0.6356, test_loss: 0.7963, test_f1: 0.6500
 epoch: 65, train_loss: 0.6420, test_loss: 0.7686, test_f1: 0.6552
 epoch: 66, train_loss: 0.6370, test_loss: 0.7720, test_f1: 0.6353
 epoch: 67, train_loss: 0.6206, test_loss: 0.7969, test_f1: 0.6428
 epoch: 68, train_loss: 0.6198, test_loss: 0.7869, test_f1: 0.6387
 epoch: 69, train_loss: 0.6269, test_loss: 0.7772, test_f1: 0.6453
 epoch: 70, train_loss: 0.6259, test_loss: 0.7449, test_f1: 0.6458
 epoch: 71, train_loss: 0.6167, test_loss: 0.8222, test_f1: 0.6382
 epoch: 72, train_loss: 0.6188, test_loss: 0.7802, test_f1: 0.6577
 epoch: 73, train_loss: 0.6165, test_loss: 0.7795, test_f1: 0.6606
 epoch: 74, train_loss: 0.6160, test_loss: 0.7712, test_f1: 0.6627
 epoch: 75, train_loss: 0.6073, test_loss: 0.7968, test_f1: 0.6504
 epoch: 76, train_loss: 0.6274, test_loss: 0.7766, test_f1: 0.6318
 epoch: 77, train_loss: 0.5987, test_loss: 0.7580, test_f1: 0.6387
 epoch: 78, train_loss: 0.6069, test_loss: 0.8223, test_f1: 0.6320
 epoch: 79, train_loss: 0.6144, test_loss: 0.8069, test_f1: 0.6477
 epoch: 80, train_loss: 0.6036, test_loss: 0.7828, test_f1: 0.6656
 epoch: 81, train_loss: 0.6080, test_loss: 0.8019, test_f1: 0.6463
 epoch: 82, train_loss: 0.5926, test_loss: 0.7916, test_f1: 0.6645
 epoch: 83, train_loss: 0.6081, test_loss: 0.8090, test_f1: 0.6719
 epoch: 84, train_loss: 0.6116, test_loss: 0.8000, test_f1: 0.6652
 epoch: 85, train_loss: 0.5974, test_loss: 0.7665, test_f1: 0.6460
 epoch: 86, train_loss: 0.5991, test_loss: 0.8061, test_f1: 0.6354
 epoch: 87, train_loss: 0.5937, test_loss: 0.7870, test_f1: 0.6404
 epoch: 88, train_loss: 0.5913, test_loss: 0.8770, test_f1: 0.6224
 epoch: 89, train_loss: 0.5949, test_loss: 0.7745, test_f1: 0.6446
 epoch: 90, train_loss: 0.5908, test_loss: 0.7788, test_f1: 0.6652
 epoch: 91, train_loss: 0.5787, test_loss: 0.7770, test_f1: 0.6482
 epoch: 92, train_loss: 0.5934, test_loss: 0.8272, test_f1: 0.6314
 epoch: 93, train_loss: 0.5881, test_loss: 0.8152, test_f1: 0.6560
 epoch: 94, train_loss: 0.5894, test_loss: 0.8024, test_f1: 0.6386
 epoch: 95, train_loss: 0.5648, test_loss: 0.7913, test_f1: 0.6565
 epoch: 96, train_loss: 0.5782, test_loss: 0.8173, test_f1: 0.6691
 epoch: 97, train_loss: 0.5696, test_loss: 0.8742, test_f1: 0.6403
 epoch: 98, train_loss: 0.5799, test_loss: 0.7791, test_f1: 0.6770
 epoch: 99, train_loss: 0.5932, test_loss: 0.8085, test_f1: 0.6511
##################ITERATION #6 ****************************************
 epoch: 0, train_loss: 1.1034, test_loss: 1.0464, test_f1: 0.4161
 epoch: 1, train_loss: 0.9846, test_loss: 0.9546, test_f1: 0.5291
 epoch: 2, train_loss: 0.9684, test_loss: 0.9643, test_f1: 0.5142
 epoch: 3, train_loss: 0.9420, test_loss: 0.9413, test_f1: 0.4995
 epoch: 4, train_loss: 0.9465, test_loss: 1.0325, test_f1: 0.4429
 epoch: 5, train_loss: 0.9237, test_loss: 1.0656, test_f1: 0.4779
 epoch: 6, train_loss: 0.9145, test_loss: 0.8650, test_f1: 0.5593
 epoch: 7, train_loss: 0.9020, test_loss: 0.9040, test_f1: 0.5447
 epoch: 8, train_loss: 0.8932, test_loss: 0.8927, test_f1: 0.5390
 epoch: 9, train_loss: 0.8788, test_loss: 0.8928, test_f1: 0.5198
 epoch: 10, train_loss: 0.8670, test_loss: 0.8687, test_f1: 0.5100
 epoch: 11, train_loss: 0.8574, test_loss: 0.9568, test_f1: 0.5393
 epoch: 12, train_loss: 0.8530, test_loss: 0.9162, test_f1: 0.5336
 epoch: 13, train_loss: 0.8558, test_loss: 0.9051, test_f1: 0.5278
 epoch: 14, train_loss: 0.8415, test_loss: 0.9220, test_f1: 0.5223
 epoch: 15, train_loss: 0.8366, test_loss: 0.8842, test_f1: 0.5712
 epoch: 16, train_loss: 0.8288, test_loss: 0.8443, test_f1: 0.6206
 epoch: 17, train_loss: 0.8394, test_loss: 0.8373, test_f1: 0.5821
 epoch: 18, train_loss: 0.8174, test_loss: 0.8406, test_f1: 0.5715
 epoch: 19, train_loss: 0.8275, test_loss: 0.8501, test_f1: 0.6115
 epoch: 20, train_loss: 0.8050, test_loss: 0.8202, test_f1: 0.5886
 epoch: 21, train_loss: 0.8201, test_loss: 0.8291, test_f1: 0.5812
 epoch: 22, train_loss: 0.7963, test_loss: 0.8236, test_f1: 0.6299
 epoch: 23, train_loss: 0.8139, test_loss: 0.7919, test_f1: 0.6455
 epoch: 24, train_loss: 0.7970, test_loss: 0.8524, test_f1: 0.6061
 epoch: 25, train_loss: 0.7944, test_loss: 0.8683, test_f1: 0.5899
 epoch: 26, train_loss: 0.7919, test_loss: 0.8585, test_f1: 0.5849
 epoch: 27, train_loss: 0.7953, test_loss: 0.8812, test_f1: 0.6344
 epoch: 28, train_loss: 0.7765, test_loss: 0.8807, test_f1: 0.6106
 epoch: 29, train_loss: 0.7640, test_loss: 0.9825, test_f1: 0.5594
 epoch: 30, train_loss: 0.7932, test_loss: 0.7974, test_f1: 0.6121
 epoch: 31, train_loss: 0.7688, test_loss: 0.8414, test_f1: 0.6015
 epoch: 32, train_loss: 0.7781, test_loss: 0.7692, test_f1: 0.6200
 epoch: 33, train_loss: 0.7584, test_loss: 0.7874, test_f1: 0.5764
 epoch: 34, train_loss: 0.7564, test_loss: 0.7971, test_f1: 0.5990
 epoch: 35, train_loss: 0.7472, test_loss: 0.7891, test_f1: 0.6208
 epoch: 36, train_loss: 0.7561, test_loss: 0.8730, test_f1: 0.5916
 epoch: 37, train_loss: 0.7633, test_loss: 0.7982, test_f1: 0.6230
 epoch: 38, train_loss: 0.7568, test_loss: 0.8370, test_f1: 0.6001
 epoch: 39, train_loss: 0.7633, test_loss: 0.7868, test_f1: 0.6168
 epoch: 40, train_loss: 0.7573, test_loss: 0.8602, test_f1: 0.5712
 epoch: 41, train_loss: 0.7498, test_loss: 0.8104, test_f1: 0.6071
 epoch: 42, train_loss: 0.7340, test_loss: 0.9090, test_f1: 0.6154
 epoch: 43, train_loss: 0.7400, test_loss: 0.8370, test_f1: 0.6209
 epoch: 44, train_loss: 0.7361, test_loss: 0.8824, test_f1: 0.6048
 epoch: 45, train_loss: 0.7383, test_loss: 0.8813, test_f1: 0.6134
 epoch: 46, train_loss: 0.7402, test_loss: 0.8720, test_f1: 0.6010
 epoch: 47, train_loss: 0.7334, test_loss: 0.8817, test_f1: 0.6007
 epoch: 48, train_loss: 0.7262, test_loss: 0.8128, test_f1: 0.6227
 epoch: 49, train_loss: 0.7179, test_loss: 0.8498, test_f1: 0.6307
 epoch: 50, train_loss: 0.7327, test_loss: 0.8388, test_f1: 0.6209
 epoch: 51, train_loss: 0.6902, test_loss: 0.8130, test_f1: 0.6457
 epoch: 52, train_loss: 0.6959, test_loss: 0.8301, test_f1: 0.6489
 epoch: 53, train_loss: 0.6915, test_loss: 0.8303, test_f1: 0.6433
 epoch: 54, train_loss: 0.6716, test_loss: 0.8236, test_f1: 0.6587
 epoch: 55, train_loss: 0.6614, test_loss: 0.8156, test_f1: 0.6633
 epoch: 56, train_loss: 0.6748, test_loss: 0.8085, test_f1: 0.6640
 epoch: 57, train_loss: 0.6730, test_loss: 0.7901, test_f1: 0.6728
 epoch: 58, train_loss: 0.6681, test_loss: 0.8344, test_f1: 0.6454
 epoch: 59, train_loss: 0.6450, test_loss: 0.8151, test_f1: 0.6555
 epoch: 60, train_loss: 0.6638, test_loss: 0.8153, test_f1: 0.6593
 epoch: 61, train_loss: 0.6645, test_loss: 0.9020, test_f1: 0.6554
 epoch: 62, train_loss: 0.6496, test_loss: 0.8375, test_f1: 0.6744
 epoch: 63, train_loss: 0.6651, test_loss: 0.8520, test_f1: 0.6722
 epoch: 64, train_loss: 0.6625, test_loss: 0.7944, test_f1: 0.6510
 epoch: 65, train_loss: 0.6495, test_loss: 0.8512, test_f1: 0.6648
 epoch: 66, train_loss: 0.6428, test_loss: 0.8493, test_f1: 0.6474
 epoch: 67, train_loss: 0.6566, test_loss: 0.8334, test_f1: 0.6604
 epoch: 68, train_loss: 0.6553, test_loss: 0.8421, test_f1: 0.6803
 epoch: 69, train_loss: 0.6471, test_loss: 0.8439, test_f1: 0.6718
 epoch: 70, train_loss: 0.6383, test_loss: 0.8018, test_f1: 0.6707
 epoch: 71, train_loss: 0.6451, test_loss: 0.8376, test_f1: 0.6577
 epoch: 72, train_loss: 0.6301, test_loss: 0.8134, test_f1: 0.6437
 epoch: 73, train_loss: 0.6212, test_loss: 0.8700, test_f1: 0.6669
 epoch: 74, train_loss: 0.6355, test_loss: 0.8935, test_f1: 0.6385
 epoch: 75, train_loss: 0.6310, test_loss: 0.8483, test_f1: 0.6413
 epoch: 76, train_loss: 0.6441, test_loss: 0.8730, test_f1: 0.6450
 epoch: 77, train_loss: 0.6428, test_loss: 0.8578, test_f1: 0.6489
 epoch: 78, train_loss: 0.6379, test_loss: 0.9133, test_f1: 0.6402
 epoch: 79, train_loss: 0.6266, test_loss: 0.8514, test_f1: 0.6695
 epoch: 80, train_loss: 0.6110, test_loss: 0.8116, test_f1: 0.6556
 epoch: 81, train_loss: 0.6112, test_loss: 0.8253, test_f1: 0.6581
 epoch: 82, train_loss: 0.6002, test_loss: 0.8746, test_f1: 0.6639
 epoch: 83, train_loss: 0.6220, test_loss: 0.8409, test_f1: 0.6680
 epoch: 84, train_loss: 0.6126, test_loss: 0.8692, test_f1: 0.6639
 epoch: 85, train_loss: 0.6287, test_loss: 0.8299, test_f1: 0.6509
 epoch: 86, train_loss: 0.6040, test_loss: 0.8032, test_f1: 0.6906
 epoch: 87, train_loss: 0.6194, test_loss: 0.8395, test_f1: 0.6723
 epoch: 88, train_loss: 0.6210, test_loss: 0.8303, test_f1: 0.6380
 epoch: 89, train_loss: 0.6285, test_loss: 0.9056, test_f1: 0.6324
 epoch: 90, train_loss: 0.6031, test_loss: 0.8326, test_f1: 0.6414
 epoch: 91, train_loss: 0.6100, test_loss: 0.8216, test_f1: 0.6799
 epoch: 92, train_loss: 0.6033, test_loss: 0.8197, test_f1: 0.6713
 epoch: 93, train_loss: 0.5892, test_loss: 0.9045, test_f1: 0.6726
 epoch: 94, train_loss: 0.6312, test_loss: 0.8332, test_f1: 0.6578
 epoch: 95, train_loss: 0.5861, test_loss: 0.8296, test_f1: 0.6863
 epoch: 96, train_loss: 0.6088, test_loss: 0.8654, test_f1: 0.6830
 epoch: 97, train_loss: 0.6004, test_loss: 0.8347, test_f1: 0.6841
 epoch: 98, train_loss: 0.6014, test_loss: 0.8898, test_f1: 0.6443
 epoch: 99, train_loss: 0.6042, test_loss: 0.8648, test_f1: 0.6502
##################ITERATION #7 ****************************************
 epoch: 0, train_loss: 1.1213, test_loss: 1.0189, test_f1: 0.5047
 epoch: 1, train_loss: 0.9984, test_loss: 0.9970, test_f1: 0.5020
 epoch: 2, train_loss: 0.9621, test_loss: 0.9888, test_f1: 0.5103
 epoch: 3, train_loss: 0.9471, test_loss: 0.9467, test_f1: 0.4821
 epoch: 4, train_loss: 0.9184, test_loss: 0.9546, test_f1: 0.5604
 epoch: 5, train_loss: 0.9154, test_loss: 0.9140, test_f1: 0.5323
 epoch: 6, train_loss: 0.8917, test_loss: 0.9468, test_f1: 0.5003
 epoch: 7, train_loss: 0.8802, test_loss: 0.9225, test_f1: 0.5365
 epoch: 8, train_loss: 0.8967, test_loss: 0.9091, test_f1: 0.5260
 epoch: 9, train_loss: 0.8583, test_loss: 0.8564, test_f1: 0.5940
 epoch: 10, train_loss: 0.8537, test_loss: 0.9373, test_f1: 0.5227
 epoch: 11, train_loss: 0.8422, test_loss: 0.8856, test_f1: 0.5492
 epoch: 12, train_loss: 0.8455, test_loss: 0.8916, test_f1: 0.5262
 epoch: 13, train_loss: 0.8482, test_loss: 0.8758, test_f1: 0.5513
 epoch: 14, train_loss: 0.8286, test_loss: 0.9566, test_f1: 0.5566
 epoch: 15, train_loss: 0.8201, test_loss: 0.8929, test_f1: 0.6070
 epoch: 16, train_loss: 0.8128, test_loss: 0.9415, test_f1: 0.5541
 epoch: 17, train_loss: 0.8252, test_loss: 0.8866, test_f1: 0.5880
 epoch: 18, train_loss: 0.8154, test_loss: 0.8247, test_f1: 0.6216
 epoch: 19, train_loss: 0.7831, test_loss: 0.8531, test_f1: 0.6511
 epoch: 20, train_loss: 0.7837, test_loss: 0.9345, test_f1: 0.5632
 epoch: 21, train_loss: 0.7943, test_loss: 0.8988, test_f1: 0.6487
 epoch: 22, train_loss: 0.7778, test_loss: 0.8780, test_f1: 0.5688
 epoch: 23, train_loss: 0.7801, test_loss: 0.8658, test_f1: 0.6048
 epoch: 24, train_loss: 0.7806, test_loss: 0.9044, test_f1: 0.5804
 epoch: 25, train_loss: 0.7689, test_loss: 0.8493, test_f1: 0.6260
 epoch: 26, train_loss: 0.7470, test_loss: 0.7688, test_f1: 0.6795
 epoch: 27, train_loss: 0.7489, test_loss: 0.9932, test_f1: 0.5316
 epoch: 28, train_loss: 0.7359, test_loss: 0.8197, test_f1: 0.6031
 epoch: 29, train_loss: 0.7556, test_loss: 0.8205, test_f1: 0.5785
 epoch: 30, train_loss: 0.7375, test_loss: 0.8915, test_f1: 0.5698
 epoch: 31, train_loss: 0.7441, test_loss: 0.9157, test_f1: 0.5814
 epoch: 32, train_loss: 0.7471, test_loss: 0.8545, test_f1: 0.6243
 epoch: 33, train_loss: 0.7552, test_loss: 0.9116, test_f1: 0.6599
 epoch: 34, train_loss: 0.7479, test_loss: 0.8744, test_f1: 0.6139
 epoch: 35, train_loss: 0.7417, test_loss: 0.8498, test_f1: 0.5902
 epoch: 36, train_loss: 0.7196, test_loss: 0.9694, test_f1: 0.5727
 epoch: 37, train_loss: 0.7352, test_loss: 0.8344, test_f1: 0.6483
 epoch: 38, train_loss: 0.7315, test_loss: 0.8495, test_f1: 0.6408
 epoch: 39, train_loss: 0.7088, test_loss: 0.8494, test_f1: 0.6588
 epoch: 40, train_loss: 0.6959, test_loss: 0.9573, test_f1: 0.6182
 epoch: 41, train_loss: 0.7251, test_loss: 0.8300, test_f1: 0.6030
 epoch: 42, train_loss: 0.7109, test_loss: 0.8774, test_f1: 0.6319
 epoch: 43, train_loss: 0.7186, test_loss: 0.8274, test_f1: 0.6088
 epoch: 44, train_loss: 0.6933, test_loss: 0.8115, test_f1: 0.6548
 epoch: 45, train_loss: 0.7066, test_loss: 0.8874, test_f1: 0.6403
 epoch: 46, train_loss: 0.6926, test_loss: 0.8670, test_f1: 0.6175
 epoch: 47, train_loss: 0.6788, test_loss: 0.8042, test_f1: 0.6682
 epoch: 48, train_loss: 0.7167, test_loss: 0.7501, test_f1: 0.6509
 epoch: 49, train_loss: 0.6943, test_loss: 0.7494, test_f1: 0.6376
 epoch: 50, train_loss: 0.6785, test_loss: 0.7945, test_f1: 0.6572
 epoch: 51, train_loss: 0.6640, test_loss: 0.8105, test_f1: 0.6640
 epoch: 52, train_loss: 0.6299, test_loss: 0.8088, test_f1: 0.6594
 epoch: 53, train_loss: 0.6276, test_loss: 0.7876, test_f1: 0.6877
 epoch: 54, train_loss: 0.6267, test_loss: 0.7876, test_f1: 0.6601
 epoch: 55, train_loss: 0.6182, test_loss: 0.8562, test_f1: 0.6622
 epoch: 56, train_loss: 0.6286, test_loss: 0.7750, test_f1: 0.6777
 epoch: 57, train_loss: 0.6131, test_loss: 0.7804, test_f1: 0.6644
 epoch: 58, train_loss: 0.6117, test_loss: 0.7717, test_f1: 0.6795
 epoch: 59, train_loss: 0.6060, test_loss: 0.7832, test_f1: 0.6568
 epoch: 60, train_loss: 0.5982, test_loss: 0.7254, test_f1: 0.6707
 epoch: 61, train_loss: 0.6123, test_loss: 0.8232, test_f1: 0.6548
 epoch: 62, train_loss: 0.5984, test_loss: 0.7875, test_f1: 0.6584
 epoch: 63, train_loss: 0.5952, test_loss: 0.8789, test_f1: 0.6583
 epoch: 64, train_loss: 0.5758, test_loss: 0.8235, test_f1: 0.6599
 epoch: 65, train_loss: 0.5996, test_loss: 0.8469, test_f1: 0.6726
 epoch: 66, train_loss: 0.5990, test_loss: 0.8477, test_f1: 0.6498
 epoch: 67, train_loss: 0.6092, test_loss: 0.9103, test_f1: 0.6840
 epoch: 68, train_loss: 0.5877, test_loss: 0.8344, test_f1: 0.6897
 epoch: 69, train_loss: 0.5832, test_loss: 0.9303, test_f1: 0.6826
 epoch: 70, train_loss: 0.5789, test_loss: 0.8551, test_f1: 0.6521
 epoch: 71, train_loss: 0.5735, test_loss: 0.9853, test_f1: 0.6836
 epoch: 72, train_loss: 0.5881, test_loss: 0.8266, test_f1: 0.6820
 epoch: 73, train_loss: 0.5861, test_loss: 0.8360, test_f1: 0.6804
 epoch: 74, train_loss: 0.5841, test_loss: 0.7713, test_f1: 0.6643
 epoch: 75, train_loss: 0.5731, test_loss: 1.0203, test_f1: 0.6418
 epoch: 76, train_loss: 0.5681, test_loss: 0.9076, test_f1: 0.6751
 epoch: 77, train_loss: 0.5777, test_loss: 0.9313, test_f1: 0.6407
 epoch: 78, train_loss: 0.5751, test_loss: 0.9306, test_f1: 0.6595
 epoch: 79, train_loss: 0.5760, test_loss: 0.7959, test_f1: 0.6788
 epoch: 80, train_loss: 0.5682, test_loss: 0.9473, test_f1: 0.6814
 epoch: 81, train_loss: 0.5657, test_loss: 0.8480, test_f1: 0.6690
 epoch: 82, train_loss: 0.5571, test_loss: 0.8109, test_f1: 0.6704
 epoch: 83, train_loss: 0.5609, test_loss: 0.8650, test_f1: 0.6492
 epoch: 84, train_loss: 0.5478, test_loss: 0.7970, test_f1: 0.6826
 epoch: 85, train_loss: 0.5725, test_loss: 0.9484, test_f1: 0.6669
 epoch: 86, train_loss: 0.5482, test_loss: 0.9364, test_f1: 0.6692
 epoch: 87, train_loss: 0.5526, test_loss: 0.8711, test_f1: 0.6661
 epoch: 88, train_loss: 0.5456, test_loss: 0.9368, test_f1: 0.6713
 epoch: 89, train_loss: 0.5327, test_loss: 0.8699, test_f1: 0.6877
 epoch: 90, train_loss: 0.5464, test_loss: 0.9570, test_f1: 0.6728
 epoch: 91, train_loss: 0.5415, test_loss: 0.9641, test_f1: 0.6755
 epoch: 92, train_loss: 0.5307, test_loss: 0.9228, test_f1: 0.6721
 epoch: 93, train_loss: 0.5466, test_loss: 0.9827, test_f1: 0.6601
 epoch: 94, train_loss: 0.5408, test_loss: 0.8790, test_f1: 0.6797
 epoch: 95, train_loss: 0.5407, test_loss: 0.7693, test_f1: 0.6798
 epoch: 96, train_loss: 0.5344, test_loss: 0.9195, test_f1: 0.6594
 epoch: 97, train_loss: 0.5375, test_loss: 0.8455, test_f1: 0.6709
 epoch: 98, train_loss: 0.5358, test_loss: 0.8063, test_f1: 0.6737
 epoch: 99, train_loss: 0.5271, test_loss: 0.8058, test_f1: 0.6728
##################ITERATION #8 ****************************************
 epoch: 0, train_loss: 1.1150, test_loss: 1.0624, test_f1: 0.3503
 epoch: 1, train_loss: 0.9875, test_loss: 1.0555, test_f1: 0.4694
 epoch: 2, train_loss: 0.9605, test_loss: 1.0505, test_f1: 0.4873
 epoch: 3, train_loss: 0.9448, test_loss: 1.0024, test_f1: 0.5194
 epoch: 4, train_loss: 0.9231, test_loss: 1.1025, test_f1: 0.4691
 epoch: 5, train_loss: 0.9065, test_loss: 1.0130, test_f1: 0.5261
 epoch: 6, train_loss: 0.9032, test_loss: 1.1357, test_f1: 0.4684
 epoch: 7, train_loss: 0.8806, test_loss: 0.9448, test_f1: 0.5458
 epoch: 8, train_loss: 0.8745, test_loss: 0.9180, test_f1: 0.5681
 epoch: 9, train_loss: 0.8600, test_loss: 0.9622, test_f1: 0.5540
 epoch: 10, train_loss: 0.8531, test_loss: 0.9447, test_f1: 0.5494
 epoch: 11, train_loss: 0.8523, test_loss: 1.1568, test_f1: 0.5477
 epoch: 12, train_loss: 0.8548, test_loss: 0.9262, test_f1: 0.5218
 epoch: 13, train_loss: 0.8310, test_loss: 0.9233, test_f1: 0.5246
 epoch: 14, train_loss: 0.8380, test_loss: 0.9490, test_f1: 0.5468
 epoch: 15, train_loss: 0.8128, test_loss: 0.8657, test_f1: 0.5772
 epoch: 16, train_loss: 0.8162, test_loss: 0.8949, test_f1: 0.5773
 epoch: 17, train_loss: 0.8299, test_loss: 0.9160, test_f1: 0.5360
 epoch: 18, train_loss: 0.8034, test_loss: 0.9757, test_f1: 0.5835
 epoch: 19, train_loss: 0.8026, test_loss: 0.9620, test_f1: 0.5590
 epoch: 20, train_loss: 0.7930, test_loss: 0.9723, test_f1: 0.5365
 epoch: 21, train_loss: 0.7803, test_loss: 0.9672, test_f1: 0.5836
 epoch: 22, train_loss: 0.7957, test_loss: 0.9739, test_f1: 0.5739
 epoch: 23, train_loss: 0.7780, test_loss: 0.9453, test_f1: 0.6054
 epoch: 24, train_loss: 0.7760, test_loss: 1.0766, test_f1: 0.5727
 epoch: 25, train_loss: 0.7886, test_loss: 0.8495, test_f1: 0.6319
 epoch: 26, train_loss: 0.7735, test_loss: 0.8930, test_f1: 0.6010
 epoch: 27, train_loss: 0.7841, test_loss: 0.9699, test_f1: 0.6168
 epoch: 28, train_loss: 0.7664, test_loss: 0.9723, test_f1: 0.5920
 epoch: 29, train_loss: 0.7696, test_loss: 0.9296, test_f1: 0.5945
 epoch: 30, train_loss: 0.7748, test_loss: 1.1454, test_f1: 0.5479
 epoch: 31, train_loss: 0.7473, test_loss: 0.9499, test_f1: 0.6225
 epoch: 32, train_loss: 0.7411, test_loss: 0.9576, test_f1: 0.6167
 epoch: 33, train_loss: 0.7407, test_loss: 1.0496, test_f1: 0.4930
 epoch: 34, train_loss: 0.7434, test_loss: 0.9345, test_f1: 0.6154
 epoch: 35, train_loss: 0.7206, test_loss: 0.9461, test_f1: 0.5911
 epoch: 36, train_loss: 0.7335, test_loss: 0.9718, test_f1: 0.6311
 epoch: 37, train_loss: 0.7481, test_loss: 1.0459, test_f1: 0.5899
 epoch: 38, train_loss: 0.7253, test_loss: 1.2170, test_f1: 0.6154
 epoch: 39, train_loss: 0.7114, test_loss: 1.0793, test_f1: 0.5823
 epoch: 40, train_loss: 0.7058, test_loss: 1.0288, test_f1: 0.6447
 epoch: 41, train_loss: 0.7060, test_loss: 1.1839, test_f1: 0.6588
 epoch: 42, train_loss: 0.7186, test_loss: 0.9638, test_f1: 0.6625
 epoch: 43, train_loss: 0.7075, test_loss: 1.1357, test_f1: 0.6130
 epoch: 44, train_loss: 0.7108, test_loss: 1.2413, test_f1: 0.6226
 epoch: 45, train_loss: 0.7178, test_loss: 1.1392, test_f1: 0.6213
 epoch: 46, train_loss: 0.6908, test_loss: 1.1752, test_f1: 0.6460
 epoch: 47, train_loss: 0.7010, test_loss: 1.2747, test_f1: 0.6464
 epoch: 48, train_loss: 0.6876, test_loss: 1.6645, test_f1: 0.5698
 epoch: 49, train_loss: 0.6961, test_loss: 1.4951, test_f1: 0.6321
 epoch: 50, train_loss: 0.6779, test_loss: 1.4723, test_f1: 0.6365
 epoch: 51, train_loss: 0.6638, test_loss: 1.3134, test_f1: 0.6640
 epoch: 52, train_loss: 0.6281, test_loss: 1.4634, test_f1: 0.6416
 epoch: 53, train_loss: 0.6401, test_loss: 1.5119, test_f1: 0.6713
 epoch: 54, train_loss: 0.6140, test_loss: 1.4994, test_f1: 0.6261
 epoch: 55, train_loss: 0.6261, test_loss: 1.4168, test_f1: 0.6461
 epoch: 56, train_loss: 0.6255, test_loss: 1.2774, test_f1: 0.6535
 epoch: 57, train_loss: 0.6292, test_loss: 1.4389, test_f1: 0.6814
 epoch: 58, train_loss: 0.6325, test_loss: 1.4731, test_f1: 0.6479
 epoch: 59, train_loss: 0.6213, test_loss: 1.5506, test_f1: 0.6875
 epoch: 60, train_loss: 0.6210, test_loss: 1.5558, test_f1: 0.6576
 epoch: 61, train_loss: 0.6149, test_loss: 1.4885, test_f1: 0.6410
 epoch: 62, train_loss: 0.6074, test_loss: 1.5249, test_f1: 0.6423
 epoch: 63, train_loss: 0.6078, test_loss: 1.5476, test_f1: 0.6774
 epoch: 64, train_loss: 0.6268, test_loss: 1.5218, test_f1: 0.6396
 epoch: 65, train_loss: 0.5936, test_loss: 1.6669, test_f1: 0.6724
 epoch: 66, train_loss: 0.5964, test_loss: 1.5282, test_f1: 0.6628
 epoch: 67, train_loss: 0.5886, test_loss: 1.3557, test_f1: 0.6669
 epoch: 68, train_loss: 0.5763, test_loss: 1.7470, test_f1: 0.6834
 epoch: 69, train_loss: 0.5926, test_loss: 1.6707, test_f1: 0.6584
 epoch: 70, train_loss: 0.6003, test_loss: 1.5401, test_f1: 0.6610
 epoch: 71, train_loss: 0.5890, test_loss: 1.8813, test_f1: 0.6668
 epoch: 72, train_loss: 0.5846, test_loss: 1.5972, test_f1: 0.6586
 epoch: 73, train_loss: 0.5800, test_loss: 2.1653, test_f1: 0.6761
 epoch: 74, train_loss: 0.6224, test_loss: 1.1177, test_f1: 0.6593
 epoch: 75, train_loss: 0.5805, test_loss: 1.3837, test_f1: 0.6802
 epoch: 76, train_loss: 0.5895, test_loss: 1.4832, test_f1: 0.6602
 epoch: 77, train_loss: 0.5838, test_loss: 1.4333, test_f1: 0.6739
 epoch: 78, train_loss: 0.5672, test_loss: 1.6343, test_f1: 0.6772
 epoch: 79, train_loss: 0.5855, test_loss: 1.6732, test_f1: 0.6769
 epoch: 80, train_loss: 0.5711, test_loss: 1.5309, test_f1: 0.6793
 epoch: 81, train_loss: 0.5647, test_loss: 1.5538, test_f1: 0.6772
 epoch: 82, train_loss: 0.5516, test_loss: 1.8140, test_f1: 0.6672
 epoch: 83, train_loss: 0.5755, test_loss: 1.7695, test_f1: 0.6869
 epoch: 84, train_loss: 0.5834, test_loss: 1.6810, test_f1: 0.6939
 epoch: 85, train_loss: 0.5752, test_loss: 1.6851, test_f1: 0.6469
 epoch: 86, train_loss: 0.5526, test_loss: 1.6525, test_f1: 0.6756
 epoch: 87, train_loss: 0.5512, test_loss: 1.7993, test_f1: 0.6579
 epoch: 88, train_loss: 0.5575, test_loss: 1.5905, test_f1: 0.6684
 epoch: 89, train_loss: 0.5418, test_loss: 1.7588, test_f1: 0.6364
 epoch: 90, train_loss: 0.5579, test_loss: 1.5427, test_f1: 0.6739
 epoch: 91, train_loss: 0.5512, test_loss: 1.5542, test_f1: 0.6635
 epoch: 92, train_loss: 0.5456, test_loss: 1.4766, test_f1: 0.6736
 epoch: 93, train_loss: 0.5566, test_loss: 1.3565, test_f1: 0.6646
 epoch: 94, train_loss: 0.5515, test_loss: 1.4729, test_f1: 0.6786
 epoch: 95, train_loss: 0.5655, test_loss: 1.3535, test_f1: 0.6617
 epoch: 96, train_loss: 0.5608, test_loss: 1.5280, test_f1: 0.6502
 epoch: 97, train_loss: 0.5335, test_loss: 1.4316, test_f1: 0.6582
 epoch: 98, train_loss: 0.5498, test_loss: 1.3988, test_f1: 0.6833
 epoch: 99, train_loss: 0.5389, test_loss: 1.4459, test_f1: 0.6587
##################ITERATION #9 ****************************************
 epoch: 0, train_loss: 1.1254, test_loss: 0.9932, test_f1: 0.5091
 epoch: 1, train_loss: 0.9977, test_loss: 0.9662, test_f1: 0.5104
 epoch: 2, train_loss: 0.9703, test_loss: 1.2783, test_f1: 0.4393
 epoch: 3, train_loss: 0.9510, test_loss: 0.9322, test_f1: 0.5109
 epoch: 4, train_loss: 0.9399, test_loss: 0.9247, test_f1: 0.4829
 epoch: 5, train_loss: 0.9083, test_loss: 0.9128, test_f1: 0.5255
 epoch: 6, train_loss: 0.8931, test_loss: 0.8954, test_f1: 0.5026
 epoch: 7, train_loss: 0.8814, test_loss: 0.8836, test_f1: 0.5901
 epoch: 8, train_loss: 0.8775, test_loss: 0.8575, test_f1: 0.5719
 epoch: 9, train_loss: 0.8609, test_loss: 0.9439, test_f1: 0.5473
 epoch: 10, train_loss: 0.8692, test_loss: 0.8769, test_f1: 0.5536
 epoch: 11, train_loss: 0.8608, test_loss: 0.8150, test_f1: 0.5122
 epoch: 12, train_loss: 0.8402, test_loss: 0.7793, test_f1: 0.5428
 epoch: 13, train_loss: 0.8413, test_loss: 0.9224, test_f1: 0.5306
 epoch: 14, train_loss: 0.8191, test_loss: 0.9237, test_f1: 0.5353
 epoch: 15, train_loss: 0.8408, test_loss: 0.9419, test_f1: 0.5262
 epoch: 16, train_loss: 0.8078, test_loss: 0.7854, test_f1: 0.6155
 epoch: 17, train_loss: 0.8004, test_loss: 0.8653, test_f1: 0.6008
 epoch: 18, train_loss: 0.8115, test_loss: 0.8627, test_f1: 0.5935
 epoch: 19, train_loss: 0.8066, test_loss: 0.9893, test_f1: 0.5578
 epoch: 20, train_loss: 0.7966, test_loss: 0.8376, test_f1: 0.5788
 epoch: 21, train_loss: 0.7889, test_loss: 0.8180, test_f1: 0.5904
 epoch: 22, train_loss: 0.7930, test_loss: 0.8435, test_f1: 0.5715
 epoch: 23, train_loss: 0.7796, test_loss: 0.8461, test_f1: 0.6077
 epoch: 24, train_loss: 0.7810, test_loss: 0.8193, test_f1: 0.6173
 epoch: 25, train_loss: 0.7652, test_loss: 0.9108, test_f1: 0.5769
 epoch: 26, train_loss: 0.7798, test_loss: 0.8221, test_f1: 0.6007
 epoch: 27, train_loss: 0.7634, test_loss: 0.8232, test_f1: 0.6135
 epoch: 28, train_loss: 0.7756, test_loss: 0.9261, test_f1: 0.5875
 epoch: 29, train_loss: 0.7813, test_loss: 0.9105, test_f1: 0.6163
 epoch: 30, train_loss: 0.7668, test_loss: 0.9646, test_f1: 0.5952
 epoch: 31, train_loss: 0.7515, test_loss: 0.8804, test_f1: 0.6112
 epoch: 32, train_loss: 0.7536, test_loss: 0.8278, test_f1: 0.5962
 epoch: 33, train_loss: 0.7501, test_loss: 0.8388, test_f1: 0.5813
 epoch: 34, train_loss: 0.7357, test_loss: 0.8566, test_f1: 0.5688
 epoch: 35, train_loss: 0.7534, test_loss: 0.8724, test_f1: 0.6109
 epoch: 36, train_loss: 0.7528, test_loss: 0.8594, test_f1: 0.5922
 epoch: 37, train_loss: 0.7466, test_loss: 0.8882, test_f1: 0.6070
 epoch: 38, train_loss: 0.7404, test_loss: 0.8955, test_f1: 0.6251
 epoch: 39, train_loss: 0.7439, test_loss: 0.8399, test_f1: 0.6359
 epoch: 40, train_loss: 0.7250, test_loss: 0.8676, test_f1: 0.6499
 epoch: 41, train_loss: 0.7114, test_loss: 0.9257, test_f1: 0.5746
 epoch: 42, train_loss: 0.7489, test_loss: 0.8624, test_f1: 0.6210
 epoch: 43, train_loss: 0.7318, test_loss: 0.9287, test_f1: 0.6255
 epoch: 44, train_loss: 0.7240, test_loss: 0.8916, test_f1: 0.5818
 epoch: 45, train_loss: 0.7224, test_loss: 0.8577, test_f1: 0.6439
 epoch: 46, train_loss: 0.7343, test_loss: 0.8514, test_f1: 0.6468
 epoch: 47, train_loss: 0.7236, test_loss: 0.8886, test_f1: 0.6376
 epoch: 48, train_loss: 0.7017, test_loss: 0.8121, test_f1: 0.6551
 epoch: 49, train_loss: 0.7137, test_loss: 0.9661, test_f1: 0.5740
 epoch: 50, train_loss: 0.7116, test_loss: 0.9115, test_f1: 0.6127
 epoch: 51, train_loss: 0.6822, test_loss: 0.8497, test_f1: 0.6396
 epoch: 52, train_loss: 0.6687, test_loss: 0.8177, test_f1: 0.6734
 epoch: 53, train_loss: 0.6912, test_loss: 0.8374, test_f1: 0.6516
 epoch: 54, train_loss: 0.6668, test_loss: 0.8580, test_f1: 0.6367
 epoch: 55, train_loss: 0.6589, test_loss: 0.8793, test_f1: 0.6640
 epoch: 56, train_loss: 0.6626, test_loss: 0.8905, test_f1: 0.6412
 epoch: 57, train_loss: 0.6526, test_loss: 0.9741, test_f1: 0.6381
 epoch: 58, train_loss: 0.6485, test_loss: 0.8842, test_f1: 0.6651
 epoch: 59, train_loss: 0.6551, test_loss: 0.9913, test_f1: 0.6444
 epoch: 60, train_loss: 0.6560, test_loss: 0.9738, test_f1: 0.6627
 epoch: 61, train_loss: 0.6688, test_loss: 0.7874, test_f1: 0.6572
 epoch: 62, train_loss: 0.6378, test_loss: 0.8291, test_f1: 0.6754
 epoch: 63, train_loss: 0.6460, test_loss: 0.7963, test_f1: 0.6507
 epoch: 64, train_loss: 0.6572, test_loss: 0.8220, test_f1: 0.6409
 epoch: 65, train_loss: 0.6370, test_loss: 1.1476, test_f1: 0.6191
 epoch: 66, train_loss: 0.6581, test_loss: 0.8016, test_f1: 0.6760
 epoch: 67, train_loss: 0.6250, test_loss: 0.7958, test_f1: 0.6651
 epoch: 68, train_loss: 0.6435, test_loss: 0.8518, test_f1: 0.6734
 epoch: 69, train_loss: 0.6374, test_loss: 0.8422, test_f1: 0.6684
 epoch: 70, train_loss: 0.6387, test_loss: 0.8764, test_f1: 0.6661
 epoch: 71, train_loss: 0.6192, test_loss: 0.8523, test_f1: 0.6898
 epoch: 72, train_loss: 0.6335, test_loss: 0.8064, test_f1: 0.6616
 epoch: 73, train_loss: 0.6063, test_loss: 0.9492, test_f1: 0.6752
 epoch: 74, train_loss: 0.6336, test_loss: 0.9231, test_f1: 0.6540
 epoch: 75, train_loss: 0.6252, test_loss: 0.8542, test_f1: 0.6710
 epoch: 76, train_loss: 0.6182, test_loss: 0.9007, test_f1: 0.6850
 epoch: 77, train_loss: 0.6262, test_loss: 0.9862, test_f1: 0.6768
 epoch: 78, train_loss: 0.6332, test_loss: 0.8776, test_f1: 0.6508
 epoch: 79, train_loss: 0.6285, test_loss: 0.8166, test_f1: 0.6913
 epoch: 80, train_loss: 0.6336, test_loss: 0.8802, test_f1: 0.6926
 epoch: 81, train_loss: 0.6103, test_loss: 0.9124, test_f1: 0.6541
 epoch: 82, train_loss: 0.6293, test_loss: 0.8814, test_f1: 0.6695
 epoch: 83, train_loss: 0.6115, test_loss: 0.8778, test_f1: 0.6747
 epoch: 84, train_loss: 0.6038, test_loss: 1.0277, test_f1: 0.6722
 epoch: 85, train_loss: 0.6001, test_loss: 0.9818, test_f1: 0.6626
 epoch: 86, train_loss: 0.6051, test_loss: 0.9783, test_f1: 0.6786
 epoch: 87, train_loss: 0.6034, test_loss: 1.0539, test_f1: 0.6600
 epoch: 88, train_loss: 0.5957, test_loss: 1.0039, test_f1: 0.6687
 epoch: 89, train_loss: 0.5975, test_loss: 0.9300, test_f1: 0.6859
 epoch: 90, train_loss: 0.5953, test_loss: 0.9669, test_f1: 0.6511
 epoch: 91, train_loss: 0.6089, test_loss: 0.9611, test_f1: 0.6558
 epoch: 92, train_loss: 0.5972, test_loss: 0.9576, test_f1: 0.6434
 epoch: 93, train_loss: 0.5860, test_loss: 0.9766, test_f1: 0.6532
 epoch: 94, train_loss: 0.5839, test_loss: 0.9670, test_f1: 0.6594
 epoch: 95, train_loss: 0.5830, test_loss: 0.9858, test_f1: 0.6770
 epoch: 96, train_loss: 0.5840, test_loss: 0.9230, test_f1: 0.6835
 epoch: 97, train_loss: 0.5890, test_loss: 0.9230, test_f1: 0.6695
 epoch: 98, train_loss: 0.5966, test_loss: 0.9881, test_f1: 0.6896
 epoch: 99, train_loss: 0.5953, test_loss: 1.0158, test_f1: 0.6608

Training completed in 639.03 seconds
Best F1: 0.6939 at epoch 84
Mean F1 across iterations: 0.6854  0.0072
========================FINAL RESULTS================================
FEGIN weighted F1: 0.6939  0.0072
python main.py --data ltspice_examples --representation component_pin_net --model FEGIN --layers 3 --hiddens 32 --batch_size 64 --lr 0.01 --emb_size 512 --epochs 100 --save_appendix component_pin_net_L3_H32_BS64_LR0.01_E512 --no_val
-----



STDERR:
  File "main.py", line 370, in <module>
    main()
  File "main.py", line 254, in main
    dataset = dataset_class(
  File "/home/philip/projects/ltspice_examples_code_repo/Circuit-Completion-Using-GNNs/component_classification_with_link_prediction_head/evaluation/FEGIN/kernel/circuit_datasets.py", line 15, in __init__
    self.data, self.slices = torch.load(self.processed_paths[0])
  File "/home/philip/.local/lib/python3.8/site-packages/torch/serialization.py", line 1040, in load
    warnings.warn(
  File "/usr/lib/python3.8/warnings.py", line 109, in _showwarnmsg
    sw(msg.message, msg.category, msg.filename, msg.lineno,
  File "main.py", line 47, in warn_with_traceback
    traceback.print_stack(file=log)
/home/philip/projects/ltspice_examples_code_repo/Circuit-Completion-Using-GNNs/component_classification_with_link_prediction_head/evaluation/FEGIN/kernel/circuit_datasets.py:15: FutureWarning: You are using `torch.load` with `weights_only=False` (the current default value), which uses the default pickle module implicitly. It is possible to construct malicious pickle data which will execute arbitrary code during unpickling (See https://github.com/pytorch/pytorch/blob/main/SECURITY.md#untrusted-models for more details). In a future release, the default value for `weights_only` will be flipped to `True`. This limits the functions that could be executed during unpickling. Arbitrary objects will no longer be allowed to be loaded via this mode unless they are explicitly allowlisted by the user via `torch.serialization.add_safe_globals`. We recommend you start setting `weights_only=True` for any use case where you don't have full control of the loaded file. Please open an issue on GitHub for any issues related to this experimental feature.
  self.data, self.slices = torch.load(self.processed_paths[0])
