STDOUT:
Results will be saved in /home/philip/projects/ltspice_examples_code_repo/Circuit-Completion-Using-GNNs/component_classification_with_link_prediction_head/evaluation/FEGIN/results/model_FEGIN_dataset_ltspice_examples
Command line input: python main.py --data ltspice_examples --representation component_component --model FEGIN --layers 5 --hiddens 16 --batch_size 64 --lr 0.0001 --emb_size 128 --epochs 100 --save_appendix component_component_L5_H16_BS64_LR0.0001_E128 --no_val
 is saved.
-----
ltspice_examples - FEGIN
Using 5 layers, 16 hidden units, h = 2
Loading component_component representation dataset
ENTERED
Training FEGIN on component_component representation
Train: 3556, Test: 845
##################ITERATION #0 ****************************************
 epoch: 0, train_loss: 1.4169, test_loss: 1.4148, test_f1: 0.0295
 epoch: 1, train_loss: 1.4097, test_loss: 1.4094, test_f1: 0.0295
 epoch: 2, train_loss: 1.4043, test_loss: 1.4048, test_f1: 0.0295
 epoch: 3, train_loss: 1.3991, test_loss: 1.3989, test_f1: 0.0295
 epoch: 4, train_loss: 1.3931, test_loss: 1.3931, test_f1: 0.0477
 epoch: 5, train_loss: 1.3860, test_loss: 1.3860, test_f1: 0.2291
 epoch: 6, train_loss: 1.3782, test_loss: 1.3789, test_f1: 0.2307
 epoch: 7, train_loss: 1.3697, test_loss: 1.3712, test_f1: 0.2229
 epoch: 8, train_loss: 1.3622, test_loss: 1.3642, test_f1: 0.2267
 epoch: 9, train_loss: 1.3505, test_loss: 1.3525, test_f1: 0.2249
 epoch: 10, train_loss: 1.3419, test_loss: 1.3453, test_f1: 0.2266
 epoch: 11, train_loss: 1.3340, test_loss: 1.3370, test_f1: 0.2274
 epoch: 12, train_loss: 1.3294, test_loss: 1.3301, test_f1: 0.2274
 epoch: 13, train_loss: 1.3206, test_loss: 1.3250, test_f1: 0.2274
 epoch: 14, train_loss: 1.3173, test_loss: 1.3197, test_f1: 0.2274
 epoch: 15, train_loss: 1.3105, test_loss: 1.3143, test_f1: 0.2274
 epoch: 16, train_loss: 1.3060, test_loss: 1.3085, test_f1: 0.2274
 epoch: 17, train_loss: 1.3022, test_loss: 1.3042, test_f1: 0.2274
 epoch: 18, train_loss: 1.2999, test_loss: 1.3001, test_f1: 0.2274
 epoch: 19, train_loss: 1.2955, test_loss: 1.2966, test_f1: 0.2274
 epoch: 20, train_loss: 1.2945, test_loss: 1.2927, test_f1: 0.2274
 epoch: 21, train_loss: 1.2904, test_loss: 1.2882, test_f1: 0.2274
 epoch: 22, train_loss: 1.2871, test_loss: 1.2831, test_f1: 0.2274
 epoch: 23, train_loss: 1.2848, test_loss: 1.2824, test_f1: 0.2274
 epoch: 24, train_loss: 1.2805, test_loss: 1.2797, test_f1: 0.2274
 epoch: 25, train_loss: 1.2809, test_loss: 1.2774, test_f1: 0.2274
 epoch: 26, train_loss: 1.2766, test_loss: 1.2742, test_f1: 0.2274
 epoch: 27, train_loss: 1.2741, test_loss: 1.2712, test_f1: 0.2274
 epoch: 28, train_loss: 1.2741, test_loss: 1.2684, test_f1: 0.2274
 epoch: 29, train_loss: 1.2703, test_loss: 1.2681, test_f1: 0.2274
 epoch: 30, train_loss: 1.2681, test_loss: 1.2638, test_f1: 0.2274
 epoch: 31, train_loss: 1.2667, test_loss: 1.2627, test_f1: 0.2274
 epoch: 32, train_loss: 1.2664, test_loss: 1.2572, test_f1: 0.2274
 epoch: 33, train_loss: 1.2610, test_loss: 1.2535, test_f1: 0.2274
 epoch: 34, train_loss: 1.2587, test_loss: 1.2542, test_f1: 0.2274
 epoch: 35, train_loss: 1.2580, test_loss: 1.2486, test_f1: 0.2274
 epoch: 36, train_loss: 1.2563, test_loss: 1.2447, test_f1: 0.2274
 epoch: 37, train_loss: 1.2534, test_loss: 1.2416, test_f1: 0.2274
 epoch: 38, train_loss: 1.2562, test_loss: 1.2408, test_f1: 0.2274
 epoch: 39, train_loss: 1.2441, test_loss: 1.2375, test_f1: 0.2274
 epoch: 40, train_loss: 1.2445, test_loss: 1.2365, test_f1: 0.2274
 epoch: 41, train_loss: 1.2462, test_loss: 1.2347, test_f1: 0.2274
 epoch: 42, train_loss: 1.2406, test_loss: 1.2299, test_f1: 0.2274
 epoch: 43, train_loss: 1.2396, test_loss: 1.2281, test_f1: 0.2274
 epoch: 44, train_loss: 1.2391, test_loss: 1.2290, test_f1: 0.2274
 epoch: 45, train_loss: 1.2366, test_loss: 1.2281, test_f1: 0.2274
 epoch: 46, train_loss: 1.2341, test_loss: 1.2278, test_f1: 0.2325
 epoch: 47, train_loss: 1.2352, test_loss: 1.2237, test_f1: 0.2497
 epoch: 48, train_loss: 1.2374, test_loss: 1.2184, test_f1: 0.2636
 epoch: 49, train_loss: 1.2300, test_loss: 1.2183, test_f1: 0.2658
 epoch: 50, train_loss: 1.2288, test_loss: 1.2145, test_f1: 0.2811
 epoch: 51, train_loss: 1.2264, test_loss: 1.2171, test_f1: 0.3067
 epoch: 52, train_loss: 1.2250, test_loss: 1.2134, test_f1: 0.2994
 epoch: 53, train_loss: 1.2270, test_loss: 1.2114, test_f1: 0.2905
 epoch: 54, train_loss: 1.2236, test_loss: 1.2097, test_f1: 0.2924
 epoch: 55, train_loss: 1.2230, test_loss: 1.2129, test_f1: 0.3169
 epoch: 56, train_loss: 1.2205, test_loss: 1.2097, test_f1: 0.3010
 epoch: 57, train_loss: 1.2251, test_loss: 1.2114, test_f1: 0.3171
 epoch: 58, train_loss: 1.2188, test_loss: 1.2049, test_f1: 0.3037
 epoch: 59, train_loss: 1.2147, test_loss: 1.2049, test_f1: 0.3286
 epoch: 60, train_loss: 1.2139, test_loss: 1.2030, test_f1: 0.3238
 epoch: 61, train_loss: 1.2146, test_loss: 1.2021, test_f1: 0.3276
 epoch: 62, train_loss: 1.2145, test_loss: 1.2008, test_f1: 0.3613
 epoch: 63, train_loss: 1.2131, test_loss: 1.1983, test_f1: 0.3622
 epoch: 64, train_loss: 1.2116, test_loss: 1.2001, test_f1: 0.3633
 epoch: 65, train_loss: 1.2181, test_loss: 1.1981, test_f1: 0.3822
 epoch: 66, train_loss: 1.2111, test_loss: 1.1972, test_f1: 0.3960
 epoch: 67, train_loss: 1.2090, test_loss: 1.2003, test_f1: 0.4018
 epoch: 68, train_loss: 1.2084, test_loss: 1.1959, test_f1: 0.3972
 epoch: 69, train_loss: 1.2076, test_loss: 1.1951, test_f1: 0.3878
 epoch: 70, train_loss: 1.2065, test_loss: 1.1956, test_f1: 0.4061
 epoch: 71, train_loss: 1.2151, test_loss: 1.1923, test_f1: 0.4043
 epoch: 72, train_loss: 1.2122, test_loss: 1.1936, test_f1: 0.4112
 epoch: 73, train_loss: 1.2073, test_loss: 1.1904, test_f1: 0.4159
 epoch: 74, train_loss: 1.2099, test_loss: 1.1905, test_f1: 0.4050
 epoch: 75, train_loss: 1.2078, test_loss: 1.1874, test_f1: 0.4084
 epoch: 76, train_loss: 1.2045, test_loss: 1.1865, test_f1: 0.4119
 epoch: 77, train_loss: 1.2103, test_loss: 1.1876, test_f1: 0.4147
 epoch: 78, train_loss: 1.2057, test_loss: 1.1864, test_f1: 0.4170
 epoch: 79, train_loss: 1.2016, test_loss: 1.1875, test_f1: 0.4204
 epoch: 80, train_loss: 1.2034, test_loss: 1.1833, test_f1: 0.4182
 epoch: 81, train_loss: 1.2079, test_loss: 1.1835, test_f1: 0.4201
 epoch: 82, train_loss: 1.2028, test_loss: 1.1862, test_f1: 0.4202
 epoch: 83, train_loss: 1.2005, test_loss: 1.1832, test_f1: 0.4214
 epoch: 84, train_loss: 1.2014, test_loss: 1.1823, test_f1: 0.4191
 epoch: 85, train_loss: 1.2002, test_loss: 1.1789, test_f1: 0.4253
 epoch: 86, train_loss: 1.1996, test_loss: 1.1795, test_f1: 0.4224
 epoch: 87, train_loss: 1.1897, test_loss: 1.1787, test_f1: 0.4208
 epoch: 88, train_loss: 1.1968, test_loss: 1.1813, test_f1: 0.4254
 epoch: 89, train_loss: 1.1948, test_loss: 1.1774, test_f1: 0.4314
 epoch: 90, train_loss: 1.1913, test_loss: 1.1755, test_f1: 0.4347
 epoch: 91, train_loss: 1.1935, test_loss: 1.1768, test_f1: 0.4288
 epoch: 92, train_loss: 1.1885, test_loss: 1.1775, test_f1: 0.4284
 epoch: 93, train_loss: 1.1885, test_loss: 1.1737, test_f1: 0.4181
 epoch: 94, train_loss: 1.1928, test_loss: 1.1735, test_f1: 0.4284
 epoch: 95, train_loss: 1.1911, test_loss: 1.1743, test_f1: 0.4328
 epoch: 96, train_loss: 1.1875, test_loss: 1.1703, test_f1: 0.4284
 epoch: 97, train_loss: 1.1847, test_loss: 1.1705, test_f1: 0.4359
 epoch: 98, train_loss: 1.1842, test_loss: 1.1709, test_f1: 0.4328
 epoch: 99, train_loss: 1.1830, test_loss: 1.1696, test_f1: 0.4389
##################ITERATION #1 ****************************************
 epoch: 0, train_loss: 1.3495, test_loss: 1.3413, test_f1: 0.2274
 epoch: 1, train_loss: 1.3383, test_loss: 1.3315, test_f1: 0.2274
 epoch: 2, train_loss: 1.3324, test_loss: 1.3254, test_f1: 0.2274
 epoch: 3, train_loss: 1.3257, test_loss: 1.3181, test_f1: 0.2274
 epoch: 4, train_loss: 1.3186, test_loss: 1.3114, test_f1: 0.2274
 epoch: 5, train_loss: 1.3121, test_loss: 1.3055, test_f1: 0.2274
 epoch: 6, train_loss: 1.3047, test_loss: 1.3019, test_f1: 0.2274
 epoch: 7, train_loss: 1.2995, test_loss: 1.2942, test_f1: 0.2274
 epoch: 8, train_loss: 1.2953, test_loss: 1.2898, test_f1: 0.2274
 epoch: 9, train_loss: 1.2921, test_loss: 1.2848, test_f1: 0.2274
 epoch: 10, train_loss: 1.2882, test_loss: 1.2797, test_f1: 0.2274
 epoch: 11, train_loss: 1.2834, test_loss: 1.2770, test_f1: 0.2274
 epoch: 12, train_loss: 1.2811, test_loss: 1.2737, test_f1: 0.2274
 epoch: 13, train_loss: 1.2747, test_loss: 1.2691, test_f1: 0.2274
 epoch: 14, train_loss: 1.2755, test_loss: 1.2665, test_f1: 0.2274
 epoch: 15, train_loss: 1.2739, test_loss: 1.2649, test_f1: 0.2274
 epoch: 16, train_loss: 1.2706, test_loss: 1.2647, test_f1: 0.2274
 epoch: 17, train_loss: 1.2710, test_loss: 1.2655, test_f1: 0.2274
 epoch: 18, train_loss: 1.2706, test_loss: 1.2594, test_f1: 0.2274
 epoch: 19, train_loss: 1.2660, test_loss: 1.2560, test_f1: 0.2274
 epoch: 20, train_loss: 1.2646, test_loss: 1.2558, test_f1: 0.2274
 epoch: 21, train_loss: 1.2633, test_loss: 1.2538, test_f1: 0.2274
 epoch: 22, train_loss: 1.2601, test_loss: 1.2489, test_f1: 0.2274
 epoch: 23, train_loss: 1.2636, test_loss: 1.2494, test_f1: 0.2274
 epoch: 24, train_loss: 1.2588, test_loss: 1.2483, test_f1: 0.2274
 epoch: 25, train_loss: 1.2618, test_loss: 1.2453, test_f1: 0.2274
 epoch: 26, train_loss: 1.2531, test_loss: 1.2429, test_f1: 0.2274
 epoch: 27, train_loss: 1.2557, test_loss: 1.2404, test_f1: 0.2274
 epoch: 28, train_loss: 1.2562, test_loss: 1.2391, test_f1: 0.2274
 epoch: 29, train_loss: 1.2518, test_loss: 1.2393, test_f1: 0.2274
 epoch: 30, train_loss: 1.2514, test_loss: 1.2381, test_f1: 0.2274
 epoch: 31, train_loss: 1.2495, test_loss: 1.2370, test_f1: 0.2274
 epoch: 32, train_loss: 1.2461, test_loss: 1.2343, test_f1: 0.2276
 epoch: 33, train_loss: 1.2465, test_loss: 1.2306, test_f1: 0.2395
 epoch: 34, train_loss: 1.2480, test_loss: 1.2273, test_f1: 0.2276
 epoch: 35, train_loss: 1.2454, test_loss: 1.2289, test_f1: 0.2555
 epoch: 36, train_loss: 1.2441, test_loss: 1.2286, test_f1: 0.2647
 epoch: 37, train_loss: 1.2409, test_loss: 1.2273, test_f1: 0.2674
 epoch: 38, train_loss: 1.2378, test_loss: 1.2236, test_f1: 0.2679
 epoch: 39, train_loss: 1.2414, test_loss: 1.2215, test_f1: 0.2785
 epoch: 40, train_loss: 1.2353, test_loss: 1.2215, test_f1: 0.2821
 epoch: 41, train_loss: 1.2406, test_loss: 1.2231, test_f1: 0.2833
 epoch: 42, train_loss: 1.2357, test_loss: 1.2193, test_f1: 0.2759
 epoch: 43, train_loss: 1.2391, test_loss: 1.2193, test_f1: 0.2863
 epoch: 44, train_loss: 1.2344, test_loss: 1.2150, test_f1: 0.2979
 epoch: 45, train_loss: 1.2361, test_loss: 1.2175, test_f1: 0.3121
 epoch: 46, train_loss: 1.2306, test_loss: 1.2158, test_f1: 0.3259
 epoch: 47, train_loss: 1.2323, test_loss: 1.2155, test_f1: 0.3250
 epoch: 48, train_loss: 1.2331, test_loss: 1.2114, test_f1: 0.3272
 epoch: 49, train_loss: 1.2332, test_loss: 1.2106, test_f1: 0.3378
 epoch: 50, train_loss: 1.2261, test_loss: 1.2105, test_f1: 0.3457
 epoch: 51, train_loss: 1.2277, test_loss: 1.2081, test_f1: 0.3489
 epoch: 52, train_loss: 1.2282, test_loss: 1.2091, test_f1: 0.3498
 epoch: 53, train_loss: 1.2285, test_loss: 1.2081, test_f1: 0.3545
 epoch: 54, train_loss: 1.2296, test_loss: 1.2100, test_f1: 0.3561
 epoch: 55, train_loss: 1.2223, test_loss: 1.2074, test_f1: 0.3543
 epoch: 56, train_loss: 1.2286, test_loss: 1.2052, test_f1: 0.3501
 epoch: 57, train_loss: 1.2249, test_loss: 1.2045, test_f1: 0.3466
 epoch: 58, train_loss: 1.2236, test_loss: 1.2038, test_f1: 0.3528
 epoch: 59, train_loss: 1.2216, test_loss: 1.2083, test_f1: 0.3571
 epoch: 60, train_loss: 1.2249, test_loss: 1.2071, test_f1: 0.3507
 epoch: 61, train_loss: 1.2228, test_loss: 1.2067, test_f1: 0.3563
 epoch: 62, train_loss: 1.2228, test_loss: 1.2050, test_f1: 0.3510
 epoch: 63, train_loss: 1.2270, test_loss: 1.2069, test_f1: 0.3458
 epoch: 64, train_loss: 1.2197, test_loss: 1.2026, test_f1: 0.3432
 epoch: 65, train_loss: 1.2210, test_loss: 1.2042, test_f1: 0.3455
 epoch: 66, train_loss: 1.2197, test_loss: 1.2049, test_f1: 0.3530
 epoch: 67, train_loss: 1.2243, test_loss: 1.2041, test_f1: 0.3450
 epoch: 68, train_loss: 1.2226, test_loss: 1.2011, test_f1: 0.3406
 epoch: 69, train_loss: 1.2186, test_loss: 1.2001, test_f1: 0.3480
 epoch: 70, train_loss: 1.2228, test_loss: 1.2004, test_f1: 0.3431
 epoch: 71, train_loss: 1.2121, test_loss: 1.2016, test_f1: 0.3426
 epoch: 72, train_loss: 1.2145, test_loss: 1.2033, test_f1: 0.3444
 epoch: 73, train_loss: 1.2175, test_loss: 1.2018, test_f1: 0.3449
 epoch: 74, train_loss: 1.2151, test_loss: 1.1965, test_f1: 0.3459
 epoch: 75, train_loss: 1.2102, test_loss: 1.2003, test_f1: 0.3450
 epoch: 76, train_loss: 1.2101, test_loss: 1.1966, test_f1: 0.3408
 epoch: 77, train_loss: 1.2158, test_loss: 1.1970, test_f1: 0.3457
 epoch: 78, train_loss: 1.2179, test_loss: 1.1991, test_f1: 0.3453
 epoch: 79, train_loss: 1.2124, test_loss: 1.1963, test_f1: 0.3426
 epoch: 80, train_loss: 1.2127, test_loss: 1.1967, test_f1: 0.3493
 epoch: 81, train_loss: 1.2161, test_loss: 1.1966, test_f1: 0.3409
 epoch: 82, train_loss: 1.2136, test_loss: 1.1956, test_f1: 0.3474
 epoch: 83, train_loss: 1.2114, test_loss: 1.1916, test_f1: 0.3432
 epoch: 84, train_loss: 1.2123, test_loss: 1.1914, test_f1: 0.3417
 epoch: 85, train_loss: 1.2127, test_loss: 1.1924, test_f1: 0.3458
 epoch: 86, train_loss: 1.2137, test_loss: 1.1960, test_f1: 0.3479
 epoch: 87, train_loss: 1.2059, test_loss: 1.1941, test_f1: 0.3456
 epoch: 88, train_loss: 1.2086, test_loss: 1.1885, test_f1: 0.3456
 epoch: 89, train_loss: 1.2085, test_loss: 1.1915, test_f1: 0.3459
 epoch: 90, train_loss: 1.2070, test_loss: 1.1904, test_f1: 0.3461
 epoch: 91, train_loss: 1.2041, test_loss: 1.1880, test_f1: 0.3459
 epoch: 92, train_loss: 1.2122, test_loss: 1.1890, test_f1: 0.3422
 epoch: 93, train_loss: 1.2061, test_loss: 1.1913, test_f1: 0.3480
 epoch: 94, train_loss: 1.2079, test_loss: 1.1883, test_f1: 0.3469
 epoch: 95, train_loss: 1.2109, test_loss: 1.1907, test_f1: 0.3433
 epoch: 96, train_loss: 1.2135, test_loss: 1.1885, test_f1: 0.3419
 epoch: 97, train_loss: 1.2039, test_loss: 1.1880, test_f1: 0.3426
 epoch: 98, train_loss: 1.1990, test_loss: 1.1884, test_f1: 0.3491
 epoch: 99, train_loss: 1.2088, test_loss: 1.1863, test_f1: 0.3426
##################ITERATION #2 ****************************************
 epoch: 0, train_loss: 1.3194, test_loss: 1.3257, test_f1: 0.2274
 epoch: 1, train_loss: 1.3117, test_loss: 1.3212, test_f1: 0.2274
 epoch: 2, train_loss: 1.3090, test_loss: 1.3164, test_f1: 0.2274
 epoch: 3, train_loss: 1.3024, test_loss: 1.3120, test_f1: 0.2274
 epoch: 4, train_loss: 1.2977, test_loss: 1.3069, test_f1: 0.2274
 epoch: 5, train_loss: 1.2926, test_loss: 1.3056, test_f1: 0.2274
 epoch: 6, train_loss: 1.2911, test_loss: 1.2999, test_f1: 0.2274
 epoch: 7, train_loss: 1.2849, test_loss: 1.2956, test_f1: 0.2274
 epoch: 8, train_loss: 1.2830, test_loss: 1.2921, test_f1: 0.2274
 epoch: 9, train_loss: 1.2792, test_loss: 1.2877, test_f1: 0.2274
 epoch: 10, train_loss: 1.2745, test_loss: 1.2858, test_f1: 0.2274
 epoch: 11, train_loss: 1.2719, test_loss: 1.2795, test_f1: 0.2274
 epoch: 12, train_loss: 1.2717, test_loss: 1.2804, test_f1: 0.2274
 epoch: 13, train_loss: 1.2687, test_loss: 1.2777, test_f1: 0.2274
 epoch: 14, train_loss: 1.2639, test_loss: 1.2730, test_f1: 0.2274
 epoch: 15, train_loss: 1.2620, test_loss: 1.2729, test_f1: 0.2274
 epoch: 16, train_loss: 1.2583, test_loss: 1.2649, test_f1: 0.2274
 epoch: 17, train_loss: 1.2562, test_loss: 1.2632, test_f1: 0.2274
 epoch: 18, train_loss: 1.2493, test_loss: 1.2604, test_f1: 0.2274
 epoch: 19, train_loss: 1.2524, test_loss: 1.2558, test_f1: 0.2274
 epoch: 20, train_loss: 1.2491, test_loss: 1.2527, test_f1: 0.2274
 epoch: 21, train_loss: 1.2466, test_loss: 1.2513, test_f1: 0.2274
 epoch: 22, train_loss: 1.2466, test_loss: 1.2502, test_f1: 0.2276
 epoch: 23, train_loss: 1.2456, test_loss: 1.2473, test_f1: 0.2402
 epoch: 24, train_loss: 1.2428, test_loss: 1.2454, test_f1: 0.2401
 epoch: 25, train_loss: 1.2415, test_loss: 1.2410, test_f1: 0.2395
 epoch: 26, train_loss: 1.2416, test_loss: 1.2416, test_f1: 0.2397
 epoch: 27, train_loss: 1.2422, test_loss: 1.2378, test_f1: 0.2392
 epoch: 28, train_loss: 1.2362, test_loss: 1.2346, test_f1: 0.2395
 epoch: 29, train_loss: 1.2343, test_loss: 1.2346, test_f1: 0.2397
 epoch: 30, train_loss: 1.2239, test_loss: 1.2304, test_f1: 0.2397
 epoch: 31, train_loss: 1.2287, test_loss: 1.2270, test_f1: 0.2382
 epoch: 32, train_loss: 1.2266, test_loss: 1.2275, test_f1: 0.2398
 epoch: 33, train_loss: 1.2254, test_loss: 1.2236, test_f1: 0.2384
 epoch: 34, train_loss: 1.2257, test_loss: 1.2231, test_f1: 0.2382
 epoch: 35, train_loss: 1.2252, test_loss: 1.2218, test_f1: 0.2408
 epoch: 36, train_loss: 1.2227, test_loss: 1.2199, test_f1: 0.2515
 epoch: 37, train_loss: 1.2136, test_loss: 1.2182, test_f1: 0.2578
 epoch: 38, train_loss: 1.2179, test_loss: 1.2121, test_f1: 0.2803
 epoch: 39, train_loss: 1.2168, test_loss: 1.2112, test_f1: 0.2994
 epoch: 40, train_loss: 1.2126, test_loss: 1.2090, test_f1: 0.3075
 epoch: 41, train_loss: 1.2086, test_loss: 1.2067, test_f1: 0.3010
 epoch: 42, train_loss: 1.2102, test_loss: 1.2027, test_f1: 0.3134
 epoch: 43, train_loss: 1.2113, test_loss: 1.2039, test_f1: 0.3024
 epoch: 44, train_loss: 1.2066, test_loss: 1.2001, test_f1: 0.3159
 epoch: 45, train_loss: 1.2023, test_loss: 1.2008, test_f1: 0.3176
 epoch: 46, train_loss: 1.2043, test_loss: 1.1961, test_f1: 0.3270
 epoch: 47, train_loss: 1.2010, test_loss: 1.1975, test_f1: 0.3334
 epoch: 48, train_loss: 1.2018, test_loss: 1.1904, test_f1: 0.3317
 epoch: 49, train_loss: 1.1977, test_loss: 1.1983, test_f1: 0.3255
 epoch: 50, train_loss: 1.1970, test_loss: 1.1810, test_f1: 0.3440
 epoch: 51, train_loss: 1.2000, test_loss: 1.1892, test_f1: 0.3343
 epoch: 52, train_loss: 1.1971, test_loss: 1.1798, test_f1: 0.3424
 epoch: 53, train_loss: 1.1922, test_loss: 1.1835, test_f1: 0.3563
 epoch: 54, train_loss: 1.1957, test_loss: 1.1822, test_f1: 0.3443
 epoch: 55, train_loss: 1.1910, test_loss: 1.1848, test_f1: 0.3427
 epoch: 56, train_loss: 1.1891, test_loss: 1.1810, test_f1: 0.3465
 epoch: 57, train_loss: 1.1987, test_loss: 1.1840, test_f1: 0.3450
 epoch: 58, train_loss: 1.1944, test_loss: 1.1791, test_f1: 0.3604
 epoch: 59, train_loss: 1.1908, test_loss: 1.1861, test_f1: 0.3541
 epoch: 60, train_loss: 1.1879, test_loss: 1.1894, test_f1: 0.3678
 epoch: 61, train_loss: 1.1884, test_loss: 1.1834, test_f1: 0.3461
 epoch: 62, train_loss: 1.1909, test_loss: 1.1775, test_f1: 0.3578
 epoch: 63, train_loss: 1.1835, test_loss: 1.1817, test_f1: 0.3560
 epoch: 64, train_loss: 1.1846, test_loss: 1.1812, test_f1: 0.3616
 epoch: 65, train_loss: 1.1862, test_loss: 1.1759, test_f1: 0.3529
 epoch: 66, train_loss: 1.1892, test_loss: 1.1921, test_f1: 0.3439
 epoch: 67, train_loss: 1.1827, test_loss: 1.1832, test_f1: 0.3576
 epoch: 68, train_loss: 1.1865, test_loss: 1.1835, test_f1: 0.3625
 epoch: 69, train_loss: 1.1816, test_loss: 1.1726, test_f1: 0.3612
 epoch: 70, train_loss: 1.1828, test_loss: 1.1851, test_f1: 0.3605
 epoch: 71, train_loss: 1.1803, test_loss: 1.1802, test_f1: 0.3749
 epoch: 72, train_loss: 1.1794, test_loss: 1.1791, test_f1: 0.3624
 epoch: 73, train_loss: 1.1787, test_loss: 1.1928, test_f1: 0.3639
 epoch: 74, train_loss: 1.1766, test_loss: 1.1909, test_f1: 0.3755
 epoch: 75, train_loss: 1.1848, test_loss: 1.1910, test_f1: 0.3658
 epoch: 76, train_loss: 1.1812, test_loss: 1.1905, test_f1: 0.3845
 epoch: 77, train_loss: 1.1729, test_loss: 1.1954, test_f1: 0.3710
 epoch: 78, train_loss: 1.1815, test_loss: 1.1873, test_f1: 0.3712
 epoch: 79, train_loss: 1.1749, test_loss: 1.1923, test_f1: 0.3702
 epoch: 80, train_loss: 1.1785, test_loss: 1.1880, test_f1: 0.3634
 epoch: 81, train_loss: 1.1732, test_loss: 1.1889, test_f1: 0.3788
 epoch: 82, train_loss: 1.1736, test_loss: 1.1913, test_f1: 0.3644
 epoch: 83, train_loss: 1.1694, test_loss: 1.1956, test_f1: 0.3662
 epoch: 84, train_loss: 1.1827, test_loss: 1.1839, test_f1: 0.3681
 epoch: 85, train_loss: 1.1741, test_loss: 1.1906, test_f1: 0.3815
 epoch: 86, train_loss: 1.1744, test_loss: 1.2006, test_f1: 0.3656
 epoch: 87, train_loss: 1.1740, test_loss: 1.1950, test_f1: 0.3782
 epoch: 88, train_loss: 1.1749, test_loss: 1.1921, test_f1: 0.3729
 epoch: 89, train_loss: 1.1691, test_loss: 1.1941, test_f1: 0.3683
 epoch: 90, train_loss: 1.1742, test_loss: 1.1934, test_f1: 0.3792
 epoch: 91, train_loss: 1.1695, test_loss: 1.1931, test_f1: 0.3715
 epoch: 92, train_loss: 1.1731, test_loss: 1.2030, test_f1: 0.3617
 epoch: 93, train_loss: 1.1759, test_loss: 1.1812, test_f1: 0.3780
 epoch: 94, train_loss: 1.1719, test_loss: 1.2041, test_f1: 0.3791
 epoch: 95, train_loss: 1.1711, test_loss: 1.2041, test_f1: 0.3815
 epoch: 96, train_loss: 1.1646, test_loss: 1.1993, test_f1: 0.3822
 epoch: 97, train_loss: 1.1791, test_loss: 1.1912, test_f1: 0.3850
 epoch: 98, train_loss: 1.1650, test_loss: 1.1949, test_f1: 0.3811
 epoch: 99, train_loss: 1.1694, test_loss: 1.1929, test_f1: 0.3776
##################ITERATION #3 ****************************************
 epoch: 0, train_loss: 1.3121, test_loss: 1.3111, test_f1: 0.2555
 epoch: 1, train_loss: 1.3021, test_loss: 1.3018, test_f1: 0.2264
 epoch: 2, train_loss: 1.2976, test_loss: 1.2932, test_f1: 0.2555
 epoch: 3, train_loss: 1.2931, test_loss: 1.2863, test_f1: 0.2613
 epoch: 4, train_loss: 1.2901, test_loss: 1.2862, test_f1: 0.2555
 epoch: 5, train_loss: 1.2860, test_loss: 1.2787, test_f1: 0.2555
 epoch: 6, train_loss: 1.2804, test_loss: 1.2774, test_f1: 0.2555
 epoch: 7, train_loss: 1.2730, test_loss: 1.2700, test_f1: 0.2555
 epoch: 8, train_loss: 1.2693, test_loss: 1.2626, test_f1: 0.2555
 epoch: 9, train_loss: 1.2658, test_loss: 1.2589, test_f1: 0.2549
 epoch: 10, train_loss: 1.2614, test_loss: 1.2540, test_f1: 0.2555
 epoch: 11, train_loss: 1.2591, test_loss: 1.2501, test_f1: 0.2555
 epoch: 12, train_loss: 1.2558, test_loss: 1.2457, test_f1: 0.2551
 epoch: 13, train_loss: 1.2544, test_loss: 1.2389, test_f1: 0.2645
 epoch: 14, train_loss: 1.2504, test_loss: 1.2373, test_f1: 0.2551
 epoch: 15, train_loss: 1.2500, test_loss: 1.2328, test_f1: 0.2556
 epoch: 16, train_loss: 1.2461, test_loss: 1.2293, test_f1: 0.2550
 epoch: 17, train_loss: 1.2435, test_loss: 1.2224, test_f1: 0.2583
 epoch: 18, train_loss: 1.2420, test_loss: 1.2217, test_f1: 0.2678
 epoch: 19, train_loss: 1.2393, test_loss: 1.2143, test_f1: 0.2752
 epoch: 20, train_loss: 1.2304, test_loss: 1.2131, test_f1: 0.2786
 epoch: 21, train_loss: 1.2329, test_loss: 1.2105, test_f1: 0.2860
 epoch: 22, train_loss: 1.2272, test_loss: 1.2070, test_f1: 0.2811
 epoch: 23, train_loss: 1.2231, test_loss: 1.2022, test_f1: 0.3175
 epoch: 24, train_loss: 1.2227, test_loss: 1.1993, test_f1: 0.3278
 epoch: 25, train_loss: 1.2230, test_loss: 1.1961, test_f1: 0.3356
 epoch: 26, train_loss: 1.2168, test_loss: 1.1899, test_f1: 0.3404
 epoch: 27, train_loss: 1.2153, test_loss: 1.1894, test_f1: 0.3499
 epoch: 28, train_loss: 1.2170, test_loss: 1.1885, test_f1: 0.3525
 epoch: 29, train_loss: 1.2130, test_loss: 1.1828, test_f1: 0.3783
 epoch: 30, train_loss: 1.2067, test_loss: 1.1801, test_f1: 0.3915
 epoch: 31, train_loss: 1.2047, test_loss: 1.1782, test_f1: 0.4062
 epoch: 32, train_loss: 1.2021, test_loss: 1.1737, test_f1: 0.3978
 epoch: 33, train_loss: 1.2026, test_loss: 1.1721, test_f1: 0.4074
 epoch: 34, train_loss: 1.2013, test_loss: 1.1683, test_f1: 0.4060
 epoch: 35, train_loss: 1.2017, test_loss: 1.1645, test_f1: 0.4065
 epoch: 36, train_loss: 1.1905, test_loss: 1.1612, test_f1: 0.4055
 epoch: 37, train_loss: 1.1933, test_loss: 1.1614, test_f1: 0.4298
 epoch: 38, train_loss: 1.1899, test_loss: 1.1563, test_f1: 0.4284
 epoch: 39, train_loss: 1.1888, test_loss: 1.1537, test_f1: 0.4356
 epoch: 40, train_loss: 1.1886, test_loss: 1.1500, test_f1: 0.4277
 epoch: 41, train_loss: 1.1906, test_loss: 1.1487, test_f1: 0.4418
 epoch: 42, train_loss: 1.1828, test_loss: 1.1444, test_f1: 0.4370
 epoch: 43, train_loss: 1.1796, test_loss: 1.1415, test_f1: 0.4398
 epoch: 44, train_loss: 1.1833, test_loss: 1.1419, test_f1: 0.4368
 epoch: 45, train_loss: 1.1735, test_loss: 1.1375, test_f1: 0.4359
 epoch: 46, train_loss: 1.1792, test_loss: 1.1370, test_f1: 0.4412
 epoch: 47, train_loss: 1.1691, test_loss: 1.1349, test_f1: 0.4361
 epoch: 48, train_loss: 1.1681, test_loss: 1.1298, test_f1: 0.4562
 epoch: 49, train_loss: 1.1672, test_loss: 1.1294, test_f1: 0.4485
 epoch: 50, train_loss: 1.1613, test_loss: 1.1245, test_f1: 0.4443
 epoch: 51, train_loss: 1.1700, test_loss: 1.1239, test_f1: 0.4529
 epoch: 52, train_loss: 1.1605, test_loss: 1.1204, test_f1: 0.4487
 epoch: 53, train_loss: 1.1600, test_loss: 1.1186, test_f1: 0.4566
 epoch: 54, train_loss: 1.1550, test_loss: 1.1192, test_f1: 0.4464
 epoch: 55, train_loss: 1.1543, test_loss: 1.1185, test_f1: 0.4520
 epoch: 56, train_loss: 1.1606, test_loss: 1.1154, test_f1: 0.4541
 epoch: 57, train_loss: 1.1597, test_loss: 1.1190, test_f1: 0.4481
 epoch: 58, train_loss: 1.1592, test_loss: 1.1191, test_f1: 0.4365
 epoch: 59, train_loss: 1.1558, test_loss: 1.1141, test_f1: 0.4517
 epoch: 60, train_loss: 1.1480, test_loss: 1.1158, test_f1: 0.4416
 epoch: 61, train_loss: 1.1546, test_loss: 1.1157, test_f1: 0.4431
 epoch: 62, train_loss: 1.1596, test_loss: 1.1124, test_f1: 0.4395
 epoch: 63, train_loss: 1.1547, test_loss: 1.1114, test_f1: 0.4371
 epoch: 64, train_loss: 1.1564, test_loss: 1.1072, test_f1: 0.4505
 epoch: 65, train_loss: 1.1472, test_loss: 1.1056, test_f1: 0.4529
 epoch: 66, train_loss: 1.1472, test_loss: 1.1085, test_f1: 0.4457
 epoch: 67, train_loss: 1.1533, test_loss: 1.1041, test_f1: 0.4495
 epoch: 68, train_loss: 1.1479, test_loss: 1.1069, test_f1: 0.4552
 epoch: 69, train_loss: 1.1440, test_loss: 1.1040, test_f1: 0.4441
 epoch: 70, train_loss: 1.1480, test_loss: 1.1070, test_f1: 0.4446
 epoch: 71, train_loss: 1.1477, test_loss: 1.1039, test_f1: 0.4392
 epoch: 72, train_loss: 1.1462, test_loss: 1.1076, test_f1: 0.4390
 epoch: 73, train_loss: 1.1481, test_loss: 1.1002, test_f1: 0.4498
 epoch: 74, train_loss: 1.1455, test_loss: 1.1015, test_f1: 0.4461
 epoch: 75, train_loss: 1.1462, test_loss: 1.1028, test_f1: 0.4540
 epoch: 76, train_loss: 1.1383, test_loss: 1.1013, test_f1: 0.4392
 epoch: 77, train_loss: 1.1390, test_loss: 1.0997, test_f1: 0.4446
 epoch: 78, train_loss: 1.1407, test_loss: 1.0963, test_f1: 0.4494
 epoch: 79, train_loss: 1.1386, test_loss: 1.0976, test_f1: 0.4335
 epoch: 80, train_loss: 1.1357, test_loss: 1.0936, test_f1: 0.4478
 epoch: 81, train_loss: 1.1410, test_loss: 1.0952, test_f1: 0.4400
 epoch: 82, train_loss: 1.1340, test_loss: 1.0959, test_f1: 0.4361
 epoch: 83, train_loss: 1.1264, test_loss: 1.0942, test_f1: 0.4360
 epoch: 84, train_loss: 1.1294, test_loss: 1.0948, test_f1: 0.4454
 epoch: 85, train_loss: 1.1378, test_loss: 1.0892, test_f1: 0.4431
 epoch: 86, train_loss: 1.1364, test_loss: 1.0902, test_f1: 0.4382
 epoch: 87, train_loss: 1.1335, test_loss: 1.0957, test_f1: 0.4388
 epoch: 88, train_loss: 1.1353, test_loss: 1.0874, test_f1: 0.4403
 epoch: 89, train_loss: 1.1379, test_loss: 1.0902, test_f1: 0.4444
 epoch: 90, train_loss: 1.1305, test_loss: 1.0881, test_f1: 0.4424
 epoch: 91, train_loss: 1.1282, test_loss: 1.0845, test_f1: 0.4400
 epoch: 92, train_loss: 1.1276, test_loss: 1.0834, test_f1: 0.4488
 epoch: 93, train_loss: 1.1285, test_loss: 1.0848, test_f1: 0.4429
 epoch: 94, train_loss: 1.1278, test_loss: 1.0875, test_f1: 0.4382
 epoch: 95, train_loss: 1.1292, test_loss: 1.0861, test_f1: 0.4382
 epoch: 96, train_loss: 1.1238, test_loss: 1.0835, test_f1: 0.4496
 epoch: 97, train_loss: 1.1275, test_loss: 1.0797, test_f1: 0.4510
 epoch: 98, train_loss: 1.1256, test_loss: 1.0820, test_f1: 0.4405
 epoch: 99, train_loss: 1.1310, test_loss: 1.0820, test_f1: 0.4346
##################ITERATION #4 ****************************************
 epoch: 0, train_loss: 1.3119, test_loss: 1.3116, test_f1: 0.2274
 epoch: 1, train_loss: 1.3025, test_loss: 1.3100, test_f1: 0.2274
 epoch: 2, train_loss: 1.2988, test_loss: 1.3076, test_f1: 0.2274
 epoch: 3, train_loss: 1.2957, test_loss: 1.2987, test_f1: 0.2274
 epoch: 4, train_loss: 1.2947, test_loss: 1.2991, test_f1: 0.2274
 epoch: 5, train_loss: 1.2894, test_loss: 1.2958, test_f1: 0.2274
 epoch: 6, train_loss: 1.2868, test_loss: 1.2920, test_f1: 0.2274
 epoch: 7, train_loss: 1.2828, test_loss: 1.2878, test_f1: 0.2274
 epoch: 8, train_loss: 1.2777, test_loss: 1.2817, test_f1: 0.2274
 epoch: 9, train_loss: 1.2747, test_loss: 1.2751, test_f1: 0.2274
 epoch: 10, train_loss: 1.2725, test_loss: 1.2758, test_f1: 0.2274
 epoch: 11, train_loss: 1.2685, test_loss: 1.2749, test_f1: 0.2274
 epoch: 12, train_loss: 1.2655, test_loss: 1.2696, test_f1: 0.2274
 epoch: 13, train_loss: 1.2623, test_loss: 1.2634, test_f1: 0.2274
 epoch: 14, train_loss: 1.2590, test_loss: 1.2572, test_f1: 0.2274
 epoch: 15, train_loss: 1.2542, test_loss: 1.2539, test_f1: 0.2274
 epoch: 16, train_loss: 1.2554, test_loss: 1.2516, test_f1: 0.2274
 epoch: 17, train_loss: 1.2494, test_loss: 1.2456, test_f1: 0.2274
 epoch: 18, train_loss: 1.2446, test_loss: 1.2430, test_f1: 0.2375
 epoch: 19, train_loss: 1.2435, test_loss: 1.2383, test_f1: 0.2698
 epoch: 20, train_loss: 1.2417, test_loss: 1.2323, test_f1: 0.2955
 epoch: 21, train_loss: 1.2392, test_loss: 1.2230, test_f1: 0.3093
 epoch: 22, train_loss: 1.2352, test_loss: 1.2237, test_f1: 0.3175
 epoch: 23, train_loss: 1.2355, test_loss: 1.2193, test_f1: 0.3142
 epoch: 24, train_loss: 1.2266, test_loss: 1.2210, test_f1: 0.2946
 epoch: 25, train_loss: 1.2275, test_loss: 1.2182, test_f1: 0.3089
 epoch: 26, train_loss: 1.2283, test_loss: 1.2154, test_f1: 0.3188
 epoch: 27, train_loss: 1.2171, test_loss: 1.2101, test_f1: 0.3314
 epoch: 28, train_loss: 1.2201, test_loss: 1.2091, test_f1: 0.3397
 epoch: 29, train_loss: 1.2189, test_loss: 1.2041, test_f1: 0.3443
 epoch: 30, train_loss: 1.2181, test_loss: 1.2078, test_f1: 0.3441
 epoch: 31, train_loss: 1.2166, test_loss: 1.2032, test_f1: 0.3471
 epoch: 32, train_loss: 1.2115, test_loss: 1.2035, test_f1: 0.3371
 epoch: 33, train_loss: 1.2102, test_loss: 1.1984, test_f1: 0.3475
 epoch: 34, train_loss: 1.2144, test_loss: 1.1980, test_f1: 0.3315
 epoch: 35, train_loss: 1.2107, test_loss: 1.1961, test_f1: 0.3396
 epoch: 36, train_loss: 1.2089, test_loss: 1.1897, test_f1: 0.3483
 epoch: 37, train_loss: 1.2085, test_loss: 1.1907, test_f1: 0.3495
 epoch: 38, train_loss: 1.2096, test_loss: 1.1887, test_f1: 0.3493
 epoch: 39, train_loss: 1.1987, test_loss: 1.1882, test_f1: 0.3380
 epoch: 40, train_loss: 1.1999, test_loss: 1.1850, test_f1: 0.3494
 epoch: 41, train_loss: 1.2018, test_loss: 1.1836, test_f1: 0.3421
 epoch: 42, train_loss: 1.1996, test_loss: 1.1796, test_f1: 0.3401
 epoch: 43, train_loss: 1.1967, test_loss: 1.1778, test_f1: 0.3463
 epoch: 44, train_loss: 1.1948, test_loss: 1.1772, test_f1: 0.3609
 epoch: 45, train_loss: 1.1945, test_loss: 1.1719, test_f1: 0.3537
 epoch: 46, train_loss: 1.1951, test_loss: 1.1722, test_f1: 0.3462
 epoch: 47, train_loss: 1.1943, test_loss: 1.1697, test_f1: 0.3602
 epoch: 48, train_loss: 1.1880, test_loss: 1.1692, test_f1: 0.3484
 epoch: 49, train_loss: 1.1887, test_loss: 1.1666, test_f1: 0.3688
 epoch: 50, train_loss: 1.1880, test_loss: 1.1635, test_f1: 0.3844
 epoch: 51, train_loss: 1.1808, test_loss: 1.1627, test_f1: 0.3640
 epoch: 52, train_loss: 1.1859, test_loss: 1.1598, test_f1: 0.3830
 epoch: 53, train_loss: 1.1881, test_loss: 1.1608, test_f1: 0.3662
 epoch: 54, train_loss: 1.1878, test_loss: 1.1589, test_f1: 0.3881
 epoch: 55, train_loss: 1.1821, test_loss: 1.1576, test_f1: 0.4038
 epoch: 56, train_loss: 1.1862, test_loss: 1.1585, test_f1: 0.3884
 epoch: 57, train_loss: 1.1839, test_loss: 1.1555, test_f1: 0.3953
 epoch: 58, train_loss: 1.1824, test_loss: 1.1528, test_f1: 0.3978
 epoch: 59, train_loss: 1.1876, test_loss: 1.1548, test_f1: 0.3899
 epoch: 60, train_loss: 1.1808, test_loss: 1.1517, test_f1: 0.3822
 epoch: 61, train_loss: 1.1783, test_loss: 1.1517, test_f1: 0.4090
 epoch: 62, train_loss: 1.1842, test_loss: 1.1517, test_f1: 0.4052
 epoch: 63, train_loss: 1.1828, test_loss: 1.1500, test_f1: 0.4008
 epoch: 64, train_loss: 1.1723, test_loss: 1.1510, test_f1: 0.4006
 epoch: 65, train_loss: 1.1791, test_loss: 1.1490, test_f1: 0.4081
 epoch: 66, train_loss: 1.1773, test_loss: 1.1494, test_f1: 0.4005
 epoch: 67, train_loss: 1.1689, test_loss: 1.1479, test_f1: 0.4168
 epoch: 68, train_loss: 1.1770, test_loss: 1.1489, test_f1: 0.4082
 epoch: 69, train_loss: 1.1775, test_loss: 1.1474, test_f1: 0.4221
 epoch: 70, train_loss: 1.1678, test_loss: 1.1461, test_f1: 0.4066
 epoch: 71, train_loss: 1.1735, test_loss: 1.1486, test_f1: 0.4058
 epoch: 72, train_loss: 1.1716, test_loss: 1.1456, test_f1: 0.4115
 epoch: 73, train_loss: 1.1703, test_loss: 1.1464, test_f1: 0.4030
 epoch: 74, train_loss: 1.1658, test_loss: 1.1434, test_f1: 0.3992
 epoch: 75, train_loss: 1.1672, test_loss: 1.1440, test_f1: 0.4258
 epoch: 76, train_loss: 1.1742, test_loss: 1.1423, test_f1: 0.4090
 epoch: 77, train_loss: 1.1757, test_loss: 1.1426, test_f1: 0.4028
 epoch: 78, train_loss: 1.1645, test_loss: 1.1409, test_f1: 0.4127
 epoch: 79, train_loss: 1.1740, test_loss: 1.1447, test_f1: 0.4029
 epoch: 80, train_loss: 1.1718, test_loss: 1.1416, test_f1: 0.4243
 epoch: 81, train_loss: 1.1752, test_loss: 1.1429, test_f1: 0.4281
 epoch: 82, train_loss: 1.1597, test_loss: 1.1419, test_f1: 0.4066
 epoch: 83, train_loss: 1.1659, test_loss: 1.1385, test_f1: 0.4136
 epoch: 84, train_loss: 1.1668, test_loss: 1.1384, test_f1: 0.4276
 epoch: 85, train_loss: 1.1650, test_loss: 1.1382, test_f1: 0.4124
 epoch: 86, train_loss: 1.1613, test_loss: 1.1360, test_f1: 0.4156
 epoch: 87, train_loss: 1.1654, test_loss: 1.1349, test_f1: 0.4178
 epoch: 88, train_loss: 1.1718, test_loss: 1.1366, test_f1: 0.4150
 epoch: 89, train_loss: 1.1618, test_loss: 1.1346, test_f1: 0.4270
 epoch: 90, train_loss: 1.1631, test_loss: 1.1349, test_f1: 0.4506
 epoch: 91, train_loss: 1.1620, test_loss: 1.1354, test_f1: 0.4135
 epoch: 92, train_loss: 1.1631, test_loss: 1.1350, test_f1: 0.4262
 epoch: 93, train_loss: 1.1613, test_loss: 1.1341, test_f1: 0.4292
 epoch: 94, train_loss: 1.1599, test_loss: 1.1344, test_f1: 0.4136
 epoch: 95, train_loss: 1.1525, test_loss: 1.1315, test_f1: 0.4305
 epoch: 96, train_loss: 1.1611, test_loss: 1.1310, test_f1: 0.4217
 epoch: 97, train_loss: 1.1634, test_loss: 1.1279, test_f1: 0.4325
 epoch: 98, train_loss: 1.1568, test_loss: 1.1312, test_f1: 0.4170
 epoch: 99, train_loss: 1.1496, test_loss: 1.1267, test_f1: 0.4259
##################ITERATION #5 ****************************************
 epoch: 0, train_loss: 1.3091, test_loss: 1.2911, test_f1: 0.2274
 epoch: 1, train_loss: 1.2931, test_loss: 1.2733, test_f1: 0.2320
 epoch: 2, train_loss: 1.2848, test_loss: 1.2646, test_f1: 0.2320
 epoch: 3, train_loss: 1.2813, test_loss: 1.2585, test_f1: 0.2600
 epoch: 4, train_loss: 1.2742, test_loss: 1.2521, test_f1: 0.2600
 epoch: 5, train_loss: 1.2737, test_loss: 1.2507, test_f1: 0.2600
 epoch: 6, train_loss: 1.2654, test_loss: 1.2451, test_f1: 0.2600
 epoch: 7, train_loss: 1.2643, test_loss: 1.2414, test_f1: 0.2661
 epoch: 8, train_loss: 1.2633, test_loss: 1.2403, test_f1: 0.2762
 epoch: 9, train_loss: 1.2620, test_loss: 1.2317, test_f1: 0.2776
 epoch: 10, train_loss: 1.2628, test_loss: 1.2330, test_f1: 0.2797
 epoch: 11, train_loss: 1.2541, test_loss: 1.2285, test_f1: 0.2769
 epoch: 12, train_loss: 1.2518, test_loss: 1.2253, test_f1: 0.2850
 epoch: 13, train_loss: 1.2576, test_loss: 1.2213, test_f1: 0.2932
 epoch: 14, train_loss: 1.2563, test_loss: 1.2207, test_f1: 0.2908
 epoch: 15, train_loss: 1.2467, test_loss: 1.2194, test_f1: 0.2894
 epoch: 16, train_loss: 1.2428, test_loss: 1.2155, test_f1: 0.3039
 epoch: 17, train_loss: 1.2504, test_loss: 1.2131, test_f1: 0.2979
 epoch: 18, train_loss: 1.2467, test_loss: 1.2126, test_f1: 0.2994
 epoch: 19, train_loss: 1.2404, test_loss: 1.2075, test_f1: 0.2997
 epoch: 20, train_loss: 1.2368, test_loss: 1.2057, test_f1: 0.3005
 epoch: 21, train_loss: 1.2398, test_loss: 1.2071, test_f1: 0.3018
 epoch: 22, train_loss: 1.2349, test_loss: 1.2059, test_f1: 0.3035
 epoch: 23, train_loss: 1.2325, test_loss: 1.2017, test_f1: 0.3071
 epoch: 24, train_loss: 1.2357, test_loss: 1.2013, test_f1: 0.3191
 epoch: 25, train_loss: 1.2318, test_loss: 1.1981, test_f1: 0.3078
 epoch: 26, train_loss: 1.2240, test_loss: 1.1976, test_f1: 0.3118
 epoch: 27, train_loss: 1.2245, test_loss: 1.1952, test_f1: 0.3181
 epoch: 28, train_loss: 1.2182, test_loss: 1.1932, test_f1: 0.3192
 epoch: 29, train_loss: 1.2173, test_loss: 1.1943, test_f1: 0.3231
 epoch: 30, train_loss: 1.2235, test_loss: 1.1919, test_f1: 0.3188
 epoch: 31, train_loss: 1.2245, test_loss: 1.1888, test_f1: 0.3303
 epoch: 32, train_loss: 1.2199, test_loss: 1.1874, test_f1: 0.3343
 epoch: 33, train_loss: 1.2199, test_loss: 1.1850, test_f1: 0.3311
 epoch: 34, train_loss: 1.2198, test_loss: 1.1853, test_f1: 0.3340
 epoch: 35, train_loss: 1.2187, test_loss: 1.1815, test_f1: 0.3372
 epoch: 36, train_loss: 1.2202, test_loss: 1.1820, test_f1: 0.3267
 epoch: 37, train_loss: 1.2154, test_loss: 1.1768, test_f1: 0.3418
 epoch: 38, train_loss: 1.2052, test_loss: 1.1764, test_f1: 0.3494
 epoch: 39, train_loss: 1.2066, test_loss: 1.1753, test_f1: 0.3607
 epoch: 40, train_loss: 1.2073, test_loss: 1.1735, test_f1: 0.3662
 epoch: 41, train_loss: 1.2073, test_loss: 1.1714, test_f1: 0.3692
 epoch: 42, train_loss: 1.2002, test_loss: 1.1687, test_f1: 0.3738
 epoch: 43, train_loss: 1.2065, test_loss: 1.1711, test_f1: 0.3676
 epoch: 44, train_loss: 1.2019, test_loss: 1.1662, test_f1: 0.3676
 epoch: 45, train_loss: 1.2100, test_loss: 1.1647, test_f1: 0.3679
 epoch: 46, train_loss: 1.1959, test_loss: 1.1640, test_f1: 0.3660
 epoch: 47, train_loss: 1.1982, test_loss: 1.1609, test_f1: 0.3799
 epoch: 48, train_loss: 1.2029, test_loss: 1.1621, test_f1: 0.3668
 epoch: 49, train_loss: 1.1909, test_loss: 1.1605, test_f1: 0.3872
 epoch: 50, train_loss: 1.1932, test_loss: 1.1574, test_f1: 0.3820
 epoch: 51, train_loss: 1.1917, test_loss: 1.1548, test_f1: 0.3869
 epoch: 52, train_loss: 1.1879, test_loss: 1.1560, test_f1: 0.3956
 epoch: 53, train_loss: 1.1895, test_loss: 1.1536, test_f1: 0.4052
 epoch: 54, train_loss: 1.1932, test_loss: 1.1528, test_f1: 0.4025
 epoch: 55, train_loss: 1.1889, test_loss: 1.1564, test_f1: 0.3877
 epoch: 56, train_loss: 1.1900, test_loss: 1.1553, test_f1: 0.3887
 epoch: 57, train_loss: 1.1842, test_loss: 1.1565, test_f1: 0.3998
 epoch: 58, train_loss: 1.1863, test_loss: 1.1546, test_f1: 0.3851
 epoch: 59, train_loss: 1.1841, test_loss: 1.1521, test_f1: 0.4128
 epoch: 60, train_loss: 1.1893, test_loss: 1.1539, test_f1: 0.4084
 epoch: 61, train_loss: 1.1822, test_loss: 1.1477, test_f1: 0.4056
 epoch: 62, train_loss: 1.1845, test_loss: 1.1483, test_f1: 0.4121
 epoch: 63, train_loss: 1.1853, test_loss: 1.1506, test_f1: 0.4051
 epoch: 64, train_loss: 1.1826, test_loss: 1.1511, test_f1: 0.4095
 epoch: 65, train_loss: 1.1787, test_loss: 1.1522, test_f1: 0.4135
 epoch: 66, train_loss: 1.1777, test_loss: 1.1513, test_f1: 0.4045
 epoch: 67, train_loss: 1.1834, test_loss: 1.1464, test_f1: 0.3983
 epoch: 68, train_loss: 1.1840, test_loss: 1.1464, test_f1: 0.4044
 epoch: 69, train_loss: 1.1776, test_loss: 1.1496, test_f1: 0.4034
 epoch: 70, train_loss: 1.1828, test_loss: 1.1481, test_f1: 0.4056
 epoch: 71, train_loss: 1.1780, test_loss: 1.1479, test_f1: 0.3984
 epoch: 72, train_loss: 1.1768, test_loss: 1.1452, test_f1: 0.4095
 epoch: 73, train_loss: 1.1784, test_loss: 1.1464, test_f1: 0.4078
 epoch: 74, train_loss: 1.1737, test_loss: 1.1468, test_f1: 0.4020
 epoch: 75, train_loss: 1.1707, test_loss: 1.1446, test_f1: 0.4087
 epoch: 76, train_loss: 1.1764, test_loss: 1.1486, test_f1: 0.4170
 epoch: 77, train_loss: 1.1753, test_loss: 1.1449, test_f1: 0.4052
 epoch: 78, train_loss: 1.1735, test_loss: 1.1440, test_f1: 0.4089
 epoch: 79, train_loss: 1.1761, test_loss: 1.1410, test_f1: 0.4096
 epoch: 80, train_loss: 1.1717, test_loss: 1.1442, test_f1: 0.4060
 epoch: 81, train_loss: 1.1683, test_loss: 1.1414, test_f1: 0.4074
 epoch: 82, train_loss: 1.1707, test_loss: 1.1396, test_f1: 0.4117
 epoch: 83, train_loss: 1.1634, test_loss: 1.1428, test_f1: 0.4064
 epoch: 84, train_loss: 1.1655, test_loss: 1.1419, test_f1: 0.4095
 epoch: 85, train_loss: 1.1671, test_loss: 1.1352, test_f1: 0.4086
 epoch: 86, train_loss: 1.1586, test_loss: 1.1375, test_f1: 0.4094
 epoch: 87, train_loss: 1.1632, test_loss: 1.1373, test_f1: 0.4193
 epoch: 88, train_loss: 1.1665, test_loss: 1.1359, test_f1: 0.4182
 epoch: 89, train_loss: 1.1671, test_loss: 1.1335, test_f1: 0.4081
 epoch: 90, train_loss: 1.1612, test_loss: 1.1354, test_f1: 0.4210
 epoch: 91, train_loss: 1.1628, test_loss: 1.1354, test_f1: 0.4171
 epoch: 92, train_loss: 1.1621, test_loss: 1.1364, test_f1: 0.4122
 epoch: 93, train_loss: 1.1564, test_loss: 1.1347, test_f1: 0.4230
 epoch: 94, train_loss: 1.1640, test_loss: 1.1313, test_f1: 0.4220
 epoch: 95, train_loss: 1.1640, test_loss: 1.1326, test_f1: 0.4163
 epoch: 96, train_loss: 1.1564, test_loss: 1.1321, test_f1: 0.4222
 epoch: 97, train_loss: 1.1621, test_loss: 1.1326, test_f1: 0.4285
 epoch: 98, train_loss: 1.1581, test_loss: 1.1325, test_f1: 0.4251
 epoch: 99, train_loss: 1.1573, test_loss: 1.1308, test_f1: 0.4208
##################ITERATION #6 ****************************************
 epoch: 0, train_loss: 1.3313, test_loss: 1.3418, test_f1: 0.2563
 epoch: 1, train_loss: 1.3103, test_loss: 1.3192, test_f1: 0.2637
 epoch: 2, train_loss: 1.3050, test_loss: 1.3049, test_f1: 0.2727
 epoch: 3, train_loss: 1.2944, test_loss: 1.2918, test_f1: 0.2706
 epoch: 4, train_loss: 1.2809, test_loss: 1.2752, test_f1: 0.2783
 epoch: 5, train_loss: 1.2777, test_loss: 1.2705, test_f1: 0.2883
 epoch: 6, train_loss: 1.2720, test_loss: 1.2627, test_f1: 0.2803
 epoch: 7, train_loss: 1.2737, test_loss: 1.2542, test_f1: 0.3039
 epoch: 8, train_loss: 1.2643, test_loss: 1.2494, test_f1: 0.3031
 epoch: 9, train_loss: 1.2612, test_loss: 1.2464, test_f1: 0.3137
 epoch: 10, train_loss: 1.2624, test_loss: 1.2357, test_f1: 0.3095
 epoch: 11, train_loss: 1.2610, test_loss: 1.2350, test_f1: 0.3006
 epoch: 12, train_loss: 1.2517, test_loss: 1.2302, test_f1: 0.3074
 epoch: 13, train_loss: 1.2532, test_loss: 1.2287, test_f1: 0.3133
 epoch: 14, train_loss: 1.2453, test_loss: 1.2264, test_f1: 0.3147
 epoch: 15, train_loss: 1.2473, test_loss: 1.2185, test_f1: 0.3222
 epoch: 16, train_loss: 1.2435, test_loss: 1.2200, test_f1: 0.3146
 epoch: 17, train_loss: 1.2421, test_loss: 1.2156, test_f1: 0.3273
 epoch: 18, train_loss: 1.2404, test_loss: 1.2142, test_f1: 0.3291
 epoch: 19, train_loss: 1.2287, test_loss: 1.2101, test_f1: 0.3350
 epoch: 20, train_loss: 1.2338, test_loss: 1.2053, test_f1: 0.3233
 epoch: 21, train_loss: 1.2270, test_loss: 1.2044, test_f1: 0.3335
 epoch: 22, train_loss: 1.2344, test_loss: 1.2047, test_f1: 0.3243
 epoch: 23, train_loss: 1.2284, test_loss: 1.2051, test_f1: 0.3234
 epoch: 24, train_loss: 1.2278, test_loss: 1.2008, test_f1: 0.3416
 epoch: 25, train_loss: 1.2252, test_loss: 1.1977, test_f1: 0.3486
 epoch: 26, train_loss: 1.2206, test_loss: 1.1934, test_f1: 0.3448
 epoch: 27, train_loss: 1.2182, test_loss: 1.1926, test_f1: 0.3628
 epoch: 28, train_loss: 1.2099, test_loss: 1.1919, test_f1: 0.3398
 epoch: 29, train_loss: 1.2160, test_loss: 1.1862, test_f1: 0.3427
 epoch: 30, train_loss: 1.2125, test_loss: 1.1816, test_f1: 0.3539
 epoch: 31, train_loss: 1.2141, test_loss: 1.1848, test_f1: 0.3526
 epoch: 32, train_loss: 1.2167, test_loss: 1.1818, test_f1: 0.3511
 epoch: 33, train_loss: 1.2044, test_loss: 1.1768, test_f1: 0.3770
 epoch: 34, train_loss: 1.2025, test_loss: 1.1753, test_f1: 0.3670
 epoch: 35, train_loss: 1.2023, test_loss: 1.1728, test_f1: 0.3676
 epoch: 36, train_loss: 1.2041, test_loss: 1.1745, test_f1: 0.3671
 epoch: 37, train_loss: 1.2030, test_loss: 1.1682, test_f1: 0.3832
 epoch: 38, train_loss: 1.2002, test_loss: 1.1694, test_f1: 0.3671
 epoch: 39, train_loss: 1.2022, test_loss: 1.1716, test_f1: 0.3579
 epoch: 40, train_loss: 1.1941, test_loss: 1.1692, test_f1: 0.3634
 epoch: 41, train_loss: 1.1955, test_loss: 1.1623, test_f1: 0.3699
 epoch: 42, train_loss: 1.1998, test_loss: 1.1647, test_f1: 0.3757
 epoch: 43, train_loss: 1.1903, test_loss: 1.1593, test_f1: 0.3794
 epoch: 44, train_loss: 1.1884, test_loss: 1.1575, test_f1: 0.3837
 epoch: 45, train_loss: 1.1919, test_loss: 1.1565, test_f1: 0.3839
 epoch: 46, train_loss: 1.1877, test_loss: 1.1574, test_f1: 0.3767
 epoch: 47, train_loss: 1.1889, test_loss: 1.1575, test_f1: 0.3627
 epoch: 48, train_loss: 1.1886, test_loss: 1.1558, test_f1: 0.3765
 epoch: 49, train_loss: 1.1872, test_loss: 1.1513, test_f1: 0.3804
 epoch: 50, train_loss: 1.1843, test_loss: 1.1516, test_f1: 0.3907
 epoch: 51, train_loss: 1.1813, test_loss: 1.1490, test_f1: 0.3823
 epoch: 52, train_loss: 1.1873, test_loss: 1.1518, test_f1: 0.3935
 epoch: 53, train_loss: 1.1787, test_loss: 1.1516, test_f1: 0.3704
 epoch: 54, train_loss: 1.1812, test_loss: 1.1478, test_f1: 0.3899
 epoch: 55, train_loss: 1.1766, test_loss: 1.1425, test_f1: 0.3849
 epoch: 56, train_loss: 1.1732, test_loss: 1.1432, test_f1: 0.3871
 epoch: 57, train_loss: 1.1831, test_loss: 1.1474, test_f1: 0.4033
 epoch: 58, train_loss: 1.1814, test_loss: 1.1454, test_f1: 0.4009
 epoch: 59, train_loss: 1.1779, test_loss: 1.1459, test_f1: 0.3860
 epoch: 60, train_loss: 1.1761, test_loss: 1.1437, test_f1: 0.4019
 epoch: 61, train_loss: 1.1721, test_loss: 1.1425, test_f1: 0.3910
 epoch: 62, train_loss: 1.1769, test_loss: 1.1396, test_f1: 0.3774
 epoch: 63, train_loss: 1.1790, test_loss: 1.1434, test_f1: 0.3862
 epoch: 64, train_loss: 1.1712, test_loss: 1.1378, test_f1: 0.4003
 epoch: 65, train_loss: 1.1665, test_loss: 1.1443, test_f1: 0.3989
 epoch: 66, train_loss: 1.1657, test_loss: 1.1395, test_f1: 0.4040
 epoch: 67, train_loss: 1.1669, test_loss: 1.1374, test_f1: 0.3988
 epoch: 68, train_loss: 1.1690, test_loss: 1.1403, test_f1: 0.3868
 epoch: 69, train_loss: 1.1695, test_loss: 1.1362, test_f1: 0.3886
 epoch: 70, train_loss: 1.1625, test_loss: 1.1390, test_f1: 0.3820
 epoch: 71, train_loss: 1.1699, test_loss: 1.1366, test_f1: 0.3896
 epoch: 72, train_loss: 1.1691, test_loss: 1.1358, test_f1: 0.3989
 epoch: 73, train_loss: 1.1634, test_loss: 1.1339, test_f1: 0.4022
 epoch: 74, train_loss: 1.1622, test_loss: 1.1344, test_f1: 0.4025
 epoch: 75, train_loss: 1.1630, test_loss: 1.1384, test_f1: 0.3947
 epoch: 76, train_loss: 1.1705, test_loss: 1.1374, test_f1: 0.3875
 epoch: 77, train_loss: 1.1619, test_loss: 1.1346, test_f1: 0.4074
 epoch: 78, train_loss: 1.1696, test_loss: 1.1354, test_f1: 0.4042
 epoch: 79, train_loss: 1.1617, test_loss: 1.1389, test_f1: 0.3879
 epoch: 80, train_loss: 1.1673, test_loss: 1.1336, test_f1: 0.3855
 epoch: 81, train_loss: 1.1611, test_loss: 1.1329, test_f1: 0.3911
 epoch: 82, train_loss: 1.1564, test_loss: 1.1348, test_f1: 0.3947
 epoch: 83, train_loss: 1.1636, test_loss: 1.1288, test_f1: 0.3953
 epoch: 84, train_loss: 1.1572, test_loss: 1.1310, test_f1: 0.3826
 epoch: 85, train_loss: 1.1577, test_loss: 1.1347, test_f1: 0.3886
 epoch: 86, train_loss: 1.1582, test_loss: 1.1307, test_f1: 0.3983
 epoch: 87, train_loss: 1.1627, test_loss: 1.1298, test_f1: 0.3904
 epoch: 88, train_loss: 1.1572, test_loss: 1.1286, test_f1: 0.4038
 epoch: 89, train_loss: 1.1507, test_loss: 1.1257, test_f1: 0.4076
 epoch: 90, train_loss: 1.1457, test_loss: 1.1281, test_f1: 0.4027
 epoch: 91, train_loss: 1.1551, test_loss: 1.1290, test_f1: 0.3982
 epoch: 92, train_loss: 1.1536, test_loss: 1.1286, test_f1: 0.4080
 epoch: 93, train_loss: 1.1507, test_loss: 1.1258, test_f1: 0.3970
 epoch: 94, train_loss: 1.1588, test_loss: 1.1263, test_f1: 0.3863
 epoch: 95, train_loss: 1.1517, test_loss: 1.1300, test_f1: 0.4025
 epoch: 96, train_loss: 1.1508, test_loss: 1.1240, test_f1: 0.4031
 epoch: 97, train_loss: 1.1502, test_loss: 1.1231, test_f1: 0.4071
 epoch: 98, train_loss: 1.1467, test_loss: 1.1251, test_f1: 0.4006
 epoch: 99, train_loss: 1.1529, test_loss: 1.1252, test_f1: 0.4146
##################ITERATION #7 ****************************************
 epoch: 0, train_loss: 1.3414, test_loss: 1.3279, test_f1: 0.2274
 epoch: 1, train_loss: 1.3185, test_loss: 1.3258, test_f1: 0.2274
 epoch: 2, train_loss: 1.3112, test_loss: 1.3134, test_f1: 0.2274
 epoch: 3, train_loss: 1.3014, test_loss: 1.3053, test_f1: 0.2274
 epoch: 4, train_loss: 1.2931, test_loss: 1.2953, test_f1: 0.2274
 epoch: 5, train_loss: 1.2870, test_loss: 1.2904, test_f1: 0.2274
 epoch: 6, train_loss: 1.2824, test_loss: 1.2821, test_f1: 0.2274
 epoch: 7, train_loss: 1.2692, test_loss: 1.2700, test_f1: 0.2274
 epoch: 8, train_loss: 1.2703, test_loss: 1.2661, test_f1: 0.2274
 epoch: 9, train_loss: 1.2615, test_loss: 1.2620, test_f1: 0.2274
 epoch: 10, train_loss: 1.2622, test_loss: 1.2518, test_f1: 0.2276
 epoch: 11, train_loss: 1.2549, test_loss: 1.2486, test_f1: 0.2276
 epoch: 12, train_loss: 1.2526, test_loss: 1.2423, test_f1: 0.2276
 epoch: 13, train_loss: 1.2540, test_loss: 1.2352, test_f1: 0.2555
 epoch: 14, train_loss: 1.2475, test_loss: 1.2346, test_f1: 0.2417
 epoch: 15, train_loss: 1.2468, test_loss: 1.2311, test_f1: 0.2582
 epoch: 16, train_loss: 1.2456, test_loss: 1.2264, test_f1: 0.2419
 epoch: 17, train_loss: 1.2446, test_loss: 1.2240, test_f1: 0.2605
 epoch: 18, train_loss: 1.2496, test_loss: 1.2219, test_f1: 0.2629
 epoch: 19, train_loss: 1.2411, test_loss: 1.2212, test_f1: 0.2586
 epoch: 20, train_loss: 1.2321, test_loss: 1.2146, test_f1: 0.2629
 epoch: 21, train_loss: 1.2428, test_loss: 1.2142, test_f1: 0.2610
 epoch: 22, train_loss: 1.2312, test_loss: 1.2098, test_f1: 0.2609
 epoch: 23, train_loss: 1.2321, test_loss: 1.2078, test_f1: 0.2654
 epoch: 24, train_loss: 1.2328, test_loss: 1.2081, test_f1: 0.2907
 epoch: 25, train_loss: 1.2261, test_loss: 1.2009, test_f1: 0.2904
 epoch: 26, train_loss: 1.2316, test_loss: 1.2006, test_f1: 0.2883
 epoch: 27, train_loss: 1.2268, test_loss: 1.1989, test_f1: 0.2921
 epoch: 28, train_loss: 1.2242, test_loss: 1.1945, test_f1: 0.3037
 epoch: 29, train_loss: 1.2220, test_loss: 1.1956, test_f1: 0.3152
 epoch: 30, train_loss: 1.2168, test_loss: 1.1924, test_f1: 0.3178
 epoch: 31, train_loss: 1.2168, test_loss: 1.1891, test_f1: 0.3300
 epoch: 32, train_loss: 1.2184, test_loss: 1.1905, test_f1: 0.3299
 epoch: 33, train_loss: 1.2185, test_loss: 1.1874, test_f1: 0.3300
 epoch: 34, train_loss: 1.2173, test_loss: 1.1878, test_f1: 0.3406
 epoch: 35, train_loss: 1.2120, test_loss: 1.1825, test_f1: 0.3329
 epoch: 36, train_loss: 1.2138, test_loss: 1.1830, test_f1: 0.3487
 epoch: 37, train_loss: 1.2044, test_loss: 1.1806, test_f1: 0.3540
 epoch: 38, train_loss: 1.2118, test_loss: 1.1801, test_f1: 0.3426
 epoch: 39, train_loss: 1.2032, test_loss: 1.1803, test_f1: 0.3636
 epoch: 40, train_loss: 1.2070, test_loss: 1.1735, test_f1: 0.3515
 epoch: 41, train_loss: 1.2036, test_loss: 1.1741, test_f1: 0.3562
 epoch: 42, train_loss: 1.2014, test_loss: 1.1703, test_f1: 0.3631
 epoch: 43, train_loss: 1.2063, test_loss: 1.1713, test_f1: 0.3676
 epoch: 44, train_loss: 1.1966, test_loss: 1.1692, test_f1: 0.3679
 epoch: 45, train_loss: 1.1981, test_loss: 1.1702, test_f1: 0.3713
 epoch: 46, train_loss: 1.1966, test_loss: 1.1671, test_f1: 0.3745
 epoch: 47, train_loss: 1.1972, test_loss: 1.1660, test_f1: 0.3851
 epoch: 48, train_loss: 1.1909, test_loss: 1.1602, test_f1: 0.3865
 epoch: 49, train_loss: 1.1880, test_loss: 1.1608, test_f1: 0.3841
 epoch: 50, train_loss: 1.1925, test_loss: 1.1535, test_f1: 0.3883
 epoch: 51, train_loss: 1.1911, test_loss: 1.1606, test_f1: 0.3899
 epoch: 52, train_loss: 1.1864, test_loss: 1.1568, test_f1: 0.3960
 epoch: 53, train_loss: 1.1859, test_loss: 1.1562, test_f1: 0.3911
 epoch: 54, train_loss: 1.1841, test_loss: 1.1570, test_f1: 0.4012
 epoch: 55, train_loss: 1.1793, test_loss: 1.1548, test_f1: 0.3954
 epoch: 56, train_loss: 1.1779, test_loss: 1.1530, test_f1: 0.4023
 epoch: 57, train_loss: 1.1834, test_loss: 1.1531, test_f1: 0.4088
 epoch: 58, train_loss: 1.1844, test_loss: 1.1519, test_f1: 0.4090
 epoch: 59, train_loss: 1.1904, test_loss: 1.1499, test_f1: 0.4049
 epoch: 60, train_loss: 1.1852, test_loss: 1.1527, test_f1: 0.4033
 epoch: 61, train_loss: 1.1751, test_loss: 1.1522, test_f1: 0.4033
 epoch: 62, train_loss: 1.1821, test_loss: 1.1502, test_f1: 0.4050
 epoch: 63, train_loss: 1.1803, test_loss: 1.1511, test_f1: 0.4026
 epoch: 64, train_loss: 1.1762, test_loss: 1.1476, test_f1: 0.4081
 epoch: 65, train_loss: 1.1824, test_loss: 1.1480, test_f1: 0.4046
 epoch: 66, train_loss: 1.1725, test_loss: 1.1453, test_f1: 0.4062
 epoch: 67, train_loss: 1.1771, test_loss: 1.1454, test_f1: 0.4054
 epoch: 68, train_loss: 1.1735, test_loss: 1.1455, test_f1: 0.4016
 epoch: 69, train_loss: 1.1766, test_loss: 1.1469, test_f1: 0.4033
 epoch: 70, train_loss: 1.1751, test_loss: 1.1442, test_f1: 0.4101
 epoch: 71, train_loss: 1.1702, test_loss: 1.1419, test_f1: 0.4110
 epoch: 72, train_loss: 1.1718, test_loss: 1.1407, test_f1: 0.4126
 epoch: 73, train_loss: 1.1667, test_loss: 1.1443, test_f1: 0.4075
 epoch: 74, train_loss: 1.1791, test_loss: 1.1425, test_f1: 0.4047
 epoch: 75, train_loss: 1.1668, test_loss: 1.1388, test_f1: 0.4139
 epoch: 76, train_loss: 1.1680, test_loss: 1.1416, test_f1: 0.4101
 epoch: 77, train_loss: 1.1651, test_loss: 1.1414, test_f1: 0.4157
 epoch: 78, train_loss: 1.1670, test_loss: 1.1378, test_f1: 0.4143
 epoch: 79, train_loss: 1.1723, test_loss: 1.1353, test_f1: 0.4197
 epoch: 80, train_loss: 1.1665, test_loss: 1.1405, test_f1: 0.4140
 epoch: 81, train_loss: 1.1611, test_loss: 1.1354, test_f1: 0.4132
 epoch: 82, train_loss: 1.1646, test_loss: 1.1365, test_f1: 0.4169
 epoch: 83, train_loss: 1.1671, test_loss: 1.1377, test_f1: 0.4133
 epoch: 84, train_loss: 1.1656, test_loss: 1.1329, test_f1: 0.4192
 epoch: 85, train_loss: 1.1679, test_loss: 1.1295, test_f1: 0.4200
 epoch: 86, train_loss: 1.1538, test_loss: 1.1314, test_f1: 0.4230
 epoch: 87, train_loss: 1.1675, test_loss: 1.1340, test_f1: 0.4130
 epoch: 88, train_loss: 1.1665, test_loss: 1.1311, test_f1: 0.4233
 epoch: 89, train_loss: 1.1692, test_loss: 1.1326, test_f1: 0.4201
 epoch: 90, train_loss: 1.1660, test_loss: 1.1315, test_f1: 0.4229
 epoch: 91, train_loss: 1.1636, test_loss: 1.1297, test_f1: 0.4218
 epoch: 92, train_loss: 1.1608, test_loss: 1.1314, test_f1: 0.4216
 epoch: 93, train_loss: 1.1580, test_loss: 1.1289, test_f1: 0.4190
 epoch: 94, train_loss: 1.1656, test_loss: 1.1303, test_f1: 0.4261
 epoch: 95, train_loss: 1.1592, test_loss: 1.1278, test_f1: 0.4194
 epoch: 96, train_loss: 1.1472, test_loss: 1.1286, test_f1: 0.4183
 epoch: 97, train_loss: 1.1494, test_loss: 1.1254, test_f1: 0.4239
 epoch: 98, train_loss: 1.1604, test_loss: 1.1278, test_f1: 0.4182
 epoch: 99, train_loss: 1.1496, test_loss: 1.1273, test_f1: 0.4212
##################ITERATION #8 ****************************************
 epoch: 0, train_loss: 1.3558, test_loss: 1.3561, test_f1: 0.2249
 epoch: 1, train_loss: 1.3302, test_loss: 1.3198, test_f1: 0.2322
 epoch: 2, train_loss: 1.3237, test_loss: 1.2968, test_f1: 0.2309
 epoch: 3, train_loss: 1.3000, test_loss: 1.2957, test_f1: 0.2305
 epoch: 4, train_loss: 1.2935, test_loss: 1.2786, test_f1: 0.2319
 epoch: 5, train_loss: 1.2905, test_loss: 1.2776, test_f1: 0.2403
 epoch: 6, train_loss: 1.2792, test_loss: 1.2699, test_f1: 0.2507
 epoch: 7, train_loss: 1.2778, test_loss: 1.2576, test_f1: 0.2729
 epoch: 8, train_loss: 1.2664, test_loss: 1.2576, test_f1: 0.2696
 epoch: 9, train_loss: 1.2660, test_loss: 1.2496, test_f1: 0.2800
 epoch: 10, train_loss: 1.2623, test_loss: 1.2455, test_f1: 0.2843
 epoch: 11, train_loss: 1.2532, test_loss: 1.2443, test_f1: 0.2867
 epoch: 12, train_loss: 1.2514, test_loss: 1.2418, test_f1: 0.2869
 epoch: 13, train_loss: 1.2513, test_loss: 1.2363, test_f1: 0.2814
 epoch: 14, train_loss: 1.2489, test_loss: 1.2318, test_f1: 0.2828
 epoch: 15, train_loss: 1.2441, test_loss: 1.2267, test_f1: 0.2744
 epoch: 16, train_loss: 1.2418, test_loss: 1.2262, test_f1: 0.2796
 epoch: 17, train_loss: 1.2416, test_loss: 1.2255, test_f1: 0.2750
 epoch: 18, train_loss: 1.2378, test_loss: 1.2196, test_f1: 0.2726
 epoch: 19, train_loss: 1.2424, test_loss: 1.2197, test_f1: 0.2751
 epoch: 20, train_loss: 1.2291, test_loss: 1.2178, test_f1: 0.2934
 epoch: 21, train_loss: 1.2398, test_loss: 1.2154, test_f1: 0.2980
 epoch: 22, train_loss: 1.2376, test_loss: 1.2131, test_f1: 0.3006
 epoch: 23, train_loss: 1.2329, test_loss: 1.2096, test_f1: 0.3157
 epoch: 24, train_loss: 1.2242, test_loss: 1.2112, test_f1: 0.3160
 epoch: 25, train_loss: 1.2238, test_loss: 1.2069, test_f1: 0.3157
 epoch: 26, train_loss: 1.2227, test_loss: 1.2013, test_f1: 0.3188
 epoch: 27, train_loss: 1.2279, test_loss: 1.2002, test_f1: 0.3127
 epoch: 28, train_loss: 1.2195, test_loss: 1.1949, test_f1: 0.3302
 epoch: 29, train_loss: 1.2215, test_loss: 1.1964, test_f1: 0.3280
 epoch: 30, train_loss: 1.2182, test_loss: 1.1946, test_f1: 0.3372
 epoch: 31, train_loss: 1.2144, test_loss: 1.1922, test_f1: 0.3349
 epoch: 32, train_loss: 1.2118, test_loss: 1.1889, test_f1: 0.3461
 epoch: 33, train_loss: 1.2167, test_loss: 1.1873, test_f1: 0.3488
 epoch: 34, train_loss: 1.2163, test_loss: 1.1854, test_f1: 0.3533
 epoch: 35, train_loss: 1.2102, test_loss: 1.1862, test_f1: 0.3558
 epoch: 36, train_loss: 1.2079, test_loss: 1.1810, test_f1: 0.3531
 epoch: 37, train_loss: 1.2079, test_loss: 1.1809, test_f1: 0.3556
 epoch: 38, train_loss: 1.2050, test_loss: 1.1828, test_f1: 0.3476
 epoch: 39, train_loss: 1.2006, test_loss: 1.1800, test_f1: 0.3431
 epoch: 40, train_loss: 1.2027, test_loss: 1.1792, test_f1: 0.3535
 epoch: 41, train_loss: 1.2031, test_loss: 1.1737, test_f1: 0.3610
 epoch: 42, train_loss: 1.1989, test_loss: 1.1720, test_f1: 0.3607
 epoch: 43, train_loss: 1.2016, test_loss: 1.1717, test_f1: 0.3639
 epoch: 44, train_loss: 1.2046, test_loss: 1.1665, test_f1: 0.3735
 epoch: 45, train_loss: 1.1990, test_loss: 1.1661, test_f1: 0.3703
 epoch: 46, train_loss: 1.1963, test_loss: 1.1655, test_f1: 0.3648
 epoch: 47, train_loss: 1.2016, test_loss: 1.1633, test_f1: 0.3733
 epoch: 48, train_loss: 1.1928, test_loss: 1.1631, test_f1: 0.3716
 epoch: 49, train_loss: 1.1926, test_loss: 1.1646, test_f1: 0.3737
 epoch: 50, train_loss: 1.1879, test_loss: 1.1617, test_f1: 0.3823
 epoch: 51, train_loss: 1.1842, test_loss: 1.1593, test_f1: 0.3754
 epoch: 52, train_loss: 1.1918, test_loss: 1.1591, test_f1: 0.3750
 epoch: 53, train_loss: 1.1860, test_loss: 1.1595, test_f1: 0.3747
 epoch: 54, train_loss: 1.1866, test_loss: 1.1562, test_f1: 0.3761
 epoch: 55, train_loss: 1.1865, test_loss: 1.1560, test_f1: 0.3789
 epoch: 56, train_loss: 1.1882, test_loss: 1.1548, test_f1: 0.3827
 epoch: 57, train_loss: 1.1840, test_loss: 1.1536, test_f1: 0.3840
 epoch: 58, train_loss: 1.1784, test_loss: 1.1560, test_f1: 0.3838
 epoch: 59, train_loss: 1.1884, test_loss: 1.1559, test_f1: 0.3782
 epoch: 60, train_loss: 1.1824, test_loss: 1.1518, test_f1: 0.3778
 epoch: 61, train_loss: 1.1876, test_loss: 1.1487, test_f1: 0.3829
 epoch: 62, train_loss: 1.1893, test_loss: 1.1528, test_f1: 0.3810
 epoch: 63, train_loss: 1.1825, test_loss: 1.1491, test_f1: 0.3791
 epoch: 64, train_loss: 1.1762, test_loss: 1.1490, test_f1: 0.3841
 epoch: 65, train_loss: 1.1783, test_loss: 1.1478, test_f1: 0.3859
 epoch: 66, train_loss: 1.1653, test_loss: 1.1484, test_f1: 0.3822
 epoch: 67, train_loss: 1.1845, test_loss: 1.1492, test_f1: 0.3790
 epoch: 68, train_loss: 1.1728, test_loss: 1.1478, test_f1: 0.3819
 epoch: 69, train_loss: 1.1720, test_loss: 1.1484, test_f1: 0.3841
 epoch: 70, train_loss: 1.1725, test_loss: 1.1459, test_f1: 0.3872
 epoch: 71, train_loss: 1.1736, test_loss: 1.1483, test_f1: 0.3852
 epoch: 72, train_loss: 1.1790, test_loss: 1.1439, test_f1: 0.3912
 epoch: 73, train_loss: 1.1753, test_loss: 1.1448, test_f1: 0.3794
 epoch: 74, train_loss: 1.1741, test_loss: 1.1467, test_f1: 0.3839
 epoch: 75, train_loss: 1.1753, test_loss: 1.1442, test_f1: 0.3763
 epoch: 76, train_loss: 1.1764, test_loss: 1.1427, test_f1: 0.3857
 epoch: 77, train_loss: 1.1750, test_loss: 1.1412, test_f1: 0.3899
 epoch: 78, train_loss: 1.1671, test_loss: 1.1414, test_f1: 0.3863
 epoch: 79, train_loss: 1.1637, test_loss: 1.1386, test_f1: 0.3878
 epoch: 80, train_loss: 1.1677, test_loss: 1.1420, test_f1: 0.3887
 epoch: 81, train_loss: 1.1685, test_loss: 1.1375, test_f1: 0.3868
 epoch: 82, train_loss: 1.1669, test_loss: 1.1370, test_f1: 0.3809
 epoch: 83, train_loss: 1.1705, test_loss: 1.1398, test_f1: 0.3942
 epoch: 84, train_loss: 1.1705, test_loss: 1.1386, test_f1: 0.3919
 epoch: 85, train_loss: 1.1687, test_loss: 1.1364, test_f1: 0.3906
 epoch: 86, train_loss: 1.1670, test_loss: 1.1409, test_f1: 0.3824
 epoch: 87, train_loss: 1.1641, test_loss: 1.1525, test_f1: 0.3878
 epoch: 88, train_loss: 1.1653, test_loss: 1.1410, test_f1: 0.3897
 epoch: 89, train_loss: 1.1585, test_loss: 1.1394, test_f1: 0.3916
 epoch: 90, train_loss: 1.1633, test_loss: 1.1394, test_f1: 0.3833
 epoch: 91, train_loss: 1.1544, test_loss: 1.1339, test_f1: 0.3889
 epoch: 92, train_loss: 1.1562, test_loss: 1.1317, test_f1: 0.3915
 epoch: 93, train_loss: 1.1628, test_loss: 1.1343, test_f1: 0.3892
 epoch: 94, train_loss: 1.1587, test_loss: 1.1383, test_f1: 0.3957
 epoch: 95, train_loss: 1.1638, test_loss: 1.1284, test_f1: 0.3961
 epoch: 96, train_loss: 1.1550, test_loss: 1.1317, test_f1: 0.3902
 epoch: 97, train_loss: 1.1584, test_loss: 1.1368, test_f1: 0.3830
 epoch: 98, train_loss: 1.1673, test_loss: 1.1292, test_f1: 0.3890
 epoch: 99, train_loss: 1.1643, test_loss: 1.1295, test_f1: 0.3898
##################ITERATION #9 ****************************************
 epoch: 0, train_loss: 1.3304, test_loss: 1.3112, test_f1: 0.2274
 epoch: 1, train_loss: 1.3136, test_loss: 1.3063, test_f1: 0.2274
 epoch: 2, train_loss: 1.3071, test_loss: 1.2982, test_f1: 0.2274
 epoch: 3, train_loss: 1.3024, test_loss: 1.2962, test_f1: 0.2274
 epoch: 4, train_loss: 1.2965, test_loss: 1.2949, test_f1: 0.2274
 epoch: 5, train_loss: 1.2926, test_loss: 1.2881, test_f1: 0.2274
 epoch: 6, train_loss: 1.2869, test_loss: 1.2878, test_f1: 0.2274
 epoch: 7, train_loss: 1.2821, test_loss: 1.2824, test_f1: 0.2300
 epoch: 8, train_loss: 1.2767, test_loss: 1.2799, test_f1: 0.2300
 epoch: 9, train_loss: 1.2708, test_loss: 1.2779, test_f1: 0.2300
 epoch: 10, train_loss: 1.2737, test_loss: 1.2673, test_f1: 0.2364
 epoch: 11, train_loss: 1.2677, test_loss: 1.2610, test_f1: 0.2352
 epoch: 12, train_loss: 1.2654, test_loss: 1.2593, test_f1: 0.2376
 epoch: 13, train_loss: 1.2633, test_loss: 1.2568, test_f1: 0.2427
 epoch: 14, train_loss: 1.2540, test_loss: 1.2559, test_f1: 0.2391
 epoch: 15, train_loss: 1.2619, test_loss: 1.2482, test_f1: 0.2391
 epoch: 16, train_loss: 1.2608, test_loss: 1.2487, test_f1: 0.2436
 epoch: 17, train_loss: 1.2504, test_loss: 1.2433, test_f1: 0.2436
 epoch: 18, train_loss: 1.2522, test_loss: 1.2419, test_f1: 0.2499
 epoch: 19, train_loss: 1.2499, test_loss: 1.2366, test_f1: 0.2470
 epoch: 20, train_loss: 1.2485, test_loss: 1.2329, test_f1: 0.2413
 epoch: 21, train_loss: 1.2437, test_loss: 1.2342, test_f1: 0.2580
 epoch: 22, train_loss: 1.2399, test_loss: 1.2281, test_f1: 0.2757
 epoch: 23, train_loss: 1.2405, test_loss: 1.2232, test_f1: 0.2718
 epoch: 24, train_loss: 1.2449, test_loss: 1.2239, test_f1: 0.2912
 epoch: 25, train_loss: 1.2362, test_loss: 1.2270, test_f1: 0.2817
 epoch: 26, train_loss: 1.2420, test_loss: 1.2220, test_f1: 0.2985
 epoch: 27, train_loss: 1.2367, test_loss: 1.2197, test_f1: 0.3057
 epoch: 28, train_loss: 1.2333, test_loss: 1.2153, test_f1: 0.3061
 epoch: 29, train_loss: 1.2329, test_loss: 1.2104, test_f1: 0.3254
 epoch: 30, train_loss: 1.2235, test_loss: 1.2068, test_f1: 0.3243
 epoch: 31, train_loss: 1.2278, test_loss: 1.2078, test_f1: 0.3194
 epoch: 32, train_loss: 1.2290, test_loss: 1.2086, test_f1: 0.3110
 epoch: 33, train_loss: 1.2291, test_loss: 1.2010, test_f1: 0.3324
 epoch: 34, train_loss: 1.2225, test_loss: 1.1986, test_f1: 0.3303
 epoch: 35, train_loss: 1.2323, test_loss: 1.1997, test_f1: 0.3273
 epoch: 36, train_loss: 1.2219, test_loss: 1.1975, test_f1: 0.3230
 epoch: 37, train_loss: 1.2203, test_loss: 1.1965, test_f1: 0.3406
 epoch: 38, train_loss: 1.2183, test_loss: 1.1986, test_f1: 0.3424
 epoch: 39, train_loss: 1.2199, test_loss: 1.1955, test_f1: 0.3596
 epoch: 40, train_loss: 1.2246, test_loss: 1.1909, test_f1: 0.3498
 epoch: 41, train_loss: 1.2158, test_loss: 1.1917, test_f1: 0.3394
 epoch: 42, train_loss: 1.2173, test_loss: 1.1913, test_f1: 0.3522
 epoch: 43, train_loss: 1.2074, test_loss: 1.1896, test_f1: 0.3667
 epoch: 44, train_loss: 1.2174, test_loss: 1.1845, test_f1: 0.3616
 epoch: 45, train_loss: 1.2040, test_loss: 1.1885, test_f1: 0.3660
 epoch: 46, train_loss: 1.2062, test_loss: 1.1837, test_f1: 0.3775
 epoch: 47, train_loss: 1.2090, test_loss: 1.1847, test_f1: 0.3716
 epoch: 48, train_loss: 1.2108, test_loss: 1.1825, test_f1: 0.3763
 epoch: 49, train_loss: 1.1999, test_loss: 1.1811, test_f1: 0.3727
 epoch: 50, train_loss: 1.2121, test_loss: 1.1782, test_f1: 0.3756
 epoch: 51, train_loss: 1.2020, test_loss: 1.1780, test_f1: 0.3762
 epoch: 52, train_loss: 1.2067, test_loss: 1.1756, test_f1: 0.3845
 epoch: 53, train_loss: 1.2084, test_loss: 1.1785, test_f1: 0.3686
 epoch: 54, train_loss: 1.2001, test_loss: 1.1749, test_f1: 0.3772
 epoch: 55, train_loss: 1.2026, test_loss: 1.1744, test_f1: 0.3760
 epoch: 56, train_loss: 1.2086, test_loss: 1.1787, test_f1: 0.3722
 epoch: 57, train_loss: 1.1937, test_loss: 1.1765, test_f1: 0.3714
 epoch: 58, train_loss: 1.1993, test_loss: 1.1724, test_f1: 0.3800
 epoch: 59, train_loss: 1.2038, test_loss: 1.1749, test_f1: 0.3708
 epoch: 60, train_loss: 1.2041, test_loss: 1.1760, test_f1: 0.3808
 epoch: 61, train_loss: 1.2004, test_loss: 1.1743, test_f1: 0.3712
 epoch: 62, train_loss: 1.1962, test_loss: 1.1766, test_f1: 0.3740
 epoch: 63, train_loss: 1.1952, test_loss: 1.1732, test_f1: 0.3742
 epoch: 64, train_loss: 1.1984, test_loss: 1.1701, test_f1: 0.3853
 epoch: 65, train_loss: 1.1969, test_loss: 1.1726, test_f1: 0.3711
 epoch: 66, train_loss: 1.1957, test_loss: 1.1719, test_f1: 0.3749
 epoch: 67, train_loss: 1.1954, test_loss: 1.1725, test_f1: 0.3707
 epoch: 68, train_loss: 1.1946, test_loss: 1.1675, test_f1: 0.3897
 epoch: 69, train_loss: 1.1966, test_loss: 1.1692, test_f1: 0.3776
 epoch: 70, train_loss: 1.2002, test_loss: 1.1709, test_f1: 0.3785
 epoch: 71, train_loss: 1.2002, test_loss: 1.1710, test_f1: 0.3783
 epoch: 72, train_loss: 1.1930, test_loss: 1.1685, test_f1: 0.3809
 epoch: 73, train_loss: 1.1970, test_loss: 1.1709, test_f1: 0.3812
 epoch: 74, train_loss: 1.1918, test_loss: 1.1697, test_f1: 0.3780
 epoch: 75, train_loss: 1.1935, test_loss: 1.1690, test_f1: 0.3821
 epoch: 76, train_loss: 1.1959, test_loss: 1.1701, test_f1: 0.3878
 epoch: 77, train_loss: 1.1932, test_loss: 1.1687, test_f1: 0.3825
 epoch: 78, train_loss: 1.1860, test_loss: 1.1680, test_f1: 0.3859
 epoch: 79, train_loss: 1.1939, test_loss: 1.1660, test_f1: 0.3884
 epoch: 80, train_loss: 1.1959, test_loss: 1.1666, test_f1: 0.3835
 epoch: 81, train_loss: 1.1906, test_loss: 1.1654, test_f1: 0.3839
 epoch: 82, train_loss: 1.1949, test_loss: 1.1648, test_f1: 0.3886
 epoch: 83, train_loss: 1.1937, test_loss: 1.1644, test_f1: 0.3872
 epoch: 84, train_loss: 1.1914, test_loss: 1.1654, test_f1: 0.3876
 epoch: 85, train_loss: 1.1928, test_loss: 1.1667, test_f1: 0.3841
 epoch: 86, train_loss: 1.1829, test_loss: 1.1678, test_f1: 0.3787
 epoch: 87, train_loss: 1.1865, test_loss: 1.1624, test_f1: 0.3858
 epoch: 88, train_loss: 1.1928, test_loss: 1.1635, test_f1: 0.3886
 epoch: 89, train_loss: 1.1840, test_loss: 1.1635, test_f1: 0.3859
 epoch: 90, train_loss: 1.1873, test_loss: 1.1633, test_f1: 0.3807
 epoch: 91, train_loss: 1.1902, test_loss: 1.1647, test_f1: 0.3883
 epoch: 92, train_loss: 1.1827, test_loss: 1.1622, test_f1: 0.3871
 epoch: 93, train_loss: 1.1873, test_loss: 1.1602, test_f1: 0.3868
 epoch: 94, train_loss: 1.1974, test_loss: 1.1628, test_f1: 0.3787
 epoch: 95, train_loss: 1.1920, test_loss: 1.1626, test_f1: 0.3797
 epoch: 96, train_loss: 1.1811, test_loss: 1.1598, test_f1: 0.3896
 epoch: 97, train_loss: 1.1787, test_loss: 1.1594, test_f1: 0.3890
 epoch: 98, train_loss: 1.1801, test_loss: 1.1588, test_f1: 0.3836
 epoch: 99, train_loss: 1.1764, test_loss: 1.1580, test_f1: 0.3794

Training completed in 734.09 seconds
Best F1: 0.4566 at epoch 53
Mean F1 across iterations: 0.4143  0.0302
========================FINAL RESULTS================================
FEGIN weighted F1: 0.4566  0.0302
python main.py --data ltspice_examples --representation component_component --model FEGIN --layers 5 --hiddens 16 --batch_size 64 --lr 0.0001 --emb_size 128 --epochs 100 --save_appendix component_component_L5_H16_BS64_LR0.0001_E128 --no_val
-----



STDERR:
  File "main.py", line 370, in <module>
    main()
  File "main.py", line 254, in main
    dataset = dataset_class(
  File "/home/philip/projects/ltspice_examples_code_repo/Circuit-Completion-Using-GNNs/component_classification_with_link_prediction_head/evaluation/FEGIN/kernel/circuit_datasets.py", line 15, in __init__
    self.data, self.slices = torch.load(self.processed_paths[0])
  File "/home/philip/.local/lib/python3.8/site-packages/torch/serialization.py", line 1040, in load
    warnings.warn(
  File "/usr/lib/python3.8/warnings.py", line 109, in _showwarnmsg
    sw(msg.message, msg.category, msg.filename, msg.lineno,
  File "main.py", line 47, in warn_with_traceback
    traceback.print_stack(file=log)
/home/philip/projects/ltspice_examples_code_repo/Circuit-Completion-Using-GNNs/component_classification_with_link_prediction_head/evaluation/FEGIN/kernel/circuit_datasets.py:15: FutureWarning: You are using `torch.load` with `weights_only=False` (the current default value), which uses the default pickle module implicitly. It is possible to construct malicious pickle data which will execute arbitrary code during unpickling (See https://github.com/pytorch/pytorch/blob/main/SECURITY.md#untrusted-models for more details). In a future release, the default value for `weights_only` will be flipped to `True`. This limits the functions that could be executed during unpickling. Arbitrary objects will no longer be allowed to be loaded via this mode unless they are explicitly allowlisted by the user via `torch.serialization.add_safe_globals`. We recommend you start setting `weights_only=True` for any use case where you don't have full control of the loaded file. Please open an issue on GitHub for any issues related to this experimental feature.
  self.data, self.slices = torch.load(self.processed_paths[0])
