STDOUT:
Results will be saved in /home/philip/projects/ltspice_examples_code_repo/Circuit-Completion-Using-GNNs/component_classification_with_link_prediction_head/evaluation/FEGIN/results/model_FEGIN_dataset_ltspice_examples
Command line input: python main.py --data ltspice_examples --representation component_net --model FEGIN --layers 5 --hiddens 64 --batch_size 64 --lr 0.001 --emb_size 512 --epochs 100 --save_appendix component_net_L5_H64_BS64_LR0.001_E512 --no_val
 is saved.
-----
ltspice_examples - FEGIN
Using 5 layers, 64 hidden units, h = 2
Loading component_net representation dataset
ENTERED
Training FEGIN on component_net representation
Train: 3558, Test: 846
##################ITERATION #0 ****************************************
 epoch: 0, train_loss: 1.2577, test_loss: 1.1278, test_f1: 0.3503
 epoch: 1, train_loss: 1.1144, test_loss: 1.0337, test_f1: 0.4977
 epoch: 2, train_loss: 1.0189, test_loss: 0.9267, test_f1: 0.5024
 epoch: 3, train_loss: 0.9855, test_loss: 0.9667, test_f1: 0.5242
 epoch: 4, train_loss: 0.9526, test_loss: 0.9442, test_f1: 0.4824
 epoch: 5, train_loss: 0.9301, test_loss: 0.9706, test_f1: 0.5189
 epoch: 6, train_loss: 0.9052, test_loss: 0.9022, test_f1: 0.5265
 epoch: 7, train_loss: 0.9007, test_loss: 0.9282, test_f1: 0.5678
 epoch: 8, train_loss: 0.8753, test_loss: 0.8717, test_f1: 0.5706
 epoch: 9, train_loss: 0.8708, test_loss: 0.9305, test_f1: 0.5738
 epoch: 10, train_loss: 0.8518, test_loss: 0.9319, test_f1: 0.5338
 epoch: 11, train_loss: 0.8363, test_loss: 0.9238, test_f1: 0.5293
 epoch: 12, train_loss: 0.8471, test_loss: 0.9186, test_f1: 0.5679
 epoch: 13, train_loss: 0.8266, test_loss: 1.0028, test_f1: 0.5199
 epoch: 14, train_loss: 0.8248, test_loss: 0.9398, test_f1: 0.5726
 epoch: 15, train_loss: 0.8057, test_loss: 0.9282, test_f1: 0.5985
 epoch: 16, train_loss: 0.8044, test_loss: 0.8706, test_f1: 0.5864
 epoch: 17, train_loss: 0.7888, test_loss: 0.9107, test_f1: 0.5788
 epoch: 18, train_loss: 0.7895, test_loss: 0.8956, test_f1: 0.5839
 epoch: 19, train_loss: 0.7703, test_loss: 0.9403, test_f1: 0.5759
 epoch: 20, train_loss: 0.7562, test_loss: 1.0053, test_f1: 0.5849
 epoch: 21, train_loss: 0.7568, test_loss: 0.9595, test_f1: 0.5873
 epoch: 22, train_loss: 0.7600, test_loss: 0.8966, test_f1: 0.6225
 epoch: 23, train_loss: 0.7486, test_loss: 0.9729, test_f1: 0.5707
 epoch: 24, train_loss: 0.7475, test_loss: 0.9096, test_f1: 0.6313
 epoch: 25, train_loss: 0.7357, test_loss: 0.8900, test_f1: 0.6313
 epoch: 26, train_loss: 0.7214, test_loss: 0.8972, test_f1: 0.6232
 epoch: 27, train_loss: 0.7094, test_loss: 0.9612, test_f1: 0.6199
 epoch: 28, train_loss: 0.7050, test_loss: 0.9347, test_f1: 0.6179
 epoch: 29, train_loss: 0.6856, test_loss: 0.9104, test_f1: 0.6598
 epoch: 30, train_loss: 0.6877, test_loss: 0.9265, test_f1: 0.5937
 epoch: 31, train_loss: 0.6764, test_loss: 0.9076, test_f1: 0.6201
 epoch: 32, train_loss: 0.6777, test_loss: 0.9529, test_f1: 0.5771
 epoch: 33, train_loss: 0.6600, test_loss: 0.9830, test_f1: 0.5634
 epoch: 34, train_loss: 0.6818, test_loss: 0.9172, test_f1: 0.6325
 epoch: 35, train_loss: 0.6532, test_loss: 0.9542, test_f1: 0.6238
 epoch: 36, train_loss: 0.6503, test_loss: 0.8862, test_f1: 0.6490
 epoch: 37, train_loss: 0.6522, test_loss: 0.9526, test_f1: 0.6251
 epoch: 38, train_loss: 0.6351, test_loss: 0.9769, test_f1: 0.6408
 epoch: 39, train_loss: 0.6333, test_loss: 0.9263, test_f1: 0.6444
 epoch: 40, train_loss: 0.6188, test_loss: 1.0183, test_f1: 0.6178
 epoch: 41, train_loss: 0.6131, test_loss: 1.0468, test_f1: 0.6193
 epoch: 42, train_loss: 0.6138, test_loss: 1.0613, test_f1: 0.6085
 epoch: 43, train_loss: 0.6127, test_loss: 1.0699, test_f1: 0.6004
 epoch: 44, train_loss: 0.6002, test_loss: 0.9287, test_f1: 0.6673
 epoch: 45, train_loss: 0.5865, test_loss: 0.9603, test_f1: 0.6181
 epoch: 46, train_loss: 0.5617, test_loss: 1.0311, test_f1: 0.6146
 epoch: 47, train_loss: 0.5718, test_loss: 0.9939, test_f1: 0.6429
 epoch: 48, train_loss: 0.5822, test_loss: 0.9059, test_f1: 0.6765
 epoch: 49, train_loss: 0.5661, test_loss: 1.0128, test_f1: 0.6447
 epoch: 50, train_loss: 0.5555, test_loss: 1.0110, test_f1: 0.6185
 epoch: 51, train_loss: 0.5249, test_loss: 0.9577, test_f1: 0.6787
 epoch: 52, train_loss: 0.4852, test_loss: 1.0154, test_f1: 0.6270
 epoch: 53, train_loss: 0.4790, test_loss: 1.0666, test_f1: 0.6521
 epoch: 54, train_loss: 0.4719, test_loss: 1.0535, test_f1: 0.6287
 epoch: 55, train_loss: 0.4584, test_loss: 1.1057, test_f1: 0.6375
 epoch: 56, train_loss: 0.4605, test_loss: 1.0636, test_f1: 0.6370
 epoch: 57, train_loss: 0.4552, test_loss: 1.1265, test_f1: 0.6449
 epoch: 58, train_loss: 0.4465, test_loss: 1.0926, test_f1: 0.6610
 epoch: 59, train_loss: 0.4492, test_loss: 1.0647, test_f1: 0.6432
 epoch: 60, train_loss: 0.4425, test_loss: 1.1351, test_f1: 0.6586
 epoch: 61, train_loss: 0.4317, test_loss: 1.1171, test_f1: 0.6667
 epoch: 62, train_loss: 0.4221, test_loss: 1.1499, test_f1: 0.6410
 epoch: 63, train_loss: 0.4258, test_loss: 1.1094, test_f1: 0.6536
 epoch: 64, train_loss: 0.4222, test_loss: 1.0854, test_f1: 0.6584
 epoch: 65, train_loss: 0.4130, test_loss: 1.1065, test_f1: 0.6531
 epoch: 66, train_loss: 0.4156, test_loss: 1.1581, test_f1: 0.6313
 epoch: 67, train_loss: 0.4067, test_loss: 1.1441, test_f1: 0.6468
 epoch: 68, train_loss: 0.4023, test_loss: 1.1021, test_f1: 0.6662
 epoch: 69, train_loss: 0.4062, test_loss: 1.0934, test_f1: 0.6708
 epoch: 70, train_loss: 0.3891, test_loss: 1.2278, test_f1: 0.6308
 epoch: 71, train_loss: 0.3874, test_loss: 1.1405, test_f1: 0.6667
 epoch: 72, train_loss: 0.3778, test_loss: 1.1825, test_f1: 0.6609
 epoch: 73, train_loss: 0.3952, test_loss: 1.2288, test_f1: 0.6434
 epoch: 74, train_loss: 0.3900, test_loss: 1.2299, test_f1: 0.6523
 epoch: 75, train_loss: 0.3788, test_loss: 1.2480, test_f1: 0.6601
 epoch: 76, train_loss: 0.3905, test_loss: 1.2013, test_f1: 0.6604
 epoch: 77, train_loss: 0.3864, test_loss: 1.2804, test_f1: 0.6488
 epoch: 78, train_loss: 0.3638, test_loss: 1.2201, test_f1: 0.6485
 epoch: 79, train_loss: 0.3611, test_loss: 1.3046, test_f1: 0.6530
 epoch: 80, train_loss: 0.3663, test_loss: 1.2907, test_f1: 0.6485
 epoch: 81, train_loss: 0.3409, test_loss: 1.2797, test_f1: 0.6619
 epoch: 82, train_loss: 0.3434, test_loss: 1.2521, test_f1: 0.6740
 epoch: 83, train_loss: 0.3578, test_loss: 1.2827, test_f1: 0.6490
 epoch: 84, train_loss: 0.3528, test_loss: 1.3191, test_f1: 0.6513
 epoch: 85, train_loss: 0.3501, test_loss: 1.2204, test_f1: 0.6498
 epoch: 86, train_loss: 0.3487, test_loss: 1.3869, test_f1: 0.6494
 epoch: 87, train_loss: 0.3376, test_loss: 1.3372, test_f1: 0.6533
 epoch: 88, train_loss: 0.3477, test_loss: 1.3343, test_f1: 0.6660
 epoch: 89, train_loss: 0.3264, test_loss: 1.3990, test_f1: 0.6479
 epoch: 90, train_loss: 0.3292, test_loss: 1.4889, test_f1: 0.6302
 epoch: 91, train_loss: 0.3088, test_loss: 1.2857, test_f1: 0.6652
 epoch: 92, train_loss: 0.3066, test_loss: 1.5828, test_f1: 0.6187
 epoch: 93, train_loss: 0.3395, test_loss: 1.5377, test_f1: 0.6441
 epoch: 94, train_loss: 0.3248, test_loss: 1.4307, test_f1: 0.6479
 epoch: 95, train_loss: 0.3282, test_loss: 1.3771, test_f1: 0.6357
 epoch: 96, train_loss: 0.3308, test_loss: 1.3209, test_f1: 0.6422
 epoch: 97, train_loss: 0.3151, test_loss: 1.4129, test_f1: 0.6349
 epoch: 98, train_loss: 0.3112, test_loss: 1.4443, test_f1: 0.6611
 epoch: 99, train_loss: 0.3198, test_loss: 1.3642, test_f1: 0.6787
##################ITERATION #1 ****************************************
 epoch: 0, train_loss: 1.1505, test_loss: 1.0121, test_f1: 0.4839
 epoch: 1, train_loss: 1.0149, test_loss: 0.9933, test_f1: 0.4712
 epoch: 2, train_loss: 0.9760, test_loss: 0.9689, test_f1: 0.4980
 epoch: 3, train_loss: 0.9491, test_loss: 0.9633, test_f1: 0.5136
 epoch: 4, train_loss: 0.9246, test_loss: 0.9632, test_f1: 0.5160
 epoch: 5, train_loss: 0.9050, test_loss: 0.8676, test_f1: 0.5395
 epoch: 6, train_loss: 0.8964, test_loss: 0.9004, test_f1: 0.5365
 epoch: 7, train_loss: 0.8812, test_loss: 0.9196, test_f1: 0.5325
 epoch: 8, train_loss: 0.8603, test_loss: 0.9153, test_f1: 0.5810
 epoch: 9, train_loss: 0.8386, test_loss: 0.9564, test_f1: 0.5427
 epoch: 10, train_loss: 0.8474, test_loss: 0.9574, test_f1: 0.5423
 epoch: 11, train_loss: 0.8300, test_loss: 0.9300, test_f1: 0.5962
 epoch: 12, train_loss: 0.8097, test_loss: 0.9587, test_f1: 0.5690
 epoch: 13, train_loss: 0.8067, test_loss: 0.9592, test_f1: 0.5727
 epoch: 14, train_loss: 0.8235, test_loss: 0.9513, test_f1: 0.5880
 epoch: 15, train_loss: 0.8016, test_loss: 1.0267, test_f1: 0.5489
 epoch: 16, train_loss: 0.7901, test_loss: 0.9145, test_f1: 0.5961
 epoch: 17, train_loss: 0.7841, test_loss: 0.9844, test_f1: 0.5573
 epoch: 18, train_loss: 0.7769, test_loss: 1.0035, test_f1: 0.5680
 epoch: 19, train_loss: 0.7469, test_loss: 0.9690, test_f1: 0.5827
 epoch: 20, train_loss: 0.7511, test_loss: 0.8966, test_f1: 0.6021
 epoch: 21, train_loss: 0.7457, test_loss: 0.9317, test_f1: 0.6236
 epoch: 22, train_loss: 0.7516, test_loss: 0.9964, test_f1: 0.5757
 epoch: 23, train_loss: 0.7563, test_loss: 0.9398, test_f1: 0.5785
 epoch: 24, train_loss: 0.7274, test_loss: 0.8391, test_f1: 0.6247
 epoch: 25, train_loss: 0.7183, test_loss: 0.9356, test_f1: 0.6280
 epoch: 26, train_loss: 0.7370, test_loss: 0.9685, test_f1: 0.5586
 epoch: 27, train_loss: 0.7189, test_loss: 0.9167, test_f1: 0.6160
 epoch: 28, train_loss: 0.6974, test_loss: 1.0222, test_f1: 0.5882
 epoch: 29, train_loss: 0.6832, test_loss: 1.0487, test_f1: 0.6181
 epoch: 30, train_loss: 0.6958, test_loss: 0.9961, test_f1: 0.6103
 epoch: 31, train_loss: 0.6799, test_loss: 0.9337, test_f1: 0.5813
 epoch: 32, train_loss: 0.6572, test_loss: 0.9992, test_f1: 0.6335
 epoch: 33, train_loss: 0.6713, test_loss: 0.9564, test_f1: 0.6263
 epoch: 34, train_loss: 0.6624, test_loss: 1.2743, test_f1: 0.5495
 epoch: 35, train_loss: 0.6466, test_loss: 0.9740, test_f1: 0.6457
 epoch: 36, train_loss: 0.6447, test_loss: 1.0552, test_f1: 0.6341
 epoch: 37, train_loss: 0.6549, test_loss: 1.0130, test_f1: 0.5965
 epoch: 38, train_loss: 0.6398, test_loss: 1.0163, test_f1: 0.5965
 epoch: 39, train_loss: 0.6163, test_loss: 1.0277, test_f1: 0.6357
 epoch: 40, train_loss: 0.6145, test_loss: 0.9827, test_f1: 0.6321
 epoch: 41, train_loss: 0.6399, test_loss: 1.0005, test_f1: 0.6073
 epoch: 42, train_loss: 0.6101, test_loss: 1.0935, test_f1: 0.6281
 epoch: 43, train_loss: 0.6056, test_loss: 1.0122, test_f1: 0.6251
 epoch: 44, train_loss: 0.5918, test_loss: 1.0313, test_f1: 0.6486
 epoch: 45, train_loss: 0.5809, test_loss: 1.1258, test_f1: 0.6190
 epoch: 46, train_loss: 0.5587, test_loss: 1.0693, test_f1: 0.6317
 epoch: 47, train_loss: 0.5649, test_loss: 1.0296, test_f1: 0.6494
 epoch: 48, train_loss: 0.5851, test_loss: 0.9672, test_f1: 0.6679
 epoch: 49, train_loss: 0.5536, test_loss: 1.0648, test_f1: 0.6429
 epoch: 50, train_loss: 0.5545, test_loss: 1.1040, test_f1: 0.6383
 epoch: 51, train_loss: 0.5195, test_loss: 1.0378, test_f1: 0.6419
 epoch: 52, train_loss: 0.4805, test_loss: 1.0935, test_f1: 0.6684
 epoch: 53, train_loss: 0.4797, test_loss: 1.1243, test_f1: 0.6684
 epoch: 54, train_loss: 0.4594, test_loss: 1.1315, test_f1: 0.6390
 epoch: 55, train_loss: 0.4545, test_loss: 1.1937, test_f1: 0.6378
 epoch: 56, train_loss: 0.4520, test_loss: 1.1042, test_f1: 0.6587
 epoch: 57, train_loss: 0.4548, test_loss: 1.0973, test_f1: 0.6734
 epoch: 58, train_loss: 0.4521, test_loss: 1.1361, test_f1: 0.6514
 epoch: 59, train_loss: 0.4503, test_loss: 1.0849, test_f1: 0.6579
 epoch: 60, train_loss: 0.4382, test_loss: 1.1177, test_f1: 0.6531
 epoch: 61, train_loss: 0.4217, test_loss: 1.1985, test_f1: 0.6528
 epoch: 62, train_loss: 0.4297, test_loss: 1.1820, test_f1: 0.6634
 epoch: 63, train_loss: 0.4180, test_loss: 1.1784, test_f1: 0.6543
 epoch: 64, train_loss: 0.4347, test_loss: 1.1374, test_f1: 0.6585
 epoch: 65, train_loss: 0.4172, test_loss: 1.1342, test_f1: 0.6575
 epoch: 66, train_loss: 0.4068, test_loss: 1.2099, test_f1: 0.6513
 epoch: 67, train_loss: 0.3852, test_loss: 1.2067, test_f1: 0.6561
 epoch: 68, train_loss: 0.4204, test_loss: 1.2560, test_f1: 0.6541
 epoch: 69, train_loss: 0.4007, test_loss: 1.2347, test_f1: 0.6398
 epoch: 70, train_loss: 0.3865, test_loss: 1.2286, test_f1: 0.6654
 epoch: 71, train_loss: 0.3836, test_loss: 1.2026, test_f1: 0.6490
 epoch: 72, train_loss: 0.3825, test_loss: 1.2552, test_f1: 0.6367
 epoch: 73, train_loss: 0.3710, test_loss: 1.2671, test_f1: 0.6539
 epoch: 74, train_loss: 0.3899, test_loss: 1.2688, test_f1: 0.6547
 epoch: 75, train_loss: 0.3848, test_loss: 1.2915, test_f1: 0.6462
 epoch: 76, train_loss: 0.3662, test_loss: 1.2385, test_f1: 0.6615
 epoch: 77, train_loss: 0.3665, test_loss: 1.2290, test_f1: 0.6688
 epoch: 78, train_loss: 0.3652, test_loss: 1.3344, test_f1: 0.6595
 epoch: 79, train_loss: 0.3568, test_loss: 1.3060, test_f1: 0.6355
 epoch: 80, train_loss: 0.3617, test_loss: 1.3448, test_f1: 0.6321
 epoch: 81, train_loss: 0.3691, test_loss: 1.3617, test_f1: 0.6626
 epoch: 82, train_loss: 0.3608, test_loss: 1.3455, test_f1: 0.6546
 epoch: 83, train_loss: 0.3510, test_loss: 1.2496, test_f1: 0.6679
 epoch: 84, train_loss: 0.3618, test_loss: 1.3596, test_f1: 0.6415
 epoch: 85, train_loss: 0.3425, test_loss: 1.2994, test_f1: 0.6530
 epoch: 86, train_loss: 0.3503, test_loss: 1.4650, test_f1: 0.6288
 epoch: 87, train_loss: 0.3330, test_loss: 1.4089, test_f1: 0.6446
 epoch: 88, train_loss: 0.3385, test_loss: 1.3865, test_f1: 0.6436
 epoch: 89, train_loss: 0.3367, test_loss: 1.4407, test_f1: 0.6347
 epoch: 90, train_loss: 0.3431, test_loss: 1.4034, test_f1: 0.6380
 epoch: 91, train_loss: 0.3306, test_loss: 1.4544, test_f1: 0.6519
 epoch: 92, train_loss: 0.3234, test_loss: 1.3477, test_f1: 0.6491
 epoch: 93, train_loss: 0.3293, test_loss: 1.4100, test_f1: 0.6249
 epoch: 94, train_loss: 0.3161, test_loss: 1.4178, test_f1: 0.6444
 epoch: 95, train_loss: 0.3313, test_loss: 1.4177, test_f1: 0.6388
 epoch: 96, train_loss: 0.3100, test_loss: 1.6492, test_f1: 0.6290
 epoch: 97, train_loss: 0.3263, test_loss: 1.4372, test_f1: 0.6216
 epoch: 98, train_loss: 0.3290, test_loss: 1.4460, test_f1: 0.6495
 epoch: 99, train_loss: 0.3025, test_loss: 1.5815, test_f1: 0.6447
##################ITERATION #2 ****************************************
 epoch: 0, train_loss: 1.2026, test_loss: 1.0778, test_f1: 0.3685
 epoch: 1, train_loss: 1.0347, test_loss: 0.9350, test_f1: 0.5369
 epoch: 2, train_loss: 0.9674, test_loss: 0.9326, test_f1: 0.5463
 epoch: 3, train_loss: 0.9486, test_loss: 0.9509, test_f1: 0.5329
 epoch: 4, train_loss: 0.9220, test_loss: 0.9359, test_f1: 0.5504
 epoch: 5, train_loss: 0.9091, test_loss: 0.9044, test_f1: 0.5413
 epoch: 6, train_loss: 0.8942, test_loss: 0.9189, test_f1: 0.5800
 epoch: 7, train_loss: 0.8805, test_loss: 0.9594, test_f1: 0.5814
 epoch: 8, train_loss: 0.8762, test_loss: 0.9061, test_f1: 0.5914
 epoch: 9, train_loss: 0.8667, test_loss: 0.9757, test_f1: 0.5335
 epoch: 10, train_loss: 0.8487, test_loss: 0.9090, test_f1: 0.5765
 epoch: 11, train_loss: 0.8374, test_loss: 0.8868, test_f1: 0.5857
 epoch: 12, train_loss: 0.8266, test_loss: 0.8936, test_f1: 0.6049
 epoch: 13, train_loss: 0.8081, test_loss: 0.9496, test_f1: 0.5647
 epoch: 14, train_loss: 0.8075, test_loss: 0.8629, test_f1: 0.5770
 epoch: 15, train_loss: 0.8056, test_loss: 0.9781, test_f1: 0.5835
 epoch: 16, train_loss: 0.8016, test_loss: 0.9747, test_f1: 0.5725
 epoch: 17, train_loss: 0.7806, test_loss: 0.9678, test_f1: 0.5416
 epoch: 18, train_loss: 0.7834, test_loss: 0.9228, test_f1: 0.5746
 epoch: 19, train_loss: 0.7743, test_loss: 0.9149, test_f1: 0.6303
 epoch: 20, train_loss: 0.7573, test_loss: 0.9362, test_f1: 0.5932
 epoch: 21, train_loss: 0.7529, test_loss: 0.9218, test_f1: 0.6352
 epoch: 22, train_loss: 0.7671, test_loss: 0.9207, test_f1: 0.6198
 epoch: 23, train_loss: 0.7597, test_loss: 0.9351, test_f1: 0.6132
 epoch: 24, train_loss: 0.7537, test_loss: 0.9280, test_f1: 0.5970
 epoch: 25, train_loss: 0.7408, test_loss: 0.9083, test_f1: 0.6116
 epoch: 26, train_loss: 0.7303, test_loss: 0.9123, test_f1: 0.6049
 epoch: 27, train_loss: 0.7176, test_loss: 0.9288, test_f1: 0.6496
 epoch: 28, train_loss: 0.7150, test_loss: 0.9613, test_f1: 0.5819
 epoch: 29, train_loss: 0.6920, test_loss: 0.9423, test_f1: 0.6123
 epoch: 30, train_loss: 0.7048, test_loss: 0.9368, test_f1: 0.6741
 epoch: 31, train_loss: 0.6788, test_loss: 0.9418, test_f1: 0.6391
 epoch: 32, train_loss: 0.6920, test_loss: 0.9595, test_f1: 0.5904
 epoch: 33, train_loss: 0.6917, test_loss: 0.9189, test_f1: 0.6415
 epoch: 34, train_loss: 0.6944, test_loss: 1.0326, test_f1: 0.5758
 epoch: 35, train_loss: 0.7118, test_loss: 0.9536, test_f1: 0.6077
 epoch: 36, train_loss: 0.6688, test_loss: 0.9286, test_f1: 0.6298
 epoch: 37, train_loss: 0.6745, test_loss: 0.9605, test_f1: 0.6408
 epoch: 38, train_loss: 0.6754, test_loss: 0.9527, test_f1: 0.6356
 epoch: 39, train_loss: 0.6513, test_loss: 0.9766, test_f1: 0.6300
 epoch: 40, train_loss: 0.6664, test_loss: 0.9523, test_f1: 0.6441
 epoch: 41, train_loss: 0.6487, test_loss: 0.9746, test_f1: 0.6344
 epoch: 42, train_loss: 0.6259, test_loss: 0.9988, test_f1: 0.6327
 epoch: 43, train_loss: 0.6433, test_loss: 1.0072, test_f1: 0.6270
 epoch: 44, train_loss: 0.6380, test_loss: 0.9521, test_f1: 0.6398
 epoch: 45, train_loss: 0.6526, test_loss: 1.0043, test_f1: 0.6295
 epoch: 46, train_loss: 0.6219, test_loss: 0.9574, test_f1: 0.6424
 epoch: 47, train_loss: 0.6000, test_loss: 0.9897, test_f1: 0.6513
 epoch: 48, train_loss: 0.6000, test_loss: 1.1383, test_f1: 0.6282
 epoch: 49, train_loss: 0.5941, test_loss: 0.9927, test_f1: 0.6712
 epoch: 50, train_loss: 0.5727, test_loss: 0.9782, test_f1: 0.6590
 epoch: 51, train_loss: 0.5460, test_loss: 0.9652, test_f1: 0.6721
 epoch: 52, train_loss: 0.5423, test_loss: 0.9840, test_f1: 0.6538
 epoch: 53, train_loss: 0.5130, test_loss: 1.0008, test_f1: 0.6456
 epoch: 54, train_loss: 0.5022, test_loss: 1.0242, test_f1: 0.6472
 epoch: 55, train_loss: 0.4951, test_loss: 1.0321, test_f1: 0.6626
 epoch: 56, train_loss: 0.5031, test_loss: 1.0791, test_f1: 0.6671
 epoch: 57, train_loss: 0.5008, test_loss: 1.0401, test_f1: 0.6496
 epoch: 58, train_loss: 0.4864, test_loss: 1.0738, test_f1: 0.6646
 epoch: 59, train_loss: 0.4870, test_loss: 1.0795, test_f1: 0.6560
 epoch: 60, train_loss: 0.4863, test_loss: 1.0912, test_f1: 0.6574
 epoch: 61, train_loss: 0.4607, test_loss: 1.0988, test_f1: 0.6610
 epoch: 62, train_loss: 0.4540, test_loss: 1.1188, test_f1: 0.6819
 epoch: 63, train_loss: 0.4645, test_loss: 1.1258, test_f1: 0.6622
 epoch: 64, train_loss: 0.4618, test_loss: 1.1450, test_f1: 0.6679
 epoch: 65, train_loss: 0.4408, test_loss: 1.1610, test_f1: 0.6446
 epoch: 66, train_loss: 0.4464, test_loss: 1.2306, test_f1: 0.6398
 epoch: 67, train_loss: 0.4383, test_loss: 1.1969, test_f1: 0.6573
 epoch: 68, train_loss: 0.4341, test_loss: 1.1457, test_f1: 0.6545
 epoch: 69, train_loss: 0.4380, test_loss: 1.2026, test_f1: 0.6591
 epoch: 70, train_loss: 0.4396, test_loss: 1.2108, test_f1: 0.6519
 epoch: 71, train_loss: 0.4629, test_loss: 1.2325, test_f1: 0.6518
 epoch: 72, train_loss: 0.4343, test_loss: 1.2720, test_f1: 0.6535
 epoch: 73, train_loss: 0.4197, test_loss: 1.2128, test_f1: 0.6809
 epoch: 74, train_loss: 0.4130, test_loss: 1.3066, test_f1: 0.6654
 epoch: 75, train_loss: 0.4193, test_loss: 1.2540, test_f1: 0.6420
 epoch: 76, train_loss: 0.4181, test_loss: 1.2129, test_f1: 0.6582
 epoch: 77, train_loss: 0.4112, test_loss: 1.1799, test_f1: 0.6746
 epoch: 78, train_loss: 0.4081, test_loss: 1.2606, test_f1: 0.6537
 epoch: 79, train_loss: 0.3963, test_loss: 1.2229, test_f1: 0.6617
 epoch: 80, train_loss: 0.4032, test_loss: 1.2438, test_f1: 0.6572
 epoch: 81, train_loss: 0.4043, test_loss: 1.3233, test_f1: 0.6346
 epoch: 82, train_loss: 0.3993, test_loss: 1.2690, test_f1: 0.6759
 epoch: 83, train_loss: 0.3759, test_loss: 1.3099, test_f1: 0.6509
 epoch: 84, train_loss: 0.3821, test_loss: 1.3804, test_f1: 0.6471
 epoch: 85, train_loss: 0.3784, test_loss: 1.3009, test_f1: 0.6592
 epoch: 86, train_loss: 0.3725, test_loss: 1.3387, test_f1: 0.6553
 epoch: 87, train_loss: 0.3652, test_loss: 1.3141, test_f1: 0.6547
 epoch: 88, train_loss: 0.3632, test_loss: 1.3813, test_f1: 0.6562
 epoch: 89, train_loss: 0.3800, test_loss: 1.3258, test_f1: 0.6621
 epoch: 90, train_loss: 0.3608, test_loss: 1.3264, test_f1: 0.6569
 epoch: 91, train_loss: 0.3431, test_loss: 1.3393, test_f1: 0.6378
 epoch: 92, train_loss: 0.3444, test_loss: 1.3318, test_f1: 0.6775
 epoch: 93, train_loss: 0.3669, test_loss: 1.3585, test_f1: 0.6551
 epoch: 94, train_loss: 0.3591, test_loss: 1.5038, test_f1: 0.6374
 epoch: 95, train_loss: 0.3530, test_loss: 1.3673, test_f1: 0.6507
 epoch: 96, train_loss: 0.3652, test_loss: 1.3352, test_f1: 0.6428
 epoch: 97, train_loss: 0.3618, test_loss: 1.4249, test_f1: 0.6393
 epoch: 98, train_loss: 0.3535, test_loss: 1.4117, test_f1: 0.6416
 epoch: 99, train_loss: 0.3401, test_loss: 1.4909, test_f1: 0.6306
##################ITERATION #3 ****************************************
 epoch: 0, train_loss: 1.2406, test_loss: 1.0533, test_f1: 0.4506
 epoch: 1, train_loss: 1.0558, test_loss: 0.9820, test_f1: 0.4983
 epoch: 2, train_loss: 0.9952, test_loss: 1.0109, test_f1: 0.4924
 epoch: 3, train_loss: 0.9608, test_loss: 0.9306, test_f1: 0.5459
 epoch: 4, train_loss: 0.9412, test_loss: 0.9570, test_f1: 0.4880
 epoch: 5, train_loss: 0.9246, test_loss: 0.9616, test_f1: 0.5172
 epoch: 6, train_loss: 0.9094, test_loss: 0.9277, test_f1: 0.5072
 epoch: 7, train_loss: 0.8953, test_loss: 0.9452, test_f1: 0.5676
 epoch: 8, train_loss: 0.8677, test_loss: 0.8975, test_f1: 0.5755
 epoch: 9, train_loss: 0.8604, test_loss: 0.9317, test_f1: 0.5440
 epoch: 10, train_loss: 0.8540, test_loss: 0.9465, test_f1: 0.5707
 epoch: 11, train_loss: 0.8490, test_loss: 0.8827, test_f1: 0.5838
 epoch: 12, train_loss: 0.8355, test_loss: 0.9255, test_f1: 0.5452
 epoch: 13, train_loss: 0.8192, test_loss: 0.9412, test_f1: 0.5643
 epoch: 14, train_loss: 0.8384, test_loss: 0.9466, test_f1: 0.5649
 epoch: 15, train_loss: 0.8228, test_loss: 0.9188, test_f1: 0.5798
 epoch: 16, train_loss: 0.8144, test_loss: 0.9399, test_f1: 0.5689
 epoch: 17, train_loss: 0.8051, test_loss: 0.9411, test_f1: 0.5957
 epoch: 18, train_loss: 0.7885, test_loss: 0.9500, test_f1: 0.5671
 epoch: 19, train_loss: 0.7708, test_loss: 0.9607, test_f1: 0.5867
 epoch: 20, train_loss: 0.7765, test_loss: 0.9570, test_f1: 0.6345
 epoch: 21, train_loss: 0.7664, test_loss: 1.0178, test_f1: 0.5887
 epoch: 22, train_loss: 0.7623, test_loss: 0.9922, test_f1: 0.5786
 epoch: 23, train_loss: 0.7492, test_loss: 1.0410, test_f1: 0.5911
 epoch: 24, train_loss: 0.7542, test_loss: 0.9599, test_f1: 0.6121
 epoch: 25, train_loss: 0.7503, test_loss: 0.9186, test_f1: 0.5891
 epoch: 26, train_loss: 0.7421, test_loss: 0.9863, test_f1: 0.5971
 epoch: 27, train_loss: 0.7262, test_loss: 0.9882, test_f1: 0.5890
 epoch: 28, train_loss: 0.7109, test_loss: 1.0390, test_f1: 0.6080
 epoch: 29, train_loss: 0.7156, test_loss: 0.9162, test_f1: 0.6290
 epoch: 30, train_loss: 0.6956, test_loss: 0.9333, test_f1: 0.6209
 epoch: 31, train_loss: 0.7140, test_loss: 0.9361, test_f1: 0.5950
 epoch: 32, train_loss: 0.6893, test_loss: 0.9696, test_f1: 0.6093
 epoch: 33, train_loss: 0.6850, test_loss: 0.9120, test_f1: 0.6137
 epoch: 34, train_loss: 0.6792, test_loss: 0.9386, test_f1: 0.6351
 epoch: 35, train_loss: 0.6656, test_loss: 0.9149, test_f1: 0.6120
 epoch: 36, train_loss: 0.6756, test_loss: 0.9988, test_f1: 0.5961
 epoch: 37, train_loss: 0.6654, test_loss: 0.9654, test_f1: 0.6113
 epoch: 38, train_loss: 0.6706, test_loss: 0.9070, test_f1: 0.5920
 epoch: 39, train_loss: 0.6673, test_loss: 0.9821, test_f1: 0.6031
 epoch: 40, train_loss: 0.6343, test_loss: 1.0032, test_f1: 0.6247
 epoch: 41, train_loss: 0.6414, test_loss: 0.9307, test_f1: 0.6564
 epoch: 42, train_loss: 0.6210, test_loss: 0.9571, test_f1: 0.6414
 epoch: 43, train_loss: 0.6152, test_loss: 0.9224, test_f1: 0.6382
 epoch: 44, train_loss: 0.6249, test_loss: 0.9563, test_f1: 0.6391
 epoch: 45, train_loss: 0.6045, test_loss: 0.9512, test_f1: 0.6787
 epoch: 46, train_loss: 0.5994, test_loss: 0.9612, test_f1: 0.6472
 epoch: 47, train_loss: 0.5892, test_loss: 1.0585, test_f1: 0.6058
 epoch: 48, train_loss: 0.5932, test_loss: 1.0474, test_f1: 0.6225
 epoch: 49, train_loss: 0.6059, test_loss: 1.0182, test_f1: 0.6068
 epoch: 50, train_loss: 0.6041, test_loss: 1.0228, test_f1: 0.6519
 epoch: 51, train_loss: 0.5621, test_loss: 1.0174, test_f1: 0.6356
 epoch: 52, train_loss: 0.5187, test_loss: 0.9725, test_f1: 0.6893
 epoch: 53, train_loss: 0.5390, test_loss: 1.0014, test_f1: 0.6499
 epoch: 54, train_loss: 0.5039, test_loss: 1.0233, test_f1: 0.6743
 epoch: 55, train_loss: 0.4934, test_loss: 1.0128, test_f1: 0.6727
 epoch: 56, train_loss: 0.4998, test_loss: 1.0363, test_f1: 0.6671
 epoch: 57, train_loss: 0.4879, test_loss: 1.0452, test_f1: 0.6437
 epoch: 58, train_loss: 0.4857, test_loss: 0.9973, test_f1: 0.6547
 epoch: 59, train_loss: 0.4790, test_loss: 1.0732, test_f1: 0.6594
 epoch: 60, train_loss: 0.4717, test_loss: 1.0675, test_f1: 0.6935
 epoch: 61, train_loss: 0.4554, test_loss: 1.1020, test_f1: 0.6574
 epoch: 62, train_loss: 0.4652, test_loss: 1.0738, test_f1: 0.6767
 epoch: 63, train_loss: 0.4573, test_loss: 1.0430, test_f1: 0.6815
 epoch: 64, train_loss: 0.4678, test_loss: 1.1044, test_f1: 0.6573
 epoch: 65, train_loss: 0.4488, test_loss: 1.1657, test_f1: 0.6461
 epoch: 66, train_loss: 0.4672, test_loss: 1.1046, test_f1: 0.6600
 epoch: 67, train_loss: 0.4505, test_loss: 1.1165, test_f1: 0.6655
 epoch: 68, train_loss: 0.4298, test_loss: 1.1097, test_f1: 0.6588
 epoch: 69, train_loss: 0.4379, test_loss: 1.1526, test_f1: 0.6630
 epoch: 70, train_loss: 0.4354, test_loss: 1.0607, test_f1: 0.6758
 epoch: 71, train_loss: 0.4375, test_loss: 1.2436, test_f1: 0.6701
 epoch: 72, train_loss: 0.4280, test_loss: 1.1527, test_f1: 0.6697
 epoch: 73, train_loss: 0.4098, test_loss: 1.1624, test_f1: 0.6470
 epoch: 74, train_loss: 0.3972, test_loss: 1.1795, test_f1: 0.6753
 epoch: 75, train_loss: 0.4187, test_loss: 1.1129, test_f1: 0.6621
 epoch: 76, train_loss: 0.4091, test_loss: 1.2020, test_f1: 0.6507
 epoch: 77, train_loss: 0.3990, test_loss: 1.2374, test_f1: 0.6407
 epoch: 78, train_loss: 0.4134, test_loss: 1.2477, test_f1: 0.6423
 epoch: 79, train_loss: 0.3862, test_loss: 1.1724, test_f1: 0.6647
 epoch: 80, train_loss: 0.4071, test_loss: 1.2732, test_f1: 0.6507
 epoch: 81, train_loss: 0.3975, test_loss: 1.2287, test_f1: 0.6606
 epoch: 82, train_loss: 0.3849, test_loss: 1.1659, test_f1: 0.6669
 epoch: 83, train_loss: 0.3801, test_loss: 1.2945, test_f1: 0.6695
 epoch: 84, train_loss: 0.3752, test_loss: 1.2534, test_f1: 0.6550
 epoch: 85, train_loss: 0.3943, test_loss: 1.2486, test_f1: 0.6469
 epoch: 86, train_loss: 0.3934, test_loss: 1.1543, test_f1: 0.6634
 epoch: 87, train_loss: 0.3596, test_loss: 1.2020, test_f1: 0.6529
 epoch: 88, train_loss: 0.3624, test_loss: 1.2282, test_f1: 0.6808
 epoch: 89, train_loss: 0.3579, test_loss: 1.2291, test_f1: 0.6590
 epoch: 90, train_loss: 0.3639, test_loss: 1.2748, test_f1: 0.6493
 epoch: 91, train_loss: 0.3683, test_loss: 1.2631, test_f1: 0.6713
 epoch: 92, train_loss: 0.3658, test_loss: 1.2861, test_f1: 0.6543
 epoch: 93, train_loss: 0.3564, test_loss: 1.2825, test_f1: 0.6693
 epoch: 94, train_loss: 0.3730, test_loss: 1.3528, test_f1: 0.6357
 epoch: 95, train_loss: 0.3756, test_loss: 1.3292, test_f1: 0.6776
 epoch: 96, train_loss: 0.3772, test_loss: 1.2983, test_f1: 0.6645
 epoch: 97, train_loss: 0.3463, test_loss: 1.2749, test_f1: 0.6839
 epoch: 98, train_loss: 0.3355, test_loss: 1.4075, test_f1: 0.6360
 epoch: 99, train_loss: 0.3470, test_loss: 1.3417, test_f1: 0.6521
##################ITERATION #4 ****************************************
 epoch: 0, train_loss: 1.2312, test_loss: 0.9915, test_f1: 0.4420
 epoch: 1, train_loss: 1.0500, test_loss: 0.9655, test_f1: 0.4643
 epoch: 2, train_loss: 0.9892, test_loss: 0.9447, test_f1: 0.4857
 epoch: 3, train_loss: 0.9647, test_loss: 0.9344, test_f1: 0.4960
 epoch: 4, train_loss: 0.9491, test_loss: 0.9164, test_f1: 0.5054
 epoch: 5, train_loss: 0.9356, test_loss: 0.8725, test_f1: 0.5401
 epoch: 6, train_loss: 0.9232, test_loss: 0.9558, test_f1: 0.4994
 epoch: 7, train_loss: 0.9060, test_loss: 0.9892, test_f1: 0.4877
 epoch: 8, train_loss: 0.8866, test_loss: 0.9659, test_f1: 0.5167
 epoch: 9, train_loss: 0.8843, test_loss: 0.9306, test_f1: 0.5290
 epoch: 10, train_loss: 0.8560, test_loss: 0.9844, test_f1: 0.5006
 epoch: 11, train_loss: 0.8591, test_loss: 0.9122, test_f1: 0.5662
 epoch: 12, train_loss: 0.8537, test_loss: 0.9470, test_f1: 0.5153
 epoch: 13, train_loss: 0.8389, test_loss: 0.9416, test_f1: 0.5336
 epoch: 14, train_loss: 0.8499, test_loss: 0.9734, test_f1: 0.5198
 epoch: 15, train_loss: 0.8194, test_loss: 0.8834, test_f1: 0.5450
 epoch: 16, train_loss: 0.8205, test_loss: 0.9660, test_f1: 0.5433
 epoch: 17, train_loss: 0.8144, test_loss: 0.9648, test_f1: 0.5796
 epoch: 18, train_loss: 0.8252, test_loss: 0.9075, test_f1: 0.5671
 epoch: 19, train_loss: 0.7954, test_loss: 0.9387, test_f1: 0.5825
 epoch: 20, train_loss: 0.8039, test_loss: 0.9289, test_f1: 0.6194
 epoch: 21, train_loss: 0.7765, test_loss: 0.9464, test_f1: 0.5792
 epoch: 22, train_loss: 0.7856, test_loss: 1.0112, test_f1: 0.5710
 epoch: 23, train_loss: 0.7838, test_loss: 0.9795, test_f1: 0.5792
 epoch: 24, train_loss: 0.7734, test_loss: 0.9409, test_f1: 0.6196
 epoch: 25, train_loss: 0.7740, test_loss: 0.9812, test_f1: 0.5827
 epoch: 26, train_loss: 0.7664, test_loss: 0.9403, test_f1: 0.5657
 epoch: 27, train_loss: 0.7545, test_loss: 0.8962, test_f1: 0.5740
 epoch: 28, train_loss: 0.7693, test_loss: 0.9594, test_f1: 0.5506
 epoch: 29, train_loss: 0.7507, test_loss: 0.8959, test_f1: 0.6222
 epoch: 30, train_loss: 0.7398, test_loss: 0.9583, test_f1: 0.6056
 epoch: 31, train_loss: 0.7338, test_loss: 0.9724, test_f1: 0.6006
 epoch: 32, train_loss: 0.7211, test_loss: 0.9800, test_f1: 0.5975
 epoch: 33, train_loss: 0.7032, test_loss: 0.9625, test_f1: 0.6251
 epoch: 34, train_loss: 0.7099, test_loss: 1.0413, test_f1: 0.5747
 epoch: 35, train_loss: 0.7140, test_loss: 1.0167, test_f1: 0.5829
 epoch: 36, train_loss: 0.6992, test_loss: 0.9549, test_f1: 0.5791
 epoch: 37, train_loss: 0.7018, test_loss: 0.9134, test_f1: 0.6072
 epoch: 38, train_loss: 0.6966, test_loss: 0.9423, test_f1: 0.6010
 epoch: 39, train_loss: 0.6862, test_loss: 0.9170, test_f1: 0.6192
 epoch: 40, train_loss: 0.6783, test_loss: 0.8757, test_f1: 0.6295
 epoch: 41, train_loss: 0.6653, test_loss: 0.9855, test_f1: 0.6166
 epoch: 42, train_loss: 0.6720, test_loss: 1.0535, test_f1: 0.5741
 epoch: 43, train_loss: 0.6543, test_loss: 0.9978, test_f1: 0.5936
 epoch: 44, train_loss: 0.6619, test_loss: 0.9567, test_f1: 0.6086
 epoch: 45, train_loss: 0.6731, test_loss: 0.9174, test_f1: 0.6087
 epoch: 46, train_loss: 0.6299, test_loss: 0.9397, test_f1: 0.6222
 epoch: 47, train_loss: 0.6397, test_loss: 1.0395, test_f1: 0.6053
 epoch: 48, train_loss: 0.6484, test_loss: 0.9309, test_f1: 0.6319
 epoch: 49, train_loss: 0.6184, test_loss: 1.0177, test_f1: 0.6137
 epoch: 50, train_loss: 0.6337, test_loss: 0.9688, test_f1: 0.6165
 epoch: 51, train_loss: 0.5932, test_loss: 0.9888, test_f1: 0.6248
 epoch: 52, train_loss: 0.5558, test_loss: 0.9849, test_f1: 0.6473
 epoch: 53, train_loss: 0.5509, test_loss: 1.0149, test_f1: 0.6274
 epoch: 54, train_loss: 0.5480, test_loss: 1.0163, test_f1: 0.6396
 epoch: 55, train_loss: 0.5453, test_loss: 0.9989, test_f1: 0.6373
 epoch: 56, train_loss: 0.5458, test_loss: 1.0445, test_f1: 0.6228
 epoch: 57, train_loss: 0.5228, test_loss: 1.0229, test_f1: 0.6318
 epoch: 58, train_loss: 0.5409, test_loss: 1.0361, test_f1: 0.6313
 epoch: 59, train_loss: 0.5314, test_loss: 1.0409, test_f1: 0.6543
 epoch: 60, train_loss: 0.5099, test_loss: 1.1092, test_f1: 0.6352
 epoch: 61, train_loss: 0.5120, test_loss: 1.0630, test_f1: 0.6263
 epoch: 62, train_loss: 0.5175, test_loss: 1.0624, test_f1: 0.6376
 epoch: 63, train_loss: 0.5019, test_loss: 1.0240, test_f1: 0.6346
 epoch: 64, train_loss: 0.4934, test_loss: 1.0351, test_f1: 0.6403
 epoch: 65, train_loss: 0.4888, test_loss: 1.0590, test_f1: 0.6557
 epoch: 66, train_loss: 0.5039, test_loss: 1.0487, test_f1: 0.6435
 epoch: 67, train_loss: 0.4938, test_loss: 1.0941, test_f1: 0.6490
 epoch: 68, train_loss: 0.4851, test_loss: 1.1310, test_f1: 0.6458
 epoch: 69, train_loss: 0.4742, test_loss: 1.1164, test_f1: 0.6319
 epoch: 70, train_loss: 0.4572, test_loss: 1.1504, test_f1: 0.6476
 epoch: 71, train_loss: 0.4850, test_loss: 1.0949, test_f1: 0.6440
 epoch: 72, train_loss: 0.4727, test_loss: 1.0673, test_f1: 0.6472
 epoch: 73, train_loss: 0.4707, test_loss: 1.1344, test_f1: 0.6381
 epoch: 74, train_loss: 0.4685, test_loss: 1.1028, test_f1: 0.6396
 epoch: 75, train_loss: 0.4540, test_loss: 1.0937, test_f1: 0.6506
 epoch: 76, train_loss: 0.4578, test_loss: 1.1162, test_f1: 0.6291
 epoch: 77, train_loss: 0.4495, test_loss: 1.2183, test_f1: 0.6372
 epoch: 78, train_loss: 0.4500, test_loss: 1.1451, test_f1: 0.6362
 epoch: 79, train_loss: 0.4615, test_loss: 1.1556, test_f1: 0.6428
 epoch: 80, train_loss: 0.4709, test_loss: 1.2046, test_f1: 0.6453
 epoch: 81, train_loss: 0.4492, test_loss: 1.1557, test_f1: 0.6508
 epoch: 82, train_loss: 0.4384, test_loss: 1.1469, test_f1: 0.6395
 epoch: 83, train_loss: 0.4363, test_loss: 1.2355, test_f1: 0.6253
 epoch: 84, train_loss: 0.4238, test_loss: 1.1337, test_f1: 0.6505
 epoch: 85, train_loss: 0.4479, test_loss: 1.1963, test_f1: 0.6434
 epoch: 86, train_loss: 0.4348, test_loss: 1.1517, test_f1: 0.6350
 epoch: 87, train_loss: 0.4424, test_loss: 1.1172, test_f1: 0.6683
 epoch: 88, train_loss: 0.4088, test_loss: 1.1784, test_f1: 0.6379
 epoch: 89, train_loss: 0.4137, test_loss: 1.1641, test_f1: 0.6458
 epoch: 90, train_loss: 0.4022, test_loss: 1.2286, test_f1: 0.6578
 epoch: 91, train_loss: 0.4233, test_loss: 1.2303, test_f1: 0.6386
 epoch: 92, train_loss: 0.3980, test_loss: 1.2988, test_f1: 0.6450
 epoch: 93, train_loss: 0.4084, test_loss: 1.2077, test_f1: 0.6533
 epoch: 94, train_loss: 0.3827, test_loss: 1.2692, test_f1: 0.6625
 epoch: 95, train_loss: 0.3795, test_loss: 1.4004, test_f1: 0.6240
 epoch: 96, train_loss: 0.3773, test_loss: 1.3417, test_f1: 0.6436
 epoch: 97, train_loss: 0.3921, test_loss: 1.3389, test_f1: 0.6240
 epoch: 98, train_loss: 0.4010, test_loss: 1.2834, test_f1: 0.6006
 epoch: 99, train_loss: 0.3775, test_loss: 1.3795, test_f1: 0.6456
##################ITERATION #5 ****************************************
 epoch: 0, train_loss: 1.2720, test_loss: 1.0430, test_f1: 0.3833
 epoch: 1, train_loss: 1.0173, test_loss: 0.9328, test_f1: 0.4987
 epoch: 2, train_loss: 0.9791, test_loss: 0.9489, test_f1: 0.5063
 epoch: 3, train_loss: 0.9632, test_loss: 0.9429, test_f1: 0.4983
 epoch: 4, train_loss: 0.9258, test_loss: 0.9550, test_f1: 0.5251
 epoch: 5, train_loss: 0.9246, test_loss: 0.9141, test_f1: 0.4958
 epoch: 6, train_loss: 0.9018, test_loss: 0.9280, test_f1: 0.5188
 epoch: 7, train_loss: 0.8840, test_loss: 0.8873, test_f1: 0.5286
 epoch: 8, train_loss: 0.8836, test_loss: 0.9441, test_f1: 0.5361
 epoch: 9, train_loss: 0.8729, test_loss: 0.8969, test_f1: 0.5607
 epoch: 10, train_loss: 0.8708, test_loss: 0.9361, test_f1: 0.5357
 epoch: 11, train_loss: 0.8542, test_loss: 0.9364, test_f1: 0.5452
 epoch: 12, train_loss: 0.8492, test_loss: 0.9340, test_f1: 0.5392
 epoch: 13, train_loss: 0.8314, test_loss: 0.9406, test_f1: 0.5550
 epoch: 14, train_loss: 0.8279, test_loss: 0.9541, test_f1: 0.5402
 epoch: 15, train_loss: 0.8123, test_loss: 0.9133, test_f1: 0.5595
 epoch: 16, train_loss: 0.8080, test_loss: 0.9227, test_f1: 0.5419
 epoch: 17, train_loss: 0.8170, test_loss: 0.9552, test_f1: 0.5309
 epoch: 18, train_loss: 0.8076, test_loss: 0.9520, test_f1: 0.5524
 epoch: 19, train_loss: 0.7789, test_loss: 0.9837, test_f1: 0.5478
 epoch: 20, train_loss: 0.7777, test_loss: 0.9190, test_f1: 0.5781
 epoch: 21, train_loss: 0.7736, test_loss: 0.9315, test_f1: 0.5801
 epoch: 22, train_loss: 0.7679, test_loss: 0.9407, test_f1: 0.5763
 epoch: 23, train_loss: 0.7609, test_loss: 0.9673, test_f1: 0.5297
 epoch: 24, train_loss: 0.7572, test_loss: 0.9544, test_f1: 0.5862
 epoch: 25, train_loss: 0.7551, test_loss: 1.0016, test_f1: 0.5394
 epoch: 26, train_loss: 0.7446, test_loss: 0.9747, test_f1: 0.5557
 epoch: 27, train_loss: 0.7327, test_loss: 0.9211, test_f1: 0.6144
 epoch: 28, train_loss: 0.7243, test_loss: 0.9354, test_f1: 0.6153
 epoch: 29, train_loss: 0.7264, test_loss: 0.9008, test_f1: 0.6014
 epoch: 30, train_loss: 0.7282, test_loss: 0.9618, test_f1: 0.6085
 epoch: 31, train_loss: 0.7139, test_loss: 0.9730, test_f1: 0.5689
 epoch: 32, train_loss: 0.7079, test_loss: 0.9622, test_f1: 0.5930
 epoch: 33, train_loss: 0.7075, test_loss: 1.1056, test_f1: 0.5668
 epoch: 34, train_loss: 0.7164, test_loss: 0.9539, test_f1: 0.6174
 epoch: 35, train_loss: 0.6977, test_loss: 1.0054, test_f1: 0.5851
 epoch: 36, train_loss: 0.6708, test_loss: 0.9999, test_f1: 0.5686
 epoch: 37, train_loss: 0.6684, test_loss: 0.8785, test_f1: 0.5948
 epoch: 38, train_loss: 0.6687, test_loss: 0.8653, test_f1: 0.6136
 epoch: 39, train_loss: 0.6689, test_loss: 0.9073, test_f1: 0.6155
 epoch: 40, train_loss: 0.6611, test_loss: 0.9113, test_f1: 0.6151
 epoch: 41, train_loss: 0.6702, test_loss: 0.9692, test_f1: 0.6234
 epoch: 42, train_loss: 0.6590, test_loss: 0.9119, test_f1: 0.6168
 epoch: 43, train_loss: 0.6544, test_loss: 0.9343, test_f1: 0.6213
 epoch: 44, train_loss: 0.6459, test_loss: 0.9897, test_f1: 0.6356
 epoch: 45, train_loss: 0.6531, test_loss: 1.0033, test_f1: 0.5934
 epoch: 46, train_loss: 0.6381, test_loss: 1.0075, test_f1: 0.6082
 epoch: 47, train_loss: 0.6113, test_loss: 0.9730, test_f1: 0.6470
 epoch: 48, train_loss: 0.6228, test_loss: 0.9826, test_f1: 0.6261
 epoch: 49, train_loss: 0.6207, test_loss: 1.0178, test_f1: 0.6436
 epoch: 50, train_loss: 0.6107, test_loss: 1.0371, test_f1: 0.6343
 epoch: 51, train_loss: 0.5780, test_loss: 0.9961, test_f1: 0.6287
 epoch: 52, train_loss: 0.5549, test_loss: 1.0149, test_f1: 0.6129
 epoch: 53, train_loss: 0.5364, test_loss: 0.9923, test_f1: 0.6312
 epoch: 54, train_loss: 0.5307, test_loss: 0.9693, test_f1: 0.6651
 epoch: 55, train_loss: 0.5276, test_loss: 0.9882, test_f1: 0.6730
 epoch: 56, train_loss: 0.5179, test_loss: 1.0159, test_f1: 0.6519
 epoch: 57, train_loss: 0.5305, test_loss: 1.0321, test_f1: 0.6478
 epoch: 58, train_loss: 0.5086, test_loss: 1.0046, test_f1: 0.6382
 epoch: 59, train_loss: 0.5052, test_loss: 1.0405, test_f1: 0.6567
 epoch: 60, train_loss: 0.5057, test_loss: 1.0187, test_f1: 0.6477
 epoch: 61, train_loss: 0.4848, test_loss: 1.0708, test_f1: 0.6525
 epoch: 62, train_loss: 0.4936, test_loss: 1.0873, test_f1: 0.6555
 epoch: 63, train_loss: 0.4957, test_loss: 1.0502, test_f1: 0.6558
 epoch: 64, train_loss: 0.4642, test_loss: 1.0264, test_f1: 0.6707
 epoch: 65, train_loss: 0.4650, test_loss: 1.1290, test_f1: 0.6551
 epoch: 66, train_loss: 0.4631, test_loss: 1.2308, test_f1: 0.6193
 epoch: 67, train_loss: 0.4620, test_loss: 1.0557, test_f1: 0.6494
 epoch: 68, train_loss: 0.4573, test_loss: 1.1175, test_f1: 0.6321
 epoch: 69, train_loss: 0.4531, test_loss: 1.0379, test_f1: 0.6484
 epoch: 70, train_loss: 0.4506, test_loss: 1.1409, test_f1: 0.6458
 epoch: 71, train_loss: 0.4319, test_loss: 1.0934, test_f1: 0.6523
 epoch: 72, train_loss: 0.4338, test_loss: 1.1009, test_f1: 0.6483
 epoch: 73, train_loss: 0.4447, test_loss: 1.1588, test_f1: 0.6268
 epoch: 74, train_loss: 0.4398, test_loss: 1.1148, test_f1: 0.6644
 epoch: 75, train_loss: 0.4208, test_loss: 1.0956, test_f1: 0.6545
 epoch: 76, train_loss: 0.4396, test_loss: 1.1221, test_f1: 0.6593
 epoch: 77, train_loss: 0.4162, test_loss: 1.1703, test_f1: 0.6519
 epoch: 78, train_loss: 0.4243, test_loss: 1.1430, test_f1: 0.6426
 epoch: 79, train_loss: 0.4316, test_loss: 1.1697, test_f1: 0.6548
 epoch: 80, train_loss: 0.4215, test_loss: 1.1642, test_f1: 0.6443
 epoch: 81, train_loss: 0.4143, test_loss: 1.0714, test_f1: 0.6483
 epoch: 82, train_loss: 0.4074, test_loss: 1.2016, test_f1: 0.6626
 epoch: 83, train_loss: 0.4024, test_loss: 1.1898, test_f1: 0.6392
 epoch: 84, train_loss: 0.3842, test_loss: 1.1991, test_f1: 0.6564
 epoch: 85, train_loss: 0.3826, test_loss: 1.3076, test_f1: 0.6562
 epoch: 86, train_loss: 0.3981, test_loss: 1.1340, test_f1: 0.6749
 epoch: 87, train_loss: 0.3737, test_loss: 1.2710, test_f1: 0.6427
 epoch: 88, train_loss: 0.3887, test_loss: 1.3307, test_f1: 0.6328
 epoch: 89, train_loss: 0.3826, test_loss: 1.1941, test_f1: 0.6613
 epoch: 90, train_loss: 0.3726, test_loss: 1.2024, test_f1: 0.6624
 epoch: 91, train_loss: 0.3836, test_loss: 1.2474, test_f1: 0.6255
 epoch: 92, train_loss: 0.3779, test_loss: 1.2645, test_f1: 0.6350
 epoch: 93, train_loss: 0.3786, test_loss: 1.2153, test_f1: 0.6432
 epoch: 94, train_loss: 0.3627, test_loss: 1.3018, test_f1: 0.6619
 epoch: 95, train_loss: 0.3536, test_loss: 1.2799, test_f1: 0.6377
 epoch: 96, train_loss: 0.3509, test_loss: 1.2866, test_f1: 0.6704
 epoch: 97, train_loss: 0.3715, test_loss: 1.3138, test_f1: 0.6506
 epoch: 98, train_loss: 0.3671, test_loss: 1.2784, test_f1: 0.6560
 epoch: 99, train_loss: 0.3543, test_loss: 1.2422, test_f1: 0.6461
##################ITERATION #6 ****************************************
 epoch: 0, train_loss: 1.3175, test_loss: 1.1455, test_f1: 0.3668
 epoch: 1, train_loss: 1.0410, test_loss: 0.9820, test_f1: 0.4440
 epoch: 2, train_loss: 0.9982, test_loss: 0.9597, test_f1: 0.4741
 epoch: 3, train_loss: 0.9750, test_loss: 0.9424, test_f1: 0.4956
 epoch: 4, train_loss: 0.9532, test_loss: 0.9314, test_f1: 0.4848
 epoch: 5, train_loss: 0.9418, test_loss: 0.9395, test_f1: 0.5044
 epoch: 6, train_loss: 0.9218, test_loss: 0.9215, test_f1: 0.5306
 epoch: 7, train_loss: 0.9110, test_loss: 0.9076, test_f1: 0.5264
 epoch: 8, train_loss: 0.8982, test_loss: 0.9453, test_f1: 0.5411
 epoch: 9, train_loss: 0.8912, test_loss: 0.9271, test_f1: 0.5598
 epoch: 10, train_loss: 0.8676, test_loss: 0.9220, test_f1: 0.5786
 epoch: 11, train_loss: 0.8670, test_loss: 0.8903, test_f1: 0.5451
 epoch: 12, train_loss: 0.8593, test_loss: 0.9168, test_f1: 0.5621
 epoch: 13, train_loss: 0.8537, test_loss: 0.9352, test_f1: 0.5646
 epoch: 14, train_loss: 0.8270, test_loss: 0.9572, test_f1: 0.5282
 epoch: 15, train_loss: 0.8285, test_loss: 0.9027, test_f1: 0.5857
 epoch: 16, train_loss: 0.8298, test_loss: 0.9560, test_f1: 0.5300
 epoch: 17, train_loss: 0.8053, test_loss: 0.9483, test_f1: 0.5695
 epoch: 18, train_loss: 0.8155, test_loss: 0.9468, test_f1: 0.5545
 epoch: 19, train_loss: 0.8070, test_loss: 0.9496, test_f1: 0.5650
 epoch: 20, train_loss: 0.7861, test_loss: 0.9238, test_f1: 0.5570
 epoch: 21, train_loss: 0.7713, test_loss: 0.9082, test_f1: 0.5588
 epoch: 22, train_loss: 0.7787, test_loss: 0.9499, test_f1: 0.5642
 epoch: 23, train_loss: 0.7700, test_loss: 0.9480, test_f1: 0.5706
 epoch: 24, train_loss: 0.7642, test_loss: 0.9484, test_f1: 0.5877
 epoch: 25, train_loss: 0.7498, test_loss: 0.9350, test_f1: 0.6076
 epoch: 26, train_loss: 0.7577, test_loss: 0.9169, test_f1: 0.5574
 epoch: 27, train_loss: 0.7383, test_loss: 0.9120, test_f1: 0.5763
 epoch: 28, train_loss: 0.7544, test_loss: 0.8634, test_f1: 0.5713
 epoch: 29, train_loss: 0.7226, test_loss: 0.9356, test_f1: 0.5782
 epoch: 30, train_loss: 0.7299, test_loss: 0.9734, test_f1: 0.5690
 epoch: 31, train_loss: 0.7531, test_loss: 0.9341, test_f1: 0.6174
 epoch: 32, train_loss: 0.7168, test_loss: 0.8792, test_f1: 0.6179
 epoch: 33, train_loss: 0.7123, test_loss: 0.9079, test_f1: 0.6062
 epoch: 34, train_loss: 0.7066, test_loss: 0.8696, test_f1: 0.6336
 epoch: 35, train_loss: 0.6960, test_loss: 0.9362, test_f1: 0.5749
 epoch: 36, train_loss: 0.7016, test_loss: 0.9110, test_f1: 0.5926
 epoch: 37, train_loss: 0.6845, test_loss: 0.9030, test_f1: 0.6072
 epoch: 38, train_loss: 0.6514, test_loss: 0.9142, test_f1: 0.6263
 epoch: 39, train_loss: 0.7068, test_loss: 0.8722, test_f1: 0.5950
 epoch: 40, train_loss: 0.6686, test_loss: 0.9413, test_f1: 0.6227
 epoch: 41, train_loss: 0.6759, test_loss: 0.9133, test_f1: 0.6234
 epoch: 42, train_loss: 0.6605, test_loss: 0.9560, test_f1: 0.6088
 epoch: 43, train_loss: 0.6554, test_loss: 0.9063, test_f1: 0.6162
 epoch: 44, train_loss: 0.6348, test_loss: 0.9447, test_f1: 0.6506
 epoch: 45, train_loss: 0.6353, test_loss: 0.9941, test_f1: 0.5951
 epoch: 46, train_loss: 0.6411, test_loss: 0.9198, test_f1: 0.6461
 epoch: 47, train_loss: 0.6460, test_loss: 0.9918, test_f1: 0.6459
 epoch: 48, train_loss: 0.6286, test_loss: 0.9543, test_f1: 0.6278
 epoch: 49, train_loss: 0.6302, test_loss: 0.8962, test_f1: 0.6107
 epoch: 50, train_loss: 0.6283, test_loss: 0.9559, test_f1: 0.6123
 epoch: 51, train_loss: 0.5870, test_loss: 0.9433, test_f1: 0.6317
 epoch: 52, train_loss: 0.5505, test_loss: 0.9794, test_f1: 0.6590
 epoch: 53, train_loss: 0.5345, test_loss: 0.9809, test_f1: 0.6631
 epoch: 54, train_loss: 0.5384, test_loss: 1.0269, test_f1: 0.6523
 epoch: 55, train_loss: 0.5375, test_loss: 0.9740, test_f1: 0.6580
 epoch: 56, train_loss: 0.5181, test_loss: 0.9609, test_f1: 0.6439
 epoch: 57, train_loss: 0.5231, test_loss: 1.0472, test_f1: 0.6734
 epoch: 58, train_loss: 0.5107, test_loss: 1.0415, test_f1: 0.6632
 epoch: 59, train_loss: 0.5068, test_loss: 1.0413, test_f1: 0.6546
 epoch: 60, train_loss: 0.5253, test_loss: 1.0010, test_f1: 0.6502
 epoch: 61, train_loss: 0.5092, test_loss: 1.0047, test_f1: 0.6652
 epoch: 62, train_loss: 0.4928, test_loss: 1.0155, test_f1: 0.6566
 epoch: 63, train_loss: 0.4943, test_loss: 1.0540, test_f1: 0.6636
 epoch: 64, train_loss: 0.4767, test_loss: 1.1142, test_f1: 0.6228
 epoch: 65, train_loss: 0.4978, test_loss: 1.0923, test_f1: 0.6431
 epoch: 66, train_loss: 0.4638, test_loss: 1.0917, test_f1: 0.6386
 epoch: 67, train_loss: 0.4754, test_loss: 1.0834, test_f1: 0.6417
 epoch: 68, train_loss: 0.4743, test_loss: 1.1183, test_f1: 0.6616
 epoch: 69, train_loss: 0.4637, test_loss: 1.1573, test_f1: 0.6569
 epoch: 70, train_loss: 0.4531, test_loss: 1.1226, test_f1: 0.6562
 epoch: 71, train_loss: 0.4540, test_loss: 1.1382, test_f1: 0.6412
 epoch: 72, train_loss: 0.4538, test_loss: 1.1067, test_f1: 0.6341
 epoch: 73, train_loss: 0.4530, test_loss: 1.1458, test_f1: 0.6440
 epoch: 74, train_loss: 0.4392, test_loss: 1.1367, test_f1: 0.6620
 epoch: 75, train_loss: 0.4300, test_loss: 1.1788, test_f1: 0.6510
 epoch: 76, train_loss: 0.4422, test_loss: 1.1171, test_f1: 0.6523
 epoch: 77, train_loss: 0.4423, test_loss: 1.1224, test_f1: 0.6392
 epoch: 78, train_loss: 0.4298, test_loss: 1.2284, test_f1: 0.6715
 epoch: 79, train_loss: 0.4244, test_loss: 1.1661, test_f1: 0.6491
 epoch: 80, train_loss: 0.4226, test_loss: 1.1468, test_f1: 0.6624
 epoch: 81, train_loss: 0.4262, test_loss: 1.1868, test_f1: 0.6355
 epoch: 82, train_loss: 0.4218, test_loss: 1.1718, test_f1: 0.6474
 epoch: 83, train_loss: 0.4161, test_loss: 1.2981, test_f1: 0.6568
 epoch: 84, train_loss: 0.4053, test_loss: 1.2119, test_f1: 0.6629
 epoch: 85, train_loss: 0.4009, test_loss: 1.2188, test_f1: 0.6520
 epoch: 86, train_loss: 0.4233, test_loss: 1.1910, test_f1: 0.6867
 epoch: 87, train_loss: 0.4147, test_loss: 1.2729, test_f1: 0.6509
 epoch: 88, train_loss: 0.4042, test_loss: 1.2009, test_f1: 0.6675
 epoch: 89, train_loss: 0.4133, test_loss: 1.2166, test_f1: 0.6657
 epoch: 90, train_loss: 0.3839, test_loss: 1.1928, test_f1: 0.6626
 epoch: 91, train_loss: 0.4060, test_loss: 1.2206, test_f1: 0.6528
 epoch: 92, train_loss: 0.3981, test_loss: 1.2487, test_f1: 0.6632
 epoch: 93, train_loss: 0.3774, test_loss: 1.2934, test_f1: 0.6577
 epoch: 94, train_loss: 0.3779, test_loss: 1.1977, test_f1: 0.6499
 epoch: 95, train_loss: 0.3710, test_loss: 1.2622, test_f1: 0.6444
 epoch: 96, train_loss: 0.3848, test_loss: 1.2612, test_f1: 0.6460
 epoch: 97, train_loss: 0.3924, test_loss: 1.2061, test_f1: 0.6935
 epoch: 98, train_loss: 0.3701, test_loss: 1.2418, test_f1: 0.6918
 epoch: 99, train_loss: 0.3585, test_loss: 1.2464, test_f1: 0.6641
##################ITERATION #7 ****************************************
 epoch: 0, train_loss: 1.3023, test_loss: 1.0405, test_f1: 0.4395
 epoch: 1, train_loss: 1.0266, test_loss: 0.9400, test_f1: 0.4823
 epoch: 2, train_loss: 0.9812, test_loss: 0.9453, test_f1: 0.4889
 epoch: 3, train_loss: 0.9494, test_loss: 0.9116, test_f1: 0.4935
 epoch: 4, train_loss: 0.9224, test_loss: 0.9375, test_f1: 0.5182
 epoch: 5, train_loss: 0.9138, test_loss: 0.9122, test_f1: 0.5266
 epoch: 6, train_loss: 0.9061, test_loss: 0.9517, test_f1: 0.5178
 epoch: 7, train_loss: 0.8819, test_loss: 0.9275, test_f1: 0.5248
 epoch: 8, train_loss: 0.8735, test_loss: 0.9258, test_f1: 0.4965
 epoch: 9, train_loss: 0.8575, test_loss: 0.9231, test_f1: 0.5331
 epoch: 10, train_loss: 0.8384, test_loss: 0.9299, test_f1: 0.5222
 epoch: 11, train_loss: 0.8506, test_loss: 0.9285, test_f1: 0.5477
 epoch: 12, train_loss: 0.8230, test_loss: 0.9384, test_f1: 0.5642
 epoch: 13, train_loss: 0.8268, test_loss: 0.9324, test_f1: 0.5692
 epoch: 14, train_loss: 0.8055, test_loss: 0.9152, test_f1: 0.5796
 epoch: 15, train_loss: 0.7965, test_loss: 0.9374, test_f1: 0.5634
 epoch: 16, train_loss: 0.7984, test_loss: 0.9140, test_f1: 0.5762
 epoch: 17, train_loss: 0.7960, test_loss: 0.9059, test_f1: 0.6064
 epoch: 18, train_loss: 0.7899, test_loss: 0.9280, test_f1: 0.5837
 epoch: 19, train_loss: 0.7874, test_loss: 0.9473, test_f1: 0.5805
 epoch: 20, train_loss: 0.7705, test_loss: 0.9119, test_f1: 0.5886
 epoch: 21, train_loss: 0.7751, test_loss: 0.9597, test_f1: 0.5732
 epoch: 22, train_loss: 0.7408, test_loss: 0.8921, test_f1: 0.5986
 epoch: 23, train_loss: 0.7511, test_loss: 0.9662, test_f1: 0.6052
 epoch: 24, train_loss: 0.7404, test_loss: 1.0347, test_f1: 0.5730
 epoch: 25, train_loss: 0.7292, test_loss: 0.9700, test_f1: 0.5743
 epoch: 26, train_loss: 0.7260, test_loss: 1.0110, test_f1: 0.5685
 epoch: 27, train_loss: 0.7177, test_loss: 0.9713, test_f1: 0.6023
 epoch: 28, train_loss: 0.7232, test_loss: 0.9618, test_f1: 0.5965
 epoch: 29, train_loss: 0.7155, test_loss: 0.9710, test_f1: 0.6423
 epoch: 30, train_loss: 0.6960, test_loss: 0.9319, test_f1: 0.6104
 epoch: 31, train_loss: 0.6912, test_loss: 0.9644, test_f1: 0.5824
 epoch: 32, train_loss: 0.6886, test_loss: 0.9657, test_f1: 0.6281
 epoch: 33, train_loss: 0.6869, test_loss: 0.9996, test_f1: 0.5991
 epoch: 34, train_loss: 0.6849, test_loss: 0.9446, test_f1: 0.6051
 epoch: 35, train_loss: 0.6656, test_loss: 0.9604, test_f1: 0.6492
 epoch: 36, train_loss: 0.6659, test_loss: 0.9372, test_f1: 0.6099
 epoch: 37, train_loss: 0.6752, test_loss: 0.9529, test_f1: 0.6244
 epoch: 38, train_loss: 0.6485, test_loss: 0.9138, test_f1: 0.6307
 epoch: 39, train_loss: 0.6408, test_loss: 0.9185, test_f1: 0.6130
 epoch: 40, train_loss: 0.6207, test_loss: 1.0173, test_f1: 0.6314
 epoch: 41, train_loss: 0.6444, test_loss: 0.9153, test_f1: 0.6606
 epoch: 42, train_loss: 0.6363, test_loss: 0.9311, test_f1: 0.6520
 epoch: 43, train_loss: 0.6170, test_loss: 0.9402, test_f1: 0.6171
 epoch: 44, train_loss: 0.6193, test_loss: 0.9885, test_f1: 0.6222
 epoch: 45, train_loss: 0.6037, test_loss: 0.9110, test_f1: 0.6250
 epoch: 46, train_loss: 0.5977, test_loss: 0.9617, test_f1: 0.6498
 epoch: 47, train_loss: 0.5922, test_loss: 1.0128, test_f1: 0.6588
 epoch: 48, train_loss: 0.6107, test_loss: 0.9355, test_f1: 0.6565
 epoch: 49, train_loss: 0.6105, test_loss: 0.9427, test_f1: 0.6520
 epoch: 50, train_loss: 0.5968, test_loss: 0.9313, test_f1: 0.6789
 epoch: 51, train_loss: 0.5582, test_loss: 0.9527, test_f1: 0.6684
 epoch: 52, train_loss: 0.5373, test_loss: 1.0277, test_f1: 0.6532
 epoch: 53, train_loss: 0.5286, test_loss: 0.9631, test_f1: 0.6895
 epoch: 54, train_loss: 0.5053, test_loss: 0.9979, test_f1: 0.6442
 epoch: 55, train_loss: 0.5234, test_loss: 0.9908, test_f1: 0.6551
 epoch: 56, train_loss: 0.5022, test_loss: 0.9575, test_f1: 0.6801
 epoch: 57, train_loss: 0.4993, test_loss: 0.9705, test_f1: 0.6942
 epoch: 58, train_loss: 0.4958, test_loss: 0.9615, test_f1: 0.6771
 epoch: 59, train_loss: 0.4925, test_loss: 1.0049, test_f1: 0.6794
 epoch: 60, train_loss: 0.4621, test_loss: 0.9851, test_f1: 0.6637
 epoch: 61, train_loss: 0.4628, test_loss: 1.0541, test_f1: 0.6807
 epoch: 62, train_loss: 0.4767, test_loss: 1.0480, test_f1: 0.6688
 epoch: 63, train_loss: 0.4653, test_loss: 0.9722, test_f1: 0.6750
 epoch: 64, train_loss: 0.4525, test_loss: 1.0291, test_f1: 0.6389
 epoch: 65, train_loss: 0.4640, test_loss: 1.0716, test_f1: 0.6656
 epoch: 66, train_loss: 0.4665, test_loss: 1.0205, test_f1: 0.6575
 epoch: 67, train_loss: 0.4433, test_loss: 1.0452, test_f1: 0.6736
 epoch: 68, train_loss: 0.4523, test_loss: 1.0421, test_f1: 0.6627
 epoch: 69, train_loss: 0.4327, test_loss: 1.0584, test_f1: 0.6730
 epoch: 70, train_loss: 0.4479, test_loss: 1.0428, test_f1: 0.6674
 epoch: 71, train_loss: 0.4466, test_loss: 1.0174, test_f1: 0.6859
 epoch: 72, train_loss: 0.4297, test_loss: 1.0525, test_f1: 0.6924
 epoch: 73, train_loss: 0.4207, test_loss: 1.0374, test_f1: 0.6587
 epoch: 74, train_loss: 0.4031, test_loss: 1.0413, test_f1: 0.6682
 epoch: 75, train_loss: 0.4356, test_loss: 1.1344, test_f1: 0.6377
 epoch: 76, train_loss: 0.4156, test_loss: 1.1633, test_f1: 0.6654
 epoch: 77, train_loss: 0.3996, test_loss: 1.1096, test_f1: 0.6656
 epoch: 78, train_loss: 0.4115, test_loss: 1.1301, test_f1: 0.6625
 epoch: 79, train_loss: 0.4150, test_loss: 1.1397, test_f1: 0.6783
 epoch: 80, train_loss: 0.4043, test_loss: 1.1475, test_f1: 0.6521
 epoch: 81, train_loss: 0.4033, test_loss: 1.1292, test_f1: 0.6727
 epoch: 82, train_loss: 0.3749, test_loss: 1.1637, test_f1: 0.6618
 epoch: 83, train_loss: 0.3908, test_loss: 1.2095, test_f1: 0.6433
 epoch: 84, train_loss: 0.3905, test_loss: 1.1225, test_f1: 0.6492
 epoch: 85, train_loss: 0.3962, test_loss: 1.2190, test_f1: 0.6602
 epoch: 86, train_loss: 0.3870, test_loss: 1.1892, test_f1: 0.6656
 epoch: 87, train_loss: 0.3816, test_loss: 1.2739, test_f1: 0.6430
 epoch: 88, train_loss: 0.3708, test_loss: 1.2555, test_f1: 0.6839
 epoch: 89, train_loss: 0.3800, test_loss: 1.2306, test_f1: 0.6634
 epoch: 90, train_loss: 0.3804, test_loss: 1.1297, test_f1: 0.6904
 epoch: 91, train_loss: 0.3792, test_loss: 1.2246, test_f1: 0.6596
 epoch: 92, train_loss: 0.3589, test_loss: 1.2288, test_f1: 0.6499
 epoch: 93, train_loss: 0.3628, test_loss: 1.1523, test_f1: 0.6861
 epoch: 94, train_loss: 0.3519, test_loss: 1.2330, test_f1: 0.6748
 epoch: 95, train_loss: 0.3519, test_loss: 1.2859, test_f1: 0.6659
 epoch: 96, train_loss: 0.3804, test_loss: 1.1920, test_f1: 0.6656
 epoch: 97, train_loss: 0.3758, test_loss: 1.2686, test_f1: 0.6474
 epoch: 98, train_loss: 0.3457, test_loss: 1.2864, test_f1: 0.6576
 epoch: 99, train_loss: 0.3250, test_loss: 1.2739, test_f1: 0.6797
##################ITERATION #8 ****************************************
 epoch: 0, train_loss: 1.3801, test_loss: 1.0515, test_f1: 0.3758
 epoch: 1, train_loss: 1.0663, test_loss: 0.9546, test_f1: 0.4910
 epoch: 2, train_loss: 0.9951, test_loss: 0.9299, test_f1: 0.4791
 epoch: 3, train_loss: 0.9664, test_loss: 0.9758, test_f1: 0.4869
 epoch: 4, train_loss: 0.9582, test_loss: 0.9676, test_f1: 0.4776
 epoch: 5, train_loss: 0.9264, test_loss: 0.9585, test_f1: 0.5040
 epoch: 6, train_loss: 0.9155, test_loss: 0.9702, test_f1: 0.5212
 epoch: 7, train_loss: 0.9123, test_loss: 0.9639, test_f1: 0.4931
 epoch: 8, train_loss: 0.8924, test_loss: 0.9547, test_f1: 0.5035
 epoch: 9, train_loss: 0.8872, test_loss: 0.9632, test_f1: 0.5066
 epoch: 10, train_loss: 0.8782, test_loss: 0.9422, test_f1: 0.5587
 epoch: 11, train_loss: 0.8607, test_loss: 0.9526, test_f1: 0.5313
 epoch: 12, train_loss: 0.8432, test_loss: 0.9867, test_f1: 0.5077
 epoch: 13, train_loss: 0.8417, test_loss: 0.9279, test_f1: 0.5162
 epoch: 14, train_loss: 0.8361, test_loss: 1.0528, test_f1: 0.4752
 epoch: 15, train_loss: 0.8269, test_loss: 0.8969, test_f1: 0.5409
 epoch: 16, train_loss: 0.8109, test_loss: 0.9711, test_f1: 0.5461
 epoch: 17, train_loss: 0.8113, test_loss: 0.9432, test_f1: 0.5433
 epoch: 18, train_loss: 0.8025, test_loss: 0.9372, test_f1: 0.5638
 epoch: 19, train_loss: 0.7928, test_loss: 1.0403, test_f1: 0.5321
 epoch: 20, train_loss: 0.7930, test_loss: 0.9772, test_f1: 0.5797
 epoch: 21, train_loss: 0.7786, test_loss: 1.0140, test_f1: 0.5719
 epoch: 22, train_loss: 0.7814, test_loss: 1.0026, test_f1: 0.5736
 epoch: 23, train_loss: 0.7752, test_loss: 0.8926, test_f1: 0.5788
 epoch: 24, train_loss: 0.7646, test_loss: 0.9807, test_f1: 0.5750
 epoch: 25, train_loss: 0.7567, test_loss: 0.9836, test_f1: 0.5559
 epoch: 26, train_loss: 0.7470, test_loss: 0.9707, test_f1: 0.5596
 epoch: 27, train_loss: 0.7568, test_loss: 1.0025, test_f1: 0.5864
 epoch: 28, train_loss: 0.7361, test_loss: 0.9625, test_f1: 0.5963
 epoch: 29, train_loss: 0.7379, test_loss: 0.9862, test_f1: 0.5636
 epoch: 30, train_loss: 0.7280, test_loss: 0.9911, test_f1: 0.6098
 epoch: 31, train_loss: 0.7159, test_loss: 0.9387, test_f1: 0.5902
 epoch: 32, train_loss: 0.7144, test_loss: 0.9689, test_f1: 0.6068
 epoch: 33, train_loss: 0.7106, test_loss: 0.9290, test_f1: 0.6000
 epoch: 34, train_loss: 0.7210, test_loss: 0.9432, test_f1: 0.5834
 epoch: 35, train_loss: 0.7009, test_loss: 0.9372, test_f1: 0.5866
 epoch: 36, train_loss: 0.7075, test_loss: 0.8828, test_f1: 0.5987
 epoch: 37, train_loss: 0.6910, test_loss: 1.1396, test_f1: 0.5568
 epoch: 38, train_loss: 0.6842, test_loss: 1.0052, test_f1: 0.6555
 epoch: 39, train_loss: 0.6564, test_loss: 1.0267, test_f1: 0.5920
 epoch: 40, train_loss: 0.6910, test_loss: 1.0464, test_f1: 0.6074
 epoch: 41, train_loss: 0.6690, test_loss: 0.9931, test_f1: 0.6068
 epoch: 42, train_loss: 0.6688, test_loss: 1.0505, test_f1: 0.6255
 epoch: 43, train_loss: 0.6531, test_loss: 0.9410, test_f1: 0.6483
 epoch: 44, train_loss: 0.6437, test_loss: 0.9546, test_f1: 0.6471
 epoch: 45, train_loss: 0.6522, test_loss: 1.0204, test_f1: 0.6220
 epoch: 46, train_loss: 0.6563, test_loss: 1.0283, test_f1: 0.6423
 epoch: 47, train_loss: 0.6198, test_loss: 1.0625, test_f1: 0.6510
 epoch: 48, train_loss: 0.6229, test_loss: 1.0275, test_f1: 0.6443
 epoch: 49, train_loss: 0.6242, test_loss: 1.1048, test_f1: 0.6039
 epoch: 50, train_loss: 0.6101, test_loss: 1.0276, test_f1: 0.6440
 epoch: 51, train_loss: 0.6085, test_loss: 1.0438, test_f1: 0.6643
 epoch: 52, train_loss: 0.5640, test_loss: 1.0880, test_f1: 0.6904
 epoch: 53, train_loss: 0.5493, test_loss: 1.0902, test_f1: 0.6540
 epoch: 54, train_loss: 0.5408, test_loss: 1.0377, test_f1: 0.6813
 epoch: 55, train_loss: 0.5340, test_loss: 1.0888, test_f1: 0.6832
 epoch: 56, train_loss: 0.5239, test_loss: 1.0894, test_f1: 0.6798
 epoch: 57, train_loss: 0.5387, test_loss: 1.1136, test_f1: 0.6602
 epoch: 58, train_loss: 0.5231, test_loss: 1.0798, test_f1: 0.6908
 epoch: 59, train_loss: 0.5200, test_loss: 1.0617, test_f1: 0.6726
 epoch: 60, train_loss: 0.5092, test_loss: 1.0704, test_f1: 0.6641
 epoch: 61, train_loss: 0.5216, test_loss: 1.2024, test_f1: 0.6465
 epoch: 62, train_loss: 0.5136, test_loss: 1.0744, test_f1: 0.6728
 epoch: 63, train_loss: 0.4857, test_loss: 1.0969, test_f1: 0.6572
 epoch: 64, train_loss: 0.4758, test_loss: 1.0890, test_f1: 0.6694
 epoch: 65, train_loss: 0.4876, test_loss: 1.1159, test_f1: 0.6784
 epoch: 66, train_loss: 0.4939, test_loss: 1.0717, test_f1: 0.6736
 epoch: 67, train_loss: 0.4863, test_loss: 1.1087, test_f1: 0.7070
 epoch: 68, train_loss: 0.4800, test_loss: 1.1161, test_f1: 0.6631
 epoch: 69, train_loss: 0.4834, test_loss: 1.1065, test_f1: 0.6988
 epoch: 70, train_loss: 0.4723, test_loss: 1.1717, test_f1: 0.6645
 epoch: 71, train_loss: 0.4755, test_loss: 1.1800, test_f1: 0.6737
 epoch: 72, train_loss: 0.4679, test_loss: 1.1863, test_f1: 0.6734
 epoch: 73, train_loss: 0.4363, test_loss: 1.1387, test_f1: 0.6916
 epoch: 74, train_loss: 0.4551, test_loss: 1.1145, test_f1: 0.6481
 epoch: 75, train_loss: 0.4529, test_loss: 1.1827, test_f1: 0.6848
 epoch: 76, train_loss: 0.4452, test_loss: 1.1358, test_f1: 0.7029
 epoch: 77, train_loss: 0.4619, test_loss: 1.1644, test_f1: 0.6364
 epoch: 78, train_loss: 0.4336, test_loss: 1.1359, test_f1: 0.6948
 epoch: 79, train_loss: 0.4326, test_loss: 1.1869, test_f1: 0.6681
 epoch: 80, train_loss: 0.4360, test_loss: 1.2153, test_f1: 0.6978
 epoch: 81, train_loss: 0.4272, test_loss: 1.0859, test_f1: 0.6868
 epoch: 82, train_loss: 0.4210, test_loss: 1.1564, test_f1: 0.6729
 epoch: 83, train_loss: 0.4374, test_loss: 1.1994, test_f1: 0.6952
 epoch: 84, train_loss: 0.4240, test_loss: 1.2186, test_f1: 0.7014
 epoch: 85, train_loss: 0.4183, test_loss: 1.1769, test_f1: 0.7097
 epoch: 86, train_loss: 0.4130, test_loss: 1.2428, test_f1: 0.6843
 epoch: 87, train_loss: 0.3957, test_loss: 1.1868, test_f1: 0.6877
 epoch: 88, train_loss: 0.4000, test_loss: 1.2494, test_f1: 0.6867
 epoch: 89, train_loss: 0.3973, test_loss: 1.3058, test_f1: 0.6949
 epoch: 90, train_loss: 0.4180, test_loss: 1.2544, test_f1: 0.6949
 epoch: 91, train_loss: 0.4081, test_loss: 1.2188, test_f1: 0.7028
 epoch: 92, train_loss: 0.3878, test_loss: 1.2353, test_f1: 0.7108
 epoch: 93, train_loss: 0.3825, test_loss: 1.2244, test_f1: 0.6958
 epoch: 94, train_loss: 0.3704, test_loss: 1.2920, test_f1: 0.6907
 epoch: 95, train_loss: 0.3763, test_loss: 1.2897, test_f1: 0.6968
 epoch: 96, train_loss: 0.3794, test_loss: 1.2151, test_f1: 0.6856
 epoch: 97, train_loss: 0.3833, test_loss: 1.3088, test_f1: 0.7053
 epoch: 98, train_loss: 0.3860, test_loss: 1.2909, test_f1: 0.6940
 epoch: 99, train_loss: 0.3710, test_loss: 1.2949, test_f1: 0.6907
##################ITERATION #9 ****************************************
 epoch: 0, train_loss: 1.3698, test_loss: 1.0542, test_f1: 0.4334
 epoch: 1, train_loss: 1.0464, test_loss: 0.9831, test_f1: 0.4706
 epoch: 2, train_loss: 0.9926, test_loss: 0.9566, test_f1: 0.4771
 epoch: 3, train_loss: 0.9760, test_loss: 0.9556, test_f1: 0.5150
 epoch: 4, train_loss: 0.9496, test_loss: 0.9340, test_f1: 0.4924
 epoch: 5, train_loss: 0.9381, test_loss: 0.9809, test_f1: 0.4879
 epoch: 6, train_loss: 0.9206, test_loss: 0.9508, test_f1: 0.4981
 epoch: 7, train_loss: 0.9194, test_loss: 0.9307, test_f1: 0.5246
 epoch: 8, train_loss: 0.8767, test_loss: 0.9753, test_f1: 0.5070
 epoch: 9, train_loss: 0.8787, test_loss: 0.9311, test_f1: 0.5220
 epoch: 10, train_loss: 0.8673, test_loss: 1.0314, test_f1: 0.5080
 epoch: 11, train_loss: 0.8659, test_loss: 0.9796, test_f1: 0.5524
 epoch: 12, train_loss: 0.8557, test_loss: 0.9147, test_f1: 0.5685
 epoch: 13, train_loss: 0.8561, test_loss: 0.9787, test_f1: 0.5240
 epoch: 14, train_loss: 0.8487, test_loss: 0.9367, test_f1: 0.5870
 epoch: 15, train_loss: 0.8419, test_loss: 0.9239, test_f1: 0.5535
 epoch: 16, train_loss: 0.8284, test_loss: 0.8791, test_f1: 0.5501
 epoch: 17, train_loss: 0.8168, test_loss: 0.9588, test_f1: 0.5458
 epoch: 18, train_loss: 0.8270, test_loss: 0.9430, test_f1: 0.5759
 epoch: 19, train_loss: 0.8088, test_loss: 0.9213, test_f1: 0.5621
 epoch: 20, train_loss: 0.7958, test_loss: 0.9591, test_f1: 0.5735
 epoch: 21, train_loss: 0.7945, test_loss: 0.9182, test_f1: 0.5791
 epoch: 22, train_loss: 0.7949, test_loss: 0.9439, test_f1: 0.5636
 epoch: 23, train_loss: 0.7892, test_loss: 0.9370, test_f1: 0.5495
 epoch: 24, train_loss: 0.7937, test_loss: 0.9252, test_f1: 0.5557
 epoch: 25, train_loss: 0.7720, test_loss: 0.9696, test_f1: 0.6049
 epoch: 26, train_loss: 0.7729, test_loss: 0.9592, test_f1: 0.6039
 epoch: 27, train_loss: 0.7635, test_loss: 1.0044, test_f1: 0.5751
 epoch: 28, train_loss: 0.7665, test_loss: 0.9798, test_f1: 0.5793
 epoch: 29, train_loss: 0.7504, test_loss: 0.9792, test_f1: 0.5912
 epoch: 30, train_loss: 0.7467, test_loss: 0.9983, test_f1: 0.6210
 epoch: 31, train_loss: 0.7668, test_loss: 0.9404, test_f1: 0.5746
 epoch: 32, train_loss: 0.7520, test_loss: 0.9521, test_f1: 0.6068
 epoch: 33, train_loss: 0.7424, test_loss: 0.9263, test_f1: 0.6029
 epoch: 34, train_loss: 0.7072, test_loss: 1.0220, test_f1: 0.5876
 epoch: 35, train_loss: 0.7224, test_loss: 1.0149, test_f1: 0.6146
 epoch: 36, train_loss: 0.7534, test_loss: 0.8990, test_f1: 0.6049
 epoch: 37, train_loss: 0.7209, test_loss: 0.9479, test_f1: 0.5958
 epoch: 38, train_loss: 0.7195, test_loss: 0.9575, test_f1: 0.5928
 epoch: 39, train_loss: 0.7030, test_loss: 1.0236, test_f1: 0.6304
 epoch: 40, train_loss: 0.7098, test_loss: 1.0109, test_f1: 0.6036
 epoch: 41, train_loss: 0.6976, test_loss: 1.0218, test_f1: 0.6112
 epoch: 42, train_loss: 0.6863, test_loss: 0.9349, test_f1: 0.6561
 epoch: 43, train_loss: 0.6843, test_loss: 1.0188, test_f1: 0.5825
 epoch: 44, train_loss: 0.6778, test_loss: 0.9905, test_f1: 0.6038
 epoch: 45, train_loss: 0.6673, test_loss: 0.9777, test_f1: 0.6456
 epoch: 46, train_loss: 0.6746, test_loss: 1.0062, test_f1: 0.6442
 epoch: 47, train_loss: 0.6675, test_loss: 1.0234, test_f1: 0.5933
 epoch: 48, train_loss: 0.6591, test_loss: 0.9900, test_f1: 0.6046
 epoch: 49, train_loss: 0.6504, test_loss: 1.0101, test_f1: 0.6389
 epoch: 50, train_loss: 0.6463, test_loss: 0.9884, test_f1: 0.6209
 epoch: 51, train_loss: 0.6142, test_loss: 0.9881, test_f1: 0.6348
 epoch: 52, train_loss: 0.6058, test_loss: 1.0232, test_f1: 0.6656
 epoch: 53, train_loss: 0.5818, test_loss: 1.0223, test_f1: 0.6619
 epoch: 54, train_loss: 0.5773, test_loss: 1.0315, test_f1: 0.6628
 epoch: 55, train_loss: 0.5892, test_loss: 1.0608, test_f1: 0.6542
 epoch: 56, train_loss: 0.5879, test_loss: 1.0429, test_f1: 0.6682
 epoch: 57, train_loss: 0.5608, test_loss: 0.9979, test_f1: 0.6685
 epoch: 58, train_loss: 0.5591, test_loss: 1.0712, test_f1: 0.6505
 epoch: 59, train_loss: 0.5610, test_loss: 1.0364, test_f1: 0.6811
 epoch: 60, train_loss: 0.5577, test_loss: 1.0526, test_f1: 0.6844
 epoch: 61, train_loss: 0.5546, test_loss: 1.0616, test_f1: 0.6840
 epoch: 62, train_loss: 0.5357, test_loss: 1.0622, test_f1: 0.6908
 epoch: 63, train_loss: 0.5539, test_loss: 1.0924, test_f1: 0.6481
 epoch: 64, train_loss: 0.5134, test_loss: 1.0839, test_f1: 0.6657
 epoch: 65, train_loss: 0.5319, test_loss: 1.0756, test_f1: 0.6870
 epoch: 66, train_loss: 0.5400, test_loss: 1.0256, test_f1: 0.6789
 epoch: 67, train_loss: 0.5296, test_loss: 1.0394, test_f1: 0.6755
 epoch: 68, train_loss: 0.5083, test_loss: 1.0712, test_f1: 0.6730
 epoch: 69, train_loss: 0.5028, test_loss: 1.0243, test_f1: 0.6877
 epoch: 70, train_loss: 0.5288, test_loss: 1.1370, test_f1: 0.6718
 epoch: 71, train_loss: 0.5129, test_loss: 1.1130, test_f1: 0.6610
 epoch: 72, train_loss: 0.5005, test_loss: 1.1787, test_f1: 0.6534
 epoch: 73, train_loss: 0.5037, test_loss: 1.1199, test_f1: 0.6750
 epoch: 74, train_loss: 0.4946, test_loss: 1.2171, test_f1: 0.6462
 epoch: 75, train_loss: 0.4853, test_loss: 1.1406, test_f1: 0.6709
 epoch: 76, train_loss: 0.4826, test_loss: 1.0769, test_f1: 0.6686
 epoch: 77, train_loss: 0.4705, test_loss: 1.1253, test_f1: 0.6652
 epoch: 78, train_loss: 0.4905, test_loss: 1.1279, test_f1: 0.6588
 epoch: 79, train_loss: 0.4996, test_loss: 1.0978, test_f1: 0.6704
 epoch: 80, train_loss: 0.4749, test_loss: 1.1370, test_f1: 0.6663
 epoch: 81, train_loss: 0.4700, test_loss: 1.1008, test_f1: 0.6638
 epoch: 82, train_loss: 0.4671, test_loss: 1.1181, test_f1: 0.6798
 epoch: 83, train_loss: 0.4765, test_loss: 1.1117, test_f1: 0.6485
 epoch: 84, train_loss: 0.4719, test_loss: 1.1070, test_f1: 0.6408
 epoch: 85, train_loss: 0.4641, test_loss: 1.1524, test_f1: 0.6794
 epoch: 86, train_loss: 0.4479, test_loss: 1.1888, test_f1: 0.6768
 epoch: 87, train_loss: 0.4351, test_loss: 1.1925, test_f1: 0.6640
 epoch: 88, train_loss: 0.4587, test_loss: 1.1848, test_f1: 0.6619
 epoch: 89, train_loss: 0.4349, test_loss: 1.1817, test_f1: 0.6735
 epoch: 90, train_loss: 0.4417, test_loss: 1.2088, test_f1: 0.6661
 epoch: 91, train_loss: 0.4269, test_loss: 1.2057, test_f1: 0.6774
 epoch: 92, train_loss: 0.4351, test_loss: 1.1812, test_f1: 0.6710
 epoch: 93, train_loss: 0.4108, test_loss: 1.2063, test_f1: 0.6630
 epoch: 94, train_loss: 0.4038, test_loss: 1.2890, test_f1: 0.6572
 epoch: 95, train_loss: 0.4205, test_loss: 1.2158, test_f1: 0.7020
 epoch: 96, train_loss: 0.4138, test_loss: 1.2304, test_f1: 0.6797
 epoch: 97, train_loss: 0.4150, test_loss: 1.1865, test_f1: 0.6764
 epoch: 98, train_loss: 0.4178, test_loss: 1.1908, test_f1: 0.6850
 epoch: 99, train_loss: 0.4012, test_loss: 1.1988, test_f1: 0.6563

Training completed in 743.27 seconds
Best F1: 0.7108 at epoch 92
Mean F1 across iterations: 0.6871  0.0131
========================FINAL RESULTS================================
FEGIN weighted F1: 0.7108  0.0131
python main.py --data ltspice_examples --representation component_net --model FEGIN --layers 5 --hiddens 64 --batch_size 64 --lr 0.001 --emb_size 512 --epochs 100 --save_appendix component_net_L5_H64_BS64_LR0.001_E512 --no_val
-----



STDERR:
  File "main.py", line 370, in <module>
    main()
  File "main.py", line 254, in main
    dataset = dataset_class(
  File "/home/philip/projects/ltspice_examples_code_repo/Circuit-Completion-Using-GNNs/component_classification_with_link_prediction_head/evaluation/FEGIN/kernel/circuit_datasets.py", line 15, in __init__
    self.data, self.slices = torch.load(self.processed_paths[0])
  File "/home/philip/.local/lib/python3.8/site-packages/torch/serialization.py", line 1040, in load
    warnings.warn(
  File "/usr/lib/python3.8/warnings.py", line 109, in _showwarnmsg
    sw(msg.message, msg.category, msg.filename, msg.lineno,
  File "main.py", line 47, in warn_with_traceback
    traceback.print_stack(file=log)
/home/philip/projects/ltspice_examples_code_repo/Circuit-Completion-Using-GNNs/component_classification_with_link_prediction_head/evaluation/FEGIN/kernel/circuit_datasets.py:15: FutureWarning: You are using `torch.load` with `weights_only=False` (the current default value), which uses the default pickle module implicitly. It is possible to construct malicious pickle data which will execute arbitrary code during unpickling (See https://github.com/pytorch/pytorch/blob/main/SECURITY.md#untrusted-models for more details). In a future release, the default value for `weights_only` will be flipped to `True`. This limits the functions that could be executed during unpickling. Arbitrary objects will no longer be allowed to be loaded via this mode unless they are explicitly allowlisted by the user via `torch.serialization.add_safe_globals`. We recommend you start setting `weights_only=True` for any use case where you don't have full control of the loaded file. Please open an issue on GitHub for any issues related to this experimental feature.
  self.data, self.slices = torch.load(self.processed_paths[0])
