STDOUT:
Results will be saved in /home/philip/projects/ltspice_examples_code_repo/Circuit-Completion-Using-GNNs/component_classification_with_link_prediction_head/evaluation/FEGIN/results/model_FEGIN_dataset_ltspice_examples
Command line input: python main.py --data ltspice_examples --representation component_component --model FEGIN --layers 6 --hiddens 32 --batch_size 256 --lr 0.0001 --emb_size 250 --epochs 100 --save_appendix component_component_L6_H32_BS256_LR0.0001_E250 --no_val
 is saved.
-----
ltspice_examples - FEGIN
Using 6 layers, 32 hidden units, h = 2
Loading component_component representation dataset
ENTERED
Training FEGIN on component_component representation
Train: 3556, Test: 845
##################ITERATION #0 ****************************************
 epoch: 0, train_loss: 1.4328, test_loss: 1.4239, test_f1: 0.1015
 epoch: 1, train_loss: 1.4289, test_loss: 1.4222, test_f1: 0.1015
 epoch: 2, train_loss: 1.4262, test_loss: 1.4205, test_f1: 0.1015
 epoch: 3, train_loss: 1.4241, test_loss: 1.4181, test_f1: 0.1011
 epoch: 4, train_loss: 1.4221, test_loss: 1.4158, test_f1: 0.1011
 epoch: 5, train_loss: 1.4191, test_loss: 1.4123, test_f1: 0.1264
 epoch: 6, train_loss: 1.4170, test_loss: 1.4097, test_f1: 0.1200
 epoch: 7, train_loss: 1.4148, test_loss: 1.4075, test_f1: 0.1222
 epoch: 8, train_loss: 1.4114, test_loss: 1.4053, test_f1: 0.1433
 epoch: 9, train_loss: 1.4095, test_loss: 1.4027, test_f1: 0.1463
 epoch: 10, train_loss: 1.4070, test_loss: 1.3998, test_f1: 0.1445
 epoch: 11, train_loss: 1.4032, test_loss: 1.3966, test_f1: 0.1463
 epoch: 12, train_loss: 1.4008, test_loss: 1.3935, test_f1: 0.1463
 epoch: 13, train_loss: 1.3970, test_loss: 1.3900, test_f1: 0.1463
 epoch: 14, train_loss: 1.3928, test_loss: 1.3861, test_f1: 0.1497
 epoch: 15, train_loss: 1.3895, test_loss: 1.3814, test_f1: 0.1581
 epoch: 16, train_loss: 1.3849, test_loss: 1.3764, test_f1: 0.1595
 epoch: 17, train_loss: 1.3787, test_loss: 1.3717, test_f1: 0.1624
 epoch: 18, train_loss: 1.3743, test_loss: 1.3658, test_f1: 0.1656
 epoch: 19, train_loss: 1.3665, test_loss: 1.3593, test_f1: 0.1664
 epoch: 20, train_loss: 1.3580, test_loss: 1.3519, test_f1: 0.1640
 epoch: 21, train_loss: 1.3520, test_loss: 1.3436, test_f1: 0.1940
 epoch: 22, train_loss: 1.3440, test_loss: 1.3343, test_f1: 0.2938
 epoch: 23, train_loss: 1.3361, test_loss: 1.3261, test_f1: 0.3111
 epoch: 24, train_loss: 1.3272, test_loss: 1.3171, test_f1: 0.3407
 epoch: 25, train_loss: 1.3171, test_loss: 1.3082, test_f1: 0.3689
 epoch: 26, train_loss: 1.3092, test_loss: 1.3004, test_f1: 0.3585
 epoch: 27, train_loss: 1.3043, test_loss: 1.2914, test_f1: 0.3621
 epoch: 28, train_loss: 1.2953, test_loss: 1.2831, test_f1: 0.3526
 epoch: 29, train_loss: 1.2848, test_loss: 1.2757, test_f1: 0.3513
 epoch: 30, train_loss: 1.2823, test_loss: 1.2704, test_f1: 0.3380
 epoch: 31, train_loss: 1.2716, test_loss: 1.2637, test_f1: 0.3527
 epoch: 32, train_loss: 1.2695, test_loss: 1.2566, test_f1: 0.3346
 epoch: 33, train_loss: 1.2675, test_loss: 1.2505, test_f1: 0.3421
 epoch: 34, train_loss: 1.2582, test_loss: 1.2452, test_f1: 0.3325
 epoch: 35, train_loss: 1.2552, test_loss: 1.2386, test_f1: 0.3375
 epoch: 36, train_loss: 1.2470, test_loss: 1.2351, test_f1: 0.3306
 epoch: 37, train_loss: 1.2454, test_loss: 1.2311, test_f1: 0.3469
 epoch: 38, train_loss: 1.2429, test_loss: 1.2269, test_f1: 0.3299
 epoch: 39, train_loss: 1.2371, test_loss: 1.2228, test_f1: 0.3326
 epoch: 40, train_loss: 1.2355, test_loss: 1.2196, test_f1: 0.3280
 epoch: 41, train_loss: 1.2296, test_loss: 1.2160, test_f1: 0.3322
 epoch: 42, train_loss: 1.2296, test_loss: 1.2121, test_f1: 0.3340
 epoch: 43, train_loss: 1.2283, test_loss: 1.2115, test_f1: 0.3302
 epoch: 44, train_loss: 1.2198, test_loss: 1.2086, test_f1: 0.3353
 epoch: 45, train_loss: 1.2139, test_loss: 1.2055, test_f1: 0.3384
 epoch: 46, train_loss: 1.2167, test_loss: 1.2030, test_f1: 0.3377
 epoch: 47, train_loss: 1.2086, test_loss: 1.2004, test_f1: 0.3382
 epoch: 48, train_loss: 1.2106, test_loss: 1.1985, test_f1: 0.3418
 epoch: 49, train_loss: 1.2080, test_loss: 1.1951, test_f1: 0.3429
 epoch: 50, train_loss: 1.1978, test_loss: 1.1924, test_f1: 0.3421
 epoch: 51, train_loss: 1.2025, test_loss: 1.1926, test_f1: 0.3427
 epoch: 52, train_loss: 1.2008, test_loss: 1.1924, test_f1: 0.3420
 epoch: 53, train_loss: 1.1967, test_loss: 1.1899, test_f1: 0.3428
 epoch: 54, train_loss: 1.1888, test_loss: 1.1891, test_f1: 0.3449
 epoch: 55, train_loss: 1.1936, test_loss: 1.1869, test_f1: 0.3435
 epoch: 56, train_loss: 1.1948, test_loss: 1.1842, test_f1: 0.3422
 epoch: 57, train_loss: 1.1956, test_loss: 1.1828, test_f1: 0.3462
 epoch: 58, train_loss: 1.1910, test_loss: 1.1814, test_f1: 0.3494
 epoch: 59, train_loss: 1.1933, test_loss: 1.1816, test_f1: 0.3452
 epoch: 60, train_loss: 1.1871, test_loss: 1.1803, test_f1: 0.3496
 epoch: 61, train_loss: 1.1891, test_loss: 1.1794, test_f1: 0.3492
 epoch: 62, train_loss: 1.1885, test_loss: 1.1788, test_f1: 0.3484
 epoch: 63, train_loss: 1.1860, test_loss: 1.1795, test_f1: 0.3526
 epoch: 64, train_loss: 1.1840, test_loss: 1.1797, test_f1: 0.3626
 epoch: 65, train_loss: 1.1855, test_loss: 1.1772, test_f1: 0.3520
 epoch: 66, train_loss: 1.1807, test_loss: 1.1746, test_f1: 0.3486
 epoch: 67, train_loss: 1.1823, test_loss: 1.1719, test_f1: 0.3552
 epoch: 68, train_loss: 1.1791, test_loss: 1.1723, test_f1: 0.3566
 epoch: 69, train_loss: 1.1778, test_loss: 1.1720, test_f1: 0.3556
 epoch: 70, train_loss: 1.1779, test_loss: 1.1713, test_f1: 0.3623
 epoch: 71, train_loss: 1.1738, test_loss: 1.1713, test_f1: 0.3691
 epoch: 72, train_loss: 1.1748, test_loss: 1.1709, test_f1: 0.3590
 epoch: 73, train_loss: 1.1736, test_loss: 1.1698, test_f1: 0.3639
 epoch: 74, train_loss: 1.1729, test_loss: 1.1696, test_f1: 0.3662
 epoch: 75, train_loss: 1.1721, test_loss: 1.1710, test_f1: 0.3555
 epoch: 76, train_loss: 1.1687, test_loss: 1.1680, test_f1: 0.3557
 epoch: 77, train_loss: 1.1674, test_loss: 1.1640, test_f1: 0.3723
 epoch: 78, train_loss: 1.1694, test_loss: 1.1613, test_f1: 0.3742
 epoch: 79, train_loss: 1.1656, test_loss: 1.1623, test_f1: 0.3784
 epoch: 80, train_loss: 1.1656, test_loss: 1.1635, test_f1: 0.3677
 epoch: 81, train_loss: 1.1690, test_loss: 1.1624, test_f1: 0.3682
 epoch: 82, train_loss: 1.1619, test_loss: 1.1623, test_f1: 0.3700
 epoch: 83, train_loss: 1.1574, test_loss: 1.1634, test_f1: 0.3718
 epoch: 84, train_loss: 1.1624, test_loss: 1.1640, test_f1: 0.3750
 epoch: 85, train_loss: 1.1575, test_loss: 1.1646, test_f1: 0.3709
 epoch: 86, train_loss: 1.1550, test_loss: 1.1664, test_f1: 0.3698
 epoch: 87, train_loss: 1.1612, test_loss: 1.1674, test_f1: 0.3734
 epoch: 88, train_loss: 1.1545, test_loss: 1.1639, test_f1: 0.3774
 epoch: 89, train_loss: 1.1530, test_loss: 1.1607, test_f1: 0.3768
 epoch: 90, train_loss: 1.1512, test_loss: 1.1623, test_f1: 0.3678
 epoch: 91, train_loss: 1.1472, test_loss: 1.1623, test_f1: 0.3713
 epoch: 92, train_loss: 1.1482, test_loss: 1.1623, test_f1: 0.3648
 epoch: 93, train_loss: 1.1501, test_loss: 1.1624, test_f1: 0.3619
 epoch: 94, train_loss: 1.1526, test_loss: 1.1627, test_f1: 0.3648
 epoch: 95, train_loss: 1.1500, test_loss: 1.1606, test_f1: 0.3773
 epoch: 96, train_loss: 1.1498, test_loss: 1.1581, test_f1: 0.3653
 epoch: 97, train_loss: 1.1474, test_loss: 1.1566, test_f1: 0.3670
 epoch: 98, train_loss: 1.1444, test_loss: 1.1555, test_f1: 0.3773
 epoch: 99, train_loss: 1.1412, test_loss: 1.1546, test_f1: 0.3797
##################ITERATION #1 ****************************************
 epoch: 0, train_loss: 1.3889, test_loss: 1.3881, test_f1: 0.1585
 epoch: 1, train_loss: 1.3830, test_loss: 1.3868, test_f1: 0.1636
 epoch: 2, train_loss: 1.3778, test_loss: 1.3822, test_f1: 0.1535
 epoch: 3, train_loss: 1.3733, test_loss: 1.3729, test_f1: 0.2072
 epoch: 4, train_loss: 1.3680, test_loss: 1.3659, test_f1: 0.2211
 epoch: 5, train_loss: 1.3621, test_loss: 1.3591, test_f1: 0.2536
 epoch: 6, train_loss: 1.3563, test_loss: 1.3519, test_f1: 0.2720
 epoch: 7, train_loss: 1.3507, test_loss: 1.3428, test_f1: 0.2680
 epoch: 8, train_loss: 1.3436, test_loss: 1.3353, test_f1: 0.2713
 epoch: 9, train_loss: 1.3354, test_loss: 1.3272, test_f1: 0.2769
 epoch: 10, train_loss: 1.3272, test_loss: 1.3193, test_f1: 0.2938
 epoch: 11, train_loss: 1.3193, test_loss: 1.3117, test_f1: 0.3123
 epoch: 12, train_loss: 1.3107, test_loss: 1.3032, test_f1: 0.3020
 epoch: 13, train_loss: 1.3036, test_loss: 1.2953, test_f1: 0.2965
 epoch: 14, train_loss: 1.2956, test_loss: 1.2878, test_f1: 0.2880
 epoch: 15, train_loss: 1.2887, test_loss: 1.2809, test_f1: 0.2825
 epoch: 16, train_loss: 1.2825, test_loss: 1.2743, test_f1: 0.2777
 epoch: 17, train_loss: 1.2732, test_loss: 1.2688, test_f1: 0.2754
 epoch: 18, train_loss: 1.2687, test_loss: 1.2634, test_f1: 0.2719
 epoch: 19, train_loss: 1.2592, test_loss: 1.2586, test_f1: 0.2719
 epoch: 20, train_loss: 1.2587, test_loss: 1.2539, test_f1: 0.2739
 epoch: 21, train_loss: 1.2509, test_loss: 1.2508, test_f1: 0.2733
 epoch: 22, train_loss: 1.2485, test_loss: 1.2471, test_f1: 0.2727
 epoch: 23, train_loss: 1.2429, test_loss: 1.2444, test_f1: 0.2713
 epoch: 24, train_loss: 1.2411, test_loss: 1.2413, test_f1: 0.2694
 epoch: 25, train_loss: 1.2429, test_loss: 1.2385, test_f1: 0.2749
 epoch: 26, train_loss: 1.2404, test_loss: 1.2358, test_f1: 0.2812
 epoch: 27, train_loss: 1.2322, test_loss: 1.2330, test_f1: 0.2863
 epoch: 28, train_loss: 1.2259, test_loss: 1.2309, test_f1: 0.2898
 epoch: 29, train_loss: 1.2247, test_loss: 1.2279, test_f1: 0.2917
 epoch: 30, train_loss: 1.2237, test_loss: 1.2260, test_f1: 0.3031
 epoch: 31, train_loss: 1.2236, test_loss: 1.2243, test_f1: 0.3161
 epoch: 32, train_loss: 1.2172, test_loss: 1.2217, test_f1: 0.3195
 epoch: 33, train_loss: 1.2152, test_loss: 1.2192, test_f1: 0.3215
 epoch: 34, train_loss: 1.2110, test_loss: 1.2160, test_f1: 0.3239
 epoch: 35, train_loss: 1.2075, test_loss: 1.2143, test_f1: 0.3300
 epoch: 36, train_loss: 1.2100, test_loss: 1.2112, test_f1: 0.3302
 epoch: 37, train_loss: 1.2017, test_loss: 1.2082, test_f1: 0.3351
 epoch: 38, train_loss: 1.1998, test_loss: 1.2066, test_f1: 0.3399
 epoch: 39, train_loss: 1.1997, test_loss: 1.2040, test_f1: 0.3407
 epoch: 40, train_loss: 1.1969, test_loss: 1.2022, test_f1: 0.3497
 epoch: 41, train_loss: 1.1941, test_loss: 1.1996, test_f1: 0.3686
 epoch: 42, train_loss: 1.1885, test_loss: 1.1963, test_f1: 0.3739
 epoch: 43, train_loss: 1.1891, test_loss: 1.1933, test_f1: 0.3721
 epoch: 44, train_loss: 1.1871, test_loss: 1.1913, test_f1: 0.3709
 epoch: 45, train_loss: 1.1803, test_loss: 1.1879, test_f1: 0.3701
 epoch: 46, train_loss: 1.1757, test_loss: 1.1870, test_f1: 0.3610
 epoch: 47, train_loss: 1.1754, test_loss: 1.1855, test_f1: 0.3731
 epoch: 48, train_loss: 1.1707, test_loss: 1.1832, test_f1: 0.3790
 epoch: 49, train_loss: 1.1641, test_loss: 1.1820, test_f1: 0.3818
 epoch: 50, train_loss: 1.1653, test_loss: 1.1781, test_f1: 0.3839
 epoch: 51, train_loss: 1.1645, test_loss: 1.1756, test_f1: 0.3819
 epoch: 52, train_loss: 1.1643, test_loss: 1.1756, test_f1: 0.3824
 epoch: 53, train_loss: 1.1639, test_loss: 1.1745, test_f1: 0.3873
 epoch: 54, train_loss: 1.1578, test_loss: 1.1721, test_f1: 0.3852
 epoch: 55, train_loss: 1.1542, test_loss: 1.1715, test_f1: 0.3803
 epoch: 56, train_loss: 1.1524, test_loss: 1.1714, test_f1: 0.3858
 epoch: 57, train_loss: 1.1563, test_loss: 1.1704, test_f1: 0.3838
 epoch: 58, train_loss: 1.1543, test_loss: 1.1699, test_f1: 0.3898
 epoch: 59, train_loss: 1.1502, test_loss: 1.1692, test_f1: 0.3873
 epoch: 60, train_loss: 1.1494, test_loss: 1.1673, test_f1: 0.3919
 epoch: 61, train_loss: 1.1492, test_loss: 1.1653, test_f1: 0.3937
 epoch: 62, train_loss: 1.1550, test_loss: 1.1656, test_f1: 0.3958
 epoch: 63, train_loss: 1.1417, test_loss: 1.1633, test_f1: 0.3919
 epoch: 64, train_loss: 1.1485, test_loss: 1.1628, test_f1: 0.3912
 epoch: 65, train_loss: 1.1440, test_loss: 1.1609, test_f1: 0.3939
 epoch: 66, train_loss: 1.1383, test_loss: 1.1616, test_f1: 0.3948
 epoch: 67, train_loss: 1.1371, test_loss: 1.1613, test_f1: 0.3959
 epoch: 68, train_loss: 1.1410, test_loss: 1.1606, test_f1: 0.3961
 epoch: 69, train_loss: 1.1352, test_loss: 1.1596, test_f1: 0.3962
 epoch: 70, train_loss: 1.1368, test_loss: 1.1588, test_f1: 0.3932
 epoch: 71, train_loss: 1.1334, test_loss: 1.1583, test_f1: 0.3934
 epoch: 72, train_loss: 1.1359, test_loss: 1.1580, test_f1: 0.3929
 epoch: 73, train_loss: 1.1286, test_loss: 1.1575, test_f1: 0.3892
 epoch: 74, train_loss: 1.1306, test_loss: 1.1559, test_f1: 0.3912
 epoch: 75, train_loss: 1.1248, test_loss: 1.1561, test_f1: 0.3942
 epoch: 76, train_loss: 1.1244, test_loss: 1.1545, test_f1: 0.3887
 epoch: 77, train_loss: 1.1223, test_loss: 1.1538, test_f1: 0.3933
 epoch: 78, train_loss: 1.1197, test_loss: 1.1536, test_f1: 0.3905
 epoch: 79, train_loss: 1.1260, test_loss: 1.1520, test_f1: 0.3877
 epoch: 80, train_loss: 1.1219, test_loss: 1.1505, test_f1: 0.3919
 epoch: 81, train_loss: 1.1162, test_loss: 1.1516, test_f1: 0.3949
 epoch: 82, train_loss: 1.1186, test_loss: 1.1521, test_f1: 0.3910
 epoch: 83, train_loss: 1.1183, test_loss: 1.1534, test_f1: 0.3890
 epoch: 84, train_loss: 1.1160, test_loss: 1.1506, test_f1: 0.3879
 epoch: 85, train_loss: 1.1142, test_loss: 1.1479, test_f1: 0.3933
 epoch: 86, train_loss: 1.1082, test_loss: 1.1481, test_f1: 0.3930
 epoch: 87, train_loss: 1.1129, test_loss: 1.1474, test_f1: 0.3922
 epoch: 88, train_loss: 1.1140, test_loss: 1.1474, test_f1: 0.3912
 epoch: 89, train_loss: 1.1109, test_loss: 1.1481, test_f1: 0.3884
 epoch: 90, train_loss: 1.1074, test_loss: 1.1476, test_f1: 0.3870
 epoch: 91, train_loss: 1.1085, test_loss: 1.1456, test_f1: 0.3910
 epoch: 92, train_loss: 1.1082, test_loss: 1.1439, test_f1: 0.3942
 epoch: 93, train_loss: 1.1071, test_loss: 1.1452, test_f1: 0.3912
 epoch: 94, train_loss: 1.1031, test_loss: 1.1462, test_f1: 0.3870
 epoch: 95, train_loss: 1.1040, test_loss: 1.1461, test_f1: 0.3830
 epoch: 96, train_loss: 1.1045, test_loss: 1.1452, test_f1: 0.3874
 epoch: 97, train_loss: 1.0975, test_loss: 1.1455, test_f1: 0.3891
 epoch: 98, train_loss: 1.1007, test_loss: 1.1441, test_f1: 0.3837
 epoch: 99, train_loss: 1.0945, test_loss: 1.1446, test_f1: 0.3800
##################ITERATION #2 ****************************************
 epoch: 0, train_loss: 1.3446, test_loss: 1.3533, test_f1: 0.2274
 epoch: 1, train_loss: 1.3352, test_loss: 1.3443, test_f1: 0.2274
 epoch: 2, train_loss: 1.3282, test_loss: 1.3375, test_f1: 0.2274
 epoch: 3, train_loss: 1.3202, test_loss: 1.3301, test_f1: 0.2274
 epoch: 4, train_loss: 1.3145, test_loss: 1.3216, test_f1: 0.2647
 epoch: 5, train_loss: 1.3082, test_loss: 1.3103, test_f1: 0.2877
 epoch: 6, train_loss: 1.3034, test_loss: 1.2980, test_f1: 0.2755
 epoch: 7, train_loss: 1.2962, test_loss: 1.2897, test_f1: 0.2762
 epoch: 8, train_loss: 1.2907, test_loss: 1.2839, test_f1: 0.2637
 epoch: 9, train_loss: 1.2849, test_loss: 1.2776, test_f1: 0.2679
 epoch: 10, train_loss: 1.2797, test_loss: 1.2726, test_f1: 0.2700
 epoch: 11, train_loss: 1.2747, test_loss: 1.2681, test_f1: 0.2875
 epoch: 12, train_loss: 1.2678, test_loss: 1.2624, test_f1: 0.2922
 epoch: 13, train_loss: 1.2629, test_loss: 1.2562, test_f1: 0.3086
 epoch: 14, train_loss: 1.2587, test_loss: 1.2524, test_f1: 0.3145
 epoch: 15, train_loss: 1.2570, test_loss: 1.2470, test_f1: 0.3153
 epoch: 16, train_loss: 1.2509, test_loss: 1.2427, test_f1: 0.3194
 epoch: 17, train_loss: 1.2452, test_loss: 1.2367, test_f1: 0.3249
 epoch: 18, train_loss: 1.2443, test_loss: 1.2330, test_f1: 0.3259
 epoch: 19, train_loss: 1.2409, test_loss: 1.2290, test_f1: 0.3286
 epoch: 20, train_loss: 1.2388, test_loss: 1.2263, test_f1: 0.3290
 epoch: 21, train_loss: 1.2328, test_loss: 1.2223, test_f1: 0.3323
 epoch: 22, train_loss: 1.2285, test_loss: 1.2192, test_f1: 0.3374
 epoch: 23, train_loss: 1.2261, test_loss: 1.2154, test_f1: 0.3388
 epoch: 24, train_loss: 1.2242, test_loss: 1.2113, test_f1: 0.3378
 epoch: 25, train_loss: 1.2231, test_loss: 1.2082, test_f1: 0.3376
 epoch: 26, train_loss: 1.2153, test_loss: 1.2062, test_f1: 0.3411
 epoch: 27, train_loss: 1.2166, test_loss: 1.2035, test_f1: 0.3389
 epoch: 28, train_loss: 1.2136, test_loss: 1.2010, test_f1: 0.3419
 epoch: 29, train_loss: 1.2082, test_loss: 1.1998, test_f1: 0.3467
 epoch: 30, train_loss: 1.2047, test_loss: 1.1978, test_f1: 0.3436
 epoch: 31, train_loss: 1.2074, test_loss: 1.1953, test_f1: 0.3412
 epoch: 32, train_loss: 1.1992, test_loss: 1.1929, test_f1: 0.3398
 epoch: 33, train_loss: 1.2020, test_loss: 1.1909, test_f1: 0.3453
 epoch: 34, train_loss: 1.1944, test_loss: 1.1886, test_f1: 0.3397
 epoch: 35, train_loss: 1.1898, test_loss: 1.1850, test_f1: 0.3429
 epoch: 36, train_loss: 1.1905, test_loss: 1.1833, test_f1: 0.3399
 epoch: 37, train_loss: 1.1893, test_loss: 1.1828, test_f1: 0.3469
 epoch: 38, train_loss: 1.1877, test_loss: 1.1806, test_f1: 0.3419
 epoch: 39, train_loss: 1.1851, test_loss: 1.1784, test_f1: 0.3404
 epoch: 40, train_loss: 1.1819, test_loss: 1.1776, test_f1: 0.3393
 epoch: 41, train_loss: 1.1815, test_loss: 1.1755, test_f1: 0.3443
 epoch: 42, train_loss: 1.1834, test_loss: 1.1748, test_f1: 0.3412
 epoch: 43, train_loss: 1.1760, test_loss: 1.1746, test_f1: 0.3430
 epoch: 44, train_loss: 1.1732, test_loss: 1.1743, test_f1: 0.3445
 epoch: 45, train_loss: 1.1665, test_loss: 1.1723, test_f1: 0.3430
 epoch: 46, train_loss: 1.1751, test_loss: 1.1699, test_f1: 0.3403
 epoch: 47, train_loss: 1.1668, test_loss: 1.1674, test_f1: 0.3351
 epoch: 48, train_loss: 1.1650, test_loss: 1.1677, test_f1: 0.3324
 epoch: 49, train_loss: 1.1642, test_loss: 1.1670, test_f1: 0.3328
 epoch: 50, train_loss: 1.1664, test_loss: 1.1612, test_f1: 0.3348
 epoch: 51, train_loss: 1.1580, test_loss: 1.1627, test_f1: 0.3351
 epoch: 52, train_loss: 1.1574, test_loss: 1.1621, test_f1: 0.3368
 epoch: 53, train_loss: 1.1532, test_loss: 1.1613, test_f1: 0.3357
 epoch: 54, train_loss: 1.1593, test_loss: 1.1622, test_f1: 0.3329
 epoch: 55, train_loss: 1.1518, test_loss: 1.1597, test_f1: 0.3331
 epoch: 56, train_loss: 1.1542, test_loss: 1.1589, test_f1: 0.3311
 epoch: 57, train_loss: 1.1524, test_loss: 1.1591, test_f1: 0.3358
 epoch: 58, train_loss: 1.1533, test_loss: 1.1590, test_f1: 0.3329
 epoch: 59, train_loss: 1.1470, test_loss: 1.1580, test_f1: 0.3328
 epoch: 60, train_loss: 1.1510, test_loss: 1.1564, test_f1: 0.3409
 epoch: 61, train_loss: 1.1475, test_loss: 1.1555, test_f1: 0.3391
 epoch: 62, train_loss: 1.1445, test_loss: 1.1554, test_f1: 0.3367
 epoch: 63, train_loss: 1.1474, test_loss: 1.1555, test_f1: 0.3463
 epoch: 64, train_loss: 1.1429, test_loss: 1.1556, test_f1: 0.3432
 epoch: 65, train_loss: 1.1427, test_loss: 1.1533, test_f1: 0.3485
 epoch: 66, train_loss: 1.1412, test_loss: 1.1534, test_f1: 0.3472
 epoch: 67, train_loss: 1.1410, test_loss: 1.1531, test_f1: 0.3451
 epoch: 68, train_loss: 1.1415, test_loss: 1.1541, test_f1: 0.3486
 epoch: 69, train_loss: 1.1348, test_loss: 1.1528, test_f1: 0.3464
 epoch: 70, train_loss: 1.1375, test_loss: 1.1518, test_f1: 0.3463
 epoch: 71, train_loss: 1.1390, test_loss: 1.1517, test_f1: 0.3452
 epoch: 72, train_loss: 1.1353, test_loss: 1.1519, test_f1: 0.3453
 epoch: 73, train_loss: 1.1413, test_loss: 1.1532, test_f1: 0.3497
 epoch: 74, train_loss: 1.1369, test_loss: 1.1502, test_f1: 0.3496
 epoch: 75, train_loss: 1.1381, test_loss: 1.1494, test_f1: 0.3484
 epoch: 76, train_loss: 1.1356, test_loss: 1.1482, test_f1: 0.3474
 epoch: 77, train_loss: 1.1293, test_loss: 1.1481, test_f1: 0.3485
 epoch: 78, train_loss: 1.1335, test_loss: 1.1490, test_f1: 0.3489
 epoch: 79, train_loss: 1.1287, test_loss: 1.1508, test_f1: 0.3468
 epoch: 80, train_loss: 1.1303, test_loss: 1.1470, test_f1: 0.3467
 epoch: 81, train_loss: 1.1306, test_loss: 1.1467, test_f1: 0.3469
 epoch: 82, train_loss: 1.1280, test_loss: 1.1477, test_f1: 0.3511
 epoch: 83, train_loss: 1.1221, test_loss: 1.1492, test_f1: 0.3499
 epoch: 84, train_loss: 1.1231, test_loss: 1.1492, test_f1: 0.3486
 epoch: 85, train_loss: 1.1224, test_loss: 1.1488, test_f1: 0.3508
 epoch: 86, train_loss: 1.1212, test_loss: 1.1468, test_f1: 0.3497
 epoch: 87, train_loss: 1.1178, test_loss: 1.1458, test_f1: 0.3477
 epoch: 88, train_loss: 1.1225, test_loss: 1.1467, test_f1: 0.3486
 epoch: 89, train_loss: 1.1179, test_loss: 1.1466, test_f1: 0.3471
 epoch: 90, train_loss: 1.1237, test_loss: 1.1475, test_f1: 0.3517
 epoch: 91, train_loss: 1.1191, test_loss: 1.1466, test_f1: 0.3520
 epoch: 92, train_loss: 1.1184, test_loss: 1.1462, test_f1: 0.3488
 epoch: 93, train_loss: 1.1160, test_loss: 1.1453, test_f1: 0.3473
 epoch: 94, train_loss: 1.1145, test_loss: 1.1440, test_f1: 0.3479
 epoch: 95, train_loss: 1.1147, test_loss: 1.1439, test_f1: 0.3475
 epoch: 96, train_loss: 1.1147, test_loss: 1.1430, test_f1: 0.3484
 epoch: 97, train_loss: 1.1124, test_loss: 1.1427, test_f1: 0.3530
 epoch: 98, train_loss: 1.1128, test_loss: 1.1418, test_f1: 0.3537
 epoch: 99, train_loss: 1.1134, test_loss: 1.1417, test_f1: 0.3526
##################ITERATION #3 ****************************************
 epoch: 0, train_loss: 1.3428, test_loss: 1.3606, test_f1: 0.2274
 epoch: 1, train_loss: 1.3312, test_loss: 1.3539, test_f1: 0.2274
 epoch: 2, train_loss: 1.3261, test_loss: 1.3416, test_f1: 0.2269
 epoch: 3, train_loss: 1.3206, test_loss: 1.3311, test_f1: 0.2345
 epoch: 4, train_loss: 1.3123, test_loss: 1.3205, test_f1: 0.2391
 epoch: 5, train_loss: 1.3093, test_loss: 1.3092, test_f1: 0.2638
 epoch: 6, train_loss: 1.3009, test_loss: 1.2995, test_f1: 0.2645
 epoch: 7, train_loss: 1.2976, test_loss: 1.2905, test_f1: 0.2722
 epoch: 8, train_loss: 1.2911, test_loss: 1.2841, test_f1: 0.2802
 epoch: 9, train_loss: 1.2853, test_loss: 1.2796, test_f1: 0.2943
 epoch: 10, train_loss: 1.2817, test_loss: 1.2722, test_f1: 0.3018
 epoch: 11, train_loss: 1.2777, test_loss: 1.2688, test_f1: 0.2983
 epoch: 12, train_loss: 1.2723, test_loss: 1.2627, test_f1: 0.3078
 epoch: 13, train_loss: 1.2676, test_loss: 1.2553, test_f1: 0.3250
 epoch: 14, train_loss: 1.2634, test_loss: 1.2515, test_f1: 0.3298
 epoch: 15, train_loss: 1.2577, test_loss: 1.2479, test_f1: 0.3185
 epoch: 16, train_loss: 1.2528, test_loss: 1.2403, test_f1: 0.3302
 epoch: 17, train_loss: 1.2488, test_loss: 1.2345, test_f1: 0.3295
 epoch: 18, train_loss: 1.2408, test_loss: 1.2293, test_f1: 0.3325
 epoch: 19, train_loss: 1.2437, test_loss: 1.2247, test_f1: 0.3414
 epoch: 20, train_loss: 1.2364, test_loss: 1.2212, test_f1: 0.3418
 epoch: 21, train_loss: 1.2332, test_loss: 1.2171, test_f1: 0.3419
 epoch: 22, train_loss: 1.2333, test_loss: 1.2126, test_f1: 0.3429
 epoch: 23, train_loss: 1.2314, test_loss: 1.2112, test_f1: 0.3398
 epoch: 24, train_loss: 1.2260, test_loss: 1.2062, test_f1: 0.3406
 epoch: 25, train_loss: 1.2232, test_loss: 1.2038, test_f1: 0.3414
 epoch: 26, train_loss: 1.2193, test_loss: 1.2000, test_f1: 0.3477
 epoch: 27, train_loss: 1.2200, test_loss: 1.1980, test_f1: 0.3430
 epoch: 28, train_loss: 1.2136, test_loss: 1.1966, test_f1: 0.3485
 epoch: 29, train_loss: 1.2117, test_loss: 1.1936, test_f1: 0.3516
 epoch: 30, train_loss: 1.2083, test_loss: 1.1902, test_f1: 0.3536
 epoch: 31, train_loss: 1.2077, test_loss: 1.1884, test_f1: 0.3458
 epoch: 32, train_loss: 1.2016, test_loss: 1.1864, test_f1: 0.3529
 epoch: 33, train_loss: 1.1959, test_loss: 1.1860, test_f1: 0.3565
 epoch: 34, train_loss: 1.2068, test_loss: 1.1863, test_f1: 0.3583
 epoch: 35, train_loss: 1.1991, test_loss: 1.1804, test_f1: 0.3529
 epoch: 36, train_loss: 1.1974, test_loss: 1.1781, test_f1: 0.3568
 epoch: 37, train_loss: 1.1895, test_loss: 1.1775, test_f1: 0.3529
 epoch: 38, train_loss: 1.1925, test_loss: 1.1761, test_f1: 0.3549
 epoch: 39, train_loss: 1.1912, test_loss: 1.1736, test_f1: 0.3584
 epoch: 40, train_loss: 1.1843, test_loss: 1.1727, test_f1: 0.3548
 epoch: 41, train_loss: 1.1860, test_loss: 1.1720, test_f1: 0.3606
 epoch: 42, train_loss: 1.1833, test_loss: 1.1712, test_f1: 0.3707
 epoch: 43, train_loss: 1.1816, test_loss: 1.1688, test_f1: 0.3682
 epoch: 44, train_loss: 1.1778, test_loss: 1.1676, test_f1: 0.3722
 epoch: 45, train_loss: 1.1653, test_loss: 1.1670, test_f1: 0.3681
 epoch: 46, train_loss: 1.1711, test_loss: 1.1633, test_f1: 0.3753
 epoch: 47, train_loss: 1.1739, test_loss: 1.1655, test_f1: 0.3710
 epoch: 48, train_loss: 1.1737, test_loss: 1.1670, test_f1: 0.3703
 epoch: 49, train_loss: 1.1674, test_loss: 1.1638, test_f1: 0.3697
 epoch: 50, train_loss: 1.1636, test_loss: 1.1650, test_f1: 0.3689
 epoch: 51, train_loss: 1.1581, test_loss: 1.1629, test_f1: 0.3679
 epoch: 52, train_loss: 1.1635, test_loss: 1.1600, test_f1: 0.3697
 epoch: 53, train_loss: 1.1584, test_loss: 1.1598, test_f1: 0.3674
 epoch: 54, train_loss: 1.1554, test_loss: 1.1603, test_f1: 0.3687
 epoch: 55, train_loss: 1.1572, test_loss: 1.1601, test_f1: 0.3711
 epoch: 56, train_loss: 1.1555, test_loss: 1.1582, test_f1: 0.3653
 epoch: 57, train_loss: 1.1534, test_loss: 1.1569, test_f1: 0.3721
 epoch: 58, train_loss: 1.1492, test_loss: 1.1590, test_f1: 0.3638
 epoch: 59, train_loss: 1.1543, test_loss: 1.1590, test_f1: 0.3687
 epoch: 60, train_loss: 1.1531, test_loss: 1.1568, test_f1: 0.3680
 epoch: 61, train_loss: 1.1508, test_loss: 1.1567, test_f1: 0.3678
 epoch: 62, train_loss: 1.1455, test_loss: 1.1558, test_f1: 0.3691
 epoch: 63, train_loss: 1.1423, test_loss: 1.1529, test_f1: 0.3697
 epoch: 64, train_loss: 1.1506, test_loss: 1.1514, test_f1: 0.3711
 epoch: 65, train_loss: 1.1407, test_loss: 1.1511, test_f1: 0.3693
 epoch: 66, train_loss: 1.1453, test_loss: 1.1548, test_f1: 0.3770
 epoch: 67, train_loss: 1.1395, test_loss: 1.1495, test_f1: 0.3721
 epoch: 68, train_loss: 1.1387, test_loss: 1.1515, test_f1: 0.3674
 epoch: 69, train_loss: 1.1385, test_loss: 1.1506, test_f1: 0.3732
 epoch: 70, train_loss: 1.1362, test_loss: 1.1527, test_f1: 0.3735
 epoch: 71, train_loss: 1.1364, test_loss: 1.1479, test_f1: 0.3708
 epoch: 72, train_loss: 1.1319, test_loss: 1.1516, test_f1: 0.3705
 epoch: 73, train_loss: 1.1382, test_loss: 1.1518, test_f1: 0.3696
 epoch: 74, train_loss: 1.1323, test_loss: 1.1484, test_f1: 0.3712
 epoch: 75, train_loss: 1.1308, test_loss: 1.1463, test_f1: 0.3672
 epoch: 76, train_loss: 1.1325, test_loss: 1.1456, test_f1: 0.3711
 epoch: 77, train_loss: 1.1377, test_loss: 1.1462, test_f1: 0.3710
 epoch: 78, train_loss: 1.1280, test_loss: 1.1465, test_f1: 0.3703
 epoch: 79, train_loss: 1.1344, test_loss: 1.1495, test_f1: 0.3761
 epoch: 80, train_loss: 1.1331, test_loss: 1.1455, test_f1: 0.3783
 epoch: 81, train_loss: 1.1266, test_loss: 1.1431, test_f1: 0.3704
 epoch: 82, train_loss: 1.1302, test_loss: 1.1443, test_f1: 0.3670
 epoch: 83, train_loss: 1.1249, test_loss: 1.1438, test_f1: 0.3681
 epoch: 84, train_loss: 1.1306, test_loss: 1.1430, test_f1: 0.3714
 epoch: 85, train_loss: 1.1236, test_loss: 1.1476, test_f1: 0.3715
 epoch: 86, train_loss: 1.1208, test_loss: 1.1407, test_f1: 0.3694
 epoch: 87, train_loss: 1.1217, test_loss: 1.1414, test_f1: 0.3677
 epoch: 88, train_loss: 1.1123, test_loss: 1.1404, test_f1: 0.3700
 epoch: 89, train_loss: 1.1221, test_loss: 1.1400, test_f1: 0.3676
 epoch: 90, train_loss: 1.1225, test_loss: 1.1460, test_f1: 0.3718
 epoch: 91, train_loss: 1.1209, test_loss: 1.1424, test_f1: 0.3684
 epoch: 92, train_loss: 1.1157, test_loss: 1.1430, test_f1: 0.3714
 epoch: 93, train_loss: 1.1159, test_loss: 1.1355, test_f1: 0.3730
 epoch: 94, train_loss: 1.1120, test_loss: 1.1367, test_f1: 0.3634
 epoch: 95, train_loss: 1.1136, test_loss: 1.1373, test_f1: 0.3673
 epoch: 96, train_loss: 1.1155, test_loss: 1.1436, test_f1: 0.3748
 epoch: 97, train_loss: 1.1096, test_loss: 1.1388, test_f1: 0.3835
 epoch: 98, train_loss: 1.1192, test_loss: 1.1366, test_f1: 0.3901
 epoch: 99, train_loss: 1.1078, test_loss: 1.1388, test_f1: 0.3863
##################ITERATION #4 ****************************************
 epoch: 0, train_loss: 1.3147, test_loss: 1.3582, test_f1: 0.2274
 epoch: 1, train_loss: 1.3027, test_loss: 1.3405, test_f1: 0.2274
 epoch: 2, train_loss: 1.2957, test_loss: 1.3227, test_f1: 0.2274
 epoch: 3, train_loss: 1.2888, test_loss: 1.3019, test_f1: 0.2276
 epoch: 4, train_loss: 1.2804, test_loss: 1.2832, test_f1: 0.2339
 epoch: 5, train_loss: 1.2733, test_loss: 1.2687, test_f1: 0.2703
 epoch: 6, train_loss: 1.2703, test_loss: 1.2598, test_f1: 0.2786
 epoch: 7, train_loss: 1.2611, test_loss: 1.2543, test_f1: 0.2975
 epoch: 8, train_loss: 1.2582, test_loss: 1.2484, test_f1: 0.2982
 epoch: 9, train_loss: 1.2517, test_loss: 1.2412, test_f1: 0.3031
 epoch: 10, train_loss: 1.2486, test_loss: 1.2363, test_f1: 0.3046
 epoch: 11, train_loss: 1.2473, test_loss: 1.2336, test_f1: 0.3039
 epoch: 12, train_loss: 1.2388, test_loss: 1.2283, test_f1: 0.3047
 epoch: 13, train_loss: 1.2346, test_loss: 1.2265, test_f1: 0.3022
 epoch: 14, train_loss: 1.2266, test_loss: 1.2194, test_f1: 0.3209
 epoch: 15, train_loss: 1.2269, test_loss: 1.2160, test_f1: 0.3209
 epoch: 16, train_loss: 1.2275, test_loss: 1.2103, test_f1: 0.3159
 epoch: 17, train_loss: 1.2221, test_loss: 1.2058, test_f1: 0.3261
 epoch: 18, train_loss: 1.2180, test_loss: 1.2026, test_f1: 0.3312
 epoch: 19, train_loss: 1.2185, test_loss: 1.2009, test_f1: 0.3331
 epoch: 20, train_loss: 1.2124, test_loss: 1.1974, test_f1: 0.3323
 epoch: 21, train_loss: 1.2102, test_loss: 1.1966, test_f1: 0.3290
 epoch: 22, train_loss: 1.2030, test_loss: 1.1938, test_f1: 0.3329
 epoch: 23, train_loss: 1.2071, test_loss: 1.1921, test_f1: 0.3332
 epoch: 24, train_loss: 1.1990, test_loss: 1.1914, test_f1: 0.3375
 epoch: 25, train_loss: 1.2009, test_loss: 1.1905, test_f1: 0.3406
 epoch: 26, train_loss: 1.1927, test_loss: 1.1883, test_f1: 0.3406
 epoch: 27, train_loss: 1.1882, test_loss: 1.1842, test_f1: 0.3388
 epoch: 28, train_loss: 1.1874, test_loss: 1.1806, test_f1: 0.3420
 epoch: 29, train_loss: 1.1875, test_loss: 1.1785, test_f1: 0.3434
 epoch: 30, train_loss: 1.1822, test_loss: 1.1782, test_f1: 0.3419
 epoch: 31, train_loss: 1.1797, test_loss: 1.1753, test_f1: 0.3415
 epoch: 32, train_loss: 1.1705, test_loss: 1.1737, test_f1: 0.3487
 epoch: 33, train_loss: 1.1737, test_loss: 1.1703, test_f1: 0.3507
 epoch: 34, train_loss: 1.1714, test_loss: 1.1689, test_f1: 0.3462
 epoch: 35, train_loss: 1.1715, test_loss: 1.1665, test_f1: 0.3533
 epoch: 36, train_loss: 1.1607, test_loss: 1.1654, test_f1: 0.3611
 epoch: 37, train_loss: 1.1604, test_loss: 1.1649, test_f1: 0.3572
 epoch: 38, train_loss: 1.1569, test_loss: 1.1643, test_f1: 0.3523
 epoch: 39, train_loss: 1.1525, test_loss: 1.1622, test_f1: 0.3652
 epoch: 40, train_loss: 1.1521, test_loss: 1.1594, test_f1: 0.3660
 epoch: 41, train_loss: 1.1444, test_loss: 1.1573, test_f1: 0.3629
 epoch: 42, train_loss: 1.1450, test_loss: 1.1580, test_f1: 0.3701
 epoch: 43, train_loss: 1.1405, test_loss: 1.1594, test_f1: 0.3709
 epoch: 44, train_loss: 1.1362, test_loss: 1.1585, test_f1: 0.3716
 epoch: 45, train_loss: 1.1335, test_loss: 1.1568, test_f1: 0.3772
 epoch: 46, train_loss: 1.1322, test_loss: 1.1553, test_f1: 0.3793
 epoch: 47, train_loss: 1.1349, test_loss: 1.1529, test_f1: 0.3822
 epoch: 48, train_loss: 1.1319, test_loss: 1.1563, test_f1: 0.3967
 epoch: 49, train_loss: 1.1198, test_loss: 1.1527, test_f1: 0.4016
 epoch: 50, train_loss: 1.1247, test_loss: 1.1496, test_f1: 0.4183
 epoch: 51, train_loss: 1.1166, test_loss: 1.1501, test_f1: 0.4135
 epoch: 52, train_loss: 1.1145, test_loss: 1.1515, test_f1: 0.4220
 epoch: 53, train_loss: 1.1140, test_loss: 1.1493, test_f1: 0.4300
 epoch: 54, train_loss: 1.1171, test_loss: 1.1481, test_f1: 0.4284
 epoch: 55, train_loss: 1.1150, test_loss: 1.1513, test_f1: 0.4326
 epoch: 56, train_loss: 1.1223, test_loss: 1.1495, test_f1: 0.4376
 epoch: 57, train_loss: 1.1115, test_loss: 1.1488, test_f1: 0.4436
 epoch: 58, train_loss: 1.1124, test_loss: 1.1519, test_f1: 0.4455
 epoch: 59, train_loss: 1.1072, test_loss: 1.1497, test_f1: 0.4469
 epoch: 60, train_loss: 1.1124, test_loss: 1.1491, test_f1: 0.4431
 epoch: 61, train_loss: 1.1066, test_loss: 1.1481, test_f1: 0.4477
 epoch: 62, train_loss: 1.1043, test_loss: 1.1502, test_f1: 0.4594
 epoch: 63, train_loss: 1.1074, test_loss: 1.1505, test_f1: 0.4476
 epoch: 64, train_loss: 1.1172, test_loss: 1.1449, test_f1: 0.4500
 epoch: 65, train_loss: 1.1057, test_loss: 1.1424, test_f1: 0.4579
 epoch: 66, train_loss: 1.1073, test_loss: 1.1446, test_f1: 0.4559
 epoch: 67, train_loss: 1.1005, test_loss: 1.1436, test_f1: 0.4552
 epoch: 68, train_loss: 1.0991, test_loss: 1.1453, test_f1: 0.4550
 epoch: 69, train_loss: 1.0975, test_loss: 1.1486, test_f1: 0.4610
 epoch: 70, train_loss: 1.0981, test_loss: 1.1505, test_f1: 0.4637
 epoch: 71, train_loss: 1.0958, test_loss: 1.1434, test_f1: 0.4633
 epoch: 72, train_loss: 1.0902, test_loss: 1.1442, test_f1: 0.4612
 epoch: 73, train_loss: 1.0888, test_loss: 1.1425, test_f1: 0.4661
 epoch: 74, train_loss: 1.0897, test_loss: 1.1448, test_f1: 0.4640
 epoch: 75, train_loss: 1.0931, test_loss: 1.1427, test_f1: 0.4732
 epoch: 76, train_loss: 1.0899, test_loss: 1.1455, test_f1: 0.4737
 epoch: 77, train_loss: 1.0932, test_loss: 1.1421, test_f1: 0.4721
 epoch: 78, train_loss: 1.0854, test_loss: 1.1416, test_f1: 0.4738
 epoch: 79, train_loss: 1.0900, test_loss: 1.1405, test_f1: 0.4716
 epoch: 80, train_loss: 1.0926, test_loss: 1.1399, test_f1: 0.4723
 epoch: 81, train_loss: 1.0913, test_loss: 1.1459, test_f1: 0.4736
 epoch: 82, train_loss: 1.0875, test_loss: 1.1412, test_f1: 0.4674
 epoch: 83, train_loss: 1.0867, test_loss: 1.1427, test_f1: 0.4713
 epoch: 84, train_loss: 1.0858, test_loss: 1.1411, test_f1: 0.4664
 epoch: 85, train_loss: 1.0824, test_loss: 1.1421, test_f1: 0.4756
 epoch: 86, train_loss: 1.0710, test_loss: 1.1399, test_f1: 0.4667
 epoch: 87, train_loss: 1.0783, test_loss: 1.1379, test_f1: 0.4719
 epoch: 88, train_loss: 1.0781, test_loss: 1.1386, test_f1: 0.4601
 epoch: 89, train_loss: 1.0763, test_loss: 1.1434, test_f1: 0.4642
 epoch: 90, train_loss: 1.0781, test_loss: 1.1412, test_f1: 0.4688
 epoch: 91, train_loss: 1.0743, test_loss: 1.1432, test_f1: 0.4713
 epoch: 92, train_loss: 1.0760, test_loss: 1.1431, test_f1: 0.4658
 epoch: 93, train_loss: 1.0721, test_loss: 1.1364, test_f1: 0.4767
 epoch: 94, train_loss: 1.0736, test_loss: 1.1338, test_f1: 0.4679
 epoch: 95, train_loss: 1.0756, test_loss: 1.1351, test_f1: 0.4769
 epoch: 96, train_loss: 1.0726, test_loss: 1.1373, test_f1: 0.4695
 epoch: 97, train_loss: 1.0627, test_loss: 1.1375, test_f1: 0.4684
 epoch: 98, train_loss: 1.0679, test_loss: 1.1329, test_f1: 0.4674
 epoch: 99, train_loss: 1.0672, test_loss: 1.1373, test_f1: 0.4762
##################ITERATION #5 ****************************************
 epoch: 0, train_loss: 1.3090, test_loss: 1.3321, test_f1: 0.2274
 epoch: 1, train_loss: 1.2928, test_loss: 1.3231, test_f1: 0.2274
 epoch: 2, train_loss: 1.2854, test_loss: 1.3102, test_f1: 0.2274
 epoch: 3, train_loss: 1.2781, test_loss: 1.2898, test_f1: 0.2269
 epoch: 4, train_loss: 1.2727, test_loss: 1.2701, test_f1: 0.2598
 epoch: 5, train_loss: 1.2653, test_loss: 1.2568, test_f1: 0.2954
 epoch: 6, train_loss: 1.2576, test_loss: 1.2451, test_f1: 0.2970
 epoch: 7, train_loss: 1.2573, test_loss: 1.2372, test_f1: 0.3117
 epoch: 8, train_loss: 1.2521, test_loss: 1.2309, test_f1: 0.3201
 epoch: 9, train_loss: 1.2443, test_loss: 1.2260, test_f1: 0.3148
 epoch: 10, train_loss: 1.2389, test_loss: 1.2185, test_f1: 0.3290
 epoch: 11, train_loss: 1.2289, test_loss: 1.2120, test_f1: 0.3266
 epoch: 12, train_loss: 1.2276, test_loss: 1.2079, test_f1: 0.3271
 epoch: 13, train_loss: 1.2264, test_loss: 1.2023, test_f1: 0.3303
 epoch: 14, train_loss: 1.2220, test_loss: 1.1983, test_f1: 0.3384
 epoch: 15, train_loss: 1.2130, test_loss: 1.1953, test_f1: 0.3375
 epoch: 16, train_loss: 1.2101, test_loss: 1.1887, test_f1: 0.3439
 epoch: 17, train_loss: 1.2067, test_loss: 1.1859, test_f1: 0.3461
 epoch: 18, train_loss: 1.2021, test_loss: 1.1823, test_f1: 0.3475
 epoch: 19, train_loss: 1.2012, test_loss: 1.1786, test_f1: 0.3487
 epoch: 20, train_loss: 1.2026, test_loss: 1.1755, test_f1: 0.3471
 epoch: 21, train_loss: 1.1990, test_loss: 1.1724, test_f1: 0.3458
 epoch: 22, train_loss: 1.1905, test_loss: 1.1718, test_f1: 0.3466
 epoch: 23, train_loss: 1.1848, test_loss: 1.1674, test_f1: 0.3411
 epoch: 24, train_loss: 1.1805, test_loss: 1.1667, test_f1: 0.3523
 epoch: 25, train_loss: 1.1838, test_loss: 1.1625, test_f1: 0.3483
 epoch: 26, train_loss: 1.1804, test_loss: 1.1598, test_f1: 0.3544
 epoch: 27, train_loss: 1.1788, test_loss: 1.1588, test_f1: 0.3523
 epoch: 28, train_loss: 1.1728, test_loss: 1.1526, test_f1: 0.3520
 epoch: 29, train_loss: 1.1784, test_loss: 1.1508, test_f1: 0.3536
 epoch: 30, train_loss: 1.1711, test_loss: 1.1510, test_f1: 0.3530
 epoch: 31, train_loss: 1.1744, test_loss: 1.1470, test_f1: 0.3568
 epoch: 32, train_loss: 1.1644, test_loss: 1.1445, test_f1: 0.3579
 epoch: 33, train_loss: 1.1678, test_loss: 1.1429, test_f1: 0.3560
 epoch: 34, train_loss: 1.1627, test_loss: 1.1433, test_f1: 0.3538
 epoch: 35, train_loss: 1.1600, test_loss: 1.1417, test_f1: 0.3559
 epoch: 36, train_loss: 1.1559, test_loss: 1.1417, test_f1: 0.3514
 epoch: 37, train_loss: 1.1544, test_loss: 1.1363, test_f1: 0.3566
 epoch: 38, train_loss: 1.1650, test_loss: 1.1369, test_f1: 0.3474
 epoch: 39, train_loss: 1.1531, test_loss: 1.1355, test_f1: 0.3607
 epoch: 40, train_loss: 1.1448, test_loss: 1.1319, test_f1: 0.3619
 epoch: 41, train_loss: 1.1516, test_loss: 1.1299, test_f1: 0.3597
 epoch: 42, train_loss: 1.1448, test_loss: 1.1294, test_f1: 0.3486
 epoch: 43, train_loss: 1.1448, test_loss: 1.1259, test_f1: 0.3513
 epoch: 44, train_loss: 1.1466, test_loss: 1.1263, test_f1: 0.3544
 epoch: 45, train_loss: 1.1444, test_loss: 1.1245, test_f1: 0.3474
 epoch: 46, train_loss: 1.1336, test_loss: 1.1238, test_f1: 0.3498
 epoch: 47, train_loss: 1.1416, test_loss: 1.1237, test_f1: 0.3466
 epoch: 48, train_loss: 1.1316, test_loss: 1.1209, test_f1: 0.3531
 epoch: 49, train_loss: 1.1355, test_loss: 1.1191, test_f1: 0.3600
 epoch: 50, train_loss: 1.1345, test_loss: 1.1179, test_f1: 0.3617
 epoch: 51, train_loss: 1.1281, test_loss: 1.1172, test_f1: 0.3580
 epoch: 52, train_loss: 1.1245, test_loss: 1.1165, test_f1: 0.3591
 epoch: 53, train_loss: 1.1288, test_loss: 1.1145, test_f1: 0.3603
 epoch: 54, train_loss: 1.1306, test_loss: 1.1153, test_f1: 0.3644
 epoch: 55, train_loss: 1.1249, test_loss: 1.1131, test_f1: 0.3636
 epoch: 56, train_loss: 1.1174, test_loss: 1.1146, test_f1: 0.3606
 epoch: 57, train_loss: 1.1254, test_loss: 1.1135, test_f1: 0.3660
 epoch: 58, train_loss: 1.1219, test_loss: 1.1117, test_f1: 0.3664
 epoch: 59, train_loss: 1.1207, test_loss: 1.1132, test_f1: 0.3634
 epoch: 60, train_loss: 1.1184, test_loss: 1.1127, test_f1: 0.3805
 epoch: 61, train_loss: 1.1147, test_loss: 1.1113, test_f1: 0.3765
 epoch: 62, train_loss: 1.1181, test_loss: 1.1111, test_f1: 0.3813
 epoch: 63, train_loss: 1.1219, test_loss: 1.1117, test_f1: 0.3892
 epoch: 64, train_loss: 1.1155, test_loss: 1.1096, test_f1: 0.3817
 epoch: 65, train_loss: 1.1046, test_loss: 1.1120, test_f1: 0.3865
 epoch: 66, train_loss: 1.1140, test_loss: 1.1110, test_f1: 0.3800
 epoch: 67, train_loss: 1.1186, test_loss: 1.1085, test_f1: 0.3909
 epoch: 68, train_loss: 1.1122, test_loss: 1.1090, test_f1: 0.3946
 epoch: 69, train_loss: 1.1066, test_loss: 1.1092, test_f1: 0.3836
 epoch: 70, train_loss: 1.1047, test_loss: 1.1074, test_f1: 0.4003
 epoch: 71, train_loss: 1.1064, test_loss: 1.1054, test_f1: 0.3908
 epoch: 72, train_loss: 1.1074, test_loss: 1.1042, test_f1: 0.3905
 epoch: 73, train_loss: 1.1040, test_loss: 1.1059, test_f1: 0.3912
 epoch: 74, train_loss: 1.1138, test_loss: 1.1077, test_f1: 0.4006
 epoch: 75, train_loss: 1.1033, test_loss: 1.1084, test_f1: 0.3934
 epoch: 76, train_loss: 1.1095, test_loss: 1.1044, test_f1: 0.3992
 epoch: 77, train_loss: 1.1006, test_loss: 1.1063, test_f1: 0.4017
 epoch: 78, train_loss: 1.0972, test_loss: 1.1079, test_f1: 0.3990
 epoch: 79, train_loss: 1.1022, test_loss: 1.1029, test_f1: 0.3955
 epoch: 80, train_loss: 1.0969, test_loss: 1.1029, test_f1: 0.4027
 epoch: 81, train_loss: 1.0980, test_loss: 1.1001, test_f1: 0.3964
 epoch: 82, train_loss: 1.0966, test_loss: 1.1015, test_f1: 0.3995
 epoch: 83, train_loss: 1.1007, test_loss: 1.1045, test_f1: 0.3982
 epoch: 84, train_loss: 1.0973, test_loss: 1.1033, test_f1: 0.3990
 epoch: 85, train_loss: 1.0872, test_loss: 1.1029, test_f1: 0.4003
 epoch: 86, train_loss: 1.0944, test_loss: 1.0989, test_f1: 0.4014
 epoch: 87, train_loss: 1.0947, test_loss: 1.0971, test_f1: 0.4099
 epoch: 88, train_loss: 1.0950, test_loss: 1.0967, test_f1: 0.4037
 epoch: 89, train_loss: 1.0848, test_loss: 1.0950, test_f1: 0.4024
 epoch: 90, train_loss: 1.0861, test_loss: 1.0951, test_f1: 0.4047
 epoch: 91, train_loss: 1.0883, test_loss: 1.0969, test_f1: 0.4033
 epoch: 92, train_loss: 1.0861, test_loss: 1.0997, test_f1: 0.4060
 epoch: 93, train_loss: 1.0811, test_loss: 1.0985, test_f1: 0.4055
 epoch: 94, train_loss: 1.0803, test_loss: 1.0986, test_f1: 0.4093
 epoch: 95, train_loss: 1.0869, test_loss: 1.0989, test_f1: 0.4119
 epoch: 96, train_loss: 1.0900, test_loss: 1.0973, test_f1: 0.4112
 epoch: 97, train_loss: 1.0773, test_loss: 1.0964, test_f1: 0.4096
 epoch: 98, train_loss: 1.0877, test_loss: 1.0978, test_f1: 0.4186
 epoch: 99, train_loss: 1.0784, test_loss: 1.0989, test_f1: 0.4100
##################ITERATION #6 ****************************************
 epoch: 0, train_loss: 1.3425, test_loss: 1.3673, test_f1: 0.2274
 epoch: 1, train_loss: 1.3221, test_loss: 1.3510, test_f1: 0.2274
 epoch: 2, train_loss: 1.3145, test_loss: 1.3393, test_f1: 0.2274
 epoch: 3, train_loss: 1.3075, test_loss: 1.3360, test_f1: 0.2274
 epoch: 4, train_loss: 1.2962, test_loss: 1.3152, test_f1: 0.2274
 epoch: 5, train_loss: 1.2888, test_loss: 1.2980, test_f1: 0.2467
 epoch: 6, train_loss: 1.2799, test_loss: 1.2816, test_f1: 0.2694
 epoch: 7, train_loss: 1.2753, test_loss: 1.2724, test_f1: 0.2739
 epoch: 8, train_loss: 1.2666, test_loss: 1.2624, test_f1: 0.2814
 epoch: 9, train_loss: 1.2590, test_loss: 1.2550, test_f1: 0.2902
 epoch: 10, train_loss: 1.2588, test_loss: 1.2487, test_f1: 0.2983
 epoch: 11, train_loss: 1.2548, test_loss: 1.2431, test_f1: 0.3013
 epoch: 12, train_loss: 1.2488, test_loss: 1.2396, test_f1: 0.3128
 epoch: 13, train_loss: 1.2421, test_loss: 1.2361, test_f1: 0.3153
 epoch: 14, train_loss: 1.2412, test_loss: 1.2308, test_f1: 0.3235
 epoch: 15, train_loss: 1.2376, test_loss: 1.2283, test_f1: 0.3387
 epoch: 16, train_loss: 1.2296, test_loss: 1.2239, test_f1: 0.3390
 epoch: 17, train_loss: 1.2270, test_loss: 1.2208, test_f1: 0.3423
 epoch: 18, train_loss: 1.2160, test_loss: 1.2151, test_f1: 0.3363
 epoch: 19, train_loss: 1.2200, test_loss: 1.2113, test_f1: 0.3484
 epoch: 20, train_loss: 1.2191, test_loss: 1.2087, test_f1: 0.3596
 epoch: 21, train_loss: 1.2122, test_loss: 1.2058, test_f1: 0.3664
 epoch: 22, train_loss: 1.2034, test_loss: 1.2032, test_f1: 0.3643
 epoch: 23, train_loss: 1.2091, test_loss: 1.1996, test_f1: 0.3607
 epoch: 24, train_loss: 1.2012, test_loss: 1.1978, test_f1: 0.3633
 epoch: 25, train_loss: 1.1948, test_loss: 1.1950, test_f1: 0.3654
 epoch: 26, train_loss: 1.1987, test_loss: 1.1925, test_f1: 0.3664
 epoch: 27, train_loss: 1.1909, test_loss: 1.1911, test_f1: 0.3649
 epoch: 28, train_loss: 1.1913, test_loss: 1.1884, test_f1: 0.3677
 epoch: 29, train_loss: 1.1929, test_loss: 1.1852, test_f1: 0.3706
 epoch: 30, train_loss: 1.1856, test_loss: 1.1837, test_f1: 0.3698
 epoch: 31, train_loss: 1.1812, test_loss: 1.1805, test_f1: 0.3586
 epoch: 32, train_loss: 1.1843, test_loss: 1.1782, test_f1: 0.3667
 epoch: 33, train_loss: 1.1803, test_loss: 1.1799, test_f1: 0.3650
 epoch: 34, train_loss: 1.1774, test_loss: 1.1786, test_f1: 0.3747
 epoch: 35, train_loss: 1.1770, test_loss: 1.1758, test_f1: 0.3757
 epoch: 36, train_loss: 1.1657, test_loss: 1.1726, test_f1: 0.3808
 epoch: 37, train_loss: 1.1691, test_loss: 1.1722, test_f1: 0.3857
 epoch: 38, train_loss: 1.1728, test_loss: 1.1711, test_f1: 0.3840
 epoch: 39, train_loss: 1.1684, test_loss: 1.1711, test_f1: 0.3829
 epoch: 40, train_loss: 1.1659, test_loss: 1.1717, test_f1: 0.3823
 epoch: 41, train_loss: 1.1604, test_loss: 1.1704, test_f1: 0.3756
 epoch: 42, train_loss: 1.1588, test_loss: 1.1693, test_f1: 0.3744
 epoch: 43, train_loss: 1.1548, test_loss: 1.1666, test_f1: 0.3773
 epoch: 44, train_loss: 1.1533, test_loss: 1.1717, test_f1: 0.3805
 epoch: 45, train_loss: 1.1542, test_loss: 1.1684, test_f1: 0.3792
 epoch: 46, train_loss: 1.1559, test_loss: 1.1684, test_f1: 0.3935
 epoch: 47, train_loss: 1.1507, test_loss: 1.1683, test_f1: 0.4005
 epoch: 48, train_loss: 1.1376, test_loss: 1.1678, test_f1: 0.4083
 epoch: 49, train_loss: 1.1444, test_loss: 1.1639, test_f1: 0.4096
 epoch: 50, train_loss: 1.1383, test_loss: 1.1652, test_f1: 0.4266
 epoch: 51, train_loss: 1.1424, test_loss: 1.1640, test_f1: 0.4305
 epoch: 52, train_loss: 1.1359, test_loss: 1.1662, test_f1: 0.4314
 epoch: 53, train_loss: 1.1396, test_loss: 1.1649, test_f1: 0.4326
 epoch: 54, train_loss: 1.1414, test_loss: 1.1651, test_f1: 0.4377
 epoch: 55, train_loss: 1.1327, test_loss: 1.1673, test_f1: 0.4362
 epoch: 56, train_loss: 1.1280, test_loss: 1.1683, test_f1: 0.4361
 epoch: 57, train_loss: 1.1282, test_loss: 1.1662, test_f1: 0.4443
 epoch: 58, train_loss: 1.1342, test_loss: 1.1661, test_f1: 0.4458
 epoch: 59, train_loss: 1.1294, test_loss: 1.1675, test_f1: 0.4480
 epoch: 60, train_loss: 1.1263, test_loss: 1.1698, test_f1: 0.4414
 epoch: 61, train_loss: 1.1274, test_loss: 1.1692, test_f1: 0.4401
 epoch: 62, train_loss: 1.1310, test_loss: 1.1725, test_f1: 0.4404
 epoch: 63, train_loss: 1.1216, test_loss: 1.1717, test_f1: 0.4463
 epoch: 64, train_loss: 1.1232, test_loss: 1.1682, test_f1: 0.4400
 epoch: 65, train_loss: 1.1173, test_loss: 1.1709, test_f1: 0.4410
 epoch: 66, train_loss: 1.1284, test_loss: 1.1724, test_f1: 0.4362
 epoch: 67, train_loss: 1.1242, test_loss: 1.1714, test_f1: 0.4497
 epoch: 68, train_loss: 1.1230, test_loss: 1.1714, test_f1: 0.4540
 epoch: 69, train_loss: 1.1190, test_loss: 1.1672, test_f1: 0.4445
 epoch: 70, train_loss: 1.1248, test_loss: 1.1712, test_f1: 0.4450
 epoch: 71, train_loss: 1.1194, test_loss: 1.1729, test_f1: 0.4350
 epoch: 72, train_loss: 1.1193, test_loss: 1.1700, test_f1: 0.4321
 epoch: 73, train_loss: 1.1077, test_loss: 1.1711, test_f1: 0.4329
 epoch: 74, train_loss: 1.1062, test_loss: 1.1689, test_f1: 0.4401
 epoch: 75, train_loss: 1.1122, test_loss: 1.1709, test_f1: 0.4360
 epoch: 76, train_loss: 1.1052, test_loss: 1.1762, test_f1: 0.4348
 epoch: 77, train_loss: 1.1119, test_loss: 1.1761, test_f1: 0.4429
 epoch: 78, train_loss: 1.1122, test_loss: 1.1750, test_f1: 0.4461
 epoch: 79, train_loss: 1.1105, test_loss: 1.1774, test_f1: 0.4448
 epoch: 80, train_loss: 1.1035, test_loss: 1.1757, test_f1: 0.4485
 epoch: 81, train_loss: 1.1021, test_loss: 1.1741, test_f1: 0.4423
 epoch: 82, train_loss: 1.1066, test_loss: 1.1775, test_f1: 0.4438
 epoch: 83, train_loss: 1.1095, test_loss: 1.1762, test_f1: 0.4467
 epoch: 84, train_loss: 1.1044, test_loss: 1.1781, test_f1: 0.4474
 epoch: 85, train_loss: 1.1065, test_loss: 1.1778, test_f1: 0.4420
 epoch: 86, train_loss: 1.1001, test_loss: 1.1757, test_f1: 0.4492
 epoch: 87, train_loss: 1.1024, test_loss: 1.1765, test_f1: 0.4439
 epoch: 88, train_loss: 1.1013, test_loss: 1.1802, test_f1: 0.4447
 epoch: 89, train_loss: 1.1033, test_loss: 1.1770, test_f1: 0.4457
 epoch: 90, train_loss: 1.0986, test_loss: 1.1805, test_f1: 0.4410
 epoch: 91, train_loss: 1.1016, test_loss: 1.1834, test_f1: 0.4407
 epoch: 92, train_loss: 1.0924, test_loss: 1.1828, test_f1: 0.4392
 epoch: 93, train_loss: 1.0956, test_loss: 1.1807, test_f1: 0.4382
 epoch: 94, train_loss: 1.0906, test_loss: 1.1800, test_f1: 0.4417
 epoch: 95, train_loss: 1.0971, test_loss: 1.1768, test_f1: 0.4417
 epoch: 96, train_loss: 1.1011, test_loss: 1.1731, test_f1: 0.4401
 epoch: 97, train_loss: 1.0974, test_loss: 1.1769, test_f1: 0.4431
 epoch: 98, train_loss: 1.0910, test_loss: 1.1808, test_f1: 0.4379
 epoch: 99, train_loss: 1.0885, test_loss: 1.1821, test_f1: 0.4378
##################ITERATION #7 ****************************************
 epoch: 0, train_loss: 1.3268, test_loss: 1.3559, test_f1: 0.2274
 epoch: 1, train_loss: 1.3045, test_loss: 1.3426, test_f1: 0.2274
 epoch: 2, train_loss: 1.2998, test_loss: 1.3268, test_f1: 0.2276
 epoch: 3, train_loss: 1.2897, test_loss: 1.3009, test_f1: 0.2382
 epoch: 4, train_loss: 1.2791, test_loss: 1.2816, test_f1: 0.2572
 epoch: 5, train_loss: 1.2724, test_loss: 1.2701, test_f1: 0.2621
 epoch: 6, train_loss: 1.2633, test_loss: 1.2622, test_f1: 0.2529
 epoch: 7, train_loss: 1.2559, test_loss: 1.2536, test_f1: 0.2736
 epoch: 8, train_loss: 1.2536, test_loss: 1.2450, test_f1: 0.2730
 epoch: 9, train_loss: 1.2389, test_loss: 1.2372, test_f1: 0.2734
 epoch: 10, train_loss: 1.2465, test_loss: 1.2322, test_f1: 0.2710
 epoch: 11, train_loss: 1.2352, test_loss: 1.2251, test_f1: 0.2932
 epoch: 12, train_loss: 1.2362, test_loss: 1.2182, test_f1: 0.3168
 epoch: 13, train_loss: 1.2330, test_loss: 1.2146, test_f1: 0.3143
 epoch: 14, train_loss: 1.2227, test_loss: 1.2099, test_f1: 0.3176
 epoch: 15, train_loss: 1.2199, test_loss: 1.2057, test_f1: 0.3418
 epoch: 16, train_loss: 1.2131, test_loss: 1.2023, test_f1: 0.3525
 epoch: 17, train_loss: 1.2139, test_loss: 1.1985, test_f1: 0.3465
 epoch: 18, train_loss: 1.2082, test_loss: 1.1936, test_f1: 0.3424
 epoch: 19, train_loss: 1.2028, test_loss: 1.1887, test_f1: 0.3529
 epoch: 20, train_loss: 1.2061, test_loss: 1.1890, test_f1: 0.3535
 epoch: 21, train_loss: 1.1962, test_loss: 1.1863, test_f1: 0.3469
 epoch: 22, train_loss: 1.1907, test_loss: 1.1832, test_f1: 0.3505
 epoch: 23, train_loss: 1.1909, test_loss: 1.1805, test_f1: 0.3613
 epoch: 24, train_loss: 1.1910, test_loss: 1.1771, test_f1: 0.3738
 epoch: 25, train_loss: 1.1867, test_loss: 1.1725, test_f1: 0.3523
 epoch: 26, train_loss: 1.1874, test_loss: 1.1680, test_f1: 0.3726
 epoch: 27, train_loss: 1.1824, test_loss: 1.1658, test_f1: 0.3605
 epoch: 28, train_loss: 1.1786, test_loss: 1.1668, test_f1: 0.3676
 epoch: 29, train_loss: 1.1747, test_loss: 1.1633, test_f1: 0.3583
 epoch: 30, train_loss: 1.1719, test_loss: 1.1590, test_f1: 0.3591
 epoch: 31, train_loss: 1.1714, test_loss: 1.1598, test_f1: 0.3788
 epoch: 32, train_loss: 1.1715, test_loss: 1.1604, test_f1: 0.3836
 epoch: 33, train_loss: 1.1629, test_loss: 1.1568, test_f1: 0.3831
 epoch: 34, train_loss: 1.1652, test_loss: 1.1545, test_f1: 0.3847
 epoch: 35, train_loss: 1.1681, test_loss: 1.1518, test_f1: 0.3859
 epoch: 36, train_loss: 1.1595, test_loss: 1.1534, test_f1: 0.3857
 epoch: 37, train_loss: 1.1536, test_loss: 1.1525, test_f1: 0.3893
 epoch: 38, train_loss: 1.1651, test_loss: 1.1499, test_f1: 0.3875
 epoch: 39, train_loss: 1.1559, test_loss: 1.1486, test_f1: 0.3777
 epoch: 40, train_loss: 1.1462, test_loss: 1.1435, test_f1: 0.3817
 epoch: 41, train_loss: 1.1521, test_loss: 1.1444, test_f1: 0.3853
 epoch: 42, train_loss: 1.1474, test_loss: 1.1456, test_f1: 0.3812
 epoch: 43, train_loss: 1.1541, test_loss: 1.1431, test_f1: 0.3874
 epoch: 44, train_loss: 1.1545, test_loss: 1.1396, test_f1: 0.3864
 epoch: 45, train_loss: 1.1447, test_loss: 1.1401, test_f1: 0.3723
 epoch: 46, train_loss: 1.1376, test_loss: 1.1374, test_f1: 0.3836
 epoch: 47, train_loss: 1.1363, test_loss: 1.1413, test_f1: 0.3877
 epoch: 48, train_loss: 1.1396, test_loss: 1.1375, test_f1: 0.3979
 epoch: 49, train_loss: 1.1292, test_loss: 1.1391, test_f1: 0.4005
 epoch: 50, train_loss: 1.1265, test_loss: 1.1353, test_f1: 0.3944
 epoch: 51, train_loss: 1.1338, test_loss: 1.1334, test_f1: 0.3857
 epoch: 52, train_loss: 1.1277, test_loss: 1.1327, test_f1: 0.3852
 epoch: 53, train_loss: 1.1295, test_loss: 1.1342, test_f1: 0.3909
 epoch: 54, train_loss: 1.1297, test_loss: 1.1316, test_f1: 0.4007
 epoch: 55, train_loss: 1.1212, test_loss: 1.1299, test_f1: 0.4043
 epoch: 56, train_loss: 1.1276, test_loss: 1.1279, test_f1: 0.3929
 epoch: 57, train_loss: 1.1308, test_loss: 1.1291, test_f1: 0.4016
 epoch: 58, train_loss: 1.1225, test_loss: 1.1295, test_f1: 0.3938
 epoch: 59, train_loss: 1.1164, test_loss: 1.1309, test_f1: 0.4091
 epoch: 60, train_loss: 1.1203, test_loss: 1.1275, test_f1: 0.4146
 epoch: 61, train_loss: 1.1252, test_loss: 1.1258, test_f1: 0.4231
 epoch: 62, train_loss: 1.1231, test_loss: 1.1279, test_f1: 0.4227
 epoch: 63, train_loss: 1.1198, test_loss: 1.1275, test_f1: 0.4322
 epoch: 64, train_loss: 1.1226, test_loss: 1.1281, test_f1: 0.4274
 epoch: 65, train_loss: 1.1108, test_loss: 1.1274, test_f1: 0.4314
 epoch: 66, train_loss: 1.1143, test_loss: 1.1276, test_f1: 0.4353
 epoch: 67, train_loss: 1.1171, test_loss: 1.1243, test_f1: 0.4316
 epoch: 68, train_loss: 1.1164, test_loss: 1.1279, test_f1: 0.4407
 epoch: 69, train_loss: 1.1111, test_loss: 1.1271, test_f1: 0.4402
 epoch: 70, train_loss: 1.1064, test_loss: 1.1265, test_f1: 0.4347
 epoch: 71, train_loss: 1.1105, test_loss: 1.1264, test_f1: 0.4343
 epoch: 72, train_loss: 1.1041, test_loss: 1.1293, test_f1: 0.4366
 epoch: 73, train_loss: 1.1094, test_loss: 1.1279, test_f1: 0.4347
 epoch: 74, train_loss: 1.1040, test_loss: 1.1220, test_f1: 0.4314
 epoch: 75, train_loss: 1.1064, test_loss: 1.1219, test_f1: 0.4372
 epoch: 76, train_loss: 1.1069, test_loss: 1.1201, test_f1: 0.4413
 epoch: 77, train_loss: 1.0998, test_loss: 1.1210, test_f1: 0.4347
 epoch: 78, train_loss: 1.0993, test_loss: 1.1219, test_f1: 0.4373
 epoch: 79, train_loss: 1.1041, test_loss: 1.1199, test_f1: 0.4458
 epoch: 80, train_loss: 1.0983, test_loss: 1.1216, test_f1: 0.4414
 epoch: 81, train_loss: 1.0902, test_loss: 1.1215, test_f1: 0.4398
 epoch: 82, train_loss: 1.0979, test_loss: 1.1200, test_f1: 0.4508
 epoch: 83, train_loss: 1.0993, test_loss: 1.1179, test_f1: 0.4424
 epoch: 84, train_loss: 1.0966, test_loss: 1.1184, test_f1: 0.4449
 epoch: 85, train_loss: 1.0947, test_loss: 1.1204, test_f1: 0.4437
 epoch: 86, train_loss: 1.0983, test_loss: 1.1170, test_f1: 0.4518
 epoch: 87, train_loss: 1.0876, test_loss: 1.1142, test_f1: 0.4480
 epoch: 88, train_loss: 1.1017, test_loss: 1.1124, test_f1: 0.4540
 epoch: 89, train_loss: 1.0956, test_loss: 1.1106, test_f1: 0.4461
 epoch: 90, train_loss: 1.0974, test_loss: 1.1091, test_f1: 0.4472
 epoch: 91, train_loss: 1.0931, test_loss: 1.1131, test_f1: 0.4444
 epoch: 92, train_loss: 1.0945, test_loss: 1.1118, test_f1: 0.4537
 epoch: 93, train_loss: 1.0879, test_loss: 1.1117, test_f1: 0.4436
 epoch: 94, train_loss: 1.0900, test_loss: 1.1131, test_f1: 0.4537
 epoch: 95, train_loss: 1.0810, test_loss: 1.1112, test_f1: 0.4587
 epoch: 96, train_loss: 1.0943, test_loss: 1.1093, test_f1: 0.4373
 epoch: 97, train_loss: 1.0908, test_loss: 1.1125, test_f1: 0.4345
 epoch: 98, train_loss: 1.0900, test_loss: 1.1120, test_f1: 0.4403
 epoch: 99, train_loss: 1.0840, test_loss: 1.1135, test_f1: 0.4300
##################ITERATION #8 ****************************************
 epoch: 0, train_loss: 1.3062, test_loss: 1.3214, test_f1: 0.2274
 epoch: 1, train_loss: 1.2936, test_loss: 1.3073, test_f1: 0.2274
 epoch: 2, train_loss: 1.2866, test_loss: 1.3023, test_f1: 0.2555
 epoch: 3, train_loss: 1.2833, test_loss: 1.2924, test_f1: 0.2276
 epoch: 4, train_loss: 1.2684, test_loss: 1.2770, test_f1: 0.2274
 epoch: 5, train_loss: 1.2666, test_loss: 1.2741, test_f1: 0.2300
 epoch: 6, train_loss: 1.2628, test_loss: 1.2694, test_f1: 0.2285
 epoch: 7, train_loss: 1.2582, test_loss: 1.2619, test_f1: 0.2352
 epoch: 8, train_loss: 1.2497, test_loss: 1.2580, test_f1: 0.2391
 epoch: 9, train_loss: 1.2470, test_loss: 1.2530, test_f1: 0.2525
 epoch: 10, train_loss: 1.2464, test_loss: 1.2499, test_f1: 0.2628
 epoch: 11, train_loss: 1.2430, test_loss: 1.2439, test_f1: 0.2735
 epoch: 12, train_loss: 1.2355, test_loss: 1.2464, test_f1: 0.2808
 epoch: 13, train_loss: 1.2346, test_loss: 1.2399, test_f1: 0.2828
 epoch: 14, train_loss: 1.2299, test_loss: 1.2306, test_f1: 0.2949
 epoch: 15, train_loss: 1.2273, test_loss: 1.2278, test_f1: 0.3092
 epoch: 16, train_loss: 1.2254, test_loss: 1.2291, test_f1: 0.3083
 epoch: 17, train_loss: 1.2202, test_loss: 1.2238, test_f1: 0.3067
 epoch: 18, train_loss: 1.2203, test_loss: 1.2237, test_f1: 0.3143
 epoch: 19, train_loss: 1.2148, test_loss: 1.2222, test_f1: 0.3223
 epoch: 20, train_loss: 1.2141, test_loss: 1.2153, test_f1: 0.3261
 epoch: 21, train_loss: 1.2101, test_loss: 1.2141, test_f1: 0.3324
 epoch: 22, train_loss: 1.2105, test_loss: 1.2094, test_f1: 0.3289
 epoch: 23, train_loss: 1.2064, test_loss: 1.2078, test_f1: 0.3334
 epoch: 24, train_loss: 1.2039, test_loss: 1.2043, test_f1: 0.3360
 epoch: 25, train_loss: 1.2006, test_loss: 1.2044, test_f1: 0.3348
 epoch: 26, train_loss: 1.2014, test_loss: 1.2036, test_f1: 0.3340
 epoch: 27, train_loss: 1.1916, test_loss: 1.2069, test_f1: 0.3299
 epoch: 28, train_loss: 1.1931, test_loss: 1.2016, test_f1: 0.3318
 epoch: 29, train_loss: 1.1881, test_loss: 1.2043, test_f1: 0.3271
 epoch: 30, train_loss: 1.1930, test_loss: 1.2032, test_f1: 0.3302
 epoch: 31, train_loss: 1.1880, test_loss: 1.1940, test_f1: 0.3264
 epoch: 32, train_loss: 1.1795, test_loss: 1.1909, test_f1: 0.3340
 epoch: 33, train_loss: 1.1830, test_loss: 1.1822, test_f1: 0.3318
 epoch: 34, train_loss: 1.1794, test_loss: 1.1856, test_f1: 0.3315
 epoch: 35, train_loss: 1.1776, test_loss: 1.1864, test_f1: 0.3225
 epoch: 36, train_loss: 1.1727, test_loss: 1.1856, test_f1: 0.3363
 epoch: 37, train_loss: 1.1783, test_loss: 1.1862, test_f1: 0.3557
 epoch: 38, train_loss: 1.1713, test_loss: 1.1786, test_f1: 0.3660
 epoch: 39, train_loss: 1.1638, test_loss: 1.1800, test_f1: 0.3774
 epoch: 40, train_loss: 1.1657, test_loss: 1.1782, test_f1: 0.3802
 epoch: 41, train_loss: 1.1557, test_loss: 1.1764, test_f1: 0.3692
 epoch: 42, train_loss: 1.1563, test_loss: 1.1748, test_f1: 0.3747
 epoch: 43, train_loss: 1.1553, test_loss: 1.1739, test_f1: 0.3911
 epoch: 44, train_loss: 1.1564, test_loss: 1.1656, test_f1: 0.3866
 epoch: 45, train_loss: 1.1588, test_loss: 1.1513, test_f1: 0.3895
 epoch: 46, train_loss: 1.1489, test_loss: 1.1650, test_f1: 0.3812
 epoch: 47, train_loss: 1.1482, test_loss: 1.1707, test_f1: 0.3784
 epoch: 48, train_loss: 1.1502, test_loss: 1.1720, test_f1: 0.3799
 epoch: 49, train_loss: 1.1365, test_loss: 1.1754, test_f1: 0.3818
 epoch: 50, train_loss: 1.1360, test_loss: 1.1752, test_f1: 0.3858
 epoch: 51, train_loss: 1.1407, test_loss: 1.1689, test_f1: 0.3785
 epoch: 52, train_loss: 1.1364, test_loss: 1.1701, test_f1: 0.3786
 epoch: 53, train_loss: 1.1313, test_loss: 1.1652, test_f1: 0.3819
 epoch: 54, train_loss: 1.1305, test_loss: 1.1635, test_f1: 0.3924
 epoch: 55, train_loss: 1.1349, test_loss: 1.1786, test_f1: 0.3862
 epoch: 56, train_loss: 1.1284, test_loss: 1.1785, test_f1: 0.3848
 epoch: 57, train_loss: 1.1328, test_loss: 1.1731, test_f1: 0.3843
 epoch: 58, train_loss: 1.1225, test_loss: 1.1641, test_f1: 0.3856
 epoch: 59, train_loss: 1.1214, test_loss: 1.1776, test_f1: 0.3852
 epoch: 60, train_loss: 1.1286, test_loss: 1.1714, test_f1: 0.3896
 epoch: 61, train_loss: 1.1243, test_loss: 1.1721, test_f1: 0.3912
 epoch: 62, train_loss: 1.1256, test_loss: 1.1618, test_f1: 0.3907
 epoch: 63, train_loss: 1.1204, test_loss: 1.1725, test_f1: 0.3904
 epoch: 64, train_loss: 1.1245, test_loss: 1.1797, test_f1: 0.3945
 epoch: 65, train_loss: 1.1166, test_loss: 1.1753, test_f1: 0.3974
 epoch: 66, train_loss: 1.1171, test_loss: 1.1742, test_f1: 0.3841
 epoch: 67, train_loss: 1.1189, test_loss: 1.1668, test_f1: 0.3904
 epoch: 68, train_loss: 1.1174, test_loss: 1.1732, test_f1: 0.3916
 epoch: 69, train_loss: 1.1118, test_loss: 1.1713, test_f1: 0.3909
 epoch: 70, train_loss: 1.1186, test_loss: 1.1689, test_f1: 0.3919
 epoch: 71, train_loss: 1.1120, test_loss: 1.1753, test_f1: 0.3890
 epoch: 72, train_loss: 1.1119, test_loss: 1.1724, test_f1: 0.3939
 epoch: 73, train_loss: 1.1099, test_loss: 1.1654, test_f1: 0.3968
 epoch: 74, train_loss: 1.1085, test_loss: 1.1697, test_f1: 0.3956
 epoch: 75, train_loss: 1.1121, test_loss: 1.1685, test_f1: 0.3962
 epoch: 76, train_loss: 1.1067, test_loss: 1.1770, test_f1: 0.3992
 epoch: 77, train_loss: 1.1001, test_loss: 1.1848, test_f1: 0.4023
 epoch: 78, train_loss: 1.1046, test_loss: 1.1718, test_f1: 0.4053
 epoch: 79, train_loss: 1.0973, test_loss: 1.1779, test_f1: 0.3940
 epoch: 80, train_loss: 1.1067, test_loss: 1.1651, test_f1: 0.4024
 epoch: 81, train_loss: 1.1088, test_loss: 1.1875, test_f1: 0.3990
 epoch: 82, train_loss: 1.1042, test_loss: 1.1910, test_f1: 0.3956
 epoch: 83, train_loss: 1.0909, test_loss: 1.1935, test_f1: 0.4024
 epoch: 84, train_loss: 1.0995, test_loss: 1.2084, test_f1: 0.3959
 epoch: 85, train_loss: 1.0969, test_loss: 1.2084, test_f1: 0.4030
 epoch: 86, train_loss: 1.0944, test_loss: 1.2112, test_f1: 0.3945
 epoch: 87, train_loss: 1.0938, test_loss: 1.2179, test_f1: 0.3951
 epoch: 88, train_loss: 1.0996, test_loss: 1.2150, test_f1: 0.3958
 epoch: 89, train_loss: 1.0879, test_loss: 1.2142, test_f1: 0.3991
 epoch: 90, train_loss: 1.0959, test_loss: 1.1904, test_f1: 0.3998
 epoch: 91, train_loss: 1.0899, test_loss: 1.1825, test_f1: 0.3952
 epoch: 92, train_loss: 1.0874, test_loss: 1.1975, test_f1: 0.4021
 epoch: 93, train_loss: 1.0909, test_loss: 1.1901, test_f1: 0.4087
 epoch: 94, train_loss: 1.0888, test_loss: 1.2015, test_f1: 0.4024
 epoch: 95, train_loss: 1.0806, test_loss: 1.2264, test_f1: 0.4054
 epoch: 96, train_loss: 1.0873, test_loss: 1.1218, test_f1: 0.4070
 epoch: 97, train_loss: 1.0808, test_loss: 1.1599, test_f1: 0.4012
 epoch: 98, train_loss: 1.0792, test_loss: 1.1587, test_f1: 0.4036
 epoch: 99, train_loss: 1.0862, test_loss: 1.1828, test_f1: 0.4139
##################ITERATION #9 ****************************************
 epoch: 0, train_loss: 1.3295, test_loss: 1.3494, test_f1: 0.2274
 epoch: 1, train_loss: 1.3072, test_loss: 1.3342, test_f1: 0.2274
 epoch: 2, train_loss: 1.2964, test_loss: 1.2986, test_f1: 0.2274
 epoch: 3, train_loss: 1.2899, test_loss: 1.2829, test_f1: 0.2300
 epoch: 4, train_loss: 1.2814, test_loss: 1.2747, test_f1: 0.2357
 epoch: 5, train_loss: 1.2726, test_loss: 1.2679, test_f1: 0.2483
 epoch: 6, train_loss: 1.2672, test_loss: 1.2583, test_f1: 0.2756
 epoch: 7, train_loss: 1.2578, test_loss: 1.2475, test_f1: 0.2872
 epoch: 8, train_loss: 1.2500, test_loss: 1.2382, test_f1: 0.2931
 epoch: 9, train_loss: 1.2421, test_loss: 1.2288, test_f1: 0.2992
 epoch: 10, train_loss: 1.2435, test_loss: 1.2219, test_f1: 0.3093
 epoch: 11, train_loss: 1.2336, test_loss: 1.2186, test_f1: 0.3060
 epoch: 12, train_loss: 1.2264, test_loss: 1.2140, test_f1: 0.3104
 epoch: 13, train_loss: 1.2271, test_loss: 1.2061, test_f1: 0.3117
 epoch: 14, train_loss: 1.2226, test_loss: 1.2030, test_f1: 0.3059
 epoch: 15, train_loss: 1.2233, test_loss: 1.1991, test_f1: 0.3122
 epoch: 16, train_loss: 1.2163, test_loss: 1.1963, test_f1: 0.3095
 epoch: 17, train_loss: 1.2126, test_loss: 1.1898, test_f1: 0.3095
 epoch: 18, train_loss: 1.2059, test_loss: 1.1870, test_f1: 0.3101
 epoch: 19, train_loss: 1.2033, test_loss: 1.1821, test_f1: 0.3111
 epoch: 20, train_loss: 1.1985, test_loss: 1.1803, test_f1: 0.3199
 epoch: 21, train_loss: 1.2049, test_loss: 1.1761, test_f1: 0.3268
 epoch: 22, train_loss: 1.1972, test_loss: 1.1716, test_f1: 0.3258
 epoch: 23, train_loss: 1.1937, test_loss: 1.1683, test_f1: 0.3263
 epoch: 24, train_loss: 1.1825, test_loss: 1.1670, test_f1: 0.3410
 epoch: 25, train_loss: 1.1874, test_loss: 1.1642, test_f1: 0.3417
 epoch: 26, train_loss: 1.1847, test_loss: 1.1622, test_f1: 0.3434
 epoch: 27, train_loss: 1.1855, test_loss: 1.1603, test_f1: 0.3437
 epoch: 28, train_loss: 1.1791, test_loss: 1.1580, test_f1: 0.3355
 epoch: 29, train_loss: 1.1766, test_loss: 1.1557, test_f1: 0.3390
 epoch: 30, train_loss: 1.1704, test_loss: 1.1499, test_f1: 0.3519
 epoch: 31, train_loss: 1.1729, test_loss: 1.1485, test_f1: 0.3457
 epoch: 32, train_loss: 1.1721, test_loss: 1.1474, test_f1: 0.3445
 epoch: 33, train_loss: 1.1640, test_loss: 1.1439, test_f1: 0.3492
 epoch: 34, train_loss: 1.1631, test_loss: 1.1455, test_f1: 0.3485
 epoch: 35, train_loss: 1.1592, test_loss: 1.1409, test_f1: 0.3523
 epoch: 36, train_loss: 1.1574, test_loss: 1.1416, test_f1: 0.3420
 epoch: 37, train_loss: 1.1578, test_loss: 1.1393, test_f1: 0.3486
 epoch: 38, train_loss: 1.1590, test_loss: 1.1384, test_f1: 0.3501
 epoch: 39, train_loss: 1.1497, test_loss: 1.1376, test_f1: 0.3519
 epoch: 40, train_loss: 1.1492, test_loss: 1.1353, test_f1: 0.3468
 epoch: 41, train_loss: 1.1488, test_loss: 1.1347, test_f1: 0.3421
 epoch: 42, train_loss: 1.1513, test_loss: 1.1306, test_f1: 0.3509
 epoch: 43, train_loss: 1.1391, test_loss: 1.1293, test_f1: 0.3578
 epoch: 44, train_loss: 1.1485, test_loss: 1.1305, test_f1: 0.3588
 epoch: 45, train_loss: 1.1340, test_loss: 1.1283, test_f1: 0.3625
 epoch: 46, train_loss: 1.1375, test_loss: 1.1274, test_f1: 0.3747
 epoch: 47, train_loss: 1.1399, test_loss: 1.1273, test_f1: 0.3757
 epoch: 48, train_loss: 1.1333, test_loss: 1.1243, test_f1: 0.3708
 epoch: 49, train_loss: 1.1338, test_loss: 1.1227, test_f1: 0.3708
 epoch: 50, train_loss: 1.1271, test_loss: 1.1188, test_f1: 0.3736
 epoch: 51, train_loss: 1.1288, test_loss: 1.1192, test_f1: 0.3832
 epoch: 52, train_loss: 1.1291, test_loss: 1.1190, test_f1: 0.3806
 epoch: 53, train_loss: 1.1239, test_loss: 1.1171, test_f1: 0.3912
 epoch: 54, train_loss: 1.1238, test_loss: 1.1170, test_f1: 0.3961
 epoch: 55, train_loss: 1.1190, test_loss: 1.1182, test_f1: 0.3930
 epoch: 56, train_loss: 1.1181, test_loss: 1.1166, test_f1: 0.3997
 epoch: 57, train_loss: 1.1221, test_loss: 1.1137, test_f1: 0.4010
 epoch: 58, train_loss: 1.1172, test_loss: 1.1147, test_f1: 0.4014
 epoch: 59, train_loss: 1.1201, test_loss: 1.1146, test_f1: 0.3996
 epoch: 60, train_loss: 1.1218, test_loss: 1.1127, test_f1: 0.3989
 epoch: 61, train_loss: 1.1210, test_loss: 1.1159, test_f1: 0.4033
 epoch: 62, train_loss: 1.1165, test_loss: 1.1125, test_f1: 0.4016
 epoch: 63, train_loss: 1.1260, test_loss: 1.1154, test_f1: 0.4034
 epoch: 64, train_loss: 1.1189, test_loss: 1.1140, test_f1: 0.4036
 epoch: 65, train_loss: 1.1137, test_loss: 1.1123, test_f1: 0.4064
 epoch: 66, train_loss: 1.1065, test_loss: 1.1112, test_f1: 0.4101
 epoch: 67, train_loss: 1.1147, test_loss: 1.1098, test_f1: 0.4054
 epoch: 68, train_loss: 1.1072, test_loss: 1.1095, test_f1: 0.4084
 epoch: 69, train_loss: 1.1094, test_loss: 1.1088, test_f1: 0.4094
 epoch: 70, train_loss: 1.1123, test_loss: 1.1077, test_f1: 0.4127
 epoch: 71, train_loss: 1.1031, test_loss: 1.1058, test_f1: 0.4141
 epoch: 72, train_loss: 1.1078, test_loss: 1.1079, test_f1: 0.4062
 epoch: 73, train_loss: 1.1005, test_loss: 1.1077, test_f1: 0.4072
 epoch: 74, train_loss: 1.0964, test_loss: 1.1054, test_f1: 0.4066
 epoch: 75, train_loss: 1.0902, test_loss: 1.1065, test_f1: 0.4092
 epoch: 76, train_loss: 1.0967, test_loss: 1.1069, test_f1: 0.4080
 epoch: 77, train_loss: 1.0997, test_loss: 1.1051, test_f1: 0.4153
 epoch: 78, train_loss: 1.0946, test_loss: 1.1028, test_f1: 0.4148
 epoch: 79, train_loss: 1.0986, test_loss: 1.1016, test_f1: 0.4170
 epoch: 80, train_loss: 1.0942, test_loss: 1.1018, test_f1: 0.4198
 epoch: 81, train_loss: 1.0963, test_loss: 1.0991, test_f1: 0.4188
 epoch: 82, train_loss: 1.0966, test_loss: 1.1020, test_f1: 0.4093
 epoch: 83, train_loss: 1.0927, test_loss: 1.1004, test_f1: 0.4125
 epoch: 84, train_loss: 1.0909, test_loss: 1.1005, test_f1: 0.4127
 epoch: 85, train_loss: 1.0939, test_loss: 1.1000, test_f1: 0.4169
 epoch: 86, train_loss: 1.0930, test_loss: 1.1017, test_f1: 0.4096
 epoch: 87, train_loss: 1.0877, test_loss: 1.1003, test_f1: 0.4148
 epoch: 88, train_loss: 1.0938, test_loss: 1.0988, test_f1: 0.4204
 epoch: 89, train_loss: 1.0947, test_loss: 1.0976, test_f1: 0.4167
 epoch: 90, train_loss: 1.0882, test_loss: 1.0984, test_f1: 0.4220
 epoch: 91, train_loss: 1.0852, test_loss: 1.0979, test_f1: 0.4186
 epoch: 92, train_loss: 1.0811, test_loss: 1.0964, test_f1: 0.4225
 epoch: 93, train_loss: 1.0923, test_loss: 1.0956, test_f1: 0.4139
 epoch: 94, train_loss: 1.0822, test_loss: 1.0951, test_f1: 0.4134
 epoch: 95, train_loss: 1.0800, test_loss: 1.0908, test_f1: 0.4244
 epoch: 96, train_loss: 1.0846, test_loss: 1.0913, test_f1: 0.4226
 epoch: 97, train_loss: 1.0792, test_loss: 1.0891, test_f1: 0.4310
 epoch: 98, train_loss: 1.0799, test_loss: 1.0908, test_f1: 0.4217
 epoch: 99, train_loss: 1.0766, test_loss: 1.0945, test_f1: 0.4214

Training completed in 420.41 seconds
Best F1: 0.4769 at epoch 95
Mean F1 across iterations: 0.4173  0.0367
========================FINAL RESULTS================================
FEGIN weighted F1: 0.4769  0.0367
python main.py --data ltspice_examples --representation component_component --model FEGIN --layers 6 --hiddens 32 --batch_size 256 --lr 0.0001 --emb_size 250 --epochs 100 --save_appendix component_component_L6_H32_BS256_LR0.0001_E250 --no_val
-----



STDERR:
  File "main.py", line 370, in <module>
    main()
  File "main.py", line 254, in main
    dataset = dataset_class(
  File "/home/philip/projects/ltspice_examples_code_repo/Circuit-Completion-Using-GNNs/component_classification_with_link_prediction_head/evaluation/FEGIN/kernel/circuit_datasets.py", line 15, in __init__
    self.data, self.slices = torch.load(self.processed_paths[0])
  File "/home/philip/.local/lib/python3.8/site-packages/torch/serialization.py", line 1040, in load
    warnings.warn(
  File "/usr/lib/python3.8/warnings.py", line 109, in _showwarnmsg
    sw(msg.message, msg.category, msg.filename, msg.lineno,
  File "main.py", line 47, in warn_with_traceback
    traceback.print_stack(file=log)
/home/philip/projects/ltspice_examples_code_repo/Circuit-Completion-Using-GNNs/component_classification_with_link_prediction_head/evaluation/FEGIN/kernel/circuit_datasets.py:15: FutureWarning: You are using `torch.load` with `weights_only=False` (the current default value), which uses the default pickle module implicitly. It is possible to construct malicious pickle data which will execute arbitrary code during unpickling (See https://github.com/pytorch/pytorch/blob/main/SECURITY.md#untrusted-models for more details). In a future release, the default value for `weights_only` will be flipped to `True`. This limits the functions that could be executed during unpickling. Arbitrary objects will no longer be allowed to be loaded via this mode unless they are explicitly allowlisted by the user via `torch.serialization.add_safe_globals`. We recommend you start setting `weights_only=True` for any use case where you don't have full control of the loaded file. Please open an issue on GitHub for any issues related to this experimental feature.
  self.data, self.slices = torch.load(self.processed_paths[0])
