STDOUT:
Results will be saved in /home/philip/projects/ltspice_examples_code_repo/Circuit-Completion-Using-GNNs/component_classification_with_link_prediction_head/evaluation/FEGIN/results/model_FEGIN_dataset_ltspice_examples
Command line input: python main.py --data ltspice_examples --representation component_net --model FEGIN --layers 4 --hiddens 32 --batch_size 32 --lr 0.01 --emb_size 128 --epochs 100 --save_appendix component_net_L4_H32_BS32_LR0.01_E128 --no_val
 is saved.
-----
ltspice_examples - FEGIN
Using 4 layers, 32 hidden units, h = 2
Loading component_net representation dataset
ENTERED
Training FEGIN on component_net representation
Train: 3558, Test: 846
##################ITERATION #0 ****************************************
 epoch: 0, train_loss: 1.1836, test_loss: 1.0630, test_f1: 0.4145
 epoch: 1, train_loss: 1.0552, test_loss: 1.0379, test_f1: 0.4963
 epoch: 2, train_loss: 1.0232, test_loss: 1.1390, test_f1: 0.4492
 epoch: 3, train_loss: 1.0042, test_loss: 1.0547, test_f1: 0.4564
 epoch: 4, train_loss: 0.9974, test_loss: 1.0665, test_f1: 0.4561
 epoch: 5, train_loss: 0.9998, test_loss: 1.0235, test_f1: 0.4773
 epoch: 6, train_loss: 0.9901, test_loss: 1.0167, test_f1: 0.4834
 epoch: 7, train_loss: 0.9795, test_loss: 1.0644, test_f1: 0.4716
 epoch: 8, train_loss: 0.9791, test_loss: 0.9854, test_f1: 0.4924
 epoch: 9, train_loss: 0.9628, test_loss: 1.0338, test_f1: 0.4861
 epoch: 10, train_loss: 0.9633, test_loss: 0.9781, test_f1: 0.4911
 epoch: 11, train_loss: 0.9532, test_loss: 1.0414, test_f1: 0.4751
 epoch: 12, train_loss: 0.9468, test_loss: 1.0239, test_f1: 0.5341
 epoch: 13, train_loss: 0.9539, test_loss: 1.0274, test_f1: 0.5117
 epoch: 14, train_loss: 0.9482, test_loss: 0.9919, test_f1: 0.5063
 epoch: 15, train_loss: 0.9461, test_loss: 0.9535, test_f1: 0.5002
 epoch: 16, train_loss: 0.9391, test_loss: 0.9605, test_f1: 0.4989
 epoch: 17, train_loss: 0.9342, test_loss: 0.9441, test_f1: 0.5394
 epoch: 18, train_loss: 0.9281, test_loss: 1.0323, test_f1: 0.5085
 epoch: 19, train_loss: 0.9222, test_loss: 0.9813, test_f1: 0.5049
 epoch: 20, train_loss: 0.9306, test_loss: 0.9476, test_f1: 0.4954
 epoch: 21, train_loss: 0.9122, test_loss: 0.9461, test_f1: 0.4971
 epoch: 22, train_loss: 0.9122, test_loss: 1.0147, test_f1: 0.4902
 epoch: 23, train_loss: 0.9092, test_loss: 0.9801, test_f1: 0.4983
 epoch: 24, train_loss: 0.9050, test_loss: 1.0062, test_f1: 0.5164
 epoch: 25, train_loss: 0.9157, test_loss: 0.9604, test_f1: 0.5151
 epoch: 26, train_loss: 0.9166, test_loss: 0.9862, test_f1: 0.5005
 epoch: 27, train_loss: 0.9016, test_loss: 1.0286, test_f1: 0.5030
 epoch: 28, train_loss: 0.9036, test_loss: 0.9933, test_f1: 0.5086
 epoch: 29, train_loss: 0.8980, test_loss: 0.9352, test_f1: 0.5013
 epoch: 30, train_loss: 0.9049, test_loss: 0.9176, test_f1: 0.4968
 epoch: 31, train_loss: 0.8885, test_loss: 1.0164, test_f1: 0.5055
 epoch: 32, train_loss: 0.8866, test_loss: 0.9839, test_f1: 0.5015
 epoch: 33, train_loss: 0.8795, test_loss: 0.9500, test_f1: 0.5056
 epoch: 34, train_loss: 0.8902, test_loss: 0.9337, test_f1: 0.5054
 epoch: 35, train_loss: 0.8788, test_loss: 1.0057, test_f1: 0.5380
 epoch: 36, train_loss: 0.8879, test_loss: 1.0275, test_f1: 0.5354
 epoch: 37, train_loss: 0.8632, test_loss: 1.0235, test_f1: 0.4981
 epoch: 38, train_loss: 0.8820, test_loss: 0.9290, test_f1: 0.5546
 epoch: 39, train_loss: 0.8763, test_loss: 0.9519, test_f1: 0.5444
 epoch: 40, train_loss: 0.9516, test_loss: 1.0148, test_f1: 0.4573
 epoch: 41, train_loss: 0.9243, test_loss: 0.9650, test_f1: 0.4948
 epoch: 42, train_loss: 0.9182, test_loss: 0.9492, test_f1: 0.4939
 epoch: 43, train_loss: 0.8918, test_loss: 0.9695, test_f1: 0.4890
 epoch: 44, train_loss: 0.8873, test_loss: 0.9312, test_f1: 0.4967
 epoch: 45, train_loss: 0.8668, test_loss: 0.9290, test_f1: 0.5567
 epoch: 46, train_loss: 0.8670, test_loss: 0.9978, test_f1: 0.5448
 epoch: 47, train_loss: 0.8652, test_loss: 0.9660, test_f1: 0.5265
 epoch: 48, train_loss: 0.8562, test_loss: 1.0204, test_f1: 0.5590
 epoch: 49, train_loss: 0.8491, test_loss: 1.0067, test_f1: 0.5059
 epoch: 50, train_loss: 0.8464, test_loss: 0.8731, test_f1: 0.5322
 epoch: 51, train_loss: 0.8160, test_loss: 0.9364, test_f1: 0.5533
 epoch: 52, train_loss: 0.8207, test_loss: 0.9280, test_f1: 0.5629
 epoch: 53, train_loss: 0.8076, test_loss: 0.9802, test_f1: 0.5430
 epoch: 54, train_loss: 0.8080, test_loss: 0.9769, test_f1: 0.5494
 epoch: 55, train_loss: 0.8008, test_loss: 0.9930, test_f1: 0.5861
 epoch: 56, train_loss: 0.8017, test_loss: 0.9780, test_f1: 0.5778
 epoch: 57, train_loss: 0.8064, test_loss: 0.9686, test_f1: 0.5943
 epoch: 58, train_loss: 0.7967, test_loss: 0.9240, test_f1: 0.6024
 epoch: 59, train_loss: 0.7793, test_loss: 0.9904, test_f1: 0.5329
 epoch: 60, train_loss: 0.7875, test_loss: 0.9488, test_f1: 0.5824
 epoch: 61, train_loss: 0.7881, test_loss: 0.9413, test_f1: 0.5498
 epoch: 62, train_loss: 0.7844, test_loss: 0.9016, test_f1: 0.5695
 epoch: 63, train_loss: 0.7682, test_loss: 0.9094, test_f1: 0.6196
 epoch: 64, train_loss: 0.7786, test_loss: 0.9628, test_f1: 0.5934
 epoch: 65, train_loss: 0.7849, test_loss: 0.9349, test_f1: 0.5580
 epoch: 66, train_loss: 0.7820, test_loss: 0.9444, test_f1: 0.5482
 epoch: 67, train_loss: 0.7749, test_loss: 0.9126, test_f1: 0.5529
 epoch: 68, train_loss: 0.7641, test_loss: 0.8890, test_f1: 0.6045
 epoch: 69, train_loss: 0.7748, test_loss: 0.9589, test_f1: 0.5931
 epoch: 70, train_loss: 0.7589, test_loss: 0.8747, test_f1: 0.6321
 epoch: 71, train_loss: 0.7551, test_loss: 0.9052, test_f1: 0.5860
 epoch: 72, train_loss: 0.7546, test_loss: 0.9541, test_f1: 0.5682
 epoch: 73, train_loss: 0.7562, test_loss: 0.9179, test_f1: 0.5838
 epoch: 74, train_loss: 0.7586, test_loss: 0.9421, test_f1: 0.5735
 epoch: 75, train_loss: 0.7620, test_loss: 0.9897, test_f1: 0.5992
 epoch: 76, train_loss: 0.7464, test_loss: 0.9103, test_f1: 0.5787
 epoch: 77, train_loss: 0.7490, test_loss: 0.9865, test_f1: 0.5725
 epoch: 78, train_loss: 0.7504, test_loss: 0.9360, test_f1: 0.5905
 epoch: 79, train_loss: 0.7378, test_loss: 0.9766, test_f1: 0.6194
 epoch: 80, train_loss: 0.7551, test_loss: 0.9827, test_f1: 0.6028
 epoch: 81, train_loss: 0.7455, test_loss: 0.9366, test_f1: 0.6491
 epoch: 82, train_loss: 0.7381, test_loss: 0.9739, test_f1: 0.5947
 epoch: 83, train_loss: 0.7357, test_loss: 0.9686, test_f1: 0.6270
 epoch: 84, train_loss: 0.7596, test_loss: 0.8915, test_f1: 0.5909
 epoch: 85, train_loss: 0.7387, test_loss: 0.9316, test_f1: 0.5819
 epoch: 86, train_loss: 0.7506, test_loss: 0.8998, test_f1: 0.5963
 epoch: 87, train_loss: 0.7330, test_loss: 0.9648, test_f1: 0.5802
 epoch: 88, train_loss: 0.7303, test_loss: 0.9681, test_f1: 0.6387
 epoch: 89, train_loss: 0.7356, test_loss: 0.9662, test_f1: 0.5960
 epoch: 90, train_loss: 0.7348, test_loss: 0.9588, test_f1: 0.5939
 epoch: 91, train_loss: 0.7267, test_loss: 0.9580, test_f1: 0.5760
 epoch: 92, train_loss: 0.7283, test_loss: 0.9270, test_f1: 0.6346
 epoch: 93, train_loss: 0.7323, test_loss: 0.9344, test_f1: 0.5827
 epoch: 94, train_loss: 0.7072, test_loss: 0.9331, test_f1: 0.6247
 epoch: 95, train_loss: 0.7157, test_loss: 0.9068, test_f1: 0.5817
 epoch: 96, train_loss: 0.7256, test_loss: 0.9717, test_f1: 0.6403
 epoch: 97, train_loss: 0.7127, test_loss: 0.9572, test_f1: 0.6137
 epoch: 98, train_loss: 0.7502, test_loss: 0.9311, test_f1: 0.6261
 epoch: 99, train_loss: 0.7142, test_loss: 0.9957, test_f1: 0.6251
##################ITERATION #1 ****************************************
 epoch: 0, train_loss: 1.1741, test_loss: 1.0830, test_f1: 0.3495
 epoch: 1, train_loss: 1.0558, test_loss: 1.0329, test_f1: 0.4110
 epoch: 2, train_loss: 1.0103, test_loss: 1.0106, test_f1: 0.4430
 epoch: 3, train_loss: 1.0114, test_loss: 1.0982, test_f1: 0.4827
 epoch: 4, train_loss: 1.0073, test_loss: 1.0262, test_f1: 0.4044
 epoch: 5, train_loss: 0.9949, test_loss: 0.9935, test_f1: 0.4567
 epoch: 6, train_loss: 0.9912, test_loss: 0.9535, test_f1: 0.5210
 epoch: 7, train_loss: 0.9661, test_loss: 0.9591, test_f1: 0.4693
 epoch: 8, train_loss: 0.9803, test_loss: 1.0097, test_f1: 0.4795
 epoch: 9, train_loss: 0.9640, test_loss: 0.9321, test_f1: 0.4947
 epoch: 10, train_loss: 0.9620, test_loss: 1.0649, test_f1: 0.4489
 epoch: 11, train_loss: 0.9579, test_loss: 1.0409, test_f1: 0.4774
 epoch: 12, train_loss: 0.9538, test_loss: 0.9921, test_f1: 0.4912
 epoch: 13, train_loss: 0.9417, test_loss: 1.1053, test_f1: 0.4814
 epoch: 14, train_loss: 0.9351, test_loss: 1.0752, test_f1: 0.5333
 epoch: 15, train_loss: 0.9361, test_loss: 1.0152, test_f1: 0.4883
 epoch: 16, train_loss: 0.9544, test_loss: 0.9723, test_f1: 0.4886
 epoch: 17, train_loss: 0.9356, test_loss: 0.9810, test_f1: 0.5201
 epoch: 18, train_loss: 0.9224, test_loss: 0.9912, test_f1: 0.4884
 epoch: 19, train_loss: 0.9158, test_loss: 0.9640, test_f1: 0.4887
 epoch: 20, train_loss: 0.9188, test_loss: 1.0426, test_f1: 0.4757
 epoch: 21, train_loss: 0.9271, test_loss: 0.9618, test_f1: 0.5038
 epoch: 22, train_loss: 0.9077, test_loss: 0.9391, test_f1: 0.5249
 epoch: 23, train_loss: 0.9100, test_loss: 0.9118, test_f1: 0.5067
 epoch: 24, train_loss: 0.9126, test_loss: 0.9166, test_f1: 0.5282
 epoch: 25, train_loss: 0.8868, test_loss: 0.9968, test_f1: 0.5099
 epoch: 26, train_loss: 0.9039, test_loss: 0.9773, test_f1: 0.5068
 epoch: 27, train_loss: 0.8902, test_loss: 0.9880, test_f1: 0.5192
 epoch: 28, train_loss: 0.8890, test_loss: 0.9214, test_f1: 0.5321
 epoch: 29, train_loss: 0.8814, test_loss: 0.9519, test_f1: 0.5105
 epoch: 30, train_loss: 0.8828, test_loss: 0.8992, test_f1: 0.5771
 epoch: 31, train_loss: 0.8683, test_loss: 1.0135, test_f1: 0.5436
 epoch: 32, train_loss: 0.8900, test_loss: 0.9221, test_f1: 0.5117
 epoch: 33, train_loss: 0.8727, test_loss: 0.9676, test_f1: 0.5549
 epoch: 34, train_loss: 0.8687, test_loss: 0.9491, test_f1: 0.5286
 epoch: 35, train_loss: 0.8947, test_loss: 0.9831, test_f1: 0.5125
 epoch: 36, train_loss: 0.8716, test_loss: 0.9921, test_f1: 0.5863
 epoch: 37, train_loss: 0.8732, test_loss: 1.0244, test_f1: 0.5303
 epoch: 38, train_loss: 0.8652, test_loss: 0.9476, test_f1: 0.5601
 epoch: 39, train_loss: 0.8577, test_loss: 0.9489, test_f1: 0.5849
 epoch: 40, train_loss: 0.8645, test_loss: 0.9889, test_f1: 0.5682
 epoch: 41, train_loss: 0.8432, test_loss: 0.9545, test_f1: 0.5694
 epoch: 42, train_loss: 0.9002, test_loss: 0.9175, test_f1: 0.5362
 epoch: 43, train_loss: 0.8814, test_loss: 0.9017, test_f1: 0.5532
 epoch: 44, train_loss: 0.8536, test_loss: 0.8985, test_f1: 0.5855
 epoch: 45, train_loss: 0.8540, test_loss: 0.8904, test_f1: 0.5268
 epoch: 46, train_loss: 0.8593, test_loss: 0.9464, test_f1: 0.5320
 epoch: 47, train_loss: 0.8499, test_loss: 0.9701, test_f1: 0.5686
 epoch: 48, train_loss: 0.8464, test_loss: 0.9474, test_f1: 0.5566
 epoch: 49, train_loss: 0.8488, test_loss: 0.9607, test_f1: 0.5932
 epoch: 50, train_loss: 0.8462, test_loss: 1.1978, test_f1: 0.3816
 epoch: 51, train_loss: 0.9041, test_loss: 0.9234, test_f1: 0.5362
 epoch: 52, train_loss: 0.8602, test_loss: 0.9230, test_f1: 0.5533
 epoch: 53, train_loss: 0.8510, test_loss: 0.9349, test_f1: 0.5492
 epoch: 54, train_loss: 0.8277, test_loss: 0.9431, test_f1: 0.5773
 epoch: 55, train_loss: 0.8288, test_loss: 0.9477, test_f1: 0.5443
 epoch: 56, train_loss: 0.8155, test_loss: 0.9224, test_f1: 0.5560
 epoch: 57, train_loss: 0.7969, test_loss: 1.0093, test_f1: 0.5504
 epoch: 58, train_loss: 0.8037, test_loss: 0.9405, test_f1: 0.5709
 epoch: 59, train_loss: 0.8067, test_loss: 0.9284, test_f1: 0.5673
 epoch: 60, train_loss: 0.7926, test_loss: 0.9198, test_f1: 0.5841
 epoch: 61, train_loss: 0.7808, test_loss: 0.9373, test_f1: 0.5968
 epoch: 62, train_loss: 0.7887, test_loss: 0.9287, test_f1: 0.5737
 epoch: 63, train_loss: 0.7908, test_loss: 0.9772, test_f1: 0.5627
 epoch: 64, train_loss: 0.7791, test_loss: 0.9848, test_f1: 0.5776
 epoch: 65, train_loss: 0.7720, test_loss: 0.9939, test_f1: 0.5884
 epoch: 66, train_loss: 0.7801, test_loss: 1.0001, test_f1: 0.5679
 epoch: 67, train_loss: 0.7777, test_loss: 1.0140, test_f1: 0.5763
 epoch: 68, train_loss: 0.7684, test_loss: 0.9329, test_f1: 0.6108
 epoch: 69, train_loss: 0.7755, test_loss: 0.9873, test_f1: 0.5648
 epoch: 70, train_loss: 0.7668, test_loss: 0.9476, test_f1: 0.5854
 epoch: 71, train_loss: 0.7767, test_loss: 0.9533, test_f1: 0.5990
 epoch: 72, train_loss: 0.7686, test_loss: 0.9847, test_f1: 0.5767
 epoch: 73, train_loss: 0.7722, test_loss: 0.9948, test_f1: 0.6107
 epoch: 74, train_loss: 0.7550, test_loss: 0.9720, test_f1: 0.5882
 epoch: 75, train_loss: 0.7593, test_loss: 0.9396, test_f1: 0.6121
 epoch: 76, train_loss: 0.7520, test_loss: 0.9398, test_f1: 0.5875
 epoch: 77, train_loss: 0.7552, test_loss: 1.0673, test_f1: 0.5812
 epoch: 78, train_loss: 0.7609, test_loss: 1.0694, test_f1: 0.5694
 epoch: 79, train_loss: 0.7510, test_loss: 1.0482, test_f1: 0.6310
 epoch: 80, train_loss: 0.7449, test_loss: 1.0697, test_f1: 0.6129
 epoch: 81, train_loss: 0.7411, test_loss: 0.9603, test_f1: 0.6211
 epoch: 82, train_loss: 0.7506, test_loss: 1.0893, test_f1: 0.5791
 epoch: 83, train_loss: 0.7385, test_loss: 1.0271, test_f1: 0.6035
 epoch: 84, train_loss: 0.7438, test_loss: 1.0905, test_f1: 0.5913
 epoch: 85, train_loss: 0.7489, test_loss: 1.0924, test_f1: 0.5858
 epoch: 86, train_loss: 0.7410, test_loss: 1.0272, test_f1: 0.6230
 epoch: 87, train_loss: 0.7298, test_loss: 1.0096, test_f1: 0.6011
 epoch: 88, train_loss: 0.7318, test_loss: 1.0110, test_f1: 0.6314
 epoch: 89, train_loss: 0.7290, test_loss: 0.8990, test_f1: 0.5758
 epoch: 90, train_loss: 0.7507, test_loss: 1.1038, test_f1: 0.6158
 epoch: 91, train_loss: 0.7326, test_loss: 1.0404, test_f1: 0.5940
 epoch: 92, train_loss: 0.7246, test_loss: 1.0714, test_f1: 0.6161
 epoch: 93, train_loss: 0.7219, test_loss: 1.3282, test_f1: 0.6639
 epoch: 94, train_loss: 0.7382, test_loss: 1.0008, test_f1: 0.6331
 epoch: 95, train_loss: 0.7318, test_loss: 1.0359, test_f1: 0.6287
 epoch: 96, train_loss: 0.7118, test_loss: 1.0335, test_f1: 0.6171
 epoch: 97, train_loss: 0.7073, test_loss: 1.0485, test_f1: 0.6454
 epoch: 98, train_loss: 0.7103, test_loss: 1.0488, test_f1: 0.6297
 epoch: 99, train_loss: 0.7216, test_loss: 0.9904, test_f1: 0.5860
##################ITERATION #2 ****************************************
 epoch: 0, train_loss: 1.1642, test_loss: 1.1891, test_f1: 0.3821
 epoch: 1, train_loss: 1.0904, test_loss: 1.1413, test_f1: 0.3432
 epoch: 2, train_loss: 1.0551, test_loss: 1.0689, test_f1: 0.4141
 epoch: 3, train_loss: 1.0350, test_loss: 1.1207, test_f1: 0.4275
 epoch: 4, train_loss: 1.0192, test_loss: 1.0487, test_f1: 0.4549
 epoch: 5, train_loss: 1.0049, test_loss: 1.0054, test_f1: 0.4723
 epoch: 6, train_loss: 0.9849, test_loss: 1.0492, test_f1: 0.4474
 epoch: 7, train_loss: 0.9663, test_loss: 0.9894, test_f1: 0.4486
 epoch: 8, train_loss: 0.9606, test_loss: 0.9456, test_f1: 0.4811
 epoch: 9, train_loss: 0.9658, test_loss: 1.0598, test_f1: 0.4955
 epoch: 10, train_loss: 0.9630, test_loss: 1.0238, test_f1: 0.4729
 epoch: 11, train_loss: 0.9669, test_loss: 0.9992, test_f1: 0.5069
 epoch: 12, train_loss: 0.9475, test_loss: 1.0260, test_f1: 0.4656
 epoch: 13, train_loss: 0.9571, test_loss: 1.0121, test_f1: 0.4651
 epoch: 14, train_loss: 0.9525, test_loss: 0.9436, test_f1: 0.4908
 epoch: 15, train_loss: 0.9387, test_loss: 0.9615, test_f1: 0.4913
 epoch: 16, train_loss: 0.9219, test_loss: 1.0344, test_f1: 0.5108
 epoch: 17, train_loss: 0.9191, test_loss: 0.9200, test_f1: 0.4969
 epoch: 18, train_loss: 0.9442, test_loss: 1.1064, test_f1: 0.4932
 epoch: 19, train_loss: 0.9181, test_loss: 1.0576, test_f1: 0.5277
 epoch: 20, train_loss: 0.9110, test_loss: 1.0032, test_f1: 0.5444
 epoch: 21, train_loss: 0.9058, test_loss: 1.0018, test_f1: 0.5103
 epoch: 22, train_loss: 0.9049, test_loss: 1.0492, test_f1: 0.5293
 epoch: 23, train_loss: 0.9114, test_loss: 1.0233, test_f1: 0.5409
 epoch: 24, train_loss: 0.8997, test_loss: 1.0249, test_f1: 0.5609
 epoch: 25, train_loss: 0.8913, test_loss: 0.9375, test_f1: 0.5391
 epoch: 26, train_loss: 0.8711, test_loss: 0.9484, test_f1: 0.5655
 epoch: 27, train_loss: 0.8936, test_loss: 0.9866, test_f1: 0.4971
 epoch: 28, train_loss: 0.9271, test_loss: 1.0319, test_f1: 0.4907
 epoch: 29, train_loss: 0.8810, test_loss: 1.0218, test_f1: 0.5421
 epoch: 30, train_loss: 0.8825, test_loss: 0.9872, test_f1: 0.5289
 epoch: 31, train_loss: 0.8818, test_loss: 0.9664, test_f1: 0.5082
 epoch: 32, train_loss: 0.8789, test_loss: 0.9731, test_f1: 0.5263
 epoch: 33, train_loss: 0.8754, test_loss: 0.9514, test_f1: 0.5645
 epoch: 34, train_loss: 0.8641, test_loss: 0.9180, test_f1: 0.5733
 epoch: 35, train_loss: 0.8804, test_loss: 0.9521, test_f1: 0.5493
 epoch: 36, train_loss: 0.8621, test_loss: 0.9541, test_f1: 0.5588
 epoch: 37, train_loss: 0.8590, test_loss: 0.9961, test_f1: 0.5338
 epoch: 38, train_loss: 0.8531, test_loss: 1.0037, test_f1: 0.5513
 epoch: 39, train_loss: 0.8575, test_loss: 1.0675, test_f1: 0.5204
 epoch: 40, train_loss: 0.8505, test_loss: 0.9258, test_f1: 0.5343
 epoch: 41, train_loss: 0.8473, test_loss: 1.0181, test_f1: 0.5388
 epoch: 42, train_loss: 0.8578, test_loss: 0.9637, test_f1: 0.5631
 epoch: 43, train_loss: 0.8475, test_loss: 0.9959, test_f1: 0.5848
 epoch: 44, train_loss: 0.8355, test_loss: 0.9632, test_f1: 0.5985
 epoch: 45, train_loss: 0.8165, test_loss: 1.1080, test_f1: 0.5188
 epoch: 46, train_loss: 0.8462, test_loss: 0.9150, test_f1: 0.5098
 epoch: 47, train_loss: 0.8260, test_loss: 0.8903, test_f1: 0.6097
 epoch: 48, train_loss: 0.8302, test_loss: 1.2563, test_f1: 0.6000
 epoch: 49, train_loss: 0.8306, test_loss: 0.9514, test_f1: 0.5983
 epoch: 50, train_loss: 0.8258, test_loss: 0.9682, test_f1: 0.5376
 epoch: 51, train_loss: 0.8080, test_loss: 0.9528, test_f1: 0.5978
 epoch: 52, train_loss: 0.7999, test_loss: 0.9476, test_f1: 0.5938
 epoch: 53, train_loss: 0.7860, test_loss: 0.9544, test_f1: 0.6228
 epoch: 54, train_loss: 0.7904, test_loss: 1.0127, test_f1: 0.5948
 epoch: 55, train_loss: 0.7814, test_loss: 1.0422, test_f1: 0.6080
 epoch: 56, train_loss: 0.8188, test_loss: 0.9679, test_f1: 0.6201
 epoch: 57, train_loss: 0.7959, test_loss: 0.9320, test_f1: 0.6242
 epoch: 58, train_loss: 0.7903, test_loss: 0.9248, test_f1: 0.5851
 epoch: 59, train_loss: 0.7849, test_loss: 0.9581, test_f1: 0.6075
 epoch: 60, train_loss: 0.7786, test_loss: 0.9796, test_f1: 0.6198
 epoch: 61, train_loss: 0.7680, test_loss: 0.9847, test_f1: 0.6012
 epoch: 62, train_loss: 0.7718, test_loss: 0.9483, test_f1: 0.5909
 epoch: 63, train_loss: 0.7646, test_loss: 0.9574, test_f1: 0.6392
 epoch: 64, train_loss: 0.7559, test_loss: 0.9671, test_f1: 0.6017
 epoch: 65, train_loss: 0.7608, test_loss: 0.9775, test_f1: 0.6144
 epoch: 66, train_loss: 0.7702, test_loss: 0.9457, test_f1: 0.6181
 epoch: 67, train_loss: 0.7593, test_loss: 0.9418, test_f1: 0.6284
 epoch: 68, train_loss: 0.7650, test_loss: 0.9654, test_f1: 0.6300
 epoch: 69, train_loss: 0.7570, test_loss: 1.0173, test_f1: 0.6317
 epoch: 70, train_loss: 0.7567, test_loss: 0.9732, test_f1: 0.5996
 epoch: 71, train_loss: 0.7467, test_loss: 0.9475, test_f1: 0.6181
 epoch: 72, train_loss: 0.7508, test_loss: 0.9740, test_f1: 0.6132
 epoch: 73, train_loss: 0.7530, test_loss: 0.9713, test_f1: 0.6294
 epoch: 74, train_loss: 0.7473, test_loss: 1.0099, test_f1: 0.6047
 epoch: 75, train_loss: 0.7548, test_loss: 0.9415, test_f1: 0.6416
 epoch: 76, train_loss: 0.7397, test_loss: 0.9926, test_f1: 0.6123
 epoch: 77, train_loss: 0.7491, test_loss: 0.9240, test_f1: 0.6197
 epoch: 78, train_loss: 0.7493, test_loss: 0.9540, test_f1: 0.6383
 epoch: 79, train_loss: 0.7540, test_loss: 0.9871, test_f1: 0.6220
 epoch: 80, train_loss: 0.7397, test_loss: 1.0240, test_f1: 0.6095
 epoch: 81, train_loss: 0.7474, test_loss: 1.0223, test_f1: 0.6283
 epoch: 82, train_loss: 0.7431, test_loss: 1.0037, test_f1: 0.6223
 epoch: 83, train_loss: 0.7371, test_loss: 1.0082, test_f1: 0.6238
 epoch: 84, train_loss: 0.7415, test_loss: 0.9577, test_f1: 0.6416
 epoch: 85, train_loss: 0.7522, test_loss: 0.9607, test_f1: 0.6262
 epoch: 86, train_loss: 0.7288, test_loss: 0.9729, test_f1: 0.6063
 epoch: 87, train_loss: 0.7249, test_loss: 1.0690, test_f1: 0.6115
 epoch: 88, train_loss: 0.7294, test_loss: 1.0019, test_f1: 0.6150
 epoch: 89, train_loss: 0.7370, test_loss: 0.9842, test_f1: 0.6166
 epoch: 90, train_loss: 0.7270, test_loss: 1.0595, test_f1: 0.6257
 epoch: 91, train_loss: 0.7310, test_loss: 0.9847, test_f1: 0.6196
 epoch: 92, train_loss: 0.7256, test_loss: 0.9669, test_f1: 0.6289
 epoch: 93, train_loss: 0.7335, test_loss: 0.9497, test_f1: 0.6080
 epoch: 94, train_loss: 0.7184, test_loss: 0.9688, test_f1: 0.6167
 epoch: 95, train_loss: 0.7036, test_loss: 0.9524, test_f1: 0.6274
 epoch: 96, train_loss: 0.7177, test_loss: 0.9527, test_f1: 0.6209
 epoch: 97, train_loss: 0.7173, test_loss: 0.9774, test_f1: 0.6263
 epoch: 98, train_loss: 0.7108, test_loss: 1.0253, test_f1: 0.6181
 epoch: 99, train_loss: 0.7175, test_loss: 0.9827, test_f1: 0.6077
##################ITERATION #3 ****************************************
 epoch: 0, train_loss: 1.1868, test_loss: 1.1134, test_f1: 0.3989
 epoch: 1, train_loss: 1.0403, test_loss: 1.0154, test_f1: 0.4440
 epoch: 2, train_loss: 0.9998, test_loss: 1.0027, test_f1: 0.4688
 epoch: 3, train_loss: 0.9985, test_loss: 1.0074, test_f1: 0.4674
 epoch: 4, train_loss: 0.9865, test_loss: 1.0545, test_f1: 0.4671
 epoch: 5, train_loss: 0.9897, test_loss: 0.9818, test_f1: 0.4568
 epoch: 6, train_loss: 0.9723, test_loss: 0.9895, test_f1: 0.4587
 epoch: 7, train_loss: 0.9506, test_loss: 0.9967, test_f1: 0.4647
 epoch: 8, train_loss: 0.9536, test_loss: 1.0204, test_f1: 0.5035
 epoch: 9, train_loss: 0.9461, test_loss: 1.0097, test_f1: 0.5212
 epoch: 10, train_loss: 0.9295, test_loss: 0.9624, test_f1: 0.5256
 epoch: 11, train_loss: 0.9252, test_loss: 0.9485, test_f1: 0.4993
 epoch: 12, train_loss: 0.9325, test_loss: 0.9455, test_f1: 0.4939
 epoch: 13, train_loss: 0.9147, test_loss: 0.9569, test_f1: 0.5119
 epoch: 14, train_loss: 0.9054, test_loss: 0.9290, test_f1: 0.5521
 epoch: 15, train_loss: 0.9053, test_loss: 1.0381, test_f1: 0.4721
 epoch: 16, train_loss: 0.9404, test_loss: 0.9580, test_f1: 0.5015
 epoch: 17, train_loss: 0.9261, test_loss: 0.9612, test_f1: 0.5268
 epoch: 18, train_loss: 0.9219, test_loss: 0.9336, test_f1: 0.5283
 epoch: 19, train_loss: 0.9091, test_loss: 0.9417, test_f1: 0.4939
 epoch: 20, train_loss: 0.9327, test_loss: 0.9781, test_f1: 0.5115
 epoch: 21, train_loss: 0.9010, test_loss: 0.8963, test_f1: 0.5366
 epoch: 22, train_loss: 0.9098, test_loss: 0.9749, test_f1: 0.5431
 epoch: 23, train_loss: 0.8782, test_loss: 0.9546, test_f1: 0.5197
 epoch: 24, train_loss: 0.8763, test_loss: 0.9241, test_f1: 0.5717
 epoch: 25, train_loss: 0.8724, test_loss: 0.9108, test_f1: 0.5496
 epoch: 26, train_loss: 0.8874, test_loss: 0.9114, test_f1: 0.5270
 epoch: 27, train_loss: 0.8702, test_loss: 1.1477, test_f1: 0.4958
 epoch: 28, train_loss: 0.8606, test_loss: 0.9401, test_f1: 0.5999
 epoch: 29, train_loss: 0.8617, test_loss: 0.9147, test_f1: 0.5603
 epoch: 30, train_loss: 0.8738, test_loss: 0.9276, test_f1: 0.5845
 epoch: 31, train_loss: 0.8533, test_loss: 0.8985, test_f1: 0.6043
 epoch: 32, train_loss: 0.8551, test_loss: 0.9151, test_f1: 0.5653
 epoch: 33, train_loss: 0.8455, test_loss: 0.9622, test_f1: 0.5304
 epoch: 34, train_loss: 0.8418, test_loss: 0.9821, test_f1: 0.5249
 epoch: 35, train_loss: 0.8329, test_loss: 0.9199, test_f1: 0.5467
 epoch: 36, train_loss: 0.8437, test_loss: 0.9557, test_f1: 0.5327
 epoch: 37, train_loss: 0.8325, test_loss: 0.9480, test_f1: 0.5386
 epoch: 38, train_loss: 0.8369, test_loss: 0.9920, test_f1: 0.6016
 epoch: 39, train_loss: 0.8350, test_loss: 0.9614, test_f1: 0.6228
 epoch: 40, train_loss: 0.8303, test_loss: 0.9322, test_f1: 0.5855
 epoch: 41, train_loss: 0.8383, test_loss: 0.9606, test_f1: 0.5875
 epoch: 42, train_loss: 0.8321, test_loss: 0.9288, test_f1: 0.6165
 epoch: 43, train_loss: 0.8301, test_loss: 0.9317, test_f1: 0.5551
 epoch: 44, train_loss: 0.8082, test_loss: 0.9511, test_f1: 0.6273
 epoch: 45, train_loss: 0.8171, test_loss: 0.9437, test_f1: 0.5992
 epoch: 46, train_loss: 0.8108, test_loss: 0.9523, test_f1: 0.5602
 epoch: 47, train_loss: 0.8226, test_loss: 0.9277, test_f1: 0.5769
 epoch: 48, train_loss: 0.8146, test_loss: 0.9512, test_f1: 0.5925
 epoch: 49, train_loss: 0.8252, test_loss: 0.9697, test_f1: 0.6079
 epoch: 50, train_loss: 0.8119, test_loss: 0.9947, test_f1: 0.5448
 epoch: 51, train_loss: 0.8536, test_loss: 0.9793, test_f1: 0.5574
 epoch: 52, train_loss: 0.8158, test_loss: 0.9571, test_f1: 0.5736
 epoch: 53, train_loss: 0.7974, test_loss: 0.9510, test_f1: 0.6045
 epoch: 54, train_loss: 0.7901, test_loss: 0.9831, test_f1: 0.5766
 epoch: 55, train_loss: 0.7884, test_loss: 1.0771, test_f1: 0.5929
 epoch: 56, train_loss: 0.7832, test_loss: 0.9867, test_f1: 0.5857
 epoch: 57, train_loss: 0.7746, test_loss: 0.9800, test_f1: 0.6050
 epoch: 58, train_loss: 0.7852, test_loss: 1.0243, test_f1: 0.5977
 epoch: 59, train_loss: 0.7702, test_loss: 0.9984, test_f1: 0.6423
 epoch: 60, train_loss: 0.7628, test_loss: 1.0570, test_f1: 0.6186
 epoch: 61, train_loss: 0.7613, test_loss: 1.0511, test_f1: 0.6038
 epoch: 62, train_loss: 0.7601, test_loss: 0.9939, test_f1: 0.6297
 epoch: 63, train_loss: 0.7578, test_loss: 1.0578, test_f1: 0.6039
 epoch: 64, train_loss: 0.7502, test_loss: 1.0756, test_f1: 0.6419
 epoch: 65, train_loss: 0.7600, test_loss: 1.0350, test_f1: 0.5961
 epoch: 66, train_loss: 0.7471, test_loss: 1.0548, test_f1: 0.6220
 epoch: 67, train_loss: 0.7495, test_loss: 1.0312, test_f1: 0.6419
 epoch: 68, train_loss: 0.7561, test_loss: 1.0025, test_f1: 0.5995
 epoch: 69, train_loss: 0.7492, test_loss: 0.9865, test_f1: 0.5981
 epoch: 70, train_loss: 0.7406, test_loss: 0.9992, test_f1: 0.5919
 epoch: 71, train_loss: 0.7526, test_loss: 1.0408, test_f1: 0.6319
 epoch: 72, train_loss: 0.7559, test_loss: 1.0208, test_f1: 0.6426
 epoch: 73, train_loss: 0.7267, test_loss: 1.0516, test_f1: 0.6341
 epoch: 74, train_loss: 0.7369, test_loss: 1.0147, test_f1: 0.6078
 epoch: 75, train_loss: 0.7323, test_loss: 0.9770, test_f1: 0.6278
 epoch: 76, train_loss: 0.7400, test_loss: 0.9830, test_f1: 0.6260
 epoch: 77, train_loss: 0.7448, test_loss: 1.0473, test_f1: 0.6245
 epoch: 78, train_loss: 0.7332, test_loss: 1.0073, test_f1: 0.6338
 epoch: 79, train_loss: 0.7563, test_loss: 0.9824, test_f1: 0.6396
 epoch: 80, train_loss: 0.7412, test_loss: 0.9935, test_f1: 0.6103
 epoch: 81, train_loss: 0.7416, test_loss: 0.9518, test_f1: 0.6272
 epoch: 82, train_loss: 0.7230, test_loss: 1.0082, test_f1: 0.6238
 epoch: 83, train_loss: 0.7394, test_loss: 1.0858, test_f1: 0.6271
 epoch: 84, train_loss: 0.7285, test_loss: 1.0767, test_f1: 0.6239
 epoch: 85, train_loss: 0.7336, test_loss: 1.0541, test_f1: 0.6039
 epoch: 86, train_loss: 0.7150, test_loss: 1.0331, test_f1: 0.6357
 epoch: 87, train_loss: 0.7294, test_loss: 0.9868, test_f1: 0.6483
 epoch: 88, train_loss: 0.7253, test_loss: 0.9522, test_f1: 0.6068
 epoch: 89, train_loss: 0.7148, test_loss: 0.9988, test_f1: 0.6452
 epoch: 90, train_loss: 0.7112, test_loss: 1.0416, test_f1: 0.6222
 epoch: 91, train_loss: 0.7158, test_loss: 1.0364, test_f1: 0.6182
 epoch: 92, train_loss: 0.6988, test_loss: 1.0324, test_f1: 0.6355
 epoch: 93, train_loss: 0.7200, test_loss: 1.0594, test_f1: 0.6067
 epoch: 94, train_loss: 0.7191, test_loss: 0.9085, test_f1: 0.6537
 epoch: 95, train_loss: 0.7175, test_loss: 1.0332, test_f1: 0.6054
 epoch: 96, train_loss: 0.7030, test_loss: 1.0025, test_f1: 0.6500
 epoch: 97, train_loss: 0.7140, test_loss: 0.9960, test_f1: 0.6589
 epoch: 98, train_loss: 0.7108, test_loss: 1.1007, test_f1: 0.6183
 epoch: 99, train_loss: 0.7250, test_loss: 1.0820, test_f1: 0.6260
##################ITERATION #4 ****************************************
 epoch: 0, train_loss: 1.1836, test_loss: 1.2512, test_f1: 0.4009
 epoch: 1, train_loss: 1.0535, test_loss: 1.0979, test_f1: 0.4262
 epoch: 2, train_loss: 1.0354, test_loss: 1.0213, test_f1: 0.4521
 epoch: 3, train_loss: 1.0042, test_loss: 1.0192, test_f1: 0.5031
 epoch: 4, train_loss: 0.9976, test_loss: 0.9995, test_f1: 0.4739
 epoch: 5, train_loss: 1.0106, test_loss: 1.0475, test_f1: 0.4611
 epoch: 6, train_loss: 0.9853, test_loss: 1.0844, test_f1: 0.4180
 epoch: 7, train_loss: 0.9747, test_loss: 0.9804, test_f1: 0.4792
 epoch: 8, train_loss: 0.9583, test_loss: 0.9863, test_f1: 0.4631
 epoch: 9, train_loss: 0.9635, test_loss: 0.9662, test_f1: 0.5060
 epoch: 10, train_loss: 0.9513, test_loss: 1.0007, test_f1: 0.4795
 epoch: 11, train_loss: 0.9500, test_loss: 0.9920, test_f1: 0.5025
 epoch: 12, train_loss: 0.9386, test_loss: 0.9252, test_f1: 0.4903
 epoch: 13, train_loss: 0.9448, test_loss: 0.9855, test_f1: 0.5103
 epoch: 14, train_loss: 0.9283, test_loss: 1.0164, test_f1: 0.5414
 epoch: 15, train_loss: 0.9222, test_loss: 0.9679, test_f1: 0.5523
 epoch: 16, train_loss: 0.9210, test_loss: 0.9708, test_f1: 0.5070
 epoch: 17, train_loss: 0.9229, test_loss: 0.9983, test_f1: 0.5189
 epoch: 18, train_loss: 0.9211, test_loss: 1.0228, test_f1: 0.5290
 epoch: 19, train_loss: 0.8973, test_loss: 0.9449, test_f1: 0.5390
 epoch: 20, train_loss: 0.9109, test_loss: 1.0110, test_f1: 0.5004
 epoch: 21, train_loss: 0.8895, test_loss: 0.9567, test_f1: 0.4975
 epoch: 22, train_loss: 0.8884, test_loss: 0.9318, test_f1: 0.5365
 epoch: 23, train_loss: 0.8854, test_loss: 0.9028, test_f1: 0.5263
 epoch: 24, train_loss: 0.9020, test_loss: 0.9725, test_f1: 0.5164
 epoch: 25, train_loss: 0.8845, test_loss: 0.9545, test_f1: 0.5273
 epoch: 26, train_loss: 0.8762, test_loss: 0.8929, test_f1: 0.4984
 epoch: 27, train_loss: 0.8722, test_loss: 0.9305, test_f1: 0.5190
 epoch: 28, train_loss: 0.8661, test_loss: 0.9539, test_f1: 0.4806
 epoch: 29, train_loss: 0.8783, test_loss: 0.9345, test_f1: 0.5031
 epoch: 30, train_loss: 0.8673, test_loss: 0.9333, test_f1: 0.5700
 epoch: 31, train_loss: 0.8577, test_loss: 0.9279, test_f1: 0.5076
 epoch: 32, train_loss: 0.8523, test_loss: 0.9976, test_f1: 0.5101
 epoch: 33, train_loss: 0.8544, test_loss: 0.9677, test_f1: 0.5309
 epoch: 34, train_loss: 0.8458, test_loss: 0.9253, test_f1: 0.5473
 epoch: 35, train_loss: 0.8512, test_loss: 0.9554, test_f1: 0.5290
 epoch: 36, train_loss: 0.8517, test_loss: 0.9137, test_f1: 0.5608
 epoch: 37, train_loss: 0.8657, test_loss: 0.9550, test_f1: 0.5412
 epoch: 38, train_loss: 0.8357, test_loss: 0.8678, test_f1: 0.5198
 epoch: 39, train_loss: 0.8364, test_loss: 0.9207, test_f1: 0.5327
 epoch: 40, train_loss: 0.8479, test_loss: 0.8990, test_f1: 0.5580
 epoch: 41, train_loss: 0.8312, test_loss: 0.8929, test_f1: 0.5321
 epoch: 42, train_loss: 0.8303, test_loss: 0.8631, test_f1: 0.5140
 epoch: 43, train_loss: 0.8276, test_loss: 0.9467, test_f1: 0.5181
 epoch: 44, train_loss: 0.8414, test_loss: 0.9502, test_f1: 0.5111
 epoch: 45, train_loss: 0.8089, test_loss: 0.8659, test_f1: 0.5918
 epoch: 46, train_loss: 0.8353, test_loss: 0.8909, test_f1: 0.5258
 epoch: 47, train_loss: 0.8277, test_loss: 0.8897, test_f1: 0.5295
 epoch: 48, train_loss: 0.8149, test_loss: 0.8740, test_f1: 0.5277
 epoch: 49, train_loss: 0.8342, test_loss: 0.8740, test_f1: 0.5591
 epoch: 50, train_loss: 0.8220, test_loss: 0.8592, test_f1: 0.5464
 epoch: 51, train_loss: 0.7881, test_loss: 0.9149, test_f1: 0.5303
 epoch: 52, train_loss: 0.7927, test_loss: 0.9314, test_f1: 0.5541
 epoch: 53, train_loss: 0.7819, test_loss: 0.8853, test_f1: 0.5465
 epoch: 54, train_loss: 0.7729, test_loss: 0.9053, test_f1: 0.5554
 epoch: 55, train_loss: 0.7810, test_loss: 0.8959, test_f1: 0.5743
 epoch: 56, train_loss: 0.7801, test_loss: 0.9328, test_f1: 0.5559
 epoch: 57, train_loss: 0.7718, test_loss: 0.8706, test_f1: 0.5406
 epoch: 58, train_loss: 0.7842, test_loss: 0.9062, test_f1: 0.5449
 epoch: 59, train_loss: 0.7698, test_loss: 0.8923, test_f1: 0.6121
 epoch: 60, train_loss: 0.7564, test_loss: 0.9516, test_f1: 0.5342
 epoch: 61, train_loss: 0.7722, test_loss: 0.8136, test_f1: 0.5691
 epoch: 62, train_loss: 0.7603, test_loss: 0.9068, test_f1: 0.5458
 epoch: 63, train_loss: 0.7546, test_loss: 0.9082, test_f1: 0.5430
 epoch: 64, train_loss: 0.7684, test_loss: 0.9622, test_f1: 0.5126
 epoch: 65, train_loss: 0.7657, test_loss: 0.9027, test_f1: 0.5872
 epoch: 66, train_loss: 0.7633, test_loss: 0.8904, test_f1: 0.5621
 epoch: 67, train_loss: 0.7380, test_loss: 0.9398, test_f1: 0.5889
 epoch: 68, train_loss: 0.7521, test_loss: 0.9839, test_f1: 0.5661
 epoch: 69, train_loss: 0.7679, test_loss: 0.9223, test_f1: 0.5326
 epoch: 70, train_loss: 0.7594, test_loss: 0.9303, test_f1: 0.5430
 epoch: 71, train_loss: 0.7624, test_loss: 0.9103, test_f1: 0.5800
 epoch: 72, train_loss: 0.7380, test_loss: 0.8406, test_f1: 0.6085
 epoch: 73, train_loss: 0.7521, test_loss: 0.8829, test_f1: 0.5431
 epoch: 74, train_loss: 0.7471, test_loss: 0.9529, test_f1: 0.5296
 epoch: 75, train_loss: 0.7362, test_loss: 0.8729, test_f1: 0.5803
 epoch: 76, train_loss: 0.7334, test_loss: 0.9350, test_f1: 0.5993
 epoch: 77, train_loss: 0.7334, test_loss: 0.9055, test_f1: 0.6034
 epoch: 78, train_loss: 0.7365, test_loss: 0.9117, test_f1: 0.5956
 epoch: 79, train_loss: 0.7318, test_loss: 0.8720, test_f1: 0.5965
 epoch: 80, train_loss: 0.7205, test_loss: 0.8951, test_f1: 0.6001
 epoch: 81, train_loss: 0.7228, test_loss: 0.9516, test_f1: 0.5888
 epoch: 82, train_loss: 0.7399, test_loss: 0.9605, test_f1: 0.5725
 epoch: 83, train_loss: 0.7265, test_loss: 0.8409, test_f1: 0.5866
 epoch: 84, train_loss: 0.7323, test_loss: 0.8985, test_f1: 0.5755
 epoch: 85, train_loss: 0.7134, test_loss: 0.9160, test_f1: 0.6370
 epoch: 86, train_loss: 0.7254, test_loss: 0.8723, test_f1: 0.6057
 epoch: 87, train_loss: 0.7320, test_loss: 0.8713, test_f1: 0.5909
 epoch: 88, train_loss: 0.7274, test_loss: 0.9406, test_f1: 0.5681
 epoch: 89, train_loss: 0.7123, test_loss: 1.0143, test_f1: 0.5801
 epoch: 90, train_loss: 0.7336, test_loss: 0.9632, test_f1: 0.5574
 epoch: 91, train_loss: 0.7183, test_loss: 0.8823, test_f1: 0.6053
 epoch: 92, train_loss: 0.7192, test_loss: 0.9696, test_f1: 0.6124
 epoch: 93, train_loss: 0.7305, test_loss: 0.9760, test_f1: 0.5840
 epoch: 94, train_loss: 0.7185, test_loss: 0.9709, test_f1: 0.6222
 epoch: 95, train_loss: 0.7106, test_loss: 0.9438, test_f1: 0.6286
 epoch: 96, train_loss: 0.7176, test_loss: 1.1817, test_f1: 0.5801
 epoch: 97, train_loss: 0.7013, test_loss: 1.0810, test_f1: 0.6303
 epoch: 98, train_loss: 0.6953, test_loss: 1.0134, test_f1: 0.6116
 epoch: 99, train_loss: 0.7237, test_loss: 0.9077, test_f1: 0.6212
##################ITERATION #5 ****************************************
 epoch: 0, train_loss: 1.1987, test_loss: 1.0668, test_f1: 0.4385
 epoch: 1, train_loss: 1.0486, test_loss: 1.0185, test_f1: 0.4665
 epoch: 2, train_loss: 1.0361, test_loss: 1.0063, test_f1: 0.4771
 epoch: 3, train_loss: 1.0123, test_loss: 1.0600, test_f1: 0.4718
 epoch: 4, train_loss: 1.0038, test_loss: 1.0315, test_f1: 0.4809
 epoch: 5, train_loss: 0.9756, test_loss: 0.9916, test_f1: 0.4692
 epoch: 6, train_loss: 0.9846, test_loss: 0.9822, test_f1: 0.4841
 epoch: 7, train_loss: 0.9622, test_loss: 1.0232, test_f1: 0.4664
 epoch: 8, train_loss: 0.9567, test_loss: 0.9541, test_f1: 0.4994
 epoch: 9, train_loss: 0.9489, test_loss: 1.0141, test_f1: 0.4899
 epoch: 10, train_loss: 0.9380, test_loss: 0.9462, test_f1: 0.5199
 epoch: 11, train_loss: 0.9350, test_loss: 1.0057, test_f1: 0.4780
 epoch: 12, train_loss: 0.9291, test_loss: 0.9496, test_f1: 0.4770
 epoch: 13, train_loss: 0.9227, test_loss: 0.9938, test_f1: 0.5045
 epoch: 14, train_loss: 0.9210, test_loss: 0.9222, test_f1: 0.5071
 epoch: 15, train_loss: 0.9139, test_loss: 0.9948, test_f1: 0.5002
 epoch: 16, train_loss: 0.9200, test_loss: 0.9512, test_f1: 0.5167
 epoch: 17, train_loss: 0.9151, test_loss: 0.9852, test_f1: 0.4937
 epoch: 18, train_loss: 0.9013, test_loss: 0.9758, test_f1: 0.4851
 epoch: 19, train_loss: 0.9022, test_loss: 0.9969, test_f1: 0.4985
 epoch: 20, train_loss: 0.8992, test_loss: 0.9638, test_f1: 0.5074
 epoch: 21, train_loss: 0.8876, test_loss: 0.9416, test_f1: 0.4960
 epoch: 22, train_loss: 0.8836, test_loss: 0.9510, test_f1: 0.5106
 epoch: 23, train_loss: 0.8880, test_loss: 1.0151, test_f1: 0.5180
 epoch: 24, train_loss: 0.8762, test_loss: 1.0578, test_f1: 0.5140
 epoch: 25, train_loss: 0.8671, test_loss: 0.9513, test_f1: 0.5713
 epoch: 26, train_loss: 0.8852, test_loss: 0.9561, test_f1: 0.5612
 epoch: 27, train_loss: 0.8814, test_loss: 1.0054, test_f1: 0.5161
 epoch: 28, train_loss: 0.8664, test_loss: 0.9674, test_f1: 0.5542
 epoch: 29, train_loss: 0.8693, test_loss: 1.0621, test_f1: 0.5230
 epoch: 30, train_loss: 0.8772, test_loss: 0.9860, test_f1: 0.5459
 epoch: 31, train_loss: 0.8646, test_loss: 0.9861, test_f1: 0.5592
 epoch: 32, train_loss: 0.8639, test_loss: 1.0647, test_f1: 0.5171
 epoch: 33, train_loss: 0.8617, test_loss: 1.0149, test_f1: 0.4911
 epoch: 34, train_loss: 0.8623, test_loss: 1.1360, test_f1: 0.5460
 epoch: 35, train_loss: 0.8479, test_loss: 0.9604, test_f1: 0.5349
 epoch: 36, train_loss: 0.8522, test_loss: 0.9554, test_f1: 0.5540
 epoch: 37, train_loss: 0.8419, test_loss: 0.9624, test_f1: 0.5549
 epoch: 38, train_loss: 0.8408, test_loss: 0.9982, test_f1: 0.5471
 epoch: 39, train_loss: 0.8403, test_loss: 0.9493, test_f1: 0.5780
 epoch: 40, train_loss: 0.8285, test_loss: 0.9778, test_f1: 0.5587
 epoch: 41, train_loss: 0.8427, test_loss: 0.9597, test_f1: 0.5283
 epoch: 42, train_loss: 0.8291, test_loss: 0.9755, test_f1: 0.5630
 epoch: 43, train_loss: 0.8390, test_loss: 1.0039, test_f1: 0.5408
 epoch: 44, train_loss: 0.8271, test_loss: 1.0346, test_f1: 0.5380
 epoch: 45, train_loss: 0.8487, test_loss: 0.9665, test_f1: 0.5520
 epoch: 46, train_loss: 0.8252, test_loss: 0.9311, test_f1: 0.6110
 epoch: 47, train_loss: 0.8059, test_loss: 0.9181, test_f1: 0.5560
 epoch: 48, train_loss: 0.8176, test_loss: 0.9432, test_f1: 0.5709
 epoch: 49, train_loss: 0.8317, test_loss: 0.9986, test_f1: 0.5091
 epoch: 50, train_loss: 0.8217, test_loss: 0.9548, test_f1: 0.5395
 epoch: 51, train_loss: 0.7863, test_loss: 0.9447, test_f1: 0.6012
 epoch: 52, train_loss: 0.7848, test_loss: 0.9572, test_f1: 0.6033
 epoch: 53, train_loss: 0.7685, test_loss: 0.9988, test_f1: 0.6045
 epoch: 54, train_loss: 0.7700, test_loss: 0.9653, test_f1: 0.5909
 epoch: 55, train_loss: 0.7697, test_loss: 1.0116, test_f1: 0.5931
 epoch: 56, train_loss: 0.7704, test_loss: 0.9936, test_f1: 0.6094
 epoch: 57, train_loss: 0.7698, test_loss: 0.9847, test_f1: 0.6003
 epoch: 58, train_loss: 0.7740, test_loss: 1.0152, test_f1: 0.5880
 epoch: 59, train_loss: 0.7582, test_loss: 0.9323, test_f1: 0.6412
 epoch: 60, train_loss: 0.7615, test_loss: 0.9769, test_f1: 0.6039
 epoch: 61, train_loss: 0.7611, test_loss: 1.0351, test_f1: 0.6189
 epoch: 62, train_loss: 0.7582, test_loss: 1.0006, test_f1: 0.6234
 epoch: 63, train_loss: 0.7697, test_loss: 0.9564, test_f1: 0.6237
 epoch: 64, train_loss: 0.7522, test_loss: 0.9701, test_f1: 0.6028
 epoch: 65, train_loss: 0.7586, test_loss: 0.9694, test_f1: 0.6138
 epoch: 66, train_loss: 0.7481, test_loss: 0.9515, test_f1: 0.5995
 epoch: 67, train_loss: 0.7572, test_loss: 1.0264, test_f1: 0.6035
 epoch: 68, train_loss: 0.7492, test_loss: 1.0087, test_f1: 0.5956
 epoch: 69, train_loss: 0.7629, test_loss: 0.9789, test_f1: 0.6159
 epoch: 70, train_loss: 0.7354, test_loss: 0.9621, test_f1: 0.5950
 epoch: 71, train_loss: 0.7410, test_loss: 1.0035, test_f1: 0.6226
 epoch: 72, train_loss: 0.7466, test_loss: 1.0073, test_f1: 0.5974
 epoch: 73, train_loss: 0.7404, test_loss: 1.1007, test_f1: 0.5962
 epoch: 74, train_loss: 0.7385, test_loss: 1.0474, test_f1: 0.5935
 epoch: 75, train_loss: 0.7502, test_loss: 1.1191, test_f1: 0.6045
 epoch: 76, train_loss: 0.7511, test_loss: 1.0256, test_f1: 0.6024
 epoch: 77, train_loss: 0.7447, test_loss: 1.0425, test_f1: 0.6142
 epoch: 78, train_loss: 0.7470, test_loss: 1.0327, test_f1: 0.6457
 epoch: 79, train_loss: 0.7224, test_loss: 1.0469, test_f1: 0.5931
 epoch: 80, train_loss: 0.7304, test_loss: 1.1923, test_f1: 0.6017
 epoch: 81, train_loss: 0.7295, test_loss: 1.1349, test_f1: 0.6177
 epoch: 82, train_loss: 0.7307, test_loss: 1.1360, test_f1: 0.6107
 epoch: 83, train_loss: 0.7340, test_loss: 1.1107, test_f1: 0.6165
 epoch: 84, train_loss: 0.7420, test_loss: 1.1399, test_f1: 0.5964
 epoch: 85, train_loss: 0.7339, test_loss: 1.1812, test_f1: 0.5837
 epoch: 86, train_loss: 0.7257, test_loss: 1.1253, test_f1: 0.6138
 epoch: 87, train_loss: 0.7210, test_loss: 1.0875, test_f1: 0.5934
 epoch: 88, train_loss: 0.7279, test_loss: 1.1082, test_f1: 0.6202
 epoch: 89, train_loss: 0.7235, test_loss: 1.2501, test_f1: 0.6282
 epoch: 90, train_loss: 0.7168, test_loss: 1.1830, test_f1: 0.6035
 epoch: 91, train_loss: 0.7217, test_loss: 1.1692, test_f1: 0.6180
 epoch: 92, train_loss: 0.7233, test_loss: 1.2157, test_f1: 0.6133
 epoch: 93, train_loss: 0.7140, test_loss: 0.9731, test_f1: 0.6320
 epoch: 94, train_loss: 0.7058, test_loss: 1.1674, test_f1: 0.6175
 epoch: 95, train_loss: 0.7019, test_loss: 1.0432, test_f1: 0.6114
 epoch: 96, train_loss: 0.7084, test_loss: 1.0670, test_f1: 0.6090
 epoch: 97, train_loss: 0.7193, test_loss: 1.0944, test_f1: 0.5963
 epoch: 98, train_loss: 0.7159, test_loss: 1.0557, test_f1: 0.6135
 epoch: 99, train_loss: 0.7349, test_loss: 1.0173, test_f1: 0.5992
##################ITERATION #6 ****************************************
 epoch: 0, train_loss: 1.1469, test_loss: 1.0848, test_f1: 0.3486
 epoch: 1, train_loss: 1.0511, test_loss: 1.0515, test_f1: 0.4264
 epoch: 2, train_loss: 1.0292, test_loss: 1.0006, test_f1: 0.4122
 epoch: 3, train_loss: 1.0099, test_loss: 1.0608, test_f1: 0.4757
 epoch: 4, train_loss: 0.9871, test_loss: 0.9921, test_f1: 0.4638
 epoch: 5, train_loss: 0.9855, test_loss: 1.0370, test_f1: 0.4784
 epoch: 6, train_loss: 0.9879, test_loss: 1.0099, test_f1: 0.4877
 epoch: 7, train_loss: 0.9774, test_loss: 0.9482, test_f1: 0.4512
 epoch: 8, train_loss: 0.9691, test_loss: 0.9637, test_f1: 0.4994
 epoch: 9, train_loss: 0.9566, test_loss: 0.9406, test_f1: 0.5330
 epoch: 10, train_loss: 0.9487, test_loss: 0.9575, test_f1: 0.5160
 epoch: 11, train_loss: 0.9458, test_loss: 0.9839, test_f1: 0.4916
 epoch: 12, train_loss: 0.9429, test_loss: 0.9614, test_f1: 0.5155
 epoch: 13, train_loss: 0.9183, test_loss: 1.0139, test_f1: 0.5236
 epoch: 14, train_loss: 0.9287, test_loss: 1.0052, test_f1: 0.5166
 epoch: 15, train_loss: 0.9416, test_loss: 1.0518, test_f1: 0.4618
 epoch: 16, train_loss: 0.9274, test_loss: 1.0157, test_f1: 0.5334
 epoch: 17, train_loss: 0.9161, test_loss: 0.9643, test_f1: 0.4861
 epoch: 18, train_loss: 0.9206, test_loss: 0.9419, test_f1: 0.5415
 epoch: 19, train_loss: 0.8986, test_loss: 0.9619, test_f1: 0.5089
 epoch: 20, train_loss: 0.9089, test_loss: 0.9345, test_f1: 0.5552
 epoch: 21, train_loss: 0.9068, test_loss: 0.9721, test_f1: 0.5297
 epoch: 22, train_loss: 0.8954, test_loss: 0.9794, test_f1: 0.5233
 epoch: 23, train_loss: 0.8900, test_loss: 1.0646, test_f1: 0.5145
 epoch: 24, train_loss: 0.8955, test_loss: 0.9551, test_f1: 0.5657
 epoch: 25, train_loss: 0.8846, test_loss: 0.9252, test_f1: 0.5224
 epoch: 26, train_loss: 0.9000, test_loss: 0.9592, test_f1: 0.5838
 epoch: 27, train_loss: 0.8785, test_loss: 0.9751, test_f1: 0.5523
 epoch: 28, train_loss: 0.8790, test_loss: 0.9562, test_f1: 0.5190
 epoch: 29, train_loss: 0.8932, test_loss: 0.9435, test_f1: 0.5214
 epoch: 30, train_loss: 0.8706, test_loss: 0.9503, test_f1: 0.5275
 epoch: 31, train_loss: 0.8617, test_loss: 0.9557, test_f1: 0.5723
 epoch: 32, train_loss: 0.8642, test_loss: 0.9631, test_f1: 0.5482
 epoch: 33, train_loss: 0.8567, test_loss: 0.9613, test_f1: 0.5546
 epoch: 34, train_loss: 0.8409, test_loss: 0.9261, test_f1: 0.5680
 epoch: 35, train_loss: 0.8617, test_loss: 0.9514, test_f1: 0.5498
 epoch: 36, train_loss: 0.8394, test_loss: 0.9219, test_f1: 0.5206
 epoch: 37, train_loss: 0.8506, test_loss: 0.9854, test_f1: 0.5931
 epoch: 38, train_loss: 0.8413, test_loss: 1.0727, test_f1: 0.5576
 epoch: 39, train_loss: 0.8431, test_loss: 0.9556, test_f1: 0.5439
 epoch: 40, train_loss: 0.8419, test_loss: 1.0026, test_f1: 0.5148
 epoch: 41, train_loss: 0.8572, test_loss: 0.9682, test_f1: 0.5442
 epoch: 42, train_loss: 0.8437, test_loss: 1.0390, test_f1: 0.5253
 epoch: 43, train_loss: 0.8486, test_loss: 0.9443, test_f1: 0.5660
 epoch: 44, train_loss: 0.8256, test_loss: 0.9735, test_f1: 0.5759
 epoch: 45, train_loss: 0.8395, test_loss: 1.0434, test_f1: 0.5762
 epoch: 46, train_loss: 0.9189, test_loss: 1.0891, test_f1: 0.5664
 epoch: 47, train_loss: 0.8623, test_loss: 1.0164, test_f1: 0.5738
 epoch: 48, train_loss: 0.8470, test_loss: 1.0435, test_f1: 0.5783
 epoch: 49, train_loss: 0.8369, test_loss: 1.0611, test_f1: 0.5808
 epoch: 50, train_loss: 0.8301, test_loss: 1.0534, test_f1: 0.5843
 epoch: 51, train_loss: 0.8075, test_loss: 1.1515, test_f1: 0.5779
 epoch: 52, train_loss: 0.7894, test_loss: 1.0546, test_f1: 0.6145
 epoch: 53, train_loss: 0.8030, test_loss: 1.0546, test_f1: 0.6059
 epoch: 54, train_loss: 0.7840, test_loss: 1.0939, test_f1: 0.5818
 epoch: 55, train_loss: 0.7752, test_loss: 1.1364, test_f1: 0.5705
 epoch: 56, train_loss: 0.7777, test_loss: 1.2323, test_f1: 0.5594
 epoch: 57, train_loss: 0.7840, test_loss: 1.2617, test_f1: 0.5781
 epoch: 58, train_loss: 0.7775, test_loss: 1.4603, test_f1: 0.5869
 epoch: 59, train_loss: 0.7728, test_loss: 1.2919, test_f1: 0.5843
 epoch: 60, train_loss: 0.7663, test_loss: 1.1771, test_f1: 0.6186
 epoch: 61, train_loss: 0.7674, test_loss: 1.1339, test_f1: 0.5702
 epoch: 62, train_loss: 0.7519, test_loss: 1.1036, test_f1: 0.5869
 epoch: 63, train_loss: 0.7695, test_loss: 1.1084, test_f1: 0.5832
 epoch: 64, train_loss: 0.7698, test_loss: 1.1284, test_f1: 0.6010
 epoch: 65, train_loss: 0.7686, test_loss: 1.1234, test_f1: 0.5917
 epoch: 66, train_loss: 0.7567, test_loss: 1.0968, test_f1: 0.5804
 epoch: 67, train_loss: 0.7749, test_loss: 1.1928, test_f1: 0.6092
 epoch: 68, train_loss: 0.7588, test_loss: 1.1713, test_f1: 0.5883
 epoch: 69, train_loss: 0.7506, test_loss: 1.1089, test_f1: 0.5845
 epoch: 70, train_loss: 0.7470, test_loss: 1.1652, test_f1: 0.5867
 epoch: 71, train_loss: 0.7457, test_loss: 1.1128, test_f1: 0.5770
 epoch: 72, train_loss: 0.7843, test_loss: 1.0598, test_f1: 0.5921
 epoch: 73, train_loss: 0.7491, test_loss: 1.0859, test_f1: 0.6325
 epoch: 74, train_loss: 0.7466, test_loss: 1.1475, test_f1: 0.5758
 epoch: 75, train_loss: 0.7438, test_loss: 1.1382, test_f1: 0.5891
 epoch: 76, train_loss: 0.7594, test_loss: 1.1645, test_f1: 0.6089
 epoch: 77, train_loss: 0.7434, test_loss: 1.1193, test_f1: 0.5876
 epoch: 78, train_loss: 0.7396, test_loss: 1.1268, test_f1: 0.5656
 epoch: 79, train_loss: 0.7368, test_loss: 1.2591, test_f1: 0.5917
 epoch: 80, train_loss: 0.7419, test_loss: 1.1904, test_f1: 0.6236
 epoch: 81, train_loss: 0.7242, test_loss: 1.0826, test_f1: 0.6063
 epoch: 82, train_loss: 0.7474, test_loss: 1.0575, test_f1: 0.6205
 epoch: 83, train_loss: 0.7222, test_loss: 1.1119, test_f1: 0.6177
 epoch: 84, train_loss: 0.7261, test_loss: 1.2325, test_f1: 0.6000
 epoch: 85, train_loss: 0.7410, test_loss: 1.3547, test_f1: 0.5829
 epoch: 86, train_loss: 0.7228, test_loss: 1.1443, test_f1: 0.6006
 epoch: 87, train_loss: 0.7281, test_loss: 1.0959, test_f1: 0.6097
 epoch: 88, train_loss: 0.7261, test_loss: 1.1113, test_f1: 0.6211
 epoch: 89, train_loss: 0.7303, test_loss: 1.0884, test_f1: 0.6070
 epoch: 90, train_loss: 0.7248, test_loss: 1.1695, test_f1: 0.6201
 epoch: 91, train_loss: 0.7414, test_loss: 1.0871, test_f1: 0.6338
 epoch: 92, train_loss: 0.7143, test_loss: 1.1014, test_f1: 0.6418
 epoch: 93, train_loss: 0.7203, test_loss: 1.1745, test_f1: 0.6306
 epoch: 94, train_loss: 0.7166, test_loss: 1.1725, test_f1: 0.6259
 epoch: 95, train_loss: 0.7204, test_loss: 1.1484, test_f1: 0.6102
 epoch: 96, train_loss: 0.7094, test_loss: 1.0890, test_f1: 0.6532
 epoch: 97, train_loss: 0.6937, test_loss: 1.1910, test_f1: 0.6268
 epoch: 98, train_loss: 0.7156, test_loss: 1.3271, test_f1: 0.6289
 epoch: 99, train_loss: 0.7108, test_loss: 1.2290, test_f1: 0.6214
##################ITERATION #7 ****************************************
 epoch: 0, train_loss: 1.1930, test_loss: 1.0174, test_f1: 0.4934
 epoch: 1, train_loss: 1.0323, test_loss: 1.0367, test_f1: 0.4632
 epoch: 2, train_loss: 1.0043, test_loss: 1.0021, test_f1: 0.4620
 epoch: 3, train_loss: 0.9943, test_loss: 1.0603, test_f1: 0.4481
 epoch: 4, train_loss: 0.9832, test_loss: 0.9963, test_f1: 0.4627
 epoch: 5, train_loss: 0.9759, test_loss: 0.9677, test_f1: 0.4630
 epoch: 6, train_loss: 0.9596, test_loss: 1.0538, test_f1: 0.4516
 epoch: 7, train_loss: 0.9527, test_loss: 1.0154, test_f1: 0.4745
 epoch: 8, train_loss: 0.9462, test_loss: 1.0918, test_f1: 0.4857
 epoch: 9, train_loss: 0.9491, test_loss: 1.0237, test_f1: 0.4756
 epoch: 10, train_loss: 0.9465, test_loss: 1.1000, test_f1: 0.4799
 epoch: 11, train_loss: 0.9420, test_loss: 1.0293, test_f1: 0.4736
 epoch: 12, train_loss: 0.9318, test_loss: 1.0033, test_f1: 0.4772
 epoch: 13, train_loss: 0.9190, test_loss: 0.9946, test_f1: 0.4750
 epoch: 14, train_loss: 0.9205, test_loss: 0.9605, test_f1: 0.4839
 epoch: 15, train_loss: 0.9289, test_loss: 0.9675, test_f1: 0.5099
 epoch: 16, train_loss: 0.9183, test_loss: 1.0060, test_f1: 0.5039
 epoch: 17, train_loss: 0.9122, test_loss: 0.9786, test_f1: 0.4751
 epoch: 18, train_loss: 0.9545, test_loss: 0.9965, test_f1: 0.4687
 epoch: 19, train_loss: 0.9259, test_loss: 1.0392, test_f1: 0.5050
 epoch: 20, train_loss: 0.9125, test_loss: 1.0423, test_f1: 0.5081
 epoch: 21, train_loss: 0.9084, test_loss: 1.0265, test_f1: 0.4853
 epoch: 22, train_loss: 0.8937, test_loss: 1.0086, test_f1: 0.5131
 epoch: 23, train_loss: 0.8942, test_loss: 1.0261, test_f1: 0.5044
 epoch: 24, train_loss: 0.8875, test_loss: 1.0530, test_f1: 0.4694
 epoch: 25, train_loss: 0.9059, test_loss: 0.9836, test_f1: 0.5194
 epoch: 26, train_loss: 0.8850, test_loss: 0.9753, test_f1: 0.5458
 epoch: 27, train_loss: 0.8771, test_loss: 1.0297, test_f1: 0.5252
 epoch: 28, train_loss: 0.8663, test_loss: 0.9870, test_f1: 0.5548
 epoch: 29, train_loss: 0.8799, test_loss: 0.9935, test_f1: 0.5540
 epoch: 30, train_loss: 0.9330, test_loss: 1.1003, test_f1: 0.4978
 epoch: 31, train_loss: 0.9241, test_loss: 1.0764, test_f1: 0.4976
 epoch: 32, train_loss: 0.8993, test_loss: 0.9315, test_f1: 0.5140
 epoch: 33, train_loss: 0.8902, test_loss: 1.0855, test_f1: 0.4938
 epoch: 34, train_loss: 0.8886, test_loss: 0.9812, test_f1: 0.5025
 epoch: 35, train_loss: 0.8712, test_loss: 1.0513, test_f1: 0.5210
 epoch: 36, train_loss: 0.8710, test_loss: 0.9995, test_f1: 0.4891
 epoch: 37, train_loss: 0.8770, test_loss: 1.0562, test_f1: 0.5167
 epoch: 38, train_loss: 0.8641, test_loss: 0.9429, test_f1: 0.5828
 epoch: 39, train_loss: 0.8590, test_loss: 1.0162, test_f1: 0.5344
 epoch: 40, train_loss: 0.8392, test_loss: 0.9975, test_f1: 0.5730
 epoch: 41, train_loss: 0.8527, test_loss: 0.9727, test_f1: 0.5461
 epoch: 42, train_loss: 0.8360, test_loss: 0.9812, test_f1: 0.5741
 epoch: 43, train_loss: 0.8358, test_loss: 1.0268, test_f1: 0.5943
 epoch: 44, train_loss: 0.8330, test_loss: 1.0172, test_f1: 0.5859
 epoch: 45, train_loss: 0.8269, test_loss: 1.0600, test_f1: 0.5310
 epoch: 46, train_loss: 0.8260, test_loss: 1.0232, test_f1: 0.5911
 epoch: 47, train_loss: 0.8248, test_loss: 1.0260, test_f1: 0.5796
 epoch: 48, train_loss: 0.8196, test_loss: 1.1001, test_f1: 0.5576
 epoch: 49, train_loss: 0.8139, test_loss: 1.1011, test_f1: 0.6035
 epoch: 50, train_loss: 0.8126, test_loss: 1.0831, test_f1: 0.5845
 epoch: 51, train_loss: 0.7925, test_loss: 1.0563, test_f1: 0.6123
 epoch: 52, train_loss: 0.7645, test_loss: 1.0423, test_f1: 0.6137
 epoch: 53, train_loss: 0.7747, test_loss: 1.0631, test_f1: 0.6240
 epoch: 54, train_loss: 0.7755, test_loss: 1.0581, test_f1: 0.5879
 epoch: 55, train_loss: 0.7595, test_loss: 1.0357, test_f1: 0.6301
 epoch: 56, train_loss: 0.7644, test_loss: 1.0701, test_f1: 0.6477
 epoch: 57, train_loss: 0.7646, test_loss: 1.1070, test_f1: 0.5789
 epoch: 58, train_loss: 0.7710, test_loss: 1.0278, test_f1: 0.6205
 epoch: 59, train_loss: 0.7601, test_loss: 1.0780, test_f1: 0.5874
 epoch: 60, train_loss: 0.7587, test_loss: 1.0605, test_f1: 0.6154
 epoch: 61, train_loss: 0.7472, test_loss: 1.1455, test_f1: 0.6309
 epoch: 62, train_loss: 0.7616, test_loss: 1.0684, test_f1: 0.6388
 epoch: 63, train_loss: 0.7534, test_loss: 1.1423, test_f1: 0.6451
 epoch: 64, train_loss: 0.7676, test_loss: 0.9974, test_f1: 0.6269
 epoch: 65, train_loss: 0.7527, test_loss: 0.9265, test_f1: 0.6514
 epoch: 66, train_loss: 0.7486, test_loss: 1.0114, test_f1: 0.6410
 epoch: 67, train_loss: 0.7521, test_loss: 1.0391, test_f1: 0.6472
 epoch: 68, train_loss: 0.7517, test_loss: 1.0795, test_f1: 0.6321
 epoch: 69, train_loss: 0.7317, test_loss: 1.0221, test_f1: 0.6482
 epoch: 70, train_loss: 0.7302, test_loss: 1.0473, test_f1: 0.6109
 epoch: 71, train_loss: 0.7381, test_loss: 1.0933, test_f1: 0.6148
 epoch: 72, train_loss: 0.7333, test_loss: 1.0684, test_f1: 0.6260
 epoch: 73, train_loss: 0.7344, test_loss: 0.9811, test_f1: 0.6471
 epoch: 74, train_loss: 0.7372, test_loss: 1.0850, test_f1: 0.6422
 epoch: 75, train_loss: 0.7387, test_loss: 1.0303, test_f1: 0.6460
 epoch: 76, train_loss: 0.7140, test_loss: 1.0525, test_f1: 0.6524
 epoch: 77, train_loss: 0.7312, test_loss: 1.0854, test_f1: 0.6338
 epoch: 78, train_loss: 0.7304, test_loss: 1.1307, test_f1: 0.6527
 epoch: 79, train_loss: 0.7263, test_loss: 1.1687, test_f1: 0.6375
 epoch: 80, train_loss: 0.7244, test_loss: 1.1538, test_f1: 0.6184
 epoch: 81, train_loss: 0.7130, test_loss: 1.1559, test_f1: 0.6270
 epoch: 82, train_loss: 0.7262, test_loss: 1.0827, test_f1: 0.6196
 epoch: 83, train_loss: 0.7160, test_loss: 1.1985, test_f1: 0.6566
 epoch: 84, train_loss: 0.7162, test_loss: 1.1238, test_f1: 0.6334
 epoch: 85, train_loss: 0.7237, test_loss: 1.1106, test_f1: 0.6336
 epoch: 86, train_loss: 0.7210, test_loss: 1.2249, test_f1: 0.6506
 epoch: 87, train_loss: 0.7035, test_loss: 1.1748, test_f1: 0.6354
 epoch: 88, train_loss: 0.7297, test_loss: 1.1124, test_f1: 0.6431
 epoch: 89, train_loss: 0.7220, test_loss: 1.1636, test_f1: 0.6402
 epoch: 90, train_loss: 0.7056, test_loss: 1.1331, test_f1: 0.6285
 epoch: 91, train_loss: 0.7036, test_loss: 1.1062, test_f1: 0.6504
 epoch: 92, train_loss: 0.7021, test_loss: 1.1216, test_f1: 0.6355
 epoch: 93, train_loss: 0.7002, test_loss: 1.1449, test_f1: 0.6512
 epoch: 94, train_loss: 0.7070, test_loss: 1.2037, test_f1: 0.6633
 epoch: 95, train_loss: 0.6984, test_loss: 1.1629, test_f1: 0.6228
 epoch: 96, train_loss: 0.7069, test_loss: 1.1992, test_f1: 0.6581
 epoch: 97, train_loss: 0.7106, test_loss: 1.0932, test_f1: 0.6408
 epoch: 98, train_loss: 0.7088, test_loss: 1.1275, test_f1: 0.6365
 epoch: 99, train_loss: 0.7048, test_loss: 1.1206, test_f1: 0.6506
##################ITERATION #8 ****************************************
 epoch: 0, train_loss: 1.1907, test_loss: 1.1400, test_f1: 0.4171
 epoch: 1, train_loss: 1.0712, test_loss: 1.1008, test_f1: 0.4582
 epoch: 2, train_loss: 1.0041, test_loss: 0.9979, test_f1: 0.4542
 epoch: 3, train_loss: 0.9978, test_loss: 0.9931, test_f1: 0.4974
 epoch: 4, train_loss: 0.9749, test_loss: 1.0349, test_f1: 0.4642
 epoch: 5, train_loss: 0.9732, test_loss: 0.9559, test_f1: 0.4830
 epoch: 6, train_loss: 0.9575, test_loss: 0.9786, test_f1: 0.4784
 epoch: 7, train_loss: 0.9413, test_loss: 0.9239, test_f1: 0.4811
 epoch: 8, train_loss: 0.9506, test_loss: 1.0280, test_f1: 0.4958
 epoch: 9, train_loss: 0.9454, test_loss: 0.9898, test_f1: 0.5312
 epoch: 10, train_loss: 0.9176, test_loss: 0.9360, test_f1: 0.4911
 epoch: 11, train_loss: 0.9316, test_loss: 1.0207, test_f1: 0.4973
 epoch: 12, train_loss: 0.9301, test_loss: 0.9608, test_f1: 0.4950
 epoch: 13, train_loss: 0.9144, test_loss: 0.9922, test_f1: 0.4920
 epoch: 14, train_loss: 0.9112, test_loss: 0.9944, test_f1: 0.5013
 epoch: 15, train_loss: 0.9091, test_loss: 1.0170, test_f1: 0.4932
 epoch: 16, train_loss: 0.9252, test_loss: 1.0188, test_f1: 0.5179
 epoch: 17, train_loss: 0.9079, test_loss: 0.9911, test_f1: 0.5234
 epoch: 18, train_loss: 0.8855, test_loss: 0.9728, test_f1: 0.5190
 epoch: 19, train_loss: 0.8997, test_loss: 0.9792, test_f1: 0.4847
 epoch: 20, train_loss: 0.8979, test_loss: 0.9720, test_f1: 0.5072
 epoch: 21, train_loss: 0.8918, test_loss: 0.9733, test_f1: 0.5474
 epoch: 22, train_loss: 0.8777, test_loss: 0.9908, test_f1: 0.5581
 epoch: 23, train_loss: 0.8469, test_loss: 1.0282, test_f1: 0.5619
 epoch: 24, train_loss: 0.8743, test_loss: 0.9673, test_f1: 0.5636
 epoch: 25, train_loss: 0.8637, test_loss: 0.9618, test_f1: 0.5172
 epoch: 26, train_loss: 0.8587, test_loss: 0.9588, test_f1: 0.5632
 epoch: 27, train_loss: 0.8796, test_loss: 0.9419, test_f1: 0.5465
 epoch: 28, train_loss: 0.8486, test_loss: 0.9107, test_f1: 0.5967
 epoch: 29, train_loss: 0.8371, test_loss: 1.0186, test_f1: 0.5073
 epoch: 30, train_loss: 0.8670, test_loss: 0.9581, test_f1: 0.5693
 epoch: 31, train_loss: 0.8385, test_loss: 0.9421, test_f1: 0.5541
 epoch: 32, train_loss: 0.8359, test_loss: 0.9472, test_f1: 0.5503
 epoch: 33, train_loss: 0.8289, test_loss: 0.9164, test_f1: 0.5523
 epoch: 34, train_loss: 0.8298, test_loss: 0.9144, test_f1: 0.5172
 epoch: 35, train_loss: 0.8205, test_loss: 0.9014, test_f1: 0.5532
 epoch: 36, train_loss: 0.8196, test_loss: 0.9329, test_f1: 0.5795
 epoch: 37, train_loss: 0.8095, test_loss: 0.9907, test_f1: 0.5638
 epoch: 38, train_loss: 0.8314, test_loss: 0.9312, test_f1: 0.5541
 epoch: 39, train_loss: 0.8131, test_loss: 0.8945, test_f1: 0.6125
 epoch: 40, train_loss: 0.8062, test_loss: 0.9327, test_f1: 0.6330
 epoch: 41, train_loss: 0.8120, test_loss: 0.9560, test_f1: 0.5941
 epoch: 42, train_loss: 0.8012, test_loss: 0.9919, test_f1: 0.5719
 epoch: 43, train_loss: 0.7995, test_loss: 0.9076, test_f1: 0.6005
 epoch: 44, train_loss: 0.7933, test_loss: 0.9246, test_f1: 0.5558
 epoch: 45, train_loss: 0.8036, test_loss: 0.9017, test_f1: 0.5869
 epoch: 46, train_loss: 0.7849, test_loss: 0.8811, test_f1: 0.6175
 epoch: 47, train_loss: 0.7957, test_loss: 0.8907, test_f1: 0.5718
 epoch: 48, train_loss: 0.7903, test_loss: 0.9900, test_f1: 0.5764
 epoch: 49, train_loss: 0.8134, test_loss: 0.9215, test_f1: 0.5770
 epoch: 50, train_loss: 0.7938, test_loss: 0.9019, test_f1: 0.6285
 epoch: 51, train_loss: 0.7668, test_loss: 0.8957, test_f1: 0.5984
 epoch: 52, train_loss: 0.7375, test_loss: 0.9410, test_f1: 0.6116
 epoch: 53, train_loss: 0.7445, test_loss: 0.9265, test_f1: 0.5972
 epoch: 54, train_loss: 0.7443, test_loss: 0.9039, test_f1: 0.6198
 epoch: 55, train_loss: 0.7327, test_loss: 0.9348, test_f1: 0.6078
 epoch: 56, train_loss: 0.7261, test_loss: 0.9594, test_f1: 0.6155
 epoch: 57, train_loss: 0.7218, test_loss: 0.9960, test_f1: 0.5960
 epoch: 58, train_loss: 0.7297, test_loss: 0.9764, test_f1: 0.6517
 epoch: 59, train_loss: 0.7238, test_loss: 1.0226, test_f1: 0.5842
 epoch: 60, train_loss: 0.7249, test_loss: 0.9827, test_f1: 0.6055
 epoch: 61, train_loss: 0.7163, test_loss: 0.9510, test_f1: 0.6036
 epoch: 62, train_loss: 0.7066, test_loss: 0.9858, test_f1: 0.6128
 epoch: 63, train_loss: 0.7154, test_loss: 1.0034, test_f1: 0.5992
 epoch: 64, train_loss: 0.7131, test_loss: 1.0065, test_f1: 0.6345
 epoch: 65, train_loss: 0.7067, test_loss: 1.0051, test_f1: 0.6080
 epoch: 66, train_loss: 0.7186, test_loss: 0.9996, test_f1: 0.6220
 epoch: 67, train_loss: 0.7060, test_loss: 1.0323, test_f1: 0.6154
 epoch: 68, train_loss: 0.7029, test_loss: 1.0105, test_f1: 0.6356
 epoch: 69, train_loss: 0.6913, test_loss: 0.9737, test_f1: 0.6501
 epoch: 70, train_loss: 0.7157, test_loss: 0.9358, test_f1: 0.6467
 epoch: 71, train_loss: 0.6850, test_loss: 0.9936, test_f1: 0.6321
 epoch: 72, train_loss: 0.7109, test_loss: 1.0478, test_f1: 0.6283
 epoch: 73, train_loss: 0.6954, test_loss: 0.9799, test_f1: 0.6487
 epoch: 74, train_loss: 0.7098, test_loss: 0.9614, test_f1: 0.6286
 epoch: 75, train_loss: 0.6826, test_loss: 1.0118, test_f1: 0.6099
 epoch: 76, train_loss: 0.7023, test_loss: 0.9751, test_f1: 0.6621
 epoch: 77, train_loss: 0.6892, test_loss: 0.9917, test_f1: 0.6056
 epoch: 78, train_loss: 0.6927, test_loss: 0.9716, test_f1: 0.6206
 epoch: 79, train_loss: 0.6911, test_loss: 1.0822, test_f1: 0.6200
 epoch: 80, train_loss: 0.7007, test_loss: 1.0754, test_f1: 0.6149
 epoch: 81, train_loss: 0.6813, test_loss: 0.9598, test_f1: 0.6384
 epoch: 82, train_loss: 0.6822, test_loss: 1.0218, test_f1: 0.6035
 epoch: 83, train_loss: 0.7013, test_loss: 0.9549, test_f1: 0.6407
 epoch: 84, train_loss: 0.6858, test_loss: 0.8877, test_f1: 0.6388
 epoch: 85, train_loss: 0.7040, test_loss: 1.0426, test_f1: 0.6196
 epoch: 86, train_loss: 0.6955, test_loss: 1.0394, test_f1: 0.6119
 epoch: 87, train_loss: 0.6773, test_loss: 1.0264, test_f1: 0.6368
 epoch: 88, train_loss: 0.6801, test_loss: 0.9735, test_f1: 0.6022
 epoch: 89, train_loss: 0.6753, test_loss: 0.9858, test_f1: 0.6446
 epoch: 90, train_loss: 0.6577, test_loss: 1.0253, test_f1: 0.6293
 epoch: 91, train_loss: 0.6709, test_loss: 1.0900, test_f1: 0.6305
 epoch: 92, train_loss: 0.6679, test_loss: 0.9803, test_f1: 0.6467
 epoch: 93, train_loss: 0.6774, test_loss: 1.0431, test_f1: 0.6177
 epoch: 94, train_loss: 0.6808, test_loss: 1.0433, test_f1: 0.6219
 epoch: 95, train_loss: 0.7209, test_loss: 0.9804, test_f1: 0.6576
 epoch: 96, train_loss: 0.7146, test_loss: 1.0182, test_f1: 0.6008
 epoch: 97, train_loss: 0.6853, test_loss: 1.0125, test_f1: 0.6174
 epoch: 98, train_loss: 0.6870, test_loss: 0.9853, test_f1: 0.6217
 epoch: 99, train_loss: 0.6590, test_loss: 1.0570, test_f1: 0.6269
##################ITERATION #9 ****************************************
 epoch: 0, train_loss: 1.1928, test_loss: 1.0288, test_f1: 0.4949
 epoch: 1, train_loss: 1.0466, test_loss: 1.0460, test_f1: 0.4480
 epoch: 2, train_loss: 1.0234, test_loss: 1.0144, test_f1: 0.4774
 epoch: 3, train_loss: 1.0083, test_loss: 1.0386, test_f1: 0.4706
 epoch: 4, train_loss: 0.9929, test_loss: 1.0010, test_f1: 0.4865
 epoch: 5, train_loss: 0.9853, test_loss: 1.0476, test_f1: 0.4814
 epoch: 6, train_loss: 0.9811, test_loss: 0.9673, test_f1: 0.5266
 epoch: 7, train_loss: 0.9732, test_loss: 0.9461, test_f1: 0.4831
 epoch: 8, train_loss: 0.9688, test_loss: 1.0012, test_f1: 0.4932
 epoch: 9, train_loss: 0.9532, test_loss: 1.0399, test_f1: 0.5234
 epoch: 10, train_loss: 0.9688, test_loss: 0.9467, test_f1: 0.4851
 epoch: 11, train_loss: 0.9598, test_loss: 0.9046, test_f1: 0.5767
 epoch: 12, train_loss: 0.9489, test_loss: 0.9676, test_f1: 0.5309
 epoch: 13, train_loss: 0.9508, test_loss: 0.9597, test_f1: 0.5154
 epoch: 14, train_loss: 0.9363, test_loss: 0.9495, test_f1: 0.4555
 epoch: 15, train_loss: 0.9296, test_loss: 0.9410, test_f1: 0.4739
 epoch: 16, train_loss: 0.9302, test_loss: 0.9636, test_f1: 0.5281
 epoch: 17, train_loss: 0.9028, test_loss: 0.9822, test_f1: 0.5380
 epoch: 18, train_loss: 0.9086, test_loss: 0.9086, test_f1: 0.5371
 epoch: 19, train_loss: 0.9137, test_loss: 1.0229, test_f1: 0.4817
 epoch: 20, train_loss: 0.9045, test_loss: 0.9493, test_f1: 0.4874
 epoch: 21, train_loss: 0.8904, test_loss: 1.0143, test_f1: 0.4909
 epoch: 22, train_loss: 0.8903, test_loss: 0.8928, test_f1: 0.5706
 epoch: 23, train_loss: 0.8955, test_loss: 0.9065, test_f1: 0.5175
 epoch: 24, train_loss: 0.8884, test_loss: 0.9377, test_f1: 0.5384
 epoch: 25, train_loss: 0.8835, test_loss: 0.9574, test_f1: 0.5012
 epoch: 26, train_loss: 0.8865, test_loss: 0.9752, test_f1: 0.4902
 epoch: 27, train_loss: 0.8780, test_loss: 0.8959, test_f1: 0.5151
 epoch: 28, train_loss: 0.8859, test_loss: 0.9607, test_f1: 0.4983
 epoch: 29, train_loss: 0.8904, test_loss: 0.9716, test_f1: 0.4957
 epoch: 30, train_loss: 0.8937, test_loss: 0.9593, test_f1: 0.5132
 epoch: 31, train_loss: 0.8763, test_loss: 1.0040, test_f1: 0.4679
 epoch: 32, train_loss: 0.8925, test_loss: 0.9550, test_f1: 0.5683
 epoch: 33, train_loss: 0.8773, test_loss: 1.0081, test_f1: 0.5078
 epoch: 34, train_loss: 0.8745, test_loss: 0.9155, test_f1: 0.5403
 epoch: 35, train_loss: 0.8696, test_loss: 0.9678, test_f1: 0.5578
 epoch: 36, train_loss: 0.8679, test_loss: 0.9049, test_f1: 0.4914
 epoch: 37, train_loss: 0.8544, test_loss: 1.0065, test_f1: 0.4764
 epoch: 38, train_loss: 0.8515, test_loss: 0.9171, test_f1: 0.5217
 epoch: 39, train_loss: 0.8522, test_loss: 0.8842, test_f1: 0.5576
 epoch: 40, train_loss: 0.8496, test_loss: 0.9684, test_f1: 0.5019
 epoch: 41, train_loss: 0.8530, test_loss: 0.8732, test_f1: 0.5750
 epoch: 42, train_loss: 0.8560, test_loss: 0.9079, test_f1: 0.5039
 epoch: 43, train_loss: 0.8494, test_loss: 0.9100, test_f1: 0.5408
 epoch: 44, train_loss: 0.8492, test_loss: 0.9099, test_f1: 0.5124
 epoch: 45, train_loss: 0.8419, test_loss: 0.9361, test_f1: 0.5263
 epoch: 46, train_loss: 0.8335, test_loss: 0.9910, test_f1: 0.4999
 epoch: 47, train_loss: 0.8603, test_loss: 0.9767, test_f1: 0.5306
 epoch: 48, train_loss: 0.8522, test_loss: 0.9241, test_f1: 0.5180
 epoch: 49, train_loss: 0.8353, test_loss: 0.9188, test_f1: 0.4976
 epoch: 50, train_loss: 0.8298, test_loss: 0.9258, test_f1: 0.4933
 epoch: 51, train_loss: 0.8168, test_loss: 0.8910, test_f1: 0.5878
 epoch: 52, train_loss: 0.8257, test_loss: 0.9462, test_f1: 0.5119
 epoch: 53, train_loss: 0.7954, test_loss: 0.9285, test_f1: 0.5716
 epoch: 54, train_loss: 0.7968, test_loss: 0.9438, test_f1: 0.5335
 epoch: 55, train_loss: 0.7958, test_loss: 0.9185, test_f1: 0.5319
 epoch: 56, train_loss: 0.7941, test_loss: 0.8923, test_f1: 0.5953
 epoch: 57, train_loss: 0.7937, test_loss: 0.9241, test_f1: 0.5801
 epoch: 58, train_loss: 0.7868, test_loss: 0.9067, test_f1: 0.5585
 epoch: 59, train_loss: 0.7864, test_loss: 0.9306, test_f1: 0.5934
 epoch: 60, train_loss: 0.7712, test_loss: 0.9080, test_f1: 0.5953
 epoch: 61, train_loss: 0.7937, test_loss: 0.9579, test_f1: 0.5329
 epoch: 62, train_loss: 0.7696, test_loss: 0.9101, test_f1: 0.5276
 epoch: 63, train_loss: 0.7664, test_loss: 0.8973, test_f1: 0.6137
 epoch: 64, train_loss: 0.7788, test_loss: 0.9582, test_f1: 0.6030
 epoch: 65, train_loss: 0.7625, test_loss: 1.0133, test_f1: 0.6136
 epoch: 66, train_loss: 0.7763, test_loss: 1.0209, test_f1: 0.6006
 epoch: 67, train_loss: 0.7621, test_loss: 0.9719, test_f1: 0.6066
 epoch: 68, train_loss: 0.7632, test_loss: 1.0008, test_f1: 0.5915
 epoch: 69, train_loss: 0.7725, test_loss: 0.9946, test_f1: 0.5770
 epoch: 70, train_loss: 0.7531, test_loss: 0.9662, test_f1: 0.5889
 epoch: 71, train_loss: 0.7631, test_loss: 0.9425, test_f1: 0.5717
 epoch: 72, train_loss: 0.7452, test_loss: 0.8972, test_f1: 0.5969
 epoch: 73, train_loss: 0.7552, test_loss: 0.9256, test_f1: 0.6013
 epoch: 74, train_loss: 0.7611, test_loss: 1.0164, test_f1: 0.5725
 epoch: 75, train_loss: 0.7756, test_loss: 0.9636, test_f1: 0.5846
 epoch: 76, train_loss: 0.7506, test_loss: 0.8419, test_f1: 0.6209
 epoch: 77, train_loss: 0.7444, test_loss: 0.9615, test_f1: 0.6160
 epoch: 78, train_loss: 0.7458, test_loss: 0.9092, test_f1: 0.6274
 epoch: 79, train_loss: 0.7461, test_loss: 0.8659, test_f1: 0.6069
 epoch: 80, train_loss: 0.7444, test_loss: 0.8515, test_f1: 0.6013
 epoch: 81, train_loss: 0.7386, test_loss: 0.9021, test_f1: 0.6035
 epoch: 82, train_loss: 0.7515, test_loss: 0.8456, test_f1: 0.6295
 epoch: 83, train_loss: 0.7568, test_loss: 0.8792, test_f1: 0.6300
 epoch: 84, train_loss: 0.7363, test_loss: 0.9080, test_f1: 0.6153
 epoch: 85, train_loss: 0.7484, test_loss: 0.8526, test_f1: 0.5791
 epoch: 86, train_loss: 0.7565, test_loss: 0.9091, test_f1: 0.6328
 epoch: 87, train_loss: 0.7526, test_loss: 0.8996, test_f1: 0.6084
 epoch: 88, train_loss: 0.7421, test_loss: 0.8609, test_f1: 0.6332
 epoch: 89, train_loss: 0.7313, test_loss: 0.8771, test_f1: 0.6183
 epoch: 90, train_loss: 0.7322, test_loss: 0.9300, test_f1: 0.6377
 epoch: 91, train_loss: 0.7440, test_loss: 0.8908, test_f1: 0.6319
 epoch: 92, train_loss: 0.7416, test_loss: 0.8976, test_f1: 0.6060
 epoch: 93, train_loss: 0.7309, test_loss: 0.8601, test_f1: 0.6410
 epoch: 94, train_loss: 0.7210, test_loss: 0.9453, test_f1: 0.6125
 epoch: 95, train_loss: 0.7246, test_loss: 0.9326, test_f1: 0.6101
 epoch: 96, train_loss: 0.7126, test_loss: 0.9037, test_f1: 0.6263
 epoch: 97, train_loss: 0.7244, test_loss: 0.8860, test_f1: 0.6375
 epoch: 98, train_loss: 0.7150, test_loss: 0.8845, test_f1: 0.6062
 epoch: 99, train_loss: 0.7291, test_loss: 0.9097, test_f1: 0.6361

Training completed in 1119.24 seconds
Best F1: 0.6639 at epoch 93
Mean F1 across iterations: 0.6516  0.0096
========================FINAL RESULTS================================
FEGIN weighted F1: 0.6639  0.0096
python main.py --data ltspice_examples --representation component_net --model FEGIN --layers 4 --hiddens 32 --batch_size 32 --lr 0.01 --emb_size 128 --epochs 100 --save_appendix component_net_L4_H32_BS32_LR0.01_E128 --no_val
-----



STDERR:
  File "main.py", line 370, in <module>
    main()
  File "main.py", line 254, in main
    dataset = dataset_class(
  File "/home/philip/projects/ltspice_examples_code_repo/Circuit-Completion-Using-GNNs/component_classification_with_link_prediction_head/evaluation/FEGIN/kernel/circuit_datasets.py", line 15, in __init__
    self.data, self.slices = torch.load(self.processed_paths[0])
  File "/home/philip/.local/lib/python3.8/site-packages/torch/serialization.py", line 1040, in load
    warnings.warn(
  File "/usr/lib/python3.8/warnings.py", line 109, in _showwarnmsg
    sw(msg.message, msg.category, msg.filename, msg.lineno,
  File "main.py", line 47, in warn_with_traceback
    traceback.print_stack(file=log)
/home/philip/projects/ltspice_examples_code_repo/Circuit-Completion-Using-GNNs/component_classification_with_link_prediction_head/evaluation/FEGIN/kernel/circuit_datasets.py:15: FutureWarning: You are using `torch.load` with `weights_only=False` (the current default value), which uses the default pickle module implicitly. It is possible to construct malicious pickle data which will execute arbitrary code during unpickling (See https://github.com/pytorch/pytorch/blob/main/SECURITY.md#untrusted-models for more details). In a future release, the default value for `weights_only` will be flipped to `True`. This limits the functions that could be executed during unpickling. Arbitrary objects will no longer be allowed to be loaded via this mode unless they are explicitly allowlisted by the user via `torch.serialization.add_safe_globals`. We recommend you start setting `weights_only=True` for any use case where you don't have full control of the loaded file. Please open an issue on GitHub for any issues related to this experimental feature.
  self.data, self.slices = torch.load(self.processed_paths[0])
