STDOUT:
Results will be saved in /home/philip/projects/ltspice_examples_code_repo/Circuit-Completion-Using-GNNs/component_classification_with_link_prediction_head/evaluation/FEGIN/results/model_FEGIN_dataset_ltspice_demos
Command line input: python main.py --data ltspice_demos --representation component_pin --model FEGIN --layers 5 --hiddens 64 --batch_size 128 --lr 0.001 --emb_size 250 --epochs 100 --save_appendix component_pin_L5_H64_BS128_LR0.001_E250 --no_val
 is saved.
-----
ltspice_demos - FEGIN
Using 5 layers, 64 hidden units, h = 2
Loading component_pin representation dataset
ENTERED
Training FEGIN on component_pin representation
Train: 1565, Test: 383
##################ITERATION #0 ****************************************
 epoch: 0, train_loss: 1.3561, test_loss: 1.3414, test_f1: 0.1365
 epoch: 1, train_loss: 1.2283, test_loss: 1.2973, test_f1: 0.3438
 epoch: 2, train_loss: 1.1570, test_loss: 1.2687, test_f1: 0.3350
 epoch: 3, train_loss: 1.1247, test_loss: 1.2334, test_f1: 0.3787
 epoch: 4, train_loss: 1.0822, test_loss: 1.2068, test_f1: 0.4228
 epoch: 5, train_loss: 1.0428, test_loss: 1.1520, test_f1: 0.4348
 epoch: 6, train_loss: 0.9965, test_loss: 1.0695, test_f1: 0.4646
 epoch: 7, train_loss: 0.9406, test_loss: 1.0227, test_f1: 0.4728
 epoch: 8, train_loss: 0.9166, test_loss: 1.0612, test_f1: 0.5044
 epoch: 9, train_loss: 0.8930, test_loss: 1.1629, test_f1: 0.5276
 epoch: 10, train_loss: 0.8524, test_loss: 1.0534, test_f1: 0.5280
 epoch: 11, train_loss: 0.8480, test_loss: 1.1042, test_f1: 0.5366
 epoch: 12, train_loss: 0.8156, test_loss: 1.0719, test_f1: 0.5487
 epoch: 13, train_loss: 0.8000, test_loss: 1.1450, test_f1: 0.4777
 epoch: 14, train_loss: 0.7777, test_loss: 0.9995, test_f1: 0.5743
 epoch: 15, train_loss: 0.7606, test_loss: 1.0914, test_f1: 0.5237
 epoch: 16, train_loss: 0.7293, test_loss: 1.0834, test_f1: 0.5699
 epoch: 17, train_loss: 0.7124, test_loss: 1.1084, test_f1: 0.5548
 epoch: 18, train_loss: 0.7071, test_loss: 1.2882, test_f1: 0.5417
 epoch: 19, train_loss: 0.6866, test_loss: 1.0728, test_f1: 0.5918
 epoch: 20, train_loss: 0.6966, test_loss: 1.0012, test_f1: 0.5859
 epoch: 21, train_loss: 0.6656, test_loss: 1.0775, test_f1: 0.5738
 epoch: 22, train_loss: 0.6803, test_loss: 1.0670, test_f1: 0.5417
 epoch: 23, train_loss: 0.6422, test_loss: 1.2544, test_f1: 0.4834
 epoch: 24, train_loss: 0.6390, test_loss: 1.0398, test_f1: 0.5547
 epoch: 25, train_loss: 0.6275, test_loss: 1.1104, test_f1: 0.5796
 epoch: 26, train_loss: 0.6245, test_loss: 1.0238, test_f1: 0.5894
 epoch: 27, train_loss: 0.6250, test_loss: 1.0220, test_f1: 0.5985
 epoch: 28, train_loss: 0.6060, test_loss: 1.0067, test_f1: 0.6105
 epoch: 29, train_loss: 0.5898, test_loss: 1.0226, test_f1: 0.5755
 epoch: 30, train_loss: 0.5602, test_loss: 1.0535, test_f1: 0.5900
 epoch: 31, train_loss: 0.5785, test_loss: 1.1371, test_f1: 0.5746
 epoch: 32, train_loss: 0.5754, test_loss: 1.0722, test_f1: 0.5857
 epoch: 33, train_loss: 0.5421, test_loss: 1.0922, test_f1: 0.5907
 epoch: 34, train_loss: 0.5277, test_loss: 1.2232, test_f1: 0.5419
 epoch: 35, train_loss: 0.5617, test_loss: 1.0780, test_f1: 0.6098
 epoch: 36, train_loss: 0.5160, test_loss: 1.0530, test_f1: 0.6124
 epoch: 37, train_loss: 0.5065, test_loss: 1.1457, test_f1: 0.6273
 epoch: 38, train_loss: 0.5202, test_loss: 1.2818, test_f1: 0.5503
 epoch: 39, train_loss: 0.5010, test_loss: 1.1701, test_f1: 0.6035
 epoch: 40, train_loss: 0.5000, test_loss: 1.2590, test_f1: 0.5535
 epoch: 41, train_loss: 0.4891, test_loss: 1.2298, test_f1: 0.6034
 epoch: 42, train_loss: 0.4749, test_loss: 1.1657, test_f1: 0.5977
 epoch: 43, train_loss: 0.4243, test_loss: 1.1764, test_f1: 0.6324
 epoch: 44, train_loss: 0.4016, test_loss: 1.2731, test_f1: 0.5747
 epoch: 45, train_loss: 0.4612, test_loss: 1.2169, test_f1: 0.6221
 epoch: 46, train_loss: 0.4877, test_loss: 1.2704, test_f1: 0.6153
 epoch: 47, train_loss: 0.4199, test_loss: 1.2364, test_f1: 0.6335
 epoch: 48, train_loss: 0.4191, test_loss: 1.2839, test_f1: 0.6378
 epoch: 49, train_loss: 0.4403, test_loss: 1.3396, test_f1: 0.5934
 epoch: 50, train_loss: 0.4152, test_loss: 1.3212, test_f1: 0.6303
 epoch: 51, train_loss: 0.3623, test_loss: 1.3816, test_f1: 0.6428
 epoch: 52, train_loss: 0.3415, test_loss: 1.3137, test_f1: 0.5968
 epoch: 53, train_loss: 0.3397, test_loss: 1.3279, test_f1: 0.6197
 epoch: 54, train_loss: 0.3237, test_loss: 1.3704, test_f1: 0.5889
 epoch: 55, train_loss: 0.3037, test_loss: 1.3421, test_f1: 0.6228
 epoch: 56, train_loss: 0.2925, test_loss: 1.3640, test_f1: 0.6021
 epoch: 57, train_loss: 0.2808, test_loss: 1.4348, test_f1: 0.5889
 epoch: 58, train_loss: 0.2753, test_loss: 1.4806, test_f1: 0.5917
 epoch: 59, train_loss: 0.2542, test_loss: 1.3978, test_f1: 0.6338
 epoch: 60, train_loss: 0.2670, test_loss: 1.4821, test_f1: 0.6350
 epoch: 61, train_loss: 0.2648, test_loss: 1.4715, test_f1: 0.6402
 epoch: 62, train_loss: 0.2499, test_loss: 1.5175, test_f1: 0.6307
 epoch: 63, train_loss: 0.2411, test_loss: 1.5252, test_f1: 0.6145
 epoch: 64, train_loss: 0.2487, test_loss: 1.5174, test_f1: 0.6112
 epoch: 65, train_loss: 0.2694, test_loss: 1.7666, test_f1: 0.5985
 epoch: 66, train_loss: 0.2575, test_loss: 1.5314, test_f1: 0.6197
 epoch: 67, train_loss: 0.2412, test_loss: 1.5378, test_f1: 0.6259
 epoch: 68, train_loss: 0.2278, test_loss: 1.6215, test_f1: 0.6330
 epoch: 69, train_loss: 0.2218, test_loss: 1.5080, test_f1: 0.6624
 epoch: 70, train_loss: 0.2568, test_loss: 1.6170, test_f1: 0.6134
 epoch: 71, train_loss: 0.2179, test_loss: 1.5288, test_f1: 0.6209
 epoch: 72, train_loss: 0.2311, test_loss: 1.6649, test_f1: 0.6228
 epoch: 73, train_loss: 0.2244, test_loss: 1.6628, test_f1: 0.6305
 epoch: 74, train_loss: 0.2078, test_loss: 1.5680, test_f1: 0.6462
 epoch: 75, train_loss: 0.1917, test_loss: 1.5912, test_f1: 0.6141
 epoch: 76, train_loss: 0.1868, test_loss: 1.6961, test_f1: 0.6446
 epoch: 77, train_loss: 0.1865, test_loss: 1.6987, test_f1: 0.6280
 epoch: 78, train_loss: 0.1920, test_loss: 1.7557, test_f1: 0.6402
 epoch: 79, train_loss: 0.1997, test_loss: 1.7103, test_f1: 0.6336
 epoch: 80, train_loss: 0.2234, test_loss: 1.7948, test_f1: 0.6194
 epoch: 81, train_loss: 0.2242, test_loss: 1.6299, test_f1: 0.6007
 epoch: 82, train_loss: 0.2126, test_loss: 1.6481, test_f1: 0.6095
 epoch: 83, train_loss: 0.2097, test_loss: 1.9028, test_f1: 0.6353
 epoch: 84, train_loss: 0.2085, test_loss: 1.7563, test_f1: 0.6383
 epoch: 85, train_loss: 0.1971, test_loss: 1.7205, test_f1: 0.6272
 epoch: 86, train_loss: 0.2083, test_loss: 1.8033, test_f1: 0.6084
 epoch: 87, train_loss: 0.2247, test_loss: 1.9379, test_f1: 0.5632
 epoch: 88, train_loss: 0.2162, test_loss: 1.7258, test_f1: 0.5858
 epoch: 89, train_loss: 0.2125, test_loss: 1.7890, test_f1: 0.6258
 epoch: 90, train_loss: 0.1964, test_loss: 1.9051, test_f1: 0.5944
 epoch: 91, train_loss: 0.1894, test_loss: 1.8150, test_f1: 0.5913
 epoch: 92, train_loss: 0.1608, test_loss: 1.8261, test_f1: 0.5776
 epoch: 93, train_loss: 0.1882, test_loss: 1.8630, test_f1: 0.6358
 epoch: 94, train_loss: 0.2125, test_loss: 2.0426, test_f1: 0.5792
 epoch: 95, train_loss: 0.2190, test_loss: 2.0065, test_f1: 0.6027
 epoch: 96, train_loss: 0.1685, test_loss: 1.8719, test_f1: 0.6164
 epoch: 97, train_loss: 0.1503, test_loss: 1.9497, test_f1: 0.6038
 epoch: 98, train_loss: 0.1883, test_loss: 1.9970, test_f1: 0.6018
 epoch: 99, train_loss: 0.1522, test_loss: 1.9452, test_f1: 0.6069
##################ITERATION #1 ****************************************
 epoch: 0, train_loss: 1.2323, test_loss: 1.3065, test_f1: 0.3055
 epoch: 1, train_loss: 1.0806, test_loss: 1.3168, test_f1: 0.3066
 epoch: 2, train_loss: 0.9951, test_loss: 1.3079, test_f1: 0.2905
 epoch: 3, train_loss: 0.9421, test_loss: 1.2448, test_f1: 0.4330
 epoch: 4, train_loss: 0.8838, test_loss: 1.1045, test_f1: 0.4911
 epoch: 5, train_loss: 0.8528, test_loss: 0.9954, test_f1: 0.5629
 epoch: 6, train_loss: 0.8244, test_loss: 1.0121, test_f1: 0.5553
 epoch: 7, train_loss: 0.8034, test_loss: 0.9890, test_f1: 0.5907
 epoch: 8, train_loss: 0.7727, test_loss: 0.9683, test_f1: 0.5796
 epoch: 9, train_loss: 0.7357, test_loss: 1.0096, test_f1: 0.5872
 epoch: 10, train_loss: 0.7140, test_loss: 1.0984, test_f1: 0.5502
 epoch: 11, train_loss: 0.7104, test_loss: 1.1041, test_f1: 0.5341
 epoch: 12, train_loss: 0.6899, test_loss: 1.0026, test_f1: 0.5924
 epoch: 13, train_loss: 0.6739, test_loss: 1.0730, test_f1: 0.6098
 epoch: 14, train_loss: 0.6538, test_loss: 1.0888, test_f1: 0.5967
 epoch: 15, train_loss: 0.6419, test_loss: 1.1075, test_f1: 0.5554
 epoch: 16, train_loss: 0.6568, test_loss: 1.1593, test_f1: 0.5637
 epoch: 17, train_loss: 0.6549, test_loss: 1.1955, test_f1: 0.5533
 epoch: 18, train_loss: 0.6261, test_loss: 1.2052, test_f1: 0.5096
 epoch: 19, train_loss: 0.6227, test_loss: 1.0685, test_f1: 0.6054
 epoch: 20, train_loss: 0.6019, test_loss: 1.0118, test_f1: 0.5828
 epoch: 21, train_loss: 0.6128, test_loss: 1.1822, test_f1: 0.5978
 epoch: 22, train_loss: 0.5859, test_loss: 1.1257, test_f1: 0.5891
 epoch: 23, train_loss: 0.5681, test_loss: 1.1533, test_f1: 0.5669
 epoch: 24, train_loss: 0.5898, test_loss: 1.2354, test_f1: 0.6072
 epoch: 25, train_loss: 0.5452, test_loss: 1.0647, test_f1: 0.5671
 epoch: 26, train_loss: 0.5408, test_loss: 1.1510, test_f1: 0.5999
 epoch: 27, train_loss: 0.5084, test_loss: 1.1886, test_f1: 0.5878
 epoch: 28, train_loss: 0.5085, test_loss: 1.2592, test_f1: 0.5911
 epoch: 29, train_loss: 0.4936, test_loss: 1.1518, test_f1: 0.6338
 epoch: 30, train_loss: 0.4935, test_loss: 1.3181, test_f1: 0.5656
 epoch: 31, train_loss: 0.5019, test_loss: 1.2072, test_f1: 0.6084
 epoch: 32, train_loss: 0.5051, test_loss: 1.3257, test_f1: 0.5703
 epoch: 33, train_loss: 0.4999, test_loss: 1.3351, test_f1: 0.6135
 epoch: 34, train_loss: 0.4713, test_loss: 1.1624, test_f1: 0.6415
 epoch: 35, train_loss: 0.4611, test_loss: 1.2838, test_f1: 0.6233
 epoch: 36, train_loss: 0.4246, test_loss: 1.1798, test_f1: 0.6367
 epoch: 37, train_loss: 0.4272, test_loss: 1.2945, test_f1: 0.6097
 epoch: 38, train_loss: 0.3996, test_loss: 1.4620, test_f1: 0.6074
 epoch: 39, train_loss: 0.3870, test_loss: 1.4491, test_f1: 0.6580
 epoch: 40, train_loss: 0.3843, test_loss: 1.6600, test_f1: 0.5432
 epoch: 41, train_loss: 0.4146, test_loss: 1.4654, test_f1: 0.6486
 epoch: 42, train_loss: 0.4230, test_loss: 1.3577, test_f1: 0.6387
 epoch: 43, train_loss: 0.4040, test_loss: 1.4486, test_f1: 0.6011
 epoch: 44, train_loss: 0.3678, test_loss: 1.3124, test_f1: 0.6527
 epoch: 45, train_loss: 0.3696, test_loss: 1.4926, test_f1: 0.6052
 epoch: 46, train_loss: 0.3733, test_loss: 1.4258, test_f1: 0.6352
 epoch: 47, train_loss: 0.3890, test_loss: 1.7976, test_f1: 0.6028
 epoch: 48, train_loss: 0.3715, test_loss: 1.5545, test_f1: 0.6071
 epoch: 49, train_loss: 0.4055, test_loss: 1.3841, test_f1: 0.6594
 epoch: 50, train_loss: 0.3398, test_loss: 1.5949, test_f1: 0.6394
 epoch: 51, train_loss: 0.3090, test_loss: 1.4912, test_f1: 0.6656
 epoch: 52, train_loss: 0.2984, test_loss: 1.5806, test_f1: 0.6420
 epoch: 53, train_loss: 0.2638, test_loss: 1.6378, test_f1: 0.6586
 epoch: 54, train_loss: 0.2448, test_loss: 1.6304, test_f1: 0.6471
 epoch: 55, train_loss: 0.2472, test_loss: 1.5772, test_f1: 0.6382
 epoch: 56, train_loss: 0.2229, test_loss: 1.6130, test_f1: 0.6512
 epoch: 57, train_loss: 0.2364, test_loss: 1.8949, test_f1: 0.6403
 epoch: 58, train_loss: 0.2443, test_loss: 1.8637, test_f1: 0.5972
 epoch: 59, train_loss: 0.2213, test_loss: 1.6634, test_f1: 0.6582
 epoch: 60, train_loss: 0.2404, test_loss: 1.8205, test_f1: 0.6438
 epoch: 61, train_loss: 0.2168, test_loss: 1.8526, test_f1: 0.6596
 epoch: 62, train_loss: 0.2242, test_loss: 1.8636, test_f1: 0.6551
 epoch: 63, train_loss: 0.1979, test_loss: 1.8575, test_f1: 0.6561
 epoch: 64, train_loss: 0.2006, test_loss: 1.9093, test_f1: 0.6759
 epoch: 65, train_loss: 0.2007, test_loss: 1.9528, test_f1: 0.6414
 epoch: 66, train_loss: 0.2186, test_loss: 1.9319, test_f1: 0.6702
 epoch: 67, train_loss: 0.2043, test_loss: 1.9748, test_f1: 0.6431
 epoch: 68, train_loss: 0.2335, test_loss: 1.9172, test_f1: 0.6438
 epoch: 69, train_loss: 0.2307, test_loss: 1.8151, test_f1: 0.6600
 epoch: 70, train_loss: 0.2455, test_loss: 1.9904, test_f1: 0.6255
 epoch: 71, train_loss: 0.2190, test_loss: 1.8803, test_f1: 0.6613
 epoch: 72, train_loss: 0.1948, test_loss: 1.8883, test_f1: 0.6624
 epoch: 73, train_loss: 0.1786, test_loss: 1.9720, test_f1: 0.6561
 epoch: 74, train_loss: 0.1895, test_loss: 1.9901, test_f1: 0.6717
 epoch: 75, train_loss: 0.1694, test_loss: 1.8878, test_f1: 0.6574
 epoch: 76, train_loss: 0.1730, test_loss: 2.1407, test_f1: 0.6436
 epoch: 77, train_loss: 0.1769, test_loss: 1.9889, test_f1: 0.6284
 epoch: 78, train_loss: 0.1825, test_loss: 2.1856, test_f1: 0.6517
 epoch: 79, train_loss: 0.1874, test_loss: 2.1399, test_f1: 0.6561
 epoch: 80, train_loss: 0.1961, test_loss: 2.0451, test_f1: 0.6253
 epoch: 81, train_loss: 0.1800, test_loss: 2.1189, test_f1: 0.6270
 epoch: 82, train_loss: 0.1772, test_loss: 2.0234, test_f1: 0.6597
 epoch: 83, train_loss: 0.1539, test_loss: 2.0213, test_f1: 0.6727
 epoch: 84, train_loss: 0.1520, test_loss: 2.0050, test_f1: 0.6750
 epoch: 85, train_loss: 0.1432, test_loss: 2.1815, test_f1: 0.6364
 epoch: 86, train_loss: 0.1287, test_loss: 2.3898, test_f1: 0.6077
 epoch: 87, train_loss: 0.1480, test_loss: 2.3307, test_f1: 0.6474
 epoch: 88, train_loss: 0.1549, test_loss: 2.2836, test_f1: 0.6016
 epoch: 89, train_loss: 0.1737, test_loss: 2.2862, test_f1: 0.6558
 epoch: 90, train_loss: 0.1467, test_loss: 2.3196, test_f1: 0.6299
 epoch: 91, train_loss: 0.1741, test_loss: 2.0822, test_f1: 0.6531
 epoch: 92, train_loss: 0.1722, test_loss: 2.2355, test_f1: 0.6509
 epoch: 93, train_loss: 0.1324, test_loss: 2.3830, test_f1: 0.6411
 epoch: 94, train_loss: 0.1152, test_loss: 2.5909, test_f1: 0.6047
 epoch: 95, train_loss: 0.1305, test_loss: 2.6539, test_f1: 0.5854
 epoch: 96, train_loss: 0.1472, test_loss: 2.4501, test_f1: 0.6162
 epoch: 97, train_loss: 0.1175, test_loss: 2.6060, test_f1: 0.6227
 epoch: 98, train_loss: 0.1400, test_loss: 2.6294, test_f1: 0.6104
 epoch: 99, train_loss: 0.1259, test_loss: 2.5455, test_f1: 0.6277
##################ITERATION #2 ****************************************
 epoch: 0, train_loss: 1.2325, test_loss: 1.3108, test_f1: 0.2465
 epoch: 1, train_loss: 1.0651, test_loss: 1.3563, test_f1: 0.2706
 epoch: 2, train_loss: 0.9849, test_loss: 1.3710, test_f1: 0.3234
 epoch: 3, train_loss: 0.9325, test_loss: 1.3239, test_f1: 0.3592
 epoch: 4, train_loss: 0.8970, test_loss: 1.0382, test_f1: 0.5579
 epoch: 5, train_loss: 0.8687, test_loss: 1.0008, test_f1: 0.5605
 epoch: 6, train_loss: 0.8451, test_loss: 0.9565, test_f1: 0.5713
 epoch: 7, train_loss: 0.8319, test_loss: 0.9535, test_f1: 0.5848
 epoch: 8, train_loss: 0.7907, test_loss: 0.9582, test_f1: 0.5836
 epoch: 9, train_loss: 0.7908, test_loss: 1.0090, test_f1: 0.5666
 epoch: 10, train_loss: 0.7641, test_loss: 0.9840, test_f1: 0.5341
 epoch: 11, train_loss: 0.7570, test_loss: 0.9395, test_f1: 0.5783
 epoch: 12, train_loss: 0.7132, test_loss: 0.9168, test_f1: 0.5738
 epoch: 13, train_loss: 0.6966, test_loss: 0.8859, test_f1: 0.6241
 epoch: 14, train_loss: 0.6847, test_loss: 0.9344, test_f1: 0.5779
 epoch: 15, train_loss: 0.6640, test_loss: 0.9016, test_f1: 0.6318
 epoch: 16, train_loss: 0.6434, test_loss: 0.9881, test_f1: 0.5933
 epoch: 17, train_loss: 0.6185, test_loss: 1.0250, test_f1: 0.5660
 epoch: 18, train_loss: 0.6233, test_loss: 0.9920, test_f1: 0.5756
 epoch: 19, train_loss: 0.6058, test_loss: 1.1501, test_f1: 0.5359
 epoch: 20, train_loss: 0.5903, test_loss: 1.0190, test_f1: 0.6393
 epoch: 21, train_loss: 0.5653, test_loss: 0.9870, test_f1: 0.6074
 epoch: 22, train_loss: 0.5649, test_loss: 1.0658, test_f1: 0.5804
 epoch: 23, train_loss: 0.5648, test_loss: 1.0464, test_f1: 0.5751
 epoch: 24, train_loss: 0.5451, test_loss: 1.1363, test_f1: 0.6080
 epoch: 25, train_loss: 0.5847, test_loss: 1.1338, test_f1: 0.5496
 epoch: 26, train_loss: 0.5641, test_loss: 1.1278, test_f1: 0.5777
 epoch: 27, train_loss: 0.5339, test_loss: 1.0031, test_f1: 0.6184
 epoch: 28, train_loss: 0.5015, test_loss: 1.0792, test_f1: 0.5901
 epoch: 29, train_loss: 0.4597, test_loss: 1.1231, test_f1: 0.6287
 epoch: 30, train_loss: 0.4194, test_loss: 1.1012, test_f1: 0.6008
 epoch: 31, train_loss: 0.4286, test_loss: 1.1835, test_f1: 0.6150
 epoch: 32, train_loss: 0.4494, test_loss: 1.1785, test_f1: 0.6043
 epoch: 33, train_loss: 0.3803, test_loss: 1.2259, test_f1: 0.5967
 epoch: 34, train_loss: 0.3831, test_loss: 1.3613, test_f1: 0.6256
 epoch: 35, train_loss: 0.3883, test_loss: 1.3691, test_f1: 0.5938
 epoch: 36, train_loss: 0.4417, test_loss: 1.2598, test_f1: 0.6023
 epoch: 37, train_loss: 0.4168, test_loss: 1.3615, test_f1: 0.5929
 epoch: 38, train_loss: 0.4291, test_loss: 1.5409, test_f1: 0.5419
 epoch: 39, train_loss: 0.3895, test_loss: 1.4879, test_f1: 0.5386
 epoch: 40, train_loss: 0.3794, test_loss: 1.4325, test_f1: 0.5803
 epoch: 41, train_loss: 0.3538, test_loss: 1.5363, test_f1: 0.5675
 epoch: 42, train_loss: 0.3521, test_loss: 1.4037, test_f1: 0.6042
 epoch: 43, train_loss: 0.3105, test_loss: 1.5258, test_f1: 0.5684
 epoch: 44, train_loss: 0.3885, test_loss: 1.4557, test_f1: 0.6213
 epoch: 45, train_loss: 0.3259, test_loss: 1.5832, test_f1: 0.5768
 epoch: 46, train_loss: 0.3345, test_loss: 1.4783, test_f1: 0.5860
 epoch: 47, train_loss: 0.3039, test_loss: 1.7474, test_f1: 0.5526
 epoch: 48, train_loss: 0.3259, test_loss: 1.7843, test_f1: 0.5687
 epoch: 49, train_loss: 0.3175, test_loss: 1.5970, test_f1: 0.5797
 epoch: 50, train_loss: 0.2884, test_loss: 1.6357, test_f1: 0.5409
 epoch: 51, train_loss: 0.2745, test_loss: 1.5791, test_f1: 0.5884
 epoch: 52, train_loss: 0.2499, test_loss: 1.6974, test_f1: 0.5837
 epoch: 53, train_loss: 0.2094, test_loss: 1.6222, test_f1: 0.5775
 epoch: 54, train_loss: 0.2155, test_loss: 1.7092, test_f1: 0.5940
 epoch: 55, train_loss: 0.2068, test_loss: 1.7841, test_f1: 0.6066
 epoch: 56, train_loss: 0.1859, test_loss: 1.8155, test_f1: 0.5947
 epoch: 57, train_loss: 0.1879, test_loss: 1.8570, test_f1: 0.5730
 epoch: 58, train_loss: 0.1849, test_loss: 1.9824, test_f1: 0.5658
 epoch: 59, train_loss: 0.2084, test_loss: 2.0393, test_f1: 0.5753
 epoch: 60, train_loss: 0.1887, test_loss: 2.0608, test_f1: 0.5753
 epoch: 61, train_loss: 0.2083, test_loss: 1.9106, test_f1: 0.5794
 epoch: 62, train_loss: 0.1799, test_loss: 1.9589, test_f1: 0.5854
 epoch: 63, train_loss: 0.1648, test_loss: 2.1046, test_f1: 0.5544
 epoch: 64, train_loss: 0.1496, test_loss: 1.8664, test_f1: 0.5781
 epoch: 65, train_loss: 0.1633, test_loss: 1.9445, test_f1: 0.5479
 epoch: 66, train_loss: 0.1704, test_loss: 1.9427, test_f1: 0.5650
 epoch: 67, train_loss: 0.1783, test_loss: 2.1729, test_f1: 0.5583
 epoch: 68, train_loss: 0.1707, test_loss: 1.9847, test_f1: 0.6038
 epoch: 69, train_loss: 0.1616, test_loss: 2.2976, test_f1: 0.5663
 epoch: 70, train_loss: 0.2279, test_loss: 2.5754, test_f1: 0.5524
 epoch: 71, train_loss: 0.1616, test_loss: 2.3425, test_f1: 0.5360
 epoch: 72, train_loss: 0.1581, test_loss: 2.1505, test_f1: 0.5539
 epoch: 73, train_loss: 0.1697, test_loss: 2.1947, test_f1: 0.5880
 epoch: 74, train_loss: 0.1933, test_loss: 2.2722, test_f1: 0.5594
 epoch: 75, train_loss: 0.1714, test_loss: 2.3383, test_f1: 0.5374
 epoch: 76, train_loss: 0.1893, test_loss: 2.1654, test_f1: 0.5950
 epoch: 77, train_loss: 0.1570, test_loss: 2.1779, test_f1: 0.5894
 epoch: 78, train_loss: 0.1403, test_loss: 2.5146, test_f1: 0.5705
 epoch: 79, train_loss: 0.1278, test_loss: 2.2193, test_f1: 0.5773
 epoch: 80, train_loss: 0.1263, test_loss: 2.3337, test_f1: 0.5767
 epoch: 81, train_loss: 0.1478, test_loss: 2.1668, test_f1: 0.5946
 epoch: 82, train_loss: 0.1299, test_loss: 2.2628, test_f1: 0.5680
 epoch: 83, train_loss: 0.1436, test_loss: 2.2662, test_f1: 0.5920
 epoch: 84, train_loss: 0.1504, test_loss: 2.3633, test_f1: 0.5879
 epoch: 85, train_loss: 0.1363, test_loss: 2.3147, test_f1: 0.5744
 epoch: 86, train_loss: 0.1347, test_loss: 2.4299, test_f1: 0.5783
 epoch: 87, train_loss: 0.1220, test_loss: 2.3634, test_f1: 0.5954
 epoch: 88, train_loss: 0.1404, test_loss: 2.5197, test_f1: 0.5840
 epoch: 89, train_loss: 0.1070, test_loss: 2.5315, test_f1: 0.5744
 epoch: 90, train_loss: 0.1252, test_loss: 2.6681, test_f1: 0.5495
 epoch: 91, train_loss: 0.1151, test_loss: 2.5683, test_f1: 0.6038
 epoch: 92, train_loss: 0.1204, test_loss: 2.5149, test_f1: 0.5630
 epoch: 93, train_loss: 0.1312, test_loss: 2.3520, test_f1: 0.5927
 epoch: 94, train_loss: 0.1213, test_loss: 2.5129, test_f1: 0.5683
 epoch: 95, train_loss: 0.1296, test_loss: 2.4658, test_f1: 0.6022
 epoch: 96, train_loss: 0.1369, test_loss: 2.6209, test_f1: 0.5957
 epoch: 97, train_loss: 0.1259, test_loss: 2.4098, test_f1: 0.6011
 epoch: 98, train_loss: 0.1151, test_loss: 2.6448, test_f1: 0.5734
 epoch: 99, train_loss: 0.1024, test_loss: 2.9270, test_f1: 0.5802
##################ITERATION #3 ****************************************
 epoch: 0, train_loss: 1.2301, test_loss: 1.3110, test_f1: 0.3059
 epoch: 1, train_loss: 1.0508, test_loss: 1.3648, test_f1: 0.3076
 epoch: 2, train_loss: 0.9871, test_loss: 1.3073, test_f1: 0.3515
 epoch: 3, train_loss: 0.9399, test_loss: 1.2222, test_f1: 0.2856
 epoch: 4, train_loss: 0.8966, test_loss: 1.0648, test_f1: 0.4595
 epoch: 5, train_loss: 0.8577, test_loss: 0.9966, test_f1: 0.5906
 epoch: 6, train_loss: 0.8222, test_loss: 0.9705, test_f1: 0.6155
 epoch: 7, train_loss: 0.7821, test_loss: 0.9610, test_f1: 0.5992
 epoch: 8, train_loss: 0.7454, test_loss: 0.9953, test_f1: 0.5418
 epoch: 9, train_loss: 0.7553, test_loss: 1.0899, test_f1: 0.5384
 epoch: 10, train_loss: 0.7356, test_loss: 1.0669, test_f1: 0.5450
 epoch: 11, train_loss: 0.7057, test_loss: 1.1158, test_f1: 0.5396
 epoch: 12, train_loss: 0.6903, test_loss: 1.1387, test_f1: 0.5093
 epoch: 13, train_loss: 0.6862, test_loss: 1.0390, test_f1: 0.5678
 epoch: 14, train_loss: 0.6976, test_loss: 1.0611, test_f1: 0.5441
 epoch: 15, train_loss: 0.6442, test_loss: 1.0959, test_f1: 0.5559
 epoch: 16, train_loss: 0.6337, test_loss: 1.1547, test_f1: 0.5488
 epoch: 17, train_loss: 0.6199, test_loss: 1.0701, test_f1: 0.5664
 epoch: 18, train_loss: 0.5927, test_loss: 1.0864, test_f1: 0.5963
 epoch: 19, train_loss: 0.5772, test_loss: 1.0878, test_f1: 0.5792
 epoch: 20, train_loss: 0.5745, test_loss: 1.1481, test_f1: 0.5704
 epoch: 21, train_loss: 0.5689, test_loss: 1.0926, test_f1: 0.5534
 epoch: 22, train_loss: 0.5534, test_loss: 1.2729, test_f1: 0.5257
 epoch: 23, train_loss: 0.5287, test_loss: 1.1517, test_f1: 0.5532
 epoch: 24, train_loss: 0.5282, test_loss: 1.2589, test_f1: 0.5479
 epoch: 25, train_loss: 0.5374, test_loss: 1.4478, test_f1: 0.5499
 epoch: 26, train_loss: 0.5061, test_loss: 1.1312, test_f1: 0.5982
 epoch: 27, train_loss: 0.4720, test_loss: 1.2477, test_f1: 0.5952
 epoch: 28, train_loss: 0.4858, test_loss: 1.3520, test_f1: 0.5358
 epoch: 29, train_loss: 0.4557, test_loss: 1.1551, test_f1: 0.6205
 epoch: 30, train_loss: 0.4730, test_loss: 1.2952, test_f1: 0.5799
 epoch: 31, train_loss: 0.4665, test_loss: 1.2551, test_f1: 0.5992
 epoch: 32, train_loss: 0.4567, test_loss: 1.3165, test_f1: 0.6041
 epoch: 33, train_loss: 0.4308, test_loss: 1.3023, test_f1: 0.6040
 epoch: 34, train_loss: 0.4050, test_loss: 1.3504, test_f1: 0.5813
 epoch: 35, train_loss: 0.4016, test_loss: 1.5156, test_f1: 0.5379
 epoch: 36, train_loss: 0.4068, test_loss: 1.4421, test_f1: 0.5447
 epoch: 37, train_loss: 0.3866, test_loss: 1.3235, test_f1: 0.6473
 epoch: 38, train_loss: 0.3531, test_loss: 1.3282, test_f1: 0.6649
 epoch: 39, train_loss: 0.3436, test_loss: 1.4179, test_f1: 0.6236
 epoch: 40, train_loss: 0.3838, test_loss: 1.4683, test_f1: 0.5921
 epoch: 41, train_loss: 0.3615, test_loss: 1.3767, test_f1: 0.6241
 epoch: 42, train_loss: 0.3435, test_loss: 1.5934, test_f1: 0.5602
 epoch: 43, train_loss: 0.3955, test_loss: 1.7527, test_f1: 0.5677
 epoch: 44, train_loss: 0.3792, test_loss: 1.5912, test_f1: 0.5724
 epoch: 45, train_loss: 0.3713, test_loss: 1.6177, test_f1: 0.5789
 epoch: 46, train_loss: 0.2964, test_loss: 1.5656, test_f1: 0.6024
 epoch: 47, train_loss: 0.3069, test_loss: 1.5573, test_f1: 0.5966
 epoch: 48, train_loss: 0.3030, test_loss: 1.5471, test_f1: 0.6062
 epoch: 49, train_loss: 0.3295, test_loss: 1.6160, test_f1: 0.6552
 epoch: 50, train_loss: 0.2964, test_loss: 1.7956, test_f1: 0.5972
 epoch: 51, train_loss: 0.3159, test_loss: 1.6083, test_f1: 0.6204
 epoch: 52, train_loss: 0.2358, test_loss: 1.6961, test_f1: 0.6146
 epoch: 53, train_loss: 0.2243, test_loss: 1.6155, test_f1: 0.6582
 epoch: 54, train_loss: 0.2287, test_loss: 1.6721, test_f1: 0.6114
 epoch: 55, train_loss: 0.2311, test_loss: 1.6811, test_f1: 0.6022
 epoch: 56, train_loss: 0.2106, test_loss: 1.7195, test_f1: 0.6045
 epoch: 57, train_loss: 0.2030, test_loss: 1.7507, test_f1: 0.5959
 epoch: 58, train_loss: 0.1942, test_loss: 1.7635, test_f1: 0.6307
 epoch: 59, train_loss: 0.1966, test_loss: 1.7437, test_f1: 0.6384
 epoch: 60, train_loss: 0.1897, test_loss: 1.6871, test_f1: 0.6623
 epoch: 61, train_loss: 0.1793, test_loss: 1.8482, test_f1: 0.6643
 epoch: 62, train_loss: 0.1895, test_loss: 1.7694, test_f1: 0.6571
 epoch: 63, train_loss: 0.2038, test_loss: 1.9444, test_f1: 0.5944
 epoch: 64, train_loss: 0.1967, test_loss: 1.8529, test_f1: 0.6018
 epoch: 65, train_loss: 0.1922, test_loss: 1.9399, test_f1: 0.6248
 epoch: 66, train_loss: 0.1682, test_loss: 1.8604, test_f1: 0.6178
 epoch: 67, train_loss: 0.1590, test_loss: 2.0237, test_f1: 0.6273
 epoch: 68, train_loss: 0.1795, test_loss: 1.8421, test_f1: 0.6314
 epoch: 69, train_loss: 0.1680, test_loss: 2.0111, test_f1: 0.6255
 epoch: 70, train_loss: 0.1693, test_loss: 1.9545, test_f1: 0.5940
 epoch: 71, train_loss: 0.1581, test_loss: 1.8936, test_f1: 0.6206
 epoch: 72, train_loss: 0.1551, test_loss: 1.9140, test_f1: 0.6510
 epoch: 73, train_loss: 0.1390, test_loss: 2.0543, test_f1: 0.6297
 epoch: 74, train_loss: 0.1498, test_loss: 2.0945, test_f1: 0.6102
 epoch: 75, train_loss: 0.1613, test_loss: 2.1046, test_f1: 0.6092
 epoch: 76, train_loss: 0.1653, test_loss: 2.0358, test_f1: 0.6335
 epoch: 77, train_loss: 0.1414, test_loss: 2.0356, test_f1: 0.5884
 epoch: 78, train_loss: 0.1245, test_loss: 2.0994, test_f1: 0.6266
 epoch: 79, train_loss: 0.1335, test_loss: 2.1705, test_f1: 0.5927
 epoch: 80, train_loss: 0.1130, test_loss: 2.2301, test_f1: 0.5993
 epoch: 81, train_loss: 0.1096, test_loss: 2.2157, test_f1: 0.6200
 epoch: 82, train_loss: 0.1213, test_loss: 2.1672, test_f1: 0.6083
 epoch: 83, train_loss: 0.1269, test_loss: 2.3104, test_f1: 0.6235
 epoch: 84, train_loss: 0.1388, test_loss: 2.4845, test_f1: 0.5971
 epoch: 85, train_loss: 0.1400, test_loss: 2.5280, test_f1: 0.5884
 epoch: 86, train_loss: 0.1197, test_loss: 2.2485, test_f1: 0.6332
 epoch: 87, train_loss: 0.1280, test_loss: 2.3332, test_f1: 0.6081
 epoch: 88, train_loss: 0.1557, test_loss: 2.1070, test_f1: 0.6023
 epoch: 89, train_loss: 0.1633, test_loss: 1.9975, test_f1: 0.6043
 epoch: 90, train_loss: 0.1357, test_loss: 2.0486, test_f1: 0.6112
 epoch: 91, train_loss: 0.1304, test_loss: 2.1701, test_f1: 0.6357
 epoch: 92, train_loss: 0.1191, test_loss: 2.2744, test_f1: 0.5991
 epoch: 93, train_loss: 0.1184, test_loss: 2.4264, test_f1: 0.5875
 epoch: 94, train_loss: 0.1133, test_loss: 2.2826, test_f1: 0.5917
 epoch: 95, train_loss: 0.1066, test_loss: 2.4418, test_f1: 0.5735
 epoch: 96, train_loss: 0.1198, test_loss: 2.5994, test_f1: 0.5627
 epoch: 97, train_loss: 0.1225, test_loss: 2.6243, test_f1: 0.5937
 epoch: 98, train_loss: 0.1146, test_loss: 2.7095, test_f1: 0.6085
 epoch: 99, train_loss: 0.1045, test_loss: 2.5403, test_f1: 0.5905
##################ITERATION #4 ****************************************
 epoch: 0, train_loss: 1.2655, test_loss: 1.3585, test_f1: 0.1365
 epoch: 1, train_loss: 1.0602, test_loss: 1.3171, test_f1: 0.1655
 epoch: 2, train_loss: 0.9880, test_loss: 1.3016, test_f1: 0.3649
 epoch: 3, train_loss: 0.9284, test_loss: 1.1278, test_f1: 0.5194
 epoch: 4, train_loss: 0.8899, test_loss: 1.0662, test_f1: 0.5954
 epoch: 5, train_loss: 0.8595, test_loss: 1.0788, test_f1: 0.5076
 epoch: 6, train_loss: 0.8141, test_loss: 1.0294, test_f1: 0.5705
 epoch: 7, train_loss: 0.7900, test_loss: 1.1438, test_f1: 0.5585
 epoch: 8, train_loss: 0.7482, test_loss: 0.9757, test_f1: 0.5951
 epoch: 9, train_loss: 0.7442, test_loss: 1.0383, test_f1: 0.5613
 epoch: 10, train_loss: 0.7367, test_loss: 1.1001, test_f1: 0.5729
 epoch: 11, train_loss: 0.7005, test_loss: 1.0513, test_f1: 0.5813
 epoch: 12, train_loss: 0.6885, test_loss: 1.1026, test_f1: 0.5505
 epoch: 13, train_loss: 0.6756, test_loss: 1.1194, test_f1: 0.5634
 epoch: 14, train_loss: 0.6552, test_loss: 1.0950, test_f1: 0.5959
 epoch: 15, train_loss: 0.6591, test_loss: 1.1686, test_f1: 0.5554
 epoch: 16, train_loss: 0.6809, test_loss: 1.0938, test_f1: 0.5979
 epoch: 17, train_loss: 0.6359, test_loss: 1.4320, test_f1: 0.5759
 epoch: 18, train_loss: 0.6412, test_loss: 1.1306, test_f1: 0.6148
 epoch: 19, train_loss: 0.6386, test_loss: 1.0717, test_f1: 0.5717
 epoch: 20, train_loss: 0.6171, test_loss: 1.2086, test_f1: 0.5626
 epoch: 21, train_loss: 0.5866, test_loss: 1.1023, test_f1: 0.6194
 epoch: 22, train_loss: 0.5813, test_loss: 1.3039, test_f1: 0.5400
 epoch: 23, train_loss: 0.5600, test_loss: 1.0723, test_f1: 0.5861
 epoch: 24, train_loss: 0.5315, test_loss: 1.1551, test_f1: 0.5656
 epoch: 25, train_loss: 0.5317, test_loss: 1.3780, test_f1: 0.5777
 epoch: 26, train_loss: 0.5186, test_loss: 1.4300, test_f1: 0.5832
 epoch: 27, train_loss: 0.5275, test_loss: 1.1583, test_f1: 0.6262
 epoch: 28, train_loss: 0.4739, test_loss: 1.3331, test_f1: 0.6166
 epoch: 29, train_loss: 0.4962, test_loss: 1.2693, test_f1: 0.5595
 epoch: 30, train_loss: 0.4976, test_loss: 1.3719, test_f1: 0.6059
 epoch: 31, train_loss: 0.4751, test_loss: 1.2402, test_f1: 0.6068
 epoch: 32, train_loss: 0.4617, test_loss: 1.2404, test_f1: 0.5800
 epoch: 33, train_loss: 0.4468, test_loss: 1.1916, test_f1: 0.6222
 epoch: 34, train_loss: 0.4668, test_loss: 1.2632, test_f1: 0.6108
 epoch: 35, train_loss: 0.4267, test_loss: 1.2522, test_f1: 0.6356
 epoch: 36, train_loss: 0.4246, test_loss: 1.3399, test_f1: 0.6538
 epoch: 37, train_loss: 0.4088, test_loss: 1.3816, test_f1: 0.6119
 epoch: 38, train_loss: 0.4056, test_loss: 1.5585, test_f1: 0.5503
 epoch: 39, train_loss: 0.3855, test_loss: 1.6748, test_f1: 0.5909
 epoch: 40, train_loss: 0.4342, test_loss: 1.6028, test_f1: 0.5923
 epoch: 41, train_loss: 0.4081, test_loss: 1.3891, test_f1: 0.6133
 epoch: 42, train_loss: 0.3934, test_loss: 1.6827, test_f1: 0.6040
 epoch: 43, train_loss: 0.3801, test_loss: 1.7760, test_f1: 0.5902
 epoch: 44, train_loss: 0.3866, test_loss: 1.4983, test_f1: 0.6010
 epoch: 45, train_loss: 0.3742, test_loss: 1.7551, test_f1: 0.6128
 epoch: 46, train_loss: 0.3827, test_loss: 1.5585, test_f1: 0.5694
 epoch: 47, train_loss: 0.3567, test_loss: 1.6187, test_f1: 0.5838
 epoch: 48, train_loss: 0.3474, test_loss: 1.5636, test_f1: 0.6033
 epoch: 49, train_loss: 0.3763, test_loss: 1.7685, test_f1: 0.6093
 epoch: 50, train_loss: 0.3765, test_loss: 1.7413, test_f1: 0.6039
 epoch: 51, train_loss: 0.3241, test_loss: 1.6673, test_f1: 0.6177
 epoch: 52, train_loss: 0.3006, test_loss: 1.7283, test_f1: 0.6253
 epoch: 53, train_loss: 0.2787, test_loss: 1.7244, test_f1: 0.6366
 epoch: 54, train_loss: 0.2516, test_loss: 1.7593, test_f1: 0.6105
 epoch: 55, train_loss: 0.2364, test_loss: 1.8189, test_f1: 0.6009
 epoch: 56, train_loss: 0.2345, test_loss: 1.6553, test_f1: 0.6382
 epoch: 57, train_loss: 0.2222, test_loss: 1.7915, test_f1: 0.6251
 epoch: 58, train_loss: 0.2257, test_loss: 1.9622, test_f1: 0.5922
 epoch: 59, train_loss: 0.2256, test_loss: 2.0521, test_f1: 0.6261
 epoch: 60, train_loss: 0.2296, test_loss: 1.8971, test_f1: 0.6347
 epoch: 61, train_loss: 0.2614, test_loss: 1.7735, test_f1: 0.6229
 epoch: 62, train_loss: 0.2434, test_loss: 2.0658, test_f1: 0.5892
 epoch: 63, train_loss: 0.2450, test_loss: 1.7719, test_f1: 0.6154
 epoch: 64, train_loss: 0.2132, test_loss: 1.7407, test_f1: 0.6368
 epoch: 65, train_loss: 0.2141, test_loss: 1.9778, test_f1: 0.6317
 epoch: 66, train_loss: 0.2291, test_loss: 2.1344, test_f1: 0.5832
 epoch: 67, train_loss: 0.2378, test_loss: 1.8600, test_f1: 0.6253
 epoch: 68, train_loss: 0.2179, test_loss: 1.9177, test_f1: 0.6455
 epoch: 69, train_loss: 0.1939, test_loss: 1.9934, test_f1: 0.6381
 epoch: 70, train_loss: 0.2062, test_loss: 1.9614, test_f1: 0.6331
 epoch: 71, train_loss: 0.1842, test_loss: 2.0984, test_f1: 0.6141
 epoch: 72, train_loss: 0.1901, test_loss: 2.0158, test_f1: 0.6400
 epoch: 73, train_loss: 0.1715, test_loss: 2.0074, test_f1: 0.6241
 epoch: 74, train_loss: 0.1765, test_loss: 2.1325, test_f1: 0.6117
 epoch: 75, train_loss: 0.2197, test_loss: 2.2688, test_f1: 0.6346
 epoch: 76, train_loss: 0.1842, test_loss: 1.9733, test_f1: 0.6520
 epoch: 77, train_loss: 0.2065, test_loss: 2.0916, test_f1: 0.6409
 epoch: 78, train_loss: 0.1826, test_loss: 1.9024, test_f1: 0.6348
 epoch: 79, train_loss: 0.1628, test_loss: 2.3253, test_f1: 0.6132
 epoch: 80, train_loss: 0.1611, test_loss: 2.1246, test_f1: 0.6305
 epoch: 81, train_loss: 0.1745, test_loss: 2.1467, test_f1: 0.5947
 epoch: 82, train_loss: 0.1719, test_loss: 2.2652, test_f1: 0.5904
 epoch: 83, train_loss: 0.1740, test_loss: 2.2208, test_f1: 0.6310
 epoch: 84, train_loss: 0.1719, test_loss: 2.2537, test_f1: 0.6208
 epoch: 85, train_loss: 0.1533, test_loss: 2.3817, test_f1: 0.6129
 epoch: 86, train_loss: 0.1483, test_loss: 2.2297, test_f1: 0.5965
 epoch: 87, train_loss: 0.1354, test_loss: 2.1505, test_f1: 0.6361
 epoch: 88, train_loss: 0.1468, test_loss: 2.2320, test_f1: 0.6101
 epoch: 89, train_loss: 0.1542, test_loss: 2.3366, test_f1: 0.6247
 epoch: 90, train_loss: 0.1478, test_loss: 2.3589, test_f1: 0.6020
 epoch: 91, train_loss: 0.1406, test_loss: 2.6104, test_f1: 0.6136
 epoch: 92, train_loss: 0.1466, test_loss: 2.3908, test_f1: 0.6212
 epoch: 93, train_loss: 0.1759, test_loss: 2.2640, test_f1: 0.6207
 epoch: 94, train_loss: 0.1889, test_loss: 2.4684, test_f1: 0.5815
 epoch: 95, train_loss: 0.1708, test_loss: 2.2577, test_f1: 0.5909
 epoch: 96, train_loss: 0.1599, test_loss: 2.4179, test_f1: 0.5890
 epoch: 97, train_loss: 0.1727, test_loss: 2.2979, test_f1: 0.6138
 epoch: 98, train_loss: 0.1753, test_loss: 2.2288, test_f1: 0.6207
 epoch: 99, train_loss: 0.1658, test_loss: 2.4280, test_f1: 0.5994
##################ITERATION #5 ****************************************
 epoch: 0, train_loss: 1.2511, test_loss: 1.3296, test_f1: 0.3316
 epoch: 1, train_loss: 1.0905, test_loss: 1.4177, test_f1: 0.2732
 epoch: 2, train_loss: 0.9792, test_loss: 1.3361, test_f1: 0.2902
 epoch: 3, train_loss: 0.9533, test_loss: 1.2335, test_f1: 0.3803
 epoch: 4, train_loss: 0.9101, test_loss: 1.1517, test_f1: 0.4955
 epoch: 5, train_loss: 0.8718, test_loss: 1.0912, test_f1: 0.5391
 epoch: 6, train_loss: 0.8342, test_loss: 1.0643, test_f1: 0.5234
 epoch: 7, train_loss: 0.8228, test_loss: 1.1018, test_f1: 0.5650
 epoch: 8, train_loss: 0.8024, test_loss: 1.0441, test_f1: 0.5701
 epoch: 9, train_loss: 0.7806, test_loss: 1.0319, test_f1: 0.5860
 epoch: 10, train_loss: 0.7556, test_loss: 1.0424, test_f1: 0.5905
 epoch: 11, train_loss: 0.7338, test_loss: 1.1224, test_f1: 0.6041
 epoch: 12, train_loss: 0.7093, test_loss: 1.1347, test_f1: 0.5535
 epoch: 13, train_loss: 0.6958, test_loss: 1.3146, test_f1: 0.5758
 epoch: 14, train_loss: 0.7044, test_loss: 1.1112, test_f1: 0.5991
 epoch: 15, train_loss: 0.6889, test_loss: 1.0612, test_f1: 0.5358
 epoch: 16, train_loss: 0.6610, test_loss: 1.2118, test_f1: 0.5132
 epoch: 17, train_loss: 0.6588, test_loss: 1.0507, test_f1: 0.5825
 epoch: 18, train_loss: 0.6239, test_loss: 1.1627, test_f1: 0.5590
 epoch: 19, train_loss: 0.6446, test_loss: 1.0545, test_f1: 0.6034
 epoch: 20, train_loss: 0.6122, test_loss: 1.1288, test_f1: 0.5966
 epoch: 21, train_loss: 0.6081, test_loss: 1.1215, test_f1: 0.5499
 epoch: 22, train_loss: 0.5953, test_loss: 1.1166, test_f1: 0.5647
 epoch: 23, train_loss: 0.5771, test_loss: 1.1497, test_f1: 0.6206
 epoch: 24, train_loss: 0.5768, test_loss: 1.1288, test_f1: 0.6114
 epoch: 25, train_loss: 0.5844, test_loss: 1.4413, test_f1: 0.5775
 epoch: 26, train_loss: 0.5713, test_loss: 1.1171, test_f1: 0.5664
 epoch: 27, train_loss: 0.5704, test_loss: 1.2314, test_f1: 0.5753
 epoch: 28, train_loss: 0.5381, test_loss: 1.4351, test_f1: 0.6044
 epoch: 29, train_loss: 0.5494, test_loss: 1.3546, test_f1: 0.5589
 epoch: 30, train_loss: 0.5388, test_loss: 1.1260, test_f1: 0.6034
 epoch: 31, train_loss: 0.5158, test_loss: 1.3075, test_f1: 0.5939
 epoch: 32, train_loss: 0.5307, test_loss: 1.1871, test_f1: 0.6092
 epoch: 33, train_loss: 0.4904, test_loss: 1.2877, test_f1: 0.5355
 epoch: 34, train_loss: 0.4959, test_loss: 1.3034, test_f1: 0.5962
 epoch: 35, train_loss: 0.4861, test_loss: 1.3516, test_f1: 0.5838
 epoch: 36, train_loss: 0.4487, test_loss: 1.3610, test_f1: 0.6067
 epoch: 37, train_loss: 0.4506, test_loss: 1.3468, test_f1: 0.6265
 epoch: 38, train_loss: 0.4455, test_loss: 1.4363, test_f1: 0.5699
 epoch: 39, train_loss: 0.4609, test_loss: 1.4061, test_f1: 0.5996
 epoch: 40, train_loss: 0.4656, test_loss: 1.2956, test_f1: 0.6317
 epoch: 41, train_loss: 0.4573, test_loss: 1.4347, test_f1: 0.5794
 epoch: 42, train_loss: 0.4300, test_loss: 1.2742, test_f1: 0.6100
 epoch: 43, train_loss: 0.3948, test_loss: 1.4525, test_f1: 0.5860
 epoch: 44, train_loss: 0.3978, test_loss: 1.2618, test_f1: 0.6318
 epoch: 45, train_loss: 0.4297, test_loss: 1.5310, test_f1: 0.5975
 epoch: 46, train_loss: 0.4023, test_loss: 1.5874, test_f1: 0.6111
 epoch: 47, train_loss: 0.4028, test_loss: 1.4059, test_f1: 0.5757
 epoch: 48, train_loss: 0.3631, test_loss: 1.6252, test_f1: 0.6287
 epoch: 49, train_loss: 0.3575, test_loss: 1.3843, test_f1: 0.6145
 epoch: 50, train_loss: 0.3736, test_loss: 1.4604, test_f1: 0.6187
 epoch: 51, train_loss: 0.3615, test_loss: 1.4179, test_f1: 0.6318
 epoch: 52, train_loss: 0.3280, test_loss: 1.5196, test_f1: 0.6307
 epoch: 53, train_loss: 0.2931, test_loss: 1.5014, test_f1: 0.5946
 epoch: 54, train_loss: 0.2962, test_loss: 1.5162, test_f1: 0.6006
 epoch: 55, train_loss: 0.3069, test_loss: 1.6292, test_f1: 0.6009
 epoch: 56, train_loss: 0.2800, test_loss: 1.5866, test_f1: 0.6077
 epoch: 57, train_loss: 0.2583, test_loss: 1.6451, test_f1: 0.5877
 epoch: 58, train_loss: 0.2513, test_loss: 1.7694, test_f1: 0.5971
 epoch: 59, train_loss: 0.2512, test_loss: 1.6696, test_f1: 0.6002
 epoch: 60, train_loss: 0.2552, test_loss: 1.8063, test_f1: 0.5986
 epoch: 61, train_loss: 0.2530, test_loss: 1.8010, test_f1: 0.5904
 epoch: 62, train_loss: 0.2749, test_loss: 1.7800, test_f1: 0.6205
 epoch: 63, train_loss: 0.2297, test_loss: 1.7427, test_f1: 0.5898
 epoch: 64, train_loss: 0.2267, test_loss: 1.9348, test_f1: 0.5680
 epoch: 65, train_loss: 0.1937, test_loss: 1.8708, test_f1: 0.6062
 epoch: 66, train_loss: 0.1974, test_loss: 1.8710, test_f1: 0.6287
 epoch: 67, train_loss: 0.2012, test_loss: 1.8612, test_f1: 0.6096
 epoch: 68, train_loss: 0.1990, test_loss: 1.8478, test_f1: 0.6107
 epoch: 69, train_loss: 0.2402, test_loss: 1.9436, test_f1: 0.5890
 epoch: 70, train_loss: 0.2436, test_loss: 2.2089, test_f1: 0.6099
 epoch: 71, train_loss: 0.2446, test_loss: 2.2570, test_f1: 0.5860
 epoch: 72, train_loss: 0.2467, test_loss: 1.8564, test_f1: 0.5813
 epoch: 73, train_loss: 0.2427, test_loss: 2.2065, test_f1: 0.5618
 epoch: 74, train_loss: 0.2223, test_loss: 1.9691, test_f1: 0.6212
 epoch: 75, train_loss: 0.1977, test_loss: 2.0240, test_f1: 0.5957
 epoch: 76, train_loss: 0.1950, test_loss: 2.0394, test_f1: 0.6189
 epoch: 77, train_loss: 0.2368, test_loss: 2.0804, test_f1: 0.5991
 epoch: 78, train_loss: 0.2130, test_loss: 2.0172, test_f1: 0.5909
 epoch: 79, train_loss: 0.2020, test_loss: 2.0755, test_f1: 0.6575
 epoch: 80, train_loss: 0.1852, test_loss: 2.0709, test_f1: 0.6199
 epoch: 81, train_loss: 0.1710, test_loss: 2.0035, test_f1: 0.5976
 epoch: 82, train_loss: 0.1568, test_loss: 1.9878, test_f1: 0.6142
 epoch: 83, train_loss: 0.2026, test_loss: 2.4069, test_f1: 0.6088
 epoch: 84, train_loss: 0.1941, test_loss: 2.1674, test_f1: 0.6072
 epoch: 85, train_loss: 0.1726, test_loss: 2.0811, test_f1: 0.6172
 epoch: 86, train_loss: 0.1978, test_loss: 2.3729, test_f1: 0.5452
 epoch: 87, train_loss: 0.2134, test_loss: 2.2601, test_f1: 0.6118
 epoch: 88, train_loss: 0.1975, test_loss: 2.1247, test_f1: 0.5895
 epoch: 89, train_loss: 0.2024, test_loss: 2.4530, test_f1: 0.6022
 epoch: 90, train_loss: 0.1939, test_loss: 2.1759, test_f1: 0.6100
 epoch: 91, train_loss: 0.1853, test_loss: 2.2924, test_f1: 0.5384
 epoch: 92, train_loss: 0.1650, test_loss: 2.1726, test_f1: 0.5870
 epoch: 93, train_loss: 0.1558, test_loss: 2.1411, test_f1: 0.5820
 epoch: 94, train_loss: 0.1718, test_loss: 2.3352, test_f1: 0.5971
 epoch: 95, train_loss: 0.1662, test_loss: 2.4302, test_f1: 0.5904
 epoch: 96, train_loss: 0.1548, test_loss: 2.4409, test_f1: 0.5897
 epoch: 97, train_loss: 0.1476, test_loss: 2.3435, test_f1: 0.6090
 epoch: 98, train_loss: 0.1405, test_loss: 2.1558, test_f1: 0.6296
 epoch: 99, train_loss: 0.1581, test_loss: 2.3110, test_f1: 0.5996
##################ITERATION #6 ****************************************
 epoch: 0, train_loss: 1.2507, test_loss: 1.3775, test_f1: 0.2545
 epoch: 1, train_loss: 1.0744, test_loss: 1.3114, test_f1: 0.3474
 epoch: 2, train_loss: 0.9808, test_loss: 1.2111, test_f1: 0.4492
 epoch: 3, train_loss: 0.9330, test_loss: 1.0782, test_f1: 0.5322
 epoch: 4, train_loss: 0.9170, test_loss: 1.0387, test_f1: 0.5930
 epoch: 5, train_loss: 0.8889, test_loss: 1.0072, test_f1: 0.5693
 epoch: 6, train_loss: 0.8548, test_loss: 0.9802, test_f1: 0.6197
 epoch: 7, train_loss: 0.8320, test_loss: 1.0101, test_f1: 0.5668
 epoch: 8, train_loss: 0.8186, test_loss: 0.9740, test_f1: 0.6014
 epoch: 9, train_loss: 0.7692, test_loss: 0.9658, test_f1: 0.5992
 epoch: 10, train_loss: 0.7570, test_loss: 1.0257, test_f1: 0.5595
 epoch: 11, train_loss: 0.7524, test_loss: 0.9884, test_f1: 0.5868
 epoch: 12, train_loss: 0.6966, test_loss: 1.0842, test_f1: 0.6010
 epoch: 13, train_loss: 0.7032, test_loss: 0.8973, test_f1: 0.6410
 epoch: 14, train_loss: 0.7008, test_loss: 1.0090, test_f1: 0.6159
 epoch: 15, train_loss: 0.6701, test_loss: 0.9926, test_f1: 0.6147
 epoch: 16, train_loss: 0.6712, test_loss: 1.0556, test_f1: 0.5636
 epoch: 17, train_loss: 0.6753, test_loss: 1.0029, test_f1: 0.6056
 epoch: 18, train_loss: 0.6533, test_loss: 0.9988, test_f1: 0.6034
 epoch: 19, train_loss: 0.6395, test_loss: 0.9288, test_f1: 0.6817
 epoch: 20, train_loss: 0.6269, test_loss: 0.9714, test_f1: 0.6351
 epoch: 21, train_loss: 0.6024, test_loss: 1.0089, test_f1: 0.5902
 epoch: 22, train_loss: 0.6062, test_loss: 1.1335, test_f1: 0.5869
 epoch: 23, train_loss: 0.5825, test_loss: 1.1369, test_f1: 0.5670
 epoch: 24, train_loss: 0.5665, test_loss: 1.0778, test_f1: 0.6159
 epoch: 25, train_loss: 0.5567, test_loss: 1.0874, test_f1: 0.5924
 epoch: 26, train_loss: 0.5453, test_loss: 1.0042, test_f1: 0.6202
 epoch: 27, train_loss: 0.5477, test_loss: 1.1908, test_f1: 0.5765
 epoch: 28, train_loss: 0.5556, test_loss: 1.1307, test_f1: 0.5916
 epoch: 29, train_loss: 0.5282, test_loss: 1.2587, test_f1: 0.5757
 epoch: 30, train_loss: 0.5133, test_loss: 1.1014, test_f1: 0.5816
 epoch: 31, train_loss: 0.5034, test_loss: 1.1080, test_f1: 0.6182
 epoch: 32, train_loss: 0.4772, test_loss: 1.2241, test_f1: 0.5665
 epoch: 33, train_loss: 0.4727, test_loss: 1.3037, test_f1: 0.5601
 epoch: 34, train_loss: 0.4963, test_loss: 1.2609, test_f1: 0.5723
 epoch: 35, train_loss: 0.4548, test_loss: 1.0831, test_f1: 0.6194
 epoch: 36, train_loss: 0.4510, test_loss: 1.1356, test_f1: 0.6127
 epoch: 37, train_loss: 0.4630, test_loss: 1.1892, test_f1: 0.6375
 epoch: 38, train_loss: 0.4301, test_loss: 1.1135, test_f1: 0.5934
 epoch: 39, train_loss: 0.4415, test_loss: 1.4906, test_f1: 0.5500
 epoch: 40, train_loss: 0.4352, test_loss: 1.4224, test_f1: 0.5535
 epoch: 41, train_loss: 0.4088, test_loss: 1.3944, test_f1: 0.6125
 epoch: 42, train_loss: 0.4050, test_loss: 1.1798, test_f1: 0.6502
 epoch: 43, train_loss: 0.4025, test_loss: 1.4419, test_f1: 0.5702
 epoch: 44, train_loss: 0.3899, test_loss: 1.6445, test_f1: 0.5497
 epoch: 45, train_loss: 0.3819, test_loss: 1.5146, test_f1: 0.5992
 epoch: 46, train_loss: 0.3898, test_loss: 1.4788, test_f1: 0.5776
 epoch: 47, train_loss: 0.3894, test_loss: 1.4313, test_f1: 0.6183
 epoch: 48, train_loss: 0.4085, test_loss: 1.3498, test_f1: 0.6124
 epoch: 49, train_loss: 0.3564, test_loss: 1.6410, test_f1: 0.5601
 epoch: 50, train_loss: 0.3699, test_loss: 1.4867, test_f1: 0.6470
 epoch: 51, train_loss: 0.3126, test_loss: 1.3980, test_f1: 0.6080
 epoch: 52, train_loss: 0.2793, test_loss: 1.3942, test_f1: 0.6196
 epoch: 53, train_loss: 0.2800, test_loss: 1.3994, test_f1: 0.6487
 epoch: 54, train_loss: 0.2568, test_loss: 1.5746, test_f1: 0.6014
 epoch: 55, train_loss: 0.2577, test_loss: 1.5960, test_f1: 0.6084
 epoch: 56, train_loss: 0.2613, test_loss: 1.5653, test_f1: 0.6119
 epoch: 57, train_loss: 0.2337, test_loss: 1.5182, test_f1: 0.6231
 epoch: 58, train_loss: 0.2357, test_loss: 1.5524, test_f1: 0.6203
 epoch: 59, train_loss: 0.2374, test_loss: 1.6365, test_f1: 0.6379
 epoch: 60, train_loss: 0.2012, test_loss: 1.7259, test_f1: 0.5832
 epoch: 61, train_loss: 0.2322, test_loss: 1.7047, test_f1: 0.5785
 epoch: 62, train_loss: 0.2710, test_loss: 1.7493, test_f1: 0.6041
 epoch: 63, train_loss: 0.2975, test_loss: 1.8348, test_f1: 0.5760
 epoch: 64, train_loss: 0.2677, test_loss: 1.8093, test_f1: 0.5862
 epoch: 65, train_loss: 0.2338, test_loss: 1.7676, test_f1: 0.6116
 epoch: 66, train_loss: 0.2116, test_loss: 1.7632, test_f1: 0.6309
 epoch: 67, train_loss: 0.2192, test_loss: 1.7414, test_f1: 0.6093
 epoch: 68, train_loss: 0.2002, test_loss: 1.7815, test_f1: 0.6248
 epoch: 69, train_loss: 0.1962, test_loss: 1.8668, test_f1: 0.5627
 epoch: 70, train_loss: 0.1841, test_loss: 1.9859, test_f1: 0.5813
 epoch: 71, train_loss: 0.1798, test_loss: 1.7998, test_f1: 0.6082
 epoch: 72, train_loss: 0.1849, test_loss: 1.9650, test_f1: 0.6113
 epoch: 73, train_loss: 0.1865, test_loss: 2.0942, test_f1: 0.5920
 epoch: 74, train_loss: 0.1695, test_loss: 1.8676, test_f1: 0.6131
 epoch: 75, train_loss: 0.1904, test_loss: 1.8081, test_f1: 0.6123
 epoch: 76, train_loss: 0.2449, test_loss: 1.8777, test_f1: 0.6139
 epoch: 77, train_loss: 0.2235, test_loss: 2.0253, test_f1: 0.5880
 epoch: 78, train_loss: 0.1958, test_loss: 2.0738, test_f1: 0.6006
 epoch: 79, train_loss: 0.1827, test_loss: 1.8330, test_f1: 0.6196
 epoch: 80, train_loss: 0.1764, test_loss: 1.8423, test_f1: 0.6532
 epoch: 81, train_loss: 0.1662, test_loss: 1.9889, test_f1: 0.6304
 epoch: 82, train_loss: 0.2033, test_loss: 2.2479, test_f1: 0.6054
 epoch: 83, train_loss: 0.1865, test_loss: 2.0260, test_f1: 0.6043
 epoch: 84, train_loss: 0.1750, test_loss: 2.0232, test_f1: 0.6061
 epoch: 85, train_loss: 0.1600, test_loss: 2.0101, test_f1: 0.6356
 epoch: 86, train_loss: 0.1519, test_loss: 2.0495, test_f1: 0.6056
 epoch: 87, train_loss: 0.1842, test_loss: 2.0234, test_f1: 0.6305
 epoch: 88, train_loss: 0.1636, test_loss: 2.0816, test_f1: 0.5947
 epoch: 89, train_loss: 0.1660, test_loss: 2.1063, test_f1: 0.5853
 epoch: 90, train_loss: 0.1824, test_loss: 2.0560, test_f1: 0.6066
 epoch: 91, train_loss: 0.1693, test_loss: 2.1804, test_f1: 0.6161
 epoch: 92, train_loss: 0.1261, test_loss: 2.3553, test_f1: 0.5890
 epoch: 93, train_loss: 0.1425, test_loss: 2.5606, test_f1: 0.5840
 epoch: 94, train_loss: 0.1963, test_loss: 2.2354, test_f1: 0.5963
 epoch: 95, train_loss: 0.1421, test_loss: 2.0713, test_f1: 0.6053
 epoch: 96, train_loss: 0.1279, test_loss: 2.0189, test_f1: 0.6372
 epoch: 97, train_loss: 0.1253, test_loss: 2.1401, test_f1: 0.6359
 epoch: 98, train_loss: 0.1618, test_loss: 2.3492, test_f1: 0.6184
 epoch: 99, train_loss: 0.1323, test_loss: 2.4667, test_f1: 0.5821
##################ITERATION #7 ****************************************
 epoch: 0, train_loss: 1.3050, test_loss: 1.3771, test_f1: 0.1687
 epoch: 1, train_loss: 1.0495, test_loss: 1.3251, test_f1: 0.2628
 epoch: 2, train_loss: 0.9920, test_loss: 1.2411, test_f1: 0.2970
 epoch: 3, train_loss: 0.9626, test_loss: 1.1499, test_f1: 0.4249
 epoch: 4, train_loss: 0.9156, test_loss: 1.0589, test_f1: 0.5797
 epoch: 5, train_loss: 0.8626, test_loss: 1.0364, test_f1: 0.6008
 epoch: 6, train_loss: 0.8405, test_loss: 1.0845, test_f1: 0.6202
 epoch: 7, train_loss: 0.8399, test_loss: 1.0243, test_f1: 0.5720
 epoch: 8, train_loss: 0.8186, test_loss: 1.1894, test_f1: 0.5537
 epoch: 9, train_loss: 0.7827, test_loss: 1.0763, test_f1: 0.5684
 epoch: 10, train_loss: 0.7665, test_loss: 1.0644, test_f1: 0.5536
 epoch: 11, train_loss: 0.7198, test_loss: 1.1122, test_f1: 0.5904
 epoch: 12, train_loss: 0.7537, test_loss: 1.1277, test_f1: 0.5705
 epoch: 13, train_loss: 0.7284, test_loss: 1.1164, test_f1: 0.5580
 epoch: 14, train_loss: 0.6732, test_loss: 1.1292, test_f1: 0.5448
 epoch: 15, train_loss: 0.6948, test_loss: 1.1041, test_f1: 0.6087
 epoch: 16, train_loss: 0.6633, test_loss: 1.1225, test_f1: 0.6021
 epoch: 17, train_loss: 0.6702, test_loss: 1.0809, test_f1: 0.5673
 epoch: 18, train_loss: 0.6372, test_loss: 1.2096, test_f1: 0.5430
 epoch: 19, train_loss: 0.6338, test_loss: 1.2746, test_f1: 0.5799
 epoch: 20, train_loss: 0.6051, test_loss: 1.2499, test_f1: 0.6085
 epoch: 21, train_loss: 0.6138, test_loss: 1.2556, test_f1: 0.6056
 epoch: 22, train_loss: 0.6079, test_loss: 1.2616, test_f1: 0.5590
 epoch: 23, train_loss: 0.5779, test_loss: 1.2627, test_f1: 0.5631
 epoch: 24, train_loss: 0.5455, test_loss: 1.1688, test_f1: 0.6332
 epoch: 25, train_loss: 0.5607, test_loss: 1.1555, test_f1: 0.5824
 epoch: 26, train_loss: 0.5173, test_loss: 1.1969, test_f1: 0.6126
 epoch: 27, train_loss: 0.4915, test_loss: 1.3564, test_f1: 0.6033
 epoch: 28, train_loss: 0.5062, test_loss: 1.4488, test_f1: 0.5812
 epoch: 29, train_loss: 0.5135, test_loss: 1.3836, test_f1: 0.5983
 epoch: 30, train_loss: 0.5003, test_loss: 1.2639, test_f1: 0.5856
 epoch: 31, train_loss: 0.4877, test_loss: 1.2989, test_f1: 0.5939
 epoch: 32, train_loss: 0.5395, test_loss: 1.2047, test_f1: 0.6025
 epoch: 33, train_loss: 0.5475, test_loss: 1.2884, test_f1: 0.6114
 epoch: 34, train_loss: 0.5064, test_loss: 1.4202, test_f1: 0.5735
 epoch: 35, train_loss: 0.5074, test_loss: 1.4120, test_f1: 0.5628
 epoch: 36, train_loss: 0.4846, test_loss: 1.5484, test_f1: 0.5481
 epoch: 37, train_loss: 0.4775, test_loss: 1.5701, test_f1: 0.5752
 epoch: 38, train_loss: 0.4469, test_loss: 1.5274, test_f1: 0.5884
 epoch: 39, train_loss: 0.4424, test_loss: 1.4978, test_f1: 0.5670
 epoch: 40, train_loss: 0.3979, test_loss: 1.4399, test_f1: 0.6009
 epoch: 41, train_loss: 0.4281, test_loss: 1.5452, test_f1: 0.5963
 epoch: 42, train_loss: 0.4222, test_loss: 1.4216, test_f1: 0.5556
 epoch: 43, train_loss: 0.3996, test_loss: 1.5962, test_f1: 0.5956
 epoch: 44, train_loss: 0.3611, test_loss: 1.3885, test_f1: 0.6377
 epoch: 45, train_loss: 0.3560, test_loss: 1.5224, test_f1: 0.6152
 epoch: 46, train_loss: 0.3987, test_loss: 1.7047, test_f1: 0.6027
 epoch: 47, train_loss: 0.3768, test_loss: 1.7454, test_f1: 0.6012
 epoch: 48, train_loss: 0.3775, test_loss: 1.6869, test_f1: 0.5639
 epoch: 49, train_loss: 0.3410, test_loss: 1.6384, test_f1: 0.5883
 epoch: 50, train_loss: 0.3649, test_loss: 1.9192, test_f1: 0.6085
 epoch: 51, train_loss: 0.3198, test_loss: 1.4922, test_f1: 0.6254
 epoch: 52, train_loss: 0.3102, test_loss: 1.6772, test_f1: 0.5908
 epoch: 53, train_loss: 0.2908, test_loss: 1.6408, test_f1: 0.6171
 epoch: 54, train_loss: 0.2560, test_loss: 1.7795, test_f1: 0.6186
 epoch: 55, train_loss: 0.2625, test_loss: 1.8179, test_f1: 0.5948
 epoch: 56, train_loss: 0.2668, test_loss: 1.8272, test_f1: 0.6242
 epoch: 57, train_loss: 0.2697, test_loss: 1.6741, test_f1: 0.6215
 epoch: 58, train_loss: 0.2651, test_loss: 1.7566, test_f1: 0.6265
 epoch: 59, train_loss: 0.2710, test_loss: 1.7954, test_f1: 0.6195
 epoch: 60, train_loss: 0.2492, test_loss: 1.8745, test_f1: 0.5765
 epoch: 61, train_loss: 0.2629, test_loss: 1.7434, test_f1: 0.6187
 epoch: 62, train_loss: 0.2389, test_loss: 1.7948, test_f1: 0.6255
 epoch: 63, train_loss: 0.2026, test_loss: 1.8661, test_f1: 0.6382
 epoch: 64, train_loss: 0.2124, test_loss: 1.9269, test_f1: 0.6148
 epoch: 65, train_loss: 0.1966, test_loss: 1.8444, test_f1: 0.6215
 epoch: 66, train_loss: 0.2053, test_loss: 1.9114, test_f1: 0.6084
 epoch: 67, train_loss: 0.2158, test_loss: 1.9417, test_f1: 0.6261
 epoch: 68, train_loss: 0.2152, test_loss: 1.9830, test_f1: 0.6102
 epoch: 69, train_loss: 0.2045, test_loss: 1.8803, test_f1: 0.6264
 epoch: 70, train_loss: 0.1971, test_loss: 1.7981, test_f1: 0.6398
 epoch: 71, train_loss: 0.2203, test_loss: 2.0157, test_f1: 0.6246
 epoch: 72, train_loss: 0.2008, test_loss: 2.1854, test_f1: 0.6104
 epoch: 73, train_loss: 0.1980, test_loss: 2.0519, test_f1: 0.6004
 epoch: 74, train_loss: 0.2007, test_loss: 2.0885, test_f1: 0.6011
 epoch: 75, train_loss: 0.1892, test_loss: 1.9326, test_f1: 0.6270
 epoch: 76, train_loss: 0.2087, test_loss: 2.1853, test_f1: 0.6142
 epoch: 77, train_loss: 0.1921, test_loss: 2.2878, test_f1: 0.6057
 epoch: 78, train_loss: 0.1892, test_loss: 1.9386, test_f1: 0.6057
 epoch: 79, train_loss: 0.2004, test_loss: 1.9561, test_f1: 0.6145
 epoch: 80, train_loss: 0.2159, test_loss: 1.9741, test_f1: 0.6287
 epoch: 81, train_loss: 0.2171, test_loss: 2.2124, test_f1: 0.6095
 epoch: 82, train_loss: 0.1850, test_loss: 1.9531, test_f1: 0.6177
 epoch: 83, train_loss: 0.1894, test_loss: 2.1271, test_f1: 0.6242
 epoch: 84, train_loss: 0.1757, test_loss: 2.1238, test_f1: 0.6211
 epoch: 85, train_loss: 0.1818, test_loss: 2.0386, test_f1: 0.6127
 epoch: 86, train_loss: 0.1636, test_loss: 2.3262, test_f1: 0.6022
 epoch: 87, train_loss: 0.1502, test_loss: 1.9415, test_f1: 0.6478
 epoch: 88, train_loss: 0.2436, test_loss: 2.3725, test_f1: 0.6200
 epoch: 89, train_loss: 0.2163, test_loss: 2.2697, test_f1: 0.6034
 epoch: 90, train_loss: 0.2064, test_loss: 2.2970, test_f1: 0.5960
 epoch: 91, train_loss: 0.2145, test_loss: 2.2842, test_f1: 0.6179
 epoch: 92, train_loss: 0.1790, test_loss: 2.2827, test_f1: 0.6073
 epoch: 93, train_loss: 0.1869, test_loss: 2.0961, test_f1: 0.6393
 epoch: 94, train_loss: 0.1309, test_loss: 2.3404, test_f1: 0.6314
 epoch: 95, train_loss: 0.1277, test_loss: 2.2119, test_f1: 0.6198
 epoch: 96, train_loss: 0.1489, test_loss: 2.3321, test_f1: 0.6299
 epoch: 97, train_loss: 0.1552, test_loss: 2.4160, test_f1: 0.6183
 epoch: 98, train_loss: 0.1424, test_loss: 2.2394, test_f1: 0.6373
 epoch: 99, train_loss: 0.2276, test_loss: 2.1887, test_f1: 0.6130
##################ITERATION #8 ****************************************
 epoch: 0, train_loss: 1.3263, test_loss: 1.3010, test_f1: 0.3021
 epoch: 1, train_loss: 1.0785, test_loss: 1.3196, test_f1: 0.2782
 epoch: 2, train_loss: 0.9781, test_loss: 1.2797, test_f1: 0.3275
 epoch: 3, train_loss: 0.9585, test_loss: 1.1285, test_f1: 0.4487
 epoch: 4, train_loss: 0.9144, test_loss: 1.0642, test_f1: 0.4867
 epoch: 5, train_loss: 0.8796, test_loss: 1.0638, test_f1: 0.5262
 epoch: 6, train_loss: 0.8510, test_loss: 1.0075, test_f1: 0.5752
 epoch: 7, train_loss: 0.8452, test_loss: 1.1531, test_f1: 0.5566
 epoch: 8, train_loss: 0.7904, test_loss: 1.0693, test_f1: 0.5813
 epoch: 9, train_loss: 0.7695, test_loss: 1.0414, test_f1: 0.6025
 epoch: 10, train_loss: 0.7748, test_loss: 1.1123, test_f1: 0.5975
 epoch: 11, train_loss: 0.7326, test_loss: 1.1592, test_f1: 0.6000
 epoch: 12, train_loss: 0.7232, test_loss: 1.1209, test_f1: 0.5943
 epoch: 13, train_loss: 0.7135, test_loss: 1.0682, test_f1: 0.5723
 epoch: 14, train_loss: 0.7278, test_loss: 1.0618, test_f1: 0.5843
 epoch: 15, train_loss: 0.6928, test_loss: 1.0027, test_f1: 0.6054
 epoch: 16, train_loss: 0.7047, test_loss: 1.2916, test_f1: 0.6533
 epoch: 17, train_loss: 0.6819, test_loss: 1.1226, test_f1: 0.5892
 epoch: 18, train_loss: 0.6773, test_loss: 1.1982, test_f1: 0.5456
 epoch: 19, train_loss: 0.6441, test_loss: 1.0640, test_f1: 0.5991
 epoch: 20, train_loss: 0.6050, test_loss: 1.2952, test_f1: 0.5697
 epoch: 21, train_loss: 0.6002, test_loss: 1.1841, test_f1: 0.5934
 epoch: 22, train_loss: 0.6055, test_loss: 1.2559, test_f1: 0.5845
 epoch: 23, train_loss: 0.5961, test_loss: 1.2688, test_f1: 0.6005
 epoch: 24, train_loss: 0.5887, test_loss: 1.3752, test_f1: 0.5946
 epoch: 25, train_loss: 0.5681, test_loss: 1.5042, test_f1: 0.5762
 epoch: 26, train_loss: 0.5720, test_loss: 1.4063, test_f1: 0.5605
 epoch: 27, train_loss: 0.5780, test_loss: 1.3093, test_f1: 0.5789
 epoch: 28, train_loss: 0.5478, test_loss: 1.1098, test_f1: 0.6084
 epoch: 29, train_loss: 0.5500, test_loss: 1.2578, test_f1: 0.5787
 epoch: 30, train_loss: 0.5268, test_loss: 1.5727, test_f1: 0.5514
 epoch: 31, train_loss: 0.5207, test_loss: 1.2633, test_f1: 0.5780
 epoch: 32, train_loss: 0.5029, test_loss: 1.4718, test_f1: 0.6074
 epoch: 33, train_loss: 0.4637, test_loss: 1.2584, test_f1: 0.6173
 epoch: 34, train_loss: 0.4597, test_loss: 1.4220, test_f1: 0.5963
 epoch: 35, train_loss: 0.4872, test_loss: 1.3950, test_f1: 0.6183
 epoch: 36, train_loss: 0.4788, test_loss: 1.4624, test_f1: 0.6006
 epoch: 37, train_loss: 0.4378, test_loss: 1.3931, test_f1: 0.6133
 epoch: 38, train_loss: 0.4535, test_loss: 1.3940, test_f1: 0.5740
 epoch: 39, train_loss: 0.4282, test_loss: 1.4372, test_f1: 0.5980
 epoch: 40, train_loss: 0.4420, test_loss: 1.5013, test_f1: 0.6151
 epoch: 41, train_loss: 0.4534, test_loss: 1.5689, test_f1: 0.5233
 epoch: 42, train_loss: 0.4346, test_loss: 1.3713, test_f1: 0.6238
 epoch: 43, train_loss: 0.4286, test_loss: 1.4129, test_f1: 0.5981
 epoch: 44, train_loss: 0.3835, test_loss: 1.6359, test_f1: 0.5903
 epoch: 45, train_loss: 0.3925, test_loss: 1.7823, test_f1: 0.5529
 epoch: 46, train_loss: 0.3708, test_loss: 1.6183, test_f1: 0.6279
 epoch: 47, train_loss: 0.3600, test_loss: 1.9285, test_f1: 0.5383
 epoch: 48, train_loss: 0.3739, test_loss: 1.8198, test_f1: 0.5877
 epoch: 49, train_loss: 0.4003, test_loss: 1.5594, test_f1: 0.6004
 epoch: 50, train_loss: 0.3858, test_loss: 1.7704, test_f1: 0.6207
 epoch: 51, train_loss: 0.3667, test_loss: 1.7740, test_f1: 0.5673
 epoch: 52, train_loss: 0.3494, test_loss: 1.7264, test_f1: 0.6074
 epoch: 53, train_loss: 0.3160, test_loss: 1.8024, test_f1: 0.6140
 epoch: 54, train_loss: 0.3022, test_loss: 1.7202, test_f1: 0.6006
 epoch: 55, train_loss: 0.2637, test_loss: 1.7128, test_f1: 0.6226
 epoch: 56, train_loss: 0.2656, test_loss: 1.8886, test_f1: 0.6209
 epoch: 57, train_loss: 0.2471, test_loss: 1.8616, test_f1: 0.6018
 epoch: 58, train_loss: 0.2538, test_loss: 1.9914, test_f1: 0.5657
 epoch: 59, train_loss: 0.2553, test_loss: 1.9977, test_f1: 0.6206
 epoch: 60, train_loss: 0.2581, test_loss: 1.9049, test_f1: 0.6206
 epoch: 61, train_loss: 0.2746, test_loss: 1.8979, test_f1: 0.6142
 epoch: 62, train_loss: 0.2706, test_loss: 2.1093, test_f1: 0.5959
 epoch: 63, train_loss: 0.2700, test_loss: 2.1961, test_f1: 0.6135
 epoch: 64, train_loss: 0.2608, test_loss: 1.8911, test_f1: 0.6113
 epoch: 65, train_loss: 0.2504, test_loss: 1.9650, test_f1: 0.6119
 epoch: 66, train_loss: 0.2740, test_loss: 1.9682, test_f1: 0.6023
 epoch: 67, train_loss: 0.2714, test_loss: 2.1171, test_f1: 0.6100
 epoch: 68, train_loss: 0.2480, test_loss: 2.0023, test_f1: 0.5918
 epoch: 69, train_loss: 0.2382, test_loss: 2.1112, test_f1: 0.5401
 epoch: 70, train_loss: 0.2467, test_loss: 2.0184, test_f1: 0.6064
 epoch: 71, train_loss: 0.2363, test_loss: 2.1117, test_f1: 0.5875
 epoch: 72, train_loss: 0.2293, test_loss: 2.0685, test_f1: 0.6104
 epoch: 73, train_loss: 0.1947, test_loss: 2.1180, test_f1: 0.5767
 epoch: 74, train_loss: 0.2119, test_loss: 2.1621, test_f1: 0.5637
 epoch: 75, train_loss: 0.1954, test_loss: 2.1536, test_f1: 0.5721
 epoch: 76, train_loss: 0.1712, test_loss: 2.2405, test_f1: 0.6071
 epoch: 77, train_loss: 0.2127, test_loss: 2.0305, test_f1: 0.6077
 epoch: 78, train_loss: 0.2287, test_loss: 2.2598, test_f1: 0.5997
 epoch: 79, train_loss: 0.2014, test_loss: 2.1140, test_f1: 0.6059
 epoch: 80, train_loss: 0.1800, test_loss: 2.2217, test_f1: 0.5886
 epoch: 81, train_loss: 0.2060, test_loss: 2.3488, test_f1: 0.5962
 epoch: 82, train_loss: 0.2036, test_loss: 2.2066, test_f1: 0.6114
 epoch: 83, train_loss: 0.2137, test_loss: 2.2895, test_f1: 0.5971
 epoch: 84, train_loss: 0.2090, test_loss: 2.2411, test_f1: 0.5843
 epoch: 85, train_loss: 0.1950, test_loss: 2.4052, test_f1: 0.5855
 epoch: 86, train_loss: 0.2069, test_loss: 2.3484, test_f1: 0.5780
 epoch: 87, train_loss: 0.2097, test_loss: 2.3378, test_f1: 0.5858
 epoch: 88, train_loss: 0.1843, test_loss: 2.1637, test_f1: 0.6028
 epoch: 89, train_loss: 0.1709, test_loss: 2.3224, test_f1: 0.6114
 epoch: 90, train_loss: 0.1592, test_loss: 2.4899, test_f1: 0.5877
 epoch: 91, train_loss: 0.1705, test_loss: 2.5690, test_f1: 0.5719
 epoch: 92, train_loss: 0.1582, test_loss: 2.5206, test_f1: 0.5974
 epoch: 93, train_loss: 0.1668, test_loss: 2.4743, test_f1: 0.6001
 epoch: 94, train_loss: 0.1675, test_loss: 2.4821, test_f1: 0.6008
 epoch: 95, train_loss: 0.1436, test_loss: 2.5340, test_f1: 0.6086
 epoch: 96, train_loss: 0.1819, test_loss: 2.7995, test_f1: 0.6005
 epoch: 97, train_loss: 0.1874, test_loss: 2.3858, test_f1: 0.6312
 epoch: 98, train_loss: 0.1848, test_loss: 2.6488, test_f1: 0.5753
 epoch: 99, train_loss: 0.1782, test_loss: 2.6665, test_f1: 0.5702
##################ITERATION #9 ****************************************
 epoch: 0, train_loss: 1.3790, test_loss: 1.4089, test_f1: 0.1486
 epoch: 1, train_loss: 1.1256, test_loss: 1.3258, test_f1: 0.2460
 epoch: 2, train_loss: 1.0401, test_loss: 1.3183, test_f1: 0.3003
 epoch: 3, train_loss: 0.9674, test_loss: 1.1634, test_f1: 0.4695
 epoch: 4, train_loss: 0.9211, test_loss: 1.0640, test_f1: 0.5383
 epoch: 5, train_loss: 0.8951, test_loss: 1.0100, test_f1: 0.5740
 epoch: 6, train_loss: 0.8848, test_loss: 1.0310, test_f1: 0.5677
 epoch: 7, train_loss: 0.8677, test_loss: 1.0265, test_f1: 0.5750
 epoch: 8, train_loss: 0.7972, test_loss: 1.0542, test_f1: 0.5560
 epoch: 9, train_loss: 0.7860, test_loss: 1.0826, test_f1: 0.5533
 epoch: 10, train_loss: 0.7786, test_loss: 1.0793, test_f1: 0.5408
 epoch: 11, train_loss: 0.7608, test_loss: 1.0094, test_f1: 0.6221
 epoch: 12, train_loss: 0.7330, test_loss: 1.1116, test_f1: 0.5614
 epoch: 13, train_loss: 0.7186, test_loss: 1.0416, test_f1: 0.6038
 epoch: 14, train_loss: 0.7038, test_loss: 1.0538, test_f1: 0.5833
 epoch: 15, train_loss: 0.6727, test_loss: 1.0966, test_f1: 0.5690
 epoch: 16, train_loss: 0.6742, test_loss: 1.0781, test_f1: 0.5726
 epoch: 17, train_loss: 0.6642, test_loss: 1.0490, test_f1: 0.5674
 epoch: 18, train_loss: 0.6331, test_loss: 1.0509, test_f1: 0.5988
 epoch: 19, train_loss: 0.6392, test_loss: 1.0241, test_f1: 0.6191
 epoch: 20, train_loss: 0.6283, test_loss: 1.1739, test_f1: 0.5674
 epoch: 21, train_loss: 0.6286, test_loss: 1.0548, test_f1: 0.6015
 epoch: 22, train_loss: 0.5986, test_loss: 1.0315, test_f1: 0.6534
 epoch: 23, train_loss: 0.5721, test_loss: 1.1378, test_f1: 0.5898
 epoch: 24, train_loss: 0.5896, test_loss: 1.1053, test_f1: 0.5910
 epoch: 25, train_loss: 0.5854, test_loss: 1.1609, test_f1: 0.5827
 epoch: 26, train_loss: 0.5921, test_loss: 1.0970, test_f1: 0.5945
 epoch: 27, train_loss: 0.5841, test_loss: 1.2426, test_f1: 0.5383
 epoch: 28, train_loss: 0.5515, test_loss: 1.3238, test_f1: 0.5354
 epoch: 29, train_loss: 0.5283, test_loss: 1.4175, test_f1: 0.5188
 epoch: 30, train_loss: 0.5188, test_loss: 1.2266, test_f1: 0.6162
 epoch: 31, train_loss: 0.4889, test_loss: 1.2368, test_f1: 0.5975
 epoch: 32, train_loss: 0.5203, test_loss: 1.2851, test_f1: 0.6124
 epoch: 33, train_loss: 0.4884, test_loss: 1.3290, test_f1: 0.5561
 epoch: 34, train_loss: 0.4816, test_loss: 1.5455, test_f1: 0.4994
 epoch: 35, train_loss: 0.4873, test_loss: 1.4350, test_f1: 0.6025
 epoch: 36, train_loss: 0.4579, test_loss: 1.5733, test_f1: 0.5360
 epoch: 37, train_loss: 0.4550, test_loss: 1.3022, test_f1: 0.5639
 epoch: 38, train_loss: 0.4364, test_loss: 1.3373, test_f1: 0.6045
 epoch: 39, train_loss: 0.4154, test_loss: 1.3738, test_f1: 0.5317
 epoch: 40, train_loss: 0.4197, test_loss: 1.4536, test_f1: 0.5588
 epoch: 41, train_loss: 0.4378, test_loss: 1.3847, test_f1: 0.5835
 epoch: 42, train_loss: 0.4343, test_loss: 1.4471, test_f1: 0.5300
 epoch: 43, train_loss: 0.4581, test_loss: 1.5732, test_f1: 0.5159
 epoch: 44, train_loss: 0.4097, test_loss: 1.8415, test_f1: 0.5425
 epoch: 45, train_loss: 0.4597, test_loss: 1.6963, test_f1: 0.5105
 epoch: 46, train_loss: 0.3992, test_loss: 1.3833, test_f1: 0.5795
 epoch: 47, train_loss: 0.3678, test_loss: 1.4655, test_f1: 0.5973
 epoch: 48, train_loss: 0.3810, test_loss: 1.5604, test_f1: 0.5490
 epoch: 49, train_loss: 0.3943, test_loss: 1.4006, test_f1: 0.6054
 epoch: 50, train_loss: 0.3462, test_loss: 1.4676, test_f1: 0.6034
 epoch: 51, train_loss: 0.3243, test_loss: 1.5233, test_f1: 0.6037
 epoch: 52, train_loss: 0.3042, test_loss: 1.5126, test_f1: 0.6391
 epoch: 53, train_loss: 0.2910, test_loss: 1.5065, test_f1: 0.6209
 epoch: 54, train_loss: 0.3000, test_loss: 1.4911, test_f1: 0.6106
 epoch: 55, train_loss: 0.2737, test_loss: 1.5468, test_f1: 0.6230
 epoch: 56, train_loss: 0.2538, test_loss: 1.5306, test_f1: 0.6128
 epoch: 57, train_loss: 0.2579, test_loss: 1.6138, test_f1: 0.6055
 epoch: 58, train_loss: 0.2635, test_loss: 1.6838, test_f1: 0.6210
 epoch: 59, train_loss: 0.2515, test_loss: 1.5847, test_f1: 0.6062
 epoch: 60, train_loss: 0.2528, test_loss: 1.6661, test_f1: 0.5942
 epoch: 61, train_loss: 0.2372, test_loss: 1.7483, test_f1: 0.6165
 epoch: 62, train_loss: 0.2272, test_loss: 1.7590, test_f1: 0.5803
 epoch: 63, train_loss: 0.2434, test_loss: 1.8430, test_f1: 0.5923
 epoch: 64, train_loss: 0.2545, test_loss: 1.8034, test_f1: 0.5708
 epoch: 65, train_loss: 0.2430, test_loss: 1.7473, test_f1: 0.5768
 epoch: 66, train_loss: 0.2570, test_loss: 2.0084, test_f1: 0.5657
 epoch: 67, train_loss: 0.2504, test_loss: 1.7470, test_f1: 0.5664
 epoch: 68, train_loss: 0.2410, test_loss: 1.9090, test_f1: 0.5889
 epoch: 69, train_loss: 0.2505, test_loss: 1.9033, test_f1: 0.5597
 epoch: 70, train_loss: 0.2271, test_loss: 1.7640, test_f1: 0.6113
 epoch: 71, train_loss: 0.2121, test_loss: 1.7887, test_f1: 0.6137
 epoch: 72, train_loss: 0.2542, test_loss: 1.9156, test_f1: 0.5528
 epoch: 73, train_loss: 0.2325, test_loss: 1.6354, test_f1: 0.6050
 epoch: 74, train_loss: 0.2679, test_loss: 1.6186, test_f1: 0.6130
 epoch: 75, train_loss: 0.2429, test_loss: 1.8240, test_f1: 0.6185
 epoch: 76, train_loss: 0.2366, test_loss: 1.7581, test_f1: 0.5923
 epoch: 77, train_loss: 0.2124, test_loss: 1.9481, test_f1: 0.5805
 epoch: 78, train_loss: 0.1980, test_loss: 1.8105, test_f1: 0.6186
 epoch: 79, train_loss: 0.2031, test_loss: 1.9475, test_f1: 0.5749
 epoch: 80, train_loss: 0.1988, test_loss: 1.8474, test_f1: 0.6268
 epoch: 81, train_loss: 0.2193, test_loss: 1.9109, test_f1: 0.5973
 epoch: 82, train_loss: 0.2137, test_loss: 2.1943, test_f1: 0.5800
 epoch: 83, train_loss: 0.1863, test_loss: 1.9692, test_f1: 0.6098
 epoch: 84, train_loss: 0.2094, test_loss: 1.8347, test_f1: 0.5830
 epoch: 85, train_loss: 0.1951, test_loss: 1.9203, test_f1: 0.5840
 epoch: 86, train_loss: 0.1857, test_loss: 1.9882, test_f1: 0.5929
 epoch: 87, train_loss: 0.1757, test_loss: 1.8785, test_f1: 0.5920
 epoch: 88, train_loss: 0.1817, test_loss: 2.1465, test_f1: 0.5639
 epoch: 89, train_loss: 0.1690, test_loss: 2.4755, test_f1: 0.5407
 epoch: 90, train_loss: 0.1627, test_loss: 2.0390, test_f1: 0.5761
 epoch: 91, train_loss: 0.1662, test_loss: 2.0108, test_f1: 0.6021
 epoch: 92, train_loss: 0.1487, test_loss: 2.1276, test_f1: 0.5800
 epoch: 93, train_loss: 0.1961, test_loss: 2.4027, test_f1: 0.5339
 epoch: 94, train_loss: 0.1679, test_loss: 2.0549, test_f1: 0.5794
 epoch: 95, train_loss: 0.1546, test_loss: 2.0220, test_f1: 0.5935
 epoch: 96, train_loss: 0.1570, test_loss: 2.0762, test_f1: 0.5751
 epoch: 97, train_loss: 0.1726, test_loss: 2.0541, test_f1: 0.5809
 epoch: 98, train_loss: 0.1625, test_loss: 2.1351, test_f1: 0.6157
 epoch: 99, train_loss: 0.1662, test_loss: 2.2416, test_f1: 0.5744

Training completed in 375.11 seconds
Best F1: 0.6817 at epoch 19
Mean F1 across iterations: 0.6590  0.0121
========================FINAL RESULTS================================
FEGIN weighted F1: 0.6817  0.0121
python main.py --data ltspice_demos --representation component_pin --model FEGIN --layers 5 --hiddens 64 --batch_size 128 --lr 0.001 --emb_size 250 --epochs 100 --save_appendix component_pin_L5_H64_BS128_LR0.001_E250 --no_val
-----



STDERR:
  File "main.py", line 370, in <module>
    main()
  File "main.py", line 254, in main
    dataset = dataset_class(
  File "/home/philip/projects/ltspice_examples_code_repo/Circuit-Completion-Using-GNNs/component_classification_with_link_prediction_head/evaluation/FEGIN/kernel/circuit_datasets.py", line 15, in __init__
    self.data, self.slices = torch.load(self.processed_paths[0])
  File "/home/philip/.local/lib/python3.8/site-packages/torch/serialization.py", line 1040, in load
    warnings.warn(
  File "/usr/lib/python3.8/warnings.py", line 109, in _showwarnmsg
    sw(msg.message, msg.category, msg.filename, msg.lineno,
  File "main.py", line 47, in warn_with_traceback
    traceback.print_stack(file=log)
/home/philip/projects/ltspice_examples_code_repo/Circuit-Completion-Using-GNNs/component_classification_with_link_prediction_head/evaluation/FEGIN/kernel/circuit_datasets.py:15: FutureWarning: You are using `torch.load` with `weights_only=False` (the current default value), which uses the default pickle module implicitly. It is possible to construct malicious pickle data which will execute arbitrary code during unpickling (See https://github.com/pytorch/pytorch/blob/main/SECURITY.md#untrusted-models for more details). In a future release, the default value for `weights_only` will be flipped to `True`. This limits the functions that could be executed during unpickling. Arbitrary objects will no longer be allowed to be loaded via this mode unless they are explicitly allowlisted by the user via `torch.serialization.add_safe_globals`. We recommend you start setting `weights_only=True` for any use case where you don't have full control of the loaded file. Please open an issue on GitHub for any issues related to this experimental feature.
  self.data, self.slices = torch.load(self.processed_paths[0])
