STDOUT:
Results will be saved in /home/philip/projects/ltspice_examples_code_repo/Circuit-Completion-Using-GNNs/component_classification_with_link_prediction_head/evaluation/FEGIN/results/model_FEGIN_dataset_ltspice_examples
Command line input: python main.py --data ltspice_examples --representation component_component --model FEGIN --layers 6 --hiddens 64 --batch_size 256 --lr 0.0001 --emb_size 250 --epochs 100 --save_appendix component_component_L6_H64_BS256_LR0.0001_E250 --no_val
 is saved.
-----
ltspice_examples - FEGIN
Using 6 layers, 64 hidden units, h = 2
Loading component_component representation dataset
ENTERED
Training FEGIN on component_component representation
Train: 3556, Test: 845
##################ITERATION #0 ****************************************
 epoch: 0, train_loss: 1.3604, test_loss: 1.3647, test_f1: 0.2274
 epoch: 1, train_loss: 1.3529, test_loss: 1.3592, test_f1: 0.2555
 epoch: 2, train_loss: 1.3468, test_loss: 1.3498, test_f1: 0.2676
 epoch: 3, train_loss: 1.3413, test_loss: 1.3395, test_f1: 0.2626
 epoch: 4, train_loss: 1.3344, test_loss: 1.3297, test_f1: 0.2660
 epoch: 5, train_loss: 1.3269, test_loss: 1.3193, test_f1: 0.2855
 epoch: 6, train_loss: 1.3183, test_loss: 1.3093, test_f1: 0.3039
 epoch: 7, train_loss: 1.3091, test_loss: 1.2978, test_f1: 0.3060
 epoch: 8, train_loss: 1.2990, test_loss: 1.2869, test_f1: 0.3068
 epoch: 9, train_loss: 1.2875, test_loss: 1.2746, test_f1: 0.3084
 epoch: 10, train_loss: 1.2776, test_loss: 1.2625, test_f1: 0.3124
 epoch: 11, train_loss: 1.2683, test_loss: 1.2505, test_f1: 0.3125
 epoch: 12, train_loss: 1.2559, test_loss: 1.2399, test_f1: 0.3142
 epoch: 13, train_loss: 1.2477, test_loss: 1.2288, test_f1: 0.3174
 epoch: 14, train_loss: 1.2387, test_loss: 1.2205, test_f1: 0.3172
 epoch: 15, train_loss: 1.2304, test_loss: 1.2109, test_f1: 0.3127
 epoch: 16, train_loss: 1.2205, test_loss: 1.2030, test_f1: 0.3279
 epoch: 17, train_loss: 1.2153, test_loss: 1.1956, test_f1: 0.3352
 epoch: 18, train_loss: 1.2107, test_loss: 1.1891, test_f1: 0.3446
 epoch: 19, train_loss: 1.1981, test_loss: 1.1822, test_f1: 0.3493
 epoch: 20, train_loss: 1.1952, test_loss: 1.1748, test_f1: 0.3380
 epoch: 21, train_loss: 1.1849, test_loss: 1.1682, test_f1: 0.3488
 epoch: 22, train_loss: 1.1762, test_loss: 1.1613, test_f1: 0.3579
 epoch: 23, train_loss: 1.1757, test_loss: 1.1583, test_f1: 0.3392
 epoch: 24, train_loss: 1.1639, test_loss: 1.1524, test_f1: 0.3464
 epoch: 25, train_loss: 1.1558, test_loss: 1.1468, test_f1: 0.3490
 epoch: 26, train_loss: 1.1441, test_loss: 1.1423, test_f1: 0.3519
 epoch: 27, train_loss: 1.1400, test_loss: 1.1377, test_f1: 0.3556
 epoch: 28, train_loss: 1.1306, test_loss: 1.1393, test_f1: 0.3522
 epoch: 29, train_loss: 1.1218, test_loss: 1.1274, test_f1: 0.3582
 epoch: 30, train_loss: 1.1199, test_loss: 1.1198, test_f1: 0.3680
 epoch: 31, train_loss: 1.1081, test_loss: 1.1199, test_f1: 0.3675
 epoch: 32, train_loss: 1.0981, test_loss: 1.1155, test_f1: 0.3673
 epoch: 33, train_loss: 1.0945, test_loss: 1.1122, test_f1: 0.3624
 epoch: 34, train_loss: 1.0883, test_loss: 1.1100, test_f1: 0.3601
 epoch: 35, train_loss: 1.0881, test_loss: 1.1142, test_f1: 0.3619
 epoch: 36, train_loss: 1.0754, test_loss: 1.1016, test_f1: 0.3800
 epoch: 37, train_loss: 1.0649, test_loss: 1.1060, test_f1: 0.4043
 epoch: 38, train_loss: 1.0519, test_loss: 1.1027, test_f1: 0.4331
 epoch: 39, train_loss: 1.0590, test_loss: 1.1030, test_f1: 0.4464
 epoch: 40, train_loss: 1.0510, test_loss: 1.0943, test_f1: 0.4594
 epoch: 41, train_loss: 1.0423, test_loss: 1.0951, test_f1: 0.4540
 epoch: 42, train_loss: 1.0338, test_loss: 1.0994, test_f1: 0.4470
 epoch: 43, train_loss: 1.0324, test_loss: 1.0965, test_f1: 0.4525
 epoch: 44, train_loss: 1.0256, test_loss: 1.0917, test_f1: 0.4534
 epoch: 45, train_loss: 1.0122, test_loss: 1.0867, test_f1: 0.4647
 epoch: 46, train_loss: 1.0081, test_loss: 1.0928, test_f1: 0.4533
 epoch: 47, train_loss: 1.0087, test_loss: 1.0903, test_f1: 0.4583
 epoch: 48, train_loss: 1.0019, test_loss: 1.0988, test_f1: 0.4550
 epoch: 49, train_loss: 0.9986, test_loss: 1.1058, test_f1: 0.4580
 epoch: 50, train_loss: 0.9871, test_loss: 1.0882, test_f1: 0.4614
 epoch: 51, train_loss: 0.9786, test_loss: 1.0940, test_f1: 0.4605
 epoch: 52, train_loss: 0.9854, test_loss: 1.0922, test_f1: 0.4649
 epoch: 53, train_loss: 0.9727, test_loss: 1.0786, test_f1: 0.4630
 epoch: 54, train_loss: 0.9743, test_loss: 1.0874, test_f1: 0.4637
 epoch: 55, train_loss: 0.9793, test_loss: 1.0864, test_f1: 0.4678
 epoch: 56, train_loss: 0.9650, test_loss: 1.0845, test_f1: 0.4561
 epoch: 57, train_loss: 0.9750, test_loss: 1.0802, test_f1: 0.4656
 epoch: 58, train_loss: 0.9655, test_loss: 1.0799, test_f1: 0.4636
 epoch: 59, train_loss: 0.9569, test_loss: 1.0802, test_f1: 0.4549
 epoch: 60, train_loss: 0.9531, test_loss: 1.0866, test_f1: 0.4563
 epoch: 61, train_loss: 0.9586, test_loss: 1.0827, test_f1: 0.4663
 epoch: 62, train_loss: 0.9519, test_loss: 1.0818, test_f1: 0.4650
 epoch: 63, train_loss: 0.9449, test_loss: 1.0839, test_f1: 0.4638
 epoch: 64, train_loss: 0.9580, test_loss: 1.0819, test_f1: 0.4656
 epoch: 65, train_loss: 0.9444, test_loss: 1.0885, test_f1: 0.4634
 epoch: 66, train_loss: 0.9481, test_loss: 1.0878, test_f1: 0.4560
 epoch: 67, train_loss: 0.9446, test_loss: 1.0789, test_f1: 0.4570
 epoch: 68, train_loss: 0.9428, test_loss: 1.0884, test_f1: 0.4472
 epoch: 69, train_loss: 0.9326, test_loss: 1.0845, test_f1: 0.4561
 epoch: 70, train_loss: 0.9377, test_loss: 1.0932, test_f1: 0.4585
 epoch: 71, train_loss: 0.9391, test_loss: 1.0904, test_f1: 0.4593
 epoch: 72, train_loss: 0.9314, test_loss: 1.0880, test_f1: 0.4559
 epoch: 73, train_loss: 0.9328, test_loss: 1.0889, test_f1: 0.4600
 epoch: 74, train_loss: 0.9253, test_loss: 1.0952, test_f1: 0.4616
 epoch: 75, train_loss: 0.9284, test_loss: 1.0921, test_f1: 0.4591
 epoch: 76, train_loss: 0.9256, test_loss: 1.0943, test_f1: 0.4620
 epoch: 77, train_loss: 0.9323, test_loss: 1.1041, test_f1: 0.4579
 epoch: 78, train_loss: 0.9206, test_loss: 1.1045, test_f1: 0.4571
 epoch: 79, train_loss: 0.9202, test_loss: 1.0985, test_f1: 0.4556
 epoch: 80, train_loss: 0.9248, test_loss: 1.1040, test_f1: 0.4540
 epoch: 81, train_loss: 0.9079, test_loss: 1.1114, test_f1: 0.4617
 epoch: 82, train_loss: 0.9154, test_loss: 1.1078, test_f1: 0.4583
 epoch: 83, train_loss: 0.9198, test_loss: 1.1050, test_f1: 0.4612
 epoch: 84, train_loss: 0.9163, test_loss: 1.0971, test_f1: 0.4588
 epoch: 85, train_loss: 0.9116, test_loss: 1.1067, test_f1: 0.4525
 epoch: 86, train_loss: 0.9113, test_loss: 1.1038, test_f1: 0.4591
 epoch: 87, train_loss: 0.9212, test_loss: 1.1030, test_f1: 0.4572
 epoch: 88, train_loss: 0.9065, test_loss: 1.1067, test_f1: 0.4536
 epoch: 89, train_loss: 0.8989, test_loss: 1.1013, test_f1: 0.4542
 epoch: 90, train_loss: 0.8988, test_loss: 1.1131, test_f1: 0.4507
 epoch: 91, train_loss: 0.8954, test_loss: 1.1049, test_f1: 0.4508
 epoch: 92, train_loss: 0.8988, test_loss: 1.0999, test_f1: 0.4508
 epoch: 93, train_loss: 0.8980, test_loss: 1.1098, test_f1: 0.4522
 epoch: 94, train_loss: 0.8981, test_loss: 1.1071, test_f1: 0.4510
 epoch: 95, train_loss: 0.8926, test_loss: 1.1050, test_f1: 0.4491
 epoch: 96, train_loss: 0.8831, test_loss: 1.1122, test_f1: 0.4535
 epoch: 97, train_loss: 0.8817, test_loss: 1.1372, test_f1: 0.4545
 epoch: 98, train_loss: 0.8968, test_loss: 1.1219, test_f1: 0.4496
 epoch: 99, train_loss: 0.8754, test_loss: 1.1171, test_f1: 0.4501
##################ITERATION #1 ****************************************
 epoch: 0, train_loss: 1.3367, test_loss: 1.3457, test_f1: 0.2274
 epoch: 1, train_loss: 1.3215, test_loss: 1.3329, test_f1: 0.2274
 epoch: 2, train_loss: 1.3110, test_loss: 1.3217, test_f1: 0.2274
 epoch: 3, train_loss: 1.2997, test_loss: 1.3058, test_f1: 0.2274
 epoch: 4, train_loss: 1.2885, test_loss: 1.2897, test_f1: 0.2633
 epoch: 5, train_loss: 1.2775, test_loss: 1.2718, test_f1: 0.2873
 epoch: 6, train_loss: 1.2672, test_loss: 1.2572, test_f1: 0.2910
 epoch: 7, train_loss: 1.2552, test_loss: 1.2417, test_f1: 0.3113
 epoch: 8, train_loss: 1.2444, test_loss: 1.2286, test_f1: 0.3152
 epoch: 9, train_loss: 1.2357, test_loss: 1.2157, test_f1: 0.3204
 epoch: 10, train_loss: 1.2224, test_loss: 1.2036, test_f1: 0.3316
 epoch: 11, train_loss: 1.2119, test_loss: 1.1931, test_f1: 0.3301
 epoch: 12, train_loss: 1.2038, test_loss: 1.1820, test_f1: 0.3302
 epoch: 13, train_loss: 1.1953, test_loss: 1.1733, test_f1: 0.3468
 epoch: 14, train_loss: 1.1835, test_loss: 1.1656, test_f1: 0.3662
 epoch: 15, train_loss: 1.1765, test_loss: 1.1575, test_f1: 0.3742
 epoch: 16, train_loss: 1.1681, test_loss: 1.1484, test_f1: 0.3930
 epoch: 17, train_loss: 1.1620, test_loss: 1.1422, test_f1: 0.4067
 epoch: 18, train_loss: 1.1511, test_loss: 1.1307, test_f1: 0.4063
 epoch: 19, train_loss: 1.1463, test_loss: 1.1260, test_f1: 0.4099
 epoch: 20, train_loss: 1.1352, test_loss: 1.1226, test_f1: 0.4038
 epoch: 21, train_loss: 1.1312, test_loss: 1.1133, test_f1: 0.4145
 epoch: 22, train_loss: 1.1206, test_loss: 1.1102, test_f1: 0.4134
 epoch: 23, train_loss: 1.1066, test_loss: 1.1054, test_f1: 0.4301
 epoch: 24, train_loss: 1.1050, test_loss: 1.1000, test_f1: 0.4255
 epoch: 25, train_loss: 1.0934, test_loss: 1.0920, test_f1: 0.4213
 epoch: 26, train_loss: 1.0842, test_loss: 1.0918, test_f1: 0.4267
 epoch: 27, train_loss: 1.0727, test_loss: 1.0847, test_f1: 0.4358
 epoch: 28, train_loss: 1.0598, test_loss: 1.0852, test_f1: 0.4447
 epoch: 29, train_loss: 1.0604, test_loss: 1.0848, test_f1: 0.4325
 epoch: 30, train_loss: 1.0504, test_loss: 1.0665, test_f1: 0.4610
 epoch: 31, train_loss: 1.0402, test_loss: 1.0798, test_f1: 0.4439
 epoch: 32, train_loss: 1.0316, test_loss: 1.0747, test_f1: 0.4440
 epoch: 33, train_loss: 1.0191, test_loss: 1.0788, test_f1: 0.4574
 epoch: 34, train_loss: 1.0104, test_loss: 1.0776, test_f1: 0.4488
 epoch: 35, train_loss: 0.9935, test_loss: 1.0770, test_f1: 0.4626
 epoch: 36, train_loss: 1.0032, test_loss: 1.0667, test_f1: 0.4672
 epoch: 37, train_loss: 0.9910, test_loss: 1.0719, test_f1: 0.4672
 epoch: 38, train_loss: 0.9769, test_loss: 1.0781, test_f1: 0.4600
 epoch: 39, train_loss: 0.9762, test_loss: 1.0796, test_f1: 0.4676
 epoch: 40, train_loss: 0.9624, test_loss: 1.0897, test_f1: 0.4531
 epoch: 41, train_loss: 0.9676, test_loss: 1.0999, test_f1: 0.4393
 epoch: 42, train_loss: 0.9555, test_loss: 1.0909, test_f1: 0.4615
 epoch: 43, train_loss: 0.9538, test_loss: 1.0927, test_f1: 0.4562
 epoch: 44, train_loss: 0.9463, test_loss: 1.0837, test_f1: 0.4655
 epoch: 45, train_loss: 0.9364, test_loss: 1.0944, test_f1: 0.4484
 epoch: 46, train_loss: 0.9342, test_loss: 1.1043, test_f1: 0.4360
 epoch: 47, train_loss: 0.9338, test_loss: 1.1122, test_f1: 0.4551
 epoch: 48, train_loss: 0.9220, test_loss: 1.1236, test_f1: 0.4437
 epoch: 49, train_loss: 0.9277, test_loss: 1.1150, test_f1: 0.4445
 epoch: 50, train_loss: 0.9054, test_loss: 1.1169, test_f1: 0.4489
 epoch: 51, train_loss: 0.8974, test_loss: 1.1180, test_f1: 0.4471
 epoch: 52, train_loss: 0.8925, test_loss: 1.1202, test_f1: 0.4519
 epoch: 53, train_loss: 0.8870, test_loss: 1.1203, test_f1: 0.4416
 epoch: 54, train_loss: 0.8971, test_loss: 1.1208, test_f1: 0.4422
 epoch: 55, train_loss: 0.8864, test_loss: 1.1281, test_f1: 0.4502
 epoch: 56, train_loss: 0.8773, test_loss: 1.1425, test_f1: 0.4438
 epoch: 57, train_loss: 0.8874, test_loss: 1.1451, test_f1: 0.4473
 epoch: 58, train_loss: 0.8864, test_loss: 1.1322, test_f1: 0.4546
 epoch: 59, train_loss: 0.8739, test_loss: 1.1476, test_f1: 0.4547
 epoch: 60, train_loss: 0.8793, test_loss: 1.1463, test_f1: 0.4638
 epoch: 61, train_loss: 0.8721, test_loss: 1.1485, test_f1: 0.4569
 epoch: 62, train_loss: 0.8670, test_loss: 1.1437, test_f1: 0.4562
 epoch: 63, train_loss: 0.8601, test_loss: 1.1557, test_f1: 0.4491
 epoch: 64, train_loss: 0.8565, test_loss: 1.1518, test_f1: 0.4593
 epoch: 65, train_loss: 0.8710, test_loss: 1.1518, test_f1: 0.4464
 epoch: 66, train_loss: 0.8635, test_loss: 1.1642, test_f1: 0.4673
 epoch: 67, train_loss: 0.8653, test_loss: 1.1588, test_f1: 0.4527
 epoch: 68, train_loss: 0.8491, test_loss: 1.1614, test_f1: 0.4608
 epoch: 69, train_loss: 0.8534, test_loss: 1.1622, test_f1: 0.4563
 epoch: 70, train_loss: 0.8517, test_loss: 1.1508, test_f1: 0.4598
 epoch: 71, train_loss: 0.8398, test_loss: 1.1833, test_f1: 0.4604
 epoch: 72, train_loss: 0.8446, test_loss: 1.1698, test_f1: 0.4555
 epoch: 73, train_loss: 0.8376, test_loss: 1.1733, test_f1: 0.4528
 epoch: 74, train_loss: 0.8540, test_loss: 1.1779, test_f1: 0.4611
 epoch: 75, train_loss: 0.8352, test_loss: 1.1774, test_f1: 0.4544
 epoch: 76, train_loss: 0.8426, test_loss: 1.1877, test_f1: 0.4586
 epoch: 77, train_loss: 0.8378, test_loss: 1.1952, test_f1: 0.4583
 epoch: 78, train_loss: 0.8428, test_loss: 1.1764, test_f1: 0.4601
 epoch: 79, train_loss: 0.8279, test_loss: 1.1937, test_f1: 0.4533
 epoch: 80, train_loss: 0.8362, test_loss: 1.2043, test_f1: 0.4557
 epoch: 81, train_loss: 0.8194, test_loss: 1.2035, test_f1: 0.4595
 epoch: 82, train_loss: 0.8100, test_loss: 1.2119, test_f1: 0.4667
 epoch: 83, train_loss: 0.8200, test_loss: 1.2200, test_f1: 0.4606
 epoch: 84, train_loss: 0.8210, test_loss: 1.2247, test_f1: 0.4600
 epoch: 85, train_loss: 0.8201, test_loss: 1.2186, test_f1: 0.4599
 epoch: 86, train_loss: 0.8097, test_loss: 1.2206, test_f1: 0.4550
 epoch: 87, train_loss: 0.8184, test_loss: 1.2201, test_f1: 0.4597
 epoch: 88, train_loss: 0.8147, test_loss: 1.2231, test_f1: 0.4583
 epoch: 89, train_loss: 0.8048, test_loss: 1.2357, test_f1: 0.4567
 epoch: 90, train_loss: 0.8125, test_loss: 1.2471, test_f1: 0.4602
 epoch: 91, train_loss: 0.8056, test_loss: 1.2382, test_f1: 0.4507
 epoch: 92, train_loss: 0.7971, test_loss: 1.2474, test_f1: 0.4594
 epoch: 93, train_loss: 0.8040, test_loss: 1.2482, test_f1: 0.4549
 epoch: 94, train_loss: 0.8052, test_loss: 1.2223, test_f1: 0.4500
 epoch: 95, train_loss: 0.8005, test_loss: 1.2508, test_f1: 0.4583
 epoch: 96, train_loss: 0.7864, test_loss: 1.2550, test_f1: 0.4577
 epoch: 97, train_loss: 0.7844, test_loss: 1.2426, test_f1: 0.4625
 epoch: 98, train_loss: 0.8027, test_loss: 1.2723, test_f1: 0.4483
 epoch: 99, train_loss: 0.7888, test_loss: 1.2822, test_f1: 0.4614
##################ITERATION #2 ****************************************
 epoch: 0, train_loss: 1.3213, test_loss: 1.3392, test_f1: 0.2274
 epoch: 1, train_loss: 1.2957, test_loss: 1.3201, test_f1: 0.2274
 epoch: 2, train_loss: 1.2780, test_loss: 1.2907, test_f1: 0.2274
 epoch: 3, train_loss: 1.2664, test_loss: 1.2625, test_f1: 0.2463
 epoch: 4, train_loss: 1.2533, test_loss: 1.2435, test_f1: 0.2609
 epoch: 5, train_loss: 1.2437, test_loss: 1.2298, test_f1: 0.3321
 epoch: 6, train_loss: 1.2355, test_loss: 1.2186, test_f1: 0.3190
 epoch: 7, train_loss: 1.2214, test_loss: 1.2092, test_f1: 0.3214
 epoch: 8, train_loss: 1.2143, test_loss: 1.1984, test_f1: 0.3479
 epoch: 9, train_loss: 1.2016, test_loss: 1.1897, test_f1: 0.3871
 epoch: 10, train_loss: 1.1943, test_loss: 1.1797, test_f1: 0.4193
 epoch: 11, train_loss: 1.1829, test_loss: 1.1703, test_f1: 0.4427
 epoch: 12, train_loss: 1.1733, test_loss: 1.1624, test_f1: 0.4496
 epoch: 13, train_loss: 1.1600, test_loss: 1.1538, test_f1: 0.4569
 epoch: 14, train_loss: 1.1523, test_loss: 1.1467, test_f1: 0.4618
 epoch: 15, train_loss: 1.1392, test_loss: 1.1371, test_f1: 0.4662
 epoch: 16, train_loss: 1.1342, test_loss: 1.1307, test_f1: 0.4550
 epoch: 17, train_loss: 1.1242, test_loss: 1.1229, test_f1: 0.4597
 epoch: 18, train_loss: 1.1194, test_loss: 1.1178, test_f1: 0.4565
 epoch: 19, train_loss: 1.1078, test_loss: 1.1113, test_f1: 0.4523
 epoch: 20, train_loss: 1.0991, test_loss: 1.1064, test_f1: 0.4541
 epoch: 21, train_loss: 1.0977, test_loss: 1.0988, test_f1: 0.4549
 epoch: 22, train_loss: 1.0823, test_loss: 1.0978, test_f1: 0.4462
 epoch: 23, train_loss: 1.0668, test_loss: 1.0902, test_f1: 0.4498
 epoch: 24, train_loss: 1.0605, test_loss: 1.0809, test_f1: 0.4563
 epoch: 25, train_loss: 1.0472, test_loss: 1.0807, test_f1: 0.4494
 epoch: 26, train_loss: 1.0449, test_loss: 1.0763, test_f1: 0.4596
 epoch: 27, train_loss: 1.0423, test_loss: 1.0775, test_f1: 0.4589
 epoch: 28, train_loss: 1.0270, test_loss: 1.0697, test_f1: 0.4494
 epoch: 29, train_loss: 1.0236, test_loss: 1.0643, test_f1: 0.4636
 epoch: 30, train_loss: 1.0103, test_loss: 1.0592, test_f1: 0.4606
 epoch: 31, train_loss: 1.0029, test_loss: 1.0629, test_f1: 0.4644
 epoch: 32, train_loss: 1.0058, test_loss: 1.0530, test_f1: 0.4651
 epoch: 33, train_loss: 0.9876, test_loss: 1.0525, test_f1: 0.4647
 epoch: 34, train_loss: 0.9849, test_loss: 1.0528, test_f1: 0.4661
 epoch: 35, train_loss: 0.9778, test_loss: 1.0690, test_f1: 0.4600
 epoch: 36, train_loss: 0.9751, test_loss: 1.0665, test_f1: 0.4644
 epoch: 37, train_loss: 0.9626, test_loss: 1.0578, test_f1: 0.4608
 epoch: 38, train_loss: 0.9663, test_loss: 1.0519, test_f1: 0.4659
 epoch: 39, train_loss: 0.9564, test_loss: 1.0554, test_f1: 0.4681
 epoch: 40, train_loss: 0.9407, test_loss: 1.0570, test_f1: 0.4627
 epoch: 41, train_loss: 0.9404, test_loss: 1.0588, test_f1: 0.4564
 epoch: 42, train_loss: 0.9374, test_loss: 1.0491, test_f1: 0.4537
 epoch: 43, train_loss: 0.9191, test_loss: 1.0654, test_f1: 0.4517
 epoch: 44, train_loss: 0.9268, test_loss: 1.0625, test_f1: 0.4615
 epoch: 45, train_loss: 0.9202, test_loss: 1.0584, test_f1: 0.4616
 epoch: 46, train_loss: 0.9079, test_loss: 1.0638, test_f1: 0.4651
 epoch: 47, train_loss: 0.9071, test_loss: 1.0679, test_f1: 0.4527
 epoch: 48, train_loss: 0.9011, test_loss: 1.0711, test_f1: 0.4626
 epoch: 49, train_loss: 0.8906, test_loss: 1.0708, test_f1: 0.4629
 epoch: 50, train_loss: 0.8996, test_loss: 1.0823, test_f1: 0.4471
 epoch: 51, train_loss: 0.8810, test_loss: 1.0746, test_f1: 0.4611
 epoch: 52, train_loss: 0.8756, test_loss: 1.0803, test_f1: 0.4587
 epoch: 53, train_loss: 0.8707, test_loss: 1.0787, test_f1: 0.4488
 epoch: 54, train_loss: 0.8764, test_loss: 1.0935, test_f1: 0.4548
 epoch: 55, train_loss: 0.8655, test_loss: 1.0892, test_f1: 0.4532
 epoch: 56, train_loss: 0.8737, test_loss: 1.0824, test_f1: 0.4499
 epoch: 57, train_loss: 0.8538, test_loss: 1.0931, test_f1: 0.4492
 epoch: 58, train_loss: 0.8640, test_loss: 1.0853, test_f1: 0.4514
 epoch: 59, train_loss: 0.8543, test_loss: 1.0753, test_f1: 0.4623
 epoch: 60, train_loss: 0.8616, test_loss: 1.0866, test_f1: 0.4607
 epoch: 61, train_loss: 0.8542, test_loss: 1.0914, test_f1: 0.4565
 epoch: 62, train_loss: 0.8610, test_loss: 1.0920, test_f1: 0.4553
 epoch: 63, train_loss: 0.8442, test_loss: 1.1038, test_f1: 0.4471
 epoch: 64, train_loss: 0.8499, test_loss: 1.1041, test_f1: 0.4470
 epoch: 65, train_loss: 0.8440, test_loss: 1.0968, test_f1: 0.4543
 epoch: 66, train_loss: 0.8509, test_loss: 1.1037, test_f1: 0.4502
 epoch: 67, train_loss: 0.8369, test_loss: 1.0932, test_f1: 0.4667
 epoch: 68, train_loss: 0.8418, test_loss: 1.1070, test_f1: 0.4550
 epoch: 69, train_loss: 0.8397, test_loss: 1.1021, test_f1: 0.4491
 epoch: 70, train_loss: 0.8350, test_loss: 1.1037, test_f1: 0.4569
 epoch: 71, train_loss: 0.8331, test_loss: 1.1045, test_f1: 0.4597
 epoch: 72, train_loss: 0.8372, test_loss: 1.1174, test_f1: 0.4523
 epoch: 73, train_loss: 0.8261, test_loss: 1.1145, test_f1: 0.4608
 epoch: 74, train_loss: 0.8125, test_loss: 1.1172, test_f1: 0.4566
 epoch: 75, train_loss: 0.8272, test_loss: 1.1177, test_f1: 0.4486
 epoch: 76, train_loss: 0.8307, test_loss: 1.1272, test_f1: 0.4447
 epoch: 77, train_loss: 0.8161, test_loss: 1.1299, test_f1: 0.4449
 epoch: 78, train_loss: 0.8146, test_loss: 1.1333, test_f1: 0.4492
 epoch: 79, train_loss: 0.8137, test_loss: 1.1396, test_f1: 0.4460
 epoch: 80, train_loss: 0.8045, test_loss: 1.1207, test_f1: 0.4566
 epoch: 81, train_loss: 0.8114, test_loss: 1.1414, test_f1: 0.4524
 epoch: 82, train_loss: 0.8242, test_loss: 1.1328, test_f1: 0.4434
 epoch: 83, train_loss: 0.8053, test_loss: 1.1401, test_f1: 0.4484
 epoch: 84, train_loss: 0.8046, test_loss: 1.1344, test_f1: 0.4562
 epoch: 85, train_loss: 0.8055, test_loss: 1.1387, test_f1: 0.4532
 epoch: 86, train_loss: 0.7980, test_loss: 1.1472, test_f1: 0.4524
 epoch: 87, train_loss: 0.8047, test_loss: 1.1368, test_f1: 0.4575
 epoch: 88, train_loss: 0.7921, test_loss: 1.1385, test_f1: 0.4608
 epoch: 89, train_loss: 0.7972, test_loss: 1.1290, test_f1: 0.4603
 epoch: 90, train_loss: 0.7901, test_loss: 1.1314, test_f1: 0.4507
 epoch: 91, train_loss: 0.7887, test_loss: 1.1355, test_f1: 0.4568
 epoch: 92, train_loss: 0.7881, test_loss: 1.1391, test_f1: 0.4574
 epoch: 93, train_loss: 0.7808, test_loss: 1.1344, test_f1: 0.4527
 epoch: 94, train_loss: 0.7817, test_loss: 1.1417, test_f1: 0.4596
 epoch: 95, train_loss: 0.7811, test_loss: 1.1513, test_f1: 0.4533
 epoch: 96, train_loss: 0.7812, test_loss: 1.1696, test_f1: 0.4479
 epoch: 97, train_loss: 0.7766, test_loss: 1.1550, test_f1: 0.4578
 epoch: 98, train_loss: 0.7861, test_loss: 1.1648, test_f1: 0.4592
 epoch: 99, train_loss: 0.7733, test_loss: 1.1592, test_f1: 0.4556
##################ITERATION #3 ****************************************
 epoch: 0, train_loss: 1.3069, test_loss: 1.3243, test_f1: 0.2274
 epoch: 1, train_loss: 1.2823, test_loss: 1.3045, test_f1: 0.2274
 epoch: 2, train_loss: 1.2733, test_loss: 1.2712, test_f1: 0.2555
 epoch: 3, train_loss: 1.2568, test_loss: 1.2479, test_f1: 0.2657
 epoch: 4, train_loss: 1.2511, test_loss: 1.2310, test_f1: 0.2898
 epoch: 5, train_loss: 1.2403, test_loss: 1.2202, test_f1: 0.3088
 epoch: 6, train_loss: 1.2323, test_loss: 1.2117, test_f1: 0.3304
 epoch: 7, train_loss: 1.2200, test_loss: 1.2025, test_f1: 0.3478
 epoch: 8, train_loss: 1.2161, test_loss: 1.1948, test_f1: 0.3392
 epoch: 9, train_loss: 1.2062, test_loss: 1.1879, test_f1: 0.3438
 epoch: 10, train_loss: 1.1967, test_loss: 1.1806, test_f1: 0.3410
 epoch: 11, train_loss: 1.1871, test_loss: 1.1748, test_f1: 0.3466
 epoch: 12, train_loss: 1.1862, test_loss: 1.1705, test_f1: 0.3716
 epoch: 13, train_loss: 1.1803, test_loss: 1.1638, test_f1: 0.3976
 epoch: 14, train_loss: 1.1701, test_loss: 1.1592, test_f1: 0.4131
 epoch: 15, train_loss: 1.1675, test_loss: 1.1527, test_f1: 0.4406
 epoch: 16, train_loss: 1.1606, test_loss: 1.1421, test_f1: 0.4498
 epoch: 17, train_loss: 1.1614, test_loss: 1.1410, test_f1: 0.4476
 epoch: 18, train_loss: 1.1494, test_loss: 1.1373, test_f1: 0.4426
 epoch: 19, train_loss: 1.1464, test_loss: 1.1325, test_f1: 0.4478
 epoch: 20, train_loss: 1.1357, test_loss: 1.1199, test_f1: 0.4325
 epoch: 21, train_loss: 1.1340, test_loss: 1.1174, test_f1: 0.4274
 epoch: 22, train_loss: 1.1244, test_loss: 1.1141, test_f1: 0.4208
 epoch: 23, train_loss: 1.1277, test_loss: 1.1098, test_f1: 0.4446
 epoch: 24, train_loss: 1.1139, test_loss: 1.1088, test_f1: 0.4359
 epoch: 25, train_loss: 1.1134, test_loss: 1.1047, test_f1: 0.4360
 epoch: 26, train_loss: 1.1056, test_loss: 1.1033, test_f1: 0.4357
 epoch: 27, train_loss: 1.0974, test_loss: 1.0948, test_f1: 0.4434
 epoch: 28, train_loss: 1.0924, test_loss: 1.0885, test_f1: 0.4522
 epoch: 29, train_loss: 1.0943, test_loss: 1.0893, test_f1: 0.4501
 epoch: 30, train_loss: 1.0751, test_loss: 1.0874, test_f1: 0.4549
 epoch: 31, train_loss: 1.0709, test_loss: 1.0820, test_f1: 0.4499
 epoch: 32, train_loss: 1.0739, test_loss: 1.0812, test_f1: 0.4405
 epoch: 33, train_loss: 1.0661, test_loss: 1.0832, test_f1: 0.4548
 epoch: 34, train_loss: 1.0506, test_loss: 1.0782, test_f1: 0.4591
 epoch: 35, train_loss: 1.0520, test_loss: 1.0755, test_f1: 0.4684
 epoch: 36, train_loss: 1.0448, test_loss: 1.0675, test_f1: 0.4667
 epoch: 37, train_loss: 1.0444, test_loss: 1.0670, test_f1: 0.4614
 epoch: 38, train_loss: 1.0293, test_loss: 1.0661, test_f1: 0.4779
 epoch: 39, train_loss: 1.0282, test_loss: 1.0684, test_f1: 0.4658
 epoch: 40, train_loss: 1.0296, test_loss: 1.0621, test_f1: 0.4645
 epoch: 41, train_loss: 1.0171, test_loss: 1.0677, test_f1: 0.4379
 epoch: 42, train_loss: 1.0149, test_loss: 1.0650, test_f1: 0.4643
 epoch: 43, train_loss: 1.0042, test_loss: 1.0495, test_f1: 0.4853
 epoch: 44, train_loss: 1.0104, test_loss: 1.0634, test_f1: 0.4549
 epoch: 45, train_loss: 0.9927, test_loss: 1.0532, test_f1: 0.4555
 epoch: 46, train_loss: 0.9902, test_loss: 1.0538, test_f1: 0.4594
 epoch: 47, train_loss: 0.9823, test_loss: 1.0463, test_f1: 0.4577
 epoch: 48, train_loss: 0.9836, test_loss: 1.0607, test_f1: 0.4471
 epoch: 49, train_loss: 0.9667, test_loss: 1.0363, test_f1: 0.4509
 epoch: 50, train_loss: 0.9738, test_loss: 1.0418, test_f1: 0.4587
 epoch: 51, train_loss: 0.9598, test_loss: 1.0459, test_f1: 0.4554
 epoch: 52, train_loss: 0.9638, test_loss: 1.0532, test_f1: 0.4478
 epoch: 53, train_loss: 0.9605, test_loss: 1.0579, test_f1: 0.4597
 epoch: 54, train_loss: 0.9649, test_loss: 1.0611, test_f1: 0.4451
 epoch: 55, train_loss: 0.9523, test_loss: 1.0434, test_f1: 0.4524
 epoch: 56, train_loss: 0.9444, test_loss: 1.0522, test_f1: 0.4493
 epoch: 57, train_loss: 0.9472, test_loss: 1.0472, test_f1: 0.4591
 epoch: 58, train_loss: 0.9422, test_loss: 1.0474, test_f1: 0.4578
 epoch: 59, train_loss: 0.9352, test_loss: 1.0408, test_f1: 0.4627
 epoch: 60, train_loss: 0.9493, test_loss: 1.0461, test_f1: 0.4595
 epoch: 61, train_loss: 0.9283, test_loss: 1.0559, test_f1: 0.4568
 epoch: 62, train_loss: 0.9248, test_loss: 1.0531, test_f1: 0.4573
 epoch: 63, train_loss: 0.9381, test_loss: 1.0595, test_f1: 0.4644
 epoch: 64, train_loss: 0.9301, test_loss: 1.0456, test_f1: 0.4581
 epoch: 65, train_loss: 0.9263, test_loss: 1.0623, test_f1: 0.4618
 epoch: 66, train_loss: 0.9223, test_loss: 1.0465, test_f1: 0.4594
 epoch: 67, train_loss: 0.9205, test_loss: 1.0475, test_f1: 0.4594
 epoch: 68, train_loss: 0.9160, test_loss: 1.0593, test_f1: 0.4521
 epoch: 69, train_loss: 0.9248, test_loss: 1.0519, test_f1: 0.4570
 epoch: 70, train_loss: 0.9158, test_loss: 1.0554, test_f1: 0.4557
 epoch: 71, train_loss: 0.9119, test_loss: 1.0532, test_f1: 0.4569
 epoch: 72, train_loss: 0.9189, test_loss: 1.0540, test_f1: 0.4620
 epoch: 73, train_loss: 0.9029, test_loss: 1.0594, test_f1: 0.4613
 epoch: 74, train_loss: 0.9085, test_loss: 1.0609, test_f1: 0.4563
 epoch: 75, train_loss: 0.9148, test_loss: 1.0495, test_f1: 0.4653
 epoch: 76, train_loss: 0.9050, test_loss: 1.0601, test_f1: 0.4602
 epoch: 77, train_loss: 0.8929, test_loss: 1.0621, test_f1: 0.4674
 epoch: 78, train_loss: 0.9118, test_loss: 1.0723, test_f1: 0.4568
 epoch: 79, train_loss: 0.9016, test_loss: 1.0708, test_f1: 0.4561
 epoch: 80, train_loss: 0.8945, test_loss: 1.0570, test_f1: 0.4593
 epoch: 81, train_loss: 0.8947, test_loss: 1.0562, test_f1: 0.4732
 epoch: 82, train_loss: 0.8829, test_loss: 1.0697, test_f1: 0.4622
 epoch: 83, train_loss: 0.8871, test_loss: 1.0618, test_f1: 0.4670
 epoch: 84, train_loss: 0.8886, test_loss: 1.0718, test_f1: 0.4665
 epoch: 85, train_loss: 0.8873, test_loss: 1.0552, test_f1: 0.4627
 epoch: 86, train_loss: 0.8881, test_loss: 1.0618, test_f1: 0.4631
 epoch: 87, train_loss: 0.8841, test_loss: 1.0597, test_f1: 0.4579
 epoch: 88, train_loss: 0.8914, test_loss: 1.0605, test_f1: 0.4621
 epoch: 89, train_loss: 0.8720, test_loss: 1.0529, test_f1: 0.4678
 epoch: 90, train_loss: 0.8740, test_loss: 1.0579, test_f1: 0.4653
 epoch: 91, train_loss: 0.8757, test_loss: 1.0554, test_f1: 0.4662
 epoch: 92, train_loss: 0.8698, test_loss: 1.0662, test_f1: 0.4661
 epoch: 93, train_loss: 0.8661, test_loss: 1.0551, test_f1: 0.4691
 epoch: 94, train_loss: 0.8546, test_loss: 1.0723, test_f1: 0.4600
 epoch: 95, train_loss: 0.8668, test_loss: 1.0614, test_f1: 0.4636
 epoch: 96, train_loss: 0.8631, test_loss: 1.0679, test_f1: 0.4630
 epoch: 97, train_loss: 0.8599, test_loss: 1.0788, test_f1: 0.4582
 epoch: 98, train_loss: 0.8641, test_loss: 1.0683, test_f1: 0.4660
 epoch: 99, train_loss: 0.8496, test_loss: 1.0857, test_f1: 0.4676
##################ITERATION #4 ****************************************
 epoch: 0, train_loss: 1.3111, test_loss: 1.3121, test_f1: 0.2274
 epoch: 1, train_loss: 1.2785, test_loss: 1.2916, test_f1: 0.2274
 epoch: 2, train_loss: 1.2644, test_loss: 1.2640, test_f1: 0.2555
 epoch: 3, train_loss: 1.2568, test_loss: 1.2383, test_f1: 0.2931
 epoch: 4, train_loss: 1.2444, test_loss: 1.2220, test_f1: 0.3218
 epoch: 5, train_loss: 1.2357, test_loss: 1.2120, test_f1: 0.3440
 epoch: 6, train_loss: 1.2229, test_loss: 1.2046, test_f1: 0.3673
 epoch: 7, train_loss: 1.2160, test_loss: 1.1972, test_f1: 0.3962
 epoch: 8, train_loss: 1.2122, test_loss: 1.1897, test_f1: 0.4032
 epoch: 9, train_loss: 1.2025, test_loss: 1.1820, test_f1: 0.4004
 epoch: 10, train_loss: 1.1980, test_loss: 1.1767, test_f1: 0.4081
 epoch: 11, train_loss: 1.1894, test_loss: 1.1709, test_f1: 0.4121
 epoch: 12, train_loss: 1.1823, test_loss: 1.1630, test_f1: 0.4143
 epoch: 13, train_loss: 1.1786, test_loss: 1.1582, test_f1: 0.4346
 epoch: 14, train_loss: 1.1721, test_loss: 1.1532, test_f1: 0.4200
 epoch: 15, train_loss: 1.1632, test_loss: 1.1496, test_f1: 0.4223
 epoch: 16, train_loss: 1.1620, test_loss: 1.1425, test_f1: 0.4280
 epoch: 17, train_loss: 1.1517, test_loss: 1.1376, test_f1: 0.4277
 epoch: 18, train_loss: 1.1430, test_loss: 1.1348, test_f1: 0.4261
 epoch: 19, train_loss: 1.1439, test_loss: 1.1311, test_f1: 0.4154
 epoch: 20, train_loss: 1.1330, test_loss: 1.1267, test_f1: 0.4172
 epoch: 21, train_loss: 1.1331, test_loss: 1.1200, test_f1: 0.4076
 epoch: 22, train_loss: 1.1278, test_loss: 1.1172, test_f1: 0.4106
 epoch: 23, train_loss: 1.1157, test_loss: 1.1121, test_f1: 0.4194
 epoch: 24, train_loss: 1.1137, test_loss: 1.1076, test_f1: 0.4352
 epoch: 25, train_loss: 1.1041, test_loss: 1.1040, test_f1: 0.4163
 epoch: 26, train_loss: 1.0940, test_loss: 1.1008, test_f1: 0.4397
 epoch: 27, train_loss: 1.0923, test_loss: 1.0983, test_f1: 0.4287
 epoch: 28, train_loss: 1.0901, test_loss: 1.0981, test_f1: 0.4390
 epoch: 29, train_loss: 1.0819, test_loss: 1.0894, test_f1: 0.4407
 epoch: 30, train_loss: 1.0706, test_loss: 1.0855, test_f1: 0.4391
 epoch: 31, train_loss: 1.0688, test_loss: 1.0819, test_f1: 0.4268
 epoch: 32, train_loss: 1.0583, test_loss: 1.0837, test_f1: 0.4410
 epoch: 33, train_loss: 1.0525, test_loss: 1.0684, test_f1: 0.4355
 epoch: 34, train_loss: 1.0471, test_loss: 1.0692, test_f1: 0.4401
 epoch: 35, train_loss: 1.0272, test_loss: 1.0689, test_f1: 0.4349
 epoch: 36, train_loss: 1.0348, test_loss: 1.0646, test_f1: 0.4362
 epoch: 37, train_loss: 1.0230, test_loss: 1.0579, test_f1: 0.4341
 epoch: 38, train_loss: 1.0226, test_loss: 1.0536, test_f1: 0.4374
 epoch: 39, train_loss: 1.0208, test_loss: 1.0602, test_f1: 0.4392
 epoch: 40, train_loss: 1.0044, test_loss: 1.0511, test_f1: 0.4414
 epoch: 41, train_loss: 0.9962, test_loss: 1.0464, test_f1: 0.4577
 epoch: 42, train_loss: 0.9953, test_loss: 1.0630, test_f1: 0.4521
 epoch: 43, train_loss: 0.9934, test_loss: 1.0468, test_f1: 0.4576
 epoch: 44, train_loss: 0.9781, test_loss: 1.0443, test_f1: 0.4574
 epoch: 45, train_loss: 0.9882, test_loss: 1.0525, test_f1: 0.4446
 epoch: 46, train_loss: 0.9739, test_loss: 1.0545, test_f1: 0.4495
 epoch: 47, train_loss: 0.9547, test_loss: 1.0448, test_f1: 0.4518
 epoch: 48, train_loss: 0.9717, test_loss: 1.0498, test_f1: 0.4648
 epoch: 49, train_loss: 0.9543, test_loss: 1.0491, test_f1: 0.4683
 epoch: 50, train_loss: 0.9494, test_loss: 1.0467, test_f1: 0.4595
 epoch: 51, train_loss: 0.9367, test_loss: 1.0604, test_f1: 0.4547
 epoch: 52, train_loss: 0.9477, test_loss: 1.0489, test_f1: 0.4545
 epoch: 53, train_loss: 0.9325, test_loss: 1.0497, test_f1: 0.4635
 epoch: 54, train_loss: 0.9215, test_loss: 1.0494, test_f1: 0.4642
 epoch: 55, train_loss: 0.9426, test_loss: 1.0423, test_f1: 0.4619
 epoch: 56, train_loss: 0.9276, test_loss: 1.0470, test_f1: 0.4631
 epoch: 57, train_loss: 0.9347, test_loss: 1.0566, test_f1: 0.4624
 epoch: 58, train_loss: 0.9232, test_loss: 1.0477, test_f1: 0.4625
 epoch: 59, train_loss: 0.9223, test_loss: 1.0498, test_f1: 0.4630
 epoch: 60, train_loss: 0.9210, test_loss: 1.0552, test_f1: 0.4585
 epoch: 61, train_loss: 0.9266, test_loss: 1.0659, test_f1: 0.4526
 epoch: 62, train_loss: 0.9099, test_loss: 1.0548, test_f1: 0.4619
 epoch: 63, train_loss: 0.9184, test_loss: 1.0534, test_f1: 0.4594
 epoch: 64, train_loss: 0.8984, test_loss: 1.0585, test_f1: 0.4485
 epoch: 65, train_loss: 0.8951, test_loss: 1.0572, test_f1: 0.4507
 epoch: 66, train_loss: 0.9004, test_loss: 1.0532, test_f1: 0.4653
 epoch: 67, train_loss: 0.8975, test_loss: 1.0527, test_f1: 0.4604
 epoch: 68, train_loss: 0.8929, test_loss: 1.0648, test_f1: 0.4573
 epoch: 69, train_loss: 0.9003, test_loss: 1.0617, test_f1: 0.4586
 epoch: 70, train_loss: 0.8903, test_loss: 1.0623, test_f1: 0.4701
 epoch: 71, train_loss: 0.8906, test_loss: 1.0698, test_f1: 0.4534
 epoch: 72, train_loss: 0.8859, test_loss: 1.0695, test_f1: 0.4541
 epoch: 73, train_loss: 0.8851, test_loss: 1.0760, test_f1: 0.4539
 epoch: 74, train_loss: 0.8833, test_loss: 1.0606, test_f1: 0.4585
 epoch: 75, train_loss: 0.8786, test_loss: 1.0677, test_f1: 0.4576
 epoch: 76, train_loss: 0.8796, test_loss: 1.0571, test_f1: 0.4612
 epoch: 77, train_loss: 0.8803, test_loss: 1.0714, test_f1: 0.4626
 epoch: 78, train_loss: 0.8758, test_loss: 1.0832, test_f1: 0.4620
 epoch: 79, train_loss: 0.8904, test_loss: 1.0843, test_f1: 0.4627
 epoch: 80, train_loss: 0.8754, test_loss: 1.0722, test_f1: 0.4640
 epoch: 81, train_loss: 0.8797, test_loss: 1.0747, test_f1: 0.4652
 epoch: 82, train_loss: 0.8677, test_loss: 1.0728, test_f1: 0.4599
 epoch: 83, train_loss: 0.8649, test_loss: 1.1003, test_f1: 0.4665
 epoch: 84, train_loss: 0.8726, test_loss: 1.0826, test_f1: 0.4674
 epoch: 85, train_loss: 0.8681, test_loss: 1.0967, test_f1: 0.4619
 epoch: 86, train_loss: 0.8634, test_loss: 1.0812, test_f1: 0.4577
 epoch: 87, train_loss: 0.8669, test_loss: 1.0766, test_f1: 0.4682
 epoch: 88, train_loss: 0.8598, test_loss: 1.1008, test_f1: 0.4649
 epoch: 89, train_loss: 0.8563, test_loss: 1.0913, test_f1: 0.4619
 epoch: 90, train_loss: 0.8555, test_loss: 1.1056, test_f1: 0.4607
 epoch: 91, train_loss: 0.8548, test_loss: 1.0942, test_f1: 0.4631
 epoch: 92, train_loss: 0.8601, test_loss: 1.0875, test_f1: 0.4638
 epoch: 93, train_loss: 0.8537, test_loss: 1.1025, test_f1: 0.4596
 epoch: 94, train_loss: 0.8379, test_loss: 1.1121, test_f1: 0.4630
 epoch: 95, train_loss: 0.8439, test_loss: 1.1111, test_f1: 0.4623
 epoch: 96, train_loss: 0.8493, test_loss: 1.0982, test_f1: 0.4591
 epoch: 97, train_loss: 0.8484, test_loss: 1.1010, test_f1: 0.4593
 epoch: 98, train_loss: 0.8436, test_loss: 1.1023, test_f1: 0.4615
 epoch: 99, train_loss: 0.8544, test_loss: 1.1046, test_f1: 0.4593
##################ITERATION #5 ****************************************
 epoch: 0, train_loss: 1.3173, test_loss: 1.3127, test_f1: 0.2274
 epoch: 1, train_loss: 1.2736, test_loss: 1.2941, test_f1: 0.2274
 epoch: 2, train_loss: 1.2600, test_loss: 1.2687, test_f1: 0.2659
 epoch: 3, train_loss: 1.2394, test_loss: 1.2393, test_f1: 0.2913
 epoch: 4, train_loss: 1.2317, test_loss: 1.2241, test_f1: 0.3196
 epoch: 5, train_loss: 1.2187, test_loss: 1.2185, test_f1: 0.3589
 epoch: 6, train_loss: 1.2088, test_loss: 1.2234, test_f1: 0.4078
 epoch: 7, train_loss: 1.2019, test_loss: 1.2097, test_f1: 0.4232
 epoch: 8, train_loss: 1.1883, test_loss: 1.1859, test_f1: 0.4283
 epoch: 9, train_loss: 1.1793, test_loss: 1.1763, test_f1: 0.4225
 epoch: 10, train_loss: 1.1777, test_loss: 1.1520, test_f1: 0.4275
 epoch: 11, train_loss: 1.1593, test_loss: 1.1438, test_f1: 0.4202
 epoch: 12, train_loss: 1.1548, test_loss: 1.1452, test_f1: 0.4224
 epoch: 13, train_loss: 1.1482, test_loss: 1.1356, test_f1: 0.4216
 epoch: 14, train_loss: 1.1401, test_loss: 1.1250, test_f1: 0.4247
 epoch: 15, train_loss: 1.1293, test_loss: 1.1224, test_f1: 0.4194
 epoch: 16, train_loss: 1.1287, test_loss: 1.1170, test_f1: 0.4479
 epoch: 17, train_loss: 1.1305, test_loss: 1.1113, test_f1: 0.4551
 epoch: 18, train_loss: 1.1098, test_loss: 1.1012, test_f1: 0.4397
 epoch: 19, train_loss: 1.1123, test_loss: 1.0980, test_f1: 0.4407
 epoch: 20, train_loss: 1.1048, test_loss: 1.0993, test_f1: 0.4358
 epoch: 21, train_loss: 1.0941, test_loss: 1.0949, test_f1: 0.4423
 epoch: 22, train_loss: 1.0905, test_loss: 1.0895, test_f1: 0.4461
 epoch: 23, train_loss: 1.0882, test_loss: 1.0856, test_f1: 0.4447
 epoch: 24, train_loss: 1.0722, test_loss: 1.0795, test_f1: 0.4432
 epoch: 25, train_loss: 1.0713, test_loss: 1.0819, test_f1: 0.4408
 epoch: 26, train_loss: 1.0617, test_loss: 1.0803, test_f1: 0.4492
 epoch: 27, train_loss: 1.0631, test_loss: 1.0834, test_f1: 0.4493
 epoch: 28, train_loss: 1.0567, test_loss: 1.0778, test_f1: 0.4366
 epoch: 29, train_loss: 1.0539, test_loss: 1.0613, test_f1: 0.4442
 epoch: 30, train_loss: 1.0330, test_loss: 1.0674, test_f1: 0.4563
 epoch: 31, train_loss: 1.0426, test_loss: 1.0792, test_f1: 0.4475
 epoch: 32, train_loss: 1.0323, test_loss: 1.0721, test_f1: 0.4527
 epoch: 33, train_loss: 1.0220, test_loss: 1.0749, test_f1: 0.4458
 epoch: 34, train_loss: 1.0204, test_loss: 1.1003, test_f1: 0.4449
 epoch: 35, train_loss: 1.0266, test_loss: 1.0830, test_f1: 0.4594
 epoch: 36, train_loss: 1.0172, test_loss: 1.0553, test_f1: 0.4526
 epoch: 37, train_loss: 1.0091, test_loss: 1.0768, test_f1: 0.4552
 epoch: 38, train_loss: 1.0015, test_loss: 1.0659, test_f1: 0.4551
 epoch: 39, train_loss: 0.9901, test_loss: 1.0775, test_f1: 0.4588
 epoch: 40, train_loss: 0.9942, test_loss: 1.0699, test_f1: 0.4706
 epoch: 41, train_loss: 0.9890, test_loss: 1.0711, test_f1: 0.4584
 epoch: 42, train_loss: 0.9830, test_loss: 1.0587, test_f1: 0.4539
 epoch: 43, train_loss: 0.9786, test_loss: 1.0928, test_f1: 0.4590
 epoch: 44, train_loss: 0.9708, test_loss: 1.0817, test_f1: 0.4414
 epoch: 45, train_loss: 0.9756, test_loss: 1.0740, test_f1: 0.4438
 epoch: 46, train_loss: 0.9553, test_loss: 1.0986, test_f1: 0.4554
 epoch: 47, train_loss: 0.9700, test_loss: 1.0777, test_f1: 0.4485
 epoch: 48, train_loss: 0.9564, test_loss: 1.0850, test_f1: 0.4496
 epoch: 49, train_loss: 0.9541, test_loss: 1.0794, test_f1: 0.4521
 epoch: 50, train_loss: 0.9454, test_loss: 1.1048, test_f1: 0.4411
 epoch: 51, train_loss: 0.9467, test_loss: 1.0861, test_f1: 0.4342
 epoch: 52, train_loss: 0.9332, test_loss: 1.0823, test_f1: 0.4434
 epoch: 53, train_loss: 0.9301, test_loss: 1.0958, test_f1: 0.4475
 epoch: 54, train_loss: 0.9195, test_loss: 1.0916, test_f1: 0.4515
 epoch: 55, train_loss: 0.9308, test_loss: 1.1011, test_f1: 0.4582
 epoch: 56, train_loss: 0.9195, test_loss: 1.0796, test_f1: 0.4486
 epoch: 57, train_loss: 0.9377, test_loss: 1.0765, test_f1: 0.4493
 epoch: 58, train_loss: 0.9238, test_loss: 1.0786, test_f1: 0.4463
 epoch: 59, train_loss: 0.9189, test_loss: 1.0835, test_f1: 0.4535
 epoch: 60, train_loss: 0.9258, test_loss: 1.0772, test_f1: 0.4507
 epoch: 61, train_loss: 0.9233, test_loss: 1.0867, test_f1: 0.4541
 epoch: 62, train_loss: 0.9100, test_loss: 1.0965, test_f1: 0.4466
 epoch: 63, train_loss: 0.9159, test_loss: 1.0901, test_f1: 0.4523
 epoch: 64, train_loss: 0.9212, test_loss: 1.0830, test_f1: 0.4531
 epoch: 65, train_loss: 0.9100, test_loss: 1.0927, test_f1: 0.4563
 epoch: 66, train_loss: 0.9158, test_loss: 1.0857, test_f1: 0.4635
 epoch: 67, train_loss: 0.9107, test_loss: 1.0859, test_f1: 0.4527
 epoch: 68, train_loss: 0.9025, test_loss: 1.0745, test_f1: 0.4483
 epoch: 69, train_loss: 0.9001, test_loss: 1.1004, test_f1: 0.4455
 epoch: 70, train_loss: 0.8990, test_loss: 1.0867, test_f1: 0.4574
 epoch: 71, train_loss: 0.8907, test_loss: 1.0857, test_f1: 0.4607
 epoch: 72, train_loss: 0.8981, test_loss: 1.0899, test_f1: 0.4556
 epoch: 73, train_loss: 0.9051, test_loss: 1.0994, test_f1: 0.4511
 epoch: 74, train_loss: 0.8998, test_loss: 1.1085, test_f1: 0.4537
 epoch: 75, train_loss: 0.8859, test_loss: 1.0990, test_f1: 0.4602
 epoch: 76, train_loss: 0.8944, test_loss: 1.0910, test_f1: 0.4572
 epoch: 77, train_loss: 0.8853, test_loss: 1.1055, test_f1: 0.4469
 epoch: 78, train_loss: 0.8804, test_loss: 1.1086, test_f1: 0.4553
 epoch: 79, train_loss: 0.8883, test_loss: 1.1005, test_f1: 0.4523
 epoch: 80, train_loss: 0.8842, test_loss: 1.1051, test_f1: 0.4526
 epoch: 81, train_loss: 0.8762, test_loss: 1.0937, test_f1: 0.4651
 epoch: 82, train_loss: 0.8623, test_loss: 1.1061, test_f1: 0.4602
 epoch: 83, train_loss: 0.8703, test_loss: 1.1056, test_f1: 0.4656
 epoch: 84, train_loss: 0.8788, test_loss: 1.0975, test_f1: 0.4624
 epoch: 85, train_loss: 0.8741, test_loss: 1.1237, test_f1: 0.4591
 epoch: 86, train_loss: 0.8635, test_loss: 1.1253, test_f1: 0.4576
 epoch: 87, train_loss: 0.8569, test_loss: 1.0887, test_f1: 0.4530
 epoch: 88, train_loss: 0.8672, test_loss: 1.0998, test_f1: 0.4605
 epoch: 89, train_loss: 0.8603, test_loss: 1.1127, test_f1: 0.4623
 epoch: 90, train_loss: 0.8672, test_loss: 1.1261, test_f1: 0.4572
 epoch: 91, train_loss: 0.8617, test_loss: 1.0989, test_f1: 0.4627
 epoch: 92, train_loss: 0.8596, test_loss: 1.0916, test_f1: 0.4679
 epoch: 93, train_loss: 0.8622, test_loss: 1.1060, test_f1: 0.4625
 epoch: 94, train_loss: 0.8681, test_loss: 1.1113, test_f1: 0.4568
 epoch: 95, train_loss: 0.8636, test_loss: 1.1044, test_f1: 0.4635
 epoch: 96, train_loss: 0.8469, test_loss: 1.1028, test_f1: 0.4582
 epoch: 97, train_loss: 0.8524, test_loss: 1.1132, test_f1: 0.4730
 epoch: 98, train_loss: 0.8448, test_loss: 1.1293, test_f1: 0.4660
 epoch: 99, train_loss: 0.8448, test_loss: 1.1343, test_f1: 0.4720
##################ITERATION #6 ****************************************
 epoch: 0, train_loss: 1.3101, test_loss: 1.3071, test_f1: 0.2274
 epoch: 1, train_loss: 1.2673, test_loss: 1.2891, test_f1: 0.2647
 epoch: 2, train_loss: 1.2508, test_loss: 1.2716, test_f1: 0.2683
 epoch: 3, train_loss: 1.2458, test_loss: 1.2514, test_f1: 0.3212
 epoch: 4, train_loss: 1.2362, test_loss: 1.2267, test_f1: 0.3735
 epoch: 5, train_loss: 1.2149, test_loss: 1.2095, test_f1: 0.4034
 epoch: 6, train_loss: 1.2178, test_loss: 1.2001, test_f1: 0.4069
 epoch: 7, train_loss: 1.2089, test_loss: 1.1943, test_f1: 0.4235
 epoch: 8, train_loss: 1.1984, test_loss: 1.1839, test_f1: 0.4144
 epoch: 9, train_loss: 1.1968, test_loss: 1.1772, test_f1: 0.4104
 epoch: 10, train_loss: 1.1835, test_loss: 1.1714, test_f1: 0.4152
 epoch: 11, train_loss: 1.1814, test_loss: 1.1699, test_f1: 0.4126
 epoch: 12, train_loss: 1.1685, test_loss: 1.1650, test_f1: 0.4107
 epoch: 13, train_loss: 1.1621, test_loss: 1.1595, test_f1: 0.4144
 epoch: 14, train_loss: 1.1536, test_loss: 1.1512, test_f1: 0.4124
 epoch: 15, train_loss: 1.1522, test_loss: 1.1466, test_f1: 0.4316
 epoch: 16, train_loss: 1.1470, test_loss: 1.1401, test_f1: 0.4390
 epoch: 17, train_loss: 1.1384, test_loss: 1.1369, test_f1: 0.4447
 epoch: 18, train_loss: 1.1341, test_loss: 1.1259, test_f1: 0.4447
 epoch: 19, train_loss: 1.1198, test_loss: 1.1204, test_f1: 0.4457
 epoch: 20, train_loss: 1.1127, test_loss: 1.1163, test_f1: 0.4533
 epoch: 21, train_loss: 1.1026, test_loss: 1.1115, test_f1: 0.4568
 epoch: 22, train_loss: 1.1026, test_loss: 1.1058, test_f1: 0.4480
 epoch: 23, train_loss: 1.1023, test_loss: 1.1015, test_f1: 0.4567
 epoch: 24, train_loss: 1.0941, test_loss: 1.0991, test_f1: 0.4459
 epoch: 25, train_loss: 1.0868, test_loss: 1.0900, test_f1: 0.4505
 epoch: 26, train_loss: 1.0884, test_loss: 1.0910, test_f1: 0.4428
 epoch: 27, train_loss: 1.0777, test_loss: 1.0787, test_f1: 0.4516
 epoch: 28, train_loss: 1.0679, test_loss: 1.0820, test_f1: 0.4498
 epoch: 29, train_loss: 1.0694, test_loss: 1.0824, test_f1: 0.4552
 epoch: 30, train_loss: 1.0683, test_loss: 1.0782, test_f1: 0.4510
 epoch: 31, train_loss: 1.0613, test_loss: 1.0768, test_f1: 0.4534
 epoch: 32, train_loss: 1.0569, test_loss: 1.0662, test_f1: 0.4532
 epoch: 33, train_loss: 1.0529, test_loss: 1.0648, test_f1: 0.4578
 epoch: 34, train_loss: 1.0411, test_loss: 1.0707, test_f1: 0.4557
 epoch: 35, train_loss: 1.0309, test_loss: 1.0715, test_f1: 0.4512
 epoch: 36, train_loss: 1.0297, test_loss: 1.0675, test_f1: 0.4510
 epoch: 37, train_loss: 1.0251, test_loss: 1.0583, test_f1: 0.4547
 epoch: 38, train_loss: 1.0207, test_loss: 1.0610, test_f1: 0.4577
 epoch: 39, train_loss: 1.0178, test_loss: 1.0659, test_f1: 0.4550
 epoch: 40, train_loss: 1.0167, test_loss: 1.0532, test_f1: 0.4616
 epoch: 41, train_loss: 1.0064, test_loss: 1.0543, test_f1: 0.4738
 epoch: 42, train_loss: 1.0089, test_loss: 1.0561, test_f1: 0.4609
 epoch: 43, train_loss: 1.0034, test_loss: 1.0651, test_f1: 0.4463
 epoch: 44, train_loss: 0.9911, test_loss: 1.0501, test_f1: 0.4625
 epoch: 45, train_loss: 0.9838, test_loss: 1.0463, test_f1: 0.4601
 epoch: 46, train_loss: 0.9749, test_loss: 1.0569, test_f1: 0.4511
 epoch: 47, train_loss: 0.9660, test_loss: 1.0558, test_f1: 0.4530
 epoch: 48, train_loss: 0.9784, test_loss: 1.0547, test_f1: 0.4638
 epoch: 49, train_loss: 0.9648, test_loss: 1.0669, test_f1: 0.4532
 epoch: 50, train_loss: 0.9768, test_loss: 1.0660, test_f1: 0.4610
 epoch: 51, train_loss: 0.9569, test_loss: 1.0747, test_f1: 0.4581
 epoch: 52, train_loss: 0.9604, test_loss: 1.0759, test_f1: 0.4591
 epoch: 53, train_loss: 0.9613, test_loss: 1.0600, test_f1: 0.4662
 epoch: 54, train_loss: 0.9543, test_loss: 1.0706, test_f1: 0.4589
 epoch: 55, train_loss: 0.9496, test_loss: 1.0710, test_f1: 0.4562
 epoch: 56, train_loss: 0.9367, test_loss: 1.0624, test_f1: 0.4567
 epoch: 57, train_loss: 0.9568, test_loss: 1.0663, test_f1: 0.4672
 epoch: 58, train_loss: 0.9413, test_loss: 1.0737, test_f1: 0.4609
 epoch: 59, train_loss: 0.9415, test_loss: 1.0718, test_f1: 0.4641
 epoch: 60, train_loss: 0.9387, test_loss: 1.0677, test_f1: 0.4546
 epoch: 61, train_loss: 0.9297, test_loss: 1.0737, test_f1: 0.4635
 epoch: 62, train_loss: 0.9299, test_loss: 1.0693, test_f1: 0.4576
 epoch: 63, train_loss: 0.9336, test_loss: 1.0726, test_f1: 0.4540
 epoch: 64, train_loss: 0.9289, test_loss: 1.0803, test_f1: 0.4492
 epoch: 65, train_loss: 0.9214, test_loss: 1.0822, test_f1: 0.4483
 epoch: 66, train_loss: 0.9307, test_loss: 1.0757, test_f1: 0.4561
 epoch: 67, train_loss: 0.9158, test_loss: 1.0853, test_f1: 0.4567
 epoch: 68, train_loss: 0.9135, test_loss: 1.0864, test_f1: 0.4547
 epoch: 69, train_loss: 0.9115, test_loss: 1.0737, test_f1: 0.4681
 epoch: 70, train_loss: 0.9128, test_loss: 1.0803, test_f1: 0.4533
 epoch: 71, train_loss: 0.9058, test_loss: 1.0854, test_f1: 0.4570
 epoch: 72, train_loss: 0.9055, test_loss: 1.0862, test_f1: 0.4535
 epoch: 73, train_loss: 0.8962, test_loss: 1.0928, test_f1: 0.4515
 epoch: 74, train_loss: 0.9131, test_loss: 1.0854, test_f1: 0.4619
 epoch: 75, train_loss: 0.9036, test_loss: 1.0842, test_f1: 0.4666
 epoch: 76, train_loss: 0.9050, test_loss: 1.0760, test_f1: 0.4603
 epoch: 77, train_loss: 0.8978, test_loss: 1.0864, test_f1: 0.4686
 epoch: 78, train_loss: 0.8875, test_loss: 1.0920, test_f1: 0.4666
 epoch: 79, train_loss: 0.8996, test_loss: 1.0981, test_f1: 0.4482
 epoch: 80, train_loss: 0.8889, test_loss: 1.0964, test_f1: 0.4567
 epoch: 81, train_loss: 0.8965, test_loss: 1.1020, test_f1: 0.4556
 epoch: 82, train_loss: 0.8964, test_loss: 1.0967, test_f1: 0.4479
 epoch: 83, train_loss: 0.8870, test_loss: 1.1029, test_f1: 0.4493
 epoch: 84, train_loss: 0.8751, test_loss: 1.0984, test_f1: 0.4561
 epoch: 85, train_loss: 0.8735, test_loss: 1.1112, test_f1: 0.4438
 epoch: 86, train_loss: 0.8871, test_loss: 1.1261, test_f1: 0.4528
 epoch: 87, train_loss: 0.8784, test_loss: 1.1149, test_f1: 0.4498
 epoch: 88, train_loss: 0.8774, test_loss: 1.1128, test_f1: 0.4443
 epoch: 89, train_loss: 0.8674, test_loss: 1.1022, test_f1: 0.4527
 epoch: 90, train_loss: 0.8760, test_loss: 1.1071, test_f1: 0.4515
 epoch: 91, train_loss: 0.8742, test_loss: 1.1084, test_f1: 0.4578
 epoch: 92, train_loss: 0.8751, test_loss: 1.1216, test_f1: 0.4470
 epoch: 93, train_loss: 0.8811, test_loss: 1.1048, test_f1: 0.4545
 epoch: 94, train_loss: 0.8725, test_loss: 1.1005, test_f1: 0.4581
 epoch: 95, train_loss: 0.8690, test_loss: 1.1060, test_f1: 0.4558
 epoch: 96, train_loss: 0.8655, test_loss: 1.1172, test_f1: 0.4599
 epoch: 97, train_loss: 0.8615, test_loss: 1.1206, test_f1: 0.4575
 epoch: 98, train_loss: 0.8609, test_loss: 1.1075, test_f1: 0.4495
 epoch: 99, train_loss: 0.8705, test_loss: 1.1175, test_f1: 0.4526
##################ITERATION #7 ****************************************
 epoch: 0, train_loss: 1.3010, test_loss: 1.3029, test_f1: 0.2274
 epoch: 1, train_loss: 1.2615, test_loss: 1.2843, test_f1: 0.2274
 epoch: 2, train_loss: 1.2428, test_loss: 1.2638, test_f1: 0.2438
 epoch: 3, train_loss: 1.2279, test_loss: 1.2327, test_f1: 0.3331
 epoch: 4, train_loss: 1.2205, test_loss: 1.2108, test_f1: 0.3687
 epoch: 5, train_loss: 1.2097, test_loss: 1.1913, test_f1: 0.4128
 epoch: 6, train_loss: 1.2011, test_loss: 1.1842, test_f1: 0.4197
 epoch: 7, train_loss: 1.1933, test_loss: 1.1753, test_f1: 0.4326
 epoch: 8, train_loss: 1.1812, test_loss: 1.1668, test_f1: 0.4247
 epoch: 9, train_loss: 1.1796, test_loss: 1.1635, test_f1: 0.4272
 epoch: 10, train_loss: 1.1793, test_loss: 1.1586, test_f1: 0.4306
 epoch: 11, train_loss: 1.1644, test_loss: 1.1524, test_f1: 0.4424
 epoch: 12, train_loss: 1.1564, test_loss: 1.1410, test_f1: 0.4450
 epoch: 13, train_loss: 1.1531, test_loss: 1.1333, test_f1: 0.4442
 epoch: 14, train_loss: 1.1427, test_loss: 1.1274, test_f1: 0.4506
 epoch: 15, train_loss: 1.1392, test_loss: 1.1204, test_f1: 0.4586
 epoch: 16, train_loss: 1.1347, test_loss: 1.1130, test_f1: 0.4486
 epoch: 17, train_loss: 1.1270, test_loss: 1.1047, test_f1: 0.4416
 epoch: 18, train_loss: 1.1223, test_loss: 1.1007, test_f1: 0.4572
 epoch: 19, train_loss: 1.1173, test_loss: 1.0988, test_f1: 0.4477
 epoch: 20, train_loss: 1.1078, test_loss: 1.0929, test_f1: 0.4634
 epoch: 21, train_loss: 1.1034, test_loss: 1.0920, test_f1: 0.4673
 epoch: 22, train_loss: 1.1000, test_loss: 1.0880, test_f1: 0.4693
 epoch: 23, train_loss: 1.0961, test_loss: 1.0776, test_f1: 0.4672
 epoch: 24, train_loss: 1.0905, test_loss: 1.0817, test_f1: 0.4515
 epoch: 25, train_loss: 1.0791, test_loss: 1.0731, test_f1: 0.4569
 epoch: 26, train_loss: 1.0643, test_loss: 1.0703, test_f1: 0.4504
 epoch: 27, train_loss: 1.0656, test_loss: 1.0683, test_f1: 0.4548
 epoch: 28, train_loss: 1.0561, test_loss: 1.0614, test_f1: 0.4592
 epoch: 29, train_loss: 1.0478, test_loss: 1.0605, test_f1: 0.4617
 epoch: 30, train_loss: 1.0490, test_loss: 1.0534, test_f1: 0.4762
 epoch: 31, train_loss: 1.0441, test_loss: 1.0501, test_f1: 0.4652
 epoch: 32, train_loss: 1.0311, test_loss: 1.0489, test_f1: 0.4598
 epoch: 33, train_loss: 1.0271, test_loss: 1.0493, test_f1: 0.4529
 epoch: 34, train_loss: 1.0240, test_loss: 1.0483, test_f1: 0.4630
 epoch: 35, train_loss: 1.0183, test_loss: 1.0483, test_f1: 0.4614
 epoch: 36, train_loss: 1.0127, test_loss: 1.0404, test_f1: 0.4671
 epoch: 37, train_loss: 1.0102, test_loss: 1.0614, test_f1: 0.4519
 epoch: 38, train_loss: 0.9955, test_loss: 1.0465, test_f1: 0.4740
 epoch: 39, train_loss: 0.9865, test_loss: 1.0507, test_f1: 0.4655
 epoch: 40, train_loss: 0.9938, test_loss: 1.0620, test_f1: 0.4646
 epoch: 41, train_loss: 0.9839, test_loss: 1.0505, test_f1: 0.4713
 epoch: 42, train_loss: 0.9838, test_loss: 1.0558, test_f1: 0.4807
 epoch: 43, train_loss: 0.9768, test_loss: 1.0597, test_f1: 0.4677
 epoch: 44, train_loss: 0.9823, test_loss: 1.0639, test_f1: 0.4761
 epoch: 45, train_loss: 0.9662, test_loss: 1.0637, test_f1: 0.4715
 epoch: 46, train_loss: 0.9608, test_loss: 1.0682, test_f1: 0.4717
 epoch: 47, train_loss: 0.9677, test_loss: 1.0671, test_f1: 0.4665
 epoch: 48, train_loss: 0.9637, test_loss: 1.0655, test_f1: 0.4679
 epoch: 49, train_loss: 0.9504, test_loss: 1.0701, test_f1: 0.4749
 epoch: 50, train_loss: 0.9409, test_loss: 1.0822, test_f1: 0.4665
 epoch: 51, train_loss: 0.9394, test_loss: 1.0591, test_f1: 0.4830
 epoch: 52, train_loss: 0.9383, test_loss: 1.0617, test_f1: 0.4805
 epoch: 53, train_loss: 0.9455, test_loss: 1.0731, test_f1: 0.4844
 epoch: 54, train_loss: 0.9257, test_loss: 1.0682, test_f1: 0.4771
 epoch: 55, train_loss: 0.9377, test_loss: 1.0711, test_f1: 0.4739
 epoch: 56, train_loss: 0.9299, test_loss: 1.0830, test_f1: 0.4713
 epoch: 57, train_loss: 0.9280, test_loss: 1.0622, test_f1: 0.4752
 epoch: 58, train_loss: 0.9223, test_loss: 1.0698, test_f1: 0.4700
 epoch: 59, train_loss: 0.9172, test_loss: 1.0821, test_f1: 0.4707
 epoch: 60, train_loss: 0.9129, test_loss: 1.0815, test_f1: 0.4798
 epoch: 61, train_loss: 0.9126, test_loss: 1.0847, test_f1: 0.4803
 epoch: 62, train_loss: 0.9199, test_loss: 1.0955, test_f1: 0.4747
 epoch: 63, train_loss: 0.9174, test_loss: 1.0989, test_f1: 0.4700
 epoch: 64, train_loss: 0.9161, test_loss: 1.0908, test_f1: 0.4716
 epoch: 65, train_loss: 0.9013, test_loss: 1.0954, test_f1: 0.4628
 epoch: 66, train_loss: 0.8979, test_loss: 1.0974, test_f1: 0.4693
 epoch: 67, train_loss: 0.8962, test_loss: 1.0954, test_f1: 0.4745
 epoch: 68, train_loss: 0.8951, test_loss: 1.0929, test_f1: 0.4747
 epoch: 69, train_loss: 0.8956, test_loss: 1.1020, test_f1: 0.4732
 epoch: 70, train_loss: 0.9051, test_loss: 1.0972, test_f1: 0.4671
 epoch: 71, train_loss: 0.8840, test_loss: 1.1114, test_f1: 0.4716
 epoch: 72, train_loss: 0.8838, test_loss: 1.1160, test_f1: 0.4665
 epoch: 73, train_loss: 0.8871, test_loss: 1.1132, test_f1: 0.4727
 epoch: 74, train_loss: 0.8781, test_loss: 1.1287, test_f1: 0.4737
 epoch: 75, train_loss: 0.8815, test_loss: 1.1018, test_f1: 0.4770
 epoch: 76, train_loss: 0.8792, test_loss: 1.1165, test_f1: 0.4759
 epoch: 77, train_loss: 0.8832, test_loss: 1.1247, test_f1: 0.4767
 epoch: 78, train_loss: 0.8822, test_loss: 1.1159, test_f1: 0.4771
 epoch: 79, train_loss: 0.8761, test_loss: 1.1368, test_f1: 0.4731
 epoch: 80, train_loss: 0.8767, test_loss: 1.1232, test_f1: 0.4676
 epoch: 81, train_loss: 0.8679, test_loss: 1.1332, test_f1: 0.4736
 epoch: 82, train_loss: 0.8722, test_loss: 1.1328, test_f1: 0.4746
 epoch: 83, train_loss: 0.8606, test_loss: 1.1345, test_f1: 0.4707
 epoch: 84, train_loss: 0.8668, test_loss: 1.1401, test_f1: 0.4779
 epoch: 85, train_loss: 0.8636, test_loss: 1.1435, test_f1: 0.4768
 epoch: 86, train_loss: 0.8669, test_loss: 1.1163, test_f1: 0.4789
 epoch: 87, train_loss: 0.8688, test_loss: 1.1337, test_f1: 0.4798
 epoch: 88, train_loss: 0.8580, test_loss: 1.1333, test_f1: 0.4738
 epoch: 89, train_loss: 0.8607, test_loss: 1.1313, test_f1: 0.4690
 epoch: 90, train_loss: 0.8523, test_loss: 1.1394, test_f1: 0.4732
 epoch: 91, train_loss: 0.8548, test_loss: 1.1492, test_f1: 0.4725
 epoch: 92, train_loss: 0.8492, test_loss: 1.1627, test_f1: 0.4717
 epoch: 93, train_loss: 0.8523, test_loss: 1.1447, test_f1: 0.4669
 epoch: 94, train_loss: 0.8507, test_loss: 1.1448, test_f1: 0.4656
 epoch: 95, train_loss: 0.8560, test_loss: 1.1517, test_f1: 0.4700
 epoch: 96, train_loss: 0.8455, test_loss: 1.1445, test_f1: 0.4757
 epoch: 97, train_loss: 0.8522, test_loss: 1.1530, test_f1: 0.4768
 epoch: 98, train_loss: 0.8503, test_loss: 1.1525, test_f1: 0.4815
 epoch: 99, train_loss: 0.8448, test_loss: 1.1473, test_f1: 0.4783
##################ITERATION #8 ****************************************
 epoch: 0, train_loss: 1.3744, test_loss: 1.3496, test_f1: 0.2244
 epoch: 1, train_loss: 1.3004, test_loss: 1.2990, test_f1: 0.2274
 epoch: 2, train_loss: 1.2827, test_loss: 1.2683, test_f1: 0.2575
 epoch: 3, train_loss: 1.2659, test_loss: 1.2388, test_f1: 0.3521
 epoch: 4, train_loss: 1.2408, test_loss: 1.2118, test_f1: 0.3713
 epoch: 5, train_loss: 1.2296, test_loss: 1.1924, test_f1: 0.3892
 epoch: 6, train_loss: 1.2190, test_loss: 1.1769, test_f1: 0.3981
 epoch: 7, train_loss: 1.2055, test_loss: 1.1655, test_f1: 0.3976
 epoch: 8, train_loss: 1.2000, test_loss: 1.1588, test_f1: 0.4036
 epoch: 9, train_loss: 1.1901, test_loss: 1.1514, test_f1: 0.4065
 epoch: 10, train_loss: 1.1853, test_loss: 1.1441, test_f1: 0.4046
 epoch: 11, train_loss: 1.1828, test_loss: 1.1355, test_f1: 0.4023
 epoch: 12, train_loss: 1.1729, test_loss: 1.1286, test_f1: 0.4060
 epoch: 13, train_loss: 1.1667, test_loss: 1.1229, test_f1: 0.4202
 epoch: 14, train_loss: 1.1585, test_loss: 1.1198, test_f1: 0.4129
 epoch: 15, train_loss: 1.1495, test_loss: 1.1134, test_f1: 0.4082
 epoch: 16, train_loss: 1.1425, test_loss: 1.1093, test_f1: 0.4206
 epoch: 17, train_loss: 1.1419, test_loss: 1.1055, test_f1: 0.4127
 epoch: 18, train_loss: 1.1301, test_loss: 1.0983, test_f1: 0.4189
 epoch: 19, train_loss: 1.1235, test_loss: 1.0947, test_f1: 0.4197
 epoch: 20, train_loss: 1.1093, test_loss: 1.0958, test_f1: 0.4278
 epoch: 21, train_loss: 1.1167, test_loss: 1.0879, test_f1: 0.4459
 epoch: 22, train_loss: 1.1102, test_loss: 1.0810, test_f1: 0.4525
 epoch: 23, train_loss: 1.1132, test_loss: 1.0779, test_f1: 0.4551
 epoch: 24, train_loss: 1.0974, test_loss: 1.0732, test_f1: 0.4568
 epoch: 25, train_loss: 1.0949, test_loss: 1.0698, test_f1: 0.4507
 epoch: 26, train_loss: 1.0845, test_loss: 1.0651, test_f1: 0.4438
 epoch: 27, train_loss: 1.0874, test_loss: 1.0676, test_f1: 0.4464
 epoch: 28, train_loss: 1.0771, test_loss: 1.0601, test_f1: 0.4443
 epoch: 29, train_loss: 1.0700, test_loss: 1.0492, test_f1: 0.4557
 epoch: 30, train_loss: 1.0665, test_loss: 1.0467, test_f1: 0.4611
 epoch: 31, train_loss: 1.0540, test_loss: 1.0438, test_f1: 0.4610
 epoch: 32, train_loss: 1.0583, test_loss: 1.0360, test_f1: 0.4684
 epoch: 33, train_loss: 1.0482, test_loss: 1.0304, test_f1: 0.4651
 epoch: 34, train_loss: 1.0403, test_loss: 1.0248, test_f1: 0.4699
 epoch: 35, train_loss: 1.0392, test_loss: 1.0239, test_f1: 0.4652
 epoch: 36, train_loss: 1.0219, test_loss: 1.0195, test_f1: 0.4729
 epoch: 37, train_loss: 1.0282, test_loss: 1.0171, test_f1: 0.4680
 epoch: 38, train_loss: 1.0215, test_loss: 1.0217, test_f1: 0.4701
 epoch: 39, train_loss: 1.0108, test_loss: 1.0082, test_f1: 0.4780
 epoch: 40, train_loss: 1.0119, test_loss: 1.0090, test_f1: 0.4678
 epoch: 41, train_loss: 1.0020, test_loss: 1.0068, test_f1: 0.4701
 epoch: 42, train_loss: 0.9938, test_loss: 1.0040, test_f1: 0.4741
 epoch: 43, train_loss: 0.9967, test_loss: 1.0058, test_f1: 0.4692
 epoch: 44, train_loss: 0.9958, test_loss: 1.0063, test_f1: 0.4842
 epoch: 45, train_loss: 0.9928, test_loss: 0.9971, test_f1: 0.4819
 epoch: 46, train_loss: 0.9806, test_loss: 0.9864, test_f1: 0.4867
 epoch: 47, train_loss: 0.9826, test_loss: 0.9867, test_f1: 0.4796
 epoch: 48, train_loss: 0.9717, test_loss: 0.9920, test_f1: 0.4842
 epoch: 49, train_loss: 0.9693, test_loss: 0.9870, test_f1: 0.4762
 epoch: 50, train_loss: 0.9643, test_loss: 0.9882, test_f1: 0.4689
 epoch: 51, train_loss: 0.9547, test_loss: 0.9842, test_f1: 0.4838
 epoch: 52, train_loss: 0.9627, test_loss: 0.9784, test_f1: 0.4882
 epoch: 53, train_loss: 0.9510, test_loss: 0.9892, test_f1: 0.4824
 epoch: 54, train_loss: 0.9562, test_loss: 0.9907, test_f1: 0.4858
 epoch: 55, train_loss: 0.9441, test_loss: 0.9812, test_f1: 0.4845
 epoch: 56, train_loss: 0.9417, test_loss: 0.9872, test_f1: 0.4760
 epoch: 57, train_loss: 0.9347, test_loss: 0.9856, test_f1: 0.4878
 epoch: 58, train_loss: 0.9433, test_loss: 0.9854, test_f1: 0.4793
 epoch: 59, train_loss: 0.9444, test_loss: 0.9874, test_f1: 0.4815
 epoch: 60, train_loss: 0.9238, test_loss: 0.9860, test_f1: 0.4759
 epoch: 61, train_loss: 0.9314, test_loss: 0.9873, test_f1: 0.4692
 epoch: 62, train_loss: 0.9368, test_loss: 0.9882, test_f1: 0.4794
 epoch: 63, train_loss: 0.9251, test_loss: 0.9969, test_f1: 0.4717
 epoch: 64, train_loss: 0.9210, test_loss: 0.9850, test_f1: 0.4826
 epoch: 65, train_loss: 0.9205, test_loss: 0.9925, test_f1: 0.4769
 epoch: 66, train_loss: 0.9302, test_loss: 0.9959, test_f1: 0.4731
 epoch: 67, train_loss: 0.9201, test_loss: 0.9926, test_f1: 0.4721
 epoch: 68, train_loss: 0.9200, test_loss: 0.9923, test_f1: 0.4728
 epoch: 69, train_loss: 0.9166, test_loss: 0.9870, test_f1: 0.4800
 epoch: 70, train_loss: 0.9089, test_loss: 0.9878, test_f1: 0.4699
 epoch: 71, train_loss: 0.9146, test_loss: 0.9933, test_f1: 0.4801
 epoch: 72, train_loss: 0.9153, test_loss: 1.0061, test_f1: 0.4664
 epoch: 73, train_loss: 0.9016, test_loss: 1.0053, test_f1: 0.4601
 epoch: 74, train_loss: 0.9026, test_loss: 0.9991, test_f1: 0.4631
 epoch: 75, train_loss: 0.9027, test_loss: 0.9986, test_f1: 0.4687
 epoch: 76, train_loss: 0.9061, test_loss: 0.9943, test_f1: 0.4804
 epoch: 77, train_loss: 0.8945, test_loss: 0.9966, test_f1: 0.4716
 epoch: 78, train_loss: 0.8984, test_loss: 1.0036, test_f1: 0.4698
 epoch: 79, train_loss: 0.8944, test_loss: 1.0088, test_f1: 0.4636
 epoch: 80, train_loss: 0.8888, test_loss: 1.0119, test_f1: 0.4524
 epoch: 81, train_loss: 0.8781, test_loss: 1.0191, test_f1: 0.4566
 epoch: 82, train_loss: 0.8720, test_loss: 1.0225, test_f1: 0.4537
 epoch: 83, train_loss: 0.8911, test_loss: 1.0247, test_f1: 0.4453
 epoch: 84, train_loss: 0.8829, test_loss: 1.0149, test_f1: 0.4454
 epoch: 85, train_loss: 0.8894, test_loss: 1.0142, test_f1: 0.4457
 epoch: 86, train_loss: 0.8664, test_loss: 1.0236, test_f1: 0.4444
 epoch: 87, train_loss: 0.8638, test_loss: 1.0104, test_f1: 0.4516
 epoch: 88, train_loss: 0.8703, test_loss: 1.0207, test_f1: 0.4468
 epoch: 89, train_loss: 0.8706, test_loss: 1.0165, test_f1: 0.4564
 epoch: 90, train_loss: 0.8786, test_loss: 1.0212, test_f1: 0.4545
 epoch: 91, train_loss: 0.8612, test_loss: 1.0135, test_f1: 0.4484
 epoch: 92, train_loss: 0.8678, test_loss: 1.0260, test_f1: 0.4457
 epoch: 93, train_loss: 0.8679, test_loss: 1.0129, test_f1: 0.4542
 epoch: 94, train_loss: 0.8639, test_loss: 1.0211, test_f1: 0.4388
 epoch: 95, train_loss: 0.8610, test_loss: 1.0063, test_f1: 0.4537
 epoch: 96, train_loss: 0.8476, test_loss: 1.0121, test_f1: 0.4459
 epoch: 97, train_loss: 0.8607, test_loss: 1.0244, test_f1: 0.4437
 epoch: 98, train_loss: 0.8678, test_loss: 1.0132, test_f1: 0.4519
 epoch: 99, train_loss: 0.8523, test_loss: 1.0091, test_f1: 0.4501
##################ITERATION #9 ****************************************
 epoch: 0, train_loss: 1.3407, test_loss: 1.3166, test_f1: 0.2274
 epoch: 1, train_loss: 1.2874, test_loss: 1.3002, test_f1: 0.2274
 epoch: 2, train_loss: 1.2612, test_loss: 1.2739, test_f1: 0.2605
 epoch: 3, train_loss: 1.2392, test_loss: 1.2455, test_f1: 0.2891
 epoch: 4, train_loss: 1.2222, test_loss: 1.2220, test_f1: 0.3452
 epoch: 5, train_loss: 1.2233, test_loss: 1.2026, test_f1: 0.3716
 epoch: 6, train_loss: 1.2037, test_loss: 1.1850, test_f1: 0.3883
 epoch: 7, train_loss: 1.1942, test_loss: 1.1808, test_f1: 0.3884
 epoch: 8, train_loss: 1.1824, test_loss: 1.1766, test_f1: 0.3869
 epoch: 9, train_loss: 1.1742, test_loss: 1.1696, test_f1: 0.4078
 epoch: 10, train_loss: 1.1649, test_loss: 1.1658, test_f1: 0.4096
 epoch: 11, train_loss: 1.1609, test_loss: 1.1557, test_f1: 0.4179
 epoch: 12, train_loss: 1.1547, test_loss: 1.1424, test_f1: 0.4201
 epoch: 13, train_loss: 1.1414, test_loss: 1.1374, test_f1: 0.4319
 epoch: 14, train_loss: 1.1345, test_loss: 1.1243, test_f1: 0.4373
 epoch: 15, train_loss: 1.1283, test_loss: 1.1105, test_f1: 0.4447
 epoch: 16, train_loss: 1.1163, test_loss: 1.1057, test_f1: 0.4450
 epoch: 17, train_loss: 1.1103, test_loss: 1.0999, test_f1: 0.4642
 epoch: 18, train_loss: 1.1093, test_loss: 1.0936, test_f1: 0.4510
 epoch: 19, train_loss: 1.0939, test_loss: 1.0885, test_f1: 0.4507
 epoch: 20, train_loss: 1.0882, test_loss: 1.0874, test_f1: 0.4607
 epoch: 21, train_loss: 1.0791, test_loss: 1.0827, test_f1: 0.4485
 epoch: 22, train_loss: 1.0771, test_loss: 1.0780, test_f1: 0.4514
 epoch: 23, train_loss: 1.0698, test_loss: 1.0746, test_f1: 0.4602
 epoch: 24, train_loss: 1.0600, test_loss: 1.0722, test_f1: 0.4712
 epoch: 25, train_loss: 1.0537, test_loss: 1.0641, test_f1: 0.4631
 epoch: 26, train_loss: 1.0361, test_loss: 1.0612, test_f1: 0.4627
 epoch: 27, train_loss: 1.0378, test_loss: 1.0552, test_f1: 0.4687
 epoch: 28, train_loss: 1.0297, test_loss: 1.0536, test_f1: 0.4697
 epoch: 29, train_loss: 1.0165, test_loss: 1.0581, test_f1: 0.4672
 epoch: 30, train_loss: 1.0215, test_loss: 1.0583, test_f1: 0.4643
 epoch: 31, train_loss: 1.0162, test_loss: 1.0585, test_f1: 0.4634
 epoch: 32, train_loss: 1.0180, test_loss: 1.0547, test_f1: 0.4740
 epoch: 33, train_loss: 0.9998, test_loss: 1.0521, test_f1: 0.4679
 epoch: 34, train_loss: 1.0000, test_loss: 1.0501, test_f1: 0.4655
 epoch: 35, train_loss: 0.9911, test_loss: 1.0402, test_f1: 0.4751
 epoch: 36, train_loss: 0.9796, test_loss: 1.0519, test_f1: 0.4627
 epoch: 37, train_loss: 0.9777, test_loss: 1.0553, test_f1: 0.4642
 epoch: 38, train_loss: 0.9712, test_loss: 1.0486, test_f1: 0.4658
 epoch: 39, train_loss: 0.9680, test_loss: 1.0547, test_f1: 0.4665
 epoch: 40, train_loss: 0.9651, test_loss: 1.0502, test_f1: 0.4798
 epoch: 41, train_loss: 0.9570, test_loss: 1.0396, test_f1: 0.4749
 epoch: 42, train_loss: 0.9559, test_loss: 1.0464, test_f1: 0.4693
 epoch: 43, train_loss: 0.9478, test_loss: 1.0743, test_f1: 0.4722
 epoch: 44, train_loss: 0.9439, test_loss: 1.0652, test_f1: 0.4724
 epoch: 45, train_loss: 0.9504, test_loss: 1.0687, test_f1: 0.4710
 epoch: 46, train_loss: 0.9458, test_loss: 1.0747, test_f1: 0.4682
 epoch: 47, train_loss: 0.9284, test_loss: 1.0615, test_f1: 0.4820
 epoch: 48, train_loss: 0.9326, test_loss: 1.0631, test_f1: 0.4705
 epoch: 49, train_loss: 0.9262, test_loss: 1.0569, test_f1: 0.4663
 epoch: 50, train_loss: 0.9354, test_loss: 1.0725, test_f1: 0.4555
 epoch: 51, train_loss: 0.9168, test_loss: 1.0758, test_f1: 0.4556
 epoch: 52, train_loss: 0.9137, test_loss: 1.0834, test_f1: 0.4534
 epoch: 53, train_loss: 0.9040, test_loss: 1.0947, test_f1: 0.4553
 epoch: 54, train_loss: 0.9119, test_loss: 1.0795, test_f1: 0.4628
 epoch: 55, train_loss: 0.9155, test_loss: 1.0785, test_f1: 0.4577
 epoch: 56, train_loss: 0.9015, test_loss: 1.0800, test_f1: 0.4592
 epoch: 57, train_loss: 0.9019, test_loss: 1.0841, test_f1: 0.4587
 epoch: 58, train_loss: 0.8963, test_loss: 1.1049, test_f1: 0.4573
 epoch: 59, train_loss: 0.8963, test_loss: 1.1160, test_f1: 0.4405
 epoch: 60, train_loss: 0.8878, test_loss: 1.1216, test_f1: 0.4518
 epoch: 61, train_loss: 0.8980, test_loss: 1.1340, test_f1: 0.4441
 epoch: 62, train_loss: 0.8910, test_loss: 1.1328, test_f1: 0.4489
 epoch: 63, train_loss: 0.8883, test_loss: 1.0961, test_f1: 0.4545
 epoch: 64, train_loss: 0.8761, test_loss: 1.1101, test_f1: 0.4553
 epoch: 65, train_loss: 0.8741, test_loss: 1.1140, test_f1: 0.4538
 epoch: 66, train_loss: 0.8648, test_loss: 1.1053, test_f1: 0.4496
 epoch: 67, train_loss: 0.8847, test_loss: 1.1024, test_f1: 0.4440
 epoch: 68, train_loss: 0.8686, test_loss: 1.1512, test_f1: 0.4397
 epoch: 69, train_loss: 0.8844, test_loss: 1.1206, test_f1: 0.4465
 epoch: 70, train_loss: 0.8784, test_loss: 1.1417, test_f1: 0.4397
 epoch: 71, train_loss: 0.8692, test_loss: 1.1409, test_f1: 0.4359
 epoch: 72, train_loss: 0.8807, test_loss: 1.1285, test_f1: 0.4330
 epoch: 73, train_loss: 0.8537, test_loss: 1.1258, test_f1: 0.4408
 epoch: 74, train_loss: 0.8677, test_loss: 1.1428, test_f1: 0.4383
 epoch: 75, train_loss: 0.8572, test_loss: 1.1350, test_f1: 0.4610
 epoch: 76, train_loss: 0.8616, test_loss: 1.1115, test_f1: 0.4566
 epoch: 77, train_loss: 0.8559, test_loss: 1.0932, test_f1: 0.4486
 epoch: 78, train_loss: 0.8550, test_loss: 1.1090, test_f1: 0.4499
 epoch: 79, train_loss: 0.8598, test_loss: 1.1308, test_f1: 0.4462
 epoch: 80, train_loss: 0.8599, test_loss: 1.1325, test_f1: 0.4431
 epoch: 81, train_loss: 0.8729, test_loss: 1.1124, test_f1: 0.4489
 epoch: 82, train_loss: 0.8490, test_loss: 1.0875, test_f1: 0.4617
 epoch: 83, train_loss: 0.8317, test_loss: 1.0883, test_f1: 0.4655
 epoch: 84, train_loss: 0.8409, test_loss: 1.1349, test_f1: 0.4552
 epoch: 85, train_loss: 0.8350, test_loss: 1.1226, test_f1: 0.4608
 epoch: 86, train_loss: 0.8452, test_loss: 1.1109, test_f1: 0.4585
 epoch: 87, train_loss: 0.8396, test_loss: 1.1242, test_f1: 0.4581
 epoch: 88, train_loss: 0.8469, test_loss: 1.1025, test_f1: 0.4482
 epoch: 89, train_loss: 0.8449, test_loss: 1.1099, test_f1: 0.4603
 epoch: 90, train_loss: 0.8441, test_loss: 1.1222, test_f1: 0.4585
 epoch: 91, train_loss: 0.8263, test_loss: 1.1208, test_f1: 0.4533
 epoch: 92, train_loss: 0.8375, test_loss: 1.1051, test_f1: 0.4382
 epoch: 93, train_loss: 0.8236, test_loss: 1.1351, test_f1: 0.4517
 epoch: 94, train_loss: 0.8269, test_loss: 1.1398, test_f1: 0.4581
 epoch: 95, train_loss: 0.8375, test_loss: 1.1322, test_f1: 0.4455
 epoch: 96, train_loss: 0.8082, test_loss: 1.1607, test_f1: 0.4463
 epoch: 97, train_loss: 0.8312, test_loss: 1.1739, test_f1: 0.4487
 epoch: 98, train_loss: 0.8238, test_loss: 1.1606, test_f1: 0.4471
 epoch: 99, train_loss: 0.8214, test_loss: 1.1624, test_f1: 0.4387

Training completed in 424.95 seconds
Best F1: 0.4882 at epoch 52
Mean F1 across iterations: 0.4760  0.0077
========================FINAL RESULTS================================
FEGIN weighted F1: 0.4882  0.0077
python main.py --data ltspice_examples --representation component_component --model FEGIN --layers 6 --hiddens 64 --batch_size 256 --lr 0.0001 --emb_size 250 --epochs 100 --save_appendix component_component_L6_H64_BS256_LR0.0001_E250 --no_val
-----



STDERR:
  File "main.py", line 370, in <module>
    main()
  File "main.py", line 254, in main
    dataset = dataset_class(
  File "/home/philip/projects/ltspice_examples_code_repo/Circuit-Completion-Using-GNNs/component_classification_with_link_prediction_head/evaluation/FEGIN/kernel/circuit_datasets.py", line 15, in __init__
    self.data, self.slices = torch.load(self.processed_paths[0])
  File "/home/philip/.local/lib/python3.8/site-packages/torch/serialization.py", line 1040, in load
    warnings.warn(
  File "/usr/lib/python3.8/warnings.py", line 109, in _showwarnmsg
    sw(msg.message, msg.category, msg.filename, msg.lineno,
  File "main.py", line 47, in warn_with_traceback
    traceback.print_stack(file=log)
/home/philip/projects/ltspice_examples_code_repo/Circuit-Completion-Using-GNNs/component_classification_with_link_prediction_head/evaluation/FEGIN/kernel/circuit_datasets.py:15: FutureWarning: You are using `torch.load` with `weights_only=False` (the current default value), which uses the default pickle module implicitly. It is possible to construct malicious pickle data which will execute arbitrary code during unpickling (See https://github.com/pytorch/pytorch/blob/main/SECURITY.md#untrusted-models for more details). In a future release, the default value for `weights_only` will be flipped to `True`. This limits the functions that could be executed during unpickling. Arbitrary objects will no longer be allowed to be loaded via this mode unless they are explicitly allowlisted by the user via `torch.serialization.add_safe_globals`. We recommend you start setting `weights_only=True` for any use case where you don't have full control of the loaded file. Please open an issue on GitHub for any issues related to this experimental feature.
  self.data, self.slices = torch.load(self.processed_paths[0])
