STDOUT:
Results will be saved in /home/philip/projects/ltspice_examples_code_repo/Circuit-Completion-Using-GNNs/component_classification_with_link_prediction_head/evaluation/FEGIN/results/model_FEGIN_dataset_ltspice_examples
Command line input: python main.py --data ltspice_examples --representation component_component --model FEGIN --layers 3 --hiddens 32 --batch_size 256 --lr 0.01 --emb_size 250 --epochs 100 --save_appendix component_component_L3_H32_BS256_LR0.01_E250 --no_val
 is saved.
-----
ltspice_examples - FEGIN
Using 3 layers, 32 hidden units, h = 2
Loading component_component representation dataset
ENTERED
Training FEGIN on component_component representation
Train: 3556, Test: 845
##################ITERATION #0 ****************************************
 epoch: 0, train_loss: 1.2986, test_loss: 1.2636, test_f1: 0.2870
 epoch: 1, train_loss: 1.2223, test_loss: 1.2003, test_f1: 0.3131
 epoch: 2, train_loss: 1.1804, test_loss: 1.1375, test_f1: 0.3443
 epoch: 3, train_loss: 1.1397, test_loss: 1.0904, test_f1: 0.4156
 epoch: 4, train_loss: 1.0968, test_loss: 1.0744, test_f1: 0.4707
 epoch: 5, train_loss: 1.0596, test_loss: 1.0124, test_f1: 0.4792
 epoch: 6, train_loss: 1.0436, test_loss: 1.0262, test_f1: 0.4388
 epoch: 7, train_loss: 1.0176, test_loss: 1.0016, test_f1: 0.4749
 epoch: 8, train_loss: 0.9840, test_loss: 0.9981, test_f1: 0.5168
 epoch: 9, train_loss: 0.9651, test_loss: 1.0169, test_f1: 0.5239
 epoch: 10, train_loss: 0.9593, test_loss: 0.9663, test_f1: 0.5006
 epoch: 11, train_loss: 0.9388, test_loss: 0.9791, test_f1: 0.5002
 epoch: 12, train_loss: 0.9305, test_loss: 0.9453, test_f1: 0.5078
 epoch: 13, train_loss: 0.9131, test_loss: 1.0226, test_f1: 0.5173
 epoch: 14, train_loss: 0.8961, test_loss: 1.0257, test_f1: 0.5204
 epoch: 15, train_loss: 0.8808, test_loss: 1.0230, test_f1: 0.5319
 epoch: 16, train_loss: 0.8704, test_loss: 1.0510, test_f1: 0.4780
 epoch: 17, train_loss: 0.8607, test_loss: 0.9870, test_f1: 0.5254
 epoch: 18, train_loss: 0.8552, test_loss: 0.9897, test_f1: 0.5214
 epoch: 19, train_loss: 0.8374, test_loss: 0.9979, test_f1: 0.5343
 epoch: 20, train_loss: 0.8315, test_loss: 1.3041, test_f1: 0.4156
 epoch: 21, train_loss: 0.8464, test_loss: 1.0907, test_f1: 0.4754
 epoch: 22, train_loss: 0.8236, test_loss: 1.0668, test_f1: 0.4782
 epoch: 23, train_loss: 0.8427, test_loss: 0.9700, test_f1: 0.5353
 epoch: 24, train_loss: 0.8200, test_loss: 0.9862, test_f1: 0.5542
 epoch: 25, train_loss: 0.8008, test_loss: 1.1792, test_f1: 0.4782
 epoch: 26, train_loss: 0.7891, test_loss: 1.0963, test_f1: 0.5094
 epoch: 27, train_loss: 0.7920, test_loss: 1.0540, test_f1: 0.5191
 epoch: 28, train_loss: 0.7493, test_loss: 1.0099, test_f1: 0.5334
 epoch: 29, train_loss: 0.7595, test_loss: 1.0727, test_f1: 0.4982
 epoch: 30, train_loss: 0.7543, test_loss: 1.0721, test_f1: 0.5292
 epoch: 31, train_loss: 0.7702, test_loss: 1.0623, test_f1: 0.5269
 epoch: 32, train_loss: 0.7528, test_loss: 1.1383, test_f1: 0.5210
 epoch: 33, train_loss: 0.7443, test_loss: 1.0397, test_f1: 0.5381
 epoch: 34, train_loss: 0.7209, test_loss: 1.1031, test_f1: 0.5703
 epoch: 35, train_loss: 0.7444, test_loss: 1.1201, test_f1: 0.5264
 epoch: 36, train_loss: 0.7315, test_loss: 1.0950, test_f1: 0.5531
 epoch: 37, train_loss: 0.7367, test_loss: 1.0697, test_f1: 0.5468
 epoch: 38, train_loss: 0.7368, test_loss: 1.0910, test_f1: 0.5330
 epoch: 39, train_loss: 0.7156, test_loss: 1.1099, test_f1: 0.5255
 epoch: 40, train_loss: 0.7243, test_loss: 1.2568, test_f1: 0.4875
 epoch: 41, train_loss: 0.6966, test_loss: 1.1083, test_f1: 0.5637
 epoch: 42, train_loss: 0.6965, test_loss: 1.1207, test_f1: 0.5256
 epoch: 43, train_loss: 0.6885, test_loss: 1.1787, test_f1: 0.5210
 epoch: 44, train_loss: 0.7237, test_loss: 1.1523, test_f1: 0.5262
 epoch: 45, train_loss: 0.7074, test_loss: 1.3319, test_f1: 0.4873
 epoch: 46, train_loss: 0.6933, test_loss: 1.0927, test_f1: 0.5358
 epoch: 47, train_loss: 0.6856, test_loss: 1.1602, test_f1: 0.4960
 epoch: 48, train_loss: 0.6744, test_loss: 1.1129, test_f1: 0.5472
 epoch: 49, train_loss: 0.6743, test_loss: 1.1283, test_f1: 0.5461
 epoch: 50, train_loss: 0.6537, test_loss: 1.1595, test_f1: 0.5394
 epoch: 51, train_loss: 0.6296, test_loss: 1.1629, test_f1: 0.5519
 epoch: 52, train_loss: 0.6212, test_loss: 1.2918, test_f1: 0.5543
 epoch: 53, train_loss: 0.6026, test_loss: 1.1486, test_f1: 0.5775
 epoch: 54, train_loss: 0.5959, test_loss: 1.2014, test_f1: 0.5652
 epoch: 55, train_loss: 0.5712, test_loss: 1.2741, test_f1: 0.5351
 epoch: 56, train_loss: 0.5931, test_loss: 1.2313, test_f1: 0.5571
 epoch: 57, train_loss: 0.5793, test_loss: 1.1664, test_f1: 0.5521
 epoch: 58, train_loss: 0.5713, test_loss: 1.2033, test_f1: 0.5477
 epoch: 59, train_loss: 0.5790, test_loss: 1.2618, test_f1: 0.5454
 epoch: 60, train_loss: 0.5709, test_loss: 1.2739, test_f1: 0.5447
 epoch: 61, train_loss: 0.5729, test_loss: 1.2552, test_f1: 0.5593
 epoch: 62, train_loss: 0.5731, test_loss: 1.3137, test_f1: 0.5462
 epoch: 63, train_loss: 0.5467, test_loss: 1.3923, test_f1: 0.5344
 epoch: 64, train_loss: 0.5391, test_loss: 1.2923, test_f1: 0.5478
 epoch: 65, train_loss: 0.5382, test_loss: 1.3316, test_f1: 0.5327
 epoch: 66, train_loss: 0.5393, test_loss: 1.2872, test_f1: 0.5582
 epoch: 67, train_loss: 0.5701, test_loss: 1.2930, test_f1: 0.5666
 epoch: 68, train_loss: 0.5338, test_loss: 1.4143, test_f1: 0.5425
 epoch: 69, train_loss: 0.5328, test_loss: 1.3040, test_f1: 0.5744
 epoch: 70, train_loss: 0.5287, test_loss: 1.3978, test_f1: 0.5545
 epoch: 71, train_loss: 0.5264, test_loss: 1.5977, test_f1: 0.5476
 epoch: 72, train_loss: 0.5411, test_loss: 1.5020, test_f1: 0.5303
 epoch: 73, train_loss: 0.5413, test_loss: 1.3227, test_f1: 0.5552
 epoch: 74, train_loss: 0.5246, test_loss: 1.4647, test_f1: 0.5030
 epoch: 75, train_loss: 0.5289, test_loss: 1.2998, test_f1: 0.5467
 epoch: 76, train_loss: 0.5362, test_loss: 1.5489, test_f1: 0.4971
 epoch: 77, train_loss: 0.5283, test_loss: 1.3225, test_f1: 0.5533
 epoch: 78, train_loss: 0.5193, test_loss: 1.4836, test_f1: 0.5203
 epoch: 79, train_loss: 0.5122, test_loss: 1.3524, test_f1: 0.5775
 epoch: 80, train_loss: 0.4982, test_loss: 1.5269, test_f1: 0.5309
 epoch: 81, train_loss: 0.4948, test_loss: 1.3367, test_f1: 0.5626
 epoch: 82, train_loss: 0.4841, test_loss: 1.4954, test_f1: 0.5544
 epoch: 83, train_loss: 0.4827, test_loss: 1.5928, test_f1: 0.5327
 epoch: 84, train_loss: 0.5029, test_loss: 1.4184, test_f1: 0.5404
 epoch: 85, train_loss: 0.4925, test_loss: 1.4216, test_f1: 0.5477
 epoch: 86, train_loss: 0.4877, test_loss: 1.4619, test_f1: 0.5472
 epoch: 87, train_loss: 0.4842, test_loss: 1.4715, test_f1: 0.5209
 epoch: 88, train_loss: 0.4799, test_loss: 1.4959, test_f1: 0.5558
 epoch: 89, train_loss: 0.4611, test_loss: 1.5519, test_f1: 0.5540
 epoch: 90, train_loss: 0.4830, test_loss: 1.5594, test_f1: 0.5387
 epoch: 91, train_loss: 0.5103, test_loss: 1.4540, test_f1: 0.5432
 epoch: 92, train_loss: 0.4895, test_loss: 1.5951, test_f1: 0.5079
 epoch: 93, train_loss: 0.4751, test_loss: 1.4003, test_f1: 0.5397
 epoch: 94, train_loss: 0.5258, test_loss: 1.4996, test_f1: 0.5247
 epoch: 95, train_loss: 0.4711, test_loss: 1.5253, test_f1: 0.5403
 epoch: 96, train_loss: 0.4660, test_loss: 1.7214, test_f1: 0.5424
 epoch: 97, train_loss: 0.4848, test_loss: 1.4484, test_f1: 0.5748
 epoch: 98, train_loss: 0.4528, test_loss: 1.5803, test_f1: 0.5074
 epoch: 99, train_loss: 0.4775, test_loss: 1.5426, test_f1: 0.5481
##################ITERATION #1 ****************************************
 epoch: 0, train_loss: 1.2893, test_loss: 1.2578, test_f1: 0.2399
 epoch: 1, train_loss: 1.1824, test_loss: 1.1538, test_f1: 0.3890
 epoch: 2, train_loss: 1.1371, test_loss: 1.1097, test_f1: 0.4127
 epoch: 3, train_loss: 1.0909, test_loss: 1.0580, test_f1: 0.4510
 epoch: 4, train_loss: 1.0676, test_loss: 1.1143, test_f1: 0.4404
 epoch: 5, train_loss: 1.0380, test_loss: 1.0464, test_f1: 0.4631
 epoch: 6, train_loss: 1.0302, test_loss: 1.0094, test_f1: 0.4177
 epoch: 7, train_loss: 1.0092, test_loss: 1.0458, test_f1: 0.4865
 epoch: 8, train_loss: 0.9856, test_loss: 1.0720, test_f1: 0.5291
 epoch: 9, train_loss: 0.9633, test_loss: 1.0226, test_f1: 0.5056
 epoch: 10, train_loss: 0.9464, test_loss: 1.0094, test_f1: 0.4791
 epoch: 11, train_loss: 0.9264, test_loss: 0.9526, test_f1: 0.5147
 epoch: 12, train_loss: 0.9331, test_loss: 1.0011, test_f1: 0.5246
 epoch: 13, train_loss: 0.9111, test_loss: 1.0033, test_f1: 0.5027
 epoch: 14, train_loss: 0.8929, test_loss: 1.0099, test_f1: 0.5171
 epoch: 15, train_loss: 0.8929, test_loss: 1.0309, test_f1: 0.5029
 epoch: 16, train_loss: 0.9187, test_loss: 1.0110, test_f1: 0.4525
 epoch: 17, train_loss: 0.8895, test_loss: 1.0157, test_f1: 0.4818
 epoch: 18, train_loss: 0.8784, test_loss: 1.0803, test_f1: 0.4876
 epoch: 19, train_loss: 0.8520, test_loss: 1.0661, test_f1: 0.5246
 epoch: 20, train_loss: 0.8451, test_loss: 1.0637, test_f1: 0.5029
 epoch: 21, train_loss: 0.8402, test_loss: 1.1242, test_f1: 0.5059
 epoch: 22, train_loss: 0.8445, test_loss: 1.0186, test_f1: 0.5390
 epoch: 23, train_loss: 0.8508, test_loss: 1.0122, test_f1: 0.5128
 epoch: 24, train_loss: 0.8497, test_loss: 1.1443, test_f1: 0.4826
 epoch: 25, train_loss: 0.8546, test_loss: 1.0167, test_f1: 0.5205
 epoch: 26, train_loss: 0.8188, test_loss: 1.0938, test_f1: 0.5232
 epoch: 27, train_loss: 0.8267, test_loss: 1.1076, test_f1: 0.5394
 epoch: 28, train_loss: 0.8265, test_loss: 1.0509, test_f1: 0.4893
 epoch: 29, train_loss: 0.8117, test_loss: 1.0395, test_f1: 0.5021
 epoch: 30, train_loss: 0.7955, test_loss: 1.0618, test_f1: 0.5261
 epoch: 31, train_loss: 0.7866, test_loss: 1.0489, test_f1: 0.5326
 epoch: 32, train_loss: 0.7892, test_loss: 1.0745, test_f1: 0.5095
 epoch: 33, train_loss: 0.8096, test_loss: 1.0299, test_f1: 0.5377
 epoch: 34, train_loss: 0.7899, test_loss: 1.0323, test_f1: 0.5157
 epoch: 35, train_loss: 0.7738, test_loss: 1.0659, test_f1: 0.5351
 epoch: 36, train_loss: 0.7628, test_loss: 1.0940, test_f1: 0.5150
 epoch: 37, train_loss: 0.7836, test_loss: 1.0826, test_f1: 0.5255
 epoch: 38, train_loss: 0.7901, test_loss: 1.0823, test_f1: 0.5116
 epoch: 39, train_loss: 0.7853, test_loss: 1.0331, test_f1: 0.5243
 epoch: 40, train_loss: 0.7676, test_loss: 1.0833, test_f1: 0.5349
 epoch: 41, train_loss: 0.7690, test_loss: 1.0321, test_f1: 0.5559
 epoch: 42, train_loss: 0.7648, test_loss: 1.0810, test_f1: 0.5073
 epoch: 43, train_loss: 0.7528, test_loss: 1.0222, test_f1: 0.5640
 epoch: 44, train_loss: 0.7521, test_loss: 1.0444, test_f1: 0.5326
 epoch: 45, train_loss: 0.7524, test_loss: 1.0984, test_f1: 0.5463
 epoch: 46, train_loss: 0.7420, test_loss: 1.0445, test_f1: 0.5498
 epoch: 47, train_loss: 0.7248, test_loss: 1.0400, test_f1: 0.5120
 epoch: 48, train_loss: 0.7483, test_loss: 1.0600, test_f1: 0.5612
 epoch: 49, train_loss: 0.7301, test_loss: 1.0972, test_f1: 0.5456
 epoch: 50, train_loss: 0.7086, test_loss: 1.0811, test_f1: 0.5575
 epoch: 51, train_loss: 0.6975, test_loss: 1.1688, test_f1: 0.5118
 epoch: 52, train_loss: 0.6908, test_loss: 1.1540, test_f1: 0.5512
 epoch: 53, train_loss: 0.6846, test_loss: 1.1601, test_f1: 0.5215
 epoch: 54, train_loss: 0.6686, test_loss: 1.1193, test_f1: 0.5568
 epoch: 55, train_loss: 0.6605, test_loss: 1.1848, test_f1: 0.5326
 epoch: 56, train_loss: 0.6547, test_loss: 1.1700, test_f1: 0.5211
 epoch: 57, train_loss: 0.6525, test_loss: 1.1534, test_f1: 0.5603
 epoch: 58, train_loss: 0.6646, test_loss: 1.1518, test_f1: 0.5515
 epoch: 59, train_loss: 0.6565, test_loss: 1.2164, test_f1: 0.5375
 epoch: 60, train_loss: 0.6529, test_loss: 1.1478, test_f1: 0.5580
 epoch: 61, train_loss: 0.6373, test_loss: 1.1631, test_f1: 0.5376
 epoch: 62, train_loss: 0.6491, test_loss: 1.1405, test_f1: 0.5636
 epoch: 63, train_loss: 0.6342, test_loss: 1.1850, test_f1: 0.5517
 epoch: 64, train_loss: 0.6347, test_loss: 1.1651, test_f1: 0.5606
 epoch: 65, train_loss: 0.6393, test_loss: 1.1668, test_f1: 0.5443
 epoch: 66, train_loss: 0.6338, test_loss: 1.1733, test_f1: 0.5566
 epoch: 67, train_loss: 0.6159, test_loss: 1.1426, test_f1: 0.5808
 epoch: 68, train_loss: 0.6029, test_loss: 1.2098, test_f1: 0.5032
 epoch: 69, train_loss: 0.6146, test_loss: 1.1902, test_f1: 0.5690
 epoch: 70, train_loss: 0.6056, test_loss: 1.1830, test_f1: 0.5568
 epoch: 71, train_loss: 0.6229, test_loss: 1.3495, test_f1: 0.5360
 epoch: 72, train_loss: 0.6115, test_loss: 1.2442, test_f1: 0.5371
 epoch: 73, train_loss: 0.6056, test_loss: 1.2953, test_f1: 0.5133
 epoch: 74, train_loss: 0.6040, test_loss: 1.1704, test_f1: 0.5761
 epoch: 75, train_loss: 0.5979, test_loss: 1.3283, test_f1: 0.5428
 epoch: 76, train_loss: 0.6055, test_loss: 1.2309, test_f1: 0.5611
 epoch: 77, train_loss: 0.5963, test_loss: 1.2260, test_f1: 0.5205
 epoch: 78, train_loss: 0.5914, test_loss: 1.2571, test_f1: 0.5382
 epoch: 79, train_loss: 0.6079, test_loss: 1.2984, test_f1: 0.5675
 epoch: 80, train_loss: 0.5959, test_loss: 1.4415, test_f1: 0.5289
 epoch: 81, train_loss: 0.5940, test_loss: 1.1904, test_f1: 0.5780
 epoch: 82, train_loss: 0.5699, test_loss: 1.2057, test_f1: 0.5325
 epoch: 83, train_loss: 0.5757, test_loss: 1.2276, test_f1: 0.5921
 epoch: 84, train_loss: 0.5831, test_loss: 1.2802, test_f1: 0.5267
 epoch: 85, train_loss: 0.5699, test_loss: 1.2171, test_f1: 0.5578
 epoch: 86, train_loss: 0.5598, test_loss: 1.3049, test_f1: 0.5733
 epoch: 87, train_loss: 0.5527, test_loss: 1.3621, test_f1: 0.5785
 epoch: 88, train_loss: 0.5560, test_loss: 1.3303, test_f1: 0.5556
 epoch: 89, train_loss: 0.5476, test_loss: 1.4452, test_f1: 0.5367
 epoch: 90, train_loss: 0.5311, test_loss: 1.3428, test_f1: 0.5527
 epoch: 91, train_loss: 0.5483, test_loss: 1.3297, test_f1: 0.5575
 epoch: 92, train_loss: 0.5725, test_loss: 1.4153, test_f1: 0.5408
 epoch: 93, train_loss: 0.5419, test_loss: 1.3153, test_f1: 0.5653
 epoch: 94, train_loss: 0.5373, test_loss: 1.3081, test_f1: 0.5555
 epoch: 95, train_loss: 0.5417, test_loss: 1.2880, test_f1: 0.5414
 epoch: 96, train_loss: 0.5532, test_loss: 1.3942, test_f1: 0.5364
 epoch: 97, train_loss: 0.5598, test_loss: 1.2775, test_f1: 0.5405
 epoch: 98, train_loss: 0.5319, test_loss: 1.3054, test_f1: 0.5431
 epoch: 99, train_loss: 0.5372, test_loss: 1.4304, test_f1: 0.5462
##################ITERATION #2 ****************************************
 epoch: 0, train_loss: 1.3241, test_loss: 1.3115, test_f1: 0.2274
 epoch: 1, train_loss: 1.2012, test_loss: 1.2089, test_f1: 0.2719
 epoch: 2, train_loss: 1.1595, test_loss: 1.1150, test_f1: 0.4085
 epoch: 3, train_loss: 1.1247, test_loss: 1.0966, test_f1: 0.3867
 epoch: 4, train_loss: 1.1020, test_loss: 1.0733, test_f1: 0.4084
 epoch: 5, train_loss: 1.0834, test_loss: 1.0419, test_f1: 0.4095
 epoch: 6, train_loss: 1.0469, test_loss: 1.0405, test_f1: 0.4327
 epoch: 7, train_loss: 1.0298, test_loss: 0.9630, test_f1: 0.4619
 epoch: 8, train_loss: 1.0151, test_loss: 0.9826, test_f1: 0.4717
 epoch: 9, train_loss: 0.9898, test_loss: 0.9987, test_f1: 0.4705
 epoch: 10, train_loss: 0.9716, test_loss: 1.1182, test_f1: 0.4441
 epoch: 11, train_loss: 0.9692, test_loss: 0.9727, test_f1: 0.4556
 epoch: 12, train_loss: 0.9497, test_loss: 1.1571, test_f1: 0.4479
 epoch: 13, train_loss: 0.9321, test_loss: 0.9811, test_f1: 0.4780
 epoch: 14, train_loss: 0.9297, test_loss: 0.9960, test_f1: 0.5140
 epoch: 15, train_loss: 0.9215, test_loss: 1.1002, test_f1: 0.4518
 epoch: 16, train_loss: 0.9129, test_loss: 1.0890, test_f1: 0.4692
 epoch: 17, train_loss: 0.9054, test_loss: 0.9762, test_f1: 0.5162
 epoch: 18, train_loss: 0.9033, test_loss: 1.0346, test_f1: 0.4889
 epoch: 19, train_loss: 0.8847, test_loss: 0.9941, test_f1: 0.5133
 epoch: 20, train_loss: 0.8768, test_loss: 0.9231, test_f1: 0.4985
 epoch: 21, train_loss: 0.8771, test_loss: 1.1041, test_f1: 0.4802
 epoch: 22, train_loss: 0.8740, test_loss: 1.0514, test_f1: 0.4770
 epoch: 23, train_loss: 0.8731, test_loss: 0.9486, test_f1: 0.5017
 epoch: 24, train_loss: 0.8592, test_loss: 1.1253, test_f1: 0.4983
 epoch: 25, train_loss: 0.8645, test_loss: 1.0143, test_f1: 0.5290
 epoch: 26, train_loss: 0.8408, test_loss: 1.0396, test_f1: 0.5159
 epoch: 27, train_loss: 0.8460, test_loss: 1.0592, test_f1: 0.4769
 epoch: 28, train_loss: 0.8300, test_loss: 1.0792, test_f1: 0.4961
 epoch: 29, train_loss: 0.8253, test_loss: 1.1257, test_f1: 0.4878
 epoch: 30, train_loss: 0.8289, test_loss: 1.0609, test_f1: 0.4925
 epoch: 31, train_loss: 0.8365, test_loss: 1.1204, test_f1: 0.4615
 epoch: 32, train_loss: 0.8398, test_loss: 1.2161, test_f1: 0.4714
 epoch: 33, train_loss: 0.8544, test_loss: 1.0555, test_f1: 0.4766
 epoch: 34, train_loss: 0.8226, test_loss: 1.0294, test_f1: 0.5110
 epoch: 35, train_loss: 0.8246, test_loss: 1.0317, test_f1: 0.5318
 epoch: 36, train_loss: 0.7981, test_loss: 1.0350, test_f1: 0.4955
 epoch: 37, train_loss: 0.7962, test_loss: 1.0280, test_f1: 0.5137
 epoch: 38, train_loss: 0.7866, test_loss: 1.0286, test_f1: 0.5307
 epoch: 39, train_loss: 0.7864, test_loss: 1.0027, test_f1: 0.5098
 epoch: 40, train_loss: 0.7964, test_loss: 1.0105, test_f1: 0.4830
 epoch: 41, train_loss: 0.7907, test_loss: 0.9622, test_f1: 0.5421
 epoch: 42, train_loss: 0.7902, test_loss: 1.0409, test_f1: 0.4984
 epoch: 43, train_loss: 0.7682, test_loss: 0.9925, test_f1: 0.5104
 epoch: 44, train_loss: 0.7581, test_loss: 1.0365, test_f1: 0.5463
 epoch: 45, train_loss: 0.7514, test_loss: 1.0379, test_f1: 0.5364
 epoch: 46, train_loss: 0.7529, test_loss: 0.9446, test_f1: 0.5395
 epoch: 47, train_loss: 0.7509, test_loss: 1.0182, test_f1: 0.4766
 epoch: 48, train_loss: 0.7447, test_loss: 1.1213, test_f1: 0.4878
 epoch: 49, train_loss: 0.7361, test_loss: 1.1070, test_f1: 0.5291
 epoch: 50, train_loss: 0.7401, test_loss: 0.9797, test_f1: 0.5381
 epoch: 51, train_loss: 0.7170, test_loss: 1.1100, test_f1: 0.4788
 epoch: 52, train_loss: 0.6895, test_loss: 1.0326, test_f1: 0.5202
 epoch: 53, train_loss: 0.6757, test_loss: 1.0829, test_f1: 0.5451
 epoch: 54, train_loss: 0.6709, test_loss: 1.0829, test_f1: 0.5492
 epoch: 55, train_loss: 0.6791, test_loss: 1.0990, test_f1: 0.5335
 epoch: 56, train_loss: 0.6847, test_loss: 1.0073, test_f1: 0.5666
 epoch: 57, train_loss: 0.6624, test_loss: 1.1254, test_f1: 0.5245
 epoch: 58, train_loss: 0.6851, test_loss: 1.1745, test_f1: 0.5363
 epoch: 59, train_loss: 0.6610, test_loss: 1.1805, test_f1: 0.5106
 epoch: 60, train_loss: 0.6595, test_loss: 1.1552, test_f1: 0.5533
 epoch: 61, train_loss: 0.6412, test_loss: 1.0271, test_f1: 0.5650
 epoch: 62, train_loss: 0.6314, test_loss: 1.0885, test_f1: 0.5603
 epoch: 63, train_loss: 0.6311, test_loss: 1.1210, test_f1: 0.5380
 epoch: 64, train_loss: 0.6422, test_loss: 1.0812, test_f1: 0.5336
 epoch: 65, train_loss: 0.6192, test_loss: 1.1796, test_f1: 0.5422
 epoch: 66, train_loss: 0.6206, test_loss: 1.1676, test_f1: 0.5178
 epoch: 67, train_loss: 0.6364, test_loss: 1.1529, test_f1: 0.5537
 epoch: 68, train_loss: 0.6231, test_loss: 1.1899, test_f1: 0.5345
 epoch: 69, train_loss: 0.6151, test_loss: 1.2595, test_f1: 0.5157
 epoch: 70, train_loss: 0.6216, test_loss: 1.1634, test_f1: 0.5468
 epoch: 71, train_loss: 0.6371, test_loss: 1.2150, test_f1: 0.5269
 epoch: 72, train_loss: 0.6148, test_loss: 1.1503, test_f1: 0.5534
 epoch: 73, train_loss: 0.6150, test_loss: 1.1581, test_f1: 0.5436
 epoch: 74, train_loss: 0.6085, test_loss: 1.1115, test_f1: 0.5388
 epoch: 75, train_loss: 0.6048, test_loss: 1.1829, test_f1: 0.5464
 epoch: 76, train_loss: 0.6164, test_loss: 1.1397, test_f1: 0.5746
 epoch: 77, train_loss: 0.5889, test_loss: 1.2812, test_f1: 0.5233
 epoch: 78, train_loss: 0.5929, test_loss: 1.2717, test_f1: 0.5348
 epoch: 79, train_loss: 0.6027, test_loss: 1.2049, test_f1: 0.5313
 epoch: 80, train_loss: 0.5840, test_loss: 1.1620, test_f1: 0.5520
 epoch: 81, train_loss: 0.5978, test_loss: 1.2683, test_f1: 0.5307
 epoch: 82, train_loss: 0.5997, test_loss: 1.2170, test_f1: 0.5481
 epoch: 83, train_loss: 0.5978, test_loss: 1.2005, test_f1: 0.5429
 epoch: 84, train_loss: 0.5741, test_loss: 1.2959, test_f1: 0.5238
 epoch: 85, train_loss: 0.5702, test_loss: 1.2903, test_f1: 0.5112
 epoch: 86, train_loss: 0.5544, test_loss: 1.3448, test_f1: 0.5054
 epoch: 87, train_loss: 0.5600, test_loss: 1.3250, test_f1: 0.5110
 epoch: 88, train_loss: 0.5488, test_loss: 1.2550, test_f1: 0.5443
 epoch: 89, train_loss: 0.5609, test_loss: 1.2540, test_f1: 0.5259
 epoch: 90, train_loss: 0.5730, test_loss: 1.1454, test_f1: 0.5432
 epoch: 91, train_loss: 0.5958, test_loss: 1.1873, test_f1: 0.5373
 epoch: 92, train_loss: 0.5688, test_loss: 1.1866, test_f1: 0.5297
 epoch: 93, train_loss: 0.5630, test_loss: 1.2875, test_f1: 0.5254
 epoch: 94, train_loss: 0.5541, test_loss: 1.3366, test_f1: 0.5384
 epoch: 95, train_loss: 0.5526, test_loss: 1.3103, test_f1: 0.5118
 epoch: 96, train_loss: 0.5588, test_loss: 1.3852, test_f1: 0.5033
 epoch: 97, train_loss: 0.5615, test_loss: 1.2197, test_f1: 0.5610
 epoch: 98, train_loss: 0.5244, test_loss: 1.1995, test_f1: 0.5548
 epoch: 99, train_loss: 0.5729, test_loss: 1.2955, test_f1: 0.5507
##################ITERATION #3 ****************************************
 epoch: 0, train_loss: 1.3779, test_loss: 1.3704, test_f1: 0.2285
 epoch: 1, train_loss: 1.1965, test_loss: 1.1849, test_f1: 0.3039
 epoch: 2, train_loss: 1.1453, test_loss: 1.1142, test_f1: 0.4250
 epoch: 3, train_loss: 1.1293, test_loss: 1.0659, test_f1: 0.4807
 epoch: 4, train_loss: 1.0809, test_loss: 1.0872, test_f1: 0.4005
 epoch: 5, train_loss: 1.0504, test_loss: 0.9860, test_f1: 0.4566
 epoch: 6, train_loss: 1.0406, test_loss: 0.9529, test_f1: 0.4681
 epoch: 7, train_loss: 0.9955, test_loss: 0.9595, test_f1: 0.4665
 epoch: 8, train_loss: 0.9807, test_loss: 0.9214, test_f1: 0.5123
 epoch: 9, train_loss: 0.9693, test_loss: 0.9141, test_f1: 0.4768
 epoch: 10, train_loss: 0.9501, test_loss: 0.9359, test_f1: 0.4674
 epoch: 11, train_loss: 0.9473, test_loss: 0.8748, test_f1: 0.5106
 epoch: 12, train_loss: 0.9258, test_loss: 0.9101, test_f1: 0.4944
 epoch: 13, train_loss: 0.9313, test_loss: 0.9133, test_f1: 0.5149
 epoch: 14, train_loss: 0.9123, test_loss: 0.9840, test_f1: 0.5096
 epoch: 15, train_loss: 0.8988, test_loss: 0.9684, test_f1: 0.5182
 epoch: 16, train_loss: 0.9056, test_loss: 1.0018, test_f1: 0.5066
 epoch: 17, train_loss: 0.8824, test_loss: 1.0591, test_f1: 0.4815
 epoch: 18, train_loss: 0.8827, test_loss: 0.9586, test_f1: 0.5139
 epoch: 19, train_loss: 0.8773, test_loss: 0.9928, test_f1: 0.5016
 epoch: 20, train_loss: 0.8637, test_loss: 0.9776, test_f1: 0.5180
 epoch: 21, train_loss: 0.8667, test_loss: 0.9450, test_f1: 0.5475
 epoch: 22, train_loss: 0.8650, test_loss: 0.9993, test_f1: 0.5017
 epoch: 23, train_loss: 0.8651, test_loss: 0.9700, test_f1: 0.5121
 epoch: 24, train_loss: 0.8421, test_loss: 0.9863, test_f1: 0.4889
 epoch: 25, train_loss: 0.8324, test_loss: 1.0339, test_f1: 0.4976
 epoch: 26, train_loss: 0.8340, test_loss: 0.9576, test_f1: 0.5012
 epoch: 27, train_loss: 0.8440, test_loss: 1.0199, test_f1: 0.5248
 epoch: 28, train_loss: 0.8912, test_loss: 1.5015, test_f1: 0.4812
 epoch: 29, train_loss: 0.8764, test_loss: 0.9641, test_f1: 0.5117
 epoch: 30, train_loss: 0.8541, test_loss: 1.0178, test_f1: 0.4855
 epoch: 31, train_loss: 0.8357, test_loss: 0.9769, test_f1: 0.4960
 epoch: 32, train_loss: 0.8196, test_loss: 1.0210, test_f1: 0.5304
 epoch: 33, train_loss: 0.8026, test_loss: 1.0037, test_f1: 0.5481
 epoch: 34, train_loss: 0.8265, test_loss: 0.9819, test_f1: 0.5041
 epoch: 35, train_loss: 0.8031, test_loss: 0.9704, test_f1: 0.5411
 epoch: 36, train_loss: 0.8185, test_loss: 0.9825, test_f1: 0.5199
 epoch: 37, train_loss: 0.8036, test_loss: 0.9771, test_f1: 0.5061
 epoch: 38, train_loss: 0.7869, test_loss: 0.9794, test_f1: 0.5287
 epoch: 39, train_loss: 0.7874, test_loss: 0.9905, test_f1: 0.5534
 epoch: 40, train_loss: 0.7840, test_loss: 0.9638, test_f1: 0.5386
 epoch: 41, train_loss: 0.7700, test_loss: 1.0635, test_f1: 0.5160
 epoch: 42, train_loss: 0.7880, test_loss: 0.9820, test_f1: 0.5533
 epoch: 43, train_loss: 0.7975, test_loss: 1.0367, test_f1: 0.5435
 epoch: 44, train_loss: 0.7952, test_loss: 0.9845, test_f1: 0.5167
 epoch: 45, train_loss: 0.7916, test_loss: 1.0085, test_f1: 0.5351
 epoch: 46, train_loss: 0.7800, test_loss: 1.0939, test_f1: 0.5205
 epoch: 47, train_loss: 0.7646, test_loss: 1.0052, test_f1: 0.5327
 epoch: 48, train_loss: 0.7622, test_loss: 0.9980, test_f1: 0.5411
 epoch: 49, train_loss: 0.7640, test_loss: 0.9876, test_f1: 0.5600
 epoch: 50, train_loss: 0.7613, test_loss: 1.0175, test_f1: 0.5392
 epoch: 51, train_loss: 0.7361, test_loss: 0.9837, test_f1: 0.5421
 epoch: 52, train_loss: 0.7067, test_loss: 1.0017, test_f1: 0.5371
 epoch: 53, train_loss: 0.7111, test_loss: 1.0021, test_f1: 0.5629
 epoch: 54, train_loss: 0.7027, test_loss: 1.0310, test_f1: 0.5335
 epoch: 55, train_loss: 0.7081, test_loss: 1.0187, test_f1: 0.5489
 epoch: 56, train_loss: 0.6977, test_loss: 1.0280, test_f1: 0.5526
 epoch: 57, train_loss: 0.6979, test_loss: 1.0047, test_f1: 0.5624
 epoch: 58, train_loss: 0.6912, test_loss: 1.0605, test_f1: 0.5376
 epoch: 59, train_loss: 0.6870, test_loss: 1.0956, test_f1: 0.5194
 epoch: 60, train_loss: 0.6904, test_loss: 1.0521, test_f1: 0.5356
 epoch: 61, train_loss: 0.6722, test_loss: 1.0612, test_f1: 0.5489
 epoch: 62, train_loss: 0.6802, test_loss: 1.0906, test_f1: 0.5418
 epoch: 63, train_loss: 0.6795, test_loss: 1.0720, test_f1: 0.5427
 epoch: 64, train_loss: 0.6841, test_loss: 1.0563, test_f1: 0.5580
 epoch: 65, train_loss: 0.6733, test_loss: 1.0568, test_f1: 0.5296
 epoch: 66, train_loss: 0.6680, test_loss: 1.0600, test_f1: 0.5374
 epoch: 67, train_loss: 0.6635, test_loss: 1.0563, test_f1: 0.5337
 epoch: 68, train_loss: 0.6861, test_loss: 1.0955, test_f1: 0.5453
 epoch: 69, train_loss: 0.6838, test_loss: 1.0550, test_f1: 0.5514
 epoch: 70, train_loss: 0.6705, test_loss: 1.0214, test_f1: 0.5807
 epoch: 71, train_loss: 0.6798, test_loss: 1.0421, test_f1: 0.5789
 epoch: 72, train_loss: 0.6569, test_loss: 1.0857, test_f1: 0.5585
 epoch: 73, train_loss: 0.6567, test_loss: 1.1665, test_f1: 0.5598
 epoch: 74, train_loss: 0.6588, test_loss: 1.1076, test_f1: 0.5740
 epoch: 75, train_loss: 0.6549, test_loss: 1.1428, test_f1: 0.5445
 epoch: 76, train_loss: 0.6514, test_loss: 1.0036, test_f1: 0.5691
 epoch: 77, train_loss: 0.6453, test_loss: 1.0831, test_f1: 0.5706
 epoch: 78, train_loss: 0.6581, test_loss: 1.0636, test_f1: 0.5752
 epoch: 79, train_loss: 0.6397, test_loss: 1.1041, test_f1: 0.5503
 epoch: 80, train_loss: 0.6493, test_loss: 1.0419, test_f1: 0.5692
 epoch: 81, train_loss: 0.6409, test_loss: 1.0689, test_f1: 0.5598
 epoch: 82, train_loss: 0.6311, test_loss: 1.0947, test_f1: 0.5461
 epoch: 83, train_loss: 0.6247, test_loss: 1.0797, test_f1: 0.5712
 epoch: 84, train_loss: 0.6291, test_loss: 1.0859, test_f1: 0.5805
 epoch: 85, train_loss: 0.6303, test_loss: 1.1549, test_f1: 0.5336
 epoch: 86, train_loss: 0.6188, test_loss: 1.0872, test_f1: 0.5675
 epoch: 87, train_loss: 0.6175, test_loss: 1.1489, test_f1: 0.5766
 epoch: 88, train_loss: 0.6262, test_loss: 1.0888, test_f1: 0.5772
 epoch: 89, train_loss: 0.6395, test_loss: 1.1403, test_f1: 0.5601
 epoch: 90, train_loss: 0.6248, test_loss: 1.1030, test_f1: 0.5571
 epoch: 91, train_loss: 0.6128, test_loss: 1.0606, test_f1: 0.5912
 epoch: 92, train_loss: 0.6107, test_loss: 1.0997, test_f1: 0.5667
 epoch: 93, train_loss: 0.6139, test_loss: 1.1291, test_f1: 0.5603
 epoch: 94, train_loss: 0.5986, test_loss: 1.1682, test_f1: 0.5734
 epoch: 95, train_loss: 0.6038, test_loss: 1.1820, test_f1: 0.5655
 epoch: 96, train_loss: 0.5847, test_loss: 1.1891, test_f1: 0.5746
 epoch: 97, train_loss: 0.5965, test_loss: 1.1621, test_f1: 0.5957
 epoch: 98, train_loss: 0.5927, test_loss: 1.1380, test_f1: 0.6042
 epoch: 99, train_loss: 0.6319, test_loss: 1.1384, test_f1: 0.5523
##################ITERATION #4 ****************************************
 epoch: 0, train_loss: 1.3957, test_loss: 1.2101, test_f1: 0.2816
 epoch: 1, train_loss: 1.2052, test_loss: 1.1750, test_f1: 0.3532
 epoch: 2, train_loss: 1.1658, test_loss: 1.1104, test_f1: 0.4062
 epoch: 3, train_loss: 1.1197, test_loss: 1.0843, test_f1: 0.4415
 epoch: 4, train_loss: 1.0868, test_loss: 1.0348, test_f1: 0.4897
 epoch: 5, train_loss: 1.0721, test_loss: 1.0750, test_f1: 0.4465
 epoch: 6, train_loss: 1.0520, test_loss: 1.1127, test_f1: 0.4798
 epoch: 7, train_loss: 1.0162, test_loss: 1.0100, test_f1: 0.4720
 epoch: 8, train_loss: 1.0086, test_loss: 1.0684, test_f1: 0.4515
 epoch: 9, train_loss: 0.9636, test_loss: 0.9945, test_f1: 0.4888
 epoch: 10, train_loss: 0.9666, test_loss: 1.0516, test_f1: 0.4676
 epoch: 11, train_loss: 0.9350, test_loss: 0.9999, test_f1: 0.5411
 epoch: 12, train_loss: 0.9415, test_loss: 18.4264, test_f1: 0.3229
 epoch: 13, train_loss: 0.9283, test_loss: 1.0438, test_f1: 0.4928
 epoch: 14, train_loss: 0.9229, test_loss: 1.0001, test_f1: 0.4825
 epoch: 15, train_loss: 0.9010, test_loss: 0.9559, test_f1: 0.5355
 epoch: 16, train_loss: 0.9055, test_loss: 1.0212, test_f1: 0.4984
 epoch: 17, train_loss: 0.8930, test_loss: 1.0157, test_f1: 0.4621
 epoch: 18, train_loss: 0.8902, test_loss: 0.9936, test_f1: 0.5131
 epoch: 19, train_loss: 0.8703, test_loss: 0.9911, test_f1: 0.4881
 epoch: 20, train_loss: 0.8576, test_loss: 1.0036, test_f1: 0.5002
 epoch: 21, train_loss: 0.8499, test_loss: 1.0262, test_f1: 0.5307
 epoch: 22, train_loss: 0.8485, test_loss: 1.0180, test_f1: 0.4808
 epoch: 23, train_loss: 0.8472, test_loss: 1.0739, test_f1: 0.4834
 epoch: 24, train_loss: 0.8531, test_loss: 1.0454, test_f1: 0.5286
 epoch: 25, train_loss: 0.8383, test_loss: 1.0215, test_f1: 0.5250
 epoch: 26, train_loss: 0.8314, test_loss: 1.0598, test_f1: 0.5125
 epoch: 27, train_loss: 0.8222, test_loss: 1.0305, test_f1: 0.5584
 epoch: 28, train_loss: 0.8013, test_loss: 1.0146, test_f1: 0.5297
 epoch: 29, train_loss: 0.8083, test_loss: 1.0458, test_f1: 0.5214
 epoch: 30, train_loss: 0.7998, test_loss: 1.0085, test_f1: 0.5501
 epoch: 31, train_loss: 0.8055, test_loss: 1.0860, test_f1: 0.5394
 epoch: 32, train_loss: 0.8175, test_loss: 0.9742, test_f1: 0.5098
 epoch: 33, train_loss: 0.7949, test_loss: 1.0101, test_f1: 0.5320
 epoch: 34, train_loss: 0.7748, test_loss: 1.1001, test_f1: 0.5209
 epoch: 35, train_loss: 0.7870, test_loss: 1.0015, test_f1: 0.5315
 epoch: 36, train_loss: 0.7771, test_loss: 1.0708, test_f1: 0.5619
 epoch: 37, train_loss: 0.7662, test_loss: 1.1635, test_f1: 0.5249
 epoch: 38, train_loss: 0.7505, test_loss: 1.0430, test_f1: 0.5200
 epoch: 39, train_loss: 0.7452, test_loss: 1.0944, test_f1: 0.5531
 epoch: 40, train_loss: 0.7417, test_loss: 1.0954, test_f1: 0.5500
 epoch: 41, train_loss: 0.7279, test_loss: 1.0633, test_f1: 0.5335
 epoch: 42, train_loss: 0.7296, test_loss: 1.2284, test_f1: 0.5085
 epoch: 43, train_loss: 0.7350, test_loss: 1.1448, test_f1: 0.5629
 epoch: 44, train_loss: 0.7145, test_loss: 1.1135, test_f1: 0.5337
 epoch: 45, train_loss: 0.7315, test_loss: 1.0372, test_f1: 0.5401
 epoch: 46, train_loss: 0.7359, test_loss: 1.0951, test_f1: 0.5244
 epoch: 47, train_loss: 0.7234, test_loss: 1.0642, test_f1: 0.5480
 epoch: 48, train_loss: 0.7097, test_loss: 1.1210, test_f1: 0.5448
 epoch: 49, train_loss: 0.7249, test_loss: 1.0203, test_f1: 0.5689
 epoch: 50, train_loss: 0.7070, test_loss: 1.1632, test_f1: 0.4934
 epoch: 51, train_loss: 0.6822, test_loss: 1.0866, test_f1: 0.5825
 epoch: 52, train_loss: 0.6394, test_loss: 1.1243, test_f1: 0.5488
 epoch: 53, train_loss: 0.6319, test_loss: 1.1834, test_f1: 0.5217
 epoch: 54, train_loss: 0.6227, test_loss: 1.1528, test_f1: 0.5513
 epoch: 55, train_loss: 0.6301, test_loss: 1.1487, test_f1: 0.5661
 epoch: 56, train_loss: 0.6242, test_loss: 1.2507, test_f1: 0.5274
 epoch: 57, train_loss: 0.6305, test_loss: 1.1940, test_f1: 0.5660
 epoch: 58, train_loss: 0.6055, test_loss: 1.2237, test_f1: 0.5563
 epoch: 59, train_loss: 0.6127, test_loss: 1.2367, test_f1: 0.5556
 epoch: 60, train_loss: 0.5974, test_loss: 1.2496, test_f1: 0.5840
 epoch: 61, train_loss: 0.6316, test_loss: 1.1948, test_f1: 0.5409
 epoch: 62, train_loss: 0.5979, test_loss: 1.2712, test_f1: 0.5662
 epoch: 63, train_loss: 0.5861, test_loss: 1.2303, test_f1: 0.5355
 epoch: 64, train_loss: 0.5765, test_loss: 1.3408, test_f1: 0.5292
 epoch: 65, train_loss: 0.5796, test_loss: 1.2690, test_f1: 0.5679
 epoch: 66, train_loss: 0.5850, test_loss: 1.2962, test_f1: 0.5585
 epoch: 67, train_loss: 0.5870, test_loss: 1.3530, test_f1: 0.5468
 epoch: 68, train_loss: 0.6132, test_loss: 1.3843, test_f1: 0.5250
 epoch: 69, train_loss: 0.5966, test_loss: 1.4142, test_f1: 0.5155
 epoch: 70, train_loss: 0.5956, test_loss: 1.3063, test_f1: 0.5720
 epoch: 71, train_loss: 0.5949, test_loss: 1.2994, test_f1: 0.5487
 epoch: 72, train_loss: 0.5714, test_loss: 1.3501, test_f1: 0.5340
 epoch: 73, train_loss: 0.5595, test_loss: 1.3539, test_f1: 0.5508
 epoch: 74, train_loss: 0.5619, test_loss: 1.3360, test_f1: 0.5267
 epoch: 75, train_loss: 0.5730, test_loss: 1.4461, test_f1: 0.5367
 epoch: 76, train_loss: 0.5611, test_loss: 1.3527, test_f1: 0.5460
 epoch: 77, train_loss: 0.5674, test_loss: 1.4160, test_f1: 0.5497
 epoch: 78, train_loss: 0.5379, test_loss: 1.6852, test_f1: 0.5332
 epoch: 79, train_loss: 0.5537, test_loss: 1.4094, test_f1: 0.5345
 epoch: 80, train_loss: 0.5519, test_loss: 1.4028, test_f1: 0.5728
 epoch: 81, train_loss: 0.5468, test_loss: 1.3991, test_f1: 0.5729
 epoch: 82, train_loss: 0.5394, test_loss: 1.5366, test_f1: 0.5411
 epoch: 83, train_loss: 0.5464, test_loss: 1.3556, test_f1: 0.5836
 epoch: 84, train_loss: 0.5395, test_loss: 1.3748, test_f1: 0.5610
 epoch: 85, train_loss: 0.5285, test_loss: 1.5677, test_f1: 0.5572
 epoch: 86, train_loss: 0.5328, test_loss: 1.7404, test_f1: 0.5205
 epoch: 87, train_loss: 0.5529, test_loss: 1.5238, test_f1: 0.5577
 epoch: 88, train_loss: 0.5340, test_loss: 1.5883, test_f1: 0.5362
 epoch: 89, train_loss: 0.5162, test_loss: 1.5490, test_f1: 0.5368
 epoch: 90, train_loss: 0.5259, test_loss: 1.4034, test_f1: 0.5490
 epoch: 91, train_loss: 0.5145, test_loss: 1.6250, test_f1: 0.5528
 epoch: 92, train_loss: 0.5271, test_loss: 1.5127, test_f1: 0.5615
 epoch: 93, train_loss: 0.5087, test_loss: 1.5492, test_f1: 0.5525
 epoch: 94, train_loss: 0.5148, test_loss: 1.6020, test_f1: 0.5442
 epoch: 95, train_loss: 0.4950, test_loss: 1.5499, test_f1: 0.5379
 epoch: 96, train_loss: 0.5195, test_loss: 1.7181, test_f1: 0.5484
 epoch: 97, train_loss: 0.4998, test_loss: 1.5267, test_f1: 0.5358
 epoch: 98, train_loss: 0.5002, test_loss: 1.5343, test_f1: 0.5433
 epoch: 99, train_loss: 0.5189, test_loss: 1.3876, test_f1: 0.5629
##################ITERATION #5 ****************************************
 epoch: 0, train_loss: 1.3805, test_loss: 1.2723, test_f1: 0.2274
 epoch: 1, train_loss: 1.2065, test_loss: 1.1613, test_f1: 0.3309
 epoch: 2, train_loss: 1.1556, test_loss: 1.1221, test_f1: 0.4429
 epoch: 3, train_loss: 1.1187, test_loss: 1.0461, test_f1: 0.4477
 epoch: 4, train_loss: 1.0701, test_loss: 1.0146, test_f1: 0.4522
 epoch: 5, train_loss: 1.0314, test_loss: 1.0335, test_f1: 0.4344
 epoch: 6, train_loss: 1.0053, test_loss: 1.0745, test_f1: 0.4688
 epoch: 7, train_loss: 0.9795, test_loss: 1.0019, test_f1: 0.5078
 epoch: 8, train_loss: 0.9516, test_loss: 0.9546, test_f1: 0.5038
 epoch: 9, train_loss: 0.9421, test_loss: 0.9714, test_f1: 0.4972
 epoch: 10, train_loss: 0.9529, test_loss: 0.9400, test_f1: 0.5218
 epoch: 11, train_loss: 0.9114, test_loss: 0.9797, test_f1: 0.4919
 epoch: 12, train_loss: 0.8949, test_loss: 1.0039, test_f1: 0.5218
 epoch: 13, train_loss: 0.8930, test_loss: 0.9985, test_f1: 0.5140
 epoch: 14, train_loss: 0.8934, test_loss: 1.0413, test_f1: 0.5204
 epoch: 15, train_loss: 0.8918, test_loss: 1.0400, test_f1: 0.5002
 epoch: 16, train_loss: 0.8757, test_loss: 0.9805, test_f1: 0.5086
 epoch: 17, train_loss: 0.8481, test_loss: 1.0747, test_f1: 0.4864
 epoch: 18, train_loss: 0.8505, test_loss: 1.1382, test_f1: 0.4820
 epoch: 19, train_loss: 0.8437, test_loss: 0.9574, test_f1: 0.5514
 epoch: 20, train_loss: 0.8419, test_loss: 1.0125, test_f1: 0.5358
 epoch: 21, train_loss: 0.8213, test_loss: 0.9354, test_f1: 0.5561
 epoch: 22, train_loss: 0.7936, test_loss: 1.0449, test_f1: 0.5214
 epoch: 23, train_loss: 0.7980, test_loss: 1.0598, test_f1: 0.5311
 epoch: 24, train_loss: 0.8092, test_loss: 1.0207, test_f1: 0.5261
 epoch: 25, train_loss: 0.8100, test_loss: 1.1347, test_f1: 0.4650
 epoch: 26, train_loss: 0.7964, test_loss: 1.0260, test_f1: 0.5251
 epoch: 27, train_loss: 0.7916, test_loss: 1.0241, test_f1: 0.5378
 epoch: 28, train_loss: 0.7814, test_loss: 0.9911, test_f1: 0.5441
 epoch: 29, train_loss: 0.7912, test_loss: 0.9931, test_f1: 0.5537
 epoch: 30, train_loss: 0.7777, test_loss: 0.9813, test_f1: 0.5366
 epoch: 31, train_loss: 0.7666, test_loss: 0.9774, test_f1: 0.5803
 epoch: 32, train_loss: 0.7419, test_loss: 1.1246, test_f1: 0.5337
 epoch: 33, train_loss: 0.7804, test_loss: 1.1996, test_f1: 0.5264
 epoch: 34, train_loss: 0.7741, test_loss: 1.0029, test_f1: 0.5503
 epoch: 35, train_loss: 0.7497, test_loss: 1.0653, test_f1: 0.5283
 epoch: 36, train_loss: 0.7574, test_loss: 1.1165, test_f1: 0.5298
 epoch: 37, train_loss: 0.7497, test_loss: 1.0202, test_f1: 0.5500
 epoch: 38, train_loss: 0.7406, test_loss: 0.9781, test_f1: 0.5465
 epoch: 39, train_loss: 0.7385, test_loss: 1.0359, test_f1: 0.5512
 epoch: 40, train_loss: 0.7276, test_loss: 1.0469, test_f1: 0.5660
 epoch: 41, train_loss: 0.7346, test_loss: 1.0240, test_f1: 0.5421
 epoch: 42, train_loss: 0.7389, test_loss: 1.1029, test_f1: 0.5532
 epoch: 43, train_loss: 0.7370, test_loss: 1.0893, test_f1: 0.5579
 epoch: 44, train_loss: 0.7103, test_loss: 1.0968, test_f1: 0.5340
 epoch: 45, train_loss: 0.7216, test_loss: 1.1164, test_f1: 0.5216
 epoch: 46, train_loss: 0.7079, test_loss: 1.0969, test_f1: 0.5347
 epoch: 47, train_loss: 0.6981, test_loss: 1.0579, test_f1: 0.5618
 epoch: 48, train_loss: 0.6750, test_loss: 1.0727, test_f1: 0.5732
 epoch: 49, train_loss: 0.6791, test_loss: 1.1766, test_f1: 0.5409
 epoch: 50, train_loss: 0.7059, test_loss: 0.9850, test_f1: 0.5935
 epoch: 51, train_loss: 0.6637, test_loss: 1.0768, test_f1: 0.5937
 epoch: 52, train_loss: 0.6349, test_loss: 1.1240, test_f1: 0.5619
 epoch: 53, train_loss: 0.6105, test_loss: 1.1463, test_f1: 0.5742
 epoch: 54, train_loss: 0.6236, test_loss: 1.0940, test_f1: 0.5856
 epoch: 55, train_loss: 0.6207, test_loss: 1.0919, test_f1: 0.5644
 epoch: 56, train_loss: 0.6002, test_loss: 1.0931, test_f1: 0.5542
 epoch: 57, train_loss: 0.5808, test_loss: 1.1752, test_f1: 0.5643
 epoch: 58, train_loss: 0.5900, test_loss: 1.1522, test_f1: 0.5665
 epoch: 59, train_loss: 0.5906, test_loss: 1.2330, test_f1: 0.5647
 epoch: 60, train_loss: 0.5888, test_loss: 1.1587, test_f1: 0.5766
 epoch: 61, train_loss: 0.5916, test_loss: 1.1495, test_f1: 0.5764
 epoch: 62, train_loss: 0.5839, test_loss: 1.1460, test_f1: 0.5644
 epoch: 63, train_loss: 0.5999, test_loss: 1.2487, test_f1: 0.5429
 epoch: 64, train_loss: 0.5969, test_loss: 1.1606, test_f1: 0.5721
 epoch: 65, train_loss: 0.5790, test_loss: 1.1785, test_f1: 0.5526
 epoch: 66, train_loss: 0.5846, test_loss: 1.2382, test_f1: 0.5567
 epoch: 67, train_loss: 0.5899, test_loss: 1.2410, test_f1: 0.5296
 epoch: 68, train_loss: 0.5626, test_loss: 1.2535, test_f1: 0.5706
 epoch: 69, train_loss: 0.5675, test_loss: 1.2347, test_f1: 0.5569
 epoch: 70, train_loss: 0.5538, test_loss: 1.2019, test_f1: 0.5986
 epoch: 71, train_loss: 0.5793, test_loss: 1.2300, test_f1: 0.5518
 epoch: 72, train_loss: 0.5826, test_loss: 1.3503, test_f1: 0.5330
 epoch: 73, train_loss: 0.5761, test_loss: 1.2981, test_f1: 0.5298
 epoch: 74, train_loss: 0.5751, test_loss: 1.2035, test_f1: 0.5586
 epoch: 75, train_loss: 0.5473, test_loss: 1.2552, test_f1: 0.5568
 epoch: 76, train_loss: 0.5596, test_loss: 1.2983, test_f1: 0.5253
 epoch: 77, train_loss: 0.5409, test_loss: 1.3396, test_f1: 0.5389
 epoch: 78, train_loss: 0.5443, test_loss: 1.3025, test_f1: 0.5701
 epoch: 79, train_loss: 0.5423, test_loss: 1.3656, test_f1: 0.5662
 epoch: 80, train_loss: 0.5338, test_loss: 1.3478, test_f1: 0.5216
 epoch: 81, train_loss: 0.5401, test_loss: 1.2601, test_f1: 0.5634
 epoch: 82, train_loss: 0.5423, test_loss: 1.2176, test_f1: 0.5454
 epoch: 83, train_loss: 0.5654, test_loss: 1.3556, test_f1: 0.5259
 epoch: 84, train_loss: 0.5399, test_loss: 1.1987, test_f1: 0.5766
 epoch: 85, train_loss: 0.5339, test_loss: 1.2354, test_f1: 0.5791
 epoch: 86, train_loss: 0.5416, test_loss: 1.2025, test_f1: 0.5661
 epoch: 87, train_loss: 0.5231, test_loss: 1.2023, test_f1: 0.5606
 epoch: 88, train_loss: 0.5312, test_loss: 1.2795, test_f1: 0.5732
 epoch: 89, train_loss: 0.5210, test_loss: 1.2460, test_f1: 0.5354
 epoch: 90, train_loss: 0.5251, test_loss: 1.2895, test_f1: 0.5299
 epoch: 91, train_loss: 0.5442, test_loss: 1.2479, test_f1: 0.5584
 epoch: 92, train_loss: 0.5106, test_loss: 1.2140, test_f1: 0.5714
 epoch: 93, train_loss: 0.5271, test_loss: 1.2380, test_f1: 0.5647
 epoch: 94, train_loss: 0.5127, test_loss: 1.2792, test_f1: 0.5513
 epoch: 95, train_loss: 0.5142, test_loss: 1.3426, test_f1: 0.5826
 epoch: 96, train_loss: 0.5115, test_loss: 1.3315, test_f1: 0.5437
 epoch: 97, train_loss: 0.5111, test_loss: 1.3443, test_f1: 0.5630
 epoch: 98, train_loss: 0.4978, test_loss: 1.2909, test_f1: 0.5886
 epoch: 99, train_loss: 0.5130, test_loss: 1.2495, test_f1: 0.5470
##################ITERATION #6 ****************************************
 epoch: 0, train_loss: 1.4217, test_loss: 1.2946, test_f1: 0.2614
 epoch: 1, train_loss: 1.2192, test_loss: 1.2193, test_f1: 0.3214
 epoch: 2, train_loss: 1.1956, test_loss: 1.1523, test_f1: 0.4011
 epoch: 3, train_loss: 1.1610, test_loss: 1.1292, test_f1: 0.4177
 epoch: 4, train_loss: 1.1433, test_loss: 1.0939, test_f1: 0.4108
 epoch: 5, train_loss: 1.1227, test_loss: 1.0882, test_f1: 0.4239
 epoch: 6, train_loss: 1.0977, test_loss: 1.0366, test_f1: 0.4377
 epoch: 7, train_loss: 1.0689, test_loss: 1.0823, test_f1: 0.4739
 epoch: 8, train_loss: 1.0505, test_loss: 1.0038, test_f1: 0.4977
 epoch: 9, train_loss: 1.0245, test_loss: 0.9801, test_f1: 0.4823
 epoch: 10, train_loss: 1.0061, test_loss: 1.0632, test_f1: 0.4463
 epoch: 11, train_loss: 0.9916, test_loss: 0.9508, test_f1: 0.5154
 epoch: 12, train_loss: 0.9622, test_loss: 1.0154, test_f1: 0.4502
 epoch: 13, train_loss: 0.9591, test_loss: 0.9780, test_f1: 0.4598
 epoch: 14, train_loss: 0.9576, test_loss: 1.0162, test_f1: 0.4803
 epoch: 15, train_loss: 0.9488, test_loss: 0.9654, test_f1: 0.4594
 epoch: 16, train_loss: 0.9313, test_loss: 0.9875, test_f1: 0.4857
 epoch: 17, train_loss: 0.9274, test_loss: 0.9889, test_f1: 0.4887
 epoch: 18, train_loss: 0.9104, test_loss: 1.0643, test_f1: 0.4876
 epoch: 19, train_loss: 0.8970, test_loss: 0.9426, test_f1: 0.5047
 epoch: 20, train_loss: 0.8983, test_loss: 1.0564, test_f1: 0.4859
 epoch: 21, train_loss: 0.8833, test_loss: 0.9954, test_f1: 0.4962
 epoch: 22, train_loss: 0.8688, test_loss: 1.0263, test_f1: 0.4614
 epoch: 23, train_loss: 0.8676, test_loss: 0.9617, test_f1: 0.4987
 epoch: 24, train_loss: 0.8814, test_loss: 1.0649, test_f1: 0.4891
 epoch: 25, train_loss: 0.8539, test_loss: 0.9565, test_f1: 0.5255
 epoch: 26, train_loss: 0.8421, test_loss: 0.9984, test_f1: 0.5102
 epoch: 27, train_loss: 0.8601, test_loss: 1.0261, test_f1: 0.4955
 epoch: 28, train_loss: 0.8419, test_loss: 0.9785, test_f1: 0.5261
 epoch: 29, train_loss: 0.8398, test_loss: 0.9986, test_f1: 0.5440
 epoch: 30, train_loss: 0.8222, test_loss: 0.9754, test_f1: 0.5460
 epoch: 31, train_loss: 0.8343, test_loss: 0.9716, test_f1: 0.5692
 epoch: 32, train_loss: 0.8083, test_loss: 0.9442, test_f1: 0.5621
 epoch: 33, train_loss: 0.7994, test_loss: 0.9867, test_f1: 0.5686
 epoch: 34, train_loss: 0.8001, test_loss: 1.0899, test_f1: 0.4939
 epoch: 35, train_loss: 0.7890, test_loss: 0.9518, test_f1: 0.5361
 epoch: 36, train_loss: 0.7933, test_loss: 0.9752, test_f1: 0.5383
 epoch: 37, train_loss: 0.8080, test_loss: 1.0716, test_f1: 0.5295
 epoch: 38, train_loss: 0.7866, test_loss: 1.0179, test_f1: 0.5520
 epoch: 39, train_loss: 0.8035, test_loss: 0.9889, test_f1: 0.5324
 epoch: 40, train_loss: 0.7997, test_loss: 1.0517, test_f1: 0.5434
 epoch: 41, train_loss: 0.7735, test_loss: 1.0596, test_f1: 0.4900
 epoch: 42, train_loss: 0.7787, test_loss: 1.0041, test_f1: 0.5343
 epoch: 43, train_loss: 0.7760, test_loss: 0.9996, test_f1: 0.5588
 epoch: 44, train_loss: 0.7705, test_loss: 1.0234, test_f1: 0.5535
 epoch: 45, train_loss: 0.7587, test_loss: 1.0257, test_f1: 0.5068
 epoch: 46, train_loss: 0.7419, test_loss: 1.0241, test_f1: 0.5685
 epoch: 47, train_loss: 0.7615, test_loss: 0.9498, test_f1: 0.5682
 epoch: 48, train_loss: 0.7432, test_loss: 1.1219, test_f1: 0.5473
 epoch: 49, train_loss: 0.7394, test_loss: 1.0238, test_f1: 0.5661
 epoch: 50, train_loss: 0.7261, test_loss: 1.1467, test_f1: 0.5382
 epoch: 51, train_loss: 0.6931, test_loss: 1.0029, test_f1: 0.5890
 epoch: 52, train_loss: 0.6867, test_loss: 1.0967, test_f1: 0.5611
 epoch: 53, train_loss: 0.6792, test_loss: 1.0966, test_f1: 0.5628
 epoch: 54, train_loss: 0.6827, test_loss: 1.0635, test_f1: 0.5705
 epoch: 55, train_loss: 0.6754, test_loss: 1.1279, test_f1: 0.5437
 epoch: 56, train_loss: 0.6589, test_loss: 1.0438, test_f1: 0.5619
 epoch: 57, train_loss: 0.6540, test_loss: 1.0868, test_f1: 0.5743
 epoch: 58, train_loss: 0.6527, test_loss: 1.0969, test_f1: 0.5305
 epoch: 59, train_loss: 0.6523, test_loss: 1.0210, test_f1: 0.5555
 epoch: 60, train_loss: 0.6520, test_loss: 1.0443, test_f1: 0.5624
 epoch: 61, train_loss: 0.6455, test_loss: 1.0817, test_f1: 0.5613
 epoch: 62, train_loss: 0.6618, test_loss: 1.0864, test_f1: 0.5500
 epoch: 63, train_loss: 0.6402, test_loss: 1.2875, test_f1: 0.5064
 epoch: 64, train_loss: 0.6436, test_loss: 1.0699, test_f1: 0.5823
 epoch: 65, train_loss: 0.6246, test_loss: 1.0720, test_f1: 0.5379
 epoch: 66, train_loss: 0.6371, test_loss: 1.1048, test_f1: 0.5235
 epoch: 67, train_loss: 0.6223, test_loss: 1.1142, test_f1: 0.5449
 epoch: 68, train_loss: 0.6281, test_loss: 1.4843, test_f1: 0.5162
 epoch: 69, train_loss: 0.6233, test_loss: 1.0675, test_f1: 0.5511
 epoch: 70, train_loss: 0.6224, test_loss: 1.0309, test_f1: 0.5589
 epoch: 71, train_loss: 0.6005, test_loss: 1.1763, test_f1: 0.5270
 epoch: 72, train_loss: 0.5958, test_loss: 1.1340, test_f1: 0.5552
 epoch: 73, train_loss: 0.6021, test_loss: 1.1589, test_f1: 0.5527
 epoch: 74, train_loss: 0.5942, test_loss: 1.1209, test_f1: 0.5637
 epoch: 75, train_loss: 0.5955, test_loss: 1.1631, test_f1: 0.5289
 epoch: 76, train_loss: 0.6228, test_loss: 1.1686, test_f1: 0.5317
 epoch: 77, train_loss: 0.6246, test_loss: 1.0985, test_f1: 0.5573
 epoch: 78, train_loss: 0.6055, test_loss: 1.2603, test_f1: 0.4974
 epoch: 79, train_loss: 0.5947, test_loss: 1.1658, test_f1: 0.5464
 epoch: 80, train_loss: 0.5838, test_loss: 1.2465, test_f1: 0.5118
 epoch: 81, train_loss: 0.5961, test_loss: 1.2580, test_f1: 0.5197
 epoch: 82, train_loss: 0.5900, test_loss: 1.1632, test_f1: 0.5408
 epoch: 83, train_loss: 0.5773, test_loss: 1.1340, test_f1: 0.5582
 epoch: 84, train_loss: 0.5752, test_loss: 1.2886, test_f1: 0.5137
 epoch: 85, train_loss: 0.6002, test_loss: 1.1785, test_f1: 0.5823
 epoch: 86, train_loss: 0.5924, test_loss: 1.1895, test_f1: 0.5551
 epoch: 87, train_loss: 0.5767, test_loss: 1.1868, test_f1: 0.5512
 epoch: 88, train_loss: 0.5856, test_loss: 1.2524, test_f1: 0.5207
 epoch: 89, train_loss: 0.5589, test_loss: 1.1725, test_f1: 0.5552
 epoch: 90, train_loss: 0.5931, test_loss: 1.2095, test_f1: 0.5384
 epoch: 91, train_loss: 0.5952, test_loss: 1.3834, test_f1: 0.5180
 epoch: 92, train_loss: 0.5667, test_loss: 1.1578, test_f1: 0.5580
 epoch: 93, train_loss: 0.5459, test_loss: 1.2338, test_f1: 0.5605
 epoch: 94, train_loss: 0.5450, test_loss: 1.2647, test_f1: 0.5720
 epoch: 95, train_loss: 0.5604, test_loss: 1.1940, test_f1: 0.5688
 epoch: 96, train_loss: 0.5538, test_loss: 1.1384, test_f1: 0.6073
 epoch: 97, train_loss: 0.5626, test_loss: 1.2414, test_f1: 0.5501
 epoch: 98, train_loss: 0.5578, test_loss: 1.1330, test_f1: 0.5678
 epoch: 99, train_loss: 0.5511, test_loss: 1.3231, test_f1: 0.5476
##################ITERATION #7 ****************************************
 epoch: 0, train_loss: 1.4080, test_loss: 1.4192, test_f1: 0.2529
 epoch: 1, train_loss: 1.2305, test_loss: 1.2273, test_f1: 0.3023
 epoch: 2, train_loss: 1.1833, test_loss: 1.1208, test_f1: 0.4112
 epoch: 3, train_loss: 1.1472, test_loss: 1.2473, test_f1: 0.3651
 epoch: 4, train_loss: 1.1102, test_loss: 1.1788, test_f1: 0.4252
 epoch: 5, train_loss: 1.0923, test_loss: 1.0066, test_f1: 0.5039
 epoch: 6, train_loss: 1.0571, test_loss: 1.1019, test_f1: 0.4685
 epoch: 7, train_loss: 1.0290, test_loss: 0.9988, test_f1: 0.4820
 epoch: 8, train_loss: 1.0053, test_loss: 1.1055, test_f1: 0.4376
 epoch: 9, train_loss: 0.9803, test_loss: 0.9901, test_f1: 0.4948
 epoch: 10, train_loss: 0.9620, test_loss: 0.9764, test_f1: 0.4594
 epoch: 11, train_loss: 0.9563, test_loss: 0.9343, test_f1: 0.5256
 epoch: 12, train_loss: 0.9387, test_loss: 1.1811, test_f1: 0.4594
 epoch: 13, train_loss: 0.9476, test_loss: 0.9746, test_f1: 0.4795
 epoch: 14, train_loss: 0.9257, test_loss: 0.9782, test_f1: 0.5124
 epoch: 15, train_loss: 0.9211, test_loss: 1.0223, test_f1: 0.5258
 epoch: 16, train_loss: 0.9218, test_loss: 0.9692, test_f1: 0.5080
 epoch: 17, train_loss: 0.8961, test_loss: 1.0692, test_f1: 0.4762
 epoch: 18, train_loss: 0.8677, test_loss: 1.0311, test_f1: 0.5290
 epoch: 19, train_loss: 0.8674, test_loss: 1.3944, test_f1: 0.4418
 epoch: 20, train_loss: 0.9097, test_loss: 0.9927, test_f1: 0.5094
 epoch: 21, train_loss: 0.8882, test_loss: 1.0964, test_f1: 0.4537
 epoch: 22, train_loss: 0.8924, test_loss: 0.9921, test_f1: 0.5059
 epoch: 23, train_loss: 0.8806, test_loss: 1.0484, test_f1: 0.4802
 epoch: 24, train_loss: 0.8707, test_loss: 0.9587, test_f1: 0.4898
 epoch: 25, train_loss: 0.8639, test_loss: 1.1341, test_f1: 0.4757
 epoch: 26, train_loss: 0.8720, test_loss: 0.9437, test_f1: 0.4905
 epoch: 27, train_loss: 0.8674, test_loss: 1.0659, test_f1: 0.4748
 epoch: 28, train_loss: 0.8616, test_loss: 0.9997, test_f1: 0.5220
 epoch: 29, train_loss: 0.8293, test_loss: 1.0684, test_f1: 0.4861
 epoch: 30, train_loss: 0.8267, test_loss: 1.0259, test_f1: 0.4956
 epoch: 31, train_loss: 0.8273, test_loss: 0.9851, test_f1: 0.4945
 epoch: 32, train_loss: 0.8143, test_loss: 1.0048, test_f1: 0.5302
 epoch: 33, train_loss: 0.8114, test_loss: 1.0231, test_f1: 0.5118
 epoch: 34, train_loss: 0.8333, test_loss: 0.9810, test_f1: 0.5196
 epoch: 35, train_loss: 0.8121, test_loss: 1.0569, test_f1: 0.4683
 epoch: 36, train_loss: 0.7913, test_loss: 1.0184, test_f1: 0.5213
 epoch: 37, train_loss: 0.8081, test_loss: 1.0242, test_f1: 0.5055
 epoch: 38, train_loss: 0.7740, test_loss: 1.1024, test_f1: 0.5065
 epoch: 39, train_loss: 0.7896, test_loss: 1.2039, test_f1: 0.4546
 epoch: 40, train_loss: 0.8198, test_loss: 1.0139, test_f1: 0.5331
 epoch: 41, train_loss: 0.7996, test_loss: 1.1003, test_f1: 0.5079
 epoch: 42, train_loss: 0.8030, test_loss: 1.1011, test_f1: 0.4773
 epoch: 43, train_loss: 0.7816, test_loss: 0.9715, test_f1: 0.5162
 epoch: 44, train_loss: 0.7735, test_loss: 0.9791, test_f1: 0.4858
 epoch: 45, train_loss: 0.7958, test_loss: 1.0393, test_f1: 0.5186
 epoch: 46, train_loss: 0.7727, test_loss: 1.1030, test_f1: 0.4803
 epoch: 47, train_loss: 0.7592, test_loss: 0.9870, test_f1: 0.5252
 epoch: 48, train_loss: 0.7619, test_loss: 0.9510, test_f1: 0.5629
 epoch: 49, train_loss: 0.7741, test_loss: 1.1519, test_f1: 0.4735
 epoch: 50, train_loss: 0.7647, test_loss: 1.0307, test_f1: 0.4909
 epoch: 51, train_loss: 0.7570, test_loss: 1.0386, test_f1: 0.5230
 epoch: 52, train_loss: 0.7272, test_loss: 1.0503, test_f1: 0.5365
 epoch: 53, train_loss: 0.6975, test_loss: 1.0255, test_f1: 0.5426
 epoch: 54, train_loss: 0.6899, test_loss: 1.1145, test_f1: 0.5095
 epoch: 55, train_loss: 0.6906, test_loss: 1.1100, test_f1: 0.5113
 epoch: 56, train_loss: 0.6955, test_loss: 0.9772, test_f1: 0.5306
 epoch: 57, train_loss: 0.6961, test_loss: 1.0911, test_f1: 0.5317
 epoch: 58, train_loss: 0.6780, test_loss: 1.0384, test_f1: 0.5380
 epoch: 59, train_loss: 0.6807, test_loss: 1.0497, test_f1: 0.5451
 epoch: 60, train_loss: 0.6645, test_loss: 1.1516, test_f1: 0.5116
 epoch: 61, train_loss: 0.6729, test_loss: 1.0637, test_f1: 0.5421
 epoch: 62, train_loss: 0.6664, test_loss: 1.0328, test_f1: 0.5476
 epoch: 63, train_loss: 0.6673, test_loss: 1.1080, test_f1: 0.5042
 epoch: 64, train_loss: 0.6657, test_loss: 1.1222, test_f1: 0.5118
 epoch: 65, train_loss: 0.6618, test_loss: 1.1407, test_f1: 0.5012
 epoch: 66, train_loss: 0.6607, test_loss: 1.1056, test_f1: 0.5241
 epoch: 67, train_loss: 0.6513, test_loss: 1.0889, test_f1: 0.5455
 epoch: 68, train_loss: 0.6633, test_loss: 1.1414, test_f1: 0.5104
 epoch: 69, train_loss: 0.6589, test_loss: 1.0769, test_f1: 0.5096
 epoch: 70, train_loss: 0.6464, test_loss: 1.1684, test_f1: 0.4990
 epoch: 71, train_loss: 0.6410, test_loss: 1.1350, test_f1: 0.4955
 epoch: 72, train_loss: 0.6584, test_loss: 1.1190, test_f1: 0.5475
 epoch: 73, train_loss: 0.6640, test_loss: 1.1152, test_f1: 0.5442
 epoch: 74, train_loss: 0.6507, test_loss: 1.1051, test_f1: 0.5437
 epoch: 75, train_loss: 0.6262, test_loss: 1.1380, test_f1: 0.5430
 epoch: 76, train_loss: 0.6210, test_loss: 1.1610, test_f1: 0.5517
 epoch: 77, train_loss: 0.6353, test_loss: 1.1631, test_f1: 0.5065
 epoch: 78, train_loss: 0.6226, test_loss: 1.2118, test_f1: 0.5200
 epoch: 79, train_loss: 0.6268, test_loss: 1.1484, test_f1: 0.5316
 epoch: 80, train_loss: 0.6134, test_loss: 1.1228, test_f1: 0.5347
 epoch: 81, train_loss: 0.6149, test_loss: 1.2341, test_f1: 0.4993
 epoch: 82, train_loss: 0.6206, test_loss: 1.1581, test_f1: 0.5496
 epoch: 83, train_loss: 0.6293, test_loss: 1.1450, test_f1: 0.5293
 epoch: 84, train_loss: 0.6241, test_loss: 1.1880, test_f1: 0.5123
 epoch: 85, train_loss: 0.6060, test_loss: 1.1573, test_f1: 0.5227
 epoch: 86, train_loss: 0.5922, test_loss: 1.2090, test_f1: 0.5284
 epoch: 87, train_loss: 0.6015, test_loss: 1.2782, test_f1: 0.5003
 epoch: 88, train_loss: 0.6239, test_loss: 1.2777, test_f1: 0.5029
 epoch: 89, train_loss: 0.6152, test_loss: 1.2560, test_f1: 0.5181
 epoch: 90, train_loss: 0.6310, test_loss: 1.2537, test_f1: 0.5065
 epoch: 91, train_loss: 0.6123, test_loss: 1.1966, test_f1: 0.5038
 epoch: 92, train_loss: 0.5900, test_loss: 1.2759, test_f1: 0.4799
 epoch: 93, train_loss: 0.6085, test_loss: 1.1901, test_f1: 0.5259
 epoch: 94, train_loss: 0.5972, test_loss: 1.1203, test_f1: 0.5243
 epoch: 95, train_loss: 0.5742, test_loss: 1.1968, test_f1: 0.5214
 epoch: 96, train_loss: 0.5676, test_loss: 1.1376, test_f1: 0.5247
 epoch: 97, train_loss: 0.5649, test_loss: 1.2873, test_f1: 0.4954
 epoch: 98, train_loss: 0.5959, test_loss: 1.2512, test_f1: 0.5241
 epoch: 99, train_loss: 0.5910, test_loss: 1.2808, test_f1: 0.4797
##################ITERATION #8 ****************************************
 epoch: 0, train_loss: 1.3530, test_loss: 1.2248, test_f1: 0.3375
 epoch: 1, train_loss: 1.1740, test_loss: 1.1113, test_f1: 0.4259
 epoch: 2, train_loss: 1.1087, test_loss: 1.0554, test_f1: 0.4643
 epoch: 3, train_loss: 1.0638, test_loss: 1.0446, test_f1: 0.4532
 epoch: 4, train_loss: 1.0399, test_loss: 1.0026, test_f1: 0.4640
 epoch: 5, train_loss: 1.0271, test_loss: 1.0288, test_f1: 0.4539
 epoch: 6, train_loss: 1.0149, test_loss: 0.9936, test_f1: 0.5133
 epoch: 7, train_loss: 0.9832, test_loss: 0.9568, test_f1: 0.5120
 epoch: 8, train_loss: 0.9598, test_loss: 0.9746, test_f1: 0.5327
 epoch: 9, train_loss: 0.9636, test_loss: 1.0411, test_f1: 0.4607
 epoch: 10, train_loss: 0.9317, test_loss: 0.9818, test_f1: 0.5149
 epoch: 11, train_loss: 0.9243, test_loss: 0.9438, test_f1: 0.5438
 epoch: 12, train_loss: 0.8924, test_loss: 1.1201, test_f1: 0.4235
 epoch: 13, train_loss: 0.9055, test_loss: 1.0170, test_f1: 0.4948
 epoch: 14, train_loss: 0.9039, test_loss: 0.9354, test_f1: 0.4954
 epoch: 15, train_loss: 0.8738, test_loss: 0.9687, test_f1: 0.5209
 epoch: 16, train_loss: 0.8676, test_loss: 0.9352, test_f1: 0.5070
 epoch: 17, train_loss: 0.8840, test_loss: 1.0700, test_f1: 0.4789
 epoch: 18, train_loss: 0.8521, test_loss: 0.9485, test_f1: 0.5202
 epoch: 19, train_loss: 0.8610, test_loss: 0.9787, test_f1: 0.5358
 epoch: 20, train_loss: 0.8576, test_loss: 0.9466, test_f1: 0.5116
 epoch: 21, train_loss: 0.8474, test_loss: 0.9109, test_f1: 0.5725
 epoch: 22, train_loss: 0.8208, test_loss: 0.8676, test_f1: 0.5798
 epoch: 23, train_loss: 0.8306, test_loss: 0.8613, test_f1: 0.5603
 epoch: 24, train_loss: 0.8096, test_loss: 0.8785, test_f1: 0.5833
 epoch: 25, train_loss: 0.7934, test_loss: 0.9324, test_f1: 0.5270
 epoch: 26, train_loss: 0.7860, test_loss: 0.9529, test_f1: 0.5468
 epoch: 27, train_loss: 0.7879, test_loss: 0.9331, test_f1: 0.5669
 epoch: 28, train_loss: 0.7870, test_loss: 0.9504, test_f1: 0.5479
 epoch: 29, train_loss: 0.7636, test_loss: 0.9423, test_f1: 0.5334
 epoch: 30, train_loss: 0.7725, test_loss: 0.9617, test_f1: 0.5255
 epoch: 31, train_loss: 0.7958, test_loss: 0.9679, test_f1: 0.5579
 epoch: 32, train_loss: 0.7556, test_loss: 0.8614, test_f1: 0.5507
 epoch: 33, train_loss: 0.7598, test_loss: 0.8825, test_f1: 0.5915
 epoch: 34, train_loss: 0.7307, test_loss: 0.9672, test_f1: 0.5478
 epoch: 35, train_loss: 0.7489, test_loss: 0.9133, test_f1: 0.5622
 epoch: 36, train_loss: 0.7273, test_loss: 0.9794, test_f1: 0.5641
 epoch: 37, train_loss: 0.7726, test_loss: 1.0180, test_f1: 0.5264
 epoch: 38, train_loss: 0.7785, test_loss: 0.9439, test_f1: 0.5821
 epoch: 39, train_loss: 0.7305, test_loss: 0.8988, test_f1: 0.5988
 epoch: 40, train_loss: 0.7212, test_loss: 1.0594, test_f1: 0.5211
 epoch: 41, train_loss: 0.7064, test_loss: 0.9889, test_f1: 0.5697
 epoch: 42, train_loss: 0.6979, test_loss: 0.9284, test_f1: 0.5613
 epoch: 43, train_loss: 0.6853, test_loss: 0.9232, test_f1: 0.5712
 epoch: 44, train_loss: 0.7091, test_loss: 0.9726, test_f1: 0.5725
 epoch: 45, train_loss: 0.6729, test_loss: 0.9461, test_f1: 0.5682
 epoch: 46, train_loss: 0.6899, test_loss: 1.0667, test_f1: 0.5531
 epoch: 47, train_loss: 0.6795, test_loss: 1.0766, test_f1: 0.5321
 epoch: 48, train_loss: 0.6425, test_loss: 0.9927, test_f1: 0.5587
 epoch: 49, train_loss: 0.6734, test_loss: 1.0662, test_f1: 0.5744
 epoch: 50, train_loss: 0.6871, test_loss: 1.0283, test_f1: 0.5589
 epoch: 51, train_loss: 0.6531, test_loss: 0.9627, test_f1: 0.5803
 epoch: 52, train_loss: 0.6164, test_loss: 0.9610, test_f1: 0.5816
 epoch: 53, train_loss: 0.5896, test_loss: 1.0115, test_f1: 0.5817
 epoch: 54, train_loss: 0.6002, test_loss: 1.0853, test_f1: 0.5424
 epoch: 55, train_loss: 0.5899, test_loss: 1.0287, test_f1: 0.5529
 epoch: 56, train_loss: 0.5870, test_loss: 1.0663, test_f1: 0.5887
 epoch: 57, train_loss: 0.5762, test_loss: 1.0106, test_f1: 0.5807
 epoch: 58, train_loss: 0.5717, test_loss: 1.0300, test_f1: 0.5671
 epoch: 59, train_loss: 0.5753, test_loss: 1.0745, test_f1: 0.5613
 epoch: 60, train_loss: 0.5684, test_loss: 1.1693, test_f1: 0.5684
 epoch: 61, train_loss: 0.5629, test_loss: 1.0386, test_f1: 0.5652
 epoch: 62, train_loss: 0.5733, test_loss: 1.0705, test_f1: 0.5423
 epoch: 63, train_loss: 0.5551, test_loss: 1.0991, test_f1: 0.5728
 epoch: 64, train_loss: 0.5444, test_loss: 1.2046, test_f1: 0.5455
 epoch: 65, train_loss: 0.5374, test_loss: 1.1599, test_f1: 0.5759
 epoch: 66, train_loss: 0.5379, test_loss: 1.3064, test_f1: 0.5521
 epoch: 67, train_loss: 0.5490, test_loss: 1.0870, test_f1: 0.5965
 epoch: 68, train_loss: 0.5455, test_loss: 1.1413, test_f1: 0.5518
 epoch: 69, train_loss: 0.5360, test_loss: 1.1592, test_f1: 0.5761
 epoch: 70, train_loss: 0.5242, test_loss: 1.0937, test_f1: 0.5943
 epoch: 71, train_loss: 0.5404, test_loss: 1.1888, test_f1: 0.5553
 epoch: 72, train_loss: 0.5331, test_loss: 1.0807, test_f1: 0.5591
 epoch: 73, train_loss: 0.5357, test_loss: 1.0331, test_f1: 0.6040
 epoch: 74, train_loss: 0.5151, test_loss: 1.2532, test_f1: 0.5344
 epoch: 75, train_loss: 0.5141, test_loss: 1.2030, test_f1: 0.5429
 epoch: 76, train_loss: 0.5266, test_loss: 1.2587, test_f1: 0.5611
 epoch: 77, train_loss: 0.5088, test_loss: 1.2056, test_f1: 0.5793
 epoch: 78, train_loss: 0.5130, test_loss: 1.2143, test_f1: 0.5610
 epoch: 79, train_loss: 0.5262, test_loss: 1.2191, test_f1: 0.5860
 epoch: 80, train_loss: 0.5153, test_loss: 1.2098, test_f1: 0.5854
 epoch: 81, train_loss: 0.5244, test_loss: 1.1331, test_f1: 0.5714
 epoch: 82, train_loss: 0.5205, test_loss: 1.2026, test_f1: 0.5623
 epoch: 83, train_loss: 0.5270, test_loss: 1.1199, test_f1: 0.5866
 epoch: 84, train_loss: 0.5173, test_loss: 1.3777, test_f1: 0.5602
 epoch: 85, train_loss: 0.4984, test_loss: 1.2164, test_f1: 0.5630
 epoch: 86, train_loss: 0.4916, test_loss: 1.2347, test_f1: 0.5692
 epoch: 87, train_loss: 0.4811, test_loss: 1.2799, test_f1: 0.5377
 epoch: 88, train_loss: 0.5075, test_loss: 1.3555, test_f1: 0.5549
 epoch: 89, train_loss: 0.5103, test_loss: 1.2779, test_f1: 0.5495
 epoch: 90, train_loss: 0.4905, test_loss: 1.2482, test_f1: 0.5817
 epoch: 91, train_loss: 0.4798, test_loss: 1.2766, test_f1: 0.5574
 epoch: 92, train_loss: 0.4917, test_loss: 1.1624, test_f1: 0.5959
 epoch: 93, train_loss: 0.4893, test_loss: 1.1011, test_f1: 0.5839
 epoch: 94, train_loss: 0.4782, test_loss: 1.2006, test_f1: 0.5975
 epoch: 95, train_loss: 0.4587, test_loss: 1.3210, test_f1: 0.5748
 epoch: 96, train_loss: 0.4758, test_loss: 1.1935, test_f1: 0.5884
 epoch: 97, train_loss: 0.4656, test_loss: 1.1886, test_f1: 0.5871
 epoch: 98, train_loss: 0.4637, test_loss: 1.2406, test_f1: 0.5780
 epoch: 99, train_loss: 0.4684, test_loss: 1.2786, test_f1: 0.5753
##################ITERATION #9 ****************************************
 epoch: 0, train_loss: 1.6308, test_loss: 1.3574, test_f1: 0.2875
 epoch: 1, train_loss: 1.2636, test_loss: 1.2087, test_f1: 0.3391
 epoch: 2, train_loss: 1.1985, test_loss: 1.1488, test_f1: 0.4224
 epoch: 3, train_loss: 1.1573, test_loss: 1.1030, test_f1: 0.4701
 epoch: 4, train_loss: 1.1128, test_loss: 1.0784, test_f1: 0.4473
 epoch: 5, train_loss: 1.0674, test_loss: 0.9895, test_f1: 0.5268
 epoch: 6, train_loss: 1.0337, test_loss: 1.0857, test_f1: 0.4150
 epoch: 7, train_loss: 1.0281, test_loss: 0.9918, test_f1: 0.5166
 epoch: 8, train_loss: 1.0053, test_loss: 0.9586, test_f1: 0.5280
 epoch: 9, train_loss: 1.0014, test_loss: 1.0337, test_f1: 0.4659
 epoch: 10, train_loss: 0.9754, test_loss: 0.9999, test_f1: 0.4703
 epoch: 11, train_loss: 0.9614, test_loss: 0.9469, test_f1: 0.4715
 epoch: 12, train_loss: 0.9288, test_loss: 0.9419, test_f1: 0.5235
 epoch: 13, train_loss: 0.9295, test_loss: 0.9466, test_f1: 0.4716
 epoch: 14, train_loss: 0.9186, test_loss: 0.9394, test_f1: 0.5275
 epoch: 15, train_loss: 0.9135, test_loss: 0.9187, test_f1: 0.5286
 epoch: 16, train_loss: 0.8934, test_loss: 0.9567, test_f1: 0.5019
 epoch: 17, train_loss: 0.8848, test_loss: 0.9810, test_f1: 0.5337
 epoch: 18, train_loss: 0.8808, test_loss: 0.9876, test_f1: 0.4820
 epoch: 19, train_loss: 0.8794, test_loss: 0.9920, test_f1: 0.5069
 epoch: 20, train_loss: 0.8758, test_loss: 1.0120, test_f1: 0.4996
 epoch: 21, train_loss: 0.8547, test_loss: 1.0355, test_f1: 0.5099
 epoch: 22, train_loss: 0.8581, test_loss: 0.9749, test_f1: 0.4957
 epoch: 23, train_loss: 0.8581, test_loss: 1.0072, test_f1: 0.4744
 epoch: 24, train_loss: 0.8383, test_loss: 1.0044, test_f1: 0.5119
 epoch: 25, train_loss: 0.8259, test_loss: 1.0297, test_f1: 0.5288
 epoch: 26, train_loss: 0.8297, test_loss: 0.9493, test_f1: 0.5161
 epoch: 27, train_loss: 0.8274, test_loss: 0.9526, test_f1: 0.5457
 epoch: 28, train_loss: 0.8259, test_loss: 1.0139, test_f1: 0.5001
 epoch: 29, train_loss: 0.7967, test_loss: 1.0397, test_f1: 0.5306
 epoch: 30, train_loss: 0.8140, test_loss: 1.0343, test_f1: 0.5200
 epoch: 31, train_loss: 0.8015, test_loss: 1.0081, test_f1: 0.5286
 epoch: 32, train_loss: 0.8042, test_loss: 1.0260, test_f1: 0.5099
 epoch: 33, train_loss: 0.7991, test_loss: 1.0188, test_f1: 0.5105
 epoch: 34, train_loss: 0.8025, test_loss: 0.9397, test_f1: 0.5506
 epoch: 35, train_loss: 0.7820, test_loss: 0.9817, test_f1: 0.5330
 epoch: 36, train_loss: 0.7577, test_loss: 1.0083, test_f1: 0.4961
 epoch: 37, train_loss: 0.7656, test_loss: 0.9965, test_f1: 0.5553
 epoch: 38, train_loss: 0.7586, test_loss: 1.0273, test_f1: 0.5242
 epoch: 39, train_loss: 0.7642, test_loss: 0.9945, test_f1: 0.5370
 epoch: 40, train_loss: 0.7752, test_loss: 0.9848, test_f1: 0.5218
 epoch: 41, train_loss: 0.7670, test_loss: 0.9805, test_f1: 0.5173
 epoch: 42, train_loss: 0.7576, test_loss: 1.0474, test_f1: 0.5279
 epoch: 43, train_loss: 0.7453, test_loss: 0.9738, test_f1: 0.5472
 epoch: 44, train_loss: 0.7687, test_loss: 0.9900, test_f1: 0.5372
 epoch: 45, train_loss: 0.7319, test_loss: 1.0047, test_f1: 0.5561
 epoch: 46, train_loss: 0.7606, test_loss: 1.0028, test_f1: 0.5332
 epoch: 47, train_loss: 0.7604, test_loss: 1.0534, test_f1: 0.5282
 epoch: 48, train_loss: 0.7534, test_loss: 1.0870, test_f1: 0.5504
 epoch: 49, train_loss: 0.7253, test_loss: 1.0647, test_f1: 0.5164
 epoch: 50, train_loss: 0.7500, test_loss: 0.9738, test_f1: 0.5424
 epoch: 51, train_loss: 0.7066, test_loss: 1.0873, test_f1: 0.5152
 epoch: 52, train_loss: 0.6885, test_loss: 1.0604, test_f1: 0.5718
 epoch: 53, train_loss: 0.6780, test_loss: 1.0640, test_f1: 0.5638
 epoch: 54, train_loss: 0.6770, test_loss: 1.0760, test_f1: 0.5622
 epoch: 55, train_loss: 0.6812, test_loss: 1.1188, test_f1: 0.5460
 epoch: 56, train_loss: 0.6615, test_loss: 1.1528, test_f1: 0.5576
 epoch: 57, train_loss: 0.6366, test_loss: 1.1171, test_f1: 0.5137
 epoch: 58, train_loss: 0.6562, test_loss: 1.1939, test_f1: 0.5464
 epoch: 59, train_loss: 0.6561, test_loss: 1.1298, test_f1: 0.5495
 epoch: 60, train_loss: 0.6338, test_loss: 1.1573, test_f1: 0.5758
 epoch: 61, train_loss: 0.6406, test_loss: 1.1233, test_f1: 0.5581
 epoch: 62, train_loss: 0.6251, test_loss: 1.1889, test_f1: 0.5506
 epoch: 63, train_loss: 0.6329, test_loss: 1.1155, test_f1: 0.5481
 epoch: 64, train_loss: 0.6343, test_loss: 1.0917, test_f1: 0.5453
 epoch: 65, train_loss: 0.6077, test_loss: 1.1825, test_f1: 0.5620
 epoch: 66, train_loss: 0.6352, test_loss: 1.1585, test_f1: 0.5611
 epoch: 67, train_loss: 0.6192, test_loss: 1.1105, test_f1: 0.5762
 epoch: 68, train_loss: 0.6176, test_loss: 1.1536, test_f1: 0.5725
 epoch: 69, train_loss: 0.6054, test_loss: 1.1117, test_f1: 0.6051
 epoch: 70, train_loss: 0.6051, test_loss: 1.1030, test_f1: 0.5842
 epoch: 71, train_loss: 0.6021, test_loss: 1.1752, test_f1: 0.5551
 epoch: 72, train_loss: 0.5844, test_loss: 1.2726, test_f1: 0.5528
 epoch: 73, train_loss: 0.5803, test_loss: 1.1558, test_f1: 0.5741
 epoch: 74, train_loss: 0.6003, test_loss: 1.2392, test_f1: 0.5523
 epoch: 75, train_loss: 0.5921, test_loss: 1.1704, test_f1: 0.5869
 epoch: 76, train_loss: 0.5694, test_loss: 1.2686, test_f1: 0.5616
 epoch: 77, train_loss: 0.5844, test_loss: 1.3159, test_f1: 0.5743
 epoch: 78, train_loss: 0.5745, test_loss: 1.2054, test_f1: 0.5658
 epoch: 79, train_loss: 0.5751, test_loss: 1.2238, test_f1: 0.5801
 epoch: 80, train_loss: 0.5723, test_loss: 1.2879, test_f1: 0.5707
 epoch: 81, train_loss: 0.5634, test_loss: 1.2937, test_f1: 0.5752
 epoch: 82, train_loss: 0.5752, test_loss: 1.3420, test_f1: 0.5525
 epoch: 83, train_loss: 0.5734, test_loss: 1.1795, test_f1: 0.5874
 epoch: 84, train_loss: 0.5622, test_loss: 1.3364, test_f1: 0.5695
 epoch: 85, train_loss: 0.5633, test_loss: 1.4310, test_f1: 0.5385
 epoch: 86, train_loss: 0.5535, test_loss: 1.3202, test_f1: 0.5545
 epoch: 87, train_loss: 0.5490, test_loss: 1.2009, test_f1: 0.5701
 epoch: 88, train_loss: 0.5393, test_loss: 1.1646, test_f1: 0.5498
 epoch: 89, train_loss: 0.5453, test_loss: 1.2530, test_f1: 0.5660
 epoch: 90, train_loss: 0.5498, test_loss: 1.3125, test_f1: 0.5713
 epoch: 91, train_loss: 0.5532, test_loss: 1.2533, test_f1: 0.5873
 epoch: 92, train_loss: 0.5646, test_loss: 1.2829, test_f1: 0.5717
 epoch: 93, train_loss: 0.5352, test_loss: 1.3519, test_f1: 0.5540
 epoch: 94, train_loss: 0.5500, test_loss: 1.3924, test_f1: 0.5388
 epoch: 95, train_loss: 0.5571, test_loss: 1.2921, test_f1: 0.5495
 epoch: 96, train_loss: 0.5402, test_loss: 1.3538, test_f1: 0.5624
 epoch: 97, train_loss: 0.5301, test_loss: 1.3419, test_f1: 0.5645
 epoch: 98, train_loss: 0.5128, test_loss: 1.3539, test_f1: 0.5593
 epoch: 99, train_loss: 0.5126, test_loss: 1.4052, test_f1: 0.5764

Training completed in 373.34 seconds
Best F1: 0.6073 at epoch 96
Mean F1 across iterations: 0.5910  0.0147
========================FINAL RESULTS================================
FEGIN weighted F1: 0.6073  0.0147
python main.py --data ltspice_examples --representation component_component --model FEGIN --layers 3 --hiddens 32 --batch_size 256 --lr 0.01 --emb_size 250 --epochs 100 --save_appendix component_component_L3_H32_BS256_LR0.01_E250 --no_val
-----



STDERR:
  File "main.py", line 370, in <module>
    main()
  File "main.py", line 254, in main
    dataset = dataset_class(
  File "/home/philip/projects/ltspice_examples_code_repo/Circuit-Completion-Using-GNNs/component_classification_with_link_prediction_head/evaluation/FEGIN/kernel/circuit_datasets.py", line 15, in __init__
    self.data, self.slices = torch.load(self.processed_paths[0])
  File "/home/philip/.local/lib/python3.8/site-packages/torch/serialization.py", line 1040, in load
    warnings.warn(
  File "/usr/lib/python3.8/warnings.py", line 109, in _showwarnmsg
    sw(msg.message, msg.category, msg.filename, msg.lineno,
  File "main.py", line 47, in warn_with_traceback
    traceback.print_stack(file=log)
/home/philip/projects/ltspice_examples_code_repo/Circuit-Completion-Using-GNNs/component_classification_with_link_prediction_head/evaluation/FEGIN/kernel/circuit_datasets.py:15: FutureWarning: You are using `torch.load` with `weights_only=False` (the current default value), which uses the default pickle module implicitly. It is possible to construct malicious pickle data which will execute arbitrary code during unpickling (See https://github.com/pytorch/pytorch/blob/main/SECURITY.md#untrusted-models for more details). In a future release, the default value for `weights_only` will be flipped to `True`. This limits the functions that could be executed during unpickling. Arbitrary objects will no longer be allowed to be loaded via this mode unless they are explicitly allowlisted by the user via `torch.serialization.add_safe_globals`. We recommend you start setting `weights_only=True` for any use case where you don't have full control of the loaded file. Please open an issue on GitHub for any issues related to this experimental feature.
  self.data, self.slices = torch.load(self.processed_paths[0])
