STDOUT:
Results will be saved in /home/philip/projects/ltspice_examples_code_repo/Circuit-Completion-Using-GNNs/component_classification_with_link_prediction_head/evaluation/FEGIN/results/model_FEGIN_dataset_ltspice_demos
Command line input: python main.py --data ltspice_demos --representation component_component --model FEGIN --layers 5 --hiddens 32 --batch_size 64 --lr 0.01 --emb_size 128 --epochs 100 --save_appendix component_component_L5_H32_BS64_LR0.01_E128 --no_val
 is saved.
-----
ltspice_demos - FEGIN
Using 5 layers, 32 hidden units, h = 2
Loading component_component representation dataset
ENTERED
Training FEGIN on component_component representation
Train: 1565, Test: 383
##################ITERATION #0 ****************************************
 epoch: 0, train_loss: 1.2540, test_loss: 1.3222, test_f1: 0.2927
 epoch: 1, train_loss: 1.1958, test_loss: 1.2459, test_f1: 0.2281
 epoch: 2, train_loss: 1.1560, test_loss: 1.2664, test_f1: 0.2606
 epoch: 3, train_loss: 1.1460, test_loss: 1.2582, test_f1: 0.4276
 epoch: 4, train_loss: 1.1167, test_loss: 1.2661, test_f1: 0.4089
 epoch: 5, train_loss: 1.0794, test_loss: 1.2057, test_f1: 0.4409
 epoch: 6, train_loss: 1.0279, test_loss: 1.2951, test_f1: 0.4922
 epoch: 7, train_loss: 1.0153, test_loss: 1.2816, test_f1: 0.4255
 epoch: 8, train_loss: 0.9629, test_loss: 1.0985, test_f1: 0.4893
 epoch: 9, train_loss: 0.9535, test_loss: 1.1605, test_f1: 0.5245
 epoch: 10, train_loss: 0.9195, test_loss: 1.0280, test_f1: 0.5526
 epoch: 11, train_loss: 0.9088, test_loss: 1.1068, test_f1: 0.5516
 epoch: 12, train_loss: 0.9007, test_loss: 1.0763, test_f1: 0.5509
 epoch: 13, train_loss: 0.9192, test_loss: 1.3073, test_f1: 0.4651
 epoch: 14, train_loss: 0.8683, test_loss: 1.2024, test_f1: 0.4003
 epoch: 15, train_loss: 0.8636, test_loss: 1.0923, test_f1: 0.5646
 epoch: 16, train_loss: 0.8333, test_loss: 1.0010, test_f1: 0.5361
 epoch: 17, train_loss: 0.8647, test_loss: 1.0754, test_f1: 0.5948
 epoch: 18, train_loss: 0.8402, test_loss: 1.2362, test_f1: 0.5616
 epoch: 19, train_loss: 0.8363, test_loss: 1.2571, test_f1: 0.5661
 epoch: 20, train_loss: 0.8302, test_loss: 1.0988, test_f1: 0.5110
 epoch: 21, train_loss: 0.8665, test_loss: 1.1106, test_f1: 0.5559
 epoch: 22, train_loss: 0.8395, test_loss: 1.0628, test_f1: 0.5633
 epoch: 23, train_loss: 0.8109, test_loss: 1.1094, test_f1: 0.6001
 epoch: 24, train_loss: 0.8325, test_loss: 1.1785, test_f1: 0.5850
 epoch: 25, train_loss: 0.8255, test_loss: 1.0507, test_f1: 0.5214
 epoch: 26, train_loss: 0.7904, test_loss: 1.2038, test_f1: 0.5418
 epoch: 27, train_loss: 0.8066, test_loss: 1.0763, test_f1: 0.6212
 epoch: 28, train_loss: 0.7923, test_loss: 1.0587, test_f1: 0.5802
 epoch: 29, train_loss: 0.7843, test_loss: 1.1007, test_f1: 0.5479
 epoch: 30, train_loss: 0.7681, test_loss: 1.4291, test_f1: 0.6217
 epoch: 31, train_loss: 0.7349, test_loss: 1.1837, test_f1: 0.5091
 epoch: 32, train_loss: 0.7323, test_loss: 1.0572, test_f1: 0.5797
 epoch: 33, train_loss: 0.7683, test_loss: 1.4157, test_f1: 0.6090
 epoch: 34, train_loss: 0.7607, test_loss: 1.0863, test_f1: 0.5982
 epoch: 35, train_loss: 0.7638, test_loss: 1.1801, test_f1: 0.5729
 epoch: 36, train_loss: 0.7532, test_loss: 1.0979, test_f1: 0.5986
 epoch: 37, train_loss: 0.7623, test_loss: 1.1701, test_f1: 0.6105
 epoch: 38, train_loss: 0.7589, test_loss: 1.2483, test_f1: 0.5614
 epoch: 39, train_loss: 0.7096, test_loss: 1.2731, test_f1: 0.5967
 epoch: 40, train_loss: 0.7750, test_loss: 1.1576, test_f1: 0.5965
 epoch: 41, train_loss: 0.7219, test_loss: 1.2637, test_f1: 0.5984
 epoch: 42, train_loss: 0.7085, test_loss: 1.3908, test_f1: 0.5956
 epoch: 43, train_loss: 0.7088, test_loss: 1.3114, test_f1: 0.6049
 epoch: 44, train_loss: 0.7200, test_loss: 1.2123, test_f1: 0.5513
 epoch: 45, train_loss: 0.7091, test_loss: 1.3767, test_f1: 0.5640
 epoch: 46, train_loss: 0.7503, test_loss: 1.1108, test_f1: 0.5614
 epoch: 47, train_loss: 0.7298, test_loss: 1.4490, test_f1: 0.6130
 epoch: 48, train_loss: 0.7381, test_loss: 1.1236, test_f1: 0.6111
 epoch: 49, train_loss: 0.7625, test_loss: 1.1522, test_f1: 0.6179
 epoch: 50, train_loss: 0.7344, test_loss: 1.1411, test_f1: 0.6249
 epoch: 51, train_loss: 0.6699, test_loss: 1.2522, test_f1: 0.6015
 epoch: 52, train_loss: 0.6399, test_loss: 1.3609, test_f1: 0.5722
 epoch: 53, train_loss: 0.6335, test_loss: 1.4668, test_f1: 0.5847
 epoch: 54, train_loss: 0.6301, test_loss: 1.3317, test_f1: 0.6147
 epoch: 55, train_loss: 0.6140, test_loss: 1.3360, test_f1: 0.5834
 epoch: 56, train_loss: 0.5929, test_loss: 1.4315, test_f1: 0.6099
 epoch: 57, train_loss: 0.6244, test_loss: 1.4307, test_f1: 0.5651
 epoch: 58, train_loss: 0.6048, test_loss: 1.6620, test_f1: 0.5822
 epoch: 59, train_loss: 0.5916, test_loss: 1.6350, test_f1: 0.5603
 epoch: 60, train_loss: 0.6058, test_loss: 1.6908, test_f1: 0.5645
 epoch: 61, train_loss: 0.5906, test_loss: 1.7406, test_f1: 0.5528
 epoch: 62, train_loss: 0.5718, test_loss: 1.6346, test_f1: 0.5888
 epoch: 63, train_loss: 0.5666, test_loss: 1.4620, test_f1: 0.5775
 epoch: 64, train_loss: 0.5793, test_loss: 1.7948, test_f1: 0.5845
 epoch: 65, train_loss: 0.5530, test_loss: 1.5028, test_f1: 0.5710
 epoch: 66, train_loss: 0.5621, test_loss: 1.5649, test_f1: 0.5881
 epoch: 67, train_loss: 0.5610, test_loss: 1.5910, test_f1: 0.6143
 epoch: 68, train_loss: 0.5682, test_loss: 1.4977, test_f1: 0.5875
 epoch: 69, train_loss: 0.5615, test_loss: 1.7588, test_f1: 0.6102
 epoch: 70, train_loss: 0.5335, test_loss: 1.6670, test_f1: 0.6013
 epoch: 71, train_loss: 0.5378, test_loss: 2.1127, test_f1: 0.5813
 epoch: 72, train_loss: 0.5662, test_loss: 1.7213, test_f1: 0.5683
 epoch: 73, train_loss: 0.5296, test_loss: 2.1045, test_f1: 0.5923
 epoch: 74, train_loss: 0.5103, test_loss: 1.7783, test_f1: 0.5605
 epoch: 75, train_loss: 0.5397, test_loss: 2.0705, test_f1: 0.5938
 epoch: 76, train_loss: 0.5085, test_loss: 2.0827, test_f1: 0.5908
 epoch: 77, train_loss: 0.5087, test_loss: 1.8719, test_f1: 0.6014
 epoch: 78, train_loss: 0.5036, test_loss: 1.8149, test_f1: 0.5991
 epoch: 79, train_loss: 0.5049, test_loss: 2.0813, test_f1: 0.5853
 epoch: 80, train_loss: 0.4840, test_loss: 1.9982, test_f1: 0.5900
 epoch: 81, train_loss: 0.4724, test_loss: 2.6264, test_f1: 0.6019
 epoch: 82, train_loss: 0.5058, test_loss: 2.0811, test_f1: 0.6097
 epoch: 83, train_loss: 0.4657, test_loss: 2.0348, test_f1: 0.6201
 epoch: 84, train_loss: 0.4906, test_loss: 2.0914, test_f1: 0.5761
 epoch: 85, train_loss: 0.4799, test_loss: 2.2651, test_f1: 0.5991
 epoch: 86, train_loss: 0.5120, test_loss: 2.4557, test_f1: 0.5977
 epoch: 87, train_loss: 0.4463, test_loss: 2.1639, test_f1: 0.5946
 epoch: 88, train_loss: 0.4946, test_loss: 1.9031, test_f1: 0.6105
 epoch: 89, train_loss: 0.4473, test_loss: 2.2235, test_f1: 0.6416
 epoch: 90, train_loss: 0.4533, test_loss: 2.2549, test_f1: 0.5533
 epoch: 91, train_loss: 0.4657, test_loss: 2.2613, test_f1: 0.5802
 epoch: 92, train_loss: 0.4487, test_loss: 2.5639, test_f1: 0.5928
 epoch: 93, train_loss: 0.4678, test_loss: 2.4240, test_f1: 0.6144
 epoch: 94, train_loss: 0.4486, test_loss: 2.6010, test_f1: 0.6054
 epoch: 95, train_loss: 0.4570, test_loss: 2.6763, test_f1: 0.6036
 epoch: 96, train_loss: 0.4424, test_loss: 2.7479, test_f1: 0.5794
 epoch: 97, train_loss: 0.4384, test_loss: 2.4454, test_f1: 0.6437
 epoch: 98, train_loss: 0.4093, test_loss: 2.5195, test_f1: 0.5958
 epoch: 99, train_loss: 0.4451, test_loss: 2.5313, test_f1: 0.5586
##################ITERATION #1 ****************************************
 epoch: 0, train_loss: 1.2395, test_loss: 1.6355, test_f1: 0.1750
 epoch: 1, train_loss: 1.1823, test_loss: 1.2547, test_f1: 0.2467
 epoch: 2, train_loss: 1.0918, test_loss: 1.2687, test_f1: 0.3511
 epoch: 3, train_loss: 1.0598, test_loss: 1.1482, test_f1: 0.5102
 epoch: 4, train_loss: 1.0209, test_loss: 1.1941, test_f1: 0.4104
 epoch: 5, train_loss: 0.9821, test_loss: 1.0734, test_f1: 0.5384
 epoch: 6, train_loss: 0.9710, test_loss: 1.0721, test_f1: 0.4855
 epoch: 7, train_loss: 0.9732, test_loss: 1.1244, test_f1: 0.5206
 epoch: 8, train_loss: 0.9505, test_loss: 1.1908, test_f1: 0.4897
 epoch: 9, train_loss: 0.9523, test_loss: 1.0210, test_f1: 0.4472
 epoch: 10, train_loss: 0.9671, test_loss: 1.1081, test_f1: 0.4416
 epoch: 11, train_loss: 0.9331, test_loss: 1.2889, test_f1: 0.4208
 epoch: 12, train_loss: 0.9404, test_loss: 1.3060, test_f1: 0.5328
 epoch: 13, train_loss: 0.8964, test_loss: 1.2388, test_f1: 0.4606
 epoch: 14, train_loss: 0.9129, test_loss: 1.0671, test_f1: 0.5599
 epoch: 15, train_loss: 0.8895, test_loss: 1.0136, test_f1: 0.5980
 epoch: 16, train_loss: 0.9118, test_loss: 1.1969, test_f1: 0.4362
 epoch: 17, train_loss: 0.9228, test_loss: 1.1208, test_f1: 0.4613
 epoch: 18, train_loss: 0.9176, test_loss: 0.9929, test_f1: 0.5261
 epoch: 19, train_loss: 0.8787, test_loss: 1.0446, test_f1: 0.4645
 epoch: 20, train_loss: 0.8781, test_loss: 1.1357, test_f1: 0.5558
 epoch: 21, train_loss: 0.8735, test_loss: 1.1829, test_f1: 0.5276
 epoch: 22, train_loss: 0.8721, test_loss: 1.0903, test_f1: 0.5608
 epoch: 23, train_loss: 0.8531, test_loss: 1.1001, test_f1: 0.5623
 epoch: 24, train_loss: 0.8569, test_loss: 1.2838, test_f1: 0.6186
 epoch: 25, train_loss: 0.8496, test_loss: 1.0146, test_f1: 0.5926
 epoch: 26, train_loss: 0.8446, test_loss: 1.1481, test_f1: 0.5521
 epoch: 27, train_loss: 0.8246, test_loss: 1.2101, test_f1: 0.5589
 epoch: 28, train_loss: 0.8352, test_loss: 1.0671, test_f1: 0.5981
 epoch: 29, train_loss: 0.8175, test_loss: 1.5281, test_f1: 0.6018
 epoch: 30, train_loss: 0.8283, test_loss: 1.0291, test_f1: 0.5650
 epoch: 31, train_loss: 0.8257, test_loss: 1.0213, test_f1: 0.5872
 epoch: 32, train_loss: 0.8259, test_loss: 1.0599, test_f1: 0.5661
 epoch: 33, train_loss: 0.7940, test_loss: 1.0508, test_f1: 0.5790
 epoch: 34, train_loss: 0.8013, test_loss: 1.0742, test_f1: 0.6135
 epoch: 35, train_loss: 0.8026, test_loss: 1.0430, test_f1: 0.6197
 epoch: 36, train_loss: 0.7738, test_loss: 1.0525, test_f1: 0.5882
 epoch: 37, train_loss: 0.7728, test_loss: 1.1531, test_f1: 0.6148
 epoch: 38, train_loss: 0.7794, test_loss: 1.2222, test_f1: 0.5982
 epoch: 39, train_loss: 0.7657, test_loss: 1.0414, test_f1: 0.6200
 epoch: 40, train_loss: 0.7696, test_loss: 1.1295, test_f1: 0.6062
 epoch: 41, train_loss: 0.7699, test_loss: 1.2032, test_f1: 0.5535
 epoch: 42, train_loss: 0.7761, test_loss: 1.0617, test_f1: 0.5974
 epoch: 43, train_loss: 0.7592, test_loss: 1.0102, test_f1: 0.6305
 epoch: 44, train_loss: 0.7533, test_loss: 1.0513, test_f1: 0.6052
 epoch: 45, train_loss: 0.7743, test_loss: 1.2369, test_f1: 0.5923
 epoch: 46, train_loss: 0.7814, test_loss: 1.0684, test_f1: 0.5780
 epoch: 47, train_loss: 0.7500, test_loss: 1.0089, test_f1: 0.6275
 epoch: 48, train_loss: 0.7344, test_loss: 1.0117, test_f1: 0.6081
 epoch: 49, train_loss: 0.7110, test_loss: 1.2402, test_f1: 0.5977
 epoch: 50, train_loss: 0.7193, test_loss: 1.0566, test_f1: 0.5932
 epoch: 51, train_loss: 0.6974, test_loss: 1.0550, test_f1: 0.5731
 epoch: 52, train_loss: 0.6782, test_loss: 1.0347, test_f1: 0.6172
 epoch: 53, train_loss: 0.6594, test_loss: 1.1251, test_f1: 0.6559
 epoch: 54, train_loss: 0.6792, test_loss: 1.1498, test_f1: 0.6212
 epoch: 55, train_loss: 0.6663, test_loss: 1.2437, test_f1: 0.5869
 epoch: 56, train_loss: 0.6690, test_loss: 1.2763, test_f1: 0.6006
 epoch: 57, train_loss: 0.6704, test_loss: 1.2994, test_f1: 0.6031
 epoch: 58, train_loss: 0.6485, test_loss: 1.2299, test_f1: 0.5804
 epoch: 59, train_loss: 0.6317, test_loss: 1.2771, test_f1: 0.5983
 epoch: 60, train_loss: 0.6356, test_loss: 1.2338, test_f1: 0.5983
 epoch: 61, train_loss: 0.6583, test_loss: 1.2882, test_f1: 0.5930
 epoch: 62, train_loss: 0.6334, test_loss: 1.1964, test_f1: 0.6219
 epoch: 63, train_loss: 0.6324, test_loss: 1.4840, test_f1: 0.5944
 epoch: 64, train_loss: 0.6351, test_loss: 1.3733, test_f1: 0.5788
 epoch: 65, train_loss: 0.6289, test_loss: 1.3178, test_f1: 0.5804
 epoch: 66, train_loss: 0.6113, test_loss: 1.8065, test_f1: 0.6096
 epoch: 67, train_loss: 0.6237, test_loss: 1.3890, test_f1: 0.5976
 epoch: 68, train_loss: 0.5881, test_loss: 1.6153, test_f1: 0.5848
 epoch: 69, train_loss: 0.6399, test_loss: 1.3792, test_f1: 0.5683
 epoch: 70, train_loss: 0.5945, test_loss: 1.3365, test_f1: 0.5449
 epoch: 71, train_loss: 0.6168, test_loss: 1.4383, test_f1: 0.6277
 epoch: 72, train_loss: 0.6084, test_loss: 1.3431, test_f1: 0.6085
 epoch: 73, train_loss: 0.5881, test_loss: 1.3903, test_f1: 0.6048
 epoch: 74, train_loss: 0.5912, test_loss: 1.5839, test_f1: 0.6108
 epoch: 75, train_loss: 0.5972, test_loss: 1.5376, test_f1: 0.5705
 epoch: 76, train_loss: 0.5826, test_loss: 1.3484, test_f1: 0.5990
 epoch: 77, train_loss: 0.6038, test_loss: 1.3073, test_f1: 0.5946
 epoch: 78, train_loss: 0.5989, test_loss: 1.3471, test_f1: 0.5915
 epoch: 79, train_loss: 0.5907, test_loss: 1.2474, test_f1: 0.6216
 epoch: 80, train_loss: 0.5696, test_loss: 1.3921, test_f1: 0.5780
 epoch: 81, train_loss: 0.5774, test_loss: 1.5690, test_f1: 0.5634
 epoch: 82, train_loss: 0.6035, test_loss: 1.3625, test_f1: 0.5590
 epoch: 83, train_loss: 0.5809, test_loss: 1.5423, test_f1: 0.6022
 epoch: 84, train_loss: 0.5503, test_loss: 1.4223, test_f1: 0.6324
 epoch: 85, train_loss: 0.6156, test_loss: 1.2985, test_f1: 0.5856
 epoch: 86, train_loss: 0.5989, test_loss: 1.1872, test_f1: 0.5900
 epoch: 87, train_loss: 0.5809, test_loss: 1.2991, test_f1: 0.6052
 epoch: 88, train_loss: 0.5589, test_loss: 1.3825, test_f1: 0.6049
 epoch: 89, train_loss: 0.5514, test_loss: 1.2659, test_f1: 0.6234
 epoch: 90, train_loss: 0.5777, test_loss: 1.3403, test_f1: 0.5996
 epoch: 91, train_loss: 0.6153, test_loss: 1.3103, test_f1: 0.5731
 epoch: 92, train_loss: 0.5683, test_loss: 1.2605, test_f1: 0.6203
 epoch: 93, train_loss: 0.5525, test_loss: 1.4443, test_f1: 0.5875
 epoch: 94, train_loss: 0.5416, test_loss: 1.3323, test_f1: 0.6223
 epoch: 95, train_loss: 0.5300, test_loss: 1.4926, test_f1: 0.5726
 epoch: 96, train_loss: 0.5139, test_loss: 1.6112, test_f1: 0.5843
 epoch: 97, train_loss: 0.5433, test_loss: 1.4241, test_f1: 0.5788
 epoch: 98, train_loss: 0.5199, test_loss: 1.3897, test_f1: 0.6104
 epoch: 99, train_loss: 0.5431, test_loss: 1.5362, test_f1: 0.5847
##################ITERATION #2 ****************************************
 epoch: 0, train_loss: 1.3351, test_loss: 1.3226, test_f1: 0.2932
 epoch: 1, train_loss: 1.2104, test_loss: 1.2526, test_f1: 0.2582
 epoch: 2, train_loss: 1.1718, test_loss: 1.2299, test_f1: 0.3116
 epoch: 3, train_loss: 1.1390, test_loss: 1.3097, test_f1: 0.2721
 epoch: 4, train_loss: 1.0986, test_loss: 1.3152, test_f1: 0.3653
 epoch: 5, train_loss: 1.0479, test_loss: 1.3820, test_f1: 0.3547
 epoch: 6, train_loss: 0.9922, test_loss: 1.1362, test_f1: 0.4293
 epoch: 7, train_loss: 0.9695, test_loss: 1.1394, test_f1: 0.5313
 epoch: 8, train_loss: 0.9213, test_loss: 1.1387, test_f1: 0.4379
 epoch: 9, train_loss: 0.9961, test_loss: 1.0693, test_f1: 0.4293
 epoch: 10, train_loss: 0.9364, test_loss: 1.0787, test_f1: 0.5020
 epoch: 11, train_loss: 0.9185, test_loss: 1.1708, test_f1: 0.3591
 epoch: 12, train_loss: 0.8701, test_loss: 1.0873, test_f1: 0.4965
 epoch: 13, train_loss: 0.8715, test_loss: 1.2752, test_f1: 0.4064
 epoch: 14, train_loss: 0.8666, test_loss: 1.0344, test_f1: 0.5088
 epoch: 15, train_loss: 0.8678, test_loss: 1.1204, test_f1: 0.5474
 epoch: 16, train_loss: 0.8603, test_loss: 1.0392, test_f1: 0.5697
 epoch: 17, train_loss: 0.8330, test_loss: 1.2283, test_f1: 0.5424
 epoch: 18, train_loss: 0.8432, test_loss: 1.2728, test_f1: 0.4957
 epoch: 19, train_loss: 0.8071, test_loss: 1.2811, test_f1: 0.5438
 epoch: 20, train_loss: 0.8323, test_loss: 1.1474, test_f1: 0.5411
 epoch: 21, train_loss: 0.8372, test_loss: 1.2446, test_f1: 0.5829
 epoch: 22, train_loss: 0.8267, test_loss: 1.2533, test_f1: 0.5258
 epoch: 23, train_loss: 0.8147, test_loss: 1.0748, test_f1: 0.5055
 epoch: 24, train_loss: 0.8291, test_loss: 1.0840, test_f1: 0.5656
 epoch: 25, train_loss: 0.8088, test_loss: 1.5778, test_f1: 0.4188
 epoch: 26, train_loss: 0.8059, test_loss: 1.1576, test_f1: 0.5679
 epoch: 27, train_loss: 0.7868, test_loss: 1.2507, test_f1: 0.4883
 epoch: 28, train_loss: 0.8187, test_loss: 1.0747, test_f1: 0.5906
 epoch: 29, train_loss: 0.8021, test_loss: 1.2092, test_f1: 0.5521
 epoch: 30, train_loss: 0.7754, test_loss: 1.2235, test_f1: 0.5419
 epoch: 31, train_loss: 0.7745, test_loss: 2.5242, test_f1: 0.3105
 epoch: 32, train_loss: 0.7845, test_loss: 1.1583, test_f1: 0.6083
 epoch: 33, train_loss: 0.8224, test_loss: 0.9908, test_f1: 0.5824
 epoch: 34, train_loss: 0.7932, test_loss: 0.9522, test_f1: 0.5581
 epoch: 35, train_loss: 0.7538, test_loss: 1.0583, test_f1: 0.5831
 epoch: 36, train_loss: 0.7375, test_loss: 1.0213, test_f1: 0.5830
 epoch: 37, train_loss: 0.7649, test_loss: 1.0779, test_f1: 0.5084
 epoch: 38, train_loss: 0.7572, test_loss: 0.9674, test_f1: 0.5785
 epoch: 39, train_loss: 0.7615, test_loss: 1.0440, test_f1: 0.5084
 epoch: 40, train_loss: 0.7433, test_loss: 1.2823, test_f1: 0.5246
 epoch: 41, train_loss: 0.7873, test_loss: 1.0043, test_f1: 0.5760
 epoch: 42, train_loss: 0.7809, test_loss: 0.9846, test_f1: 0.5186
 epoch: 43, train_loss: 0.7625, test_loss: 1.3057, test_f1: 0.4978
 epoch: 44, train_loss: 0.7517, test_loss: 1.1518, test_f1: 0.5327
 epoch: 45, train_loss: 0.7471, test_loss: 1.0280, test_f1: 0.5304
 epoch: 46, train_loss: 0.7183, test_loss: 1.0644, test_f1: 0.5842
 epoch: 47, train_loss: 0.7075, test_loss: 1.1822, test_f1: 0.5251
 epoch: 48, train_loss: 0.7286, test_loss: 1.0784, test_f1: 0.5970
 epoch: 49, train_loss: 0.7196, test_loss: 1.1038, test_f1: 0.5262
 epoch: 50, train_loss: 0.7023, test_loss: 1.1404, test_f1: 0.5759
 epoch: 51, train_loss: 0.7073, test_loss: 1.0685, test_f1: 0.5195
 epoch: 52, train_loss: 0.6738, test_loss: 1.0705, test_f1: 0.6070
 epoch: 53, train_loss: 0.6720, test_loss: 1.1248, test_f1: 0.6199
 epoch: 54, train_loss: 0.6821, test_loss: 1.0818, test_f1: 0.5673
 epoch: 55, train_loss: 0.6769, test_loss: 1.1091, test_f1: 0.6088
 epoch: 56, train_loss: 0.6433, test_loss: 1.1127, test_f1: 0.6259
 epoch: 57, train_loss: 0.6324, test_loss: 1.1455, test_f1: 0.5717
 epoch: 58, train_loss: 0.6593, test_loss: 1.0463, test_f1: 0.5916
 epoch: 59, train_loss: 0.6373, test_loss: 1.1767, test_f1: 0.6024
 epoch: 60, train_loss: 0.6612, test_loss: 1.1706, test_f1: 0.5817
 epoch: 61, train_loss: 0.6558, test_loss: 1.1118, test_f1: 0.5958
 epoch: 62, train_loss: 0.6293, test_loss: 1.0946, test_f1: 0.5812
 epoch: 63, train_loss: 0.6250, test_loss: 1.1374, test_f1: 0.5727
 epoch: 64, train_loss: 0.6273, test_loss: 0.9895, test_f1: 0.5988
 epoch: 65, train_loss: 0.6202, test_loss: 1.1926, test_f1: 0.6153
 epoch: 66, train_loss: 0.6037, test_loss: 1.1007, test_f1: 0.6270
 epoch: 67, train_loss: 0.6316, test_loss: 1.0563, test_f1: 0.6292
 epoch: 68, train_loss: 0.6046, test_loss: 1.3226, test_f1: 0.5727
 epoch: 69, train_loss: 0.6020, test_loss: 1.0830, test_f1: 0.6313
 epoch: 70, train_loss: 0.6084, test_loss: 1.0878, test_f1: 0.5876
 epoch: 71, train_loss: 0.6089, test_loss: 1.1842, test_f1: 0.5916
 epoch: 72, train_loss: 0.5675, test_loss: 1.1848, test_f1: 0.6043
 epoch: 73, train_loss: 0.6096, test_loss: 1.1226, test_f1: 0.6306
 epoch: 74, train_loss: 0.6061, test_loss: 1.0929, test_f1: 0.6362
 epoch: 75, train_loss: 0.6007, test_loss: 1.0716, test_f1: 0.6255
 epoch: 76, train_loss: 0.5760, test_loss: 1.1445, test_f1: 0.5890
 epoch: 77, train_loss: 0.5883, test_loss: 1.2306, test_f1: 0.6437
 epoch: 78, train_loss: 0.6010, test_loss: 1.1270, test_f1: 0.6432
 epoch: 79, train_loss: 0.6002, test_loss: 1.1458, test_f1: 0.6537
 epoch: 80, train_loss: 0.5810, test_loss: 1.1250, test_f1: 0.6047
 epoch: 81, train_loss: 0.5662, test_loss: 1.1318, test_f1: 0.6322
 epoch: 82, train_loss: 0.5821, test_loss: 1.1436, test_f1: 0.6078
 epoch: 83, train_loss: 0.5518, test_loss: 1.1894, test_f1: 0.6192
 epoch: 84, train_loss: 0.5629, test_loss: 1.2478, test_f1: 0.6204
 epoch: 85, train_loss: 0.5547, test_loss: 1.0893, test_f1: 0.6100
 epoch: 86, train_loss: 0.5422, test_loss: 1.2717, test_f1: 0.6131
 epoch: 87, train_loss: 0.5324, test_loss: 1.2051, test_f1: 0.5943
 epoch: 88, train_loss: 0.5388, test_loss: 1.2730, test_f1: 0.6352
 epoch: 89, train_loss: 0.5481, test_loss: 1.2689, test_f1: 0.5689
 epoch: 90, train_loss: 0.5925, test_loss: 1.1639, test_f1: 0.5980
 epoch: 91, train_loss: 0.5616, test_loss: 1.2281, test_f1: 0.6183
 epoch: 92, train_loss: 0.5698, test_loss: 1.1952, test_f1: 0.6444
 epoch: 93, train_loss: 0.5153, test_loss: 1.1344, test_f1: 0.6367
 epoch: 94, train_loss: 0.5257, test_loss: 1.2215, test_f1: 0.6102
 epoch: 95, train_loss: 0.5378, test_loss: 1.2476, test_f1: 0.6431
 epoch: 96, train_loss: 0.5237, test_loss: 1.3286, test_f1: 0.6107
 epoch: 97, train_loss: 0.5201, test_loss: 1.2559, test_f1: 0.5807
 epoch: 98, train_loss: 0.5079, test_loss: 1.2568, test_f1: 0.6027
 epoch: 99, train_loss: 0.5355, test_loss: 1.1155, test_f1: 0.6775
##################ITERATION #3 ****************************************
 epoch: 0, train_loss: 1.2961, test_loss: 1.2826, test_f1: 0.3609
 epoch: 1, train_loss: 1.1935, test_loss: 1.2284, test_f1: 0.4222
 epoch: 2, train_loss: 1.1476, test_loss: 1.2534, test_f1: 0.3696
 epoch: 3, train_loss: 1.1250, test_loss: 1.2717, test_f1: 0.2621
 epoch: 4, train_loss: 1.0884, test_loss: 1.2849, test_f1: 0.3000
 epoch: 5, train_loss: 1.1075, test_loss: 1.1505, test_f1: 0.4771
 epoch: 6, train_loss: 1.0499, test_loss: 1.1989, test_f1: 0.4412
 epoch: 7, train_loss: 1.0448, test_loss: 1.1982, test_f1: 0.3706
 epoch: 8, train_loss: 1.0045, test_loss: 1.1772, test_f1: 0.4731
 epoch: 9, train_loss: 0.9920, test_loss: 1.2106, test_f1: 0.4162
 epoch: 10, train_loss: 0.9880, test_loss: 1.1874, test_f1: 0.4827
 epoch: 11, train_loss: 0.9618, test_loss: 1.0746, test_f1: 0.5420
 epoch: 12, train_loss: 0.9368, test_loss: 1.1390, test_f1: 0.5165
 epoch: 13, train_loss: 0.9133, test_loss: 1.1774, test_f1: 0.4099
 epoch: 14, train_loss: 0.9455, test_loss: 1.2049, test_f1: 0.4712
 epoch: 15, train_loss: 0.9394, test_loss: 1.1095, test_f1: 0.5128
 epoch: 16, train_loss: 0.9150, test_loss: 1.1636, test_f1: 0.4775
 epoch: 17, train_loss: 0.8824, test_loss: 1.0575, test_f1: 0.5495
 epoch: 18, train_loss: 0.8702, test_loss: 1.2905, test_f1: 0.4720
 epoch: 19, train_loss: 0.8540, test_loss: 1.1272, test_f1: 0.5192
 epoch: 20, train_loss: 0.8586, test_loss: 1.1417, test_f1: 0.4584
 epoch: 21, train_loss: 0.8795, test_loss: 1.1403, test_f1: 0.5605
 epoch: 22, train_loss: 0.8920, test_loss: 1.0679, test_f1: 0.4957
 epoch: 23, train_loss: 0.8444, test_loss: 2.1603, test_f1: 0.4621
 epoch: 24, train_loss: 0.8819, test_loss: 1.3095, test_f1: 0.4718
 epoch: 25, train_loss: 0.8661, test_loss: 1.0884, test_f1: 0.5134
 epoch: 26, train_loss: 0.8472, test_loss: 1.1324, test_f1: 0.5762
 epoch: 27, train_loss: 0.8199, test_loss: 1.0590, test_f1: 0.5627
 epoch: 28, train_loss: 0.8268, test_loss: 1.0846, test_f1: 0.4564
 epoch: 29, train_loss: 0.8250, test_loss: 1.0758, test_f1: 0.5901
 epoch: 30, train_loss: 0.8077, test_loss: 1.0594, test_f1: 0.4933
 epoch: 31, train_loss: 0.8153, test_loss: 1.4096, test_f1: 0.5706
 epoch: 32, train_loss: 0.8073, test_loss: 1.0426, test_f1: 0.5498
 epoch: 33, train_loss: 0.7806, test_loss: 1.0877, test_f1: 0.5631
 epoch: 34, train_loss: 0.7868, test_loss: 1.1526, test_f1: 0.5263
 epoch: 35, train_loss: 0.7731, test_loss: 1.1598, test_f1: 0.5564
 epoch: 36, train_loss: 0.7873, test_loss: 1.0331, test_f1: 0.5836
 epoch: 37, train_loss: 0.7772, test_loss: 1.2514, test_f1: 0.5251
 epoch: 38, train_loss: 0.7706, test_loss: 1.0344, test_f1: 0.5577
 epoch: 39, train_loss: 0.7697, test_loss: 1.1846, test_f1: 0.5536
 epoch: 40, train_loss: 0.7578, test_loss: 1.5699, test_f1: 0.5379
 epoch: 41, train_loss: 0.8089, test_loss: 1.8997, test_f1: 0.5367
 epoch: 42, train_loss: 0.8053, test_loss: 1.1248, test_f1: 0.5438
 epoch: 43, train_loss: 0.7566, test_loss: 1.2097, test_f1: 0.5723
 epoch: 44, train_loss: 0.7323, test_loss: 1.2022, test_f1: 0.5792
 epoch: 45, train_loss: 0.7159, test_loss: 1.3437, test_f1: 0.5198
 epoch: 46, train_loss: 0.7546, test_loss: 1.2454, test_f1: 0.5071
 epoch: 47, train_loss: 0.7532, test_loss: 1.1476, test_f1: 0.5629
 epoch: 48, train_loss: 0.7306, test_loss: 1.1175, test_f1: 0.5703
 epoch: 49, train_loss: 0.7170, test_loss: 1.1066, test_f1: 0.6141
 epoch: 50, train_loss: 0.6856, test_loss: 1.1947, test_f1: 0.5635
 epoch: 51, train_loss: 0.6726, test_loss: 1.2046, test_f1: 0.5629
 epoch: 52, train_loss: 0.6563, test_loss: 1.1308, test_f1: 0.5642
 epoch: 53, train_loss: 0.6434, test_loss: 1.2507, test_f1: 0.5551
 epoch: 54, train_loss: 0.6301, test_loss: 1.2160, test_f1: 0.5504
 epoch: 55, train_loss: 0.6311, test_loss: 1.1820, test_f1: 0.5541
 epoch: 56, train_loss: 0.6226, test_loss: 1.6177, test_f1: 0.5329
 epoch: 57, train_loss: 0.6396, test_loss: 1.2424, test_f1: 0.5937
 epoch: 58, train_loss: 0.6183, test_loss: 1.3721, test_f1: 0.5541
 epoch: 59, train_loss: 0.6168, test_loss: 1.2581, test_f1: 0.6013
 epoch: 60, train_loss: 0.5938, test_loss: 1.2110, test_f1: 0.5884
 epoch: 61, train_loss: 0.6242, test_loss: 1.3125, test_f1: 0.5435
 epoch: 62, train_loss: 0.8260, test_loss: 1.1767, test_f1: 0.5336
 epoch: 63, train_loss: 0.7459, test_loss: 1.1256, test_f1: 0.5911
 epoch: 64, train_loss: 0.7069, test_loss: 1.2318, test_f1: 0.5480
 epoch: 65, train_loss: 0.6507, test_loss: 1.3314, test_f1: 0.5172
 epoch: 66, train_loss: 0.6587, test_loss: 1.4644, test_f1: 0.5620
 epoch: 67, train_loss: 0.6550, test_loss: 1.1855, test_f1: 0.5499
 epoch: 68, train_loss: 0.6256, test_loss: 1.1906, test_f1: 0.5860
 epoch: 69, train_loss: 0.6146, test_loss: 1.2446, test_f1: 0.5512
 epoch: 70, train_loss: 0.5918, test_loss: 1.2721, test_f1: 0.5365
 epoch: 71, train_loss: 0.6047, test_loss: 1.4246, test_f1: 0.5644
 epoch: 72, train_loss: 0.6137, test_loss: 1.3680, test_f1: 0.5721
 epoch: 73, train_loss: 0.5843, test_loss: 1.4530, test_f1: 0.5129
 epoch: 74, train_loss: 0.5854, test_loss: 1.2538, test_f1: 0.6071
 epoch: 75, train_loss: 0.5994, test_loss: 1.2211, test_f1: 0.5609
 epoch: 76, train_loss: 0.5787, test_loss: 1.3838, test_f1: 0.5550
 epoch: 77, train_loss: 0.5745, test_loss: 1.3295, test_f1: 0.5595
 epoch: 78, train_loss: 0.5958, test_loss: 1.3731, test_f1: 0.5646
 epoch: 79, train_loss: 0.5857, test_loss: 1.2437, test_f1: 0.6004
 epoch: 80, train_loss: 0.5504, test_loss: 1.3216, test_f1: 0.6141
 epoch: 81, train_loss: 0.5383, test_loss: 1.4261, test_f1: 0.5467
 epoch: 82, train_loss: 0.5681, test_loss: 1.4610, test_f1: 0.5610
 epoch: 83, train_loss: 0.5446, test_loss: 1.5909, test_f1: 0.5344
 epoch: 84, train_loss: 0.5446, test_loss: 1.2706, test_f1: 0.5664
 epoch: 85, train_loss: 0.5439, test_loss: 1.4282, test_f1: 0.5413
 epoch: 86, train_loss: 0.5412, test_loss: 1.3713, test_f1: 0.5440
 epoch: 87, train_loss: 0.5457, test_loss: 1.6435, test_f1: 0.5441
 epoch: 88, train_loss: 0.5453, test_loss: 1.3669, test_f1: 0.5733
 epoch: 89, train_loss: 0.5194, test_loss: 1.3458, test_f1: 0.5817
 epoch: 90, train_loss: 0.5138, test_loss: 1.5093, test_f1: 0.5692
 epoch: 91, train_loss: 0.5280, test_loss: 1.4805, test_f1: 0.5365
 epoch: 92, train_loss: 0.4957, test_loss: 1.4781, test_f1: 0.5616
 epoch: 93, train_loss: 0.5115, test_loss: 1.2773, test_f1: 0.5908
 epoch: 94, train_loss: 0.5217, test_loss: 1.4946, test_f1: 0.5213
 epoch: 95, train_loss: 0.5226, test_loss: 1.5479, test_f1: 0.5322
 epoch: 96, train_loss: 0.5149, test_loss: 1.6204, test_f1: 0.5322
 epoch: 97, train_loss: 0.5317, test_loss: 1.6245, test_f1: 0.5585
 epoch: 98, train_loss: 0.4805, test_loss: 1.4955, test_f1: 0.5635
 epoch: 99, train_loss: 0.5019, test_loss: 1.3245, test_f1: 0.5879
##################ITERATION #4 ****************************************
 epoch: 0, train_loss: 1.3270, test_loss: 1.3350, test_f1: 0.2456
 epoch: 1, train_loss: 1.2098, test_loss: 1.2635, test_f1: 0.3894
 epoch: 2, train_loss: 1.1415, test_loss: 1.2529, test_f1: 0.4213
 epoch: 3, train_loss: 1.1071, test_loss: 1.3073, test_f1: 0.3004
 epoch: 4, train_loss: 1.0747, test_loss: 1.1643, test_f1: 0.4214
 epoch: 5, train_loss: 1.0348, test_loss: 1.1267, test_f1: 0.3966
 epoch: 6, train_loss: 1.0171, test_loss: 1.0747, test_f1: 0.4273
 epoch: 7, train_loss: 0.9826, test_loss: 1.2513, test_f1: 0.3886
 epoch: 8, train_loss: 0.9847, test_loss: 1.0394, test_f1: 0.5426
 epoch: 9, train_loss: 0.9348, test_loss: 1.0997, test_f1: 0.5083
 epoch: 10, train_loss: 0.9221, test_loss: 0.9961, test_f1: 0.5540
 epoch: 11, train_loss: 0.9258, test_loss: 1.1277, test_f1: 0.5433
 epoch: 12, train_loss: 0.9125, test_loss: 1.1661, test_f1: 0.5386
 epoch: 13, train_loss: 0.8628, test_loss: 1.0289, test_f1: 0.5937
 epoch: 14, train_loss: 0.8841, test_loss: 1.0333, test_f1: 0.5582
 epoch: 15, train_loss: 0.8473, test_loss: 1.0408, test_f1: 0.5759
 epoch: 16, train_loss: 0.8537, test_loss: 1.3413, test_f1: 0.5067
 epoch: 17, train_loss: 0.8640, test_loss: 1.1092, test_f1: 0.4966
 epoch: 18, train_loss: 0.8484, test_loss: 1.0970, test_f1: 0.5486
 epoch: 19, train_loss: 0.8393, test_loss: 1.0115, test_f1: 0.5269
 epoch: 20, train_loss: 0.8283, test_loss: 1.0341, test_f1: 0.5276
 epoch: 21, train_loss: 0.8066, test_loss: 1.3898, test_f1: 0.5197
 epoch: 22, train_loss: 0.7893, test_loss: 1.1424, test_f1: 0.5806
 epoch: 23, train_loss: 0.8210, test_loss: 1.1920, test_f1: 0.6012
 epoch: 24, train_loss: 0.7948, test_loss: 1.1493, test_f1: 0.5624
 epoch: 25, train_loss: 0.7831, test_loss: 1.1116, test_f1: 0.6122
 epoch: 26, train_loss: 0.8068, test_loss: 1.1895, test_f1: 0.5110
 epoch: 27, train_loss: 0.7926, test_loss: 1.1720, test_f1: 0.6019
 epoch: 28, train_loss: 0.8130, test_loss: 1.0911, test_f1: 0.5386
 epoch: 29, train_loss: 0.7780, test_loss: 1.1829, test_f1: 0.5944
 epoch: 30, train_loss: 0.7743, test_loss: 1.2000, test_f1: 0.5756
 epoch: 31, train_loss: 0.7634, test_loss: 1.0650, test_f1: 0.6021
 epoch: 32, train_loss: 0.7671, test_loss: 1.4226, test_f1: 0.5904
 epoch: 33, train_loss: 0.8147, test_loss: 1.2804, test_f1: 0.4998
 epoch: 34, train_loss: 0.8149, test_loss: 1.1855, test_f1: 0.5447
 epoch: 35, train_loss: 0.7700, test_loss: 1.1349, test_f1: 0.5407
 epoch: 36, train_loss: 0.7842, test_loss: 1.2460, test_f1: 0.5824
 epoch: 37, train_loss: 0.7680, test_loss: 1.3887, test_f1: 0.5285
 epoch: 38, train_loss: 0.7405, test_loss: 1.5344, test_f1: 0.5871
 epoch: 39, train_loss: 0.7469, test_loss: 1.1349, test_f1: 0.5515
 epoch: 40, train_loss: 0.7457, test_loss: 1.3247, test_f1: 0.6010
 epoch: 41, train_loss: 0.7580, test_loss: 1.0948, test_f1: 0.5880
 epoch: 42, train_loss: 0.7290, test_loss: 1.1691, test_f1: 0.5341
 epoch: 43, train_loss: 0.7646, test_loss: 1.2498, test_f1: 0.5721
 epoch: 44, train_loss: 0.7529, test_loss: 1.2030, test_f1: 0.6000
 epoch: 45, train_loss: 0.7215, test_loss: 1.4158, test_f1: 0.6148
 epoch: 46, train_loss: 0.6825, test_loss: 1.2616, test_f1: 0.5843
 epoch: 47, train_loss: 0.6802, test_loss: 1.3914, test_f1: 0.5551
 epoch: 48, train_loss: 0.7228, test_loss: 11.8406, test_f1: 0.4773
 epoch: 49, train_loss: 0.7247, test_loss: 1.1788, test_f1: 0.5887
 epoch: 50, train_loss: 0.6950, test_loss: 1.6141, test_f1: 0.5043
 epoch: 51, train_loss: 0.6657, test_loss: 1.1876, test_f1: 0.6172
 epoch: 52, train_loss: 0.6219, test_loss: 1.3301, test_f1: 0.5986
 epoch: 53, train_loss: 0.6441, test_loss: 1.3938, test_f1: 0.5728
 epoch: 54, train_loss: 0.6179, test_loss: 1.2555, test_f1: 0.5787
 epoch: 55, train_loss: 0.6069, test_loss: 1.5007, test_f1: 0.5262
 epoch: 56, train_loss: 0.6066, test_loss: 1.4376, test_f1: 0.5739
 epoch: 57, train_loss: 0.5859, test_loss: 1.5578, test_f1: 0.5721
 epoch: 58, train_loss: 0.5978, test_loss: 1.4416, test_f1: 0.5658
 epoch: 59, train_loss: 0.6020, test_loss: 1.2919, test_f1: 0.5937
 epoch: 60, train_loss: 0.6127, test_loss: 1.3490, test_f1: 0.5985
 epoch: 61, train_loss: 0.5990, test_loss: 1.4099, test_f1: 0.6032
 epoch: 62, train_loss: 0.6202, test_loss: 1.4474, test_f1: 0.5781
 epoch: 63, train_loss: 0.5909, test_loss: 1.5531, test_f1: 0.5511
 epoch: 64, train_loss: 0.5969, test_loss: 1.4224, test_f1: 0.5680
 epoch: 65, train_loss: 0.6485, test_loss: 1.4220, test_f1: 0.5975
 epoch: 66, train_loss: 0.5979, test_loss: 1.5369, test_f1: 0.5241
 epoch: 67, train_loss: 0.5496, test_loss: 1.4293, test_f1: 0.5743
 epoch: 68, train_loss: 0.5603, test_loss: 1.4806, test_f1: 0.5707
 epoch: 69, train_loss: 0.5738, test_loss: 1.6353, test_f1: 0.5476
 epoch: 70, train_loss: 0.5673, test_loss: 1.6767, test_f1: 0.5354
 epoch: 71, train_loss: 0.5774, test_loss: 1.4183, test_f1: 0.5911
 epoch: 72, train_loss: 0.5374, test_loss: 1.5871, test_f1: 0.5549
 epoch: 73, train_loss: 0.5542, test_loss: 1.7027, test_f1: 0.5459
 epoch: 74, train_loss: 0.5716, test_loss: 1.7150, test_f1: 0.5445
 epoch: 75, train_loss: 0.5520, test_loss: 1.6639, test_f1: 0.5878
 epoch: 76, train_loss: 0.5289, test_loss: 1.4469, test_f1: 0.5299
 epoch: 77, train_loss: 0.5542, test_loss: 1.4608, test_f1: 0.5738
 epoch: 78, train_loss: 0.5287, test_loss: 1.4878, test_f1: 0.5538
 epoch: 79, train_loss: 0.5346, test_loss: 1.6049, test_f1: 0.5441
 epoch: 80, train_loss: 0.5241, test_loss: 1.6456, test_f1: 0.5388
 epoch: 81, train_loss: 0.5403, test_loss: 1.6156, test_f1: 0.5304
 epoch: 82, train_loss: 0.5203, test_loss: 1.5361, test_f1: 0.5714
 epoch: 83, train_loss: 0.5092, test_loss: 1.8991, test_f1: 0.5491
 epoch: 84, train_loss: 0.5275, test_loss: 1.7323, test_f1: 0.5225
 epoch: 85, train_loss: 0.5537, test_loss: 1.9216, test_f1: 0.5419
 epoch: 86, train_loss: 0.5111, test_loss: 1.4871, test_f1: 0.5614
 epoch: 87, train_loss: 0.4888, test_loss: 1.6413, test_f1: 0.5458
 epoch: 88, train_loss: 0.5025, test_loss: 1.5980, test_f1: 0.5892
 epoch: 89, train_loss: 0.4954, test_loss: 1.5382, test_f1: 0.5325
 epoch: 90, train_loss: 0.4909, test_loss: 1.7626, test_f1: 0.5767
 epoch: 91, train_loss: 0.5065, test_loss: 1.5372, test_f1: 0.5793
 epoch: 92, train_loss: 0.4758, test_loss: 1.7375, test_f1: 0.5226
 epoch: 93, train_loss: 0.4939, test_loss: 1.5810, test_f1: 0.5876
 epoch: 94, train_loss: 0.5067, test_loss: 1.4917, test_f1: 0.6089
 epoch: 95, train_loss: 0.5203, test_loss: 1.5713, test_f1: 0.5372
 epoch: 96, train_loss: 0.4502, test_loss: 1.6626, test_f1: 0.5766
 epoch: 97, train_loss: 0.4704, test_loss: 1.7037, test_f1: 0.5495
 epoch: 98, train_loss: 0.5163, test_loss: 1.7095, test_f1: 0.5439
 epoch: 99, train_loss: 0.5229, test_loss: 1.5883, test_f1: 0.5498
##################ITERATION #5 ****************************************
 epoch: 0, train_loss: 1.3365, test_loss: 1.4101, test_f1: 0.2867
 epoch: 1, train_loss: 1.1627, test_loss: 1.2497, test_f1: 0.3834
 epoch: 2, train_loss: 1.1200, test_loss: 1.2092, test_f1: 0.4610
 epoch: 3, train_loss: 1.0991, test_loss: 1.2067, test_f1: 0.3599
 epoch: 4, train_loss: 1.0757, test_loss: 1.1438, test_f1: 0.4729
 epoch: 5, train_loss: 1.0401, test_loss: 1.1571, test_f1: 0.4114
 epoch: 6, train_loss: 1.0017, test_loss: 1.1728, test_f1: 0.4214
 epoch: 7, train_loss: 0.9847, test_loss: 2.0662, test_f1: 0.4291
 epoch: 8, train_loss: 1.0199, test_loss: 1.1794, test_f1: 0.3929
 epoch: 9, train_loss: 0.9880, test_loss: 1.1295, test_f1: 0.4993
 epoch: 10, train_loss: 0.9455, test_loss: 1.0776, test_f1: 0.3978
 epoch: 11, train_loss: 0.9285, test_loss: 1.0648, test_f1: 0.5010
 epoch: 12, train_loss: 0.9382, test_loss: 1.0831, test_f1: 0.5386
 epoch: 13, train_loss: 0.9327, test_loss: 1.0854, test_f1: 0.5346
 epoch: 14, train_loss: 0.9306, test_loss: 1.0643, test_f1: 0.4783
 epoch: 15, train_loss: 0.9471, test_loss: 1.0932, test_f1: 0.4648
 epoch: 16, train_loss: 0.9233, test_loss: 1.1247, test_f1: 0.4394
 epoch: 17, train_loss: 0.9154, test_loss: 1.3134, test_f1: 0.3767
 epoch: 18, train_loss: 0.8797, test_loss: 1.0598, test_f1: 0.5331
 epoch: 19, train_loss: 0.8867, test_loss: 1.0506, test_f1: 0.4868
 epoch: 20, train_loss: 0.8742, test_loss: 1.0310, test_f1: 0.5646
 epoch: 21, train_loss: 0.8562, test_loss: 1.0924, test_f1: 0.4765
 epoch: 22, train_loss: 0.8326, test_loss: 1.4786, test_f1: 0.4723
 epoch: 23, train_loss: 0.8361, test_loss: 1.3832, test_f1: 0.4983
 epoch: 24, train_loss: 0.8411, test_loss: 1.2790, test_f1: 0.4887
 epoch: 25, train_loss: 0.8381, test_loss: 1.0173, test_f1: 0.5861
 epoch: 26, train_loss: 0.8326, test_loss: 1.1694, test_f1: 0.5066
 epoch: 27, train_loss: 0.8318, test_loss: 1.0609, test_f1: 0.5129
 epoch: 28, train_loss: 0.8371, test_loss: 1.2063, test_f1: 0.4223
 epoch: 29, train_loss: 0.8400, test_loss: 1.1683, test_f1: 0.4853
 epoch: 30, train_loss: 0.8221, test_loss: 1.1345, test_f1: 0.5293
 epoch: 31, train_loss: 0.7951, test_loss: 1.1164, test_f1: 0.5373
 epoch: 32, train_loss: 0.8055, test_loss: 1.1043, test_f1: 0.5158
 epoch: 33, train_loss: 0.8072, test_loss: 1.3067, test_f1: 0.5057
 epoch: 34, train_loss: 0.8264, test_loss: 1.0586, test_f1: 0.5532
 epoch: 35, train_loss: 0.7946, test_loss: 1.2498, test_f1: 0.5019
 epoch: 36, train_loss: 0.7985, test_loss: 1.1581, test_f1: 0.5182
 epoch: 37, train_loss: 0.7884, test_loss: 1.1913, test_f1: 0.5459
 epoch: 38, train_loss: 0.8183, test_loss: 1.1037, test_f1: 0.4938
 epoch: 39, train_loss: 0.7890, test_loss: 1.1237, test_f1: 0.5374
 epoch: 40, train_loss: 0.7893, test_loss: 1.0387, test_f1: 0.6034
 epoch: 41, train_loss: 0.7782, test_loss: 1.2611, test_f1: 0.5633
 epoch: 42, train_loss: 0.7572, test_loss: 1.2645, test_f1: 0.4826
 epoch: 43, train_loss: 0.7634, test_loss: 1.3134, test_f1: 0.5378
 epoch: 44, train_loss: 0.7777, test_loss: 1.1448, test_f1: 0.5588
 epoch: 45, train_loss: 0.7946, test_loss: 1.2023, test_f1: 0.6002
 epoch: 46, train_loss: 0.7575, test_loss: 1.3188, test_f1: 0.5246
 epoch: 47, train_loss: 0.8140, test_loss: 1.2645, test_f1: 0.5143
 epoch: 48, train_loss: 0.7801, test_loss: 1.1429, test_f1: 0.5531
 epoch: 49, train_loss: 0.7730, test_loss: 1.3436, test_f1: 0.5007
 epoch: 50, train_loss: 0.7602, test_loss: 1.2665, test_f1: 0.5102
 epoch: 51, train_loss: 0.7324, test_loss: 1.1874, test_f1: 0.5495
 epoch: 52, train_loss: 0.6950, test_loss: 1.2296, test_f1: 0.5588
 epoch: 53, train_loss: 0.6974, test_loss: 1.2580, test_f1: 0.5490
 epoch: 54, train_loss: 0.6950, test_loss: 1.2759, test_f1: 0.5436
 epoch: 55, train_loss: 0.7041, test_loss: 1.3554, test_f1: 0.5286
 epoch: 56, train_loss: 0.6675, test_loss: 1.2365, test_f1: 0.5431
 epoch: 57, train_loss: 0.6644, test_loss: 1.2701, test_f1: 0.5320
 epoch: 58, train_loss: 0.6842, test_loss: 1.2402, test_f1: 0.5668
 epoch: 59, train_loss: 0.6961, test_loss: 1.3348, test_f1: 0.5390
 epoch: 60, train_loss: 0.6503, test_loss: 1.3849, test_f1: 0.5396
 epoch: 61, train_loss: 0.6496, test_loss: 1.3369, test_f1: 0.5808
 epoch: 62, train_loss: 0.6675, test_loss: 1.4630, test_f1: 0.5338
 epoch: 63, train_loss: 0.6681, test_loss: 1.4938, test_f1: 0.5571
 epoch: 64, train_loss: 0.6623, test_loss: 1.2781, test_f1: 0.6063
 epoch: 65, train_loss: 0.6516, test_loss: 1.5818, test_f1: 0.5275
 epoch: 66, train_loss: 0.6376, test_loss: 1.4016, test_f1: 0.5201
 epoch: 67, train_loss: 0.6345, test_loss: 1.7532, test_f1: 0.4874
 epoch: 68, train_loss: 0.6432, test_loss: 1.4062, test_f1: 0.5453
 epoch: 69, train_loss: 0.6293, test_loss: 1.2460, test_f1: 0.5795
 epoch: 70, train_loss: 0.6313, test_loss: 1.4769, test_f1: 0.5465
 epoch: 71, train_loss: 0.6132, test_loss: 1.4189, test_f1: 0.5657
 epoch: 72, train_loss: 0.6296, test_loss: 1.5442, test_f1: 0.5099
 epoch: 73, train_loss: 0.6400, test_loss: 1.4555, test_f1: 0.5198
 epoch: 74, train_loss: 0.6303, test_loss: 1.3696, test_f1: 0.5616
 epoch: 75, train_loss: 0.6294, test_loss: 1.6684, test_f1: 0.5123
 epoch: 76, train_loss: 0.6235, test_loss: 1.3755, test_f1: 0.5622
 epoch: 77, train_loss: 0.6051, test_loss: 1.5744, test_f1: 0.5452
 epoch: 78, train_loss: 0.6037, test_loss: 1.6319, test_f1: 0.5561
 epoch: 79, train_loss: 0.6131, test_loss: 1.5250, test_f1: 0.5608
 epoch: 80, train_loss: 0.6059, test_loss: 1.5439, test_f1: 0.5227
 epoch: 81, train_loss: 0.6034, test_loss: 1.3990, test_f1: 0.5397
 epoch: 82, train_loss: 0.5962, test_loss: 1.2904, test_f1: 0.5648
 epoch: 83, train_loss: 0.5919, test_loss: 1.2212, test_f1: 0.5944
 epoch: 84, train_loss: 0.6135, test_loss: 1.4539, test_f1: 0.5706
 epoch: 85, train_loss: 0.6020, test_loss: 2.1792, test_f1: 0.4284
 epoch: 86, train_loss: 0.6014, test_loss: 1.2753, test_f1: 0.5882
 epoch: 87, train_loss: 0.6000, test_loss: 1.3529, test_f1: 0.5734
 epoch: 88, train_loss: 0.5859, test_loss: 1.5271, test_f1: 0.5169
 epoch: 89, train_loss: 0.5677, test_loss: 1.4303, test_f1: 0.5762
 epoch: 90, train_loss: 0.5801, test_loss: 1.4324, test_f1: 0.5447
 epoch: 91, train_loss: 0.5553, test_loss: 1.4728, test_f1: 0.5831
 epoch: 92, train_loss: 0.5323, test_loss: 1.4783, test_f1: 0.5686
 epoch: 93, train_loss: 0.5488, test_loss: 1.4558, test_f1: 0.5683
 epoch: 94, train_loss: 0.5578, test_loss: 1.5255, test_f1: 0.5268
 epoch: 95, train_loss: 0.5515, test_loss: 1.5185, test_f1: 0.5662
 epoch: 96, train_loss: 0.5502, test_loss: 1.8045, test_f1: 0.5421
 epoch: 97, train_loss: 0.5646, test_loss: 1.5937, test_f1: 0.5993
 epoch: 98, train_loss: 0.5567, test_loss: 1.5595, test_f1: 0.5563
 epoch: 99, train_loss: 0.5638, test_loss: 1.5712, test_f1: 0.5899
##################ITERATION #6 ****************************************
 epoch: 0, train_loss: 1.2926, test_loss: 1.2464, test_f1: 0.3641
 epoch: 1, train_loss: 1.1459, test_loss: 1.2383, test_f1: 0.4042
 epoch: 2, train_loss: 1.0743, test_loss: 1.1173, test_f1: 0.3979
 epoch: 3, train_loss: 1.0187, test_loss: 1.2634, test_f1: 0.4340
 epoch: 4, train_loss: 0.9936, test_loss: 1.1334, test_f1: 0.4827
 epoch: 5, train_loss: 0.9808, test_loss: 1.3456, test_f1: 0.4456
 epoch: 6, train_loss: 0.9453, test_loss: 1.0507, test_f1: 0.4894
 epoch: 7, train_loss: 0.9585, test_loss: 2.0512, test_f1: 0.4248
 epoch: 8, train_loss: 0.9370, test_loss: 1.0399, test_f1: 0.5084
 epoch: 9, train_loss: 0.9229, test_loss: 1.0095, test_f1: 0.5592
 epoch: 10, train_loss: 0.9102, test_loss: 1.0761, test_f1: 0.5055
 epoch: 11, train_loss: 0.8972, test_loss: 1.0639, test_f1: 0.5341
 epoch: 12, train_loss: 0.9200, test_loss: 1.0172, test_f1: 0.5521
 epoch: 13, train_loss: 0.9038, test_loss: 0.9973, test_f1: 0.5734
 epoch: 14, train_loss: 0.8722, test_loss: 1.0454, test_f1: 0.5537
 epoch: 15, train_loss: 0.8584, test_loss: 1.0251, test_f1: 0.5356
 epoch: 16, train_loss: 0.8612, test_loss: 1.0825, test_f1: 0.5588
 epoch: 17, train_loss: 0.8430, test_loss: 1.0627, test_f1: 0.5856
 epoch: 18, train_loss: 0.8504, test_loss: 1.1288, test_f1: 0.5278
 epoch: 19, train_loss: 0.8511, test_loss: 1.0929, test_f1: 0.5138
 epoch: 20, train_loss: 0.8384, test_loss: 1.0855, test_f1: 0.5345
 epoch: 21, train_loss: 0.8157, test_loss: 1.0037, test_f1: 0.5818
 epoch: 22, train_loss: 0.8551, test_loss: 1.1283, test_f1: 0.5426
 epoch: 23, train_loss: 0.8408, test_loss: 1.2325, test_f1: 0.5579
 epoch: 24, train_loss: 0.8020, test_loss: 1.1001, test_f1: 0.5535
 epoch: 25, train_loss: 0.8280, test_loss: 1.2658, test_f1: 0.5452
 epoch: 26, train_loss: 0.8216, test_loss: 1.3829, test_f1: 0.5083
 epoch: 27, train_loss: 0.8637, test_loss: 1.1099, test_f1: 0.5716
 epoch: 28, train_loss: 0.8324, test_loss: 1.0132, test_f1: 0.5706
 epoch: 29, train_loss: 0.8114, test_loss: 1.2205, test_f1: 0.5626
 epoch: 30, train_loss: 0.8168, test_loss: 1.1198, test_f1: 0.5393
 epoch: 31, train_loss: 0.8030, test_loss: 1.0153, test_f1: 0.5787
 epoch: 32, train_loss: 0.7950, test_loss: 0.9824, test_f1: 0.6345
 epoch: 33, train_loss: 0.7933, test_loss: 1.0747, test_f1: 0.5838
 epoch: 34, train_loss: 0.8180, test_loss: 1.0506, test_f1: 0.5885
 epoch: 35, train_loss: 0.8080, test_loss: 1.0051, test_f1: 0.5888
 epoch: 36, train_loss: 0.7748, test_loss: 1.0164, test_f1: 0.6031
 epoch: 37, train_loss: 0.7683, test_loss: 1.0644, test_f1: 0.5726
 epoch: 38, train_loss: 0.7701, test_loss: 1.1104, test_f1: 0.5859
 epoch: 39, train_loss: 0.7685, test_loss: 1.0917, test_f1: 0.5980
 epoch: 40, train_loss: 0.7566, test_loss: 1.1298, test_f1: 0.5374
 epoch: 41, train_loss: 0.7700, test_loss: 1.0520, test_f1: 0.5791
 epoch: 42, train_loss: 0.7975, test_loss: 0.9904, test_f1: 0.5800
 epoch: 43, train_loss: 0.7830, test_loss: 1.0242, test_f1: 0.5474
 epoch: 44, train_loss: 0.7487, test_loss: 1.0664, test_f1: 0.5786
 epoch: 45, train_loss: 0.7636, test_loss: 1.0730, test_f1: 0.5292
 epoch: 46, train_loss: 0.7613, test_loss: 1.0632, test_f1: 0.5812
 epoch: 47, train_loss: 0.7502, test_loss: 1.0509, test_f1: 0.5994
 epoch: 48, train_loss: 0.7964, test_loss: 1.1458, test_f1: 0.5289
 epoch: 49, train_loss: 0.7525, test_loss: 1.1292, test_f1: 0.5642
 epoch: 50, train_loss: 0.7477, test_loss: 1.0845, test_f1: 0.6028
 epoch: 51, train_loss: 0.7107, test_loss: 1.0304, test_f1: 0.6289
 epoch: 52, train_loss: 0.6839, test_loss: 1.0233, test_f1: 0.6012
 epoch: 53, train_loss: 0.6868, test_loss: 1.0697, test_f1: 0.6104
 epoch: 54, train_loss: 0.6975, test_loss: 1.1044, test_f1: 0.6114
 epoch: 55, train_loss: 0.6486, test_loss: 1.1829, test_f1: 0.5952
 epoch: 56, train_loss: 0.6536, test_loss: 1.2117, test_f1: 0.5903
 epoch: 57, train_loss: 0.6377, test_loss: 1.2465, test_f1: 0.5899
 epoch: 58, train_loss: 0.6497, test_loss: 1.2313, test_f1: 0.5906
 epoch: 59, train_loss: 0.6639, test_loss: 1.2869, test_f1: 0.5937
 epoch: 60, train_loss: 0.6781, test_loss: 1.2288, test_f1: 0.6000
 epoch: 61, train_loss: 0.6634, test_loss: 1.2463, test_f1: 0.5620
 epoch: 62, train_loss: 0.6573, test_loss: 1.1744, test_f1: 0.5871
 epoch: 63, train_loss: 0.6683, test_loss: 1.3126, test_f1: 0.5930
 epoch: 64, train_loss: 0.6726, test_loss: 1.3214, test_f1: 0.5510
 epoch: 65, train_loss: 0.6445, test_loss: 1.4360, test_f1: 0.5702
 epoch: 66, train_loss: 0.6153, test_loss: 1.4166, test_f1: 0.5686
 epoch: 67, train_loss: 0.6446, test_loss: 1.3051, test_f1: 0.5597
 epoch: 68, train_loss: 0.6262, test_loss: 1.3679, test_f1: 0.5662
 epoch: 69, train_loss: 0.6464, test_loss: 1.3139, test_f1: 0.5726
 epoch: 70, train_loss: 0.6114, test_loss: 1.5097, test_f1: 0.5269
 epoch: 71, train_loss: 0.6303, test_loss: 1.2820, test_f1: 0.5802
 epoch: 72, train_loss: 0.6213, test_loss: 1.3054, test_f1: 0.6116
 epoch: 73, train_loss: 0.6072, test_loss: 1.1727, test_f1: 0.6046
 epoch: 74, train_loss: 0.5955, test_loss: 1.2633, test_f1: 0.6097
 epoch: 75, train_loss: 0.6091, test_loss: 1.2959, test_f1: 0.5639
 epoch: 76, train_loss: 0.6006, test_loss: 1.2618, test_f1: 0.5709
 epoch: 77, train_loss: 0.5924, test_loss: 1.3660, test_f1: 0.5695
 epoch: 78, train_loss: 0.5985, test_loss: 1.3261, test_f1: 0.5964
 epoch: 79, train_loss: 0.5928, test_loss: 1.4667, test_f1: 0.5450
 epoch: 80, train_loss: 0.5952, test_loss: 1.2372, test_f1: 0.5703
 epoch: 81, train_loss: 0.5879, test_loss: 1.3560, test_f1: 0.5748
 epoch: 82, train_loss: 0.5759, test_loss: 1.3504, test_f1: 0.5787
 epoch: 83, train_loss: 0.5774, test_loss: 1.2264, test_f1: 0.5935
 epoch: 84, train_loss: 0.6171, test_loss: 1.3761, test_f1: 0.5342
 epoch: 85, train_loss: 0.5524, test_loss: 1.4991, test_f1: 0.5657
 epoch: 86, train_loss: 0.5653, test_loss: 1.4757, test_f1: 0.5448
 epoch: 87, train_loss: 0.5505, test_loss: 1.6348, test_f1: 0.5599
 epoch: 88, train_loss: 0.5512, test_loss: 1.3965, test_f1: 0.6078
 epoch: 89, train_loss: 0.5613, test_loss: 1.5268, test_f1: 0.5675
 epoch: 90, train_loss: 0.5520, test_loss: 1.4188, test_f1: 0.5820
 epoch: 91, train_loss: 0.5483, test_loss: 1.5216, test_f1: 0.5443
 epoch: 92, train_loss: 0.5273, test_loss: 1.8411, test_f1: 0.5443
 epoch: 93, train_loss: 0.5496, test_loss: 1.3735, test_f1: 0.5909
 epoch: 94, train_loss: 0.5684, test_loss: 1.4803, test_f1: 0.5277
 epoch: 95, train_loss: 0.5471, test_loss: 1.5068, test_f1: 0.5586
 epoch: 96, train_loss: 0.5272, test_loss: 1.4856, test_f1: 0.5641
 epoch: 97, train_loss: 0.5439, test_loss: 1.4966, test_f1: 0.5754
 epoch: 98, train_loss: 0.5437, test_loss: 1.4668, test_f1: 0.5643
 epoch: 99, train_loss: 0.5336, test_loss: 1.6135, test_f1: 0.5458
##################ITERATION #7 ****************************************
 epoch: 0, train_loss: 1.2883, test_loss: 1.3426, test_f1: 0.3263
 epoch: 1, train_loss: 1.1858, test_loss: 1.2342, test_f1: 0.2731
 epoch: 2, train_loss: 1.1273, test_loss: 1.2420, test_f1: 0.3770
 epoch: 3, train_loss: 1.0676, test_loss: 1.2905, test_f1: 0.4235
 epoch: 4, train_loss: 1.0461, test_loss: 1.1527, test_f1: 0.4675
 epoch: 5, train_loss: 1.0151, test_loss: 1.6878, test_f1: 0.4035
 epoch: 6, train_loss: 0.9626, test_loss: 1.1264, test_f1: 0.4964
 epoch: 7, train_loss: 0.9519, test_loss: 1.0639, test_f1: 0.4944
 epoch: 8, train_loss: 0.9425, test_loss: 1.2242, test_f1: 0.4119
 epoch: 9, train_loss: 0.9206, test_loss: 1.1774, test_f1: 0.4912
 epoch: 10, train_loss: 0.9314, test_loss: 1.0781, test_f1: 0.4585
 epoch: 11, train_loss: 0.9227, test_loss: 1.3363, test_f1: 0.4193
 epoch: 12, train_loss: 0.9226, test_loss: 1.0365, test_f1: 0.5009
 epoch: 13, train_loss: 0.9088, test_loss: 1.1669, test_f1: 0.4427
 epoch: 14, train_loss: 0.9004, test_loss: 1.0261, test_f1: 0.5443
 epoch: 15, train_loss: 0.9152, test_loss: 1.0037, test_f1: 0.5304
 epoch: 16, train_loss: 0.8864, test_loss: 1.0522, test_f1: 0.4412
 epoch: 17, train_loss: 0.8849, test_loss: 1.0680, test_f1: 0.5167
 epoch: 18, train_loss: 0.8882, test_loss: 1.0001, test_f1: 0.4478
 epoch: 19, train_loss: 0.8865, test_loss: 1.6215, test_f1: 0.4210
 epoch: 20, train_loss: 0.8640, test_loss: 1.0726, test_f1: 0.5805
 epoch: 21, train_loss: 0.8518, test_loss: 1.0463, test_f1: 0.5249
 epoch: 22, train_loss: 0.8729, test_loss: 1.1561, test_f1: 0.4360
 epoch: 23, train_loss: 0.8574, test_loss: 1.0806, test_f1: 0.5305
 epoch: 24, train_loss: 0.8291, test_loss: 1.0218, test_f1: 0.5484
 epoch: 25, train_loss: 0.8076, test_loss: 1.0440, test_f1: 0.5351
 epoch: 26, train_loss: 0.8149, test_loss: 1.0439, test_f1: 0.5239
 epoch: 27, train_loss: 0.8294, test_loss: 1.0349, test_f1: 0.5158
 epoch: 28, train_loss: 0.8003, test_loss: 1.1804, test_f1: 0.5329
 epoch: 29, train_loss: 0.8052, test_loss: 1.0163, test_f1: 0.5625
 epoch: 30, train_loss: 0.7842, test_loss: 1.0532, test_f1: 0.5668
 epoch: 31, train_loss: 0.7871, test_loss: 1.2070, test_f1: 0.5296
 epoch: 32, train_loss: 0.8318, test_loss: 1.0023, test_f1: 0.5577
 epoch: 33, train_loss: 0.7952, test_loss: 1.0352, test_f1: 0.5916
 epoch: 34, train_loss: 0.7831, test_loss: 1.0492, test_f1: 0.5926
 epoch: 35, train_loss: 0.8018, test_loss: 2.9174, test_f1: 0.3572
 epoch: 36, train_loss: 0.7861, test_loss: 1.0275, test_f1: 0.5521
 epoch: 37, train_loss: 0.7760, test_loss: 1.0056, test_f1: 0.5652
 epoch: 38, train_loss: 0.7519, test_loss: 1.0012, test_f1: 0.5792
 epoch: 39, train_loss: 0.7549, test_loss: 1.0589, test_f1: 0.5578
 epoch: 40, train_loss: 0.7374, test_loss: 1.0436, test_f1: 0.5675
 epoch: 41, train_loss: 0.7617, test_loss: 1.0611, test_f1: 0.5478
 epoch: 42, train_loss: 0.7378, test_loss: 0.9919, test_f1: 0.6060
 epoch: 43, train_loss: 0.7481, test_loss: 1.1057, test_f1: 0.5281
 epoch: 44, train_loss: 0.7256, test_loss: 1.0291, test_f1: 0.6047
 epoch: 45, train_loss: 0.7504, test_loss: 1.0687, test_f1: 0.5442
 epoch: 46, train_loss: 0.7419, test_loss: 0.9759, test_f1: 0.6042
 epoch: 47, train_loss: 0.7174, test_loss: 1.2634, test_f1: 0.4956
 epoch: 48, train_loss: 0.7345, test_loss: 1.0093, test_f1: 0.5911
 epoch: 49, train_loss: 0.7350, test_loss: 1.1275, test_f1: 0.5516
 epoch: 50, train_loss: 0.7241, test_loss: 0.9460, test_f1: 0.6075
 epoch: 51, train_loss: 0.6875, test_loss: 1.1335, test_f1: 0.5680
 epoch: 52, train_loss: 0.6775, test_loss: 1.0205, test_f1: 0.5908
 epoch: 53, train_loss: 0.6691, test_loss: 1.1603, test_f1: 0.5787
 epoch: 54, train_loss: 0.6601, test_loss: 1.1017, test_f1: 0.5826
 epoch: 55, train_loss: 0.6790, test_loss: 1.0202, test_f1: 0.5793
 epoch: 56, train_loss: 0.6540, test_loss: 1.0901, test_f1: 0.5932
 epoch: 57, train_loss: 0.6455, test_loss: 1.0525, test_f1: 0.5888
 epoch: 58, train_loss: 0.6349, test_loss: 1.1591, test_f1: 0.5852
 epoch: 59, train_loss: 0.6408, test_loss: 1.1684, test_f1: 0.5704
 epoch: 60, train_loss: 0.6818, test_loss: 1.0573, test_f1: 0.5990
 epoch: 61, train_loss: 0.6576, test_loss: 0.9990, test_f1: 0.5916
 epoch: 62, train_loss: 0.6369, test_loss: 1.0273, test_f1: 0.6195
 epoch: 63, train_loss: 0.6382, test_loss: 1.0540, test_f1: 0.6269
 epoch: 64, train_loss: 0.6316, test_loss: 1.1115, test_f1: 0.6103
 epoch: 65, train_loss: 0.6377, test_loss: 1.1565, test_f1: 0.6133
 epoch: 66, train_loss: 0.6222, test_loss: 1.2980, test_f1: 0.5882
 epoch: 67, train_loss: 0.5978, test_loss: 1.3456, test_f1: 0.5192
 epoch: 68, train_loss: 0.6266, test_loss: 1.0386, test_f1: 0.6458
 epoch: 69, train_loss: 0.6007, test_loss: 1.0992, test_f1: 0.6130
 epoch: 70, train_loss: 0.6239, test_loss: 1.1421, test_f1: 0.5888
 epoch: 71, train_loss: 0.6024, test_loss: 1.3661, test_f1: 0.5022
 epoch: 72, train_loss: 0.6186, test_loss: 1.1210, test_f1: 0.6088
 epoch: 73, train_loss: 0.6056, test_loss: 1.1437, test_f1: 0.6068
 epoch: 74, train_loss: 0.6178, test_loss: 1.1333, test_f1: 0.5865
 epoch: 75, train_loss: 0.6349, test_loss: 1.5161, test_f1: 0.5482
 epoch: 76, train_loss: 0.6151, test_loss: 1.3990, test_f1: 0.5617
 epoch: 77, train_loss: 0.6304, test_loss: 1.2209, test_f1: 0.5589
 epoch: 78, train_loss: 0.6169, test_loss: 1.1384, test_f1: 0.5841
 epoch: 79, train_loss: 0.6066, test_loss: 1.2296, test_f1: 0.5764
 epoch: 80, train_loss: 0.5694, test_loss: 1.1551, test_f1: 0.5741
 epoch: 81, train_loss: 0.5665, test_loss: 1.5214, test_f1: 0.5272
 epoch: 82, train_loss: 0.5997, test_loss: 1.2363, test_f1: 0.5805
 epoch: 83, train_loss: 0.5845, test_loss: 1.8844, test_f1: 0.4809
 epoch: 84, train_loss: 0.5779, test_loss: 1.4578, test_f1: 0.5537
 epoch: 85, train_loss: 0.5912, test_loss: 1.1571, test_f1: 0.5980
 epoch: 86, train_loss: 0.5697, test_loss: 1.3486, test_f1: 0.5432
 epoch: 87, train_loss: 0.5851, test_loss: 1.1556, test_f1: 0.5691
 epoch: 88, train_loss: 0.5748, test_loss: 1.1487, test_f1: 0.6106
 epoch: 89, train_loss: 0.5660, test_loss: 1.3859, test_f1: 0.5716
 epoch: 90, train_loss: 0.5555, test_loss: 1.4823, test_f1: 0.5597
 epoch: 91, train_loss: 0.5814, test_loss: 1.6378, test_f1: 0.5438
 epoch: 92, train_loss: 0.6077, test_loss: 1.2117, test_f1: 0.5671
 epoch: 93, train_loss: 0.5571, test_loss: 1.4819, test_f1: 0.5772
 epoch: 94, train_loss: 0.5506, test_loss: 1.2941, test_f1: 0.5756
 epoch: 95, train_loss: 0.5303, test_loss: 1.7797, test_f1: 0.5075
 epoch: 96, train_loss: 0.5686, test_loss: 1.3359, test_f1: 0.5577
 epoch: 97, train_loss: 0.5615, test_loss: 1.2871, test_f1: 0.5831
 epoch: 98, train_loss: 0.5466, test_loss: 1.4494, test_f1: 0.5510
 epoch: 99, train_loss: 0.5748, test_loss: 1.1541, test_f1: 0.5940
##################ITERATION #8 ****************************************
 epoch: 0, train_loss: 1.2847, test_loss: 1.3192, test_f1: 0.2705
 epoch: 1, train_loss: 1.1568, test_loss: 1.2444, test_f1: 0.2894
 epoch: 2, train_loss: 1.1018, test_loss: 1.1910, test_f1: 0.3893
 epoch: 3, train_loss: 1.0600, test_loss: 1.2324, test_f1: 0.4529
 epoch: 4, train_loss: 1.0485, test_loss: 1.1892, test_f1: 0.4395
 epoch: 5, train_loss: 1.0163, test_loss: 1.1387, test_f1: 0.4474
 epoch: 6, train_loss: 1.0062, test_loss: 1.1084, test_f1: 0.4888
 epoch: 7, train_loss: 0.9710, test_loss: 1.0835, test_f1: 0.5075
 epoch: 8, train_loss: 0.9483, test_loss: 1.2557, test_f1: 0.4201
 epoch: 9, train_loss: 0.9600, test_loss: 1.1424, test_f1: 0.4982
 epoch: 10, train_loss: 0.9157, test_loss: 1.1273, test_f1: 0.4699
 epoch: 11, train_loss: 0.9256, test_loss: 1.0761, test_f1: 0.4713
 epoch: 12, train_loss: 0.9144, test_loss: 1.1003, test_f1: 0.4437
 epoch: 13, train_loss: 0.8948, test_loss: 1.0568, test_f1: 0.5392
 epoch: 14, train_loss: 0.8856, test_loss: 1.0314, test_f1: 0.5526
 epoch: 15, train_loss: 0.8863, test_loss: 1.1526, test_f1: 0.5541
 epoch: 16, train_loss: 0.8854, test_loss: 1.0612, test_f1: 0.5510
 epoch: 17, train_loss: 0.8686, test_loss: 1.0674, test_f1: 0.5328
 epoch: 18, train_loss: 0.8604, test_loss: 1.0021, test_f1: 0.5672
 epoch: 19, train_loss: 0.8511, test_loss: 1.0688, test_f1: 0.5657
 epoch: 20, train_loss: 0.8584, test_loss: 1.0655, test_f1: 0.5464
 epoch: 21, train_loss: 0.8571, test_loss: 1.0193, test_f1: 0.5538
 epoch: 22, train_loss: 0.8604, test_loss: 1.1007, test_f1: 0.5269
 epoch: 23, train_loss: 0.8255, test_loss: 1.0162, test_f1: 0.5682
 epoch: 24, train_loss: 0.8463, test_loss: 1.0724, test_f1: 0.5781
 epoch: 25, train_loss: 0.8655, test_loss: 1.0269, test_f1: 0.5386
 epoch: 26, train_loss: 0.8572, test_loss: 0.9787, test_f1: 0.5127
 epoch: 27, train_loss: 0.8248, test_loss: 1.0953, test_f1: 0.5536
 epoch: 28, train_loss: 0.8167, test_loss: 0.9555, test_f1: 0.5559
 epoch: 29, train_loss: 0.8159, test_loss: 1.0319, test_f1: 0.5769
 epoch: 30, train_loss: 0.8252, test_loss: 1.0051, test_f1: 0.6068
 epoch: 31, train_loss: 0.8133, test_loss: 0.9808, test_f1: 0.5447
 epoch: 32, train_loss: 0.8060, test_loss: 1.0457, test_f1: 0.5492
 epoch: 33, train_loss: 0.8151, test_loss: 1.1127, test_f1: 0.5382
 epoch: 34, train_loss: 0.8521, test_loss: 1.3538, test_f1: 0.4394
 epoch: 35, train_loss: 0.8015, test_loss: 0.9952, test_f1: 0.5660
 epoch: 36, train_loss: 0.8082, test_loss: 1.0214, test_f1: 0.5274
 epoch: 37, train_loss: 0.7845, test_loss: 0.9753, test_f1: 0.5952
 epoch: 38, train_loss: 0.7696, test_loss: 1.0739, test_f1: 0.5424
 epoch: 39, train_loss: 0.7692, test_loss: 1.6265, test_f1: 0.4243
 epoch: 40, train_loss: 0.8116, test_loss: 1.2193, test_f1: 0.5469
 epoch: 41, train_loss: 0.7616, test_loss: 1.0553, test_f1: 0.5663
 epoch: 42, train_loss: 0.7880, test_loss: 0.9890, test_f1: 0.5815
 epoch: 43, train_loss: 0.7499, test_loss: 1.0369, test_f1: 0.6023
 epoch: 44, train_loss: 0.7448, test_loss: 1.0092, test_f1: 0.6299
 epoch: 45, train_loss: 0.7402, test_loss: 1.0821, test_f1: 0.6502
 epoch: 46, train_loss: 0.7147, test_loss: 1.0567, test_f1: 0.5914
 epoch: 47, train_loss: 0.7088, test_loss: 1.0389, test_f1: 0.6312
 epoch: 48, train_loss: 0.7187, test_loss: 1.1075, test_f1: 0.5592
 epoch: 49, train_loss: 0.7343, test_loss: 1.3208, test_f1: 0.4666
 epoch: 50, train_loss: 0.7217, test_loss: 1.0328, test_f1: 0.6051
 epoch: 51, train_loss: 0.6946, test_loss: 1.0606, test_f1: 0.5587
 epoch: 52, train_loss: 0.6526, test_loss: 1.1701, test_f1: 0.5909
 epoch: 53, train_loss: 0.6668, test_loss: 1.1050, test_f1: 0.6110
 epoch: 54, train_loss: 0.6742, test_loss: 1.2824, test_f1: 0.5044
 epoch: 55, train_loss: 0.6646, test_loss: 1.1991, test_f1: 0.5891
 epoch: 56, train_loss: 0.6635, test_loss: 1.0658, test_f1: 0.6289
 epoch: 57, train_loss: 0.6726, test_loss: 1.0895, test_f1: 0.6187
 epoch: 58, train_loss: 0.6642, test_loss: 1.2110, test_f1: 0.5970
 epoch: 59, train_loss: 0.6316, test_loss: 1.1148, test_f1: 0.6653
 epoch: 60, train_loss: 0.6444, test_loss: 1.0829, test_f1: 0.6210
 epoch: 61, train_loss: 0.6265, test_loss: 1.1429, test_f1: 0.5845
 epoch: 62, train_loss: 0.6054, test_loss: 1.3116, test_f1: 0.5856
 epoch: 63, train_loss: 0.5999, test_loss: 1.2922, test_f1: 0.5459
 epoch: 64, train_loss: 0.6303, test_loss: 1.0985, test_f1: 0.6408
 epoch: 65, train_loss: 0.6072, test_loss: 1.1389, test_f1: 0.6647
 epoch: 66, train_loss: 0.6081, test_loss: 1.1874, test_f1: 0.5913
 epoch: 67, train_loss: 0.6131, test_loss: 1.2711, test_f1: 0.5545
 epoch: 68, train_loss: 0.6147, test_loss: 1.2672, test_f1: 0.5877
 epoch: 69, train_loss: 0.6404, test_loss: 1.2838, test_f1: 0.5638
 epoch: 70, train_loss: 0.5978, test_loss: 1.2812, test_f1: 0.5553
 epoch: 71, train_loss: 0.5872, test_loss: 1.2688, test_f1: 0.6016
 epoch: 72, train_loss: 0.5809, test_loss: 1.1988, test_f1: 0.5916
 epoch: 73, train_loss: 0.6183, test_loss: 1.1702, test_f1: 0.6428
 epoch: 74, train_loss: 0.6005, test_loss: 1.4688, test_f1: 0.5487
 epoch: 75, train_loss: 0.6140, test_loss: 1.1164, test_f1: 0.5872
 epoch: 76, train_loss: 0.5753, test_loss: 1.2156, test_f1: 0.5953
 epoch: 77, train_loss: 0.5739, test_loss: 1.1864, test_f1: 0.5777
 epoch: 78, train_loss: 0.5962, test_loss: 1.6289, test_f1: 0.5796
 epoch: 79, train_loss: 0.5546, test_loss: 1.2328, test_f1: 0.6074
 epoch: 80, train_loss: 0.5668, test_loss: 1.3643, test_f1: 0.6150
 epoch: 81, train_loss: 0.5884, test_loss: 1.2264, test_f1: 0.6316
 epoch: 82, train_loss: 0.5723, test_loss: 1.3032, test_f1: 0.5694
 epoch: 83, train_loss: 0.5621, test_loss: 1.4181, test_f1: 0.5626
 epoch: 84, train_loss: 0.5598, test_loss: 1.1985, test_f1: 0.6726
 epoch: 85, train_loss: 0.5801, test_loss: 1.2398, test_f1: 0.6472
 epoch: 86, train_loss: 0.5662, test_loss: 1.1134, test_f1: 0.6720
 epoch: 87, train_loss: 0.5599, test_loss: 1.7610, test_f1: 0.5097
 epoch: 88, train_loss: 0.5472, test_loss: 1.4536, test_f1: 0.5956
 epoch: 89, train_loss: 0.5635, test_loss: 1.4991, test_f1: 0.5395
 epoch: 90, train_loss: 0.5646, test_loss: 1.3165, test_f1: 0.6349
 epoch: 91, train_loss: 0.5410, test_loss: 1.3637, test_f1: 0.6143
 epoch: 92, train_loss: 0.5283, test_loss: 1.3016, test_f1: 0.6501
 epoch: 93, train_loss: 0.5369, test_loss: 1.2933, test_f1: 0.5993
 epoch: 94, train_loss: 0.5296, test_loss: 1.4657, test_f1: 0.5802
 epoch: 95, train_loss: 0.5292, test_loss: 1.2962, test_f1: 0.5860
 epoch: 96, train_loss: 0.5507, test_loss: 1.2390, test_f1: 0.6271
 epoch: 97, train_loss: 0.5090, test_loss: 1.3388, test_f1: 0.6015
 epoch: 98, train_loss: 0.5116, test_loss: 1.6139, test_f1: 0.5375
 epoch: 99, train_loss: 0.5332, test_loss: 1.4068, test_f1: 0.5679
##################ITERATION #9 ****************************************
 epoch: 0, train_loss: 1.3439, test_loss: 1.3193, test_f1: 0.2762
 epoch: 1, train_loss: 1.2015, test_loss: 1.2351, test_f1: 0.3872
 epoch: 2, train_loss: 1.1263, test_loss: 1.1935, test_f1: 0.4566
 epoch: 3, train_loss: 1.0845, test_loss: 1.3608, test_f1: 0.3464
 epoch: 4, train_loss: 1.0637, test_loss: 1.1140, test_f1: 0.4846
 epoch: 5, train_loss: 1.0369, test_loss: 1.0466, test_f1: 0.4900
 epoch: 6, train_loss: 0.9960, test_loss: 1.0899, test_f1: 0.4162
 epoch: 7, train_loss: 0.9876, test_loss: 1.0722, test_f1: 0.4849
 epoch: 8, train_loss: 0.9283, test_loss: 1.0682, test_f1: 0.5658
 epoch: 9, train_loss: 0.9546, test_loss: 1.0285, test_f1: 0.5632
 epoch: 10, train_loss: 0.9488, test_loss: 1.0961, test_f1: 0.4311
 epoch: 11, train_loss: 0.9287, test_loss: 1.3329, test_f1: 0.3959
 epoch: 12, train_loss: 0.9516, test_loss: 1.2317, test_f1: 0.4243
 epoch: 13, train_loss: 0.9259, test_loss: 1.0924, test_f1: 0.5558
 epoch: 14, train_loss: 0.8897, test_loss: 1.0518, test_f1: 0.5492
 epoch: 15, train_loss: 0.8838, test_loss: 1.0069, test_f1: 0.5550
 epoch: 16, train_loss: 0.8686, test_loss: 1.0904, test_f1: 0.4789
 epoch: 17, train_loss: 0.8692, test_loss: 1.8554, test_f1: 0.5192
 epoch: 18, train_loss: 0.9291, test_loss: 1.0238, test_f1: 0.4997
 epoch: 19, train_loss: 0.8931, test_loss: 1.0510, test_f1: 0.5516
 epoch: 20, train_loss: 0.8676, test_loss: 1.0072, test_f1: 0.5276
 epoch: 21, train_loss: 0.8714, test_loss: 1.0464, test_f1: 0.5353
 epoch: 22, train_loss: 0.8698, test_loss: 1.0631, test_f1: 0.5162
 epoch: 23, train_loss: 0.8465, test_loss: 1.0650, test_f1: 0.5075
 epoch: 24, train_loss: 0.8420, test_loss: 0.9992, test_f1: 0.6131
 epoch: 25, train_loss: 0.8428, test_loss: 0.9998, test_f1: 0.5760
 epoch: 26, train_loss: 0.8422, test_loss: 1.0208, test_f1: 0.5482
 epoch: 27, train_loss: 0.8562, test_loss: 1.0395, test_f1: 0.5529
 epoch: 28, train_loss: 0.8202, test_loss: 1.0620, test_f1: 0.5425
 epoch: 29, train_loss: 0.8238, test_loss: 1.0295, test_f1: 0.5905
 epoch: 30, train_loss: 0.8161, test_loss: 1.0613, test_f1: 0.5957
 epoch: 31, train_loss: 0.8127, test_loss: 0.9963, test_f1: 0.5819
 epoch: 32, train_loss: 0.7939, test_loss: 1.0727, test_f1: 0.5189
 epoch: 33, train_loss: 0.7850, test_loss: 1.0957, test_f1: 0.5735
 epoch: 34, train_loss: 0.7833, test_loss: 1.7366, test_f1: 0.5172
 epoch: 35, train_loss: 0.7748, test_loss: 1.1694, test_f1: 0.5726
 epoch: 36, train_loss: 0.7769, test_loss: 1.2703, test_f1: 0.5804
 epoch: 37, train_loss: 0.7788, test_loss: 1.2109, test_f1: 0.5403
 epoch: 38, train_loss: 0.7757, test_loss: 1.1208, test_f1: 0.6156
 epoch: 39, train_loss: 0.7486, test_loss: 1.3231, test_f1: 0.5833
 epoch: 40, train_loss: 0.7644, test_loss: 1.2643, test_f1: 0.5827
 epoch: 41, train_loss: 0.7820, test_loss: 1.4478, test_f1: 0.6024
 epoch: 42, train_loss: 0.7655, test_loss: 1.5301, test_f1: 0.5692
 epoch: 43, train_loss: 0.7533, test_loss: 1.4437, test_f1: 0.5609
 epoch: 44, train_loss: 0.7511, test_loss: 1.3265, test_f1: 0.5679
 epoch: 45, train_loss: 0.7649, test_loss: 1.1688, test_f1: 0.5532
 epoch: 46, train_loss: 0.7461, test_loss: 1.1235, test_f1: 0.5660
 epoch: 47, train_loss: 0.7343, test_loss: 1.0290, test_f1: 0.6143
 epoch: 48, train_loss: 0.7178, test_loss: 1.2939, test_f1: 0.5465
 epoch: 49, train_loss: 0.7583, test_loss: 1.4265, test_f1: 0.5169
 epoch: 50, train_loss: 0.7329, test_loss: 1.3668, test_f1: 0.5486
 epoch: 51, train_loss: 0.7003, test_loss: 1.3096, test_f1: 0.6116
 epoch: 52, train_loss: 0.7070, test_loss: 1.2093, test_f1: 0.5649
 epoch: 53, train_loss: 0.6797, test_loss: 1.2932, test_f1: 0.5450
 epoch: 54, train_loss: 0.6774, test_loss: 1.4124, test_f1: 0.5727
 epoch: 55, train_loss: 0.6676, test_loss: 1.3081, test_f1: 0.6016
 epoch: 56, train_loss: 0.6706, test_loss: 1.4349, test_f1: 0.5444
 epoch: 57, train_loss: 0.6759, test_loss: 1.4359, test_f1: 0.5609
 epoch: 58, train_loss: 0.6476, test_loss: 1.4041, test_f1: 0.5258
 epoch: 59, train_loss: 0.6611, test_loss: 1.3361, test_f1: 0.5604
 epoch: 60, train_loss: 0.6438, test_loss: 1.4080, test_f1: 0.5813
 epoch: 61, train_loss: 0.6331, test_loss: 1.3414, test_f1: 0.6032
 epoch: 62, train_loss: 0.6380, test_loss: 1.5008, test_f1: 0.5890
 epoch: 63, train_loss: 0.6341, test_loss: 1.4686, test_f1: 0.5494
 epoch: 64, train_loss: 0.6608, test_loss: 1.4056, test_f1: 0.5724
 epoch: 65, train_loss: 0.6443, test_loss: 1.3402, test_f1: 0.5773
 epoch: 66, train_loss: 0.6427, test_loss: 1.4335, test_f1: 0.5820
 epoch: 67, train_loss: 0.6263, test_loss: 1.4780, test_f1: 0.5931
 epoch: 68, train_loss: 0.6618, test_loss: 1.4541, test_f1: 0.5683
 epoch: 69, train_loss: 0.6250, test_loss: 1.4812, test_f1: 0.5544
 epoch: 70, train_loss: 0.6156, test_loss: 1.5821, test_f1: 0.5254
 epoch: 71, train_loss: 0.6376, test_loss: 1.5223, test_f1: 0.5367
 epoch: 72, train_loss: 0.6360, test_loss: 1.5279, test_f1: 0.4975
 epoch: 73, train_loss: 0.6570, test_loss: 1.3488, test_f1: 0.5923
 epoch: 74, train_loss: 0.6407, test_loss: 1.5161, test_f1: 0.5218
 epoch: 75, train_loss: 0.6386, test_loss: 1.5680, test_f1: 0.5661
 epoch: 76, train_loss: 0.6339, test_loss: 1.6146, test_f1: 0.5288
 epoch: 77, train_loss: 0.6028, test_loss: 1.6143, test_f1: 0.5046
 epoch: 78, train_loss: 0.6020, test_loss: 1.5903, test_f1: 0.5657
 epoch: 79, train_loss: 0.5966, test_loss: 1.6550, test_f1: 0.5751
 epoch: 80, train_loss: 0.6050, test_loss: 1.9013, test_f1: 0.5388
 epoch: 81, train_loss: 0.6209, test_loss: 1.7648, test_f1: 0.5527
 epoch: 82, train_loss: 0.6156, test_loss: 1.9133, test_f1: 0.5227
 epoch: 83, train_loss: 0.6081, test_loss: 1.8141, test_f1: 0.5043
 epoch: 84, train_loss: 0.6136, test_loss: 1.6464, test_f1: 0.5759
 epoch: 85, train_loss: 0.5874, test_loss: 1.7922, test_f1: 0.5230
 epoch: 86, train_loss: 0.5942, test_loss: 1.6764, test_f1: 0.5355
 epoch: 87, train_loss: 0.5961, test_loss: 1.4760, test_f1: 0.5438
 epoch: 88, train_loss: 0.6070, test_loss: 1.6678, test_f1: 0.5334
 epoch: 89, train_loss: 0.5860, test_loss: 1.5447, test_f1: 0.5360
 epoch: 90, train_loss: 0.5823, test_loss: 1.7201, test_f1: 0.4771
 epoch: 91, train_loss: 0.6048, test_loss: 1.4496, test_f1: 0.5431
 epoch: 92, train_loss: 0.6849, test_loss: 1.3633, test_f1: 0.5481
 epoch: 93, train_loss: 0.5946, test_loss: 1.5354, test_f1: 0.4871
 epoch: 94, train_loss: 0.5778, test_loss: 1.3615, test_f1: 0.5949
 epoch: 95, train_loss: 0.5754, test_loss: 1.4355, test_f1: 0.5653
 epoch: 96, train_loss: 0.5762, test_loss: 1.5269, test_f1: 0.5434
 epoch: 97, train_loss: 0.5841, test_loss: 1.6037, test_f1: 0.5422
 epoch: 98, train_loss: 0.5919, test_loss: 1.4954, test_f1: 0.5780
 epoch: 99, train_loss: 0.5723, test_loss: 1.5722, test_f1: 0.5766

Training completed in 647.10 seconds
Best F1: 0.6775 at epoch 99
Mean F1 across iterations: 0.6383  0.0239
========================FINAL RESULTS================================
FEGIN weighted F1: 0.6775  0.0239
python main.py --data ltspice_demos --representation component_component --model FEGIN --layers 5 --hiddens 32 --batch_size 64 --lr 0.01 --emb_size 128 --epochs 100 --save_appendix component_component_L5_H32_BS64_LR0.01_E128 --no_val
-----



STDERR:
  File "main.py", line 370, in <module>
    main()
  File "main.py", line 254, in main
    dataset = dataset_class(
  File "/home/philip/projects/ltspice_examples_code_repo/Circuit-Completion-Using-GNNs/component_classification_with_link_prediction_head/evaluation/FEGIN/kernel/circuit_datasets.py", line 15, in __init__
    self.data, self.slices = torch.load(self.processed_paths[0])
  File "/home/philip/.local/lib/python3.8/site-packages/torch/serialization.py", line 1040, in load
    warnings.warn(
  File "/usr/lib/python3.8/warnings.py", line 109, in _showwarnmsg
    sw(msg.message, msg.category, msg.filename, msg.lineno,
  File "main.py", line 47, in warn_with_traceback
    traceback.print_stack(file=log)
/home/philip/projects/ltspice_examples_code_repo/Circuit-Completion-Using-GNNs/component_classification_with_link_prediction_head/evaluation/FEGIN/kernel/circuit_datasets.py:15: FutureWarning: You are using `torch.load` with `weights_only=False` (the current default value), which uses the default pickle module implicitly. It is possible to construct malicious pickle data which will execute arbitrary code during unpickling (See https://github.com/pytorch/pytorch/blob/main/SECURITY.md#untrusted-models for more details). In a future release, the default value for `weights_only` will be flipped to `True`. This limits the functions that could be executed during unpickling. Arbitrary objects will no longer be allowed to be loaded via this mode unless they are explicitly allowlisted by the user via `torch.serialization.add_safe_globals`. We recommend you start setting `weights_only=True` for any use case where you don't have full control of the loaded file. Please open an issue on GitHub for any issues related to this experimental feature.
  self.data, self.slices = torch.load(self.processed_paths[0])
