STDOUT:
Results will be saved in /home/philip/projects/ltspice_examples_code_repo/Circuit-Completion-Using-GNNs/component_classification_with_link_prediction_head/evaluation/FEGIN/results/model_FEGIN_dataset_ltspice_examples
Command line input: python main.py --data ltspice_examples --representation component_component --model FEGIN --layers 5 --hiddens 128 --batch_size 256 --lr 0.0001 --emb_size 250 --epochs 100 --save_appendix component_component_L5_H128_BS256_LR0.0001_E250 --no_val
 is saved.
-----
ltspice_examples - FEGIN
Using 5 layers, 128 hidden units, h = 2
Loading component_component representation dataset
ENTERED
Training FEGIN on component_component representation
Train: 3556, Test: 845
##################ITERATION #0 ****************************************
 epoch: 0, train_loss: 1.3908, test_loss: 1.3850, test_f1: 0.0794
 epoch: 1, train_loss: 1.3730, test_loss: 1.3755, test_f1: 0.2808
 epoch: 2, train_loss: 1.3600, test_loss: 1.3590, test_f1: 0.3091
 epoch: 3, train_loss: 1.3435, test_loss: 1.3380, test_f1: 0.2959
 epoch: 4, train_loss: 1.3235, test_loss: 1.3128, test_f1: 0.2783
 epoch: 5, train_loss: 1.3011, test_loss: 1.2851, test_f1: 0.2914
 epoch: 6, train_loss: 1.2755, test_loss: 1.2574, test_f1: 0.2959
 epoch: 7, train_loss: 1.2559, test_loss: 1.2306, test_f1: 0.3015
 epoch: 8, train_loss: 1.2346, test_loss: 1.2112, test_f1: 0.3379
 epoch: 9, train_loss: 1.2185, test_loss: 1.1921, test_f1: 0.3521
 epoch: 10, train_loss: 1.1988, test_loss: 1.1746, test_f1: 0.3431
 epoch: 11, train_loss: 1.1835, test_loss: 1.1600, test_f1: 0.3566
 epoch: 12, train_loss: 1.1645, test_loss: 1.1458, test_f1: 0.3636
 epoch: 13, train_loss: 1.1507, test_loss: 1.1320, test_f1: 0.3822
 epoch: 14, train_loss: 1.1313, test_loss: 1.1301, test_f1: 0.4139
 epoch: 15, train_loss: 1.1151, test_loss: 1.1156, test_f1: 0.4330
 epoch: 16, train_loss: 1.1045, test_loss: 1.1084, test_f1: 0.4393
 epoch: 17, train_loss: 1.0876, test_loss: 1.0930, test_f1: 0.4643
 epoch: 18, train_loss: 1.0683, test_loss: 1.0867, test_f1: 0.4396
 epoch: 19, train_loss: 1.0455, test_loss: 1.0809, test_f1: 0.4627
 epoch: 20, train_loss: 1.0396, test_loss: 1.0663, test_f1: 0.4643
 epoch: 21, train_loss: 1.0234, test_loss: 1.0728, test_f1: 0.4590
 epoch: 22, train_loss: 1.0038, test_loss: 1.0542, test_f1: 0.4670
 epoch: 23, train_loss: 0.9873, test_loss: 1.0513, test_f1: 0.4812
 epoch: 24, train_loss: 0.9780, test_loss: 1.0444, test_f1: 0.4757
 epoch: 25, train_loss: 0.9545, test_loss: 1.0431, test_f1: 0.4872
 epoch: 26, train_loss: 0.9471, test_loss: 1.0400, test_f1: 0.4973
 epoch: 27, train_loss: 0.9431, test_loss: 1.0674, test_f1: 0.4697
 epoch: 28, train_loss: 0.9282, test_loss: 1.0222, test_f1: 0.4879
 epoch: 29, train_loss: 0.9078, test_loss: 1.0554, test_f1: 0.4953
 epoch: 30, train_loss: 0.9014, test_loss: 1.0549, test_f1: 0.4792
 epoch: 31, train_loss: 0.8959, test_loss: 1.0312, test_f1: 0.5213
 epoch: 32, train_loss: 0.8874, test_loss: 1.0807, test_f1: 0.4956
 epoch: 33, train_loss: 0.8808, test_loss: 1.0584, test_f1: 0.4757
 epoch: 34, train_loss: 0.8670, test_loss: 1.0974, test_f1: 0.4804
 epoch: 35, train_loss: 0.8538, test_loss: 1.0510, test_f1: 0.4828
 epoch: 36, train_loss: 0.8353, test_loss: 1.0681, test_f1: 0.4970
 epoch: 37, train_loss: 0.8323, test_loss: 1.1039, test_f1: 0.4648
 epoch: 38, train_loss: 0.8312, test_loss: 1.1380, test_f1: 0.4667
 epoch: 39, train_loss: 0.8280, test_loss: 1.1090, test_f1: 0.4776
 epoch: 40, train_loss: 0.8290, test_loss: 1.1271, test_f1: 0.4838
 epoch: 41, train_loss: 0.7910, test_loss: 1.1164, test_f1: 0.4744
 epoch: 42, train_loss: 0.7908, test_loss: 1.1323, test_f1: 0.4971
 epoch: 43, train_loss: 0.7867, test_loss: 1.1375, test_f1: 0.4789
 epoch: 44, train_loss: 0.7871, test_loss: 1.1414, test_f1: 0.4865
 epoch: 45, train_loss: 0.7760, test_loss: 1.1433, test_f1: 0.4839
 epoch: 46, train_loss: 0.7782, test_loss: 1.1629, test_f1: 0.4920
 epoch: 47, train_loss: 0.7633, test_loss: 1.1999, test_f1: 0.4951
 epoch: 48, train_loss: 0.7631, test_loss: 1.2444, test_f1: 0.4696
 epoch: 49, train_loss: 0.7342, test_loss: 1.2788, test_f1: 0.4711
 epoch: 50, train_loss: 0.7362, test_loss: 1.2496, test_f1: 0.4729
 epoch: 51, train_loss: 0.7211, test_loss: 1.2804, test_f1: 0.4695
 epoch: 52, train_loss: 0.7247, test_loss: 1.2599, test_f1: 0.4746
 epoch: 53, train_loss: 0.7087, test_loss: 1.2585, test_f1: 0.4910
 epoch: 54, train_loss: 0.7155, test_loss: 1.2486, test_f1: 0.4899
 epoch: 55, train_loss: 0.7059, test_loss: 1.2459, test_f1: 0.4825
 epoch: 56, train_loss: 0.6887, test_loss: 1.2604, test_f1: 0.4799
 epoch: 57, train_loss: 0.6993, test_loss: 1.3214, test_f1: 0.4893
 epoch: 58, train_loss: 0.6977, test_loss: 1.3099, test_f1: 0.4857
 epoch: 59, train_loss: 0.6815, test_loss: 1.2949, test_f1: 0.4932
 epoch: 60, train_loss: 0.6734, test_loss: 1.3154, test_f1: 0.4766
 epoch: 61, train_loss: 0.6710, test_loss: 1.2888, test_f1: 0.4859
 epoch: 62, train_loss: 0.6664, test_loss: 1.3209, test_f1: 0.4919
 epoch: 63, train_loss: 0.6792, test_loss: 1.3251, test_f1: 0.4925
 epoch: 64, train_loss: 0.6645, test_loss: 1.3649, test_f1: 0.4877
 epoch: 65, train_loss: 0.6614, test_loss: 1.3023, test_f1: 0.4848
 epoch: 66, train_loss: 0.6555, test_loss: 1.2503, test_f1: 0.4843
 epoch: 67, train_loss: 0.6760, test_loss: 1.2872, test_f1: 0.4948
 epoch: 68, train_loss: 0.6501, test_loss: 1.3297, test_f1: 0.4966
 epoch: 69, train_loss: 0.6635, test_loss: 1.3159, test_f1: 0.4877
 epoch: 70, train_loss: 0.6633, test_loss: 1.3165, test_f1: 0.5037
 epoch: 71, train_loss: 0.6671, test_loss: 1.3374, test_f1: 0.5004
 epoch: 72, train_loss: 0.6494, test_loss: 1.3881, test_f1: 0.4619
 epoch: 73, train_loss: 0.6469, test_loss: 1.3973, test_f1: 0.4878
 epoch: 74, train_loss: 0.6477, test_loss: 1.3944, test_f1: 0.4934
 epoch: 75, train_loss: 0.6400, test_loss: 1.3544, test_f1: 0.4832
 epoch: 76, train_loss: 0.6426, test_loss: 1.3270, test_f1: 0.4982
 epoch: 77, train_loss: 0.6247, test_loss: 1.3843, test_f1: 0.4984
 epoch: 78, train_loss: 0.6269, test_loss: 1.4107, test_f1: 0.4904
 epoch: 79, train_loss: 0.6140, test_loss: 1.4196, test_f1: 0.4904
 epoch: 80, train_loss: 0.6206, test_loss: 1.4353, test_f1: 0.4963
 epoch: 81, train_loss: 0.6182, test_loss: 1.4293, test_f1: 0.4891
 epoch: 82, train_loss: 0.6119, test_loss: 1.4513, test_f1: 0.4931
 epoch: 83, train_loss: 0.6123, test_loss: 1.4540, test_f1: 0.5032
 epoch: 84, train_loss: 0.6056, test_loss: 1.4446, test_f1: 0.4974
 epoch: 85, train_loss: 0.6025, test_loss: 1.4884, test_f1: 0.5006
 epoch: 86, train_loss: 0.5967, test_loss: 1.4845, test_f1: 0.5009
 epoch: 87, train_loss: 0.5988, test_loss: 1.4404, test_f1: 0.4995
 epoch: 88, train_loss: 0.6020, test_loss: 1.4629, test_f1: 0.4885
 epoch: 89, train_loss: 0.6087, test_loss: 1.5139, test_f1: 0.5086
 epoch: 90, train_loss: 0.5906, test_loss: 1.5706, test_f1: 0.4928
 epoch: 91, train_loss: 0.5984, test_loss: 1.5293, test_f1: 0.5158
 epoch: 92, train_loss: 0.5918, test_loss: 1.4843, test_f1: 0.5122
 epoch: 93, train_loss: 0.5788, test_loss: 1.4693, test_f1: 0.5060
 epoch: 94, train_loss: 0.5789, test_loss: 1.5425, test_f1: 0.4944
 epoch: 95, train_loss: 0.5923, test_loss: 1.5364, test_f1: 0.5078
 epoch: 96, train_loss: 0.5816, test_loss: 1.5092, test_f1: 0.5129
 epoch: 97, train_loss: 0.5740, test_loss: 1.5218, test_f1: 0.4948
 epoch: 98, train_loss: 0.5795, test_loss: 1.6288, test_f1: 0.4970
 epoch: 99, train_loss: 0.5691, test_loss: 1.5954, test_f1: 0.5008
##################ITERATION #1 ****************************************
 epoch: 0, train_loss: 1.3405, test_loss: 1.3503, test_f1: 0.2274
 epoch: 1, train_loss: 1.2839, test_loss: 1.3178, test_f1: 0.2274
 epoch: 2, train_loss: 1.2572, test_loss: 1.2821, test_f1: 0.2677
 epoch: 3, train_loss: 1.2335, test_loss: 1.2424, test_f1: 0.2964
 epoch: 4, train_loss: 1.2113, test_loss: 1.2034, test_f1: 0.3499
 epoch: 5, train_loss: 1.1899, test_loss: 1.1781, test_f1: 0.4042
 epoch: 6, train_loss: 1.1747, test_loss: 1.1579, test_f1: 0.4236
 epoch: 7, train_loss: 1.1565, test_loss: 1.1451, test_f1: 0.4186
 epoch: 8, train_loss: 1.1418, test_loss: 1.1312, test_f1: 0.4528
 epoch: 9, train_loss: 1.1181, test_loss: 1.1196, test_f1: 0.4555
 epoch: 10, train_loss: 1.1073, test_loss: 1.1087, test_f1: 0.4613
 epoch: 11, train_loss: 1.0924, test_loss: 1.0992, test_f1: 0.4692
 epoch: 12, train_loss: 1.0704, test_loss: 1.0941, test_f1: 0.4626
 epoch: 13, train_loss: 1.0552, test_loss: 1.0772, test_f1: 0.4548
 epoch: 14, train_loss: 1.0393, test_loss: 1.0732, test_f1: 0.4595
 epoch: 15, train_loss: 1.0249, test_loss: 1.0601, test_f1: 0.4582
 epoch: 16, train_loss: 1.0051, test_loss: 1.0614, test_f1: 0.4613
 epoch: 17, train_loss: 0.9976, test_loss: 1.0375, test_f1: 0.4718
 epoch: 18, train_loss: 0.9761, test_loss: 1.0560, test_f1: 0.4809
 epoch: 19, train_loss: 0.9676, test_loss: 1.0548, test_f1: 0.4746
 epoch: 20, train_loss: 0.9403, test_loss: 1.0515, test_f1: 0.4788
 epoch: 21, train_loss: 0.9220, test_loss: 1.0437, test_f1: 0.4956
 epoch: 22, train_loss: 0.9086, test_loss: 1.0572, test_f1: 0.4801
 epoch: 23, train_loss: 0.9024, test_loss: 1.0554, test_f1: 0.4680
 epoch: 24, train_loss: 0.8862, test_loss: 1.0737, test_f1: 0.4693
 epoch: 25, train_loss: 0.8621, test_loss: 1.0748, test_f1: 0.4708
 epoch: 26, train_loss: 0.8595, test_loss: 1.0608, test_f1: 0.4794
 epoch: 27, train_loss: 0.8306, test_loss: 1.1348, test_f1: 0.4498
 epoch: 28, train_loss: 0.8295, test_loss: 1.0905, test_f1: 0.4700
 epoch: 29, train_loss: 0.8028, test_loss: 1.1946, test_f1: 0.4579
 epoch: 30, train_loss: 0.8120, test_loss: 1.1133, test_f1: 0.4726
 epoch: 31, train_loss: 0.7850, test_loss: 1.1363, test_f1: 0.4673
 epoch: 32, train_loss: 0.7837, test_loss: 1.1168, test_f1: 0.4754
 epoch: 33, train_loss: 0.7751, test_loss: 1.1562, test_f1: 0.4667
 epoch: 34, train_loss: 0.7587, test_loss: 1.1833, test_f1: 0.4683
 epoch: 35, train_loss: 0.7505, test_loss: 1.1401, test_f1: 0.4731
 epoch: 36, train_loss: 0.7455, test_loss: 1.1471, test_f1: 0.4778
 epoch: 37, train_loss: 0.7186, test_loss: 1.3392, test_f1: 0.4680
 epoch: 38, train_loss: 0.7273, test_loss: 1.2268, test_f1: 0.4617
 epoch: 39, train_loss: 0.7154, test_loss: 1.2149, test_f1: 0.4700
 epoch: 40, train_loss: 0.7064, test_loss: 1.2426, test_f1: 0.4894
 epoch: 41, train_loss: 0.7193, test_loss: 1.2216, test_f1: 0.4829
 epoch: 42, train_loss: 0.6963, test_loss: 1.2140, test_f1: 0.4792
 epoch: 43, train_loss: 0.6812, test_loss: 1.2791, test_f1: 0.4734
 epoch: 44, train_loss: 0.6784, test_loss: 1.2306, test_f1: 0.4777
 epoch: 45, train_loss: 0.6859, test_loss: 1.2455, test_f1: 0.4992
 epoch: 46, train_loss: 0.6760, test_loss: 1.2577, test_f1: 0.4923
 epoch: 47, train_loss: 0.6670, test_loss: 1.2813, test_f1: 0.4895
 epoch: 48, train_loss: 0.6562, test_loss: 1.3017, test_f1: 0.5024
 epoch: 49, train_loss: 0.6404, test_loss: 1.3212, test_f1: 0.4716
 epoch: 50, train_loss: 0.6365, test_loss: 1.3322, test_f1: 0.4799
 epoch: 51, train_loss: 0.6214, test_loss: 1.2950, test_f1: 0.4949
 epoch: 52, train_loss: 0.6274, test_loss: 1.3129, test_f1: 0.4937
 epoch: 53, train_loss: 0.6135, test_loss: 1.3310, test_f1: 0.4952
 epoch: 54, train_loss: 0.6089, test_loss: 1.3647, test_f1: 0.4858
 epoch: 55, train_loss: 0.6026, test_loss: 1.3836, test_f1: 0.4871
 epoch: 56, train_loss: 0.6073, test_loss: 1.3778, test_f1: 0.4953
 epoch: 57, train_loss: 0.5972, test_loss: 1.3529, test_f1: 0.4941
 epoch: 58, train_loss: 0.5897, test_loss: 1.4049, test_f1: 0.4776
 epoch: 59, train_loss: 0.6011, test_loss: 1.4131, test_f1: 0.4841
 epoch: 60, train_loss: 0.5889, test_loss: 1.4885, test_f1: 0.4742
 epoch: 61, train_loss: 0.5682, test_loss: 1.5510, test_f1: 0.4779
 epoch: 62, train_loss: 0.5851, test_loss: 1.4439, test_f1: 0.4726
 epoch: 63, train_loss: 0.5722, test_loss: 1.4705, test_f1: 0.4763
 epoch: 64, train_loss: 0.5820, test_loss: 1.4093, test_f1: 0.4810
 epoch: 65, train_loss: 0.5747, test_loss: 1.5029, test_f1: 0.4678
 epoch: 66, train_loss: 0.5835, test_loss: 1.5191, test_f1: 0.4697
 epoch: 67, train_loss: 0.5729, test_loss: 1.4863, test_f1: 0.4822
 epoch: 68, train_loss: 0.5594, test_loss: 1.4953, test_f1: 0.4710
 epoch: 69, train_loss: 0.5713, test_loss: 1.5113, test_f1: 0.4740
 epoch: 70, train_loss: 0.5764, test_loss: 1.4785, test_f1: 0.4654
 epoch: 71, train_loss: 0.5706, test_loss: 1.4664, test_f1: 0.4725
 epoch: 72, train_loss: 0.5609, test_loss: 1.5092, test_f1: 0.4752
 epoch: 73, train_loss: 0.5675, test_loss: 1.4966, test_f1: 0.4791
 epoch: 74, train_loss: 0.5419, test_loss: 1.5122, test_f1: 0.4761
 epoch: 75, train_loss: 0.5552, test_loss: 1.5221, test_f1: 0.4702
 epoch: 76, train_loss: 0.5388, test_loss: 1.6035, test_f1: 0.4669
 epoch: 77, train_loss: 0.5399, test_loss: 1.5763, test_f1: 0.4646
 epoch: 78, train_loss: 0.5469, test_loss: 1.5811, test_f1: 0.4621
 epoch: 79, train_loss: 0.5227, test_loss: 1.5833, test_f1: 0.4597
 epoch: 80, train_loss: 0.5442, test_loss: 1.5683, test_f1: 0.4767
 epoch: 81, train_loss: 0.5281, test_loss: 1.5814, test_f1: 0.4819
 epoch: 82, train_loss: 0.5278, test_loss: 1.5461, test_f1: 0.4843
 epoch: 83, train_loss: 0.5290, test_loss: 1.5391, test_f1: 0.4861
 epoch: 84, train_loss: 0.5225, test_loss: 1.5632, test_f1: 0.4777
 epoch: 85, train_loss: 0.5202, test_loss: 1.5631, test_f1: 0.4750
 epoch: 86, train_loss: 0.5169, test_loss: 1.6125, test_f1: 0.4726
 epoch: 87, train_loss: 0.5118, test_loss: 1.6452, test_f1: 0.4750
 epoch: 88, train_loss: 0.5185, test_loss: 1.5852, test_f1: 0.4818
 epoch: 89, train_loss: 0.4940, test_loss: 1.5767, test_f1: 0.4860
 epoch: 90, train_loss: 0.5196, test_loss: 1.6489, test_f1: 0.4798
 epoch: 91, train_loss: 0.5049, test_loss: 1.6824, test_f1: 0.4733
 epoch: 92, train_loss: 0.5141, test_loss: 1.6347, test_f1: 0.4744
 epoch: 93, train_loss: 0.5173, test_loss: 1.6353, test_f1: 0.4843
 epoch: 94, train_loss: 0.5109, test_loss: 1.6508, test_f1: 0.4893
 epoch: 95, train_loss: 0.4990, test_loss: 1.6377, test_f1: 0.4872
 epoch: 96, train_loss: 0.5029, test_loss: 1.7328, test_f1: 0.4771
 epoch: 97, train_loss: 0.4964, test_loss: 1.6892, test_f1: 0.4670
 epoch: 98, train_loss: 0.5075, test_loss: 1.6272, test_f1: 0.4895
 epoch: 99, train_loss: 0.5094, test_loss: 1.6798, test_f1: 0.4790
##################ITERATION #2 ****************************************
 epoch: 0, train_loss: 1.3419, test_loss: 1.3340, test_f1: 0.2565
 epoch: 1, train_loss: 1.2620, test_loss: 1.2923, test_f1: 0.3048
 epoch: 2, train_loss: 1.2274, test_loss: 1.2405, test_f1: 0.3304
 epoch: 3, train_loss: 1.2065, test_loss: 1.1969, test_f1: 0.4335
 epoch: 4, train_loss: 1.1810, test_loss: 1.1636, test_f1: 0.4479
 epoch: 5, train_loss: 1.1588, test_loss: 1.1412, test_f1: 0.4546
 epoch: 6, train_loss: 1.1429, test_loss: 1.1252, test_f1: 0.4543
 epoch: 7, train_loss: 1.1295, test_loss: 1.1143, test_f1: 0.4548
 epoch: 8, train_loss: 1.1114, test_loss: 1.1002, test_f1: 0.4556
 epoch: 9, train_loss: 1.0949, test_loss: 1.0854, test_f1: 0.4664
 epoch: 10, train_loss: 1.0800, test_loss: 1.0780, test_f1: 0.4547
 epoch: 11, train_loss: 1.0634, test_loss: 1.0625, test_f1: 0.4669
 epoch: 12, train_loss: 1.0418, test_loss: 1.0552, test_f1: 0.4636
 epoch: 13, train_loss: 1.0331, test_loss: 1.0512, test_f1: 0.4552
 epoch: 14, train_loss: 1.0198, test_loss: 1.0437, test_f1: 0.4641
 epoch: 15, train_loss: 1.0065, test_loss: 1.0352, test_f1: 0.4737
 epoch: 16, train_loss: 0.9961, test_loss: 1.0251, test_f1: 0.4813
 epoch: 17, train_loss: 0.9819, test_loss: 1.0244, test_f1: 0.4756
 epoch: 18, train_loss: 0.9643, test_loss: 1.0131, test_f1: 0.4817
 epoch: 19, train_loss: 0.9532, test_loss: 1.0122, test_f1: 0.4864
 epoch: 20, train_loss: 0.9368, test_loss: 1.0350, test_f1: 0.4894
 epoch: 21, train_loss: 0.9296, test_loss: 1.0309, test_f1: 0.4932
 epoch: 22, train_loss: 0.9080, test_loss: 1.0011, test_f1: 0.4897
 epoch: 23, train_loss: 0.8983, test_loss: 1.0056, test_f1: 0.4960
 epoch: 24, train_loss: 0.8909, test_loss: 1.0226, test_f1: 0.4981
 epoch: 25, train_loss: 0.8731, test_loss: 1.0258, test_f1: 0.4877
 epoch: 26, train_loss: 0.8627, test_loss: 1.0444, test_f1: 0.4931
 epoch: 27, train_loss: 0.8597, test_loss: 1.0753, test_f1: 0.4947
 epoch: 28, train_loss: 0.8360, test_loss: 1.0414, test_f1: 0.4961
 epoch: 29, train_loss: 0.8329, test_loss: 1.0530, test_f1: 0.4828
 epoch: 30, train_loss: 0.8300, test_loss: 1.0152, test_f1: 0.5190
 epoch: 31, train_loss: 0.8145, test_loss: 1.0609, test_f1: 0.4907
 epoch: 32, train_loss: 0.8107, test_loss: 1.0602, test_f1: 0.4951
 epoch: 33, train_loss: 0.7916, test_loss: 1.0985, test_f1: 0.5140
 epoch: 34, train_loss: 0.7768, test_loss: 1.0787, test_f1: 0.5100
 epoch: 35, train_loss: 0.7696, test_loss: 1.0756, test_f1: 0.5313
 epoch: 36, train_loss: 0.7631, test_loss: 1.1160, test_f1: 0.5115
 epoch: 37, train_loss: 0.7603, test_loss: 1.0741, test_f1: 0.5023
 epoch: 38, train_loss: 0.7524, test_loss: 1.0757, test_f1: 0.5116
 epoch: 39, train_loss: 0.7462, test_loss: 1.1321, test_f1: 0.5136
 epoch: 40, train_loss: 0.7342, test_loss: 1.1599, test_f1: 0.5078
 epoch: 41, train_loss: 0.7121, test_loss: 1.0889, test_f1: 0.5266
 epoch: 42, train_loss: 0.7170, test_loss: 1.1597, test_f1: 0.4919
 epoch: 43, train_loss: 0.7136, test_loss: 1.1103, test_f1: 0.5142
 epoch: 44, train_loss: 0.7061, test_loss: 1.1254, test_f1: 0.5057
 epoch: 45, train_loss: 0.7000, test_loss: 1.1910, test_f1: 0.5232
 epoch: 46, train_loss: 0.7029, test_loss: 1.1881, test_f1: 0.5041
 epoch: 47, train_loss: 0.6929, test_loss: 1.1309, test_f1: 0.5320
 epoch: 48, train_loss: 0.6878, test_loss: 1.1786, test_f1: 0.4934
 epoch: 49, train_loss: 0.6610, test_loss: 1.2175, test_f1: 0.5109
 epoch: 50, train_loss: 0.6562, test_loss: 1.2366, test_f1: 0.5160
 epoch: 51, train_loss: 0.6482, test_loss: 1.1866, test_f1: 0.5207
 epoch: 52, train_loss: 0.6486, test_loss: 1.2111, test_f1: 0.4975
 epoch: 53, train_loss: 0.6354, test_loss: 1.1863, test_f1: 0.5198
 epoch: 54, train_loss: 0.6320, test_loss: 1.1993, test_f1: 0.5094
 epoch: 55, train_loss: 0.6180, test_loss: 1.2040, test_f1: 0.5081
 epoch: 56, train_loss: 0.6260, test_loss: 1.2217, test_f1: 0.5222
 epoch: 57, train_loss: 0.6152, test_loss: 1.2141, test_f1: 0.4993
 epoch: 58, train_loss: 0.6070, test_loss: 1.2029, test_f1: 0.5146
 epoch: 59, train_loss: 0.6199, test_loss: 1.2326, test_f1: 0.5122
 epoch: 60, train_loss: 0.6081, test_loss: 1.2657, test_f1: 0.5112
 epoch: 61, train_loss: 0.5957, test_loss: 1.2585, test_f1: 0.5159
 epoch: 62, train_loss: 0.5864, test_loss: 1.2299, test_f1: 0.5137
 epoch: 63, train_loss: 0.6006, test_loss: 1.3083, test_f1: 0.5045
 epoch: 64, train_loss: 0.5871, test_loss: 1.2896, test_f1: 0.5068
 epoch: 65, train_loss: 0.5761, test_loss: 1.3067, test_f1: 0.5011
 epoch: 66, train_loss: 0.5912, test_loss: 1.2691, test_f1: 0.4913
 epoch: 67, train_loss: 0.5810, test_loss: 1.2688, test_f1: 0.5007
 epoch: 68, train_loss: 0.5837, test_loss: 1.2972, test_f1: 0.5096
 epoch: 69, train_loss: 0.5782, test_loss: 1.2938, test_f1: 0.5115
 epoch: 70, train_loss: 0.5727, test_loss: 1.2837, test_f1: 0.5224
 epoch: 71, train_loss: 0.5695, test_loss: 1.3017, test_f1: 0.5160
 epoch: 72, train_loss: 0.5683, test_loss: 1.3108, test_f1: 0.5100
 epoch: 73, train_loss: 0.5625, test_loss: 1.3492, test_f1: 0.4983
 epoch: 74, train_loss: 0.5669, test_loss: 1.3729, test_f1: 0.5043
 epoch: 75, train_loss: 0.5664, test_loss: 1.3525, test_f1: 0.5116
 epoch: 76, train_loss: 0.5498, test_loss: 1.3049, test_f1: 0.5175
 epoch: 77, train_loss: 0.5572, test_loss: 1.3174, test_f1: 0.5159
 epoch: 78, train_loss: 0.5508, test_loss: 1.3710, test_f1: 0.5170
 epoch: 79, train_loss: 0.5507, test_loss: 1.3730, test_f1: 0.5111
 epoch: 80, train_loss: 0.5533, test_loss: 1.3828, test_f1: 0.5259
 epoch: 81, train_loss: 0.5483, test_loss: 1.3915, test_f1: 0.5099
 epoch: 82, train_loss: 0.5616, test_loss: 1.3311, test_f1: 0.5131
 epoch: 83, train_loss: 0.5507, test_loss: 1.3637, test_f1: 0.5145
 epoch: 84, train_loss: 0.5354, test_loss: 1.3465, test_f1: 0.5197
 epoch: 85, train_loss: 0.5262, test_loss: 1.3941, test_f1: 0.5114
 epoch: 86, train_loss: 0.5323, test_loss: 1.4049, test_f1: 0.5218
 epoch: 87, train_loss: 0.5218, test_loss: 1.3938, test_f1: 0.5193
 epoch: 88, train_loss: 0.5380, test_loss: 1.3775, test_f1: 0.5202
 epoch: 89, train_loss: 0.5292, test_loss: 1.3830, test_f1: 0.5184
 epoch: 90, train_loss: 0.5089, test_loss: 1.4654, test_f1: 0.5101
 epoch: 91, train_loss: 0.5243, test_loss: 1.4313, test_f1: 0.5156
 epoch: 92, train_loss: 0.5142, test_loss: 1.4299, test_f1: 0.5176
 epoch: 93, train_loss: 0.5196, test_loss: 1.4505, test_f1: 0.5162
 epoch: 94, train_loss: 0.5094, test_loss: 1.4405, test_f1: 0.5199
 epoch: 95, train_loss: 0.5152, test_loss: 1.5323, test_f1: 0.4999
 epoch: 96, train_loss: 0.5132, test_loss: 1.4384, test_f1: 0.5077
 epoch: 97, train_loss: 0.5111, test_loss: 1.4415, test_f1: 0.5230
 epoch: 98, train_loss: 0.5060, test_loss: 1.4697, test_f1: 0.5171
 epoch: 99, train_loss: 0.5085, test_loss: 1.4656, test_f1: 0.5010
##################ITERATION #3 ****************************************
 epoch: 0, train_loss: 1.2892, test_loss: 1.3141, test_f1: 0.2504
 epoch: 1, train_loss: 1.2287, test_loss: 1.2722, test_f1: 0.3041
 epoch: 2, train_loss: 1.2115, test_loss: 1.2323, test_f1: 0.4062
 epoch: 3, train_loss: 1.1864, test_loss: 1.2076, test_f1: 0.4017
 epoch: 4, train_loss: 1.1630, test_loss: 1.1755, test_f1: 0.4163
 epoch: 5, train_loss: 1.1493, test_loss: 1.1538, test_f1: 0.4235
 epoch: 6, train_loss: 1.1337, test_loss: 1.1457, test_f1: 0.4334
 epoch: 7, train_loss: 1.1137, test_loss: 1.1304, test_f1: 0.4377
 epoch: 8, train_loss: 1.1009, test_loss: 1.1207, test_f1: 0.4376
 epoch: 9, train_loss: 1.0871, test_loss: 1.1078, test_f1: 0.4362
 epoch: 10, train_loss: 1.0690, test_loss: 1.0924, test_f1: 0.4432
 epoch: 11, train_loss: 1.0570, test_loss: 1.0874, test_f1: 0.4460
 epoch: 12, train_loss: 1.0364, test_loss: 1.0683, test_f1: 0.4823
 epoch: 13, train_loss: 1.0177, test_loss: 1.0679, test_f1: 0.4668
 epoch: 14, train_loss: 1.0097, test_loss: 1.0603, test_f1: 0.4630
 epoch: 15, train_loss: 0.9934, test_loss: 1.0542, test_f1: 0.4768
 epoch: 16, train_loss: 0.9770, test_loss: 1.0460, test_f1: 0.4799
 epoch: 17, train_loss: 0.9555, test_loss: 1.0438, test_f1: 0.4565
 epoch: 18, train_loss: 0.9517, test_loss: 1.0366, test_f1: 0.4756
 epoch: 19, train_loss: 0.9417, test_loss: 1.0487, test_f1: 0.4747
 epoch: 20, train_loss: 0.9341, test_loss: 1.0451, test_f1: 0.4813
 epoch: 21, train_loss: 0.9259, test_loss: 1.0747, test_f1: 0.4779
 epoch: 22, train_loss: 0.9026, test_loss: 1.0629, test_f1: 0.4835
 epoch: 23, train_loss: 0.8992, test_loss: 1.0793, test_f1: 0.4754
 epoch: 24, train_loss: 0.8931, test_loss: 1.0880, test_f1: 0.4675
 epoch: 25, train_loss: 0.8797, test_loss: 1.0606, test_f1: 0.4777
 epoch: 26, train_loss: 0.8708, test_loss: 1.0727, test_f1: 0.4876
 epoch: 27, train_loss: 0.8618, test_loss: 1.0674, test_f1: 0.4918
 epoch: 28, train_loss: 0.8455, test_loss: 1.0721, test_f1: 0.4963
 epoch: 29, train_loss: 0.8329, test_loss: 1.0955, test_f1: 0.4797
 epoch: 30, train_loss: 0.8286, test_loss: 1.0762, test_f1: 0.4867
 epoch: 31, train_loss: 0.8202, test_loss: 1.0896, test_f1: 0.4914
 epoch: 32, train_loss: 0.8011, test_loss: 1.0890, test_f1: 0.4870
 epoch: 33, train_loss: 0.7954, test_loss: 1.0843, test_f1: 0.4848
 epoch: 34, train_loss: 0.7845, test_loss: 1.1016, test_f1: 0.4864
 epoch: 35, train_loss: 0.7861, test_loss: 1.1055, test_f1: 0.4949
 epoch: 36, train_loss: 0.7671, test_loss: 1.1533, test_f1: 0.4886
 epoch: 37, train_loss: 0.7780, test_loss: 1.1295, test_f1: 0.4812
 epoch: 38, train_loss: 0.7607, test_loss: 1.1553, test_f1: 0.4962
 epoch: 39, train_loss: 0.7497, test_loss: 1.1714, test_f1: 0.4954
 epoch: 40, train_loss: 0.7576, test_loss: 1.1756, test_f1: 0.4947
 epoch: 41, train_loss: 0.7473, test_loss: 1.1767, test_f1: 0.4933
 epoch: 42, train_loss: 0.7340, test_loss: 1.1960, test_f1: 0.4833
 epoch: 43, train_loss: 0.7232, test_loss: 1.1948, test_f1: 0.5027
 epoch: 44, train_loss: 0.7184, test_loss: 1.2217, test_f1: 0.4831
 epoch: 45, train_loss: 0.6990, test_loss: 1.2289, test_f1: 0.4923
 epoch: 46, train_loss: 0.6980, test_loss: 1.2282, test_f1: 0.4916
 epoch: 47, train_loss: 0.6799, test_loss: 1.2517, test_f1: 0.4839
 epoch: 48, train_loss: 0.6956, test_loss: 1.2679, test_f1: 0.4952
 epoch: 49, train_loss: 0.6797, test_loss: 1.2697, test_f1: 0.4960
 epoch: 50, train_loss: 0.6860, test_loss: 1.3417, test_f1: 0.4814
 epoch: 51, train_loss: 0.6545, test_loss: 1.3050, test_f1: 0.4876
 epoch: 52, train_loss: 0.6542, test_loss: 1.3223, test_f1: 0.4866
 epoch: 53, train_loss: 0.6378, test_loss: 1.3225, test_f1: 0.4972
 epoch: 54, train_loss: 0.6512, test_loss: 1.3887, test_f1: 0.4881
 epoch: 55, train_loss: 0.6385, test_loss: 1.4405, test_f1: 0.4868
 epoch: 56, train_loss: 0.6197, test_loss: 1.3960, test_f1: 0.4845
 epoch: 57, train_loss: 0.6392, test_loss: 1.3436, test_f1: 0.4879
 epoch: 58, train_loss: 0.6375, test_loss: 1.4081, test_f1: 0.4928
 epoch: 59, train_loss: 0.6241, test_loss: 1.3749, test_f1: 0.4929
 epoch: 60, train_loss: 0.6252, test_loss: 1.3938, test_f1: 0.4871
 epoch: 61, train_loss: 0.6248, test_loss: 1.3923, test_f1: 0.4828
 epoch: 62, train_loss: 0.6129, test_loss: 1.4315, test_f1: 0.4772
 epoch: 63, train_loss: 0.6181, test_loss: 1.4640, test_f1: 0.4862
 epoch: 64, train_loss: 0.6166, test_loss: 1.4361, test_f1: 0.4827
 epoch: 65, train_loss: 0.6073, test_loss: 1.4247, test_f1: 0.4898
 epoch: 66, train_loss: 0.6074, test_loss: 1.4387, test_f1: 0.4944
 epoch: 67, train_loss: 0.5942, test_loss: 1.4934, test_f1: 0.4961
 epoch: 68, train_loss: 0.6059, test_loss: 1.4638, test_f1: 0.5006
 epoch: 69, train_loss: 0.5934, test_loss: 1.5049, test_f1: 0.4939
 epoch: 70, train_loss: 0.5876, test_loss: 1.4518, test_f1: 0.4965
 epoch: 71, train_loss: 0.5888, test_loss: 1.4624, test_f1: 0.4936
 epoch: 72, train_loss: 0.5712, test_loss: 1.4599, test_f1: 0.4951
 epoch: 73, train_loss: 0.5875, test_loss: 1.5211, test_f1: 0.4997
 epoch: 74, train_loss: 0.5630, test_loss: 1.4947, test_f1: 0.4957
 epoch: 75, train_loss: 0.5771, test_loss: 1.4937, test_f1: 0.4983
 epoch: 76, train_loss: 0.5646, test_loss: 1.5264, test_f1: 0.4912
 epoch: 77, train_loss: 0.5699, test_loss: 1.5433, test_f1: 0.4857
 epoch: 78, train_loss: 0.5615, test_loss: 1.5371, test_f1: 0.4913
 epoch: 79, train_loss: 0.5680, test_loss: 1.5518, test_f1: 0.5011
 epoch: 80, train_loss: 0.5453, test_loss: 1.5924, test_f1: 0.4952
 epoch: 81, train_loss: 0.5672, test_loss: 1.5083, test_f1: 0.5048
 epoch: 82, train_loss: 0.5527, test_loss: 1.4959, test_f1: 0.5002
 epoch: 83, train_loss: 0.5497, test_loss: 1.5889, test_f1: 0.4878
 epoch: 84, train_loss: 0.5453, test_loss: 1.5694, test_f1: 0.4965
 epoch: 85, train_loss: 0.5291, test_loss: 1.5165, test_f1: 0.5083
 epoch: 86, train_loss: 0.5322, test_loss: 1.5488, test_f1: 0.4871
 epoch: 87, train_loss: 0.5253, test_loss: 1.5672, test_f1: 0.5099
 epoch: 88, train_loss: 0.5470, test_loss: 1.6494, test_f1: 0.5003
 epoch: 89, train_loss: 0.5432, test_loss: 1.6598, test_f1: 0.4923
 epoch: 90, train_loss: 0.5252, test_loss: 1.6319, test_f1: 0.5019
 epoch: 91, train_loss: 0.5139, test_loss: 1.6354, test_f1: 0.4974
 epoch: 92, train_loss: 0.5366, test_loss: 1.6477, test_f1: 0.5128
 epoch: 93, train_loss: 0.5080, test_loss: 1.6225, test_f1: 0.4965
 epoch: 94, train_loss: 0.5141, test_loss: 1.5848, test_f1: 0.5188
 epoch: 95, train_loss: 0.5137, test_loss: 1.6531, test_f1: 0.5318
 epoch: 96, train_loss: 0.5078, test_loss: 1.6697, test_f1: 0.5132
 epoch: 97, train_loss: 0.5114, test_loss: 1.6642, test_f1: 0.5264
 epoch: 98, train_loss: 0.5100, test_loss: 1.6545, test_f1: 0.5073
 epoch: 99, train_loss: 0.5065, test_loss: 1.6451, test_f1: 0.5195
##################ITERATION #4 ****************************************
 epoch: 0, train_loss: 1.2984, test_loss: 1.3221, test_f1: 0.2274
 epoch: 1, train_loss: 1.2236, test_loss: 1.2681, test_f1: 0.2499
 epoch: 2, train_loss: 1.2015, test_loss: 1.2169, test_f1: 0.3949
 epoch: 3, train_loss: 1.1814, test_loss: 1.1744, test_f1: 0.4089
 epoch: 4, train_loss: 1.1558, test_loss: 1.1482, test_f1: 0.4307
 epoch: 5, train_loss: 1.1484, test_loss: 1.1257, test_f1: 0.4500
 epoch: 6, train_loss: 1.1275, test_loss: 1.1136, test_f1: 0.4604
 epoch: 7, train_loss: 1.1171, test_loss: 1.1015, test_f1: 0.4676
 epoch: 8, train_loss: 1.0963, test_loss: 1.0913, test_f1: 0.4596
 epoch: 9, train_loss: 1.0775, test_loss: 1.0900, test_f1: 0.4633
 epoch: 10, train_loss: 1.0769, test_loss: 1.0866, test_f1: 0.4592
 epoch: 11, train_loss: 1.0526, test_loss: 1.0953, test_f1: 0.4503
 epoch: 12, train_loss: 1.0457, test_loss: 1.0614, test_f1: 0.4444
 epoch: 13, train_loss: 1.0238, test_loss: 1.0800, test_f1: 0.4363
 epoch: 14, train_loss: 1.0250, test_loss: 1.0468, test_f1: 0.4542
 epoch: 15, train_loss: 1.0105, test_loss: 1.0817, test_f1: 0.4437
 epoch: 16, train_loss: 0.9955, test_loss: 1.0868, test_f1: 0.4440
 epoch: 17, train_loss: 0.9911, test_loss: 1.0399, test_f1: 0.4563
 epoch: 18, train_loss: 0.9796, test_loss: 1.0719, test_f1: 0.4337
 epoch: 19, train_loss: 0.9665, test_loss: 1.0311, test_f1: 0.4621
 epoch: 20, train_loss: 0.9529, test_loss: 1.0603, test_f1: 0.4500
 epoch: 21, train_loss: 0.9305, test_loss: 1.0417, test_f1: 0.4592
 epoch: 22, train_loss: 0.9314, test_loss: 1.0413, test_f1: 0.4721
 epoch: 23, train_loss: 0.9186, test_loss: 1.1041, test_f1: 0.4630
 epoch: 24, train_loss: 0.9062, test_loss: 1.0346, test_f1: 0.4827
 epoch: 25, train_loss: 0.8992, test_loss: 1.0450, test_f1: 0.4564
 epoch: 26, train_loss: 0.8868, test_loss: 1.0573, test_f1: 0.4690
 epoch: 27, train_loss: 0.8757, test_loss: 1.0541, test_f1: 0.4672
 epoch: 28, train_loss: 0.8678, test_loss: 1.1382, test_f1: 0.4685
 epoch: 29, train_loss: 0.8547, test_loss: 1.0556, test_f1: 0.4920
 epoch: 30, train_loss: 0.8460, test_loss: 1.1109, test_f1: 0.4731
 epoch: 31, train_loss: 0.8348, test_loss: 1.1157, test_f1: 0.4574
 epoch: 32, train_loss: 0.8290, test_loss: 1.0845, test_f1: 0.4805
 epoch: 33, train_loss: 0.8316, test_loss: 1.0716, test_f1: 0.4922
 epoch: 34, train_loss: 0.8139, test_loss: 1.0768, test_f1: 0.4859
 epoch: 35, train_loss: 0.8193, test_loss: 1.2923, test_f1: 0.4836
 epoch: 36, train_loss: 0.7982, test_loss: 1.1030, test_f1: 0.4916
 epoch: 37, train_loss: 0.7783, test_loss: 1.0946, test_f1: 0.5010
 epoch: 38, train_loss: 0.7802, test_loss: 1.1128, test_f1: 0.4920
 epoch: 39, train_loss: 0.7700, test_loss: 1.1388, test_f1: 0.4865
 epoch: 40, train_loss: 0.7578, test_loss: 1.2535, test_f1: 0.4795
 epoch: 41, train_loss: 0.7521, test_loss: 1.1724, test_f1: 0.5020
 epoch: 42, train_loss: 0.7650, test_loss: 1.1366, test_f1: 0.5032
 epoch: 43, train_loss: 0.7379, test_loss: 1.1908, test_f1: 0.4962
 epoch: 44, train_loss: 0.7230, test_loss: 1.2318, test_f1: 0.4944
 epoch: 45, train_loss: 0.7327, test_loss: 1.2084, test_f1: 0.5011
 epoch: 46, train_loss: 0.7265, test_loss: 1.3897, test_f1: 0.4953
 epoch: 47, train_loss: 0.7326, test_loss: 1.2699, test_f1: 0.4974
 epoch: 48, train_loss: 0.7099, test_loss: 1.2185, test_f1: 0.4884
 epoch: 49, train_loss: 0.7028, test_loss: 1.3088, test_f1: 0.4982
 epoch: 50, train_loss: 0.6853, test_loss: 1.2355, test_f1: 0.5098
 epoch: 51, train_loss: 0.6833, test_loss: 1.2656, test_f1: 0.5060
 epoch: 52, train_loss: 0.6525, test_loss: 1.4325, test_f1: 0.4883
 epoch: 53, train_loss: 0.6709, test_loss: 1.2966, test_f1: 0.5048
 epoch: 54, train_loss: 0.6735, test_loss: 1.3180, test_f1: 0.4954
 epoch: 55, train_loss: 0.6635, test_loss: 1.3524, test_f1: 0.4871
 epoch: 56, train_loss: 0.6577, test_loss: 1.2955, test_f1: 0.4961
 epoch: 57, train_loss: 0.6559, test_loss: 1.2840, test_f1: 0.4926
 epoch: 58, train_loss: 0.6454, test_loss: 1.3237, test_f1: 0.4983
 epoch: 59, train_loss: 0.6532, test_loss: 1.4186, test_f1: 0.4897
 epoch: 60, train_loss: 0.6495, test_loss: 1.3658, test_f1: 0.4921
 epoch: 61, train_loss: 0.6462, test_loss: 1.2967, test_f1: 0.5022
 epoch: 62, train_loss: 0.6398, test_loss: 1.3066, test_f1: 0.4961
 epoch: 63, train_loss: 0.6266, test_loss: 1.3575, test_f1: 0.4912
 epoch: 64, train_loss: 0.6362, test_loss: 1.3793, test_f1: 0.4967
 epoch: 65, train_loss: 0.6250, test_loss: 1.4405, test_f1: 0.4799
 epoch: 66, train_loss: 0.6258, test_loss: 1.3046, test_f1: 0.5028
 epoch: 67, train_loss: 0.6083, test_loss: 1.3383, test_f1: 0.5029
 epoch: 68, train_loss: 0.6160, test_loss: 1.5539, test_f1: 0.4913
 epoch: 69, train_loss: 0.6057, test_loss: 1.3686, test_f1: 0.5055
 epoch: 70, train_loss: 0.5990, test_loss: 1.3449, test_f1: 0.5016
 epoch: 71, train_loss: 0.6050, test_loss: 1.3427, test_f1: 0.5015
 epoch: 72, train_loss: 0.6073, test_loss: 1.4111, test_f1: 0.5039
 epoch: 73, train_loss: 0.5957, test_loss: 1.3642, test_f1: 0.5076
 epoch: 74, train_loss: 0.5997, test_loss: 1.4261, test_f1: 0.4895
 epoch: 75, train_loss: 0.6018, test_loss: 1.5096, test_f1: 0.4939
 epoch: 76, train_loss: 0.5889, test_loss: 1.4003, test_f1: 0.5103
 epoch: 77, train_loss: 0.5972, test_loss: 1.3763, test_f1: 0.5159
 epoch: 78, train_loss: 0.5986, test_loss: 1.4075, test_f1: 0.5072
 epoch: 79, train_loss: 0.5845, test_loss: 1.5768, test_f1: 0.4953
 epoch: 80, train_loss: 0.5804, test_loss: 1.5046, test_f1: 0.4971
 epoch: 81, train_loss: 0.5755, test_loss: 1.4487, test_f1: 0.5042
 epoch: 82, train_loss: 0.5953, test_loss: 1.4329, test_f1: 0.5024
 epoch: 83, train_loss: 0.5873, test_loss: 1.4523, test_f1: 0.4981
 epoch: 84, train_loss: 0.5766, test_loss: 1.4067, test_f1: 0.5191
 epoch: 85, train_loss: 0.5667, test_loss: 1.4118, test_f1: 0.5113
 epoch: 86, train_loss: 0.5555, test_loss: 1.4185, test_f1: 0.5075
 epoch: 87, train_loss: 0.5842, test_loss: 1.4451, test_f1: 0.5124
 epoch: 88, train_loss: 0.5388, test_loss: 1.4745, test_f1: 0.5105
 epoch: 89, train_loss: 0.5451, test_loss: 1.4475, test_f1: 0.5070
 epoch: 90, train_loss: 0.5519, test_loss: 1.4443, test_f1: 0.5094
 epoch: 91, train_loss: 0.5429, test_loss: 1.5179, test_f1: 0.4957
 epoch: 92, train_loss: 0.5578, test_loss: 1.4837, test_f1: 0.5233
 epoch: 93, train_loss: 0.5394, test_loss: 1.6224, test_f1: 0.5049
 epoch: 94, train_loss: 0.5573, test_loss: 1.4996, test_f1: 0.5089
 epoch: 95, train_loss: 0.5529, test_loss: 1.4803, test_f1: 0.5056
 epoch: 96, train_loss: 0.5395, test_loss: 1.4924, test_f1: 0.5126
 epoch: 97, train_loss: 0.5393, test_loss: 1.6640, test_f1: 0.4965
 epoch: 98, train_loss: 0.5377, test_loss: 1.4963, test_f1: 0.5199
 epoch: 99, train_loss: 0.5414, test_loss: 1.4739, test_f1: 0.5261
##################ITERATION #5 ****************************************
 epoch: 0, train_loss: 1.3149, test_loss: 1.3094, test_f1: 0.2603
 epoch: 1, train_loss: 1.2265, test_loss: 1.2675, test_f1: 0.2592
 epoch: 2, train_loss: 1.2000, test_loss: 1.2130, test_f1: 0.2937
 epoch: 3, train_loss: 1.1738, test_loss: 1.1757, test_f1: 0.3751
 epoch: 4, train_loss: 1.1580, test_loss: 1.1425, test_f1: 0.4387
 epoch: 5, train_loss: 1.1340, test_loss: 1.1239, test_f1: 0.4349
 epoch: 6, train_loss: 1.1257, test_loss: 1.1075, test_f1: 0.4331
 epoch: 7, train_loss: 1.1112, test_loss: 1.1093, test_f1: 0.4177
 epoch: 8, train_loss: 1.1006, test_loss: 1.1299, test_f1: 0.4224
 epoch: 9, train_loss: 1.0871, test_loss: 1.1090, test_f1: 0.4365
 epoch: 10, train_loss: 1.0651, test_loss: 1.1113, test_f1: 0.4539
 epoch: 11, train_loss: 1.0620, test_loss: 1.1017, test_f1: 0.4495
 epoch: 12, train_loss: 1.0444, test_loss: 1.0782, test_f1: 0.4406
 epoch: 13, train_loss: 1.0311, test_loss: 1.0753, test_f1: 0.4363
 epoch: 14, train_loss: 1.0273, test_loss: 1.0708, test_f1: 0.4491
 epoch: 15, train_loss: 1.0098, test_loss: 1.0632, test_f1: 0.4588
 epoch: 16, train_loss: 0.9986, test_loss: 1.0494, test_f1: 0.4706
 epoch: 17, train_loss: 0.9923, test_loss: 1.0369, test_f1: 0.4667
 epoch: 18, train_loss: 0.9680, test_loss: 1.0376, test_f1: 0.4590
 epoch: 19, train_loss: 0.9604, test_loss: 1.0341, test_f1: 0.4630
 epoch: 20, train_loss: 0.9485, test_loss: 1.0315, test_f1: 0.4805
 epoch: 21, train_loss: 0.9291, test_loss: 1.0364, test_f1: 0.4813
 epoch: 22, train_loss: 0.9218, test_loss: 1.0220, test_f1: 0.4758
 epoch: 23, train_loss: 0.9224, test_loss: 1.0302, test_f1: 0.4815
 epoch: 24, train_loss: 0.9020, test_loss: 1.0140, test_f1: 0.4818
 epoch: 25, train_loss: 0.8938, test_loss: 1.0143, test_f1: 0.4761
 epoch: 26, train_loss: 0.8892, test_loss: 1.0172, test_f1: 0.4787
 epoch: 27, train_loss: 0.8649, test_loss: 1.0284, test_f1: 0.4804
 epoch: 28, train_loss: 0.8611, test_loss: 1.0555, test_f1: 0.4741
 epoch: 29, train_loss: 0.8449, test_loss: 1.0408, test_f1: 0.4806
 epoch: 30, train_loss: 0.8441, test_loss: 1.0581, test_f1: 0.4778
 epoch: 31, train_loss: 0.8311, test_loss: 1.0528, test_f1: 0.4869
 epoch: 32, train_loss: 0.8199, test_loss: 1.0769, test_f1: 0.4822
 epoch: 33, train_loss: 0.8069, test_loss: 1.0692, test_f1: 0.4719
 epoch: 34, train_loss: 0.8066, test_loss: 1.0774, test_f1: 0.4886
 epoch: 35, train_loss: 0.7934, test_loss: 1.0879, test_f1: 0.4723
 epoch: 36, train_loss: 0.7969, test_loss: 1.0915, test_f1: 0.4729
 epoch: 37, train_loss: 0.7762, test_loss: 1.1311, test_f1: 0.4651
 epoch: 38, train_loss: 0.7694, test_loss: 1.1227, test_f1: 0.4807
 epoch: 39, train_loss: 0.7701, test_loss: 1.1086, test_f1: 0.4799
 epoch: 40, train_loss: 0.7629, test_loss: 1.1339, test_f1: 0.4839
 epoch: 41, train_loss: 0.7425, test_loss: 1.1363, test_f1: 0.4599
 epoch: 42, train_loss: 0.7303, test_loss: 1.1288, test_f1: 0.4999
 epoch: 43, train_loss: 0.7175, test_loss: 1.1644, test_f1: 0.4646
 epoch: 44, train_loss: 0.7296, test_loss: 1.1379, test_f1: 0.4822
 epoch: 45, train_loss: 0.7029, test_loss: 1.1391, test_f1: 0.5073
 epoch: 46, train_loss: 0.7137, test_loss: 1.1878, test_f1: 0.4874
 epoch: 47, train_loss: 0.7163, test_loss: 1.1850, test_f1: 0.4861
 epoch: 48, train_loss: 0.6966, test_loss: 1.2135, test_f1: 0.4737
 epoch: 49, train_loss: 0.7023, test_loss: 1.1783, test_f1: 0.4903
 epoch: 50, train_loss: 0.6807, test_loss: 1.1964, test_f1: 0.4869
 epoch: 51, train_loss: 0.6546, test_loss: 1.2414, test_f1: 0.4819
 epoch: 52, train_loss: 0.6561, test_loss: 1.2280, test_f1: 0.4985
 epoch: 53, train_loss: 0.6627, test_loss: 1.2354, test_f1: 0.4975
 epoch: 54, train_loss: 0.6436, test_loss: 1.1969, test_f1: 0.4951
 epoch: 55, train_loss: 0.6500, test_loss: 1.2107, test_f1: 0.5002
 epoch: 56, train_loss: 0.6268, test_loss: 1.2430, test_f1: 0.4925
 epoch: 57, train_loss: 0.6286, test_loss: 1.2360, test_f1: 0.4872
 epoch: 58, train_loss: 0.6322, test_loss: 1.2826, test_f1: 0.4946
 epoch: 59, train_loss: 0.6288, test_loss: 1.2720, test_f1: 0.4940
 epoch: 60, train_loss: 0.6238, test_loss: 1.2757, test_f1: 0.5044
 epoch: 61, train_loss: 0.6384, test_loss: 1.2269, test_f1: 0.5006
 epoch: 62, train_loss: 0.6236, test_loss: 1.2561, test_f1: 0.5076
 epoch: 63, train_loss: 0.6296, test_loss: 1.2682, test_f1: 0.4999
 epoch: 64, train_loss: 0.6208, test_loss: 1.2338, test_f1: 0.5206
 epoch: 65, train_loss: 0.6212, test_loss: 1.2526, test_f1: 0.5116
 epoch: 66, train_loss: 0.6077, test_loss: 1.3053, test_f1: 0.4927
 epoch: 67, train_loss: 0.6024, test_loss: 1.3227, test_f1: 0.4887
 epoch: 68, train_loss: 0.6017, test_loss: 1.3380, test_f1: 0.4970
 epoch: 69, train_loss: 0.6002, test_loss: 1.3108, test_f1: 0.5044
 epoch: 70, train_loss: 0.6037, test_loss: 1.2771, test_f1: 0.5074
 epoch: 71, train_loss: 0.6022, test_loss: 1.2665, test_f1: 0.5106
 epoch: 72, train_loss: 0.5998, test_loss: 1.2879, test_f1: 0.5031
 epoch: 73, train_loss: 0.5876, test_loss: 1.3023, test_f1: 0.5074
 epoch: 74, train_loss: 0.5758, test_loss: 1.3349, test_f1: 0.5029
 epoch: 75, train_loss: 0.5691, test_loss: 1.2965, test_f1: 0.5015
 epoch: 76, train_loss: 0.5724, test_loss: 1.2790, test_f1: 0.5028
 epoch: 77, train_loss: 0.5657, test_loss: 1.2860, test_f1: 0.5131
 epoch: 78, train_loss: 0.5649, test_loss: 1.3305, test_f1: 0.5079
 epoch: 79, train_loss: 0.5707, test_loss: 1.3780, test_f1: 0.5058
 epoch: 80, train_loss: 0.5718, test_loss: 1.3255, test_f1: 0.5003
 epoch: 81, train_loss: 0.5568, test_loss: 1.3467, test_f1: 0.5177
 epoch: 82, train_loss: 0.5731, test_loss: 1.3527, test_f1: 0.4937
 epoch: 83, train_loss: 0.5571, test_loss: 1.3540, test_f1: 0.5155
 epoch: 84, train_loss: 0.5719, test_loss: 1.2952, test_f1: 0.5158
 epoch: 85, train_loss: 0.5443, test_loss: 1.3141, test_f1: 0.5124
 epoch: 86, train_loss: 0.5432, test_loss: 1.3735, test_f1: 0.5002
 epoch: 87, train_loss: 0.5655, test_loss: 1.3211, test_f1: 0.5018
 epoch: 88, train_loss: 0.5516, test_loss: 1.3277, test_f1: 0.5279
 epoch: 89, train_loss: 0.5473, test_loss: 1.3589, test_f1: 0.5134
 epoch: 90, train_loss: 0.5360, test_loss: 1.3801, test_f1: 0.5192
 epoch: 91, train_loss: 0.5240, test_loss: 1.3866, test_f1: 0.5118
 epoch: 92, train_loss: 0.5284, test_loss: 1.3882, test_f1: 0.5068
 epoch: 93, train_loss: 0.5463, test_loss: 1.3721, test_f1: 0.5225
 epoch: 94, train_loss: 0.5406, test_loss: 1.3915, test_f1: 0.5205
 epoch: 95, train_loss: 0.5187, test_loss: 1.3541, test_f1: 0.5170
 epoch: 96, train_loss: 0.5187, test_loss: 1.3518, test_f1: 0.5208
 epoch: 97, train_loss: 0.5176, test_loss: 1.3774, test_f1: 0.5243
 epoch: 98, train_loss: 0.5291, test_loss: 1.3915, test_f1: 0.5281
 epoch: 99, train_loss: 0.5169, test_loss: 1.3828, test_f1: 0.5196
##################ITERATION #6 ****************************************
 epoch: 0, train_loss: 1.3245, test_loss: 1.3145, test_f1: 0.2730
 epoch: 1, train_loss: 1.2099, test_loss: 1.2423, test_f1: 0.4004
 epoch: 2, train_loss: 1.1824, test_loss: 1.1770, test_f1: 0.4467
 epoch: 3, train_loss: 1.1488, test_loss: 1.1385, test_f1: 0.4425
 epoch: 4, train_loss: 1.1394, test_loss: 1.1203, test_f1: 0.4340
 epoch: 5, train_loss: 1.1175, test_loss: 1.1065, test_f1: 0.4551
 epoch: 6, train_loss: 1.1042, test_loss: 1.0885, test_f1: 0.4610
 epoch: 7, train_loss: 1.0899, test_loss: 1.0696, test_f1: 0.4743
 epoch: 8, train_loss: 1.0753, test_loss: 1.0542, test_f1: 0.4746
 epoch: 9, train_loss: 1.0717, test_loss: 1.0490, test_f1: 0.4614
 epoch: 10, train_loss: 1.0506, test_loss: 1.0434, test_f1: 0.4474
 epoch: 11, train_loss: 1.0329, test_loss: 1.0431, test_f1: 0.4544
 epoch: 12, train_loss: 1.0216, test_loss: 1.0444, test_f1: 0.4530
 epoch: 13, train_loss: 1.0064, test_loss: 1.0343, test_f1: 0.4565
 epoch: 14, train_loss: 1.0009, test_loss: 1.0337, test_f1: 0.4622
 epoch: 15, train_loss: 0.9859, test_loss: 1.0331, test_f1: 0.4591
 epoch: 16, train_loss: 0.9795, test_loss: 1.0264, test_f1: 0.4751
 epoch: 17, train_loss: 0.9739, test_loss: 1.0297, test_f1: 0.4800
 epoch: 18, train_loss: 0.9679, test_loss: 1.0319, test_f1: 0.4751
 epoch: 19, train_loss: 0.9462, test_loss: 1.0418, test_f1: 0.4734
 epoch: 20, train_loss: 0.9457, test_loss: 1.0417, test_f1: 0.4640
 epoch: 21, train_loss: 0.9368, test_loss: 1.0397, test_f1: 0.4859
 epoch: 22, train_loss: 0.9138, test_loss: 1.0574, test_f1: 0.4738
 epoch: 23, train_loss: 0.9157, test_loss: 1.0412, test_f1: 0.4798
 epoch: 24, train_loss: 0.9083, test_loss: 1.0437, test_f1: 0.4860
 epoch: 25, train_loss: 0.9080, test_loss: 1.0267, test_f1: 0.4886
 epoch: 26, train_loss: 0.8866, test_loss: 1.0455, test_f1: 0.4941
 epoch: 27, train_loss: 0.8716, test_loss: 1.0504, test_f1: 0.4734
 epoch: 28, train_loss: 0.8688, test_loss: 1.0497, test_f1: 0.4995
 epoch: 29, train_loss: 0.8669, test_loss: 1.0712, test_f1: 0.4986
 epoch: 30, train_loss: 0.8519, test_loss: 1.0651, test_f1: 0.4812
 epoch: 31, train_loss: 0.8510, test_loss: 1.0534, test_f1: 0.4902
 epoch: 32, train_loss: 0.8350, test_loss: 1.1038, test_f1: 0.4889
 epoch: 33, train_loss: 0.8343, test_loss: 1.0756, test_f1: 0.5156
 epoch: 34, train_loss: 0.8280, test_loss: 1.1078, test_f1: 0.4845
 epoch: 35, train_loss: 0.8157, test_loss: 1.0949, test_f1: 0.4894
 epoch: 36, train_loss: 0.8116, test_loss: 1.1054, test_f1: 0.5033
 epoch: 37, train_loss: 0.8114, test_loss: 1.1501, test_f1: 0.4809
 epoch: 38, train_loss: 0.7980, test_loss: 1.1363, test_f1: 0.4931
 epoch: 39, train_loss: 0.7810, test_loss: 1.1335, test_f1: 0.4943
 epoch: 40, train_loss: 0.7750, test_loss: 1.1209, test_f1: 0.5009
 epoch: 41, train_loss: 0.7724, test_loss: 1.1407, test_f1: 0.4951
 epoch: 42, train_loss: 0.7652, test_loss: 1.1625, test_f1: 0.4963
 epoch: 43, train_loss: 0.7548, test_loss: 1.1368, test_f1: 0.5026
 epoch: 44, train_loss: 0.7425, test_loss: 1.2035, test_f1: 0.5019
 epoch: 45, train_loss: 0.7350, test_loss: 1.2366, test_f1: 0.4852
 epoch: 46, train_loss: 0.7381, test_loss: 1.1983, test_f1: 0.4991
 epoch: 47, train_loss: 0.7219, test_loss: 1.2484, test_f1: 0.5011
 epoch: 48, train_loss: 0.7196, test_loss: 1.3321, test_f1: 0.4870
 epoch: 49, train_loss: 0.7197, test_loss: 1.3296, test_f1: 0.4997
 epoch: 50, train_loss: 0.6981, test_loss: 1.2848, test_f1: 0.5084
 epoch: 51, train_loss: 0.6920, test_loss: 1.2871, test_f1: 0.4871
 epoch: 52, train_loss: 0.6992, test_loss: 1.2785, test_f1: 0.4991
 epoch: 53, train_loss: 0.6769, test_loss: 1.3271, test_f1: 0.5064
 epoch: 54, train_loss: 0.6741, test_loss: 1.2669, test_f1: 0.5069
 epoch: 55, train_loss: 0.6793, test_loss: 1.2946, test_f1: 0.4918
 epoch: 56, train_loss: 0.6671, test_loss: 1.2921, test_f1: 0.5149
 epoch: 57, train_loss: 0.6684, test_loss: 1.3220, test_f1: 0.4923
 epoch: 58, train_loss: 0.6630, test_loss: 1.3349, test_f1: 0.5030
 epoch: 59, train_loss: 0.6528, test_loss: 1.3432, test_f1: 0.5000
 epoch: 60, train_loss: 0.6547, test_loss: 1.3708, test_f1: 0.4971
 epoch: 61, train_loss: 0.6422, test_loss: 1.3327, test_f1: 0.5051
 epoch: 62, train_loss: 0.6510, test_loss: 1.3172, test_f1: 0.4873
 epoch: 63, train_loss: 0.6556, test_loss: 1.3314, test_f1: 0.5082
 epoch: 64, train_loss: 0.6435, test_loss: 1.3537, test_f1: 0.5154
 epoch: 65, train_loss: 0.6311, test_loss: 1.3381, test_f1: 0.5159
 epoch: 66, train_loss: 0.6515, test_loss: 1.3266, test_f1: 0.5227
 epoch: 67, train_loss: 0.6393, test_loss: 1.3524, test_f1: 0.5077
 epoch: 68, train_loss: 0.6398, test_loss: 1.3570, test_f1: 0.5260
 epoch: 69, train_loss: 0.6312, test_loss: 1.3683, test_f1: 0.5338
 epoch: 70, train_loss: 0.6257, test_loss: 1.3513, test_f1: 0.5085
 epoch: 71, train_loss: 0.6326, test_loss: 1.3565, test_f1: 0.5133
 epoch: 72, train_loss: 0.6345, test_loss: 1.3952, test_f1: 0.5128
 epoch: 73, train_loss: 0.6191, test_loss: 1.3939, test_f1: 0.5122
 epoch: 74, train_loss: 0.6248, test_loss: 1.3919, test_f1: 0.5172
 epoch: 75, train_loss: 0.6156, test_loss: 1.4002, test_f1: 0.5173
 epoch: 76, train_loss: 0.6084, test_loss: 1.3698, test_f1: 0.5228
 epoch: 77, train_loss: 0.5925, test_loss: 1.4572, test_f1: 0.4952
 epoch: 78, train_loss: 0.5974, test_loss: 1.4554, test_f1: 0.5007
 epoch: 79, train_loss: 0.6132, test_loss: 1.4215, test_f1: 0.5116
 epoch: 80, train_loss: 0.5960, test_loss: 1.4515, test_f1: 0.5033
 epoch: 81, train_loss: 0.5933, test_loss: 1.4388, test_f1: 0.5201
 epoch: 82, train_loss: 0.5787, test_loss: 1.4191, test_f1: 0.5190
 epoch: 83, train_loss: 0.5810, test_loss: 1.4306, test_f1: 0.5105
 epoch: 84, train_loss: 0.5744, test_loss: 1.4466, test_f1: 0.5308
 epoch: 85, train_loss: 0.5646, test_loss: 1.4444, test_f1: 0.5083
 epoch: 86, train_loss: 0.5687, test_loss: 1.4370, test_f1: 0.5141
 epoch: 87, train_loss: 0.5701, test_loss: 1.4400, test_f1: 0.5069
 epoch: 88, train_loss: 0.5750, test_loss: 1.4393, test_f1: 0.5230
 epoch: 89, train_loss: 0.5610, test_loss: 1.4646, test_f1: 0.5067
 epoch: 90, train_loss: 0.5711, test_loss: 1.4885, test_f1: 0.5170
 epoch: 91, train_loss: 0.5696, test_loss: 1.4721, test_f1: 0.5211
 epoch: 92, train_loss: 0.5614, test_loss: 1.4590, test_f1: 0.5272
 epoch: 93, train_loss: 0.5634, test_loss: 1.4976, test_f1: 0.5230
 epoch: 94, train_loss: 0.5677, test_loss: 1.5147, test_f1: 0.5179
 epoch: 95, train_loss: 0.5622, test_loss: 1.5200, test_f1: 0.5047
 epoch: 96, train_loss: 0.5566, test_loss: 1.5295, test_f1: 0.5112
 epoch: 97, train_loss: 0.5573, test_loss: 1.5568, test_f1: 0.5106
 epoch: 98, train_loss: 0.5536, test_loss: 1.5003, test_f1: 0.5009
 epoch: 99, train_loss: 0.5518, test_loss: 1.5258, test_f1: 0.5170
##################ITERATION #7 ****************************************
 epoch: 0, train_loss: 1.3169, test_loss: 1.3113, test_f1: 0.2327
 epoch: 1, train_loss: 1.2256, test_loss: 1.2626, test_f1: 0.2826
 epoch: 2, train_loss: 1.1971, test_loss: 1.2074, test_f1: 0.3761
 epoch: 3, train_loss: 1.1748, test_loss: 1.1439, test_f1: 0.4438
 epoch: 4, train_loss: 1.1483, test_loss: 1.1153, test_f1: 0.4500
 epoch: 5, train_loss: 1.1385, test_loss: 1.0947, test_f1: 0.4691
 epoch: 6, train_loss: 1.1016, test_loss: 1.0891, test_f1: 0.4650
 epoch: 7, train_loss: 1.1173, test_loss: 1.0849, test_f1: 0.4711
 epoch: 8, train_loss: 1.0881, test_loss: 1.0704, test_f1: 0.4900
 epoch: 9, train_loss: 1.0718, test_loss: 1.0635, test_f1: 0.4866
 epoch: 10, train_loss: 1.0585, test_loss: 1.0583, test_f1: 0.4866
 epoch: 11, train_loss: 1.0604, test_loss: 1.0532, test_f1: 0.4795
 epoch: 12, train_loss: 1.0390, test_loss: 1.0440, test_f1: 0.4866
 epoch: 13, train_loss: 1.0244, test_loss: 1.0401, test_f1: 0.4691
 epoch: 14, train_loss: 1.0156, test_loss: 1.0352, test_f1: 0.4641
 epoch: 15, train_loss: 1.0046, test_loss: 1.0306, test_f1: 0.4717
 epoch: 16, train_loss: 0.9981, test_loss: 1.0346, test_f1: 0.4814
 epoch: 17, train_loss: 0.9851, test_loss: 1.0275, test_f1: 0.4722
 epoch: 18, train_loss: 0.9742, test_loss: 1.0213, test_f1: 0.4932
 epoch: 19, train_loss: 0.9642, test_loss: 1.0241, test_f1: 0.4950
 epoch: 20, train_loss: 0.9589, test_loss: 1.0289, test_f1: 0.4824
 epoch: 21, train_loss: 0.9452, test_loss: 1.0174, test_f1: 0.4885
 epoch: 22, train_loss: 0.9392, test_loss: 1.0166, test_f1: 0.4958
 epoch: 23, train_loss: 0.9259, test_loss: 1.0135, test_f1: 0.5060
 epoch: 24, train_loss: 0.9052, test_loss: 1.0076, test_f1: 0.5088
 epoch: 25, train_loss: 0.8990, test_loss: 1.0066, test_f1: 0.5026
 epoch: 26, train_loss: 0.8974, test_loss: 1.0005, test_f1: 0.4989
 epoch: 27, train_loss: 0.8914, test_loss: 0.9962, test_f1: 0.5217
 epoch: 28, train_loss: 0.8804, test_loss: 1.0144, test_f1: 0.5095
 epoch: 29, train_loss: 0.8644, test_loss: 0.9912, test_f1: 0.5307
 epoch: 30, train_loss: 0.8604, test_loss: 1.0049, test_f1: 0.5329
 epoch: 31, train_loss: 0.8413, test_loss: 1.0116, test_f1: 0.4935
 epoch: 32, train_loss: 0.8396, test_loss: 1.0272, test_f1: 0.5138
 epoch: 33, train_loss: 0.8210, test_loss: 1.0170, test_f1: 0.5191
 epoch: 34, train_loss: 0.8204, test_loss: 1.0122, test_f1: 0.5257
 epoch: 35, train_loss: 0.7976, test_loss: 1.0292, test_f1: 0.5259
 epoch: 36, train_loss: 0.8096, test_loss: 1.0235, test_f1: 0.5220
 epoch: 37, train_loss: 0.8030, test_loss: 1.0357, test_f1: 0.5187
 epoch: 38, train_loss: 0.7915, test_loss: 1.0361, test_f1: 0.5260
 epoch: 39, train_loss: 0.7799, test_loss: 1.0322, test_f1: 0.5226
 epoch: 40, train_loss: 0.7692, test_loss: 1.0449, test_f1: 0.5188
 epoch: 41, train_loss: 0.7658, test_loss: 1.0476, test_f1: 0.5241
 epoch: 42, train_loss: 0.7685, test_loss: 1.0920, test_f1: 0.5094
 epoch: 43, train_loss: 0.7558, test_loss: 1.0651, test_f1: 0.5149
 epoch: 44, train_loss: 0.7470, test_loss: 1.0446, test_f1: 0.5302
 epoch: 45, train_loss: 0.7365, test_loss: 1.0623, test_f1: 0.5303
 epoch: 46, train_loss: 0.7330, test_loss: 1.0910, test_f1: 0.5375
 epoch: 47, train_loss: 0.7175, test_loss: 1.0891, test_f1: 0.5232
 epoch: 48, train_loss: 0.7177, test_loss: 1.0878, test_f1: 0.5218
 epoch: 49, train_loss: 0.7101, test_loss: 1.0963, test_f1: 0.5089
 epoch: 50, train_loss: 0.6868, test_loss: 1.1426, test_f1: 0.5366
 epoch: 51, train_loss: 0.6750, test_loss: 1.1097, test_f1: 0.5537
 epoch: 52, train_loss: 0.6755, test_loss: 1.1235, test_f1: 0.5365
 epoch: 53, train_loss: 0.6544, test_loss: 1.1432, test_f1: 0.5282
 epoch: 54, train_loss: 0.6460, test_loss: 1.1399, test_f1: 0.5254
 epoch: 55, train_loss: 0.6457, test_loss: 1.1439, test_f1: 0.5478
 epoch: 56, train_loss: 0.6615, test_loss: 1.1594, test_f1: 0.5128
 epoch: 57, train_loss: 0.6408, test_loss: 1.1759, test_f1: 0.5299
 epoch: 58, train_loss: 0.6428, test_loss: 1.1799, test_f1: 0.5167
 epoch: 59, train_loss: 0.6260, test_loss: 1.1815, test_f1: 0.5326
 epoch: 60, train_loss: 0.6211, test_loss: 1.2099, test_f1: 0.5318
 epoch: 61, train_loss: 0.6323, test_loss: 1.1994, test_f1: 0.5270
 epoch: 62, train_loss: 0.6159, test_loss: 1.1907, test_f1: 0.5296
 epoch: 63, train_loss: 0.6285, test_loss: 1.2058, test_f1: 0.5248
 epoch: 64, train_loss: 0.6352, test_loss: 1.2138, test_f1: 0.5193
 epoch: 65, train_loss: 0.6137, test_loss: 1.2217, test_f1: 0.5082
 epoch: 66, train_loss: 0.6118, test_loss: 1.2389, test_f1: 0.5210
 epoch: 67, train_loss: 0.6196, test_loss: 1.2399, test_f1: 0.5142
 epoch: 68, train_loss: 0.6101, test_loss: 1.2135, test_f1: 0.5111
 epoch: 69, train_loss: 0.6059, test_loss: 1.2452, test_f1: 0.5241
 epoch: 70, train_loss: 0.6029, test_loss: 1.2501, test_f1: 0.5120
 epoch: 71, train_loss: 0.6097, test_loss: 1.2578, test_f1: 0.5224
 epoch: 72, train_loss: 0.5963, test_loss: 1.2634, test_f1: 0.5130
 epoch: 73, train_loss: 0.5957, test_loss: 1.2617, test_f1: 0.5272
 epoch: 74, train_loss: 0.5836, test_loss: 1.2551, test_f1: 0.5121
 epoch: 75, train_loss: 0.5917, test_loss: 1.2771, test_f1: 0.5084
 epoch: 76, train_loss: 0.5769, test_loss: 1.3098, test_f1: 0.5300
 epoch: 77, train_loss: 0.5762, test_loss: 1.2939, test_f1: 0.5262
 epoch: 78, train_loss: 0.5774, test_loss: 1.3095, test_f1: 0.5197
 epoch: 79, train_loss: 0.5912, test_loss: 1.3521, test_f1: 0.5203
 epoch: 80, train_loss: 0.5673, test_loss: 1.3088, test_f1: 0.5266
 epoch: 81, train_loss: 0.5819, test_loss: 1.3408, test_f1: 0.5202
 epoch: 82, train_loss: 0.5577, test_loss: 1.3411, test_f1: 0.5493
 epoch: 83, train_loss: 0.5689, test_loss: 1.3218, test_f1: 0.5314
 epoch: 84, train_loss: 0.5469, test_loss: 1.3483, test_f1: 0.5276
 epoch: 85, train_loss: 0.5514, test_loss: 1.3726, test_f1: 0.5096
 epoch: 86, train_loss: 0.5620, test_loss: 1.4065, test_f1: 0.5234
 epoch: 87, train_loss: 0.5492, test_loss: 1.3900, test_f1: 0.5279
 epoch: 88, train_loss: 0.5475, test_loss: 1.3821, test_f1: 0.5172
 epoch: 89, train_loss: 0.5555, test_loss: 1.3669, test_f1: 0.5323
 epoch: 90, train_loss: 0.5623, test_loss: 1.3715, test_f1: 0.5334
 epoch: 91, train_loss: 0.5393, test_loss: 1.4103, test_f1: 0.5173
 epoch: 92, train_loss: 0.5170, test_loss: 1.4174, test_f1: 0.5235
 epoch: 93, train_loss: 0.5461, test_loss: 1.4218, test_f1: 0.5172
 epoch: 94, train_loss: 0.5387, test_loss: 1.4357, test_f1: 0.5136
 epoch: 95, train_loss: 0.5335, test_loss: 1.4161, test_f1: 0.5233
 epoch: 96, train_loss: 0.5371, test_loss: 1.3908, test_f1: 0.5091
 epoch: 97, train_loss: 0.5408, test_loss: 1.4244, test_f1: 0.5193
 epoch: 98, train_loss: 0.5206, test_loss: 1.4223, test_f1: 0.5264
 epoch: 99, train_loss: 0.5329, test_loss: 1.4224, test_f1: 0.5155
##################ITERATION #8 ****************************************
 epoch: 0, train_loss: 1.3624, test_loss: 1.3066, test_f1: 0.2612
 epoch: 1, train_loss: 1.2601, test_loss: 1.2539, test_f1: 0.2442
 epoch: 2, train_loss: 1.2283, test_loss: 1.1976, test_f1: 0.3723
 epoch: 3, train_loss: 1.1976, test_loss: 1.1577, test_f1: 0.4081
 epoch: 4, train_loss: 1.1771, test_loss: 1.1325, test_f1: 0.4586
 epoch: 5, train_loss: 1.1603, test_loss: 1.1177, test_f1: 0.4622
 epoch: 6, train_loss: 1.1302, test_loss: 1.1075, test_f1: 0.4697
 epoch: 7, train_loss: 1.1319, test_loss: 1.0931, test_f1: 0.4743
 epoch: 8, train_loss: 1.1098, test_loss: 1.0826, test_f1: 0.4824
 epoch: 9, train_loss: 1.1099, test_loss: 1.0750, test_f1: 0.4686
 epoch: 10, train_loss: 1.0859, test_loss: 1.0682, test_f1: 0.4659
 epoch: 11, train_loss: 1.0868, test_loss: 1.0709, test_f1: 0.4619
 epoch: 12, train_loss: 1.0693, test_loss: 1.0590, test_f1: 0.4701
 epoch: 13, train_loss: 1.0547, test_loss: 1.0519, test_f1: 0.4740
 epoch: 14, train_loss: 1.0405, test_loss: 1.0393, test_f1: 0.4776
 epoch: 15, train_loss: 1.0402, test_loss: 1.0347, test_f1: 0.5042
 epoch: 16, train_loss: 1.0271, test_loss: 1.0330, test_f1: 0.5048
 epoch: 17, train_loss: 1.0212, test_loss: 1.0258, test_f1: 0.5044
 epoch: 18, train_loss: 1.0142, test_loss: 1.0271, test_f1: 0.4741
 epoch: 19, train_loss: 0.9901, test_loss: 1.0205, test_f1: 0.4887
 epoch: 20, train_loss: 0.9798, test_loss: 1.0122, test_f1: 0.4804
 epoch: 21, train_loss: 0.9825, test_loss: 1.0026, test_f1: 0.5098
 epoch: 22, train_loss: 0.9799, test_loss: 1.0142, test_f1: 0.4862
 epoch: 23, train_loss: 0.9566, test_loss: 1.0181, test_f1: 0.4798
 epoch: 24, train_loss: 0.9495, test_loss: 1.0009, test_f1: 0.4869
 epoch: 25, train_loss: 0.9371, test_loss: 1.0003, test_f1: 0.4929
 epoch: 26, train_loss: 0.9418, test_loss: 1.0052, test_f1: 0.5029
 epoch: 27, train_loss: 0.9262, test_loss: 1.0090, test_f1: 0.5043
 epoch: 28, train_loss: 0.9084, test_loss: 1.0139, test_f1: 0.4963
 epoch: 29, train_loss: 0.9030, test_loss: 1.0150, test_f1: 0.4948
 epoch: 30, train_loss: 0.9055, test_loss: 1.0091, test_f1: 0.4862
 epoch: 31, train_loss: 0.8788, test_loss: 1.0458, test_f1: 0.5017
 epoch: 32, train_loss: 0.8749, test_loss: 1.0157, test_f1: 0.4984
 epoch: 33, train_loss: 0.8721, test_loss: 1.0163, test_f1: 0.4988
 epoch: 34, train_loss: 0.8551, test_loss: 1.0270, test_f1: 0.4862
 epoch: 35, train_loss: 0.8524, test_loss: 1.0265, test_f1: 0.4940
 epoch: 36, train_loss: 0.8285, test_loss: 1.0166, test_f1: 0.4941
 epoch: 37, train_loss: 0.8219, test_loss: 1.0288, test_f1: 0.5031
 epoch: 38, train_loss: 0.8237, test_loss: 1.0123, test_f1: 0.5100
 epoch: 39, train_loss: 0.8388, test_loss: 1.0164, test_f1: 0.4972
 epoch: 40, train_loss: 0.8255, test_loss: 1.0194, test_f1: 0.4945
 epoch: 41, train_loss: 0.8230, test_loss: 1.0380, test_f1: 0.5043
 epoch: 42, train_loss: 0.8052, test_loss: 1.0203, test_f1: 0.5123
 epoch: 43, train_loss: 0.7894, test_loss: 1.0366, test_f1: 0.5023
 epoch: 44, train_loss: 0.7874, test_loss: 1.0367, test_f1: 0.5038
 epoch: 45, train_loss: 0.7887, test_loss: 1.0662, test_f1: 0.5038
 epoch: 46, train_loss: 0.7701, test_loss: 1.0546, test_f1: 0.5061
 epoch: 47, train_loss: 0.7741, test_loss: 1.0641, test_f1: 0.4906
 epoch: 48, train_loss: 0.7643, test_loss: 1.0769, test_f1: 0.5098
 epoch: 49, train_loss: 0.7619, test_loss: 1.0555, test_f1: 0.4988
 epoch: 50, train_loss: 0.7462, test_loss: 1.0593, test_f1: 0.5033
 epoch: 51, train_loss: 0.7252, test_loss: 1.0694, test_f1: 0.4994
 epoch: 52, train_loss: 0.7169, test_loss: 1.0799, test_f1: 0.4940
 epoch: 53, train_loss: 0.7119, test_loss: 1.1121, test_f1: 0.4903
 epoch: 54, train_loss: 0.7065, test_loss: 1.1142, test_f1: 0.4905
 epoch: 55, train_loss: 0.6981, test_loss: 1.1170, test_f1: 0.5044
 epoch: 56, train_loss: 0.7164, test_loss: 1.0862, test_f1: 0.5044
 epoch: 57, train_loss: 0.7055, test_loss: 1.0998, test_f1: 0.5061
 epoch: 58, train_loss: 0.7044, test_loss: 1.1091, test_f1: 0.5080
 epoch: 59, train_loss: 0.6844, test_loss: 1.1108, test_f1: 0.5262
 epoch: 60, train_loss: 0.6850, test_loss: 1.1141, test_f1: 0.5094
 epoch: 61, train_loss: 0.7005, test_loss: 1.1064, test_f1: 0.5191
 epoch: 62, train_loss: 0.6803, test_loss: 1.1313, test_f1: 0.5164
 epoch: 63, train_loss: 0.6826, test_loss: 1.1399, test_f1: 0.5080
 epoch: 64, train_loss: 0.6861, test_loss: 1.1222, test_f1: 0.5060
 epoch: 65, train_loss: 0.6947, test_loss: 1.1291, test_f1: 0.5263
 epoch: 66, train_loss: 0.6691, test_loss: 1.1556, test_f1: 0.5118
 epoch: 67, train_loss: 0.6574, test_loss: 1.1443, test_f1: 0.5097
 epoch: 68, train_loss: 0.6724, test_loss: 1.1542, test_f1: 0.5065
 epoch: 69, train_loss: 0.6692, test_loss: 1.1624, test_f1: 0.5051
 epoch: 70, train_loss: 0.6531, test_loss: 1.1643, test_f1: 0.4976
 epoch: 71, train_loss: 0.6533, test_loss: 1.1791, test_f1: 0.5042
 epoch: 72, train_loss: 0.6545, test_loss: 1.1994, test_f1: 0.5128
 epoch: 73, train_loss: 0.6242, test_loss: 1.1768, test_f1: 0.5016
 epoch: 74, train_loss: 0.6402, test_loss: 1.1827, test_f1: 0.5063
 epoch: 75, train_loss: 0.6406, test_loss: 1.1796, test_f1: 0.5132
 epoch: 76, train_loss: 0.6259, test_loss: 1.1990, test_f1: 0.5110
 epoch: 77, train_loss: 0.6183, test_loss: 1.2181, test_f1: 0.5061
 epoch: 78, train_loss: 0.6317, test_loss: 1.1874, test_f1: 0.4998
 epoch: 79, train_loss: 0.6202, test_loss: 1.2183, test_f1: 0.5193
 epoch: 80, train_loss: 0.6349, test_loss: 1.2358, test_f1: 0.5113
 epoch: 81, train_loss: 0.6241, test_loss: 1.2283, test_f1: 0.5100
 epoch: 82, train_loss: 0.6256, test_loss: 1.2355, test_f1: 0.4977
 epoch: 83, train_loss: 0.6148, test_loss: 1.2409, test_f1: 0.4945
 epoch: 84, train_loss: 0.6050, test_loss: 1.2200, test_f1: 0.5105
 epoch: 85, train_loss: 0.6129, test_loss: 1.2140, test_f1: 0.5100
 epoch: 86, train_loss: 0.6224, test_loss: 1.2538, test_f1: 0.5075
 epoch: 87, train_loss: 0.5956, test_loss: 1.2733, test_f1: 0.5126
 epoch: 88, train_loss: 0.6033, test_loss: 1.3146, test_f1: 0.4940
 epoch: 89, train_loss: 0.5943, test_loss: 1.2903, test_f1: 0.4959
 epoch: 90, train_loss: 0.5910, test_loss: 1.2510, test_f1: 0.5122
 epoch: 91, train_loss: 0.5887, test_loss: 1.2230, test_f1: 0.5086
 epoch: 92, train_loss: 0.5987, test_loss: 1.2495, test_f1: 0.5135
 epoch: 93, train_loss: 0.5943, test_loss: 1.2559, test_f1: 0.5156
 epoch: 94, train_loss: 0.5892, test_loss: 1.2841, test_f1: 0.5176
 epoch: 95, train_loss: 0.5702, test_loss: 1.2733, test_f1: 0.5103
 epoch: 96, train_loss: 0.5720, test_loss: 1.2797, test_f1: 0.5230
 epoch: 97, train_loss: 0.5891, test_loss: 1.3311, test_f1: 0.5193
 epoch: 98, train_loss: 0.5675, test_loss: 1.2972, test_f1: 0.5070
 epoch: 99, train_loss: 0.5823, test_loss: 1.3174, test_f1: 0.5233
##################ITERATION #9 ****************************************
 epoch: 0, train_loss: 1.3616, test_loss: 1.2966, test_f1: 0.2580
 epoch: 1, train_loss: 1.2550, test_loss: 1.2771, test_f1: 0.2461
 epoch: 2, train_loss: 1.2162, test_loss: 1.2346, test_f1: 0.2990
 epoch: 3, train_loss: 1.2019, test_loss: 1.2022, test_f1: 0.3858
 epoch: 4, train_loss: 1.1752, test_loss: 1.1537, test_f1: 0.4276
 epoch: 5, train_loss: 1.1646, test_loss: 1.1402, test_f1: 0.4244
 epoch: 6, train_loss: 1.1344, test_loss: 1.1214, test_f1: 0.4419
 epoch: 7, train_loss: 1.1152, test_loss: 1.1160, test_f1: 0.4245
 epoch: 8, train_loss: 1.1157, test_loss: 1.1019, test_f1: 0.4305
 epoch: 9, train_loss: 1.0965, test_loss: 1.0958, test_f1: 0.4275
 epoch: 10, train_loss: 1.0811, test_loss: 1.0921, test_f1: 0.4278
 epoch: 11, train_loss: 1.0752, test_loss: 1.0915, test_f1: 0.4506
 epoch: 12, train_loss: 1.0590, test_loss: 1.0688, test_f1: 0.4501
 epoch: 13, train_loss: 1.0450, test_loss: 1.0727, test_f1: 0.4408
 epoch: 14, train_loss: 1.0383, test_loss: 1.0627, test_f1: 0.4556
 epoch: 15, train_loss: 1.0246, test_loss: 1.0692, test_f1: 0.4512
 epoch: 16, train_loss: 1.0156, test_loss: 1.0646, test_f1: 0.4596
 epoch: 17, train_loss: 1.0067, test_loss: 1.0645, test_f1: 0.4678
 epoch: 18, train_loss: 0.9905, test_loss: 1.0494, test_f1: 0.4776
 epoch: 19, train_loss: 0.9792, test_loss: 1.0433, test_f1: 0.4750
 epoch: 20, train_loss: 0.9732, test_loss: 1.0570, test_f1: 0.4816
 epoch: 21, train_loss: 0.9679, test_loss: 1.0527, test_f1: 0.4788
 epoch: 22, train_loss: 0.9635, test_loss: 1.0560, test_f1: 0.4866
 epoch: 23, train_loss: 0.9486, test_loss: 1.0607, test_f1: 0.4851
 epoch: 24, train_loss: 0.9412, test_loss: 1.0522, test_f1: 0.4903
 epoch: 25, train_loss: 0.9365, test_loss: 1.0597, test_f1: 0.4761
 epoch: 26, train_loss: 0.9151, test_loss: 1.0550, test_f1: 0.4811
 epoch: 27, train_loss: 0.9053, test_loss: 1.0596, test_f1: 0.4850
 epoch: 28, train_loss: 0.9008, test_loss: 1.0705, test_f1: 0.4943
 epoch: 29, train_loss: 0.8854, test_loss: 1.0685, test_f1: 0.4959
 epoch: 30, train_loss: 0.8811, test_loss: 1.1382, test_f1: 0.4818
 epoch: 31, train_loss: 0.8793, test_loss: 1.0844, test_f1: 0.4886
 epoch: 32, train_loss: 0.8726, test_loss: 1.0701, test_f1: 0.4976
 epoch: 33, train_loss: 0.8609, test_loss: 1.0701, test_f1: 0.4925
 epoch: 34, train_loss: 0.8515, test_loss: 1.0680, test_f1: 0.4802
 epoch: 35, train_loss: 0.8361, test_loss: 1.0773, test_f1: 0.4959
 epoch: 36, train_loss: 0.8547, test_loss: 1.0859, test_f1: 0.4808
 epoch: 37, train_loss: 0.8413, test_loss: 1.0910, test_f1: 0.4980
 epoch: 38, train_loss: 0.8100, test_loss: 1.1082, test_f1: 0.4987
 epoch: 39, train_loss: 0.8252, test_loss: 1.1100, test_f1: 0.4955
 epoch: 40, train_loss: 0.8035, test_loss: 1.1023, test_f1: 0.4880
 epoch: 41, train_loss: 0.8085, test_loss: 1.0774, test_f1: 0.4996
 epoch: 42, train_loss: 0.8028, test_loss: 1.1094, test_f1: 0.4829
 epoch: 43, train_loss: 0.7813, test_loss: 1.1189, test_f1: 0.4952
 epoch: 44, train_loss: 0.7685, test_loss: 1.1414, test_f1: 0.4945
 epoch: 45, train_loss: 0.7757, test_loss: 1.1254, test_f1: 0.5035
 epoch: 46, train_loss: 0.7768, test_loss: 1.1587, test_f1: 0.4883
 epoch: 47, train_loss: 0.7610, test_loss: 1.1446, test_f1: 0.4834
 epoch: 48, train_loss: 0.7415, test_loss: 1.1503, test_f1: 0.5068
 epoch: 49, train_loss: 0.7405, test_loss: 1.1661, test_f1: 0.4951
 epoch: 50, train_loss: 0.7526, test_loss: 1.1311, test_f1: 0.5002
 epoch: 51, train_loss: 0.7444, test_loss: 1.1456, test_f1: 0.5063
 epoch: 52, train_loss: 0.7262, test_loss: 1.1840, test_f1: 0.4997
 epoch: 53, train_loss: 0.7139, test_loss: 1.1967, test_f1: 0.4892
 epoch: 54, train_loss: 0.6949, test_loss: 1.2010, test_f1: 0.4881
 epoch: 55, train_loss: 0.7108, test_loss: 1.1896, test_f1: 0.4969
 epoch: 56, train_loss: 0.7082, test_loss: 1.1986, test_f1: 0.5011
 epoch: 57, train_loss: 0.6986, test_loss: 1.1984, test_f1: 0.4850
 epoch: 58, train_loss: 0.6807, test_loss: 1.1866, test_f1: 0.4970
 epoch: 59, train_loss: 0.7045, test_loss: 1.1761, test_f1: 0.4958
 epoch: 60, train_loss: 0.6992, test_loss: 1.2166, test_f1: 0.5047
 epoch: 61, train_loss: 0.6815, test_loss: 1.2502, test_f1: 0.4930
 epoch: 62, train_loss: 0.6792, test_loss: 1.2518, test_f1: 0.4940
 epoch: 63, train_loss: 0.6864, test_loss: 1.2435, test_f1: 0.5021
 epoch: 64, train_loss: 0.6769, test_loss: 1.2400, test_f1: 0.4956
 epoch: 65, train_loss: 0.6724, test_loss: 1.2521, test_f1: 0.4947
 epoch: 66, train_loss: 0.6676, test_loss: 1.2744, test_f1: 0.4880
 epoch: 67, train_loss: 0.6523, test_loss: 1.2627, test_f1: 0.5014
 epoch: 68, train_loss: 0.6602, test_loss: 1.2449, test_f1: 0.4975
 epoch: 69, train_loss: 0.6741, test_loss: 1.2700, test_f1: 0.5071
 epoch: 70, train_loss: 0.6522, test_loss: 1.2616, test_f1: 0.5017
 epoch: 71, train_loss: 0.6554, test_loss: 1.2578, test_f1: 0.5024
 epoch: 72, train_loss: 0.6531, test_loss: 1.2708, test_f1: 0.4897
 epoch: 73, train_loss: 0.6559, test_loss: 1.2619, test_f1: 0.5008
 epoch: 74, train_loss: 0.6446, test_loss: 1.2957, test_f1: 0.5024
 epoch: 75, train_loss: 0.6404, test_loss: 1.2541, test_f1: 0.5069
 epoch: 76, train_loss: 0.6441, test_loss: 1.2989, test_f1: 0.5037
 epoch: 77, train_loss: 0.6437, test_loss: 1.3118, test_f1: 0.4832
 epoch: 78, train_loss: 0.6345, test_loss: 1.3153, test_f1: 0.4874
 epoch: 79, train_loss: 0.6272, test_loss: 1.3040, test_f1: 0.4878
 epoch: 80, train_loss: 0.6370, test_loss: 1.3077, test_f1: 0.5109
 epoch: 81, train_loss: 0.6128, test_loss: 1.2835, test_f1: 0.5050
 epoch: 82, train_loss: 0.6197, test_loss: 1.3124, test_f1: 0.4890
 epoch: 83, train_loss: 0.6225, test_loss: 1.3302, test_f1: 0.4986
 epoch: 84, train_loss: 0.6127, test_loss: 1.3410, test_f1: 0.5037
 epoch: 85, train_loss: 0.6180, test_loss: 1.3080, test_f1: 0.5106
 epoch: 86, train_loss: 0.6193, test_loss: 1.2999, test_f1: 0.5144
 epoch: 87, train_loss: 0.6136, test_loss: 1.3326, test_f1: 0.4961
 epoch: 88, train_loss: 0.6305, test_loss: 1.3546, test_f1: 0.5076
 epoch: 89, train_loss: 0.6143, test_loss: 1.3328, test_f1: 0.5013
 epoch: 90, train_loss: 0.6018, test_loss: 1.3411, test_f1: 0.5056
 epoch: 91, train_loss: 0.5948, test_loss: 1.3366, test_f1: 0.5014
 epoch: 92, train_loss: 0.6106, test_loss: 1.3891, test_f1: 0.4938
 epoch: 93, train_loss: 0.6021, test_loss: 1.3840, test_f1: 0.5006
 epoch: 94, train_loss: 0.6006, test_loss: 1.3906, test_f1: 0.5046
 epoch: 95, train_loss: 0.5892, test_loss: 1.4011, test_f1: 0.4963
 epoch: 96, train_loss: 0.5970, test_loss: 1.3960, test_f1: 0.4954
 epoch: 97, train_loss: 0.5805, test_loss: 1.3794, test_f1: 0.4935
 epoch: 98, train_loss: 0.6019, test_loss: 1.3938, test_f1: 0.4975
 epoch: 99, train_loss: 0.5580, test_loss: 1.3981, test_f1: 0.4971

Training completed in 418.77 seconds
Best F1: 0.5537 at epoch 51
Mean F1 across iterations: 0.5270  0.0127
========================FINAL RESULTS================================
FEGIN weighted F1: 0.5537  0.0127
python main.py --data ltspice_examples --representation component_component --model FEGIN --layers 5 --hiddens 128 --batch_size 256 --lr 0.0001 --emb_size 250 --epochs 100 --save_appendix component_component_L5_H128_BS256_LR0.0001_E250 --no_val
-----



STDERR:
  File "main.py", line 370, in <module>
    main()
  File "main.py", line 254, in main
    dataset = dataset_class(
  File "/home/philip/projects/ltspice_examples_code_repo/Circuit-Completion-Using-GNNs/component_classification_with_link_prediction_head/evaluation/FEGIN/kernel/circuit_datasets.py", line 15, in __init__
    self.data, self.slices = torch.load(self.processed_paths[0])
  File "/home/philip/.local/lib/python3.8/site-packages/torch/serialization.py", line 1040, in load
    warnings.warn(
  File "/usr/lib/python3.8/warnings.py", line 109, in _showwarnmsg
    sw(msg.message, msg.category, msg.filename, msg.lineno,
  File "main.py", line 47, in warn_with_traceback
    traceback.print_stack(file=log)
/home/philip/projects/ltspice_examples_code_repo/Circuit-Completion-Using-GNNs/component_classification_with_link_prediction_head/evaluation/FEGIN/kernel/circuit_datasets.py:15: FutureWarning: You are using `torch.load` with `weights_only=False` (the current default value), which uses the default pickle module implicitly. It is possible to construct malicious pickle data which will execute arbitrary code during unpickling (See https://github.com/pytorch/pytorch/blob/main/SECURITY.md#untrusted-models for more details). In a future release, the default value for `weights_only` will be flipped to `True`. This limits the functions that could be executed during unpickling. Arbitrary objects will no longer be allowed to be loaded via this mode unless they are explicitly allowlisted by the user via `torch.serialization.add_safe_globals`. We recommend you start setting `weights_only=True` for any use case where you don't have full control of the loaded file. Please open an issue on GitHub for any issues related to this experimental feature.
  self.data, self.slices = torch.load(self.processed_paths[0])
