STDOUT:
Results will be saved in /home/philip/projects/ltspice_examples_code_repo/Circuit-Completion-Using-GNNs/component_classification_with_link_prediction_head/evaluation/FEGIN/results/model_FEGIN_dataset_ltspice_examples
Command line input: python main.py --data ltspice_examples --representation component_net --model FEGIN --layers 5 --hiddens 128 --batch_size 64 --lr 0.001 --emb_size 250 --epochs 100 --save_appendix component_net_L5_H128_BS64_LR0.001_E250 --no_val
 is saved.
-----
ltspice_examples - FEGIN
Using 5 layers, 128 hidden units, h = 2
Loading component_net representation dataset
ENTERED
Training FEGIN on component_net representation
Train: 3558, Test: 846
##################ITERATION #0 ****************************************
 epoch: 0, train_loss: 1.1977, test_loss: 1.0511, test_f1: 0.4539
 epoch: 1, train_loss: 0.9920, test_loss: 0.9867, test_f1: 0.5177
 epoch: 2, train_loss: 0.9531, test_loss: 0.9501, test_f1: 0.5208
 epoch: 3, train_loss: 0.9212, test_loss: 0.9019, test_f1: 0.5300
 epoch: 4, train_loss: 0.8927, test_loss: 0.8750, test_f1: 0.5752
 epoch: 5, train_loss: 0.8846, test_loss: 0.9262, test_f1: 0.5348
 epoch: 6, train_loss: 0.8686, test_loss: 0.9151, test_f1: 0.5477
 epoch: 7, train_loss: 0.8618, test_loss: 0.9265, test_f1: 0.5251
 epoch: 8, train_loss: 0.8349, test_loss: 0.9178, test_f1: 0.5408
 epoch: 9, train_loss: 0.8422, test_loss: 0.9375, test_f1: 0.5804
 epoch: 10, train_loss: 0.8199, test_loss: 0.8970, test_f1: 0.6185
 epoch: 11, train_loss: 0.8118, test_loss: 0.9315, test_f1: 0.5234
 epoch: 12, train_loss: 0.7912, test_loss: 0.9534, test_f1: 0.5566
 epoch: 13, train_loss: 0.7743, test_loss: 0.9778, test_f1: 0.5783
 epoch: 14, train_loss: 0.7851, test_loss: 0.9532, test_f1: 0.5797
 epoch: 15, train_loss: 0.7671, test_loss: 0.8699, test_f1: 0.5529
 epoch: 16, train_loss: 0.7430, test_loss: 0.9435, test_f1: 0.5642
 epoch: 17, train_loss: 0.7345, test_loss: 0.9816, test_f1: 0.6030
 epoch: 18, train_loss: 0.7103, test_loss: 0.9354, test_f1: 0.6183
 epoch: 19, train_loss: 0.7163, test_loss: 0.9846, test_f1: 0.6002
 epoch: 20, train_loss: 0.7132, test_loss: 0.9385, test_f1: 0.6042
 epoch: 21, train_loss: 0.7027, test_loss: 0.9905, test_f1: 0.5934
 epoch: 22, train_loss: 0.6867, test_loss: 0.9219, test_f1: 0.6552
 epoch: 23, train_loss: 0.6952, test_loss: 0.9199, test_f1: 0.6152
 epoch: 24, train_loss: 0.6668, test_loss: 0.9182, test_f1: 0.6410
 epoch: 25, train_loss: 0.6673, test_loss: 0.9368, test_f1: 0.6260
 epoch: 26, train_loss: 0.6529, test_loss: 0.8769, test_f1: 0.6242
 epoch: 27, train_loss: 0.6416, test_loss: 0.9445, test_f1: 0.6407
 epoch: 28, train_loss: 0.6250, test_loss: 1.0609, test_f1: 0.6056
 epoch: 29, train_loss: 0.6104, test_loss: 0.9991, test_f1: 0.6066
 epoch: 30, train_loss: 0.6209, test_loss: 1.0453, test_f1: 0.6255
 epoch: 31, train_loss: 0.5901, test_loss: 1.1369, test_f1: 0.6072
 epoch: 32, train_loss: 0.5771, test_loss: 0.9932, test_f1: 0.6574
 epoch: 33, train_loss: 0.5937, test_loss: 1.0179, test_f1: 0.6160
 epoch: 34, train_loss: 0.5621, test_loss: 1.1174, test_f1: 0.6171
 epoch: 35, train_loss: 0.5463, test_loss: 1.0971, test_f1: 0.6563
 epoch: 36, train_loss: 0.5517, test_loss: 1.0381, test_f1: 0.6416
 epoch: 37, train_loss: 0.5292, test_loss: 0.9969, test_f1: 0.6796
 epoch: 38, train_loss: 0.5192, test_loss: 1.0794, test_f1: 0.6361
 epoch: 39, train_loss: 0.5198, test_loss: 1.3750, test_f1: 0.6073
 epoch: 40, train_loss: 0.5346, test_loss: 1.1590, test_f1: 0.6603
 epoch: 41, train_loss: 0.4934, test_loss: 1.1847, test_f1: 0.6524
 epoch: 42, train_loss: 0.4755, test_loss: 1.4014, test_f1: 0.6125
 epoch: 43, train_loss: 0.4611, test_loss: 1.2517, test_f1: 0.6345
 epoch: 44, train_loss: 0.4810, test_loss: 1.1056, test_f1: 0.6651
 epoch: 45, train_loss: 0.4575, test_loss: 1.1518, test_f1: 0.6640
 epoch: 46, train_loss: 0.4576, test_loss: 1.2314, test_f1: 0.6090
 epoch: 47, train_loss: 0.4482, test_loss: 1.1733, test_f1: 0.6392
 epoch: 48, train_loss: 0.4553, test_loss: 1.3686, test_f1: 0.6222
 epoch: 49, train_loss: 0.4614, test_loss: 1.2612, test_f1: 0.6225
 epoch: 50, train_loss: 0.4244, test_loss: 1.2928, test_f1: 0.6233
 epoch: 51, train_loss: 0.3683, test_loss: 1.4200, test_f1: 0.6342
 epoch: 52, train_loss: 0.3602, test_loss: 1.3725, test_f1: 0.6455
 epoch: 53, train_loss: 0.3437, test_loss: 1.4797, test_f1: 0.6571
 epoch: 54, train_loss: 0.3339, test_loss: 1.5570, test_f1: 0.6429
 epoch: 55, train_loss: 0.3292, test_loss: 1.5961, test_f1: 0.6308
 epoch: 56, train_loss: 0.3295, test_loss: 1.6454, test_f1: 0.6182
 epoch: 57, train_loss: 0.2994, test_loss: 1.7246, test_f1: 0.6299
 epoch: 58, train_loss: 0.3048, test_loss: 1.6901, test_f1: 0.6450
 epoch: 59, train_loss: 0.2964, test_loss: 1.8293, test_f1: 0.6289
 epoch: 60, train_loss: 0.2862, test_loss: 1.7765, test_f1: 0.6179
 epoch: 61, train_loss: 0.3021, test_loss: 1.6989, test_f1: 0.6408
 epoch: 62, train_loss: 0.2961, test_loss: 1.6285, test_f1: 0.6547
 epoch: 63, train_loss: 0.2701, test_loss: 1.8318, test_f1: 0.6349
 epoch: 64, train_loss: 0.2761, test_loss: 1.9508, test_f1: 0.6302
 epoch: 65, train_loss: 0.2632, test_loss: 1.8214, test_f1: 0.6713
 epoch: 66, train_loss: 0.2925, test_loss: 1.9694, test_f1: 0.6225
 epoch: 67, train_loss: 0.2678, test_loss: 1.8516, test_f1: 0.6222
 epoch: 68, train_loss: 0.2537, test_loss: 1.8724, test_f1: 0.6443
 epoch: 69, train_loss: 0.2438, test_loss: 1.8200, test_f1: 0.6659
 epoch: 70, train_loss: 0.2450, test_loss: 2.0488, test_f1: 0.6431
 epoch: 71, train_loss: 0.2460, test_loss: 1.8709, test_f1: 0.6353
 epoch: 72, train_loss: 0.2356, test_loss: 1.9176, test_f1: 0.6373
 epoch: 73, train_loss: 0.2226, test_loss: 2.0768, test_f1: 0.6561
 epoch: 74, train_loss: 0.2621, test_loss: 2.0527, test_f1: 0.6109
 epoch: 75, train_loss: 0.2348, test_loss: 2.0511, test_f1: 0.6349
 epoch: 76, train_loss: 0.2236, test_loss: 1.9394, test_f1: 0.6581
 epoch: 77, train_loss: 0.2165, test_loss: 2.0550, test_f1: 0.6311
 epoch: 78, train_loss: 0.2115, test_loss: 2.0935, test_f1: 0.6424
 epoch: 79, train_loss: 0.2175, test_loss: 2.0980, test_f1: 0.6576
 epoch: 80, train_loss: 0.2177, test_loss: 2.1937, test_f1: 0.6438
 epoch: 81, train_loss: 0.2165, test_loss: 2.0614, test_f1: 0.6352
 epoch: 82, train_loss: 0.2068, test_loss: 2.3488, test_f1: 0.6356
 epoch: 83, train_loss: 0.2265, test_loss: 2.1652, test_f1: 0.6427
 epoch: 84, train_loss: 0.2007, test_loss: 2.3292, test_f1: 0.6406
 epoch: 85, train_loss: 0.2088, test_loss: 2.1432, test_f1: 0.6283
 epoch: 86, train_loss: 0.2323, test_loss: 2.1085, test_f1: 0.6428
 epoch: 87, train_loss: 0.2036, test_loss: 2.2383, test_f1: 0.6418
 epoch: 88, train_loss: 0.1976, test_loss: 2.3390, test_f1: 0.6439
 epoch: 89, train_loss: 0.2165, test_loss: 2.3701, test_f1: 0.6203
 epoch: 90, train_loss: 0.2021, test_loss: 2.3373, test_f1: 0.6449
 epoch: 91, train_loss: 0.1917, test_loss: 2.2551, test_f1: 0.6459
 epoch: 92, train_loss: 0.1868, test_loss: 2.4203, test_f1: 0.6358
 epoch: 93, train_loss: 0.1997, test_loss: 2.3373, test_f1: 0.6403
 epoch: 94, train_loss: 0.1874, test_loss: 2.3572, test_f1: 0.6478
 epoch: 95, train_loss: 0.1721, test_loss: 2.3295, test_f1: 0.6460
 epoch: 96, train_loss: 0.2060, test_loss: 2.4518, test_f1: 0.6189
 epoch: 97, train_loss: 0.1854, test_loss: 2.4102, test_f1: 0.6307
 epoch: 98, train_loss: 0.1709, test_loss: 2.4887, test_f1: 0.6206
 epoch: 99, train_loss: 0.1811, test_loss: 2.3453, test_f1: 0.6583
##################ITERATION #1 ****************************************
 epoch: 0, train_loss: 1.1332, test_loss: 1.0623, test_f1: 0.4477
 epoch: 1, train_loss: 0.9949, test_loss: 0.9785, test_f1: 0.5070
 epoch: 2, train_loss: 0.9430, test_loss: 0.9499, test_f1: 0.4938
 epoch: 3, train_loss: 0.9023, test_loss: 0.9731, test_f1: 0.5189
 epoch: 4, train_loss: 0.8892, test_loss: 0.9385, test_f1: 0.5439
 epoch: 5, train_loss: 0.8767, test_loss: 0.8783, test_f1: 0.5014
 epoch: 6, train_loss: 0.8596, test_loss: 0.9291, test_f1: 0.5268
 epoch: 7, train_loss: 0.8404, test_loss: 0.9150, test_f1: 0.5692
 epoch: 8, train_loss: 0.8266, test_loss: 0.9207, test_f1: 0.5799
 epoch: 9, train_loss: 0.8084, test_loss: 0.9600, test_f1: 0.5816
 epoch: 10, train_loss: 0.8120, test_loss: 0.9018, test_f1: 0.5730
 epoch: 11, train_loss: 0.7983, test_loss: 0.9610, test_f1: 0.5933
 epoch: 12, train_loss: 0.7910, test_loss: 0.9390, test_f1: 0.5956
 epoch: 13, train_loss: 0.7671, test_loss: 0.9371, test_f1: 0.5547
 epoch: 14, train_loss: 0.7461, test_loss: 0.9896, test_f1: 0.6054
 epoch: 15, train_loss: 0.7548, test_loss: 0.9746, test_f1: 0.5772
 epoch: 16, train_loss: 0.7352, test_loss: 0.9200, test_f1: 0.6101
 epoch: 17, train_loss: 0.7549, test_loss: 0.9567, test_f1: 0.6196
 epoch: 18, train_loss: 0.7196, test_loss: 0.9621, test_f1: 0.6139
 epoch: 19, train_loss: 0.7181, test_loss: 0.9928, test_f1: 0.6037
 epoch: 20, train_loss: 0.7094, test_loss: 0.9453, test_f1: 0.6340
 epoch: 21, train_loss: 0.6859, test_loss: 0.9736, test_f1: 0.5853
 epoch: 22, train_loss: 0.6826, test_loss: 0.9975, test_f1: 0.6292
 epoch: 23, train_loss: 0.6619, test_loss: 1.0345, test_f1: 0.6053
 epoch: 24, train_loss: 0.6914, test_loss: 1.0152, test_f1: 0.5571
 epoch: 25, train_loss: 0.6593, test_loss: 1.0320, test_f1: 0.6269
 epoch: 26, train_loss: 0.6439, test_loss: 1.0316, test_f1: 0.6013
 epoch: 27, train_loss: 0.6393, test_loss: 1.0285, test_f1: 0.6276
 epoch: 28, train_loss: 0.6256, test_loss: 0.9711, test_f1: 0.6545
 epoch: 29, train_loss: 0.6069, test_loss: 1.0730, test_f1: 0.6375
 epoch: 30, train_loss: 0.6032, test_loss: 1.0024, test_f1: 0.6295
 epoch: 31, train_loss: 0.5942, test_loss: 1.0695, test_f1: 0.5988
 epoch: 32, train_loss: 0.5830, test_loss: 1.0565, test_f1: 0.6330
 epoch: 33, train_loss: 0.5563, test_loss: 1.1093, test_f1: 0.6402
 epoch: 34, train_loss: 0.5622, test_loss: 1.0955, test_f1: 0.6096
 epoch: 35, train_loss: 0.5448, test_loss: 1.0931, test_f1: 0.6452
 epoch: 36, train_loss: 0.5693, test_loss: 1.1323, test_f1: 0.6273
 epoch: 37, train_loss: 0.5227, test_loss: 1.0280, test_f1: 0.6285
 epoch: 38, train_loss: 0.5105, test_loss: 1.1912, test_f1: 0.6768
 epoch: 39, train_loss: 0.5270, test_loss: 1.0127, test_f1: 0.6200
 epoch: 40, train_loss: 0.5193, test_loss: 1.1327, test_f1: 0.6505
 epoch: 41, train_loss: 0.4989, test_loss: 1.2516, test_f1: 0.6397
 epoch: 42, train_loss: 0.4998, test_loss: 1.2380, test_f1: 0.6116
 epoch: 43, train_loss: 0.4900, test_loss: 1.2611, test_f1: 0.6437
 epoch: 44, train_loss: 0.4660, test_loss: 1.2597, test_f1: 0.6496
 epoch: 45, train_loss: 0.4476, test_loss: 1.1931, test_f1: 0.6635
 epoch: 46, train_loss: 0.4477, test_loss: 1.2355, test_f1: 0.6514
 epoch: 47, train_loss: 0.4555, test_loss: 1.2055, test_f1: 0.6535
 epoch: 48, train_loss: 0.4448, test_loss: 1.2282, test_f1: 0.6621
 epoch: 49, train_loss: 0.4481, test_loss: 1.3238, test_f1: 0.6516
 epoch: 50, train_loss: 0.4245, test_loss: 1.2816, test_f1: 0.6332
 epoch: 51, train_loss: 0.3733, test_loss: 1.2717, test_f1: 0.6730
 epoch: 52, train_loss: 0.3673, test_loss: 1.3109, test_f1: 0.6620
 epoch: 53, train_loss: 0.3400, test_loss: 1.5098, test_f1: 0.6645
 epoch: 54, train_loss: 0.3284, test_loss: 1.3673, test_f1: 0.6635
 epoch: 55, train_loss: 0.3159, test_loss: 1.4743, test_f1: 0.6667
 epoch: 56, train_loss: 0.2982, test_loss: 1.6087, test_f1: 0.6624
 epoch: 57, train_loss: 0.3148, test_loss: 1.6530, test_f1: 0.6485
 epoch: 58, train_loss: 0.3260, test_loss: 1.4866, test_f1: 0.6792
 epoch: 59, train_loss: 0.3085, test_loss: 1.4747, test_f1: 0.6551
 epoch: 60, train_loss: 0.2966, test_loss: 1.4875, test_f1: 0.6714
 epoch: 61, train_loss: 0.2860, test_loss: 1.5685, test_f1: 0.6637
 epoch: 62, train_loss: 0.2692, test_loss: 1.7090, test_f1: 0.6602
 epoch: 63, train_loss: 0.2791, test_loss: 1.8206, test_f1: 0.6466
 epoch: 64, train_loss: 0.2818, test_loss: 1.5675, test_f1: 0.6675
 epoch: 65, train_loss: 0.2692, test_loss: 1.6533, test_f1: 0.6504
 epoch: 66, train_loss: 0.2728, test_loss: 1.6783, test_f1: 0.6713
 epoch: 67, train_loss: 0.2609, test_loss: 1.7516, test_f1: 0.6477
 epoch: 68, train_loss: 0.2861, test_loss: 1.6230, test_f1: 0.6583
 epoch: 69, train_loss: 0.2434, test_loss: 1.8562, test_f1: 0.6795
 epoch: 70, train_loss: 0.2597, test_loss: 1.7376, test_f1: 0.6493
 epoch: 71, train_loss: 0.2521, test_loss: 1.8004, test_f1: 0.6609
 epoch: 72, train_loss: 0.2555, test_loss: 1.7111, test_f1: 0.6666
 epoch: 73, train_loss: 0.2609, test_loss: 1.7479, test_f1: 0.6726
 epoch: 74, train_loss: 0.2428, test_loss: 1.8779, test_f1: 0.6682
 epoch: 75, train_loss: 0.2350, test_loss: 1.9262, test_f1: 0.6332
 epoch: 76, train_loss: 0.2522, test_loss: 1.8972, test_f1: 0.6717
 epoch: 77, train_loss: 0.2414, test_loss: 1.9665, test_f1: 0.6636
 epoch: 78, train_loss: 0.2419, test_loss: 1.9226, test_f1: 0.6589
 epoch: 79, train_loss: 0.2284, test_loss: 1.8335, test_f1: 0.6737
 epoch: 80, train_loss: 0.2264, test_loss: 1.8658, test_f1: 0.6697
 epoch: 81, train_loss: 0.2314, test_loss: 1.9408, test_f1: 0.6544
 epoch: 82, train_loss: 0.1979, test_loss: 1.9093, test_f1: 0.6809
 epoch: 83, train_loss: 0.2094, test_loss: 1.9316, test_f1: 0.6683
 epoch: 84, train_loss: 0.1977, test_loss: 2.0436, test_f1: 0.6607
 epoch: 85, train_loss: 0.2078, test_loss: 2.0984, test_f1: 0.6690
 epoch: 86, train_loss: 0.2355, test_loss: 1.9997, test_f1: 0.6538
 epoch: 87, train_loss: 0.2130, test_loss: 2.1129, test_f1: 0.6573
 epoch: 88, train_loss: 0.2100, test_loss: 2.0275, test_f1: 0.6784
 epoch: 89, train_loss: 0.2087, test_loss: 2.0348, test_f1: 0.6565
 epoch: 90, train_loss: 0.2075, test_loss: 2.0600, test_f1: 0.6614
 epoch: 91, train_loss: 0.2200, test_loss: 2.0826, test_f1: 0.6566
 epoch: 92, train_loss: 0.2069, test_loss: 2.0707, test_f1: 0.6602
 epoch: 93, train_loss: 0.1916, test_loss: 2.1259, test_f1: 0.6479
 epoch: 94, train_loss: 0.1824, test_loss: 2.0827, test_f1: 0.6558
 epoch: 95, train_loss: 0.2043, test_loss: 2.2131, test_f1: 0.6592
 epoch: 96, train_loss: 0.2148, test_loss: 2.1040, test_f1: 0.6579
 epoch: 97, train_loss: 0.1920, test_loss: 2.1524, test_f1: 0.6662
 epoch: 98, train_loss: 0.1864, test_loss: 2.2869, test_f1: 0.6641
 epoch: 99, train_loss: 0.1880, test_loss: 2.2593, test_f1: 0.6347
##################ITERATION #2 ****************************************
 epoch: 0, train_loss: 1.1619, test_loss: 1.0263, test_f1: 0.4360
 epoch: 1, train_loss: 0.9713, test_loss: 0.9325, test_f1: 0.5392
 epoch: 2, train_loss: 0.9413, test_loss: 0.9488, test_f1: 0.5383
 epoch: 3, train_loss: 0.9332, test_loss: 0.9072, test_f1: 0.5501
 epoch: 4, train_loss: 0.8951, test_loss: 0.9485, test_f1: 0.5035
 epoch: 5, train_loss: 0.8833, test_loss: 0.9749, test_f1: 0.5328
 epoch: 6, train_loss: 0.8665, test_loss: 0.9617, test_f1: 0.5249
 epoch: 7, train_loss: 0.8490, test_loss: 0.9168, test_f1: 0.5488
 epoch: 8, train_loss: 0.8457, test_loss: 1.0214, test_f1: 0.5129
 epoch: 9, train_loss: 0.8476, test_loss: 0.9963, test_f1: 0.5529
 epoch: 10, train_loss: 0.8171, test_loss: 0.9437, test_f1: 0.5461
 epoch: 11, train_loss: 0.8139, test_loss: 0.9482, test_f1: 0.5670
 epoch: 12, train_loss: 0.8112, test_loss: 0.9089, test_f1: 0.5493
 epoch: 13, train_loss: 0.7986, test_loss: 1.0010, test_f1: 0.5761
 epoch: 14, train_loss: 0.7855, test_loss: 0.9441, test_f1: 0.5431
 epoch: 15, train_loss: 0.7811, test_loss: 0.9851, test_f1: 0.5796
 epoch: 16, train_loss: 0.7601, test_loss: 0.9053, test_f1: 0.5941
 epoch: 17, train_loss: 0.7626, test_loss: 0.9686, test_f1: 0.5442
 epoch: 18, train_loss: 0.7559, test_loss: 0.9349, test_f1: 0.5850
 epoch: 19, train_loss: 0.7388, test_loss: 0.9592, test_f1: 0.5812
 epoch: 20, train_loss: 0.7284, test_loss: 1.0124, test_f1: 0.5850
 epoch: 21, train_loss: 0.7273, test_loss: 0.9417, test_f1: 0.5727
 epoch: 22, train_loss: 0.6974, test_loss: 0.9528, test_f1: 0.6185
 epoch: 23, train_loss: 0.7160, test_loss: 0.9251, test_f1: 0.5820
 epoch: 24, train_loss: 0.7045, test_loss: 0.9875, test_f1: 0.5785
 epoch: 25, train_loss: 0.6786, test_loss: 0.9219, test_f1: 0.6132
 epoch: 26, train_loss: 0.6865, test_loss: 0.9431, test_f1: 0.5692
 epoch: 27, train_loss: 0.6636, test_loss: 0.9746, test_f1: 0.5812
 epoch: 28, train_loss: 0.6753, test_loss: 1.0165, test_f1: 0.5751
 epoch: 29, train_loss: 0.6543, test_loss: 0.9432, test_f1: 0.6185
 epoch: 30, train_loss: 0.6605, test_loss: 1.0024, test_f1: 0.6060
 epoch: 31, train_loss: 0.6379, test_loss: 0.9841, test_f1: 0.6259
 epoch: 32, train_loss: 0.6238, test_loss: 0.9772, test_f1: 0.5971
 epoch: 33, train_loss: 0.5983, test_loss: 1.0411, test_f1: 0.6222
 epoch: 34, train_loss: 0.6098, test_loss: 0.9598, test_f1: 0.6257
 epoch: 35, train_loss: 0.5985, test_loss: 0.9471, test_f1: 0.6230
 epoch: 36, train_loss: 0.6182, test_loss: 0.9999, test_f1: 0.6608
 epoch: 37, train_loss: 0.6101, test_loss: 0.9818, test_f1: 0.6191
 epoch: 38, train_loss: 0.5817, test_loss: 1.0206, test_f1: 0.6398
 epoch: 39, train_loss: 0.5786, test_loss: 1.1980, test_f1: 0.6097
 epoch: 40, train_loss: 0.5626, test_loss: 1.0398, test_f1: 0.6119
 epoch: 41, train_loss: 0.5669, test_loss: 1.0418, test_f1: 0.6180
 epoch: 42, train_loss: 0.5377, test_loss: 1.1296, test_f1: 0.6320
 epoch: 43, train_loss: 0.5190, test_loss: 1.1055, test_f1: 0.6315
 epoch: 44, train_loss: 0.5239, test_loss: 1.1468, test_f1: 0.6298
 epoch: 45, train_loss: 0.5267, test_loss: 1.0978, test_f1: 0.6386
 epoch: 46, train_loss: 0.5156, test_loss: 1.1805, test_f1: 0.6357
 epoch: 47, train_loss: 0.5227, test_loss: 1.2175, test_f1: 0.6280
 epoch: 48, train_loss: 0.5032, test_loss: 1.0960, test_f1: 0.6598
 epoch: 49, train_loss: 0.4996, test_loss: 1.1259, test_f1: 0.6591
 epoch: 50, train_loss: 0.4734, test_loss: 1.2344, test_f1: 0.6322
 epoch: 51, train_loss: 0.4392, test_loss: 1.1826, test_f1: 0.6724
 epoch: 52, train_loss: 0.4094, test_loss: 1.1765, test_f1: 0.6713
 epoch: 53, train_loss: 0.4057, test_loss: 1.2480, test_f1: 0.6487
 epoch: 54, train_loss: 0.4127, test_loss: 1.1930, test_f1: 0.6613
 epoch: 55, train_loss: 0.3760, test_loss: 1.2576, test_f1: 0.6655
 epoch: 56, train_loss: 0.3764, test_loss: 1.2954, test_f1: 0.6747
 epoch: 57, train_loss: 0.3699, test_loss: 1.4719, test_f1: 0.6265
 epoch: 58, train_loss: 0.3782, test_loss: 1.3475, test_f1: 0.6666
 epoch: 59, train_loss: 0.3618, test_loss: 1.3789, test_f1: 0.6410
 epoch: 60, train_loss: 0.3525, test_loss: 1.3019, test_f1: 0.6684
 epoch: 61, train_loss: 0.3457, test_loss: 1.4232, test_f1: 0.6583
 epoch: 62, train_loss: 0.3309, test_loss: 1.5083, test_f1: 0.6656
 epoch: 63, train_loss: 0.3286, test_loss: 1.4311, test_f1: 0.6527
 epoch: 64, train_loss: 0.3209, test_loss: 1.5315, test_f1: 0.6444
 epoch: 65, train_loss: 0.3304, test_loss: 1.5481, test_f1: 0.6533
 epoch: 66, train_loss: 0.3177, test_loss: 1.4980, test_f1: 0.6492
 epoch: 67, train_loss: 0.3240, test_loss: 1.5466, test_f1: 0.6381
 epoch: 68, train_loss: 0.3131, test_loss: 1.6399, test_f1: 0.6567
 epoch: 69, train_loss: 0.2969, test_loss: 1.5805, test_f1: 0.6452
 epoch: 70, train_loss: 0.3025, test_loss: 1.4865, test_f1: 0.6404
 epoch: 71, train_loss: 0.3008, test_loss: 1.5274, test_f1: 0.6752
 epoch: 72, train_loss: 0.2961, test_loss: 1.6308, test_f1: 0.6685
 epoch: 73, train_loss: 0.2838, test_loss: 1.6891, test_f1: 0.6380
 epoch: 74, train_loss: 0.3061, test_loss: 1.5508, test_f1: 0.6886
 epoch: 75, train_loss: 0.2823, test_loss: 1.6904, test_f1: 0.6539
 epoch: 76, train_loss: 0.2924, test_loss: 1.5446, test_f1: 0.6471
 epoch: 77, train_loss: 0.2996, test_loss: 1.5760, test_f1: 0.6546
 epoch: 78, train_loss: 0.2645, test_loss: 1.7450, test_f1: 0.6524
 epoch: 79, train_loss: 0.2646, test_loss: 1.8078, test_f1: 0.6575
 epoch: 80, train_loss: 0.2617, test_loss: 1.8948, test_f1: 0.6389
 epoch: 81, train_loss: 0.2719, test_loss: 1.7208, test_f1: 0.6787
 epoch: 82, train_loss: 0.2742, test_loss: 1.7410, test_f1: 0.6358
 epoch: 83, train_loss: 0.2666, test_loss: 1.7801, test_f1: 0.6458
 epoch: 84, train_loss: 0.2414, test_loss: 1.8157, test_f1: 0.6568
 epoch: 85, train_loss: 0.2528, test_loss: 1.8578, test_f1: 0.6560
 epoch: 86, train_loss: 0.2517, test_loss: 1.8811, test_f1: 0.6548
 epoch: 87, train_loss: 0.2423, test_loss: 1.7766, test_f1: 0.6484
 epoch: 88, train_loss: 0.2408, test_loss: 1.8358, test_f1: 0.6434
 epoch: 89, train_loss: 0.2592, test_loss: 1.7894, test_f1: 0.6505
 epoch: 90, train_loss: 0.2433, test_loss: 1.9272, test_f1: 0.6441
 epoch: 91, train_loss: 0.2230, test_loss: 1.9452, test_f1: 0.6173
 epoch: 92, train_loss: 0.2255, test_loss: 2.0600, test_f1: 0.6413
 epoch: 93, train_loss: 0.2360, test_loss: 1.9421, test_f1: 0.6622
 epoch: 94, train_loss: 0.2134, test_loss: 2.0962, test_f1: 0.6262
 epoch: 95, train_loss: 0.2352, test_loss: 2.1009, test_f1: 0.6269
 epoch: 96, train_loss: 0.2222, test_loss: 1.9814, test_f1: 0.6538
 epoch: 97, train_loss: 0.2315, test_loss: 2.0231, test_f1: 0.6488
 epoch: 98, train_loss: 0.1961, test_loss: 1.9765, test_f1: 0.6596
 epoch: 99, train_loss: 0.2099, test_loss: 2.0713, test_f1: 0.6506
##################ITERATION #3 ****************************************
 epoch: 0, train_loss: 1.2264, test_loss: 1.0661, test_f1: 0.4748
 epoch: 1, train_loss: 0.9985, test_loss: 0.9684, test_f1: 0.4824
 epoch: 2, train_loss: 0.9500, test_loss: 0.9598, test_f1: 0.4874
 epoch: 3, train_loss: 0.9182, test_loss: 0.9281, test_f1: 0.5103
 epoch: 4, train_loss: 0.8933, test_loss: 0.9408, test_f1: 0.5214
 epoch: 5, train_loss: 0.8769, test_loss: 0.9448, test_f1: 0.5267
 epoch: 6, train_loss: 0.8499, test_loss: 0.9276, test_f1: 0.5625
 epoch: 7, train_loss: 0.8517, test_loss: 0.9950, test_f1: 0.5546
 epoch: 8, train_loss: 0.8540, test_loss: 0.9937, test_f1: 0.5502
 epoch: 9, train_loss: 0.8267, test_loss: 1.0356, test_f1: 0.5372
 epoch: 10, train_loss: 0.8105, test_loss: 0.9957, test_f1: 0.5834
 epoch: 11, train_loss: 0.8079, test_loss: 0.9125, test_f1: 0.5586
 epoch: 12, train_loss: 0.7877, test_loss: 0.9760, test_f1: 0.5909
 epoch: 13, train_loss: 0.7698, test_loss: 1.0389, test_f1: 0.5567
 epoch: 14, train_loss: 0.7608, test_loss: 0.9535, test_f1: 0.5828
 epoch: 15, train_loss: 0.7613, test_loss: 1.0423, test_f1: 0.5587
 epoch: 16, train_loss: 0.7501, test_loss: 1.0320, test_f1: 0.5850
 epoch: 17, train_loss: 0.7488, test_loss: 1.0691, test_f1: 0.5721
 epoch: 18, train_loss: 0.7333, test_loss: 1.1021, test_f1: 0.5778
 epoch: 19, train_loss: 0.7171, test_loss: 1.0584, test_f1: 0.5613
 epoch: 20, train_loss: 0.7126, test_loss: 1.0439, test_f1: 0.6209
 epoch: 21, train_loss: 0.7041, test_loss: 1.0086, test_f1: 0.5988
 epoch: 22, train_loss: 0.6982, test_loss: 1.2087, test_f1: 0.5561
 epoch: 23, train_loss: 0.7024, test_loss: 1.0213, test_f1: 0.5975
 epoch: 24, train_loss: 0.7127, test_loss: 1.0817, test_f1: 0.6035
 epoch: 25, train_loss: 0.6867, test_loss: 1.1268, test_f1: 0.6049
 epoch: 26, train_loss: 0.6519, test_loss: 0.9707, test_f1: 0.6139
 epoch: 27, train_loss: 0.6697, test_loss: 1.0740, test_f1: 0.6390
 epoch: 28, train_loss: 0.6611, test_loss: 1.1001, test_f1: 0.6387
 epoch: 29, train_loss: 0.6339, test_loss: 1.0375, test_f1: 0.6402
 epoch: 30, train_loss: 0.6548, test_loss: 1.0600, test_f1: 0.6311
 epoch: 31, train_loss: 0.6235, test_loss: 1.0668, test_f1: 0.5989
 epoch: 32, train_loss: 0.6251, test_loss: 1.0864, test_f1: 0.6293
 epoch: 33, train_loss: 0.6135, test_loss: 1.1166, test_f1: 0.6572
 epoch: 34, train_loss: 0.6028, test_loss: 1.0684, test_f1: 0.5872
 epoch: 35, train_loss: 0.5753, test_loss: 1.1111, test_f1: 0.6513
 epoch: 36, train_loss: 0.5995, test_loss: 1.1737, test_f1: 0.6417
 epoch: 37, train_loss: 0.5922, test_loss: 1.0372, test_f1: 0.6070
 epoch: 38, train_loss: 0.5758, test_loss: 1.0488, test_f1: 0.6498
 epoch: 39, train_loss: 0.5589, test_loss: 1.0880, test_f1: 0.6368
 epoch: 40, train_loss: 0.5591, test_loss: 1.0421, test_f1: 0.6498
 epoch: 41, train_loss: 0.5303, test_loss: 1.1569, test_f1: 0.6356
 epoch: 42, train_loss: 0.5266, test_loss: 1.0820, test_f1: 0.6523
 epoch: 43, train_loss: 0.5334, test_loss: 0.9753, test_f1: 0.6253
 epoch: 44, train_loss: 0.5261, test_loss: 1.2157, test_f1: 0.6275
 epoch: 45, train_loss: 0.5351, test_loss: 1.1022, test_f1: 0.6306
 epoch: 46, train_loss: 0.5096, test_loss: 1.1855, test_f1: 0.6413
 epoch: 47, train_loss: 0.4734, test_loss: 1.2396, test_f1: 0.6372
 epoch: 48, train_loss: 0.5048, test_loss: 1.0910, test_f1: 0.6038
 epoch: 49, train_loss: 0.4785, test_loss: 1.1555, test_f1: 0.6217
 epoch: 50, train_loss: 0.4929, test_loss: 1.1794, test_f1: 0.6286
 epoch: 51, train_loss: 0.4403, test_loss: 1.2479, test_f1: 0.6521
 epoch: 52, train_loss: 0.4143, test_loss: 1.1917, test_f1: 0.6406
 epoch: 53, train_loss: 0.3824, test_loss: 1.1983, test_f1: 0.6631
 epoch: 54, train_loss: 0.3756, test_loss: 1.3249, test_f1: 0.6615
 epoch: 55, train_loss: 0.3650, test_loss: 1.3799, test_f1: 0.6547
 epoch: 56, train_loss: 0.3800, test_loss: 1.3408, test_f1: 0.6444
 epoch: 57, train_loss: 0.3595, test_loss: 1.3647, test_f1: 0.6551
 epoch: 58, train_loss: 0.3501, test_loss: 1.3874, test_f1: 0.6387
 epoch: 59, train_loss: 0.3320, test_loss: 1.3480, test_f1: 0.6651
 epoch: 60, train_loss: 0.3047, test_loss: 1.3740, test_f1: 0.6718
 epoch: 61, train_loss: 0.3393, test_loss: 1.4338, test_f1: 0.6514
 epoch: 62, train_loss: 0.3260, test_loss: 1.4276, test_f1: 0.6546
 epoch: 63, train_loss: 0.3351, test_loss: 1.4553, test_f1: 0.6571
 epoch: 64, train_loss: 0.3042, test_loss: 1.4935, test_f1: 0.6417
 epoch: 65, train_loss: 0.2902, test_loss: 1.5520, test_f1: 0.6446
 epoch: 66, train_loss: 0.3010, test_loss: 1.5249, test_f1: 0.6558
 epoch: 67, train_loss: 0.3154, test_loss: 1.5658, test_f1: 0.6500
 epoch: 68, train_loss: 0.3053, test_loss: 1.5809, test_f1: 0.6481
 epoch: 69, train_loss: 0.2949, test_loss: 1.5795, test_f1: 0.6395
 epoch: 70, train_loss: 0.2810, test_loss: 1.5949, test_f1: 0.6540
 epoch: 71, train_loss: 0.2844, test_loss: 1.6166, test_f1: 0.6690
 epoch: 72, train_loss: 0.2763, test_loss: 1.5912, test_f1: 0.6634
 epoch: 73, train_loss: 0.2781, test_loss: 1.5878, test_f1: 0.6593
 epoch: 74, train_loss: 0.2647, test_loss: 1.6221, test_f1: 0.6599
 epoch: 75, train_loss: 0.2644, test_loss: 1.7432, test_f1: 0.6415
 epoch: 76, train_loss: 0.2734, test_loss: 1.7069, test_f1: 0.6668
 epoch: 77, train_loss: 0.2810, test_loss: 1.4917, test_f1: 0.6870
 epoch: 78, train_loss: 0.2702, test_loss: 1.7035, test_f1: 0.6513
 epoch: 79, train_loss: 0.2546, test_loss: 1.5854, test_f1: 0.6559
 epoch: 80, train_loss: 0.2317, test_loss: 1.6378, test_f1: 0.6500
 epoch: 81, train_loss: 0.2482, test_loss: 1.7503, test_f1: 0.6617
 epoch: 82, train_loss: 0.2459, test_loss: 1.7623, test_f1: 0.6549
 epoch: 83, train_loss: 0.2548, test_loss: 1.6086, test_f1: 0.6606
 epoch: 84, train_loss: 0.2430, test_loss: 1.8261, test_f1: 0.6606
 epoch: 85, train_loss: 0.2273, test_loss: 1.9168, test_f1: 0.6337
 epoch: 86, train_loss: 0.2582, test_loss: 1.6581, test_f1: 0.6714
 epoch: 87, train_loss: 0.2226, test_loss: 2.0336, test_f1: 0.6528
 epoch: 88, train_loss: 0.2396, test_loss: 1.8685, test_f1: 0.5980
 epoch: 89, train_loss: 0.2433, test_loss: 1.7130, test_f1: 0.6560
 epoch: 90, train_loss: 0.2452, test_loss: 1.7146, test_f1: 0.6775
 epoch: 91, train_loss: 0.2341, test_loss: 1.7819, test_f1: 0.6478
 epoch: 92, train_loss: 0.2319, test_loss: 1.8789, test_f1: 0.6639
 epoch: 93, train_loss: 0.2234, test_loss: 1.9622, test_f1: 0.6481
 epoch: 94, train_loss: 0.2301, test_loss: 1.9949, test_f1: 0.6763
 epoch: 95, train_loss: 0.2334, test_loss: 1.9699, test_f1: 0.6557
 epoch: 96, train_loss: 0.2320, test_loss: 1.8695, test_f1: 0.6465
 epoch: 97, train_loss: 0.2332, test_loss: 1.8393, test_f1: 0.6440
 epoch: 98, train_loss: 0.2220, test_loss: 1.8251, test_f1: 0.6613
 epoch: 99, train_loss: 0.2086, test_loss: 1.8823, test_f1: 0.6316
##################ITERATION #4 ****************************************
 epoch: 0, train_loss: 1.2474, test_loss: 1.0038, test_f1: 0.4608
 epoch: 1, train_loss: 0.9950, test_loss: 0.9610, test_f1: 0.4850
 epoch: 2, train_loss: 0.9498, test_loss: 0.9623, test_f1: 0.4701
 epoch: 3, train_loss: 0.9103, test_loss: 0.9176, test_f1: 0.4979
 epoch: 4, train_loss: 0.9058, test_loss: 0.9306, test_f1: 0.5153
 epoch: 5, train_loss: 0.8835, test_loss: 0.9602, test_f1: 0.5019
 epoch: 6, train_loss: 0.8685, test_loss: 0.8948, test_f1: 0.5211
 epoch: 7, train_loss: 0.8501, test_loss: 0.9640, test_f1: 0.5510
 epoch: 8, train_loss: 0.8570, test_loss: 0.8787, test_f1: 0.5180
 epoch: 9, train_loss: 0.8456, test_loss: 0.9246, test_f1: 0.5622
 epoch: 10, train_loss: 0.8116, test_loss: 0.8960, test_f1: 0.5910
 epoch: 11, train_loss: 0.8155, test_loss: 0.9748, test_f1: 0.5607
 epoch: 12, train_loss: 0.7885, test_loss: 0.8973, test_f1: 0.5900
 epoch: 13, train_loss: 0.7849, test_loss: 0.9289, test_f1: 0.5818
 epoch: 14, train_loss: 0.7718, test_loss: 0.9237, test_f1: 0.5738
 epoch: 15, train_loss: 0.7561, test_loss: 0.9645, test_f1: 0.6027
 epoch: 16, train_loss: 0.7598, test_loss: 0.9636, test_f1: 0.5552
 epoch: 17, train_loss: 0.7391, test_loss: 0.9597, test_f1: 0.5872
 epoch: 18, train_loss: 0.7303, test_loss: 0.9522, test_f1: 0.6074
 epoch: 19, train_loss: 0.7300, test_loss: 0.9782, test_f1: 0.6009
 epoch: 20, train_loss: 0.7223, test_loss: 1.0087, test_f1: 0.6058
 epoch: 21, train_loss: 0.6960, test_loss: 1.0510, test_f1: 0.5757
 epoch: 22, train_loss: 0.6931, test_loss: 1.0391, test_f1: 0.6088
 epoch: 23, train_loss: 0.6740, test_loss: 0.9090, test_f1: 0.6133
 epoch: 24, train_loss: 0.6701, test_loss: 0.9395, test_f1: 0.5836
 epoch: 25, train_loss: 0.6570, test_loss: 0.9776, test_f1: 0.6502
 epoch: 26, train_loss: 0.6750, test_loss: 0.9527, test_f1: 0.6189
 epoch: 27, train_loss: 0.6439, test_loss: 1.0087, test_f1: 0.6146
 epoch: 28, train_loss: 0.6516, test_loss: 0.9601, test_f1: 0.6172
 epoch: 29, train_loss: 0.6268, test_loss: 0.9637, test_f1: 0.6440
 epoch: 30, train_loss: 0.6123, test_loss: 1.0778, test_f1: 0.6535
 epoch: 31, train_loss: 0.5927, test_loss: 1.1361, test_f1: 0.5819
 epoch: 32, train_loss: 0.6044, test_loss: 1.0365, test_f1: 0.6008
 epoch: 33, train_loss: 0.5992, test_loss: 0.9466, test_f1: 0.6477
 epoch: 34, train_loss: 0.5800, test_loss: 1.0636, test_f1: 0.6341
 epoch: 35, train_loss: 0.5851, test_loss: 0.9891, test_f1: 0.6539
 epoch: 36, train_loss: 0.5684, test_loss: 1.0128, test_f1: 0.6439
 epoch: 37, train_loss: 0.5642, test_loss: 1.1362, test_f1: 0.6160
 epoch: 38, train_loss: 0.5394, test_loss: 1.1641, test_f1: 0.6270
 epoch: 39, train_loss: 0.5276, test_loss: 1.1536, test_f1: 0.6203
 epoch: 40, train_loss: 0.5116, test_loss: 1.1148, test_f1: 0.6427
 epoch: 41, train_loss: 0.5128, test_loss: 1.0038, test_f1: 0.6376
 epoch: 42, train_loss: 0.5241, test_loss: 1.1596, test_f1: 0.6317
 epoch: 43, train_loss: 0.5182, test_loss: 1.1118, test_f1: 0.6271
 epoch: 44, train_loss: 0.4964, test_loss: 1.0798, test_f1: 0.6571
 epoch: 45, train_loss: 0.4837, test_loss: 1.1712, test_f1: 0.6602
 epoch: 46, train_loss: 0.4752, test_loss: 1.0864, test_f1: 0.6381
 epoch: 47, train_loss: 0.4774, test_loss: 1.0937, test_f1: 0.6496
 epoch: 48, train_loss: 0.4686, test_loss: 1.3981, test_f1: 0.5755
 epoch: 49, train_loss: 0.4905, test_loss: 1.0787, test_f1: 0.6567
 epoch: 50, train_loss: 0.4441, test_loss: 1.3011, test_f1: 0.6104
 epoch: 51, train_loss: 0.4134, test_loss: 1.3534, test_f1: 0.6363
 epoch: 52, train_loss: 0.3797, test_loss: 1.2463, test_f1: 0.6267
 epoch: 53, train_loss: 0.3686, test_loss: 1.3657, test_f1: 0.6448
 epoch: 54, train_loss: 0.3755, test_loss: 1.2592, test_f1: 0.6458
 epoch: 55, train_loss: 0.3509, test_loss: 1.3379, test_f1: 0.6476
 epoch: 56, train_loss: 0.3375, test_loss: 1.4589, test_f1: 0.6343
 epoch: 57, train_loss: 0.3355, test_loss: 1.4491, test_f1: 0.6206
 epoch: 58, train_loss: 0.3354, test_loss: 1.4019, test_f1: 0.6387
 epoch: 59, train_loss: 0.3253, test_loss: 1.3478, test_f1: 0.6582
 epoch: 60, train_loss: 0.3257, test_loss: 1.4852, test_f1: 0.6563
 epoch: 61, train_loss: 0.3018, test_loss: 1.4696, test_f1: 0.6270
 epoch: 62, train_loss: 0.3172, test_loss: 1.3526, test_f1: 0.6378
 epoch: 63, train_loss: 0.3247, test_loss: 1.4464, test_f1: 0.6496
 epoch: 64, train_loss: 0.3110, test_loss: 1.4386, test_f1: 0.6488
 epoch: 65, train_loss: 0.2972, test_loss: 1.6613, test_f1: 0.6382
 epoch: 66, train_loss: 0.3218, test_loss: 1.5474, test_f1: 0.6388
 epoch: 67, train_loss: 0.3020, test_loss: 1.5807, test_f1: 0.6335
 epoch: 68, train_loss: 0.2805, test_loss: 1.5792, test_f1: 0.6313
 epoch: 69, train_loss: 0.3002, test_loss: 1.6645, test_f1: 0.6248
 epoch: 70, train_loss: 0.2706, test_loss: 1.5856, test_f1: 0.6392
 epoch: 71, train_loss: 0.2778, test_loss: 1.6289, test_f1: 0.6256
 epoch: 72, train_loss: 0.2809, test_loss: 1.5952, test_f1: 0.6317
 epoch: 73, train_loss: 0.2870, test_loss: 1.5851, test_f1: 0.6297
 epoch: 74, train_loss: 0.2536, test_loss: 1.7787, test_f1: 0.6251
 epoch: 75, train_loss: 0.2703, test_loss: 1.5225, test_f1: 0.6348
 epoch: 76, train_loss: 0.2752, test_loss: 1.6648, test_f1: 0.6437
 epoch: 77, train_loss: 0.2564, test_loss: 1.6432, test_f1: 0.6416
 epoch: 78, train_loss: 0.2422, test_loss: 1.6463, test_f1: 0.6482
 epoch: 79, train_loss: 0.2457, test_loss: 1.8042, test_f1: 0.6294
 epoch: 80, train_loss: 0.2491, test_loss: 1.6806, test_f1: 0.6424
 epoch: 81, train_loss: 0.2197, test_loss: 1.8699, test_f1: 0.6286
 epoch: 82, train_loss: 0.2351, test_loss: 1.7612, test_f1: 0.6451
 epoch: 83, train_loss: 0.2307, test_loss: 1.8754, test_f1: 0.6355
 epoch: 84, train_loss: 0.2327, test_loss: 1.5806, test_f1: 0.6480
 epoch: 85, train_loss: 0.2229, test_loss: 1.8531, test_f1: 0.6453
 epoch: 86, train_loss: 0.2450, test_loss: 1.8584, test_f1: 0.6356
 epoch: 87, train_loss: 0.2298, test_loss: 1.7629, test_f1: 0.6441
 epoch: 88, train_loss: 0.2312, test_loss: 1.8657, test_f1: 0.6400
 epoch: 89, train_loss: 0.2386, test_loss: 1.8031, test_f1: 0.6374
 epoch: 90, train_loss: 0.2293, test_loss: 1.9173, test_f1: 0.6377
 epoch: 91, train_loss: 0.2133, test_loss: 2.0253, test_f1: 0.6363
 epoch: 92, train_loss: 0.2256, test_loss: 2.0946, test_f1: 0.6382
 epoch: 93, train_loss: 0.2060, test_loss: 2.0305, test_f1: 0.6242
 epoch: 94, train_loss: 0.2128, test_loss: 1.9512, test_f1: 0.6280
 epoch: 95, train_loss: 0.2117, test_loss: 1.9414, test_f1: 0.6342
 epoch: 96, train_loss: 0.2198, test_loss: 1.9915, test_f1: 0.6469
 epoch: 97, train_loss: 0.2256, test_loss: 1.9040, test_f1: 0.6317
 epoch: 98, train_loss: 0.1996, test_loss: 1.9996, test_f1: 0.6426
 epoch: 99, train_loss: 0.1961, test_loss: 1.9971, test_f1: 0.6520
##################ITERATION #5 ****************************************
 epoch: 0, train_loss: 1.2530, test_loss: 1.0310, test_f1: 0.3879
 epoch: 1, train_loss: 0.9963, test_loss: 0.9452, test_f1: 0.4927
 epoch: 2, train_loss: 0.9429, test_loss: 0.9431, test_f1: 0.4967
 epoch: 3, train_loss: 0.9298, test_loss: 0.9230, test_f1: 0.5341
 epoch: 4, train_loss: 0.9196, test_loss: 0.9526, test_f1: 0.5131
 epoch: 5, train_loss: 0.8917, test_loss: 0.8790, test_f1: 0.5582
 epoch: 6, train_loss: 0.8764, test_loss: 0.9697, test_f1: 0.5433
 epoch: 7, train_loss: 0.8580, test_loss: 0.8902, test_f1: 0.5534
 epoch: 8, train_loss: 0.8488, test_loss: 0.9205, test_f1: 0.5621
 epoch: 9, train_loss: 0.8174, test_loss: 0.9599, test_f1: 0.5587
 epoch: 10, train_loss: 0.8271, test_loss: 0.9156, test_f1: 0.5542
 epoch: 11, train_loss: 0.7960, test_loss: 0.9312, test_f1: 0.5620
 epoch: 12, train_loss: 0.7944, test_loss: 0.9136, test_f1: 0.5571
 epoch: 13, train_loss: 0.7948, test_loss: 0.9097, test_f1: 0.5828
 epoch: 14, train_loss: 0.7697, test_loss: 0.9643, test_f1: 0.5768
 epoch: 15, train_loss: 0.7752, test_loss: 0.9495, test_f1: 0.5702
 epoch: 16, train_loss: 0.7706, test_loss: 0.9807, test_f1: 0.5646
 epoch: 17, train_loss: 0.7633, test_loss: 0.9476, test_f1: 0.6275
 epoch: 18, train_loss: 0.7225, test_loss: 0.8769, test_f1: 0.6120
 epoch: 19, train_loss: 0.7466, test_loss: 0.9133, test_f1: 0.6265
 epoch: 20, train_loss: 0.7255, test_loss: 0.9360, test_f1: 0.6015
 epoch: 21, train_loss: 0.7015, test_loss: 0.9870, test_f1: 0.6136
 epoch: 22, train_loss: 0.6995, test_loss: 0.9491, test_f1: 0.6456
 epoch: 23, train_loss: 0.6837, test_loss: 0.9607, test_f1: 0.6126
 epoch: 24, train_loss: 0.6768, test_loss: 0.9685, test_f1: 0.6298
 epoch: 25, train_loss: 0.6750, test_loss: 0.9773, test_f1: 0.6045
 epoch: 26, train_loss: 0.6470, test_loss: 0.9069, test_f1: 0.6094
 epoch: 27, train_loss: 0.6403, test_loss: 1.0324, test_f1: 0.6083
 epoch: 28, train_loss: 0.6434, test_loss: 0.9514, test_f1: 0.6257
 epoch: 29, train_loss: 0.6332, test_loss: 1.0684, test_f1: 0.5821
 epoch: 30, train_loss: 0.6245, test_loss: 0.9938, test_f1: 0.5870
 epoch: 31, train_loss: 0.6006, test_loss: 1.0248, test_f1: 0.6225
 epoch: 32, train_loss: 0.6001, test_loss: 1.0305, test_f1: 0.6171
 epoch: 33, train_loss: 0.5949, test_loss: 0.9604, test_f1: 0.6424
 epoch: 34, train_loss: 0.5820, test_loss: 1.0793, test_f1: 0.6248
 epoch: 35, train_loss: 0.5523, test_loss: 1.0113, test_f1: 0.6819
 epoch: 36, train_loss: 0.5405, test_loss: 1.0472, test_f1: 0.6661
 epoch: 37, train_loss: 0.5329, test_loss: 1.0406, test_f1: 0.6606
 epoch: 38, train_loss: 0.5469, test_loss: 1.0086, test_f1: 0.6335
 epoch: 39, train_loss: 0.5423, test_loss: 1.0772, test_f1: 0.6181
 epoch: 40, train_loss: 0.5275, test_loss: 1.0409, test_f1: 0.6658
 epoch: 41, train_loss: 0.5196, test_loss: 1.0040, test_f1: 0.6849
 epoch: 42, train_loss: 0.5241, test_loss: 0.8767, test_f1: 0.6726
 epoch: 43, train_loss: 0.4873, test_loss: 1.0970, test_f1: 0.6470
 epoch: 44, train_loss: 0.4911, test_loss: 1.1753, test_f1: 0.6432
 epoch: 45, train_loss: 0.4854, test_loss: 1.1788, test_f1: 0.6495
 epoch: 46, train_loss: 0.4803, test_loss: 1.0784, test_f1: 0.6607
 epoch: 47, train_loss: 0.4752, test_loss: 1.0199, test_f1: 0.6604
 epoch: 48, train_loss: 0.4574, test_loss: 0.9733, test_f1: 0.6649
 epoch: 49, train_loss: 0.4824, test_loss: 0.9876, test_f1: 0.6822
 epoch: 50, train_loss: 0.4418, test_loss: 1.1941, test_f1: 0.6427
 epoch: 51, train_loss: 0.4098, test_loss: 1.1635, test_f1: 0.6809
 epoch: 52, train_loss: 0.3602, test_loss: 1.1259, test_f1: 0.6786
 epoch: 53, train_loss: 0.3598, test_loss: 1.2215, test_f1: 0.6718
 epoch: 54, train_loss: 0.3650, test_loss: 1.1831, test_f1: 0.6798
 epoch: 55, train_loss: 0.3497, test_loss: 1.2328, test_f1: 0.6764
 epoch: 56, train_loss: 0.3361, test_loss: 1.3681, test_f1: 0.6703
 epoch: 57, train_loss: 0.3452, test_loss: 1.2441, test_f1: 0.6836
 epoch: 58, train_loss: 0.3196, test_loss: 1.1882, test_f1: 0.6787
 epoch: 59, train_loss: 0.3131, test_loss: 1.3075, test_f1: 0.6750
 epoch: 60, train_loss: 0.3115, test_loss: 1.2775, test_f1: 0.6483
 epoch: 61, train_loss: 0.3150, test_loss: 1.2605, test_f1: 0.6626
 epoch: 62, train_loss: 0.3028, test_loss: 1.2896, test_f1: 0.6688
 epoch: 63, train_loss: 0.2932, test_loss: 1.2805, test_f1: 0.6810
 epoch: 64, train_loss: 0.3108, test_loss: 1.2949, test_f1: 0.6651
 epoch: 65, train_loss: 0.2802, test_loss: 1.3631, test_f1: 0.6658
 epoch: 66, train_loss: 0.2847, test_loss: 1.3551, test_f1: 0.6834
 epoch: 67, train_loss: 0.2743, test_loss: 1.4258, test_f1: 0.6755
 epoch: 68, train_loss: 0.2745, test_loss: 1.4571, test_f1: 0.6679
 epoch: 69, train_loss: 0.2766, test_loss: 1.3710, test_f1: 0.6534
 epoch: 70, train_loss: 0.2618, test_loss: 1.3704, test_f1: 0.6628
 epoch: 71, train_loss: 0.2676, test_loss: 1.4456, test_f1: 0.6662
 epoch: 72, train_loss: 0.2570, test_loss: 1.3847, test_f1: 0.6523
 epoch: 73, train_loss: 0.2590, test_loss: 1.5083, test_f1: 0.6662
 epoch: 74, train_loss: 0.2530, test_loss: 1.5817, test_f1: 0.6670
 epoch: 75, train_loss: 0.2660, test_loss: 1.3143, test_f1: 0.6709
 epoch: 76, train_loss: 0.2480, test_loss: 1.4786, test_f1: 0.6595
 epoch: 77, train_loss: 0.2737, test_loss: 1.7434, test_f1: 0.6418
 epoch: 78, train_loss: 0.2530, test_loss: 1.5547, test_f1: 0.6527
 epoch: 79, train_loss: 0.2376, test_loss: 1.5764, test_f1: 0.6719
 epoch: 80, train_loss: 0.2290, test_loss: 1.5891, test_f1: 0.6486
 epoch: 81, train_loss: 0.2442, test_loss: 1.6177, test_f1: 0.6386
 epoch: 82, train_loss: 0.2312, test_loss: 1.6492, test_f1: 0.6454
 epoch: 83, train_loss: 0.2448, test_loss: 1.5815, test_f1: 0.6799
 epoch: 84, train_loss: 0.2737, test_loss: 1.4956, test_f1: 0.6543
 epoch: 85, train_loss: 0.2534, test_loss: 1.3991, test_f1: 0.6744
 epoch: 86, train_loss: 0.2224, test_loss: 1.4426, test_f1: 0.6517
 epoch: 87, train_loss: 0.2321, test_loss: 1.4703, test_f1: 0.6410
 epoch: 88, train_loss: 0.2461, test_loss: 1.6207, test_f1: 0.6506
 epoch: 89, train_loss: 0.2289, test_loss: 1.5974, test_f1: 0.6704
 epoch: 90, train_loss: 0.2127, test_loss: 1.6313, test_f1: 0.6432
 epoch: 91, train_loss: 0.2095, test_loss: 1.7326, test_f1: 0.6561
 epoch: 92, train_loss: 0.2083, test_loss: 1.6684, test_f1: 0.6473
 epoch: 93, train_loss: 0.2111, test_loss: 1.7161, test_f1: 0.6702
 epoch: 94, train_loss: 0.2097, test_loss: 1.7127, test_f1: 0.6604
 epoch: 95, train_loss: 0.2047, test_loss: 1.7198, test_f1: 0.6920
 epoch: 96, train_loss: 0.1979, test_loss: 1.7288, test_f1: 0.6651
 epoch: 97, train_loss: 0.2102, test_loss: 1.7280, test_f1: 0.6610
 epoch: 98, train_loss: 0.2186, test_loss: 1.5980, test_f1: 0.6612
 epoch: 99, train_loss: 0.2011, test_loss: 1.5926, test_f1: 0.6575
##################ITERATION #6 ****************************************
 epoch: 0, train_loss: 1.2821, test_loss: 1.0273, test_f1: 0.4970
 epoch: 1, train_loss: 1.0078, test_loss: 0.9519, test_f1: 0.5187
 epoch: 2, train_loss: 0.9537, test_loss: 0.9465, test_f1: 0.5334
 epoch: 3, train_loss: 0.9436, test_loss: 0.9488, test_f1: 0.4972
 epoch: 4, train_loss: 0.9162, test_loss: 0.9903, test_f1: 0.4870
 epoch: 5, train_loss: 0.8831, test_loss: 0.9648, test_f1: 0.5482
 epoch: 6, train_loss: 0.8769, test_loss: 0.9492, test_f1: 0.5582
 epoch: 7, train_loss: 0.8466, test_loss: 0.9622, test_f1: 0.5289
 epoch: 8, train_loss: 0.8553, test_loss: 0.9748, test_f1: 0.6053
 epoch: 9, train_loss: 0.8441, test_loss: 0.9682, test_f1: 0.6042
 epoch: 10, train_loss: 0.8278, test_loss: 0.9544, test_f1: 0.6024
 epoch: 11, train_loss: 0.8038, test_loss: 0.9935, test_f1: 0.5856
 epoch: 12, train_loss: 0.7936, test_loss: 0.9701, test_f1: 0.5713
 epoch: 13, train_loss: 0.7908, test_loss: 0.9594, test_f1: 0.6016
 epoch: 14, train_loss: 0.7787, test_loss: 1.0050, test_f1: 0.5466
 epoch: 15, train_loss: 0.7695, test_loss: 0.9425, test_f1: 0.6305
 epoch: 16, train_loss: 0.7586, test_loss: 0.9565, test_f1: 0.5985
 epoch: 17, train_loss: 0.7587, test_loss: 0.9055, test_f1: 0.6146
 epoch: 18, train_loss: 0.7453, test_loss: 1.0561, test_f1: 0.6034
 epoch: 19, train_loss: 0.7228, test_loss: 0.9968, test_f1: 0.5889
 epoch: 20, train_loss: 0.7178, test_loss: 1.0033, test_f1: 0.6098
 epoch: 21, train_loss: 0.7100, test_loss: 0.9661, test_f1: 0.5861
 epoch: 22, train_loss: 0.6955, test_loss: 0.9529, test_f1: 0.6066
 epoch: 23, train_loss: 0.6870, test_loss: 0.9644, test_f1: 0.6250
 epoch: 24, train_loss: 0.6784, test_loss: 1.0602, test_f1: 0.6182
 epoch: 25, train_loss: 0.6755, test_loss: 0.9660, test_f1: 0.6291
 epoch: 26, train_loss: 0.6658, test_loss: 1.0152, test_f1: 0.6029
 epoch: 27, train_loss: 0.6727, test_loss: 0.9687, test_f1: 0.6254
 epoch: 28, train_loss: 0.6499, test_loss: 0.9451, test_f1: 0.6091
 epoch: 29, train_loss: 0.6498, test_loss: 1.0255, test_f1: 0.5964
 epoch: 30, train_loss: 0.6540, test_loss: 0.8632, test_f1: 0.6567
 epoch: 31, train_loss: 0.6292, test_loss: 0.8725, test_f1: 0.6318
 epoch: 32, train_loss: 0.6050, test_loss: 1.0733, test_f1: 0.5715
 epoch: 33, train_loss: 0.6161, test_loss: 1.0346, test_f1: 0.6647
 epoch: 34, train_loss: 0.6034, test_loss: 1.1505, test_f1: 0.6003
 epoch: 35, train_loss: 0.5859, test_loss: 1.0058, test_f1: 0.6524
 epoch: 36, train_loss: 0.5713, test_loss: 1.2051, test_f1: 0.5973
 epoch: 37, train_loss: 0.5703, test_loss: 0.9927, test_f1: 0.6504
 epoch: 38, train_loss: 0.5936, test_loss: 1.1255, test_f1: 0.6253
 epoch: 39, train_loss: 0.5673, test_loss: 1.1121, test_f1: 0.6638
 epoch: 40, train_loss: 0.5388, test_loss: 1.0767, test_f1: 0.6512
 epoch: 41, train_loss: 0.5345, test_loss: 1.0451, test_f1: 0.6204
 epoch: 42, train_loss: 0.5354, test_loss: 1.0781, test_f1: 0.6387
 epoch: 43, train_loss: 0.5263, test_loss: 1.1371, test_f1: 0.6243
 epoch: 44, train_loss: 0.5100, test_loss: 1.0222, test_f1: 0.6091
 epoch: 45, train_loss: 0.5270, test_loss: 0.9956, test_f1: 0.6370
 epoch: 46, train_loss: 0.4981, test_loss: 1.0983, test_f1: 0.6533
 epoch: 47, train_loss: 0.4889, test_loss: 1.1003, test_f1: 0.6805
 epoch: 48, train_loss: 0.4963, test_loss: 1.0494, test_f1: 0.6340
 epoch: 49, train_loss: 0.4800, test_loss: 1.1031, test_f1: 0.6166
 epoch: 50, train_loss: 0.4548, test_loss: 1.1532, test_f1: 0.6348
 epoch: 51, train_loss: 0.4162, test_loss: 1.1945, test_f1: 0.6397
 epoch: 52, train_loss: 0.3993, test_loss: 1.1538, test_f1: 0.6439
 epoch: 53, train_loss: 0.3894, test_loss: 1.1030, test_f1: 0.6294
 epoch: 54, train_loss: 0.3749, test_loss: 1.2399, test_f1: 0.6433
 epoch: 55, train_loss: 0.3616, test_loss: 1.2055, test_f1: 0.6231
 epoch: 56, train_loss: 0.3690, test_loss: 1.2585, test_f1: 0.6275
 epoch: 57, train_loss: 0.3505, test_loss: 1.2538, test_f1: 0.6348
 epoch: 58, train_loss: 0.3363, test_loss: 1.3465, test_f1: 0.6620
 epoch: 59, train_loss: 0.3434, test_loss: 1.2800, test_f1: 0.6279
 epoch: 60, train_loss: 0.3357, test_loss: 1.3441, test_f1: 0.6494
 epoch: 61, train_loss: 0.3246, test_loss: 1.3483, test_f1: 0.6412
 epoch: 62, train_loss: 0.3174, test_loss: 1.4832, test_f1: 0.6349
 epoch: 63, train_loss: 0.3121, test_loss: 1.4054, test_f1: 0.6403
 epoch: 64, train_loss: 0.3099, test_loss: 1.4570, test_f1: 0.6339
 epoch: 65, train_loss: 0.3136, test_loss: 1.4406, test_f1: 0.6475
 epoch: 66, train_loss: 0.2810, test_loss: 1.5212, test_f1: 0.6411
 epoch: 67, train_loss: 0.3040, test_loss: 1.4805, test_f1: 0.6617
 epoch: 68, train_loss: 0.2936, test_loss: 1.4940, test_f1: 0.6422
 epoch: 69, train_loss: 0.3016, test_loss: 1.6038, test_f1: 0.6094
 epoch: 70, train_loss: 0.2691, test_loss: 1.6012, test_f1: 0.6347
 epoch: 71, train_loss: 0.2779, test_loss: 1.6308, test_f1: 0.6107
 epoch: 72, train_loss: 0.2778, test_loss: 1.5284, test_f1: 0.6275
 epoch: 73, train_loss: 0.2724, test_loss: 1.6347, test_f1: 0.6285
 epoch: 74, train_loss: 0.2671, test_loss: 1.6725, test_f1: 0.6250
 epoch: 75, train_loss: 0.2778, test_loss: 1.6584, test_f1: 0.6136
 epoch: 76, train_loss: 0.2702, test_loss: 1.5082, test_f1: 0.6348
 epoch: 77, train_loss: 0.2692, test_loss: 1.7154, test_f1: 0.6406
 epoch: 78, train_loss: 0.2444, test_loss: 1.6069, test_f1: 0.6221
 epoch: 79, train_loss: 0.2578, test_loss: 1.7585, test_f1: 0.6209
 epoch: 80, train_loss: 0.2649, test_loss: 1.6781, test_f1: 0.6348
 epoch: 81, train_loss: 0.2447, test_loss: 1.6532, test_f1: 0.6571
 epoch: 82, train_loss: 0.2583, test_loss: 1.6562, test_f1: 0.6301
 epoch: 83, train_loss: 0.2406, test_loss: 1.6688, test_f1: 0.6471
 epoch: 84, train_loss: 0.2314, test_loss: 1.7758, test_f1: 0.6349
 epoch: 85, train_loss: 0.2484, test_loss: 1.8508, test_f1: 0.6100
 epoch: 86, train_loss: 0.2279, test_loss: 1.7238, test_f1: 0.6067
 epoch: 87, train_loss: 0.2472, test_loss: 1.8036, test_f1: 0.6243
 epoch: 88, train_loss: 0.2444, test_loss: 1.6975, test_f1: 0.6206
 epoch: 89, train_loss: 0.2280, test_loss: 1.7801, test_f1: 0.6295
 epoch: 90, train_loss: 0.2443, test_loss: 1.5768, test_f1: 0.6252
 epoch: 91, train_loss: 0.2200, test_loss: 1.7588, test_f1: 0.6366
 epoch: 92, train_loss: 0.2248, test_loss: 1.7638, test_f1: 0.6341
 epoch: 93, train_loss: 0.2020, test_loss: 1.8269, test_f1: 0.6196
 epoch: 94, train_loss: 0.2030, test_loss: 1.8305, test_f1: 0.6270
 epoch: 95, train_loss: 0.2026, test_loss: 1.7993, test_f1: 0.6377
 epoch: 96, train_loss: 0.2045, test_loss: 1.7302, test_f1: 0.6197
 epoch: 97, train_loss: 0.2108, test_loss: 1.7929, test_f1: 0.6476
 epoch: 98, train_loss: 0.1932, test_loss: 1.8488, test_f1: 0.6261
 epoch: 99, train_loss: 0.2050, test_loss: 1.9501, test_f1: 0.6205
##################ITERATION #7 ****************************************
 epoch: 0, train_loss: 1.2560, test_loss: 1.0144, test_f1: 0.4651
 epoch: 1, train_loss: 1.0021, test_loss: 0.9250, test_f1: 0.4892
 epoch: 2, train_loss: 0.9432, test_loss: 0.9147, test_f1: 0.5132
 epoch: 3, train_loss: 0.9166, test_loss: 0.8955, test_f1: 0.5180
 epoch: 4, train_loss: 0.9059, test_loss: 0.9311, test_f1: 0.5091
 epoch: 5, train_loss: 0.8745, test_loss: 0.9403, test_f1: 0.5397
 epoch: 6, train_loss: 0.8614, test_loss: 0.9137, test_f1: 0.5376
 epoch: 7, train_loss: 0.8563, test_loss: 0.9897, test_f1: 0.5349
 epoch: 8, train_loss: 0.8365, test_loss: 0.9542, test_f1: 0.5821
 epoch: 9, train_loss: 0.8276, test_loss: 0.9837, test_f1: 0.5404
 epoch: 10, train_loss: 0.7966, test_loss: 0.9645, test_f1: 0.5755
 epoch: 11, train_loss: 0.8031, test_loss: 0.9827, test_f1: 0.5658
 epoch: 12, train_loss: 0.7851, test_loss: 0.9571, test_f1: 0.5789
 epoch: 13, train_loss: 0.7622, test_loss: 0.9087, test_f1: 0.5902
 epoch: 14, train_loss: 0.7604, test_loss: 0.9216, test_f1: 0.6125
 epoch: 15, train_loss: 0.7530, test_loss: 0.9417, test_f1: 0.5836
 epoch: 16, train_loss: 0.7618, test_loss: 0.9690, test_f1: 0.5482
 epoch: 17, train_loss: 0.7271, test_loss: 1.0105, test_f1: 0.5869
 epoch: 18, train_loss: 0.7466, test_loss: 1.0012, test_f1: 0.5776
 epoch: 19, train_loss: 0.7190, test_loss: 1.0356, test_f1: 0.5908
 epoch: 20, train_loss: 0.7137, test_loss: 0.9656, test_f1: 0.5713
 epoch: 21, train_loss: 0.6947, test_loss: 0.9927, test_f1: 0.6104
 epoch: 22, train_loss: 0.6881, test_loss: 1.0318, test_f1: 0.6325
 epoch: 23, train_loss: 0.6797, test_loss: 0.9628, test_f1: 0.5964
 epoch: 24, train_loss: 0.6778, test_loss: 0.8794, test_f1: 0.6249
 epoch: 25, train_loss: 0.6745, test_loss: 1.0411, test_f1: 0.6154
 epoch: 26, train_loss: 0.6696, test_loss: 0.9265, test_f1: 0.6325
 epoch: 27, train_loss: 0.6491, test_loss: 0.9683, test_f1: 0.6545
 epoch: 28, train_loss: 0.6438, test_loss: 1.0018, test_f1: 0.6405
 epoch: 29, train_loss: 0.6309, test_loss: 1.0732, test_f1: 0.6082
 epoch: 30, train_loss: 0.6234, test_loss: 1.0385, test_f1: 0.6444
 epoch: 31, train_loss: 0.6057, test_loss: 1.0188, test_f1: 0.6413
 epoch: 32, train_loss: 0.6227, test_loss: 1.0379, test_f1: 0.5970
 epoch: 33, train_loss: 0.6065, test_loss: 0.9873, test_f1: 0.5987
 epoch: 34, train_loss: 0.5800, test_loss: 1.0693, test_f1: 0.6145
 epoch: 35, train_loss: 0.5893, test_loss: 1.0437, test_f1: 0.6126
 epoch: 36, train_loss: 0.5706, test_loss: 1.0283, test_f1: 0.6496
 epoch: 37, train_loss: 0.5574, test_loss: 1.0570, test_f1: 0.6496
 epoch: 38, train_loss: 0.5683, test_loss: 1.1228, test_f1: 0.6090
 epoch: 39, train_loss: 0.5398, test_loss: 1.1089, test_f1: 0.6398
 epoch: 40, train_loss: 0.5338, test_loss: 1.1060, test_f1: 0.6261
 epoch: 41, train_loss: 0.5195, test_loss: 1.1383, test_f1: 0.6154
 epoch: 42, train_loss: 0.5183, test_loss: 1.1477, test_f1: 0.6022
 epoch: 43, train_loss: 0.5248, test_loss: 1.0142, test_f1: 0.6031
 epoch: 44, train_loss: 0.5151, test_loss: 1.0717, test_f1: 0.6332
 epoch: 45, train_loss: 0.4865, test_loss: 1.0417, test_f1: 0.6244
 epoch: 46, train_loss: 0.5002, test_loss: 1.0077, test_f1: 0.6700
 epoch: 47, train_loss: 0.4808, test_loss: 1.1257, test_f1: 0.6324
 epoch: 48, train_loss: 0.4849, test_loss: 1.1702, test_f1: 0.6282
 epoch: 49, train_loss: 0.4846, test_loss: 1.1669, test_f1: 0.6343
 epoch: 50, train_loss: 0.4601, test_loss: 1.1769, test_f1: 0.6502
 epoch: 51, train_loss: 0.4368, test_loss: 1.2118, test_f1: 0.6627
 epoch: 52, train_loss: 0.3877, test_loss: 1.1590, test_f1: 0.6683
 epoch: 53, train_loss: 0.3836, test_loss: 1.1968, test_f1: 0.6519
 epoch: 54, train_loss: 0.3783, test_loss: 1.2876, test_f1: 0.6621
 epoch: 55, train_loss: 0.3619, test_loss: 1.2165, test_f1: 0.6548
 epoch: 56, train_loss: 0.3439, test_loss: 1.3137, test_f1: 0.6522
 epoch: 57, train_loss: 0.3421, test_loss: 1.3173, test_f1: 0.6486
 epoch: 58, train_loss: 0.3272, test_loss: 1.3251, test_f1: 0.6496
 epoch: 59, train_loss: 0.3230, test_loss: 1.3784, test_f1: 0.6371
 epoch: 60, train_loss: 0.3362, test_loss: 1.4347, test_f1: 0.6401
 epoch: 61, train_loss: 0.3172, test_loss: 1.4296, test_f1: 0.6466
 epoch: 62, train_loss: 0.3218, test_loss: 1.3669, test_f1: 0.6524
 epoch: 63, train_loss: 0.3068, test_loss: 1.5402, test_f1: 0.6071
 epoch: 64, train_loss: 0.3378, test_loss: 1.4582, test_f1: 0.6526
 epoch: 65, train_loss: 0.3023, test_loss: 1.5024, test_f1: 0.6333
 epoch: 66, train_loss: 0.3258, test_loss: 1.4485, test_f1: 0.6265
 epoch: 67, train_loss: 0.3204, test_loss: 1.4201, test_f1: 0.6514
 epoch: 68, train_loss: 0.3037, test_loss: 1.6158, test_f1: 0.6251
 epoch: 69, train_loss: 0.2844, test_loss: 1.6254, test_f1: 0.6267
 epoch: 70, train_loss: 0.2899, test_loss: 1.5758, test_f1: 0.6633
 epoch: 71, train_loss: 0.2722, test_loss: 1.5189, test_f1: 0.6389
 epoch: 72, train_loss: 0.2711, test_loss: 1.5128, test_f1: 0.6463
 epoch: 73, train_loss: 0.2958, test_loss: 1.5893, test_f1: 0.6346
 epoch: 74, train_loss: 0.2699, test_loss: 1.6257, test_f1: 0.6578
 epoch: 75, train_loss: 0.2606, test_loss: 1.6159, test_f1: 0.6467
 epoch: 76, train_loss: 0.2497, test_loss: 1.6327, test_f1: 0.6417
 epoch: 77, train_loss: 0.2507, test_loss: 1.6990, test_f1: 0.6400
 epoch: 78, train_loss: 0.2708, test_loss: 1.6069, test_f1: 0.6475
 epoch: 79, train_loss: 0.2537, test_loss: 1.6517, test_f1: 0.6439
 epoch: 80, train_loss: 0.2483, test_loss: 1.6737, test_f1: 0.6570
 epoch: 81, train_loss: 0.2543, test_loss: 1.5616, test_f1: 0.6355
 epoch: 82, train_loss: 0.2532, test_loss: 1.6001, test_f1: 0.6525
 epoch: 83, train_loss: 0.2441, test_loss: 1.6565, test_f1: 0.6503
 epoch: 84, train_loss: 0.2477, test_loss: 1.6955, test_f1: 0.6425
 epoch: 85, train_loss: 0.2272, test_loss: 1.7253, test_f1: 0.6422
 epoch: 86, train_loss: 0.2422, test_loss: 1.7841, test_f1: 0.6375
 epoch: 87, train_loss: 0.2522, test_loss: 1.6758, test_f1: 0.6580
 epoch: 88, train_loss: 0.2328, test_loss: 1.7813, test_f1: 0.6428
 epoch: 89, train_loss: 0.2485, test_loss: 1.8065, test_f1: 0.6362
 epoch: 90, train_loss: 0.2411, test_loss: 1.8606, test_f1: 0.6174
 epoch: 91, train_loss: 0.2340, test_loss: 1.6712, test_f1: 0.6360
 epoch: 92, train_loss: 0.2227, test_loss: 1.7098, test_f1: 0.6378
 epoch: 93, train_loss: 0.2281, test_loss: 1.8287, test_f1: 0.6352
 epoch: 94, train_loss: 0.2194, test_loss: 1.6570, test_f1: 0.6475
 epoch: 95, train_loss: 0.2244, test_loss: 1.8659, test_f1: 0.6345
 epoch: 96, train_loss: 0.2132, test_loss: 1.8368, test_f1: 0.6582
 epoch: 97, train_loss: 0.2090, test_loss: 1.7671, test_f1: 0.6292
 epoch: 98, train_loss: 0.2052, test_loss: 1.9028, test_f1: 0.6323
 epoch: 99, train_loss: 0.2206, test_loss: 1.7783, test_f1: 0.6260
##################ITERATION #8 ****************************************
 epoch: 0, train_loss: 1.2935, test_loss: 1.0547, test_f1: 0.4226
 epoch: 1, train_loss: 1.0170, test_loss: 0.9203, test_f1: 0.4683
 epoch: 2, train_loss: 0.9744, test_loss: 0.9398, test_f1: 0.5078
 epoch: 3, train_loss: 0.9383, test_loss: 0.9330, test_f1: 0.4955
 epoch: 4, train_loss: 0.9102, test_loss: 0.9598, test_f1: 0.5108
 epoch: 5, train_loss: 0.9189, test_loss: 0.9584, test_f1: 0.4857
 epoch: 6, train_loss: 0.8856, test_loss: 0.9104, test_f1: 0.5325
 epoch: 7, train_loss: 0.8588, test_loss: 0.8643, test_f1: 0.5509
 epoch: 8, train_loss: 0.8546, test_loss: 0.9613, test_f1: 0.5342
 epoch: 9, train_loss: 0.8420, test_loss: 1.0101, test_f1: 0.5725
 epoch: 10, train_loss: 0.8560, test_loss: 0.8930, test_f1: 0.5822
 epoch: 11, train_loss: 0.8228, test_loss: 0.9038, test_f1: 0.5706
 epoch: 12, train_loss: 0.8040, test_loss: 0.8989, test_f1: 0.5787
 epoch: 13, train_loss: 0.7935, test_loss: 0.9446, test_f1: 0.5944
 epoch: 14, train_loss: 0.7747, test_loss: 0.9183, test_f1: 0.5961
 epoch: 15, train_loss: 0.7705, test_loss: 0.9080, test_f1: 0.5722
 epoch: 16, train_loss: 0.7709, test_loss: 0.9716, test_f1: 0.5782
 epoch: 17, train_loss: 0.7609, test_loss: 0.9425, test_f1: 0.6014
 epoch: 18, train_loss: 0.7365, test_loss: 0.8811, test_f1: 0.5999
 epoch: 19, train_loss: 0.7466, test_loss: 1.0297, test_f1: 0.5626
 epoch: 20, train_loss: 0.7446, test_loss: 0.8695, test_f1: 0.6084
 epoch: 21, train_loss: 0.7105, test_loss: 0.9485, test_f1: 0.6091
 epoch: 22, train_loss: 0.7053, test_loss: 0.9216, test_f1: 0.6091
 epoch: 23, train_loss: 0.7060, test_loss: 0.9713, test_f1: 0.6087
 epoch: 24, train_loss: 0.7197, test_loss: 0.9652, test_f1: 0.5835
 epoch: 25, train_loss: 0.6852, test_loss: 1.0529, test_f1: 0.6063
 epoch: 26, train_loss: 0.6758, test_loss: 0.9397, test_f1: 0.6111
 epoch: 27, train_loss: 0.6589, test_loss: 1.0080, test_f1: 0.6040
 epoch: 28, train_loss: 0.6672, test_loss: 0.9583, test_f1: 0.6271
 epoch: 29, train_loss: 0.6497, test_loss: 1.0340, test_f1: 0.6000
 epoch: 30, train_loss: 0.6327, test_loss: 0.9615, test_f1: 0.6178
 epoch: 31, train_loss: 0.6276, test_loss: 1.0190, test_f1: 0.6143
 epoch: 32, train_loss: 0.6165, test_loss: 1.0641, test_f1: 0.5895
 epoch: 33, train_loss: 0.6056, test_loss: 0.9913, test_f1: 0.5942
 epoch: 34, train_loss: 0.6177, test_loss: 1.0689, test_f1: 0.6105
 epoch: 35, train_loss: 0.6189, test_loss: 1.0997, test_f1: 0.5970
 epoch: 36, train_loss: 0.6273, test_loss: 1.0467, test_f1: 0.5873
 epoch: 37, train_loss: 0.5916, test_loss: 1.0383, test_f1: 0.6288
 epoch: 38, train_loss: 0.5635, test_loss: 1.1229, test_f1: 0.6540
 epoch: 39, train_loss: 0.5883, test_loss: 1.1276, test_f1: 0.6301
 epoch: 40, train_loss: 0.5712, test_loss: 1.1059, test_f1: 0.6280
 epoch: 41, train_loss: 0.5699, test_loss: 1.0591, test_f1: 0.6363
 epoch: 42, train_loss: 0.5490, test_loss: 1.1895, test_f1: 0.6393
 epoch: 43, train_loss: 0.5461, test_loss: 1.1610, test_f1: 0.6157
 epoch: 44, train_loss: 0.5545, test_loss: 0.9909, test_f1: 0.6601
 epoch: 45, train_loss: 0.5189, test_loss: 1.1371, test_f1: 0.6303
 epoch: 46, train_loss: 0.5294, test_loss: 1.1532, test_f1: 0.6201
 epoch: 47, train_loss: 0.5101, test_loss: 1.0796, test_f1: 0.6360
 epoch: 48, train_loss: 0.5154, test_loss: 1.0840, test_f1: 0.6084
 epoch: 49, train_loss: 0.5120, test_loss: 1.1356, test_f1: 0.6349
 epoch: 50, train_loss: 0.4984, test_loss: 1.2167, test_f1: 0.6319
 epoch: 51, train_loss: 0.4515, test_loss: 1.1283, test_f1: 0.6488
 epoch: 52, train_loss: 0.4249, test_loss: 1.2089, test_f1: 0.6502
 epoch: 53, train_loss: 0.4180, test_loss: 1.2247, test_f1: 0.6326
 epoch: 54, train_loss: 0.3956, test_loss: 1.2567, test_f1: 0.6353
 epoch: 55, train_loss: 0.3788, test_loss: 1.3177, test_f1: 0.6323
 epoch: 56, train_loss: 0.3692, test_loss: 1.3562, test_f1: 0.6443
 epoch: 57, train_loss: 0.3638, test_loss: 1.3031, test_f1: 0.6443
 epoch: 58, train_loss: 0.3562, test_loss: 1.3847, test_f1: 0.6426
 epoch: 59, train_loss: 0.3622, test_loss: 1.3527, test_f1: 0.6316
 epoch: 60, train_loss: 0.3555, test_loss: 1.4369, test_f1: 0.6542
 epoch: 61, train_loss: 0.3517, test_loss: 1.3644, test_f1: 0.6474
 epoch: 62, train_loss: 0.3728, test_loss: 1.3976, test_f1: 0.6449
 epoch: 63, train_loss: 0.3585, test_loss: 1.3238, test_f1: 0.6402
 epoch: 64, train_loss: 0.3476, test_loss: 1.4493, test_f1: 0.6327
 epoch: 65, train_loss: 0.3382, test_loss: 1.4334, test_f1: 0.6375
 epoch: 66, train_loss: 0.3420, test_loss: 1.3998, test_f1: 0.6563
 epoch: 67, train_loss: 0.3283, test_loss: 1.4769, test_f1: 0.6380
 epoch: 68, train_loss: 0.3494, test_loss: 1.4885, test_f1: 0.6322
 epoch: 69, train_loss: 0.3232, test_loss: 1.6330, test_f1: 0.6114
 epoch: 70, train_loss: 0.3230, test_loss: 1.5742, test_f1: 0.6290
 epoch: 71, train_loss: 0.3193, test_loss: 1.5786, test_f1: 0.6247
 epoch: 72, train_loss: 0.3045, test_loss: 1.4940, test_f1: 0.6428
 epoch: 73, train_loss: 0.3057, test_loss: 1.5656, test_f1: 0.6383
 epoch: 74, train_loss: 0.3219, test_loss: 1.4921, test_f1: 0.6219
 epoch: 75, train_loss: 0.3106, test_loss: 1.5064, test_f1: 0.6539
 epoch: 76, train_loss: 0.2880, test_loss: 1.5759, test_f1: 0.6527
 epoch: 77, train_loss: 0.2929, test_loss: 1.6527, test_f1: 0.6261
 epoch: 78, train_loss: 0.2765, test_loss: 1.6241, test_f1: 0.6317
 epoch: 79, train_loss: 0.2985, test_loss: 1.5100, test_f1: 0.6121
 epoch: 80, train_loss: 0.2699, test_loss: 1.5902, test_f1: 0.6360
 epoch: 81, train_loss: 0.2702, test_loss: 1.6927, test_f1: 0.6265
 epoch: 82, train_loss: 0.2656, test_loss: 1.7913, test_f1: 0.6369
 epoch: 83, train_loss: 0.2750, test_loss: 1.7159, test_f1: 0.6315
 epoch: 84, train_loss: 0.2715, test_loss: 1.5823, test_f1: 0.6379
 epoch: 85, train_loss: 0.2568, test_loss: 1.6158, test_f1: 0.6314
 epoch: 86, train_loss: 0.2619, test_loss: 1.7699, test_f1: 0.6245
 epoch: 87, train_loss: 0.2628, test_loss: 1.7225, test_f1: 0.6288
 epoch: 88, train_loss: 0.2799, test_loss: 1.7618, test_f1: 0.6262
 epoch: 89, train_loss: 0.2562, test_loss: 1.7532, test_f1: 0.6174
 epoch: 90, train_loss: 0.2639, test_loss: 1.7328, test_f1: 0.6388
 epoch: 91, train_loss: 0.2719, test_loss: 1.7186, test_f1: 0.6154
 epoch: 92, train_loss: 0.2440, test_loss: 1.8367, test_f1: 0.6308
 epoch: 93, train_loss: 0.2435, test_loss: 1.7571, test_f1: 0.6319
 epoch: 94, train_loss: 0.2407, test_loss: 1.9039, test_f1: 0.6224
 epoch: 95, train_loss: 0.2573, test_loss: 1.8333, test_f1: 0.6343
 epoch: 96, train_loss: 0.2471, test_loss: 1.8467, test_f1: 0.6240
 epoch: 97, train_loss: 0.2365, test_loss: 1.8393, test_f1: 0.6321
 epoch: 98, train_loss: 0.2258, test_loss: 1.9671, test_f1: 0.6367
 epoch: 99, train_loss: 0.2431, test_loss: 1.8849, test_f1: 0.6227
##################ITERATION #9 ****************************************
 epoch: 0, train_loss: 1.3208, test_loss: 1.0265, test_f1: 0.4946
 epoch: 1, train_loss: 1.0145, test_loss: 0.9996, test_f1: 0.5292
 epoch: 2, train_loss: 0.9683, test_loss: 0.9807, test_f1: 0.4751
 epoch: 3, train_loss: 0.9339, test_loss: 0.9691, test_f1: 0.4851
 epoch: 4, train_loss: 0.9270, test_loss: 0.9504, test_f1: 0.5383
 epoch: 5, train_loss: 0.8943, test_loss: 0.9483, test_f1: 0.5327
 epoch: 6, train_loss: 0.8664, test_loss: 0.9472, test_f1: 0.5476
 epoch: 7, train_loss: 0.8746, test_loss: 0.9853, test_f1: 0.5225
 epoch: 8, train_loss: 0.8524, test_loss: 0.9982, test_f1: 0.5537
 epoch: 9, train_loss: 0.8384, test_loss: 0.9855, test_f1: 0.5351
 epoch: 10, train_loss: 0.8376, test_loss: 0.9746, test_f1: 0.5595
 epoch: 11, train_loss: 0.7961, test_loss: 1.0255, test_f1: 0.5386
 epoch: 12, train_loss: 0.8111, test_loss: 0.9618, test_f1: 0.5583
 epoch: 13, train_loss: 0.7950, test_loss: 1.0214, test_f1: 0.5496
 epoch: 14, train_loss: 0.7719, test_loss: 0.9707, test_f1: 0.6012
 epoch: 15, train_loss: 0.7655, test_loss: 0.9728, test_f1: 0.5622
 epoch: 16, train_loss: 0.7714, test_loss: 1.0206, test_f1: 0.6226
 epoch: 17, train_loss: 0.7621, test_loss: 1.0173, test_f1: 0.5808
 epoch: 18, train_loss: 0.7419, test_loss: 0.9371, test_f1: 0.6266
 epoch: 19, train_loss: 0.7165, test_loss: 0.9419, test_f1: 0.6100
 epoch: 20, train_loss: 0.7193, test_loss: 1.0008, test_f1: 0.6217
 epoch: 21, train_loss: 0.7176, test_loss: 1.0729, test_f1: 0.5840
 epoch: 22, train_loss: 0.7079, test_loss: 1.0514, test_f1: 0.5774
 epoch: 23, train_loss: 0.7006, test_loss: 1.0526, test_f1: 0.6132
 epoch: 24, train_loss: 0.6960, test_loss: 1.0344, test_f1: 0.5819
 epoch: 25, train_loss: 0.6989, test_loss: 1.0244, test_f1: 0.6154
 epoch: 26, train_loss: 0.6836, test_loss: 1.0785, test_f1: 0.5763
 epoch: 27, train_loss: 0.6659, test_loss: 1.1299, test_f1: 0.5929
 epoch: 28, train_loss: 0.6662, test_loss: 1.0491, test_f1: 0.6182
 epoch: 29, train_loss: 0.6514, test_loss: 1.0375, test_f1: 0.6172
 epoch: 30, train_loss: 0.6307, test_loss: 1.1133, test_f1: 0.6481
 epoch: 31, train_loss: 0.6458, test_loss: 1.0664, test_f1: 0.6224
 epoch: 32, train_loss: 0.6254, test_loss: 1.0610, test_f1: 0.6162
 epoch: 33, train_loss: 0.6272, test_loss: 1.2400, test_f1: 0.5606
 epoch: 34, train_loss: 0.5966, test_loss: 1.1697, test_f1: 0.6121
 epoch: 35, train_loss: 0.6171, test_loss: 1.0562, test_f1: 0.6160
 epoch: 36, train_loss: 0.6004, test_loss: 1.0415, test_f1: 0.6679
 epoch: 37, train_loss: 0.5911, test_loss: 0.9641, test_f1: 0.6477
 epoch: 38, train_loss: 0.5906, test_loss: 1.0899, test_f1: 0.6375
 epoch: 39, train_loss: 0.5806, test_loss: 1.1367, test_f1: 0.6583
 epoch: 40, train_loss: 0.5597, test_loss: 1.0708, test_f1: 0.6396
 epoch: 41, train_loss: 0.5365, test_loss: 1.0982, test_f1: 0.6130
 epoch: 42, train_loss: 0.5279, test_loss: 1.0772, test_f1: 0.6183
 epoch: 43, train_loss: 0.5289, test_loss: 1.1935, test_f1: 0.6262
 epoch: 44, train_loss: 0.5199, test_loss: 1.1520, test_f1: 0.6180
 epoch: 45, train_loss: 0.5082, test_loss: 1.1792, test_f1: 0.6076
 epoch: 46, train_loss: 0.4877, test_loss: 1.1592, test_f1: 0.6322
 epoch: 47, train_loss: 0.5186, test_loss: 1.1477, test_f1: 0.6131
 epoch: 48, train_loss: 0.4732, test_loss: 1.1842, test_f1: 0.6542
 epoch: 49, train_loss: 0.4908, test_loss: 1.0926, test_f1: 0.6372
 epoch: 50, train_loss: 0.5030, test_loss: 1.1469, test_f1: 0.6184
 epoch: 51, train_loss: 0.4428, test_loss: 1.1554, test_f1: 0.6231
 epoch: 52, train_loss: 0.3873, test_loss: 1.2208, test_f1: 0.6460
 epoch: 53, train_loss: 0.3933, test_loss: 1.2250, test_f1: 0.6499
 epoch: 54, train_loss: 0.3825, test_loss: 1.2192, test_f1: 0.6518
 epoch: 55, train_loss: 0.3543, test_loss: 1.2749, test_f1: 0.6621
 epoch: 56, train_loss: 0.3510, test_loss: 1.2523, test_f1: 0.6799
 epoch: 57, train_loss: 0.3724, test_loss: 1.2876, test_f1: 0.6687
 epoch: 58, train_loss: 0.3554, test_loss: 1.2860, test_f1: 0.6612
 epoch: 59, train_loss: 0.3582, test_loss: 1.3348, test_f1: 0.6601
 epoch: 60, train_loss: 0.3474, test_loss: 1.3197, test_f1: 0.6715
 epoch: 61, train_loss: 0.3319, test_loss: 1.2485, test_f1: 0.6681
 epoch: 62, train_loss: 0.3231, test_loss: 1.3299, test_f1: 0.6549
 epoch: 63, train_loss: 0.3068, test_loss: 1.3433, test_f1: 0.6626
 epoch: 64, train_loss: 0.3512, test_loss: 1.3837, test_f1: 0.6407
 epoch: 65, train_loss: 0.3291, test_loss: 1.2749, test_f1: 0.6694
 epoch: 66, train_loss: 0.3200, test_loss: 1.3724, test_f1: 0.6570
 epoch: 67, train_loss: 0.3296, test_loss: 1.3697, test_f1: 0.6624
 epoch: 68, train_loss: 0.3132, test_loss: 1.3252, test_f1: 0.6724
 epoch: 69, train_loss: 0.2936, test_loss: 1.3709, test_f1: 0.6314
 epoch: 70, train_loss: 0.2831, test_loss: 1.3298, test_f1: 0.6640
 epoch: 71, train_loss: 0.2953, test_loss: 1.3936, test_f1: 0.6778
 epoch: 72, train_loss: 0.3045, test_loss: 1.4457, test_f1: 0.6433
 epoch: 73, train_loss: 0.2860, test_loss: 1.5451, test_f1: 0.6544
 epoch: 74, train_loss: 0.2782, test_loss: 1.5571, test_f1: 0.6521
 epoch: 75, train_loss: 0.2825, test_loss: 1.4940, test_f1: 0.6414
 epoch: 76, train_loss: 0.2698, test_loss: 1.6260, test_f1: 0.6222
 epoch: 77, train_loss: 0.2709, test_loss: 1.5885, test_f1: 0.6307
 epoch: 78, train_loss: 0.2612, test_loss: 1.5030, test_f1: 0.6669
 epoch: 79, train_loss: 0.2706, test_loss: 1.5729, test_f1: 0.6490
 epoch: 80, train_loss: 0.2596, test_loss: 1.5781, test_f1: 0.6423
 epoch: 81, train_loss: 0.2688, test_loss: 1.6248, test_f1: 0.6253
 epoch: 82, train_loss: 0.2726, test_loss: 1.5935, test_f1: 0.6420
 epoch: 83, train_loss: 0.2480, test_loss: 1.6644, test_f1: 0.6186
 epoch: 84, train_loss: 0.2660, test_loss: 1.7457, test_f1: 0.6343
 epoch: 85, train_loss: 0.2510, test_loss: 1.6677, test_f1: 0.6310
 epoch: 86, train_loss: 0.2452, test_loss: 1.7580, test_f1: 0.6494
 epoch: 87, train_loss: 0.2185, test_loss: 1.7059, test_f1: 0.6178
 epoch: 88, train_loss: 0.2312, test_loss: 1.8100, test_f1: 0.6105
 epoch: 89, train_loss: 0.2282, test_loss: 1.6517, test_f1: 0.6522
 epoch: 90, train_loss: 0.2387, test_loss: 1.8166, test_f1: 0.6383
 epoch: 91, train_loss: 0.2381, test_loss: 1.6616, test_f1: 0.6400
 epoch: 92, train_loss: 0.2375, test_loss: 1.6023, test_f1: 0.6288
 epoch: 93, train_loss: 0.2291, test_loss: 1.6769, test_f1: 0.6403
 epoch: 94, train_loss: 0.2238, test_loss: 1.6106, test_f1: 0.6483
 epoch: 95, train_loss: 0.2371, test_loss: 1.8062, test_f1: 0.6440
 epoch: 96, train_loss: 0.2149, test_loss: 1.5880, test_f1: 0.6700
 epoch: 97, train_loss: 0.2064, test_loss: 1.7222, test_f1: 0.6404
 epoch: 98, train_loss: 0.1986, test_loss: 1.6923, test_f1: 0.6439
 epoch: 99, train_loss: 0.2030, test_loss: 1.9104, test_f1: 0.6290

Training completed in 815.17 seconds
Best F1: 0.6920 at epoch 95
Mean F1 across iterations: 0.6779  0.0105
========================FINAL RESULTS================================
FEGIN weighted F1: 0.6920  0.0105
python main.py --data ltspice_examples --representation component_net --model FEGIN --layers 5 --hiddens 128 --batch_size 64 --lr 0.001 --emb_size 250 --epochs 100 --save_appendix component_net_L5_H128_BS64_LR0.001_E250 --no_val
-----



STDERR:
  File "main.py", line 370, in <module>
    main()
  File "main.py", line 254, in main
    dataset = dataset_class(
  File "/home/philip/projects/ltspice_examples_code_repo/Circuit-Completion-Using-GNNs/component_classification_with_link_prediction_head/evaluation/FEGIN/kernel/circuit_datasets.py", line 15, in __init__
    self.data, self.slices = torch.load(self.processed_paths[0])
  File "/home/philip/.local/lib/python3.8/site-packages/torch/serialization.py", line 1040, in load
    warnings.warn(
  File "/usr/lib/python3.8/warnings.py", line 109, in _showwarnmsg
    sw(msg.message, msg.category, msg.filename, msg.lineno,
  File "main.py", line 47, in warn_with_traceback
    traceback.print_stack(file=log)
/home/philip/projects/ltspice_examples_code_repo/Circuit-Completion-Using-GNNs/component_classification_with_link_prediction_head/evaluation/FEGIN/kernel/circuit_datasets.py:15: FutureWarning: You are using `torch.load` with `weights_only=False` (the current default value), which uses the default pickle module implicitly. It is possible to construct malicious pickle data which will execute arbitrary code during unpickling (See https://github.com/pytorch/pytorch/blob/main/SECURITY.md#untrusted-models for more details). In a future release, the default value for `weights_only` will be flipped to `True`. This limits the functions that could be executed during unpickling. Arbitrary objects will no longer be allowed to be loaded via this mode unless they are explicitly allowlisted by the user via `torch.serialization.add_safe_globals`. We recommend you start setting `weights_only=True` for any use case where you don't have full control of the loaded file. Please open an issue on GitHub for any issues related to this experimental feature.
  self.data, self.slices = torch.load(self.processed_paths[0])
