STDOUT:
Results will be saved in /home/philip/projects/ltspice_examples_code_repo/Circuit-Completion-Using-GNNs/component_classification_with_link_prediction_head/evaluation/FEGIN/results/model_FEGIN_dataset_ltspice_examples
Command line input: python main.py --data ltspice_examples --representation component_net --model FEGIN --layers 5 --hiddens 64 --batch_size 64 --lr 0.001 --emb_size 512 --epochs 100 --save_appendix component_net_L5_H64_BS64_LR0.001_E512 --no_val
 is saved.
-----
ltspice_examples - FEGIN
Using 5 layers, 64 hidden units, h = 2
Loading component_net representation dataset
ENTERED
Training FEGIN on component_net representation
Train: 3558, Test: 846
##################ITERATION #0 ****************************************
 epoch: 0, train_loss: 1.2520, test_loss: 1.1441, test_f1: 0.3959
 epoch: 1, train_loss: 1.1047, test_loss: 1.0474, test_f1: 0.4816
 epoch: 2, train_loss: 1.0153, test_loss: 0.9564, test_f1: 0.4753
 epoch: 3, train_loss: 0.9646, test_loss: 0.9541, test_f1: 0.5220
 epoch: 4, train_loss: 0.9432, test_loss: 0.9552, test_f1: 0.4820
 epoch: 5, train_loss: 0.9166, test_loss: 0.9387, test_f1: 0.5288
 epoch: 6, train_loss: 0.8902, test_loss: 0.9132, test_f1: 0.5442
 epoch: 7, train_loss: 0.8891, test_loss: 0.9748, test_f1: 0.5431
 epoch: 8, train_loss: 0.8757, test_loss: 0.9408, test_f1: 0.5577
 epoch: 9, train_loss: 0.8667, test_loss: 0.9884, test_f1: 0.5443
 epoch: 10, train_loss: 0.8468, test_loss: 0.9979, test_f1: 0.5048
 epoch: 11, train_loss: 0.8355, test_loss: 0.9054, test_f1: 0.5506
 epoch: 12, train_loss: 0.8373, test_loss: 0.9091, test_f1: 0.5494
 epoch: 13, train_loss: 0.8192, test_loss: 0.9772, test_f1: 0.5703
 epoch: 14, train_loss: 0.8191, test_loss: 0.9643, test_f1: 0.5969
 epoch: 15, train_loss: 0.7996, test_loss: 0.9595, test_f1: 0.6015
 epoch: 16, train_loss: 0.8163, test_loss: 0.9847, test_f1: 0.5442
 epoch: 17, train_loss: 0.8177, test_loss: 0.9743, test_f1: 0.5418
 epoch: 18, train_loss: 0.8019, test_loss: 0.8980, test_f1: 0.5981
 epoch: 19, train_loss: 0.7812, test_loss: 0.9684, test_f1: 0.5826
 epoch: 20, train_loss: 0.7869, test_loss: 1.0207, test_f1: 0.5912
 epoch: 21, train_loss: 0.7871, test_loss: 0.9286, test_f1: 0.5854
 epoch: 22, train_loss: 0.7697, test_loss: 0.9958, test_f1: 0.5578
 epoch: 23, train_loss: 0.7607, test_loss: 0.9933, test_f1: 0.5843
 epoch: 24, train_loss: 0.7570, test_loss: 0.9154, test_f1: 0.6356
 epoch: 25, train_loss: 0.7421, test_loss: 0.9339, test_f1: 0.6390
 epoch: 26, train_loss: 0.7410, test_loss: 0.9410, test_f1: 0.6154
 epoch: 27, train_loss: 0.7211, test_loss: 0.9384, test_f1: 0.5907
 epoch: 28, train_loss: 0.7159, test_loss: 0.9352, test_f1: 0.6000
 epoch: 29, train_loss: 0.6988, test_loss: 0.9868, test_f1: 0.6281
 epoch: 30, train_loss: 0.7310, test_loss: 0.9639, test_f1: 0.5933
 epoch: 31, train_loss: 0.7094, test_loss: 0.9593, test_f1: 0.5943
 epoch: 32, train_loss: 0.6939, test_loss: 0.9608, test_f1: 0.5899
 epoch: 33, train_loss: 0.6921, test_loss: 0.9679, test_f1: 0.6032
 epoch: 34, train_loss: 0.6832, test_loss: 0.9507, test_f1: 0.6095
 epoch: 35, train_loss: 0.6722, test_loss: 0.9742, test_f1: 0.6112
 epoch: 36, train_loss: 0.6779, test_loss: 1.1303, test_f1: 0.5484
 epoch: 37, train_loss: 0.6586, test_loss: 0.9473, test_f1: 0.6154
 epoch: 38, train_loss: 0.6663, test_loss: 0.9864, test_f1: 0.5956
 epoch: 39, train_loss: 0.6504, test_loss: 1.0141, test_f1: 0.6096
 epoch: 40, train_loss: 0.6552, test_loss: 0.9714, test_f1: 0.6370
 epoch: 41, train_loss: 0.6546, test_loss: 1.0529, test_f1: 0.6140
 epoch: 42, train_loss: 0.6534, test_loss: 1.0459, test_f1: 0.6406
 epoch: 43, train_loss: 0.6272, test_loss: 1.0359, test_f1: 0.6286
 epoch: 44, train_loss: 0.6317, test_loss: 1.0140, test_f1: 0.6422
 epoch: 45, train_loss: 0.6387, test_loss: 0.9707, test_f1: 0.6250
 epoch: 46, train_loss: 0.6058, test_loss: 0.9959, test_f1: 0.6423
 epoch: 47, train_loss: 0.6405, test_loss: 0.9937, test_f1: 0.6089
 epoch: 48, train_loss: 0.6177, test_loss: 0.9952, test_f1: 0.6447
 epoch: 49, train_loss: 0.6118, test_loss: 0.9987, test_f1: 0.6258
 epoch: 50, train_loss: 0.5861, test_loss: 1.0252, test_f1: 0.6261
 epoch: 51, train_loss: 0.5833, test_loss: 1.0045, test_f1: 0.6357
 epoch: 52, train_loss: 0.5300, test_loss: 1.0512, test_f1: 0.6268
 epoch: 53, train_loss: 0.5375, test_loss: 1.0023, test_f1: 0.6634
 epoch: 54, train_loss: 0.5259, test_loss: 1.1141, test_f1: 0.6316
 epoch: 55, train_loss: 0.5228, test_loss: 1.1636, test_f1: 0.6192
 epoch: 56, train_loss: 0.5238, test_loss: 1.0894, test_f1: 0.6341
 epoch: 57, train_loss: 0.5022, test_loss: 1.0918, test_f1: 0.6388
 epoch: 58, train_loss: 0.5049, test_loss: 1.0988, test_f1: 0.6502
 epoch: 59, train_loss: 0.4965, test_loss: 1.0983, test_f1: 0.6380
 epoch: 60, train_loss: 0.4905, test_loss: 1.2071, test_f1: 0.6127
 epoch: 61, train_loss: 0.4928, test_loss: 1.1403, test_f1: 0.6593
 epoch: 62, train_loss: 0.4861, test_loss: 1.1852, test_f1: 0.6491
 epoch: 63, train_loss: 0.4818, test_loss: 1.2080, test_f1: 0.6337
 epoch: 64, train_loss: 0.4699, test_loss: 1.1957, test_f1: 0.6273
 epoch: 65, train_loss: 0.4617, test_loss: 1.1550, test_f1: 0.6399
 epoch: 66, train_loss: 0.4590, test_loss: 1.1934, test_f1: 0.6614
 epoch: 67, train_loss: 0.4691, test_loss: 1.1871, test_f1: 0.6373
 epoch: 68, train_loss: 0.4321, test_loss: 1.1950, test_f1: 0.6254
 epoch: 69, train_loss: 0.4549, test_loss: 1.2429, test_f1: 0.6197
 epoch: 70, train_loss: 0.4547, test_loss: 1.3759, test_f1: 0.6327
 epoch: 71, train_loss: 0.4512, test_loss: 1.3214, test_f1: 0.6321
 epoch: 72, train_loss: 0.4350, test_loss: 1.2371, test_f1: 0.6357
 epoch: 73, train_loss: 0.4453, test_loss: 1.2438, test_f1: 0.6470
 epoch: 74, train_loss: 0.4309, test_loss: 1.2447, test_f1: 0.6433
 epoch: 75, train_loss: 0.4194, test_loss: 1.3307, test_f1: 0.6173
 epoch: 76, train_loss: 0.4328, test_loss: 1.2512, test_f1: 0.6426
 epoch: 77, train_loss: 0.4188, test_loss: 1.3321, test_f1: 0.6462
 epoch: 78, train_loss: 0.3950, test_loss: 1.3127, test_f1: 0.6317
 epoch: 79, train_loss: 0.4023, test_loss: 1.3800, test_f1: 0.6320
 epoch: 80, train_loss: 0.4078, test_loss: 1.4139, test_f1: 0.6372
 epoch: 81, train_loss: 0.3947, test_loss: 1.3466, test_f1: 0.6393
 epoch: 82, train_loss: 0.4100, test_loss: 1.3732, test_f1: 0.6438
 epoch: 83, train_loss: 0.4078, test_loss: 1.3634, test_f1: 0.6425
 epoch: 84, train_loss: 0.4098, test_loss: 1.4218, test_f1: 0.6381
 epoch: 85, train_loss: 0.3854, test_loss: 1.3337, test_f1: 0.6185
 epoch: 86, train_loss: 0.3790, test_loss: 1.4154, test_f1: 0.6316
 epoch: 87, train_loss: 0.3657, test_loss: 1.3770, test_f1: 0.6653
 epoch: 88, train_loss: 0.4034, test_loss: 1.3943, test_f1: 0.6443
 epoch: 89, train_loss: 0.3745, test_loss: 1.4349, test_f1: 0.6477
 epoch: 90, train_loss: 0.3961, test_loss: 1.3830, test_f1: 0.6351
 epoch: 91, train_loss: 0.3577, test_loss: 1.4336, test_f1: 0.6141
 epoch: 92, train_loss: 0.3633, test_loss: 1.5957, test_f1: 0.6304
 epoch: 93, train_loss: 0.3725, test_loss: 1.5430, test_f1: 0.6436
 epoch: 94, train_loss: 0.3754, test_loss: 1.4056, test_f1: 0.6693
 epoch: 95, train_loss: 0.3592, test_loss: 1.4448, test_f1: 0.6509
 epoch: 96, train_loss: 0.3660, test_loss: 1.6061, test_f1: 0.6302
 epoch: 97, train_loss: 0.3620, test_loss: 1.4270, test_f1: 0.6369
 epoch: 98, train_loss: 0.3559, test_loss: 1.5189, test_f1: 0.6454
 epoch: 99, train_loss: 0.3420, test_loss: 1.4131, test_f1: 0.6454
##################ITERATION #1 ****************************************
 epoch: 0, train_loss: 1.1586, test_loss: 1.0432, test_f1: 0.4175
 epoch: 1, train_loss: 1.0230, test_loss: 0.9583, test_f1: 0.4592
 epoch: 2, train_loss: 0.9695, test_loss: 0.9416, test_f1: 0.5196
 epoch: 3, train_loss: 0.9618, test_loss: 0.8916, test_f1: 0.5215
 epoch: 4, train_loss: 0.9214, test_loss: 0.9680, test_f1: 0.5151
 epoch: 5, train_loss: 0.9131, test_loss: 0.8935, test_f1: 0.5297
 epoch: 6, train_loss: 0.9101, test_loss: 0.9589, test_f1: 0.5285
 epoch: 7, train_loss: 0.8893, test_loss: 0.9353, test_f1: 0.5380
 epoch: 8, train_loss: 0.8617, test_loss: 0.8957, test_f1: 0.5499
 epoch: 9, train_loss: 0.8482, test_loss: 0.8969, test_f1: 0.5670
 epoch: 10, train_loss: 0.8370, test_loss: 0.9299, test_f1: 0.5531
 epoch: 11, train_loss: 0.8369, test_loss: 0.8928, test_f1: 0.6041
 epoch: 12, train_loss: 0.8056, test_loss: 1.0141, test_f1: 0.5782
 epoch: 13, train_loss: 0.7994, test_loss: 0.9513, test_f1: 0.5810
 epoch: 14, train_loss: 0.8204, test_loss: 0.9243, test_f1: 0.5786
 epoch: 15, train_loss: 0.7843, test_loss: 0.9418, test_f1: 0.5718
 epoch: 16, train_loss: 0.7849, test_loss: 0.9547, test_f1: 0.5862
 epoch: 17, train_loss: 0.7762, test_loss: 0.9596, test_f1: 0.5663
 epoch: 18, train_loss: 0.7618, test_loss: 0.9447, test_f1: 0.5663
 epoch: 19, train_loss: 0.7573, test_loss: 0.8965, test_f1: 0.6122
 epoch: 20, train_loss: 0.7524, test_loss: 0.9680, test_f1: 0.5868
 epoch: 21, train_loss: 0.7490, test_loss: 0.9027, test_f1: 0.6001
 epoch: 22, train_loss: 0.7229, test_loss: 0.9544, test_f1: 0.6001
 epoch: 23, train_loss: 0.7343, test_loss: 0.9293, test_f1: 0.6143
 epoch: 24, train_loss: 0.7187, test_loss: 1.0057, test_f1: 0.5727
 epoch: 25, train_loss: 0.7073, test_loss: 0.9359, test_f1: 0.6149
 epoch: 26, train_loss: 0.7147, test_loss: 1.0056, test_f1: 0.5722
 epoch: 27, train_loss: 0.7127, test_loss: 0.8978, test_f1: 0.6338
 epoch: 28, train_loss: 0.7006, test_loss: 0.8994, test_f1: 0.5895
 epoch: 29, train_loss: 0.6881, test_loss: 1.0069, test_f1: 0.6073
 epoch: 30, train_loss: 0.6804, test_loss: 1.0034, test_f1: 0.6085
 epoch: 31, train_loss: 0.6712, test_loss: 0.9737, test_f1: 0.6333
 epoch: 32, train_loss: 0.6545, test_loss: 1.0033, test_f1: 0.6107
 epoch: 33, train_loss: 0.6660, test_loss: 1.0150, test_f1: 0.6038
 epoch: 34, train_loss: 0.6774, test_loss: 0.9957, test_f1: 0.6435
 epoch: 35, train_loss: 0.6659, test_loss: 0.9500, test_f1: 0.6305
 epoch: 36, train_loss: 0.6324, test_loss: 1.0155, test_f1: 0.6458
 epoch: 37, train_loss: 0.6414, test_loss: 0.9239, test_f1: 0.6353
 epoch: 38, train_loss: 0.6487, test_loss: 0.9971, test_f1: 0.6326
 epoch: 39, train_loss: 0.6153, test_loss: 1.0360, test_f1: 0.6282
 epoch: 40, train_loss: 0.6181, test_loss: 1.0182, test_f1: 0.6261
 epoch: 41, train_loss: 0.5977, test_loss: 0.9244, test_f1: 0.6446
 epoch: 42, train_loss: 0.5796, test_loss: 1.0678, test_f1: 0.6357
 epoch: 43, train_loss: 0.5989, test_loss: 1.0695, test_f1: 0.6208
 epoch: 44, train_loss: 0.5735, test_loss: 1.1196, test_f1: 0.6272
 epoch: 45, train_loss: 0.5722, test_loss: 1.0643, test_f1: 0.6618
 epoch: 46, train_loss: 0.5618, test_loss: 1.0886, test_f1: 0.6431
 epoch: 47, train_loss: 0.5565, test_loss: 1.0443, test_f1: 0.6311
 epoch: 48, train_loss: 0.5713, test_loss: 1.0060, test_f1: 0.6523
 epoch: 49, train_loss: 0.5459, test_loss: 1.0553, test_f1: 0.6466
 epoch: 50, train_loss: 0.5491, test_loss: 1.0289, test_f1: 0.6528
 epoch: 51, train_loss: 0.5281, test_loss: 1.0463, test_f1: 0.6759
 epoch: 52, train_loss: 0.4759, test_loss: 1.0656, test_f1: 0.6739
 epoch: 53, train_loss: 0.4751, test_loss: 1.0782, test_f1: 0.6797
 epoch: 54, train_loss: 0.4716, test_loss: 1.0704, test_f1: 0.6477
 epoch: 55, train_loss: 0.4534, test_loss: 1.1847, test_f1: 0.6455
 epoch: 56, train_loss: 0.4448, test_loss: 1.1612, test_f1: 0.6452
 epoch: 57, train_loss: 0.4580, test_loss: 1.1190, test_f1: 0.6774
 epoch: 58, train_loss: 0.4393, test_loss: 1.1869, test_f1: 0.6589
 epoch: 59, train_loss: 0.4357, test_loss: 1.1163, test_f1: 0.6442
 epoch: 60, train_loss: 0.4488, test_loss: 1.1557, test_f1: 0.6634
 epoch: 61, train_loss: 0.4194, test_loss: 1.1587, test_f1: 0.6349
 epoch: 62, train_loss: 0.4176, test_loss: 1.1849, test_f1: 0.6457
 epoch: 63, train_loss: 0.4200, test_loss: 1.2888, test_f1: 0.6283
 epoch: 64, train_loss: 0.4165, test_loss: 1.1955, test_f1: 0.6457
 epoch: 65, train_loss: 0.4148, test_loss: 1.1880, test_f1: 0.6585
 epoch: 66, train_loss: 0.3965, test_loss: 1.2791, test_f1: 0.6435
 epoch: 67, train_loss: 0.3967, test_loss: 1.3220, test_f1: 0.6413
 epoch: 68, train_loss: 0.4007, test_loss: 1.2479, test_f1: 0.6624
 epoch: 69, train_loss: 0.4046, test_loss: 1.2723, test_f1: 0.6574
 epoch: 70, train_loss: 0.3778, test_loss: 1.2709, test_f1: 0.6734
 epoch: 71, train_loss: 0.3793, test_loss: 1.2985, test_f1: 0.6485
 epoch: 72, train_loss: 0.3687, test_loss: 1.2937, test_f1: 0.6367
 epoch: 73, train_loss: 0.3569, test_loss: 1.3621, test_f1: 0.6471
 epoch: 74, train_loss: 0.3730, test_loss: 1.2841, test_f1: 0.6705
 epoch: 75, train_loss: 0.3760, test_loss: 1.3323, test_f1: 0.6471
 epoch: 76, train_loss: 0.3589, test_loss: 1.3149, test_f1: 0.6630
 epoch: 77, train_loss: 0.3562, test_loss: 1.3134, test_f1: 0.6678
 epoch: 78, train_loss: 0.3524, test_loss: 1.2987, test_f1: 0.6642
 epoch: 79, train_loss: 0.3541, test_loss: 1.2594, test_f1: 0.6828
 epoch: 80, train_loss: 0.3580, test_loss: 1.2822, test_f1: 0.6732
 epoch: 81, train_loss: 0.3275, test_loss: 1.3937, test_f1: 0.6658
 epoch: 82, train_loss: 0.3377, test_loss: 1.4549, test_f1: 0.6242
 epoch: 83, train_loss: 0.3514, test_loss: 1.3615, test_f1: 0.6755
 epoch: 84, train_loss: 0.3607, test_loss: 1.3479, test_f1: 0.6680
 epoch: 85, train_loss: 0.3130, test_loss: 1.3821, test_f1: 0.6628
 epoch: 86, train_loss: 0.3216, test_loss: 1.4901, test_f1: 0.6588
 epoch: 87, train_loss: 0.3352, test_loss: 1.4119, test_f1: 0.6515
 epoch: 88, train_loss: 0.3300, test_loss: 1.4044, test_f1: 0.6914
 epoch: 89, train_loss: 0.3307, test_loss: 1.4306, test_f1: 0.6597
 epoch: 90, train_loss: 0.3324, test_loss: 1.4750, test_f1: 0.6618
 epoch: 91, train_loss: 0.3152, test_loss: 1.4660, test_f1: 0.6654
 epoch: 92, train_loss: 0.3043, test_loss: 1.3895, test_f1: 0.6352
 epoch: 93, train_loss: 0.3182, test_loss: 1.4889, test_f1: 0.6466
 epoch: 94, train_loss: 0.2914, test_loss: 1.4522, test_f1: 0.6495
 epoch: 95, train_loss: 0.3136, test_loss: 1.4676, test_f1: 0.6729
 epoch: 96, train_loss: 0.3170, test_loss: 1.5225, test_f1: 0.6740
 epoch: 97, train_loss: 0.3211, test_loss: 1.4706, test_f1: 0.6425
 epoch: 98, train_loss: 0.3015, test_loss: 1.4893, test_f1: 0.6668
 epoch: 99, train_loss: 0.2951, test_loss: 1.5607, test_f1: 0.6702
##################ITERATION #2 ****************************************
 epoch: 0, train_loss: 1.1916, test_loss: 1.0565, test_f1: 0.4181
 epoch: 1, train_loss: 1.0344, test_loss: 0.9495, test_f1: 0.5026
 epoch: 2, train_loss: 0.9790, test_loss: 0.9433, test_f1: 0.5508
 epoch: 3, train_loss: 0.9542, test_loss: 0.9806, test_f1: 0.5366
 epoch: 4, train_loss: 0.9273, test_loss: 0.8693, test_f1: 0.5366
 epoch: 5, train_loss: 0.9072, test_loss: 0.9225, test_f1: 0.5433
 epoch: 6, train_loss: 0.8877, test_loss: 0.9073, test_f1: 0.5693
 epoch: 7, train_loss: 0.8817, test_loss: 0.9086, test_f1: 0.5828
 epoch: 8, train_loss: 0.8746, test_loss: 0.9060, test_f1: 0.5865
 epoch: 9, train_loss: 0.8558, test_loss: 0.9416, test_f1: 0.5676
 epoch: 10, train_loss: 0.8663, test_loss: 0.9167, test_f1: 0.5976
 epoch: 11, train_loss: 0.8624, test_loss: 0.9272, test_f1: 0.5884
 epoch: 12, train_loss: 0.8404, test_loss: 0.9299, test_f1: 0.5823
 epoch: 13, train_loss: 0.8186, test_loss: 0.9145, test_f1: 0.5935
 epoch: 14, train_loss: 0.8027, test_loss: 0.9040, test_f1: 0.5804
 epoch: 15, train_loss: 0.8073, test_loss: 0.9786, test_f1: 0.5898
 epoch: 16, train_loss: 0.8180, test_loss: 0.9708, test_f1: 0.5929
 epoch: 17, train_loss: 0.7875, test_loss: 0.8939, test_f1: 0.5826
 epoch: 18, train_loss: 0.7734, test_loss: 1.0002, test_f1: 0.5826
 epoch: 19, train_loss: 0.7706, test_loss: 0.9419, test_f1: 0.6086
 epoch: 20, train_loss: 0.7658, test_loss: 0.9662, test_f1: 0.5706
 epoch: 21, train_loss: 0.7585, test_loss: 0.9477, test_f1: 0.6202
 epoch: 22, train_loss: 0.7640, test_loss: 0.9015, test_f1: 0.5928
 epoch: 23, train_loss: 0.7565, test_loss: 0.9030, test_f1: 0.5961
 epoch: 24, train_loss: 0.7406, test_loss: 0.8796, test_f1: 0.6076
 epoch: 25, train_loss: 0.7203, test_loss: 0.8707, test_f1: 0.6214
 epoch: 26, train_loss: 0.7301, test_loss: 0.8819, test_f1: 0.6111
 epoch: 27, train_loss: 0.7204, test_loss: 0.9188, test_f1: 0.5926
 epoch: 28, train_loss: 0.7124, test_loss: 1.0291, test_f1: 0.5922
 epoch: 29, train_loss: 0.7130, test_loss: 0.8655, test_f1: 0.6301
 epoch: 30, train_loss: 0.6988, test_loss: 0.8710, test_f1: 0.6001
 epoch: 31, train_loss: 0.6838, test_loss: 1.0489, test_f1: 0.5687
 epoch: 32, train_loss: 0.6795, test_loss: 0.9994, test_f1: 0.5638
 epoch: 33, train_loss: 0.6691, test_loss: 0.9462, test_f1: 0.6199
 epoch: 34, train_loss: 0.6609, test_loss: 0.9351, test_f1: 0.6072
 epoch: 35, train_loss: 0.6556, test_loss: 1.0172, test_f1: 0.5473
 epoch: 36, train_loss: 0.6552, test_loss: 0.9631, test_f1: 0.5934
 epoch: 37, train_loss: 0.6488, test_loss: 1.0338, test_f1: 0.5902
 epoch: 38, train_loss: 0.6535, test_loss: 0.9221, test_f1: 0.6341
 epoch: 39, train_loss: 0.6270, test_loss: 0.9708, test_f1: 0.5856
 epoch: 40, train_loss: 0.6351, test_loss: 0.9493, test_f1: 0.6542
 epoch: 41, train_loss: 0.6141, test_loss: 0.9751, test_f1: 0.6112
 epoch: 42, train_loss: 0.6089, test_loss: 0.9967, test_f1: 0.6207
 epoch: 43, train_loss: 0.6081, test_loss: 0.9600, test_f1: 0.6216
 epoch: 44, train_loss: 0.5943, test_loss: 0.9416, test_f1: 0.6628
 epoch: 45, train_loss: 0.5931, test_loss: 0.9734, test_f1: 0.6476
 epoch: 46, train_loss: 0.5836, test_loss: 1.0064, test_f1: 0.6265
 epoch: 47, train_loss: 0.5717, test_loss: 1.0165, test_f1: 0.6366
 epoch: 48, train_loss: 0.5692, test_loss: 1.0946, test_f1: 0.6321
 epoch: 49, train_loss: 0.5619, test_loss: 1.0414, test_f1: 0.6417
 epoch: 50, train_loss: 0.5486, test_loss: 1.0581, test_f1: 0.6227
 epoch: 51, train_loss: 0.5228, test_loss: 1.0556, test_f1: 0.6408
 epoch: 52, train_loss: 0.5111, test_loss: 1.0006, test_f1: 0.6572
 epoch: 53, train_loss: 0.4846, test_loss: 1.1016, test_f1: 0.6508
 epoch: 54, train_loss: 0.4895, test_loss: 1.1486, test_f1: 0.6328
 epoch: 55, train_loss: 0.4790, test_loss: 1.1239, test_f1: 0.6707
 epoch: 56, train_loss: 0.4746, test_loss: 1.0930, test_f1: 0.6609
 epoch: 57, train_loss: 0.4576, test_loss: 1.1613, test_f1: 0.6446
 epoch: 58, train_loss: 0.4649, test_loss: 1.1363, test_f1: 0.6584
 epoch: 59, train_loss: 0.4567, test_loss: 1.2253, test_f1: 0.6564
 epoch: 60, train_loss: 0.4423, test_loss: 1.1546, test_f1: 0.6468
 epoch: 61, train_loss: 0.4541, test_loss: 1.2790, test_f1: 0.6047
 epoch: 62, train_loss: 0.4549, test_loss: 1.1232, test_f1: 0.6611
 epoch: 63, train_loss: 0.4298, test_loss: 1.2057, test_f1: 0.6411
 epoch: 64, train_loss: 0.4373, test_loss: 1.1634, test_f1: 0.6662
 epoch: 65, train_loss: 0.4234, test_loss: 1.1674, test_f1: 0.6651
 epoch: 66, train_loss: 0.4162, test_loss: 1.2531, test_f1: 0.6671
 epoch: 67, train_loss: 0.4050, test_loss: 1.2460, test_f1: 0.6477
 epoch: 68, train_loss: 0.4249, test_loss: 1.2611, test_f1: 0.6692
 epoch: 69, train_loss: 0.4256, test_loss: 1.3122, test_f1: 0.6413
 epoch: 70, train_loss: 0.4219, test_loss: 1.2189, test_f1: 0.6713
 epoch: 71, train_loss: 0.4044, test_loss: 1.2178, test_f1: 0.6417
 epoch: 72, train_loss: 0.3874, test_loss: 1.3293, test_f1: 0.6739
 epoch: 73, train_loss: 0.3906, test_loss: 1.2785, test_f1: 0.6578
 epoch: 74, train_loss: 0.3941, test_loss: 1.2287, test_f1: 0.6764
 epoch: 75, train_loss: 0.3962, test_loss: 1.3049, test_f1: 0.6589
 epoch: 76, train_loss: 0.3841, test_loss: 1.3288, test_f1: 0.6643
 epoch: 77, train_loss: 0.3812, test_loss: 1.3114, test_f1: 0.6578
 epoch: 78, train_loss: 0.3796, test_loss: 1.3437, test_f1: 0.6592
 epoch: 79, train_loss: 0.3815, test_loss: 1.3414, test_f1: 0.6595
 epoch: 80, train_loss: 0.3590, test_loss: 1.2900, test_f1: 0.6746
 epoch: 81, train_loss: 0.3767, test_loss: 1.3401, test_f1: 0.6471
 epoch: 82, train_loss: 0.3733, test_loss: 1.3605, test_f1: 0.6621
 epoch: 83, train_loss: 0.3495, test_loss: 1.3915, test_f1: 0.6705
 epoch: 84, train_loss: 0.3737, test_loss: 1.3594, test_f1: 0.6630
 epoch: 85, train_loss: 0.3521, test_loss: 1.4023, test_f1: 0.6442
 epoch: 86, train_loss: 0.3609, test_loss: 1.3999, test_f1: 0.6646
 epoch: 87, train_loss: 0.3448, test_loss: 1.4642, test_f1: 0.6207
 epoch: 88, train_loss: 0.3612, test_loss: 1.4350, test_f1: 0.6614
 epoch: 89, train_loss: 0.3436, test_loss: 1.4551, test_f1: 0.6815
 epoch: 90, train_loss: 0.3291, test_loss: 1.3937, test_f1: 0.6864
 epoch: 91, train_loss: 0.3279, test_loss: 1.3962, test_f1: 0.6791
 epoch: 92, train_loss: 0.3248, test_loss: 1.4963, test_f1: 0.6477
 epoch: 93, train_loss: 0.3499, test_loss: 1.4198, test_f1: 0.6653
 epoch: 94, train_loss: 0.3493, test_loss: 1.5456, test_f1: 0.6532
 epoch: 95, train_loss: 0.3269, test_loss: 1.4632, test_f1: 0.6591
 epoch: 96, train_loss: 0.3238, test_loss: 1.4857, test_f1: 0.6717
 epoch: 97, train_loss: 0.3419, test_loss: 1.5910, test_f1: 0.6518
 epoch: 98, train_loss: 0.3199, test_loss: 1.4264, test_f1: 0.6559
 epoch: 99, train_loss: 0.3260, test_loss: 1.5243, test_f1: 0.6489
##################ITERATION #3 ****************************************
 epoch: 0, train_loss: 1.2221, test_loss: 1.0681, test_f1: 0.4005
 epoch: 1, train_loss: 1.0519, test_loss: 0.9362, test_f1: 0.4963
 epoch: 2, train_loss: 0.9792, test_loss: 0.9438, test_f1: 0.5194
 epoch: 3, train_loss: 0.9475, test_loss: 0.9526, test_f1: 0.4999
 epoch: 4, train_loss: 0.9203, test_loss: 1.0078, test_f1: 0.4608
 epoch: 5, train_loss: 0.9138, test_loss: 0.9691, test_f1: 0.4806
 epoch: 6, train_loss: 0.8986, test_loss: 0.9975, test_f1: 0.5092
 epoch: 7, train_loss: 0.8900, test_loss: 0.9378, test_f1: 0.5328
 epoch: 8, train_loss: 0.8681, test_loss: 0.9464, test_f1: 0.5283
 epoch: 9, train_loss: 0.8767, test_loss: 1.0050, test_f1: 0.5393
 epoch: 10, train_loss: 0.8558, test_loss: 0.9599, test_f1: 0.5490
 epoch: 11, train_loss: 0.8387, test_loss: 0.9368, test_f1: 0.5637
 epoch: 12, train_loss: 0.8329, test_loss: 0.9595, test_f1: 0.5504
 epoch: 13, train_loss: 0.8328, test_loss: 0.9334, test_f1: 0.5118
 epoch: 14, train_loss: 0.8179, test_loss: 0.9426, test_f1: 0.5523
 epoch: 15, train_loss: 0.8142, test_loss: 0.9512, test_f1: 0.6102
 epoch: 16, train_loss: 0.8076, test_loss: 0.9466, test_f1: 0.5698
 epoch: 17, train_loss: 0.7868, test_loss: 0.9768, test_f1: 0.5926
 epoch: 18, train_loss: 0.7850, test_loss: 0.9871, test_f1: 0.6052
 epoch: 19, train_loss: 0.7696, test_loss: 0.9807, test_f1: 0.5693
 epoch: 20, train_loss: 0.7848, test_loss: 0.9049, test_f1: 0.6133
 epoch: 21, train_loss: 0.7682, test_loss: 1.0676, test_f1: 0.5536
 epoch: 22, train_loss: 0.7652, test_loss: 1.0481, test_f1: 0.5512
 epoch: 23, train_loss: 0.7373, test_loss: 0.9446, test_f1: 0.5972
 epoch: 24, train_loss: 0.7411, test_loss: 0.9775, test_f1: 0.6135
 epoch: 25, train_loss: 0.7417, test_loss: 0.9716, test_f1: 0.6078
 epoch: 26, train_loss: 0.7332, test_loss: 0.9403, test_f1: 0.6122
 epoch: 27, train_loss: 0.7177, test_loss: 1.0263, test_f1: 0.5814
 epoch: 28, train_loss: 0.7327, test_loss: 1.0965, test_f1: 0.5670
 epoch: 29, train_loss: 0.6947, test_loss: 0.9605, test_f1: 0.6221
 epoch: 30, train_loss: 0.6783, test_loss: 0.9507, test_f1: 0.6333
 epoch: 31, train_loss: 0.7006, test_loss: 0.9356, test_f1: 0.6025
 epoch: 32, train_loss: 0.6896, test_loss: 0.9761, test_f1: 0.5863
 epoch: 33, train_loss: 0.6870, test_loss: 0.9579, test_f1: 0.6151
 epoch: 34, train_loss: 0.6797, test_loss: 0.9516, test_f1: 0.6300
 epoch: 35, train_loss: 0.6659, test_loss: 1.0028, test_f1: 0.6018
 epoch: 36, train_loss: 0.6757, test_loss: 1.0904, test_f1: 0.5915
 epoch: 37, train_loss: 0.6690, test_loss: 0.9673, test_f1: 0.6314
 epoch: 38, train_loss: 0.6550, test_loss: 0.9877, test_f1: 0.6098
 epoch: 39, train_loss: 0.6444, test_loss: 1.0022, test_f1: 0.6088
 epoch: 40, train_loss: 0.6310, test_loss: 0.9933, test_f1: 0.6251
 epoch: 41, train_loss: 0.6460, test_loss: 1.0857, test_f1: 0.6164
 epoch: 42, train_loss: 0.6205, test_loss: 0.9414, test_f1: 0.6324
 epoch: 43, train_loss: 0.6052, test_loss: 1.0372, test_f1: 0.6362
 epoch: 44, train_loss: 0.6283, test_loss: 1.0299, test_f1: 0.6576
 epoch: 45, train_loss: 0.6035, test_loss: 1.0662, test_f1: 0.6334
 epoch: 46, train_loss: 0.6044, test_loss: 1.1188, test_f1: 0.6254
 epoch: 47, train_loss: 0.5822, test_loss: 1.0546, test_f1: 0.6323
 epoch: 48, train_loss: 0.5843, test_loss: 1.0649, test_f1: 0.6268
 epoch: 49, train_loss: 0.5667, test_loss: 1.1157, test_f1: 0.5965
 epoch: 50, train_loss: 0.5671, test_loss: 1.0599, test_f1: 0.6186
 epoch: 51, train_loss: 0.5377, test_loss: 1.0248, test_f1: 0.6585
 epoch: 52, train_loss: 0.5054, test_loss: 1.1459, test_f1: 0.6424
 epoch: 53, train_loss: 0.5020, test_loss: 1.0670, test_f1: 0.6670
 epoch: 54, train_loss: 0.4843, test_loss: 1.0896, test_f1: 0.6596
 epoch: 55, train_loss: 0.4945, test_loss: 1.2376, test_f1: 0.6415
 epoch: 56, train_loss: 0.4845, test_loss: 1.0892, test_f1: 0.6589
 epoch: 57, train_loss: 0.4885, test_loss: 1.1628, test_f1: 0.6421
 epoch: 58, train_loss: 0.4775, test_loss: 1.1229, test_f1: 0.6546
 epoch: 59, train_loss: 0.4632, test_loss: 1.1324, test_f1: 0.6467
 epoch: 60, train_loss: 0.4519, test_loss: 1.1500, test_f1: 0.6658
 epoch: 61, train_loss: 0.4557, test_loss: 1.1716, test_f1: 0.6486
 epoch: 62, train_loss: 0.4571, test_loss: 1.2222, test_f1: 0.6438
 epoch: 63, train_loss: 0.4444, test_loss: 1.1256, test_f1: 0.6552
 epoch: 64, train_loss: 0.4383, test_loss: 1.1704, test_f1: 0.6735
 epoch: 65, train_loss: 0.4393, test_loss: 1.2702, test_f1: 0.6385
 epoch: 66, train_loss: 0.4458, test_loss: 1.1587, test_f1: 0.6655
 epoch: 67, train_loss: 0.4305, test_loss: 1.2115, test_f1: 0.6233
 epoch: 68, train_loss: 0.4232, test_loss: 1.2634, test_f1: 0.6771
 epoch: 69, train_loss: 0.4446, test_loss: 1.1900, test_f1: 0.6627
 epoch: 70, train_loss: 0.4096, test_loss: 1.2457, test_f1: 0.6499
 epoch: 71, train_loss: 0.4158, test_loss: 1.2868, test_f1: 0.6740
 epoch: 72, train_loss: 0.3956, test_loss: 1.2250, test_f1: 0.6504
 epoch: 73, train_loss: 0.3987, test_loss: 1.2411, test_f1: 0.6674
 epoch: 74, train_loss: 0.3944, test_loss: 1.2141, test_f1: 0.6649
 epoch: 75, train_loss: 0.3939, test_loss: 1.2602, test_f1: 0.6481
 epoch: 76, train_loss: 0.3845, test_loss: 1.3175, test_f1: 0.6308
 epoch: 77, train_loss: 0.3948, test_loss: 1.3554, test_f1: 0.6572
 epoch: 78, train_loss: 0.3822, test_loss: 1.3626, test_f1: 0.6430
 epoch: 79, train_loss: 0.3854, test_loss: 1.2831, test_f1: 0.6568
 epoch: 80, train_loss: 0.3799, test_loss: 1.3812, test_f1: 0.6360
 epoch: 81, train_loss: 0.3857, test_loss: 1.3013, test_f1: 0.6465
 epoch: 82, train_loss: 0.3660, test_loss: 1.3077, test_f1: 0.6639
 epoch: 83, train_loss: 0.3569, test_loss: 1.2801, test_f1: 0.6332
 epoch: 84, train_loss: 0.3714, test_loss: 1.4181, test_f1: 0.6513
 epoch: 85, train_loss: 0.3770, test_loss: 1.3904, test_f1: 0.6486
 epoch: 86, train_loss: 0.3603, test_loss: 1.3728, test_f1: 0.6287
 epoch: 87, train_loss: 0.3490, test_loss: 1.4324, test_f1: 0.6451
 epoch: 88, train_loss: 0.3549, test_loss: 1.3724, test_f1: 0.6534
 epoch: 89, train_loss: 0.3450, test_loss: 1.4733, test_f1: 0.6471
 epoch: 90, train_loss: 0.3475, test_loss: 1.3439, test_f1: 0.6741
 epoch: 91, train_loss: 0.3363, test_loss: 1.4090, test_f1: 0.6755
 epoch: 92, train_loss: 0.3410, test_loss: 1.5363, test_f1: 0.6377
 epoch: 93, train_loss: 0.3420, test_loss: 1.5141, test_f1: 0.6521
 epoch: 94, train_loss: 0.3499, test_loss: 1.4814, test_f1: 0.6347
 epoch: 95, train_loss: 0.3279, test_loss: 1.5258, test_f1: 0.6527
 epoch: 96, train_loss: 0.3368, test_loss: 1.4761, test_f1: 0.6756
 epoch: 97, train_loss: 0.3508, test_loss: 1.5615, test_f1: 0.6711
 epoch: 98, train_loss: 0.3283, test_loss: 1.5061, test_f1: 0.6729
 epoch: 99, train_loss: 0.3254, test_loss: 1.5534, test_f1: 0.6792
##################ITERATION #4 ****************************************
 epoch: 0, train_loss: 1.2626, test_loss: 1.0792, test_f1: 0.4701
 epoch: 1, train_loss: 1.0501, test_loss: 0.9653, test_f1: 0.4887
 epoch: 2, train_loss: 0.9984, test_loss: 0.9437, test_f1: 0.5388
 epoch: 3, train_loss: 0.9648, test_loss: 0.9709, test_f1: 0.5032
 epoch: 4, train_loss: 0.9425, test_loss: 0.9410, test_f1: 0.5129
 epoch: 5, train_loss: 0.9591, test_loss: 0.9313, test_f1: 0.5223
 epoch: 6, train_loss: 0.9260, test_loss: 0.9568, test_f1: 0.5117
 epoch: 7, train_loss: 0.9087, test_loss: 0.9496, test_f1: 0.5057
 epoch: 8, train_loss: 0.8922, test_loss: 0.9639, test_f1: 0.5106
 epoch: 9, train_loss: 0.8829, test_loss: 0.9278, test_f1: 0.5311
 epoch: 10, train_loss: 0.8752, test_loss: 1.0462, test_f1: 0.5010
 epoch: 11, train_loss: 0.8720, test_loss: 0.9651, test_f1: 0.5063
 epoch: 12, train_loss: 0.8553, test_loss: 0.9361, test_f1: 0.5338
 epoch: 13, train_loss: 0.8471, test_loss: 0.9357, test_f1: 0.5339
 epoch: 14, train_loss: 0.8368, test_loss: 0.9529, test_f1: 0.5408
 epoch: 15, train_loss: 0.8278, test_loss: 0.9463, test_f1: 0.5222
 epoch: 16, train_loss: 0.8350, test_loss: 0.9527, test_f1: 0.5227
 epoch: 17, train_loss: 0.8244, test_loss: 0.9712, test_f1: 0.5351
 epoch: 18, train_loss: 0.8308, test_loss: 0.9476, test_f1: 0.5377
 epoch: 19, train_loss: 0.8074, test_loss: 0.9428, test_f1: 0.5490
 epoch: 20, train_loss: 0.7976, test_loss: 0.9528, test_f1: 0.5516
 epoch: 21, train_loss: 0.7919, test_loss: 0.9847, test_f1: 0.5551
 epoch: 22, train_loss: 0.7869, test_loss: 0.9288, test_f1: 0.5667
 epoch: 23, train_loss: 0.7595, test_loss: 0.9813, test_f1: 0.5541
 epoch: 24, train_loss: 0.7724, test_loss: 1.0024, test_f1: 0.5631
 epoch: 25, train_loss: 0.7630, test_loss: 1.0037, test_f1: 0.5653
 epoch: 26, train_loss: 0.7616, test_loss: 0.9681, test_f1: 0.5977
 epoch: 27, train_loss: 0.7585, test_loss: 0.9635, test_f1: 0.6031
 epoch: 28, train_loss: 0.7535, test_loss: 1.0142, test_f1: 0.5520
 epoch: 29, train_loss: 0.7575, test_loss: 1.0054, test_f1: 0.5886
 epoch: 30, train_loss: 0.7341, test_loss: 0.9732, test_f1: 0.6036
 epoch: 31, train_loss: 0.7253, test_loss: 0.9636, test_f1: 0.6109
 epoch: 32, train_loss: 0.7225, test_loss: 0.9738, test_f1: 0.5563
 epoch: 33, train_loss: 0.7103, test_loss: 1.0357, test_f1: 0.5929
 epoch: 34, train_loss: 0.7181, test_loss: 1.0059, test_f1: 0.5595
 epoch: 35, train_loss: 0.7234, test_loss: 0.9751, test_f1: 0.5914
 epoch: 36, train_loss: 0.6976, test_loss: 0.9288, test_f1: 0.6144
 epoch: 37, train_loss: 0.6947, test_loss: 0.9845, test_f1: 0.6104
 epoch: 38, train_loss: 0.6852, test_loss: 1.0159, test_f1: 0.6143
 epoch: 39, train_loss: 0.7061, test_loss: 0.9662, test_f1: 0.6300
 epoch: 40, train_loss: 0.6955, test_loss: 1.0065, test_f1: 0.6006
 epoch: 41, train_loss: 0.6647, test_loss: 1.0003, test_f1: 0.6040
 epoch: 42, train_loss: 0.6539, test_loss: 1.0395, test_f1: 0.6020
 epoch: 43, train_loss: 0.6543, test_loss: 0.9868, test_f1: 0.6095
 epoch: 44, train_loss: 0.6596, test_loss: 1.0840, test_f1: 0.5850
 epoch: 45, train_loss: 0.6488, test_loss: 0.9889, test_f1: 0.6231
 epoch: 46, train_loss: 0.6378, test_loss: 1.0239, test_f1: 0.6026
 epoch: 47, train_loss: 0.6358, test_loss: 1.0659, test_f1: 0.6124
 epoch: 48, train_loss: 0.6420, test_loss: 0.9812, test_f1: 0.6498
 epoch: 49, train_loss: 0.6023, test_loss: 1.0004, test_f1: 0.6227
 epoch: 50, train_loss: 0.6185, test_loss: 1.1216, test_f1: 0.6253
 epoch: 51, train_loss: 0.5851, test_loss: 1.0565, test_f1: 0.6036
 epoch: 52, train_loss: 0.5567, test_loss: 1.0689, test_f1: 0.6481
 epoch: 53, train_loss: 0.5574, test_loss: 1.0388, test_f1: 0.6506
 epoch: 54, train_loss: 0.5390, test_loss: 1.0583, test_f1: 0.6423
 epoch: 55, train_loss: 0.5369, test_loss: 1.0339, test_f1: 0.6393
 epoch: 56, train_loss: 0.5450, test_loss: 1.0911, test_f1: 0.6386
 epoch: 57, train_loss: 0.5311, test_loss: 1.1013, test_f1: 0.6642
 epoch: 58, train_loss: 0.5391, test_loss: 1.0271, test_f1: 0.6277
 epoch: 59, train_loss: 0.5246, test_loss: 1.0831, test_f1: 0.6738
 epoch: 60, train_loss: 0.5097, test_loss: 1.0299, test_f1: 0.6594
 epoch: 61, train_loss: 0.5166, test_loss: 1.1314, test_f1: 0.6920
 epoch: 62, train_loss: 0.5112, test_loss: 1.0498, test_f1: 0.6545
 epoch: 63, train_loss: 0.5091, test_loss: 1.0614, test_f1: 0.6384
 epoch: 64, train_loss: 0.4984, test_loss: 1.1096, test_f1: 0.6697
 epoch: 65, train_loss: 0.4946, test_loss: 1.0833, test_f1: 0.6223
 epoch: 66, train_loss: 0.4928, test_loss: 1.0875, test_f1: 0.6661
 epoch: 67, train_loss: 0.4747, test_loss: 1.1380, test_f1: 0.6673
 epoch: 68, train_loss: 0.4790, test_loss: 1.1742, test_f1: 0.6590
 epoch: 69, train_loss: 0.4971, test_loss: 1.0725, test_f1: 0.6885
 epoch: 70, train_loss: 0.4643, test_loss: 1.1278, test_f1: 0.6415
 epoch: 71, train_loss: 0.4668, test_loss: 1.0769, test_f1: 0.6645
 epoch: 72, train_loss: 0.4653, test_loss: 1.0678, test_f1: 0.6744
 epoch: 73, train_loss: 0.4649, test_loss: 1.1819, test_f1: 0.6645
 epoch: 74, train_loss: 0.4571, test_loss: 1.0727, test_f1: 0.6629
 epoch: 75, train_loss: 0.4542, test_loss: 1.1072, test_f1: 0.6770
 epoch: 76, train_loss: 0.4580, test_loss: 1.1332, test_f1: 0.6823
 epoch: 77, train_loss: 0.4588, test_loss: 1.1362, test_f1: 0.6901
 epoch: 78, train_loss: 0.4618, test_loss: 1.1177, test_f1: 0.6655
 epoch: 79, train_loss: 0.4479, test_loss: 1.0684, test_f1: 0.6748
 epoch: 80, train_loss: 0.4428, test_loss: 1.1907, test_f1: 0.6648
 epoch: 81, train_loss: 0.4411, test_loss: 1.2135, test_f1: 0.6750
 epoch: 82, train_loss: 0.4296, test_loss: 1.2024, test_f1: 0.6934
 epoch: 83, train_loss: 0.4198, test_loss: 1.1735, test_f1: 0.6709
 epoch: 84, train_loss: 0.4114, test_loss: 1.1634, test_f1: 0.6560
 epoch: 85, train_loss: 0.4609, test_loss: 1.1889, test_f1: 0.6722
 epoch: 86, train_loss: 0.4336, test_loss: 1.1949, test_f1: 0.6766
 epoch: 87, train_loss: 0.4401, test_loss: 1.1800, test_f1: 0.7063
 epoch: 88, train_loss: 0.4031, test_loss: 1.2294, test_f1: 0.6621
 epoch: 89, train_loss: 0.4144, test_loss: 1.2628, test_f1: 0.6611
 epoch: 90, train_loss: 0.4096, test_loss: 1.2987, test_f1: 0.6697
 epoch: 91, train_loss: 0.4070, test_loss: 1.1402, test_f1: 0.6688
 epoch: 92, train_loss: 0.4049, test_loss: 1.2938, test_f1: 0.6640
 epoch: 93, train_loss: 0.3869, test_loss: 1.2507, test_f1: 0.6635
 epoch: 94, train_loss: 0.3843, test_loss: 1.2820, test_f1: 0.6802
 epoch: 95, train_loss: 0.3973, test_loss: 1.2735, test_f1: 0.6606
 epoch: 96, train_loss: 0.3933, test_loss: 1.3311, test_f1: 0.6709
 epoch: 97, train_loss: 0.4038, test_loss: 1.3437, test_f1: 0.6845
 epoch: 98, train_loss: 0.3991, test_loss: 1.3303, test_f1: 0.6467
 epoch: 99, train_loss: 0.3805, test_loss: 1.2588, test_f1: 0.6799
##################ITERATION #5 ****************************************
 epoch: 0, train_loss: 1.2951, test_loss: 1.0066, test_f1: 0.5075
 epoch: 1, train_loss: 1.0391, test_loss: 0.9370, test_f1: 0.5038
 epoch: 2, train_loss: 0.9735, test_loss: 0.9193, test_f1: 0.5234
 epoch: 3, train_loss: 0.9566, test_loss: 0.9419, test_f1: 0.4968
 epoch: 4, train_loss: 0.9351, test_loss: 0.9629, test_f1: 0.5398
 epoch: 5, train_loss: 0.9149, test_loss: 0.9484, test_f1: 0.5151
 epoch: 6, train_loss: 0.8935, test_loss: 0.9296, test_f1: 0.5423
 epoch: 7, train_loss: 0.8894, test_loss: 0.9308, test_f1: 0.5309
 epoch: 8, train_loss: 0.8723, test_loss: 0.9633, test_f1: 0.5173
 epoch: 9, train_loss: 0.8833, test_loss: 0.9591, test_f1: 0.5733
 epoch: 10, train_loss: 0.8596, test_loss: 0.9285, test_f1: 0.5260
 epoch: 11, train_loss: 0.8549, test_loss: 0.9509, test_f1: 0.5368
 epoch: 12, train_loss: 0.8339, test_loss: 0.9411, test_f1: 0.5322
 epoch: 13, train_loss: 0.8270, test_loss: 0.9062, test_f1: 0.6140
 epoch: 14, train_loss: 0.8160, test_loss: 0.9135, test_f1: 0.5508
 epoch: 15, train_loss: 0.8097, test_loss: 0.9236, test_f1: 0.5597
 epoch: 16, train_loss: 0.7926, test_loss: 0.9350, test_f1: 0.5692
 epoch: 17, train_loss: 0.7945, test_loss: 0.9564, test_f1: 0.5626
 epoch: 18, train_loss: 0.8057, test_loss: 0.9739, test_f1: 0.5441
 epoch: 19, train_loss: 0.7722, test_loss: 0.9039, test_f1: 0.5887
 epoch: 20, train_loss: 0.7767, test_loss: 0.9405, test_f1: 0.5771
 epoch: 21, train_loss: 0.7682, test_loss: 0.9242, test_f1: 0.5816
 epoch: 22, train_loss: 0.7417, test_loss: 0.8940, test_f1: 0.5842
 epoch: 23, train_loss: 0.7650, test_loss: 0.9583, test_f1: 0.5801
 epoch: 24, train_loss: 0.7586, test_loss: 0.9472, test_f1: 0.5557
 epoch: 25, train_loss: 0.7266, test_loss: 0.9375, test_f1: 0.5700
 epoch: 26, train_loss: 0.7470, test_loss: 0.9635, test_f1: 0.5920
 epoch: 27, train_loss: 0.7366, test_loss: 0.9416, test_f1: 0.5926
 epoch: 28, train_loss: 0.7142, test_loss: 0.9710, test_f1: 0.5641
 epoch: 29, train_loss: 0.7235, test_loss: 1.0017, test_f1: 0.5558
 epoch: 30, train_loss: 0.7237, test_loss: 0.9207, test_f1: 0.6095
 epoch: 31, train_loss: 0.7033, test_loss: 0.9130, test_f1: 0.5909
 epoch: 32, train_loss: 0.7134, test_loss: 0.9661, test_f1: 0.5921
 epoch: 33, train_loss: 0.6906, test_loss: 0.9555, test_f1: 0.6111
 epoch: 34, train_loss: 0.6860, test_loss: 0.9416, test_f1: 0.6182
 epoch: 35, train_loss: 0.6869, test_loss: 0.9657, test_f1: 0.5790
 epoch: 36, train_loss: 0.6802, test_loss: 0.9103, test_f1: 0.6351
 epoch: 37, train_loss: 0.6761, test_loss: 1.0245, test_f1: 0.5690
 epoch: 38, train_loss: 0.6672, test_loss: 0.9355, test_f1: 0.6031
 epoch: 39, train_loss: 0.6573, test_loss: 1.0174, test_f1: 0.5881
 epoch: 40, train_loss: 0.6590, test_loss: 0.9709, test_f1: 0.6271
 epoch: 41, train_loss: 0.6552, test_loss: 0.9563, test_f1: 0.6111
 epoch: 42, train_loss: 0.6751, test_loss: 1.0056, test_f1: 0.5906
 epoch: 43, train_loss: 0.6652, test_loss: 0.9376, test_f1: 0.6102
 epoch: 44, train_loss: 0.6467, test_loss: 1.0595, test_f1: 0.5975
 epoch: 45, train_loss: 0.6300, test_loss: 0.9989, test_f1: 0.5893
 epoch: 46, train_loss: 0.6139, test_loss: 1.0109, test_f1: 0.5916
 epoch: 47, train_loss: 0.6239, test_loss: 1.0378, test_f1: 0.6110
 epoch: 48, train_loss: 0.6296, test_loss: 0.9789, test_f1: 0.5989
 epoch: 49, train_loss: 0.5959, test_loss: 0.9532, test_f1: 0.6562
 epoch: 50, train_loss: 0.6139, test_loss: 1.0125, test_f1: 0.6566
 epoch: 51, train_loss: 0.5745, test_loss: 0.9806, test_f1: 0.6156
 epoch: 52, train_loss: 0.5628, test_loss: 0.9839, test_f1: 0.6458
 epoch: 53, train_loss: 0.5467, test_loss: 0.9080, test_f1: 0.6791
 epoch: 54, train_loss: 0.5256, test_loss: 0.9519, test_f1: 0.6462
 epoch: 55, train_loss: 0.5325, test_loss: 0.9593, test_f1: 0.6423
 epoch: 56, train_loss: 0.5200, test_loss: 1.0110, test_f1: 0.6113
 epoch: 57, train_loss: 0.5193, test_loss: 0.9888, test_f1: 0.6509
 epoch: 58, train_loss: 0.5239, test_loss: 0.9884, test_f1: 0.6422
 epoch: 59, train_loss: 0.5261, test_loss: 0.9348, test_f1: 0.6562
 epoch: 60, train_loss: 0.4992, test_loss: 1.0376, test_f1: 0.6336
 epoch: 61, train_loss: 0.5068, test_loss: 1.0246, test_f1: 0.6263
 epoch: 62, train_loss: 0.4913, test_loss: 1.0133, test_f1: 0.6717
 epoch: 63, train_loss: 0.4957, test_loss: 1.0960, test_f1: 0.6325
 epoch: 64, train_loss: 0.4869, test_loss: 0.9982, test_f1: 0.6498
 epoch: 65, train_loss: 0.4822, test_loss: 1.0095, test_f1: 0.6682
 epoch: 66, train_loss: 0.4653, test_loss: 1.0737, test_f1: 0.6308
 epoch: 67, train_loss: 0.4705, test_loss: 1.0709, test_f1: 0.6458
 epoch: 68, train_loss: 0.4609, test_loss: 1.0315, test_f1: 0.6207
 epoch: 69, train_loss: 0.4525, test_loss: 1.1023, test_f1: 0.6409
 epoch: 70, train_loss: 0.4639, test_loss: 1.1004, test_f1: 0.6412
 epoch: 71, train_loss: 0.4429, test_loss: 1.0380, test_f1: 0.6395
 epoch: 72, train_loss: 0.4464, test_loss: 1.0582, test_f1: 0.6407
 epoch: 73, train_loss: 0.4434, test_loss: 1.0188, test_f1: 0.6474
 epoch: 74, train_loss: 0.4343, test_loss: 1.0145, test_f1: 0.6584
 epoch: 75, train_loss: 0.4440, test_loss: 1.1718, test_f1: 0.6253
 epoch: 76, train_loss: 0.4385, test_loss: 1.1299, test_f1: 0.6570
 epoch: 77, train_loss: 0.4254, test_loss: 1.1278, test_f1: 0.6473
 epoch: 78, train_loss: 0.4351, test_loss: 1.1321, test_f1: 0.6538
 epoch: 79, train_loss: 0.4243, test_loss: 1.1148, test_f1: 0.6470
 epoch: 80, train_loss: 0.4318, test_loss: 1.1385, test_f1: 0.6320
 epoch: 81, train_loss: 0.4063, test_loss: 1.1676, test_f1: 0.6571
 epoch: 82, train_loss: 0.4036, test_loss: 1.1145, test_f1: 0.6656
 epoch: 83, train_loss: 0.4056, test_loss: 1.1943, test_f1: 0.6540
 epoch: 84, train_loss: 0.4116, test_loss: 1.1122, test_f1: 0.6500
 epoch: 85, train_loss: 0.4113, test_loss: 1.2218, test_f1: 0.6415
 epoch: 86, train_loss: 0.3831, test_loss: 1.1680, test_f1: 0.6549
 epoch: 87, train_loss: 0.3757, test_loss: 1.1653, test_f1: 0.6569
 epoch: 88, train_loss: 0.4107, test_loss: 1.1893, test_f1: 0.6715
 epoch: 89, train_loss: 0.3722, test_loss: 1.2232, test_f1: 0.6611
 epoch: 90, train_loss: 0.3882, test_loss: 1.2377, test_f1: 0.6658
 epoch: 91, train_loss: 0.3971, test_loss: 1.2140, test_f1: 0.6631
 epoch: 92, train_loss: 0.3817, test_loss: 1.2111, test_f1: 0.6582
 epoch: 93, train_loss: 0.3765, test_loss: 1.2985, test_f1: 0.6529
 epoch: 94, train_loss: 0.3926, test_loss: 1.2994, test_f1: 0.6597
 epoch: 95, train_loss: 0.3733, test_loss: 1.2708, test_f1: 0.6525
 epoch: 96, train_loss: 0.3538, test_loss: 1.2329, test_f1: 0.6713
 epoch: 97, train_loss: 0.3583, test_loss: 1.3552, test_f1: 0.6337
 epoch: 98, train_loss: 0.3569, test_loss: 1.2964, test_f1: 0.6665
 epoch: 99, train_loss: 0.3641, test_loss: 1.2804, test_f1: 0.6473
##################ITERATION #6 ****************************************
 epoch: 0, train_loss: 1.3381, test_loss: 0.9931, test_f1: 0.4547
 epoch: 1, train_loss: 1.0415, test_loss: 0.9217, test_f1: 0.4762
 epoch: 2, train_loss: 0.9794, test_loss: 0.9699, test_f1: 0.4746
 epoch: 3, train_loss: 0.9681, test_loss: 0.9781, test_f1: 0.4719
 epoch: 4, train_loss: 0.9515, test_loss: 0.9676, test_f1: 0.4925
 epoch: 5, train_loss: 0.9473, test_loss: 0.9488, test_f1: 0.4940
 epoch: 6, train_loss: 0.9148, test_loss: 0.9540, test_f1: 0.5156
 epoch: 7, train_loss: 0.8976, test_loss: 1.0015, test_f1: 0.4753
 epoch: 8, train_loss: 0.9140, test_loss: 0.9669, test_f1: 0.5184
 epoch: 9, train_loss: 0.8797, test_loss: 0.9685, test_f1: 0.5442
 epoch: 10, train_loss: 0.8593, test_loss: 0.9813, test_f1: 0.5018
 epoch: 11, train_loss: 0.8673, test_loss: 0.9448, test_f1: 0.5130
 epoch: 12, train_loss: 0.8464, test_loss: 0.9514, test_f1: 0.5374
 epoch: 13, train_loss: 0.8575, test_loss: 0.9432, test_f1: 0.5669
 epoch: 14, train_loss: 0.8226, test_loss: 0.9666, test_f1: 0.5565
 epoch: 15, train_loss: 0.8396, test_loss: 0.9516, test_f1: 0.5576
 epoch: 16, train_loss: 0.8325, test_loss: 0.9394, test_f1: 0.5500
 epoch: 17, train_loss: 0.7996, test_loss: 0.9761, test_f1: 0.5320
 epoch: 18, train_loss: 0.8097, test_loss: 0.9340, test_f1: 0.5568
 epoch: 19, train_loss: 0.7921, test_loss: 0.9595, test_f1: 0.5699
 epoch: 20, train_loss: 0.7882, test_loss: 0.9933, test_f1: 0.5554
 epoch: 21, train_loss: 0.7814, test_loss: 0.9454, test_f1: 0.5437
 epoch: 22, train_loss: 0.7707, test_loss: 0.9424, test_f1: 0.5723
 epoch: 23, train_loss: 0.7675, test_loss: 0.9818, test_f1: 0.5537
 epoch: 24, train_loss: 0.7496, test_loss: 0.9054, test_f1: 0.5722
 epoch: 25, train_loss: 0.7569, test_loss: 0.9541, test_f1: 0.5742
 epoch: 26, train_loss: 0.7472, test_loss: 0.9778, test_f1: 0.5424
 epoch: 27, train_loss: 0.7380, test_loss: 0.9835, test_f1: 0.5698
 epoch: 28, train_loss: 0.7332, test_loss: 0.9294, test_f1: 0.5911
 epoch: 29, train_loss: 0.7136, test_loss: 0.9891, test_f1: 0.5798
 epoch: 30, train_loss: 0.7216, test_loss: 0.9607, test_f1: 0.5855
 epoch: 31, train_loss: 0.6967, test_loss: 0.9934, test_f1: 0.5558
 epoch: 32, train_loss: 0.6961, test_loss: 0.9435, test_f1: 0.5857
 epoch: 33, train_loss: 0.7007, test_loss: 1.0013, test_f1: 0.5824
 epoch: 34, train_loss: 0.6841, test_loss: 1.0200, test_f1: 0.5726
 epoch: 35, train_loss: 0.6702, test_loss: 1.0151, test_f1: 0.5791
 epoch: 36, train_loss: 0.6819, test_loss: 1.0029, test_f1: 0.5893
 epoch: 37, train_loss: 0.6751, test_loss: 1.0151, test_f1: 0.5764
 epoch: 38, train_loss: 0.6768, test_loss: 0.9863, test_f1: 0.6080
 epoch: 39, train_loss: 0.6532, test_loss: 0.9607, test_f1: 0.5982
 epoch: 40, train_loss: 0.6615, test_loss: 0.9638, test_f1: 0.5899
 epoch: 41, train_loss: 0.6430, test_loss: 1.0797, test_f1: 0.6194
 epoch: 42, train_loss: 0.6568, test_loss: 0.9282, test_f1: 0.6080
 epoch: 43, train_loss: 0.6609, test_loss: 0.9895, test_f1: 0.6256
 epoch: 44, train_loss: 0.6292, test_loss: 0.9708, test_f1: 0.6012
 epoch: 45, train_loss: 0.6501, test_loss: 0.9795, test_f1: 0.5959
 epoch: 46, train_loss: 0.5965, test_loss: 0.9725, test_f1: 0.6212
 epoch: 47, train_loss: 0.6196, test_loss: 1.0063, test_f1: 0.6155
 epoch: 48, train_loss: 0.6156, test_loss: 1.0309, test_f1: 0.5997
 epoch: 49, train_loss: 0.5838, test_loss: 1.0068, test_f1: 0.6046
 epoch: 50, train_loss: 0.5813, test_loss: 1.0677, test_f1: 0.6127
 epoch: 51, train_loss: 0.5358, test_loss: 1.0273, test_f1: 0.6233
 epoch: 52, train_loss: 0.5271, test_loss: 1.0793, test_f1: 0.6199
 epoch: 53, train_loss: 0.5106, test_loss: 1.0676, test_f1: 0.6170
 epoch: 54, train_loss: 0.5052, test_loss: 1.0535, test_f1: 0.6251
 epoch: 55, train_loss: 0.5099, test_loss: 1.0201, test_f1: 0.6351
 epoch: 56, train_loss: 0.4871, test_loss: 1.1386, test_f1: 0.6470
 epoch: 57, train_loss: 0.4931, test_loss: 1.1107, test_f1: 0.6233
 epoch: 58, train_loss: 0.4703, test_loss: 1.1267, test_f1: 0.6255
 epoch: 59, train_loss: 0.4772, test_loss: 1.2208, test_f1: 0.6159
 epoch: 60, train_loss: 0.4781, test_loss: 1.1179, test_f1: 0.6119
 epoch: 61, train_loss: 0.4832, test_loss: 1.1665, test_f1: 0.6308
 epoch: 62, train_loss: 0.4648, test_loss: 1.0881, test_f1: 0.6457
 epoch: 63, train_loss: 0.4695, test_loss: 1.1609, test_f1: 0.6334
 epoch: 64, train_loss: 0.4662, test_loss: 1.1304, test_f1: 0.6213
 epoch: 65, train_loss: 0.4676, test_loss: 1.1245, test_f1: 0.6241
 epoch: 66, train_loss: 0.4520, test_loss: 1.1944, test_f1: 0.6228
 epoch: 67, train_loss: 0.4524, test_loss: 1.0997, test_f1: 0.6319
 epoch: 68, train_loss: 0.4469, test_loss: 1.2468, test_f1: 0.6186
 epoch: 69, train_loss: 0.4542, test_loss: 1.2187, test_f1: 0.6490
 epoch: 70, train_loss: 0.4258, test_loss: 1.1717, test_f1: 0.6314
 epoch: 71, train_loss: 0.4360, test_loss: 1.1556, test_f1: 0.6236
 epoch: 72, train_loss: 0.4199, test_loss: 1.1654, test_f1: 0.6388
 epoch: 73, train_loss: 0.4163, test_loss: 1.2643, test_f1: 0.6329
 epoch: 74, train_loss: 0.4218, test_loss: 1.1914, test_f1: 0.6474
 epoch: 75, train_loss: 0.4085, test_loss: 1.3537, test_f1: 0.6125
 epoch: 76, train_loss: 0.4140, test_loss: 1.1860, test_f1: 0.6435
 epoch: 77, train_loss: 0.4080, test_loss: 1.2149, test_f1: 0.6464
 epoch: 78, train_loss: 0.4087, test_loss: 1.2623, test_f1: 0.6434
 epoch: 79, train_loss: 0.4159, test_loss: 1.2621, test_f1: 0.6267
 epoch: 80, train_loss: 0.3845, test_loss: 1.3489, test_f1: 0.6441
 epoch: 81, train_loss: 0.3823, test_loss: 1.3269, test_f1: 0.6345
 epoch: 82, train_loss: 0.3727, test_loss: 1.2748, test_f1: 0.6353
 epoch: 83, train_loss: 0.3784, test_loss: 1.4255, test_f1: 0.6278
 epoch: 84, train_loss: 0.3786, test_loss: 1.3597, test_f1: 0.6320
 epoch: 85, train_loss: 0.3734, test_loss: 1.4256, test_f1: 0.6343
 epoch: 86, train_loss: 0.3974, test_loss: 1.3725, test_f1: 0.6427
 epoch: 87, train_loss: 0.3760, test_loss: 1.2619, test_f1: 0.6469
 epoch: 88, train_loss: 0.3910, test_loss: 1.2358, test_f1: 0.6244
 epoch: 89, train_loss: 0.3844, test_loss: 1.3032, test_f1: 0.6295
 epoch: 90, train_loss: 0.3725, test_loss: 1.3558, test_f1: 0.6355
 epoch: 91, train_loss: 0.3734, test_loss: 1.3670, test_f1: 0.6338
 epoch: 92, train_loss: 0.3632, test_loss: 1.3681, test_f1: 0.6455
 epoch: 93, train_loss: 0.3382, test_loss: 1.4047, test_f1: 0.6476
 epoch: 94, train_loss: 0.3568, test_loss: 1.3017, test_f1: 0.6357
 epoch: 95, train_loss: 0.3497, test_loss: 1.4029, test_f1: 0.6530
 epoch: 96, train_loss: 0.3432, test_loss: 1.4467, test_f1: 0.6429
 epoch: 97, train_loss: 0.3622, test_loss: 1.4607, test_f1: 0.6282
 epoch: 98, train_loss: 0.3367, test_loss: 1.4891, test_f1: 0.6563
 epoch: 99, train_loss: 0.3359, test_loss: 1.3785, test_f1: 0.6587
##################ITERATION #7 ****************************************
 epoch: 0, train_loss: 1.3056, test_loss: 1.0133, test_f1: 0.4883
 epoch: 1, train_loss: 1.0378, test_loss: 0.9886, test_f1: 0.4838
 epoch: 2, train_loss: 0.9821, test_loss: 0.9386, test_f1: 0.4838
 epoch: 3, train_loss: 0.9444, test_loss: 0.9433, test_f1: 0.4982
 epoch: 4, train_loss: 0.9180, test_loss: 0.9329, test_f1: 0.5094
 epoch: 5, train_loss: 0.9093, test_loss: 0.9383, test_f1: 0.4965
 epoch: 6, train_loss: 0.8935, test_loss: 0.9347, test_f1: 0.5293
 epoch: 7, train_loss: 0.8831, test_loss: 0.9636, test_f1: 0.5151
 epoch: 8, train_loss: 0.8623, test_loss: 0.9475, test_f1: 0.5199
 epoch: 9, train_loss: 0.8469, test_loss: 0.9386, test_f1: 0.5167
 epoch: 10, train_loss: 0.8456, test_loss: 0.9809, test_f1: 0.5383
 epoch: 11, train_loss: 0.8414, test_loss: 0.9598, test_f1: 0.5298
 epoch: 12, train_loss: 0.8242, test_loss: 0.9561, test_f1: 0.5265
 epoch: 13, train_loss: 0.8276, test_loss: 0.9937, test_f1: 0.5360
 epoch: 14, train_loss: 0.7918, test_loss: 0.9524, test_f1: 0.5593
 epoch: 15, train_loss: 0.7994, test_loss: 0.9928, test_f1: 0.5576
 epoch: 16, train_loss: 0.7845, test_loss: 0.9529, test_f1: 0.5543
 epoch: 17, train_loss: 0.7867, test_loss: 0.9717, test_f1: 0.5809
 epoch: 18, train_loss: 0.7842, test_loss: 0.9502, test_f1: 0.6012
 epoch: 19, train_loss: 0.7868, test_loss: 0.9339, test_f1: 0.5631
 epoch: 20, train_loss: 0.7695, test_loss: 0.9644, test_f1: 0.5623
 epoch: 21, train_loss: 0.7667, test_loss: 0.9282, test_f1: 0.5942
 epoch: 22, train_loss: 0.7564, test_loss: 0.9134, test_f1: 0.5763
 epoch: 23, train_loss: 0.7457, test_loss: 1.0014, test_f1: 0.5621
 epoch: 24, train_loss: 0.7445, test_loss: 0.9124, test_f1: 0.5990
 epoch: 25, train_loss: 0.7226, test_loss: 0.9576, test_f1: 0.6075
 epoch: 26, train_loss: 0.7273, test_loss: 0.9664, test_f1: 0.5896
 epoch: 27, train_loss: 0.7182, test_loss: 0.9473, test_f1: 0.6227
 epoch: 28, train_loss: 0.7066, test_loss: 0.9733, test_f1: 0.6120
 epoch: 29, train_loss: 0.7161, test_loss: 0.9173, test_f1: 0.6284
 epoch: 30, train_loss: 0.6965, test_loss: 1.0163, test_f1: 0.6185
 epoch: 31, train_loss: 0.7170, test_loss: 1.0107, test_f1: 0.5897
 epoch: 32, train_loss: 0.6953, test_loss: 1.0056, test_f1: 0.6025
 epoch: 33, train_loss: 0.6781, test_loss: 0.9188, test_f1: 0.6392
 epoch: 34, train_loss: 0.6829, test_loss: 1.1643, test_f1: 0.5765
 epoch: 35, train_loss: 0.6720, test_loss: 0.8987, test_f1: 0.6231
 epoch: 36, train_loss: 0.6524, test_loss: 0.9245, test_f1: 0.6106
 epoch: 37, train_loss: 0.6556, test_loss: 0.9731, test_f1: 0.6206
 epoch: 38, train_loss: 0.6819, test_loss: 1.0447, test_f1: 0.6077
 epoch: 39, train_loss: 0.6576, test_loss: 0.9731, test_f1: 0.5815
 epoch: 40, train_loss: 0.6382, test_loss: 1.0047, test_f1: 0.6109
 epoch: 41, train_loss: 0.6406, test_loss: 0.9340, test_f1: 0.6018
 epoch: 42, train_loss: 0.6359, test_loss: 0.9943, test_f1: 0.6201
 epoch: 43, train_loss: 0.6287, test_loss: 0.9147, test_f1: 0.6102
 epoch: 44, train_loss: 0.6255, test_loss: 1.0111, test_f1: 0.6140
 epoch: 45, train_loss: 0.6244, test_loss: 0.9875, test_f1: 0.6082
 epoch: 46, train_loss: 0.6018, test_loss: 0.9339, test_f1: 0.6332
 epoch: 47, train_loss: 0.6233, test_loss: 1.1379, test_f1: 0.6182
 epoch: 48, train_loss: 0.6012, test_loss: 1.0321, test_f1: 0.6281
 epoch: 49, train_loss: 0.6058, test_loss: 1.0799, test_f1: 0.6129
 epoch: 50, train_loss: 0.6049, test_loss: 1.0361, test_f1: 0.6260
 epoch: 51, train_loss: 0.5754, test_loss: 1.0164, test_f1: 0.6271
 epoch: 52, train_loss: 0.5466, test_loss: 1.0120, test_f1: 0.6157
 epoch: 53, train_loss: 0.5160, test_loss: 0.9625, test_f1: 0.6416
 epoch: 54, train_loss: 0.5168, test_loss: 1.0575, test_f1: 0.6425
 epoch: 55, train_loss: 0.5203, test_loss: 1.0214, test_f1: 0.6571
 epoch: 56, train_loss: 0.5068, test_loss: 1.1117, test_f1: 0.6376
 epoch: 57, train_loss: 0.4958, test_loss: 1.1090, test_f1: 0.6675
 epoch: 58, train_loss: 0.5010, test_loss: 1.1273, test_f1: 0.6607
 epoch: 59, train_loss: 0.5021, test_loss: 1.0841, test_f1: 0.6397
 epoch: 60, train_loss: 0.4943, test_loss: 1.0826, test_f1: 0.6687
 epoch: 61, train_loss: 0.4871, test_loss: 1.1003, test_f1: 0.6510
 epoch: 62, train_loss: 0.4808, test_loss: 1.0862, test_f1: 0.6611
 epoch: 63, train_loss: 0.4671, test_loss: 1.1023, test_f1: 0.6657
 epoch: 64, train_loss: 0.4660, test_loss: 1.1085, test_f1: 0.6471
 epoch: 65, train_loss: 0.4703, test_loss: 1.0918, test_f1: 0.6549
 epoch: 66, train_loss: 0.4787, test_loss: 1.1447, test_f1: 0.6703
 epoch: 67, train_loss: 0.4446, test_loss: 1.1819, test_f1: 0.6346
 epoch: 68, train_loss: 0.4640, test_loss: 1.1925, test_f1: 0.6377
 epoch: 69, train_loss: 0.4435, test_loss: 1.2011, test_f1: 0.6357
 epoch: 70, train_loss: 0.4671, test_loss: 1.1238, test_f1: 0.6643
 epoch: 71, train_loss: 0.4492, test_loss: 1.2189, test_f1: 0.6442
 epoch: 72, train_loss: 0.4400, test_loss: 1.1828, test_f1: 0.6518
 epoch: 73, train_loss: 0.4286, test_loss: 1.1393, test_f1: 0.6242
 epoch: 74, train_loss: 0.4233, test_loss: 1.1443, test_f1: 0.6414
 epoch: 75, train_loss: 0.4413, test_loss: 1.3086, test_f1: 0.6287
 epoch: 76, train_loss: 0.4260, test_loss: 1.2214, test_f1: 0.6293
 epoch: 77, train_loss: 0.4131, test_loss: 1.2072, test_f1: 0.6508
 epoch: 78, train_loss: 0.4159, test_loss: 1.2198, test_f1: 0.6459
 epoch: 79, train_loss: 0.4286, test_loss: 1.3034, test_f1: 0.6238
 epoch: 80, train_loss: 0.4000, test_loss: 1.3527, test_f1: 0.6258
 epoch: 81, train_loss: 0.3899, test_loss: 1.2679, test_f1: 0.6355
 epoch: 82, train_loss: 0.3899, test_loss: 1.2431, test_f1: 0.6591
 epoch: 83, train_loss: 0.3878, test_loss: 1.2893, test_f1: 0.6454
 epoch: 84, train_loss: 0.3825, test_loss: 1.3264, test_f1: 0.6343
 epoch: 85, train_loss: 0.3795, test_loss: 1.3898, test_f1: 0.6417
 epoch: 86, train_loss: 0.3782, test_loss: 1.3916, test_f1: 0.6434
 epoch: 87, train_loss: 0.4039, test_loss: 1.2320, test_f1: 0.6464
 epoch: 88, train_loss: 0.3503, test_loss: 1.3415, test_f1: 0.6376
 epoch: 89, train_loss: 0.3669, test_loss: 1.3549, test_f1: 0.6274
 epoch: 90, train_loss: 0.3624, test_loss: 1.3561, test_f1: 0.6522
 epoch: 91, train_loss: 0.3814, test_loss: 1.3381, test_f1: 0.6387
 epoch: 92, train_loss: 0.3951, test_loss: 1.3166, test_f1: 0.6496
 epoch: 93, train_loss: 0.3533, test_loss: 1.3552, test_f1: 0.6569
 epoch: 94, train_loss: 0.3418, test_loss: 1.3749, test_f1: 0.6444
 epoch: 95, train_loss: 0.3558, test_loss: 1.5645, test_f1: 0.6202
 epoch: 96, train_loss: 0.3414, test_loss: 1.2957, test_f1: 0.6473
 epoch: 97, train_loss: 0.3422, test_loss: 1.3917, test_f1: 0.6521
 epoch: 98, train_loss: 0.3518, test_loss: 1.3568, test_f1: 0.6478
 epoch: 99, train_loss: 0.3326, test_loss: 1.5283, test_f1: 0.5962
##################ITERATION #8 ****************************************
 epoch: 0, train_loss: 1.3691, test_loss: 1.0301, test_f1: 0.4307
 epoch: 1, train_loss: 1.0418, test_loss: 0.9677, test_f1: 0.4851
 epoch: 2, train_loss: 0.9733, test_loss: 0.9724, test_f1: 0.4820
 epoch: 3, train_loss: 0.9670, test_loss: 0.9731, test_f1: 0.4829
 epoch: 4, train_loss: 0.9318, test_loss: 0.9819, test_f1: 0.4954
 epoch: 5, train_loss: 0.9244, test_loss: 0.9761, test_f1: 0.4993
 epoch: 6, train_loss: 0.9063, test_loss: 0.9843, test_f1: 0.5182
 epoch: 7, train_loss: 0.8861, test_loss: 0.9712, test_f1: 0.4983
 epoch: 8, train_loss: 0.8865, test_loss: 0.9448, test_f1: 0.5270
 epoch: 9, train_loss: 0.8654, test_loss: 0.9436, test_f1: 0.5344
 epoch: 10, train_loss: 0.8514, test_loss: 0.9380, test_f1: 0.5452
 epoch: 11, train_loss: 0.8377, test_loss: 1.0401, test_f1: 0.4946
 epoch: 12, train_loss: 0.8484, test_loss: 0.9601, test_f1: 0.5360
 epoch: 13, train_loss: 0.8277, test_loss: 0.9283, test_f1: 0.5421
 epoch: 14, train_loss: 0.8334, test_loss: 0.9338, test_f1: 0.5438
 epoch: 15, train_loss: 0.8464, test_loss: 0.9337, test_f1: 0.5213
 epoch: 16, train_loss: 0.8349, test_loss: 0.9385, test_f1: 0.5429
 epoch: 17, train_loss: 0.8098, test_loss: 0.9641, test_f1: 0.5648
 epoch: 18, train_loss: 0.8041, test_loss: 0.9912, test_f1: 0.5511
 epoch: 19, train_loss: 0.8075, test_loss: 0.9573, test_f1: 0.5715
 epoch: 20, train_loss: 0.8039, test_loss: 0.9873, test_f1: 0.5520
 epoch: 21, train_loss: 0.7879, test_loss: 0.9597, test_f1: 0.5563
 epoch: 22, train_loss: 0.7723, test_loss: 1.1695, test_f1: 0.4930
 epoch: 23, train_loss: 0.7809, test_loss: 0.9679, test_f1: 0.5751
 epoch: 24, train_loss: 0.7702, test_loss: 1.0044, test_f1: 0.5840
 epoch: 25, train_loss: 0.7701, test_loss: 0.9718, test_f1: 0.5767
 epoch: 26, train_loss: 0.7471, test_loss: 1.0870, test_f1: 0.5780
 epoch: 27, train_loss: 0.7462, test_loss: 1.0622, test_f1: 0.5632
 epoch: 28, train_loss: 0.7446, test_loss: 0.9918, test_f1: 0.5805
 epoch: 29, train_loss: 0.7488, test_loss: 0.9682, test_f1: 0.5877
 epoch: 30, train_loss: 0.7318, test_loss: 1.0356, test_f1: 0.5673
 epoch: 31, train_loss: 0.7365, test_loss: 0.9900, test_f1: 0.5872
 epoch: 32, train_loss: 0.7296, test_loss: 0.9448, test_f1: 0.5998
 epoch: 33, train_loss: 0.7055, test_loss: 0.9618, test_f1: 0.6323
 epoch: 34, train_loss: 0.7260, test_loss: 0.9850, test_f1: 0.6005
 epoch: 35, train_loss: 0.7033, test_loss: 1.0392, test_f1: 0.5813
 epoch: 36, train_loss: 0.6910, test_loss: 0.9636, test_f1: 0.6269
 epoch: 37, train_loss: 0.6905, test_loss: 1.0531, test_f1: 0.5804
 epoch: 38, train_loss: 0.6834, test_loss: 1.0138, test_f1: 0.6158
 epoch: 39, train_loss: 0.6820, test_loss: 1.1398, test_f1: 0.5892
 epoch: 40, train_loss: 0.6896, test_loss: 1.0485, test_f1: 0.5930
 epoch: 41, train_loss: 0.6811, test_loss: 1.1128, test_f1: 0.5855
 epoch: 42, train_loss: 0.6818, test_loss: 1.0865, test_f1: 0.5962
 epoch: 43, train_loss: 0.6652, test_loss: 0.9764, test_f1: 0.6408
 epoch: 44, train_loss: 0.6498, test_loss: 1.0754, test_f1: 0.6242
 epoch: 45, train_loss: 0.6638, test_loss: 0.9934, test_f1: 0.6218
 epoch: 46, train_loss: 0.6430, test_loss: 1.0662, test_f1: 0.6000
 epoch: 47, train_loss: 0.6412, test_loss: 1.0740, test_f1: 0.6373
 epoch: 48, train_loss: 0.6618, test_loss: 1.0223, test_f1: 0.6103
 epoch: 49, train_loss: 0.6382, test_loss: 0.9947, test_f1: 0.5955
 epoch: 50, train_loss: 0.6197, test_loss: 1.0721, test_f1: 0.6285
 epoch: 51, train_loss: 0.6052, test_loss: 1.0099, test_f1: 0.6311
 epoch: 52, train_loss: 0.5731, test_loss: 1.0700, test_f1: 0.6607
 epoch: 53, train_loss: 0.5680, test_loss: 1.0756, test_f1: 0.6168
 epoch: 54, train_loss: 0.5768, test_loss: 0.9820, test_f1: 0.6217
 epoch: 55, train_loss: 0.5453, test_loss: 1.0242, test_f1: 0.6406
 epoch: 56, train_loss: 0.5433, test_loss: 1.0527, test_f1: 0.6399
 epoch: 57, train_loss: 0.5496, test_loss: 1.0754, test_f1: 0.6014
 epoch: 58, train_loss: 0.5317, test_loss: 1.0995, test_f1: 0.6518
 epoch: 59, train_loss: 0.5268, test_loss: 1.1002, test_f1: 0.6386
 epoch: 60, train_loss: 0.5383, test_loss: 1.0617, test_f1: 0.6261
 epoch: 61, train_loss: 0.5315, test_loss: 1.0655, test_f1: 0.6221
 epoch: 62, train_loss: 0.5344, test_loss: 1.0817, test_f1: 0.6336
 epoch: 63, train_loss: 0.5128, test_loss: 1.0892, test_f1: 0.6194
 epoch: 64, train_loss: 0.5060, test_loss: 1.1374, test_f1: 0.6371
 epoch: 65, train_loss: 0.5190, test_loss: 1.1703, test_f1: 0.6168
 epoch: 66, train_loss: 0.5099, test_loss: 1.0469, test_f1: 0.6458
 epoch: 67, train_loss: 0.5127, test_loss: 1.0765, test_f1: 0.6345
 epoch: 68, train_loss: 0.4928, test_loss: 1.2063, test_f1: 0.6443
 epoch: 69, train_loss: 0.5071, test_loss: 1.0793, test_f1: 0.6454
 epoch: 70, train_loss: 0.4705, test_loss: 1.1782, test_f1: 0.6388
 epoch: 71, train_loss: 0.4759, test_loss: 1.0759, test_f1: 0.6394
 epoch: 72, train_loss: 0.4803, test_loss: 1.1152, test_f1: 0.6377
 epoch: 73, train_loss: 0.4832, test_loss: 1.1842, test_f1: 0.6312
 epoch: 74, train_loss: 0.4722, test_loss: 1.2350, test_f1: 0.6026
 epoch: 75, train_loss: 0.4621, test_loss: 1.2420, test_f1: 0.6308
 epoch: 76, train_loss: 0.4616, test_loss: 1.3092, test_f1: 0.6241
 epoch: 77, train_loss: 0.4626, test_loss: 1.2218, test_f1: 0.6337
 epoch: 78, train_loss: 0.4488, test_loss: 1.1346, test_f1: 0.6448
 epoch: 79, train_loss: 0.4549, test_loss: 1.2203, test_f1: 0.6375
 epoch: 80, train_loss: 0.4625, test_loss: 1.2819, test_f1: 0.6328
 epoch: 81, train_loss: 0.4500, test_loss: 1.1658, test_f1: 0.6486
 epoch: 82, train_loss: 0.4326, test_loss: 1.1608, test_f1: 0.6453
 epoch: 83, train_loss: 0.4254, test_loss: 1.1784, test_f1: 0.6479
 epoch: 84, train_loss: 0.4629, test_loss: 1.2936, test_f1: 0.6284
 epoch: 85, train_loss: 0.4331, test_loss: 1.1389, test_f1: 0.6366
 epoch: 86, train_loss: 0.4327, test_loss: 1.2832, test_f1: 0.6308
 epoch: 87, train_loss: 0.4085, test_loss: 1.3277, test_f1: 0.6264
 epoch: 88, train_loss: 0.4065, test_loss: 1.2923, test_f1: 0.6232
 epoch: 89, train_loss: 0.4136, test_loss: 1.3019, test_f1: 0.6342
 epoch: 90, train_loss: 0.4465, test_loss: 1.2798, test_f1: 0.6413
 epoch: 91, train_loss: 0.4224, test_loss: 1.3107, test_f1: 0.6234
 epoch: 92, train_loss: 0.4186, test_loss: 1.2926, test_f1: 0.6306
 epoch: 93, train_loss: 0.4089, test_loss: 1.3187, test_f1: 0.6178
 epoch: 94, train_loss: 0.3942, test_loss: 1.2937, test_f1: 0.6540
 epoch: 95, train_loss: 0.3952, test_loss: 1.4553, test_f1: 0.6347
 epoch: 96, train_loss: 0.3842, test_loss: 1.3675, test_f1: 0.6462
 epoch: 97, train_loss: 0.3893, test_loss: 1.4296, test_f1: 0.6454
 epoch: 98, train_loss: 0.3879, test_loss: 1.2473, test_f1: 0.6682
 epoch: 99, train_loss: 0.3969, test_loss: 1.2780, test_f1: 0.6572
##################ITERATION #9 ****************************************
 epoch: 0, train_loss: 1.3393, test_loss: 1.1037, test_f1: 0.3801
 epoch: 1, train_loss: 1.0582, test_loss: 0.9628, test_f1: 0.4539
 epoch: 2, train_loss: 1.0064, test_loss: 0.9706, test_f1: 0.4510
 epoch: 3, train_loss: 0.9907, test_loss: 0.9745, test_f1: 0.4626
 epoch: 4, train_loss: 0.9611, test_loss: 0.9603, test_f1: 0.4837
 epoch: 5, train_loss: 0.9426, test_loss: 0.9584, test_f1: 0.4791
 epoch: 6, train_loss: 0.9269, test_loss: 0.9465, test_f1: 0.4936
 epoch: 7, train_loss: 0.9221, test_loss: 0.9536, test_f1: 0.4819
 epoch: 8, train_loss: 0.8977, test_loss: 0.9595, test_f1: 0.4999
 epoch: 9, train_loss: 0.8982, test_loss: 0.9347, test_f1: 0.5130
 epoch: 10, train_loss: 0.8739, test_loss: 0.9767, test_f1: 0.5049
 epoch: 11, train_loss: 0.8642, test_loss: 0.9587, test_f1: 0.5150
 epoch: 12, train_loss: 0.8664, test_loss: 0.9175, test_f1: 0.5203
 epoch: 13, train_loss: 0.8578, test_loss: 0.9189, test_f1: 0.5315
 epoch: 14, train_loss: 0.8419, test_loss: 0.9643, test_f1: 0.5144
 epoch: 15, train_loss: 0.8245, test_loss: 0.9039, test_f1: 0.5266
 epoch: 16, train_loss: 0.8111, test_loss: 0.9490, test_f1: 0.5298
 epoch: 17, train_loss: 0.8390, test_loss: 0.9720, test_f1: 0.5291
 epoch: 18, train_loss: 0.8272, test_loss: 0.9399, test_f1: 0.5764
 epoch: 19, train_loss: 0.8118, test_loss: 0.9558, test_f1: 0.5424
 epoch: 20, train_loss: 0.8087, test_loss: 0.9509, test_f1: 0.5167
 epoch: 21, train_loss: 0.7912, test_loss: 0.9709, test_f1: 0.5249
 epoch: 22, train_loss: 0.7916, test_loss: 0.9362, test_f1: 0.5343
 epoch: 23, train_loss: 0.7765, test_loss: 0.9490, test_f1: 0.5430
 epoch: 24, train_loss: 0.7586, test_loss: 0.9677, test_f1: 0.5551
 epoch: 25, train_loss: 0.7530, test_loss: 0.9629, test_f1: 0.5719
 epoch: 26, train_loss: 0.7704, test_loss: 0.9418, test_f1: 0.5973
 epoch: 27, train_loss: 0.7414, test_loss: 0.9382, test_f1: 0.6025
 epoch: 28, train_loss: 0.7596, test_loss: 0.9327, test_f1: 0.5868
 epoch: 29, train_loss: 0.7425, test_loss: 0.9474, test_f1: 0.5968
 epoch: 30, train_loss: 0.7274, test_loss: 1.0273, test_f1: 0.5755
 epoch: 31, train_loss: 0.7280, test_loss: 1.0024, test_f1: 0.5294
 epoch: 32, train_loss: 0.7076, test_loss: 0.9241, test_f1: 0.5845
 epoch: 33, train_loss: 0.7051, test_loss: 0.9513, test_f1: 0.5806
 epoch: 34, train_loss: 0.7009, test_loss: 1.0074, test_f1: 0.5930
 epoch: 35, train_loss: 0.6888, test_loss: 0.9824, test_f1: 0.5960
 epoch: 36, train_loss: 0.7035, test_loss: 1.0055, test_f1: 0.5686
 epoch: 37, train_loss: 0.6771, test_loss: 1.0480, test_f1: 0.5663
 epoch: 38, train_loss: 0.6711, test_loss: 0.9857, test_f1: 0.6256
 epoch: 39, train_loss: 0.6746, test_loss: 0.9965, test_f1: 0.6099
 epoch: 40, train_loss: 0.6714, test_loss: 0.9916, test_f1: 0.6249
 epoch: 41, train_loss: 0.6550, test_loss: 1.0833, test_f1: 0.6019
 epoch: 42, train_loss: 0.6649, test_loss: 1.0257, test_f1: 0.5761
 epoch: 43, train_loss: 0.6547, test_loss: 1.0181, test_f1: 0.6500
 epoch: 44, train_loss: 0.6449, test_loss: 1.0104, test_f1: 0.6227
 epoch: 45, train_loss: 0.6470, test_loss: 1.0914, test_f1: 0.5891
 epoch: 46, train_loss: 0.6503, test_loss: 0.9870, test_f1: 0.6382
 epoch: 47, train_loss: 0.6364, test_loss: 1.0513, test_f1: 0.5878
 epoch: 48, train_loss: 0.6160, test_loss: 1.0436, test_f1: 0.6046
 epoch: 49, train_loss: 0.6210, test_loss: 1.0880, test_f1: 0.6082
 epoch: 50, train_loss: 0.6100, test_loss: 1.0427, test_f1: 0.6391
 epoch: 51, train_loss: 0.5778, test_loss: 1.0600, test_f1: 0.5984
 epoch: 52, train_loss: 0.5643, test_loss: 1.0589, test_f1: 0.6450
 epoch: 53, train_loss: 0.5381, test_loss: 1.0997, test_f1: 0.6353
 epoch: 54, train_loss: 0.5389, test_loss: 1.0769, test_f1: 0.6548
 epoch: 55, train_loss: 0.5314, test_loss: 1.1016, test_f1: 0.6265
 epoch: 56, train_loss: 0.5289, test_loss: 1.1151, test_f1: 0.6454
 epoch: 57, train_loss: 0.5132, test_loss: 1.1108, test_f1: 0.6169
 epoch: 58, train_loss: 0.4918, test_loss: 1.0931, test_f1: 0.6703
 epoch: 59, train_loss: 0.5022, test_loss: 1.1627, test_f1: 0.6522
 epoch: 60, train_loss: 0.4923, test_loss: 1.1666, test_f1: 0.6671
 epoch: 61, train_loss: 0.4950, test_loss: 1.1595, test_f1: 0.6461
 epoch: 62, train_loss: 0.4824, test_loss: 1.1466, test_f1: 0.6602
 epoch: 63, train_loss: 0.4872, test_loss: 1.1619, test_f1: 0.6585
 epoch: 64, train_loss: 0.4812, test_loss: 1.1246, test_f1: 0.6473
 epoch: 65, train_loss: 0.4888, test_loss: 1.1769, test_f1: 0.6695
 epoch: 66, train_loss: 0.4815, test_loss: 1.1569, test_f1: 0.6592
 epoch: 67, train_loss: 0.4675, test_loss: 1.1941, test_f1: 0.6594
 epoch: 68, train_loss: 0.4598, test_loss: 1.2372, test_f1: 0.6424
 epoch: 69, train_loss: 0.4626, test_loss: 1.2054, test_f1: 0.6620
 epoch: 70, train_loss: 0.4588, test_loss: 1.2253, test_f1: 0.6573
 epoch: 71, train_loss: 0.4506, test_loss: 1.1668, test_f1: 0.6420
 epoch: 72, train_loss: 0.4512, test_loss: 1.2149, test_f1: 0.6498
 epoch: 73, train_loss: 0.4535, test_loss: 1.1830, test_f1: 0.6730
 epoch: 74, train_loss: 0.4429, test_loss: 1.2487, test_f1: 0.6635
 epoch: 75, train_loss: 0.4306, test_loss: 1.2246, test_f1: 0.6656
 epoch: 76, train_loss: 0.4400, test_loss: 1.2110, test_f1: 0.6582
 epoch: 77, train_loss: 0.4352, test_loss: 1.3123, test_f1: 0.6596
 epoch: 78, train_loss: 0.4307, test_loss: 1.2584, test_f1: 0.6470
 epoch: 79, train_loss: 0.4403, test_loss: 1.2346, test_f1: 0.6624
 epoch: 80, train_loss: 0.4215, test_loss: 1.2365, test_f1: 0.6523
 epoch: 81, train_loss: 0.4252, test_loss: 1.2911, test_f1: 0.6208
 epoch: 82, train_loss: 0.4198, test_loss: 1.3132, test_f1: 0.6392
 epoch: 83, train_loss: 0.4234, test_loss: 1.2631, test_f1: 0.6402
 epoch: 84, train_loss: 0.4148, test_loss: 1.2865, test_f1: 0.6642
 epoch: 85, train_loss: 0.3911, test_loss: 1.3145, test_f1: 0.6418
 epoch: 86, train_loss: 0.3916, test_loss: 1.2594, test_f1: 0.6752
 epoch: 87, train_loss: 0.3906, test_loss: 1.4499, test_f1: 0.6365
 epoch: 88, train_loss: 0.4045, test_loss: 1.3870, test_f1: 0.6591
 epoch: 89, train_loss: 0.4061, test_loss: 1.3420, test_f1: 0.6753
 epoch: 90, train_loss: 0.3961, test_loss: 1.3737, test_f1: 0.6662
 epoch: 91, train_loss: 0.3781, test_loss: 1.4116, test_f1: 0.6515
 epoch: 92, train_loss: 0.3837, test_loss: 1.3712, test_f1: 0.6397
 epoch: 93, train_loss: 0.3719, test_loss: 1.3717, test_f1: 0.6292
 epoch: 94, train_loss: 0.3845, test_loss: 1.4021, test_f1: 0.6439
 epoch: 95, train_loss: 0.3949, test_loss: 1.3473, test_f1: 0.6450
 epoch: 96, train_loss: 0.3596, test_loss: 1.4013, test_f1: 0.6413
 epoch: 97, train_loss: 0.3598, test_loss: 1.4372, test_f1: 0.6398
 epoch: 98, train_loss: 0.3786, test_loss: 1.4726, test_f1: 0.6305
 epoch: 99, train_loss: 0.3540, test_loss: 1.3792, test_f1: 0.6382

Training completed in 738.71 seconds
Best F1: 0.7063 at epoch 87
Mean F1 across iterations: 0.6784  0.0129
========================FINAL RESULTS================================
FEGIN weighted F1: 0.7063  0.0129
python main.py --data ltspice_examples --representation component_net --model FEGIN --layers 5 --hiddens 64 --batch_size 64 --lr 0.001 --emb_size 512 --epochs 100 --save_appendix component_net_L5_H64_BS64_LR0.001_E512 --no_val
-----



STDERR:
  File "main.py", line 370, in <module>
    main()
  File "main.py", line 254, in main
    dataset = dataset_class(
  File "/home/philip/projects/ltspice_examples_code_repo/Circuit-Completion-Using-GNNs/component_classification_with_link_prediction_head/evaluation/FEGIN/kernel/circuit_datasets.py", line 15, in __init__
    self.data, self.slices = torch.load(self.processed_paths[0])
  File "/home/philip/.local/lib/python3.8/site-packages/torch/serialization.py", line 1040, in load
    warnings.warn(
  File "/usr/lib/python3.8/warnings.py", line 109, in _showwarnmsg
    sw(msg.message, msg.category, msg.filename, msg.lineno,
  File "main.py", line 47, in warn_with_traceback
    traceback.print_stack(file=log)
/home/philip/projects/ltspice_examples_code_repo/Circuit-Completion-Using-GNNs/component_classification_with_link_prediction_head/evaluation/FEGIN/kernel/circuit_datasets.py:15: FutureWarning: You are using `torch.load` with `weights_only=False` (the current default value), which uses the default pickle module implicitly. It is possible to construct malicious pickle data which will execute arbitrary code during unpickling (See https://github.com/pytorch/pytorch/blob/main/SECURITY.md#untrusted-models for more details). In a future release, the default value for `weights_only` will be flipped to `True`. This limits the functions that could be executed during unpickling. Arbitrary objects will no longer be allowed to be loaded via this mode unless they are explicitly allowlisted by the user via `torch.serialization.add_safe_globals`. We recommend you start setting `weights_only=True` for any use case where you don't have full control of the loaded file. Please open an issue on GitHub for any issues related to this experimental feature.
  self.data, self.slices = torch.load(self.processed_paths[0])
