STDOUT:
Results will be saved in /home/philip/projects/ltspice_examples_code_repo/Circuit-Completion-Using-GNNs/component_classification_with_link_prediction_head/evaluation/FEGIN/results/model_FEGIN_dataset_ltspice_demos
Command line input: python main.py --data ltspice_demos --representation component_pin_net --model FEGIN --layers 2 --hiddens 32 --batch_size 256 --lr 0.1 --emb_size 250 --epochs 100 --save_appendix component_pin_net_L2_H32_BS256_LR0.1_E250 --no_val
 is saved.
-----
ltspice_demos - FEGIN
Using 2 layers, 32 hidden units, h = 2
Loading component_pin_net representation dataset
ENTERED
Training FEGIN on component_pin_net representation
Train: 1565, Test: 383
##################ITERATION #0 ****************************************
 epoch: 0, train_loss: 1.3133, test_loss: 14.2109, test_f1: 0.0301
 epoch: 1, train_loss: 1.1328, test_loss: 2.6536, test_f1: 0.1098
 epoch: 2, train_loss: 1.0702, test_loss: 1.7316, test_f1: 0.2442
 epoch: 3, train_loss: 1.0126, test_loss: 1.0902, test_f1: 0.4703
 epoch: 4, train_loss: 1.0358, test_loss: 1.1221, test_f1: 0.4259
 epoch: 5, train_loss: 1.0323, test_loss: 1.4949, test_f1: 0.3221
 epoch: 6, train_loss: 1.0446, test_loss: 3.0709, test_f1: 0.1338
 epoch: 7, train_loss: 1.0245, test_loss: 1.1088, test_f1: 0.5208
 epoch: 8, train_loss: 1.0062, test_loss: 1.3077, test_f1: 0.4591
 epoch: 9, train_loss: 0.9800, test_loss: 1.0784, test_f1: 0.5179
 epoch: 10, train_loss: 0.9556, test_loss: 1.0353, test_f1: 0.4056
 epoch: 11, train_loss: 0.9541, test_loss: 1.0838, test_f1: 0.3965
 epoch: 12, train_loss: 0.9336, test_loss: 1.0036, test_f1: 0.4847
 epoch: 13, train_loss: 0.9878, test_loss: 1.0129, test_f1: 0.4253
 epoch: 14, train_loss: 0.9669, test_loss: 4.9024, test_f1: 0.2052
 epoch: 15, train_loss: 0.9803, test_loss: 1.0281, test_f1: 0.5344
 epoch: 16, train_loss: 0.9876, test_loss: 1.1530, test_f1: 0.4121
 epoch: 17, train_loss: 0.9909, test_loss: 5.0075, test_f1: 0.3542
 epoch: 18, train_loss: 0.9730, test_loss: 1.0551, test_f1: 0.5178
 epoch: 19, train_loss: 0.9413, test_loss: 1.0376, test_f1: 0.4178
 epoch: 20, train_loss: 0.9687, test_loss: 1.0718, test_f1: 0.3774
 epoch: 21, train_loss: 0.9761, test_loss: 4.2504, test_f1: 0.1257
 epoch: 22, train_loss: 0.9636, test_loss: 1.3253, test_f1: 0.3425
 epoch: 23, train_loss: 0.9273, test_loss: 1.6573, test_f1: 0.3873
 epoch: 24, train_loss: 0.9184, test_loss: 0.9743, test_f1: 0.4303
 epoch: 25, train_loss: 0.9400, test_loss: 4.9456, test_f1: 0.2936
 epoch: 26, train_loss: 0.9535, test_loss: 1.0247, test_f1: 0.4196
 epoch: 27, train_loss: 0.9771, test_loss: 1.2482, test_f1: 0.3339
 epoch: 28, train_loss: 0.9231, test_loss: 1.0695, test_f1: 0.5048
 epoch: 29, train_loss: 0.9263, test_loss: 1.1680, test_f1: 0.3290
 epoch: 30, train_loss: 1.0108, test_loss: 1.5444, test_f1: 0.2690
 epoch: 31, train_loss: 1.0328, test_loss: 3.7843, test_f1: 0.2324
 epoch: 32, train_loss: 1.0624, test_loss: 1.1051, test_f1: 0.3421
 epoch: 33, train_loss: 1.0435, test_loss: 1.1485, test_f1: 0.3290
 epoch: 34, train_loss: 1.0351, test_loss: 1.2958, test_f1: 0.2759
 epoch: 35, train_loss: 1.1164, test_loss: 1.1608, test_f1: 0.3300
 epoch: 36, train_loss: 1.1074, test_loss: 1.1365, test_f1: 0.3317
 epoch: 37, train_loss: 1.0370, test_loss: 1.1100, test_f1: 0.3420
 epoch: 38, train_loss: 1.0306, test_loss: 1.2161, test_f1: 0.3195
 epoch: 39, train_loss: 1.0308, test_loss: 1.2425, test_f1: 0.3102
 epoch: 40, train_loss: 1.0122, test_loss: 1.1359, test_f1: 0.3250
 epoch: 41, train_loss: 1.0165, test_loss: 1.1031, test_f1: 0.3421
 epoch: 42, train_loss: 1.0129, test_loss: 1.1362, test_f1: 0.3370
 epoch: 43, train_loss: 1.0141, test_loss: 1.1181, test_f1: 0.3243
 epoch: 44, train_loss: 1.0208, test_loss: 1.0852, test_f1: 0.3445
 epoch: 45, train_loss: 1.0159, test_loss: 1.0971, test_f1: 0.3370
 epoch: 46, train_loss: 1.0351, test_loss: 1.1495, test_f1: 0.3124
 epoch: 47, train_loss: 1.0270, test_loss: 1.1112, test_f1: 0.4089
 epoch: 48, train_loss: 1.0166, test_loss: 1.1028, test_f1: 0.3529
 epoch: 49, train_loss: 1.0096, test_loss: 1.0954, test_f1: 0.3468
 epoch: 50, train_loss: 1.0108, test_loss: 1.0911, test_f1: 0.3529
 epoch: 51, train_loss: 1.0275, test_loss: 1.1072, test_f1: 0.3395
 epoch: 52, train_loss: 1.0126, test_loss: 1.1145, test_f1: 0.3370
 epoch: 53, train_loss: 1.0066, test_loss: 1.1029, test_f1: 0.3468
 epoch: 54, train_loss: 1.0019, test_loss: 1.1068, test_f1: 0.3468
 epoch: 55, train_loss: 1.0025, test_loss: 1.1146, test_f1: 0.3393
 epoch: 56, train_loss: 1.0067, test_loss: 1.1238, test_f1: 0.3296
 epoch: 57, train_loss: 1.0074, test_loss: 1.1011, test_f1: 0.3461
 epoch: 58, train_loss: 1.0103, test_loss: 1.1266, test_f1: 0.3344
 epoch: 59, train_loss: 1.0218, test_loss: 1.1313, test_f1: 0.3344
 epoch: 60, train_loss: 1.0142, test_loss: 1.1163, test_f1: 0.3370
 epoch: 61, train_loss: 1.0021, test_loss: 1.1079, test_f1: 0.3372
 epoch: 62, train_loss: 1.0031, test_loss: 1.1013, test_f1: 0.3468
 epoch: 63, train_loss: 0.9982, test_loss: 1.1010, test_f1: 0.3468
 epoch: 64, train_loss: 1.0025, test_loss: 1.1013, test_f1: 0.3397
 epoch: 65, train_loss: 1.0021, test_loss: 1.0917, test_f1: 0.3468
 epoch: 66, train_loss: 1.0012, test_loss: 1.1897, test_f1: 0.3161
 epoch: 67, train_loss: 1.0051, test_loss: 1.1253, test_f1: 0.3254
 epoch: 68, train_loss: 1.0060, test_loss: 1.0988, test_f1: 0.3395
 epoch: 69, train_loss: 1.0046, test_loss: 1.0960, test_f1: 0.3468
 epoch: 70, train_loss: 1.0215, test_loss: 1.1071, test_f1: 0.3420
 epoch: 71, train_loss: 1.0107, test_loss: 1.1334, test_f1: 0.3344
 epoch: 72, train_loss: 1.0207, test_loss: 1.1157, test_f1: 0.3370
 epoch: 73, train_loss: 1.0110, test_loss: 1.1237, test_f1: 0.3344
 epoch: 74, train_loss: 1.0115, test_loss: 1.1255, test_f1: 0.3344
 epoch: 75, train_loss: 1.0063, test_loss: 1.1042, test_f1: 0.3420
 epoch: 76, train_loss: 1.0027, test_loss: 1.1116, test_f1: 0.4088
 epoch: 77, train_loss: 1.0055, test_loss: 1.1205, test_f1: 0.4173
 epoch: 78, train_loss: 0.9967, test_loss: 1.1034, test_f1: 0.4292
 epoch: 79, train_loss: 1.0066, test_loss: 1.1084, test_f1: 0.3370
 epoch: 80, train_loss: 0.9963, test_loss: 1.1094, test_f1: 0.3420
 epoch: 81, train_loss: 0.9970, test_loss: 1.0789, test_f1: 0.3468
 epoch: 82, train_loss: 1.0102, test_loss: 1.0748, test_f1: 0.3536
 epoch: 83, train_loss: 1.0088, test_loss: 1.0886, test_f1: 0.3444
 epoch: 84, train_loss: 1.0490, test_loss: 1.2714, test_f1: 0.3795
 epoch: 85, train_loss: 1.0292, test_loss: 1.2120, test_f1: 0.3752
 epoch: 86, train_loss: 1.0141, test_loss: 1.1571, test_f1: 0.3317
 epoch: 87, train_loss: 1.0066, test_loss: 1.1459, test_f1: 0.3370
 epoch: 88, train_loss: 1.0127, test_loss: 1.1400, test_f1: 0.3395
 epoch: 89, train_loss: 1.0282, test_loss: 2.1129, test_f1: 0.2588
 epoch: 90, train_loss: 1.0184, test_loss: 2.9010, test_f1: 0.2412
 epoch: 91, train_loss: 1.0131, test_loss: 1.3642, test_f1: 0.2915
 epoch: 92, train_loss: 1.0170, test_loss: 1.3426, test_f1: 0.2880
 epoch: 93, train_loss: 1.0038, test_loss: 1.0860, test_f1: 0.3477
 epoch: 94, train_loss: 0.9991, test_loss: 1.0771, test_f1: 0.3466
 epoch: 95, train_loss: 0.9883, test_loss: 1.0553, test_f1: 0.4039
 epoch: 96, train_loss: 0.9883, test_loss: 1.0583, test_f1: 0.3685
 epoch: 97, train_loss: 0.9787, test_loss: 1.0719, test_f1: 0.3708
 epoch: 98, train_loss: 0.9636, test_loss: 1.0538, test_f1: 0.4031
 epoch: 99, train_loss: 0.9528, test_loss: 1.0529, test_f1: 0.4165
##################ITERATION #1 ****************************************
 epoch: 0, train_loss: 1.3256, test_loss: 1.3372, test_f1: 0.2281
 epoch: 1, train_loss: 1.2665, test_loss: 1.3355, test_f1: 0.2281
 epoch: 2, train_loss: 1.2437, test_loss: 1.3292, test_f1: 0.2281
 epoch: 3, train_loss: 1.2418, test_loss: 1.3177, test_f1: 0.2281
 epoch: 4, train_loss: 1.2136, test_loss: 1.2329, test_f1: 0.2876
 epoch: 5, train_loss: 1.1502, test_loss: 1.2668, test_f1: 0.2586
 epoch: 6, train_loss: 1.1283, test_loss: 1.2070, test_f1: 0.3083
 epoch: 7, train_loss: 1.0995, test_loss: 1.1479, test_f1: 0.3317
 epoch: 8, train_loss: 1.0716, test_loss: 1.1045, test_f1: 0.3444
 epoch: 9, train_loss: 1.0547, test_loss: 1.1493, test_f1: 0.3262
 epoch: 10, train_loss: 1.0599, test_loss: 1.1033, test_f1: 0.3444
 epoch: 11, train_loss: 1.0354, test_loss: 1.1251, test_f1: 0.3479
 epoch: 12, train_loss: 1.0716, test_loss: 1.3938, test_f1: 0.2336
 epoch: 13, train_loss: 1.0768, test_loss: 1.1988, test_f1: 0.3146
 epoch: 14, train_loss: 1.0534, test_loss: 1.1660, test_f1: 0.3234
 epoch: 15, train_loss: 1.0458, test_loss: 1.1270, test_f1: 0.3344
 epoch: 16, train_loss: 1.0365, test_loss: 1.1120, test_f1: 0.3352
 epoch: 17, train_loss: 1.0265, test_loss: 1.1126, test_f1: 0.3597
 epoch: 18, train_loss: 1.0306, test_loss: 1.1389, test_f1: 0.3438
 epoch: 19, train_loss: 1.0308, test_loss: 1.1221, test_f1: 0.3509
 epoch: 20, train_loss: 1.0285, test_loss: 1.1197, test_f1: 0.3395
 epoch: 21, train_loss: 1.0320, test_loss: 1.1565, test_f1: 0.3344
 epoch: 22, train_loss: 1.0256, test_loss: 1.1025, test_f1: 0.3476
 epoch: 23, train_loss: 1.0318, test_loss: 1.2055, test_f1: 0.3124
 epoch: 24, train_loss: 1.0374, test_loss: 1.1633, test_f1: 0.3317
 epoch: 25, train_loss: 1.0185, test_loss: 1.1085, test_f1: 0.3402
 epoch: 26, train_loss: 1.0131, test_loss: 1.5706, test_f1: 0.2834
 epoch: 27, train_loss: 1.0402, test_loss: 1.1465, test_f1: 0.3291
 epoch: 28, train_loss: 1.0242, test_loss: 1.2482, test_f1: 0.2984
 epoch: 29, train_loss: 1.0238, test_loss: 1.2068, test_f1: 0.3146
 epoch: 30, train_loss: 1.0279, test_loss: 1.1359, test_f1: 0.3344
 epoch: 31, train_loss: 1.0255, test_loss: 1.1015, test_f1: 0.3397
 epoch: 32, train_loss: 1.1277, test_loss: 1.2403, test_f1: 0.2953
 epoch: 33, train_loss: 1.0771, test_loss: 1.1570, test_f1: 0.3143
 epoch: 34, train_loss: 1.0527, test_loss: 1.1682, test_f1: 0.3262
 epoch: 35, train_loss: 1.0536, test_loss: 1.1506, test_f1: 0.3290
 epoch: 36, train_loss: 1.0340, test_loss: 1.1388, test_f1: 0.3344
 epoch: 37, train_loss: 1.0248, test_loss: 1.1174, test_f1: 0.3344
 epoch: 38, train_loss: 1.0216, test_loss: 1.1253, test_f1: 0.3344
 epoch: 39, train_loss: 1.0158, test_loss: 1.1043, test_f1: 0.3397
 epoch: 40, train_loss: 1.0156, test_loss: 1.1206, test_f1: 0.3321
 epoch: 41, train_loss: 1.0207, test_loss: 1.1370, test_f1: 0.3344
 epoch: 42, train_loss: 1.0329, test_loss: 1.1376, test_f1: 0.3399
 epoch: 43, train_loss: 1.0378, test_loss: 1.8471, test_f1: 0.2803
 epoch: 44, train_loss: 1.0243, test_loss: 1.1332, test_f1: 0.3344
 epoch: 45, train_loss: 1.0157, test_loss: 1.2268, test_f1: 0.3146
 epoch: 46, train_loss: 1.0204, test_loss: 1.1862, test_f1: 0.3234
 epoch: 47, train_loss: 1.0075, test_loss: 1.2100, test_f1: 0.3176
 epoch: 48, train_loss: 1.0109, test_loss: 1.1245, test_f1: 0.3370
 epoch: 49, train_loss: 1.0132, test_loss: 1.1273, test_f1: 0.3370
 epoch: 50, train_loss: 1.0072, test_loss: 1.1268, test_f1: 0.3370
 epoch: 51, train_loss: 1.0014, test_loss: 1.1026, test_f1: 0.3421
 epoch: 52, train_loss: 1.0117, test_loss: 1.0955, test_f1: 0.3484
 epoch: 53, train_loss: 1.0038, test_loss: 1.1479, test_f1: 0.3221
 epoch: 54, train_loss: 1.0042, test_loss: 1.1195, test_f1: 0.3249
 epoch: 55, train_loss: 1.0300, test_loss: 1.1298, test_f1: 0.3344
 epoch: 56, train_loss: 1.0321, test_loss: 1.2282, test_f1: 0.3029
 epoch: 57, train_loss: 1.0161, test_loss: 1.1583, test_f1: 0.3251
 epoch: 58, train_loss: 1.0032, test_loss: 1.1194, test_f1: 0.3344
 epoch: 59, train_loss: 1.0055, test_loss: 1.1363, test_f1: 0.3344
 epoch: 60, train_loss: 1.0004, test_loss: 1.1049, test_f1: 0.3372
 epoch: 61, train_loss: 1.0084, test_loss: 1.0955, test_f1: 0.3468
 epoch: 62, train_loss: 1.0001, test_loss: 1.0929, test_f1: 0.3468
 epoch: 63, train_loss: 1.0037, test_loss: 1.1126, test_f1: 0.3371
 epoch: 64, train_loss: 0.9954, test_loss: 1.1148, test_f1: 0.3376
 epoch: 65, train_loss: 1.0010, test_loss: 1.1102, test_f1: 0.3421
 epoch: 66, train_loss: 0.9993, test_loss: 1.1164, test_f1: 0.3484
 epoch: 67, train_loss: 1.0206, test_loss: 1.2117, test_f1: 0.3138
 epoch: 68, train_loss: 1.0339, test_loss: 1.1413, test_f1: 0.3330
 epoch: 69, train_loss: 1.0259, test_loss: 1.1329, test_f1: 0.3336
 epoch: 70, train_loss: 1.0146, test_loss: 1.1599, test_f1: 0.3317
 epoch: 71, train_loss: 1.0050, test_loss: 1.1947, test_f1: 0.3234
 epoch: 72, train_loss: 1.0065, test_loss: 1.1527, test_f1: 0.3344
 epoch: 73, train_loss: 0.9979, test_loss: 1.1342, test_f1: 0.3346
 epoch: 74, train_loss: 1.0015, test_loss: 1.0989, test_f1: 0.3445
 epoch: 75, train_loss: 0.9982, test_loss: 1.1233, test_f1: 0.3261
 epoch: 76, train_loss: 0.9978, test_loss: 1.1193, test_f1: 0.3303
 epoch: 77, train_loss: 1.0044, test_loss: 1.1194, test_f1: 0.3324
 epoch: 78, train_loss: 0.9986, test_loss: 1.1066, test_f1: 0.3415
 epoch: 79, train_loss: 0.9933, test_loss: 1.1023, test_f1: 0.3468
 epoch: 80, train_loss: 0.9931, test_loss: 1.1021, test_f1: 0.3421
 epoch: 81, train_loss: 0.9922, test_loss: 1.1634, test_f1: 0.3198
 epoch: 82, train_loss: 0.9948, test_loss: 1.2608, test_f1: 0.3140
 epoch: 83, train_loss: 1.0045, test_loss: 1.3534, test_f1: 0.3021
 epoch: 84, train_loss: 1.0065, test_loss: 1.1235, test_f1: 0.3348
 epoch: 85, train_loss: 1.0019, test_loss: 1.1165, test_f1: 0.3414
 epoch: 86, train_loss: 0.9893, test_loss: 1.1577, test_f1: 0.3224
 epoch: 87, train_loss: 0.9916, test_loss: 1.1164, test_f1: 0.3337
 epoch: 88, train_loss: 0.9939, test_loss: 1.1739, test_f1: 0.3258
 epoch: 89, train_loss: 0.9993, test_loss: 1.1134, test_f1: 0.3359
 epoch: 90, train_loss: 0.9984, test_loss: 1.1121, test_f1: 0.3414
 epoch: 91, train_loss: 0.9943, test_loss: 1.1042, test_f1: 0.3461
 epoch: 92, train_loss: 1.0023, test_loss: 1.1336, test_f1: 0.3395
 epoch: 93, train_loss: 1.0009, test_loss: 1.1137, test_f1: 0.3421
 epoch: 94, train_loss: 0.9946, test_loss: 1.1142, test_f1: 0.3461
 epoch: 95, train_loss: 1.0003, test_loss: 1.1193, test_f1: 0.3414
 epoch: 96, train_loss: 0.9978, test_loss: 1.1062, test_f1: 0.3304
 epoch: 97, train_loss: 1.0091, test_loss: 1.1239, test_f1: 0.3395
 epoch: 98, train_loss: 1.0284, test_loss: 1.1159, test_f1: 0.3444
 epoch: 99, train_loss: 1.0226, test_loss: 1.5446, test_f1: 0.2762
##################ITERATION #2 ****************************************
 epoch: 0, train_loss: 1.3039, test_loss: 1.4026, test_f1: 0.2281
 epoch: 1, train_loss: 1.3098, test_loss: 1.3616, test_f1: 0.2281
 epoch: 2, train_loss: 1.2789, test_loss: 1.3225, test_f1: 0.2281
 epoch: 3, train_loss: 1.2599, test_loss: 1.3032, test_f1: 0.2281
 epoch: 4, train_loss: 1.2538, test_loss: 1.3000, test_f1: 0.2281
 epoch: 5, train_loss: 1.2540, test_loss: 1.3034, test_f1: 0.2281
 epoch: 6, train_loss: 1.2535, test_loss: 1.3061, test_f1: 0.2281
 epoch: 7, train_loss: 1.2553, test_loss: 1.3100, test_f1: 0.2281
 epoch: 8, train_loss: 1.2545, test_loss: 1.3068, test_f1: 0.2281
 epoch: 9, train_loss: 1.2529, test_loss: 1.3067, test_f1: 0.2281
 epoch: 10, train_loss: 1.2524, test_loss: 1.3048, test_f1: 0.2281
 epoch: 11, train_loss: 1.2530, test_loss: 1.3025, test_f1: 0.2281
 epoch: 12, train_loss: 1.2522, test_loss: 1.3053, test_f1: 0.2281
 epoch: 13, train_loss: 1.2523, test_loss: 1.3034, test_f1: 0.2281
 epoch: 14, train_loss: 1.2524, test_loss: 1.3023, test_f1: 0.2281
 epoch: 15, train_loss: 1.2521, test_loss: 1.3037, test_f1: 0.2281
 epoch: 16, train_loss: 1.2530, test_loss: 1.3092, test_f1: 0.2281
 epoch: 17, train_loss: 1.2536, test_loss: 1.3101, test_f1: 0.2281
 epoch: 18, train_loss: 1.2523, test_loss: 1.3053, test_f1: 0.2281
 epoch: 19, train_loss: 1.2549, test_loss: 1.3025, test_f1: 0.2281
 epoch: 20, train_loss: 1.2532, test_loss: 1.3048, test_f1: 0.2281
 epoch: 21, train_loss: 1.2523, test_loss: 1.3064, test_f1: 0.2281
 epoch: 22, train_loss: 1.2532, test_loss: 1.3054, test_f1: 0.2281
 epoch: 23, train_loss: 1.2527, test_loss: 1.3047, test_f1: 0.2281
 epoch: 24, train_loss: 1.2528, test_loss: 1.3038, test_f1: 0.2281
 epoch: 25, train_loss: 1.2527, test_loss: 1.3089, test_f1: 0.2281
 epoch: 26, train_loss: 1.2541, test_loss: 1.3070, test_f1: 0.2281
 epoch: 27, train_loss: 1.2526, test_loss: 1.3032, test_f1: 0.2281
 epoch: 28, train_loss: 1.2520, test_loss: 1.3036, test_f1: 0.2281
 epoch: 29, train_loss: 1.2528, test_loss: 1.3037, test_f1: 0.2281
 epoch: 30, train_loss: 1.2534, test_loss: 1.3040, test_f1: 0.2281
 epoch: 31, train_loss: 1.2527, test_loss: 1.3059, test_f1: 0.2281
 epoch: 32, train_loss: 1.2528, test_loss: 1.3062, test_f1: 0.2281
 epoch: 33, train_loss: 1.2531, test_loss: 1.3075, test_f1: 0.2281
 epoch: 34, train_loss: 1.2525, test_loss: 1.3063, test_f1: 0.2281
 epoch: 35, train_loss: 1.2525, test_loss: 1.3075, test_f1: 0.2281
 epoch: 36, train_loss: 1.2530, test_loss: 1.3027, test_f1: 0.2281
 epoch: 37, train_loss: 1.2521, test_loss: 1.3035, test_f1: 0.2281
 epoch: 38, train_loss: 1.2530, test_loss: 1.3075, test_f1: 0.2281
 epoch: 39, train_loss: 1.2529, test_loss: 1.3085, test_f1: 0.2281
 epoch: 40, train_loss: 1.2524, test_loss: 1.3035, test_f1: 0.2281
 epoch: 41, train_loss: 1.2525, test_loss: 1.3021, test_f1: 0.2281
 epoch: 42, train_loss: 1.2537, test_loss: 1.3074, test_f1: 0.2281
 epoch: 43, train_loss: 1.2524, test_loss: 1.3059, test_f1: 0.2281
 epoch: 44, train_loss: 1.2534, test_loss: 1.3046, test_f1: 0.2281
 epoch: 45, train_loss: 1.2524, test_loss: 1.3051, test_f1: 0.2281
 epoch: 46, train_loss: 1.2553, test_loss: 1.3086, test_f1: 0.2281
 epoch: 47, train_loss: 1.2524, test_loss: 1.3070, test_f1: 0.2281
 epoch: 48, train_loss: 1.2533, test_loss: 1.3106, test_f1: 0.2281
 epoch: 49, train_loss: 1.2531, test_loss: 1.3063, test_f1: 0.2281
 epoch: 50, train_loss: 1.2522, test_loss: 1.3009, test_f1: 0.2281
 epoch: 51, train_loss: 1.2533, test_loss: 1.3017, test_f1: 0.2281
 epoch: 52, train_loss: 1.2530, test_loss: 1.3019, test_f1: 0.2281
 epoch: 53, train_loss: 1.2528, test_loss: 1.3016, test_f1: 0.2281
 epoch: 54, train_loss: 1.2524, test_loss: 1.3034, test_f1: 0.2281
 epoch: 55, train_loss: 1.2523, test_loss: 1.3035, test_f1: 0.2281
 epoch: 56, train_loss: 1.2521, test_loss: 1.3048, test_f1: 0.2281
 epoch: 57, train_loss: 1.2521, test_loss: 1.3040, test_f1: 0.2281
 epoch: 58, train_loss: 1.2523, test_loss: 1.3034, test_f1: 0.2281
 epoch: 59, train_loss: 1.2530, test_loss: 1.3052, test_f1: 0.2281
 epoch: 60, train_loss: 1.2541, test_loss: 1.3069, test_f1: 0.2281
 epoch: 61, train_loss: 1.2526, test_loss: 1.3036, test_f1: 0.2281
 epoch: 62, train_loss: 1.2527, test_loss: 1.3015, test_f1: 0.2281
 epoch: 63, train_loss: 1.2539, test_loss: 1.2997, test_f1: 0.2281
 epoch: 64, train_loss: 1.2544, test_loss: 1.3000, test_f1: 0.2281
 epoch: 65, train_loss: 1.2521, test_loss: 1.3041, test_f1: 0.2281
 epoch: 66, train_loss: 1.2524, test_loss: 1.3077, test_f1: 0.2281
 epoch: 67, train_loss: 1.2525, test_loss: 1.3085, test_f1: 0.2281
 epoch: 68, train_loss: 1.2526, test_loss: 1.3094, test_f1: 0.2281
 epoch: 69, train_loss: 1.2525, test_loss: 1.3083, test_f1: 0.2281
 epoch: 70, train_loss: 1.2524, test_loss: 1.3064, test_f1: 0.2281
 epoch: 71, train_loss: 1.2526, test_loss: 1.3053, test_f1: 0.2281
 epoch: 72, train_loss: 1.2527, test_loss: 1.3051, test_f1: 0.2281
 epoch: 73, train_loss: 1.2520, test_loss: 1.3051, test_f1: 0.2281
 epoch: 74, train_loss: 1.2522, test_loss: 1.3050, test_f1: 0.2281
 epoch: 75, train_loss: 1.2525, test_loss: 1.3069, test_f1: 0.2281
 epoch: 76, train_loss: 1.2523, test_loss: 1.3068, test_f1: 0.2281
 epoch: 77, train_loss: 1.2521, test_loss: 1.3044, test_f1: 0.2281
 epoch: 78, train_loss: 1.2527, test_loss: 1.3005, test_f1: 0.2281
 epoch: 79, train_loss: 1.2530, test_loss: 1.3008, test_f1: 0.2281
 epoch: 80, train_loss: 1.2528, test_loss: 1.3044, test_f1: 0.2281
 epoch: 81, train_loss: 1.2540, test_loss: 1.3060, test_f1: 0.2281
 epoch: 82, train_loss: 1.2525, test_loss: 1.3063, test_f1: 0.2281
 epoch: 83, train_loss: 1.2525, test_loss: 1.3070, test_f1: 0.2281
 epoch: 84, train_loss: 1.2526, test_loss: 1.3070, test_f1: 0.2281
 epoch: 85, train_loss: 1.2525, test_loss: 1.3064, test_f1: 0.2281
 epoch: 86, train_loss: 1.2519, test_loss: 1.3081, test_f1: 0.2281
 epoch: 87, train_loss: 1.2531, test_loss: 1.3092, test_f1: 0.2281
 epoch: 88, train_loss: 1.2525, test_loss: 1.3057, test_f1: 0.2281
 epoch: 89, train_loss: 1.2523, test_loss: 1.3031, test_f1: 0.2281
 epoch: 90, train_loss: 1.2524, test_loss: 1.3010, test_f1: 0.2281
 epoch: 91, train_loss: 1.2523, test_loss: 1.3024, test_f1: 0.2281
 epoch: 92, train_loss: 1.2523, test_loss: 1.3043, test_f1: 0.2281
 epoch: 93, train_loss: 1.2523, test_loss: 1.3043, test_f1: 0.2281
 epoch: 94, train_loss: 1.2523, test_loss: 1.3059, test_f1: 0.2281
 epoch: 95, train_loss: 1.2521, test_loss: 1.3044, test_f1: 0.2281
 epoch: 96, train_loss: 1.2521, test_loss: 1.3030, test_f1: 0.2281
 epoch: 97, train_loss: 1.2528, test_loss: 1.3001, test_f1: 0.2281
 epoch: 98, train_loss: 1.2530, test_loss: 1.2997, test_f1: 0.2281
 epoch: 99, train_loss: 1.2537, test_loss: 1.2993, test_f1: 0.2281
##################ITERATION #3 ****************************************
 epoch: 0, train_loss: 1.2603, test_loss: 1.3088, test_f1: 0.2281
 epoch: 1, train_loss: 1.2558, test_loss: 1.3195, test_f1: 0.2281
 epoch: 2, train_loss: 1.2563, test_loss: 1.3144, test_f1: 0.2281
 epoch: 3, train_loss: 1.2540, test_loss: 1.3065, test_f1: 0.2281
 epoch: 4, train_loss: 1.2533, test_loss: 1.3023, test_f1: 0.2281
 epoch: 5, train_loss: 1.2523, test_loss: 1.3052, test_f1: 0.2281
 epoch: 6, train_loss: 1.2522, test_loss: 1.3080, test_f1: 0.2281
 epoch: 7, train_loss: 1.2521, test_loss: 1.3072, test_f1: 0.2281
 epoch: 8, train_loss: 1.2531, test_loss: 1.3078, test_f1: 0.2281
 epoch: 9, train_loss: 1.2534, test_loss: 1.3034, test_f1: 0.2281
 epoch: 10, train_loss: 1.2528, test_loss: 1.3062, test_f1: 0.2281
 epoch: 11, train_loss: 1.2529, test_loss: 1.3091, test_f1: 0.2281
 epoch: 12, train_loss: 1.2537, test_loss: 1.3073, test_f1: 0.2281
 epoch: 13, train_loss: 1.2543, test_loss: 1.3059, test_f1: 0.2281
 epoch: 14, train_loss: 1.2523, test_loss: 1.3007, test_f1: 0.2281
 epoch: 15, train_loss: 1.2535, test_loss: 1.2992, test_f1: 0.2281
 epoch: 16, train_loss: 1.2530, test_loss: 1.3049, test_f1: 0.2281
 epoch: 17, train_loss: 1.2522, test_loss: 1.3054, test_f1: 0.2281
 epoch: 18, train_loss: 1.2527, test_loss: 1.3009, test_f1: 0.2281
 epoch: 19, train_loss: 1.2534, test_loss: 1.2999, test_f1: 0.2281
 epoch: 20, train_loss: 1.2545, test_loss: 1.3021, test_f1: 0.2281
 epoch: 21, train_loss: 1.2527, test_loss: 1.3069, test_f1: 0.2281
 epoch: 22, train_loss: 1.2539, test_loss: 1.3114, test_f1: 0.2281
 epoch: 23, train_loss: 1.2559, test_loss: 1.3147, test_f1: 0.1365
 epoch: 24, train_loss: 1.2548, test_loss: 1.3085, test_f1: 0.2281
 epoch: 25, train_loss: 1.2531, test_loss: 1.3101, test_f1: 0.2281
 epoch: 26, train_loss: 1.2528, test_loss: 1.3088, test_f1: 0.2281
 epoch: 27, train_loss: 1.2537, test_loss: 1.3033, test_f1: 0.2281
 epoch: 28, train_loss: 1.2526, test_loss: 1.3025, test_f1: 0.2281
 epoch: 29, train_loss: 1.2528, test_loss: 1.3045, test_f1: 0.2281
 epoch: 30, train_loss: 1.2525, test_loss: 1.3024, test_f1: 0.2281
 epoch: 31, train_loss: 1.2522, test_loss: 1.3016, test_f1: 0.2281
 epoch: 32, train_loss: 1.2532, test_loss: 1.3065, test_f1: 0.2281
 epoch: 33, train_loss: 1.2530, test_loss: 1.3080, test_f1: 0.2281
 epoch: 34, train_loss: 1.2527, test_loss: 1.3047, test_f1: 0.2281
 epoch: 35, train_loss: 1.2533, test_loss: 1.3041, test_f1: 0.2281
 epoch: 36, train_loss: 1.2535, test_loss: 1.3079, test_f1: 0.2281
 epoch: 37, train_loss: 1.2529, test_loss: 1.3095, test_f1: 0.2281
 epoch: 38, train_loss: 1.2527, test_loss: 1.3080, test_f1: 0.2281
 epoch: 39, train_loss: 1.2536, test_loss: 1.3049, test_f1: 0.2281
 epoch: 40, train_loss: 1.2527, test_loss: 1.3058, test_f1: 0.2281
 epoch: 41, train_loss: 1.2525, test_loss: 1.3059, test_f1: 0.2281
 epoch: 42, train_loss: 1.2532, test_loss: 1.3072, test_f1: 0.2281
 epoch: 43, train_loss: 1.2528, test_loss: 1.3026, test_f1: 0.2281
 epoch: 44, train_loss: 1.2539, test_loss: 1.3036, test_f1: 0.2281
 epoch: 45, train_loss: 1.2524, test_loss: 1.3041, test_f1: 0.2281
 epoch: 46, train_loss: 1.2525, test_loss: 1.3057, test_f1: 0.2281
 epoch: 47, train_loss: 1.2529, test_loss: 1.3042, test_f1: 0.2281
 epoch: 48, train_loss: 1.2522, test_loss: 1.3060, test_f1: 0.2281
 epoch: 49, train_loss: 1.2529, test_loss: 1.3091, test_f1: 0.2281
 epoch: 50, train_loss: 1.2529, test_loss: 1.3064, test_f1: 0.2281
 epoch: 51, train_loss: 1.2529, test_loss: 1.3055, test_f1: 0.2281
 epoch: 52, train_loss: 1.2527, test_loss: 1.3059, test_f1: 0.2281
 epoch: 53, train_loss: 1.2522, test_loss: 1.3043, test_f1: 0.2281
 epoch: 54, train_loss: 1.2524, test_loss: 1.3030, test_f1: 0.2281
 epoch: 55, train_loss: 1.2524, test_loss: 1.3019, test_f1: 0.2281
 epoch: 56, train_loss: 1.2525, test_loss: 1.3017, test_f1: 0.2281
 epoch: 57, train_loss: 1.2525, test_loss: 1.3014, test_f1: 0.2281
 epoch: 58, train_loss: 1.2529, test_loss: 1.3007, test_f1: 0.2281
 epoch: 59, train_loss: 1.2526, test_loss: 1.3024, test_f1: 0.2281
 epoch: 60, train_loss: 1.2521, test_loss: 1.3059, test_f1: 0.2281
 epoch: 61, train_loss: 1.2522, test_loss: 1.3084, test_f1: 0.2281
 epoch: 62, train_loss: 1.2525, test_loss: 1.3046, test_f1: 0.2281
 epoch: 63, train_loss: 1.2520, test_loss: 1.3022, test_f1: 0.2281
 epoch: 64, train_loss: 1.2523, test_loss: 1.3021, test_f1: 0.2281
 epoch: 65, train_loss: 1.2523, test_loss: 1.3012, test_f1: 0.2281
 epoch: 66, train_loss: 1.2530, test_loss: 1.2998, test_f1: 0.2281
 epoch: 67, train_loss: 1.2527, test_loss: 1.3020, test_f1: 0.2281
 epoch: 68, train_loss: 1.2527, test_loss: 1.3053, test_f1: 0.2281
 epoch: 69, train_loss: 1.2526, test_loss: 1.3065, test_f1: 0.2281
 epoch: 70, train_loss: 1.2527, test_loss: 1.3061, test_f1: 0.2281
 epoch: 71, train_loss: 1.2524, test_loss: 1.3053, test_f1: 0.2281
 epoch: 72, train_loss: 1.2522, test_loss: 1.3049, test_f1: 0.2281
 epoch: 73, train_loss: 1.2522, test_loss: 1.3034, test_f1: 0.2281
 epoch: 74, train_loss: 1.2527, test_loss: 1.3008, test_f1: 0.2281
 epoch: 75, train_loss: 1.2527, test_loss: 1.3032, test_f1: 0.2281
 epoch: 76, train_loss: 1.2533, test_loss: 1.3056, test_f1: 0.2281
 epoch: 77, train_loss: 1.2529, test_loss: 1.3051, test_f1: 0.2281
 epoch: 78, train_loss: 1.2519, test_loss: 1.3048, test_f1: 0.2281
 epoch: 79, train_loss: 1.2521, test_loss: 1.3042, test_f1: 0.2281
 epoch: 80, train_loss: 1.2522, test_loss: 1.3041, test_f1: 0.2281
 epoch: 81, train_loss: 1.2522, test_loss: 1.3032, test_f1: 0.2281
 epoch: 82, train_loss: 1.2522, test_loss: 1.3031, test_f1: 0.2281
 epoch: 83, train_loss: 1.2525, test_loss: 1.3050, test_f1: 0.2281
 epoch: 84, train_loss: 1.2522, test_loss: 1.3058, test_f1: 0.2281
 epoch: 85, train_loss: 1.2526, test_loss: 1.3059, test_f1: 0.2281
 epoch: 86, train_loss: 1.2527, test_loss: 1.3027, test_f1: 0.2281
 epoch: 87, train_loss: 1.2524, test_loss: 1.3028, test_f1: 0.2281
 epoch: 88, train_loss: 1.2526, test_loss: 1.3041, test_f1: 0.2281
 epoch: 89, train_loss: 1.2528, test_loss: 1.3054, test_f1: 0.2281
 epoch: 90, train_loss: 1.2531, test_loss: 1.3063, test_f1: 0.2281
 epoch: 91, train_loss: 1.2529, test_loss: 1.3050, test_f1: 0.2281
 epoch: 92, train_loss: 1.2525, test_loss: 1.3026, test_f1: 0.2281
 epoch: 93, train_loss: 1.2529, test_loss: 1.3014, test_f1: 0.2281
 epoch: 94, train_loss: 1.2530, test_loss: 1.3035, test_f1: 0.2281
 epoch: 95, train_loss: 1.2527, test_loss: 1.3033, test_f1: 0.2281
 epoch: 96, train_loss: 1.2526, test_loss: 1.3036, test_f1: 0.2281
 epoch: 97, train_loss: 1.2523, test_loss: 1.3047, test_f1: 0.2281
 epoch: 98, train_loss: 1.2523, test_loss: 1.3033, test_f1: 0.2281
 epoch: 99, train_loss: 1.2518, test_loss: 1.3031, test_f1: 0.2281
##################ITERATION #4 ****************************************
 epoch: 0, train_loss: 1.2564, test_loss: 67.1161, test_f1: 0.2281
 epoch: 1, train_loss: 1.4527, test_loss: 1.3035, test_f1: 0.2281
 epoch: 2, train_loss: 1.2539, test_loss: 1.3027, test_f1: 0.2281
 epoch: 3, train_loss: 1.2521, test_loss: 1.3046, test_f1: 0.2281
 epoch: 4, train_loss: 1.2526, test_loss: 1.3035, test_f1: 0.2281
 epoch: 5, train_loss: 1.2531, test_loss: 1.3068, test_f1: 0.2281
 epoch: 6, train_loss: 1.2535, test_loss: 1.3050, test_f1: 0.2281
 epoch: 7, train_loss: 1.2539, test_loss: 1.3053, test_f1: 0.2281
 epoch: 8, train_loss: 1.2539, test_loss: 1.3125, test_f1: 0.2281
 epoch: 9, train_loss: 1.2541, test_loss: 1.3093, test_f1: 0.2281
 epoch: 10, train_loss: 1.2536, test_loss: 1.3039, test_f1: 0.2281
 epoch: 11, train_loss: 1.2524, test_loss: 1.3026, test_f1: 0.2281
 epoch: 12, train_loss: 1.2529, test_loss: 1.3029, test_f1: 0.2281
 epoch: 13, train_loss: 1.2530, test_loss: 1.3103, test_f1: 0.2281
 epoch: 14, train_loss: 1.2544, test_loss: 1.3060, test_f1: 0.2281
 epoch: 15, train_loss: 1.2532, test_loss: 1.3047, test_f1: 0.2281
 epoch: 16, train_loss: 1.2526, test_loss: 1.3090, test_f1: 0.2281
 epoch: 17, train_loss: 1.2539, test_loss: 1.3145, test_f1: 0.1365
 epoch: 18, train_loss: 1.2549, test_loss: 1.3078, test_f1: 0.2281
 epoch: 19, train_loss: 1.2525, test_loss: 1.3071, test_f1: 0.2281
 epoch: 20, train_loss: 1.2553, test_loss: 1.3062, test_f1: 0.2281
 epoch: 21, train_loss: 1.2522, test_loss: 1.3053, test_f1: 0.2281
 epoch: 22, train_loss: 1.2533, test_loss: 1.3082, test_f1: 0.2281
 epoch: 23, train_loss: 1.2530, test_loss: 1.3056, test_f1: 0.2281
 epoch: 24, train_loss: 1.2525, test_loss: 1.3034, test_f1: 0.2281
 epoch: 25, train_loss: 1.2528, test_loss: 1.3016, test_f1: 0.2281
 epoch: 26, train_loss: 1.2542, test_loss: 1.3050, test_f1: 0.2281
 epoch: 27, train_loss: 1.2520, test_loss: 1.3109, test_f1: 0.2281
 epoch: 28, train_loss: 1.2536, test_loss: 1.3101, test_f1: 0.2281
 epoch: 29, train_loss: 1.2538, test_loss: 1.3026, test_f1: 0.2281
 epoch: 30, train_loss: 1.2526, test_loss: 1.3023, test_f1: 0.2281
 epoch: 31, train_loss: 1.2569, test_loss: 1.3091, test_f1: 0.1365
 epoch: 32, train_loss: 1.2548, test_loss: 1.3101, test_f1: 0.2281
 epoch: 33, train_loss: 1.2529, test_loss: 1.3080, test_f1: 0.2281
 epoch: 34, train_loss: 1.2526, test_loss: 1.3087, test_f1: 0.2281
 epoch: 35, train_loss: 1.2541, test_loss: 1.3095, test_f1: 0.2281
 epoch: 36, train_loss: 1.2541, test_loss: 1.3031, test_f1: 0.2281
 epoch: 37, train_loss: 1.2523, test_loss: 1.3069, test_f1: 0.2281
 epoch: 38, train_loss: 1.2528, test_loss: 1.3045, test_f1: 0.2281
 epoch: 39, train_loss: 1.2520, test_loss: 1.3032, test_f1: 0.2281
 epoch: 40, train_loss: 1.2527, test_loss: 1.3091, test_f1: 0.2281
 epoch: 41, train_loss: 1.2534, test_loss: 1.3073, test_f1: 0.2281
 epoch: 42, train_loss: 1.2531, test_loss: 1.3039, test_f1: 0.2281
 epoch: 43, train_loss: 1.2528, test_loss: 1.3028, test_f1: 0.2281
 epoch: 44, train_loss: 1.2534, test_loss: 1.3073, test_f1: 0.2281
 epoch: 45, train_loss: 1.2526, test_loss: 1.3069, test_f1: 0.2281
 epoch: 46, train_loss: 1.2520, test_loss: 1.3050, test_f1: 0.2281
 epoch: 47, train_loss: 1.2531, test_loss: 1.3042, test_f1: 0.2281
 epoch: 48, train_loss: 1.2533, test_loss: 1.3036, test_f1: 0.2281
 epoch: 49, train_loss: 1.2551, test_loss: 1.3061, test_f1: 0.2281
 epoch: 50, train_loss: 1.2535, test_loss: 1.3040, test_f1: 0.2281
 epoch: 51, train_loss: 1.2523, test_loss: 1.3044, test_f1: 0.2281
 epoch: 52, train_loss: 1.2523, test_loss: 1.3056, test_f1: 0.2281
 epoch: 53, train_loss: 1.2523, test_loss: 1.3079, test_f1: 0.2281
 epoch: 54, train_loss: 1.2524, test_loss: 1.3102, test_f1: 0.2281
 epoch: 55, train_loss: 1.2529, test_loss: 1.3071, test_f1: 0.2281
 epoch: 56, train_loss: 1.2525, test_loss: 1.3060, test_f1: 0.2281
 epoch: 57, train_loss: 1.2525, test_loss: 1.3055, test_f1: 0.2281
 epoch: 58, train_loss: 1.2523, test_loss: 1.3044, test_f1: 0.2281
 epoch: 59, train_loss: 1.2524, test_loss: 1.3033, test_f1: 0.2281
 epoch: 60, train_loss: 1.2525, test_loss: 1.3018, test_f1: 0.2281
 epoch: 61, train_loss: 1.2524, test_loss: 1.3027, test_f1: 0.2281
 epoch: 62, train_loss: 1.2525, test_loss: 1.3044, test_f1: 0.2281
 epoch: 63, train_loss: 1.2520, test_loss: 1.3068, test_f1: 0.2281
 epoch: 64, train_loss: 1.2520, test_loss: 1.3080, test_f1: 0.2281
 epoch: 65, train_loss: 1.2528, test_loss: 1.3087, test_f1: 0.2281
 epoch: 66, train_loss: 1.2523, test_loss: 1.3039, test_f1: 0.2281
 epoch: 67, train_loss: 1.2521, test_loss: 1.2999, test_f1: 0.2281
 epoch: 68, train_loss: 1.2533, test_loss: 1.2999, test_f1: 0.2281
 epoch: 69, train_loss: 1.2533, test_loss: 1.3022, test_f1: 0.2281
 epoch: 70, train_loss: 1.2521, test_loss: 1.3049, test_f1: 0.2281
 epoch: 71, train_loss: 1.2522, test_loss: 1.3060, test_f1: 0.2281
 epoch: 72, train_loss: 1.2520, test_loss: 1.3048, test_f1: 0.2281
 epoch: 73, train_loss: 1.2523, test_loss: 1.3059, test_f1: 0.2281
 epoch: 74, train_loss: 1.2522, test_loss: 1.3051, test_f1: 0.2281
 epoch: 75, train_loss: 1.2524, test_loss: 1.3070, test_f1: 0.2281
 epoch: 76, train_loss: 1.2524, test_loss: 1.3075, test_f1: 0.2281
 epoch: 77, train_loss: 1.2526, test_loss: 1.3039, test_f1: 0.2281
 epoch: 78, train_loss: 1.2527, test_loss: 1.3012, test_f1: 0.2281
 epoch: 79, train_loss: 1.2532, test_loss: 1.3011, test_f1: 0.2281
 epoch: 80, train_loss: 1.2527, test_loss: 1.3050, test_f1: 0.2281
 epoch: 81, train_loss: 1.2527, test_loss: 1.3067, test_f1: 0.2281
 epoch: 82, train_loss: 1.2530, test_loss: 1.3039, test_f1: 0.2281
 epoch: 83, train_loss: 1.2521, test_loss: 1.3037, test_f1: 0.2281
 epoch: 84, train_loss: 1.2522, test_loss: 1.3027, test_f1: 0.2281
 epoch: 85, train_loss: 1.2524, test_loss: 1.3023, test_f1: 0.2281
 epoch: 86, train_loss: 1.2524, test_loss: 1.3036, test_f1: 0.2281
 epoch: 87, train_loss: 1.2522, test_loss: 1.3054, test_f1: 0.2281
 epoch: 88, train_loss: 1.2523, test_loss: 1.3042, test_f1: 0.2281
 epoch: 89, train_loss: 1.2523, test_loss: 1.3032, test_f1: 0.2281
 epoch: 90, train_loss: 1.2524, test_loss: 1.3024, test_f1: 0.2281
 epoch: 91, train_loss: 1.2524, test_loss: 1.3037, test_f1: 0.2281
 epoch: 92, train_loss: 1.2521, test_loss: 1.3035, test_f1: 0.2281
 epoch: 93, train_loss: 1.2523, test_loss: 1.3037, test_f1: 0.2281
 epoch: 94, train_loss: 1.2526, test_loss: 1.3060, test_f1: 0.2281
 epoch: 95, train_loss: 1.2530, test_loss: 1.3086, test_f1: 0.2281
 epoch: 96, train_loss: 1.2529, test_loss: 1.3077, test_f1: 0.2281
 epoch: 97, train_loss: 1.2526, test_loss: 1.3083, test_f1: 0.2281
 epoch: 98, train_loss: 1.2525, test_loss: 1.3063, test_f1: 0.2281
 epoch: 99, train_loss: 1.2527, test_loss: 1.3054, test_f1: 0.2281
##################ITERATION #5 ****************************************
 epoch: 0, train_loss: 1.2546, test_loss: 1.3129, test_f1: 0.1365
 epoch: 1, train_loss: 1.2553, test_loss: 1.3142, test_f1: 0.2281
 epoch: 2, train_loss: 1.2534, test_loss: 1.3089, test_f1: 0.2281
 epoch: 3, train_loss: 1.2551, test_loss: 1.3056, test_f1: 0.2281
 epoch: 4, train_loss: 1.2537, test_loss: 1.3048, test_f1: 0.2281
 epoch: 5, train_loss: 1.2521, test_loss: 1.3029, test_f1: 0.2281
 epoch: 6, train_loss: 1.2533, test_loss: 1.3008, test_f1: 0.2281
 epoch: 7, train_loss: 1.2538, test_loss: 1.3015, test_f1: 0.2281
 epoch: 8, train_loss: 1.2536, test_loss: 1.3070, test_f1: 0.2281
 epoch: 9, train_loss: 1.2528, test_loss: 1.3091, test_f1: 0.2281
 epoch: 10, train_loss: 1.2534, test_loss: 1.3108, test_f1: 0.2281
 epoch: 11, train_loss: 1.2530, test_loss: 1.3054, test_f1: 0.2281
 epoch: 12, train_loss: 1.2525, test_loss: 1.3055, test_f1: 0.2281
 epoch: 13, train_loss: 1.2531, test_loss: 1.3013, test_f1: 0.2281
 epoch: 14, train_loss: 1.2528, test_loss: 1.3040, test_f1: 0.2281
 epoch: 15, train_loss: 1.2531, test_loss: 1.3143, test_f1: 0.2281
 epoch: 16, train_loss: 1.2553, test_loss: 1.3131, test_f1: 0.2281
 epoch: 17, train_loss: 1.2525, test_loss: 1.3055, test_f1: 0.2281
 epoch: 18, train_loss: 1.2522, test_loss: 1.3046, test_f1: 0.2281
 epoch: 19, train_loss: 1.2523, test_loss: 1.3047, test_f1: 0.2281
 epoch: 20, train_loss: 1.2522, test_loss: 1.3024, test_f1: 0.2281
 epoch: 21, train_loss: 1.2531, test_loss: 1.3015, test_f1: 0.2281
 epoch: 22, train_loss: 1.2528, test_loss: 1.3015, test_f1: 0.2281
 epoch: 23, train_loss: 1.2528, test_loss: 1.3031, test_f1: 0.2281
 epoch: 24, train_loss: 1.2530, test_loss: 1.3052, test_f1: 0.2281
 epoch: 25, train_loss: 1.2519, test_loss: 1.3057, test_f1: 0.2281
 epoch: 26, train_loss: 1.2541, test_loss: 1.3050, test_f1: 0.2281
 epoch: 27, train_loss: 1.2524, test_loss: 1.3058, test_f1: 0.2281
 epoch: 28, train_loss: 1.2534, test_loss: 1.3078, test_f1: 0.2281
 epoch: 29, train_loss: 1.2526, test_loss: 1.3061, test_f1: 0.2281
 epoch: 30, train_loss: 1.2526, test_loss: 1.3108, test_f1: 0.2281
 epoch: 31, train_loss: 1.2547, test_loss: 1.3095, test_f1: 0.2281
 epoch: 32, train_loss: 1.2528, test_loss: 1.3049, test_f1: 0.2281
 epoch: 33, train_loss: 1.2519, test_loss: 1.3036, test_f1: 0.2281
 epoch: 34, train_loss: 1.2525, test_loss: 1.3034, test_f1: 0.2281
 epoch: 35, train_loss: 1.2533, test_loss: 1.3069, test_f1: 0.2281
 epoch: 36, train_loss: 1.2531, test_loss: 1.3051, test_f1: 0.2281
 epoch: 37, train_loss: 1.2528, test_loss: 1.3050, test_f1: 0.2281
 epoch: 38, train_loss: 1.2528, test_loss: 1.3041, test_f1: 0.2281
 epoch: 39, train_loss: 1.2546, test_loss: 1.3126, test_f1: 0.2281
 epoch: 40, train_loss: 1.2528, test_loss: 1.3050, test_f1: 0.2281
 epoch: 41, train_loss: 1.2533, test_loss: 1.3015, test_f1: 0.2281
 epoch: 42, train_loss: 1.2520, test_loss: 1.3101, test_f1: 0.2281
 epoch: 43, train_loss: 1.2534, test_loss: 1.3173, test_f1: 0.2281
 epoch: 44, train_loss: 1.2546, test_loss: 1.3099, test_f1: 0.2281
 epoch: 45, train_loss: 1.2531, test_loss: 1.3025, test_f1: 0.2281
 epoch: 46, train_loss: 1.2532, test_loss: 1.3027, test_f1: 0.2281
 epoch: 47, train_loss: 1.2540, test_loss: 1.3033, test_f1: 0.2281
 epoch: 48, train_loss: 1.2544, test_loss: 1.3068, test_f1: 0.2281
 epoch: 49, train_loss: 1.2519, test_loss: 1.3078, test_f1: 0.2281
 epoch: 50, train_loss: 1.2537, test_loss: 1.3142, test_f1: 0.2281
 epoch: 51, train_loss: 1.2544, test_loss: 1.3124, test_f1: 0.2281
 epoch: 52, train_loss: 1.2534, test_loss: 1.3098, test_f1: 0.2281
 epoch: 53, train_loss: 1.2525, test_loss: 1.3063, test_f1: 0.2281
 epoch: 54, train_loss: 1.2520, test_loss: 1.3031, test_f1: 0.2281
 epoch: 55, train_loss: 1.2521, test_loss: 1.3038, test_f1: 0.2281
 epoch: 56, train_loss: 1.2524, test_loss: 1.3040, test_f1: 0.2281
 epoch: 57, train_loss: 1.2522, test_loss: 1.3083, test_f1: 0.2281
 epoch: 58, train_loss: 1.2530, test_loss: 1.3107, test_f1: 0.2281
 epoch: 59, train_loss: 1.2534, test_loss: 1.3096, test_f1: 0.2281
 epoch: 60, train_loss: 1.2526, test_loss: 1.3071, test_f1: 0.2281
 epoch: 61, train_loss: 1.2522, test_loss: 1.3059, test_f1: 0.2281
 epoch: 62, train_loss: 1.2522, test_loss: 1.3053, test_f1: 0.2281
 epoch: 63, train_loss: 1.2523, test_loss: 1.3053, test_f1: 0.2281
 epoch: 64, train_loss: 1.2523, test_loss: 1.3066, test_f1: 0.2281
 epoch: 65, train_loss: 1.2522, test_loss: 1.3062, test_f1: 0.2281
 epoch: 66, train_loss: 1.2521, test_loss: 1.3053, test_f1: 0.2281
 epoch: 67, train_loss: 1.2521, test_loss: 1.3034, test_f1: 0.2281
 epoch: 68, train_loss: 1.2524, test_loss: 1.3024, test_f1: 0.2281
 epoch: 69, train_loss: 1.2528, test_loss: 1.3033, test_f1: 0.2281
 epoch: 70, train_loss: 1.2525, test_loss: 1.3059, test_f1: 0.2281
 epoch: 71, train_loss: 1.2524, test_loss: 1.3085, test_f1: 0.2281
 epoch: 72, train_loss: 1.2528, test_loss: 1.3070, test_f1: 0.2281
 epoch: 73, train_loss: 1.2529, test_loss: 1.3087, test_f1: 0.2281
 epoch: 74, train_loss: 1.2532, test_loss: 1.3041, test_f1: 0.2281
 epoch: 75, train_loss: 1.2526, test_loss: 1.3021, test_f1: 0.2281
 epoch: 76, train_loss: 1.2530, test_loss: 1.3025, test_f1: 0.2281
 epoch: 77, train_loss: 1.2528, test_loss: 1.3048, test_f1: 0.2281
 epoch: 78, train_loss: 1.2522, test_loss: 1.3075, test_f1: 0.2281
 epoch: 79, train_loss: 1.2527, test_loss: 1.3086, test_f1: 0.2281
 epoch: 80, train_loss: 1.2526, test_loss: 1.3081, test_f1: 0.2281
 epoch: 81, train_loss: 1.2525, test_loss: 1.3075, test_f1: 0.2281
 epoch: 82, train_loss: 1.2524, test_loss: 1.3045, test_f1: 0.2281
 epoch: 83, train_loss: 1.2522, test_loss: 1.3059, test_f1: 0.2281
 epoch: 84, train_loss: 1.2530, test_loss: 1.3093, test_f1: 0.2281
 epoch: 85, train_loss: 1.2525, test_loss: 1.3061, test_f1: 0.2281
 epoch: 86, train_loss: 1.2521, test_loss: 1.3052, test_f1: 0.2281
 epoch: 87, train_loss: 1.2527, test_loss: 1.3071, test_f1: 0.2281
 epoch: 88, train_loss: 1.2532, test_loss: 1.3092, test_f1: 0.2281
 epoch: 89, train_loss: 1.2530, test_loss: 1.3058, test_f1: 0.2281
 epoch: 90, train_loss: 1.2522, test_loss: 1.3041, test_f1: 0.2281
 epoch: 91, train_loss: 1.2522, test_loss: 1.3033, test_f1: 0.2281
 epoch: 92, train_loss: 1.2529, test_loss: 1.3048, test_f1: 0.2281
 epoch: 93, train_loss: 1.2527, test_loss: 1.3058, test_f1: 0.2281
 epoch: 94, train_loss: 1.2521, test_loss: 1.3054, test_f1: 0.2281
 epoch: 95, train_loss: 1.2524, test_loss: 1.3046, test_f1: 0.2281
 epoch: 96, train_loss: 1.2526, test_loss: 1.3041, test_f1: 0.2281
 epoch: 97, train_loss: 1.2525, test_loss: 1.3053, test_f1: 0.2281
 epoch: 98, train_loss: 1.2523, test_loss: 1.3051, test_f1: 0.2281
 epoch: 99, train_loss: 1.2520, test_loss: 1.3044, test_f1: 0.2281
##################ITERATION #6 ****************************************
 epoch: 0, train_loss: 1.2563, test_loss: 1.3014, test_f1: 0.2281
 epoch: 1, train_loss: 1.2532, test_loss: 1.3035, test_f1: 0.2281
 epoch: 2, train_loss: 1.2534, test_loss: 1.3063, test_f1: 0.2281
 epoch: 3, train_loss: 1.2543, test_loss: 1.3055, test_f1: 0.2281
 epoch: 4, train_loss: 1.2529, test_loss: 1.3052, test_f1: 0.2281
 epoch: 5, train_loss: 1.2524, test_loss: 1.3040, test_f1: 0.2281
 epoch: 6, train_loss: 1.2526, test_loss: 1.3017, test_f1: 0.2281
 epoch: 7, train_loss: 1.2525, test_loss: 1.3026, test_f1: 0.2281
 epoch: 8, train_loss: 1.2524, test_loss: 1.3058, test_f1: 0.2281
 epoch: 9, train_loss: 1.2529, test_loss: 1.3039, test_f1: 0.2281
 epoch: 10, train_loss: 1.2522, test_loss: 1.3043, test_f1: 0.2281
 epoch: 11, train_loss: 1.2531, test_loss: 1.3033, test_f1: 0.2281
 epoch: 12, train_loss: 1.2535, test_loss: 1.3057, test_f1: 0.2281
 epoch: 13, train_loss: 1.2525, test_loss: 1.3075, test_f1: 0.2281
 epoch: 14, train_loss: 1.2538, test_loss: 1.3057, test_f1: 0.2281
 epoch: 15, train_loss: 1.2532, test_loss: 1.3061, test_f1: 0.2281
 epoch: 16, train_loss: 1.2527, test_loss: 1.3076, test_f1: 0.2281
 epoch: 17, train_loss: 1.2535, test_loss: 1.3041, test_f1: 0.2281
 epoch: 18, train_loss: 1.2523, test_loss: 1.3033, test_f1: 0.2281
 epoch: 19, train_loss: 1.2533, test_loss: 1.3059, test_f1: 0.2281
 epoch: 20, train_loss: 1.2526, test_loss: 1.3054, test_f1: 0.2281
 epoch: 21, train_loss: 1.2542, test_loss: 1.3099, test_f1: 0.2281
 epoch: 22, train_loss: 1.2542, test_loss: 1.3073, test_f1: 0.2281
 epoch: 23, train_loss: 1.2531, test_loss: 1.3105, test_f1: 0.2281
 epoch: 24, train_loss: 1.2534, test_loss: 1.3053, test_f1: 0.2281
 epoch: 25, train_loss: 1.2537, test_loss: 1.3044, test_f1: 0.2281
 epoch: 26, train_loss: 1.2532, test_loss: 1.3020, test_f1: 0.2281
 epoch: 27, train_loss: 1.2524, test_loss: 1.3025, test_f1: 0.2281
 epoch: 28, train_loss: 1.2532, test_loss: 1.3022, test_f1: 0.2281
 epoch: 29, train_loss: 1.2530, test_loss: 1.3083, test_f1: 0.2281
 epoch: 30, train_loss: 1.2549, test_loss: 1.3136, test_f1: 0.2281
 epoch: 31, train_loss: 1.2543, test_loss: 1.3086, test_f1: 0.2281
 epoch: 32, train_loss: 1.2559, test_loss: 1.3042, test_f1: 0.2281
 epoch: 33, train_loss: 1.2545, test_loss: 1.3034, test_f1: 0.2281
 epoch: 34, train_loss: 1.2523, test_loss: 1.3088, test_f1: 0.2281
 epoch: 35, train_loss: 1.2529, test_loss: 1.3081, test_f1: 0.2281
 epoch: 36, train_loss: 1.2528, test_loss: 1.3041, test_f1: 0.2281
 epoch: 37, train_loss: 1.2523, test_loss: 1.3028, test_f1: 0.2281
 epoch: 38, train_loss: 1.2531, test_loss: 1.3049, test_f1: 0.2281
 epoch: 39, train_loss: 1.2525, test_loss: 1.3051, test_f1: 0.2281
 epoch: 40, train_loss: 1.2522, test_loss: 1.3057, test_f1: 0.2281
 epoch: 41, train_loss: 1.2547, test_loss: 1.3031, test_f1: 0.2281
 epoch: 42, train_loss: 1.2532, test_loss: 1.3060, test_f1: 0.2281
 epoch: 43, train_loss: 1.2523, test_loss: 1.3088, test_f1: 0.2281
 epoch: 44, train_loss: 1.2526, test_loss: 1.3082, test_f1: 0.2281
 epoch: 45, train_loss: 1.2526, test_loss: 1.3116, test_f1: 0.2281
 epoch: 46, train_loss: 1.2549, test_loss: 1.3130, test_f1: 0.2281
 epoch: 47, train_loss: 1.2554, test_loss: 1.3091, test_f1: 0.2281
 epoch: 48, train_loss: 1.2530, test_loss: 1.3023, test_f1: 0.2281
 epoch: 49, train_loss: 1.2528, test_loss: 1.3035, test_f1: 0.2281
 epoch: 50, train_loss: 1.2525, test_loss: 1.3060, test_f1: 0.2281
 epoch: 51, train_loss: 1.2527, test_loss: 1.3057, test_f1: 0.2281
 epoch: 52, train_loss: 1.2527, test_loss: 1.3036, test_f1: 0.2281
 epoch: 53, train_loss: 1.2527, test_loss: 1.3045, test_f1: 0.2281
 epoch: 54, train_loss: 1.2522, test_loss: 1.3028, test_f1: 0.2281
 epoch: 55, train_loss: 1.2528, test_loss: 1.3017, test_f1: 0.2281
 epoch: 56, train_loss: 1.2533, test_loss: 1.3029, test_f1: 0.2281
 epoch: 57, train_loss: 1.2546, test_loss: 1.3044, test_f1: 0.2281
 epoch: 58, train_loss: 1.2544, test_loss: 1.3047, test_f1: 0.2281
 epoch: 59, train_loss: 1.2523, test_loss: 1.3077, test_f1: 0.2281
 epoch: 60, train_loss: 1.2523, test_loss: 1.3082, test_f1: 0.2281
 epoch: 61, train_loss: 1.2525, test_loss: 1.3080, test_f1: 0.2281
 epoch: 62, train_loss: 1.2523, test_loss: 1.3070, test_f1: 0.2281
 epoch: 63, train_loss: 1.2522, test_loss: 1.3037, test_f1: 0.2281
 epoch: 64, train_loss: 1.2523, test_loss: 1.3024, test_f1: 0.2281
 epoch: 65, train_loss: 1.2525, test_loss: 1.3056, test_f1: 0.2281
 epoch: 66, train_loss: 1.2522, test_loss: 1.3078, test_f1: 0.2281
 epoch: 67, train_loss: 1.2528, test_loss: 1.3093, test_f1: 0.2281
 epoch: 68, train_loss: 1.2531, test_loss: 1.3089, test_f1: 0.2281
 epoch: 69, train_loss: 1.2527, test_loss: 1.3077, test_f1: 0.2281
 epoch: 70, train_loss: 1.2535, test_loss: 1.3086, test_f1: 0.2281
 epoch: 71, train_loss: 1.2529, test_loss: 1.3067, test_f1: 0.2281
 epoch: 72, train_loss: 1.2522, test_loss: 1.3055, test_f1: 0.2281
 epoch: 73, train_loss: 1.2525, test_loss: 1.3064, test_f1: 0.2281
 epoch: 74, train_loss: 1.2524, test_loss: 1.3063, test_f1: 0.2281
 epoch: 75, train_loss: 1.2522, test_loss: 1.3064, test_f1: 0.2281
 epoch: 76, train_loss: 1.2522, test_loss: 1.3080, test_f1: 0.2281
 epoch: 77, train_loss: 1.2526, test_loss: 1.3096, test_f1: 0.2281
 epoch: 78, train_loss: 1.2528, test_loss: 1.3087, test_f1: 0.2281
 epoch: 79, train_loss: 1.2530, test_loss: 1.3079, test_f1: 0.2281
 epoch: 80, train_loss: 1.2523, test_loss: 1.3059, test_f1: 0.2281
 epoch: 81, train_loss: 1.2523, test_loss: 1.3050, test_f1: 0.2281
 epoch: 82, train_loss: 1.2522, test_loss: 1.3059, test_f1: 0.2281
 epoch: 83, train_loss: 1.2523, test_loss: 1.3040, test_f1: 0.2281
 epoch: 84, train_loss: 1.2522, test_loss: 1.3025, test_f1: 0.2281
 epoch: 85, train_loss: 1.2523, test_loss: 1.3037, test_f1: 0.2281
 epoch: 86, train_loss: 1.2525, test_loss: 1.3049, test_f1: 0.2281
 epoch: 87, train_loss: 1.2522, test_loss: 1.3075, test_f1: 0.2281
 epoch: 88, train_loss: 1.2524, test_loss: 1.3074, test_f1: 0.2281
 epoch: 89, train_loss: 1.2525, test_loss: 1.3087, test_f1: 0.2281
 epoch: 90, train_loss: 1.2530, test_loss: 1.3093, test_f1: 0.2281
 epoch: 91, train_loss: 1.2527, test_loss: 1.3059, test_f1: 0.2281
 epoch: 92, train_loss: 1.2522, test_loss: 1.3021, test_f1: 0.2281
 epoch: 93, train_loss: 1.2527, test_loss: 1.3026, test_f1: 0.2281
 epoch: 94, train_loss: 1.2524, test_loss: 1.3022, test_f1: 0.2281
 epoch: 95, train_loss: 1.2528, test_loss: 1.3022, test_f1: 0.2281
 epoch: 96, train_loss: 1.2524, test_loss: 1.3033, test_f1: 0.2281
 epoch: 97, train_loss: 1.2520, test_loss: 1.3074, test_f1: 0.2281
 epoch: 98, train_loss: 1.2524, test_loss: 1.3077, test_f1: 0.2281
 epoch: 99, train_loss: 1.2525, test_loss: 1.3060, test_f1: 0.2281
##################ITERATION #7 ****************************************
 epoch: 0, train_loss: 1.2537, test_loss: 1.3155, test_f1: 0.2281
 epoch: 1, train_loss: 1.2565, test_loss: 1.3167, test_f1: 0.2281
 epoch: 2, train_loss: 1.2539, test_loss: 1.3070, test_f1: 0.2281
 epoch: 3, train_loss: 1.2553, test_loss: 1.3019, test_f1: 0.2281
 epoch: 4, train_loss: 1.2532, test_loss: 1.3038, test_f1: 0.2281
 epoch: 5, train_loss: 1.2531, test_loss: 1.3022, test_f1: 0.2281
 epoch: 6, train_loss: 1.2531, test_loss: 1.3033, test_f1: 0.2281
 epoch: 7, train_loss: 1.2528, test_loss: 1.3017, test_f1: 0.2281
 epoch: 8, train_loss: 1.2530, test_loss: 1.3024, test_f1: 0.2281
 epoch: 9, train_loss: 1.2521, test_loss: 1.3033, test_f1: 0.2281
 epoch: 10, train_loss: 1.2531, test_loss: 1.3010, test_f1: 0.2281
 epoch: 11, train_loss: 1.2539, test_loss: 1.2995, test_f1: 0.2281
 epoch: 12, train_loss: 1.2537, test_loss: 1.3007, test_f1: 0.2281
 epoch: 13, train_loss: 1.2528, test_loss: 1.3060, test_f1: 0.2281
 epoch: 14, train_loss: 1.2522, test_loss: 1.3082, test_f1: 0.2281
 epoch: 15, train_loss: 1.2530, test_loss: 1.3064, test_f1: 0.2281
 epoch: 16, train_loss: 1.2526, test_loss: 1.3059, test_f1: 0.2281
 epoch: 17, train_loss: 1.2527, test_loss: 1.3064, test_f1: 0.2281
 epoch: 18, train_loss: 1.2537, test_loss: 1.3106, test_f1: 0.2281
 epoch: 19, train_loss: 1.2533, test_loss: 1.3076, test_f1: 0.2281
 epoch: 20, train_loss: 1.2533, test_loss: 1.3011, test_f1: 0.2281
 epoch: 21, train_loss: 1.2537, test_loss: 1.2991, test_f1: 0.2281
 epoch: 22, train_loss: 1.2533, test_loss: 1.3032, test_f1: 0.2281
 epoch: 23, train_loss: 1.2524, test_loss: 1.3071, test_f1: 0.2281
 epoch: 24, train_loss: 1.2531, test_loss: 1.3083, test_f1: 0.2281
 epoch: 25, train_loss: 1.2527, test_loss: 1.3062, test_f1: 0.2281
 epoch: 26, train_loss: 1.2533, test_loss: 1.3066, test_f1: 0.2281
 epoch: 27, train_loss: 1.2523, test_loss: 1.3027, test_f1: 0.2281
 epoch: 28, train_loss: 1.2531, test_loss: 1.3042, test_f1: 0.2281
 epoch: 29, train_loss: 1.2529, test_loss: 1.3051, test_f1: 0.2281
 epoch: 30, train_loss: 1.2522, test_loss: 1.3070, test_f1: 0.2281
 epoch: 31, train_loss: 1.2524, test_loss: 1.3091, test_f1: 0.2281
 epoch: 32, train_loss: 1.2533, test_loss: 1.3065, test_f1: 0.2281
 epoch: 33, train_loss: 1.2528, test_loss: 1.3053, test_f1: 0.2281
 epoch: 34, train_loss: 1.2530, test_loss: 1.3041, test_f1: 0.2281
 epoch: 35, train_loss: 1.2530, test_loss: 1.3077, test_f1: 0.2281
 epoch: 36, train_loss: 1.2524, test_loss: 1.3097, test_f1: 0.2281
 epoch: 37, train_loss: 1.2542, test_loss: 1.3045, test_f1: 0.2281
 epoch: 38, train_loss: 1.2536, test_loss: 1.3061, test_f1: 0.2281
 epoch: 39, train_loss: 1.2530, test_loss: 1.3022, test_f1: 0.2281
 epoch: 40, train_loss: 1.2539, test_loss: 1.3036, test_f1: 0.2281
 epoch: 41, train_loss: 1.2535, test_loss: 1.3026, test_f1: 0.2281
 epoch: 42, train_loss: 1.2523, test_loss: 1.3063, test_f1: 0.2281
 epoch: 43, train_loss: 1.2525, test_loss: 1.3083, test_f1: 0.2281
 epoch: 44, train_loss: 1.2527, test_loss: 1.3054, test_f1: 0.2281
 epoch: 45, train_loss: 1.2522, test_loss: 1.3037, test_f1: 0.2281
 epoch: 46, train_loss: 1.2522, test_loss: 1.3083, test_f1: 0.2281
 epoch: 47, train_loss: 1.2530, test_loss: 1.3083, test_f1: 0.2281
 epoch: 48, train_loss: 1.2527, test_loss: 1.3054, test_f1: 0.2281
 epoch: 49, train_loss: 1.2523, test_loss: 1.3069, test_f1: 0.2281
 epoch: 50, train_loss: 1.2527, test_loss: 1.3072, test_f1: 0.2281
 epoch: 51, train_loss: 1.2526, test_loss: 1.3080, test_f1: 0.2281
 epoch: 52, train_loss: 1.2525, test_loss: 1.3079, test_f1: 0.2281
 epoch: 53, train_loss: 1.2524, test_loss: 1.3057, test_f1: 0.2281
 epoch: 54, train_loss: 1.2527, test_loss: 1.3070, test_f1: 0.2281
 epoch: 55, train_loss: 1.2534, test_loss: 1.3067, test_f1: 0.2281
 epoch: 56, train_loss: 1.2520, test_loss: 1.3077, test_f1: 0.2281
 epoch: 57, train_loss: 1.2529, test_loss: 1.3077, test_f1: 0.2281
 epoch: 58, train_loss: 1.2533, test_loss: 1.3033, test_f1: 0.2281
 epoch: 59, train_loss: 1.2526, test_loss: 1.3025, test_f1: 0.2281
 epoch: 60, train_loss: 1.2522, test_loss: 1.3047, test_f1: 0.2281
 epoch: 61, train_loss: 1.2526, test_loss: 1.3065, test_f1: 0.2281
 epoch: 62, train_loss: 1.2528, test_loss: 1.3062, test_f1: 0.2281
 epoch: 63, train_loss: 1.2521, test_loss: 1.3059, test_f1: 0.2281
 epoch: 64, train_loss: 1.2527, test_loss: 1.3046, test_f1: 0.2281
 epoch: 65, train_loss: 1.2525, test_loss: 1.3041, test_f1: 0.2281
 epoch: 66, train_loss: 1.2525, test_loss: 1.3044, test_f1: 0.2281
 epoch: 67, train_loss: 1.2521, test_loss: 1.3047, test_f1: 0.2281
 epoch: 68, train_loss: 1.2520, test_loss: 1.3031, test_f1: 0.2281
 epoch: 69, train_loss: 1.2527, test_loss: 1.3027, test_f1: 0.2281
 epoch: 70, train_loss: 1.2522, test_loss: 1.3026, test_f1: 0.2281
 epoch: 71, train_loss: 1.2529, test_loss: 1.3036, test_f1: 0.2281
 epoch: 72, train_loss: 1.2533, test_loss: 1.3060, test_f1: 0.2281
 epoch: 73, train_loss: 1.2524, test_loss: 1.3071, test_f1: 0.2281
 epoch: 74, train_loss: 1.2520, test_loss: 1.3059, test_f1: 0.2281
 epoch: 75, train_loss: 1.2521, test_loss: 1.3036, test_f1: 0.2281
 epoch: 76, train_loss: 1.2522, test_loss: 1.3032, test_f1: 0.2281
 epoch: 77, train_loss: 1.2524, test_loss: 1.3045, test_f1: 0.2281
 epoch: 78, train_loss: 1.2522, test_loss: 1.3053, test_f1: 0.2281
 epoch: 79, train_loss: 1.2523, test_loss: 1.3076, test_f1: 0.2281
 epoch: 80, train_loss: 1.2524, test_loss: 1.3064, test_f1: 0.2281
 epoch: 81, train_loss: 1.2522, test_loss: 1.3060, test_f1: 0.2281
 epoch: 82, train_loss: 1.2521, test_loss: 1.3045, test_f1: 0.2281
 epoch: 83, train_loss: 1.2527, test_loss: 1.3040, test_f1: 0.2281
 epoch: 84, train_loss: 1.2523, test_loss: 1.3034, test_f1: 0.2281
 epoch: 85, train_loss: 1.2527, test_loss: 1.3057, test_f1: 0.2281
 epoch: 86, train_loss: 1.2530, test_loss: 1.3049, test_f1: 0.2281
 epoch: 87, train_loss: 1.2532, test_loss: 1.3057, test_f1: 0.2281
 epoch: 88, train_loss: 1.2524, test_loss: 1.3066, test_f1: 0.2281
 epoch: 89, train_loss: 1.2521, test_loss: 1.3053, test_f1: 0.2281
 epoch: 90, train_loss: 1.2529, test_loss: 1.3038, test_f1: 0.2281
 epoch: 91, train_loss: 1.2527, test_loss: 1.3083, test_f1: 0.2281
 epoch: 92, train_loss: 1.2533, test_loss: 1.3083, test_f1: 0.2281
 epoch: 93, train_loss: 1.2528, test_loss: 1.3068, test_f1: 0.2281
 epoch: 94, train_loss: 1.2524, test_loss: 1.3061, test_f1: 0.2281
 epoch: 95, train_loss: 1.2522, test_loss: 1.3030, test_f1: 0.2281
 epoch: 96, train_loss: 1.2522, test_loss: 1.3024, test_f1: 0.2281
 epoch: 97, train_loss: 1.2523, test_loss: 1.3042, test_f1: 0.2281
 epoch: 98, train_loss: 1.2523, test_loss: 1.3075, test_f1: 0.2281
 epoch: 99, train_loss: 1.2528, test_loss: 1.3090, test_f1: 0.2281
##################ITERATION #8 ****************************************
 epoch: 0, train_loss: 1.2584, test_loss: 1.3073, test_f1: 0.2281
 epoch: 1, train_loss: 1.2531, test_loss: 1.3043, test_f1: 0.2281
 epoch: 2, train_loss: 1.2522, test_loss: 1.3046, test_f1: 0.2281
 epoch: 3, train_loss: 1.2532, test_loss: 1.3066, test_f1: 0.2281
 epoch: 4, train_loss: 1.2526, test_loss: 1.3058, test_f1: 0.2281
 epoch: 5, train_loss: 1.2527, test_loss: 1.3046, test_f1: 0.2281
 epoch: 6, train_loss: 1.2523, test_loss: 1.3018, test_f1: 0.2281
 epoch: 7, train_loss: 1.2534, test_loss: 1.3006, test_f1: 0.2281
 epoch: 8, train_loss: 1.2537, test_loss: 1.2996, test_f1: 0.2281
 epoch: 9, train_loss: 1.2526, test_loss: 1.3051, test_f1: 0.2281
 epoch: 10, train_loss: 1.2520, test_loss: 1.3099, test_f1: 0.2281
 epoch: 11, train_loss: 1.2542, test_loss: 1.3113, test_f1: 0.2281
 epoch: 12, train_loss: 1.2531, test_loss: 1.3027, test_f1: 0.2281
 epoch: 13, train_loss: 1.2531, test_loss: 1.3011, test_f1: 0.2281
 epoch: 14, train_loss: 1.2523, test_loss: 1.3059, test_f1: 0.2281
 epoch: 15, train_loss: 1.2552, test_loss: 1.3100, test_f1: 0.2281
 epoch: 16, train_loss: 1.2532, test_loss: 1.3050, test_f1: 0.2281
 epoch: 17, train_loss: 1.2521, test_loss: 1.3004, test_f1: 0.2281
 epoch: 18, train_loss: 1.2536, test_loss: 1.3028, test_f1: 0.2281
 epoch: 19, train_loss: 1.2530, test_loss: 1.3075, test_f1: 0.2281
 epoch: 20, train_loss: 1.2528, test_loss: 1.3126, test_f1: 0.2281
 epoch: 21, train_loss: 1.2553, test_loss: 1.3150, test_f1: 0.2281
 epoch: 22, train_loss: 1.2538, test_loss: 1.3068, test_f1: 0.2281
 epoch: 23, train_loss: 1.2526, test_loss: 1.3031, test_f1: 0.2281
 epoch: 24, train_loss: 1.2533, test_loss: 1.3042, test_f1: 0.2281
 epoch: 25, train_loss: 1.2527, test_loss: 1.3031, test_f1: 0.2281
 epoch: 26, train_loss: 1.2526, test_loss: 1.3035, test_f1: 0.2281
 epoch: 27, train_loss: 1.2521, test_loss: 1.3067, test_f1: 0.2281
 epoch: 28, train_loss: 1.2526, test_loss: 1.3043, test_f1: 0.2281
 epoch: 29, train_loss: 1.2533, test_loss: 1.3003, test_f1: 0.2281
 epoch: 30, train_loss: 1.2542, test_loss: 1.3082, test_f1: 0.2281
 epoch: 31, train_loss: 1.2526, test_loss: 1.3098, test_f1: 0.2281
 epoch: 32, train_loss: 1.2536, test_loss: 1.3103, test_f1: 0.2281
 epoch: 33, train_loss: 1.2531, test_loss: 1.3042, test_f1: 0.2281
 epoch: 34, train_loss: 1.2529, test_loss: 1.3013, test_f1: 0.2281
 epoch: 35, train_loss: 1.2524, test_loss: 1.3038, test_f1: 0.2281
 epoch: 36, train_loss: 1.2529, test_loss: 1.3063, test_f1: 0.2281
 epoch: 37, train_loss: 1.2531, test_loss: 1.3076, test_f1: 0.2281
 epoch: 38, train_loss: 1.2523, test_loss: 1.3088, test_f1: 0.2281
 epoch: 39, train_loss: 1.2528, test_loss: 1.3052, test_f1: 0.2281
 epoch: 40, train_loss: 1.2521, test_loss: 1.3032, test_f1: 0.2281
 epoch: 41, train_loss: 1.2526, test_loss: 1.3047, test_f1: 0.2281
 epoch: 42, train_loss: 1.2537, test_loss: 1.3059, test_f1: 0.2281
 epoch: 43, train_loss: 1.2539, test_loss: 1.3154, test_f1: 0.1365
 epoch: 44, train_loss: 1.2575, test_loss: 1.3112, test_f1: 0.2281
 epoch: 45, train_loss: 1.2528, test_loss: 1.3045, test_f1: 0.2281
 epoch: 46, train_loss: 1.2533, test_loss: 1.3040, test_f1: 0.2281
 epoch: 47, train_loss: 1.2530, test_loss: 1.3055, test_f1: 0.2281
 epoch: 48, train_loss: 1.2533, test_loss: 1.3097, test_f1: 0.2281
 epoch: 49, train_loss: 1.2532, test_loss: 1.3094, test_f1: 0.2281
 epoch: 50, train_loss: 1.2522, test_loss: 1.3047, test_f1: 0.2281
 epoch: 51, train_loss: 1.2521, test_loss: 1.3046, test_f1: 0.2281
 epoch: 52, train_loss: 1.2531, test_loss: 1.3054, test_f1: 0.2281
 epoch: 53, train_loss: 1.2527, test_loss: 1.3045, test_f1: 0.2281
 epoch: 54, train_loss: 1.2518, test_loss: 1.3040, test_f1: 0.2281
 epoch: 55, train_loss: 1.2525, test_loss: 1.3026, test_f1: 0.2281
 epoch: 56, train_loss: 1.2525, test_loss: 1.3023, test_f1: 0.2281
 epoch: 57, train_loss: 1.2528, test_loss: 1.3032, test_f1: 0.2281
 epoch: 58, train_loss: 1.2525, test_loss: 1.3041, test_f1: 0.2281
 epoch: 59, train_loss: 1.2522, test_loss: 1.3058, test_f1: 0.2281
 epoch: 60, train_loss: 1.2521, test_loss: 1.3061, test_f1: 0.2281
 epoch: 61, train_loss: 1.2524, test_loss: 1.3041, test_f1: 0.2281
 epoch: 62, train_loss: 1.2528, test_loss: 1.3028, test_f1: 0.2281
 epoch: 63, train_loss: 1.2526, test_loss: 1.3038, test_f1: 0.2281
 epoch: 64, train_loss: 1.2523, test_loss: 1.3035, test_f1: 0.2281
 epoch: 65, train_loss: 1.2521, test_loss: 1.3027, test_f1: 0.2281
 epoch: 66, train_loss: 1.2522, test_loss: 1.3026, test_f1: 0.2281
 epoch: 67, train_loss: 1.2522, test_loss: 1.3024, test_f1: 0.2281
 epoch: 68, train_loss: 1.2526, test_loss: 1.3039, test_f1: 0.2281
 epoch: 69, train_loss: 1.2527, test_loss: 1.3044, test_f1: 0.2281
 epoch: 70, train_loss: 1.2522, test_loss: 1.3063, test_f1: 0.2281
 epoch: 71, train_loss: 1.2528, test_loss: 1.3074, test_f1: 0.2281
 epoch: 72, train_loss: 1.2532, test_loss: 1.3082, test_f1: 0.2281
 epoch: 73, train_loss: 1.2521, test_loss: 1.3058, test_f1: 0.2281
 epoch: 74, train_loss: 1.2523, test_loss: 1.3066, test_f1: 0.2281
 epoch: 75, train_loss: 1.2530, test_loss: 1.3053, test_f1: 0.2281
 epoch: 76, train_loss: 1.2528, test_loss: 1.3037, test_f1: 0.2281
 epoch: 77, train_loss: 1.2526, test_loss: 1.3066, test_f1: 0.2281
 epoch: 78, train_loss: 1.2528, test_loss: 1.3086, test_f1: 0.2281
 epoch: 79, train_loss: 1.2532, test_loss: 1.3101, test_f1: 0.2281
 epoch: 80, train_loss: 1.2530, test_loss: 1.3063, test_f1: 0.2281
 epoch: 81, train_loss: 1.2524, test_loss: 1.3052, test_f1: 0.2281
 epoch: 82, train_loss: 1.2523, test_loss: 1.3052, test_f1: 0.2281
 epoch: 83, train_loss: 1.2523, test_loss: 1.3053, test_f1: 0.2281
 epoch: 84, train_loss: 1.2534, test_loss: 1.3022, test_f1: 0.2281
 epoch: 85, train_loss: 1.2527, test_loss: 1.3006, test_f1: 0.2281
 epoch: 86, train_loss: 1.2527, test_loss: 1.3041, test_f1: 0.2281
 epoch: 87, train_loss: 1.2531, test_loss: 1.3067, test_f1: 0.2281
 epoch: 88, train_loss: 1.2527, test_loss: 1.3075, test_f1: 0.2281
 epoch: 89, train_loss: 1.2524, test_loss: 1.3097, test_f1: 0.2281
 epoch: 90, train_loss: 1.2530, test_loss: 1.3082, test_f1: 0.2281
 epoch: 91, train_loss: 1.2522, test_loss: 1.3045, test_f1: 0.2281
 epoch: 92, train_loss: 1.2521, test_loss: 1.3034, test_f1: 0.2281
 epoch: 93, train_loss: 1.2525, test_loss: 1.3025, test_f1: 0.2281
 epoch: 94, train_loss: 1.2524, test_loss: 1.3041, test_f1: 0.2281
 epoch: 95, train_loss: 1.2522, test_loss: 1.3035, test_f1: 0.2281
 epoch: 96, train_loss: 1.2523, test_loss: 1.3028, test_f1: 0.2281
 epoch: 97, train_loss: 1.2522, test_loss: 1.3047, test_f1: 0.2281
 epoch: 98, train_loss: 1.2522, test_loss: 1.3068, test_f1: 0.2281
 epoch: 99, train_loss: 1.2522, test_loss: 1.3060, test_f1: 0.2281
##################ITERATION #9 ****************************************
 epoch: 0, train_loss: 1.2599, test_loss: 1.3013, test_f1: 0.2281
 epoch: 1, train_loss: 1.2554, test_loss: 1.3088, test_f1: 0.2281
 epoch: 2, train_loss: 1.2544, test_loss: 1.3085, test_f1: 0.2281
 epoch: 3, train_loss: 1.2529, test_loss: 1.3089, test_f1: 0.2281
 epoch: 4, train_loss: 1.2528, test_loss: 1.3036, test_f1: 0.2281
 epoch: 5, train_loss: 1.2530, test_loss: 1.3024, test_f1: 0.2281
 epoch: 6, train_loss: 1.2524, test_loss: 1.3025, test_f1: 0.2281
 epoch: 7, train_loss: 1.2523, test_loss: 1.3062, test_f1: 0.2281
 epoch: 8, train_loss: 1.2530, test_loss: 1.3074, test_f1: 0.2281
 epoch: 9, train_loss: 1.2525, test_loss: 1.3029, test_f1: 0.2281
 epoch: 10, train_loss: 1.2523, test_loss: 1.3047, test_f1: 0.2281
 epoch: 11, train_loss: 1.2524, test_loss: 1.3041, test_f1: 0.2281
 epoch: 12, train_loss: 1.2525, test_loss: 1.3031, test_f1: 0.2281
 epoch: 13, train_loss: 1.2536, test_loss: 1.3010, test_f1: 0.2281
 epoch: 14, train_loss: 1.2550, test_loss: 1.3005, test_f1: 0.2281
 epoch: 15, train_loss: 1.2542, test_loss: 1.3026, test_f1: 0.2281
 epoch: 16, train_loss: 1.2539, test_loss: 1.3097, test_f1: 0.2281
 epoch: 17, train_loss: 1.2534, test_loss: 1.3097, test_f1: 0.2281
 epoch: 18, train_loss: 1.2531, test_loss: 1.3123, test_f1: 0.2281
 epoch: 19, train_loss: 1.2537, test_loss: 1.3063, test_f1: 0.2281
 epoch: 20, train_loss: 1.2527, test_loss: 1.3034, test_f1: 0.2281
 epoch: 21, train_loss: 1.2547, test_loss: 1.3095, test_f1: 0.2281
 epoch: 22, train_loss: 1.2540, test_loss: 1.3117, test_f1: 0.2281
 epoch: 23, train_loss: 1.2537, test_loss: 1.3051, test_f1: 0.2281
 epoch: 24, train_loss: 1.2524, test_loss: 1.3020, test_f1: 0.2281
 epoch: 25, train_loss: 1.2525, test_loss: 1.3048, test_f1: 0.2281
 epoch: 26, train_loss: 1.2522, test_loss: 1.3061, test_f1: 0.2281
 epoch: 27, train_loss: 1.2529, test_loss: 1.3072, test_f1: 0.2281
 epoch: 28, train_loss: 1.2531, test_loss: 1.3072, test_f1: 0.2281
 epoch: 29, train_loss: 1.2533, test_loss: 1.3043, test_f1: 0.2281
 epoch: 30, train_loss: 1.2529, test_loss: 1.3032, test_f1: 0.2281
 epoch: 31, train_loss: 1.2523, test_loss: 1.3050, test_f1: 0.2281
 epoch: 32, train_loss: 1.2525, test_loss: 1.3070, test_f1: 0.2281
 epoch: 33, train_loss: 1.2537, test_loss: 1.3101, test_f1: 0.2281
 epoch: 34, train_loss: 1.2530, test_loss: 1.3035, test_f1: 0.2281
 epoch: 35, train_loss: 1.2531, test_loss: 1.3078, test_f1: 0.2281
 epoch: 36, train_loss: 1.2533, test_loss: 1.3067, test_f1: 0.2281
 epoch: 37, train_loss: 1.2529, test_loss: 1.3057, test_f1: 0.2281
 epoch: 38, train_loss: 1.2527, test_loss: 1.3040, test_f1: 0.2281
 epoch: 39, train_loss: 1.2533, test_loss: 1.3052, test_f1: 0.2281
 epoch: 40, train_loss: 1.2524, test_loss: 1.3052, test_f1: 0.2281
 epoch: 41, train_loss: 1.2530, test_loss: 1.3091, test_f1: 0.2281
 epoch: 42, train_loss: 1.2540, test_loss: 1.3064, test_f1: 0.2281
 epoch: 43, train_loss: 1.2545, test_loss: 1.3120, test_f1: 0.2281
 epoch: 44, train_loss: 1.2527, test_loss: 1.3030, test_f1: 0.2281
 epoch: 45, train_loss: 1.2525, test_loss: 1.3011, test_f1: 0.2281
 epoch: 46, train_loss: 1.2529, test_loss: 1.3011, test_f1: 0.2281
 epoch: 47, train_loss: 1.2525, test_loss: 1.3039, test_f1: 0.2281
 epoch: 48, train_loss: 1.2521, test_loss: 1.3064, test_f1: 0.2281
 epoch: 49, train_loss: 1.2531, test_loss: 1.3100, test_f1: 0.2281
 epoch: 50, train_loss: 1.2531, test_loss: 1.3103, test_f1: 0.2281
 epoch: 51, train_loss: 1.2529, test_loss: 1.3098, test_f1: 0.2281
 epoch: 52, train_loss: 1.2526, test_loss: 1.3095, test_f1: 0.2281
 epoch: 53, train_loss: 1.2532, test_loss: 1.3088, test_f1: 0.2281
 epoch: 54, train_loss: 1.2526, test_loss: 1.3051, test_f1: 0.2281
 epoch: 55, train_loss: 1.2526, test_loss: 1.3033, test_f1: 0.2281
 epoch: 56, train_loss: 1.2527, test_loss: 1.3033, test_f1: 0.2281
 epoch: 57, train_loss: 1.2521, test_loss: 1.3035, test_f1: 0.2281
 epoch: 58, train_loss: 1.2540, test_loss: 1.3049, test_f1: 0.2281
 epoch: 59, train_loss: 1.2539, test_loss: 1.3032, test_f1: 0.2281
 epoch: 60, train_loss: 1.2527, test_loss: 1.3018, test_f1: 0.2281
 epoch: 61, train_loss: 1.2521, test_loss: 1.3034, test_f1: 0.2281
 epoch: 62, train_loss: 1.2525, test_loss: 1.3057, test_f1: 0.2281
 epoch: 63, train_loss: 1.2531, test_loss: 1.3052, test_f1: 0.2281
 epoch: 64, train_loss: 1.2523, test_loss: 1.3043, test_f1: 0.2281
 epoch: 65, train_loss: 1.2522, test_loss: 1.3056, test_f1: 0.2281
 epoch: 66, train_loss: 1.2527, test_loss: 1.3076, test_f1: 0.2281
 epoch: 67, train_loss: 1.2534, test_loss: 1.3083, test_f1: 0.2281
 epoch: 68, train_loss: 1.2520, test_loss: 1.3066, test_f1: 0.2281
 epoch: 69, train_loss: 1.2533, test_loss: 1.3049, test_f1: 0.2281
 epoch: 70, train_loss: 1.2535, test_loss: 1.3030, test_f1: 0.2281
 epoch: 71, train_loss: 1.2528, test_loss: 1.3028, test_f1: 0.2281
 epoch: 72, train_loss: 1.2523, test_loss: 1.3037, test_f1: 0.2281
 epoch: 73, train_loss: 1.2523, test_loss: 1.3051, test_f1: 0.2281
 epoch: 74, train_loss: 1.2525, test_loss: 1.3048, test_f1: 0.2281
 epoch: 75, train_loss: 1.2528, test_loss: 1.3079, test_f1: 0.2281
 epoch: 76, train_loss: 1.2530, test_loss: 1.3064, test_f1: 0.2281
 epoch: 77, train_loss: 1.2521, test_loss: 1.3045, test_f1: 0.2281
 epoch: 78, train_loss: 1.2527, test_loss: 1.3028, test_f1: 0.2281
 epoch: 79, train_loss: 1.2525, test_loss: 1.3053, test_f1: 0.2281
 epoch: 80, train_loss: 1.2523, test_loss: 1.3057, test_f1: 0.2281
 epoch: 81, train_loss: 1.2522, test_loss: 1.3062, test_f1: 0.2281
 epoch: 82, train_loss: 1.2527, test_loss: 1.3051, test_f1: 0.2281
 epoch: 83, train_loss: 1.2523, test_loss: 1.3036, test_f1: 0.2281
 epoch: 84, train_loss: 1.2521, test_loss: 1.3059, test_f1: 0.2281
 epoch: 85, train_loss: 1.2527, test_loss: 1.3072, test_f1: 0.2281
 epoch: 86, train_loss: 1.2526, test_loss: 1.3051, test_f1: 0.2281
 epoch: 87, train_loss: 1.2521, test_loss: 1.3045, test_f1: 0.2281
 epoch: 88, train_loss: 1.2523, test_loss: 1.3069, test_f1: 0.2281
 epoch: 89, train_loss: 1.2533, test_loss: 1.3049, test_f1: 0.2281
 epoch: 90, train_loss: 1.2528, test_loss: 1.3025, test_f1: 0.2281
 epoch: 91, train_loss: 1.2529, test_loss: 1.3018, test_f1: 0.2281
 epoch: 92, train_loss: 1.2525, test_loss: 1.3026, test_f1: 0.2281
 epoch: 93, train_loss: 1.2523, test_loss: 1.3030, test_f1: 0.2281
 epoch: 94, train_loss: 1.2528, test_loss: 1.3029, test_f1: 0.2281
 epoch: 95, train_loss: 1.2527, test_loss: 1.3035, test_f1: 0.2281
 epoch: 96, train_loss: 1.2524, test_loss: 1.3032, test_f1: 0.2281
 epoch: 97, train_loss: 1.2529, test_loss: 1.3053, test_f1: 0.2281
 epoch: 98, train_loss: 1.2525, test_loss: 1.3060, test_f1: 0.2281
 epoch: 99, train_loss: 1.2520, test_loss: 1.3054, test_f1: 0.2281

Training completed in 292.68 seconds
Best F1: 0.5344 at epoch 15
Mean F1 across iterations: 0.2719  0.0959
========================FINAL RESULTS================================
FEGIN weighted F1: 0.5344  0.0959
python main.py --data ltspice_demos --representation component_pin_net --model FEGIN --layers 2 --hiddens 32 --batch_size 256 --lr 0.1 --emb_size 250 --epochs 100 --save_appendix component_pin_net_L2_H32_BS256_LR0.1_E250 --no_val
-----



STDERR:
  File "main.py", line 370, in <module>
    main()
  File "main.py", line 254, in main
    dataset = dataset_class(
  File "/home/philip/projects/ltspice_examples_code_repo/Circuit-Completion-Using-GNNs/component_classification_with_link_prediction_head/evaluation/FEGIN/kernel/circuit_datasets.py", line 15, in __init__
    self.data, self.slices = torch.load(self.processed_paths[0])
  File "/home/philip/.local/lib/python3.8/site-packages/torch/serialization.py", line 1040, in load
    warnings.warn(
  File "/usr/lib/python3.8/warnings.py", line 109, in _showwarnmsg
    sw(msg.message, msg.category, msg.filename, msg.lineno,
  File "main.py", line 47, in warn_with_traceback
    traceback.print_stack(file=log)
/home/philip/projects/ltspice_examples_code_repo/Circuit-Completion-Using-GNNs/component_classification_with_link_prediction_head/evaluation/FEGIN/kernel/circuit_datasets.py:15: FutureWarning: You are using `torch.load` with `weights_only=False` (the current default value), which uses the default pickle module implicitly. It is possible to construct malicious pickle data which will execute arbitrary code during unpickling (See https://github.com/pytorch/pytorch/blob/main/SECURITY.md#untrusted-models for more details). In a future release, the default value for `weights_only` will be flipped to `True`. This limits the functions that could be executed during unpickling. Arbitrary objects will no longer be allowed to be loaded via this mode unless they are explicitly allowlisted by the user via `torch.serialization.add_safe_globals`. We recommend you start setting `weights_only=True` for any use case where you don't have full control of the loaded file. Please open an issue on GitHub for any issues related to this experimental feature.
  self.data, self.slices = torch.load(self.processed_paths[0])
