STDOUT:
Results will be saved in /home/philip/projects/ltspice_examples_code_repo/Circuit-Completion-Using-GNNs/component_classification_with_link_prediction_head/evaluation/FEGIN/results/model_FEGIN_dataset_ltspice_examples
Command line input: python main.py --data ltspice_examples --representation component_pin --model FEGIN --layers 3 --hiddens 64 --batch_size 64 --lr 0.001 --emb_size 250 --epochs 100 --save_appendix component_pin_L3_H64_BS64_LR0.001_E250 --no_val
 is saved.
-----
ltspice_examples - FEGIN
Using 3 layers, 64 hidden units, h = 2
Loading component_pin representation dataset
ENTERED
Training FEGIN on component_pin representation
Train: 3560, Test: 848
##################ITERATION #0 ****************************************
 epoch: 0, train_loss: 1.2404, test_loss: 1.1897, test_f1: 0.3427
 epoch: 1, train_loss: 1.0415, test_loss: 1.0617, test_f1: 0.3643
 epoch: 2, train_loss: 1.0248, test_loss: 1.0522, test_f1: 0.4887
 epoch: 3, train_loss: 0.9861, test_loss: 1.0092, test_f1: 0.4984
 epoch: 4, train_loss: 0.9578, test_loss: 1.0300, test_f1: 0.5136
 epoch: 5, train_loss: 0.9120, test_loss: 0.9958, test_f1: 0.4940
 epoch: 6, train_loss: 0.8871, test_loss: 0.9716, test_f1: 0.5185
 epoch: 7, train_loss: 0.8579, test_loss: 0.9243, test_f1: 0.5517
 epoch: 8, train_loss: 0.8453, test_loss: 0.8971, test_f1: 0.5525
 epoch: 9, train_loss: 0.8199, test_loss: 0.9381, test_f1: 0.5179
 epoch: 10, train_loss: 0.8003, test_loss: 0.8663, test_f1: 0.5623
 epoch: 11, train_loss: 0.7878, test_loss: 0.8691, test_f1: 0.5586
 epoch: 12, train_loss: 0.7698, test_loss: 0.9008, test_f1: 0.5865
 epoch: 13, train_loss: 0.7563, test_loss: 0.9293, test_f1: 0.5745
 epoch: 14, train_loss: 0.7451, test_loss: 0.8884, test_f1: 0.5791
 epoch: 15, train_loss: 0.7394, test_loss: 0.8935, test_f1: 0.6004
 epoch: 16, train_loss: 0.7227, test_loss: 0.9234, test_f1: 0.5777
 epoch: 17, train_loss: 0.7029, test_loss: 0.8930, test_f1: 0.5546
 epoch: 18, train_loss: 0.7046, test_loss: 0.8887, test_f1: 0.6138
 epoch: 19, train_loss: 0.6830, test_loss: 0.8577, test_f1: 0.6003
 epoch: 20, train_loss: 0.6692, test_loss: 0.9177, test_f1: 0.6033
 epoch: 21, train_loss: 0.6700, test_loss: 0.9155, test_f1: 0.5955
 epoch: 22, train_loss: 0.6627, test_loss: 0.9161, test_f1: 0.5824
 epoch: 23, train_loss: 0.6452, test_loss: 0.9644, test_f1: 0.5639
 epoch: 24, train_loss: 0.6512, test_loss: 0.9203, test_f1: 0.6025
 epoch: 25, train_loss: 0.6369, test_loss: 0.9609, test_f1: 0.5984
 epoch: 26, train_loss: 0.6287, test_loss: 0.8408, test_f1: 0.6341
 epoch: 27, train_loss: 0.6284, test_loss: 0.8057, test_f1: 0.6253
 epoch: 28, train_loss: 0.6392, test_loss: 1.0033, test_f1: 0.5861
 epoch: 29, train_loss: 0.6002, test_loss: 1.0863, test_f1: 0.5794
 epoch: 30, train_loss: 0.5994, test_loss: 1.0387, test_f1: 0.6109
 epoch: 31, train_loss: 0.5835, test_loss: 0.9636, test_f1: 0.6252
 epoch: 32, train_loss: 0.5967, test_loss: 0.9513, test_f1: 0.6143
 epoch: 33, train_loss: 0.5900, test_loss: 0.9890, test_f1: 0.5649
 epoch: 34, train_loss: 0.5846, test_loss: 0.9314, test_f1: 0.6017
 epoch: 35, train_loss: 0.5700, test_loss: 0.9411, test_f1: 0.6067
 epoch: 36, train_loss: 0.5624, test_loss: 1.0250, test_f1: 0.5961
 epoch: 37, train_loss: 0.5617, test_loss: 1.0128, test_f1: 0.6123
 epoch: 38, train_loss: 0.5583, test_loss: 1.0871, test_f1: 0.5980
 epoch: 39, train_loss: 0.5364, test_loss: 1.0812, test_f1: 0.5898
 epoch: 40, train_loss: 0.5259, test_loss: 1.0870, test_f1: 0.6073
 epoch: 41, train_loss: 0.5346, test_loss: 1.0014, test_f1: 0.6173
 epoch: 42, train_loss: 0.5219, test_loss: 1.0354, test_f1: 0.6143
 epoch: 43, train_loss: 0.5235, test_loss: 1.0608, test_f1: 0.6013
 epoch: 44, train_loss: 0.5231, test_loss: 1.0591, test_f1: 0.6167
 epoch: 45, train_loss: 0.5051, test_loss: 1.1555, test_f1: 0.5706
 epoch: 46, train_loss: 0.4953, test_loss: 1.0298, test_f1: 0.6424
 epoch: 47, train_loss: 0.4855, test_loss: 1.2538, test_f1: 0.6018
 epoch: 48, train_loss: 0.4881, test_loss: 1.1702, test_f1: 0.5765
 epoch: 49, train_loss: 0.4878, test_loss: 1.0961, test_f1: 0.5986
 epoch: 50, train_loss: 0.4810, test_loss: 1.1297, test_f1: 0.6304
 epoch: 51, train_loss: 0.4472, test_loss: 1.0080, test_f1: 0.6566
 epoch: 52, train_loss: 0.4264, test_loss: 1.0817, test_f1: 0.6131
 epoch: 53, train_loss: 0.4058, test_loss: 1.1292, test_f1: 0.6379
 epoch: 54, train_loss: 0.4094, test_loss: 1.0589, test_f1: 0.6407
 epoch: 55, train_loss: 0.4022, test_loss: 1.0509, test_f1: 0.6211
 epoch: 56, train_loss: 0.4088, test_loss: 1.2112, test_f1: 0.6056
 epoch: 57, train_loss: 0.3975, test_loss: 1.1911, test_f1: 0.6225
 epoch: 58, train_loss: 0.3861, test_loss: 1.2747, test_f1: 0.6308
 epoch: 59, train_loss: 0.3774, test_loss: 1.2962, test_f1: 0.5880
 epoch: 60, train_loss: 0.3963, test_loss: 1.2822, test_f1: 0.5913
 epoch: 61, train_loss: 0.3997, test_loss: 1.2915, test_f1: 0.6025
 epoch: 62, train_loss: 0.3933, test_loss: 1.2044, test_f1: 0.6058
 epoch: 63, train_loss: 0.3716, test_loss: 1.1308, test_f1: 0.6524
 epoch: 64, train_loss: 0.3561, test_loss: 1.2611, test_f1: 0.6337
 epoch: 65, train_loss: 0.3737, test_loss: 1.3343, test_f1: 0.6279
 epoch: 66, train_loss: 0.3811, test_loss: 1.3396, test_f1: 0.6058
 epoch: 67, train_loss: 0.3746, test_loss: 1.4628, test_f1: 0.5995
 epoch: 68, train_loss: 0.3593, test_loss: 1.2742, test_f1: 0.6245
 epoch: 69, train_loss: 0.3529, test_loss: 1.3345, test_f1: 0.6274
 epoch: 70, train_loss: 0.3539, test_loss: 1.3539, test_f1: 0.6307
 epoch: 71, train_loss: 0.3551, test_loss: 1.2667, test_f1: 0.6081
 epoch: 72, train_loss: 0.3417, test_loss: 1.3515, test_f1: 0.6050
 epoch: 73, train_loss: 0.3565, test_loss: 1.3985, test_f1: 0.6225
 epoch: 74, train_loss: 0.3446, test_loss: 1.2665, test_f1: 0.6124
 epoch: 75, train_loss: 0.3482, test_loss: 1.4946, test_f1: 0.6320
 epoch: 76, train_loss: 0.3349, test_loss: 1.3026, test_f1: 0.6638
 epoch: 77, train_loss: 0.3368, test_loss: 1.3113, test_f1: 0.6388
 epoch: 78, train_loss: 0.3526, test_loss: 1.3327, test_f1: 0.6326
 epoch: 79, train_loss: 0.3296, test_loss: 1.2837, test_f1: 0.6663
 epoch: 80, train_loss: 0.3265, test_loss: 1.4723, test_f1: 0.6177
 epoch: 81, train_loss: 0.3213, test_loss: 1.5701, test_f1: 0.6018
 epoch: 82, train_loss: 0.3206, test_loss: 1.5099, test_f1: 0.6283
 epoch: 83, train_loss: 0.3113, test_loss: 1.4522, test_f1: 0.6345
 epoch: 84, train_loss: 0.3231, test_loss: 1.3368, test_f1: 0.6635
 epoch: 85, train_loss: 0.3320, test_loss: 1.4718, test_f1: 0.6214
 epoch: 86, train_loss: 0.3441, test_loss: 1.4286, test_f1: 0.6456
 epoch: 87, train_loss: 0.3176, test_loss: 1.3839, test_f1: 0.6371
 epoch: 88, train_loss: 0.3007, test_loss: 1.5001, test_f1: 0.6270
 epoch: 89, train_loss: 0.2786, test_loss: 1.4567, test_f1: 0.6377
 epoch: 90, train_loss: 0.3070, test_loss: 1.3014, test_f1: 0.6762
 epoch: 91, train_loss: 0.2894, test_loss: 1.4986, test_f1: 0.6401
 epoch: 92, train_loss: 0.2892, test_loss: 1.5379, test_f1: 0.6502
 epoch: 93, train_loss: 0.2816, test_loss: 1.7697, test_f1: 0.6039
 epoch: 94, train_loss: 0.3050, test_loss: 1.5530, test_f1: 0.6366
 epoch: 95, train_loss: 0.3089, test_loss: 1.5969, test_f1: 0.6360
 epoch: 96, train_loss: 0.2907, test_loss: 1.6974, test_f1: 0.6475
 epoch: 97, train_loss: 0.2914, test_loss: 1.7295, test_f1: 0.6307
 epoch: 98, train_loss: 0.2899, test_loss: 1.6035, test_f1: 0.6597
 epoch: 99, train_loss: 0.2648, test_loss: 1.6713, test_f1: 0.6356
##################ITERATION #1 ****************************************
 epoch: 0, train_loss: 1.1515, test_loss: 1.1430, test_f1: 0.3165
 epoch: 1, train_loss: 0.9840, test_loss: 1.0864, test_f1: 0.4483
 epoch: 2, train_loss: 0.9666, test_loss: 0.9153, test_f1: 0.5253
 epoch: 3, train_loss: 0.9275, test_loss: 0.9079, test_f1: 0.5237
 epoch: 4, train_loss: 0.8995, test_loss: 0.8964, test_f1: 0.5322
 epoch: 5, train_loss: 0.8840, test_loss: 0.8741, test_f1: 0.5740
 epoch: 6, train_loss: 0.8646, test_loss: 0.8875, test_f1: 0.5526
 epoch: 7, train_loss: 0.8523, test_loss: 1.0776, test_f1: 0.4830
 epoch: 8, train_loss: 0.8251, test_loss: 0.8678, test_f1: 0.5684
 epoch: 9, train_loss: 0.8037, test_loss: 0.8701, test_f1: 0.5486
 epoch: 10, train_loss: 0.7947, test_loss: 0.8175, test_f1: 0.5610
 epoch: 11, train_loss: 0.7700, test_loss: 0.9005, test_f1: 0.6071
 epoch: 12, train_loss: 0.7588, test_loss: 0.9264, test_f1: 0.5861
 epoch: 13, train_loss: 0.7652, test_loss: 0.8598, test_f1: 0.5565
 epoch: 14, train_loss: 0.7351, test_loss: 0.7705, test_f1: 0.6065
 epoch: 15, train_loss: 0.7164, test_loss: 0.8285, test_f1: 0.5803
 epoch: 16, train_loss: 0.7134, test_loss: 0.8651, test_f1: 0.5550
 epoch: 17, train_loss: 0.7152, test_loss: 1.0020, test_f1: 0.5464
 epoch: 18, train_loss: 0.6871, test_loss: 0.9256, test_f1: 0.5828
 epoch: 19, train_loss: 0.6813, test_loss: 0.9471, test_f1: 0.5601
 epoch: 20, train_loss: 0.6694, test_loss: 0.9174, test_f1: 0.5633
 epoch: 21, train_loss: 0.6633, test_loss: 0.8847, test_f1: 0.5734
 epoch: 22, train_loss: 0.6503, test_loss: 0.8413, test_f1: 0.6033
 epoch: 23, train_loss: 0.6355, test_loss: 1.0153, test_f1: 0.5549
 epoch: 24, train_loss: 0.6180, test_loss: 0.8025, test_f1: 0.6144
 epoch: 25, train_loss: 0.6397, test_loss: 0.7330, test_f1: 0.6074
 epoch: 26, train_loss: 0.6180, test_loss: 0.7748, test_f1: 0.6388
 epoch: 27, train_loss: 0.6077, test_loss: 0.8650, test_f1: 0.6254
 epoch: 28, train_loss: 0.6220, test_loss: 0.7985, test_f1: 0.6231
 epoch: 29, train_loss: 0.6063, test_loss: 0.7600, test_f1: 0.6262
 epoch: 30, train_loss: 0.5883, test_loss: 0.8759, test_f1: 0.6095
 epoch: 31, train_loss: 0.5854, test_loss: 0.7582, test_f1: 0.6308
 epoch: 32, train_loss: 0.5801, test_loss: 0.7629, test_f1: 0.6502
 epoch: 33, train_loss: 0.5727, test_loss: 0.9027, test_f1: 0.5970
 epoch: 34, train_loss: 0.5765, test_loss: 0.7566, test_f1: 0.6452
 epoch: 35, train_loss: 0.5620, test_loss: 0.8758, test_f1: 0.6179
 epoch: 36, train_loss: 0.5385, test_loss: 0.7623, test_f1: 0.6509
 epoch: 37, train_loss: 0.5339, test_loss: 0.8438, test_f1: 0.6160
 epoch: 38, train_loss: 0.5312, test_loss: 0.7567, test_f1: 0.6569
 epoch: 39, train_loss: 0.5143, test_loss: 0.8004, test_f1: 0.5992
 epoch: 40, train_loss: 0.5235, test_loss: 0.7952, test_f1: 0.6138
 epoch: 41, train_loss: 0.5180, test_loss: 0.8233, test_f1: 0.6360
 epoch: 42, train_loss: 0.5299, test_loss: 0.8193, test_f1: 0.6466
 epoch: 43, train_loss: 0.5203, test_loss: 1.1825, test_f1: 0.5703
 epoch: 44, train_loss: 0.5103, test_loss: 0.8688, test_f1: 0.6171
 epoch: 45, train_loss: 0.5060, test_loss: 0.8603, test_f1: 0.6242
 epoch: 46, train_loss: 0.4855, test_loss: 0.8712, test_f1: 0.6113
 epoch: 47, train_loss: 0.4866, test_loss: 0.9174, test_f1: 0.6093
 epoch: 48, train_loss: 0.4909, test_loss: 0.9838, test_f1: 0.6246
 epoch: 49, train_loss: 0.4617, test_loss: 0.8188, test_f1: 0.6525
 epoch: 50, train_loss: 0.4699, test_loss: 0.7946, test_f1: 0.6496
 epoch: 51, train_loss: 0.4425, test_loss: 0.8413, test_f1: 0.6520
 epoch: 52, train_loss: 0.4097, test_loss: 1.0277, test_f1: 0.6047
 epoch: 53, train_loss: 0.3980, test_loss: 0.9397, test_f1: 0.6470
 epoch: 54, train_loss: 0.4012, test_loss: 1.0440, test_f1: 0.6376
 epoch: 55, train_loss: 0.3939, test_loss: 0.9247, test_f1: 0.6558
 epoch: 56, train_loss: 0.4018, test_loss: 0.9246, test_f1: 0.6424
 epoch: 57, train_loss: 0.3908, test_loss: 1.0141, test_f1: 0.6218
 epoch: 58, train_loss: 0.3779, test_loss: 0.8959, test_f1: 0.6556
 epoch: 59, train_loss: 0.3956, test_loss: 1.0458, test_f1: 0.6095
 epoch: 60, train_loss: 0.3841, test_loss: 1.0325, test_f1: 0.6321
 epoch: 61, train_loss: 0.3732, test_loss: 0.9649, test_f1: 0.6685
 epoch: 62, train_loss: 0.3577, test_loss: 1.1486, test_f1: 0.6292
 epoch: 63, train_loss: 0.3911, test_loss: 1.0597, test_f1: 0.6393
 epoch: 64, train_loss: 0.3779, test_loss: 1.0631, test_f1: 0.6268
 epoch: 65, train_loss: 0.3560, test_loss: 1.0017, test_f1: 0.6559
 epoch: 66, train_loss: 0.3575, test_loss: 1.0656, test_f1: 0.6480
 epoch: 67, train_loss: 0.3508, test_loss: 1.0672, test_f1: 0.6460
 epoch: 68, train_loss: 0.3526, test_loss: 1.1192, test_f1: 0.6370
 epoch: 69, train_loss: 0.3455, test_loss: 1.1381, test_f1: 0.6452
 epoch: 70, train_loss: 0.3390, test_loss: 1.1268, test_f1: 0.6597
 epoch: 71, train_loss: 0.3382, test_loss: 1.0321, test_f1: 0.6515
 epoch: 72, train_loss: 0.3354, test_loss: 1.1420, test_f1: 0.6444
 epoch: 73, train_loss: 0.3244, test_loss: 1.0457, test_f1: 0.6425
 epoch: 74, train_loss: 0.3360, test_loss: 1.0390, test_f1: 0.6466
 epoch: 75, train_loss: 0.3205, test_loss: 1.0173, test_f1: 0.6607
 epoch: 76, train_loss: 0.3257, test_loss: 1.1234, test_f1: 0.6511
 epoch: 77, train_loss: 0.3242, test_loss: 1.1806, test_f1: 0.6411
 epoch: 78, train_loss: 0.3290, test_loss: 1.0294, test_f1: 0.6674
 epoch: 79, train_loss: 0.3230, test_loss: 1.1605, test_f1: 0.6139
 epoch: 80, train_loss: 0.3126, test_loss: 1.2041, test_f1: 0.6338
 epoch: 81, train_loss: 0.3050, test_loss: 1.1952, test_f1: 0.6480
 epoch: 82, train_loss: 0.3016, test_loss: 1.2007, test_f1: 0.6600
 epoch: 83, train_loss: 0.3019, test_loss: 1.2504, test_f1: 0.6579
 epoch: 84, train_loss: 0.3183, test_loss: 1.1684, test_f1: 0.6477
 epoch: 85, train_loss: 0.3141, test_loss: 1.1958, test_f1: 0.6706
 epoch: 86, train_loss: 0.2932, test_loss: 1.0780, test_f1: 0.6339
 epoch: 87, train_loss: 0.2939, test_loss: 1.1707, test_f1: 0.6488
 epoch: 88, train_loss: 0.2839, test_loss: 1.3663, test_f1: 0.5984
 epoch: 89, train_loss: 0.2803, test_loss: 1.2489, test_f1: 0.6504
 epoch: 90, train_loss: 0.2923, test_loss: 1.0593, test_f1: 0.6657
 epoch: 91, train_loss: 0.3050, test_loss: 1.2487, test_f1: 0.6282
 epoch: 92, train_loss: 0.2847, test_loss: 1.3616, test_f1: 0.6521
 epoch: 93, train_loss: 0.2758, test_loss: 1.1670, test_f1: 0.6755
 epoch: 94, train_loss: 0.2854, test_loss: 1.2659, test_f1: 0.6622
 epoch: 95, train_loss: 0.2739, test_loss: 1.2296, test_f1: 0.6471
 epoch: 96, train_loss: 0.2606, test_loss: 1.2571, test_f1: 0.6533
 epoch: 97, train_loss: 0.2712, test_loss: 1.4078, test_f1: 0.6588
 epoch: 98, train_loss: 0.2662, test_loss: 1.3641, test_f1: 0.6636
 epoch: 99, train_loss: 0.2746, test_loss: 1.3148, test_f1: 0.6527
##################ITERATION #2 ****************************************
 epoch: 0, train_loss: 1.1156, test_loss: 1.3691, test_f1: 0.3320
 epoch: 1, train_loss: 0.9881, test_loss: 0.9520, test_f1: 0.5030
 epoch: 2, train_loss: 0.9375, test_loss: 0.9348, test_f1: 0.4979
 epoch: 3, train_loss: 0.9002, test_loss: 0.8754, test_f1: 0.5565
 epoch: 4, train_loss: 0.8902, test_loss: 0.9350, test_f1: 0.5645
 epoch: 5, train_loss: 0.8671, test_loss: 0.8825, test_f1: 0.5784
 epoch: 6, train_loss: 0.8392, test_loss: 0.9311, test_f1: 0.5697
 epoch: 7, train_loss: 0.8263, test_loss: 0.8702, test_f1: 0.5721
 epoch: 8, train_loss: 0.8201, test_loss: 0.9771, test_f1: 0.5176
 epoch: 9, train_loss: 0.7951, test_loss: 0.8869, test_f1: 0.5658
 epoch: 10, train_loss: 0.7784, test_loss: 1.0639, test_f1: 0.5444
 epoch: 11, train_loss: 0.7807, test_loss: 0.9112, test_f1: 0.5733
 epoch: 12, train_loss: 0.7505, test_loss: 0.8635, test_f1: 0.5691
 epoch: 13, train_loss: 0.7434, test_loss: 0.8287, test_f1: 0.5854
 epoch: 14, train_loss: 0.7208, test_loss: 0.8949, test_f1: 0.6084
 epoch: 15, train_loss: 0.7172, test_loss: 0.8430, test_f1: 0.5979
 epoch: 16, train_loss: 0.7120, test_loss: 0.8378, test_f1: 0.6030
 epoch: 17, train_loss: 0.6797, test_loss: 0.9079, test_f1: 0.6229
 epoch: 18, train_loss: 0.6835, test_loss: 0.8081, test_f1: 0.6169
 epoch: 19, train_loss: 0.6755, test_loss: 0.8313, test_f1: 0.6111
 epoch: 20, train_loss: 0.6667, test_loss: 1.0976, test_f1: 0.5761
 epoch: 21, train_loss: 0.6692, test_loss: 0.8424, test_f1: 0.6152
 epoch: 22, train_loss: 0.6630, test_loss: 0.8075, test_f1: 0.6128
 epoch: 23, train_loss: 0.6499, test_loss: 0.7711, test_f1: 0.6282
 epoch: 24, train_loss: 0.6314, test_loss: 0.8536, test_f1: 0.6018
 epoch: 25, train_loss: 0.6174, test_loss: 0.7632, test_f1: 0.6451
 epoch: 26, train_loss: 0.6062, test_loss: 0.8459, test_f1: 0.6545
 epoch: 27, train_loss: 0.5993, test_loss: 0.8990, test_f1: 0.6135
 epoch: 28, train_loss: 0.5908, test_loss: 0.7746, test_f1: 0.6430
 epoch: 29, train_loss: 0.5967, test_loss: 0.8808, test_f1: 0.6109
 epoch: 30, train_loss: 0.5742, test_loss: 0.7881, test_f1: 0.6377
 epoch: 31, train_loss: 0.6156, test_loss: 0.8952, test_f1: 0.6089
 epoch: 32, train_loss: 0.5791, test_loss: 0.7897, test_f1: 0.6287
 epoch: 33, train_loss: 0.5539, test_loss: 0.9646, test_f1: 0.6397
 epoch: 34, train_loss: 0.5500, test_loss: 0.8523, test_f1: 0.6320
 epoch: 35, train_loss: 0.5537, test_loss: 0.8124, test_f1: 0.6125
 epoch: 36, train_loss: 0.5314, test_loss: 0.8605, test_f1: 0.6426
 epoch: 37, train_loss: 0.5279, test_loss: 0.8358, test_f1: 0.6377
 epoch: 38, train_loss: 0.5284, test_loss: 0.8265, test_f1: 0.6514
 epoch: 39, train_loss: 0.5217, test_loss: 0.8750, test_f1: 0.6481
 epoch: 40, train_loss: 0.5268, test_loss: 0.8693, test_f1: 0.6254
 epoch: 41, train_loss: 0.5097, test_loss: 0.9524, test_f1: 0.6283
 epoch: 42, train_loss: 0.5157, test_loss: 1.0836, test_f1: 0.6043
 epoch: 43, train_loss: 0.4986, test_loss: 0.8012, test_f1: 0.6489
 epoch: 44, train_loss: 0.5126, test_loss: 0.9238, test_f1: 0.6397
 epoch: 45, train_loss: 0.4878, test_loss: 0.7918, test_f1: 0.6471
 epoch: 46, train_loss: 0.4733, test_loss: 0.8514, test_f1: 0.6670
 epoch: 47, train_loss: 0.4737, test_loss: 0.9004, test_f1: 0.6377
 epoch: 48, train_loss: 0.4777, test_loss: 0.9640, test_f1: 0.6577
 epoch: 49, train_loss: 0.4518, test_loss: 0.8359, test_f1: 0.6709
 epoch: 50, train_loss: 0.4444, test_loss: 0.9051, test_f1: 0.6608
 epoch: 51, train_loss: 0.4117, test_loss: 0.9239, test_f1: 0.6573
 epoch: 52, train_loss: 0.3870, test_loss: 0.8785, test_f1: 0.6740
 epoch: 53, train_loss: 0.3883, test_loss: 0.8583, test_f1: 0.6696
 epoch: 54, train_loss: 0.3859, test_loss: 0.8498, test_f1: 0.6775
 epoch: 55, train_loss: 0.3967, test_loss: 0.8860, test_f1: 0.6906
 epoch: 56, train_loss: 0.3889, test_loss: 0.9282, test_f1: 0.6809
 epoch: 57, train_loss: 0.3839, test_loss: 0.9289, test_f1: 0.6805
 epoch: 58, train_loss: 0.3751, test_loss: 0.9566, test_f1: 0.6588
 epoch: 59, train_loss: 0.3672, test_loss: 0.9411, test_f1: 0.6620
 epoch: 60, train_loss: 0.3700, test_loss: 0.9684, test_f1: 0.6898
 epoch: 61, train_loss: 0.3610, test_loss: 0.9488, test_f1: 0.6631
 epoch: 62, train_loss: 0.3582, test_loss: 0.9778, test_f1: 0.6798
 epoch: 63, train_loss: 0.3552, test_loss: 1.0098, test_f1: 0.6765
 epoch: 64, train_loss: 0.3601, test_loss: 1.0399, test_f1: 0.6755
 epoch: 65, train_loss: 0.3510, test_loss: 1.0318, test_f1: 0.6681
 epoch: 66, train_loss: 0.3482, test_loss: 0.9973, test_f1: 0.6583
 epoch: 67, train_loss: 0.3471, test_loss: 1.0705, test_f1: 0.6679
 epoch: 68, train_loss: 0.3338, test_loss: 1.1330, test_f1: 0.6650
 epoch: 69, train_loss: 0.3343, test_loss: 1.1548, test_f1: 0.6598
 epoch: 70, train_loss: 0.3206, test_loss: 1.1311, test_f1: 0.6746
 epoch: 71, train_loss: 0.3309, test_loss: 1.0441, test_f1: 0.6702
 epoch: 72, train_loss: 0.3377, test_loss: 1.1414, test_f1: 0.6388
 epoch: 73, train_loss: 0.3261, test_loss: 1.0968, test_f1: 0.6617
 epoch: 74, train_loss: 0.3128, test_loss: 1.0915, test_f1: 0.6683
 epoch: 75, train_loss: 0.3211, test_loss: 1.1255, test_f1: 0.6700
 epoch: 76, train_loss: 0.3088, test_loss: 1.1248, test_f1: 0.6769
 epoch: 77, train_loss: 0.3188, test_loss: 1.2905, test_f1: 0.6596
 epoch: 78, train_loss: 0.3112, test_loss: 1.1732, test_f1: 0.6388
 epoch: 79, train_loss: 0.3093, test_loss: 1.1275, test_f1: 0.6823
 epoch: 80, train_loss: 0.3188, test_loss: 1.2265, test_f1: 0.6767
 epoch: 81, train_loss: 0.2997, test_loss: 1.1617, test_f1: 0.6611
 epoch: 82, train_loss: 0.3008, test_loss: 1.1641, test_f1: 0.6906
 epoch: 83, train_loss: 0.2983, test_loss: 1.2279, test_f1: 0.6847
 epoch: 84, train_loss: 0.2856, test_loss: 1.2861, test_f1: 0.6518
 epoch: 85, train_loss: 0.2808, test_loss: 1.2188, test_f1: 0.6896
 epoch: 86, train_loss: 0.2889, test_loss: 1.2237, test_f1: 0.6482
 epoch: 87, train_loss: 0.2965, test_loss: 1.2820, test_f1: 0.6575
 epoch: 88, train_loss: 0.2952, test_loss: 1.2942, test_f1: 0.6724
 epoch: 89, train_loss: 0.2704, test_loss: 1.3145, test_f1: 0.6229
 epoch: 90, train_loss: 0.3025, test_loss: 1.2535, test_f1: 0.6621
 epoch: 91, train_loss: 0.2944, test_loss: 1.2249, test_f1: 0.6614
 epoch: 92, train_loss: 0.2718, test_loss: 1.2338, test_f1: 0.6881
 epoch: 93, train_loss: 0.2891, test_loss: 1.3190, test_f1: 0.6520
 epoch: 94, train_loss: 0.2697, test_loss: 1.1306, test_f1: 0.7108
 epoch: 95, train_loss: 0.2645, test_loss: 1.2760, test_f1: 0.6609
 epoch: 96, train_loss: 0.2842, test_loss: 1.2478, test_f1: 0.6595
 epoch: 97, train_loss: 0.2506, test_loss: 1.4035, test_f1: 0.6738
 epoch: 98, train_loss: 0.2566, test_loss: 1.2819, test_f1: 0.6576
 epoch: 99, train_loss: 0.2690, test_loss: 1.3254, test_f1: 0.6603
##################ITERATION #3 ****************************************
 epoch: 0, train_loss: 1.1832, test_loss: 1.0314, test_f1: 0.4196
 epoch: 1, train_loss: 0.9933, test_loss: 1.0016, test_f1: 0.5616
 epoch: 2, train_loss: 0.9442, test_loss: 0.9329, test_f1: 0.5178
 epoch: 3, train_loss: 0.9123, test_loss: 0.9152, test_f1: 0.5583
 epoch: 4, train_loss: 0.8870, test_loss: 0.9374, test_f1: 0.5649
 epoch: 5, train_loss: 0.8686, test_loss: 0.9739, test_f1: 0.5507
 epoch: 6, train_loss: 0.8543, test_loss: 0.9328, test_f1: 0.5635
 epoch: 7, train_loss: 0.8361, test_loss: 0.8709, test_f1: 0.5990
 epoch: 8, train_loss: 0.8108, test_loss: 0.8942, test_f1: 0.5429
 epoch: 9, train_loss: 0.8042, test_loss: 0.9479, test_f1: 0.5408
 epoch: 10, train_loss: 0.7982, test_loss: 0.8843, test_f1: 0.5773
 epoch: 11, train_loss: 0.7572, test_loss: 0.9107, test_f1: 0.5725
 epoch: 12, train_loss: 0.7601, test_loss: 1.0608, test_f1: 0.5401
 epoch: 13, train_loss: 0.7437, test_loss: 0.8421, test_f1: 0.5929
 epoch: 14, train_loss: 0.7283, test_loss: 0.8587, test_f1: 0.6145
 epoch: 15, train_loss: 0.7199, test_loss: 0.8493, test_f1: 0.6175
 epoch: 16, train_loss: 0.7186, test_loss: 0.9367, test_f1: 0.6090
 epoch: 17, train_loss: 0.7199, test_loss: 1.2248, test_f1: 0.4849
 epoch: 18, train_loss: 0.7025, test_loss: 0.8703, test_f1: 0.5890
 epoch: 19, train_loss: 0.6966, test_loss: 0.8384, test_f1: 0.6097
 epoch: 20, train_loss: 0.6724, test_loss: 0.8494, test_f1: 0.6292
 epoch: 21, train_loss: 0.6779, test_loss: 0.9064, test_f1: 0.5777
 epoch: 22, train_loss: 0.6677, test_loss: 0.8113, test_f1: 0.6496
 epoch: 23, train_loss: 0.6575, test_loss: 0.9623, test_f1: 0.5594
 epoch: 24, train_loss: 0.6563, test_loss: 0.9759, test_f1: 0.5760
 epoch: 25, train_loss: 0.6415, test_loss: 0.8926, test_f1: 0.5921
 epoch: 26, train_loss: 0.6234, test_loss: 0.8993, test_f1: 0.5881
 epoch: 27, train_loss: 0.6307, test_loss: 0.8862, test_f1: 0.6379
 epoch: 28, train_loss: 0.6062, test_loss: 0.9199, test_f1: 0.6088
 epoch: 29, train_loss: 0.6123, test_loss: 0.8246, test_f1: 0.6142
 epoch: 30, train_loss: 0.6084, test_loss: 0.9722, test_f1: 0.6122
 epoch: 31, train_loss: 0.6067, test_loss: 0.9012, test_f1: 0.6222
 epoch: 32, train_loss: 0.5873, test_loss: 0.9633, test_f1: 0.6206
 epoch: 33, train_loss: 0.5967, test_loss: 0.8596, test_f1: 0.6387
 epoch: 34, train_loss: 0.5775, test_loss: 0.8425, test_f1: 0.6392
 epoch: 35, train_loss: 0.5543, test_loss: 0.8475, test_f1: 0.6344
 epoch: 36, train_loss: 0.5647, test_loss: 0.8590, test_f1: 0.6377
 epoch: 37, train_loss: 0.5393, test_loss: 0.8822, test_f1: 0.6432
 epoch: 38, train_loss: 0.5574, test_loss: 0.8898, test_f1: 0.6291
 epoch: 39, train_loss: 0.5436, test_loss: 0.8580, test_f1: 0.6296
 epoch: 40, train_loss: 0.5392, test_loss: 0.9366, test_f1: 0.6213
 epoch: 41, train_loss: 0.5580, test_loss: 0.8702, test_f1: 0.6541
 epoch: 42, train_loss: 0.5444, test_loss: 0.9124, test_f1: 0.6459
 epoch: 43, train_loss: 0.5192, test_loss: 0.8596, test_f1: 0.6623
 epoch: 44, train_loss: 0.5073, test_loss: 0.9081, test_f1: 0.6172
 epoch: 45, train_loss: 0.5166, test_loss: 0.8981, test_f1: 0.6195
 epoch: 46, train_loss: 0.5075, test_loss: 0.9067, test_f1: 0.6175
 epoch: 47, train_loss: 0.5042, test_loss: 0.9447, test_f1: 0.6538
 epoch: 48, train_loss: 0.4984, test_loss: 0.9452, test_f1: 0.6382
 epoch: 49, train_loss: 0.4816, test_loss: 0.8940, test_f1: 0.6597
 epoch: 50, train_loss: 0.4947, test_loss: 0.9226, test_f1: 0.6355
 epoch: 51, train_loss: 0.4503, test_loss: 0.8738, test_f1: 0.6710
 epoch: 52, train_loss: 0.4295, test_loss: 0.9589, test_f1: 0.6574
 epoch: 53, train_loss: 0.4217, test_loss: 0.9120, test_f1: 0.6684
 epoch: 54, train_loss: 0.4223, test_loss: 0.8865, test_f1: 0.6726
 epoch: 55, train_loss: 0.3998, test_loss: 0.9896, test_f1: 0.6608
 epoch: 56, train_loss: 0.4009, test_loss: 1.0008, test_f1: 0.6556
 epoch: 57, train_loss: 0.3930, test_loss: 0.9125, test_f1: 0.6604
 epoch: 58, train_loss: 0.3880, test_loss: 0.9648, test_f1: 0.6458
 epoch: 59, train_loss: 0.3864, test_loss: 0.9746, test_f1: 0.6487
 epoch: 60, train_loss: 0.3782, test_loss: 0.9972, test_f1: 0.6443
 epoch: 61, train_loss: 0.3668, test_loss: 0.9351, test_f1: 0.6739
 epoch: 62, train_loss: 0.3800, test_loss: 1.0199, test_f1: 0.6403
 epoch: 63, train_loss: 0.3761, test_loss: 1.0019, test_f1: 0.6558
 epoch: 64, train_loss: 0.3919, test_loss: 1.0505, test_f1: 0.6254
 epoch: 65, train_loss: 0.3719, test_loss: 1.0496, test_f1: 0.6426
 epoch: 66, train_loss: 0.3665, test_loss: 1.0155, test_f1: 0.6268
 epoch: 67, train_loss: 0.3839, test_loss: 0.9416, test_f1: 0.6558
 epoch: 68, train_loss: 0.3664, test_loss: 1.0987, test_f1: 0.6217
 epoch: 69, train_loss: 0.3712, test_loss: 0.9631, test_f1: 0.6506
 epoch: 70, train_loss: 0.3497, test_loss: 1.0576, test_f1: 0.6710
 epoch: 71, train_loss: 0.3563, test_loss: 1.0137, test_f1: 0.6459
 epoch: 72, train_loss: 0.3430, test_loss: 0.9559, test_f1: 0.6535
 epoch: 73, train_loss: 0.3438, test_loss: 1.0101, test_f1: 0.6563
 epoch: 74, train_loss: 0.3443, test_loss: 0.9920, test_f1: 0.6656
 epoch: 75, train_loss: 0.3493, test_loss: 1.0816, test_f1: 0.6524
 epoch: 76, train_loss: 0.3424, test_loss: 1.0421, test_f1: 0.6492
 epoch: 77, train_loss: 0.3308, test_loss: 1.0334, test_f1: 0.6454
 epoch: 78, train_loss: 0.3270, test_loss: 1.1436, test_f1: 0.6410
 epoch: 79, train_loss: 0.3090, test_loss: 1.0161, test_f1: 0.6587
 epoch: 80, train_loss: 0.3181, test_loss: 1.0962, test_f1: 0.6648
 epoch: 81, train_loss: 0.3122, test_loss: 1.1923, test_f1: 0.6506
 epoch: 82, train_loss: 0.3215, test_loss: 1.0402, test_f1: 0.6566
 epoch: 83, train_loss: 0.3173, test_loss: 1.1461, test_f1: 0.6763
 epoch: 84, train_loss: 0.3273, test_loss: 1.1173, test_f1: 0.6490
 epoch: 85, train_loss: 0.2957, test_loss: 1.0411, test_f1: 0.6560
 epoch: 86, train_loss: 0.3110, test_loss: 1.0948, test_f1: 0.6502
 epoch: 87, train_loss: 0.3017, test_loss: 1.2555, test_f1: 0.6566
 epoch: 88, train_loss: 0.2860, test_loss: 1.1614, test_f1: 0.6637
 epoch: 89, train_loss: 0.2940, test_loss: 1.2114, test_f1: 0.6666
 epoch: 90, train_loss: 0.2868, test_loss: 1.1176, test_f1: 0.6753
 epoch: 91, train_loss: 0.3038, test_loss: 1.2408, test_f1: 0.6586
 epoch: 92, train_loss: 0.2989, test_loss: 1.1068, test_f1: 0.6703
 epoch: 93, train_loss: 0.2839, test_loss: 1.2373, test_f1: 0.6567
 epoch: 94, train_loss: 0.2788, test_loss: 1.1520, test_f1: 0.6622
 epoch: 95, train_loss: 0.2793, test_loss: 1.1613, test_f1: 0.6443
 epoch: 96, train_loss: 0.2633, test_loss: 1.2052, test_f1: 0.6745
 epoch: 97, train_loss: 0.2587, test_loss: 1.2998, test_f1: 0.6619
 epoch: 98, train_loss: 0.2756, test_loss: 1.2260, test_f1: 0.6510
 epoch: 99, train_loss: 0.3047, test_loss: 1.3130, test_f1: 0.6616
##################ITERATION #4 ****************************************
 epoch: 0, train_loss: 1.2041, test_loss: 1.0576, test_f1: 0.4533
 epoch: 1, train_loss: 0.9742, test_loss: 0.9868, test_f1: 0.4999
 epoch: 2, train_loss: 0.9312, test_loss: 0.9584, test_f1: 0.5441
 epoch: 3, train_loss: 0.8943, test_loss: 0.9449, test_f1: 0.5406
 epoch: 4, train_loss: 0.8679, test_loss: 0.9053, test_f1: 0.5983
 epoch: 5, train_loss: 0.8569, test_loss: 0.9459, test_f1: 0.5253
 epoch: 6, train_loss: 0.8422, test_loss: 0.9697, test_f1: 0.5536
 epoch: 7, train_loss: 0.8287, test_loss: 0.9421, test_f1: 0.5756
 epoch: 8, train_loss: 0.7922, test_loss: 0.9131, test_f1: 0.5826
 epoch: 9, train_loss: 0.8084, test_loss: 0.8975, test_f1: 0.5712
 epoch: 10, train_loss: 0.7824, test_loss: 0.8773, test_f1: 0.6157
 epoch: 11, train_loss: 0.7524, test_loss: 0.9877, test_f1: 0.6034
 epoch: 12, train_loss: 0.7563, test_loss: 0.8150, test_f1: 0.6026
 epoch: 13, train_loss: 0.7490, test_loss: 0.8825, test_f1: 0.5879
 epoch: 14, train_loss: 0.7228, test_loss: 0.8575, test_f1: 0.6008
 epoch: 15, train_loss: 0.7088, test_loss: 0.8800, test_f1: 0.6113
 epoch: 16, train_loss: 0.7026, test_loss: 0.8518, test_f1: 0.6367
 epoch: 17, train_loss: 0.6852, test_loss: 0.8450, test_f1: 0.5990
 epoch: 18, train_loss: 0.6750, test_loss: 0.8872, test_f1: 0.6066
 epoch: 19, train_loss: 0.6626, test_loss: 0.9258, test_f1: 0.6370
 epoch: 20, train_loss: 0.6700, test_loss: 0.9378, test_f1: 0.6127
 epoch: 21, train_loss: 0.6482, test_loss: 1.0290, test_f1: 0.5961
 epoch: 22, train_loss: 0.6480, test_loss: 0.8788, test_f1: 0.6090
 epoch: 23, train_loss: 0.6415, test_loss: 0.8779, test_f1: 0.6561
 epoch: 24, train_loss: 0.6353, test_loss: 0.8800, test_f1: 0.6114
 epoch: 25, train_loss: 0.6150, test_loss: 0.8910, test_f1: 0.6220
 epoch: 26, train_loss: 0.5944, test_loss: 0.8844, test_f1: 0.6279
 epoch: 27, train_loss: 0.6069, test_loss: 0.8525, test_f1: 0.6689
 epoch: 28, train_loss: 0.5943, test_loss: 0.9591, test_f1: 0.6327
 epoch: 29, train_loss: 0.6012, test_loss: 0.8278, test_f1: 0.6765
 epoch: 30, train_loss: 0.5698, test_loss: 0.9113, test_f1: 0.6478
 epoch: 31, train_loss: 0.5869, test_loss: 0.8326, test_f1: 0.6489
 epoch: 32, train_loss: 0.5504, test_loss: 0.8996, test_f1: 0.6477
 epoch: 33, train_loss: 0.5629, test_loss: 0.8334, test_f1: 0.6442
 epoch: 34, train_loss: 0.5674, test_loss: 0.8466, test_f1: 0.6545
 epoch: 35, train_loss: 0.5470, test_loss: 0.8819, test_f1: 0.6496
 epoch: 36, train_loss: 0.5254, test_loss: 0.8955, test_f1: 0.6572
 epoch: 37, train_loss: 0.5284, test_loss: 0.9012, test_f1: 0.6222
 epoch: 38, train_loss: 0.5340, test_loss: 0.9278, test_f1: 0.6363
 epoch: 39, train_loss: 0.5517, test_loss: 0.9879, test_f1: 0.6200
 epoch: 40, train_loss: 0.5309, test_loss: 0.8532, test_f1: 0.6600
 epoch: 41, train_loss: 0.5080, test_loss: 0.9931, test_f1: 0.6233
 epoch: 42, train_loss: 0.5112, test_loss: 0.8308, test_f1: 0.6701
 epoch: 43, train_loss: 0.4984, test_loss: 0.9050, test_f1: 0.6589
 epoch: 44, train_loss: 0.4728, test_loss: 0.9247, test_f1: 0.6513
 epoch: 45, train_loss: 0.4852, test_loss: 0.9774, test_f1: 0.6350
 epoch: 46, train_loss: 0.4861, test_loss: 1.0020, test_f1: 0.6251
 epoch: 47, train_loss: 0.4740, test_loss: 0.8721, test_f1: 0.6450
 epoch: 48, train_loss: 0.4462, test_loss: 0.9009, test_f1: 0.6581
 epoch: 49, train_loss: 0.4520, test_loss: 0.9048, test_f1: 0.6392
 epoch: 50, train_loss: 0.4624, test_loss: 0.8987, test_f1: 0.6570
 epoch: 51, train_loss: 0.4141, test_loss: 0.8845, test_f1: 0.6857
 epoch: 52, train_loss: 0.4200, test_loss: 0.9320, test_f1: 0.6623
 epoch: 53, train_loss: 0.3947, test_loss: 0.8879, test_f1: 0.6685
 epoch: 54, train_loss: 0.3919, test_loss: 0.9260, test_f1: 0.6817
 epoch: 55, train_loss: 0.3833, test_loss: 0.9674, test_f1: 0.6619
 epoch: 56, train_loss: 0.3534, test_loss: 0.9451, test_f1: 0.6672
 epoch: 57, train_loss: 0.3716, test_loss: 0.9725, test_f1: 0.6615
 epoch: 58, train_loss: 0.3354, test_loss: 1.0411, test_f1: 0.6636
 epoch: 59, train_loss: 0.3597, test_loss: 1.0113, test_f1: 0.6588
 epoch: 60, train_loss: 0.3640, test_loss: 1.0311, test_f1: 0.6697
 epoch: 61, train_loss: 0.3503, test_loss: 0.9822, test_f1: 0.6660
 epoch: 62, train_loss: 0.3441, test_loss: 1.0005, test_f1: 0.6635
 epoch: 63, train_loss: 0.3441, test_loss: 1.0507, test_f1: 0.6847
 epoch: 64, train_loss: 0.3451, test_loss: 1.0235, test_f1: 0.6648
 epoch: 65, train_loss: 0.3554, test_loss: 1.0658, test_f1: 0.6798
 epoch: 66, train_loss: 0.3479, test_loss: 0.9722, test_f1: 0.6776
 epoch: 67, train_loss: 0.3209, test_loss: 1.0299, test_f1: 0.6772
 epoch: 68, train_loss: 0.3346, test_loss: 0.9941, test_f1: 0.6808
 epoch: 69, train_loss: 0.3396, test_loss: 1.0232, test_f1: 0.6795
 epoch: 70, train_loss: 0.3149, test_loss: 1.0105, test_f1: 0.6625
 epoch: 71, train_loss: 0.3300, test_loss: 1.0182, test_f1: 0.6820
 epoch: 72, train_loss: 0.3147, test_loss: 1.0188, test_f1: 0.6580
 epoch: 73, train_loss: 0.3218, test_loss: 0.9891, test_f1: 0.6924
 epoch: 74, train_loss: 0.3042, test_loss: 1.1650, test_f1: 0.6233
 epoch: 75, train_loss: 0.3051, test_loss: 1.0988, test_f1: 0.6599
 epoch: 76, train_loss: 0.3004, test_loss: 1.1460, test_f1: 0.6329
 epoch: 77, train_loss: 0.2907, test_loss: 1.2429, test_f1: 0.6354
 epoch: 78, train_loss: 0.3099, test_loss: 1.0764, test_f1: 0.6741
 epoch: 79, train_loss: 0.3098, test_loss: 1.1007, test_f1: 0.6890
 epoch: 80, train_loss: 0.3027, test_loss: 1.0912, test_f1: 0.6714
 epoch: 81, train_loss: 0.2959, test_loss: 1.1520, test_f1: 0.6502
 epoch: 82, train_loss: 0.2876, test_loss: 1.2032, test_f1: 0.6388
 epoch: 83, train_loss: 0.2844, test_loss: 1.1577, test_f1: 0.6426
 epoch: 84, train_loss: 0.2961, test_loss: 1.1463, test_f1: 0.6507
 epoch: 85, train_loss: 0.2860, test_loss: 1.0863, test_f1: 0.7079
 epoch: 86, train_loss: 0.2958, test_loss: 1.0936, test_f1: 0.6835
 epoch: 87, train_loss: 0.2863, test_loss: 1.1463, test_f1: 0.6710
 epoch: 88, train_loss: 0.2799, test_loss: 1.1667, test_f1: 0.6848
 epoch: 89, train_loss: 0.2683, test_loss: 1.1281, test_f1: 0.6606
 epoch: 90, train_loss: 0.2608, test_loss: 1.1673, test_f1: 0.6599
 epoch: 91, train_loss: 0.2654, test_loss: 1.1890, test_f1: 0.6425
 epoch: 92, train_loss: 0.2772, test_loss: 1.1709, test_f1: 0.6425
 epoch: 93, train_loss: 0.2553, test_loss: 1.1113, test_f1: 0.6576
 epoch: 94, train_loss: 0.2540, test_loss: 1.1950, test_f1: 0.6687
 epoch: 95, train_loss: 0.2585, test_loss: 1.1832, test_f1: 0.6737
 epoch: 96, train_loss: 0.2495, test_loss: 1.1519, test_f1: 0.6782
 epoch: 97, train_loss: 0.2623, test_loss: 1.3698, test_f1: 0.6386
 epoch: 98, train_loss: 0.2608, test_loss: 1.1488, test_f1: 0.6647
 epoch: 99, train_loss: 0.2462, test_loss: 1.2044, test_f1: 0.6687
##################ITERATION #5 ****************************************
 epoch: 0, train_loss: 1.2365, test_loss: 1.0409, test_f1: 0.4776
 epoch: 1, train_loss: 1.0093, test_loss: 0.9682, test_f1: 0.4885
 epoch: 2, train_loss: 0.9552, test_loss: 0.9776, test_f1: 0.5184
 epoch: 3, train_loss: 0.9168, test_loss: 0.9351, test_f1: 0.5146
 epoch: 4, train_loss: 0.9024, test_loss: 0.8966, test_f1: 0.5606
 epoch: 5, train_loss: 0.8570, test_loss: 0.9294, test_f1: 0.5832
 epoch: 6, train_loss: 0.8478, test_loss: 0.9440, test_f1: 0.5628
 epoch: 7, train_loss: 0.8324, test_loss: 0.9029, test_f1: 0.5844
 epoch: 8, train_loss: 0.8033, test_loss: 0.9377, test_f1: 0.5327
 epoch: 9, train_loss: 0.7923, test_loss: 0.8330, test_f1: 0.5825
 epoch: 10, train_loss: 0.7785, test_loss: 0.8023, test_f1: 0.5883
 epoch: 11, train_loss: 0.7601, test_loss: 0.8803, test_f1: 0.5974
 epoch: 12, train_loss: 0.7532, test_loss: 0.8465, test_f1: 0.5879
 epoch: 13, train_loss: 0.7359, test_loss: 0.7774, test_f1: 0.6130
 epoch: 14, train_loss: 0.7162, test_loss: 1.1004, test_f1: 0.5367
 epoch: 15, train_loss: 0.7325, test_loss: 0.9971, test_f1: 0.5529
 epoch: 16, train_loss: 0.7152, test_loss: 0.8552, test_f1: 0.5837
 epoch: 17, train_loss: 0.7060, test_loss: 0.7915, test_f1: 0.6342
 epoch: 18, train_loss: 0.6810, test_loss: 0.8559, test_f1: 0.6152
 epoch: 19, train_loss: 0.6662, test_loss: 0.7985, test_f1: 0.6432
 epoch: 20, train_loss: 0.6844, test_loss: 0.8523, test_f1: 0.6124
 epoch: 21, train_loss: 0.6636, test_loss: 0.7575, test_f1: 0.6286
 epoch: 22, train_loss: 0.6650, test_loss: 0.8400, test_f1: 0.5975
 epoch: 23, train_loss: 0.6403, test_loss: 0.8119, test_f1: 0.6474
 epoch: 24, train_loss: 0.6475, test_loss: 0.8092, test_f1: 0.6326
 epoch: 25, train_loss: 0.6138, test_loss: 0.8049, test_f1: 0.6459
 epoch: 26, train_loss: 0.6138, test_loss: 0.8896, test_f1: 0.6083
 epoch: 27, train_loss: 0.6064, test_loss: 0.7811, test_f1: 0.6445
 epoch: 28, train_loss: 0.6014, test_loss: 0.8712, test_f1: 0.6169
 epoch: 29, train_loss: 0.5868, test_loss: 0.8366, test_f1: 0.6605
 epoch: 30, train_loss: 0.5946, test_loss: 0.9054, test_f1: 0.6175
 epoch: 31, train_loss: 0.6176, test_loss: 0.8290, test_f1: 0.6402
 epoch: 32, train_loss: 0.5843, test_loss: 0.8019, test_f1: 0.6465
 epoch: 33, train_loss: 0.5746, test_loss: 0.8402, test_f1: 0.6441
 epoch: 34, train_loss: 0.5547, test_loss: 0.8161, test_f1: 0.6114
 epoch: 35, train_loss: 0.5728, test_loss: 0.8102, test_f1: 0.6442
 epoch: 36, train_loss: 0.5614, test_loss: 0.8352, test_f1: 0.6560
 epoch: 37, train_loss: 0.5511, test_loss: 0.9742, test_f1: 0.6096
 epoch: 38, train_loss: 0.5428, test_loss: 0.8596, test_f1: 0.6464
 epoch: 39, train_loss: 0.5427, test_loss: 0.8734, test_f1: 0.6432
 epoch: 40, train_loss: 0.5128, test_loss: 0.8588, test_f1: 0.6609
 epoch: 41, train_loss: 0.5158, test_loss: 0.9562, test_f1: 0.6283
 epoch: 42, train_loss: 0.5137, test_loss: 0.7511, test_f1: 0.6913
 epoch: 43, train_loss: 0.4989, test_loss: 0.8728, test_f1: 0.6395
 epoch: 44, train_loss: 0.5021, test_loss: 0.8566, test_f1: 0.6531
 epoch: 45, train_loss: 0.4925, test_loss: 0.8228, test_f1: 0.6606
 epoch: 46, train_loss: 0.5091, test_loss: 0.8907, test_f1: 0.6126
 epoch: 47, train_loss: 0.4624, test_loss: 0.8431, test_f1: 0.6388
 epoch: 48, train_loss: 0.4897, test_loss: 0.9200, test_f1: 0.6458
 epoch: 49, train_loss: 0.4825, test_loss: 0.8920, test_f1: 0.6352
 epoch: 50, train_loss: 0.4586, test_loss: 0.9086, test_f1: 0.6490
 epoch: 51, train_loss: 0.4386, test_loss: 0.8983, test_f1: 0.6312
 epoch: 52, train_loss: 0.4175, test_loss: 0.9367, test_f1: 0.6590
 epoch: 53, train_loss: 0.4137, test_loss: 0.9265, test_f1: 0.6667
 epoch: 54, train_loss: 0.4108, test_loss: 0.9220, test_f1: 0.6629
 epoch: 55, train_loss: 0.4025, test_loss: 0.9080, test_f1: 0.6666
 epoch: 56, train_loss: 0.3998, test_loss: 0.8462, test_f1: 0.6701
 epoch: 57, train_loss: 0.3974, test_loss: 0.8566, test_f1: 0.6742
 epoch: 58, train_loss: 0.3927, test_loss: 0.9234, test_f1: 0.6959
 epoch: 59, train_loss: 0.3692, test_loss: 0.8832, test_f1: 0.6761
 epoch: 60, train_loss: 0.3769, test_loss: 0.9467, test_f1: 0.6738
 epoch: 61, train_loss: 0.3697, test_loss: 0.8980, test_f1: 0.6692
 epoch: 62, train_loss: 0.3850, test_loss: 0.9523, test_f1: 0.6622
 epoch: 63, train_loss: 0.3719, test_loss: 0.9244, test_f1: 0.6783
 epoch: 64, train_loss: 0.3646, test_loss: 1.0200, test_f1: 0.6536
 epoch: 65, train_loss: 0.3701, test_loss: 0.9078, test_f1: 0.6688
 epoch: 66, train_loss: 0.3655, test_loss: 1.0113, test_f1: 0.6513
 epoch: 67, train_loss: 0.3572, test_loss: 0.9881, test_f1: 0.6730
 epoch: 68, train_loss: 0.3402, test_loss: 1.0267, test_f1: 0.6548
 epoch: 69, train_loss: 0.3546, test_loss: 1.0030, test_f1: 0.6671
 epoch: 70, train_loss: 0.3446, test_loss: 0.9619, test_f1: 0.6770
 epoch: 71, train_loss: 0.3361, test_loss: 0.9458, test_f1: 0.6611
 epoch: 72, train_loss: 0.3421, test_loss: 1.0388, test_f1: 0.6362
 epoch: 73, train_loss: 0.3220, test_loss: 1.0586, test_f1: 0.6838
 epoch: 74, train_loss: 0.3161, test_loss: 1.1110, test_f1: 0.6644
 epoch: 75, train_loss: 0.3441, test_loss: 1.0635, test_f1: 0.6692
 epoch: 76, train_loss: 0.3397, test_loss: 1.0485, test_f1: 0.6677
 epoch: 77, train_loss: 0.3198, test_loss: 1.0877, test_f1: 0.6714
 epoch: 78, train_loss: 0.3237, test_loss: 1.1703, test_f1: 0.6276
 epoch: 79, train_loss: 0.3023, test_loss: 1.1133, test_f1: 0.6563
 epoch: 80, train_loss: 0.3188, test_loss: 1.1166, test_f1: 0.6731
 epoch: 81, train_loss: 0.3320, test_loss: 1.0672, test_f1: 0.6852
 epoch: 82, train_loss: 0.3289, test_loss: 1.0586, test_f1: 0.6840
 epoch: 83, train_loss: 0.3105, test_loss: 1.1027, test_f1: 0.6595
 epoch: 84, train_loss: 0.3169, test_loss: 1.0754, test_f1: 0.6750
 epoch: 85, train_loss: 0.3015, test_loss: 1.1024, test_f1: 0.6384
 epoch: 86, train_loss: 0.3051, test_loss: 1.0904, test_f1: 0.6759
 epoch: 87, train_loss: 0.3145, test_loss: 1.0419, test_f1: 0.6609
 epoch: 88, train_loss: 0.2896, test_loss: 1.1492, test_f1: 0.6487
 epoch: 89, train_loss: 0.2946, test_loss: 1.1395, test_f1: 0.6746
 epoch: 90, train_loss: 0.2982, test_loss: 1.1588, test_f1: 0.6707
 epoch: 91, train_loss: 0.2788, test_loss: 1.1283, test_f1: 0.6575
 epoch: 92, train_loss: 0.2756, test_loss: 1.1526, test_f1: 0.6758
 epoch: 93, train_loss: 0.2775, test_loss: 1.1712, test_f1: 0.6600
 epoch: 94, train_loss: 0.2970, test_loss: 1.1232, test_f1: 0.6932
 epoch: 95, train_loss: 0.2750, test_loss: 1.1536, test_f1: 0.6583
 epoch: 96, train_loss: 0.2708, test_loss: 1.1953, test_f1: 0.6870
 epoch: 97, train_loss: 0.3029, test_loss: 1.0154, test_f1: 0.7082
 epoch: 98, train_loss: 0.2629, test_loss: 1.1099, test_f1: 0.6740
 epoch: 99, train_loss: 0.2723, test_loss: 1.1989, test_f1: 0.6539
##################ITERATION #6 ****************************************
 epoch: 0, train_loss: 1.3797, test_loss: 1.0443, test_f1: 0.4103
 epoch: 1, train_loss: 1.0270, test_loss: 0.9864, test_f1: 0.4907
 epoch: 2, train_loss: 0.9896, test_loss: 0.9652, test_f1: 0.4978
 epoch: 3, train_loss: 0.9483, test_loss: 0.9819, test_f1: 0.4971
 epoch: 4, train_loss: 0.9288, test_loss: 0.9500, test_f1: 0.5104
 epoch: 5, train_loss: 0.9041, test_loss: 0.9404, test_f1: 0.5458
 epoch: 6, train_loss: 0.8792, test_loss: 0.8969, test_f1: 0.5656
 epoch: 7, train_loss: 0.8710, test_loss: 0.8765, test_f1: 0.5681
 epoch: 8, train_loss: 0.8517, test_loss: 0.8185, test_f1: 0.5767
 epoch: 9, train_loss: 0.8549, test_loss: 0.8451, test_f1: 0.5757
 epoch: 10, train_loss: 0.8198, test_loss: 0.8194, test_f1: 0.5821
 epoch: 11, train_loss: 0.8174, test_loss: 0.8601, test_f1: 0.5922
 epoch: 12, train_loss: 0.8088, test_loss: 0.8256, test_f1: 0.5678
 epoch: 13, train_loss: 0.7919, test_loss: 0.8153, test_f1: 0.5991
 epoch: 14, train_loss: 0.7847, test_loss: 0.7883, test_f1: 0.6230
 epoch: 15, train_loss: 0.7683, test_loss: 0.8478, test_f1: 0.5919
 epoch: 16, train_loss: 0.7568, test_loss: 0.9787, test_f1: 0.5441
 epoch: 17, train_loss: 0.7500, test_loss: 0.7698, test_f1: 0.6234
 epoch: 18, train_loss: 0.7155, test_loss: 0.8926, test_f1: 0.5765
 epoch: 19, train_loss: 0.7226, test_loss: 0.8729, test_f1: 0.6105
 epoch: 20, train_loss: 0.7068, test_loss: 0.8602, test_f1: 0.6031
 epoch: 21, train_loss: 0.6908, test_loss: 0.8772, test_f1: 0.5884
 epoch: 22, train_loss: 0.7011, test_loss: 0.7819, test_f1: 0.6146
 epoch: 23, train_loss: 0.6806, test_loss: 0.7807, test_f1: 0.6404
 epoch: 24, train_loss: 0.6728, test_loss: 0.8179, test_f1: 0.6035
 epoch: 25, train_loss: 0.6627, test_loss: 0.7838, test_f1: 0.6175
 epoch: 26, train_loss: 0.6574, test_loss: 0.9211, test_f1: 0.6289
 epoch: 27, train_loss: 0.6559, test_loss: 0.7976, test_f1: 0.6236
 epoch: 28, train_loss: 0.6473, test_loss: 0.9029, test_f1: 0.5917
 epoch: 29, train_loss: 0.6304, test_loss: 0.8099, test_f1: 0.6283
 epoch: 30, train_loss: 0.6245, test_loss: 0.7904, test_f1: 0.6290
 epoch: 31, train_loss: 0.6462, test_loss: 0.8174, test_f1: 0.6304
 epoch: 32, train_loss: 0.5915, test_loss: 0.7680, test_f1: 0.6363
 epoch: 33, train_loss: 0.6122, test_loss: 0.7732, test_f1: 0.6574
 epoch: 34, train_loss: 0.5934, test_loss: 0.8261, test_f1: 0.6265
 epoch: 35, train_loss: 0.5921, test_loss: 0.7676, test_f1: 0.6460
 epoch: 36, train_loss: 0.5822, test_loss: 0.9150, test_f1: 0.5879
 epoch: 37, train_loss: 0.5970, test_loss: 1.0774, test_f1: 0.5831
 epoch: 38, train_loss: 0.5728, test_loss: 0.8187, test_f1: 0.6443
 epoch: 39, train_loss: 0.5784, test_loss: 0.7966, test_f1: 0.6282
 epoch: 40, train_loss: 0.5451, test_loss: 0.8569, test_f1: 0.6208
 epoch: 41, train_loss: 0.5804, test_loss: 0.8487, test_f1: 0.6065
 epoch: 42, train_loss: 0.5534, test_loss: 1.0418, test_f1: 0.6144
 epoch: 43, train_loss: 0.5677, test_loss: 0.7977, test_f1: 0.6526
 epoch: 44, train_loss: 0.5230, test_loss: 0.8001, test_f1: 0.6665
 epoch: 45, train_loss: 0.5127, test_loss: 0.9165, test_f1: 0.6373
 epoch: 46, train_loss: 0.5286, test_loss: 0.8500, test_f1: 0.6432
 epoch: 47, train_loss: 0.5132, test_loss: 0.9137, test_f1: 0.6350
 epoch: 48, train_loss: 0.5019, test_loss: 0.9149, test_f1: 0.6470
 epoch: 49, train_loss: 0.5011, test_loss: 0.8814, test_f1: 0.6281
 epoch: 50, train_loss: 0.5007, test_loss: 0.9206, test_f1: 0.6435
 epoch: 51, train_loss: 0.4537, test_loss: 0.8372, test_f1: 0.6583
 epoch: 52, train_loss: 0.4478, test_loss: 0.9064, test_f1: 0.6604
 epoch: 53, train_loss: 0.4454, test_loss: 0.9383, test_f1: 0.6437
 epoch: 54, train_loss: 0.4404, test_loss: 0.8319, test_f1: 0.6825
 epoch: 55, train_loss: 0.4190, test_loss: 0.8565, test_f1: 0.6612
 epoch: 56, train_loss: 0.4099, test_loss: 0.8921, test_f1: 0.6796
 epoch: 57, train_loss: 0.4022, test_loss: 0.8523, test_f1: 0.6606
 epoch: 58, train_loss: 0.4070, test_loss: 0.8716, test_f1: 0.6564
 epoch: 59, train_loss: 0.3902, test_loss: 0.8513, test_f1: 0.6864
 epoch: 60, train_loss: 0.4081, test_loss: 0.9165, test_f1: 0.6440
 epoch: 61, train_loss: 0.3878, test_loss: 0.9092, test_f1: 0.6672
 epoch: 62, train_loss: 0.4004, test_loss: 0.9699, test_f1: 0.6398
 epoch: 63, train_loss: 0.4004, test_loss: 0.9262, test_f1: 0.6779
 epoch: 64, train_loss: 0.3916, test_loss: 0.8976, test_f1: 0.6926
 epoch: 65, train_loss: 0.3734, test_loss: 0.9260, test_f1: 0.6651
 epoch: 66, train_loss: 0.3841, test_loss: 0.9456, test_f1: 0.6677
 epoch: 67, train_loss: 0.3909, test_loss: 1.0358, test_f1: 0.6566
 epoch: 68, train_loss: 0.3911, test_loss: 0.9527, test_f1: 0.6998
 epoch: 69, train_loss: 0.3874, test_loss: 0.9811, test_f1: 0.6642
 epoch: 70, train_loss: 0.3701, test_loss: 1.1402, test_f1: 0.6490
 epoch: 71, train_loss: 0.3642, test_loss: 0.9474, test_f1: 0.6939
 epoch: 72, train_loss: 0.3614, test_loss: 0.9513, test_f1: 0.6892
 epoch: 73, train_loss: 0.3641, test_loss: 1.0122, test_f1: 0.6588
 epoch: 74, train_loss: 0.3682, test_loss: 0.9676, test_f1: 0.6598
 epoch: 75, train_loss: 0.3634, test_loss: 0.9766, test_f1: 0.6538
 epoch: 76, train_loss: 0.3364, test_loss: 1.0324, test_f1: 0.6745
 epoch: 77, train_loss: 0.3465, test_loss: 0.9857, test_f1: 0.6776
 epoch: 78, train_loss: 0.3402, test_loss: 1.0740, test_f1: 0.6781
 epoch: 79, train_loss: 0.3347, test_loss: 1.0248, test_f1: 0.6594
 epoch: 80, train_loss: 0.3396, test_loss: 1.0312, test_f1: 0.6500
 epoch: 81, train_loss: 0.3231, test_loss: 1.1237, test_f1: 0.6547
 epoch: 82, train_loss: 0.3404, test_loss: 1.1194, test_f1: 0.6575
 epoch: 83, train_loss: 0.3271, test_loss: 1.0701, test_f1: 0.6635
 epoch: 84, train_loss: 0.3490, test_loss: 0.9878, test_f1: 0.6947
 epoch: 85, train_loss: 0.3440, test_loss: 1.0853, test_f1: 0.6562
 epoch: 86, train_loss: 0.3359, test_loss: 1.0861, test_f1: 0.6733
 epoch: 87, train_loss: 0.3341, test_loss: 1.1182, test_f1: 0.6408
 epoch: 88, train_loss: 0.3360, test_loss: 1.0506, test_f1: 0.6783
 epoch: 89, train_loss: 0.3127, test_loss: 1.1717, test_f1: 0.6589
 epoch: 90, train_loss: 0.3258, test_loss: 1.2769, test_f1: 0.6142
 epoch: 91, train_loss: 0.3259, test_loss: 1.1511, test_f1: 0.6667
 epoch: 92, train_loss: 0.3182, test_loss: 1.1306, test_f1: 0.6485
 epoch: 93, train_loss: 0.3059, test_loss: 1.1245, test_f1: 0.6545
 epoch: 94, train_loss: 0.3142, test_loss: 1.2301, test_f1: 0.6260
 epoch: 95, train_loss: 0.2999, test_loss: 1.1522, test_f1: 0.6613
 epoch: 96, train_loss: 0.2918, test_loss: 1.1412, test_f1: 0.6514
 epoch: 97, train_loss: 0.2954, test_loss: 1.2101, test_f1: 0.6582
 epoch: 98, train_loss: 0.2974, test_loss: 1.1428, test_f1: 0.6896
 epoch: 99, train_loss: 0.2817, test_loss: 1.3298, test_f1: 0.6538
##################ITERATION #7 ****************************************
 epoch: 0, train_loss: 1.2420, test_loss: 1.0177, test_f1: 0.4618
 epoch: 1, train_loss: 1.0087, test_loss: 0.9450, test_f1: 0.5350
 epoch: 2, train_loss: 0.9659, test_loss: 0.9803, test_f1: 0.4940
 epoch: 3, train_loss: 0.9266, test_loss: 0.9296, test_f1: 0.5471
 epoch: 4, train_loss: 0.9066, test_loss: 0.8961, test_f1: 0.5317
 epoch: 5, train_loss: 0.8803, test_loss: 0.8460, test_f1: 0.5738
 epoch: 6, train_loss: 0.8715, test_loss: 0.9200, test_f1: 0.5470
 epoch: 7, train_loss: 0.8479, test_loss: 0.9238, test_f1: 0.5425
 epoch: 8, train_loss: 0.8436, test_loss: 0.9647, test_f1: 0.5315
 epoch: 9, train_loss: 0.8077, test_loss: 0.9449, test_f1: 0.5669
 epoch: 10, train_loss: 0.8033, test_loss: 0.8880, test_f1: 0.5743
 epoch: 11, train_loss: 0.7756, test_loss: 0.8655, test_f1: 0.5686
 epoch: 12, train_loss: 0.7671, test_loss: 0.8192, test_f1: 0.6238
 epoch: 13, train_loss: 0.7618, test_loss: 0.8546, test_f1: 0.5638
 epoch: 14, train_loss: 0.7376, test_loss: 0.8770, test_f1: 0.6175
 epoch: 15, train_loss: 0.7151, test_loss: 0.9002, test_f1: 0.5810
 epoch: 16, train_loss: 0.7092, test_loss: 0.8412, test_f1: 0.6313
 epoch: 17, train_loss: 0.7240, test_loss: 0.8969, test_f1: 0.6046
 epoch: 18, train_loss: 0.6955, test_loss: 0.8854, test_f1: 0.6197
 epoch: 19, train_loss: 0.6700, test_loss: 0.9537, test_f1: 0.6116
 epoch: 20, train_loss: 0.6758, test_loss: 0.8696, test_f1: 0.6129
 epoch: 21, train_loss: 0.6719, test_loss: 0.8955, test_f1: 0.6218
 epoch: 22, train_loss: 0.6396, test_loss: 0.9182, test_f1: 0.6050
 epoch: 23, train_loss: 0.6498, test_loss: 0.9445, test_f1: 0.5911
 epoch: 24, train_loss: 0.6344, test_loss: 0.9318, test_f1: 0.5970
 epoch: 25, train_loss: 0.6212, test_loss: 0.9322, test_f1: 0.6040
 epoch: 26, train_loss: 0.6338, test_loss: 0.9250, test_f1: 0.5939
 epoch: 27, train_loss: 0.6130, test_loss: 0.8597, test_f1: 0.6154
 epoch: 28, train_loss: 0.6030, test_loss: 0.8954, test_f1: 0.6002
 epoch: 29, train_loss: 0.5884, test_loss: 0.8542, test_f1: 0.6121
 epoch: 30, train_loss: 0.5845, test_loss: 0.9170, test_f1: 0.6250
 epoch: 31, train_loss: 0.5672, test_loss: 0.9212, test_f1: 0.6189
 epoch: 32, train_loss: 0.5822, test_loss: 1.0867, test_f1: 0.5961
 epoch: 33, train_loss: 0.5663, test_loss: 0.8815, test_f1: 0.6249
 epoch: 34, train_loss: 0.5476, test_loss: 0.9013, test_f1: 0.6270
 epoch: 35, train_loss: 0.5372, test_loss: 0.8707, test_f1: 0.6410
 epoch: 36, train_loss: 0.5284, test_loss: 0.9583, test_f1: 0.6418
 epoch: 37, train_loss: 0.5426, test_loss: 0.9943, test_f1: 0.5968
 epoch: 38, train_loss: 0.5560, test_loss: 0.9081, test_f1: 0.6240
 epoch: 39, train_loss: 0.5478, test_loss: 0.9862, test_f1: 0.6460
 epoch: 40, train_loss: 0.5082, test_loss: 1.0147, test_f1: 0.6165
 epoch: 41, train_loss: 0.5056, test_loss: 0.8666, test_f1: 0.6344
 epoch: 42, train_loss: 0.5173, test_loss: 0.8676, test_f1: 0.6378
 epoch: 43, train_loss: 0.5083, test_loss: 1.0082, test_f1: 0.6144
 epoch: 44, train_loss: 0.5062, test_loss: 0.9032, test_f1: 0.6281
 epoch: 45, train_loss: 0.4913, test_loss: 0.8754, test_f1: 0.6379
 epoch: 46, train_loss: 0.5058, test_loss: 0.9982, test_f1: 0.6377
 epoch: 47, train_loss: 0.4763, test_loss: 0.9256, test_f1: 0.6395
 epoch: 48, train_loss: 0.4885, test_loss: 1.0447, test_f1: 0.6226
 epoch: 49, train_loss: 0.4802, test_loss: 1.0703, test_f1: 0.6085
 epoch: 50, train_loss: 0.4566, test_loss: 1.0535, test_f1: 0.6213
 epoch: 51, train_loss: 0.4203, test_loss: 0.9767, test_f1: 0.6406
 epoch: 52, train_loss: 0.3870, test_loss: 0.9207, test_f1: 0.6724
 epoch: 53, train_loss: 0.3819, test_loss: 1.0075, test_f1: 0.6494
 epoch: 54, train_loss: 0.3954, test_loss: 1.0857, test_f1: 0.6206
 epoch: 55, train_loss: 0.3818, test_loss: 0.9543, test_f1: 0.6830
 epoch: 56, train_loss: 0.3705, test_loss: 0.9955, test_f1: 0.6630
 epoch: 57, train_loss: 0.3789, test_loss: 1.0364, test_f1: 0.6741
 epoch: 58, train_loss: 0.3800, test_loss: 1.0760, test_f1: 0.6521
 epoch: 59, train_loss: 0.3680, test_loss: 1.0038, test_f1: 0.6742
 epoch: 60, train_loss: 0.3551, test_loss: 0.9923, test_f1: 0.6715
 epoch: 61, train_loss: 0.3635, test_loss: 1.0713, test_f1: 0.6310
 epoch: 62, train_loss: 0.3665, test_loss: 1.0816, test_f1: 0.6683
 epoch: 63, train_loss: 0.3547, test_loss: 1.0110, test_f1: 0.6857
 epoch: 64, train_loss: 0.3618, test_loss: 1.0157, test_f1: 0.6598
 epoch: 65, train_loss: 0.3425, test_loss: 1.1626, test_f1: 0.6475
 epoch: 66, train_loss: 0.3595, test_loss: 1.1507, test_f1: 0.6269
 epoch: 67, train_loss: 0.3533, test_loss: 1.1380, test_f1: 0.6102
 epoch: 68, train_loss: 0.3501, test_loss: 1.0675, test_f1: 0.6459
 epoch: 69, train_loss: 0.3328, test_loss: 1.1317, test_f1: 0.6637
 epoch: 70, train_loss: 0.3452, test_loss: 1.0718, test_f1: 0.6646
 epoch: 71, train_loss: 0.3321, test_loss: 1.0897, test_f1: 0.6804
 epoch: 72, train_loss: 0.3326, test_loss: 1.0655, test_f1: 0.6653
 epoch: 73, train_loss: 0.3210, test_loss: 1.1993, test_f1: 0.6400
 epoch: 74, train_loss: 0.3342, test_loss: 1.0728, test_f1: 0.6846
 epoch: 75, train_loss: 0.3077, test_loss: 1.1937, test_f1: 0.6356
 epoch: 76, train_loss: 0.3371, test_loss: 1.0510, test_f1: 0.6583
 epoch: 77, train_loss: 0.3247, test_loss: 1.0679, test_f1: 0.6589
 epoch: 78, train_loss: 0.3304, test_loss: 1.1141, test_f1: 0.6481
 epoch: 79, train_loss: 0.3244, test_loss: 1.2343, test_f1: 0.6395
 epoch: 80, train_loss: 0.3146, test_loss: 1.2008, test_f1: 0.6549
 epoch: 81, train_loss: 0.3084, test_loss: 1.0693, test_f1: 0.6738
 epoch: 82, train_loss: 0.3076, test_loss: 1.2787, test_f1: 0.6033
 epoch: 83, train_loss: 0.3255, test_loss: 1.0948, test_f1: 0.6731
 epoch: 84, train_loss: 0.2960, test_loss: 1.1353, test_f1: 0.6434
 epoch: 85, train_loss: 0.3071, test_loss: 1.0718, test_f1: 0.6558
 epoch: 86, train_loss: 0.2829, test_loss: 1.1283, test_f1: 0.6436
 epoch: 87, train_loss: 0.2891, test_loss: 1.1566, test_f1: 0.6566
 epoch: 88, train_loss: 0.3180, test_loss: 1.1516, test_f1: 0.6624
 epoch: 89, train_loss: 0.2847, test_loss: 1.2386, test_f1: 0.6299
 epoch: 90, train_loss: 0.2936, test_loss: 1.2553, test_f1: 0.6273
 epoch: 91, train_loss: 0.2828, test_loss: 1.1974, test_f1: 0.6534
 epoch: 92, train_loss: 0.2767, test_loss: 1.3471, test_f1: 0.6342
 epoch: 93, train_loss: 0.2673, test_loss: 1.2319, test_f1: 0.6589
 epoch: 94, train_loss: 0.2916, test_loss: 1.2172, test_f1: 0.6560
 epoch: 95, train_loss: 0.2974, test_loss: 1.1042, test_f1: 0.6899
 epoch: 96, train_loss: 0.2747, test_loss: 1.1736, test_f1: 0.6460
 epoch: 97, train_loss: 0.2907, test_loss: 1.1817, test_f1: 0.6384
 epoch: 98, train_loss: 0.2718, test_loss: 1.2060, test_f1: 0.6737
 epoch: 99, train_loss: 0.2687, test_loss: 1.1913, test_f1: 0.6598
##################ITERATION #8 ****************************************
 epoch: 0, train_loss: 1.3005, test_loss: 0.9943, test_f1: 0.4344
 epoch: 1, train_loss: 1.0065, test_loss: 0.9464, test_f1: 0.5297
 epoch: 2, train_loss: 0.9574, test_loss: 0.8924, test_f1: 0.5232
 epoch: 3, train_loss: 0.9231, test_loss: 0.8503, test_f1: 0.5584
 epoch: 4, train_loss: 0.9075, test_loss: 0.8836, test_f1: 0.5604
 epoch: 5, train_loss: 0.8848, test_loss: 0.8707, test_f1: 0.5434
 epoch: 6, train_loss: 0.8649, test_loss: 0.8374, test_f1: 0.5718
 epoch: 7, train_loss: 0.8381, test_loss: 0.8428, test_f1: 0.5650
 epoch: 8, train_loss: 0.8381, test_loss: 0.8713, test_f1: 0.5682
 epoch: 9, train_loss: 0.8161, test_loss: 0.8893, test_f1: 0.5471
 epoch: 10, train_loss: 0.8103, test_loss: 0.8729, test_f1: 0.5529
 epoch: 11, train_loss: 0.7842, test_loss: 0.8131, test_f1: 0.6210
 epoch: 12, train_loss: 0.7865, test_loss: 0.8580, test_f1: 0.5965
 epoch: 13, train_loss: 0.7769, test_loss: 0.8826, test_f1: 0.5687
 epoch: 14, train_loss: 0.7585, test_loss: 0.9918, test_f1: 0.5446
 epoch: 15, train_loss: 0.7496, test_loss: 0.9292, test_f1: 0.5477
 epoch: 16, train_loss: 0.7360, test_loss: 0.9254, test_f1: 0.5892
 epoch: 17, train_loss: 0.7242, test_loss: 0.8977, test_f1: 0.5692
 epoch: 18, train_loss: 0.7081, test_loss: 0.8766, test_f1: 0.6119
 epoch: 19, train_loss: 0.7199, test_loss: 0.8860, test_f1: 0.5807
 epoch: 20, train_loss: 0.6946, test_loss: 0.8669, test_f1: 0.5826
 epoch: 21, train_loss: 0.6907, test_loss: 0.9420, test_f1: 0.5936
 epoch: 22, train_loss: 0.6792, test_loss: 0.8696, test_f1: 0.5877
 epoch: 23, train_loss: 0.6747, test_loss: 0.9950, test_f1: 0.5756
 epoch: 24, train_loss: 0.6598, test_loss: 0.9093, test_f1: 0.5716
 epoch: 25, train_loss: 0.6664, test_loss: 0.8746, test_f1: 0.5996
 epoch: 26, train_loss: 0.6567, test_loss: 0.8449, test_f1: 0.5888
 epoch: 27, train_loss: 0.6370, test_loss: 0.9046, test_f1: 0.5840
 epoch: 28, train_loss: 0.6262, test_loss: 0.9512, test_f1: 0.5775
 epoch: 29, train_loss: 0.6179, test_loss: 1.0979, test_f1: 0.5559
 epoch: 30, train_loss: 0.6172, test_loss: 0.8593, test_f1: 0.5998
 epoch: 31, train_loss: 0.6044, test_loss: 1.0003, test_f1: 0.5949
 epoch: 32, train_loss: 0.6099, test_loss: 0.8732, test_f1: 0.6388
 epoch: 33, train_loss: 0.5862, test_loss: 0.8508, test_f1: 0.6236
 epoch: 34, train_loss: 0.5902, test_loss: 0.9287, test_f1: 0.6194
 epoch: 35, train_loss: 0.5723, test_loss: 0.8238, test_f1: 0.6450
 epoch: 36, train_loss: 0.5725, test_loss: 0.8626, test_f1: 0.6362
 epoch: 37, train_loss: 0.5936, test_loss: 0.8899, test_f1: 0.6176
 epoch: 38, train_loss: 0.5589, test_loss: 0.8602, test_f1: 0.6593
 epoch: 39, train_loss: 0.5644, test_loss: 0.9774, test_f1: 0.5936
 epoch: 40, train_loss: 0.5390, test_loss: 0.8659, test_f1: 0.6221
 epoch: 41, train_loss: 0.5408, test_loss: 0.8080, test_f1: 0.6649
 epoch: 42, train_loss: 0.5299, test_loss: 0.8609, test_f1: 0.6368
 epoch: 43, train_loss: 0.5323, test_loss: 0.8719, test_f1: 0.6228
 epoch: 44, train_loss: 0.5253, test_loss: 0.8790, test_f1: 0.6480
 epoch: 45, train_loss: 0.5272, test_loss: 0.8966, test_f1: 0.6240
 epoch: 46, train_loss: 0.5177, test_loss: 0.8458, test_f1: 0.6284
 epoch: 47, train_loss: 0.5193, test_loss: 0.8058, test_f1: 0.6326
 epoch: 48, train_loss: 0.5132, test_loss: 0.8238, test_f1: 0.6538
 epoch: 49, train_loss: 0.4866, test_loss: 0.9482, test_f1: 0.6247
 epoch: 50, train_loss: 0.5255, test_loss: 0.8485, test_f1: 0.6423
 epoch: 51, train_loss: 0.4712, test_loss: 0.8951, test_f1: 0.6214
 epoch: 52, train_loss: 0.4280, test_loss: 0.8619, test_f1: 0.6547
 epoch: 53, train_loss: 0.4123, test_loss: 0.9085, test_f1: 0.6578
 epoch: 54, train_loss: 0.4115, test_loss: 0.9050, test_f1: 0.6621
 epoch: 55, train_loss: 0.4104, test_loss: 0.9221, test_f1: 0.6480
 epoch: 56, train_loss: 0.4110, test_loss: 0.9702, test_f1: 0.6549
 epoch: 57, train_loss: 0.4057, test_loss: 0.9993, test_f1: 0.6537
 epoch: 58, train_loss: 0.4112, test_loss: 0.9740, test_f1: 0.6333
 epoch: 59, train_loss: 0.3897, test_loss: 0.9961, test_f1: 0.6547
 epoch: 60, train_loss: 0.4068, test_loss: 1.0716, test_f1: 0.6125
 epoch: 61, train_loss: 0.3853, test_loss: 0.9734, test_f1: 0.6394
 epoch: 62, train_loss: 0.3891, test_loss: 0.9229, test_f1: 0.6589
 epoch: 63, train_loss: 0.3641, test_loss: 1.0171, test_f1: 0.6420
 epoch: 64, train_loss: 0.3809, test_loss: 0.9554, test_f1: 0.6706
 epoch: 65, train_loss: 0.3736, test_loss: 0.9813, test_f1: 0.6564
 epoch: 66, train_loss: 0.3767, test_loss: 0.9780, test_f1: 0.6443
 epoch: 67, train_loss: 0.3518, test_loss: 1.0283, test_f1: 0.6432
 epoch: 68, train_loss: 0.3580, test_loss: 0.9900, test_f1: 0.6734
 epoch: 69, train_loss: 0.3691, test_loss: 1.0679, test_f1: 0.6399
 epoch: 70, train_loss: 0.3827, test_loss: 1.0127, test_f1: 0.6542
 epoch: 71, train_loss: 0.3603, test_loss: 1.0415, test_f1: 0.6495
 epoch: 72, train_loss: 0.3674, test_loss: 1.0459, test_f1: 0.6359
 epoch: 73, train_loss: 0.3585, test_loss: 0.9933, test_f1: 0.6582
 epoch: 74, train_loss: 0.3495, test_loss: 0.9403, test_f1: 0.6849
 epoch: 75, train_loss: 0.3474, test_loss: 1.1684, test_f1: 0.6561
 epoch: 76, train_loss: 0.3565, test_loss: 1.1317, test_f1: 0.5953
 epoch: 77, train_loss: 0.3368, test_loss: 1.0862, test_f1: 0.6508
 epoch: 78, train_loss: 0.3612, test_loss: 1.1600, test_f1: 0.6482
 epoch: 79, train_loss: 0.3359, test_loss: 1.2199, test_f1: 0.6386
 epoch: 80, train_loss: 0.3302, test_loss: 1.2101, test_f1: 0.6202
 epoch: 81, train_loss: 0.3226, test_loss: 1.2066, test_f1: 0.6402
 epoch: 82, train_loss: 0.3215, test_loss: 1.2200, test_f1: 0.6257
 epoch: 83, train_loss: 0.3296, test_loss: 1.1281, test_f1: 0.6708
 epoch: 84, train_loss: 0.3344, test_loss: 1.0637, test_f1: 0.6482
 epoch: 85, train_loss: 0.3332, test_loss: 1.3048, test_f1: 0.6351
 epoch: 86, train_loss: 0.3361, test_loss: 1.2201, test_f1: 0.6131
 epoch: 87, train_loss: 0.3382, test_loss: 1.1055, test_f1: 0.6537
 epoch: 88, train_loss: 0.3343, test_loss: 1.1776, test_f1: 0.6457
 epoch: 89, train_loss: 0.3153, test_loss: 1.1578, test_f1: 0.6514
 epoch: 90, train_loss: 0.3043, test_loss: 1.2049, test_f1: 0.6251
 epoch: 91, train_loss: 0.3270, test_loss: 1.1414, test_f1: 0.6257
 epoch: 92, train_loss: 0.3357, test_loss: 0.9727, test_f1: 0.6548
 epoch: 93, train_loss: 0.3230, test_loss: 1.1197, test_f1: 0.6494
 epoch: 94, train_loss: 0.3002, test_loss: 1.1096, test_f1: 0.6392
 epoch: 95, train_loss: 0.3012, test_loss: 1.1166, test_f1: 0.6473
 epoch: 96, train_loss: 0.3052, test_loss: 1.1140, test_f1: 0.6534
 epoch: 97, train_loss: 0.3216, test_loss: 1.2119, test_f1: 0.6613
 epoch: 98, train_loss: 0.2845, test_loss: 1.0903, test_f1: 0.6628
 epoch: 99, train_loss: 0.2905, test_loss: 1.1983, test_f1: 0.6363
##################ITERATION #9 ****************************************
 epoch: 0, train_loss: 1.2767, test_loss: 1.0545, test_f1: 0.4104
 epoch: 1, train_loss: 1.0206, test_loss: 1.0335, test_f1: 0.5018
 epoch: 2, train_loss: 0.9717, test_loss: 0.9943, test_f1: 0.4991
 epoch: 3, train_loss: 0.9454, test_loss: 1.0103, test_f1: 0.5147
 epoch: 4, train_loss: 0.9068, test_loss: 0.9415, test_f1: 0.4963
 epoch: 5, train_loss: 0.8830, test_loss: 0.9944, test_f1: 0.4789
 epoch: 6, train_loss: 0.8728, test_loss: 0.9864, test_f1: 0.5309
 epoch: 7, train_loss: 0.8425, test_loss: 0.9752, test_f1: 0.5207
 epoch: 8, train_loss: 0.8361, test_loss: 1.0057, test_f1: 0.5469
 epoch: 9, train_loss: 0.8186, test_loss: 1.0503, test_f1: 0.5377
 epoch: 10, train_loss: 0.8023, test_loss: 0.9310, test_f1: 0.5259
 epoch: 11, train_loss: 0.7847, test_loss: 0.9263, test_f1: 0.5610
 epoch: 12, train_loss: 0.7904, test_loss: 0.9393, test_f1: 0.5469
 epoch: 13, train_loss: 0.7799, test_loss: 1.0058, test_f1: 0.5216
 epoch: 14, train_loss: 0.7671, test_loss: 0.8738, test_f1: 0.5645
 epoch: 15, train_loss: 0.7404, test_loss: 0.8915, test_f1: 0.5739
 epoch: 16, train_loss: 0.7348, test_loss: 0.9025, test_f1: 0.5694
 epoch: 17, train_loss: 0.7082, test_loss: 0.8741, test_f1: 0.5848
 epoch: 18, train_loss: 0.7120, test_loss: 0.9365, test_f1: 0.5954
 epoch: 19, train_loss: 0.7140, test_loss: 0.8920, test_f1: 0.5786
 epoch: 20, train_loss: 0.6966, test_loss: 0.9453, test_f1: 0.5402
 epoch: 21, train_loss: 0.6878, test_loss: 0.8713, test_f1: 0.5870
 epoch: 22, train_loss: 0.6871, test_loss: 0.8667, test_f1: 0.6352
 epoch: 23, train_loss: 0.6932, test_loss: 0.8650, test_f1: 0.6034
 epoch: 24, train_loss: 0.6613, test_loss: 0.9514, test_f1: 0.6038
 epoch: 25, train_loss: 0.6544, test_loss: 0.8539, test_f1: 0.6189
 epoch: 26, train_loss: 0.6553, test_loss: 0.9011, test_f1: 0.6095
 epoch: 27, train_loss: 0.6449, test_loss: 0.8025, test_f1: 0.6361
 epoch: 28, train_loss: 0.6443, test_loss: 0.9260, test_f1: 0.6162
 epoch: 29, train_loss: 0.6200, test_loss: 0.8619, test_f1: 0.6133
 epoch: 30, train_loss: 0.6233, test_loss: 0.8614, test_f1: 0.6048
 epoch: 31, train_loss: 0.6126, test_loss: 0.8292, test_f1: 0.6429
 epoch: 32, train_loss: 0.6002, test_loss: 0.9177, test_f1: 0.6356
 epoch: 33, train_loss: 0.6273, test_loss: 0.9711, test_f1: 0.6189
 epoch: 34, train_loss: 0.5786, test_loss: 0.9673, test_f1: 0.6069
 epoch: 35, train_loss: 0.5859, test_loss: 0.9320, test_f1: 0.6362
 epoch: 36, train_loss: 0.5825, test_loss: 0.9390, test_f1: 0.6160
 epoch: 37, train_loss: 0.5716, test_loss: 0.8397, test_f1: 0.6448
 epoch: 38, train_loss: 0.5730, test_loss: 0.9431, test_f1: 0.6154
 epoch: 39, train_loss: 0.5747, test_loss: 0.9121, test_f1: 0.6276
 epoch: 40, train_loss: 0.5729, test_loss: 0.9795, test_f1: 0.6085
 epoch: 41, train_loss: 0.5412, test_loss: 1.0080, test_f1: 0.6057
 epoch: 42, train_loss: 0.5551, test_loss: 0.9856, test_f1: 0.6094
 epoch: 43, train_loss: 0.5718, test_loss: 0.9719, test_f1: 0.6239
 epoch: 44, train_loss: 0.5495, test_loss: 0.9350, test_f1: 0.6536
 epoch: 45, train_loss: 0.5359, test_loss: 0.8728, test_f1: 0.6548
 epoch: 46, train_loss: 0.5393, test_loss: 0.9241, test_f1: 0.6391
 epoch: 47, train_loss: 0.5283, test_loss: 0.9618, test_f1: 0.6275
 epoch: 48, train_loss: 0.5344, test_loss: 0.8448, test_f1: 0.6449
 epoch: 49, train_loss: 0.5337, test_loss: 0.9787, test_f1: 0.6582
 epoch: 50, train_loss: 0.5080, test_loss: 0.9836, test_f1: 0.6425
 epoch: 51, train_loss: 0.4674, test_loss: 0.9626, test_f1: 0.6267
 epoch: 52, train_loss: 0.4322, test_loss: 1.0096, test_f1: 0.6426
 epoch: 53, train_loss: 0.4369, test_loss: 0.9787, test_f1: 0.6446
 epoch: 54, train_loss: 0.4332, test_loss: 0.9204, test_f1: 0.6503
 epoch: 55, train_loss: 0.4262, test_loss: 1.0496, test_f1: 0.6266
 epoch: 56, train_loss: 0.4248, test_loss: 0.8948, test_f1: 0.6585
 epoch: 57, train_loss: 0.4276, test_loss: 0.9983, test_f1: 0.6601
 epoch: 58, train_loss: 0.4374, test_loss: 1.0021, test_f1: 0.6551
 epoch: 59, train_loss: 0.4084, test_loss: 1.0846, test_f1: 0.6286
 epoch: 60, train_loss: 0.4099, test_loss: 1.0638, test_f1: 0.6190
 epoch: 61, train_loss: 0.3980, test_loss: 1.0730, test_f1: 0.6379
 epoch: 62, train_loss: 0.3924, test_loss: 1.0240, test_f1: 0.6345
 epoch: 63, train_loss: 0.4040, test_loss: 0.9460, test_f1: 0.6636
 epoch: 64, train_loss: 0.4116, test_loss: 1.0492, test_f1: 0.6351
 epoch: 65, train_loss: 0.4049, test_loss: 1.0795, test_f1: 0.6448
 epoch: 66, train_loss: 0.3950, test_loss: 1.0476, test_f1: 0.6483
 epoch: 67, train_loss: 0.3875, test_loss: 0.9709, test_f1: 0.6663
 epoch: 68, train_loss: 0.3958, test_loss: 1.0413, test_f1: 0.6632
 epoch: 69, train_loss: 0.3852, test_loss: 1.1740, test_f1: 0.6455
 epoch: 70, train_loss: 0.3838, test_loss: 1.0063, test_f1: 0.6489
 epoch: 71, train_loss: 0.3838, test_loss: 1.1296, test_f1: 0.6308
 epoch: 72, train_loss: 0.3737, test_loss: 1.0983, test_f1: 0.6505
 epoch: 73, train_loss: 0.3920, test_loss: 1.0304, test_f1: 0.6581
 epoch: 74, train_loss: 0.3700, test_loss: 1.0115, test_f1: 0.6407
 epoch: 75, train_loss: 0.3829, test_loss: 1.0979, test_f1: 0.6523
 epoch: 76, train_loss: 0.3436, test_loss: 1.1662, test_f1: 0.6356
 epoch: 77, train_loss: 0.3697, test_loss: 1.2159, test_f1: 0.6254
 epoch: 78, train_loss: 0.3833, test_loss: 1.0291, test_f1: 0.6881
 epoch: 79, train_loss: 0.3663, test_loss: 1.1609, test_f1: 0.6583
 epoch: 80, train_loss: 0.3559, test_loss: 1.1726, test_f1: 0.6813
 epoch: 81, train_loss: 0.3353, test_loss: 1.1966, test_f1: 0.6406
 epoch: 82, train_loss: 0.3449, test_loss: 1.1603, test_f1: 0.6411
 epoch: 83, train_loss: 0.3584, test_loss: 1.1681, test_f1: 0.6248
 epoch: 84, train_loss: 0.3410, test_loss: 1.2873, test_f1: 0.6422
 epoch: 85, train_loss: 0.3457, test_loss: 1.1887, test_f1: 0.6627
 epoch: 86, train_loss: 0.3466, test_loss: 1.1911, test_f1: 0.6584
 epoch: 87, train_loss: 0.3439, test_loss: 1.3634, test_f1: 0.6139
 epoch: 88, train_loss: 0.3196, test_loss: 1.0934, test_f1: 0.6774
 epoch: 89, train_loss: 0.3366, test_loss: 1.1540, test_f1: 0.6479
 epoch: 90, train_loss: 0.3329, test_loss: 1.1984, test_f1: 0.6732
 epoch: 91, train_loss: 0.3171, test_loss: 1.1790, test_f1: 0.6428
 epoch: 92, train_loss: 0.3316, test_loss: 1.4345, test_f1: 0.6357
 epoch: 93, train_loss: 0.3345, test_loss: 1.2828, test_f1: 0.6155
 epoch: 94, train_loss: 0.3322, test_loss: 1.2139, test_f1: 0.6674
 epoch: 95, train_loss: 0.3182, test_loss: 1.2672, test_f1: 0.6492
 epoch: 96, train_loss: 0.3167, test_loss: 1.2421, test_f1: 0.6657
 epoch: 97, train_loss: 0.3268, test_loss: 1.2543, test_f1: 0.6767
 epoch: 98, train_loss: 0.2957, test_loss: 1.3610, test_f1: 0.6579
 epoch: 99, train_loss: 0.3248, test_loss: 1.2198, test_f1: 0.6525

Training completed in 639.56 seconds
Best F1: 0.7108 at epoch 94
Mean F1 across iterations: 0.6918  0.0133
========================FINAL RESULTS================================
FEGIN weighted F1: 0.7108  0.0133
python main.py --data ltspice_examples --representation component_pin --model FEGIN --layers 3 --hiddens 64 --batch_size 64 --lr 0.001 --emb_size 250 --epochs 100 --save_appendix component_pin_L3_H64_BS64_LR0.001_E250 --no_val
-----



STDERR:
  File "main.py", line 370, in <module>
    main()
  File "main.py", line 254, in main
    dataset = dataset_class(
  File "/home/philip/projects/ltspice_examples_code_repo/Circuit-Completion-Using-GNNs/component_classification_with_link_prediction_head/evaluation/FEGIN/kernel/circuit_datasets.py", line 15, in __init__
    self.data, self.slices = torch.load(self.processed_paths[0])
  File "/home/philip/.local/lib/python3.8/site-packages/torch/serialization.py", line 1040, in load
    warnings.warn(
  File "/usr/lib/python3.8/warnings.py", line 109, in _showwarnmsg
    sw(msg.message, msg.category, msg.filename, msg.lineno,
  File "main.py", line 47, in warn_with_traceback
    traceback.print_stack(file=log)
/home/philip/projects/ltspice_examples_code_repo/Circuit-Completion-Using-GNNs/component_classification_with_link_prediction_head/evaluation/FEGIN/kernel/circuit_datasets.py:15: FutureWarning: You are using `torch.load` with `weights_only=False` (the current default value), which uses the default pickle module implicitly. It is possible to construct malicious pickle data which will execute arbitrary code during unpickling (See https://github.com/pytorch/pytorch/blob/main/SECURITY.md#untrusted-models for more details). In a future release, the default value for `weights_only` will be flipped to `True`. This limits the functions that could be executed during unpickling. Arbitrary objects will no longer be allowed to be loaded via this mode unless they are explicitly allowlisted by the user via `torch.serialization.add_safe_globals`. We recommend you start setting `weights_only=True` for any use case where you don't have full control of the loaded file. Please open an issue on GitHub for any issues related to this experimental feature.
  self.data, self.slices = torch.load(self.processed_paths[0])
