STDOUT:
Results will be saved in /home/philip/projects/llm_inference_code_repo/Circuit-Completion-Using-GNNs/component_classification_with_link_prediction_head/evaluation/FEGIN/results/model_FEGIN_dataset_ltspice_examples
Command line input: python main.py --data ltspice_examples --representation component_net --model FEGIN --layers 2 --hiddens 128 --batch_size 64 --lr 0.0001 --emb_size 128 --epochs 100 --save_appendix component_net_L2_H128_BS64_LR0.0001_E128 --no_val
 is saved.
-----
ltspice_examples - FEGIN
Using 2 layers, 128 hidden units, h = 2
Loading component_net representation dataset
ENTERED
Training FEGIN on component_net representation
Train: 3558, Test: 846
##################ITERATION #0 ****************************************
 epoch: 0, train_loss: 1.3573, test_loss: 1.3310, test_f1: 0.2270
 epoch: 1, train_loss: 1.2946, test_loss: 1.2732, test_f1: 0.2270
 epoch: 2, train_loss: 1.2542, test_loss: 1.2322, test_f1: 0.2747
 epoch: 3, train_loss: 1.2176, test_loss: 1.1893, test_f1: 0.3243
 epoch: 4, train_loss: 1.1884, test_loss: 1.1462, test_f1: 0.3962
 epoch: 5, train_loss: 1.1471, test_loss: 1.0973, test_f1: 0.4510
 epoch: 6, train_loss: 1.1061, test_loss: 1.0576, test_f1: 0.4683
 epoch: 7, train_loss: 1.0679, test_loss: 1.0124, test_f1: 0.4766
 epoch: 8, train_loss: 1.0306, test_loss: 0.9802, test_f1: 0.4823
 epoch: 9, train_loss: 1.0021, test_loss: 0.9737, test_f1: 0.4910
 epoch: 10, train_loss: 0.9748, test_loss: 0.9560, test_f1: 0.4890
 epoch: 11, train_loss: 0.9562, test_loss: 0.9184, test_f1: 0.5242
 epoch: 12, train_loss: 0.9523, test_loss: 0.9138, test_f1: 0.5065
 epoch: 13, train_loss: 0.9375, test_loss: 0.9238, test_f1: 0.5125
 epoch: 14, train_loss: 0.9231, test_loss: 0.9065, test_f1: 0.5264
 epoch: 15, train_loss: 0.9236, test_loss: 0.8867, test_f1: 0.5332
 epoch: 16, train_loss: 0.9025, test_loss: 0.8923, test_f1: 0.5377
 epoch: 17, train_loss: 0.8996, test_loss: 0.8798, test_f1: 0.5556
 epoch: 18, train_loss: 0.8934, test_loss: 0.8781, test_f1: 0.5392
 epoch: 19, train_loss: 0.8826, test_loss: 0.8849, test_f1: 0.5290
 epoch: 20, train_loss: 0.8764, test_loss: 0.8499, test_f1: 0.5646
 epoch: 21, train_loss: 0.8720, test_loss: 0.8792, test_f1: 0.5466
 epoch: 22, train_loss: 0.8618, test_loss: 0.8721, test_f1: 0.5370
 epoch: 23, train_loss: 0.8550, test_loss: 0.8862, test_f1: 0.5240
 epoch: 24, train_loss: 0.8469, test_loss: 0.8575, test_f1: 0.5529
 epoch: 25, train_loss: 0.8455, test_loss: 0.8743, test_f1: 0.5399
 epoch: 26, train_loss: 0.8391, test_loss: 0.8678, test_f1: 0.5447
 epoch: 27, train_loss: 0.8409, test_loss: 0.8732, test_f1: 0.5468
 epoch: 28, train_loss: 0.8264, test_loss: 0.8680, test_f1: 0.5623
 epoch: 29, train_loss: 0.8137, test_loss: 0.8541, test_f1: 0.5375
 epoch: 30, train_loss: 0.8172, test_loss: 0.8291, test_f1: 0.5708
 epoch: 31, train_loss: 0.8179, test_loss: 0.8511, test_f1: 0.5466
 epoch: 32, train_loss: 0.8081, test_loss: 0.8751, test_f1: 0.5610
 epoch: 33, train_loss: 0.7987, test_loss: 0.9093, test_f1: 0.5514
 epoch: 34, train_loss: 0.7926, test_loss: 0.8525, test_f1: 0.5706
 epoch: 35, train_loss: 0.7873, test_loss: 0.8678, test_f1: 0.5892
 epoch: 36, train_loss: 0.7802, test_loss: 0.8816, test_f1: 0.5718
 epoch: 37, train_loss: 0.7844, test_loss: 0.8797, test_f1: 0.5627
 epoch: 38, train_loss: 0.7663, test_loss: 0.8855, test_f1: 0.5578
 epoch: 39, train_loss: 0.7713, test_loss: 0.9061, test_f1: 0.5741
 epoch: 40, train_loss: 0.7687, test_loss: 0.8505, test_f1: 0.5916
 epoch: 41, train_loss: 0.7652, test_loss: 0.8490, test_f1: 0.5901
 epoch: 42, train_loss: 0.7601, test_loss: 0.8556, test_f1: 0.5998
 epoch: 43, train_loss: 0.7565, test_loss: 0.8941, test_f1: 0.5874
 epoch: 44, train_loss: 0.7500, test_loss: 0.8783, test_f1: 0.5997
 epoch: 45, train_loss: 0.7483, test_loss: 0.8507, test_f1: 0.5848
 epoch: 46, train_loss: 0.7437, test_loss: 0.8816, test_f1: 0.5929
 epoch: 47, train_loss: 0.7361, test_loss: 0.8699, test_f1: 0.6101
 epoch: 48, train_loss: 0.7322, test_loss: 0.8736, test_f1: 0.5941
 epoch: 49, train_loss: 0.7339, test_loss: 0.8861, test_f1: 0.6030
 epoch: 50, train_loss: 0.7262, test_loss: 0.9026, test_f1: 0.6072
 epoch: 51, train_loss: 0.7259, test_loss: 0.8500, test_f1: 0.6269
 epoch: 52, train_loss: 0.7110, test_loss: 0.8816, test_f1: 0.6167
 epoch: 53, train_loss: 0.7169, test_loss: 0.8818, test_f1: 0.6148
 epoch: 54, train_loss: 0.7053, test_loss: 0.8601, test_f1: 0.6218
 epoch: 55, train_loss: 0.7074, test_loss: 0.8855, test_f1: 0.6163
 epoch: 56, train_loss: 0.7092, test_loss: 0.8839, test_f1: 0.6277
 epoch: 57, train_loss: 0.7067, test_loss: 0.8750, test_f1: 0.6237
 epoch: 58, train_loss: 0.6984, test_loss: 0.8432, test_f1: 0.6284
 epoch: 59, train_loss: 0.6938, test_loss: 0.8769, test_f1: 0.6241
 epoch: 60, train_loss: 0.6898, test_loss: 0.8768, test_f1: 0.6197
 epoch: 61, train_loss: 0.6864, test_loss: 0.8741, test_f1: 0.6241
 epoch: 62, train_loss: 0.6887, test_loss: 0.8756, test_f1: 0.6081
 epoch: 63, train_loss: 0.6897, test_loss: 0.8885, test_f1: 0.6263
 epoch: 64, train_loss: 0.6916, test_loss: 0.8871, test_f1: 0.6222
 epoch: 65, train_loss: 0.6910, test_loss: 0.8811, test_f1: 0.6287
 epoch: 66, train_loss: 0.6758, test_loss: 0.9252, test_f1: 0.6143
 epoch: 67, train_loss: 0.6785, test_loss: 0.8773, test_f1: 0.6115
 epoch: 68, train_loss: 0.6820, test_loss: 0.8860, test_f1: 0.6195
 epoch: 69, train_loss: 0.6707, test_loss: 0.8769, test_f1: 0.6242
 epoch: 70, train_loss: 0.6719, test_loss: 0.8769, test_f1: 0.6147
 epoch: 71, train_loss: 0.6695, test_loss: 0.9045, test_f1: 0.6152
 epoch: 72, train_loss: 0.6771, test_loss: 0.8659, test_f1: 0.6153
 epoch: 73, train_loss: 0.6698, test_loss: 0.8913, test_f1: 0.6230
 epoch: 74, train_loss: 0.6665, test_loss: 0.9048, test_f1: 0.6140
 epoch: 75, train_loss: 0.6616, test_loss: 0.8882, test_f1: 0.6171
 epoch: 76, train_loss: 0.6615, test_loss: 0.9079, test_f1: 0.6103
 epoch: 77, train_loss: 0.6603, test_loss: 0.8899, test_f1: 0.6279
 epoch: 78, train_loss: 0.6629, test_loss: 0.8978, test_f1: 0.6167
 epoch: 79, train_loss: 0.6598, test_loss: 0.8921, test_f1: 0.6385
 epoch: 80, train_loss: 0.6713, test_loss: 0.8981, test_f1: 0.6347
 epoch: 81, train_loss: 0.6571, test_loss: 0.8949, test_f1: 0.6283
 epoch: 82, train_loss: 0.6593, test_loss: 0.8952, test_f1: 0.6160
 epoch: 83, train_loss: 0.6603, test_loss: 0.9115, test_f1: 0.6125
 epoch: 84, train_loss: 0.6525, test_loss: 0.9054, test_f1: 0.6169
 epoch: 85, train_loss: 0.6540, test_loss: 0.8894, test_f1: 0.6240
 epoch: 86, train_loss: 0.6481, test_loss: 0.8974, test_f1: 0.6125
 epoch: 87, train_loss: 0.6532, test_loss: 0.9317, test_f1: 0.6219
 epoch: 88, train_loss: 0.6472, test_loss: 0.9058, test_f1: 0.6088
 epoch: 89, train_loss: 0.6454, test_loss: 0.9231, test_f1: 0.5951
 epoch: 90, train_loss: 0.6402, test_loss: 0.8966, test_f1: 0.6104
 epoch: 91, train_loss: 0.6372, test_loss: 0.8717, test_f1: 0.6380
 epoch: 92, train_loss: 0.6489, test_loss: 0.9147, test_f1: 0.6223
 epoch: 93, train_loss: 0.6475, test_loss: 0.8851, test_f1: 0.6262
 epoch: 94, train_loss: 0.6263, test_loss: 0.9119, test_f1: 0.6342
 epoch: 95, train_loss: 0.6366, test_loss: 0.9110, test_f1: 0.6182
 epoch: 96, train_loss: 0.6351, test_loss: 0.9031, test_f1: 0.6252
 epoch: 97, train_loss: 0.6334, test_loss: 0.8959, test_f1: 0.6290
 epoch: 98, train_loss: 0.6348, test_loss: 0.9053, test_f1: 0.6246
 epoch: 99, train_loss: 0.6365, test_loss: 0.9117, test_f1: 0.6147
##################ITERATION #1 ****************************************
 epoch: 0, train_loss: 1.2718, test_loss: 1.2116, test_f1: 0.2707
 epoch: 1, train_loss: 1.1670, test_loss: 1.1121, test_f1: 0.4165
 epoch: 2, train_loss: 1.1130, test_loss: 1.0587, test_f1: 0.4455
 epoch: 3, train_loss: 1.0766, test_loss: 1.0147, test_f1: 0.4695
 epoch: 4, train_loss: 1.0326, test_loss: 0.9912, test_f1: 0.4828
 epoch: 5, train_loss: 1.0017, test_loss: 0.9711, test_f1: 0.4773
 epoch: 6, train_loss: 0.9841, test_loss: 0.9525, test_f1: 0.5006
 epoch: 7, train_loss: 0.9631, test_loss: 0.9519, test_f1: 0.5062
 epoch: 8, train_loss: 0.9526, test_loss: 0.9574, test_f1: 0.5114
 epoch: 9, train_loss: 0.9375, test_loss: 0.9440, test_f1: 0.5041
 epoch: 10, train_loss: 0.9297, test_loss: 0.9389, test_f1: 0.5140
 epoch: 11, train_loss: 0.9234, test_loss: 0.9203, test_f1: 0.5269
 epoch: 12, train_loss: 0.9103, test_loss: 0.9051, test_f1: 0.5255
 epoch: 13, train_loss: 0.8973, test_loss: 0.9162, test_f1: 0.5366
 epoch: 14, train_loss: 0.8929, test_loss: 0.9123, test_f1: 0.5319
 epoch: 15, train_loss: 0.8846, test_loss: 0.8921, test_f1: 0.5418
 epoch: 16, train_loss: 0.8695, test_loss: 0.9064, test_f1: 0.5440
 epoch: 17, train_loss: 0.8623, test_loss: 0.8763, test_f1: 0.5389
 epoch: 18, train_loss: 0.8560, test_loss: 0.8955, test_f1: 0.5438
 epoch: 19, train_loss: 0.8517, test_loss: 0.8938, test_f1: 0.5512
 epoch: 20, train_loss: 0.8460, test_loss: 0.8866, test_f1: 0.5711
 epoch: 21, train_loss: 0.8398, test_loss: 0.9017, test_f1: 0.5498
 epoch: 22, train_loss: 0.8290, test_loss: 0.8950, test_f1: 0.5340
 epoch: 23, train_loss: 0.8259, test_loss: 0.8674, test_f1: 0.5547
 epoch: 24, train_loss: 0.8126, test_loss: 0.9066, test_f1: 0.5540
 epoch: 25, train_loss: 0.8195, test_loss: 0.8845, test_f1: 0.5607
 epoch: 26, train_loss: 0.8153, test_loss: 0.8827, test_f1: 0.5527
 epoch: 27, train_loss: 0.7957, test_loss: 0.8991, test_f1: 0.5523
 epoch: 28, train_loss: 0.8002, test_loss: 0.8995, test_f1: 0.5465
 epoch: 29, train_loss: 0.7997, test_loss: 0.9179, test_f1: 0.5478
 epoch: 30, train_loss: 0.7920, test_loss: 0.8725, test_f1: 0.5828
 epoch: 31, train_loss: 0.7826, test_loss: 0.9199, test_f1: 0.5690
 epoch: 32, train_loss: 0.7821, test_loss: 0.8702, test_f1: 0.5827
 epoch: 33, train_loss: 0.7739, test_loss: 0.8966, test_f1: 0.5806
 epoch: 34, train_loss: 0.7693, test_loss: 0.8945, test_f1: 0.5720
 epoch: 35, train_loss: 0.7570, test_loss: 0.9225, test_f1: 0.5725
 epoch: 36, train_loss: 0.7600, test_loss: 0.9065, test_f1: 0.5742
 epoch: 37, train_loss: 0.7532, test_loss: 0.8986, test_f1: 0.6040
 epoch: 38, train_loss: 0.7496, test_loss: 0.9167, test_f1: 0.5773
 epoch: 39, train_loss: 0.7457, test_loss: 0.8874, test_f1: 0.5870
 epoch: 40, train_loss: 0.7402, test_loss: 0.9073, test_f1: 0.6181
 epoch: 41, train_loss: 0.7355, test_loss: 0.9068, test_f1: 0.5835
 epoch: 42, train_loss: 0.7368, test_loss: 0.9444, test_f1: 0.5949
 epoch: 43, train_loss: 0.7339, test_loss: 0.9119, test_f1: 0.6133
 epoch: 44, train_loss: 0.7285, test_loss: 0.9073, test_f1: 0.5863
 epoch: 45, train_loss: 0.7206, test_loss: 0.9187, test_f1: 0.5876
 epoch: 46, train_loss: 0.7240, test_loss: 0.8855, test_f1: 0.6101
 epoch: 47, train_loss: 0.7148, test_loss: 0.9294, test_f1: 0.5811
 epoch: 48, train_loss: 0.7072, test_loss: 0.9353, test_f1: 0.6089
 epoch: 49, train_loss: 0.7142, test_loss: 0.9144, test_f1: 0.5773
 epoch: 50, train_loss: 0.7050, test_loss: 0.9723, test_f1: 0.5732
 epoch: 51, train_loss: 0.6936, test_loss: 0.9052, test_f1: 0.6055
 epoch: 52, train_loss: 0.6914, test_loss: 0.9293, test_f1: 0.6011
 epoch: 53, train_loss: 0.6889, test_loss: 0.9085, test_f1: 0.6235
 epoch: 54, train_loss: 0.6826, test_loss: 0.9162, test_f1: 0.5888
 epoch: 55, train_loss: 0.6875, test_loss: 0.9029, test_f1: 0.6289
 epoch: 56, train_loss: 0.6775, test_loss: 0.9169, test_f1: 0.5875
 epoch: 57, train_loss: 0.6720, test_loss: 0.9264, test_f1: 0.5964
 epoch: 58, train_loss: 0.6773, test_loss: 0.9187, test_f1: 0.6204
 epoch: 59, train_loss: 0.6692, test_loss: 0.9317, test_f1: 0.5913
 epoch: 60, train_loss: 0.6752, test_loss: 0.9319, test_f1: 0.5898
 epoch: 61, train_loss: 0.6638, test_loss: 0.9198, test_f1: 0.5928
 epoch: 62, train_loss: 0.6658, test_loss: 0.9386, test_f1: 0.5830
 epoch: 63, train_loss: 0.6623, test_loss: 0.9282, test_f1: 0.6102
 epoch: 64, train_loss: 0.6650, test_loss: 0.9359, test_f1: 0.5998
 epoch: 65, train_loss: 0.6761, test_loss: 0.9449, test_f1: 0.6041
 epoch: 66, train_loss: 0.6638, test_loss: 0.9065, test_f1: 0.6056
 epoch: 67, train_loss: 0.6512, test_loss: 0.9593, test_f1: 0.5933
 epoch: 68, train_loss: 0.6553, test_loss: 0.9211, test_f1: 0.6345
 epoch: 69, train_loss: 0.6607, test_loss: 0.9465, test_f1: 0.6184
 epoch: 70, train_loss: 0.6433, test_loss: 0.9297, test_f1: 0.6158
 epoch: 71, train_loss: 0.6461, test_loss: 0.9493, test_f1: 0.6166
 epoch: 72, train_loss: 0.6536, test_loss: 0.9620, test_f1: 0.5951
 epoch: 73, train_loss: 0.6453, test_loss: 0.9529, test_f1: 0.6253
 epoch: 74, train_loss: 0.6424, test_loss: 0.9405, test_f1: 0.6200
 epoch: 75, train_loss: 0.6521, test_loss: 0.9365, test_f1: 0.6275
 epoch: 76, train_loss: 0.6399, test_loss: 0.9410, test_f1: 0.6159
 epoch: 77, train_loss: 0.6489, test_loss: 0.9576, test_f1: 0.6188
 epoch: 78, train_loss: 0.6506, test_loss: 0.9405, test_f1: 0.6091
 epoch: 79, train_loss: 0.6396, test_loss: 0.9625, test_f1: 0.6227
 epoch: 80, train_loss: 0.6339, test_loss: 0.9654, test_f1: 0.6098
 epoch: 81, train_loss: 0.6286, test_loss: 0.9552, test_f1: 0.6150
 epoch: 82, train_loss: 0.6446, test_loss: 0.9476, test_f1: 0.6280
 epoch: 83, train_loss: 0.6307, test_loss: 0.9636, test_f1: 0.6256
 epoch: 84, train_loss: 0.6319, test_loss: 0.9606, test_f1: 0.6248
 epoch: 85, train_loss: 0.6357, test_loss: 0.9825, test_f1: 0.6114
 epoch: 86, train_loss: 0.6303, test_loss: 1.0044, test_f1: 0.6161
 epoch: 87, train_loss: 0.6229, test_loss: 0.9676, test_f1: 0.6133
 epoch: 88, train_loss: 0.6299, test_loss: 0.9640, test_f1: 0.6391
 epoch: 89, train_loss: 0.6275, test_loss: 0.9830, test_f1: 0.6261
 epoch: 90, train_loss: 0.6127, test_loss: 0.9819, test_f1: 0.6175
 epoch: 91, train_loss: 0.6249, test_loss: 0.9814, test_f1: 0.6246
 epoch: 92, train_loss: 0.6157, test_loss: 0.9638, test_f1: 0.6304
 epoch: 93, train_loss: 0.6241, test_loss: 0.9767, test_f1: 0.6137
 epoch: 94, train_loss: 0.6130, test_loss: 1.0041, test_f1: 0.6162
 epoch: 95, train_loss: 0.6180, test_loss: 0.9874, test_f1: 0.6309
 epoch: 96, train_loss: 0.6074, test_loss: 1.0013, test_f1: 0.6088
 epoch: 97, train_loss: 0.6230, test_loss: 1.0147, test_f1: 0.6087
 epoch: 98, train_loss: 0.6037, test_loss: 0.9778, test_f1: 0.6355
 epoch: 99, train_loss: 0.6176, test_loss: 0.9913, test_f1: 0.6419
##################ITERATION #2 ****************************************
 epoch: 0, train_loss: 1.2220, test_loss: 1.1637, test_f1: 0.3405
 epoch: 1, train_loss: 1.1290, test_loss: 1.0662, test_f1: 0.4821
 epoch: 2, train_loss: 1.0885, test_loss: 1.0262, test_f1: 0.4923
 epoch: 3, train_loss: 1.0389, test_loss: 0.9977, test_f1: 0.4975
 epoch: 4, train_loss: 1.0185, test_loss: 0.9721, test_f1: 0.5053
 epoch: 5, train_loss: 0.9859, test_loss: 0.9495, test_f1: 0.5129
 epoch: 6, train_loss: 0.9720, test_loss: 0.9482, test_f1: 0.5170
 epoch: 7, train_loss: 0.9572, test_loss: 0.9335, test_f1: 0.5150
 epoch: 8, train_loss: 0.9394, test_loss: 0.9247, test_f1: 0.5457
 epoch: 9, train_loss: 0.9253, test_loss: 0.9188, test_f1: 0.5455
 epoch: 10, train_loss: 0.9114, test_loss: 0.9141, test_f1: 0.5610
 epoch: 11, train_loss: 0.9142, test_loss: 0.8989, test_f1: 0.5546
 epoch: 12, train_loss: 0.9014, test_loss: 0.9073, test_f1: 0.5464
 epoch: 13, train_loss: 0.8834, test_loss: 0.8887, test_f1: 0.5663
 epoch: 14, train_loss: 0.8689, test_loss: 0.8776, test_f1: 0.5559
 epoch: 15, train_loss: 0.8705, test_loss: 0.8883, test_f1: 0.5704
 epoch: 16, train_loss: 0.8620, test_loss: 0.8845, test_f1: 0.5678
 epoch: 17, train_loss: 0.8540, test_loss: 0.8728, test_f1: 0.5675
 epoch: 18, train_loss: 0.8503, test_loss: 0.8965, test_f1: 0.5484
 epoch: 19, train_loss: 0.8395, test_loss: 0.8915, test_f1: 0.5525
 epoch: 20, train_loss: 0.8334, test_loss: 0.8467, test_f1: 0.5833
 epoch: 21, train_loss: 0.8307, test_loss: 0.8529, test_f1: 0.5810
 epoch: 22, train_loss: 0.8259, test_loss: 0.8746, test_f1: 0.5635
 epoch: 23, train_loss: 0.8151, test_loss: 0.8706, test_f1: 0.5702
 epoch: 24, train_loss: 0.8053, test_loss: 0.8381, test_f1: 0.5875
 epoch: 25, train_loss: 0.8026, test_loss: 0.8720, test_f1: 0.5842
 epoch: 26, train_loss: 0.7988, test_loss: 0.8465, test_f1: 0.5798
 epoch: 27, train_loss: 0.7951, test_loss: 0.8764, test_f1: 0.5760
 epoch: 28, train_loss: 0.7883, test_loss: 0.8458, test_f1: 0.6063
 epoch: 29, train_loss: 0.7847, test_loss: 0.8831, test_f1: 0.5856
 epoch: 30, train_loss: 0.7848, test_loss: 0.8470, test_f1: 0.6083
 epoch: 31, train_loss: 0.7666, test_loss: 0.8564, test_f1: 0.5850
 epoch: 32, train_loss: 0.7683, test_loss: 0.8428, test_f1: 0.5725
 epoch: 33, train_loss: 0.7653, test_loss: 0.8518, test_f1: 0.5911
 epoch: 34, train_loss: 0.7558, test_loss: 0.8258, test_f1: 0.6315
 epoch: 35, train_loss: 0.7504, test_loss: 0.8800, test_f1: 0.5802
 epoch: 36, train_loss: 0.7574, test_loss: 0.8703, test_f1: 0.5852
 epoch: 37, train_loss: 0.7398, test_loss: 0.8883, test_f1: 0.6144
 epoch: 38, train_loss: 0.7336, test_loss: 0.8549, test_f1: 0.6275
 epoch: 39, train_loss: 0.7296, test_loss: 0.8835, test_f1: 0.5991
 epoch: 40, train_loss: 0.7263, test_loss: 0.8783, test_f1: 0.6150
 epoch: 41, train_loss: 0.7246, test_loss: 0.8823, test_f1: 0.6249
 epoch: 42, train_loss: 0.7203, test_loss: 0.8798, test_f1: 0.6110
 epoch: 43, train_loss: 0.7061, test_loss: 0.8868, test_f1: 0.6368
 epoch: 44, train_loss: 0.7081, test_loss: 0.8820, test_f1: 0.6336
 epoch: 45, train_loss: 0.6971, test_loss: 0.8704, test_f1: 0.6079
 epoch: 46, train_loss: 0.6972, test_loss: 0.8915, test_f1: 0.6249
 epoch: 47, train_loss: 0.7041, test_loss: 0.8860, test_f1: 0.6289
 epoch: 48, train_loss: 0.6876, test_loss: 0.9015, test_f1: 0.6426
 epoch: 49, train_loss: 0.6917, test_loss: 0.8689, test_f1: 0.6624
 epoch: 50, train_loss: 0.6980, test_loss: 0.8784, test_f1: 0.6247
 epoch: 51, train_loss: 0.6716, test_loss: 0.8727, test_f1: 0.6280
 epoch: 52, train_loss: 0.6695, test_loss: 0.8687, test_f1: 0.6497
 epoch: 53, train_loss: 0.6624, test_loss: 0.8893, test_f1: 0.6257
 epoch: 54, train_loss: 0.6554, test_loss: 0.8986, test_f1: 0.6418
 epoch: 55, train_loss: 0.6598, test_loss: 0.8884, test_f1: 0.6367
 epoch: 56, train_loss: 0.6626, test_loss: 0.8832, test_f1: 0.6432
 epoch: 57, train_loss: 0.6500, test_loss: 0.8767, test_f1: 0.6317
 epoch: 58, train_loss: 0.6509, test_loss: 0.9085, test_f1: 0.6473
 epoch: 59, train_loss: 0.6494, test_loss: 0.8968, test_f1: 0.6279
 epoch: 60, train_loss: 0.6516, test_loss: 0.9029, test_f1: 0.6439
 epoch: 61, train_loss: 0.6526, test_loss: 0.8717, test_f1: 0.6531
 epoch: 62, train_loss: 0.6511, test_loss: 0.9037, test_f1: 0.6404
 epoch: 63, train_loss: 0.6501, test_loss: 0.9282, test_f1: 0.6311
 epoch: 64, train_loss: 0.6449, test_loss: 0.9057, test_f1: 0.6247
 epoch: 65, train_loss: 0.6318, test_loss: 0.9063, test_f1: 0.6417
 epoch: 66, train_loss: 0.6341, test_loss: 0.9369, test_f1: 0.6251
 epoch: 67, train_loss: 0.6505, test_loss: 0.8949, test_f1: 0.6453
 epoch: 68, train_loss: 0.6410, test_loss: 0.9209, test_f1: 0.6434
 epoch: 69, train_loss: 0.6331, test_loss: 0.9194, test_f1: 0.6498
 epoch: 70, train_loss: 0.6324, test_loss: 0.9158, test_f1: 0.6306
 epoch: 71, train_loss: 0.6263, test_loss: 0.9097, test_f1: 0.6471
 epoch: 72, train_loss: 0.6215, test_loss: 0.9133, test_f1: 0.6389
 epoch: 73, train_loss: 0.6140, test_loss: 0.9318, test_f1: 0.6412
 epoch: 74, train_loss: 0.6280, test_loss: 0.9095, test_f1: 0.6491
 epoch: 75, train_loss: 0.6129, test_loss: 0.9206, test_f1: 0.6548
 epoch: 76, train_loss: 0.6260, test_loss: 0.9344, test_f1: 0.6584
 epoch: 77, train_loss: 0.6204, test_loss: 0.9271, test_f1: 0.6537
 epoch: 78, train_loss: 0.6164, test_loss: 0.9174, test_f1: 0.6607
 epoch: 79, train_loss: 0.6013, test_loss: 0.9097, test_f1: 0.6587
 epoch: 80, train_loss: 0.6054, test_loss: 0.9260, test_f1: 0.6462
 epoch: 81, train_loss: 0.6157, test_loss: 0.9227, test_f1: 0.6514
 epoch: 82, train_loss: 0.5989, test_loss: 0.9483, test_f1: 0.6521
 epoch: 83, train_loss: 0.6033, test_loss: 0.9208, test_f1: 0.6583
 epoch: 84, train_loss: 0.6066, test_loss: 0.9358, test_f1: 0.6676
 epoch: 85, train_loss: 0.6028, test_loss: 0.9378, test_f1: 0.6544
 epoch: 86, train_loss: 0.5947, test_loss: 0.9769, test_f1: 0.6599
 epoch: 87, train_loss: 0.6015, test_loss: 0.9497, test_f1: 0.6632
 epoch: 88, train_loss: 0.6050, test_loss: 0.9485, test_f1: 0.6589
 epoch: 89, train_loss: 0.6033, test_loss: 0.9251, test_f1: 0.6596
 epoch: 90, train_loss: 0.5910, test_loss: 0.9640, test_f1: 0.6688
 epoch: 91, train_loss: 0.5888, test_loss: 0.9594, test_f1: 0.6596
 epoch: 92, train_loss: 0.5941, test_loss: 0.9403, test_f1: 0.6677
 epoch: 93, train_loss: 0.5889, test_loss: 0.9335, test_f1: 0.6619
 epoch: 94, train_loss: 0.5954, test_loss: 0.9720, test_f1: 0.6546
 epoch: 95, train_loss: 0.5880, test_loss: 0.9435, test_f1: 0.6560
 epoch: 96, train_loss: 0.5748, test_loss: 0.9328, test_f1: 0.6614
 epoch: 97, train_loss: 0.5779, test_loss: 0.9396, test_f1: 0.6707
 epoch: 98, train_loss: 0.5688, test_loss: 0.9394, test_f1: 0.6626
 epoch: 99, train_loss: 0.5665, test_loss: 0.9520, test_f1: 0.6708
##################ITERATION #3 ****************************************
 epoch: 0, train_loss: 1.2094, test_loss: 1.1165, test_f1: 0.3872
 epoch: 1, train_loss: 1.0971, test_loss: 1.0311, test_f1: 0.4516
 epoch: 2, train_loss: 1.0549, test_loss: 1.0001, test_f1: 0.4844
 epoch: 3, train_loss: 1.0232, test_loss: 0.9803, test_f1: 0.4765
 epoch: 4, train_loss: 0.9988, test_loss: 0.9592, test_f1: 0.5163
 epoch: 5, train_loss: 0.9931, test_loss: 0.9508, test_f1: 0.5086
 epoch: 6, train_loss: 0.9692, test_loss: 0.9484, test_f1: 0.5197
 epoch: 7, train_loss: 0.9569, test_loss: 0.9437, test_f1: 0.4940
 epoch: 8, train_loss: 0.9496, test_loss: 0.9289, test_f1: 0.5101
 epoch: 9, train_loss: 0.9408, test_loss: 0.9114, test_f1: 0.5065
 epoch: 10, train_loss: 0.9263, test_loss: 0.9174, test_f1: 0.5234
 epoch: 11, train_loss: 0.9122, test_loss: 0.9018, test_f1: 0.5348
 epoch: 12, train_loss: 0.9011, test_loss: 0.9038, test_f1: 0.5453
 epoch: 13, train_loss: 0.9068, test_loss: 0.8962, test_f1: 0.5279
 epoch: 14, train_loss: 0.8981, test_loss: 0.9013, test_f1: 0.5309
 epoch: 15, train_loss: 0.8902, test_loss: 0.8965, test_f1: 0.5573
 epoch: 16, train_loss: 0.8780, test_loss: 0.8882, test_f1: 0.5430
 epoch: 17, train_loss: 0.8736, test_loss: 0.8838, test_f1: 0.5462
 epoch: 18, train_loss: 0.8652, test_loss: 0.8807, test_f1: 0.5466
 epoch: 19, train_loss: 0.8575, test_loss: 0.8877, test_f1: 0.5283
 epoch: 20, train_loss: 0.8608, test_loss: 0.8709, test_f1: 0.5627
 epoch: 21, train_loss: 0.8628, test_loss: 0.8777, test_f1: 0.5556
 epoch: 22, train_loss: 0.8476, test_loss: 0.8867, test_f1: 0.5563
 epoch: 23, train_loss: 0.8432, test_loss: 0.8784, test_f1: 0.5508
 epoch: 24, train_loss: 0.8277, test_loss: 0.8757, test_f1: 0.5847
 epoch: 25, train_loss: 0.8345, test_loss: 0.8719, test_f1: 0.5545
 epoch: 26, train_loss: 0.8248, test_loss: 0.8752, test_f1: 0.5642
 epoch: 27, train_loss: 0.8197, test_loss: 0.8767, test_f1: 0.5840
 epoch: 28, train_loss: 0.8209, test_loss: 0.8598, test_f1: 0.5839
 epoch: 29, train_loss: 0.8168, test_loss: 0.8831, test_f1: 0.5663
 epoch: 30, train_loss: 0.8011, test_loss: 0.8658, test_f1: 0.5675
 epoch: 31, train_loss: 0.8014, test_loss: 0.8888, test_f1: 0.6080
 epoch: 32, train_loss: 0.7945, test_loss: 0.8717, test_f1: 0.5872
 epoch: 33, train_loss: 0.7913, test_loss: 0.8820, test_f1: 0.5885
 epoch: 34, train_loss: 0.7861, test_loss: 0.8626, test_f1: 0.5829
 epoch: 35, train_loss: 0.7899, test_loss: 0.8824, test_f1: 0.5971
 epoch: 36, train_loss: 0.7870, test_loss: 0.8626, test_f1: 0.5847
 epoch: 37, train_loss: 0.7739, test_loss: 0.8663, test_f1: 0.5940
 epoch: 38, train_loss: 0.7734, test_loss: 0.8753, test_f1: 0.5887
 epoch: 39, train_loss: 0.7658, test_loss: 0.8742, test_f1: 0.5875
 epoch: 40, train_loss: 0.7661, test_loss: 0.8678, test_f1: 0.5773
 epoch: 41, train_loss: 0.7549, test_loss: 0.8428, test_f1: 0.6003
 epoch: 42, train_loss: 0.7618, test_loss: 0.8427, test_f1: 0.6106
 epoch: 43, train_loss: 0.7523, test_loss: 0.8768, test_f1: 0.6002
 epoch: 44, train_loss: 0.7505, test_loss: 0.8622, test_f1: 0.5854
 epoch: 45, train_loss: 0.7435, test_loss: 0.8837, test_f1: 0.5882
 epoch: 46, train_loss: 0.7377, test_loss: 0.8700, test_f1: 0.6090
 epoch: 47, train_loss: 0.7285, test_loss: 0.8820, test_f1: 0.6259
 epoch: 48, train_loss: 0.7350, test_loss: 0.9071, test_f1: 0.5774
 epoch: 49, train_loss: 0.7323, test_loss: 0.8799, test_f1: 0.5915
 epoch: 50, train_loss: 0.7253, test_loss: 0.8781, test_f1: 0.6160
 epoch: 51, train_loss: 0.7189, test_loss: 0.8911, test_f1: 0.5913
 epoch: 52, train_loss: 0.7142, test_loss: 0.8944, test_f1: 0.5888
 epoch: 53, train_loss: 0.7149, test_loss: 0.8840, test_f1: 0.6009
 epoch: 54, train_loss: 0.7105, test_loss: 0.8966, test_f1: 0.5914
 epoch: 55, train_loss: 0.7061, test_loss: 0.8927, test_f1: 0.5823
 epoch: 56, train_loss: 0.7051, test_loss: 0.9006, test_f1: 0.5984
 epoch: 57, train_loss: 0.7020, test_loss: 0.9005, test_f1: 0.5915
 epoch: 58, train_loss: 0.6956, test_loss: 0.9142, test_f1: 0.5971
 epoch: 59, train_loss: 0.7058, test_loss: 0.9103, test_f1: 0.6138
 epoch: 60, train_loss: 0.7002, test_loss: 0.8884, test_f1: 0.6086
 epoch: 61, train_loss: 0.6902, test_loss: 0.8992, test_f1: 0.6052
 epoch: 62, train_loss: 0.6969, test_loss: 0.9116, test_f1: 0.6006
 epoch: 63, train_loss: 0.6993, test_loss: 0.9171, test_f1: 0.6077
 epoch: 64, train_loss: 0.6931, test_loss: 0.9003, test_f1: 0.6092
 epoch: 65, train_loss: 0.6882, test_loss: 0.9100, test_f1: 0.6215
 epoch: 66, train_loss: 0.6791, test_loss: 0.9102, test_f1: 0.6217
 epoch: 67, train_loss: 0.6801, test_loss: 0.9060, test_f1: 0.6070
 epoch: 68, train_loss: 0.6732, test_loss: 0.9054, test_f1: 0.6188
 epoch: 69, train_loss: 0.6770, test_loss: 0.8986, test_f1: 0.6292
 epoch: 70, train_loss: 0.6849, test_loss: 0.9293, test_f1: 0.6068
 epoch: 71, train_loss: 0.6840, test_loss: 0.9242, test_f1: 0.6232
 epoch: 72, train_loss: 0.6651, test_loss: 0.9120, test_f1: 0.6185
 epoch: 73, train_loss: 0.6765, test_loss: 0.9286, test_f1: 0.6158
 epoch: 74, train_loss: 0.6723, test_loss: 0.9202, test_f1: 0.6142
 epoch: 75, train_loss: 0.6747, test_loss: 0.9127, test_f1: 0.6089
 epoch: 76, train_loss: 0.6739, test_loss: 0.9138, test_f1: 0.6195
 epoch: 77, train_loss: 0.6695, test_loss: 0.9308, test_f1: 0.6179
 epoch: 78, train_loss: 0.6635, test_loss: 0.9241, test_f1: 0.6212
 epoch: 79, train_loss: 0.6594, test_loss: 0.9324, test_f1: 0.6237
 epoch: 80, train_loss: 0.6570, test_loss: 0.9236, test_f1: 0.6195
 epoch: 81, train_loss: 0.6595, test_loss: 0.9309, test_f1: 0.6299
 epoch: 82, train_loss: 0.6700, test_loss: 0.9528, test_f1: 0.6374
 epoch: 83, train_loss: 0.6578, test_loss: 0.9431, test_f1: 0.6076
 epoch: 84, train_loss: 0.6601, test_loss: 0.9277, test_f1: 0.6371
 epoch: 85, train_loss: 0.6604, test_loss: 0.9235, test_f1: 0.6362
 epoch: 86, train_loss: 0.6529, test_loss: 0.9240, test_f1: 0.6449
 epoch: 87, train_loss: 0.6613, test_loss: 0.9471, test_f1: 0.6191
 epoch: 88, train_loss: 0.6424, test_loss: 0.9337, test_f1: 0.6262
 epoch: 89, train_loss: 0.6595, test_loss: 0.9189, test_f1: 0.6457
 epoch: 90, train_loss: 0.6413, test_loss: 0.9296, test_f1: 0.6355
 epoch: 91, train_loss: 0.6362, test_loss: 0.9445, test_f1: 0.6250
 epoch: 92, train_loss: 0.6364, test_loss: 0.9391, test_f1: 0.6346
 epoch: 93, train_loss: 0.6439, test_loss: 0.9377, test_f1: 0.6318
 epoch: 94, train_loss: 0.6410, test_loss: 0.9553, test_f1: 0.6250
 epoch: 95, train_loss: 0.6419, test_loss: 0.9267, test_f1: 0.6457
 epoch: 96, train_loss: 0.6334, test_loss: 0.9338, test_f1: 0.6312
 epoch: 97, train_loss: 0.6376, test_loss: 0.9600, test_f1: 0.6302
 epoch: 98, train_loss: 0.6330, test_loss: 0.9396, test_f1: 0.6349
 epoch: 99, train_loss: 0.6370, test_loss: 0.9593, test_f1: 0.6322
##################ITERATION #4 ****************************************
 epoch: 0, train_loss: 1.2237, test_loss: 1.1346, test_f1: 0.4347
 epoch: 1, train_loss: 1.0967, test_loss: 1.0046, test_f1: 0.4797
 epoch: 2, train_loss: 1.0607, test_loss: 0.9866, test_f1: 0.4808
 epoch: 3, train_loss: 1.0234, test_loss: 0.9607, test_f1: 0.4872
 epoch: 4, train_loss: 1.0016, test_loss: 0.9414, test_f1: 0.5008
 epoch: 5, train_loss: 0.9823, test_loss: 0.9478, test_f1: 0.4933
 epoch: 6, train_loss: 0.9599, test_loss: 0.9390, test_f1: 0.4926
 epoch: 7, train_loss: 0.9486, test_loss: 0.9332, test_f1: 0.5206
 epoch: 8, train_loss: 0.9408, test_loss: 0.9291, test_f1: 0.5082
 epoch: 9, train_loss: 0.9229, test_loss: 0.9408, test_f1: 0.5115
 epoch: 10, train_loss: 0.9152, test_loss: 0.9335, test_f1: 0.5067
 epoch: 11, train_loss: 0.9010, test_loss: 0.9487, test_f1: 0.5115
 epoch: 12, train_loss: 0.8991, test_loss: 0.9164, test_f1: 0.5112
 epoch: 13, train_loss: 0.8920, test_loss: 0.9188, test_f1: 0.5150
 epoch: 14, train_loss: 0.8831, test_loss: 0.9185, test_f1: 0.5183
 epoch: 15, train_loss: 0.8726, test_loss: 0.9049, test_f1: 0.5468
 epoch: 16, train_loss: 0.8565, test_loss: 0.9085, test_f1: 0.5208
 epoch: 17, train_loss: 0.8618, test_loss: 0.9127, test_f1: 0.5776
 epoch: 18, train_loss: 0.8521, test_loss: 0.8986, test_f1: 0.5440
 epoch: 19, train_loss: 0.8498, test_loss: 0.9351, test_f1: 0.5305
 epoch: 20, train_loss: 0.8361, test_loss: 0.9267, test_f1: 0.5608
 epoch: 21, train_loss: 0.8341, test_loss: 0.9552, test_f1: 0.5540
 epoch: 22, train_loss: 0.8279, test_loss: 0.9340, test_f1: 0.5448
 epoch: 23, train_loss: 0.8206, test_loss: 0.9320, test_f1: 0.5608
 epoch: 24, train_loss: 0.8110, test_loss: 0.9366, test_f1: 0.5520
 epoch: 25, train_loss: 0.8122, test_loss: 0.9256, test_f1: 0.5582
 epoch: 26, train_loss: 0.8106, test_loss: 0.9340, test_f1: 0.5740
 epoch: 27, train_loss: 0.7980, test_loss: 0.9331, test_f1: 0.5807
 epoch: 28, train_loss: 0.7848, test_loss: 0.9288, test_f1: 0.5802
 epoch: 29, train_loss: 0.7865, test_loss: 0.9311, test_f1: 0.5613
 epoch: 30, train_loss: 0.7951, test_loss: 0.9518, test_f1: 0.5606
 epoch: 31, train_loss: 0.7760, test_loss: 0.9629, test_f1: 0.5560
 epoch: 32, train_loss: 0.7762, test_loss: 0.9486, test_f1: 0.5766
 epoch: 33, train_loss: 0.7756, test_loss: 0.9644, test_f1: 0.5562
 epoch: 34, train_loss: 0.7616, test_loss: 0.9523, test_f1: 0.5786
 epoch: 35, train_loss: 0.7641, test_loss: 0.9476, test_f1: 0.5810
 epoch: 36, train_loss: 0.7563, test_loss: 0.9463, test_f1: 0.5525
 epoch: 37, train_loss: 0.7545, test_loss: 0.9301, test_f1: 0.6048
 epoch: 38, train_loss: 0.7554, test_loss: 0.9421, test_f1: 0.5794
 epoch: 39, train_loss: 0.7437, test_loss: 0.9511, test_f1: 0.6013
 epoch: 40, train_loss: 0.7409, test_loss: 0.9646, test_f1: 0.5621
 epoch: 41, train_loss: 0.7286, test_loss: 0.9565, test_f1: 0.5678
 epoch: 42, train_loss: 0.7196, test_loss: 0.9470, test_f1: 0.6025
 epoch: 43, train_loss: 0.7283, test_loss: 0.9495, test_f1: 0.5763
 epoch: 44, train_loss: 0.7269, test_loss: 0.9606, test_f1: 0.5892
 epoch: 45, train_loss: 0.7225, test_loss: 0.9350, test_f1: 0.5914
 epoch: 46, train_loss: 0.7137, test_loss: 0.9387, test_f1: 0.6353
 epoch: 47, train_loss: 0.7025, test_loss: 0.9469, test_f1: 0.5996
 epoch: 48, train_loss: 0.7138, test_loss: 0.9394, test_f1: 0.6272
 epoch: 49, train_loss: 0.6945, test_loss: 0.9400, test_f1: 0.6236
 epoch: 50, train_loss: 0.6939, test_loss: 0.9753, test_f1: 0.6495
 epoch: 51, train_loss: 0.6830, test_loss: 0.9424, test_f1: 0.6167
 epoch: 52, train_loss: 0.6899, test_loss: 0.9609, test_f1: 0.6089
 epoch: 53, train_loss: 0.6805, test_loss: 0.9534, test_f1: 0.6022
 epoch: 54, train_loss: 0.6754, test_loss: 0.9657, test_f1: 0.5940
 epoch: 55, train_loss: 0.6688, test_loss: 0.9592, test_f1: 0.6118
 epoch: 56, train_loss: 0.6720, test_loss: 0.9612, test_f1: 0.6094
 epoch: 57, train_loss: 0.6725, test_loss: 0.9426, test_f1: 0.6156
 epoch: 58, train_loss: 0.6544, test_loss: 0.9653, test_f1: 0.6157
 epoch: 59, train_loss: 0.6611, test_loss: 0.9596, test_f1: 0.6312
 epoch: 60, train_loss: 0.6593, test_loss: 0.9596, test_f1: 0.6177
 epoch: 61, train_loss: 0.6612, test_loss: 0.9677, test_f1: 0.6125
 epoch: 62, train_loss: 0.6622, test_loss: 0.9484, test_f1: 0.6534
 epoch: 63, train_loss: 0.6614, test_loss: 0.9671, test_f1: 0.6362
 epoch: 64, train_loss: 0.6447, test_loss: 0.9530, test_f1: 0.6400
 epoch: 65, train_loss: 0.6498, test_loss: 0.9640, test_f1: 0.6540
 epoch: 66, train_loss: 0.6538, test_loss: 0.9591, test_f1: 0.6299
 epoch: 67, train_loss: 0.6572, test_loss: 0.9671, test_f1: 0.6548
 epoch: 68, train_loss: 0.6444, test_loss: 0.9535, test_f1: 0.6699
 epoch: 69, train_loss: 0.6448, test_loss: 0.9550, test_f1: 0.6394
 epoch: 70, train_loss: 0.6496, test_loss: 0.9629, test_f1: 0.6327
 epoch: 71, train_loss: 0.6496, test_loss: 0.9673, test_f1: 0.6278
 epoch: 72, train_loss: 0.6358, test_loss: 0.9723, test_f1: 0.6310
 epoch: 73, train_loss: 0.6291, test_loss: 0.9548, test_f1: 0.6422
 epoch: 74, train_loss: 0.6354, test_loss: 0.9749, test_f1: 0.6389
 epoch: 75, train_loss: 0.6256, test_loss: 0.9630, test_f1: 0.6614
 epoch: 76, train_loss: 0.6312, test_loss: 0.9851, test_f1: 0.6363
 epoch: 77, train_loss: 0.6315, test_loss: 0.9586, test_f1: 0.6564
 epoch: 78, train_loss: 0.6181, test_loss: 0.9815, test_f1: 0.6613
 epoch: 79, train_loss: 0.6248, test_loss: 0.9639, test_f1: 0.6554
 epoch: 80, train_loss: 0.6265, test_loss: 0.9575, test_f1: 0.6694
 epoch: 81, train_loss: 0.6205, test_loss: 0.9845, test_f1: 0.6579
 epoch: 82, train_loss: 0.6153, test_loss: 0.9786, test_f1: 0.6636
 epoch: 83, train_loss: 0.6247, test_loss: 0.9829, test_f1: 0.6770
 epoch: 84, train_loss: 0.6061, test_loss: 0.9773, test_f1: 0.6571
 epoch: 85, train_loss: 0.6026, test_loss: 0.9957, test_f1: 0.6509
 epoch: 86, train_loss: 0.6107, test_loss: 0.9944, test_f1: 0.6504
 epoch: 87, train_loss: 0.6090, test_loss: 0.9856, test_f1: 0.6527
 epoch: 88, train_loss: 0.6105, test_loss: 0.9839, test_f1: 0.6458
 epoch: 89, train_loss: 0.6066, test_loss: 0.9876, test_f1: 0.6638
 epoch: 90, train_loss: 0.6010, test_loss: 1.0007, test_f1: 0.6578
 epoch: 91, train_loss: 0.6054, test_loss: 0.9843, test_f1: 0.6743
 epoch: 92, train_loss: 0.6019, test_loss: 0.9932, test_f1: 0.6565
 epoch: 93, train_loss: 0.6033, test_loss: 0.9868, test_f1: 0.6482
 epoch: 94, train_loss: 0.5954, test_loss: 0.9950, test_f1: 0.6664
 epoch: 95, train_loss: 0.5905, test_loss: 1.0121, test_f1: 0.6389
 epoch: 96, train_loss: 0.5971, test_loss: 1.0130, test_f1: 0.6664
 epoch: 97, train_loss: 0.5933, test_loss: 1.0073, test_f1: 0.6469
 epoch: 98, train_loss: 0.5722, test_loss: 1.0089, test_f1: 0.6608
 epoch: 99, train_loss: 0.5916, test_loss: 0.9996, test_f1: 0.6689
##################ITERATION #5 ****************************************
 epoch: 0, train_loss: 1.2525, test_loss: 1.1292, test_f1: 0.3837
 epoch: 1, train_loss: 1.0990, test_loss: 1.0170, test_f1: 0.4698
 epoch: 2, train_loss: 1.0701, test_loss: 0.9956, test_f1: 0.4844
 epoch: 3, train_loss: 1.0277, test_loss: 0.9696, test_f1: 0.5132
 epoch: 4, train_loss: 1.0139, test_loss: 0.9735, test_f1: 0.4909
 epoch: 5, train_loss: 0.9815, test_loss: 0.9538, test_f1: 0.5126
 epoch: 6, train_loss: 0.9780, test_loss: 0.9522, test_f1: 0.5164
 epoch: 7, train_loss: 0.9612, test_loss: 0.9443, test_f1: 0.5379
 epoch: 8, train_loss: 0.9494, test_loss: 0.9572, test_f1: 0.5183
 epoch: 9, train_loss: 0.9366, test_loss: 0.9388, test_f1: 0.5234
 epoch: 10, train_loss: 0.9221, test_loss: 0.9264, test_f1: 0.5365
 epoch: 11, train_loss: 0.9138, test_loss: 0.9333, test_f1: 0.5249
 epoch: 12, train_loss: 0.9011, test_loss: 0.9466, test_f1: 0.5182
 epoch: 13, train_loss: 0.8879, test_loss: 0.9223, test_f1: 0.5282
 epoch: 14, train_loss: 0.8865, test_loss: 0.9221, test_f1: 0.5304
 epoch: 15, train_loss: 0.8793, test_loss: 0.9191, test_f1: 0.5317
 epoch: 16, train_loss: 0.8746, test_loss: 0.9226, test_f1: 0.5479
 epoch: 17, train_loss: 0.8661, test_loss: 0.9245, test_f1: 0.5311
 epoch: 18, train_loss: 0.8555, test_loss: 0.9062, test_f1: 0.5591
 epoch: 19, train_loss: 0.8469, test_loss: 0.9054, test_f1: 0.5560
 epoch: 20, train_loss: 0.8450, test_loss: 0.9278, test_f1: 0.5479
 epoch: 21, train_loss: 0.8353, test_loss: 0.9063, test_f1: 0.5541
 epoch: 22, train_loss: 0.8320, test_loss: 0.9261, test_f1: 0.5588
 epoch: 23, train_loss: 0.8391, test_loss: 0.9233, test_f1: 0.5643
 epoch: 24, train_loss: 0.8276, test_loss: 0.9109, test_f1: 0.5737
 epoch: 25, train_loss: 0.8170, test_loss: 0.9034, test_f1: 0.5688
 epoch: 26, train_loss: 0.8032, test_loss: 0.9265, test_f1: 0.5592
 epoch: 27, train_loss: 0.8010, test_loss: 0.9169, test_f1: 0.5725
 epoch: 28, train_loss: 0.8014, test_loss: 0.9346, test_f1: 0.5570
 epoch: 29, train_loss: 0.7936, test_loss: 0.9335, test_f1: 0.5604
 epoch: 30, train_loss: 0.7935, test_loss: 0.9430, test_f1: 0.5550
 epoch: 31, train_loss: 0.7884, test_loss: 0.9298, test_f1: 0.5607
 epoch: 32, train_loss: 0.7855, test_loss: 0.9345, test_f1: 0.5680
 epoch: 33, train_loss: 0.7781, test_loss: 0.9077, test_f1: 0.5869
 epoch: 34, train_loss: 0.7757, test_loss: 0.9044, test_f1: 0.5848
 epoch: 35, train_loss: 0.7799, test_loss: 0.9380, test_f1: 0.5675
 epoch: 36, train_loss: 0.7729, test_loss: 0.9623, test_f1: 0.5664
 epoch: 37, train_loss: 0.7607, test_loss: 0.9257, test_f1: 0.5829
 epoch: 38, train_loss: 0.7637, test_loss: 0.9218, test_f1: 0.5772
 epoch: 39, train_loss: 0.7569, test_loss: 0.9421, test_f1: 0.5810
 epoch: 40, train_loss: 0.7600, test_loss: 0.9341, test_f1: 0.6018
 epoch: 41, train_loss: 0.7481, test_loss: 0.9492, test_f1: 0.5966
 epoch: 42, train_loss: 0.7385, test_loss: 0.9476, test_f1: 0.5961
 epoch: 43, train_loss: 0.7462, test_loss: 0.9445, test_f1: 0.5873
 epoch: 44, train_loss: 0.7402, test_loss: 0.9698, test_f1: 0.5857
 epoch: 45, train_loss: 0.7385, test_loss: 0.9587, test_f1: 0.6031
 epoch: 46, train_loss: 0.7302, test_loss: 0.9553, test_f1: 0.6131
 epoch: 47, train_loss: 0.7296, test_loss: 0.9370, test_f1: 0.5875
 epoch: 48, train_loss: 0.7206, test_loss: 0.9603, test_f1: 0.5974
 epoch: 49, train_loss: 0.7219, test_loss: 0.9317, test_f1: 0.6129
 epoch: 50, train_loss: 0.7066, test_loss: 0.9612, test_f1: 0.5893
 epoch: 51, train_loss: 0.7021, test_loss: 0.9400, test_f1: 0.6170
 epoch: 52, train_loss: 0.7071, test_loss: 0.9364, test_f1: 0.6166
 epoch: 53, train_loss: 0.6938, test_loss: 0.9399, test_f1: 0.6121
 epoch: 54, train_loss: 0.6990, test_loss: 0.9454, test_f1: 0.6238
 epoch: 55, train_loss: 0.6886, test_loss: 0.9450, test_f1: 0.6174
 epoch: 56, train_loss: 0.6915, test_loss: 0.9424, test_f1: 0.6151
 epoch: 57, train_loss: 0.6919, test_loss: 0.9416, test_f1: 0.6355
 epoch: 58, train_loss: 0.6854, test_loss: 0.9496, test_f1: 0.6195
 epoch: 59, train_loss: 0.6916, test_loss: 0.9521, test_f1: 0.6052
 epoch: 60, train_loss: 0.6901, test_loss: 0.9485, test_f1: 0.6302
 epoch: 61, train_loss: 0.6706, test_loss: 0.9702, test_f1: 0.6229
 epoch: 62, train_loss: 0.6806, test_loss: 0.9461, test_f1: 0.6219
 epoch: 63, train_loss: 0.6829, test_loss: 0.9682, test_f1: 0.6206
 epoch: 64, train_loss: 0.6725, test_loss: 0.9571, test_f1: 0.6107
 epoch: 65, train_loss: 0.6647, test_loss: 0.9456, test_f1: 0.6455
 epoch: 66, train_loss: 0.6699, test_loss: 0.9761, test_f1: 0.6060
 epoch: 67, train_loss: 0.6759, test_loss: 0.9495, test_f1: 0.6207
 epoch: 68, train_loss: 0.6659, test_loss: 0.9469, test_f1: 0.6376
 epoch: 69, train_loss: 0.6683, test_loss: 0.9373, test_f1: 0.6380
 epoch: 70, train_loss: 0.6714, test_loss: 0.9337, test_f1: 0.6449
 epoch: 71, train_loss: 0.6636, test_loss: 0.9269, test_f1: 0.6309
 epoch: 72, train_loss: 0.6591, test_loss: 0.9266, test_f1: 0.6352
 epoch: 73, train_loss: 0.6647, test_loss: 0.9331, test_f1: 0.6321
 epoch: 74, train_loss: 0.6587, test_loss: 0.9298, test_f1: 0.6393
 epoch: 75, train_loss: 0.6505, test_loss: 0.9350, test_f1: 0.6203
 epoch: 76, train_loss: 0.6654, test_loss: 0.9419, test_f1: 0.6278
 epoch: 77, train_loss: 0.6574, test_loss: 0.9478, test_f1: 0.6193
 epoch: 78, train_loss: 0.6427, test_loss: 0.9413, test_f1: 0.6282
 epoch: 79, train_loss: 0.6456, test_loss: 0.9466, test_f1: 0.6280
 epoch: 80, train_loss: 0.6463, test_loss: 0.9462, test_f1: 0.6341
 epoch: 81, train_loss: 0.6434, test_loss: 0.9600, test_f1: 0.6224
 epoch: 82, train_loss: 0.6527, test_loss: 0.9647, test_f1: 0.6249
 epoch: 83, train_loss: 0.6478, test_loss: 0.9388, test_f1: 0.6525
 epoch: 84, train_loss: 0.6460, test_loss: 0.9487, test_f1: 0.6387
 epoch: 85, train_loss: 0.6415, test_loss: 0.9509, test_f1: 0.6422
 epoch: 86, train_loss: 0.6367, test_loss: 0.9715, test_f1: 0.6444
 epoch: 87, train_loss: 0.6397, test_loss: 0.9645, test_f1: 0.6195
 epoch: 88, train_loss: 0.6330, test_loss: 0.9678, test_f1: 0.6350
 epoch: 89, train_loss: 0.6408, test_loss: 0.9725, test_f1: 0.6262
 epoch: 90, train_loss: 0.6292, test_loss: 0.9781, test_f1: 0.6191
 epoch: 91, train_loss: 0.6216, test_loss: 0.9684, test_f1: 0.6330
 epoch: 92, train_loss: 0.6265, test_loss: 0.9417, test_f1: 0.6469
 epoch: 93, train_loss: 0.6255, test_loss: 0.9512, test_f1: 0.6553
 epoch: 94, train_loss: 0.6233, test_loss: 0.9484, test_f1: 0.6526
 epoch: 95, train_loss: 0.6331, test_loss: 0.9547, test_f1: 0.6527
 epoch: 96, train_loss: 0.6187, test_loss: 0.9666, test_f1: 0.6458
 epoch: 97, train_loss: 0.6216, test_loss: 0.9664, test_f1: 0.6385
 epoch: 98, train_loss: 0.6231, test_loss: 1.0020, test_f1: 0.6373
 epoch: 99, train_loss: 0.6110, test_loss: 0.9847, test_f1: 0.6283
##################ITERATION #6 ****************************************
 epoch: 0, train_loss: 1.2291, test_loss: 1.0984, test_f1: 0.3944
 epoch: 1, train_loss: 1.0868, test_loss: 1.0105, test_f1: 0.4839
 epoch: 2, train_loss: 1.0501, test_loss: 0.9864, test_f1: 0.5093
 epoch: 3, train_loss: 1.0107, test_loss: 0.9758, test_f1: 0.5142
 epoch: 4, train_loss: 0.9898, test_loss: 0.9624, test_f1: 0.5335
 epoch: 5, train_loss: 0.9677, test_loss: 0.9751, test_f1: 0.5405
 epoch: 6, train_loss: 0.9603, test_loss: 0.9550, test_f1: 0.5271
 epoch: 7, train_loss: 0.9470, test_loss: 0.9431, test_f1: 0.5385
 epoch: 8, train_loss: 0.9342, test_loss: 0.9500, test_f1: 0.5432
 epoch: 9, train_loss: 0.9191, test_loss: 0.9267, test_f1: 0.5348
 epoch: 10, train_loss: 0.9172, test_loss: 0.9365, test_f1: 0.5614
 epoch: 11, train_loss: 0.9046, test_loss: 0.9269, test_f1: 0.5661
 epoch: 12, train_loss: 0.8920, test_loss: 0.9353, test_f1: 0.5444
 epoch: 13, train_loss: 0.8863, test_loss: 0.9125, test_f1: 0.5504
 epoch: 14, train_loss: 0.8756, test_loss: 0.9061, test_f1: 0.5631
 epoch: 15, train_loss: 0.8624, test_loss: 0.9074, test_f1: 0.5661
 epoch: 16, train_loss: 0.8599, test_loss: 0.9181, test_f1: 0.5427
 epoch: 17, train_loss: 0.8574, test_loss: 0.9293, test_f1: 0.5431
 epoch: 18, train_loss: 0.8539, test_loss: 0.9009, test_f1: 0.5542
 epoch: 19, train_loss: 0.8570, test_loss: 0.9010, test_f1: 0.5302
 epoch: 20, train_loss: 0.8404, test_loss: 0.9270, test_f1: 0.5575
 epoch: 21, train_loss: 0.8391, test_loss: 0.8966, test_f1: 0.5630
 epoch: 22, train_loss: 0.8323, test_loss: 0.9728, test_f1: 0.5527
 epoch: 23, train_loss: 0.8268, test_loss: 0.8955, test_f1: 0.5528
 epoch: 24, train_loss: 0.8130, test_loss: 0.9214, test_f1: 0.5687
 epoch: 25, train_loss: 0.8170, test_loss: 0.8929, test_f1: 0.5830
 epoch: 26, train_loss: 0.8121, test_loss: 0.8775, test_f1: 0.5948
 epoch: 27, train_loss: 0.7975, test_loss: 0.9283, test_f1: 0.5716
 epoch: 28, train_loss: 0.8036, test_loss: 0.9072, test_f1: 0.5829
 epoch: 29, train_loss: 0.7993, test_loss: 0.9517, test_f1: 0.5764
 epoch: 30, train_loss: 0.7998, test_loss: 0.9104, test_f1: 0.5966
 epoch: 31, train_loss: 0.7881, test_loss: 0.9347, test_f1: 0.5817
 epoch: 32, train_loss: 0.7813, test_loss: 0.8853, test_f1: 0.5671
 epoch: 33, train_loss: 0.7874, test_loss: 0.9098, test_f1: 0.5738
 epoch: 34, train_loss: 0.7800, test_loss: 0.9241, test_f1: 0.5585
 epoch: 35, train_loss: 0.7778, test_loss: 0.9123, test_f1: 0.5604
 epoch: 36, train_loss: 0.7620, test_loss: 0.9183, test_f1: 0.5772
 epoch: 37, train_loss: 0.7657, test_loss: 0.8966, test_f1: 0.5876
 epoch: 38, train_loss: 0.7619, test_loss: 0.9604, test_f1: 0.5927
 epoch: 39, train_loss: 0.7595, test_loss: 0.8752, test_f1: 0.5855
 epoch: 40, train_loss: 0.7475, test_loss: 0.9064, test_f1: 0.5804
 epoch: 41, train_loss: 0.7470, test_loss: 0.9552, test_f1: 0.5835
 epoch: 42, train_loss: 0.7469, test_loss: 0.8893, test_f1: 0.5841
 epoch: 43, train_loss: 0.7449, test_loss: 0.9235, test_f1: 0.5841
 epoch: 44, train_loss: 0.7313, test_loss: 0.9315, test_f1: 0.5887
 epoch: 45, train_loss: 0.7309, test_loss: 0.9126, test_f1: 0.6323
 epoch: 46, train_loss: 0.7328, test_loss: 0.9220, test_f1: 0.6293
 epoch: 47, train_loss: 0.7286, test_loss: 0.9172, test_f1: 0.5869
 epoch: 48, train_loss: 0.7321, test_loss: 0.9020, test_f1: 0.5973
 epoch: 49, train_loss: 0.7288, test_loss: 0.8880, test_f1: 0.6030
 epoch: 50, train_loss: 0.7237, test_loss: 0.8751, test_f1: 0.6091
 epoch: 51, train_loss: 0.7167, test_loss: 0.9034, test_f1: 0.6288
 epoch: 52, train_loss: 0.7011, test_loss: 0.9094, test_f1: 0.6113
 epoch: 53, train_loss: 0.7072, test_loss: 0.9251, test_f1: 0.6013
 epoch: 54, train_loss: 0.7075, test_loss: 0.9080, test_f1: 0.6107
 epoch: 55, train_loss: 0.6951, test_loss: 0.9316, test_f1: 0.5926
 epoch: 56, train_loss: 0.7001, test_loss: 0.9156, test_f1: 0.5995
 epoch: 57, train_loss: 0.7012, test_loss: 0.9192, test_f1: 0.5845
 epoch: 58, train_loss: 0.6878, test_loss: 0.9262, test_f1: 0.6283
 epoch: 59, train_loss: 0.6936, test_loss: 0.9350, test_f1: 0.5892
 epoch: 60, train_loss: 0.6859, test_loss: 0.9189, test_f1: 0.6110
 epoch: 61, train_loss: 0.6864, test_loss: 0.9184, test_f1: 0.6068
 epoch: 62, train_loss: 0.6889, test_loss: 0.9109, test_f1: 0.6202
 epoch: 63, train_loss: 0.6833, test_loss: 0.9293, test_f1: 0.6051
 epoch: 64, train_loss: 0.6710, test_loss: 0.9193, test_f1: 0.6241
 epoch: 65, train_loss: 0.6766, test_loss: 0.9075, test_f1: 0.6096
 epoch: 66, train_loss: 0.6753, test_loss: 0.9312, test_f1: 0.6309
 epoch: 67, train_loss: 0.6771, test_loss: 0.9340, test_f1: 0.6091
 epoch: 68, train_loss: 0.6685, test_loss: 0.9293, test_f1: 0.6355
 epoch: 69, train_loss: 0.6666, test_loss: 0.9236, test_f1: 0.6248
 epoch: 70, train_loss: 0.6754, test_loss: 0.9150, test_f1: 0.6237
 epoch: 71, train_loss: 0.6704, test_loss: 0.9470, test_f1: 0.6221
 epoch: 72, train_loss: 0.6648, test_loss: 0.9469, test_f1: 0.6323
 epoch: 73, train_loss: 0.6629, test_loss: 0.9357, test_f1: 0.6213
 epoch: 74, train_loss: 0.6652, test_loss: 0.9475, test_f1: 0.5902
 epoch: 75, train_loss: 0.6657, test_loss: 0.9468, test_f1: 0.5985
 epoch: 76, train_loss: 0.6508, test_loss: 0.9381, test_f1: 0.6048
 epoch: 77, train_loss: 0.6486, test_loss: 0.9327, test_f1: 0.6242
 epoch: 78, train_loss: 0.6584, test_loss: 0.9675, test_f1: 0.6342
 epoch: 79, train_loss: 0.6448, test_loss: 0.9457, test_f1: 0.6284
 epoch: 80, train_loss: 0.6574, test_loss: 0.9508, test_f1: 0.6184
 epoch: 81, train_loss: 0.6518, test_loss: 0.9442, test_f1: 0.6243
 epoch: 82, train_loss: 0.6519, test_loss: 0.9549, test_f1: 0.6302
 epoch: 83, train_loss: 0.6518, test_loss: 0.9871, test_f1: 0.6107
 epoch: 84, train_loss: 0.6610, test_loss: 0.9292, test_f1: 0.6361
 epoch: 85, train_loss: 0.6522, test_loss: 0.9976, test_f1: 0.6282
 epoch: 86, train_loss: 0.6566, test_loss: 0.9716, test_f1: 0.6286
 epoch: 87, train_loss: 0.6454, test_loss: 0.9842, test_f1: 0.6383
 epoch: 88, train_loss: 0.6417, test_loss: 0.9769, test_f1: 0.5975
 epoch: 89, train_loss: 0.6323, test_loss: 0.9524, test_f1: 0.6394
 epoch: 90, train_loss: 0.6415, test_loss: 0.9772, test_f1: 0.6584
 epoch: 91, train_loss: 0.6325, test_loss: 0.9378, test_f1: 0.6413
 epoch: 92, train_loss: 0.6345, test_loss: 0.9935, test_f1: 0.6156
 epoch: 93, train_loss: 0.6164, test_loss: 0.9534, test_f1: 0.6602
 epoch: 94, train_loss: 0.6338, test_loss: 0.9727, test_f1: 0.6254
 epoch: 95, train_loss: 0.6310, test_loss: 0.9850, test_f1: 0.6608
 epoch: 96, train_loss: 0.6324, test_loss: 0.9727, test_f1: 0.6472
 epoch: 97, train_loss: 0.6232, test_loss: 0.9770, test_f1: 0.6326
 epoch: 98, train_loss: 0.6385, test_loss: 1.0007, test_f1: 0.6406
 epoch: 99, train_loss: 0.6352, test_loss: 0.9845, test_f1: 0.6619
##################ITERATION #7 ****************************************
 epoch: 0, train_loss: 1.2782, test_loss: 1.0634, test_f1: 0.4095
 epoch: 1, train_loss: 1.0877, test_loss: 0.9727, test_f1: 0.4605
 epoch: 2, train_loss: 1.0454, test_loss: 0.9426, test_f1: 0.4955
 epoch: 3, train_loss: 1.0124, test_loss: 0.9233, test_f1: 0.5216
 epoch: 4, train_loss: 0.9936, test_loss: 0.9142, test_f1: 0.5137
 epoch: 5, train_loss: 0.9753, test_loss: 0.8999, test_f1: 0.5151
 epoch: 6, train_loss: 0.9581, test_loss: 0.8988, test_f1: 0.5387
 epoch: 7, train_loss: 0.9344, test_loss: 0.8836, test_f1: 0.5332
 epoch: 8, train_loss: 0.9289, test_loss: 0.8948, test_f1: 0.5316
 epoch: 9, train_loss: 0.9182, test_loss: 0.8943, test_f1: 0.5305
 epoch: 10, train_loss: 0.9120, test_loss: 0.8973, test_f1: 0.5327
 epoch: 11, train_loss: 0.8893, test_loss: 0.8763, test_f1: 0.5563
 epoch: 12, train_loss: 0.8920, test_loss: 0.8684, test_f1: 0.5378
 epoch: 13, train_loss: 0.8875, test_loss: 0.8682, test_f1: 0.5495
 epoch: 14, train_loss: 0.8675, test_loss: 0.8734, test_f1: 0.5420
 epoch: 15, train_loss: 0.8724, test_loss: 0.8689, test_f1: 0.5410
 epoch: 16, train_loss: 0.8578, test_loss: 0.8666, test_f1: 0.5480
 epoch: 17, train_loss: 0.8553, test_loss: 0.8729, test_f1: 0.5426
 epoch: 18, train_loss: 0.8454, test_loss: 0.8652, test_f1: 0.5541
 epoch: 19, train_loss: 0.8429, test_loss: 0.8726, test_f1: 0.5524
 epoch: 20, train_loss: 0.8422, test_loss: 0.8764, test_f1: 0.5454
 epoch: 21, train_loss: 0.8386, test_loss: 0.8664, test_f1: 0.5557
 epoch: 22, train_loss: 0.8265, test_loss: 0.8743, test_f1: 0.5617
 epoch: 23, train_loss: 0.8215, test_loss: 0.8791, test_f1: 0.5504
 epoch: 24, train_loss: 0.8127, test_loss: 0.8683, test_f1: 0.5485
 epoch: 25, train_loss: 0.8124, test_loss: 0.8720, test_f1: 0.5848
 epoch: 26, train_loss: 0.8079, test_loss: 0.8961, test_f1: 0.5659
 epoch: 27, train_loss: 0.8052, test_loss: 0.8768, test_f1: 0.5572
 epoch: 28, train_loss: 0.7958, test_loss: 0.8856, test_f1: 0.5517
 epoch: 29, train_loss: 0.7862, test_loss: 0.8894, test_f1: 0.5530
 epoch: 30, train_loss: 0.7936, test_loss: 0.9014, test_f1: 0.5507
 epoch: 31, train_loss: 0.7850, test_loss: 0.8812, test_f1: 0.5680
 epoch: 32, train_loss: 0.7745, test_loss: 0.8680, test_f1: 0.5524
 epoch: 33, train_loss: 0.7671, test_loss: 0.9069, test_f1: 0.5561
 epoch: 34, train_loss: 0.7675, test_loss: 0.8881, test_f1: 0.5742
 epoch: 35, train_loss: 0.7624, test_loss: 0.8987, test_f1: 0.5728
 epoch: 36, train_loss: 0.7476, test_loss: 0.9264, test_f1: 0.5755
 epoch: 37, train_loss: 0.7536, test_loss: 0.8903, test_f1: 0.5792
 epoch: 38, train_loss: 0.7525, test_loss: 0.8830, test_f1: 0.5845
 epoch: 39, train_loss: 0.7520, test_loss: 0.8732, test_f1: 0.5668
 epoch: 40, train_loss: 0.7428, test_loss: 0.8930, test_f1: 0.5937
 epoch: 41, train_loss: 0.7422, test_loss: 0.8777, test_f1: 0.5932
 epoch: 42, train_loss: 0.7361, test_loss: 0.8862, test_f1: 0.5974
 epoch: 43, train_loss: 0.7320, test_loss: 0.9205, test_f1: 0.5856
 epoch: 44, train_loss: 0.7307, test_loss: 0.9013, test_f1: 0.5824
 epoch: 45, train_loss: 0.7161, test_loss: 0.8998, test_f1: 0.5778
 epoch: 46, train_loss: 0.7151, test_loss: 0.8812, test_f1: 0.6067
 epoch: 47, train_loss: 0.7062, test_loss: 0.9274, test_f1: 0.5991
 epoch: 48, train_loss: 0.7237, test_loss: 0.9220, test_f1: 0.5906
 epoch: 49, train_loss: 0.7064, test_loss: 0.9169, test_f1: 0.5803
 epoch: 50, train_loss: 0.7062, test_loss: 0.9196, test_f1: 0.5987
 epoch: 51, train_loss: 0.6970, test_loss: 0.9272, test_f1: 0.6203
 epoch: 52, train_loss: 0.6925, test_loss: 0.9271, test_f1: 0.5854
 epoch: 53, train_loss: 0.6947, test_loss: 0.9056, test_f1: 0.6249
 epoch: 54, train_loss: 0.6807, test_loss: 0.9059, test_f1: 0.6059
 epoch: 55, train_loss: 0.6752, test_loss: 0.9342, test_f1: 0.5900
 epoch: 56, train_loss: 0.6675, test_loss: 0.9193, test_f1: 0.6061
 epoch: 57, train_loss: 0.6751, test_loss: 0.9349, test_f1: 0.5909
 epoch: 58, train_loss: 0.6669, test_loss: 0.9231, test_f1: 0.6043
 epoch: 59, train_loss: 0.6832, test_loss: 0.9134, test_f1: 0.6247
 epoch: 60, train_loss: 0.6634, test_loss: 0.9400, test_f1: 0.6070
 epoch: 61, train_loss: 0.6641, test_loss: 0.9090, test_f1: 0.6183
 epoch: 62, train_loss: 0.6650, test_loss: 0.9194, test_f1: 0.6239
 epoch: 63, train_loss: 0.6475, test_loss: 0.9215, test_f1: 0.6110
 epoch: 64, train_loss: 0.6529, test_loss: 0.9353, test_f1: 0.6167
 epoch: 65, train_loss: 0.6446, test_loss: 0.9313, test_f1: 0.6306
 epoch: 66, train_loss: 0.6667, test_loss: 0.9428, test_f1: 0.5964
 epoch: 67, train_loss: 0.6527, test_loss: 0.9381, test_f1: 0.6279
 epoch: 68, train_loss: 0.6496, test_loss: 0.9539, test_f1: 0.6259
 epoch: 69, train_loss: 0.6450, test_loss: 0.9675, test_f1: 0.5837
 epoch: 70, train_loss: 0.6575, test_loss: 0.9408, test_f1: 0.6291
 epoch: 71, train_loss: 0.6336, test_loss: 0.9397, test_f1: 0.6015
 epoch: 72, train_loss: 0.6457, test_loss: 0.9424, test_f1: 0.6262
 epoch: 73, train_loss: 0.6447, test_loss: 0.9348, test_f1: 0.6288
 epoch: 74, train_loss: 0.6425, test_loss: 0.9378, test_f1: 0.6312
 epoch: 75, train_loss: 0.6347, test_loss: 0.9365, test_f1: 0.6165
 epoch: 76, train_loss: 0.6379, test_loss: 0.9447, test_f1: 0.6069
 epoch: 77, train_loss: 0.6312, test_loss: 0.9450, test_f1: 0.6159
 epoch: 78, train_loss: 0.6252, test_loss: 0.9254, test_f1: 0.6356
 epoch: 79, train_loss: 0.6388, test_loss: 0.9275, test_f1: 0.6306
 epoch: 80, train_loss: 0.6300, test_loss: 0.9466, test_f1: 0.6617
 epoch: 81, train_loss: 0.6262, test_loss: 0.9252, test_f1: 0.6450
 epoch: 82, train_loss: 0.6318, test_loss: 0.9606, test_f1: 0.6297
 epoch: 83, train_loss: 0.6296, test_loss: 0.9528, test_f1: 0.6109
 epoch: 84, train_loss: 0.6243, test_loss: 0.9571, test_f1: 0.6154
 epoch: 85, train_loss: 0.6195, test_loss: 0.9839, test_f1: 0.6231
 epoch: 86, train_loss: 0.6068, test_loss: 0.9809, test_f1: 0.6338
 epoch: 87, train_loss: 0.6181, test_loss: 0.9684, test_f1: 0.6308
 epoch: 88, train_loss: 0.6119, test_loss: 0.9723, test_f1: 0.6326
 epoch: 89, train_loss: 0.6059, test_loss: 0.9626, test_f1: 0.6439
 epoch: 90, train_loss: 0.6025, test_loss: 0.9855, test_f1: 0.6501
 epoch: 91, train_loss: 0.6222, test_loss: 0.9842, test_f1: 0.6298
 epoch: 92, train_loss: 0.6037, test_loss: 1.0116, test_f1: 0.6409
 epoch: 93, train_loss: 0.6136, test_loss: 1.0348, test_f1: 0.6263
 epoch: 94, train_loss: 0.6047, test_loss: 0.9795, test_f1: 0.6497
 epoch: 95, train_loss: 0.5963, test_loss: 0.9988, test_f1: 0.6183
 epoch: 96, train_loss: 0.5937, test_loss: 1.0151, test_f1: 0.6362
 epoch: 97, train_loss: 0.6025, test_loss: 0.9796, test_f1: 0.6445
 epoch: 98, train_loss: 0.6008, test_loss: 0.9934, test_f1: 0.6444
 epoch: 99, train_loss: 0.5962, test_loss: 0.9832, test_f1: 0.6547
##################ITERATION #8 ****************************************
 epoch: 0, train_loss: 1.2960, test_loss: 1.0503, test_f1: 0.4619
 epoch: 1, train_loss: 1.1153, test_loss: 0.9875, test_f1: 0.4684
 epoch: 2, train_loss: 1.0726, test_loss: 0.9757, test_f1: 0.5215
 epoch: 3, train_loss: 1.0442, test_loss: 0.9535, test_f1: 0.5080
 epoch: 4, train_loss: 1.0146, test_loss: 0.9425, test_f1: 0.5008
 epoch: 5, train_loss: 1.0005, test_loss: 0.9269, test_f1: 0.5606
 epoch: 6, train_loss: 0.9867, test_loss: 0.9220, test_f1: 0.5521
 epoch: 7, train_loss: 0.9603, test_loss: 0.9266, test_f1: 0.5309
 epoch: 8, train_loss: 0.9620, test_loss: 0.9178, test_f1: 0.5266
 epoch: 9, train_loss: 0.9531, test_loss: 0.9121, test_f1: 0.5572
 epoch: 10, train_loss: 0.9364, test_loss: 0.9120, test_f1: 0.5244
 epoch: 11, train_loss: 0.9226, test_loss: 0.9016, test_f1: 0.5408
 epoch: 12, train_loss: 0.9176, test_loss: 0.9147, test_f1: 0.5350
 epoch: 13, train_loss: 0.9077, test_loss: 0.8932, test_f1: 0.5530
 epoch: 14, train_loss: 0.8937, test_loss: 0.9085, test_f1: 0.5312
 epoch: 15, train_loss: 0.8943, test_loss: 0.9026, test_f1: 0.5392
 epoch: 16, train_loss: 0.8860, test_loss: 0.8989, test_f1: 0.5591
 epoch: 17, train_loss: 0.8900, test_loss: 0.9128, test_f1: 0.5483
 epoch: 18, train_loss: 0.8743, test_loss: 0.9037, test_f1: 0.5730
 epoch: 19, train_loss: 0.8689, test_loss: 0.8913, test_f1: 0.5650
 epoch: 20, train_loss: 0.8644, test_loss: 0.8986, test_f1: 0.5778
 epoch: 21, train_loss: 0.8487, test_loss: 0.8815, test_f1: 0.5752
 epoch: 22, train_loss: 0.8515, test_loss: 0.8875, test_f1: 0.5695
 epoch: 23, train_loss: 0.8398, test_loss: 0.9151, test_f1: 0.5776
 epoch: 24, train_loss: 0.8260, test_loss: 0.8976, test_f1: 0.5554
 epoch: 25, train_loss: 0.8302, test_loss: 0.9317, test_f1: 0.5581
 epoch: 26, train_loss: 0.8340, test_loss: 0.9103, test_f1: 0.5901
 epoch: 27, train_loss: 0.8217, test_loss: 0.9340, test_f1: 0.5748
 epoch: 28, train_loss: 0.8232, test_loss: 0.9154, test_f1: 0.5852
 epoch: 29, train_loss: 0.8051, test_loss: 0.9453, test_f1: 0.5998
 epoch: 30, train_loss: 0.8023, test_loss: 0.9139, test_f1: 0.5685
 epoch: 31, train_loss: 0.8042, test_loss: 0.9191, test_f1: 0.5745
 epoch: 32, train_loss: 0.8029, test_loss: 0.9405, test_f1: 0.5785
 epoch: 33, train_loss: 0.7895, test_loss: 0.9514, test_f1: 0.5816
 epoch: 34, train_loss: 0.7957, test_loss: 0.9483, test_f1: 0.5700
 epoch: 35, train_loss: 0.7859, test_loss: 0.9442, test_f1: 0.5862
 epoch: 36, train_loss: 0.7836, test_loss: 0.9694, test_f1: 0.5684
 epoch: 37, train_loss: 0.7767, test_loss: 0.9353, test_f1: 0.5719
 epoch: 38, train_loss: 0.7734, test_loss: 0.9747, test_f1: 0.5636
 epoch: 39, train_loss: 0.7695, test_loss: 0.9522, test_f1: 0.5732
 epoch: 40, train_loss: 0.7594, test_loss: 0.9516, test_f1: 0.5880
 epoch: 41, train_loss: 0.7703, test_loss: 0.9599, test_f1: 0.5809
 epoch: 42, train_loss: 0.7690, test_loss: 0.9427, test_f1: 0.5773
 epoch: 43, train_loss: 0.7643, test_loss: 0.9689, test_f1: 0.6002
 epoch: 44, train_loss: 0.7666, test_loss: 0.9508, test_f1: 0.6007
 epoch: 45, train_loss: 0.7444, test_loss: 0.9807, test_f1: 0.6184
 epoch: 46, train_loss: 0.7497, test_loss: 0.9646, test_f1: 0.5953
 epoch: 47, train_loss: 0.7479, test_loss: 0.9866, test_f1: 0.5920
 epoch: 48, train_loss: 0.7412, test_loss: 0.9312, test_f1: 0.5882
 epoch: 49, train_loss: 0.7301, test_loss: 0.9694, test_f1: 0.5982
 epoch: 50, train_loss: 0.7235, test_loss: 0.9790, test_f1: 0.6184
 epoch: 51, train_loss: 0.7222, test_loss: 0.9502, test_f1: 0.5989
 epoch: 52, train_loss: 0.7175, test_loss: 0.9817, test_f1: 0.5979
 epoch: 53, train_loss: 0.7169, test_loss: 0.9797, test_f1: 0.6009
 epoch: 54, train_loss: 0.7083, test_loss: 0.9609, test_f1: 0.5831
 epoch: 55, train_loss: 0.7120, test_loss: 0.9705, test_f1: 0.5893
 epoch: 56, train_loss: 0.7003, test_loss: 1.0039, test_f1: 0.5893
 epoch: 57, train_loss: 0.6934, test_loss: 0.9753, test_f1: 0.6033
 epoch: 58, train_loss: 0.6905, test_loss: 0.9779, test_f1: 0.5977
 epoch: 59, train_loss: 0.7024, test_loss: 0.9729, test_f1: 0.5979
 epoch: 60, train_loss: 0.7008, test_loss: 0.9968, test_f1: 0.6075
 epoch: 61, train_loss: 0.6891, test_loss: 0.9892, test_f1: 0.6020
 epoch: 62, train_loss: 0.6833, test_loss: 0.9917, test_f1: 0.5978
 epoch: 63, train_loss: 0.6904, test_loss: 0.9806, test_f1: 0.6100
 epoch: 64, train_loss: 0.6821, test_loss: 0.9845, test_f1: 0.6074
 epoch: 65, train_loss: 0.6860, test_loss: 0.9872, test_f1: 0.6148
 epoch: 66, train_loss: 0.6933, test_loss: 1.0123, test_f1: 0.6210
 epoch: 67, train_loss: 0.6737, test_loss: 1.0139, test_f1: 0.6105
 epoch: 68, train_loss: 0.6794, test_loss: 0.9752, test_f1: 0.6165
 epoch: 69, train_loss: 0.6670, test_loss: 0.9851, test_f1: 0.6057
 epoch: 70, train_loss: 0.6749, test_loss: 0.9792, test_f1: 0.6185
 epoch: 71, train_loss: 0.6792, test_loss: 1.0020, test_f1: 0.6009
 epoch: 72, train_loss: 0.6760, test_loss: 0.9775, test_f1: 0.6116
 epoch: 73, train_loss: 0.6695, test_loss: 1.0174, test_f1: 0.6306
 epoch: 74, train_loss: 0.6630, test_loss: 0.9977, test_f1: 0.6097
 epoch: 75, train_loss: 0.6718, test_loss: 0.9900, test_f1: 0.6110
 epoch: 76, train_loss: 0.6598, test_loss: 1.0236, test_f1: 0.6293
 epoch: 77, train_loss: 0.6638, test_loss: 1.0144, test_f1: 0.6150
 epoch: 78, train_loss: 0.6587, test_loss: 1.0404, test_f1: 0.5795
 epoch: 79, train_loss: 0.6613, test_loss: 1.0198, test_f1: 0.6081
 epoch: 80, train_loss: 0.6564, test_loss: 1.0217, test_f1: 0.6114
 epoch: 81, train_loss: 0.6540, test_loss: 1.0088, test_f1: 0.6217
 epoch: 82, train_loss: 0.6552, test_loss: 0.9843, test_f1: 0.6263
 epoch: 83, train_loss: 0.6537, test_loss: 1.0120, test_f1: 0.6088
 epoch: 84, train_loss: 0.6494, test_loss: 1.0496, test_f1: 0.6111
 epoch: 85, train_loss: 0.6593, test_loss: 1.0615, test_f1: 0.6154
 epoch: 86, train_loss: 0.6393, test_loss: 1.0114, test_f1: 0.6402
 epoch: 87, train_loss: 0.6388, test_loss: 1.0169, test_f1: 0.6262
 epoch: 88, train_loss: 0.6478, test_loss: 1.0435, test_f1: 0.6285
 epoch: 89, train_loss: 0.6397, test_loss: 1.0316, test_f1: 0.6143
 epoch: 90, train_loss: 0.6393, test_loss: 1.0530, test_f1: 0.6081
 epoch: 91, train_loss: 0.6357, test_loss: 1.0338, test_f1: 0.6234
 epoch: 92, train_loss: 0.6374, test_loss: 1.0438, test_f1: 0.6174
 epoch: 93, train_loss: 0.6370, test_loss: 1.0503, test_f1: 0.6392
 epoch: 94, train_loss: 0.6232, test_loss: 1.0326, test_f1: 0.6344
 epoch: 95, train_loss: 0.6257, test_loss: 1.0743, test_f1: 0.6160
 epoch: 96, train_loss: 0.6192, test_loss: 1.0555, test_f1: 0.6252
 epoch: 97, train_loss: 0.6231, test_loss: 1.0490, test_f1: 0.6341
 epoch: 98, train_loss: 0.6345, test_loss: 1.0590, test_f1: 0.6361
 epoch: 99, train_loss: 0.6170, test_loss: 1.0536, test_f1: 0.6265
##################ITERATION #9 ****************************************
 epoch: 0, train_loss: 1.3380, test_loss: 1.1225, test_f1: 0.3782
 epoch: 1, train_loss: 1.1480, test_loss: 1.0076, test_f1: 0.4806
 epoch: 2, train_loss: 1.0767, test_loss: 0.9644, test_f1: 0.5030
 epoch: 3, train_loss: 1.0588, test_loss: 0.9447, test_f1: 0.5288
 epoch: 4, train_loss: 1.0339, test_loss: 0.9366, test_f1: 0.5249
 epoch: 5, train_loss: 1.0018, test_loss: 0.9139, test_f1: 0.5236
 epoch: 6, train_loss: 0.9838, test_loss: 0.9140, test_f1: 0.5577
 epoch: 7, train_loss: 0.9597, test_loss: 0.9144, test_f1: 0.5421
 epoch: 8, train_loss: 0.9570, test_loss: 0.9060, test_f1: 0.5651
 epoch: 9, train_loss: 0.9377, test_loss: 0.9028, test_f1: 0.5462
 epoch: 10, train_loss: 0.9290, test_loss: 0.9020, test_f1: 0.5358
 epoch: 11, train_loss: 0.9221, test_loss: 0.9021, test_f1: 0.5495
 epoch: 12, train_loss: 0.9049, test_loss: 0.8881, test_f1: 0.5617
 epoch: 13, train_loss: 0.8899, test_loss: 0.8731, test_f1: 0.5584
 epoch: 14, train_loss: 0.8887, test_loss: 0.8847, test_f1: 0.5486
 epoch: 15, train_loss: 0.8853, test_loss: 0.8778, test_f1: 0.5371
 epoch: 16, train_loss: 0.8754, test_loss: 0.8845, test_f1: 0.5496
 epoch: 17, train_loss: 0.8686, test_loss: 0.8870, test_f1: 0.5528
 epoch: 18, train_loss: 0.8587, test_loss: 0.8797, test_f1: 0.5538
 epoch: 19, train_loss: 0.8454, test_loss: 0.8931, test_f1: 0.5761
 epoch: 20, train_loss: 0.8413, test_loss: 0.8872, test_f1: 0.5893
 epoch: 21, train_loss: 0.8407, test_loss: 0.8820, test_f1: 0.5736
 epoch: 22, train_loss: 0.8338, test_loss: 0.8958, test_f1: 0.5892
 epoch: 23, train_loss: 0.8281, test_loss: 0.9002, test_f1: 0.5522
 epoch: 24, train_loss: 0.8217, test_loss: 0.8879, test_f1: 0.5789
 epoch: 25, train_loss: 0.8198, test_loss: 0.8897, test_f1: 0.5637
 epoch: 26, train_loss: 0.8171, test_loss: 0.8852, test_f1: 0.5789
 epoch: 27, train_loss: 0.8311, test_loss: 0.8831, test_f1: 0.5813
 epoch: 28, train_loss: 0.8088, test_loss: 0.8846, test_f1: 0.5658
 epoch: 29, train_loss: 0.7967, test_loss: 0.8691, test_f1: 0.5817
 epoch: 30, train_loss: 0.7888, test_loss: 0.8719, test_f1: 0.5735
 epoch: 31, train_loss: 0.7892, test_loss: 0.9016, test_f1: 0.5692
 epoch: 32, train_loss: 0.7928, test_loss: 0.8692, test_f1: 0.5776
 epoch: 33, train_loss: 0.7834, test_loss: 0.8938, test_f1: 0.5864
 epoch: 34, train_loss: 0.7764, test_loss: 0.8629, test_f1: 0.5885
 epoch: 35, train_loss: 0.7702, test_loss: 0.8909, test_f1: 0.5839
 epoch: 36, train_loss: 0.7639, test_loss: 0.8642, test_f1: 0.5844
 epoch: 37, train_loss: 0.7609, test_loss: 0.8938, test_f1: 0.5810
 epoch: 38, train_loss: 0.7664, test_loss: 0.8758, test_f1: 0.5834
 epoch: 39, train_loss: 0.7589, test_loss: 0.9022, test_f1: 0.5875
 epoch: 40, train_loss: 0.7513, test_loss: 0.9057, test_f1: 0.5775
 epoch: 41, train_loss: 0.7556, test_loss: 0.9048, test_f1: 0.6004
 epoch: 42, train_loss: 0.7496, test_loss: 0.8860, test_f1: 0.5969
 epoch: 43, train_loss: 0.7440, test_loss: 0.8970, test_f1: 0.6003
 epoch: 44, train_loss: 0.7426, test_loss: 0.8898, test_f1: 0.6062
 epoch: 45, train_loss: 0.7372, test_loss: 0.9339, test_f1: 0.5896
 epoch: 46, train_loss: 0.7294, test_loss: 0.9122, test_f1: 0.6083
 epoch: 47, train_loss: 0.7287, test_loss: 0.8952, test_f1: 0.6372
 epoch: 48, train_loss: 0.7178, test_loss: 0.9039, test_f1: 0.5996
 epoch: 49, train_loss: 0.7272, test_loss: 0.8903, test_f1: 0.6156
 epoch: 50, train_loss: 0.7109, test_loss: 0.8909, test_f1: 0.5968
 epoch: 51, train_loss: 0.7032, test_loss: 0.8714, test_f1: 0.6239
 epoch: 52, train_loss: 0.7034, test_loss: 0.8868, test_f1: 0.6310
 epoch: 53, train_loss: 0.7020, test_loss: 0.8987, test_f1: 0.6328
 epoch: 54, train_loss: 0.7020, test_loss: 0.9024, test_f1: 0.6332
 epoch: 55, train_loss: 0.7026, test_loss: 0.8941, test_f1: 0.6344
 epoch: 56, train_loss: 0.6902, test_loss: 0.8988, test_f1: 0.6396
 epoch: 57, train_loss: 0.6848, test_loss: 0.9110, test_f1: 0.6277
 epoch: 58, train_loss: 0.6944, test_loss: 0.9055, test_f1: 0.6328
 epoch: 59, train_loss: 0.6898, test_loss: 0.9052, test_f1: 0.6302
 epoch: 60, train_loss: 0.6868, test_loss: 0.9020, test_f1: 0.6422
 epoch: 61, train_loss: 0.6937, test_loss: 0.9009, test_f1: 0.6317
 epoch: 62, train_loss: 0.6945, test_loss: 0.9157, test_f1: 0.6333
 epoch: 63, train_loss: 0.6803, test_loss: 0.9123, test_f1: 0.6240
 epoch: 64, train_loss: 0.6805, test_loss: 0.8950, test_f1: 0.6417
 epoch: 65, train_loss: 0.6864, test_loss: 0.9005, test_f1: 0.6323
 epoch: 66, train_loss: 0.6862, test_loss: 0.9029, test_f1: 0.6345
 epoch: 67, train_loss: 0.6776, test_loss: 0.8976, test_f1: 0.6282
 epoch: 68, train_loss: 0.6748, test_loss: 0.9076, test_f1: 0.6274
 epoch: 69, train_loss: 0.6724, test_loss: 0.9153, test_f1: 0.6482
 epoch: 70, train_loss: 0.6732, test_loss: 0.9099, test_f1: 0.6291
 epoch: 71, train_loss: 0.6692, test_loss: 0.9269, test_f1: 0.6124
 epoch: 72, train_loss: 0.6780, test_loss: 0.8964, test_f1: 0.6506
 epoch: 73, train_loss: 0.6628, test_loss: 0.8920, test_f1: 0.6376
 epoch: 74, train_loss: 0.6626, test_loss: 0.9202, test_f1: 0.6344
 epoch: 75, train_loss: 0.6576, test_loss: 0.9014, test_f1: 0.6344
 epoch: 76, train_loss: 0.6600, test_loss: 0.9156, test_f1: 0.6441
 epoch: 77, train_loss: 0.6591, test_loss: 0.9402, test_f1: 0.6271
 epoch: 78, train_loss: 0.6559, test_loss: 0.9266, test_f1: 0.6331
 epoch: 79, train_loss: 0.6552, test_loss: 0.9154, test_f1: 0.6391
 epoch: 80, train_loss: 0.6425, test_loss: 0.9322, test_f1: 0.6332
 epoch: 81, train_loss: 0.6520, test_loss: 0.9119, test_f1: 0.6402
 epoch: 82, train_loss: 0.6439, test_loss: 0.9062, test_f1: 0.6640
 epoch: 83, train_loss: 0.6497, test_loss: 0.9224, test_f1: 0.6329
 epoch: 84, train_loss: 0.6509, test_loss: 0.9187, test_f1: 0.6496
 epoch: 85, train_loss: 0.6483, test_loss: 0.9394, test_f1: 0.6327
 epoch: 86, train_loss: 0.6408, test_loss: 0.9213, test_f1: 0.6466
 epoch: 87, train_loss: 0.6361, test_loss: 0.9280, test_f1: 0.6466
 epoch: 88, train_loss: 0.6335, test_loss: 0.9207, test_f1: 0.6454
 epoch: 89, train_loss: 0.6327, test_loss: 0.9389, test_f1: 0.6379
 epoch: 90, train_loss: 0.6435, test_loss: 0.9469, test_f1: 0.6368
 epoch: 91, train_loss: 0.6259, test_loss: 0.9319, test_f1: 0.6408
 epoch: 92, train_loss: 0.6329, test_loss: 0.9417, test_f1: 0.6485
 epoch: 93, train_loss: 0.6192, test_loss: 0.9207, test_f1: 0.6578
 epoch: 94, train_loss: 0.6349, test_loss: 0.9243, test_f1: 0.6544
 epoch: 95, train_loss: 0.6260, test_loss: 0.9454, test_f1: 0.6258
 epoch: 96, train_loss: 0.6235, test_loss: 0.9227, test_f1: 0.6475
 epoch: 97, train_loss: 0.6181, test_loss: 0.9343, test_f1: 0.6458
 epoch: 98, train_loss: 0.6303, test_loss: 0.9387, test_f1: 0.6477
 epoch: 99, train_loss: 0.6127, test_loss: 0.9494, test_f1: 0.6319

Training completed in 850.06 seconds
Best F1: 0.6770 at epoch 83
Mean F1 across iterations: 0.6557  0.0128
========================FINAL RESULTS================================
FEGIN weighted F1: 0.6770  0.0128
python main.py --data ltspice_examples --representation component_net --model FEGIN --layers 2 --hiddens 128 --batch_size 64 --lr 0.0001 --emb_size 128 --epochs 100 --save_appendix component_net_L2_H128_BS64_LR0.0001_E128 --no_val
-----



STDERR:
  File "main.py", line 370, in <module>
    main()
  File "main.py", line 254, in main
    dataset = dataset_class(
  File "/home/philip/projects/llm_inference_code_repo/Circuit-Completion-Using-GNNs/component_classification_with_link_prediction_head/evaluation/FEGIN/kernel/circuit_datasets.py", line 15, in __init__
    self.data, self.slices = torch.load(self.processed_paths[0])
  File "/home/philip/.local/lib/python3.8/site-packages/torch/serialization.py", line 1040, in load
    warnings.warn(
  File "/usr/lib/python3.8/warnings.py", line 109, in _showwarnmsg
    sw(msg.message, msg.category, msg.filename, msg.lineno,
  File "main.py", line 47, in warn_with_traceback
    traceback.print_stack(file=log)
/home/philip/projects/llm_inference_code_repo/Circuit-Completion-Using-GNNs/component_classification_with_link_prediction_head/evaluation/FEGIN/kernel/circuit_datasets.py:15: FutureWarning: You are using `torch.load` with `weights_only=False` (the current default value), which uses the default pickle module implicitly. It is possible to construct malicious pickle data which will execute arbitrary code during unpickling (See https://github.com/pytorch/pytorch/blob/main/SECURITY.md#untrusted-models for more details). In a future release, the default value for `weights_only` will be flipped to `True`. This limits the functions that could be executed during unpickling. Arbitrary objects will no longer be allowed to be loaded via this mode unless they are explicitly allowlisted by the user via `torch.serialization.add_safe_globals`. We recommend you start setting `weights_only=True` for any use case where you don't have full control of the loaded file. Please open an issue on GitHub for any issues related to this experimental feature.
  self.data, self.slices = torch.load(self.processed_paths[0])
