STDOUT:
Results will be saved in /home/philip/projects/ltspice_examples_code_repo/Circuit-Completion-Using-GNNs/component_classification_with_link_prediction_head/evaluation/FEGIN/results/model_FEGIN_dataset_ltspice_examples
Command line input: python main.py --data ltspice_examples --representation component_pin --model FEGIN --layers 4 --hiddens 32 --batch_size 256 --lr 0.001 --emb_size 128 --epochs 100 --save_appendix component_pin_L4_H32_BS256_LR0.001_E128 --no_val
 is saved.
-----
ltspice_examples - FEGIN
Using 4 layers, 32 hidden units, h = 2
Loading component_pin representation dataset
ENTERED
Training FEGIN on component_pin representation
Train: 3560, Test: 848
##################ITERATION #0 ****************************************
 epoch: 0, train_loss: 1.3457, test_loss: 1.3400, test_f1: 0.2260
 epoch: 1, train_loss: 1.3089, test_loss: 1.3233, test_f1: 0.2260
 epoch: 2, train_loss: 1.2632, test_loss: 1.2995, test_f1: 0.2260
 epoch: 3, train_loss: 1.2073, test_loss: 1.2734, test_f1: 0.2260
 epoch: 4, train_loss: 1.1495, test_loss: 1.3097, test_f1: 0.2260
 epoch: 5, train_loss: 1.0874, test_loss: 1.1018, test_f1: 0.3404
 epoch: 6, train_loss: 1.0444, test_loss: 1.0214, test_f1: 0.3445
 epoch: 7, train_loss: 1.0130, test_loss: 1.0167, test_f1: 0.3763
 epoch: 8, train_loss: 1.0034, test_loss: 1.0273, test_f1: 0.3434
 epoch: 9, train_loss: 0.9898, test_loss: 0.9978, test_f1: 0.3550
 epoch: 10, train_loss: 0.9776, test_loss: 1.0711, test_f1: 0.3482
 epoch: 11, train_loss: 0.9647, test_loss: 1.0075, test_f1: 0.4086
 epoch: 12, train_loss: 0.9583, test_loss: 0.9881, test_f1: 0.4690
 epoch: 13, train_loss: 0.9451, test_loss: 1.0414, test_f1: 0.3923
 epoch: 14, train_loss: 0.9255, test_loss: 0.9479, test_f1: 0.4694
 epoch: 15, train_loss: 0.9304, test_loss: 0.9664, test_f1: 0.4415
 epoch: 16, train_loss: 0.9090, test_loss: 0.9548, test_f1: 0.4717
 epoch: 17, train_loss: 0.8976, test_loss: 0.9683, test_f1: 0.4983
 epoch: 18, train_loss: 0.8949, test_loss: 0.9622, test_f1: 0.4768
 epoch: 19, train_loss: 0.8846, test_loss: 0.9656, test_f1: 0.5030
 epoch: 20, train_loss: 0.8802, test_loss: 0.9133, test_f1: 0.5042
 epoch: 21, train_loss: 0.8559, test_loss: 0.9727, test_f1: 0.4834
 epoch: 22, train_loss: 0.8402, test_loss: 0.9451, test_f1: 0.5018
 epoch: 23, train_loss: 0.8497, test_loss: 1.0508, test_f1: 0.4936
 epoch: 24, train_loss: 0.8337, test_loss: 0.9742, test_f1: 0.4836
 epoch: 25, train_loss: 0.8395, test_loss: 0.9609, test_f1: 0.4914
 epoch: 26, train_loss: 0.8214, test_loss: 1.1051, test_f1: 0.4811
 epoch: 27, train_loss: 0.8127, test_loss: 0.9886, test_f1: 0.5223
 epoch: 28, train_loss: 0.8069, test_loss: 0.9970, test_f1: 0.4830
 epoch: 29, train_loss: 0.8027, test_loss: 0.9723, test_f1: 0.5169
 epoch: 30, train_loss: 0.7952, test_loss: 0.9618, test_f1: 0.4995
 epoch: 31, train_loss: 0.7929, test_loss: 0.9791, test_f1: 0.5056
 epoch: 32, train_loss: 0.7772, test_loss: 0.9590, test_f1: 0.5130
 epoch: 33, train_loss: 0.7811, test_loss: 1.0152, test_f1: 0.5037
 epoch: 34, train_loss: 0.7773, test_loss: 1.0596, test_f1: 0.4966
 epoch: 35, train_loss: 0.7683, test_loss: 0.9180, test_f1: 0.5317
 epoch: 36, train_loss: 0.7573, test_loss: 1.0540, test_f1: 0.5045
 epoch: 37, train_loss: 0.7493, test_loss: 0.9784, test_f1: 0.5027
 epoch: 38, train_loss: 0.7441, test_loss: 0.9636, test_f1: 0.5275
 epoch: 39, train_loss: 0.7269, test_loss: 1.0814, test_f1: 0.5101
 epoch: 40, train_loss: 0.7269, test_loss: 0.9414, test_f1: 0.5208
 epoch: 41, train_loss: 0.7223, test_loss: 0.9381, test_f1: 0.5486
 epoch: 42, train_loss: 0.7171, test_loss: 1.1190, test_f1: 0.4966
 epoch: 43, train_loss: 0.7179, test_loss: 0.9479, test_f1: 0.5254
 epoch: 44, train_loss: 0.7146, test_loss: 1.0764, test_f1: 0.5267
 epoch: 45, train_loss: 0.7044, test_loss: 1.0590, test_f1: 0.5325
 epoch: 46, train_loss: 0.6924, test_loss: 1.2223, test_f1: 0.5068
 epoch: 47, train_loss: 0.7013, test_loss: 1.0672, test_f1: 0.5334
 epoch: 48, train_loss: 0.6949, test_loss: 1.0040, test_f1: 0.5547
 epoch: 49, train_loss: 0.6702, test_loss: 1.0137, test_f1: 0.5354
 epoch: 50, train_loss: 0.7018, test_loss: 1.0139, test_f1: 0.5153
 epoch: 51, train_loss: 0.6859, test_loss: 1.0084, test_f1: 0.5462
 epoch: 52, train_loss: 0.6510, test_loss: 1.0583, test_f1: 0.5220
 epoch: 53, train_loss: 0.6368, test_loss: 1.1656, test_f1: 0.5286
 epoch: 54, train_loss: 0.6488, test_loss: 1.0419, test_f1: 0.5499
 epoch: 55, train_loss: 0.6417, test_loss: 1.0579, test_f1: 0.5565
 epoch: 56, train_loss: 0.6468, test_loss: 1.0657, test_f1: 0.5341
 epoch: 57, train_loss: 0.6342, test_loss: 1.0515, test_f1: 0.5491
 epoch: 58, train_loss: 0.6266, test_loss: 1.1132, test_f1: 0.5459
 epoch: 59, train_loss: 0.6358, test_loss: 1.0657, test_f1: 0.5531
 epoch: 60, train_loss: 0.6245, test_loss: 1.0613, test_f1: 0.5444
 epoch: 61, train_loss: 0.6283, test_loss: 1.0791, test_f1: 0.5551
 epoch: 62, train_loss: 0.6266, test_loss: 1.0799, test_f1: 0.5652
 epoch: 63, train_loss: 0.6179, test_loss: 1.0580, test_f1: 0.5677
 epoch: 64, train_loss: 0.6226, test_loss: 1.1175, test_f1: 0.5526
 epoch: 65, train_loss: 0.6119, test_loss: 1.0900, test_f1: 0.5560
 epoch: 66, train_loss: 0.6064, test_loss: 1.0710, test_f1: 0.5503
 epoch: 67, train_loss: 0.6127, test_loss: 1.1124, test_f1: 0.5514
 epoch: 68, train_loss: 0.6194, test_loss: 1.0914, test_f1: 0.5540
 epoch: 69, train_loss: 0.6080, test_loss: 1.1059, test_f1: 0.5618
 epoch: 70, train_loss: 0.5970, test_loss: 1.0976, test_f1: 0.5623
 epoch: 71, train_loss: 0.6004, test_loss: 1.0580, test_f1: 0.5528
 epoch: 72, train_loss: 0.6105, test_loss: 1.1214, test_f1: 0.5533
 epoch: 73, train_loss: 0.5893, test_loss: 1.1714, test_f1: 0.5614
 epoch: 74, train_loss: 0.5874, test_loss: 1.1331, test_f1: 0.5621
 epoch: 75, train_loss: 0.5829, test_loss: 1.1367, test_f1: 0.5597
 epoch: 76, train_loss: 0.6036, test_loss: 1.1639, test_f1: 0.5634
 epoch: 77, train_loss: 0.5989, test_loss: 1.2528, test_f1: 0.5351
 epoch: 78, train_loss: 0.6101, test_loss: 1.1222, test_f1: 0.5413
 epoch: 79, train_loss: 0.6020, test_loss: 1.1871, test_f1: 0.5602
 epoch: 80, train_loss: 0.6041, test_loss: 1.1823, test_f1: 0.5535
 epoch: 81, train_loss: 0.5993, test_loss: 1.1358, test_f1: 0.5714
 epoch: 82, train_loss: 0.5744, test_loss: 1.1860, test_f1: 0.5703
 epoch: 83, train_loss: 0.5837, test_loss: 1.2417, test_f1: 0.5508
 epoch: 84, train_loss: 0.5867, test_loss: 1.1843, test_f1: 0.5405
 epoch: 85, train_loss: 0.5795, test_loss: 1.1852, test_f1: 0.5699
 epoch: 86, train_loss: 0.5681, test_loss: 1.2295, test_f1: 0.5603
 epoch: 87, train_loss: 0.5686, test_loss: 1.1639, test_f1: 0.5680
 epoch: 88, train_loss: 0.5832, test_loss: 1.1662, test_f1: 0.5592
 epoch: 89, train_loss: 0.5738, test_loss: 1.1162, test_f1: 0.5626
 epoch: 90, train_loss: 0.5745, test_loss: 1.2281, test_f1: 0.5408
 epoch: 91, train_loss: 0.5676, test_loss: 1.2338, test_f1: 0.5593
 epoch: 92, train_loss: 0.5635, test_loss: 1.2210, test_f1: 0.5636
 epoch: 93, train_loss: 0.5626, test_loss: 1.2822, test_f1: 0.5392
 epoch: 94, train_loss: 0.5507, test_loss: 1.2639, test_f1: 0.5355
 epoch: 95, train_loss: 0.5624, test_loss: 1.1931, test_f1: 0.6148
 epoch: 96, train_loss: 0.5718, test_loss: 1.0899, test_f1: 0.5760
 epoch: 97, train_loss: 0.5561, test_loss: 1.1603, test_f1: 0.5751
 epoch: 98, train_loss: 0.5631, test_loss: 1.1583, test_f1: 0.5660
 epoch: 99, train_loss: 0.5608, test_loss: 1.1343, test_f1: 0.5709
##################ITERATION #1 ****************************************
 epoch: 0, train_loss: 1.2806, test_loss: 1.2995, test_f1: 0.2260
 epoch: 1, train_loss: 1.1674, test_loss: 1.2286, test_f1: 0.2260
 epoch: 2, train_loss: 1.1096, test_loss: 1.1174, test_f1: 0.3391
 epoch: 3, train_loss: 1.0656, test_loss: 1.0651, test_f1: 0.3449
 epoch: 4, train_loss: 1.0390, test_loss: 1.0483, test_f1: 0.4315
 epoch: 5, train_loss: 1.0090, test_loss: 1.0496, test_f1: 0.4303
 epoch: 6, train_loss: 0.9811, test_loss: 1.0330, test_f1: 0.4495
 epoch: 7, train_loss: 0.9569, test_loss: 1.0030, test_f1: 0.4823
 epoch: 8, train_loss: 0.9481, test_loss: 1.0262, test_f1: 0.4512
 epoch: 9, train_loss: 0.9234, test_loss: 1.0279, test_f1: 0.4373
 epoch: 10, train_loss: 0.9016, test_loss: 0.9364, test_f1: 0.5102
 epoch: 11, train_loss: 0.8874, test_loss: 0.9441, test_f1: 0.5311
 epoch: 12, train_loss: 0.8797, test_loss: 0.9804, test_f1: 0.4858
 epoch: 13, train_loss: 0.8591, test_loss: 0.9289, test_f1: 0.5149
 epoch: 14, train_loss: 0.8609, test_loss: 0.9168, test_f1: 0.5147
 epoch: 15, train_loss: 0.8413, test_loss: 0.9331, test_f1: 0.5218
 epoch: 16, train_loss: 0.8295, test_loss: 0.9502, test_f1: 0.5215
 epoch: 17, train_loss: 0.8210, test_loss: 0.9205, test_f1: 0.5345
 epoch: 18, train_loss: 0.8132, test_loss: 0.9065, test_f1: 0.5225
 epoch: 19, train_loss: 0.7933, test_loss: 0.9438, test_f1: 0.5243
 epoch: 20, train_loss: 0.7862, test_loss: 0.9425, test_f1: 0.5436
 epoch: 21, train_loss: 0.7821, test_loss: 0.9365, test_f1: 0.5277
 epoch: 22, train_loss: 0.7809, test_loss: 0.9210, test_f1: 0.5563
 epoch: 23, train_loss: 0.7703, test_loss: 0.9480, test_f1: 0.5442
 epoch: 24, train_loss: 0.7796, test_loss: 0.9142, test_f1: 0.5484
 epoch: 25, train_loss: 0.7709, test_loss: 0.9296, test_f1: 0.5317
 epoch: 26, train_loss: 0.7508, test_loss: 0.9943, test_f1: 0.5300
 epoch: 27, train_loss: 0.7535, test_loss: 0.9117, test_f1: 0.5473
 epoch: 28, train_loss: 0.7434, test_loss: 0.9238, test_f1: 0.5470
 epoch: 29, train_loss: 0.7352, test_loss: 0.9229, test_f1: 0.5539
 epoch: 30, train_loss: 0.7267, test_loss: 0.9188, test_f1: 0.5329
 epoch: 31, train_loss: 0.7198, test_loss: 0.9616, test_f1: 0.5387
 epoch: 32, train_loss: 0.7365, test_loss: 0.9244, test_f1: 0.5649
 epoch: 33, train_loss: 0.7237, test_loss: 0.9101, test_f1: 0.5541
 epoch: 34, train_loss: 0.7110, test_loss: 0.8998, test_f1: 0.5741
 epoch: 35, train_loss: 0.7212, test_loss: 0.9265, test_f1: 0.5297
 epoch: 36, train_loss: 0.6921, test_loss: 0.9227, test_f1: 0.5457
 epoch: 37, train_loss: 0.7023, test_loss: 0.9278, test_f1: 0.5682
 epoch: 38, train_loss: 0.6958, test_loss: 0.9504, test_f1: 0.5626
 epoch: 39, train_loss: 0.6894, test_loss: 0.9882, test_f1: 0.5513
 epoch: 40, train_loss: 0.6848, test_loss: 0.9128, test_f1: 0.5719
 epoch: 41, train_loss: 0.6822, test_loss: 0.9794, test_f1: 0.5456
 epoch: 42, train_loss: 0.6713, test_loss: 0.9356, test_f1: 0.5735
 epoch: 43, train_loss: 0.6755, test_loss: 1.0030, test_f1: 0.5354
 epoch: 44, train_loss: 0.6706, test_loss: 0.9740, test_f1: 0.5525
 epoch: 45, train_loss: 0.6790, test_loss: 0.9872, test_f1: 0.5549
 epoch: 46, train_loss: 0.6713, test_loss: 0.9277, test_f1: 0.5572
 epoch: 47, train_loss: 0.6629, test_loss: 0.9773, test_f1: 0.5591
 epoch: 48, train_loss: 0.6582, test_loss: 0.9357, test_f1: 0.5699
 epoch: 49, train_loss: 0.6587, test_loss: 1.0218, test_f1: 0.5467
 epoch: 50, train_loss: 0.6495, test_loss: 1.0200, test_f1: 0.5353
 epoch: 51, train_loss: 0.6455, test_loss: 0.9436, test_f1: 0.5802
 epoch: 52, train_loss: 0.6334, test_loss: 0.9692, test_f1: 0.5677
 epoch: 53, train_loss: 0.6281, test_loss: 0.9479, test_f1: 0.5703
 epoch: 54, train_loss: 0.6183, test_loss: 1.0026, test_f1: 0.5487
 epoch: 55, train_loss: 0.6197, test_loss: 0.9454, test_f1: 0.5634
 epoch: 56, train_loss: 0.6159, test_loss: 0.9658, test_f1: 0.5661
 epoch: 57, train_loss: 0.6052, test_loss: 1.0151, test_f1: 0.5577
 epoch: 58, train_loss: 0.6029, test_loss: 1.0175, test_f1: 0.5570
 epoch: 59, train_loss: 0.6145, test_loss: 1.0287, test_f1: 0.5621
 epoch: 60, train_loss: 0.6044, test_loss: 1.0172, test_f1: 0.5480
 epoch: 61, train_loss: 0.6039, test_loss: 0.9798, test_f1: 0.5665
 epoch: 62, train_loss: 0.5998, test_loss: 1.0411, test_f1: 0.5625
 epoch: 63, train_loss: 0.6166, test_loss: 1.0105, test_f1: 0.5697
 epoch: 64, train_loss: 0.6049, test_loss: 0.9667, test_f1: 0.5801
 epoch: 65, train_loss: 0.5955, test_loss: 0.9823, test_f1: 0.5815
 epoch: 66, train_loss: 0.6066, test_loss: 1.0044, test_f1: 0.5667
 epoch: 67, train_loss: 0.5971, test_loss: 1.0622, test_f1: 0.5681
 epoch: 68, train_loss: 0.6002, test_loss: 0.9822, test_f1: 0.5762
 epoch: 69, train_loss: 0.6065, test_loss: 0.9651, test_f1: 0.5766
 epoch: 70, train_loss: 0.5981, test_loss: 0.9686, test_f1: 0.5792
 epoch: 71, train_loss: 0.5974, test_loss: 1.0348, test_f1: 0.5676
 epoch: 72, train_loss: 0.5875, test_loss: 0.9846, test_f1: 0.5742
 epoch: 73, train_loss: 0.5845, test_loss: 1.0077, test_f1: 0.5701
 epoch: 74, train_loss: 0.5749, test_loss: 0.9805, test_f1: 0.5819
 epoch: 75, train_loss: 0.5886, test_loss: 0.9751, test_f1: 0.5928
 epoch: 76, train_loss: 0.5849, test_loss: 1.0131, test_f1: 0.5770
 epoch: 77, train_loss: 0.5899, test_loss: 1.0115, test_f1: 0.5741
 epoch: 78, train_loss: 0.5916, test_loss: 0.9796, test_f1: 0.5895
 epoch: 79, train_loss: 0.5831, test_loss: 0.9994, test_f1: 0.5957
 epoch: 80, train_loss: 0.5733, test_loss: 1.0550, test_f1: 0.5932
 epoch: 81, train_loss: 0.5638, test_loss: 0.9908, test_f1: 0.5932
 epoch: 82, train_loss: 0.5781, test_loss: 1.0840, test_f1: 0.5891
 epoch: 83, train_loss: 0.5763, test_loss: 1.0616, test_f1: 0.5817
 epoch: 84, train_loss: 0.5706, test_loss: 1.0668, test_f1: 0.5756
 epoch: 85, train_loss: 0.5796, test_loss: 1.0084, test_f1: 0.5939
 epoch: 86, train_loss: 0.5708, test_loss: 1.0233, test_f1: 0.5836
 epoch: 87, train_loss: 0.5684, test_loss: 1.0268, test_f1: 0.5892
 epoch: 88, train_loss: 0.5624, test_loss: 0.9957, test_f1: 0.5982
 epoch: 89, train_loss: 0.5688, test_loss: 1.0907, test_f1: 0.5816
 epoch: 90, train_loss: 0.5728, test_loss: 1.0493, test_f1: 0.5758
 epoch: 91, train_loss: 0.5617, test_loss: 1.0500, test_f1: 0.5784
 epoch: 92, train_loss: 0.5582, test_loss: 1.0522, test_f1: 0.5845
 epoch: 93, train_loss: 0.5486, test_loss: 1.0097, test_f1: 0.5913
 epoch: 94, train_loss: 0.5567, test_loss: 1.0393, test_f1: 0.6035
 epoch: 95, train_loss: 0.5522, test_loss: 1.0918, test_f1: 0.5684
 epoch: 96, train_loss: 0.5514, test_loss: 1.0712, test_f1: 0.5644
 epoch: 97, train_loss: 0.5750, test_loss: 1.0256, test_f1: 0.6080
 epoch: 98, train_loss: 0.5501, test_loss: 1.0398, test_f1: 0.5902
 epoch: 99, train_loss: 0.5562, test_loss: 1.1298, test_f1: 0.5775
##################ITERATION #2 ****************************************
 epoch: 0, train_loss: 1.2532, test_loss: 1.2915, test_f1: 0.2260
 epoch: 1, train_loss: 1.1357, test_loss: 1.2495, test_f1: 0.2260
 epoch: 2, train_loss: 1.0745, test_loss: 1.1754, test_f1: 0.3058
 epoch: 3, train_loss: 1.0263, test_loss: 1.0833, test_f1: 0.3628
 epoch: 4, train_loss: 0.9939, test_loss: 0.9929, test_f1: 0.4307
 epoch: 5, train_loss: 0.9641, test_loss: 0.9628, test_f1: 0.4491
 epoch: 6, train_loss: 0.9508, test_loss: 0.9472, test_f1: 0.4694
 epoch: 7, train_loss: 0.9383, test_loss: 0.9770, test_f1: 0.4841
 epoch: 8, train_loss: 0.9202, test_loss: 1.0034, test_f1: 0.4711
 epoch: 9, train_loss: 0.9056, test_loss: 1.1264, test_f1: 0.4177
 epoch: 10, train_loss: 0.8925, test_loss: 1.0013, test_f1: 0.5101
 epoch: 11, train_loss: 0.8746, test_loss: 0.9922, test_f1: 0.4847
 epoch: 12, train_loss: 0.8650, test_loss: 1.0604, test_f1: 0.4987
 epoch: 13, train_loss: 0.8517, test_loss: 0.9195, test_f1: 0.5184
 epoch: 14, train_loss: 0.8287, test_loss: 0.9706, test_f1: 0.5114
 epoch: 15, train_loss: 0.8305, test_loss: 1.1430, test_f1: 0.4893
 epoch: 16, train_loss: 0.8126, test_loss: 1.0101, test_f1: 0.5329
 epoch: 17, train_loss: 0.8100, test_loss: 0.9861, test_f1: 0.5407
 epoch: 18, train_loss: 0.8120, test_loss: 0.9533, test_f1: 0.5363
 epoch: 19, train_loss: 0.7880, test_loss: 0.9975, test_f1: 0.5340
 epoch: 20, train_loss: 0.7824, test_loss: 1.1560, test_f1: 0.4946
 epoch: 21, train_loss: 0.7754, test_loss: 1.0393, test_f1: 0.5203
 epoch: 22, train_loss: 0.7647, test_loss: 0.9491, test_f1: 0.5463
 epoch: 23, train_loss: 0.7481, test_loss: 0.9997, test_f1: 0.5285
 epoch: 24, train_loss: 0.7433, test_loss: 1.0403, test_f1: 0.5315
 epoch: 25, train_loss: 0.7337, test_loss: 0.9793, test_f1: 0.5549
 epoch: 26, train_loss: 0.7273, test_loss: 0.9050, test_f1: 0.5699
 epoch: 27, train_loss: 0.7076, test_loss: 0.9722, test_f1: 0.5369
 epoch: 28, train_loss: 0.7090, test_loss: 0.9818, test_f1: 0.5405
 epoch: 29, train_loss: 0.7141, test_loss: 1.0078, test_f1: 0.5572
 epoch: 30, train_loss: 0.7016, test_loss: 0.9493, test_f1: 0.5322
 epoch: 31, train_loss: 0.6969, test_loss: 1.0125, test_f1: 0.5375
 epoch: 32, train_loss: 0.6896, test_loss: 0.9743, test_f1: 0.5626
 epoch: 33, train_loss: 0.6687, test_loss: 0.9660, test_f1: 0.5475
 epoch: 34, train_loss: 0.6503, test_loss: 1.0272, test_f1: 0.5604
 epoch: 35, train_loss: 0.6567, test_loss: 1.0156, test_f1: 0.5571
 epoch: 36, train_loss: 0.6562, test_loss: 0.9676, test_f1: 0.5693
 epoch: 37, train_loss: 0.6652, test_loss: 1.0822, test_f1: 0.5514
 epoch: 38, train_loss: 0.6637, test_loss: 0.9502, test_f1: 0.5731
 epoch: 39, train_loss: 0.6388, test_loss: 1.0030, test_f1: 0.5629
 epoch: 40, train_loss: 0.6332, test_loss: 0.9883, test_f1: 0.5654
 epoch: 41, train_loss: 0.6346, test_loss: 0.9862, test_f1: 0.5786
 epoch: 42, train_loss: 0.6220, test_loss: 1.0460, test_f1: 0.5777
 epoch: 43, train_loss: 0.6073, test_loss: 1.0200, test_f1: 0.5757
 epoch: 44, train_loss: 0.6057, test_loss: 0.9317, test_f1: 0.5981
 epoch: 45, train_loss: 0.6192, test_loss: 0.9912, test_f1: 0.5815
 epoch: 46, train_loss: 0.6198, test_loss: 0.9814, test_f1: 0.5816
 epoch: 47, train_loss: 0.5965, test_loss: 0.9938, test_f1: 0.5911
 epoch: 48, train_loss: 0.5787, test_loss: 0.9875, test_f1: 0.6038
 epoch: 49, train_loss: 0.5858, test_loss: 1.0249, test_f1: 0.5943
 epoch: 50, train_loss: 0.5909, test_loss: 1.0521, test_f1: 0.5920
 epoch: 51, train_loss: 0.5831, test_loss: 0.9933, test_f1: 0.6125
 epoch: 52, train_loss: 0.5752, test_loss: 1.0022, test_f1: 0.5648
 epoch: 53, train_loss: 0.5447, test_loss: 1.0058, test_f1: 0.5740
 epoch: 54, train_loss: 0.5411, test_loss: 0.9931, test_f1: 0.5981
 epoch: 55, train_loss: 0.5448, test_loss: 0.9693, test_f1: 0.5983
 epoch: 56, train_loss: 0.5435, test_loss: 0.9957, test_f1: 0.6012
 epoch: 57, train_loss: 0.5428, test_loss: 1.0257, test_f1: 0.5998
 epoch: 58, train_loss: 0.5291, test_loss: 1.0148, test_f1: 0.5699
 epoch: 59, train_loss: 0.5197, test_loss: 1.0094, test_f1: 0.5949
 epoch: 60, train_loss: 0.5251, test_loss: 1.0402, test_f1: 0.5946
 epoch: 61, train_loss: 0.5357, test_loss: 1.0125, test_f1: 0.5925
 epoch: 62, train_loss: 0.5266, test_loss: 1.0237, test_f1: 0.6059
 epoch: 63, train_loss: 0.5184, test_loss: 1.0556, test_f1: 0.5922
 epoch: 64, train_loss: 0.5217, test_loss: 1.0316, test_f1: 0.6163
 epoch: 65, train_loss: 0.5271, test_loss: 1.0514, test_f1: 0.5990
 epoch: 66, train_loss: 0.5280, test_loss: 1.0190, test_f1: 0.6027
 epoch: 67, train_loss: 0.5269, test_loss: 1.0254, test_f1: 0.6348
 epoch: 68, train_loss: 0.5258, test_loss: 0.9825, test_f1: 0.6224
 epoch: 69, train_loss: 0.5056, test_loss: 1.0444, test_f1: 0.6065
 epoch: 70, train_loss: 0.4977, test_loss: 1.0830, test_f1: 0.5992
 epoch: 71, train_loss: 0.5020, test_loss: 1.0755, test_f1: 0.6158
 epoch: 72, train_loss: 0.4973, test_loss: 1.0245, test_f1: 0.6038
 epoch: 73, train_loss: 0.5295, test_loss: 1.0425, test_f1: 0.6068
 epoch: 74, train_loss: 0.5165, test_loss: 0.9907, test_f1: 0.6277
 epoch: 75, train_loss: 0.5287, test_loss: 1.0119, test_f1: 0.6165
 epoch: 76, train_loss: 0.5078, test_loss: 1.0509, test_f1: 0.6146
 epoch: 77, train_loss: 0.4944, test_loss: 1.0236, test_f1: 0.5959
 epoch: 78, train_loss: 0.4910, test_loss: 1.0325, test_f1: 0.6349
 epoch: 79, train_loss: 0.4876, test_loss: 1.0569, test_f1: 0.6050
 epoch: 80, train_loss: 0.4861, test_loss: 1.0073, test_f1: 0.6161
 epoch: 81, train_loss: 0.4729, test_loss: 1.0193, test_f1: 0.6127
 epoch: 82, train_loss: 0.4802, test_loss: 1.0394, test_f1: 0.6402
 epoch: 83, train_loss: 0.4968, test_loss: 1.0533, test_f1: 0.6238
 epoch: 84, train_loss: 0.4750, test_loss: 1.0349, test_f1: 0.6211
 epoch: 85, train_loss: 0.4879, test_loss: 1.0922, test_f1: 0.6062
 epoch: 86, train_loss: 0.4841, test_loss: 1.0055, test_f1: 0.6401
 epoch: 87, train_loss: 0.4851, test_loss: 1.0268, test_f1: 0.6222
 epoch: 88, train_loss: 0.4729, test_loss: 1.0107, test_f1: 0.6437
 epoch: 89, train_loss: 0.4700, test_loss: 1.0449, test_f1: 0.6229
 epoch: 90, train_loss: 0.4859, test_loss: 1.1384, test_f1: 0.6060
 epoch: 91, train_loss: 0.4656, test_loss: 1.1065, test_f1: 0.6076
 epoch: 92, train_loss: 0.4679, test_loss: 1.0554, test_f1: 0.6207
 epoch: 93, train_loss: 0.4660, test_loss: 1.0553, test_f1: 0.6121
 epoch: 94, train_loss: 0.4591, test_loss: 1.0357, test_f1: 0.6195
 epoch: 95, train_loss: 0.4608, test_loss: 1.0721, test_f1: 0.6024
 epoch: 96, train_loss: 0.4523, test_loss: 1.1225, test_f1: 0.6206
 epoch: 97, train_loss: 0.4606, test_loss: 1.0471, test_f1: 0.6288
 epoch: 98, train_loss: 0.4654, test_loss: 1.1329, test_f1: 0.6148
 epoch: 99, train_loss: 0.4568, test_loss: 1.0527, test_f1: 0.6197
##################ITERATION #3 ****************************************
 epoch: 0, train_loss: 1.2473, test_loss: 1.3021, test_f1: 0.2260
 epoch: 1, train_loss: 1.1208, test_loss: 1.2766, test_f1: 0.2311
 epoch: 2, train_loss: 1.0470, test_loss: 1.2057, test_f1: 0.2951
 epoch: 3, train_loss: 1.0125, test_loss: 1.0548, test_f1: 0.3789
 epoch: 4, train_loss: 0.9785, test_loss: 0.9967, test_f1: 0.4366
 epoch: 5, train_loss: 0.9497, test_loss: 0.9381, test_f1: 0.4785
 epoch: 6, train_loss: 0.9244, test_loss: 0.9340, test_f1: 0.5275
 epoch: 7, train_loss: 0.9089, test_loss: 0.9228, test_f1: 0.5138
 epoch: 8, train_loss: 0.8913, test_loss: 0.9165, test_f1: 0.5085
 epoch: 9, train_loss: 0.8901, test_loss: 0.9220, test_f1: 0.5273
 epoch: 10, train_loss: 0.8680, test_loss: 0.9065, test_f1: 0.5249
 epoch: 11, train_loss: 0.8665, test_loss: 0.9570, test_f1: 0.5164
 epoch: 12, train_loss: 0.8549, test_loss: 0.9387, test_f1: 0.4938
 epoch: 13, train_loss: 0.8229, test_loss: 0.8865, test_f1: 0.5390
 epoch: 14, train_loss: 0.8209, test_loss: 0.8921, test_f1: 0.5453
 epoch: 15, train_loss: 0.8119, test_loss: 0.8802, test_f1: 0.5256
 epoch: 16, train_loss: 0.8046, test_loss: 0.9547, test_f1: 0.5252
 epoch: 17, train_loss: 0.7923, test_loss: 0.9731, test_f1: 0.4961
 epoch: 18, train_loss: 0.7866, test_loss: 0.9426, test_f1: 0.5215
 epoch: 19, train_loss: 0.7892, test_loss: 0.9344, test_f1: 0.5108
 epoch: 20, train_loss: 0.7767, test_loss: 0.9057, test_f1: 0.5230
 epoch: 21, train_loss: 0.7737, test_loss: 0.8993, test_f1: 0.5506
 epoch: 22, train_loss: 0.7572, test_loss: 0.9133, test_f1: 0.5407
 epoch: 23, train_loss: 0.7405, test_loss: 0.9119, test_f1: 0.5315
 epoch: 24, train_loss: 0.7416, test_loss: 0.9608, test_f1: 0.5263
 epoch: 25, train_loss: 0.7389, test_loss: 0.9406, test_f1: 0.5305
 epoch: 26, train_loss: 0.7423, test_loss: 0.9237, test_f1: 0.5390
 epoch: 27, train_loss: 0.7259, test_loss: 0.9613, test_f1: 0.5185
 epoch: 28, train_loss: 0.7343, test_loss: 0.9151, test_f1: 0.5595
 epoch: 29, train_loss: 0.7283, test_loss: 1.0240, test_f1: 0.5245
 epoch: 30, train_loss: 0.7140, test_loss: 0.9237, test_f1: 0.5534
 epoch: 31, train_loss: 0.7122, test_loss: 0.9567, test_f1: 0.5471
 epoch: 32, train_loss: 0.7084, test_loss: 0.9173, test_f1: 0.5615
 epoch: 33, train_loss: 0.6969, test_loss: 0.9296, test_f1: 0.5356
 epoch: 34, train_loss: 0.7010, test_loss: 0.9330, test_f1: 0.5626
 epoch: 35, train_loss: 0.6958, test_loss: 0.9879, test_f1: 0.5272
 epoch: 36, train_loss: 0.6770, test_loss: 0.9690, test_f1: 0.5206
 epoch: 37, train_loss: 0.6766, test_loss: 1.0065, test_f1: 0.5131
 epoch: 38, train_loss: 0.6925, test_loss: 0.9657, test_f1: 0.5483
 epoch: 39, train_loss: 0.6973, test_loss: 0.9453, test_f1: 0.5390
 epoch: 40, train_loss: 0.6738, test_loss: 0.8748, test_f1: 0.5504
 epoch: 41, train_loss: 0.6671, test_loss: 0.9251, test_f1: 0.5355
 epoch: 42, train_loss: 0.6541, test_loss: 0.9742, test_f1: 0.5314
 epoch: 43, train_loss: 0.6572, test_loss: 1.0203, test_f1: 0.5185
 epoch: 44, train_loss: 0.6368, test_loss: 0.9562, test_f1: 0.5809
 epoch: 45, train_loss: 0.6229, test_loss: 0.9194, test_f1: 0.5653
 epoch: 46, train_loss: 0.6335, test_loss: 0.9199, test_f1: 0.5405
 epoch: 47, train_loss: 0.6416, test_loss: 0.9728, test_f1: 0.5489
 epoch: 48, train_loss: 0.6202, test_loss: 1.0438, test_f1: 0.5409
 epoch: 49, train_loss: 0.6257, test_loss: 1.0072, test_f1: 0.5527
 epoch: 50, train_loss: 0.6166, test_loss: 0.9224, test_f1: 0.5579
 epoch: 51, train_loss: 0.6075, test_loss: 0.9851, test_f1: 0.5323
 epoch: 52, train_loss: 0.6112, test_loss: 0.9121, test_f1: 0.5521
 epoch: 53, train_loss: 0.6005, test_loss: 0.9853, test_f1: 0.5386
 epoch: 54, train_loss: 0.5890, test_loss: 0.9977, test_f1: 0.5517
 epoch: 55, train_loss: 0.5897, test_loss: 0.9708, test_f1: 0.5471
 epoch: 56, train_loss: 0.5778, test_loss: 0.9346, test_f1: 0.5490
 epoch: 57, train_loss: 0.5676, test_loss: 0.9993, test_f1: 0.5490
 epoch: 58, train_loss: 0.5556, test_loss: 1.0395, test_f1: 0.5431
 epoch: 59, train_loss: 0.5654, test_loss: 1.0569, test_f1: 0.5468
 epoch: 60, train_loss: 0.5708, test_loss: 1.0196, test_f1: 0.5607
 epoch: 61, train_loss: 0.5754, test_loss: 1.0316, test_f1: 0.5338
 epoch: 62, train_loss: 0.5519, test_loss: 1.0280, test_f1: 0.5392
 epoch: 63, train_loss: 0.5628, test_loss: 1.0950, test_f1: 0.5299
 epoch: 64, train_loss: 0.5625, test_loss: 1.0794, test_f1: 0.5660
 epoch: 65, train_loss: 0.5529, test_loss: 1.0036, test_f1: 0.5588
 epoch: 66, train_loss: 0.5604, test_loss: 1.0318, test_f1: 0.5546
 epoch: 67, train_loss: 0.5466, test_loss: 1.0635, test_f1: 0.5558
 epoch: 68, train_loss: 0.5588, test_loss: 0.9986, test_f1: 0.5524
 epoch: 69, train_loss: 0.5620, test_loss: 1.0285, test_f1: 0.5510
 epoch: 70, train_loss: 0.5625, test_loss: 1.0012, test_f1: 0.5549
 epoch: 71, train_loss: 0.5455, test_loss: 1.0422, test_f1: 0.5475
 epoch: 72, train_loss: 0.5407, test_loss: 1.0810, test_f1: 0.5586
 epoch: 73, train_loss: 0.5471, test_loss: 1.0598, test_f1: 0.5514
 epoch: 74, train_loss: 0.5573, test_loss: 1.0492, test_f1: 0.5517
 epoch: 75, train_loss: 0.5582, test_loss: 1.0606, test_f1: 0.5436
 epoch: 76, train_loss: 0.5384, test_loss: 1.0605, test_f1: 0.5560
 epoch: 77, train_loss: 0.5479, test_loss: 1.0423, test_f1: 0.5514
 epoch: 78, train_loss: 0.5292, test_loss: 1.1674, test_f1: 0.5540
 epoch: 79, train_loss: 0.5255, test_loss: 1.0557, test_f1: 0.5504
 epoch: 80, train_loss: 0.5256, test_loss: 1.0537, test_f1: 0.5559
 epoch: 81, train_loss: 0.5286, test_loss: 1.1261, test_f1: 0.5511
 epoch: 82, train_loss: 0.5215, test_loss: 1.0589, test_f1: 0.5530
 epoch: 83, train_loss: 0.5167, test_loss: 1.1823, test_f1: 0.5454
 epoch: 84, train_loss: 0.5492, test_loss: 1.0599, test_f1: 0.5620
 epoch: 85, train_loss: 0.5302, test_loss: 1.0989, test_f1: 0.5534
 epoch: 86, train_loss: 0.5267, test_loss: 1.0885, test_f1: 0.5525
 epoch: 87, train_loss: 0.5188, test_loss: 1.1359, test_f1: 0.5577
 epoch: 88, train_loss: 0.5128, test_loss: 1.0631, test_f1: 0.5648
 epoch: 89, train_loss: 0.5202, test_loss: 1.1862, test_f1: 0.5517
 epoch: 90, train_loss: 0.5169, test_loss: 1.1122, test_f1: 0.5486
 epoch: 91, train_loss: 0.5201, test_loss: 1.1441, test_f1: 0.5612
 epoch: 92, train_loss: 0.5246, test_loss: 1.1396, test_f1: 0.5399
 epoch: 93, train_loss: 0.5253, test_loss: 1.0985, test_f1: 0.5556
 epoch: 94, train_loss: 0.5080, test_loss: 1.2374, test_f1: 0.5383
 epoch: 95, train_loss: 0.5190, test_loss: 1.0809, test_f1: 0.5646
 epoch: 96, train_loss: 0.5067, test_loss: 1.1553, test_f1: 0.5649
 epoch: 97, train_loss: 0.5084, test_loss: 1.1535, test_f1: 0.5356
 epoch: 98, train_loss: 0.5173, test_loss: 1.0995, test_f1: 0.5631
 epoch: 99, train_loss: 0.5128, test_loss: 1.1745, test_f1: 0.5487
##################ITERATION #4 ****************************************
 epoch: 0, train_loss: 1.2226, test_loss: 1.3334, test_f1: 0.2260
 epoch: 1, train_loss: 1.0992, test_loss: 1.3290, test_f1: 0.2260
 epoch: 2, train_loss: 1.0536, test_loss: 1.1414, test_f1: 0.3211
 epoch: 3, train_loss: 1.0406, test_loss: 1.1030, test_f1: 0.3443
 epoch: 4, train_loss: 1.0110, test_loss: 1.0790, test_f1: 0.4515
 epoch: 5, train_loss: 0.9955, test_loss: 1.0332, test_f1: 0.4536
 epoch: 6, train_loss: 0.9673, test_loss: 0.9977, test_f1: 0.4695
 epoch: 7, train_loss: 0.9484, test_loss: 0.9881, test_f1: 0.5008
 epoch: 8, train_loss: 0.9375, test_loss: 0.9867, test_f1: 0.5095
 epoch: 9, train_loss: 0.9072, test_loss: 0.9533, test_f1: 0.5204
 epoch: 10, train_loss: 0.9017, test_loss: 0.9432, test_f1: 0.5193
 epoch: 11, train_loss: 0.8870, test_loss: 0.9561, test_f1: 0.5178
 epoch: 12, train_loss: 0.8878, test_loss: 0.9824, test_f1: 0.5129
 epoch: 13, train_loss: 0.8662, test_loss: 0.9086, test_f1: 0.5169
 epoch: 14, train_loss: 0.8548, test_loss: 0.9520, test_f1: 0.5183
 epoch: 15, train_loss: 0.8587, test_loss: 0.9500, test_f1: 0.5310
 epoch: 16, train_loss: 0.8277, test_loss: 1.0332, test_f1: 0.5049
 epoch: 17, train_loss: 0.8277, test_loss: 0.9482, test_f1: 0.5028
 epoch: 18, train_loss: 0.8146, test_loss: 1.0610, test_f1: 0.4878
 epoch: 19, train_loss: 0.8112, test_loss: 0.9319, test_f1: 0.5368
 epoch: 20, train_loss: 0.8114, test_loss: 0.9373, test_f1: 0.5337
 epoch: 21, train_loss: 0.7888, test_loss: 0.9565, test_f1: 0.5363
 epoch: 22, train_loss: 0.7976, test_loss: 0.9924, test_f1: 0.5251
 epoch: 23, train_loss: 0.7899, test_loss: 1.0974, test_f1: 0.5058
 epoch: 24, train_loss: 0.7906, test_loss: 1.0772, test_f1: 0.4805
 epoch: 25, train_loss: 0.7815, test_loss: 0.8989, test_f1: 0.5573
 epoch: 26, train_loss: 0.7750, test_loss: 0.9515, test_f1: 0.5323
 epoch: 27, train_loss: 0.7597, test_loss: 0.9526, test_f1: 0.5511
 epoch: 28, train_loss: 0.7731, test_loss: 0.9226, test_f1: 0.5640
 epoch: 29, train_loss: 0.7587, test_loss: 0.9430, test_f1: 0.5401
 epoch: 30, train_loss: 0.7617, test_loss: 0.9618, test_f1: 0.5426
 epoch: 31, train_loss: 0.7461, test_loss: 0.9438, test_f1: 0.5300
 epoch: 32, train_loss: 0.7548, test_loss: 0.9181, test_f1: 0.5563
 epoch: 33, train_loss: 0.7506, test_loss: 1.0077, test_f1: 0.5419
 epoch: 34, train_loss: 0.7437, test_loss: 0.9210, test_f1: 0.5548
 epoch: 35, train_loss: 0.7290, test_loss: 0.9389, test_f1: 0.5439
 epoch: 36, train_loss: 0.7246, test_loss: 0.9535, test_f1: 0.5437
 epoch: 37, train_loss: 0.7250, test_loss: 0.9708, test_f1: 0.5425
 epoch: 38, train_loss: 0.7129, test_loss: 0.9253, test_f1: 0.5449
 epoch: 39, train_loss: 0.7110, test_loss: 1.0139, test_f1: 0.5390
 epoch: 40, train_loss: 0.7013, test_loss: 1.0165, test_f1: 0.5015
 epoch: 41, train_loss: 0.7064, test_loss: 1.1051, test_f1: 0.4994
 epoch: 42, train_loss: 0.7013, test_loss: 0.9317, test_f1: 0.5335
 epoch: 43, train_loss: 0.6896, test_loss: 0.9542, test_f1: 0.5495
 epoch: 44, train_loss: 0.6932, test_loss: 0.9316, test_f1: 0.5598
 epoch: 45, train_loss: 0.6900, test_loss: 0.9196, test_f1: 0.5528
 epoch: 46, train_loss: 0.6825, test_loss: 0.9692, test_f1: 0.5524
 epoch: 47, train_loss: 0.6837, test_loss: 0.9938, test_f1: 0.5510
 epoch: 48, train_loss: 0.6729, test_loss: 0.9019, test_f1: 0.5722
 epoch: 49, train_loss: 0.6735, test_loss: 1.0445, test_f1: 0.5376
 epoch: 50, train_loss: 0.6741, test_loss: 1.0205, test_f1: 0.5420
 epoch: 51, train_loss: 0.6549, test_loss: 0.9944, test_f1: 0.5592
 epoch: 52, train_loss: 0.6573, test_loss: 0.9574, test_f1: 0.5489
 epoch: 53, train_loss: 0.6537, test_loss: 0.9487, test_f1: 0.5603
 epoch: 54, train_loss: 0.6416, test_loss: 0.9724, test_f1: 0.5552
 epoch: 55, train_loss: 0.6297, test_loss: 0.9299, test_f1: 0.5516
 epoch: 56, train_loss: 0.6362, test_loss: 0.9358, test_f1: 0.5480
 epoch: 57, train_loss: 0.6282, test_loss: 0.9616, test_f1: 0.5463
 epoch: 58, train_loss: 0.6465, test_loss: 0.9456, test_f1: 0.5720
 epoch: 59, train_loss: 0.6283, test_loss: 0.9456, test_f1: 0.5528
 epoch: 60, train_loss: 0.6374, test_loss: 0.9766, test_f1: 0.5690
 epoch: 61, train_loss: 0.6239, test_loss: 0.9765, test_f1: 0.5595
 epoch: 62, train_loss: 0.6185, test_loss: 0.9496, test_f1: 0.5480
 epoch: 63, train_loss: 0.6264, test_loss: 0.9696, test_f1: 0.5477
 epoch: 64, train_loss: 0.6164, test_loss: 0.9463, test_f1: 0.5756
 epoch: 65, train_loss: 0.6114, test_loss: 0.9908, test_f1: 0.5525
 epoch: 66, train_loss: 0.6253, test_loss: 0.9454, test_f1: 0.5652
 epoch: 67, train_loss: 0.6149, test_loss: 1.0522, test_f1: 0.5374
 epoch: 68, train_loss: 0.6110, test_loss: 0.9524, test_f1: 0.5870
 epoch: 69, train_loss: 0.6175, test_loss: 0.9625, test_f1: 0.5733
 epoch: 70, train_loss: 0.6177, test_loss: 0.9947, test_f1: 0.5714
 epoch: 71, train_loss: 0.6102, test_loss: 0.9244, test_f1: 0.5782
 epoch: 72, train_loss: 0.6054, test_loss: 0.9611, test_f1: 0.5681
 epoch: 73, train_loss: 0.6038, test_loss: 0.9813, test_f1: 0.5728
 epoch: 74, train_loss: 0.6035, test_loss: 0.9455, test_f1: 0.5858
 epoch: 75, train_loss: 0.6003, test_loss: 0.9676, test_f1: 0.5924
 epoch: 76, train_loss: 0.5951, test_loss: 0.9688, test_f1: 0.5670
 epoch: 77, train_loss: 0.6144, test_loss: 1.0130, test_f1: 0.5629
 epoch: 78, train_loss: 0.6006, test_loss: 0.9944, test_f1: 0.5624
 epoch: 79, train_loss: 0.6117, test_loss: 1.0708, test_f1: 0.5648
 epoch: 80, train_loss: 0.5955, test_loss: 0.9768, test_f1: 0.5602
 epoch: 81, train_loss: 0.5846, test_loss: 0.9520, test_f1: 0.5857
 epoch: 82, train_loss: 0.5755, test_loss: 0.9656, test_f1: 0.5480
 epoch: 83, train_loss: 0.5934, test_loss: 0.9610, test_f1: 0.5686
 epoch: 84, train_loss: 0.5795, test_loss: 0.9811, test_f1: 0.5610
 epoch: 85, train_loss: 0.5733, test_loss: 1.0368, test_f1: 0.5680
 epoch: 86, train_loss: 0.5901, test_loss: 0.9816, test_f1: 0.5865
 epoch: 87, train_loss: 0.6057, test_loss: 1.0032, test_f1: 0.5835
 epoch: 88, train_loss: 0.5993, test_loss: 1.0052, test_f1: 0.5844
 epoch: 89, train_loss: 0.5826, test_loss: 0.9749, test_f1: 0.5837
 epoch: 90, train_loss: 0.5700, test_loss: 0.9654, test_f1: 0.5923
 epoch: 91, train_loss: 0.5889, test_loss: 1.0240, test_f1: 0.5724
 epoch: 92, train_loss: 0.5758, test_loss: 0.9617, test_f1: 0.5780
 epoch: 93, train_loss: 0.5785, test_loss: 0.9840, test_f1: 0.5946
 epoch: 94, train_loss: 0.5864, test_loss: 1.0144, test_f1: 0.5815
 epoch: 95, train_loss: 0.5770, test_loss: 0.9736, test_f1: 0.6057
 epoch: 96, train_loss: 0.5695, test_loss: 0.9311, test_f1: 0.5889
 epoch: 97, train_loss: 0.5701, test_loss: 0.9639, test_f1: 0.5981
 epoch: 98, train_loss: 0.5590, test_loss: 0.9719, test_f1: 0.5914
 epoch: 99, train_loss: 0.5653, test_loss: 1.0738, test_f1: 0.5778
##################ITERATION #5 ****************************************
 epoch: 0, train_loss: 1.2533, test_loss: 1.3132, test_f1: 0.2260
 epoch: 1, train_loss: 1.1062, test_loss: 1.2814, test_f1: 0.3136
 epoch: 2, train_loss: 1.0489, test_loss: 1.5477, test_f1: 0.2303
 epoch: 3, train_loss: 1.0122, test_loss: 1.2480, test_f1: 0.3192
 epoch: 4, train_loss: 0.9925, test_loss: 1.0295, test_f1: 0.4133
 epoch: 5, train_loss: 0.9611, test_loss: 0.9571, test_f1: 0.4468
 epoch: 6, train_loss: 0.9462, test_loss: 0.9547, test_f1: 0.5073
 epoch: 7, train_loss: 0.9201, test_loss: 0.9526, test_f1: 0.4782
 epoch: 8, train_loss: 0.9186, test_loss: 0.9337, test_f1: 0.4936
 epoch: 9, train_loss: 0.9057, test_loss: 0.9444, test_f1: 0.5167
 epoch: 10, train_loss: 0.8799, test_loss: 0.9608, test_f1: 0.5059
 epoch: 11, train_loss: 0.8607, test_loss: 0.9760, test_f1: 0.5127
 epoch: 12, train_loss: 0.8550, test_loss: 0.9288, test_f1: 0.5502
 epoch: 13, train_loss: 0.8415, test_loss: 0.9314, test_f1: 0.5631
 epoch: 14, train_loss: 0.8322, test_loss: 0.9719, test_f1: 0.5199
 epoch: 15, train_loss: 0.8203, test_loss: 0.9687, test_f1: 0.5496
 epoch: 16, train_loss: 0.8252, test_loss: 0.9563, test_f1: 0.5164
 epoch: 17, train_loss: 0.8073, test_loss: 0.9507, test_f1: 0.5353
 epoch: 18, train_loss: 0.7963, test_loss: 0.9515, test_f1: 0.5274
 epoch: 19, train_loss: 0.7871, test_loss: 0.9565, test_f1: 0.5453
 epoch: 20, train_loss: 0.7845, test_loss: 0.9746, test_f1: 0.5168
 epoch: 21, train_loss: 0.7679, test_loss: 0.9031, test_f1: 0.5697
 epoch: 22, train_loss: 0.7602, test_loss: 0.9840, test_f1: 0.5561
 epoch: 23, train_loss: 0.7781, test_loss: 0.9976, test_f1: 0.5438
 epoch: 24, train_loss: 0.7667, test_loss: 0.9873, test_f1: 0.5674
 epoch: 25, train_loss: 0.7516, test_loss: 0.9316, test_f1: 0.5857
 epoch: 26, train_loss: 0.7517, test_loss: 0.9736, test_f1: 0.5764
 epoch: 27, train_loss: 0.7466, test_loss: 0.9753, test_f1: 0.5701
 epoch: 28, train_loss: 0.7337, test_loss: 0.9439, test_f1: 0.5611
 epoch: 29, train_loss: 0.7263, test_loss: 1.0326, test_f1: 0.5671
 epoch: 30, train_loss: 0.7199, test_loss: 0.9826, test_f1: 0.5623
 epoch: 31, train_loss: 0.7075, test_loss: 0.9808, test_f1: 0.5729
 epoch: 32, train_loss: 0.7077, test_loss: 1.0102, test_f1: 0.5784
 epoch: 33, train_loss: 0.7058, test_loss: 0.9850, test_f1: 0.5661
 epoch: 34, train_loss: 0.7011, test_loss: 1.0129, test_f1: 0.5832
 epoch: 35, train_loss: 0.6898, test_loss: 1.0967, test_f1: 0.5621
 epoch: 36, train_loss: 0.6911, test_loss: 0.8943, test_f1: 0.6033
 epoch: 37, train_loss: 0.6835, test_loss: 0.9019, test_f1: 0.5854
 epoch: 38, train_loss: 0.6927, test_loss: 0.9271, test_f1: 0.6056
 epoch: 39, train_loss: 0.6796, test_loss: 1.0195, test_f1: 0.5690
 epoch: 40, train_loss: 0.6709, test_loss: 0.9852, test_f1: 0.5717
 epoch: 41, train_loss: 0.6511, test_loss: 0.9576, test_f1: 0.6111
 epoch: 42, train_loss: 0.6559, test_loss: 1.0438, test_f1: 0.5735
 epoch: 43, train_loss: 0.6636, test_loss: 0.9982, test_f1: 0.5907
 epoch: 44, train_loss: 0.6608, test_loss: 0.9778, test_f1: 0.5591
 epoch: 45, train_loss: 0.6527, test_loss: 0.9802, test_f1: 0.6133
 epoch: 46, train_loss: 0.6458, test_loss: 0.9480, test_f1: 0.6019
 epoch: 47, train_loss: 0.6237, test_loss: 1.1505, test_f1: 0.5686
 epoch: 48, train_loss: 0.6344, test_loss: 1.0199, test_f1: 0.6222
 epoch: 49, train_loss: 0.6507, test_loss: 1.1080, test_f1: 0.5893
 epoch: 50, train_loss: 0.6487, test_loss: 1.0209, test_f1: 0.5756
 epoch: 51, train_loss: 0.6106, test_loss: 1.0260, test_f1: 0.5929
 epoch: 52, train_loss: 0.6068, test_loss: 1.0043, test_f1: 0.6104
 epoch: 53, train_loss: 0.6027, test_loss: 0.9655, test_f1: 0.6089
 epoch: 54, train_loss: 0.5940, test_loss: 0.9782, test_f1: 0.5951
 epoch: 55, train_loss: 0.5917, test_loss: 0.9959, test_f1: 0.6181
 epoch: 56, train_loss: 0.5826, test_loss: 0.9844, test_f1: 0.6084
 epoch: 57, train_loss: 0.5787, test_loss: 0.9563, test_f1: 0.6175
 epoch: 58, train_loss: 0.5727, test_loss: 1.0061, test_f1: 0.5926
 epoch: 59, train_loss: 0.5858, test_loss: 0.9877, test_f1: 0.6118
 epoch: 60, train_loss: 0.5752, test_loss: 1.0237, test_f1: 0.5971
 epoch: 61, train_loss: 0.5669, test_loss: 1.0405, test_f1: 0.5833
 epoch: 62, train_loss: 0.5632, test_loss: 0.9608, test_f1: 0.6198
 epoch: 63, train_loss: 0.5621, test_loss: 1.0048, test_f1: 0.5954
 epoch: 64, train_loss: 0.5666, test_loss: 1.1001, test_f1: 0.6044
 epoch: 65, train_loss: 0.5550, test_loss: 1.0995, test_f1: 0.5901
 epoch: 66, train_loss: 0.5571, test_loss: 1.0848, test_f1: 0.5772
 epoch: 67, train_loss: 0.5584, test_loss: 1.0064, test_f1: 0.5978
 epoch: 68, train_loss: 0.5579, test_loss: 1.0386, test_f1: 0.5898
 epoch: 69, train_loss: 0.5674, test_loss: 1.1189, test_f1: 0.5654
 epoch: 70, train_loss: 0.5468, test_loss: 1.0986, test_f1: 0.5858
 epoch: 71, train_loss: 0.5618, test_loss: 1.0914, test_f1: 0.5990
 epoch: 72, train_loss: 0.5535, test_loss: 1.0531, test_f1: 0.6120
 epoch: 73, train_loss: 0.5376, test_loss: 1.0508, test_f1: 0.6005
 epoch: 74, train_loss: 0.5425, test_loss: 1.0999, test_f1: 0.5799
 epoch: 75, train_loss: 0.5262, test_loss: 1.0845, test_f1: 0.6004
 epoch: 76, train_loss: 0.5383, test_loss: 1.0339, test_f1: 0.6012
 epoch: 77, train_loss: 0.5251, test_loss: 1.1383, test_f1: 0.6102
 epoch: 78, train_loss: 0.5280, test_loss: 1.0358, test_f1: 0.5744
 epoch: 79, train_loss: 0.5255, test_loss: 1.1139, test_f1: 0.6000
 epoch: 80, train_loss: 0.5268, test_loss: 1.1285, test_f1: 0.5739
 epoch: 81, train_loss: 0.5171, test_loss: 1.1703, test_f1: 0.5631
 epoch: 82, train_loss: 0.5168, test_loss: 1.0987, test_f1: 0.5912
 epoch: 83, train_loss: 0.5062, test_loss: 1.1067, test_f1: 0.6292
 epoch: 84, train_loss: 0.5049, test_loss: 1.0944, test_f1: 0.5852
 epoch: 85, train_loss: 0.5071, test_loss: 1.0693, test_f1: 0.5795
 epoch: 86, train_loss: 0.5108, test_loss: 1.0270, test_f1: 0.6103
 epoch: 87, train_loss: 0.5111, test_loss: 1.0334, test_f1: 0.6203
 epoch: 88, train_loss: 0.5064, test_loss: 1.0287, test_f1: 0.6390
 epoch: 89, train_loss: 0.5005, test_loss: 1.0745, test_f1: 0.5735
 epoch: 90, train_loss: 0.4967, test_loss: 1.0583, test_f1: 0.6214
 epoch: 91, train_loss: 0.4879, test_loss: 1.0940, test_f1: 0.5877
 epoch: 92, train_loss: 0.4972, test_loss: 1.0918, test_f1: 0.5850
 epoch: 93, train_loss: 0.4920, test_loss: 1.0991, test_f1: 0.5999
 epoch: 94, train_loss: 0.4847, test_loss: 1.1341, test_f1: 0.6010
 epoch: 95, train_loss: 0.4849, test_loss: 1.0829, test_f1: 0.5865
 epoch: 96, train_loss: 0.4805, test_loss: 1.0641, test_f1: 0.6100
 epoch: 97, train_loss: 0.4810, test_loss: 1.1892, test_f1: 0.5961
 epoch: 98, train_loss: 0.5043, test_loss: 1.1044, test_f1: 0.6178
 epoch: 99, train_loss: 0.4851, test_loss: 1.1349, test_f1: 0.5793
##################ITERATION #6 ****************************************
 epoch: 0, train_loss: 1.3967, test_loss: 1.4142, test_f1: 0.2260
 epoch: 1, train_loss: 1.1478, test_loss: 1.3712, test_f1: 0.2260
 epoch: 2, train_loss: 1.0874, test_loss: 1.3704, test_f1: 0.2542
 epoch: 3, train_loss: 1.0549, test_loss: 1.1497, test_f1: 0.3428
 epoch: 4, train_loss: 1.0395, test_loss: 1.0278, test_f1: 0.4069
 epoch: 5, train_loss: 1.0199, test_loss: 1.0027, test_f1: 0.4366
 epoch: 6, train_loss: 1.0050, test_loss: 1.0126, test_f1: 0.4475
 epoch: 7, train_loss: 0.9857, test_loss: 0.9852, test_f1: 0.4806
 epoch: 8, train_loss: 0.9674, test_loss: 0.9752, test_f1: 0.4959
 epoch: 9, train_loss: 0.9487, test_loss: 0.9864, test_f1: 0.4823
 epoch: 10, train_loss: 0.9273, test_loss: 0.9880, test_f1: 0.4842
 epoch: 11, train_loss: 0.9217, test_loss: 0.9901, test_f1: 0.4866
 epoch: 12, train_loss: 0.9194, test_loss: 0.9919, test_f1: 0.5031
 epoch: 13, train_loss: 0.8954, test_loss: 0.9424, test_f1: 0.5226
 epoch: 14, train_loss: 0.8894, test_loss: 0.9938, test_f1: 0.4895
 epoch: 15, train_loss: 0.8850, test_loss: 1.0436, test_f1: 0.4685
 epoch: 16, train_loss: 0.8678, test_loss: 0.9810, test_f1: 0.5219
 epoch: 17, train_loss: 0.8522, test_loss: 0.9709, test_f1: 0.5645
 epoch: 18, train_loss: 0.8564, test_loss: 0.9980, test_f1: 0.5181
 epoch: 19, train_loss: 0.8461, test_loss: 0.9787, test_f1: 0.5603
 epoch: 20, train_loss: 0.8220, test_loss: 0.9564, test_f1: 0.5704
 epoch: 21, train_loss: 0.8253, test_loss: 0.9329, test_f1: 0.5477
 epoch: 22, train_loss: 0.8069, test_loss: 1.0033, test_f1: 0.5555
 epoch: 23, train_loss: 0.8112, test_loss: 0.9617, test_f1: 0.5252
 epoch: 24, train_loss: 0.8106, test_loss: 0.9509, test_f1: 0.5675
 epoch: 25, train_loss: 0.7929, test_loss: 0.9980, test_f1: 0.5141
 epoch: 26, train_loss: 0.7806, test_loss: 1.0041, test_f1: 0.5647
 epoch: 27, train_loss: 0.7926, test_loss: 0.9441, test_f1: 0.5436
 epoch: 28, train_loss: 0.7886, test_loss: 0.9778, test_f1: 0.5454
 epoch: 29, train_loss: 0.7769, test_loss: 0.9559, test_f1: 0.5738
 epoch: 30, train_loss: 0.7679, test_loss: 1.0331, test_f1: 0.5561
 epoch: 31, train_loss: 0.7591, test_loss: 1.0269, test_f1: 0.5493
 epoch: 32, train_loss: 0.7468, test_loss: 0.9987, test_f1: 0.5684
 epoch: 33, train_loss: 0.7428, test_loss: 0.9850, test_f1: 0.5650
 epoch: 34, train_loss: 0.7407, test_loss: 0.9706, test_f1: 0.5648
 epoch: 35, train_loss: 0.7433, test_loss: 1.0232, test_f1: 0.5618
 epoch: 36, train_loss: 0.7084, test_loss: 1.0254, test_f1: 0.5621
 epoch: 37, train_loss: 0.7197, test_loss: 0.9982, test_f1: 0.5763
 epoch: 38, train_loss: 0.7055, test_loss: 0.9354, test_f1: 0.5868
 epoch: 39, train_loss: 0.6987, test_loss: 0.9584, test_f1: 0.5798
 epoch: 40, train_loss: 0.7096, test_loss: 0.9825, test_f1: 0.5717
 epoch: 41, train_loss: 0.7194, test_loss: 0.9316, test_f1: 0.5760
 epoch: 42, train_loss: 0.7103, test_loss: 1.0025, test_f1: 0.5723
 epoch: 43, train_loss: 0.7010, test_loss: 0.9517, test_f1: 0.5857
 epoch: 44, train_loss: 0.6928, test_loss: 0.9688, test_f1: 0.5621
 epoch: 45, train_loss: 0.6833, test_loss: 1.0032, test_f1: 0.5823
 epoch: 46, train_loss: 0.6681, test_loss: 0.9634, test_f1: 0.6052
 epoch: 47, train_loss: 0.6848, test_loss: 0.9715, test_f1: 0.5660
 epoch: 48, train_loss: 0.6980, test_loss: 0.9952, test_f1: 0.5776
 epoch: 49, train_loss: 0.6694, test_loss: 0.9530, test_f1: 0.5542
 epoch: 50, train_loss: 0.6731, test_loss: 0.9473, test_f1: 0.6103
 epoch: 51, train_loss: 0.6515, test_loss: 0.9357, test_f1: 0.6052
 epoch: 52, train_loss: 0.6374, test_loss: 0.9583, test_f1: 0.5828
 epoch: 53, train_loss: 0.6231, test_loss: 0.9315, test_f1: 0.5958
 epoch: 54, train_loss: 0.6271, test_loss: 0.9620, test_f1: 0.5814
 epoch: 55, train_loss: 0.6309, test_loss: 0.9084, test_f1: 0.6130
 epoch: 56, train_loss: 0.6099, test_loss: 0.9773, test_f1: 0.6004
 epoch: 57, train_loss: 0.6285, test_loss: 0.9662, test_f1: 0.5907
 epoch: 58, train_loss: 0.6178, test_loss: 0.9180, test_f1: 0.6026
 epoch: 59, train_loss: 0.6148, test_loss: 0.9852, test_f1: 0.6032
 epoch: 60, train_loss: 0.6175, test_loss: 0.9898, test_f1: 0.5915
 epoch: 61, train_loss: 0.6032, test_loss: 0.9655, test_f1: 0.5972
 epoch: 62, train_loss: 0.5916, test_loss: 0.9584, test_f1: 0.5969
 epoch: 63, train_loss: 0.6034, test_loss: 0.9874, test_f1: 0.5817
 epoch: 64, train_loss: 0.5994, test_loss: 0.9874, test_f1: 0.6023
 epoch: 65, train_loss: 0.5950, test_loss: 0.9846, test_f1: 0.5935
 epoch: 66, train_loss: 0.5897, test_loss: 1.0118, test_f1: 0.5967
 epoch: 67, train_loss: 0.5900, test_loss: 0.9958, test_f1: 0.5958
 epoch: 68, train_loss: 0.5988, test_loss: 0.9609, test_f1: 0.5980
 epoch: 69, train_loss: 0.5916, test_loss: 0.9796, test_f1: 0.5838
 epoch: 70, train_loss: 0.5790, test_loss: 1.0095, test_f1: 0.5998
 epoch: 71, train_loss: 0.5838, test_loss: 0.9739, test_f1: 0.6004
 epoch: 72, train_loss: 0.5846, test_loss: 1.0296, test_f1: 0.6183
 epoch: 73, train_loss: 0.5893, test_loss: 1.0020, test_f1: 0.6140
 epoch: 74, train_loss: 0.5771, test_loss: 0.9743, test_f1: 0.6112
 epoch: 75, train_loss: 0.5676, test_loss: 1.0155, test_f1: 0.5981
 epoch: 76, train_loss: 0.5673, test_loss: 0.9981, test_f1: 0.6197
 epoch: 77, train_loss: 0.5788, test_loss: 1.0300, test_f1: 0.5929
 epoch: 78, train_loss: 0.5790, test_loss: 1.0046, test_f1: 0.6074
 epoch: 79, train_loss: 0.5725, test_loss: 1.0473, test_f1: 0.5886
 epoch: 80, train_loss: 0.5683, test_loss: 1.0420, test_f1: 0.6035
 epoch: 81, train_loss: 0.5688, test_loss: 1.0347, test_f1: 0.6206
 epoch: 82, train_loss: 0.5620, test_loss: 1.0341, test_f1: 0.5957
 epoch: 83, train_loss: 0.5653, test_loss: 1.0254, test_f1: 0.6177
 epoch: 84, train_loss: 0.5665, test_loss: 1.0218, test_f1: 0.6166
 epoch: 85, train_loss: 0.5568, test_loss: 0.9919, test_f1: 0.6152
 epoch: 86, train_loss: 0.5485, test_loss: 0.9849, test_f1: 0.6352
 epoch: 87, train_loss: 0.5528, test_loss: 1.0321, test_f1: 0.6077
 epoch: 88, train_loss: 0.5491, test_loss: 0.9830, test_f1: 0.6080
 epoch: 89, train_loss: 0.5473, test_loss: 1.0074, test_f1: 0.6148
 epoch: 90, train_loss: 0.5331, test_loss: 1.0439, test_f1: 0.6025
 epoch: 91, train_loss: 0.5496, test_loss: 1.0400, test_f1: 0.6054
 epoch: 92, train_loss: 0.5469, test_loss: 1.0578, test_f1: 0.6075
 epoch: 93, train_loss: 0.5375, test_loss: 1.0494, test_f1: 0.5966
 epoch: 94, train_loss: 0.5348, test_loss: 1.0623, test_f1: 0.6053
 epoch: 95, train_loss: 0.5300, test_loss: 1.0442, test_f1: 0.6097
 epoch: 96, train_loss: 0.5308, test_loss: 1.0156, test_f1: 0.6180
 epoch: 97, train_loss: 0.5338, test_loss: 1.0539, test_f1: 0.6081
 epoch: 98, train_loss: 0.5326, test_loss: 1.0049, test_f1: 0.6102
 epoch: 99, train_loss: 0.5297, test_loss: 1.0800, test_f1: 0.6026
##################ITERATION #7 ****************************************
 epoch: 0, train_loss: 1.3567, test_loss: 1.4028, test_f1: 0.2260
 epoch: 1, train_loss: 1.1942, test_loss: 1.3230, test_f1: 0.2291
 epoch: 2, train_loss: 1.1331, test_loss: 1.1933, test_f1: 0.2850
 epoch: 3, train_loss: 1.0721, test_loss: 1.0559, test_f1: 0.4181
 epoch: 4, train_loss: 1.0363, test_loss: 0.9988, test_f1: 0.4607
 epoch: 5, train_loss: 1.0160, test_loss: 1.0414, test_f1: 0.4433
 epoch: 6, train_loss: 0.9769, test_loss: 1.0428, test_f1: 0.4659
 epoch: 7, train_loss: 0.9507, test_loss: 1.0077, test_f1: 0.4636
 epoch: 8, train_loss: 0.9530, test_loss: 0.9757, test_f1: 0.5196
 epoch: 9, train_loss: 0.9349, test_loss: 0.9712, test_f1: 0.5127
 epoch: 10, train_loss: 0.9248, test_loss: 0.9797, test_f1: 0.5111
 epoch: 11, train_loss: 0.9090, test_loss: 0.8978, test_f1: 0.5128
 epoch: 12, train_loss: 0.9010, test_loss: 0.9985, test_f1: 0.5475
 epoch: 13, train_loss: 0.8829, test_loss: 0.8902, test_f1: 0.5275
 epoch: 14, train_loss: 0.8731, test_loss: 0.9392, test_f1: 0.5179
 epoch: 15, train_loss: 0.8534, test_loss: 0.9671, test_f1: 0.5125
 epoch: 16, train_loss: 0.8434, test_loss: 0.8830, test_f1: 0.5015
 epoch: 17, train_loss: 0.8346, test_loss: 0.9437, test_f1: 0.5303
 epoch: 18, train_loss: 0.8398, test_loss: 0.9200, test_f1: 0.5481
 epoch: 19, train_loss: 0.8261, test_loss: 0.9234, test_f1: 0.5367
 epoch: 20, train_loss: 0.8119, test_loss: 0.8369, test_f1: 0.5435
 epoch: 21, train_loss: 0.8085, test_loss: 0.9273, test_f1: 0.5472
 epoch: 22, train_loss: 0.7965, test_loss: 0.9197, test_f1: 0.5338
 epoch: 23, train_loss: 0.8076, test_loss: 0.8614, test_f1: 0.5329
 epoch: 24, train_loss: 0.8005, test_loss: 0.8869, test_f1: 0.5316
 epoch: 25, train_loss: 0.7945, test_loss: 0.8903, test_f1: 0.5340
 epoch: 26, train_loss: 0.7737, test_loss: 0.9820, test_f1: 0.5358
 epoch: 27, train_loss: 0.7733, test_loss: 0.9321, test_f1: 0.5399
 epoch: 28, train_loss: 0.7703, test_loss: 0.8901, test_f1: 0.5343
 epoch: 29, train_loss: 0.7553, test_loss: 0.8532, test_f1: 0.5451
 epoch: 30, train_loss: 0.7664, test_loss: 0.8590, test_f1: 0.5291
 epoch: 31, train_loss: 0.7517, test_loss: 0.9160, test_f1: 0.5442
 epoch: 32, train_loss: 0.7525, test_loss: 0.8521, test_f1: 0.5572
 epoch: 33, train_loss: 0.7380, test_loss: 0.9084, test_f1: 0.5309
 epoch: 34, train_loss: 0.7348, test_loss: 0.8606, test_f1: 0.5500
 epoch: 35, train_loss: 0.7362, test_loss: 0.8663, test_f1: 0.5460
 epoch: 36, train_loss: 0.7335, test_loss: 0.8122, test_f1: 0.5694
 epoch: 37, train_loss: 0.7178, test_loss: 0.8947, test_f1: 0.5362
 epoch: 38, train_loss: 0.7063, test_loss: 0.8810, test_f1: 0.5418
 epoch: 39, train_loss: 0.7090, test_loss: 0.8625, test_f1: 0.5474
 epoch: 40, train_loss: 0.7034, test_loss: 1.2094, test_f1: 0.5392
 epoch: 41, train_loss: 0.7045, test_loss: 0.9234, test_f1: 0.5419
 epoch: 42, train_loss: 0.6978, test_loss: 0.8859, test_f1: 0.5468
 epoch: 43, train_loss: 0.7004, test_loss: 0.9543, test_f1: 0.5638
 epoch: 44, train_loss: 0.6859, test_loss: 0.9212, test_f1: 0.5564
 epoch: 45, train_loss: 0.6867, test_loss: 0.8012, test_f1: 0.5768
 epoch: 46, train_loss: 0.6916, test_loss: 0.9189, test_f1: 0.5478
 epoch: 47, train_loss: 0.6653, test_loss: 0.9037, test_f1: 0.5484
 epoch: 48, train_loss: 0.6751, test_loss: 0.8538, test_f1: 0.5618
 epoch: 49, train_loss: 0.6638, test_loss: 0.8144, test_f1: 0.5720
 epoch: 50, train_loss: 0.6575, test_loss: 1.0731, test_f1: 0.5569
 epoch: 51, train_loss: 0.6689, test_loss: 0.8681, test_f1: 0.5696
 epoch: 52, train_loss: 0.6456, test_loss: 0.8543, test_f1: 0.5720
 epoch: 53, train_loss: 0.6430, test_loss: 0.8888, test_f1: 0.5705
 epoch: 54, train_loss: 0.6374, test_loss: 0.9136, test_f1: 0.5646
 epoch: 55, train_loss: 0.6308, test_loss: 0.9098, test_f1: 0.5566
 epoch: 56, train_loss: 0.6242, test_loss: 0.8992, test_f1: 0.5591
 epoch: 57, train_loss: 0.6260, test_loss: 0.8695, test_f1: 0.5666
 epoch: 58, train_loss: 0.6270, test_loss: 0.9176, test_f1: 0.5558
 epoch: 59, train_loss: 0.6219, test_loss: 0.7972, test_f1: 0.5945
 epoch: 60, train_loss: 0.6257, test_loss: 0.9328, test_f1: 0.5699
 epoch: 61, train_loss: 0.6162, test_loss: 0.8596, test_f1: 0.5917
 epoch: 62, train_loss: 0.6098, test_loss: 0.9496, test_f1: 0.5470
 epoch: 63, train_loss: 0.6191, test_loss: 0.8305, test_f1: 0.5998
 epoch: 64, train_loss: 0.6234, test_loss: 0.9145, test_f1: 0.5623
 epoch: 65, train_loss: 0.6100, test_loss: 0.8925, test_f1: 0.5758
 epoch: 66, train_loss: 0.6240, test_loss: 0.8764, test_f1: 0.5604
 epoch: 67, train_loss: 0.6114, test_loss: 0.8976, test_f1: 0.5656
 epoch: 68, train_loss: 0.6246, test_loss: 0.9198, test_f1: 0.5679
 epoch: 69, train_loss: 0.6182, test_loss: 0.9082, test_f1: 0.5754
 epoch: 70, train_loss: 0.6019, test_loss: 0.9565, test_f1: 0.5618
 epoch: 71, train_loss: 0.6029, test_loss: 0.9189, test_f1: 0.5641
 epoch: 72, train_loss: 0.5953, test_loss: 0.9433, test_f1: 0.5728
 epoch: 73, train_loss: 0.6012, test_loss: 0.9125, test_f1: 0.5776
 epoch: 74, train_loss: 0.6111, test_loss: 0.9320, test_f1: 0.5648
 epoch: 75, train_loss: 0.5853, test_loss: 0.9167, test_f1: 0.5744
 epoch: 76, train_loss: 0.6011, test_loss: 0.9181, test_f1: 0.5699
 epoch: 77, train_loss: 0.6071, test_loss: 0.9151, test_f1: 0.5724
 epoch: 78, train_loss: 0.5930, test_loss: 0.8532, test_f1: 0.5726
 epoch: 79, train_loss: 0.5987, test_loss: 0.9813, test_f1: 0.5576
 epoch: 80, train_loss: 0.5828, test_loss: 0.9026, test_f1: 0.5747
 epoch: 81, train_loss: 0.5945, test_loss: 0.8742, test_f1: 0.5924
 epoch: 82, train_loss: 0.5816, test_loss: 1.0144, test_f1: 0.5472
 epoch: 83, train_loss: 0.5850, test_loss: 0.8987, test_f1: 0.5775
 epoch: 84, train_loss: 0.6001, test_loss: 0.8673, test_f1: 0.5827
 epoch: 85, train_loss: 0.5974, test_loss: 0.9103, test_f1: 0.5749
 epoch: 86, train_loss: 0.5883, test_loss: 0.9615, test_f1: 0.5744
 epoch: 87, train_loss: 0.5761, test_loss: 0.8937, test_f1: 0.5716
 epoch: 88, train_loss: 0.5801, test_loss: 0.9464, test_f1: 0.5767
 epoch: 89, train_loss: 0.5826, test_loss: 1.0091, test_f1: 0.5504
 epoch: 90, train_loss: 0.5714, test_loss: 0.9063, test_f1: 0.5990
 epoch: 91, train_loss: 0.5734, test_loss: 0.9384, test_f1: 0.5972
 epoch: 92, train_loss: 0.5757, test_loss: 0.8913, test_f1: 0.5803
 epoch: 93, train_loss: 0.5634, test_loss: 0.9631, test_f1: 0.5704
 epoch: 94, train_loss: 0.5604, test_loss: 0.9322, test_f1: 0.5690
 epoch: 95, train_loss: 0.5667, test_loss: 0.9568, test_f1: 0.5797
 epoch: 96, train_loss: 0.5570, test_loss: 0.9557, test_f1: 0.5709
 epoch: 97, train_loss: 0.5677, test_loss: 0.9133, test_f1: 0.5747
 epoch: 98, train_loss: 0.5611, test_loss: 0.9092, test_f1: 0.5843
 epoch: 99, train_loss: 0.5526, test_loss: 0.9428, test_f1: 0.5842
##################ITERATION #8 ****************************************
 epoch: 0, train_loss: 1.2874, test_loss: 1.4242, test_f1: 0.2260
 epoch: 1, train_loss: 1.1035, test_loss: 1.3309, test_f1: 0.2262
 epoch: 2, train_loss: 1.0517, test_loss: 1.1691, test_f1: 0.3473
 epoch: 3, train_loss: 1.0146, test_loss: 1.0195, test_f1: 0.4329
 epoch: 4, train_loss: 0.9916, test_loss: 0.9759, test_f1: 0.4747
 epoch: 5, train_loss: 0.9769, test_loss: 0.9724, test_f1: 0.4851
 epoch: 6, train_loss: 0.9576, test_loss: 0.9481, test_f1: 0.5220
 epoch: 7, train_loss: 0.9409, test_loss: 0.9358, test_f1: 0.5192
 epoch: 8, train_loss: 0.9321, test_loss: 0.9461, test_f1: 0.4876
 epoch: 9, train_loss: 0.9210, test_loss: 0.9102, test_f1: 0.5341
 epoch: 10, train_loss: 0.9046, test_loss: 0.9331, test_f1: 0.5301
 epoch: 11, train_loss: 0.8915, test_loss: 0.9237, test_f1: 0.5593
 epoch: 12, train_loss: 0.8853, test_loss: 0.9253, test_f1: 0.5040
 epoch: 13, train_loss: 0.8669, test_loss: 0.9169, test_f1: 0.5184
 epoch: 14, train_loss: 0.8680, test_loss: 0.9315, test_f1: 0.5382
 epoch: 15, train_loss: 0.8404, test_loss: 0.8992, test_f1: 0.5359
 epoch: 16, train_loss: 0.8426, test_loss: 0.9016, test_f1: 0.5282
 epoch: 17, train_loss: 0.8255, test_loss: 0.8996, test_f1: 0.5370
 epoch: 18, train_loss: 0.8317, test_loss: 0.9090, test_f1: 0.5335
 epoch: 19, train_loss: 0.8224, test_loss: 0.9815, test_f1: 0.5224
 epoch: 20, train_loss: 0.8160, test_loss: 0.9272, test_f1: 0.5471
 epoch: 21, train_loss: 0.8000, test_loss: 0.9176, test_f1: 0.5230
 epoch: 22, train_loss: 0.7895, test_loss: 0.9217, test_f1: 0.5344
 epoch: 23, train_loss: 0.8001, test_loss: 0.9269, test_f1: 0.5244
 epoch: 24, train_loss: 0.7802, test_loss: 0.9481, test_f1: 0.5207
 epoch: 25, train_loss: 0.7806, test_loss: 0.9154, test_f1: 0.5505
 epoch: 26, train_loss: 0.7789, test_loss: 0.9429, test_f1: 0.5336
 epoch: 27, train_loss: 0.7663, test_loss: 0.9715, test_f1: 0.5260
 epoch: 28, train_loss: 0.7662, test_loss: 0.9521, test_f1: 0.5629
 epoch: 29, train_loss: 0.7633, test_loss: 0.9120, test_f1: 0.5224
 epoch: 30, train_loss: 0.7506, test_loss: 0.9550, test_f1: 0.5527
 epoch: 31, train_loss: 0.7447, test_loss: 0.9482, test_f1: 0.5560
 epoch: 32, train_loss: 0.7499, test_loss: 0.9123, test_f1: 0.5385
 epoch: 33, train_loss: 0.7382, test_loss: 1.0571, test_f1: 0.5257
 epoch: 34, train_loss: 0.7373, test_loss: 0.9814, test_f1: 0.5506
 epoch: 35, train_loss: 0.7207, test_loss: 0.9698, test_f1: 0.5444
 epoch: 36, train_loss: 0.7166, test_loss: 0.9714, test_f1: 0.5378
 epoch: 37, train_loss: 0.7118, test_loss: 0.9899, test_f1: 0.5614
 epoch: 38, train_loss: 0.7147, test_loss: 1.0734, test_f1: 0.5231
 epoch: 39, train_loss: 0.7034, test_loss: 0.9807, test_f1: 0.5510
 epoch: 40, train_loss: 0.7010, test_loss: 0.9444, test_f1: 0.5493
 epoch: 41, train_loss: 0.7192, test_loss: 1.0253, test_f1: 0.5515
 epoch: 42, train_loss: 0.7153, test_loss: 1.0158, test_f1: 0.5172
 epoch: 43, train_loss: 0.7080, test_loss: 1.0115, test_f1: 0.5665
 epoch: 44, train_loss: 0.7008, test_loss: 0.9739, test_f1: 0.5377
 epoch: 45, train_loss: 0.6866, test_loss: 0.9395, test_f1: 0.5872
 epoch: 46, train_loss: 0.6773, test_loss: 1.0486, test_f1: 0.5516
 epoch: 47, train_loss: 0.6602, test_loss: 0.9981, test_f1: 0.5570
 epoch: 48, train_loss: 0.6617, test_loss: 1.0243, test_f1: 0.5580
 epoch: 49, train_loss: 0.6742, test_loss: 0.9632, test_f1: 0.5654
 epoch: 50, train_loss: 0.6605, test_loss: 0.9756, test_f1: 0.5674
 epoch: 51, train_loss: 0.6500, test_loss: 0.9637, test_f1: 0.5640
 epoch: 52, train_loss: 0.6463, test_loss: 1.0034, test_f1: 0.5736
 epoch: 53, train_loss: 0.6371, test_loss: 1.0492, test_f1: 0.5636
 epoch: 54, train_loss: 0.6353, test_loss: 0.9909, test_f1: 0.5880
 epoch: 55, train_loss: 0.6397, test_loss: 0.9836, test_f1: 0.5811
 epoch: 56, train_loss: 0.6269, test_loss: 1.0492, test_f1: 0.5528
 epoch: 57, train_loss: 0.6174, test_loss: 1.0126, test_f1: 0.5766
 epoch: 58, train_loss: 0.6212, test_loss: 0.9986, test_f1: 0.5602
 epoch: 59, train_loss: 0.6252, test_loss: 1.0199, test_f1: 0.5616
 epoch: 60, train_loss: 0.6222, test_loss: 1.0128, test_f1: 0.5824
 epoch: 61, train_loss: 0.6145, test_loss: 1.0187, test_f1: 0.5679
 epoch: 62, train_loss: 0.6182, test_loss: 1.0331, test_f1: 0.5792
 epoch: 63, train_loss: 0.6184, test_loss: 1.0589, test_f1: 0.5689
 epoch: 64, train_loss: 0.6051, test_loss: 1.0450, test_f1: 0.5928
 epoch: 65, train_loss: 0.6180, test_loss: 1.0492, test_f1: 0.5646
 epoch: 66, train_loss: 0.6074, test_loss: 1.0373, test_f1: 0.5824
 epoch: 67, train_loss: 0.6016, test_loss: 1.0162, test_f1: 0.6027
 epoch: 68, train_loss: 0.5980, test_loss: 1.0407, test_f1: 0.5954
 epoch: 69, train_loss: 0.5999, test_loss: 1.0420, test_f1: 0.5797
 epoch: 70, train_loss: 0.5983, test_loss: 1.0535, test_f1: 0.5743
 epoch: 71, train_loss: 0.5957, test_loss: 1.0996, test_f1: 0.5492
 epoch: 72, train_loss: 0.6055, test_loss: 1.0232, test_f1: 0.5762
 epoch: 73, train_loss: 0.5981, test_loss: 1.0531, test_f1: 0.5873
 epoch: 74, train_loss: 0.5983, test_loss: 1.0890, test_f1: 0.5797
 epoch: 75, train_loss: 0.5966, test_loss: 1.0215, test_f1: 0.5921
 epoch: 76, train_loss: 0.5990, test_loss: 1.1099, test_f1: 0.5735
 epoch: 77, train_loss: 0.5834, test_loss: 1.0414, test_f1: 0.5938
 epoch: 78, train_loss: 0.5848, test_loss: 1.0734, test_f1: 0.5989
 epoch: 79, train_loss: 0.5801, test_loss: 1.0465, test_f1: 0.5933
 epoch: 80, train_loss: 0.5777, test_loss: 1.0518, test_f1: 0.5810
 epoch: 81, train_loss: 0.5782, test_loss: 1.0519, test_f1: 0.5754
 epoch: 82, train_loss: 0.5691, test_loss: 1.0546, test_f1: 0.5856
 epoch: 83, train_loss: 0.5642, test_loss: 1.0476, test_f1: 0.6030
 epoch: 84, train_loss: 0.5657, test_loss: 1.0993, test_f1: 0.5837
 epoch: 85, train_loss: 0.5687, test_loss: 1.0597, test_f1: 0.5918
 epoch: 86, train_loss: 0.5703, test_loss: 1.0592, test_f1: 0.5797
 epoch: 87, train_loss: 0.5641, test_loss: 1.0751, test_f1: 0.5754
 epoch: 88, train_loss: 0.5601, test_loss: 1.0325, test_f1: 0.5951
 epoch: 89, train_loss: 0.5639, test_loss: 1.0653, test_f1: 0.5939
 epoch: 90, train_loss: 0.5608, test_loss: 1.0297, test_f1: 0.5676
 epoch: 91, train_loss: 0.5783, test_loss: 1.0515, test_f1: 0.5816
 epoch: 92, train_loss: 0.5585, test_loss: 1.0444, test_f1: 0.5849
 epoch: 93, train_loss: 0.5626, test_loss: 1.1599, test_f1: 0.5732
 epoch: 94, train_loss: 0.5554, test_loss: 1.0542, test_f1: 0.5847
 epoch: 95, train_loss: 0.5416, test_loss: 1.0710, test_f1: 0.5974
 epoch: 96, train_loss: 0.5543, test_loss: 0.9694, test_f1: 0.6270
 epoch: 97, train_loss: 0.5505, test_loss: 1.0076, test_f1: 0.6059
 epoch: 98, train_loss: 0.5453, test_loss: 1.0978, test_f1: 0.5785
 epoch: 99, train_loss: 0.5422, test_loss: 1.1029, test_f1: 0.5914
##################ITERATION #9 ****************************************
 epoch: 0, train_loss: 1.4569, test_loss: 1.3832, test_f1: 0.2262
 epoch: 1, train_loss: 1.1388, test_loss: 1.3227, test_f1: 0.3177
 epoch: 2, train_loss: 1.0801, test_loss: 1.2359, test_f1: 0.3904
 epoch: 3, train_loss: 1.0486, test_loss: 1.1060, test_f1: 0.4596
 epoch: 4, train_loss: 1.0192, test_loss: 1.0090, test_f1: 0.4784
 epoch: 5, train_loss: 0.9974, test_loss: 0.9376, test_f1: 0.4866
 epoch: 6, train_loss: 0.9842, test_loss: 0.9414, test_f1: 0.4809
 epoch: 7, train_loss: 0.9618, test_loss: 0.9123, test_f1: 0.5185
 epoch: 8, train_loss: 0.9412, test_loss: 0.9485, test_f1: 0.4685
 epoch: 9, train_loss: 0.9252, test_loss: 0.9652, test_f1: 0.4851
 epoch: 10, train_loss: 0.9149, test_loss: 0.8981, test_f1: 0.5164
 epoch: 11, train_loss: 0.8955, test_loss: 0.8913, test_f1: 0.5126
 epoch: 12, train_loss: 0.8789, test_loss: 0.8818, test_f1: 0.5240
 epoch: 13, train_loss: 0.8728, test_loss: 0.8802, test_f1: 0.5211
 epoch: 14, train_loss: 0.8652, test_loss: 0.9229, test_f1: 0.5257
 epoch: 15, train_loss: 0.8456, test_loss: 0.9141, test_f1: 0.5269
 epoch: 16, train_loss: 0.8384, test_loss: 0.8495, test_f1: 0.5575
 epoch: 17, train_loss: 0.8268, test_loss: 1.0867, test_f1: 0.4830
 epoch: 18, train_loss: 0.8244, test_loss: 0.8533, test_f1: 0.5607
 epoch: 19, train_loss: 0.8122, test_loss: 0.9452, test_f1: 0.5366
 epoch: 20, train_loss: 0.8077, test_loss: 0.8567, test_f1: 0.5431
 epoch: 21, train_loss: 0.7969, test_loss: 0.9180, test_f1: 0.5553
 epoch: 22, train_loss: 0.7980, test_loss: 0.8803, test_f1: 0.5521
 epoch: 23, train_loss: 0.7941, test_loss: 0.8637, test_f1: 0.5424
 epoch: 24, train_loss: 0.7690, test_loss: 0.8045, test_f1: 0.5924
 epoch: 25, train_loss: 0.7758, test_loss: 0.9929, test_f1: 0.5306
 epoch: 26, train_loss: 0.7557, test_loss: 0.8241, test_f1: 0.5544
 epoch: 27, train_loss: 0.7592, test_loss: 0.8122, test_f1: 0.5598
 epoch: 28, train_loss: 0.7674, test_loss: 0.8575, test_f1: 0.5430
 epoch: 29, train_loss: 0.7529, test_loss: 0.7883, test_f1: 0.5977
 epoch: 30, train_loss: 0.7484, test_loss: 0.8686, test_f1: 0.5786
 epoch: 31, train_loss: 0.7462, test_loss: 0.8130, test_f1: 0.5517
 epoch: 32, train_loss: 0.7484, test_loss: 0.8758, test_f1: 0.5560
 epoch: 33, train_loss: 0.7269, test_loss: 0.8982, test_f1: 0.5521
 epoch: 34, train_loss: 0.7187, test_loss: 0.8235, test_f1: 0.5935
 epoch: 35, train_loss: 0.7105, test_loss: 0.8614, test_f1: 0.5605
 epoch: 36, train_loss: 0.6993, test_loss: 0.8553, test_f1: 0.5894
 epoch: 37, train_loss: 0.7078, test_loss: 0.8487, test_f1: 0.5956
 epoch: 38, train_loss: 0.6965, test_loss: 0.8278, test_f1: 0.5477
 epoch: 39, train_loss: 0.6931, test_loss: 0.7710, test_f1: 0.5797
 epoch: 40, train_loss: 0.6933, test_loss: 0.9837, test_f1: 0.5732
 epoch: 41, train_loss: 0.6849, test_loss: 0.9491, test_f1: 0.5643
 epoch: 42, train_loss: 0.6820, test_loss: 0.8564, test_f1: 0.5960
 epoch: 43, train_loss: 0.6752, test_loss: 0.8932, test_f1: 0.5754
 epoch: 44, train_loss: 0.6803, test_loss: 0.8569, test_f1: 0.5545
 epoch: 45, train_loss: 0.6679, test_loss: 0.8433, test_f1: 0.5551
 epoch: 46, train_loss: 0.6727, test_loss: 0.8518, test_f1: 0.5496
 epoch: 47, train_loss: 0.6622, test_loss: 0.8158, test_f1: 0.5492
 epoch: 48, train_loss: 0.6664, test_loss: 0.8820, test_f1: 0.5804
 epoch: 49, train_loss: 0.6603, test_loss: 0.7957, test_f1: 0.6034
 epoch: 50, train_loss: 0.6402, test_loss: 0.8396, test_f1: 0.5630
 epoch: 51, train_loss: 0.6354, test_loss: 0.9327, test_f1: 0.5765
 epoch: 52, train_loss: 0.6198, test_loss: 0.8586, test_f1: 0.5778
 epoch: 53, train_loss: 0.6207, test_loss: 0.8596, test_f1: 0.5964
 epoch: 54, train_loss: 0.6230, test_loss: 0.8461, test_f1: 0.5904
 epoch: 55, train_loss: 0.6124, test_loss: 0.8162, test_f1: 0.5822
 epoch: 56, train_loss: 0.6008, test_loss: 0.8762, test_f1: 0.5962
 epoch: 57, train_loss: 0.5918, test_loss: 0.8507, test_f1: 0.5815
 epoch: 58, train_loss: 0.6102, test_loss: 0.8347, test_f1: 0.6078
 epoch: 59, train_loss: 0.5997, test_loss: 0.9173, test_f1: 0.5751
 epoch: 60, train_loss: 0.5956, test_loss: 0.8535, test_f1: 0.5928
 epoch: 61, train_loss: 0.5884, test_loss: 0.8543, test_f1: 0.5817
 epoch: 62, train_loss: 0.5982, test_loss: 0.8490, test_f1: 0.5771
 epoch: 63, train_loss: 0.5975, test_loss: 0.8167, test_f1: 0.5997
 epoch: 64, train_loss: 0.5786, test_loss: 0.8589, test_f1: 0.5908
 epoch: 65, train_loss: 0.5944, test_loss: 0.8928, test_f1: 0.5760
 epoch: 66, train_loss: 0.5961, test_loss: 0.8857, test_f1: 0.5909
 epoch: 67, train_loss: 0.5819, test_loss: 0.7927, test_f1: 0.6086
 epoch: 68, train_loss: 0.5735, test_loss: 0.8750, test_f1: 0.5943
 epoch: 69, train_loss: 0.5819, test_loss: 0.8896, test_f1: 0.5937
 epoch: 70, train_loss: 0.5733, test_loss: 0.8521, test_f1: 0.6005
 epoch: 71, train_loss: 0.5748, test_loss: 0.8708, test_f1: 0.5964
 epoch: 72, train_loss: 0.5698, test_loss: 0.8613, test_f1: 0.6020
 epoch: 73, train_loss: 0.5713, test_loss: 0.8344, test_f1: 0.6083
 epoch: 74, train_loss: 0.5572, test_loss: 0.8932, test_f1: 0.6030
 epoch: 75, train_loss: 0.5603, test_loss: 0.8761, test_f1: 0.5945
 epoch: 76, train_loss: 0.5533, test_loss: 0.8284, test_f1: 0.6099
 epoch: 77, train_loss: 0.5488, test_loss: 0.9063, test_f1: 0.6033
 epoch: 78, train_loss: 0.5527, test_loss: 0.8702, test_f1: 0.5990
 epoch: 79, train_loss: 0.5664, test_loss: 0.8203, test_f1: 0.5945
 epoch: 80, train_loss: 0.5524, test_loss: 0.9067, test_f1: 0.5804
 epoch: 81, train_loss: 0.5401, test_loss: 0.8954, test_f1: 0.5791
 epoch: 82, train_loss: 0.5449, test_loss: 0.8604, test_f1: 0.6323
 epoch: 83, train_loss: 0.5513, test_loss: 0.8861, test_f1: 0.5776
 epoch: 84, train_loss: 0.5446, test_loss: 1.0167, test_f1: 0.5661
 epoch: 85, train_loss: 0.5488, test_loss: 0.8356, test_f1: 0.6048
 epoch: 86, train_loss: 0.5381, test_loss: 0.8485, test_f1: 0.6136
 epoch: 87, train_loss: 0.5433, test_loss: 0.8507, test_f1: 0.5938
 epoch: 88, train_loss: 0.5494, test_loss: 0.9109, test_f1: 0.5998
 epoch: 89, train_loss: 0.5189, test_loss: 0.9012, test_f1: 0.5805
 epoch: 90, train_loss: 0.5200, test_loss: 0.8578, test_f1: 0.6061
 epoch: 91, train_loss: 0.5217, test_loss: 0.8939, test_f1: 0.5917
 epoch: 92, train_loss: 0.5103, test_loss: 0.8646, test_f1: 0.6060
 epoch: 93, train_loss: 0.5274, test_loss: 0.8744, test_f1: 0.6086
 epoch: 94, train_loss: 0.5443, test_loss: 0.9198, test_f1: 0.6031
 epoch: 95, train_loss: 0.5230, test_loss: 0.8411, test_f1: 0.6101
 epoch: 96, train_loss: 0.5049, test_loss: 0.8767, test_f1: 0.5944
 epoch: 97, train_loss: 0.5037, test_loss: 0.9364, test_f1: 0.5943
 epoch: 98, train_loss: 0.5399, test_loss: 0.9093, test_f1: 0.5860
 epoch: 99, train_loss: 0.5231, test_loss: 0.8963, test_f1: 0.6090

Training completed in 425.27 seconds
Best F1: 0.6437 at epoch 88
Mean F1 across iterations: 0.6186  0.0191
========================FINAL RESULTS================================
FEGIN weighted F1: 0.6437  0.0191
python main.py --data ltspice_examples --representation component_pin --model FEGIN --layers 4 --hiddens 32 --batch_size 256 --lr 0.001 --emb_size 128 --epochs 100 --save_appendix component_pin_L4_H32_BS256_LR0.001_E128 --no_val
-----



STDERR:
  File "main.py", line 370, in <module>
    main()
  File "main.py", line 254, in main
    dataset = dataset_class(
  File "/home/philip/projects/ltspice_examples_code_repo/Circuit-Completion-Using-GNNs/component_classification_with_link_prediction_head/evaluation/FEGIN/kernel/circuit_datasets.py", line 15, in __init__
    self.data, self.slices = torch.load(self.processed_paths[0])
  File "/home/philip/.local/lib/python3.8/site-packages/torch/serialization.py", line 1040, in load
    warnings.warn(
  File "/usr/lib/python3.8/warnings.py", line 109, in _showwarnmsg
    sw(msg.message, msg.category, msg.filename, msg.lineno,
  File "main.py", line 47, in warn_with_traceback
    traceback.print_stack(file=log)
/home/philip/projects/ltspice_examples_code_repo/Circuit-Completion-Using-GNNs/component_classification_with_link_prediction_head/evaluation/FEGIN/kernel/circuit_datasets.py:15: FutureWarning: You are using `torch.load` with `weights_only=False` (the current default value), which uses the default pickle module implicitly. It is possible to construct malicious pickle data which will execute arbitrary code during unpickling (See https://github.com/pytorch/pytorch/blob/main/SECURITY.md#untrusted-models for more details). In a future release, the default value for `weights_only` will be flipped to `True`. This limits the functions that could be executed during unpickling. Arbitrary objects will no longer be allowed to be loaded via this mode unless they are explicitly allowlisted by the user via `torch.serialization.add_safe_globals`. We recommend you start setting `weights_only=True` for any use case where you don't have full control of the loaded file. Please open an issue on GitHub for any issues related to this experimental feature.
  self.data, self.slices = torch.load(self.processed_paths[0])
