STDOUT:
Results will be saved in /home/philip/projects/ltspice_examples_code_repo/Circuit-Completion-Using-GNNs/component_classification_with_link_prediction_head/evaluation/FEGIN/results/model_FEGIN_dataset_ltspice_demos
Command line input: python main.py --data ltspice_demos --representation component_net --model FEGIN --layers 2 --hiddens 128 --batch_size 256 --lr 0.001 --emb_size 250 --epochs 100 --save_appendix component_net_L2_H128_BS256_LR0.001_E250 --no_val
 is saved.
-----
ltspice_demos - FEGIN
Using 2 layers, 128 hidden units, h = 2
Loading component_net representation dataset
ENTERED
Training FEGIN on component_net representation
Train: 1565, Test: 383
##################ITERATION #0 ****************************************
 epoch: 0, train_loss: 1.3358, test_loss: 1.3438, test_f1: 0.2281
 epoch: 1, train_loss: 1.2075, test_loss: 1.3094, test_f1: 0.2583
 epoch: 2, train_loss: 1.1608, test_loss: 1.2832, test_f1: 0.2722
 epoch: 3, train_loss: 1.1223, test_loss: 1.2486, test_f1: 0.2723
 epoch: 4, train_loss: 1.0924, test_loss: 1.2104, test_f1: 0.3540
 epoch: 5, train_loss: 1.0482, test_loss: 1.1778, test_f1: 0.4278
 epoch: 6, train_loss: 1.0146, test_loss: 1.1389, test_f1: 0.4142
 epoch: 7, train_loss: 0.9853, test_loss: 1.1065, test_f1: 0.4376
 epoch: 8, train_loss: 0.9577, test_loss: 1.0857, test_f1: 0.4935
 epoch: 9, train_loss: 0.9352, test_loss: 1.1144, test_f1: 0.4585
 epoch: 10, train_loss: 0.9068, test_loss: 1.0811, test_f1: 0.5382
 epoch: 11, train_loss: 0.8916, test_loss: 1.1174, test_f1: 0.5396
 epoch: 12, train_loss: 0.8739, test_loss: 1.0760, test_f1: 0.5413
 epoch: 13, train_loss: 0.8710, test_loss: 1.0988, test_f1: 0.5386
 epoch: 14, train_loss: 0.8576, test_loss: 1.1087, test_f1: 0.5720
 epoch: 15, train_loss: 0.8472, test_loss: 1.0897, test_f1: 0.5304
 epoch: 16, train_loss: 0.8452, test_loss: 1.0721, test_f1: 0.5303
 epoch: 17, train_loss: 0.8470, test_loss: 1.0830, test_f1: 0.5687
 epoch: 18, train_loss: 0.8354, test_loss: 1.0490, test_f1: 0.5624
 epoch: 19, train_loss: 0.8046, test_loss: 0.9918, test_f1: 0.6010
 epoch: 20, train_loss: 0.7984, test_loss: 1.1636, test_f1: 0.5300
 epoch: 21, train_loss: 0.7763, test_loss: 1.1404, test_f1: 0.5286
 epoch: 22, train_loss: 0.7842, test_loss: 1.1769, test_f1: 0.5143
 epoch: 23, train_loss: 0.7740, test_loss: 1.0770, test_f1: 0.5365
 epoch: 24, train_loss: 0.7682, test_loss: 1.1668, test_f1: 0.5166
 epoch: 25, train_loss: 0.7385, test_loss: 1.1796, test_f1: 0.5888
 epoch: 26, train_loss: 0.7255, test_loss: 1.0890, test_f1: 0.5659
 epoch: 27, train_loss: 0.7255, test_loss: 1.1002, test_f1: 0.5408
 epoch: 28, train_loss: 0.7179, test_loss: 1.1165, test_f1: 0.5704
 epoch: 29, train_loss: 0.6837, test_loss: 1.1577, test_f1: 0.5672
 epoch: 30, train_loss: 0.6910, test_loss: 1.1494, test_f1: 0.5658
 epoch: 31, train_loss: 0.6578, test_loss: 1.0875, test_f1: 0.5724
 epoch: 32, train_loss: 0.6758, test_loss: 1.1981, test_f1: 0.5654
 epoch: 33, train_loss: 0.6472, test_loss: 1.1220, test_f1: 0.5879
 epoch: 34, train_loss: 0.6517, test_loss: 1.0760, test_f1: 0.5696
 epoch: 35, train_loss: 0.6437, test_loss: 1.2302, test_f1: 0.5702
 epoch: 36, train_loss: 0.6345, test_loss: 1.1636, test_f1: 0.5841
 epoch: 37, train_loss: 0.6154, test_loss: 1.0870, test_f1: 0.6296
 epoch: 38, train_loss: 0.6173, test_loss: 1.1253, test_f1: 0.5992
 epoch: 39, train_loss: 0.6132, test_loss: 1.1280, test_f1: 0.6078
 epoch: 40, train_loss: 0.6193, test_loss: 1.2187, test_f1: 0.6200
 epoch: 41, train_loss: 0.6318, test_loss: 1.1998, test_f1: 0.5461
 epoch: 42, train_loss: 0.6159, test_loss: 1.2477, test_f1: 0.5437
 epoch: 43, train_loss: 0.6083, test_loss: 1.2158, test_f1: 0.5806
 epoch: 44, train_loss: 0.5906, test_loss: 1.1962, test_f1: 0.5983
 epoch: 45, train_loss: 0.6038, test_loss: 1.4095, test_f1: 0.5643
 epoch: 46, train_loss: 0.6084, test_loss: 1.4070, test_f1: 0.5853
 epoch: 47, train_loss: 0.5835, test_loss: 1.3769, test_f1: 0.5934
 epoch: 48, train_loss: 0.5602, test_loss: 1.2187, test_f1: 0.6058
 epoch: 49, train_loss: 0.5600, test_loss: 1.1611, test_f1: 0.6051
 epoch: 50, train_loss: 0.5920, test_loss: 1.1992, test_f1: 0.5852
 epoch: 51, train_loss: 0.5626, test_loss: 1.1577, test_f1: 0.6114
 epoch: 52, train_loss: 0.5361, test_loss: 1.2278, test_f1: 0.6257
 epoch: 53, train_loss: 0.5255, test_loss: 1.2526, test_f1: 0.5923
 epoch: 54, train_loss: 0.5064, test_loss: 1.2721, test_f1: 0.5985
 epoch: 55, train_loss: 0.4943, test_loss: 1.3066, test_f1: 0.6023
 epoch: 56, train_loss: 0.4922, test_loss: 1.2563, test_f1: 0.5941
 epoch: 57, train_loss: 0.4848, test_loss: 1.2932, test_f1: 0.5918
 epoch: 58, train_loss: 0.4628, test_loss: 1.3525, test_f1: 0.5986
 epoch: 59, train_loss: 0.4731, test_loss: 1.3888, test_f1: 0.5882
 epoch: 60, train_loss: 0.4619, test_loss: 1.4345, test_f1: 0.5862
 epoch: 61, train_loss: 0.4565, test_loss: 1.4120, test_f1: 0.5811
 epoch: 62, train_loss: 0.4530, test_loss: 1.3550, test_f1: 0.6134
 epoch: 63, train_loss: 0.4566, test_loss: 1.4054, test_f1: 0.6204
 epoch: 64, train_loss: 0.4353, test_loss: 1.4685, test_f1: 0.5912
 epoch: 65, train_loss: 0.4263, test_loss: 1.4992, test_f1: 0.5652
 epoch: 66, train_loss: 0.4371, test_loss: 1.5414, test_f1: 0.5901
 epoch: 67, train_loss: 0.4618, test_loss: 1.5071, test_f1: 0.6023
 epoch: 68, train_loss: 0.4218, test_loss: 1.5241, test_f1: 0.6124
 epoch: 69, train_loss: 0.4300, test_loss: 1.4354, test_f1: 0.5899
 epoch: 70, train_loss: 0.4248, test_loss: 1.6478, test_f1: 0.5971
 epoch: 71, train_loss: 0.4113, test_loss: 1.5854, test_f1: 0.5800
 epoch: 72, train_loss: 0.3996, test_loss: 1.5217, test_f1: 0.5792
 epoch: 73, train_loss: 0.4493, test_loss: 1.6890, test_f1: 0.5458
 epoch: 74, train_loss: 0.4605, test_loss: 1.7537, test_f1: 0.5667
 epoch: 75, train_loss: 0.4595, test_loss: 1.5962, test_f1: 0.6012
 epoch: 76, train_loss: 0.4353, test_loss: 1.5100, test_f1: 0.5936
 epoch: 77, train_loss: 0.4023, test_loss: 1.4501, test_f1: 0.6134
 epoch: 78, train_loss: 0.4039, test_loss: 1.5268, test_f1: 0.6072
 epoch: 79, train_loss: 0.4186, test_loss: 1.4945, test_f1: 0.6010
 epoch: 80, train_loss: 0.3885, test_loss: 1.5771, test_f1: 0.6054
 epoch: 81, train_loss: 0.3766, test_loss: 1.6111, test_f1: 0.6055
 epoch: 82, train_loss: 0.3966, test_loss: 1.6198, test_f1: 0.6123
 epoch: 83, train_loss: 0.4079, test_loss: 1.6989, test_f1: 0.6103
 epoch: 84, train_loss: 0.3917, test_loss: 1.6974, test_f1: 0.5952
 epoch: 85, train_loss: 0.3920, test_loss: 1.6851, test_f1: 0.5900
 epoch: 86, train_loss: 0.3524, test_loss: 1.7756, test_f1: 0.5770
 epoch: 87, train_loss: 0.3578, test_loss: 1.7284, test_f1: 0.6042
 epoch: 88, train_loss: 0.3471, test_loss: 1.6559, test_f1: 0.6066
 epoch: 89, train_loss: 0.3513, test_loss: 1.6801, test_f1: 0.6079
 epoch: 90, train_loss: 0.3373, test_loss: 1.6955, test_f1: 0.5988
 epoch: 91, train_loss: 0.3524, test_loss: 1.8146, test_f1: 0.5974
 epoch: 92, train_loss: 0.3533, test_loss: 1.8612, test_f1: 0.5890
 epoch: 93, train_loss: 0.3237, test_loss: 1.8914, test_f1: 0.5915
 epoch: 94, train_loss: 0.3631, test_loss: 1.9549, test_f1: 0.5839
 epoch: 95, train_loss: 0.3669, test_loss: 1.8283, test_f1: 0.6002
 epoch: 96, train_loss: 0.3391, test_loss: 2.2407, test_f1: 0.5714
 epoch: 97, train_loss: 0.3565, test_loss: 2.1302, test_f1: 0.5548
 epoch: 98, train_loss: 0.3757, test_loss: 2.0494, test_f1: 0.5786
 epoch: 99, train_loss: 0.3249, test_loss: 1.8577, test_f1: 0.5969
##################ITERATION #1 ****************************************
 epoch: 0, train_loss: 1.2137, test_loss: 1.3126, test_f1: 0.1365
 epoch: 1, train_loss: 1.0669, test_loss: 1.2946, test_f1: 0.1365
 epoch: 2, train_loss: 1.0029, test_loss: 1.2558, test_f1: 0.1368
 epoch: 3, train_loss: 0.9765, test_loss: 1.1829, test_f1: 0.4113
 epoch: 4, train_loss: 0.9481, test_loss: 1.1328, test_f1: 0.4102
 epoch: 5, train_loss: 0.9223, test_loss: 1.0956, test_f1: 0.3915
 epoch: 6, train_loss: 0.9030, test_loss: 1.0660, test_f1: 0.4831
 epoch: 7, train_loss: 0.8839, test_loss: 1.0480, test_f1: 0.4621
 epoch: 8, train_loss: 0.8743, test_loss: 1.0346, test_f1: 0.4840
 epoch: 9, train_loss: 0.8466, test_loss: 1.0231, test_f1: 0.5086
 epoch: 10, train_loss: 0.8225, test_loss: 1.0454, test_f1: 0.5616
 epoch: 11, train_loss: 0.7940, test_loss: 1.0140, test_f1: 0.5857
 epoch: 12, train_loss: 0.7904, test_loss: 1.1632, test_f1: 0.4687
 epoch: 13, train_loss: 0.7782, test_loss: 1.0297, test_f1: 0.5769
 epoch: 14, train_loss: 0.7747, test_loss: 1.0856, test_f1: 0.5913
 epoch: 15, train_loss: 0.7511, test_loss: 1.1679, test_f1: 0.5296
 epoch: 16, train_loss: 0.7541, test_loss: 1.0445, test_f1: 0.5887
 epoch: 17, train_loss: 0.7355, test_loss: 1.1023, test_f1: 0.5708
 epoch: 18, train_loss: 0.7159, test_loss: 1.0792, test_f1: 0.5877
 epoch: 19, train_loss: 0.7312, test_loss: 1.0465, test_f1: 0.5846
 epoch: 20, train_loss: 0.7047, test_loss: 1.0678, test_f1: 0.6050
 epoch: 21, train_loss: 0.6809, test_loss: 1.0774, test_f1: 0.5976
 epoch: 22, train_loss: 0.6621, test_loss: 1.0404, test_f1: 0.5845
 epoch: 23, train_loss: 0.6518, test_loss: 1.0830, test_f1: 0.5238
 epoch: 24, train_loss: 0.6291, test_loss: 1.0929, test_f1: 0.6037
 epoch: 25, train_loss: 0.6243, test_loss: 1.0854, test_f1: 0.6569
 epoch: 26, train_loss: 0.6222, test_loss: 1.0783, test_f1: 0.5755
 epoch: 27, train_loss: 0.6215, test_loss: 1.1897, test_f1: 0.5588
 epoch: 28, train_loss: 0.6161, test_loss: 1.1849, test_f1: 0.5484
 epoch: 29, train_loss: 0.5771, test_loss: 1.1100, test_f1: 0.6101
 epoch: 30, train_loss: 0.6039, test_loss: 1.1281, test_f1: 0.6236
 epoch: 31, train_loss: 0.5652, test_loss: 1.0689, test_f1: 0.6251
 epoch: 32, train_loss: 0.5980, test_loss: 1.1260, test_f1: 0.6167
 epoch: 33, train_loss: 0.6071, test_loss: 1.1446, test_f1: 0.6026
 epoch: 34, train_loss: 0.5842, test_loss: 1.2080, test_f1: 0.5082
 epoch: 35, train_loss: 0.5570, test_loss: 1.1197, test_f1: 0.6190
 epoch: 36, train_loss: 0.5510, test_loss: 1.3113, test_f1: 0.5509
 epoch: 37, train_loss: 0.5431, test_loss: 1.1316, test_f1: 0.6232
 epoch: 38, train_loss: 0.5211, test_loss: 1.2221, test_f1: 0.5845
 epoch: 39, train_loss: 0.5026, test_loss: 1.2761, test_f1: 0.5825
 epoch: 40, train_loss: 0.5109, test_loss: 1.4012, test_f1: 0.6081
 epoch: 41, train_loss: 0.5012, test_loss: 1.2540, test_f1: 0.6092
 epoch: 42, train_loss: 0.4910, test_loss: 1.3350, test_f1: 0.6043
 epoch: 43, train_loss: 0.4892, test_loss: 1.4996, test_f1: 0.5935
 epoch: 44, train_loss: 0.4857, test_loss: 1.7208, test_f1: 0.5984
 epoch: 45, train_loss: 0.4629, test_loss: 1.5002, test_f1: 0.5852
 epoch: 46, train_loss: 0.4810, test_loss: 1.3850, test_f1: 0.6219
 epoch: 47, train_loss: 0.4939, test_loss: 1.3906, test_f1: 0.6240
 epoch: 48, train_loss: 0.4694, test_loss: 1.3459, test_f1: 0.6199
 epoch: 49, train_loss: 0.4452, test_loss: 1.3233, test_f1: 0.6156
 epoch: 50, train_loss: 0.4362, test_loss: 1.4800, test_f1: 0.5797
 epoch: 51, train_loss: 0.4123, test_loss: 1.4089, test_f1: 0.5991
 epoch: 52, train_loss: 0.3973, test_loss: 1.4114, test_f1: 0.6122
 epoch: 53, train_loss: 0.3988, test_loss: 1.4195, test_f1: 0.6187
 epoch: 54, train_loss: 0.3870, test_loss: 1.4896, test_f1: 0.6146
 epoch: 55, train_loss: 0.3657, test_loss: 1.5334, test_f1: 0.6195
 epoch: 56, train_loss: 0.3645, test_loss: 1.4895, test_f1: 0.6254
 epoch: 57, train_loss: 0.3738, test_loss: 1.5142, test_f1: 0.6315
 epoch: 58, train_loss: 0.3526, test_loss: 1.5692, test_f1: 0.6291
 epoch: 59, train_loss: 0.3749, test_loss: 1.7557, test_f1: 0.5831
 epoch: 60, train_loss: 0.3561, test_loss: 1.6715, test_f1: 0.6231
 epoch: 61, train_loss: 0.3534, test_loss: 1.6390, test_f1: 0.6354
 epoch: 62, train_loss: 0.3337, test_loss: 1.7364, test_f1: 0.6459
 epoch: 63, train_loss: 0.3260, test_loss: 1.6805, test_f1: 0.6411
 epoch: 64, train_loss: 0.3540, test_loss: 1.8568, test_f1: 0.6208
 epoch: 65, train_loss: 0.3317, test_loss: 1.8261, test_f1: 0.5899
 epoch: 66, train_loss: 0.3547, test_loss: 1.7456, test_f1: 0.6035
 epoch: 67, train_loss: 0.3204, test_loss: 1.6887, test_f1: 0.6158
 epoch: 68, train_loss: 0.3079, test_loss: 1.7230, test_f1: 0.6300
 epoch: 69, train_loss: 0.3147, test_loss: 1.7038, test_f1: 0.6389
 epoch: 70, train_loss: 0.3154, test_loss: 1.5867, test_f1: 0.6252
 epoch: 71, train_loss: 0.3174, test_loss: 1.5931, test_f1: 0.6436
 epoch: 72, train_loss: 0.3160, test_loss: 1.9440, test_f1: 0.6396
 epoch: 73, train_loss: 0.2812, test_loss: 1.9025, test_f1: 0.6234
 epoch: 74, train_loss: 0.2973, test_loss: 1.8881, test_f1: 0.6220
 epoch: 75, train_loss: 0.3007, test_loss: 1.8658, test_f1: 0.6201
 epoch: 76, train_loss: 0.2736, test_loss: 1.8226, test_f1: 0.6298
 epoch: 77, train_loss: 0.2781, test_loss: 1.8858, test_f1: 0.6286
 epoch: 78, train_loss: 0.2738, test_loss: 1.9734, test_f1: 0.6233
 epoch: 79, train_loss: 0.2925, test_loss: 1.9982, test_f1: 0.6259
 epoch: 80, train_loss: 0.2706, test_loss: 2.0530, test_f1: 0.6181
 epoch: 81, train_loss: 0.2488, test_loss: 2.1975, test_f1: 0.6343
 epoch: 82, train_loss: 0.2732, test_loss: 2.0288, test_f1: 0.6269
 epoch: 83, train_loss: 0.2809, test_loss: 1.9793, test_f1: 0.6201
 epoch: 84, train_loss: 0.2561, test_loss: 1.9048, test_f1: 0.6158
 epoch: 85, train_loss: 0.2570, test_loss: 2.1580, test_f1: 0.6119
 epoch: 86, train_loss: 0.2321, test_loss: 2.0904, test_f1: 0.6419
 epoch: 87, train_loss: 0.2382, test_loss: 1.8500, test_f1: 0.6314
 epoch: 88, train_loss: 0.2762, test_loss: 1.9544, test_f1: 0.6093
 epoch: 89, train_loss: 0.2549, test_loss: 1.8877, test_f1: 0.6408
 epoch: 90, train_loss: 0.2642, test_loss: 1.9351, test_f1: 0.6310
 epoch: 91, train_loss: 0.2657, test_loss: 2.1402, test_f1: 0.6430
 epoch: 92, train_loss: 0.2655, test_loss: 2.0044, test_f1: 0.6269
 epoch: 93, train_loss: 0.2642, test_loss: 2.3639, test_f1: 0.6202
 epoch: 94, train_loss: 0.2520, test_loss: 2.2352, test_f1: 0.6009
 epoch: 95, train_loss: 0.2569, test_loss: 2.1278, test_f1: 0.6426
 epoch: 96, train_loss: 0.2577, test_loss: 1.9762, test_f1: 0.6167
 epoch: 97, train_loss: 0.2560, test_loss: 2.2354, test_f1: 0.5950
 epoch: 98, train_loss: 0.2242, test_loss: 2.2418, test_f1: 0.6329
 epoch: 99, train_loss: 0.2540, test_loss: 2.1801, test_f1: 0.6042
##################ITERATION #2 ****************************************
 epoch: 0, train_loss: 1.2311, test_loss: 1.3152, test_f1: 0.1365
 epoch: 1, train_loss: 1.0516, test_loss: 1.3021, test_f1: 0.1365
 epoch: 2, train_loss: 0.9999, test_loss: 1.2565, test_f1: 0.2234
 epoch: 3, train_loss: 0.9519, test_loss: 1.2045, test_f1: 0.4181
 epoch: 4, train_loss: 0.9408, test_loss: 1.1746, test_f1: 0.3736
 epoch: 5, train_loss: 0.9200, test_loss: 1.1214, test_f1: 0.4509
 epoch: 6, train_loss: 0.8948, test_loss: 1.1322, test_f1: 0.4430
 epoch: 7, train_loss: 0.8760, test_loss: 1.1673, test_f1: 0.4162
 epoch: 8, train_loss: 0.8581, test_loss: 1.1039, test_f1: 0.5441
 epoch: 9, train_loss: 0.8422, test_loss: 1.0667, test_f1: 0.5581
 epoch: 10, train_loss: 0.8120, test_loss: 1.0885, test_f1: 0.5581
 epoch: 11, train_loss: 0.8167, test_loss: 1.0711, test_f1: 0.5627
 epoch: 12, train_loss: 0.7916, test_loss: 1.1180, test_f1: 0.5582
 epoch: 13, train_loss: 0.7975, test_loss: 1.0836, test_f1: 0.5611
 epoch: 14, train_loss: 0.7680, test_loss: 1.0624, test_f1: 0.5824
 epoch: 15, train_loss: 0.7468, test_loss: 1.0352, test_f1: 0.5688
 epoch: 16, train_loss: 0.7363, test_loss: 1.0669, test_f1: 0.6161
 epoch: 17, train_loss: 0.7468, test_loss: 1.0713, test_f1: 0.5592
 epoch: 18, train_loss: 0.7176, test_loss: 1.1584, test_f1: 0.5471
 epoch: 19, train_loss: 0.7343, test_loss: 1.1321, test_f1: 0.5953
 epoch: 20, train_loss: 0.7116, test_loss: 1.0926, test_f1: 0.5921
 epoch: 21, train_loss: 0.7115, test_loss: 1.0853, test_f1: 0.6031
 epoch: 22, train_loss: 0.6978, test_loss: 1.1252, test_f1: 0.5890
 epoch: 23, train_loss: 0.6767, test_loss: 1.1948, test_f1: 0.6081
 epoch: 24, train_loss: 0.6595, test_loss: 1.1440, test_f1: 0.6089
 epoch: 25, train_loss: 0.6571, test_loss: 1.1798, test_f1: 0.5588
 epoch: 26, train_loss: 0.6553, test_loss: 1.0620, test_f1: 0.6247
 epoch: 27, train_loss: 0.6602, test_loss: 1.1888, test_f1: 0.5970
 epoch: 28, train_loss: 0.6364, test_loss: 1.1524, test_f1: 0.5673
 epoch: 29, train_loss: 0.6276, test_loss: 1.2563, test_f1: 0.5809
 epoch: 30, train_loss: 0.6276, test_loss: 1.2178, test_f1: 0.5973
 epoch: 31, train_loss: 0.6146, test_loss: 1.1394, test_f1: 0.6149
 epoch: 32, train_loss: 0.6367, test_loss: 1.1519, test_f1: 0.5951
 epoch: 33, train_loss: 0.6069, test_loss: 1.2055, test_f1: 0.5865
 epoch: 34, train_loss: 0.5969, test_loss: 1.1668, test_f1: 0.6030
 epoch: 35, train_loss: 0.5917, test_loss: 1.2364, test_f1: 0.5970
 epoch: 36, train_loss: 0.5724, test_loss: 1.2652, test_f1: 0.5737
 epoch: 37, train_loss: 0.5856, test_loss: 1.1881, test_f1: 0.5914
 epoch: 38, train_loss: 0.5478, test_loss: 1.3051, test_f1: 0.5885
 epoch: 39, train_loss: 0.5562, test_loss: 1.2438, test_f1: 0.5701
 epoch: 40, train_loss: 0.5503, test_loss: 1.2801, test_f1: 0.6071
 epoch: 41, train_loss: 0.5279, test_loss: 1.2683, test_f1: 0.6140
 epoch: 42, train_loss: 0.5271, test_loss: 1.3641, test_f1: 0.5928
 epoch: 43, train_loss: 0.5283, test_loss: 1.4687, test_f1: 0.5794
 epoch: 44, train_loss: 0.5292, test_loss: 1.3108, test_f1: 0.6168
 epoch: 45, train_loss: 0.5224, test_loss: 1.3066, test_f1: 0.6121
 epoch: 46, train_loss: 0.5388, test_loss: 1.7067, test_f1: 0.5722
 epoch: 47, train_loss: 0.4993, test_loss: 1.5089, test_f1: 0.5860
 epoch: 48, train_loss: 0.5021, test_loss: 1.3831, test_f1: 0.5680
 epoch: 49, train_loss: 0.5145, test_loss: 1.4173, test_f1: 0.5951
 epoch: 50, train_loss: 0.5034, test_loss: 1.4031, test_f1: 0.6041
 epoch: 51, train_loss: 0.4718, test_loss: 1.4787, test_f1: 0.6028
 epoch: 52, train_loss: 0.4401, test_loss: 1.5483, test_f1: 0.5821
 epoch: 53, train_loss: 0.4517, test_loss: 1.5733, test_f1: 0.5952
 epoch: 54, train_loss: 0.4333, test_loss: 1.6287, test_f1: 0.5956
 epoch: 55, train_loss: 0.4441, test_loss: 1.6508, test_f1: 0.5736
 epoch: 56, train_loss: 0.4505, test_loss: 1.6475, test_f1: 0.5830
 epoch: 57, train_loss: 0.4227, test_loss: 1.5780, test_f1: 0.5851
 epoch: 58, train_loss: 0.4089, test_loss: 1.5770, test_f1: 0.5932
 epoch: 59, train_loss: 0.4116, test_loss: 1.5475, test_f1: 0.5808
 epoch: 60, train_loss: 0.3939, test_loss: 1.5352, test_f1: 0.5862
 epoch: 61, train_loss: 0.4091, test_loss: 1.7009, test_f1: 0.5657
 epoch: 62, train_loss: 0.3849, test_loss: 1.6436, test_f1: 0.6016
 epoch: 63, train_loss: 0.3778, test_loss: 1.5943, test_f1: 0.6084
 epoch: 64, train_loss: 0.3769, test_loss: 1.6463, test_f1: 0.6043
 epoch: 65, train_loss: 0.3526, test_loss: 1.7654, test_f1: 0.5810
 epoch: 66, train_loss: 0.3621, test_loss: 1.7963, test_f1: 0.5935
 epoch: 67, train_loss: 0.3715, test_loss: 1.8322, test_f1: 0.5874
 epoch: 68, train_loss: 0.3567, test_loss: 1.8749, test_f1: 0.5888
 epoch: 69, train_loss: 0.3418, test_loss: 1.9543, test_f1: 0.5624
 epoch: 70, train_loss: 0.3342, test_loss: 1.8912, test_f1: 0.5895
 epoch: 71, train_loss: 0.3407, test_loss: 1.8873, test_f1: 0.5957
 epoch: 72, train_loss: 0.3147, test_loss: 1.9220, test_f1: 0.5978
 epoch: 73, train_loss: 0.3348, test_loss: 2.0266, test_f1: 0.6024
 epoch: 74, train_loss: 0.3315, test_loss: 1.8858, test_f1: 0.5786
 epoch: 75, train_loss: 0.3428, test_loss: 1.8956, test_f1: 0.5858
 epoch: 76, train_loss: 0.3337, test_loss: 1.9844, test_f1: 0.5968
 epoch: 77, train_loss: 0.3194, test_loss: 2.0994, test_f1: 0.5900
 epoch: 78, train_loss: 0.3513, test_loss: 2.1088, test_f1: 0.5876
 epoch: 79, train_loss: 0.3497, test_loss: 2.1329, test_f1: 0.5773
 epoch: 80, train_loss: 0.3519, test_loss: 2.0642, test_f1: 0.5646
 epoch: 81, train_loss: 0.3261, test_loss: 1.9604, test_f1: 0.5863
 epoch: 82, train_loss: 0.3310, test_loss: 2.0229, test_f1: 0.5989
 epoch: 83, train_loss: 0.3604, test_loss: 2.0605, test_f1: 0.5970
 epoch: 84, train_loss: 0.3347, test_loss: 1.8459, test_f1: 0.6103
 epoch: 85, train_loss: 0.3384, test_loss: 2.1110, test_f1: 0.6141
 epoch: 86, train_loss: 0.3388, test_loss: 2.1870, test_f1: 0.6146
 epoch: 87, train_loss: 0.3146, test_loss: 2.2596, test_f1: 0.5849
 epoch: 88, train_loss: 0.3309, test_loss: 2.0009, test_f1: 0.5954
 epoch: 89, train_loss: 0.2974, test_loss: 1.9460, test_f1: 0.5880
 epoch: 90, train_loss: 0.3196, test_loss: 1.9520, test_f1: 0.5816
 epoch: 91, train_loss: 0.3113, test_loss: 1.8556, test_f1: 0.6059
 epoch: 92, train_loss: 0.3022, test_loss: 1.9880, test_f1: 0.5914
 epoch: 93, train_loss: 0.2925, test_loss: 2.1761, test_f1: 0.5936
 epoch: 94, train_loss: 0.2947, test_loss: 2.2985, test_f1: 0.5884
 epoch: 95, train_loss: 0.2715, test_loss: 2.1877, test_f1: 0.5972
 epoch: 96, train_loss: 0.3063, test_loss: 2.2875, test_f1: 0.5780
 epoch: 97, train_loss: 0.3169, test_loss: 2.2357, test_f1: 0.5716
 epoch: 98, train_loss: 0.3110, test_loss: 2.1642, test_f1: 0.6003
 epoch: 99, train_loss: 0.2913, test_loss: 2.1609, test_f1: 0.5940
##################ITERATION #3 ****************************************
 epoch: 0, train_loss: 1.2209, test_loss: 1.3004, test_f1: 0.1365
 epoch: 1, train_loss: 1.0372, test_loss: 1.2926, test_f1: 0.1371
 epoch: 2, train_loss: 1.0026, test_loss: 1.2256, test_f1: 0.2752
 epoch: 3, train_loss: 0.9770, test_loss: 1.1826, test_f1: 0.4118
 epoch: 4, train_loss: 0.9159, test_loss: 1.1666, test_f1: 0.3830
 epoch: 5, train_loss: 0.8996, test_loss: 1.1413, test_f1: 0.3783
 epoch: 6, train_loss: 0.8795, test_loss: 1.1118, test_f1: 0.4605
 epoch: 7, train_loss: 0.8562, test_loss: 1.1144, test_f1: 0.4984
 epoch: 8, train_loss: 0.8553, test_loss: 1.0865, test_f1: 0.5255
 epoch: 9, train_loss: 0.8337, test_loss: 1.1094, test_f1: 0.5715
 epoch: 10, train_loss: 0.7973, test_loss: 1.1193, test_f1: 0.5643
 epoch: 11, train_loss: 0.8018, test_loss: 1.0994, test_f1: 0.6012
 epoch: 12, train_loss: 0.7945, test_loss: 1.0615, test_f1: 0.5836
 epoch: 13, train_loss: 0.7923, test_loss: 1.1233, test_f1: 0.5728
 epoch: 14, train_loss: 0.7678, test_loss: 1.0638, test_f1: 0.6032
 epoch: 15, train_loss: 0.7569, test_loss: 1.0705, test_f1: 0.5787
 epoch: 16, train_loss: 0.7394, test_loss: 1.0454, test_f1: 0.5850
 epoch: 17, train_loss: 0.7317, test_loss: 1.1311, test_f1: 0.5554
 epoch: 18, train_loss: 0.7152, test_loss: 1.1222, test_f1: 0.6107
 epoch: 19, train_loss: 0.7133, test_loss: 1.2634, test_f1: 0.5657
 epoch: 20, train_loss: 0.7263, test_loss: 1.1504, test_f1: 0.5945
 epoch: 21, train_loss: 0.7091, test_loss: 1.3115, test_f1: 0.5279
 epoch: 22, train_loss: 0.6736, test_loss: 1.1223, test_f1: 0.5809
 epoch: 23, train_loss: 0.6702, test_loss: 1.0823, test_f1: 0.5889
 epoch: 24, train_loss: 0.6676, test_loss: 1.0693, test_f1: 0.6021
 epoch: 25, train_loss: 0.6465, test_loss: 0.9932, test_f1: 0.6374
 epoch: 26, train_loss: 0.6560, test_loss: 1.1013, test_f1: 0.5866
 epoch: 27, train_loss: 0.6680, test_loss: 1.0843, test_f1: 0.5698
 epoch: 28, train_loss: 0.6572, test_loss: 1.0831, test_f1: 0.6199
 epoch: 29, train_loss: 0.6358, test_loss: 1.1164, test_f1: 0.5920
 epoch: 30, train_loss: 0.6406, test_loss: 1.1717, test_f1: 0.5902
 epoch: 31, train_loss: 0.6466, test_loss: 1.1507, test_f1: 0.5505
 epoch: 32, train_loss: 0.6239, test_loss: 1.1546, test_f1: 0.6009
 epoch: 33, train_loss: 0.6264, test_loss: 1.1575, test_f1: 0.5760
 epoch: 34, train_loss: 0.6130, test_loss: 1.1283, test_f1: 0.5690
 epoch: 35, train_loss: 0.5928, test_loss: 1.1623, test_f1: 0.5891
 epoch: 36, train_loss: 0.5686, test_loss: 1.1535, test_f1: 0.6116
 epoch: 37, train_loss: 0.5555, test_loss: 1.1431, test_f1: 0.6007
 epoch: 38, train_loss: 0.5757, test_loss: 1.1936, test_f1: 0.5764
 epoch: 39, train_loss: 0.5661, test_loss: 1.2631, test_f1: 0.6066
 epoch: 40, train_loss: 0.5609, test_loss: 1.2067, test_f1: 0.6137
 epoch: 41, train_loss: 0.5474, test_loss: 1.1618, test_f1: 0.6130
 epoch: 42, train_loss: 0.5559, test_loss: 1.4345, test_f1: 0.5805
 epoch: 43, train_loss: 0.5808, test_loss: 1.3521, test_f1: 0.5616
 epoch: 44, train_loss: 0.5525, test_loss: 1.2556, test_f1: 0.6129
 epoch: 45, train_loss: 0.5236, test_loss: 1.2758, test_f1: 0.6140
 epoch: 46, train_loss: 0.5165, test_loss: 1.2225, test_f1: 0.5754
 epoch: 47, train_loss: 0.5300, test_loss: 1.2140, test_f1: 0.5698
 epoch: 48, train_loss: 0.5144, test_loss: 1.1883, test_f1: 0.6255
 epoch: 49, train_loss: 0.4795, test_loss: 1.2131, test_f1: 0.5556
 epoch: 50, train_loss: 0.4702, test_loss: 1.2568, test_f1: 0.6093
 epoch: 51, train_loss: 0.4767, test_loss: 1.2699, test_f1: 0.5976
 epoch: 52, train_loss: 0.4470, test_loss: 1.3096, test_f1: 0.6440
 epoch: 53, train_loss: 0.4454, test_loss: 1.3170, test_f1: 0.6192
 epoch: 54, train_loss: 0.4303, test_loss: 1.3563, test_f1: 0.5821
 epoch: 55, train_loss: 0.4234, test_loss: 1.2666, test_f1: 0.5712
 epoch: 56, train_loss: 0.4378, test_loss: 1.3388, test_f1: 0.6275
 epoch: 57, train_loss: 0.4270, test_loss: 1.4707, test_f1: 0.6195
 epoch: 58, train_loss: 0.4376, test_loss: 1.4104, test_f1: 0.6229
 epoch: 59, train_loss: 0.4284, test_loss: 1.4651, test_f1: 0.5762
 epoch: 60, train_loss: 0.4232, test_loss: 1.3675, test_f1: 0.6035
 epoch: 61, train_loss: 0.4342, test_loss: 1.3031, test_f1: 0.6058
 epoch: 62, train_loss: 0.4223, test_loss: 1.3855, test_f1: 0.5730
 epoch: 63, train_loss: 0.4170, test_loss: 1.4651, test_f1: 0.5979
 epoch: 64, train_loss: 0.4074, test_loss: 1.3843, test_f1: 0.6130
 epoch: 65, train_loss: 0.3921, test_loss: 1.3569, test_f1: 0.5750
 epoch: 66, train_loss: 0.3896, test_loss: 1.3673, test_f1: 0.5814
 epoch: 67, train_loss: 0.3565, test_loss: 1.4041, test_f1: 0.5871
 epoch: 68, train_loss: 0.3656, test_loss: 1.4859, test_f1: 0.5780
 epoch: 69, train_loss: 0.3702, test_loss: 1.5105, test_f1: 0.6051
 epoch: 70, train_loss: 0.3679, test_loss: 1.5315, test_f1: 0.6252
 epoch: 71, train_loss: 0.3476, test_loss: 1.4473, test_f1: 0.6088
 epoch: 72, train_loss: 0.3503, test_loss: 1.4617, test_f1: 0.5964
 epoch: 73, train_loss: 0.3440, test_loss: 1.4774, test_f1: 0.6180
 epoch: 74, train_loss: 0.3525, test_loss: 1.5365, test_f1: 0.6127
 epoch: 75, train_loss: 0.3425, test_loss: 1.5239, test_f1: 0.6097
 epoch: 76, train_loss: 0.3455, test_loss: 1.5779, test_f1: 0.5897
 epoch: 77, train_loss: 0.3349, test_loss: 1.5504, test_f1: 0.6181
 epoch: 78, train_loss: 0.3149, test_loss: 1.6706, test_f1: 0.6145
 epoch: 79, train_loss: 0.3172, test_loss: 1.5740, test_f1: 0.6180
 epoch: 80, train_loss: 0.3496, test_loss: 1.7072, test_f1: 0.6137
 epoch: 81, train_loss: 0.3329, test_loss: 1.6989, test_f1: 0.5849
 epoch: 82, train_loss: 0.3167, test_loss: 1.7185, test_f1: 0.5849
 epoch: 83, train_loss: 0.3261, test_loss: 1.6208, test_f1: 0.6169
 epoch: 84, train_loss: 0.3194, test_loss: 1.6476, test_f1: 0.6242
 epoch: 85, train_loss: 0.3067, test_loss: 1.6422, test_f1: 0.6097
 epoch: 86, train_loss: 0.3315, test_loss: 1.6322, test_f1: 0.6294
 epoch: 87, train_loss: 0.3242, test_loss: 1.5455, test_f1: 0.6053
 epoch: 88, train_loss: 0.3092, test_loss: 1.7218, test_f1: 0.6159
 epoch: 89, train_loss: 0.3059, test_loss: 1.7108, test_f1: 0.6250
 epoch: 90, train_loss: 0.3251, test_loss: 1.7900, test_f1: 0.6144
 epoch: 91, train_loss: 0.3079, test_loss: 1.7141, test_f1: 0.5803
 epoch: 92, train_loss: 0.3159, test_loss: 1.6057, test_f1: 0.5912
 epoch: 93, train_loss: 0.2863, test_loss: 1.6088, test_f1: 0.5994
 epoch: 94, train_loss: 0.2913, test_loss: 1.8214, test_f1: 0.6227
 epoch: 95, train_loss: 0.2999, test_loss: 1.7754, test_f1: 0.6407
 epoch: 96, train_loss: 0.3086, test_loss: 1.8403, test_f1: 0.6396
 epoch: 97, train_loss: 0.3417, test_loss: 1.6773, test_f1: 0.6342
 epoch: 98, train_loss: 0.3538, test_loss: 1.6157, test_f1: 0.6404
 epoch: 99, train_loss: 0.3136, test_loss: 1.6644, test_f1: 0.6291
##################ITERATION #4 ****************************************
 epoch: 0, train_loss: 1.2577, test_loss: 1.3203, test_f1: 0.1365
 epoch: 1, train_loss: 1.0880, test_loss: 1.3338, test_f1: 0.1365
 epoch: 2, train_loss: 1.0128, test_loss: 1.2970, test_f1: 0.1371
 epoch: 3, train_loss: 0.9728, test_loss: 1.2538, test_f1: 0.2586
 epoch: 4, train_loss: 0.9517, test_loss: 1.1680, test_f1: 0.4256
 epoch: 5, train_loss: 0.9276, test_loss: 1.1489, test_f1: 0.3834
 epoch: 6, train_loss: 0.8814, test_loss: 1.1108, test_f1: 0.3887
 epoch: 7, train_loss: 0.8718, test_loss: 1.0806, test_f1: 0.4476
 epoch: 8, train_loss: 0.8470, test_loss: 1.0787, test_f1: 0.4934
 epoch: 9, train_loss: 0.8295, test_loss: 1.0949, test_f1: 0.5598
 epoch: 10, train_loss: 0.8153, test_loss: 1.1277, test_f1: 0.5549
 epoch: 11, train_loss: 0.7955, test_loss: 1.0544, test_f1: 0.5802
 epoch: 12, train_loss: 0.7904, test_loss: 1.0851, test_f1: 0.5970
 epoch: 13, train_loss: 0.7770, test_loss: 1.0627, test_f1: 0.6236
 epoch: 14, train_loss: 0.7563, test_loss: 1.0492, test_f1: 0.5636
 epoch: 15, train_loss: 0.7493, test_loss: 1.0105, test_f1: 0.6252
 epoch: 16, train_loss: 0.7319, test_loss: 1.0520, test_f1: 0.6145
 epoch: 17, train_loss: 0.7498, test_loss: 1.1007, test_f1: 0.6006
 epoch: 18, train_loss: 0.7346, test_loss: 1.0827, test_f1: 0.5906
 epoch: 19, train_loss: 0.7172, test_loss: 1.0542, test_f1: 0.6211
 epoch: 20, train_loss: 0.6785, test_loss: 1.0695, test_f1: 0.6087
 epoch: 21, train_loss: 0.6793, test_loss: 1.0298, test_f1: 0.6446
 epoch: 22, train_loss: 0.6765, test_loss: 1.1111, test_f1: 0.6203
 epoch: 23, train_loss: 0.6419, test_loss: 1.1022, test_f1: 0.6162
 epoch: 24, train_loss: 0.6453, test_loss: 1.1003, test_f1: 0.5811
 epoch: 25, train_loss: 0.6796, test_loss: 1.2826, test_f1: 0.5840
 epoch: 26, train_loss: 0.6770, test_loss: 1.1514, test_f1: 0.6098
 epoch: 27, train_loss: 0.6377, test_loss: 1.0440, test_f1: 0.6062
 epoch: 28, train_loss: 0.6172, test_loss: 1.0583, test_f1: 0.6258
 epoch: 29, train_loss: 0.6017, test_loss: 1.0945, test_f1: 0.6255
 epoch: 30, train_loss: 0.6206, test_loss: 1.1465, test_f1: 0.6592
 epoch: 31, train_loss: 0.5960, test_loss: 1.1325, test_f1: 0.5968
 epoch: 32, train_loss: 0.5943, test_loss: 1.1608, test_f1: 0.6063
 epoch: 33, train_loss: 0.6129, test_loss: 1.2760, test_f1: 0.6025
 epoch: 34, train_loss: 0.6043, test_loss: 1.3052, test_f1: 0.6222
 epoch: 35, train_loss: 0.5722, test_loss: 1.3378, test_f1: 0.6128
 epoch: 36, train_loss: 0.5806, test_loss: 1.1501, test_f1: 0.6443
 epoch: 37, train_loss: 0.5822, test_loss: 1.1893, test_f1: 0.6565
 epoch: 38, train_loss: 0.5847, test_loss: 1.3362, test_f1: 0.5794
 epoch: 39, train_loss: 0.5561, test_loss: 1.3168, test_f1: 0.6330
 epoch: 40, train_loss: 0.5356, test_loss: 1.2098, test_f1: 0.6218
 epoch: 41, train_loss: 0.5502, test_loss: 1.2517, test_f1: 0.6121
 epoch: 42, train_loss: 0.5504, test_loss: 1.2124, test_f1: 0.6205
 epoch: 43, train_loss: 0.5552, test_loss: 1.2644, test_f1: 0.6107
 epoch: 44, train_loss: 0.5483, test_loss: 1.4697, test_f1: 0.6118
 epoch: 45, train_loss: 0.5582, test_loss: 1.2568, test_f1: 0.6301
 epoch: 46, train_loss: 0.5141, test_loss: 1.3465, test_f1: 0.5889
 epoch: 47, train_loss: 0.4909, test_loss: 1.3293, test_f1: 0.6234
 epoch: 48, train_loss: 0.5013, test_loss: 1.4516, test_f1: 0.5909
 epoch: 49, train_loss: 0.4577, test_loss: 1.5429, test_f1: 0.6087
 epoch: 50, train_loss: 0.4653, test_loss: 1.3193, test_f1: 0.6606
 epoch: 51, train_loss: 0.4666, test_loss: 1.2800, test_f1: 0.6228
 epoch: 52, train_loss: 0.4624, test_loss: 1.3240, test_f1: 0.6456
 epoch: 53, train_loss: 0.4575, test_loss: 1.4197, test_f1: 0.6501
 epoch: 54, train_loss: 0.4553, test_loss: 1.2880, test_f1: 0.6379
 epoch: 55, train_loss: 0.4492, test_loss: 1.4155, test_f1: 0.6454
 epoch: 56, train_loss: 0.4259, test_loss: 1.4123, test_f1: 0.6127
 epoch: 57, train_loss: 0.4289, test_loss: 1.3261, test_f1: 0.6313
 epoch: 58, train_loss: 0.4205, test_loss: 1.4043, test_f1: 0.6247
 epoch: 59, train_loss: 0.4130, test_loss: 1.4222, test_f1: 0.6382
 epoch: 60, train_loss: 0.4039, test_loss: 1.4174, test_f1: 0.6404
 epoch: 61, train_loss: 0.3960, test_loss: 1.4535, test_f1: 0.6522
 epoch: 62, train_loss: 0.3735, test_loss: 1.4282, test_f1: 0.6484
 epoch: 63, train_loss: 0.3920, test_loss: 1.4063, test_f1: 0.6496
 epoch: 64, train_loss: 0.3911, test_loss: 1.3915, test_f1: 0.6455
 epoch: 65, train_loss: 0.3795, test_loss: 1.4377, test_f1: 0.6464
 epoch: 66, train_loss: 0.3809, test_loss: 1.4812, test_f1: 0.6413
 epoch: 67, train_loss: 0.3825, test_loss: 1.4648, test_f1: 0.6426
 epoch: 68, train_loss: 0.3690, test_loss: 1.5557, test_f1: 0.6573
 epoch: 69, train_loss: 0.3828, test_loss: 1.5656, test_f1: 0.6357
 epoch: 70, train_loss: 0.3874, test_loss: 1.6321, test_f1: 0.6658
 epoch: 71, train_loss: 0.3913, test_loss: 1.5149, test_f1: 0.6494
 epoch: 72, train_loss: 0.3779, test_loss: 1.5986, test_f1: 0.6294
 epoch: 73, train_loss: 0.3668, test_loss: 1.5163, test_f1: 0.6325
 epoch: 74, train_loss: 0.3709, test_loss: 1.5213, test_f1: 0.6250
 epoch: 75, train_loss: 0.3569, test_loss: 1.6100, test_f1: 0.6263
 epoch: 76, train_loss: 0.3423, test_loss: 1.5473, test_f1: 0.6418
 epoch: 77, train_loss: 0.3524, test_loss: 1.5179, test_f1: 0.6264
 epoch: 78, train_loss: 0.3468, test_loss: 1.5682, test_f1: 0.6213
 epoch: 79, train_loss: 0.3364, test_loss: 1.7136, test_f1: 0.6297
 epoch: 80, train_loss: 0.3194, test_loss: 1.6985, test_f1: 0.6504
 epoch: 81, train_loss: 0.3219, test_loss: 1.6462, test_f1: 0.6412
 epoch: 82, train_loss: 0.3437, test_loss: 1.6324, test_f1: 0.6530
 epoch: 83, train_loss: 0.3276, test_loss: 1.6805, test_f1: 0.6450
 epoch: 84, train_loss: 0.2974, test_loss: 1.7670, test_f1: 0.6455
 epoch: 85, train_loss: 0.3077, test_loss: 1.7482, test_f1: 0.6306
 epoch: 86, train_loss: 0.2925, test_loss: 1.6915, test_f1: 0.6434
 epoch: 87, train_loss: 0.3013, test_loss: 1.7721, test_f1: 0.6186
 epoch: 88, train_loss: 0.3031, test_loss: 1.8003, test_f1: 0.6324
 epoch: 89, train_loss: 0.3410, test_loss: 1.6500, test_f1: 0.6283
 epoch: 90, train_loss: 0.3162, test_loss: 1.8311, test_f1: 0.6229
 epoch: 91, train_loss: 0.3187, test_loss: 1.8736, test_f1: 0.6226
 epoch: 92, train_loss: 0.2814, test_loss: 1.8619, test_f1: 0.6459
 epoch: 93, train_loss: 0.2692, test_loss: 1.8731, test_f1: 0.6455
 epoch: 94, train_loss: 0.2958, test_loss: 1.8584, test_f1: 0.6203
 epoch: 95, train_loss: 0.3051, test_loss: 1.8068, test_f1: 0.6114
 epoch: 96, train_loss: 0.3162, test_loss: 1.9894, test_f1: 0.6407
 epoch: 97, train_loss: 0.3244, test_loss: 2.0157, test_f1: 0.6202
 epoch: 98, train_loss: 0.3053, test_loss: 1.8783, test_f1: 0.6361
 epoch: 99, train_loss: 0.2948, test_loss: 1.8218, test_f1: 0.6270
##################ITERATION #5 ****************************************
 epoch: 0, train_loss: 1.2966, test_loss: 1.3393, test_f1: 0.1365
 epoch: 1, train_loss: 1.0678, test_loss: 1.2778, test_f1: 0.1424
 epoch: 2, train_loss: 1.0383, test_loss: 1.2357, test_f1: 0.4563
 epoch: 3, train_loss: 0.9684, test_loss: 1.1869, test_f1: 0.4902
 epoch: 4, train_loss: 0.9517, test_loss: 1.1206, test_f1: 0.5036
 epoch: 5, train_loss: 0.9281, test_loss: 1.1039, test_f1: 0.4938
 epoch: 6, train_loss: 0.8918, test_loss: 1.0358, test_f1: 0.5468
 epoch: 7, train_loss: 0.8705, test_loss: 1.0213, test_f1: 0.5467
 epoch: 8, train_loss: 0.8485, test_loss: 1.0415, test_f1: 0.5110
 epoch: 9, train_loss: 0.8261, test_loss: 1.0191, test_f1: 0.5708
 epoch: 10, train_loss: 0.8372, test_loss: 1.0325, test_f1: 0.5670
 epoch: 11, train_loss: 0.8058, test_loss: 1.0854, test_f1: 0.5619
 epoch: 12, train_loss: 0.7960, test_loss: 1.1018, test_f1: 0.5500
 epoch: 13, train_loss: 0.7765, test_loss: 1.1257, test_f1: 0.5607
 epoch: 14, train_loss: 0.7801, test_loss: 1.1173, test_f1: 0.5880
 epoch: 15, train_loss: 0.7549, test_loss: 1.1013, test_f1: 0.5877
 epoch: 16, train_loss: 0.7421, test_loss: 1.0822, test_f1: 0.5834
 epoch: 17, train_loss: 0.7440, test_loss: 1.1070, test_f1: 0.5698
 epoch: 18, train_loss: 0.7242, test_loss: 1.2422, test_f1: 0.5135
 epoch: 19, train_loss: 0.7210, test_loss: 1.1657, test_f1: 0.5842
 epoch: 20, train_loss: 0.7428, test_loss: 1.1673, test_f1: 0.5271
 epoch: 21, train_loss: 0.7440, test_loss: 1.1228, test_f1: 0.5684
 epoch: 22, train_loss: 0.7143, test_loss: 1.1327, test_f1: 0.5808
 epoch: 23, train_loss: 0.6921, test_loss: 1.0932, test_f1: 0.5932
 epoch: 24, train_loss: 0.6852, test_loss: 1.1517, test_f1: 0.5870
 epoch: 25, train_loss: 0.6874, test_loss: 1.1318, test_f1: 0.6101
 epoch: 26, train_loss: 0.6515, test_loss: 1.1743, test_f1: 0.5896
 epoch: 27, train_loss: 0.6484, test_loss: 1.2277, test_f1: 0.5692
 epoch: 28, train_loss: 0.6327, test_loss: 1.2132, test_f1: 0.5629
 epoch: 29, train_loss: 0.6239, test_loss: 1.2601, test_f1: 0.6141
 epoch: 30, train_loss: 0.6265, test_loss: 1.3604, test_f1: 0.5407
 epoch: 31, train_loss: 0.6231, test_loss: 1.3629, test_f1: 0.5396
 epoch: 32, train_loss: 0.6521, test_loss: 1.3186, test_f1: 0.5380
 epoch: 33, train_loss: 0.5927, test_loss: 1.2124, test_f1: 0.5824
 epoch: 34, train_loss: 0.5829, test_loss: 1.2119, test_f1: 0.5864
 epoch: 35, train_loss: 0.5832, test_loss: 1.3188, test_f1: 0.5788
 epoch: 36, train_loss: 0.5823, test_loss: 1.5672, test_f1: 0.5659
 epoch: 37, train_loss: 0.5747, test_loss: 1.4036, test_f1: 0.5419
 epoch: 38, train_loss: 0.5789, test_loss: 1.3436, test_f1: 0.5833
 epoch: 39, train_loss: 0.5615, test_loss: 1.4355, test_f1: 0.5481
 epoch: 40, train_loss: 0.5395, test_loss: 1.4845, test_f1: 0.5351
 epoch: 41, train_loss: 0.5557, test_loss: 1.5537, test_f1: 0.5393
 epoch: 42, train_loss: 0.5650, test_loss: 1.3072, test_f1: 0.5826
 epoch: 43, train_loss: 0.5619, test_loss: 1.4898, test_f1: 0.5498
 epoch: 44, train_loss: 0.5411, test_loss: 1.2847, test_f1: 0.5906
 epoch: 45, train_loss: 0.5236, test_loss: 1.2558, test_f1: 0.5717
 epoch: 46, train_loss: 0.5087, test_loss: 1.5092, test_f1: 0.5158
 epoch: 47, train_loss: 0.5220, test_loss: 1.5480, test_f1: 0.5666
 epoch: 48, train_loss: 0.5237, test_loss: 1.3601, test_f1: 0.5921
 epoch: 49, train_loss: 0.5087, test_loss: 1.3986, test_f1: 0.5797
 epoch: 50, train_loss: 0.4990, test_loss: 1.4813, test_f1: 0.5823
 epoch: 51, train_loss: 0.4952, test_loss: 1.3578, test_f1: 0.6094
 epoch: 52, train_loss: 0.4639, test_loss: 1.4152, test_f1: 0.5637
 epoch: 53, train_loss: 0.4711, test_loss: 1.4460, test_f1: 0.6016
 epoch: 54, train_loss: 0.4536, test_loss: 1.4326, test_f1: 0.5683
 epoch: 55, train_loss: 0.4530, test_loss: 1.4833, test_f1: 0.6156
 epoch: 56, train_loss: 0.4654, test_loss: 1.5084, test_f1: 0.6007
 epoch: 57, train_loss: 0.4443, test_loss: 1.4997, test_f1: 0.5789
 epoch: 58, train_loss: 0.4274, test_loss: 1.6405, test_f1: 0.5604
 epoch: 59, train_loss: 0.4445, test_loss: 1.5289, test_f1: 0.6206
 epoch: 60, train_loss: 0.4339, test_loss: 1.5265, test_f1: 0.6101
 epoch: 61, train_loss: 0.4257, test_loss: 1.5303, test_f1: 0.6167
 epoch: 62, train_loss: 0.4143, test_loss: 1.4880, test_f1: 0.6216
 epoch: 63, train_loss: 0.4024, test_loss: 1.6106, test_f1: 0.5766
 epoch: 64, train_loss: 0.4047, test_loss: 1.6604, test_f1: 0.5399
 epoch: 65, train_loss: 0.4150, test_loss: 1.5775, test_f1: 0.5566
 epoch: 66, train_loss: 0.3939, test_loss: 1.5126, test_f1: 0.6131
 epoch: 67, train_loss: 0.3892, test_loss: 1.5455, test_f1: 0.5909
 epoch: 68, train_loss: 0.3873, test_loss: 1.6157, test_f1: 0.5656
 epoch: 69, train_loss: 0.4109, test_loss: 1.7247, test_f1: 0.5625
 epoch: 70, train_loss: 0.3902, test_loss: 1.5604, test_f1: 0.5932
 epoch: 71, train_loss: 0.3798, test_loss: 1.6468, test_f1: 0.5632
 epoch: 72, train_loss: 0.3780, test_loss: 1.7126, test_f1: 0.5848
 epoch: 73, train_loss: 0.3886, test_loss: 1.5706, test_f1: 0.5774
 epoch: 74, train_loss: 0.3764, test_loss: 1.6047, test_f1: 0.5649
 epoch: 75, train_loss: 0.4015, test_loss: 1.7107, test_f1: 0.6142
 epoch: 76, train_loss: 0.3626, test_loss: 1.7473, test_f1: 0.5880
 epoch: 77, train_loss: 0.3829, test_loss: 1.7877, test_f1: 0.5600
 epoch: 78, train_loss: 0.3533, test_loss: 1.8403, test_f1: 0.5976
 epoch: 79, train_loss: 0.3600, test_loss: 1.7722, test_f1: 0.5978
 epoch: 80, train_loss: 0.3234, test_loss: 1.8061, test_f1: 0.5906
 epoch: 81, train_loss: 0.3359, test_loss: 1.7467, test_f1: 0.6114
 epoch: 82, train_loss: 0.3235, test_loss: 1.7149, test_f1: 0.5800
 epoch: 83, train_loss: 0.3176, test_loss: 1.8474, test_f1: 0.5771
 epoch: 84, train_loss: 0.3246, test_loss: 1.8848, test_f1: 0.5590
 epoch: 85, train_loss: 0.3241, test_loss: 1.7465, test_f1: 0.5824
 epoch: 86, train_loss: 0.3345, test_loss: 1.7947, test_f1: 0.5708
 epoch: 87, train_loss: 0.3210, test_loss: 1.7683, test_f1: 0.5942
 epoch: 88, train_loss: 0.3226, test_loss: 1.8698, test_f1: 0.5837
 epoch: 89, train_loss: 0.3133, test_loss: 1.8922, test_f1: 0.5887
 epoch: 90, train_loss: 0.3118, test_loss: 1.9726, test_f1: 0.5896
 epoch: 91, train_loss: 0.3097, test_loss: 1.8681, test_f1: 0.6172
 epoch: 92, train_loss: 0.3049, test_loss: 1.8628, test_f1: 0.6011
 epoch: 93, train_loss: 0.3022, test_loss: 1.8761, test_f1: 0.5698
 epoch: 94, train_loss: 0.3133, test_loss: 1.9983, test_f1: 0.5592
 epoch: 95, train_loss: 0.3168, test_loss: 2.0721, test_f1: 0.5993
 epoch: 96, train_loss: 0.3117, test_loss: 1.8295, test_f1: 0.6040
 epoch: 97, train_loss: 0.3056, test_loss: 1.9902, test_f1: 0.5809
 epoch: 98, train_loss: 0.3232, test_loss: 1.8570, test_f1: 0.5869
 epoch: 99, train_loss: 0.3107, test_loss: 1.9142, test_f1: 0.6079
##################ITERATION #6 ****************************************
 epoch: 0, train_loss: 1.4278, test_loss: 1.3679, test_f1: 0.1365
 epoch: 1, train_loss: 1.0852, test_loss: 1.3149, test_f1: 0.1405
 epoch: 2, train_loss: 1.0219, test_loss: 1.2551, test_f1: 0.2958
 epoch: 3, train_loss: 0.9699, test_loss: 1.1643, test_f1: 0.4195
 epoch: 4, train_loss: 0.9444, test_loss: 1.1136, test_f1: 0.4631
 epoch: 5, train_loss: 0.9235, test_loss: 1.0856, test_f1: 0.5158
 epoch: 6, train_loss: 0.9130, test_loss: 1.0770, test_f1: 0.5178
 epoch: 7, train_loss: 0.8947, test_loss: 1.0733, test_f1: 0.5123
 epoch: 8, train_loss: 0.8896, test_loss: 1.0776, test_f1: 0.5190
 epoch: 9, train_loss: 0.8776, test_loss: 1.0414, test_f1: 0.5459
 epoch: 10, train_loss: 0.8468, test_loss: 1.0155, test_f1: 0.5908
 epoch: 11, train_loss: 0.8459, test_loss: 1.0441, test_f1: 0.5440
 epoch: 12, train_loss: 0.8076, test_loss: 1.1137, test_f1: 0.5448
 epoch: 13, train_loss: 0.8376, test_loss: 1.0749, test_f1: 0.5628
 epoch: 14, train_loss: 0.8117, test_loss: 1.1000, test_f1: 0.5283
 epoch: 15, train_loss: 0.7988, test_loss: 1.0757, test_f1: 0.5389
 epoch: 16, train_loss: 0.7829, test_loss: 1.0625, test_f1: 0.5483
 epoch: 17, train_loss: 0.7791, test_loss: 1.0272, test_f1: 0.5725
 epoch: 18, train_loss: 0.7605, test_loss: 1.0803, test_f1: 0.5860
 epoch: 19, train_loss: 0.7557, test_loss: 1.0823, test_f1: 0.5843
 epoch: 20, train_loss: 0.7372, test_loss: 1.1256, test_f1: 0.5996
 epoch: 21, train_loss: 0.7419, test_loss: 1.1025, test_f1: 0.6045
 epoch: 22, train_loss: 0.7136, test_loss: 1.1307, test_f1: 0.6086
 epoch: 23, train_loss: 0.7040, test_loss: 1.0920, test_f1: 0.5735
 epoch: 24, train_loss: 0.6980, test_loss: 1.0894, test_f1: 0.5847
 epoch: 25, train_loss: 0.6900, test_loss: 1.1273, test_f1: 0.5350
 epoch: 26, train_loss: 0.7061, test_loss: 1.1456, test_f1: 0.5399
 epoch: 27, train_loss: 0.6746, test_loss: 1.0163, test_f1: 0.6141
 epoch: 28, train_loss: 0.6646, test_loss: 1.0709, test_f1: 0.6183
 epoch: 29, train_loss: 0.6648, test_loss: 1.1066, test_f1: 0.6173
 epoch: 30, train_loss: 0.6574, test_loss: 1.1229, test_f1: 0.6048
 epoch: 31, train_loss: 0.6731, test_loss: 1.2160, test_f1: 0.5452
 epoch: 32, train_loss: 0.6619, test_loss: 1.1792, test_f1: 0.5397
 epoch: 33, train_loss: 0.6469, test_loss: 1.1292, test_f1: 0.5838
 epoch: 34, train_loss: 0.6506, test_loss: 1.1337, test_f1: 0.5699
 epoch: 35, train_loss: 0.6434, test_loss: 1.0544, test_f1: 0.6213
 epoch: 36, train_loss: 0.6388, test_loss: 1.1065, test_f1: 0.6249
 epoch: 37, train_loss: 0.5910, test_loss: 1.1609, test_f1: 0.6317
 epoch: 38, train_loss: 0.5893, test_loss: 1.2068, test_f1: 0.6190
 epoch: 39, train_loss: 0.5916, test_loss: 1.2013, test_f1: 0.6383
 epoch: 40, train_loss: 0.5818, test_loss: 1.3155, test_f1: 0.6044
 epoch: 41, train_loss: 0.5629, test_loss: 1.2035, test_f1: 0.6178
 epoch: 42, train_loss: 0.5904, test_loss: 1.1464, test_f1: 0.6302
 epoch: 43, train_loss: 0.5844, test_loss: 1.3225, test_f1: 0.6019
 epoch: 44, train_loss: 0.5588, test_loss: 1.3757, test_f1: 0.6081
 epoch: 45, train_loss: 0.5587, test_loss: 1.2604, test_f1: 0.6169
 epoch: 46, train_loss: 0.5432, test_loss: 1.3690, test_f1: 0.5774
 epoch: 47, train_loss: 0.5328, test_loss: 1.3266, test_f1: 0.6031
 epoch: 48, train_loss: 0.5163, test_loss: 1.2582, test_f1: 0.6327
 epoch: 49, train_loss: 0.5817, test_loss: 1.1836, test_f1: 0.6195
 epoch: 50, train_loss: 0.5654, test_loss: 1.4382, test_f1: 0.5516
 epoch: 51, train_loss: 0.5416, test_loss: 1.2504, test_f1: 0.6146
 epoch: 52, train_loss: 0.5056, test_loss: 1.2243, test_f1: 0.6012
 epoch: 53, train_loss: 0.5068, test_loss: 1.2972, test_f1: 0.5972
 epoch: 54, train_loss: 0.4925, test_loss: 1.3198, test_f1: 0.6059
 epoch: 55, train_loss: 0.4760, test_loss: 1.3018, test_f1: 0.5979
 epoch: 56, train_loss: 0.4639, test_loss: 1.2626, test_f1: 0.6178
 epoch: 57, train_loss: 0.4580, test_loss: 1.2106, test_f1: 0.6564
 epoch: 58, train_loss: 0.4416, test_loss: 1.2658, test_f1: 0.6107
 epoch: 59, train_loss: 0.4440, test_loss: 1.2888, test_f1: 0.6325
 epoch: 60, train_loss: 0.4304, test_loss: 1.2991, test_f1: 0.6133
 epoch: 61, train_loss: 0.4340, test_loss: 1.3413, test_f1: 0.5945
 epoch: 62, train_loss: 0.4199, test_loss: 1.2982, test_f1: 0.6030
 epoch: 63, train_loss: 0.4192, test_loss: 1.4067, test_f1: 0.5990
 epoch: 64, train_loss: 0.4611, test_loss: 1.2655, test_f1: 0.6231
 epoch: 65, train_loss: 0.4142, test_loss: 1.3760, test_f1: 0.6600
 epoch: 66, train_loss: 0.4172, test_loss: 1.3090, test_f1: 0.6409
 epoch: 67, train_loss: 0.4140, test_loss: 1.3109, test_f1: 0.6323
 epoch: 68, train_loss: 0.4090, test_loss: 1.2831, test_f1: 0.6297
 epoch: 69, train_loss: 0.4132, test_loss: 1.4758, test_f1: 0.6166
 epoch: 70, train_loss: 0.4166, test_loss: 1.4290, test_f1: 0.6315
 epoch: 71, train_loss: 0.4069, test_loss: 1.5438, test_f1: 0.6099
 epoch: 72, train_loss: 0.3962, test_loss: 1.4957, test_f1: 0.6144
 epoch: 73, train_loss: 0.4038, test_loss: 1.3509, test_f1: 0.5948
 epoch: 74, train_loss: 0.3768, test_loss: 1.4730, test_f1: 0.5693
 epoch: 75, train_loss: 0.3786, test_loss: 1.3941, test_f1: 0.5953
 epoch: 76, train_loss: 0.3734, test_loss: 1.4854, test_f1: 0.6145
 epoch: 77, train_loss: 0.3407, test_loss: 1.5540, test_f1: 0.6237
 epoch: 78, train_loss: 0.3680, test_loss: 1.6140, test_f1: 0.6293
 epoch: 79, train_loss: 0.3720, test_loss: 1.6129, test_f1: 0.5976
 epoch: 80, train_loss: 0.3622, test_loss: 1.4303, test_f1: 0.6266
 epoch: 81, train_loss: 0.3725, test_loss: 1.4473, test_f1: 0.6601
 epoch: 82, train_loss: 0.3914, test_loss: 1.4047, test_f1: 0.6307
 epoch: 83, train_loss: 0.3562, test_loss: 1.4664, test_f1: 0.6224
 epoch: 84, train_loss: 0.3741, test_loss: 1.6602, test_f1: 0.5913
 epoch: 85, train_loss: 0.3362, test_loss: 1.6399, test_f1: 0.5969
 epoch: 86, train_loss: 0.3372, test_loss: 1.4876, test_f1: 0.6256
 epoch: 87, train_loss: 0.3662, test_loss: 1.5682, test_f1: 0.6309
 epoch: 88, train_loss: 0.3555, test_loss: 1.5625, test_f1: 0.6422
 epoch: 89, train_loss: 0.3538, test_loss: 1.6943, test_f1: 0.6528
 epoch: 90, train_loss: 0.3449, test_loss: 1.7159, test_f1: 0.6748
 epoch: 91, train_loss: 0.3437, test_loss: 1.5792, test_f1: 0.6279
 epoch: 92, train_loss: 0.3638, test_loss: 1.7966, test_f1: 0.6122
 epoch: 93, train_loss: 0.3340, test_loss: 1.5661, test_f1: 0.6106
 epoch: 94, train_loss: 0.3548, test_loss: 1.7040, test_f1: 0.6218
 epoch: 95, train_loss: 0.3247, test_loss: 1.5709, test_f1: 0.6152
 epoch: 96, train_loss: 0.3291, test_loss: 1.5291, test_f1: 0.6245
 epoch: 97, train_loss: 0.3305, test_loss: 1.6425, test_f1: 0.6303
 epoch: 98, train_loss: 0.3189, test_loss: 1.6664, test_f1: 0.6211
 epoch: 99, train_loss: 0.3317, test_loss: 1.7163, test_f1: 0.6291
##################ITERATION #7 ****************************************
 epoch: 0, train_loss: 1.3084, test_loss: 1.4805, test_f1: 0.1365
 epoch: 1, train_loss: 1.0997, test_loss: 1.3623, test_f1: 0.1399
 epoch: 2, train_loss: 1.0256, test_loss: 1.3396, test_f1: 0.1425
 epoch: 3, train_loss: 1.0176, test_loss: 1.2830, test_f1: 0.2047
 epoch: 4, train_loss: 0.9763, test_loss: 1.2438, test_f1: 0.2936
 epoch: 5, train_loss: 0.9378, test_loss: 1.2021, test_f1: 0.3219
 epoch: 6, train_loss: 0.9171, test_loss: 1.1384, test_f1: 0.3936
 epoch: 7, train_loss: 0.9004, test_loss: 1.0859, test_f1: 0.4662
 epoch: 8, train_loss: 0.8890, test_loss: 1.0682, test_f1: 0.5519
 epoch: 9, train_loss: 0.8497, test_loss: 1.1196, test_f1: 0.5438
 epoch: 10, train_loss: 0.8437, test_loss: 1.0999, test_f1: 0.5297
 epoch: 11, train_loss: 0.8275, test_loss: 1.0891, test_f1: 0.5562
 epoch: 12, train_loss: 0.8137, test_loss: 1.0833, test_f1: 0.5505
 epoch: 13, train_loss: 0.8142, test_loss: 1.0577, test_f1: 0.5385
 epoch: 14, train_loss: 0.7867, test_loss: 1.0895, test_f1: 0.6134
 epoch: 15, train_loss: 0.7557, test_loss: 1.0472, test_f1: 0.6267
 epoch: 16, train_loss: 0.7604, test_loss: 1.0843, test_f1: 0.6173
 epoch: 17, train_loss: 0.7306, test_loss: 1.1357, test_f1: 0.5818
 epoch: 18, train_loss: 0.7467, test_loss: 1.0948, test_f1: 0.6237
 epoch: 19, train_loss: 0.7278, test_loss: 1.0884, test_f1: 0.6307
 epoch: 20, train_loss: 0.7215, test_loss: 1.1825, test_f1: 0.5869
 epoch: 21, train_loss: 0.7127, test_loss: 1.2938, test_f1: 0.5701
 epoch: 22, train_loss: 0.7310, test_loss: 1.2442, test_f1: 0.5417
 epoch: 23, train_loss: 0.7061, test_loss: 1.2209, test_f1: 0.6220
 epoch: 24, train_loss: 0.7085, test_loss: 1.2404, test_f1: 0.5876
 epoch: 25, train_loss: 0.6747, test_loss: 1.1715, test_f1: 0.5860
 epoch: 26, train_loss: 0.6629, test_loss: 1.1559, test_f1: 0.6046
 epoch: 27, train_loss: 0.6544, test_loss: 1.2089, test_f1: 0.6285
 epoch: 28, train_loss: 0.6521, test_loss: 1.3296, test_f1: 0.5525
 epoch: 29, train_loss: 0.6401, test_loss: 1.2388, test_f1: 0.5817
 epoch: 30, train_loss: 0.6268, test_loss: 1.2218, test_f1: 0.5822
 epoch: 31, train_loss: 0.6385, test_loss: 1.1968, test_f1: 0.5964
 epoch: 32, train_loss: 0.6163, test_loss: 1.2090, test_f1: 0.6402
 epoch: 33, train_loss: 0.6342, test_loss: 1.2717, test_f1: 0.5837
 epoch: 34, train_loss: 0.6204, test_loss: 1.2528, test_f1: 0.6223
 epoch: 35, train_loss: 0.6118, test_loss: 1.2827, test_f1: 0.5797
 epoch: 36, train_loss: 0.5757, test_loss: 1.2359, test_f1: 0.6300
 epoch: 37, train_loss: 0.5730, test_loss: 1.2852, test_f1: 0.5575
 epoch: 38, train_loss: 0.5797, test_loss: 1.1910, test_f1: 0.6485
 epoch: 39, train_loss: 0.5642, test_loss: 1.1625, test_f1: 0.6036
 epoch: 40, train_loss: 0.5724, test_loss: 1.1951, test_f1: 0.6404
 epoch: 41, train_loss: 0.5580, test_loss: 1.2488, test_f1: 0.6337
 epoch: 42, train_loss: 0.5394, test_loss: 1.4791, test_f1: 0.5999
 epoch: 43, train_loss: 0.5647, test_loss: 1.5282, test_f1: 0.5511
 epoch: 44, train_loss: 0.5606, test_loss: 1.4222, test_f1: 0.5833
 epoch: 45, train_loss: 0.5213, test_loss: 1.2392, test_f1: 0.6357
 epoch: 46, train_loss: 0.5266, test_loss: 1.4308, test_f1: 0.6072
 epoch: 47, train_loss: 0.5561, test_loss: 1.4138, test_f1: 0.6153
 epoch: 48, train_loss: 0.5541, test_loss: 1.3428, test_f1: 0.6547
 epoch: 49, train_loss: 0.5390, test_loss: 1.2151, test_f1: 0.6073
 epoch: 50, train_loss: 0.5585, test_loss: 1.3012, test_f1: 0.6291
 epoch: 51, train_loss: 0.5052, test_loss: 1.3745, test_f1: 0.6362
 epoch: 52, train_loss: 0.4953, test_loss: 1.4328, test_f1: 0.6420
 epoch: 53, train_loss: 0.4861, test_loss: 1.3447, test_f1: 0.6386
 epoch: 54, train_loss: 0.4685, test_loss: 1.3153, test_f1: 0.6337
 epoch: 55, train_loss: 0.4681, test_loss: 1.3882, test_f1: 0.6278
 epoch: 56, train_loss: 0.4543, test_loss: 1.5290, test_f1: 0.6248
 epoch: 57, train_loss: 0.4464, test_loss: 1.5089, test_f1: 0.6341
 epoch: 58, train_loss: 0.4501, test_loss: 1.3679, test_f1: 0.6160
 epoch: 59, train_loss: 0.4515, test_loss: 1.4733, test_f1: 0.6671
 epoch: 60, train_loss: 0.4504, test_loss: 1.5631, test_f1: 0.6257
 epoch: 61, train_loss: 0.4503, test_loss: 1.4838, test_f1: 0.6229
 epoch: 62, train_loss: 0.4508, test_loss: 1.4922, test_f1: 0.5893
 epoch: 63, train_loss: 0.4420, test_loss: 1.4813, test_f1: 0.6265
 epoch: 64, train_loss: 0.4398, test_loss: 1.4865, test_f1: 0.5958
 epoch: 65, train_loss: 0.4086, test_loss: 1.4746, test_f1: 0.6100
 epoch: 66, train_loss: 0.3868, test_loss: 1.4477, test_f1: 0.6321
 epoch: 67, train_loss: 0.4071, test_loss: 1.4669, test_f1: 0.6236
 epoch: 68, train_loss: 0.4023, test_loss: 1.4455, test_f1: 0.6145
 epoch: 69, train_loss: 0.4032, test_loss: 1.5510, test_f1: 0.6098
 epoch: 70, train_loss: 0.3977, test_loss: 1.5242, test_f1: 0.6332
 epoch: 71, train_loss: 0.3949, test_loss: 1.5274, test_f1: 0.6072
 epoch: 72, train_loss: 0.3764, test_loss: 1.5630, test_f1: 0.6156
 epoch: 73, train_loss: 0.3683, test_loss: 1.6274, test_f1: 0.6358
 epoch: 74, train_loss: 0.3744, test_loss: 1.5201, test_f1: 0.6164
 epoch: 75, train_loss: 0.3727, test_loss: 1.4906, test_f1: 0.6077
 epoch: 76, train_loss: 0.3859, test_loss: 1.6008, test_f1: 0.6265
 epoch: 77, train_loss: 0.3593, test_loss: 1.6329, test_f1: 0.6340
 epoch: 78, train_loss: 0.3733, test_loss: 1.6012, test_f1: 0.6357
 epoch: 79, train_loss: 0.3917, test_loss: 1.6771, test_f1: 0.6066
 epoch: 80, train_loss: 0.3664, test_loss: 1.5017, test_f1: 0.6161
 epoch: 81, train_loss: 0.3635, test_loss: 1.6531, test_f1: 0.5647
 epoch: 82, train_loss: 0.3590, test_loss: 1.5541, test_f1: 0.5823
 epoch: 83, train_loss: 0.3318, test_loss: 1.5884, test_f1: 0.6403
 epoch: 84, train_loss: 0.3489, test_loss: 1.6134, test_f1: 0.6211
 epoch: 85, train_loss: 0.3346, test_loss: 1.7177, test_f1: 0.5892
 epoch: 86, train_loss: 0.3383, test_loss: 1.7212, test_f1: 0.5677
 epoch: 87, train_loss: 0.3237, test_loss: 1.6261, test_f1: 0.6114
 epoch: 88, train_loss: 0.3116, test_loss: 1.6924, test_f1: 0.6293
 epoch: 89, train_loss: 0.3064, test_loss: 1.7347, test_f1: 0.6195
 epoch: 90, train_loss: 0.3222, test_loss: 1.6853, test_f1: 0.6133
 epoch: 91, train_loss: 0.3250, test_loss: 1.6595, test_f1: 0.6329
 epoch: 92, train_loss: 0.3023, test_loss: 1.6422, test_f1: 0.5779
 epoch: 93, train_loss: 0.3045, test_loss: 1.7073, test_f1: 0.5945
 epoch: 94, train_loss: 0.2974, test_loss: 1.7800, test_f1: 0.6142
 epoch: 95, train_loss: 0.2920, test_loss: 1.7595, test_f1: 0.6257
 epoch: 96, train_loss: 0.2876, test_loss: 1.7719, test_f1: 0.6056
 epoch: 97, train_loss: 0.2969, test_loss: 1.7878, test_f1: 0.6123
 epoch: 98, train_loss: 0.3087, test_loss: 1.8519, test_f1: 0.6131
 epoch: 99, train_loss: 0.2928, test_loss: 1.8005, test_f1: 0.6216
##################ITERATION #8 ****************************************
 epoch: 0, train_loss: 1.4357, test_loss: 1.4124, test_f1: 0.1365
 epoch: 1, train_loss: 1.1291, test_loss: 1.4292, test_f1: 0.1365
 epoch: 2, train_loss: 1.0928, test_loss: 1.3536, test_f1: 0.1505
 epoch: 3, train_loss: 1.0232, test_loss: 1.2864, test_f1: 0.2125
 epoch: 4, train_loss: 0.9749, test_loss: 1.1965, test_f1: 0.4059
 epoch: 5, train_loss: 0.9349, test_loss: 1.1401, test_f1: 0.4649
 epoch: 6, train_loss: 0.9194, test_loss: 1.0959, test_f1: 0.4776
 epoch: 7, train_loss: 0.9236, test_loss: 1.1010, test_f1: 0.4752
 epoch: 8, train_loss: 0.9011, test_loss: 1.1332, test_f1: 0.4398
 epoch: 9, train_loss: 0.8467, test_loss: 1.1404, test_f1: 0.4888
 epoch: 10, train_loss: 0.8346, test_loss: 1.1510, test_f1: 0.4985
 epoch: 11, train_loss: 0.8405, test_loss: 1.1567, test_f1: 0.5046
 epoch: 12, train_loss: 0.8001, test_loss: 1.1966, test_f1: 0.4164
 epoch: 13, train_loss: 0.8129, test_loss: 1.2294, test_f1: 0.5272
 epoch: 14, train_loss: 0.7932, test_loss: 1.2679, test_f1: 0.5145
 epoch: 15, train_loss: 0.7866, test_loss: 1.1780, test_f1: 0.5349
 epoch: 16, train_loss: 0.7546, test_loss: 1.1115, test_f1: 0.5779
 epoch: 17, train_loss: 0.7883, test_loss: 1.1470, test_f1: 0.5781
 epoch: 18, train_loss: 0.7612, test_loss: 1.2278, test_f1: 0.5773
 epoch: 19, train_loss: 0.7585, test_loss: 1.1549, test_f1: 0.5283
 epoch: 20, train_loss: 0.7342, test_loss: 1.1178, test_f1: 0.5613
 epoch: 21, train_loss: 0.7315, test_loss: 1.2006, test_f1: 0.5398
 epoch: 22, train_loss: 0.7170, test_loss: 1.2355, test_f1: 0.5834
 epoch: 23, train_loss: 0.6879, test_loss: 1.1510, test_f1: 0.6011
 epoch: 24, train_loss: 0.6927, test_loss: 1.2388, test_f1: 0.5964
 epoch: 25, train_loss: 0.6666, test_loss: 1.2851, test_f1: 0.5724
 epoch: 26, train_loss: 0.6635, test_loss: 1.2884, test_f1: 0.5942
 epoch: 27, train_loss: 0.6598, test_loss: 1.1752, test_f1: 0.6089
 epoch: 28, train_loss: 0.6452, test_loss: 1.1590, test_f1: 0.6205
 epoch: 29, train_loss: 0.6292, test_loss: 1.2383, test_f1: 0.6236
 epoch: 30, train_loss: 0.6257, test_loss: 1.3189, test_f1: 0.5811
 epoch: 31, train_loss: 0.6266, test_loss: 1.4178, test_f1: 0.5447
 epoch: 32, train_loss: 0.6348, test_loss: 1.3262, test_f1: 0.5652
 epoch: 33, train_loss: 0.6325, test_loss: 1.2370, test_f1: 0.6005
 epoch: 34, train_loss: 0.6123, test_loss: 1.2488, test_f1: 0.5863
 epoch: 35, train_loss: 0.5998, test_loss: 1.2574, test_f1: 0.6150
 epoch: 36, train_loss: 0.5898, test_loss: 1.2377, test_f1: 0.5973
 epoch: 37, train_loss: 0.6046, test_loss: 1.2623, test_f1: 0.5763
 epoch: 38, train_loss: 0.6259, test_loss: 1.1607, test_f1: 0.6097
 epoch: 39, train_loss: 0.5731, test_loss: 1.1664, test_f1: 0.6169
 epoch: 40, train_loss: 0.5617, test_loss: 1.2542, test_f1: 0.6102
 epoch: 41, train_loss: 0.5785, test_loss: 1.1761, test_f1: 0.6188
 epoch: 42, train_loss: 0.5715, test_loss: 1.2315, test_f1: 0.5823
 epoch: 43, train_loss: 0.5543, test_loss: 1.2827, test_f1: 0.6129
 epoch: 44, train_loss: 0.5769, test_loss: 1.2158, test_f1: 0.6097
 epoch: 45, train_loss: 0.5540, test_loss: 1.4259, test_f1: 0.5771
 epoch: 46, train_loss: 0.6009, test_loss: 1.3397, test_f1: 0.6158
 epoch: 47, train_loss: 0.6100, test_loss: 1.3074, test_f1: 0.6039
 epoch: 48, train_loss: 0.5402, test_loss: 1.3374, test_f1: 0.5686
 epoch: 49, train_loss: 0.5292, test_loss: 1.5130, test_f1: 0.5648
 epoch: 50, train_loss: 0.5705, test_loss: 1.3387, test_f1: 0.5865
 epoch: 51, train_loss: 0.5055, test_loss: 1.3312, test_f1: 0.5923
 epoch: 52, train_loss: 0.4800, test_loss: 1.3408, test_f1: 0.6111
 epoch: 53, train_loss: 0.4734, test_loss: 1.3159, test_f1: 0.6416
 epoch: 54, train_loss: 0.4506, test_loss: 1.2634, test_f1: 0.6569
 epoch: 55, train_loss: 0.4500, test_loss: 1.2558, test_f1: 0.6541
 epoch: 56, train_loss: 0.4629, test_loss: 1.2437, test_f1: 0.6428
 epoch: 57, train_loss: 0.4346, test_loss: 1.2573, test_f1: 0.6416
 epoch: 58, train_loss: 0.4248, test_loss: 1.3027, test_f1: 0.6113
 epoch: 59, train_loss: 0.4373, test_loss: 1.3927, test_f1: 0.6432
 epoch: 60, train_loss: 0.4179, test_loss: 1.3769, test_f1: 0.6420
 epoch: 61, train_loss: 0.4369, test_loss: 1.4401, test_f1: 0.6334
 epoch: 62, train_loss: 0.4076, test_loss: 1.4681, test_f1: 0.6173
 epoch: 63, train_loss: 0.4421, test_loss: 1.3809, test_f1: 0.6238
 epoch: 64, train_loss: 0.4042, test_loss: 1.4076, test_f1: 0.6184
 epoch: 65, train_loss: 0.4023, test_loss: 1.3560, test_f1: 0.6288
 epoch: 66, train_loss: 0.3798, test_loss: 1.3826, test_f1: 0.6405
 epoch: 67, train_loss: 0.3927, test_loss: 1.5431, test_f1: 0.6432
 epoch: 68, train_loss: 0.3918, test_loss: 1.4913, test_f1: 0.6354
 epoch: 69, train_loss: 0.3799, test_loss: 1.5047, test_f1: 0.6348
 epoch: 70, train_loss: 0.3922, test_loss: 1.4445, test_f1: 0.6173
 epoch: 71, train_loss: 0.3914, test_loss: 1.5373, test_f1: 0.6142
 epoch: 72, train_loss: 0.4189, test_loss: 1.5773, test_f1: 0.6144
 epoch: 73, train_loss: 0.3928, test_loss: 1.6090, test_f1: 0.6280
 epoch: 74, train_loss: 0.3519, test_loss: 1.5906, test_f1: 0.6312
 epoch: 75, train_loss: 0.3544, test_loss: 1.6229, test_f1: 0.6244
 epoch: 76, train_loss: 0.3518, test_loss: 1.6376, test_f1: 0.6102
 epoch: 77, train_loss: 0.3512, test_loss: 1.6082, test_f1: 0.6019
 epoch: 78, train_loss: 0.3698, test_loss: 1.6166, test_f1: 0.6000
 epoch: 79, train_loss: 0.3648, test_loss: 1.4836, test_f1: 0.6213
 epoch: 80, train_loss: 0.3550, test_loss: 1.6083, test_f1: 0.6400
 epoch: 81, train_loss: 0.3515, test_loss: 1.4705, test_f1: 0.6570
 epoch: 82, train_loss: 0.3387, test_loss: 1.5949, test_f1: 0.6202
 epoch: 83, train_loss: 0.3549, test_loss: 1.4686, test_f1: 0.6290
 epoch: 84, train_loss: 0.3570, test_loss: 1.5332, test_f1: 0.6427
 epoch: 85, train_loss: 0.3446, test_loss: 1.6022, test_f1: 0.6476
 epoch: 86, train_loss: 0.3416, test_loss: 1.6178, test_f1: 0.6487
 epoch: 87, train_loss: 0.3421, test_loss: 1.5920, test_f1: 0.6110
 epoch: 88, train_loss: 0.3432, test_loss: 1.5949, test_f1: 0.6138
 epoch: 89, train_loss: 0.3608, test_loss: 1.4626, test_f1: 0.5893
 epoch: 90, train_loss: 0.3649, test_loss: 1.6237, test_f1: 0.6483
 epoch: 91, train_loss: 0.3195, test_loss: 1.6087, test_f1: 0.6100
 epoch: 92, train_loss: 0.3149, test_loss: 1.6901, test_f1: 0.6531
 epoch: 93, train_loss: 0.3205, test_loss: 1.6552, test_f1: 0.6254
 epoch: 94, train_loss: 0.3107, test_loss: 1.8104, test_f1: 0.6440
 epoch: 95, train_loss: 0.3227, test_loss: 1.6787, test_f1: 0.6553
 epoch: 96, train_loss: 0.3059, test_loss: 1.8618, test_f1: 0.6120
 epoch: 97, train_loss: 0.3018, test_loss: 1.5896, test_f1: 0.6211
 epoch: 98, train_loss: 0.2935, test_loss: 1.5972, test_f1: 0.6197
 epoch: 99, train_loss: 0.3117, test_loss: 1.7563, test_f1: 0.6286
##################ITERATION #9 ****************************************
 epoch: 0, train_loss: 1.5185, test_loss: 1.4369, test_f1: 0.1365
 epoch: 1, train_loss: 1.1677, test_loss: 1.4382, test_f1: 0.1365
 epoch: 2, train_loss: 1.0777, test_loss: 1.3852, test_f1: 0.1365
 epoch: 3, train_loss: 1.0251, test_loss: 1.2455, test_f1: 0.2095
 epoch: 4, train_loss: 0.9747, test_loss: 1.2274, test_f1: 0.2234
 epoch: 5, train_loss: 0.9367, test_loss: 1.1787, test_f1: 0.3137
 epoch: 6, train_loss: 0.9104, test_loss: 1.1487, test_f1: 0.3758
 epoch: 7, train_loss: 0.9210, test_loss: 1.1325, test_f1: 0.4237
 epoch: 8, train_loss: 0.8996, test_loss: 1.1439, test_f1: 0.4777
 epoch: 9, train_loss: 0.8682, test_loss: 1.1611, test_f1: 0.5477
 epoch: 10, train_loss: 0.8526, test_loss: 1.1532, test_f1: 0.5359
 epoch: 11, train_loss: 0.8543, test_loss: 1.1512, test_f1: 0.5193
 epoch: 12, train_loss: 0.8200, test_loss: 1.1498, test_f1: 0.5497
 epoch: 13, train_loss: 0.8192, test_loss: 1.1822, test_f1: 0.5490
 epoch: 14, train_loss: 0.7957, test_loss: 1.1250, test_f1: 0.5962
 epoch: 15, train_loss: 0.7829, test_loss: 1.1078, test_f1: 0.5904
 epoch: 16, train_loss: 0.7785, test_loss: 1.1301, test_f1: 0.5999
 epoch: 17, train_loss: 0.7606, test_loss: 1.1501, test_f1: 0.5901
 epoch: 18, train_loss: 0.7545, test_loss: 1.1417, test_f1: 0.5966
 epoch: 19, train_loss: 0.7294, test_loss: 1.1644, test_f1: 0.5643
 epoch: 20, train_loss: 0.7251, test_loss: 1.2087, test_f1: 0.5810
 epoch: 21, train_loss: 0.7279, test_loss: 1.2148, test_f1: 0.5802
 epoch: 22, train_loss: 0.7261, test_loss: 1.1721, test_f1: 0.5711
 epoch: 23, train_loss: 0.7089, test_loss: 1.1838, test_f1: 0.5665
 epoch: 24, train_loss: 0.6857, test_loss: 1.2178, test_f1: 0.5952
 epoch: 25, train_loss: 0.6832, test_loss: 1.2018, test_f1: 0.5836
 epoch: 26, train_loss: 0.6865, test_loss: 1.1512, test_f1: 0.5838
 epoch: 27, train_loss: 0.6783, test_loss: 1.2156, test_f1: 0.5739
 epoch: 28, train_loss: 0.6918, test_loss: 1.2560, test_f1: 0.5998
 epoch: 29, train_loss: 0.6586, test_loss: 1.2348, test_f1: 0.5973
 epoch: 30, train_loss: 0.6382, test_loss: 1.2523, test_f1: 0.5952
 epoch: 31, train_loss: 0.6594, test_loss: 1.2518, test_f1: 0.5787
 epoch: 32, train_loss: 0.6440, test_loss: 1.2436, test_f1: 0.5784
 epoch: 33, train_loss: 0.6267, test_loss: 1.2678, test_f1: 0.5883
 epoch: 34, train_loss: 0.6430, test_loss: 1.3722, test_f1: 0.5938
 epoch: 35, train_loss: 0.6456, test_loss: 1.4049, test_f1: 0.5724
 epoch: 36, train_loss: 0.6363, test_loss: 1.3566, test_f1: 0.5135
 epoch: 37, train_loss: 0.6034, test_loss: 1.3538, test_f1: 0.5348
 epoch: 38, train_loss: 0.6132, test_loss: 1.2585, test_f1: 0.6143
 epoch: 39, train_loss: 0.6082, test_loss: 1.2684, test_f1: 0.6050
 epoch: 40, train_loss: 0.5743, test_loss: 1.3393, test_f1: 0.6042
 epoch: 41, train_loss: 0.5815, test_loss: 1.4403, test_f1: 0.6012
 epoch: 42, train_loss: 0.5375, test_loss: 1.4018, test_f1: 0.6020
 epoch: 43, train_loss: 0.5630, test_loss: 1.3123, test_f1: 0.6223
 epoch: 44, train_loss: 0.5368, test_loss: 1.3797, test_f1: 0.5640
 epoch: 45, train_loss: 0.5253, test_loss: 1.3765, test_f1: 0.5529
 epoch: 46, train_loss: 0.5134, test_loss: 1.3790, test_f1: 0.6245
 epoch: 47, train_loss: 0.5204, test_loss: 1.3768, test_f1: 0.5982
 epoch: 48, train_loss: 0.5045, test_loss: 1.3991, test_f1: 0.5758
 epoch: 49, train_loss: 0.5336, test_loss: 1.4963, test_f1: 0.6141
 epoch: 50, train_loss: 0.5337, test_loss: 1.5167, test_f1: 0.5858
 epoch: 51, train_loss: 0.5166, test_loss: 1.5773, test_f1: 0.6244
 epoch: 52, train_loss: 0.4932, test_loss: 1.4409, test_f1: 0.6201
 epoch: 53, train_loss: 0.4862, test_loss: 1.4372, test_f1: 0.6189
 epoch: 54, train_loss: 0.4723, test_loss: 1.4919, test_f1: 0.6091
 epoch: 55, train_loss: 0.4827, test_loss: 1.4734, test_f1: 0.5818
 epoch: 56, train_loss: 0.4672, test_loss: 1.5022, test_f1: 0.5673
 epoch: 57, train_loss: 0.5058, test_loss: 1.5557, test_f1: 0.5689
 epoch: 58, train_loss: 0.4765, test_loss: 1.4832, test_f1: 0.6268
 epoch: 59, train_loss: 0.4490, test_loss: 1.6287, test_f1: 0.6158
 epoch: 60, train_loss: 0.4292, test_loss: 1.5612, test_f1: 0.6205
 epoch: 61, train_loss: 0.4263, test_loss: 1.5271, test_f1: 0.6140
 epoch: 62, train_loss: 0.4360, test_loss: 1.5236, test_f1: 0.6122
 epoch: 63, train_loss: 0.4255, test_loss: 1.4642, test_f1: 0.5852
 epoch: 64, train_loss: 0.4364, test_loss: 1.5132, test_f1: 0.5901
 epoch: 65, train_loss: 0.4341, test_loss: 1.5587, test_f1: 0.6097
 epoch: 66, train_loss: 0.4101, test_loss: 1.5893, test_f1: 0.6183
 epoch: 67, train_loss: 0.4296, test_loss: 1.5481, test_f1: 0.6181
 epoch: 68, train_loss: 0.3967, test_loss: 1.5220, test_f1: 0.6060
 epoch: 69, train_loss: 0.4227, test_loss: 1.6279, test_f1: 0.5980
 epoch: 70, train_loss: 0.4159, test_loss: 1.7076, test_f1: 0.6086
 epoch: 71, train_loss: 0.4273, test_loss: 1.6155, test_f1: 0.6004
 epoch: 72, train_loss: 0.3922, test_loss: 1.6847, test_f1: 0.5864
 epoch: 73, train_loss: 0.3966, test_loss: 1.5895, test_f1: 0.5772
 epoch: 74, train_loss: 0.3731, test_loss: 1.7607, test_f1: 0.6056
 epoch: 75, train_loss: 0.3766, test_loss: 1.6709, test_f1: 0.5990
 epoch: 76, train_loss: 0.3839, test_loss: 1.6860, test_f1: 0.6073
 epoch: 77, train_loss: 0.3952, test_loss: 1.6849, test_f1: 0.6024
 epoch: 78, train_loss: 0.3467, test_loss: 1.6686, test_f1: 0.5741
 epoch: 79, train_loss: 0.3878, test_loss: 1.7781, test_f1: 0.6020
 epoch: 80, train_loss: 0.3584, test_loss: 1.7169, test_f1: 0.5883
 epoch: 81, train_loss: 0.3484, test_loss: 1.6828, test_f1: 0.6242
 epoch: 82, train_loss: 0.3495, test_loss: 1.5849, test_f1: 0.6014
 epoch: 83, train_loss: 0.3638, test_loss: 1.7346, test_f1: 0.5655
 epoch: 84, train_loss: 0.3420, test_loss: 1.8078, test_f1: 0.5743
 epoch: 85, train_loss: 0.3401, test_loss: 1.8372, test_f1: 0.5795
 epoch: 86, train_loss: 0.3376, test_loss: 1.8588, test_f1: 0.6046
 epoch: 87, train_loss: 0.3400, test_loss: 1.7580, test_f1: 0.5906
 epoch: 88, train_loss: 0.3706, test_loss: 1.7105, test_f1: 0.6266
 epoch: 89, train_loss: 0.3859, test_loss: 1.8967, test_f1: 0.5741
 epoch: 90, train_loss: 0.3556, test_loss: 1.7297, test_f1: 0.6088
 epoch: 91, train_loss: 0.3349, test_loss: 1.7599, test_f1: 0.5916
 epoch: 92, train_loss: 0.3395, test_loss: 1.7962, test_f1: 0.5791
 epoch: 93, train_loss: 0.3248, test_loss: 1.8395, test_f1: 0.5925
 epoch: 94, train_loss: 0.3243, test_loss: 1.9388, test_f1: 0.5867
 epoch: 95, train_loss: 0.3208, test_loss: 1.8539, test_f1: 0.6143
 epoch: 96, train_loss: 0.3513, test_loss: 1.7455, test_f1: 0.6111
 epoch: 97, train_loss: 0.3297, test_loss: 1.8031, test_f1: 0.5879
 epoch: 98, train_loss: 0.3438, test_loss: 1.8326, test_f1: 0.5926
 epoch: 99, train_loss: 0.3321, test_loss: 1.9937, test_f1: 0.6230

Training completed in 284.02 seconds
Best F1: 0.6748 at epoch 90
Mean F1 across iterations: 0.6468  0.0189
========================FINAL RESULTS================================
FEGIN weighted F1: 0.6748  0.0189
python main.py --data ltspice_demos --representation component_net --model FEGIN --layers 2 --hiddens 128 --batch_size 256 --lr 0.001 --emb_size 250 --epochs 100 --save_appendix component_net_L2_H128_BS256_LR0.001_E250 --no_val
-----



STDERR:
  File "main.py", line 370, in <module>
    main()
  File "main.py", line 254, in main
    dataset = dataset_class(
  File "/home/philip/projects/ltspice_examples_code_repo/Circuit-Completion-Using-GNNs/component_classification_with_link_prediction_head/evaluation/FEGIN/kernel/circuit_datasets.py", line 15, in __init__
    self.data, self.slices = torch.load(self.processed_paths[0])
  File "/home/philip/.local/lib/python3.8/site-packages/torch/serialization.py", line 1040, in load
    warnings.warn(
  File "/usr/lib/python3.8/warnings.py", line 109, in _showwarnmsg
    sw(msg.message, msg.category, msg.filename, msg.lineno,
  File "main.py", line 47, in warn_with_traceback
    traceback.print_stack(file=log)
/home/philip/projects/ltspice_examples_code_repo/Circuit-Completion-Using-GNNs/component_classification_with_link_prediction_head/evaluation/FEGIN/kernel/circuit_datasets.py:15: FutureWarning: You are using `torch.load` with `weights_only=False` (the current default value), which uses the default pickle module implicitly. It is possible to construct malicious pickle data which will execute arbitrary code during unpickling (See https://github.com/pytorch/pytorch/blob/main/SECURITY.md#untrusted-models for more details). In a future release, the default value for `weights_only` will be flipped to `True`. This limits the functions that could be executed during unpickling. Arbitrary objects will no longer be allowed to be loaded via this mode unless they are explicitly allowlisted by the user via `torch.serialization.add_safe_globals`. We recommend you start setting `weights_only=True` for any use case where you don't have full control of the loaded file. Please open an issue on GitHub for any issues related to this experimental feature.
  self.data, self.slices = torch.load(self.processed_paths[0])
