STDOUT:
Results will be saved in /home/philip/projects/ltspice_examples_code_repo/Circuit-Completion-Using-GNNs/component_classification_with_link_prediction_head/evaluation/FEGIN/results/model_FEGIN_dataset_ltspice_examples
Command line input: python main.py --data ltspice_examples --representation component_net --model FEGIN --layers 4 --hiddens 64 --batch_size 256 --lr 0.0001 --emb_size 250 --epochs 100 --save_appendix component_net_L4_H64_BS256_LR0.0001_E250 --no_val
 is saved.
-----
ltspice_examples - FEGIN
Using 4 layers, 64 hidden units, h = 2
Loading component_net representation dataset
ENTERED
Training FEGIN on component_net representation
Train: 3558, Test: 846
##################ITERATION #0 ****************************************
 epoch: 0, train_loss: 1.3697, test_loss: 1.3756, test_f1: 0.2270
 epoch: 1, train_loss: 1.3602, test_loss: 1.3738, test_f1: 0.2270
 epoch: 2, train_loss: 1.3535, test_loss: 1.3686, test_f1: 0.2270
 epoch: 3, train_loss: 1.3456, test_loss: 1.3574, test_f1: 0.2270
 epoch: 4, train_loss: 1.3371, test_loss: 1.3415, test_f1: 0.2270
 epoch: 5, train_loss: 1.3275, test_loss: 1.3280, test_f1: 0.2270
 epoch: 6, train_loss: 1.3181, test_loss: 1.3170, test_f1: 0.2270
 epoch: 7, train_loss: 1.3085, test_loss: 1.3061, test_f1: 0.2270
 epoch: 8, train_loss: 1.2982, test_loss: 1.2960, test_f1: 0.2270
 epoch: 9, train_loss: 1.2873, test_loss: 1.2855, test_f1: 0.2270
 epoch: 10, train_loss: 1.2778, test_loss: 1.2740, test_f1: 0.2270
 epoch: 11, train_loss: 1.2656, test_loss: 1.2626, test_f1: 0.2270
 epoch: 12, train_loss: 1.2544, test_loss: 1.2503, test_f1: 0.2270
 epoch: 13, train_loss: 1.2409, test_loss: 1.2373, test_f1: 0.2295
 epoch: 14, train_loss: 1.2310, test_loss: 1.2259, test_f1: 0.2443
 epoch: 15, train_loss: 1.2222, test_loss: 1.2128, test_f1: 0.2792
 epoch: 16, train_loss: 1.2123, test_loss: 1.2024, test_f1: 0.2830
 epoch: 17, train_loss: 1.2015, test_loss: 1.1921, test_f1: 0.3046
 epoch: 18, train_loss: 1.1916, test_loss: 1.1774, test_f1: 0.3308
 epoch: 19, train_loss: 1.1765, test_loss: 1.1651, test_f1: 0.3368
 epoch: 20, train_loss: 1.1681, test_loss: 1.1499, test_f1: 0.3433
 epoch: 21, train_loss: 1.1555, test_loss: 1.1412, test_f1: 0.3418
 epoch: 22, train_loss: 1.1441, test_loss: 1.1249, test_f1: 0.3573
 epoch: 23, train_loss: 1.1253, test_loss: 1.1061, test_f1: 0.3948
 epoch: 24, train_loss: 1.1193, test_loss: 1.0914, test_f1: 0.4218
 epoch: 25, train_loss: 1.1060, test_loss: 1.0798, test_f1: 0.4412
 epoch: 26, train_loss: 1.0880, test_loss: 1.0675, test_f1: 0.4551
 epoch: 27, train_loss: 1.0740, test_loss: 1.0472, test_f1: 0.4812
 epoch: 28, train_loss: 1.0625, test_loss: 1.0333, test_f1: 0.5010
 epoch: 29, train_loss: 1.0536, test_loss: 1.0228, test_f1: 0.5060
 epoch: 30, train_loss: 1.0313, test_loss: 1.0035, test_f1: 0.4895
 epoch: 31, train_loss: 1.0207, test_loss: 0.9980, test_f1: 0.4953
 epoch: 32, train_loss: 1.0086, test_loss: 0.9805, test_f1: 0.5012
 epoch: 33, train_loss: 0.9932, test_loss: 0.9845, test_f1: 0.5017
 epoch: 34, train_loss: 0.9839, test_loss: 0.9692, test_f1: 0.5033
 epoch: 35, train_loss: 0.9733, test_loss: 0.9535, test_f1: 0.5155
 epoch: 36, train_loss: 0.9706, test_loss: 0.9469, test_f1: 0.5059
 epoch: 37, train_loss: 0.9546, test_loss: 0.9421, test_f1: 0.5214
 epoch: 38, train_loss: 0.9433, test_loss: 0.9305, test_f1: 0.5220
 epoch: 39, train_loss: 0.9416, test_loss: 0.9289, test_f1: 0.5165
 epoch: 40, train_loss: 0.9231, test_loss: 0.9179, test_f1: 0.5052
 epoch: 41, train_loss: 0.9203, test_loss: 0.9155, test_f1: 0.5209
 epoch: 42, train_loss: 0.9154, test_loss: 0.9208, test_f1: 0.5242
 epoch: 43, train_loss: 0.9073, test_loss: 0.9486, test_f1: 0.5018
 epoch: 44, train_loss: 0.9012, test_loss: 0.8951, test_f1: 0.5312
 epoch: 45, train_loss: 0.8904, test_loss: 0.9181, test_f1: 0.5048
 epoch: 46, train_loss: 0.8874, test_loss: 0.8899, test_f1: 0.5192
 epoch: 47, train_loss: 0.8869, test_loss: 0.9202, test_f1: 0.5166
 epoch: 48, train_loss: 0.8824, test_loss: 0.8863, test_f1: 0.5318
 epoch: 49, train_loss: 0.8776, test_loss: 0.8928, test_f1: 0.5403
 epoch: 50, train_loss: 0.8669, test_loss: 0.8890, test_f1: 0.5368
 epoch: 51, train_loss: 0.8688, test_loss: 0.8897, test_f1: 0.5326
 epoch: 52, train_loss: 0.8573, test_loss: 0.8926, test_f1: 0.5302
 epoch: 53, train_loss: 0.8543, test_loss: 0.8938, test_f1: 0.5325
 epoch: 54, train_loss: 0.8575, test_loss: 0.8933, test_f1: 0.5403
 epoch: 55, train_loss: 0.8510, test_loss: 0.8849, test_f1: 0.5392
 epoch: 56, train_loss: 0.8567, test_loss: 0.8923, test_f1: 0.5314
 epoch: 57, train_loss: 0.8588, test_loss: 0.8927, test_f1: 0.5286
 epoch: 58, train_loss: 0.8562, test_loss: 0.8858, test_f1: 0.5460
 epoch: 59, train_loss: 0.8545, test_loss: 0.9055, test_f1: 0.5341
 epoch: 60, train_loss: 0.8394, test_loss: 0.8890, test_f1: 0.5438
 epoch: 61, train_loss: 0.8506, test_loss: 0.9019, test_f1: 0.5334
 epoch: 62, train_loss: 0.8416, test_loss: 0.8853, test_f1: 0.5300
 epoch: 63, train_loss: 0.8364, test_loss: 0.8899, test_f1: 0.5274
 epoch: 64, train_loss: 0.8392, test_loss: 0.9092, test_f1: 0.5226
 epoch: 65, train_loss: 0.8346, test_loss: 0.9008, test_f1: 0.5234
 epoch: 66, train_loss: 0.8286, test_loss: 0.8874, test_f1: 0.5460
 epoch: 67, train_loss: 0.8319, test_loss: 0.8872, test_f1: 0.5437
 epoch: 68, train_loss: 0.8296, test_loss: 0.8927, test_f1: 0.5455
 epoch: 69, train_loss: 0.8256, test_loss: 0.8966, test_f1: 0.5455
 epoch: 70, train_loss: 0.8278, test_loss: 0.8829, test_f1: 0.5358
 epoch: 71, train_loss: 0.8286, test_loss: 0.9066, test_f1: 0.5352
 epoch: 72, train_loss: 0.8244, test_loss: 0.8914, test_f1: 0.5395
 epoch: 73, train_loss: 0.8244, test_loss: 0.9013, test_f1: 0.5472
 epoch: 74, train_loss: 0.8322, test_loss: 0.9009, test_f1: 0.5423
 epoch: 75, train_loss: 0.8192, test_loss: 0.8935, test_f1: 0.5499
 epoch: 76, train_loss: 0.8207, test_loss: 0.9003, test_f1: 0.5337
 epoch: 77, train_loss: 0.8289, test_loss: 0.8896, test_f1: 0.5438
 epoch: 78, train_loss: 0.8166, test_loss: 0.9039, test_f1: 0.5357
 epoch: 79, train_loss: 0.8193, test_loss: 0.9144, test_f1: 0.5256
 epoch: 80, train_loss: 0.8263, test_loss: 0.8898, test_f1: 0.5376
 epoch: 81, train_loss: 0.8160, test_loss: 0.9110, test_f1: 0.5328
 epoch: 82, train_loss: 0.8155, test_loss: 0.9058, test_f1: 0.5359
 epoch: 83, train_loss: 0.8156, test_loss: 0.9105, test_f1: 0.5388
 epoch: 84, train_loss: 0.8075, test_loss: 0.9122, test_f1: 0.5368
 epoch: 85, train_loss: 0.8117, test_loss: 0.9067, test_f1: 0.5390
 epoch: 86, train_loss: 0.8107, test_loss: 0.9104, test_f1: 0.5394
 epoch: 87, train_loss: 0.7958, test_loss: 0.9108, test_f1: 0.5388
 epoch: 88, train_loss: 0.8115, test_loss: 0.8910, test_f1: 0.5457
 epoch: 89, train_loss: 0.8048, test_loss: 0.8947, test_f1: 0.5377
 epoch: 90, train_loss: 0.8090, test_loss: 0.9058, test_f1: 0.5413
 epoch: 91, train_loss: 0.8006, test_loss: 0.9014, test_f1: 0.5392
 epoch: 92, train_loss: 0.8011, test_loss: 0.9053, test_f1: 0.5439
 epoch: 93, train_loss: 0.7991, test_loss: 0.8908, test_f1: 0.5397
 epoch: 94, train_loss: 0.7932, test_loss: 0.9008, test_f1: 0.5431
 epoch: 95, train_loss: 0.7937, test_loss: 0.9039, test_f1: 0.5384
 epoch: 96, train_loss: 0.7937, test_loss: 0.9254, test_f1: 0.5240
 epoch: 97, train_loss: 0.7869, test_loss: 0.8907, test_f1: 0.5397
 epoch: 98, train_loss: 0.7898, test_loss: 0.9130, test_f1: 0.5377
 epoch: 99, train_loss: 0.7972, test_loss: 0.9013, test_f1: 0.5450
##################ITERATION #1 ****************************************
 epoch: 0, train_loss: 1.3298, test_loss: 1.3593, test_f1: 0.2270
 epoch: 1, train_loss: 1.3064, test_loss: 1.3447, test_f1: 0.2270
 epoch: 2, train_loss: 1.2909, test_loss: 1.3255, test_f1: 0.2270
 epoch: 3, train_loss: 1.2787, test_loss: 1.2993, test_f1: 0.2270
 epoch: 4, train_loss: 1.2664, test_loss: 1.2721, test_f1: 0.2270
 epoch: 5, train_loss: 1.2525, test_loss: 1.2497, test_f1: 0.2270
 epoch: 6, train_loss: 1.2406, test_loss: 1.2307, test_f1: 0.2728
 epoch: 7, train_loss: 1.2272, test_loss: 1.2127, test_f1: 0.2836
 epoch: 8, train_loss: 1.2141, test_loss: 1.1987, test_f1: 0.2946
 epoch: 9, train_loss: 1.2002, test_loss: 1.1805, test_f1: 0.3328
 epoch: 10, train_loss: 1.1837, test_loss: 1.1652, test_f1: 0.3596
 epoch: 11, train_loss: 1.1699, test_loss: 1.1448, test_f1: 0.3952
 epoch: 12, train_loss: 1.1494, test_loss: 1.1240, test_f1: 0.4175
 epoch: 13, train_loss: 1.1350, test_loss: 1.1113, test_f1: 0.4202
 epoch: 14, train_loss: 1.1136, test_loss: 1.0831, test_f1: 0.4300
 epoch: 15, train_loss: 1.0991, test_loss: 1.0634, test_f1: 0.4421
 epoch: 16, train_loss: 1.0797, test_loss: 1.0462, test_f1: 0.4702
 epoch: 17, train_loss: 1.0662, test_loss: 1.0296, test_f1: 0.4792
 epoch: 18, train_loss: 1.0508, test_loss: 1.0237, test_f1: 0.4713
 epoch: 19, train_loss: 1.0310, test_loss: 1.0040, test_f1: 0.4836
 epoch: 20, train_loss: 1.0227, test_loss: 0.9949, test_f1: 0.4819
 epoch: 21, train_loss: 1.0091, test_loss: 0.9796, test_f1: 0.4948
 epoch: 22, train_loss: 0.9969, test_loss: 0.9651, test_f1: 0.4992
 epoch: 23, train_loss: 0.9949, test_loss: 0.9623, test_f1: 0.4986
 epoch: 24, train_loss: 0.9794, test_loss: 0.9563, test_f1: 0.4997
 epoch: 25, train_loss: 0.9663, test_loss: 0.9500, test_f1: 0.5024
 epoch: 26, train_loss: 0.9591, test_loss: 0.9325, test_f1: 0.5151
 epoch: 27, train_loss: 0.9525, test_loss: 0.9367, test_f1: 0.5004
 epoch: 28, train_loss: 0.9412, test_loss: 0.9304, test_f1: 0.5088
 epoch: 29, train_loss: 0.9298, test_loss: 0.9911, test_f1: 0.4704
 epoch: 30, train_loss: 0.9263, test_loss: 0.9241, test_f1: 0.5158
 epoch: 31, train_loss: 0.9201, test_loss: 0.9117, test_f1: 0.5135
 epoch: 32, train_loss: 0.9104, test_loss: 0.9879, test_f1: 0.4855
 epoch: 33, train_loss: 0.9136, test_loss: 0.9142, test_f1: 0.5131
 epoch: 34, train_loss: 0.9012, test_loss: 0.9283, test_f1: 0.5074
 epoch: 35, train_loss: 0.9013, test_loss: 0.9086, test_f1: 0.5201
 epoch: 36, train_loss: 0.8992, test_loss: 1.0498, test_f1: 0.4922
 epoch: 37, train_loss: 0.8913, test_loss: 0.9204, test_f1: 0.5198
 epoch: 38, train_loss: 0.8871, test_loss: 0.8967, test_f1: 0.5196
 epoch: 39, train_loss: 0.8841, test_loss: 0.9129, test_f1: 0.5189
 epoch: 40, train_loss: 0.8743, test_loss: 0.9054, test_f1: 0.5141
 epoch: 41, train_loss: 0.8704, test_loss: 0.9506, test_f1: 0.5165
 epoch: 42, train_loss: 0.8651, test_loss: 0.9211, test_f1: 0.5101
 epoch: 43, train_loss: 0.8590, test_loss: 0.8919, test_f1: 0.5270
 epoch: 44, train_loss: 0.8621, test_loss: 0.9209, test_f1: 0.5120
 epoch: 45, train_loss: 0.8606, test_loss: 0.8967, test_f1: 0.5298
 epoch: 46, train_loss: 0.8501, test_loss: 1.0091, test_f1: 0.4998
 epoch: 47, train_loss: 0.8498, test_loss: 0.8943, test_f1: 0.5295
 epoch: 48, train_loss: 0.8411, test_loss: 0.8907, test_f1: 0.5199
 epoch: 49, train_loss: 0.8503, test_loss: 0.9153, test_f1: 0.5294
 epoch: 50, train_loss: 0.8423, test_loss: 0.9060, test_f1: 0.5291
 epoch: 51, train_loss: 0.8309, test_loss: 0.9065, test_f1: 0.5170
 epoch: 52, train_loss: 0.8245, test_loss: 0.9028, test_f1: 0.5261
 epoch: 53, train_loss: 0.8291, test_loss: 0.9013, test_f1: 0.5255
 epoch: 54, train_loss: 0.8267, test_loss: 0.9193, test_f1: 0.5355
 epoch: 55, train_loss: 0.8227, test_loss: 0.9098, test_f1: 0.5237
 epoch: 56, train_loss: 0.8287, test_loss: 0.9078, test_f1: 0.5245
 epoch: 57, train_loss: 0.8252, test_loss: 0.9087, test_f1: 0.5300
 epoch: 58, train_loss: 0.8197, test_loss: 0.9338, test_f1: 0.5202
 epoch: 59, train_loss: 0.8185, test_loss: 0.9069, test_f1: 0.5348
 epoch: 60, train_loss: 0.8204, test_loss: 0.9175, test_f1: 0.5294
 epoch: 61, train_loss: 0.8080, test_loss: 0.9200, test_f1: 0.5359
 epoch: 62, train_loss: 0.8090, test_loss: 0.8927, test_f1: 0.5461
 epoch: 63, train_loss: 0.8118, test_loss: 0.9062, test_f1: 0.5540
 epoch: 64, train_loss: 0.8090, test_loss: 0.9140, test_f1: 0.5476
 epoch: 65, train_loss: 0.8141, test_loss: 0.9105, test_f1: 0.5450
 epoch: 66, train_loss: 0.8103, test_loss: 0.9017, test_f1: 0.5511
 epoch: 67, train_loss: 0.8076, test_loss: 0.8997, test_f1: 0.5451
 epoch: 68, train_loss: 0.8102, test_loss: 0.9103, test_f1: 0.5396
 epoch: 69, train_loss: 0.8051, test_loss: 0.9030, test_f1: 0.5472
 epoch: 70, train_loss: 0.8054, test_loss: 0.9106, test_f1: 0.5341
 epoch: 71, train_loss: 0.8072, test_loss: 0.9183, test_f1: 0.5378
 epoch: 72, train_loss: 0.8020, test_loss: 0.9121, test_f1: 0.5347
 epoch: 73, train_loss: 0.8044, test_loss: 0.9067, test_f1: 0.5373
 epoch: 74, train_loss: 0.7937, test_loss: 0.9191, test_f1: 0.5328
 epoch: 75, train_loss: 0.7910, test_loss: 0.9037, test_f1: 0.5520
 epoch: 76, train_loss: 0.8050, test_loss: 0.9155, test_f1: 0.5481
 epoch: 77, train_loss: 0.7933, test_loss: 0.9195, test_f1: 0.5486
 epoch: 78, train_loss: 0.7889, test_loss: 0.9143, test_f1: 0.5537
 epoch: 79, train_loss: 0.7911, test_loss: 0.9288, test_f1: 0.5480
 epoch: 80, train_loss: 0.7907, test_loss: 0.8957, test_f1: 0.5381
 epoch: 81, train_loss: 0.7927, test_loss: 0.9266, test_f1: 0.5375
 epoch: 82, train_loss: 0.7856, test_loss: 0.9196, test_f1: 0.5419
 epoch: 83, train_loss: 0.7821, test_loss: 0.9128, test_f1: 0.5505
 epoch: 84, train_loss: 0.7824, test_loss: 0.9012, test_f1: 0.5627
 epoch: 85, train_loss: 0.7871, test_loss: 0.9069, test_f1: 0.5394
 epoch: 86, train_loss: 0.7819, test_loss: 0.9473, test_f1: 0.5366
 epoch: 87, train_loss: 0.7841, test_loss: 0.9052, test_f1: 0.5463
 epoch: 88, train_loss: 0.7824, test_loss: 0.9144, test_f1: 0.5634
 epoch: 89, train_loss: 0.7791, test_loss: 0.9239, test_f1: 0.5419
 epoch: 90, train_loss: 0.7798, test_loss: 0.9050, test_f1: 0.5578
 epoch: 91, train_loss: 0.7766, test_loss: 0.9127, test_f1: 0.5604
 epoch: 92, train_loss: 0.7827, test_loss: 0.9235, test_f1: 0.5455
 epoch: 93, train_loss: 0.7675, test_loss: 0.9089, test_f1: 0.5433
 epoch: 94, train_loss: 0.7783, test_loss: 0.9286, test_f1: 0.5349
 epoch: 95, train_loss: 0.7717, test_loss: 0.9172, test_f1: 0.5460
 epoch: 96, train_loss: 0.7803, test_loss: 0.9544, test_f1: 0.5551
 epoch: 97, train_loss: 0.7673, test_loss: 0.9190, test_f1: 0.5616
 epoch: 98, train_loss: 0.7711, test_loss: 0.9206, test_f1: 0.5509
 epoch: 99, train_loss: 0.7848, test_loss: 0.9299, test_f1: 0.5430
##################ITERATION #2 ****************************************
 epoch: 0, train_loss: 1.3153, test_loss: 1.3422, test_f1: 0.2270
 epoch: 1, train_loss: 1.2795, test_loss: 1.3267, test_f1: 0.2270
 epoch: 2, train_loss: 1.2653, test_loss: 1.3085, test_f1: 0.2270
 epoch: 3, train_loss: 1.2456, test_loss: 1.2752, test_f1: 0.2344
 epoch: 4, train_loss: 1.2308, test_loss: 1.2310, test_f1: 0.3110
 epoch: 5, train_loss: 1.2138, test_loss: 1.1955, test_f1: 0.3481
 epoch: 6, train_loss: 1.1967, test_loss: 1.1679, test_f1: 0.3757
 epoch: 7, train_loss: 1.1757, test_loss: 1.1466, test_f1: 0.4169
 epoch: 8, train_loss: 1.1633, test_loss: 1.1283, test_f1: 0.4329
 epoch: 9, train_loss: 1.1438, test_loss: 1.1106, test_f1: 0.4293
 epoch: 10, train_loss: 1.1266, test_loss: 1.0919, test_f1: 0.4334
 epoch: 11, train_loss: 1.1110, test_loss: 1.0776, test_f1: 0.4391
 epoch: 12, train_loss: 1.0957, test_loss: 1.0609, test_f1: 0.4247
 epoch: 13, train_loss: 1.0793, test_loss: 1.0469, test_f1: 0.4362
 epoch: 14, train_loss: 1.0635, test_loss: 1.0328, test_f1: 0.4396
 epoch: 15, train_loss: 1.0510, test_loss: 1.0183, test_f1: 0.4444
 epoch: 16, train_loss: 1.0348, test_loss: 1.0094, test_f1: 0.4547
 epoch: 17, train_loss: 1.0204, test_loss: 0.9950, test_f1: 0.4585
 epoch: 18, train_loss: 1.0081, test_loss: 0.9843, test_f1: 0.4665
 epoch: 19, train_loss: 0.9944, test_loss: 0.9752, test_f1: 0.4686
 epoch: 20, train_loss: 0.9857, test_loss: 0.9654, test_f1: 0.4700
 epoch: 21, train_loss: 0.9733, test_loss: 0.9550, test_f1: 0.4827
 epoch: 22, train_loss: 0.9667, test_loss: 0.9483, test_f1: 0.4753
 epoch: 23, train_loss: 0.9551, test_loss: 0.9433, test_f1: 0.4907
 epoch: 24, train_loss: 0.9472, test_loss: 0.9372, test_f1: 0.5055
 epoch: 25, train_loss: 0.9370, test_loss: 0.9318, test_f1: 0.4985
 epoch: 26, train_loss: 0.9312, test_loss: 0.9247, test_f1: 0.5134
 epoch: 27, train_loss: 0.9185, test_loss: 0.9286, test_f1: 0.5132
 epoch: 28, train_loss: 0.9238, test_loss: 0.9252, test_f1: 0.5065
 epoch: 29, train_loss: 0.9128, test_loss: 0.9261, test_f1: 0.5014
 epoch: 30, train_loss: 0.9110, test_loss: 0.9192, test_f1: 0.5056
 epoch: 31, train_loss: 0.8989, test_loss: 0.9260, test_f1: 0.4955
 epoch: 32, train_loss: 0.8940, test_loss: 0.9154, test_f1: 0.5091
 epoch: 33, train_loss: 0.8896, test_loss: 0.9160, test_f1: 0.5131
 epoch: 34, train_loss: 0.8877, test_loss: 0.9171, test_f1: 0.5150
 epoch: 35, train_loss: 0.8768, test_loss: 0.9275, test_f1: 0.5126
 epoch: 36, train_loss: 0.8815, test_loss: 0.9269, test_f1: 0.5232
 epoch: 37, train_loss: 0.8651, test_loss: 0.9343, test_f1: 0.5074
 epoch: 38, train_loss: 0.8710, test_loss: 0.9208, test_f1: 0.5097
 epoch: 39, train_loss: 0.8638, test_loss: 0.9075, test_f1: 0.5143
 epoch: 40, train_loss: 0.8523, test_loss: 0.9127, test_f1: 0.5099
 epoch: 41, train_loss: 0.8513, test_loss: 0.9393, test_f1: 0.5131
 epoch: 42, train_loss: 0.8574, test_loss: 0.9235, test_f1: 0.5217
 epoch: 43, train_loss: 0.8535, test_loss: 0.9219, test_f1: 0.5230
 epoch: 44, train_loss: 0.8402, test_loss: 0.9194, test_f1: 0.5192
 epoch: 45, train_loss: 0.8409, test_loss: 0.9193, test_f1: 0.5240
 epoch: 46, train_loss: 0.8380, test_loss: 0.9210, test_f1: 0.5187
 epoch: 47, train_loss: 0.8291, test_loss: 0.9320, test_f1: 0.5295
 epoch: 48, train_loss: 0.8312, test_loss: 0.9286, test_f1: 0.5297
 epoch: 49, train_loss: 0.8322, test_loss: 0.9494, test_f1: 0.5219
 epoch: 50, train_loss: 0.8313, test_loss: 0.9396, test_f1: 0.5297
 epoch: 51, train_loss: 0.8219, test_loss: 0.9308, test_f1: 0.5221
 epoch: 52, train_loss: 0.8170, test_loss: 0.9322, test_f1: 0.5268
 epoch: 53, train_loss: 0.8124, test_loss: 0.9365, test_f1: 0.5156
 epoch: 54, train_loss: 0.8173, test_loss: 0.9285, test_f1: 0.5146
 epoch: 55, train_loss: 0.8212, test_loss: 0.9315, test_f1: 0.5182
 epoch: 56, train_loss: 0.8158, test_loss: 0.9316, test_f1: 0.5194
 epoch: 57, train_loss: 0.8059, test_loss: 0.9278, test_f1: 0.5213
 epoch: 58, train_loss: 0.8026, test_loss: 0.9358, test_f1: 0.5252
 epoch: 59, train_loss: 0.8009, test_loss: 0.9399, test_f1: 0.5160
 epoch: 60, train_loss: 0.8168, test_loss: 0.9379, test_f1: 0.5237
 epoch: 61, train_loss: 0.8053, test_loss: 0.9410, test_f1: 0.5199
 epoch: 62, train_loss: 0.8054, test_loss: 0.9406, test_f1: 0.5237
 epoch: 63, train_loss: 0.8012, test_loss: 0.9435, test_f1: 0.5244
 epoch: 64, train_loss: 0.7957, test_loss: 0.9434, test_f1: 0.5189
 epoch: 65, train_loss: 0.7932, test_loss: 0.9387, test_f1: 0.5290
 epoch: 66, train_loss: 0.7875, test_loss: 0.9366, test_f1: 0.5258
 epoch: 67, train_loss: 0.7930, test_loss: 0.9357, test_f1: 0.5261
 epoch: 68, train_loss: 0.7883, test_loss: 0.9418, test_f1: 0.5174
 epoch: 69, train_loss: 0.7958, test_loss: 0.9438, test_f1: 0.5215
 epoch: 70, train_loss: 0.7832, test_loss: 0.9426, test_f1: 0.5220
 epoch: 71, train_loss: 0.7893, test_loss: 0.9423, test_f1: 0.5129
 epoch: 72, train_loss: 0.7885, test_loss: 0.9473, test_f1: 0.5129
 epoch: 73, train_loss: 0.7838, test_loss: 0.9393, test_f1: 0.5237
 epoch: 74, train_loss: 0.7835, test_loss: 0.9505, test_f1: 0.5279
 epoch: 75, train_loss: 0.7830, test_loss: 0.9490, test_f1: 0.5230
 epoch: 76, train_loss: 0.7703, test_loss: 0.9491, test_f1: 0.5365
 epoch: 77, train_loss: 0.7816, test_loss: 0.9460, test_f1: 0.5296
 epoch: 78, train_loss: 0.7809, test_loss: 0.9538, test_f1: 0.5292
 epoch: 79, train_loss: 0.7850, test_loss: 0.9529, test_f1: 0.5338
 epoch: 80, train_loss: 0.7875, test_loss: 0.9468, test_f1: 0.5369
 epoch: 81, train_loss: 0.7749, test_loss: 0.9471, test_f1: 0.5210
 epoch: 82, train_loss: 0.7822, test_loss: 0.9391, test_f1: 0.5327
 epoch: 83, train_loss: 0.7763, test_loss: 0.9548, test_f1: 0.5315
 epoch: 84, train_loss: 0.7670, test_loss: 0.9511, test_f1: 0.5295
 epoch: 85, train_loss: 0.7730, test_loss: 0.9513, test_f1: 0.5360
 epoch: 86, train_loss: 0.7706, test_loss: 0.9487, test_f1: 0.5307
 epoch: 87, train_loss: 0.7728, test_loss: 0.9538, test_f1: 0.5281
 epoch: 88, train_loss: 0.7608, test_loss: 0.9405, test_f1: 0.5347
 epoch: 89, train_loss: 0.7676, test_loss: 0.9539, test_f1: 0.5349
 epoch: 90, train_loss: 0.7646, test_loss: 0.9621, test_f1: 0.5351
 epoch: 91, train_loss: 0.7619, test_loss: 0.9576, test_f1: 0.5365
 epoch: 92, train_loss: 0.7600, test_loss: 0.9573, test_f1: 0.5379
 epoch: 93, train_loss: 0.7714, test_loss: 0.9431, test_f1: 0.5402
 epoch: 94, train_loss: 0.7625, test_loss: 0.9459, test_f1: 0.5375
 epoch: 95, train_loss: 0.7616, test_loss: 0.9585, test_f1: 0.5408
 epoch: 96, train_loss: 0.7554, test_loss: 0.9576, test_f1: 0.5434
 epoch: 97, train_loss: 0.7567, test_loss: 0.9558, test_f1: 0.5392
 epoch: 98, train_loss: 0.7515, test_loss: 0.9547, test_f1: 0.5422
 epoch: 99, train_loss: 0.7593, test_loss: 0.9535, test_f1: 0.5483
##################ITERATION #3 ****************************************
 epoch: 0, train_loss: 1.2920, test_loss: 1.3252, test_f1: 0.2270
 epoch: 1, train_loss: 1.2604, test_loss: 1.3145, test_f1: 0.2270
 epoch: 2, train_loss: 1.2484, test_loss: 1.2867, test_f1: 0.2270
 epoch: 3, train_loss: 1.2366, test_loss: 1.2467, test_f1: 0.2270
 epoch: 4, train_loss: 1.2189, test_loss: 1.2133, test_f1: 0.2938
 epoch: 5, train_loss: 1.2062, test_loss: 1.1883, test_f1: 0.3158
 epoch: 6, train_loss: 1.1961, test_loss: 1.1675, test_f1: 0.3698
 epoch: 7, train_loss: 1.1736, test_loss: 1.1481, test_f1: 0.4034
 epoch: 8, train_loss: 1.1660, test_loss: 1.1294, test_f1: 0.4311
 epoch: 9, train_loss: 1.1515, test_loss: 1.1112, test_f1: 0.4460
 epoch: 10, train_loss: 1.1377, test_loss: 1.0937, test_f1: 0.4617
 epoch: 11, train_loss: 1.1184, test_loss: 1.0783, test_f1: 0.4615
 epoch: 12, train_loss: 1.0991, test_loss: 1.0594, test_f1: 0.4727
 epoch: 13, train_loss: 1.0893, test_loss: 1.0377, test_f1: 0.4785
 epoch: 14, train_loss: 1.0735, test_loss: 1.0241, test_f1: 0.4804
 epoch: 15, train_loss: 1.0535, test_loss: 1.0131, test_f1: 0.4959
 epoch: 16, train_loss: 1.0327, test_loss: 0.9871, test_f1: 0.4967
 epoch: 17, train_loss: 1.0299, test_loss: 0.9796, test_f1: 0.4983
 epoch: 18, train_loss: 1.0118, test_loss: 0.9682, test_f1: 0.5001
 epoch: 19, train_loss: 1.0004, test_loss: 0.9531, test_f1: 0.5094
 epoch: 20, train_loss: 0.9911, test_loss: 0.9397, test_f1: 0.5159
 epoch: 21, train_loss: 0.9759, test_loss: 0.9374, test_f1: 0.5159
 epoch: 22, train_loss: 0.9604, test_loss: 0.9367, test_f1: 0.4995
 epoch: 23, train_loss: 0.9569, test_loss: 0.9263, test_f1: 0.5112
 epoch: 24, train_loss: 0.9412, test_loss: 0.9204, test_f1: 0.5087
 epoch: 25, train_loss: 0.9400, test_loss: 0.9135, test_f1: 0.5074
 epoch: 26, train_loss: 0.9372, test_loss: 0.9111, test_f1: 0.5033
 epoch: 27, train_loss: 0.9196, test_loss: 0.8999, test_f1: 0.5220
 epoch: 28, train_loss: 0.9229, test_loss: 0.9055, test_f1: 0.5156
 epoch: 29, train_loss: 0.9178, test_loss: 0.8967, test_f1: 0.5179
 epoch: 30, train_loss: 0.9061, test_loss: 0.8938, test_f1: 0.5138
 epoch: 31, train_loss: 0.8997, test_loss: 0.8988, test_f1: 0.5240
 epoch: 32, train_loss: 0.8918, test_loss: 0.8938, test_f1: 0.5184
 epoch: 33, train_loss: 0.8854, test_loss: 0.8890, test_f1: 0.5213
 epoch: 34, train_loss: 0.8870, test_loss: 0.9058, test_f1: 0.5198
 epoch: 35, train_loss: 0.8799, test_loss: 0.8903, test_f1: 0.5233
 epoch: 36, train_loss: 0.8725, test_loss: 0.8884, test_f1: 0.5163
 epoch: 37, train_loss: 0.8743, test_loss: 0.8915, test_f1: 0.5341
 epoch: 38, train_loss: 0.8795, test_loss: 0.8819, test_f1: 0.5266
 epoch: 39, train_loss: 0.8644, test_loss: 0.8842, test_f1: 0.5385
 epoch: 40, train_loss: 0.8547, test_loss: 0.8849, test_f1: 0.5433
 epoch: 41, train_loss: 0.8561, test_loss: 0.9006, test_f1: 0.5209
 epoch: 42, train_loss: 0.8606, test_loss: 0.8950, test_f1: 0.5387
 epoch: 43, train_loss: 0.8469, test_loss: 0.8916, test_f1: 0.5372
 epoch: 44, train_loss: 0.8537, test_loss: 0.8869, test_f1: 0.5444
 epoch: 45, train_loss: 0.8459, test_loss: 0.8911, test_f1: 0.5389
 epoch: 46, train_loss: 0.8399, test_loss: 0.8904, test_f1: 0.5383
 epoch: 47, train_loss: 0.8295, test_loss: 0.8860, test_f1: 0.5312
 epoch: 48, train_loss: 0.8311, test_loss: 0.8770, test_f1: 0.5421
 epoch: 49, train_loss: 0.8312, test_loss: 0.8897, test_f1: 0.5426
 epoch: 50, train_loss: 0.8192, test_loss: 0.8847, test_f1: 0.5475
 epoch: 51, train_loss: 0.8229, test_loss: 0.8848, test_f1: 0.5493
 epoch: 52, train_loss: 0.8198, test_loss: 0.8899, test_f1: 0.5482
 epoch: 53, train_loss: 0.8222, test_loss: 0.8855, test_f1: 0.5400
 epoch: 54, train_loss: 0.8185, test_loss: 0.8772, test_f1: 0.5501
 epoch: 55, train_loss: 0.8129, test_loss: 0.8890, test_f1: 0.5460
 epoch: 56, train_loss: 0.8105, test_loss: 0.8888, test_f1: 0.5486
 epoch: 57, train_loss: 0.8157, test_loss: 0.8856, test_f1: 0.5343
 epoch: 58, train_loss: 0.8084, test_loss: 0.8837, test_f1: 0.5471
 epoch: 59, train_loss: 0.8064, test_loss: 0.8885, test_f1: 0.5457
 epoch: 60, train_loss: 0.8113, test_loss: 0.8886, test_f1: 0.5399
 epoch: 61, train_loss: 0.8018, test_loss: 0.8808, test_f1: 0.5526
 epoch: 62, train_loss: 0.7998, test_loss: 0.8884, test_f1: 0.5494
 epoch: 63, train_loss: 0.7990, test_loss: 0.8849, test_f1: 0.5500
 epoch: 64, train_loss: 0.8025, test_loss: 0.8996, test_f1: 0.5527
 epoch: 65, train_loss: 0.8011, test_loss: 0.8910, test_f1: 0.5502
 epoch: 66, train_loss: 0.7918, test_loss: 0.8841, test_f1: 0.5323
 epoch: 67, train_loss: 0.8018, test_loss: 0.8874, test_f1: 0.5462
 epoch: 68, train_loss: 0.7913, test_loss: 0.8926, test_f1: 0.5395
 epoch: 69, train_loss: 0.7873, test_loss: 0.8840, test_f1: 0.5423
 epoch: 70, train_loss: 0.7847, test_loss: 0.8859, test_f1: 0.5457
 epoch: 71, train_loss: 0.7861, test_loss: 0.8889, test_f1: 0.5392
 epoch: 72, train_loss: 0.7875, test_loss: 0.8954, test_f1: 0.5442
 epoch: 73, train_loss: 0.7869, test_loss: 0.8877, test_f1: 0.5518
 epoch: 74, train_loss: 0.7797, test_loss: 0.8923, test_f1: 0.5501
 epoch: 75, train_loss: 0.7908, test_loss: 0.8934, test_f1: 0.5433
 epoch: 76, train_loss: 0.7845, test_loss: 0.8923, test_f1: 0.5412
 epoch: 77, train_loss: 0.7823, test_loss: 0.8898, test_f1: 0.5475
 epoch: 78, train_loss: 0.7760, test_loss: 0.8980, test_f1: 0.5519
 epoch: 79, train_loss: 0.7785, test_loss: 0.8901, test_f1: 0.5487
 epoch: 80, train_loss: 0.7773, test_loss: 0.8865, test_f1: 0.5513
 epoch: 81, train_loss: 0.7731, test_loss: 0.8886, test_f1: 0.5521
 epoch: 82, train_loss: 0.7785, test_loss: 0.8974, test_f1: 0.5554
 epoch: 83, train_loss: 0.7676, test_loss: 0.8973, test_f1: 0.5484
 epoch: 84, train_loss: 0.7712, test_loss: 0.8903, test_f1: 0.5441
 epoch: 85, train_loss: 0.7718, test_loss: 0.8981, test_f1: 0.5526
 epoch: 86, train_loss: 0.7740, test_loss: 0.8912, test_f1: 0.5533
 epoch: 87, train_loss: 0.7667, test_loss: 0.8996, test_f1: 0.5492
 epoch: 88, train_loss: 0.7639, test_loss: 0.9106, test_f1: 0.5547
 epoch: 89, train_loss: 0.7703, test_loss: 0.9092, test_f1: 0.5469
 epoch: 90, train_loss: 0.7565, test_loss: 0.9061, test_f1: 0.5504
 epoch: 91, train_loss: 0.7604, test_loss: 0.9012, test_f1: 0.5531
 epoch: 92, train_loss: 0.7629, test_loss: 0.9012, test_f1: 0.5576
 epoch: 93, train_loss: 0.7565, test_loss: 0.8995, test_f1: 0.5382
 epoch: 94, train_loss: 0.7526, test_loss: 0.9042, test_f1: 0.5539
 epoch: 95, train_loss: 0.7594, test_loss: 0.8887, test_f1: 0.5564
 epoch: 96, train_loss: 0.7517, test_loss: 0.8926, test_f1: 0.5581
 epoch: 97, train_loss: 0.7489, test_loss: 0.9036, test_f1: 0.5525
 epoch: 98, train_loss: 0.7497, test_loss: 0.8948, test_f1: 0.5546
 epoch: 99, train_loss: 0.7614, test_loss: 0.8978, test_f1: 0.5548
##################ITERATION #4 ****************************************
 epoch: 0, train_loss: 1.2931, test_loss: 1.3324, test_f1: 0.2270
 epoch: 1, train_loss: 1.2362, test_loss: 1.3113, test_f1: 0.2270
 epoch: 2, train_loss: 1.2235, test_loss: 1.2753, test_f1: 0.2270
 epoch: 3, train_loss: 1.2002, test_loss: 1.2155, test_f1: 0.2766
 epoch: 4, train_loss: 1.1824, test_loss: 1.1647, test_f1: 0.3702
 epoch: 5, train_loss: 1.1659, test_loss: 1.1322, test_f1: 0.3931
 epoch: 6, train_loss: 1.1495, test_loss: 1.1096, test_f1: 0.4005
 epoch: 7, train_loss: 1.1361, test_loss: 1.0911, test_f1: 0.4184
 epoch: 8, train_loss: 1.1210, test_loss: 1.0731, test_f1: 0.4277
 epoch: 9, train_loss: 1.1035, test_loss: 1.0541, test_f1: 0.4451
 epoch: 10, train_loss: 1.0951, test_loss: 1.0388, test_f1: 0.4421
 epoch: 11, train_loss: 1.0783, test_loss: 1.0274, test_f1: 0.4508
 epoch: 12, train_loss: 1.0654, test_loss: 1.0145, test_f1: 0.4716
 epoch: 13, train_loss: 1.0521, test_loss: 1.0020, test_f1: 0.4680
 epoch: 14, train_loss: 1.0389, test_loss: 0.9930, test_f1: 0.4714
 epoch: 15, train_loss: 1.0323, test_loss: 0.9820, test_f1: 0.4890
 epoch: 16, train_loss: 1.0201, test_loss: 0.9721, test_f1: 0.4887
 epoch: 17, train_loss: 1.0048, test_loss: 0.9629, test_f1: 0.4857
 epoch: 18, train_loss: 0.9951, test_loss: 0.9558, test_f1: 0.4941
 epoch: 19, train_loss: 0.9913, test_loss: 0.9498, test_f1: 0.5003
 epoch: 20, train_loss: 0.9814, test_loss: 0.9452, test_f1: 0.4997
 epoch: 21, train_loss: 0.9757, test_loss: 0.9403, test_f1: 0.4944
 epoch: 22, train_loss: 0.9631, test_loss: 0.9322, test_f1: 0.5011
 epoch: 23, train_loss: 0.9616, test_loss: 0.9310, test_f1: 0.4940
 epoch: 24, train_loss: 0.9547, test_loss: 0.9228, test_f1: 0.4953
 epoch: 25, train_loss: 0.9522, test_loss: 0.9218, test_f1: 0.5118
 epoch: 26, train_loss: 0.9416, test_loss: 0.9191, test_f1: 0.5125
 epoch: 27, train_loss: 0.9364, test_loss: 0.9285, test_f1: 0.5124
 epoch: 28, train_loss: 0.9329, test_loss: 0.9192, test_f1: 0.5136
 epoch: 29, train_loss: 0.9216, test_loss: 0.9218, test_f1: 0.5144
 epoch: 30, train_loss: 0.9217, test_loss: 0.9151, test_f1: 0.5189
 epoch: 31, train_loss: 0.9135, test_loss: 0.9184, test_f1: 0.5169
 epoch: 32, train_loss: 0.9068, test_loss: 0.9183, test_f1: 0.5202
 epoch: 33, train_loss: 0.9111, test_loss: 0.9142, test_f1: 0.5280
 epoch: 34, train_loss: 0.9012, test_loss: 0.9129, test_f1: 0.5283
 epoch: 35, train_loss: 0.8947, test_loss: 0.9036, test_f1: 0.5286
 epoch: 36, train_loss: 0.8905, test_loss: 0.8983, test_f1: 0.5253
 epoch: 37, train_loss: 0.8881, test_loss: 0.9001, test_f1: 0.5460
 epoch: 38, train_loss: 0.8849, test_loss: 0.9040, test_f1: 0.5390
 epoch: 39, train_loss: 0.8782, test_loss: 0.9016, test_f1: 0.5403
 epoch: 40, train_loss: 0.8711, test_loss: 0.9006, test_f1: 0.5462
 epoch: 41, train_loss: 0.8819, test_loss: 0.9201, test_f1: 0.5426
 epoch: 42, train_loss: 0.8585, test_loss: 0.9072, test_f1: 0.5439
 epoch: 43, train_loss: 0.8637, test_loss: 0.8961, test_f1: 0.5328
 epoch: 44, train_loss: 0.8618, test_loss: 0.9084, test_f1: 0.5335
 epoch: 45, train_loss: 0.8511, test_loss: 0.9139, test_f1: 0.5306
 epoch: 46, train_loss: 0.8506, test_loss: 0.9040, test_f1: 0.5366
 epoch: 47, train_loss: 0.8482, test_loss: 0.9129, test_f1: 0.5335
 epoch: 48, train_loss: 0.8458, test_loss: 0.9063, test_f1: 0.5456
 epoch: 49, train_loss: 0.8395, test_loss: 0.9000, test_f1: 0.5629
 epoch: 50, train_loss: 0.8411, test_loss: 0.9109, test_f1: 0.5368
 epoch: 51, train_loss: 0.8334, test_loss: 0.8958, test_f1: 0.5405
 epoch: 52, train_loss: 0.8337, test_loss: 0.9009, test_f1: 0.5391
 epoch: 53, train_loss: 0.8241, test_loss: 0.9036, test_f1: 0.5372
 epoch: 54, train_loss: 0.8265, test_loss: 0.9021, test_f1: 0.5331
 epoch: 55, train_loss: 0.8299, test_loss: 0.9094, test_f1: 0.5412
 epoch: 56, train_loss: 0.8203, test_loss: 0.9053, test_f1: 0.5430
 epoch: 57, train_loss: 0.8224, test_loss: 0.9068, test_f1: 0.5430
 epoch: 58, train_loss: 0.8174, test_loss: 0.9004, test_f1: 0.5444
 epoch: 59, train_loss: 0.8219, test_loss: 0.9035, test_f1: 0.5429
 epoch: 60, train_loss: 0.8200, test_loss: 0.9116, test_f1: 0.5424
 epoch: 61, train_loss: 0.8116, test_loss: 0.9001, test_f1: 0.5357
 epoch: 62, train_loss: 0.8026, test_loss: 0.8956, test_f1: 0.5445
 epoch: 63, train_loss: 0.8062, test_loss: 0.9037, test_f1: 0.5420
 epoch: 64, train_loss: 0.8137, test_loss: 0.9059, test_f1: 0.5254
 epoch: 65, train_loss: 0.8066, test_loss: 0.9000, test_f1: 0.5460
 epoch: 66, train_loss: 0.8089, test_loss: 0.9051, test_f1: 0.5480
 epoch: 67, train_loss: 0.8069, test_loss: 0.9013, test_f1: 0.5491
 epoch: 68, train_loss: 0.8067, test_loss: 0.9178, test_f1: 0.5402
 epoch: 69, train_loss: 0.8057, test_loss: 0.9199, test_f1: 0.5455
 epoch: 70, train_loss: 0.7944, test_loss: 0.9093, test_f1: 0.5395
 epoch: 71, train_loss: 0.7985, test_loss: 0.9160, test_f1: 0.5549
 epoch: 72, train_loss: 0.7959, test_loss: 0.9078, test_f1: 0.5444
 epoch: 73, train_loss: 0.7977, test_loss: 0.9027, test_f1: 0.5479
 epoch: 74, train_loss: 0.7923, test_loss: 0.9061, test_f1: 0.5420
 epoch: 75, train_loss: 0.7987, test_loss: 0.9100, test_f1: 0.5343
 epoch: 76, train_loss: 0.7941, test_loss: 0.9054, test_f1: 0.5559
 epoch: 77, train_loss: 0.7838, test_loss: 0.9161, test_f1: 0.5485
 epoch: 78, train_loss: 0.7888, test_loss: 0.9114, test_f1: 0.5569
 epoch: 79, train_loss: 0.7883, test_loss: 0.9054, test_f1: 0.5556
 epoch: 80, train_loss: 0.7949, test_loss: 0.9054, test_f1: 0.5631
 epoch: 81, train_loss: 0.7806, test_loss: 0.8990, test_f1: 0.5662
 epoch: 82, train_loss: 0.7877, test_loss: 0.9022, test_f1: 0.5478
 epoch: 83, train_loss: 0.7842, test_loss: 0.9129, test_f1: 0.5648
 epoch: 84, train_loss: 0.7785, test_loss: 0.9026, test_f1: 0.5533
 epoch: 85, train_loss: 0.7888, test_loss: 0.9043, test_f1: 0.5572
 epoch: 86, train_loss: 0.7788, test_loss: 0.9039, test_f1: 0.5567
 epoch: 87, train_loss: 0.7802, test_loss: 0.9081, test_f1: 0.5502
 epoch: 88, train_loss: 0.7859, test_loss: 0.9022, test_f1: 0.5607
 epoch: 89, train_loss: 0.7769, test_loss: 0.9092, test_f1: 0.5473
 epoch: 90, train_loss: 0.7793, test_loss: 0.9108, test_f1: 0.5455
 epoch: 91, train_loss: 0.7727, test_loss: 0.9051, test_f1: 0.5508
 epoch: 92, train_loss: 0.7861, test_loss: 0.9112, test_f1: 0.5572
 epoch: 93, train_loss: 0.7713, test_loss: 0.9227, test_f1: 0.5520
 epoch: 94, train_loss: 0.7782, test_loss: 0.9045, test_f1: 0.5466
 epoch: 95, train_loss: 0.7703, test_loss: 0.9182, test_f1: 0.5460
 epoch: 96, train_loss: 0.7719, test_loss: 0.9143, test_f1: 0.5480
 epoch: 97, train_loss: 0.7572, test_loss: 0.9084, test_f1: 0.5469
 epoch: 98, train_loss: 0.7715, test_loss: 0.9131, test_f1: 0.5510
 epoch: 99, train_loss: 0.7612, test_loss: 0.9197, test_f1: 0.5469
##################ITERATION #5 ****************************************
 epoch: 0, train_loss: 1.3044, test_loss: 1.3263, test_f1: 0.2270
 epoch: 1, train_loss: 1.2476, test_loss: 1.3055, test_f1: 0.2270
 epoch: 2, train_loss: 1.2140, test_loss: 1.2817, test_f1: 0.2270
 epoch: 3, train_loss: 1.1953, test_loss: 1.2284, test_f1: 0.2270
 epoch: 4, train_loss: 1.1773, test_loss: 1.1754, test_f1: 0.3128
 epoch: 5, train_loss: 1.1483, test_loss: 1.1305, test_f1: 0.4223
 epoch: 6, train_loss: 1.1485, test_loss: 1.0978, test_f1: 0.4447
 epoch: 7, train_loss: 1.1246, test_loss: 1.0797, test_f1: 0.4452
 epoch: 8, train_loss: 1.1149, test_loss: 1.0665, test_f1: 0.4503
 epoch: 9, train_loss: 1.0984, test_loss: 1.0556, test_f1: 0.4469
 epoch: 10, train_loss: 1.0889, test_loss: 1.0413, test_f1: 0.4557
 epoch: 11, train_loss: 1.0698, test_loss: 1.0294, test_f1: 0.4565
 epoch: 12, train_loss: 1.0599, test_loss: 1.0196, test_f1: 0.4608
 epoch: 13, train_loss: 1.0491, test_loss: 1.0099, test_f1: 0.4614
 epoch: 14, train_loss: 1.0398, test_loss: 1.0002, test_f1: 0.4606
 epoch: 15, train_loss: 1.0299, test_loss: 0.9981, test_f1: 0.4673
 epoch: 16, train_loss: 1.0175, test_loss: 0.9839, test_f1: 0.4840
 epoch: 17, train_loss: 1.0091, test_loss: 0.9747, test_f1: 0.4757
 epoch: 18, train_loss: 1.0054, test_loss: 0.9715, test_f1: 0.4837
 epoch: 19, train_loss: 0.9889, test_loss: 0.9658, test_f1: 0.4756
 epoch: 20, train_loss: 0.9871, test_loss: 0.9648, test_f1: 0.4761
 epoch: 21, train_loss: 0.9789, test_loss: 0.9601, test_f1: 0.4796
 epoch: 22, train_loss: 0.9713, test_loss: 0.9521, test_f1: 0.4831
 epoch: 23, train_loss: 0.9626, test_loss: 0.9496, test_f1: 0.4881
 epoch: 24, train_loss: 0.9567, test_loss: 0.9541, test_f1: 0.4802
 epoch: 25, train_loss: 0.9466, test_loss: 0.9536, test_f1: 0.4868
 epoch: 26, train_loss: 0.9473, test_loss: 0.9393, test_f1: 0.4904
 epoch: 27, train_loss: 0.9353, test_loss: 0.9453, test_f1: 0.4861
 epoch: 28, train_loss: 0.9378, test_loss: 0.9407, test_f1: 0.4965
 epoch: 29, train_loss: 0.9270, test_loss: 0.9391, test_f1: 0.4977
 epoch: 30, train_loss: 0.9176, test_loss: 0.9390, test_f1: 0.5024
 epoch: 31, train_loss: 0.9104, test_loss: 0.9368, test_f1: 0.4962
 epoch: 32, train_loss: 0.9024, test_loss: 0.9315, test_f1: 0.5039
 epoch: 33, train_loss: 0.8999, test_loss: 0.9335, test_f1: 0.5008
 epoch: 34, train_loss: 0.8987, test_loss: 0.9324, test_f1: 0.5107
 epoch: 35, train_loss: 0.8967, test_loss: 0.9277, test_f1: 0.5214
 epoch: 36, train_loss: 0.8918, test_loss: 0.9290, test_f1: 0.5059
 epoch: 37, train_loss: 0.8832, test_loss: 0.9363, test_f1: 0.5256
 epoch: 38, train_loss: 0.8803, test_loss: 0.9268, test_f1: 0.5231
 epoch: 39, train_loss: 0.8747, test_loss: 0.9320, test_f1: 0.5319
 epoch: 40, train_loss: 0.8755, test_loss: 0.9377, test_f1: 0.5175
 epoch: 41, train_loss: 0.8613, test_loss: 0.9243, test_f1: 0.5308
 epoch: 42, train_loss: 0.8564, test_loss: 0.9314, test_f1: 0.5262
 epoch: 43, train_loss: 0.8582, test_loss: 0.9300, test_f1: 0.5367
 epoch: 44, train_loss: 0.8617, test_loss: 0.9359, test_f1: 0.5357
 epoch: 45, train_loss: 0.8523, test_loss: 0.9344, test_f1: 0.5303
 epoch: 46, train_loss: 0.8476, test_loss: 0.9370, test_f1: 0.5410
 epoch: 47, train_loss: 0.8436, test_loss: 0.9186, test_f1: 0.5437
 epoch: 48, train_loss: 0.8445, test_loss: 0.9377, test_f1: 0.5431
 epoch: 49, train_loss: 0.8370, test_loss: 0.9345, test_f1: 0.5361
 epoch: 50, train_loss: 0.8359, test_loss: 0.9390, test_f1: 0.5362
 epoch: 51, train_loss: 0.8331, test_loss: 0.9298, test_f1: 0.5458
 epoch: 52, train_loss: 0.8213, test_loss: 0.9396, test_f1: 0.5502
 epoch: 53, train_loss: 0.8208, test_loss: 0.9355, test_f1: 0.5445
 epoch: 54, train_loss: 0.8142, test_loss: 0.9364, test_f1: 0.5434
 epoch: 55, train_loss: 0.8121, test_loss: 0.9354, test_f1: 0.5471
 epoch: 56, train_loss: 0.8263, test_loss: 0.9231, test_f1: 0.5551
 epoch: 57, train_loss: 0.8084, test_loss: 0.9331, test_f1: 0.5456
 epoch: 58, train_loss: 0.8140, test_loss: 0.9393, test_f1: 0.5495
 epoch: 59, train_loss: 0.8092, test_loss: 0.9314, test_f1: 0.5473
 epoch: 60, train_loss: 0.8131, test_loss: 0.9359, test_f1: 0.5572
 epoch: 61, train_loss: 0.8132, test_loss: 0.9344, test_f1: 0.5524
 epoch: 62, train_loss: 0.8109, test_loss: 0.9394, test_f1: 0.5462
 epoch: 63, train_loss: 0.8181, test_loss: 0.9288, test_f1: 0.5523
 epoch: 64, train_loss: 0.8068, test_loss: 0.9468, test_f1: 0.5427
 epoch: 65, train_loss: 0.8060, test_loss: 0.9482, test_f1: 0.5568
 epoch: 66, train_loss: 0.7996, test_loss: 0.9479, test_f1: 0.5605
 epoch: 67, train_loss: 0.8020, test_loss: 0.9572, test_f1: 0.5462
 epoch: 68, train_loss: 0.8087, test_loss: 0.9341, test_f1: 0.5473
 epoch: 69, train_loss: 0.7986, test_loss: 0.9386, test_f1: 0.5534
 epoch: 70, train_loss: 0.7991, test_loss: 0.9495, test_f1: 0.5516
 epoch: 71, train_loss: 0.8023, test_loss: 0.9380, test_f1: 0.5601
 epoch: 72, train_loss: 0.7932, test_loss: 0.9414, test_f1: 0.5565
 epoch: 73, train_loss: 0.7928, test_loss: 0.9396, test_f1: 0.5470
 epoch: 74, train_loss: 0.7917, test_loss: 0.9367, test_f1: 0.5474
 epoch: 75, train_loss: 0.7874, test_loss: 0.9452, test_f1: 0.5395
 epoch: 76, train_loss: 0.7951, test_loss: 0.9365, test_f1: 0.5534
 epoch: 77, train_loss: 0.7924, test_loss: 0.9487, test_f1: 0.5459
 epoch: 78, train_loss: 0.7912, test_loss: 0.9339, test_f1: 0.5594
 epoch: 79, train_loss: 0.7804, test_loss: 0.9412, test_f1: 0.5589
 epoch: 80, train_loss: 0.7917, test_loss: 0.9285, test_f1: 0.5602
 epoch: 81, train_loss: 0.7861, test_loss: 0.9501, test_f1: 0.5480
 epoch: 82, train_loss: 0.7791, test_loss: 0.9516, test_f1: 0.5477
 epoch: 83, train_loss: 0.7725, test_loss: 0.9576, test_f1: 0.5551
 epoch: 84, train_loss: 0.7727, test_loss: 0.9481, test_f1: 0.5585
 epoch: 85, train_loss: 0.7838, test_loss: 0.9305, test_f1: 0.5556
 epoch: 86, train_loss: 0.7837, test_loss: 0.9484, test_f1: 0.5552
 epoch: 87, train_loss: 0.7755, test_loss: 0.9592, test_f1: 0.5482
 epoch: 88, train_loss: 0.7711, test_loss: 0.9465, test_f1: 0.5574
 epoch: 89, train_loss: 0.7678, test_loss: 0.9458, test_f1: 0.5516
 epoch: 90, train_loss: 0.7715, test_loss: 0.9479, test_f1: 0.5485
 epoch: 91, train_loss: 0.7756, test_loss: 0.9496, test_f1: 0.5489
 epoch: 92, train_loss: 0.7698, test_loss: 0.9626, test_f1: 0.5492
 epoch: 93, train_loss: 0.7647, test_loss: 0.9485, test_f1: 0.5496
 epoch: 94, train_loss: 0.7830, test_loss: 0.9552, test_f1: 0.5422
 epoch: 95, train_loss: 0.7723, test_loss: 0.9574, test_f1: 0.5499
 epoch: 96, train_loss: 0.7765, test_loss: 0.9496, test_f1: 0.5435
 epoch: 97, train_loss: 0.7635, test_loss: 0.9607, test_f1: 0.5505
 epoch: 98, train_loss: 0.7656, test_loss: 0.9520, test_f1: 0.5433
 epoch: 99, train_loss: 0.7618, test_loss: 0.9607, test_f1: 0.5477
##################ITERATION #6 ****************************************
 epoch: 0, train_loss: 1.3383, test_loss: 1.3704, test_f1: 0.2270
 epoch: 1, train_loss: 1.2480, test_loss: 1.3320, test_f1: 0.2270
 epoch: 2, train_loss: 1.2119, test_loss: 1.2771, test_f1: 0.2295
 epoch: 3, train_loss: 1.1906, test_loss: 1.1995, test_f1: 0.3627
 epoch: 4, train_loss: 1.1742, test_loss: 1.1485, test_f1: 0.3834
 epoch: 5, train_loss: 1.1527, test_loss: 1.1057, test_f1: 0.4133
 epoch: 6, train_loss: 1.1353, test_loss: 1.0848, test_f1: 0.4358
 epoch: 7, train_loss: 1.1204, test_loss: 1.0639, test_f1: 0.4521
 epoch: 8, train_loss: 1.1013, test_loss: 1.0470, test_f1: 0.4588
 epoch: 9, train_loss: 1.0882, test_loss: 1.0384, test_f1: 0.4560
 epoch: 10, train_loss: 1.0588, test_loss: 1.0265, test_f1: 0.4650
 epoch: 11, train_loss: 1.0552, test_loss: 1.0133, test_f1: 0.4748
 epoch: 12, train_loss: 1.0531, test_loss: 1.0166, test_f1: 0.4768
 epoch: 13, train_loss: 1.0278, test_loss: 0.9990, test_f1: 0.4790
 epoch: 14, train_loss: 1.0199, test_loss: 0.9889, test_f1: 0.4834
 epoch: 15, train_loss: 1.0127, test_loss: 0.9855, test_f1: 0.4883
 epoch: 16, train_loss: 1.0044, test_loss: 0.9722, test_f1: 0.4882
 epoch: 17, train_loss: 0.9848, test_loss: 0.9671, test_f1: 0.4850
 epoch: 18, train_loss: 0.9902, test_loss: 0.9782, test_f1: 0.4880
 epoch: 19, train_loss: 0.9753, test_loss: 0.9685, test_f1: 0.4969
 epoch: 20, train_loss: 0.9728, test_loss: 0.9633, test_f1: 0.4886
 epoch: 21, train_loss: 0.9552, test_loss: 0.9688, test_f1: 0.4844
 epoch: 22, train_loss: 0.9546, test_loss: 0.9480, test_f1: 0.4974
 epoch: 23, train_loss: 0.9465, test_loss: 0.9537, test_f1: 0.4945
 epoch: 24, train_loss: 0.9535, test_loss: 0.9686, test_f1: 0.5031
 epoch: 25, train_loss: 0.9400, test_loss: 0.9591, test_f1: 0.5094
 epoch: 26, train_loss: 0.9317, test_loss: 0.9481, test_f1: 0.4865
 epoch: 27, train_loss: 0.9392, test_loss: 0.9604, test_f1: 0.4876
 epoch: 28, train_loss: 0.9234, test_loss: 0.9483, test_f1: 0.4879
 epoch: 29, train_loss: 0.9181, test_loss: 0.9468, test_f1: 0.4993
 epoch: 30, train_loss: 0.9117, test_loss: 0.9646, test_f1: 0.4910
 epoch: 31, train_loss: 0.9144, test_loss: 0.9526, test_f1: 0.5118
 epoch: 32, train_loss: 0.9048, test_loss: 0.9630, test_f1: 0.4909
 epoch: 33, train_loss: 0.9142, test_loss: 0.9400, test_f1: 0.5184
 epoch: 34, train_loss: 0.8944, test_loss: 0.9559, test_f1: 0.5080
 epoch: 35, train_loss: 0.8922, test_loss: 0.9410, test_f1: 0.5206
 epoch: 36, train_loss: 0.8947, test_loss: 0.9518, test_f1: 0.5195
 epoch: 37, train_loss: 0.8918, test_loss: 0.9491, test_f1: 0.5333
 epoch: 38, train_loss: 0.8798, test_loss: 0.9617, test_f1: 0.5131
 epoch: 39, train_loss: 0.8852, test_loss: 0.9506, test_f1: 0.5272
 epoch: 40, train_loss: 0.8720, test_loss: 0.9509, test_f1: 0.5164
 epoch: 41, train_loss: 0.8776, test_loss: 0.9502, test_f1: 0.5245
 epoch: 42, train_loss: 0.8753, test_loss: 0.9622, test_f1: 0.5281
 epoch: 43, train_loss: 0.8630, test_loss: 0.9572, test_f1: 0.5358
 epoch: 44, train_loss: 0.8614, test_loss: 0.9698, test_f1: 0.5293
 epoch: 45, train_loss: 0.8614, test_loss: 0.9490, test_f1: 0.5317
 epoch: 46, train_loss: 0.8513, test_loss: 0.9588, test_f1: 0.5269
 epoch: 47, train_loss: 0.8524, test_loss: 0.9758, test_f1: 0.5229
 epoch: 48, train_loss: 0.8502, test_loss: 0.9746, test_f1: 0.5271
 epoch: 49, train_loss: 0.8446, test_loss: 0.9728, test_f1: 0.5293
 epoch: 50, train_loss: 0.8464, test_loss: 0.9617, test_f1: 0.5218
 epoch: 51, train_loss: 0.8480, test_loss: 0.9811, test_f1: 0.5274
 epoch: 52, train_loss: 0.8341, test_loss: 0.9760, test_f1: 0.5222
 epoch: 53, train_loss: 0.8417, test_loss: 0.9774, test_f1: 0.5252
 epoch: 54, train_loss: 0.8323, test_loss: 0.9843, test_f1: 0.5316
 epoch: 55, train_loss: 0.8292, test_loss: 0.9696, test_f1: 0.5280
 epoch: 56, train_loss: 0.8367, test_loss: 0.9682, test_f1: 0.5238
 epoch: 57, train_loss: 0.8259, test_loss: 0.9753, test_f1: 0.5216
 epoch: 58, train_loss: 0.8338, test_loss: 0.9691, test_f1: 0.5220
 epoch: 59, train_loss: 0.8296, test_loss: 0.9744, test_f1: 0.5293
 epoch: 60, train_loss: 0.8276, test_loss: 0.9785, test_f1: 0.5295
 epoch: 61, train_loss: 0.8414, test_loss: 0.9752, test_f1: 0.5310
 epoch: 62, train_loss: 0.8184, test_loss: 0.9762, test_f1: 0.5196
 epoch: 63, train_loss: 0.8229, test_loss: 0.9807, test_f1: 0.5166
 epoch: 64, train_loss: 0.8180, test_loss: 0.9900, test_f1: 0.5214
 epoch: 65, train_loss: 0.8188, test_loss: 0.9648, test_f1: 0.5280
 epoch: 66, train_loss: 0.8188, test_loss: 0.9841, test_f1: 0.5258
 epoch: 67, train_loss: 0.8247, test_loss: 0.9758, test_f1: 0.5278
 epoch: 68, train_loss: 0.8184, test_loss: 0.9817, test_f1: 0.5299
 epoch: 69, train_loss: 0.8168, test_loss: 0.9792, test_f1: 0.5248
 epoch: 70, train_loss: 0.8166, test_loss: 0.9800, test_f1: 0.5225
 epoch: 71, train_loss: 0.8134, test_loss: 0.9851, test_f1: 0.5300
 epoch: 72, train_loss: 0.8178, test_loss: 0.9895, test_f1: 0.5158
 epoch: 73, train_loss: 0.8149, test_loss: 0.9818, test_f1: 0.5155
 epoch: 74, train_loss: 0.8107, test_loss: 0.9810, test_f1: 0.5153
 epoch: 75, train_loss: 0.8033, test_loss: 0.9797, test_f1: 0.5133
 epoch: 76, train_loss: 0.8174, test_loss: 0.9839, test_f1: 0.5149
 epoch: 77, train_loss: 0.8068, test_loss: 0.9836, test_f1: 0.5141
 epoch: 78, train_loss: 0.8060, test_loss: 0.9955, test_f1: 0.5124
 epoch: 79, train_loss: 0.8047, test_loss: 0.9870, test_f1: 0.5148
 epoch: 80, train_loss: 0.8006, test_loss: 0.9961, test_f1: 0.5175
 epoch: 81, train_loss: 0.8039, test_loss: 0.9880, test_f1: 0.5152
 epoch: 82, train_loss: 0.8017, test_loss: 1.0012, test_f1: 0.5175
 epoch: 83, train_loss: 0.8156, test_loss: 0.9985, test_f1: 0.5173
 epoch: 84, train_loss: 0.7983, test_loss: 0.9782, test_f1: 0.5176
 epoch: 85, train_loss: 0.7918, test_loss: 0.9780, test_f1: 0.5191
 epoch: 86, train_loss: 0.7924, test_loss: 0.9869, test_f1: 0.5179
 epoch: 87, train_loss: 0.7880, test_loss: 0.9869, test_f1: 0.5188
 epoch: 88, train_loss: 0.7915, test_loss: 0.9947, test_f1: 0.5239
 epoch: 89, train_loss: 0.7945, test_loss: 0.9924, test_f1: 0.5174
 epoch: 90, train_loss: 0.7969, test_loss: 0.9903, test_f1: 0.5133
 epoch: 91, train_loss: 0.7907, test_loss: 0.9851, test_f1: 0.5187
 epoch: 92, train_loss: 0.7918, test_loss: 1.0103, test_f1: 0.5169
 epoch: 93, train_loss: 0.7956, test_loss: 1.0124, test_f1: 0.5154
 epoch: 94, train_loss: 0.7918, test_loss: 1.0036, test_f1: 0.5166
 epoch: 95, train_loss: 0.7924, test_loss: 0.9972, test_f1: 0.5247
 epoch: 96, train_loss: 0.7897, test_loss: 0.9988, test_f1: 0.5203
 epoch: 97, train_loss: 0.7819, test_loss: 0.9974, test_f1: 0.5188
 epoch: 98, train_loss: 0.7860, test_loss: 1.0033, test_f1: 0.5218
 epoch: 99, train_loss: 0.7839, test_loss: 1.0037, test_f1: 0.5258
##################ITERATION #7 ****************************************
 epoch: 0, train_loss: 1.3077, test_loss: 1.3281, test_f1: 0.2270
 epoch: 1, train_loss: 1.2270, test_loss: 1.3097, test_f1: 0.2270
 epoch: 2, train_loss: 1.2017, test_loss: 1.2874, test_f1: 0.2320
 epoch: 3, train_loss: 1.1808, test_loss: 1.2535, test_f1: 0.3342
 epoch: 4, train_loss: 1.1650, test_loss: 1.1907, test_f1: 0.3533
 epoch: 5, train_loss: 1.1456, test_loss: 1.1271, test_f1: 0.3967
 epoch: 6, train_loss: 1.1253, test_loss: 1.0887, test_f1: 0.4291
 epoch: 7, train_loss: 1.1184, test_loss: 1.0625, test_f1: 0.4530
 epoch: 8, train_loss: 1.0991, test_loss: 1.0418, test_f1: 0.4443
 epoch: 9, train_loss: 1.0826, test_loss: 1.0328, test_f1: 0.4390
 epoch: 10, train_loss: 1.0667, test_loss: 1.0148, test_f1: 0.4460
 epoch: 11, train_loss: 1.0542, test_loss: 1.0018, test_f1: 0.4453
 epoch: 12, train_loss: 1.0429, test_loss: 0.9897, test_f1: 0.4678
 epoch: 13, train_loss: 1.0385, test_loss: 0.9834, test_f1: 0.4666
 epoch: 14, train_loss: 1.0222, test_loss: 0.9715, test_f1: 0.4905
 epoch: 15, train_loss: 1.0225, test_loss: 0.9662, test_f1: 0.4894
 epoch: 16, train_loss: 1.0164, test_loss: 0.9605, test_f1: 0.4989
 epoch: 17, train_loss: 1.0028, test_loss: 0.9553, test_f1: 0.5030
 epoch: 18, train_loss: 0.9938, test_loss: 0.9495, test_f1: 0.5103
 epoch: 19, train_loss: 0.9837, test_loss: 0.9472, test_f1: 0.5086
 epoch: 20, train_loss: 0.9769, test_loss: 0.9389, test_f1: 0.5067
 epoch: 21, train_loss: 0.9744, test_loss: 0.9352, test_f1: 0.5075
 epoch: 22, train_loss: 0.9520, test_loss: 0.9394, test_f1: 0.4993
 epoch: 23, train_loss: 0.9603, test_loss: 0.9270, test_f1: 0.5165
 epoch: 24, train_loss: 0.9582, test_loss: 0.9398, test_f1: 0.5110
 epoch: 25, train_loss: 0.9439, test_loss: 0.9250, test_f1: 0.5106
 epoch: 26, train_loss: 0.9394, test_loss: 0.9269, test_f1: 0.5078
 epoch: 27, train_loss: 0.9357, test_loss: 0.9386, test_f1: 0.5050
 epoch: 28, train_loss: 0.9362, test_loss: 0.9210, test_f1: 0.5225
 epoch: 29, train_loss: 0.9258, test_loss: 0.9308, test_f1: 0.5167
 epoch: 30, train_loss: 0.9225, test_loss: 0.9240, test_f1: 0.5172
 epoch: 31, train_loss: 0.9240, test_loss: 0.9256, test_f1: 0.5182
 epoch: 32, train_loss: 0.9112, test_loss: 0.9244, test_f1: 0.5190
 epoch: 33, train_loss: 0.9123, test_loss: 0.9316, test_f1: 0.5131
 epoch: 34, train_loss: 0.8971, test_loss: 0.9448, test_f1: 0.5110
 epoch: 35, train_loss: 0.8925, test_loss: 0.9179, test_f1: 0.5116
 epoch: 36, train_loss: 0.8963, test_loss: 0.9327, test_f1: 0.5268
 epoch: 37, train_loss: 0.8875, test_loss: 0.9331, test_f1: 0.5340
 epoch: 38, train_loss: 0.8849, test_loss: 0.9249, test_f1: 0.5200
 epoch: 39, train_loss: 0.8821, test_loss: 0.9366, test_f1: 0.5218
 epoch: 40, train_loss: 0.8763, test_loss: 0.9083, test_f1: 0.5368
 epoch: 41, train_loss: 0.8788, test_loss: 0.9227, test_f1: 0.5374
 epoch: 42, train_loss: 0.8736, test_loss: 0.9322, test_f1: 0.5350
 epoch: 43, train_loss: 0.8649, test_loss: 0.9224, test_f1: 0.5154
 epoch: 44, train_loss: 0.8622, test_loss: 0.9166, test_f1: 0.5319
 epoch: 45, train_loss: 0.8567, test_loss: 0.9403, test_f1: 0.5234
 epoch: 46, train_loss: 0.8607, test_loss: 0.9135, test_f1: 0.5348
 epoch: 47, train_loss: 0.8490, test_loss: 0.9322, test_f1: 0.5269
 epoch: 48, train_loss: 0.8493, test_loss: 0.9865, test_f1: 0.5096
 epoch: 49, train_loss: 0.8468, test_loss: 0.9220, test_f1: 0.5397
 epoch: 50, train_loss: 0.8440, test_loss: 0.9252, test_f1: 0.5314
 epoch: 51, train_loss: 0.8468, test_loss: 0.9415, test_f1: 0.5386
 epoch: 52, train_loss: 0.8385, test_loss: 0.9250, test_f1: 0.5315
 epoch: 53, train_loss: 0.8289, test_loss: 0.9444, test_f1: 0.5220
 epoch: 54, train_loss: 0.8393, test_loss: 0.9339, test_f1: 0.5360
 epoch: 55, train_loss: 0.8375, test_loss: 0.9381, test_f1: 0.5307
 epoch: 56, train_loss: 0.8326, test_loss: 0.9357, test_f1: 0.5336
 epoch: 57, train_loss: 0.8299, test_loss: 0.9384, test_f1: 0.5458
 epoch: 58, train_loss: 0.8304, test_loss: 0.9536, test_f1: 0.5475
 epoch: 59, train_loss: 0.8207, test_loss: 0.9462, test_f1: 0.5531
 epoch: 60, train_loss: 0.8235, test_loss: 0.9494, test_f1: 0.5459
 epoch: 61, train_loss: 0.8166, test_loss: 0.9518, test_f1: 0.5440
 epoch: 62, train_loss: 0.8235, test_loss: 0.9435, test_f1: 0.5272
 epoch: 63, train_loss: 0.8220, test_loss: 0.9379, test_f1: 0.5268
 epoch: 64, train_loss: 0.8148, test_loss: 0.9329, test_f1: 0.5180
 epoch: 65, train_loss: 0.8225, test_loss: 0.9274, test_f1: 0.5409
 epoch: 66, train_loss: 0.8081, test_loss: 0.9396, test_f1: 0.5407
 epoch: 67, train_loss: 0.8079, test_loss: 0.9485, test_f1: 0.5364
 epoch: 68, train_loss: 0.8134, test_loss: 0.9581, test_f1: 0.5255
 epoch: 69, train_loss: 0.8034, test_loss: 0.9414, test_f1: 0.5468
 epoch: 70, train_loss: 0.8085, test_loss: 0.9610, test_f1: 0.5244
 epoch: 71, train_loss: 0.8077, test_loss: 0.9464, test_f1: 0.5354
 epoch: 72, train_loss: 0.8115, test_loss: 0.9526, test_f1: 0.5222
 epoch: 73, train_loss: 0.8048, test_loss: 0.9793, test_f1: 0.5383
 epoch: 74, train_loss: 0.8005, test_loss: 0.9581, test_f1: 0.5392
 epoch: 75, train_loss: 0.8025, test_loss: 0.9549, test_f1: 0.5430
 epoch: 76, train_loss: 0.7999, test_loss: 0.9610, test_f1: 0.5363
 epoch: 77, train_loss: 0.7972, test_loss: 0.9656, test_f1: 0.5399
 epoch: 78, train_loss: 0.7982, test_loss: 0.9576, test_f1: 0.5400
 epoch: 79, train_loss: 0.7919, test_loss: 0.9416, test_f1: 0.5406
 epoch: 80, train_loss: 0.7988, test_loss: 0.9559, test_f1: 0.5428
 epoch: 81, train_loss: 0.7890, test_loss: 0.9825, test_f1: 0.5483
 epoch: 82, train_loss: 0.7954, test_loss: 0.9523, test_f1: 0.5375
 epoch: 83, train_loss: 0.7925, test_loss: 0.9663, test_f1: 0.5388
 epoch: 84, train_loss: 0.7841, test_loss: 0.9846, test_f1: 0.5356
 epoch: 85, train_loss: 0.7878, test_loss: 0.9608, test_f1: 0.5403
 epoch: 86, train_loss: 0.7857, test_loss: 0.9524, test_f1: 0.5331
 epoch: 87, train_loss: 0.7857, test_loss: 0.9678, test_f1: 0.5488
 epoch: 88, train_loss: 0.7904, test_loss: 0.9543, test_f1: 0.5476
 epoch: 89, train_loss: 0.7777, test_loss: 0.9697, test_f1: 0.5288
 epoch: 90, train_loss: 0.7872, test_loss: 0.9735, test_f1: 0.5384
 epoch: 91, train_loss: 0.7792, test_loss: 0.9471, test_f1: 0.5425
 epoch: 92, train_loss: 0.7823, test_loss: 0.9578, test_f1: 0.5384
 epoch: 93, train_loss: 0.7754, test_loss: 0.9309, test_f1: 0.5488
 epoch: 94, train_loss: 0.7806, test_loss: 0.9425, test_f1: 0.5503
 epoch: 95, train_loss: 0.7767, test_loss: 0.9353, test_f1: 0.5480
 epoch: 96, train_loss: 0.7733, test_loss: 0.9760, test_f1: 0.5490
 epoch: 97, train_loss: 0.7766, test_loss: 0.9458, test_f1: 0.5477
 epoch: 98, train_loss: 0.7689, test_loss: 0.9405, test_f1: 0.5490
 epoch: 99, train_loss: 0.7684, test_loss: 0.9356, test_f1: 0.5517
##################ITERATION #8 ****************************************
 epoch: 0, train_loss: 1.3405, test_loss: 1.3155, test_f1: 0.2270
 epoch: 1, train_loss: 1.2312, test_loss: 1.3086, test_f1: 0.2270
 epoch: 2, train_loss: 1.2123, test_loss: 1.2718, test_f1: 0.3068
 epoch: 3, train_loss: 1.1888, test_loss: 1.2298, test_f1: 0.3113
 epoch: 4, train_loss: 1.1558, test_loss: 1.1630, test_f1: 0.3876
 epoch: 5, train_loss: 1.1413, test_loss: 1.1142, test_f1: 0.4329
 epoch: 6, train_loss: 1.1221, test_loss: 1.0762, test_f1: 0.4571
 epoch: 7, train_loss: 1.1051, test_loss: 1.0588, test_f1: 0.4659
 epoch: 8, train_loss: 1.0871, test_loss: 1.0489, test_f1: 0.4780
 epoch: 9, train_loss: 1.0706, test_loss: 1.0364, test_f1: 0.4788
 epoch: 10, train_loss: 1.0633, test_loss: 1.0205, test_f1: 0.4791
 epoch: 11, train_loss: 1.0394, test_loss: 0.9994, test_f1: 0.4901
 epoch: 12, train_loss: 1.0250, test_loss: 0.9864, test_f1: 0.4990
 epoch: 13, train_loss: 1.0192, test_loss: 0.9838, test_f1: 0.5009
 epoch: 14, train_loss: 1.0104, test_loss: 0.9732, test_f1: 0.5112
 epoch: 15, train_loss: 1.0025, test_loss: 0.9726, test_f1: 0.5089
 epoch: 16, train_loss: 0.9924, test_loss: 0.9742, test_f1: 0.5024
 epoch: 17, train_loss: 0.9774, test_loss: 0.9700, test_f1: 0.5032
 epoch: 18, train_loss: 0.9705, test_loss: 0.9626, test_f1: 0.5160
 epoch: 19, train_loss: 0.9637, test_loss: 0.9570, test_f1: 0.5062
 epoch: 20, train_loss: 0.9588, test_loss: 0.9536, test_f1: 0.5168
 epoch: 21, train_loss: 0.9434, test_loss: 0.9513, test_f1: 0.5170
 epoch: 22, train_loss: 0.9400, test_loss: 0.9481, test_f1: 0.5189
 epoch: 23, train_loss: 0.9337, test_loss: 0.9404, test_f1: 0.5148
 epoch: 24, train_loss: 0.9158, test_loss: 0.9456, test_f1: 0.5136
 epoch: 25, train_loss: 0.9214, test_loss: 0.9489, test_f1: 0.5162
 epoch: 26, train_loss: 0.9174, test_loss: 0.9503, test_f1: 0.5047
 epoch: 27, train_loss: 0.9073, test_loss: 0.9375, test_f1: 0.5247
 epoch: 28, train_loss: 0.9067, test_loss: 0.9373, test_f1: 0.5277
 epoch: 29, train_loss: 0.9028, test_loss: 0.9472, test_f1: 0.5248
 epoch: 30, train_loss: 0.8832, test_loss: 0.9396, test_f1: 0.5179
 epoch: 31, train_loss: 0.8820, test_loss: 0.9320, test_f1: 0.5247
 epoch: 32, train_loss: 0.8804, test_loss: 0.9420, test_f1: 0.5089
 epoch: 33, train_loss: 0.8700, test_loss: 0.9346, test_f1: 0.5214
 epoch: 34, train_loss: 0.8681, test_loss: 0.9539, test_f1: 0.5210
 epoch: 35, train_loss: 0.8643, test_loss: 0.9356, test_f1: 0.5203
 epoch: 36, train_loss: 0.8629, test_loss: 0.9518, test_f1: 0.5199
 epoch: 37, train_loss: 0.8651, test_loss: 0.9487, test_f1: 0.5289
 epoch: 38, train_loss: 0.8529, test_loss: 0.9357, test_f1: 0.5244
 epoch: 39, train_loss: 0.8501, test_loss: 0.9556, test_f1: 0.5216
 epoch: 40, train_loss: 0.8457, test_loss: 0.9586, test_f1: 0.5232
 epoch: 41, train_loss: 0.8441, test_loss: 0.9812, test_f1: 0.5253
 epoch: 42, train_loss: 0.8375, test_loss: 0.9501, test_f1: 0.5260
 epoch: 43, train_loss: 0.8477, test_loss: 0.9467, test_f1: 0.5350
 epoch: 44, train_loss: 0.8396, test_loss: 0.9780, test_f1: 0.5187
 epoch: 45, train_loss: 0.8364, test_loss: 0.9666, test_f1: 0.5316
 epoch: 46, train_loss: 0.8296, test_loss: 0.9513, test_f1: 0.5248
 epoch: 47, train_loss: 0.8277, test_loss: 0.9664, test_f1: 0.5236
 epoch: 48, train_loss: 0.8271, test_loss: 0.9503, test_f1: 0.5438
 epoch: 49, train_loss: 0.8222, test_loss: 0.9701, test_f1: 0.5350
 epoch: 50, train_loss: 0.8161, test_loss: 0.9793, test_f1: 0.5391
 epoch: 51, train_loss: 0.8177, test_loss: 0.9727, test_f1: 0.5311
 epoch: 52, train_loss: 0.8155, test_loss: 0.9676, test_f1: 0.5370
 epoch: 53, train_loss: 0.8097, test_loss: 0.9758, test_f1: 0.5420
 epoch: 54, train_loss: 0.8093, test_loss: 0.9688, test_f1: 0.5419
 epoch: 55, train_loss: 0.8028, test_loss: 0.9617, test_f1: 0.5408
 epoch: 56, train_loss: 0.8106, test_loss: 0.9563, test_f1: 0.5444
 epoch: 57, train_loss: 0.8013, test_loss: 0.9744, test_f1: 0.5429
 epoch: 58, train_loss: 0.7993, test_loss: 0.9676, test_f1: 0.5571
 epoch: 59, train_loss: 0.7960, test_loss: 0.9643, test_f1: 0.5518
 epoch: 60, train_loss: 0.7955, test_loss: 0.9715, test_f1: 0.5527
 epoch: 61, train_loss: 0.7984, test_loss: 0.9659, test_f1: 0.5507
 epoch: 62, train_loss: 0.7915, test_loss: 0.9771, test_f1: 0.5409
 epoch: 63, train_loss: 0.7831, test_loss: 0.9717, test_f1: 0.5448
 epoch: 64, train_loss: 0.7889, test_loss: 0.9700, test_f1: 0.5482
 epoch: 65, train_loss: 0.7907, test_loss: 0.9662, test_f1: 0.5551
 epoch: 66, train_loss: 0.7888, test_loss: 0.9767, test_f1: 0.5602
 epoch: 67, train_loss: 0.7860, test_loss: 0.9725, test_f1: 0.5521
 epoch: 68, train_loss: 0.7835, test_loss: 0.9732, test_f1: 0.5514
 epoch: 69, train_loss: 0.7868, test_loss: 0.9808, test_f1: 0.5545
 epoch: 70, train_loss: 0.7858, test_loss: 0.9767, test_f1: 0.5501
 epoch: 71, train_loss: 0.7863, test_loss: 0.9791, test_f1: 0.5617
 epoch: 72, train_loss: 0.7819, test_loss: 0.9817, test_f1: 0.5668
 epoch: 73, train_loss: 0.7844, test_loss: 0.9972, test_f1: 0.5504
 epoch: 74, train_loss: 0.7900, test_loss: 0.9888, test_f1: 0.5640
 epoch: 75, train_loss: 0.7758, test_loss: 0.9812, test_f1: 0.5663
 epoch: 76, train_loss: 0.7768, test_loss: 0.9792, test_f1: 0.5619
 epoch: 77, train_loss: 0.7674, test_loss: 0.9835, test_f1: 0.5528
 epoch: 78, train_loss: 0.7847, test_loss: 0.9815, test_f1: 0.5619
 epoch: 79, train_loss: 0.7724, test_loss: 0.9797, test_f1: 0.5663
 epoch: 80, train_loss: 0.7724, test_loss: 0.9785, test_f1: 0.5637
 epoch: 81, train_loss: 0.7724, test_loss: 0.9996, test_f1: 0.5569
 epoch: 82, train_loss: 0.7716, test_loss: 0.9881, test_f1: 0.5622
 epoch: 83, train_loss: 0.7700, test_loss: 0.9856, test_f1: 0.5766
 epoch: 84, train_loss: 0.7665, test_loss: 0.9933, test_f1: 0.5543
 epoch: 85, train_loss: 0.7762, test_loss: 0.9896, test_f1: 0.5665
 epoch: 86, train_loss: 0.7750, test_loss: 0.9909, test_f1: 0.5542
 epoch: 87, train_loss: 0.7629, test_loss: 0.9823, test_f1: 0.5645
 epoch: 88, train_loss: 0.7681, test_loss: 0.9729, test_f1: 0.5647
 epoch: 89, train_loss: 0.7716, test_loss: 0.9866, test_f1: 0.5712
 epoch: 90, train_loss: 0.7603, test_loss: 0.9925, test_f1: 0.5773
 epoch: 91, train_loss: 0.7588, test_loss: 0.9878, test_f1: 0.5701
 epoch: 92, train_loss: 0.7641, test_loss: 0.9920, test_f1: 0.5777
 epoch: 93, train_loss: 0.7604, test_loss: 0.9961, test_f1: 0.5789
 epoch: 94, train_loss: 0.7582, test_loss: 0.9950, test_f1: 0.5820
 epoch: 95, train_loss: 0.7579, test_loss: 0.9919, test_f1: 0.5674
 epoch: 96, train_loss: 0.7473, test_loss: 0.9991, test_f1: 0.5741
 epoch: 97, train_loss: 0.7544, test_loss: 0.9961, test_f1: 0.5732
 epoch: 98, train_loss: 0.7502, test_loss: 0.9930, test_f1: 0.5826
 epoch: 99, train_loss: 0.7521, test_loss: 0.9911, test_f1: 0.5756
##################ITERATION #9 ****************************************
 epoch: 0, train_loss: 1.3075, test_loss: 1.3080, test_f1: 0.2270
 epoch: 1, train_loss: 1.2084, test_loss: 1.2951, test_f1: 0.3327
 epoch: 2, train_loss: 1.1817, test_loss: 1.2543, test_f1: 0.2862
 epoch: 3, train_loss: 1.1597, test_loss: 1.1637, test_f1: 0.3759
 epoch: 4, train_loss: 1.1331, test_loss: 1.1346, test_f1: 0.3993
 epoch: 5, train_loss: 1.1073, test_loss: 1.1168, test_f1: 0.4281
 epoch: 6, train_loss: 1.1049, test_loss: 1.0694, test_f1: 0.4513
 epoch: 7, train_loss: 1.0809, test_loss: 1.0321, test_f1: 0.4698
 epoch: 8, train_loss: 1.0649, test_loss: 1.0218, test_f1: 0.4743
 epoch: 9, train_loss: 1.0490, test_loss: 1.0147, test_f1: 0.4688
 epoch: 10, train_loss: 1.0449, test_loss: 1.0055, test_f1: 0.4844
 epoch: 11, train_loss: 1.0294, test_loss: 0.9989, test_f1: 0.4918
 epoch: 12, train_loss: 1.0205, test_loss: 0.9845, test_f1: 0.4938
 epoch: 13, train_loss: 1.0147, test_loss: 0.9785, test_f1: 0.5005
 epoch: 14, train_loss: 0.9998, test_loss: 0.9743, test_f1: 0.4936
 epoch: 15, train_loss: 0.9931, test_loss: 0.9708, test_f1: 0.5016
 epoch: 16, train_loss: 0.9853, test_loss: 0.9600, test_f1: 0.5026
 epoch: 17, train_loss: 0.9750, test_loss: 0.9631, test_f1: 0.5034
 epoch: 18, train_loss: 0.9674, test_loss: 0.9598, test_f1: 0.5057
 epoch: 19, train_loss: 0.9707, test_loss: 0.9496, test_f1: 0.5074
 epoch: 20, train_loss: 0.9522, test_loss: 0.9533, test_f1: 0.5065
 epoch: 21, train_loss: 0.9519, test_loss: 0.9474, test_f1: 0.5026
 epoch: 22, train_loss: 0.9408, test_loss: 0.9409, test_f1: 0.5066
 epoch: 23, train_loss: 0.9424, test_loss: 0.9458, test_f1: 0.5071
 epoch: 24, train_loss: 0.9349, test_loss: 0.9353, test_f1: 0.5046
 epoch: 25, train_loss: 0.9352, test_loss: 0.9365, test_f1: 0.5084
 epoch: 26, train_loss: 0.9315, test_loss: 0.9337, test_f1: 0.5115
 epoch: 27, train_loss: 0.9183, test_loss: 0.9331, test_f1: 0.5120
 epoch: 28, train_loss: 0.9196, test_loss: 0.9427, test_f1: 0.5135
 epoch: 29, train_loss: 0.9190, test_loss: 0.9299, test_f1: 0.5145
 epoch: 30, train_loss: 0.9147, test_loss: 0.9291, test_f1: 0.5044
 epoch: 31, train_loss: 0.9041, test_loss: 0.9334, test_f1: 0.5167
 epoch: 32, train_loss: 0.9021, test_loss: 0.9403, test_f1: 0.5117
 epoch: 33, train_loss: 0.8957, test_loss: 0.9324, test_f1: 0.5146
 epoch: 34, train_loss: 0.8968, test_loss: 0.9244, test_f1: 0.5203
 epoch: 35, train_loss: 0.8876, test_loss: 0.9212, test_f1: 0.5218
 epoch: 36, train_loss: 0.8911, test_loss: 0.9238, test_f1: 0.5180
 epoch: 37, train_loss: 0.8815, test_loss: 0.9160, test_f1: 0.5186
 epoch: 38, train_loss: 0.8793, test_loss: 0.9302, test_f1: 0.5170
 epoch: 39, train_loss: 0.8722, test_loss: 0.9311, test_f1: 0.5174
 epoch: 40, train_loss: 0.8662, test_loss: 0.9263, test_f1: 0.5206
 epoch: 41, train_loss: 0.8691, test_loss: 0.9107, test_f1: 0.5226
 epoch: 42, train_loss: 0.8667, test_loss: 0.9178, test_f1: 0.5227
 epoch: 43, train_loss: 0.8580, test_loss: 0.9250, test_f1: 0.5179
 epoch: 44, train_loss: 0.8606, test_loss: 0.9207, test_f1: 0.5211
 epoch: 45, train_loss: 0.8679, test_loss: 0.9195, test_f1: 0.5239
 epoch: 46, train_loss: 0.8542, test_loss: 0.9219, test_f1: 0.5239
 epoch: 47, train_loss: 0.8556, test_loss: 0.9154, test_f1: 0.5220
 epoch: 48, train_loss: 0.8398, test_loss: 0.9254, test_f1: 0.5205
 epoch: 49, train_loss: 0.8400, test_loss: 0.9189, test_f1: 0.5234
 epoch: 50, train_loss: 0.8454, test_loss: 0.9224, test_f1: 0.5242
 epoch: 51, train_loss: 0.8456, test_loss: 0.9223, test_f1: 0.5242
 epoch: 52, train_loss: 0.8385, test_loss: 0.9217, test_f1: 0.5211
 epoch: 53, train_loss: 0.8324, test_loss: 0.9176, test_f1: 0.5215
 epoch: 54, train_loss: 0.8355, test_loss: 0.9149, test_f1: 0.5293
 epoch: 55, train_loss: 0.8257, test_loss: 0.9159, test_f1: 0.5230
 epoch: 56, train_loss: 0.8354, test_loss: 0.9202, test_f1: 0.5262
 epoch: 57, train_loss: 0.8337, test_loss: 0.9154, test_f1: 0.5232
 epoch: 58, train_loss: 0.8290, test_loss: 0.9174, test_f1: 0.5224
 epoch: 59, train_loss: 0.8234, test_loss: 0.9202, test_f1: 0.5208
 epoch: 60, train_loss: 0.8178, test_loss: 0.9209, test_f1: 0.5291
 epoch: 61, train_loss: 0.8268, test_loss: 0.9157, test_f1: 0.5230
 epoch: 62, train_loss: 0.8187, test_loss: 0.9208, test_f1: 0.5221
 epoch: 63, train_loss: 0.8199, test_loss: 0.9156, test_f1: 0.5267
 epoch: 64, train_loss: 0.8194, test_loss: 0.9196, test_f1: 0.5241
 epoch: 65, train_loss: 0.8152, test_loss: 0.9288, test_f1: 0.5195
 epoch: 66, train_loss: 0.8213, test_loss: 0.9239, test_f1: 0.5195
 epoch: 67, train_loss: 0.8145, test_loss: 0.9191, test_f1: 0.5196
 epoch: 68, train_loss: 0.8132, test_loss: 0.9250, test_f1: 0.5208
 epoch: 69, train_loss: 0.8164, test_loss: 0.9266, test_f1: 0.5224
 epoch: 70, train_loss: 0.8036, test_loss: 0.9236, test_f1: 0.5234
 epoch: 71, train_loss: 0.8063, test_loss: 0.9153, test_f1: 0.5204
 epoch: 72, train_loss: 0.8062, test_loss: 0.9255, test_f1: 0.5214
 epoch: 73, train_loss: 0.8109, test_loss: 0.9222, test_f1: 0.5233
 epoch: 74, train_loss: 0.8064, test_loss: 0.9264, test_f1: 0.5276
 epoch: 75, train_loss: 0.8051, test_loss: 0.9262, test_f1: 0.5255
 epoch: 76, train_loss: 0.8018, test_loss: 0.9233, test_f1: 0.5268
 epoch: 77, train_loss: 0.8028, test_loss: 0.9302, test_f1: 0.5233
 epoch: 78, train_loss: 0.8053, test_loss: 0.9251, test_f1: 0.5251
 epoch: 79, train_loss: 0.7946, test_loss: 0.9277, test_f1: 0.5232
 epoch: 80, train_loss: 0.7947, test_loss: 0.9282, test_f1: 0.5216
 epoch: 81, train_loss: 0.7964, test_loss: 0.9229, test_f1: 0.5302
 epoch: 82, train_loss: 0.7955, test_loss: 0.9295, test_f1: 0.5273
 epoch: 83, train_loss: 0.7904, test_loss: 0.9255, test_f1: 0.5234
 epoch: 84, train_loss: 0.7910, test_loss: 0.9261, test_f1: 0.5178
 epoch: 85, train_loss: 0.7911, test_loss: 0.9263, test_f1: 0.5226
 epoch: 86, train_loss: 0.7960, test_loss: 0.9281, test_f1: 0.5167
 epoch: 87, train_loss: 0.7892, test_loss: 0.9301, test_f1: 0.5233
 epoch: 88, train_loss: 0.7836, test_loss: 0.9262, test_f1: 0.5280
 epoch: 89, train_loss: 0.7858, test_loss: 0.9301, test_f1: 0.5234
 epoch: 90, train_loss: 0.7819, test_loss: 0.9294, test_f1: 0.5265
 epoch: 91, train_loss: 0.7864, test_loss: 0.9344, test_f1: 0.5229
 epoch: 92, train_loss: 0.7854, test_loss: 0.9344, test_f1: 0.5238
 epoch: 93, train_loss: 0.7846, test_loss: 0.9324, test_f1: 0.5342
 epoch: 94, train_loss: 0.7874, test_loss: 0.9362, test_f1: 0.5306
 epoch: 95, train_loss: 0.7791, test_loss: 0.9307, test_f1: 0.5286
 epoch: 96, train_loss: 0.7803, test_loss: 0.9330, test_f1: 0.5295
 epoch: 97, train_loss: 0.7788, test_loss: 0.9313, test_f1: 0.5319
 epoch: 98, train_loss: 0.7761, test_loss: 0.9335, test_f1: 0.5349
 epoch: 99, train_loss: 0.7797, test_loss: 0.9364, test_f1: 0.5335

Training completed in 396.07 seconds
Best F1: 0.5826 at epoch 98
Mean F1 across iterations: 0.5553  0.0136
========================FINAL RESULTS================================
FEGIN weighted F1: 0.5826  0.0136
python main.py --data ltspice_examples --representation component_net --model FEGIN --layers 4 --hiddens 64 --batch_size 256 --lr 0.0001 --emb_size 250 --epochs 100 --save_appendix component_net_L4_H64_BS256_LR0.0001_E250 --no_val
-----



STDERR:
  File "main.py", line 370, in <module>
    main()
  File "main.py", line 254, in main
    dataset = dataset_class(
  File "/home/philip/projects/ltspice_examples_code_repo/Circuit-Completion-Using-GNNs/component_classification_with_link_prediction_head/evaluation/FEGIN/kernel/circuit_datasets.py", line 15, in __init__
    self.data, self.slices = torch.load(self.processed_paths[0])
  File "/home/philip/.local/lib/python3.8/site-packages/torch/serialization.py", line 1040, in load
    warnings.warn(
  File "/usr/lib/python3.8/warnings.py", line 109, in _showwarnmsg
    sw(msg.message, msg.category, msg.filename, msg.lineno,
  File "main.py", line 47, in warn_with_traceback
    traceback.print_stack(file=log)
/home/philip/projects/ltspice_examples_code_repo/Circuit-Completion-Using-GNNs/component_classification_with_link_prediction_head/evaluation/FEGIN/kernel/circuit_datasets.py:15: FutureWarning: You are using `torch.load` with `weights_only=False` (the current default value), which uses the default pickle module implicitly. It is possible to construct malicious pickle data which will execute arbitrary code during unpickling (See https://github.com/pytorch/pytorch/blob/main/SECURITY.md#untrusted-models for more details). In a future release, the default value for `weights_only` will be flipped to `True`. This limits the functions that could be executed during unpickling. Arbitrary objects will no longer be allowed to be loaded via this mode unless they are explicitly allowlisted by the user via `torch.serialization.add_safe_globals`. We recommend you start setting `weights_only=True` for any use case where you don't have full control of the loaded file. Please open an issue on GitHub for any issues related to this experimental feature.
  self.data, self.slices = torch.load(self.processed_paths[0])
