STDOUT:
Results will be saved in /home/philip/projects/ltspice_examples_code_repo/Circuit-Completion-Using-GNNs/component_classification_with_link_prediction_head/evaluation/FEGIN/results/model_FEGIN_dataset_ltspice_demos
Command line input: python main.py --data ltspice_demos --representation component_pin --model FEGIN --layers 4 --hiddens 32 --batch_size 256 --lr 0.001 --emb_size 128 --epochs 100 --save_appendix component_pin_L4_H32_BS256_LR0.001_E128 --no_val
 is saved.
-----
ltspice_demos - FEGIN
Using 4 layers, 32 hidden units, h = 2
Loading component_pin representation dataset
ENTERED
Training FEGIN on component_pin representation
Train: 1565, Test: 383
##################ITERATION #0 ****************************************
 epoch: 0, train_loss: 1.3097, test_loss: 1.3263, test_f1: 0.2628
 epoch: 1, train_loss: 1.2976, test_loss: 1.3224, test_f1: 0.2628
 epoch: 2, train_loss: 1.2885, test_loss: 1.3183, test_f1: 0.2628
 epoch: 3, train_loss: 1.2767, test_loss: 1.3138, test_f1: 0.2630
 epoch: 4, train_loss: 1.2645, test_loss: 1.3086, test_f1: 0.2630
 epoch: 5, train_loss: 1.2458, test_loss: 1.3024, test_f1: 0.2571
 epoch: 6, train_loss: 1.2265, test_loss: 1.2936, test_f1: 0.3019
 epoch: 7, train_loss: 1.2041, test_loss: 1.2807, test_f1: 0.3287
 epoch: 8, train_loss: 1.1816, test_loss: 1.2757, test_f1: 0.3347
 epoch: 9, train_loss: 1.1565, test_loss: 1.2689, test_f1: 0.3296
 epoch: 10, train_loss: 1.1306, test_loss: 1.2425, test_f1: 0.3426
 epoch: 11, train_loss: 1.1032, test_loss: 1.2196, test_f1: 0.3757
 epoch: 12, train_loss: 1.0803, test_loss: 1.1886, test_f1: 0.4191
 epoch: 13, train_loss: 1.0608, test_loss: 1.1398, test_f1: 0.4504
 epoch: 14, train_loss: 1.0285, test_loss: 1.1837, test_f1: 0.4212
 epoch: 15, train_loss: 0.9985, test_loss: 1.1351, test_f1: 0.4272
 epoch: 16, train_loss: 0.9905, test_loss: 1.1835, test_f1: 0.4296
 epoch: 17, train_loss: 0.9911, test_loss: 1.5104, test_f1: 0.3805
 epoch: 18, train_loss: 0.9891, test_loss: 1.3230, test_f1: 0.3946
 epoch: 19, train_loss: 0.9780, test_loss: 1.1114, test_f1: 0.4527
 epoch: 20, train_loss: 0.9741, test_loss: 1.1497, test_f1: 0.4271
 epoch: 21, train_loss: 0.9605, test_loss: 1.1864, test_f1: 0.4139
 epoch: 22, train_loss: 0.9406, test_loss: 1.0749, test_f1: 0.4496
 epoch: 23, train_loss: 0.9376, test_loss: 1.0826, test_f1: 0.4439
 epoch: 24, train_loss: 0.9197, test_loss: 1.0906, test_f1: 0.4453
 epoch: 25, train_loss: 0.9269, test_loss: 1.0546, test_f1: 0.4579
 epoch: 26, train_loss: 0.9032, test_loss: 1.0872, test_f1: 0.4472
 epoch: 27, train_loss: 0.9065, test_loss: 1.0921, test_f1: 0.4602
 epoch: 28, train_loss: 0.9018, test_loss: 1.0902, test_f1: 0.4400
 epoch: 29, train_loss: 0.9026, test_loss: 1.0999, test_f1: 0.4307
 epoch: 30, train_loss: 0.9090, test_loss: 1.0479, test_f1: 0.4623
 epoch: 31, train_loss: 0.8866, test_loss: 1.0546, test_f1: 0.4826
 epoch: 32, train_loss: 0.8816, test_loss: 0.9971, test_f1: 0.4896
 epoch: 33, train_loss: 0.8775, test_loss: 1.3047, test_f1: 0.3758
 epoch: 34, train_loss: 0.8729, test_loss: 1.1573, test_f1: 0.4523
 epoch: 35, train_loss: 0.8761, test_loss: 1.0596, test_f1: 0.4663
 epoch: 36, train_loss: 0.8579, test_loss: 1.0905, test_f1: 0.5189
 epoch: 37, train_loss: 0.8525, test_loss: 1.0362, test_f1: 0.5333
 epoch: 38, train_loss: 0.8367, test_loss: 1.3133, test_f1: 0.4481
 epoch: 39, train_loss: 0.8386, test_loss: 1.2846, test_f1: 0.4434
 epoch: 40, train_loss: 0.8219, test_loss: 1.0521, test_f1: 0.5357
 epoch: 41, train_loss: 0.8155, test_loss: 1.0934, test_f1: 0.4857
 epoch: 42, train_loss: 0.7986, test_loss: 1.4667, test_f1: 0.4125
 epoch: 43, train_loss: 0.7931, test_loss: 1.0945, test_f1: 0.5115
 epoch: 44, train_loss: 0.7862, test_loss: 1.0479, test_f1: 0.5673
 epoch: 45, train_loss: 0.7853, test_loss: 1.1557, test_f1: 0.5232
 epoch: 46, train_loss: 0.7704, test_loss: 1.1031, test_f1: 0.5445
 epoch: 47, train_loss: 0.7720, test_loss: 1.3646, test_f1: 0.4676
 epoch: 48, train_loss: 0.7675, test_loss: 1.1354, test_f1: 0.5345
 epoch: 49, train_loss: 0.7623, test_loss: 1.2465, test_f1: 0.5472
 epoch: 50, train_loss: 0.7605, test_loss: 1.1915, test_f1: 0.5237
 epoch: 51, train_loss: 0.7405, test_loss: 1.0329, test_f1: 0.5529
 epoch: 52, train_loss: 0.7277, test_loss: 1.3491, test_f1: 0.4516
 epoch: 53, train_loss: 0.7300, test_loss: 1.8181, test_f1: 0.3780
 epoch: 54, train_loss: 0.7255, test_loss: 1.5463, test_f1: 0.4382
 epoch: 55, train_loss: 0.7219, test_loss: 1.1060, test_f1: 0.5495
 epoch: 56, train_loss: 0.7098, test_loss: 1.0127, test_f1: 0.5596
 epoch: 57, train_loss: 0.7175, test_loss: 1.0206, test_f1: 0.5432
 epoch: 58, train_loss: 0.6999, test_loss: 1.0405, test_f1: 0.5543
 epoch: 59, train_loss: 0.7050, test_loss: 1.0597, test_f1: 0.5670
 epoch: 60, train_loss: 0.6837, test_loss: 1.0796, test_f1: 0.5708
 epoch: 61, train_loss: 0.6909, test_loss: 1.0988, test_f1: 0.5318
 epoch: 62, train_loss: 0.6857, test_loss: 1.3138, test_f1: 0.4786
 epoch: 63, train_loss: 0.6832, test_loss: 1.0436, test_f1: 0.5502
 epoch: 64, train_loss: 0.6771, test_loss: 1.0534, test_f1: 0.5241
 epoch: 65, train_loss: 0.6861, test_loss: 1.0978, test_f1: 0.5638
 epoch: 66, train_loss: 0.6711, test_loss: 1.1409, test_f1: 0.5567
 epoch: 67, train_loss: 0.6692, test_loss: 1.0967, test_f1: 0.5731
 epoch: 68, train_loss: 0.6650, test_loss: 1.1171, test_f1: 0.5595
 epoch: 69, train_loss: 0.6737, test_loss: 1.1533, test_f1: 0.4797
 epoch: 70, train_loss: 0.6708, test_loss: 1.2107, test_f1: 0.4763
 epoch: 71, train_loss: 0.6522, test_loss: 1.2693, test_f1: 0.4358
 epoch: 72, train_loss: 0.6495, test_loss: 1.2130, test_f1: 0.4914
 epoch: 73, train_loss: 0.6530, test_loss: 1.1076, test_f1: 0.5494
 epoch: 74, train_loss: 0.6515, test_loss: 1.0870, test_f1: 0.5592
 epoch: 75, train_loss: 0.6485, test_loss: 1.1004, test_f1: 0.5653
 epoch: 76, train_loss: 0.6549, test_loss: 1.0482, test_f1: 0.5620
 epoch: 77, train_loss: 0.6558, test_loss: 1.0686, test_f1: 0.5455
 epoch: 78, train_loss: 0.6509, test_loss: 1.1302, test_f1: 0.5689
 epoch: 79, train_loss: 0.6821, test_loss: 1.1061, test_f1: 0.5705
 epoch: 80, train_loss: 0.6683, test_loss: 1.0237, test_f1: 0.5960
 epoch: 81, train_loss: 0.6672, test_loss: 1.0295, test_f1: 0.5744
 epoch: 82, train_loss: 0.6621, test_loss: 1.1380, test_f1: 0.5412
 epoch: 83, train_loss: 0.6514, test_loss: 1.1419, test_f1: 0.5507
 epoch: 84, train_loss: 0.6596, test_loss: 1.0774, test_f1: 0.5498
 epoch: 85, train_loss: 0.6549, test_loss: 1.4865, test_f1: 0.4635
 epoch: 86, train_loss: 0.6606, test_loss: 1.2188, test_f1: 0.5502
 epoch: 87, train_loss: 0.6568, test_loss: 1.0710, test_f1: 0.5858
 epoch: 88, train_loss: 0.6404, test_loss: 1.0542, test_f1: 0.5880
 epoch: 89, train_loss: 0.6288, test_loss: 1.0615, test_f1: 0.5866
 epoch: 90, train_loss: 0.6302, test_loss: 1.1108, test_f1: 0.5462
 epoch: 91, train_loss: 0.6244, test_loss: 1.0457, test_f1: 0.5838
 epoch: 92, train_loss: 0.6198, test_loss: 1.0724, test_f1: 0.5633
 epoch: 93, train_loss: 0.6191, test_loss: 1.0795, test_f1: 0.5807
 epoch: 94, train_loss: 0.6136, test_loss: 1.0654, test_f1: 0.5867
 epoch: 95, train_loss: 0.6344, test_loss: 1.0431, test_f1: 0.5965
 epoch: 96, train_loss: 0.6295, test_loss: 1.0335, test_f1: 0.5402
 epoch: 97, train_loss: 0.7167, test_loss: 1.1351, test_f1: 0.5465
 epoch: 98, train_loss: 0.7098, test_loss: 1.0676, test_f1: 0.5502
 epoch: 99, train_loss: 0.6534, test_loss: 1.1020, test_f1: 0.5804
##################ITERATION #1 ****************************************
 epoch: 0, train_loss: 1.2566, test_loss: 1.2979, test_f1: 0.2281
 epoch: 1, train_loss: 1.2124, test_loss: 1.2967, test_f1: 0.2281
 epoch: 2, train_loss: 1.1856, test_loss: 1.2980, test_f1: 0.2281
 epoch: 3, train_loss: 1.1576, test_loss: 1.3048, test_f1: 0.2281
 epoch: 4, train_loss: 1.1306, test_loss: 1.3101, test_f1: 0.2281
 epoch: 5, train_loss: 1.1046, test_loss: 1.2997, test_f1: 0.2231
 epoch: 6, train_loss: 1.0809, test_loss: 1.2681, test_f1: 0.2614
 epoch: 7, train_loss: 1.0540, test_loss: 1.2127, test_f1: 0.3159
 epoch: 8, train_loss: 1.0258, test_loss: 1.1419, test_f1: 0.3740
 epoch: 9, train_loss: 1.0044, test_loss: 1.1498, test_f1: 0.3985
 epoch: 10, train_loss: 0.9775, test_loss: 1.0599, test_f1: 0.4547
 epoch: 11, train_loss: 0.9563, test_loss: 1.0610, test_f1: 0.4851
 epoch: 12, train_loss: 0.9393, test_loss: 1.1118, test_f1: 0.4897
 epoch: 13, train_loss: 0.9195, test_loss: 1.0909, test_f1: 0.5057
 epoch: 14, train_loss: 0.8989, test_loss: 1.0454, test_f1: 0.5033
 epoch: 15, train_loss: 0.8926, test_loss: 1.0077, test_f1: 0.5479
 epoch: 16, train_loss: 0.8742, test_loss: 1.0123, test_f1: 0.5279
 epoch: 17, train_loss: 0.8576, test_loss: 1.0297, test_f1: 0.5414
 epoch: 18, train_loss: 0.8561, test_loss: 1.0246, test_f1: 0.5485
 epoch: 19, train_loss: 0.8349, test_loss: 1.0705, test_f1: 0.5360
 epoch: 20, train_loss: 0.8343, test_loss: 0.9956, test_f1: 0.5128
 epoch: 21, train_loss: 0.8336, test_loss: 1.0509, test_f1: 0.5573
 epoch: 22, train_loss: 0.8096, test_loss: 0.9956, test_f1: 0.5613
 epoch: 23, train_loss: 0.8027, test_loss: 1.0639, test_f1: 0.4954
 epoch: 24, train_loss: 0.8008, test_loss: 1.0221, test_f1: 0.5420
 epoch: 25, train_loss: 0.7943, test_loss: 1.0013, test_f1: 0.5937
 epoch: 26, train_loss: 0.7835, test_loss: 1.0105, test_f1: 0.5988
 epoch: 27, train_loss: 0.7540, test_loss: 1.0200, test_f1: 0.6149
 epoch: 28, train_loss: 0.7490, test_loss: 1.0344, test_f1: 0.5936
 epoch: 29, train_loss: 0.7430, test_loss: 0.9944, test_f1: 0.5840
 epoch: 30, train_loss: 0.7439, test_loss: 1.0603, test_f1: 0.5647
 epoch: 31, train_loss: 0.7510, test_loss: 1.0112, test_f1: 0.5568
 epoch: 32, train_loss: 0.7326, test_loss: 1.0363, test_f1: 0.5622
 epoch: 33, train_loss: 0.7342, test_loss: 1.0594, test_f1: 0.5618
 epoch: 34, train_loss: 0.7540, test_loss: 1.0606, test_f1: 0.5034
 epoch: 35, train_loss: 0.7215, test_loss: 1.2016, test_f1: 0.5257
 epoch: 36, train_loss: 0.7216, test_loss: 1.0569, test_f1: 0.5986
 epoch: 37, train_loss: 0.7171, test_loss: 0.9903, test_f1: 0.5905
 epoch: 38, train_loss: 0.7165, test_loss: 1.0518, test_f1: 0.5585
 epoch: 39, train_loss: 0.7119, test_loss: 1.0702, test_f1: 0.5584
 epoch: 40, train_loss: 0.7040, test_loss: 1.0954, test_f1: 0.5758
 epoch: 41, train_loss: 0.6740, test_loss: 1.0907, test_f1: 0.5615
 epoch: 42, train_loss: 0.6761, test_loss: 1.0837, test_f1: 0.5473
 epoch: 43, train_loss: 0.6788, test_loss: 1.0671, test_f1: 0.5305
 epoch: 44, train_loss: 0.6744, test_loss: 1.1742, test_f1: 0.4624
 epoch: 45, train_loss: 0.6627, test_loss: 1.1322, test_f1: 0.5182
 epoch: 46, train_loss: 0.7010, test_loss: 1.3630, test_f1: 0.5667
 epoch: 47, train_loss: 0.7012, test_loss: 1.1795, test_f1: 0.5916
 epoch: 48, train_loss: 0.6980, test_loss: 1.1159, test_f1: 0.5745
 epoch: 49, train_loss: 0.6780, test_loss: 1.0849, test_f1: 0.5716
 epoch: 50, train_loss: 0.6634, test_loss: 1.1338, test_f1: 0.5428
 epoch: 51, train_loss: 0.6607, test_loss: 1.1085, test_f1: 0.5485
 epoch: 52, train_loss: 0.6683, test_loss: 1.1630, test_f1: 0.5311
 epoch: 53, train_loss: 0.6769, test_loss: 1.1596, test_f1: 0.5629
 epoch: 54, train_loss: 0.6595, test_loss: 1.1462, test_f1: 0.5417
 epoch: 55, train_loss: 0.6518, test_loss: 1.2454, test_f1: 0.5335
 epoch: 56, train_loss: 0.6495, test_loss: 1.3308, test_f1: 0.5165
 epoch: 57, train_loss: 0.6381, test_loss: 1.1241, test_f1: 0.5303
 epoch: 58, train_loss: 0.6424, test_loss: 1.1269, test_f1: 0.5213
 epoch: 59, train_loss: 0.6432, test_loss: 1.1680, test_f1: 0.5313
 epoch: 60, train_loss: 0.6370, test_loss: 1.3084, test_f1: 0.5082
 epoch: 61, train_loss: 0.6358, test_loss: 1.1151, test_f1: 0.5790
 epoch: 62, train_loss: 0.6314, test_loss: 1.1808, test_f1: 0.5976
 epoch: 63, train_loss: 0.6318, test_loss: 1.1793, test_f1: 0.5718
 epoch: 64, train_loss: 0.6287, test_loss: 1.1441, test_f1: 0.5414
 epoch: 65, train_loss: 0.6192, test_loss: 1.1204, test_f1: 0.5059
 epoch: 66, train_loss: 0.6338, test_loss: 1.3078, test_f1: 0.4971
 epoch: 67, train_loss: 0.6261, test_loss: 1.1814, test_f1: 0.5688
 epoch: 68, train_loss: 0.6103, test_loss: 1.1072, test_f1: 0.5869
 epoch: 69, train_loss: 0.6306, test_loss: 1.1651, test_f1: 0.6021
 epoch: 70, train_loss: 0.6193, test_loss: 1.1537, test_f1: 0.5796
 epoch: 71, train_loss: 0.6208, test_loss: 1.2236, test_f1: 0.5615
 epoch: 72, train_loss: 0.6131, test_loss: 1.2054, test_f1: 0.5608
 epoch: 73, train_loss: 0.6214, test_loss: 1.1479, test_f1: 0.5309
 epoch: 74, train_loss: 0.6176, test_loss: 1.2239, test_f1: 0.5799
 epoch: 75, train_loss: 0.6224, test_loss: 1.2068, test_f1: 0.5834
 epoch: 76, train_loss: 0.6238, test_loss: 1.1070, test_f1: 0.5854
 epoch: 77, train_loss: 0.6107, test_loss: 1.3203, test_f1: 0.5447
 epoch: 78, train_loss: 0.6166, test_loss: 1.1382, test_f1: 0.5927
 epoch: 79, train_loss: 0.6318, test_loss: 1.1657, test_f1: 0.5504
 epoch: 80, train_loss: 0.6234, test_loss: 1.2288, test_f1: 0.5487
 epoch: 81, train_loss: 0.6190, test_loss: 1.2405, test_f1: 0.5792
 epoch: 82, train_loss: 0.6043, test_loss: 1.3598, test_f1: 0.5242
 epoch: 83, train_loss: 0.6094, test_loss: 1.2556, test_f1: 0.5441
 epoch: 84, train_loss: 0.6126, test_loss: 1.1602, test_f1: 0.5816
 epoch: 85, train_loss: 0.6046, test_loss: 1.1406, test_f1: 0.5879
 epoch: 86, train_loss: 0.6150, test_loss: 1.2501, test_f1: 0.5871
 epoch: 87, train_loss: 0.6069, test_loss: 1.1732, test_f1: 0.5832
 epoch: 88, train_loss: 0.6028, test_loss: 1.2296, test_f1: 0.5413
 epoch: 89, train_loss: 0.5930, test_loss: 1.2888, test_f1: 0.5662
 epoch: 90, train_loss: 0.5919, test_loss: 1.2416, test_f1: 0.5667
 epoch: 91, train_loss: 0.5944, test_loss: 1.1712, test_f1: 0.5915
 epoch: 92, train_loss: 0.5874, test_loss: 1.1795, test_f1: 0.5864
 epoch: 93, train_loss: 0.6070, test_loss: 1.3710, test_f1: 0.5358
 epoch: 94, train_loss: 0.6001, test_loss: 1.3685, test_f1: 0.5462
 epoch: 95, train_loss: 0.5968, test_loss: 1.2274, test_f1: 0.5962
 epoch: 96, train_loss: 0.6076, test_loss: 1.1913, test_f1: 0.5915
 epoch: 97, train_loss: 0.6118, test_loss: 1.8112, test_f1: 0.5172
 epoch: 98, train_loss: 0.6087, test_loss: 1.9336, test_f1: 0.4719
 epoch: 99, train_loss: 0.6167, test_loss: 1.6980, test_f1: 0.4661
##################ITERATION #2 ****************************************
 epoch: 0, train_loss: 1.2508, test_loss: 1.3115, test_f1: 0.2281
 epoch: 1, train_loss: 1.1892, test_loss: 1.3050, test_f1: 0.2281
 epoch: 2, train_loss: 1.1595, test_loss: 1.2887, test_f1: 0.2281
 epoch: 3, train_loss: 1.1283, test_loss: 1.2711, test_f1: 0.2281
 epoch: 4, train_loss: 1.0953, test_loss: 1.2442, test_f1: 0.2281
 epoch: 5, train_loss: 1.0683, test_loss: 1.2038, test_f1: 0.2799
 epoch: 6, train_loss: 1.0288, test_loss: 1.1765, test_f1: 0.3440
 epoch: 7, train_loss: 1.0078, test_loss: 1.1334, test_f1: 0.3529
 epoch: 8, train_loss: 0.9927, test_loss: 1.0731, test_f1: 0.3988
 epoch: 9, train_loss: 0.9686, test_loss: 1.0608, test_f1: 0.4360
 epoch: 10, train_loss: 0.9577, test_loss: 1.0362, test_f1: 0.4526
 epoch: 11, train_loss: 0.9281, test_loss: 1.0855, test_f1: 0.4352
 epoch: 12, train_loss: 0.9216, test_loss: 1.0721, test_f1: 0.4561
 epoch: 13, train_loss: 0.9025, test_loss: 1.0203, test_f1: 0.4912
 epoch: 14, train_loss: 0.8859, test_loss: 1.0282, test_f1: 0.5189
 epoch: 15, train_loss: 0.8744, test_loss: 1.0548, test_f1: 0.5055
 epoch: 16, train_loss: 0.8678, test_loss: 1.0126, test_f1: 0.5286
 epoch: 17, train_loss: 0.8530, test_loss: 1.0089, test_f1: 0.5277
 epoch: 18, train_loss: 0.8313, test_loss: 1.0206, test_f1: 0.5024
 epoch: 19, train_loss: 0.8285, test_loss: 1.0276, test_f1: 0.5095
 epoch: 20, train_loss: 0.8214, test_loss: 1.0017, test_f1: 0.5182
 epoch: 21, train_loss: 0.8228, test_loss: 0.9788, test_f1: 0.5159
 epoch: 22, train_loss: 0.8089, test_loss: 0.9827, test_f1: 0.5538
 epoch: 23, train_loss: 0.8077, test_loss: 0.9726, test_f1: 0.5382
 epoch: 24, train_loss: 0.7979, test_loss: 0.9585, test_f1: 0.5255
 epoch: 25, train_loss: 0.8101, test_loss: 1.0032, test_f1: 0.5114
 epoch: 26, train_loss: 0.8198, test_loss: 0.9595, test_f1: 0.5467
 epoch: 27, train_loss: 0.8012, test_loss: 0.9528, test_f1: 0.5186
 epoch: 28, train_loss: 0.7837, test_loss: 0.9814, test_f1: 0.4965
 epoch: 29, train_loss: 0.7706, test_loss: 1.0193, test_f1: 0.5371
 epoch: 30, train_loss: 0.7700, test_loss: 1.0277, test_f1: 0.5661
 epoch: 31, train_loss: 0.7646, test_loss: 0.9792, test_f1: 0.5153
 epoch: 32, train_loss: 0.7679, test_loss: 0.9889, test_f1: 0.5700
 epoch: 33, train_loss: 0.7730, test_loss: 0.9854, test_f1: 0.5594
 epoch: 34, train_loss: 0.7656, test_loss: 0.9729, test_f1: 0.5740
 epoch: 35, train_loss: 0.7543, test_loss: 0.9794, test_f1: 0.6056
 epoch: 36, train_loss: 0.7435, test_loss: 0.9924, test_f1: 0.5481
 epoch: 37, train_loss: 0.7397, test_loss: 1.0057, test_f1: 0.5418
 epoch: 38, train_loss: 0.7251, test_loss: 0.9929, test_f1: 0.5606
 epoch: 39, train_loss: 0.7272, test_loss: 0.9961, test_f1: 0.5687
 epoch: 40, train_loss: 0.7325, test_loss: 0.9957, test_f1: 0.5664
 epoch: 41, train_loss: 0.7659, test_loss: 0.9874, test_f1: 0.5344
 epoch: 42, train_loss: 0.7353, test_loss: 0.9553, test_f1: 0.5970
 epoch: 43, train_loss: 0.7287, test_loss: 0.9715, test_f1: 0.5913
 epoch: 44, train_loss: 0.7188, test_loss: 0.9847, test_f1: 0.5615
 epoch: 45, train_loss: 0.7127, test_loss: 0.9867, test_f1: 0.5755
 epoch: 46, train_loss: 0.7173, test_loss: 0.9878, test_f1: 0.5763
 epoch: 47, train_loss: 0.7111, test_loss: 0.9873, test_f1: 0.5835
 epoch: 48, train_loss: 0.7175, test_loss: 0.9738, test_f1: 0.5717
 epoch: 49, train_loss: 0.7091, test_loss: 0.9605, test_f1: 0.5509
 epoch: 50, train_loss: 0.7139, test_loss: 1.0061, test_f1: 0.5319
 epoch: 51, train_loss: 0.7056, test_loss: 0.9713, test_f1: 0.5603
 epoch: 52, train_loss: 0.6861, test_loss: 1.0112, test_f1: 0.5666
 epoch: 53, train_loss: 0.6897, test_loss: 0.9893, test_f1: 0.5912
 epoch: 54, train_loss: 0.6975, test_loss: 0.9708, test_f1: 0.6020
 epoch: 55, train_loss: 0.6956, test_loss: 0.9993, test_f1: 0.6003
 epoch: 56, train_loss: 0.6901, test_loss: 0.9981, test_f1: 0.5899
 epoch: 57, train_loss: 0.6806, test_loss: 1.0062, test_f1: 0.5787
 epoch: 58, train_loss: 0.6757, test_loss: 1.0050, test_f1: 0.5844
 epoch: 59, train_loss: 0.6750, test_loss: 0.9855, test_f1: 0.5961
 epoch: 60, train_loss: 0.6764, test_loss: 0.9904, test_f1: 0.6056
 epoch: 61, train_loss: 0.6811, test_loss: 1.0267, test_f1: 0.5927
 epoch: 62, train_loss: 0.6678, test_loss: 1.0736, test_f1: 0.6005
 epoch: 63, train_loss: 0.6705, test_loss: 1.0078, test_f1: 0.5814
 epoch: 64, train_loss: 0.6716, test_loss: 0.9863, test_f1: 0.5916
 epoch: 65, train_loss: 0.6659, test_loss: 1.0638, test_f1: 0.5823
 epoch: 66, train_loss: 0.6716, test_loss: 1.0760, test_f1: 0.5585
 epoch: 67, train_loss: 0.6576, test_loss: 1.0717, test_f1: 0.5912
 epoch: 68, train_loss: 0.6549, test_loss: 1.0496, test_f1: 0.5971
 epoch: 69, train_loss: 0.6449, test_loss: 1.0006, test_f1: 0.5908
 epoch: 70, train_loss: 0.6550, test_loss: 0.9824, test_f1: 0.6212
 epoch: 71, train_loss: 0.6437, test_loss: 1.0458, test_f1: 0.5946
 epoch: 72, train_loss: 0.6497, test_loss: 1.0708, test_f1: 0.5938
 epoch: 73, train_loss: 0.6556, test_loss: 1.0426, test_f1: 0.6222
 epoch: 74, train_loss: 0.6530, test_loss: 1.0761, test_f1: 0.6114
 epoch: 75, train_loss: 0.6607, test_loss: 1.0403, test_f1: 0.5863
 epoch: 76, train_loss: 0.6353, test_loss: 0.9995, test_f1: 0.6212
 epoch: 77, train_loss: 0.6435, test_loss: 1.0478, test_f1: 0.5908
 epoch: 78, train_loss: 0.6321, test_loss: 1.0640, test_f1: 0.5738
 epoch: 79, train_loss: 0.6455, test_loss: 1.0433, test_f1: 0.6001
 epoch: 80, train_loss: 0.6287, test_loss: 1.0473, test_f1: 0.5922
 epoch: 81, train_loss: 0.6334, test_loss: 1.1056, test_f1: 0.5786
 epoch: 82, train_loss: 0.6267, test_loss: 1.0545, test_f1: 0.6200
 epoch: 83, train_loss: 0.6382, test_loss: 1.0931, test_f1: 0.6033
 epoch: 84, train_loss: 0.6424, test_loss: 1.0831, test_f1: 0.5891
 epoch: 85, train_loss: 0.6263, test_loss: 1.1378, test_f1: 0.5969
 epoch: 86, train_loss: 0.6401, test_loss: 1.1172, test_f1: 0.5903
 epoch: 87, train_loss: 0.6246, test_loss: 1.0773, test_f1: 0.6146
 epoch: 88, train_loss: 0.6230, test_loss: 1.0913, test_f1: 0.6108
 epoch: 89, train_loss: 0.6292, test_loss: 1.0572, test_f1: 0.6182
 epoch: 90, train_loss: 0.6304, test_loss: 0.9896, test_f1: 0.6467
 epoch: 91, train_loss: 0.6249, test_loss: 1.0878, test_f1: 0.6176
 epoch: 92, train_loss: 0.6376, test_loss: 1.0735, test_f1: 0.6066
 epoch: 93, train_loss: 0.6252, test_loss: 1.1899, test_f1: 0.5512
 epoch: 94, train_loss: 0.6304, test_loss: 1.1537, test_f1: 0.5710
 epoch: 95, train_loss: 0.6172, test_loss: 1.1281, test_f1: 0.5724
 epoch: 96, train_loss: 0.6147, test_loss: 1.0860, test_f1: 0.5865
 epoch: 97, train_loss: 0.6215, test_loss: 1.1295, test_f1: 0.5891
 epoch: 98, train_loss: 0.6117, test_loss: 1.1026, test_f1: 0.6000
 epoch: 99, train_loss: 0.6065, test_loss: 1.1171, test_f1: 0.5921
##################ITERATION #3 ****************************************
 epoch: 0, train_loss: 1.2079, test_loss: 1.3245, test_f1: 0.2281
 epoch: 1, train_loss: 1.1318, test_loss: 1.3261, test_f1: 0.2281
 epoch: 2, train_loss: 1.1041, test_loss: 1.3397, test_f1: 0.2248
 epoch: 3, train_loss: 1.0685, test_loss: 1.3409, test_f1: 0.2238
 epoch: 4, train_loss: 1.0432, test_loss: 1.3283, test_f1: 0.2248
 epoch: 5, train_loss: 1.0064, test_loss: 1.2904, test_f1: 0.2304
 epoch: 6, train_loss: 0.9931, test_loss: 1.2296, test_f1: 0.3218
 epoch: 7, train_loss: 0.9540, test_loss: 1.1568, test_f1: 0.4789
 epoch: 8, train_loss: 0.9411, test_loss: 1.0928, test_f1: 0.5048
 epoch: 9, train_loss: 0.9050, test_loss: 1.0563, test_f1: 0.5267
 epoch: 10, train_loss: 0.9066, test_loss: 1.0194, test_f1: 0.5421
 epoch: 11, train_loss: 0.8877, test_loss: 1.0199, test_f1: 0.5462
 epoch: 12, train_loss: 0.8751, test_loss: 1.0064, test_f1: 0.5535
 epoch: 13, train_loss: 0.8623, test_loss: 1.0109, test_f1: 0.5504
 epoch: 14, train_loss: 0.8497, test_loss: 1.0266, test_f1: 0.5404
 epoch: 15, train_loss: 0.8577, test_loss: 1.0265, test_f1: 0.5407
 epoch: 16, train_loss: 0.8385, test_loss: 0.9751, test_f1: 0.5654
 epoch: 17, train_loss: 0.8154, test_loss: 0.9785, test_f1: 0.5758
 epoch: 18, train_loss: 0.8199, test_loss: 0.9761, test_f1: 0.5633
 epoch: 19, train_loss: 0.8041, test_loss: 0.9764, test_f1: 0.5844
 epoch: 20, train_loss: 0.7967, test_loss: 0.9956, test_f1: 0.5408
 epoch: 21, train_loss: 0.7946, test_loss: 0.9817, test_f1: 0.5858
 epoch: 22, train_loss: 0.7936, test_loss: 1.0326, test_f1: 0.5702
 epoch: 23, train_loss: 0.7814, test_loss: 1.0963, test_f1: 0.5330
 epoch: 24, train_loss: 0.7629, test_loss: 1.0116, test_f1: 0.6053
 epoch: 25, train_loss: 0.7623, test_loss: 0.9659, test_f1: 0.5803
 epoch: 26, train_loss: 0.7512, test_loss: 0.9653, test_f1: 0.5439
 epoch: 27, train_loss: 0.7438, test_loss: 0.9812, test_f1: 0.5362
 epoch: 28, train_loss: 0.7268, test_loss: 0.9917, test_f1: 0.5852
 epoch: 29, train_loss: 0.7387, test_loss: 1.0430, test_f1: 0.5590
 epoch: 30, train_loss: 0.7217, test_loss: 1.0057, test_f1: 0.5808
 epoch: 31, train_loss: 0.7229, test_loss: 0.9732, test_f1: 0.5799
 epoch: 32, train_loss: 0.7171, test_loss: 1.0003, test_f1: 0.5517
 epoch: 33, train_loss: 0.7090, test_loss: 0.9844, test_f1: 0.5741
 epoch: 34, train_loss: 0.7258, test_loss: 0.9735, test_f1: 0.5338
 epoch: 35, train_loss: 0.7405, test_loss: 1.0025, test_f1: 0.5269
 epoch: 36, train_loss: 0.7256, test_loss: 1.0897, test_f1: 0.5224
 epoch: 37, train_loss: 0.7188, test_loss: 1.0441, test_f1: 0.5658
 epoch: 38, train_loss: 0.6950, test_loss: 1.0883, test_f1: 0.5655
 epoch: 39, train_loss: 0.7164, test_loss: 1.0765, test_f1: 0.5777
 epoch: 40, train_loss: 0.6958, test_loss: 1.0099, test_f1: 0.5638
 epoch: 41, train_loss: 0.6989, test_loss: 0.9826, test_f1: 0.5913
 epoch: 42, train_loss: 0.6890, test_loss: 0.9349, test_f1: 0.6002
 epoch: 43, train_loss: 0.7006, test_loss: 0.9635, test_f1: 0.5569
 epoch: 44, train_loss: 0.7088, test_loss: 1.0885, test_f1: 0.5053
 epoch: 45, train_loss: 0.6946, test_loss: 0.9445, test_f1: 0.6214
 epoch: 46, train_loss: 0.6988, test_loss: 0.9130, test_f1: 0.6212
 epoch: 47, train_loss: 0.6770, test_loss: 0.8698, test_f1: 0.6104
 epoch: 48, train_loss: 0.6705, test_loss: 0.8704, test_f1: 0.5990
 epoch: 49, train_loss: 0.6790, test_loss: 0.9145, test_f1: 0.5795
 epoch: 50, train_loss: 0.6528, test_loss: 0.9297, test_f1: 0.5912
 epoch: 51, train_loss: 0.6454, test_loss: 0.9478, test_f1: 0.5885
 epoch: 52, train_loss: 0.6613, test_loss: 0.9228, test_f1: 0.6010
 epoch: 53, train_loss: 0.6636, test_loss: 0.9715, test_f1: 0.5908
 epoch: 54, train_loss: 0.6524, test_loss: 0.9833, test_f1: 0.5711
 epoch: 55, train_loss: 0.6479, test_loss: 0.9752, test_f1: 0.5854
 epoch: 56, train_loss: 0.6424, test_loss: 0.9824, test_f1: 0.5805
 epoch: 57, train_loss: 0.6348, test_loss: 0.9827, test_f1: 0.5835
 epoch: 58, train_loss: 0.6285, test_loss: 0.9732, test_f1: 0.5770
 epoch: 59, train_loss: 0.6314, test_loss: 0.9706, test_f1: 0.5705
 epoch: 60, train_loss: 0.6259, test_loss: 1.0060, test_f1: 0.6011
 epoch: 61, train_loss: 0.6264, test_loss: 1.0072, test_f1: 0.5758
 epoch: 62, train_loss: 0.6186, test_loss: 0.9982, test_f1: 0.5963
 epoch: 63, train_loss: 0.6278, test_loss: 0.9878, test_f1: 0.5929
 epoch: 64, train_loss: 0.6325, test_loss: 1.0092, test_f1: 0.5785
 epoch: 65, train_loss: 0.6184, test_loss: 1.0123, test_f1: 0.5853
 epoch: 66, train_loss: 0.6095, test_loss: 1.0201, test_f1: 0.6051
 epoch: 67, train_loss: 0.6063, test_loss: 1.0391, test_f1: 0.5845
 epoch: 68, train_loss: 0.6006, test_loss: 1.0619, test_f1: 0.5672
 epoch: 69, train_loss: 0.6079, test_loss: 1.0565, test_f1: 0.5677
 epoch: 70, train_loss: 0.6172, test_loss: 1.0000, test_f1: 0.5775
 epoch: 71, train_loss: 0.6074, test_loss: 0.9680, test_f1: 0.5970
 epoch: 72, train_loss: 0.5977, test_loss: 0.9842, test_f1: 0.5829
 epoch: 73, train_loss: 0.6023, test_loss: 1.0279, test_f1: 0.5848
 epoch: 74, train_loss: 0.5920, test_loss: 1.0804, test_f1: 0.5706
 epoch: 75, train_loss: 0.5849, test_loss: 1.0984, test_f1: 0.5588
 epoch: 76, train_loss: 0.5899, test_loss: 1.0525, test_f1: 0.5561
 epoch: 77, train_loss: 0.5937, test_loss: 1.0725, test_f1: 0.5604
 epoch: 78, train_loss: 0.6059, test_loss: 1.0841, test_f1: 0.5814
 epoch: 79, train_loss: 0.5888, test_loss: 1.0919, test_f1: 0.5778
 epoch: 80, train_loss: 0.5843, test_loss: 1.0801, test_f1: 0.5744
 epoch: 81, train_loss: 0.5946, test_loss: 1.1074, test_f1: 0.5681
 epoch: 82, train_loss: 0.5946, test_loss: 1.1602, test_f1: 0.5497
 epoch: 83, train_loss: 0.5960, test_loss: 1.2146, test_f1: 0.5621
 epoch: 84, train_loss: 0.5974, test_loss: 1.1745, test_f1: 0.5613
 epoch: 85, train_loss: 0.5925, test_loss: 1.1515, test_f1: 0.5631
 epoch: 86, train_loss: 0.5875, test_loss: 1.1593, test_f1: 0.5722
 epoch: 87, train_loss: 0.5805, test_loss: 1.1755, test_f1: 0.5641
 epoch: 88, train_loss: 0.5808, test_loss: 1.1418, test_f1: 0.5776
 epoch: 89, train_loss: 0.5772, test_loss: 1.1078, test_f1: 0.5757
 epoch: 90, train_loss: 0.5835, test_loss: 1.2032, test_f1: 0.5682
 epoch: 91, train_loss: 0.5805, test_loss: 1.2213, test_f1: 0.5633
 epoch: 92, train_loss: 0.5733, test_loss: 1.1713, test_f1: 0.5653
 epoch: 93, train_loss: 0.5656, test_loss: 1.2145, test_f1: 0.5522
 epoch: 94, train_loss: 0.5631, test_loss: 1.2109, test_f1: 0.5556
 epoch: 95, train_loss: 0.5674, test_loss: 1.2535, test_f1: 0.5673
 epoch: 96, train_loss: 0.5547, test_loss: 1.1787, test_f1: 0.5883
 epoch: 97, train_loss: 0.5611, test_loss: 1.0991, test_f1: 0.5784
 epoch: 98, train_loss: 0.5660, test_loss: 1.1095, test_f1: 0.5586
 epoch: 99, train_loss: 0.5538, test_loss: 1.2367, test_f1: 0.5387
##################ITERATION #4 ****************************************
 epoch: 0, train_loss: 1.2498, test_loss: 1.3002, test_f1: 0.2281
 epoch: 1, train_loss: 1.1347, test_loss: 1.2958, test_f1: 0.2281
 epoch: 2, train_loss: 1.0835, test_loss: 1.2974, test_f1: 0.2281
 epoch: 3, train_loss: 1.0578, test_loss: 1.3136, test_f1: 0.2379
 epoch: 4, train_loss: 1.0285, test_loss: 1.3315, test_f1: 0.2918
 epoch: 5, train_loss: 0.9948, test_loss: 1.3986, test_f1: 0.1339
 epoch: 6, train_loss: 0.9612, test_loss: 1.5179, test_f1: 0.1488
 epoch: 7, train_loss: 0.9579, test_loss: 1.4790, test_f1: 0.1549
 epoch: 8, train_loss: 0.9339, test_loss: 1.2719, test_f1: 0.3077
 epoch: 9, train_loss: 0.9075, test_loss: 1.0911, test_f1: 0.5036
 epoch: 10, train_loss: 0.8897, test_loss: 1.0678, test_f1: 0.5182
 epoch: 11, train_loss: 0.8717, test_loss: 1.0280, test_f1: 0.5293
 epoch: 12, train_loss: 0.8674, test_loss: 1.0252, test_f1: 0.5348
 epoch: 13, train_loss: 0.8453, test_loss: 0.9945, test_f1: 0.5660
 epoch: 14, train_loss: 0.8371, test_loss: 1.0150, test_f1: 0.5636
 epoch: 15, train_loss: 0.8339, test_loss: 1.0598, test_f1: 0.5703
 epoch: 16, train_loss: 0.8134, test_loss: 1.0728, test_f1: 0.5709
 epoch: 17, train_loss: 0.8070, test_loss: 1.0751, test_f1: 0.5366
 epoch: 18, train_loss: 0.7972, test_loss: 1.0917, test_f1: 0.5281
 epoch: 19, train_loss: 0.7922, test_loss: 1.0892, test_f1: 0.5453
 epoch: 20, train_loss: 0.7838, test_loss: 1.0428, test_f1: 0.5735
 epoch: 21, train_loss: 0.7588, test_loss: 1.0314, test_f1: 0.5626
 epoch: 22, train_loss: 0.7560, test_loss: 1.0544, test_f1: 0.5677
 epoch: 23, train_loss: 0.7482, test_loss: 1.0591, test_f1: 0.5646
 epoch: 24, train_loss: 0.7462, test_loss: 1.0546, test_f1: 0.5832
 epoch: 25, train_loss: 0.7552, test_loss: 1.0618, test_f1: 0.5855
 epoch: 26, train_loss: 0.7590, test_loss: 1.1038, test_f1: 0.5855
 epoch: 27, train_loss: 0.7562, test_loss: 1.1172, test_f1: 0.5834
 epoch: 28, train_loss: 0.7341, test_loss: 1.1078, test_f1: 0.5676
 epoch: 29, train_loss: 0.7417, test_loss: 1.1027, test_f1: 0.5671
 epoch: 30, train_loss: 0.7180, test_loss: 1.1384, test_f1: 0.5773
 epoch: 31, train_loss: 0.7103, test_loss: 1.0944, test_f1: 0.5919
 epoch: 32, train_loss: 0.7234, test_loss: 1.1809, test_f1: 0.5370
 epoch: 33, train_loss: 0.7217, test_loss: 1.1905, test_f1: 0.5438
 epoch: 34, train_loss: 0.7082, test_loss: 1.2037, test_f1: 0.5163
 epoch: 35, train_loss: 0.7097, test_loss: 1.1521, test_f1: 0.5168
 epoch: 36, train_loss: 0.7032, test_loss: 1.2147, test_f1: 0.5081
 epoch: 37, train_loss: 0.6876, test_loss: 1.2017, test_f1: 0.5583
 epoch: 38, train_loss: 0.6933, test_loss: 1.1877, test_f1: 0.5936
 epoch: 39, train_loss: 0.6741, test_loss: 1.2188, test_f1: 0.6083
 epoch: 40, train_loss: 0.6950, test_loss: 1.2111, test_f1: 0.5586
 epoch: 41, train_loss: 0.6838, test_loss: 1.2474, test_f1: 0.5554
 epoch: 42, train_loss: 0.6688, test_loss: 1.3133, test_f1: 0.5478
 epoch: 43, train_loss: 0.6485, test_loss: 1.2903, test_f1: 0.5217
 epoch: 44, train_loss: 0.6537, test_loss: 1.2509, test_f1: 0.5552
 epoch: 45, train_loss: 0.6507, test_loss: 1.2480, test_f1: 0.5269
 epoch: 46, train_loss: 0.6455, test_loss: 1.3925, test_f1: 0.5215
 epoch: 47, train_loss: 0.6570, test_loss: 1.3679, test_f1: 0.5538
 epoch: 48, train_loss: 0.6451, test_loss: 1.3090, test_f1: 0.5893
 epoch: 49, train_loss: 0.6562, test_loss: 1.3093, test_f1: 0.5743
 epoch: 50, train_loss: 0.6832, test_loss: 1.2830, test_f1: 0.5670
 epoch: 51, train_loss: 0.6524, test_loss: 1.2684, test_f1: 0.6030
 epoch: 52, train_loss: 0.6411, test_loss: 1.2701, test_f1: 0.5867
 epoch: 53, train_loss: 0.6245, test_loss: 1.2670, test_f1: 0.5710
 epoch: 54, train_loss: 0.6375, test_loss: 1.3274, test_f1: 0.5885
 epoch: 55, train_loss: 0.6287, test_loss: 1.2197, test_f1: 0.6088
 epoch: 56, train_loss: 0.6238, test_loss: 1.2169, test_f1: 0.5913
 epoch: 57, train_loss: 0.6243, test_loss: 1.2709, test_f1: 0.5765
 epoch: 58, train_loss: 0.6175, test_loss: 1.2578, test_f1: 0.5710
 epoch: 59, train_loss: 0.5989, test_loss: 1.2694, test_f1: 0.5479
 epoch: 60, train_loss: 0.5976, test_loss: 1.3011, test_f1: 0.5689
 epoch: 61, train_loss: 0.6046, test_loss: 1.2911, test_f1: 0.5835
 epoch: 62, train_loss: 0.5897, test_loss: 1.3508, test_f1: 0.5645
 epoch: 63, train_loss: 0.5923, test_loss: 1.4298, test_f1: 0.5588
 epoch: 64, train_loss: 0.5956, test_loss: 1.3832, test_f1: 0.5580
 epoch: 65, train_loss: 0.6022, test_loss: 1.3760, test_f1: 0.5509
 epoch: 66, train_loss: 0.6127, test_loss: 1.3853, test_f1: 0.5671
 epoch: 67, train_loss: 0.5988, test_loss: 1.2927, test_f1: 0.5954
 epoch: 68, train_loss: 0.6071, test_loss: 1.3680, test_f1: 0.5767
 epoch: 69, train_loss: 0.5978, test_loss: 1.4117, test_f1: 0.5567
 epoch: 70, train_loss: 0.6025, test_loss: 1.3635, test_f1: 0.5596
 epoch: 71, train_loss: 0.6074, test_loss: 1.4293, test_f1: 0.5484
 epoch: 72, train_loss: 0.5886, test_loss: 1.4252, test_f1: 0.5530
 epoch: 73, train_loss: 0.5893, test_loss: 1.3263, test_f1: 0.5683
 epoch: 74, train_loss: 0.5787, test_loss: 1.3774, test_f1: 0.5844
 epoch: 75, train_loss: 0.5883, test_loss: 1.3352, test_f1: 0.5866
 epoch: 76, train_loss: 0.5796, test_loss: 1.3477, test_f1: 0.5645
 epoch: 77, train_loss: 0.5778, test_loss: 1.3755, test_f1: 0.5887
 epoch: 78, train_loss: 0.5717, test_loss: 1.4103, test_f1: 0.5765
 epoch: 79, train_loss: 0.5728, test_loss: 1.4265, test_f1: 0.5660
 epoch: 80, train_loss: 0.5603, test_loss: 1.3945, test_f1: 0.5611
 epoch: 81, train_loss: 0.5655, test_loss: 1.4410, test_f1: 0.5436
 epoch: 82, train_loss: 0.5526, test_loss: 1.5261, test_f1: 0.5338
 epoch: 83, train_loss: 0.5784, test_loss: 1.5017, test_f1: 0.5292
 epoch: 84, train_loss: 0.5625, test_loss: 1.5071, test_f1: 0.5498
 epoch: 85, train_loss: 0.5648, test_loss: 1.4650, test_f1: 0.5596
 epoch: 86, train_loss: 0.5585, test_loss: 1.5098, test_f1: 0.5831
 epoch: 87, train_loss: 0.5392, test_loss: 1.5057, test_f1: 0.5464
 epoch: 88, train_loss: 0.5595, test_loss: 1.5217, test_f1: 0.5244
 epoch: 89, train_loss: 0.5449, test_loss: 1.5790, test_f1: 0.5385
 epoch: 90, train_loss: 0.5542, test_loss: 1.6395, test_f1: 0.5355
 epoch: 91, train_loss: 0.5666, test_loss: 1.7231, test_f1: 0.5264
 epoch: 92, train_loss: 0.5731, test_loss: 1.5890, test_f1: 0.5540
 epoch: 93, train_loss: 0.5513, test_loss: 1.4698, test_f1: 0.5659
 epoch: 94, train_loss: 0.5579, test_loss: 1.4283, test_f1: 0.5742
 epoch: 95, train_loss: 0.5340, test_loss: 1.4988, test_f1: 0.5724
 epoch: 96, train_loss: 0.5681, test_loss: 1.4363, test_f1: 0.5555
 epoch: 97, train_loss: 0.5835, test_loss: 1.4382, test_f1: 0.5514
 epoch: 98, train_loss: 0.5669, test_loss: 1.5382, test_f1: 0.5345
 epoch: 99, train_loss: 0.5567, test_loss: 1.5649, test_f1: 0.5473
##################ITERATION #5 ****************************************
 epoch: 0, train_loss: 1.2703, test_loss: 1.3266, test_f1: 0.2281
 epoch: 1, train_loss: 1.1526, test_loss: 1.3182, test_f1: 0.2281
 epoch: 2, train_loss: 1.0973, test_loss: 1.2987, test_f1: 0.2281
 epoch: 3, train_loss: 1.0604, test_loss: 1.2761, test_f1: 0.2242
 epoch: 4, train_loss: 1.0383, test_loss: 1.2222, test_f1: 0.2590
 epoch: 5, train_loss: 1.0029, test_loss: 1.1524, test_f1: 0.3500
 epoch: 6, train_loss: 0.9825, test_loss: 1.0817, test_f1: 0.4922
 epoch: 7, train_loss: 0.9654, test_loss: 1.0331, test_f1: 0.5245
 epoch: 8, train_loss: 0.9350, test_loss: 1.0358, test_f1: 0.5534
 epoch: 9, train_loss: 0.9132, test_loss: 1.0496, test_f1: 0.5255
 epoch: 10, train_loss: 0.9112, test_loss: 1.0344, test_f1: 0.5272
 epoch: 11, train_loss: 0.8970, test_loss: 1.0255, test_f1: 0.5172
 epoch: 12, train_loss: 0.8908, test_loss: 1.0734, test_f1: 0.5287
 epoch: 13, train_loss: 0.8856, test_loss: 1.0305, test_f1: 0.5244
 epoch: 14, train_loss: 0.8689, test_loss: 0.9817, test_f1: 0.5418
 epoch: 15, train_loss: 0.8505, test_loss: 1.0123, test_f1: 0.5035
 epoch: 16, train_loss: 0.8387, test_loss: 0.9945, test_f1: 0.5101
 epoch: 17, train_loss: 0.8426, test_loss: 0.9819, test_f1: 0.5244
 epoch: 18, train_loss: 0.8207, test_loss: 0.9918, test_f1: 0.5362
 epoch: 19, train_loss: 0.8111, test_loss: 0.9886, test_f1: 0.5315
 epoch: 20, train_loss: 0.8150, test_loss: 0.9709, test_f1: 0.5460
 epoch: 21, train_loss: 0.7944, test_loss: 1.0296, test_f1: 0.5074
 epoch: 22, train_loss: 0.7980, test_loss: 0.9963, test_f1: 0.5242
 epoch: 23, train_loss: 0.8014, test_loss: 1.0308, test_f1: 0.5042
 epoch: 24, train_loss: 0.7765, test_loss: 1.0476, test_f1: 0.5297
 epoch: 25, train_loss: 0.7767, test_loss: 1.0296, test_f1: 0.5026
 epoch: 26, train_loss: 0.7602, test_loss: 0.9912, test_f1: 0.4951
 epoch: 27, train_loss: 0.7645, test_loss: 0.9815, test_f1: 0.5192
 epoch: 28, train_loss: 0.7503, test_loss: 1.0172, test_f1: 0.5471
 epoch: 29, train_loss: 0.7541, test_loss: 0.9422, test_f1: 0.5415
 epoch: 30, train_loss: 0.7564, test_loss: 0.9376, test_f1: 0.5618
 epoch: 31, train_loss: 0.7481, test_loss: 1.0081, test_f1: 0.5346
 epoch: 32, train_loss: 0.7395, test_loss: 1.0689, test_f1: 0.5278
 epoch: 33, train_loss: 0.7288, test_loss: 1.0096, test_f1: 0.5554
 epoch: 34, train_loss: 0.7300, test_loss: 1.0179, test_f1: 0.5588
 epoch: 35, train_loss: 0.7108, test_loss: 0.9682, test_f1: 0.6001
 epoch: 36, train_loss: 0.7186, test_loss: 0.9268, test_f1: 0.5885
 epoch: 37, train_loss: 0.7170, test_loss: 1.0162, test_f1: 0.5390
 epoch: 38, train_loss: 0.7188, test_loss: 1.0735, test_f1: 0.5981
 epoch: 39, train_loss: 0.7216, test_loss: 1.0035, test_f1: 0.5787
 epoch: 40, train_loss: 0.7005, test_loss: 1.0493, test_f1: 0.5540
 epoch: 41, train_loss: 0.6878, test_loss: 1.1591, test_f1: 0.5372
 epoch: 42, train_loss: 0.6677, test_loss: 1.2546, test_f1: 0.5138
 epoch: 43, train_loss: 0.6838, test_loss: 1.1581, test_f1: 0.5283
 epoch: 44, train_loss: 0.6995, test_loss: 0.9902, test_f1: 0.5452
 epoch: 45, train_loss: 0.6766, test_loss: 1.1074, test_f1: 0.5749
 epoch: 46, train_loss: 0.7037, test_loss: 1.0209, test_f1: 0.5501
 epoch: 47, train_loss: 0.7033, test_loss: 1.0517, test_f1: 0.5240
 epoch: 48, train_loss: 0.6721, test_loss: 1.1255, test_f1: 0.5705
 epoch: 49, train_loss: 0.6845, test_loss: 0.9596, test_f1: 0.6367
 epoch: 50, train_loss: 0.6882, test_loss: 1.1297, test_f1: 0.5705
 epoch: 51, train_loss: 0.6904, test_loss: 1.1570, test_f1: 0.5617
 epoch: 52, train_loss: 0.6691, test_loss: 1.1190, test_f1: 0.5913
 epoch: 53, train_loss: 0.6577, test_loss: 1.0844, test_f1: 0.6116
 epoch: 54, train_loss: 0.6523, test_loss: 1.0715, test_f1: 0.6200
 epoch: 55, train_loss: 0.6477, test_loss: 0.9820, test_f1: 0.6115
 epoch: 56, train_loss: 0.6362, test_loss: 1.0216, test_f1: 0.6192
 epoch: 57, train_loss: 0.6353, test_loss: 1.0984, test_f1: 0.5985
 epoch: 58, train_loss: 0.6610, test_loss: 1.0554, test_f1: 0.5841
 epoch: 59, train_loss: 0.6507, test_loss: 1.1425, test_f1: 0.5768
 epoch: 60, train_loss: 0.6662, test_loss: 1.1320, test_f1: 0.5465
 epoch: 61, train_loss: 0.6584, test_loss: 1.0453, test_f1: 0.5655
 epoch: 62, train_loss: 0.6462, test_loss: 1.0555, test_f1: 0.5882
 epoch: 63, train_loss: 0.6383, test_loss: 1.0328, test_f1: 0.6239
 epoch: 64, train_loss: 0.6332, test_loss: 1.1141, test_f1: 0.5996
 epoch: 65, train_loss: 0.6548, test_loss: 1.0978, test_f1: 0.6130
 epoch: 66, train_loss: 0.6296, test_loss: 1.0411, test_f1: 0.5899
 epoch: 67, train_loss: 0.6249, test_loss: 1.0668, test_f1: 0.5587
 epoch: 68, train_loss: 0.6250, test_loss: 1.1631, test_f1: 0.5804
 epoch: 69, train_loss: 0.6295, test_loss: 1.1442, test_f1: 0.5816
 epoch: 70, train_loss: 0.6288, test_loss: 1.1382, test_f1: 0.6129
 epoch: 71, train_loss: 0.6268, test_loss: 1.1494, test_f1: 0.5891
 epoch: 72, train_loss: 0.6315, test_loss: 1.1344, test_f1: 0.5914
 epoch: 73, train_loss: 0.6184, test_loss: 1.1069, test_f1: 0.6061
 epoch: 74, train_loss: 0.6230, test_loss: 1.1437, test_f1: 0.6134
 epoch: 75, train_loss: 0.6045, test_loss: 1.2573, test_f1: 0.6165
 epoch: 76, train_loss: 0.6049, test_loss: 1.1132, test_f1: 0.6135
 epoch: 77, train_loss: 0.6129, test_loss: 1.1776, test_f1: 0.5628
 epoch: 78, train_loss: 0.6248, test_loss: 1.1383, test_f1: 0.5988
 epoch: 79, train_loss: 0.6151, test_loss: 1.1063, test_f1: 0.5888
 epoch: 80, train_loss: 0.5973, test_loss: 1.1264, test_f1: 0.5955
 epoch: 81, train_loss: 0.5898, test_loss: 1.0914, test_f1: 0.6061
 epoch: 82, train_loss: 0.6114, test_loss: 1.1974, test_f1: 0.6259
 epoch: 83, train_loss: 0.5956, test_loss: 1.1433, test_f1: 0.5838
 epoch: 84, train_loss: 0.6020, test_loss: 1.0477, test_f1: 0.5938
 epoch: 85, train_loss: 0.5997, test_loss: 1.0637, test_f1: 0.6264
 epoch: 86, train_loss: 0.5960, test_loss: 1.0688, test_f1: 0.6332
 epoch: 87, train_loss: 0.5821, test_loss: 1.1263, test_f1: 0.6108
 epoch: 88, train_loss: 0.5841, test_loss: 1.1483, test_f1: 0.6240
 epoch: 89, train_loss: 0.5877, test_loss: 1.1555, test_f1: 0.5875
 epoch: 90, train_loss: 0.5747, test_loss: 1.1911, test_f1: 0.5881
 epoch: 91, train_loss: 0.6213, test_loss: 1.1906, test_f1: 0.6251
 epoch: 92, train_loss: 0.5883, test_loss: 1.2288, test_f1: 0.5865
 epoch: 93, train_loss: 0.5867, test_loss: 1.3155, test_f1: 0.5493
 epoch: 94, train_loss: 0.5751, test_loss: 1.1430, test_f1: 0.5849
 epoch: 95, train_loss: 0.5930, test_loss: 1.1217, test_f1: 0.5954
 epoch: 96, train_loss: 0.5693, test_loss: 1.2126, test_f1: 0.5780
 epoch: 97, train_loss: 0.5758, test_loss: 1.1065, test_f1: 0.5945
 epoch: 98, train_loss: 0.5732, test_loss: 1.0124, test_f1: 0.5899
 epoch: 99, train_loss: 0.5560, test_loss: 1.1821, test_f1: 0.5730
##################ITERATION #6 ****************************************
 epoch: 0, train_loss: 1.2543, test_loss: 1.4608, test_f1: 0.3103
 epoch: 1, train_loss: 1.0990, test_loss: 1.4337, test_f1: 0.3115
 epoch: 2, train_loss: 1.0676, test_loss: 1.3616, test_f1: 0.3019
 epoch: 3, train_loss: 1.0357, test_loss: 1.2978, test_f1: 0.2587
 epoch: 4, train_loss: 1.0141, test_loss: 1.2318, test_f1: 0.2639
 epoch: 5, train_loss: 0.9965, test_loss: 1.2102, test_f1: 0.3191
 epoch: 6, train_loss: 0.9860, test_loss: 1.1668, test_f1: 0.3379
 epoch: 7, train_loss: 0.9628, test_loss: 1.1234, test_f1: 0.3846
 epoch: 8, train_loss: 0.9516, test_loss: 1.0851, test_f1: 0.4001
 epoch: 9, train_loss: 0.9275, test_loss: 1.1021, test_f1: 0.3923
 epoch: 10, train_loss: 0.9373, test_loss: 1.0385, test_f1: 0.4440
 epoch: 11, train_loss: 0.9311, test_loss: 1.0122, test_f1: 0.4797
 epoch: 12, train_loss: 0.8899, test_loss: 0.9906, test_f1: 0.5348
 epoch: 13, train_loss: 0.8913, test_loss: 0.9843, test_f1: 0.5361
 epoch: 14, train_loss: 0.8920, test_loss: 0.9742, test_f1: 0.5974
 epoch: 15, train_loss: 0.8651, test_loss: 0.9622, test_f1: 0.6202
 epoch: 16, train_loss: 0.8584, test_loss: 0.9723, test_f1: 0.6138
 epoch: 17, train_loss: 0.8490, test_loss: 0.9417, test_f1: 0.6190
 epoch: 18, train_loss: 0.8324, test_loss: 0.9545, test_f1: 0.6111
 epoch: 19, train_loss: 0.8527, test_loss: 0.9860, test_f1: 0.6161
 epoch: 20, train_loss: 0.8311, test_loss: 0.9835, test_f1: 0.5625
 epoch: 21, train_loss: 0.8175, test_loss: 1.0042, test_f1: 0.5624
 epoch: 22, train_loss: 0.8033, test_loss: 0.9941, test_f1: 0.5696
 epoch: 23, train_loss: 0.7951, test_loss: 0.9528, test_f1: 0.6097
 epoch: 24, train_loss: 0.7841, test_loss: 0.9448, test_f1: 0.6135
 epoch: 25, train_loss: 0.7846, test_loss: 0.9528, test_f1: 0.5937
 epoch: 26, train_loss: 0.7702, test_loss: 0.9933, test_f1: 0.5709
 epoch: 27, train_loss: 0.7713, test_loss: 1.0071, test_f1: 0.5718
 epoch: 28, train_loss: 0.7683, test_loss: 0.9401, test_f1: 0.5978
 epoch: 29, train_loss: 0.7784, test_loss: 1.0021, test_f1: 0.5854
 epoch: 30, train_loss: 0.7829, test_loss: 0.9236, test_f1: 0.6457
 epoch: 31, train_loss: 0.7682, test_loss: 0.9344, test_f1: 0.5642
 epoch: 32, train_loss: 0.7683, test_loss: 0.9390, test_f1: 0.5883
 epoch: 33, train_loss: 0.7455, test_loss: 0.9184, test_f1: 0.5907
 epoch: 34, train_loss: 0.7541, test_loss: 0.9191, test_f1: 0.6303
 epoch: 35, train_loss: 0.7441, test_loss: 0.9231, test_f1: 0.6387
 epoch: 36, train_loss: 0.7263, test_loss: 0.9327, test_f1: 0.5682
 epoch: 37, train_loss: 0.7171, test_loss: 0.9771, test_f1: 0.5655
 epoch: 38, train_loss: 0.7172, test_loss: 0.9333, test_f1: 0.5781
 epoch: 39, train_loss: 0.7291, test_loss: 1.0870, test_f1: 0.5764
 epoch: 40, train_loss: 0.7329, test_loss: 0.9135, test_f1: 0.6170
 epoch: 41, train_loss: 0.7293, test_loss: 1.0027, test_f1: 0.5363
 epoch: 42, train_loss: 0.7459, test_loss: 0.9170, test_f1: 0.5915
 epoch: 43, train_loss: 0.7032, test_loss: 0.8942, test_f1: 0.6568
 epoch: 44, train_loss: 0.6954, test_loss: 0.9366, test_f1: 0.5962
 epoch: 45, train_loss: 0.6996, test_loss: 1.0123, test_f1: 0.5716
 epoch: 46, train_loss: 0.6857, test_loss: 0.9915, test_f1: 0.5982
 epoch: 47, train_loss: 0.6868, test_loss: 1.0254, test_f1: 0.5408
 epoch: 48, train_loss: 0.6757, test_loss: 1.0027, test_f1: 0.5557
 epoch: 49, train_loss: 0.6620, test_loss: 1.0127, test_f1: 0.5361
 epoch: 50, train_loss: 0.6767, test_loss: 1.0327, test_f1: 0.5682
 epoch: 51, train_loss: 0.6658, test_loss: 1.0332, test_f1: 0.5619
 epoch: 52, train_loss: 0.6618, test_loss: 0.9974, test_f1: 0.5892
 epoch: 53, train_loss: 0.6571, test_loss: 1.0160, test_f1: 0.5984
 epoch: 54, train_loss: 0.6430, test_loss: 1.0109, test_f1: 0.5593
 epoch: 55, train_loss: 0.6391, test_loss: 0.9799, test_f1: 0.5614
 epoch: 56, train_loss: 0.6342, test_loss: 0.9370, test_f1: 0.5703
 epoch: 57, train_loss: 0.6438, test_loss: 0.9635, test_f1: 0.5524
 epoch: 58, train_loss: 0.6321, test_loss: 0.9844, test_f1: 0.5650
 epoch: 59, train_loss: 0.6339, test_loss: 0.9571, test_f1: 0.5802
 epoch: 60, train_loss: 0.6430, test_loss: 0.9200, test_f1: 0.5782
 epoch: 61, train_loss: 0.6282, test_loss: 0.9247, test_f1: 0.5845
 epoch: 62, train_loss: 0.6309, test_loss: 0.9160, test_f1: 0.5690
 epoch: 63, train_loss: 0.6337, test_loss: 0.9404, test_f1: 0.5517
 epoch: 64, train_loss: 0.6300, test_loss: 0.9366, test_f1: 0.5726
 epoch: 65, train_loss: 0.6249, test_loss: 0.9233, test_f1: 0.5722
 epoch: 66, train_loss: 0.6261, test_loss: 0.9477, test_f1: 0.5426
 epoch: 67, train_loss: 0.6225, test_loss: 0.9479, test_f1: 0.5535
 epoch: 68, train_loss: 0.6348, test_loss: 1.0108, test_f1: 0.5452
 epoch: 69, train_loss: 0.6258, test_loss: 1.0104, test_f1: 0.5909
 epoch: 70, train_loss: 0.6241, test_loss: 1.0089, test_f1: 0.5855
 epoch: 71, train_loss: 0.6282, test_loss: 1.1066, test_f1: 0.5540
 epoch: 72, train_loss: 0.6047, test_loss: 1.0801, test_f1: 0.5600
 epoch: 73, train_loss: 0.6165, test_loss: 1.0618, test_f1: 0.5518
 epoch: 74, train_loss: 0.6077, test_loss: 1.0660, test_f1: 0.5430
 epoch: 75, train_loss: 0.5935, test_loss: 1.0369, test_f1: 0.5580
 epoch: 76, train_loss: 0.5813, test_loss: 1.0205, test_f1: 0.5638
 epoch: 77, train_loss: 0.5912, test_loss: 1.0664, test_f1: 0.5327
 epoch: 78, train_loss: 0.5927, test_loss: 1.0460, test_f1: 0.5441
 epoch: 79, train_loss: 0.6121, test_loss: 1.0211, test_f1: 0.5419
 epoch: 80, train_loss: 0.5946, test_loss: 1.0192, test_f1: 0.5557
 epoch: 81, train_loss: 0.6138, test_loss: 0.9895, test_f1: 0.5737
 epoch: 82, train_loss: 0.5955, test_loss: 0.9771, test_f1: 0.5814
 epoch: 83, train_loss: 0.5946, test_loss: 0.9489, test_f1: 0.5780
 epoch: 84, train_loss: 0.5951, test_loss: 0.9587, test_f1: 0.5386
 epoch: 85, train_loss: 0.5861, test_loss: 1.0093, test_f1: 0.5190
 epoch: 86, train_loss: 0.5936, test_loss: 1.0756, test_f1: 0.4987
 epoch: 87, train_loss: 0.5955, test_loss: 0.9840, test_f1: 0.5483
 epoch: 88, train_loss: 0.5906, test_loss: 0.9716, test_f1: 0.6187
 epoch: 89, train_loss: 0.5947, test_loss: 0.9649, test_f1: 0.6075
 epoch: 90, train_loss: 0.6099, test_loss: 0.9756, test_f1: 0.5751
 epoch: 91, train_loss: 0.5947, test_loss: 0.9827, test_f1: 0.5591
 epoch: 92, train_loss: 0.5843, test_loss: 0.9272, test_f1: 0.6074
 epoch: 93, train_loss: 0.5704, test_loss: 0.9658, test_f1: 0.5646
 epoch: 94, train_loss: 0.5731, test_loss: 0.9652, test_f1: 0.5794
 epoch: 95, train_loss: 0.5604, test_loss: 0.9594, test_f1: 0.5855
 epoch: 96, train_loss: 0.5731, test_loss: 1.0397, test_f1: 0.5898
 epoch: 97, train_loss: 0.5819, test_loss: 1.0612, test_f1: 0.5628
 epoch: 98, train_loss: 0.5793, test_loss: 0.9589, test_f1: 0.5837
 epoch: 99, train_loss: 0.5788, test_loss: 0.9524, test_f1: 0.5777
##################ITERATION #7 ****************************************
 epoch: 0, train_loss: 1.3010, test_loss: 1.3661, test_f1: 0.2281
 epoch: 1, train_loss: 1.1782, test_loss: 1.3443, test_f1: 0.2281
 epoch: 2, train_loss: 1.1327, test_loss: 1.3259, test_f1: 0.2285
 epoch: 3, train_loss: 1.1176, test_loss: 1.3082, test_f1: 0.3280
 epoch: 4, train_loss: 1.0807, test_loss: 1.2967, test_f1: 0.3070
 epoch: 5, train_loss: 1.0579, test_loss: 1.2883, test_f1: 0.3014
 epoch: 6, train_loss: 1.0404, test_loss: 1.2558, test_f1: 0.3374
 epoch: 7, train_loss: 1.0048, test_loss: 1.2063, test_f1: 0.4080
 epoch: 8, train_loss: 0.9953, test_loss: 1.1998, test_f1: 0.3689
 epoch: 9, train_loss: 0.9927, test_loss: 1.1193, test_f1: 0.4861
 epoch: 10, train_loss: 0.9806, test_loss: 1.1096, test_f1: 0.4585
 epoch: 11, train_loss: 0.9509, test_loss: 1.0646, test_f1: 0.5385
 epoch: 12, train_loss: 0.9399, test_loss: 1.0270, test_f1: 0.5740
 epoch: 13, train_loss: 0.9212, test_loss: 1.0189, test_f1: 0.5659
 epoch: 14, train_loss: 0.9135, test_loss: 1.0261, test_f1: 0.5677
 epoch: 15, train_loss: 0.9059, test_loss: 1.0577, test_f1: 0.5210
 epoch: 16, train_loss: 0.8818, test_loss: 1.0227, test_f1: 0.5462
 epoch: 17, train_loss: 0.8850, test_loss: 0.9836, test_f1: 0.5845
 epoch: 18, train_loss: 0.8681, test_loss: 0.9953, test_f1: 0.5506
 epoch: 19, train_loss: 0.8672, test_loss: 0.9503, test_f1: 0.6096
 epoch: 20, train_loss: 0.8402, test_loss: 0.9718, test_f1: 0.5949
 epoch: 21, train_loss: 0.8392, test_loss: 1.0500, test_f1: 0.5410
 epoch: 22, train_loss: 0.8247, test_loss: 0.9792, test_f1: 0.6220
 epoch: 23, train_loss: 0.8094, test_loss: 1.0073, test_f1: 0.5739
 epoch: 24, train_loss: 0.8056, test_loss: 1.0048, test_f1: 0.5944
 epoch: 25, train_loss: 0.7844, test_loss: 1.0573, test_f1: 0.5306
 epoch: 26, train_loss: 0.7952, test_loss: 1.0620, test_f1: 0.5631
 epoch: 27, train_loss: 0.7923, test_loss: 1.0588, test_f1: 0.5459
 epoch: 28, train_loss: 0.7889, test_loss: 1.0983, test_f1: 0.5550
 epoch: 29, train_loss: 0.7677, test_loss: 1.0227, test_f1: 0.5871
 epoch: 30, train_loss: 0.7592, test_loss: 1.0548, test_f1: 0.5553
 epoch: 31, train_loss: 0.7494, test_loss: 1.1804, test_f1: 0.5249
 epoch: 32, train_loss: 0.7558, test_loss: 1.1696, test_f1: 0.5531
 epoch: 33, train_loss: 0.7432, test_loss: 1.2012, test_f1: 0.5971
 epoch: 34, train_loss: 0.7455, test_loss: 1.2684, test_f1: 0.5576
 epoch: 35, train_loss: 0.7410, test_loss: 1.2536, test_f1: 0.5807
 epoch: 36, train_loss: 0.7284, test_loss: 1.2917, test_f1: 0.5683
 epoch: 37, train_loss: 0.7365, test_loss: 1.3179, test_f1: 0.5538
 epoch: 38, train_loss: 0.7242, test_loss: 1.4399, test_f1: 0.5065
 epoch: 39, train_loss: 0.7172, test_loss: 1.2367, test_f1: 0.5459
 epoch: 40, train_loss: 0.7172, test_loss: 1.3708, test_f1: 0.5459
 epoch: 41, train_loss: 0.7748, test_loss: 1.2638, test_f1: 0.5183
 epoch: 42, train_loss: 0.7618, test_loss: 1.1280, test_f1: 0.5717
 epoch: 43, train_loss: 0.7640, test_loss: 1.0758, test_f1: 0.5629
 epoch: 44, train_loss: 0.7319, test_loss: 1.0647, test_f1: 0.5037
 epoch: 45, train_loss: 0.7242, test_loss: 1.0336, test_f1: 0.5824
 epoch: 46, train_loss: 0.7122, test_loss: 1.3383, test_f1: 0.5498
 epoch: 47, train_loss: 0.7067, test_loss: 1.3290, test_f1: 0.6020
 epoch: 48, train_loss: 0.6987, test_loss: 1.2468, test_f1: 0.5635
 epoch: 49, train_loss: 0.7001, test_loss: 1.5789, test_f1: 0.4831
 epoch: 50, train_loss: 0.6984, test_loss: 1.2765, test_f1: 0.5689
 epoch: 51, train_loss: 0.6809, test_loss: 1.2685, test_f1: 0.5033
 epoch: 52, train_loss: 0.6718, test_loss: 1.2366, test_f1: 0.5123
 epoch: 53, train_loss: 0.6763, test_loss: 1.1870, test_f1: 0.5495
 epoch: 54, train_loss: 0.6630, test_loss: 1.1780, test_f1: 0.5838
 epoch: 55, train_loss: 0.6661, test_loss: 1.2537, test_f1: 0.5182
 epoch: 56, train_loss: 0.6636, test_loss: 1.2070, test_f1: 0.5719
 epoch: 57, train_loss: 0.6551, test_loss: 1.2289, test_f1: 0.5697
 epoch: 58, train_loss: 0.6567, test_loss: 1.2960, test_f1: 0.5757
 epoch: 59, train_loss: 0.6520, test_loss: 1.3186, test_f1: 0.5588
 epoch: 60, train_loss: 0.6539, test_loss: 1.3675, test_f1: 0.5742
 epoch: 61, train_loss: 0.6394, test_loss: 1.3127, test_f1: 0.5566
 epoch: 62, train_loss: 0.6481, test_loss: 1.2249, test_f1: 0.5818
 epoch: 63, train_loss: 0.6391, test_loss: 1.2580, test_f1: 0.5683
 epoch: 64, train_loss: 0.6226, test_loss: 1.2891, test_f1: 0.5746
 epoch: 65, train_loss: 0.6292, test_loss: 1.3594, test_f1: 0.5643
 epoch: 66, train_loss: 0.6350, test_loss: 1.3992, test_f1: 0.5687
 epoch: 67, train_loss: 0.6264, test_loss: 1.4145, test_f1: 0.5913
 epoch: 68, train_loss: 0.6347, test_loss: 1.4881, test_f1: 0.5745
 epoch: 69, train_loss: 0.6332, test_loss: 1.7471, test_f1: 0.5641
 epoch: 70, train_loss: 0.6260, test_loss: 1.7364, test_f1: 0.5639
 epoch: 71, train_loss: 0.6364, test_loss: 1.5363, test_f1: 0.5658
 epoch: 72, train_loss: 0.6167, test_loss: 1.2287, test_f1: 0.5621
 epoch: 73, train_loss: 0.6130, test_loss: 1.3997, test_f1: 0.5878
 epoch: 74, train_loss: 0.6196, test_loss: 1.5668, test_f1: 0.5565
 epoch: 75, train_loss: 0.6001, test_loss: 1.6129, test_f1: 0.5504
 epoch: 76, train_loss: 0.6187, test_loss: 1.4618, test_f1: 0.5842
 epoch: 77, train_loss: 0.6167, test_loss: 1.3870, test_f1: 0.5875
 epoch: 78, train_loss: 0.6144, test_loss: 1.5027, test_f1: 0.5691
 epoch: 79, train_loss: 0.6263, test_loss: 1.5618, test_f1: 0.5352
 epoch: 80, train_loss: 0.6203, test_loss: 1.4404, test_f1: 0.5717
 epoch: 81, train_loss: 0.5956, test_loss: 1.3644, test_f1: 0.5871
 epoch: 82, train_loss: 0.6077, test_loss: 1.2986, test_f1: 0.5943
 epoch: 83, train_loss: 0.6170, test_loss: 1.2960, test_f1: 0.5735
 epoch: 84, train_loss: 0.6030, test_loss: 1.3632, test_f1: 0.5962
 epoch: 85, train_loss: 0.6079, test_loss: 1.3752, test_f1: 0.5941
 epoch: 86, train_loss: 0.6019, test_loss: 1.3856, test_f1: 0.5845
 epoch: 87, train_loss: 0.5829, test_loss: 1.4673, test_f1: 0.5849
 epoch: 88, train_loss: 0.5981, test_loss: 1.6138, test_f1: 0.5384
 epoch: 89, train_loss: 0.5871, test_loss: 1.6985, test_f1: 0.5805
 epoch: 90, train_loss: 0.5838, test_loss: 1.7216, test_f1: 0.5756
 epoch: 91, train_loss: 0.5905, test_loss: 1.6553, test_f1: 0.5775
 epoch: 92, train_loss: 0.6281, test_loss: 1.6582, test_f1: 0.5572
 epoch: 93, train_loss: 0.6267, test_loss: 1.5347, test_f1: 0.5376
 epoch: 94, train_loss: 0.6044, test_loss: 1.5241, test_f1: 0.5669
 epoch: 95, train_loss: 0.5996, test_loss: 1.3830, test_f1: 0.5867
 epoch: 96, train_loss: 0.5943, test_loss: 1.3861, test_f1: 0.5998
 epoch: 97, train_loss: 0.5837, test_loss: 1.4489, test_f1: 0.6062
 epoch: 98, train_loss: 0.5892, test_loss: 1.5871, test_f1: 0.6197
 epoch: 99, train_loss: 0.5910, test_loss: 1.6479, test_f1: 0.5735
##################ITERATION #8 ****************************************
 epoch: 0, train_loss: 1.4386, test_loss: 1.4107, test_f1: 0.3443
 epoch: 1, train_loss: 1.2114, test_loss: 1.3758, test_f1: 0.3390
 epoch: 2, train_loss: 1.1527, test_loss: 1.3728, test_f1: 0.3457
 epoch: 3, train_loss: 1.1134, test_loss: 1.3786, test_f1: 0.3473
 epoch: 4, train_loss: 1.1040, test_loss: 1.3771, test_f1: 0.2782
 epoch: 5, train_loss: 1.0559, test_loss: 1.3617, test_f1: 0.2394
 epoch: 6, train_loss: 1.0444, test_loss: 1.3118, test_f1: 0.3001
 epoch: 7, train_loss: 1.0105, test_loss: 1.2449, test_f1: 0.4159
 epoch: 8, train_loss: 0.9822, test_loss: 1.1725, test_f1: 0.4730
 epoch: 9, train_loss: 0.9650, test_loss: 1.1488, test_f1: 0.4815
 epoch: 10, train_loss: 0.9606, test_loss: 1.1047, test_f1: 0.5039
 epoch: 11, train_loss: 0.9401, test_loss: 1.0669, test_f1: 0.5318
 epoch: 12, train_loss: 0.9183, test_loss: 1.0572, test_f1: 0.5213
 epoch: 13, train_loss: 0.9038, test_loss: 1.0412, test_f1: 0.5558
 epoch: 14, train_loss: 0.8825, test_loss: 1.0053, test_f1: 0.5541
 epoch: 15, train_loss: 0.8694, test_loss: 1.0011, test_f1: 0.5481
 epoch: 16, train_loss: 0.8636, test_loss: 1.0361, test_f1: 0.5350
 epoch: 17, train_loss: 0.8596, test_loss: 1.0286, test_f1: 0.5463
 epoch: 18, train_loss: 0.8366, test_loss: 1.0171, test_f1: 0.5526
 epoch: 19, train_loss: 0.8371, test_loss: 1.0112, test_f1: 0.5490
 epoch: 20, train_loss: 0.8143, test_loss: 0.9988, test_f1: 0.5727
 epoch: 21, train_loss: 0.8179, test_loss: 0.9955, test_f1: 0.5594
 epoch: 22, train_loss: 0.8014, test_loss: 1.0029, test_f1: 0.5701
 epoch: 23, train_loss: 0.7902, test_loss: 0.9951, test_f1: 0.5671
 epoch: 24, train_loss: 0.7872, test_loss: 1.0100, test_f1: 0.5476
 epoch: 25, train_loss: 0.7754, test_loss: 1.0014, test_f1: 0.5565
 epoch: 26, train_loss: 0.7640, test_loss: 1.0087, test_f1: 0.5653
 epoch: 27, train_loss: 0.7562, test_loss: 0.9969, test_f1: 0.5769
 epoch: 28, train_loss: 0.7414, test_loss: 0.9883, test_f1: 0.5553
 epoch: 29, train_loss: 0.7285, test_loss: 1.0308, test_f1: 0.5529
 epoch: 30, train_loss: 0.7350, test_loss: 1.0414, test_f1: 0.5496
 epoch: 31, train_loss: 0.7340, test_loss: 0.9942, test_f1: 0.5724
 epoch: 32, train_loss: 0.7329, test_loss: 1.0574, test_f1: 0.5533
 epoch: 33, train_loss: 0.7217, test_loss: 1.0575, test_f1: 0.5500
 epoch: 34, train_loss: 0.7068, test_loss: 1.0496, test_f1: 0.5386
 epoch: 35, train_loss: 0.6867, test_loss: 1.1089, test_f1: 0.5575
 epoch: 36, train_loss: 0.7091, test_loss: 1.1152, test_f1: 0.5494
 epoch: 37, train_loss: 0.6901, test_loss: 1.0905, test_f1: 0.5578
 epoch: 38, train_loss: 0.6793, test_loss: 1.0971, test_f1: 0.5028
 epoch: 39, train_loss: 0.6897, test_loss: 1.1350, test_f1: 0.5419
 epoch: 40, train_loss: 0.6873, test_loss: 1.0568, test_f1: 0.5892
 epoch: 41, train_loss: 0.6614, test_loss: 1.0587, test_f1: 0.5711
 epoch: 42, train_loss: 0.6634, test_loss: 1.1108, test_f1: 0.5549
 epoch: 43, train_loss: 0.6754, test_loss: 1.0840, test_f1: 0.5760
 epoch: 44, train_loss: 0.6586, test_loss: 1.0486, test_f1: 0.5826
 epoch: 45, train_loss: 0.6490, test_loss: 1.0428, test_f1: 0.5579
 epoch: 46, train_loss: 0.6427, test_loss: 1.0937, test_f1: 0.5878
 epoch: 47, train_loss: 0.6352, test_loss: 1.1132, test_f1: 0.5565
 epoch: 48, train_loss: 0.6273, test_loss: 1.0738, test_f1: 0.5740
 epoch: 49, train_loss: 0.6421, test_loss: 1.0901, test_f1: 0.6142
 epoch: 50, train_loss: 0.6348, test_loss: 1.2049, test_f1: 0.5503
 epoch: 51, train_loss: 0.6181, test_loss: 1.1234, test_f1: 0.5740
 epoch: 52, train_loss: 0.6103, test_loss: 1.0762, test_f1: 0.6047
 epoch: 53, train_loss: 0.6002, test_loss: 1.0540, test_f1: 0.6019
 epoch: 54, train_loss: 0.6045, test_loss: 1.0843, test_f1: 0.6028
 epoch: 55, train_loss: 0.5989, test_loss: 1.1466, test_f1: 0.5963
 epoch: 56, train_loss: 0.5997, test_loss: 1.0759, test_f1: 0.5794
 epoch: 57, train_loss: 0.6099, test_loss: 1.1723, test_f1: 0.5406
 epoch: 58, train_loss: 0.5969, test_loss: 1.1813, test_f1: 0.5488
 epoch: 59, train_loss: 0.5959, test_loss: 1.2114, test_f1: 0.5419
 epoch: 60, train_loss: 0.5849, test_loss: 1.2264, test_f1: 0.5490
 epoch: 61, train_loss: 0.5880, test_loss: 1.1655, test_f1: 0.5690
 epoch: 62, train_loss: 0.5863, test_loss: 1.1404, test_f1: 0.5973
 epoch: 63, train_loss: 0.5896, test_loss: 1.2078, test_f1: 0.5809
 epoch: 64, train_loss: 0.5765, test_loss: 1.2743, test_f1: 0.5521
 epoch: 65, train_loss: 0.5694, test_loss: 1.2164, test_f1: 0.5619
 epoch: 66, train_loss: 0.5702, test_loss: 1.1845, test_f1: 0.5565
 epoch: 67, train_loss: 0.5695, test_loss: 1.1318, test_f1: 0.5655
 epoch: 68, train_loss: 0.5545, test_loss: 1.1232, test_f1: 0.5616
 epoch: 69, train_loss: 0.5648, test_loss: 1.1144, test_f1: 0.5705
 epoch: 70, train_loss: 0.5825, test_loss: 1.1526, test_f1: 0.5807
 epoch: 71, train_loss: 0.5549, test_loss: 1.1868, test_f1: 0.5539
 epoch: 72, train_loss: 0.5552, test_loss: 1.2569, test_f1: 0.5530
 epoch: 73, train_loss: 0.5668, test_loss: 1.2125, test_f1: 0.5691
 epoch: 74, train_loss: 0.5541, test_loss: 1.2570, test_f1: 0.5571
 epoch: 75, train_loss: 0.5689, test_loss: 1.3454, test_f1: 0.5483
 epoch: 76, train_loss: 0.5473, test_loss: 1.2844, test_f1: 0.5756
 epoch: 77, train_loss: 0.5476, test_loss: 1.1603, test_f1: 0.5706
 epoch: 78, train_loss: 0.5442, test_loss: 1.2380, test_f1: 0.5496
 epoch: 79, train_loss: 0.5553, test_loss: 1.1789, test_f1: 0.5778
 epoch: 80, train_loss: 0.5468, test_loss: 1.1859, test_f1: 0.5875
 epoch: 81, train_loss: 0.5559, test_loss: 1.2644, test_f1: 0.5491
 epoch: 82, train_loss: 0.5399, test_loss: 1.2493, test_f1: 0.5270
 epoch: 83, train_loss: 0.5328, test_loss: 1.2031, test_f1: 0.5779
 epoch: 84, train_loss: 0.5217, test_loss: 1.2349, test_f1: 0.5647
 epoch: 85, train_loss: 0.5314, test_loss: 1.2418, test_f1: 0.5703
 epoch: 86, train_loss: 0.5431, test_loss: 1.2384, test_f1: 0.5711
 epoch: 87, train_loss: 0.5304, test_loss: 1.2096, test_f1: 0.5796
 epoch: 88, train_loss: 0.5282, test_loss: 1.3450, test_f1: 0.5286
 epoch: 89, train_loss: 0.5305, test_loss: 1.2061, test_f1: 0.5492
 epoch: 90, train_loss: 0.5089, test_loss: 1.2206, test_f1: 0.5557
 epoch: 91, train_loss: 0.5058, test_loss: 1.3316, test_f1: 0.5727
 epoch: 92, train_loss: 0.5185, test_loss: 1.3357, test_f1: 0.5486
 epoch: 93, train_loss: 0.5140, test_loss: 1.4370, test_f1: 0.5303
 epoch: 94, train_loss: 0.5247, test_loss: 1.4682, test_f1: 0.5371
 epoch: 95, train_loss: 0.5207, test_loss: 1.4375, test_f1: 0.5249
 epoch: 96, train_loss: 0.5247, test_loss: 1.3675, test_f1: 0.5491
 epoch: 97, train_loss: 0.5049, test_loss: 1.3096, test_f1: 0.5585
 epoch: 98, train_loss: 0.5084, test_loss: 1.3065, test_f1: 0.5893
 epoch: 99, train_loss: 0.5140, test_loss: 1.3999, test_f1: 0.5549
##################ITERATION #9 ****************************************
 epoch: 0, train_loss: 1.4220, test_loss: 1.5465, test_f1: 0.2168
 epoch: 1, train_loss: 1.2014, test_loss: 1.5202, test_f1: 0.1867
 epoch: 2, train_loss: 1.1316, test_loss: 1.4195, test_f1: 0.2734
 epoch: 3, train_loss: 1.1035, test_loss: 1.3215, test_f1: 0.2281
 epoch: 4, train_loss: 1.0693, test_loss: 1.3204, test_f1: 0.2287
 epoch: 5, train_loss: 1.0275, test_loss: 1.3062, test_f1: 0.2662
 epoch: 6, train_loss: 1.0112, test_loss: 1.3495, test_f1: 0.3488
 epoch: 7, train_loss: 0.9784, test_loss: 1.3233, test_f1: 0.3771
 epoch: 8, train_loss: 0.9612, test_loss: 1.1747, test_f1: 0.4568
 epoch: 9, train_loss: 0.9282, test_loss: 1.1228, test_f1: 0.4799
 epoch: 10, train_loss: 0.9304, test_loss: 1.0861, test_f1: 0.4645
 epoch: 11, train_loss: 0.9090, test_loss: 1.1123, test_f1: 0.5196
 epoch: 12, train_loss: 0.8994, test_loss: 1.0090, test_f1: 0.5517
 epoch: 13, train_loss: 0.8856, test_loss: 1.0024, test_f1: 0.5547
 epoch: 14, train_loss: 0.8650, test_loss: 0.9769, test_f1: 0.5509
 epoch: 15, train_loss: 0.8638, test_loss: 0.9911, test_f1: 0.5668
 epoch: 16, train_loss: 0.8598, test_loss: 1.1047, test_f1: 0.5209
 epoch: 17, train_loss: 0.8458, test_loss: 1.0661, test_f1: 0.5394
 epoch: 18, train_loss: 0.8516, test_loss: 1.1873, test_f1: 0.5467
 epoch: 19, train_loss: 0.8448, test_loss: 1.0897, test_f1: 0.5397
 epoch: 20, train_loss: 0.8354, test_loss: 1.0666, test_f1: 0.5388
 epoch: 21, train_loss: 0.8183, test_loss: 1.3143, test_f1: 0.5650
 epoch: 22, train_loss: 0.8199, test_loss: 1.1527, test_f1: 0.5346
 epoch: 23, train_loss: 0.8064, test_loss: 1.0188, test_f1: 0.5551
 epoch: 24, train_loss: 0.7965, test_loss: 0.9977, test_f1: 0.5801
 epoch: 25, train_loss: 0.7848, test_loss: 1.0728, test_f1: 0.5440
 epoch: 26, train_loss: 0.7814, test_loss: 1.0565, test_f1: 0.5981
 epoch: 27, train_loss: 0.7797, test_loss: 1.0563, test_f1: 0.5905
 epoch: 28, train_loss: 0.7644, test_loss: 1.0041, test_f1: 0.5799
 epoch: 29, train_loss: 0.7737, test_loss: 0.9942, test_f1: 0.5661
 epoch: 30, train_loss: 0.7358, test_loss: 0.9819, test_f1: 0.5804
 epoch: 31, train_loss: 0.7236, test_loss: 1.0023, test_f1: 0.6045
 epoch: 32, train_loss: 0.7135, test_loss: 1.0194, test_f1: 0.5733
 epoch: 33, train_loss: 0.7226, test_loss: 1.0595, test_f1: 0.5699
 epoch: 34, train_loss: 0.7164, test_loss: 1.0482, test_f1: 0.5890
 epoch: 35, train_loss: 0.7313, test_loss: 1.0074, test_f1: 0.5797
 epoch: 36, train_loss: 0.7201, test_loss: 1.0882, test_f1: 0.5847
 epoch: 37, train_loss: 0.7203, test_loss: 1.0707, test_f1: 0.5958
 epoch: 38, train_loss: 0.7103, test_loss: 1.0360, test_f1: 0.6027
 epoch: 39, train_loss: 0.7009, test_loss: 1.1600, test_f1: 0.5680
 epoch: 40, train_loss: 0.6699, test_loss: 1.1088, test_f1: 0.5598
 epoch: 41, train_loss: 0.6671, test_loss: 1.0140, test_f1: 0.5550
 epoch: 42, train_loss: 0.6999, test_loss: 0.9639, test_f1: 0.6059
 epoch: 43, train_loss: 0.6851, test_loss: 1.0878, test_f1: 0.5995
 epoch: 44, train_loss: 0.6729, test_loss: 1.0600, test_f1: 0.5670
 epoch: 45, train_loss: 0.6629, test_loss: 1.1034, test_f1: 0.6099
 epoch: 46, train_loss: 0.6731, test_loss: 1.0712, test_f1: 0.5734
 epoch: 47, train_loss: 0.6698, test_loss: 1.0941, test_f1: 0.5237
 epoch: 48, train_loss: 0.6554, test_loss: 1.0209, test_f1: 0.5567
 epoch: 49, train_loss: 0.6614, test_loss: 1.1697, test_f1: 0.5583
 epoch: 50, train_loss: 0.6628, test_loss: 1.1934, test_f1: 0.5304
 epoch: 51, train_loss: 0.6512, test_loss: 1.0197, test_f1: 0.6070
 epoch: 52, train_loss: 0.6416, test_loss: 1.0619, test_f1: 0.6009
 epoch: 53, train_loss: 0.6320, test_loss: 1.0207, test_f1: 0.5962
 epoch: 54, train_loss: 0.6122, test_loss: 1.0049, test_f1: 0.6224
 epoch: 55, train_loss: 0.6248, test_loss: 1.0143, test_f1: 0.5726
 epoch: 56, train_loss: 0.6129, test_loss: 1.0557, test_f1: 0.5622
 epoch: 57, train_loss: 0.6134, test_loss: 1.0871, test_f1: 0.5733
 epoch: 58, train_loss: 0.5979, test_loss: 1.0103, test_f1: 0.5915
 epoch: 59, train_loss: 0.6186, test_loss: 1.0097, test_f1: 0.6172
 epoch: 60, train_loss: 0.5943, test_loss: 1.0971, test_f1: 0.6010
 epoch: 61, train_loss: 0.6085, test_loss: 1.0563, test_f1: 0.5706
 epoch: 62, train_loss: 0.5861, test_loss: 1.0878, test_f1: 0.5618
 epoch: 63, train_loss: 0.5952, test_loss: 0.9961, test_f1: 0.6258
 epoch: 64, train_loss: 0.5971, test_loss: 0.9793, test_f1: 0.6374
 epoch: 65, train_loss: 0.5902, test_loss: 1.0075, test_f1: 0.6039
 epoch: 66, train_loss: 0.5845, test_loss: 1.0457, test_f1: 0.5911
 epoch: 67, train_loss: 0.5796, test_loss: 1.0820, test_f1: 0.6116
 epoch: 68, train_loss: 0.6043, test_loss: 1.0624, test_f1: 0.6036
 epoch: 69, train_loss: 0.5957, test_loss: 1.0444, test_f1: 0.5997
 epoch: 70, train_loss: 0.5796, test_loss: 1.0568, test_f1: 0.6229
 epoch: 71, train_loss: 0.6007, test_loss: 1.1375, test_f1: 0.5609
 epoch: 72, train_loss: 0.5949, test_loss: 1.0361, test_f1: 0.6326
 epoch: 73, train_loss: 0.5869, test_loss: 1.0485, test_f1: 0.6023
 epoch: 74, train_loss: 0.5847, test_loss: 1.1350, test_f1: 0.5875
 epoch: 75, train_loss: 0.5624, test_loss: 1.0660, test_f1: 0.5946
 epoch: 76, train_loss: 0.5726, test_loss: 1.0344, test_f1: 0.6153
 epoch: 77, train_loss: 0.5891, test_loss: 1.0292, test_f1: 0.6169
 epoch: 78, train_loss: 0.5937, test_loss: 1.0240, test_f1: 0.6087
 epoch: 79, train_loss: 0.5433, test_loss: 1.1598, test_f1: 0.5975
 epoch: 80, train_loss: 0.5545, test_loss: 1.0469, test_f1: 0.5980
 epoch: 81, train_loss: 0.5460, test_loss: 1.0943, test_f1: 0.6024
 epoch: 82, train_loss: 0.5496, test_loss: 1.2387, test_f1: 0.5872
 epoch: 83, train_loss: 0.5577, test_loss: 1.1193, test_f1: 0.6115
 epoch: 84, train_loss: 0.5469, test_loss: 1.1460, test_f1: 0.5921
 epoch: 85, train_loss: 0.5610, test_loss: 1.5491, test_f1: 0.5664
 epoch: 86, train_loss: 0.5503, test_loss: 1.4373, test_f1: 0.5686
 epoch: 87, train_loss: 0.5418, test_loss: 1.1235, test_f1: 0.5865
 epoch: 88, train_loss: 0.5484, test_loss: 1.0992, test_f1: 0.5961
 epoch: 89, train_loss: 0.5563, test_loss: 1.0131, test_f1: 0.6451
 epoch: 90, train_loss: 0.5374, test_loss: 1.0254, test_f1: 0.6307
 epoch: 91, train_loss: 0.5384, test_loss: 1.0551, test_f1: 0.6141
 epoch: 92, train_loss: 0.5237, test_loss: 1.0753, test_f1: 0.6086
 epoch: 93, train_loss: 0.5328, test_loss: 1.1215, test_f1: 0.5958
 epoch: 94, train_loss: 0.5236, test_loss: 1.1808, test_f1: 0.5680
 epoch: 95, train_loss: 0.5231, test_loss: 1.4851, test_f1: 0.5610
 epoch: 96, train_loss: 0.5236, test_loss: 1.0899, test_f1: 0.6160
 epoch: 97, train_loss: 0.5136, test_loss: 1.1062, test_f1: 0.6139
 epoch: 98, train_loss: 0.5162, test_loss: 1.2086, test_f1: 0.5845
 epoch: 99, train_loss: 0.5063, test_loss: 1.1361, test_f1: 0.5777

Training completed in 309.25 seconds
Best F1: 0.6568 at epoch 43
Mean F1 across iterations: 0.6263  0.0182
========================FINAL RESULTS================================
FEGIN weighted F1: 0.6568  0.0182
python main.py --data ltspice_demos --representation component_pin --model FEGIN --layers 4 --hiddens 32 --batch_size 256 --lr 0.001 --emb_size 128 --epochs 100 --save_appendix component_pin_L4_H32_BS256_LR0.001_E128 --no_val
-----



STDERR:
  File "main.py", line 370, in <module>
    main()
  File "main.py", line 254, in main
    dataset = dataset_class(
  File "/home/philip/projects/ltspice_examples_code_repo/Circuit-Completion-Using-GNNs/component_classification_with_link_prediction_head/evaluation/FEGIN/kernel/circuit_datasets.py", line 15, in __init__
    self.data, self.slices = torch.load(self.processed_paths[0])
  File "/home/philip/.local/lib/python3.8/site-packages/torch/serialization.py", line 1040, in load
    warnings.warn(
  File "/usr/lib/python3.8/warnings.py", line 109, in _showwarnmsg
    sw(msg.message, msg.category, msg.filename, msg.lineno,
  File "main.py", line 47, in warn_with_traceback
    traceback.print_stack(file=log)
/home/philip/projects/ltspice_examples_code_repo/Circuit-Completion-Using-GNNs/component_classification_with_link_prediction_head/evaluation/FEGIN/kernel/circuit_datasets.py:15: FutureWarning: You are using `torch.load` with `weights_only=False` (the current default value), which uses the default pickle module implicitly. It is possible to construct malicious pickle data which will execute arbitrary code during unpickling (See https://github.com/pytorch/pytorch/blob/main/SECURITY.md#untrusted-models for more details). In a future release, the default value for `weights_only` will be flipped to `True`. This limits the functions that could be executed during unpickling. Arbitrary objects will no longer be allowed to be loaded via this mode unless they are explicitly allowlisted by the user via `torch.serialization.add_safe_globals`. We recommend you start setting `weights_only=True` for any use case where you don't have full control of the loaded file. Please open an issue on GitHub for any issues related to this experimental feature.
  self.data, self.slices = torch.load(self.processed_paths[0])
