STDOUT:
Results will be saved in /home/philip/projects/ltspice_examples_code_repo/Circuit-Completion-Using-GNNs/component_classification_with_link_prediction_head/evaluation/FEGIN/results/model_FEGIN_dataset_ltspice_examples
Command line input: python main.py --data ltspice_examples --representation component_net --model FEGIN --layers 4 --hiddens 16 --batch_size 256 --lr 0.1 --emb_size 512 --epochs 100 --save_appendix component_net_L4_H16_BS256_LR0.1_E512 --no_val
 is saved.
-----
ltspice_examples - FEGIN
Using 4 layers, 16 hidden units, h = 2
Loading component_net representation dataset
ENTERED
Training FEGIN on component_net representation
Train: 3558, Test: 846
##################ITERATION #0 ****************************************
 epoch: 0, train_loss: 1.4295, test_loss: 1.2747, test_f1: 0.3306
 epoch: 1, train_loss: 1.2655, test_loss: 1.3445, test_f1: 0.2756
 epoch: 2, train_loss: 1.2346, test_loss: 1.2566, test_f1: 0.2640
 epoch: 3, train_loss: 1.2036, test_loss: 1.0759, test_f1: 0.3441
 epoch: 4, train_loss: 1.1379, test_loss: 1.1477, test_f1: 0.3283
 epoch: 5, train_loss: 1.1388, test_loss: 1.0798, test_f1: 0.3422
 epoch: 6, train_loss: 1.1390, test_loss: 1.1212, test_f1: 0.3688
 epoch: 7, train_loss: 1.1326, test_loss: 1.1762, test_f1: 0.3597
 epoch: 8, train_loss: 1.1409, test_loss: 1.1171, test_f1: 0.3422
 epoch: 9, train_loss: 1.1440, test_loss: 1.0524, test_f1: 0.3647
 epoch: 10, train_loss: 1.1329, test_loss: 1.0656, test_f1: 0.3570
 epoch: 11, train_loss: 1.1178, test_loss: 1.1299, test_f1: 0.3439
 epoch: 12, train_loss: 1.1079, test_loss: 1.2662, test_f1: 0.3231
 epoch: 13, train_loss: 1.1023, test_loss: 1.0443, test_f1: 0.3553
 epoch: 14, train_loss: 1.1014, test_loss: 1.1633, test_f1: 0.3159
 epoch: 15, train_loss: 1.1010, test_loss: 1.0674, test_f1: 0.3432
 epoch: 16, train_loss: 1.0940, test_loss: 1.2288, test_f1: 0.3059
 epoch: 17, train_loss: 1.0787, test_loss: 1.0963, test_f1: 0.3422
 epoch: 18, train_loss: 1.0717, test_loss: 3.8223, test_f1: 0.2641
 epoch: 19, train_loss: 1.0818, test_loss: 1.0809, test_f1: 0.3422
 epoch: 20, train_loss: 1.0615, test_loss: 1.0717, test_f1: 0.3553
 epoch: 21, train_loss: 1.0692, test_loss: 1.0347, test_f1: 0.3563
 epoch: 22, train_loss: 1.0786, test_loss: 1.1008, test_f1: 0.3422
 epoch: 23, train_loss: 1.0708, test_loss: 1.5205, test_f1: 0.3728
 epoch: 24, train_loss: 1.0758, test_loss: 1.0557, test_f1: 0.3687
 epoch: 25, train_loss: 1.0731, test_loss: 1.0997, test_f1: 0.3554
 epoch: 26, train_loss: 1.0564, test_loss: 1.2049, test_f1: 0.3562
 epoch: 27, train_loss: 1.0592, test_loss: 1.0681, test_f1: 0.3516
 epoch: 28, train_loss: 1.0582, test_loss: 1.0554, test_f1: 0.3738
 epoch: 29, train_loss: 1.0576, test_loss: 1.0694, test_f1: 0.3603
 epoch: 30, train_loss: 1.0531, test_loss: 1.0353, test_f1: 0.3523
 epoch: 31, train_loss: 1.0678, test_loss: 1.0236, test_f1: 0.3550
 epoch: 32, train_loss: 1.0649, test_loss: 1.0406, test_f1: 0.3408
 epoch: 33, train_loss: 1.0671, test_loss: 1.1133, test_f1: 0.3441
 epoch: 34, train_loss: 1.0664, test_loss: 1.1038, test_f1: 0.3440
 epoch: 35, train_loss: 1.0397, test_loss: 1.1759, test_f1: 0.4017
 epoch: 36, train_loss: 1.0414, test_loss: 1.3103, test_f1: 0.4039
 epoch: 37, train_loss: 1.0649, test_loss: 1.4068, test_f1: 0.3213
 epoch: 38, train_loss: 1.0744, test_loss: 1.4327, test_f1: 0.3407
 epoch: 39, train_loss: 1.0898, test_loss: 1.3360, test_f1: 0.3347
 epoch: 40, train_loss: 1.0744, test_loss: 1.0373, test_f1: 0.3873
 epoch: 41, train_loss: 1.0781, test_loss: 1.0223, test_f1: 0.4035
 epoch: 42, train_loss: 1.0568, test_loss: 1.0597, test_f1: 0.3737
 epoch: 43, train_loss: 1.0478, test_loss: 1.0668, test_f1: 0.3774
 epoch: 44, train_loss: 1.0480, test_loss: 1.1385, test_f1: 0.4171
 epoch: 45, train_loss: 1.0338, test_loss: 1.3186, test_f1: 0.4469
 epoch: 46, train_loss: 1.0372, test_loss: 1.3206, test_f1: 0.3544
 epoch: 47, train_loss: 1.0479, test_loss: 1.0844, test_f1: 0.4214
 epoch: 48, train_loss: 1.0429, test_loss: 1.0275, test_f1: 0.3909
 epoch: 49, train_loss: 1.0652, test_loss: 1.0393, test_f1: 0.3676
 epoch: 50, train_loss: 1.0572, test_loss: 1.0276, test_f1: 0.4354
 epoch: 51, train_loss: 1.0376, test_loss: 1.0217, test_f1: 0.4585
 epoch: 52, train_loss: 1.0331, test_loss: 1.0057, test_f1: 0.4554
 epoch: 53, train_loss: 1.0407, test_loss: 0.9980, test_f1: 0.3921
 epoch: 54, train_loss: 1.0393, test_loss: 0.9999, test_f1: 0.4182
 epoch: 55, train_loss: 1.0223, test_loss: 1.0286, test_f1: 0.4276
 epoch: 56, train_loss: 1.0400, test_loss: 1.0752, test_f1: 0.3913
 epoch: 57, train_loss: 1.0298, test_loss: 1.0506, test_f1: 0.4349
 epoch: 58, train_loss: 1.0222, test_loss: 1.0160, test_f1: 0.4342
 epoch: 59, train_loss: 1.0136, test_loss: 1.1462, test_f1: 0.4387
 epoch: 60, train_loss: 1.0132, test_loss: 1.1376, test_f1: 0.4377
 epoch: 61, train_loss: 1.0106, test_loss: 1.0732, test_f1: 0.4638
 epoch: 62, train_loss: 1.0125, test_loss: 1.0578, test_f1: 0.4134
 epoch: 63, train_loss: 1.0218, test_loss: 1.0149, test_f1: 0.4049
 epoch: 64, train_loss: 1.0208, test_loss: 1.0301, test_f1: 0.4009
 epoch: 65, train_loss: 1.0203, test_loss: 1.0374, test_f1: 0.4071
 epoch: 66, train_loss: 1.0076, test_loss: 1.0149, test_f1: 0.4624
 epoch: 67, train_loss: 1.0113, test_loss: 1.0747, test_f1: 0.4234
 epoch: 68, train_loss: 1.0051, test_loss: 1.1825, test_f1: 0.4500
 epoch: 69, train_loss: 1.0091, test_loss: 1.0327, test_f1: 0.4329
 epoch: 70, train_loss: 1.0032, test_loss: 1.0238, test_f1: 0.4423
 epoch: 71, train_loss: 1.0101, test_loss: 1.0562, test_f1: 0.4402
 epoch: 72, train_loss: 1.0133, test_loss: 1.2059, test_f1: 0.4448
 epoch: 73, train_loss: 1.0079, test_loss: 1.0059, test_f1: 0.4919
 epoch: 74, train_loss: 0.9962, test_loss: 1.0933, test_f1: 0.4384
 epoch: 75, train_loss: 1.0050, test_loss: 1.0261, test_f1: 0.4715
 epoch: 76, train_loss: 1.0108, test_loss: 1.0076, test_f1: 0.4367
 epoch: 77, train_loss: 1.0301, test_loss: 1.0422, test_f1: 0.4033
 epoch: 78, train_loss: 1.0217, test_loss: 1.1820, test_f1: 0.4259
 epoch: 79, train_loss: 1.0098, test_loss: 1.0426, test_f1: 0.4509
 epoch: 80, train_loss: 1.0116, test_loss: 1.0368, test_f1: 0.4653
 epoch: 81, train_loss: 1.0205, test_loss: 1.8797, test_f1: 0.4244
 epoch: 82, train_loss: 1.0150, test_loss: 41.5300, test_f1: 0.3193
 epoch: 83, train_loss: 1.0084, test_loss: 21.3811, test_f1: 0.3623
 epoch: 84, train_loss: 1.0018, test_loss: 138.0299, test_f1: 0.2827
 epoch: 85, train_loss: 0.9978, test_loss: 1.0935, test_f1: 0.4545
 epoch: 86, train_loss: 1.0024, test_loss: 1.1579, test_f1: 0.4285
 epoch: 87, train_loss: 1.0072, test_loss: 1.0090, test_f1: 0.4987
 epoch: 88, train_loss: 1.0119, test_loss: 1.1124, test_f1: 0.4407
 epoch: 89, train_loss: 1.0083, test_loss: 1.0682, test_f1: 0.4611
 epoch: 90, train_loss: 0.9954, test_loss: 1.0802, test_f1: 0.4607
 epoch: 91, train_loss: 0.9951, test_loss: 1.1727, test_f1: 0.4263
 epoch: 92, train_loss: 1.0054, test_loss: 1.1476, test_f1: 0.4739
 epoch: 93, train_loss: 1.0071, test_loss: 1.0079, test_f1: 0.5235
 epoch: 94, train_loss: 0.9951, test_loss: 1.0927, test_f1: 0.4695
 epoch: 95, train_loss: 0.9951, test_loss: 1.1439, test_f1: 0.4762
 epoch: 96, train_loss: 0.9852, test_loss: 1.0610, test_f1: 0.4717
 epoch: 97, train_loss: 0.9966, test_loss: 0.9964, test_f1: 0.5009
 epoch: 98, train_loss: 0.9972, test_loss: 0.9882, test_f1: 0.4833
 epoch: 99, train_loss: 0.9947, test_loss: 1.0618, test_f1: 0.4744
##################ITERATION #1 ****************************************
 epoch: 0, train_loss: 1.3248, test_loss: 1.7201, test_f1: 0.2418
 epoch: 1, train_loss: 1.1889, test_loss: 1.4549, test_f1: 0.2660
 epoch: 2, train_loss: 1.1051, test_loss: 1.3305, test_f1: 0.2797
 epoch: 3, train_loss: 1.0919, test_loss: 1.0776, test_f1: 0.3545
 epoch: 4, train_loss: 1.1003, test_loss: 1.1502, test_f1: 0.3322
 epoch: 5, train_loss: 1.1029, test_loss: 1.0916, test_f1: 0.3415
 epoch: 6, train_loss: 1.0569, test_loss: 1.0949, test_f1: 0.3732
 epoch: 7, train_loss: 1.0530, test_loss: 1.1152, test_f1: 0.3697
 epoch: 8, train_loss: 1.0465, test_loss: 1.0662, test_f1: 0.3393
 epoch: 9, train_loss: 1.0583, test_loss: 1.0723, test_f1: 0.3413
 epoch: 10, train_loss: 1.0460, test_loss: 1.0516, test_f1: 0.3562
 epoch: 11, train_loss: 1.0436, test_loss: 1.0751, test_f1: 0.3432
 epoch: 12, train_loss: 1.0348, test_loss: 1.1438, test_f1: 0.3468
 epoch: 13, train_loss: 1.0382, test_loss: 1.1255, test_f1: 0.4528
 epoch: 14, train_loss: 1.0287, test_loss: 1.0849, test_f1: 0.4392
 epoch: 15, train_loss: 1.0362, test_loss: 1.1218, test_f1: 0.3839
 epoch: 16, train_loss: 1.0295, test_loss: 1.0930, test_f1: 0.4518
 epoch: 17, train_loss: 1.0328, test_loss: 1.0905, test_f1: 0.3740
 epoch: 18, train_loss: 1.0360, test_loss: 1.2167, test_f1: 0.4404
 epoch: 19, train_loss: 1.0326, test_loss: 1.2642, test_f1: 0.4309
 epoch: 20, train_loss: 1.0374, test_loss: 1.1645, test_f1: 0.4549
 epoch: 21, train_loss: 1.0329, test_loss: 1.3630, test_f1: 0.3933
 epoch: 22, train_loss: 1.0165, test_loss: 1.0144, test_f1: 0.4594
 epoch: 23, train_loss: 1.0240, test_loss: 1.0318, test_f1: 0.5032
 epoch: 24, train_loss: 1.0233, test_loss: 1.0219, test_f1: 0.4681
 epoch: 25, train_loss: 1.0091, test_loss: 1.2590, test_f1: 0.4794
 epoch: 26, train_loss: 1.0269, test_loss: 1.1743, test_f1: 0.4493
 epoch: 27, train_loss: 1.0197, test_loss: 1.0486, test_f1: 0.5199
 epoch: 28, train_loss: 1.0333, test_loss: 1.2198, test_f1: 0.4233
 epoch: 29, train_loss: 1.0361, test_loss: 1.3042, test_f1: 0.3605
 epoch: 30, train_loss: 1.0229, test_loss: 1.1371, test_f1: 0.4641
 epoch: 31, train_loss: 1.0192, test_loss: 1.1706, test_f1: 0.3434
 epoch: 32, train_loss: 1.0239, test_loss: 1.0668, test_f1: 0.4352
 epoch: 33, train_loss: 1.0093, test_loss: 1.3282, test_f1: 0.4734
 epoch: 34, train_loss: 1.0153, test_loss: 1.1962, test_f1: 0.4705
 epoch: 35, train_loss: 1.0047, test_loss: 1.0674, test_f1: 0.4582
 epoch: 36, train_loss: 1.0197, test_loss: 1.0410, test_f1: 0.4595
 epoch: 37, train_loss: 1.0075, test_loss: 1.0851, test_f1: 0.4646
 epoch: 38, train_loss: 0.9891, test_loss: 1.0321, test_f1: 0.4858
 epoch: 39, train_loss: 0.9965, test_loss: 1.0130, test_f1: 0.4794
 epoch: 40, train_loss: 1.0108, test_loss: 1.0475, test_f1: 0.4473
 epoch: 41, train_loss: 1.0016, test_loss: 1.1112, test_f1: 0.4804
 epoch: 42, train_loss: 1.0113, test_loss: 1.1417, test_f1: 0.4800
 epoch: 43, train_loss: 0.9878, test_loss: 1.0554, test_f1: 0.4974
 epoch: 44, train_loss: 0.9939, test_loss: 1.2337, test_f1: 0.4553
 epoch: 45, train_loss: 0.9926, test_loss: 1.2032, test_f1: 0.4612
 epoch: 46, train_loss: 1.0016, test_loss: 1.0792, test_f1: 0.4768
 epoch: 47, train_loss: 0.9850, test_loss: 1.0355, test_f1: 0.5113
 epoch: 48, train_loss: 1.0009, test_loss: 1.0488, test_f1: 0.4716
 epoch: 49, train_loss: 0.9849, test_loss: 0.9853, test_f1: 0.5042
 epoch: 50, train_loss: 0.9829, test_loss: 1.0373, test_f1: 0.4946
 epoch: 51, train_loss: 0.9662, test_loss: 1.0381, test_f1: 0.4858
 epoch: 52, train_loss: 0.9701, test_loss: 1.1319, test_f1: 0.5048
 epoch: 53, train_loss: 0.9593, test_loss: 1.1013, test_f1: 0.4888
 epoch: 54, train_loss: 0.9605, test_loss: 1.0867, test_f1: 0.4978
 epoch: 55, train_loss: 0.9613, test_loss: 1.2477, test_f1: 0.4925
 epoch: 56, train_loss: 0.9504, test_loss: 1.1451, test_f1: 0.4861
 epoch: 57, train_loss: 0.9569, test_loss: 1.0410, test_f1: 0.5172
 epoch: 58, train_loss: 0.9480, test_loss: 1.0421, test_f1: 0.5002
 epoch: 59, train_loss: 0.9442, test_loss: 1.0722, test_f1: 0.4858
 epoch: 60, train_loss: 0.9509, test_loss: 1.0261, test_f1: 0.5064
 epoch: 61, train_loss: 0.9627, test_loss: 1.0435, test_f1: 0.4989
 epoch: 62, train_loss: 0.9546, test_loss: 1.0024, test_f1: 0.4985
 epoch: 63, train_loss: 0.9647, test_loss: 1.0937, test_f1: 0.4716
 epoch: 64, train_loss: 0.9674, test_loss: 1.3678, test_f1: 0.4638
 epoch: 65, train_loss: 0.9605, test_loss: 1.0648, test_f1: 0.4987
 epoch: 66, train_loss: 0.9495, test_loss: 0.9871, test_f1: 0.5179
 epoch: 67, train_loss: 0.9495, test_loss: 0.9667, test_f1: 0.5167
 epoch: 68, train_loss: 0.9503, test_loss: 1.0041, test_f1: 0.5080
 epoch: 69, train_loss: 0.9524, test_loss: 1.0381, test_f1: 0.5207
 epoch: 70, train_loss: 0.9459, test_loss: 1.0060, test_f1: 0.5443
 epoch: 71, train_loss: 0.9345, test_loss: 1.0054, test_f1: 0.5026
 epoch: 72, train_loss: 0.9435, test_loss: 0.9984, test_f1: 0.4961
 epoch: 73, train_loss: 0.9413, test_loss: 1.2740, test_f1: 0.5009
 epoch: 74, train_loss: 0.9479, test_loss: 1.1171, test_f1: 0.4966
 epoch: 75, train_loss: 0.9436, test_loss: 1.0029, test_f1: 0.5011
 epoch: 76, train_loss: 0.9449, test_loss: 1.0340, test_f1: 0.4828
 epoch: 77, train_loss: 0.9344, test_loss: 1.1263, test_f1: 0.4988
 epoch: 78, train_loss: 0.9400, test_loss: 1.0288, test_f1: 0.5487
 epoch: 79, train_loss: 0.9328, test_loss: 1.0413, test_f1: 0.4938
 epoch: 80, train_loss: 0.9349, test_loss: 1.0618, test_f1: 0.5494
 epoch: 81, train_loss: 0.9240, test_loss: 1.0029, test_f1: 0.5098
 epoch: 82, train_loss: 0.9384, test_loss: 1.0057, test_f1: 0.4959
 epoch: 83, train_loss: 0.9374, test_loss: 1.0750, test_f1: 0.5044
 epoch: 84, train_loss: 0.9456, test_loss: 1.0753, test_f1: 0.5010
 epoch: 85, train_loss: 0.9351, test_loss: 1.0239, test_f1: 0.5434
 epoch: 86, train_loss: 0.9411, test_loss: 1.0799, test_f1: 0.4965
 epoch: 87, train_loss: 0.9477, test_loss: 0.9879, test_f1: 0.5018
 epoch: 88, train_loss: 0.9360, test_loss: 0.9760, test_f1: 0.5281
 epoch: 89, train_loss: 0.9365, test_loss: 1.0524, test_f1: 0.5475
 epoch: 90, train_loss: 0.9366, test_loss: 1.0396, test_f1: 0.5189
 epoch: 91, train_loss: 0.9376, test_loss: 1.0761, test_f1: 0.5026
 epoch: 92, train_loss: 0.9328, test_loss: 1.0505, test_f1: 0.5112
 epoch: 93, train_loss: 0.9480, test_loss: 1.0122, test_f1: 0.5157
 epoch: 94, train_loss: 0.9374, test_loss: 1.0734, test_f1: 0.5042
 epoch: 95, train_loss: 0.9364, test_loss: 1.0499, test_f1: 0.5110
 epoch: 96, train_loss: 0.9430, test_loss: 1.0298, test_f1: 0.4940
 epoch: 97, train_loss: 0.9287, test_loss: 1.0586, test_f1: 0.5337
 epoch: 98, train_loss: 0.9385, test_loss: 1.0133, test_f1: 0.5202
 epoch: 99, train_loss: 0.9311, test_loss: 1.0095, test_f1: 0.5738
##################ITERATION #2 ****************************************
 epoch: 0, train_loss: 1.4229, test_loss: 1.3665, test_f1: 0.2448
 epoch: 1, train_loss: 1.2817, test_loss: 1.2768, test_f1: 0.2471
 epoch: 2, train_loss: 1.2416, test_loss: 1.1729, test_f1: 0.3343
 epoch: 3, train_loss: 1.1981, test_loss: 1.0784, test_f1: 0.3405
 epoch: 4, train_loss: 1.1757, test_loss: 1.0939, test_f1: 0.3432
 epoch: 5, train_loss: 1.1669, test_loss: 1.0775, test_f1: 0.3415
 epoch: 6, train_loss: 1.1586, test_loss: 1.1335, test_f1: 0.3237
 epoch: 7, train_loss: 1.1351, test_loss: 1.0728, test_f1: 0.3441
 epoch: 8, train_loss: 1.1339, test_loss: 1.0911, test_f1: 0.3446
 epoch: 9, train_loss: 1.1279, test_loss: 1.1015, test_f1: 0.3523
 epoch: 10, train_loss: 1.1161, test_loss: 1.0624, test_f1: 0.3469
 epoch: 11, train_loss: 1.1019, test_loss: 1.1001, test_f1: 0.3313
 epoch: 12, train_loss: 1.1123, test_loss: 1.1428, test_f1: 0.3262
 epoch: 13, train_loss: 1.1311, test_loss: 1.0752, test_f1: 0.3469
 epoch: 14, train_loss: 1.1029, test_loss: 1.0600, test_f1: 0.3573
 epoch: 15, train_loss: 1.0907, test_loss: 1.0943, test_f1: 0.3469
 epoch: 16, train_loss: 1.0791, test_loss: 1.0993, test_f1: 0.3433
 epoch: 17, train_loss: 1.0724, test_loss: 1.0928, test_f1: 0.3378
 epoch: 18, train_loss: 1.0695, test_loss: 1.0894, test_f1: 0.3466
 epoch: 19, train_loss: 1.0823, test_loss: 1.0972, test_f1: 0.3442
 epoch: 20, train_loss: 1.0753, test_loss: 1.1071, test_f1: 0.3432
 epoch: 21, train_loss: 1.0729, test_loss: 1.0959, test_f1: 0.3486
 epoch: 22, train_loss: 1.0755, test_loss: 1.1006, test_f1: 0.3454
 epoch: 23, train_loss: 1.0556, test_loss: 1.0899, test_f1: 0.3474
 epoch: 24, train_loss: 1.0700, test_loss: 1.1130, test_f1: 0.3428
 epoch: 25, train_loss: 1.0580, test_loss: 1.1601, test_f1: 0.3423
 epoch: 26, train_loss: 1.0545, test_loss: 1.1142, test_f1: 0.3434
 epoch: 27, train_loss: 1.0516, test_loss: 1.1377, test_f1: 0.3443
 epoch: 28, train_loss: 1.0527, test_loss: 1.0990, test_f1: 0.3334
 epoch: 29, train_loss: 1.0600, test_loss: 1.0931, test_f1: 0.3421
 epoch: 30, train_loss: 1.0607, test_loss: 1.0955, test_f1: 0.3410
 epoch: 31, train_loss: 1.0554, test_loss: 1.0857, test_f1: 0.3461
 epoch: 32, train_loss: 1.0531, test_loss: 1.0818, test_f1: 0.3429
 epoch: 33, train_loss: 1.0559, test_loss: 1.1062, test_f1: 0.3471
 epoch: 34, train_loss: 1.0410, test_loss: 1.1482, test_f1: 0.3446
 epoch: 35, train_loss: 1.0560, test_loss: 1.1170, test_f1: 0.3386
 epoch: 36, train_loss: 1.0480, test_loss: 1.1024, test_f1: 0.3441
 epoch: 37, train_loss: 1.0502, test_loss: 1.1109, test_f1: 0.3408
 epoch: 38, train_loss: 1.0599, test_loss: 1.1207, test_f1: 0.3451
 epoch: 39, train_loss: 1.0496, test_loss: 1.1067, test_f1: 0.3439
 epoch: 40, train_loss: 1.0394, test_loss: 1.1209, test_f1: 0.3417
 epoch: 41, train_loss: 1.0497, test_loss: 1.1433, test_f1: 0.3432
 epoch: 42, train_loss: 1.0933, test_loss: 1.1014, test_f1: 0.3435
 epoch: 43, train_loss: 1.0864, test_loss: 1.0962, test_f1: 0.3461
 epoch: 44, train_loss: 1.0798, test_loss: 1.1575, test_f1: 0.3413
 epoch: 45, train_loss: 1.0779, test_loss: 1.1614, test_f1: 0.3422
 epoch: 46, train_loss: 1.0634, test_loss: 1.1266, test_f1: 0.3473
 epoch: 47, train_loss: 1.0612, test_loss: 1.1503, test_f1: 0.3489
 epoch: 48, train_loss: 1.0910, test_loss: 1.1822, test_f1: 0.3432
 epoch: 49, train_loss: 1.0955, test_loss: 1.1606, test_f1: 0.3413
 epoch: 50, train_loss: 1.0763, test_loss: 1.0723, test_f1: 0.3526
 epoch: 51, train_loss: 1.0622, test_loss: 1.1293, test_f1: 0.3437
 epoch: 52, train_loss: 1.0654, test_loss: 1.1420, test_f1: 0.3447
 epoch: 53, train_loss: 1.0620, test_loss: 1.1384, test_f1: 0.3468
 epoch: 54, train_loss: 1.0676, test_loss: 1.1273, test_f1: 0.3413
 epoch: 55, train_loss: 1.0587, test_loss: 1.1106, test_f1: 0.3442
 epoch: 56, train_loss: 1.0518, test_loss: 1.1120, test_f1: 0.3488
 epoch: 57, train_loss: 1.0488, test_loss: 1.1121, test_f1: 0.3477
 epoch: 58, train_loss: 1.0547, test_loss: 1.1356, test_f1: 0.3439
 epoch: 59, train_loss: 1.0449, test_loss: 1.1291, test_f1: 0.3418
 epoch: 60, train_loss: 1.0427, test_loss: 1.1375, test_f1: 0.3432
 epoch: 61, train_loss: 1.0445, test_loss: 1.1348, test_f1: 0.3422
 epoch: 62, train_loss: 1.0568, test_loss: 1.1124, test_f1: 0.3518
 epoch: 63, train_loss: 1.0472, test_loss: 1.1191, test_f1: 0.3522
 epoch: 64, train_loss: 1.0403, test_loss: 1.1100, test_f1: 0.3470
 epoch: 65, train_loss: 1.0322, test_loss: 1.1100, test_f1: 0.3522
 epoch: 66, train_loss: 1.0416, test_loss: 1.1624, test_f1: 0.3336
 epoch: 67, train_loss: 1.0324, test_loss: 1.1274, test_f1: 0.3484
 epoch: 68, train_loss: 1.0321, test_loss: 1.1604, test_f1: 0.3389
 epoch: 69, train_loss: 1.0598, test_loss: 1.1155, test_f1: 0.3454
 epoch: 70, train_loss: 1.0446, test_loss: 1.1200, test_f1: 0.3503
 epoch: 71, train_loss: 1.0472, test_loss: 1.1474, test_f1: 0.3411
 epoch: 72, train_loss: 1.0335, test_loss: 1.1203, test_f1: 0.3454
 epoch: 73, train_loss: 1.0399, test_loss: 1.0955, test_f1: 0.3492
 epoch: 74, train_loss: 1.0371, test_loss: 1.1295, test_f1: 0.3439
 epoch: 75, train_loss: 1.0383, test_loss: 1.1284, test_f1: 0.3517
 epoch: 76, train_loss: 1.0372, test_loss: 1.1114, test_f1: 0.3429
 epoch: 77, train_loss: 1.0297, test_loss: 1.1118, test_f1: 0.3484
 epoch: 78, train_loss: 1.0355, test_loss: 1.1377, test_f1: 0.3439
 epoch: 79, train_loss: 1.0363, test_loss: 1.1341, test_f1: 0.3447
 epoch: 80, train_loss: 1.0294, test_loss: 1.1178, test_f1: 0.3473
 epoch: 81, train_loss: 1.0290, test_loss: 1.1740, test_f1: 0.3374
 epoch: 82, train_loss: 1.0305, test_loss: 1.1390, test_f1: 0.3382
 epoch: 83, train_loss: 1.0287, test_loss: 1.1181, test_f1: 0.3445
 epoch: 84, train_loss: 1.0253, test_loss: 1.1046, test_f1: 0.3505
 epoch: 85, train_loss: 1.0265, test_loss: 1.1139, test_f1: 0.3494
 epoch: 86, train_loss: 1.0259, test_loss: 1.1434, test_f1: 0.3390
 epoch: 87, train_loss: 1.0314, test_loss: 1.1442, test_f1: 0.3407
 epoch: 88, train_loss: 1.0206, test_loss: 1.0828, test_f1: 0.3527
 epoch: 89, train_loss: 1.0255, test_loss: 1.1286, test_f1: 0.3412
 epoch: 90, train_loss: 1.0230, test_loss: 1.1386, test_f1: 0.3431
 epoch: 91, train_loss: 1.0197, test_loss: 1.1470, test_f1: 0.3440
 epoch: 92, train_loss: 1.0251, test_loss: 1.0999, test_f1: 0.3531
 epoch: 93, train_loss: 1.0254, test_loss: 1.1187, test_f1: 0.3415
 epoch: 94, train_loss: 1.0245, test_loss: 1.1529, test_f1: 0.3443
 epoch: 95, train_loss: 1.0190, test_loss: 1.1436, test_f1: 0.3453
 epoch: 96, train_loss: 1.0290, test_loss: 1.0522, test_f1: 0.3474
 epoch: 97, train_loss: 1.0508, test_loss: 1.0842, test_f1: 0.3469
 epoch: 98, train_loss: 1.0343, test_loss: 1.1086, test_f1: 0.3433
 epoch: 99, train_loss: 1.0333, test_loss: 1.1094, test_f1: 0.3418
##################ITERATION #3 ****************************************
 epoch: 0, train_loss: 1.3742, test_loss: 1.4320, test_f1: 0.2270
 epoch: 1, train_loss: 1.2512, test_loss: 1.2626, test_f1: 0.2461
 epoch: 2, train_loss: 1.2095, test_loss: 1.3548, test_f1: 0.2270
 epoch: 3, train_loss: 1.1874, test_loss: 1.2419, test_f1: 0.3039
 epoch: 4, train_loss: 1.1462, test_loss: 1.1352, test_f1: 0.3519
 epoch: 5, train_loss: 1.1456, test_loss: 1.1143, test_f1: 0.3534
 epoch: 6, train_loss: 1.1935, test_loss: 1.3113, test_f1: 0.2631
 epoch: 7, train_loss: 1.1637, test_loss: 1.1644, test_f1: 0.3320
 epoch: 8, train_loss: 1.1951, test_loss: 1.3613, test_f1: 0.2484
 epoch: 9, train_loss: 1.1536, test_loss: 1.2329, test_f1: 0.2983
 epoch: 10, train_loss: 1.1235, test_loss: 1.1086, test_f1: 0.3432
 epoch: 11, train_loss: 1.1152, test_loss: 1.1221, test_f1: 0.3446
 epoch: 12, train_loss: 1.1287, test_loss: 1.1231, test_f1: 0.3413
 epoch: 13, train_loss: 1.1163, test_loss: 1.1213, test_f1: 0.3471
 epoch: 14, train_loss: 1.1115, test_loss: 1.1315, test_f1: 0.3487
 epoch: 15, train_loss: 1.1012, test_loss: 1.1308, test_f1: 0.3513
 epoch: 16, train_loss: 1.1127, test_loss: 1.1511, test_f1: 0.3422
 epoch: 17, train_loss: 1.1074, test_loss: 1.1494, test_f1: 0.3413
 epoch: 18, train_loss: 1.1009, test_loss: 1.1613, test_f1: 0.3422
 epoch: 19, train_loss: 1.1153, test_loss: 1.3649, test_f1: 0.2295
 epoch: 20, train_loss: 1.1014, test_loss: 1.3582, test_f1: 0.2320
 epoch: 21, train_loss: 1.1113, test_loss: 1.1462, test_f1: 0.3469
 epoch: 22, train_loss: 1.1075, test_loss: 1.1317, test_f1: 0.3422
 epoch: 23, train_loss: 1.1118, test_loss: 1.1407, test_f1: 0.3396
 epoch: 24, train_loss: 1.1036, test_loss: 1.1535, test_f1: 0.3325
 epoch: 25, train_loss: 1.1037, test_loss: 1.1320, test_f1: 0.3432
 epoch: 26, train_loss: 1.0966, test_loss: 1.0951, test_f1: 0.3432
 epoch: 27, train_loss: 1.1035, test_loss: 1.1571, test_f1: 0.3469
 epoch: 28, train_loss: 1.0973, test_loss: 1.0886, test_f1: 0.3422
 epoch: 29, train_loss: 1.1107, test_loss: 1.1306, test_f1: 0.3497
 epoch: 30, train_loss: 1.1129, test_loss: 1.0703, test_f1: 0.3580
 epoch: 31, train_loss: 1.1198, test_loss: 1.0967, test_f1: 0.3413
 epoch: 32, train_loss: 1.0817, test_loss: 1.1409, test_f1: 0.3422
 epoch: 33, train_loss: 1.0822, test_loss: 1.1009, test_f1: 0.3422
 epoch: 34, train_loss: 1.1065, test_loss: 1.0924, test_f1: 0.3422
 epoch: 35, train_loss: 1.0847, test_loss: 1.1014, test_f1: 0.3422
 epoch: 36, train_loss: 1.0994, test_loss: 1.0699, test_f1: 0.3563
 epoch: 37, train_loss: 1.1023, test_loss: 1.1885, test_f1: 0.3422
 epoch: 38, train_loss: 1.1023, test_loss: 1.1023, test_f1: 0.3422
 epoch: 39, train_loss: 1.0813, test_loss: 1.1618, test_f1: 0.3422
 epoch: 40, train_loss: 1.0666, test_loss: 1.1381, test_f1: 0.3487
 epoch: 41, train_loss: 1.1002, test_loss: 1.0956, test_f1: 0.3413
 epoch: 42, train_loss: 1.0761, test_loss: 1.1522, test_f1: 0.3479
 epoch: 43, train_loss: 1.0740, test_loss: 1.1244, test_f1: 0.3451
 epoch: 44, train_loss: 1.0621, test_loss: 1.1571, test_f1: 0.3486
 epoch: 45, train_loss: 1.0723, test_loss: 1.0833, test_f1: 0.3441
 epoch: 46, train_loss: 1.0707, test_loss: 1.1778, test_f1: 0.3414
 epoch: 47, train_loss: 1.0682, test_loss: 1.1469, test_f1: 0.3341
 epoch: 48, train_loss: 1.0640, test_loss: 1.0694, test_f1: 0.3580
 epoch: 49, train_loss: 1.0739, test_loss: 1.1481, test_f1: 0.3425
 epoch: 50, train_loss: 1.0774, test_loss: 1.1204, test_f1: 0.3460
 epoch: 51, train_loss: 1.0941, test_loss: 1.1737, test_f1: 0.3453
 epoch: 52, train_loss: 1.0722, test_loss: 1.1308, test_f1: 0.3441
 epoch: 53, train_loss: 1.0604, test_loss: 1.1412, test_f1: 0.3425
 epoch: 54, train_loss: 1.0685, test_loss: 1.1583, test_f1: 0.3448
 epoch: 55, train_loss: 1.0656, test_loss: 1.0795, test_f1: 0.3580
 epoch: 56, train_loss: 1.0647, test_loss: 1.1802, test_f1: 0.3460
 epoch: 57, train_loss: 1.0625, test_loss: 1.1088, test_f1: 0.3548
 epoch: 58, train_loss: 1.0611, test_loss: 1.0667, test_f1: 0.3589
 epoch: 59, train_loss: 1.0657, test_loss: 1.1299, test_f1: 0.3382
 epoch: 60, train_loss: 1.0639, test_loss: 1.1675, test_f1: 0.3455
 epoch: 61, train_loss: 1.0625, test_loss: 1.1727, test_f1: 0.3437
 epoch: 62, train_loss: 1.0586, test_loss: 1.1322, test_f1: 0.3432
 epoch: 63, train_loss: 1.0519, test_loss: 1.2746, test_f1: 0.3226
 epoch: 64, train_loss: 1.0644, test_loss: 1.1457, test_f1: 0.3436
 epoch: 65, train_loss: 1.0560, test_loss: 1.0831, test_f1: 0.3579
 epoch: 66, train_loss: 1.0628, test_loss: 1.1691, test_f1: 0.3392
 epoch: 67, train_loss: 1.0541, test_loss: 1.1076, test_f1: 0.3508
 epoch: 68, train_loss: 1.0499, test_loss: 1.1715, test_f1: 0.3388
 epoch: 69, train_loss: 1.0483, test_loss: 1.1554, test_f1: 0.3443
 epoch: 70, train_loss: 1.0566, test_loss: 1.1760, test_f1: 0.3342
 epoch: 71, train_loss: 1.0573, test_loss: 1.0555, test_f1: 0.3538
 epoch: 72, train_loss: 1.0511, test_loss: 1.0599, test_f1: 0.3599
 epoch: 73, train_loss: 1.0491, test_loss: 1.3143, test_f1: 0.3397
 epoch: 74, train_loss: 1.0558, test_loss: 1.2649, test_f1: 0.3424
 epoch: 75, train_loss: 1.0462, test_loss: 1.4886, test_f1: 0.3427
 epoch: 76, train_loss: 1.0474, test_loss: 1.0636, test_f1: 0.3589
 epoch: 77, train_loss: 1.0504, test_loss: 1.3196, test_f1: 0.3472
 epoch: 78, train_loss: 1.0504, test_loss: 1.3623, test_f1: 0.3425
 epoch: 79, train_loss: 1.0545, test_loss: 1.0588, test_f1: 0.3549
 epoch: 80, train_loss: 1.0503, test_loss: 1.2576, test_f1: 0.3402
 epoch: 81, train_loss: 1.0573, test_loss: 1.1761, test_f1: 0.3511
 epoch: 82, train_loss: 1.0499, test_loss: 1.0831, test_f1: 0.3492
 epoch: 83, train_loss: 1.0538, test_loss: 1.3362, test_f1: 0.3465
 epoch: 84, train_loss: 1.0524, test_loss: 1.3357, test_f1: 0.3433
 epoch: 85, train_loss: 1.0493, test_loss: 1.1629, test_f1: 0.3431
 epoch: 86, train_loss: 1.0417, test_loss: 1.4048, test_f1: 0.3253
 epoch: 87, train_loss: 1.0487, test_loss: 1.0713, test_f1: 0.3499
 epoch: 88, train_loss: 1.0576, test_loss: 1.1699, test_f1: 0.3416
 epoch: 89, train_loss: 1.0619, test_loss: 1.3891, test_f1: 0.3451
 epoch: 90, train_loss: 1.0541, test_loss: 1.1456, test_f1: 0.3441
 epoch: 91, train_loss: 1.0516, test_loss: 1.0546, test_f1: 0.3572
 epoch: 92, train_loss: 1.0490, test_loss: 1.1821, test_f1: 0.3432
 epoch: 93, train_loss: 1.0501, test_loss: 1.0633, test_f1: 0.3592
 epoch: 94, train_loss: 1.0433, test_loss: 1.0962, test_f1: 0.3424
 epoch: 95, train_loss: 1.0328, test_loss: 1.0454, test_f1: 0.3533
 epoch: 96, train_loss: 1.0375, test_loss: 1.1356, test_f1: 0.3426
 epoch: 97, train_loss: 1.0484, test_loss: 1.0632, test_f1: 0.3571
 epoch: 98, train_loss: 1.0451, test_loss: 1.0505, test_f1: 0.3609
 epoch: 99, train_loss: 1.0358, test_loss: 1.2347, test_f1: 0.3332
##################ITERATION #4 ****************************************
 epoch: 0, train_loss: 1.3868, test_loss: 1.3377, test_f1: 0.2270
 epoch: 1, train_loss: 1.2486, test_loss: 1.2574, test_f1: 0.2270
 epoch: 2, train_loss: 1.2388, test_loss: 1.2479, test_f1: 0.2270
 epoch: 3, train_loss: 1.2312, test_loss: 1.2232, test_f1: 0.2270
 epoch: 4, train_loss: 1.2322, test_loss: 1.1799, test_f1: 0.2270
 epoch: 5, train_loss: 1.2150, test_loss: 1.1568, test_f1: 0.3371
 epoch: 6, train_loss: 1.2067, test_loss: 1.1462, test_f1: 0.3543
 epoch: 7, train_loss: 1.1756, test_loss: 1.1255, test_f1: 0.3429
 epoch: 8, train_loss: 1.1472, test_loss: 1.1836, test_f1: 0.2968
 epoch: 9, train_loss: 1.1129, test_loss: 1.1894, test_f1: 0.3078
 epoch: 10, train_loss: 1.1035, test_loss: 1.2349, test_f1: 0.3135
 epoch: 11, train_loss: 1.1215, test_loss: 1.2428, test_f1: 0.3133
 epoch: 12, train_loss: 1.1025, test_loss: 1.1518, test_f1: 0.3280
 epoch: 13, train_loss: 1.0961, test_loss: 1.0637, test_f1: 0.3430
 epoch: 14, train_loss: 1.0735, test_loss: 1.2290, test_f1: 0.3109
 epoch: 15, train_loss: 1.0733, test_loss: 1.1241, test_f1: 0.3488
 epoch: 16, train_loss: 1.0637, test_loss: 1.0898, test_f1: 0.3415
 epoch: 17, train_loss: 1.0622, test_loss: 1.0975, test_f1: 0.3504
 epoch: 18, train_loss: 1.0710, test_loss: 1.0880, test_f1: 0.3533
 epoch: 19, train_loss: 1.0552, test_loss: 1.0785, test_f1: 0.3580
 epoch: 20, train_loss: 1.0653, test_loss: 1.1698, test_f1: 0.3186
 epoch: 21, train_loss: 1.0828, test_loss: 1.1420, test_f1: 0.3432
 epoch: 22, train_loss: 1.1092, test_loss: 1.1364, test_f1: 0.3422
 epoch: 23, train_loss: 1.1217, test_loss: 1.1453, test_f1: 0.3447
 epoch: 24, train_loss: 1.1396, test_loss: 1.1910, test_f1: 0.3365
 epoch: 25, train_loss: 1.1228, test_loss: 1.3533, test_f1: 0.2270
 epoch: 26, train_loss: 1.1119, test_loss: 1.1433, test_f1: 0.3359
 epoch: 27, train_loss: 1.1031, test_loss: 1.1677, test_f1: 0.3413
 epoch: 28, train_loss: 1.1023, test_loss: 1.1571, test_f1: 0.3479
 epoch: 29, train_loss: 1.1088, test_loss: 1.1452, test_f1: 0.3384
 epoch: 30, train_loss: 1.1110, test_loss: 1.1133, test_f1: 0.3513
 epoch: 31, train_loss: 1.1015, test_loss: 1.1968, test_f1: 0.3422
 epoch: 32, train_loss: 1.1254, test_loss: 1.1239, test_f1: 0.3460
 epoch: 33, train_loss: 1.1154, test_loss: 1.1642, test_f1: 0.3441
 epoch: 34, train_loss: 1.0931, test_loss: 1.2232, test_f1: 0.3422
 epoch: 35, train_loss: 1.0886, test_loss: 1.1855, test_f1: 0.3432
 epoch: 36, train_loss: 1.0985, test_loss: 1.0673, test_f1: 0.3583
 epoch: 37, train_loss: 1.0897, test_loss: 1.1212, test_f1: 0.3425
 epoch: 38, train_loss: 1.0906, test_loss: 1.1205, test_f1: 0.3479
 epoch: 39, train_loss: 1.0752, test_loss: 1.1862, test_f1: 0.3432
 epoch: 40, train_loss: 1.0754, test_loss: 1.3779, test_f1: 0.3173
 epoch: 41, train_loss: 1.0813, test_loss: 1.1667, test_f1: 0.3415
 epoch: 42, train_loss: 1.0919, test_loss: 1.1408, test_f1: 0.3425
 epoch: 43, train_loss: 1.0833, test_loss: 1.1265, test_f1: 0.3450
 epoch: 44, train_loss: 1.0846, test_loss: 1.1640, test_f1: 0.3432
 epoch: 45, train_loss: 1.0861, test_loss: 1.0912, test_f1: 0.3532
 epoch: 46, train_loss: 1.0822, test_loss: 1.1891, test_f1: 0.3434
 epoch: 47, train_loss: 1.0899, test_loss: 1.1536, test_f1: 0.3393
 epoch: 48, train_loss: 1.0799, test_loss: 1.1912, test_f1: 0.3344
 epoch: 49, train_loss: 1.0659, test_loss: 1.0919, test_f1: 0.3502
 epoch: 50, train_loss: 1.0853, test_loss: 1.1390, test_f1: 0.3399
 epoch: 51, train_loss: 1.0773, test_loss: 1.1103, test_f1: 0.3429
 epoch: 52, train_loss: 1.0762, test_loss: 1.1138, test_f1: 0.3484
 epoch: 53, train_loss: 1.0737, test_loss: 1.1305, test_f1: 0.3432
 epoch: 54, train_loss: 1.0747, test_loss: 1.1344, test_f1: 0.3477
 epoch: 55, train_loss: 1.0653, test_loss: 1.1169, test_f1: 0.3459
 epoch: 56, train_loss: 1.0755, test_loss: 1.1268, test_f1: 0.3468
 epoch: 57, train_loss: 1.0672, test_loss: 1.1424, test_f1: 0.3444
 epoch: 58, train_loss: 1.0623, test_loss: 1.1101, test_f1: 0.3453
 epoch: 59, train_loss: 1.0606, test_loss: 1.1498, test_f1: 0.3436
 epoch: 60, train_loss: 1.0687, test_loss: 1.1385, test_f1: 0.3431
 epoch: 61, train_loss: 1.0699, test_loss: 1.1502, test_f1: 0.3467
 epoch: 62, train_loss: 1.0641, test_loss: 1.1695, test_f1: 0.3431
 epoch: 63, train_loss: 1.0661, test_loss: 1.1736, test_f1: 0.3431
 epoch: 64, train_loss: 1.0603, test_loss: 1.1675, test_f1: 0.3412
 epoch: 65, train_loss: 1.0665, test_loss: 1.1248, test_f1: 0.3462
 epoch: 66, train_loss: 1.0656, test_loss: 1.1189, test_f1: 0.3444
 epoch: 67, train_loss: 1.0584, test_loss: 1.1620, test_f1: 0.3462
 epoch: 68, train_loss: 1.0620, test_loss: 1.1802, test_f1: 0.3453
 epoch: 69, train_loss: 1.0603, test_loss: 1.1709, test_f1: 0.3453
 epoch: 70, train_loss: 1.0587, test_loss: 1.1715, test_f1: 0.3460
 epoch: 71, train_loss: 1.0580, test_loss: 1.1808, test_f1: 0.3425
 epoch: 72, train_loss: 1.0607, test_loss: 1.1696, test_f1: 0.3441
 epoch: 73, train_loss: 1.0593, test_loss: 1.1844, test_f1: 0.3422
 epoch: 74, train_loss: 1.0608, test_loss: 1.1663, test_f1: 0.3416
 epoch: 75, train_loss: 1.0589, test_loss: 1.1614, test_f1: 0.3452
 epoch: 76, train_loss: 1.0557, test_loss: 1.1583, test_f1: 0.3452
 epoch: 77, train_loss: 1.0566, test_loss: 1.1771, test_f1: 0.3431
 epoch: 78, train_loss: 1.0591, test_loss: 1.1632, test_f1: 0.3453
 epoch: 79, train_loss: 1.0695, test_loss: 1.1629, test_f1: 0.3431
 epoch: 80, train_loss: 1.0628, test_loss: 1.1719, test_f1: 0.3462
 epoch: 81, train_loss: 1.0618, test_loss: 1.1517, test_f1: 0.3417
 epoch: 82, train_loss: 1.0627, test_loss: 1.1337, test_f1: 0.3453
 epoch: 83, train_loss: 1.0595, test_loss: 1.1528, test_f1: 0.3435
 epoch: 84, train_loss: 1.0533, test_loss: 1.1833, test_f1: 0.3431
 epoch: 85, train_loss: 1.0600, test_loss: 1.1817, test_f1: 0.3444
 epoch: 86, train_loss: 1.0525, test_loss: 1.1863, test_f1: 0.3462
 epoch: 87, train_loss: 1.0533, test_loss: 1.1810, test_f1: 0.3453
 epoch: 88, train_loss: 1.0552, test_loss: 1.1432, test_f1: 0.3441
 epoch: 89, train_loss: 1.0718, test_loss: 1.1678, test_f1: 0.3453
 epoch: 90, train_loss: 1.0565, test_loss: 1.1708, test_f1: 0.3462
 epoch: 91, train_loss: 1.0551, test_loss: 1.1801, test_f1: 0.3452
 epoch: 92, train_loss: 1.0542, test_loss: 1.1548, test_f1: 0.3426
 epoch: 93, train_loss: 1.0558, test_loss: 1.1077, test_f1: 0.3444
 epoch: 94, train_loss: 1.0626, test_loss: 1.1403, test_f1: 0.3460
 epoch: 95, train_loss: 1.0611, test_loss: 1.1715, test_f1: 0.3410
 epoch: 96, train_loss: 1.0582, test_loss: 1.1615, test_f1: 0.3455
 epoch: 97, train_loss: 1.0540, test_loss: 1.1381, test_f1: 0.3453
 epoch: 98, train_loss: 1.0560, test_loss: 1.1396, test_f1: 0.3444
 epoch: 99, train_loss: 1.0571, test_loss: 1.1664, test_f1: 0.3444
##################ITERATION #5 ****************************************
 epoch: 0, train_loss: 1.5167, test_loss: 1.4003, test_f1: 0.2270
 epoch: 1, train_loss: 1.3681, test_loss: 1.3446, test_f1: 0.2270
 epoch: 2, train_loss: 1.3183, test_loss: 1.3170, test_f1: 0.2270
 epoch: 3, train_loss: 1.3024, test_loss: 1.3154, test_f1: 0.2270
 epoch: 4, train_loss: 1.3018, test_loss: 1.3171, test_f1: 0.2270
 epoch: 5, train_loss: 1.3018, test_loss: 1.3153, test_f1: 0.2270
 epoch: 6, train_loss: 1.3016, test_loss: 1.3155, test_f1: 0.2270
 epoch: 7, train_loss: 1.3021, test_loss: 1.3150, test_f1: 0.2270
 epoch: 8, train_loss: 1.3027, test_loss: 1.3155, test_f1: 0.2270
 epoch: 9, train_loss: 1.3022, test_loss: 1.3151, test_f1: 0.2270
 epoch: 10, train_loss: 1.3024, test_loss: 1.3152, test_f1: 0.2270
 epoch: 11, train_loss: 1.3015, test_loss: 1.3154, test_f1: 0.2270
 epoch: 12, train_loss: 1.3016, test_loss: 1.3153, test_f1: 0.2270
 epoch: 13, train_loss: 1.3017, test_loss: 1.3149, test_f1: 0.2270
 epoch: 14, train_loss: 1.3021, test_loss: 1.3157, test_f1: 0.2270
 epoch: 15, train_loss: 1.3015, test_loss: 1.3139, test_f1: 0.2270
 epoch: 16, train_loss: 1.3014, test_loss: 1.3162, test_f1: 0.2270
 epoch: 17, train_loss: 1.3024, test_loss: 1.3155, test_f1: 0.2270
 epoch: 18, train_loss: 1.3028, test_loss: 1.3166, test_f1: 0.2270
 epoch: 19, train_loss: 1.3036, test_loss: 1.3149, test_f1: 0.2270
 epoch: 20, train_loss: 1.3033, test_loss: 1.3162, test_f1: 0.2270
 epoch: 21, train_loss: 1.3018, test_loss: 1.3153, test_f1: 0.2270
 epoch: 22, train_loss: 1.3019, test_loss: 1.3150, test_f1: 0.2270
 epoch: 23, train_loss: 1.3023, test_loss: 1.3143, test_f1: 0.2270
 epoch: 24, train_loss: 1.3020, test_loss: 1.3156, test_f1: 0.2270
 epoch: 25, train_loss: 1.3019, test_loss: 1.3145, test_f1: 0.2270
 epoch: 26, train_loss: 1.3028, test_loss: 1.3150, test_f1: 0.2270
 epoch: 27, train_loss: 1.3024, test_loss: 1.3152, test_f1: 0.2270
 epoch: 28, train_loss: 1.3015, test_loss: 1.3145, test_f1: 0.2270
 epoch: 29, train_loss: 1.3020, test_loss: 1.3145, test_f1: 0.2270
 epoch: 30, train_loss: 1.3018, test_loss: 1.3155, test_f1: 0.2270
 epoch: 31, train_loss: 1.3020, test_loss: 1.3161, test_f1: 0.2270
 epoch: 32, train_loss: 1.3015, test_loss: 1.3142, test_f1: 0.2270
 epoch: 33, train_loss: 1.3021, test_loss: 1.3146, test_f1: 0.2270
 epoch: 34, train_loss: 1.3022, test_loss: 1.3169, test_f1: 0.2270
 epoch: 35, train_loss: 1.3021, test_loss: 1.3144, test_f1: 0.2270
 epoch: 36, train_loss: 1.3021, test_loss: 1.3162, test_f1: 0.2270
 epoch: 37, train_loss: 1.3014, test_loss: 1.3155, test_f1: 0.2270
 epoch: 38, train_loss: 1.3016, test_loss: 1.3151, test_f1: 0.2270
 epoch: 39, train_loss: 1.3017, test_loss: 1.3153, test_f1: 0.2270
 epoch: 40, train_loss: 1.3022, test_loss: 1.3139, test_f1: 0.2270
 epoch: 41, train_loss: 1.3018, test_loss: 1.3150, test_f1: 0.2270
 epoch: 42, train_loss: 1.3021, test_loss: 1.3143, test_f1: 0.2270
 epoch: 43, train_loss: 1.3024, test_loss: 1.3169, test_f1: 0.2270
 epoch: 44, train_loss: 1.3021, test_loss: 1.3150, test_f1: 0.2270
 epoch: 45, train_loss: 1.3018, test_loss: 1.3172, test_f1: 0.2270
 epoch: 46, train_loss: 1.3019, test_loss: 1.3141, test_f1: 0.2270
 epoch: 47, train_loss: 1.3016, test_loss: 1.3157, test_f1: 0.2270
 epoch: 48, train_loss: 1.3023, test_loss: 1.3148, test_f1: 0.2270
 epoch: 49, train_loss: 1.3017, test_loss: 1.3174, test_f1: 0.2270
 epoch: 50, train_loss: 1.3022, test_loss: 1.3162, test_f1: 0.2270
 epoch: 51, train_loss: 1.3017, test_loss: 1.3143, test_f1: 0.2270
 epoch: 52, train_loss: 1.3016, test_loss: 1.3154, test_f1: 0.2270
 epoch: 53, train_loss: 1.3015, test_loss: 1.3145, test_f1: 0.2270
 epoch: 54, train_loss: 1.3014, test_loss: 1.3152, test_f1: 0.2270
 epoch: 55, train_loss: 1.3016, test_loss: 1.3157, test_f1: 0.2270
 epoch: 56, train_loss: 1.3016, test_loss: 1.3148, test_f1: 0.2270
 epoch: 57, train_loss: 1.3014, test_loss: 1.3153, test_f1: 0.2270
 epoch: 58, train_loss: 1.3019, test_loss: 1.3147, test_f1: 0.2270
 epoch: 59, train_loss: 1.3018, test_loss: 1.3168, test_f1: 0.2270
 epoch: 60, train_loss: 1.3015, test_loss: 1.3141, test_f1: 0.2270
 epoch: 61, train_loss: 1.3017, test_loss: 1.3157, test_f1: 0.2270
 epoch: 62, train_loss: 1.3015, test_loss: 1.3153, test_f1: 0.2270
 epoch: 63, train_loss: 1.3014, test_loss: 1.3149, test_f1: 0.2270
 epoch: 64, train_loss: 1.3024, test_loss: 1.3144, test_f1: 0.2270
 epoch: 65, train_loss: 1.3013, test_loss: 1.3170, test_f1: 0.2270
 epoch: 66, train_loss: 1.3014, test_loss: 1.3151, test_f1: 0.2270
 epoch: 67, train_loss: 1.3016, test_loss: 1.3145, test_f1: 0.2270
 epoch: 68, train_loss: 1.3014, test_loss: 1.3156, test_f1: 0.2270
 epoch: 69, train_loss: 1.3015, test_loss: 1.3148, test_f1: 0.2270
 epoch: 70, train_loss: 1.3014, test_loss: 1.3152, test_f1: 0.2270
 epoch: 71, train_loss: 1.3016, test_loss: 1.3152, test_f1: 0.2270
 epoch: 72, train_loss: 1.3016, test_loss: 1.3143, test_f1: 0.2270
 epoch: 73, train_loss: 1.3016, test_loss: 1.3158, test_f1: 0.2270
 epoch: 74, train_loss: 1.3014, test_loss: 1.3153, test_f1: 0.2270
 epoch: 75, train_loss: 1.3014, test_loss: 1.3148, test_f1: 0.2270
 epoch: 76, train_loss: 1.3014, test_loss: 1.3148, test_f1: 0.2270
 epoch: 77, train_loss: 1.3015, test_loss: 1.3157, test_f1: 0.2270
 epoch: 78, train_loss: 1.3019, test_loss: 1.3144, test_f1: 0.2270
 epoch: 79, train_loss: 1.3017, test_loss: 1.3154, test_f1: 0.2270
 epoch: 80, train_loss: 1.3017, test_loss: 1.3147, test_f1: 0.2270
 epoch: 81, train_loss: 1.3020, test_loss: 1.3146, test_f1: 0.2270
 epoch: 82, train_loss: 1.3019, test_loss: 1.3158, test_f1: 0.2270
 epoch: 83, train_loss: 1.3015, test_loss: 1.3144, test_f1: 0.2270
 epoch: 84, train_loss: 1.3019, test_loss: 1.3145, test_f1: 0.2270
 epoch: 85, train_loss: 1.3012, test_loss: 1.3162, test_f1: 0.2270
 epoch: 86, train_loss: 1.3015, test_loss: 1.3155, test_f1: 0.2270
 epoch: 87, train_loss: 1.3018, test_loss: 1.3149, test_f1: 0.2270
 epoch: 88, train_loss: 1.3013, test_loss: 1.3153, test_f1: 0.2270
 epoch: 89, train_loss: 1.3017, test_loss: 1.3153, test_f1: 0.2270
 epoch: 90, train_loss: 1.3014, test_loss: 1.3146, test_f1: 0.2270
 epoch: 91, train_loss: 1.3016, test_loss: 1.3154, test_f1: 0.2270
 epoch: 92, train_loss: 1.3019, test_loss: 1.3145, test_f1: 0.2270
 epoch: 93, train_loss: 1.3014, test_loss: 1.3160, test_f1: 0.2270
 epoch: 94, train_loss: 1.3016, test_loss: 1.3150, test_f1: 0.2270
 epoch: 95, train_loss: 1.3018, test_loss: 1.3146, test_f1: 0.2270
 epoch: 96, train_loss: 1.3015, test_loss: 1.3154, test_f1: 0.2270
 epoch: 97, train_loss: 1.3018, test_loss: 1.3150, test_f1: 0.2270
 epoch: 98, train_loss: 1.3015, test_loss: 1.3148, test_f1: 0.2270
 epoch: 99, train_loss: 1.3014, test_loss: 1.3153, test_f1: 0.2270
##################ITERATION #6 ****************************************
 epoch: 0, train_loss: 1.3084, test_loss: 1.3145, test_f1: 0.2270
 epoch: 1, train_loss: 1.3051, test_loss: 1.3161, test_f1: 0.2270
 epoch: 2, train_loss: 1.3037, test_loss: 1.3157, test_f1: 0.2270
 epoch: 3, train_loss: 1.3020, test_loss: 1.3146, test_f1: 0.2270
 epoch: 4, train_loss: 1.3023, test_loss: 1.3148, test_f1: 0.2270
 epoch: 5, train_loss: 1.3016, test_loss: 1.3149, test_f1: 0.2270
 epoch: 6, train_loss: 1.3030, test_loss: 1.3154, test_f1: 0.2270
 epoch: 7, train_loss: 1.3025, test_loss: 1.3162, test_f1: 0.2270
 epoch: 8, train_loss: 1.3022, test_loss: 1.3152, test_f1: 0.2270
 epoch: 9, train_loss: 1.3021, test_loss: 1.3144, test_f1: 0.2270
 epoch: 10, train_loss: 1.3022, test_loss: 1.3156, test_f1: 0.2270
 epoch: 11, train_loss: 1.3031, test_loss: 1.3144, test_f1: 0.2270
 epoch: 12, train_loss: 1.3044, test_loss: 1.3145, test_f1: 0.2270
 epoch: 13, train_loss: 1.3020, test_loss: 1.3159, test_f1: 0.2270
 epoch: 14, train_loss: 1.3015, test_loss: 1.3147, test_f1: 0.2270
 epoch: 15, train_loss: 1.3029, test_loss: 1.3146, test_f1: 0.2270
 epoch: 16, train_loss: 1.3020, test_loss: 1.3152, test_f1: 0.2270
 epoch: 17, train_loss: 1.3020, test_loss: 1.3154, test_f1: 0.2270
 epoch: 18, train_loss: 1.3023, test_loss: 1.3163, test_f1: 0.2270
 epoch: 19, train_loss: 1.3029, test_loss: 1.3134, test_f1: 0.2270
 epoch: 20, train_loss: 1.3018, test_loss: 1.3167, test_f1: 0.2270
 epoch: 21, train_loss: 1.3024, test_loss: 1.3148, test_f1: 0.2270
 epoch: 22, train_loss: 1.3018, test_loss: 1.3157, test_f1: 0.2270
 epoch: 23, train_loss: 1.3019, test_loss: 1.3155, test_f1: 0.2270
 epoch: 24, train_loss: 1.3017, test_loss: 1.3142, test_f1: 0.2270
 epoch: 25, train_loss: 1.3024, test_loss: 1.3158, test_f1: 0.2270
 epoch: 26, train_loss: 1.3019, test_loss: 1.3149, test_f1: 0.2270
 epoch: 27, train_loss: 1.3029, test_loss: 1.3153, test_f1: 0.2270
 epoch: 28, train_loss: 1.3022, test_loss: 1.3147, test_f1: 0.2270
 epoch: 29, train_loss: 1.3022, test_loss: 1.3145, test_f1: 0.2270
 epoch: 30, train_loss: 1.3023, test_loss: 1.3156, test_f1: 0.2270
 epoch: 31, train_loss: 1.3024, test_loss: 1.3153, test_f1: 0.2270
 epoch: 32, train_loss: 1.3023, test_loss: 1.3151, test_f1: 0.2270
 epoch: 33, train_loss: 1.3016, test_loss: 1.3150, test_f1: 0.2270
 epoch: 34, train_loss: 1.3015, test_loss: 1.3151, test_f1: 0.2270
 epoch: 35, train_loss: 1.3021, test_loss: 1.3144, test_f1: 0.2270
 epoch: 36, train_loss: 1.3020, test_loss: 1.3150, test_f1: 0.2270
 epoch: 37, train_loss: 1.3021, test_loss: 1.3157, test_f1: 0.2270
 epoch: 38, train_loss: 1.3029, test_loss: 1.3141, test_f1: 0.2270
 epoch: 39, train_loss: 1.3026, test_loss: 1.3154, test_f1: 0.2270
 epoch: 40, train_loss: 1.3027, test_loss: 1.3141, test_f1: 0.2270
 epoch: 41, train_loss: 1.3019, test_loss: 1.3169, test_f1: 0.2270
 epoch: 42, train_loss: 1.3025, test_loss: 1.3149, test_f1: 0.2270
 epoch: 43, train_loss: 1.3018, test_loss: 1.3148, test_f1: 0.2270
 epoch: 44, train_loss: 1.3024, test_loss: 1.3159, test_f1: 0.2270
 epoch: 45, train_loss: 1.3022, test_loss: 1.3137, test_f1: 0.2270
 epoch: 46, train_loss: 1.3020, test_loss: 1.3158, test_f1: 0.2270
 epoch: 47, train_loss: 1.3028, test_loss: 1.3153, test_f1: 0.2270
 epoch: 48, train_loss: 1.3023, test_loss: 1.3152, test_f1: 0.2270
 epoch: 49, train_loss: 1.3016, test_loss: 1.3149, test_f1: 0.2270
 epoch: 50, train_loss: 1.3021, test_loss: 1.3171, test_f1: 0.2270
 epoch: 51, train_loss: 1.3021, test_loss: 1.3146, test_f1: 0.2270
 epoch: 52, train_loss: 1.3015, test_loss: 1.3153, test_f1: 0.2270
 epoch: 53, train_loss: 1.3019, test_loss: 1.3148, test_f1: 0.2270
 epoch: 54, train_loss: 1.3025, test_loss: 1.3152, test_f1: 0.2270
 epoch: 55, train_loss: 1.3014, test_loss: 1.3152, test_f1: 0.2270
 epoch: 56, train_loss: 1.3014, test_loss: 1.3152, test_f1: 0.2270
 epoch: 57, train_loss: 1.3015, test_loss: 1.3149, test_f1: 0.2270
 epoch: 58, train_loss: 1.3016, test_loss: 1.3158, test_f1: 0.2270
 epoch: 59, train_loss: 1.3018, test_loss: 1.3148, test_f1: 0.2270
 epoch: 60, train_loss: 1.3020, test_loss: 1.3155, test_f1: 0.2270
 epoch: 61, train_loss: 1.3014, test_loss: 1.3145, test_f1: 0.2270
 epoch: 62, train_loss: 1.3020, test_loss: 1.3165, test_f1: 0.2270
 epoch: 63, train_loss: 1.3018, test_loss: 1.3143, test_f1: 0.2270
 epoch: 64, train_loss: 1.3015, test_loss: 1.3154, test_f1: 0.2270
 epoch: 65, train_loss: 1.3014, test_loss: 1.3146, test_f1: 0.2270
 epoch: 66, train_loss: 1.3018, test_loss: 1.3150, test_f1: 0.2270
 epoch: 67, train_loss: 1.3013, test_loss: 1.3152, test_f1: 0.2270
 epoch: 68, train_loss: 1.3023, test_loss: 1.3158, test_f1: 0.2270
 epoch: 69, train_loss: 1.3017, test_loss: 1.3141, test_f1: 0.2270
 epoch: 70, train_loss: 1.3018, test_loss: 1.3160, test_f1: 0.2270
 epoch: 71, train_loss: 1.3023, test_loss: 1.3139, test_f1: 0.2270
 epoch: 72, train_loss: 1.3025, test_loss: 1.3174, test_f1: 0.2270
 epoch: 73, train_loss: 1.3013, test_loss: 1.3142, test_f1: 0.2270
 epoch: 74, train_loss: 1.3019, test_loss: 1.3155, test_f1: 0.2270
 epoch: 75, train_loss: 1.3013, test_loss: 1.3148, test_f1: 0.2270
 epoch: 76, train_loss: 1.3017, test_loss: 1.3150, test_f1: 0.2270
 epoch: 77, train_loss: 1.3020, test_loss: 1.3146, test_f1: 0.2270
 epoch: 78, train_loss: 1.3017, test_loss: 1.3159, test_f1: 0.2270
 epoch: 79, train_loss: 1.3018, test_loss: 1.3157, test_f1: 0.2270
 epoch: 80, train_loss: 1.3016, test_loss: 1.3154, test_f1: 0.2270
 epoch: 81, train_loss: 1.3015, test_loss: 1.3151, test_f1: 0.2270
 epoch: 82, train_loss: 1.3017, test_loss: 1.3149, test_f1: 0.2270
 epoch: 83, train_loss: 1.3015, test_loss: 1.3151, test_f1: 0.2270
 epoch: 84, train_loss: 1.3016, test_loss: 1.3155, test_f1: 0.2270
 epoch: 85, train_loss: 1.3019, test_loss: 1.3152, test_f1: 0.2270
 epoch: 86, train_loss: 1.3015, test_loss: 1.3149, test_f1: 0.2270
 epoch: 87, train_loss: 1.3015, test_loss: 1.3151, test_f1: 0.2270
 epoch: 88, train_loss: 1.3020, test_loss: 1.3165, test_f1: 0.2270
 epoch: 89, train_loss: 1.3020, test_loss: 1.3149, test_f1: 0.2270
 epoch: 90, train_loss: 1.3016, test_loss: 1.3151, test_f1: 0.2270
 epoch: 91, train_loss: 1.3014, test_loss: 1.3159, test_f1: 0.2270
 epoch: 92, train_loss: 1.3017, test_loss: 1.3141, test_f1: 0.2270
 epoch: 93, train_loss: 1.3017, test_loss: 1.3155, test_f1: 0.2270
 epoch: 94, train_loss: 1.3017, test_loss: 1.3149, test_f1: 0.2270
 epoch: 95, train_loss: 1.3015, test_loss: 1.3149, test_f1: 0.2270
 epoch: 96, train_loss: 1.3017, test_loss: 1.3149, test_f1: 0.2270
 epoch: 97, train_loss: 1.3018, test_loss: 1.3156, test_f1: 0.2270
 epoch: 98, train_loss: 1.3016, test_loss: 1.3146, test_f1: 0.2270
 epoch: 99, train_loss: 1.3027, test_loss: 1.3149, test_f1: 0.2270
##################ITERATION #7 ****************************************
 epoch: 0, train_loss: 1.3505, test_loss: 1.3177, test_f1: 0.2270
 epoch: 1, train_loss: 1.3018, test_loss: 1.3169, test_f1: 0.2270
 epoch: 2, train_loss: 1.3035, test_loss: 1.3139, test_f1: 0.2270
 epoch: 3, train_loss: 1.3015, test_loss: 1.3175, test_f1: 0.2270
 epoch: 4, train_loss: 1.3020, test_loss: 1.3152, test_f1: 0.2270
 epoch: 5, train_loss: 1.3014, test_loss: 1.3145, test_f1: 0.2270
 epoch: 6, train_loss: 1.3015, test_loss: 1.3149, test_f1: 0.2270
 epoch: 7, train_loss: 1.3016, test_loss: 1.3149, test_f1: 0.2270
 epoch: 8, train_loss: 1.3018, test_loss: 1.3153, test_f1: 0.2270
 epoch: 9, train_loss: 1.3015, test_loss: 1.3148, test_f1: 0.2270
 epoch: 10, train_loss: 1.3025, test_loss: 1.3156, test_f1: 0.2270
 epoch: 11, train_loss: 1.3017, test_loss: 1.3149, test_f1: 0.2270
 epoch: 12, train_loss: 1.3015, test_loss: 1.3152, test_f1: 0.2270
 epoch: 13, train_loss: 1.3017, test_loss: 1.3157, test_f1: 0.2270
 epoch: 14, train_loss: 1.3027, test_loss: 1.3149, test_f1: 0.2270
 epoch: 15, train_loss: 1.3018, test_loss: 1.3166, test_f1: 0.2270
 epoch: 16, train_loss: 1.3017, test_loss: 1.3144, test_f1: 0.2270
 epoch: 17, train_loss: 1.3025, test_loss: 1.3165, test_f1: 0.2270
 epoch: 18, train_loss: 1.3016, test_loss: 1.3144, test_f1: 0.2270
 epoch: 19, train_loss: 1.3018, test_loss: 1.3145, test_f1: 0.2270
 epoch: 20, train_loss: 1.3021, test_loss: 1.3152, test_f1: 0.2270
 epoch: 21, train_loss: 1.3028, test_loss: 1.3169, test_f1: 0.2270
 epoch: 22, train_loss: 1.3016, test_loss: 1.3159, test_f1: 0.2270
 epoch: 23, train_loss: 1.3022, test_loss: 1.3157, test_f1: 0.2270
 epoch: 24, train_loss: 1.3028, test_loss: 1.3153, test_f1: 0.2270
 epoch: 25, train_loss: 1.3023, test_loss: 1.3151, test_f1: 0.2270
 epoch: 26, train_loss: 1.3019, test_loss: 1.3158, test_f1: 0.2270
 epoch: 27, train_loss: 1.3029, test_loss: 1.3154, test_f1: 0.2270
 epoch: 28, train_loss: 1.3018, test_loss: 1.3153, test_f1: 0.2270
 epoch: 29, train_loss: 1.3023, test_loss: 1.3151, test_f1: 0.2270
 epoch: 30, train_loss: 1.3019, test_loss: 1.3142, test_f1: 0.2270
 epoch: 31, train_loss: 1.3015, test_loss: 1.3154, test_f1: 0.2270
 epoch: 32, train_loss: 1.3019, test_loss: 1.3157, test_f1: 0.2270
 epoch: 33, train_loss: 1.3016, test_loss: 1.3146, test_f1: 0.2270
 epoch: 34, train_loss: 1.3020, test_loss: 1.3161, test_f1: 0.2270
 epoch: 35, train_loss: 1.3023, test_loss: 1.3151, test_f1: 0.2270
 epoch: 36, train_loss: 1.3018, test_loss: 1.3154, test_f1: 0.2270
 epoch: 37, train_loss: 1.3021, test_loss: 1.3161, test_f1: 0.2270
 epoch: 38, train_loss: 1.3027, test_loss: 1.3152, test_f1: 0.2270
 epoch: 39, train_loss: 1.3026, test_loss: 1.3146, test_f1: 0.2270
 epoch: 40, train_loss: 1.3023, test_loss: 1.3161, test_f1: 0.2270
 epoch: 41, train_loss: 1.3022, test_loss: 1.3137, test_f1: 0.2270
 epoch: 42, train_loss: 1.3020, test_loss: 1.3167, test_f1: 0.2270
 epoch: 43, train_loss: 1.3033, test_loss: 1.3155, test_f1: 0.2270
 epoch: 44, train_loss: 1.3016, test_loss: 1.3151, test_f1: 0.2270
 epoch: 45, train_loss: 1.3024, test_loss: 1.3170, test_f1: 0.2270
 epoch: 46, train_loss: 1.3024, test_loss: 1.3143, test_f1: 0.2270
 epoch: 47, train_loss: 1.3022, test_loss: 1.3159, test_f1: 0.2270
 epoch: 48, train_loss: 1.3026, test_loss: 1.3159, test_f1: 0.2270
 epoch: 49, train_loss: 1.3027, test_loss: 1.3140, test_f1: 0.2270
 epoch: 50, train_loss: 1.3017, test_loss: 1.3150, test_f1: 0.2270
 epoch: 51, train_loss: 1.3015, test_loss: 1.3152, test_f1: 0.2270
 epoch: 52, train_loss: 1.3014, test_loss: 1.3150, test_f1: 0.2270
 epoch: 53, train_loss: 1.3015, test_loss: 1.3149, test_f1: 0.2270
 epoch: 54, train_loss: 1.3015, test_loss: 1.3149, test_f1: 0.2270
 epoch: 55, train_loss: 1.3015, test_loss: 1.3151, test_f1: 0.2270
 epoch: 56, train_loss: 1.3020, test_loss: 1.3157, test_f1: 0.2270
 epoch: 57, train_loss: 1.3021, test_loss: 1.3148, test_f1: 0.2270
 epoch: 58, train_loss: 1.3016, test_loss: 1.3153, test_f1: 0.2270
 epoch: 59, train_loss: 1.3017, test_loss: 1.3154, test_f1: 0.2270
 epoch: 60, train_loss: 1.3014, test_loss: 1.3151, test_f1: 0.2270
 epoch: 61, train_loss: 1.3016, test_loss: 1.3149, test_f1: 0.2270
 epoch: 62, train_loss: 1.3017, test_loss: 1.3146, test_f1: 0.2270
 epoch: 63, train_loss: 1.3014, test_loss: 1.3152, test_f1: 0.2270
 epoch: 64, train_loss: 1.3020, test_loss: 1.3156, test_f1: 0.2270
 epoch: 65, train_loss: 1.3014, test_loss: 1.3141, test_f1: 0.2270
 epoch: 66, train_loss: 1.3017, test_loss: 1.3155, test_f1: 0.2270
 epoch: 67, train_loss: 1.3018, test_loss: 1.3152, test_f1: 0.2270
 epoch: 68, train_loss: 1.3015, test_loss: 1.3154, test_f1: 0.2270
 epoch: 69, train_loss: 1.3018, test_loss: 1.3151, test_f1: 0.2270
 epoch: 70, train_loss: 1.3017, test_loss: 1.3154, test_f1: 0.2270
 epoch: 71, train_loss: 1.3012, test_loss: 1.3145, test_f1: 0.2270
 epoch: 72, train_loss: 1.3015, test_loss: 1.3149, test_f1: 0.2270
 epoch: 73, train_loss: 1.3015, test_loss: 1.3151, test_f1: 0.2270
 epoch: 74, train_loss: 1.3016, test_loss: 1.3155, test_f1: 0.2270
 epoch: 75, train_loss: 1.3014, test_loss: 1.3150, test_f1: 0.2270
 epoch: 76, train_loss: 1.3014, test_loss: 1.3153, test_f1: 0.2270
 epoch: 77, train_loss: 1.3014, test_loss: 1.3150, test_f1: 0.2270
 epoch: 78, train_loss: 1.3015, test_loss: 1.3148, test_f1: 0.2270
 epoch: 79, train_loss: 1.3015, test_loss: 1.3150, test_f1: 0.2270
 epoch: 80, train_loss: 1.3017, test_loss: 1.3156, test_f1: 0.2270
 epoch: 81, train_loss: 1.3014, test_loss: 1.3146, test_f1: 0.2270
 epoch: 82, train_loss: 1.3014, test_loss: 1.3147, test_f1: 0.2270
 epoch: 83, train_loss: 1.3016, test_loss: 1.3158, test_f1: 0.2270
 epoch: 84, train_loss: 1.3013, test_loss: 1.3147, test_f1: 0.2270
 epoch: 85, train_loss: 1.3016, test_loss: 1.3149, test_f1: 0.2270
 epoch: 86, train_loss: 1.3017, test_loss: 1.3155, test_f1: 0.2270
 epoch: 87, train_loss: 1.3013, test_loss: 1.3145, test_f1: 0.2270
 epoch: 88, train_loss: 1.3015, test_loss: 1.3150, test_f1: 0.2270
 epoch: 89, train_loss: 1.3016, test_loss: 1.3154, test_f1: 0.2270
 epoch: 90, train_loss: 1.3018, test_loss: 1.3152, test_f1: 0.2270
 epoch: 91, train_loss: 1.3014, test_loss: 1.3154, test_f1: 0.2270
 epoch: 92, train_loss: 1.3015, test_loss: 1.3148, test_f1: 0.2270
 epoch: 93, train_loss: 1.3017, test_loss: 1.3154, test_f1: 0.2270
 epoch: 94, train_loss: 1.3013, test_loss: 1.3149, test_f1: 0.2270
 epoch: 95, train_loss: 1.3017, test_loss: 1.3142, test_f1: 0.2270
 epoch: 96, train_loss: 1.3016, test_loss: 1.3160, test_f1: 0.2270
 epoch: 97, train_loss: 1.3018, test_loss: 1.3150, test_f1: 0.2270
 epoch: 98, train_loss: 1.3022, test_loss: 1.3145, test_f1: 0.2270
 epoch: 99, train_loss: 1.3015, test_loss: 1.3153, test_f1: 0.2270
##################ITERATION #8 ****************************************
 epoch: 0, train_loss: 1.3159, test_loss: 1.3223, test_f1: 0.2270
 epoch: 1, train_loss: 1.3035, test_loss: 1.3141, test_f1: 0.2270
 epoch: 2, train_loss: 1.3021, test_loss: 1.3159, test_f1: 0.2270
 epoch: 3, train_loss: 1.3021, test_loss: 1.3147, test_f1: 0.2270
 epoch: 4, train_loss: 1.3022, test_loss: 1.3155, test_f1: 0.2270
 epoch: 5, train_loss: 1.3022, test_loss: 1.3146, test_f1: 0.2270
 epoch: 6, train_loss: 1.3024, test_loss: 1.3157, test_f1: 0.2270
 epoch: 7, train_loss: 1.3018, test_loss: 1.3150, test_f1: 0.2270
 epoch: 8, train_loss: 1.3021, test_loss: 1.3158, test_f1: 0.2270
 epoch: 9, train_loss: 1.3026, test_loss: 1.3139, test_f1: 0.2270
 epoch: 10, train_loss: 1.3022, test_loss: 1.3149, test_f1: 0.2270
 epoch: 11, train_loss: 1.3027, test_loss: 1.3157, test_f1: 0.2270
 epoch: 12, train_loss: 1.3025, test_loss: 1.3146, test_f1: 0.2270
 epoch: 13, train_loss: 1.3025, test_loss: 1.3152, test_f1: 0.2270
 epoch: 14, train_loss: 1.3019, test_loss: 1.3151, test_f1: 0.2270
 epoch: 15, train_loss: 1.3022, test_loss: 1.3150, test_f1: 0.2270
 epoch: 16, train_loss: 1.3021, test_loss: 1.3156, test_f1: 0.2270
 epoch: 17, train_loss: 1.3017, test_loss: 1.3156, test_f1: 0.2270
 epoch: 18, train_loss: 1.3020, test_loss: 1.3161, test_f1: 0.2270
 epoch: 19, train_loss: 1.3020, test_loss: 1.3146, test_f1: 0.2270
 epoch: 20, train_loss: 1.3015, test_loss: 1.3153, test_f1: 0.2270
 epoch: 21, train_loss: 1.3020, test_loss: 1.3148, test_f1: 0.2270
 epoch: 22, train_loss: 1.3021, test_loss: 1.3162, test_f1: 0.2270
 epoch: 23, train_loss: 1.3024, test_loss: 1.3165, test_f1: 0.2270
 epoch: 24, train_loss: 1.3021, test_loss: 1.3142, test_f1: 0.2270
 epoch: 25, train_loss: 1.3022, test_loss: 1.3168, test_f1: 0.2270
 epoch: 26, train_loss: 1.3019, test_loss: 1.3141, test_f1: 0.2270
 epoch: 27, train_loss: 1.3020, test_loss: 1.3148, test_f1: 0.2270
 epoch: 28, train_loss: 1.3026, test_loss: 1.3165, test_f1: 0.2270
 epoch: 29, train_loss: 1.3027, test_loss: 1.3134, test_f1: 0.2270
 epoch: 30, train_loss: 1.3017, test_loss: 1.3170, test_f1: 0.2270
 epoch: 31, train_loss: 1.3016, test_loss: 1.3148, test_f1: 0.2270
 epoch: 32, train_loss: 1.3020, test_loss: 1.3154, test_f1: 0.2270
 epoch: 33, train_loss: 1.3019, test_loss: 1.3150, test_f1: 0.2270
 epoch: 34, train_loss: 1.3019, test_loss: 1.3157, test_f1: 0.2270
 epoch: 35, train_loss: 1.3017, test_loss: 1.3141, test_f1: 0.2270
 epoch: 36, train_loss: 1.3020, test_loss: 1.3159, test_f1: 0.2270
 epoch: 37, train_loss: 1.3018, test_loss: 1.3144, test_f1: 0.2270
 epoch: 38, train_loss: 1.3027, test_loss: 1.3148, test_f1: 0.2270
 epoch: 39, train_loss: 1.3032, test_loss: 1.3154, test_f1: 0.2270
 epoch: 40, train_loss: 1.3014, test_loss: 1.3156, test_f1: 0.2270
 epoch: 41, train_loss: 1.3020, test_loss: 1.3151, test_f1: 0.2270
 epoch: 42, train_loss: 1.3022, test_loss: 1.3148, test_f1: 0.2270
 epoch: 43, train_loss: 1.3019, test_loss: 1.3169, test_f1: 0.2270
 epoch: 44, train_loss: 1.3020, test_loss: 1.3145, test_f1: 0.2270
 epoch: 45, train_loss: 1.3019, test_loss: 1.3154, test_f1: 0.2270
 epoch: 46, train_loss: 1.3022, test_loss: 1.3157, test_f1: 0.2270
 epoch: 47, train_loss: 1.3016, test_loss: 1.3151, test_f1: 0.2270
 epoch: 48, train_loss: 1.3022, test_loss: 1.3155, test_f1: 0.2270
 epoch: 49, train_loss: 1.3024, test_loss: 1.3164, test_f1: 0.2270
 epoch: 50, train_loss: 1.3019, test_loss: 1.3145, test_f1: 0.2270
 epoch: 51, train_loss: 1.3022, test_loss: 1.3147, test_f1: 0.2270
 epoch: 52, train_loss: 1.3024, test_loss: 1.3160, test_f1: 0.2270
 epoch: 53, train_loss: 1.3016, test_loss: 1.3146, test_f1: 0.2270
 epoch: 54, train_loss: 1.3017, test_loss: 1.3151, test_f1: 0.2270
 epoch: 55, train_loss: 1.3015, test_loss: 1.3145, test_f1: 0.2270
 epoch: 56, train_loss: 1.3021, test_loss: 1.3156, test_f1: 0.2270
 epoch: 57, train_loss: 1.3018, test_loss: 1.3149, test_f1: 0.2270
 epoch: 58, train_loss: 1.3017, test_loss: 1.3147, test_f1: 0.2270
 epoch: 59, train_loss: 1.3015, test_loss: 1.3150, test_f1: 0.2270
 epoch: 60, train_loss: 1.3014, test_loss: 1.3156, test_f1: 0.2270
 epoch: 61, train_loss: 1.3014, test_loss: 1.3149, test_f1: 0.2270
 epoch: 62, train_loss: 1.3018, test_loss: 1.3149, test_f1: 0.2270
 epoch: 63, train_loss: 1.3015, test_loss: 1.3151, test_f1: 0.2270
 epoch: 64, train_loss: 1.3015, test_loss: 1.3151, test_f1: 0.2270
 epoch: 65, train_loss: 1.3020, test_loss: 1.3147, test_f1: 0.2270
 epoch: 66, train_loss: 1.3018, test_loss: 1.3157, test_f1: 0.2270
 epoch: 67, train_loss: 1.3019, test_loss: 1.3142, test_f1: 0.2270
 epoch: 68, train_loss: 1.3018, test_loss: 1.3157, test_f1: 0.2270
 epoch: 69, train_loss: 1.3020, test_loss: 1.3144, test_f1: 0.2270
 epoch: 70, train_loss: 1.3028, test_loss: 1.3158, test_f1: 0.2270
 epoch: 71, train_loss: 1.3016, test_loss: 1.3144, test_f1: 0.2270
 epoch: 72, train_loss: 1.3016, test_loss: 1.3150, test_f1: 0.2270
 epoch: 73, train_loss: 1.3023, test_loss: 1.3153, test_f1: 0.2270
 epoch: 74, train_loss: 1.3015, test_loss: 1.3154, test_f1: 0.2270
 epoch: 75, train_loss: 1.3020, test_loss: 1.3156, test_f1: 0.2270
 epoch: 76, train_loss: 1.3014, test_loss: 1.3146, test_f1: 0.2270
 epoch: 77, train_loss: 1.3014, test_loss: 1.3146, test_f1: 0.2270
 epoch: 78, train_loss: 1.3017, test_loss: 1.3155, test_f1: 0.2270
 epoch: 79, train_loss: 1.3017, test_loss: 1.3150, test_f1: 0.2270
 epoch: 80, train_loss: 1.3015, test_loss: 1.3147, test_f1: 0.2270
 epoch: 81, train_loss: 1.3017, test_loss: 1.3160, test_f1: 0.2270
 epoch: 82, train_loss: 1.3018, test_loss: 1.3154, test_f1: 0.2270
 epoch: 83, train_loss: 1.3017, test_loss: 1.3145, test_f1: 0.2270
 epoch: 84, train_loss: 1.3023, test_loss: 1.3156, test_f1: 0.2270
 epoch: 85, train_loss: 1.3017, test_loss: 1.3150, test_f1: 0.2270
 epoch: 86, train_loss: 1.3018, test_loss: 1.3148, test_f1: 0.2270
 epoch: 87, train_loss: 1.3015, test_loss: 1.3147, test_f1: 0.2270
 epoch: 88, train_loss: 1.3019, test_loss: 1.3158, test_f1: 0.2270
 epoch: 89, train_loss: 1.3014, test_loss: 1.3140, test_f1: 0.2270
 epoch: 90, train_loss: 1.3019, test_loss: 1.3157, test_f1: 0.2270
 epoch: 91, train_loss: 1.3016, test_loss: 1.3154, test_f1: 0.2270
 epoch: 92, train_loss: 1.3016, test_loss: 1.3151, test_f1: 0.2270
 epoch: 93, train_loss: 1.3026, test_loss: 1.3150, test_f1: 0.2270
 epoch: 94, train_loss: 1.3016, test_loss: 1.3138, test_f1: 0.2270
 epoch: 95, train_loss: 1.3017, test_loss: 1.3160, test_f1: 0.2270
 epoch: 96, train_loss: 1.3015, test_loss: 1.3153, test_f1: 0.2270
 epoch: 97, train_loss: 1.3021, test_loss: 1.3142, test_f1: 0.2270
 epoch: 98, train_loss: 1.3016, test_loss: 1.3163, test_f1: 0.2270
 epoch: 99, train_loss: 1.3016, test_loss: 1.3148, test_f1: 0.2270
##################ITERATION #9 ****************************************
 epoch: 0, train_loss: 1.3146, test_loss: 1.3134, test_f1: 0.2270
 epoch: 1, train_loss: 1.3031, test_loss: 1.3161, test_f1: 0.2270
 epoch: 2, train_loss: 1.3017, test_loss: 1.3148, test_f1: 0.2270
 epoch: 3, train_loss: 1.3023, test_loss: 1.3156, test_f1: 0.2270
 epoch: 4, train_loss: 1.3023, test_loss: 1.3151, test_f1: 0.2270
 epoch: 5, train_loss: 1.3017, test_loss: 1.3160, test_f1: 0.2270
 epoch: 6, train_loss: 1.3021, test_loss: 1.3148, test_f1: 0.2270
 epoch: 7, train_loss: 1.3027, test_loss: 1.3157, test_f1: 0.2270
 epoch: 8, train_loss: 1.3025, test_loss: 1.3147, test_f1: 0.2270
 epoch: 9, train_loss: 1.3020, test_loss: 1.3173, test_f1: 0.2270
 epoch: 10, train_loss: 1.3018, test_loss: 1.3143, test_f1: 0.2270
 epoch: 11, train_loss: 1.3021, test_loss: 1.3145, test_f1: 0.2270
 epoch: 12, train_loss: 1.3018, test_loss: 1.3145, test_f1: 0.2270
 epoch: 13, train_loss: 1.3018, test_loss: 1.3151, test_f1: 0.2270
 epoch: 14, train_loss: 1.3021, test_loss: 1.3159, test_f1: 0.2270
 epoch: 15, train_loss: 1.3027, test_loss: 1.3152, test_f1: 0.2270
 epoch: 16, train_loss: 1.3033, test_loss: 1.3157, test_f1: 0.2270
 epoch: 17, train_loss: 1.3033, test_loss: 1.3153, test_f1: 0.2270
 epoch: 18, train_loss: 1.3031, test_loss: 1.3153, test_f1: 0.2270
 epoch: 19, train_loss: 1.3021, test_loss: 1.3162, test_f1: 0.2270
 epoch: 20, train_loss: 1.3017, test_loss: 1.3140, test_f1: 0.2270
 epoch: 21, train_loss: 1.3031, test_loss: 1.3157, test_f1: 0.2270
 epoch: 22, train_loss: 1.3017, test_loss: 1.3151, test_f1: 0.2270
 epoch: 23, train_loss: 1.3017, test_loss: 1.3149, test_f1: 0.2270
 epoch: 24, train_loss: 1.3023, test_loss: 1.3155, test_f1: 0.2270
 epoch: 25, train_loss: 1.3018, test_loss: 1.3154, test_f1: 0.2270
 epoch: 26, train_loss: 1.3022, test_loss: 1.3149, test_f1: 0.2270
 epoch: 27, train_loss: 1.3023, test_loss: 1.3157, test_f1: 0.2270
 epoch: 28, train_loss: 1.3037, test_loss: 1.3143, test_f1: 0.2270
 epoch: 29, train_loss: 1.3031, test_loss: 1.3151, test_f1: 0.2270
 epoch: 30, train_loss: 1.3016, test_loss: 1.3157, test_f1: 0.2270
 epoch: 31, train_loss: 1.3024, test_loss: 1.3169, test_f1: 0.2270
 epoch: 32, train_loss: 1.3021, test_loss: 1.3149, test_f1: 0.2270
 epoch: 33, train_loss: 1.3019, test_loss: 1.3150, test_f1: 0.2270
 epoch: 34, train_loss: 1.3018, test_loss: 1.3155, test_f1: 0.2270
 epoch: 35, train_loss: 1.3025, test_loss: 1.3146, test_f1: 0.2270
 epoch: 36, train_loss: 1.3022, test_loss: 1.3142, test_f1: 0.2270
 epoch: 37, train_loss: 1.3017, test_loss: 1.3160, test_f1: 0.2270
 epoch: 38, train_loss: 1.3019, test_loss: 1.3148, test_f1: 0.2270
 epoch: 39, train_loss: 1.3019, test_loss: 1.3142, test_f1: 0.2270
 epoch: 40, train_loss: 1.3019, test_loss: 1.3161, test_f1: 0.2270
 epoch: 41, train_loss: 1.3018, test_loss: 1.3161, test_f1: 0.2270
 epoch: 42, train_loss: 1.3020, test_loss: 1.3154, test_f1: 0.2270
 epoch: 43, train_loss: 1.3018, test_loss: 1.3150, test_f1: 0.2270
 epoch: 44, train_loss: 1.3021, test_loss: 1.3153, test_f1: 0.2270
 epoch: 45, train_loss: 1.3020, test_loss: 1.3152, test_f1: 0.2270
 epoch: 46, train_loss: 1.3017, test_loss: 1.3168, test_f1: 0.2270
 epoch: 47, train_loss: 1.3019, test_loss: 1.3137, test_f1: 0.2270
 epoch: 48, train_loss: 1.3020, test_loss: 1.3163, test_f1: 0.2270
 epoch: 49, train_loss: 1.3038, test_loss: 1.3140, test_f1: 0.2270
 epoch: 50, train_loss: 1.3027, test_loss: 1.3159, test_f1: 0.2270
 epoch: 51, train_loss: 1.3014, test_loss: 1.3153, test_f1: 0.2270
 epoch: 52, train_loss: 1.3017, test_loss: 1.3145, test_f1: 0.2270
 epoch: 53, train_loss: 1.3014, test_loss: 1.3156, test_f1: 0.2270
 epoch: 54, train_loss: 1.3024, test_loss: 1.3150, test_f1: 0.2270
 epoch: 55, train_loss: 1.3024, test_loss: 1.3152, test_f1: 0.2270
 epoch: 56, train_loss: 1.3024, test_loss: 1.3160, test_f1: 0.2270
 epoch: 57, train_loss: 1.3017, test_loss: 1.3147, test_f1: 0.2270
 epoch: 58, train_loss: 1.3017, test_loss: 1.3153, test_f1: 0.2270
 epoch: 59, train_loss: 1.3014, test_loss: 1.3149, test_f1: 0.2270
 epoch: 60, train_loss: 1.3024, test_loss: 1.3146, test_f1: 0.2270
 epoch: 61, train_loss: 1.3014, test_loss: 1.3153, test_f1: 0.2270
 epoch: 62, train_loss: 1.3017, test_loss: 1.3156, test_f1: 0.2270
 epoch: 63, train_loss: 1.3016, test_loss: 1.3144, test_f1: 0.2270
 epoch: 64, train_loss: 1.3019, test_loss: 1.3150, test_f1: 0.2270
 epoch: 65, train_loss: 1.3017, test_loss: 1.3149, test_f1: 0.2270
 epoch: 66, train_loss: 1.3017, test_loss: 1.3147, test_f1: 0.2270
 epoch: 67, train_loss: 1.3019, test_loss: 1.3156, test_f1: 0.2270
 epoch: 68, train_loss: 1.3021, test_loss: 1.3141, test_f1: 0.2270
 epoch: 69, train_loss: 1.3019, test_loss: 1.3161, test_f1: 0.2270
 epoch: 70, train_loss: 1.3014, test_loss: 1.3153, test_f1: 0.2270
 epoch: 71, train_loss: 1.3019, test_loss: 1.3144, test_f1: 0.2270
 epoch: 72, train_loss: 1.3015, test_loss: 1.3152, test_f1: 0.2270
 epoch: 73, train_loss: 1.3018, test_loss: 1.3153, test_f1: 0.2270
 epoch: 74, train_loss: 1.3017, test_loss: 1.3155, test_f1: 0.2270
 epoch: 75, train_loss: 1.3015, test_loss: 1.3149, test_f1: 0.2270
 epoch: 76, train_loss: 1.3016, test_loss: 1.3151, test_f1: 0.2270
 epoch: 77, train_loss: 1.3017, test_loss: 1.3157, test_f1: 0.2270
 epoch: 78, train_loss: 1.3018, test_loss: 1.3142, test_f1: 0.2270
 epoch: 79, train_loss: 1.3014, test_loss: 1.3160, test_f1: 0.2270
 epoch: 80, train_loss: 1.3015, test_loss: 1.3149, test_f1: 0.2270
 epoch: 81, train_loss: 1.3015, test_loss: 1.3154, test_f1: 0.2270
 epoch: 82, train_loss: 1.3023, test_loss: 1.3160, test_f1: 0.2270
 epoch: 83, train_loss: 1.3016, test_loss: 1.3143, test_f1: 0.2270
 epoch: 84, train_loss: 1.3016, test_loss: 1.3153, test_f1: 0.2270
 epoch: 85, train_loss: 1.3014, test_loss: 1.3150, test_f1: 0.2270
 epoch: 86, train_loss: 1.3015, test_loss: 1.3152, test_f1: 0.2270
 epoch: 87, train_loss: 1.3020, test_loss: 1.3158, test_f1: 0.2270
 epoch: 88, train_loss: 1.3019, test_loss: 1.3148, test_f1: 0.2270
 epoch: 89, train_loss: 1.3019, test_loss: 1.3158, test_f1: 0.2270
 epoch: 90, train_loss: 1.3016, test_loss: 1.3144, test_f1: 0.2270
 epoch: 91, train_loss: 1.3017, test_loss: 1.3147, test_f1: 0.2270
 epoch: 92, train_loss: 1.3016, test_loss: 1.3164, test_f1: 0.2270
 epoch: 93, train_loss: 1.3013, test_loss: 1.3146, test_f1: 0.2270
 epoch: 94, train_loss: 1.3015, test_loss: 1.3142, test_f1: 0.2270
 epoch: 95, train_loss: 1.3019, test_loss: 1.3157, test_f1: 0.2270
 epoch: 96, train_loss: 1.3018, test_loss: 1.3147, test_f1: 0.2270
 epoch: 97, train_loss: 1.3012, test_loss: 1.3151, test_f1: 0.2270
 epoch: 98, train_loss: 1.3017, test_loss: 1.3147, test_f1: 0.2270
 epoch: 99, train_loss: 1.3016, test_loss: 1.3151, test_f1: 0.2270

Training completed in 407.18 seconds
Best F1: 0.5738 at epoch 99
Mean F1 across iterations: 0.3309  0.1235
========================FINAL RESULTS================================
FEGIN weighted F1: 0.5738  0.1235
python main.py --data ltspice_examples --representation component_net --model FEGIN --layers 4 --hiddens 16 --batch_size 256 --lr 0.1 --emb_size 512 --epochs 100 --save_appendix component_net_L4_H16_BS256_LR0.1_E512 --no_val
-----



STDERR:
  File "main.py", line 370, in <module>
    main()
  File "main.py", line 254, in main
    dataset = dataset_class(
  File "/home/philip/projects/ltspice_examples_code_repo/Circuit-Completion-Using-GNNs/component_classification_with_link_prediction_head/evaluation/FEGIN/kernel/circuit_datasets.py", line 15, in __init__
    self.data, self.slices = torch.load(self.processed_paths[0])
  File "/home/philip/.local/lib/python3.8/site-packages/torch/serialization.py", line 1040, in load
    warnings.warn(
  File "/usr/lib/python3.8/warnings.py", line 109, in _showwarnmsg
    sw(msg.message, msg.category, msg.filename, msg.lineno,
  File "main.py", line 47, in warn_with_traceback
    traceback.print_stack(file=log)
/home/philip/projects/ltspice_examples_code_repo/Circuit-Completion-Using-GNNs/component_classification_with_link_prediction_head/evaluation/FEGIN/kernel/circuit_datasets.py:15: FutureWarning: You are using `torch.load` with `weights_only=False` (the current default value), which uses the default pickle module implicitly. It is possible to construct malicious pickle data which will execute arbitrary code during unpickling (See https://github.com/pytorch/pytorch/blob/main/SECURITY.md#untrusted-models for more details). In a future release, the default value for `weights_only` will be flipped to `True`. This limits the functions that could be executed during unpickling. Arbitrary objects will no longer be allowed to be loaded via this mode unless they are explicitly allowlisted by the user via `torch.serialization.add_safe_globals`. We recommend you start setting `weights_only=True` for any use case where you don't have full control of the loaded file. Please open an issue on GitHub for any issues related to this experimental feature.
  self.data, self.slices = torch.load(self.processed_paths[0])
