STDOUT:
Results will be saved in /home/philip/projects/ltspice_examples_code_repo/Circuit-Completion-Using-GNNs/component_classification_with_link_prediction_head/evaluation/FEGIN/results/model_FEGIN_dataset_ltspice_examples
Command line input: python main.py --data ltspice_examples --representation component_component --model FEGIN --layers 5 --hiddens 32 --batch_size 64 --lr 0.01 --emb_size 250 --epochs 100 --save_appendix component_component_L5_H32_BS64_LR0.01_E250 --no_val
 is saved.
-----
ltspice_examples - FEGIN
Using 5 layers, 32 hidden units, h = 2
Loading component_component representation dataset
ENTERED
Training FEGIN on component_component representation
Train: 3556, Test: 845
##################ITERATION #0 ****************************************
 epoch: 0, train_loss: 1.2580, test_loss: 1.2194, test_f1: 0.3426
 epoch: 1, train_loss: 1.1881, test_loss: 1.1970, test_f1: 0.3550
 epoch: 2, train_loss: 1.1411, test_loss: 1.2420, test_f1: 0.3433
 epoch: 3, train_loss: 1.1306, test_loss: 1.0990, test_f1: 0.4178
 epoch: 4, train_loss: 1.0885, test_loss: 1.0119, test_f1: 0.4296
 epoch: 5, train_loss: 1.0562, test_loss: 0.9589, test_f1: 0.5111
 epoch: 6, train_loss: 1.0161, test_loss: 1.0075, test_f1: 0.4542
 epoch: 7, train_loss: 1.0119, test_loss: 1.0465, test_f1: 0.4527
 epoch: 8, train_loss: 0.9850, test_loss: 1.0553, test_f1: 0.4482
 epoch: 9, train_loss: 0.9662, test_loss: 1.0434, test_f1: 0.4606
 epoch: 10, train_loss: 0.9639, test_loss: 1.1672, test_f1: 0.4853
 epoch: 11, train_loss: 0.9684, test_loss: 0.9682, test_f1: 0.5036
 epoch: 12, train_loss: 0.9536, test_loss: 1.0263, test_f1: 0.5289
 epoch: 13, train_loss: 0.9327, test_loss: 1.0968, test_f1: 0.4761
 epoch: 14, train_loss: 0.9305, test_loss: 1.0128, test_f1: 0.5236
 epoch: 15, train_loss: 0.9197, test_loss: 0.9479, test_f1: 0.5129
 epoch: 16, train_loss: 0.9010, test_loss: 1.0461, test_f1: 0.5104
 epoch: 17, train_loss: 0.9198, test_loss: 0.9725, test_f1: 0.4993
 epoch: 18, train_loss: 0.9143, test_loss: 1.0271, test_f1: 0.4958
 epoch: 19, train_loss: 0.8989, test_loss: 1.0089, test_f1: 0.5123
 epoch: 20, train_loss: 0.8985, test_loss: 1.0657, test_f1: 0.4906
 epoch: 21, train_loss: 0.8926, test_loss: 1.0085, test_f1: 0.4987
 epoch: 22, train_loss: 0.8722, test_loss: 1.0428, test_f1: 0.4849
 epoch: 23, train_loss: 0.8694, test_loss: 1.0284, test_f1: 0.5206
 epoch: 24, train_loss: 0.8881, test_loss: 1.0108, test_f1: 0.4997
 epoch: 25, train_loss: 0.8699, test_loss: 1.0261, test_f1: 0.5022
 epoch: 26, train_loss: 0.8731, test_loss: 0.9561, test_f1: 0.5037
 epoch: 27, train_loss: 0.8776, test_loss: 1.0104, test_f1: 0.5123
 epoch: 28, train_loss: 0.8517, test_loss: 1.0145, test_f1: 0.5048
 epoch: 29, train_loss: 0.8511, test_loss: 1.1694, test_f1: 0.4791
 epoch: 30, train_loss: 0.8626, test_loss: 0.9709, test_f1: 0.5282
 epoch: 31, train_loss: 0.8528, test_loss: 0.9667, test_f1: 0.5050
 epoch: 32, train_loss: 0.8435, test_loss: 0.9763, test_f1: 0.5149
 epoch: 33, train_loss: 0.8406, test_loss: 1.0066, test_f1: 0.5162
 epoch: 34, train_loss: 0.8335, test_loss: 1.2561, test_f1: 0.4804
 epoch: 35, train_loss: 0.8482, test_loss: 1.0506, test_f1: 0.5192
 epoch: 36, train_loss: 0.8313, test_loss: 1.0875, test_f1: 0.5028
 epoch: 37, train_loss: 0.8312, test_loss: 1.1244, test_f1: 0.4959
 epoch: 38, train_loss: 0.8108, test_loss: 1.5871, test_f1: 0.5282
 epoch: 39, train_loss: 0.8194, test_loss: 1.0967, test_f1: 0.5239
 epoch: 40, train_loss: 0.8141, test_loss: 1.2542, test_f1: 0.4804
 epoch: 41, train_loss: 0.8673, test_loss: 1.1348, test_f1: 0.5243
 epoch: 42, train_loss: 0.8274, test_loss: 0.9782, test_f1: 0.5733
 epoch: 43, train_loss: 0.8060, test_loss: 1.1142, test_f1: 0.5194
 epoch: 44, train_loss: 0.8327, test_loss: 1.2735, test_f1: 0.4843
 epoch: 45, train_loss: 0.8163, test_loss: 1.1761, test_f1: 0.5551
 epoch: 46, train_loss: 0.8102, test_loss: 1.2466, test_f1: 0.5024
 epoch: 47, train_loss: 0.8044, test_loss: 1.0721, test_f1: 0.5326
 epoch: 48, train_loss: 0.8083, test_loss: 1.0339, test_f1: 0.5430
 epoch: 49, train_loss: 0.8039, test_loss: 1.0190, test_f1: 0.5309
 epoch: 50, train_loss: 0.7981, test_loss: 1.2318, test_f1: 0.5183
 epoch: 51, train_loss: 0.7734, test_loss: 1.1215, test_f1: 0.5689
 epoch: 52, train_loss: 0.7607, test_loss: 1.1624, test_f1: 0.5521
 epoch: 53, train_loss: 0.7575, test_loss: 1.0799, test_f1: 0.5417
 epoch: 54, train_loss: 0.7571, test_loss: 1.1400, test_f1: 0.5563
 epoch: 55, train_loss: 0.7581, test_loss: 1.0899, test_f1: 0.5280
 epoch: 56, train_loss: 0.7546, test_loss: 1.1170, test_f1: 0.5466
 epoch: 57, train_loss: 0.7601, test_loss: 1.1368, test_f1: 0.5799
 epoch: 58, train_loss: 0.7351, test_loss: 1.1281, test_f1: 0.5788
 epoch: 59, train_loss: 0.7312, test_loss: 1.1134, test_f1: 0.5928
 epoch: 60, train_loss: 0.7421, test_loss: 1.0223, test_f1: 0.5743
 epoch: 61, train_loss: 0.7263, test_loss: 1.0998, test_f1: 0.5725
 epoch: 62, train_loss: 0.7204, test_loss: 1.0838, test_f1: 0.5338
 epoch: 63, train_loss: 0.7307, test_loss: 1.0208, test_f1: 0.5629
 epoch: 64, train_loss: 0.7352, test_loss: 1.0443, test_f1: 0.5964
 epoch: 65, train_loss: 0.7303, test_loss: 1.0321, test_f1: 0.5627
 epoch: 66, train_loss: 0.7219, test_loss: 1.0907, test_f1: 0.5580
 epoch: 67, train_loss: 0.7273, test_loss: 1.2895, test_f1: 0.5979
 epoch: 68, train_loss: 0.7270, test_loss: 1.1115, test_f1: 0.5718
 epoch: 69, train_loss: 0.7125, test_loss: 1.1622, test_f1: 0.5813
 epoch: 70, train_loss: 0.7172, test_loss: 1.1182, test_f1: 0.5960
 epoch: 71, train_loss: 0.7124, test_loss: 1.1126, test_f1: 0.5865
 epoch: 72, train_loss: 0.7165, test_loss: 1.0826, test_f1: 0.5822
 epoch: 73, train_loss: 0.7295, test_loss: 1.1111, test_f1: 0.5792
 epoch: 74, train_loss: 0.7121, test_loss: 1.1953, test_f1: 0.5522
 epoch: 75, train_loss: 0.7128, test_loss: 1.1380, test_f1: 0.5736
 epoch: 76, train_loss: 0.7090, test_loss: 1.1785, test_f1: 0.5745
 epoch: 77, train_loss: 0.7090, test_loss: 1.0451, test_f1: 0.5671
 epoch: 78, train_loss: 0.7131, test_loss: 1.0877, test_f1: 0.5595
 epoch: 79, train_loss: 0.7022, test_loss: 1.0723, test_f1: 0.5511
 epoch: 80, train_loss: 0.7063, test_loss: 1.1187, test_f1: 0.5715
 epoch: 81, train_loss: 0.7080, test_loss: 1.0763, test_f1: 0.5557
 epoch: 82, train_loss: 0.7104, test_loss: 1.1061, test_f1: 0.5709
 epoch: 83, train_loss: 0.6912, test_loss: 1.2080, test_f1: 0.5628
 epoch: 84, train_loss: 0.7071, test_loss: 1.1143, test_f1: 0.5881
 epoch: 85, train_loss: 0.6847, test_loss: 1.1912, test_f1: 0.5796
 epoch: 86, train_loss: 0.6891, test_loss: 1.0904, test_f1: 0.6208
 epoch: 87, train_loss: 0.6991, test_loss: 1.1097, test_f1: 0.5784
 epoch: 88, train_loss: 0.6836, test_loss: 1.0816, test_f1: 0.5689
 epoch: 89, train_loss: 0.7001, test_loss: 1.0932, test_f1: 0.5659
 epoch: 90, train_loss: 0.6734, test_loss: 1.0640, test_f1: 0.5833
 epoch: 91, train_loss: 0.6868, test_loss: 1.0663, test_f1: 0.5651
 epoch: 92, train_loss: 0.6908, test_loss: 1.1556, test_f1: 0.5964
 epoch: 93, train_loss: 0.6832, test_loss: 1.0926, test_f1: 0.5846
 epoch: 94, train_loss: 0.6832, test_loss: 1.0809, test_f1: 0.5996
 epoch: 95, train_loss: 0.6805, test_loss: 1.1083, test_f1: 0.5876
 epoch: 96, train_loss: 0.6760, test_loss: 1.0563, test_f1: 0.6142
 epoch: 97, train_loss: 0.6741, test_loss: 1.0570, test_f1: 0.6051
 epoch: 98, train_loss: 0.6622, test_loss: 1.0395, test_f1: 0.6019
 epoch: 99, train_loss: 0.6841, test_loss: 1.0628, test_f1: 0.5921
##################ITERATION #1 ****************************************
 epoch: 0, train_loss: 1.2658, test_loss: 1.1594, test_f1: 0.3196
 epoch: 1, train_loss: 1.2007, test_loss: 1.1216, test_f1: 0.3372
 epoch: 2, train_loss: 1.1480, test_loss: 1.0197, test_f1: 0.4882
 epoch: 3, train_loss: 1.1016, test_loss: 1.0016, test_f1: 0.4605
 epoch: 4, train_loss: 1.0640, test_loss: 1.1316, test_f1: 0.3807
 epoch: 5, train_loss: 1.0514, test_loss: 1.0582, test_f1: 0.4481
 epoch: 6, train_loss: 1.0146, test_loss: 0.9165, test_f1: 0.4816
 epoch: 7, train_loss: 0.9957, test_loss: 0.9556, test_f1: 0.4869
 epoch: 8, train_loss: 1.0007, test_loss: 1.0986, test_f1: 0.4560
 epoch: 9, train_loss: 1.0058, test_loss: 0.9891, test_f1: 0.4764
 epoch: 10, train_loss: 1.0098, test_loss: 1.0484, test_f1: 0.4587
 epoch: 11, train_loss: 0.9700, test_loss: 0.9842, test_f1: 0.5117
 epoch: 12, train_loss: 0.9589, test_loss: 0.9891, test_f1: 0.4835
 epoch: 13, train_loss: 0.9534, test_loss: 1.0390, test_f1: 0.5052
 epoch: 14, train_loss: 0.9458, test_loss: 0.9946, test_f1: 0.5011
 epoch: 15, train_loss: 0.9363, test_loss: 1.0226, test_f1: 0.4990
 epoch: 16, train_loss: 0.9201, test_loss: 0.9982, test_f1: 0.5005
 epoch: 17, train_loss: 0.9118, test_loss: 1.0035, test_f1: 0.5040
 epoch: 18, train_loss: 0.9234, test_loss: 0.9941, test_f1: 0.5026
 epoch: 19, train_loss: 0.8983, test_loss: 1.0031, test_f1: 0.5113
 epoch: 20, train_loss: 0.8934, test_loss: 1.0332, test_f1: 0.5102
 epoch: 21, train_loss: 0.9096, test_loss: 0.9641, test_f1: 0.4950
 epoch: 22, train_loss: 0.8959, test_loss: 1.0647, test_f1: 0.4853
 epoch: 23, train_loss: 0.8894, test_loss: 1.0286, test_f1: 0.5377
 epoch: 24, train_loss: 0.8923, test_loss: 0.9280, test_f1: 0.5012
 epoch: 25, train_loss: 0.8930, test_loss: 1.0406, test_f1: 0.5103
 epoch: 26, train_loss: 0.8755, test_loss: 0.9990, test_f1: 0.5444
 epoch: 27, train_loss: 0.8688, test_loss: 1.0413, test_f1: 0.5180
 epoch: 28, train_loss: 0.8768, test_loss: 0.9978, test_f1: 0.5364
 epoch: 29, train_loss: 0.8684, test_loss: 1.0143, test_f1: 0.5286
 epoch: 30, train_loss: 0.8724, test_loss: 0.9761, test_f1: 0.5441
 epoch: 31, train_loss: 0.8585, test_loss: 0.9868, test_f1: 0.5530
 epoch: 32, train_loss: 0.8585, test_loss: 1.0848, test_f1: 0.4858
 epoch: 33, train_loss: 0.8502, test_loss: 1.0531, test_f1: 0.5266
 epoch: 34, train_loss: 0.8381, test_loss: 0.9902, test_f1: 0.5365
 epoch: 35, train_loss: 0.8368, test_loss: 1.3884, test_f1: 0.4961
 epoch: 36, train_loss: 0.8683, test_loss: 1.1066, test_f1: 0.5261
 epoch: 37, train_loss: 0.8545, test_loss: 1.0076, test_f1: 0.4864
 epoch: 38, train_loss: 0.8502, test_loss: 0.9647, test_f1: 0.5641
 epoch: 39, train_loss: 0.8325, test_loss: 0.9605, test_f1: 0.5367
 epoch: 40, train_loss: 0.8327, test_loss: 1.0225, test_f1: 0.5221
 epoch: 41, train_loss: 0.8334, test_loss: 0.9603, test_f1: 0.5505
 epoch: 42, train_loss: 0.8206, test_loss: 1.1942, test_f1: 0.5224
 epoch: 43, train_loss: 0.8243, test_loss: 0.9839, test_f1: 0.5475
 epoch: 44, train_loss: 0.8330, test_loss: 1.0812, test_f1: 0.5129
 epoch: 45, train_loss: 0.8435, test_loss: 1.0092, test_f1: 0.5373
 epoch: 46, train_loss: 0.8256, test_loss: 1.0267, test_f1: 0.5528
 epoch: 47, train_loss: 0.8321, test_loss: 0.9567, test_f1: 0.5470
 epoch: 48, train_loss: 0.8292, test_loss: 1.0244, test_f1: 0.5071
 epoch: 49, train_loss: 0.8304, test_loss: 1.2240, test_f1: 0.4889
 epoch: 50, train_loss: 0.8133, test_loss: 0.9706, test_f1: 0.6052
 epoch: 51, train_loss: 0.7937, test_loss: 0.9926, test_f1: 0.5673
 epoch: 52, train_loss: 0.7683, test_loss: 1.0541, test_f1: 0.5437
 epoch: 53, train_loss: 0.7619, test_loss: 0.9863, test_f1: 0.5775
 epoch: 54, train_loss: 0.7607, test_loss: 1.0112, test_f1: 0.5355
 epoch: 55, train_loss: 0.7414, test_loss: 1.0364, test_f1: 0.5557
 epoch: 56, train_loss: 0.7410, test_loss: 1.0464, test_f1: 0.5840
 epoch: 57, train_loss: 0.7580, test_loss: 1.0303, test_f1: 0.5814
 epoch: 58, train_loss: 0.7395, test_loss: 1.0539, test_f1: 0.5570
 epoch: 59, train_loss: 0.7402, test_loss: 1.1205, test_f1: 0.5457
 epoch: 60, train_loss: 0.8147, test_loss: 1.0788, test_f1: 0.4783
 epoch: 61, train_loss: 0.9288, test_loss: 1.0079, test_f1: 0.5472
 epoch: 62, train_loss: 0.8689, test_loss: 1.0686, test_f1: 0.5102
 epoch: 63, train_loss: 0.8440, test_loss: 0.9606, test_f1: 0.5446
 epoch: 64, train_loss: 0.8096, test_loss: 0.9611, test_f1: 0.5627
 epoch: 65, train_loss: 0.8005, test_loss: 1.0587, test_f1: 0.5475
 epoch: 66, train_loss: 0.7846, test_loss: 0.9805, test_f1: 0.5322
 epoch: 67, train_loss: 0.7818, test_loss: 1.0098, test_f1: 0.5180
 epoch: 68, train_loss: 0.7682, test_loss: 0.9724, test_f1: 0.5290
 epoch: 69, train_loss: 0.7685, test_loss: 1.0071, test_f1: 0.5320
 epoch: 70, train_loss: 0.7643, test_loss: 0.9860, test_f1: 0.5177
 epoch: 71, train_loss: 0.7665, test_loss: 1.0106, test_f1: 0.5342
 epoch: 72, train_loss: 0.7615, test_loss: 0.9943, test_f1: 0.5365
 epoch: 73, train_loss: 0.7512, test_loss: 1.0087, test_f1: 0.5571
 epoch: 74, train_loss: 0.7539, test_loss: 1.1244, test_f1: 0.5275
 epoch: 75, train_loss: 0.7459, test_loss: 1.0120, test_f1: 0.5479
 epoch: 76, train_loss: 0.7415, test_loss: 0.9872, test_f1: 0.5598
 epoch: 77, train_loss: 0.7220, test_loss: 1.0346, test_f1: 0.5579
 epoch: 78, train_loss: 0.7475, test_loss: 0.9859, test_f1: 0.5740
 epoch: 79, train_loss: 0.7402, test_loss: 1.0615, test_f1: 0.5470
 epoch: 80, train_loss: 0.7212, test_loss: 1.0072, test_f1: 0.5701
 epoch: 81, train_loss: 0.7152, test_loss: 1.0414, test_f1: 0.5615
 epoch: 82, train_loss: 0.7060, test_loss: 0.9644, test_f1: 0.5850
 epoch: 83, train_loss: 0.7131, test_loss: 1.0526, test_f1: 0.5868
 epoch: 84, train_loss: 0.7052, test_loss: 1.0655, test_f1: 0.5854
 epoch: 85, train_loss: 0.7107, test_loss: 0.9782, test_f1: 0.5849
 epoch: 86, train_loss: 0.7135, test_loss: 1.0637, test_f1: 0.6005
 epoch: 87, train_loss: 0.6980, test_loss: 1.0054, test_f1: 0.6065
 epoch: 88, train_loss: 0.7066, test_loss: 1.0269, test_f1: 0.5753
 epoch: 89, train_loss: 0.7168, test_loss: 1.1142, test_f1: 0.5409
 epoch: 90, train_loss: 0.7180, test_loss: 1.0827, test_f1: 0.5421
 epoch: 91, train_loss: 0.7049, test_loss: 1.0006, test_f1: 0.5591
 epoch: 92, train_loss: 0.7022, test_loss: 1.0602, test_f1: 0.5784
 epoch: 93, train_loss: 0.7008, test_loss: 1.0099, test_f1: 0.5704
 epoch: 94, train_loss: 0.6928, test_loss: 1.1142, test_f1: 0.5418
 epoch: 95, train_loss: 0.6822, test_loss: 1.0412, test_f1: 0.5571
 epoch: 96, train_loss: 0.7075, test_loss: 1.0186, test_f1: 0.5668
 epoch: 97, train_loss: 0.7097, test_loss: 1.0611, test_f1: 0.5642
 epoch: 98, train_loss: 0.6888, test_loss: 1.1911, test_f1: 0.5387
 epoch: 99, train_loss: 0.6774, test_loss: 1.1027, test_f1: 0.5887
##################ITERATION #2 ****************************************
 epoch: 0, train_loss: 1.2966, test_loss: 1.2097, test_f1: 0.3414
 epoch: 1, train_loss: 1.2248, test_loss: 1.1641, test_f1: 0.3933
 epoch: 2, train_loss: 1.1887, test_loss: 1.1616, test_f1: 0.3681
 epoch: 3, train_loss: 1.1396, test_loss: 1.0709, test_f1: 0.4288
 epoch: 4, train_loss: 1.0897, test_loss: 1.0204, test_f1: 0.4601
 epoch: 5, train_loss: 1.0629, test_loss: 1.0558, test_f1: 0.4267
 epoch: 6, train_loss: 1.0582, test_loss: 1.0022, test_f1: 0.4487
 epoch: 7, train_loss: 1.0397, test_loss: 0.9658, test_f1: 0.4420
 epoch: 8, train_loss: 1.0119, test_loss: 0.9128, test_f1: 0.4730
 epoch: 9, train_loss: 1.0063, test_loss: 1.0039, test_f1: 0.4654
 epoch: 10, train_loss: 0.9792, test_loss: 0.9075, test_f1: 0.4770
 epoch: 11, train_loss: 0.9652, test_loss: 1.0459, test_f1: 0.4844
 epoch: 12, train_loss: 0.9595, test_loss: 1.0312, test_f1: 0.4869
 epoch: 13, train_loss: 0.9535, test_loss: 1.0243, test_f1: 0.4473
 epoch: 14, train_loss: 0.9506, test_loss: 1.1044, test_f1: 0.4440
 epoch: 15, train_loss: 0.9501, test_loss: 1.0574, test_f1: 0.4945
 epoch: 16, train_loss: 0.9414, test_loss: 0.9835, test_f1: 0.5005
 epoch: 17, train_loss: 0.9336, test_loss: 0.9888, test_f1: 0.5091
 epoch: 18, train_loss: 0.9220, test_loss: 0.9910, test_f1: 0.4900
 epoch: 19, train_loss: 0.9174, test_loss: 0.9975, test_f1: 0.5104
 epoch: 20, train_loss: 0.9283, test_loss: 0.9738, test_f1: 0.5066
 epoch: 21, train_loss: 0.9059, test_loss: 1.0011, test_f1: 0.5015
 epoch: 22, train_loss: 0.9053, test_loss: 1.0559, test_f1: 0.5266
 epoch: 23, train_loss: 0.9054, test_loss: 0.9845, test_f1: 0.5204
 epoch: 24, train_loss: 0.8968, test_loss: 0.9626, test_f1: 0.5467
 epoch: 25, train_loss: 0.9019, test_loss: 1.0679, test_f1: 0.4870
 epoch: 26, train_loss: 0.8773, test_loss: 1.0214, test_f1: 0.5350
 epoch: 27, train_loss: 0.8876, test_loss: 1.0641, test_f1: 0.4598
 epoch: 28, train_loss: 0.8974, test_loss: 1.0768, test_f1: 0.5060
 epoch: 29, train_loss: 0.8698, test_loss: 1.0020, test_f1: 0.4810
 epoch: 30, train_loss: 0.8749, test_loss: 1.0053, test_f1: 0.4954
 epoch: 31, train_loss: 0.8778, test_loss: 1.1198, test_f1: 0.4796
 epoch: 32, train_loss: 0.8775, test_loss: 1.0389, test_f1: 0.5260
 epoch: 33, train_loss: 0.8681, test_loss: 1.0561, test_f1: 0.5170
 epoch: 34, train_loss: 0.8524, test_loss: 1.0697, test_f1: 0.4939
 epoch: 35, train_loss: 0.8527, test_loss: 1.0295, test_f1: 0.5164
 epoch: 36, train_loss: 0.8657, test_loss: 1.1578, test_f1: 0.5065
 epoch: 37, train_loss: 0.8453, test_loss: 1.1557, test_f1: 0.4900
 epoch: 38, train_loss: 0.8489, test_loss: 1.2201, test_f1: 0.4822
 epoch: 39, train_loss: 0.8532, test_loss: 0.9444, test_f1: 0.5078
 epoch: 40, train_loss: 0.8472, test_loss: 0.9479, test_f1: 0.5010
 epoch: 41, train_loss: 0.8348, test_loss: 1.0007, test_f1: 0.5346
 epoch: 42, train_loss: 0.8362, test_loss: 1.2001, test_f1: 0.4929
 epoch: 43, train_loss: 0.8539, test_loss: 1.0620, test_f1: 0.5134
 epoch: 44, train_loss: 0.8247, test_loss: 1.1110, test_f1: 0.5351
 epoch: 45, train_loss: 0.8247, test_loss: 1.0324, test_f1: 0.5372
 epoch: 46, train_loss: 0.8146, test_loss: 1.0100, test_f1: 0.5468
 epoch: 47, train_loss: 0.8127, test_loss: 1.0203, test_f1: 0.5229
 epoch: 48, train_loss: 0.8104, test_loss: 1.0487, test_f1: 0.4973
 epoch: 49, train_loss: 0.8318, test_loss: 1.0362, test_f1: 0.5612
 epoch: 50, train_loss: 0.8157, test_loss: 1.0575, test_f1: 0.5374
 epoch: 51, train_loss: 0.8158, test_loss: 1.0313, test_f1: 0.5450
 epoch: 52, train_loss: 0.7889, test_loss: 1.1015, test_f1: 0.5190
 epoch: 53, train_loss: 0.7681, test_loss: 1.1741, test_f1: 0.5116
 epoch: 54, train_loss: 0.7462, test_loss: 1.1465, test_f1: 0.5360
 epoch: 55, train_loss: 0.7488, test_loss: 1.0403, test_f1: 0.5853
 epoch: 56, train_loss: 0.7613, test_loss: 1.0048, test_f1: 0.5580
 epoch: 57, train_loss: 0.7491, test_loss: 1.0225, test_f1: 0.5607
 epoch: 58, train_loss: 0.7382, test_loss: 1.1097, test_f1: 0.5530
 epoch: 59, train_loss: 0.7497, test_loss: 1.0546, test_f1: 0.5768
 epoch: 60, train_loss: 0.7496, test_loss: 1.0412, test_f1: 0.5676
 epoch: 61, train_loss: 0.7533, test_loss: 1.0489, test_f1: 0.5737
 epoch: 62, train_loss: 0.7515, test_loss: 1.1316, test_f1: 0.5353
 epoch: 63, train_loss: 0.7352, test_loss: 1.1192, test_f1: 0.5568
 epoch: 64, train_loss: 0.7537, test_loss: 1.1351, test_f1: 0.5146
 epoch: 65, train_loss: 0.7422, test_loss: 1.0443, test_f1: 0.5576
 epoch: 66, train_loss: 0.7353, test_loss: 1.0892, test_f1: 0.5791
 epoch: 67, train_loss: 0.7463, test_loss: 1.1710, test_f1: 0.5159
 epoch: 68, train_loss: 0.7437, test_loss: 1.1276, test_f1: 0.5533
 epoch: 69, train_loss: 0.7303, test_loss: 1.1926, test_f1: 0.5465
 epoch: 70, train_loss: 0.7450, test_loss: 1.1106, test_f1: 0.5781
 epoch: 71, train_loss: 0.7087, test_loss: 1.2581, test_f1: 0.5225
 epoch: 72, train_loss: 0.7242, test_loss: 1.1259, test_f1: 0.5458
 epoch: 73, train_loss: 0.7216, test_loss: 1.1772, test_f1: 0.5584
 epoch: 74, train_loss: 0.7122, test_loss: 1.2297, test_f1: 0.5321
 epoch: 75, train_loss: 0.7082, test_loss: 1.2737, test_f1: 0.5385
 epoch: 76, train_loss: 0.7226, test_loss: 1.0867, test_f1: 0.5726
 epoch: 77, train_loss: 0.7172, test_loss: 1.1354, test_f1: 0.5622
 epoch: 78, train_loss: 0.7206, test_loss: 1.1505, test_f1: 0.5583
 epoch: 79, train_loss: 0.7162, test_loss: 1.1767, test_f1: 0.5205
 epoch: 80, train_loss: 0.7130, test_loss: 1.1645, test_f1: 0.5527
 epoch: 81, train_loss: 0.6964, test_loss: 1.1270, test_f1: 0.5709
 epoch: 82, train_loss: 0.7026, test_loss: 1.1329, test_f1: 0.5650
 epoch: 83, train_loss: 0.7021, test_loss: 1.2078, test_f1: 0.5360
 epoch: 84, train_loss: 0.7179, test_loss: 1.1529, test_f1: 0.5492
 epoch: 85, train_loss: 0.7128, test_loss: 1.2685, test_f1: 0.5484
 epoch: 86, train_loss: 0.6849, test_loss: 1.1767, test_f1: 0.5781
 epoch: 87, train_loss: 0.6781, test_loss: 1.2735, test_f1: 0.5589
 epoch: 88, train_loss: 0.6894, test_loss: 1.3203, test_f1: 0.5336
 epoch: 89, train_loss: 0.6859, test_loss: 1.1471, test_f1: 0.5582
 epoch: 90, train_loss: 0.6898, test_loss: 1.2170, test_f1: 0.5592
 epoch: 91, train_loss: 0.6830, test_loss: 1.2073, test_f1: 0.5324
 epoch: 92, train_loss: 0.6910, test_loss: 1.1947, test_f1: 0.5850
 epoch: 93, train_loss: 0.6833, test_loss: 1.3910, test_f1: 0.5290
 epoch: 94, train_loss: 0.6823, test_loss: 1.3328, test_f1: 0.5384
 epoch: 95, train_loss: 0.6766, test_loss: 1.1748, test_f1: 0.5690
 epoch: 96, train_loss: 0.6836, test_loss: 1.2237, test_f1: 0.5884
 epoch: 97, train_loss: 0.6773, test_loss: 1.2705, test_f1: 0.5457
 epoch: 98, train_loss: 0.6813, test_loss: 1.2326, test_f1: 0.5660
 epoch: 99, train_loss: 0.6572, test_loss: 1.3344, test_f1: 0.5607
##################ITERATION #3 ****************************************
 epoch: 0, train_loss: 1.2611, test_loss: 1.2134, test_f1: 0.2951
 epoch: 1, train_loss: 1.1593, test_loss: 1.0602, test_f1: 0.4414
 epoch: 2, train_loss: 1.1121, test_loss: 1.0013, test_f1: 0.4866
 epoch: 3, train_loss: 1.0806, test_loss: 1.0393, test_f1: 0.4465
 epoch: 4, train_loss: 1.0510, test_loss: 0.9835, test_f1: 0.4893
 epoch: 5, train_loss: 1.0350, test_loss: 1.0162, test_f1: 0.4740
 epoch: 6, train_loss: 1.0257, test_loss: 0.9381, test_f1: 0.4671
 epoch: 7, train_loss: 1.0044, test_loss: 1.0414, test_f1: 0.4796
 epoch: 8, train_loss: 0.9985, test_loss: 0.9895, test_f1: 0.4666
 epoch: 9, train_loss: 0.9730, test_loss: 1.0409, test_f1: 0.4858
 epoch: 10, train_loss: 0.9719, test_loss: 0.9563, test_f1: 0.4905
 epoch: 11, train_loss: 0.9625, test_loss: 0.9887, test_f1: 0.5062
 epoch: 12, train_loss: 0.9676, test_loss: 1.0043, test_f1: 0.4907
 epoch: 13, train_loss: 0.9363, test_loss: 1.0242, test_f1: 0.4798
 epoch: 14, train_loss: 0.9240, test_loss: 1.1123, test_f1: 0.4583
 epoch: 15, train_loss: 0.9286, test_loss: 0.9985, test_f1: 0.5237
 epoch: 16, train_loss: 0.9178, test_loss: 0.9955, test_f1: 0.5081
 epoch: 17, train_loss: 0.9273, test_loss: 0.9125, test_f1: 0.5296
 epoch: 18, train_loss: 0.9143, test_loss: 1.0582, test_f1: 0.5044
 epoch: 19, train_loss: 0.8869, test_loss: 1.1391, test_f1: 0.5128
 epoch: 20, train_loss: 0.9052, test_loss: 1.0233, test_f1: 0.5168
 epoch: 21, train_loss: 0.8813, test_loss: 1.0355, test_f1: 0.5062
 epoch: 22, train_loss: 0.8774, test_loss: 0.9712, test_f1: 0.5185
 epoch: 23, train_loss: 0.8857, test_loss: 1.0093, test_f1: 0.5281
 epoch: 24, train_loss: 0.8757, test_loss: 1.2915, test_f1: 0.4808
 epoch: 25, train_loss: 0.8562, test_loss: 1.0563, test_f1: 0.5195
 epoch: 26, train_loss: 0.8610, test_loss: 1.1012, test_f1: 0.5183
 epoch: 27, train_loss: 0.8800, test_loss: 1.1044, test_f1: 0.5175
 epoch: 28, train_loss: 0.8606, test_loss: 0.9974, test_f1: 0.5332
 epoch: 29, train_loss: 0.8533, test_loss: 1.0798, test_f1: 0.4816
 epoch: 30, train_loss: 0.8573, test_loss: 1.0905, test_f1: 0.5304
 epoch: 31, train_loss: 0.8459, test_loss: 1.0512, test_f1: 0.5010
 epoch: 32, train_loss: 0.8423, test_loss: 1.0580, test_f1: 0.5145
 epoch: 33, train_loss: 0.8425, test_loss: 1.0034, test_f1: 0.5271
 epoch: 34, train_loss: 0.8292, test_loss: 1.0643, test_f1: 0.5478
 epoch: 35, train_loss: 0.8221, test_loss: 1.0766, test_f1: 0.5284
 epoch: 36, train_loss: 0.8205, test_loss: 1.0819, test_f1: 0.5301
 epoch: 37, train_loss: 0.8306, test_loss: 1.0830, test_f1: 0.5039
 epoch: 38, train_loss: 0.8256, test_loss: 1.0731, test_f1: 0.5144
 epoch: 39, train_loss: 0.8266, test_loss: 1.0772, test_f1: 0.5197
 epoch: 40, train_loss: 0.8069, test_loss: 1.2173, test_f1: 0.5061
 epoch: 41, train_loss: 0.8187, test_loss: 1.0608, test_f1: 0.5440
 epoch: 42, train_loss: 0.8165, test_loss: 1.2033, test_f1: 0.4887
 epoch: 43, train_loss: 0.8152, test_loss: 1.5044, test_f1: 0.5114
 epoch: 44, train_loss: 0.8208, test_loss: 1.0202, test_f1: 0.4850
 epoch: 45, train_loss: 0.8133, test_loss: 1.3556, test_f1: 0.5139
 epoch: 46, train_loss: 0.8304, test_loss: 1.2961, test_f1: 0.5222
 epoch: 47, train_loss: 0.8023, test_loss: 1.0534, test_f1: 0.5881
 epoch: 48, train_loss: 0.7978, test_loss: 1.0253, test_f1: 0.5309
 epoch: 49, train_loss: 0.8189, test_loss: 1.0611, test_f1: 0.5099
 epoch: 50, train_loss: 0.8085, test_loss: 1.0160, test_f1: 0.5555
 epoch: 51, train_loss: 0.7900, test_loss: 1.1210, test_f1: 0.5376
 epoch: 52, train_loss: 0.7560, test_loss: 1.1353, test_f1: 0.5777
 epoch: 53, train_loss: 0.7504, test_loss: 1.0511, test_f1: 0.5488
 epoch: 54, train_loss: 0.7551, test_loss: 1.1779, test_f1: 0.5302
 epoch: 55, train_loss: 0.7457, test_loss: 1.1379, test_f1: 0.5643
 epoch: 56, train_loss: 0.7390, test_loss: 1.1145, test_f1: 0.5548
 epoch: 57, train_loss: 0.7252, test_loss: 1.1594, test_f1: 0.5600
 epoch: 58, train_loss: 0.7371, test_loss: 1.1948, test_f1: 0.5662
 epoch: 59, train_loss: 0.7345, test_loss: 1.1164, test_f1: 0.5601
 epoch: 60, train_loss: 0.7160, test_loss: 1.2111, test_f1: 0.5756
 epoch: 61, train_loss: 0.7257, test_loss: 1.1750, test_f1: 0.5821
 epoch: 62, train_loss: 0.7328, test_loss: 1.1006, test_f1: 0.5811
 epoch: 63, train_loss: 0.7351, test_loss: 1.3695, test_f1: 0.5343
 epoch: 64, train_loss: 0.7418, test_loss: 1.0599, test_f1: 0.5734
 epoch: 65, train_loss: 0.7093, test_loss: 1.2797, test_f1: 0.5726
 epoch: 66, train_loss: 0.7232, test_loss: 1.1573, test_f1: 0.5636
 epoch: 67, train_loss: 0.7202, test_loss: 1.2794, test_f1: 0.5514
 epoch: 68, train_loss: 0.7124, test_loss: 1.2747, test_f1: 0.5453
 epoch: 69, train_loss: 0.7000, test_loss: 1.2554, test_f1: 0.5656
 epoch: 70, train_loss: 0.6928, test_loss: 1.6798, test_f1: 0.5354
 epoch: 71, train_loss: 0.6963, test_loss: 1.2454, test_f1: 0.5614
 epoch: 72, train_loss: 0.7105, test_loss: 1.4363, test_f1: 0.5381
 epoch: 73, train_loss: 0.6966, test_loss: 1.1998, test_f1: 0.5858
 epoch: 74, train_loss: 0.6984, test_loss: 1.2595, test_f1: 0.5625
 epoch: 75, train_loss: 0.7110, test_loss: 1.2343, test_f1: 0.5615
 epoch: 76, train_loss: 0.6966, test_loss: 1.2964, test_f1: 0.5675
 epoch: 77, train_loss: 0.6921, test_loss: 1.3041, test_f1: 0.5540
 epoch: 78, train_loss: 0.6935, test_loss: 1.2802, test_f1: 0.5629
 epoch: 79, train_loss: 0.6832, test_loss: 1.2638, test_f1: 0.5543
 epoch: 80, train_loss: 0.7008, test_loss: 1.2983, test_f1: 0.5799
 epoch: 81, train_loss: 0.6856, test_loss: 1.3486, test_f1: 0.5512
 epoch: 82, train_loss: 0.7029, test_loss: 1.2745, test_f1: 0.5436
 epoch: 83, train_loss: 0.6897, test_loss: 1.2205, test_f1: 0.5742
 epoch: 84, train_loss: 0.6862, test_loss: 1.5208, test_f1: 0.5382
 epoch: 85, train_loss: 0.6921, test_loss: 1.2223, test_f1: 0.5573
 epoch: 86, train_loss: 0.6708, test_loss: 1.2063, test_f1: 0.5836
 epoch: 87, train_loss: 0.6646, test_loss: 1.2657, test_f1: 0.5807
 epoch: 88, train_loss: 0.6735, test_loss: 1.2413, test_f1: 0.5725
 epoch: 89, train_loss: 0.6781, test_loss: 1.3162, test_f1: 0.5352
 epoch: 90, train_loss: 0.6547, test_loss: 1.3281, test_f1: 0.5844
 epoch: 91, train_loss: 0.6983, test_loss: 1.2914, test_f1: 0.5663
 epoch: 92, train_loss: 0.6610, test_loss: 1.3562, test_f1: 0.5284
 epoch: 93, train_loss: 0.6589, test_loss: 1.3661, test_f1: 0.5755
 epoch: 94, train_loss: 0.6580, test_loss: 1.2714, test_f1: 0.5648
 epoch: 95, train_loss: 0.6800, test_loss: 1.4223, test_f1: 0.5410
 epoch: 96, train_loss: 0.6752, test_loss: 1.2109, test_f1: 0.5592
 epoch: 97, train_loss: 0.6541, test_loss: 1.2790, test_f1: 0.5510
 epoch: 98, train_loss: 0.6550, test_loss: 1.2811, test_f1: 0.5595
 epoch: 99, train_loss: 0.6820, test_loss: 1.2689, test_f1: 0.5622
##################ITERATION #4 ****************************************
 epoch: 0, train_loss: 1.2577, test_loss: 1.1125, test_f1: 0.4449
 epoch: 1, train_loss: 1.1411, test_loss: 1.0350, test_f1: 0.4816
 epoch: 2, train_loss: 1.0775, test_loss: 0.9898, test_f1: 0.4633
 epoch: 3, train_loss: 1.0465, test_loss: 0.9826, test_f1: 0.4698
 epoch: 4, train_loss: 1.0222, test_loss: 1.0258, test_f1: 0.4357
 epoch: 5, train_loss: 1.0056, test_loss: 0.9946, test_f1: 0.4941
 epoch: 6, train_loss: 0.9722, test_loss: 0.9976, test_f1: 0.4776
 epoch: 7, train_loss: 0.9716, test_loss: 1.0182, test_f1: 0.5131
 epoch: 8, train_loss: 0.9541, test_loss: 1.0411, test_f1: 0.5283
 epoch: 9, train_loss: 0.9439, test_loss: 0.9973, test_f1: 0.5260
 epoch: 10, train_loss: 0.9318, test_loss: 0.9759, test_f1: 0.4932
 epoch: 11, train_loss: 0.9204, test_loss: 1.0753, test_f1: 0.4928
 epoch: 12, train_loss: 0.9203, test_loss: 0.9925, test_f1: 0.4936
 epoch: 13, train_loss: 0.9277, test_loss: 0.9257, test_f1: 0.5362
 epoch: 14, train_loss: 0.9072, test_loss: 0.9653, test_f1: 0.5564
 epoch: 15, train_loss: 0.9199, test_loss: 1.0712, test_f1: 0.5094
 epoch: 16, train_loss: 0.8860, test_loss: 0.9573, test_f1: 0.5626
 epoch: 17, train_loss: 0.8813, test_loss: 1.1660, test_f1: 0.4656
 epoch: 18, train_loss: 0.8945, test_loss: 1.0045, test_f1: 0.5237
 epoch: 19, train_loss: 0.8932, test_loss: 1.0280, test_f1: 0.5236
 epoch: 20, train_loss: 0.8948, test_loss: 1.0099, test_f1: 0.4910
 epoch: 21, train_loss: 0.8662, test_loss: 1.0669, test_f1: 0.5475
 epoch: 22, train_loss: 0.8607, test_loss: 1.1041, test_f1: 0.4919
 epoch: 23, train_loss: 0.8616, test_loss: 1.0604, test_f1: 0.5232
 epoch: 24, train_loss: 0.8594, test_loss: 1.0572, test_f1: 0.4940
 epoch: 25, train_loss: 0.8414, test_loss: 1.1412, test_f1: 0.5289
 epoch: 26, train_loss: 0.8320, test_loss: 1.2096, test_f1: 0.5500
 epoch: 27, train_loss: 0.8682, test_loss: 1.1378, test_f1: 0.5007
 epoch: 28, train_loss: 0.8749, test_loss: 1.1093, test_f1: 0.5103
 epoch: 29, train_loss: 0.8427, test_loss: 1.0423, test_f1: 0.5539
 epoch: 30, train_loss: 0.8340, test_loss: 1.1565, test_f1: 0.5255
 epoch: 31, train_loss: 0.8283, test_loss: 1.0646, test_f1: 0.5505
 epoch: 32, train_loss: 0.8362, test_loss: 0.9633, test_f1: 0.5367
 epoch: 33, train_loss: 0.8421, test_loss: 1.0644, test_f1: 0.5249
 epoch: 34, train_loss: 0.8443, test_loss: 1.0969, test_f1: 0.5281
 epoch: 35, train_loss: 0.8349, test_loss: 1.1131, test_f1: 0.5105
 epoch: 36, train_loss: 0.8320, test_loss: 1.0632, test_f1: 0.5205
 epoch: 37, train_loss: 0.8166, test_loss: 0.9963, test_f1: 0.5115
 epoch: 38, train_loss: 0.8262, test_loss: 1.0931, test_f1: 0.5359
 epoch: 39, train_loss: 0.8205, test_loss: 1.1980, test_f1: 0.5195
 epoch: 40, train_loss: 0.8003, test_loss: 1.1291, test_f1: 0.5748
 epoch: 41, train_loss: 0.7955, test_loss: 1.1401, test_f1: 0.5490
 epoch: 42, train_loss: 0.8033, test_loss: 1.1104, test_f1: 0.5434
 epoch: 43, train_loss: 0.7896, test_loss: 1.0868, test_f1: 0.5497
 epoch: 44, train_loss: 0.8088, test_loss: 1.1697, test_f1: 0.5507
 epoch: 45, train_loss: 0.8124, test_loss: 1.0702, test_f1: 0.5553
 epoch: 46, train_loss: 0.7895, test_loss: 1.2087, test_f1: 0.4767
 epoch: 47, train_loss: 0.7802, test_loss: 1.0328, test_f1: 0.5607
 epoch: 48, train_loss: 0.7777, test_loss: 1.1545, test_f1: 0.5464
 epoch: 49, train_loss: 0.7815, test_loss: 1.0457, test_f1: 0.5543
 epoch: 50, train_loss: 0.7736, test_loss: 1.2318, test_f1: 0.5292
 epoch: 51, train_loss: 0.7562, test_loss: 1.0398, test_f1: 0.5501
 epoch: 52, train_loss: 0.7279, test_loss: 1.1709, test_f1: 0.5315
 epoch: 53, train_loss: 0.7236, test_loss: 1.1218, test_f1: 0.5694
 epoch: 54, train_loss: 0.7312, test_loss: 1.1622, test_f1: 0.5445
 epoch: 55, train_loss: 0.7205, test_loss: 1.2525, test_f1: 0.5227
 epoch: 56, train_loss: 0.7024, test_loss: 1.2710, test_f1: 0.5616
 epoch: 57, train_loss: 0.7101, test_loss: 1.1704, test_f1: 0.5553
 epoch: 58, train_loss: 0.7117, test_loss: 1.0659, test_f1: 0.5483
 epoch: 59, train_loss: 0.7029, test_loss: 1.2372, test_f1: 0.5572
 epoch: 60, train_loss: 0.7106, test_loss: 1.1803, test_f1: 0.5273
 epoch: 61, train_loss: 0.7055, test_loss: 1.1249, test_f1: 0.5717
 epoch: 62, train_loss: 0.7006, test_loss: 1.0805, test_f1: 0.5583
 epoch: 63, train_loss: 0.6835, test_loss: 1.1816, test_f1: 0.5493
 epoch: 64, train_loss: 0.6794, test_loss: 1.2283, test_f1: 0.5515
 epoch: 65, train_loss: 0.6774, test_loss: 1.1482, test_f1: 0.5594
 epoch: 66, train_loss: 0.6866, test_loss: 1.1095, test_f1: 0.5611
 epoch: 67, train_loss: 0.6693, test_loss: 1.2169, test_f1: 0.5778
 epoch: 68, train_loss: 0.6926, test_loss: 1.3836, test_f1: 0.5511
 epoch: 69, train_loss: 0.6745, test_loss: 1.2545, test_f1: 0.5452
 epoch: 70, train_loss: 0.6696, test_loss: 1.2903, test_f1: 0.5277
 epoch: 71, train_loss: 0.6833, test_loss: 1.1929, test_f1: 0.5495
 epoch: 72, train_loss: 0.6673, test_loss: 1.4137, test_f1: 0.5316
 epoch: 73, train_loss: 0.6815, test_loss: 1.4113, test_f1: 0.5570
 epoch: 74, train_loss: 0.6707, test_loss: 1.1659, test_f1: 0.5889
 epoch: 75, train_loss: 0.6877, test_loss: 1.2432, test_f1: 0.5638
 epoch: 76, train_loss: 0.6683, test_loss: 1.4098, test_f1: 0.5073
 epoch: 77, train_loss: 0.6670, test_loss: 1.1511, test_f1: 0.5659
 epoch: 78, train_loss: 0.7174, test_loss: 1.3896, test_f1: 0.5034
 epoch: 79, train_loss: 0.6602, test_loss: 1.3222, test_f1: 0.5580
 epoch: 80, train_loss: 0.6842, test_loss: 1.4229, test_f1: 0.5373
 epoch: 81, train_loss: 0.6649, test_loss: 1.4625, test_f1: 0.5346
 epoch: 82, train_loss: 0.6642, test_loss: 1.2936, test_f1: 0.5433
 epoch: 83, train_loss: 0.6554, test_loss: 1.2049, test_f1: 0.5263
 epoch: 84, train_loss: 0.6580, test_loss: 1.4406, test_f1: 0.5249
 epoch: 85, train_loss: 0.6492, test_loss: 1.3060, test_f1: 0.5501
 epoch: 86, train_loss: 0.6382, test_loss: 1.2844, test_f1: 0.5685
 epoch: 87, train_loss: 0.6396, test_loss: 1.2758, test_f1: 0.5535
 epoch: 88, train_loss: 0.6510, test_loss: 1.2588, test_f1: 0.5861
 epoch: 89, train_loss: 0.6587, test_loss: 1.4628, test_f1: 0.5288
 epoch: 90, train_loss: 0.6616, test_loss: 1.2417, test_f1: 0.5516
 epoch: 91, train_loss: 0.6546, test_loss: 1.3745, test_f1: 0.5053
 epoch: 92, train_loss: 0.6243, test_loss: 1.2117, test_f1: 0.5752
 epoch: 93, train_loss: 0.6326, test_loss: 1.3909, test_f1: 0.5231
 epoch: 94, train_loss: 0.6289, test_loss: 1.3266, test_f1: 0.5369
 epoch: 95, train_loss: 0.6268, test_loss: 1.4127, test_f1: 0.5305
 epoch: 96, train_loss: 0.6454, test_loss: 1.2515, test_f1: 0.5390
 epoch: 97, train_loss: 0.6509, test_loss: 1.4778, test_f1: 0.5403
 epoch: 98, train_loss: 0.6255, test_loss: 1.4451, test_f1: 0.5568
 epoch: 99, train_loss: 0.6259, test_loss: 1.4652, test_f1: 0.5262
##################ITERATION #5 ****************************************
 epoch: 0, train_loss: 1.3120, test_loss: 1.2417, test_f1: 0.3801
 epoch: 1, train_loss: 1.2287, test_loss: 1.1463, test_f1: 0.4041
 epoch: 2, train_loss: 1.1566, test_loss: 1.1607, test_f1: 0.4022
 epoch: 3, train_loss: 1.1245, test_loss: 1.0665, test_f1: 0.4320
 epoch: 4, train_loss: 1.0967, test_loss: 1.0155, test_f1: 0.4470
 epoch: 5, train_loss: 1.0572, test_loss: 0.9712, test_f1: 0.4722
 epoch: 6, train_loss: 1.0192, test_loss: 0.9948, test_f1: 0.4422
 epoch: 7, train_loss: 1.0127, test_loss: 1.0337, test_f1: 0.4542
 epoch: 8, train_loss: 1.0219, test_loss: 1.0400, test_f1: 0.4771
 epoch: 9, train_loss: 1.0002, test_loss: 0.8985, test_f1: 0.4796
 epoch: 10, train_loss: 0.9810, test_loss: 1.0036, test_f1: 0.4818
 epoch: 11, train_loss: 1.0171, test_loss: 0.9925, test_f1: 0.4487
 epoch: 12, train_loss: 0.9853, test_loss: 1.0020, test_f1: 0.4755
 epoch: 13, train_loss: 0.9632, test_loss: 1.0311, test_f1: 0.5114
 epoch: 14, train_loss: 0.9626, test_loss: 1.0096, test_f1: 0.4744
 epoch: 15, train_loss: 0.9549, test_loss: 1.0679, test_f1: 0.4505
 epoch: 16, train_loss: 0.9374, test_loss: 0.9718, test_f1: 0.4841
 epoch: 17, train_loss: 0.9702, test_loss: 0.9167, test_f1: 0.4816
 epoch: 18, train_loss: 0.9741, test_loss: 0.9765, test_f1: 0.5033
 epoch: 19, train_loss: 0.9451, test_loss: 0.9517, test_f1: 0.5027
 epoch: 20, train_loss: 0.9390, test_loss: 0.9617, test_f1: 0.5017
 epoch: 21, train_loss: 0.9246, test_loss: 0.9858, test_f1: 0.4994
 epoch: 22, train_loss: 0.9147, test_loss: 1.0233, test_f1: 0.4715
 epoch: 23, train_loss: 0.9271, test_loss: 0.9596, test_f1: 0.5117
 epoch: 24, train_loss: 0.9260, test_loss: 0.9605, test_f1: 0.5107
 epoch: 25, train_loss: 0.9100, test_loss: 0.9355, test_f1: 0.5103
 epoch: 26, train_loss: 0.9099, test_loss: 0.9632, test_f1: 0.4973
 epoch: 27, train_loss: 0.9140, test_loss: 0.9589, test_f1: 0.4909
 epoch: 28, train_loss: 0.9136, test_loss: 0.9437, test_f1: 0.4952
 epoch: 29, train_loss: 0.9195, test_loss: 0.9673, test_f1: 0.4864
 epoch: 30, train_loss: 0.9025, test_loss: 0.9678, test_f1: 0.4957
 epoch: 31, train_loss: 0.9010, test_loss: 0.9792, test_f1: 0.4838
 epoch: 32, train_loss: 0.8844, test_loss: 0.9672, test_f1: 0.5121
 epoch: 33, train_loss: 0.8764, test_loss: 0.9830, test_f1: 0.5086
 epoch: 34, train_loss: 0.8744, test_loss: 0.9789, test_f1: 0.5071
 epoch: 35, train_loss: 0.8809, test_loss: 1.0225, test_f1: 0.4874
 epoch: 36, train_loss: 0.8976, test_loss: 1.0180, test_f1: 0.5069
 epoch: 37, train_loss: 0.8823, test_loss: 0.9436, test_f1: 0.4993
 epoch: 38, train_loss: 0.8623, test_loss: 1.0172, test_f1: 0.5421
 epoch: 39, train_loss: 0.8749, test_loss: 0.9580, test_f1: 0.5157
 epoch: 40, train_loss: 0.8684, test_loss: 1.0015, test_f1: 0.5199
 epoch: 41, train_loss: 0.8689, test_loss: 1.0127, test_f1: 0.5341
 epoch: 42, train_loss: 0.8593, test_loss: 1.0342, test_f1: 0.5065
 epoch: 43, train_loss: 0.8621, test_loss: 1.1253, test_f1: 0.4767
 epoch: 44, train_loss: 0.8723, test_loss: 0.9307, test_f1: 0.5148
 epoch: 45, train_loss: 0.8796, test_loss: 1.0183, test_f1: 0.5016
 epoch: 46, train_loss: 0.8353, test_loss: 1.0293, test_f1: 0.5062
 epoch: 47, train_loss: 0.8398, test_loss: 0.9619, test_f1: 0.5247
 epoch: 48, train_loss: 0.8356, test_loss: 0.9911, test_f1: 0.5117
 epoch: 49, train_loss: 0.8342, test_loss: 0.9416, test_f1: 0.5285
 epoch: 50, train_loss: 0.8502, test_loss: 0.9853, test_f1: 0.5123
 epoch: 51, train_loss: 0.8137, test_loss: 0.9654, test_f1: 0.5171
 epoch: 52, train_loss: 0.8171, test_loss: 0.9972, test_f1: 0.5293
 epoch: 53, train_loss: 0.7946, test_loss: 1.0360, test_f1: 0.4924
 epoch: 54, train_loss: 0.8010, test_loss: 1.0261, test_f1: 0.5050
 epoch: 55, train_loss: 0.7885, test_loss: 1.0121, test_f1: 0.5094
 epoch: 56, train_loss: 0.8014, test_loss: 1.0120, test_f1: 0.5223
 epoch: 57, train_loss: 0.8059, test_loss: 1.0072, test_f1: 0.5303
 epoch: 58, train_loss: 0.8019, test_loss: 0.9827, test_f1: 0.5119
 epoch: 59, train_loss: 0.7816, test_loss: 1.0044, test_f1: 0.5335
 epoch: 60, train_loss: 0.7720, test_loss: 0.9973, test_f1: 0.5270
 epoch: 61, train_loss: 0.7864, test_loss: 0.9650, test_f1: 0.5244
 epoch: 62, train_loss: 0.7815, test_loss: 1.1192, test_f1: 0.4875
 epoch: 63, train_loss: 0.7717, test_loss: 1.1829, test_f1: 0.4944
 epoch: 64, train_loss: 0.7707, test_loss: 1.0227, test_f1: 0.5101
 epoch: 65, train_loss: 0.7735, test_loss: 1.0061, test_f1: 0.5207
 epoch: 66, train_loss: 0.7657, test_loss: 1.1184, test_f1: 0.5229
 epoch: 67, train_loss: 0.7647, test_loss: 1.0558, test_f1: 0.5358
 epoch: 68, train_loss: 0.7714, test_loss: 1.1130, test_f1: 0.5017
 epoch: 69, train_loss: 0.7618, test_loss: 1.0547, test_f1: 0.5192
 epoch: 70, train_loss: 0.7729, test_loss: 0.9699, test_f1: 0.5178
 epoch: 71, train_loss: 0.7686, test_loss: 0.9788, test_f1: 0.5249
 epoch: 72, train_loss: 0.7702, test_loss: 1.1174, test_f1: 0.4988
 epoch: 73, train_loss: 0.7603, test_loss: 1.0410, test_f1: 0.5050
 epoch: 74, train_loss: 0.7702, test_loss: 1.1756, test_f1: 0.5008
 epoch: 75, train_loss: 0.7569, test_loss: 1.1438, test_f1: 0.5416
 epoch: 76, train_loss: 0.7654, test_loss: 0.9920, test_f1: 0.5189
 epoch: 77, train_loss: 0.7522, test_loss: 0.9901, test_f1: 0.5429
 epoch: 78, train_loss: 0.7490, test_loss: 1.0137, test_f1: 0.5438
 epoch: 79, train_loss: 0.7484, test_loss: 0.9822, test_f1: 0.5114
 epoch: 80, train_loss: 0.7644, test_loss: 1.1392, test_f1: 0.4767
 epoch: 81, train_loss: 0.7654, test_loss: 0.9647, test_f1: 0.5230
 epoch: 82, train_loss: 0.7886, test_loss: 1.0927, test_f1: 0.4937
 epoch: 83, train_loss: 0.7639, test_loss: 1.1181, test_f1: 0.5101
 epoch: 84, train_loss: 0.7583, test_loss: 1.1819, test_f1: 0.4935
 epoch: 85, train_loss: 0.7568, test_loss: 1.0865, test_f1: 0.5187
 epoch: 86, train_loss: 0.7538, test_loss: 1.0472, test_f1: 0.5501
 epoch: 87, train_loss: 0.7347, test_loss: 1.0546, test_f1: 0.5188
 epoch: 88, train_loss: 0.7519, test_loss: 1.0645, test_f1: 0.5236
 epoch: 89, train_loss: 0.7464, test_loss: 1.2222, test_f1: 0.5056
 epoch: 90, train_loss: 0.7336, test_loss: 1.1985, test_f1: 0.5108
 epoch: 91, train_loss: 0.7377, test_loss: 1.0613, test_f1: 0.5275
 epoch: 92, train_loss: 0.7374, test_loss: 1.1060, test_f1: 0.5351
 epoch: 93, train_loss: 0.7448, test_loss: 1.0503, test_f1: 0.5266
 epoch: 94, train_loss: 0.7390, test_loss: 1.0252, test_f1: 0.5594
 epoch: 95, train_loss: 0.7206, test_loss: 1.0361, test_f1: 0.5596
 epoch: 96, train_loss: 0.7468, test_loss: 1.0189, test_f1: 0.5321
 epoch: 97, train_loss: 0.7490, test_loss: 1.0419, test_f1: 0.5468
 epoch: 98, train_loss: 0.7339, test_loss: 1.0553, test_f1: 0.5330
 epoch: 99, train_loss: 0.7237, test_loss: 1.0032, test_f1: 0.5790
##################ITERATION #6 ****************************************
 epoch: 0, train_loss: 1.3070, test_loss: 1.2343, test_f1: 0.2958
 epoch: 1, train_loss: 1.2350, test_loss: 1.1929, test_f1: 0.3952
 epoch: 2, train_loss: 1.1830, test_loss: 1.0878, test_f1: 0.4510
 epoch: 3, train_loss: 1.1349, test_loss: 1.1545, test_f1: 0.4371
 epoch: 4, train_loss: 1.0863, test_loss: 0.9922, test_f1: 0.4635
 epoch: 5, train_loss: 1.0315, test_loss: 0.9856, test_f1: 0.4678
 epoch: 6, train_loss: 1.0268, test_loss: 0.9893, test_f1: 0.4596
 epoch: 7, train_loss: 1.0231, test_loss: 0.9246, test_f1: 0.4837
 epoch: 8, train_loss: 0.9983, test_loss: 1.0220, test_f1: 0.4830
 epoch: 9, train_loss: 1.0034, test_loss: 1.0514, test_f1: 0.5292
 epoch: 10, train_loss: 0.9750, test_loss: 1.0117, test_f1: 0.4842
 epoch: 11, train_loss: 0.9631, test_loss: 1.0781, test_f1: 0.4831
 epoch: 12, train_loss: 0.9430, test_loss: 1.0605, test_f1: 0.4613
 epoch: 13, train_loss: 0.9405, test_loss: 1.0374, test_f1: 0.5053
 epoch: 14, train_loss: 0.9547, test_loss: 1.1610, test_f1: 0.4859
 epoch: 15, train_loss: 0.9492, test_loss: 1.1076, test_f1: 0.5056
 epoch: 16, train_loss: 0.9169, test_loss: 1.1044, test_f1: 0.4879
 epoch: 17, train_loss: 0.9202, test_loss: 1.0305, test_f1: 0.4797
 epoch: 18, train_loss: 0.9148, test_loss: 0.9472, test_f1: 0.5001
 epoch: 19, train_loss: 0.9209, test_loss: 1.1479, test_f1: 0.4929
 epoch: 20, train_loss: 0.9112, test_loss: 1.1029, test_f1: 0.4991
 epoch: 21, train_loss: 0.8912, test_loss: 0.9998, test_f1: 0.5068
 epoch: 22, train_loss: 0.9003, test_loss: 1.0720, test_f1: 0.5046
 epoch: 23, train_loss: 0.8880, test_loss: 1.0893, test_f1: 0.5101
 epoch: 24, train_loss: 0.8813, test_loss: 1.0199, test_f1: 0.5077
 epoch: 25, train_loss: 0.8954, test_loss: 1.0220, test_f1: 0.5046
 epoch: 26, train_loss: 0.8922, test_loss: 1.1515, test_f1: 0.5108
 epoch: 27, train_loss: 0.8892, test_loss: 1.0529, test_f1: 0.5030
 epoch: 28, train_loss: 0.8727, test_loss: 1.1655, test_f1: 0.4988
 epoch: 29, train_loss: 0.8618, test_loss: 1.1490, test_f1: 0.4884
 epoch: 30, train_loss: 0.8698, test_loss: 1.0652, test_f1: 0.4911
 epoch: 31, train_loss: 0.8727, test_loss: 1.2494, test_f1: 0.4950
 epoch: 32, train_loss: 0.8647, test_loss: 1.0993, test_f1: 0.5197
 epoch: 33, train_loss: 0.8782, test_loss: 1.0773, test_f1: 0.4813
 epoch: 34, train_loss: 0.8371, test_loss: 0.9845, test_f1: 0.5101
 epoch: 35, train_loss: 0.8490, test_loss: 1.0427, test_f1: 0.4987
 epoch: 36, train_loss: 0.8481, test_loss: 1.0467, test_f1: 0.5013
 epoch: 37, train_loss: 0.8689, test_loss: 1.0307, test_f1: 0.4992
 epoch: 38, train_loss: 0.8400, test_loss: 1.1093, test_f1: 0.5010
 epoch: 39, train_loss: 0.8426, test_loss: 0.9797, test_f1: 0.5326
 epoch: 40, train_loss: 0.8349, test_loss: 1.1906, test_f1: 0.5122
 epoch: 41, train_loss: 0.8491, test_loss: 1.0991, test_f1: 0.4766
 epoch: 42, train_loss: 0.8438, test_loss: 0.9612, test_f1: 0.5261
 epoch: 43, train_loss: 0.8248, test_loss: 1.0296, test_f1: 0.5058
 epoch: 44, train_loss: 0.8169, test_loss: 1.2450, test_f1: 0.4900
 epoch: 45, train_loss: 0.8006, test_loss: 1.0612, test_f1: 0.5224
 epoch: 46, train_loss: 0.8134, test_loss: 1.0343, test_f1: 0.4937
 epoch: 47, train_loss: 0.8333, test_loss: 0.9611, test_f1: 0.5186
 epoch: 48, train_loss: 0.8227, test_loss: 0.9579, test_f1: 0.5214
 epoch: 49, train_loss: 0.8120, test_loss: 1.1248, test_f1: 0.4674
 epoch: 50, train_loss: 0.8125, test_loss: 1.0282, test_f1: 0.4819
 epoch: 51, train_loss: 0.8209, test_loss: 0.9936, test_f1: 0.4958
 epoch: 52, train_loss: 0.7812, test_loss: 1.0027, test_f1: 0.4988
 epoch: 53, train_loss: 0.7729, test_loss: 0.9786, test_f1: 0.5277
 epoch: 54, train_loss: 0.7508, test_loss: 1.1110, test_f1: 0.5053
 epoch: 55, train_loss: 0.7361, test_loss: 1.0385, test_f1: 0.5178
 epoch: 56, train_loss: 0.7634, test_loss: 1.1454, test_f1: 0.4920
 epoch: 57, train_loss: 0.7435, test_loss: 1.1157, test_f1: 0.5033
 epoch: 58, train_loss: 0.7449, test_loss: 1.1386, test_f1: 0.5003
 epoch: 59, train_loss: 0.7456, test_loss: 1.1753, test_f1: 0.4912
 epoch: 60, train_loss: 0.7425, test_loss: 1.2332, test_f1: 0.5080
 epoch: 61, train_loss: 0.7405, test_loss: 1.2103, test_f1: 0.5016
 epoch: 62, train_loss: 0.7414, test_loss: 1.0238, test_f1: 0.5118
 epoch: 63, train_loss: 0.7315, test_loss: 1.3045, test_f1: 0.4842
 epoch: 64, train_loss: 0.7373, test_loss: 1.3161, test_f1: 0.4877
 epoch: 65, train_loss: 0.7308, test_loss: 1.0718, test_f1: 0.5121
 epoch: 66, train_loss: 0.7273, test_loss: 1.0739, test_f1: 0.5143
 epoch: 67, train_loss: 0.7246, test_loss: 1.2676, test_f1: 0.4804
 epoch: 68, train_loss: 0.7154, test_loss: 1.2508, test_f1: 0.4887
 epoch: 69, train_loss: 0.7263, test_loss: 1.2074, test_f1: 0.4736
 epoch: 70, train_loss: 0.7481, test_loss: 1.1674, test_f1: 0.4759
 epoch: 71, train_loss: 0.7303, test_loss: 1.1784, test_f1: 0.4812
 epoch: 72, train_loss: 0.7238, test_loss: 1.1433, test_f1: 0.5175
 epoch: 73, train_loss: 0.7229, test_loss: 1.0460, test_f1: 0.4709
 epoch: 74, train_loss: 0.7091, test_loss: 1.0783, test_f1: 0.5032
 epoch: 75, train_loss: 0.7241, test_loss: 1.0674, test_f1: 0.5023
 epoch: 76, train_loss: 0.7112, test_loss: 1.1599, test_f1: 0.5007
 epoch: 77, train_loss: 0.7147, test_loss: 1.2726, test_f1: 0.4875
 epoch: 78, train_loss: 0.7389, test_loss: 1.0750, test_f1: 0.5349
 epoch: 79, train_loss: 0.6930, test_loss: 1.1471, test_f1: 0.5371
 epoch: 80, train_loss: 0.7140, test_loss: 1.1184, test_f1: 0.5247
 epoch: 81, train_loss: 0.6819, test_loss: 1.2746, test_f1: 0.4921
 epoch: 82, train_loss: 0.6939, test_loss: 1.1727, test_f1: 0.5093
 epoch: 83, train_loss: 0.6890, test_loss: 1.1427, test_f1: 0.5242
 epoch: 84, train_loss: 0.6914, test_loss: 1.0593, test_f1: 0.5746
 epoch: 85, train_loss: 0.7046, test_loss: 1.0392, test_f1: 0.5623
 epoch: 86, train_loss: 0.7115, test_loss: 1.0122, test_f1: 0.5649
 epoch: 87, train_loss: 0.6776, test_loss: 1.1208, test_f1: 0.5419
 epoch: 88, train_loss: 0.6839, test_loss: 1.1098, test_f1: 0.5462
 epoch: 89, train_loss: 0.7026, test_loss: 1.1340, test_f1: 0.5129
 epoch: 90, train_loss: 0.6767, test_loss: 1.2295, test_f1: 0.4987
 epoch: 91, train_loss: 0.6766, test_loss: 1.1726, test_f1: 0.5358
 epoch: 92, train_loss: 0.6774, test_loss: 1.0721, test_f1: 0.5107
 epoch: 93, train_loss: 0.6671, test_loss: 1.2270, test_f1: 0.5089
 epoch: 94, train_loss: 0.6579, test_loss: 1.0470, test_f1: 0.5428
 epoch: 95, train_loss: 0.6789, test_loss: 1.0868, test_f1: 0.5241
 epoch: 96, train_loss: 0.6743, test_loss: 1.1028, test_f1: 0.5414
 epoch: 97, train_loss: 0.6698, test_loss: 1.2064, test_f1: 0.5241
 epoch: 98, train_loss: 0.6740, test_loss: 1.1676, test_f1: 0.5530
 epoch: 99, train_loss: 0.6514, test_loss: 1.1998, test_f1: 0.5381
##################ITERATION #7 ****************************************
 epoch: 0, train_loss: 1.2796, test_loss: 1.2055, test_f1: 0.3295
 epoch: 1, train_loss: 1.1716, test_loss: 1.2162, test_f1: 0.3437
 epoch: 2, train_loss: 1.1402, test_loss: 1.0810, test_f1: 0.4391
 epoch: 3, train_loss: 1.0859, test_loss: 0.9928, test_f1: 0.4481
 epoch: 4, train_loss: 1.0663, test_loss: 0.9846, test_f1: 0.4788
 epoch: 5, train_loss: 1.0477, test_loss: 1.0196, test_f1: 0.4832
 epoch: 6, train_loss: 1.0264, test_loss: 0.9501, test_f1: 0.4624
 epoch: 7, train_loss: 0.9921, test_loss: 0.9147, test_f1: 0.5016
 epoch: 8, train_loss: 0.9863, test_loss: 1.0167, test_f1: 0.5049
 epoch: 9, train_loss: 0.9908, test_loss: 0.9502, test_f1: 0.4970
 epoch: 10, train_loss: 0.9607, test_loss: 0.8988, test_f1: 0.4881
 epoch: 11, train_loss: 0.9721, test_loss: 1.0259, test_f1: 0.4932
 epoch: 12, train_loss: 0.9565, test_loss: 0.9608, test_f1: 0.4958
 epoch: 13, train_loss: 0.9336, test_loss: 0.9744, test_f1: 0.5004
 epoch: 14, train_loss: 0.9379, test_loss: 0.9903, test_f1: 0.5067
 epoch: 15, train_loss: 0.9291, test_loss: 1.0321, test_f1: 0.4876
 epoch: 16, train_loss: 0.9460, test_loss: 0.9784, test_f1: 0.4838
 epoch: 17, train_loss: 0.9142, test_loss: 0.9935, test_f1: 0.5160
 epoch: 18, train_loss: 0.8902, test_loss: 1.0082, test_f1: 0.5117
 epoch: 19, train_loss: 0.9031, test_loss: 1.0024, test_f1: 0.5108
 epoch: 20, train_loss: 0.9061, test_loss: 1.2650, test_f1: 0.4609
 epoch: 21, train_loss: 0.9153, test_loss: 1.0333, test_f1: 0.5100
 epoch: 22, train_loss: 0.8938, test_loss: 1.0082, test_f1: 0.4959
 epoch: 23, train_loss: 0.8897, test_loss: 1.2566, test_f1: 0.4538
 epoch: 24, train_loss: 0.8888, test_loss: 1.0295, test_f1: 0.4962
 epoch: 25, train_loss: 0.8770, test_loss: 0.9481, test_f1: 0.5182
 epoch: 26, train_loss: 0.8716, test_loss: 1.0051, test_f1: 0.5039
 epoch: 27, train_loss: 0.8688, test_loss: 1.0763, test_f1: 0.4710
 epoch: 28, train_loss: 0.8647, test_loss: 1.0054, test_f1: 0.5153
 epoch: 29, train_loss: 0.8650, test_loss: 1.0301, test_f1: 0.5107
 epoch: 30, train_loss: 0.8641, test_loss: 1.0264, test_f1: 0.5028
 epoch: 31, train_loss: 0.8407, test_loss: 1.0276, test_f1: 0.5138
 epoch: 32, train_loss: 0.8679, test_loss: 0.9577, test_f1: 0.5089
 epoch: 33, train_loss: 0.8589, test_loss: 1.0465, test_f1: 0.5436
 epoch: 34, train_loss: 0.8557, test_loss: 0.9982, test_f1: 0.5081
 epoch: 35, train_loss: 0.8419, test_loss: 1.0824, test_f1: 0.4924
 epoch: 36, train_loss: 0.8538, test_loss: 1.0333, test_f1: 0.5212
 epoch: 37, train_loss: 0.8528, test_loss: 1.1241, test_f1: 0.4787
 epoch: 38, train_loss: 0.8464, test_loss: 1.1856, test_f1: 0.5021
 epoch: 39, train_loss: 0.8338, test_loss: 1.0851, test_f1: 0.5134
 epoch: 40, train_loss: 0.8370, test_loss: 1.0418, test_f1: 0.5174
 epoch: 41, train_loss: 0.8373, test_loss: 1.1012, test_f1: 0.4945
 epoch: 42, train_loss: 0.8365, test_loss: 1.1871, test_f1: 0.5086
 epoch: 43, train_loss: 0.8200, test_loss: 1.1923, test_f1: 0.5188
 epoch: 44, train_loss: 0.8141, test_loss: 1.0351, test_f1: 0.5205
 epoch: 45, train_loss: 0.8021, test_loss: 1.0462, test_f1: 0.5427
 epoch: 46, train_loss: 0.8064, test_loss: 1.0765, test_f1: 0.5341
 epoch: 47, train_loss: 0.8192, test_loss: 0.9930, test_f1: 0.5833
 epoch: 48, train_loss: 0.8260, test_loss: 1.0122, test_f1: 0.5490
 epoch: 49, train_loss: 0.8221, test_loss: 1.0289, test_f1: 0.5491
 epoch: 50, train_loss: 0.7929, test_loss: 1.0595, test_f1: 0.5696
 epoch: 51, train_loss: 0.7834, test_loss: 1.0210, test_f1: 0.5739
 epoch: 52, train_loss: 0.7663, test_loss: 1.1043, test_f1: 0.5817
 epoch: 53, train_loss: 0.7573, test_loss: 1.2366, test_f1: 0.5370
 epoch: 54, train_loss: 0.7483, test_loss: 1.1042, test_f1: 0.5835
 epoch: 55, train_loss: 0.7568, test_loss: 1.0526, test_f1: 0.5857
 epoch: 56, train_loss: 0.7544, test_loss: 1.1164, test_f1: 0.5740
 epoch: 57, train_loss: 0.7388, test_loss: 1.1720, test_f1: 0.5625
 epoch: 58, train_loss: 0.7277, test_loss: 1.1842, test_f1: 0.5574
 epoch: 59, train_loss: 0.7564, test_loss: 1.2032, test_f1: 0.5649
 epoch: 60, train_loss: 0.7391, test_loss: 1.1063, test_f1: 0.5855
 epoch: 61, train_loss: 0.7241, test_loss: 1.1323, test_f1: 0.5624
 epoch: 62, train_loss: 0.7276, test_loss: 1.1142, test_f1: 0.5988
 epoch: 63, train_loss: 0.7160, test_loss: 1.1414, test_f1: 0.5672
 epoch: 64, train_loss: 0.7301, test_loss: 1.1252, test_f1: 0.6028
 epoch: 65, train_loss: 0.7370, test_loss: 1.1836, test_f1: 0.5779
 epoch: 66, train_loss: 0.7220, test_loss: 1.2603, test_f1: 0.5791
 epoch: 67, train_loss: 0.7128, test_loss: 1.1419, test_f1: 0.5909
 epoch: 68, train_loss: 0.7256, test_loss: 1.1648, test_f1: 0.5846
 epoch: 69, train_loss: 0.7280, test_loss: 1.1098, test_f1: 0.5929
 epoch: 70, train_loss: 0.7101, test_loss: 1.1053, test_f1: 0.6107
 epoch: 71, train_loss: 0.6991, test_loss: 1.1284, test_f1: 0.6072
 epoch: 72, train_loss: 0.7094, test_loss: 1.2397, test_f1: 0.5390
 epoch: 73, train_loss: 0.7252, test_loss: 1.2569, test_f1: 0.5763
 epoch: 74, train_loss: 0.7001, test_loss: 1.1425, test_f1: 0.5875
 epoch: 75, train_loss: 0.6907, test_loss: 1.3653, test_f1: 0.5802
 epoch: 76, train_loss: 0.7065, test_loss: 1.3389, test_f1: 0.5357
 epoch: 77, train_loss: 0.6869, test_loss: 1.4267, test_f1: 0.5694
 epoch: 78, train_loss: 0.6964, test_loss: 1.2105, test_f1: 0.5986
 epoch: 79, train_loss: 0.6962, test_loss: 1.1800, test_f1: 0.5779
 epoch: 80, train_loss: 0.6940, test_loss: 1.2646, test_f1: 0.5426
 epoch: 81, train_loss: 0.6903, test_loss: 1.4137, test_f1: 0.5230
 epoch: 82, train_loss: 0.6859, test_loss: 1.2895, test_f1: 0.5343
 epoch: 83, train_loss: 0.6749, test_loss: 1.6160, test_f1: 0.5196
 epoch: 84, train_loss: 0.6895, test_loss: 1.2346, test_f1: 0.5777
 epoch: 85, train_loss: 0.6525, test_loss: 1.3493, test_f1: 0.5497
 epoch: 86, train_loss: 0.6800, test_loss: 1.4498, test_f1: 0.5590
 epoch: 87, train_loss: 0.6775, test_loss: 1.1067, test_f1: 0.5887
 epoch: 88, train_loss: 0.6834, test_loss: 1.1853, test_f1: 0.5844
 epoch: 89, train_loss: 0.6798, test_loss: 1.3481, test_f1: 0.5813
 epoch: 90, train_loss: 0.6829, test_loss: 1.1700, test_f1: 0.5950
 epoch: 91, train_loss: 0.6727, test_loss: 1.3411, test_f1: 0.5697
 epoch: 92, train_loss: 0.6610, test_loss: 1.1667, test_f1: 0.5791
 epoch: 93, train_loss: 0.6744, test_loss: 1.4081, test_f1: 0.5726
 epoch: 94, train_loss: 0.6563, test_loss: 1.1640, test_f1: 0.6063
 epoch: 95, train_loss: 0.6457, test_loss: 1.3516, test_f1: 0.5819
 epoch: 96, train_loss: 0.6468, test_loss: 1.3247, test_f1: 0.5898
 epoch: 97, train_loss: 0.6691, test_loss: 1.2752, test_f1: 0.5837
 epoch: 98, train_loss: 0.6548, test_loss: 1.2454, test_f1: 0.5704
 epoch: 99, train_loss: 0.6512, test_loss: 1.3521, test_f1: 0.5750
##################ITERATION #8 ****************************************
 epoch: 0, train_loss: 1.3100, test_loss: 1.2362, test_f1: 0.3571
 epoch: 1, train_loss: 1.2263, test_loss: 1.1941, test_f1: 0.4140
 epoch: 2, train_loss: 1.1873, test_loss: 1.1356, test_f1: 0.4149
 epoch: 3, train_loss: 1.1720, test_loss: 1.1234, test_f1: 0.4624
 epoch: 4, train_loss: 1.1114, test_loss: 1.0022, test_f1: 0.4932
 epoch: 5, train_loss: 1.0784, test_loss: 0.9726, test_f1: 0.4652
 epoch: 6, train_loss: 1.0571, test_loss: 0.9620, test_f1: 0.4593
 epoch: 7, train_loss: 1.0334, test_loss: 0.9686, test_f1: 0.5336
 epoch: 8, train_loss: 0.9971, test_loss: 1.0226, test_f1: 0.4852
 epoch: 9, train_loss: 0.9910, test_loss: 1.0353, test_f1: 0.5155
 epoch: 10, train_loss: 0.9806, test_loss: 1.0759, test_f1: 0.4862
 epoch: 11, train_loss: 0.9727, test_loss: 1.3017, test_f1: 0.4680
 epoch: 12, train_loss: 0.9667, test_loss: 1.0049, test_f1: 0.4797
 epoch: 13, train_loss: 0.9585, test_loss: 0.9934, test_f1: 0.4976
 epoch: 14, train_loss: 0.9404, test_loss: 1.0947, test_f1: 0.4890
 epoch: 15, train_loss: 0.9406, test_loss: 1.0084, test_f1: 0.4703
 epoch: 16, train_loss: 0.9263, test_loss: 0.9731, test_f1: 0.4754
 epoch: 17, train_loss: 0.9353, test_loss: 1.0201, test_f1: 0.4902
 epoch: 18, train_loss: 0.9126, test_loss: 0.9866, test_f1: 0.4900
 epoch: 19, train_loss: 0.9170, test_loss: 0.9739, test_f1: 0.5023
 epoch: 20, train_loss: 0.9227, test_loss: 1.0361, test_f1: 0.5104
 epoch: 21, train_loss: 0.9185, test_loss: 1.0734, test_f1: 0.5044
 epoch: 22, train_loss: 0.9218, test_loss: 1.0392, test_f1: 0.4898
 epoch: 23, train_loss: 0.9079, test_loss: 0.9288, test_f1: 0.5073
 epoch: 24, train_loss: 0.9056, test_loss: 0.9635, test_f1: 0.4842
 epoch: 25, train_loss: 0.8937, test_loss: 0.9890, test_f1: 0.5076
 epoch: 26, train_loss: 0.8822, test_loss: 0.9675, test_f1: 0.5102
 epoch: 27, train_loss: 0.8900, test_loss: 1.0466, test_f1: 0.4821
 epoch: 28, train_loss: 0.8781, test_loss: 0.9953, test_f1: 0.5354
 epoch: 29, train_loss: 0.8833, test_loss: 0.9903, test_f1: 0.5293
 epoch: 30, train_loss: 0.8616, test_loss: 0.9640, test_f1: 0.5105
 epoch: 31, train_loss: 0.8686, test_loss: 0.9628, test_f1: 0.5162
 epoch: 32, train_loss: 0.8753, test_loss: 1.0256, test_f1: 0.5101
 epoch: 33, train_loss: 0.8589, test_loss: 0.9679, test_f1: 0.5326
 epoch: 34, train_loss: 0.8620, test_loss: 1.1112, test_f1: 0.4896
 epoch: 35, train_loss: 0.8695, test_loss: 0.9780, test_f1: 0.5134
 epoch: 36, train_loss: 0.8625, test_loss: 1.0813, test_f1: 0.5257
 epoch: 37, train_loss: 0.8575, test_loss: 1.0048, test_f1: 0.5241
 epoch: 38, train_loss: 0.8508, test_loss: 1.0930, test_f1: 0.5015
 epoch: 39, train_loss: 0.8475, test_loss: 0.9694, test_f1: 0.5561
 epoch: 40, train_loss: 0.8319, test_loss: 1.0118, test_f1: 0.5552
 epoch: 41, train_loss: 0.8408, test_loss: 0.9935, test_f1: 0.4882
 epoch: 42, train_loss: 0.8357, test_loss: 1.0063, test_f1: 0.5202
 epoch: 43, train_loss: 0.8311, test_loss: 1.0117, test_f1: 0.5213
 epoch: 44, train_loss: 0.8241, test_loss: 1.1063, test_f1: 0.4989
 epoch: 45, train_loss: 0.8222, test_loss: 0.9464, test_f1: 0.5458
 epoch: 46, train_loss: 0.8207, test_loss: 1.0624, test_f1: 0.5594
 epoch: 47, train_loss: 0.8191, test_loss: 1.0260, test_f1: 0.5530
 epoch: 48, train_loss: 0.8126, test_loss: 0.9807, test_f1: 0.5164
 epoch: 49, train_loss: 0.8209, test_loss: 1.2092, test_f1: 0.5449
 epoch: 50, train_loss: 0.8292, test_loss: 1.0168, test_f1: 0.5649
 epoch: 51, train_loss: 0.8030, test_loss: 0.9829, test_f1: 0.5510
 epoch: 52, train_loss: 0.7817, test_loss: 1.0409, test_f1: 0.5589
 epoch: 53, train_loss: 0.7575, test_loss: 0.9547, test_f1: 0.5381
 epoch: 54, train_loss: 0.7797, test_loss: 1.0485, test_f1: 0.5282
 epoch: 55, train_loss: 0.7649, test_loss: 1.1448, test_f1: 0.5256
 epoch: 56, train_loss: 0.7549, test_loss: 1.1315, test_f1: 0.5645
 epoch: 57, train_loss: 0.7515, test_loss: 1.0646, test_f1: 0.5818
 epoch: 58, train_loss: 0.7511, test_loss: 1.1510, test_f1: 0.5388
 epoch: 59, train_loss: 0.7409, test_loss: 1.0358, test_f1: 0.5556
 epoch: 60, train_loss: 0.8081, test_loss: 0.9047, test_f1: 0.5596
 epoch: 61, train_loss: 0.7878, test_loss: 0.9964, test_f1: 0.5369
 epoch: 62, train_loss: 0.7463, test_loss: 1.0553, test_f1: 0.5604
 epoch: 63, train_loss: 0.7489, test_loss: 0.9774, test_f1: 0.5870
 epoch: 64, train_loss: 0.7333, test_loss: 1.0977, test_f1: 0.5431
 epoch: 65, train_loss: 0.7384, test_loss: 0.9116, test_f1: 0.5770
 epoch: 66, train_loss: 0.7446, test_loss: 0.9456, test_f1: 0.5788
 epoch: 67, train_loss: 0.7460, test_loss: 1.0150, test_f1: 0.5831
 epoch: 68, train_loss: 0.7347, test_loss: 1.0587, test_f1: 0.5445
 epoch: 69, train_loss: 0.7217, test_loss: 0.9935, test_f1: 0.5765
 epoch: 70, train_loss: 0.7262, test_loss: 1.0026, test_f1: 0.5770
 epoch: 71, train_loss: 0.7289, test_loss: 1.0615, test_f1: 0.5710
 epoch: 72, train_loss: 0.7168, test_loss: 1.0382, test_f1: 0.5461
 epoch: 73, train_loss: 0.7138, test_loss: 1.0905, test_f1: 0.5476
 epoch: 74, train_loss: 0.7116, test_loss: 1.1172, test_f1: 0.5632
 epoch: 75, train_loss: 0.7085, test_loss: 1.2252, test_f1: 0.5346
 epoch: 76, train_loss: 0.7189, test_loss: 1.0605, test_f1: 0.5818
 epoch: 77, train_loss: 0.7228, test_loss: 1.0204, test_f1: 0.5658
 epoch: 78, train_loss: 0.7406, test_loss: 0.9811, test_f1: 0.5647
 epoch: 79, train_loss: 0.7238, test_loss: 1.0033, test_f1: 0.5691
 epoch: 80, train_loss: 0.7041, test_loss: 1.1306, test_f1: 0.5394
 epoch: 81, train_loss: 0.7071, test_loss: 1.0037, test_f1: 0.5574
 epoch: 82, train_loss: 0.6968, test_loss: 1.0237, test_f1: 0.5723
 epoch: 83, train_loss: 0.7113, test_loss: 1.1104, test_f1: 0.5616
 epoch: 84, train_loss: 0.6943, test_loss: 1.1258, test_f1: 0.5461
 epoch: 85, train_loss: 0.7088, test_loss: 1.0015, test_f1: 0.5711
 epoch: 86, train_loss: 0.6894, test_loss: 1.2227, test_f1: 0.5266
 epoch: 87, train_loss: 0.6724, test_loss: 0.9975, test_f1: 0.5684
 epoch: 88, train_loss: 0.6938, test_loss: 1.1280, test_f1: 0.5583
 epoch: 89, train_loss: 0.7063, test_loss: 1.0303, test_f1: 0.5478
 epoch: 90, train_loss: 0.7566, test_loss: 0.9607, test_f1: 0.5624
 epoch: 91, train_loss: 0.7301, test_loss: 1.0025, test_f1: 0.5429
 epoch: 92, train_loss: 0.6952, test_loss: 1.1046, test_f1: 0.5574
 epoch: 93, train_loss: 0.6995, test_loss: 1.0806, test_f1: 0.5627
 epoch: 94, train_loss: 0.7060, test_loss: 1.2042, test_f1: 0.5728
 epoch: 95, train_loss: 0.6943, test_loss: 1.0325, test_f1: 0.5552
 epoch: 96, train_loss: 0.6961, test_loss: 1.0707, test_f1: 0.5870
 epoch: 97, train_loss: 0.6700, test_loss: 1.0534, test_f1: 0.5645
 epoch: 98, train_loss: 0.6659, test_loss: 1.0343, test_f1: 0.5971
 epoch: 99, train_loss: 0.6872, test_loss: 1.1549, test_f1: 0.5398
##################ITERATION #9 ****************************************
 epoch: 0, train_loss: 1.2841, test_loss: 1.1968, test_f1: 0.3804
 epoch: 1, train_loss: 1.1770, test_loss: 1.0756, test_f1: 0.4693
 epoch: 2, train_loss: 1.1303, test_loss: 1.1055, test_f1: 0.4410
 epoch: 3, train_loss: 1.1037, test_loss: 1.0052, test_f1: 0.5192
 epoch: 4, train_loss: 1.0880, test_loss: 0.9724, test_f1: 0.5148
 epoch: 5, train_loss: 1.0501, test_loss: 0.9762, test_f1: 0.5146
 epoch: 6, train_loss: 1.0335, test_loss: 0.9549, test_f1: 0.4799
 epoch: 7, train_loss: 1.0237, test_loss: 0.9598, test_f1: 0.4854
 epoch: 8, train_loss: 1.0230, test_loss: 1.0561, test_f1: 0.4848
 epoch: 9, train_loss: 1.0012, test_loss: 0.9623, test_f1: 0.4579
 epoch: 10, train_loss: 0.9946, test_loss: 0.8764, test_f1: 0.5413
 epoch: 11, train_loss: 0.9876, test_loss: 1.0241, test_f1: 0.4867
 epoch: 12, train_loss: 0.9665, test_loss: 0.9674, test_f1: 0.5370
 epoch: 13, train_loss: 0.9743, test_loss: 0.9833, test_f1: 0.5136
 epoch: 14, train_loss: 0.9549, test_loss: 1.0226, test_f1: 0.4724
 epoch: 15, train_loss: 0.9636, test_loss: 1.0050, test_f1: 0.5117
 epoch: 16, train_loss: 0.9675, test_loss: 0.9278, test_f1: 0.4433
 epoch: 17, train_loss: 0.9341, test_loss: 0.9624, test_f1: 0.4928
 epoch: 18, train_loss: 0.9498, test_loss: 0.9084, test_f1: 0.4927
 epoch: 19, train_loss: 0.9469, test_loss: 0.9476, test_f1: 0.4610
 epoch: 20, train_loss: 0.9253, test_loss: 0.9763, test_f1: 0.5029
 epoch: 21, train_loss: 0.9187, test_loss: 1.0547, test_f1: 0.4932
 epoch: 22, train_loss: 0.9332, test_loss: 1.0145, test_f1: 0.4921
 epoch: 23, train_loss: 0.9118, test_loss: 1.0128, test_f1: 0.4890
 epoch: 24, train_loss: 0.8997, test_loss: 0.9448, test_f1: 0.5376
 epoch: 25, train_loss: 0.8919, test_loss: 0.9482, test_f1: 0.5281
 epoch: 26, train_loss: 0.8789, test_loss: 0.9057, test_f1: 0.5515
 epoch: 27, train_loss: 0.9007, test_loss: 0.9581, test_f1: 0.5129
 epoch: 28, train_loss: 0.8860, test_loss: 0.9711, test_f1: 0.5307
 epoch: 29, train_loss: 0.8730, test_loss: 0.9872, test_f1: 0.5258
 epoch: 30, train_loss: 0.8799, test_loss: 0.9283, test_f1: 0.5203
 epoch: 31, train_loss: 0.8769, test_loss: 1.0316, test_f1: 0.5011
 epoch: 32, train_loss: 0.8750, test_loss: 0.8960, test_f1: 0.5195
 epoch: 33, train_loss: 0.8744, test_loss: 0.9494, test_f1: 0.5111
 epoch: 34, train_loss: 0.8610, test_loss: 0.9489, test_f1: 0.5227
 epoch: 35, train_loss: 0.8701, test_loss: 1.0034, test_f1: 0.5302
 epoch: 36, train_loss: 0.8631, test_loss: 1.0143, test_f1: 0.5296
 epoch: 37, train_loss: 0.8605, test_loss: 0.9711, test_f1: 0.5315
 epoch: 38, train_loss: 0.8394, test_loss: 0.9486, test_f1: 0.5141
 epoch: 39, train_loss: 0.8678, test_loss: 0.9847, test_f1: 0.5415
 epoch: 40, train_loss: 0.8466, test_loss: 0.9780, test_f1: 0.5262
 epoch: 41, train_loss: 0.8500, test_loss: 0.9903, test_f1: 0.5095
 epoch: 42, train_loss: 0.8451, test_loss: 0.9816, test_f1: 0.5502
 epoch: 43, train_loss: 0.8434, test_loss: 0.9896, test_f1: 0.5215
 epoch: 44, train_loss: 0.8513, test_loss: 0.9496, test_f1: 0.5426
 epoch: 45, train_loss: 0.8386, test_loss: 0.9524, test_f1: 0.5474
 epoch: 46, train_loss: 0.8292, test_loss: 0.9244, test_f1: 0.5567
 epoch: 47, train_loss: 0.8299, test_loss: 0.9495, test_f1: 0.5536
 epoch: 48, train_loss: 0.8144, test_loss: 0.9278, test_f1: 0.5450
 epoch: 49, train_loss: 0.8118, test_loss: 0.9497, test_f1: 0.5559
 epoch: 50, train_loss: 0.8082, test_loss: 0.9553, test_f1: 0.5287
 epoch: 51, train_loss: 0.7900, test_loss: 0.9314, test_f1: 0.5636
 epoch: 52, train_loss: 0.7733, test_loss: 0.8972, test_f1: 0.5477
 epoch: 53, train_loss: 0.7571, test_loss: 0.9635, test_f1: 0.5356
 epoch: 54, train_loss: 0.7622, test_loss: 0.9504, test_f1: 0.5547
 epoch: 55, train_loss: 0.7505, test_loss: 0.9433, test_f1: 0.5575
 epoch: 56, train_loss: 0.7578, test_loss: 0.9123, test_f1: 0.5698
 epoch: 57, train_loss: 0.7735, test_loss: 0.9357, test_f1: 0.5531
 epoch: 58, train_loss: 0.7562, test_loss: 0.9417, test_f1: 0.5618
 epoch: 59, train_loss: 0.7549, test_loss: 0.9605, test_f1: 0.5541
 epoch: 60, train_loss: 0.7612, test_loss: 0.9364, test_f1: 0.5541
 epoch: 61, train_loss: 0.7432, test_loss: 0.9322, test_f1: 0.5562
 epoch: 62, train_loss: 0.7417, test_loss: 0.9084, test_f1: 0.5669
 epoch: 63, train_loss: 0.7403, test_loss: 0.9680, test_f1: 0.5922
 epoch: 64, train_loss: 0.7567, test_loss: 0.9885, test_f1: 0.5568
 epoch: 65, train_loss: 0.7416, test_loss: 0.9365, test_f1: 0.5664
 epoch: 66, train_loss: 0.7421, test_loss: 0.9299, test_f1: 0.5506
 epoch: 67, train_loss: 0.7344, test_loss: 1.0221, test_f1: 0.5366
 epoch: 68, train_loss: 0.7394, test_loss: 0.9451, test_f1: 0.5585
 epoch: 69, train_loss: 0.7408, test_loss: 0.9745, test_f1: 0.5521
 epoch: 70, train_loss: 0.7353, test_loss: 0.9494, test_f1: 0.5723
 epoch: 71, train_loss: 0.7346, test_loss: 0.9985, test_f1: 0.5463
 epoch: 72, train_loss: 0.7383, test_loss: 0.9456, test_f1: 0.5576
 epoch: 73, train_loss: 0.7431, test_loss: 0.9669, test_f1: 0.5721
 epoch: 74, train_loss: 0.7359, test_loss: 0.9756, test_f1: 0.5657
 epoch: 75, train_loss: 0.7288, test_loss: 0.9453, test_f1: 0.5425
 epoch: 76, train_loss: 0.7334, test_loss: 0.9783, test_f1: 0.5571
 epoch: 77, train_loss: 0.7604, test_loss: 0.9951, test_f1: 0.5383
 epoch: 78, train_loss: 0.7312, test_loss: 0.9583, test_f1: 0.5654
 epoch: 79, train_loss: 0.7179, test_loss: 0.9531, test_f1: 0.5679
 epoch: 80, train_loss: 0.7377, test_loss: 0.9039, test_f1: 0.5737
 epoch: 81, train_loss: 0.7171, test_loss: 0.9799, test_f1: 0.5662
 epoch: 82, train_loss: 0.7094, test_loss: 0.9614, test_f1: 0.5629
 epoch: 83, train_loss: 0.7061, test_loss: 0.9602, test_f1: 0.5474
 epoch: 84, train_loss: 0.7038, test_loss: 0.9829, test_f1: 0.5556
 epoch: 85, train_loss: 0.7232, test_loss: 0.9213, test_f1: 0.5667
 epoch: 86, train_loss: 0.7072, test_loss: 0.9761, test_f1: 0.5618
 epoch: 87, train_loss: 0.7039, test_loss: 0.9843, test_f1: 0.5683
 epoch: 88, train_loss: 0.6905, test_loss: 1.0026, test_f1: 0.5769
 epoch: 89, train_loss: 0.7018, test_loss: 0.9404, test_f1: 0.5570
 epoch: 90, train_loss: 0.7027, test_loss: 0.9685, test_f1: 0.5661
 epoch: 91, train_loss: 0.6820, test_loss: 0.9592, test_f1: 0.5542
 epoch: 92, train_loss: 0.6854, test_loss: 1.0426, test_f1: 0.5626
 epoch: 93, train_loss: 0.7105, test_loss: 1.0145, test_f1: 0.5662
 epoch: 94, train_loss: 0.7010, test_loss: 1.0206, test_f1: 0.5535
 epoch: 95, train_loss: 0.6978, test_loss: 1.0128, test_f1: 0.5687
 epoch: 96, train_loss: 0.6893, test_loss: 1.0768, test_f1: 0.5768
 epoch: 97, train_loss: 0.6836, test_loss: 1.1037, test_f1: 0.5646
 epoch: 98, train_loss: 0.6841, test_loss: 0.9944, test_f1: 0.5440
 epoch: 99, train_loss: 0.6821, test_loss: 1.0614, test_f1: 0.5344

Training completed in 743.23 seconds
Best F1: 0.6208 at epoch 86
Mean F1 across iterations: 0.5946  0.0136
========================FINAL RESULTS================================
FEGIN weighted F1: 0.6208  0.0136
python main.py --data ltspice_examples --representation component_component --model FEGIN --layers 5 --hiddens 32 --batch_size 64 --lr 0.01 --emb_size 250 --epochs 100 --save_appendix component_component_L5_H32_BS64_LR0.01_E250 --no_val
-----



STDERR:
  File "main.py", line 370, in <module>
    main()
  File "main.py", line 254, in main
    dataset = dataset_class(
  File "/home/philip/projects/ltspice_examples_code_repo/Circuit-Completion-Using-GNNs/component_classification_with_link_prediction_head/evaluation/FEGIN/kernel/circuit_datasets.py", line 15, in __init__
    self.data, self.slices = torch.load(self.processed_paths[0])
  File "/home/philip/.local/lib/python3.8/site-packages/torch/serialization.py", line 1040, in load
    warnings.warn(
  File "/usr/lib/python3.8/warnings.py", line 109, in _showwarnmsg
    sw(msg.message, msg.category, msg.filename, msg.lineno,
  File "main.py", line 47, in warn_with_traceback
    traceback.print_stack(file=log)
/home/philip/projects/ltspice_examples_code_repo/Circuit-Completion-Using-GNNs/component_classification_with_link_prediction_head/evaluation/FEGIN/kernel/circuit_datasets.py:15: FutureWarning: You are using `torch.load` with `weights_only=False` (the current default value), which uses the default pickle module implicitly. It is possible to construct malicious pickle data which will execute arbitrary code during unpickling (See https://github.com/pytorch/pytorch/blob/main/SECURITY.md#untrusted-models for more details). In a future release, the default value for `weights_only` will be flipped to `True`. This limits the functions that could be executed during unpickling. Arbitrary objects will no longer be allowed to be loaded via this mode unless they are explicitly allowlisted by the user via `torch.serialization.add_safe_globals`. We recommend you start setting `weights_only=True` for any use case where you don't have full control of the loaded file. Please open an issue on GitHub for any issues related to this experimental feature.
  self.data, self.slices = torch.load(self.processed_paths[0])
