STDOUT:
Results will be saved in /home/philip/projects/ltspice_examples_code_repo/Circuit-Completion-Using-GNNs/component_classification_with_link_prediction_head/evaluation/FEGIN/results/model_FEGIN_dataset_ltspice_examples
Command line input: python main.py --data ltspice_examples --representation component_net --model FEGIN --layers 3 --hiddens 32 --batch_size 64 --lr 0.001 --emb_size 128 --epochs 100 --save_appendix component_net_L3_H32_BS64_LR0.001_E128 --no_val
 is saved.
-----
ltspice_examples - FEGIN
Using 3 layers, 32 hidden units, h = 2
Loading component_net representation dataset
ENTERED
Training FEGIN on component_net representation
Train: 3558, Test: 846
##################ITERATION #0 ****************************************
 epoch: 0, train_loss: 1.3120, test_loss: 1.2347, test_f1: 0.2382
 epoch: 1, train_loss: 1.1890, test_loss: 1.1194, test_f1: 0.3856
 epoch: 2, train_loss: 1.1162, test_loss: 1.0970, test_f1: 0.4319
 epoch: 3, train_loss: 1.0706, test_loss: 1.0931, test_f1: 0.4285
 epoch: 4, train_loss: 1.0101, test_loss: 1.0896, test_f1: 0.4402
 epoch: 5, train_loss: 0.9865, test_loss: 0.9498, test_f1: 0.5080
 epoch: 6, train_loss: 0.9623, test_loss: 1.0289, test_f1: 0.4516
 epoch: 7, train_loss: 0.9536, test_loss: 0.9521, test_f1: 0.4920
 epoch: 8, train_loss: 0.9380, test_loss: 0.9576, test_f1: 0.4915
 epoch: 9, train_loss: 0.9246, test_loss: 0.9445, test_f1: 0.5073
 epoch: 10, train_loss: 0.9207, test_loss: 0.9457, test_f1: 0.5004
 epoch: 11, train_loss: 0.9180, test_loss: 0.9534, test_f1: 0.5183
 epoch: 12, train_loss: 0.9030, test_loss: 0.9459, test_f1: 0.4989
 epoch: 13, train_loss: 0.8936, test_loss: 0.9312, test_f1: 0.5192
 epoch: 14, train_loss: 0.8920, test_loss: 0.9635, test_f1: 0.5160
 epoch: 15, train_loss: 0.8806, test_loss: 0.9533, test_f1: 0.4989
 epoch: 16, train_loss: 0.8683, test_loss: 0.9489, test_f1: 0.5156
 epoch: 17, train_loss: 0.8710, test_loss: 0.9365, test_f1: 0.5222
 epoch: 18, train_loss: 0.8610, test_loss: 0.9376, test_f1: 0.5209
 epoch: 19, train_loss: 0.8524, test_loss: 0.9509, test_f1: 0.5249
 epoch: 20, train_loss: 0.8538, test_loss: 0.9506, test_f1: 0.5574
 epoch: 21, train_loss: 0.8447, test_loss: 0.9337, test_f1: 0.5629
 epoch: 22, train_loss: 0.8241, test_loss: 0.9147, test_f1: 0.5668
 epoch: 23, train_loss: 0.8342, test_loss: 0.9176, test_f1: 0.5710
 epoch: 24, train_loss: 0.8207, test_loss: 0.9424, test_f1: 0.5595
 epoch: 25, train_loss: 0.8156, test_loss: 0.9679, test_f1: 0.5309
 epoch: 26, train_loss: 0.8042, test_loss: 0.9367, test_f1: 0.5682
 epoch: 27, train_loss: 0.8035, test_loss: 0.9277, test_f1: 0.5563
 epoch: 28, train_loss: 0.7991, test_loss: 0.9390, test_f1: 0.5566
 epoch: 29, train_loss: 0.7899, test_loss: 0.9716, test_f1: 0.5214
 epoch: 30, train_loss: 0.7972, test_loss: 0.9539, test_f1: 0.5691
 epoch: 31, train_loss: 0.7813, test_loss: 0.9896, test_f1: 0.5603
 epoch: 32, train_loss: 0.7776, test_loss: 0.9714, test_f1: 0.5910
 epoch: 33, train_loss: 0.7783, test_loss: 1.0221, test_f1: 0.5507
 epoch: 34, train_loss: 0.7736, test_loss: 1.0219, test_f1: 0.5281
 epoch: 35, train_loss: 0.7662, test_loss: 0.9709, test_f1: 0.5248
 epoch: 36, train_loss: 0.7569, test_loss: 0.9410, test_f1: 0.5539
 epoch: 37, train_loss: 0.7713, test_loss: 0.9822, test_f1: 0.5571
 epoch: 38, train_loss: 0.7497, test_loss: 0.9892, test_f1: 0.5479
 epoch: 39, train_loss: 0.7547, test_loss: 0.9944, test_f1: 0.5683
 epoch: 40, train_loss: 0.7376, test_loss: 0.9843, test_f1: 0.5604
 epoch: 41, train_loss: 0.7434, test_loss: 1.0157, test_f1: 0.5838
 epoch: 42, train_loss: 0.7369, test_loss: 0.9259, test_f1: 0.5807
 epoch: 43, train_loss: 0.7266, test_loss: 0.9287, test_f1: 0.6023
 epoch: 44, train_loss: 0.7220, test_loss: 0.9723, test_f1: 0.5831
 epoch: 45, train_loss: 0.7229, test_loss: 0.9485, test_f1: 0.5760
 epoch: 46, train_loss: 0.7253, test_loss: 0.9906, test_f1: 0.5981
 epoch: 47, train_loss: 0.7245, test_loss: 0.9694, test_f1: 0.6002
 epoch: 48, train_loss: 0.7208, test_loss: 0.9840, test_f1: 0.5935
 epoch: 49, train_loss: 0.7030, test_loss: 0.9876, test_f1: 0.6016
 epoch: 50, train_loss: 0.7114, test_loss: 1.0057, test_f1: 0.5737
 epoch: 51, train_loss: 0.6820, test_loss: 0.9635, test_f1: 0.5767
 epoch: 52, train_loss: 0.6694, test_loss: 0.9592, test_f1: 0.6137
 epoch: 53, train_loss: 0.6616, test_loss: 0.9798, test_f1: 0.6118
 epoch: 54, train_loss: 0.6708, test_loss: 0.9628, test_f1: 0.6152
 epoch: 55, train_loss: 0.6700, test_loss: 0.9564, test_f1: 0.6001
 epoch: 56, train_loss: 0.6701, test_loss: 0.9604, test_f1: 0.6091
 epoch: 57, train_loss: 0.6684, test_loss: 1.0088, test_f1: 0.5835
 epoch: 58, train_loss: 0.6612, test_loss: 0.9960, test_f1: 0.6359
 epoch: 59, train_loss: 0.6647, test_loss: 1.0107, test_f1: 0.6217
 epoch: 60, train_loss: 0.6633, test_loss: 1.0196, test_f1: 0.6063
 epoch: 61, train_loss: 0.6616, test_loss: 0.9975, test_f1: 0.6180
 epoch: 62, train_loss: 0.6518, test_loss: 1.0057, test_f1: 0.6176
 epoch: 63, train_loss: 0.6465, test_loss: 1.0002, test_f1: 0.6108
 epoch: 64, train_loss: 0.6638, test_loss: 1.0012, test_f1: 0.6328
 epoch: 65, train_loss: 0.6606, test_loss: 0.9604, test_f1: 0.6336
 epoch: 66, train_loss: 0.6525, test_loss: 1.0061, test_f1: 0.6316
 epoch: 67, train_loss: 0.6528, test_loss: 1.0346, test_f1: 0.6034
 epoch: 68, train_loss: 0.6443, test_loss: 0.9638, test_f1: 0.6296
 epoch: 69, train_loss: 0.6461, test_loss: 1.0156, test_f1: 0.6225
 epoch: 70, train_loss: 0.6395, test_loss: 0.9827, test_f1: 0.6181
 epoch: 71, train_loss: 0.6465, test_loss: 0.9897, test_f1: 0.6292
 epoch: 72, train_loss: 0.6326, test_loss: 0.9928, test_f1: 0.6332
 epoch: 73, train_loss: 0.6397, test_loss: 0.9636, test_f1: 0.6270
 epoch: 74, train_loss: 0.6320, test_loss: 0.9855, test_f1: 0.6143
 epoch: 75, train_loss: 0.6222, test_loss: 0.9865, test_f1: 0.6309
 epoch: 76, train_loss: 0.6236, test_loss: 1.0240, test_f1: 0.6162
 epoch: 77, train_loss: 0.6244, test_loss: 1.0132, test_f1: 0.6287
 epoch: 78, train_loss: 0.6227, test_loss: 1.0056, test_f1: 0.6222
 epoch: 79, train_loss: 0.6257, test_loss: 0.9964, test_f1: 0.6124
 epoch: 80, train_loss: 0.6291, test_loss: 1.0344, test_f1: 0.6070
 epoch: 81, train_loss: 0.6243, test_loss: 0.9600, test_f1: 0.6239
 epoch: 82, train_loss: 0.6301, test_loss: 1.0068, test_f1: 0.6357
 epoch: 83, train_loss: 0.6136, test_loss: 1.0430, test_f1: 0.6340
 epoch: 84, train_loss: 0.6197, test_loss: 1.0328, test_f1: 0.6270
 epoch: 85, train_loss: 0.6059, test_loss: 1.0159, test_f1: 0.6479
 epoch: 86, train_loss: 0.6183, test_loss: 0.9751, test_f1: 0.6232
 epoch: 87, train_loss: 0.6049, test_loss: 1.0104, test_f1: 0.6240
 epoch: 88, train_loss: 0.6101, test_loss: 1.0102, test_f1: 0.6320
 epoch: 89, train_loss: 0.6038, test_loss: 1.0064, test_f1: 0.6287
 epoch: 90, train_loss: 0.6144, test_loss: 0.9774, test_f1: 0.6272
 epoch: 91, train_loss: 0.6096, test_loss: 1.0069, test_f1: 0.6360
 epoch: 92, train_loss: 0.6056, test_loss: 1.0557, test_f1: 0.6112
 epoch: 93, train_loss: 0.5856, test_loss: 1.0058, test_f1: 0.6340
 epoch: 94, train_loss: 0.5999, test_loss: 0.9977, test_f1: 0.6531
 epoch: 95, train_loss: 0.6072, test_loss: 1.0459, test_f1: 0.6257
 epoch: 96, train_loss: 0.6084, test_loss: 1.0709, test_f1: 0.6250
 epoch: 97, train_loss: 0.6004, test_loss: 1.0127, test_f1: 0.6490
 epoch: 98, train_loss: 0.5841, test_loss: 1.0795, test_f1: 0.6188
 epoch: 99, train_loss: 0.5875, test_loss: 1.0761, test_f1: 0.6335
##################ITERATION #1 ****************************************
 epoch: 0, train_loss: 1.2204, test_loss: 1.1448, test_f1: 0.4276
 epoch: 1, train_loss: 1.0889, test_loss: 1.0031, test_f1: 0.4453
 epoch: 2, train_loss: 1.0255, test_loss: 0.9588, test_f1: 0.4659
 epoch: 3, train_loss: 0.9954, test_loss: 0.9670, test_f1: 0.4797
 epoch: 4, train_loss: 0.9873, test_loss: 0.9376, test_f1: 0.4991
 epoch: 5, train_loss: 0.9582, test_loss: 0.9413, test_f1: 0.4912
 epoch: 6, train_loss: 0.9436, test_loss: 0.9553, test_f1: 0.4825
 epoch: 7, train_loss: 0.9385, test_loss: 0.9214, test_f1: 0.5144
 epoch: 8, train_loss: 0.9337, test_loss: 0.9623, test_f1: 0.4737
 epoch: 9, train_loss: 0.9321, test_loss: 0.9452, test_f1: 0.4957
 epoch: 10, train_loss: 0.9199, test_loss: 0.9396, test_f1: 0.4954
 epoch: 11, train_loss: 0.9186, test_loss: 0.9202, test_f1: 0.5003
 epoch: 12, train_loss: 0.9039, test_loss: 0.9347, test_f1: 0.4848
 epoch: 13, train_loss: 0.8924, test_loss: 0.9398, test_f1: 0.5021
 epoch: 14, train_loss: 0.8883, test_loss: 0.9520, test_f1: 0.5201
 epoch: 15, train_loss: 0.8848, test_loss: 0.9331, test_f1: 0.5008
 epoch: 16, train_loss: 0.8761, test_loss: 0.9307, test_f1: 0.5260
 epoch: 17, train_loss: 0.8728, test_loss: 0.8889, test_f1: 0.5174
 epoch: 18, train_loss: 0.8662, test_loss: 0.9617, test_f1: 0.5186
 epoch: 19, train_loss: 0.8667, test_loss: 1.0028, test_f1: 0.5241
 epoch: 20, train_loss: 0.8616, test_loss: 0.9485, test_f1: 0.5343
 epoch: 21, train_loss: 0.8587, test_loss: 0.9428, test_f1: 0.5116
 epoch: 22, train_loss: 0.8480, test_loss: 0.9681, test_f1: 0.5600
 epoch: 23, train_loss: 0.8436, test_loss: 0.9644, test_f1: 0.5200
 epoch: 24, train_loss: 0.8503, test_loss: 0.9612, test_f1: 0.5562
 epoch: 25, train_loss: 0.8363, test_loss: 0.9821, test_f1: 0.5188
 epoch: 26, train_loss: 0.8305, test_loss: 0.9680, test_f1: 0.5560
 epoch: 27, train_loss: 0.8209, test_loss: 0.9531, test_f1: 0.5855
 epoch: 28, train_loss: 0.8185, test_loss: 0.9685, test_f1: 0.5508
 epoch: 29, train_loss: 0.8260, test_loss: 0.9294, test_f1: 0.5559
 epoch: 30, train_loss: 0.8168, test_loss: 0.9023, test_f1: 0.5602
 epoch: 31, train_loss: 0.8102, test_loss: 0.9102, test_f1: 0.5920
 epoch: 32, train_loss: 0.7922, test_loss: 0.9619, test_f1: 0.5445
 epoch: 33, train_loss: 0.7980, test_loss: 0.9235, test_f1: 0.5657
 epoch: 34, train_loss: 0.7885, test_loss: 0.8954, test_f1: 0.5821
 epoch: 35, train_loss: 0.7927, test_loss: 0.9191, test_f1: 0.5512
 epoch: 36, train_loss: 0.7919, test_loss: 0.8881, test_f1: 0.5949
 epoch: 37, train_loss: 0.7737, test_loss: 0.9634, test_f1: 0.5520
 epoch: 38, train_loss: 0.7764, test_loss: 0.9380, test_f1: 0.5740
 epoch: 39, train_loss: 0.7771, test_loss: 0.9207, test_f1: 0.5993
 epoch: 40, train_loss: 0.7699, test_loss: 0.9821, test_f1: 0.5784
 epoch: 41, train_loss: 0.7568, test_loss: 0.9692, test_f1: 0.5844
 epoch: 42, train_loss: 0.7705, test_loss: 0.9487, test_f1: 0.6038
 epoch: 43, train_loss: 0.7646, test_loss: 0.9235, test_f1: 0.6062
 epoch: 44, train_loss: 0.7514, test_loss: 0.9623, test_f1: 0.5869
 epoch: 45, train_loss: 0.7474, test_loss: 0.9278, test_f1: 0.5976
 epoch: 46, train_loss: 0.7590, test_loss: 0.9347, test_f1: 0.5987
 epoch: 47, train_loss: 0.7464, test_loss: 0.9849, test_f1: 0.5961
 epoch: 48, train_loss: 0.7467, test_loss: 0.9771, test_f1: 0.6008
 epoch: 49, train_loss: 0.7306, test_loss: 0.9410, test_f1: 0.5930
 epoch: 50, train_loss: 0.7392, test_loss: 0.9819, test_f1: 0.5774
 epoch: 51, train_loss: 0.7175, test_loss: 0.9373, test_f1: 0.6022
 epoch: 52, train_loss: 0.7097, test_loss: 0.9597, test_f1: 0.6434
 epoch: 53, train_loss: 0.6984, test_loss: 0.9192, test_f1: 0.6079
 epoch: 54, train_loss: 0.7053, test_loss: 0.9470, test_f1: 0.6282
 epoch: 55, train_loss: 0.7059, test_loss: 0.9305, test_f1: 0.6038
 epoch: 56, train_loss: 0.7012, test_loss: 0.9429, test_f1: 0.6225
 epoch: 57, train_loss: 0.6969, test_loss: 0.9263, test_f1: 0.6174
 epoch: 58, train_loss: 0.6888, test_loss: 0.9389, test_f1: 0.6278
 epoch: 59, train_loss: 0.6986, test_loss: 0.9278, test_f1: 0.6469
 epoch: 60, train_loss: 0.6777, test_loss: 0.9642, test_f1: 0.6129
 epoch: 61, train_loss: 0.6885, test_loss: 0.9391, test_f1: 0.6246
 epoch: 62, train_loss: 0.6860, test_loss: 0.9314, test_f1: 0.6598
 epoch: 63, train_loss: 0.6736, test_loss: 0.9367, test_f1: 0.6568
 epoch: 64, train_loss: 0.6797, test_loss: 0.9322, test_f1: 0.6488
 epoch: 65, train_loss: 0.6792, test_loss: 0.9530, test_f1: 0.6219
 epoch: 66, train_loss: 0.6795, test_loss: 0.9468, test_f1: 0.6447
 epoch: 67, train_loss: 0.6742, test_loss: 0.9565, test_f1: 0.6232
 epoch: 68, train_loss: 0.6662, test_loss: 0.9066, test_f1: 0.6425
 epoch: 69, train_loss: 0.6734, test_loss: 0.9362, test_f1: 0.6442
 epoch: 70, train_loss: 0.6666, test_loss: 0.9924, test_f1: 0.6342
 epoch: 71, train_loss: 0.6670, test_loss: 0.9267, test_f1: 0.6569
 epoch: 72, train_loss: 0.6676, test_loss: 0.9370, test_f1: 0.6494
 epoch: 73, train_loss: 0.6534, test_loss: 0.9223, test_f1: 0.6481
 epoch: 74, train_loss: 0.6638, test_loss: 0.9611, test_f1: 0.6569
 epoch: 75, train_loss: 0.6612, test_loss: 0.9455, test_f1: 0.6542
 epoch: 76, train_loss: 0.6480, test_loss: 0.9829, test_f1: 0.6492
 epoch: 77, train_loss: 0.6431, test_loss: 0.9565, test_f1: 0.6450
 epoch: 78, train_loss: 0.6539, test_loss: 0.9437, test_f1: 0.6598
 epoch: 79, train_loss: 0.6420, test_loss: 0.9289, test_f1: 0.6540
 epoch: 80, train_loss: 0.6452, test_loss: 0.9587, test_f1: 0.6530
 epoch: 81, train_loss: 0.6498, test_loss: 0.9379, test_f1: 0.6463
 epoch: 82, train_loss: 0.6434, test_loss: 1.0227, test_f1: 0.6305
 epoch: 83, train_loss: 0.6448, test_loss: 0.9998, test_f1: 0.6597
 epoch: 84, train_loss: 0.6413, test_loss: 0.9677, test_f1: 0.6727
 epoch: 85, train_loss: 0.6302, test_loss: 0.9760, test_f1: 0.6542
 epoch: 86, train_loss: 0.6411, test_loss: 0.9512, test_f1: 0.6611
 epoch: 87, train_loss: 0.6445, test_loss: 0.9942, test_f1: 0.6599
 epoch: 88, train_loss: 0.6333, test_loss: 0.9492, test_f1: 0.6687
 epoch: 89, train_loss: 0.6456, test_loss: 1.0149, test_f1: 0.6533
 epoch: 90, train_loss: 0.6428, test_loss: 0.9731, test_f1: 0.6486
 epoch: 91, train_loss: 0.6356, test_loss: 0.9985, test_f1: 0.6574
 epoch: 92, train_loss: 0.6243, test_loss: 0.9624, test_f1: 0.6659
 epoch: 93, train_loss: 0.6139, test_loss: 0.9940, test_f1: 0.6623
 epoch: 94, train_loss: 0.6248, test_loss: 0.9918, test_f1: 0.6662
 epoch: 95, train_loss: 0.6107, test_loss: 0.9878, test_f1: 0.6669
 epoch: 96, train_loss: 0.6304, test_loss: 0.9492, test_f1: 0.6593
 epoch: 97, train_loss: 0.6218, test_loss: 0.9932, test_f1: 0.6605
 epoch: 98, train_loss: 0.6210, test_loss: 0.9973, test_f1: 0.6685
 epoch: 99, train_loss: 0.6103, test_loss: 1.0144, test_f1: 0.6800
##################ITERATION #2 ****************************************
 epoch: 0, train_loss: 1.1836, test_loss: 1.0703, test_f1: 0.4469
 epoch: 1, train_loss: 1.0398, test_loss: 1.0004, test_f1: 0.4740
 epoch: 2, train_loss: 1.0046, test_loss: 0.9702, test_f1: 0.5028
 epoch: 3, train_loss: 0.9758, test_loss: 0.9810, test_f1: 0.4914
 epoch: 4, train_loss: 0.9534, test_loss: 0.9582, test_f1: 0.5601
 epoch: 5, train_loss: 0.9340, test_loss: 0.9684, test_f1: 0.5094
 epoch: 6, train_loss: 0.9272, test_loss: 0.9851, test_f1: 0.5252
 epoch: 7, train_loss: 0.9078, test_loss: 0.9996, test_f1: 0.5136
 epoch: 8, train_loss: 0.9172, test_loss: 0.9330, test_f1: 0.5493
 epoch: 9, train_loss: 0.8914, test_loss: 0.9543, test_f1: 0.5480
 epoch: 10, train_loss: 0.8897, test_loss: 0.9473, test_f1: 0.5404
 epoch: 11, train_loss: 0.8733, test_loss: 0.9684, test_f1: 0.5540
 epoch: 12, train_loss: 0.8728, test_loss: 0.9949, test_f1: 0.5491
 epoch: 13, train_loss: 0.8545, test_loss: 0.9555, test_f1: 0.5320
 epoch: 14, train_loss: 0.8567, test_loss: 0.9314, test_f1: 0.5588
 epoch: 15, train_loss: 0.8438, test_loss: 0.9673, test_f1: 0.5482
 epoch: 16, train_loss: 0.8342, test_loss: 0.9436, test_f1: 0.5737
 epoch: 17, train_loss: 0.8307, test_loss: 0.9194, test_f1: 0.5622
 epoch: 18, train_loss: 0.8292, test_loss: 0.9629, test_f1: 0.5730
 epoch: 19, train_loss: 0.8314, test_loss: 0.9615, test_f1: 0.5676
 epoch: 20, train_loss: 0.8198, test_loss: 0.9796, test_f1: 0.5738
 epoch: 21, train_loss: 0.8198, test_loss: 0.9176, test_f1: 0.5931
 epoch: 22, train_loss: 0.8054, test_loss: 0.9227, test_f1: 0.5930
 epoch: 23, train_loss: 0.8014, test_loss: 0.9873, test_f1: 0.5628
 epoch: 24, train_loss: 0.7954, test_loss: 0.9304, test_f1: 0.5644
 epoch: 25, train_loss: 0.7965, test_loss: 0.9470, test_f1: 0.5743
 epoch: 26, train_loss: 0.7825, test_loss: 1.0005, test_f1: 0.5764
 epoch: 27, train_loss: 0.7739, test_loss: 0.9556, test_f1: 0.5880
 epoch: 28, train_loss: 0.7727, test_loss: 0.9823, test_f1: 0.5800
 epoch: 29, train_loss: 0.7792, test_loss: 1.0659, test_f1: 0.5140
 epoch: 30, train_loss: 0.7758, test_loss: 0.9539, test_f1: 0.5635
 epoch: 31, train_loss: 0.7708, test_loss: 0.9135, test_f1: 0.6089
 epoch: 32, train_loss: 0.7620, test_loss: 0.9761, test_f1: 0.6000
 epoch: 33, train_loss: 0.7537, test_loss: 0.9501, test_f1: 0.5831
 epoch: 34, train_loss: 0.7354, test_loss: 0.9320, test_f1: 0.5833
 epoch: 35, train_loss: 0.7466, test_loss: 0.9532, test_f1: 0.6103
 epoch: 36, train_loss: 0.7308, test_loss: 0.9472, test_f1: 0.5844
 epoch: 37, train_loss: 0.7228, test_loss: 0.9616, test_f1: 0.6099
 epoch: 38, train_loss: 0.7282, test_loss: 0.9499, test_f1: 0.5843
 epoch: 39, train_loss: 0.7460, test_loss: 0.9512, test_f1: 0.5989
 epoch: 40, train_loss: 0.7317, test_loss: 0.9611, test_f1: 0.5875
 epoch: 41, train_loss: 0.7226, test_loss: 0.9282, test_f1: 0.5994
 epoch: 42, train_loss: 0.7161, test_loss: 0.9772, test_f1: 0.6117
 epoch: 43, train_loss: 0.7182, test_loss: 0.9478, test_f1: 0.5979
 epoch: 44, train_loss: 0.7117, test_loss: 0.9946, test_f1: 0.5891
 epoch: 45, train_loss: 0.7195, test_loss: 0.9356, test_f1: 0.6142
 epoch: 46, train_loss: 0.7074, test_loss: 0.9551, test_f1: 0.6022
 epoch: 47, train_loss: 0.6844, test_loss: 0.9203, test_f1: 0.6014
 epoch: 48, train_loss: 0.7003, test_loss: 0.9683, test_f1: 0.5853
 epoch: 49, train_loss: 0.6874, test_loss: 0.9773, test_f1: 0.5976
 epoch: 50, train_loss: 0.6796, test_loss: 0.9545, test_f1: 0.6020
 epoch: 51, train_loss: 0.6723, test_loss: 0.9469, test_f1: 0.6246
 epoch: 52, train_loss: 0.6674, test_loss: 0.9361, test_f1: 0.6072
 epoch: 53, train_loss: 0.6694, test_loss: 0.9505, test_f1: 0.6126
 epoch: 54, train_loss: 0.6662, test_loss: 0.9567, test_f1: 0.6160
 epoch: 55, train_loss: 0.6533, test_loss: 0.9567, test_f1: 0.6171
 epoch: 56, train_loss: 0.6422, test_loss: 0.9268, test_f1: 0.6239
 epoch: 57, train_loss: 0.6419, test_loss: 0.9434, test_f1: 0.6149
 epoch: 58, train_loss: 0.6377, test_loss: 0.9755, test_f1: 0.6057
 epoch: 59, train_loss: 0.6374, test_loss: 0.9633, test_f1: 0.5976
 epoch: 60, train_loss: 0.6331, test_loss: 0.9848, test_f1: 0.6211
 epoch: 61, train_loss: 0.6487, test_loss: 0.9741, test_f1: 0.5990
 epoch: 62, train_loss: 0.6410, test_loss: 0.9560, test_f1: 0.6032
 epoch: 63, train_loss: 0.6355, test_loss: 0.9650, test_f1: 0.6317
 epoch: 64, train_loss: 0.6296, test_loss: 0.9644, test_f1: 0.6112
 epoch: 65, train_loss: 0.6165, test_loss: 0.9953, test_f1: 0.6076
 epoch: 66, train_loss: 0.6113, test_loss: 0.9519, test_f1: 0.6279
 epoch: 67, train_loss: 0.6387, test_loss: 1.0032, test_f1: 0.6275
 epoch: 68, train_loss: 0.6280, test_loss: 0.9864, test_f1: 0.6188
 epoch: 69, train_loss: 0.6295, test_loss: 0.9613, test_f1: 0.6122
 epoch: 70, train_loss: 0.6297, test_loss: 0.9958, test_f1: 0.5864
 epoch: 71, train_loss: 0.6225, test_loss: 0.9885, test_f1: 0.6014
 epoch: 72, train_loss: 0.6061, test_loss: 0.9591, test_f1: 0.6162
 epoch: 73, train_loss: 0.6149, test_loss: 0.9529, test_f1: 0.6220
 epoch: 74, train_loss: 0.5962, test_loss: 0.9850, test_f1: 0.6351
 epoch: 75, train_loss: 0.5997, test_loss: 0.9981, test_f1: 0.6359
 epoch: 76, train_loss: 0.6003, test_loss: 0.9998, test_f1: 0.6071
 epoch: 77, train_loss: 0.5957, test_loss: 0.9764, test_f1: 0.6280
 epoch: 78, train_loss: 0.6013, test_loss: 0.9781, test_f1: 0.6406
 epoch: 79, train_loss: 0.5924, test_loss: 0.9794, test_f1: 0.6130
 epoch: 80, train_loss: 0.6061, test_loss: 1.0104, test_f1: 0.6360
 epoch: 81, train_loss: 0.5877, test_loss: 1.0007, test_f1: 0.6128
 epoch: 82, train_loss: 0.5908, test_loss: 1.0043, test_f1: 0.6070
 epoch: 83, train_loss: 0.5945, test_loss: 1.0335, test_f1: 0.6500
 epoch: 84, train_loss: 0.5878, test_loss: 0.9574, test_f1: 0.6250
 epoch: 85, train_loss: 0.5822, test_loss: 1.0160, test_f1: 0.6163
 epoch: 86, train_loss: 0.5924, test_loss: 1.0207, test_f1: 0.6542
 epoch: 87, train_loss: 0.5782, test_loss: 1.0329, test_f1: 0.6044
 epoch: 88, train_loss: 0.5781, test_loss: 1.0053, test_f1: 0.6158
 epoch: 89, train_loss: 0.5730, test_loss: 1.0684, test_f1: 0.5998
 epoch: 90, train_loss: 0.5865, test_loss: 0.9878, test_f1: 0.6165
 epoch: 91, train_loss: 0.5622, test_loss: 0.9824, test_f1: 0.6144
 epoch: 92, train_loss: 0.5714, test_loss: 1.0104, test_f1: 0.6076
 epoch: 93, train_loss: 0.5817, test_loss: 1.0053, test_f1: 0.6486
 epoch: 94, train_loss: 0.5604, test_loss: 1.0711, test_f1: 0.6131
 epoch: 95, train_loss: 0.5696, test_loss: 1.0760, test_f1: 0.5898
 epoch: 96, train_loss: 0.5659, test_loss: 1.0779, test_f1: 0.6133
 epoch: 97, train_loss: 0.5674, test_loss: 1.0632, test_f1: 0.6056
 epoch: 98, train_loss: 0.5568, test_loss: 1.0522, test_f1: 0.5975
 epoch: 99, train_loss: 0.5667, test_loss: 1.0216, test_f1: 0.6202
##################ITERATION #3 ****************************************
 epoch: 0, train_loss: 1.2309, test_loss: 1.0930, test_f1: 0.4486
 epoch: 1, train_loss: 1.0873, test_loss: 0.9849, test_f1: 0.4746
 epoch: 2, train_loss: 1.0495, test_loss: 0.9734, test_f1: 0.4696
 epoch: 3, train_loss: 0.9970, test_loss: 0.9513, test_f1: 0.4770
 epoch: 4, train_loss: 0.9868, test_loss: 0.9430, test_f1: 0.4666
 epoch: 5, train_loss: 0.9687, test_loss: 0.9713, test_f1: 0.4801
 epoch: 6, train_loss: 0.9625, test_loss: 0.9048, test_f1: 0.5025
 epoch: 7, train_loss: 0.9553, test_loss: 0.9145, test_f1: 0.4913
 epoch: 8, train_loss: 0.9395, test_loss: 0.9150, test_f1: 0.4959
 epoch: 9, train_loss: 0.9297, test_loss: 0.9076, test_f1: 0.5040
 epoch: 10, train_loss: 0.9130, test_loss: 0.8866, test_f1: 0.5112
 epoch: 11, train_loss: 0.9090, test_loss: 0.8922, test_f1: 0.5245
 epoch: 12, train_loss: 0.8968, test_loss: 0.8720, test_f1: 0.5300
 epoch: 13, train_loss: 0.8928, test_loss: 0.9006, test_f1: 0.5341
 epoch: 14, train_loss: 0.8853, test_loss: 0.9031, test_f1: 0.5224
 epoch: 15, train_loss: 0.8519, test_loss: 0.9045, test_f1: 0.5070
 epoch: 16, train_loss: 0.8646, test_loss: 0.8609, test_f1: 0.5668
 epoch: 17, train_loss: 0.8533, test_loss: 0.8809, test_f1: 0.5438
 epoch: 18, train_loss: 0.8547, test_loss: 0.8334, test_f1: 0.5577
 epoch: 19, train_loss: 0.8473, test_loss: 0.8796, test_f1: 0.5496
 epoch: 20, train_loss: 0.8414, test_loss: 0.8426, test_f1: 0.5564
 epoch: 21, train_loss: 0.8205, test_loss: 0.9167, test_f1: 0.5252
 epoch: 22, train_loss: 0.8227, test_loss: 0.8857, test_f1: 0.5618
 epoch: 23, train_loss: 0.8253, test_loss: 0.8812, test_f1: 0.5402
 epoch: 24, train_loss: 0.8225, test_loss: 0.8540, test_f1: 0.5672
 epoch: 25, train_loss: 0.8036, test_loss: 0.9958, test_f1: 0.5406
 epoch: 26, train_loss: 0.8022, test_loss: 0.8622, test_f1: 0.5628
 epoch: 27, train_loss: 0.7985, test_loss: 0.9222, test_f1: 0.5478
 epoch: 28, train_loss: 0.8038, test_loss: 0.8934, test_f1: 0.5817
 epoch: 29, train_loss: 0.7988, test_loss: 0.8948, test_f1: 0.5611
 epoch: 30, train_loss: 0.7913, test_loss: 0.8553, test_f1: 0.5781
 epoch: 31, train_loss: 0.7876, test_loss: 0.8755, test_f1: 0.5870
 epoch: 32, train_loss: 0.7879, test_loss: 0.8755, test_f1: 0.5836
 epoch: 33, train_loss: 0.7717, test_loss: 0.8892, test_f1: 0.5977
 epoch: 34, train_loss: 0.7570, test_loss: 0.8777, test_f1: 0.5741
 epoch: 35, train_loss: 0.7665, test_loss: 0.8282, test_f1: 0.5788
 epoch: 36, train_loss: 0.7768, test_loss: 0.8650, test_f1: 0.5923
 epoch: 37, train_loss: 0.7523, test_loss: 0.9063, test_f1: 0.5613
 epoch: 38, train_loss: 0.7534, test_loss: 0.8706, test_f1: 0.6069
 epoch: 39, train_loss: 0.7439, test_loss: 0.8759, test_f1: 0.5821
 epoch: 40, train_loss: 0.7527, test_loss: 0.8574, test_f1: 0.6137
 epoch: 41, train_loss: 0.7475, test_loss: 0.8562, test_f1: 0.5971
 epoch: 42, train_loss: 0.7472, test_loss: 0.8912, test_f1: 0.6036
 epoch: 43, train_loss: 0.7419, test_loss: 0.8740, test_f1: 0.5954
 epoch: 44, train_loss: 0.7359, test_loss: 0.8663, test_f1: 0.5873
 epoch: 45, train_loss: 0.7195, test_loss: 0.9024, test_f1: 0.5751
 epoch: 46, train_loss: 0.7173, test_loss: 0.8660, test_f1: 0.5926
 epoch: 47, train_loss: 0.7263, test_loss: 0.8153, test_f1: 0.6004
 epoch: 48, train_loss: 0.7169, test_loss: 0.8930, test_f1: 0.5866
 epoch: 49, train_loss: 0.7197, test_loss: 0.8753, test_f1: 0.6099
 epoch: 50, train_loss: 0.7095, test_loss: 0.8105, test_f1: 0.5930
 epoch: 51, train_loss: 0.6944, test_loss: 0.8469, test_f1: 0.5923
 epoch: 52, train_loss: 0.6884, test_loss: 0.8653, test_f1: 0.6153
 epoch: 53, train_loss: 0.6666, test_loss: 0.8466, test_f1: 0.6208
 epoch: 54, train_loss: 0.6611, test_loss: 0.8785, test_f1: 0.6393
 epoch: 55, train_loss: 0.6685, test_loss: 0.8566, test_f1: 0.6090
 epoch: 56, train_loss: 0.6673, test_loss: 0.8799, test_f1: 0.6198
 epoch: 57, train_loss: 0.6695, test_loss: 0.8703, test_f1: 0.6123
 epoch: 58, train_loss: 0.6698, test_loss: 0.8795, test_f1: 0.5978
 epoch: 59, train_loss: 0.6655, test_loss: 0.8698, test_f1: 0.6210
 epoch: 60, train_loss: 0.6636, test_loss: 0.8704, test_f1: 0.6326
 epoch: 61, train_loss: 0.6481, test_loss: 0.8659, test_f1: 0.6390
 epoch: 62, train_loss: 0.6552, test_loss: 0.8807, test_f1: 0.6101
 epoch: 63, train_loss: 0.6420, test_loss: 0.8640, test_f1: 0.6180
 epoch: 64, train_loss: 0.6481, test_loss: 0.8872, test_f1: 0.6331
 epoch: 65, train_loss: 0.6555, test_loss: 0.8790, test_f1: 0.6306
 epoch: 66, train_loss: 0.6470, test_loss: 0.8831, test_f1: 0.6200
 epoch: 67, train_loss: 0.6403, test_loss: 0.8602, test_f1: 0.6359
 epoch: 68, train_loss: 0.6422, test_loss: 0.8789, test_f1: 0.6446
 epoch: 69, train_loss: 0.6340, test_loss: 0.8714, test_f1: 0.6436
 epoch: 70, train_loss: 0.6388, test_loss: 0.8482, test_f1: 0.6398
 epoch: 71, train_loss: 0.6307, test_loss: 0.9080, test_f1: 0.6181
 epoch: 72, train_loss: 0.6221, test_loss: 0.8721, test_f1: 0.6394
 epoch: 73, train_loss: 0.6245, test_loss: 0.8721, test_f1: 0.6494
 epoch: 74, train_loss: 0.6120, test_loss: 0.8879, test_f1: 0.6427
 epoch: 75, train_loss: 0.6156, test_loss: 0.8689, test_f1: 0.6170
 epoch: 76, train_loss: 0.6235, test_loss: 0.8728, test_f1: 0.6465
 epoch: 77, train_loss: 0.6377, test_loss: 0.8765, test_f1: 0.6345
 epoch: 78, train_loss: 0.6155, test_loss: 0.8989, test_f1: 0.6418
 epoch: 79, train_loss: 0.6143, test_loss: 0.9042, test_f1: 0.6199
 epoch: 80, train_loss: 0.6188, test_loss: 0.8889, test_f1: 0.5992
 epoch: 81, train_loss: 0.6101, test_loss: 0.8940, test_f1: 0.6374
 epoch: 82, train_loss: 0.6151, test_loss: 0.9281, test_f1: 0.6252
 epoch: 83, train_loss: 0.6148, test_loss: 0.9040, test_f1: 0.6461
 epoch: 84, train_loss: 0.6205, test_loss: 0.9042, test_f1: 0.6327
 epoch: 85, train_loss: 0.6105, test_loss: 0.8732, test_f1: 0.6548
 epoch: 86, train_loss: 0.6030, test_loss: 0.8804, test_f1: 0.6542
 epoch: 87, train_loss: 0.6049, test_loss: 0.8732, test_f1: 0.6335
 epoch: 88, train_loss: 0.5994, test_loss: 0.8833, test_f1: 0.6466
 epoch: 89, train_loss: 0.5893, test_loss: 0.9292, test_f1: 0.6357
 epoch: 90, train_loss: 0.5822, test_loss: 0.8992, test_f1: 0.6415
 epoch: 91, train_loss: 0.5929, test_loss: 0.9090, test_f1: 0.6550
 epoch: 92, train_loss: 0.5874, test_loss: 0.9527, test_f1: 0.6412
 epoch: 93, train_loss: 0.5942, test_loss: 0.9190, test_f1: 0.6268
 epoch: 94, train_loss: 0.5820, test_loss: 0.9484, test_f1: 0.6514
 epoch: 95, train_loss: 0.5848, test_loss: 0.9102, test_f1: 0.6575
 epoch: 96, train_loss: 0.5826, test_loss: 0.9190, test_f1: 0.6368
 epoch: 97, train_loss: 0.5815, test_loss: 0.9780, test_f1: 0.6298
 epoch: 98, train_loss: 0.5697, test_loss: 0.9000, test_f1: 0.6620
 epoch: 99, train_loss: 0.5899, test_loss: 0.9511, test_f1: 0.6291
##################ITERATION #4 ****************************************
 epoch: 0, train_loss: 1.2670, test_loss: 1.0939, test_f1: 0.4183
 epoch: 1, train_loss: 1.1012, test_loss: 0.9923, test_f1: 0.4910
 epoch: 2, train_loss: 1.0497, test_loss: 0.9655, test_f1: 0.4785
 epoch: 3, train_loss: 1.0164, test_loss: 0.9322, test_f1: 0.5129
 epoch: 4, train_loss: 0.9709, test_loss: 0.9315, test_f1: 0.4960
 epoch: 5, train_loss: 0.9646, test_loss: 0.9384, test_f1: 0.5062
 epoch: 6, train_loss: 0.9554, test_loss: 0.9211, test_f1: 0.5186
 epoch: 7, train_loss: 0.9399, test_loss: 0.9238, test_f1: 0.5089
 epoch: 8, train_loss: 0.9205, test_loss: 0.9219, test_f1: 0.5149
 epoch: 9, train_loss: 0.9129, test_loss: 0.9181, test_f1: 0.5256
 epoch: 10, train_loss: 0.9071, test_loss: 0.8916, test_f1: 0.5264
 epoch: 11, train_loss: 0.8876, test_loss: 0.9255, test_f1: 0.5281
 epoch: 12, train_loss: 0.8941, test_loss: 0.9307, test_f1: 0.4880
 epoch: 13, train_loss: 0.8821, test_loss: 0.9307, test_f1: 0.5349
 epoch: 14, train_loss: 0.8904, test_loss: 0.9189, test_f1: 0.5295
 epoch: 15, train_loss: 0.8676, test_loss: 0.9213, test_f1: 0.5249
 epoch: 16, train_loss: 0.8662, test_loss: 0.9192, test_f1: 0.5371
 epoch: 17, train_loss: 0.8523, test_loss: 0.9086, test_f1: 0.5392
 epoch: 18, train_loss: 0.8524, test_loss: 0.9133, test_f1: 0.5589
 epoch: 19, train_loss: 0.8476, test_loss: 0.9467, test_f1: 0.5804
 epoch: 20, train_loss: 0.8388, test_loss: 0.9051, test_f1: 0.5499
 epoch: 21, train_loss: 0.8312, test_loss: 0.9148, test_f1: 0.5515
 epoch: 22, train_loss: 0.8251, test_loss: 0.8997, test_f1: 0.5742
 epoch: 23, train_loss: 0.8250, test_loss: 0.8800, test_f1: 0.5514
 epoch: 24, train_loss: 0.8254, test_loss: 0.9161, test_f1: 0.5728
 epoch: 25, train_loss: 0.8216, test_loss: 0.9374, test_f1: 0.5632
 epoch: 26, train_loss: 0.8183, test_loss: 0.9144, test_f1: 0.5816
 epoch: 27, train_loss: 0.8024, test_loss: 0.8908, test_f1: 0.5265
 epoch: 28, train_loss: 0.8113, test_loss: 0.9291, test_f1: 0.5974
 epoch: 29, train_loss: 0.8040, test_loss: 0.9289, test_f1: 0.5536
 epoch: 30, train_loss: 0.7944, test_loss: 0.9398, test_f1: 0.5671
 epoch: 31, train_loss: 0.7922, test_loss: 0.9287, test_f1: 0.5834
 epoch: 32, train_loss: 0.7724, test_loss: 0.9194, test_f1: 0.5861
 epoch: 33, train_loss: 0.7974, test_loss: 0.9178, test_f1: 0.6027
 epoch: 34, train_loss: 0.7760, test_loss: 0.9443, test_f1: 0.5847
 epoch: 35, train_loss: 0.7661, test_loss: 0.9180, test_f1: 0.5788
 epoch: 36, train_loss: 0.7705, test_loss: 0.9111, test_f1: 0.5841
 epoch: 37, train_loss: 0.7560, test_loss: 0.9069, test_f1: 0.6086
 epoch: 38, train_loss: 0.7434, test_loss: 0.9165, test_f1: 0.5758
 epoch: 39, train_loss: 0.7504, test_loss: 0.9472, test_f1: 0.6230
 epoch: 40, train_loss: 0.7642, test_loss: 0.9928, test_f1: 0.5573
 epoch: 41, train_loss: 0.7491, test_loss: 0.9530, test_f1: 0.5827
 epoch: 42, train_loss: 0.7442, test_loss: 0.9425, test_f1: 0.5958
 epoch: 43, train_loss: 0.7451, test_loss: 0.9719, test_f1: 0.5703
 epoch: 44, train_loss: 0.7470, test_loss: 0.9557, test_f1: 0.5878
 epoch: 45, train_loss: 0.7454, test_loss: 0.9692, test_f1: 0.5615
 epoch: 46, train_loss: 0.7348, test_loss: 1.0048, test_f1: 0.5397
 epoch: 47, train_loss: 0.7349, test_loss: 0.9704, test_f1: 0.5750
 epoch: 48, train_loss: 0.7204, test_loss: 0.9451, test_f1: 0.6159
 epoch: 49, train_loss: 0.7230, test_loss: 0.9384, test_f1: 0.6191
 epoch: 50, train_loss: 0.7353, test_loss: 0.9898, test_f1: 0.5852
 epoch: 51, train_loss: 0.7109, test_loss: 0.9106, test_f1: 0.6398
 epoch: 52, train_loss: 0.6952, test_loss: 0.9474, test_f1: 0.6108
 epoch: 53, train_loss: 0.6888, test_loss: 0.9467, test_f1: 0.6142
 epoch: 54, train_loss: 0.6756, test_loss: 0.9254, test_f1: 0.6247
 epoch: 55, train_loss: 0.6763, test_loss: 0.9294, test_f1: 0.6333
 epoch: 56, train_loss: 0.6791, test_loss: 0.9436, test_f1: 0.6159
 epoch: 57, train_loss: 0.6669, test_loss: 0.9815, test_f1: 0.6212
 epoch: 58, train_loss: 0.6770, test_loss: 0.9928, test_f1: 0.6085
 epoch: 59, train_loss: 0.6793, test_loss: 0.9685, test_f1: 0.6181
 epoch: 60, train_loss: 0.6718, test_loss: 0.9441, test_f1: 0.6134
 epoch: 61, train_loss: 0.6669, test_loss: 0.9805, test_f1: 0.6302
 epoch: 62, train_loss: 0.6577, test_loss: 0.9529, test_f1: 0.6234
 epoch: 63, train_loss: 0.6686, test_loss: 0.9247, test_f1: 0.6224
 epoch: 64, train_loss: 0.6735, test_loss: 0.9544, test_f1: 0.6320
 epoch: 65, train_loss: 0.6600, test_loss: 0.9401, test_f1: 0.6125
 epoch: 66, train_loss: 0.6591, test_loss: 0.9896, test_f1: 0.6289
 epoch: 67, train_loss: 0.6509, test_loss: 1.0044, test_f1: 0.6222
 epoch: 68, train_loss: 0.6637, test_loss: 0.9599, test_f1: 0.6184
 epoch: 69, train_loss: 0.6495, test_loss: 0.9764, test_f1: 0.6190
 epoch: 70, train_loss: 0.6463, test_loss: 0.9513, test_f1: 0.6216
 epoch: 71, train_loss: 0.6452, test_loss: 0.9808, test_f1: 0.6350
 epoch: 72, train_loss: 0.6475, test_loss: 0.9682, test_f1: 0.6287
 epoch: 73, train_loss: 0.6425, test_loss: 0.9598, test_f1: 0.6372
 epoch: 74, train_loss: 0.6308, test_loss: 0.9579, test_f1: 0.6496
 epoch: 75, train_loss: 0.6454, test_loss: 0.9945, test_f1: 0.6209
 epoch: 76, train_loss: 0.6391, test_loss: 0.9533, test_f1: 0.6378
 epoch: 77, train_loss: 0.6278, test_loss: 0.9789, test_f1: 0.6267
 epoch: 78, train_loss: 0.6341, test_loss: 0.9906, test_f1: 0.6298
 epoch: 79, train_loss: 0.6347, test_loss: 0.9687, test_f1: 0.6397
 epoch: 80, train_loss: 0.6260, test_loss: 0.9822, test_f1: 0.6380
 epoch: 81, train_loss: 0.6265, test_loss: 0.9982, test_f1: 0.6431
 epoch: 82, train_loss: 0.6242, test_loss: 0.9199, test_f1: 0.6678
 epoch: 83, train_loss: 0.6248, test_loss: 1.0082, test_f1: 0.6599
 epoch: 84, train_loss: 0.6287, test_loss: 0.9491, test_f1: 0.6568
 epoch: 85, train_loss: 0.6045, test_loss: 1.0205, test_f1: 0.6214
 epoch: 86, train_loss: 0.6183, test_loss: 0.9572, test_f1: 0.6628
 epoch: 87, train_loss: 0.6188, test_loss: 0.9613, test_f1: 0.6460
 epoch: 88, train_loss: 0.6297, test_loss: 0.9614, test_f1: 0.6304
 epoch: 89, train_loss: 0.6211, test_loss: 0.9578, test_f1: 0.6578
 epoch: 90, train_loss: 0.6163, test_loss: 0.9682, test_f1: 0.6251
 epoch: 91, train_loss: 0.6031, test_loss: 0.9828, test_f1: 0.6404
 epoch: 92, train_loss: 0.6092, test_loss: 0.9653, test_f1: 0.6316
 epoch: 93, train_loss: 0.5946, test_loss: 0.9932, test_f1: 0.6289
 epoch: 94, train_loss: 0.5993, test_loss: 0.9933, test_f1: 0.6430
 epoch: 95, train_loss: 0.5972, test_loss: 0.9689, test_f1: 0.6491
 epoch: 96, train_loss: 0.6222, test_loss: 1.0288, test_f1: 0.6192
 epoch: 97, train_loss: 0.6039, test_loss: 1.0717, test_f1: 0.6155
 epoch: 98, train_loss: 0.6013, test_loss: 0.9825, test_f1: 0.6318
 epoch: 99, train_loss: 0.5921, test_loss: 0.9696, test_f1: 0.6352
##################ITERATION #5 ****************************************
 epoch: 0, train_loss: 1.2832, test_loss: 1.1130, test_f1: 0.4554
 epoch: 1, train_loss: 1.0820, test_loss: 0.9765, test_f1: 0.4677
 epoch: 2, train_loss: 1.0270, test_loss: 0.9602, test_f1: 0.4770
 epoch: 3, train_loss: 0.9946, test_loss: 0.9454, test_f1: 0.4886
 epoch: 4, train_loss: 0.9819, test_loss: 0.9227, test_f1: 0.5082
 epoch: 5, train_loss: 0.9557, test_loss: 0.9121, test_f1: 0.5235
 epoch: 6, train_loss: 0.9297, test_loss: 0.9224, test_f1: 0.5388
 epoch: 7, train_loss: 0.9295, test_loss: 0.9040, test_f1: 0.5205
 epoch: 8, train_loss: 0.9249, test_loss: 0.8825, test_f1: 0.5203
 epoch: 9, train_loss: 0.9054, test_loss: 0.8988, test_f1: 0.5418
 epoch: 10, train_loss: 0.8914, test_loss: 0.8766, test_f1: 0.5131
 epoch: 11, train_loss: 0.8811, test_loss: 0.8969, test_f1: 0.5262
 epoch: 12, train_loss: 0.8660, test_loss: 0.8924, test_f1: 0.5511
 epoch: 13, train_loss: 0.8733, test_loss: 0.8781, test_f1: 0.5555
 epoch: 14, train_loss: 0.8687, test_loss: 0.9124, test_f1: 0.5522
 epoch: 15, train_loss: 0.8551, test_loss: 0.9145, test_f1: 0.5252
 epoch: 16, train_loss: 0.8483, test_loss: 0.9165, test_f1: 0.5428
 epoch: 17, train_loss: 0.8461, test_loss: 0.8931, test_f1: 0.5470
 epoch: 18, train_loss: 0.8377, test_loss: 0.9112, test_f1: 0.5509
 epoch: 19, train_loss: 0.8323, test_loss: 0.9056, test_f1: 0.5636
 epoch: 20, train_loss: 0.8203, test_loss: 0.9410, test_f1: 0.5488
 epoch: 21, train_loss: 0.8182, test_loss: 0.9467, test_f1: 0.5715
 epoch: 22, train_loss: 0.8237, test_loss: 0.9336, test_f1: 0.5540
 epoch: 23, train_loss: 0.8155, test_loss: 0.8914, test_f1: 0.5512
 epoch: 24, train_loss: 0.8154, test_loss: 0.8926, test_f1: 0.6084
 epoch: 25, train_loss: 0.7939, test_loss: 0.9044, test_f1: 0.5564
 epoch: 26, train_loss: 0.7968, test_loss: 0.8897, test_f1: 0.5503
 epoch: 27, train_loss: 0.7961, test_loss: 0.8690, test_f1: 0.5860
 epoch: 28, train_loss: 0.7905, test_loss: 0.9018, test_f1: 0.5938
 epoch: 29, train_loss: 0.7767, test_loss: 0.8879, test_f1: 0.5948
 epoch: 30, train_loss: 0.7743, test_loss: 0.9872, test_f1: 0.5961
 epoch: 31, train_loss: 0.7785, test_loss: 0.8920, test_f1: 0.5779
 epoch: 32, train_loss: 0.7769, test_loss: 0.8885, test_f1: 0.6086
 epoch: 33, train_loss: 0.7743, test_loss: 0.8701, test_f1: 0.6274
 epoch: 34, train_loss: 0.7648, test_loss: 0.9035, test_f1: 0.6182
 epoch: 35, train_loss: 0.7652, test_loss: 0.9133, test_f1: 0.6189
 epoch: 36, train_loss: 0.7538, test_loss: 0.8700, test_f1: 0.6066
 epoch: 37, train_loss: 0.7528, test_loss: 0.8776, test_f1: 0.6106
 epoch: 38, train_loss: 0.7497, test_loss: 0.8889, test_f1: 0.6301
 epoch: 39, train_loss: 0.7396, test_loss: 0.9050, test_f1: 0.6220
 epoch: 40, train_loss: 0.7436, test_loss: 0.9048, test_f1: 0.6097
 epoch: 41, train_loss: 0.7355, test_loss: 0.8897, test_f1: 0.6154
 epoch: 42, train_loss: 0.7535, test_loss: 1.0034, test_f1: 0.5973
 epoch: 43, train_loss: 0.7379, test_loss: 1.0903, test_f1: 0.6024
 epoch: 44, train_loss: 0.7259, test_loss: 1.0029, test_f1: 0.6280
 epoch: 45, train_loss: 0.7233, test_loss: 0.9003, test_f1: 0.6282
 epoch: 46, train_loss: 0.7208, test_loss: 0.8917, test_f1: 0.6339
 epoch: 47, train_loss: 0.7243, test_loss: 0.9061, test_f1: 0.5997
 epoch: 48, train_loss: 0.7096, test_loss: 0.9554, test_f1: 0.6036
 epoch: 49, train_loss: 0.7040, test_loss: 0.8993, test_f1: 0.6338
 epoch: 50, train_loss: 0.7045, test_loss: 0.9096, test_f1: 0.6463
 epoch: 51, train_loss: 0.6900, test_loss: 0.8989, test_f1: 0.6448
 epoch: 52, train_loss: 0.6669, test_loss: 0.9119, test_f1: 0.6346
 epoch: 53, train_loss: 0.6736, test_loss: 0.9401, test_f1: 0.6341
 epoch: 54, train_loss: 0.6676, test_loss: 0.8980, test_f1: 0.6166
 epoch: 55, train_loss: 0.6511, test_loss: 0.9039, test_f1: 0.6523
 epoch: 56, train_loss: 0.6627, test_loss: 0.9288, test_f1: 0.6152
 epoch: 57, train_loss: 0.6709, test_loss: 0.8880, test_f1: 0.6668
 epoch: 58, train_loss: 0.6532, test_loss: 0.9072, test_f1: 0.6290
 epoch: 59, train_loss: 0.6660, test_loss: 0.9393, test_f1: 0.6227
 epoch: 60, train_loss: 0.6506, test_loss: 0.9384, test_f1: 0.6083
 epoch: 61, train_loss: 0.6511, test_loss: 0.9140, test_f1: 0.6518
 epoch: 62, train_loss: 0.6560, test_loss: 0.9679, test_f1: 0.6072
 epoch: 63, train_loss: 0.6460, test_loss: 0.9574, test_f1: 0.6435
 epoch: 64, train_loss: 0.6548, test_loss: 0.9471, test_f1: 0.6465
 epoch: 65, train_loss: 0.6551, test_loss: 0.9405, test_f1: 0.6343
 epoch: 66, train_loss: 0.6441, test_loss: 0.9249, test_f1: 0.6552
 epoch: 67, train_loss: 0.6445, test_loss: 0.9014, test_f1: 0.6628
 epoch: 68, train_loss: 0.6282, test_loss: 0.9633, test_f1: 0.6345
 epoch: 69, train_loss: 0.6275, test_loss: 0.9434, test_f1: 0.6416
 epoch: 70, train_loss: 0.6352, test_loss: 0.9461, test_f1: 0.6519
 epoch: 71, train_loss: 0.6337, test_loss: 0.9832, test_f1: 0.6186
 epoch: 72, train_loss: 0.6232, test_loss: 0.9560, test_f1: 0.6546
 epoch: 73, train_loss: 0.6297, test_loss: 0.9863, test_f1: 0.6434
 epoch: 74, train_loss: 0.6214, test_loss: 0.9510, test_f1: 0.6641
 epoch: 75, train_loss: 0.6078, test_loss: 0.9414, test_f1: 0.6619
 epoch: 76, train_loss: 0.6353, test_loss: 0.9652, test_f1: 0.6264
 epoch: 77, train_loss: 0.6094, test_loss: 0.9248, test_f1: 0.6558
 epoch: 78, train_loss: 0.6161, test_loss: 0.9865, test_f1: 0.6477
 epoch: 79, train_loss: 0.6145, test_loss: 0.9514, test_f1: 0.6399
 epoch: 80, train_loss: 0.6055, test_loss: 0.9535, test_f1: 0.6577
 epoch: 81, train_loss: 0.6147, test_loss: 0.9505, test_f1: 0.6454
 epoch: 82, train_loss: 0.6143, test_loss: 0.9401, test_f1: 0.6985
 epoch: 83, train_loss: 0.5893, test_loss: 0.9941, test_f1: 0.6565
 epoch: 84, train_loss: 0.6104, test_loss: 0.9577, test_f1: 0.6623
 epoch: 85, train_loss: 0.5947, test_loss: 0.9678, test_f1: 0.6532
 epoch: 86, train_loss: 0.5949, test_loss: 0.9795, test_f1: 0.6674
 epoch: 87, train_loss: 0.6059, test_loss: 0.9552, test_f1: 0.6781
 epoch: 88, train_loss: 0.5956, test_loss: 0.9618, test_f1: 0.6396
 epoch: 89, train_loss: 0.5979, test_loss: 0.9602, test_f1: 0.6569
 epoch: 90, train_loss: 0.5843, test_loss: 0.9937, test_f1: 0.6505
 epoch: 91, train_loss: 0.5764, test_loss: 0.9829, test_f1: 0.6359
 epoch: 92, train_loss: 0.5997, test_loss: 0.9561, test_f1: 0.6595
 epoch: 93, train_loss: 0.5865, test_loss: 0.9862, test_f1: 0.6620
 epoch: 94, train_loss: 0.5928, test_loss: 0.9872, test_f1: 0.6731
 epoch: 95, train_loss: 0.5944, test_loss: 0.9208, test_f1: 0.6771
 epoch: 96, train_loss: 0.5886, test_loss: 0.9861, test_f1: 0.6604
 epoch: 97, train_loss: 0.5746, test_loss: 0.9608, test_f1: 0.6742
 epoch: 98, train_loss: 0.5846, test_loss: 1.0023, test_f1: 0.6597
 epoch: 99, train_loss: 0.5815, test_loss: 1.0112, test_f1: 0.6319
##################ITERATION #6 ****************************************
 epoch: 0, train_loss: 1.3450, test_loss: 1.2181, test_f1: 0.2861
 epoch: 1, train_loss: 1.1105, test_loss: 1.0210, test_f1: 0.4779
 epoch: 2, train_loss: 1.0612, test_loss: 1.0082, test_f1: 0.4522
 epoch: 3, train_loss: 1.0285, test_loss: 0.9510, test_f1: 0.4892
 epoch: 4, train_loss: 0.9886, test_loss: 0.9878, test_f1: 0.4849
 epoch: 5, train_loss: 0.9757, test_loss: 0.9936, test_f1: 0.5075
 epoch: 6, train_loss: 0.9704, test_loss: 0.9999, test_f1: 0.4753
 epoch: 7, train_loss: 0.9422, test_loss: 0.9882, test_f1: 0.4680
 epoch: 8, train_loss: 0.9305, test_loss: 0.9920, test_f1: 0.4876
 epoch: 9, train_loss: 0.9149, test_loss: 0.9749, test_f1: 0.4961
 epoch: 10, train_loss: 0.9080, test_loss: 0.9350, test_f1: 0.5071
 epoch: 11, train_loss: 0.9009, test_loss: 0.9820, test_f1: 0.5062
 epoch: 12, train_loss: 0.8955, test_loss: 0.9567, test_f1: 0.5384
 epoch: 13, train_loss: 0.8877, test_loss: 0.9366, test_f1: 0.5168
 epoch: 14, train_loss: 0.8779, test_loss: 0.9603, test_f1: 0.5229
 epoch: 15, train_loss: 0.8790, test_loss: 0.9752, test_f1: 0.5115
 epoch: 16, train_loss: 0.8620, test_loss: 0.9198, test_f1: 0.5277
 epoch: 17, train_loss: 0.8538, test_loss: 0.9514, test_f1: 0.5358
 epoch: 18, train_loss: 0.8555, test_loss: 0.9557, test_f1: 0.5334
 epoch: 19, train_loss: 0.8547, test_loss: 0.9490, test_f1: 0.5350
 epoch: 20, train_loss: 0.8363, test_loss: 0.9377, test_f1: 0.5552
 epoch: 21, train_loss: 0.8241, test_loss: 0.9302, test_f1: 0.5443
 epoch: 22, train_loss: 0.8313, test_loss: 0.9217, test_f1: 0.5403
 epoch: 23, train_loss: 0.8137, test_loss: 0.9099, test_f1: 0.5430
 epoch: 24, train_loss: 0.8108, test_loss: 0.9247, test_f1: 0.5732
 epoch: 25, train_loss: 0.7999, test_loss: 0.9234, test_f1: 0.5432
 epoch: 26, train_loss: 0.8042, test_loss: 0.9319, test_f1: 0.5700
 epoch: 27, train_loss: 0.8018, test_loss: 0.9360, test_f1: 0.5567
 epoch: 28, train_loss: 0.7993, test_loss: 0.9091, test_f1: 0.5677
 epoch: 29, train_loss: 0.7970, test_loss: 0.9171, test_f1: 0.5674
 epoch: 30, train_loss: 0.7875, test_loss: 0.9046, test_f1: 0.5674
 epoch: 31, train_loss: 0.7858, test_loss: 0.9347, test_f1: 0.5623
 epoch: 32, train_loss: 0.7751, test_loss: 0.9211, test_f1: 0.5499
 epoch: 33, train_loss: 0.7881, test_loss: 0.9154, test_f1: 0.5651
 epoch: 34, train_loss: 0.7607, test_loss: 0.8836, test_f1: 0.5827
 epoch: 35, train_loss: 0.7699, test_loss: 0.9029, test_f1: 0.5873
 epoch: 36, train_loss: 0.7608, test_loss: 0.8489, test_f1: 0.6092
 epoch: 37, train_loss: 0.7668, test_loss: 0.9078, test_f1: 0.5960
 epoch: 38, train_loss: 0.7478, test_loss: 0.9260, test_f1: 0.5739
 epoch: 39, train_loss: 0.7398, test_loss: 0.9563, test_f1: 0.5873
 epoch: 40, train_loss: 0.7487, test_loss: 0.8956, test_f1: 0.6217
 epoch: 41, train_loss: 0.7464, test_loss: 0.9203, test_f1: 0.5864
 epoch: 42, train_loss: 0.7332, test_loss: 0.9156, test_f1: 0.6033
 epoch: 43, train_loss: 0.7315, test_loss: 0.8900, test_f1: 0.5700
 epoch: 44, train_loss: 0.7416, test_loss: 0.9762, test_f1: 0.6118
 epoch: 45, train_loss: 0.7240, test_loss: 0.9285, test_f1: 0.6142
 epoch: 46, train_loss: 0.7288, test_loss: 0.9578, test_f1: 0.5986
 epoch: 47, train_loss: 0.7243, test_loss: 1.0101, test_f1: 0.6153
 epoch: 48, train_loss: 0.7231, test_loss: 0.9488, test_f1: 0.6177
 epoch: 49, train_loss: 0.7242, test_loss: 0.9560, test_f1: 0.6021
 epoch: 50, train_loss: 0.7194, test_loss: 0.9928, test_f1: 0.6055
 epoch: 51, train_loss: 0.6890, test_loss: 0.9437, test_f1: 0.6122
 epoch: 52, train_loss: 0.6743, test_loss: 0.9682, test_f1: 0.6242
 epoch: 53, train_loss: 0.6754, test_loss: 0.9794, test_f1: 0.6205
 epoch: 54, train_loss: 0.6804, test_loss: 0.9418, test_f1: 0.6350
 epoch: 55, train_loss: 0.6843, test_loss: 0.9525, test_f1: 0.6477
 epoch: 56, train_loss: 0.6607, test_loss: 0.9927, test_f1: 0.6261
 epoch: 57, train_loss: 0.6562, test_loss: 0.9727, test_f1: 0.6373
 epoch: 58, train_loss: 0.6640, test_loss: 1.0103, test_f1: 0.6015
 epoch: 59, train_loss: 0.6514, test_loss: 1.0005, test_f1: 0.6303
 epoch: 60, train_loss: 0.6481, test_loss: 0.9896, test_f1: 0.6339
 epoch: 61, train_loss: 0.6650, test_loss: 0.9625, test_f1: 0.6199
 epoch: 62, train_loss: 0.6565, test_loss: 0.9366, test_f1: 0.6468
 epoch: 63, train_loss: 0.6565, test_loss: 0.9902, test_f1: 0.6409
 epoch: 64, train_loss: 0.6361, test_loss: 0.9720, test_f1: 0.6397
 epoch: 65, train_loss: 0.6427, test_loss: 1.0298, test_f1: 0.6224
 epoch: 66, train_loss: 0.6380, test_loss: 0.9974, test_f1: 0.6075
 epoch: 67, train_loss: 0.6339, test_loss: 0.9820, test_f1: 0.6287
 epoch: 68, train_loss: 0.6405, test_loss: 1.0103, test_f1: 0.6261
 epoch: 69, train_loss: 0.6400, test_loss: 1.0235, test_f1: 0.6241
 epoch: 70, train_loss: 0.6327, test_loss: 0.9835, test_f1: 0.6314
 epoch: 71, train_loss: 0.6178, test_loss: 1.0039, test_f1: 0.6415
 epoch: 72, train_loss: 0.6316, test_loss: 1.0718, test_f1: 0.6234
 epoch: 73, train_loss: 0.6178, test_loss: 1.0788, test_f1: 0.6281
 epoch: 74, train_loss: 0.6335, test_loss: 1.1066, test_f1: 0.6213
 epoch: 75, train_loss: 0.6208, test_loss: 1.0207, test_f1: 0.6445
 epoch: 76, train_loss: 0.6312, test_loss: 1.0918, test_f1: 0.6264
 epoch: 77, train_loss: 0.6109, test_loss: 1.0616, test_f1: 0.6382
 epoch: 78, train_loss: 0.6232, test_loss: 1.1591, test_f1: 0.6247
 epoch: 79, train_loss: 0.6101, test_loss: 1.0657, test_f1: 0.6173
 epoch: 80, train_loss: 0.6072, test_loss: 1.0519, test_f1: 0.6160
 epoch: 81, train_loss: 0.6065, test_loss: 1.1170, test_f1: 0.6031
 epoch: 82, train_loss: 0.6135, test_loss: 1.0223, test_f1: 0.6516
 epoch: 83, train_loss: 0.6146, test_loss: 1.0585, test_f1: 0.6278
 epoch: 84, train_loss: 0.6076, test_loss: 1.0976, test_f1: 0.6203
 epoch: 85, train_loss: 0.5913, test_loss: 1.1169, test_f1: 0.6155
 epoch: 86, train_loss: 0.5886, test_loss: 1.0275, test_f1: 0.6327
 epoch: 87, train_loss: 0.6013, test_loss: 1.1271, test_f1: 0.6158
 epoch: 88, train_loss: 0.5991, test_loss: 1.0729, test_f1: 0.6321
 epoch: 89, train_loss: 0.6110, test_loss: 1.0747, test_f1: 0.6317
 epoch: 90, train_loss: 0.5759, test_loss: 1.1050, test_f1: 0.6621
 epoch: 91, train_loss: 0.5971, test_loss: 1.1177, test_f1: 0.6304
 epoch: 92, train_loss: 0.5892, test_loss: 1.0677, test_f1: 0.6331
 epoch: 93, train_loss: 0.5912, test_loss: 1.0850, test_f1: 0.6481
 epoch: 94, train_loss: 0.5905, test_loss: 1.1135, test_f1: 0.6261
 epoch: 95, train_loss: 0.5785, test_loss: 1.1454, test_f1: 0.6352
 epoch: 96, train_loss: 0.5826, test_loss: 1.1272, test_f1: 0.6205
 epoch: 97, train_loss: 0.5758, test_loss: 1.1381, test_f1: 0.6269
 epoch: 98, train_loss: 0.5842, test_loss: 1.0980, test_f1: 0.6364
 epoch: 99, train_loss: 0.5788, test_loss: 1.0981, test_f1: 0.6360
##################ITERATION #7 ****************************************
 epoch: 0, train_loss: 1.4232, test_loss: 1.1898, test_f1: 0.3578
 epoch: 1, train_loss: 1.1376, test_loss: 0.9786, test_f1: 0.4760
 epoch: 2, train_loss: 1.0654, test_loss: 0.9284, test_f1: 0.4716
 epoch: 3, train_loss: 1.0118, test_loss: 0.9156, test_f1: 0.4979
 epoch: 4, train_loss: 0.9996, test_loss: 0.9095, test_f1: 0.4947
 epoch: 5, train_loss: 0.9864, test_loss: 0.8912, test_f1: 0.4958
 epoch: 6, train_loss: 0.9664, test_loss: 0.8954, test_f1: 0.4970
 epoch: 7, train_loss: 0.9526, test_loss: 0.8814, test_f1: 0.5155
 epoch: 8, train_loss: 0.9383, test_loss: 0.8794, test_f1: 0.4993
 epoch: 9, train_loss: 0.9235, test_loss: 0.8870, test_f1: 0.5173
 epoch: 10, train_loss: 0.9263, test_loss: 0.8774, test_f1: 0.5259
 epoch: 11, train_loss: 0.9070, test_loss: 0.9087, test_f1: 0.5254
 epoch: 12, train_loss: 0.8984, test_loss: 0.8645, test_f1: 0.5217
 epoch: 13, train_loss: 0.8941, test_loss: 0.8835, test_f1: 0.5372
 epoch: 14, train_loss: 0.8898, test_loss: 0.8400, test_f1: 0.5417
 epoch: 15, train_loss: 0.8992, test_loss: 0.8802, test_f1: 0.5325
 epoch: 16, train_loss: 0.8736, test_loss: 0.8641, test_f1: 0.5271
 epoch: 17, train_loss: 0.8742, test_loss: 0.9046, test_f1: 0.5196
 epoch: 18, train_loss: 0.8667, test_loss: 0.9387, test_f1: 0.5193
 epoch: 19, train_loss: 0.8564, test_loss: 0.8938, test_f1: 0.5267
 epoch: 20, train_loss: 0.8544, test_loss: 0.9053, test_f1: 0.5187
 epoch: 21, train_loss: 0.8542, test_loss: 0.8982, test_f1: 0.5295
 epoch: 22, train_loss: 0.8312, test_loss: 0.9401, test_f1: 0.5150
 epoch: 23, train_loss: 0.8472, test_loss: 0.9147, test_f1: 0.5307
 epoch: 24, train_loss: 0.8368, test_loss: 0.8916, test_f1: 0.5586
 epoch: 25, train_loss: 0.8191, test_loss: 0.9056, test_f1: 0.5368
 epoch: 26, train_loss: 0.8285, test_loss: 0.8918, test_f1: 0.5716
 epoch: 27, train_loss: 0.8176, test_loss: 0.9137, test_f1: 0.5568
 epoch: 28, train_loss: 0.8162, test_loss: 0.8955, test_f1: 0.5646
 epoch: 29, train_loss: 0.8151, test_loss: 0.9273, test_f1: 0.5653
 epoch: 30, train_loss: 0.8123, test_loss: 0.9167, test_f1: 0.5220
 epoch: 31, train_loss: 0.8125, test_loss: 0.9285, test_f1: 0.5590
 epoch: 32, train_loss: 0.7952, test_loss: 0.9020, test_f1: 0.5435
 epoch: 33, train_loss: 0.8085, test_loss: 0.9059, test_f1: 0.5469
 epoch: 34, train_loss: 0.7837, test_loss: 0.9209, test_f1: 0.5492
 epoch: 35, train_loss: 0.7924, test_loss: 0.9310, test_f1: 0.5549
 epoch: 36, train_loss: 0.7754, test_loss: 0.9095, test_f1: 0.5733
 epoch: 37, train_loss: 0.7740, test_loss: 0.9046, test_f1: 0.5683
 epoch: 38, train_loss: 0.7874, test_loss: 0.9070, test_f1: 0.5741
 epoch: 39, train_loss: 0.7822, test_loss: 0.9502, test_f1: 0.5672
 epoch: 40, train_loss: 0.7642, test_loss: 0.9328, test_f1: 0.5627
 epoch: 41, train_loss: 0.7525, test_loss: 0.8943, test_f1: 0.5716
 epoch: 42, train_loss: 0.7603, test_loss: 0.9354, test_f1: 0.5803
 epoch: 43, train_loss: 0.7455, test_loss: 0.9244, test_f1: 0.6080
 epoch: 44, train_loss: 0.7583, test_loss: 0.9502, test_f1: 0.5660
 epoch: 45, train_loss: 0.7409, test_loss: 0.8954, test_f1: 0.6118
 epoch: 46, train_loss: 0.7421, test_loss: 0.9363, test_f1: 0.5826
 epoch: 47, train_loss: 0.7583, test_loss: 0.9038, test_f1: 0.6002
 epoch: 48, train_loss: 0.7498, test_loss: 0.8979, test_f1: 0.6016
 epoch: 49, train_loss: 0.7339, test_loss: 0.9874, test_f1: 0.5788
 epoch: 50, train_loss: 0.7420, test_loss: 0.9362, test_f1: 0.5712
 epoch: 51, train_loss: 0.7233, test_loss: 0.9211, test_f1: 0.6005
 epoch: 52, train_loss: 0.7011, test_loss: 0.9016, test_f1: 0.5925
 epoch: 53, train_loss: 0.7060, test_loss: 0.9245, test_f1: 0.5923
 epoch: 54, train_loss: 0.6946, test_loss: 0.9105, test_f1: 0.5856
 epoch: 55, train_loss: 0.6993, test_loss: 0.9249, test_f1: 0.6288
 epoch: 56, train_loss: 0.6836, test_loss: 0.9227, test_f1: 0.6062
 epoch: 57, train_loss: 0.7057, test_loss: 0.9013, test_f1: 0.6183
 epoch: 58, train_loss: 0.7029, test_loss: 0.9018, test_f1: 0.6060
 epoch: 59, train_loss: 0.6896, test_loss: 0.9098, test_f1: 0.6333
 epoch: 60, train_loss: 0.6887, test_loss: 0.9295, test_f1: 0.6100
 epoch: 61, train_loss: 0.6952, test_loss: 0.9339, test_f1: 0.6018
 epoch: 62, train_loss: 0.6861, test_loss: 1.0724, test_f1: 0.6190
 epoch: 63, train_loss: 0.6832, test_loss: 0.9446, test_f1: 0.5987
 epoch: 64, train_loss: 0.6625, test_loss: 1.0111, test_f1: 0.6152
 epoch: 65, train_loss: 0.6846, test_loss: 0.9379, test_f1: 0.6148
 epoch: 66, train_loss: 0.6693, test_loss: 1.0787, test_f1: 0.6184
 epoch: 67, train_loss: 0.6714, test_loss: 0.8997, test_f1: 0.6129
 epoch: 68, train_loss: 0.6651, test_loss: 0.9989, test_f1: 0.6087
 epoch: 69, train_loss: 0.6707, test_loss: 1.0279, test_f1: 0.6024
 epoch: 70, train_loss: 0.6762, test_loss: 1.0238, test_f1: 0.5994
 epoch: 71, train_loss: 0.6642, test_loss: 0.9874, test_f1: 0.5956
 epoch: 72, train_loss: 0.6626, test_loss: 1.0099, test_f1: 0.5960
 epoch: 73, train_loss: 0.6779, test_loss: 1.1080, test_f1: 0.6102
 epoch: 74, train_loss: 0.6582, test_loss: 1.0274, test_f1: 0.6270
 epoch: 75, train_loss: 0.6313, test_loss: 0.9866, test_f1: 0.5955
 epoch: 76, train_loss: 0.6566, test_loss: 0.9841, test_f1: 0.6121
 epoch: 77, train_loss: 0.6551, test_loss: 1.0409, test_f1: 0.5999
 epoch: 78, train_loss: 0.6415, test_loss: 0.9772, test_f1: 0.5838
 epoch: 79, train_loss: 0.6435, test_loss: 0.9459, test_f1: 0.6157
 epoch: 80, train_loss: 0.6358, test_loss: 0.9971, test_f1: 0.5796
 epoch: 81, train_loss: 0.6373, test_loss: 0.9737, test_f1: 0.6164
 epoch: 82, train_loss: 0.6347, test_loss: 0.9418, test_f1: 0.6410
 epoch: 83, train_loss: 0.6270, test_loss: 1.0041, test_f1: 0.6241
 epoch: 84, train_loss: 0.6303, test_loss: 0.9639, test_f1: 0.6026
 epoch: 85, train_loss: 0.6236, test_loss: 0.9940, test_f1: 0.6169
 epoch: 86, train_loss: 0.6313, test_loss: 0.9814, test_f1: 0.6296
 epoch: 87, train_loss: 0.6274, test_loss: 0.9517, test_f1: 0.6207
 epoch: 88, train_loss: 0.6367, test_loss: 0.9435, test_f1: 0.6222
 epoch: 89, train_loss: 0.6268, test_loss: 0.9975, test_f1: 0.6406
 epoch: 90, train_loss: 0.6168, test_loss: 0.9615, test_f1: 0.6198
 epoch: 91, train_loss: 0.6233, test_loss: 0.9669, test_f1: 0.5998
 epoch: 92, train_loss: 0.6291, test_loss: 0.9656, test_f1: 0.6372
 epoch: 93, train_loss: 0.6112, test_loss: 1.0165, test_f1: 0.6183
 epoch: 94, train_loss: 0.6184, test_loss: 0.9675, test_f1: 0.6372
 epoch: 95, train_loss: 0.6088, test_loss: 0.9710, test_f1: 0.6289
 epoch: 96, train_loss: 0.6149, test_loss: 0.9730, test_f1: 0.6293
 epoch: 97, train_loss: 0.6125, test_loss: 1.0031, test_f1: 0.6339
 epoch: 98, train_loss: 0.6198, test_loss: 1.0616, test_f1: 0.5760
 epoch: 99, train_loss: 0.6058, test_loss: 0.9619, test_f1: 0.6031
##################ITERATION #8 ****************************************
 epoch: 0, train_loss: 1.3794, test_loss: 1.0667, test_f1: 0.4060
 epoch: 1, train_loss: 1.0911, test_loss: 0.9875, test_f1: 0.4808
 epoch: 2, train_loss: 1.0314, test_loss: 0.9673, test_f1: 0.4989
 epoch: 3, train_loss: 0.9970, test_loss: 0.9594, test_f1: 0.5005
 epoch: 4, train_loss: 0.9797, test_loss: 0.9494, test_f1: 0.4818
 epoch: 5, train_loss: 0.9478, test_loss: 0.9417, test_f1: 0.4764
 epoch: 6, train_loss: 0.9443, test_loss: 0.9271, test_f1: 0.5008
 epoch: 7, train_loss: 0.9224, test_loss: 0.9601, test_f1: 0.4888
 epoch: 8, train_loss: 0.9144, test_loss: 0.9361, test_f1: 0.4906
 epoch: 9, train_loss: 0.9097, test_loss: 0.9134, test_f1: 0.4908
 epoch: 10, train_loss: 0.9037, test_loss: 0.9262, test_f1: 0.5147
 epoch: 11, train_loss: 0.9115, test_loss: 0.9205, test_f1: 0.5379
 epoch: 12, train_loss: 0.8865, test_loss: 0.9219, test_f1: 0.5598
 epoch: 13, train_loss: 0.8730, test_loss: 0.8970, test_f1: 0.5258
 epoch: 14, train_loss: 0.8653, test_loss: 0.9292, test_f1: 0.5021
 epoch: 15, train_loss: 0.8637, test_loss: 0.9130, test_f1: 0.5242
 epoch: 16, train_loss: 0.8454, test_loss: 0.9065, test_f1: 0.5193
 epoch: 17, train_loss: 0.8454, test_loss: 0.8779, test_f1: 0.5346
 epoch: 18, train_loss: 0.8486, test_loss: 0.9162, test_f1: 0.5238
 epoch: 19, train_loss: 0.8243, test_loss: 0.9134, test_f1: 0.5427
 epoch: 20, train_loss: 0.8134, test_loss: 0.8785, test_f1: 0.5433
 epoch: 21, train_loss: 0.8105, test_loss: 0.9079, test_f1: 0.5360
 epoch: 22, train_loss: 0.8119, test_loss: 0.8659, test_f1: 0.5476
 epoch: 23, train_loss: 0.8098, test_loss: 0.9111, test_f1: 0.5536
 epoch: 24, train_loss: 0.7935, test_loss: 0.9145, test_f1: 0.5335
 epoch: 25, train_loss: 0.7920, test_loss: 0.9557, test_f1: 0.5482
 epoch: 26, train_loss: 0.7964, test_loss: 0.8986, test_f1: 0.5521
 epoch: 27, train_loss: 0.7831, test_loss: 0.8944, test_f1: 0.5618
 epoch: 28, train_loss: 0.7668, test_loss: 0.9156, test_f1: 0.5757
 epoch: 29, train_loss: 0.7719, test_loss: 0.9301, test_f1: 0.5622
 epoch: 30, train_loss: 0.7751, test_loss: 0.9148, test_f1: 0.5864
 epoch: 31, train_loss: 0.7625, test_loss: 0.9235, test_f1: 0.5556
 epoch: 32, train_loss: 0.7629, test_loss: 0.9158, test_f1: 0.5828
 epoch: 33, train_loss: 0.7462, test_loss: 0.9162, test_f1: 0.5807
 epoch: 34, train_loss: 0.7555, test_loss: 0.8787, test_f1: 0.5979
 epoch: 35, train_loss: 0.7455, test_loss: 0.9403, test_f1: 0.5918
 epoch: 36, train_loss: 0.7314, test_loss: 0.9220, test_f1: 0.6019
 epoch: 37, train_loss: 0.7432, test_loss: 0.9108, test_f1: 0.5974
 epoch: 38, train_loss: 0.7306, test_loss: 0.8705, test_f1: 0.6026
 epoch: 39, train_loss: 0.7301, test_loss: 0.8677, test_f1: 0.5676
 epoch: 40, train_loss: 0.7367, test_loss: 0.8956, test_f1: 0.6110
 epoch: 41, train_loss: 0.7297, test_loss: 0.9260, test_f1: 0.6119
 epoch: 42, train_loss: 0.7297, test_loss: 0.9212, test_f1: 0.6094
 epoch: 43, train_loss: 0.7138, test_loss: 0.9212, test_f1: 0.6266
 epoch: 44, train_loss: 0.7043, test_loss: 0.9094, test_f1: 0.5703
 epoch: 45, train_loss: 0.7096, test_loss: 0.9594, test_f1: 0.5451
 epoch: 46, train_loss: 0.7098, test_loss: 0.9726, test_f1: 0.5778
 epoch: 47, train_loss: 0.7109, test_loss: 0.9039, test_f1: 0.6079
 epoch: 48, train_loss: 0.7018, test_loss: 0.9217, test_f1: 0.5847
 epoch: 49, train_loss: 0.7128, test_loss: 0.9126, test_f1: 0.5672
 epoch: 50, train_loss: 0.6949, test_loss: 0.9120, test_f1: 0.5720
 epoch: 51, train_loss: 0.6789, test_loss: 0.9252, test_f1: 0.6114
 epoch: 52, train_loss: 0.6641, test_loss: 0.9117, test_f1: 0.5893
 epoch: 53, train_loss: 0.6647, test_loss: 0.9298, test_f1: 0.5865
 epoch: 54, train_loss: 0.6564, test_loss: 0.8973, test_f1: 0.5973
 epoch: 55, train_loss: 0.6635, test_loss: 0.9161, test_f1: 0.6076
 epoch: 56, train_loss: 0.6449, test_loss: 0.9276, test_f1: 0.6061
 epoch: 57, train_loss: 0.6392, test_loss: 0.9054, test_f1: 0.6170
 epoch: 58, train_loss: 0.6504, test_loss: 0.9041, test_f1: 0.6184
 epoch: 59, train_loss: 0.6427, test_loss: 0.9108, test_f1: 0.6207
 epoch: 60, train_loss: 0.6472, test_loss: 0.9450, test_f1: 0.5846
 epoch: 61, train_loss: 0.6544, test_loss: 0.9221, test_f1: 0.6056
 epoch: 62, train_loss: 0.6435, test_loss: 0.9260, test_f1: 0.6080
 epoch: 63, train_loss: 0.6360, test_loss: 0.9531, test_f1: 0.5962
 epoch: 64, train_loss: 0.6388, test_loss: 0.9424, test_f1: 0.6000
 epoch: 65, train_loss: 0.6397, test_loss: 0.9391, test_f1: 0.6055
 epoch: 66, train_loss: 0.6320, test_loss: 0.9084, test_f1: 0.5921
 epoch: 67, train_loss: 0.6319, test_loss: 0.9545, test_f1: 0.6112
 epoch: 68, train_loss: 0.6398, test_loss: 0.9369, test_f1: 0.6187
 epoch: 69, train_loss: 0.6336, test_loss: 0.9246, test_f1: 0.6308
 epoch: 70, train_loss: 0.6291, test_loss: 0.9399, test_f1: 0.6015
 epoch: 71, train_loss: 0.6180, test_loss: 0.9455, test_f1: 0.6265
 epoch: 72, train_loss: 0.6296, test_loss: 0.9431, test_f1: 0.6057
 epoch: 73, train_loss: 0.6168, test_loss: 0.9424, test_f1: 0.6156
 epoch: 74, train_loss: 0.6110, test_loss: 0.8856, test_f1: 0.6533
 epoch: 75, train_loss: 0.6241, test_loss: 0.9128, test_f1: 0.6175
 epoch: 76, train_loss: 0.6188, test_loss: 0.9653, test_f1: 0.5875
 epoch: 77, train_loss: 0.6328, test_loss: 0.9295, test_f1: 0.5987
 epoch: 78, train_loss: 0.6166, test_loss: 0.9028, test_f1: 0.6375
 epoch: 79, train_loss: 0.5936, test_loss: 0.9302, test_f1: 0.6369
 epoch: 80, train_loss: 0.6113, test_loss: 0.9676, test_f1: 0.6033
 epoch: 81, train_loss: 0.6114, test_loss: 0.9290, test_f1: 0.6518
 epoch: 82, train_loss: 0.6198, test_loss: 0.9317, test_f1: 0.6206
 epoch: 83, train_loss: 0.6027, test_loss: 0.9242, test_f1: 0.6133
 epoch: 84, train_loss: 0.6186, test_loss: 0.8978, test_f1: 0.5917
 epoch: 85, train_loss: 0.5962, test_loss: 0.9293, test_f1: 0.6066
 epoch: 86, train_loss: 0.6028, test_loss: 0.9389, test_f1: 0.6219
 epoch: 87, train_loss: 0.5962, test_loss: 0.9334, test_f1: 0.6160
 epoch: 88, train_loss: 0.5938, test_loss: 0.9695, test_f1: 0.6029
 epoch: 89, train_loss: 0.5989, test_loss: 0.9273, test_f1: 0.6195
 epoch: 90, train_loss: 0.5945, test_loss: 0.9647, test_f1: 0.6088
 epoch: 91, train_loss: 0.6089, test_loss: 0.9195, test_f1: 0.6170
 epoch: 92, train_loss: 0.5939, test_loss: 0.9506, test_f1: 0.6210
 epoch: 93, train_loss: 0.5932, test_loss: 0.9593, test_f1: 0.6123
 epoch: 94, train_loss: 0.5996, test_loss: 1.0002, test_f1: 0.6261
 epoch: 95, train_loss: 0.6000, test_loss: 0.9666, test_f1: 0.5863
 epoch: 96, train_loss: 0.5877, test_loss: 0.9734, test_f1: 0.6021
 epoch: 97, train_loss: 0.5831, test_loss: 0.9759, test_f1: 0.6046
 epoch: 98, train_loss: 0.5805, test_loss: 0.9766, test_f1: 0.6059
 epoch: 99, train_loss: 0.5792, test_loss: 0.9485, test_f1: 0.6346
##################ITERATION #9 ****************************************
 epoch: 0, train_loss: 1.3757, test_loss: 1.1044, test_f1: 0.4487
 epoch: 1, train_loss: 1.1142, test_loss: 1.0009, test_f1: 0.4953
 epoch: 2, train_loss: 1.0621, test_loss: 0.9785, test_f1: 0.4961
 epoch: 3, train_loss: 1.0055, test_loss: 0.9774, test_f1: 0.4783
 epoch: 4, train_loss: 0.9910, test_loss: 0.9727, test_f1: 0.4930
 epoch: 5, train_loss: 0.9840, test_loss: 0.9728, test_f1: 0.4900
 epoch: 6, train_loss: 0.9486, test_loss: 0.9507, test_f1: 0.4962
 epoch: 7, train_loss: 0.9375, test_loss: 0.9584, test_f1: 0.5074
 epoch: 8, train_loss: 0.9246, test_loss: 0.9773, test_f1: 0.5167
 epoch: 9, train_loss: 0.9110, test_loss: 0.9541, test_f1: 0.5126
 epoch: 10, train_loss: 0.9046, test_loss: 0.9654, test_f1: 0.5311
 epoch: 11, train_loss: 0.9026, test_loss: 0.9271, test_f1: 0.5365
 epoch: 12, train_loss: 0.8883, test_loss: 0.9561, test_f1: 0.5421
 epoch: 13, train_loss: 0.8750, test_loss: 0.9449, test_f1: 0.5332
 epoch: 14, train_loss: 0.8796, test_loss: 0.9371, test_f1: 0.5334
 epoch: 15, train_loss: 0.8570, test_loss: 0.9218, test_f1: 0.5412
 epoch: 16, train_loss: 0.8597, test_loss: 0.9421, test_f1: 0.5610
 epoch: 17, train_loss: 0.8478, test_loss: 0.9735, test_f1: 0.5247
 epoch: 18, train_loss: 0.8494, test_loss: 0.9658, test_f1: 0.5437
 epoch: 19, train_loss: 0.8326, test_loss: 0.9674, test_f1: 0.5365
 epoch: 20, train_loss: 0.8297, test_loss: 0.9676, test_f1: 0.5522
 epoch: 21, train_loss: 0.8288, test_loss: 0.9744, test_f1: 0.5564
 epoch: 22, train_loss: 0.8282, test_loss: 0.9574, test_f1: 0.5574
 epoch: 23, train_loss: 0.8135, test_loss: 0.9743, test_f1: 0.5422
 epoch: 24, train_loss: 0.8125, test_loss: 0.9743, test_f1: 0.5448
 epoch: 25, train_loss: 0.8263, test_loss: 0.9723, test_f1: 0.5609
 epoch: 26, train_loss: 0.8052, test_loss: 0.9758, test_f1: 0.5606
 epoch: 27, train_loss: 0.8005, test_loss: 1.0034, test_f1: 0.5914
 epoch: 28, train_loss: 0.8122, test_loss: 0.9522, test_f1: 0.5652
 epoch: 29, train_loss: 0.7968, test_loss: 0.9960, test_f1: 0.5454
 epoch: 30, train_loss: 0.7883, test_loss: 1.0080, test_f1: 0.5500
 epoch: 31, train_loss: 0.7817, test_loss: 0.9621, test_f1: 0.5629
 epoch: 32, train_loss: 0.7904, test_loss: 1.0051, test_f1: 0.5573
 epoch: 33, train_loss: 0.7797, test_loss: 1.0004, test_f1: 0.5511
 epoch: 34, train_loss: 0.7834, test_loss: 1.0042, test_f1: 0.5687
 epoch: 35, train_loss: 0.7669, test_loss: 1.0044, test_f1: 0.5491
 epoch: 36, train_loss: 0.7597, test_loss: 1.0027, test_f1: 0.5329
 epoch: 37, train_loss: 0.7649, test_loss: 0.9987, test_f1: 0.5663
 epoch: 38, train_loss: 0.7603, test_loss: 0.9502, test_f1: 0.5954
 epoch: 39, train_loss: 0.7491, test_loss: 1.0138, test_f1: 0.5689
 epoch: 40, train_loss: 0.7639, test_loss: 0.9826, test_f1: 0.5760
 epoch: 41, train_loss: 0.7479, test_loss: 1.0603, test_f1: 0.5656
 epoch: 42, train_loss: 0.7415, test_loss: 0.9849, test_f1: 0.5839
 epoch: 43, train_loss: 0.7492, test_loss: 1.0245, test_f1: 0.5765
 epoch: 44, train_loss: 0.7308, test_loss: 0.9650, test_f1: 0.5747
 epoch: 45, train_loss: 0.7429, test_loss: 0.9621, test_f1: 0.5846
 epoch: 46, train_loss: 0.7498, test_loss: 0.9301, test_f1: 0.5840
 epoch: 47, train_loss: 0.7382, test_loss: 0.9849, test_f1: 0.5982
 epoch: 48, train_loss: 0.7371, test_loss: 0.9815, test_f1: 0.5933
 epoch: 49, train_loss: 0.7215, test_loss: 1.0867, test_f1: 0.5686
 epoch: 50, train_loss: 0.7235, test_loss: 0.9681, test_f1: 0.5852
 epoch: 51, train_loss: 0.7108, test_loss: 0.9687, test_f1: 0.5931
 epoch: 52, train_loss: 0.6952, test_loss: 0.9899, test_f1: 0.5894
 epoch: 53, train_loss: 0.7051, test_loss: 1.0052, test_f1: 0.6059
 epoch: 54, train_loss: 0.6919, test_loss: 0.9485, test_f1: 0.6024
 epoch: 55, train_loss: 0.6895, test_loss: 0.9927, test_f1: 0.6128
 epoch: 56, train_loss: 0.6835, test_loss: 1.0135, test_f1: 0.6028
 epoch: 57, train_loss: 0.6831, test_loss: 0.9872, test_f1: 0.5983
 epoch: 58, train_loss: 0.6821, test_loss: 1.0288, test_f1: 0.5975
 epoch: 59, train_loss: 0.6641, test_loss: 1.0296, test_f1: 0.5939
 epoch: 60, train_loss: 0.6701, test_loss: 0.9856, test_f1: 0.6082
 epoch: 61, train_loss: 0.6690, test_loss: 1.0001, test_f1: 0.6399
 epoch: 62, train_loss: 0.6661, test_loss: 0.9773, test_f1: 0.6231
 epoch: 63, train_loss: 0.6670, test_loss: 0.9710, test_f1: 0.6187
 epoch: 64, train_loss: 0.6550, test_loss: 0.9965, test_f1: 0.6321
 epoch: 65, train_loss: 0.6500, test_loss: 1.0052, test_f1: 0.6176
 epoch: 66, train_loss: 0.6548, test_loss: 1.0067, test_f1: 0.6056
 epoch: 67, train_loss: 0.6554, test_loss: 1.0250, test_f1: 0.6197
 epoch: 68, train_loss: 0.6549, test_loss: 1.0134, test_f1: 0.6314
 epoch: 69, train_loss: 0.6591, test_loss: 1.0142, test_f1: 0.6388
 epoch: 70, train_loss: 0.6447, test_loss: 1.0243, test_f1: 0.6301
 epoch: 71, train_loss: 0.6610, test_loss: 0.9927, test_f1: 0.6267
 epoch: 72, train_loss: 0.6535, test_loss: 1.0366, test_f1: 0.6299
 epoch: 73, train_loss: 0.6424, test_loss: 1.0347, test_f1: 0.6176
 epoch: 74, train_loss: 0.6452, test_loss: 1.0285, test_f1: 0.6106
 epoch: 75, train_loss: 0.6365, test_loss: 1.0170, test_f1: 0.6207
 epoch: 76, train_loss: 0.6378, test_loss: 1.0158, test_f1: 0.6398
 epoch: 77, train_loss: 0.6463, test_loss: 1.0393, test_f1: 0.6134
 epoch: 78, train_loss: 0.6376, test_loss: 1.0197, test_f1: 0.6185
 epoch: 79, train_loss: 0.6304, test_loss: 1.0058, test_f1: 0.6405
 epoch: 80, train_loss: 0.6299, test_loss: 1.0320, test_f1: 0.6197
 epoch: 81, train_loss: 0.6245, test_loss: 1.0530, test_f1: 0.6170
 epoch: 82, train_loss: 0.6312, test_loss: 1.0541, test_f1: 0.6293
 epoch: 83, train_loss: 0.6329, test_loss: 1.0341, test_f1: 0.6601
 epoch: 84, train_loss: 0.6288, test_loss: 1.0276, test_f1: 0.6512
 epoch: 85, train_loss: 0.6307, test_loss: 1.0231, test_f1: 0.6178
 epoch: 86, train_loss: 0.6262, test_loss: 1.0386, test_f1: 0.6345
 epoch: 87, train_loss: 0.6233, test_loss: 1.0256, test_f1: 0.6314
 epoch: 88, train_loss: 0.6119, test_loss: 1.0737, test_f1: 0.6376
 epoch: 89, train_loss: 0.6178, test_loss: 1.0260, test_f1: 0.6456
 epoch: 90, train_loss: 0.6131, test_loss: 1.0495, test_f1: 0.6431
 epoch: 91, train_loss: 0.6215, test_loss: 1.0239, test_f1: 0.6304
 epoch: 92, train_loss: 0.6244, test_loss: 1.0610, test_f1: 0.6198
 epoch: 93, train_loss: 0.6034, test_loss: 1.0582, test_f1: 0.6367
 epoch: 94, train_loss: 0.6083, test_loss: 1.0580, test_f1: 0.6270
 epoch: 95, train_loss: 0.6153, test_loss: 1.0906, test_f1: 0.6421
 epoch: 96, train_loss: 0.6027, test_loss: 1.0425, test_f1: 0.6497
 epoch: 97, train_loss: 0.6144, test_loss: 1.0642, test_f1: 0.6598
 epoch: 98, train_loss: 0.6052, test_loss: 1.0779, test_f1: 0.6285
 epoch: 99, train_loss: 0.5898, test_loss: 1.0628, test_f1: 0.6337

Training completed in 618.13 seconds
Best F1: 0.6985 at epoch 82
Mean F1 across iterations: 0.6632  0.0153
========================FINAL RESULTS================================
FEGIN weighted F1: 0.6985  0.0153
python main.py --data ltspice_examples --representation component_net --model FEGIN --layers 3 --hiddens 32 --batch_size 64 --lr 0.001 --emb_size 128 --epochs 100 --save_appendix component_net_L3_H32_BS64_LR0.001_E128 --no_val
-----



STDERR:
  File "main.py", line 370, in <module>
    main()
  File "main.py", line 254, in main
    dataset = dataset_class(
  File "/home/philip/projects/ltspice_examples_code_repo/Circuit-Completion-Using-GNNs/component_classification_with_link_prediction_head/evaluation/FEGIN/kernel/circuit_datasets.py", line 15, in __init__
    self.data, self.slices = torch.load(self.processed_paths[0])
  File "/home/philip/.local/lib/python3.8/site-packages/torch/serialization.py", line 1040, in load
    warnings.warn(
  File "/usr/lib/python3.8/warnings.py", line 109, in _showwarnmsg
    sw(msg.message, msg.category, msg.filename, msg.lineno,
  File "main.py", line 47, in warn_with_traceback
    traceback.print_stack(file=log)
/home/philip/projects/ltspice_examples_code_repo/Circuit-Completion-Using-GNNs/component_classification_with_link_prediction_head/evaluation/FEGIN/kernel/circuit_datasets.py:15: FutureWarning: You are using `torch.load` with `weights_only=False` (the current default value), which uses the default pickle module implicitly. It is possible to construct malicious pickle data which will execute arbitrary code during unpickling (See https://github.com/pytorch/pytorch/blob/main/SECURITY.md#untrusted-models for more details). In a future release, the default value for `weights_only` will be flipped to `True`. This limits the functions that could be executed during unpickling. Arbitrary objects will no longer be allowed to be loaded via this mode unless they are explicitly allowlisted by the user via `torch.serialization.add_safe_globals`. We recommend you start setting `weights_only=True` for any use case where you don't have full control of the loaded file. Please open an issue on GitHub for any issues related to this experimental feature.
  self.data, self.slices = torch.load(self.processed_paths[0])
