STDOUT:
Results will be saved in /home/philip/projects/llm_inference_code_repo/Circuit-Completion-Using-GNNs/component_classification_with_link_prediction_head/evaluation/FEGIN/results/model_FEGIN_dataset_ltspice_examples
Command line input: python main.py --data ltspice_examples --representation component_pin_net --model FEGIN --layers 4 --hiddens 128 --batch_size 32 --lr 0.0001 --emb_size 512 --epochs 100 --save_appendix component_pin_net_L4_H128_BS32_LR0.0001_E512 --no_val
 is saved.
-----
ltspice_examples - FEGIN
Using 4 layers, 128 hidden units, h = 2
Loading component_pin_net representation dataset
ENTERED
Training FEGIN on component_pin_net representation
Train: 3558, Test: 846
##################ITERATION #0 ****************************************
 epoch: 0, train_loss: 1.2951, test_loss: 1.1211, test_f1: 0.3422
 epoch: 1, train_loss: 1.0985, test_loss: 1.0717, test_f1: 0.3469
 epoch: 2, train_loss: 1.0431, test_loss: 1.0573, test_f1: 0.3809
 epoch: 3, train_loss: 1.0192, test_loss: 1.0289, test_f1: 0.4736
 epoch: 4, train_loss: 0.9885, test_loss: 0.9905, test_f1: 0.4853
 epoch: 5, train_loss: 0.9590, test_loss: 0.9725, test_f1: 0.5004
 epoch: 6, train_loss: 0.9455, test_loss: 0.9620, test_f1: 0.5287
 epoch: 7, train_loss: 0.9312, test_loss: 0.9306, test_f1: 0.5444
 epoch: 8, train_loss: 0.9163, test_loss: 0.9428, test_f1: 0.5308
 epoch: 9, train_loss: 0.9029, test_loss: 0.9160, test_f1: 0.5386
 epoch: 10, train_loss: 0.8973, test_loss: 0.9091, test_f1: 0.5399
 epoch: 11, train_loss: 0.8737, test_loss: 0.9059, test_f1: 0.5496
 epoch: 12, train_loss: 0.8734, test_loss: 0.9094, test_f1: 0.5244
 epoch: 13, train_loss: 0.8586, test_loss: 0.8825, test_f1: 0.5551
 epoch: 14, train_loss: 0.8537, test_loss: 0.9026, test_f1: 0.5410
 epoch: 15, train_loss: 0.8543, test_loss: 0.8898, test_f1: 0.5220
 epoch: 16, train_loss: 0.8418, test_loss: 0.8626, test_f1: 0.5468
 epoch: 17, train_loss: 0.8347, test_loss: 0.8668, test_f1: 0.5595
 epoch: 18, train_loss: 0.8282, test_loss: 0.8686, test_f1: 0.5462
 epoch: 19, train_loss: 0.8040, test_loss: 0.8379, test_f1: 0.5675
 epoch: 20, train_loss: 0.8135, test_loss: 0.8504, test_f1: 0.5697
 epoch: 21, train_loss: 0.8013, test_loss: 0.8463, test_f1: 0.5587
 epoch: 22, train_loss: 0.7989, test_loss: 0.8523, test_f1: 0.5446
 epoch: 23, train_loss: 0.7823, test_loss: 0.8403, test_f1: 0.5651
 epoch: 24, train_loss: 0.7985, test_loss: 0.8718, test_f1: 0.5481
 epoch: 25, train_loss: 0.7696, test_loss: 0.8638, test_f1: 0.5625
 epoch: 26, train_loss: 0.7719, test_loss: 0.8427, test_f1: 0.5425
 epoch: 27, train_loss: 0.7608, test_loss: 0.8531, test_f1: 0.5652
 epoch: 28, train_loss: 0.7617, test_loss: 0.8372, test_f1: 0.5586
 epoch: 29, train_loss: 0.7552, test_loss: 0.8226, test_f1: 0.5558
 epoch: 30, train_loss: 0.7380, test_loss: 0.8663, test_f1: 0.5647
 epoch: 31, train_loss: 0.7443, test_loss: 0.8203, test_f1: 0.5950
 epoch: 32, train_loss: 0.7365, test_loss: 0.7872, test_f1: 0.5984
 epoch: 33, train_loss: 0.7257, test_loss: 0.8551, test_f1: 0.5670
 epoch: 34, train_loss: 0.7151, test_loss: 0.8773, test_f1: 0.5620
 epoch: 35, train_loss: 0.7123, test_loss: 0.8592, test_f1: 0.5822
 epoch: 36, train_loss: 0.7083, test_loss: 0.8598, test_f1: 0.5761
 epoch: 37, train_loss: 0.6892, test_loss: 0.8271, test_f1: 0.5928
 epoch: 38, train_loss: 0.6835, test_loss: 0.8356, test_f1: 0.5969
 epoch: 39, train_loss: 0.6929, test_loss: 0.8285, test_f1: 0.6034
 epoch: 40, train_loss: 0.6688, test_loss: 0.8359, test_f1: 0.5753
 epoch: 41, train_loss: 0.6754, test_loss: 0.8003, test_f1: 0.6415
 epoch: 42, train_loss: 0.6619, test_loss: 0.8471, test_f1: 0.5910
 epoch: 43, train_loss: 0.6674, test_loss: 0.8390, test_f1: 0.5701
 epoch: 44, train_loss: 0.6672, test_loss: 0.8239, test_f1: 0.6407
 epoch: 45, train_loss: 0.6566, test_loss: 0.8166, test_f1: 0.5835
 epoch: 46, train_loss: 0.6359, test_loss: 0.8451, test_f1: 0.6376
 epoch: 47, train_loss: 0.6418, test_loss: 0.8564, test_f1: 0.5934
 epoch: 48, train_loss: 0.6380, test_loss: 0.9122, test_f1: 0.6159
 epoch: 49, train_loss: 0.6320, test_loss: 0.8626, test_f1: 0.6218
 epoch: 50, train_loss: 0.6182, test_loss: 0.8627, test_f1: 0.5982
 epoch: 51, train_loss: 0.6036, test_loss: 0.8149, test_f1: 0.6496
 epoch: 52, train_loss: 0.5850, test_loss: 0.8365, test_f1: 0.6293
 epoch: 53, train_loss: 0.5919, test_loss: 0.8191, test_f1: 0.6336
 epoch: 54, train_loss: 0.5883, test_loss: 0.8431, test_f1: 0.6190
 epoch: 55, train_loss: 0.5726, test_loss: 0.8777, test_f1: 0.6427
 epoch: 56, train_loss: 0.5822, test_loss: 0.8727, test_f1: 0.6317
 epoch: 57, train_loss: 0.5761, test_loss: 0.9197, test_f1: 0.6359
 epoch: 58, train_loss: 0.5657, test_loss: 0.8973, test_f1: 0.6401
 epoch: 59, train_loss: 0.5783, test_loss: 0.8922, test_f1: 0.6240
 epoch: 60, train_loss: 0.5683, test_loss: 0.9054, test_f1: 0.6485
 epoch: 61, train_loss: 0.5641, test_loss: 0.8771, test_f1: 0.6373
 epoch: 62, train_loss: 0.5578, test_loss: 0.9343, test_f1: 0.6296
 epoch: 63, train_loss: 0.5547, test_loss: 0.8486, test_f1: 0.6393
 epoch: 64, train_loss: 0.5450, test_loss: 0.9434, test_f1: 0.6307
 epoch: 65, train_loss: 0.5520, test_loss: 0.8326, test_f1: 0.6529
 epoch: 66, train_loss: 0.5551, test_loss: 0.9404, test_f1: 0.6376
 epoch: 67, train_loss: 0.5435, test_loss: 0.8778, test_f1: 0.6500
 epoch: 68, train_loss: 0.5552, test_loss: 0.9198, test_f1: 0.6352
 epoch: 69, train_loss: 0.5331, test_loss: 0.9010, test_f1: 0.6547
 epoch: 70, train_loss: 0.5435, test_loss: 0.9702, test_f1: 0.6632
 epoch: 71, train_loss: 0.5306, test_loss: 0.9386, test_f1: 0.6332
 epoch: 72, train_loss: 0.5326, test_loss: 0.9008, test_f1: 0.6353
 epoch: 73, train_loss: 0.5302, test_loss: 0.9594, test_f1: 0.6330
 epoch: 74, train_loss: 0.5267, test_loss: 0.9709, test_f1: 0.6368
 epoch: 75, train_loss: 0.5221, test_loss: 0.9237, test_f1: 0.6366
 epoch: 76, train_loss: 0.5147, test_loss: 0.9031, test_f1: 0.6403
 epoch: 77, train_loss: 0.5262, test_loss: 0.9323, test_f1: 0.6369
 epoch: 78, train_loss: 0.5166, test_loss: 0.9695, test_f1: 0.6322
 epoch: 79, train_loss: 0.5086, test_loss: 0.9453, test_f1: 0.6352
 epoch: 80, train_loss: 0.4996, test_loss: 0.9185, test_f1: 0.6480
 epoch: 81, train_loss: 0.5124, test_loss: 0.9551, test_f1: 0.6434
 epoch: 82, train_loss: 0.4834, test_loss: 0.9593, test_f1: 0.6448
 epoch: 83, train_loss: 0.5056, test_loss: 0.9312, test_f1: 0.6422
 epoch: 84, train_loss: 0.5023, test_loss: 0.9459, test_f1: 0.6602
 epoch: 85, train_loss: 0.4910, test_loss: 0.9023, test_f1: 0.6654
 epoch: 86, train_loss: 0.4933, test_loss: 0.9796, test_f1: 0.6302
 epoch: 87, train_loss: 0.4941, test_loss: 0.9876, test_f1: 0.6312
 epoch: 88, train_loss: 0.4774, test_loss: 0.9925, test_f1: 0.6483
 epoch: 89, train_loss: 0.4834, test_loss: 1.0174, test_f1: 0.6335
 epoch: 90, train_loss: 0.4807, test_loss: 1.0252, test_f1: 0.6374
 epoch: 91, train_loss: 0.4788, test_loss: 1.0093, test_f1: 0.6349
 epoch: 92, train_loss: 0.4694, test_loss: 1.0686, test_f1: 0.6253
 epoch: 93, train_loss: 0.4768, test_loss: 1.0782, test_f1: 0.6439
 epoch: 94, train_loss: 0.4736, test_loss: 1.0290, test_f1: 0.6284
 epoch: 95, train_loss: 0.4839, test_loss: 1.1754, test_f1: 0.6319
 epoch: 96, train_loss: 0.4745, test_loss: 1.1290, test_f1: 0.6278
 epoch: 97, train_loss: 0.4672, test_loss: 1.1675, test_f1: 0.6144
 epoch: 98, train_loss: 0.4597, test_loss: 1.0610, test_f1: 0.6407
 epoch: 99, train_loss: 0.4628, test_loss: 1.0622, test_f1: 0.6182
##################ITERATION #1 ****************************************
 epoch: 0, train_loss: 1.1712, test_loss: 1.0210, test_f1: 0.4304
 epoch: 1, train_loss: 1.0152, test_loss: 0.9746, test_f1: 0.4814
 epoch: 2, train_loss: 0.9799, test_loss: 0.9705, test_f1: 0.4996
 epoch: 3, train_loss: 0.9578, test_loss: 0.9299, test_f1: 0.5243
 epoch: 4, train_loss: 0.9336, test_loss: 0.9250, test_f1: 0.5068
 epoch: 5, train_loss: 0.9132, test_loss: 0.9079, test_f1: 0.5286
 epoch: 6, train_loss: 0.9008, test_loss: 0.9029, test_f1: 0.5319
 epoch: 7, train_loss: 0.8854, test_loss: 0.9094, test_f1: 0.5279
 epoch: 8, train_loss: 0.8772, test_loss: 0.9047, test_f1: 0.5264
 epoch: 9, train_loss: 0.8575, test_loss: 0.8898, test_f1: 0.5549
 epoch: 10, train_loss: 0.8475, test_loss: 0.8666, test_f1: 0.5346
 epoch: 11, train_loss: 0.8388, test_loss: 0.8884, test_f1: 0.5339
 epoch: 12, train_loss: 0.8298, test_loss: 0.8274, test_f1: 0.5612
 epoch: 13, train_loss: 0.8182, test_loss: 0.8308, test_f1: 0.5657
 epoch: 14, train_loss: 0.8011, test_loss: 0.8642, test_f1: 0.5370
 epoch: 15, train_loss: 0.7845, test_loss: 0.8671, test_f1: 0.5671
 epoch: 16, train_loss: 0.7848, test_loss: 0.8170, test_f1: 0.6031
 epoch: 17, train_loss: 0.7821, test_loss: 0.8298, test_f1: 0.5756
 epoch: 18, train_loss: 0.7722, test_loss: 0.8459, test_f1: 0.6212
 epoch: 19, train_loss: 0.7595, test_loss: 0.8223, test_f1: 0.5869
 epoch: 20, train_loss: 0.7499, test_loss: 0.8250, test_f1: 0.5728
 epoch: 21, train_loss: 0.7367, test_loss: 0.8367, test_f1: 0.6094
 epoch: 22, train_loss: 0.7372, test_loss: 0.8625, test_f1: 0.5572
 epoch: 23, train_loss: 0.7260, test_loss: 0.8696, test_f1: 0.6154
 epoch: 24, train_loss: 0.7087, test_loss: 0.8425, test_f1: 0.5933
 epoch: 25, train_loss: 0.7023, test_loss: 0.8293, test_f1: 0.6124
 epoch: 26, train_loss: 0.6893, test_loss: 0.8256, test_f1: 0.6347
 epoch: 27, train_loss: 0.6956, test_loss: 0.8102, test_f1: 0.6568
 epoch: 28, train_loss: 0.6857, test_loss: 0.8478, test_f1: 0.6199
 epoch: 29, train_loss: 0.6809, test_loss: 0.8772, test_f1: 0.6098
 epoch: 30, train_loss: 0.6603, test_loss: 0.8831, test_f1: 0.6058
 epoch: 31, train_loss: 0.6643, test_loss: 0.8449, test_f1: 0.6108
 epoch: 32, train_loss: 0.6467, test_loss: 0.8482, test_f1: 0.6260
 epoch: 33, train_loss: 0.6509, test_loss: 0.8570, test_f1: 0.6437
 epoch: 34, train_loss: 0.6361, test_loss: 0.8266, test_f1: 0.6298
 epoch: 35, train_loss: 0.6415, test_loss: 0.8038, test_f1: 0.6422
 epoch: 36, train_loss: 0.6253, test_loss: 0.8110, test_f1: 0.6241
 epoch: 37, train_loss: 0.6141, test_loss: 0.8095, test_f1: 0.6686
 epoch: 38, train_loss: 0.6132, test_loss: 0.9412, test_f1: 0.6144
 epoch: 39, train_loss: 0.6128, test_loss: 0.8280, test_f1: 0.6457
 epoch: 40, train_loss: 0.6100, test_loss: 0.8082, test_f1: 0.6290
 epoch: 41, train_loss: 0.5970, test_loss: 0.8642, test_f1: 0.6641
 epoch: 42, train_loss: 0.5944, test_loss: 0.9282, test_f1: 0.6410
 epoch: 43, train_loss: 0.5921, test_loss: 0.9022, test_f1: 0.6304
 epoch: 44, train_loss: 0.5952, test_loss: 0.8527, test_f1: 0.6271
 epoch: 45, train_loss: 0.5881, test_loss: 0.9494, test_f1: 0.6164
 epoch: 46, train_loss: 0.5754, test_loss: 0.9765, test_f1: 0.6357
 epoch: 47, train_loss: 0.5557, test_loss: 1.0333, test_f1: 0.6223
 epoch: 48, train_loss: 0.5798, test_loss: 1.0000, test_f1: 0.6146
 epoch: 49, train_loss: 0.5630, test_loss: 0.9395, test_f1: 0.6234
 epoch: 50, train_loss: 0.5481, test_loss: 0.9614, test_f1: 0.6334
 epoch: 51, train_loss: 0.5394, test_loss: 0.9468, test_f1: 0.6507
 epoch: 52, train_loss: 0.5181, test_loss: 0.9390, test_f1: 0.6462
 epoch: 53, train_loss: 0.5072, test_loss: 1.0085, test_f1: 0.6302
 epoch: 54, train_loss: 0.5083, test_loss: 0.9781, test_f1: 0.6449
 epoch: 55, train_loss: 0.5040, test_loss: 1.0803, test_f1: 0.6175
 epoch: 56, train_loss: 0.5133, test_loss: 1.0359, test_f1: 0.6293
 epoch: 57, train_loss: 0.5091, test_loss: 1.0494, test_f1: 0.6323
 epoch: 58, train_loss: 0.4853, test_loss: 1.0829, test_f1: 0.6321
 epoch: 59, train_loss: 0.4976, test_loss: 1.0683, test_f1: 0.6317
 epoch: 60, train_loss: 0.4913, test_loss: 1.0679, test_f1: 0.6292
 epoch: 61, train_loss: 0.4985, test_loss: 1.0995, test_f1: 0.6320
 epoch: 62, train_loss: 0.4780, test_loss: 1.0899, test_f1: 0.6415
 epoch: 63, train_loss: 0.4845, test_loss: 1.1014, test_f1: 0.6350
 epoch: 64, train_loss: 0.4802, test_loss: 1.0933, test_f1: 0.6276
 epoch: 65, train_loss: 0.4782, test_loss: 1.1751, test_f1: 0.6341
 epoch: 66, train_loss: 0.4695, test_loss: 1.2129, test_f1: 0.6202
 epoch: 67, train_loss: 0.4738, test_loss: 1.1686, test_f1: 0.6383
 epoch: 68, train_loss: 0.4643, test_loss: 1.1690, test_f1: 0.6305
 epoch: 69, train_loss: 0.4673, test_loss: 1.2382, test_f1: 0.6000
 epoch: 70, train_loss: 0.4671, test_loss: 1.2516, test_f1: 0.6236
 epoch: 71, train_loss: 0.4707, test_loss: 1.2462, test_f1: 0.6206
 epoch: 72, train_loss: 0.4715, test_loss: 1.2128, test_f1: 0.6343
 epoch: 73, train_loss: 0.4372, test_loss: 1.2472, test_f1: 0.6279
 epoch: 74, train_loss: 0.4603, test_loss: 1.1924, test_f1: 0.6545
 epoch: 75, train_loss: 0.4545, test_loss: 1.1748, test_f1: 0.6437
 epoch: 76, train_loss: 0.4395, test_loss: 1.1953, test_f1: 0.6499
 epoch: 77, train_loss: 0.4433, test_loss: 1.2740, test_f1: 0.6486
 epoch: 78, train_loss: 0.4422, test_loss: 1.2477, test_f1: 0.6452
 epoch: 79, train_loss: 0.4442, test_loss: 1.2699, test_f1: 0.6407
 epoch: 80, train_loss: 0.4369, test_loss: 1.3411, test_f1: 0.6239
 epoch: 81, train_loss: 0.4235, test_loss: 1.3538, test_f1: 0.6268
 epoch: 82, train_loss: 0.4362, test_loss: 1.3035, test_f1: 0.6405
 epoch: 83, train_loss: 0.4392, test_loss: 1.2721, test_f1: 0.6407
 epoch: 84, train_loss: 0.4193, test_loss: 1.3329, test_f1: 0.6326
 epoch: 85, train_loss: 0.4179, test_loss: 1.2931, test_f1: 0.6401
 epoch: 86, train_loss: 0.4383, test_loss: 1.3070, test_f1: 0.6516
 epoch: 87, train_loss: 0.4109, test_loss: 1.3354, test_f1: 0.6402
 epoch: 88, train_loss: 0.4181, test_loss: 1.3349, test_f1: 0.6361
 epoch: 89, train_loss: 0.4168, test_loss: 1.3388, test_f1: 0.6504
 epoch: 90, train_loss: 0.4162, test_loss: 1.3369, test_f1: 0.6340
 epoch: 91, train_loss: 0.3861, test_loss: 1.3843, test_f1: 0.6401
 epoch: 92, train_loss: 0.4127, test_loss: 1.3782, test_f1: 0.6592
 epoch: 93, train_loss: 0.4056, test_loss: 1.3978, test_f1: 0.6395
 epoch: 94, train_loss: 0.3935, test_loss: 1.4354, test_f1: 0.6409
 epoch: 95, train_loss: 0.3953, test_loss: 1.4309, test_f1: 0.6539
 epoch: 96, train_loss: 0.3976, test_loss: 1.4239, test_f1: 0.6269
 epoch: 97, train_loss: 0.3895, test_loss: 1.4835, test_f1: 0.6292
 epoch: 98, train_loss: 0.3901, test_loss: 1.4479, test_f1: 0.6538
 epoch: 99, train_loss: 0.3878, test_loss: 1.4851, test_f1: 0.6360
##################ITERATION #2 ****************************************
 epoch: 0, train_loss: 1.1254, test_loss: 1.0192, test_f1: 0.4948
 epoch: 1, train_loss: 0.9949, test_loss: 0.9693, test_f1: 0.4967
 epoch: 2, train_loss: 0.9624, test_loss: 0.9375, test_f1: 0.5246
 epoch: 3, train_loss: 0.9302, test_loss: 0.9363, test_f1: 0.4843
 epoch: 4, train_loss: 0.9118, test_loss: 0.9112, test_f1: 0.5300
 epoch: 5, train_loss: 0.8905, test_loss: 0.8935, test_f1: 0.5326
 epoch: 6, train_loss: 0.8727, test_loss: 0.8454, test_f1: 0.5632
 epoch: 7, train_loss: 0.8564, test_loss: 0.8754, test_f1: 0.5628
 epoch: 8, train_loss: 0.8469, test_loss: 0.8385, test_f1: 0.5565
 epoch: 9, train_loss: 0.8291, test_loss: 0.8488, test_f1: 0.5519
 epoch: 10, train_loss: 0.8211, test_loss: 0.8314, test_f1: 0.5974
 epoch: 11, train_loss: 0.8080, test_loss: 0.8310, test_f1: 0.5795
 epoch: 12, train_loss: 0.8040, test_loss: 0.8173, test_f1: 0.5698
 epoch: 13, train_loss: 0.7841, test_loss: 0.7823, test_f1: 0.5923
 epoch: 14, train_loss: 0.7800, test_loss: 0.7751, test_f1: 0.6032
 epoch: 15, train_loss: 0.7716, test_loss: 0.8083, test_f1: 0.5816
 epoch: 16, train_loss: 0.7634, test_loss: 0.7648, test_f1: 0.6296
 epoch: 17, train_loss: 0.7464, test_loss: 0.7537, test_f1: 0.5984
 epoch: 18, train_loss: 0.7400, test_loss: 0.7576, test_f1: 0.6020
 epoch: 19, train_loss: 0.7231, test_loss: 0.7549, test_f1: 0.6213
 epoch: 20, train_loss: 0.7176, test_loss: 0.8883, test_f1: 0.5916
 epoch: 21, train_loss: 0.7188, test_loss: 0.7120, test_f1: 0.6287
 epoch: 22, train_loss: 0.7055, test_loss: 0.7270, test_f1: 0.6330
 epoch: 23, train_loss: 0.7091, test_loss: 0.7347, test_f1: 0.6511
 epoch: 24, train_loss: 0.6906, test_loss: 0.7361, test_f1: 0.6536
 epoch: 25, train_loss: 0.6797, test_loss: 0.7169, test_f1: 0.6383
 epoch: 26, train_loss: 0.6805, test_loss: 0.7293, test_f1: 0.6310
 epoch: 27, train_loss: 0.6613, test_loss: 0.7562, test_f1: 0.6408
 epoch: 28, train_loss: 0.6692, test_loss: 0.7098, test_f1: 0.6562
 epoch: 29, train_loss: 0.6465, test_loss: 0.7332, test_f1: 0.6538
 epoch: 30, train_loss: 0.6483, test_loss: 0.7101, test_f1: 0.6399
 epoch: 31, train_loss: 0.6472, test_loss: 0.7350, test_f1: 0.6360
 epoch: 32, train_loss: 0.6398, test_loss: 0.7754, test_f1: 0.6292
 epoch: 33, train_loss: 0.6326, test_loss: 0.7598, test_f1: 0.6173
 epoch: 34, train_loss: 0.6289, test_loss: 0.7758, test_f1: 0.6289
 epoch: 35, train_loss: 0.6106, test_loss: 0.7175, test_f1: 0.6609
 epoch: 36, train_loss: 0.6006, test_loss: 0.7553, test_f1: 0.6497
 epoch: 37, train_loss: 0.6038, test_loss: 0.7300, test_f1: 0.6367
 epoch: 38, train_loss: 0.6043, test_loss: 0.7045, test_f1: 0.6597
 epoch: 39, train_loss: 0.5839, test_loss: 0.7140, test_f1: 0.6453
 epoch: 40, train_loss: 0.5734, test_loss: 0.8256, test_f1: 0.6098
 epoch: 41, train_loss: 0.5686, test_loss: 0.8602, test_f1: 0.6396
 epoch: 42, train_loss: 0.5798, test_loss: 0.7665, test_f1: 0.6462
 epoch: 43, train_loss: 0.5757, test_loss: 0.7439, test_f1: 0.6487
 epoch: 44, train_loss: 0.5566, test_loss: 0.8037, test_f1: 0.6244
 epoch: 45, train_loss: 0.5554, test_loss: 0.7862, test_f1: 0.6547
 epoch: 46, train_loss: 0.5450, test_loss: 0.8255, test_f1: 0.6433
 epoch: 47, train_loss: 0.5411, test_loss: 0.8109, test_f1: 0.6425
 epoch: 48, train_loss: 0.5396, test_loss: 0.7675, test_f1: 0.6329
 epoch: 49, train_loss: 0.5394, test_loss: 0.8461, test_f1: 0.6216
 epoch: 50, train_loss: 0.5177, test_loss: 0.8521, test_f1: 0.6223
 epoch: 51, train_loss: 0.5247, test_loss: 0.8253, test_f1: 0.6264
 epoch: 52, train_loss: 0.4973, test_loss: 0.8417, test_f1: 0.6371
 epoch: 53, train_loss: 0.4788, test_loss: 0.8957, test_f1: 0.6199
 epoch: 54, train_loss: 0.4881, test_loss: 0.9161, test_f1: 0.6307
 epoch: 55, train_loss: 0.4749, test_loss: 0.8789, test_f1: 0.6428
 epoch: 56, train_loss: 0.4919, test_loss: 0.8555, test_f1: 0.6288
 epoch: 57, train_loss: 0.4918, test_loss: 0.9173, test_f1: 0.6326
 epoch: 58, train_loss: 0.4803, test_loss: 0.8835, test_f1: 0.6324
 epoch: 59, train_loss: 0.4867, test_loss: 0.9215, test_f1: 0.6325
 epoch: 60, train_loss: 0.4741, test_loss: 0.8612, test_f1: 0.6321
 epoch: 61, train_loss: 0.4663, test_loss: 0.8881, test_f1: 0.6289
 epoch: 62, train_loss: 0.4632, test_loss: 0.8935, test_f1: 0.6231
 epoch: 63, train_loss: 0.4627, test_loss: 0.8764, test_f1: 0.6461
 epoch: 64, train_loss: 0.4653, test_loss: 1.0170, test_f1: 0.6199
 epoch: 65, train_loss: 0.4519, test_loss: 0.9618, test_f1: 0.6289
 epoch: 66, train_loss: 0.4368, test_loss: 0.9861, test_f1: 0.6455
 epoch: 67, train_loss: 0.4311, test_loss: 0.9677, test_f1: 0.6421
 epoch: 68, train_loss: 0.4431, test_loss: 0.9667, test_f1: 0.6350
 epoch: 69, train_loss: 0.4349, test_loss: 1.0090, test_f1: 0.6451
 epoch: 70, train_loss: 0.4272, test_loss: 1.1360, test_f1: 0.6119
 epoch: 71, train_loss: 0.4339, test_loss: 0.9600, test_f1: 0.6464
 epoch: 72, train_loss: 0.4291, test_loss: 1.0512, test_f1: 0.6442
 epoch: 73, train_loss: 0.4176, test_loss: 0.9907, test_f1: 0.6304
 epoch: 74, train_loss: 0.4350, test_loss: 1.0359, test_f1: 0.6324
 epoch: 75, train_loss: 0.4224, test_loss: 1.0729, test_f1: 0.6439
 epoch: 76, train_loss: 0.4179, test_loss: 1.0575, test_f1: 0.6410
 epoch: 77, train_loss: 0.4160, test_loss: 1.1206, test_f1: 0.6365
 epoch: 78, train_loss: 0.4142, test_loss: 1.0430, test_f1: 0.6419
 epoch: 79, train_loss: 0.4138, test_loss: 1.0887, test_f1: 0.6475
 epoch: 80, train_loss: 0.4097, test_loss: 1.0369, test_f1: 0.6470
 epoch: 81, train_loss: 0.4012, test_loss: 1.0738, test_f1: 0.6344
 epoch: 82, train_loss: 0.4082, test_loss: 1.1522, test_f1: 0.6343
 epoch: 83, train_loss: 0.4029, test_loss: 0.9713, test_f1: 0.6501
 epoch: 84, train_loss: 0.4042, test_loss: 1.1114, test_f1: 0.6466
 epoch: 85, train_loss: 0.4083, test_loss: 1.1827, test_f1: 0.6391
 epoch: 86, train_loss: 0.3837, test_loss: 1.1421, test_f1: 0.6513
 epoch: 87, train_loss: 0.3915, test_loss: 1.1044, test_f1: 0.6484
 epoch: 88, train_loss: 0.3891, test_loss: 1.1361, test_f1: 0.6268
 epoch: 89, train_loss: 0.3882, test_loss: 1.0992, test_f1: 0.6593
 epoch: 90, train_loss: 0.3773, test_loss: 1.1688, test_f1: 0.6484
 epoch: 91, train_loss: 0.3915, test_loss: 1.2135, test_f1: 0.6313
 epoch: 92, train_loss: 0.3747, test_loss: 1.1480, test_f1: 0.6427
 epoch: 93, train_loss: 0.3821, test_loss: 1.1963, test_f1: 0.6424
 epoch: 94, train_loss: 0.3788, test_loss: 1.1792, test_f1: 0.6411
 epoch: 95, train_loss: 0.3826, test_loss: 1.1801, test_f1: 0.6217
 epoch: 96, train_loss: 0.3666, test_loss: 1.1641, test_f1: 0.6368
 epoch: 97, train_loss: 0.3682, test_loss: 1.1973, test_f1: 0.6261
 epoch: 98, train_loss: 0.3723, test_loss: 1.1849, test_f1: 0.6466
 epoch: 99, train_loss: 0.3562, test_loss: 1.2918, test_f1: 0.6494
##################ITERATION #3 ****************************************
 epoch: 0, train_loss: 1.1124, test_loss: 0.9960, test_f1: 0.5017
 epoch: 1, train_loss: 0.9825, test_loss: 0.9662, test_f1: 0.5115
 epoch: 2, train_loss: 0.9456, test_loss: 0.9175, test_f1: 0.5291
 epoch: 3, train_loss: 0.9276, test_loss: 0.9032, test_f1: 0.5411
 epoch: 4, train_loss: 0.9041, test_loss: 0.8979, test_f1: 0.5173
 epoch: 5, train_loss: 0.8863, test_loss: 0.8702, test_f1: 0.5635
 epoch: 6, train_loss: 0.8696, test_loss: 0.8740, test_f1: 0.5808
 epoch: 7, train_loss: 0.8612, test_loss: 0.8568, test_f1: 0.5820
 epoch: 8, train_loss: 0.8355, test_loss: 0.8491, test_f1: 0.5880
 epoch: 9, train_loss: 0.8243, test_loss: 0.7716, test_f1: 0.6103
 epoch: 10, train_loss: 0.8114, test_loss: 0.7933, test_f1: 0.5645
 epoch: 11, train_loss: 0.7962, test_loss: 0.7915, test_f1: 0.6222
 epoch: 12, train_loss: 0.7889, test_loss: 0.7805, test_f1: 0.6006
 epoch: 13, train_loss: 0.7746, test_loss: 0.7919, test_f1: 0.5837
 epoch: 14, train_loss: 0.7617, test_loss: 0.7566, test_f1: 0.6291
 epoch: 15, train_loss: 0.7538, test_loss: 0.7442, test_f1: 0.6323
 epoch: 16, train_loss: 0.7302, test_loss: 0.7390, test_f1: 0.6359
 epoch: 17, train_loss: 0.7298, test_loss: 0.7702, test_f1: 0.6464
 epoch: 18, train_loss: 0.7171, test_loss: 0.7265, test_f1: 0.6419
 epoch: 19, train_loss: 0.7060, test_loss: 0.7410, test_f1: 0.6393
 epoch: 20, train_loss: 0.6978, test_loss: 0.7614, test_f1: 0.6281
 epoch: 21, train_loss: 0.6935, test_loss: 0.6959, test_f1: 0.6724
 epoch: 22, train_loss: 0.6831, test_loss: 0.7416, test_f1: 0.6272
 epoch: 23, train_loss: 0.6738, test_loss: 0.7662, test_f1: 0.6506
 epoch: 24, train_loss: 0.6628, test_loss: 0.7306, test_f1: 0.6700
 epoch: 25, train_loss: 0.6529, test_loss: 0.7918, test_f1: 0.6700
 epoch: 26, train_loss: 0.6531, test_loss: 0.7385, test_f1: 0.6705
 epoch: 27, train_loss: 0.6403, test_loss: 0.7193, test_f1: 0.6752
 epoch: 28, train_loss: 0.6240, test_loss: 0.7110, test_f1: 0.6733
 epoch: 29, train_loss: 0.6227, test_loss: 0.7188, test_f1: 0.6518
 epoch: 30, train_loss: 0.6301, test_loss: 0.8335, test_f1: 0.6789
 epoch: 31, train_loss: 0.6129, test_loss: 0.7379, test_f1: 0.6443
 epoch: 32, train_loss: 0.6133, test_loss: 0.8591, test_f1: 0.6379
 epoch: 33, train_loss: 0.6156, test_loss: 0.7443, test_f1: 0.6719
 epoch: 34, train_loss: 0.5883, test_loss: 0.7604, test_f1: 0.6615
 epoch: 35, train_loss: 0.5900, test_loss: 0.8352, test_f1: 0.6510
 epoch: 36, train_loss: 0.5824, test_loss: 0.7576, test_f1: 0.6557
 epoch: 37, train_loss: 0.5869, test_loss: 0.8182, test_f1: 0.6584
 epoch: 38, train_loss: 0.5569, test_loss: 0.9050, test_f1: 0.6193
 epoch: 39, train_loss: 0.5678, test_loss: 0.8875, test_f1: 0.6293
 epoch: 40, train_loss: 0.5615, test_loss: 0.8187, test_f1: 0.6362
 epoch: 41, train_loss: 0.5658, test_loss: 0.8729, test_f1: 0.6601
 epoch: 42, train_loss: 0.5568, test_loss: 0.8217, test_f1: 0.6410
 epoch: 43, train_loss: 0.5623, test_loss: 0.9045, test_f1: 0.6417
 epoch: 44, train_loss: 0.5371, test_loss: 0.9168, test_f1: 0.6442
 epoch: 45, train_loss: 0.5387, test_loss: 0.8849, test_f1: 0.6334
 epoch: 46, train_loss: 0.5290, test_loss: 0.8172, test_f1: 0.6798
 epoch: 47, train_loss: 0.5160, test_loss: 0.9837, test_f1: 0.6508
 epoch: 48, train_loss: 0.5230, test_loss: 0.9344, test_f1: 0.6449
 epoch: 49, train_loss: 0.5179, test_loss: 0.8868, test_f1: 0.6352
 epoch: 50, train_loss: 0.5123, test_loss: 0.8324, test_f1: 0.6544
 epoch: 51, train_loss: 0.4808, test_loss: 0.9718, test_f1: 0.6285
 epoch: 52, train_loss: 0.4796, test_loss: 0.8305, test_f1: 0.6839
 epoch: 53, train_loss: 0.4681, test_loss: 0.8935, test_f1: 0.6369
 epoch: 54, train_loss: 0.4656, test_loss: 0.9013, test_f1: 0.6381
 epoch: 55, train_loss: 0.4557, test_loss: 0.9654, test_f1: 0.6558
 epoch: 56, train_loss: 0.4642, test_loss: 0.9739, test_f1: 0.6654
 epoch: 57, train_loss: 0.4504, test_loss: 0.9414, test_f1: 0.6342
 epoch: 58, train_loss: 0.4491, test_loss: 1.0014, test_f1: 0.6439
 epoch: 59, train_loss: 0.4407, test_loss: 0.9580, test_f1: 0.6337
 epoch: 60, train_loss: 0.4528, test_loss: 1.0526, test_f1: 0.6453
 epoch: 61, train_loss: 0.4440, test_loss: 1.0134, test_f1: 0.6507
 epoch: 62, train_loss: 0.4263, test_loss: 0.9570, test_f1: 0.6609
 epoch: 63, train_loss: 0.4267, test_loss: 0.9656, test_f1: 0.6594
 epoch: 64, train_loss: 0.4315, test_loss: 1.0750, test_f1: 0.6531
 epoch: 65, train_loss: 0.4248, test_loss: 0.9854, test_f1: 0.6496
 epoch: 66, train_loss: 0.4150, test_loss: 1.0832, test_f1: 0.6545
 epoch: 67, train_loss: 0.4402, test_loss: 1.0146, test_f1: 0.6423
 epoch: 68, train_loss: 0.4313, test_loss: 1.0399, test_f1: 0.6542
 epoch: 69, train_loss: 0.4153, test_loss: 1.0797, test_f1: 0.6438
 epoch: 70, train_loss: 0.4162, test_loss: 1.0705, test_f1: 0.6630
 epoch: 71, train_loss: 0.4202, test_loss: 1.0329, test_f1: 0.6679
 epoch: 72, train_loss: 0.4122, test_loss: 1.1438, test_f1: 0.6696
 epoch: 73, train_loss: 0.4068, test_loss: 1.0926, test_f1: 0.6681
 epoch: 74, train_loss: 0.4045, test_loss: 1.1269, test_f1: 0.6919
 epoch: 75, train_loss: 0.3928, test_loss: 1.1010, test_f1: 0.6819
 epoch: 76, train_loss: 0.4022, test_loss: 1.1870, test_f1: 0.6579
 epoch: 77, train_loss: 0.4044, test_loss: 1.1777, test_f1: 0.6665
 epoch: 78, train_loss: 0.3869, test_loss: 1.0645, test_f1: 0.6663
 epoch: 79, train_loss: 0.3853, test_loss: 1.0824, test_f1: 0.6520
 epoch: 80, train_loss: 0.3933, test_loss: 1.1733, test_f1: 0.6627
 epoch: 81, train_loss: 0.3917, test_loss: 1.1574, test_f1: 0.6422
 epoch: 82, train_loss: 0.3859, test_loss: 1.2156, test_f1: 0.6828
 epoch: 83, train_loss: 0.3760, test_loss: 1.1717, test_f1: 0.6632
 epoch: 84, train_loss: 0.3855, test_loss: 1.2161, test_f1: 0.6775
 epoch: 85, train_loss: 0.3774, test_loss: 1.1355, test_f1: 0.6676
 epoch: 86, train_loss: 0.3732, test_loss: 1.1961, test_f1: 0.6479
 epoch: 87, train_loss: 0.3717, test_loss: 1.2427, test_f1: 0.6741
 epoch: 88, train_loss: 0.3790, test_loss: 1.2355, test_f1: 0.6498
 epoch: 89, train_loss: 0.3691, test_loss: 1.2766, test_f1: 0.6654
 epoch: 90, train_loss: 0.3698, test_loss: 1.2013, test_f1: 0.6649
 epoch: 91, train_loss: 0.3668, test_loss: 1.2709, test_f1: 0.6836
 epoch: 92, train_loss: 0.3611, test_loss: 1.2617, test_f1: 0.6801
 epoch: 93, train_loss: 0.3581, test_loss: 1.3446, test_f1: 0.6661
 epoch: 94, train_loss: 0.3564, test_loss: 1.3238, test_f1: 0.6572
 epoch: 95, train_loss: 0.3719, test_loss: 1.3073, test_f1: 0.6631
 epoch: 96, train_loss: 0.3471, test_loss: 1.3240, test_f1: 0.6563
 epoch: 97, train_loss: 0.3538, test_loss: 1.2851, test_f1: 0.6540
 epoch: 98, train_loss: 0.3565, test_loss: 1.3883, test_f1: 0.6702
 epoch: 99, train_loss: 0.3618, test_loss: 1.3511, test_f1: 0.6696
##################ITERATION #4 ****************************************
 epoch: 0, train_loss: 1.1050, test_loss: 1.0281, test_f1: 0.4665
 epoch: 1, train_loss: 0.9831, test_loss: 0.9538, test_f1: 0.5172
 epoch: 2, train_loss: 0.9514, test_loss: 0.9385, test_f1: 0.5159
 epoch: 3, train_loss: 0.9299, test_loss: 0.9480, test_f1: 0.4946
 epoch: 4, train_loss: 0.9140, test_loss: 0.8925, test_f1: 0.5621
 epoch: 5, train_loss: 0.8908, test_loss: 0.9183, test_f1: 0.5594
 epoch: 6, train_loss: 0.8829, test_loss: 0.8957, test_f1: 0.5936
 epoch: 7, train_loss: 0.8688, test_loss: 0.9010, test_f1: 0.5575
 epoch: 8, train_loss: 0.8568, test_loss: 0.9016, test_f1: 0.5686
 epoch: 9, train_loss: 0.8371, test_loss: 0.8688, test_f1: 0.5953
 epoch: 10, train_loss: 0.8323, test_loss: 0.8732, test_f1: 0.5832
 epoch: 11, train_loss: 0.8174, test_loss: 0.8474, test_f1: 0.5707
 epoch: 12, train_loss: 0.8159, test_loss: 0.8456, test_f1: 0.5855
 epoch: 13, train_loss: 0.7894, test_loss: 0.8644, test_f1: 0.5937
 epoch: 14, train_loss: 0.7764, test_loss: 0.9043, test_f1: 0.5830
 epoch: 15, train_loss: 0.7636, test_loss: 0.8359, test_f1: 0.6138
 epoch: 16, train_loss: 0.7532, test_loss: 0.8331, test_f1: 0.5932
 epoch: 17, train_loss: 0.7443, test_loss: 0.8322, test_f1: 0.6201
 epoch: 18, train_loss: 0.7361, test_loss: 0.8458, test_f1: 0.6287
 epoch: 19, train_loss: 0.7203, test_loss: 0.8972, test_f1: 0.6216
 epoch: 20, train_loss: 0.7099, test_loss: 0.7863, test_f1: 0.6385
 epoch: 21, train_loss: 0.7043, test_loss: 0.8037, test_f1: 0.6231
 epoch: 22, train_loss: 0.7050, test_loss: 0.7886, test_f1: 0.6286
 epoch: 23, train_loss: 0.6804, test_loss: 0.8023, test_f1: 0.6232
 epoch: 24, train_loss: 0.6907, test_loss: 0.8530, test_f1: 0.6138
 epoch: 25, train_loss: 0.6678, test_loss: 0.8494, test_f1: 0.6366
 epoch: 26, train_loss: 0.6697, test_loss: 0.8260, test_f1: 0.6334
 epoch: 27, train_loss: 0.6470, test_loss: 0.8288, test_f1: 0.6397
 epoch: 28, train_loss: 0.6445, test_loss: 0.8661, test_f1: 0.6336
 epoch: 29, train_loss: 0.6456, test_loss: 0.8651, test_f1: 0.6326
 epoch: 30, train_loss: 0.6309, test_loss: 0.8541, test_f1: 0.6460
 epoch: 31, train_loss: 0.6287, test_loss: 0.8292, test_f1: 0.6553
 epoch: 32, train_loss: 0.6101, test_loss: 0.8196, test_f1: 0.6373
 epoch: 33, train_loss: 0.6086, test_loss: 0.8128, test_f1: 0.6339
 epoch: 34, train_loss: 0.6005, test_loss: 0.8231, test_f1: 0.6561
 epoch: 35, train_loss: 0.5947, test_loss: 0.8778, test_f1: 0.6464
 epoch: 36, train_loss: 0.6017, test_loss: 0.8839, test_f1: 0.6539
 epoch: 37, train_loss: 0.5841, test_loss: 0.8701, test_f1: 0.6387
 epoch: 38, train_loss: 0.5872, test_loss: 0.8977, test_f1: 0.6675
 epoch: 39, train_loss: 0.5669, test_loss: 0.8428, test_f1: 0.6434
 epoch: 40, train_loss: 0.5740, test_loss: 0.8855, test_f1: 0.6376
 epoch: 41, train_loss: 0.5709, test_loss: 0.8807, test_f1: 0.6643
 epoch: 42, train_loss: 0.5509, test_loss: 0.9279, test_f1: 0.6360
 epoch: 43, train_loss: 0.5435, test_loss: 0.9273, test_f1: 0.6546
 epoch: 44, train_loss: 0.5481, test_loss: 0.8989, test_f1: 0.6452
 epoch: 45, train_loss: 0.5286, test_loss: 0.9873, test_f1: 0.6495
 epoch: 46, train_loss: 0.5241, test_loss: 0.9349, test_f1: 0.6513
 epoch: 47, train_loss: 0.5391, test_loss: 0.9049, test_f1: 0.6598
 epoch: 48, train_loss: 0.5012, test_loss: 0.8977, test_f1: 0.6581
 epoch: 49, train_loss: 0.5218, test_loss: 0.8761, test_f1: 0.6567
 epoch: 50, train_loss: 0.5096, test_loss: 1.0193, test_f1: 0.6500
 epoch: 51, train_loss: 0.4850, test_loss: 0.9227, test_f1: 0.6653
 epoch: 52, train_loss: 0.4610, test_loss: 1.0184, test_f1: 0.6520
 epoch: 53, train_loss: 0.4770, test_loss: 0.9350, test_f1: 0.6667
 epoch: 54, train_loss: 0.4569, test_loss: 1.0053, test_f1: 0.6567
 epoch: 55, train_loss: 0.4565, test_loss: 1.0754, test_f1: 0.6536
 epoch: 56, train_loss: 0.4481, test_loss: 1.0287, test_f1: 0.6699
 epoch: 57, train_loss: 0.4626, test_loss: 1.0349, test_f1: 0.6643
 epoch: 58, train_loss: 0.4535, test_loss: 1.0653, test_f1: 0.6526
 epoch: 59, train_loss: 0.4422, test_loss: 1.0832, test_f1: 0.6586
 epoch: 60, train_loss: 0.4439, test_loss: 1.0750, test_f1: 0.6555
 epoch: 61, train_loss: 0.4360, test_loss: 1.0663, test_f1: 0.6804
 epoch: 62, train_loss: 0.4407, test_loss: 1.1090, test_f1: 0.6478
 epoch: 63, train_loss: 0.4340, test_loss: 1.1382, test_f1: 0.6526
 epoch: 64, train_loss: 0.4320, test_loss: 1.1560, test_f1: 0.6595
 epoch: 65, train_loss: 0.4270, test_loss: 1.1368, test_f1: 0.6442
 epoch: 66, train_loss: 0.4270, test_loss: 1.0923, test_f1: 0.6568
 epoch: 67, train_loss: 0.4151, test_loss: 1.1945, test_f1: 0.6467
 epoch: 68, train_loss: 0.4077, test_loss: 1.1409, test_f1: 0.6704
 epoch: 69, train_loss: 0.4041, test_loss: 1.2138, test_f1: 0.6648
 epoch: 70, train_loss: 0.4083, test_loss: 1.1545, test_f1: 0.6650
 epoch: 71, train_loss: 0.3990, test_loss: 1.1328, test_f1: 0.6532
 epoch: 72, train_loss: 0.4074, test_loss: 1.2444, test_f1: 0.6539
 epoch: 73, train_loss: 0.4110, test_loss: 1.2313, test_f1: 0.6521
 epoch: 74, train_loss: 0.4122, test_loss: 1.2298, test_f1: 0.6612
 epoch: 75, train_loss: 0.4104, test_loss: 1.2294, test_f1: 0.6550
 epoch: 76, train_loss: 0.4112, test_loss: 1.2715, test_f1: 0.6420
 epoch: 77, train_loss: 0.3960, test_loss: 1.2395, test_f1: 0.6494
 epoch: 78, train_loss: 0.3852, test_loss: 1.2031, test_f1: 0.6591
 epoch: 79, train_loss: 0.3809, test_loss: 1.1687, test_f1: 0.6520
 epoch: 80, train_loss: 0.3793, test_loss: 1.2800, test_f1: 0.6488
 epoch: 81, train_loss: 0.3862, test_loss: 1.2858, test_f1: 0.6529
 epoch: 82, train_loss: 0.3644, test_loss: 1.2285, test_f1: 0.6526
 epoch: 83, train_loss: 0.3702, test_loss: 1.1992, test_f1: 0.6593
 epoch: 84, train_loss: 0.3762, test_loss: 1.2855, test_f1: 0.6578
 epoch: 85, train_loss: 0.3763, test_loss: 1.3028, test_f1: 0.6792
 epoch: 86, train_loss: 0.3697, test_loss: 1.2653, test_f1: 0.6799
 epoch: 87, train_loss: 0.3576, test_loss: 1.3677, test_f1: 0.6693
 epoch: 88, train_loss: 0.3691, test_loss: 1.3672, test_f1: 0.6721
 epoch: 89, train_loss: 0.3676, test_loss: 1.3378, test_f1: 0.6683
 epoch: 90, train_loss: 0.3600, test_loss: 1.3407, test_f1: 0.6720
 epoch: 91, train_loss: 0.3689, test_loss: 1.4230, test_f1: 0.6507
 epoch: 92, train_loss: 0.3617, test_loss: 1.3815, test_f1: 0.6675
 epoch: 93, train_loss: 0.3519, test_loss: 1.4888, test_f1: 0.6768
 epoch: 94, train_loss: 0.3403, test_loss: 1.5088, test_f1: 0.6588
 epoch: 95, train_loss: 0.3588, test_loss: 1.4805, test_f1: 0.6636
 epoch: 96, train_loss: 0.3404, test_loss: 1.4506, test_f1: 0.6677
 epoch: 97, train_loss: 0.3423, test_loss: 1.3310, test_f1: 0.6794
 epoch: 98, train_loss: 0.3541, test_loss: 1.3479, test_f1: 0.6790
 epoch: 99, train_loss: 0.3474, test_loss: 1.3689, test_f1: 0.6639
##################ITERATION #5 ****************************************
 epoch: 0, train_loss: 1.1455, test_loss: 0.9791, test_f1: 0.5070
 epoch: 1, train_loss: 0.9904, test_loss: 0.9491, test_f1: 0.5532
 epoch: 2, train_loss: 0.9624, test_loss: 0.9308, test_f1: 0.5837
 epoch: 3, train_loss: 0.9319, test_loss: 0.8980, test_f1: 0.5363
 epoch: 4, train_loss: 0.9191, test_loss: 0.8825, test_f1: 0.5371
 epoch: 5, train_loss: 0.8956, test_loss: 0.8797, test_f1: 0.5657
 epoch: 6, train_loss: 0.8752, test_loss: 0.8661, test_f1: 0.5570
 epoch: 7, train_loss: 0.8630, test_loss: 0.8542, test_f1: 0.5781
 epoch: 8, train_loss: 0.8509, test_loss: 0.8054, test_f1: 0.6059
 epoch: 9, train_loss: 0.8297, test_loss: 0.8185, test_f1: 0.5867
 epoch: 10, train_loss: 0.8250, test_loss: 0.8038, test_f1: 0.5564
 epoch: 11, train_loss: 0.8067, test_loss: 0.7616, test_f1: 0.6130
 epoch: 12, train_loss: 0.7999, test_loss: 0.7965, test_f1: 0.6026
 epoch: 13, train_loss: 0.7903, test_loss: 0.7409, test_f1: 0.6384
 epoch: 14, train_loss: 0.7797, test_loss: 0.8017, test_f1: 0.6213
 epoch: 15, train_loss: 0.7753, test_loss: 0.7540, test_f1: 0.6210
 epoch: 16, train_loss: 0.7526, test_loss: 0.7715, test_f1: 0.6037
 epoch: 17, train_loss: 0.7576, test_loss: 0.7500, test_f1: 0.6274
 epoch: 18, train_loss: 0.7333, test_loss: 0.7375, test_f1: 0.6136
 epoch: 19, train_loss: 0.7350, test_loss: 0.7212, test_f1: 0.6551
 epoch: 20, train_loss: 0.7183, test_loss: 0.7583, test_f1: 0.5853
 epoch: 21, train_loss: 0.7120, test_loss: 0.7029, test_f1: 0.6745
 epoch: 22, train_loss: 0.6983, test_loss: 0.7459, test_f1: 0.6447
 epoch: 23, train_loss: 0.7071, test_loss: 0.7210, test_f1: 0.6556
 epoch: 24, train_loss: 0.6833, test_loss: 0.7668, test_f1: 0.6240
 epoch: 25, train_loss: 0.6889, test_loss: 0.7725, test_f1: 0.6318
 epoch: 26, train_loss: 0.6878, test_loss: 0.6972, test_f1: 0.6515
 epoch: 27, train_loss: 0.6707, test_loss: 0.7063, test_f1: 0.6612
 epoch: 28, train_loss: 0.6699, test_loss: 0.6744, test_f1: 0.6575
 epoch: 29, train_loss: 0.6561, test_loss: 0.7143, test_f1: 0.6658
 epoch: 30, train_loss: 0.6395, test_loss: 0.7539, test_f1: 0.6608
 epoch: 31, train_loss: 0.6325, test_loss: 0.7709, test_f1: 0.6629
 epoch: 32, train_loss: 0.6401, test_loss: 0.6838, test_f1: 0.6754
 epoch: 33, train_loss: 0.6269, test_loss: 0.7006, test_f1: 0.6759
 epoch: 34, train_loss: 0.6057, test_loss: 0.6967, test_f1: 0.6348
 epoch: 35, train_loss: 0.6241, test_loss: 0.7155, test_f1: 0.6559
 epoch: 36, train_loss: 0.6012, test_loss: 0.7387, test_f1: 0.6570
 epoch: 37, train_loss: 0.6026, test_loss: 0.7716, test_f1: 0.6601
 epoch: 38, train_loss: 0.5970, test_loss: 0.7421, test_f1: 0.6410
 epoch: 39, train_loss: 0.5957, test_loss: 0.7171, test_f1: 0.6403
 epoch: 40, train_loss: 0.5803, test_loss: 0.7002, test_f1: 0.6999
 epoch: 41, train_loss: 0.5764, test_loss: 0.6978, test_f1: 0.6847
 epoch: 42, train_loss: 0.5701, test_loss: 0.7132, test_f1: 0.6776
 epoch: 43, train_loss: 0.5564, test_loss: 0.7472, test_f1: 0.6576
 epoch: 44, train_loss: 0.5620, test_loss: 0.7161, test_f1: 0.6499
 epoch: 45, train_loss: 0.5546, test_loss: 0.7258, test_f1: 0.6706
 epoch: 46, train_loss: 0.5476, test_loss: 0.7357, test_f1: 0.6836
 epoch: 47, train_loss: 0.5245, test_loss: 0.7427, test_f1: 0.6660
 epoch: 48, train_loss: 0.5326, test_loss: 0.7761, test_f1: 0.6570
 epoch: 49, train_loss: 0.5374, test_loss: 0.8247, test_f1: 0.6806
 epoch: 50, train_loss: 0.5204, test_loss: 0.7571, test_f1: 0.6686
 epoch: 51, train_loss: 0.4990, test_loss: 0.7322, test_f1: 0.6657
 epoch: 52, train_loss: 0.4903, test_loss: 0.7435, test_f1: 0.6679
 epoch: 53, train_loss: 0.4939, test_loss: 0.7695, test_f1: 0.6655
 epoch: 54, train_loss: 0.4937, test_loss: 0.7950, test_f1: 0.6819
 epoch: 55, train_loss: 0.4795, test_loss: 0.7955, test_f1: 0.6678
 epoch: 56, train_loss: 0.4720, test_loss: 0.7901, test_f1: 0.6676
 epoch: 57, train_loss: 0.4662, test_loss: 0.7541, test_f1: 0.6651
 epoch: 58, train_loss: 0.4609, test_loss: 0.8092, test_f1: 0.6750
 epoch: 59, train_loss: 0.4674, test_loss: 0.7924, test_f1: 0.6646
 epoch: 60, train_loss: 0.4642, test_loss: 0.8028, test_f1: 0.6556
 epoch: 61, train_loss: 0.4451, test_loss: 0.8036, test_f1: 0.6545
 epoch: 62, train_loss: 0.4574, test_loss: 0.8098, test_f1: 0.6636
 epoch: 63, train_loss: 0.4578, test_loss: 0.8895, test_f1: 0.6361
 epoch: 64, train_loss: 0.4587, test_loss: 0.8848, test_f1: 0.6661
 epoch: 65, train_loss: 0.4262, test_loss: 0.8513, test_f1: 0.6634
 epoch: 66, train_loss: 0.4311, test_loss: 0.8768, test_f1: 0.6637
 epoch: 67, train_loss: 0.4439, test_loss: 0.8920, test_f1: 0.6599
 epoch: 68, train_loss: 0.4386, test_loss: 0.8258, test_f1: 0.6581
 epoch: 69, train_loss: 0.4273, test_loss: 0.8849, test_f1: 0.6485
 epoch: 70, train_loss: 0.4310, test_loss: 0.9003, test_f1: 0.6676
 epoch: 71, train_loss: 0.4307, test_loss: 0.8711, test_f1: 0.6679
 epoch: 72, train_loss: 0.4257, test_loss: 0.8586, test_f1: 0.6842
 epoch: 73, train_loss: 0.4329, test_loss: 0.9157, test_f1: 0.6681
 epoch: 74, train_loss: 0.4109, test_loss: 0.9637, test_f1: 0.6443
 epoch: 75, train_loss: 0.4288, test_loss: 0.8686, test_f1: 0.6735
 epoch: 76, train_loss: 0.4214, test_loss: 0.9107, test_f1: 0.6586
 epoch: 77, train_loss: 0.4122, test_loss: 0.9422, test_f1: 0.6702
 epoch: 78, train_loss: 0.4077, test_loss: 0.9424, test_f1: 0.6660
 epoch: 79, train_loss: 0.4002, test_loss: 0.9616, test_f1: 0.6429
 epoch: 80, train_loss: 0.4043, test_loss: 0.9369, test_f1: 0.6867
 epoch: 81, train_loss: 0.3994, test_loss: 1.0320, test_f1: 0.6710
 epoch: 82, train_loss: 0.4199, test_loss: 0.9627, test_f1: 0.6733
 epoch: 83, train_loss: 0.4105, test_loss: 1.0026, test_f1: 0.6680
 epoch: 84, train_loss: 0.3936, test_loss: 0.9372, test_f1: 0.6813
 epoch: 85, train_loss: 0.3857, test_loss: 0.9410, test_f1: 0.6792
 epoch: 86, train_loss: 0.3925, test_loss: 0.9798, test_f1: 0.6603
 epoch: 87, train_loss: 0.3877, test_loss: 0.9901, test_f1: 0.6726
 epoch: 88, train_loss: 0.3856, test_loss: 1.0434, test_f1: 0.6673
 epoch: 89, train_loss: 0.3786, test_loss: 0.9785, test_f1: 0.6639
 epoch: 90, train_loss: 0.3794, test_loss: 1.0277, test_f1: 0.6694
 epoch: 91, train_loss: 0.3658, test_loss: 0.9801, test_f1: 0.6732
 epoch: 92, train_loss: 0.3826, test_loss: 1.0725, test_f1: 0.6679
 epoch: 93, train_loss: 0.3626, test_loss: 1.0228, test_f1: 0.6819
 epoch: 94, train_loss: 0.3800, test_loss: 1.0199, test_f1: 0.6551
 epoch: 95, train_loss: 0.3663, test_loss: 1.0591, test_f1: 0.6722
 epoch: 96, train_loss: 0.3654, test_loss: 1.0691, test_f1: 0.6536
 epoch: 97, train_loss: 0.3690, test_loss: 1.0838, test_f1: 0.6714
 epoch: 98, train_loss: 0.3756, test_loss: 1.0632, test_f1: 0.6545
 epoch: 99, train_loss: 0.3564, test_loss: 1.1075, test_f1: 0.6731
##################ITERATION #6 ****************************************
 epoch: 0, train_loss: 1.1459, test_loss: 0.9772, test_f1: 0.4825
 epoch: 1, train_loss: 0.9926, test_loss: 0.9620, test_f1: 0.5121
 epoch: 2, train_loss: 0.9777, test_loss: 0.9314, test_f1: 0.5165
 epoch: 3, train_loss: 0.9482, test_loss: 0.9237, test_f1: 0.5516
 epoch: 4, train_loss: 0.9136, test_loss: 0.9138, test_f1: 0.5366
 epoch: 5, train_loss: 0.9048, test_loss: 0.8895, test_f1: 0.5646
 epoch: 6, train_loss: 0.8861, test_loss: 0.8746, test_f1: 0.5888
 epoch: 7, train_loss: 0.8624, test_loss: 0.8536, test_f1: 0.5669
 epoch: 8, train_loss: 0.8394, test_loss: 0.8138, test_f1: 0.5902
 epoch: 9, train_loss: 0.8351, test_loss: 0.8158, test_f1: 0.6142
 epoch: 10, train_loss: 0.8149, test_loss: 0.8459, test_f1: 0.6175
 epoch: 11, train_loss: 0.8137, test_loss: 0.7781, test_f1: 0.6166
 epoch: 12, train_loss: 0.7987, test_loss: 0.8012, test_f1: 0.5686
 epoch: 13, train_loss: 0.7748, test_loss: 0.7562, test_f1: 0.6487
 epoch: 14, train_loss: 0.7786, test_loss: 0.7802, test_f1: 0.5940
 epoch: 15, train_loss: 0.7642, test_loss: 0.7661, test_f1: 0.6108
 epoch: 16, train_loss: 0.7610, test_loss: 0.7694, test_f1: 0.6178
 epoch: 17, train_loss: 0.7397, test_loss: 0.7510, test_f1: 0.6185
 epoch: 18, train_loss: 0.7392, test_loss: 0.7292, test_f1: 0.6804
 epoch: 19, train_loss: 0.7325, test_loss: 0.7510, test_f1: 0.6151
 epoch: 20, train_loss: 0.7242, test_loss: 0.7448, test_f1: 0.6210
 epoch: 21, train_loss: 0.6924, test_loss: 0.7564, test_f1: 0.6531
 epoch: 22, train_loss: 0.7006, test_loss: 0.7616, test_f1: 0.6624
 epoch: 23, train_loss: 0.6950, test_loss: 0.7582, test_f1: 0.6485
 epoch: 24, train_loss: 0.6859, test_loss: 0.7550, test_f1: 0.6543
 epoch: 25, train_loss: 0.6707, test_loss: 0.7453, test_f1: 0.6261
 epoch: 26, train_loss: 0.6685, test_loss: 0.7417, test_f1: 0.6411
 epoch: 27, train_loss: 0.6642, test_loss: 0.7643, test_f1: 0.6516
 epoch: 28, train_loss: 0.6572, test_loss: 0.7306, test_f1: 0.6595
 epoch: 29, train_loss: 0.6515, test_loss: 0.7265, test_f1: 0.6414
 epoch: 30, train_loss: 0.6506, test_loss: 0.7489, test_f1: 0.6393
 epoch: 31, train_loss: 0.6299, test_loss: 0.7529, test_f1: 0.6594
 epoch: 32, train_loss: 0.6280, test_loss: 0.7729, test_f1: 0.6457
 epoch: 33, train_loss: 0.6155, test_loss: 0.7354, test_f1: 0.6444
 epoch: 34, train_loss: 0.6068, test_loss: 0.7604, test_f1: 0.6594
 epoch: 35, train_loss: 0.6105, test_loss: 0.7742, test_f1: 0.6399
 epoch: 36, train_loss: 0.6038, test_loss: 0.7705, test_f1: 0.6399
 epoch: 37, train_loss: 0.5999, test_loss: 0.7300, test_f1: 0.6582
 epoch: 38, train_loss: 0.5796, test_loss: 0.7905, test_f1: 0.6374
 epoch: 39, train_loss: 0.5677, test_loss: 0.8111, test_f1: 0.6299
 epoch: 40, train_loss: 0.5831, test_loss: 0.7362, test_f1: 0.6700
 epoch: 41, train_loss: 0.5623, test_loss: 0.7955, test_f1: 0.6589
 epoch: 42, train_loss: 0.5538, test_loss: 0.7570, test_f1: 0.6666
 epoch: 43, train_loss: 0.5576, test_loss: 0.7440, test_f1: 0.6707
 epoch: 44, train_loss: 0.5491, test_loss: 0.8586, test_f1: 0.6536
 epoch: 45, train_loss: 0.5484, test_loss: 0.7704, test_f1: 0.6799
 epoch: 46, train_loss: 0.5389, test_loss: 0.8448, test_f1: 0.6558
 epoch: 47, train_loss: 0.5403, test_loss: 0.8103, test_f1: 0.6637
 epoch: 48, train_loss: 0.5203, test_loss: 0.8234, test_f1: 0.6537
 epoch: 49, train_loss: 0.5131, test_loss: 0.8560, test_f1: 0.6442
 epoch: 50, train_loss: 0.5273, test_loss: 0.8963, test_f1: 0.6629
 epoch: 51, train_loss: 0.5007, test_loss: 0.8241, test_f1: 0.6574
 epoch: 52, train_loss: 0.4873, test_loss: 0.9329, test_f1: 0.6445
 epoch: 53, train_loss: 0.4790, test_loss: 0.8644, test_f1: 0.6518
 epoch: 54, train_loss: 0.4773, test_loss: 0.8635, test_f1: 0.6593
 epoch: 55, train_loss: 0.4651, test_loss: 0.8958, test_f1: 0.6445
 epoch: 56, train_loss: 0.4708, test_loss: 0.8789, test_f1: 0.6392
 epoch: 57, train_loss: 0.4661, test_loss: 0.8718, test_f1: 0.6664
 epoch: 58, train_loss: 0.4502, test_loss: 0.9157, test_f1: 0.6450
 epoch: 59, train_loss: 0.4511, test_loss: 0.8973, test_f1: 0.6611
 epoch: 60, train_loss: 0.4489, test_loss: 0.8675, test_f1: 0.6481
 epoch: 61, train_loss: 0.4399, test_loss: 0.9453, test_f1: 0.6587
 epoch: 62, train_loss: 0.4518, test_loss: 0.8666, test_f1: 0.6662
 epoch: 63, train_loss: 0.4353, test_loss: 0.9079, test_f1: 0.6613
 epoch: 64, train_loss: 0.4386, test_loss: 0.9850, test_f1: 0.6676
 epoch: 65, train_loss: 0.4261, test_loss: 0.9437, test_f1: 0.6605
 epoch: 66, train_loss: 0.4412, test_loss: 0.9271, test_f1: 0.6458
 epoch: 67, train_loss: 0.4326, test_loss: 0.9938, test_f1: 0.6462
 epoch: 68, train_loss: 0.4169, test_loss: 0.8779, test_f1: 0.6708
 epoch: 69, train_loss: 0.4256, test_loss: 0.9338, test_f1: 0.6511
 epoch: 70, train_loss: 0.4282, test_loss: 0.9647, test_f1: 0.6618
 epoch: 71, train_loss: 0.4189, test_loss: 0.9457, test_f1: 0.6581
 epoch: 72, train_loss: 0.4117, test_loss: 0.9923, test_f1: 0.6604
 epoch: 73, train_loss: 0.4097, test_loss: 0.8990, test_f1: 0.6924
 epoch: 74, train_loss: 0.4078, test_loss: 0.9807, test_f1: 0.6569
 epoch: 75, train_loss: 0.4142, test_loss: 1.0058, test_f1: 0.6416
 epoch: 76, train_loss: 0.4141, test_loss: 1.0693, test_f1: 0.6469
 epoch: 77, train_loss: 0.4150, test_loss: 1.0056, test_f1: 0.6611
 epoch: 78, train_loss: 0.3983, test_loss: 1.1124, test_f1: 0.6696
 epoch: 79, train_loss: 0.3997, test_loss: 1.0350, test_f1: 0.6607
 epoch: 80, train_loss: 0.3981, test_loss: 0.9897, test_f1: 0.6620
 epoch: 81, train_loss: 0.3905, test_loss: 1.0227, test_f1: 0.6534
 epoch: 82, train_loss: 0.4143, test_loss: 1.0554, test_f1: 0.6458
 epoch: 83, train_loss: 0.3822, test_loss: 1.0075, test_f1: 0.6603
 epoch: 84, train_loss: 0.3780, test_loss: 1.0511, test_f1: 0.6923
 epoch: 85, train_loss: 0.3734, test_loss: 1.0694, test_f1: 0.6629
 epoch: 86, train_loss: 0.3791, test_loss: 1.0983, test_f1: 0.6751
 epoch: 87, train_loss: 0.3836, test_loss: 1.0642, test_f1: 0.6590
 epoch: 88, train_loss: 0.3651, test_loss: 1.0972, test_f1: 0.6721
 epoch: 89, train_loss: 0.3694, test_loss: 1.0386, test_f1: 0.6616
 epoch: 90, train_loss: 0.3731, test_loss: 1.1569, test_f1: 0.6760
 epoch: 91, train_loss: 0.3747, test_loss: 1.1292, test_f1: 0.6532
 epoch: 92, train_loss: 0.3621, test_loss: 1.1327, test_f1: 0.6523
 epoch: 93, train_loss: 0.3658, test_loss: 1.0586, test_f1: 0.6828
 epoch: 94, train_loss: 0.3598, test_loss: 1.1013, test_f1: 0.6758
 epoch: 95, train_loss: 0.3676, test_loss: 1.0774, test_f1: 0.6807
 epoch: 96, train_loss: 0.3434, test_loss: 1.0675, test_f1: 0.6832
 epoch: 97, train_loss: 0.3430, test_loss: 1.0919, test_f1: 0.6779
 epoch: 98, train_loss: 0.3526, test_loss: 1.1681, test_f1: 0.6678
 epoch: 99, train_loss: 0.3515, test_loss: 1.0265, test_f1: 0.6896
##################ITERATION #7 ****************************************
 epoch: 0, train_loss: 1.1761, test_loss: 1.0489, test_f1: 0.4436
 epoch: 1, train_loss: 1.0340, test_loss: 1.0055, test_f1: 0.4919
 epoch: 2, train_loss: 0.9955, test_loss: 0.9259, test_f1: 0.5408
 epoch: 3, train_loss: 0.9559, test_loss: 0.9466, test_f1: 0.5041
 epoch: 4, train_loss: 0.9504, test_loss: 0.9081, test_f1: 0.5582
 epoch: 5, train_loss: 0.9113, test_loss: 0.8954, test_f1: 0.5787
 epoch: 6, train_loss: 0.9012, test_loss: 0.8872, test_f1: 0.5604
 epoch: 7, train_loss: 0.8689, test_loss: 0.8494, test_f1: 0.5786
 epoch: 8, train_loss: 0.8727, test_loss: 0.8757, test_f1: 0.5660
 epoch: 9, train_loss: 0.8563, test_loss: 0.8279, test_f1: 0.6071
 epoch: 10, train_loss: 0.8279, test_loss: 0.8396, test_f1: 0.5896
 epoch: 11, train_loss: 0.8315, test_loss: 0.8481, test_f1: 0.6219
 epoch: 12, train_loss: 0.8103, test_loss: 0.8128, test_f1: 0.5910
 epoch: 13, train_loss: 0.7953, test_loss: 0.7857, test_f1: 0.6253
 epoch: 14, train_loss: 0.7910, test_loss: 0.7956, test_f1: 0.6164
 epoch: 15, train_loss: 0.7950, test_loss: 0.7638, test_f1: 0.6268
 epoch: 16, train_loss: 0.7774, test_loss: 0.7548, test_f1: 0.6140
 epoch: 17, train_loss: 0.7506, test_loss: 0.7772, test_f1: 0.6358
 epoch: 18, train_loss: 0.7506, test_loss: 0.7404, test_f1: 0.6050
 epoch: 19, train_loss: 0.7378, test_loss: 0.7603, test_f1: 0.6413
 epoch: 20, train_loss: 0.7313, test_loss: 0.7214, test_f1: 0.6490
 epoch: 21, train_loss: 0.7222, test_loss: 0.7157, test_f1: 0.6477
 epoch: 22, train_loss: 0.7206, test_loss: 0.7246, test_f1: 0.6532
 epoch: 23, train_loss: 0.7139, test_loss: 0.7552, test_f1: 0.6234
 epoch: 24, train_loss: 0.6999, test_loss: 0.7153, test_f1: 0.6176
 epoch: 25, train_loss: 0.6877, test_loss: 0.7568, test_f1: 0.6623
 epoch: 26, train_loss: 0.6743, test_loss: 0.7228, test_f1: 0.6582
 epoch: 27, train_loss: 0.6887, test_loss: 0.7211, test_f1: 0.6811
 epoch: 28, train_loss: 0.6741, test_loss: 0.7084, test_f1: 0.6905
 epoch: 29, train_loss: 0.6520, test_loss: 0.7144, test_f1: 0.6629
 epoch: 30, train_loss: 0.6698, test_loss: 0.7181, test_f1: 0.6723
 epoch: 31, train_loss: 0.6475, test_loss: 0.7109, test_f1: 0.6495
 epoch: 32, train_loss: 0.6417, test_loss: 0.7302, test_f1: 0.6473
 epoch: 33, train_loss: 0.6455, test_loss: 0.6939, test_f1: 0.6617
 epoch: 34, train_loss: 0.6279, test_loss: 0.7083, test_f1: 0.6481
 epoch: 35, train_loss: 0.6085, test_loss: 0.7155, test_f1: 0.6683
 epoch: 36, train_loss: 0.6066, test_loss: 0.7210, test_f1: 0.6326
 epoch: 37, train_loss: 0.5900, test_loss: 0.6940, test_f1: 0.6938
 epoch: 38, train_loss: 0.5912, test_loss: 0.7648, test_f1: 0.6469
 epoch: 39, train_loss: 0.6036, test_loss: 0.7042, test_f1: 0.6898
 epoch: 40, train_loss: 0.5901, test_loss: 0.7463, test_f1: 0.6334
 epoch: 41, train_loss: 0.5807, test_loss: 0.7056, test_f1: 0.6756
 epoch: 42, train_loss: 0.5608, test_loss: 0.7411, test_f1: 0.6560
 epoch: 43, train_loss: 0.5628, test_loss: 0.7597, test_f1: 0.6379
 epoch: 44, train_loss: 0.5599, test_loss: 0.7321, test_f1: 0.6558
 epoch: 45, train_loss: 0.5867, test_loss: 0.7580, test_f1: 0.6494
 epoch: 46, train_loss: 0.5480, test_loss: 0.7424, test_f1: 0.6577
 epoch: 47, train_loss: 0.5421, test_loss: 0.7693, test_f1: 0.6580
 epoch: 48, train_loss: 0.5342, test_loss: 0.7875, test_f1: 0.6555
 epoch: 49, train_loss: 0.5426, test_loss: 0.7737, test_f1: 0.6711
 epoch: 50, train_loss: 0.5502, test_loss: 0.7813, test_f1: 0.6554
 epoch: 51, train_loss: 0.5164, test_loss: 0.7810, test_f1: 0.6740
 epoch: 52, train_loss: 0.4990, test_loss: 0.7410, test_f1: 0.6874
 epoch: 53, train_loss: 0.4900, test_loss: 0.7752, test_f1: 0.6636
 epoch: 54, train_loss: 0.4936, test_loss: 0.7688, test_f1: 0.6779
 epoch: 55, train_loss: 0.4790, test_loss: 0.8024, test_f1: 0.6713
 epoch: 56, train_loss: 0.4822, test_loss: 0.8011, test_f1: 0.6843
 epoch: 57, train_loss: 0.4824, test_loss: 0.8279, test_f1: 0.6599
 epoch: 58, train_loss: 0.4784, test_loss: 0.7973, test_f1: 0.6627
 epoch: 59, train_loss: 0.4685, test_loss: 0.7926, test_f1: 0.6712
 epoch: 60, train_loss: 0.4748, test_loss: 0.7956, test_f1: 0.6592
 epoch: 61, train_loss: 0.4694, test_loss: 0.7987, test_f1: 0.6811
 epoch: 62, train_loss: 0.4662, test_loss: 0.8293, test_f1: 0.6731
 epoch: 63, train_loss: 0.4524, test_loss: 0.8574, test_f1: 0.6638
 epoch: 64, train_loss: 0.4468, test_loss: 0.8280, test_f1: 0.6632
 epoch: 65, train_loss: 0.4609, test_loss: 0.8046, test_f1: 0.6791
 epoch: 66, train_loss: 0.4360, test_loss: 0.8818, test_f1: 0.6538
 epoch: 67, train_loss: 0.4541, test_loss: 0.8391, test_f1: 0.6746
 epoch: 68, train_loss: 0.4463, test_loss: 0.8269, test_f1: 0.6614
 epoch: 69, train_loss: 0.4351, test_loss: 0.8804, test_f1: 0.6789
 epoch: 70, train_loss: 0.4400, test_loss: 0.8883, test_f1: 0.6728
 epoch: 71, train_loss: 0.4221, test_loss: 0.8994, test_f1: 0.6625
 epoch: 72, train_loss: 0.4333, test_loss: 0.8656, test_f1: 0.6662
 epoch: 73, train_loss: 0.4277, test_loss: 0.8637, test_f1: 0.6851
 epoch: 74, train_loss: 0.4224, test_loss: 0.8668, test_f1: 0.6920
 epoch: 75, train_loss: 0.4187, test_loss: 0.9563, test_f1: 0.6790
 epoch: 76, train_loss: 0.4204, test_loss: 0.8997, test_f1: 0.6807
 epoch: 77, train_loss: 0.4191, test_loss: 0.9164, test_f1: 0.6648
 epoch: 78, train_loss: 0.4257, test_loss: 0.9385, test_f1: 0.6702
 epoch: 79, train_loss: 0.4087, test_loss: 0.9638, test_f1: 0.6738
 epoch: 80, train_loss: 0.4175, test_loss: 0.9887, test_f1: 0.6662
 epoch: 81, train_loss: 0.4053, test_loss: 0.9595, test_f1: 0.6830
 epoch: 82, train_loss: 0.3986, test_loss: 1.0480, test_f1: 0.6559
 epoch: 83, train_loss: 0.4140, test_loss: 0.9820, test_f1: 0.6652
 epoch: 84, train_loss: 0.4172, test_loss: 0.9547, test_f1: 0.6644
 epoch: 85, train_loss: 0.4037, test_loss: 0.9618, test_f1: 0.6766
 epoch: 86, train_loss: 0.4017, test_loss: 1.0038, test_f1: 0.6678
 epoch: 87, train_loss: 0.3976, test_loss: 0.9665, test_f1: 0.6750
 epoch: 88, train_loss: 0.4010, test_loss: 0.9571, test_f1: 0.6840
 epoch: 89, train_loss: 0.3872, test_loss: 0.9872, test_f1: 0.6630
 epoch: 90, train_loss: 0.3760, test_loss: 1.0775, test_f1: 0.6612
 epoch: 91, train_loss: 0.3945, test_loss: 0.9912, test_f1: 0.6821
 epoch: 92, train_loss: 0.3782, test_loss: 1.0094, test_f1: 0.6856
 epoch: 93, train_loss: 0.3660, test_loss: 0.9625, test_f1: 0.7005
 epoch: 94, train_loss: 0.3758, test_loss: 1.0424, test_f1: 0.6718
 epoch: 95, train_loss: 0.3800, test_loss: 1.0064, test_f1: 0.6770
 epoch: 96, train_loss: 0.3739, test_loss: 0.9361, test_f1: 0.7042
 epoch: 97, train_loss: 0.3733, test_loss: 1.0239, test_f1: 0.6818
 epoch: 98, train_loss: 0.3786, test_loss: 0.9811, test_f1: 0.6832
 epoch: 99, train_loss: 0.3674, test_loss: 1.0981, test_f1: 0.6861
##################ITERATION #8 ****************************************
 epoch: 0, train_loss: 1.2191, test_loss: 0.9419, test_f1: 0.5210
 epoch: 1, train_loss: 1.0458, test_loss: 0.9816, test_f1: 0.5019
 epoch: 2, train_loss: 0.9710, test_loss: 0.9309, test_f1: 0.5135
 epoch: 3, train_loss: 0.9774, test_loss: 0.8834, test_f1: 0.5215
 epoch: 4, train_loss: 0.9211, test_loss: 0.8768, test_f1: 0.5527
 epoch: 5, train_loss: 0.9215, test_loss: 0.9002, test_f1: 0.5553
 epoch: 6, train_loss: 0.8933, test_loss: 0.8438, test_f1: 0.5337
 epoch: 7, train_loss: 0.8731, test_loss: 0.8346, test_f1: 0.5704
 epoch: 8, train_loss: 0.8437, test_loss: 0.8254, test_f1: 0.5629
 epoch: 9, train_loss: 0.8559, test_loss: 0.8230, test_f1: 0.6017
 epoch: 10, train_loss: 0.8457, test_loss: 0.8268, test_f1: 0.5591
 epoch: 11, train_loss: 0.8351, test_loss: 0.8454, test_f1: 0.5874
 epoch: 12, train_loss: 0.8133, test_loss: 0.8398, test_f1: 0.6035
 epoch: 13, train_loss: 0.8077, test_loss: 0.7807, test_f1: 0.6032
 epoch: 14, train_loss: 0.8050, test_loss: 0.7898, test_f1: 0.6067
 epoch: 15, train_loss: 0.7821, test_loss: 0.7618, test_f1: 0.6217
 epoch: 16, train_loss: 0.7711, test_loss: 0.8043, test_f1: 0.6286
 epoch: 17, train_loss: 0.7610, test_loss: 0.7952, test_f1: 0.5913
 epoch: 18, train_loss: 0.7506, test_loss: 0.7824, test_f1: 0.6238
 epoch: 19, train_loss: 0.7465, test_loss: 0.7492, test_f1: 0.6117
 epoch: 20, train_loss: 0.7331, test_loss: 0.7615, test_f1: 0.6447
 epoch: 21, train_loss: 0.7343, test_loss: 0.7318, test_f1: 0.6680
 epoch: 22, train_loss: 0.7257, test_loss: 0.7765, test_f1: 0.6290
 epoch: 23, train_loss: 0.7130, test_loss: 0.7727, test_f1: 0.6500
 epoch: 24, train_loss: 0.7014, test_loss: 0.8124, test_f1: 0.6295
 epoch: 25, train_loss: 0.6995, test_loss: 0.7939, test_f1: 0.6677
 epoch: 26, train_loss: 0.6805, test_loss: 0.7477, test_f1: 0.6443
 epoch: 27, train_loss: 0.6736, test_loss: 0.7357, test_f1: 0.6588
 epoch: 28, train_loss: 0.6795, test_loss: 0.7225, test_f1: 0.6472
 epoch: 29, train_loss: 0.6916, test_loss: 0.7845, test_f1: 0.6563
 epoch: 30, train_loss: 0.6585, test_loss: 0.7718, test_f1: 0.6827
 epoch: 31, train_loss: 0.6488, test_loss: 0.7640, test_f1: 0.6513
 epoch: 32, train_loss: 0.6330, test_loss: 0.7645, test_f1: 0.6492
 epoch: 33, train_loss: 0.6395, test_loss: 0.7990, test_f1: 0.6437
 epoch: 34, train_loss: 0.6219, test_loss: 0.7133, test_f1: 0.6898
 epoch: 35, train_loss: 0.6215, test_loss: 0.7466, test_f1: 0.6916
 epoch: 36, train_loss: 0.6137, test_loss: 0.7311, test_f1: 0.6695
 epoch: 37, train_loss: 0.6188, test_loss: 0.7794, test_f1: 0.6669
 epoch: 38, train_loss: 0.6174, test_loss: 0.7227, test_f1: 0.6811
 epoch: 39, train_loss: 0.5890, test_loss: 0.7087, test_f1: 0.6894
 epoch: 40, train_loss: 0.5774, test_loss: 0.8066, test_f1: 0.6813
 epoch: 41, train_loss: 0.5654, test_loss: 0.7441, test_f1: 0.6651
 epoch: 42, train_loss: 0.5814, test_loss: 0.7553, test_f1: 0.6904
 epoch: 43, train_loss: 0.5756, test_loss: 0.7700, test_f1: 0.6867
 epoch: 44, train_loss: 0.5759, test_loss: 0.7646, test_f1: 0.6534
 epoch: 45, train_loss: 0.5712, test_loss: 0.8488, test_f1: 0.6539
 epoch: 46, train_loss: 0.5737, test_loss: 0.7533, test_f1: 0.6597
 epoch: 47, train_loss: 0.5367, test_loss: 0.7993, test_f1: 0.6641
 epoch: 48, train_loss: 0.5399, test_loss: 0.7667, test_f1: 0.6749
 epoch: 49, train_loss: 0.5317, test_loss: 0.7639, test_f1: 0.6751
 epoch: 50, train_loss: 0.5333, test_loss: 0.7998, test_f1: 0.6748
 epoch: 51, train_loss: 0.5131, test_loss: 0.8754, test_f1: 0.6563
 epoch: 52, train_loss: 0.5041, test_loss: 0.8361, test_f1: 0.6696
 epoch: 53, train_loss: 0.4988, test_loss: 0.8584, test_f1: 0.6749
 epoch: 54, train_loss: 0.4967, test_loss: 0.8481, test_f1: 0.6480
 epoch: 55, train_loss: 0.4864, test_loss: 0.8762, test_f1: 0.6668
 epoch: 56, train_loss: 0.4805, test_loss: 0.8994, test_f1: 0.6687
 epoch: 57, train_loss: 0.4799, test_loss: 0.8248, test_f1: 0.6498
 epoch: 58, train_loss: 0.4794, test_loss: 0.8332, test_f1: 0.6580
 epoch: 59, train_loss: 0.4718, test_loss: 0.8906, test_f1: 0.6660
 epoch: 60, train_loss: 0.4681, test_loss: 0.8278, test_f1: 0.6646
 epoch: 61, train_loss: 0.4595, test_loss: 0.9348, test_f1: 0.6639
 epoch: 62, train_loss: 0.4686, test_loss: 0.9105, test_f1: 0.6709
 epoch: 63, train_loss: 0.4492, test_loss: 1.0168, test_f1: 0.6622
 epoch: 64, train_loss: 0.4488, test_loss: 0.8178, test_f1: 0.6537
 epoch: 65, train_loss: 0.4609, test_loss: 0.8918, test_f1: 0.6497
 epoch: 66, train_loss: 0.4566, test_loss: 0.8436, test_f1: 0.6773
 epoch: 67, train_loss: 0.4558, test_loss: 0.9364, test_f1: 0.6651
 epoch: 68, train_loss: 0.4407, test_loss: 0.9274, test_f1: 0.6619
 epoch: 69, train_loss: 0.4285, test_loss: 0.8866, test_f1: 0.6774
 epoch: 70, train_loss: 0.4448, test_loss: 0.9480, test_f1: 0.6612
 epoch: 71, train_loss: 0.4400, test_loss: 1.0099, test_f1: 0.6620
 epoch: 72, train_loss: 0.4381, test_loss: 1.0195, test_f1: 0.6668
 epoch: 73, train_loss: 0.4373, test_loss: 0.9323, test_f1: 0.6676
 epoch: 74, train_loss: 0.4231, test_loss: 1.0864, test_f1: 0.6703
 epoch: 75, train_loss: 0.4128, test_loss: 1.0548, test_f1: 0.6828
 epoch: 76, train_loss: 0.4063, test_loss: 1.0339, test_f1: 0.6691
 epoch: 77, train_loss: 0.4152, test_loss: 1.0035, test_f1: 0.6584
 epoch: 78, train_loss: 0.4160, test_loss: 1.1066, test_f1: 0.6736
 epoch: 79, train_loss: 0.4208, test_loss: 1.1178, test_f1: 0.6714
 epoch: 80, train_loss: 0.3841, test_loss: 1.0330, test_f1: 0.6662
 epoch: 81, train_loss: 0.3969, test_loss: 1.0418, test_f1: 0.6601
 epoch: 82, train_loss: 0.3990, test_loss: 1.0478, test_f1: 0.6736
 epoch: 83, train_loss: 0.4007, test_loss: 1.1013, test_f1: 0.6541
 epoch: 84, train_loss: 0.3864, test_loss: 1.1089, test_f1: 0.6638
 epoch: 85, train_loss: 0.3970, test_loss: 1.2136, test_f1: 0.6720
 epoch: 86, train_loss: 0.3893, test_loss: 1.0423, test_f1: 0.6755
 epoch: 87, train_loss: 0.3840, test_loss: 1.1584, test_f1: 0.6585
 epoch: 88, train_loss: 0.3937, test_loss: 1.0800, test_f1: 0.6697
 epoch: 89, train_loss: 0.3806, test_loss: 1.1351, test_f1: 0.6758
 epoch: 90, train_loss: 0.3767, test_loss: 1.1626, test_f1: 0.6704
 epoch: 91, train_loss: 0.3734, test_loss: 1.0972, test_f1: 0.6779
 epoch: 92, train_loss: 0.3732, test_loss: 1.2037, test_f1: 0.6628
 epoch: 93, train_loss: 0.3694, test_loss: 1.1756, test_f1: 0.6770
 epoch: 94, train_loss: 0.3577, test_loss: 1.1665, test_f1: 0.6681
 epoch: 95, train_loss: 0.3597, test_loss: 1.2243, test_f1: 0.6695
 epoch: 96, train_loss: 0.3752, test_loss: 1.2653, test_f1: 0.6547
 epoch: 97, train_loss: 0.3535, test_loss: 1.2068, test_f1: 0.6733
 epoch: 98, train_loss: 0.3510, test_loss: 1.2075, test_f1: 0.6690
 epoch: 99, train_loss: 0.3673, test_loss: 1.2352, test_f1: 0.6827
##################ITERATION #9 ****************************************
 epoch: 0, train_loss: 1.2519, test_loss: 0.9988, test_f1: 0.5129
 epoch: 1, train_loss: 1.0511, test_loss: 0.9792, test_f1: 0.5105
 epoch: 2, train_loss: 1.0006, test_loss: 0.9517, test_f1: 0.5645
 epoch: 3, train_loss: 0.9682, test_loss: 0.9591, test_f1: 0.5232
 epoch: 4, train_loss: 0.9342, test_loss: 0.9188, test_f1: 0.5022
 epoch: 5, train_loss: 0.9188, test_loss: 0.9086, test_f1: 0.5338
 epoch: 6, train_loss: 0.9004, test_loss: 0.8940, test_f1: 0.5553
 epoch: 7, train_loss: 0.8775, test_loss: 0.8876, test_f1: 0.5847
 epoch: 8, train_loss: 0.8795, test_loss: 0.8589, test_f1: 0.5641
 epoch: 9, train_loss: 0.8448, test_loss: 0.8338, test_f1: 0.5556
 epoch: 10, train_loss: 0.8339, test_loss: 0.8719, test_f1: 0.5732
 epoch: 11, train_loss: 0.8219, test_loss: 0.8531, test_f1: 0.5877
 epoch: 12, train_loss: 0.8258, test_loss: 0.8567, test_f1: 0.5708
 epoch: 13, train_loss: 0.8030, test_loss: 0.8128, test_f1: 0.6040
 epoch: 14, train_loss: 0.7994, test_loss: 0.8203, test_f1: 0.5808
 epoch: 15, train_loss: 0.7874, test_loss: 0.8284, test_f1: 0.6315
 epoch: 16, train_loss: 0.7750, test_loss: 0.8073, test_f1: 0.6166
 epoch: 17, train_loss: 0.7646, test_loss: 0.8068, test_f1: 0.6157
 epoch: 18, train_loss: 0.7471, test_loss: 0.7819, test_f1: 0.6109
 epoch: 19, train_loss: 0.7457, test_loss: 0.8037, test_f1: 0.6286
 epoch: 20, train_loss: 0.7361, test_loss: 0.8206, test_f1: 0.6161
 epoch: 21, train_loss: 0.7278, test_loss: 0.8271, test_f1: 0.6142
 epoch: 22, train_loss: 0.7177, test_loss: 0.8102, test_f1: 0.6278
 epoch: 23, train_loss: 0.7094, test_loss: 0.7926, test_f1: 0.6054
 epoch: 24, train_loss: 0.7118, test_loss: 0.7698, test_f1: 0.6380
 epoch: 25, train_loss: 0.6941, test_loss: 0.7741, test_f1: 0.6441
 epoch: 26, train_loss: 0.6806, test_loss: 0.7843, test_f1: 0.6447
 epoch: 27, train_loss: 0.6961, test_loss: 0.8056, test_f1: 0.6379
 epoch: 28, train_loss: 0.6737, test_loss: 0.7975, test_f1: 0.6355
 epoch: 29, train_loss: 0.6646, test_loss: 0.8399, test_f1: 0.6538
 epoch: 30, train_loss: 0.6552, test_loss: 0.8263, test_f1: 0.6409
 epoch: 31, train_loss: 0.6453, test_loss: 0.8102, test_f1: 0.6321
 epoch: 32, train_loss: 0.6320, test_loss: 0.7579, test_f1: 0.6551
 epoch: 33, train_loss: 0.6521, test_loss: 0.7314, test_f1: 0.6498
 epoch: 34, train_loss: 0.6351, test_loss: 0.7999, test_f1: 0.6496
 epoch: 35, train_loss: 0.6488, test_loss: 0.7609, test_f1: 0.6457
 epoch: 36, train_loss: 0.6275, test_loss: 0.7786, test_f1: 0.6384
 epoch: 37, train_loss: 0.6187, test_loss: 0.8038, test_f1: 0.6458
 epoch: 38, train_loss: 0.5921, test_loss: 0.8116, test_f1: 0.6206
 epoch: 39, train_loss: 0.6077, test_loss: 0.7765, test_f1: 0.6358
 epoch: 40, train_loss: 0.5969, test_loss: 0.7835, test_f1: 0.6542
 epoch: 41, train_loss: 0.5904, test_loss: 0.8450, test_f1: 0.6193
 epoch: 42, train_loss: 0.5846, test_loss: 0.8091, test_f1: 0.6377
 epoch: 43, train_loss: 0.5727, test_loss: 0.8560, test_f1: 0.6434
 epoch: 44, train_loss: 0.5779, test_loss: 0.8687, test_f1: 0.6197
 epoch: 45, train_loss: 0.5705, test_loss: 0.8301, test_f1: 0.6538
 epoch: 46, train_loss: 0.5529, test_loss: 0.7517, test_f1: 0.6957
 epoch: 47, train_loss: 0.5606, test_loss: 0.7983, test_f1: 0.6632
 epoch: 48, train_loss: 0.5493, test_loss: 0.8252, test_f1: 0.6478
 epoch: 49, train_loss: 0.5410, test_loss: 0.7769, test_f1: 0.6525
 epoch: 50, train_loss: 0.5278, test_loss: 0.8778, test_f1: 0.6484
 epoch: 51, train_loss: 0.5001, test_loss: 0.7910, test_f1: 0.6769
 epoch: 52, train_loss: 0.4975, test_loss: 0.8769, test_f1: 0.6523
 epoch: 53, train_loss: 0.5107, test_loss: 0.8476, test_f1: 0.6709
 epoch: 54, train_loss: 0.4895, test_loss: 0.9030, test_f1: 0.6521
 epoch: 55, train_loss: 0.4839, test_loss: 0.8738, test_f1: 0.6538
 epoch: 56, train_loss: 0.4900, test_loss: 0.8770, test_f1: 0.6660
 epoch: 57, train_loss: 0.4796, test_loss: 0.8916, test_f1: 0.6520
 epoch: 58, train_loss: 0.4914, test_loss: 0.9290, test_f1: 0.6436
 epoch: 59, train_loss: 0.4652, test_loss: 0.9021, test_f1: 0.6547
 epoch: 60, train_loss: 0.4762, test_loss: 0.9774, test_f1: 0.6350
 epoch: 61, train_loss: 0.4616, test_loss: 0.9941, test_f1: 0.6589
 epoch: 62, train_loss: 0.4557, test_loss: 0.9062, test_f1: 0.6523
 epoch: 63, train_loss: 0.4529, test_loss: 0.9463, test_f1: 0.6565
 epoch: 64, train_loss: 0.4574, test_loss: 0.9644, test_f1: 0.6620
 epoch: 65, train_loss: 0.4631, test_loss: 0.9770, test_f1: 0.6425
 epoch: 66, train_loss: 0.4602, test_loss: 1.0879, test_f1: 0.6648
 epoch: 67, train_loss: 0.4534, test_loss: 0.9411, test_f1: 0.6638
 epoch: 68, train_loss: 0.4443, test_loss: 0.9364, test_f1: 0.6732
 epoch: 69, train_loss: 0.4378, test_loss: 0.9735, test_f1: 0.6572
 epoch: 70, train_loss: 0.4387, test_loss: 1.0365, test_f1: 0.6416
 epoch: 71, train_loss: 0.4523, test_loss: 0.9870, test_f1: 0.6455
 epoch: 72, train_loss: 0.4391, test_loss: 0.9816, test_f1: 0.6662
 epoch: 73, train_loss: 0.4264, test_loss: 0.9838, test_f1: 0.6564
 epoch: 74, train_loss: 0.4209, test_loss: 0.9745, test_f1: 0.6701
 epoch: 75, train_loss: 0.4346, test_loss: 0.9282, test_f1: 0.6768
 epoch: 76, train_loss: 0.4243, test_loss: 0.9704, test_f1: 0.6685
 epoch: 77, train_loss: 0.4119, test_loss: 1.0397, test_f1: 0.6414
 epoch: 78, train_loss: 0.4234, test_loss: 1.0854, test_f1: 0.6641
 epoch: 79, train_loss: 0.4104, test_loss: 1.0273, test_f1: 0.6541
 epoch: 80, train_loss: 0.4232, test_loss: 1.0564, test_f1: 0.6507
 epoch: 81, train_loss: 0.4152, test_loss: 1.0978, test_f1: 0.6606
 epoch: 82, train_loss: 0.4129, test_loss: 1.0540, test_f1: 0.6398
 epoch: 83, train_loss: 0.4064, test_loss: 1.0106, test_f1: 0.6656
 epoch: 84, train_loss: 0.4007, test_loss: 1.0514, test_f1: 0.6535
 epoch: 85, train_loss: 0.4042, test_loss: 1.0912, test_f1: 0.6519
 epoch: 86, train_loss: 0.3875, test_loss: 1.1275, test_f1: 0.6519
 epoch: 87, train_loss: 0.3986, test_loss: 1.0748, test_f1: 0.6549
 epoch: 88, train_loss: 0.3925, test_loss: 1.1219, test_f1: 0.6556
 epoch: 89, train_loss: 0.3911, test_loss: 1.1707, test_f1: 0.6542
 epoch: 90, train_loss: 0.3949, test_loss: 1.1395, test_f1: 0.6479
 epoch: 91, train_loss: 0.3844, test_loss: 1.1201, test_f1: 0.6644
 epoch: 92, train_loss: 0.3758, test_loss: 1.1714, test_f1: 0.6330
 epoch: 93, train_loss: 0.3798, test_loss: 1.1803, test_f1: 0.6530
 epoch: 94, train_loss: 0.3631, test_loss: 1.2008, test_f1: 0.6379
 epoch: 95, train_loss: 0.3747, test_loss: 1.1706, test_f1: 0.6639
 epoch: 96, train_loss: 0.3710, test_loss: 1.1742, test_f1: 0.6577
 epoch: 97, train_loss: 0.3637, test_loss: 1.2362, test_f1: 0.6509
 epoch: 98, train_loss: 0.3630, test_loss: 1.1988, test_f1: 0.6588
 epoch: 99, train_loss: 0.3728, test_loss: 1.1641, test_f1: 0.6705

Training completed in 2041.48 seconds
Best F1: 0.7042 at epoch 96
Mean F1 across iterations: 0.6851  0.0145
========================FINAL RESULTS================================
FEGIN weighted F1: 0.7042  0.0145
python main.py --data ltspice_examples --representation component_pin_net --model FEGIN --layers 4 --hiddens 128 --batch_size 32 --lr 0.0001 --emb_size 512 --epochs 100 --save_appendix component_pin_net_L4_H128_BS32_LR0.0001_E512 --no_val
-----



STDERR:
  File "main.py", line 370, in <module>
    main()
  File "main.py", line 254, in main
    dataset = dataset_class(
  File "/home/philip/projects/llm_inference_code_repo/Circuit-Completion-Using-GNNs/component_classification_with_link_prediction_head/evaluation/FEGIN/kernel/circuit_datasets.py", line 15, in __init__
    self.data, self.slices = torch.load(self.processed_paths[0])
  File "/home/philip/.local/lib/python3.8/site-packages/torch/serialization.py", line 1040, in load
    warnings.warn(
  File "/usr/lib/python3.8/warnings.py", line 109, in _showwarnmsg
    sw(msg.message, msg.category, msg.filename, msg.lineno,
  File "main.py", line 47, in warn_with_traceback
    traceback.print_stack(file=log)
/home/philip/projects/llm_inference_code_repo/Circuit-Completion-Using-GNNs/component_classification_with_link_prediction_head/evaluation/FEGIN/kernel/circuit_datasets.py:15: FutureWarning: You are using `torch.load` with `weights_only=False` (the current default value), which uses the default pickle module implicitly. It is possible to construct malicious pickle data which will execute arbitrary code during unpickling (See https://github.com/pytorch/pytorch/blob/main/SECURITY.md#untrusted-models for more details). In a future release, the default value for `weights_only` will be flipped to `True`. This limits the functions that could be executed during unpickling. Arbitrary objects will no longer be allowed to be loaded via this mode unless they are explicitly allowlisted by the user via `torch.serialization.add_safe_globals`. We recommend you start setting `weights_only=True` for any use case where you don't have full control of the loaded file. Please open an issue on GitHub for any issues related to this experimental feature.
  self.data, self.slices = torch.load(self.processed_paths[0])
