STDOUT:
Results will be saved in /home/philip/projects/ltspice_examples_code_repo/Circuit-Completion-Using-GNNs/component_classification_with_link_prediction_head/evaluation/FEGIN/results/model_FEGIN_dataset_ltspice_demos
Command line input: python main.py --data ltspice_demos --representation component_net --model FEGIN --layers 6 --hiddens 64 --batch_size 64 --lr 0.0001 --emb_size 512 --epochs 100 --save_appendix component_net_L6_H64_BS64_LR0.0001_E512 --no_val
 is saved.
-----
ltspice_demos - FEGIN
Using 6 layers, 64 hidden units, h = 2
Loading component_net representation dataset
ENTERED
Training FEGIN on component_net representation
Train: 1565, Test: 383
##################ITERATION #0 ****************************************
 epoch: 0, train_loss: 1.3760, test_loss: 1.3862, test_f1: 0.1365
 epoch: 1, train_loss: 1.3528, test_loss: 1.3744, test_f1: 0.1365
 epoch: 2, train_loss: 1.3338, test_loss: 1.3609, test_f1: 0.1365
 epoch: 3, train_loss: 1.3087, test_loss: 1.3352, test_f1: 0.1365
 epoch: 4, train_loss: 1.2800, test_loss: 1.3039, test_f1: 0.1365
 epoch: 5, train_loss: 1.2488, test_loss: 1.2767, test_f1: 0.1580
 epoch: 6, train_loss: 1.2167, test_loss: 1.2532, test_f1: 0.2005
 epoch: 7, train_loss: 1.1911, test_loss: 1.2314, test_f1: 0.3313
 epoch: 8, train_loss: 1.1681, test_loss: 1.2160, test_f1: 0.3599
 epoch: 9, train_loss: 1.1576, test_loss: 1.2035, test_f1: 0.3168
 epoch: 10, train_loss: 1.1463, test_loss: 1.1940, test_f1: 0.3091
 epoch: 11, train_loss: 1.1408, test_loss: 1.1897, test_f1: 0.3108
 epoch: 12, train_loss: 1.1335, test_loss: 1.1793, test_f1: 0.3085
 epoch: 13, train_loss: 1.1200, test_loss: 1.1710, test_f1: 0.3239
 epoch: 14, train_loss: 1.1137, test_loss: 1.1659, test_f1: 0.3241
 epoch: 15, train_loss: 1.1105, test_loss: 1.1666, test_f1: 0.3190
 epoch: 16, train_loss: 1.1023, test_loss: 1.1563, test_f1: 0.3337
 epoch: 17, train_loss: 1.0926, test_loss: 1.1537, test_f1: 0.3465
 epoch: 18, train_loss: 1.0935, test_loss: 1.1448, test_f1: 0.3503
 epoch: 19, train_loss: 1.0828, test_loss: 1.1423, test_f1: 0.4062
 epoch: 20, train_loss: 1.0748, test_loss: 1.1336, test_f1: 0.4312
 epoch: 21, train_loss: 1.0678, test_loss: 1.1344, test_f1: 0.4533
 epoch: 22, train_loss: 1.0597, test_loss: 1.1297, test_f1: 0.4638
 epoch: 23, train_loss: 1.0588, test_loss: 1.1317, test_f1: 0.4728
 epoch: 24, train_loss: 1.0517, test_loss: 1.1187, test_f1: 0.5062
 epoch: 25, train_loss: 1.0376, test_loss: 1.1204, test_f1: 0.4848
 epoch: 26, train_loss: 1.0334, test_loss: 1.1025, test_f1: 0.4946
 epoch: 27, train_loss: 1.0278, test_loss: 1.1181, test_f1: 0.4773
 epoch: 28, train_loss: 1.0174, test_loss: 1.1229, test_f1: 0.4981
 epoch: 29, train_loss: 1.0146, test_loss: 1.0851, test_f1: 0.5083
 epoch: 30, train_loss: 1.0045, test_loss: 1.0763, test_f1: 0.5196
 epoch: 31, train_loss: 0.9976, test_loss: 1.0778, test_f1: 0.5153
 epoch: 32, train_loss: 0.9875, test_loss: 1.0786, test_f1: 0.5115
 epoch: 33, train_loss: 0.9772, test_loss: 1.0721, test_f1: 0.5024
 epoch: 34, train_loss: 0.9732, test_loss: 1.0608, test_f1: 0.5138
 epoch: 35, train_loss: 0.9674, test_loss: 1.0869, test_f1: 0.5156
 epoch: 36, train_loss: 0.9666, test_loss: 1.0732, test_f1: 0.5125
 epoch: 37, train_loss: 0.9530, test_loss: 1.0599, test_f1: 0.5357
 epoch: 38, train_loss: 0.9381, test_loss: 1.0646, test_f1: 0.5182
 epoch: 39, train_loss: 0.9443, test_loss: 1.0575, test_f1: 0.5441
 epoch: 40, train_loss: 0.9336, test_loss: 1.0637, test_f1: 0.5227
 epoch: 41, train_loss: 0.9341, test_loss: 1.0851, test_f1: 0.5448
 epoch: 42, train_loss: 0.9187, test_loss: 1.0564, test_f1: 0.5438
 epoch: 43, train_loss: 0.9076, test_loss: 1.0622, test_f1: 0.5384
 epoch: 44, train_loss: 0.9057, test_loss: 1.0798, test_f1: 0.5442
 epoch: 45, train_loss: 0.8968, test_loss: 1.0844, test_f1: 0.5373
 epoch: 46, train_loss: 0.8869, test_loss: 1.0845, test_f1: 0.5447
 epoch: 47, train_loss: 0.8819, test_loss: 1.0820, test_f1: 0.5545
 epoch: 48, train_loss: 0.8733, test_loss: 1.1171, test_f1: 0.5320
 epoch: 49, train_loss: 0.8757, test_loss: 1.0738, test_f1: 0.5480
 epoch: 50, train_loss: 0.8729, test_loss: 1.0622, test_f1: 0.5390
 epoch: 51, train_loss: 0.8648, test_loss: 1.1394, test_f1: 0.5347
 epoch: 52, train_loss: 0.8486, test_loss: 1.1326, test_f1: 0.5248
 epoch: 53, train_loss: 0.8603, test_loss: 1.1468, test_f1: 0.5193
 epoch: 54, train_loss: 0.8577, test_loss: 1.1293, test_f1: 0.5253
 epoch: 55, train_loss: 0.8524, test_loss: 1.1160, test_f1: 0.5289
 epoch: 56, train_loss: 0.8432, test_loss: 1.1281, test_f1: 0.5263
 epoch: 57, train_loss: 0.8472, test_loss: 1.1479, test_f1: 0.5202
 epoch: 58, train_loss: 0.8498, test_loss: 1.1190, test_f1: 0.5299
 epoch: 59, train_loss: 0.8554, test_loss: 1.1485, test_f1: 0.5298
 epoch: 60, train_loss: 0.8499, test_loss: 1.1574, test_f1: 0.5321
 epoch: 61, train_loss: 0.8415, test_loss: 1.1451, test_f1: 0.5298
 epoch: 62, train_loss: 0.8481, test_loss: 1.1365, test_f1: 0.5488
 epoch: 63, train_loss: 0.8458, test_loss: 1.1558, test_f1: 0.5391
 epoch: 64, train_loss: 0.8378, test_loss: 1.1144, test_f1: 0.5308
 epoch: 65, train_loss: 0.8416, test_loss: 1.1559, test_f1: 0.5393
 epoch: 66, train_loss: 0.8433, test_loss: 1.1468, test_f1: 0.5351
 epoch: 67, train_loss: 0.8241, test_loss: 1.1759, test_f1: 0.5300
 epoch: 68, train_loss: 0.8298, test_loss: 1.1638, test_f1: 0.5355
 epoch: 69, train_loss: 0.8296, test_loss: 1.2017, test_f1: 0.5297
 epoch: 70, train_loss: 0.8216, test_loss: 1.1824, test_f1: 0.5272
 epoch: 71, train_loss: 0.8204, test_loss: 1.2124, test_f1: 0.5208
 epoch: 72, train_loss: 0.8345, test_loss: 1.1699, test_f1: 0.5294
 epoch: 73, train_loss: 0.8438, test_loss: 1.1743, test_f1: 0.5273
 epoch: 74, train_loss: 0.8142, test_loss: 1.1818, test_f1: 0.5259
 epoch: 75, train_loss: 0.8268, test_loss: 1.1664, test_f1: 0.5451
 epoch: 76, train_loss: 0.8192, test_loss: 1.1764, test_f1: 0.5356
 epoch: 77, train_loss: 0.8047, test_loss: 1.2005, test_f1: 0.5319
 epoch: 78, train_loss: 0.8004, test_loss: 1.2004, test_f1: 0.5283
 epoch: 79, train_loss: 0.8142, test_loss: 1.1929, test_f1: 0.5321
 epoch: 80, train_loss: 0.8260, test_loss: 1.1942, test_f1: 0.5310
 epoch: 81, train_loss: 0.8055, test_loss: 1.1724, test_f1: 0.5411
 epoch: 82, train_loss: 0.8099, test_loss: 1.2081, test_f1: 0.5320
 epoch: 83, train_loss: 0.7931, test_loss: 1.2232, test_f1: 0.5347
 epoch: 84, train_loss: 0.8016, test_loss: 1.2013, test_f1: 0.5424
 epoch: 85, train_loss: 0.8124, test_loss: 1.2073, test_f1: 0.5380
 epoch: 86, train_loss: 0.8010, test_loss: 1.2135, test_f1: 0.5448
 epoch: 87, train_loss: 0.7818, test_loss: 1.1843, test_f1: 0.5366
 epoch: 88, train_loss: 0.8145, test_loss: 1.2540, test_f1: 0.5333
 epoch: 89, train_loss: 0.8016, test_loss: 1.2133, test_f1: 0.5183
 epoch: 90, train_loss: 0.8044, test_loss: 1.2286, test_f1: 0.5205
 epoch: 91, train_loss: 0.8053, test_loss: 1.2279, test_f1: 0.5196
 epoch: 92, train_loss: 0.7907, test_loss: 1.2226, test_f1: 0.5261
 epoch: 93, train_loss: 0.7883, test_loss: 1.2257, test_f1: 0.5119
 epoch: 94, train_loss: 0.7822, test_loss: 1.2536, test_f1: 0.5340
 epoch: 95, train_loss: 0.8013, test_loss: 1.2063, test_f1: 0.5294
 epoch: 96, train_loss: 0.7762, test_loss: 1.2710, test_f1: 0.5192
 epoch: 97, train_loss: 0.7908, test_loss: 1.2726, test_f1: 0.5286
 epoch: 98, train_loss: 0.7852, test_loss: 1.2516, test_f1: 0.5279
 epoch: 99, train_loss: 0.7944, test_loss: 1.2688, test_f1: 0.5219
##################ITERATION #1 ****************************************
 epoch: 0, train_loss: 1.3357, test_loss: 1.3614, test_f1: 0.1365
 epoch: 1, train_loss: 1.2740, test_loss: 1.3220, test_f1: 0.2183
 epoch: 2, train_loss: 1.2318, test_loss: 1.2630, test_f1: 0.2739
 epoch: 3, train_loss: 1.2019, test_loss: 1.2300, test_f1: 0.3372
 epoch: 4, train_loss: 1.1772, test_loss: 1.2037, test_f1: 0.3534
 epoch: 5, train_loss: 1.1561, test_loss: 1.1878, test_f1: 0.3783
 epoch: 6, train_loss: 1.1359, test_loss: 1.1733, test_f1: 0.3917
 epoch: 7, train_loss: 1.1222, test_loss: 1.1615, test_f1: 0.4310
 epoch: 8, train_loss: 1.1077, test_loss: 1.1452, test_f1: 0.4389
 epoch: 9, train_loss: 1.0997, test_loss: 1.1344, test_f1: 0.4469
 epoch: 10, train_loss: 1.0901, test_loss: 1.1281, test_f1: 0.4487
 epoch: 11, train_loss: 1.0828, test_loss: 1.1165, test_f1: 0.4766
 epoch: 12, train_loss: 1.0676, test_loss: 1.1070, test_f1: 0.4865
 epoch: 13, train_loss: 1.0636, test_loss: 1.0961, test_f1: 0.4989
 epoch: 14, train_loss: 1.0481, test_loss: 1.0930, test_f1: 0.5028
 epoch: 15, train_loss: 1.0461, test_loss: 1.0841, test_f1: 0.5109
 epoch: 16, train_loss: 1.0386, test_loss: 1.0799, test_f1: 0.5012
 epoch: 17, train_loss: 1.0251, test_loss: 1.0748, test_f1: 0.5006
 epoch: 18, train_loss: 1.0183, test_loss: 1.0660, test_f1: 0.5009
 epoch: 19, train_loss: 1.0107, test_loss: 1.0518, test_f1: 0.5019
 epoch: 20, train_loss: 0.9958, test_loss: 1.0429, test_f1: 0.5233
 epoch: 21, train_loss: 0.9881, test_loss: 1.0375, test_f1: 0.5310
 epoch: 22, train_loss: 0.9755, test_loss: 1.0314, test_f1: 0.5399
 epoch: 23, train_loss: 0.9656, test_loss: 1.0249, test_f1: 0.5182
 epoch: 24, train_loss: 0.9701, test_loss: 1.0098, test_f1: 0.5378
 epoch: 25, train_loss: 0.9601, test_loss: 1.0291, test_f1: 0.5243
 epoch: 26, train_loss: 0.9479, test_loss: 1.0096, test_f1: 0.5445
 epoch: 27, train_loss: 0.9497, test_loss: 1.0065, test_f1: 0.5372
 epoch: 28, train_loss: 0.9419, test_loss: 1.0017, test_f1: 0.5607
 epoch: 29, train_loss: 0.9391, test_loss: 1.0043, test_f1: 0.5286
 epoch: 30, train_loss: 0.9245, test_loss: 1.0060, test_f1: 0.5382
 epoch: 31, train_loss: 0.9366, test_loss: 1.0276, test_f1: 0.5275
 epoch: 32, train_loss: 0.9155, test_loss: 0.9921, test_f1: 0.5407
 epoch: 33, train_loss: 0.9148, test_loss: 0.9872, test_f1: 0.5405
 epoch: 34, train_loss: 0.9150, test_loss: 0.9944, test_f1: 0.5310
 epoch: 35, train_loss: 0.9011, test_loss: 0.9934, test_f1: 0.5510
 epoch: 36, train_loss: 0.8945, test_loss: 0.9954, test_f1: 0.5392
 epoch: 37, train_loss: 0.8894, test_loss: 1.0128, test_f1: 0.5421
 epoch: 38, train_loss: 0.8804, test_loss: 0.9943, test_f1: 0.5387
 epoch: 39, train_loss: 0.8809, test_loss: 1.0212, test_f1: 0.5261
 epoch: 40, train_loss: 0.8838, test_loss: 0.9768, test_f1: 0.5547
 epoch: 41, train_loss: 0.8698, test_loss: 1.0146, test_f1: 0.5510
 epoch: 42, train_loss: 0.8736, test_loss: 1.0108, test_f1: 0.5556
 epoch: 43, train_loss: 0.8672, test_loss: 1.0005, test_f1: 0.5402
 epoch: 44, train_loss: 0.8570, test_loss: 0.9977, test_f1: 0.5368
 epoch: 45, train_loss: 0.8534, test_loss: 1.0170, test_f1: 0.5330
 epoch: 46, train_loss: 0.8555, test_loss: 1.0300, test_f1: 0.5359
 epoch: 47, train_loss: 0.8351, test_loss: 1.0113, test_f1: 0.5461
 epoch: 48, train_loss: 0.8342, test_loss: 0.9924, test_f1: 0.5703
 epoch: 49, train_loss: 0.8406, test_loss: 0.9901, test_f1: 0.5537
 epoch: 50, train_loss: 0.8261, test_loss: 1.0053, test_f1: 0.5710
 epoch: 51, train_loss: 0.8432, test_loss: 1.0166, test_f1: 0.5459
 epoch: 52, train_loss: 0.8301, test_loss: 1.0275, test_f1: 0.5496
 epoch: 53, train_loss: 0.8245, test_loss: 1.0439, test_f1: 0.5545
 epoch: 54, train_loss: 0.8146, test_loss: 1.0381, test_f1: 0.5524
 epoch: 55, train_loss: 0.8162, test_loss: 1.0379, test_f1: 0.5541
 epoch: 56, train_loss: 0.8163, test_loss: 1.0359, test_f1: 0.5522
 epoch: 57, train_loss: 0.8236, test_loss: 1.0507, test_f1: 0.5537
 epoch: 58, train_loss: 0.8141, test_loss: 1.0299, test_f1: 0.5705
 epoch: 59, train_loss: 0.8081, test_loss: 1.0052, test_f1: 0.5641
 epoch: 60, train_loss: 0.8016, test_loss: 1.0207, test_f1: 0.5605
 epoch: 61, train_loss: 0.8032, test_loss: 1.0505, test_f1: 0.5577
 epoch: 62, train_loss: 0.8068, test_loss: 1.0593, test_f1: 0.5653
 epoch: 63, train_loss: 0.8050, test_loss: 1.0443, test_f1: 0.5671
 epoch: 64, train_loss: 0.7946, test_loss: 1.0468, test_f1: 0.5782
 epoch: 65, train_loss: 0.8061, test_loss: 1.0621, test_f1: 0.5654
 epoch: 66, train_loss: 0.8042, test_loss: 1.0514, test_f1: 0.5699
 epoch: 67, train_loss: 0.7977, test_loss: 1.0328, test_f1: 0.5819
 epoch: 68, train_loss: 0.8055, test_loss: 1.0345, test_f1: 0.5750
 epoch: 69, train_loss: 0.7916, test_loss: 1.0430, test_f1: 0.5817
 epoch: 70, train_loss: 0.7964, test_loss: 1.0039, test_f1: 0.5749
 epoch: 71, train_loss: 0.7996, test_loss: 1.0231, test_f1: 0.5797
 epoch: 72, train_loss: 0.7789, test_loss: 1.0565, test_f1: 0.5739
 epoch: 73, train_loss: 0.7843, test_loss: 1.0627, test_f1: 0.5709
 epoch: 74, train_loss: 0.7867, test_loss: 1.0139, test_f1: 0.5740
 epoch: 75, train_loss: 0.7859, test_loss: 1.0353, test_f1: 0.5790
 epoch: 76, train_loss: 0.7832, test_loss: 1.0478, test_f1: 0.5782
 epoch: 77, train_loss: 0.7812, test_loss: 1.0114, test_f1: 0.5840
 epoch: 78, train_loss: 0.7786, test_loss: 1.0271, test_f1: 0.5798
 epoch: 79, train_loss: 0.7701, test_loss: 1.0564, test_f1: 0.5663
 epoch: 80, train_loss: 0.7694, test_loss: 1.0683, test_f1: 0.5693
 epoch: 81, train_loss: 0.7715, test_loss: 1.0229, test_f1: 0.5849
 epoch: 82, train_loss: 0.7748, test_loss: 1.0508, test_f1: 0.5728
 epoch: 83, train_loss: 0.7643, test_loss: 1.0496, test_f1: 0.5686
 epoch: 84, train_loss: 0.7715, test_loss: 1.0494, test_f1: 0.5881
 epoch: 85, train_loss: 0.7553, test_loss: 1.0976, test_f1: 0.5646
 epoch: 86, train_loss: 0.7742, test_loss: 1.0901, test_f1: 0.5798
 epoch: 87, train_loss: 0.7695, test_loss: 1.0661, test_f1: 0.5749
 epoch: 88, train_loss: 0.7644, test_loss: 1.0782, test_f1: 0.5743
 epoch: 89, train_loss: 0.7567, test_loss: 1.0897, test_f1: 0.5811
 epoch: 90, train_loss: 0.7715, test_loss: 1.0839, test_f1: 0.5856
 epoch: 91, train_loss: 0.7497, test_loss: 1.1111, test_f1: 0.5840
 epoch: 92, train_loss: 0.7652, test_loss: 1.0759, test_f1: 0.5793
 epoch: 93, train_loss: 0.7619, test_loss: 1.0892, test_f1: 0.5855
 epoch: 94, train_loss: 0.7645, test_loss: 1.1087, test_f1: 0.5733
 epoch: 95, train_loss: 0.7564, test_loss: 1.1329, test_f1: 0.5683
 epoch: 96, train_loss: 0.7569, test_loss: 1.1173, test_f1: 0.5789
 epoch: 97, train_loss: 0.7563, test_loss: 1.0906, test_f1: 0.5834
 epoch: 98, train_loss: 0.7662, test_loss: 1.0964, test_f1: 0.5803
 epoch: 99, train_loss: 0.7539, test_loss: 1.1195, test_f1: 0.5758
##################ITERATION #2 ****************************************
 epoch: 0, train_loss: 1.2713, test_loss: 1.3476, test_f1: 0.2281
 epoch: 1, train_loss: 1.2050, test_loss: 1.3292, test_f1: 0.2895
 epoch: 2, train_loss: 1.1744, test_loss: 1.2942, test_f1: 0.3413
 epoch: 3, train_loss: 1.1539, test_loss: 1.2270, test_f1: 0.3900
 epoch: 4, train_loss: 1.1345, test_loss: 1.1865, test_f1: 0.4280
 epoch: 5, train_loss: 1.1123, test_loss: 1.1674, test_f1: 0.4482
 epoch: 6, train_loss: 1.0987, test_loss: 1.1480, test_f1: 0.4698
 epoch: 7, train_loss: 1.0833, test_loss: 1.1383, test_f1: 0.4411
 epoch: 8, train_loss: 1.0680, test_loss: 1.1234, test_f1: 0.4758
 epoch: 9, train_loss: 1.0706, test_loss: 1.1095, test_f1: 0.4763
 epoch: 10, train_loss: 1.0374, test_loss: 1.1091, test_f1: 0.4816
 epoch: 11, train_loss: 1.0278, test_loss: 1.0944, test_f1: 0.4834
 epoch: 12, train_loss: 1.0203, test_loss: 1.0893, test_f1: 0.5022
 epoch: 13, train_loss: 1.0107, test_loss: 1.0975, test_f1: 0.5038
 epoch: 14, train_loss: 0.9974, test_loss: 1.0836, test_f1: 0.5221
 epoch: 15, train_loss: 0.9917, test_loss: 1.0708, test_f1: 0.5366
 epoch: 16, train_loss: 0.9786, test_loss: 1.0666, test_f1: 0.5490
 epoch: 17, train_loss: 0.9679, test_loss: 1.0812, test_f1: 0.5295
 epoch: 18, train_loss: 0.9554, test_loss: 1.0747, test_f1: 0.5414
 epoch: 19, train_loss: 0.9544, test_loss: 1.0584, test_f1: 0.5469
 epoch: 20, train_loss: 0.9432, test_loss: 1.0773, test_f1: 0.5349
 epoch: 21, train_loss: 0.9384, test_loss: 1.0436, test_f1: 0.5342
 epoch: 22, train_loss: 0.9401, test_loss: 1.0653, test_f1: 0.5282
 epoch: 23, train_loss: 0.9334, test_loss: 1.0592, test_f1: 0.5391
 epoch: 24, train_loss: 0.9181, test_loss: 1.0405, test_f1: 0.5387
 epoch: 25, train_loss: 0.9144, test_loss: 1.0406, test_f1: 0.5397
 epoch: 26, train_loss: 0.9071, test_loss: 1.0440, test_f1: 0.5448
 epoch: 27, train_loss: 0.9113, test_loss: 1.0505, test_f1: 0.5421
 epoch: 28, train_loss: 0.9089, test_loss: 1.0259, test_f1: 0.5565
 epoch: 29, train_loss: 0.9034, test_loss: 1.0545, test_f1: 0.5438
 epoch: 30, train_loss: 0.9003, test_loss: 1.0523, test_f1: 0.5536
 epoch: 31, train_loss: 0.8886, test_loss: 1.0325, test_f1: 0.5545
 epoch: 32, train_loss: 0.8798, test_loss: 1.0534, test_f1: 0.5599
 epoch: 33, train_loss: 0.8779, test_loss: 1.0403, test_f1: 0.5718
 epoch: 34, train_loss: 0.8741, test_loss: 1.0352, test_f1: 0.5764
 epoch: 35, train_loss: 0.8569, test_loss: 1.0326, test_f1: 0.5541
 epoch: 36, train_loss: 0.8655, test_loss: 1.0447, test_f1: 0.5575
 epoch: 37, train_loss: 0.8659, test_loss: 1.0634, test_f1: 0.5510
 epoch: 38, train_loss: 0.8700, test_loss: 1.0271, test_f1: 0.5826
 epoch: 39, train_loss: 0.8630, test_loss: 1.0099, test_f1: 0.5678
 epoch: 40, train_loss: 0.8494, test_loss: 1.0706, test_f1: 0.5731
 epoch: 41, train_loss: 0.8495, test_loss: 1.0287, test_f1: 0.5825
 epoch: 42, train_loss: 0.8415, test_loss: 1.0478, test_f1: 0.5659
 epoch: 43, train_loss: 0.8445, test_loss: 1.0504, test_f1: 0.5751
 epoch: 44, train_loss: 0.8365, test_loss: 1.0665, test_f1: 0.5807
 epoch: 45, train_loss: 0.8324, test_loss: 1.0398, test_f1: 0.5803
 epoch: 46, train_loss: 0.8194, test_loss: 1.1025, test_f1: 0.5742
 epoch: 47, train_loss: 0.8168, test_loss: 1.0528, test_f1: 0.5772
 epoch: 48, train_loss: 0.8197, test_loss: 1.0478, test_f1: 0.5743
 epoch: 49, train_loss: 0.8278, test_loss: 1.0371, test_f1: 0.5837
 epoch: 50, train_loss: 0.8211, test_loss: 1.0750, test_f1: 0.5459
 epoch: 51, train_loss: 0.8047, test_loss: 1.0668, test_f1: 0.5673
 epoch: 52, train_loss: 0.8074, test_loss: 1.0460, test_f1: 0.5910
 epoch: 53, train_loss: 0.7933, test_loss: 1.0548, test_f1: 0.5979
 epoch: 54, train_loss: 0.7924, test_loss: 1.0437, test_f1: 0.5993
 epoch: 55, train_loss: 0.7859, test_loss: 1.0494, test_f1: 0.5746
 epoch: 56, train_loss: 0.7933, test_loss: 1.0571, test_f1: 0.5718
 epoch: 57, train_loss: 0.7900, test_loss: 1.0663, test_f1: 0.5811
 epoch: 58, train_loss: 0.7849, test_loss: 1.0421, test_f1: 0.5996
 epoch: 59, train_loss: 0.7703, test_loss: 1.0827, test_f1: 0.5756
 epoch: 60, train_loss: 0.7910, test_loss: 1.0768, test_f1: 0.5802
 epoch: 61, train_loss: 0.7862, test_loss: 1.0566, test_f1: 0.5904
 epoch: 62, train_loss: 0.7871, test_loss: 1.0696, test_f1: 0.5796
 epoch: 63, train_loss: 0.7874, test_loss: 1.0682, test_f1: 0.5982
 epoch: 64, train_loss: 0.7770, test_loss: 1.0840, test_f1: 0.5787
 epoch: 65, train_loss: 0.7780, test_loss: 1.0865, test_f1: 0.5753
 epoch: 66, train_loss: 0.7707, test_loss: 1.1006, test_f1: 0.5638
 epoch: 67, train_loss: 0.7675, test_loss: 1.0897, test_f1: 0.5696
 epoch: 68, train_loss: 0.7716, test_loss: 1.0936, test_f1: 0.5662
 epoch: 69, train_loss: 0.7714, test_loss: 1.0994, test_f1: 0.5728
 epoch: 70, train_loss: 0.7694, test_loss: 1.1171, test_f1: 0.5777
 epoch: 71, train_loss: 0.7681, test_loss: 1.0937, test_f1: 0.5575
 epoch: 72, train_loss: 0.7511, test_loss: 1.0880, test_f1: 0.5740
 epoch: 73, train_loss: 0.7567, test_loss: 1.0927, test_f1: 0.5597
 epoch: 74, train_loss: 0.7487, test_loss: 1.1009, test_f1: 0.5699
 epoch: 75, train_loss: 0.7482, test_loss: 1.1095, test_f1: 0.5543
 epoch: 76, train_loss: 0.7401, test_loss: 1.1148, test_f1: 0.5594
 epoch: 77, train_loss: 0.7484, test_loss: 1.1440, test_f1: 0.5589
 epoch: 78, train_loss: 0.7592, test_loss: 1.1555, test_f1: 0.5691
 epoch: 79, train_loss: 0.7702, test_loss: 1.1283, test_f1: 0.5469
 epoch: 80, train_loss: 0.7429, test_loss: 1.1028, test_f1: 0.5559
 epoch: 81, train_loss: 0.7583, test_loss: 1.1105, test_f1: 0.5839
 epoch: 82, train_loss: 0.7427, test_loss: 1.1087, test_f1: 0.5595
 epoch: 83, train_loss: 0.7633, test_loss: 1.0964, test_f1: 0.5610
 epoch: 84, train_loss: 0.7427, test_loss: 1.1111, test_f1: 0.5575
 epoch: 85, train_loss: 0.7237, test_loss: 1.0985, test_f1: 0.5764
 epoch: 86, train_loss: 0.7329, test_loss: 1.1285, test_f1: 0.5769
 epoch: 87, train_loss: 0.7465, test_loss: 1.1024, test_f1: 0.5790
 epoch: 88, train_loss: 0.7382, test_loss: 1.0943, test_f1: 0.5737
 epoch: 89, train_loss: 0.7512, test_loss: 1.1166, test_f1: 0.5619
 epoch: 90, train_loss: 0.7378, test_loss: 1.0830, test_f1: 0.5747
 epoch: 91, train_loss: 0.7378, test_loss: 1.0956, test_f1: 0.5755
 epoch: 92, train_loss: 0.7261, test_loss: 1.1255, test_f1: 0.5643
 epoch: 93, train_loss: 0.7224, test_loss: 1.1109, test_f1: 0.5568
 epoch: 94, train_loss: 0.7329, test_loss: 1.1014, test_f1: 0.5806
 epoch: 95, train_loss: 0.7401, test_loss: 1.1171, test_f1: 0.5938
 epoch: 96, train_loss: 0.7333, test_loss: 1.1390, test_f1: 0.5722
 epoch: 97, train_loss: 0.7136, test_loss: 1.1312, test_f1: 0.5760
 epoch: 98, train_loss: 0.7166, test_loss: 1.1411, test_f1: 0.5854
 epoch: 99, train_loss: 0.7128, test_loss: 1.1063, test_f1: 0.5724
##################ITERATION #3 ****************************************
 epoch: 0, train_loss: 1.2607, test_loss: 1.3457, test_f1: 0.2281
 epoch: 1, train_loss: 1.1988, test_loss: 1.2791, test_f1: 0.2582
 epoch: 2, train_loss: 1.1731, test_loss: 1.2498, test_f1: 0.2323
 epoch: 3, train_loss: 1.1470, test_loss: 1.2073, test_f1: 0.3641
 epoch: 4, train_loss: 1.1302, test_loss: 1.1815, test_f1: 0.4101
 epoch: 5, train_loss: 1.1109, test_loss: 1.1636, test_f1: 0.4359
 epoch: 6, train_loss: 1.0956, test_loss: 1.1457, test_f1: 0.4457
 epoch: 7, train_loss: 1.0848, test_loss: 1.1337, test_f1: 0.4346
 epoch: 8, train_loss: 1.0688, test_loss: 1.1200, test_f1: 0.4590
 epoch: 9, train_loss: 1.0528, test_loss: 1.1148, test_f1: 0.4544
 epoch: 10, train_loss: 1.0383, test_loss: 1.1100, test_f1: 0.4769
 epoch: 11, train_loss: 1.0272, test_loss: 1.0994, test_f1: 0.4676
 epoch: 12, train_loss: 1.0312, test_loss: 1.0823, test_f1: 0.4767
 epoch: 13, train_loss: 1.0042, test_loss: 1.0692, test_f1: 0.4832
 epoch: 14, train_loss: 0.9945, test_loss: 1.0619, test_f1: 0.4843
 epoch: 15, train_loss: 0.9998, test_loss: 1.0784, test_f1: 0.4898
 epoch: 16, train_loss: 0.9852, test_loss: 1.0758, test_f1: 0.4943
 epoch: 17, train_loss: 0.9711, test_loss: 1.0559, test_f1: 0.5081
 epoch: 18, train_loss: 0.9778, test_loss: 1.0484, test_f1: 0.5064
 epoch: 19, train_loss: 0.9565, test_loss: 1.0571, test_f1: 0.5144
 epoch: 20, train_loss: 0.9581, test_loss: 1.0572, test_f1: 0.5151
 epoch: 21, train_loss: 0.9579, test_loss: 1.0511, test_f1: 0.5110
 epoch: 22, train_loss: 0.9443, test_loss: 1.0348, test_f1: 0.5352
 epoch: 23, train_loss: 0.9402, test_loss: 1.0310, test_f1: 0.5270
 epoch: 24, train_loss: 0.9312, test_loss: 1.0270, test_f1: 0.5303
 epoch: 25, train_loss: 0.9279, test_loss: 1.0481, test_f1: 0.5322
 epoch: 26, train_loss: 0.9197, test_loss: 1.0471, test_f1: 0.5354
 epoch: 27, train_loss: 0.9292, test_loss: 1.0544, test_f1: 0.5297
 epoch: 28, train_loss: 0.9009, test_loss: 1.0448, test_f1: 0.5280
 epoch: 29, train_loss: 0.9117, test_loss: 1.0492, test_f1: 0.5363
 epoch: 30, train_loss: 0.9105, test_loss: 1.0275, test_f1: 0.5359
 epoch: 31, train_loss: 0.9026, test_loss: 1.0350, test_f1: 0.5334
 epoch: 32, train_loss: 0.8864, test_loss: 1.0317, test_f1: 0.5444
 epoch: 33, train_loss: 0.8766, test_loss: 1.0399, test_f1: 0.5486
 epoch: 34, train_loss: 0.8861, test_loss: 1.0320, test_f1: 0.5604
 epoch: 35, train_loss: 0.8800, test_loss: 1.0233, test_f1: 0.5493
 epoch: 36, train_loss: 0.8614, test_loss: 1.0219, test_f1: 0.5494
 epoch: 37, train_loss: 0.8759, test_loss: 1.0470, test_f1: 0.5436
 epoch: 38, train_loss: 0.8736, test_loss: 1.0373, test_f1: 0.5525
 epoch: 39, train_loss: 0.8644, test_loss: 1.0041, test_f1: 0.5534
 epoch: 40, train_loss: 0.8606, test_loss: 1.0477, test_f1: 0.5477
 epoch: 41, train_loss: 0.8545, test_loss: 1.0644, test_f1: 0.5406
 epoch: 42, train_loss: 0.8565, test_loss: 1.0334, test_f1: 0.5579
 epoch: 43, train_loss: 0.8495, test_loss: 1.0610, test_f1: 0.5580
 epoch: 44, train_loss: 0.8462, test_loss: 1.0648, test_f1: 0.5647
 epoch: 45, train_loss: 0.8302, test_loss: 1.0465, test_f1: 0.5629
 epoch: 46, train_loss: 0.8354, test_loss: 1.0568, test_f1: 0.5650
 epoch: 47, train_loss: 0.8287, test_loss: 1.0943, test_f1: 0.5786
 epoch: 48, train_loss: 0.8390, test_loss: 1.0921, test_f1: 0.5524
 epoch: 49, train_loss: 0.8304, test_loss: 1.0553, test_f1: 0.5616
 epoch: 50, train_loss: 0.8268, test_loss: 1.0802, test_f1: 0.5703
 epoch: 51, train_loss: 0.8229, test_loss: 1.1018, test_f1: 0.5685
 epoch: 52, train_loss: 0.8118, test_loss: 1.0770, test_f1: 0.5710
 epoch: 53, train_loss: 0.8121, test_loss: 1.0900, test_f1: 0.5671
 epoch: 54, train_loss: 0.8201, test_loss: 1.0756, test_f1: 0.5747
 epoch: 55, train_loss: 0.8005, test_loss: 1.0603, test_f1: 0.5790
 epoch: 56, train_loss: 0.8030, test_loss: 1.0791, test_f1: 0.5760
 epoch: 57, train_loss: 0.8013, test_loss: 1.1073, test_f1: 0.5577
 epoch: 58, train_loss: 0.7882, test_loss: 1.1159, test_f1: 0.5663
 epoch: 59, train_loss: 0.8015, test_loss: 1.1081, test_f1: 0.5612
 epoch: 60, train_loss: 0.7781, test_loss: 1.1006, test_f1: 0.5652
 epoch: 61, train_loss: 0.7988, test_loss: 1.1090, test_f1: 0.5620
 epoch: 62, train_loss: 0.7876, test_loss: 1.1071, test_f1: 0.5625
 epoch: 63, train_loss: 0.7988, test_loss: 1.1158, test_f1: 0.5754
 epoch: 64, train_loss: 0.7834, test_loss: 1.1280, test_f1: 0.5648
 epoch: 65, train_loss: 0.7870, test_loss: 1.0938, test_f1: 0.5606
 epoch: 66, train_loss: 0.7953, test_loss: 1.1435, test_f1: 0.5556
 epoch: 67, train_loss: 0.7934, test_loss: 1.1350, test_f1: 0.5701
 epoch: 68, train_loss: 0.7883, test_loss: 1.1490, test_f1: 0.5637
 epoch: 69, train_loss: 0.7866, test_loss: 1.1713, test_f1: 0.5783
 epoch: 70, train_loss: 0.7727, test_loss: 1.1382, test_f1: 0.5763
 epoch: 71, train_loss: 0.7833, test_loss: 1.1378, test_f1: 0.5712
 epoch: 72, train_loss: 0.7967, test_loss: 1.1392, test_f1: 0.5759
 epoch: 73, train_loss: 0.7682, test_loss: 1.1240, test_f1: 0.5716
 epoch: 74, train_loss: 0.7726, test_loss: 1.1684, test_f1: 0.5687
 epoch: 75, train_loss: 0.7802, test_loss: 1.1387, test_f1: 0.5667
 epoch: 76, train_loss: 0.7701, test_loss: 1.1854, test_f1: 0.5615
 epoch: 77, train_loss: 0.7844, test_loss: 1.1728, test_f1: 0.5697
 epoch: 78, train_loss: 0.7893, test_loss: 1.1727, test_f1: 0.5814
 epoch: 79, train_loss: 0.7914, test_loss: 1.1670, test_f1: 0.5651
 epoch: 80, train_loss: 0.7793, test_loss: 1.2055, test_f1: 0.5627
 epoch: 81, train_loss: 0.7714, test_loss: 1.1853, test_f1: 0.5663
 epoch: 82, train_loss: 0.7876, test_loss: 1.1779, test_f1: 0.5666
 epoch: 83, train_loss: 0.7745, test_loss: 1.1977, test_f1: 0.5507
 epoch: 84, train_loss: 0.7675, test_loss: 1.1964, test_f1: 0.5632
 epoch: 85, train_loss: 0.7518, test_loss: 1.1890, test_f1: 0.5606
 epoch: 86, train_loss: 0.7675, test_loss: 1.2071, test_f1: 0.5599
 epoch: 87, train_loss: 0.7640, test_loss: 1.1958, test_f1: 0.5724
 epoch: 88, train_loss: 0.7699, test_loss: 1.1526, test_f1: 0.5729
 epoch: 89, train_loss: 0.7575, test_loss: 1.2110, test_f1: 0.5695
 epoch: 90, train_loss: 0.7715, test_loss: 1.1850, test_f1: 0.5775
 epoch: 91, train_loss: 0.7329, test_loss: 1.1901, test_f1: 0.5707
 epoch: 92, train_loss: 0.7343, test_loss: 1.2081, test_f1: 0.5645
 epoch: 93, train_loss: 0.7512, test_loss: 1.2125, test_f1: 0.5769
 epoch: 94, train_loss: 0.7626, test_loss: 1.1937, test_f1: 0.5749
 epoch: 95, train_loss: 0.7417, test_loss: 1.2073, test_f1: 0.5697
 epoch: 96, train_loss: 0.7577, test_loss: 1.2104, test_f1: 0.5666
 epoch: 97, train_loss: 0.7396, test_loss: 1.2412, test_f1: 0.5624
 epoch: 98, train_loss: 0.7355, test_loss: 1.2335, test_f1: 0.5679
 epoch: 99, train_loss: 0.7350, test_loss: 1.2566, test_f1: 0.5775
##################ITERATION #4 ****************************************
 epoch: 0, train_loss: 1.2625, test_loss: 1.3711, test_f1: 0.2526
 epoch: 1, train_loss: 1.1678, test_loss: 1.2841, test_f1: 0.2786
 epoch: 2, train_loss: 1.1429, test_loss: 1.2368, test_f1: 0.3152
 epoch: 3, train_loss: 1.1198, test_loss: 1.1921, test_f1: 0.3457
 epoch: 4, train_loss: 1.0998, test_loss: 1.1562, test_f1: 0.3393
 epoch: 5, train_loss: 1.0751, test_loss: 1.1359, test_f1: 0.3800
 epoch: 6, train_loss: 1.0655, test_loss: 1.1197, test_f1: 0.4021
 epoch: 7, train_loss: 1.0580, test_loss: 1.1127, test_f1: 0.4408
 epoch: 8, train_loss: 1.0443, test_loss: 1.1120, test_f1: 0.4305
 epoch: 9, train_loss: 1.0175, test_loss: 1.1040, test_f1: 0.4479
 epoch: 10, train_loss: 1.0087, test_loss: 1.0847, test_f1: 0.4772
 epoch: 11, train_loss: 1.0072, test_loss: 1.0884, test_f1: 0.4752
 epoch: 12, train_loss: 0.9928, test_loss: 1.0692, test_f1: 0.4905
 epoch: 13, train_loss: 0.9879, test_loss: 1.0825, test_f1: 0.4838
 epoch: 14, train_loss: 0.9865, test_loss: 1.0627, test_f1: 0.4777
 epoch: 15, train_loss: 0.9660, test_loss: 1.0545, test_f1: 0.4907
 epoch: 16, train_loss: 0.9740, test_loss: 1.0574, test_f1: 0.4867
 epoch: 17, train_loss: 0.9512, test_loss: 1.0505, test_f1: 0.4910
 epoch: 18, train_loss: 0.9382, test_loss: 1.0579, test_f1: 0.4827
 epoch: 19, train_loss: 0.9435, test_loss: 1.0605, test_f1: 0.5000
 epoch: 20, train_loss: 0.9363, test_loss: 1.0603, test_f1: 0.4808
 epoch: 21, train_loss: 0.9412, test_loss: 1.0704, test_f1: 0.4948
 epoch: 22, train_loss: 0.9168, test_loss: 1.0516, test_f1: 0.4982
 epoch: 23, train_loss: 0.9181, test_loss: 1.0716, test_f1: 0.5038
 epoch: 24, train_loss: 0.9117, test_loss: 1.0588, test_f1: 0.5153
 epoch: 25, train_loss: 0.9043, test_loss: 1.0576, test_f1: 0.5002
 epoch: 26, train_loss: 0.9059, test_loss: 1.0438, test_f1: 0.4943
 epoch: 27, train_loss: 0.8967, test_loss: 1.0411, test_f1: 0.5204
 epoch: 28, train_loss: 0.9070, test_loss: 1.0475, test_f1: 0.5048
 epoch: 29, train_loss: 0.9010, test_loss: 1.0279, test_f1: 0.5224
 epoch: 30, train_loss: 0.8827, test_loss: 1.0242, test_f1: 0.5100
 epoch: 31, train_loss: 0.8780, test_loss: 1.0274, test_f1: 0.5349
 epoch: 32, train_loss: 0.8702, test_loss: 1.0214, test_f1: 0.5492
 epoch: 33, train_loss: 0.8651, test_loss: 1.0357, test_f1: 0.5528
 epoch: 34, train_loss: 0.8662, test_loss: 1.0429, test_f1: 0.5481
 epoch: 35, train_loss: 0.8632, test_loss: 1.0742, test_f1: 0.5552
 epoch: 36, train_loss: 0.8576, test_loss: 1.0797, test_f1: 0.5479
 epoch: 37, train_loss: 0.8489, test_loss: 1.0427, test_f1: 0.5559
 epoch: 38, train_loss: 0.8570, test_loss: 1.0349, test_f1: 0.5529
 epoch: 39, train_loss: 0.8396, test_loss: 1.0491, test_f1: 0.5581
 epoch: 40, train_loss: 0.8389, test_loss: 1.0305, test_f1: 0.5611
 epoch: 41, train_loss: 0.8420, test_loss: 1.0308, test_f1: 0.5563
 epoch: 42, train_loss: 0.8294, test_loss: 1.0463, test_f1: 0.5372
 epoch: 43, train_loss: 0.8294, test_loss: 1.0849, test_f1: 0.5496
 epoch: 44, train_loss: 0.8298, test_loss: 1.0664, test_f1: 0.5586
 epoch: 45, train_loss: 0.8223, test_loss: 1.0731, test_f1: 0.5496
 epoch: 46, train_loss: 0.8220, test_loss: 1.0785, test_f1: 0.5492
 epoch: 47, train_loss: 0.8056, test_loss: 1.0449, test_f1: 0.5643
 epoch: 48, train_loss: 0.8040, test_loss: 1.1359, test_f1: 0.5361
 epoch: 49, train_loss: 0.8002, test_loss: 1.1102, test_f1: 0.5533
 epoch: 50, train_loss: 0.7984, test_loss: 1.1380, test_f1: 0.5583
 epoch: 51, train_loss: 0.8000, test_loss: 1.1461, test_f1: 0.5492
 epoch: 52, train_loss: 0.7904, test_loss: 1.1309, test_f1: 0.5728
 epoch: 53, train_loss: 0.7846, test_loss: 1.1344, test_f1: 0.5706
 epoch: 54, train_loss: 0.7744, test_loss: 1.1504, test_f1: 0.5539
 epoch: 55, train_loss: 0.7758, test_loss: 1.1392, test_f1: 0.5613
 epoch: 56, train_loss: 0.7790, test_loss: 1.1696, test_f1: 0.5537
 epoch: 57, train_loss: 0.7715, test_loss: 1.1549, test_f1: 0.5724
 epoch: 58, train_loss: 0.7744, test_loss: 1.1622, test_f1: 0.5628
 epoch: 59, train_loss: 0.7562, test_loss: 1.1525, test_f1: 0.5511
 epoch: 60, train_loss: 0.7712, test_loss: 1.1531, test_f1: 0.5679
 epoch: 61, train_loss: 0.7730, test_loss: 1.1417, test_f1: 0.5700
 epoch: 62, train_loss: 0.7612, test_loss: 1.1088, test_f1: 0.5666
 epoch: 63, train_loss: 0.7763, test_loss: 1.1480, test_f1: 0.5619
 epoch: 64, train_loss: 0.7618, test_loss: 1.1586, test_f1: 0.5700
 epoch: 65, train_loss: 0.7653, test_loss: 1.1589, test_f1: 0.5568
 epoch: 66, train_loss: 0.7727, test_loss: 1.1532, test_f1: 0.5558
 epoch: 67, train_loss: 0.7467, test_loss: 1.1749, test_f1: 0.5535
 epoch: 68, train_loss: 0.7560, test_loss: 1.1800, test_f1: 0.5545
 epoch: 69, train_loss: 0.7502, test_loss: 1.1802, test_f1: 0.5690
 epoch: 70, train_loss: 0.7509, test_loss: 1.1820, test_f1: 0.5707
 epoch: 71, train_loss: 0.7475, test_loss: 1.1787, test_f1: 0.5719
 epoch: 72, train_loss: 0.7436, test_loss: 1.1773, test_f1: 0.5857
 epoch: 73, train_loss: 0.7468, test_loss: 1.1674, test_f1: 0.5800
 epoch: 74, train_loss: 0.7423, test_loss: 1.1942, test_f1: 0.5677
 epoch: 75, train_loss: 0.7431, test_loss: 1.1755, test_f1: 0.5829
 epoch: 76, train_loss: 0.7409, test_loss: 1.1627, test_f1: 0.5561
 epoch: 77, train_loss: 0.7495, test_loss: 1.1417, test_f1: 0.5822
 epoch: 78, train_loss: 0.7573, test_loss: 1.1864, test_f1: 0.5708
 epoch: 79, train_loss: 0.7406, test_loss: 1.1774, test_f1: 0.5749
 epoch: 80, train_loss: 0.7373, test_loss: 1.2016, test_f1: 0.5741
 epoch: 81, train_loss: 0.7381, test_loss: 1.1857, test_f1: 0.5852
 epoch: 82, train_loss: 0.7395, test_loss: 1.2150, test_f1: 0.5602
 epoch: 83, train_loss: 0.7365, test_loss: 1.1900, test_f1: 0.5590
 epoch: 84, train_loss: 0.7397, test_loss: 1.2525, test_f1: 0.5876
 epoch: 85, train_loss: 0.7382, test_loss: 1.2304, test_f1: 0.5564
 epoch: 86, train_loss: 0.7255, test_loss: 1.2702, test_f1: 0.5468
 epoch: 87, train_loss: 0.7149, test_loss: 1.2168, test_f1: 0.5684
 epoch: 88, train_loss: 0.7234, test_loss: 1.2370, test_f1: 0.5509
 epoch: 89, train_loss: 0.7296, test_loss: 1.2390, test_f1: 0.5435
 epoch: 90, train_loss: 0.7245, test_loss: 1.2515, test_f1: 0.5643
 epoch: 91, train_loss: 0.7301, test_loss: 1.2578, test_f1: 0.5766
 epoch: 92, train_loss: 0.7298, test_loss: 1.2467, test_f1: 0.5681
 epoch: 93, train_loss: 0.7254, test_loss: 1.2419, test_f1: 0.5721
 epoch: 94, train_loss: 0.7072, test_loss: 1.2452, test_f1: 0.5663
 epoch: 95, train_loss: 0.7282, test_loss: 1.2599, test_f1: 0.5485
 epoch: 96, train_loss: 0.7336, test_loss: 1.2380, test_f1: 0.5523
 epoch: 97, train_loss: 0.7109, test_loss: 1.2208, test_f1: 0.5650
 epoch: 98, train_loss: 0.7144, test_loss: 1.2393, test_f1: 0.5550
 epoch: 99, train_loss: 0.7121, test_loss: 1.2973, test_f1: 0.5460
##################ITERATION #5 ****************************************
 epoch: 0, train_loss: 1.2192, test_loss: 1.3088, test_f1: 0.2281
 epoch: 1, train_loss: 1.1516, test_loss: 1.2730, test_f1: 0.2828
 epoch: 2, train_loss: 1.1202, test_loss: 1.2467, test_f1: 0.3569
 epoch: 3, train_loss: 1.1117, test_loss: 1.1676, test_f1: 0.4092
 epoch: 4, train_loss: 1.0747, test_loss: 1.1576, test_f1: 0.4327
 epoch: 5, train_loss: 1.0697, test_loss: 1.1428, test_f1: 0.4331
 epoch: 6, train_loss: 1.0739, test_loss: 1.1337, test_f1: 0.4377
 epoch: 7, train_loss: 1.0432, test_loss: 1.1242, test_f1: 0.4430
 epoch: 8, train_loss: 1.0361, test_loss: 1.1062, test_f1: 0.4478
 epoch: 9, train_loss: 1.0301, test_loss: 1.0974, test_f1: 0.4892
 epoch: 10, train_loss: 1.0211, test_loss: 1.0982, test_f1: 0.4948
 epoch: 11, train_loss: 1.0013, test_loss: 1.0963, test_f1: 0.4947
 epoch: 12, train_loss: 0.9982, test_loss: 1.0800, test_f1: 0.4843
 epoch: 13, train_loss: 1.0005, test_loss: 1.0745, test_f1: 0.4994
 epoch: 14, train_loss: 0.9834, test_loss: 1.0723, test_f1: 0.5050
 epoch: 15, train_loss: 0.9586, test_loss: 1.0731, test_f1: 0.5017
 epoch: 16, train_loss: 0.9652, test_loss: 1.0786, test_f1: 0.4967
 epoch: 17, train_loss: 0.9629, test_loss: 1.0792, test_f1: 0.5176
 epoch: 18, train_loss: 0.9508, test_loss: 1.0661, test_f1: 0.5125
 epoch: 19, train_loss: 0.9505, test_loss: 1.0734, test_f1: 0.5212
 epoch: 20, train_loss: 0.9426, test_loss: 1.0761, test_f1: 0.5107
 epoch: 21, train_loss: 0.9464, test_loss: 1.0874, test_f1: 0.5163
 epoch: 22, train_loss: 0.9413, test_loss: 1.0858, test_f1: 0.5266
 epoch: 23, train_loss: 0.9322, test_loss: 1.0722, test_f1: 0.5381
 epoch: 24, train_loss: 0.9305, test_loss: 1.0781, test_f1: 0.5244
 epoch: 25, train_loss: 0.9166, test_loss: 1.0608, test_f1: 0.5258
 epoch: 26, train_loss: 0.9146, test_loss: 1.0729, test_f1: 0.5297
 epoch: 27, train_loss: 0.9073, test_loss: 1.0736, test_f1: 0.5265
 epoch: 28, train_loss: 0.9061, test_loss: 1.0917, test_f1: 0.5383
 epoch: 29, train_loss: 0.9040, test_loss: 1.0535, test_f1: 0.5185
 epoch: 30, train_loss: 0.8944, test_loss: 1.0567, test_f1: 0.5223
 epoch: 31, train_loss: 0.8852, test_loss: 1.0458, test_f1: 0.5243
 epoch: 32, train_loss: 0.8780, test_loss: 1.0627, test_f1: 0.5470
 epoch: 33, train_loss: 0.8877, test_loss: 1.0629, test_f1: 0.5377
 epoch: 34, train_loss: 0.8702, test_loss: 1.0450, test_f1: 0.5477
 epoch: 35, train_loss: 0.8683, test_loss: 1.0834, test_f1: 0.5416
 epoch: 36, train_loss: 0.8654, test_loss: 1.0536, test_f1: 0.5627
 epoch: 37, train_loss: 0.8808, test_loss: 1.0452, test_f1: 0.5564
 epoch: 38, train_loss: 0.8578, test_loss: 1.0575, test_f1: 0.5470
 epoch: 39, train_loss: 0.8629, test_loss: 1.0406, test_f1: 0.5746
 epoch: 40, train_loss: 0.8564, test_loss: 1.0569, test_f1: 0.5484
 epoch: 41, train_loss: 0.8422, test_loss: 1.0389, test_f1: 0.5712
 epoch: 42, train_loss: 0.8419, test_loss: 1.0377, test_f1: 0.5602
 epoch: 43, train_loss: 0.8428, test_loss: 1.0440, test_f1: 0.5504
 epoch: 44, train_loss: 0.8520, test_loss: 1.0339, test_f1: 0.5727
 epoch: 45, train_loss: 0.8268, test_loss: 1.0487, test_f1: 0.5648
 epoch: 46, train_loss: 0.8353, test_loss: 1.0800, test_f1: 0.5676
 epoch: 47, train_loss: 0.8345, test_loss: 1.0348, test_f1: 0.5676
 epoch: 48, train_loss: 0.8444, test_loss: 1.0376, test_f1: 0.5841
 epoch: 49, train_loss: 0.8232, test_loss: 1.0655, test_f1: 0.5575
 epoch: 50, train_loss: 0.8317, test_loss: 1.0380, test_f1: 0.5641
 epoch: 51, train_loss: 0.8262, test_loss: 1.0451, test_f1: 0.5591
 epoch: 52, train_loss: 0.8185, test_loss: 1.0521, test_f1: 0.5622
 epoch: 53, train_loss: 0.8168, test_loss: 1.0285, test_f1: 0.5699
 epoch: 54, train_loss: 0.8071, test_loss: 1.0361, test_f1: 0.5585
 epoch: 55, train_loss: 0.8159, test_loss: 1.0356, test_f1: 0.5675
 epoch: 56, train_loss: 0.8037, test_loss: 1.0427, test_f1: 0.5598
 epoch: 57, train_loss: 0.7990, test_loss: 1.0344, test_f1: 0.5641
 epoch: 58, train_loss: 0.8002, test_loss: 1.0351, test_f1: 0.5568
 epoch: 59, train_loss: 0.7953, test_loss: 1.0510, test_f1: 0.5676
 epoch: 60, train_loss: 0.7872, test_loss: 1.0487, test_f1: 0.5572
 epoch: 61, train_loss: 0.7879, test_loss: 1.0439, test_f1: 0.5706
 epoch: 62, train_loss: 0.7933, test_loss: 1.0365, test_f1: 0.5776
 epoch: 63, train_loss: 0.7821, test_loss: 1.0624, test_f1: 0.5593
 epoch: 64, train_loss: 0.7811, test_loss: 1.0362, test_f1: 0.5773
 epoch: 65, train_loss: 0.7955, test_loss: 1.0520, test_f1: 0.5811
 epoch: 66, train_loss: 0.7920, test_loss: 1.0492, test_f1: 0.5630
 epoch: 67, train_loss: 0.7939, test_loss: 1.0394, test_f1: 0.5787
 epoch: 68, train_loss: 0.7790, test_loss: 1.0580, test_f1: 0.5688
 epoch: 69, train_loss: 0.7891, test_loss: 1.0679, test_f1: 0.5772
 epoch: 70, train_loss: 0.7806, test_loss: 1.0563, test_f1: 0.5713
 epoch: 71, train_loss: 0.7739, test_loss: 1.0648, test_f1: 0.5713
 epoch: 72, train_loss: 0.7718, test_loss: 1.0653, test_f1: 0.5579
 epoch: 73, train_loss: 0.7840, test_loss: 1.0561, test_f1: 0.5605
 epoch: 74, train_loss: 0.7809, test_loss: 1.0630, test_f1: 0.5691
 epoch: 75, train_loss: 0.7843, test_loss: 1.0580, test_f1: 0.5714
 epoch: 76, train_loss: 0.7618, test_loss: 1.0530, test_f1: 0.5624
 epoch: 77, train_loss: 0.7721, test_loss: 1.0474, test_f1: 0.5657
 epoch: 78, train_loss: 0.7634, test_loss: 1.0297, test_f1: 0.5596
 epoch: 79, train_loss: 0.7617, test_loss: 1.0728, test_f1: 0.5634
 epoch: 80, train_loss: 0.7712, test_loss: 1.0678, test_f1: 0.5742
 epoch: 81, train_loss: 0.7732, test_loss: 1.0731, test_f1: 0.5719
 epoch: 82, train_loss: 0.7800, test_loss: 1.0608, test_f1: 0.5693
 epoch: 83, train_loss: 0.7555, test_loss: 1.0862, test_f1: 0.5771
 epoch: 84, train_loss: 0.7682, test_loss: 1.0696, test_f1: 0.5848
 epoch: 85, train_loss: 0.7614, test_loss: 1.0484, test_f1: 0.5860
 epoch: 86, train_loss: 0.7538, test_loss: 1.0519, test_f1: 0.5830
 epoch: 87, train_loss: 0.7583, test_loss: 1.0545, test_f1: 0.5795
 epoch: 88, train_loss: 0.7507, test_loss: 1.0867, test_f1: 0.5845
 epoch: 89, train_loss: 0.7575, test_loss: 1.0681, test_f1: 0.5873
 epoch: 90, train_loss: 0.7471, test_loss: 1.0770, test_f1: 0.5848
 epoch: 91, train_loss: 0.7308, test_loss: 1.0928, test_f1: 0.5715
 epoch: 92, train_loss: 0.7470, test_loss: 1.0727, test_f1: 0.5685
 epoch: 93, train_loss: 0.7626, test_loss: 1.0859, test_f1: 0.5709
 epoch: 94, train_loss: 0.7404, test_loss: 1.0726, test_f1: 0.5797
 epoch: 95, train_loss: 0.7400, test_loss: 1.0930, test_f1: 0.5731
 epoch: 96, train_loss: 0.7281, test_loss: 1.0804, test_f1: 0.5721
 epoch: 97, train_loss: 0.7406, test_loss: 1.0598, test_f1: 0.5739
 epoch: 98, train_loss: 0.7430, test_loss: 1.0757, test_f1: 0.5772
 epoch: 99, train_loss: 0.7394, test_loss: 1.0723, test_f1: 0.5726
##################ITERATION #6 ****************************************
 epoch: 0, train_loss: 1.2112, test_loss: 1.3221, test_f1: 0.2281
 epoch: 1, train_loss: 1.1451, test_loss: 1.3135, test_f1: 0.2503
 epoch: 2, train_loss: 1.1123, test_loss: 1.2042, test_f1: 0.3585
 epoch: 3, train_loss: 1.0909, test_loss: 1.1377, test_f1: 0.4131
 epoch: 4, train_loss: 1.0781, test_loss: 1.1296, test_f1: 0.4363
 epoch: 5, train_loss: 1.0594, test_loss: 1.1081, test_f1: 0.4540
 epoch: 6, train_loss: 1.0505, test_loss: 1.0965, test_f1: 0.4605
 epoch: 7, train_loss: 1.0436, test_loss: 1.0866, test_f1: 0.4896
 epoch: 8, train_loss: 1.0261, test_loss: 1.0829, test_f1: 0.5016
 epoch: 9, train_loss: 1.0190, test_loss: 1.0655, test_f1: 0.5120
 epoch: 10, train_loss: 1.0161, test_loss: 1.0765, test_f1: 0.5065
 epoch: 11, train_loss: 1.0040, test_loss: 1.0576, test_f1: 0.5243
 epoch: 12, train_loss: 0.9904, test_loss: 1.0750, test_f1: 0.5401
 epoch: 13, train_loss: 0.9873, test_loss: 1.0537, test_f1: 0.5416
 epoch: 14, train_loss: 0.9732, test_loss: 1.0370, test_f1: 0.5345
 epoch: 15, train_loss: 0.9643, test_loss: 1.0563, test_f1: 0.5517
 epoch: 16, train_loss: 0.9551, test_loss: 1.0512, test_f1: 0.5560
 epoch: 17, train_loss: 0.9567, test_loss: 1.0549, test_f1: 0.5395
 epoch: 18, train_loss: 0.9481, test_loss: 1.0434, test_f1: 0.5561
 epoch: 19, train_loss: 0.9335, test_loss: 1.0759, test_f1: 0.5544
 epoch: 20, train_loss: 0.9401, test_loss: 1.0528, test_f1: 0.5591
 epoch: 21, train_loss: 0.9211, test_loss: 1.0644, test_f1: 0.5472
 epoch: 22, train_loss: 0.9273, test_loss: 1.0522, test_f1: 0.5500
 epoch: 23, train_loss: 0.9214, test_loss: 1.0598, test_f1: 0.5499
 epoch: 24, train_loss: 0.9045, test_loss: 1.0488, test_f1: 0.5520
 epoch: 25, train_loss: 0.9012, test_loss: 1.0679, test_f1: 0.5515
 epoch: 26, train_loss: 0.9122, test_loss: 1.0727, test_f1: 0.5454
 epoch: 27, train_loss: 0.9046, test_loss: 1.0618, test_f1: 0.5447
 epoch: 28, train_loss: 0.8976, test_loss: 1.0436, test_f1: 0.5626
 epoch: 29, train_loss: 0.8903, test_loss: 1.0691, test_f1: 0.5644
 epoch: 30, train_loss: 0.8875, test_loss: 1.0930, test_f1: 0.5554
 epoch: 31, train_loss: 0.8915, test_loss: 1.0939, test_f1: 0.5580
 epoch: 32, train_loss: 0.8686, test_loss: 1.0954, test_f1: 0.5513
 epoch: 33, train_loss: 0.8698, test_loss: 1.0889, test_f1: 0.5569
 epoch: 34, train_loss: 0.8551, test_loss: 1.0755, test_f1: 0.5722
 epoch: 35, train_loss: 0.8683, test_loss: 1.0561, test_f1: 0.5780
 epoch: 36, train_loss: 0.8428, test_loss: 1.0869, test_f1: 0.5699
 epoch: 37, train_loss: 0.8551, test_loss: 1.1174, test_f1: 0.5718
 epoch: 38, train_loss: 0.8560, test_loss: 1.0738, test_f1: 0.5651
 epoch: 39, train_loss: 0.8417, test_loss: 1.1208, test_f1: 0.5609
 epoch: 40, train_loss: 0.8394, test_loss: 1.1133, test_f1: 0.5585
 epoch: 41, train_loss: 0.8269, test_loss: 1.1158, test_f1: 0.5754
 epoch: 42, train_loss: 0.8344, test_loss: 1.1013, test_f1: 0.5751
 epoch: 43, train_loss: 0.8132, test_loss: 1.1118, test_f1: 0.5876
 epoch: 44, train_loss: 0.8207, test_loss: 1.0836, test_f1: 0.6012
 epoch: 45, train_loss: 0.8273, test_loss: 1.0805, test_f1: 0.5859
 epoch: 46, train_loss: 0.8233, test_loss: 1.0855, test_f1: 0.5928
 epoch: 47, train_loss: 0.8082, test_loss: 1.0997, test_f1: 0.5714
 epoch: 48, train_loss: 0.8090, test_loss: 1.1390, test_f1: 0.5831
 epoch: 49, train_loss: 0.7982, test_loss: 1.1141, test_f1: 0.5837
 epoch: 50, train_loss: 0.7955, test_loss: 1.1115, test_f1: 0.5698
 epoch: 51, train_loss: 0.7806, test_loss: 1.1009, test_f1: 0.5841
 epoch: 52, train_loss: 0.7867, test_loss: 1.1176, test_f1: 0.5900
 epoch: 53, train_loss: 0.7863, test_loss: 1.1078, test_f1: 0.6088
 epoch: 54, train_loss: 0.7766, test_loss: 1.0991, test_f1: 0.5890
 epoch: 55, train_loss: 0.7815, test_loss: 1.1314, test_f1: 0.5861
 epoch: 56, train_loss: 0.7823, test_loss: 1.1308, test_f1: 0.5761
 epoch: 57, train_loss: 0.7868, test_loss: 1.1174, test_f1: 0.5944
 epoch: 58, train_loss: 0.7744, test_loss: 1.1012, test_f1: 0.5977
 epoch: 59, train_loss: 0.7653, test_loss: 1.1132, test_f1: 0.6091
 epoch: 60, train_loss: 0.7732, test_loss: 1.1269, test_f1: 0.5848
 epoch: 61, train_loss: 0.7629, test_loss: 1.1210, test_f1: 0.5867
 epoch: 62, train_loss: 0.7699, test_loss: 1.1160, test_f1: 0.5857
 epoch: 63, train_loss: 0.7679, test_loss: 1.1234, test_f1: 0.5843
 epoch: 64, train_loss: 0.7703, test_loss: 1.1366, test_f1: 0.5756
 epoch: 65, train_loss: 0.7766, test_loss: 1.1279, test_f1: 0.5801
 epoch: 66, train_loss: 0.7619, test_loss: 1.1660, test_f1: 0.5695
 epoch: 67, train_loss: 0.7732, test_loss: 1.1532, test_f1: 0.5796
 epoch: 68, train_loss: 0.7577, test_loss: 1.1620, test_f1: 0.5770
 epoch: 69, train_loss: 0.7652, test_loss: 1.1654, test_f1: 0.5789
 epoch: 70, train_loss: 0.7725, test_loss: 1.1419, test_f1: 0.5883
 epoch: 71, train_loss: 0.7537, test_loss: 1.1511, test_f1: 0.5931
 epoch: 72, train_loss: 0.7469, test_loss: 1.1826, test_f1: 0.5857
 epoch: 73, train_loss: 0.7507, test_loss: 1.1563, test_f1: 0.5844
 epoch: 74, train_loss: 0.7565, test_loss: 1.1826, test_f1: 0.5909
 epoch: 75, train_loss: 0.7588, test_loss: 1.1631, test_f1: 0.6023
 epoch: 76, train_loss: 0.7408, test_loss: 1.1713, test_f1: 0.6032
 epoch: 77, train_loss: 0.7519, test_loss: 1.2097, test_f1: 0.5848
 epoch: 78, train_loss: 0.7405, test_loss: 1.1763, test_f1: 0.5985
 epoch: 79, train_loss: 0.7304, test_loss: 1.2030, test_f1: 0.5916
 epoch: 80, train_loss: 0.7350, test_loss: 1.2294, test_f1: 0.5838
 epoch: 81, train_loss: 0.7336, test_loss: 1.2069, test_f1: 0.5842
 epoch: 82, train_loss: 0.7333, test_loss: 1.1964, test_f1: 0.5736
 epoch: 83, train_loss: 0.7494, test_loss: 1.1714, test_f1: 0.5932
 epoch: 84, train_loss: 0.7428, test_loss: 1.1995, test_f1: 0.5771
 epoch: 85, train_loss: 0.7381, test_loss: 1.2220, test_f1: 0.5905
 epoch: 86, train_loss: 0.7276, test_loss: 1.2318, test_f1: 0.5891
 epoch: 87, train_loss: 0.7268, test_loss: 1.2035, test_f1: 0.5910
 epoch: 88, train_loss: 0.7237, test_loss: 1.2262, test_f1: 0.5822
 epoch: 89, train_loss: 0.7263, test_loss: 1.2313, test_f1: 0.5831
 epoch: 90, train_loss: 0.7322, test_loss: 1.1754, test_f1: 0.5963
 epoch: 91, train_loss: 0.7284, test_loss: 1.1980, test_f1: 0.5925
 epoch: 92, train_loss: 0.7262, test_loss: 1.1837, test_f1: 0.5950
 epoch: 93, train_loss: 0.7211, test_loss: 1.2183, test_f1: 0.5862
 epoch: 94, train_loss: 0.7282, test_loss: 1.2005, test_f1: 0.5885
 epoch: 95, train_loss: 0.7082, test_loss: 1.2088, test_f1: 0.5949
 epoch: 96, train_loss: 0.7075, test_loss: 1.2269, test_f1: 0.5801
 epoch: 97, train_loss: 0.7130, test_loss: 1.2427, test_f1: 0.5977
 epoch: 98, train_loss: 0.7110, test_loss: 1.2375, test_f1: 0.5873
 epoch: 99, train_loss: 0.7047, test_loss: 1.2799, test_f1: 0.5878
##################ITERATION #7 ****************************************
 epoch: 0, train_loss: 1.2312, test_loss: 1.3570, test_f1: 0.2389
 epoch: 1, train_loss: 1.1375, test_loss: 1.2521, test_f1: 0.3458
 epoch: 2, train_loss: 1.1173, test_loss: 1.2308, test_f1: 0.3696
 epoch: 3, train_loss: 1.0847, test_loss: 1.1548, test_f1: 0.4264
 epoch: 4, train_loss: 1.0765, test_loss: 1.1440, test_f1: 0.4607
 epoch: 5, train_loss: 1.0602, test_loss: 1.1261, test_f1: 0.4438
 epoch: 6, train_loss: 1.0441, test_loss: 1.1205, test_f1: 0.4193
 epoch: 7, train_loss: 1.0315, test_loss: 1.0978, test_f1: 0.5044
 epoch: 8, train_loss: 1.0208, test_loss: 1.0953, test_f1: 0.4820
 epoch: 9, train_loss: 1.0126, test_loss: 1.0981, test_f1: 0.4481
 epoch: 10, train_loss: 0.9993, test_loss: 1.0923, test_f1: 0.4704
 epoch: 11, train_loss: 1.0026, test_loss: 1.0839, test_f1: 0.4682
 epoch: 12, train_loss: 0.9894, test_loss: 1.0804, test_f1: 0.4823
 epoch: 13, train_loss: 0.9824, test_loss: 1.0796, test_f1: 0.4855
 epoch: 14, train_loss: 0.9523, test_loss: 1.0870, test_f1: 0.4788
 epoch: 15, train_loss: 0.9722, test_loss: 1.0947, test_f1: 0.5072
 epoch: 16, train_loss: 0.9564, test_loss: 1.0884, test_f1: 0.4867
 epoch: 17, train_loss: 0.9536, test_loss: 1.0864, test_f1: 0.5082
 epoch: 18, train_loss: 0.9616, test_loss: 1.0867, test_f1: 0.5198
 epoch: 19, train_loss: 0.9274, test_loss: 1.0749, test_f1: 0.5211
 epoch: 20, train_loss: 0.9273, test_loss: 1.0714, test_f1: 0.5195
 epoch: 21, train_loss: 0.9313, test_loss: 1.0732, test_f1: 0.5270
 epoch: 22, train_loss: 0.9192, test_loss: 1.0556, test_f1: 0.5311
 epoch: 23, train_loss: 0.9247, test_loss: 1.0800, test_f1: 0.5202
 epoch: 24, train_loss: 0.9080, test_loss: 1.0774, test_f1: 0.5190
 epoch: 25, train_loss: 0.9030, test_loss: 1.0685, test_f1: 0.5234
 epoch: 26, train_loss: 0.8943, test_loss: 1.0736, test_f1: 0.5071
 epoch: 27, train_loss: 0.8955, test_loss: 1.0542, test_f1: 0.5342
 epoch: 28, train_loss: 0.8920, test_loss: 1.0939, test_f1: 0.5297
 epoch: 29, train_loss: 0.8932, test_loss: 1.0709, test_f1: 0.5274
 epoch: 30, train_loss: 0.8942, test_loss: 1.0650, test_f1: 0.5363
 epoch: 31, train_loss: 0.8723, test_loss: 1.0737, test_f1: 0.5349
 epoch: 32, train_loss: 0.8775, test_loss: 1.0716, test_f1: 0.5416
 epoch: 33, train_loss: 0.8821, test_loss: 1.0665, test_f1: 0.5420
 epoch: 34, train_loss: 0.8693, test_loss: 1.0637, test_f1: 0.5690
 epoch: 35, train_loss: 0.8609, test_loss: 1.0807, test_f1: 0.5687
 epoch: 36, train_loss: 0.8577, test_loss: 1.0871, test_f1: 0.5522
 epoch: 37, train_loss: 0.8705, test_loss: 1.1021, test_f1: 0.5554
 epoch: 38, train_loss: 0.8682, test_loss: 1.0728, test_f1: 0.5649
 epoch: 39, train_loss: 0.8640, test_loss: 1.0698, test_f1: 0.5453
 epoch: 40, train_loss: 0.8426, test_loss: 1.0501, test_f1: 0.5815
 epoch: 41, train_loss: 0.8473, test_loss: 1.0778, test_f1: 0.5485
 epoch: 42, train_loss: 0.8282, test_loss: 1.0831, test_f1: 0.5714
 epoch: 43, train_loss: 0.8510, test_loss: 1.0766, test_f1: 0.5702
 epoch: 44, train_loss: 0.8333, test_loss: 1.0802, test_f1: 0.5707
 epoch: 45, train_loss: 0.8396, test_loss: 1.0845, test_f1: 0.5748
 epoch: 46, train_loss: 0.8291, test_loss: 1.0825, test_f1: 0.5581
 epoch: 47, train_loss: 0.8297, test_loss: 1.1023, test_f1: 0.5607
 epoch: 48, train_loss: 0.8389, test_loss: 1.1324, test_f1: 0.5553
 epoch: 49, train_loss: 0.8321, test_loss: 1.0896, test_f1: 0.5631
 epoch: 50, train_loss: 0.8240, test_loss: 1.0882, test_f1: 0.5570
 epoch: 51, train_loss: 0.8253, test_loss: 1.0832, test_f1: 0.5607
 epoch: 52, train_loss: 0.8194, test_loss: 1.0841, test_f1: 0.5949
 epoch: 53, train_loss: 0.8075, test_loss: 1.0781, test_f1: 0.5800
 epoch: 54, train_loss: 0.8121, test_loss: 1.1016, test_f1: 0.5705
 epoch: 55, train_loss: 0.8076, test_loss: 1.0895, test_f1: 0.5722
 epoch: 56, train_loss: 0.8032, test_loss: 1.0878, test_f1: 0.5710
 epoch: 57, train_loss: 0.8033, test_loss: 1.0966, test_f1: 0.5611
 epoch: 58, train_loss: 0.7927, test_loss: 1.1040, test_f1: 0.5603
 epoch: 59, train_loss: 0.8111, test_loss: 1.0993, test_f1: 0.5547
 epoch: 60, train_loss: 0.7928, test_loss: 1.1056, test_f1: 0.5670
 epoch: 61, train_loss: 0.7910, test_loss: 1.1008, test_f1: 0.5716
 epoch: 62, train_loss: 0.7938, test_loss: 1.0973, test_f1: 0.5701
 epoch: 63, train_loss: 0.7790, test_loss: 1.0889, test_f1: 0.5811
 epoch: 64, train_loss: 0.7848, test_loss: 1.1066, test_f1: 0.5655
 epoch: 65, train_loss: 0.7841, test_loss: 1.1023, test_f1: 0.5645
 epoch: 66, train_loss: 0.7981, test_loss: 1.1107, test_f1: 0.5728
 epoch: 67, train_loss: 0.7937, test_loss: 1.1221, test_f1: 0.5688
 epoch: 68, train_loss: 0.7851, test_loss: 1.1217, test_f1: 0.5680
 epoch: 69, train_loss: 0.7852, test_loss: 1.1295, test_f1: 0.5712
 epoch: 70, train_loss: 0.7774, test_loss: 1.1126, test_f1: 0.5796
 epoch: 71, train_loss: 0.7768, test_loss: 1.1052, test_f1: 0.5788
 epoch: 72, train_loss: 0.7711, test_loss: 1.1199, test_f1: 0.5752
 epoch: 73, train_loss: 0.7757, test_loss: 1.1006, test_f1: 0.5742
 epoch: 74, train_loss: 0.7691, test_loss: 1.1280, test_f1: 0.5678
 epoch: 75, train_loss: 0.7806, test_loss: 1.1003, test_f1: 0.5817
 epoch: 76, train_loss: 0.7753, test_loss: 1.1056, test_f1: 0.5645
 epoch: 77, train_loss: 0.7494, test_loss: 1.1394, test_f1: 0.5683
 epoch: 78, train_loss: 0.7706, test_loss: 1.1393, test_f1: 0.5638
 epoch: 79, train_loss: 0.7650, test_loss: 1.1386, test_f1: 0.5761
 epoch: 80, train_loss: 0.7595, test_loss: 1.1307, test_f1: 0.5709
 epoch: 81, train_loss: 0.7620, test_loss: 1.1327, test_f1: 0.5628
 epoch: 82, train_loss: 0.7390, test_loss: 1.1473, test_f1: 0.5831
 epoch: 83, train_loss: 0.7663, test_loss: 1.1614, test_f1: 0.5599
 epoch: 84, train_loss: 0.7700, test_loss: 1.1454, test_f1: 0.5771
 epoch: 85, train_loss: 0.7679, test_loss: 1.1542, test_f1: 0.5846
 epoch: 86, train_loss: 0.7744, test_loss: 1.1378, test_f1: 0.5855
 epoch: 87, train_loss: 0.7619, test_loss: 1.1535, test_f1: 0.5664
 epoch: 88, train_loss: 0.7465, test_loss: 1.1620, test_f1: 0.5566
 epoch: 89, train_loss: 0.7485, test_loss: 1.1442, test_f1: 0.5750
 epoch: 90, train_loss: 0.7505, test_loss: 1.1251, test_f1: 0.5782
 epoch: 91, train_loss: 0.7557, test_loss: 1.1407, test_f1: 0.5676
 epoch: 92, train_loss: 0.7255, test_loss: 1.1365, test_f1: 0.5649
 epoch: 93, train_loss: 0.7450, test_loss: 1.1606, test_f1: 0.5766
 epoch: 94, train_loss: 0.7524, test_loss: 1.1522, test_f1: 0.5806
 epoch: 95, train_loss: 0.7379, test_loss: 1.1539, test_f1: 0.5568
 epoch: 96, train_loss: 0.7310, test_loss: 1.1660, test_f1: 0.5923
 epoch: 97, train_loss: 0.7479, test_loss: 1.1479, test_f1: 0.5910
 epoch: 98, train_loss: 0.7505, test_loss: 1.1673, test_f1: 0.5745
 epoch: 99, train_loss: 0.7311, test_loss: 1.1576, test_f1: 0.5791
##################ITERATION #8 ****************************************
 epoch: 0, train_loss: 1.2392, test_loss: 1.3353, test_f1: 0.2681
 epoch: 1, train_loss: 1.1491, test_loss: 1.2708, test_f1: 0.2903
 epoch: 2, train_loss: 1.1262, test_loss: 1.2020, test_f1: 0.4362
 epoch: 3, train_loss: 1.1196, test_loss: 1.1702, test_f1: 0.4620
 epoch: 4, train_loss: 1.0982, test_loss: 1.1623, test_f1: 0.4737
 epoch: 5, train_loss: 1.0782, test_loss: 1.1455, test_f1: 0.4946
 epoch: 6, train_loss: 1.0662, test_loss: 1.1349, test_f1: 0.5154
 epoch: 7, train_loss: 1.0533, test_loss: 1.1449, test_f1: 0.5020
 epoch: 8, train_loss: 1.0476, test_loss: 1.1469, test_f1: 0.4900
 epoch: 9, train_loss: 1.0313, test_loss: 1.1378, test_f1: 0.5041
 epoch: 10, train_loss: 1.0266, test_loss: 1.1224, test_f1: 0.5137
 epoch: 11, train_loss: 1.0111, test_loss: 1.1601, test_f1: 0.5206
 epoch: 12, train_loss: 0.9999, test_loss: 1.1196, test_f1: 0.5183
 epoch: 13, train_loss: 1.0073, test_loss: 1.1141, test_f1: 0.5242
 epoch: 14, train_loss: 0.9915, test_loss: 1.0989, test_f1: 0.5211
 epoch: 15, train_loss: 1.0041, test_loss: 1.1085, test_f1: 0.5321
 epoch: 16, train_loss: 0.9727, test_loss: 1.1033, test_f1: 0.5112
 epoch: 17, train_loss: 0.9683, test_loss: 1.0786, test_f1: 0.5330
 epoch: 18, train_loss: 0.9693, test_loss: 1.0840, test_f1: 0.5257
 epoch: 19, train_loss: 0.9484, test_loss: 1.0810, test_f1: 0.5537
 epoch: 20, train_loss: 0.9524, test_loss: 1.1168, test_f1: 0.5333
 epoch: 21, train_loss: 0.9556, test_loss: 1.1649, test_f1: 0.5399
 epoch: 22, train_loss: 0.9265, test_loss: 1.1665, test_f1: 0.5384
 epoch: 23, train_loss: 0.9369, test_loss: 1.1696, test_f1: 0.5520
 epoch: 24, train_loss: 0.9345, test_loss: 1.1569, test_f1: 0.5368
 epoch: 25, train_loss: 0.9312, test_loss: 1.1178, test_f1: 0.5616
 epoch: 26, train_loss: 0.9214, test_loss: 1.1142, test_f1: 0.5510
 epoch: 27, train_loss: 0.9227, test_loss: 1.0587, test_f1: 0.5636
 epoch: 28, train_loss: 0.9167, test_loss: 1.0738, test_f1: 0.5603
 epoch: 29, train_loss: 0.9089, test_loss: 1.0879, test_f1: 0.5653
 epoch: 30, train_loss: 0.8925, test_loss: 1.1320, test_f1: 0.5672
 epoch: 31, train_loss: 0.9038, test_loss: 1.0828, test_f1: 0.5791
 epoch: 32, train_loss: 0.9031, test_loss: 1.0718, test_f1: 0.5632
 epoch: 33, train_loss: 0.8888, test_loss: 1.1004, test_f1: 0.5922
 epoch: 34, train_loss: 0.8872, test_loss: 1.1048, test_f1: 0.5785
 epoch: 35, train_loss: 0.8851, test_loss: 1.1368, test_f1: 0.5564
 epoch: 36, train_loss: 0.8835, test_loss: 1.0940, test_f1: 0.5804
 epoch: 37, train_loss: 0.8647, test_loss: 1.1085, test_f1: 0.5820
 epoch: 38, train_loss: 0.8748, test_loss: 1.0893, test_f1: 0.5811
 epoch: 39, train_loss: 0.8637, test_loss: 1.0756, test_f1: 0.5755
 epoch: 40, train_loss: 0.8710, test_loss: 1.0515, test_f1: 0.5944
 epoch: 41, train_loss: 0.8916, test_loss: 1.1025, test_f1: 0.5800
 epoch: 42, train_loss: 0.8424, test_loss: 1.0847, test_f1: 0.6106
 epoch: 43, train_loss: 0.8594, test_loss: 1.1241, test_f1: 0.5632
 epoch: 44, train_loss: 0.8452, test_loss: 1.1156, test_f1: 0.5962
 epoch: 45, train_loss: 0.8388, test_loss: 1.1257, test_f1: 0.5856
 epoch: 46, train_loss: 0.8405, test_loss: 1.1179, test_f1: 0.6062
 epoch: 47, train_loss: 0.8420, test_loss: 1.1661, test_f1: 0.5720
 epoch: 48, train_loss: 0.8385, test_loss: 1.0901, test_f1: 0.6022
 epoch: 49, train_loss: 0.8415, test_loss: 1.0939, test_f1: 0.6032
 epoch: 50, train_loss: 0.8414, test_loss: 1.0825, test_f1: 0.5974
 epoch: 51, train_loss: 0.8226, test_loss: 1.0827, test_f1: 0.6019
 epoch: 52, train_loss: 0.8123, test_loss: 1.1157, test_f1: 0.5963
 epoch: 53, train_loss: 0.8202, test_loss: 1.1081, test_f1: 0.5918
 epoch: 54, train_loss: 0.8106, test_loss: 1.1221, test_f1: 0.5884
 epoch: 55, train_loss: 0.8091, test_loss: 1.1293, test_f1: 0.5859
 epoch: 56, train_loss: 0.8096, test_loss: 1.1165, test_f1: 0.5809
 epoch: 57, train_loss: 0.8154, test_loss: 1.1653, test_f1: 0.5807
 epoch: 58, train_loss: 0.8178, test_loss: 1.1337, test_f1: 0.5810
 epoch: 59, train_loss: 0.8024, test_loss: 1.1469, test_f1: 0.5913
 epoch: 60, train_loss: 0.8091, test_loss: 1.1363, test_f1: 0.6075
 epoch: 61, train_loss: 0.8078, test_loss: 1.1261, test_f1: 0.5772
 epoch: 62, train_loss: 0.8001, test_loss: 1.1195, test_f1: 0.5885
 epoch: 63, train_loss: 0.7909, test_loss: 1.1336, test_f1: 0.5962
 epoch: 64, train_loss: 0.7976, test_loss: 1.1183, test_f1: 0.5952
 epoch: 65, train_loss: 0.7969, test_loss: 1.1269, test_f1: 0.5917
 epoch: 66, train_loss: 0.7842, test_loss: 1.1338, test_f1: 0.5939
 epoch: 67, train_loss: 0.7944, test_loss: 1.1074, test_f1: 0.6006
 epoch: 68, train_loss: 0.7849, test_loss: 1.1485, test_f1: 0.6048
 epoch: 69, train_loss: 0.7909, test_loss: 1.1012, test_f1: 0.5958
 epoch: 70, train_loss: 0.7853, test_loss: 1.0831, test_f1: 0.6118
 epoch: 71, train_loss: 0.7890, test_loss: 1.1071, test_f1: 0.6005
 epoch: 72, train_loss: 0.7862, test_loss: 1.1252, test_f1: 0.5919
 epoch: 73, train_loss: 0.7823, test_loss: 1.1273, test_f1: 0.5904
 epoch: 74, train_loss: 0.7966, test_loss: 1.1280, test_f1: 0.5859
 epoch: 75, train_loss: 0.7923, test_loss: 1.1112, test_f1: 0.5843
 epoch: 76, train_loss: 0.7739, test_loss: 1.1042, test_f1: 0.5991
 epoch: 77, train_loss: 0.7736, test_loss: 1.1237, test_f1: 0.5989
 epoch: 78, train_loss: 0.7724, test_loss: 1.0888, test_f1: 0.6129
 epoch: 79, train_loss: 0.7949, test_loss: 1.0847, test_f1: 0.6069
 epoch: 80, train_loss: 0.7733, test_loss: 1.1212, test_f1: 0.5888
 epoch: 81, train_loss: 0.7693, test_loss: 1.1207, test_f1: 0.5739
 epoch: 82, train_loss: 0.7853, test_loss: 1.1376, test_f1: 0.5761
 epoch: 83, train_loss: 0.7597, test_loss: 1.1236, test_f1: 0.5839
 epoch: 84, train_loss: 0.7778, test_loss: 1.1334, test_f1: 0.5910
 epoch: 85, train_loss: 0.7746, test_loss: 1.1342, test_f1: 0.5903
 epoch: 86, train_loss: 0.7708, test_loss: 1.1165, test_f1: 0.5966
 epoch: 87, train_loss: 0.7658, test_loss: 1.1151, test_f1: 0.6104
 epoch: 88, train_loss: 0.7722, test_loss: 1.1186, test_f1: 0.5747
 epoch: 89, train_loss: 0.7734, test_loss: 1.1358, test_f1: 0.5827
 epoch: 90, train_loss: 0.7549, test_loss: 1.1187, test_f1: 0.6021
 epoch: 91, train_loss: 0.7487, test_loss: 1.1481, test_f1: 0.5806
 epoch: 92, train_loss: 0.7527, test_loss: 1.1549, test_f1: 0.5944
 epoch: 93, train_loss: 0.7659, test_loss: 1.1399, test_f1: 0.5851
 epoch: 94, train_loss: 0.7606, test_loss: 1.1339, test_f1: 0.5963
 epoch: 95, train_loss: 0.7642, test_loss: 1.1257, test_f1: 0.5873
 epoch: 96, train_loss: 0.7648, test_loss: 1.1671, test_f1: 0.5801
 epoch: 97, train_loss: 0.7451, test_loss: 1.1416, test_f1: 0.5898
 epoch: 98, train_loss: 0.7460, test_loss: 1.1413, test_f1: 0.5826
 epoch: 99, train_loss: 0.7441, test_loss: 1.1348, test_f1: 0.5935
##################ITERATION #9 ****************************************
 epoch: 0, train_loss: 1.2435, test_loss: 1.2773, test_f1: 0.2281
 epoch: 1, train_loss: 1.1526, test_loss: 1.2362, test_f1: 0.2931
 epoch: 2, train_loss: 1.1148, test_loss: 1.2196, test_f1: 0.3822
 epoch: 3, train_loss: 1.0922, test_loss: 1.1524, test_f1: 0.4517
 epoch: 4, train_loss: 1.0667, test_loss: 1.1278, test_f1: 0.4713
 epoch: 5, train_loss: 1.0478, test_loss: 1.1243, test_f1: 0.4749
 epoch: 6, train_loss: 1.0379, test_loss: 1.1176, test_f1: 0.4799
 epoch: 7, train_loss: 1.0442, test_loss: 1.0953, test_f1: 0.4859
 epoch: 8, train_loss: 1.0049, test_loss: 1.0843, test_f1: 0.5162
 epoch: 9, train_loss: 1.0095, test_loss: 1.0860, test_f1: 0.5193
 epoch: 10, train_loss: 1.0082, test_loss: 1.0919, test_f1: 0.5226
 epoch: 11, train_loss: 0.9994, test_loss: 1.0685, test_f1: 0.4963
 epoch: 12, train_loss: 0.9793, test_loss: 1.0854, test_f1: 0.5006
 epoch: 13, train_loss: 0.9808, test_loss: 1.0922, test_f1: 0.5143
 epoch: 14, train_loss: 0.9651, test_loss: 1.0864, test_f1: 0.5343
 epoch: 15, train_loss: 0.9589, test_loss: 1.0432, test_f1: 0.5409
 epoch: 16, train_loss: 0.9383, test_loss: 1.0514, test_f1: 0.5370
 epoch: 17, train_loss: 0.9611, test_loss: 1.0509, test_f1: 0.5369
 epoch: 18, train_loss: 0.9449, test_loss: 1.0475, test_f1: 0.5371
 epoch: 19, train_loss: 0.9265, test_loss: 1.0356, test_f1: 0.5349
 epoch: 20, train_loss: 0.9349, test_loss: 1.0566, test_f1: 0.5379
 epoch: 21, train_loss: 0.9321, test_loss: 1.0627, test_f1: 0.5208
 epoch: 22, train_loss: 0.9214, test_loss: 1.0437, test_f1: 0.5508
 epoch: 23, train_loss: 0.9337, test_loss: 1.0246, test_f1: 0.5420
 epoch: 24, train_loss: 0.9267, test_loss: 1.0460, test_f1: 0.5575
 epoch: 25, train_loss: 0.9180, test_loss: 1.0332, test_f1: 0.5341
 epoch: 26, train_loss: 0.9134, test_loss: 1.0393, test_f1: 0.5368
 epoch: 27, train_loss: 0.9079, test_loss: 1.0276, test_f1: 0.5574
 epoch: 28, train_loss: 0.9055, test_loss: 1.0506, test_f1: 0.5420
 epoch: 29, train_loss: 0.9163, test_loss: 1.0384, test_f1: 0.5342
 epoch: 30, train_loss: 0.9066, test_loss: 1.0759, test_f1: 0.5531
 epoch: 31, train_loss: 0.9026, test_loss: 1.0352, test_f1: 0.5762
 epoch: 32, train_loss: 0.9039, test_loss: 1.0348, test_f1: 0.5535
 epoch: 33, train_loss: 0.8862, test_loss: 1.0348, test_f1: 0.5549
 epoch: 34, train_loss: 0.8848, test_loss: 1.0388, test_f1: 0.5472
 epoch: 35, train_loss: 0.8933, test_loss: 1.0213, test_f1: 0.5598
 epoch: 36, train_loss: 0.8756, test_loss: 1.0272, test_f1: 0.5616
 epoch: 37, train_loss: 0.8615, test_loss: 1.0661, test_f1: 0.5566
 epoch: 38, train_loss: 0.8641, test_loss: 1.0444, test_f1: 0.5880
 epoch: 39, train_loss: 0.8724, test_loss: 1.0960, test_f1: 0.5682
 epoch: 40, train_loss: 0.8585, test_loss: 1.0437, test_f1: 0.5763
 epoch: 41, train_loss: 0.8517, test_loss: 1.0565, test_f1: 0.5798
 epoch: 42, train_loss: 0.8539, test_loss: 1.1077, test_f1: 0.5667
 epoch: 43, train_loss: 0.8358, test_loss: 1.0409, test_f1: 0.5992
 epoch: 44, train_loss: 0.8426, test_loss: 1.0698, test_f1: 0.5800
 epoch: 45, train_loss: 0.8284, test_loss: 1.0366, test_f1: 0.5827
 epoch: 46, train_loss: 0.8379, test_loss: 1.0721, test_f1: 0.5833
 epoch: 47, train_loss: 0.8331, test_loss: 1.1102, test_f1: 0.5649
 epoch: 48, train_loss: 0.8353, test_loss: 1.1126, test_f1: 0.5709
 epoch: 49, train_loss: 0.8294, test_loss: 1.0559, test_f1: 0.5779
 epoch: 50, train_loss: 0.8160, test_loss: 1.1120, test_f1: 0.5765
 epoch: 51, train_loss: 0.8257, test_loss: 1.0928, test_f1: 0.5973
 epoch: 52, train_loss: 0.8198, test_loss: 1.1230, test_f1: 0.5837
 epoch: 53, train_loss: 0.8268, test_loss: 1.0930, test_f1: 0.5952
 epoch: 54, train_loss: 0.8076, test_loss: 1.1087, test_f1: 0.5681
 epoch: 55, train_loss: 0.8099, test_loss: 1.1252, test_f1: 0.5723
 epoch: 56, train_loss: 0.8076, test_loss: 1.1106, test_f1: 0.5678
 epoch: 57, train_loss: 0.7991, test_loss: 1.1145, test_f1: 0.5841
 epoch: 58, train_loss: 0.8100, test_loss: 1.1239, test_f1: 0.5796
 epoch: 59, train_loss: 0.7869, test_loss: 1.1113, test_f1: 0.5873
 epoch: 60, train_loss: 0.7927, test_loss: 1.1310, test_f1: 0.5682
 epoch: 61, train_loss: 0.8014, test_loss: 1.1152, test_f1: 0.5886
 epoch: 62, train_loss: 0.7772, test_loss: 1.1307, test_f1: 0.5754
 epoch: 63, train_loss: 0.7880, test_loss: 1.1302, test_f1: 0.5977
 epoch: 64, train_loss: 0.7933, test_loss: 1.1553, test_f1: 0.5784
 epoch: 65, train_loss: 0.7827, test_loss: 1.1515, test_f1: 0.5828
 epoch: 66, train_loss: 0.7882, test_loss: 1.1638, test_f1: 0.5713
 epoch: 67, train_loss: 0.7921, test_loss: 1.1586, test_f1: 0.5669
 epoch: 68, train_loss: 0.7781, test_loss: 1.1407, test_f1: 0.5908
 epoch: 69, train_loss: 0.7920, test_loss: 1.1837, test_f1: 0.5921
 epoch: 70, train_loss: 0.7863, test_loss: 1.1488, test_f1: 0.5822
 epoch: 71, train_loss: 0.7858, test_loss: 1.1384, test_f1: 0.5902
 epoch: 72, train_loss: 0.7797, test_loss: 1.1605, test_f1: 0.5797
 epoch: 73, train_loss: 0.7585, test_loss: 1.1973, test_f1: 0.5725
 epoch: 74, train_loss: 0.7692, test_loss: 1.2206, test_f1: 0.5658
 epoch: 75, train_loss: 0.7644, test_loss: 1.2084, test_f1: 0.5819
 epoch: 76, train_loss: 0.7813, test_loss: 1.1886, test_f1: 0.5734
 epoch: 77, train_loss: 0.7752, test_loss: 1.1835, test_f1: 0.5686
 epoch: 78, train_loss: 0.7617, test_loss: 1.2101, test_f1: 0.5697
 epoch: 79, train_loss: 0.7799, test_loss: 1.1984, test_f1: 0.5749
 epoch: 80, train_loss: 0.7681, test_loss: 1.1715, test_f1: 0.5886
 epoch: 81, train_loss: 0.7719, test_loss: 1.2426, test_f1: 0.5708
 epoch: 82, train_loss: 0.7649, test_loss: 1.1822, test_f1: 0.5636
 epoch: 83, train_loss: 0.7490, test_loss: 1.2178, test_f1: 0.5612
 epoch: 84, train_loss: 0.7489, test_loss: 1.1939, test_f1: 0.5766
 epoch: 85, train_loss: 0.7495, test_loss: 1.1870, test_f1: 0.5764
 epoch: 86, train_loss: 0.7619, test_loss: 1.1870, test_f1: 0.5681
 epoch: 87, train_loss: 0.7499, test_loss: 1.2277, test_f1: 0.5681
 epoch: 88, train_loss: 0.7490, test_loss: 1.2022, test_f1: 0.5755
 epoch: 89, train_loss: 0.7424, test_loss: 1.2575, test_f1: 0.5766
 epoch: 90, train_loss: 0.7511, test_loss: 1.2105, test_f1: 0.5681
 epoch: 91, train_loss: 0.7425, test_loss: 1.2123, test_f1: 0.5749
 epoch: 92, train_loss: 0.7623, test_loss: 1.2199, test_f1: 0.5541
 epoch: 93, train_loss: 0.7391, test_loss: 1.2123, test_f1: 0.5633
 epoch: 94, train_loss: 0.7459, test_loss: 1.2496, test_f1: 0.5609
 epoch: 95, train_loss: 0.7350, test_loss: 1.2721, test_f1: 0.5644
 epoch: 96, train_loss: 0.7395, test_loss: 1.2500, test_f1: 0.5598
 epoch: 97, train_loss: 0.7364, test_loss: 1.2396, test_f1: 0.5634
 epoch: 98, train_loss: 0.7411, test_loss: 1.2449, test_f1: 0.5667
 epoch: 99, train_loss: 0.7386, test_loss: 1.2055, test_f1: 0.5791

Training completed in 745.76 seconds
Best F1: 0.6129 at epoch 78
Mean F1 across iterations: 0.5915  0.0156
========================FINAL RESULTS================================
FEGIN weighted F1: 0.6129  0.0156
python main.py --data ltspice_demos --representation component_net --model FEGIN --layers 6 --hiddens 64 --batch_size 64 --lr 0.0001 --emb_size 512 --epochs 100 --save_appendix component_net_L6_H64_BS64_LR0.0001_E512 --no_val
-----



STDERR:
  File "main.py", line 370, in <module>
    main()
  File "main.py", line 254, in main
    dataset = dataset_class(
  File "/home/philip/projects/ltspice_examples_code_repo/Circuit-Completion-Using-GNNs/component_classification_with_link_prediction_head/evaluation/FEGIN/kernel/circuit_datasets.py", line 15, in __init__
    self.data, self.slices = torch.load(self.processed_paths[0])
  File "/home/philip/.local/lib/python3.8/site-packages/torch/serialization.py", line 1040, in load
    warnings.warn(
  File "/usr/lib/python3.8/warnings.py", line 109, in _showwarnmsg
    sw(msg.message, msg.category, msg.filename, msg.lineno,
  File "main.py", line 47, in warn_with_traceback
    traceback.print_stack(file=log)
/home/philip/projects/ltspice_examples_code_repo/Circuit-Completion-Using-GNNs/component_classification_with_link_prediction_head/evaluation/FEGIN/kernel/circuit_datasets.py:15: FutureWarning: You are using `torch.load` with `weights_only=False` (the current default value), which uses the default pickle module implicitly. It is possible to construct malicious pickle data which will execute arbitrary code during unpickling (See https://github.com/pytorch/pytorch/blob/main/SECURITY.md#untrusted-models for more details). In a future release, the default value for `weights_only` will be flipped to `True`. This limits the functions that could be executed during unpickling. Arbitrary objects will no longer be allowed to be loaded via this mode unless they are explicitly allowlisted by the user via `torch.serialization.add_safe_globals`. We recommend you start setting `weights_only=True` for any use case where you don't have full control of the loaded file. Please open an issue on GitHub for any issues related to this experimental feature.
  self.data, self.slices = torch.load(self.processed_paths[0])
