STDOUT:
Results will be saved in /home/philip/projects/ltspice_examples_code_repo/Circuit-Completion-Using-GNNs/component_classification_with_link_prediction_head/evaluation/FEGIN/results/model_FEGIN_dataset_ltspice_examples
Command line input: python main.py --data ltspice_examples --representation component_pin --model FEGIN --layers 5 --hiddens 64 --batch_size 128 --lr 0.001 --emb_size 250 --epochs 100 --save_appendix component_pin_L5_H64_BS128_LR0.001_E250 --no_val
 is saved.
-----
ltspice_examples - FEGIN
Using 5 layers, 64 hidden units, h = 2
Loading component_pin representation dataset
ENTERED
Training FEGIN on component_pin representation
Train: 3560, Test: 848
##################ITERATION #0 ****************************************
 epoch: 0, train_loss: 1.2982, test_loss: 1.2872, test_f1: 0.2671
 epoch: 1, train_loss: 1.1545, test_loss: 1.2286, test_f1: 0.2871
 epoch: 2, train_loss: 1.0532, test_loss: 1.0350, test_f1: 0.4568
 epoch: 3, train_loss: 1.0001, test_loss: 0.9801, test_f1: 0.4655
 epoch: 4, train_loss: 0.9697, test_loss: 0.9824, test_f1: 0.5020
 epoch: 5, train_loss: 0.9378, test_loss: 0.9809, test_f1: 0.5198
 epoch: 6, train_loss: 0.9104, test_loss: 0.9912, test_f1: 0.4837
 epoch: 7, train_loss: 0.8877, test_loss: 0.8888, test_f1: 0.5039
 epoch: 8, train_loss: 0.8602, test_loss: 1.1178, test_f1: 0.4059
 epoch: 9, train_loss: 0.8559, test_loss: 0.9156, test_f1: 0.5474
 epoch: 10, train_loss: 0.8241, test_loss: 1.0089, test_f1: 0.5067
 epoch: 11, train_loss: 0.8240, test_loss: 0.9729, test_f1: 0.5013
 epoch: 12, train_loss: 0.7897, test_loss: 0.8468, test_f1: 0.5838
 epoch: 13, train_loss: 0.7804, test_loss: 0.8298, test_f1: 0.5698
 epoch: 14, train_loss: 0.7670, test_loss: 0.9741, test_f1: 0.5601
 epoch: 15, train_loss: 0.7633, test_loss: 0.8622, test_f1: 0.6060
 epoch: 16, train_loss: 0.7311, test_loss: 0.8934, test_f1: 0.5489
 epoch: 17, train_loss: 0.7413, test_loss: 0.9906, test_f1: 0.5489
 epoch: 18, train_loss: 0.7145, test_loss: 0.8637, test_f1: 0.5421
 epoch: 19, train_loss: 0.6942, test_loss: 0.8292, test_f1: 0.5918
 epoch: 20, train_loss: 0.6868, test_loss: 1.0253, test_f1: 0.5327
 epoch: 21, train_loss: 0.6834, test_loss: 0.9960, test_f1: 0.5125
 epoch: 22, train_loss: 0.6516, test_loss: 0.8956, test_f1: 0.5681
 epoch: 23, train_loss: 0.6517, test_loss: 0.9787, test_f1: 0.5725
 epoch: 24, train_loss: 0.6583, test_loss: 0.8805, test_f1: 0.5676
 epoch: 25, train_loss: 0.6251, test_loss: 0.9644, test_f1: 0.5698
 epoch: 26, train_loss: 0.6306, test_loss: 0.9550, test_f1: 0.5915
 epoch: 27, train_loss: 0.6350, test_loss: 0.8427, test_f1: 0.5981
 epoch: 28, train_loss: 0.6197, test_loss: 0.9503, test_f1: 0.5974
 epoch: 29, train_loss: 0.6097, test_loss: 0.9389, test_f1: 0.6056
 epoch: 30, train_loss: 0.5894, test_loss: 0.8709, test_f1: 0.6125
 epoch: 31, train_loss: 0.5754, test_loss: 0.8905, test_f1: 0.6121
 epoch: 32, train_loss: 0.5892, test_loss: 0.9597, test_f1: 0.6057
 epoch: 33, train_loss: 0.5677, test_loss: 0.9844, test_f1: 0.6330
 epoch: 34, train_loss: 0.5655, test_loss: 0.8302, test_f1: 0.6468
 epoch: 35, train_loss: 0.5626, test_loss: 0.9078, test_f1: 0.6010
 epoch: 36, train_loss: 0.5731, test_loss: 0.9781, test_f1: 0.6139
 epoch: 37, train_loss: 0.5477, test_loss: 0.8032, test_f1: 0.6456
 epoch: 38, train_loss: 0.5495, test_loss: 0.9822, test_f1: 0.6013
 epoch: 39, train_loss: 0.5231, test_loss: 1.0380, test_f1: 0.6227
 epoch: 40, train_loss: 0.4928, test_loss: 0.9904, test_f1: 0.5823
 epoch: 41, train_loss: 0.5042, test_loss: 1.0176, test_f1: 0.6252
 epoch: 42, train_loss: 0.5136, test_loss: 0.9425, test_f1: 0.6061
 epoch: 43, train_loss: 0.5276, test_loss: 1.0629, test_f1: 0.6190
 epoch: 44, train_loss: 0.5051, test_loss: 0.9032, test_f1: 0.6299
 epoch: 45, train_loss: 0.4930, test_loss: 0.9695, test_f1: 0.6443
 epoch: 46, train_loss: 0.4715, test_loss: 1.0263, test_f1: 0.6411
 epoch: 47, train_loss: 0.4777, test_loss: 1.0575, test_f1: 0.6319
 epoch: 48, train_loss: 0.4513, test_loss: 1.1725, test_f1: 0.6073
 epoch: 49, train_loss: 0.4616, test_loss: 0.9385, test_f1: 0.6460
 epoch: 50, train_loss: 0.4436, test_loss: 1.0031, test_f1: 0.6264
 epoch: 51, train_loss: 0.4286, test_loss: 1.0056, test_f1: 0.6454
 epoch: 52, train_loss: 0.4066, test_loss: 1.0118, test_f1: 0.6647
 epoch: 53, train_loss: 0.3908, test_loss: 1.0104, test_f1: 0.6606
 epoch: 54, train_loss: 0.3860, test_loss: 1.0234, test_f1: 0.6374
 epoch: 55, train_loss: 0.3657, test_loss: 1.2093, test_f1: 0.6538
 epoch: 56, train_loss: 0.3582, test_loss: 1.0981, test_f1: 0.6695
 epoch: 57, train_loss: 0.3538, test_loss: 1.0990, test_f1: 0.6619
 epoch: 58, train_loss: 0.3581, test_loss: 1.2066, test_f1: 0.6353
 epoch: 59, train_loss: 0.3664, test_loss: 1.1311, test_f1: 0.6767
 epoch: 60, train_loss: 0.3433, test_loss: 1.2686, test_f1: 0.6175
 epoch: 61, train_loss: 0.3531, test_loss: 1.2698, test_f1: 0.6274
 epoch: 62, train_loss: 0.3463, test_loss: 1.1125, test_f1: 0.6604
 epoch: 63, train_loss: 0.3477, test_loss: 1.2296, test_f1: 0.6420
 epoch: 64, train_loss: 0.3455, test_loss: 1.2003, test_f1: 0.6436
 epoch: 65, train_loss: 0.3315, test_loss: 1.1396, test_f1: 0.6672
 epoch: 66, train_loss: 0.3172, test_loss: 1.4302, test_f1: 0.6195
 epoch: 67, train_loss: 0.3297, test_loss: 1.2797, test_f1: 0.6509
 epoch: 68, train_loss: 0.3281, test_loss: 1.3367, test_f1: 0.6417
 epoch: 69, train_loss: 0.3183, test_loss: 1.2297, test_f1: 0.6389
 epoch: 70, train_loss: 0.3155, test_loss: 1.3206, test_f1: 0.6580
 epoch: 71, train_loss: 0.3080, test_loss: 1.3691, test_f1: 0.6303
 epoch: 72, train_loss: 0.3053, test_loss: 1.2850, test_f1: 0.6750
 epoch: 73, train_loss: 0.2972, test_loss: 1.4855, test_f1: 0.6194
 epoch: 74, train_loss: 0.3149, test_loss: 1.2897, test_f1: 0.6833
 epoch: 75, train_loss: 0.3011, test_loss: 1.4390, test_f1: 0.6100
 epoch: 76, train_loss: 0.3008, test_loss: 1.3396, test_f1: 0.6578
 epoch: 77, train_loss: 0.2945, test_loss: 1.3355, test_f1: 0.6631
 epoch: 78, train_loss: 0.2694, test_loss: 1.5435, test_f1: 0.6318
 epoch: 79, train_loss: 0.2718, test_loss: 1.5141, test_f1: 0.6471
 epoch: 80, train_loss: 0.2748, test_loss: 1.5468, test_f1: 0.6554
 epoch: 81, train_loss: 0.2703, test_loss: 1.4082, test_f1: 0.6337
 epoch: 82, train_loss: 0.2750, test_loss: 1.4560, test_f1: 0.6705
 epoch: 83, train_loss: 0.2958, test_loss: 1.4565, test_f1: 0.6298
 epoch: 84, train_loss: 0.2868, test_loss: 1.3767, test_f1: 0.6649
 epoch: 85, train_loss: 0.2677, test_loss: 1.4319, test_f1: 0.6498
 epoch: 86, train_loss: 0.2917, test_loss: 1.4679, test_f1: 0.6275
 epoch: 87, train_loss: 0.2619, test_loss: 1.5443, test_f1: 0.6317
 epoch: 88, train_loss: 0.2763, test_loss: 1.7965, test_f1: 0.5704
 epoch: 89, train_loss: 0.2727, test_loss: 1.5189, test_f1: 0.6541
 epoch: 90, train_loss: 0.2453, test_loss: 1.5819, test_f1: 0.6512
 epoch: 91, train_loss: 0.2381, test_loss: 1.6709, test_f1: 0.6356
 epoch: 92, train_loss: 0.2498, test_loss: 1.7566, test_f1: 0.6550
 epoch: 93, train_loss: 0.2495, test_loss: 1.6742, test_f1: 0.6606
 epoch: 94, train_loss: 0.2577, test_loss: 1.7375, test_f1: 0.6317
 epoch: 95, train_loss: 0.2706, test_loss: 1.6619, test_f1: 0.6269
 epoch: 96, train_loss: 0.2661, test_loss: 1.5828, test_f1: 0.6401
 epoch: 97, train_loss: 0.2536, test_loss: 1.6223, test_f1: 0.6463
 epoch: 98, train_loss: 0.2407, test_loss: 1.7247, test_f1: 0.6453
 epoch: 99, train_loss: 0.2363, test_loss: 1.8219, test_f1: 0.6408
##################ITERATION #1 ****************************************
 epoch: 0, train_loss: 1.1992, test_loss: 1.2396, test_f1: 0.2260
 epoch: 1, train_loss: 1.0392, test_loss: 1.0097, test_f1: 0.4811
 epoch: 2, train_loss: 0.9686, test_loss: 0.9600, test_f1: 0.5173
 epoch: 3, train_loss: 0.9266, test_loss: 0.9326, test_f1: 0.4919
 epoch: 4, train_loss: 0.8930, test_loss: 0.9422, test_f1: 0.5334
 epoch: 5, train_loss: 0.8638, test_loss: 0.8420, test_f1: 0.5424
 epoch: 6, train_loss: 0.8449, test_loss: 1.0521, test_f1: 0.5069
 epoch: 7, train_loss: 0.8221, test_loss: 0.8824, test_f1: 0.5708
 epoch: 8, train_loss: 0.8240, test_loss: 1.0019, test_f1: 0.5222
 epoch: 9, train_loss: 0.7919, test_loss: 0.9655, test_f1: 0.5197
 epoch: 10, train_loss: 0.7637, test_loss: 0.9118, test_f1: 0.5947
 epoch: 11, train_loss: 0.7481, test_loss: 0.9454, test_f1: 0.5785
 epoch: 12, train_loss: 0.7485, test_loss: 1.2677, test_f1: 0.5263
 epoch: 13, train_loss: 0.7570, test_loss: 0.8801, test_f1: 0.5729
 epoch: 14, train_loss: 0.7236, test_loss: 0.8473, test_f1: 0.5897
 epoch: 15, train_loss: 0.7108, test_loss: 0.8922, test_f1: 0.5932
 epoch: 16, train_loss: 0.6999, test_loss: 0.9347, test_f1: 0.5672
 epoch: 17, train_loss: 0.6890, test_loss: 0.9117, test_f1: 0.6101
 epoch: 18, train_loss: 0.7084, test_loss: 0.8700, test_f1: 0.5845
 epoch: 19, train_loss: 0.6957, test_loss: 0.8537, test_f1: 0.6088
 epoch: 20, train_loss: 0.6644, test_loss: 0.8673, test_f1: 0.6028
 epoch: 21, train_loss: 0.6650, test_loss: 0.9581, test_f1: 0.5471
 epoch: 22, train_loss: 0.6436, test_loss: 0.7772, test_f1: 0.6394
 epoch: 23, train_loss: 0.6425, test_loss: 0.8191, test_f1: 0.6204
 epoch: 24, train_loss: 0.6333, test_loss: 0.9241, test_f1: 0.6003
 epoch: 25, train_loss: 0.6258, test_loss: 0.8033, test_f1: 0.6047
 epoch: 26, train_loss: 0.6337, test_loss: 0.9408, test_f1: 0.5680
 epoch: 27, train_loss: 0.6325, test_loss: 0.7877, test_f1: 0.6078
 epoch: 28, train_loss: 0.6173, test_loss: 1.0808, test_f1: 0.5507
 epoch: 29, train_loss: 0.6013, test_loss: 1.1538, test_f1: 0.5397
 epoch: 30, train_loss: 0.6233, test_loss: 0.8179, test_f1: 0.6223
 epoch: 31, train_loss: 0.5928, test_loss: 1.0373, test_f1: 0.6006
 epoch: 32, train_loss: 0.5864, test_loss: 0.8343, test_f1: 0.6079
 epoch: 33, train_loss: 0.5801, test_loss: 0.8165, test_f1: 0.6250
 epoch: 34, train_loss: 0.5610, test_loss: 0.7459, test_f1: 0.6381
 epoch: 35, train_loss: 0.5474, test_loss: 0.9486, test_f1: 0.5907
 epoch: 36, train_loss: 0.5440, test_loss: 0.9007, test_f1: 0.5579
 epoch: 37, train_loss: 0.5387, test_loss: 0.8591, test_f1: 0.6145
 epoch: 38, train_loss: 0.5177, test_loss: 0.8517, test_f1: 0.6364
 epoch: 39, train_loss: 0.5329, test_loss: 0.9374, test_f1: 0.6345
 epoch: 40, train_loss: 0.5018, test_loss: 0.7725, test_f1: 0.6671
 epoch: 41, train_loss: 0.5114, test_loss: 0.7160, test_f1: 0.6769
 epoch: 42, train_loss: 0.5169, test_loss: 1.0076, test_f1: 0.6271
 epoch: 43, train_loss: 0.5381, test_loss: 0.7906, test_f1: 0.6355
 epoch: 44, train_loss: 0.5021, test_loss: 0.7955, test_f1: 0.6421
 epoch: 45, train_loss: 0.4959, test_loss: 0.7914, test_f1: 0.6456
 epoch: 46, train_loss: 0.4859, test_loss: 0.9624, test_f1: 0.5921
 epoch: 47, train_loss: 0.4797, test_loss: 0.8899, test_f1: 0.6292
 epoch: 48, train_loss: 0.4849, test_loss: 1.0176, test_f1: 0.6340
 epoch: 49, train_loss: 0.4758, test_loss: 0.7908, test_f1: 0.6761
 epoch: 50, train_loss: 0.4758, test_loss: 0.8924, test_f1: 0.6384
 epoch: 51, train_loss: 0.4235, test_loss: 0.8238, test_f1: 0.6481
 epoch: 52, train_loss: 0.3935, test_loss: 1.0083, test_f1: 0.6427
 epoch: 53, train_loss: 0.3794, test_loss: 1.0104, test_f1: 0.6391
 epoch: 54, train_loss: 0.3856, test_loss: 0.9341, test_f1: 0.6315
 epoch: 55, train_loss: 0.3787, test_loss: 0.9893, test_f1: 0.6595
 epoch: 56, train_loss: 0.3967, test_loss: 0.8058, test_f1: 0.6702
 epoch: 57, train_loss: 0.3595, test_loss: 0.9181, test_f1: 0.6617
 epoch: 58, train_loss: 0.3487, test_loss: 0.8622, test_f1: 0.6707
 epoch: 59, train_loss: 0.3602, test_loss: 1.0158, test_f1: 0.6678
 epoch: 60, train_loss: 0.3659, test_loss: 0.9518, test_f1: 0.6406
 epoch: 61, train_loss: 0.3440, test_loss: 0.9928, test_f1: 0.6584
 epoch: 62, train_loss: 0.3352, test_loss: 0.9448, test_f1: 0.6733
 epoch: 63, train_loss: 0.3185, test_loss: 0.9967, test_f1: 0.6368
 epoch: 64, train_loss: 0.3481, test_loss: 0.9624, test_f1: 0.6655
 epoch: 65, train_loss: 0.3437, test_loss: 1.0243, test_f1: 0.6788
 epoch: 66, train_loss: 0.3366, test_loss: 0.8885, test_f1: 0.6599
 epoch: 67, train_loss: 0.3146, test_loss: 1.2296, test_f1: 0.6490
 epoch: 68, train_loss: 0.3072, test_loss: 1.2352, test_f1: 0.6346
 epoch: 69, train_loss: 0.2978, test_loss: 1.1169, test_f1: 0.6589
 epoch: 70, train_loss: 0.3179, test_loss: 1.0913, test_f1: 0.6333
 epoch: 71, train_loss: 0.3129, test_loss: 1.1759, test_f1: 0.6544
 epoch: 72, train_loss: 0.3096, test_loss: 1.1807, test_f1: 0.6505
 epoch: 73, train_loss: 0.3228, test_loss: 1.2990, test_f1: 0.6475
 epoch: 74, train_loss: 0.2997, test_loss: 1.0828, test_f1: 0.6917
 epoch: 75, train_loss: 0.3068, test_loss: 1.0765, test_f1: 0.6470
 epoch: 76, train_loss: 0.3037, test_loss: 1.1457, test_f1: 0.6693
 epoch: 77, train_loss: 0.2969, test_loss: 1.3188, test_f1: 0.6702
 epoch: 78, train_loss: 0.2843, test_loss: 1.2320, test_f1: 0.6826
 epoch: 79, train_loss: 0.2906, test_loss: 1.0850, test_f1: 0.6787
 epoch: 80, train_loss: 0.2888, test_loss: 1.1024, test_f1: 0.6495
 epoch: 81, train_loss: 0.2637, test_loss: 1.2534, test_f1: 0.6647
 epoch: 82, train_loss: 0.2674, test_loss: 1.3386, test_f1: 0.6521
 epoch: 83, train_loss: 0.2522, test_loss: 1.3036, test_f1: 0.6568
 epoch: 84, train_loss: 0.2710, test_loss: 1.1464, test_f1: 0.6606
 epoch: 85, train_loss: 0.2815, test_loss: 1.3558, test_f1: 0.6362
 epoch: 86, train_loss: 0.2761, test_loss: 1.3452, test_f1: 0.6671
 epoch: 87, train_loss: 0.2497, test_loss: 1.3365, test_f1: 0.6488
 epoch: 88, train_loss: 0.2580, test_loss: 1.3788, test_f1: 0.6676
 epoch: 89, train_loss: 0.2648, test_loss: 1.3230, test_f1: 0.6464
 epoch: 90, train_loss: 0.2403, test_loss: 1.4763, test_f1: 0.6349
 epoch: 91, train_loss: 0.2420, test_loss: 1.3283, test_f1: 0.6805
 epoch: 92, train_loss: 0.2375, test_loss: 1.4258, test_f1: 0.6422
 epoch: 93, train_loss: 0.2362, test_loss: 1.3053, test_f1: 0.6689
 epoch: 94, train_loss: 0.2486, test_loss: 1.3282, test_f1: 0.6377
 epoch: 95, train_loss: 0.2456, test_loss: 1.2050, test_f1: 0.6625
 epoch: 96, train_loss: 0.2538, test_loss: 1.2852, test_f1: 0.6620
 epoch: 97, train_loss: 0.2400, test_loss: 1.2838, test_f1: 0.6613
 epoch: 98, train_loss: 0.2532, test_loss: 1.4947, test_f1: 0.6674
 epoch: 99, train_loss: 0.2336, test_loss: 1.3353, test_f1: 0.7010
##################ITERATION #2 ****************************************
 epoch: 0, train_loss: 1.1722, test_loss: 1.3325, test_f1: 0.2286
 epoch: 1, train_loss: 0.9894, test_loss: 1.1663, test_f1: 0.3486
 epoch: 2, train_loss: 0.9313, test_loss: 0.9688, test_f1: 0.4636
 epoch: 3, train_loss: 0.8966, test_loss: 0.9004, test_f1: 0.4969
 epoch: 4, train_loss: 0.8831, test_loss: 0.9756, test_f1: 0.5295
 epoch: 5, train_loss: 0.8466, test_loss: 1.0237, test_f1: 0.5330
 epoch: 6, train_loss: 0.8368, test_loss: 1.0701, test_f1: 0.5156
 epoch: 7, train_loss: 0.8181, test_loss: 1.1470, test_f1: 0.5223
 epoch: 8, train_loss: 0.7868, test_loss: 0.9278, test_f1: 0.5814
 epoch: 9, train_loss: 0.7746, test_loss: 0.9122, test_f1: 0.5532
 epoch: 10, train_loss: 0.7746, test_loss: 0.8360, test_f1: 0.5642
 epoch: 11, train_loss: 0.7516, test_loss: 0.8921, test_f1: 0.5966
 epoch: 12, train_loss: 0.7405, test_loss: 0.8514, test_f1: 0.5673
 epoch: 13, train_loss: 0.7149, test_loss: 0.9273, test_f1: 0.6058
 epoch: 14, train_loss: 0.6953, test_loss: 1.0137, test_f1: 0.5691
 epoch: 15, train_loss: 0.6835, test_loss: 0.9331, test_f1: 0.5916
 epoch: 16, train_loss: 0.6973, test_loss: 0.9551, test_f1: 0.5738
 epoch: 17, train_loss: 0.6784, test_loss: 0.8875, test_f1: 0.6165
 epoch: 18, train_loss: 0.6575, test_loss: 0.9290, test_f1: 0.5996
 epoch: 19, train_loss: 0.6494, test_loss: 0.9356, test_f1: 0.5953
 epoch: 20, train_loss: 0.6314, test_loss: 0.8834, test_f1: 0.6133
 epoch: 21, train_loss: 0.6286, test_loss: 0.9513, test_f1: 0.6186
 epoch: 22, train_loss: 0.6165, test_loss: 0.8816, test_f1: 0.6124
 epoch: 23, train_loss: 0.6067, test_loss: 0.9385, test_f1: 0.6208
 epoch: 24, train_loss: 0.5912, test_loss: 0.8543, test_f1: 0.6035
 epoch: 25, train_loss: 0.5839, test_loss: 0.9004, test_f1: 0.6243
 epoch: 26, train_loss: 0.6037, test_loss: 0.9966, test_f1: 0.5892
 epoch: 27, train_loss: 0.5958, test_loss: 0.9254, test_f1: 0.6071
 epoch: 28, train_loss: 0.5703, test_loss: 0.8896, test_f1: 0.6134
 epoch: 29, train_loss: 0.5550, test_loss: 0.9244, test_f1: 0.6264
 epoch: 30, train_loss: 0.5483, test_loss: 0.8255, test_f1: 0.6438
 epoch: 31, train_loss: 0.5352, test_loss: 0.9532, test_f1: 0.6275
 epoch: 32, train_loss: 0.5469, test_loss: 0.8752, test_f1: 0.6149
 epoch: 33, train_loss: 0.5232, test_loss: 0.9160, test_f1: 0.6291
 epoch: 34, train_loss: 0.5315, test_loss: 0.8414, test_f1: 0.6499
 epoch: 35, train_loss: 0.5306, test_loss: 0.8400, test_f1: 0.6339
 epoch: 36, train_loss: 0.5066, test_loss: 1.0125, test_f1: 0.6297
 epoch: 37, train_loss: 0.4992, test_loss: 0.9460, test_f1: 0.6530
 epoch: 38, train_loss: 0.5033, test_loss: 0.9969, test_f1: 0.6271
 epoch: 39, train_loss: 0.4796, test_loss: 1.0409, test_f1: 0.6441
 epoch: 40, train_loss: 0.4730, test_loss: 0.9368, test_f1: 0.6554
 epoch: 41, train_loss: 0.4536, test_loss: 0.8729, test_f1: 0.6618
 epoch: 42, train_loss: 0.4538, test_loss: 1.0227, test_f1: 0.6269
 epoch: 43, train_loss: 0.4611, test_loss: 1.1213, test_f1: 0.6143
 epoch: 44, train_loss: 0.4434, test_loss: 1.1060, test_f1: 0.6266
 epoch: 45, train_loss: 0.4178, test_loss: 0.9624, test_f1: 0.6493
 epoch: 46, train_loss: 0.4299, test_loss: 1.3321, test_f1: 0.5523
 epoch: 47, train_loss: 0.4569, test_loss: 1.0402, test_f1: 0.6322
 epoch: 48, train_loss: 0.4473, test_loss: 0.9603, test_f1: 0.6620
 epoch: 49, train_loss: 0.4511, test_loss: 1.1753, test_f1: 0.5797
 epoch: 50, train_loss: 0.4116, test_loss: 1.0230, test_f1: 0.6413
 epoch: 51, train_loss: 0.3792, test_loss: 1.0079, test_f1: 0.6566
 epoch: 52, train_loss: 0.3511, test_loss: 1.0985, test_f1: 0.6434
 epoch: 53, train_loss: 0.3612, test_loss: 1.0680, test_f1: 0.6599
 epoch: 54, train_loss: 0.3372, test_loss: 1.1238, test_f1: 0.6343
 epoch: 55, train_loss: 0.3401, test_loss: 1.0433, test_f1: 0.6306
 epoch: 56, train_loss: 0.3221, test_loss: 1.1036, test_f1: 0.6462
 epoch: 57, train_loss: 0.3240, test_loss: 1.1262, test_f1: 0.6554
 epoch: 58, train_loss: 0.3033, test_loss: 1.1762, test_f1: 0.6494
 epoch: 59, train_loss: 0.3120, test_loss: 1.0581, test_f1: 0.6671
 epoch: 60, train_loss: 0.3114, test_loss: 1.2298, test_f1: 0.6617
 epoch: 61, train_loss: 0.3011, test_loss: 1.2679, test_f1: 0.6416
 epoch: 62, train_loss: 0.3183, test_loss: 1.2351, test_f1: 0.6529
 epoch: 63, train_loss: 0.2887, test_loss: 1.2786, test_f1: 0.6651
 epoch: 64, train_loss: 0.2941, test_loss: 1.2661, test_f1: 0.6530
 epoch: 65, train_loss: 0.2821, test_loss: 1.1474, test_f1: 0.6744
 epoch: 66, train_loss: 0.2791, test_loss: 1.3181, test_f1: 0.6666
 epoch: 67, train_loss: 0.2808, test_loss: 1.2536, test_f1: 0.6715
 epoch: 68, train_loss: 0.2672, test_loss: 1.3973, test_f1: 0.6740
 epoch: 69, train_loss: 0.2822, test_loss: 1.3155, test_f1: 0.6642
 epoch: 70, train_loss: 0.2786, test_loss: 1.4108, test_f1: 0.6523
 epoch: 71, train_loss: 0.2740, test_loss: 1.3214, test_f1: 0.6444
 epoch: 72, train_loss: 0.2640, test_loss: 1.3113, test_f1: 0.6427
 epoch: 73, train_loss: 0.2702, test_loss: 1.3363, test_f1: 0.6473
 epoch: 74, train_loss: 0.2526, test_loss: 1.4459, test_f1: 0.6378
 epoch: 75, train_loss: 0.2522, test_loss: 1.2367, test_f1: 0.6751
 epoch: 76, train_loss: 0.2654, test_loss: 1.3030, test_f1: 0.6572
 epoch: 77, train_loss: 0.2470, test_loss: 1.5019, test_f1: 0.6488
 epoch: 78, train_loss: 0.2533, test_loss: 1.3105, test_f1: 0.6529
 epoch: 79, train_loss: 0.2591, test_loss: 1.2652, test_f1: 0.6411
 epoch: 80, train_loss: 0.2637, test_loss: 1.5053, test_f1: 0.6531
 epoch: 81, train_loss: 0.2545, test_loss: 1.3349, test_f1: 0.6427
 epoch: 82, train_loss: 0.2486, test_loss: 1.4612, test_f1: 0.6537
 epoch: 83, train_loss: 0.2454, test_loss: 1.5127, test_f1: 0.6689
 epoch: 84, train_loss: 0.2322, test_loss: 1.4346, test_f1: 0.6601
 epoch: 85, train_loss: 0.2406, test_loss: 1.4871, test_f1: 0.6387
 epoch: 86, train_loss: 0.2433, test_loss: 1.5563, test_f1: 0.6555
 epoch: 87, train_loss: 0.2443, test_loss: 1.6219, test_f1: 0.6532
 epoch: 88, train_loss: 0.2405, test_loss: 1.5709, test_f1: 0.6400
 epoch: 89, train_loss: 0.2330, test_loss: 1.5799, test_f1: 0.6276
 epoch: 90, train_loss: 0.2249, test_loss: 1.5713, test_f1: 0.6556
 epoch: 91, train_loss: 0.2301, test_loss: 1.4081, test_f1: 0.6596
 epoch: 92, train_loss: 0.2127, test_loss: 1.5330, test_f1: 0.6681
 epoch: 93, train_loss: 0.2166, test_loss: 1.6380, test_f1: 0.6631
 epoch: 94, train_loss: 0.2295, test_loss: 1.4924, test_f1: 0.6354
 epoch: 95, train_loss: 0.2224, test_loss: 1.4692, test_f1: 0.6880
 epoch: 96, train_loss: 0.2073, test_loss: 1.6818, test_f1: 0.6578
 epoch: 97, train_loss: 0.2193, test_loss: 1.5945, test_f1: 0.6655
 epoch: 98, train_loss: 0.2167, test_loss: 1.4352, test_f1: 0.6584
 epoch: 99, train_loss: 0.2137, test_loss: 1.7727, test_f1: 0.6350
##################ITERATION #3 ****************************************
 epoch: 0, train_loss: 1.1940, test_loss: 1.2304, test_f1: 0.2664
 epoch: 1, train_loss: 1.0372, test_loss: 1.0416, test_f1: 0.4759
 epoch: 2, train_loss: 0.9801, test_loss: 0.9955, test_f1: 0.4855
 epoch: 3, train_loss: 0.9466, test_loss: 0.9615, test_f1: 0.5070
 epoch: 4, train_loss: 0.9337, test_loss: 0.9466, test_f1: 0.5304
 epoch: 5, train_loss: 0.9026, test_loss: 0.9501, test_f1: 0.5403
 epoch: 6, train_loss: 0.8819, test_loss: 0.9486, test_f1: 0.5448
 epoch: 7, train_loss: 0.8660, test_loss: 0.9395, test_f1: 0.5379
 epoch: 8, train_loss: 0.8338, test_loss: 0.9171, test_f1: 0.5880
 epoch: 9, train_loss: 0.8251, test_loss: 0.9361, test_f1: 0.5561
 epoch: 10, train_loss: 0.7928, test_loss: 0.9305, test_f1: 0.5585
 epoch: 11, train_loss: 0.7976, test_loss: 0.9114, test_f1: 0.5402
 epoch: 12, train_loss: 0.7983, test_loss: 0.8940, test_f1: 0.5797
 epoch: 13, train_loss: 0.7671, test_loss: 0.9337, test_f1: 0.5692
 epoch: 14, train_loss: 0.7460, test_loss: 0.8982, test_f1: 0.5964
 epoch: 15, train_loss: 0.7243, test_loss: 0.9043, test_f1: 0.6159
 epoch: 16, train_loss: 0.7322, test_loss: 0.9217, test_f1: 0.5651
 epoch: 17, train_loss: 0.7209, test_loss: 0.8867, test_f1: 0.5890
 epoch: 18, train_loss: 0.7086, test_loss: 0.9060, test_f1: 0.5893
 epoch: 19, train_loss: 0.6851, test_loss: 1.0860, test_f1: 0.5705
 epoch: 20, train_loss: 0.7008, test_loss: 1.0257, test_f1: 0.5766
 epoch: 21, train_loss: 0.6856, test_loss: 0.9061, test_f1: 0.6006
 epoch: 22, train_loss: 0.6693, test_loss: 0.9416, test_f1: 0.5866
 epoch: 23, train_loss: 0.6518, test_loss: 0.9658, test_f1: 0.5781
 epoch: 24, train_loss: 0.6568, test_loss: 0.9209, test_f1: 0.5862
 epoch: 25, train_loss: 0.6423, test_loss: 0.9003, test_f1: 0.6039
 epoch: 26, train_loss: 0.6785, test_loss: 0.8570, test_f1: 0.6248
 epoch: 27, train_loss: 0.6299, test_loss: 0.8904, test_f1: 0.6216
 epoch: 28, train_loss: 0.6179, test_loss: 0.9219, test_f1: 0.6103
 epoch: 29, train_loss: 0.6053, test_loss: 0.8886, test_f1: 0.6106
 epoch: 30, train_loss: 0.5939, test_loss: 0.9483, test_f1: 0.6014
 epoch: 31, train_loss: 0.5944, test_loss: 1.0486, test_f1: 0.5913
 epoch: 32, train_loss: 0.5984, test_loss: 1.0052, test_f1: 0.5783
 epoch: 33, train_loss: 0.5655, test_loss: 1.1040, test_f1: 0.5646
 epoch: 34, train_loss: 0.5736, test_loss: 0.8767, test_f1: 0.6208
 epoch: 35, train_loss: 0.5478, test_loss: 0.9155, test_f1: 0.6230
 epoch: 36, train_loss: 0.5409, test_loss: 0.9657, test_f1: 0.6229
 epoch: 37, train_loss: 0.5491, test_loss: 1.0157, test_f1: 0.5997
 epoch: 38, train_loss: 0.5319, test_loss: 0.9212, test_f1: 0.6365
 epoch: 39, train_loss: 0.5359, test_loss: 0.9586, test_f1: 0.6316
 epoch: 40, train_loss: 0.5196, test_loss: 1.1361, test_f1: 0.5745
 epoch: 41, train_loss: 0.5151, test_loss: 0.9617, test_f1: 0.6373
 epoch: 42, train_loss: 0.5132, test_loss: 0.9614, test_f1: 0.6086
 epoch: 43, train_loss: 0.4787, test_loss: 1.0160, test_f1: 0.5976
 epoch: 44, train_loss: 0.5113, test_loss: 1.0566, test_f1: 0.6319
 epoch: 45, train_loss: 0.5029, test_loss: 1.1260, test_f1: 0.5727
 epoch: 46, train_loss: 0.4781, test_loss: 1.0536, test_f1: 0.6014
 epoch: 47, train_loss: 0.4631, test_loss: 1.0123, test_f1: 0.6222
 epoch: 48, train_loss: 0.4528, test_loss: 1.0842, test_f1: 0.6080
 epoch: 49, train_loss: 0.4844, test_loss: 1.1129, test_f1: 0.6077
 epoch: 50, train_loss: 0.4661, test_loss: 1.0342, test_f1: 0.5959
 epoch: 51, train_loss: 0.4209, test_loss: 0.9948, test_f1: 0.6307
 epoch: 52, train_loss: 0.3888, test_loss: 1.1263, test_f1: 0.5999
 epoch: 53, train_loss: 0.3838, test_loss: 1.1598, test_f1: 0.6152
 epoch: 54, train_loss: 0.3852, test_loss: 1.1903, test_f1: 0.6120
 epoch: 55, train_loss: 0.3599, test_loss: 1.2741, test_f1: 0.5919
 epoch: 56, train_loss: 0.3651, test_loss: 1.0556, test_f1: 0.6314
 epoch: 57, train_loss: 0.3571, test_loss: 1.1331, test_f1: 0.6271
 epoch: 58, train_loss: 0.3552, test_loss: 1.2170, test_f1: 0.6180
 epoch: 59, train_loss: 0.3602, test_loss: 1.1644, test_f1: 0.6075
 epoch: 60, train_loss: 0.3482, test_loss: 1.2469, test_f1: 0.6021
 epoch: 61, train_loss: 0.3422, test_loss: 1.1798, test_f1: 0.6100
 epoch: 62, train_loss: 0.3386, test_loss: 1.2592, test_f1: 0.6307
 epoch: 63, train_loss: 0.3321, test_loss: 1.2259, test_f1: 0.6147
 epoch: 64, train_loss: 0.3233, test_loss: 1.1780, test_f1: 0.6432
 epoch: 65, train_loss: 0.3313, test_loss: 1.1834, test_f1: 0.6292
 epoch: 66, train_loss: 0.3140, test_loss: 1.4269, test_f1: 0.6040
 epoch: 67, train_loss: 0.3144, test_loss: 1.3725, test_f1: 0.6298
 epoch: 68, train_loss: 0.3285, test_loss: 1.2246, test_f1: 0.6304
 epoch: 69, train_loss: 0.3290, test_loss: 1.4540, test_f1: 0.6237
 epoch: 70, train_loss: 0.3157, test_loss: 1.3744, test_f1: 0.6231
 epoch: 71, train_loss: 0.3130, test_loss: 1.3012, test_f1: 0.6300
 epoch: 72, train_loss: 0.3050, test_loss: 1.3252, test_f1: 0.6317
 epoch: 73, train_loss: 0.3031, test_loss: 1.3640, test_f1: 0.6434
 epoch: 74, train_loss: 0.2840, test_loss: 1.4912, test_f1: 0.6177
 epoch: 75, train_loss: 0.2972, test_loss: 1.5159, test_f1: 0.6271
 epoch: 76, train_loss: 0.2843, test_loss: 1.4619, test_f1: 0.6276
 epoch: 77, train_loss: 0.2887, test_loss: 1.4503, test_f1: 0.6145
 epoch: 78, train_loss: 0.2994, test_loss: 1.5351, test_f1: 0.5992
 epoch: 79, train_loss: 0.3050, test_loss: 1.3926, test_f1: 0.6100
 epoch: 80, train_loss: 0.2784, test_loss: 1.5660, test_f1: 0.6105
 epoch: 81, train_loss: 0.2859, test_loss: 1.4356, test_f1: 0.6324
 epoch: 82, train_loss: 0.2688, test_loss: 1.4517, test_f1: 0.6218
 epoch: 83, train_loss: 0.2676, test_loss: 1.4957, test_f1: 0.6469
 epoch: 84, train_loss: 0.2672, test_loss: 1.4343, test_f1: 0.6341
 epoch: 85, train_loss: 0.2583, test_loss: 1.6228, test_f1: 0.5897
 epoch: 86, train_loss: 0.2740, test_loss: 1.5421, test_f1: 0.6141
 epoch: 87, train_loss: 0.2641, test_loss: 1.4263, test_f1: 0.6318
 epoch: 88, train_loss: 0.2654, test_loss: 1.4350, test_f1: 0.6441
 epoch: 89, train_loss: 0.2722, test_loss: 1.5048, test_f1: 0.6281
 epoch: 90, train_loss: 0.2501, test_loss: 1.4726, test_f1: 0.6384
 epoch: 91, train_loss: 0.2378, test_loss: 1.7206, test_f1: 0.5603
 epoch: 92, train_loss: 0.2575, test_loss: 1.4067, test_f1: 0.6571
 epoch: 93, train_loss: 0.2608, test_loss: 1.6734, test_f1: 0.6372
 epoch: 94, train_loss: 0.2553, test_loss: 1.7035, test_f1: 0.6179
 epoch: 95, train_loss: 0.2532, test_loss: 1.6466, test_f1: 0.6122
 epoch: 96, train_loss: 0.2406, test_loss: 1.4996, test_f1: 0.6499
 epoch: 97, train_loss: 0.2384, test_loss: 1.5282, test_f1: 0.6489
 epoch: 98, train_loss: 0.2302, test_loss: 1.8107, test_f1: 0.6039
 epoch: 99, train_loss: 0.2450, test_loss: 1.5674, test_f1: 0.6235
##################ITERATION #4 ****************************************
 epoch: 0, train_loss: 1.2053, test_loss: 1.3089, test_f1: 0.2427
 epoch: 1, train_loss: 1.0466, test_loss: 1.0376, test_f1: 0.3941
 epoch: 2, train_loss: 0.9616, test_loss: 0.9826, test_f1: 0.4663
 epoch: 3, train_loss: 0.9384, test_loss: 0.9241, test_f1: 0.5151
 epoch: 4, train_loss: 0.8982, test_loss: 0.9455, test_f1: 0.5245
 epoch: 5, train_loss: 0.8737, test_loss: 0.8822, test_f1: 0.5486
 epoch: 6, train_loss: 0.8468, test_loss: 0.8833, test_f1: 0.5445
 epoch: 7, train_loss: 0.8267, test_loss: 0.8678, test_f1: 0.5750
 epoch: 8, train_loss: 0.8130, test_loss: 0.8687, test_f1: 0.5583
 epoch: 9, train_loss: 0.8073, test_loss: 0.9558, test_f1: 0.5145
 epoch: 10, train_loss: 0.7881, test_loss: 0.8233, test_f1: 0.5837
 epoch: 11, train_loss: 0.7550, test_loss: 0.8459, test_f1: 0.5863
 epoch: 12, train_loss: 0.7405, test_loss: 0.8328, test_f1: 0.5616
 epoch: 13, train_loss: 0.7249, test_loss: 0.8524, test_f1: 0.5832
 epoch: 14, train_loss: 0.7203, test_loss: 0.8022, test_f1: 0.5779
 epoch: 15, train_loss: 0.7024, test_loss: 0.7983, test_f1: 0.5928
 epoch: 16, train_loss: 0.6979, test_loss: 0.8556, test_f1: 0.5774
 epoch: 17, train_loss: 0.6871, test_loss: 0.7989, test_f1: 0.6063
 epoch: 18, train_loss: 0.6752, test_loss: 0.8786, test_f1: 0.5960
 epoch: 19, train_loss: 0.6555, test_loss: 0.7824, test_f1: 0.6221
 epoch: 20, train_loss: 0.6399, test_loss: 0.7943, test_f1: 0.5873
 epoch: 21, train_loss: 0.6311, test_loss: 0.8232, test_f1: 0.5915
 epoch: 22, train_loss: 0.6401, test_loss: 0.8111, test_f1: 0.6170
 epoch: 23, train_loss: 0.6159, test_loss: 0.8147, test_f1: 0.6081
 epoch: 24, train_loss: 0.6053, test_loss: 0.8286, test_f1: 0.6153
 epoch: 25, train_loss: 0.5935, test_loss: 0.8137, test_f1: 0.6218
 epoch: 26, train_loss: 0.5757, test_loss: 0.9166, test_f1: 0.6112
 epoch: 27, train_loss: 0.5864, test_loss: 0.8601, test_f1: 0.6335
 epoch: 28, train_loss: 0.5702, test_loss: 0.9451, test_f1: 0.6216
 epoch: 29, train_loss: 0.5579, test_loss: 0.8642, test_f1: 0.6198
 epoch: 30, train_loss: 0.5458, test_loss: 0.8225, test_f1: 0.6266
 epoch: 31, train_loss: 0.5527, test_loss: 0.9154, test_f1: 0.6040
 epoch: 32, train_loss: 0.5364, test_loss: 0.8102, test_f1: 0.6378
 epoch: 33, train_loss: 0.5271, test_loss: 1.0492, test_f1: 0.5759
 epoch: 34, train_loss: 0.5210, test_loss: 0.8294, test_f1: 0.6290
 epoch: 35, train_loss: 0.5227, test_loss: 0.8298, test_f1: 0.6409
 epoch: 36, train_loss: 0.4955, test_loss: 0.8310, test_f1: 0.6436
 epoch: 37, train_loss: 0.4998, test_loss: 0.9687, test_f1: 0.6266
 epoch: 38, train_loss: 0.4883, test_loss: 0.7839, test_f1: 0.6521
 epoch: 39, train_loss: 0.4924, test_loss: 0.9770, test_f1: 0.6251
 epoch: 40, train_loss: 0.4691, test_loss: 0.8681, test_f1: 0.6532
 epoch: 41, train_loss: 0.4838, test_loss: 0.8902, test_f1: 0.6572
 epoch: 42, train_loss: 0.4702, test_loss: 0.9645, test_f1: 0.6346
 epoch: 43, train_loss: 0.4471, test_loss: 0.9504, test_f1: 0.6284
 epoch: 44, train_loss: 0.4415, test_loss: 0.9664, test_f1: 0.6289
 epoch: 45, train_loss: 0.4473, test_loss: 0.9324, test_f1: 0.6433
 epoch: 46, train_loss: 0.4495, test_loss: 0.9792, test_f1: 0.6539
 epoch: 47, train_loss: 0.4524, test_loss: 0.9274, test_f1: 0.6484
 epoch: 48, train_loss: 0.4235, test_loss: 1.0094, test_f1: 0.6471
 epoch: 49, train_loss: 0.4173, test_loss: 0.9150, test_f1: 0.6357
 epoch: 50, train_loss: 0.4086, test_loss: 1.2404, test_f1: 0.6105
 epoch: 51, train_loss: 0.3818, test_loss: 0.9464, test_f1: 0.6604
 epoch: 52, train_loss: 0.3607, test_loss: 0.9356, test_f1: 0.6598
 epoch: 53, train_loss: 0.3479, test_loss: 1.0080, test_f1: 0.6516
 epoch: 54, train_loss: 0.3407, test_loss: 1.0089, test_f1: 0.6343
 epoch: 55, train_loss: 0.3176, test_loss: 1.0465, test_f1: 0.6461
 epoch: 56, train_loss: 0.3173, test_loss: 0.9785, test_f1: 0.6717
 epoch: 57, train_loss: 0.2998, test_loss: 1.2077, test_f1: 0.6231
 epoch: 58, train_loss: 0.3209, test_loss: 1.0144, test_f1: 0.6550
 epoch: 59, train_loss: 0.3088, test_loss: 1.1167, test_f1: 0.6453
 epoch: 60, train_loss: 0.3220, test_loss: 1.1062, test_f1: 0.6389
 epoch: 61, train_loss: 0.2973, test_loss: 1.0401, test_f1: 0.6569
 epoch: 62, train_loss: 0.2927, test_loss: 1.0785, test_f1: 0.6515
 epoch: 63, train_loss: 0.3039, test_loss: 1.1032, test_f1: 0.6536
 epoch: 64, train_loss: 0.2883, test_loss: 1.0885, test_f1: 0.6675
 epoch: 65, train_loss: 0.2952, test_loss: 1.1327, test_f1: 0.6723
 epoch: 66, train_loss: 0.2979, test_loss: 1.0716, test_f1: 0.6496
 epoch: 67, train_loss: 0.2920, test_loss: 1.1257, test_f1: 0.6348
 epoch: 68, train_loss: 0.2807, test_loss: 1.1980, test_f1: 0.6582
 epoch: 69, train_loss: 0.2964, test_loss: 1.2189, test_f1: 0.6477
 epoch: 70, train_loss: 0.2646, test_loss: 1.1097, test_f1: 0.6580
 epoch: 71, train_loss: 0.2666, test_loss: 1.0570, test_f1: 0.6563
 epoch: 72, train_loss: 0.2611, test_loss: 1.3137, test_f1: 0.6525
 epoch: 73, train_loss: 0.2868, test_loss: 1.1582, test_f1: 0.6447
 epoch: 74, train_loss: 0.2636, test_loss: 1.2437, test_f1: 0.6593
 epoch: 75, train_loss: 0.2681, test_loss: 1.1648, test_f1: 0.6488
 epoch: 76, train_loss: 0.2712, test_loss: 1.5097, test_f1: 0.6046
 epoch: 77, train_loss: 0.2462, test_loss: 1.2435, test_f1: 0.6417
 epoch: 78, train_loss: 0.2637, test_loss: 1.2769, test_f1: 0.6199
 epoch: 79, train_loss: 0.2510, test_loss: 1.1912, test_f1: 0.6492
 epoch: 80, train_loss: 0.2470, test_loss: 1.2535, test_f1: 0.6594
 epoch: 81, train_loss: 0.2406, test_loss: 1.2466, test_f1: 0.6487
 epoch: 82, train_loss: 0.2467, test_loss: 1.1913, test_f1: 0.6390
 epoch: 83, train_loss: 0.2267, test_loss: 1.3973, test_f1: 0.6422
 epoch: 84, train_loss: 0.2369, test_loss: 1.1863, test_f1: 0.6777
 epoch: 85, train_loss: 0.2575, test_loss: 1.1931, test_f1: 0.6677
 epoch: 86, train_loss: 0.2490, test_loss: 1.2401, test_f1: 0.6693
 epoch: 87, train_loss: 0.2252, test_loss: 1.3189, test_f1: 0.6558
 epoch: 88, train_loss: 0.2561, test_loss: 1.2880, test_f1: 0.6807
 epoch: 89, train_loss: 0.2311, test_loss: 1.3125, test_f1: 0.6604
 epoch: 90, train_loss: 0.2341, test_loss: 1.2799, test_f1: 0.6758
 epoch: 91, train_loss: 0.2378, test_loss: 1.3118, test_f1: 0.6658
 epoch: 92, train_loss: 0.2164, test_loss: 1.3909, test_f1: 0.6353
 epoch: 93, train_loss: 0.2130, test_loss: 1.4699, test_f1: 0.6556
 epoch: 94, train_loss: 0.2204, test_loss: 1.3936, test_f1: 0.6705
 epoch: 95, train_loss: 0.2257, test_loss: 1.4418, test_f1: 0.6412
 epoch: 96, train_loss: 0.2031, test_loss: 1.3723, test_f1: 0.6637
 epoch: 97, train_loss: 0.1976, test_loss: 1.4623, test_f1: 0.6457
 epoch: 98, train_loss: 0.2145, test_loss: 1.2594, test_f1: 0.6860
 epoch: 99, train_loss: 0.2112, test_loss: 1.3681, test_f1: 0.6674
##################ITERATION #5 ****************************************
 epoch: 0, train_loss: 1.2836, test_loss: 1.2249, test_f1: 0.2566
 epoch: 1, train_loss: 1.0476, test_loss: 1.0053, test_f1: 0.4743
 epoch: 2, train_loss: 0.9814, test_loss: 1.0037, test_f1: 0.4956
 epoch: 3, train_loss: 0.9544, test_loss: 0.9300, test_f1: 0.5547
 epoch: 4, train_loss: 0.9096, test_loss: 0.9292, test_f1: 0.5326
 epoch: 5, train_loss: 0.8773, test_loss: 0.9231, test_f1: 0.5668
 epoch: 6, train_loss: 0.8582, test_loss: 0.9074, test_f1: 0.5384
 epoch: 7, train_loss: 0.8437, test_loss: 0.8686, test_f1: 0.5724
 epoch: 8, train_loss: 0.8181, test_loss: 0.9086, test_f1: 0.5589
 epoch: 9, train_loss: 0.8094, test_loss: 0.8845, test_f1: 0.5904
 epoch: 10, train_loss: 0.7927, test_loss: 0.8792, test_f1: 0.5854
 epoch: 11, train_loss: 0.7837, test_loss: 0.8783, test_f1: 0.5702
 epoch: 12, train_loss: 0.7496, test_loss: 0.8745, test_f1: 0.6000
 epoch: 13, train_loss: 0.7505, test_loss: 0.8412, test_f1: 0.6370
 epoch: 14, train_loss: 0.7125, test_loss: 0.8276, test_f1: 0.6049
 epoch: 15, train_loss: 0.7184, test_loss: 0.8239, test_f1: 0.6145
 epoch: 16, train_loss: 0.7055, test_loss: 0.8242, test_f1: 0.6480
 epoch: 17, train_loss: 0.6968, test_loss: 0.7857, test_f1: 0.6531
 epoch: 18, train_loss: 0.6825, test_loss: 0.8102, test_f1: 0.6497
 epoch: 19, train_loss: 0.6790, test_loss: 0.8313, test_f1: 0.6368
 epoch: 20, train_loss: 0.6649, test_loss: 0.8764, test_f1: 0.6314
 epoch: 21, train_loss: 0.6479, test_loss: 0.7955, test_f1: 0.6553
 epoch: 22, train_loss: 0.6346, test_loss: 0.7444, test_f1: 0.6356
 epoch: 23, train_loss: 0.6181, test_loss: 0.8437, test_f1: 0.6398
 epoch: 24, train_loss: 0.6211, test_loss: 0.7956, test_f1: 0.6297
 epoch: 25, train_loss: 0.6196, test_loss: 0.7444, test_f1: 0.6335
 epoch: 26, train_loss: 0.6189, test_loss: 0.8439, test_f1: 0.6469
 epoch: 27, train_loss: 0.6245, test_loss: 0.7458, test_f1: 0.6516
 epoch: 28, train_loss: 0.6081, test_loss: 0.7573, test_f1: 0.6523
 epoch: 29, train_loss: 0.5925, test_loss: 0.8874, test_f1: 0.6587
 epoch: 30, train_loss: 0.5802, test_loss: 0.7526, test_f1: 0.6731
 epoch: 31, train_loss: 0.5637, test_loss: 0.7339, test_f1: 0.6751
 epoch: 32, train_loss: 0.5446, test_loss: 0.8074, test_f1: 0.6422
 epoch: 33, train_loss: 0.5340, test_loss: 0.8274, test_f1: 0.6680
 epoch: 34, train_loss: 0.5076, test_loss: 0.9015, test_f1: 0.6446
 epoch: 35, train_loss: 0.5364, test_loss: 0.7979, test_f1: 0.6888
 epoch: 36, train_loss: 0.5303, test_loss: 0.7670, test_f1: 0.6616
 epoch: 37, train_loss: 0.5318, test_loss: 0.8518, test_f1: 0.6593
 epoch: 38, train_loss: 0.5192, test_loss: 0.7812, test_f1: 0.6837
 epoch: 39, train_loss: 0.4962, test_loss: 0.8487, test_f1: 0.6620
 epoch: 40, train_loss: 0.4962, test_loss: 0.7783, test_f1: 0.7115
 epoch: 41, train_loss: 0.5059, test_loss: 0.7757, test_f1: 0.6852
 epoch: 42, train_loss: 0.4795, test_loss: 0.8311, test_f1: 0.6566
 epoch: 43, train_loss: 0.4680, test_loss: 0.8355, test_f1: 0.6578
 epoch: 44, train_loss: 0.4404, test_loss: 0.8332, test_f1: 0.6609
 epoch: 45, train_loss: 0.4705, test_loss: 0.9233, test_f1: 0.6637
 epoch: 46, train_loss: 0.4292, test_loss: 0.7718, test_f1: 0.7080
 epoch: 47, train_loss: 0.4231, test_loss: 0.8271, test_f1: 0.6876
 epoch: 48, train_loss: 0.4350, test_loss: 0.8120, test_f1: 0.6640
 epoch: 49, train_loss: 0.4212, test_loss: 0.8172, test_f1: 0.6720
 epoch: 50, train_loss: 0.4216, test_loss: 0.9729, test_f1: 0.5993
 epoch: 51, train_loss: 0.4053, test_loss: 0.8254, test_f1: 0.7077
 epoch: 52, train_loss: 0.3766, test_loss: 0.8546, test_f1: 0.6622
 epoch: 53, train_loss: 0.3596, test_loss: 0.8650, test_f1: 0.6904
 epoch: 54, train_loss: 0.3387, test_loss: 0.9232, test_f1: 0.6801
 epoch: 55, train_loss: 0.3502, test_loss: 0.9105, test_f1: 0.6891
 epoch: 56, train_loss: 0.3480, test_loss: 0.8616, test_f1: 0.7077
 epoch: 57, train_loss: 0.3295, test_loss: 0.9177, test_f1: 0.6985
 epoch: 58, train_loss: 0.3338, test_loss: 0.9585, test_f1: 0.6657
 epoch: 59, train_loss: 0.3154, test_loss: 0.9711, test_f1: 0.6878
 epoch: 60, train_loss: 0.3152, test_loss: 0.8987, test_f1: 0.6711
 epoch: 61, train_loss: 0.3204, test_loss: 1.0196, test_f1: 0.6797
 epoch: 62, train_loss: 0.3021, test_loss: 1.0256, test_f1: 0.6722
 epoch: 63, train_loss: 0.3176, test_loss: 1.0367, test_f1: 0.6773
 epoch: 64, train_loss: 0.3268, test_loss: 0.9237, test_f1: 0.6976
 epoch: 65, train_loss: 0.3055, test_loss: 0.8543, test_f1: 0.6918
 epoch: 66, train_loss: 0.3033, test_loss: 0.9125, test_f1: 0.6787
 epoch: 67, train_loss: 0.2945, test_loss: 0.9091, test_f1: 0.7000
 epoch: 68, train_loss: 0.2805, test_loss: 0.9908, test_f1: 0.7075
 epoch: 69, train_loss: 0.2937, test_loss: 0.9959, test_f1: 0.7098
 epoch: 70, train_loss: 0.2948, test_loss: 0.9374, test_f1: 0.6933
 epoch: 71, train_loss: 0.2679, test_loss: 1.0008, test_f1: 0.6885
 epoch: 72, train_loss: 0.2678, test_loss: 1.0134, test_f1: 0.6687
 epoch: 73, train_loss: 0.2718, test_loss: 1.0195, test_f1: 0.7113
 epoch: 74, train_loss: 0.2736, test_loss: 1.0517, test_f1: 0.6867
 epoch: 75, train_loss: 0.2825, test_loss: 0.9934, test_f1: 0.6838
 epoch: 76, train_loss: 0.2646, test_loss: 1.0372, test_f1: 0.6982
 epoch: 77, train_loss: 0.2530, test_loss: 1.0265, test_f1: 0.6900
 epoch: 78, train_loss: 0.2709, test_loss: 0.9635, test_f1: 0.7146
 epoch: 79, train_loss: 0.2597, test_loss: 1.0091, test_f1: 0.6840
 epoch: 80, train_loss: 0.2535, test_loss: 0.9903, test_f1: 0.6833
 epoch: 81, train_loss: 0.2721, test_loss: 1.0608, test_f1: 0.6919
 epoch: 82, train_loss: 0.2471, test_loss: 1.0535, test_f1: 0.6979
 epoch: 83, train_loss: 0.2451, test_loss: 1.0210, test_f1: 0.7071
 epoch: 84, train_loss: 0.2706, test_loss: 1.0203, test_f1: 0.6794
 epoch: 85, train_loss: 0.2315, test_loss: 1.1359, test_f1: 0.7088
 epoch: 86, train_loss: 0.2499, test_loss: 1.0953, test_f1: 0.6871
 epoch: 87, train_loss: 0.2403, test_loss: 1.1058, test_f1: 0.6823
 epoch: 88, train_loss: 0.2438, test_loss: 0.9518, test_f1: 0.7036
 epoch: 89, train_loss: 0.2437, test_loss: 1.1290, test_f1: 0.6884
 epoch: 90, train_loss: 0.2482, test_loss: 1.1374, test_f1: 0.6983
 epoch: 91, train_loss: 0.2301, test_loss: 1.1790, test_f1: 0.6914
 epoch: 92, train_loss: 0.2357, test_loss: 1.0075, test_f1: 0.7015
 epoch: 93, train_loss: 0.2221, test_loss: 1.2390, test_f1: 0.6868
 epoch: 94, train_loss: 0.2282, test_loss: 1.1100, test_f1: 0.7015
 epoch: 95, train_loss: 0.2196, test_loss: 1.3370, test_f1: 0.6853
 epoch: 96, train_loss: 0.2253, test_loss: 1.3480, test_f1: 0.6840
 epoch: 97, train_loss: 0.2314, test_loss: 1.0579, test_f1: 0.7102
 epoch: 98, train_loss: 0.2125, test_loss: 1.0937, test_f1: 0.6916
 epoch: 99, train_loss: 0.2091, test_loss: 1.1001, test_f1: 0.7031
##################ITERATION #6 ****************************************
 epoch: 0, train_loss: 1.2674, test_loss: 1.2373, test_f1: 0.2574
 epoch: 1, train_loss: 1.0602, test_loss: 1.0078, test_f1: 0.4936
 epoch: 2, train_loss: 1.0090, test_loss: 0.9934, test_f1: 0.5013
 epoch: 3, train_loss: 0.9614, test_loss: 1.0232, test_f1: 0.4423
 epoch: 4, train_loss: 0.9212, test_loss: 0.9535, test_f1: 0.5090
 epoch: 5, train_loss: 0.9039, test_loss: 1.0484, test_f1: 0.4769
 epoch: 6, train_loss: 0.8883, test_loss: 0.9732, test_f1: 0.5214
 epoch: 7, train_loss: 0.8577, test_loss: 0.9080, test_f1: 0.5649
 epoch: 8, train_loss: 0.8394, test_loss: 0.8505, test_f1: 0.5733
 epoch: 9, train_loss: 0.8410, test_loss: 0.8723, test_f1: 0.5825
 epoch: 10, train_loss: 0.8115, test_loss: 0.9474, test_f1: 0.5842
 epoch: 11, train_loss: 0.8119, test_loss: 0.8669, test_f1: 0.5990
 epoch: 12, train_loss: 0.7741, test_loss: 0.8393, test_f1: 0.6171
 epoch: 13, train_loss: 0.7778, test_loss: 0.8400, test_f1: 0.6069
 epoch: 14, train_loss: 0.7674, test_loss: 0.8504, test_f1: 0.6149
 epoch: 15, train_loss: 0.7573, test_loss: 0.9604, test_f1: 0.5979
 epoch: 16, train_loss: 0.7297, test_loss: 0.8891, test_f1: 0.5977
 epoch: 17, train_loss: 0.7152, test_loss: 0.8767, test_f1: 0.5875
 epoch: 18, train_loss: 0.7352, test_loss: 0.8749, test_f1: 0.6134
 epoch: 19, train_loss: 0.7068, test_loss: 0.9402, test_f1: 0.5868
 epoch: 20, train_loss: 0.6970, test_loss: 0.9228, test_f1: 0.6082
 epoch: 21, train_loss: 0.6876, test_loss: 0.8565, test_f1: 0.5958
 epoch: 22, train_loss: 0.6708, test_loss: 0.8703, test_f1: 0.6021
 epoch: 23, train_loss: 0.6698, test_loss: 1.0060, test_f1: 0.5859
 epoch: 24, train_loss: 0.6491, test_loss: 0.7971, test_f1: 0.6386
 epoch: 25, train_loss: 0.6410, test_loss: 0.8255, test_f1: 0.6262
 epoch: 26, train_loss: 0.6494, test_loss: 0.8314, test_f1: 0.5986
 epoch: 27, train_loss: 0.6270, test_loss: 0.7915, test_f1: 0.6473
 epoch: 28, train_loss: 0.6413, test_loss: 0.9993, test_f1: 0.5770
 epoch: 29, train_loss: 0.6464, test_loss: 0.8230, test_f1: 0.6120
 epoch: 30, train_loss: 0.6125, test_loss: 0.8926, test_f1: 0.5931
 epoch: 31, train_loss: 0.5957, test_loss: 0.8339, test_f1: 0.6497
 epoch: 32, train_loss: 0.6033, test_loss: 0.8409, test_f1: 0.6267
 epoch: 33, train_loss: 0.5959, test_loss: 0.8523, test_f1: 0.6206
 epoch: 34, train_loss: 0.5884, test_loss: 0.8634, test_f1: 0.6212
 epoch: 35, train_loss: 0.5826, test_loss: 0.8072, test_f1: 0.6473
 epoch: 36, train_loss: 0.5742, test_loss: 0.9168, test_f1: 0.6191
 epoch: 37, train_loss: 0.5733, test_loss: 0.8407, test_f1: 0.6354
 epoch: 38, train_loss: 0.5628, test_loss: 0.8021, test_f1: 0.6331
 epoch: 39, train_loss: 0.5461, test_loss: 0.8722, test_f1: 0.6400
 epoch: 40, train_loss: 0.5466, test_loss: 0.8625, test_f1: 0.6493
 epoch: 41, train_loss: 0.5428, test_loss: 0.7896, test_f1: 0.6418
 epoch: 42, train_loss: 0.5267, test_loss: 0.8385, test_f1: 0.6576
 epoch: 43, train_loss: 0.5262, test_loss: 0.9465, test_f1: 0.5708
 epoch: 44, train_loss: 0.5426, test_loss: 0.9064, test_f1: 0.6355
 epoch: 45, train_loss: 0.5054, test_loss: 0.8459, test_f1: 0.6377
 epoch: 46, train_loss: 0.5141, test_loss: 0.8404, test_f1: 0.6485
 epoch: 47, train_loss: 0.4999, test_loss: 0.8317, test_f1: 0.6599
 epoch: 48, train_loss: 0.4923, test_loss: 0.8996, test_f1: 0.6242
 epoch: 49, train_loss: 0.4889, test_loss: 0.8094, test_f1: 0.6534
 epoch: 50, train_loss: 0.5038, test_loss: 0.8925, test_f1: 0.6331
 epoch: 51, train_loss: 0.4483, test_loss: 0.7811, test_f1: 0.6794
 epoch: 52, train_loss: 0.4377, test_loss: 0.8060, test_f1: 0.6703
 epoch: 53, train_loss: 0.4148, test_loss: 0.8333, test_f1: 0.6531
 epoch: 54, train_loss: 0.4153, test_loss: 0.8438, test_f1: 0.6640
 epoch: 55, train_loss: 0.4146, test_loss: 0.8504, test_f1: 0.6535
 epoch: 56, train_loss: 0.4151, test_loss: 0.8596, test_f1: 0.6594
 epoch: 57, train_loss: 0.3905, test_loss: 0.8440, test_f1: 0.6568
 epoch: 58, train_loss: 0.3874, test_loss: 0.8721, test_f1: 0.6704
 epoch: 59, train_loss: 0.4209, test_loss: 0.8615, test_f1: 0.6567
 epoch: 60, train_loss: 0.3813, test_loss: 0.8147, test_f1: 0.6698
 epoch: 61, train_loss: 0.3885, test_loss: 0.9183, test_f1: 0.6513
 epoch: 62, train_loss: 0.3891, test_loss: 0.8596, test_f1: 0.6683
 epoch: 63, train_loss: 0.3709, test_loss: 0.8890, test_f1: 0.6545
 epoch: 64, train_loss: 0.3753, test_loss: 0.8851, test_f1: 0.6587
 epoch: 65, train_loss: 0.3552, test_loss: 0.8199, test_f1: 0.6736
 epoch: 66, train_loss: 0.3808, test_loss: 0.8378, test_f1: 0.6883
 epoch: 67, train_loss: 0.3783, test_loss: 0.8416, test_f1: 0.6719
 epoch: 68, train_loss: 0.3646, test_loss: 0.8780, test_f1: 0.6700
 epoch: 69, train_loss: 0.3594, test_loss: 0.9818, test_f1: 0.6346
 epoch: 70, train_loss: 0.3546, test_loss: 0.8213, test_f1: 0.6958
 epoch: 71, train_loss: 0.3504, test_loss: 0.9347, test_f1: 0.6519
 epoch: 72, train_loss: 0.3576, test_loss: 1.0093, test_f1: 0.6177
 epoch: 73, train_loss: 0.3343, test_loss: 0.9265, test_f1: 0.6580
 epoch: 74, train_loss: 0.3311, test_loss: 0.9698, test_f1: 0.6393
 epoch: 75, train_loss: 0.3450, test_loss: 0.9790, test_f1: 0.6446
 epoch: 76, train_loss: 0.3380, test_loss: 0.9043, test_f1: 0.6596
 epoch: 77, train_loss: 0.3428, test_loss: 0.9472, test_f1: 0.6681
 epoch: 78, train_loss: 0.3211, test_loss: 1.0412, test_f1: 0.6409
 epoch: 79, train_loss: 0.3517, test_loss: 0.9609, test_f1: 0.6596
 epoch: 80, train_loss: 0.3439, test_loss: 1.1007, test_f1: 0.6251
 epoch: 81, train_loss: 0.3190, test_loss: 0.8762, test_f1: 0.6722
 epoch: 82, train_loss: 0.3175, test_loss: 0.9157, test_f1: 0.6650
 epoch: 83, train_loss: 0.3116, test_loss: 1.1090, test_f1: 0.6293
 epoch: 84, train_loss: 0.3205, test_loss: 0.8898, test_f1: 0.7032
 epoch: 85, train_loss: 0.3031, test_loss: 1.0041, test_f1: 0.6520
 epoch: 86, train_loss: 0.3044, test_loss: 1.1370, test_f1: 0.6292
 epoch: 87, train_loss: 0.3184, test_loss: 0.9997, test_f1: 0.6496
 epoch: 88, train_loss: 0.3243, test_loss: 0.9132, test_f1: 0.6745
 epoch: 89, train_loss: 0.3083, test_loss: 1.0185, test_f1: 0.6385
 epoch: 90, train_loss: 0.3101, test_loss: 0.9060, test_f1: 0.6625
 epoch: 91, train_loss: 0.3166, test_loss: 1.0039, test_f1: 0.6712
 epoch: 92, train_loss: 0.3097, test_loss: 1.0302, test_f1: 0.6469
 epoch: 93, train_loss: 0.2901, test_loss: 1.0539, test_f1: 0.6545
 epoch: 94, train_loss: 0.3131, test_loss: 0.9661, test_f1: 0.6634
 epoch: 95, train_loss: 0.3136, test_loss: 0.9638, test_f1: 0.6544
 epoch: 96, train_loss: 0.2878, test_loss: 0.9628, test_f1: 0.6639
 epoch: 97, train_loss: 0.2869, test_loss: 0.9421, test_f1: 0.6619
 epoch: 98, train_loss: 0.2893, test_loss: 1.0617, test_f1: 0.6448
 epoch: 99, train_loss: 0.2650, test_loss: 1.0182, test_f1: 0.6550
##################ITERATION #7 ****************************************
 epoch: 0, train_loss: 1.4400, test_loss: 1.3224, test_f1: 0.3173
 epoch: 1, train_loss: 1.0711, test_loss: 1.0827, test_f1: 0.4458
 epoch: 2, train_loss: 1.0101, test_loss: 0.9773, test_f1: 0.5007
 epoch: 3, train_loss: 0.9737, test_loss: 0.9443, test_f1: 0.5290
 epoch: 4, train_loss: 0.9488, test_loss: 0.9505, test_f1: 0.5374
 epoch: 5, train_loss: 0.9098, test_loss: 0.9468, test_f1: 0.5641
 epoch: 6, train_loss: 0.8843, test_loss: 0.9140, test_f1: 0.5782
 epoch: 7, train_loss: 0.8668, test_loss: 0.9365, test_f1: 0.5539
 epoch: 8, train_loss: 0.8503, test_loss: 0.9048, test_f1: 0.5744
 epoch: 9, train_loss: 0.8302, test_loss: 0.8993, test_f1: 0.5838
 epoch: 10, train_loss: 0.8218, test_loss: 0.9105, test_f1: 0.5569
 epoch: 11, train_loss: 0.7938, test_loss: 0.8712, test_f1: 0.6066
 epoch: 12, train_loss: 0.7804, test_loss: 0.9635, test_f1: 0.5845
 epoch: 13, train_loss: 0.7563, test_loss: 0.9361, test_f1: 0.5825
 epoch: 14, train_loss: 0.7355, test_loss: 0.9554, test_f1: 0.5927
 epoch: 15, train_loss: 0.7527, test_loss: 0.8696, test_f1: 0.5959
 epoch: 16, train_loss: 0.7329, test_loss: 0.9582, test_f1: 0.5832
 epoch: 17, train_loss: 0.7045, test_loss: 1.1240, test_f1: 0.5695
 epoch: 18, train_loss: 0.7057, test_loss: 0.9067, test_f1: 0.5834
 epoch: 19, train_loss: 0.6631, test_loss: 0.9012, test_f1: 0.5944
 epoch: 20, train_loss: 0.6545, test_loss: 0.9717, test_f1: 0.6333
 epoch: 21, train_loss: 0.6575, test_loss: 0.9012, test_f1: 0.5973
 epoch: 22, train_loss: 0.6540, test_loss: 0.9789, test_f1: 0.5805
 epoch: 23, train_loss: 0.6285, test_loss: 0.8989, test_f1: 0.6436
 epoch: 24, train_loss: 0.6286, test_loss: 0.9684, test_f1: 0.6148
 epoch: 25, train_loss: 0.6183, test_loss: 0.9160, test_f1: 0.6300
 epoch: 26, train_loss: 0.6048, test_loss: 0.8488, test_f1: 0.6353
 epoch: 27, train_loss: 0.5869, test_loss: 0.8285, test_f1: 0.6413
 epoch: 28, train_loss: 0.5890, test_loss: 0.8426, test_f1: 0.6240
 epoch: 29, train_loss: 0.5808, test_loss: 0.8703, test_f1: 0.6414
 epoch: 30, train_loss: 0.5637, test_loss: 1.0078, test_f1: 0.5906
 epoch: 31, train_loss: 0.5823, test_loss: 0.8610, test_f1: 0.6418
 epoch: 32, train_loss: 0.5669, test_loss: 0.8835, test_f1: 0.6403
 epoch: 33, train_loss: 0.5567, test_loss: 0.9666, test_f1: 0.6254
 epoch: 34, train_loss: 0.5428, test_loss: 0.9026, test_f1: 0.6287
 epoch: 35, train_loss: 0.5261, test_loss: 0.8626, test_f1: 0.6514
 epoch: 36, train_loss: 0.5142, test_loss: 0.9451, test_f1: 0.6511
 epoch: 37, train_loss: 0.5196, test_loss: 0.9282, test_f1: 0.6399
 epoch: 38, train_loss: 0.5105, test_loss: 0.9165, test_f1: 0.6253
 epoch: 39, train_loss: 0.4961, test_loss: 1.0122, test_f1: 0.6178
 epoch: 40, train_loss: 0.5063, test_loss: 0.9775, test_f1: 0.6309
 epoch: 41, train_loss: 0.4966, test_loss: 0.9795, test_f1: 0.6514
 epoch: 42, train_loss: 0.5049, test_loss: 1.0904, test_f1: 0.6111
 epoch: 43, train_loss: 0.4750, test_loss: 0.9410, test_f1: 0.6732
 epoch: 44, train_loss: 0.4723, test_loss: 1.0075, test_f1: 0.6154
 epoch: 45, train_loss: 0.4785, test_loss: 0.8823, test_f1: 0.6430
 epoch: 46, train_loss: 0.4630, test_loss: 0.9908, test_f1: 0.6288
 epoch: 47, train_loss: 0.4508, test_loss: 0.9946, test_f1: 0.6547
 epoch: 48, train_loss: 0.4484, test_loss: 0.8867, test_f1: 0.6535
 epoch: 49, train_loss: 0.4458, test_loss: 0.9675, test_f1: 0.6580
 epoch: 50, train_loss: 0.4457, test_loss: 1.0555, test_f1: 0.6533
 epoch: 51, train_loss: 0.4185, test_loss: 0.9595, test_f1: 0.6558
 epoch: 52, train_loss: 0.3847, test_loss: 0.9627, test_f1: 0.6696
 epoch: 53, train_loss: 0.3528, test_loss: 0.9933, test_f1: 0.6619
 epoch: 54, train_loss: 0.3537, test_loss: 0.9530, test_f1: 0.6490
 epoch: 55, train_loss: 0.3610, test_loss: 0.9994, test_f1: 0.6715
 epoch: 56, train_loss: 0.3375, test_loss: 1.0012, test_f1: 0.6787
 epoch: 57, train_loss: 0.3437, test_loss: 1.1275, test_f1: 0.6375
 epoch: 58, train_loss: 0.3546, test_loss: 1.0125, test_f1: 0.6485
 epoch: 59, train_loss: 0.3473, test_loss: 1.0938, test_f1: 0.6549
 epoch: 60, train_loss: 0.3280, test_loss: 1.0988, test_f1: 0.6604
 epoch: 61, train_loss: 0.3390, test_loss: 1.1175, test_f1: 0.6493
 epoch: 62, train_loss: 0.3388, test_loss: 1.1179, test_f1: 0.6462
 epoch: 63, train_loss: 0.3250, test_loss: 1.1712, test_f1: 0.6581
 epoch: 64, train_loss: 0.3149, test_loss: 1.1778, test_f1: 0.6544
 epoch: 65, train_loss: 0.3245, test_loss: 1.1886, test_f1: 0.6440
 epoch: 66, train_loss: 0.3117, test_loss: 1.1849, test_f1: 0.6517
 epoch: 67, train_loss: 0.3200, test_loss: 1.2690, test_f1: 0.6411
 epoch: 68, train_loss: 0.3138, test_loss: 1.2682, test_f1: 0.6354
 epoch: 69, train_loss: 0.3231, test_loss: 1.1449, test_f1: 0.6358
 epoch: 70, train_loss: 0.2989, test_loss: 1.1595, test_f1: 0.6449
 epoch: 71, train_loss: 0.3121, test_loss: 1.1761, test_f1: 0.6591
 epoch: 72, train_loss: 0.3047, test_loss: 1.1639, test_f1: 0.6703
 epoch: 73, train_loss: 0.2901, test_loss: 1.2607, test_f1: 0.6317
 epoch: 74, train_loss: 0.2867, test_loss: 1.1627, test_f1: 0.6547
 epoch: 75, train_loss: 0.2809, test_loss: 1.2736, test_f1: 0.6324
 epoch: 76, train_loss: 0.2640, test_loss: 1.2350, test_f1: 0.6635
 epoch: 77, train_loss: 0.2696, test_loss: 1.3324, test_f1: 0.6492
 epoch: 78, train_loss: 0.2777, test_loss: 1.1968, test_f1: 0.6653
 epoch: 79, train_loss: 0.2770, test_loss: 1.2083, test_f1: 0.6599
 epoch: 80, train_loss: 0.2800, test_loss: 1.2467, test_f1: 0.6584
 epoch: 81, train_loss: 0.2619, test_loss: 1.3032, test_f1: 0.6532
 epoch: 82, train_loss: 0.2701, test_loss: 1.2644, test_f1: 0.6420
 epoch: 83, train_loss: 0.2672, test_loss: 1.3151, test_f1: 0.6581
 epoch: 84, train_loss: 0.2458, test_loss: 1.4031, test_f1: 0.6328
 epoch: 85, train_loss: 0.2652, test_loss: 1.2984, test_f1: 0.6538
 epoch: 86, train_loss: 0.2697, test_loss: 1.4286, test_f1: 0.6449
 epoch: 87, train_loss: 0.2482, test_loss: 1.2600, test_f1: 0.6862
 epoch: 88, train_loss: 0.2660, test_loss: 1.4133, test_f1: 0.6737
 epoch: 89, train_loss: 0.2504, test_loss: 1.3082, test_f1: 0.6695
 epoch: 90, train_loss: 0.2655, test_loss: 1.2942, test_f1: 0.6818
 epoch: 91, train_loss: 0.2610, test_loss: 1.4822, test_f1: 0.6328
 epoch: 92, train_loss: 0.2446, test_loss: 1.3355, test_f1: 0.6512
 epoch: 93, train_loss: 0.2338, test_loss: 1.3934, test_f1: 0.6492
 epoch: 94, train_loss: 0.2428, test_loss: 1.2967, test_f1: 0.6786
 epoch: 95, train_loss: 0.2441, test_loss: 1.5105, test_f1: 0.6453
 epoch: 96, train_loss: 0.2328, test_loss: 1.4728, test_f1: 0.6328
 epoch: 97, train_loss: 0.2552, test_loss: 1.4938, test_f1: 0.6511
 epoch: 98, train_loss: 0.2391, test_loss: 1.3217, test_f1: 0.6609
 epoch: 99, train_loss: 0.2374, test_loss: 1.4424, test_f1: 0.6655
##################ITERATION #8 ****************************************
 epoch: 0, train_loss: 1.3121, test_loss: 1.2188, test_f1: 0.2336
 epoch: 1, train_loss: 1.0117, test_loss: 0.9962, test_f1: 0.4898
 epoch: 2, train_loss: 0.9623, test_loss: 0.9784, test_f1: 0.4853
 epoch: 3, train_loss: 0.9294, test_loss: 0.9684, test_f1: 0.5124
 epoch: 4, train_loss: 0.9040, test_loss: 0.9385, test_f1: 0.5169
 epoch: 5, train_loss: 0.8882, test_loss: 0.9894, test_f1: 0.5269
 epoch: 6, train_loss: 0.8620, test_loss: 0.9420, test_f1: 0.5474
 epoch: 7, train_loss: 0.8568, test_loss: 0.9866, test_f1: 0.5345
 epoch: 8, train_loss: 0.8249, test_loss: 0.9462, test_f1: 0.5481
 epoch: 9, train_loss: 0.8110, test_loss: 0.9628, test_f1: 0.5520
 epoch: 10, train_loss: 0.8049, test_loss: 0.9561, test_f1: 0.5384
 epoch: 11, train_loss: 0.7779, test_loss: 0.9468, test_f1: 0.5510
 epoch: 12, train_loss: 0.7644, test_loss: 0.9948, test_f1: 0.5376
 epoch: 13, train_loss: 0.7692, test_loss: 0.9554, test_f1: 0.5477
 epoch: 14, train_loss: 0.7473, test_loss: 1.0525, test_f1: 0.5235
 epoch: 15, train_loss: 0.7435, test_loss: 0.9314, test_f1: 0.5514
 epoch: 16, train_loss: 0.7292, test_loss: 0.9664, test_f1: 0.5854
 epoch: 17, train_loss: 0.7202, test_loss: 0.9596, test_f1: 0.5387
 epoch: 18, train_loss: 0.7107, test_loss: 0.9389, test_f1: 0.5670
 epoch: 19, train_loss: 0.6925, test_loss: 1.0375, test_f1: 0.5732
 epoch: 20, train_loss: 0.6916, test_loss: 0.9288, test_f1: 0.5856
 epoch: 21, train_loss: 0.6706, test_loss: 0.8832, test_f1: 0.6029
 epoch: 22, train_loss: 0.6542, test_loss: 0.9713, test_f1: 0.5688
 epoch: 23, train_loss: 0.6534, test_loss: 0.9237, test_f1: 0.5586
 epoch: 24, train_loss: 0.6551, test_loss: 1.1284, test_f1: 0.5423
 epoch: 25, train_loss: 0.6534, test_loss: 0.9039, test_f1: 0.5948
 epoch: 26, train_loss: 0.6095, test_loss: 0.9463, test_f1: 0.6136
 epoch: 27, train_loss: 0.6249, test_loss: 0.9001, test_f1: 0.6014
 epoch: 28, train_loss: 0.6073, test_loss: 0.9828, test_f1: 0.5647
 epoch: 29, train_loss: 0.6126, test_loss: 1.0264, test_f1: 0.5771
 epoch: 30, train_loss: 0.6138, test_loss: 0.9582, test_f1: 0.6081
 epoch: 31, train_loss: 0.6214, test_loss: 0.9242, test_f1: 0.5880
 epoch: 32, train_loss: 0.5653, test_loss: 0.9419, test_f1: 0.5847
 epoch: 33, train_loss: 0.5610, test_loss: 1.0646, test_f1: 0.5904
 epoch: 34, train_loss: 0.5515, test_loss: 0.9563, test_f1: 0.6031
 epoch: 35, train_loss: 0.5612, test_loss: 0.8859, test_f1: 0.6258
 epoch: 36, train_loss: 0.5588, test_loss: 1.0109, test_f1: 0.5863
 epoch: 37, train_loss: 0.5256, test_loss: 0.9198, test_f1: 0.6173
 epoch: 38, train_loss: 0.5266, test_loss: 0.9959, test_f1: 0.5966
 epoch: 39, train_loss: 0.5305, test_loss: 0.9675, test_f1: 0.6133
 epoch: 40, train_loss: 0.5162, test_loss: 0.9669, test_f1: 0.6067
 epoch: 41, train_loss: 0.5312, test_loss: 0.9606, test_f1: 0.6073
 epoch: 42, train_loss: 0.5154, test_loss: 0.9816, test_f1: 0.5711
 epoch: 43, train_loss: 0.5015, test_loss: 0.9536, test_f1: 0.6156
 epoch: 44, train_loss: 0.5261, test_loss: 1.0126, test_f1: 0.6329
 epoch: 45, train_loss: 0.5071, test_loss: 0.9409, test_f1: 0.6264
 epoch: 46, train_loss: 0.4779, test_loss: 0.9584, test_f1: 0.6178
 epoch: 47, train_loss: 0.5136, test_loss: 0.9998, test_f1: 0.5876
 epoch: 48, train_loss: 0.4799, test_loss: 1.0224, test_f1: 0.6197
 epoch: 49, train_loss: 0.4815, test_loss: 0.9565, test_f1: 0.6357
 epoch: 50, train_loss: 0.4759, test_loss: 0.9142, test_f1: 0.6536
 epoch: 51, train_loss: 0.4264, test_loss: 0.9144, test_f1: 0.6473
 epoch: 52, train_loss: 0.3945, test_loss: 1.0343, test_f1: 0.6477
 epoch: 53, train_loss: 0.3857, test_loss: 1.0418, test_f1: 0.6493
 epoch: 54, train_loss: 0.3888, test_loss: 1.0421, test_f1: 0.6312
 epoch: 55, train_loss: 0.3842, test_loss: 1.0059, test_f1: 0.6330
 epoch: 56, train_loss: 0.3861, test_loss: 1.0486, test_f1: 0.6382
 epoch: 57, train_loss: 0.3870, test_loss: 1.0246, test_f1: 0.6362
 epoch: 58, train_loss: 0.3811, test_loss: 1.0673, test_f1: 0.6336
 epoch: 59, train_loss: 0.3709, test_loss: 1.0179, test_f1: 0.6245
 epoch: 60, train_loss: 0.3683, test_loss: 1.0341, test_f1: 0.6663
 epoch: 61, train_loss: 0.3599, test_loss: 1.0211, test_f1: 0.6353
 epoch: 62, train_loss: 0.3795, test_loss: 1.0610, test_f1: 0.6477
 epoch: 63, train_loss: 0.3679, test_loss: 1.1015, test_f1: 0.6285
 epoch: 64, train_loss: 0.3524, test_loss: 1.0405, test_f1: 0.6390
 epoch: 65, train_loss: 0.3512, test_loss: 1.0351, test_f1: 0.6537
 epoch: 66, train_loss: 0.3461, test_loss: 1.0445, test_f1: 0.6393
 epoch: 67, train_loss: 0.3348, test_loss: 1.0460, test_f1: 0.6288
 epoch: 68, train_loss: 0.3318, test_loss: 1.1100, test_f1: 0.6560
 epoch: 69, train_loss: 0.3316, test_loss: 1.1754, test_f1: 0.6434
 epoch: 70, train_loss: 0.3436, test_loss: 1.1260, test_f1: 0.6428
 epoch: 71, train_loss: 0.3244, test_loss: 1.1186, test_f1: 0.6574
 epoch: 72, train_loss: 0.3359, test_loss: 1.0547, test_f1: 0.6547
 epoch: 73, train_loss: 0.3267, test_loss: 1.1370, test_f1: 0.6379
 epoch: 74, train_loss: 0.3125, test_loss: 1.1201, test_f1: 0.6272
 epoch: 75, train_loss: 0.3286, test_loss: 1.1776, test_f1: 0.6380
 epoch: 76, train_loss: 0.3145, test_loss: 1.2125, test_f1: 0.6155
 epoch: 77, train_loss: 0.3093, test_loss: 1.0967, test_f1: 0.6325
 epoch: 78, train_loss: 0.3037, test_loss: 1.1525, test_f1: 0.6084
 epoch: 79, train_loss: 0.3216, test_loss: 1.1094, test_f1: 0.6483
 epoch: 80, train_loss: 0.3032, test_loss: 1.3290, test_f1: 0.6093
 epoch: 81, train_loss: 0.3023, test_loss: 1.1878, test_f1: 0.6546
 epoch: 82, train_loss: 0.2965, test_loss: 1.1930, test_f1: 0.6374
 epoch: 83, train_loss: 0.2932, test_loss: 1.1847, test_f1: 0.6240
 epoch: 84, train_loss: 0.2808, test_loss: 1.1792, test_f1: 0.6395
 epoch: 85, train_loss: 0.2938, test_loss: 1.2003, test_f1: 0.6496
 epoch: 86, train_loss: 0.2970, test_loss: 1.1928, test_f1: 0.6278
 epoch: 87, train_loss: 0.2956, test_loss: 1.1723, test_f1: 0.6562
 epoch: 88, train_loss: 0.2750, test_loss: 1.1433, test_f1: 0.6424
 epoch: 89, train_loss: 0.2803, test_loss: 1.1952, test_f1: 0.6328
 epoch: 90, train_loss: 0.2783, test_loss: 1.1929, test_f1: 0.6795
 epoch: 91, train_loss: 0.2763, test_loss: 1.3142, test_f1: 0.6161
 epoch: 92, train_loss: 0.2915, test_loss: 1.2510, test_f1: 0.6580
 epoch: 93, train_loss: 0.2604, test_loss: 1.2759, test_f1: 0.6314
 epoch: 94, train_loss: 0.2684, test_loss: 1.2920, test_f1: 0.5968
 epoch: 95, train_loss: 0.2721, test_loss: 1.3724, test_f1: 0.6387
 epoch: 96, train_loss: 0.2668, test_loss: 1.2607, test_f1: 0.6247
 epoch: 97, train_loss: 0.2680, test_loss: 1.2922, test_f1: 0.6657
 epoch: 98, train_loss: 0.2769, test_loss: 1.2703, test_f1: 0.6469
 epoch: 99, train_loss: 0.2510, test_loss: 1.2946, test_f1: 0.6452
##################ITERATION #9 ****************************************
 epoch: 0, train_loss: 1.5911, test_loss: 1.4582, test_f1: 0.2376
 epoch: 1, train_loss: 1.1284, test_loss: 1.3194, test_f1: 0.3142
 epoch: 2, train_loss: 1.0506, test_loss: 0.9924, test_f1: 0.4737
 epoch: 3, train_loss: 0.9840, test_loss: 0.9296, test_f1: 0.5187
 epoch: 4, train_loss: 0.9574, test_loss: 0.9369, test_f1: 0.5359
 epoch: 5, train_loss: 0.9505, test_loss: 0.9579, test_f1: 0.5399
 epoch: 6, train_loss: 0.9079, test_loss: 0.9652, test_f1: 0.5571
 epoch: 7, train_loss: 0.9103, test_loss: 0.9434, test_f1: 0.5357
 epoch: 8, train_loss: 0.8893, test_loss: 0.9462, test_f1: 0.5324
 epoch: 9, train_loss: 0.8721, test_loss: 1.0193, test_f1: 0.5316
 epoch: 10, train_loss: 0.8566, test_loss: 0.9047, test_f1: 0.5569
 epoch: 11, train_loss: 0.8407, test_loss: 0.9125, test_f1: 0.5782
 epoch: 12, train_loss: 0.8364, test_loss: 0.8337, test_f1: 0.6007
 epoch: 13, train_loss: 0.8070, test_loss: 1.0280, test_f1: 0.5602
 epoch: 14, train_loss: 0.7872, test_loss: 0.8488, test_f1: 0.5791
 epoch: 15, train_loss: 0.8030, test_loss: 0.9811, test_f1: 0.5345
 epoch: 16, train_loss: 0.7881, test_loss: 0.8977, test_f1: 0.5576
 epoch: 17, train_loss: 0.7696, test_loss: 0.9642, test_f1: 0.5236
 epoch: 18, train_loss: 0.7705, test_loss: 0.8499, test_f1: 0.6272
 epoch: 19, train_loss: 0.7455, test_loss: 0.8998, test_f1: 0.6070
 epoch: 20, train_loss: 0.7258, test_loss: 0.8477, test_f1: 0.5942
 epoch: 21, train_loss: 0.7150, test_loss: 1.0881, test_f1: 0.5381
 epoch: 22, train_loss: 0.7258, test_loss: 0.9131, test_f1: 0.6083
 epoch: 23, train_loss: 0.7292, test_loss: 0.9269, test_f1: 0.5963
 epoch: 24, train_loss: 0.7211, test_loss: 1.0173, test_f1: 0.5798
 epoch: 25, train_loss: 0.6822, test_loss: 0.8498, test_f1: 0.6154
 epoch: 26, train_loss: 0.6652, test_loss: 0.9111, test_f1: 0.5829
 epoch: 27, train_loss: 0.6819, test_loss: 0.9310, test_f1: 0.5826
 epoch: 28, train_loss: 0.6985, test_loss: 0.8646, test_f1: 0.5987
 epoch: 29, train_loss: 0.6622, test_loss: 0.8857, test_f1: 0.6061
 epoch: 30, train_loss: 0.6475, test_loss: 0.8621, test_f1: 0.6113
 epoch: 31, train_loss: 0.6356, test_loss: 0.8766, test_f1: 0.6054
 epoch: 32, train_loss: 0.6263, test_loss: 0.8978, test_f1: 0.5985
 epoch: 33, train_loss: 0.6183, test_loss: 0.8501, test_f1: 0.6169
 epoch: 34, train_loss: 0.5975, test_loss: 0.9059, test_f1: 0.6119
 epoch: 35, train_loss: 0.5999, test_loss: 0.9256, test_f1: 0.6158
 epoch: 36, train_loss: 0.6050, test_loss: 0.8681, test_f1: 0.6103
 epoch: 37, train_loss: 0.5977, test_loss: 0.8910, test_f1: 0.6103
 epoch: 38, train_loss: 0.6019, test_loss: 0.8896, test_f1: 0.6173
 epoch: 39, train_loss: 0.5774, test_loss: 0.8673, test_f1: 0.6430
 epoch: 40, train_loss: 0.6041, test_loss: 1.0802, test_f1: 0.5650
 epoch: 41, train_loss: 0.5895, test_loss: 0.9882, test_f1: 0.5875
 epoch: 42, train_loss: 0.5814, test_loss: 0.9392, test_f1: 0.5949
 epoch: 43, train_loss: 0.5608, test_loss: 0.8841, test_f1: 0.6360
 epoch: 44, train_loss: 0.5414, test_loss: 0.9827, test_f1: 0.6240
 epoch: 45, train_loss: 0.5464, test_loss: 1.1777, test_f1: 0.5780
 epoch: 46, train_loss: 0.5326, test_loss: 1.2279, test_f1: 0.5547
 epoch: 47, train_loss: 0.5396, test_loss: 0.9559, test_f1: 0.6261
 epoch: 48, train_loss: 0.5230, test_loss: 1.0506, test_f1: 0.5930
 epoch: 49, train_loss: 0.5403, test_loss: 0.9652, test_f1: 0.6450
 epoch: 50, train_loss: 0.5301, test_loss: 0.9492, test_f1: 0.6279
 epoch: 51, train_loss: 0.4784, test_loss: 0.9177, test_f1: 0.6456
 epoch: 52, train_loss: 0.4435, test_loss: 0.9978, test_f1: 0.6281
 epoch: 53, train_loss: 0.4496, test_loss: 0.9981, test_f1: 0.6305
 epoch: 54, train_loss: 0.4492, test_loss: 0.9595, test_f1: 0.6262
 epoch: 55, train_loss: 0.4390, test_loss: 0.9885, test_f1: 0.6432
 epoch: 56, train_loss: 0.4212, test_loss: 0.9602, test_f1: 0.6640
 epoch: 57, train_loss: 0.4253, test_loss: 0.9968, test_f1: 0.6679
 epoch: 58, train_loss: 0.4189, test_loss: 1.0182, test_f1: 0.6436
 epoch: 59, train_loss: 0.4151, test_loss: 1.0550, test_f1: 0.6268
 epoch: 60, train_loss: 0.4172, test_loss: 1.0124, test_f1: 0.6486
 epoch: 61, train_loss: 0.4043, test_loss: 1.0744, test_f1: 0.6306
 epoch: 62, train_loss: 0.3868, test_loss: 1.0679, test_f1: 0.6267
 epoch: 63, train_loss: 0.4109, test_loss: 0.9989, test_f1: 0.6467
 epoch: 64, train_loss: 0.4049, test_loss: 1.0909, test_f1: 0.6522
 epoch: 65, train_loss: 0.3940, test_loss: 1.0480, test_f1: 0.6500
 epoch: 66, train_loss: 0.4010, test_loss: 1.1471, test_f1: 0.6380
 epoch: 67, train_loss: 0.3782, test_loss: 1.0820, test_f1: 0.6470
 epoch: 68, train_loss: 0.3814, test_loss: 1.2105, test_f1: 0.6536
 epoch: 69, train_loss: 0.3791, test_loss: 1.1054, test_f1: 0.6325
 epoch: 70, train_loss: 0.3761, test_loss: 1.0543, test_f1: 0.6462
 epoch: 71, train_loss: 0.3487, test_loss: 1.2224, test_f1: 0.6191
 epoch: 72, train_loss: 0.3471, test_loss: 1.1586, test_f1: 0.6381
 epoch: 73, train_loss: 0.3611, test_loss: 1.2581, test_f1: 0.6378
 epoch: 74, train_loss: 0.3690, test_loss: 1.0846, test_f1: 0.6384
 epoch: 75, train_loss: 0.3515, test_loss: 1.3127, test_f1: 0.6319
 epoch: 76, train_loss: 0.3452, test_loss: 1.1340, test_f1: 0.6482
 epoch: 77, train_loss: 0.3803, test_loss: 1.0780, test_f1: 0.6326
 epoch: 78, train_loss: 0.3742, test_loss: 1.0747, test_f1: 0.6425
 epoch: 79, train_loss: 0.3731, test_loss: 1.1077, test_f1: 0.6267
 epoch: 80, train_loss: 0.3544, test_loss: 1.4891, test_f1: 0.6316
 epoch: 81, train_loss: 0.3349, test_loss: 1.1510, test_f1: 0.6508
 epoch: 82, train_loss: 0.3253, test_loss: 1.3437, test_f1: 0.6283
 epoch: 83, train_loss: 0.3423, test_loss: 1.0863, test_f1: 0.6526
 epoch: 84, train_loss: 0.3253, test_loss: 1.1942, test_f1: 0.6473
 epoch: 85, train_loss: 0.3298, test_loss: 1.1306, test_f1: 0.6520
 epoch: 86, train_loss: 0.3112, test_loss: 1.1711, test_f1: 0.6439
 epoch: 87, train_loss: 0.3060, test_loss: 1.2207, test_f1: 0.6370
 epoch: 88, train_loss: 0.3060, test_loss: 1.0970, test_f1: 0.6676
 epoch: 89, train_loss: 0.3219, test_loss: 1.2512, test_f1: 0.6269
 epoch: 90, train_loss: 0.3120, test_loss: 1.3617, test_f1: 0.6274
 epoch: 91, train_loss: 0.3148, test_loss: 1.2093, test_f1: 0.6570
 epoch: 92, train_loss: 0.3015, test_loss: 1.2503, test_f1: 0.6279
 epoch: 93, train_loss: 0.3079, test_loss: 1.2679, test_f1: 0.6473
 epoch: 94, train_loss: 0.3174, test_loss: 1.3083, test_f1: 0.6369
 epoch: 95, train_loss: 0.3009, test_loss: 1.3051, test_f1: 0.6442
 epoch: 96, train_loss: 0.2988, test_loss: 1.2553, test_f1: 0.6379
 epoch: 97, train_loss: 0.3078, test_loss: 1.2756, test_f1: 0.6475
 epoch: 98, train_loss: 0.3021, test_loss: 1.3854, test_f1: 0.6490
 epoch: 99, train_loss: 0.2763, test_loss: 1.3519, test_f1: 0.6269

Training completed in 543.80 seconds
Best F1: 0.7146 at epoch 78
Mean F1 across iterations: 0.6867  0.0160
========================FINAL RESULTS================================
FEGIN weighted F1: 0.7146  0.0160
python main.py --data ltspice_examples --representation component_pin --model FEGIN --layers 5 --hiddens 64 --batch_size 128 --lr 0.001 --emb_size 250 --epochs 100 --save_appendix component_pin_L5_H64_BS128_LR0.001_E250 --no_val
-----



STDERR:
  File "main.py", line 370, in <module>
    main()
  File "main.py", line 254, in main
    dataset = dataset_class(
  File "/home/philip/projects/ltspice_examples_code_repo/Circuit-Completion-Using-GNNs/component_classification_with_link_prediction_head/evaluation/FEGIN/kernel/circuit_datasets.py", line 15, in __init__
    self.data, self.slices = torch.load(self.processed_paths[0])
  File "/home/philip/.local/lib/python3.8/site-packages/torch/serialization.py", line 1040, in load
    warnings.warn(
  File "/usr/lib/python3.8/warnings.py", line 109, in _showwarnmsg
    sw(msg.message, msg.category, msg.filename, msg.lineno,
  File "main.py", line 47, in warn_with_traceback
    traceback.print_stack(file=log)
/home/philip/projects/ltspice_examples_code_repo/Circuit-Completion-Using-GNNs/component_classification_with_link_prediction_head/evaluation/FEGIN/kernel/circuit_datasets.py:15: FutureWarning: You are using `torch.load` with `weights_only=False` (the current default value), which uses the default pickle module implicitly. It is possible to construct malicious pickle data which will execute arbitrary code during unpickling (See https://github.com/pytorch/pytorch/blob/main/SECURITY.md#untrusted-models for more details). In a future release, the default value for `weights_only` will be flipped to `True`. This limits the functions that could be executed during unpickling. Arbitrary objects will no longer be allowed to be loaded via this mode unless they are explicitly allowlisted by the user via `torch.serialization.add_safe_globals`. We recommend you start setting `weights_only=True` for any use case where you don't have full control of the loaded file. Please open an issue on GitHub for any issues related to this experimental feature.
  self.data, self.slices = torch.load(self.processed_paths[0])
