STDOUT:
Results will be saved in /home/philip/projects/ltspice_examples_code_repo/Circuit-Completion-Using-GNNs/component_classification_with_link_prediction_head/evaluation/FEGIN/results/model_FEGIN_dataset_ltspice_examples
Command line input: python main.py --data ltspice_examples --representation component_component --model FEGIN --layers 2 --hiddens 64 --batch_size 32 --lr 0.01 --emb_size 512 --epochs 100 --save_appendix component_component_L2_H64_BS32_LR0.01_E512 --no_val
 is saved.
-----
ltspice_examples - FEGIN
Using 2 layers, 64 hidden units, h = 2
Loading component_component representation dataset
ENTERED
Training FEGIN on component_component representation
Train: 3556, Test: 845
##################ITERATION #0 ****************************************
 epoch: 0, train_loss: 1.2410, test_loss: 1.2630, test_f1: 0.2715
 epoch: 1, train_loss: 1.1000, test_loss: 0.9661, test_f1: 0.4956
 epoch: 2, train_loss: 1.0515, test_loss: 1.0678, test_f1: 0.4427
 epoch: 3, train_loss: 1.0269, test_loss: 0.9875, test_f1: 0.4825
 epoch: 4, train_loss: 1.0005, test_loss: 1.0660, test_f1: 0.4722
 epoch: 5, train_loss: 0.9785, test_loss: 1.0034, test_f1: 0.4976
 epoch: 6, train_loss: 0.9675, test_loss: 1.0080, test_f1: 0.5118
 epoch: 7, train_loss: 0.9559, test_loss: 1.0855, test_f1: 0.5476
 epoch: 8, train_loss: 0.9594, test_loss: 1.0111, test_f1: 0.5049
 epoch: 9, train_loss: 0.9360, test_loss: 1.2633, test_f1: 0.4868
 epoch: 10, train_loss: 0.9295, test_loss: 1.0158, test_f1: 0.4671
 epoch: 11, train_loss: 0.9437, test_loss: 1.0513, test_f1: 0.5204
 epoch: 12, train_loss: 0.9349, test_loss: 1.0671, test_f1: 0.4657
 epoch: 13, train_loss: 0.9066, test_loss: 1.0532, test_f1: 0.5212
 epoch: 14, train_loss: 0.9047, test_loss: 0.9556, test_f1: 0.5080
 epoch: 15, train_loss: 0.9123, test_loss: 0.9910, test_f1: 0.5445
 epoch: 16, train_loss: 0.9003, test_loss: 0.9652, test_f1: 0.5647
 epoch: 17, train_loss: 0.8708, test_loss: 1.0599, test_f1: 0.5115
 epoch: 18, train_loss: 0.8876, test_loss: 1.0200, test_f1: 0.4935
 epoch: 19, train_loss: 0.8916, test_loss: 0.9668, test_f1: 0.5127
 epoch: 20, train_loss: 0.9006, test_loss: 0.9335, test_f1: 0.5611
 epoch: 21, train_loss: 0.8814, test_loss: 0.9288, test_f1: 0.5460
 epoch: 22, train_loss: 0.8701, test_loss: 0.9930, test_f1: 0.5450
 epoch: 23, train_loss: 0.8640, test_loss: 1.0325, test_f1: 0.5338
 epoch: 24, train_loss: 0.8671, test_loss: 0.9193, test_f1: 0.5223
 epoch: 25, train_loss: 0.8550, test_loss: 0.9621, test_f1: 0.5433
 epoch: 26, train_loss: 0.8794, test_loss: 1.1595, test_f1: 0.4964
 epoch: 27, train_loss: 0.9435, test_loss: 0.9485, test_f1: 0.5134
 epoch: 28, train_loss: 0.9689, test_loss: 1.0709, test_f1: 0.5219
 epoch: 29, train_loss: 0.8993, test_loss: 1.1063, test_f1: 0.5039
 epoch: 30, train_loss: 0.8943, test_loss: 1.0493, test_f1: 0.5478
 epoch: 31, train_loss: 0.8753, test_loss: 0.9824, test_f1: 0.5458
 epoch: 32, train_loss: 0.8750, test_loss: 0.9889, test_f1: 0.5564
 epoch: 33, train_loss: 0.8590, test_loss: 1.1086, test_f1: 0.5099
 epoch: 34, train_loss: 0.8448, test_loss: 0.9827, test_f1: 0.5784
 epoch: 35, train_loss: 0.8505, test_loss: 0.9922, test_f1: 0.5376
 epoch: 36, train_loss: 0.8426, test_loss: 0.9784, test_f1: 0.5795
 epoch: 37, train_loss: 0.8467, test_loss: 1.0811, test_f1: 0.5611
 epoch: 38, train_loss: 0.8223, test_loss: 0.9516, test_f1: 0.5324
 epoch: 39, train_loss: 0.8436, test_loss: 0.9637, test_f1: 0.5623
 epoch: 40, train_loss: 0.8191, test_loss: 1.0074, test_f1: 0.5472
 epoch: 41, train_loss: 0.8170, test_loss: 1.1733, test_f1: 0.5452
 epoch: 42, train_loss: 0.8233, test_loss: 0.8810, test_f1: 0.5458
 epoch: 43, train_loss: 0.8085, test_loss: 1.0222, test_f1: 0.5623
 epoch: 44, train_loss: 0.7997, test_loss: 1.0343, test_f1: 0.5083
 epoch: 45, train_loss: 0.8186, test_loss: 1.1213, test_f1: 0.5423
 epoch: 46, train_loss: 0.8125, test_loss: 0.9889, test_f1: 0.5484
 epoch: 47, train_loss: 0.8058, test_loss: 1.0604, test_f1: 0.5611
 epoch: 48, train_loss: 0.8184, test_loss: 1.2683, test_f1: 0.4940
 epoch: 49, train_loss: 0.7952, test_loss: 1.0282, test_f1: 0.5492
 epoch: 50, train_loss: 0.7941, test_loss: 1.1130, test_f1: 0.5418
 epoch: 51, train_loss: 0.7690, test_loss: 0.9900, test_f1: 0.5481
 epoch: 52, train_loss: 0.7557, test_loss: 0.9311, test_f1: 0.5875
 epoch: 53, train_loss: 0.7403, test_loss: 1.0365, test_f1: 0.5778
 epoch: 54, train_loss: 0.7344, test_loss: 0.9960, test_f1: 0.5891
 epoch: 55, train_loss: 0.7289, test_loss: 1.0955, test_f1: 0.5531
 epoch: 56, train_loss: 0.7161, test_loss: 1.2231, test_f1: 0.5412
 epoch: 57, train_loss: 0.7206, test_loss: 1.1902, test_f1: 0.5414
 epoch: 58, train_loss: 0.7191, test_loss: 1.0911, test_f1: 0.5440
 epoch: 59, train_loss: 0.7132, test_loss: 1.1105, test_f1: 0.5717
 epoch: 60, train_loss: 0.7028, test_loss: 1.1129, test_f1: 0.5841
 epoch: 61, train_loss: 0.7004, test_loss: 1.1874, test_f1: 0.5681
 epoch: 62, train_loss: 0.7067, test_loss: 1.1574, test_f1: 0.5484
 epoch: 63, train_loss: 0.7014, test_loss: 1.1212, test_f1: 0.5733
 epoch: 64, train_loss: 0.6845, test_loss: 1.2322, test_f1: 0.5529
 epoch: 65, train_loss: 0.7092, test_loss: 1.2931, test_f1: 0.5502
 epoch: 66, train_loss: 0.6950, test_loss: 1.1853, test_f1: 0.5659
 epoch: 67, train_loss: 0.6957, test_loss: 1.1987, test_f1: 0.5478
 epoch: 68, train_loss: 0.6756, test_loss: 1.3048, test_f1: 0.5430
 epoch: 69, train_loss: 0.6746, test_loss: 1.1950, test_f1: 0.5604
 epoch: 70, train_loss: 0.6736, test_loss: 1.2011, test_f1: 0.5595
 epoch: 71, train_loss: 0.6669, test_loss: 1.1068, test_f1: 0.5761
 epoch: 72, train_loss: 0.6826, test_loss: 1.2920, test_f1: 0.5710
 epoch: 73, train_loss: 0.6907, test_loss: 1.2343, test_f1: 0.5608
 epoch: 74, train_loss: 0.6720, test_loss: 1.2152, test_f1: 0.5560
 epoch: 75, train_loss: 0.6482, test_loss: 1.3183, test_f1: 0.5439
 epoch: 76, train_loss: 0.6577, test_loss: 1.0903, test_f1: 0.5521
 epoch: 77, train_loss: 0.6598, test_loss: 1.2221, test_f1: 0.5547
 epoch: 78, train_loss: 0.6719, test_loss: 1.1324, test_f1: 0.5623
 epoch: 79, train_loss: 0.6628, test_loss: 1.1590, test_f1: 0.5463
 epoch: 80, train_loss: 0.6758, test_loss: 1.1283, test_f1: 0.5569
 epoch: 81, train_loss: 0.6483, test_loss: 1.1256, test_f1: 0.5543
 epoch: 82, train_loss: 0.6658, test_loss: 1.3087, test_f1: 0.5316
 epoch: 83, train_loss: 0.6476, test_loss: 1.1319, test_f1: 0.5600
 epoch: 84, train_loss: 0.6600, test_loss: 1.3007, test_f1: 0.5100
 epoch: 85, train_loss: 0.6493, test_loss: 1.1463, test_f1: 0.5709
 epoch: 86, train_loss: 0.6528, test_loss: 1.1026, test_f1: 0.5597
 epoch: 87, train_loss: 0.6334, test_loss: 1.3895, test_f1: 0.5568
 epoch: 88, train_loss: 0.6365, test_loss: 1.1231, test_f1: 0.5680
 epoch: 89, train_loss: 0.6781, test_loss: 1.2072, test_f1: 0.5567
 epoch: 90, train_loss: 0.6526, test_loss: 1.4194, test_f1: 0.5266
 epoch: 91, train_loss: 0.6433, test_loss: 1.6706, test_f1: 0.5301
 epoch: 92, train_loss: 0.6618, test_loss: 1.3638, test_f1: 0.5293
 epoch: 93, train_loss: 0.6137, test_loss: 1.4515, test_f1: 0.5318
 epoch: 94, train_loss: 0.6297, test_loss: 1.2613, test_f1: 0.5332
 epoch: 95, train_loss: 0.6201, test_loss: 1.2486, test_f1: 0.5456
 epoch: 96, train_loss: 0.6296, test_loss: 1.4520, test_f1: 0.5472
 epoch: 97, train_loss: 0.6166, test_loss: 1.1778, test_f1: 0.5677
 epoch: 98, train_loss: 0.6395, test_loss: 1.1763, test_f1: 0.5726
 epoch: 99, train_loss: 0.6389, test_loss: 1.1828, test_f1: 0.5460
##################ITERATION #1 ****************************************
 epoch: 0, train_loss: 1.2874, test_loss: 1.2802, test_f1: 0.2300
 epoch: 1, train_loss: 1.2380, test_loss: 1.1552, test_f1: 0.3390
 epoch: 2, train_loss: 1.1293, test_loss: 1.0554, test_f1: 0.4151
 epoch: 3, train_loss: 1.0776, test_loss: 1.0250, test_f1: 0.4906
 epoch: 4, train_loss: 1.0268, test_loss: 0.9531, test_f1: 0.5041
 epoch: 5, train_loss: 0.9960, test_loss: 1.0499, test_f1: 0.4961
 epoch: 6, train_loss: 0.9992, test_loss: 0.9950, test_f1: 0.4714
 epoch: 7, train_loss: 0.9673, test_loss: 1.0149, test_f1: 0.5158
 epoch: 8, train_loss: 0.9675, test_loss: 1.0566, test_f1: 0.4522
 epoch: 9, train_loss: 0.9623, test_loss: 1.0409, test_f1: 0.4630
 epoch: 10, train_loss: 0.9334, test_loss: 1.1555, test_f1: 0.4637
 epoch: 11, train_loss: 0.9501, test_loss: 1.0897, test_f1: 0.5509
 epoch: 12, train_loss: 0.9150, test_loss: 1.0219, test_f1: 0.5118
 epoch: 13, train_loss: 0.9049, test_loss: 1.0111, test_f1: 0.4478
 epoch: 14, train_loss: 0.9157, test_loss: 1.1286, test_f1: 0.5071
 epoch: 15, train_loss: 0.9082, test_loss: 0.9892, test_f1: 0.5422
 epoch: 16, train_loss: 0.8913, test_loss: 1.0971, test_f1: 0.4809
 epoch: 17, train_loss: 0.9040, test_loss: 1.3984, test_f1: 0.4772
 epoch: 18, train_loss: 0.8931, test_loss: 0.9751, test_f1: 0.5267
 epoch: 19, train_loss: 0.8918, test_loss: 0.9994, test_f1: 0.5149
 epoch: 20, train_loss: 0.8738, test_loss: 0.9959, test_f1: 0.5028
 epoch: 21, train_loss: 0.8869, test_loss: 0.9720, test_f1: 0.5398
 epoch: 22, train_loss: 0.8763, test_loss: 1.0934, test_f1: 0.5508
 epoch: 23, train_loss: 0.9400, test_loss: 1.1147, test_f1: 0.5127
 epoch: 24, train_loss: 0.8788, test_loss: 1.0210, test_f1: 0.5428
 epoch: 25, train_loss: 0.8637, test_loss: 1.0273, test_f1: 0.5186
 epoch: 26, train_loss: 0.8516, test_loss: 1.1650, test_f1: 0.5244
 epoch: 27, train_loss: 0.8896, test_loss: 0.9511, test_f1: 0.5170
 epoch: 28, train_loss: 0.8805, test_loss: 0.9555, test_f1: 0.5583
 epoch: 29, train_loss: 0.8680, test_loss: 1.0104, test_f1: 0.5063
 epoch: 30, train_loss: 0.8628, test_loss: 1.0284, test_f1: 0.5598
 epoch: 31, train_loss: 0.8485, test_loss: 1.0573, test_f1: 0.5612
 epoch: 32, train_loss: 0.8404, test_loss: 0.9859, test_f1: 0.5414
 epoch: 33, train_loss: 0.8787, test_loss: 0.9757, test_f1: 0.5438
 epoch: 34, train_loss: 0.8494, test_loss: 1.2661, test_f1: 0.5107
 epoch: 35, train_loss: 0.8291, test_loss: 0.9445, test_f1: 0.5646
 epoch: 36, train_loss: 0.8237, test_loss: 1.0286, test_f1: 0.5540
 epoch: 37, train_loss: 0.8215, test_loss: 1.0306, test_f1: 0.5394
 epoch: 38, train_loss: 0.8310, test_loss: 1.0400, test_f1: 0.5609
 epoch: 39, train_loss: 0.8118, test_loss: 1.0411, test_f1: 0.5242
 epoch: 40, train_loss: 0.8268, test_loss: 1.0678, test_f1: 0.5491
 epoch: 41, train_loss: 0.8201, test_loss: 1.0564, test_f1: 0.5972
 epoch: 42, train_loss: 0.8777, test_loss: 0.9498, test_f1: 0.5920
 epoch: 43, train_loss: 0.8610, test_loss: 1.0144, test_f1: 0.5508
 epoch: 44, train_loss: 0.8353, test_loss: 1.0437, test_f1: 0.5666
 epoch: 45, train_loss: 0.8278, test_loss: 1.1537, test_f1: 0.5234
 epoch: 46, train_loss: 0.8141, test_loss: 1.2966, test_f1: 0.5262
 epoch: 47, train_loss: 0.8052, test_loss: 0.9677, test_f1: 0.5706
 epoch: 48, train_loss: 0.7998, test_loss: 1.1600, test_f1: 0.5297
 epoch: 49, train_loss: 0.8177, test_loss: 1.0236, test_f1: 0.5478
 epoch: 50, train_loss: 0.7908, test_loss: 1.0760, test_f1: 0.5560
 epoch: 51, train_loss: 0.7846, test_loss: 1.0445, test_f1: 0.5510
 epoch: 52, train_loss: 0.7486, test_loss: 1.0749, test_f1: 0.5180
 epoch: 53, train_loss: 0.7571, test_loss: 1.1015, test_f1: 0.5340
 epoch: 54, train_loss: 0.7329, test_loss: 1.0440, test_f1: 0.5590
 epoch: 55, train_loss: 0.7290, test_loss: 1.1751, test_f1: 0.5867
 epoch: 56, train_loss: 0.7263, test_loss: 1.2401, test_f1: 0.5430
 epoch: 57, train_loss: 0.7190, test_loss: 1.2489, test_f1: 0.5233
 epoch: 58, train_loss: 0.7267, test_loss: 1.2316, test_f1: 0.5305
 epoch: 59, train_loss: 0.6993, test_loss: 1.1379, test_f1: 0.5297
 epoch: 60, train_loss: 0.7152, test_loss: 1.2150, test_f1: 0.5568
 epoch: 61, train_loss: 0.7084, test_loss: 1.2933, test_f1: 0.5412
 epoch: 62, train_loss: 0.7192, test_loss: 1.3110, test_f1: 0.5453
 epoch: 63, train_loss: 0.7039, test_loss: 1.1953, test_f1: 0.5347
 epoch: 64, train_loss: 0.7118, test_loss: 1.0997, test_f1: 0.5689
 epoch: 65, train_loss: 0.6987, test_loss: 1.1113, test_f1: 0.5671
 epoch: 66, train_loss: 0.6879, test_loss: 1.1140, test_f1: 0.5633
 epoch: 67, train_loss: 0.6815, test_loss: 1.1214, test_f1: 0.5548
 epoch: 68, train_loss: 0.6788, test_loss: 1.1905, test_f1: 0.5796
 epoch: 69, train_loss: 0.6863, test_loss: 1.3676, test_f1: 0.5441
 epoch: 70, train_loss: 0.6666, test_loss: 1.1527, test_f1: 0.5844
 epoch: 71, train_loss: 0.7013, test_loss: 1.1464, test_f1: 0.5721
 epoch: 72, train_loss: 0.6889, test_loss: 1.1604, test_f1: 0.5531
 epoch: 73, train_loss: 0.6711, test_loss: 1.2426, test_f1: 0.5845
 epoch: 74, train_loss: 0.6799, test_loss: 1.3703, test_f1: 0.5510
 epoch: 75, train_loss: 0.6694, test_loss: 1.3566, test_f1: 0.5502
 epoch: 76, train_loss: 0.6727, test_loss: 1.1841, test_f1: 0.5656
 epoch: 77, train_loss: 0.6596, test_loss: 1.4579, test_f1: 0.5548
 epoch: 78, train_loss: 0.6605, test_loss: 1.5224, test_f1: 0.5543
 epoch: 79, train_loss: 0.6635, test_loss: 1.4613, test_f1: 0.5569
 epoch: 80, train_loss: 0.6474, test_loss: 1.4025, test_f1: 0.5531
 epoch: 81, train_loss: 0.6593, test_loss: 1.2501, test_f1: 0.5520
 epoch: 82, train_loss: 0.6596, test_loss: 1.3218, test_f1: 0.5530
 epoch: 83, train_loss: 0.6505, test_loss: 1.3701, test_f1: 0.5599
 epoch: 84, train_loss: 0.6487, test_loss: 1.2231, test_f1: 0.5612
 epoch: 85, train_loss: 0.6330, test_loss: 1.1280, test_f1: 0.5538
 epoch: 86, train_loss: 0.6649, test_loss: 1.1926, test_f1: 0.5728
 epoch: 87, train_loss: 0.6470, test_loss: 1.2660, test_f1: 0.5784
 epoch: 88, train_loss: 0.6423, test_loss: 1.3986, test_f1: 0.5684
 epoch: 89, train_loss: 0.6471, test_loss: 1.2631, test_f1: 0.5428
 epoch: 90, train_loss: 0.6460, test_loss: 1.3647, test_f1: 0.5844
 epoch: 91, train_loss: 0.6324, test_loss: 1.3729, test_f1: 0.5523
 epoch: 92, train_loss: 0.6464, test_loss: 1.0876, test_f1: 0.5735
 epoch: 93, train_loss: 0.6364, test_loss: 1.5641, test_f1: 0.5551
 epoch: 94, train_loss: 0.6311, test_loss: 1.5535, test_f1: 0.5752
 epoch: 95, train_loss: 0.6365, test_loss: 1.3511, test_f1: 0.5566
 epoch: 96, train_loss: 0.6216, test_loss: 1.2873, test_f1: 0.5473
 epoch: 97, train_loss: 0.6160, test_loss: 1.3237, test_f1: 0.5384
 epoch: 98, train_loss: 0.6195, test_loss: 1.3850, test_f1: 0.5823
 epoch: 99, train_loss: 0.6342, test_loss: 1.4165, test_f1: 0.5753
##################ITERATION #2 ****************************************
 epoch: 0, train_loss: 1.2930, test_loss: 1.2713, test_f1: 0.2274
 epoch: 1, train_loss: 1.2408, test_loss: 1.2852, test_f1: 0.2850
 epoch: 2, train_loss: 1.2082, test_loss: 1.1351, test_f1: 0.3694
 epoch: 3, train_loss: 1.1587, test_loss: 1.2962, test_f1: 0.2937
 epoch: 4, train_loss: 1.1682, test_loss: 1.0918, test_f1: 0.4579
 epoch: 5, train_loss: 1.1479, test_loss: 1.0617, test_f1: 0.4713
 epoch: 6, train_loss: 1.1102, test_loss: 1.0088, test_f1: 0.4486
 epoch: 7, train_loss: 1.0838, test_loss: 0.9908, test_f1: 0.5206
 epoch: 8, train_loss: 1.0532, test_loss: 1.0029, test_f1: 0.4769
 epoch: 9, train_loss: 1.0260, test_loss: 1.0279, test_f1: 0.4490
 epoch: 10, train_loss: 1.0127, test_loss: 1.0015, test_f1: 0.4258
 epoch: 11, train_loss: 0.9970, test_loss: 0.9500, test_f1: 0.5099
 epoch: 12, train_loss: 1.0042, test_loss: 0.9453, test_f1: 0.5097
 epoch: 13, train_loss: 0.9754, test_loss: 0.9702, test_f1: 0.5157
 epoch: 14, train_loss: 0.9750, test_loss: 1.0085, test_f1: 0.4789
 epoch: 15, train_loss: 0.9576, test_loss: 0.9661, test_f1: 0.5471
 epoch: 16, train_loss: 0.9694, test_loss: 0.9743, test_f1: 0.5018
 epoch: 17, train_loss: 0.9553, test_loss: 0.9779, test_f1: 0.5076
 epoch: 18, train_loss: 0.9567, test_loss: 0.9618, test_f1: 0.5241
 epoch: 19, train_loss: 0.9405, test_loss: 0.9691, test_f1: 0.5496
 epoch: 20, train_loss: 0.9404, test_loss: 0.9469, test_f1: 0.5170
 epoch: 21, train_loss: 0.9284, test_loss: 0.9487, test_f1: 0.5521
 epoch: 22, train_loss: 0.9388, test_loss: 1.0178, test_f1: 0.5578
 epoch: 23, train_loss: 0.9447, test_loss: 0.9745, test_f1: 0.5181
 epoch: 24, train_loss: 0.9130, test_loss: 0.9815, test_f1: 0.4955
 epoch: 25, train_loss: 0.9263, test_loss: 0.9473, test_f1: 0.5359
 epoch: 26, train_loss: 0.9079, test_loss: 0.9124, test_f1: 0.5526
 epoch: 27, train_loss: 0.9050, test_loss: 0.9317, test_f1: 0.5446
 epoch: 28, train_loss: 0.9149, test_loss: 0.9790, test_f1: 0.5484
 epoch: 29, train_loss: 0.8858, test_loss: 0.9067, test_f1: 0.5639
 epoch: 30, train_loss: 0.8886, test_loss: 1.0456, test_f1: 0.5219
 epoch: 31, train_loss: 0.9129, test_loss: 0.9147, test_f1: 0.5668
 epoch: 32, train_loss: 0.8829, test_loss: 0.9910, test_f1: 0.5435
 epoch: 33, train_loss: 0.8743, test_loss: 0.9110, test_f1: 0.5503
 epoch: 34, train_loss: 0.8744, test_loss: 0.9235, test_f1: 0.5313
 epoch: 35, train_loss: 0.8767, test_loss: 0.9576, test_f1: 0.5433
 epoch: 36, train_loss: 0.8685, test_loss: 1.0149, test_f1: 0.5244
 epoch: 37, train_loss: 0.8876, test_loss: 0.9912, test_f1: 0.5466
 epoch: 38, train_loss: 0.8515, test_loss: 0.9290, test_f1: 0.5577
 epoch: 39, train_loss: 0.8625, test_loss: 1.0674, test_f1: 0.5402
 epoch: 40, train_loss: 0.8651, test_loss: 1.0330, test_f1: 0.5526
 epoch: 41, train_loss: 0.8608, test_loss: 0.9685, test_f1: 0.5493
 epoch: 42, train_loss: 0.8685, test_loss: 0.9513, test_f1: 0.5339
 epoch: 43, train_loss: 0.8602, test_loss: 0.9268, test_f1: 0.5466
 epoch: 44, train_loss: 0.8550, test_loss: 0.9371, test_f1: 0.5570
 epoch: 45, train_loss: 0.8421, test_loss: 0.9618, test_f1: 0.5666
 epoch: 46, train_loss: 0.8417, test_loss: 0.9066, test_f1: 0.5704
 epoch: 47, train_loss: 0.8460, test_loss: 0.9773, test_f1: 0.5701
 epoch: 48, train_loss: 0.8361, test_loss: 1.2330, test_f1: 0.5469
 epoch: 49, train_loss: 0.8550, test_loss: 1.0734, test_f1: 0.5708
 epoch: 50, train_loss: 0.8572, test_loss: 0.9289, test_f1: 0.5509
 epoch: 51, train_loss: 0.8104, test_loss: 0.9339, test_f1: 0.5718
 epoch: 52, train_loss: 0.7980, test_loss: 0.9493, test_f1: 0.5717
 epoch: 53, train_loss: 0.7813, test_loss: 0.9447, test_f1: 0.5805
 epoch: 54, train_loss: 0.7888, test_loss: 0.9485, test_f1: 0.5744
 epoch: 55, train_loss: 0.7880, test_loss: 0.9503, test_f1: 0.5753
 epoch: 56, train_loss: 0.7695, test_loss: 0.9847, test_f1: 0.5909
 epoch: 57, train_loss: 0.7754, test_loss: 0.9172, test_f1: 0.5599
 epoch: 58, train_loss: 0.7688, test_loss: 0.9516, test_f1: 0.5773
 epoch: 59, train_loss: 0.7640, test_loss: 0.9757, test_f1: 0.5885
 epoch: 60, train_loss: 0.7641, test_loss: 0.9581, test_f1: 0.5994
 epoch: 61, train_loss: 0.7723, test_loss: 0.9943, test_f1: 0.5707
 epoch: 62, train_loss: 0.7623, test_loss: 0.9159, test_f1: 0.5950
 epoch: 63, train_loss: 0.7493, test_loss: 0.9699, test_f1: 0.5691
 epoch: 64, train_loss: 0.7568, test_loss: 1.0540, test_f1: 0.6064
 epoch: 65, train_loss: 0.7410, test_loss: 1.1145, test_f1: 0.5865
 epoch: 66, train_loss: 0.7894, test_loss: 0.9077, test_f1: 0.5848
 epoch: 67, train_loss: 0.7444, test_loss: 0.9954, test_f1: 0.5668
 epoch: 68, train_loss: 0.7289, test_loss: 0.9772, test_f1: 0.5901
 epoch: 69, train_loss: 0.7528, test_loss: 0.9883, test_f1: 0.6039
 epoch: 70, train_loss: 0.7272, test_loss: 1.0191, test_f1: 0.5655
 epoch: 71, train_loss: 0.7199, test_loss: 0.9833, test_f1: 0.5769
 epoch: 72, train_loss: 0.7353, test_loss: 0.9596, test_f1: 0.5997
 epoch: 73, train_loss: 0.7196, test_loss: 1.0833, test_f1: 0.5838
 epoch: 74, train_loss: 0.7265, test_loss: 1.0291, test_f1: 0.5822
 epoch: 75, train_loss: 0.7114, test_loss: 0.9508, test_f1: 0.6003
 epoch: 76, train_loss: 0.7148, test_loss: 1.0552, test_f1: 0.6032
 epoch: 77, train_loss: 0.7097, test_loss: 0.9654, test_f1: 0.6051
 epoch: 78, train_loss: 0.7130, test_loss: 1.0392, test_f1: 0.6028
 epoch: 79, train_loss: 0.7130, test_loss: 0.9559, test_f1: 0.5609
 epoch: 80, train_loss: 0.6925, test_loss: 1.1932, test_f1: 0.5584
 epoch: 81, train_loss: 0.7079, test_loss: 1.0588, test_f1: 0.5705
 epoch: 82, train_loss: 0.7046, test_loss: 0.9952, test_f1: 0.5852
 epoch: 83, train_loss: 0.6860, test_loss: 1.0431, test_f1: 0.5785
 epoch: 84, train_loss: 0.6811, test_loss: 1.0081, test_f1: 0.5781
 epoch: 85, train_loss: 0.6956, test_loss: 1.0251, test_f1: 0.6056
 epoch: 86, train_loss: 0.6969, test_loss: 1.0045, test_f1: 0.5841
 epoch: 87, train_loss: 0.6920, test_loss: 1.0847, test_f1: 0.5684
 epoch: 88, train_loss: 0.7211, test_loss: 0.9721, test_f1: 0.6157
 epoch: 89, train_loss: 0.6844, test_loss: 1.0449, test_f1: 0.5953
 epoch: 90, train_loss: 0.6828, test_loss: 0.9513, test_f1: 0.6081
 epoch: 91, train_loss: 0.6916, test_loss: 1.0235, test_f1: 0.6039
 epoch: 92, train_loss: 0.6859, test_loss: 0.9669, test_f1: 0.5915
 epoch: 93, train_loss: 0.6700, test_loss: 1.0636, test_f1: 0.5963
 epoch: 94, train_loss: 0.6638, test_loss: 1.0937, test_f1: 0.5748
 epoch: 95, train_loss: 0.7000, test_loss: 1.0402, test_f1: 0.5726
 epoch: 96, train_loss: 0.6728, test_loss: 0.9886, test_f1: 0.5544
 epoch: 97, train_loss: 0.6693, test_loss: 1.0732, test_f1: 0.6057
 epoch: 98, train_loss: 0.6584, test_loss: 0.9860, test_f1: 0.5947
 epoch: 99, train_loss: 0.6747, test_loss: 1.1312, test_f1: 0.5970
##################ITERATION #3 ****************************************
 epoch: 0, train_loss: 1.2844, test_loss: 1.2024, test_f1: 0.3813
 epoch: 1, train_loss: 1.1529, test_loss: 1.0995, test_f1: 0.3956
 epoch: 2, train_loss: 1.1130, test_loss: 1.0504, test_f1: 0.4537
 epoch: 3, train_loss: 1.0747, test_loss: 1.0228, test_f1: 0.4825
 epoch: 4, train_loss: 1.0566, test_loss: 1.0290, test_f1: 0.4505
 epoch: 5, train_loss: 1.0406, test_loss: 0.9734, test_f1: 0.4759
 epoch: 6, train_loss: 1.0081, test_loss: 1.0246, test_f1: 0.4443
 epoch: 7, train_loss: 1.0023, test_loss: 0.9632, test_f1: 0.4969
 epoch: 8, train_loss: 0.9911, test_loss: 2.5210, test_f1: 0.2870
 epoch: 9, train_loss: 0.9996, test_loss: 1.0071, test_f1: 0.4859
 epoch: 10, train_loss: 0.9671, test_loss: 0.9625, test_f1: 0.4647
 epoch: 11, train_loss: 0.9494, test_loss: 0.9432, test_f1: 0.4904
 epoch: 12, train_loss: 0.9470, test_loss: 1.0676, test_f1: 0.4774
 epoch: 13, train_loss: 0.9380, test_loss: 0.9983, test_f1: 0.4930
 epoch: 14, train_loss: 0.9186, test_loss: 0.9996, test_f1: 0.4731
 epoch: 15, train_loss: 0.9223, test_loss: 1.0193, test_f1: 0.4858
 epoch: 16, train_loss: 0.9108, test_loss: 1.0116, test_f1: 0.4798
 epoch: 17, train_loss: 0.9079, test_loss: 1.0156, test_f1: 0.5346
 epoch: 18, train_loss: 0.9047, test_loss: 0.9737, test_f1: 0.5010
 epoch: 19, train_loss: 0.8863, test_loss: 1.0085, test_f1: 0.5048
 epoch: 20, train_loss: 0.9248, test_loss: 0.9548, test_f1: 0.4963
 epoch: 21, train_loss: 0.8821, test_loss: 1.0527, test_f1: 0.5169
 epoch: 22, train_loss: 0.8848, test_loss: 1.0265, test_f1: 0.5019
 epoch: 23, train_loss: 0.8740, test_loss: 1.1410, test_f1: 0.4960
 epoch: 24, train_loss: 0.8927, test_loss: 1.1267, test_f1: 0.4758
 epoch: 25, train_loss: 0.8647, test_loss: 0.9667, test_f1: 0.5305
 epoch: 26, train_loss: 0.8620, test_loss: 0.9730, test_f1: 0.5045
 epoch: 27, train_loss: 0.9229, test_loss: 0.9526, test_f1: 0.5069
 epoch: 28, train_loss: 0.8699, test_loss: 0.9842, test_f1: 0.5038
 epoch: 29, train_loss: 0.8431, test_loss: 0.9775, test_f1: 0.5497
 epoch: 30, train_loss: 0.8889, test_loss: 0.9361, test_f1: 0.4709
 epoch: 31, train_loss: 0.8522, test_loss: 0.9959, test_f1: 0.4988
 epoch: 32, train_loss: 0.8533, test_loss: 1.0084, test_f1: 0.4894
 epoch: 33, train_loss: 0.8576, test_loss: 1.0710, test_f1: 0.5096
 epoch: 34, train_loss: 0.9043, test_loss: 1.0582, test_f1: 0.4819
 epoch: 35, train_loss: 0.8539, test_loss: 1.0697, test_f1: 0.4985
 epoch: 36, train_loss: 0.8378, test_loss: 1.1303, test_f1: 0.4801
 epoch: 37, train_loss: 0.8659, test_loss: 1.1069, test_f1: 0.4731
 epoch: 38, train_loss: 0.8552, test_loss: 0.9663, test_f1: 0.4990
 epoch: 39, train_loss: 0.8400, test_loss: 1.1050, test_f1: 0.4906
 epoch: 40, train_loss: 0.8289, test_loss: 0.9629, test_f1: 0.5277
 epoch: 41, train_loss: 0.8426, test_loss: 0.9190, test_f1: 0.5464
 epoch: 42, train_loss: 0.8149, test_loss: 0.9652, test_f1: 0.5179
 epoch: 43, train_loss: 0.8226, test_loss: 0.9554, test_f1: 0.5088
 epoch: 44, train_loss: 0.8230, test_loss: 0.9850, test_f1: 0.5055
 epoch: 45, train_loss: 0.8235, test_loss: 0.9930, test_f1: 0.5458
 epoch: 46, train_loss: 0.8162, test_loss: 0.9958, test_f1: 0.5191
 epoch: 47, train_loss: 0.8206, test_loss: 1.0336, test_f1: 0.4955
 epoch: 48, train_loss: 0.8068, test_loss: 0.9430, test_f1: 0.5232
 epoch: 49, train_loss: 0.8281, test_loss: 0.9482, test_f1: 0.5030
 epoch: 50, train_loss: 0.7924, test_loss: 0.9530, test_f1: 0.5014
 epoch: 51, train_loss: 0.7804, test_loss: 0.9366, test_f1: 0.5390
 epoch: 52, train_loss: 0.7557, test_loss: 0.9503, test_f1: 0.5505
 epoch: 53, train_loss: 0.7662, test_loss: 1.1784, test_f1: 0.5046
 epoch: 54, train_loss: 0.7714, test_loss: 1.0372, test_f1: 0.5040
 epoch: 55, train_loss: 0.7449, test_loss: 1.0503, test_f1: 0.5189
 epoch: 56, train_loss: 0.7489, test_loss: 0.9798, test_f1: 0.5362
 epoch: 57, train_loss: 0.7463, test_loss: 0.9709, test_f1: 0.5656
 epoch: 58, train_loss: 0.7399, test_loss: 0.9554, test_f1: 0.5583
 epoch: 59, train_loss: 0.7386, test_loss: 1.0484, test_f1: 0.5437
 epoch: 60, train_loss: 0.7293, test_loss: 1.0607, test_f1: 0.5153
 epoch: 61, train_loss: 0.7286, test_loss: 1.1247, test_f1: 0.5068
 epoch: 62, train_loss: 0.7239, test_loss: 1.1952, test_f1: 0.5148
 epoch: 63, train_loss: 0.7278, test_loss: 1.0041, test_f1: 0.5397
 epoch: 64, train_loss: 0.7217, test_loss: 0.9820, test_f1: 0.5743
 epoch: 65, train_loss: 0.7300, test_loss: 1.0154, test_f1: 0.5360
 epoch: 66, train_loss: 0.7292, test_loss: 1.0082, test_f1: 0.5574
 epoch: 67, train_loss: 0.7250, test_loss: 1.0202, test_f1: 0.5480
 epoch: 68, train_loss: 0.7181, test_loss: 1.0107, test_f1: 0.5644
 epoch: 69, train_loss: 0.7181, test_loss: 1.1830, test_f1: 0.5194
 epoch: 70, train_loss: 0.7055, test_loss: 1.1529, test_f1: 0.5593
 epoch: 71, train_loss: 0.7174, test_loss: 1.0588, test_f1: 0.5689
 epoch: 72, train_loss: 0.7086, test_loss: 1.0626, test_f1: 0.5860
 epoch: 73, train_loss: 0.7254, test_loss: 1.0525, test_f1: 0.5763
 epoch: 74, train_loss: 0.7203, test_loss: 1.0042, test_f1: 0.5574
 epoch: 75, train_loss: 0.7181, test_loss: 0.9978, test_f1: 0.5735
 epoch: 76, train_loss: 0.7072, test_loss: 1.3026, test_f1: 0.4849
 epoch: 77, train_loss: 0.7389, test_loss: 0.9225, test_f1: 0.5726
 epoch: 78, train_loss: 0.6886, test_loss: 1.0542, test_f1: 0.5294
 epoch: 79, train_loss: 0.7020, test_loss: 1.0243, test_f1: 0.5600
 epoch: 80, train_loss: 0.6915, test_loss: 1.0644, test_f1: 0.5735
 epoch: 81, train_loss: 0.6813, test_loss: 0.9642, test_f1: 0.5926
 epoch: 82, train_loss: 0.6855, test_loss: 1.0750, test_f1: 0.5512
 epoch: 83, train_loss: 0.6811, test_loss: 1.0805, test_f1: 0.5134
 epoch: 84, train_loss: 0.6860, test_loss: 1.0399, test_f1: 0.5911
 epoch: 85, train_loss: 0.6707, test_loss: 1.0833, test_f1: 0.5885
 epoch: 86, train_loss: 0.6852, test_loss: 1.0333, test_f1: 0.6120
 epoch: 87, train_loss: 0.6679, test_loss: 1.0876, test_f1: 0.5915
 epoch: 88, train_loss: 0.6790, test_loss: 1.1004, test_f1: 0.5886
 epoch: 89, train_loss: 0.6807, test_loss: 1.0446, test_f1: 0.5897
 epoch: 90, train_loss: 0.6666, test_loss: 1.1153, test_f1: 0.5978
 epoch: 91, train_loss: 0.6532, test_loss: 1.1147, test_f1: 0.5907
 epoch: 92, train_loss: 0.6600, test_loss: 1.2132, test_f1: 0.5888
 epoch: 93, train_loss: 0.6473, test_loss: 1.0931, test_f1: 0.5949
 epoch: 94, train_loss: 0.6610, test_loss: 1.1827, test_f1: 0.5870
 epoch: 95, train_loss: 0.6751, test_loss: 1.0946, test_f1: 0.5866
 epoch: 96, train_loss: 0.6553, test_loss: 1.1352, test_f1: 0.5992
 epoch: 97, train_loss: 0.6605, test_loss: 1.1181, test_f1: 0.5675
 epoch: 98, train_loss: 0.6434, test_loss: 0.9922, test_f1: 0.5969
 epoch: 99, train_loss: 0.6439, test_loss: 1.1876, test_f1: 0.5613
##################ITERATION #4 ****************************************
 epoch: 0, train_loss: 1.3003, test_loss: 1.1810, test_f1: 0.2970
 epoch: 1, train_loss: 1.1445, test_loss: 1.0297, test_f1: 0.4748
 epoch: 2, train_loss: 1.0993, test_loss: 1.0340, test_f1: 0.4639
 epoch: 3, train_loss: 1.0542, test_loss: 1.0003, test_f1: 0.4697
 epoch: 4, train_loss: 1.0410, test_loss: 1.0620, test_f1: 0.4655
 epoch: 5, train_loss: 1.0171, test_loss: 1.0207, test_f1: 0.4534
 epoch: 6, train_loss: 1.0003, test_loss: 1.0063, test_f1: 0.4680
 epoch: 7, train_loss: 0.9947, test_loss: 1.0850, test_f1: 0.4730
 epoch: 8, train_loss: 0.9893, test_loss: 1.1003, test_f1: 0.4743
 epoch: 9, train_loss: 0.9712, test_loss: 0.9935, test_f1: 0.4583
 epoch: 10, train_loss: 0.9554, test_loss: 0.9933, test_f1: 0.5081
 epoch: 11, train_loss: 0.9433, test_loss: 1.0206, test_f1: 0.5075
 epoch: 12, train_loss: 0.9408, test_loss: 1.0204, test_f1: 0.4550
 epoch: 13, train_loss: 0.9295, test_loss: 1.0520, test_f1: 0.4855
 epoch: 14, train_loss: 0.9190, test_loss: 1.0463, test_f1: 0.5061
 epoch: 15, train_loss: 0.9084, test_loss: 0.9859, test_f1: 0.5265
 epoch: 16, train_loss: 0.8959, test_loss: 1.0550, test_f1: 0.5167
 epoch: 17, train_loss: 0.9062, test_loss: 0.9804, test_f1: 0.4920
 epoch: 18, train_loss: 1.0099, test_loss: 1.0297, test_f1: 0.4912
 epoch: 19, train_loss: 0.9689, test_loss: 1.0453, test_f1: 0.4597
 epoch: 20, train_loss: 0.9504, test_loss: 1.1439, test_f1: 0.4748
 epoch: 21, train_loss: 0.9326, test_loss: 0.9983, test_f1: 0.5203
 epoch: 22, train_loss: 0.9148, test_loss: 0.9752, test_f1: 0.5322
 epoch: 23, train_loss: 0.8943, test_loss: 0.9838, test_f1: 0.5071
 epoch: 24, train_loss: 0.9026, test_loss: 1.0030, test_f1: 0.4902
 epoch: 25, train_loss: 0.9135, test_loss: 0.9847, test_f1: 0.5137
 epoch: 26, train_loss: 0.8818, test_loss: 1.0354, test_f1: 0.4978
 epoch: 27, train_loss: 0.9017, test_loss: 1.0544, test_f1: 0.4916
 epoch: 28, train_loss: 0.8757, test_loss: 1.0240, test_f1: 0.5304
 epoch: 29, train_loss: 0.8612, test_loss: 1.0040, test_f1: 0.5408
 epoch: 30, train_loss: 0.8770, test_loss: 1.2064, test_f1: 0.4655
 epoch: 31, train_loss: 0.8888, test_loss: 1.0311, test_f1: 0.5272
 epoch: 32, train_loss: 0.8561, test_loss: 1.0474, test_f1: 0.4950
 epoch: 33, train_loss: 0.8647, test_loss: 1.2605, test_f1: 0.4887
 epoch: 34, train_loss: 0.8497, test_loss: 1.0486, test_f1: 0.4791
 epoch: 35, train_loss: 0.8730, test_loss: 1.1304, test_f1: 0.5180
 epoch: 36, train_loss: 0.8616, test_loss: 1.0573, test_f1: 0.5298
 epoch: 37, train_loss: 0.8549, test_loss: 0.9657, test_f1: 0.5691
 epoch: 38, train_loss: 0.8540, test_loss: 0.9864, test_f1: 0.5623
 epoch: 39, train_loss: 0.8371, test_loss: 1.1910, test_f1: 0.5005
 epoch: 40, train_loss: 0.8339, test_loss: 0.9683, test_f1: 0.5321
 epoch: 41, train_loss: 0.8516, test_loss: 1.0163, test_f1: 0.5450
 epoch: 42, train_loss: 0.8468, test_loss: 1.0183, test_f1: 0.5231
 epoch: 43, train_loss: 0.8327, test_loss: 1.0351, test_f1: 0.5423
 epoch: 44, train_loss: 0.8314, test_loss: 1.0179, test_f1: 0.5380
 epoch: 45, train_loss: 0.8262, test_loss: 1.1183, test_f1: 0.5100
 epoch: 46, train_loss: 0.8448, test_loss: 1.0798, test_f1: 0.5222
 epoch: 47, train_loss: 0.8061, test_loss: 1.0376, test_f1: 0.5179
 epoch: 48, train_loss: 0.8384, test_loss: 1.0641, test_f1: 0.5499
 epoch: 49, train_loss: 0.8341, test_loss: 1.0174, test_f1: 0.5366
 epoch: 50, train_loss: 0.8247, test_loss: 0.9778, test_f1: 0.5934
 epoch: 51, train_loss: 0.7911, test_loss: 0.9991, test_f1: 0.5267
 epoch: 52, train_loss: 0.8243, test_loss: 0.9983, test_f1: 0.5539
 epoch: 53, train_loss: 0.7678, test_loss: 1.1735, test_f1: 0.5330
 epoch: 54, train_loss: 0.7699, test_loss: 1.0593, test_f1: 0.5365
 epoch: 55, train_loss: 0.7659, test_loss: 0.9970, test_f1: 0.5752
 epoch: 56, train_loss: 0.7606, test_loss: 1.1091, test_f1: 0.5379
 epoch: 57, train_loss: 0.7469, test_loss: 1.0455, test_f1: 0.5210
 epoch: 58, train_loss: 0.7570, test_loss: 1.0390, test_f1: 0.5635
 epoch: 59, train_loss: 0.7372, test_loss: 1.0497, test_f1: 0.5569
 epoch: 60, train_loss: 0.7508, test_loss: 1.0316, test_f1: 0.5301
 epoch: 61, train_loss: 0.7407, test_loss: 1.0526, test_f1: 0.5508
 epoch: 62, train_loss: 0.7499, test_loss: 1.1243, test_f1: 0.5576
 epoch: 63, train_loss: 0.7674, test_loss: 0.9518, test_f1: 0.5861
 epoch: 64, train_loss: 0.7416, test_loss: 1.1518, test_f1: 0.5539
 epoch: 65, train_loss: 0.7532, test_loss: 0.9646, test_f1: 0.5776
 epoch: 66, train_loss: 0.7565, test_loss: 0.9837, test_f1: 0.5623
 epoch: 67, train_loss: 0.7334, test_loss: 1.0360, test_f1: 0.5761
 epoch: 68, train_loss: 0.7247, test_loss: 1.0385, test_f1: 0.5365
 epoch: 69, train_loss: 0.7211, test_loss: 1.0853, test_f1: 0.5704
 epoch: 70, train_loss: 0.7162, test_loss: 1.0517, test_f1: 0.5664
 epoch: 71, train_loss: 0.7197, test_loss: 1.0327, test_f1: 0.5614
 epoch: 72, train_loss: 0.7192, test_loss: 1.1404, test_f1: 0.5733
 epoch: 73, train_loss: 0.7323, test_loss: 1.0076, test_f1: 0.5594
 epoch: 74, train_loss: 0.7251, test_loss: 1.0110, test_f1: 0.5666
 epoch: 75, train_loss: 0.7343, test_loss: 1.0824, test_f1: 0.5325
 epoch: 76, train_loss: 0.7143, test_loss: 1.1377, test_f1: 0.5262
 epoch: 77, train_loss: 0.7255, test_loss: 1.0014, test_f1: 0.5581
 epoch: 78, train_loss: 0.7059, test_loss: 1.0225, test_f1: 0.5809
 epoch: 79, train_loss: 0.7040, test_loss: 0.9649, test_f1: 0.5831
 epoch: 80, train_loss: 0.7012, test_loss: 0.9725, test_f1: 0.5990
 epoch: 81, train_loss: 0.6889, test_loss: 1.0141, test_f1: 0.5752
 epoch: 82, train_loss: 0.7026, test_loss: 1.1918, test_f1: 0.5105
 epoch: 83, train_loss: 0.7420, test_loss: 0.9945, test_f1: 0.5539
 epoch: 84, train_loss: 0.7523, test_loss: 1.0366, test_f1: 0.5757
 epoch: 85, train_loss: 0.7181, test_loss: 1.0376, test_f1: 0.5639
 epoch: 86, train_loss: 0.7126, test_loss: 1.0517, test_f1: 0.5590
 epoch: 87, train_loss: 0.6941, test_loss: 1.1494, test_f1: 0.5634
 epoch: 88, train_loss: 0.6834, test_loss: 1.0802, test_f1: 0.5600
 epoch: 89, train_loss: 0.6938, test_loss: 1.0291, test_f1: 0.5797
 epoch: 90, train_loss: 0.6779, test_loss: 0.9768, test_f1: 0.5944
 epoch: 91, train_loss: 0.6740, test_loss: 1.1072, test_f1: 0.5657
 epoch: 92, train_loss: 0.6813, test_loss: 1.0694, test_f1: 0.5597
 epoch: 93, train_loss: 0.6841, test_loss: 1.0250, test_f1: 0.5544
 epoch: 94, train_loss: 0.6667, test_loss: 1.1147, test_f1: 0.5557
 epoch: 95, train_loss: 0.6785, test_loss: 1.0217, test_f1: 0.5912
 epoch: 96, train_loss: 0.6780, test_loss: 1.0398, test_f1: 0.5939
 epoch: 97, train_loss: 0.6709, test_loss: 1.0834, test_f1: 0.5795
 epoch: 98, train_loss: 0.6877, test_loss: 1.2526, test_f1: 0.5418
 epoch: 99, train_loss: 0.7159, test_loss: 1.1951, test_f1: 0.5667
##################ITERATION #5 ****************************************
 epoch: 0, train_loss: 1.2751, test_loss: 1.2026, test_f1: 0.3788
 epoch: 1, train_loss: 1.1345, test_loss: 1.1021, test_f1: 0.4756
 epoch: 2, train_loss: 1.0784, test_loss: 1.0220, test_f1: 0.4405
 epoch: 3, train_loss: 1.0388, test_loss: 0.9940, test_f1: 0.4858
 epoch: 4, train_loss: 1.0060, test_loss: 1.0235, test_f1: 0.5357
 epoch: 5, train_loss: 0.9871, test_loss: 1.0110, test_f1: 0.4906
 epoch: 6, train_loss: 0.9693, test_loss: 1.0232, test_f1: 0.4956
 epoch: 7, train_loss: 0.9522, test_loss: 0.9610, test_f1: 0.5122
 epoch: 8, train_loss: 0.9660, test_loss: 0.9881, test_f1: 0.5094
 epoch: 9, train_loss: 0.9295, test_loss: 1.0203, test_f1: 0.4883
 epoch: 10, train_loss: 0.9267, test_loss: 0.9872, test_f1: 0.4915
 epoch: 11, train_loss: 0.9404, test_loss: 0.9905, test_f1: 0.4767
 epoch: 12, train_loss: 0.9102, test_loss: 0.9630, test_f1: 0.5131
 epoch: 13, train_loss: 0.9120, test_loss: 1.1424, test_f1: 0.5251
 epoch: 14, train_loss: 0.9010, test_loss: 0.9826, test_f1: 0.5657
 epoch: 15, train_loss: 0.8978, test_loss: 1.0441, test_f1: 0.5332
 epoch: 16, train_loss: 0.8770, test_loss: 1.0619, test_f1: 0.5285
 epoch: 17, train_loss: 0.8939, test_loss: 1.0254, test_f1: 0.5283
 epoch: 18, train_loss: 0.8684, test_loss: 1.0485, test_f1: 0.5141
 epoch: 19, train_loss: 0.8842, test_loss: 1.0219, test_f1: 0.5550
 epoch: 20, train_loss: 0.8608, test_loss: 1.0140, test_f1: 0.5106
 epoch: 21, train_loss: 0.8584, test_loss: 1.0164, test_f1: 0.5316
 epoch: 22, train_loss: 0.8497, test_loss: 0.9969, test_f1: 0.5528
 epoch: 23, train_loss: 0.8801, test_loss: 1.0339, test_f1: 0.5485
 epoch: 24, train_loss: 0.8547, test_loss: 1.0388, test_f1: 0.5093
 epoch: 25, train_loss: 0.8338, test_loss: 1.0347, test_f1: 0.5560
 epoch: 26, train_loss: 0.8324, test_loss: 1.0593, test_f1: 0.5355
 epoch: 27, train_loss: 0.8286, test_loss: 0.9617, test_f1: 0.5784
 epoch: 28, train_loss: 0.8427, test_loss: 0.9436, test_f1: 0.5931
 epoch: 29, train_loss: 0.8339, test_loss: 1.0683, test_f1: 0.5274
 epoch: 30, train_loss: 0.8415, test_loss: 1.0750, test_f1: 0.5442
 epoch: 31, train_loss: 0.8182, test_loss: 1.0519, test_f1: 0.5396
 epoch: 32, train_loss: 0.8113, test_loss: 1.2193, test_f1: 0.5535
 epoch: 33, train_loss: 0.8321, test_loss: 1.0491, test_f1: 0.5265
 epoch: 34, train_loss: 0.8047, test_loss: 1.1130, test_f1: 0.5547
 epoch: 35, train_loss: 0.7916, test_loss: 1.0316, test_f1: 0.5591
 epoch: 36, train_loss: 0.7898, test_loss: 0.9930, test_f1: 0.5524
 epoch: 37, train_loss: 0.8180, test_loss: 1.1347, test_f1: 0.5341
 epoch: 38, train_loss: 0.8090, test_loss: 0.9601, test_f1: 0.5764
 epoch: 39, train_loss: 0.7713, test_loss: 1.0421, test_f1: 0.5494
 epoch: 40, train_loss: 0.7601, test_loss: 1.0476, test_f1: 0.5331
 epoch: 41, train_loss: 0.7791, test_loss: 1.0601, test_f1: 0.5184
 epoch: 42, train_loss: 0.7820, test_loss: 1.0130, test_f1: 0.5572
 epoch: 43, train_loss: 0.7781, test_loss: 1.1180, test_f1: 0.5575
 epoch: 44, train_loss: 0.7556, test_loss: 1.0355, test_f1: 0.5587
 epoch: 45, train_loss: 0.7595, test_loss: 1.1527, test_f1: 0.5350
 epoch: 46, train_loss: 0.7643, test_loss: 1.1161, test_f1: 0.5709
 epoch: 47, train_loss: 0.7559, test_loss: 1.0579, test_f1: 0.5962
 epoch: 48, train_loss: 0.7432, test_loss: 1.2969, test_f1: 0.5543
 epoch: 49, train_loss: 0.7479, test_loss: 1.1442, test_f1: 0.5609
 epoch: 50, train_loss: 0.7525, test_loss: 1.0938, test_f1: 0.5724
 epoch: 51, train_loss: 0.7104, test_loss: 1.1252, test_f1: 0.5872
 epoch: 52, train_loss: 0.6884, test_loss: 1.1004, test_f1: 0.5874
 epoch: 53, train_loss: 0.6876, test_loss: 1.1475, test_f1: 0.5732
 epoch: 54, train_loss: 0.6798, test_loss: 1.2611, test_f1: 0.5763
 epoch: 55, train_loss: 0.6634, test_loss: 1.0888, test_f1: 0.5850
 epoch: 56, train_loss: 0.6773, test_loss: 1.3937, test_f1: 0.5729
 epoch: 57, train_loss: 0.6593, test_loss: 1.2307, test_f1: 0.5729
 epoch: 58, train_loss: 0.6547, test_loss: 1.2771, test_f1: 0.5790
 epoch: 59, train_loss: 0.6563, test_loss: 1.2850, test_f1: 0.5558
 epoch: 60, train_loss: 0.6740, test_loss: 1.2063, test_f1: 0.5583
 epoch: 61, train_loss: 0.6634, test_loss: 1.2644, test_f1: 0.5646
 epoch: 62, train_loss: 0.6503, test_loss: 1.4006, test_f1: 0.5650
 epoch: 63, train_loss: 0.6489, test_loss: 1.4027, test_f1: 0.5639
 epoch: 64, train_loss: 0.6349, test_loss: 1.3624, test_f1: 0.5697
 epoch: 65, train_loss: 0.6503, test_loss: 1.3042, test_f1: 0.5655
 epoch: 66, train_loss: 0.6301, test_loss: 1.3013, test_f1: 0.5524
 epoch: 67, train_loss: 0.6268, test_loss: 1.3058, test_f1: 0.5582
 epoch: 68, train_loss: 0.6191, test_loss: 1.2778, test_f1: 0.5663
 epoch: 69, train_loss: 0.6375, test_loss: 1.1669, test_f1: 0.6030
 epoch: 70, train_loss: 0.6306, test_loss: 1.4083, test_f1: 0.5673
 epoch: 71, train_loss: 0.6208, test_loss: 1.3467, test_f1: 0.5861
 epoch: 72, train_loss: 0.6324, test_loss: 1.5076, test_f1: 0.5778
 epoch: 73, train_loss: 0.6320, test_loss: 1.1417, test_f1: 0.5910
 epoch: 74, train_loss: 0.6069, test_loss: 1.4887, test_f1: 0.5664
 epoch: 75, train_loss: 0.6270, test_loss: 1.4884, test_f1: 0.5747
 epoch: 76, train_loss: 0.6094, test_loss: 1.2681, test_f1: 0.6101
 epoch: 77, train_loss: 0.5963, test_loss: 1.3372, test_f1: 0.5522
 epoch: 78, train_loss: 0.5995, test_loss: 1.2887, test_f1: 0.5898
 epoch: 79, train_loss: 0.6199, test_loss: 1.5973, test_f1: 0.5705
 epoch: 80, train_loss: 0.6014, test_loss: 1.5726, test_f1: 0.5660
 epoch: 81, train_loss: 0.6073, test_loss: 1.3470, test_f1: 0.5738
 epoch: 82, train_loss: 0.5890, test_loss: 1.5548, test_f1: 0.5583
 epoch: 83, train_loss: 0.6326, test_loss: 1.5910, test_f1: 0.5505
 epoch: 84, train_loss: 0.5953, test_loss: 1.3468, test_f1: 0.5979
 epoch: 85, train_loss: 0.6248, test_loss: 1.2211, test_f1: 0.5824
 epoch: 86, train_loss: 0.6086, test_loss: 1.4594, test_f1: 0.5801
 epoch: 87, train_loss: 0.5899, test_loss: 1.2804, test_f1: 0.5865
 epoch: 88, train_loss: 0.5869, test_loss: 1.2423, test_f1: 0.5745
 epoch: 89, train_loss: 0.5939, test_loss: 1.3056, test_f1: 0.5732
 epoch: 90, train_loss: 0.5855, test_loss: 1.1797, test_f1: 0.5871
 epoch: 91, train_loss: 0.5740, test_loss: 1.2927, test_f1: 0.5830
 epoch: 92, train_loss: 0.5994, test_loss: 1.3586, test_f1: 0.5653
 epoch: 93, train_loss: 0.5926, test_loss: 1.3154, test_f1: 0.5907
 epoch: 94, train_loss: 0.5663, test_loss: 1.4321, test_f1: 0.5799
 epoch: 95, train_loss: 0.5942, test_loss: 1.6488, test_f1: 0.5820
 epoch: 96, train_loss: 0.5759, test_loss: 1.3840, test_f1: 0.5755
 epoch: 97, train_loss: 0.5762, test_loss: 1.4630, test_f1: 0.5751
 epoch: 98, train_loss: 0.5667, test_loss: 1.4249, test_f1: 0.5594
 epoch: 99, train_loss: 0.5634, test_loss: 1.5182, test_f1: 0.5632
##################ITERATION #6 ****************************************
 epoch: 0, train_loss: 1.2844, test_loss: 1.2657, test_f1: 0.3250
 epoch: 1, train_loss: 1.1607, test_loss: 1.1092, test_f1: 0.4138
 epoch: 2, train_loss: 1.1040, test_loss: 1.0183, test_f1: 0.4623
 epoch: 3, train_loss: 1.0509, test_loss: 1.0003, test_f1: 0.4899
 epoch: 4, train_loss: 1.0218, test_loss: 1.0229, test_f1: 0.4846
 epoch: 5, train_loss: 0.9933, test_loss: 1.0345, test_f1: 0.4537
 epoch: 6, train_loss: 0.9932, test_loss: 0.9825, test_f1: 0.4971
 epoch: 7, train_loss: 0.9688, test_loss: 0.9738, test_f1: 0.4880
 epoch: 8, train_loss: 0.9579, test_loss: 0.9702, test_f1: 0.5073
 epoch: 9, train_loss: 0.9581, test_loss: 1.0189, test_f1: 0.4886
 epoch: 10, train_loss: 0.9464, test_loss: 0.9709, test_f1: 0.4850
 epoch: 11, train_loss: 0.9245, test_loss: 1.0247, test_f1: 0.4935
 epoch: 12, train_loss: 0.9480, test_loss: 1.0664, test_f1: 0.4934
 epoch: 13, train_loss: 0.9340, test_loss: 1.0095, test_f1: 0.5008
 epoch: 14, train_loss: 0.9142, test_loss: 0.9928, test_f1: 0.5135
 epoch: 15, train_loss: 0.9108, test_loss: 1.0202, test_f1: 0.5045
 epoch: 16, train_loss: 0.9364, test_loss: 1.0873, test_f1: 0.4923
 epoch: 17, train_loss: 0.9017, test_loss: 1.0328, test_f1: 0.5031
 epoch: 18, train_loss: 0.9068, test_loss: 1.0293, test_f1: 0.5240
 epoch: 19, train_loss: 0.9183, test_loss: 0.9461, test_f1: 0.5384
 epoch: 20, train_loss: 0.8850, test_loss: 0.9998, test_f1: 0.4850
 epoch: 21, train_loss: 0.8924, test_loss: 0.9947, test_f1: 0.5155
 epoch: 22, train_loss: 0.8834, test_loss: 0.9933, test_f1: 0.4794
 epoch: 23, train_loss: 0.9562, test_loss: 0.9983, test_f1: 0.4829
 epoch: 24, train_loss: 0.8960, test_loss: 1.0289, test_f1: 0.4866
 epoch: 25, train_loss: 0.8994, test_loss: 0.9905, test_f1: 0.5177
 epoch: 26, train_loss: 0.8673, test_loss: 0.9757, test_f1: 0.5322
 epoch: 27, train_loss: 0.8608, test_loss: 1.0796, test_f1: 0.4742
 epoch: 28, train_loss: 0.8747, test_loss: 0.9336, test_f1: 0.5332
 epoch: 29, train_loss: 0.8661, test_loss: 0.9906, test_f1: 0.5426
 epoch: 30, train_loss: 0.8567, test_loss: 1.0398, test_f1: 0.5115
 epoch: 31, train_loss: 0.8730, test_loss: 0.9948, test_f1: 0.5758
 epoch: 32, train_loss: 0.8691, test_loss: 0.9913, test_f1: 0.5064
 epoch: 33, train_loss: 0.8595, test_loss: 1.1754, test_f1: 0.5058
 epoch: 34, train_loss: 0.8793, test_loss: 1.1492, test_f1: 0.5685
 epoch: 35, train_loss: 0.8539, test_loss: 0.9742, test_f1: 0.5518
 epoch: 36, train_loss: 0.8518, test_loss: 0.9967, test_f1: 0.5067
 epoch: 37, train_loss: 0.9192, test_loss: 0.9914, test_f1: 0.5281
 epoch: 38, train_loss: 0.8583, test_loss: 0.9414, test_f1: 0.5482
 epoch: 39, train_loss: 0.8506, test_loss: 1.0329, test_f1: 0.5477
 epoch: 40, train_loss: 0.8662, test_loss: 0.9853, test_f1: 0.5562
 epoch: 41, train_loss: 0.8410, test_loss: 1.0224, test_f1: 0.5519
 epoch: 42, train_loss: 0.8596, test_loss: 0.9850, test_f1: 0.5392
 epoch: 43, train_loss: 0.8509, test_loss: 0.9579, test_f1: 0.5480
 epoch: 44, train_loss: 0.9228, test_loss: 1.0721, test_f1: 0.5358
 epoch: 45, train_loss: 0.8573, test_loss: 0.9696, test_f1: 0.5349
 epoch: 46, train_loss: 0.8284, test_loss: 0.9922, test_f1: 0.5123
 epoch: 47, train_loss: 0.8233, test_loss: 0.9862, test_f1: 0.5688
 epoch: 48, train_loss: 0.8222, test_loss: 0.9998, test_f1: 0.5540
 epoch: 49, train_loss: 0.8198, test_loss: 0.9684, test_f1: 0.5469
 epoch: 50, train_loss: 0.8139, test_loss: 1.0343, test_f1: 0.5495
 epoch: 51, train_loss: 0.7814, test_loss: 1.0519, test_f1: 0.5619
 epoch: 52, train_loss: 0.7717, test_loss: 1.0386, test_f1: 0.5721
 epoch: 53, train_loss: 0.7715, test_loss: 1.2645, test_f1: 0.5157
 epoch: 54, train_loss: 0.7719, test_loss: 1.1311, test_f1: 0.5734
 epoch: 55, train_loss: 0.7690, test_loss: 1.6683, test_f1: 0.5003
 epoch: 56, train_loss: 0.7860, test_loss: 0.9675, test_f1: 0.5686
 epoch: 57, train_loss: 0.7637, test_loss: 1.0245, test_f1: 0.5555
 epoch: 58, train_loss: 0.7816, test_loss: 1.1410, test_f1: 0.5584
 epoch: 59, train_loss: 0.7613, test_loss: 1.0745, test_f1: 0.5551
 epoch: 60, train_loss: 0.7328, test_loss: 1.0317, test_f1: 0.5666
 epoch: 61, train_loss: 0.7477, test_loss: 1.1302, test_f1: 0.5650
 epoch: 62, train_loss: 0.7363, test_loss: 1.0610, test_f1: 0.5507
 epoch: 63, train_loss: 0.7397, test_loss: 1.2611, test_f1: 0.5256
 epoch: 64, train_loss: 0.7323, test_loss: 1.0733, test_f1: 0.5779
 epoch: 65, train_loss: 0.7419, test_loss: 1.0388, test_f1: 0.5741
 epoch: 66, train_loss: 0.7421, test_loss: 1.1764, test_f1: 0.5451
 epoch: 67, train_loss: 0.7393, test_loss: 1.2993, test_f1: 0.5498
 epoch: 68, train_loss: 0.7302, test_loss: 1.0910, test_f1: 0.5796
 epoch: 69, train_loss: 0.7335, test_loss: 1.0274, test_f1: 0.5732
 epoch: 70, train_loss: 0.7180, test_loss: 1.0607, test_f1: 0.5944
 epoch: 71, train_loss: 0.7380, test_loss: 1.1065, test_f1: 0.5711
 epoch: 72, train_loss: 0.7267, test_loss: 1.1710, test_f1: 0.5791
 epoch: 73, train_loss: 0.7252, test_loss: 1.2370, test_f1: 0.5629
 epoch: 74, train_loss: 0.7117, test_loss: 1.4147, test_f1: 0.5462
 epoch: 75, train_loss: 0.7137, test_loss: 1.2423, test_f1: 0.5513
 epoch: 76, train_loss: 0.7171, test_loss: 1.1184, test_f1: 0.5646
 epoch: 77, train_loss: 0.7086, test_loss: 1.2482, test_f1: 0.5811
 epoch: 78, train_loss: 0.7059, test_loss: 1.1374, test_f1: 0.5687
 epoch: 79, train_loss: 0.7470, test_loss: 1.0711, test_f1: 0.5897
 epoch: 80, train_loss: 0.7000, test_loss: 1.1751, test_f1: 0.5620
 epoch: 81, train_loss: 0.6921, test_loss: 1.2091, test_f1: 0.5568
 epoch: 82, train_loss: 0.7135, test_loss: 1.2313, test_f1: 0.5761
 epoch: 83, train_loss: 0.6964, test_loss: 1.1951, test_f1: 0.5906
 epoch: 84, train_loss: 0.6914, test_loss: 1.4588, test_f1: 0.5646
 epoch: 85, train_loss: 0.6867, test_loss: 1.3780, test_f1: 0.5726
 epoch: 86, train_loss: 0.6954, test_loss: 1.2375, test_f1: 0.5850
 epoch: 87, train_loss: 0.6839, test_loss: 1.3130, test_f1: 0.5949
 epoch: 88, train_loss: 0.6897, test_loss: 1.3413, test_f1: 0.5801
 epoch: 89, train_loss: 0.6804, test_loss: 1.1691, test_f1: 0.6010
 epoch: 90, train_loss: 0.6697, test_loss: 1.4276, test_f1: 0.5422
 epoch: 91, train_loss: 0.6831, test_loss: 1.3556, test_f1: 0.5823
 epoch: 92, train_loss: 0.7049, test_loss: 1.5476, test_f1: 0.5383
 epoch: 93, train_loss: 0.7045, test_loss: 1.2115, test_f1: 0.5790
 epoch: 94, train_loss: 0.6735, test_loss: 1.2940, test_f1: 0.5937
 epoch: 95, train_loss: 0.6612, test_loss: 1.3479, test_f1: 0.5819
 epoch: 96, train_loss: 0.6613, test_loss: 1.3268, test_f1: 0.5923
 epoch: 97, train_loss: 0.6618, test_loss: 1.3271, test_f1: 0.5652
 epoch: 98, train_loss: 0.6615, test_loss: 1.2394, test_f1: 0.5722
 epoch: 99, train_loss: 0.6467, test_loss: 1.3543, test_f1: 0.5811
##################ITERATION #7 ****************************************
 epoch: 0, train_loss: 1.3003, test_loss: 1.2301, test_f1: 0.3675
 epoch: 1, train_loss: 1.1875, test_loss: 1.1310, test_f1: 0.4537
 epoch: 2, train_loss: 1.1244, test_loss: 1.0506, test_f1: 0.4638
 epoch: 3, train_loss: 1.0842, test_loss: 0.9680, test_f1: 0.4758
 epoch: 4, train_loss: 1.0368, test_loss: 1.0277, test_f1: 0.4585
 epoch: 5, train_loss: 1.0252, test_loss: 0.9689, test_f1: 0.4958
 epoch: 6, train_loss: 0.9990, test_loss: 1.0337, test_f1: 0.4543
 epoch: 7, train_loss: 1.0016, test_loss: 1.0668, test_f1: 0.4593
 epoch: 8, train_loss: 0.9698, test_loss: 1.0220, test_f1: 0.4918
 epoch: 9, train_loss: 0.9662, test_loss: 0.9803, test_f1: 0.5558
 epoch: 10, train_loss: 0.9473, test_loss: 1.0227, test_f1: 0.5062
 epoch: 11, train_loss: 0.9365, test_loss: 1.0419, test_f1: 0.5521
 epoch: 12, train_loss: 0.9419, test_loss: 1.0170, test_f1: 0.4730
 epoch: 13, train_loss: 0.9338, test_loss: 0.9878, test_f1: 0.5404
 epoch: 14, train_loss: 0.9275, test_loss: 1.0127, test_f1: 0.5250
 epoch: 15, train_loss: 0.9253, test_loss: 0.9819, test_f1: 0.4873
 epoch: 16, train_loss: 0.9316, test_loss: 1.0467, test_f1: 0.5221
 epoch: 17, train_loss: 0.9182, test_loss: 1.1074, test_f1: 0.5230
 epoch: 18, train_loss: 0.9019, test_loss: 1.0695, test_f1: 0.5355
 epoch: 19, train_loss: 0.9448, test_loss: 1.0095, test_f1: 0.5529
 epoch: 20, train_loss: 0.9111, test_loss: 1.1075, test_f1: 0.5296
 epoch: 21, train_loss: 0.8980, test_loss: 1.0192, test_f1: 0.5566
 epoch: 22, train_loss: 0.8737, test_loss: 0.9495, test_f1: 0.5725
 epoch: 23, train_loss: 0.8787, test_loss: 1.0384, test_f1: 0.5452
 epoch: 24, train_loss: 0.8711, test_loss: 1.0192, test_f1: 0.5468
 epoch: 25, train_loss: 0.8526, test_loss: 1.1689, test_f1: 0.5330
 epoch: 26, train_loss: 0.8844, test_loss: 0.9967, test_f1: 0.5335
 epoch: 27, train_loss: 0.8590, test_loss: 0.9765, test_f1: 0.5466
 epoch: 28, train_loss: 0.8334, test_loss: 1.0052, test_f1: 0.5882
 epoch: 29, train_loss: 0.8432, test_loss: 1.0718, test_f1: 0.5268
 epoch: 30, train_loss: 0.8602, test_loss: 0.9803, test_f1: 0.5405
 epoch: 31, train_loss: 0.8296, test_loss: 0.9706, test_f1: 0.5775
 epoch: 32, train_loss: 0.8349, test_loss: 1.0641, test_f1: 0.5200
 epoch: 33, train_loss: 0.8348, test_loss: 1.3261, test_f1: 0.4695
 epoch: 34, train_loss: 0.8322, test_loss: 1.0190, test_f1: 0.5413
 epoch: 35, train_loss: 0.8090, test_loss: 1.0322, test_f1: 0.5641
 epoch: 36, train_loss: 0.8180, test_loss: 1.0100, test_f1: 0.5760
 epoch: 37, train_loss: 0.8032, test_loss: 1.0260, test_f1: 0.5376
 epoch: 38, train_loss: 0.8031, test_loss: 1.0570, test_f1: 0.5435
 epoch: 39, train_loss: 0.8007, test_loss: 1.0626, test_f1: 0.5485
 epoch: 40, train_loss: 0.8074, test_loss: 1.1398, test_f1: 0.5551
 epoch: 41, train_loss: 0.8079, test_loss: 0.9939, test_f1: 0.5726
 epoch: 42, train_loss: 0.7952, test_loss: 1.1284, test_f1: 0.5549
 epoch: 43, train_loss: 0.7832, test_loss: 1.0882, test_f1: 0.5816
 epoch: 44, train_loss: 0.7951, test_loss: 0.9916, test_f1: 0.5801
 epoch: 45, train_loss: 0.7997, test_loss: 1.0637, test_f1: 0.5806
 epoch: 46, train_loss: 0.7563, test_loss: 1.0697, test_f1: 0.5782
 epoch: 47, train_loss: 0.7864, test_loss: 1.0700, test_f1: 0.5912
 epoch: 48, train_loss: 0.7733, test_loss: 0.9769, test_f1: 0.5703
 epoch: 49, train_loss: 0.7920, test_loss: 1.0061, test_f1: 0.5990
 epoch: 50, train_loss: 0.7678, test_loss: 1.0347, test_f1: 0.5652
 epoch: 51, train_loss: 0.7331, test_loss: 1.0315, test_f1: 0.5591
 epoch: 52, train_loss: 0.7247, test_loss: 1.1652, test_f1: 0.5462
 epoch: 53, train_loss: 0.7059, test_loss: 1.0338, test_f1: 0.5772
 epoch: 54, train_loss: 0.7159, test_loss: 1.0973, test_f1: 0.5612
 epoch: 55, train_loss: 0.6911, test_loss: 1.0519, test_f1: 0.5592
 epoch: 56, train_loss: 0.6811, test_loss: 1.0986, test_f1: 0.5753
 epoch: 57, train_loss: 0.6719, test_loss: 1.0628, test_f1: 0.5909
 epoch: 58, train_loss: 0.6847, test_loss: 1.0519, test_f1: 0.5868
 epoch: 59, train_loss: 0.6753, test_loss: 1.0497, test_f1: 0.5690
 epoch: 60, train_loss: 0.6633, test_loss: 1.1070, test_f1: 0.5912
 epoch: 61, train_loss: 0.6748, test_loss: 1.1167, test_f1: 0.5619
 epoch: 62, train_loss: 0.6741, test_loss: 1.0696, test_f1: 0.5724
 epoch: 63, train_loss: 0.6763, test_loss: 1.0896, test_f1: 0.5757
 epoch: 64, train_loss: 0.6726, test_loss: 1.1590, test_f1: 0.5805
 epoch: 65, train_loss: 0.6549, test_loss: 1.2977, test_f1: 0.5799
 epoch: 66, train_loss: 0.6710, test_loss: 1.3363, test_f1: 0.5642
 epoch: 67, train_loss: 0.6591, test_loss: 1.2437, test_f1: 0.5727
 epoch: 68, train_loss: 0.6723, test_loss: 1.1882, test_f1: 0.5922
 epoch: 69, train_loss: 0.6442, test_loss: 1.1550, test_f1: 0.5687
 epoch: 70, train_loss: 0.6578, test_loss: 1.1649, test_f1: 0.5751
 epoch: 71, train_loss: 0.6389, test_loss: 1.1900, test_f1: 0.5920
 epoch: 72, train_loss: 0.6425, test_loss: 1.2028, test_f1: 0.5664
 epoch: 73, train_loss: 0.6449, test_loss: 1.0885, test_f1: 0.5771
 epoch: 74, train_loss: 0.6407, test_loss: 1.1499, test_f1: 0.5837
 epoch: 75, train_loss: 0.6301, test_loss: 1.2931, test_f1: 0.5700
 epoch: 76, train_loss: 0.6255, test_loss: 1.1268, test_f1: 0.5590
 epoch: 77, train_loss: 0.6276, test_loss: 1.1981, test_f1: 0.5451
 epoch: 78, train_loss: 0.6211, test_loss: 1.0961, test_f1: 0.5765
 epoch: 79, train_loss: 0.6230, test_loss: 1.0732, test_f1: 0.5635
 epoch: 80, train_loss: 0.6178, test_loss: 1.0846, test_f1: 0.5575
 epoch: 81, train_loss: 0.6168, test_loss: 1.1479, test_f1: 0.5626
 epoch: 82, train_loss: 0.6281, test_loss: 1.2016, test_f1: 0.5610
 epoch: 83, train_loss: 0.6194, test_loss: 1.0957, test_f1: 0.5801
 epoch: 84, train_loss: 0.6020, test_loss: 1.1769, test_f1: 0.5628
 epoch: 85, train_loss: 0.6103, test_loss: 1.1534, test_f1: 0.5688
 epoch: 86, train_loss: 0.6075, test_loss: 1.1494, test_f1: 0.5992
 epoch: 87, train_loss: 0.5913, test_loss: 1.2005, test_f1: 0.5660
 epoch: 88, train_loss: 0.6120, test_loss: 1.1344, test_f1: 0.5648
 epoch: 89, train_loss: 0.6316, test_loss: 1.1802, test_f1: 0.5436
 epoch: 90, train_loss: 0.6105, test_loss: 1.1803, test_f1: 0.5764
 epoch: 91, train_loss: 0.6168, test_loss: 1.1715, test_f1: 0.5478
 epoch: 92, train_loss: 0.6004, test_loss: 1.2804, test_f1: 0.5571
 epoch: 93, train_loss: 0.5902, test_loss: 1.1462, test_f1: 0.5682
 epoch: 94, train_loss: 0.5702, test_loss: 1.2489, test_f1: 0.5633
 epoch: 95, train_loss: 0.5836, test_loss: 1.2401, test_f1: 0.5587
 epoch: 96, train_loss: 0.5899, test_loss: 1.1967, test_f1: 0.5647
 epoch: 97, train_loss: 0.5777, test_loss: 1.2999, test_f1: 0.5611
 epoch: 98, train_loss: 0.5946, test_loss: 1.2099, test_f1: 0.5692
 epoch: 99, train_loss: 0.5806, test_loss: 1.2580, test_f1: 0.5491
##################ITERATION #8 ****************************************
 epoch: 0, train_loss: 1.2835, test_loss: 1.3038, test_f1: 0.3228
 epoch: 1, train_loss: 1.1487, test_loss: 1.2115, test_f1: 0.4246
 epoch: 2, train_loss: 1.1078, test_loss: 1.0859, test_f1: 0.4157
 epoch: 3, train_loss: 1.0696, test_loss: 0.9399, test_f1: 0.5080
 epoch: 4, train_loss: 1.0662, test_loss: 1.0305, test_f1: 0.4780
 epoch: 5, train_loss: 1.0225, test_loss: 0.9176, test_f1: 0.5012
 epoch: 6, train_loss: 1.0226, test_loss: 1.0415, test_f1: 0.4660
 epoch: 7, train_loss: 0.9974, test_loss: 1.0215, test_f1: 0.4788
 epoch: 8, train_loss: 0.9859, test_loss: 1.0770, test_f1: 0.4552
 epoch: 9, train_loss: 0.9908, test_loss: 1.0769, test_f1: 0.4235
 epoch: 10, train_loss: 0.9600, test_loss: 1.0155, test_f1: 0.4750
 epoch: 11, train_loss: 0.9596, test_loss: 1.0096, test_f1: 0.4683
 epoch: 12, train_loss: 0.9460, test_loss: 0.9618, test_f1: 0.5427
 epoch: 13, train_loss: 0.9568, test_loss: 1.0206, test_f1: 0.4987
 epoch: 14, train_loss: 0.9428, test_loss: 0.9929, test_f1: 0.5267
 epoch: 15, train_loss: 0.9661, test_loss: 0.9782, test_f1: 0.5318
 epoch: 16, train_loss: 0.9141, test_loss: 1.1653, test_f1: 0.4497
 epoch: 17, train_loss: 0.9247, test_loss: 1.0207, test_f1: 0.5476
 epoch: 18, train_loss: 0.9099, test_loss: 1.0185, test_f1: 0.4864
 epoch: 19, train_loss: 0.9594, test_loss: 0.9742, test_f1: 0.5065
 epoch: 20, train_loss: 0.9359, test_loss: 0.9735, test_f1: 0.5278
 epoch: 21, train_loss: 0.9118, test_loss: 1.0106, test_f1: 0.5000
 epoch: 22, train_loss: 0.9149, test_loss: 1.0620, test_f1: 0.5028
 epoch: 23, train_loss: 0.9004, test_loss: 1.1242, test_f1: 0.5373
 epoch: 24, train_loss: 0.8875, test_loss: 1.0979, test_f1: 0.5631
 epoch: 25, train_loss: 0.8948, test_loss: 0.9672, test_f1: 0.5161
 epoch: 26, train_loss: 0.8844, test_loss: 1.1684, test_f1: 0.4962
 epoch: 27, train_loss: 0.8821, test_loss: 0.9533, test_f1: 0.5234
 epoch: 28, train_loss: 0.8566, test_loss: 0.9641, test_f1: 0.5488
 epoch: 29, train_loss: 0.8762, test_loss: 0.9664, test_f1: 0.5577
 epoch: 30, train_loss: 0.8609, test_loss: 0.9208, test_f1: 0.5578
 epoch: 31, train_loss: 0.8476, test_loss: 0.9768, test_f1: 0.5758
 epoch: 32, train_loss: 0.8530, test_loss: 0.9721, test_f1: 0.5710
 epoch: 33, train_loss: 0.8535, test_loss: 1.0175, test_f1: 0.5117
 epoch: 34, train_loss: 0.8555, test_loss: 1.0681, test_f1: 0.5371
 epoch: 35, train_loss: 0.8431, test_loss: 0.9872, test_f1: 0.5811
 epoch: 36, train_loss: 0.8478, test_loss: 1.0582, test_f1: 0.5283
 epoch: 37, train_loss: 0.8428, test_loss: 1.0187, test_f1: 0.5109
 epoch: 38, train_loss: 0.8351, test_loss: 0.9964, test_f1: 0.5706
 epoch: 39, train_loss: 0.8110, test_loss: 0.9344, test_f1: 0.5710
 epoch: 40, train_loss: 0.8245, test_loss: 0.9521, test_f1: 0.5592
 epoch: 41, train_loss: 0.8059, test_loss: 0.9454, test_f1: 0.5740
 epoch: 42, train_loss: 0.8334, test_loss: 0.9548, test_f1: 0.5649
 epoch: 43, train_loss: 0.8275, test_loss: 0.9546, test_f1: 0.5513
 epoch: 44, train_loss: 0.7991, test_loss: 1.0217, test_f1: 0.5781
 epoch: 45, train_loss: 0.8138, test_loss: 0.9593, test_f1: 0.5516
 epoch: 46, train_loss: 0.8041, test_loss: 0.9353, test_f1: 0.5700
 epoch: 47, train_loss: 0.8016, test_loss: 1.0229, test_f1: 0.5942
 epoch: 48, train_loss: 0.7868, test_loss: 0.9453, test_f1: 0.5788
 epoch: 49, train_loss: 0.7917, test_loss: 0.9700, test_f1: 0.5694
 epoch: 50, train_loss: 0.7667, test_loss: 1.2036, test_f1: 0.5089
 epoch: 51, train_loss: 0.7680, test_loss: 1.1580, test_f1: 0.5246
 epoch: 52, train_loss: 0.7619, test_loss: 0.9406, test_f1: 0.5700
 epoch: 53, train_loss: 0.7799, test_loss: 0.9544, test_f1: 0.5600
 epoch: 54, train_loss: 0.7459, test_loss: 0.9895, test_f1: 0.5587
 epoch: 55, train_loss: 0.7413, test_loss: 0.9473, test_f1: 0.5740
 epoch: 56, train_loss: 0.7529, test_loss: 0.9463, test_f1: 0.5640
 epoch: 57, train_loss: 0.7292, test_loss: 0.9969, test_f1: 0.5548
 epoch: 58, train_loss: 0.7242, test_loss: 1.1276, test_f1: 0.5483
 epoch: 59, train_loss: 0.7329, test_loss: 0.9463, test_f1: 0.5632
 epoch: 60, train_loss: 0.7176, test_loss: 0.9192, test_f1: 0.5673
 epoch: 61, train_loss: 0.7209, test_loss: 1.0159, test_f1: 0.5660
 epoch: 62, train_loss: 0.7147, test_loss: 1.0436, test_f1: 0.5743
 epoch: 63, train_loss: 0.7036, test_loss: 1.0254, test_f1: 0.5940
 epoch: 64, train_loss: 0.7122, test_loss: 1.1152, test_f1: 0.5364
 epoch: 65, train_loss: 0.7140, test_loss: 0.9214, test_f1: 0.5635
 epoch: 66, train_loss: 0.7023, test_loss: 0.9315, test_f1: 0.5820
 epoch: 67, train_loss: 0.6995, test_loss: 0.9804, test_f1: 0.5539
 epoch: 68, train_loss: 0.6873, test_loss: 0.9395, test_f1: 0.5660
 epoch: 69, train_loss: 0.6942, test_loss: 1.0002, test_f1: 0.5621
 epoch: 70, train_loss: 0.6973, test_loss: 1.0040, test_f1: 0.5637
 epoch: 71, train_loss: 0.7012, test_loss: 0.9595, test_f1: 0.5751
 epoch: 72, train_loss: 0.6855, test_loss: 1.0175, test_f1: 0.5572
 epoch: 73, train_loss: 0.6768, test_loss: 0.9675, test_f1: 0.5987
 epoch: 74, train_loss: 0.6812, test_loss: 1.0458, test_f1: 0.5502
 epoch: 75, train_loss: 0.6867, test_loss: 0.9894, test_f1: 0.5735
 epoch: 76, train_loss: 0.6950, test_loss: 0.9780, test_f1: 0.5665
 epoch: 77, train_loss: 0.6779, test_loss: 0.9019, test_f1: 0.5798
 epoch: 78, train_loss: 0.6800, test_loss: 0.9889, test_f1: 0.5609
 epoch: 79, train_loss: 0.6876, test_loss: 1.0545, test_f1: 0.5752
 epoch: 80, train_loss: 0.6774, test_loss: 0.9373, test_f1: 0.5623
 epoch: 81, train_loss: 0.6772, test_loss: 0.8965, test_f1: 0.5814
 epoch: 82, train_loss: 0.6784, test_loss: 0.9932, test_f1: 0.5718
 epoch: 83, train_loss: 0.6720, test_loss: 1.0164, test_f1: 0.5625
 epoch: 84, train_loss: 0.6684, test_loss: 0.9080, test_f1: 0.6018
 epoch: 85, train_loss: 0.6714, test_loss: 1.1965, test_f1: 0.5692
 epoch: 86, train_loss: 0.6852, test_loss: 1.0924, test_f1: 0.5531
 epoch: 87, train_loss: 0.6991, test_loss: 0.9307, test_f1: 0.5667
 epoch: 88, train_loss: 0.6587, test_loss: 0.9381, test_f1: 0.5930
 epoch: 89, train_loss: 0.6593, test_loss: 0.9794, test_f1: 0.5798
 epoch: 90, train_loss: 0.6672, test_loss: 1.0040, test_f1: 0.5990
 epoch: 91, train_loss: 0.6616, test_loss: 1.0509, test_f1: 0.5373
 epoch: 92, train_loss: 0.6753, test_loss: 1.0233, test_f1: 0.5465
 epoch: 93, train_loss: 0.6541, test_loss: 0.9924, test_f1: 0.5901
 epoch: 94, train_loss: 0.6605, test_loss: 1.0226, test_f1: 0.5803
 epoch: 95, train_loss: 0.6181, test_loss: 1.0030, test_f1: 0.5878
 epoch: 96, train_loss: 0.6570, test_loss: 1.0860, test_f1: 0.5951
 epoch: 97, train_loss: 0.6497, test_loss: 1.0265, test_f1: 0.5808
 epoch: 98, train_loss: 0.6463, test_loss: 1.0490, test_f1: 0.5913
 epoch: 99, train_loss: 0.6497, test_loss: 0.9486, test_f1: 0.5808
##################ITERATION #9 ****************************************
 epoch: 0, train_loss: 1.2669, test_loss: 1.1820, test_f1: 0.4240
 epoch: 1, train_loss: 1.1344, test_loss: 1.0277, test_f1: 0.4688
 epoch: 2, train_loss: 1.0892, test_loss: 1.0211, test_f1: 0.4587
 epoch: 3, train_loss: 1.0311, test_loss: 1.1803, test_f1: 0.4770
 epoch: 4, train_loss: 1.0187, test_loss: 0.9277, test_f1: 0.5091
 epoch: 5, train_loss: 0.9837, test_loss: 1.0374, test_f1: 0.4631
 epoch: 6, train_loss: 0.9589, test_loss: 1.0004, test_f1: 0.5075
 epoch: 7, train_loss: 0.9849, test_loss: 1.1097, test_f1: 0.4827
 epoch: 8, train_loss: 0.9734, test_loss: 1.0509, test_f1: 0.5095
 epoch: 9, train_loss: 0.9587, test_loss: 1.0195, test_f1: 0.5001
 epoch: 10, train_loss: 0.9387, test_loss: 0.9978, test_f1: 0.5127
 epoch: 11, train_loss: 0.9450, test_loss: 0.9994, test_f1: 0.5242
 epoch: 12, train_loss: 0.9074, test_loss: 1.3602, test_f1: 0.5286
 epoch: 13, train_loss: 0.9234, test_loss: 0.9745, test_f1: 0.5601
 epoch: 14, train_loss: 0.9178, test_loss: 1.0139, test_f1: 0.5298
 epoch: 15, train_loss: 0.8987, test_loss: 0.9649, test_f1: 0.5512
 epoch: 16, train_loss: 0.9343, test_loss: 1.0225, test_f1: 0.5459
 epoch: 17, train_loss: 0.9026, test_loss: 1.0102, test_f1: 0.5160
 epoch: 18, train_loss: 0.8942, test_loss: 0.9834, test_f1: 0.4873
 epoch: 19, train_loss: 0.8886, test_loss: 1.0201, test_f1: 0.5140
 epoch: 20, train_loss: 0.8895, test_loss: 0.9855, test_f1: 0.4963
 epoch: 21, train_loss: 0.8852, test_loss: 1.0316, test_f1: 0.4874
 epoch: 22, train_loss: 0.8931, test_loss: 1.0397, test_f1: 0.5123
 epoch: 23, train_loss: 0.8728, test_loss: 1.1410, test_f1: 0.5179
 epoch: 24, train_loss: 0.8543, test_loss: 1.0394, test_f1: 0.5339
 epoch: 25, train_loss: 0.8673, test_loss: 1.1364, test_f1: 0.5072
 epoch: 26, train_loss: 0.8711, test_loss: 0.9757, test_f1: 0.5564
 epoch: 27, train_loss: 0.8518, test_loss: 1.0130, test_f1: 0.5408
 epoch: 28, train_loss: 0.8661, test_loss: 1.0940, test_f1: 0.5112
 epoch: 29, train_loss: 0.8346, test_loss: 1.0664, test_f1: 0.5225
 epoch: 30, train_loss: 0.8557, test_loss: 1.0584, test_f1: 0.5225
 epoch: 31, train_loss: 0.8379, test_loss: 1.0144, test_f1: 0.5496
 epoch: 32, train_loss: 0.8600, test_loss: 1.0650, test_f1: 0.5476
 epoch: 33, train_loss: 0.8158, test_loss: 1.1774, test_f1: 0.5025
 epoch: 34, train_loss: 0.8435, test_loss: 1.0010, test_f1: 0.5541
 epoch: 35, train_loss: 0.8297, test_loss: 0.9724, test_f1: 0.5320
 epoch: 36, train_loss: 0.8165, test_loss: 1.0970, test_f1: 0.5416
 epoch: 37, train_loss: 0.8259, test_loss: 0.9990, test_f1: 0.5549
 epoch: 38, train_loss: 0.8212, test_loss: 0.9706, test_f1: 0.5367
 epoch: 39, train_loss: 0.7936, test_loss: 0.9461, test_f1: 0.5457
 epoch: 40, train_loss: 0.8051, test_loss: 0.9965, test_f1: 0.5377
 epoch: 41, train_loss: 0.8104, test_loss: 1.0234, test_f1: 0.5502
 epoch: 42, train_loss: 0.7897, test_loss: 1.1307, test_f1: 0.5313
 epoch: 43, train_loss: 0.7999, test_loss: 0.9759, test_f1: 0.5595
 epoch: 44, train_loss: 0.7884, test_loss: 1.0809, test_f1: 0.5541
 epoch: 45, train_loss: 0.8058, test_loss: 1.0512, test_f1: 0.5321
 epoch: 46, train_loss: 0.7770, test_loss: 1.1495, test_f1: 0.5341
 epoch: 47, train_loss: 0.8040, test_loss: 0.9719, test_f1: 0.5610
 epoch: 48, train_loss: 0.7794, test_loss: 1.0218, test_f1: 0.5273
 epoch: 49, train_loss: 0.8055, test_loss: 0.9395, test_f1: 0.5644
 epoch: 50, train_loss: 0.7814, test_loss: 1.1077, test_f1: 0.5214
 epoch: 51, train_loss: 0.7499, test_loss: 1.1180, test_f1: 0.5377
 epoch: 52, train_loss: 0.7440, test_loss: 1.2404, test_f1: 0.5587
 epoch: 53, train_loss: 0.7304, test_loss: 1.0585, test_f1: 0.5510
 epoch: 54, train_loss: 0.7258, test_loss: 1.0991, test_f1: 0.5632
 epoch: 55, train_loss: 0.7094, test_loss: 1.0974, test_f1: 0.5510
 epoch: 56, train_loss: 0.7098, test_loss: 1.0754, test_f1: 0.5609
 epoch: 57, train_loss: 0.7192, test_loss: 1.0470, test_f1: 0.5653
 epoch: 58, train_loss: 0.7215, test_loss: 1.0902, test_f1: 0.5480
 epoch: 59, train_loss: 0.7101, test_loss: 1.0485, test_f1: 0.5713
 epoch: 60, train_loss: 0.7050, test_loss: 1.0569, test_f1: 0.5593
 epoch: 61, train_loss: 0.6887, test_loss: 1.0133, test_f1: 0.5786
 epoch: 62, train_loss: 0.7205, test_loss: 1.0110, test_f1: 0.5689
 epoch: 63, train_loss: 0.6943, test_loss: 1.0587, test_f1: 0.5677
 epoch: 64, train_loss: 0.6653, test_loss: 1.0147, test_f1: 0.5729
 epoch: 65, train_loss: 0.7074, test_loss: 1.0164, test_f1: 0.5799
 epoch: 66, train_loss: 0.6886, test_loss: 1.2120, test_f1: 0.5438
 epoch: 67, train_loss: 0.6887, test_loss: 1.1564, test_f1: 0.5565
 epoch: 68, train_loss: 0.6861, test_loss: 1.1166, test_f1: 0.5900
 epoch: 69, train_loss: 0.6550, test_loss: 1.3039, test_f1: 0.5375
 epoch: 70, train_loss: 0.6612, test_loss: 1.0368, test_f1: 0.5771
 epoch: 71, train_loss: 0.6748, test_loss: 1.0983, test_f1: 0.5924
 epoch: 72, train_loss: 0.6586, test_loss: 1.2312, test_f1: 0.5423
 epoch: 73, train_loss: 0.6567, test_loss: 1.1303, test_f1: 0.5560
 epoch: 74, train_loss: 0.6535, test_loss: 1.2676, test_f1: 0.5605
 epoch: 75, train_loss: 0.6478, test_loss: 1.1568, test_f1: 0.5444
 epoch: 76, train_loss: 0.6509, test_loss: 1.1329, test_f1: 0.5651
 epoch: 77, train_loss: 0.6414, test_loss: 1.2706, test_f1: 0.5527
 epoch: 78, train_loss: 0.6865, test_loss: 1.1955, test_f1: 0.5434
 epoch: 79, train_loss: 0.6635, test_loss: 1.0908, test_f1: 0.5563
 epoch: 80, train_loss: 0.6470, test_loss: 1.1106, test_f1: 0.5833
 epoch: 81, train_loss: 0.6383, test_loss: 1.1938, test_f1: 0.5815
 epoch: 82, train_loss: 0.6441, test_loss: 1.2366, test_f1: 0.5672
 epoch: 83, train_loss: 0.6285, test_loss: 1.1908, test_f1: 0.5487
 epoch: 84, train_loss: 0.6363, test_loss: 1.1071, test_f1: 0.5944
 epoch: 85, train_loss: 0.6541, test_loss: 1.1121, test_f1: 0.5879
 epoch: 86, train_loss: 0.6350, test_loss: 1.0591, test_f1: 0.5994
 epoch: 87, train_loss: 0.6423, test_loss: 1.1280, test_f1: 0.5669
 epoch: 88, train_loss: 0.6351, test_loss: 1.2266, test_f1: 0.5256
 epoch: 89, train_loss: 0.6276, test_loss: 1.1380, test_f1: 0.5723
 epoch: 90, train_loss: 0.6219, test_loss: 1.0887, test_f1: 0.5763
 epoch: 91, train_loss: 0.6198, test_loss: 1.0984, test_f1: 0.5906
 epoch: 92, train_loss: 0.6102, test_loss: 1.1674, test_f1: 0.5446
 epoch: 93, train_loss: 0.6231, test_loss: 1.1254, test_f1: 0.5448
 epoch: 94, train_loss: 0.6211, test_loss: 1.1669, test_f1: 0.5442
 epoch: 95, train_loss: 0.6302, test_loss: 1.3056, test_f1: 0.5272
 epoch: 96, train_loss: 0.6358, test_loss: 1.1977, test_f1: 0.5494
 epoch: 97, train_loss: 0.6115, test_loss: 1.1794, test_f1: 0.5598
 epoch: 98, train_loss: 0.6013, test_loss: 1.0708, test_f1: 0.5708
 epoch: 99, train_loss: 0.6136, test_loss: 1.0825, test_f1: 0.5799

Training completed in 789.87 seconds
Best F1: 0.6157 at epoch 88
Mean F1 across iterations: 0.6025  0.0075
========================FINAL RESULTS================================
FEGIN weighted F1: 0.6157  0.0075
python main.py --data ltspice_examples --representation component_component --model FEGIN --layers 2 --hiddens 64 --batch_size 32 --lr 0.01 --emb_size 512 --epochs 100 --save_appendix component_component_L2_H64_BS32_LR0.01_E512 --no_val
-----



STDERR:
  File "main.py", line 370, in <module>
    main()
  File "main.py", line 254, in main
    dataset = dataset_class(
  File "/home/philip/projects/ltspice_examples_code_repo/Circuit-Completion-Using-GNNs/component_classification_with_link_prediction_head/evaluation/FEGIN/kernel/circuit_datasets.py", line 15, in __init__
    self.data, self.slices = torch.load(self.processed_paths[0])
  File "/home/philip/.local/lib/python3.8/site-packages/torch/serialization.py", line 1040, in load
    warnings.warn(
  File "/usr/lib/python3.8/warnings.py", line 109, in _showwarnmsg
    sw(msg.message, msg.category, msg.filename, msg.lineno,
  File "main.py", line 47, in warn_with_traceback
    traceback.print_stack(file=log)
/home/philip/projects/ltspice_examples_code_repo/Circuit-Completion-Using-GNNs/component_classification_with_link_prediction_head/evaluation/FEGIN/kernel/circuit_datasets.py:15: FutureWarning: You are using `torch.load` with `weights_only=False` (the current default value), which uses the default pickle module implicitly. It is possible to construct malicious pickle data which will execute arbitrary code during unpickling (See https://github.com/pytorch/pytorch/blob/main/SECURITY.md#untrusted-models for more details). In a future release, the default value for `weights_only` will be flipped to `True`. This limits the functions that could be executed during unpickling. Arbitrary objects will no longer be allowed to be loaded via this mode unless they are explicitly allowlisted by the user via `torch.serialization.add_safe_globals`. We recommend you start setting `weights_only=True` for any use case where you don't have full control of the loaded file. Please open an issue on GitHub for any issues related to this experimental feature.
  self.data, self.slices = torch.load(self.processed_paths[0])
