STDOUT:
Results will be saved in /home/philip/projects/ltspice_examples_code_repo/Circuit-Completion-Using-GNNs/component_classification_with_link_prediction_head/evaluation/FEGIN/results/model_FEGIN_dataset_ltspice_demos
Command line input: python main.py --data ltspice_demos --representation component_net --model FEGIN --layers 4 --hiddens 64 --batch_size 256 --lr 0.0001 --emb_size 250 --epochs 100 --save_appendix component_net_L4_H64_BS256_LR0.0001_E250 --no_val
 is saved.
-----
ltspice_demos - FEGIN
Using 4 layers, 64 hidden units, h = 2
Loading component_net representation dataset
ENTERED
Training FEGIN on component_net representation
Train: 1565, Test: 383
##################ITERATION #0 ****************************************
 epoch: 0, train_loss: 1.3652, test_loss: 1.3699, test_f1: 0.2281
 epoch: 1, train_loss: 1.3586, test_loss: 1.3693, test_f1: 0.2281
 epoch: 2, train_loss: 1.3560, test_loss: 1.3682, test_f1: 0.2281
 epoch: 3, train_loss: 1.3533, test_loss: 1.3669, test_f1: 0.2281
 epoch: 4, train_loss: 1.3484, test_loss: 1.3650, test_f1: 0.2281
 epoch: 5, train_loss: 1.3440, test_loss: 1.3633, test_f1: 0.2281
 epoch: 6, train_loss: 1.3401, test_loss: 1.3613, test_f1: 0.2281
 epoch: 7, train_loss: 1.3368, test_loss: 1.3592, test_f1: 0.2281
 epoch: 8, train_loss: 1.3316, test_loss: 1.3566, test_f1: 0.2281
 epoch: 9, train_loss: 1.3261, test_loss: 1.3535, test_f1: 0.2281
 epoch: 10, train_loss: 1.3215, test_loss: 1.3500, test_f1: 0.2281
 epoch: 11, train_loss: 1.3149, test_loss: 1.3461, test_f1: 0.2274
 epoch: 12, train_loss: 1.3091, test_loss: 1.3424, test_f1: 0.2597
 epoch: 13, train_loss: 1.3018, test_loss: 1.3385, test_f1: 0.2583
 epoch: 14, train_loss: 1.2957, test_loss: 1.3338, test_f1: 0.2583
 epoch: 15, train_loss: 1.2900, test_loss: 1.3298, test_f1: 0.2585
 epoch: 16, train_loss: 1.2819, test_loss: 1.3257, test_f1: 0.2585
 epoch: 17, train_loss: 1.2772, test_loss: 1.3211, test_f1: 0.2585
 epoch: 18, train_loss: 1.2685, test_loss: 1.3163, test_f1: 0.2587
 epoch: 19, train_loss: 1.2595, test_loss: 1.3117, test_f1: 0.2765
 epoch: 20, train_loss: 1.2555, test_loss: 1.3069, test_f1: 0.2765
 epoch: 21, train_loss: 1.2467, test_loss: 1.3025, test_f1: 0.2765
 epoch: 22, train_loss: 1.2426, test_loss: 1.2965, test_f1: 0.2721
 epoch: 23, train_loss: 1.2326, test_loss: 1.2890, test_f1: 0.2721
 epoch: 24, train_loss: 1.2282, test_loss: 1.2834, test_f1: 0.2721
 epoch: 25, train_loss: 1.2183, test_loss: 1.2781, test_f1: 0.2763
 epoch: 26, train_loss: 1.2121, test_loss: 1.2709, test_f1: 0.3008
 epoch: 27, train_loss: 1.2049, test_loss: 1.2651, test_f1: 0.2991
 epoch: 28, train_loss: 1.1996, test_loss: 1.2593, test_f1: 0.3164
 epoch: 29, train_loss: 1.1933, test_loss: 1.2530, test_f1: 0.3164
 epoch: 30, train_loss: 1.1864, test_loss: 1.2470, test_f1: 0.3164
 epoch: 31, train_loss: 1.1853, test_loss: 1.2413, test_f1: 0.3201
 epoch: 32, train_loss: 1.1767, test_loss: 1.2371, test_f1: 0.3164
 epoch: 33, train_loss: 1.1728, test_loss: 1.2326, test_f1: 0.3201
 epoch: 34, train_loss: 1.1649, test_loss: 1.2286, test_f1: 0.3237
 epoch: 35, train_loss: 1.1591, test_loss: 1.2235, test_f1: 0.3237
 epoch: 36, train_loss: 1.1516, test_loss: 1.2192, test_f1: 0.3237
 epoch: 37, train_loss: 1.1519, test_loss: 1.2149, test_f1: 0.3237
 epoch: 38, train_loss: 1.1469, test_loss: 1.2112, test_f1: 0.3237
 epoch: 39, train_loss: 1.1417, test_loss: 1.2088, test_f1: 0.3237
 epoch: 40, train_loss: 1.1397, test_loss: 1.2073, test_f1: 0.3237
 epoch: 41, train_loss: 1.1416, test_loss: 1.2055, test_f1: 0.3237
 epoch: 42, train_loss: 1.1349, test_loss: 1.2016, test_f1: 0.3237
 epoch: 43, train_loss: 1.1341, test_loss: 1.1983, test_f1: 0.3201
 epoch: 44, train_loss: 1.1301, test_loss: 1.1941, test_f1: 0.3443
 epoch: 45, train_loss: 1.1247, test_loss: 1.1914, test_f1: 0.3424
 epoch: 46, train_loss: 1.1181, test_loss: 1.1877, test_f1: 0.3443
 epoch: 47, train_loss: 1.1177, test_loss: 1.1830, test_f1: 0.3201
 epoch: 48, train_loss: 1.1176, test_loss: 1.1809, test_f1: 0.3201
 epoch: 49, train_loss: 1.1171, test_loss: 1.1780, test_f1: 0.3522
 epoch: 50, train_loss: 1.1084, test_loss: 1.1744, test_f1: 0.3527
 epoch: 51, train_loss: 1.1059, test_loss: 1.1734, test_f1: 0.3558
 epoch: 52, train_loss: 1.1037, test_loss: 1.1707, test_f1: 0.3527
 epoch: 53, train_loss: 1.1064, test_loss: 1.1696, test_f1: 0.3527
 epoch: 54, train_loss: 1.1003, test_loss: 1.1698, test_f1: 0.3558
 epoch: 55, train_loss: 1.0987, test_loss: 1.1689, test_f1: 0.3527
 epoch: 56, train_loss: 1.0970, test_loss: 1.1664, test_f1: 0.3527
 epoch: 57, train_loss: 1.0983, test_loss: 1.1651, test_f1: 0.3515
 epoch: 58, train_loss: 1.1003, test_loss: 1.1641, test_f1: 0.3547
 epoch: 59, train_loss: 1.0953, test_loss: 1.1612, test_f1: 0.3515
 epoch: 60, train_loss: 1.0937, test_loss: 1.1619, test_f1: 0.3558
 epoch: 61, train_loss: 1.0963, test_loss: 1.1601, test_f1: 0.3558
 epoch: 62, train_loss: 1.0917, test_loss: 1.1596, test_f1: 0.3558
 epoch: 63, train_loss: 1.0912, test_loss: 1.1573, test_f1: 0.3558
 epoch: 64, train_loss: 1.0936, test_loss: 1.1577, test_f1: 0.3558
 epoch: 65, train_loss: 1.0908, test_loss: 1.1551, test_f1: 0.3547
 epoch: 66, train_loss: 1.0870, test_loss: 1.1548, test_f1: 0.3566
 epoch: 67, train_loss: 1.0848, test_loss: 1.1540, test_f1: 0.3566
 epoch: 68, train_loss: 1.0904, test_loss: 1.1517, test_f1: 0.3534
 epoch: 69, train_loss: 1.0893, test_loss: 1.1511, test_f1: 0.3534
 epoch: 70, train_loss: 1.0820, test_loss: 1.1505, test_f1: 0.3566
 epoch: 71, train_loss: 1.0816, test_loss: 1.1494, test_f1: 0.3566
 epoch: 72, train_loss: 1.0831, test_loss: 1.1488, test_f1: 0.3597
 epoch: 73, train_loss: 1.0782, test_loss: 1.1478, test_f1: 0.3597
 epoch: 74, train_loss: 1.0820, test_loss: 1.1460, test_f1: 0.3534
 epoch: 75, train_loss: 1.0810, test_loss: 1.1460, test_f1: 0.3534
 epoch: 76, train_loss: 1.0810, test_loss: 1.1469, test_f1: 0.3578
 epoch: 77, train_loss: 1.0758, test_loss: 1.1458, test_f1: 0.3566
 epoch: 78, train_loss: 1.0790, test_loss: 1.1421, test_f1: 0.3566
 epoch: 79, train_loss: 1.0745, test_loss: 1.1399, test_f1: 0.3566
 epoch: 80, train_loss: 1.0730, test_loss: 1.1389, test_f1: 0.3597
 epoch: 81, train_loss: 1.0685, test_loss: 1.1380, test_f1: 0.3628
 epoch: 82, train_loss: 1.0688, test_loss: 1.1371, test_f1: 0.3589
 epoch: 83, train_loss: 1.0690, test_loss: 1.1385, test_f1: 0.3705
 epoch: 84, train_loss: 1.0718, test_loss: 1.1397, test_f1: 0.3751
 epoch: 85, train_loss: 1.0693, test_loss: 1.1355, test_f1: 0.3667
 epoch: 86, train_loss: 1.0661, test_loss: 1.1323, test_f1: 0.3730
 epoch: 87, train_loss: 1.0682, test_loss: 1.1321, test_f1: 0.3759
 epoch: 88, train_loss: 1.0637, test_loss: 1.1319, test_f1: 0.3759
 epoch: 89, train_loss: 1.0671, test_loss: 1.1292, test_f1: 0.3813
 epoch: 90, train_loss: 1.0618, test_loss: 1.1288, test_f1: 0.3834
 epoch: 91, train_loss: 1.0604, test_loss: 1.1287, test_f1: 0.3813
 epoch: 92, train_loss: 1.0605, test_loss: 1.1279, test_f1: 0.3813
 epoch: 93, train_loss: 1.0576, test_loss: 1.1283, test_f1: 0.3818
 epoch: 94, train_loss: 1.0577, test_loss: 1.1313, test_f1: 0.3854
 epoch: 95, train_loss: 1.0545, test_loss: 1.1284, test_f1: 0.3906
 epoch: 96, train_loss: 1.0535, test_loss: 1.1251, test_f1: 0.4006
 epoch: 97, train_loss: 1.0542, test_loss: 1.1268, test_f1: 0.3965
 epoch: 98, train_loss: 1.0503, test_loss: 1.1259, test_f1: 0.4099
 epoch: 99, train_loss: 1.0492, test_loss: 1.1241, test_f1: 0.4103
##################ITERATION #1 ****************************************
 epoch: 0, train_loss: 1.3256, test_loss: 1.3527, test_f1: 0.2281
 epoch: 1, train_loss: 1.3127, test_loss: 1.3491, test_f1: 0.2281
 epoch: 2, train_loss: 1.3049, test_loss: 1.3439, test_f1: 0.2281
 epoch: 3, train_loss: 1.2980, test_loss: 1.3375, test_f1: 0.2281
 epoch: 4, train_loss: 1.2897, test_loss: 1.3326, test_f1: 0.2281
 epoch: 5, train_loss: 1.2828, test_loss: 1.3299, test_f1: 0.2281
 epoch: 6, train_loss: 1.2739, test_loss: 1.3276, test_f1: 0.2281
 epoch: 7, train_loss: 1.2664, test_loss: 1.3237, test_f1: 0.2281
 epoch: 8, train_loss: 1.2583, test_loss: 1.3162, test_f1: 0.2281
 epoch: 9, train_loss: 1.2503, test_loss: 1.3081, test_f1: 0.2281
 epoch: 10, train_loss: 1.2390, test_loss: 1.2976, test_f1: 0.2281
 epoch: 11, train_loss: 1.2306, test_loss: 1.2869, test_f1: 0.2281
 epoch: 12, train_loss: 1.2238, test_loss: 1.2780, test_f1: 0.2281
 epoch: 13, train_loss: 1.2158, test_loss: 1.2685, test_f1: 0.2281
 epoch: 14, train_loss: 1.2066, test_loss: 1.2589, test_f1: 0.2281
 epoch: 15, train_loss: 1.2013, test_loss: 1.2511, test_f1: 0.2248
 epoch: 16, train_loss: 1.1916, test_loss: 1.2441, test_f1: 0.2248
 epoch: 17, train_loss: 1.1874, test_loss: 1.2389, test_f1: 0.2248
 epoch: 18, train_loss: 1.1800, test_loss: 1.2331, test_f1: 0.2450
 epoch: 19, train_loss: 1.1722, test_loss: 1.2287, test_f1: 0.2450
 epoch: 20, train_loss: 1.1687, test_loss: 1.2234, test_f1: 0.2488
 epoch: 21, train_loss: 1.1649, test_loss: 1.2180, test_f1: 0.2689
 epoch: 22, train_loss: 1.1591, test_loss: 1.2132, test_f1: 0.2862
 epoch: 23, train_loss: 1.1522, test_loss: 1.2083, test_f1: 0.2862
 epoch: 24, train_loss: 1.1474, test_loss: 1.2053, test_f1: 0.3009
 epoch: 25, train_loss: 1.1410, test_loss: 1.2033, test_f1: 0.2945
 epoch: 26, train_loss: 1.1405, test_loss: 1.2002, test_f1: 0.2945
 epoch: 27, train_loss: 1.1386, test_loss: 1.1968, test_f1: 0.2929
 epoch: 28, train_loss: 1.1337, test_loss: 1.1938, test_f1: 0.2846
 epoch: 29, train_loss: 1.1300, test_loss: 1.1915, test_f1: 0.2762
 epoch: 30, train_loss: 1.1247, test_loss: 1.1891, test_f1: 0.2862
 epoch: 31, train_loss: 1.1229, test_loss: 1.1885, test_f1: 0.2945
 epoch: 32, train_loss: 1.1183, test_loss: 1.1890, test_f1: 0.3009
 epoch: 33, train_loss: 1.1151, test_loss: 1.1857, test_f1: 0.2992
 epoch: 34, train_loss: 1.1162, test_loss: 1.1816, test_f1: 0.2992
 epoch: 35, train_loss: 1.1051, test_loss: 1.1788, test_f1: 0.2992
 epoch: 36, train_loss: 1.1078, test_loss: 1.1764, test_f1: 0.2992
 epoch: 37, train_loss: 1.1031, test_loss: 1.1747, test_f1: 0.2976
 epoch: 38, train_loss: 1.1012, test_loss: 1.1738, test_f1: 0.2976
 epoch: 39, train_loss: 1.0961, test_loss: 1.1748, test_f1: 0.3015
 epoch: 40, train_loss: 1.0938, test_loss: 1.1719, test_f1: 0.3031
 epoch: 41, train_loss: 1.0914, test_loss: 1.1713, test_f1: 0.3070
 epoch: 42, train_loss: 1.0892, test_loss: 1.1696, test_f1: 0.3048
 epoch: 43, train_loss: 1.0922, test_loss: 1.1657, test_f1: 0.3070
 epoch: 44, train_loss: 1.0816, test_loss: 1.1650, test_f1: 0.3402
 epoch: 45, train_loss: 1.0787, test_loss: 1.1596, test_f1: 0.3402
 epoch: 46, train_loss: 1.0803, test_loss: 1.1555, test_f1: 0.3453
 epoch: 47, train_loss: 1.0786, test_loss: 1.1513, test_f1: 0.3435
 epoch: 48, train_loss: 1.0786, test_loss: 1.1596, test_f1: 0.3645
 epoch: 49, train_loss: 1.0762, test_loss: 1.1678, test_f1: 0.3688
 epoch: 50, train_loss: 1.0710, test_loss: 1.1678, test_f1: 0.3729
 epoch: 51, train_loss: 1.0717, test_loss: 1.1623, test_f1: 0.3751
 epoch: 52, train_loss: 1.0742, test_loss: 1.1622, test_f1: 0.3753
 epoch: 53, train_loss: 1.0721, test_loss: 1.1602, test_f1: 0.3753
 epoch: 54, train_loss: 1.0669, test_loss: 1.1588, test_f1: 0.3753
 epoch: 55, train_loss: 1.0619, test_loss: 1.1573, test_f1: 0.3755
 epoch: 56, train_loss: 1.0589, test_loss: 1.1528, test_f1: 0.3867
 epoch: 57, train_loss: 1.0615, test_loss: 1.1529, test_f1: 0.3867
 epoch: 58, train_loss: 1.0603, test_loss: 1.1525, test_f1: 0.3865
 epoch: 59, train_loss: 1.0597, test_loss: 1.1557, test_f1: 0.3936
 epoch: 60, train_loss: 1.0532, test_loss: 1.1556, test_f1: 0.3931
 epoch: 61, train_loss: 1.0510, test_loss: 1.1505, test_f1: 0.3933
 epoch: 62, train_loss: 1.0514, test_loss: 1.1515, test_f1: 0.3933
 epoch: 63, train_loss: 1.0521, test_loss: 1.1523, test_f1: 0.3976
 epoch: 64, train_loss: 1.0544, test_loss: 1.1445, test_f1: 0.4039
 epoch: 65, train_loss: 1.0505, test_loss: 1.1476, test_f1: 0.4039
 epoch: 66, train_loss: 1.0503, test_loss: 1.1504, test_f1: 0.4026
 epoch: 67, train_loss: 1.0466, test_loss: 1.1554, test_f1: 0.4039
 epoch: 68, train_loss: 1.0488, test_loss: 1.1476, test_f1: 0.4036
 epoch: 69, train_loss: 1.0468, test_loss: 1.1447, test_f1: 0.4047
 epoch: 70, train_loss: 1.0479, test_loss: 1.1468, test_f1: 0.3995
 epoch: 71, train_loss: 1.0420, test_loss: 1.1468, test_f1: 0.4036
 epoch: 72, train_loss: 1.0446, test_loss: 1.1362, test_f1: 0.4047
 epoch: 73, train_loss: 1.0468, test_loss: 1.1340, test_f1: 0.4047
 epoch: 74, train_loss: 1.0416, test_loss: 1.1350, test_f1: 0.4047
 epoch: 75, train_loss: 1.0423, test_loss: 1.1424, test_f1: 0.4096
 epoch: 76, train_loss: 1.0354, test_loss: 1.1431, test_f1: 0.4079
 epoch: 77, train_loss: 1.0337, test_loss: 1.1420, test_f1: 0.4042
 epoch: 78, train_loss: 1.0355, test_loss: 1.1393, test_f1: 0.4163
 epoch: 79, train_loss: 1.0341, test_loss: 1.1426, test_f1: 0.4193
 epoch: 80, train_loss: 1.0363, test_loss: 1.1340, test_f1: 0.4185
 epoch: 81, train_loss: 1.0294, test_loss: 1.1378, test_f1: 0.4189
 epoch: 82, train_loss: 1.0293, test_loss: 1.1396, test_f1: 0.4148
 epoch: 83, train_loss: 1.0251, test_loss: 1.1404, test_f1: 0.4222
 epoch: 84, train_loss: 1.0308, test_loss: 1.1373, test_f1: 0.4209
 epoch: 85, train_loss: 1.0310, test_loss: 1.1325, test_f1: 0.4199
 epoch: 86, train_loss: 1.0247, test_loss: 1.1344, test_f1: 0.4175
 epoch: 87, train_loss: 1.0203, test_loss: 1.1333, test_f1: 0.4209
 epoch: 88, train_loss: 1.0215, test_loss: 1.1308, test_f1: 0.4297
 epoch: 89, train_loss: 1.0271, test_loss: 1.1219, test_f1: 0.4257
 epoch: 90, train_loss: 1.0228, test_loss: 1.1191, test_f1: 0.4150
 epoch: 91, train_loss: 1.0233, test_loss: 1.1165, test_f1: 0.4178
 epoch: 92, train_loss: 1.0136, test_loss: 1.1259, test_f1: 0.4237
 epoch: 93, train_loss: 1.0159, test_loss: 1.1355, test_f1: 0.4243
 epoch: 94, train_loss: 1.0094, test_loss: 1.1336, test_f1: 0.4225
 epoch: 95, train_loss: 1.0131, test_loss: 1.1242, test_f1: 0.4226
 epoch: 96, train_loss: 1.0097, test_loss: 1.1308, test_f1: 0.4236
 epoch: 97, train_loss: 1.0074, test_loss: 1.1304, test_f1: 0.4301
 epoch: 98, train_loss: 1.0096, test_loss: 1.1171, test_f1: 0.4353
 epoch: 99, train_loss: 1.0089, test_loss: 1.1117, test_f1: 0.4374
##################ITERATION #2 ****************************************
 epoch: 0, train_loss: 1.3045, test_loss: 1.3520, test_f1: 0.2281
 epoch: 1, train_loss: 1.2855, test_loss: 1.3517, test_f1: 0.2281
 epoch: 2, train_loss: 1.2768, test_loss: 1.3501, test_f1: 0.2281
 epoch: 3, train_loss: 1.2640, test_loss: 1.3464, test_f1: 0.2281
 epoch: 4, train_loss: 1.2551, test_loss: 1.3400, test_f1: 0.2281
 epoch: 5, train_loss: 1.2423, test_loss: 1.3297, test_f1: 0.2281
 epoch: 6, train_loss: 1.2349, test_loss: 1.3187, test_f1: 0.2281
 epoch: 7, train_loss: 1.2199, test_loss: 1.3084, test_f1: 0.2281
 epoch: 8, train_loss: 1.2157, test_loss: 1.2971, test_f1: 0.2281
 epoch: 9, train_loss: 1.2107, test_loss: 1.2835, test_f1: 0.2281
 epoch: 10, train_loss: 1.2007, test_loss: 1.2724, test_f1: 0.2281
 epoch: 11, train_loss: 1.1942, test_loss: 1.2618, test_f1: 0.2281
 epoch: 12, train_loss: 1.1847, test_loss: 1.2512, test_f1: 0.2281
 epoch: 13, train_loss: 1.1790, test_loss: 1.2406, test_f1: 0.2281
 epoch: 14, train_loss: 1.1744, test_loss: 1.2317, test_f1: 0.2281
 epoch: 15, train_loss: 1.1679, test_loss: 1.2260, test_f1: 0.2281
 epoch: 16, train_loss: 1.1627, test_loss: 1.2184, test_f1: 0.2281
 epoch: 17, train_loss: 1.1549, test_loss: 1.2147, test_f1: 0.2281
 epoch: 18, train_loss: 1.1548, test_loss: 1.2068, test_f1: 0.2281
 epoch: 19, train_loss: 1.1509, test_loss: 1.2023, test_f1: 0.2281
 epoch: 20, train_loss: 1.1477, test_loss: 1.1962, test_f1: 0.2281
 epoch: 21, train_loss: 1.1378, test_loss: 1.1928, test_f1: 0.2281
 epoch: 22, train_loss: 1.1366, test_loss: 1.1902, test_f1: 0.2281
 epoch: 23, train_loss: 1.1314, test_loss: 1.1864, test_f1: 0.2434
 epoch: 24, train_loss: 1.1249, test_loss: 1.1822, test_f1: 0.2527
 epoch: 25, train_loss: 1.1232, test_loss: 1.1779, test_f1: 0.2869
 epoch: 26, train_loss: 1.1192, test_loss: 1.1753, test_f1: 0.3006
 epoch: 27, train_loss: 1.1113, test_loss: 1.1724, test_f1: 0.2869
 epoch: 28, train_loss: 1.1161, test_loss: 1.1700, test_f1: 0.3057
 epoch: 29, train_loss: 1.1086, test_loss: 1.1671, test_f1: 0.3057
 epoch: 30, train_loss: 1.1058, test_loss: 1.1656, test_f1: 0.3057
 epoch: 31, train_loss: 1.1029, test_loss: 1.1615, test_f1: 0.3057
 epoch: 32, train_loss: 1.0982, test_loss: 1.1597, test_f1: 0.3100
 epoch: 33, train_loss: 1.0995, test_loss: 1.1581, test_f1: 0.3163
 epoch: 34, train_loss: 1.0956, test_loss: 1.1541, test_f1: 0.3215
 epoch: 35, train_loss: 1.0933, test_loss: 1.1534, test_f1: 0.3198
 epoch: 36, train_loss: 1.0892, test_loss: 1.1464, test_f1: 0.3215
 epoch: 37, train_loss: 1.0886, test_loss: 1.1400, test_f1: 0.3297
 epoch: 38, train_loss: 1.0821, test_loss: 1.1365, test_f1: 0.3600
 epoch: 39, train_loss: 1.0770, test_loss: 1.1357, test_f1: 0.3640
 epoch: 40, train_loss: 1.0752, test_loss: 1.1372, test_f1: 0.3679
 epoch: 41, train_loss: 1.0761, test_loss: 1.1389, test_f1: 0.3718
 epoch: 42, train_loss: 1.0739, test_loss: 1.1390, test_f1: 0.3689
 epoch: 43, train_loss: 1.0685, test_loss: 1.1353, test_f1: 0.3726
 epoch: 44, train_loss: 1.0690, test_loss: 1.1362, test_f1: 0.3857
 epoch: 45, train_loss: 1.0619, test_loss: 1.1374, test_f1: 0.3875
 epoch: 46, train_loss: 1.0559, test_loss: 1.1375, test_f1: 0.3886
 epoch: 47, train_loss: 1.0552, test_loss: 1.1346, test_f1: 0.3851
 epoch: 48, train_loss: 1.0567, test_loss: 1.1329, test_f1: 0.3789
 epoch: 49, train_loss: 1.0556, test_loss: 1.1253, test_f1: 0.3812
 epoch: 50, train_loss: 1.0561, test_loss: 1.1263, test_f1: 0.3865
 epoch: 51, train_loss: 1.0483, test_loss: 1.1195, test_f1: 0.3951
 epoch: 52, train_loss: 1.0447, test_loss: 1.1201, test_f1: 0.3908
 epoch: 53, train_loss: 1.0445, test_loss: 1.1191, test_f1: 0.3939
 epoch: 54, train_loss: 1.0340, test_loss: 1.1157, test_f1: 0.3942
 epoch: 55, train_loss: 1.0443, test_loss: 1.1158, test_f1: 0.3942
 epoch: 56, train_loss: 1.0389, test_loss: 1.1223, test_f1: 0.3984
 epoch: 57, train_loss: 1.0349, test_loss: 1.1153, test_f1: 0.3959
 epoch: 58, train_loss: 1.0406, test_loss: 1.1108, test_f1: 0.4004
 epoch: 59, train_loss: 1.0326, test_loss: 1.1065, test_f1: 0.4028
 epoch: 60, train_loss: 1.0389, test_loss: 1.1054, test_f1: 0.4129
 epoch: 61, train_loss: 1.0300, test_loss: 1.1071, test_f1: 0.4189
 epoch: 62, train_loss: 1.0284, test_loss: 1.1046, test_f1: 0.4210
 epoch: 63, train_loss: 1.0275, test_loss: 1.0986, test_f1: 0.4074
 epoch: 64, train_loss: 1.0289, test_loss: 1.0980, test_f1: 0.4203
 epoch: 65, train_loss: 1.0195, test_loss: 1.0999, test_f1: 0.4203
 epoch: 66, train_loss: 1.0266, test_loss: 1.1043, test_f1: 0.4240
 epoch: 67, train_loss: 1.0182, test_loss: 1.1003, test_f1: 0.4186
 epoch: 68, train_loss: 1.0220, test_loss: 1.0936, test_f1: 0.4071
 epoch: 69, train_loss: 1.0196, test_loss: 1.0987, test_f1: 0.4216
 epoch: 70, train_loss: 1.0181, test_loss: 1.0965, test_f1: 0.4268
 epoch: 71, train_loss: 1.0137, test_loss: 1.0977, test_f1: 0.4274
 epoch: 72, train_loss: 1.0255, test_loss: 1.1019, test_f1: 0.4274
 epoch: 73, train_loss: 1.0106, test_loss: 1.0974, test_f1: 0.4246
 epoch: 74, train_loss: 1.0110, test_loss: 1.0955, test_f1: 0.4183
 epoch: 75, train_loss: 1.0151, test_loss: 1.0990, test_f1: 0.4178
 epoch: 76, train_loss: 1.0074, test_loss: 1.0957, test_f1: 0.4178
 epoch: 77, train_loss: 1.0075, test_loss: 1.1011, test_f1: 0.4228
 epoch: 78, train_loss: 1.0109, test_loss: 1.0894, test_f1: 0.4222
 epoch: 79, train_loss: 1.0023, test_loss: 1.0913, test_f1: 0.4315
 epoch: 80, train_loss: 1.0036, test_loss: 1.0855, test_f1: 0.4304
 epoch: 81, train_loss: 1.0033, test_loss: 1.0942, test_f1: 0.4236
 epoch: 82, train_loss: 1.0006, test_loss: 1.0934, test_f1: 0.4219
 epoch: 83, train_loss: 0.9960, test_loss: 1.1006, test_f1: 0.4106
 epoch: 84, train_loss: 0.9977, test_loss: 1.0921, test_f1: 0.4230
 epoch: 85, train_loss: 0.9892, test_loss: 1.0884, test_f1: 0.4267
 epoch: 86, train_loss: 0.9973, test_loss: 1.0848, test_f1: 0.4228
 epoch: 87, train_loss: 0.9905, test_loss: 1.0821, test_f1: 0.4317
 epoch: 88, train_loss: 0.9926, test_loss: 1.0729, test_f1: 0.4199
 epoch: 89, train_loss: 0.9897, test_loss: 1.0812, test_f1: 0.4220
 epoch: 90, train_loss: 0.9890, test_loss: 1.0928, test_f1: 0.4198
 epoch: 91, train_loss: 0.9799, test_loss: 1.1131, test_f1: 0.4265
 epoch: 92, train_loss: 0.9792, test_loss: 1.1019, test_f1: 0.4198
 epoch: 93, train_loss: 0.9846, test_loss: 1.0877, test_f1: 0.4196
 epoch: 94, train_loss: 0.9825, test_loss: 1.0863, test_f1: 0.4230
 epoch: 95, train_loss: 0.9757, test_loss: 1.0916, test_f1: 0.4265
 epoch: 96, train_loss: 0.9790, test_loss: 1.0870, test_f1: 0.4267
 epoch: 97, train_loss: 0.9757, test_loss: 1.0807, test_f1: 0.4312
 epoch: 98, train_loss: 0.9689, test_loss: 1.0828, test_f1: 0.4292
 epoch: 99, train_loss: 0.9673, test_loss: 1.0827, test_f1: 0.4279
##################ITERATION #3 ****************************************
 epoch: 0, train_loss: 1.2764, test_loss: 1.3455, test_f1: 0.2281
 epoch: 1, train_loss: 1.2529, test_loss: 1.3395, test_f1: 0.2281
 epoch: 2, train_loss: 1.2419, test_loss: 1.3323, test_f1: 0.2281
 epoch: 3, train_loss: 1.2322, test_loss: 1.3241, test_f1: 0.2281
 epoch: 4, train_loss: 1.2230, test_loss: 1.3161, test_f1: 0.2281
 epoch: 5, train_loss: 1.2108, test_loss: 1.3090, test_f1: 0.2281
 epoch: 6, train_loss: 1.2032, test_loss: 1.3008, test_f1: 0.2281
 epoch: 7, train_loss: 1.1962, test_loss: 1.2939, test_f1: 0.2281
 epoch: 8, train_loss: 1.1899, test_loss: 1.2838, test_f1: 0.2281
 epoch: 9, train_loss: 1.1802, test_loss: 1.2690, test_f1: 0.2281
 epoch: 10, train_loss: 1.1740, test_loss: 1.2580, test_f1: 0.2281
 epoch: 11, train_loss: 1.1669, test_loss: 1.2458, test_f1: 0.2281
 epoch: 12, train_loss: 1.1595, test_loss: 1.2366, test_f1: 0.2603
 epoch: 13, train_loss: 1.1558, test_loss: 1.2289, test_f1: 0.2623
 epoch: 14, train_loss: 1.1473, test_loss: 1.2218, test_f1: 0.2599
 epoch: 15, train_loss: 1.1453, test_loss: 1.2170, test_f1: 0.2601
 epoch: 16, train_loss: 1.1375, test_loss: 1.2125, test_f1: 0.2642
 epoch: 17, train_loss: 1.1359, test_loss: 1.2095, test_f1: 0.2642
 epoch: 18, train_loss: 1.1310, test_loss: 1.2056, test_f1: 0.2831
 epoch: 19, train_loss: 1.1250, test_loss: 1.1990, test_f1: 0.3179
 epoch: 20, train_loss: 1.1204, test_loss: 1.1962, test_f1: 0.3602
 epoch: 21, train_loss: 1.1174, test_loss: 1.1931, test_f1: 0.3839
 epoch: 22, train_loss: 1.1135, test_loss: 1.1915, test_f1: 0.3866
 epoch: 23, train_loss: 1.1124, test_loss: 1.1887, test_f1: 0.3888
 epoch: 24, train_loss: 1.1055, test_loss: 1.1835, test_f1: 0.3908
 epoch: 25, train_loss: 1.1052, test_loss: 1.1811, test_f1: 0.3932
 epoch: 26, train_loss: 1.0995, test_loss: 1.1782, test_f1: 0.4018
 epoch: 27, train_loss: 1.0943, test_loss: 1.1777, test_f1: 0.3963
 epoch: 28, train_loss: 1.0925, test_loss: 1.1773, test_f1: 0.3928
 epoch: 29, train_loss: 1.0845, test_loss: 1.1718, test_f1: 0.4023
 epoch: 30, train_loss: 1.0799, test_loss: 1.1707, test_f1: 0.4186
 epoch: 31, train_loss: 1.0834, test_loss: 1.1704, test_f1: 0.4202
 epoch: 32, train_loss: 1.0775, test_loss: 1.1637, test_f1: 0.4244
 epoch: 33, train_loss: 1.0730, test_loss: 1.1653, test_f1: 0.4310
 epoch: 34, train_loss: 1.0693, test_loss: 1.1575, test_f1: 0.4166
 epoch: 35, train_loss: 1.0664, test_loss: 1.1592, test_f1: 0.4210
 epoch: 36, train_loss: 1.0651, test_loss: 1.1573, test_f1: 0.4246
 epoch: 37, train_loss: 1.0616, test_loss: 1.1545, test_f1: 0.4195
 epoch: 38, train_loss: 1.0527, test_loss: 1.1483, test_f1: 0.4301
 epoch: 39, train_loss: 1.0554, test_loss: 1.1486, test_f1: 0.4381
 epoch: 40, train_loss: 1.0475, test_loss: 1.1522, test_f1: 0.4315
 epoch: 41, train_loss: 1.0490, test_loss: 1.1522, test_f1: 0.4314
 epoch: 42, train_loss: 1.0486, test_loss: 1.1485, test_f1: 0.4306
 epoch: 43, train_loss: 1.0381, test_loss: 1.1465, test_f1: 0.4271
 epoch: 44, train_loss: 1.0332, test_loss: 1.1446, test_f1: 0.4210
 epoch: 45, train_loss: 1.0392, test_loss: 1.1468, test_f1: 0.4234
 epoch: 46, train_loss: 1.0335, test_loss: 1.1435, test_f1: 0.4256
 epoch: 47, train_loss: 1.0267, test_loss: 1.1407, test_f1: 0.4265
 epoch: 48, train_loss: 1.0244, test_loss: 1.1423, test_f1: 0.4305
 epoch: 49, train_loss: 1.0227, test_loss: 1.1469, test_f1: 0.4420
 epoch: 50, train_loss: 1.0158, test_loss: 1.1423, test_f1: 0.4340
 epoch: 51, train_loss: 1.0188, test_loss: 1.1389, test_f1: 0.4350
 epoch: 52, train_loss: 1.0070, test_loss: 1.1393, test_f1: 0.4365
 epoch: 53, train_loss: 1.0087, test_loss: 1.1432, test_f1: 0.4424
 epoch: 54, train_loss: 1.0140, test_loss: 1.1334, test_f1: 0.4327
 epoch: 55, train_loss: 1.0007, test_loss: 1.1268, test_f1: 0.4363
 epoch: 56, train_loss: 1.0052, test_loss: 1.1251, test_f1: 0.4363
 epoch: 57, train_loss: 1.0020, test_loss: 1.1356, test_f1: 0.4298
 epoch: 58, train_loss: 1.0030, test_loss: 1.1309, test_f1: 0.4319
 epoch: 59, train_loss: 1.0005, test_loss: 1.1281, test_f1: 0.4311
 epoch: 60, train_loss: 0.9985, test_loss: 1.1271, test_f1: 0.4330
 epoch: 61, train_loss: 0.9913, test_loss: 1.1287, test_f1: 0.4449
 epoch: 62, train_loss: 0.9968, test_loss: 1.1363, test_f1: 0.4485
 epoch: 63, train_loss: 0.9975, test_loss: 1.1300, test_f1: 0.4484
 epoch: 64, train_loss: 0.9875, test_loss: 1.1351, test_f1: 0.4525
 epoch: 65, train_loss: 0.9943, test_loss: 1.1310, test_f1: 0.4508
 epoch: 66, train_loss: 0.9938, test_loss: 1.1330, test_f1: 0.4503
 epoch: 67, train_loss: 0.9892, test_loss: 1.1266, test_f1: 0.4474
 epoch: 68, train_loss: 0.9893, test_loss: 1.1287, test_f1: 0.4497
 epoch: 69, train_loss: 0.9917, test_loss: 1.1267, test_f1: 0.4448
 epoch: 70, train_loss: 0.9866, test_loss: 1.1269, test_f1: 0.4427
 epoch: 71, train_loss: 0.9871, test_loss: 1.1272, test_f1: 0.4469
 epoch: 72, train_loss: 0.9831, test_loss: 1.1267, test_f1: 0.4505
 epoch: 73, train_loss: 0.9750, test_loss: 1.1322, test_f1: 0.4483
 epoch: 74, train_loss: 0.9806, test_loss: 1.1331, test_f1: 0.4505
 epoch: 75, train_loss: 0.9890, test_loss: 1.1360, test_f1: 0.4506
 epoch: 76, train_loss: 0.9817, test_loss: 1.1384, test_f1: 0.4505
 epoch: 77, train_loss: 0.9807, test_loss: 1.1262, test_f1: 0.4527
 epoch: 78, train_loss: 0.9802, test_loss: 1.1231, test_f1: 0.4506
 epoch: 79, train_loss: 0.9783, test_loss: 1.1208, test_f1: 0.4485
 epoch: 80, train_loss: 0.9695, test_loss: 1.1289, test_f1: 0.4528
 epoch: 81, train_loss: 0.9636, test_loss: 1.1247, test_f1: 0.4528
 epoch: 82, train_loss: 0.9774, test_loss: 1.1374, test_f1: 0.4529
 epoch: 83, train_loss: 0.9669, test_loss: 1.1285, test_f1: 0.4508
 epoch: 84, train_loss: 0.9668, test_loss: 1.1195, test_f1: 0.4506
 epoch: 85, train_loss: 0.9656, test_loss: 1.1175, test_f1: 0.4528
 epoch: 86, train_loss: 0.9625, test_loss: 1.1165, test_f1: 0.4505
 epoch: 87, train_loss: 0.9569, test_loss: 1.1237, test_f1: 0.4505
 epoch: 88, train_loss: 0.9628, test_loss: 1.1285, test_f1: 0.4505
 epoch: 89, train_loss: 0.9604, test_loss: 1.1319, test_f1: 0.4499
 epoch: 90, train_loss: 0.9546, test_loss: 1.1225, test_f1: 0.4528
 epoch: 91, train_loss: 0.9567, test_loss: 1.1179, test_f1: 0.4533
 epoch: 92, train_loss: 0.9538, test_loss: 1.1123, test_f1: 0.4534
 epoch: 93, train_loss: 0.9572, test_loss: 1.1120, test_f1: 0.4512
 epoch: 94, train_loss: 0.9468, test_loss: 1.1136, test_f1: 0.4487
 epoch: 95, train_loss: 0.9530, test_loss: 1.1236, test_f1: 0.4487
 epoch: 96, train_loss: 0.9452, test_loss: 1.1287, test_f1: 0.4507
 epoch: 97, train_loss: 0.9424, test_loss: 1.1271, test_f1: 0.4509
 epoch: 98, train_loss: 0.9515, test_loss: 1.1219, test_f1: 0.4472
 epoch: 99, train_loss: 0.9486, test_loss: 1.1208, test_f1: 0.4504
##################ITERATION #4 ****************************************
 epoch: 0, train_loss: 1.2898, test_loss: 1.3594, test_f1: 0.2281
 epoch: 1, train_loss: 1.2525, test_loss: 1.3501, test_f1: 0.2281
 epoch: 2, train_loss: 1.2385, test_loss: 1.3349, test_f1: 0.2281
 epoch: 3, train_loss: 1.2234, test_loss: 1.3175, test_f1: 0.2281
 epoch: 4, train_loss: 1.2077, test_loss: 1.3021, test_f1: 0.2281
 epoch: 5, train_loss: 1.1959, test_loss: 1.2935, test_f1: 0.2281
 epoch: 6, train_loss: 1.1878, test_loss: 1.2878, test_f1: 0.2281
 epoch: 7, train_loss: 1.1808, test_loss: 1.2780, test_f1: 0.2336
 epoch: 8, train_loss: 1.1685, test_loss: 1.2686, test_f1: 0.2683
 epoch: 9, train_loss: 1.1643, test_loss: 1.2562, test_f1: 0.2757
 epoch: 10, train_loss: 1.1543, test_loss: 1.2389, test_f1: 0.2820
 epoch: 11, train_loss: 1.1493, test_loss: 1.2232, test_f1: 0.2778
 epoch: 12, train_loss: 1.1403, test_loss: 1.2144, test_f1: 0.2829
 epoch: 13, train_loss: 1.1361, test_loss: 1.2108, test_f1: 0.3024
 epoch: 14, train_loss: 1.1298, test_loss: 1.2110, test_f1: 0.3484
 epoch: 15, train_loss: 1.1267, test_loss: 1.2130, test_f1: 0.3485
 epoch: 16, train_loss: 1.1154, test_loss: 1.2212, test_f1: 0.3588
 epoch: 17, train_loss: 1.1112, test_loss: 1.2169, test_f1: 0.3860
 epoch: 18, train_loss: 1.1045, test_loss: 1.2323, test_f1: 0.3815
 epoch: 19, train_loss: 1.1016, test_loss: 1.2341, test_f1: 0.3875
 epoch: 20, train_loss: 1.0975, test_loss: 1.2255, test_f1: 0.3958
 epoch: 21, train_loss: 1.0977, test_loss: 1.2301, test_f1: 0.3889
 epoch: 22, train_loss: 1.0845, test_loss: 1.2271, test_f1: 0.3910
 epoch: 23, train_loss: 1.0835, test_loss: 1.2128, test_f1: 0.4066
 epoch: 24, train_loss: 1.0751, test_loss: 1.2128, test_f1: 0.4025
 epoch: 25, train_loss: 1.0753, test_loss: 1.2006, test_f1: 0.4156
 epoch: 26, train_loss: 1.0667, test_loss: 1.2059, test_f1: 0.4156
 epoch: 27, train_loss: 1.0660, test_loss: 1.2169, test_f1: 0.4126
 epoch: 28, train_loss: 1.0695, test_loss: 1.2168, test_f1: 0.4127
 epoch: 29, train_loss: 1.0591, test_loss: 1.2013, test_f1: 0.4180
 epoch: 30, train_loss: 1.0583, test_loss: 1.1988, test_f1: 0.4321
 epoch: 31, train_loss: 1.0544, test_loss: 1.1996, test_f1: 0.4305
 epoch: 32, train_loss: 1.0539, test_loss: 1.1913, test_f1: 0.4303
 epoch: 33, train_loss: 1.0488, test_loss: 1.1926, test_f1: 0.4312
 epoch: 34, train_loss: 1.0421, test_loss: 1.2018, test_f1: 0.4470
 epoch: 35, train_loss: 1.0371, test_loss: 1.2050, test_f1: 0.4445
 epoch: 36, train_loss: 1.0299, test_loss: 1.2020, test_f1: 0.4326
 epoch: 37, train_loss: 1.0307, test_loss: 1.1828, test_f1: 0.4366
 epoch: 38, train_loss: 1.0337, test_loss: 1.1568, test_f1: 0.4562
 epoch: 39, train_loss: 1.0259, test_loss: 1.1552, test_f1: 0.4483
 epoch: 40, train_loss: 1.0236, test_loss: 1.1631, test_f1: 0.4636
 epoch: 41, train_loss: 1.0203, test_loss: 1.1631, test_f1: 0.4554
 epoch: 42, train_loss: 1.0112, test_loss: 1.1558, test_f1: 0.4703
 epoch: 43, train_loss: 1.0106, test_loss: 1.1671, test_f1: 0.4770
 epoch: 44, train_loss: 1.0090, test_loss: 1.1486, test_f1: 0.4868
 epoch: 45, train_loss: 1.0018, test_loss: 1.1630, test_f1: 0.4744
 epoch: 46, train_loss: 0.9974, test_loss: 1.1772, test_f1: 0.4613
 epoch: 47, train_loss: 0.9952, test_loss: 1.1955, test_f1: 0.4686
 epoch: 48, train_loss: 0.9961, test_loss: 1.1936, test_f1: 0.4823
 epoch: 49, train_loss: 0.9887, test_loss: 1.1906, test_f1: 0.4840
 epoch: 50, train_loss: 0.9865, test_loss: 1.1992, test_f1: 0.4874
 epoch: 51, train_loss: 0.9807, test_loss: 1.1911, test_f1: 0.4771
 epoch: 52, train_loss: 0.9811, test_loss: 1.1758, test_f1: 0.4863
 epoch: 53, train_loss: 0.9743, test_loss: 1.1871, test_f1: 0.4897
 epoch: 54, train_loss: 0.9824, test_loss: 1.1916, test_f1: 0.4914
 epoch: 55, train_loss: 0.9742, test_loss: 1.1928, test_f1: 0.5067
 epoch: 56, train_loss: 0.9755, test_loss: 1.1926, test_f1: 0.4940
 epoch: 57, train_loss: 0.9778, test_loss: 1.1923, test_f1: 0.5007
 epoch: 58, train_loss: 0.9744, test_loss: 1.1921, test_f1: 0.5000
 epoch: 59, train_loss: 0.9727, test_loss: 1.2026, test_f1: 0.4978
 epoch: 60, train_loss: 0.9704, test_loss: 1.1889, test_f1: 0.4884
 epoch: 61, train_loss: 0.9687, test_loss: 1.1696, test_f1: 0.4970
 epoch: 62, train_loss: 0.9714, test_loss: 1.1821, test_f1: 0.4978
 epoch: 63, train_loss: 0.9634, test_loss: 1.1845, test_f1: 0.5021
 epoch: 64, train_loss: 0.9598, test_loss: 1.1944, test_f1: 0.4976
 epoch: 65, train_loss: 0.9584, test_loss: 1.1821, test_f1: 0.4924
 epoch: 66, train_loss: 0.9615, test_loss: 1.1921, test_f1: 0.4952
 epoch: 67, train_loss: 0.9543, test_loss: 1.1891, test_f1: 0.5078
 epoch: 68, train_loss: 0.9572, test_loss: 1.1793, test_f1: 0.5124
 epoch: 69, train_loss: 0.9635, test_loss: 1.1712, test_f1: 0.5198
 epoch: 70, train_loss: 0.9461, test_loss: 1.1243, test_f1: 0.5193
 epoch: 71, train_loss: 0.9466, test_loss: 1.1451, test_f1: 0.5246
 epoch: 72, train_loss: 0.9434, test_loss: 1.1632, test_f1: 0.5070
 epoch: 73, train_loss: 0.9454, test_loss: 1.1614, test_f1: 0.5105
 epoch: 74, train_loss: 0.9516, test_loss: 1.1722, test_f1: 0.5288
 epoch: 75, train_loss: 0.9506, test_loss: 1.1835, test_f1: 0.5141
 epoch: 76, train_loss: 0.9449, test_loss: 1.1857, test_f1: 0.5173
 epoch: 77, train_loss: 0.9373, test_loss: 1.1852, test_f1: 0.5181
 epoch: 78, train_loss: 0.9355, test_loss: 1.1844, test_f1: 0.5130
 epoch: 79, train_loss: 0.9367, test_loss: 1.1954, test_f1: 0.5188
 epoch: 80, train_loss: 0.9351, test_loss: 1.1762, test_f1: 0.5157
 epoch: 81, train_loss: 0.9352, test_loss: 1.1683, test_f1: 0.5136
 epoch: 82, train_loss: 0.9337, test_loss: 1.1903, test_f1: 0.5077
 epoch: 83, train_loss: 0.9334, test_loss: 1.1744, test_f1: 0.5250
 epoch: 84, train_loss: 0.9327, test_loss: 1.1422, test_f1: 0.5229
 epoch: 85, train_loss: 0.9287, test_loss: 1.1538, test_f1: 0.5164
 epoch: 86, train_loss: 0.9264, test_loss: 1.1583, test_f1: 0.5455
 epoch: 87, train_loss: 0.9208, test_loss: 1.1719, test_f1: 0.5417
 epoch: 88, train_loss: 0.9270, test_loss: 1.1729, test_f1: 0.5366
 epoch: 89, train_loss: 0.9202, test_loss: 1.1692, test_f1: 0.5227
 epoch: 90, train_loss: 0.9149, test_loss: 1.1643, test_f1: 0.5192
 epoch: 91, train_loss: 0.9188, test_loss: 1.1684, test_f1: 0.5275
 epoch: 92, train_loss: 0.9200, test_loss: 1.1625, test_f1: 0.5416
 epoch: 93, train_loss: 0.9113, test_loss: 1.1626, test_f1: 0.5416
 epoch: 94, train_loss: 0.9190, test_loss: 1.1759, test_f1: 0.5346
 epoch: 95, train_loss: 0.9202, test_loss: 1.1668, test_f1: 0.5435
 epoch: 96, train_loss: 0.9126, test_loss: 1.1654, test_f1: 0.5468
 epoch: 97, train_loss: 0.9120, test_loss: 1.1719, test_f1: 0.5502
 epoch: 98, train_loss: 0.9141, test_loss: 1.1783, test_f1: 0.5532
 epoch: 99, train_loss: 0.9074, test_loss: 1.1885, test_f1: 0.5563
##################ITERATION #5 ****************************************
 epoch: 0, train_loss: 1.2651, test_loss: 1.3287, test_f1: 0.2281
 epoch: 1, train_loss: 1.2301, test_loss: 1.3162, test_f1: 0.2281
 epoch: 2, train_loss: 1.2203, test_loss: 1.3041, test_f1: 0.2281
 epoch: 3, train_loss: 1.2091, test_loss: 1.2962, test_f1: 0.2281
 epoch: 4, train_loss: 1.2002, test_loss: 1.2913, test_f1: 0.2281
 epoch: 5, train_loss: 1.1908, test_loss: 1.2911, test_f1: 0.2281
 epoch: 6, train_loss: 1.1831, test_loss: 1.2882, test_f1: 0.2281
 epoch: 7, train_loss: 1.1695, test_loss: 1.2776, test_f1: 0.2281
 epoch: 8, train_loss: 1.1642, test_loss: 1.2605, test_f1: 0.2281
 epoch: 9, train_loss: 1.1541, test_loss: 1.2447, test_f1: 0.2281
 epoch: 10, train_loss: 1.1495, test_loss: 1.2319, test_f1: 0.2501
 epoch: 11, train_loss: 1.1444, test_loss: 1.2201, test_f1: 0.2687
 epoch: 12, train_loss: 1.1347, test_loss: 1.2111, test_f1: 0.3207
 epoch: 13, train_loss: 1.1302, test_loss: 1.2031, test_f1: 0.3234
 epoch: 14, train_loss: 1.1271, test_loss: 1.1933, test_f1: 0.3321
 epoch: 15, train_loss: 1.1133, test_loss: 1.1887, test_f1: 0.3435
 epoch: 16, train_loss: 1.1143, test_loss: 1.1851, test_f1: 0.3499
 epoch: 17, train_loss: 1.1075, test_loss: 1.1819, test_f1: 0.3553
 epoch: 18, train_loss: 1.1034, test_loss: 1.1764, test_f1: 0.3566
 epoch: 19, train_loss: 1.0925, test_loss: 1.1754, test_f1: 0.3615
 epoch: 20, train_loss: 1.0928, test_loss: 1.1663, test_f1: 0.3779
 epoch: 21, train_loss: 1.0910, test_loss: 1.1661, test_f1: 0.3804
 epoch: 22, train_loss: 1.0804, test_loss: 1.1581, test_f1: 0.3906
 epoch: 23, train_loss: 1.0821, test_loss: 1.1464, test_f1: 0.3928
 epoch: 24, train_loss: 1.0721, test_loss: 1.1432, test_f1: 0.4100
 epoch: 25, train_loss: 1.0687, test_loss: 1.1407, test_f1: 0.4115
 epoch: 26, train_loss: 1.0700, test_loss: 1.1386, test_f1: 0.4078
 epoch: 27, train_loss: 1.0607, test_loss: 1.1342, test_f1: 0.4109
 epoch: 28, train_loss: 1.0651, test_loss: 1.1299, test_f1: 0.4186
 epoch: 29, train_loss: 1.0505, test_loss: 1.1286, test_f1: 0.4143
 epoch: 30, train_loss: 1.0485, test_loss: 1.1234, test_f1: 0.4133
 epoch: 31, train_loss: 1.0443, test_loss: 1.1191, test_f1: 0.4088
 epoch: 32, train_loss: 1.0411, test_loss: 1.1112, test_f1: 0.4137
 epoch: 33, train_loss: 1.0372, test_loss: 1.1116, test_f1: 0.4119
 epoch: 34, train_loss: 1.0366, test_loss: 1.1058, test_f1: 0.4073
 epoch: 35, train_loss: 1.0365, test_loss: 1.1044, test_f1: 0.4135
 epoch: 36, train_loss: 1.0287, test_loss: 1.1081, test_f1: 0.4079
 epoch: 37, train_loss: 1.0245, test_loss: 1.0995, test_f1: 0.4186
 epoch: 38, train_loss: 1.0137, test_loss: 1.0936, test_f1: 0.4176
 epoch: 39, train_loss: 1.0226, test_loss: 1.0937, test_f1: 0.4136
 epoch: 40, train_loss: 1.0172, test_loss: 1.0981, test_f1: 0.4140
 epoch: 41, train_loss: 1.0112, test_loss: 1.0874, test_f1: 0.4175
 epoch: 42, train_loss: 1.0160, test_loss: 1.0855, test_f1: 0.4304
 epoch: 43, train_loss: 1.0050, test_loss: 1.0889, test_f1: 0.4265
 epoch: 44, train_loss: 1.0008, test_loss: 1.0820, test_f1: 0.4226
 epoch: 45, train_loss: 0.9986, test_loss: 1.0800, test_f1: 0.4070
 epoch: 46, train_loss: 0.9967, test_loss: 1.0794, test_f1: 0.4069
 epoch: 47, train_loss: 0.9828, test_loss: 1.0864, test_f1: 0.4277
 epoch: 48, train_loss: 0.9941, test_loss: 1.0834, test_f1: 0.4195
 epoch: 49, train_loss: 0.9834, test_loss: 1.0740, test_f1: 0.4242
 epoch: 50, train_loss: 0.9793, test_loss: 1.0760, test_f1: 0.4248
 epoch: 51, train_loss: 0.9821, test_loss: 1.0813, test_f1: 0.4193
 epoch: 52, train_loss: 0.9783, test_loss: 1.0797, test_f1: 0.4184
 epoch: 53, train_loss: 0.9823, test_loss: 1.0797, test_f1: 0.4070
 epoch: 54, train_loss: 0.9793, test_loss: 1.0820, test_f1: 0.4090
 epoch: 55, train_loss: 0.9758, test_loss: 1.0895, test_f1: 0.4170
 epoch: 56, train_loss: 0.9771, test_loss: 1.0999, test_f1: 0.4129
 epoch: 57, train_loss: 0.9725, test_loss: 1.0982, test_f1: 0.4204
 epoch: 58, train_loss: 0.9713, test_loss: 1.1003, test_f1: 0.4227
 epoch: 59, train_loss: 0.9664, test_loss: 1.1220, test_f1: 0.4161
 epoch: 60, train_loss: 0.9653, test_loss: 1.1187, test_f1: 0.4187
 epoch: 61, train_loss: 0.9645, test_loss: 1.1038, test_f1: 0.4229
 epoch: 62, train_loss: 0.9624, test_loss: 1.0889, test_f1: 0.4202
 epoch: 63, train_loss: 0.9699, test_loss: 1.0870, test_f1: 0.4192
 epoch: 64, train_loss: 0.9538, test_loss: 1.0957, test_f1: 0.4170
 epoch: 65, train_loss: 0.9572, test_loss: 1.1124, test_f1: 0.4170
 epoch: 66, train_loss: 0.9555, test_loss: 1.1240, test_f1: 0.4235
 epoch: 67, train_loss: 0.9582, test_loss: 1.1364, test_f1: 0.4172
 epoch: 68, train_loss: 0.9514, test_loss: 1.1383, test_f1: 0.4172
 epoch: 69, train_loss: 0.9518, test_loss: 1.1409, test_f1: 0.4151
 epoch: 70, train_loss: 0.9529, test_loss: 1.1528, test_f1: 0.4144
 epoch: 71, train_loss: 0.9496, test_loss: 1.1403, test_f1: 0.4165
 epoch: 72, train_loss: 0.9552, test_loss: 1.1330, test_f1: 0.4243
 epoch: 73, train_loss: 0.9461, test_loss: 1.1359, test_f1: 0.4270
 epoch: 74, train_loss: 0.9464, test_loss: 1.1212, test_f1: 0.4172
 epoch: 75, train_loss: 0.9446, test_loss: 1.1145, test_f1: 0.4194
 epoch: 76, train_loss: 0.9496, test_loss: 1.1129, test_f1: 0.4268
 epoch: 77, train_loss: 0.9437, test_loss: 1.1181, test_f1: 0.4249
 epoch: 78, train_loss: 0.9405, test_loss: 1.1220, test_f1: 0.4249
 epoch: 79, train_loss: 0.9360, test_loss: 1.1212, test_f1: 0.4208
 epoch: 80, train_loss: 0.9364, test_loss: 1.1460, test_f1: 0.4250
 epoch: 81, train_loss: 0.9356, test_loss: 1.1402, test_f1: 0.4481
 epoch: 82, train_loss: 0.9334, test_loss: 1.1482, test_f1: 0.4431
 epoch: 83, train_loss: 0.9287, test_loss: 1.1639, test_f1: 0.4251
 epoch: 84, train_loss: 0.9386, test_loss: 1.1439, test_f1: 0.4369
 epoch: 85, train_loss: 0.9295, test_loss: 1.1527, test_f1: 0.4417
 epoch: 86, train_loss: 0.9233, test_loss: 1.1717, test_f1: 0.4313
 epoch: 87, train_loss: 0.9208, test_loss: 1.1788, test_f1: 0.4508
 epoch: 88, train_loss: 0.9302, test_loss: 1.1706, test_f1: 0.4496
 epoch: 89, train_loss: 0.9147, test_loss: 1.1473, test_f1: 0.4497
 epoch: 90, train_loss: 0.9265, test_loss: 1.1415, test_f1: 0.4623
 epoch: 91, train_loss: 0.9289, test_loss: 1.1520, test_f1: 0.4605
 epoch: 92, train_loss: 0.9295, test_loss: 1.1648, test_f1: 0.4554
 epoch: 93, train_loss: 0.9154, test_loss: 1.1353, test_f1: 0.4637
 epoch: 94, train_loss: 0.9181, test_loss: 1.1614, test_f1: 0.4657
 epoch: 95, train_loss: 0.9118, test_loss: 1.1906, test_f1: 0.4770
 epoch: 96, train_loss: 0.9087, test_loss: 1.2215, test_f1: 0.4694
 epoch: 97, train_loss: 0.9028, test_loss: 1.2184, test_f1: 0.4810
 epoch: 98, train_loss: 0.9088, test_loss: 1.2060, test_f1: 0.4854
 epoch: 99, train_loss: 0.9185, test_loss: 1.2002, test_f1: 0.4913
##################ITERATION #6 ****************************************
 epoch: 0, train_loss: 1.2965, test_loss: 1.3675, test_f1: 0.2281
 epoch: 1, train_loss: 1.2473, test_loss: 1.3646, test_f1: 0.2281
 epoch: 2, train_loss: 1.2224, test_loss: 1.3565, test_f1: 0.2281
 epoch: 3, train_loss: 1.2099, test_loss: 1.3482, test_f1: 0.2281
 epoch: 4, train_loss: 1.1919, test_loss: 1.3430, test_f1: 0.2336
 epoch: 5, train_loss: 1.1863, test_loss: 1.3337, test_f1: 0.2739
 epoch: 6, train_loss: 1.1695, test_loss: 1.3194, test_f1: 0.2847
 epoch: 7, train_loss: 1.1642, test_loss: 1.3037, test_f1: 0.2980
 epoch: 8, train_loss: 1.1471, test_loss: 1.2831, test_f1: 0.2881
 epoch: 9, train_loss: 1.1361, test_loss: 1.2637, test_f1: 0.2869
 epoch: 10, train_loss: 1.1348, test_loss: 1.2418, test_f1: 0.2891
 epoch: 11, train_loss: 1.1294, test_loss: 1.2185, test_f1: 0.2993
 epoch: 12, train_loss: 1.1198, test_loss: 1.2068, test_f1: 0.3059
 epoch: 13, train_loss: 1.1079, test_loss: 1.1882, test_f1: 0.3331
 epoch: 14, train_loss: 1.1060, test_loss: 1.1777, test_f1: 0.3477
 epoch: 15, train_loss: 1.1025, test_loss: 1.1674, test_f1: 0.3846
 epoch: 16, train_loss: 1.0953, test_loss: 1.1636, test_f1: 0.3689
 epoch: 17, train_loss: 1.0874, test_loss: 1.1578, test_f1: 0.3849
 epoch: 18, train_loss: 1.0874, test_loss: 1.1473, test_f1: 0.3952
 epoch: 19, train_loss: 1.0845, test_loss: 1.1443, test_f1: 0.4017
 epoch: 20, train_loss: 1.0707, test_loss: 1.1337, test_f1: 0.4002
 epoch: 21, train_loss: 1.0617, test_loss: 1.1312, test_f1: 0.4067
 epoch: 22, train_loss: 1.0613, test_loss: 1.1308, test_f1: 0.4200
 epoch: 23, train_loss: 1.0541, test_loss: 1.1283, test_f1: 0.3992
 epoch: 24, train_loss: 1.0504, test_loss: 1.1357, test_f1: 0.4069
 epoch: 25, train_loss: 1.0482, test_loss: 1.1298, test_f1: 0.4203
 epoch: 26, train_loss: 1.0366, test_loss: 1.1213, test_f1: 0.4314
 epoch: 27, train_loss: 1.0460, test_loss: 1.1207, test_f1: 0.4154
 epoch: 28, train_loss: 1.0354, test_loss: 1.1172, test_f1: 0.4146
 epoch: 29, train_loss: 1.0329, test_loss: 1.1208, test_f1: 0.4116
 epoch: 30, train_loss: 1.0351, test_loss: 1.1137, test_f1: 0.4159
 epoch: 31, train_loss: 1.0264, test_loss: 1.1163, test_f1: 0.4183
 epoch: 32, train_loss: 1.0245, test_loss: 1.1319, test_f1: 0.4226
 epoch: 33, train_loss: 1.0201, test_loss: 1.1285, test_f1: 0.4269
 epoch: 34, train_loss: 1.0199, test_loss: 1.1122, test_f1: 0.4139
 epoch: 35, train_loss: 1.0032, test_loss: 1.1057, test_f1: 0.4083
 epoch: 36, train_loss: 1.0115, test_loss: 1.1078, test_f1: 0.4160
 epoch: 37, train_loss: 1.0052, test_loss: 1.1098, test_f1: 0.4236
 epoch: 38, train_loss: 1.0024, test_loss: 1.1066, test_f1: 0.4237
 epoch: 39, train_loss: 0.9983, test_loss: 1.1024, test_f1: 0.4166
 epoch: 40, train_loss: 0.9939, test_loss: 1.1107, test_f1: 0.4225
 epoch: 41, train_loss: 0.9925, test_loss: 1.1110, test_f1: 0.4276
 epoch: 42, train_loss: 0.9886, test_loss: 1.1018, test_f1: 0.4338
 epoch: 43, train_loss: 0.9882, test_loss: 1.1057, test_f1: 0.4460
 epoch: 44, train_loss: 0.9801, test_loss: 1.1073, test_f1: 0.4362
 epoch: 45, train_loss: 0.9785, test_loss: 1.1064, test_f1: 0.4414
 epoch: 46, train_loss: 0.9766, test_loss: 1.1184, test_f1: 0.4357
 epoch: 47, train_loss: 0.9707, test_loss: 1.1151, test_f1: 0.4372
 epoch: 48, train_loss: 0.9674, test_loss: 1.1113, test_f1: 0.4490
 epoch: 49, train_loss: 0.9666, test_loss: 1.1089, test_f1: 0.4411
 epoch: 50, train_loss: 0.9651, test_loss: 1.1241, test_f1: 0.4400
 epoch: 51, train_loss: 0.9654, test_loss: 1.1214, test_f1: 0.4435
 epoch: 52, train_loss: 0.9564, test_loss: 1.1093, test_f1: 0.4508
 epoch: 53, train_loss: 0.9542, test_loss: 1.1141, test_f1: 0.4554
 epoch: 54, train_loss: 0.9623, test_loss: 1.1149, test_f1: 0.4403
 epoch: 55, train_loss: 0.9670, test_loss: 1.1138, test_f1: 0.4648
 epoch: 56, train_loss: 0.9616, test_loss: 1.1067, test_f1: 0.4550
 epoch: 57, train_loss: 0.9588, test_loss: 1.1060, test_f1: 0.4447
 epoch: 58, train_loss: 0.9510, test_loss: 1.1018, test_f1: 0.4600
 epoch: 59, train_loss: 0.9523, test_loss: 1.1018, test_f1: 0.4568
 epoch: 60, train_loss: 0.9521, test_loss: 1.1029, test_f1: 0.4677
 epoch: 61, train_loss: 0.9554, test_loss: 1.1041, test_f1: 0.4739
 epoch: 62, train_loss: 0.9465, test_loss: 1.1029, test_f1: 0.4723
 epoch: 63, train_loss: 0.9483, test_loss: 1.1082, test_f1: 0.4699
 epoch: 64, train_loss: 0.9454, test_loss: 1.1164, test_f1: 0.4590
 epoch: 65, train_loss: 0.9347, test_loss: 1.1083, test_f1: 0.4665
 epoch: 66, train_loss: 0.9379, test_loss: 1.1050, test_f1: 0.4565
 epoch: 67, train_loss: 0.9402, test_loss: 1.1004, test_f1: 0.4714
 epoch: 68, train_loss: 0.9420, test_loss: 1.1072, test_f1: 0.4602
 epoch: 69, train_loss: 0.9322, test_loss: 1.1111, test_f1: 0.4679
 epoch: 70, train_loss: 0.9346, test_loss: 1.1056, test_f1: 0.4724
 epoch: 71, train_loss: 0.9373, test_loss: 1.0947, test_f1: 0.4715
 epoch: 72, train_loss: 0.9282, test_loss: 1.1068, test_f1: 0.4705
 epoch: 73, train_loss: 0.9430, test_loss: 1.1019, test_f1: 0.4913
 epoch: 74, train_loss: 0.9343, test_loss: 1.0972, test_f1: 0.4837
 epoch: 75, train_loss: 0.9331, test_loss: 1.1037, test_f1: 0.4887
 epoch: 76, train_loss: 0.9318, test_loss: 1.1093, test_f1: 0.4825
 epoch: 77, train_loss: 0.9236, test_loss: 1.1079, test_f1: 0.4825
 epoch: 78, train_loss: 0.9281, test_loss: 1.1087, test_f1: 0.4870
 epoch: 79, train_loss: 0.9269, test_loss: 1.1082, test_f1: 0.4964
 epoch: 80, train_loss: 0.9307, test_loss: 1.1028, test_f1: 0.4940
 epoch: 81, train_loss: 0.9207, test_loss: 1.1012, test_f1: 0.4843
 epoch: 82, train_loss: 0.9260, test_loss: 1.1109, test_f1: 0.4787
 epoch: 83, train_loss: 0.9311, test_loss: 1.1136, test_f1: 0.4897
 epoch: 84, train_loss: 0.9118, test_loss: 1.1133, test_f1: 0.4917
 epoch: 85, train_loss: 0.9087, test_loss: 1.1088, test_f1: 0.5014
 epoch: 86, train_loss: 0.9225, test_loss: 1.1096, test_f1: 0.4936
 epoch: 87, train_loss: 0.9091, test_loss: 1.1091, test_f1: 0.4964
 epoch: 88, train_loss: 0.9165, test_loss: 1.1104, test_f1: 0.4920
 epoch: 89, train_loss: 0.9289, test_loss: 1.1124, test_f1: 0.4885
 epoch: 90, train_loss: 0.9102, test_loss: 1.1157, test_f1: 0.4919
 epoch: 91, train_loss: 0.9142, test_loss: 1.1186, test_f1: 0.5009
 epoch: 92, train_loss: 0.9119, test_loss: 1.1208, test_f1: 0.5115
 epoch: 93, train_loss: 0.9091, test_loss: 1.1155, test_f1: 0.5038
 epoch: 94, train_loss: 0.9174, test_loss: 1.1081, test_f1: 0.5027
 epoch: 95, train_loss: 0.9014, test_loss: 1.1000, test_f1: 0.5143
 epoch: 96, train_loss: 0.9041, test_loss: 1.0970, test_f1: 0.5122
 epoch: 97, train_loss: 0.9126, test_loss: 1.1020, test_f1: 0.5112
 epoch: 98, train_loss: 0.9040, test_loss: 1.0957, test_f1: 0.5168
 epoch: 99, train_loss: 0.8967, test_loss: 1.1064, test_f1: 0.5049
##################ITERATION #7 ****************************************
 epoch: 0, train_loss: 1.2784, test_loss: 1.3592, test_f1: 0.2281
 epoch: 1, train_loss: 1.2329, test_loss: 1.3604, test_f1: 0.2281
 epoch: 2, train_loss: 1.2108, test_loss: 1.3530, test_f1: 0.2281
 epoch: 3, train_loss: 1.2052, test_loss: 1.3469, test_f1: 0.2281
 epoch: 4, train_loss: 1.1910, test_loss: 1.3402, test_f1: 0.2281
 epoch: 5, train_loss: 1.1700, test_loss: 1.3294, test_f1: 0.2285
 epoch: 6, train_loss: 1.1726, test_loss: 1.3042, test_f1: 0.2888
 epoch: 7, train_loss: 1.1614, test_loss: 1.2776, test_f1: 0.2979
 epoch: 8, train_loss: 1.1513, test_loss: 1.2564, test_f1: 0.3033
 epoch: 9, train_loss: 1.1358, test_loss: 1.2348, test_f1: 0.3216
 epoch: 10, train_loss: 1.1337, test_loss: 1.2148, test_f1: 0.3164
 epoch: 11, train_loss: 1.1200, test_loss: 1.2059, test_f1: 0.3252
 epoch: 12, train_loss: 1.1230, test_loss: 1.1887, test_f1: 0.3429
 epoch: 13, train_loss: 1.1011, test_loss: 1.1778, test_f1: 0.3596
 epoch: 14, train_loss: 1.1021, test_loss: 1.1663, test_f1: 0.3765
 epoch: 15, train_loss: 1.1003, test_loss: 1.1621, test_f1: 0.3874
 epoch: 16, train_loss: 1.0857, test_loss: 1.1580, test_f1: 0.4045
 epoch: 17, train_loss: 1.0829, test_loss: 1.1511, test_f1: 0.4006
 epoch: 18, train_loss: 1.0796, test_loss: 1.1464, test_f1: 0.4008
 epoch: 19, train_loss: 1.0733, test_loss: 1.1422, test_f1: 0.4024
 epoch: 20, train_loss: 1.0662, test_loss: 1.1350, test_f1: 0.3895
 epoch: 21, train_loss: 1.0718, test_loss: 1.1290, test_f1: 0.3940
 epoch: 22, train_loss: 1.0546, test_loss: 1.1257, test_f1: 0.3962
 epoch: 23, train_loss: 1.0570, test_loss: 1.1161, test_f1: 0.4062
 epoch: 24, train_loss: 1.0410, test_loss: 1.1159, test_f1: 0.3999
 epoch: 25, train_loss: 1.0513, test_loss: 1.1144, test_f1: 0.4154
 epoch: 26, train_loss: 1.0374, test_loss: 1.1165, test_f1: 0.4125
 epoch: 27, train_loss: 1.0401, test_loss: 1.1170, test_f1: 0.4133
 epoch: 28, train_loss: 1.0351, test_loss: 1.1102, test_f1: 0.4011
 epoch: 29, train_loss: 1.0296, test_loss: 1.1066, test_f1: 0.4034
 epoch: 30, train_loss: 1.0315, test_loss: 1.1034, test_f1: 0.4316
 epoch: 31, train_loss: 1.0274, test_loss: 1.1094, test_f1: 0.4299
 epoch: 32, train_loss: 1.0177, test_loss: 1.1076, test_f1: 0.4280
 epoch: 33, train_loss: 1.0089, test_loss: 1.1078, test_f1: 0.4273
 epoch: 34, train_loss: 1.0133, test_loss: 1.1031, test_f1: 0.4211
 epoch: 35, train_loss: 1.0073, test_loss: 1.1001, test_f1: 0.4211
 epoch: 36, train_loss: 1.0129, test_loss: 1.0938, test_f1: 0.4175
 epoch: 37, train_loss: 1.0108, test_loss: 1.0949, test_f1: 0.4252
 epoch: 38, train_loss: 1.0071, test_loss: 1.0963, test_f1: 0.4303
 epoch: 39, train_loss: 1.0040, test_loss: 1.0814, test_f1: 0.4375
 epoch: 40, train_loss: 0.9884, test_loss: 1.0822, test_f1: 0.4406
 epoch: 41, train_loss: 0.9947, test_loss: 1.0838, test_f1: 0.4387
 epoch: 42, train_loss: 0.9955, test_loss: 1.0805, test_f1: 0.4461
 epoch: 43, train_loss: 0.9953, test_loss: 1.0770, test_f1: 0.4396
 epoch: 44, train_loss: 1.0005, test_loss: 1.0839, test_f1: 0.4537
 epoch: 45, train_loss: 0.9844, test_loss: 1.0874, test_f1: 0.4534
 epoch: 46, train_loss: 0.9857, test_loss: 1.0746, test_f1: 0.4527
 epoch: 47, train_loss: 0.9704, test_loss: 1.0644, test_f1: 0.4530
 epoch: 48, train_loss: 0.9764, test_loss: 1.0709, test_f1: 0.4309
 epoch: 49, train_loss: 0.9700, test_loss: 1.0655, test_f1: 0.4413
 epoch: 50, train_loss: 0.9830, test_loss: 1.0686, test_f1: 0.4375
 epoch: 51, train_loss: 0.9760, test_loss: 1.0710, test_f1: 0.4399
 epoch: 52, train_loss: 0.9628, test_loss: 1.0676, test_f1: 0.4364
 epoch: 53, train_loss: 0.9775, test_loss: 1.0655, test_f1: 0.4461
 epoch: 54, train_loss: 0.9629, test_loss: 1.0633, test_f1: 0.4526
 epoch: 55, train_loss: 0.9733, test_loss: 1.0633, test_f1: 0.4591
 epoch: 56, train_loss: 0.9570, test_loss: 1.0557, test_f1: 0.4522
 epoch: 57, train_loss: 0.9586, test_loss: 1.0600, test_f1: 0.4504
 epoch: 58, train_loss: 0.9609, test_loss: 1.0642, test_f1: 0.4497
 epoch: 59, train_loss: 0.9623, test_loss: 1.0722, test_f1: 0.4519
 epoch: 60, train_loss: 0.9665, test_loss: 1.0638, test_f1: 0.4543
 epoch: 61, train_loss: 0.9625, test_loss: 1.0578, test_f1: 0.4546
 epoch: 62, train_loss: 0.9493, test_loss: 1.0571, test_f1: 0.4542
 epoch: 63, train_loss: 0.9530, test_loss: 1.0507, test_f1: 0.4496
 epoch: 64, train_loss: 0.9484, test_loss: 1.0493, test_f1: 0.4574
 epoch: 65, train_loss: 0.9514, test_loss: 1.0446, test_f1: 0.4569
 epoch: 66, train_loss: 0.9455, test_loss: 1.0447, test_f1: 0.4632
 epoch: 67, train_loss: 0.9517, test_loss: 1.0466, test_f1: 0.4771
 epoch: 68, train_loss: 0.9481, test_loss: 1.0474, test_f1: 0.4728
 epoch: 69, train_loss: 0.9494, test_loss: 1.0459, test_f1: 0.4703
 epoch: 70, train_loss: 0.9410, test_loss: 1.0414, test_f1: 0.4687
 epoch: 71, train_loss: 0.9395, test_loss: 1.0419, test_f1: 0.4755
 epoch: 72, train_loss: 0.9386, test_loss: 1.0421, test_f1: 0.4669
 epoch: 73, train_loss: 0.9345, test_loss: 1.0496, test_f1: 0.4666
 epoch: 74, train_loss: 0.9270, test_loss: 1.0656, test_f1: 0.4783
 epoch: 75, train_loss: 0.9310, test_loss: 1.0606, test_f1: 0.4774
 epoch: 76, train_loss: 0.9368, test_loss: 1.0519, test_f1: 0.4718
 epoch: 77, train_loss: 0.9319, test_loss: 1.0452, test_f1: 0.4850
 epoch: 78, train_loss: 0.9311, test_loss: 1.0370, test_f1: 0.4913
 epoch: 79, train_loss: 0.9355, test_loss: 1.0420, test_f1: 0.4693
 epoch: 80, train_loss: 0.9331, test_loss: 1.0422, test_f1: 0.4883
 epoch: 81, train_loss: 0.9335, test_loss: 1.0493, test_f1: 0.4909
 epoch: 82, train_loss: 0.9317, test_loss: 1.0523, test_f1: 0.5005
 epoch: 83, train_loss: 0.9263, test_loss: 1.0418, test_f1: 0.4903
 epoch: 84, train_loss: 0.9212, test_loss: 1.0331, test_f1: 0.4754
 epoch: 85, train_loss: 0.9262, test_loss: 1.0372, test_f1: 0.5007
 epoch: 86, train_loss: 0.9252, test_loss: 1.0441, test_f1: 0.5076
 epoch: 87, train_loss: 0.9162, test_loss: 1.0359, test_f1: 0.4949
 epoch: 88, train_loss: 0.9182, test_loss: 1.0310, test_f1: 0.4915
 epoch: 89, train_loss: 0.9196, test_loss: 1.0383, test_f1: 0.5034
 epoch: 90, train_loss: 0.9158, test_loss: 1.0434, test_f1: 0.4972
 epoch: 91, train_loss: 0.9240, test_loss: 1.0461, test_f1: 0.5057
 epoch: 92, train_loss: 0.9138, test_loss: 1.0523, test_f1: 0.5030
 epoch: 93, train_loss: 0.9107, test_loss: 1.0418, test_f1: 0.4974
 epoch: 94, train_loss: 0.9204, test_loss: 1.0306, test_f1: 0.5071
 epoch: 95, train_loss: 0.9100, test_loss: 1.0264, test_f1: 0.4991
 epoch: 96, train_loss: 0.9197, test_loss: 1.0342, test_f1: 0.4986
 epoch: 97, train_loss: 0.9186, test_loss: 1.0336, test_f1: 0.5153
 epoch: 98, train_loss: 0.9149, test_loss: 1.0394, test_f1: 0.5097
 epoch: 99, train_loss: 0.9038, test_loss: 1.0408, test_f1: 0.5032
##################ITERATION #8 ****************************************
 epoch: 0, train_loss: 1.2640, test_loss: 1.3447, test_f1: 0.2281
 epoch: 1, train_loss: 1.2175, test_loss: 1.3386, test_f1: 0.2281
 epoch: 2, train_loss: 1.2064, test_loss: 1.3311, test_f1: 0.2281
 epoch: 3, train_loss: 1.1871, test_loss: 1.3250, test_f1: 0.2281
 epoch: 4, train_loss: 1.1793, test_loss: 1.3224, test_f1: 0.2281
 epoch: 5, train_loss: 1.1755, test_loss: 1.3191, test_f1: 0.2620
 epoch: 6, train_loss: 1.1633, test_loss: 1.3072, test_f1: 0.2696
 epoch: 7, train_loss: 1.1440, test_loss: 1.2876, test_f1: 0.2639
 epoch: 8, train_loss: 1.1411, test_loss: 1.2636, test_f1: 0.3009
 epoch: 9, train_loss: 1.1297, test_loss: 1.2434, test_f1: 0.3227
 epoch: 10, train_loss: 1.1264, test_loss: 1.2303, test_f1: 0.3442
 epoch: 11, train_loss: 1.1118, test_loss: 1.2143, test_f1: 0.3240
 epoch: 12, train_loss: 1.1102, test_loss: 1.1961, test_f1: 0.3295
 epoch: 13, train_loss: 1.1007, test_loss: 1.1814, test_f1: 0.3278
 epoch: 14, train_loss: 1.0951, test_loss: 1.1738, test_f1: 0.3267
 epoch: 15, train_loss: 1.0838, test_loss: 1.1689, test_f1: 0.3441
 epoch: 16, train_loss: 1.0788, test_loss: 1.1638, test_f1: 0.3466
 epoch: 17, train_loss: 1.0791, test_loss: 1.1608, test_f1: 0.3507
 epoch: 18, train_loss: 1.0753, test_loss: 1.1587, test_f1: 0.3509
 epoch: 19, train_loss: 1.0704, test_loss: 1.1493, test_f1: 0.3529
 epoch: 20, train_loss: 1.0579, test_loss: 1.1409, test_f1: 0.3506
 epoch: 21, train_loss: 1.0587, test_loss: 1.1409, test_f1: 0.3482
 epoch: 22, train_loss: 1.0513, test_loss: 1.1397, test_f1: 0.3570
 epoch: 23, train_loss: 1.0458, test_loss: 1.1342, test_f1: 0.3703
 epoch: 24, train_loss: 1.0565, test_loss: 1.1298, test_f1: 0.3764
 epoch: 25, train_loss: 1.0356, test_loss: 1.1248, test_f1: 0.3811
 epoch: 26, train_loss: 1.0368, test_loss: 1.1214, test_f1: 0.3731
 epoch: 27, train_loss: 1.0270, test_loss: 1.1204, test_f1: 0.3908
 epoch: 28, train_loss: 1.0273, test_loss: 1.1156, test_f1: 0.4056
 epoch: 29, train_loss: 1.0220, test_loss: 1.1111, test_f1: 0.4080
 epoch: 30, train_loss: 1.0240, test_loss: 1.1095, test_f1: 0.4102
 epoch: 31, train_loss: 1.0247, test_loss: 1.1055, test_f1: 0.4373
 epoch: 32, train_loss: 1.0041, test_loss: 1.1023, test_f1: 0.4308
 epoch: 33, train_loss: 1.0098, test_loss: 1.1041, test_f1: 0.4572
 epoch: 34, train_loss: 1.0158, test_loss: 1.1089, test_f1: 0.4341
 epoch: 35, train_loss: 1.0031, test_loss: 1.1090, test_f1: 0.4328
 epoch: 36, train_loss: 0.9963, test_loss: 1.1089, test_f1: 0.4043
 epoch: 37, train_loss: 0.9878, test_loss: 1.1077, test_f1: 0.4398
 epoch: 38, train_loss: 0.9969, test_loss: 1.1004, test_f1: 0.4442
 epoch: 39, train_loss: 0.9852, test_loss: 1.1006, test_f1: 0.4682
 epoch: 40, train_loss: 0.9896, test_loss: 1.1164, test_f1: 0.4602
 epoch: 41, train_loss: 0.9947, test_loss: 1.1094, test_f1: 0.4574
 epoch: 42, train_loss: 0.9869, test_loss: 1.0996, test_f1: 0.4605
 epoch: 43, train_loss: 0.9752, test_loss: 1.0911, test_f1: 0.4738
 epoch: 44, train_loss: 0.9747, test_loss: 1.0915, test_f1: 0.4642
 epoch: 45, train_loss: 0.9816, test_loss: 1.0904, test_f1: 0.4651
 epoch: 46, train_loss: 0.9691, test_loss: 1.0960, test_f1: 0.4700
 epoch: 47, train_loss: 0.9654, test_loss: 1.0931, test_f1: 0.4801
 epoch: 48, train_loss: 0.9619, test_loss: 1.0944, test_f1: 0.4933
 epoch: 49, train_loss: 0.9594, test_loss: 1.0873, test_f1: 0.4967
 epoch: 50, train_loss: 0.9586, test_loss: 1.0874, test_f1: 0.4993
 epoch: 51, train_loss: 0.9574, test_loss: 1.0837, test_f1: 0.4984
 epoch: 52, train_loss: 0.9570, test_loss: 1.0870, test_f1: 0.5092
 epoch: 53, train_loss: 0.9505, test_loss: 1.0888, test_f1: 0.5052
 epoch: 54, train_loss: 0.9491, test_loss: 1.0880, test_f1: 0.5022
 epoch: 55, train_loss: 0.9626, test_loss: 1.0843, test_f1: 0.4898
 epoch: 56, train_loss: 0.9522, test_loss: 1.0917, test_f1: 0.5069
 epoch: 57, train_loss: 0.9468, test_loss: 1.0913, test_f1: 0.5049
 epoch: 58, train_loss: 0.9544, test_loss: 1.0980, test_f1: 0.5008
 epoch: 59, train_loss: 0.9510, test_loss: 1.0911, test_f1: 0.5077
 epoch: 60, train_loss: 0.9472, test_loss: 1.0879, test_f1: 0.5122
 epoch: 61, train_loss: 0.9498, test_loss: 1.0898, test_f1: 0.5144
 epoch: 62, train_loss: 0.9380, test_loss: 1.0829, test_f1: 0.5122
 epoch: 63, train_loss: 0.9356, test_loss: 1.0820, test_f1: 0.5188
 epoch: 64, train_loss: 0.9379, test_loss: 1.0883, test_f1: 0.5165
 epoch: 65, train_loss: 0.9375, test_loss: 1.0919, test_f1: 0.5209
 epoch: 66, train_loss: 0.9403, test_loss: 1.0933, test_f1: 0.5269
 epoch: 67, train_loss: 0.9441, test_loss: 1.0898, test_f1: 0.5255
 epoch: 68, train_loss: 0.9440, test_loss: 1.0847, test_f1: 0.5045
 epoch: 69, train_loss: 0.9275, test_loss: 1.0807, test_f1: 0.5215
 epoch: 70, train_loss: 0.9339, test_loss: 1.0736, test_f1: 0.5162
 epoch: 71, train_loss: 0.9417, test_loss: 1.0693, test_f1: 0.5162
 epoch: 72, train_loss: 0.9311, test_loss: 1.0726, test_f1: 0.5168
 epoch: 73, train_loss: 0.9239, test_loss: 1.0757, test_f1: 0.5168
 epoch: 74, train_loss: 0.9315, test_loss: 1.0685, test_f1: 0.5212
 epoch: 75, train_loss: 0.9175, test_loss: 1.0720, test_f1: 0.5255
 epoch: 76, train_loss: 0.9208, test_loss: 1.0800, test_f1: 0.5235
 epoch: 77, train_loss: 0.9248, test_loss: 1.0801, test_f1: 0.5152
 epoch: 78, train_loss: 0.9213, test_loss: 1.0758, test_f1: 0.5226
 epoch: 79, train_loss: 0.9258, test_loss: 1.0747, test_f1: 0.5212
 epoch: 80, train_loss: 0.9148, test_loss: 1.0730, test_f1: 0.5259
 epoch: 81, train_loss: 0.9231, test_loss: 1.0694, test_f1: 0.5191
 epoch: 82, train_loss: 0.9188, test_loss: 1.0747, test_f1: 0.5191
 epoch: 83, train_loss: 0.9143, test_loss: 1.0766, test_f1: 0.5118
 epoch: 84, train_loss: 0.9140, test_loss: 1.0741, test_f1: 0.5185
 epoch: 85, train_loss: 0.9134, test_loss: 1.0778, test_f1: 0.5187
 epoch: 86, train_loss: 0.9229, test_loss: 1.0750, test_f1: 0.5135
 epoch: 87, train_loss: 0.9135, test_loss: 1.0793, test_f1: 0.5238
 epoch: 88, train_loss: 0.9021, test_loss: 1.0793, test_f1: 0.5240
 epoch: 89, train_loss: 0.9061, test_loss: 1.0746, test_f1: 0.5376
 epoch: 90, train_loss: 0.9180, test_loss: 1.0766, test_f1: 0.5242
 epoch: 91, train_loss: 0.9047, test_loss: 1.0751, test_f1: 0.5217
 epoch: 92, train_loss: 0.9084, test_loss: 1.0727, test_f1: 0.5141
 epoch: 93, train_loss: 0.9028, test_loss: 1.0695, test_f1: 0.5312
 epoch: 94, train_loss: 0.8980, test_loss: 1.0740, test_f1: 0.5213
 epoch: 95, train_loss: 0.8949, test_loss: 1.0765, test_f1: 0.5304
 epoch: 96, train_loss: 0.8996, test_loss: 1.0794, test_f1: 0.5341
 epoch: 97, train_loss: 0.9045, test_loss: 1.0847, test_f1: 0.5384
 epoch: 98, train_loss: 0.8988, test_loss: 1.0851, test_f1: 0.5299
 epoch: 99, train_loss: 0.8944, test_loss: 1.0823, test_f1: 0.5295
##################ITERATION #9 ****************************************
 epoch: 0, train_loss: 1.2770, test_loss: 1.3323, test_f1: 0.2281
 epoch: 1, train_loss: 1.2322, test_loss: 1.3179, test_f1: 0.2281
 epoch: 2, train_loss: 1.2165, test_loss: 1.3039, test_f1: 0.2281
 epoch: 3, train_loss: 1.1942, test_loss: 1.2900, test_f1: 0.2281
 epoch: 4, train_loss: 1.1869, test_loss: 1.2825, test_f1: 0.2281
 epoch: 5, train_loss: 1.1712, test_loss: 1.2750, test_f1: 0.2281
 epoch: 6, train_loss: 1.1613, test_loss: 1.2590, test_f1: 0.2390
 epoch: 7, train_loss: 1.1519, test_loss: 1.2419, test_f1: 0.2524
 epoch: 8, train_loss: 1.1471, test_loss: 1.2281, test_f1: 0.2683
 epoch: 9, train_loss: 1.1375, test_loss: 1.2194, test_f1: 0.3011
 epoch: 10, train_loss: 1.1245, test_loss: 1.2099, test_f1: 0.3432
 epoch: 11, train_loss: 1.1196, test_loss: 1.2012, test_f1: 0.3767
 epoch: 12, train_loss: 1.1195, test_loss: 1.1945, test_f1: 0.3821
 epoch: 13, train_loss: 1.1110, test_loss: 1.1890, test_f1: 0.3612
 epoch: 14, train_loss: 1.1012, test_loss: 1.1800, test_f1: 0.3850
 epoch: 15, train_loss: 1.0948, test_loss: 1.1734, test_f1: 0.3757
 epoch: 16, train_loss: 1.0916, test_loss: 1.1691, test_f1: 0.3828
 epoch: 17, train_loss: 1.0801, test_loss: 1.1689, test_f1: 0.4162
 epoch: 18, train_loss: 1.0808, test_loss: 1.1669, test_f1: 0.4264
 epoch: 19, train_loss: 1.0774, test_loss: 1.1620, test_f1: 0.4199
 epoch: 20, train_loss: 1.0703, test_loss: 1.1585, test_f1: 0.4229
 epoch: 21, train_loss: 1.0690, test_loss: 1.1559, test_f1: 0.4284
 epoch: 22, train_loss: 1.0591, test_loss: 1.1494, test_f1: 0.4242
 epoch: 23, train_loss: 1.0520, test_loss: 1.1482, test_f1: 0.4256
 epoch: 24, train_loss: 1.0499, test_loss: 1.1423, test_f1: 0.4324
 epoch: 25, train_loss: 1.0493, test_loss: 1.1426, test_f1: 0.4293
 epoch: 26, train_loss: 1.0401, test_loss: 1.1394, test_f1: 0.4372
 epoch: 27, train_loss: 1.0404, test_loss: 1.1389, test_f1: 0.4351
 epoch: 28, train_loss: 1.0339, test_loss: 1.1356, test_f1: 0.4417
 epoch: 29, train_loss: 1.0192, test_loss: 1.1274, test_f1: 0.4430
 epoch: 30, train_loss: 1.0266, test_loss: 1.1299, test_f1: 0.4484
 epoch: 31, train_loss: 1.0200, test_loss: 1.1371, test_f1: 0.4444
 epoch: 32, train_loss: 1.0173, test_loss: 1.1343, test_f1: 0.4422
 epoch: 33, train_loss: 1.0262, test_loss: 1.1244, test_f1: 0.4479
 epoch: 34, train_loss: 1.0128, test_loss: 1.1258, test_f1: 0.4405
 epoch: 35, train_loss: 1.0093, test_loss: 1.1325, test_f1: 0.4381
 epoch: 36, train_loss: 1.0030, test_loss: 1.1418, test_f1: 0.4411
 epoch: 37, train_loss: 1.0021, test_loss: 1.1470, test_f1: 0.4545
 epoch: 38, train_loss: 0.9950, test_loss: 1.1440, test_f1: 0.4478
 epoch: 39, train_loss: 0.9875, test_loss: 1.1293, test_f1: 0.4589
 epoch: 40, train_loss: 0.9831, test_loss: 1.1254, test_f1: 0.4539
 epoch: 41, train_loss: 0.9853, test_loss: 1.1269, test_f1: 0.4575
 epoch: 42, train_loss: 0.9767, test_loss: 1.1270, test_f1: 0.4542
 epoch: 43, train_loss: 0.9780, test_loss: 1.1339, test_f1: 0.4643
 epoch: 44, train_loss: 0.9677, test_loss: 1.1384, test_f1: 0.4607
 epoch: 45, train_loss: 0.9740, test_loss: 1.1306, test_f1: 0.4623
 epoch: 46, train_loss: 0.9669, test_loss: 1.1330, test_f1: 0.4606
 epoch: 47, train_loss: 0.9587, test_loss: 1.1324, test_f1: 0.4557
 epoch: 48, train_loss: 0.9534, test_loss: 1.1342, test_f1: 0.4616
 epoch: 49, train_loss: 0.9570, test_loss: 1.1487, test_f1: 0.4738
 epoch: 50, train_loss: 0.9500, test_loss: 1.1473, test_f1: 0.4621
 epoch: 51, train_loss: 0.9543, test_loss: 1.1389, test_f1: 0.4598
 epoch: 52, train_loss: 0.9509, test_loss: 1.1307, test_f1: 0.4626
 epoch: 53, train_loss: 0.9427, test_loss: 1.1367, test_f1: 0.4575
 epoch: 54, train_loss: 0.9497, test_loss: 1.1338, test_f1: 0.4670
 epoch: 55, train_loss: 0.9449, test_loss: 1.1338, test_f1: 0.4691
 epoch: 56, train_loss: 0.9369, test_loss: 1.1369, test_f1: 0.4761
 epoch: 57, train_loss: 0.9404, test_loss: 1.1374, test_f1: 0.4811
 epoch: 58, train_loss: 0.9458, test_loss: 1.1334, test_f1: 0.4833
 epoch: 59, train_loss: 0.9436, test_loss: 1.1275, test_f1: 0.4710
 epoch: 60, train_loss: 0.9429, test_loss: 1.1305, test_f1: 0.4804
 epoch: 61, train_loss: 0.9291, test_loss: 1.1377, test_f1: 0.4764
 epoch: 62, train_loss: 0.9331, test_loss: 1.1417, test_f1: 0.4743
 epoch: 63, train_loss: 0.9324, test_loss: 1.1511, test_f1: 0.4792
 epoch: 64, train_loss: 0.9282, test_loss: 1.1462, test_f1: 0.4880
 epoch: 65, train_loss: 0.9260, test_loss: 1.1369, test_f1: 0.4929
 epoch: 66, train_loss: 0.9131, test_loss: 1.1322, test_f1: 0.4952
 epoch: 67, train_loss: 0.9240, test_loss: 1.1331, test_f1: 0.4907
 epoch: 68, train_loss: 0.9250, test_loss: 1.1323, test_f1: 0.4882
 epoch: 69, train_loss: 0.9304, test_loss: 1.1357, test_f1: 0.4878
 epoch: 70, train_loss: 0.9198, test_loss: 1.1373, test_f1: 0.4842
 epoch: 71, train_loss: 0.9234, test_loss: 1.1536, test_f1: 0.4815
 epoch: 72, train_loss: 0.9141, test_loss: 1.1519, test_f1: 0.4997
 epoch: 73, train_loss: 0.9197, test_loss: 1.1485, test_f1: 0.4951
 epoch: 74, train_loss: 0.9170, test_loss: 1.1538, test_f1: 0.4933
 epoch: 75, train_loss: 0.9242, test_loss: 1.1490, test_f1: 0.4933
 epoch: 76, train_loss: 0.9145, test_loss: 1.1385, test_f1: 0.4907
 epoch: 77, train_loss: 0.9072, test_loss: 1.1473, test_f1: 0.4954
 epoch: 78, train_loss: 0.9109, test_loss: 1.1446, test_f1: 0.4952
 epoch: 79, train_loss: 0.9065, test_loss: 1.1465, test_f1: 0.4926
 epoch: 80, train_loss: 0.9005, test_loss: 1.1504, test_f1: 0.5018
 epoch: 81, train_loss: 0.9050, test_loss: 1.1430, test_f1: 0.5012
 epoch: 82, train_loss: 0.9126, test_loss: 1.1407, test_f1: 0.4951
 epoch: 83, train_loss: 0.9076, test_loss: 1.1397, test_f1: 0.4953
 epoch: 84, train_loss: 0.9050, test_loss: 1.1490, test_f1: 0.4990
 epoch: 85, train_loss: 0.9045, test_loss: 1.1516, test_f1: 0.4882
 epoch: 86, train_loss: 0.8997, test_loss: 1.1420, test_f1: 0.4863
 epoch: 87, train_loss: 0.8936, test_loss: 1.1331, test_f1: 0.4912
 epoch: 88, train_loss: 0.9007, test_loss: 1.1360, test_f1: 0.4972
 epoch: 89, train_loss: 0.8971, test_loss: 1.1399, test_f1: 0.4969
 epoch: 90, train_loss: 0.8996, test_loss: 1.1448, test_f1: 0.5018
 epoch: 91, train_loss: 0.8952, test_loss: 1.1644, test_f1: 0.5020
 epoch: 92, train_loss: 0.8851, test_loss: 1.1609, test_f1: 0.5038
 epoch: 93, train_loss: 0.8926, test_loss: 1.1693, test_f1: 0.4995
 epoch: 94, train_loss: 0.8906, test_loss: 1.1690, test_f1: 0.5012
 epoch: 95, train_loss: 0.8877, test_loss: 1.1642, test_f1: 0.4969
 epoch: 96, train_loss: 0.8840, test_loss: 1.1652, test_f1: 0.5001
 epoch: 97, train_loss: 0.8851, test_loss: 1.1654, test_f1: 0.5065
 epoch: 98, train_loss: 0.8865, test_loss: 1.1690, test_f1: 0.5107
 epoch: 99, train_loss: 0.8857, test_loss: 1.1578, test_f1: 0.5153

Training completed in 301.45 seconds
Best F1: 0.5563 at epoch 99
Mean F1 across iterations: 0.4866  0.0474
========================FINAL RESULTS================================
FEGIN weighted F1: 0.5563  0.0474
python main.py --data ltspice_demos --representation component_net --model FEGIN --layers 4 --hiddens 64 --batch_size 256 --lr 0.0001 --emb_size 250 --epochs 100 --save_appendix component_net_L4_H64_BS256_LR0.0001_E250 --no_val
-----



STDERR:
  File "main.py", line 370, in <module>
    main()
  File "main.py", line 254, in main
    dataset = dataset_class(
  File "/home/philip/projects/ltspice_examples_code_repo/Circuit-Completion-Using-GNNs/component_classification_with_link_prediction_head/evaluation/FEGIN/kernel/circuit_datasets.py", line 15, in __init__
    self.data, self.slices = torch.load(self.processed_paths[0])
  File "/home/philip/.local/lib/python3.8/site-packages/torch/serialization.py", line 1040, in load
    warnings.warn(
  File "/usr/lib/python3.8/warnings.py", line 109, in _showwarnmsg
    sw(msg.message, msg.category, msg.filename, msg.lineno,
  File "main.py", line 47, in warn_with_traceback
    traceback.print_stack(file=log)
/home/philip/projects/ltspice_examples_code_repo/Circuit-Completion-Using-GNNs/component_classification_with_link_prediction_head/evaluation/FEGIN/kernel/circuit_datasets.py:15: FutureWarning: You are using `torch.load` with `weights_only=False` (the current default value), which uses the default pickle module implicitly. It is possible to construct malicious pickle data which will execute arbitrary code during unpickling (See https://github.com/pytorch/pytorch/blob/main/SECURITY.md#untrusted-models for more details). In a future release, the default value for `weights_only` will be flipped to `True`. This limits the functions that could be executed during unpickling. Arbitrary objects will no longer be allowed to be loaded via this mode unless they are explicitly allowlisted by the user via `torch.serialization.add_safe_globals`. We recommend you start setting `weights_only=True` for any use case where you don't have full control of the loaded file. Please open an issue on GitHub for any issues related to this experimental feature.
  self.data, self.slices = torch.load(self.processed_paths[0])
