STDOUT:
Results will be saved in /home/philip/projects/ltspice_examples_code_repo/Circuit-Completion-Using-GNNs/component_classification_with_link_prediction_head/evaluation/FEGIN/results/model_FEGIN_dataset_ltspice_examples
Command line input: python main.py --data ltspice_examples --representation component_pin --model FEGIN --layers 5 --hiddens 16 --batch_size 256 --lr 0.001 --emb_size 128 --epochs 100 --save_appendix component_pin_L5_H16_BS256_LR0.001_E128 --no_val
 is saved.
-----
ltspice_examples - FEGIN
Using 5 layers, 16 hidden units, h = 2
Loading component_pin representation dataset
ENTERED
Training FEGIN on component_pin representation
Train: 3560, Test: 848
##################ITERATION #0 ****************************************
 epoch: 0, train_loss: 1.4368, test_loss: 1.4214, test_f1: 0.1017
 epoch: 1, train_loss: 1.4145, test_loss: 1.4060, test_f1: 0.1017
 epoch: 2, train_loss: 1.3940, test_loss: 1.3844, test_f1: 0.1017
 epoch: 3, train_loss: 1.3658, test_loss: 1.3541, test_f1: 0.2102
 epoch: 4, train_loss: 1.3374, test_loss: 1.3242, test_f1: 0.2430
 epoch: 5, train_loss: 1.3116, test_loss: 1.2992, test_f1: 0.2510
 epoch: 6, train_loss: 1.2922, test_loss: 1.2725, test_f1: 0.2500
 epoch: 7, train_loss: 1.2620, test_loss: 1.2425, test_f1: 0.2441
 epoch: 8, train_loss: 1.2336, test_loss: 1.2066, test_f1: 0.2518
 epoch: 9, train_loss: 1.1975, test_loss: 1.1684, test_f1: 0.3779
 epoch: 10, train_loss: 1.1722, test_loss: 1.1226, test_f1: 0.3937
 epoch: 11, train_loss: 1.1363, test_loss: 1.0896, test_f1: 0.3866
 epoch: 12, train_loss: 1.1079, test_loss: 1.0782, test_f1: 0.3923
 epoch: 13, train_loss: 1.0821, test_loss: 1.0556, test_f1: 0.3987
 epoch: 14, train_loss: 1.0718, test_loss: 1.2109, test_f1: 0.3453
 epoch: 15, train_loss: 1.0752, test_loss: 1.0315, test_f1: 0.3929
 epoch: 16, train_loss: 1.0618, test_loss: 1.0569, test_f1: 0.3892
 epoch: 17, train_loss: 1.0502, test_loss: 1.0253, test_f1: 0.3963
 epoch: 18, train_loss: 1.0382, test_loss: 1.0270, test_f1: 0.4001
 epoch: 19, train_loss: 1.0239, test_loss: 1.0452, test_f1: 0.4386
 epoch: 20, train_loss: 1.0130, test_loss: 1.0269, test_f1: 0.4723
 epoch: 21, train_loss: 1.0062, test_loss: 1.0206, test_f1: 0.4531
 epoch: 22, train_loss: 0.9982, test_loss: 0.9960, test_f1: 0.4874
 epoch: 23, train_loss: 0.9964, test_loss: 1.0040, test_f1: 0.4736
 epoch: 24, train_loss: 0.9873, test_loss: 1.0741, test_f1: 0.4314
 epoch: 25, train_loss: 0.9838, test_loss: 1.0135, test_f1: 0.4659
 epoch: 26, train_loss: 0.9677, test_loss: 1.0294, test_f1: 0.4618
 epoch: 27, train_loss: 0.9706, test_loss: 1.0194, test_f1: 0.4761
 epoch: 28, train_loss: 0.9602, test_loss: 0.9833, test_f1: 0.4909
 epoch: 29, train_loss: 0.9525, test_loss: 1.0177, test_f1: 0.5015
 epoch: 30, train_loss: 0.9554, test_loss: 0.9993, test_f1: 0.4802
 epoch: 31, train_loss: 0.9403, test_loss: 1.0940, test_f1: 0.4369
 epoch: 32, train_loss: 0.9427, test_loss: 1.0210, test_f1: 0.4975
 epoch: 33, train_loss: 0.9303, test_loss: 1.0127, test_f1: 0.5096
 epoch: 34, train_loss: 0.9365, test_loss: 0.9883, test_f1: 0.5107
 epoch: 35, train_loss: 0.9356, test_loss: 1.0607, test_f1: 0.4530
 epoch: 36, train_loss: 0.9251, test_loss: 0.9974, test_f1: 0.4884
 epoch: 37, train_loss: 0.9157, test_loss: 0.9674, test_f1: 0.4985
 epoch: 38, train_loss: 0.9202, test_loss: 0.9971, test_f1: 0.4934
 epoch: 39, train_loss: 0.9143, test_loss: 0.9772, test_f1: 0.4982
 epoch: 40, train_loss: 0.9165, test_loss: 0.9703, test_f1: 0.4953
 epoch: 41, train_loss: 0.9051, test_loss: 0.9883, test_f1: 0.5130
 epoch: 42, train_loss: 0.9046, test_loss: 0.9591, test_f1: 0.4952
 epoch: 43, train_loss: 0.8985, test_loss: 0.9645, test_f1: 0.5133
 epoch: 44, train_loss: 0.8948, test_loss: 1.0138, test_f1: 0.4966
 epoch: 45, train_loss: 0.8868, test_loss: 1.0296, test_f1: 0.4971
 epoch: 46, train_loss: 0.8918, test_loss: 1.0200, test_f1: 0.4843
 epoch: 47, train_loss: 0.8805, test_loss: 0.9628, test_f1: 0.4978
 epoch: 48, train_loss: 0.8856, test_loss: 1.0401, test_f1: 0.5056
 epoch: 49, train_loss: 0.8786, test_loss: 0.9895, test_f1: 0.4761
 epoch: 50, train_loss: 0.8818, test_loss: 0.9776, test_f1: 0.5078
 epoch: 51, train_loss: 0.8710, test_loss: 1.0067, test_f1: 0.5067
 epoch: 52, train_loss: 0.8607, test_loss: 0.9726, test_f1: 0.5199
 epoch: 53, train_loss: 0.8631, test_loss: 0.9627, test_f1: 0.5095
 epoch: 54, train_loss: 0.8682, test_loss: 0.9416, test_f1: 0.5284
 epoch: 55, train_loss: 0.8551, test_loss: 0.9658, test_f1: 0.5242
 epoch: 56, train_loss: 0.8542, test_loss: 0.9736, test_f1: 0.5205
 epoch: 57, train_loss: 0.8534, test_loss: 0.9809, test_f1: 0.5261
 epoch: 58, train_loss: 0.8524, test_loss: 0.9399, test_f1: 0.5157
 epoch: 59, train_loss: 0.8447, test_loss: 0.9470, test_f1: 0.5289
 epoch: 60, train_loss: 0.8423, test_loss: 0.9788, test_f1: 0.5154
 epoch: 61, train_loss: 0.8483, test_loss: 0.9758, test_f1: 0.5346
 epoch: 62, train_loss: 0.8454, test_loss: 0.9543, test_f1: 0.5337
 epoch: 63, train_loss: 0.8324, test_loss: 0.9615, test_f1: 0.5259
 epoch: 64, train_loss: 0.8443, test_loss: 0.9437, test_f1: 0.5295
 epoch: 65, train_loss: 0.8428, test_loss: 0.9758, test_f1: 0.5344
 epoch: 66, train_loss: 0.8337, test_loss: 0.9611, test_f1: 0.5233
 epoch: 67, train_loss: 0.8350, test_loss: 0.9641, test_f1: 0.5212
 epoch: 68, train_loss: 0.8355, test_loss: 0.9294, test_f1: 0.5375
 epoch: 69, train_loss: 0.8328, test_loss: 0.9334, test_f1: 0.5107
 epoch: 70, train_loss: 0.8283, test_loss: 0.9563, test_f1: 0.5167
 epoch: 71, train_loss: 0.8238, test_loss: 0.9228, test_f1: 0.5460
 epoch: 72, train_loss: 0.8181, test_loss: 0.9358, test_f1: 0.5550
 epoch: 73, train_loss: 0.8218, test_loss: 0.9320, test_f1: 0.5262
 epoch: 74, train_loss: 0.8165, test_loss: 0.9296, test_f1: 0.5513
 epoch: 75, train_loss: 0.8148, test_loss: 0.9372, test_f1: 0.5289
 epoch: 76, train_loss: 0.8211, test_loss: 0.9454, test_f1: 0.5545
 epoch: 77, train_loss: 0.8176, test_loss: 0.9234, test_f1: 0.5320
 epoch: 78, train_loss: 0.8107, test_loss: 0.9316, test_f1: 0.5221
 epoch: 79, train_loss: 0.8052, test_loss: 0.8952, test_f1: 0.5408
 epoch: 80, train_loss: 0.8048, test_loss: 0.9305, test_f1: 0.5455
 epoch: 81, train_loss: 0.8114, test_loss: 0.9409, test_f1: 0.5553
 epoch: 82, train_loss: 0.8100, test_loss: 0.9134, test_f1: 0.5682
 epoch: 83, train_loss: 0.8134, test_loss: 0.9440, test_f1: 0.5505
 epoch: 84, train_loss: 0.8123, test_loss: 0.9329, test_f1: 0.5426
 epoch: 85, train_loss: 0.8064, test_loss: 0.9018, test_f1: 0.5362
 epoch: 86, train_loss: 0.8062, test_loss: 0.9334, test_f1: 0.5547
 epoch: 87, train_loss: 0.8097, test_loss: 0.9234, test_f1: 0.5378
 epoch: 88, train_loss: 0.8004, test_loss: 0.9129, test_f1: 0.5310
 epoch: 89, train_loss: 0.8030, test_loss: 0.9423, test_f1: 0.5518
 epoch: 90, train_loss: 0.8042, test_loss: 0.9246, test_f1: 0.5535
 epoch: 91, train_loss: 0.8033, test_loss: 0.8760, test_f1: 0.5486
 epoch: 92, train_loss: 0.7985, test_loss: 0.8921, test_f1: 0.5366
 epoch: 93, train_loss: 0.7830, test_loss: 0.8937, test_f1: 0.5439
 epoch: 94, train_loss: 0.8020, test_loss: 0.9181, test_f1: 0.5404
 epoch: 95, train_loss: 0.7814, test_loss: 0.9027, test_f1: 0.5432
 epoch: 96, train_loss: 0.7817, test_loss: 0.8926, test_f1: 0.5220
 epoch: 97, train_loss: 0.7744, test_loss: 0.8656, test_f1: 0.5511
 epoch: 98, train_loss: 0.7874, test_loss: 0.8888, test_f1: 0.5348
 epoch: 99, train_loss: 0.7894, test_loss: 0.9651, test_f1: 0.5352
##################ITERATION #1 ****************************************
 epoch: 0, train_loss: 1.3456, test_loss: 1.3482, test_f1: 0.1017
 epoch: 1, train_loss: 1.2790, test_loss: 1.3248, test_f1: 0.2257
 epoch: 2, train_loss: 1.2334, test_loss: 1.2734, test_f1: 0.2260
 epoch: 3, train_loss: 1.1939, test_loss: 1.1867, test_f1: 0.3371
 epoch: 4, train_loss: 1.1559, test_loss: 1.1358, test_f1: 0.3298
 epoch: 5, train_loss: 1.1223, test_loss: 1.1067, test_f1: 0.3419
 epoch: 6, train_loss: 1.0944, test_loss: 1.1083, test_f1: 0.3189
 epoch: 7, train_loss: 1.0765, test_loss: 1.0868, test_f1: 0.3403
 epoch: 8, train_loss: 1.0568, test_loss: 1.1347, test_f1: 0.3208
 epoch: 9, train_loss: 1.0457, test_loss: 1.1541, test_f1: 0.3278
 epoch: 10, train_loss: 1.0299, test_loss: 1.0880, test_f1: 0.4048
 epoch: 11, train_loss: 1.0295, test_loss: 1.0786, test_f1: 0.4148
 epoch: 12, train_loss: 1.0218, test_loss: 1.0793, test_f1: 0.4384
 epoch: 13, train_loss: 1.0154, test_loss: 1.0642, test_f1: 0.4525
 epoch: 14, train_loss: 1.0115, test_loss: 1.0619, test_f1: 0.4525
 epoch: 15, train_loss: 0.9900, test_loss: 1.0313, test_f1: 0.4760
 epoch: 16, train_loss: 0.9872, test_loss: 1.0600, test_f1: 0.4563
 epoch: 17, train_loss: 0.9885, test_loss: 1.0865, test_f1: 0.4460
 epoch: 18, train_loss: 0.9785, test_loss: 1.1213, test_f1: 0.4359
 epoch: 19, train_loss: 0.9687, test_loss: 1.0498, test_f1: 0.4628
 epoch: 20, train_loss: 0.9581, test_loss: 1.1124, test_f1: 0.4515
 epoch: 21, train_loss: 0.9568, test_loss: 1.0945, test_f1: 0.4444
 epoch: 22, train_loss: 0.9516, test_loss: 1.0287, test_f1: 0.4659
 epoch: 23, train_loss: 0.9434, test_loss: 1.1270, test_f1: 0.4518
 epoch: 24, train_loss: 0.9334, test_loss: 1.1353, test_f1: 0.4440
 epoch: 25, train_loss: 0.9319, test_loss: 1.0112, test_f1: 0.4968
 epoch: 26, train_loss: 0.9249, test_loss: 1.0565, test_f1: 0.4579
 epoch: 27, train_loss: 0.9284, test_loss: 1.0393, test_f1: 0.4819
 epoch: 28, train_loss: 0.9154, test_loss: 1.1058, test_f1: 0.4590
 epoch: 29, train_loss: 0.9081, test_loss: 1.0419, test_f1: 0.4837
 epoch: 30, train_loss: 0.9190, test_loss: 1.0603, test_f1: 0.4572
 epoch: 31, train_loss: 0.8991, test_loss: 1.0947, test_f1: 0.4613
 epoch: 32, train_loss: 0.9089, test_loss: 1.0421, test_f1: 0.4759
 epoch: 33, train_loss: 0.8892, test_loss: 1.0559, test_f1: 0.4823
 epoch: 34, train_loss: 0.9023, test_loss: 1.0711, test_f1: 0.4752
 epoch: 35, train_loss: 0.9033, test_loss: 1.1627, test_f1: 0.4664
 epoch: 36, train_loss: 0.8965, test_loss: 1.0401, test_f1: 0.4713
 epoch: 37, train_loss: 0.8923, test_loss: 1.0086, test_f1: 0.4893
 epoch: 38, train_loss: 0.8786, test_loss: 1.0407, test_f1: 0.4644
 epoch: 39, train_loss: 0.8772, test_loss: 1.0131, test_f1: 0.4800
 epoch: 40, train_loss: 0.8839, test_loss: 1.0889, test_f1: 0.4610
 epoch: 41, train_loss: 0.8780, test_loss: 1.1416, test_f1: 0.4657
 epoch: 42, train_loss: 0.8744, test_loss: 1.0264, test_f1: 0.4876
 epoch: 43, train_loss: 0.8693, test_loss: 1.0168, test_f1: 0.4762
 epoch: 44, train_loss: 0.8755, test_loss: 1.1199, test_f1: 0.4603
 epoch: 45, train_loss: 0.8742, test_loss: 1.0548, test_f1: 0.4800
 epoch: 46, train_loss: 0.8732, test_loss: 1.0350, test_f1: 0.4877
 epoch: 47, train_loss: 0.8467, test_loss: 1.0681, test_f1: 0.4704
 epoch: 48, train_loss: 0.8538, test_loss: 1.0789, test_f1: 0.4809
 epoch: 49, train_loss: 0.8440, test_loss: 1.0340, test_f1: 0.4822
 epoch: 50, train_loss: 0.8351, test_loss: 1.3634, test_f1: 0.4245
 epoch: 51, train_loss: 0.8337, test_loss: 1.0178, test_f1: 0.4881
 epoch: 52, train_loss: 0.8272, test_loss: 1.0335, test_f1: 0.4713
 epoch: 53, train_loss: 0.8240, test_loss: 1.0183, test_f1: 0.4818
 epoch: 54, train_loss: 0.8177, test_loss: 1.0082, test_f1: 0.4867
 epoch: 55, train_loss: 0.8329, test_loss: 0.9857, test_f1: 0.4903
 epoch: 56, train_loss: 0.8357, test_loss: 1.0713, test_f1: 0.4779
 epoch: 57, train_loss: 0.8273, test_loss: 1.0067, test_f1: 0.4767
 epoch: 58, train_loss: 0.8177, test_loss: 1.0385, test_f1: 0.4806
 epoch: 59, train_loss: 0.8122, test_loss: 1.0432, test_f1: 0.4852
 epoch: 60, train_loss: 0.8271, test_loss: 1.0003, test_f1: 0.5018
 epoch: 61, train_loss: 0.8097, test_loss: 0.9925, test_f1: 0.4978
 epoch: 62, train_loss: 0.8233, test_loss: 1.0439, test_f1: 0.4872
 epoch: 63, train_loss: 0.8052, test_loss: 0.9808, test_f1: 0.5123
 epoch: 64, train_loss: 0.8050, test_loss: 1.1157, test_f1: 0.4849
 epoch: 65, train_loss: 0.8208, test_loss: 0.9988, test_f1: 0.5102
 epoch: 66, train_loss: 0.8089, test_loss: 0.9791, test_f1: 0.5140
 epoch: 67, train_loss: 0.8025, test_loss: 1.0898, test_f1: 0.4805
 epoch: 68, train_loss: 0.8043, test_loss: 1.0006, test_f1: 0.5109
 epoch: 69, train_loss: 0.7959, test_loss: 0.9914, test_f1: 0.4926
 epoch: 70, train_loss: 0.7917, test_loss: 1.0060, test_f1: 0.4901
 epoch: 71, train_loss: 0.7881, test_loss: 1.0830, test_f1: 0.4704
 epoch: 72, train_loss: 0.7979, test_loss: 0.9672, test_f1: 0.4917
 epoch: 73, train_loss: 0.8042, test_loss: 1.0010, test_f1: 0.4881
 epoch: 74, train_loss: 0.8035, test_loss: 1.0336, test_f1: 0.4926
 epoch: 75, train_loss: 0.8041, test_loss: 1.0145, test_f1: 0.5134
 epoch: 76, train_loss: 0.7871, test_loss: 0.9911, test_f1: 0.5021
 epoch: 77, train_loss: 0.7899, test_loss: 1.0012, test_f1: 0.5046
 epoch: 78, train_loss: 0.7944, test_loss: 1.0127, test_f1: 0.4807
 epoch: 79, train_loss: 0.7830, test_loss: 1.0208, test_f1: 0.4948
 epoch: 80, train_loss: 0.7858, test_loss: 0.9873, test_f1: 0.4905
 epoch: 81, train_loss: 0.7846, test_loss: 1.0374, test_f1: 0.5066
 epoch: 82, train_loss: 0.7763, test_loss: 0.9780, test_f1: 0.5088
 epoch: 83, train_loss: 0.7798, test_loss: 1.0261, test_f1: 0.5069
 epoch: 84, train_loss: 0.7834, test_loss: 1.0053, test_f1: 0.4934
 epoch: 85, train_loss: 0.7804, test_loss: 1.0411, test_f1: 0.5029
 epoch: 86, train_loss: 0.7808, test_loss: 1.0053, test_f1: 0.5105
 epoch: 87, train_loss: 0.7789, test_loss: 1.0281, test_f1: 0.4975
 epoch: 88, train_loss: 0.7688, test_loss: 0.9937, test_f1: 0.5107
 epoch: 89, train_loss: 0.7681, test_loss: 1.0678, test_f1: 0.4984
 epoch: 90, train_loss: 0.7698, test_loss: 1.0250, test_f1: 0.5038
 epoch: 91, train_loss: 0.7754, test_loss: 1.0651, test_f1: 0.4849
 epoch: 92, train_loss: 0.7756, test_loss: 0.9542, test_f1: 0.5141
 epoch: 93, train_loss: 0.7664, test_loss: 1.0040, test_f1: 0.5087
 epoch: 94, train_loss: 0.7737, test_loss: 1.0177, test_f1: 0.5122
 epoch: 95, train_loss: 0.7572, test_loss: 1.0129, test_f1: 0.5009
 epoch: 96, train_loss: 0.7733, test_loss: 1.0431, test_f1: 0.4892
 epoch: 97, train_loss: 0.7664, test_loss: 1.0159, test_f1: 0.4914
 epoch: 98, train_loss: 0.7708, test_loss: 0.9911, test_f1: 0.5161
 epoch: 99, train_loss: 0.7798, test_loss: 1.0623, test_f1: 0.4910
##################ITERATION #2 ****************************************
 epoch: 0, train_loss: 1.3280, test_loss: 1.3343, test_f1: 0.2260
 epoch: 1, train_loss: 1.2516, test_loss: 1.3137, test_f1: 0.2260
 epoch: 2, train_loss: 1.1986, test_loss: 1.2562, test_f1: 0.2260
 epoch: 3, train_loss: 1.1434, test_loss: 1.1215, test_f1: 0.3522
 epoch: 4, train_loss: 1.1051, test_loss: 1.0682, test_f1: 0.4145
 epoch: 5, train_loss: 1.0757, test_loss: 1.0368, test_f1: 0.4670
 epoch: 6, train_loss: 1.0559, test_loss: 1.0332, test_f1: 0.4378
 epoch: 7, train_loss: 1.0442, test_loss: 1.0394, test_f1: 0.4565
 epoch: 8, train_loss: 1.0234, test_loss: 1.0084, test_f1: 0.4647
 epoch: 9, train_loss: 1.0163, test_loss: 1.0117, test_f1: 0.4748
 epoch: 10, train_loss: 1.0044, test_loss: 1.0152, test_f1: 0.4687
 epoch: 11, train_loss: 0.9995, test_loss: 1.0049, test_f1: 0.4763
 epoch: 12, train_loss: 0.9778, test_loss: 0.9847, test_f1: 0.4964
 epoch: 13, train_loss: 0.9705, test_loss: 0.9540, test_f1: 0.4918
 epoch: 14, train_loss: 0.9626, test_loss: 0.9910, test_f1: 0.5017
 epoch: 15, train_loss: 0.9558, test_loss: 0.9503, test_f1: 0.4814
 epoch: 16, train_loss: 0.9433, test_loss: 0.9648, test_f1: 0.5104
 epoch: 17, train_loss: 0.9320, test_loss: 0.9854, test_f1: 0.4865
 epoch: 18, train_loss: 0.9356, test_loss: 0.9578, test_f1: 0.4995
 epoch: 19, train_loss: 0.9288, test_loss: 1.0119, test_f1: 0.5036
 epoch: 20, train_loss: 0.9191, test_loss: 0.9696, test_f1: 0.5090
 epoch: 21, train_loss: 0.9131, test_loss: 0.9985, test_f1: 0.5055
 epoch: 22, train_loss: 0.9048, test_loss: 0.9463, test_f1: 0.5032
 epoch: 23, train_loss: 0.8960, test_loss: 0.9600, test_f1: 0.5057
 epoch: 24, train_loss: 0.8979, test_loss: 0.9439, test_f1: 0.4760
 epoch: 25, train_loss: 0.8968, test_loss: 0.9543, test_f1: 0.4926
 epoch: 26, train_loss: 0.8874, test_loss: 0.9510, test_f1: 0.5177
 epoch: 27, train_loss: 0.8784, test_loss: 0.9576, test_f1: 0.5107
 epoch: 28, train_loss: 0.8729, test_loss: 0.9141, test_f1: 0.5074
 epoch: 29, train_loss: 0.8620, test_loss: 0.9508, test_f1: 0.5164
 epoch: 30, train_loss: 0.8700, test_loss: 0.9304, test_f1: 0.5028
 epoch: 31, train_loss: 0.8518, test_loss: 0.9489, test_f1: 0.4932
 epoch: 32, train_loss: 0.8500, test_loss: 0.9563, test_f1: 0.5288
 epoch: 33, train_loss: 0.8563, test_loss: 0.9339, test_f1: 0.5110
 epoch: 34, train_loss: 0.8525, test_loss: 0.9219, test_f1: 0.5212
 epoch: 35, train_loss: 0.8327, test_loss: 0.9244, test_f1: 0.5338
 epoch: 36, train_loss: 0.8431, test_loss: 0.9084, test_f1: 0.5182
 epoch: 37, train_loss: 0.8313, test_loss: 0.9482, test_f1: 0.5179
 epoch: 38, train_loss: 0.8407, test_loss: 0.9578, test_f1: 0.5210
 epoch: 39, train_loss: 0.8297, test_loss: 0.9160, test_f1: 0.5055
 epoch: 40, train_loss: 0.8142, test_loss: 0.9322, test_f1: 0.5310
 epoch: 41, train_loss: 0.8220, test_loss: 1.0032, test_f1: 0.5227
 epoch: 42, train_loss: 0.8290, test_loss: 0.9212, test_f1: 0.5220
 epoch: 43, train_loss: 0.8278, test_loss: 0.9271, test_f1: 0.5057
 epoch: 44, train_loss: 0.8041, test_loss: 0.9653, test_f1: 0.5102
 epoch: 45, train_loss: 0.8079, test_loss: 0.9447, test_f1: 0.5202
 epoch: 46, train_loss: 0.8138, test_loss: 0.9012, test_f1: 0.5263
 epoch: 47, train_loss: 0.7989, test_loss: 0.9363, test_f1: 0.5096
 epoch: 48, train_loss: 0.8038, test_loss: 0.9785, test_f1: 0.5259
 epoch: 49, train_loss: 0.8085, test_loss: 0.9609, test_f1: 0.5040
 epoch: 50, train_loss: 0.7941, test_loss: 0.9449, test_f1: 0.5212
 epoch: 51, train_loss: 0.7784, test_loss: 0.9369, test_f1: 0.5334
 epoch: 52, train_loss: 0.7782, test_loss: 0.9328, test_f1: 0.5323
 epoch: 53, train_loss: 0.7772, test_loss: 0.9108, test_f1: 0.5295
 epoch: 54, train_loss: 0.7888, test_loss: 0.9271, test_f1: 0.5149
 epoch: 55, train_loss: 0.7758, test_loss: 0.9607, test_f1: 0.5225
 epoch: 56, train_loss: 0.7698, test_loss: 0.9325, test_f1: 0.5228
 epoch: 57, train_loss: 0.7771, test_loss: 0.9304, test_f1: 0.5385
 epoch: 58, train_loss: 0.7689, test_loss: 0.9435, test_f1: 0.5417
 epoch: 59, train_loss: 0.7614, test_loss: 0.9221, test_f1: 0.5469
 epoch: 60, train_loss: 0.7553, test_loss: 0.9104, test_f1: 0.5378
 epoch: 61, train_loss: 0.7650, test_loss: 0.9233, test_f1: 0.5334
 epoch: 62, train_loss: 0.7496, test_loss: 0.9594, test_f1: 0.5356
 epoch: 63, train_loss: 0.7578, test_loss: 0.9342, test_f1: 0.5502
 epoch: 64, train_loss: 0.7679, test_loss: 0.9377, test_f1: 0.5472
 epoch: 65, train_loss: 0.7656, test_loss: 0.9469, test_f1: 0.5211
 epoch: 66, train_loss: 0.7618, test_loss: 0.9308, test_f1: 0.5217
 epoch: 67, train_loss: 0.7678, test_loss: 0.9559, test_f1: 0.5197
 epoch: 68, train_loss: 0.7624, test_loss: 0.9425, test_f1: 0.5237
 epoch: 69, train_loss: 0.7552, test_loss: 0.9366, test_f1: 0.5370
 epoch: 70, train_loss: 0.7598, test_loss: 0.9169, test_f1: 0.5200
 epoch: 71, train_loss: 0.7548, test_loss: 0.9536, test_f1: 0.5182
 epoch: 72, train_loss: 0.7473, test_loss: 0.9530, test_f1: 0.5252
 epoch: 73, train_loss: 0.7516, test_loss: 0.9418, test_f1: 0.5202
 epoch: 74, train_loss: 0.7430, test_loss: 0.9318, test_f1: 0.5150
 epoch: 75, train_loss: 0.7609, test_loss: 0.9753, test_f1: 0.5345
 epoch: 76, train_loss: 0.7404, test_loss: 0.9454, test_f1: 0.5337
 epoch: 77, train_loss: 0.7430, test_loss: 0.9606, test_f1: 0.5238
 epoch: 78, train_loss: 0.7451, test_loss: 0.9589, test_f1: 0.5269
 epoch: 79, train_loss: 0.7386, test_loss: 0.9195, test_f1: 0.5262
 epoch: 80, train_loss: 0.7367, test_loss: 0.9359, test_f1: 0.5228
 epoch: 81, train_loss: 0.7452, test_loss: 0.9143, test_f1: 0.5406
 epoch: 82, train_loss: 0.7489, test_loss: 0.9228, test_f1: 0.5281
 epoch: 83, train_loss: 0.7529, test_loss: 0.9687, test_f1: 0.5343
 epoch: 84, train_loss: 0.7409, test_loss: 0.9527, test_f1: 0.5307
 epoch: 85, train_loss: 0.7470, test_loss: 0.9460, test_f1: 0.5249
 epoch: 86, train_loss: 0.7312, test_loss: 0.9803, test_f1: 0.5177
 epoch: 87, train_loss: 0.7524, test_loss: 0.9456, test_f1: 0.5314
 epoch: 88, train_loss: 0.7344, test_loss: 0.9902, test_f1: 0.5250
 epoch: 89, train_loss: 0.7281, test_loss: 0.9869, test_f1: 0.5366
 epoch: 90, train_loss: 0.7273, test_loss: 0.9579, test_f1: 0.5210
 epoch: 91, train_loss: 0.7372, test_loss: 0.9422, test_f1: 0.5378
 epoch: 92, train_loss: 0.7399, test_loss: 0.9832, test_f1: 0.5329
 epoch: 93, train_loss: 0.7252, test_loss: 0.9631, test_f1: 0.5304
 epoch: 94, train_loss: 0.7293, test_loss: 0.9407, test_f1: 0.5414
 epoch: 95, train_loss: 0.7265, test_loss: 0.9476, test_f1: 0.5523
 epoch: 96, train_loss: 0.7363, test_loss: 0.9988, test_f1: 0.5308
 epoch: 97, train_loss: 0.7294, test_loss: 0.9235, test_f1: 0.5281
 epoch: 98, train_loss: 0.7210, test_loss: 0.9568, test_f1: 0.5420
 epoch: 99, train_loss: 0.7382, test_loss: 0.9541, test_f1: 0.5358
##################ITERATION #3 ****************************************
 epoch: 0, train_loss: 1.2821, test_loss: 1.3053, test_f1: 0.2260
 epoch: 1, train_loss: 1.2165, test_loss: 1.2875, test_f1: 0.2260
 epoch: 2, train_loss: 1.1920, test_loss: 1.2538, test_f1: 0.2260
 epoch: 3, train_loss: 1.1616, test_loss: 1.1796, test_f1: 0.2876
 epoch: 4, train_loss: 1.1330, test_loss: 1.1083, test_f1: 0.3500
 epoch: 5, train_loss: 1.1127, test_loss: 1.0755, test_f1: 0.3617
 epoch: 6, train_loss: 1.0909, test_loss: 1.0613, test_f1: 0.3669
 epoch: 7, train_loss: 1.0754, test_loss: 1.0454, test_f1: 0.3707
 epoch: 8, train_loss: 1.0717, test_loss: 1.0572, test_f1: 0.3561
 epoch: 9, train_loss: 1.0528, test_loss: 1.0506, test_f1: 0.3642
 epoch: 10, train_loss: 1.0391, test_loss: 1.0647, test_f1: 0.3410
 epoch: 11, train_loss: 1.0290, test_loss: 1.0406, test_f1: 0.3829
 epoch: 12, train_loss: 1.0220, test_loss: 1.0350, test_f1: 0.3788
 epoch: 13, train_loss: 1.0080, test_loss: 1.0166, test_f1: 0.3931
 epoch: 14, train_loss: 1.0059, test_loss: 1.0358, test_f1: 0.3855
 epoch: 15, train_loss: 0.9914, test_loss: 1.0122, test_f1: 0.4110
 epoch: 16, train_loss: 0.9757, test_loss: 1.0061, test_f1: 0.4529
 epoch: 17, train_loss: 0.9690, test_loss: 1.0021, test_f1: 0.4526
 epoch: 18, train_loss: 0.9617, test_loss: 0.9916, test_f1: 0.4919
 epoch: 19, train_loss: 0.9532, test_loss: 1.0582, test_f1: 0.3942
 epoch: 20, train_loss: 0.9554, test_loss: 0.9865, test_f1: 0.4801
 epoch: 21, train_loss: 0.9492, test_loss: 1.0142, test_f1: 0.4520
 epoch: 22, train_loss: 0.9333, test_loss: 1.0084, test_f1: 0.4592
 epoch: 23, train_loss: 0.9339, test_loss: 0.9892, test_f1: 0.4763
 epoch: 24, train_loss: 0.9177, test_loss: 0.9744, test_f1: 0.4937
 epoch: 25, train_loss: 0.9199, test_loss: 0.9652, test_f1: 0.4957
 epoch: 26, train_loss: 0.9198, test_loss: 0.9561, test_f1: 0.5122
 epoch: 27, train_loss: 0.9035, test_loss: 1.0014, test_f1: 0.4889
 epoch: 28, train_loss: 0.9013, test_loss: 0.9704, test_f1: 0.4907
 epoch: 29, train_loss: 0.8959, test_loss: 0.9584, test_f1: 0.5002
 epoch: 30, train_loss: 0.8802, test_loss: 0.9188, test_f1: 0.4868
 epoch: 31, train_loss: 0.8798, test_loss: 0.9558, test_f1: 0.4967
 epoch: 32, train_loss: 0.8808, test_loss: 0.9479, test_f1: 0.5008
 epoch: 33, train_loss: 0.8764, test_loss: 0.9635, test_f1: 0.5121
 epoch: 34, train_loss: 0.8599, test_loss: 0.9354, test_f1: 0.4988
 epoch: 35, train_loss: 0.8593, test_loss: 0.9537, test_f1: 0.4942
 epoch: 36, train_loss: 0.8604, test_loss: 0.9987, test_f1: 0.4872
 epoch: 37, train_loss: 0.8569, test_loss: 0.9546, test_f1: 0.4855
 epoch: 38, train_loss: 0.8546, test_loss: 0.9306, test_f1: 0.5180
 epoch: 39, train_loss: 0.8400, test_loss: 0.9888, test_f1: 0.4966
 epoch: 40, train_loss: 0.8425, test_loss: 0.9382, test_f1: 0.4967
 epoch: 41, train_loss: 0.8341, test_loss: 0.9825, test_f1: 0.4906
 epoch: 42, train_loss: 0.8268, test_loss: 0.9792, test_f1: 0.4953
 epoch: 43, train_loss: 0.8313, test_loss: 0.9557, test_f1: 0.5078
 epoch: 44, train_loss: 0.8292, test_loss: 0.9721, test_f1: 0.5109
 epoch: 45, train_loss: 0.8317, test_loss: 0.9376, test_f1: 0.5043
 epoch: 46, train_loss: 0.8183, test_loss: 1.0209, test_f1: 0.4691
 epoch: 47, train_loss: 0.8119, test_loss: 0.9698, test_f1: 0.5005
 epoch: 48, train_loss: 0.8243, test_loss: 1.0185, test_f1: 0.4751
 epoch: 49, train_loss: 0.8216, test_loss: 0.9644, test_f1: 0.5086
 epoch: 50, train_loss: 0.8090, test_loss: 0.9636, test_f1: 0.5071
 epoch: 51, train_loss: 0.7976, test_loss: 0.9599, test_f1: 0.5048
 epoch: 52, train_loss: 0.7904, test_loss: 0.9908, test_f1: 0.5122
 epoch: 53, train_loss: 0.7940, test_loss: 0.9316, test_f1: 0.5166
 epoch: 54, train_loss: 0.7862, test_loss: 0.9406, test_f1: 0.5267
 epoch: 55, train_loss: 0.7856, test_loss: 0.9603, test_f1: 0.5195
 epoch: 56, train_loss: 0.7912, test_loss: 0.9400, test_f1: 0.5246
 epoch: 57, train_loss: 0.7890, test_loss: 0.9757, test_f1: 0.5166
 epoch: 58, train_loss: 0.7821, test_loss: 0.9377, test_f1: 0.5221
 epoch: 59, train_loss: 0.7788, test_loss: 0.9477, test_f1: 0.5306
 epoch: 60, train_loss: 0.7889, test_loss: 0.9489, test_f1: 0.5171
 epoch: 61, train_loss: 0.7696, test_loss: 0.9575, test_f1: 0.5118
 epoch: 62, train_loss: 0.7797, test_loss: 0.9686, test_f1: 0.5170
 epoch: 63, train_loss: 0.7691, test_loss: 0.9892, test_f1: 0.5261
 epoch: 64, train_loss: 0.7680, test_loss: 0.9810, test_f1: 0.5278
 epoch: 65, train_loss: 0.7790, test_loss: 0.9680, test_f1: 0.5180
 epoch: 66, train_loss: 0.7737, test_loss: 0.9526, test_f1: 0.5187
 epoch: 67, train_loss: 0.7775, test_loss: 0.9851, test_f1: 0.5234
 epoch: 68, train_loss: 0.7689, test_loss: 0.9483, test_f1: 0.5253
 epoch: 69, train_loss: 0.7668, test_loss: 0.9823, test_f1: 0.5248
 epoch: 70, train_loss: 0.7601, test_loss: 0.9859, test_f1: 0.5155
 epoch: 71, train_loss: 0.7655, test_loss: 0.9718, test_f1: 0.5114
 epoch: 72, train_loss: 0.7650, test_loss: 0.9612, test_f1: 0.5142
 epoch: 73, train_loss: 0.7695, test_loss: 0.9837, test_f1: 0.5169
 epoch: 74, train_loss: 0.7709, test_loss: 0.9899, test_f1: 0.5187
 epoch: 75, train_loss: 0.7512, test_loss: 0.9782, test_f1: 0.5159
 epoch: 76, train_loss: 0.7522, test_loss: 0.9839, test_f1: 0.5252
 epoch: 77, train_loss: 0.7678, test_loss: 0.9835, test_f1: 0.5202
 epoch: 78, train_loss: 0.7513, test_loss: 0.9814, test_f1: 0.5239
 epoch: 79, train_loss: 0.7602, test_loss: 1.0160, test_f1: 0.5125
 epoch: 80, train_loss: 0.7507, test_loss: 0.9589, test_f1: 0.5250
 epoch: 81, train_loss: 0.7464, test_loss: 0.9801, test_f1: 0.5167
 epoch: 82, train_loss: 0.7518, test_loss: 0.9981, test_f1: 0.5192
 epoch: 83, train_loss: 0.7532, test_loss: 1.0185, test_f1: 0.5210
 epoch: 84, train_loss: 0.7532, test_loss: 0.9994, test_f1: 0.5150
 epoch: 85, train_loss: 0.7519, test_loss: 1.0045, test_f1: 0.5201
 epoch: 86, train_loss: 0.7505, test_loss: 0.9802, test_f1: 0.5248
 epoch: 87, train_loss: 0.7488, test_loss: 1.0013, test_f1: 0.5242
 epoch: 88, train_loss: 0.7366, test_loss: 0.9875, test_f1: 0.5210
 epoch: 89, train_loss: 0.7546, test_loss: 1.0060, test_f1: 0.5079
 epoch: 90, train_loss: 0.7327, test_loss: 0.9990, test_f1: 0.5171
 epoch: 91, train_loss: 0.7526, test_loss: 0.9592, test_f1: 0.5190
 epoch: 92, train_loss: 0.7494, test_loss: 0.9760, test_f1: 0.5256
 epoch: 93, train_loss: 0.7525, test_loss: 0.9884, test_f1: 0.5107
 epoch: 94, train_loss: 0.7288, test_loss: 1.0135, test_f1: 0.5227
 epoch: 95, train_loss: 0.7410, test_loss: 1.0158, test_f1: 0.5132
 epoch: 96, train_loss: 0.7455, test_loss: 1.0006, test_f1: 0.5180
 epoch: 97, train_loss: 0.7346, test_loss: 0.9911, test_f1: 0.5320
 epoch: 98, train_loss: 0.7354, test_loss: 1.0246, test_f1: 0.5242
 epoch: 99, train_loss: 0.7325, test_loss: 0.9902, test_f1: 0.5195
##################ITERATION #4 ****************************************
 epoch: 0, train_loss: 1.2946, test_loss: 1.3285, test_f1: 0.2260
 epoch: 1, train_loss: 1.2194, test_loss: 1.3208, test_f1: 0.2260
 epoch: 2, train_loss: 1.1880, test_loss: 1.3044, test_f1: 0.2260
 epoch: 3, train_loss: 1.1525, test_loss: 1.2210, test_f1: 0.2260
 epoch: 4, train_loss: 1.1254, test_loss: 1.1200, test_f1: 0.3363
 epoch: 5, train_loss: 1.1052, test_loss: 1.0795, test_f1: 0.3522
 epoch: 6, train_loss: 1.0865, test_loss: 1.0758, test_f1: 0.3727
 epoch: 7, train_loss: 1.0685, test_loss: 1.0734, test_f1: 0.3833
 epoch: 8, train_loss: 1.0510, test_loss: 1.0706, test_f1: 0.3836
 epoch: 9, train_loss: 1.0422, test_loss: 1.0681, test_f1: 0.4195
 epoch: 10, train_loss: 1.0383, test_loss: 1.0542, test_f1: 0.4126
 epoch: 11, train_loss: 1.0223, test_loss: 1.0568, test_f1: 0.4333
 epoch: 12, train_loss: 1.0219, test_loss: 1.0904, test_f1: 0.4370
 epoch: 13, train_loss: 1.0096, test_loss: 1.0346, test_f1: 0.4407
 epoch: 14, train_loss: 1.0075, test_loss: 0.9866, test_f1: 0.4855
 epoch: 15, train_loss: 1.0138, test_loss: 0.9708, test_f1: 0.4805
 epoch: 16, train_loss: 0.9980, test_loss: 1.0086, test_f1: 0.4848
 epoch: 17, train_loss: 0.9909, test_loss: 0.9910, test_f1: 0.4793
 epoch: 18, train_loss: 0.9823, test_loss: 1.0303, test_f1: 0.4747
 epoch: 19, train_loss: 0.9750, test_loss: 1.0234, test_f1: 0.4655
 epoch: 20, train_loss: 0.9632, test_loss: 1.0225, test_f1: 0.4490
 epoch: 21, train_loss: 0.9663, test_loss: 0.9910, test_f1: 0.4780
 epoch: 22, train_loss: 0.9568, test_loss: 0.9953, test_f1: 0.4788
 epoch: 23, train_loss: 0.9530, test_loss: 1.0493, test_f1: 0.4667
 epoch: 24, train_loss: 0.9489, test_loss: 0.9791, test_f1: 0.4761
 epoch: 25, train_loss: 0.9410, test_loss: 0.9762, test_f1: 0.4736
 epoch: 26, train_loss: 0.9470, test_loss: 0.9875, test_f1: 0.4841
 epoch: 27, train_loss: 0.9304, test_loss: 0.9964, test_f1: 0.4886
 epoch: 28, train_loss: 0.9228, test_loss: 0.9868, test_f1: 0.4903
 epoch: 29, train_loss: 0.9467, test_loss: 1.0108, test_f1: 0.4950
 epoch: 30, train_loss: 0.9188, test_loss: 0.9623, test_f1: 0.4907
 epoch: 31, train_loss: 0.9099, test_loss: 0.9787, test_f1: 0.4968
 epoch: 32, train_loss: 0.9014, test_loss: 1.0432, test_f1: 0.4701
 epoch: 33, train_loss: 0.9058, test_loss: 1.0331, test_f1: 0.4909
 epoch: 34, train_loss: 0.8938, test_loss: 0.9758, test_f1: 0.4917
 epoch: 35, train_loss: 0.8953, test_loss: 1.0797, test_f1: 0.4654
 epoch: 36, train_loss: 0.9001, test_loss: 0.9859, test_f1: 0.4912
 epoch: 37, train_loss: 0.8911, test_loss: 1.0239, test_f1: 0.4983
 epoch: 38, train_loss: 0.8922, test_loss: 0.9731, test_f1: 0.4877
 epoch: 39, train_loss: 0.8910, test_loss: 1.0463, test_f1: 0.4968
 epoch: 40, train_loss: 0.8727, test_loss: 1.0866, test_f1: 0.4688
 epoch: 41, train_loss: 0.8810, test_loss: 1.0314, test_f1: 0.4962
 epoch: 42, train_loss: 0.8798, test_loss: 1.0698, test_f1: 0.4952
 epoch: 43, train_loss: 0.8840, test_loss: 1.0198, test_f1: 0.4828
 epoch: 44, train_loss: 0.8923, test_loss: 1.1165, test_f1: 0.4744
 epoch: 45, train_loss: 0.8837, test_loss: 1.0227, test_f1: 0.5006
 epoch: 46, train_loss: 0.8719, test_loss: 1.0333, test_f1: 0.5036
 epoch: 47, train_loss: 0.8677, test_loss: 1.0267, test_f1: 0.4892
 epoch: 48, train_loss: 0.8731, test_loss: 1.0174, test_f1: 0.5009
 epoch: 49, train_loss: 0.8498, test_loss: 1.0263, test_f1: 0.4925
 epoch: 50, train_loss: 0.8586, test_loss: 1.0662, test_f1: 0.4868
 epoch: 51, train_loss: 0.8584, test_loss: 1.0469, test_f1: 0.4997
 epoch: 52, train_loss: 0.8435, test_loss: 1.0326, test_f1: 0.4959
 epoch: 53, train_loss: 0.8449, test_loss: 1.0122, test_f1: 0.5039
 epoch: 54, train_loss: 0.8379, test_loss: 1.0006, test_f1: 0.5082
 epoch: 55, train_loss: 0.8374, test_loss: 1.0109, test_f1: 0.5076
 epoch: 56, train_loss: 0.8375, test_loss: 1.0267, test_f1: 0.4999
 epoch: 57, train_loss: 0.8391, test_loss: 1.0243, test_f1: 0.5048
 epoch: 58, train_loss: 0.8217, test_loss: 0.9897, test_f1: 0.4972
 epoch: 59, train_loss: 0.8265, test_loss: 1.0296, test_f1: 0.5028
 epoch: 60, train_loss: 0.8261, test_loss: 1.0366, test_f1: 0.5056
 epoch: 61, train_loss: 0.8373, test_loss: 1.0289, test_f1: 0.5255
 epoch: 62, train_loss: 0.8326, test_loss: 1.0283, test_f1: 0.5021
 epoch: 63, train_loss: 0.8334, test_loss: 1.0146, test_f1: 0.5060
 epoch: 64, train_loss: 0.8288, test_loss: 1.0302, test_f1: 0.4992
 epoch: 65, train_loss: 0.8180, test_loss: 1.0066, test_f1: 0.4909
 epoch: 66, train_loss: 0.8196, test_loss: 1.0285, test_f1: 0.4953
 epoch: 67, train_loss: 0.8090, test_loss: 1.0459, test_f1: 0.4987
 epoch: 68, train_loss: 0.8067, test_loss: 1.0595, test_f1: 0.4906
 epoch: 69, train_loss: 0.8085, test_loss: 1.0348, test_f1: 0.4959
 epoch: 70, train_loss: 0.8180, test_loss: 1.0273, test_f1: 0.5145
 epoch: 71, train_loss: 0.8034, test_loss: 1.0511, test_f1: 0.4940
 epoch: 72, train_loss: 0.8156, test_loss: 0.9973, test_f1: 0.4975
 epoch: 73, train_loss: 0.8119, test_loss: 1.0537, test_f1: 0.5016
 epoch: 74, train_loss: 0.8090, test_loss: 1.0273, test_f1: 0.5190
 epoch: 75, train_loss: 0.8124, test_loss: 1.0301, test_f1: 0.5055
 epoch: 76, train_loss: 0.8075, test_loss: 1.0412, test_f1: 0.4978
 epoch: 77, train_loss: 0.7997, test_loss: 1.0420, test_f1: 0.5117
 epoch: 78, train_loss: 0.7991, test_loss: 1.0264, test_f1: 0.4968
 epoch: 79, train_loss: 0.8094, test_loss: 1.0713, test_f1: 0.4804
 epoch: 80, train_loss: 0.7964, test_loss: 1.0593, test_f1: 0.4977
 epoch: 81, train_loss: 0.8047, test_loss: 1.0407, test_f1: 0.5049
 epoch: 82, train_loss: 0.8000, test_loss: 1.1083, test_f1: 0.4893
 epoch: 83, train_loss: 0.7859, test_loss: 1.0537, test_f1: 0.4936
 epoch: 84, train_loss: 0.8058, test_loss: 1.0381, test_f1: 0.4890
 epoch: 85, train_loss: 0.7854, test_loss: 1.0447, test_f1: 0.5022
 epoch: 86, train_loss: 0.7973, test_loss: 1.0736, test_f1: 0.4880
 epoch: 87, train_loss: 0.7928, test_loss: 1.0350, test_f1: 0.5145
 epoch: 88, train_loss: 0.7989, test_loss: 1.0224, test_f1: 0.5205
 epoch: 89, train_loss: 0.7947, test_loss: 1.0516, test_f1: 0.4892
 epoch: 90, train_loss: 0.7916, test_loss: 1.0037, test_f1: 0.5255
 epoch: 91, train_loss: 0.8046, test_loss: 1.0637, test_f1: 0.4964
 epoch: 92, train_loss: 0.7858, test_loss: 1.0467, test_f1: 0.4893
 epoch: 93, train_loss: 0.7936, test_loss: 1.0492, test_f1: 0.4801
 epoch: 94, train_loss: 0.7899, test_loss: 1.0570, test_f1: 0.5057
 epoch: 95, train_loss: 0.7733, test_loss: 1.0691, test_f1: 0.4970
 epoch: 96, train_loss: 0.7839, test_loss: 1.0855, test_f1: 0.4871
 epoch: 97, train_loss: 0.7801, test_loss: 1.0783, test_f1: 0.4927
 epoch: 98, train_loss: 0.7931, test_loss: 1.0936, test_f1: 0.5056
 epoch: 99, train_loss: 0.7804, test_loss: 1.1006, test_f1: 0.4802
##################ITERATION #5 ****************************************
 epoch: 0, train_loss: 1.2836, test_loss: 1.2939, test_f1: 0.2260
 epoch: 1, train_loss: 1.2082, test_loss: 1.2586, test_f1: 0.2260
 epoch: 2, train_loss: 1.1627, test_loss: 1.2378, test_f1: 0.2260
 epoch: 3, train_loss: 1.1193, test_loss: 1.1290, test_f1: 0.3391
 epoch: 4, train_loss: 1.0929, test_loss: 1.0580, test_f1: 0.3524
 epoch: 5, train_loss: 1.0611, test_loss: 1.0336, test_f1: 0.4055
 epoch: 6, train_loss: 1.0550, test_loss: 1.0125, test_f1: 0.3964
 epoch: 7, train_loss: 1.0348, test_loss: 0.9994, test_f1: 0.4471
 epoch: 8, train_loss: 1.0254, test_loss: 1.0158, test_f1: 0.4151
 epoch: 9, train_loss: 1.0144, test_loss: 0.9798, test_f1: 0.4461
 epoch: 10, train_loss: 1.0119, test_loss: 0.9714, test_f1: 0.4644
 epoch: 11, train_loss: 0.9915, test_loss: 1.0378, test_f1: 0.4371
 epoch: 12, train_loss: 0.9857, test_loss: 0.9854, test_f1: 0.4927
 epoch: 13, train_loss: 0.9724, test_loss: 0.9521, test_f1: 0.4939
 epoch: 14, train_loss: 0.9643, test_loss: 1.0766, test_f1: 0.4538
 epoch: 15, train_loss: 0.9569, test_loss: 1.0029, test_f1: 0.4732
 epoch: 16, train_loss: 0.9468, test_loss: 0.9867, test_f1: 0.4792
 epoch: 17, train_loss: 0.9403, test_loss: 0.9882, test_f1: 0.4844
 epoch: 18, train_loss: 0.9533, test_loss: 1.0346, test_f1: 0.4751
 epoch: 19, train_loss: 0.9293, test_loss: 0.9543, test_f1: 0.5087
 epoch: 20, train_loss: 0.9311, test_loss: 0.9286, test_f1: 0.5175
 epoch: 21, train_loss: 0.9255, test_loss: 0.9277, test_f1: 0.5004
 epoch: 22, train_loss: 0.9087, test_loss: 0.9493, test_f1: 0.4988
 epoch: 23, train_loss: 0.9044, test_loss: 0.9249, test_f1: 0.5171
 epoch: 24, train_loss: 0.8983, test_loss: 0.9377, test_f1: 0.5188
 epoch: 25, train_loss: 0.8944, test_loss: 0.9178, test_f1: 0.5186
 epoch: 26, train_loss: 0.8864, test_loss: 0.9443, test_f1: 0.5006
 epoch: 27, train_loss: 0.8951, test_loss: 0.9598, test_f1: 0.4912
 epoch: 28, train_loss: 0.8827, test_loss: 0.8669, test_f1: 0.5277
 epoch: 29, train_loss: 0.8766, test_loss: 0.9533, test_f1: 0.5274
 epoch: 30, train_loss: 0.8720, test_loss: 0.9244, test_f1: 0.5228
 epoch: 31, train_loss: 0.8646, test_loss: 0.9270, test_f1: 0.5282
 epoch: 32, train_loss: 0.8670, test_loss: 0.9107, test_f1: 0.5309
 epoch: 33, train_loss: 0.8501, test_loss: 0.9630, test_f1: 0.5066
 epoch: 34, train_loss: 0.8569, test_loss: 0.9448, test_f1: 0.5197
 epoch: 35, train_loss: 0.8520, test_loss: 0.9104, test_f1: 0.5222
 epoch: 36, train_loss: 0.8472, test_loss: 0.9385, test_f1: 0.5256
 epoch: 37, train_loss: 0.8400, test_loss: 0.8816, test_f1: 0.5227
 epoch: 38, train_loss: 0.8405, test_loss: 0.8686, test_f1: 0.5453
 epoch: 39, train_loss: 0.8317, test_loss: 0.9101, test_f1: 0.5088
 epoch: 40, train_loss: 0.8558, test_loss: 1.0498, test_f1: 0.4859
 epoch: 41, train_loss: 0.8463, test_loss: 0.8886, test_f1: 0.5219
 epoch: 42, train_loss: 0.8386, test_loss: 0.9927, test_f1: 0.5039
 epoch: 43, train_loss: 0.8278, test_loss: 0.9172, test_f1: 0.5339
 epoch: 44, train_loss: 0.8220, test_loss: 0.9188, test_f1: 0.5339
 epoch: 45, train_loss: 0.8285, test_loss: 0.8799, test_f1: 0.5442
 epoch: 46, train_loss: 0.8161, test_loss: 0.9052, test_f1: 0.5221
 epoch: 47, train_loss: 0.8288, test_loss: 0.9239, test_f1: 0.5406
 epoch: 48, train_loss: 0.8169, test_loss: 0.9193, test_f1: 0.5277
 epoch: 49, train_loss: 0.8060, test_loss: 0.8765, test_f1: 0.5384
 epoch: 50, train_loss: 0.8050, test_loss: 0.9163, test_f1: 0.5413
 epoch: 51, train_loss: 0.8079, test_loss: 0.8931, test_f1: 0.5415
 epoch: 52, train_loss: 0.7878, test_loss: 0.8993, test_f1: 0.5409
 epoch: 53, train_loss: 0.8011, test_loss: 0.9446, test_f1: 0.5313
 epoch: 54, train_loss: 0.7924, test_loss: 0.8839, test_f1: 0.5318
 epoch: 55, train_loss: 0.7893, test_loss: 0.9281, test_f1: 0.5251
 epoch: 56, train_loss: 0.7770, test_loss: 0.9200, test_f1: 0.5318
 epoch: 57, train_loss: 0.7814, test_loss: 0.9166, test_f1: 0.5289
 epoch: 58, train_loss: 0.7814, test_loss: 0.9150, test_f1: 0.5340
 epoch: 59, train_loss: 0.7888, test_loss: 0.9006, test_f1: 0.5358
 epoch: 60, train_loss: 0.7781, test_loss: 0.9032, test_f1: 0.5278
 epoch: 61, train_loss: 0.7744, test_loss: 0.9211, test_f1: 0.5094
 epoch: 62, train_loss: 0.7764, test_loss: 0.9530, test_f1: 0.5155
 epoch: 63, train_loss: 0.7817, test_loss: 0.9425, test_f1: 0.5165
 epoch: 64, train_loss: 0.7701, test_loss: 0.9280, test_f1: 0.5285
 epoch: 65, train_loss: 0.7642, test_loss: 0.8913, test_f1: 0.5276
 epoch: 66, train_loss: 0.7704, test_loss: 0.9182, test_f1: 0.5285
 epoch: 67, train_loss: 0.7728, test_loss: 0.9450, test_f1: 0.5278
 epoch: 68, train_loss: 0.7728, test_loss: 0.9164, test_f1: 0.5131
 epoch: 69, train_loss: 0.7798, test_loss: 0.9320, test_f1: 0.5220
 epoch: 70, train_loss: 0.7751, test_loss: 0.9661, test_f1: 0.5249
 epoch: 71, train_loss: 0.7678, test_loss: 0.9412, test_f1: 0.5160
 epoch: 72, train_loss: 0.7538, test_loss: 0.9600, test_f1: 0.5067
 epoch: 73, train_loss: 0.7583, test_loss: 0.9488, test_f1: 0.5272
 epoch: 74, train_loss: 0.7713, test_loss: 0.9540, test_f1: 0.5156
 epoch: 75, train_loss: 0.7615, test_loss: 0.9583, test_f1: 0.5124
 epoch: 76, train_loss: 0.7591, test_loss: 0.9571, test_f1: 0.5072
 epoch: 77, train_loss: 0.7519, test_loss: 0.9454, test_f1: 0.5144
 epoch: 78, train_loss: 0.7443, test_loss: 0.9462, test_f1: 0.5196
 epoch: 79, train_loss: 0.7596, test_loss: 0.9619, test_f1: 0.5067
 epoch: 80, train_loss: 0.7463, test_loss: 0.9850, test_f1: 0.5012
 epoch: 81, train_loss: 0.7546, test_loss: 0.9411, test_f1: 0.5161
 epoch: 82, train_loss: 0.7415, test_loss: 0.9814, test_f1: 0.5151
 epoch: 83, train_loss: 0.7411, test_loss: 0.9787, test_f1: 0.5040
 epoch: 84, train_loss: 0.7415, test_loss: 0.9680, test_f1: 0.5105
 epoch: 85, train_loss: 0.7448, test_loss: 0.9262, test_f1: 0.5117
 epoch: 86, train_loss: 0.7367, test_loss: 0.9785, test_f1: 0.5101
 epoch: 87, train_loss: 0.7295, test_loss: 0.9520, test_f1: 0.5061
 epoch: 88, train_loss: 0.7402, test_loss: 0.9333, test_f1: 0.5306
 epoch: 89, train_loss: 0.7483, test_loss: 1.0034, test_f1: 0.5141
 epoch: 90, train_loss: 0.7434, test_loss: 0.9811, test_f1: 0.5196
 epoch: 91, train_loss: 0.7293, test_loss: 1.0002, test_f1: 0.5151
 epoch: 92, train_loss: 0.7400, test_loss: 0.9683, test_f1: 0.5176
 epoch: 93, train_loss: 0.7408, test_loss: 0.9873, test_f1: 0.5029
 epoch: 94, train_loss: 0.7367, test_loss: 0.9636, test_f1: 0.5135
 epoch: 95, train_loss: 0.7430, test_loss: 0.9482, test_f1: 0.5077
 epoch: 96, train_loss: 0.7436, test_loss: 0.9918, test_f1: 0.5037
 epoch: 97, train_loss: 0.7353, test_loss: 0.9936, test_f1: 0.5097
 epoch: 98, train_loss: 0.7310, test_loss: 0.9917, test_f1: 0.5096
 epoch: 99, train_loss: 0.7305, test_loss: 0.9900, test_f1: 0.5064
##################ITERATION #6 ****************************************
 epoch: 0, train_loss: 1.5297, test_loss: 1.3984, test_f1: 0.2540
 epoch: 1, train_loss: 1.3565, test_loss: 1.3581, test_f1: 0.2540
 epoch: 2, train_loss: 1.2823, test_loss: 1.2887, test_f1: 0.2540
 epoch: 3, train_loss: 1.2382, test_loss: 1.2179, test_f1: 0.2565
 epoch: 4, train_loss: 1.1998, test_loss: 1.1483, test_f1: 0.3189
 epoch: 5, train_loss: 1.1600, test_loss: 1.1060, test_f1: 0.3381
 epoch: 6, train_loss: 1.1360, test_loss: 1.0708, test_f1: 0.3762
 epoch: 7, train_loss: 1.1018, test_loss: 1.0612, test_f1: 0.3737
 epoch: 8, train_loss: 1.0717, test_loss: 1.0424, test_f1: 0.4197
 epoch: 9, train_loss: 1.0622, test_loss: 1.0393, test_f1: 0.4316
 epoch: 10, train_loss: 1.0430, test_loss: 1.0304, test_f1: 0.4276
 epoch: 11, train_loss: 1.0281, test_loss: 1.0428, test_f1: 0.4110
 epoch: 12, train_loss: 1.0113, test_loss: 1.0206, test_f1: 0.4418
 epoch: 13, train_loss: 1.0055, test_loss: 1.0114, test_f1: 0.4321
 epoch: 14, train_loss: 0.9874, test_loss: 0.9949, test_f1: 0.4670
 epoch: 15, train_loss: 0.9765, test_loss: 1.0026, test_f1: 0.4515
 epoch: 16, train_loss: 0.9735, test_loss: 1.0237, test_f1: 0.4406
 epoch: 17, train_loss: 0.9684, test_loss: 1.0799, test_f1: 0.4347
 epoch: 18, train_loss: 0.9597, test_loss: 1.0112, test_f1: 0.4659
 epoch: 19, train_loss: 0.9537, test_loss: 1.0435, test_f1: 0.4522
 epoch: 20, train_loss: 0.9443, test_loss: 0.9968, test_f1: 0.4519
 epoch: 21, train_loss: 0.9464, test_loss: 1.0016, test_f1: 0.4716
 epoch: 22, train_loss: 0.9448, test_loss: 0.9715, test_f1: 0.4675
 epoch: 23, train_loss: 0.9338, test_loss: 1.0070, test_f1: 0.4728
 epoch: 24, train_loss: 0.9281, test_loss: 1.0082, test_f1: 0.4495
 epoch: 25, train_loss: 0.9230, test_loss: 0.9507, test_f1: 0.4771
 epoch: 26, train_loss: 0.9124, test_loss: 0.9375, test_f1: 0.4848
 epoch: 27, train_loss: 0.9226, test_loss: 0.9548, test_f1: 0.4772
 epoch: 28, train_loss: 0.9131, test_loss: 0.9541, test_f1: 0.4825
 epoch: 29, train_loss: 0.9138, test_loss: 0.9525, test_f1: 0.4861
 epoch: 30, train_loss: 0.9068, test_loss: 0.9778, test_f1: 0.4710
 epoch: 31, train_loss: 0.8906, test_loss: 0.9594, test_f1: 0.4999
 epoch: 32, train_loss: 0.8988, test_loss: 0.9749, test_f1: 0.4817
 epoch: 33, train_loss: 0.9079, test_loss: 0.9569, test_f1: 0.4675
 epoch: 34, train_loss: 0.8949, test_loss: 0.9462, test_f1: 0.4771
 epoch: 35, train_loss: 0.8855, test_loss: 0.9636, test_f1: 0.4926
 epoch: 36, train_loss: 0.8792, test_loss: 0.9714, test_f1: 0.4748
 epoch: 37, train_loss: 0.8902, test_loss: 0.9703, test_f1: 0.4854
 epoch: 38, train_loss: 0.8751, test_loss: 0.9446, test_f1: 0.4836
 epoch: 39, train_loss: 0.8740, test_loss: 0.9790, test_f1: 0.4785
 epoch: 40, train_loss: 0.8733, test_loss: 0.9608, test_f1: 0.4748
 epoch: 41, train_loss: 0.8711, test_loss: 1.0201, test_f1: 0.4798
 epoch: 42, train_loss: 0.8635, test_loss: 0.9476, test_f1: 0.4853
 epoch: 43, train_loss: 0.8695, test_loss: 1.0987, test_f1: 0.4635
 epoch: 44, train_loss: 0.8721, test_loss: 0.9635, test_f1: 0.4799
 epoch: 45, train_loss: 0.8686, test_loss: 0.9910, test_f1: 0.4848
 epoch: 46, train_loss: 0.8658, test_loss: 0.9757, test_f1: 0.4890
 epoch: 47, train_loss: 0.8482, test_loss: 1.0269, test_f1: 0.4806
 epoch: 48, train_loss: 0.8524, test_loss: 0.9553, test_f1: 0.4857
 epoch: 49, train_loss: 0.8521, test_loss: 0.9698, test_f1: 0.4889
 epoch: 50, train_loss: 0.8417, test_loss: 0.9596, test_f1: 0.4945
 epoch: 51, train_loss: 0.8265, test_loss: 0.9683, test_f1: 0.4968
 epoch: 52, train_loss: 0.8258, test_loss: 0.9729, test_f1: 0.4999
 epoch: 53, train_loss: 0.8266, test_loss: 0.9765, test_f1: 0.4963
 epoch: 54, train_loss: 0.8233, test_loss: 0.9672, test_f1: 0.4914
 epoch: 55, train_loss: 0.8149, test_loss: 0.9817, test_f1: 0.4949
 epoch: 56, train_loss: 0.8343, test_loss: 0.9880, test_f1: 0.4917
 epoch: 57, train_loss: 0.8240, test_loss: 0.9629, test_f1: 0.4872
 epoch: 58, train_loss: 0.8297, test_loss: 0.9744, test_f1: 0.4996
 epoch: 59, train_loss: 0.8261, test_loss: 0.9907, test_f1: 0.4969
 epoch: 60, train_loss: 0.8192, test_loss: 0.9463, test_f1: 0.4977
 epoch: 61, train_loss: 0.8119, test_loss: 0.9793, test_f1: 0.5013
 epoch: 62, train_loss: 0.8197, test_loss: 0.9782, test_f1: 0.4898
 epoch: 63, train_loss: 0.8140, test_loss: 0.9724, test_f1: 0.4837
 epoch: 64, train_loss: 0.8135, test_loss: 0.9767, test_f1: 0.4866
 epoch: 65, train_loss: 0.8033, test_loss: 1.0056, test_f1: 0.4937
 epoch: 66, train_loss: 0.8079, test_loss: 0.9959, test_f1: 0.4951
 epoch: 67, train_loss: 0.8055, test_loss: 0.9787, test_f1: 0.4999
 epoch: 68, train_loss: 0.8187, test_loss: 1.0025, test_f1: 0.4935
 epoch: 69, train_loss: 0.8098, test_loss: 1.0163, test_f1: 0.4882
 epoch: 70, train_loss: 0.8093, test_loss: 0.9856, test_f1: 0.4932
 epoch: 71, train_loss: 0.8071, test_loss: 0.9992, test_f1: 0.4919
 epoch: 72, train_loss: 0.7997, test_loss: 1.0031, test_f1: 0.4957
 epoch: 73, train_loss: 0.8023, test_loss: 1.0119, test_f1: 0.4974
 epoch: 74, train_loss: 0.8022, test_loss: 1.0241, test_f1: 0.4963
 epoch: 75, train_loss: 0.8002, test_loss: 1.0183, test_f1: 0.4959
 epoch: 76, train_loss: 0.7956, test_loss: 1.0112, test_f1: 0.4950
 epoch: 77, train_loss: 0.7917, test_loss: 1.0073, test_f1: 0.4975
 epoch: 78, train_loss: 0.7968, test_loss: 1.0119, test_f1: 0.4995
 epoch: 79, train_loss: 0.7871, test_loss: 1.0246, test_f1: 0.5104
 epoch: 80, train_loss: 0.8011, test_loss: 1.0051, test_f1: 0.5016
 epoch: 81, train_loss: 0.7864, test_loss: 1.0003, test_f1: 0.4974
 epoch: 82, train_loss: 0.7985, test_loss: 1.0055, test_f1: 0.4977
 epoch: 83, train_loss: 0.7855, test_loss: 0.9910, test_f1: 0.4923
 epoch: 84, train_loss: 0.7874, test_loss: 0.9954, test_f1: 0.4950
 epoch: 85, train_loss: 0.7842, test_loss: 1.0241, test_f1: 0.4946
 epoch: 86, train_loss: 0.7800, test_loss: 1.0284, test_f1: 0.5008
 epoch: 87, train_loss: 0.7824, test_loss: 0.9965, test_f1: 0.4977
 epoch: 88, train_loss: 0.7774, test_loss: 1.0181, test_f1: 0.4981
 epoch: 89, train_loss: 0.7792, test_loss: 1.0537, test_f1: 0.4770
 epoch: 90, train_loss: 0.7748, test_loss: 1.0127, test_f1: 0.4983
 epoch: 91, train_loss: 0.7828, test_loss: 1.0428, test_f1: 0.4920
 epoch: 92, train_loss: 0.7756, test_loss: 1.0366, test_f1: 0.4987
 epoch: 93, train_loss: 0.7764, test_loss: 1.0395, test_f1: 0.4922
 epoch: 94, train_loss: 0.7736, test_loss: 1.0148, test_f1: 0.4976
 epoch: 95, train_loss: 0.7773, test_loss: 1.1180, test_f1: 0.4734
 epoch: 96, train_loss: 0.7727, test_loss: 1.0207, test_f1: 0.4945
 epoch: 97, train_loss: 0.7753, test_loss: 1.0298, test_f1: 0.4987
 epoch: 98, train_loss: 0.7678, test_loss: 1.0160, test_f1: 0.5017
 epoch: 99, train_loss: 0.7669, test_loss: 1.0331, test_f1: 0.4937
##################ITERATION #7 ****************************************
 epoch: 0, train_loss: 1.4169, test_loss: 1.3615, test_f1: 0.2260
 epoch: 1, train_loss: 1.2856, test_loss: 1.3196, test_f1: 0.2260
 epoch: 2, train_loss: 1.2428, test_loss: 1.2619, test_f1: 0.2262
 epoch: 3, train_loss: 1.2193, test_loss: 1.1995, test_f1: 0.2811
 epoch: 4, train_loss: 1.1919, test_loss: 1.1569, test_f1: 0.3540
 epoch: 5, train_loss: 1.1462, test_loss: 1.1380, test_f1: 0.3901
 epoch: 6, train_loss: 1.1118, test_loss: 1.0856, test_f1: 0.3969
 epoch: 7, train_loss: 1.0832, test_loss: 1.0325, test_f1: 0.4576
 epoch: 8, train_loss: 1.0804, test_loss: 1.0236, test_f1: 0.4600
 epoch: 9, train_loss: 1.0465, test_loss: 1.0160, test_f1: 0.4760
 epoch: 10, train_loss: 1.0254, test_loss: 1.0061, test_f1: 0.4794
 epoch: 11, train_loss: 1.0229, test_loss: 1.0150, test_f1: 0.4492
 epoch: 12, train_loss: 1.0065, test_loss: 0.9909, test_f1: 0.4886
 epoch: 13, train_loss: 0.9836, test_loss: 0.9888, test_f1: 0.4713
 epoch: 14, train_loss: 0.9812, test_loss: 1.0141, test_f1: 0.4718
 epoch: 15, train_loss: 0.9739, test_loss: 1.0285, test_f1: 0.4711
 epoch: 16, train_loss: 0.9798, test_loss: 0.9988, test_f1: 0.4598
 epoch: 17, train_loss: 0.9684, test_loss: 1.0054, test_f1: 0.4642
 epoch: 18, train_loss: 0.9539, test_loss: 1.0426, test_f1: 0.4399
 epoch: 19, train_loss: 0.9432, test_loss: 0.9713, test_f1: 0.5136
 epoch: 20, train_loss: 0.9384, test_loss: 1.0052, test_f1: 0.4611
 epoch: 21, train_loss: 0.9191, test_loss: 0.9730, test_f1: 0.5026
 epoch: 22, train_loss: 0.9245, test_loss: 0.9582, test_f1: 0.4979
 epoch: 23, train_loss: 0.9261, test_loss: 0.9933, test_f1: 0.4836
 epoch: 24, train_loss: 0.9137, test_loss: 0.9775, test_f1: 0.4941
 epoch: 25, train_loss: 0.9144, test_loss: 1.0170, test_f1: 0.4729
 epoch: 26, train_loss: 0.9026, test_loss: 1.0270, test_f1: 0.4702
 epoch: 27, train_loss: 0.9016, test_loss: 0.9765, test_f1: 0.4795
 epoch: 28, train_loss: 0.8936, test_loss: 0.9977, test_f1: 0.4661
 epoch: 29, train_loss: 0.8960, test_loss: 1.0302, test_f1: 0.4766
 epoch: 30, train_loss: 0.8756, test_loss: 0.9860, test_f1: 0.5057
 epoch: 31, train_loss: 0.8885, test_loss: 1.0124, test_f1: 0.4913
 epoch: 32, train_loss: 0.8932, test_loss: 1.0070, test_f1: 0.5001
 epoch: 33, train_loss: 0.8957, test_loss: 0.9924, test_f1: 0.5091
 epoch: 34, train_loss: 0.8667, test_loss: 1.0119, test_f1: 0.4964
 epoch: 35, train_loss: 0.8790, test_loss: 1.0347, test_f1: 0.4757
 epoch: 36, train_loss: 0.8733, test_loss: 1.0020, test_f1: 0.5028
 epoch: 37, train_loss: 0.8652, test_loss: 0.9590, test_f1: 0.5050
 epoch: 38, train_loss: 0.8569, test_loss: 0.9938, test_f1: 0.4821
 epoch: 39, train_loss: 0.8521, test_loss: 0.9702, test_f1: 0.5061
 epoch: 40, train_loss: 0.8531, test_loss: 1.0036, test_f1: 0.4870
 epoch: 41, train_loss: 0.8539, test_loss: 0.9810, test_f1: 0.4877
 epoch: 42, train_loss: 0.8517, test_loss: 1.0495, test_f1: 0.5093
 epoch: 43, train_loss: 0.8551, test_loss: 0.9761, test_f1: 0.5040
 epoch: 44, train_loss: 0.8559, test_loss: 0.9853, test_f1: 0.5057
 epoch: 45, train_loss: 0.8467, test_loss: 1.0473, test_f1: 0.4885
 epoch: 46, train_loss: 0.8418, test_loss: 1.0004, test_f1: 0.5129
 epoch: 47, train_loss: 0.8342, test_loss: 0.9891, test_f1: 0.5085
 epoch: 48, train_loss: 0.8326, test_loss: 0.9717, test_f1: 0.5161
 epoch: 49, train_loss: 0.8262, test_loss: 0.9723, test_f1: 0.5094
 epoch: 50, train_loss: 0.8266, test_loss: 1.0619, test_f1: 0.4917
 epoch: 51, train_loss: 0.8228, test_loss: 0.9588, test_f1: 0.5140
 epoch: 52, train_loss: 0.8256, test_loss: 0.9626, test_f1: 0.5083
 epoch: 53, train_loss: 0.8107, test_loss: 0.9754, test_f1: 0.5043
 epoch: 54, train_loss: 0.8161, test_loss: 0.9769, test_f1: 0.5176
 epoch: 55, train_loss: 0.8045, test_loss: 1.0080, test_f1: 0.5166
 epoch: 56, train_loss: 0.8083, test_loss: 0.9977, test_f1: 0.5111
 epoch: 57, train_loss: 0.8114, test_loss: 0.9737, test_f1: 0.5245
 epoch: 58, train_loss: 0.7962, test_loss: 1.0018, test_f1: 0.5102
 epoch: 59, train_loss: 0.8098, test_loss: 0.9804, test_f1: 0.5262
 epoch: 60, train_loss: 0.7929, test_loss: 0.9935, test_f1: 0.5235
 epoch: 61, train_loss: 0.8071, test_loss: 1.0029, test_f1: 0.5300
 epoch: 62, train_loss: 0.7890, test_loss: 1.0023, test_f1: 0.5237
 epoch: 63, train_loss: 0.8005, test_loss: 0.9731, test_f1: 0.5298
 epoch: 64, train_loss: 0.8017, test_loss: 0.9881, test_f1: 0.5292
 epoch: 65, train_loss: 0.7917, test_loss: 0.9710, test_f1: 0.5255
 epoch: 66, train_loss: 0.7817, test_loss: 1.0053, test_f1: 0.5183
 epoch: 67, train_loss: 0.7976, test_loss: 0.9720, test_f1: 0.5333
 epoch: 68, train_loss: 0.7896, test_loss: 0.9850, test_f1: 0.5256
 epoch: 69, train_loss: 0.7851, test_loss: 1.0163, test_f1: 0.5194
 epoch: 70, train_loss: 0.7889, test_loss: 0.9795, test_f1: 0.5087
 epoch: 71, train_loss: 0.7921, test_loss: 0.9882, test_f1: 0.5265
 epoch: 72, train_loss: 0.7861, test_loss: 1.0058, test_f1: 0.5240
 epoch: 73, train_loss: 0.7845, test_loss: 1.0126, test_f1: 0.5210
 epoch: 74, train_loss: 0.7906, test_loss: 0.9873, test_f1: 0.5161
 epoch: 75, train_loss: 0.7733, test_loss: 0.9904, test_f1: 0.5236
 epoch: 76, train_loss: 0.7817, test_loss: 1.0220, test_f1: 0.5180
 epoch: 77, train_loss: 0.7752, test_loss: 0.9793, test_f1: 0.5278
 epoch: 78, train_loss: 0.7769, test_loss: 0.9699, test_f1: 0.5178
 epoch: 79, train_loss: 0.7794, test_loss: 0.9886, test_f1: 0.5238
 epoch: 80, train_loss: 0.7687, test_loss: 0.9673, test_f1: 0.5421
 epoch: 81, train_loss: 0.7817, test_loss: 0.9660, test_f1: 0.5215
 epoch: 82, train_loss: 0.7757, test_loss: 0.9855, test_f1: 0.5240
 epoch: 83, train_loss: 0.7710, test_loss: 0.9821, test_f1: 0.5314
 epoch: 84, train_loss: 0.7721, test_loss: 1.0028, test_f1: 0.5319
 epoch: 85, train_loss: 0.7687, test_loss: 1.0062, test_f1: 0.5297
 epoch: 86, train_loss: 0.7729, test_loss: 1.0072, test_f1: 0.5367
 epoch: 87, train_loss: 0.7684, test_loss: 1.0104, test_f1: 0.5216
 epoch: 88, train_loss: 0.7731, test_loss: 1.0171, test_f1: 0.5235
 epoch: 89, train_loss: 0.7841, test_loss: 0.9936, test_f1: 0.5288
 epoch: 90, train_loss: 0.7773, test_loss: 1.0134, test_f1: 0.5143
 epoch: 91, train_loss: 0.7810, test_loss: 1.0201, test_f1: 0.5090
 epoch: 92, train_loss: 0.7727, test_loss: 1.0345, test_f1: 0.5138
 epoch: 93, train_loss: 0.7651, test_loss: 1.0216, test_f1: 0.5198
 epoch: 94, train_loss: 0.7719, test_loss: 1.0275, test_f1: 0.5100
 epoch: 95, train_loss: 0.7524, test_loss: 0.9989, test_f1: 0.5295
 epoch: 96, train_loss: 0.7612, test_loss: 1.0384, test_f1: 0.5118
 epoch: 97, train_loss: 0.7582, test_loss: 1.0404, test_f1: 0.5112
 epoch: 98, train_loss: 0.7636, test_loss: 0.9971, test_f1: 0.5232
 epoch: 99, train_loss: 0.7653, test_loss: 0.9837, test_f1: 0.5260
##################ITERATION #8 ****************************************
 epoch: 0, train_loss: 1.3597, test_loss: 1.3382, test_f1: 0.2260
 epoch: 1, train_loss: 1.2014, test_loss: 1.3162, test_f1: 0.2434
 epoch: 2, train_loss: 1.1561, test_loss: 1.2597, test_f1: 0.2781
 epoch: 3, train_loss: 1.1183, test_loss: 1.1101, test_f1: 0.4279
 epoch: 4, train_loss: 1.1014, test_loss: 1.0870, test_f1: 0.4341
 epoch: 5, train_loss: 1.0803, test_loss: 1.0837, test_f1: 0.4187
 epoch: 6, train_loss: 1.0634, test_loss: 1.0817, test_f1: 0.4156
 epoch: 7, train_loss: 1.0526, test_loss: 1.0635, test_f1: 0.4286
 epoch: 8, train_loss: 1.0403, test_loss: 1.0554, test_f1: 0.4331
 epoch: 9, train_loss: 1.0386, test_loss: 1.0560, test_f1: 0.4330
 epoch: 10, train_loss: 1.0290, test_loss: 1.0528, test_f1: 0.4348
 epoch: 11, train_loss: 1.0281, test_loss: 1.0817, test_f1: 0.4548
 epoch: 12, train_loss: 1.0199, test_loss: 1.0592, test_f1: 0.4388
 epoch: 13, train_loss: 1.0042, test_loss: 1.0842, test_f1: 0.4445
 epoch: 14, train_loss: 1.0083, test_loss: 1.0734, test_f1: 0.4418
 epoch: 15, train_loss: 0.9951, test_loss: 1.0886, test_f1: 0.4186
 epoch: 16, train_loss: 0.9892, test_loss: 1.0703, test_f1: 0.4339
 epoch: 17, train_loss: 0.9807, test_loss: 1.1054, test_f1: 0.4455
 epoch: 18, train_loss: 0.9830, test_loss: 1.0763, test_f1: 0.4755
 epoch: 19, train_loss: 0.9774, test_loss: 1.0929, test_f1: 0.4320
 epoch: 20, train_loss: 0.9735, test_loss: 1.0904, test_f1: 0.4726
 epoch: 21, train_loss: 0.9714, test_loss: 1.0611, test_f1: 0.4738
 epoch: 22, train_loss: 0.9706, test_loss: 1.0970, test_f1: 0.4585
 epoch: 23, train_loss: 0.9698, test_loss: 1.0795, test_f1: 0.4770
 epoch: 24, train_loss: 0.9651, test_loss: 1.1484, test_f1: 0.4401
 epoch: 25, train_loss: 0.9600, test_loss: 1.1801, test_f1: 0.4326
 epoch: 26, train_loss: 0.9539, test_loss: 1.1266, test_f1: 0.4818
 epoch: 27, train_loss: 0.9450, test_loss: 1.0794, test_f1: 0.4721
 epoch: 28, train_loss: 0.9451, test_loss: 1.0671, test_f1: 0.4960
 epoch: 29, train_loss: 0.9388, test_loss: 1.1283, test_f1: 0.4576
 epoch: 30, train_loss: 0.9353, test_loss: 1.1157, test_f1: 0.4674
 epoch: 31, train_loss: 0.9281, test_loss: 1.0731, test_f1: 0.4977
 epoch: 32, train_loss: 0.9300, test_loss: 1.0715, test_f1: 0.4783
 epoch: 33, train_loss: 0.9305, test_loss: 1.0643, test_f1: 0.5115
 epoch: 34, train_loss: 0.9388, test_loss: 1.0896, test_f1: 0.4788
 epoch: 35, train_loss: 0.9263, test_loss: 1.0564, test_f1: 0.4984
 epoch: 36, train_loss: 0.9282, test_loss: 1.0925, test_f1: 0.4817
 epoch: 37, train_loss: 0.9211, test_loss: 1.0544, test_f1: 0.5128
 epoch: 38, train_loss: 0.9203, test_loss: 1.0551, test_f1: 0.4907
 epoch: 39, train_loss: 0.9139, test_loss: 1.1641, test_f1: 0.4806
 epoch: 40, train_loss: 0.9100, test_loss: 1.0425, test_f1: 0.5010
 epoch: 41, train_loss: 0.9170, test_loss: 1.0780, test_f1: 0.4967
 epoch: 42, train_loss: 0.9038, test_loss: 1.0574, test_f1: 0.4898
 epoch: 43, train_loss: 0.8987, test_loss: 1.0338, test_f1: 0.5069
 epoch: 44, train_loss: 0.9048, test_loss: 1.0300, test_f1: 0.5115
 epoch: 45, train_loss: 0.8894, test_loss: 1.0681, test_f1: 0.4850
 epoch: 46, train_loss: 0.8991, test_loss: 1.0361, test_f1: 0.5084
 epoch: 47, train_loss: 0.8998, test_loss: 1.0418, test_f1: 0.4937
 epoch: 48, train_loss: 0.9023, test_loss: 1.0612, test_f1: 0.5045
 epoch: 49, train_loss: 0.8851, test_loss: 1.0465, test_f1: 0.5178
 epoch: 50, train_loss: 0.8801, test_loss: 1.0373, test_f1: 0.5160
 epoch: 51, train_loss: 0.8882, test_loss: 1.0642, test_f1: 0.5133
 epoch: 52, train_loss: 0.8764, test_loss: 1.0491, test_f1: 0.5026
 epoch: 53, train_loss: 0.8765, test_loss: 1.0540, test_f1: 0.5111
 epoch: 54, train_loss: 0.8617, test_loss: 1.0327, test_f1: 0.5103
 epoch: 55, train_loss: 0.8838, test_loss: 1.0352, test_f1: 0.5263
 epoch: 56, train_loss: 0.8695, test_loss: 1.0734, test_f1: 0.5166
 epoch: 57, train_loss: 0.8686, test_loss: 1.0409, test_f1: 0.5153
 epoch: 58, train_loss: 0.8738, test_loss: 1.0594, test_f1: 0.5003
 epoch: 59, train_loss: 0.8616, test_loss: 1.0894, test_f1: 0.5124
 epoch: 60, train_loss: 0.8669, test_loss: 1.0345, test_f1: 0.5165
 epoch: 61, train_loss: 0.8575, test_loss: 1.0569, test_f1: 0.5222
 epoch: 62, train_loss: 0.8628, test_loss: 1.0572, test_f1: 0.5062
 epoch: 63, train_loss: 0.8590, test_loss: 1.0391, test_f1: 0.5243
 epoch: 64, train_loss: 0.8555, test_loss: 1.0590, test_f1: 0.5093
 epoch: 65, train_loss: 0.8487, test_loss: 1.0477, test_f1: 0.5172
 epoch: 66, train_loss: 0.8524, test_loss: 1.0415, test_f1: 0.5137
 epoch: 67, train_loss: 0.8509, test_loss: 1.0281, test_f1: 0.5213
 epoch: 68, train_loss: 0.8560, test_loss: 1.0260, test_f1: 0.5259
 epoch: 69, train_loss: 0.8531, test_loss: 1.0619, test_f1: 0.5162
 epoch: 70, train_loss: 0.8588, test_loss: 1.0534, test_f1: 0.5266
 epoch: 71, train_loss: 0.8429, test_loss: 1.0488, test_f1: 0.5208
 epoch: 72, train_loss: 0.8475, test_loss: 1.0370, test_f1: 0.5168
 epoch: 73, train_loss: 0.8329, test_loss: 1.0379, test_f1: 0.5312
 epoch: 74, train_loss: 0.8373, test_loss: 1.0509, test_f1: 0.5291
 epoch: 75, train_loss: 0.8512, test_loss: 1.0903, test_f1: 0.5198
 epoch: 76, train_loss: 0.8442, test_loss: 1.0455, test_f1: 0.5284
 epoch: 77, train_loss: 0.8402, test_loss: 1.0323, test_f1: 0.5303
 epoch: 78, train_loss: 0.8343, test_loss: 1.0726, test_f1: 0.5212
 epoch: 79, train_loss: 0.8454, test_loss: 1.0134, test_f1: 0.5280
 epoch: 80, train_loss: 0.8359, test_loss: 1.0479, test_f1: 0.5238
 epoch: 81, train_loss: 0.8370, test_loss: 1.0215, test_f1: 0.5259
 epoch: 82, train_loss: 0.8454, test_loss: 1.0367, test_f1: 0.5240
 epoch: 83, train_loss: 0.8370, test_loss: 1.0102, test_f1: 0.5304
 epoch: 84, train_loss: 0.8378, test_loss: 1.0583, test_f1: 0.5284
 epoch: 85, train_loss: 0.8456, test_loss: 1.0215, test_f1: 0.5140
 epoch: 86, train_loss: 0.8225, test_loss: 1.0491, test_f1: 0.5270
 epoch: 87, train_loss: 0.8400, test_loss: 1.0379, test_f1: 0.5225
 epoch: 88, train_loss: 0.8383, test_loss: 1.0660, test_f1: 0.5255
 epoch: 89, train_loss: 0.8295, test_loss: 1.0924, test_f1: 0.5134
 epoch: 90, train_loss: 0.8208, test_loss: 1.0184, test_f1: 0.5211
 epoch: 91, train_loss: 0.8382, test_loss: 1.0123, test_f1: 0.5297
 epoch: 92, train_loss: 0.8300, test_loss: 1.0294, test_f1: 0.5254
 epoch: 93, train_loss: 0.8402, test_loss: 1.0440, test_f1: 0.5335
 epoch: 94, train_loss: 0.8330, test_loss: 1.0748, test_f1: 0.5265
 epoch: 95, train_loss: 0.8229, test_loss: 1.0409, test_f1: 0.5199
 epoch: 96, train_loss: 0.8257, test_loss: 1.0878, test_f1: 0.5100
 epoch: 97, train_loss: 0.8182, test_loss: 1.0308, test_f1: 0.5301
 epoch: 98, train_loss: 0.8129, test_loss: 1.0575, test_f1: 0.5251
 epoch: 99, train_loss: 0.8115, test_loss: 1.0248, test_f1: 0.5240
##################ITERATION #9 ****************************************
 epoch: 0, train_loss: 1.3798, test_loss: 1.3399, test_f1: 0.2260
 epoch: 1, train_loss: 1.1807, test_loss: 1.2557, test_f1: 0.2260
 epoch: 2, train_loss: 1.1159, test_loss: 1.1822, test_f1: 0.3334
 epoch: 3, train_loss: 1.0822, test_loss: 1.1340, test_f1: 0.3822
 epoch: 4, train_loss: 1.0683, test_loss: 1.0992, test_f1: 0.4106
 epoch: 5, train_loss: 1.0546, test_loss: 1.1130, test_f1: 0.4353
 epoch: 6, train_loss: 1.0436, test_loss: 1.0795, test_f1: 0.4425
 epoch: 7, train_loss: 1.0351, test_loss: 1.0465, test_f1: 0.4499
 epoch: 8, train_loss: 1.0214, test_loss: 1.0431, test_f1: 0.4664
 epoch: 9, train_loss: 1.0183, test_loss: 1.0404, test_f1: 0.4700
 epoch: 10, train_loss: 1.0052, test_loss: 1.0326, test_f1: 0.4711
 epoch: 11, train_loss: 0.9988, test_loss: 1.0082, test_f1: 0.4971
 epoch: 12, train_loss: 0.9911, test_loss: 0.9990, test_f1: 0.4862
 epoch: 13, train_loss: 0.9922, test_loss: 1.0139, test_f1: 0.4745
 epoch: 14, train_loss: 0.9702, test_loss: 0.9989, test_f1: 0.4783
 epoch: 15, train_loss: 0.9713, test_loss: 1.0232, test_f1: 0.4745
 epoch: 16, train_loss: 0.9624, test_loss: 0.9774, test_f1: 0.4997
 epoch: 17, train_loss: 0.9553, test_loss: 0.9847, test_f1: 0.4869
 epoch: 18, train_loss: 0.9512, test_loss: 1.0008, test_f1: 0.4810
 epoch: 19, train_loss: 0.9465, test_loss: 1.0000, test_f1: 0.4919
 epoch: 20, train_loss: 0.9493, test_loss: 0.9836, test_f1: 0.4831
 epoch: 21, train_loss: 0.9355, test_loss: 0.9890, test_f1: 0.5194
 epoch: 22, train_loss: 0.9313, test_loss: 0.9760, test_f1: 0.5081
 epoch: 23, train_loss: 0.9358, test_loss: 0.9840, test_f1: 0.5096
 epoch: 24, train_loss: 0.9280, test_loss: 0.9773, test_f1: 0.4940
 epoch: 25, train_loss: 0.9157, test_loss: 0.9765, test_f1: 0.5171
 epoch: 26, train_loss: 0.9136, test_loss: 0.9315, test_f1: 0.5018
 epoch: 27, train_loss: 0.9191, test_loss: 0.9746, test_f1: 0.5200
 epoch: 28, train_loss: 0.9120, test_loss: 0.9681, test_f1: 0.5090
 epoch: 29, train_loss: 0.9092, test_loss: 0.9807, test_f1: 0.5231
 epoch: 30, train_loss: 0.8998, test_loss: 0.9646, test_f1: 0.5276
 epoch: 31, train_loss: 0.9045, test_loss: 0.9599, test_f1: 0.5019
 epoch: 32, train_loss: 0.8866, test_loss: 0.9938, test_f1: 0.5076
 epoch: 33, train_loss: 0.8937, test_loss: 0.9518, test_f1: 0.5209
 epoch: 34, train_loss: 0.8834, test_loss: 0.9855, test_f1: 0.5062
 epoch: 35, train_loss: 0.8903, test_loss: 0.9786, test_f1: 0.5222
 epoch: 36, train_loss: 0.8731, test_loss: 0.9667, test_f1: 0.5077
 epoch: 37, train_loss: 0.8695, test_loss: 0.9721, test_f1: 0.5279
 epoch: 38, train_loss: 0.8660, test_loss: 0.9564, test_f1: 0.5553
 epoch: 39, train_loss: 0.8718, test_loss: 0.9938, test_f1: 0.5171
 epoch: 40, train_loss: 0.8564, test_loss: 0.9422, test_f1: 0.5367
 epoch: 41, train_loss: 0.8701, test_loss: 0.9807, test_f1: 0.5452
 epoch: 42, train_loss: 0.8581, test_loss: 0.9399, test_f1: 0.5476
 epoch: 43, train_loss: 0.8670, test_loss: 0.9353, test_f1: 0.5443
 epoch: 44, train_loss: 0.8526, test_loss: 0.9742, test_f1: 0.5300
 epoch: 45, train_loss: 0.8581, test_loss: 0.9556, test_f1: 0.5159
 epoch: 46, train_loss: 0.8598, test_loss: 0.9888, test_f1: 0.5357
 epoch: 47, train_loss: 0.8491, test_loss: 0.9395, test_f1: 0.5323
 epoch: 48, train_loss: 0.8460, test_loss: 0.9645, test_f1: 0.5259
 epoch: 49, train_loss: 0.8386, test_loss: 0.9519, test_f1: 0.5442
 epoch: 50, train_loss: 0.8482, test_loss: 0.9664, test_f1: 0.5248
 epoch: 51, train_loss: 0.8343, test_loss: 0.9681, test_f1: 0.5553
 epoch: 52, train_loss: 0.8130, test_loss: 0.9649, test_f1: 0.5362
 epoch: 53, train_loss: 0.8241, test_loss: 0.9661, test_f1: 0.5326
 epoch: 54, train_loss: 0.8235, test_loss: 0.9669, test_f1: 0.5221
 epoch: 55, train_loss: 0.8178, test_loss: 0.9675, test_f1: 0.5354
 epoch: 56, train_loss: 0.8144, test_loss: 0.9744, test_f1: 0.5242
 epoch: 57, train_loss: 0.8082, test_loss: 0.9520, test_f1: 0.5404
 epoch: 58, train_loss: 0.8170, test_loss: 0.9556, test_f1: 0.5309
 epoch: 59, train_loss: 0.8075, test_loss: 1.0113, test_f1: 0.5398
 epoch: 60, train_loss: 0.8256, test_loss: 0.9860, test_f1: 0.5324
 epoch: 61, train_loss: 0.8160, test_loss: 1.0152, test_f1: 0.5236
 epoch: 62, train_loss: 0.8067, test_loss: 0.9921, test_f1: 0.5255
 epoch: 63, train_loss: 0.8166, test_loss: 0.9850, test_f1: 0.5405
 epoch: 64, train_loss: 0.8037, test_loss: 0.9590, test_f1: 0.5323
 epoch: 65, train_loss: 0.8063, test_loss: 0.9819, test_f1: 0.5371
 epoch: 66, train_loss: 0.8126, test_loss: 0.9690, test_f1: 0.5332
 epoch: 67, train_loss: 0.8149, test_loss: 0.9840, test_f1: 0.5283
 epoch: 68, train_loss: 0.8030, test_loss: 0.9764, test_f1: 0.5410
 epoch: 69, train_loss: 0.8031, test_loss: 0.9988, test_f1: 0.5413
 epoch: 70, train_loss: 0.8070, test_loss: 0.9985, test_f1: 0.5438
 epoch: 71, train_loss: 0.8020, test_loss: 1.0321, test_f1: 0.5462
 epoch: 72, train_loss: 0.8032, test_loss: 0.9689, test_f1: 0.5427
 epoch: 73, train_loss: 0.8003, test_loss: 1.0064, test_f1: 0.5384
 epoch: 74, train_loss: 0.7996, test_loss: 1.0029, test_f1: 0.5311
 epoch: 75, train_loss: 0.7997, test_loss: 1.0128, test_f1: 0.5318
 epoch: 76, train_loss: 0.7897, test_loss: 0.9974, test_f1: 0.5413
 epoch: 77, train_loss: 0.7817, test_loss: 1.0075, test_f1: 0.5439
 epoch: 78, train_loss: 0.7860, test_loss: 1.0179, test_f1: 0.5432
 epoch: 79, train_loss: 0.7938, test_loss: 1.0219, test_f1: 0.5432
 epoch: 80, train_loss: 0.7860, test_loss: 1.0349, test_f1: 0.5317
 epoch: 81, train_loss: 0.7912, test_loss: 1.0350, test_f1: 0.5321
 epoch: 82, train_loss: 0.7843, test_loss: 1.0462, test_f1: 0.5456
 epoch: 83, train_loss: 0.7883, test_loss: 1.0447, test_f1: 0.5299
 epoch: 84, train_loss: 0.7818, test_loss: 1.0247, test_f1: 0.5289
 epoch: 85, train_loss: 0.7761, test_loss: 1.0527, test_f1: 0.5403
 epoch: 86, train_loss: 0.7787, test_loss: 1.0607, test_f1: 0.5488
 epoch: 87, train_loss: 0.7750, test_loss: 1.0394, test_f1: 0.5378
 epoch: 88, train_loss: 0.7725, test_loss: 1.0680, test_f1: 0.5313
 epoch: 89, train_loss: 0.7718, test_loss: 1.0715, test_f1: 0.5320
 epoch: 90, train_loss: 0.7702, test_loss: 1.0079, test_f1: 0.5390
 epoch: 91, train_loss: 0.7794, test_loss: 0.9829, test_f1: 0.5419
 epoch: 92, train_loss: 0.7718, test_loss: 1.0039, test_f1: 0.5329
 epoch: 93, train_loss: 0.7688, test_loss: 1.0357, test_f1: 0.5324
 epoch: 94, train_loss: 0.7729, test_loss: 1.0476, test_f1: 0.5459
 epoch: 95, train_loss: 0.7522, test_loss: 1.0569, test_f1: 0.5369
 epoch: 96, train_loss: 0.7676, test_loss: 1.0147, test_f1: 0.5340
 epoch: 97, train_loss: 0.7727, test_loss: 1.0473, test_f1: 0.5425
 epoch: 98, train_loss: 0.7716, test_loss: 1.0048, test_f1: 0.5348
 epoch: 99, train_loss: 0.7645, test_loss: 1.0739, test_f1: 0.5314

Training completed in 431.12 seconds
Best F1: 0.5682 at epoch 82
Mean F1 across iterations: 0.5381  0.0172
========================FINAL RESULTS================================
FEGIN weighted F1: 0.5682  0.0172
python main.py --data ltspice_examples --representation component_pin --model FEGIN --layers 5 --hiddens 16 --batch_size 256 --lr 0.001 --emb_size 128 --epochs 100 --save_appendix component_pin_L5_H16_BS256_LR0.001_E128 --no_val
-----



STDERR:
  File "main.py", line 370, in <module>
    main()
  File "main.py", line 254, in main
    dataset = dataset_class(
  File "/home/philip/projects/ltspice_examples_code_repo/Circuit-Completion-Using-GNNs/component_classification_with_link_prediction_head/evaluation/FEGIN/kernel/circuit_datasets.py", line 15, in __init__
    self.data, self.slices = torch.load(self.processed_paths[0])
  File "/home/philip/.local/lib/python3.8/site-packages/torch/serialization.py", line 1040, in load
    warnings.warn(
  File "/usr/lib/python3.8/warnings.py", line 109, in _showwarnmsg
    sw(msg.message, msg.category, msg.filename, msg.lineno,
  File "main.py", line 47, in warn_with_traceback
    traceback.print_stack(file=log)
/home/philip/projects/ltspice_examples_code_repo/Circuit-Completion-Using-GNNs/component_classification_with_link_prediction_head/evaluation/FEGIN/kernel/circuit_datasets.py:15: FutureWarning: You are using `torch.load` with `weights_only=False` (the current default value), which uses the default pickle module implicitly. It is possible to construct malicious pickle data which will execute arbitrary code during unpickling (See https://github.com/pytorch/pytorch/blob/main/SECURITY.md#untrusted-models for more details). In a future release, the default value for `weights_only` will be flipped to `True`. This limits the functions that could be executed during unpickling. Arbitrary objects will no longer be allowed to be loaded via this mode unless they are explicitly allowlisted by the user via `torch.serialization.add_safe_globals`. We recommend you start setting `weights_only=True` for any use case where you don't have full control of the loaded file. Please open an issue on GitHub for any issues related to this experimental feature.
  self.data, self.slices = torch.load(self.processed_paths[0])
