STDOUT:
Results will be saved in /home/philip/projects/ltspice_examples_code_repo/Circuit-Completion-Using-GNNs/component_classification_with_link_prediction_head/evaluation/FEGIN/results/model_FEGIN_dataset_ltspice_examples
Command line input: python main.py --data ltspice_examples --representation component_pin_net --model FEGIN --layers 2 --hiddens 128 --batch_size 32 --lr 0.01 --emb_size 128 --epochs 100 --save_appendix component_pin_net_L2_H128_BS32_LR0.01_E128 --no_val
 is saved.
-----
ltspice_examples - FEGIN
Using 2 layers, 128 hidden units, h = 2
Loading component_pin_net representation dataset
ENTERED
Training FEGIN on component_pin_net representation
Train: 3558, Test: 846
##################ITERATION #0 ****************************************
 epoch: 0, train_loss: 1.1230, test_loss: 1.1841, test_f1: 0.4402
 epoch: 1, train_loss: 1.0248, test_loss: 1.0236, test_f1: 0.4615
 epoch: 2, train_loss: 0.9851, test_loss: 1.0298, test_f1: 0.4775
 epoch: 3, train_loss: 0.9653, test_loss: 0.9773, test_f1: 0.5046
 epoch: 4, train_loss: 0.9310, test_loss: 0.9317, test_f1: 0.5053
 epoch: 5, train_loss: 0.9445, test_loss: 0.9189, test_f1: 0.5506
 epoch: 6, train_loss: 0.9313, test_loss: 0.9190, test_f1: 0.5038
 epoch: 7, train_loss: 0.8979, test_loss: 1.0880, test_f1: 0.5100
 epoch: 8, train_loss: 0.9204, test_loss: 0.9451, test_f1: 0.5124
 epoch: 9, train_loss: 0.8754, test_loss: 0.8853, test_f1: 0.5713
 epoch: 10, train_loss: 0.8813, test_loss: 0.9064, test_f1: 0.6224
 epoch: 11, train_loss: 0.8539, test_loss: 0.9646, test_f1: 0.5629
 epoch: 12, train_loss: 0.8638, test_loss: 0.9741, test_f1: 0.5361
 epoch: 13, train_loss: 0.8421, test_loss: 1.0163, test_f1: 0.5278
 epoch: 14, train_loss: 0.8394, test_loss: 0.9629, test_f1: 0.5187
 epoch: 15, train_loss: 0.8738, test_loss: 0.8651, test_f1: 0.5527
 epoch: 16, train_loss: 0.8216, test_loss: 0.9292, test_f1: 0.5625
 epoch: 17, train_loss: 0.8065, test_loss: 0.9690, test_f1: 0.5822
 epoch: 18, train_loss: 0.8029, test_loss: 0.9984, test_f1: 0.5814
 epoch: 19, train_loss: 0.7961, test_loss: 0.9591, test_f1: 0.5780
 epoch: 20, train_loss: 0.7993, test_loss: 0.8250, test_f1: 0.5847
 epoch: 21, train_loss: 0.8005, test_loss: 0.9715, test_f1: 0.5467
 epoch: 22, train_loss: 0.7981, test_loss: 0.9342, test_f1: 0.5820
 epoch: 23, train_loss: 0.7736, test_loss: 0.8863, test_f1: 0.5884
 epoch: 24, train_loss: 0.7726, test_loss: 0.8392, test_f1: 0.6120
 epoch: 25, train_loss: 0.7726, test_loss: 0.8862, test_f1: 0.6318
 epoch: 26, train_loss: 0.7569, test_loss: 0.8507, test_f1: 0.6009
 epoch: 27, train_loss: 0.7631, test_loss: 0.9127, test_f1: 0.5987
 epoch: 28, train_loss: 0.7581, test_loss: 0.9259, test_f1: 0.5766
 epoch: 29, train_loss: 0.7449, test_loss: 0.8914, test_f1: 0.6258
 epoch: 30, train_loss: 0.7501, test_loss: 0.8787, test_f1: 0.6169
 epoch: 31, train_loss: 0.7160, test_loss: 0.7958, test_f1: 0.5883
 epoch: 32, train_loss: 0.7468, test_loss: 0.7975, test_f1: 0.6081
 epoch: 33, train_loss: 0.7296, test_loss: 0.7977, test_f1: 0.6392
 epoch: 34, train_loss: 0.7359, test_loss: 0.8889, test_f1: 0.5944
 epoch: 35, train_loss: 0.7500, test_loss: 0.7919, test_f1: 0.6155
 epoch: 36, train_loss: 0.7523, test_loss: 0.8298, test_f1: 0.5990
 epoch: 37, train_loss: 0.7134, test_loss: 0.8197, test_f1: 0.6127
 epoch: 38, train_loss: 0.6931, test_loss: 0.9000, test_f1: 0.6063
 epoch: 39, train_loss: 0.7110, test_loss: 0.9036, test_f1: 0.6186
 epoch: 40, train_loss: 0.7048, test_loss: 0.8511, test_f1: 0.6125
 epoch: 41, train_loss: 0.6931, test_loss: 0.9752, test_f1: 0.5963
 epoch: 42, train_loss: 0.6911, test_loss: 0.9318, test_f1: 0.6435
 epoch: 43, train_loss: 0.6915, test_loss: 0.8825, test_f1: 0.6055
 epoch: 44, train_loss: 0.6777, test_loss: 0.7308, test_f1: 0.6553
 epoch: 45, train_loss: 0.6786, test_loss: 0.8993, test_f1: 0.6306
 epoch: 46, train_loss: 0.6483, test_loss: 0.8865, test_f1: 0.5982
 epoch: 47, train_loss: 0.6695, test_loss: 0.9372, test_f1: 0.6556
 epoch: 48, train_loss: 0.6725, test_loss: 0.8102, test_f1: 0.6474
 epoch: 49, train_loss: 0.6458, test_loss: 1.0129, test_f1: 0.6362
 epoch: 50, train_loss: 0.6475, test_loss: 0.7444, test_f1: 0.6287
 epoch: 51, train_loss: 0.6153, test_loss: 0.8177, test_f1: 0.6316
 epoch: 52, train_loss: 0.5787, test_loss: 0.9601, test_f1: 0.6687
 epoch: 53, train_loss: 0.5808, test_loss: 0.8991, test_f1: 0.6462
 epoch: 54, train_loss: 0.5872, test_loss: 0.8381, test_f1: 0.6735
 epoch: 55, train_loss: 0.5816, test_loss: 0.8922, test_f1: 0.6566
 epoch: 56, train_loss: 0.5560, test_loss: 0.8478, test_f1: 0.6582
 epoch: 57, train_loss: 0.5700, test_loss: 0.9417, test_f1: 0.6557
 epoch: 58, train_loss: 0.5533, test_loss: 0.9851, test_f1: 0.6711
 epoch: 59, train_loss: 0.5379, test_loss: 0.9023, test_f1: 0.6907
 epoch: 60, train_loss: 0.5414, test_loss: 1.1262, test_f1: 0.6676
 epoch: 61, train_loss: 0.5453, test_loss: 1.1603, test_f1: 0.6678
 epoch: 62, train_loss: 0.5476, test_loss: 1.0122, test_f1: 0.6423
 epoch: 63, train_loss: 0.5259, test_loss: 0.9924, test_f1: 0.6628
 epoch: 64, train_loss: 0.5455, test_loss: 0.8095, test_f1: 0.6761
 epoch: 65, train_loss: 0.5212, test_loss: 0.9312, test_f1: 0.6632
 epoch: 66, train_loss: 0.5221, test_loss: 0.8734, test_f1: 0.6423
 epoch: 67, train_loss: 0.5191, test_loss: 1.0440, test_f1: 0.6844
 epoch: 68, train_loss: 0.5056, test_loss: 1.1384, test_f1: 0.6313
 epoch: 69, train_loss: 0.5168, test_loss: 0.9328, test_f1: 0.6595
 epoch: 70, train_loss: 0.5176, test_loss: 1.0203, test_f1: 0.6766
 epoch: 71, train_loss: 0.5006, test_loss: 1.0818, test_f1: 0.6578
 epoch: 72, train_loss: 0.5043, test_loss: 1.1161, test_f1: 0.6523
 epoch: 73, train_loss: 0.5025, test_loss: 1.0755, test_f1: 0.6906
 epoch: 74, train_loss: 0.4899, test_loss: 0.8448, test_f1: 0.6962
 epoch: 75, train_loss: 0.4967, test_loss: 0.8502, test_f1: 0.6843
 epoch: 76, train_loss: 0.4823, test_loss: 0.8861, test_f1: 0.6546
 epoch: 77, train_loss: 0.5045, test_loss: 1.1874, test_f1: 0.6811
 epoch: 78, train_loss: 0.4748, test_loss: 0.9289, test_f1: 0.6734
 epoch: 79, train_loss: 0.4729, test_loss: 0.9351, test_f1: 0.6764
 epoch: 80, train_loss: 0.4868, test_loss: 0.8907, test_f1: 0.6600
 epoch: 81, train_loss: 0.4666, test_loss: 0.9891, test_f1: 0.6928
 epoch: 82, train_loss: 0.4515, test_loss: 0.9012, test_f1: 0.6604
 epoch: 83, train_loss: 0.4725, test_loss: 0.8849, test_f1: 0.6745
 epoch: 84, train_loss: 0.4572, test_loss: 0.9246, test_f1: 0.7049
 epoch: 85, train_loss: 0.4493, test_loss: 1.1438, test_f1: 0.6492
 epoch: 86, train_loss: 0.4325, test_loss: 1.1201, test_f1: 0.6714
 epoch: 87, train_loss: 0.4703, test_loss: 0.9577, test_f1: 0.6625
 epoch: 88, train_loss: 0.4498, test_loss: 1.1346, test_f1: 0.6638
 epoch: 89, train_loss: 0.4320, test_loss: 1.0467, test_f1: 0.6913
 epoch: 90, train_loss: 0.4464, test_loss: 1.0492, test_f1: 0.6617
 epoch: 91, train_loss: 0.4208, test_loss: 1.1741, test_f1: 0.6980
 epoch: 92, train_loss: 0.4263, test_loss: 1.1883, test_f1: 0.7164
 epoch: 93, train_loss: 0.4089, test_loss: 1.2192, test_f1: 0.6714
 epoch: 94, train_loss: 0.4246, test_loss: 1.1744, test_f1: 0.6886
 epoch: 95, train_loss: 0.4385, test_loss: 0.8918, test_f1: 0.6789
 epoch: 96, train_loss: 0.4237, test_loss: 1.3428, test_f1: 0.7049
 epoch: 97, train_loss: 0.4024, test_loss: 1.2548, test_f1: 0.6716
 epoch: 98, train_loss: 0.4194, test_loss: 1.1328, test_f1: 0.6827
 epoch: 99, train_loss: 0.4116, test_loss: 1.4088, test_f1: 0.7062
##################ITERATION #1 ****************************************
 epoch: 0, train_loss: 1.0811, test_loss: 0.9998, test_f1: 0.4853
 epoch: 1, train_loss: 0.9855, test_loss: 0.9622, test_f1: 0.4767
 epoch: 2, train_loss: 0.9679, test_loss: 0.9697, test_f1: 0.4548
 epoch: 3, train_loss: 0.9538, test_loss: 0.9533, test_f1: 0.5099
 epoch: 4, train_loss: 0.9199, test_loss: 0.9039, test_f1: 0.4818
 epoch: 5, train_loss: 0.9184, test_loss: 0.9602, test_f1: 0.4953
 epoch: 6, train_loss: 0.8971, test_loss: 0.9508, test_f1: 0.5210
 epoch: 7, train_loss: 0.8831, test_loss: 0.9051, test_f1: 0.5223
 epoch: 8, train_loss: 0.8730, test_loss: 1.2212, test_f1: 0.4398
 epoch: 9, train_loss: 0.8743, test_loss: 0.9171, test_f1: 0.5140
 epoch: 10, train_loss: 0.8778, test_loss: 0.8584, test_f1: 0.5474
 epoch: 11, train_loss: 0.8642, test_loss: 0.9515, test_f1: 0.5788
 epoch: 12, train_loss: 0.8528, test_loss: 2.8835, test_f1: 0.0749
 epoch: 13, train_loss: 0.8624, test_loss: 0.9100, test_f1: 0.5315
 epoch: 14, train_loss: 0.8182, test_loss: 0.8485, test_f1: 0.5648
 epoch: 15, train_loss: 0.8345, test_loss: 1.0564, test_f1: 0.5267
 epoch: 16, train_loss: 0.8153, test_loss: 0.9218, test_f1: 0.5113
 epoch: 17, train_loss: 0.8222, test_loss: 0.9045, test_f1: 0.5377
 epoch: 18, train_loss: 0.8027, test_loss: 0.8830, test_f1: 0.5573
 epoch: 19, train_loss: 0.7961, test_loss: 0.8694, test_f1: 0.5390
 epoch: 20, train_loss: 0.7854, test_loss: 0.8491, test_f1: 0.5587
 epoch: 21, train_loss: 0.7862, test_loss: 0.8451, test_f1: 0.6207
 epoch: 22, train_loss: 0.7530, test_loss: 0.8716, test_f1: 0.5524
 epoch: 23, train_loss: 0.7657, test_loss: 0.9571, test_f1: 0.5431
 epoch: 24, train_loss: 0.7491, test_loss: 0.8351, test_f1: 0.6331
 epoch: 25, train_loss: 0.7624, test_loss: 0.7901, test_f1: 0.5697
 epoch: 26, train_loss: 0.7405, test_loss: 0.7721, test_f1: 0.5544
 epoch: 27, train_loss: 0.7424, test_loss: 0.8539, test_f1: 0.6120
 epoch: 28, train_loss: 0.7247, test_loss: 0.7829, test_f1: 0.6223
 epoch: 29, train_loss: 0.7135, test_loss: 0.9915, test_f1: 0.6028
 epoch: 30, train_loss: 0.7568, test_loss: 0.8264, test_f1: 0.5832
 epoch: 31, train_loss: 0.7244, test_loss: 0.9048, test_f1: 0.6150
 epoch: 32, train_loss: 0.7004, test_loss: 0.8237, test_f1: 0.6388
 epoch: 33, train_loss: 0.7224, test_loss: 0.8762, test_f1: 0.5868
 epoch: 34, train_loss: 0.7041, test_loss: 0.9547, test_f1: 0.6006
 epoch: 35, train_loss: 0.7114, test_loss: 0.9625, test_f1: 0.6419
 epoch: 36, train_loss: 0.6897, test_loss: 0.8343, test_f1: 0.6292
 epoch: 37, train_loss: 0.6795, test_loss: 0.9035, test_f1: 0.6448
 epoch: 38, train_loss: 0.6903, test_loss: 0.8066, test_f1: 0.5805
 epoch: 39, train_loss: 0.6969, test_loss: 0.7606, test_f1: 0.5732
 epoch: 40, train_loss: 0.6700, test_loss: 0.9341, test_f1: 0.6362
 epoch: 41, train_loss: 0.6836, test_loss: 1.0099, test_f1: 0.6494
 epoch: 42, train_loss: 0.6897, test_loss: 0.7660, test_f1: 0.6242
 epoch: 43, train_loss: 0.6749, test_loss: 0.8343, test_f1: 0.6438
 epoch: 44, train_loss: 0.6566, test_loss: 0.7929, test_f1: 0.6499
 epoch: 45, train_loss: 0.6753, test_loss: 0.8244, test_f1: 0.6371
 epoch: 46, train_loss: 0.6515, test_loss: 1.0023, test_f1: 0.5952
 epoch: 47, train_loss: 0.6645, test_loss: 0.7862, test_f1: 0.6082
 epoch: 48, train_loss: 0.6548, test_loss: 0.7769, test_f1: 0.5992
 epoch: 49, train_loss: 0.6611, test_loss: 0.8226, test_f1: 0.6701
 epoch: 50, train_loss: 0.6275, test_loss: 1.0213, test_f1: 0.6736
 epoch: 51, train_loss: 0.6013, test_loss: 0.8194, test_f1: 0.6769
 epoch: 52, train_loss: 0.5555, test_loss: 0.7228, test_f1: 0.6739
 epoch: 53, train_loss: 0.5706, test_loss: 0.9394, test_f1: 0.7036
 epoch: 54, train_loss: 0.5656, test_loss: 0.8401, test_f1: 0.6680
 epoch: 55, train_loss: 0.5613, test_loss: 0.8799, test_f1: 0.6564
 epoch: 56, train_loss: 0.5571, test_loss: 0.8705, test_f1: 0.6657
 epoch: 57, train_loss: 0.5328, test_loss: 0.9941, test_f1: 0.6339
 epoch: 58, train_loss: 0.5907, test_loss: 0.7855, test_f1: 0.6385
 epoch: 59, train_loss: 0.5541, test_loss: 0.9378, test_f1: 0.6759
 epoch: 60, train_loss: 0.5391, test_loss: 0.7242, test_f1: 0.7086
 epoch: 61, train_loss: 0.5357, test_loss: 0.8141, test_f1: 0.6480
 epoch: 62, train_loss: 0.5265, test_loss: 0.8279, test_f1: 0.6652
 epoch: 63, train_loss: 0.5484, test_loss: 0.7305, test_f1: 0.6918
 epoch: 64, train_loss: 0.5444, test_loss: 0.7374, test_f1: 0.6776
 epoch: 65, train_loss: 0.5223, test_loss: 0.7089, test_f1: 0.6883
 epoch: 66, train_loss: 0.5079, test_loss: 0.8642, test_f1: 0.6990
 epoch: 67, train_loss: 0.5319, test_loss: 0.8226, test_f1: 0.6690
 epoch: 68, train_loss: 0.4982, test_loss: 0.8158, test_f1: 0.7151
 epoch: 69, train_loss: 0.5085, test_loss: 0.8532, test_f1: 0.6878
 epoch: 70, train_loss: 0.5070, test_loss: 1.1291, test_f1: 0.6660
 epoch: 71, train_loss: 0.4963, test_loss: 0.8999, test_f1: 0.6831
 epoch: 72, train_loss: 0.5212, test_loss: 0.8081, test_f1: 0.6697
 epoch: 73, train_loss: 0.4940, test_loss: 1.0626, test_f1: 0.6469
 epoch: 74, train_loss: 0.4847, test_loss: 1.1339, test_f1: 0.6769
 epoch: 75, train_loss: 0.4882, test_loss: 1.0017, test_f1: 0.6947
 epoch: 76, train_loss: 0.4752, test_loss: 0.9501, test_f1: 0.6599
 epoch: 77, train_loss: 0.4995, test_loss: 1.0749, test_f1: 0.6609
 epoch: 78, train_loss: 0.4729, test_loss: 0.9909, test_f1: 0.6861
 epoch: 79, train_loss: 0.4903, test_loss: 0.9062, test_f1: 0.6618
 epoch: 80, train_loss: 0.4790, test_loss: 0.9413, test_f1: 0.6915
 epoch: 81, train_loss: 0.4765, test_loss: 1.1587, test_f1: 0.6996
 epoch: 82, train_loss: 0.4610, test_loss: 1.1515, test_f1: 0.6718
 epoch: 83, train_loss: 0.4636, test_loss: 1.1037, test_f1: 0.6757
 epoch: 84, train_loss: 0.4636, test_loss: 1.3108, test_f1: 0.6642
 epoch: 85, train_loss: 0.4641, test_loss: 1.1478, test_f1: 0.6742
 epoch: 86, train_loss: 0.4569, test_loss: 1.2683, test_f1: 0.6878
 epoch: 87, train_loss: 0.4507, test_loss: 1.0468, test_f1: 0.6753
 epoch: 88, train_loss: 0.4503, test_loss: 1.1077, test_f1: 0.6505
 epoch: 89, train_loss: 0.4518, test_loss: 1.1067, test_f1: 0.6701
 epoch: 90, train_loss: 0.4396, test_loss: 1.1192, test_f1: 0.6627
 epoch: 91, train_loss: 0.4485, test_loss: 1.1364, test_f1: 0.6590
 epoch: 92, train_loss: 0.4376, test_loss: 1.1016, test_f1: 0.6446
 epoch: 93, train_loss: 0.4531, test_loss: 1.2171, test_f1: 0.6748
 epoch: 94, train_loss: 0.4462, test_loss: 1.1891, test_f1: 0.6726
 epoch: 95, train_loss: 0.4212, test_loss: 1.1236, test_f1: 0.6803
 epoch: 96, train_loss: 0.4189, test_loss: 1.2500, test_f1: 0.6843
 epoch: 97, train_loss: 0.4329, test_loss: 1.0449, test_f1: 0.6423
 epoch: 98, train_loss: 0.4207, test_loss: 1.1432, test_f1: 0.6665
 epoch: 99, train_loss: 0.4332, test_loss: 1.1211, test_f1: 0.6729
##################ITERATION #2 ****************************************
 epoch: 0, train_loss: 1.1027, test_loss: 1.2116, test_f1: 0.3679
 epoch: 1, train_loss: 0.9942, test_loss: 0.9321, test_f1: 0.5149
 epoch: 2, train_loss: 0.9562, test_loss: 0.9686, test_f1: 0.5067
 epoch: 3, train_loss: 0.9364, test_loss: 0.9597, test_f1: 0.5133
 epoch: 4, train_loss: 0.9089, test_loss: 0.9285, test_f1: 0.5194
 epoch: 5, train_loss: 0.9127, test_loss: 0.8613, test_f1: 0.5156
 epoch: 6, train_loss: 0.8901, test_loss: 0.9004, test_f1: 0.5268
 epoch: 7, train_loss: 0.8988, test_loss: 0.9010, test_f1: 0.5149
 epoch: 8, train_loss: 0.8784, test_loss: 0.8888, test_f1: 0.5286
 epoch: 9, train_loss: 0.8666, test_loss: 0.9617, test_f1: 0.4905
 epoch: 10, train_loss: 0.8560, test_loss: 0.8425, test_f1: 0.5273
 epoch: 11, train_loss: 0.8432, test_loss: 0.8308, test_f1: 0.6175
 epoch: 12, train_loss: 0.8446, test_loss: 0.9237, test_f1: 0.5007
 epoch: 13, train_loss: 0.8494, test_loss: 0.8302, test_f1: 0.5453
 epoch: 14, train_loss: 0.8270, test_loss: 0.9974, test_f1: 0.4667
 epoch: 15, train_loss: 0.8412, test_loss: 0.9831, test_f1: 0.5507
 epoch: 16, train_loss: 0.8264, test_loss: 0.8908, test_f1: 0.5500
 epoch: 17, train_loss: 0.8124, test_loss: 0.8567, test_f1: 0.5489
 epoch: 18, train_loss: 0.8359, test_loss: 0.8578, test_f1: 0.5961
 epoch: 19, train_loss: 0.8310, test_loss: 0.8608, test_f1: 0.5762
 epoch: 20, train_loss: 0.8254, test_loss: 0.8359, test_f1: 0.5877
 epoch: 21, train_loss: 0.7979, test_loss: 0.7720, test_f1: 0.6145
 epoch: 22, train_loss: 0.7948, test_loss: 0.9179, test_f1: 0.5768
 epoch: 23, train_loss: 0.7915, test_loss: 0.9281, test_f1: 0.5736
 epoch: 24, train_loss: 0.7748, test_loss: 0.9724, test_f1: 0.5775
 epoch: 25, train_loss: 0.7719, test_loss: 0.8386, test_f1: 0.5980
 epoch: 26, train_loss: 0.7707, test_loss: 0.9127, test_f1: 0.5483
 epoch: 27, train_loss: 0.7636, test_loss: 0.8892, test_f1: 0.5840
 epoch: 28, train_loss: 0.7835, test_loss: 0.9809, test_f1: 0.6244
 epoch: 29, train_loss: 0.7647, test_loss: 0.9161, test_f1: 0.5600
 epoch: 30, train_loss: 0.7605, test_loss: 0.8910, test_f1: 0.6035
 epoch: 31, train_loss: 0.7695, test_loss: 1.4692, test_f1: 0.4939
 epoch: 32, train_loss: 0.9097, test_loss: 1.0631, test_f1: 0.5339
 epoch: 33, train_loss: 0.8039, test_loss: 0.9554, test_f1: 0.5776
 epoch: 34, train_loss: 0.7750, test_loss: 0.9129, test_f1: 0.5475
 epoch: 35, train_loss: 0.7656, test_loss: 0.9752, test_f1: 0.5885
 epoch: 36, train_loss: 0.7619, test_loss: 1.2561, test_f1: 0.6201
 epoch: 37, train_loss: 0.7393, test_loss: 0.9170, test_f1: 0.6162
 epoch: 38, train_loss: 0.7367, test_loss: 0.8561, test_f1: 0.6398
 epoch: 39, train_loss: 0.7489, test_loss: 0.9058, test_f1: 0.5832
 epoch: 40, train_loss: 0.7211, test_loss: 0.9220, test_f1: 0.6182
 epoch: 41, train_loss: 0.7285, test_loss: 0.9739, test_f1: 0.6348
 epoch: 42, train_loss: 0.7639, test_loss: 0.9880, test_f1: 0.6371
 epoch: 43, train_loss: 0.7298, test_loss: 0.8668, test_f1: 0.6401
 epoch: 44, train_loss: 0.7248, test_loss: 0.8771, test_f1: 0.6196
 epoch: 45, train_loss: 0.7000, test_loss: 1.0741, test_f1: 0.6336
 epoch: 46, train_loss: 0.6961, test_loss: 0.9363, test_f1: 0.6354
 epoch: 47, train_loss: 0.6931, test_loss: 0.9408, test_f1: 0.6446
 epoch: 48, train_loss: 0.6950, test_loss: 0.9963, test_f1: 0.6303
 epoch: 49, train_loss: 0.6795, test_loss: 0.9072, test_f1: 0.6444
 epoch: 50, train_loss: 0.6939, test_loss: 0.9946, test_f1: 0.6109
 epoch: 51, train_loss: 0.6380, test_loss: 0.9739, test_f1: 0.6529
 epoch: 52, train_loss: 0.6157, test_loss: 0.9427, test_f1: 0.6576
 epoch: 53, train_loss: 0.6151, test_loss: 0.9736, test_f1: 0.6651
 epoch: 54, train_loss: 0.5982, test_loss: 1.0686, test_f1: 0.6565
 epoch: 55, train_loss: 0.5980, test_loss: 1.1368, test_f1: 0.6517
 epoch: 56, train_loss: 0.5938, test_loss: 1.0743, test_f1: 0.6260
 epoch: 57, train_loss: 0.5756, test_loss: 1.2299, test_f1: 0.6349
 epoch: 58, train_loss: 0.5848, test_loss: 1.2470, test_f1: 0.6615
 epoch: 59, train_loss: 0.5847, test_loss: 1.1269, test_f1: 0.6580
 epoch: 60, train_loss: 0.5743, test_loss: 1.1196, test_f1: 0.6383
 epoch: 61, train_loss: 0.5731, test_loss: 1.0585, test_f1: 0.6621
 epoch: 62, train_loss: 0.5536, test_loss: 1.1056, test_f1: 0.6454
 epoch: 63, train_loss: 0.5577, test_loss: 1.2848, test_f1: 0.6477
 epoch: 64, train_loss: 0.5594, test_loss: 1.0999, test_f1: 0.6642
 epoch: 65, train_loss: 0.5498, test_loss: 1.1349, test_f1: 0.6735
 epoch: 66, train_loss: 0.5468, test_loss: 1.0882, test_f1: 0.6772
 epoch: 67, train_loss: 0.5398, test_loss: 1.1346, test_f1: 0.6314
 epoch: 68, train_loss: 0.6016, test_loss: 0.9839, test_f1: 0.6796
 epoch: 69, train_loss: 0.5437, test_loss: 1.1448, test_f1: 0.6659
 epoch: 70, train_loss: 0.5308, test_loss: 1.1618, test_f1: 0.6734
 epoch: 71, train_loss: 0.5458, test_loss: 1.1756, test_f1: 0.6453
 epoch: 72, train_loss: 0.5221, test_loss: 1.1833, test_f1: 0.6642
 epoch: 73, train_loss: 0.5100, test_loss: 1.0711, test_f1: 0.7003
 epoch: 74, train_loss: 0.5333, test_loss: 1.0240, test_f1: 0.6976
 epoch: 75, train_loss: 0.5089, test_loss: 1.1131, test_f1: 0.6755
 epoch: 76, train_loss: 0.5400, test_loss: 1.0823, test_f1: 0.6545
 epoch: 77, train_loss: 0.5010, test_loss: 1.1664, test_f1: 0.6738
 epoch: 78, train_loss: 0.5080, test_loss: 1.0616, test_f1: 0.7003
 epoch: 79, train_loss: 0.5181, test_loss: 1.1739, test_f1: 0.6704
 epoch: 80, train_loss: 0.5026, test_loss: 1.0326, test_f1: 0.6600
 epoch: 81, train_loss: 0.5022, test_loss: 1.1528, test_f1: 0.6706
 epoch: 82, train_loss: 0.5101, test_loss: 1.1043, test_f1: 0.6802
 epoch: 83, train_loss: 0.5039, test_loss: 1.0926, test_f1: 0.6733
 epoch: 84, train_loss: 0.5128, test_loss: 1.0763, test_f1: 0.6542
 epoch: 85, train_loss: 0.4704, test_loss: 1.3512, test_f1: 0.6678
 epoch: 86, train_loss: 0.4683, test_loss: 1.0164, test_f1: 0.6910
 epoch: 87, train_loss: 0.4869, test_loss: 1.0982, test_f1: 0.6691
 epoch: 88, train_loss: 0.4576, test_loss: 1.2150, test_f1: 0.6791
 epoch: 89, train_loss: 0.4770, test_loss: 1.2866, test_f1: 0.6513
 epoch: 90, train_loss: 0.4943, test_loss: 1.1270, test_f1: 0.6662
 epoch: 91, train_loss: 0.4912, test_loss: 1.2137, test_f1: 0.6655
 epoch: 92, train_loss: 0.4767, test_loss: 1.3734, test_f1: 0.6689
 epoch: 93, train_loss: 0.4955, test_loss: 1.0710, test_f1: 0.6645
 epoch: 94, train_loss: 0.4518, test_loss: 1.1845, test_f1: 0.6738
 epoch: 95, train_loss: 0.4498, test_loss: 1.2385, test_f1: 0.6790
 epoch: 96, train_loss: 0.4488, test_loss: 1.1828, test_f1: 0.6702
 epoch: 97, train_loss: 0.4691, test_loss: 1.1544, test_f1: 0.6680
 epoch: 98, train_loss: 0.4452, test_loss: 1.2115, test_f1: 0.6648
 epoch: 99, train_loss: 0.4659, test_loss: 1.2527, test_f1: 0.6638
##################ITERATION #3 ****************************************
 epoch: 0, train_loss: 1.0856, test_loss: 1.0200, test_f1: 0.4223
 epoch: 1, train_loss: 0.9944, test_loss: 0.9723, test_f1: 0.4740
 epoch: 2, train_loss: 0.9534, test_loss: 0.9460, test_f1: 0.4764
 epoch: 3, train_loss: 0.9357, test_loss: 0.9554, test_f1: 0.4912
 epoch: 4, train_loss: 0.9141, test_loss: 0.9440, test_f1: 0.4957
 epoch: 5, train_loss: 0.9335, test_loss: 0.8789, test_f1: 0.4904
 epoch: 6, train_loss: 0.8945, test_loss: 0.8926, test_f1: 0.5193
 epoch: 7, train_loss: 0.8793, test_loss: 0.9955, test_f1: 0.5383
 epoch: 8, train_loss: 0.8738, test_loss: 0.9329, test_f1: 0.5164
 epoch: 9, train_loss: 0.8617, test_loss: 0.8991, test_f1: 0.5562
 epoch: 10, train_loss: 0.8390, test_loss: 0.8262, test_f1: 0.5446
 epoch: 11, train_loss: 0.8371, test_loss: 0.9163, test_f1: 0.5716
 epoch: 12, train_loss: 0.8172, test_loss: 0.8473, test_f1: 0.5951
 epoch: 13, train_loss: 0.8147, test_loss: 0.8416, test_f1: 0.5330
 epoch: 14, train_loss: 0.8098, test_loss: 0.8899, test_f1: 0.6136
 epoch: 15, train_loss: 0.8424, test_loss: 0.8120, test_f1: 0.6199
 epoch: 16, train_loss: 0.8287, test_loss: 0.8268, test_f1: 0.5985
 epoch: 17, train_loss: 0.8125, test_loss: 0.9182, test_f1: 0.5931
 epoch: 18, train_loss: 0.8044, test_loss: 0.9972, test_f1: 0.6117
 epoch: 19, train_loss: 0.8148, test_loss: 0.9139, test_f1: 0.6116
 epoch: 20, train_loss: 0.7739, test_loss: 0.8809, test_f1: 0.5987
 epoch: 21, train_loss: 0.7840, test_loss: 0.9194, test_f1: 0.5559
 epoch: 22, train_loss: 0.7642, test_loss: 0.8155, test_f1: 0.5998
 epoch: 23, train_loss: 0.7591, test_loss: 0.8171, test_f1: 0.6374
 epoch: 24, train_loss: 0.7620, test_loss: 0.8852, test_f1: 0.6192
 epoch: 25, train_loss: 0.7515, test_loss: 0.9624, test_f1: 0.5620
 epoch: 26, train_loss: 0.7596, test_loss: 0.8398, test_f1: 0.5998
 epoch: 27, train_loss: 0.7371, test_loss: 0.8878, test_f1: 0.6140
 epoch: 28, train_loss: 0.7123, test_loss: 0.8378, test_f1: 0.5999
 epoch: 29, train_loss: 0.7117, test_loss: 0.9350, test_f1: 0.6316
 epoch: 30, train_loss: 0.7358, test_loss: 0.8866, test_f1: 0.5822
 epoch: 31, train_loss: 0.7033, test_loss: 0.7718, test_f1: 0.5985
 epoch: 32, train_loss: 0.7064, test_loss: 0.8916, test_f1: 0.6493
 epoch: 33, train_loss: 0.7030, test_loss: 0.8109, test_f1: 0.6296
 epoch: 34, train_loss: 0.7022, test_loss: 0.9643, test_f1: 0.5882
 epoch: 35, train_loss: 0.6929, test_loss: 0.8354, test_f1: 0.6486
 epoch: 36, train_loss: 0.6961, test_loss: 0.9386, test_f1: 0.6406
 epoch: 37, train_loss: 0.6856, test_loss: 0.8654, test_f1: 0.6473
 epoch: 38, train_loss: 0.6678, test_loss: 0.9883, test_f1: 0.5966
 epoch: 39, train_loss: 0.6750, test_loss: 0.8821, test_f1: 0.6142
 epoch: 40, train_loss: 0.7044, test_loss: 0.9677, test_f1: 0.6290
 epoch: 41, train_loss: 0.7009, test_loss: 0.7463, test_f1: 0.6439
 epoch: 42, train_loss: 0.6541, test_loss: 1.0458, test_f1: 0.6501
 epoch: 43, train_loss: 0.6674, test_loss: 1.0379, test_f1: 0.6618
 epoch: 44, train_loss: 0.6547, test_loss: 1.0912, test_f1: 0.6421
 epoch: 45, train_loss: 0.6556, test_loss: 0.8192, test_f1: 0.6439
 epoch: 46, train_loss: 0.6388, test_loss: 0.8081, test_f1: 0.6280
 epoch: 47, train_loss: 0.6606, test_loss: 0.9021, test_f1: 0.6399
 epoch: 48, train_loss: 0.6391, test_loss: 0.9762, test_f1: 0.6436
 epoch: 49, train_loss: 0.6308, test_loss: 0.8113, test_f1: 0.6335
 epoch: 50, train_loss: 0.5960, test_loss: 0.9846, test_f1: 0.6531
 epoch: 51, train_loss: 0.5810, test_loss: 0.8903, test_f1: 0.6608
 epoch: 52, train_loss: 0.5761, test_loss: 0.8850, test_f1: 0.6403
 epoch: 53, train_loss: 0.5586, test_loss: 0.8500, test_f1: 0.6601
 epoch: 54, train_loss: 0.5555, test_loss: 0.8116, test_f1: 0.6483
 epoch: 55, train_loss: 0.5319, test_loss: 0.8988, test_f1: 0.6693
 epoch: 56, train_loss: 0.5230, test_loss: 0.9545, test_f1: 0.6422
 epoch: 57, train_loss: 0.5468, test_loss: 0.8046, test_f1: 0.6673
 epoch: 58, train_loss: 0.5353, test_loss: 0.7997, test_f1: 0.6677
 epoch: 59, train_loss: 0.5252, test_loss: 0.8591, test_f1: 0.6819
 epoch: 60, train_loss: 0.5159, test_loss: 0.7714, test_f1: 0.6839
 epoch: 61, train_loss: 0.5325, test_loss: 0.8894, test_f1: 0.6724
 epoch: 62, train_loss: 0.5273, test_loss: 0.9773, test_f1: 0.6870
 epoch: 63, train_loss: 0.5287, test_loss: 0.7445, test_f1: 0.6841
 epoch: 64, train_loss: 0.5063, test_loss: 0.7787, test_f1: 0.6525
 epoch: 65, train_loss: 0.5136, test_loss: 0.7481, test_f1: 0.6797
 epoch: 66, train_loss: 0.4908, test_loss: 0.8525, test_f1: 0.6657
 epoch: 67, train_loss: 0.5071, test_loss: 0.8825, test_f1: 0.6545
 epoch: 68, train_loss: 0.4841, test_loss: 0.8627, test_f1: 0.6751
 epoch: 69, train_loss: 0.4947, test_loss: 0.8542, test_f1: 0.6552
 epoch: 70, train_loss: 0.4913, test_loss: 0.8926, test_f1: 0.6580
 epoch: 71, train_loss: 0.4771, test_loss: 0.8799, test_f1: 0.6694
 epoch: 72, train_loss: 0.4683, test_loss: 0.8562, test_f1: 0.6785
 epoch: 73, train_loss: 0.4712, test_loss: 0.8610, test_f1: 0.6845
 epoch: 74, train_loss: 0.4872, test_loss: 0.8813, test_f1: 0.6557
 epoch: 75, train_loss: 0.4697, test_loss: 0.9090, test_f1: 0.6892
 epoch: 76, train_loss: 0.4690, test_loss: 0.8780, test_f1: 0.6700
 epoch: 77, train_loss: 0.4893, test_loss: 0.8424, test_f1: 0.6878
 epoch: 78, train_loss: 0.4449, test_loss: 0.8275, test_f1: 0.6875
 epoch: 79, train_loss: 0.4475, test_loss: 0.8763, test_f1: 0.6758
 epoch: 80, train_loss: 0.4370, test_loss: 0.7844, test_f1: 0.6835
 epoch: 81, train_loss: 0.4440, test_loss: 0.9297, test_f1: 0.6867
 epoch: 82, train_loss: 0.4479, test_loss: 0.8567, test_f1: 0.6716
 epoch: 83, train_loss: 0.4414, test_loss: 0.8798, test_f1: 0.6828
 epoch: 84, train_loss: 0.4588, test_loss: 0.8987, test_f1: 0.6791
 epoch: 85, train_loss: 0.4337, test_loss: 0.7915, test_f1: 0.7014
 epoch: 86, train_loss: 0.4758, test_loss: 0.8330, test_f1: 0.6631
 epoch: 87, train_loss: 0.4344, test_loss: 0.8206, test_f1: 0.6832
 epoch: 88, train_loss: 0.4146, test_loss: 0.8471, test_f1: 0.6802
 epoch: 89, train_loss: 0.4209, test_loss: 0.8299, test_f1: 0.6859
 epoch: 90, train_loss: 0.4086, test_loss: 0.8950, test_f1: 0.6899
 epoch: 91, train_loss: 0.4520, test_loss: 0.8212, test_f1: 0.6763
 epoch: 92, train_loss: 0.4180, test_loss: 0.9264, test_f1: 0.6754
 epoch: 93, train_loss: 0.4197, test_loss: 0.9374, test_f1: 0.6812
 epoch: 94, train_loss: 0.4102, test_loss: 0.9067, test_f1: 0.6829
 epoch: 95, train_loss: 0.4233, test_loss: 0.8631, test_f1: 0.6819
 epoch: 96, train_loss: 0.3945, test_loss: 0.9914, test_f1: 0.6651
 epoch: 97, train_loss: 0.4104, test_loss: 0.8386, test_f1: 0.6831
 epoch: 98, train_loss: 0.3908, test_loss: 0.8731, test_f1: 0.7011
 epoch: 99, train_loss: 0.3928, test_loss: 0.8832, test_f1: 0.7020
##################ITERATION #4 ****************************************
 epoch: 0, train_loss: 1.0787, test_loss: 1.0476, test_f1: 0.4324
 epoch: 1, train_loss: 0.9846, test_loss: 0.9430, test_f1: 0.4951
 epoch: 2, train_loss: 0.9322, test_loss: 0.9371, test_f1: 0.5219
 epoch: 3, train_loss: 0.9255, test_loss: 0.9047, test_f1: 0.5093
 epoch: 4, train_loss: 0.9155, test_loss: 0.9378, test_f1: 0.5072
 epoch: 5, train_loss: 0.8913, test_loss: 0.9401, test_f1: 0.5093
 epoch: 6, train_loss: 0.8832, test_loss: 0.8726, test_f1: 0.5627
 epoch: 7, train_loss: 0.9031, test_loss: 0.9541, test_f1: 0.5503
 epoch: 8, train_loss: 0.8819, test_loss: 0.8987, test_f1: 0.5472
 epoch: 9, train_loss: 0.8897, test_loss: 0.8678, test_f1: 0.5797
 epoch: 10, train_loss: 0.8647, test_loss: 0.8986, test_f1: 0.5324
 epoch: 11, train_loss: 0.8723, test_loss: 0.8233, test_f1: 0.5569
 epoch: 12, train_loss: 0.8493, test_loss: 0.9530, test_f1: 0.4878
 epoch: 13, train_loss: 0.8255, test_loss: 0.8415, test_f1: 0.5846
 epoch: 14, train_loss: 0.8553, test_loss: 0.9907, test_f1: 0.4923
 epoch: 15, train_loss: 0.8521, test_loss: 0.8541, test_f1: 0.5586
 epoch: 16, train_loss: 0.8345, test_loss: 0.8807, test_f1: 0.5360
 epoch: 17, train_loss: 0.8336, test_loss: 0.8731, test_f1: 0.6026
 epoch: 18, train_loss: 0.8287, test_loss: 0.9179, test_f1: 0.5689
 epoch: 19, train_loss: 0.8038, test_loss: 0.8690, test_f1: 0.5806
 epoch: 20, train_loss: 0.7906, test_loss: 0.8092, test_f1: 0.6193
 epoch: 21, train_loss: 0.7990, test_loss: 0.7917, test_f1: 0.6149
 epoch: 22, train_loss: 0.7861, test_loss: 0.9403, test_f1: 0.5643
 epoch: 23, train_loss: 0.7689, test_loss: 0.7722, test_f1: 0.6226
 epoch: 24, train_loss: 0.7666, test_loss: 0.8578, test_f1: 0.6265
 epoch: 25, train_loss: 0.7727, test_loss: 1.0088, test_f1: 0.5832
 epoch: 26, train_loss: 0.7608, test_loss: 0.7718, test_f1: 0.6612
 epoch: 27, train_loss: 0.7865, test_loss: 0.8719, test_f1: 0.5893
 epoch: 28, train_loss: 0.7476, test_loss: 0.9125, test_f1: 0.5861
 epoch: 29, train_loss: 0.7634, test_loss: 0.8138, test_f1: 0.6559
 epoch: 30, train_loss: 0.7455, test_loss: 0.8498, test_f1: 0.5854
 epoch: 31, train_loss: 0.7374, test_loss: 0.7178, test_f1: 0.6356
 epoch: 32, train_loss: 0.7282, test_loss: 0.7861, test_f1: 0.6328
 epoch: 33, train_loss: 0.7206, test_loss: 0.7533, test_f1: 0.6397
 epoch: 34, train_loss: 0.7347, test_loss: 0.8533, test_f1: 0.6097
 epoch: 35, train_loss: 0.7475, test_loss: 0.7683, test_f1: 0.6298
 epoch: 36, train_loss: 0.7424, test_loss: 0.8441, test_f1: 0.6241
 epoch: 37, train_loss: 0.7222, test_loss: 0.8412, test_f1: 0.6270
 epoch: 38, train_loss: 0.7187, test_loss: 0.9561, test_f1: 0.6078
 epoch: 39, train_loss: 0.7051, test_loss: 0.8509, test_f1: 0.6244
 epoch: 40, train_loss: 0.6987, test_loss: 0.7306, test_f1: 0.6743
 epoch: 41, train_loss: 0.6875, test_loss: 0.7260, test_f1: 0.6753
 epoch: 42, train_loss: 0.6660, test_loss: 0.7534, test_f1: 0.6063
 epoch: 43, train_loss: 0.6725, test_loss: 0.7906, test_f1: 0.6296
 epoch: 44, train_loss: 0.6909, test_loss: 0.9341, test_f1: 0.5661
 epoch: 45, train_loss: 0.6970, test_loss: 0.8683, test_f1: 0.6118
 epoch: 46, train_loss: 0.6976, test_loss: 0.7698, test_f1: 0.6318
 epoch: 47, train_loss: 0.6631, test_loss: 0.7266, test_f1: 0.6444
 epoch: 48, train_loss: 0.6687, test_loss: 0.7569, test_f1: 0.6471
 epoch: 49, train_loss: 0.6702, test_loss: 0.8339, test_f1: 0.6314
 epoch: 50, train_loss: 0.6603, test_loss: 0.7983, test_f1: 0.6476
 epoch: 51, train_loss: 0.6171, test_loss: 0.8018, test_f1: 0.6899
 epoch: 52, train_loss: 0.5858, test_loss: 0.7530, test_f1: 0.6500
 epoch: 53, train_loss: 0.5834, test_loss: 0.8205, test_f1: 0.6275
 epoch: 54, train_loss: 0.5993, test_loss: 0.8808, test_f1: 0.6733
 epoch: 55, train_loss: 0.5660, test_loss: 0.8954, test_f1: 0.6548
 epoch: 56, train_loss: 0.5698, test_loss: 0.8653, test_f1: 0.6713
 epoch: 57, train_loss: 0.5698, test_loss: 0.9243, test_f1: 0.6375
 epoch: 58, train_loss: 0.5472, test_loss: 0.9694, test_f1: 0.6782
 epoch: 59, train_loss: 0.5538, test_loss: 0.9373, test_f1: 0.6431
 epoch: 60, train_loss: 0.5500, test_loss: 0.8758, test_f1: 0.6566
 epoch: 61, train_loss: 0.5413, test_loss: 0.8944, test_f1: 0.6717
 epoch: 62, train_loss: 0.5566, test_loss: 0.8161, test_f1: 0.6619
 epoch: 63, train_loss: 0.5390, test_loss: 0.7871, test_f1: 0.6600
 epoch: 64, train_loss: 0.5293, test_loss: 0.9109, test_f1: 0.6506
 epoch: 65, train_loss: 0.5282, test_loss: 0.9438, test_f1: 0.6628
 epoch: 66, train_loss: 0.5165, test_loss: 0.9274, test_f1: 0.6383
 epoch: 67, train_loss: 0.4994, test_loss: 0.9278, test_f1: 0.6901
 epoch: 68, train_loss: 0.5122, test_loss: 0.9789, test_f1: 0.6522
 epoch: 69, train_loss: 0.5082, test_loss: 0.9368, test_f1: 0.6614
 epoch: 70, train_loss: 0.4995, test_loss: 0.8030, test_f1: 0.6594
 epoch: 71, train_loss: 0.4858, test_loss: 0.8812, test_f1: 0.6582
 epoch: 72, train_loss: 0.4965, test_loss: 0.8694, test_f1: 0.6758
 epoch: 73, train_loss: 0.4835, test_loss: 0.9367, test_f1: 0.6792
 epoch: 74, train_loss: 0.5081, test_loss: 0.9163, test_f1: 0.6923
 epoch: 75, train_loss: 0.4811, test_loss: 0.9633, test_f1: 0.6807
 epoch: 76, train_loss: 0.4996, test_loss: 0.9554, test_f1: 0.6901
 epoch: 77, train_loss: 0.4770, test_loss: 0.9907, test_f1: 0.7132
 epoch: 78, train_loss: 0.4609, test_loss: 0.9365, test_f1: 0.6867
 epoch: 79, train_loss: 0.4866, test_loss: 0.8833, test_f1: 0.6781
 epoch: 80, train_loss: 0.4763, test_loss: 0.9234, test_f1: 0.6693
 epoch: 81, train_loss: 0.4694, test_loss: 0.9348, test_f1: 0.6745
 epoch: 82, train_loss: 0.4657, test_loss: 0.8428, test_f1: 0.7082
 epoch: 83, train_loss: 0.4627, test_loss: 0.8977, test_f1: 0.6942
 epoch: 84, train_loss: 0.4668, test_loss: 0.8345, test_f1: 0.6930
 epoch: 85, train_loss: 0.4509, test_loss: 0.8755, test_f1: 0.6739
 epoch: 86, train_loss: 0.4973, test_loss: 0.9065, test_f1: 0.6715
 epoch: 87, train_loss: 0.4666, test_loss: 0.9001, test_f1: 0.6804
 epoch: 88, train_loss: 0.4393, test_loss: 0.8543, test_f1: 0.6488
 epoch: 89, train_loss: 0.4486, test_loss: 0.8621, test_f1: 0.6706
 epoch: 90, train_loss: 0.4412, test_loss: 0.8606, test_f1: 0.6818
 epoch: 91, train_loss: 0.4466, test_loss: 0.9107, test_f1: 0.6715
 epoch: 92, train_loss: 0.4348, test_loss: 1.0182, test_f1: 0.6888
 epoch: 93, train_loss: 0.4327, test_loss: 0.8913, test_f1: 0.6647
 epoch: 94, train_loss: 0.4319, test_loss: 0.8164, test_f1: 0.6817
 epoch: 95, train_loss: 0.4591, test_loss: 0.8959, test_f1: 0.6765
 epoch: 96, train_loss: 0.4303, test_loss: 0.8490, test_f1: 0.6604
 epoch: 97, train_loss: 0.4311, test_loss: 1.0000, test_f1: 0.6732
 epoch: 98, train_loss: 0.4183, test_loss: 0.9190, test_f1: 0.6827
 epoch: 99, train_loss: 0.4245, test_loss: 0.8300, test_f1: 0.6796
##################ITERATION #5 ****************************************
 epoch: 0, train_loss: 1.1210, test_loss: 1.1179, test_f1: 0.4547
 epoch: 1, train_loss: 1.0056, test_loss: 1.0237, test_f1: 0.4587
 epoch: 2, train_loss: 0.9775, test_loss: 0.9643, test_f1: 0.5133
 epoch: 3, train_loss: 0.9537, test_loss: 0.9963, test_f1: 0.5108
 epoch: 4, train_loss: 0.9591, test_loss: 0.9438, test_f1: 0.4985
 epoch: 5, train_loss: 0.9435, test_loss: 0.9100, test_f1: 0.5139
 epoch: 6, train_loss: 0.9189, test_loss: 0.8673, test_f1: 0.5334
 epoch: 7, train_loss: 0.9207, test_loss: 0.9846, test_f1: 0.4665
 epoch: 8, train_loss: 0.9063, test_loss: 0.8991, test_f1: 0.5513
 epoch: 9, train_loss: 0.8819, test_loss: 0.8957, test_f1: 0.5657
 epoch: 10, train_loss: 0.8794, test_loss: 0.9271, test_f1: 0.5470
 epoch: 11, train_loss: 0.8556, test_loss: 0.8681, test_f1: 0.5245
 epoch: 12, train_loss: 0.8390, test_loss: 0.8401, test_f1: 0.5818
 epoch: 13, train_loss: 0.8604, test_loss: 0.8695, test_f1: 0.5480
 epoch: 14, train_loss: 0.8407, test_loss: 0.8288, test_f1: 0.5996
 epoch: 15, train_loss: 0.8367, test_loss: 0.8462, test_f1: 0.5409
 epoch: 16, train_loss: 0.8518, test_loss: 0.9187, test_f1: 0.5870
 epoch: 17, train_loss: 0.8257, test_loss: 0.8874, test_f1: 0.5577
 epoch: 18, train_loss: 0.8189, test_loss: 0.8743, test_f1: 0.5963
 epoch: 19, train_loss: 0.8081, test_loss: 0.8159, test_f1: 0.6480
 epoch: 20, train_loss: 0.8060, test_loss: 0.8542, test_f1: 0.5506
 epoch: 21, train_loss: 0.7922, test_loss: 0.8579, test_f1: 0.6013
 epoch: 22, train_loss: 0.7792, test_loss: 1.0368, test_f1: 0.5752
 epoch: 23, train_loss: 0.8144, test_loss: 0.7805, test_f1: 0.6036
 epoch: 24, train_loss: 0.7929, test_loss: 0.7959, test_f1: 0.6259
 epoch: 25, train_loss: 0.7599, test_loss: 0.8457, test_f1: 0.6217
 epoch: 26, train_loss: 0.7913, test_loss: 0.8923, test_f1: 0.5575
 epoch: 27, train_loss: 0.7798, test_loss: 0.8197, test_f1: 0.5939
 epoch: 28, train_loss: 0.7869, test_loss: 0.8231, test_f1: 0.6232
 epoch: 29, train_loss: 0.7936, test_loss: 0.7736, test_f1: 0.6412
 epoch: 30, train_loss: 0.7634, test_loss: 0.8674, test_f1: 0.6198
 epoch: 31, train_loss: 0.7577, test_loss: 0.9824, test_f1: 0.5891
 epoch: 32, train_loss: 0.7364, test_loss: 0.8255, test_f1: 0.6216
 epoch: 33, train_loss: 0.7294, test_loss: 1.0026, test_f1: 0.6175
 epoch: 34, train_loss: 0.7357, test_loss: 0.9147, test_f1: 0.5827
 epoch: 35, train_loss: 0.7265, test_loss: 1.0576, test_f1: 0.6346
 epoch: 36, train_loss: 0.7618, test_loss: 0.9915, test_f1: 0.5677
 epoch: 37, train_loss: 0.7152, test_loss: 0.8573, test_f1: 0.6111
 epoch: 38, train_loss: 0.6980, test_loss: 1.1877, test_f1: 0.5506
 epoch: 39, train_loss: 0.7158, test_loss: 0.8414, test_f1: 0.6548
 epoch: 40, train_loss: 0.7014, test_loss: 1.0174, test_f1: 0.6313
 epoch: 41, train_loss: 0.7078, test_loss: 0.8373, test_f1: 0.6586
 epoch: 42, train_loss: 0.6625, test_loss: 0.9694, test_f1: 0.6624
 epoch: 43, train_loss: 0.7083, test_loss: 0.7818, test_f1: 0.6430
 epoch: 44, train_loss: 0.7002, test_loss: 0.9868, test_f1: 0.6349
 epoch: 45, train_loss: 0.6596, test_loss: 0.9211, test_f1: 0.6213
 epoch: 46, train_loss: 0.6815, test_loss: 0.9393, test_f1: 0.6323
 epoch: 47, train_loss: 0.6439, test_loss: 0.9216, test_f1: 0.6668
 epoch: 48, train_loss: 0.6670, test_loss: 0.8864, test_f1: 0.6533
 epoch: 49, train_loss: 0.6423, test_loss: 0.8592, test_f1: 0.6998
 epoch: 50, train_loss: 0.6268, test_loss: 0.9661, test_f1: 0.6508
 epoch: 51, train_loss: 0.6005, test_loss: 0.8559, test_f1: 0.6672
 epoch: 52, train_loss: 0.5738, test_loss: 0.8634, test_f1: 0.6914
 epoch: 53, train_loss: 0.5641, test_loss: 0.9339, test_f1: 0.6776
 epoch: 54, train_loss: 0.5595, test_loss: 0.9005, test_f1: 0.6805
 epoch: 55, train_loss: 0.5638, test_loss: 0.9030, test_f1: 0.6627
 epoch: 56, train_loss: 0.5654, test_loss: 0.8123, test_f1: 0.6912
 epoch: 57, train_loss: 0.5348, test_loss: 0.9405, test_f1: 0.7037
 epoch: 58, train_loss: 0.5462, test_loss: 0.8772, test_f1: 0.6931
 epoch: 59, train_loss: 0.5411, test_loss: 0.9296, test_f1: 0.6793
 epoch: 60, train_loss: 0.5314, test_loss: 0.8572, test_f1: 0.7012
 epoch: 61, train_loss: 0.5372, test_loss: 1.1088, test_f1: 0.6951
 epoch: 62, train_loss: 0.5169, test_loss: 0.9940, test_f1: 0.6711
 epoch: 63, train_loss: 0.5293, test_loss: 0.7451, test_f1: 0.6661
 epoch: 64, train_loss: 0.5487, test_loss: 0.8598, test_f1: 0.7221
 epoch: 65, train_loss: 0.5248, test_loss: 0.8359, test_f1: 0.6777
 epoch: 66, train_loss: 0.4988, test_loss: 1.1419, test_f1: 0.6696
 epoch: 67, train_loss: 0.5099, test_loss: 0.8964, test_f1: 0.6902
 epoch: 68, train_loss: 0.5052, test_loss: 0.9572, test_f1: 0.6718
 epoch: 69, train_loss: 0.5063, test_loss: 1.0510, test_f1: 0.6697
 epoch: 70, train_loss: 0.5206, test_loss: 1.0206, test_f1: 0.7033
 epoch: 71, train_loss: 0.4857, test_loss: 0.8563, test_f1: 0.6854
 epoch: 72, train_loss: 0.5093, test_loss: 0.9561, test_f1: 0.7004
 epoch: 73, train_loss: 0.4744, test_loss: 0.8801, test_f1: 0.6869
 epoch: 74, train_loss: 0.4866, test_loss: 0.9930, test_f1: 0.6714
 epoch: 75, train_loss: 0.4859, test_loss: 0.8683, test_f1: 0.6480
 epoch: 76, train_loss: 0.5253, test_loss: 1.0653, test_f1: 0.6978
 epoch: 77, train_loss: 0.4742, test_loss: 1.2451, test_f1: 0.6240
 epoch: 78, train_loss: 0.4756, test_loss: 1.0746, test_f1: 0.6850
 epoch: 79, train_loss: 0.4780, test_loss: 1.0351, test_f1: 0.6776
 epoch: 80, train_loss: 0.4814, test_loss: 0.9481, test_f1: 0.6867
 epoch: 81, train_loss: 0.4669, test_loss: 0.9736, test_f1: 0.6791
 epoch: 82, train_loss: 0.4637, test_loss: 1.1111, test_f1: 0.6911
 epoch: 83, train_loss: 0.4527, test_loss: 0.9438, test_f1: 0.6594
 epoch: 84, train_loss: 0.4685, test_loss: 0.9822, test_f1: 0.6773
 epoch: 85, train_loss: 0.4504, test_loss: 0.8784, test_f1: 0.6710
 epoch: 86, train_loss: 0.4627, test_loss: 1.1281, test_f1: 0.6827
 epoch: 87, train_loss: 0.4486, test_loss: 1.0401, test_f1: 0.6857
 epoch: 88, train_loss: 0.4431, test_loss: 1.0274, test_f1: 0.6987
 epoch: 89, train_loss: 0.4772, test_loss: 0.8908, test_f1: 0.6775
 epoch: 90, train_loss: 0.4498, test_loss: 0.9522, test_f1: 0.6901
 epoch: 91, train_loss: 0.4615, test_loss: 0.7618, test_f1: 0.6678
 epoch: 92, train_loss: 0.4413, test_loss: 0.9524, test_f1: 0.6621
 epoch: 93, train_loss: 0.4402, test_loss: 0.7548, test_f1: 0.6789
 epoch: 94, train_loss: 0.4290, test_loss: 0.9987, test_f1: 0.6739
 epoch: 95, train_loss: 0.4342, test_loss: 0.7977, test_f1: 0.6826
 epoch: 96, train_loss: 0.4281, test_loss: 0.9732, test_f1: 0.6788
 epoch: 97, train_loss: 0.4247, test_loss: 0.8510, test_f1: 0.7028
 epoch: 98, train_loss: 0.4379, test_loss: 0.8285, test_f1: 0.6728
 epoch: 99, train_loss: 0.4224, test_loss: 1.0041, test_f1: 0.6957
##################ITERATION #6 ****************************************
 epoch: 0, train_loss: 1.1163, test_loss: 1.0576, test_f1: 0.4119
 epoch: 1, train_loss: 0.9680, test_loss: 1.0382, test_f1: 0.4533
 epoch: 2, train_loss: 0.9456, test_loss: 0.9264, test_f1: 0.4996
 epoch: 3, train_loss: 0.9223, test_loss: 1.0658, test_f1: 0.4766
 epoch: 4, train_loss: 0.9132, test_loss: 0.9105, test_f1: 0.5442
 epoch: 5, train_loss: 0.9011, test_loss: 0.8701, test_f1: 0.4999
 epoch: 6, train_loss: 0.8869, test_loss: 0.8451, test_f1: 0.5389
 epoch: 7, train_loss: 0.8770, test_loss: 0.9034, test_f1: 0.5314
 epoch: 8, train_loss: 0.8739, test_loss: 0.8535, test_f1: 0.5282
 epoch: 9, train_loss: 0.8569, test_loss: 0.9416, test_f1: 0.5261
 epoch: 10, train_loss: 0.8500, test_loss: 0.9585, test_f1: 0.5677
 epoch: 11, train_loss: 0.8389, test_loss: 0.8534, test_f1: 0.5998
 epoch: 12, train_loss: 0.8375, test_loss: 1.0502, test_f1: 0.5627
 epoch: 13, train_loss: 0.8474, test_loss: 0.9390, test_f1: 0.5347
 epoch: 14, train_loss: 0.8376, test_loss: 0.8118, test_f1: 0.5944
 epoch: 15, train_loss: 0.8179, test_loss: 0.9958, test_f1: 0.5329
 epoch: 16, train_loss: 0.8084, test_loss: 1.0673, test_f1: 0.5373
 epoch: 17, train_loss: 0.8014, test_loss: 0.8848, test_f1: 0.5640
 epoch: 18, train_loss: 0.8232, test_loss: 0.9490, test_f1: 0.6073
 epoch: 19, train_loss: 0.7790, test_loss: 0.8949, test_f1: 0.6135
 epoch: 20, train_loss: 0.7773, test_loss: 0.9471, test_f1: 0.6169
 epoch: 21, train_loss: 0.7750, test_loss: 1.0228, test_f1: 0.5738
 epoch: 22, train_loss: 0.7716, test_loss: 0.9041, test_f1: 0.5859
 epoch: 23, train_loss: 0.7680, test_loss: 0.8626, test_f1: 0.5950
 epoch: 24, train_loss: 0.7530, test_loss: 0.9053, test_f1: 0.5563
 epoch: 25, train_loss: 0.7301, test_loss: 0.8763, test_f1: 0.5713
 epoch: 26, train_loss: 0.7631, test_loss: 0.8101, test_f1: 0.6068
 epoch: 27, train_loss: 0.7653, test_loss: 0.8866, test_f1: 0.5790
 epoch: 28, train_loss: 0.7427, test_loss: 0.9266, test_f1: 0.6341
 epoch: 29, train_loss: 0.7434, test_loss: 0.9913, test_f1: 0.5852
 epoch: 30, train_loss: 0.7375, test_loss: 0.8434, test_f1: 0.6457
 epoch: 31, train_loss: 0.7336, test_loss: 0.8007, test_f1: 0.6154
 epoch: 32, train_loss: 0.6970, test_loss: 1.1848, test_f1: 0.5731
 epoch: 33, train_loss: 0.7137, test_loss: 0.9933, test_f1: 0.6360
 epoch: 34, train_loss: 0.7092, test_loss: 0.9103, test_f1: 0.6046
 epoch: 35, train_loss: 0.6851, test_loss: 1.0789, test_f1: 0.6132
 epoch: 36, train_loss: 0.6844, test_loss: 1.0081, test_f1: 0.6144
 epoch: 37, train_loss: 0.6984, test_loss: 0.8682, test_f1: 0.6446
 epoch: 38, train_loss: 0.6842, test_loss: 0.9274, test_f1: 0.6089
 epoch: 39, train_loss: 0.6667, test_loss: 1.0125, test_f1: 0.6233
 epoch: 40, train_loss: 0.7107, test_loss: 1.0165, test_f1: 0.6194
 epoch: 41, train_loss: 0.6744, test_loss: 0.8785, test_f1: 0.6261
 epoch: 42, train_loss: 0.6804, test_loss: 0.9475, test_f1: 0.6043
 epoch: 43, train_loss: 0.6608, test_loss: 0.8743, test_f1: 0.6539
 epoch: 44, train_loss: 0.6709, test_loss: 0.8422, test_f1: 0.6185
 epoch: 45, train_loss: 0.6564, test_loss: 0.8701, test_f1: 0.6597
 epoch: 46, train_loss: 0.6330, test_loss: 0.9919, test_f1: 0.6240
 epoch: 47, train_loss: 0.6626, test_loss: 0.8812, test_f1: 0.6398
 epoch: 48, train_loss: 0.6299, test_loss: 0.8794, test_f1: 0.6405
 epoch: 49, train_loss: 0.6185, test_loss: 0.9559, test_f1: 0.6517
 epoch: 50, train_loss: 0.6320, test_loss: 0.8366, test_f1: 0.6230
 epoch: 51, train_loss: 0.5708, test_loss: 0.9479, test_f1: 0.6890
 epoch: 52, train_loss: 0.5628, test_loss: 0.9005, test_f1: 0.6769
 epoch: 53, train_loss: 0.5268, test_loss: 0.9560, test_f1: 0.6753
 epoch: 54, train_loss: 0.5390, test_loss: 0.8696, test_f1: 0.6648
 epoch: 55, train_loss: 0.5312, test_loss: 0.9558, test_f1: 0.6879
 epoch: 56, train_loss: 0.5332, test_loss: 0.9405, test_f1: 0.6802
 epoch: 57, train_loss: 0.5236, test_loss: 0.8521, test_f1: 0.6718
 epoch: 58, train_loss: 0.5072, test_loss: 1.0518, test_f1: 0.6675
 epoch: 59, train_loss: 0.5274, test_loss: 0.9646, test_f1: 0.6672
 epoch: 60, train_loss: 0.5208, test_loss: 0.9199, test_f1: 0.6853
 epoch: 61, train_loss: 0.5047, test_loss: 0.8988, test_f1: 0.6880
 epoch: 62, train_loss: 0.5141, test_loss: 1.0232, test_f1: 0.6844
 epoch: 63, train_loss: 0.4921, test_loss: 0.9434, test_f1: 0.6744
 epoch: 64, train_loss: 0.5090, test_loss: 1.0010, test_f1: 0.6838
 epoch: 65, train_loss: 0.4927, test_loss: 0.8710, test_f1: 0.6858
 epoch: 66, train_loss: 0.4750, test_loss: 0.9608, test_f1: 0.6832
 epoch: 67, train_loss: 0.4801, test_loss: 0.9626, test_f1: 0.6683
 epoch: 68, train_loss: 0.4893, test_loss: 0.8889, test_f1: 0.6620
 epoch: 69, train_loss: 0.4934, test_loss: 0.9324, test_f1: 0.6851
 epoch: 70, train_loss: 0.4722, test_loss: 0.8818, test_f1: 0.6774
 epoch: 71, train_loss: 0.4854, test_loss: 0.9396, test_f1: 0.6945
 epoch: 72, train_loss: 0.4812, test_loss: 0.9007, test_f1: 0.6832
 epoch: 73, train_loss: 0.4763, test_loss: 0.9116, test_f1: 0.6744
 epoch: 74, train_loss: 0.4744, test_loss: 0.8416, test_f1: 0.6816
 epoch: 75, train_loss: 0.4777, test_loss: 1.0529, test_f1: 0.6728
 epoch: 76, train_loss: 0.4740, test_loss: 1.0405, test_f1: 0.6645
 epoch: 77, train_loss: 0.4586, test_loss: 1.0828, test_f1: 0.6583
 epoch: 78, train_loss: 0.4768, test_loss: 0.9981, test_f1: 0.6688
 epoch: 79, train_loss: 0.4640, test_loss: 1.0222, test_f1: 0.6831
 epoch: 80, train_loss: 0.4502, test_loss: 1.0657, test_f1: 0.6661
 epoch: 81, train_loss: 0.4295, test_loss: 0.9005, test_f1: 0.6876
 epoch: 82, train_loss: 0.4497, test_loss: 0.9418, test_f1: 0.6899
 epoch: 83, train_loss: 0.4416, test_loss: 0.9568, test_f1: 0.6966
 epoch: 84, train_loss: 0.4346, test_loss: 0.8771, test_f1: 0.6669
 epoch: 85, train_loss: 0.4479, test_loss: 0.9466, test_f1: 0.7008
 epoch: 86, train_loss: 0.4377, test_loss: 1.0832, test_f1: 0.6816
 epoch: 87, train_loss: 0.4456, test_loss: 0.9452, test_f1: 0.6570
 epoch: 88, train_loss: 0.4230, test_loss: 1.0370, test_f1: 0.6564
 epoch: 89, train_loss: 0.4503, test_loss: 0.9580, test_f1: 0.6960
 epoch: 90, train_loss: 0.4344, test_loss: 1.0324, test_f1: 0.6848
 epoch: 91, train_loss: 0.4228, test_loss: 1.1740, test_f1: 0.6855
 epoch: 92, train_loss: 0.4318, test_loss: 1.0130, test_f1: 0.6729
 epoch: 93, train_loss: 0.4070, test_loss: 0.9198, test_f1: 0.6698
 epoch: 94, train_loss: 0.4161, test_loss: 1.1704, test_f1: 0.6837
 epoch: 95, train_loss: 0.4318, test_loss: 1.2814, test_f1: 0.6658
 epoch: 96, train_loss: 0.4200, test_loss: 1.1289, test_f1: 0.6686
 epoch: 97, train_loss: 0.4081, test_loss: 1.1135, test_f1: 0.6797
 epoch: 98, train_loss: 0.4206, test_loss: 1.0920, test_f1: 0.6691
 epoch: 99, train_loss: 0.4431, test_loss: 1.2525, test_f1: 0.7005
##################ITERATION #7 ****************************************
 epoch: 0, train_loss: 1.1278, test_loss: 1.1259, test_f1: 0.3917
 epoch: 1, train_loss: 1.0160, test_loss: 0.9725, test_f1: 0.4919
 epoch: 2, train_loss: 1.0154, test_loss: 1.0534, test_f1: 0.4887
 epoch: 3, train_loss: 0.9729, test_loss: 1.0024, test_f1: 0.4881
 epoch: 4, train_loss: 0.9340, test_loss: 1.0282, test_f1: 0.4897
 epoch: 5, train_loss: 0.9258, test_loss: 0.8729, test_f1: 0.5583
 epoch: 6, train_loss: 0.9434, test_loss: 0.9715, test_f1: 0.5230
 epoch: 7, train_loss: 0.9001, test_loss: 0.8883, test_f1: 0.5286
 epoch: 8, train_loss: 0.8909, test_loss: 1.0074, test_f1: 0.5199
 epoch: 9, train_loss: 0.8620, test_loss: 0.9376, test_f1: 0.5432
 epoch: 10, train_loss: 0.8608, test_loss: 1.0627, test_f1: 0.5526
 epoch: 11, train_loss: 0.8546, test_loss: 0.9619, test_f1: 0.5189
 epoch: 12, train_loss: 0.8552, test_loss: 0.8641, test_f1: 0.5426
 epoch: 13, train_loss: 0.8505, test_loss: 0.8798, test_f1: 0.5592
 epoch: 14, train_loss: 0.8554, test_loss: 0.8972, test_f1: 0.5685
 epoch: 15, train_loss: 0.8276, test_loss: 0.8281, test_f1: 0.5977
 epoch: 16, train_loss: 0.8118, test_loss: 0.8361, test_f1: 0.5417
 epoch: 17, train_loss: 0.8286, test_loss: 0.8499, test_f1: 0.5461
 epoch: 18, train_loss: 0.8230, test_loss: 0.8962, test_f1: 0.5501
 epoch: 19, train_loss: 0.8011, test_loss: 0.9212, test_f1: 0.5030
 epoch: 20, train_loss: 0.8075, test_loss: 0.8237, test_f1: 0.5678
 epoch: 21, train_loss: 0.8051, test_loss: 0.8486, test_f1: 0.5197
 epoch: 22, train_loss: 0.7821, test_loss: 0.8509, test_f1: 0.5449
 epoch: 23, train_loss: 0.7970, test_loss: 0.9827, test_f1: 0.6211
 epoch: 24, train_loss: 0.8104, test_loss: 0.9699, test_f1: 0.5495
 epoch: 25, train_loss: 0.7735, test_loss: 0.8407, test_f1: 0.5695
 epoch: 26, train_loss: 0.8150, test_loss: 0.9446, test_f1: 0.5432
 epoch: 27, train_loss: 0.7929, test_loss: 0.8747, test_f1: 0.6080
 epoch: 28, train_loss: 0.7706, test_loss: 1.0433, test_f1: 0.6051
 epoch: 29, train_loss: 0.7587, test_loss: 0.8317, test_f1: 0.6324
 epoch: 30, train_loss: 0.7371, test_loss: 1.0290, test_f1: 0.6272
 epoch: 31, train_loss: 0.7410, test_loss: 0.9264, test_f1: 0.6453
 epoch: 32, train_loss: 0.7509, test_loss: 0.8710, test_f1: 0.6056
 epoch: 33, train_loss: 0.7579, test_loss: 0.9236, test_f1: 0.6169
 epoch: 34, train_loss: 0.7484, test_loss: 1.1065, test_f1: 0.5643
 epoch: 35, train_loss: 0.7392, test_loss: 1.0978, test_f1: 0.5638
 epoch: 36, train_loss: 0.7158, test_loss: 0.9676, test_f1: 0.6384
 epoch: 37, train_loss: 0.6980, test_loss: 1.0056, test_f1: 0.6072
 epoch: 38, train_loss: 0.7213, test_loss: 0.9598, test_f1: 0.5963
 epoch: 39, train_loss: 0.7094, test_loss: 1.0356, test_f1: 0.6402
 epoch: 40, train_loss: 0.7048, test_loss: 0.8917, test_f1: 0.6164
 epoch: 41, train_loss: 0.6946, test_loss: 1.0131, test_f1: 0.6159
 epoch: 42, train_loss: 0.7104, test_loss: 0.9679, test_f1: 0.6349
 epoch: 43, train_loss: 0.7054, test_loss: 0.8590, test_f1: 0.6361
 epoch: 44, train_loss: 0.6983, test_loss: 0.8560, test_f1: 0.6319
 epoch: 45, train_loss: 0.6841, test_loss: 0.7722, test_f1: 0.6456
 epoch: 46, train_loss: 0.6802, test_loss: 0.8138, test_f1: 0.5836
 epoch: 47, train_loss: 0.6513, test_loss: 0.9409, test_f1: 0.6391
 epoch: 48, train_loss: 0.6767, test_loss: 0.9176, test_f1: 0.6330
 epoch: 49, train_loss: 0.6831, test_loss: 0.9409, test_f1: 0.6243
 epoch: 50, train_loss: 0.6698, test_loss: 0.8227, test_f1: 0.6405
 epoch: 51, train_loss: 0.6109, test_loss: 0.8701, test_f1: 0.6368
 epoch: 52, train_loss: 0.6194, test_loss: 0.8574, test_f1: 0.6475
 epoch: 53, train_loss: 0.6075, test_loss: 0.9053, test_f1: 0.6601
 epoch: 54, train_loss: 0.5965, test_loss: 0.8818, test_f1: 0.6597
 epoch: 55, train_loss: 0.5791, test_loss: 0.8515, test_f1: 0.6632
 epoch: 56, train_loss: 0.5822, test_loss: 0.8563, test_f1: 0.6594
 epoch: 57, train_loss: 0.5851, test_loss: 0.9261, test_f1: 0.6168
 epoch: 58, train_loss: 0.5720, test_loss: 0.7819, test_f1: 0.6606
 epoch: 59, train_loss: 0.5646, test_loss: 0.9029, test_f1: 0.6343
 epoch: 60, train_loss: 0.5970, test_loss: 0.8832, test_f1: 0.6541
 epoch: 61, train_loss: 0.5671, test_loss: 0.8699, test_f1: 0.6322
 epoch: 62, train_loss: 0.5525, test_loss: 1.0161, test_f1: 0.6381
 epoch: 63, train_loss: 0.5417, test_loss: 0.9432, test_f1: 0.6628
 epoch: 64, train_loss: 0.5341, test_loss: 0.9732, test_f1: 0.6677
 epoch: 65, train_loss: 0.5436, test_loss: 0.9000, test_f1: 0.6680
 epoch: 66, train_loss: 0.5222, test_loss: 0.8856, test_f1: 0.6601
 epoch: 67, train_loss: 0.5517, test_loss: 1.0031, test_f1: 0.6591
 epoch: 68, train_loss: 0.5325, test_loss: 1.0534, test_f1: 0.6618
 epoch: 69, train_loss: 0.5447, test_loss: 0.8918, test_f1: 0.6895
 epoch: 70, train_loss: 0.5232, test_loss: 1.0488, test_f1: 0.6391
 epoch: 71, train_loss: 0.5210, test_loss: 0.8998, test_f1: 0.6724
 epoch: 72, train_loss: 0.5244, test_loss: 0.8554, test_f1: 0.6828
 epoch: 73, train_loss: 0.5302, test_loss: 0.9741, test_f1: 0.6658
 epoch: 74, train_loss: 0.5116, test_loss: 1.0236, test_f1: 0.6513
 epoch: 75, train_loss: 0.5083, test_loss: 1.0039, test_f1: 0.6318
 epoch: 76, train_loss: 0.5017, test_loss: 1.0559, test_f1: 0.6494
 epoch: 77, train_loss: 0.5123, test_loss: 0.9247, test_f1: 0.6565
 epoch: 78, train_loss: 0.4903, test_loss: 1.0278, test_f1: 0.6520
 epoch: 79, train_loss: 0.5082, test_loss: 1.0481, test_f1: 0.6537
 epoch: 80, train_loss: 0.5066, test_loss: 1.0308, test_f1: 0.6183
 epoch: 81, train_loss: 0.4909, test_loss: 1.0459, test_f1: 0.6420
 epoch: 82, train_loss: 0.4937, test_loss: 1.0076, test_f1: 0.6123
 epoch: 83, train_loss: 0.4660, test_loss: 1.0377, test_f1: 0.6234
 epoch: 84, train_loss: 0.5102, test_loss: 1.0793, test_f1: 0.6497
 epoch: 85, train_loss: 0.4809, test_loss: 0.9343, test_f1: 0.6463
 epoch: 86, train_loss: 0.4613, test_loss: 0.9008, test_f1: 0.6755
 epoch: 87, train_loss: 0.4885, test_loss: 1.1194, test_f1: 0.6694
 epoch: 88, train_loss: 0.4613, test_loss: 1.1305, test_f1: 0.6627
 epoch: 89, train_loss: 0.4533, test_loss: 0.8965, test_f1: 0.6712
 epoch: 90, train_loss: 0.4787, test_loss: 0.8874, test_f1: 0.6481
 epoch: 91, train_loss: 0.4713, test_loss: 0.9366, test_f1: 0.6806
 epoch: 92, train_loss: 0.4493, test_loss: 0.9444, test_f1: 0.6463
 epoch: 93, train_loss: 0.4738, test_loss: 0.9654, test_f1: 0.6735
 epoch: 94, train_loss: 0.4623, test_loss: 1.1300, test_f1: 0.6479
 epoch: 95, train_loss: 0.4681, test_loss: 1.2245, test_f1: 0.6203
 epoch: 96, train_loss: 0.4715, test_loss: 1.1122, test_f1: 0.6417
 epoch: 97, train_loss: 0.4520, test_loss: 0.9212, test_f1: 0.6702
 epoch: 98, train_loss: 0.4592, test_loss: 1.0075, test_f1: 0.6593
 epoch: 99, train_loss: 0.4447, test_loss: 1.1327, test_f1: 0.6289
##################ITERATION #8 ****************************************
 epoch: 0, train_loss: 1.1211, test_loss: 1.0406, test_f1: 0.4231
 epoch: 1, train_loss: 1.0141, test_loss: 1.0256, test_f1: 0.4601
 epoch: 2, train_loss: 0.9800, test_loss: 0.9789, test_f1: 0.4967
 epoch: 3, train_loss: 0.9604, test_loss: 0.9278, test_f1: 0.4978
 epoch: 4, train_loss: 0.9393, test_loss: 1.0845, test_f1: 0.5331
 epoch: 5, train_loss: 0.9191, test_loss: 0.9519, test_f1: 0.5608
 epoch: 6, train_loss: 0.8935, test_loss: 0.8801, test_f1: 0.5187
 epoch: 7, train_loss: 0.9071, test_loss: 1.0049, test_f1: 0.5193
 epoch: 8, train_loss: 0.9133, test_loss: 0.8960, test_f1: 0.5886
 epoch: 9, train_loss: 0.8871, test_loss: 0.8652, test_f1: 0.5710
 epoch: 10, train_loss: 0.8650, test_loss: 0.8280, test_f1: 0.6176
 epoch: 11, train_loss: 0.8575, test_loss: 0.8538, test_f1: 0.5830
 epoch: 12, train_loss: 0.8289, test_loss: 0.8420, test_f1: 0.5537
 epoch: 13, train_loss: 0.8270, test_loss: 0.8607, test_f1: 0.5889
 epoch: 14, train_loss: 0.8439, test_loss: 0.8408, test_f1: 0.6086
 epoch: 15, train_loss: 0.8357, test_loss: 0.8707, test_f1: 0.5787
 epoch: 16, train_loss: 0.8167, test_loss: 0.8543, test_f1: 0.5783
 epoch: 17, train_loss: 0.7990, test_loss: 0.8446, test_f1: 0.5938
 epoch: 18, train_loss: 0.8186, test_loss: 0.8303, test_f1: 0.6403
 epoch: 19, train_loss: 0.8066, test_loss: 0.8711, test_f1: 0.5411
 epoch: 20, train_loss: 0.7824, test_loss: 0.8923, test_f1: 0.5853
 epoch: 21, train_loss: 0.7649, test_loss: 1.0037, test_f1: 0.6105
 epoch: 22, train_loss: 0.7563, test_loss: 0.8629, test_f1: 0.6124
 epoch: 23, train_loss: 0.7758, test_loss: 0.9061, test_f1: 0.5916
 epoch: 24, train_loss: 0.7477, test_loss: 0.8652, test_f1: 0.6213
 epoch: 25, train_loss: 0.7420, test_loss: 0.9428, test_f1: 0.6343
 epoch: 26, train_loss: 0.7460, test_loss: 0.9347, test_f1: 0.5783
 epoch: 27, train_loss: 0.7366, test_loss: 0.7848, test_f1: 0.6380
 epoch: 28, train_loss: 0.7242, test_loss: 1.0762, test_f1: 0.6162
 epoch: 29, train_loss: 0.7333, test_loss: 0.8921, test_f1: 0.6153
 epoch: 30, train_loss: 0.7534, test_loss: 0.9193, test_f1: 0.6615
 epoch: 31, train_loss: 0.7549, test_loss: 0.9548, test_f1: 0.6527
 epoch: 32, train_loss: 0.7079, test_loss: 1.2531, test_f1: 0.6285
 epoch: 33, train_loss: 0.7109, test_loss: 0.9329, test_f1: 0.6642
 epoch: 34, train_loss: 0.7143, test_loss: 1.0822, test_f1: 0.6135
 epoch: 35, train_loss: 0.6966, test_loss: 0.9340, test_f1: 0.6409
 epoch: 36, train_loss: 0.7159, test_loss: 1.0214, test_f1: 0.6201
 epoch: 37, train_loss: 0.7626, test_loss: 0.9944, test_f1: 0.6089
 epoch: 38, train_loss: 0.7108, test_loss: 0.9389, test_f1: 0.6613
 epoch: 39, train_loss: 0.7006, test_loss: 0.8784, test_f1: 0.6162
 epoch: 40, train_loss: 0.6830, test_loss: 1.0278, test_f1: 0.6504
 epoch: 41, train_loss: 0.6906, test_loss: 1.0099, test_f1: 0.6062
 epoch: 42, train_loss: 0.6835, test_loss: 1.3783, test_f1: 0.6434
 epoch: 43, train_loss: 0.8070, test_loss: 0.9141, test_f1: 0.5776
 epoch: 44, train_loss: 0.6949, test_loss: 1.2328, test_f1: 0.6353
 epoch: 45, train_loss: 0.6693, test_loss: 0.9684, test_f1: 0.6450
 epoch: 46, train_loss: 0.6576, test_loss: 1.0822, test_f1: 0.6254
 epoch: 47, train_loss: 0.6726, test_loss: 1.0594, test_f1: 0.6183
 epoch: 48, train_loss: 0.6403, test_loss: 1.0446, test_f1: 0.6396
 epoch: 49, train_loss: 0.6508, test_loss: 1.0882, test_f1: 0.6378
 epoch: 50, train_loss: 0.6457, test_loss: 1.2487, test_f1: 0.6313
 epoch: 51, train_loss: 0.5963, test_loss: 1.1554, test_f1: 0.6583
 epoch: 52, train_loss: 0.5868, test_loss: 1.1689, test_f1: 0.6572
 epoch: 53, train_loss: 0.5680, test_loss: 1.1460, test_f1: 0.6500
 epoch: 54, train_loss: 0.5774, test_loss: 1.2106, test_f1: 0.6649
 epoch: 55, train_loss: 0.5595, test_loss: 1.2138, test_f1: 0.6709
 epoch: 56, train_loss: 0.5509, test_loss: 1.1237, test_f1: 0.6657
 epoch: 57, train_loss: 0.5564, test_loss: 1.2528, test_f1: 0.6426
 epoch: 58, train_loss: 0.5357, test_loss: 1.3209, test_f1: 0.6586
 epoch: 59, train_loss: 0.5488, test_loss: 1.2230, test_f1: 0.6571
 epoch: 60, train_loss: 0.5303, test_loss: 1.1507, test_f1: 0.6665
 epoch: 61, train_loss: 0.5458, test_loss: 1.1012, test_f1: 0.6530
 epoch: 62, train_loss: 0.5420, test_loss: 1.2330, test_f1: 0.6608
 epoch: 63, train_loss: 0.5208, test_loss: 1.3664, test_f1: 0.6755
 epoch: 64, train_loss: 0.5211, test_loss: 1.3935, test_f1: 0.6405
 epoch: 65, train_loss: 0.5217, test_loss: 1.1844, test_f1: 0.6576
 epoch: 66, train_loss: 0.5047, test_loss: 1.3460, test_f1: 0.6646
 epoch: 67, train_loss: 0.5072, test_loss: 1.4223, test_f1: 0.6645
 epoch: 68, train_loss: 0.4961, test_loss: 1.3730, test_f1: 0.6681
 epoch: 69, train_loss: 0.5172, test_loss: 1.4735, test_f1: 0.6583
 epoch: 70, train_loss: 0.4966, test_loss: 1.3738, test_f1: 0.6420
 epoch: 71, train_loss: 0.4965, test_loss: 1.5261, test_f1: 0.6490
 epoch: 72, train_loss: 0.4989, test_loss: 1.3997, test_f1: 0.6649
 epoch: 73, train_loss: 0.4852, test_loss: 1.5768, test_f1: 0.6399
 epoch: 74, train_loss: 0.5108, test_loss: 1.4425, test_f1: 0.6575
 epoch: 75, train_loss: 0.4950, test_loss: 1.6264, test_f1: 0.6575
 epoch: 76, train_loss: 0.5229, test_loss: 1.5653, test_f1: 0.6774
 epoch: 77, train_loss: 0.4975, test_loss: 1.4481, test_f1: 0.6626
 epoch: 78, train_loss: 0.4958, test_loss: 1.3687, test_f1: 0.6616
 epoch: 79, train_loss: 0.4765, test_loss: 1.6608, test_f1: 0.6507
 epoch: 80, train_loss: 0.4812, test_loss: 1.6483, test_f1: 0.6609
 epoch: 81, train_loss: 0.4833, test_loss: 1.7727, test_f1: 0.6521
 epoch: 82, train_loss: 0.4886, test_loss: 1.7036, test_f1: 0.6839
 epoch: 83, train_loss: 0.4745, test_loss: 1.7275, test_f1: 0.6541
 epoch: 84, train_loss: 0.4939, test_loss: 1.7161, test_f1: 0.6614
 epoch: 85, train_loss: 0.4778, test_loss: 1.6453, test_f1: 0.6665
 epoch: 86, train_loss: 0.4690, test_loss: 1.5951, test_f1: 0.6653
 epoch: 87, train_loss: 0.4472, test_loss: 1.5955, test_f1: 0.6534
 epoch: 88, train_loss: 0.4675, test_loss: 1.8932, test_f1: 0.6693
 epoch: 89, train_loss: 0.4705, test_loss: 1.8880, test_f1: 0.6488
 epoch: 90, train_loss: 0.4646, test_loss: 1.7941, test_f1: 0.6516
 epoch: 91, train_loss: 0.4708, test_loss: 1.8077, test_f1: 0.6493
 epoch: 92, train_loss: 0.4357, test_loss: 1.7935, test_f1: 0.6473
 epoch: 93, train_loss: 0.4294, test_loss: 1.9251, test_f1: 0.6409
 epoch: 94, train_loss: 0.4254, test_loss: 1.9072, test_f1: 0.6310
 epoch: 95, train_loss: 0.4381, test_loss: 2.0635, test_f1: 0.6529
 epoch: 96, train_loss: 0.4705, test_loss: 1.6129, test_f1: 0.6512
 epoch: 97, train_loss: 0.4332, test_loss: 1.7225, test_f1: 0.6589
 epoch: 98, train_loss: 0.4523, test_loss: 1.5571, test_f1: 0.6774
 epoch: 99, train_loss: 0.4296, test_loss: 1.8515, test_f1: 0.6593
##################ITERATION #9 ****************************************
 epoch: 0, train_loss: 1.1306, test_loss: 1.0476, test_f1: 0.4844
 epoch: 1, train_loss: 0.9814, test_loss: 0.9005, test_f1: 0.5228
 epoch: 2, train_loss: 0.9542, test_loss: 1.0319, test_f1: 0.4742
 epoch: 3, train_loss: 0.9451, test_loss: 0.9509, test_f1: 0.4766
 epoch: 4, train_loss: 0.9301, test_loss: 0.9324, test_f1: 0.5181
 epoch: 5, train_loss: 0.9211, test_loss: 0.9398, test_f1: 0.5328
 epoch: 6, train_loss: 0.9012, test_loss: 1.0043, test_f1: 0.4980
 epoch: 7, train_loss: 0.8867, test_loss: 1.0067, test_f1: 0.5218
 epoch: 8, train_loss: 0.8616, test_loss: 0.9112, test_f1: 0.5977
 epoch: 9, train_loss: 0.8556, test_loss: 0.8401, test_f1: 0.5584
 epoch: 10, train_loss: 0.8460, test_loss: 0.9892, test_f1: 0.5195
 epoch: 11, train_loss: 0.8586, test_loss: 0.9347, test_f1: 0.6240
 epoch: 12, train_loss: 0.8465, test_loss: 0.9361, test_f1: 0.5653
 epoch: 13, train_loss: 0.8351, test_loss: 1.0138, test_f1: 0.6009
 epoch: 14, train_loss: 0.8306, test_loss: 0.8505, test_f1: 0.6079
 epoch: 15, train_loss: 0.8231, test_loss: 0.8957, test_f1: 0.5953
 epoch: 16, train_loss: 0.8032, test_loss: 0.8049, test_f1: 0.6293
 epoch: 17, train_loss: 0.8140, test_loss: 0.8288, test_f1: 0.6143
 epoch: 18, train_loss: 0.8047, test_loss: 0.9334, test_f1: 0.5634
 epoch: 19, train_loss: 0.8158, test_loss: 0.8635, test_f1: 0.6058
 epoch: 20, train_loss: 0.7886, test_loss: 0.8989, test_f1: 0.5950
 epoch: 21, train_loss: 0.7813, test_loss: 0.8496, test_f1: 0.6168
 epoch: 22, train_loss: 0.7870, test_loss: 0.8549, test_f1: 0.6164
 epoch: 23, train_loss: 0.7734, test_loss: 0.7678, test_f1: 0.6051
 epoch: 24, train_loss: 0.7930, test_loss: 0.8267, test_f1: 0.5771
 epoch: 25, train_loss: 0.7917, test_loss: 0.9831, test_f1: 0.6199
 epoch: 26, train_loss: 0.7990, test_loss: 0.8140, test_f1: 0.6259
 epoch: 27, train_loss: 0.7642, test_loss: 0.8067, test_f1: 0.6287
 epoch: 28, train_loss: 0.7463, test_loss: 0.8315, test_f1: 0.6753
 epoch: 29, train_loss: 0.7344, test_loss: 0.8217, test_f1: 0.6469
 epoch: 30, train_loss: 0.7474, test_loss: 0.7405, test_f1: 0.6319
 epoch: 31, train_loss: 0.7325, test_loss: 0.8781, test_f1: 0.6290
 epoch: 32, train_loss: 0.7169, test_loss: 0.8455, test_f1: 0.6559
 epoch: 33, train_loss: 0.7429, test_loss: 0.7508, test_f1: 0.6494
 epoch: 34, train_loss: 0.7445, test_loss: 0.8281, test_f1: 0.6338
 epoch: 35, train_loss: 0.7377, test_loss: 0.9051, test_f1: 0.6263
 epoch: 36, train_loss: 0.7246, test_loss: 0.7690, test_f1: 0.6370
 epoch: 37, train_loss: 0.7022, test_loss: 0.7735, test_f1: 0.6309
 epoch: 38, train_loss: 0.7049, test_loss: 0.9376, test_f1: 0.6350
 epoch: 39, train_loss: 0.7275, test_loss: 0.8283, test_f1: 0.6238
 epoch: 40, train_loss: 0.7283, test_loss: 0.8074, test_f1: 0.6389
 epoch: 41, train_loss: 0.7253, test_loss: 0.7742, test_f1: 0.6350
 epoch: 42, train_loss: 0.7043, test_loss: 0.8491, test_f1: 0.6504
 epoch: 43, train_loss: 0.6776, test_loss: 0.8125, test_f1: 0.6312
 epoch: 44, train_loss: 0.6963, test_loss: 0.7423, test_f1: 0.6536
 epoch: 45, train_loss: 0.6642, test_loss: 0.8830, test_f1: 0.6220
 epoch: 46, train_loss: 0.6784, test_loss: 0.7908, test_f1: 0.6584
 epoch: 47, train_loss: 0.7213, test_loss: 0.8084, test_f1: 0.6367
 epoch: 48, train_loss: 0.6851, test_loss: 0.8553, test_f1: 0.6461
 epoch: 49, train_loss: 0.6721, test_loss: 0.8859, test_f1: 0.6617
 epoch: 50, train_loss: 0.6436, test_loss: 0.7693, test_f1: 0.6559
 epoch: 51, train_loss: 0.6014, test_loss: 0.8948, test_f1: 0.6775
 epoch: 52, train_loss: 0.5941, test_loss: 0.8153, test_f1: 0.6677
 epoch: 53, train_loss: 0.5738, test_loss: 0.7652, test_f1: 0.6851
 epoch: 54, train_loss: 0.5802, test_loss: 0.8491, test_f1: 0.6706
 epoch: 55, train_loss: 0.5677, test_loss: 0.8392, test_f1: 0.6751
 epoch: 56, train_loss: 0.5627, test_loss: 0.8305, test_f1: 0.6655
 epoch: 57, train_loss: 0.5603, test_loss: 0.8171, test_f1: 0.6630
 epoch: 58, train_loss: 0.5610, test_loss: 0.8317, test_f1: 0.6885
 epoch: 59, train_loss: 0.5580, test_loss: 0.7637, test_f1: 0.6864
 epoch: 60, train_loss: 0.5455, test_loss: 0.7510, test_f1: 0.6905
 epoch: 61, train_loss: 0.5174, test_loss: 0.8131, test_f1: 0.6608
 epoch: 62, train_loss: 0.5483, test_loss: 0.8075, test_f1: 0.6793
 epoch: 63, train_loss: 0.5402, test_loss: 0.8073, test_f1: 0.6818
 epoch: 64, train_loss: 0.5245, test_loss: 0.7389, test_f1: 0.6869
 epoch: 65, train_loss: 0.5207, test_loss: 0.8059, test_f1: 0.6682
 epoch: 66, train_loss: 0.4916, test_loss: 0.8847, test_f1: 0.6681
 epoch: 67, train_loss: 0.5090, test_loss: 0.9213, test_f1: 0.6691
 epoch: 68, train_loss: 0.5240, test_loss: 1.0250, test_f1: 0.6706
 epoch: 69, train_loss: 0.4983, test_loss: 0.9399, test_f1: 0.6647
 epoch: 70, train_loss: 0.5136, test_loss: 0.8691, test_f1: 0.6871
 epoch: 71, train_loss: 0.5086, test_loss: 1.1182, test_f1: 0.6594
 epoch: 72, train_loss: 0.5184, test_loss: 1.0223, test_f1: 0.6750
 epoch: 73, train_loss: 0.4917, test_loss: 1.1079, test_f1: 0.6561
 epoch: 74, train_loss: 0.4933, test_loss: 0.9442, test_f1: 0.6670
 epoch: 75, train_loss: 0.4903, test_loss: 1.0644, test_f1: 0.6726
 epoch: 76, train_loss: 0.4783, test_loss: 1.0253, test_f1: 0.6634
 epoch: 77, train_loss: 0.4749, test_loss: 0.8395, test_f1: 0.6692
 epoch: 78, train_loss: 0.4869, test_loss: 0.9079, test_f1: 0.6923
 epoch: 79, train_loss: 0.4613, test_loss: 0.9002, test_f1: 0.6538
 epoch: 80, train_loss: 0.4636, test_loss: 1.0263, test_f1: 0.6915
 epoch: 81, train_loss: 0.4615, test_loss: 1.0029, test_f1: 0.6543
 epoch: 82, train_loss: 0.4919, test_loss: 0.9325, test_f1: 0.6635
 epoch: 83, train_loss: 0.4552, test_loss: 1.0030, test_f1: 0.6716
 epoch: 84, train_loss: 0.4599, test_loss: 0.9451, test_f1: 0.6610
 epoch: 85, train_loss: 0.4566, test_loss: 0.9553, test_f1: 0.6982
 epoch: 86, train_loss: 0.4563, test_loss: 0.8882, test_f1: 0.6796
 epoch: 87, train_loss: 0.4407, test_loss: 0.9436, test_f1: 0.7072
 epoch: 88, train_loss: 0.4359, test_loss: 1.0177, test_f1: 0.6641
 epoch: 89, train_loss: 0.4331, test_loss: 0.8785, test_f1: 0.7016
 epoch: 90, train_loss: 0.4495, test_loss: 1.0039, test_f1: 0.6902
 epoch: 91, train_loss: 0.4356, test_loss: 0.9889, test_f1: 0.6826
 epoch: 92, train_loss: 0.4366, test_loss: 1.0520, test_f1: 0.6639
 epoch: 93, train_loss: 0.4266, test_loss: 1.1638, test_f1: 0.6720
 epoch: 94, train_loss: 0.4151, test_loss: 0.9645, test_f1: 0.6877
 epoch: 95, train_loss: 0.4316, test_loss: 0.9451, test_f1: 0.6965
 epoch: 96, train_loss: 0.4212, test_loss: 0.9919, test_f1: 0.6742
 epoch: 97, train_loss: 0.4209, test_loss: 0.9564, test_f1: 0.7226
 epoch: 98, train_loss: 0.4303, test_loss: 0.9985, test_f1: 0.6893
 epoch: 99, train_loss: 0.4255, test_loss: 1.0237, test_f1: 0.6673

Training completed in 826.46 seconds
Best F1: 0.7226 at epoch 97
Mean F1 across iterations: 0.7066  0.0127
========================FINAL RESULTS================================
FEGIN weighted F1: 0.7226  0.0127
python main.py --data ltspice_examples --representation component_pin_net --model FEGIN --layers 2 --hiddens 128 --batch_size 32 --lr 0.01 --emb_size 128 --epochs 100 --save_appendix component_pin_net_L2_H128_BS32_LR0.01_E128 --no_val
-----



STDERR:
  File "main.py", line 370, in <module>
    main()
  File "main.py", line 254, in main
    dataset = dataset_class(
  File "/home/philip/projects/ltspice_examples_code_repo/Circuit-Completion-Using-GNNs/component_classification_with_link_prediction_head/evaluation/FEGIN/kernel/circuit_datasets.py", line 15, in __init__
    self.data, self.slices = torch.load(self.processed_paths[0])
  File "/home/philip/.local/lib/python3.8/site-packages/torch/serialization.py", line 1040, in load
    warnings.warn(
  File "/usr/lib/python3.8/warnings.py", line 109, in _showwarnmsg
    sw(msg.message, msg.category, msg.filename, msg.lineno,
  File "main.py", line 47, in warn_with_traceback
    traceback.print_stack(file=log)
/home/philip/projects/ltspice_examples_code_repo/Circuit-Completion-Using-GNNs/component_classification_with_link_prediction_head/evaluation/FEGIN/kernel/circuit_datasets.py:15: FutureWarning: You are using `torch.load` with `weights_only=False` (the current default value), which uses the default pickle module implicitly. It is possible to construct malicious pickle data which will execute arbitrary code during unpickling (See https://github.com/pytorch/pytorch/blob/main/SECURITY.md#untrusted-models for more details). In a future release, the default value for `weights_only` will be flipped to `True`. This limits the functions that could be executed during unpickling. Arbitrary objects will no longer be allowed to be loaded via this mode unless they are explicitly allowlisted by the user via `torch.serialization.add_safe_globals`. We recommend you start setting `weights_only=True` for any use case where you don't have full control of the loaded file. Please open an issue on GitHub for any issues related to this experimental feature.
  self.data, self.slices = torch.load(self.processed_paths[0])
