STDOUT:
Results will be saved in /home/philip/projects/ltspice_examples_code_repo/Circuit-Completion-Using-GNNs/component_classification_with_link_prediction_head/evaluation/FEGIN/results/model_FEGIN_dataset_ltspice_demos
Command line input: python main.py --data ltspice_demos --representation component_pin_net --model FEGIN --layers 2 --hiddens 64 --batch_size 256 --lr 0.01 --emb_size 128 --epochs 100 --save_appendix component_pin_net_L2_H64_BS256_LR0.01_E128 --no_val
 is saved.
-----
ltspice_demos - FEGIN
Using 2 layers, 64 hidden units, h = 2
Loading component_pin_net representation dataset
ENTERED
Training FEGIN on component_pin_net representation
Train: 1565, Test: 383
##################ITERATION #0 ****************************************
 epoch: 0, train_loss: 1.2457, test_loss: 1.3379, test_f1: 0.3372
 epoch: 1, train_loss: 1.0940, test_loss: 1.7500, test_f1: 0.1365
 epoch: 2, train_loss: 1.0323, test_loss: 1.4728, test_f1: 0.3288
 epoch: 3, train_loss: 0.9945, test_loss: 1.4530, test_f1: 0.1718
 epoch: 4, train_loss: 0.9643, test_loss: 1.2995, test_f1: 0.3612
 epoch: 5, train_loss: 0.9425, test_loss: 1.1966, test_f1: 0.3263
 epoch: 6, train_loss: 0.9273, test_loss: 1.1375, test_f1: 0.4954
 epoch: 7, train_loss: 0.9229, test_loss: 1.1246, test_f1: 0.4784
 epoch: 8, train_loss: 0.8909, test_loss: 1.1184, test_f1: 0.5475
 epoch: 9, train_loss: 0.8766, test_loss: 1.3738, test_f1: 0.4390
 epoch: 10, train_loss: 0.8600, test_loss: 1.6939, test_f1: 0.3842
 epoch: 11, train_loss: 0.8819, test_loss: 1.3531, test_f1: 0.4678
 epoch: 12, train_loss: 0.8725, test_loss: 1.1194, test_f1: 0.4773
 epoch: 13, train_loss: 0.8464, test_loss: 1.5606, test_f1: 0.3478
 epoch: 14, train_loss: 0.8592, test_loss: 1.0145, test_f1: 0.5107
 epoch: 15, train_loss: 0.8210, test_loss: 1.1412, test_f1: 0.4943
 epoch: 16, train_loss: 0.8051, test_loss: 1.0880, test_f1: 0.5170
 epoch: 17, train_loss: 0.7880, test_loss: 1.0814, test_f1: 0.5261
 epoch: 18, train_loss: 0.7502, test_loss: 1.6917, test_f1: 0.3543
 epoch: 19, train_loss: 0.7611, test_loss: 0.9554, test_f1: 0.5599
 epoch: 20, train_loss: 0.7592, test_loss: 1.0613, test_f1: 0.5154
 epoch: 21, train_loss: 0.7457, test_loss: 1.2194, test_f1: 0.5164
 epoch: 22, train_loss: 0.7087, test_loss: 1.1469, test_f1: 0.6115
 epoch: 23, train_loss: 0.7188, test_loss: 0.9810, test_f1: 0.5826
 epoch: 24, train_loss: 0.7285, test_loss: 1.1324, test_f1: 0.5164
 epoch: 25, train_loss: 0.7108, test_loss: 1.2182, test_f1: 0.4223
 epoch: 26, train_loss: 0.7194, test_loss: 1.0907, test_f1: 0.5468
 epoch: 27, train_loss: 0.7476, test_loss: 1.0456, test_f1: 0.5361
 epoch: 28, train_loss: 0.6995, test_loss: 1.6160, test_f1: 0.3801
 epoch: 29, train_loss: 0.6762, test_loss: 1.0239, test_f1: 0.6416
 epoch: 30, train_loss: 0.6423, test_loss: 1.1992, test_f1: 0.5475
 epoch: 31, train_loss: 0.6961, test_loss: 1.0259, test_f1: 0.6116
 epoch: 32, train_loss: 0.7022, test_loss: 1.2116, test_f1: 0.5589
 epoch: 33, train_loss: 0.6950, test_loss: 2.0325, test_f1: 0.4919
 epoch: 34, train_loss: 0.6558, test_loss: 1.3450, test_f1: 0.4782
 epoch: 35, train_loss: 0.6387, test_loss: 1.1998, test_f1: 0.5171
 epoch: 36, train_loss: 0.6397, test_loss: 0.9586, test_f1: 0.6261
 epoch: 37, train_loss: 0.5922, test_loss: 0.9825, test_f1: 0.6098
 epoch: 38, train_loss: 0.5908, test_loss: 1.4107, test_f1: 0.5605
 epoch: 39, train_loss: 0.6095, test_loss: 1.0842, test_f1: 0.6200
 epoch: 40, train_loss: 0.5926, test_loss: 1.0955, test_f1: 0.6139
 epoch: 41, train_loss: 0.6379, test_loss: 1.0985, test_f1: 0.5685
 epoch: 42, train_loss: 0.6425, test_loss: 1.1177, test_f1: 0.5374
 epoch: 43, train_loss: 0.6239, test_loss: 0.9708, test_f1: 0.6218
 epoch: 44, train_loss: 0.5712, test_loss: 0.9927, test_f1: 0.6476
 epoch: 45, train_loss: 0.5868, test_loss: 1.5172, test_f1: 0.5130
 epoch: 46, train_loss: 0.6535, test_loss: 0.9566, test_f1: 0.6329
 epoch: 47, train_loss: 0.6545, test_loss: 1.1428, test_f1: 0.5309
 epoch: 48, train_loss: 0.6173, test_loss: 1.2633, test_f1: 0.4914
 epoch: 49, train_loss: 0.5809, test_loss: 1.1673, test_f1: 0.5685
 epoch: 50, train_loss: 0.5731, test_loss: 1.0515, test_f1: 0.6112
 epoch: 51, train_loss: 0.5475, test_loss: 1.1126, test_f1: 0.6256
 epoch: 52, train_loss: 0.5103, test_loss: 1.1162, test_f1: 0.6099
 epoch: 53, train_loss: 0.5000, test_loss: 1.0956, test_f1: 0.6257
 epoch: 54, train_loss: 0.4708, test_loss: 1.2907, test_f1: 0.6113
 epoch: 55, train_loss: 0.4968, test_loss: 1.0030, test_f1: 0.6517
 epoch: 56, train_loss: 0.4690, test_loss: 0.9543, test_f1: 0.6357
 epoch: 57, train_loss: 0.4408, test_loss: 1.3252, test_f1: 0.5945
 epoch: 58, train_loss: 0.4178, test_loss: 1.2534, test_f1: 0.6101
 epoch: 59, train_loss: 0.4637, test_loss: 1.1870, test_f1: 0.6460
 epoch: 60, train_loss: 0.4504, test_loss: 1.2249, test_f1: 0.6370
 epoch: 61, train_loss: 0.4442, test_loss: 1.3465, test_f1: 0.5848
 epoch: 62, train_loss: 0.4419, test_loss: 1.1287, test_f1: 0.6539
 epoch: 63, train_loss: 0.4040, test_loss: 1.0906, test_f1: 0.6215
 epoch: 64, train_loss: 0.3916, test_loss: 1.1227, test_f1: 0.6330
 epoch: 65, train_loss: 0.4579, test_loss: 1.2081, test_f1: 0.6259
 epoch: 66, train_loss: 0.4520, test_loss: 1.1366, test_f1: 0.5967
 epoch: 67, train_loss: 0.4231, test_loss: 1.1340, test_f1: 0.6135
 epoch: 68, train_loss: 0.3970, test_loss: 1.6123, test_f1: 0.6116
 epoch: 69, train_loss: 0.4064, test_loss: 1.5540, test_f1: 0.6132
 epoch: 70, train_loss: 0.3823, test_loss: 1.1316, test_f1: 0.6234
 epoch: 71, train_loss: 0.3593, test_loss: 1.1557, test_f1: 0.6501
 epoch: 72, train_loss: 0.3777, test_loss: 1.3624, test_f1: 0.6268
 epoch: 73, train_loss: 0.3912, test_loss: 1.3804, test_f1: 0.6214
 epoch: 74, train_loss: 0.3830, test_loss: 1.3043, test_f1: 0.6320
 epoch: 75, train_loss: 0.4385, test_loss: 1.5622, test_f1: 0.5684
 epoch: 76, train_loss: 0.4025, test_loss: 1.8457, test_f1: 0.5622
 epoch: 77, train_loss: 0.3917, test_loss: 1.5593, test_f1: 0.5795
 epoch: 78, train_loss: 0.3823, test_loss: 1.4628, test_f1: 0.5979
 epoch: 79, train_loss: 0.3258, test_loss: 1.8134, test_f1: 0.5688
 epoch: 80, train_loss: 0.3804, test_loss: 1.5975, test_f1: 0.5989
 epoch: 81, train_loss: 0.3719, test_loss: 1.6720, test_f1: 0.5923
 epoch: 82, train_loss: 0.3650, test_loss: 1.2451, test_f1: 0.6284
 epoch: 83, train_loss: 0.4008, test_loss: 1.2832, test_f1: 0.6563
 epoch: 84, train_loss: 0.3468, test_loss: 1.4230, test_f1: 0.5787
 epoch: 85, train_loss: 0.3741, test_loss: 1.2059, test_f1: 0.6423
 epoch: 86, train_loss: 0.3385, test_loss: 1.3619, test_f1: 0.6100
 epoch: 87, train_loss: 0.3304, test_loss: 1.5249, test_f1: 0.6188
 epoch: 88, train_loss: 0.2976, test_loss: 1.6680, test_f1: 0.6173
 epoch: 89, train_loss: 0.3266, test_loss: 1.7347, test_f1: 0.5550
 epoch: 90, train_loss: 0.3185, test_loss: 1.7227, test_f1: 0.5573
 epoch: 91, train_loss: 0.3272, test_loss: 1.5579, test_f1: 0.6079
 epoch: 92, train_loss: 0.3814, test_loss: 1.2810, test_f1: 0.6116
 epoch: 93, train_loss: 0.3572, test_loss: 1.1947, test_f1: 0.6596
 epoch: 94, train_loss: 0.3430, test_loss: 1.2341, test_f1: 0.6743
 epoch: 95, train_loss: 0.3335, test_loss: 1.5813, test_f1: 0.6303
 epoch: 96, train_loss: 0.3520, test_loss: 1.7519, test_f1: 0.6097
 epoch: 97, train_loss: 0.3523, test_loss: 1.7543, test_f1: 0.5758
 epoch: 98, train_loss: 0.3081, test_loss: 1.4535, test_f1: 0.6613
 epoch: 99, train_loss: 0.3351, test_loss: 1.4785, test_f1: 0.6205
##################ITERATION #1 ****************************************
 epoch: 0, train_loss: 1.1781, test_loss: 1.3622, test_f1: 0.3266
 epoch: 1, train_loss: 1.0099, test_loss: 1.4396, test_f1: 0.2570
 epoch: 2, train_loss: 0.9837, test_loss: 1.5538, test_f1: 0.1591
 epoch: 3, train_loss: 0.9402, test_loss: 1.2759, test_f1: 0.2733
 epoch: 4, train_loss: 0.8976, test_loss: 1.2833, test_f1: 0.3825
 epoch: 5, train_loss: 0.8835, test_loss: 1.1268, test_f1: 0.4366
 epoch: 6, train_loss: 0.8513, test_loss: 1.1380, test_f1: 0.4845
 epoch: 7, train_loss: 0.8443, test_loss: 1.0323, test_f1: 0.5225
 epoch: 8, train_loss: 0.8141, test_loss: 1.0290, test_f1: 0.5509
 epoch: 9, train_loss: 0.8000, test_loss: 0.9783, test_f1: 0.5498
 epoch: 10, train_loss: 0.7937, test_loss: 1.0303, test_f1: 0.5189
 epoch: 11, train_loss: 0.7987, test_loss: 1.0226, test_f1: 0.5242
 epoch: 12, train_loss: 0.8003, test_loss: 1.0613, test_f1: 0.4720
 epoch: 13, train_loss: 0.7860, test_loss: 0.9840, test_f1: 0.5381
 epoch: 14, train_loss: 0.7706, test_loss: 1.0002, test_f1: 0.5467
 epoch: 15, train_loss: 0.7763, test_loss: 0.9638, test_f1: 0.5384
 epoch: 16, train_loss: 0.7519, test_loss: 0.9765, test_f1: 0.5519
 epoch: 17, train_loss: 0.7518, test_loss: 0.9812, test_f1: 0.5683
 epoch: 18, train_loss: 0.7156, test_loss: 1.3361, test_f1: 0.4638
 epoch: 19, train_loss: 0.7139, test_loss: 1.5349, test_f1: 0.4330
 epoch: 20, train_loss: 0.6698, test_loss: 1.1539, test_f1: 0.5117
 epoch: 21, train_loss: 0.6763, test_loss: 0.9994, test_f1: 0.5469
 epoch: 22, train_loss: 0.6708, test_loss: 1.4228, test_f1: 0.5441
 epoch: 23, train_loss: 0.6736, test_loss: 1.2683, test_f1: 0.4922
 epoch: 24, train_loss: 0.6917, test_loss: 1.1301, test_f1: 0.4526
 epoch: 25, train_loss: 0.6801, test_loss: 1.1812, test_f1: 0.5077
 epoch: 26, train_loss: 0.6631, test_loss: 0.9968, test_f1: 0.5749
 epoch: 27, train_loss: 0.6669, test_loss: 1.0472, test_f1: 0.6070
 epoch: 28, train_loss: 0.6702, test_loss: 1.0555, test_f1: 0.5931
 epoch: 29, train_loss: 0.6830, test_loss: 1.0691, test_f1: 0.5923
 epoch: 30, train_loss: 0.6121, test_loss: 1.2417, test_f1: 0.5355
 epoch: 31, train_loss: 0.6367, test_loss: 1.5237, test_f1: 0.5128
 epoch: 32, train_loss: 0.6599, test_loss: 1.1726, test_f1: 0.4850
 epoch: 33, train_loss: 0.6206, test_loss: 1.1623, test_f1: 0.5612
 epoch: 34, train_loss: 0.6162, test_loss: 1.2552, test_f1: 0.5608
 epoch: 35, train_loss: 0.6003, test_loss: 1.3966, test_f1: 0.5859
 epoch: 36, train_loss: 0.6209, test_loss: 1.6094, test_f1: 0.5332
 epoch: 37, train_loss: 0.6108, test_loss: 1.2762, test_f1: 0.5018
 epoch: 38, train_loss: 0.6020, test_loss: 1.5701, test_f1: 0.5203
 epoch: 39, train_loss: 0.5945, test_loss: 1.0648, test_f1: 0.5966
 epoch: 40, train_loss: 0.6107, test_loss: 1.2099, test_f1: 0.5964
 epoch: 41, train_loss: 0.5645, test_loss: 1.4247, test_f1: 0.5591
 epoch: 42, train_loss: 0.5654, test_loss: 1.2035, test_f1: 0.5984
 epoch: 43, train_loss: 0.5567, test_loss: 1.6974, test_f1: 0.5454
 epoch: 44, train_loss: 0.5902, test_loss: 1.7878, test_f1: 0.4409
 epoch: 45, train_loss: 0.5530, test_loss: 1.1488, test_f1: 0.6020
 epoch: 46, train_loss: 0.5364, test_loss: 1.1678, test_f1: 0.6199
 epoch: 47, train_loss: 0.5411, test_loss: 1.2764, test_f1: 0.6278
 epoch: 48, train_loss: 0.5357, test_loss: 1.7216, test_f1: 0.4983
 epoch: 49, train_loss: 0.5500, test_loss: 2.3977, test_f1: 0.5194
 epoch: 50, train_loss: 0.5232, test_loss: 1.5299, test_f1: 0.5951
 epoch: 51, train_loss: 0.5138, test_loss: 1.7788, test_f1: 0.5474
 epoch: 52, train_loss: 0.4721, test_loss: 1.1485, test_f1: 0.6494
 epoch: 53, train_loss: 0.4633, test_loss: 1.1024, test_f1: 0.6398
 epoch: 54, train_loss: 0.4310, test_loss: 1.4543, test_f1: 0.5919
 epoch: 55, train_loss: 0.4390, test_loss: 1.6233, test_f1: 0.5978
 epoch: 56, train_loss: 0.4627, test_loss: 1.4917, test_f1: 0.5480
 epoch: 57, train_loss: 0.4393, test_loss: 1.7006, test_f1: 0.5801
 epoch: 58, train_loss: 0.4115, test_loss: 1.7128, test_f1: 0.6022
 epoch: 59, train_loss: 0.4071, test_loss: 1.9933, test_f1: 0.5358
 epoch: 60, train_loss: 0.4127, test_loss: 1.8161, test_f1: 0.5926
 epoch: 61, train_loss: 0.3944, test_loss: 1.7081, test_f1: 0.6295
 epoch: 62, train_loss: 0.4165, test_loss: 2.0301, test_f1: 0.5757
 epoch: 63, train_loss: 0.4013, test_loss: 1.3650, test_f1: 0.6349
 epoch: 64, train_loss: 0.3791, test_loss: 1.4230, test_f1: 0.6242
 epoch: 65, train_loss: 0.3798, test_loss: 1.6769, test_f1: 0.5768
 epoch: 66, train_loss: 0.3727, test_loss: 1.5187, test_f1: 0.5677
 epoch: 67, train_loss: 0.3739, test_loss: 1.9875, test_f1: 0.5280
 epoch: 68, train_loss: 0.3629, test_loss: 1.8508, test_f1: 0.5892
 epoch: 69, train_loss: 0.3406, test_loss: 1.7708, test_f1: 0.6111
 epoch: 70, train_loss: 0.3636, test_loss: 1.7795, test_f1: 0.6361
 epoch: 71, train_loss: 0.3644, test_loss: 1.9236, test_f1: 0.6358
 epoch: 72, train_loss: 0.3402, test_loss: 1.7326, test_f1: 0.5551
 epoch: 73, train_loss: 0.3654, test_loss: 1.4762, test_f1: 0.5863
 epoch: 74, train_loss: 0.3689, test_loss: 1.6269, test_f1: 0.5676
 epoch: 75, train_loss: 0.3838, test_loss: 1.6177, test_f1: 0.5863
 epoch: 76, train_loss: 0.3735, test_loss: 1.8109, test_f1: 0.5839
 epoch: 77, train_loss: 0.3630, test_loss: 1.5998, test_f1: 0.5835
 epoch: 78, train_loss: 0.3384, test_loss: 1.6397, test_f1: 0.5516
 epoch: 79, train_loss: 0.3498, test_loss: 1.8552, test_f1: 0.5251
 epoch: 80, train_loss: 0.3769, test_loss: 1.6707, test_f1: 0.6267
 epoch: 81, train_loss: 0.3351, test_loss: 2.0144, test_f1: 0.6065
 epoch: 82, train_loss: 0.3218, test_loss: 2.2151, test_f1: 0.6220
 epoch: 83, train_loss: 0.3300, test_loss: 2.3383, test_f1: 0.5725
 epoch: 84, train_loss: 0.3568, test_loss: 1.8148, test_f1: 0.5815
 epoch: 85, train_loss: 0.3154, test_loss: 1.8067, test_f1: 0.5660
 epoch: 86, train_loss: 0.3136, test_loss: 1.5548, test_f1: 0.5406
 epoch: 87, train_loss: 0.3132, test_loss: 1.7323, test_f1: 0.5629
 epoch: 88, train_loss: 0.2861, test_loss: 1.7482, test_f1: 0.5783
 epoch: 89, train_loss: 0.2754, test_loss: 1.6212, test_f1: 0.5893
 epoch: 90, train_loss: 0.2546, test_loss: 1.8284, test_f1: 0.6070
 epoch: 91, train_loss: 0.3021, test_loss: 1.7862, test_f1: 0.5813
 epoch: 92, train_loss: 0.2766, test_loss: 1.7260, test_f1: 0.5580
 epoch: 93, train_loss: 0.3152, test_loss: 1.6129, test_f1: 0.5958
 epoch: 94, train_loss: 0.2927, test_loss: 1.9002, test_f1: 0.5888
 epoch: 95, train_loss: 0.2789, test_loss: 1.7271, test_f1: 0.5974
 epoch: 96, train_loss: 0.3102, test_loss: 1.9271, test_f1: 0.5868
 epoch: 97, train_loss: 0.2979, test_loss: 2.6992, test_f1: 0.5411
 epoch: 98, train_loss: 0.3491, test_loss: 2.0945, test_f1: 0.5758
 epoch: 99, train_loss: 0.2945, test_loss: 1.6866, test_f1: 0.6244
##################ITERATION #2 ****************************************
 epoch: 0, train_loss: 1.4886, test_loss: 1.5482, test_f1: 0.1365
 epoch: 1, train_loss: 1.0257, test_loss: 1.4371, test_f1: 0.2411
 epoch: 2, train_loss: 0.9635, test_loss: 1.4415, test_f1: 0.2583
 epoch: 3, train_loss: 0.9275, test_loss: 1.3998, test_f1: 0.3871
 epoch: 4, train_loss: 0.9047, test_loss: 1.2104, test_f1: 0.3967
 epoch: 5, train_loss: 0.8936, test_loss: 1.0813, test_f1: 0.5024
 epoch: 6, train_loss: 0.8635, test_loss: 1.1175, test_f1: 0.5062
 epoch: 7, train_loss: 0.8573, test_loss: 1.0330, test_f1: 0.5409
 epoch: 8, train_loss: 0.8325, test_loss: 1.0645, test_f1: 0.4962
 epoch: 9, train_loss: 0.8329, test_loss: 1.0129, test_f1: 0.6016
 epoch: 10, train_loss: 0.8063, test_loss: 1.0873, test_f1: 0.4880
 epoch: 11, train_loss: 0.8176, test_loss: 1.0622, test_f1: 0.5169
 epoch: 12, train_loss: 0.7987, test_loss: 1.0005, test_f1: 0.5314
 epoch: 13, train_loss: 0.7679, test_loss: 0.9915, test_f1: 0.5841
 epoch: 14, train_loss: 0.7424, test_loss: 0.9989, test_f1: 0.6272
 epoch: 15, train_loss: 0.7327, test_loss: 1.1135, test_f1: 0.5489
 epoch: 16, train_loss: 0.7377, test_loss: 1.0423, test_f1: 0.5917
 epoch: 17, train_loss: 0.7329, test_loss: 1.0874, test_f1: 0.5470
 epoch: 18, train_loss: 0.7287, test_loss: 1.3046, test_f1: 0.4600
 epoch: 19, train_loss: 0.7311, test_loss: 1.7579, test_f1: 0.4683
 epoch: 20, train_loss: 0.7145, test_loss: 1.2075, test_f1: 0.5059
 epoch: 21, train_loss: 0.6832, test_loss: 1.0972, test_f1: 0.6022
 epoch: 22, train_loss: 0.7146, test_loss: 1.1943, test_f1: 0.5564
 epoch: 23, train_loss: 0.6962, test_loss: 1.9293, test_f1: 0.4967
 epoch: 24, train_loss: 0.6663, test_loss: 1.1674, test_f1: 0.5048
 epoch: 25, train_loss: 0.6613, test_loss: 1.2013, test_f1: 0.4536
 epoch: 26, train_loss: 0.6525, test_loss: 1.9940, test_f1: 0.4252
 epoch: 27, train_loss: 0.7003, test_loss: 2.4162, test_f1: 0.4677
 epoch: 28, train_loss: 0.6816, test_loss: 1.1471, test_f1: 0.5535
 epoch: 29, train_loss: 0.6631, test_loss: 1.1894, test_f1: 0.5885
 epoch: 30, train_loss: 0.6522, test_loss: 2.4434, test_f1: 0.4431
 epoch: 31, train_loss: 0.6177, test_loss: 2.3367, test_f1: 0.4544
 epoch: 32, train_loss: 0.6265, test_loss: 1.6630, test_f1: 0.5377
 epoch: 33, train_loss: 0.6606, test_loss: 1.2083, test_f1: 0.6121
 epoch: 34, train_loss: 0.6718, test_loss: 1.7225, test_f1: 0.5824
 epoch: 35, train_loss: 0.6254, test_loss: 1.6036, test_f1: 0.5843
 epoch: 36, train_loss: 0.6091, test_loss: 2.3453, test_f1: 0.5391
 epoch: 37, train_loss: 0.6202, test_loss: 1.5348, test_f1: 0.5641
 epoch: 38, train_loss: 0.5986, test_loss: 2.0632, test_f1: 0.5599
 epoch: 39, train_loss: 0.5951, test_loss: 1.8309, test_f1: 0.4713
 epoch: 40, train_loss: 0.5758, test_loss: 2.1647, test_f1: 0.5248
 epoch: 41, train_loss: 0.5685, test_loss: 2.1928, test_f1: 0.5848
 epoch: 42, train_loss: 0.6463, test_loss: 1.9374, test_f1: 0.5642
 epoch: 43, train_loss: 0.6006, test_loss: 1.5285, test_f1: 0.5750
 epoch: 44, train_loss: 0.6013, test_loss: 1.4759, test_f1: 0.6114
 epoch: 45, train_loss: 0.6271, test_loss: 1.7801, test_f1: 0.4878
 epoch: 46, train_loss: 0.5622, test_loss: 1.3354, test_f1: 0.5123
 epoch: 47, train_loss: 0.6138, test_loss: 1.1794, test_f1: 0.5365
 epoch: 48, train_loss: 0.5811, test_loss: 1.1654, test_f1: 0.5522
 epoch: 49, train_loss: 0.5685, test_loss: 1.2358, test_f1: 0.5659
 epoch: 50, train_loss: 0.5694, test_loss: 1.1920, test_f1: 0.5809
 epoch: 51, train_loss: 0.5460, test_loss: 1.2946, test_f1: 0.5796
 epoch: 52, train_loss: 0.5323, test_loss: 1.4182, test_f1: 0.6186
 epoch: 53, train_loss: 0.5130, test_loss: 1.8836, test_f1: 0.5929
 epoch: 54, train_loss: 0.4870, test_loss: 1.7303, test_f1: 0.5880
 epoch: 55, train_loss: 0.4953, test_loss: 1.4109, test_f1: 0.6451
 epoch: 56, train_loss: 0.4767, test_loss: 1.2862, test_f1: 0.6267
 epoch: 57, train_loss: 0.4795, test_loss: 1.3151, test_f1: 0.6351
 epoch: 58, train_loss: 0.4853, test_loss: 1.4096, test_f1: 0.6255
 epoch: 59, train_loss: 0.4472, test_loss: 1.3790, test_f1: 0.6105
 epoch: 60, train_loss: 0.4575, test_loss: 1.3003, test_f1: 0.6185
 epoch: 61, train_loss: 0.4369, test_loss: 1.2880, test_f1: 0.6129
 epoch: 62, train_loss: 0.4434, test_loss: 1.7606, test_f1: 0.6059
 epoch: 63, train_loss: 0.4235, test_loss: 1.5645, test_f1: 0.6524
 epoch: 64, train_loss: 0.4226, test_loss: 1.6480, test_f1: 0.6367
 epoch: 65, train_loss: 0.4206, test_loss: 1.4370, test_f1: 0.5938
 epoch: 66, train_loss: 0.3856, test_loss: 1.6102, test_f1: 0.5999
 epoch: 67, train_loss: 0.4069, test_loss: 1.7303, test_f1: 0.6119
 epoch: 68, train_loss: 0.4043, test_loss: 1.5119, test_f1: 0.5969
 epoch: 69, train_loss: 0.3827, test_loss: 1.8063, test_f1: 0.5645
 epoch: 70, train_loss: 0.4003, test_loss: 1.7498, test_f1: 0.5068
 epoch: 71, train_loss: 0.3764, test_loss: 1.4877, test_f1: 0.6226
 epoch: 72, train_loss: 0.4105, test_loss: 1.5080, test_f1: 0.6239
 epoch: 73, train_loss: 0.3674, test_loss: 1.7851, test_f1: 0.5841
 epoch: 74, train_loss: 0.3779, test_loss: 1.5974, test_f1: 0.6417
 epoch: 75, train_loss: 0.3613, test_loss: 1.7313, test_f1: 0.6243
 epoch: 76, train_loss: 0.3886, test_loss: 1.6249, test_f1: 0.6240
 epoch: 77, train_loss: 0.3675, test_loss: 1.8943, test_f1: 0.5635
 epoch: 78, train_loss: 0.3870, test_loss: 1.8061, test_f1: 0.5771
 epoch: 79, train_loss: 0.3859, test_loss: 1.7410, test_f1: 0.5881
 epoch: 80, train_loss: 0.4021, test_loss: 1.9495, test_f1: 0.5917
 epoch: 81, train_loss: 0.3639, test_loss: 1.6667, test_f1: 0.5951
 epoch: 82, train_loss: 0.3742, test_loss: 1.6967, test_f1: 0.6047
 epoch: 83, train_loss: 0.3732, test_loss: 1.7109, test_f1: 0.5914
 epoch: 84, train_loss: 0.3812, test_loss: 1.7519, test_f1: 0.5791
 epoch: 85, train_loss: 0.3765, test_loss: 1.6830, test_f1: 0.6019
 epoch: 86, train_loss: 0.3896, test_loss: 1.9648, test_f1: 0.5812
 epoch: 87, train_loss: 0.3459, test_loss: 2.1666, test_f1: 0.6065
 epoch: 88, train_loss: 0.3529, test_loss: 2.3806, test_f1: 0.5774
 epoch: 89, train_loss: 0.3228, test_loss: 2.4591, test_f1: 0.5803
 epoch: 90, train_loss: 0.3558, test_loss: 1.8024, test_f1: 0.6319
 epoch: 91, train_loss: 0.3680, test_loss: 1.6487, test_f1: 0.6000
 epoch: 92, train_loss: 0.3372, test_loss: 1.7445, test_f1: 0.6301
 epoch: 93, train_loss: 0.3564, test_loss: 1.7472, test_f1: 0.6010
 epoch: 94, train_loss: 0.3447, test_loss: 1.9824, test_f1: 0.6028
 epoch: 95, train_loss: 0.3262, test_loss: 2.4562, test_f1: 0.5585
 epoch: 96, train_loss: 0.3403, test_loss: 2.1098, test_f1: 0.5399
 epoch: 97, train_loss: 0.3532, test_loss: 2.0686, test_f1: 0.5581
 epoch: 98, train_loss: 0.3497, test_loss: 1.8978, test_f1: 0.5841
 epoch: 99, train_loss: 0.3231, test_loss: 1.9066, test_f1: 0.5925
##################ITERATION #3 ****************************************
 epoch: 0, train_loss: 1.3459, test_loss: 1.5579, test_f1: 0.3348
 epoch: 1, train_loss: 1.0196, test_loss: 1.4215, test_f1: 0.1478
 epoch: 2, train_loss: 0.9809, test_loss: 1.2978, test_f1: 0.3195
 epoch: 3, train_loss: 0.9596, test_loss: 1.3276, test_f1: 0.3494
 epoch: 4, train_loss: 0.9213, test_loss: 1.1720, test_f1: 0.3617
 epoch: 5, train_loss: 0.8943, test_loss: 1.0742, test_f1: 0.5126
 epoch: 6, train_loss: 0.8660, test_loss: 1.0911, test_f1: 0.5002
 epoch: 7, train_loss: 0.8556, test_loss: 1.1250, test_f1: 0.4741
 epoch: 8, train_loss: 0.8127, test_loss: 1.2664, test_f1: 0.4750
 epoch: 9, train_loss: 0.8327, test_loss: 1.0983, test_f1: 0.5364
 epoch: 10, train_loss: 0.8185, test_loss: 1.0889, test_f1: 0.5789
 epoch: 11, train_loss: 0.8010, test_loss: 1.1654, test_f1: 0.5375
 epoch: 12, train_loss: 0.7955, test_loss: 1.0292, test_f1: 0.5789
 epoch: 13, train_loss: 0.8023, test_loss: 1.0160, test_f1: 0.5529
 epoch: 14, train_loss: 0.7931, test_loss: 1.0066, test_f1: 0.5792
 epoch: 15, train_loss: 0.7721, test_loss: 1.8036, test_f1: 0.2948
 epoch: 16, train_loss: 0.7721, test_loss: 1.4701, test_f1: 0.3542
 epoch: 17, train_loss: 0.7492, test_loss: 1.1436, test_f1: 0.5373
 epoch: 18, train_loss: 0.7351, test_loss: 1.1275, test_f1: 0.5582
 epoch: 19, train_loss: 0.7099, test_loss: 1.1764, test_f1: 0.5038
 epoch: 20, train_loss: 0.7177, test_loss: 1.2110, test_f1: 0.5054
 epoch: 21, train_loss: 0.6723, test_loss: 1.2983, test_f1: 0.4786
 epoch: 22, train_loss: 0.6847, test_loss: 1.0917, test_f1: 0.5816
 epoch: 23, train_loss: 0.6664, test_loss: 1.0600, test_f1: 0.6126
 epoch: 24, train_loss: 0.6942, test_loss: 1.1308, test_f1: 0.5802
 epoch: 25, train_loss: 0.7476, test_loss: 1.2063, test_f1: 0.4928
 epoch: 26, train_loss: 0.6854, test_loss: 1.3428, test_f1: 0.5132
 epoch: 27, train_loss: 0.6755, test_loss: 1.3226, test_f1: 0.5092
 epoch: 28, train_loss: 0.6640, test_loss: 1.3037, test_f1: 0.4788
 epoch: 29, train_loss: 0.6601, test_loss: 1.1096, test_f1: 0.5657
 epoch: 30, train_loss: 0.6839, test_loss: 1.0477, test_f1: 0.5929
 epoch: 31, train_loss: 0.6307, test_loss: 1.0840, test_f1: 0.6084
 epoch: 32, train_loss: 0.6336, test_loss: 1.1903, test_f1: 0.5574
 epoch: 33, train_loss: 0.6362, test_loss: 1.1110, test_f1: 0.5773
 epoch: 34, train_loss: 0.6727, test_loss: 1.3637, test_f1: 0.5455
 epoch: 35, train_loss: 0.6608, test_loss: 1.2974, test_f1: 0.5566
 epoch: 36, train_loss: 0.6640, test_loss: 1.1766, test_f1: 0.5352
 epoch: 37, train_loss: 0.6578, test_loss: 1.0664, test_f1: 0.5547
 epoch: 38, train_loss: 0.6339, test_loss: 1.1293, test_f1: 0.6093
 epoch: 39, train_loss: 0.6195, test_loss: 1.3632, test_f1: 0.5260
 epoch: 40, train_loss: 0.5763, test_loss: 1.2039, test_f1: 0.5110
 epoch: 41, train_loss: 0.5937, test_loss: 1.2804, test_f1: 0.5652
 epoch: 42, train_loss: 0.6157, test_loss: 1.4044, test_f1: 0.5759
 epoch: 43, train_loss: 0.6113, test_loss: 1.2919, test_f1: 0.5443
 epoch: 44, train_loss: 0.5745, test_loss: 1.0764, test_f1: 0.6306
 epoch: 45, train_loss: 0.5521, test_loss: 1.2317, test_f1: 0.5784
 epoch: 46, train_loss: 0.5321, test_loss: 1.2540, test_f1: 0.5971
 epoch: 47, train_loss: 0.5487, test_loss: 1.3045, test_f1: 0.5527
 epoch: 48, train_loss: 0.5392, test_loss: 1.1979, test_f1: 0.5701
 epoch: 49, train_loss: 0.5629, test_loss: 1.3395, test_f1: 0.5444
 epoch: 50, train_loss: 0.5243, test_loss: 1.4909, test_f1: 0.5542
 epoch: 51, train_loss: 0.5277, test_loss: 1.3020, test_f1: 0.5623
 epoch: 52, train_loss: 0.5143, test_loss: 1.3204, test_f1: 0.5541
 epoch: 53, train_loss: 0.4993, test_loss: 1.5294, test_f1: 0.5410
 epoch: 54, train_loss: 0.5000, test_loss: 1.8208, test_f1: 0.5104
 epoch: 55, train_loss: 0.4925, test_loss: 1.5703, test_f1: 0.5431
 epoch: 56, train_loss: 0.5154, test_loss: 1.4274, test_f1: 0.5878
 epoch: 57, train_loss: 0.4800, test_loss: 1.3139, test_f1: 0.5584
 epoch: 58, train_loss: 0.4578, test_loss: 1.4771, test_f1: 0.5604
 epoch: 59, train_loss: 0.4540, test_loss: 1.4741, test_f1: 0.5727
 epoch: 60, train_loss: 0.4692, test_loss: 1.4254, test_f1: 0.6074
 epoch: 61, train_loss: 0.4642, test_loss: 1.4863, test_f1: 0.5748
 epoch: 62, train_loss: 0.4554, test_loss: 1.4861, test_f1: 0.5451
 epoch: 63, train_loss: 0.4628, test_loss: 1.3696, test_f1: 0.6002
 epoch: 64, train_loss: 0.4613, test_loss: 1.3514, test_f1: 0.6074
 epoch: 65, train_loss: 0.4663, test_loss: 1.4784, test_f1: 0.5680
 epoch: 66, train_loss: 0.4222, test_loss: 1.6673, test_f1: 0.5484
 epoch: 67, train_loss: 0.4134, test_loss: 1.8075, test_f1: 0.5665
 epoch: 68, train_loss: 0.4109, test_loss: 1.6071, test_f1: 0.5899
 epoch: 69, train_loss: 0.3945, test_loss: 1.6717, test_f1: 0.5435
 epoch: 70, train_loss: 0.4087, test_loss: 1.6362, test_f1: 0.5598
 epoch: 71, train_loss: 0.3946, test_loss: 1.6272, test_f1: 0.5778
 epoch: 72, train_loss: 0.3921, test_loss: 1.4842, test_f1: 0.5939
 epoch: 73, train_loss: 0.3706, test_loss: 1.4335, test_f1: 0.6228
 epoch: 74, train_loss: 0.3775, test_loss: 1.5721, test_f1: 0.5774
 epoch: 75, train_loss: 0.4044, test_loss: 1.4296, test_f1: 0.6409
 epoch: 76, train_loss: 0.4005, test_loss: 1.2978, test_f1: 0.6273
 epoch: 77, train_loss: 0.3742, test_loss: 1.3239, test_f1: 0.6121
 epoch: 78, train_loss: 0.3707, test_loss: 1.4918, test_f1: 0.5740
 epoch: 79, train_loss: 0.3811, test_loss: 1.8103, test_f1: 0.5406
 epoch: 80, train_loss: 0.3685, test_loss: 1.8414, test_f1: 0.5654
 epoch: 81, train_loss: 0.3787, test_loss: 1.6851, test_f1: 0.5863
 epoch: 82, train_loss: 0.3957, test_loss: 1.4827, test_f1: 0.6296
 epoch: 83, train_loss: 0.3665, test_loss: 1.6254, test_f1: 0.5695
 epoch: 84, train_loss: 0.3714, test_loss: 1.5007, test_f1: 0.6190
 epoch: 85, train_loss: 0.3763, test_loss: 1.4704, test_f1: 0.6329
 epoch: 86, train_loss: 0.3960, test_loss: 1.5077, test_f1: 0.6121
 epoch: 87, train_loss: 0.3466, test_loss: 1.5148, test_f1: 0.5893
 epoch: 88, train_loss: 0.3567, test_loss: 1.4666, test_f1: 0.6295
 epoch: 89, train_loss: 0.3652, test_loss: 1.5817, test_f1: 0.5797
 epoch: 90, train_loss: 0.3664, test_loss: 1.4424, test_f1: 0.6292
 epoch: 91, train_loss: 0.3615, test_loss: 1.5140, test_f1: 0.6231
 epoch: 92, train_loss: 0.3769, test_loss: 1.5205, test_f1: 0.5981
 epoch: 93, train_loss: 0.3972, test_loss: 1.8659, test_f1: 0.5543
 epoch: 94, train_loss: 0.4024, test_loss: 1.7130, test_f1: 0.5170
 epoch: 95, train_loss: 0.3718, test_loss: 2.3216, test_f1: 0.5047
 epoch: 96, train_loss: 0.3608, test_loss: 2.2078, test_f1: 0.5140
 epoch: 97, train_loss: 0.3651, test_loss: 1.8769, test_f1: 0.5456
 epoch: 98, train_loss: 0.3978, test_loss: 1.6556, test_f1: 0.6234
 epoch: 99, train_loss: 0.3814, test_loss: 1.7008, test_f1: 0.5962
##################ITERATION #4 ****************************************
 epoch: 0, train_loss: 1.3948, test_loss: 1.6215, test_f1: 0.1365
 epoch: 1, train_loss: 1.0128, test_loss: 1.6866, test_f1: 0.1365
 epoch: 2, train_loss: 0.9532, test_loss: 1.5666, test_f1: 0.2013
 epoch: 3, train_loss: 0.9154, test_loss: 1.3591, test_f1: 0.3734
 epoch: 4, train_loss: 0.8917, test_loss: 1.1994, test_f1: 0.5214
 epoch: 5, train_loss: 0.8699, test_loss: 1.1973, test_f1: 0.4974
 epoch: 6, train_loss: 0.8534, test_loss: 1.0591, test_f1: 0.5427
 epoch: 7, train_loss: 0.8263, test_loss: 1.0872, test_f1: 0.5115
 epoch: 8, train_loss: 0.8080, test_loss: 0.9917, test_f1: 0.5878
 epoch: 9, train_loss: 0.8237, test_loss: 0.9556, test_f1: 0.6050
 epoch: 10, train_loss: 0.7890, test_loss: 1.1194, test_f1: 0.5967
 epoch: 11, train_loss: 0.7911, test_loss: 1.1687, test_f1: 0.5463
 epoch: 12, train_loss: 0.8046, test_loss: 1.2508, test_f1: 0.5082
 epoch: 13, train_loss: 0.7926, test_loss: 1.3550, test_f1: 0.4122
 epoch: 14, train_loss: 0.7567, test_loss: 1.0325, test_f1: 0.5251
 epoch: 15, train_loss: 0.7455, test_loss: 1.1424, test_f1: 0.4523
 epoch: 16, train_loss: 0.7337, test_loss: 1.1120, test_f1: 0.4322
 epoch: 17, train_loss: 0.7532, test_loss: 1.1214, test_f1: 0.5553
 epoch: 18, train_loss: 0.7448, test_loss: 1.1428, test_f1: 0.5532
 epoch: 19, train_loss: 0.7409, test_loss: 1.3646, test_f1: 0.4393
 epoch: 20, train_loss: 0.7276, test_loss: 1.4863, test_f1: 0.4304
 epoch: 21, train_loss: 0.6998, test_loss: 1.3700, test_f1: 0.4802
 epoch: 22, train_loss: 0.6955, test_loss: 1.1084, test_f1: 0.5816
 epoch: 23, train_loss: 0.6684, test_loss: 1.2802, test_f1: 0.4905
 epoch: 24, train_loss: 0.6647, test_loss: 1.3539, test_f1: 0.5097
 epoch: 25, train_loss: 0.6517, test_loss: 1.0908, test_f1: 0.5368
 epoch: 26, train_loss: 0.6709, test_loss: 1.1803, test_f1: 0.5809
 epoch: 27, train_loss: 0.6615, test_loss: 1.3573, test_f1: 0.5450
 epoch: 28, train_loss: 0.6497, test_loss: 1.3821, test_f1: 0.4720
 epoch: 29, train_loss: 0.6573, test_loss: 1.1309, test_f1: 0.5931
 epoch: 30, train_loss: 0.6693, test_loss: 1.1425, test_f1: 0.5818
 epoch: 31, train_loss: 0.6504, test_loss: 1.2558, test_f1: 0.5660
 epoch: 32, train_loss: 0.6369, test_loss: 1.5355, test_f1: 0.4797
 epoch: 33, train_loss: 0.6352, test_loss: 1.4317, test_f1: 0.3921
 epoch: 34, train_loss: 0.6120, test_loss: 1.3307, test_f1: 0.5329
 epoch: 35, train_loss: 0.6089, test_loss: 1.4218, test_f1: 0.5964
 epoch: 36, train_loss: 0.6030, test_loss: 1.2440, test_f1: 0.5692
 epoch: 37, train_loss: 0.6091, test_loss: 1.7136, test_f1: 0.4821
 epoch: 38, train_loss: 0.5960, test_loss: 1.9529, test_f1: 0.4806
 epoch: 39, train_loss: 0.6116, test_loss: 1.3781, test_f1: 0.5742
 epoch: 40, train_loss: 0.5891, test_loss: 1.4140, test_f1: 0.4372
 epoch: 41, train_loss: 0.5639, test_loss: 1.1481, test_f1: 0.5822
 epoch: 42, train_loss: 0.5880, test_loss: 1.1592, test_f1: 0.5722
 epoch: 43, train_loss: 0.5902, test_loss: 1.2134, test_f1: 0.5729
 epoch: 44, train_loss: 0.5815, test_loss: 1.3975, test_f1: 0.5830
 epoch: 45, train_loss: 0.5779, test_loss: 1.1868, test_f1: 0.5390
 epoch: 46, train_loss: 0.5769, test_loss: 1.6370, test_f1: 0.5221
 epoch: 47, train_loss: 0.5584, test_loss: 1.8355, test_f1: 0.5065
 epoch: 48, train_loss: 0.5589, test_loss: 1.7380, test_f1: 0.5148
 epoch: 49, train_loss: 0.5972, test_loss: 1.4413, test_f1: 0.5450
 epoch: 50, train_loss: 0.5841, test_loss: 1.8404, test_f1: 0.4577
 epoch: 51, train_loss: 0.5251, test_loss: 1.5787, test_f1: 0.5460
 epoch: 52, train_loss: 0.5193, test_loss: 1.5678, test_f1: 0.5808
 epoch: 53, train_loss: 0.4861, test_loss: 1.2874, test_f1: 0.5781
 epoch: 54, train_loss: 0.4995, test_loss: 1.5327, test_f1: 0.5372
 epoch: 55, train_loss: 0.4735, test_loss: 1.8496, test_f1: 0.5459
 epoch: 56, train_loss: 0.4525, test_loss: 1.4878, test_f1: 0.6035
 epoch: 57, train_loss: 0.4668, test_loss: 1.3889, test_f1: 0.6449
 epoch: 58, train_loss: 0.4757, test_loss: 1.3544, test_f1: 0.6087
 epoch: 59, train_loss: 0.4653, test_loss: 1.3866, test_f1: 0.5844
 epoch: 60, train_loss: 0.4673, test_loss: 1.3182, test_f1: 0.5926
 epoch: 61, train_loss: 0.4744, test_loss: 1.3520, test_f1: 0.5186
 epoch: 62, train_loss: 0.4871, test_loss: 1.4288, test_f1: 0.6110
 epoch: 63, train_loss: 0.4313, test_loss: 1.5506, test_f1: 0.5798
 epoch: 64, train_loss: 0.4368, test_loss: 1.5751, test_f1: 0.6187
 epoch: 65, train_loss: 0.4226, test_loss: 1.6292, test_f1: 0.6255
 epoch: 66, train_loss: 0.4107, test_loss: 1.5540, test_f1: 0.6319
 epoch: 67, train_loss: 0.4258, test_loss: 1.7422, test_f1: 0.6564
 epoch: 68, train_loss: 0.4126, test_loss: 1.8293, test_f1: 0.6122
 epoch: 69, train_loss: 0.3955, test_loss: 1.7631, test_f1: 0.6202
 epoch: 70, train_loss: 0.3973, test_loss: 1.6392, test_f1: 0.6190
 epoch: 71, train_loss: 0.4021, test_loss: 1.8051, test_f1: 0.5761
 epoch: 72, train_loss: 0.3859, test_loss: 1.9220, test_f1: 0.6186
 epoch: 73, train_loss: 0.4282, test_loss: 1.8603, test_f1: 0.6209
 epoch: 74, train_loss: 0.4109, test_loss: 1.9517, test_f1: 0.6043
 epoch: 75, train_loss: 0.3916, test_loss: 2.0150, test_f1: 0.5929
 epoch: 76, train_loss: 0.3677, test_loss: 1.9707, test_f1: 0.5975
 epoch: 77, train_loss: 0.3847, test_loss: 1.7720, test_f1: 0.6373
 epoch: 78, train_loss: 0.3972, test_loss: 2.0097, test_f1: 0.5585
 epoch: 79, train_loss: 0.4112, test_loss: 2.1371, test_f1: 0.5696
 epoch: 80, train_loss: 0.4332, test_loss: 1.6981, test_f1: 0.6284
 epoch: 81, train_loss: 0.3885, test_loss: 1.7397, test_f1: 0.6126
 epoch: 82, train_loss: 0.3799, test_loss: 1.8824, test_f1: 0.6291
 epoch: 83, train_loss: 0.3693, test_loss: 1.9878, test_f1: 0.6007
 epoch: 84, train_loss: 0.3943, test_loss: 2.1099, test_f1: 0.6106
 epoch: 85, train_loss: 0.3736, test_loss: 2.0178, test_f1: 0.5843
 epoch: 86, train_loss: 0.3636, test_loss: 1.9286, test_f1: 0.5903
 epoch: 87, train_loss: 0.3396, test_loss: 1.8994, test_f1: 0.5909
 epoch: 88, train_loss: 0.3609, test_loss: 2.3611, test_f1: 0.6014
 epoch: 89, train_loss: 0.3326, test_loss: 1.8522, test_f1: 0.6748
 epoch: 90, train_loss: 0.3380, test_loss: 2.0362, test_f1: 0.6398
 epoch: 91, train_loss: 0.3538, test_loss: 2.0155, test_f1: 0.5998
 epoch: 92, train_loss: 0.3705, test_loss: 2.2378, test_f1: 0.5450
 epoch: 93, train_loss: 0.4011, test_loss: 2.6076, test_f1: 0.5805
 epoch: 94, train_loss: 0.4074, test_loss: 1.8393, test_f1: 0.6321
 epoch: 95, train_loss: 0.4161, test_loss: 1.7614, test_f1: 0.5511
 epoch: 96, train_loss: 0.3652, test_loss: 2.0520, test_f1: 0.5516
 epoch: 97, train_loss: 0.3550, test_loss: 1.7597, test_f1: 0.6161
 epoch: 98, train_loss: 0.3822, test_loss: 1.7562, test_f1: 0.6128
 epoch: 99, train_loss: 0.4114, test_loss: 3.0573, test_f1: 0.4447
##################ITERATION #5 ****************************************
 epoch: 0, train_loss: 1.3106, test_loss: 1.5016, test_f1: 0.1365
 epoch: 1, train_loss: 1.0178, test_loss: 1.3411, test_f1: 0.2825
 epoch: 2, train_loss: 0.9614, test_loss: 1.2485, test_f1: 0.3398
 epoch: 3, train_loss: 0.9419, test_loss: 1.1696, test_f1: 0.4533
 epoch: 4, train_loss: 0.9012, test_loss: 1.1335, test_f1: 0.4750
 epoch: 5, train_loss: 0.8747, test_loss: 1.1661, test_f1: 0.5128
 epoch: 6, train_loss: 0.8569, test_loss: 1.0908, test_f1: 0.5789
 epoch: 7, train_loss: 0.8336, test_loss: 1.0823, test_f1: 0.5157
 epoch: 8, train_loss: 0.8374, test_loss: 1.1365, test_f1: 0.5148
 epoch: 9, train_loss: 0.8361, test_loss: 1.0680, test_f1: 0.5264
 epoch: 10, train_loss: 0.8123, test_loss: 1.0273, test_f1: 0.5220
 epoch: 11, train_loss: 0.8149, test_loss: 1.1298, test_f1: 0.4575
 epoch: 12, train_loss: 0.7990, test_loss: 1.0491, test_f1: 0.5782
 epoch: 13, train_loss: 0.7672, test_loss: 1.1654, test_f1: 0.3988
 epoch: 14, train_loss: 0.7967, test_loss: 1.0383, test_f1: 0.5135
 epoch: 15, train_loss: 0.7730, test_loss: 1.0258, test_f1: 0.6036
 epoch: 16, train_loss: 0.7660, test_loss: 0.9977, test_f1: 0.5198
 epoch: 17, train_loss: 0.7577, test_loss: 1.1224, test_f1: 0.4774
 epoch: 18, train_loss: 0.7377, test_loss: 1.5234, test_f1: 0.3914
 epoch: 19, train_loss: 0.7492, test_loss: 2.1700, test_f1: 0.3519
 epoch: 20, train_loss: 0.7503, test_loss: 1.0209, test_f1: 0.5681
 epoch: 21, train_loss: 0.7145, test_loss: 1.1311, test_f1: 0.5353
 epoch: 22, train_loss: 0.7272, test_loss: 1.0344, test_f1: 0.5288
 epoch: 23, train_loss: 0.7139, test_loss: 2.3693, test_f1: 0.3069
 epoch: 24, train_loss: 0.6970, test_loss: 2.1255, test_f1: 0.4164
 epoch: 25, train_loss: 0.6749, test_loss: 1.4938, test_f1: 0.3996
 epoch: 26, train_loss: 0.7070, test_loss: 1.0193, test_f1: 0.5589
 epoch: 27, train_loss: 0.6892, test_loss: 1.1410, test_f1: 0.5257
 epoch: 28, train_loss: 0.6532, test_loss: 1.0600, test_f1: 0.5414
 epoch: 29, train_loss: 0.6228, test_loss: 1.1156, test_f1: 0.5605
 epoch: 30, train_loss: 0.6370, test_loss: 1.3542, test_f1: 0.5294
 epoch: 31, train_loss: 0.6186, test_loss: 1.4455, test_f1: 0.4319
 epoch: 32, train_loss: 0.6344, test_loss: 1.3577, test_f1: 0.5434
 epoch: 33, train_loss: 0.6656, test_loss: 1.3097, test_f1: 0.4961
 epoch: 34, train_loss: 0.7027, test_loss: 1.5509, test_f1: 0.4999
 epoch: 35, train_loss: 0.6365, test_loss: 1.1739, test_f1: 0.5113
 epoch: 36, train_loss: 0.6480, test_loss: 1.1648, test_f1: 0.5381
 epoch: 37, train_loss: 0.6434, test_loss: 1.1590, test_f1: 0.5508
 epoch: 38, train_loss: 0.6373, test_loss: 1.1342, test_f1: 0.5460
 epoch: 39, train_loss: 0.6290, test_loss: 1.2966, test_f1: 0.5319
 epoch: 40, train_loss: 0.6144, test_loss: 1.1952, test_f1: 0.5289
 epoch: 41, train_loss: 0.5990, test_loss: 1.3292, test_f1: 0.5282
 epoch: 42, train_loss: 0.5874, test_loss: 1.2866, test_f1: 0.5576
 epoch: 43, train_loss: 0.6004, test_loss: 1.1256, test_f1: 0.5282
 epoch: 44, train_loss: 0.6323, test_loss: 1.1237, test_f1: 0.5718
 epoch: 45, train_loss: 0.5953, test_loss: 1.2418, test_f1: 0.4664
 epoch: 46, train_loss: 0.5853, test_loss: 1.2192, test_f1: 0.5787
 epoch: 47, train_loss: 0.5775, test_loss: 1.2604, test_f1: 0.5654
 epoch: 48, train_loss: 0.5652, test_loss: 1.5068, test_f1: 0.5467
 epoch: 49, train_loss: 0.5673, test_loss: 1.1387, test_f1: 0.5935
 epoch: 50, train_loss: 0.5466, test_loss: 1.2404, test_f1: 0.5687
 epoch: 51, train_loss: 0.5138, test_loss: 1.1961, test_f1: 0.5901
 epoch: 52, train_loss: 0.5212, test_loss: 1.2233, test_f1: 0.5603
 epoch: 53, train_loss: 0.4922, test_loss: 1.1378, test_f1: 0.5575
 epoch: 54, train_loss: 0.4666, test_loss: 1.1606, test_f1: 0.6002
 epoch: 55, train_loss: 0.4542, test_loss: 1.2053, test_f1: 0.6106
 epoch: 56, train_loss: 0.4599, test_loss: 1.3102, test_f1: 0.5654
 epoch: 57, train_loss: 0.4677, test_loss: 1.3317, test_f1: 0.5939
 epoch: 58, train_loss: 0.4602, test_loss: 1.3974, test_f1: 0.5948
 epoch: 59, train_loss: 0.4510, test_loss: 1.4579, test_f1: 0.5672
 epoch: 60, train_loss: 0.4319, test_loss: 1.3842, test_f1: 0.6050
 epoch: 61, train_loss: 0.4399, test_loss: 1.5812, test_f1: 0.5860
 epoch: 62, train_loss: 0.4628, test_loss: 1.4099, test_f1: 0.6252
 epoch: 63, train_loss: 0.4666, test_loss: 1.5494, test_f1: 0.5859
 epoch: 64, train_loss: 0.4457, test_loss: 1.3929, test_f1: 0.5802
 epoch: 65, train_loss: 0.4183, test_loss: 1.3289, test_f1: 0.5784
 epoch: 66, train_loss: 0.4042, test_loss: 1.3975, test_f1: 0.6078
 epoch: 67, train_loss: 0.4002, test_loss: 1.4364, test_f1: 0.5759
 epoch: 68, train_loss: 0.4023, test_loss: 1.6157, test_f1: 0.5663
 epoch: 69, train_loss: 0.4020, test_loss: 1.4358, test_f1: 0.5614
 epoch: 70, train_loss: 0.4177, test_loss: 1.2906, test_f1: 0.5780
 epoch: 71, train_loss: 0.4430, test_loss: 1.3626, test_f1: 0.6102
 epoch: 72, train_loss: 0.3975, test_loss: 1.2577, test_f1: 0.6013
 epoch: 73, train_loss: 0.4143, test_loss: 1.4523, test_f1: 0.5453
 epoch: 74, train_loss: 0.4103, test_loss: 1.4994, test_f1: 0.5492
 epoch: 75, train_loss: 0.4082, test_loss: 1.3998, test_f1: 0.6078
 epoch: 76, train_loss: 0.3731, test_loss: 1.4406, test_f1: 0.5581
 epoch: 77, train_loss: 0.3893, test_loss: 1.5256, test_f1: 0.5582
 epoch: 78, train_loss: 0.3683, test_loss: 1.8109, test_f1: 0.5854
 epoch: 79, train_loss: 0.3790, test_loss: 1.6518, test_f1: 0.5713
 epoch: 80, train_loss: 0.3905, test_loss: 1.5775, test_f1: 0.5573
 epoch: 81, train_loss: 0.4187, test_loss: 1.5165, test_f1: 0.5754
 epoch: 82, train_loss: 0.4428, test_loss: 1.8534, test_f1: 0.5634
 epoch: 83, train_loss: 0.3902, test_loss: 1.5971, test_f1: 0.5884
 epoch: 84, train_loss: 0.3858, test_loss: 1.5430, test_f1: 0.5689
 epoch: 85, train_loss: 0.4026, test_loss: 1.3863, test_f1: 0.6067
 epoch: 86, train_loss: 0.3720, test_loss: 1.4291, test_f1: 0.6276
 epoch: 87, train_loss: 0.3841, test_loss: 1.3894, test_f1: 0.6086
 epoch: 88, train_loss: 0.3531, test_loss: 1.4990, test_f1: 0.5631
 epoch: 89, train_loss: 0.3365, test_loss: 1.7277, test_f1: 0.6008
 epoch: 90, train_loss: 0.3598, test_loss: 1.8710, test_f1: 0.6012
 epoch: 91, train_loss: 0.3596, test_loss: 1.8291, test_f1: 0.5809
 epoch: 92, train_loss: 0.3511, test_loss: 1.6875, test_f1: 0.5619
 epoch: 93, train_loss: 0.3466, test_loss: 1.8858, test_f1: 0.5762
 epoch: 94, train_loss: 0.3454, test_loss: 1.9874, test_f1: 0.6018
 epoch: 95, train_loss: 0.3849, test_loss: 1.9530, test_f1: 0.6106
 epoch: 96, train_loss: 0.3526, test_loss: 1.9328, test_f1: 0.5544
 epoch: 97, train_loss: 0.3552, test_loss: 1.7178, test_f1: 0.5952
 epoch: 98, train_loss: 0.4100, test_loss: 1.5850, test_f1: 0.5800
 epoch: 99, train_loss: 0.3585, test_loss: 1.6600, test_f1: 0.5851
##################ITERATION #6 ****************************************
 epoch: 0, train_loss: 1.4690, test_loss: 1.4286, test_f1: 0.2722
 epoch: 1, train_loss: 1.0322, test_loss: 1.3413, test_f1: 0.3278
 epoch: 2, train_loss: 0.9603, test_loss: 1.2795, test_f1: 0.4113
 epoch: 3, train_loss: 0.9178, test_loss: 1.2329, test_f1: 0.4181
 epoch: 4, train_loss: 0.8841, test_loss: 1.1346, test_f1: 0.4446
 epoch: 5, train_loss: 0.8784, test_loss: 1.1022, test_f1: 0.5025
 epoch: 6, train_loss: 0.8582, test_loss: 1.0445, test_f1: 0.5373
 epoch: 7, train_loss: 0.8507, test_loss: 1.0580, test_f1: 0.5373
 epoch: 8, train_loss: 0.8465, test_loss: 1.0245, test_f1: 0.5117
 epoch: 9, train_loss: 0.8083, test_loss: 1.4073, test_f1: 0.3119
 epoch: 10, train_loss: 0.8215, test_loss: 1.0620, test_f1: 0.5464
 epoch: 11, train_loss: 0.7967, test_loss: 1.0291, test_f1: 0.5328
 epoch: 12, train_loss: 0.8059, test_loss: 1.0099, test_f1: 0.5267
 epoch: 13, train_loss: 0.7715, test_loss: 1.4306, test_f1: 0.4189
 epoch: 14, train_loss: 0.7895, test_loss: 1.1337, test_f1: 0.5631
 epoch: 15, train_loss: 0.7604, test_loss: 1.1755, test_f1: 0.4621
 epoch: 16, train_loss: 0.7653, test_loss: 1.1375, test_f1: 0.5350
 epoch: 17, train_loss: 0.7416, test_loss: 1.6474, test_f1: 0.4664
 epoch: 18, train_loss: 0.7356, test_loss: 1.1628, test_f1: 0.5742
 epoch: 19, train_loss: 0.7099, test_loss: 1.1025, test_f1: 0.5684
 epoch: 20, train_loss: 0.7027, test_loss: 1.1290, test_f1: 0.5217
 epoch: 21, train_loss: 0.7163, test_loss: 1.1885, test_f1: 0.5363
 epoch: 22, train_loss: 0.7404, test_loss: 1.1273, test_f1: 0.5007
 epoch: 23, train_loss: 0.7166, test_loss: 1.1142, test_f1: 0.4388
 epoch: 24, train_loss: 0.6775, test_loss: 0.9809, test_f1: 0.5793
 epoch: 25, train_loss: 0.6811, test_loss: 1.0009, test_f1: 0.5503
 epoch: 26, train_loss: 0.7018, test_loss: 1.1174, test_f1: 0.5618
 epoch: 27, train_loss: 0.6853, test_loss: 0.9895, test_f1: 0.6496
 epoch: 28, train_loss: 0.6746, test_loss: 1.4893, test_f1: 0.5291
 epoch: 29, train_loss: 0.6774, test_loss: 1.5661, test_f1: 0.4478
 epoch: 30, train_loss: 0.6336, test_loss: 1.2533, test_f1: 0.5215
 epoch: 31, train_loss: 0.6312, test_loss: 1.3391, test_f1: 0.4811
 epoch: 32, train_loss: 0.6579, test_loss: 1.0746, test_f1: 0.5900
 epoch: 33, train_loss: 0.6617, test_loss: 1.2533, test_f1: 0.4472
 epoch: 34, train_loss: 0.6457, test_loss: 1.0720, test_f1: 0.6040
 epoch: 35, train_loss: 0.6212, test_loss: 1.2526, test_f1: 0.5100
 epoch: 36, train_loss: 0.6163, test_loss: 1.0329, test_f1: 0.5492
 epoch: 37, train_loss: 0.6055, test_loss: 1.2978, test_f1: 0.4889
 epoch: 38, train_loss: 0.6196, test_loss: 2.1630, test_f1: 0.4893
 epoch: 39, train_loss: 0.6242, test_loss: 1.1166, test_f1: 0.6096
 epoch: 40, train_loss: 0.6185, test_loss: 1.0877, test_f1: 0.6202
 epoch: 41, train_loss: 0.5957, test_loss: 1.2254, test_f1: 0.5413
 epoch: 42, train_loss: 0.6195, test_loss: 1.0200, test_f1: 0.6141
 epoch: 43, train_loss: 0.6051, test_loss: 1.3668, test_f1: 0.4451
 epoch: 44, train_loss: 0.5873, test_loss: 1.0790, test_f1: 0.5787
 epoch: 45, train_loss: 0.6076, test_loss: 1.1994, test_f1: 0.5710
 epoch: 46, train_loss: 0.5798, test_loss: 1.0097, test_f1: 0.6236
 epoch: 47, train_loss: 0.5618, test_loss: 1.0723, test_f1: 0.6198
 epoch: 48, train_loss: 0.5569, test_loss: 1.1494, test_f1: 0.5606
 epoch: 49, train_loss: 0.5852, test_loss: 1.0716, test_f1: 0.6029
 epoch: 50, train_loss: 0.5899, test_loss: 1.4687, test_f1: 0.5535
 epoch: 51, train_loss: 0.5746, test_loss: 1.3553, test_f1: 0.6101
 epoch: 52, train_loss: 0.5424, test_loss: 1.4491, test_f1: 0.5822
 epoch: 53, train_loss: 0.5347, test_loss: 1.2824, test_f1: 0.5863
 epoch: 54, train_loss: 0.5383, test_loss: 1.2484, test_f1: 0.6094
 epoch: 55, train_loss: 0.5090, test_loss: 1.1722, test_f1: 0.6131
 epoch: 56, train_loss: 0.5243, test_loss: 1.0815, test_f1: 0.6099
 epoch: 57, train_loss: 0.4980, test_loss: 1.0730, test_f1: 0.6206
 epoch: 58, train_loss: 0.4882, test_loss: 1.1783, test_f1: 0.5986
 epoch: 59, train_loss: 0.4995, test_loss: 1.2788, test_f1: 0.5527
 epoch: 60, train_loss: 0.4472, test_loss: 1.1294, test_f1: 0.6400
 epoch: 61, train_loss: 0.4620, test_loss: 1.3057, test_f1: 0.5773
 epoch: 62, train_loss: 0.4386, test_loss: 1.4101, test_f1: 0.5699
 epoch: 63, train_loss: 0.4492, test_loss: 1.2980, test_f1: 0.5948
 epoch: 64, train_loss: 0.4500, test_loss: 1.2962, test_f1: 0.6142
 epoch: 65, train_loss: 0.4326, test_loss: 1.2179, test_f1: 0.5923
 epoch: 66, train_loss: 0.5038, test_loss: 1.2069, test_f1: 0.5898
 epoch: 67, train_loss: 0.5270, test_loss: 1.5624, test_f1: 0.5417
 epoch: 68, train_loss: 0.4892, test_loss: 1.2155, test_f1: 0.6409
 epoch: 69, train_loss: 0.5045, test_loss: 1.3913, test_f1: 0.6090
 epoch: 70, train_loss: 0.4796, test_loss: 1.1632, test_f1: 0.6196
 epoch: 71, train_loss: 0.4539, test_loss: 1.1276, test_f1: 0.6222
 epoch: 72, train_loss: 0.5095, test_loss: 1.3941, test_f1: 0.5427
 epoch: 73, train_loss: 0.4567, test_loss: 1.2147, test_f1: 0.5942
 epoch: 74, train_loss: 0.4272, test_loss: 1.0950, test_f1: 0.6436
 epoch: 75, train_loss: 0.4066, test_loss: 1.1473, test_f1: 0.6658
 epoch: 76, train_loss: 0.4222, test_loss: 1.1460, test_f1: 0.6612
 epoch: 77, train_loss: 0.4218, test_loss: 1.3469, test_f1: 0.5979
 epoch: 78, train_loss: 0.4410, test_loss: 1.4277, test_f1: 0.5696
 epoch: 79, train_loss: 0.4398, test_loss: 1.3072, test_f1: 0.6243
 epoch: 80, train_loss: 0.4385, test_loss: 1.1832, test_f1: 0.6671
 epoch: 81, train_loss: 0.4270, test_loss: 1.2712, test_f1: 0.6235
 epoch: 82, train_loss: 0.4053, test_loss: 1.4312, test_f1: 0.6089
 epoch: 83, train_loss: 0.4209, test_loss: 1.2291, test_f1: 0.6142
 epoch: 84, train_loss: 0.4086, test_loss: 1.1890, test_f1: 0.6459
 epoch: 85, train_loss: 0.3942, test_loss: 1.1787, test_f1: 0.6474
 epoch: 86, train_loss: 0.3924, test_loss: 1.2852, test_f1: 0.6206
 epoch: 87, train_loss: 0.4039, test_loss: 1.3816, test_f1: 0.6385
 epoch: 88, train_loss: 0.3907, test_loss: 1.3229, test_f1: 0.6292
 epoch: 89, train_loss: 0.3882, test_loss: 1.1758, test_f1: 0.6424
 epoch: 90, train_loss: 0.3878, test_loss: 1.2526, test_f1: 0.6030
 epoch: 91, train_loss: 0.3923, test_loss: 1.2271, test_f1: 0.6020
 epoch: 92, train_loss: 0.3895, test_loss: 1.2419, test_f1: 0.6055
 epoch: 93, train_loss: 0.3586, test_loss: 1.2540, test_f1: 0.6337
 epoch: 94, train_loss: 0.3693, test_loss: 1.2212, test_f1: 0.6258
 epoch: 95, train_loss: 0.3663, test_loss: 1.2849, test_f1: 0.6352
 epoch: 96, train_loss: 0.3781, test_loss: 1.3374, test_f1: 0.6157
 epoch: 97, train_loss: 0.3877, test_loss: 1.4058, test_f1: 0.6268
 epoch: 98, train_loss: 0.4150, test_loss: 1.4976, test_f1: 0.6064
 epoch: 99, train_loss: 0.3612, test_loss: 1.6148, test_f1: 0.6105
##################ITERATION #7 ****************************************
 epoch: 0, train_loss: 1.5148, test_loss: 1.5415, test_f1: 0.1365
 epoch: 1, train_loss: 1.0251, test_loss: 1.4223, test_f1: 0.3414
 epoch: 2, train_loss: 0.9679, test_loss: 1.3840, test_f1: 0.2583
 epoch: 3, train_loss: 0.9443, test_loss: 1.2190, test_f1: 0.3291
 epoch: 4, train_loss: 0.9078, test_loss: 1.0989, test_f1: 0.4626
 epoch: 5, train_loss: 0.8936, test_loss: 1.1385, test_f1: 0.4154
 epoch: 6, train_loss: 0.8807, test_loss: 1.0297, test_f1: 0.5407
 epoch: 7, train_loss: 0.8409, test_loss: 1.0203, test_f1: 0.5301
 epoch: 8, train_loss: 0.8403, test_loss: 1.0708, test_f1: 0.4752
 epoch: 9, train_loss: 0.8335, test_loss: 1.0796, test_f1: 0.5219
 epoch: 10, train_loss: 0.8145, test_loss: 0.9733, test_f1: 0.5663
 epoch: 11, train_loss: 0.7894, test_loss: 1.0628, test_f1: 0.5256
 epoch: 12, train_loss: 0.8074, test_loss: 1.0027, test_f1: 0.5492
 epoch: 13, train_loss: 0.8022, test_loss: 1.1336, test_f1: 0.4807
 epoch: 14, train_loss: 0.7699, test_loss: 1.0563, test_f1: 0.5330
 epoch: 15, train_loss: 0.7793, test_loss: 1.1280, test_f1: 0.4587
 epoch: 16, train_loss: 0.7596, test_loss: 1.5026, test_f1: 0.4266
 epoch: 17, train_loss: 0.7336, test_loss: 1.1258, test_f1: 0.5315
 epoch: 18, train_loss: 0.7445, test_loss: 1.0976, test_f1: 0.5408
 epoch: 19, train_loss: 0.7134, test_loss: 1.1900, test_f1: 0.4899
 epoch: 20, train_loss: 0.7009, test_loss: 1.3801, test_f1: 0.4177
 epoch: 21, train_loss: 0.7354, test_loss: 1.1013, test_f1: 0.5929
 epoch: 22, train_loss: 0.7268, test_loss: 1.3392, test_f1: 0.3780
 epoch: 23, train_loss: 0.6972, test_loss: 1.1750, test_f1: 0.4781
 epoch: 24, train_loss: 0.6816, test_loss: 1.3700, test_f1: 0.4789
 epoch: 25, train_loss: 0.6374, test_loss: 1.0898, test_f1: 0.5787
 epoch: 26, train_loss: 0.6372, test_loss: 1.2391, test_f1: 0.4735
 epoch: 27, train_loss: 0.6490, test_loss: 1.0215, test_f1: 0.5626
 epoch: 28, train_loss: 0.7291, test_loss: 2.4920, test_f1: 0.3802
 epoch: 29, train_loss: 0.6603, test_loss: 2.3505, test_f1: 0.3241
 epoch: 30, train_loss: 0.6468, test_loss: 1.1257, test_f1: 0.5269
 epoch: 31, train_loss: 0.6467, test_loss: 1.0920, test_f1: 0.5331
 epoch: 32, train_loss: 0.6878, test_loss: 1.1199, test_f1: 0.5230
 epoch: 33, train_loss: 0.6438, test_loss: 1.0476, test_f1: 0.5505
 epoch: 34, train_loss: 0.6059, test_loss: 1.0194, test_f1: 0.5988
 epoch: 35, train_loss: 0.6128, test_loss: 1.2388, test_f1: 0.4557
 epoch: 36, train_loss: 0.5871, test_loss: 1.1074, test_f1: 0.5705
 epoch: 37, train_loss: 0.5955, test_loss: 1.2066, test_f1: 0.5534
 epoch: 38, train_loss: 0.6072, test_loss: 1.3174, test_f1: 0.5475
 epoch: 39, train_loss: 0.5741, test_loss: 1.1805, test_f1: 0.5467
 epoch: 40, train_loss: 0.5458, test_loss: 1.2049, test_f1: 0.5141
 epoch: 41, train_loss: 0.5793, test_loss: 1.1636, test_f1: 0.5857
 epoch: 42, train_loss: 0.5653, test_loss: 1.2429, test_f1: 0.5342
 epoch: 43, train_loss: 0.5852, test_loss: 1.1365, test_f1: 0.6108
 epoch: 44, train_loss: 0.6505, test_loss: 1.4158, test_f1: 0.4956
 epoch: 45, train_loss: 0.6063, test_loss: 1.6384, test_f1: 0.4725
 epoch: 46, train_loss: 0.5882, test_loss: 1.1125, test_f1: 0.5648
 epoch: 47, train_loss: 0.5917, test_loss: 1.0969, test_f1: 0.5952
 epoch: 48, train_loss: 0.5681, test_loss: 1.1324, test_f1: 0.6138
 epoch: 49, train_loss: 0.5458, test_loss: 1.2550, test_f1: 0.5532
 epoch: 50, train_loss: 0.5279, test_loss: 1.4193, test_f1: 0.5226
 epoch: 51, train_loss: 0.5468, test_loss: 1.2324, test_f1: 0.6098
 epoch: 52, train_loss: 0.5302, test_loss: 1.1880, test_f1: 0.6375
 epoch: 53, train_loss: 0.5131, test_loss: 1.1797, test_f1: 0.6059
 epoch: 54, train_loss: 0.5056, test_loss: 1.2942, test_f1: 0.5598
 epoch: 55, train_loss: 0.5023, test_loss: 1.2760, test_f1: 0.5637
 epoch: 56, train_loss: 0.4803, test_loss: 1.4306, test_f1: 0.5201
 epoch: 57, train_loss: 0.4745, test_loss: 1.4826, test_f1: 0.5617
 epoch: 58, train_loss: 0.5175, test_loss: 1.4979, test_f1: 0.5695
 epoch: 59, train_loss: 0.4886, test_loss: 1.4327, test_f1: 0.5640
 epoch: 60, train_loss: 0.4624, test_loss: 1.2022, test_f1: 0.5994
 epoch: 61, train_loss: 0.4830, test_loss: 1.1511, test_f1: 0.6187
 epoch: 62, train_loss: 0.4384, test_loss: 1.1997, test_f1: 0.6037
 epoch: 63, train_loss: 0.4346, test_loss: 1.2916, test_f1: 0.5834
 epoch: 64, train_loss: 0.4117, test_loss: 1.3610, test_f1: 0.5656
 epoch: 65, train_loss: 0.4237, test_loss: 1.3424, test_f1: 0.5712
 epoch: 66, train_loss: 0.4285, test_loss: 1.5161, test_f1: 0.5608
 epoch: 67, train_loss: 0.4198, test_loss: 1.7195, test_f1: 0.5497
 epoch: 68, train_loss: 0.4380, test_loss: 1.5025, test_f1: 0.6029
 epoch: 69, train_loss: 0.4277, test_loss: 1.2619, test_f1: 0.5898
 epoch: 70, train_loss: 0.4245, test_loss: 1.2743, test_f1: 0.5792
 epoch: 71, train_loss: 0.4255, test_loss: 1.2723, test_f1: 0.6323
 epoch: 72, train_loss: 0.4030, test_loss: 1.3725, test_f1: 0.5948
 epoch: 73, train_loss: 0.4095, test_loss: 1.3635, test_f1: 0.6257
 epoch: 74, train_loss: 0.4222, test_loss: 1.7543, test_f1: 0.5933
 epoch: 75, train_loss: 0.4267, test_loss: 1.6844, test_f1: 0.5879
 epoch: 76, train_loss: 0.4298, test_loss: 1.4901, test_f1: 0.6078
 epoch: 77, train_loss: 0.4340, test_loss: 1.4998, test_f1: 0.6320
 epoch: 78, train_loss: 0.4200, test_loss: 1.4112, test_f1: 0.5841
 epoch: 79, train_loss: 0.4060, test_loss: 1.4092, test_f1: 0.6304
 epoch: 80, train_loss: 0.3979, test_loss: 1.3948, test_f1: 0.6229
 epoch: 81, train_loss: 0.3813, test_loss: 1.5182, test_f1: 0.5782
 epoch: 82, train_loss: 0.3710, test_loss: 1.5958, test_f1: 0.6180
 epoch: 83, train_loss: 0.3557, test_loss: 1.5253, test_f1: 0.6118
 epoch: 84, train_loss: 0.3747, test_loss: 1.6238, test_f1: 0.6188
 epoch: 85, train_loss: 0.3581, test_loss: 1.3644, test_f1: 0.6754
 epoch: 86, train_loss: 0.3505, test_loss: 1.3735, test_f1: 0.6567
 epoch: 87, train_loss: 0.3504, test_loss: 1.5978, test_f1: 0.6025
 epoch: 88, train_loss: 0.3872, test_loss: 1.8790, test_f1: 0.6189
 epoch: 89, train_loss: 0.3761, test_loss: 1.7145, test_f1: 0.5907
 epoch: 90, train_loss: 0.3518, test_loss: 1.6962, test_f1: 0.6449
 epoch: 91, train_loss: 0.3763, test_loss: 1.5208, test_f1: 0.6039
 epoch: 92, train_loss: 0.3558, test_loss: 1.9093, test_f1: 0.6033
 epoch: 93, train_loss: 0.3352, test_loss: 1.8599, test_f1: 0.5703
 epoch: 94, train_loss: 0.3412, test_loss: 1.6019, test_f1: 0.6166
 epoch: 95, train_loss: 0.3735, test_loss: 1.5788, test_f1: 0.5845
 epoch: 96, train_loss: 0.3417, test_loss: 1.6527, test_f1: 0.5894
 epoch: 97, train_loss: 0.3200, test_loss: 1.6221, test_f1: 0.6303
 epoch: 98, train_loss: 0.3212, test_loss: 1.5668, test_f1: 0.6340
 epoch: 99, train_loss: 0.3492, test_loss: 1.4477, test_f1: 0.6016
##################ITERATION #8 ****************************************
 epoch: 0, train_loss: 1.4015, test_loss: 1.4455, test_f1: 0.2720
 epoch: 1, train_loss: 1.0053, test_loss: 1.3971, test_f1: 0.2583
 epoch: 2, train_loss: 0.9819, test_loss: 1.3818, test_f1: 0.2790
 epoch: 3, train_loss: 0.9277, test_loss: 1.2294, test_f1: 0.3735
 epoch: 4, train_loss: 0.9107, test_loss: 1.1624, test_f1: 0.4089
 epoch: 5, train_loss: 0.8880, test_loss: 1.0188, test_f1: 0.5422
 epoch: 6, train_loss: 0.8624, test_loss: 1.0200, test_f1: 0.5251
 epoch: 7, train_loss: 0.8471, test_loss: 1.0300, test_f1: 0.5381
 epoch: 8, train_loss: 0.8413, test_loss: 1.1118, test_f1: 0.4226
 epoch: 9, train_loss: 0.8254, test_loss: 0.9790, test_f1: 0.5880
 epoch: 10, train_loss: 0.8053, test_loss: 1.0413, test_f1: 0.4956
 epoch: 11, train_loss: 0.8048, test_loss: 0.9935, test_f1: 0.5832
 epoch: 12, train_loss: 0.7733, test_loss: 1.3285, test_f1: 0.4271
 epoch: 13, train_loss: 0.7649, test_loss: 1.3503, test_f1: 0.3892
 epoch: 14, train_loss: 0.7472, test_loss: 1.2198, test_f1: 0.4278
 epoch: 15, train_loss: 0.7301, test_loss: 1.5226, test_f1: 0.4019
 epoch: 16, train_loss: 0.7361, test_loss: 1.8738, test_f1: 0.3721
 epoch: 17, train_loss: 0.7485, test_loss: 1.3801, test_f1: 0.4076
 epoch: 18, train_loss: 0.7757, test_loss: 1.2859, test_f1: 0.4998
 epoch: 19, train_loss: 0.7708, test_loss: 1.2528, test_f1: 0.4998
 epoch: 20, train_loss: 0.7495, test_loss: 1.5111, test_f1: 0.4518
 epoch: 21, train_loss: 0.7374, test_loss: 1.5565, test_f1: 0.4097
 epoch: 22, train_loss: 0.7442, test_loss: 1.5970, test_f1: 0.4207
 epoch: 23, train_loss: 0.7809, test_loss: 1.5101, test_f1: 0.5123
 epoch: 24, train_loss: 0.7668, test_loss: 1.2056, test_f1: 0.5330
 epoch: 25, train_loss: 0.7544, test_loss: 1.3246, test_f1: 0.4161
 epoch: 26, train_loss: 0.7192, test_loss: 1.2934, test_f1: 0.4545
 epoch: 27, train_loss: 0.7073, test_loss: 1.3325, test_f1: 0.4223
 epoch: 28, train_loss: 0.7366, test_loss: 1.1173, test_f1: 0.4750
 epoch: 29, train_loss: 0.6861, test_loss: 1.2302, test_f1: 0.5012
 epoch: 30, train_loss: 0.6682, test_loss: 1.4973, test_f1: 0.5431
 epoch: 31, train_loss: 0.6555, test_loss: 1.0996, test_f1: 0.5582
 epoch: 32, train_loss: 0.6533, test_loss: 1.0438, test_f1: 0.5550
 epoch: 33, train_loss: 0.6071, test_loss: 1.2521, test_f1: 0.5822
 epoch: 34, train_loss: 0.6025, test_loss: 1.3610, test_f1: 0.5529
 epoch: 35, train_loss: 0.5998, test_loss: 1.6414, test_f1: 0.5436
 epoch: 36, train_loss: 0.6371, test_loss: 2.1698, test_f1: 0.3676
 epoch: 37, train_loss: 0.6167, test_loss: 1.6200, test_f1: 0.4220
 epoch: 38, train_loss: 0.6269, test_loss: 1.1240, test_f1: 0.6074
 epoch: 39, train_loss: 0.5809, test_loss: 2.0139, test_f1: 0.4271
 epoch: 40, train_loss: 0.6191, test_loss: 1.7224, test_f1: 0.5181
 epoch: 41, train_loss: 0.6244, test_loss: 1.7628, test_f1: 0.4793
 epoch: 42, train_loss: 0.6474, test_loss: 1.4059, test_f1: 0.4133
 epoch: 43, train_loss: 0.6504, test_loss: 1.2639, test_f1: 0.5148
 epoch: 44, train_loss: 0.6341, test_loss: 1.1974, test_f1: 0.5442
 epoch: 45, train_loss: 0.5715, test_loss: 1.2674, test_f1: 0.5700
 epoch: 46, train_loss: 0.5461, test_loss: 1.3386, test_f1: 0.5726
 epoch: 47, train_loss: 0.5964, test_loss: 1.6460, test_f1: 0.5149
 epoch: 48, train_loss: 0.5439, test_loss: 1.2945, test_f1: 0.5958
 epoch: 49, train_loss: 0.5493, test_loss: 1.3029, test_f1: 0.5948
 epoch: 50, train_loss: 0.5236, test_loss: 1.2414, test_f1: 0.5681
 epoch: 51, train_loss: 0.5322, test_loss: 1.2290, test_f1: 0.5496
 epoch: 52, train_loss: 0.5374, test_loss: 1.2840, test_f1: 0.5465
 epoch: 53, train_loss: 0.5154, test_loss: 1.2479, test_f1: 0.5826
 epoch: 54, train_loss: 0.4648, test_loss: 1.3397, test_f1: 0.5904
 epoch: 55, train_loss: 0.4736, test_loss: 1.4965, test_f1: 0.5526
 epoch: 56, train_loss: 0.4661, test_loss: 1.3097, test_f1: 0.5827
 epoch: 57, train_loss: 0.4589, test_loss: 1.2213, test_f1: 0.5987
 epoch: 58, train_loss: 0.4439, test_loss: 1.4939, test_f1: 0.6119
 epoch: 59, train_loss: 0.4521, test_loss: 1.5583, test_f1: 0.6346
 epoch: 60, train_loss: 0.4706, test_loss: 1.4916, test_f1: 0.5335
 epoch: 61, train_loss: 0.4940, test_loss: 1.4409, test_f1: 0.5766
 epoch: 62, train_loss: 0.4642, test_loss: 1.4702, test_f1: 0.5579
 epoch: 63, train_loss: 0.4520, test_loss: 1.5269, test_f1: 0.5835
 epoch: 64, train_loss: 0.4432, test_loss: 1.7840, test_f1: 0.5499
 epoch: 65, train_loss: 0.4617, test_loss: 1.5161, test_f1: 0.5572
 epoch: 66, train_loss: 0.4436, test_loss: 1.5537, test_f1: 0.6211
 epoch: 67, train_loss: 0.4476, test_loss: 1.4787, test_f1: 0.6210
 epoch: 68, train_loss: 0.4541, test_loss: 1.4892, test_f1: 0.5770
 epoch: 69, train_loss: 0.4438, test_loss: 1.5914, test_f1: 0.5197
 epoch: 70, train_loss: 0.4586, test_loss: 1.4059, test_f1: 0.6391
 epoch: 71, train_loss: 0.4308, test_loss: 1.5114, test_f1: 0.5778
 epoch: 72, train_loss: 0.3997, test_loss: 1.7420, test_f1: 0.5572
 epoch: 73, train_loss: 0.3932, test_loss: 1.5981, test_f1: 0.5956
 epoch: 74, train_loss: 0.4026, test_loss: 1.7655, test_f1: 0.5584
 epoch: 75, train_loss: 0.3700, test_loss: 1.7160, test_f1: 0.5662
 epoch: 76, train_loss: 0.4051, test_loss: 1.5104, test_f1: 0.5796
 epoch: 77, train_loss: 0.4172, test_loss: 1.6527, test_f1: 0.5980
 epoch: 78, train_loss: 0.3965, test_loss: 1.7964, test_f1: 0.5707
 epoch: 79, train_loss: 0.4025, test_loss: 1.7393, test_f1: 0.6101
 epoch: 80, train_loss: 0.4131, test_loss: 1.5826, test_f1: 0.6470
 epoch: 81, train_loss: 0.3982, test_loss: 1.5637, test_f1: 0.6161
 epoch: 82, train_loss: 0.3894, test_loss: 1.6857, test_f1: 0.6006
 epoch: 83, train_loss: 0.3482, test_loss: 1.9211, test_f1: 0.5223
 epoch: 84, train_loss: 0.3660, test_loss: 1.5893, test_f1: 0.6301
 epoch: 85, train_loss: 0.3995, test_loss: 1.8028, test_f1: 0.5836
 epoch: 86, train_loss: 0.3615, test_loss: 1.4616, test_f1: 0.5936
 epoch: 87, train_loss: 0.3932, test_loss: 1.5764, test_f1: 0.6139
 epoch: 88, train_loss: 0.3806, test_loss: 1.6086, test_f1: 0.5855
 epoch: 89, train_loss: 0.4015, test_loss: 1.5948, test_f1: 0.5781
 epoch: 90, train_loss: 0.4316, test_loss: 1.7018, test_f1: 0.5886
 epoch: 91, train_loss: 0.4480, test_loss: 1.7734, test_f1: 0.5977
 epoch: 92, train_loss: 0.3843, test_loss: 1.7508, test_f1: 0.5237
 epoch: 93, train_loss: 0.3388, test_loss: 1.7523, test_f1: 0.5244
 epoch: 94, train_loss: 0.3498, test_loss: 1.6436, test_f1: 0.5536
 epoch: 95, train_loss: 0.3650, test_loss: 1.5779, test_f1: 0.6472
 epoch: 96, train_loss: 0.3787, test_loss: 1.5908, test_f1: 0.5986
 epoch: 97, train_loss: 0.3728, test_loss: 1.9533, test_f1: 0.5541
 epoch: 98, train_loss: 0.3548, test_loss: 2.1119, test_f1: 0.5394
 epoch: 99, train_loss: 0.3496, test_loss: 1.9414, test_f1: 0.6032
##################ITERATION #9 ****************************************
 epoch: 0, train_loss: 1.5558, test_loss: 1.6573, test_f1: 0.1365
 epoch: 1, train_loss: 1.0426, test_loss: 1.6679, test_f1: 0.1371
 epoch: 2, train_loss: 0.9437, test_loss: 1.5334, test_f1: 0.3474
 epoch: 3, train_loss: 0.9203, test_loss: 1.4001, test_f1: 0.3719
 epoch: 4, train_loss: 0.8738, test_loss: 1.3376, test_f1: 0.3620
 epoch: 5, train_loss: 0.8723, test_loss: 1.2565, test_f1: 0.3510
 epoch: 6, train_loss: 0.8637, test_loss: 1.1622, test_f1: 0.4238
 epoch: 7, train_loss: 0.8200, test_loss: 1.1866, test_f1: 0.3596
 epoch: 8, train_loss: 0.7963, test_loss: 1.2908, test_f1: 0.3310
 epoch: 9, train_loss: 0.8017, test_loss: 1.3135, test_f1: 0.4230
 epoch: 10, train_loss: 0.8033, test_loss: 1.1684, test_f1: 0.5479
 epoch: 11, train_loss: 0.7784, test_loss: 1.0725, test_f1: 0.5633
 epoch: 12, train_loss: 0.7786, test_loss: 1.0030, test_f1: 0.5994
 epoch: 13, train_loss: 0.7451, test_loss: 1.2283, test_f1: 0.5212
 epoch: 14, train_loss: 0.7557, test_loss: 1.3204, test_f1: 0.5633
 epoch: 15, train_loss: 0.7106, test_loss: 1.0766, test_f1: 0.5715
 epoch: 16, train_loss: 0.7042, test_loss: 1.0767, test_f1: 0.5068
 epoch: 17, train_loss: 0.6935, test_loss: 1.3699, test_f1: 0.4554
 epoch: 18, train_loss: 0.6808, test_loss: 1.3056, test_f1: 0.4891
 epoch: 19, train_loss: 0.6968, test_loss: 1.0843, test_f1: 0.5405
 epoch: 20, train_loss: 0.6728, test_loss: 1.0764, test_f1: 0.5481
 epoch: 21, train_loss: 0.7058, test_loss: 1.1770, test_f1: 0.5330
 epoch: 22, train_loss: 0.7196, test_loss: 1.2041, test_f1: 0.5299
 epoch: 23, train_loss: 0.7002, test_loss: 1.0437, test_f1: 0.6130
 epoch: 24, train_loss: 0.6850, test_loss: 1.1546, test_f1: 0.5423
 epoch: 25, train_loss: 0.6552, test_loss: 1.4024, test_f1: 0.4830
 epoch: 26, train_loss: 0.6584, test_loss: 2.6248, test_f1: 0.3507
 epoch: 27, train_loss: 0.6393, test_loss: 1.5070, test_f1: 0.4781
 epoch: 28, train_loss: 0.6223, test_loss: 1.5578, test_f1: 0.5179
 epoch: 29, train_loss: 0.6056, test_loss: 1.3222, test_f1: 0.5458
 epoch: 30, train_loss: 0.5883, test_loss: 1.1898, test_f1: 0.5488
 epoch: 31, train_loss: 0.5849, test_loss: 1.4916, test_f1: 0.5295
 epoch: 32, train_loss: 0.5839, test_loss: 1.4013, test_f1: 0.5619
 epoch: 33, train_loss: 0.5766, test_loss: 1.1995, test_f1: 0.5910
 epoch: 34, train_loss: 0.5985, test_loss: 1.3452, test_f1: 0.5463
 epoch: 35, train_loss: 0.5646, test_loss: 1.1301, test_f1: 0.5654
 epoch: 36, train_loss: 0.5946, test_loss: 1.1348, test_f1: 0.5773
 epoch: 37, train_loss: 0.6001, test_loss: 1.5000, test_f1: 0.5050
 epoch: 38, train_loss: 0.5697, test_loss: 1.4413, test_f1: 0.5673
 epoch: 39, train_loss: 0.5749, test_loss: 1.4036, test_f1: 0.5840
 epoch: 40, train_loss: 0.5921, test_loss: 1.5589, test_f1: 0.5374
 epoch: 41, train_loss: 0.6416, test_loss: 1.4948, test_f1: 0.5280
 epoch: 42, train_loss: 0.6072, test_loss: 2.1189, test_f1: 0.4614
 epoch: 43, train_loss: 0.5806, test_loss: 1.3018, test_f1: 0.5184
 epoch: 44, train_loss: 0.5830, test_loss: 1.5897, test_f1: 0.5019
 epoch: 45, train_loss: 0.5576, test_loss: 1.2750, test_f1: 0.5418
 epoch: 46, train_loss: 0.5302, test_loss: 1.2716, test_f1: 0.5357
 epoch: 47, train_loss: 0.5437, test_loss: 1.3531, test_f1: 0.5023
 epoch: 48, train_loss: 0.5497, test_loss: 1.6198, test_f1: 0.4937
 epoch: 49, train_loss: 0.5232, test_loss: 1.5226, test_f1: 0.5141
 epoch: 50, train_loss: 0.5796, test_loss: 3.4282, test_f1: 0.4226
 epoch: 51, train_loss: 0.5334, test_loss: 2.0878, test_f1: 0.5029
 epoch: 52, train_loss: 0.4778, test_loss: 1.7703, test_f1: 0.5895
 epoch: 53, train_loss: 0.4613, test_loss: 1.8071, test_f1: 0.5789
 epoch: 54, train_loss: 0.4926, test_loss: 1.6936, test_f1: 0.5435
 epoch: 55, train_loss: 0.4791, test_loss: 1.4840, test_f1: 0.5534
 epoch: 56, train_loss: 0.4324, test_loss: 1.3122, test_f1: 0.5880
 epoch: 57, train_loss: 0.4233, test_loss: 1.4797, test_f1: 0.5876
 epoch: 58, train_loss: 0.4112, test_loss: 1.4212, test_f1: 0.6059
 epoch: 59, train_loss: 0.3836, test_loss: 1.6035, test_f1: 0.5960
 epoch: 60, train_loss: 0.4024, test_loss: 1.4385, test_f1: 0.5820
 epoch: 61, train_loss: 0.3999, test_loss: 1.5859, test_f1: 0.5747
 epoch: 62, train_loss: 0.3459, test_loss: 2.1544, test_f1: 0.5496
 epoch: 63, train_loss: 0.3814, test_loss: 1.8811, test_f1: 0.5466
 epoch: 64, train_loss: 0.3603, test_loss: 1.6007, test_f1: 0.5975
 epoch: 65, train_loss: 0.3804, test_loss: 1.7936, test_f1: 0.5748
 epoch: 66, train_loss: 0.3806, test_loss: 2.1055, test_f1: 0.5445
 epoch: 67, train_loss: 0.3803, test_loss: 1.8187, test_f1: 0.6247
 epoch: 68, train_loss: 0.3722, test_loss: 2.0126, test_f1: 0.5542
 epoch: 69, train_loss: 0.3660, test_loss: 2.6395, test_f1: 0.5163
 epoch: 70, train_loss: 0.4326, test_loss: 1.8141, test_f1: 0.5439
 epoch: 71, train_loss: 0.4226, test_loss: 1.5318, test_f1: 0.5842
 epoch: 72, train_loss: 0.4254, test_loss: 1.3470, test_f1: 0.6191
 epoch: 73, train_loss: 0.3918, test_loss: 1.3492, test_f1: 0.6001
 epoch: 74, train_loss: 0.3815, test_loss: 1.3495, test_f1: 0.6084
 epoch: 75, train_loss: 0.3935, test_loss: 1.7184, test_f1: 0.5741
 epoch: 76, train_loss: 0.3763, test_loss: 2.1631, test_f1: 0.5567
 epoch: 77, train_loss: 0.3270, test_loss: 1.8904, test_f1: 0.5796
 epoch: 78, train_loss: 0.3218, test_loss: 1.9471, test_f1: 0.5725
 epoch: 79, train_loss: 0.3551, test_loss: 1.8229, test_f1: 0.5793
 epoch: 80, train_loss: 0.4106, test_loss: 1.9277, test_f1: 0.5375
 epoch: 81, train_loss: 0.3607, test_loss: 1.8948, test_f1: 0.5183
 epoch: 82, train_loss: 0.3442, test_loss: 1.7232, test_f1: 0.5682
 epoch: 83, train_loss: 0.3546, test_loss: 1.9452, test_f1: 0.6006
 epoch: 84, train_loss: 0.4356, test_loss: 2.0997, test_f1: 0.5747
 epoch: 85, train_loss: 0.3558, test_loss: 2.1289, test_f1: 0.5699
 epoch: 86, train_loss: 0.3633, test_loss: 2.0139, test_f1: 0.5722
 epoch: 87, train_loss: 0.3284, test_loss: 1.9891, test_f1: 0.5208
 epoch: 88, train_loss: 0.3269, test_loss: 1.8154, test_f1: 0.5829
 epoch: 89, train_loss: 0.3601, test_loss: 2.0936, test_f1: 0.5988
 epoch: 90, train_loss: 0.3041, test_loss: 2.1565, test_f1: 0.5815
 epoch: 91, train_loss: 0.3012, test_loss: 2.1460, test_f1: 0.5824
 epoch: 92, train_loss: 0.3322, test_loss: 1.9412, test_f1: 0.5960
 epoch: 93, train_loss: 0.3356, test_loss: 1.6020, test_f1: 0.5884
 epoch: 94, train_loss: 0.3510, test_loss: 1.6571, test_f1: 0.5946
 epoch: 95, train_loss: 0.3494, test_loss: 1.9464, test_f1: 0.5945
 epoch: 96, train_loss: 0.3134, test_loss: 2.3279, test_f1: 0.5448
 epoch: 97, train_loss: 0.3127, test_loss: 1.8333, test_f1: 0.5929
 epoch: 98, train_loss: 0.2803, test_loss: 2.0541, test_f1: 0.5648
 epoch: 99, train_loss: 0.2807, test_loss: 1.9773, test_f1: 0.5754

Training completed in 297.48 seconds
Best F1: 0.6754 at epoch 85
Mean F1 across iterations: 0.6534  0.0181
========================FINAL RESULTS================================
FEGIN weighted F1: 0.6754  0.0181
python main.py --data ltspice_demos --representation component_pin_net --model FEGIN --layers 2 --hiddens 64 --batch_size 256 --lr 0.01 --emb_size 128 --epochs 100 --save_appendix component_pin_net_L2_H64_BS256_LR0.01_E128 --no_val
-----



STDERR:
  File "main.py", line 370, in <module>
    main()
  File "main.py", line 254, in main
    dataset = dataset_class(
  File "/home/philip/projects/ltspice_examples_code_repo/Circuit-Completion-Using-GNNs/component_classification_with_link_prediction_head/evaluation/FEGIN/kernel/circuit_datasets.py", line 15, in __init__
    self.data, self.slices = torch.load(self.processed_paths[0])
  File "/home/philip/.local/lib/python3.8/site-packages/torch/serialization.py", line 1040, in load
    warnings.warn(
  File "/usr/lib/python3.8/warnings.py", line 109, in _showwarnmsg
    sw(msg.message, msg.category, msg.filename, msg.lineno,
  File "main.py", line 47, in warn_with_traceback
    traceback.print_stack(file=log)
/home/philip/projects/ltspice_examples_code_repo/Circuit-Completion-Using-GNNs/component_classification_with_link_prediction_head/evaluation/FEGIN/kernel/circuit_datasets.py:15: FutureWarning: You are using `torch.load` with `weights_only=False` (the current default value), which uses the default pickle module implicitly. It is possible to construct malicious pickle data which will execute arbitrary code during unpickling (See https://github.com/pytorch/pytorch/blob/main/SECURITY.md#untrusted-models for more details). In a future release, the default value for `weights_only` will be flipped to `True`. This limits the functions that could be executed during unpickling. Arbitrary objects will no longer be allowed to be loaded via this mode unless they are explicitly allowlisted by the user via `torch.serialization.add_safe_globals`. We recommend you start setting `weights_only=True` for any use case where you don't have full control of the loaded file. Please open an issue on GitHub for any issues related to this experimental feature.
  self.data, self.slices = torch.load(self.processed_paths[0])
