STDOUT:
Results will be saved in /home/philip/projects/ltspice_examples_code_repo/Circuit-Completion-Using-GNNs/component_classification_with_link_prediction_head/evaluation/FEGIN/results/model_FEGIN_dataset_ltspice_examples
Command line input: python main.py --data ltspice_examples --representation component_pin_net --model FEGIN --layers 2 --hiddens 64 --batch_size 32 --lr 0.001 --emb_size 128 --epochs 100 --save_appendix component_pin_net_L2_H64_BS32_LR0.001_E128 --no_val
 is saved.
-----
ltspice_examples - FEGIN
Using 2 layers, 64 hidden units, h = 2
Loading component_pin_net representation dataset
ENTERED
Training FEGIN on component_pin_net representation
Train: 3558, Test: 846
##################ITERATION #0 ****************************************
 epoch: 0, train_loss: 1.1709, test_loss: 0.9992, test_f1: 0.4705
 epoch: 1, train_loss: 0.9924, test_loss: 0.9781, test_f1: 0.4838
 epoch: 2, train_loss: 0.9667, test_loss: 0.9220, test_f1: 0.4819
 epoch: 3, train_loss: 0.9486, test_loss: 0.9077, test_f1: 0.5072
 epoch: 4, train_loss: 0.9212, test_loss: 0.9119, test_f1: 0.5315
 epoch: 5, train_loss: 0.9129, test_loss: 0.8750, test_f1: 0.5139
 epoch: 6, train_loss: 0.9047, test_loss: 0.8769, test_f1: 0.5147
 epoch: 7, train_loss: 0.8871, test_loss: 0.8522, test_f1: 0.5356
 epoch: 8, train_loss: 0.8607, test_loss: 0.8470, test_f1: 0.5351
 epoch: 9, train_loss: 0.8466, test_loss: 0.8558, test_f1: 0.5300
 epoch: 10, train_loss: 0.8232, test_loss: 0.8429, test_f1: 0.5378
 epoch: 11, train_loss: 0.8118, test_loss: 0.8542, test_f1: 0.5862
 epoch: 12, train_loss: 0.8066, test_loss: 0.9199, test_f1: 0.5448
 epoch: 13, train_loss: 0.8089, test_loss: 0.8372, test_f1: 0.6139
 epoch: 14, train_loss: 0.7768, test_loss: 0.7961, test_f1: 0.5697
 epoch: 15, train_loss: 0.7556, test_loss: 0.7905, test_f1: 0.6061
 epoch: 16, train_loss: 0.7596, test_loss: 0.7906, test_f1: 0.6043
 epoch: 17, train_loss: 0.7472, test_loss: 0.7834, test_f1: 0.6305
 epoch: 18, train_loss: 0.7436, test_loss: 0.8293, test_f1: 0.5863
 epoch: 19, train_loss: 0.7229, test_loss: 0.9086, test_f1: 0.5219
 epoch: 20, train_loss: 0.7193, test_loss: 0.8683, test_f1: 0.5774
 epoch: 21, train_loss: 0.7055, test_loss: 0.8358, test_f1: 0.5681
 epoch: 22, train_loss: 0.6968, test_loss: 0.8457, test_f1: 0.6313
 epoch: 23, train_loss: 0.6876, test_loss: 0.7997, test_f1: 0.6187
 epoch: 24, train_loss: 0.6891, test_loss: 0.8540, test_f1: 0.6320
 epoch: 25, train_loss: 0.6733, test_loss: 0.8632, test_f1: 0.6146
 epoch: 26, train_loss: 0.6719, test_loss: 0.8216, test_f1: 0.6149
 epoch: 27, train_loss: 0.6514, test_loss: 0.8312, test_f1: 0.6578
 epoch: 28, train_loss: 0.6635, test_loss: 0.7978, test_f1: 0.6372
 epoch: 29, train_loss: 0.6453, test_loss: 0.8094, test_f1: 0.6518
 epoch: 30, train_loss: 0.6487, test_loss: 0.8924, test_f1: 0.6149
 epoch: 31, train_loss: 0.6344, test_loss: 0.8263, test_f1: 0.6443
 epoch: 32, train_loss: 0.6263, test_loss: 0.7967, test_f1: 0.6562
 epoch: 33, train_loss: 0.6259, test_loss: 0.8210, test_f1: 0.6750
 epoch: 34, train_loss: 0.6118, test_loss: 0.8763, test_f1: 0.6429
 epoch: 35, train_loss: 0.6189, test_loss: 0.7661, test_f1: 0.6631
 epoch: 36, train_loss: 0.5982, test_loss: 0.8049, test_f1: 0.6543
 epoch: 37, train_loss: 0.6086, test_loss: 0.8435, test_f1: 0.6692
 epoch: 38, train_loss: 0.5863, test_loss: 0.7963, test_f1: 0.6731
 epoch: 39, train_loss: 0.5829, test_loss: 0.8813, test_f1: 0.6414
 epoch: 40, train_loss: 0.5907, test_loss: 0.8052, test_f1: 0.6553
 epoch: 41, train_loss: 0.5780, test_loss: 0.7991, test_f1: 0.6750
 epoch: 42, train_loss: 0.5663, test_loss: 0.8334, test_f1: 0.6613
 epoch: 43, train_loss: 0.5601, test_loss: 0.8721, test_f1: 0.6403
 epoch: 44, train_loss: 0.5639, test_loss: 0.8121, test_f1: 0.6654
 epoch: 45, train_loss: 0.5390, test_loss: 0.8190, test_f1: 0.6703
 epoch: 46, train_loss: 0.5555, test_loss: 0.9613, test_f1: 0.6409
 epoch: 47, train_loss: 0.5446, test_loss: 0.9500, test_f1: 0.6566
 epoch: 48, train_loss: 0.5564, test_loss: 0.9955, test_f1: 0.6453
 epoch: 49, train_loss: 0.5712, test_loss: 0.8626, test_f1: 0.6713
 epoch: 50, train_loss: 0.5333, test_loss: 0.8510, test_f1: 0.6305
 epoch: 51, train_loss: 0.5109, test_loss: 0.8813, test_f1: 0.6852
 epoch: 52, train_loss: 0.5038, test_loss: 0.9085, test_f1: 0.6551
 epoch: 53, train_loss: 0.4975, test_loss: 0.9625, test_f1: 0.6652
 epoch: 54, train_loss: 0.4789, test_loss: 0.9076, test_f1: 0.6684
 epoch: 55, train_loss: 0.4753, test_loss: 0.9820, test_f1: 0.6422
 epoch: 56, train_loss: 0.4733, test_loss: 0.9555, test_f1: 0.6693
 epoch: 57, train_loss: 0.4829, test_loss: 0.9319, test_f1: 0.6705
 epoch: 58, train_loss: 0.4643, test_loss: 0.9388, test_f1: 0.6719
 epoch: 59, train_loss: 0.4812, test_loss: 0.9831, test_f1: 0.6681
 epoch: 60, train_loss: 0.4621, test_loss: 0.9795, test_f1: 0.6649
 epoch: 61, train_loss: 0.4636, test_loss: 0.9663, test_f1: 0.6526
 epoch: 62, train_loss: 0.4500, test_loss: 0.9786, test_f1: 0.6734
 epoch: 63, train_loss: 0.4536, test_loss: 0.9760, test_f1: 0.6578
 epoch: 64, train_loss: 0.4482, test_loss: 1.0420, test_f1: 0.6540
 epoch: 65, train_loss: 0.4520, test_loss: 1.0156, test_f1: 0.6685
 epoch: 66, train_loss: 0.4377, test_loss: 1.0196, test_f1: 0.6631
 epoch: 67, train_loss: 0.4376, test_loss: 0.9486, test_f1: 0.6776
 epoch: 68, train_loss: 0.4368, test_loss: 1.0202, test_f1: 0.6819
 epoch: 69, train_loss: 0.4265, test_loss: 0.9996, test_f1: 0.6708
 epoch: 70, train_loss: 0.4193, test_loss: 1.0140, test_f1: 0.6712
 epoch: 71, train_loss: 0.4342, test_loss: 1.0782, test_f1: 0.6517
 epoch: 72, train_loss: 0.4253, test_loss: 1.0026, test_f1: 0.6771
 epoch: 73, train_loss: 0.4365, test_loss: 1.0636, test_f1: 0.6743
 epoch: 74, train_loss: 0.4284, test_loss: 1.0478, test_f1: 0.6650
 epoch: 75, train_loss: 0.4403, test_loss: 1.0233, test_f1: 0.6641
 epoch: 76, train_loss: 0.4340, test_loss: 1.0626, test_f1: 0.6805
 epoch: 77, train_loss: 0.4199, test_loss: 1.1694, test_f1: 0.6604
 epoch: 78, train_loss: 0.4131, test_loss: 1.0857, test_f1: 0.6552
 epoch: 79, train_loss: 0.4214, test_loss: 1.2072, test_f1: 0.6615
 epoch: 80, train_loss: 0.4153, test_loss: 1.0960, test_f1: 0.6664
 epoch: 81, train_loss: 0.4074, test_loss: 1.0806, test_f1: 0.6601
 epoch: 82, train_loss: 0.4225, test_loss: 1.0678, test_f1: 0.6673
 epoch: 83, train_loss: 0.4078, test_loss: 1.1431, test_f1: 0.6652
 epoch: 84, train_loss: 0.3994, test_loss: 1.0917, test_f1: 0.6638
 epoch: 85, train_loss: 0.4069, test_loss: 1.1671, test_f1: 0.6630
 epoch: 86, train_loss: 0.4000, test_loss: 1.2261, test_f1: 0.6723
 epoch: 87, train_loss: 0.3872, test_loss: 1.2932, test_f1: 0.6770
 epoch: 88, train_loss: 0.3887, test_loss: 1.2970, test_f1: 0.6608
 epoch: 89, train_loss: 0.3803, test_loss: 1.1810, test_f1: 0.6629
 epoch: 90, train_loss: 0.3906, test_loss: 1.2523, test_f1: 0.6856
 epoch: 91, train_loss: 0.4052, test_loss: 1.2301, test_f1: 0.6791
 epoch: 92, train_loss: 0.3862, test_loss: 1.1979, test_f1: 0.6707
 epoch: 93, train_loss: 0.3768, test_loss: 1.2193, test_f1: 0.6463
 epoch: 94, train_loss: 0.3693, test_loss: 1.2301, test_f1: 0.6926
 epoch: 95, train_loss: 0.3762, test_loss: 1.2859, test_f1: 0.6573
 epoch: 96, train_loss: 0.3784, test_loss: 1.2451, test_f1: 0.6659
 epoch: 97, train_loss: 0.3651, test_loss: 1.2033, test_f1: 0.6699
 epoch: 98, train_loss: 0.3879, test_loss: 1.2774, test_f1: 0.6454
 epoch: 99, train_loss: 0.3796, test_loss: 1.2609, test_f1: 0.6759
##################ITERATION #1 ****************************************
 epoch: 0, train_loss: 1.0779, test_loss: 0.9974, test_f1: 0.4683
 epoch: 1, train_loss: 0.9651, test_loss: 0.9638, test_f1: 0.5082
 epoch: 2, train_loss: 0.9378, test_loss: 0.9809, test_f1: 0.4846
 epoch: 3, train_loss: 0.9190, test_loss: 0.9380, test_f1: 0.5391
 epoch: 4, train_loss: 0.8899, test_loss: 0.9137, test_f1: 0.5743
 epoch: 5, train_loss: 0.8797, test_loss: 0.8625, test_f1: 0.5623
 epoch: 6, train_loss: 0.8516, test_loss: 0.8604, test_f1: 0.5574
 epoch: 7, train_loss: 0.8503, test_loss: 0.8421, test_f1: 0.5454
 epoch: 8, train_loss: 0.8236, test_loss: 0.8702, test_f1: 0.5418
 epoch: 9, train_loss: 0.8085, test_loss: 0.8861, test_f1: 0.5600
 epoch: 10, train_loss: 0.8122, test_loss: 0.8341, test_f1: 0.5963
 epoch: 11, train_loss: 0.7728, test_loss: 0.8221, test_f1: 0.5972
 epoch: 12, train_loss: 0.7713, test_loss: 0.8370, test_f1: 0.6320
 epoch: 13, train_loss: 0.7712, test_loss: 0.7628, test_f1: 0.6221
 epoch: 14, train_loss: 0.7651, test_loss: 0.7913, test_f1: 0.6526
 epoch: 15, train_loss: 0.7405, test_loss: 0.8580, test_f1: 0.5903
 epoch: 16, train_loss: 0.7256, test_loss: 0.7392, test_f1: 0.6396
 epoch: 17, train_loss: 0.7270, test_loss: 0.7610, test_f1: 0.6545
 epoch: 18, train_loss: 0.7123, test_loss: 0.8543, test_f1: 0.6265
 epoch: 19, train_loss: 0.7256, test_loss: 0.7714, test_f1: 0.6250
 epoch: 20, train_loss: 0.6865, test_loss: 0.8334, test_f1: 0.6297
 epoch: 21, train_loss: 0.6972, test_loss: 0.8042, test_f1: 0.6241
 epoch: 22, train_loss: 0.6866, test_loss: 0.7881, test_f1: 0.6525
 epoch: 23, train_loss: 0.6714, test_loss: 0.7189, test_f1: 0.6585
 epoch: 24, train_loss: 0.6623, test_loss: 0.7382, test_f1: 0.6645
 epoch: 25, train_loss: 0.6631, test_loss: 0.7971, test_f1: 0.6284
 epoch: 26, train_loss: 0.6658, test_loss: 0.7003, test_f1: 0.6995
 epoch: 27, train_loss: 0.6485, test_loss: 0.8469, test_f1: 0.6247
 epoch: 28, train_loss: 0.6490, test_loss: 0.7076, test_f1: 0.6565
 epoch: 29, train_loss: 0.6531, test_loss: 0.7559, test_f1: 0.6439
 epoch: 30, train_loss: 0.6403, test_loss: 0.7804, test_f1: 0.6559
 epoch: 31, train_loss: 0.6358, test_loss: 0.8018, test_f1: 0.6553
 epoch: 32, train_loss: 0.6194, test_loss: 0.8576, test_f1: 0.6549
 epoch: 33, train_loss: 0.6121, test_loss: 0.8132, test_f1: 0.6575
 epoch: 34, train_loss: 0.6013, test_loss: 0.8741, test_f1: 0.6455
 epoch: 35, train_loss: 0.6115, test_loss: 0.8773, test_f1: 0.6778
 epoch: 36, train_loss: 0.5925, test_loss: 0.8061, test_f1: 0.6721
 epoch: 37, train_loss: 0.6120, test_loss: 0.8491, test_f1: 0.6813
 epoch: 38, train_loss: 0.5903, test_loss: 0.8943, test_f1: 0.6530
 epoch: 39, train_loss: 0.5919, test_loss: 0.8722, test_f1: 0.6621
 epoch: 40, train_loss: 0.5648, test_loss: 0.8850, test_f1: 0.6492
 epoch: 41, train_loss: 0.5688, test_loss: 0.8706, test_f1: 0.6679
 epoch: 42, train_loss: 0.5650, test_loss: 0.9830, test_f1: 0.6536
 epoch: 43, train_loss: 0.5581, test_loss: 0.7929, test_f1: 0.6635
 epoch: 44, train_loss: 0.5610, test_loss: 0.8754, test_f1: 0.6597
 epoch: 45, train_loss: 0.5458, test_loss: 0.8570, test_f1: 0.6585
 epoch: 46, train_loss: 0.5508, test_loss: 0.8941, test_f1: 0.6512
 epoch: 47, train_loss: 0.5439, test_loss: 0.9742, test_f1: 0.6546
 epoch: 48, train_loss: 0.5385, test_loss: 0.8915, test_f1: 0.6769
 epoch: 49, train_loss: 0.5329, test_loss: 0.8943, test_f1: 0.6573
 epoch: 50, train_loss: 0.5282, test_loss: 0.8329, test_f1: 0.6605
 epoch: 51, train_loss: 0.4997, test_loss: 0.9196, test_f1: 0.6543
 epoch: 52, train_loss: 0.4751, test_loss: 0.8930, test_f1: 0.6761
 epoch: 53, train_loss: 0.4695, test_loss: 0.9352, test_f1: 0.6694
 epoch: 54, train_loss: 0.4699, test_loss: 0.9692, test_f1: 0.6610
 epoch: 55, train_loss: 0.4781, test_loss: 1.0240, test_f1: 0.6661
 epoch: 56, train_loss: 0.4701, test_loss: 0.9207, test_f1: 0.6673
 epoch: 57, train_loss: 0.4671, test_loss: 0.9498, test_f1: 0.6698
 epoch: 58, train_loss: 0.4710, test_loss: 0.9767, test_f1: 0.6555
 epoch: 59, train_loss: 0.4676, test_loss: 1.0191, test_f1: 0.6575
 epoch: 60, train_loss: 0.4517, test_loss: 0.9458, test_f1: 0.6794
 epoch: 61, train_loss: 0.4559, test_loss: 0.9327, test_f1: 0.6871
 epoch: 62, train_loss: 0.4669, test_loss: 0.9559, test_f1: 0.6790
 epoch: 63, train_loss: 0.4430, test_loss: 0.9353, test_f1: 0.6777
 epoch: 64, train_loss: 0.4538, test_loss: 1.0269, test_f1: 0.6585
 epoch: 65, train_loss: 0.4461, test_loss: 1.0275, test_f1: 0.6730
 epoch: 66, train_loss: 0.4300, test_loss: 1.0187, test_f1: 0.6548
 epoch: 67, train_loss: 0.4342, test_loss: 1.0072, test_f1: 0.6605
 epoch: 68, train_loss: 0.4386, test_loss: 1.0166, test_f1: 0.6762
 epoch: 69, train_loss: 0.4248, test_loss: 1.0968, test_f1: 0.6525
 epoch: 70, train_loss: 0.4094, test_loss: 1.0801, test_f1: 0.6797
 epoch: 71, train_loss: 0.4272, test_loss: 1.0974, test_f1: 0.6734
 epoch: 72, train_loss: 0.4283, test_loss: 1.0714, test_f1: 0.6743
 epoch: 73, train_loss: 0.4246, test_loss: 1.0432, test_f1: 0.6723
 epoch: 74, train_loss: 0.4247, test_loss: 1.0637, test_f1: 0.6859
 epoch: 75, train_loss: 0.4275, test_loss: 1.1033, test_f1: 0.6678
 epoch: 76, train_loss: 0.4316, test_loss: 1.0529, test_f1: 0.6750
 epoch: 77, train_loss: 0.4125, test_loss: 1.0956, test_f1: 0.6627
 epoch: 78, train_loss: 0.4021, test_loss: 1.0848, test_f1: 0.6797
 epoch: 79, train_loss: 0.4254, test_loss: 1.1541, test_f1: 0.6774
 epoch: 80, train_loss: 0.3935, test_loss: 1.1071, test_f1: 0.6667
 epoch: 81, train_loss: 0.4062, test_loss: 1.0843, test_f1: 0.6848
 epoch: 82, train_loss: 0.3969, test_loss: 1.1034, test_f1: 0.6833
 epoch: 83, train_loss: 0.3862, test_loss: 1.2026, test_f1: 0.6609
 epoch: 84, train_loss: 0.4011, test_loss: 1.1067, test_f1: 0.6732
 epoch: 85, train_loss: 0.3904, test_loss: 1.2090, test_f1: 0.6794
 epoch: 86, train_loss: 0.4040, test_loss: 1.1473, test_f1: 0.6731
 epoch: 87, train_loss: 0.3900, test_loss: 1.2095, test_f1: 0.6767
 epoch: 88, train_loss: 0.3795, test_loss: 1.1621, test_f1: 0.6650
 epoch: 89, train_loss: 0.3992, test_loss: 1.2136, test_f1: 0.6725
 epoch: 90, train_loss: 0.3826, test_loss: 1.2029, test_f1: 0.6734
 epoch: 91, train_loss: 0.3929, test_loss: 1.2592, test_f1: 0.6733
 epoch: 92, train_loss: 0.3822, test_loss: 1.2208, test_f1: 0.6712
 epoch: 93, train_loss: 0.3839, test_loss: 1.2255, test_f1: 0.6732
 epoch: 94, train_loss: 0.3830, test_loss: 1.2067, test_f1: 0.6733
 epoch: 95, train_loss: 0.3737, test_loss: 1.1988, test_f1: 0.6867
 epoch: 96, train_loss: 0.3669, test_loss: 1.1905, test_f1: 0.6756
 epoch: 97, train_loss: 0.3869, test_loss: 1.1823, test_f1: 0.6774
 epoch: 98, train_loss: 0.3711, test_loss: 1.1073, test_f1: 0.7050
 epoch: 99, train_loss: 0.3765, test_loss: 1.1338, test_f1: 0.6657
##################ITERATION #2 ****************************************
 epoch: 0, train_loss: 1.0740, test_loss: 1.0484, test_f1: 0.4862
 epoch: 1, train_loss: 0.9748, test_loss: 0.9566, test_f1: 0.4732
 epoch: 2, train_loss: 0.9373, test_loss: 0.9102, test_f1: 0.5250
 epoch: 3, train_loss: 0.9161, test_loss: 0.8851, test_f1: 0.5483
 epoch: 4, train_loss: 0.8902, test_loss: 0.8532, test_f1: 0.5238
 epoch: 5, train_loss: 0.8893, test_loss: 0.8911, test_f1: 0.5561
 epoch: 6, train_loss: 0.8567, test_loss: 0.8759, test_f1: 0.5499
 epoch: 7, train_loss: 0.8393, test_loss: 0.8662, test_f1: 0.5797
 epoch: 8, train_loss: 0.8311, test_loss: 0.8507, test_f1: 0.5876
 epoch: 9, train_loss: 0.8161, test_loss: 0.8510, test_f1: 0.6227
 epoch: 10, train_loss: 0.7979, test_loss: 0.8322, test_f1: 0.6029
 epoch: 11, train_loss: 0.7901, test_loss: 0.8122, test_f1: 0.5903
 epoch: 12, train_loss: 0.7848, test_loss: 0.7804, test_f1: 0.6468
 epoch: 13, train_loss: 0.7612, test_loss: 0.7966, test_f1: 0.6065
 epoch: 14, train_loss: 0.7512, test_loss: 0.7838, test_f1: 0.6316
 epoch: 15, train_loss: 0.7462, test_loss: 0.7733, test_f1: 0.6308
 epoch: 16, train_loss: 0.7257, test_loss: 0.8242, test_f1: 0.6282
 epoch: 17, train_loss: 0.7165, test_loss: 0.7833, test_f1: 0.6336
 epoch: 18, train_loss: 0.7269, test_loss: 0.7190, test_f1: 0.6431
 epoch: 19, train_loss: 0.7131, test_loss: 0.7746, test_f1: 0.6469
 epoch: 20, train_loss: 0.6916, test_loss: 0.8032, test_f1: 0.6441
 epoch: 21, train_loss: 0.6954, test_loss: 0.7540, test_f1: 0.6581
 epoch: 22, train_loss: 0.6836, test_loss: 0.7717, test_f1: 0.6598
 epoch: 23, train_loss: 0.6796, test_loss: 0.7861, test_f1: 0.6391
 epoch: 24, train_loss: 0.6639, test_loss: 0.7937, test_f1: 0.6460
 epoch: 25, train_loss: 0.6606, test_loss: 0.7513, test_f1: 0.6595
 epoch: 26, train_loss: 0.6703, test_loss: 0.7943, test_f1: 0.6181
 epoch: 27, train_loss: 0.6422, test_loss: 0.8124, test_f1: 0.6335
 epoch: 28, train_loss: 0.6369, test_loss: 0.7996, test_f1: 0.6574
 epoch: 29, train_loss: 0.6482, test_loss: 0.8028, test_f1: 0.6508
 epoch: 30, train_loss: 0.6392, test_loss: 0.7358, test_f1: 0.6574
 epoch: 31, train_loss: 0.6478, test_loss: 0.7615, test_f1: 0.6841
 epoch: 32, train_loss: 0.6354, test_loss: 0.7943, test_f1: 0.6646
 epoch: 33, train_loss: 0.6366, test_loss: 0.7914, test_f1: 0.6446
 epoch: 34, train_loss: 0.6207, test_loss: 0.7852, test_f1: 0.6645
 epoch: 35, train_loss: 0.6040, test_loss: 0.7922, test_f1: 0.6400
 epoch: 36, train_loss: 0.5965, test_loss: 0.8000, test_f1: 0.6397
 epoch: 37, train_loss: 0.5978, test_loss: 0.7777, test_f1: 0.6649
 epoch: 38, train_loss: 0.5832, test_loss: 0.8328, test_f1: 0.6733
 epoch: 39, train_loss: 0.5921, test_loss: 0.8192, test_f1: 0.6810
 epoch: 40, train_loss: 0.5747, test_loss: 0.8503, test_f1: 0.6403
 epoch: 41, train_loss: 0.5790, test_loss: 0.7998, test_f1: 0.6731
 epoch: 42, train_loss: 0.5840, test_loss: 0.8439, test_f1: 0.6519
 epoch: 43, train_loss: 0.5532, test_loss: 0.8527, test_f1: 0.6969
 epoch: 44, train_loss: 0.5593, test_loss: 0.8380, test_f1: 0.6650
 epoch: 45, train_loss: 0.5635, test_loss: 0.9502, test_f1: 0.6535
 epoch: 46, train_loss: 0.5649, test_loss: 0.8441, test_f1: 0.6775
 epoch: 47, train_loss: 0.5595, test_loss: 0.9065, test_f1: 0.6592
 epoch: 48, train_loss: 0.5530, test_loss: 0.9827, test_f1: 0.6420
 epoch: 49, train_loss: 0.5366, test_loss: 0.8403, test_f1: 0.6700
 epoch: 50, train_loss: 0.5431, test_loss: 0.8837, test_f1: 0.6669
 epoch: 51, train_loss: 0.5156, test_loss: 0.8533, test_f1: 0.6840
 epoch: 52, train_loss: 0.5040, test_loss: 0.8828, test_f1: 0.6647
 epoch: 53, train_loss: 0.4966, test_loss: 0.9472, test_f1: 0.6585
 epoch: 54, train_loss: 0.4614, test_loss: 0.9547, test_f1: 0.6851
 epoch: 55, train_loss: 0.4843, test_loss: 0.8920, test_f1: 0.6634
 epoch: 56, train_loss: 0.4615, test_loss: 0.9314, test_f1: 0.6555
 epoch: 57, train_loss: 0.4825, test_loss: 0.9597, test_f1: 0.6777
 epoch: 58, train_loss: 0.4824, test_loss: 0.9244, test_f1: 0.6726
 epoch: 59, train_loss: 0.4871, test_loss: 0.9398, test_f1: 0.6984
 epoch: 60, train_loss: 0.4730, test_loss: 0.9590, test_f1: 0.6626
 epoch: 61, train_loss: 0.4675, test_loss: 0.9005, test_f1: 0.6771
 epoch: 62, train_loss: 0.4649, test_loss: 0.9958, test_f1: 0.6479
 epoch: 63, train_loss: 0.4377, test_loss: 0.9579, test_f1: 0.6609
 epoch: 64, train_loss: 0.4511, test_loss: 1.0138, test_f1: 0.6573
 epoch: 65, train_loss: 0.4476, test_loss: 1.0211, test_f1: 0.6666
 epoch: 66, train_loss: 0.4384, test_loss: 1.0060, test_f1: 0.6589
 epoch: 67, train_loss: 0.4318, test_loss: 0.9972, test_f1: 0.6844
 epoch: 68, train_loss: 0.4445, test_loss: 1.0158, test_f1: 0.6589
 epoch: 69, train_loss: 0.4419, test_loss: 1.0226, test_f1: 0.6785
 epoch: 70, train_loss: 0.4437, test_loss: 1.0198, test_f1: 0.6682
 epoch: 71, train_loss: 0.4424, test_loss: 1.0063, test_f1: 0.6604
 epoch: 72, train_loss: 0.4435, test_loss: 0.9906, test_f1: 0.6857
 epoch: 73, train_loss: 0.4337, test_loss: 1.0278, test_f1: 0.6726
 epoch: 74, train_loss: 0.4442, test_loss: 1.0119, test_f1: 0.6817
 epoch: 75, train_loss: 0.4229, test_loss: 1.0421, test_f1: 0.6731
 epoch: 76, train_loss: 0.4220, test_loss: 1.0727, test_f1: 0.6609
 epoch: 77, train_loss: 0.4365, test_loss: 1.1094, test_f1: 0.6631
 epoch: 78, train_loss: 0.4274, test_loss: 1.1335, test_f1: 0.6521
 epoch: 79, train_loss: 0.4155, test_loss: 1.0684, test_f1: 0.6673
 epoch: 80, train_loss: 0.4366, test_loss: 1.0309, test_f1: 0.6752
 epoch: 81, train_loss: 0.4215, test_loss: 1.0483, test_f1: 0.6665
 epoch: 82, train_loss: 0.4054, test_loss: 1.0804, test_f1: 0.6646
 epoch: 83, train_loss: 0.4082, test_loss: 1.0690, test_f1: 0.6629
 epoch: 84, train_loss: 0.4122, test_loss: 1.1462, test_f1: 0.6672
 epoch: 85, train_loss: 0.4138, test_loss: 1.0426, test_f1: 0.7028
 epoch: 86, train_loss: 0.4180, test_loss: 1.1190, test_f1: 0.6775
 epoch: 87, train_loss: 0.3901, test_loss: 1.1491, test_f1: 0.6748
 epoch: 88, train_loss: 0.4008, test_loss: 1.1387, test_f1: 0.6739
 epoch: 89, train_loss: 0.3976, test_loss: 1.1230, test_f1: 0.6530
 epoch: 90, train_loss: 0.4001, test_loss: 1.1430, test_f1: 0.6700
 epoch: 91, train_loss: 0.3923, test_loss: 1.1223, test_f1: 0.6607
 epoch: 92, train_loss: 0.3927, test_loss: 1.1545, test_f1: 0.6661
 epoch: 93, train_loss: 0.4019, test_loss: 1.1961, test_f1: 0.6498
 epoch: 94, train_loss: 0.3880, test_loss: 1.1656, test_f1: 0.6814
 epoch: 95, train_loss: 0.3849, test_loss: 1.2056, test_f1: 0.6721
 epoch: 96, train_loss: 0.3930, test_loss: 1.1938, test_f1: 0.6762
 epoch: 97, train_loss: 0.3919, test_loss: 1.1637, test_f1: 0.6628
 epoch: 98, train_loss: 0.3812, test_loss: 1.2641, test_f1: 0.6567
 epoch: 99, train_loss: 0.3886, test_loss: 1.1923, test_f1: 0.6682
##################ITERATION #3 ****************************************
 epoch: 0, train_loss: 1.1344, test_loss: 0.9603, test_f1: 0.5077
 epoch: 1, train_loss: 0.9714, test_loss: 0.9639, test_f1: 0.5697
 epoch: 2, train_loss: 0.9527, test_loss: 0.8875, test_f1: 0.5533
 epoch: 3, train_loss: 0.9159, test_loss: 0.8775, test_f1: 0.5329
 epoch: 4, train_loss: 0.8911, test_loss: 0.8893, test_f1: 0.5728
 epoch: 5, train_loss: 0.8758, test_loss: 0.8041, test_f1: 0.5716
 epoch: 6, train_loss: 0.8593, test_loss: 0.8276, test_f1: 0.5661
 epoch: 7, train_loss: 0.8391, test_loss: 0.8266, test_f1: 0.5913
 epoch: 8, train_loss: 0.8234, test_loss: 0.7916, test_f1: 0.6373
 epoch: 9, train_loss: 0.8140, test_loss: 0.8515, test_f1: 0.6219
 epoch: 10, train_loss: 0.7960, test_loss: 0.7751, test_f1: 0.6125
 epoch: 11, train_loss: 0.7847, test_loss: 0.7889, test_f1: 0.6344
 epoch: 12, train_loss: 0.7788, test_loss: 0.7995, test_f1: 0.6334
 epoch: 13, train_loss: 0.7799, test_loss: 0.8080, test_f1: 0.6384
 epoch: 14, train_loss: 0.7848, test_loss: 0.7616, test_f1: 0.6346
 epoch: 15, train_loss: 0.7476, test_loss: 0.8130, test_f1: 0.6466
 epoch: 16, train_loss: 0.7543, test_loss: 0.7560, test_f1: 0.6554
 epoch: 17, train_loss: 0.7401, test_loss: 0.7457, test_f1: 0.6554
 epoch: 18, train_loss: 0.7309, test_loss: 0.7808, test_f1: 0.6490
 epoch: 19, train_loss: 0.7137, test_loss: 0.7616, test_f1: 0.6395
 epoch: 20, train_loss: 0.7169, test_loss: 0.8347, test_f1: 0.6451
 epoch: 21, train_loss: 0.7168, test_loss: 0.8011, test_f1: 0.6419
 epoch: 22, train_loss: 0.6985, test_loss: 0.8170, test_f1: 0.6411
 epoch: 23, train_loss: 0.6898, test_loss: 0.7953, test_f1: 0.6639
 epoch: 24, train_loss: 0.6820, test_loss: 0.8048, test_f1: 0.6768
 epoch: 25, train_loss: 0.6830, test_loss: 0.7826, test_f1: 0.6535
 epoch: 26, train_loss: 0.6809, test_loss: 0.8521, test_f1: 0.6483
 epoch: 27, train_loss: 0.6670, test_loss: 0.8448, test_f1: 0.6521
 epoch: 28, train_loss: 0.6628, test_loss: 0.8492, test_f1: 0.6493
 epoch: 29, train_loss: 0.6648, test_loss: 0.8228, test_f1: 0.6650
 epoch: 30, train_loss: 0.6594, test_loss: 0.8171, test_f1: 0.6541
 epoch: 31, train_loss: 0.6311, test_loss: 0.8641, test_f1: 0.6382
 epoch: 32, train_loss: 0.6316, test_loss: 0.8640, test_f1: 0.6620
 epoch: 33, train_loss: 0.6388, test_loss: 0.8281, test_f1: 0.6622
 epoch: 34, train_loss: 0.6225, test_loss: 0.8525, test_f1: 0.6555
 epoch: 35, train_loss: 0.6322, test_loss: 0.9116, test_f1: 0.6714
 epoch: 36, train_loss: 0.6173, test_loss: 0.8962, test_f1: 0.6625
 epoch: 37, train_loss: 0.6158, test_loss: 0.8142, test_f1: 0.6797
 epoch: 38, train_loss: 0.6210, test_loss: 0.8242, test_f1: 0.6635
 epoch: 39, train_loss: 0.6019, test_loss: 0.8897, test_f1: 0.6480
 epoch: 40, train_loss: 0.5987, test_loss: 0.9069, test_f1: 0.6484
 epoch: 41, train_loss: 0.5899, test_loss: 0.9186, test_f1: 0.6391
 epoch: 42, train_loss: 0.5972, test_loss: 0.8462, test_f1: 0.6648
 epoch: 43, train_loss: 0.5865, test_loss: 0.8933, test_f1: 0.6669
 epoch: 44, train_loss: 0.5879, test_loss: 0.8706, test_f1: 0.6949
 epoch: 45, train_loss: 0.5766, test_loss: 0.8551, test_f1: 0.6714
 epoch: 46, train_loss: 0.5710, test_loss: 0.8917, test_f1: 0.6431
 epoch: 47, train_loss: 0.5648, test_loss: 0.8790, test_f1: 0.6517
 epoch: 48, train_loss: 0.5623, test_loss: 0.9069, test_f1: 0.6562
 epoch: 49, train_loss: 0.5475, test_loss: 0.9512, test_f1: 0.6718
 epoch: 50, train_loss: 0.5441, test_loss: 0.8258, test_f1: 0.6869
 epoch: 51, train_loss: 0.5239, test_loss: 0.8895, test_f1: 0.6696
 epoch: 52, train_loss: 0.5091, test_loss: 0.8620, test_f1: 0.6794
 epoch: 53, train_loss: 0.5279, test_loss: 0.9118, test_f1: 0.6652
 epoch: 54, train_loss: 0.4796, test_loss: 0.9203, test_f1: 0.6723
 epoch: 55, train_loss: 0.5003, test_loss: 0.9420, test_f1: 0.6683
 epoch: 56, train_loss: 0.5087, test_loss: 0.9462, test_f1: 0.6669
 epoch: 57, train_loss: 0.4741, test_loss: 0.9863, test_f1: 0.6627
 epoch: 58, train_loss: 0.4896, test_loss: 0.8875, test_f1: 0.6654
 epoch: 59, train_loss: 0.4696, test_loss: 0.9774, test_f1: 0.6806
 epoch: 60, train_loss: 0.4940, test_loss: 0.9685, test_f1: 0.6808
 epoch: 61, train_loss: 0.5069, test_loss: 1.0096, test_f1: 0.6611
 epoch: 62, train_loss: 0.4759, test_loss: 0.9407, test_f1: 0.6801
 epoch: 63, train_loss: 0.4813, test_loss: 0.9554, test_f1: 0.6788
 epoch: 64, train_loss: 0.4643, test_loss: 0.9599, test_f1: 0.6611
 epoch: 65, train_loss: 0.4568, test_loss: 0.9823, test_f1: 0.6716
 epoch: 66, train_loss: 0.4719, test_loss: 0.9523, test_f1: 0.6880
 epoch: 67, train_loss: 0.4839, test_loss: 1.0498, test_f1: 0.6767
 epoch: 68, train_loss: 0.4746, test_loss: 1.0382, test_f1: 0.6645
 epoch: 69, train_loss: 0.4564, test_loss: 1.0743, test_f1: 0.6746
 epoch: 70, train_loss: 0.4758, test_loss: 0.9914, test_f1: 0.6569
 epoch: 71, train_loss: 0.4632, test_loss: 1.0735, test_f1: 0.6666
 epoch: 72, train_loss: 0.4365, test_loss: 1.0675, test_f1: 0.6778
 epoch: 73, train_loss: 0.4564, test_loss: 1.0080, test_f1: 0.6893
 epoch: 74, train_loss: 0.4460, test_loss: 0.9908, test_f1: 0.6860
 epoch: 75, train_loss: 0.4306, test_loss: 1.0359, test_f1: 0.6858
 epoch: 76, train_loss: 0.4465, test_loss: 1.1221, test_f1: 0.6615
 epoch: 77, train_loss: 0.4464, test_loss: 1.0603, test_f1: 0.6770
 epoch: 78, train_loss: 0.4360, test_loss: 1.0881, test_f1: 0.6802
 epoch: 79, train_loss: 0.4326, test_loss: 1.0532, test_f1: 0.6693
 epoch: 80, train_loss: 0.4293, test_loss: 1.0422, test_f1: 0.6690
 epoch: 81, train_loss: 0.4472, test_loss: 1.0769, test_f1: 0.6794
 epoch: 82, train_loss: 0.4290, test_loss: 1.1368, test_f1: 0.6545
 epoch: 83, train_loss: 0.4558, test_loss: 1.0021, test_f1: 0.6675
 epoch: 84, train_loss: 0.4105, test_loss: 1.1062, test_f1: 0.6775
 epoch: 85, train_loss: 0.4223, test_loss: 1.0334, test_f1: 0.6720
 epoch: 86, train_loss: 0.4250, test_loss: 1.1001, test_f1: 0.6673
 epoch: 87, train_loss: 0.4323, test_loss: 1.1372, test_f1: 0.6696
 epoch: 88, train_loss: 0.4146, test_loss: 1.0870, test_f1: 0.6655
 epoch: 89, train_loss: 0.4039, test_loss: 1.1470, test_f1: 0.6679
 epoch: 90, train_loss: 0.4095, test_loss: 1.1151, test_f1: 0.6752
 epoch: 91, train_loss: 0.4216, test_loss: 1.0883, test_f1: 0.6673
 epoch: 92, train_loss: 0.4192, test_loss: 1.1698, test_f1: 0.6707
 epoch: 93, train_loss: 0.4298, test_loss: 1.1581, test_f1: 0.6795
 epoch: 94, train_loss: 0.4196, test_loss: 1.1056, test_f1: 0.6712
 epoch: 95, train_loss: 0.4154, test_loss: 1.1596, test_f1: 0.6786
 epoch: 96, train_loss: 0.4133, test_loss: 1.1226, test_f1: 0.6868
 epoch: 97, train_loss: 0.4041, test_loss: 1.1048, test_f1: 0.6676
 epoch: 98, train_loss: 0.3961, test_loss: 1.1603, test_f1: 0.6734
 epoch: 99, train_loss: 0.3975, test_loss: 1.1205, test_f1: 0.6794
##################ITERATION #4 ****************************************
 epoch: 0, train_loss: 1.2039, test_loss: 1.0230, test_f1: 0.5226
 epoch: 1, train_loss: 0.9853, test_loss: 0.9832, test_f1: 0.5206
 epoch: 2, train_loss: 0.9478, test_loss: 0.9723, test_f1: 0.5397
 epoch: 3, train_loss: 0.9310, test_loss: 0.9228, test_f1: 0.5139
 epoch: 4, train_loss: 0.9070, test_loss: 0.9125, test_f1: 0.5428
 epoch: 5, train_loss: 0.8758, test_loss: 0.8766, test_f1: 0.5054
 epoch: 6, train_loss: 0.8802, test_loss: 0.8200, test_f1: 0.5652
 epoch: 7, train_loss: 0.8558, test_loss: 0.7992, test_f1: 0.5845
 epoch: 8, train_loss: 0.8420, test_loss: 0.7884, test_f1: 0.6031
 epoch: 9, train_loss: 0.8277, test_loss: 0.8047, test_f1: 0.5913
 epoch: 10, train_loss: 0.8117, test_loss: 0.8019, test_f1: 0.5889
 epoch: 11, train_loss: 0.7991, test_loss: 0.8202, test_f1: 0.6216
 epoch: 12, train_loss: 0.7834, test_loss: 0.7694, test_f1: 0.6206
 epoch: 13, train_loss: 0.7870, test_loss: 0.7843, test_f1: 0.6153
 epoch: 14, train_loss: 0.7788, test_loss: 0.7628, test_f1: 0.6213
 epoch: 15, train_loss: 0.7575, test_loss: 0.8009, test_f1: 0.6243
 epoch: 16, train_loss: 0.7507, test_loss: 0.7566, test_f1: 0.6438
 epoch: 17, train_loss: 0.7410, test_loss: 0.7430, test_f1: 0.6493
 epoch: 18, train_loss: 0.7167, test_loss: 0.7864, test_f1: 0.6232
 epoch: 19, train_loss: 0.7191, test_loss: 0.7981, test_f1: 0.6344
 epoch: 20, train_loss: 0.7290, test_loss: 0.7389, test_f1: 0.6578
 epoch: 21, train_loss: 0.6893, test_loss: 0.8216, test_f1: 0.6338
 epoch: 22, train_loss: 0.7099, test_loss: 0.7368, test_f1: 0.6681
 epoch: 23, train_loss: 0.7051, test_loss: 0.8289, test_f1: 0.6137
 epoch: 24, train_loss: 0.6958, test_loss: 0.8075, test_f1: 0.6830
 epoch: 25, train_loss: 0.6732, test_loss: 0.8210, test_f1: 0.6324
 epoch: 26, train_loss: 0.6617, test_loss: 0.7698, test_f1: 0.6651
 epoch: 27, train_loss: 0.6808, test_loss: 0.8016, test_f1: 0.6478
 epoch: 28, train_loss: 0.6636, test_loss: 0.7923, test_f1: 0.6418
 epoch: 29, train_loss: 0.6632, test_loss: 0.8384, test_f1: 0.6763
 epoch: 30, train_loss: 0.6509, test_loss: 0.8172, test_f1: 0.6936
 epoch: 31, train_loss: 0.6332, test_loss: 0.7886, test_f1: 0.6633
 epoch: 32, train_loss: 0.6168, test_loss: 0.8105, test_f1: 0.6422
 epoch: 33, train_loss: 0.6581, test_loss: 0.8527, test_f1: 0.6435
 epoch: 34, train_loss: 0.6381, test_loss: 0.8812, test_f1: 0.6586
 epoch: 35, train_loss: 0.6209, test_loss: 0.8047, test_f1: 0.6682
 epoch: 36, train_loss: 0.6230, test_loss: 0.8233, test_f1: 0.6414
 epoch: 37, train_loss: 0.6166, test_loss: 0.8481, test_f1: 0.6369
 epoch: 38, train_loss: 0.6111, test_loss: 0.8160, test_f1: 0.6679
 epoch: 39, train_loss: 0.6070, test_loss: 0.8245, test_f1: 0.6596
 epoch: 40, train_loss: 0.5994, test_loss: 0.8737, test_f1: 0.6752
 epoch: 41, train_loss: 0.6014, test_loss: 0.8181, test_f1: 0.6931
 epoch: 42, train_loss: 0.6050, test_loss: 0.8969, test_f1: 0.6824
 epoch: 43, train_loss: 0.5756, test_loss: 0.8865, test_f1: 0.6756
 epoch: 44, train_loss: 0.5684, test_loss: 0.8893, test_f1: 0.6550
 epoch: 45, train_loss: 0.5681, test_loss: 0.8104, test_f1: 0.6830
 epoch: 46, train_loss: 0.5681, test_loss: 0.9601, test_f1: 0.6498
 epoch: 47, train_loss: 0.5857, test_loss: 0.8512, test_f1: 0.6802
 epoch: 48, train_loss: 0.5602, test_loss: 0.8605, test_f1: 0.6656
 epoch: 49, train_loss: 0.5613, test_loss: 0.9517, test_f1: 0.6561
 epoch: 50, train_loss: 0.5380, test_loss: 0.9568, test_f1: 0.6849
 epoch: 51, train_loss: 0.5402, test_loss: 0.8821, test_f1: 0.6750
 epoch: 52, train_loss: 0.5197, test_loss: 0.9666, test_f1: 0.6773
 epoch: 53, train_loss: 0.5163, test_loss: 0.9228, test_f1: 0.6903
 epoch: 54, train_loss: 0.4945, test_loss: 0.8801, test_f1: 0.6912
 epoch: 55, train_loss: 0.5017, test_loss: 0.9279, test_f1: 0.6792
 epoch: 56, train_loss: 0.4912, test_loss: 0.9236, test_f1: 0.6746
 epoch: 57, train_loss: 0.4830, test_loss: 0.9976, test_f1: 0.6708
 epoch: 58, train_loss: 0.4892, test_loss: 0.9896, test_f1: 0.6819
 epoch: 59, train_loss: 0.4866, test_loss: 0.9684, test_f1: 0.6875
 epoch: 60, train_loss: 0.4826, test_loss: 0.9494, test_f1: 0.6661
 epoch: 61, train_loss: 0.4832, test_loss: 1.0075, test_f1: 0.6896
 epoch: 62, train_loss: 0.4948, test_loss: 1.0247, test_f1: 0.6633
 epoch: 63, train_loss: 0.4859, test_loss: 0.9783, test_f1: 0.6864
 epoch: 64, train_loss: 0.4741, test_loss: 0.9805, test_f1: 0.6744
 epoch: 65, train_loss: 0.4782, test_loss: 1.0030, test_f1: 0.6749
 epoch: 66, train_loss: 0.4841, test_loss: 0.9816, test_f1: 0.6953
 epoch: 67, train_loss: 0.4689, test_loss: 1.0246, test_f1: 0.6617
 epoch: 68, train_loss: 0.4746, test_loss: 1.0528, test_f1: 0.6456
 epoch: 69, train_loss: 0.4650, test_loss: 0.9913, test_f1: 0.6681
 epoch: 70, train_loss: 0.4361, test_loss: 1.0158, test_f1: 0.6790
 epoch: 71, train_loss: 0.4675, test_loss: 1.0326, test_f1: 0.6808
 epoch: 72, train_loss: 0.4669, test_loss: 0.9820, test_f1: 0.6713
 epoch: 73, train_loss: 0.4550, test_loss: 0.9732, test_f1: 0.6463
 epoch: 74, train_loss: 0.4581, test_loss: 0.9823, test_f1: 0.6677
 epoch: 75, train_loss: 0.4373, test_loss: 1.0724, test_f1: 0.6836
 epoch: 76, train_loss: 0.4557, test_loss: 1.0101, test_f1: 0.6555
 epoch: 77, train_loss: 0.4700, test_loss: 1.0113, test_f1: 0.6864
 epoch: 78, train_loss: 0.4335, test_loss: 0.9913, test_f1: 0.6932
 epoch: 79, train_loss: 0.4500, test_loss: 0.9907, test_f1: 0.6778
 epoch: 80, train_loss: 0.4364, test_loss: 1.0190, test_f1: 0.6634
 epoch: 81, train_loss: 0.4288, test_loss: 1.0465, test_f1: 0.6420
 epoch: 82, train_loss: 0.4421, test_loss: 1.0635, test_f1: 0.6643
 epoch: 83, train_loss: 0.4376, test_loss: 1.0724, test_f1: 0.6850
 epoch: 84, train_loss: 0.4267, test_loss: 0.9939, test_f1: 0.6710
 epoch: 85, train_loss: 0.4191, test_loss: 1.0405, test_f1: 0.6624
 epoch: 86, train_loss: 0.4273, test_loss: 1.0138, test_f1: 0.6731
 epoch: 87, train_loss: 0.4285, test_loss: 1.0930, test_f1: 0.6905
 epoch: 88, train_loss: 0.4212, test_loss: 1.0981, test_f1: 0.6773
 epoch: 89, train_loss: 0.4120, test_loss: 1.0768, test_f1: 0.7008
 epoch: 90, train_loss: 0.4271, test_loss: 1.1336, test_f1: 0.6517
 epoch: 91, train_loss: 0.4423, test_loss: 1.0806, test_f1: 0.6680
 epoch: 92, train_loss: 0.4006, test_loss: 1.0519, test_f1: 0.6560
 epoch: 93, train_loss: 0.4380, test_loss: 1.1817, test_f1: 0.6570
 epoch: 94, train_loss: 0.4005, test_loss: 1.1361, test_f1: 0.6608
 epoch: 95, train_loss: 0.4220, test_loss: 1.1050, test_f1: 0.6727
 epoch: 96, train_loss: 0.4122, test_loss: 1.1364, test_f1: 0.6797
 epoch: 97, train_loss: 0.4169, test_loss: 1.1086, test_f1: 0.6767
 epoch: 98, train_loss: 0.3947, test_loss: 1.0566, test_f1: 0.6952
 epoch: 99, train_loss: 0.4082, test_loss: 1.1070, test_f1: 0.6921
##################ITERATION #5 ****************************************
 epoch: 0, train_loss: 1.1679, test_loss: 0.9948, test_f1: 0.5447
 epoch: 1, train_loss: 0.9869, test_loss: 0.9548, test_f1: 0.5441
 epoch: 2, train_loss: 0.9558, test_loss: 0.9279, test_f1: 0.5529
 epoch: 3, train_loss: 0.9338, test_loss: 0.8519, test_f1: 0.5488
 epoch: 4, train_loss: 0.9177, test_loss: 0.8534, test_f1: 0.5464
 epoch: 5, train_loss: 0.8963, test_loss: 0.8339, test_f1: 0.5826
 epoch: 6, train_loss: 0.8745, test_loss: 0.8082, test_f1: 0.5546
 epoch: 7, train_loss: 0.8524, test_loss: 0.8176, test_f1: 0.5950
 epoch: 8, train_loss: 0.8529, test_loss: 0.7812, test_f1: 0.5829
 epoch: 9, train_loss: 0.8457, test_loss: 0.7453, test_f1: 0.6317
 epoch: 10, train_loss: 0.8221, test_loss: 0.8621, test_f1: 0.5720
 epoch: 11, train_loss: 0.8031, test_loss: 0.7754, test_f1: 0.6084
 epoch: 12, train_loss: 0.7894, test_loss: 0.8237, test_f1: 0.6193
 epoch: 13, train_loss: 0.7850, test_loss: 0.7704, test_f1: 0.6314
 epoch: 14, train_loss: 0.7747, test_loss: 0.8132, test_f1: 0.5876
 epoch: 15, train_loss: 0.7654, test_loss: 0.7431, test_f1: 0.6526
 epoch: 16, train_loss: 0.7743, test_loss: 0.7268, test_f1: 0.6395
 epoch: 17, train_loss: 0.7433, test_loss: 0.7730, test_f1: 0.6264
 epoch: 18, train_loss: 0.7278, test_loss: 0.8237, test_f1: 0.6289
 epoch: 19, train_loss: 0.7288, test_loss: 0.8350, test_f1: 0.5534
 epoch: 20, train_loss: 0.7218, test_loss: 0.7278, test_f1: 0.6815
 epoch: 21, train_loss: 0.7119, test_loss: 0.7288, test_f1: 0.6397
 epoch: 22, train_loss: 0.7063, test_loss: 0.7554, test_f1: 0.6535
 epoch: 23, train_loss: 0.6988, test_loss: 0.7186, test_f1: 0.6636
 epoch: 24, train_loss: 0.6875, test_loss: 0.7196, test_f1: 0.6544
 epoch: 25, train_loss: 0.6733, test_loss: 0.7590, test_f1: 0.6144
 epoch: 26, train_loss: 0.6859, test_loss: 0.7578, test_f1: 0.6714
 epoch: 27, train_loss: 0.6839, test_loss: 0.7299, test_f1: 0.6644
 epoch: 28, train_loss: 0.6547, test_loss: 0.7234, test_f1: 0.6527
 epoch: 29, train_loss: 0.6423, test_loss: 0.7580, test_f1: 0.6478
 epoch: 30, train_loss: 0.6444, test_loss: 0.6967, test_f1: 0.6662
 epoch: 31, train_loss: 0.6322, test_loss: 0.7156, test_f1: 0.6753
 epoch: 32, train_loss: 0.6357, test_loss: 0.8009, test_f1: 0.6484
 epoch: 33, train_loss: 0.6368, test_loss: 0.7926, test_f1: 0.6690
 epoch: 34, train_loss: 0.6106, test_loss: 0.7878, test_f1: 0.6597
 epoch: 35, train_loss: 0.6267, test_loss: 0.7666, test_f1: 0.6617
 epoch: 36, train_loss: 0.6034, test_loss: 0.8048, test_f1: 0.6518
 epoch: 37, train_loss: 0.6074, test_loss: 0.8273, test_f1: 0.6710
 epoch: 38, train_loss: 0.6051, test_loss: 0.7303, test_f1: 0.6613
 epoch: 39, train_loss: 0.5999, test_loss: 0.8258, test_f1: 0.6256
 epoch: 40, train_loss: 0.6009, test_loss: 0.7267, test_f1: 0.6514
 epoch: 41, train_loss: 0.5840, test_loss: 0.7522, test_f1: 0.6651
 epoch: 42, train_loss: 0.6046, test_loss: 0.8272, test_f1: 0.6399
 epoch: 43, train_loss: 0.5762, test_loss: 0.7132, test_f1: 0.6593
 epoch: 44, train_loss: 0.5856, test_loss: 0.7663, test_f1: 0.6531
 epoch: 45, train_loss: 0.5806, test_loss: 0.8230, test_f1: 0.6848
 epoch: 46, train_loss: 0.5762, test_loss: 0.7520, test_f1: 0.6773
 epoch: 47, train_loss: 0.5621, test_loss: 0.7997, test_f1: 0.6841
 epoch: 48, train_loss: 0.5493, test_loss: 0.8374, test_f1: 0.6909
 epoch: 49, train_loss: 0.5754, test_loss: 0.8091, test_f1: 0.6595
 epoch: 50, train_loss: 0.5535, test_loss: 0.8614, test_f1: 0.6782
 epoch: 51, train_loss: 0.5199, test_loss: 0.8306, test_f1: 0.6598
 epoch: 52, train_loss: 0.5216, test_loss: 0.8320, test_f1: 0.6809
 epoch: 53, train_loss: 0.5006, test_loss: 0.8284, test_f1: 0.6630
 epoch: 54, train_loss: 0.5078, test_loss: 0.8831, test_f1: 0.6742
 epoch: 55, train_loss: 0.5020, test_loss: 0.8639, test_f1: 0.6901
 epoch: 56, train_loss: 0.5026, test_loss: 0.8974, test_f1: 0.6696
 epoch: 57, train_loss: 0.4832, test_loss: 0.8311, test_f1: 0.6634
 epoch: 58, train_loss: 0.4792, test_loss: 0.8700, test_f1: 0.6642
 epoch: 59, train_loss: 0.4935, test_loss: 0.8294, test_f1: 0.6573
 epoch: 60, train_loss: 0.4856, test_loss: 0.7910, test_f1: 0.7125
 epoch: 61, train_loss: 0.4790, test_loss: 0.8582, test_f1: 0.6890
 epoch: 62, train_loss: 0.4812, test_loss: 0.8558, test_f1: 0.6651
 epoch: 63, train_loss: 0.4722, test_loss: 0.8292, test_f1: 0.6803
 epoch: 64, train_loss: 0.4727, test_loss: 0.9091, test_f1: 0.6824
 epoch: 65, train_loss: 0.4728, test_loss: 0.8785, test_f1: 0.6647
 epoch: 66, train_loss: 0.4534, test_loss: 0.8543, test_f1: 0.6674
 epoch: 67, train_loss: 0.4570, test_loss: 0.8582, test_f1: 0.6903
 epoch: 68, train_loss: 0.4713, test_loss: 0.8911, test_f1: 0.6689
 epoch: 69, train_loss: 0.4418, test_loss: 0.8649, test_f1: 0.6640
 epoch: 70, train_loss: 0.4343, test_loss: 0.8531, test_f1: 0.6824
 epoch: 71, train_loss: 0.4518, test_loss: 0.8745, test_f1: 0.6647
 epoch: 72, train_loss: 0.4466, test_loss: 0.9371, test_f1: 0.6701
 epoch: 73, train_loss: 0.4321, test_loss: 0.9133, test_f1: 0.6831
 epoch: 74, train_loss: 0.4408, test_loss: 0.9655, test_f1: 0.6722
 epoch: 75, train_loss: 0.4422, test_loss: 0.8765, test_f1: 0.6604
 epoch: 76, train_loss: 0.4428, test_loss: 0.8916, test_f1: 0.6928
 epoch: 77, train_loss: 0.4488, test_loss: 0.9762, test_f1: 0.6676
 epoch: 78, train_loss: 0.4356, test_loss: 0.9032, test_f1: 0.6780
 epoch: 79, train_loss: 0.4334, test_loss: 0.9228, test_f1: 0.6688
 epoch: 80, train_loss: 0.4514, test_loss: 0.9068, test_f1: 0.6814
 epoch: 81, train_loss: 0.4463, test_loss: 0.9817, test_f1: 0.6630
 epoch: 82, train_loss: 0.4365, test_loss: 0.9135, test_f1: 0.6964
 epoch: 83, train_loss: 0.4301, test_loss: 0.9004, test_f1: 0.6714
 epoch: 84, train_loss: 0.3937, test_loss: 0.9357, test_f1: 0.6596
 epoch: 85, train_loss: 0.4206, test_loss: 0.9557, test_f1: 0.6869
 epoch: 86, train_loss: 0.4077, test_loss: 0.9656, test_f1: 0.7012
 epoch: 87, train_loss: 0.4218, test_loss: 0.9523, test_f1: 0.6695
 epoch: 88, train_loss: 0.4289, test_loss: 0.9516, test_f1: 0.6742
 epoch: 89, train_loss: 0.4052, test_loss: 1.0359, test_f1: 0.6644
 epoch: 90, train_loss: 0.4101, test_loss: 1.0020, test_f1: 0.6601
 epoch: 91, train_loss: 0.4100, test_loss: 0.9195, test_f1: 0.6973
 epoch: 92, train_loss: 0.4202, test_loss: 0.9456, test_f1: 0.6831
 epoch: 93, train_loss: 0.4118, test_loss: 1.0629, test_f1: 0.6530
 epoch: 94, train_loss: 0.4244, test_loss: 0.9802, test_f1: 0.6422
 epoch: 95, train_loss: 0.4192, test_loss: 0.9733, test_f1: 0.6773
 epoch: 96, train_loss: 0.4009, test_loss: 0.9967, test_f1: 0.6608
 epoch: 97, train_loss: 0.3841, test_loss: 1.0043, test_f1: 0.6649
 epoch: 98, train_loss: 0.3796, test_loss: 0.9901, test_f1: 0.6544
 epoch: 99, train_loss: 0.4002, test_loss: 1.0105, test_f1: 0.6826
##################ITERATION #6 ****************************************
 epoch: 0, train_loss: 1.2347, test_loss: 0.9876, test_f1: 0.5424
 epoch: 1, train_loss: 1.0145, test_loss: 0.9771, test_f1: 0.4842
 epoch: 2, train_loss: 0.9574, test_loss: 0.9663, test_f1: 0.5131
 epoch: 3, train_loss: 0.9429, test_loss: 0.9176, test_f1: 0.5200
 epoch: 4, train_loss: 0.9249, test_loss: 0.9427, test_f1: 0.5392
 epoch: 5, train_loss: 0.9043, test_loss: 0.9208, test_f1: 0.5375
 epoch: 6, train_loss: 0.8841, test_loss: 0.9068, test_f1: 0.5854
 epoch: 7, train_loss: 0.8644, test_loss: 0.9072, test_f1: 0.5419
 epoch: 8, train_loss: 0.8719, test_loss: 0.8671, test_f1: 0.6043
 epoch: 9, train_loss: 0.8258, test_loss: 0.8275, test_f1: 0.5657
 epoch: 10, train_loss: 0.8347, test_loss: 0.8736, test_f1: 0.5866
 epoch: 11, train_loss: 0.8251, test_loss: 0.8649, test_f1: 0.5988
 epoch: 12, train_loss: 0.8113, test_loss: 0.8769, test_f1: 0.6097
 epoch: 13, train_loss: 0.7888, test_loss: 0.8234, test_f1: 0.6062
 epoch: 14, train_loss: 0.7761, test_loss: 0.8274, test_f1: 0.6273
 epoch: 15, train_loss: 0.7605, test_loss: 0.8409, test_f1: 0.6273
 epoch: 16, train_loss: 0.7633, test_loss: 0.8091, test_f1: 0.6266
 epoch: 17, train_loss: 0.7487, test_loss: 0.8085, test_f1: 0.6392
 epoch: 18, train_loss: 0.7511, test_loss: 0.8492, test_f1: 0.6208
 epoch: 19, train_loss: 0.7306, test_loss: 0.8396, test_f1: 0.6471
 epoch: 20, train_loss: 0.7237, test_loss: 0.7658, test_f1: 0.6319
 epoch: 21, train_loss: 0.7158, test_loss: 0.8079, test_f1: 0.6013
 epoch: 22, train_loss: 0.7030, test_loss: 0.8473, test_f1: 0.6379
 epoch: 23, train_loss: 0.7012, test_loss: 0.8559, test_f1: 0.6407
 epoch: 24, train_loss: 0.6735, test_loss: 0.8680, test_f1: 0.6056
 epoch: 25, train_loss: 0.6969, test_loss: 0.8535, test_f1: 0.6559
 epoch: 26, train_loss: 0.6630, test_loss: 0.8351, test_f1: 0.6382
 epoch: 27, train_loss: 0.6830, test_loss: 0.8793, test_f1: 0.6045
 epoch: 28, train_loss: 0.6553, test_loss: 0.8695, test_f1: 0.6621
 epoch: 29, train_loss: 0.6596, test_loss: 0.8886, test_f1: 0.6660
 epoch: 30, train_loss: 0.6561, test_loss: 0.8562, test_f1: 0.6171
 epoch: 31, train_loss: 0.6421, test_loss: 0.7989, test_f1: 0.6502
 epoch: 32, train_loss: 0.6492, test_loss: 0.8199, test_f1: 0.6354
 epoch: 33, train_loss: 0.6075, test_loss: 0.9050, test_f1: 0.6487
 epoch: 34, train_loss: 0.6168, test_loss: 0.8263, test_f1: 0.6615
 epoch: 35, train_loss: 0.6157, test_loss: 0.8946, test_f1: 0.6159
 epoch: 36, train_loss: 0.6281, test_loss: 0.8571, test_f1: 0.6478
 epoch: 37, train_loss: 0.6234, test_loss: 0.8313, test_f1: 0.6372
 epoch: 38, train_loss: 0.6043, test_loss: 0.8831, test_f1: 0.6628
 epoch: 39, train_loss: 0.6174, test_loss: 0.8634, test_f1: 0.6475
 epoch: 40, train_loss: 0.6074, test_loss: 0.9455, test_f1: 0.6524
 epoch: 41, train_loss: 0.6005, test_loss: 0.8879, test_f1: 0.6300
 epoch: 42, train_loss: 0.5952, test_loss: 0.9343, test_f1: 0.6329
 epoch: 43, train_loss: 0.5852, test_loss: 0.8566, test_f1: 0.6629
 epoch: 44, train_loss: 0.5817, test_loss: 0.8110, test_f1: 0.6744
 epoch: 45, train_loss: 0.5798, test_loss: 0.8815, test_f1: 0.6663
 epoch: 46, train_loss: 0.5524, test_loss: 0.8826, test_f1: 0.6477
 epoch: 47, train_loss: 0.5611, test_loss: 0.8433, test_f1: 0.6583
 epoch: 48, train_loss: 0.5660, test_loss: 0.9015, test_f1: 0.6478
 epoch: 49, train_loss: 0.5598, test_loss: 0.9391, test_f1: 0.6248
 epoch: 50, train_loss: 0.5643, test_loss: 0.9048, test_f1: 0.6422
 epoch: 51, train_loss: 0.5403, test_loss: 0.8960, test_f1: 0.6529
 epoch: 52, train_loss: 0.4933, test_loss: 0.9092, test_f1: 0.6722
 epoch: 53, train_loss: 0.4971, test_loss: 0.8877, test_f1: 0.6494
 epoch: 54, train_loss: 0.4957, test_loss: 0.9638, test_f1: 0.6475
 epoch: 55, train_loss: 0.4953, test_loss: 0.8781, test_f1: 0.6534
 epoch: 56, train_loss: 0.4854, test_loss: 0.9268, test_f1: 0.6545
 epoch: 57, train_loss: 0.4863, test_loss: 0.9601, test_f1: 0.6483
 epoch: 58, train_loss: 0.4895, test_loss: 0.9302, test_f1: 0.6542
 epoch: 59, train_loss: 0.4856, test_loss: 0.9711, test_f1: 0.6517
 epoch: 60, train_loss: 0.4731, test_loss: 1.0088, test_f1: 0.6611
 epoch: 61, train_loss: 0.4701, test_loss: 1.0100, test_f1: 0.6417
 epoch: 62, train_loss: 0.4605, test_loss: 0.9467, test_f1: 0.6467
 epoch: 63, train_loss: 0.4694, test_loss: 0.9433, test_f1: 0.6572
 epoch: 64, train_loss: 0.4648, test_loss: 0.9360, test_f1: 0.6605
 epoch: 65, train_loss: 0.4700, test_loss: 0.9127, test_f1: 0.6796
 epoch: 66, train_loss: 0.4630, test_loss: 0.9920, test_f1: 0.6777
 epoch: 67, train_loss: 0.4479, test_loss: 0.9683, test_f1: 0.6520
 epoch: 68, train_loss: 0.4576, test_loss: 1.0170, test_f1: 0.6515
 epoch: 69, train_loss: 0.4740, test_loss: 0.9799, test_f1: 0.6503
 epoch: 70, train_loss: 0.4506, test_loss: 0.9788, test_f1: 0.6727
 epoch: 71, train_loss: 0.4441, test_loss: 0.9411, test_f1: 0.6613
 epoch: 72, train_loss: 0.4440, test_loss: 0.9723, test_f1: 0.6662
 epoch: 73, train_loss: 0.4431, test_loss: 1.0425, test_f1: 0.6628
 epoch: 74, train_loss: 0.4285, test_loss: 1.0204, test_f1: 0.6689
 epoch: 75, train_loss: 0.4460, test_loss: 1.0998, test_f1: 0.6460
 epoch: 76, train_loss: 0.4415, test_loss: 1.0691, test_f1: 0.6519
 epoch: 77, train_loss: 0.4268, test_loss: 1.0404, test_f1: 0.6545
 epoch: 78, train_loss: 0.4172, test_loss: 1.0718, test_f1: 0.6629
 epoch: 79, train_loss: 0.4363, test_loss: 1.0532, test_f1: 0.6504
 epoch: 80, train_loss: 0.4250, test_loss: 1.0973, test_f1: 0.6728
 epoch: 81, train_loss: 0.4125, test_loss: 1.0950, test_f1: 0.6518
 epoch: 82, train_loss: 0.4186, test_loss: 1.0926, test_f1: 0.6667
 epoch: 83, train_loss: 0.4150, test_loss: 1.0299, test_f1: 0.6557
 epoch: 84, train_loss: 0.4468, test_loss: 1.0144, test_f1: 0.6491
 epoch: 85, train_loss: 0.4083, test_loss: 1.0639, test_f1: 0.6374
 epoch: 86, train_loss: 0.4117, test_loss: 1.1213, test_f1: 0.6454
 epoch: 87, train_loss: 0.4106, test_loss: 1.0782, test_f1: 0.6532
 epoch: 88, train_loss: 0.4207, test_loss: 1.0715, test_f1: 0.6693
 epoch: 89, train_loss: 0.4005, test_loss: 1.1425, test_f1: 0.6453
 epoch: 90, train_loss: 0.3862, test_loss: 1.0960, test_f1: 0.6555
 epoch: 91, train_loss: 0.4021, test_loss: 1.0829, test_f1: 0.6514
 epoch: 92, train_loss: 0.3873, test_loss: 1.0982, test_f1: 0.6424
 epoch: 93, train_loss: 0.4078, test_loss: 1.1598, test_f1: 0.6382
 epoch: 94, train_loss: 0.3980, test_loss: 1.0848, test_f1: 0.6528
 epoch: 95, train_loss: 0.4140, test_loss: 1.2284, test_f1: 0.6601
 epoch: 96, train_loss: 0.3909, test_loss: 1.1763, test_f1: 0.6367
 epoch: 97, train_loss: 0.4152, test_loss: 1.1356, test_f1: 0.6493
 epoch: 98, train_loss: 0.4271, test_loss: 1.1588, test_f1: 0.6537
 epoch: 99, train_loss: 0.4064, test_loss: 1.0974, test_f1: 0.6545
##################ITERATION #7 ****************************************
 epoch: 0, train_loss: 1.2000, test_loss: 1.0657, test_f1: 0.4803
 epoch: 1, train_loss: 0.9843, test_loss: 0.9807, test_f1: 0.5592
 epoch: 2, train_loss: 0.9411, test_loss: 0.9424, test_f1: 0.5696
 epoch: 3, train_loss: 0.9208, test_loss: 0.8972, test_f1: 0.5562
 epoch: 4, train_loss: 0.8988, test_loss: 0.8553, test_f1: 0.5941
 epoch: 5, train_loss: 0.8724, test_loss: 0.9296, test_f1: 0.5907
 epoch: 6, train_loss: 0.8534, test_loss: 0.8010, test_f1: 0.5806
 epoch: 7, train_loss: 0.8505, test_loss: 0.8588, test_f1: 0.6016
 epoch: 8, train_loss: 0.8232, test_loss: 0.8051, test_f1: 0.6152
 epoch: 9, train_loss: 0.8220, test_loss: 0.8572, test_f1: 0.5910
 epoch: 10, train_loss: 0.7893, test_loss: 0.8180, test_f1: 0.5983
 epoch: 11, train_loss: 0.7968, test_loss: 0.7779, test_f1: 0.6135
 epoch: 12, train_loss: 0.7826, test_loss: 0.8476, test_f1: 0.6320
 epoch: 13, train_loss: 0.7830, test_loss: 0.8524, test_f1: 0.6360
 epoch: 14, train_loss: 0.7441, test_loss: 0.7817, test_f1: 0.6379
 epoch: 15, train_loss: 0.7516, test_loss: 0.8349, test_f1: 0.6315
 epoch: 16, train_loss: 0.7358, test_loss: 0.8142, test_f1: 0.6426
 epoch: 17, train_loss: 0.7386, test_loss: 0.7944, test_f1: 0.6429
 epoch: 18, train_loss: 0.7250, test_loss: 0.7981, test_f1: 0.6357
 epoch: 19, train_loss: 0.7111, test_loss: 0.8661, test_f1: 0.6379
 epoch: 20, train_loss: 0.7124, test_loss: 0.8164, test_f1: 0.6269
 epoch: 21, train_loss: 0.6962, test_loss: 0.7675, test_f1: 0.6351
 epoch: 22, train_loss: 0.6862, test_loss: 0.7113, test_f1: 0.6548
 epoch: 23, train_loss: 0.6715, test_loss: 0.8359, test_f1: 0.6532
 epoch: 24, train_loss: 0.6504, test_loss: 0.7883, test_f1: 0.6508
 epoch: 25, train_loss: 0.6587, test_loss: 0.8095, test_f1: 0.6499
 epoch: 26, train_loss: 0.6571, test_loss: 0.7250, test_f1: 0.6502
 epoch: 27, train_loss: 0.6398, test_loss: 0.8388, test_f1: 0.6552
 epoch: 28, train_loss: 0.6459, test_loss: 0.9338, test_f1: 0.6508
 epoch: 29, train_loss: 0.6446, test_loss: 0.8296, test_f1: 0.6459
 epoch: 30, train_loss: 0.6277, test_loss: 0.8661, test_f1: 0.6555
 epoch: 31, train_loss: 0.6211, test_loss: 0.7865, test_f1: 0.6717
 epoch: 32, train_loss: 0.6229, test_loss: 0.8308, test_f1: 0.6634
 epoch: 33, train_loss: 0.6321, test_loss: 0.8199, test_f1: 0.6720
 epoch: 34, train_loss: 0.6195, test_loss: 0.9209, test_f1: 0.6724
 epoch: 35, train_loss: 0.5942, test_loss: 0.9500, test_f1: 0.6510
 epoch: 36, train_loss: 0.5884, test_loss: 0.7762, test_f1: 0.6662
 epoch: 37, train_loss: 0.5978, test_loss: 0.8891, test_f1: 0.6556
 epoch: 38, train_loss: 0.5786, test_loss: 0.9340, test_f1: 0.6707
 epoch: 39, train_loss: 0.5850, test_loss: 0.9172, test_f1: 0.6757
 epoch: 40, train_loss: 0.5926, test_loss: 0.9381, test_f1: 0.6627
 epoch: 41, train_loss: 0.5655, test_loss: 0.9379, test_f1: 0.6525
 epoch: 42, train_loss: 0.5723, test_loss: 0.8738, test_f1: 0.6567
 epoch: 43, train_loss: 0.5736, test_loss: 0.9243, test_f1: 0.6684
 epoch: 44, train_loss: 0.5580, test_loss: 0.9995, test_f1: 0.6392
 epoch: 45, train_loss: 0.5643, test_loss: 0.9179, test_f1: 0.6613
 epoch: 46, train_loss: 0.5692, test_loss: 0.9193, test_f1: 0.6589
 epoch: 47, train_loss: 0.5583, test_loss: 0.9306, test_f1: 0.6928
 epoch: 48, train_loss: 0.5337, test_loss: 0.9179, test_f1: 0.6701
 epoch: 49, train_loss: 0.5305, test_loss: 0.9564, test_f1: 0.6724
 epoch: 50, train_loss: 0.5345, test_loss: 0.9269, test_f1: 0.6714
 epoch: 51, train_loss: 0.5127, test_loss: 0.9416, test_f1: 0.6816
 epoch: 52, train_loss: 0.4904, test_loss: 0.9504, test_f1: 0.6841
 epoch: 53, train_loss: 0.4899, test_loss: 0.9562, test_f1: 0.6783
 epoch: 54, train_loss: 0.4879, test_loss: 0.9583, test_f1: 0.6602
 epoch: 55, train_loss: 0.4763, test_loss: 1.0059, test_f1: 0.6469
 epoch: 56, train_loss: 0.4646, test_loss: 0.9288, test_f1: 0.6621
 epoch: 57, train_loss: 0.4727, test_loss: 0.9636, test_f1: 0.6873
 epoch: 58, train_loss: 0.4795, test_loss: 0.9667, test_f1: 0.6823
 epoch: 59, train_loss: 0.4734, test_loss: 0.9849, test_f1: 0.6791
 epoch: 60, train_loss: 0.4570, test_loss: 0.9884, test_f1: 0.6823
 epoch: 61, train_loss: 0.4569, test_loss: 0.9922, test_f1: 0.6684
 epoch: 62, train_loss: 0.4404, test_loss: 1.0410, test_f1: 0.6627
 epoch: 63, train_loss: 0.4638, test_loss: 1.0260, test_f1: 0.6737
 epoch: 64, train_loss: 0.4463, test_loss: 1.0125, test_f1: 0.6947
 epoch: 65, train_loss: 0.4453, test_loss: 1.0143, test_f1: 0.6921
 epoch: 66, train_loss: 0.4336, test_loss: 1.0804, test_f1: 0.6975
 epoch: 67, train_loss: 0.4482, test_loss: 1.1568, test_f1: 0.6801
 epoch: 68, train_loss: 0.4326, test_loss: 1.0632, test_f1: 0.6886
 epoch: 69, train_loss: 0.4379, test_loss: 1.0955, test_f1: 0.6763
 epoch: 70, train_loss: 0.4113, test_loss: 1.0832, test_f1: 0.6610
 epoch: 71, train_loss: 0.4428, test_loss: 1.1393, test_f1: 0.6566
 epoch: 72, train_loss: 0.4153, test_loss: 1.1149, test_f1: 0.6615
 epoch: 73, train_loss: 0.4212, test_loss: 1.1392, test_f1: 0.6783
 epoch: 74, train_loss: 0.4226, test_loss: 1.1457, test_f1: 0.6551
 epoch: 75, train_loss: 0.4102, test_loss: 1.1173, test_f1: 0.6769
 epoch: 76, train_loss: 0.4160, test_loss: 1.0973, test_f1: 0.6744
 epoch: 77, train_loss: 0.4150, test_loss: 1.1631, test_f1: 0.6666
 epoch: 78, train_loss: 0.4071, test_loss: 1.2048, test_f1: 0.6726
 epoch: 79, train_loss: 0.4215, test_loss: 1.1449, test_f1: 0.6542
 epoch: 80, train_loss: 0.4086, test_loss: 1.2360, test_f1: 0.6725
 epoch: 81, train_loss: 0.3970, test_loss: 1.1373, test_f1: 0.6769
 epoch: 82, train_loss: 0.4023, test_loss: 1.1606, test_f1: 0.6802
 epoch: 83, train_loss: 0.4161, test_loss: 1.1700, test_f1: 0.6740
 epoch: 84, train_loss: 0.3950, test_loss: 1.1364, test_f1: 0.6791
 epoch: 85, train_loss: 0.4021, test_loss: 1.1757, test_f1: 0.6727
 epoch: 86, train_loss: 0.3741, test_loss: 1.1283, test_f1: 0.6689
 epoch: 87, train_loss: 0.4002, test_loss: 1.2348, test_f1: 0.6672
 epoch: 88, train_loss: 0.3882, test_loss: 1.2417, test_f1: 0.6601
 epoch: 89, train_loss: 0.3844, test_loss: 1.2013, test_f1: 0.6930
 epoch: 90, train_loss: 0.3824, test_loss: 1.1489, test_f1: 0.6750
 epoch: 91, train_loss: 0.3807, test_loss: 1.2583, test_f1: 0.6717
 epoch: 92, train_loss: 0.3929, test_loss: 1.0794, test_f1: 0.6907
 epoch: 93, train_loss: 0.3869, test_loss: 1.2066, test_f1: 0.6727
 epoch: 94, train_loss: 0.3854, test_loss: 1.1067, test_f1: 0.6871
 epoch: 95, train_loss: 0.3732, test_loss: 1.2098, test_f1: 0.6651
 epoch: 96, train_loss: 0.3576, test_loss: 1.2382, test_f1: 0.6841
 epoch: 97, train_loss: 0.3740, test_loss: 1.2378, test_f1: 0.6808
 epoch: 98, train_loss: 0.3778, test_loss: 1.2479, test_f1: 0.6734
 epoch: 99, train_loss: 0.3584, test_loss: 1.2480, test_f1: 0.6773
##################ITERATION #8 ****************************************
 epoch: 0, train_loss: 1.1952, test_loss: 0.9488, test_f1: 0.4919
 epoch: 1, train_loss: 0.9882, test_loss: 0.9733, test_f1: 0.4795
 epoch: 2, train_loss: 0.9549, test_loss: 0.9663, test_f1: 0.5293
 epoch: 3, train_loss: 0.9337, test_loss: 0.9162, test_f1: 0.5224
 epoch: 4, train_loss: 0.9223, test_loss: 0.9411, test_f1: 0.5547
 epoch: 5, train_loss: 0.9007, test_loss: 0.8633, test_f1: 0.5517
 epoch: 6, train_loss: 0.9030, test_loss: 0.9394, test_f1: 0.5912
 epoch: 7, train_loss: 0.8815, test_loss: 0.8769, test_f1: 0.5911
 epoch: 8, train_loss: 0.8539, test_loss: 0.9100, test_f1: 0.5701
 epoch: 9, train_loss: 0.8340, test_loss: 0.8766, test_f1: 0.6236
 epoch: 10, train_loss: 0.8437, test_loss: 0.8429, test_f1: 0.5769
 epoch: 11, train_loss: 0.8187, test_loss: 0.8066, test_f1: 0.5801
 epoch: 12, train_loss: 0.8019, test_loss: 0.8267, test_f1: 0.6084
 epoch: 13, train_loss: 0.8070, test_loss: 0.7780, test_f1: 0.6322
 epoch: 14, train_loss: 0.7954, test_loss: 0.9329, test_f1: 0.6268
 epoch: 15, train_loss: 0.7630, test_loss: 0.8551, test_f1: 0.6520
 epoch: 16, train_loss: 0.7528, test_loss: 0.8261, test_f1: 0.6217
 epoch: 17, train_loss: 0.7607, test_loss: 0.8536, test_f1: 0.6378
 epoch: 18, train_loss: 0.7535, test_loss: 0.8029, test_f1: 0.6456
 epoch: 19, train_loss: 0.7408, test_loss: 0.8064, test_f1: 0.6469
 epoch: 20, train_loss: 0.7484, test_loss: 0.7754, test_f1: 0.6715
 epoch: 21, train_loss: 0.7396, test_loss: 0.8427, test_f1: 0.6110
 epoch: 22, train_loss: 0.7370, test_loss: 0.8472, test_f1: 0.6385
 epoch: 23, train_loss: 0.7235, test_loss: 0.8614, test_f1: 0.6403
 epoch: 24, train_loss: 0.7102, test_loss: 0.8276, test_f1: 0.6549
 epoch: 25, train_loss: 0.6904, test_loss: 0.8949, test_f1: 0.6101
 epoch: 26, train_loss: 0.7000, test_loss: 0.8400, test_f1: 0.6390
 epoch: 27, train_loss: 0.6891, test_loss: 0.8961, test_f1: 0.6279
 epoch: 28, train_loss: 0.6973, test_loss: 0.8862, test_f1: 0.6439
 epoch: 29, train_loss: 0.6726, test_loss: 0.8759, test_f1: 0.6333
 epoch: 30, train_loss: 0.6613, test_loss: 0.9056, test_f1: 0.6542
 epoch: 31, train_loss: 0.6612, test_loss: 0.9215, test_f1: 0.6523
 epoch: 32, train_loss: 0.6576, test_loss: 0.8788, test_f1: 0.6384
 epoch: 33, train_loss: 0.6412, test_loss: 0.8852, test_f1: 0.6327
 epoch: 34, train_loss: 0.6394, test_loss: 0.9043, test_f1: 0.6356
 epoch: 35, train_loss: 0.6344, test_loss: 0.8551, test_f1: 0.6540
 epoch: 36, train_loss: 0.6208, test_loss: 0.9045, test_f1: 0.6815
 epoch: 37, train_loss: 0.6262, test_loss: 0.8745, test_f1: 0.6425
 epoch: 38, train_loss: 0.6261, test_loss: 0.9420, test_f1: 0.6484
 epoch: 39, train_loss: 0.6211, test_loss: 0.9862, test_f1: 0.6602
 epoch: 40, train_loss: 0.6039, test_loss: 0.9036, test_f1: 0.6595
 epoch: 41, train_loss: 0.5970, test_loss: 0.9500, test_f1: 0.6607
 epoch: 42, train_loss: 0.6004, test_loss: 0.9775, test_f1: 0.6373
 epoch: 43, train_loss: 0.6120, test_loss: 0.9917, test_f1: 0.6406
 epoch: 44, train_loss: 0.5876, test_loss: 0.9805, test_f1: 0.6550
 epoch: 45, train_loss: 0.5763, test_loss: 0.9744, test_f1: 0.6446
 epoch: 46, train_loss: 0.5762, test_loss: 0.9382, test_f1: 0.6625
 epoch: 47, train_loss: 0.5643, test_loss: 0.8744, test_f1: 0.6656
 epoch: 48, train_loss: 0.5780, test_loss: 0.9659, test_f1: 0.6712
 epoch: 49, train_loss: 0.5714, test_loss: 0.8995, test_f1: 0.6884
 epoch: 50, train_loss: 0.5703, test_loss: 0.9732, test_f1: 0.6731
 epoch: 51, train_loss: 0.5403, test_loss: 1.0141, test_f1: 0.6757
 epoch: 52, train_loss: 0.5185, test_loss: 0.9829, test_f1: 0.6840
 epoch: 53, train_loss: 0.5017, test_loss: 0.9316, test_f1: 0.6860
 epoch: 54, train_loss: 0.4995, test_loss: 0.9747, test_f1: 0.6615
 epoch: 55, train_loss: 0.5050, test_loss: 0.9960, test_f1: 0.6785
 epoch: 56, train_loss: 0.4934, test_loss: 0.9695, test_f1: 0.6690
 epoch: 57, train_loss: 0.4872, test_loss: 1.0051, test_f1: 0.6840
 epoch: 58, train_loss: 0.4937, test_loss: 1.0112, test_f1: 0.6693
 epoch: 59, train_loss: 0.4953, test_loss: 0.9280, test_f1: 0.6754
 epoch: 60, train_loss: 0.4849, test_loss: 0.9693, test_f1: 0.6801
 epoch: 61, train_loss: 0.4814, test_loss: 1.0066, test_f1: 0.6702
 epoch: 62, train_loss: 0.4618, test_loss: 0.9968, test_f1: 0.6877
 epoch: 63, train_loss: 0.4767, test_loss: 1.0314, test_f1: 0.6826
 epoch: 64, train_loss: 0.4592, test_loss: 1.0640, test_f1: 0.6580
 epoch: 65, train_loss: 0.4645, test_loss: 1.0533, test_f1: 0.6725
 epoch: 66, train_loss: 0.4533, test_loss: 1.0205, test_f1: 0.6741
 epoch: 67, train_loss: 0.4640, test_loss: 1.0576, test_f1: 0.6666
 epoch: 68, train_loss: 0.4663, test_loss: 1.0274, test_f1: 0.6934
 epoch: 69, train_loss: 0.4488, test_loss: 1.0603, test_f1: 0.6727
 epoch: 70, train_loss: 0.4625, test_loss: 1.0634, test_f1: 0.6642
 epoch: 71, train_loss: 0.4542, test_loss: 1.0745, test_f1: 0.6968
 epoch: 72, train_loss: 0.4406, test_loss: 0.9272, test_f1: 0.6858
 epoch: 73, train_loss: 0.4401, test_loss: 0.9859, test_f1: 0.6866
 epoch: 74, train_loss: 0.4406, test_loss: 1.0378, test_f1: 0.6861
 epoch: 75, train_loss: 0.4220, test_loss: 1.0346, test_f1: 0.6817
 epoch: 76, train_loss: 0.4537, test_loss: 1.0147, test_f1: 0.6650
 epoch: 77, train_loss: 0.4273, test_loss: 1.0017, test_f1: 0.6704
 epoch: 78, train_loss: 0.4360, test_loss: 1.0350, test_f1: 0.6863
 epoch: 79, train_loss: 0.4229, test_loss: 1.0766, test_f1: 0.6835
 epoch: 80, train_loss: 0.4313, test_loss: 1.0377, test_f1: 0.6733
 epoch: 81, train_loss: 0.4131, test_loss: 1.1507, test_f1: 0.6815
 epoch: 82, train_loss: 0.4174, test_loss: 1.1100, test_f1: 0.6862
 epoch: 83, train_loss: 0.4456, test_loss: 1.1216, test_f1: 0.6763
 epoch: 84, train_loss: 0.4131, test_loss: 1.1031, test_f1: 0.6798
 epoch: 85, train_loss: 0.4264, test_loss: 1.1073, test_f1: 0.6871
 epoch: 86, train_loss: 0.4209, test_loss: 1.0552, test_f1: 0.6827
 epoch: 87, train_loss: 0.4100, test_loss: 1.0784, test_f1: 0.6716
 epoch: 88, train_loss: 0.4017, test_loss: 1.0991, test_f1: 0.6783
 epoch: 89, train_loss: 0.4102, test_loss: 1.1096, test_f1: 0.6685
 epoch: 90, train_loss: 0.4235, test_loss: 1.0794, test_f1: 0.6812
 epoch: 91, train_loss: 0.3937, test_loss: 1.1544, test_f1: 0.6863
 epoch: 92, train_loss: 0.4008, test_loss: 1.1249, test_f1: 0.6964
 epoch: 93, train_loss: 0.4065, test_loss: 1.0652, test_f1: 0.6891
 epoch: 94, train_loss: 0.3811, test_loss: 1.0659, test_f1: 0.6952
 epoch: 95, train_loss: 0.3942, test_loss: 1.1496, test_f1: 0.6760
 epoch: 96, train_loss: 0.4007, test_loss: 1.1700, test_f1: 0.6821
 epoch: 97, train_loss: 0.3992, test_loss: 1.1086, test_f1: 0.7012
 epoch: 98, train_loss: 0.3724, test_loss: 1.0327, test_f1: 0.7033
 epoch: 99, train_loss: 0.4004, test_loss: 1.1274, test_f1: 0.6832
##################ITERATION #9 ****************************************
 epoch: 0, train_loss: 1.2030, test_loss: 0.9994, test_f1: 0.5133
 epoch: 1, train_loss: 0.9856, test_loss: 0.9974, test_f1: 0.5457
 epoch: 2, train_loss: 0.9615, test_loss: 0.9146, test_f1: 0.5312
 epoch: 3, train_loss: 0.9422, test_loss: 0.8988, test_f1: 0.5447
 epoch: 4, train_loss: 0.9075, test_loss: 0.9098, test_f1: 0.5116
 epoch: 5, train_loss: 0.8842, test_loss: 0.9026, test_f1: 0.5289
 epoch: 6, train_loss: 0.8893, test_loss: 0.8864, test_f1: 0.5429
 epoch: 7, train_loss: 0.8567, test_loss: 0.8942, test_f1: 0.5767
 epoch: 8, train_loss: 0.8357, test_loss: 0.8763, test_f1: 0.5828
 epoch: 9, train_loss: 0.8247, test_loss: 0.8684, test_f1: 0.5664
 epoch: 10, train_loss: 0.8201, test_loss: 0.8482, test_f1: 0.5770
 epoch: 11, train_loss: 0.7990, test_loss: 0.8443, test_f1: 0.5996
 epoch: 12, train_loss: 0.7808, test_loss: 0.7882, test_f1: 0.6391
 epoch: 13, train_loss: 0.7915, test_loss: 0.8560, test_f1: 0.6300
 epoch: 14, train_loss: 0.7655, test_loss: 0.7656, test_f1: 0.6329
 epoch: 15, train_loss: 0.7516, test_loss: 0.7970, test_f1: 0.6308
 epoch: 16, train_loss: 0.7569, test_loss: 0.7369, test_f1: 0.6435
 epoch: 17, train_loss: 0.7317, test_loss: 0.7294, test_f1: 0.6346
 epoch: 18, train_loss: 0.7487, test_loss: 0.8179, test_f1: 0.6231
 epoch: 19, train_loss: 0.7463, test_loss: 0.7230, test_f1: 0.6437
 epoch: 20, train_loss: 0.7136, test_loss: 0.7370, test_f1: 0.6537
 epoch: 21, train_loss: 0.6934, test_loss: 0.6938, test_f1: 0.6538
 epoch: 22, train_loss: 0.6847, test_loss: 0.7433, test_f1: 0.6625
 epoch: 23, train_loss: 0.6863, test_loss: 0.7493, test_f1: 0.6537
 epoch: 24, train_loss: 0.6895, test_loss: 0.7088, test_f1: 0.6484
 epoch: 25, train_loss: 0.6770, test_loss: 0.7141, test_f1: 0.6663
 epoch: 26, train_loss: 0.6756, test_loss: 0.7334, test_f1: 0.6861
 epoch: 27, train_loss: 0.6688, test_loss: 0.8032, test_f1: 0.5878
 epoch: 28, train_loss: 0.6689, test_loss: 0.8155, test_f1: 0.6546
 epoch: 29, train_loss: 0.6520, test_loss: 0.7297, test_f1: 0.6855
 epoch: 30, train_loss: 0.6383, test_loss: 0.8044, test_f1: 0.6224
 epoch: 31, train_loss: 0.6488, test_loss: 0.7197, test_f1: 0.6813
 epoch: 32, train_loss: 0.6321, test_loss: 0.7678, test_f1: 0.6528
 epoch: 33, train_loss: 0.6361, test_loss: 0.7609, test_f1: 0.6459
 epoch: 34, train_loss: 0.6152, test_loss: 0.7240, test_f1: 0.6600
 epoch: 35, train_loss: 0.6004, test_loss: 0.7309, test_f1: 0.6727
 epoch: 36, train_loss: 0.6132, test_loss: 0.7543, test_f1: 0.6554
 epoch: 37, train_loss: 0.5994, test_loss: 0.7252, test_f1: 0.6766
 epoch: 38, train_loss: 0.6092, test_loss: 0.7829, test_f1: 0.6317
 epoch: 39, train_loss: 0.6077, test_loss: 0.7912, test_f1: 0.6534
 epoch: 40, train_loss: 0.6117, test_loss: 0.7328, test_f1: 0.6737
 epoch: 41, train_loss: 0.6254, test_loss: 0.7731, test_f1: 0.6202
 epoch: 42, train_loss: 0.6008, test_loss: 0.8311, test_f1: 0.6607
 epoch: 43, train_loss: 0.5931, test_loss: 0.6973, test_f1: 0.6749
 epoch: 44, train_loss: 0.5802, test_loss: 0.7559, test_f1: 0.6675
 epoch: 45, train_loss: 0.5658, test_loss: 0.8064, test_f1: 0.6645
 epoch: 46, train_loss: 0.5714, test_loss: 0.7981, test_f1: 0.6548
 epoch: 47, train_loss: 0.5619, test_loss: 0.7392, test_f1: 0.6868
 epoch: 48, train_loss: 0.5865, test_loss: 0.7384, test_f1: 0.6571
 epoch: 49, train_loss: 0.5580, test_loss: 0.8594, test_f1: 0.6467
 epoch: 50, train_loss: 0.5418, test_loss: 0.7575, test_f1: 0.6806
 epoch: 51, train_loss: 0.5240, test_loss: 0.7778, test_f1: 0.6533
 epoch: 52, train_loss: 0.5113, test_loss: 0.7730, test_f1: 0.6626
 epoch: 53, train_loss: 0.5042, test_loss: 0.7891, test_f1: 0.6618
 epoch: 54, train_loss: 0.5108, test_loss: 0.8866, test_f1: 0.6495
 epoch: 55, train_loss: 0.4919, test_loss: 0.8343, test_f1: 0.6651
 epoch: 56, train_loss: 0.4842, test_loss: 0.9048, test_f1: 0.6377
 epoch: 57, train_loss: 0.4901, test_loss: 0.8501, test_f1: 0.6709
 epoch: 58, train_loss: 0.4938, test_loss: 0.8315, test_f1: 0.6471
 epoch: 59, train_loss: 0.5056, test_loss: 0.8045, test_f1: 0.6497
 epoch: 60, train_loss: 0.4855, test_loss: 0.8506, test_f1: 0.6565
 epoch: 61, train_loss: 0.4690, test_loss: 0.8988, test_f1: 0.6686
 epoch: 62, train_loss: 0.4697, test_loss: 0.8359, test_f1: 0.6534
 epoch: 63, train_loss: 0.4525, test_loss: 0.8968, test_f1: 0.6497
 epoch: 64, train_loss: 0.4785, test_loss: 0.8467, test_f1: 0.6505
 epoch: 65, train_loss: 0.4589, test_loss: 0.9114, test_f1: 0.6515
 epoch: 66, train_loss: 0.4684, test_loss: 0.9339, test_f1: 0.6383
 epoch: 67, train_loss: 0.4506, test_loss: 0.9505, test_f1: 0.6455
 epoch: 68, train_loss: 0.4607, test_loss: 0.9232, test_f1: 0.6331
 epoch: 69, train_loss: 0.4510, test_loss: 0.9249, test_f1: 0.6474
 epoch: 70, train_loss: 0.4475, test_loss: 0.9328, test_f1: 0.6412
 epoch: 71, train_loss: 0.4602, test_loss: 0.9669, test_f1: 0.6475
 epoch: 72, train_loss: 0.4655, test_loss: 0.9412, test_f1: 0.6559
 epoch: 73, train_loss: 0.4604, test_loss: 0.9300, test_f1: 0.6519
 epoch: 74, train_loss: 0.4402, test_loss: 0.9063, test_f1: 0.6648
 epoch: 75, train_loss: 0.4368, test_loss: 0.9264, test_f1: 0.6453
 epoch: 76, train_loss: 0.4418, test_loss: 1.0130, test_f1: 0.6347
 epoch: 77, train_loss: 0.4374, test_loss: 1.0099, test_f1: 0.6492
 epoch: 78, train_loss: 0.4433, test_loss: 0.9948, test_f1: 0.6331
 epoch: 79, train_loss: 0.4283, test_loss: 1.0612, test_f1: 0.6397
 epoch: 80, train_loss: 0.4134, test_loss: 1.0352, test_f1: 0.6742
 epoch: 81, train_loss: 0.4352, test_loss: 0.8972, test_f1: 0.6789
 epoch: 82, train_loss: 0.4450, test_loss: 1.1033, test_f1: 0.6374
 epoch: 83, train_loss: 0.4280, test_loss: 0.9663, test_f1: 0.6369
 epoch: 84, train_loss: 0.4192, test_loss: 1.0663, test_f1: 0.6214
 epoch: 85, train_loss: 0.4234, test_loss: 1.0941, test_f1: 0.6684
 epoch: 86, train_loss: 0.4174, test_loss: 0.9812, test_f1: 0.6542
 epoch: 87, train_loss: 0.3938, test_loss: 1.0481, test_f1: 0.6430
 epoch: 88, train_loss: 0.4121, test_loss: 1.0756, test_f1: 0.6239
 epoch: 89, train_loss: 0.4083, test_loss: 1.1644, test_f1: 0.6445
 epoch: 90, train_loss: 0.4119, test_loss: 1.0535, test_f1: 0.6751
 epoch: 91, train_loss: 0.4099, test_loss: 1.0262, test_f1: 0.6630
 epoch: 92, train_loss: 0.4110, test_loss: 1.2136, test_f1: 0.6452
 epoch: 93, train_loss: 0.4054, test_loss: 1.1188, test_f1: 0.6586
 epoch: 94, train_loss: 0.4002, test_loss: 1.1343, test_f1: 0.6416
 epoch: 95, train_loss: 0.4135, test_loss: 1.0166, test_f1: 0.6400
 epoch: 96, train_loss: 0.4101, test_loss: 1.0908, test_f1: 0.6592
 epoch: 97, train_loss: 0.3972, test_loss: 1.1220, test_f1: 0.6600
 epoch: 98, train_loss: 0.3882, test_loss: 1.1473, test_f1: 0.6306
 epoch: 99, train_loss: 0.3969, test_loss: 1.0844, test_f1: 0.6544

Training completed in 818.68 seconds
Best F1: 0.7125 at epoch 60
Mean F1 across iterations: 0.6976  0.0090
========================FINAL RESULTS================================
FEGIN weighted F1: 0.7125  0.0090
python main.py --data ltspice_examples --representation component_pin_net --model FEGIN --layers 2 --hiddens 64 --batch_size 32 --lr 0.001 --emb_size 128 --epochs 100 --save_appendix component_pin_net_L2_H64_BS32_LR0.001_E128 --no_val
-----



STDERR:
  File "main.py", line 370, in <module>
    main()
  File "main.py", line 254, in main
    dataset = dataset_class(
  File "/home/philip/projects/ltspice_examples_code_repo/Circuit-Completion-Using-GNNs/component_classification_with_link_prediction_head/evaluation/FEGIN/kernel/circuit_datasets.py", line 15, in __init__
    self.data, self.slices = torch.load(self.processed_paths[0])
  File "/home/philip/.local/lib/python3.8/site-packages/torch/serialization.py", line 1040, in load
    warnings.warn(
  File "/usr/lib/python3.8/warnings.py", line 109, in _showwarnmsg
    sw(msg.message, msg.category, msg.filename, msg.lineno,
  File "main.py", line 47, in warn_with_traceback
    traceback.print_stack(file=log)
/home/philip/projects/ltspice_examples_code_repo/Circuit-Completion-Using-GNNs/component_classification_with_link_prediction_head/evaluation/FEGIN/kernel/circuit_datasets.py:15: FutureWarning: You are using `torch.load` with `weights_only=False` (the current default value), which uses the default pickle module implicitly. It is possible to construct malicious pickle data which will execute arbitrary code during unpickling (See https://github.com/pytorch/pytorch/blob/main/SECURITY.md#untrusted-models for more details). In a future release, the default value for `weights_only` will be flipped to `True`. This limits the functions that could be executed during unpickling. Arbitrary objects will no longer be allowed to be loaded via this mode unless they are explicitly allowlisted by the user via `torch.serialization.add_safe_globals`. We recommend you start setting `weights_only=True` for any use case where you don't have full control of the loaded file. Please open an issue on GitHub for any issues related to this experimental feature.
  self.data, self.slices = torch.load(self.processed_paths[0])
