STDOUT:
Results will be saved in /home/philip/projects/ltspice_examples_code_repo/Circuit-Completion-Using-GNNs/component_classification_with_link_prediction_head/evaluation/FEGIN/results/model_FEGIN_dataset_ltspice_demos
Command line input: python main.py --data ltspice_demos --representation component_pin --model FEGIN --layers 2 --hiddens 32 --batch_size 32 --lr 0.001 --emb_size 512 --epochs 100 --save_appendix component_pin_L2_H32_BS32_LR0.001_E512 --no_val
 is saved.
-----
ltspice_demos - FEGIN
Using 2 layers, 32 hidden units, h = 2
Loading component_pin representation dataset
ENTERED
Training FEGIN on component_pin representation
Train: 1565, Test: 383
##################ITERATION #0 ****************************************
 epoch: 0, train_loss: 1.3143, test_loss: 1.2977, test_f1: 0.3480
 epoch: 1, train_loss: 1.1939, test_loss: 1.2069, test_f1: 0.3903
 epoch: 2, train_loss: 1.0870, test_loss: 1.1294, test_f1: 0.4253
 epoch: 3, train_loss: 1.0178, test_loss: 1.0757, test_f1: 0.3759
 epoch: 4, train_loss: 0.9946, test_loss: 1.1005, test_f1: 0.4540
 epoch: 5, train_loss: 0.9576, test_loss: 1.0939, test_f1: 0.4151
 epoch: 6, train_loss: 0.9392, test_loss: 1.0225, test_f1: 0.4979
 epoch: 7, train_loss: 0.9273, test_loss: 1.0247, test_f1: 0.4916
 epoch: 8, train_loss: 0.9021, test_loss: 0.9641, test_f1: 0.5853
 epoch: 9, train_loss: 0.8805, test_loss: 1.0595, test_f1: 0.5218
 epoch: 10, train_loss: 0.8558, test_loss: 0.9509, test_f1: 0.5744
 epoch: 11, train_loss: 0.8373, test_loss: 0.9548, test_f1: 0.5251
 epoch: 12, train_loss: 0.8180, test_loss: 0.9626, test_f1: 0.5270
 epoch: 13, train_loss: 0.7842, test_loss: 0.9396, test_f1: 0.5961
 epoch: 14, train_loss: 0.7943, test_loss: 0.9548, test_f1: 0.5191
 epoch: 15, train_loss: 0.7733, test_loss: 1.0040, test_f1: 0.4955
 epoch: 16, train_loss: 0.7690, test_loss: 0.9998, test_f1: 0.5881
 epoch: 17, train_loss: 0.7535, test_loss: 1.0338, test_f1: 0.5476
 epoch: 18, train_loss: 0.7418, test_loss: 1.0685, test_f1: 0.5629
 epoch: 19, train_loss: 0.7578, test_loss: 0.8827, test_f1: 0.5590
 epoch: 20, train_loss: 0.7495, test_loss: 0.9191, test_f1: 0.5524
 epoch: 21, train_loss: 0.7384, test_loss: 1.0336, test_f1: 0.5798
 epoch: 22, train_loss: 0.7199, test_loss: 0.9158, test_f1: 0.6303
 epoch: 23, train_loss: 0.7110, test_loss: 0.9839, test_f1: 0.5562
 epoch: 24, train_loss: 0.7205, test_loss: 0.9709, test_f1: 0.6140
 epoch: 25, train_loss: 0.7000, test_loss: 0.9684, test_f1: 0.5733
 epoch: 26, train_loss: 0.6952, test_loss: 0.9686, test_f1: 0.6103
 epoch: 27, train_loss: 0.6762, test_loss: 0.9366, test_f1: 0.5840
 epoch: 28, train_loss: 0.6899, test_loss: 1.0426, test_f1: 0.6082
 epoch: 29, train_loss: 0.6886, test_loss: 1.2147, test_f1: 0.4659
 epoch: 30, train_loss: 0.6924, test_loss: 1.0477, test_f1: 0.5943
 epoch: 31, train_loss: 0.6904, test_loss: 1.0772, test_f1: 0.5398
 epoch: 32, train_loss: 0.6906, test_loss: 1.0619, test_f1: 0.6210
 epoch: 33, train_loss: 0.6620, test_loss: 1.1230, test_f1: 0.6020
 epoch: 34, train_loss: 0.6468, test_loss: 1.0242, test_f1: 0.6120
 epoch: 35, train_loss: 0.6774, test_loss: 1.0491, test_f1: 0.5884
 epoch: 36, train_loss: 0.6580, test_loss: 0.9312, test_f1: 0.6098
 epoch: 37, train_loss: 0.6413, test_loss: 0.9934, test_f1: 0.6066
 epoch: 38, train_loss: 0.6542, test_loss: 1.0628, test_f1: 0.6076
 epoch: 39, train_loss: 0.6400, test_loss: 1.1227, test_f1: 0.6077
 epoch: 40, train_loss: 0.6247, test_loss: 1.0326, test_f1: 0.6070
 epoch: 41, train_loss: 0.6319, test_loss: 1.1609, test_f1: 0.6175
 epoch: 42, train_loss: 0.6383, test_loss: 1.1074, test_f1: 0.5714
 epoch: 43, train_loss: 0.6212, test_loss: 1.1912, test_f1: 0.5959
 epoch: 44, train_loss: 0.6161, test_loss: 1.2009, test_f1: 0.5970
 epoch: 45, train_loss: 0.6211, test_loss: 1.0918, test_f1: 0.6070
 epoch: 46, train_loss: 0.6152, test_loss: 1.1524, test_f1: 0.6023
 epoch: 47, train_loss: 0.6060, test_loss: 1.1620, test_f1: 0.6478
 epoch: 48, train_loss: 0.6058, test_loss: 1.1185, test_f1: 0.6050
 epoch: 49, train_loss: 0.6115, test_loss: 1.2332, test_f1: 0.6462
 epoch: 50, train_loss: 0.5950, test_loss: 1.1076, test_f1: 0.6451
 epoch: 51, train_loss: 0.5908, test_loss: 1.1946, test_f1: 0.6043
 epoch: 52, train_loss: 0.5740, test_loss: 1.1551, test_f1: 0.6378
 epoch: 53, train_loss: 0.5639, test_loss: 1.2005, test_f1: 0.6403
 epoch: 54, train_loss: 0.5766, test_loss: 1.1945, test_f1: 0.6205
 epoch: 55, train_loss: 0.5602, test_loss: 1.1684, test_f1: 0.6184
 epoch: 56, train_loss: 0.5455, test_loss: 1.1823, test_f1: 0.6299
 epoch: 57, train_loss: 0.5530, test_loss: 1.2256, test_f1: 0.6190
 epoch: 58, train_loss: 0.5622, test_loss: 1.2147, test_f1: 0.6155
 epoch: 59, train_loss: 0.5439, test_loss: 1.2003, test_f1: 0.6406
 epoch: 60, train_loss: 0.5481, test_loss: 1.2505, test_f1: 0.6452
 epoch: 61, train_loss: 0.5453, test_loss: 1.3158, test_f1: 0.5846
 epoch: 62, train_loss: 0.5470, test_loss: 1.3646, test_f1: 0.5824
 epoch: 63, train_loss: 0.5480, test_loss: 1.1848, test_f1: 0.6107
 epoch: 64, train_loss: 0.5583, test_loss: 1.2423, test_f1: 0.6226
 epoch: 65, train_loss: 0.5529, test_loss: 1.2217, test_f1: 0.5963
 epoch: 66, train_loss: 0.5477, test_loss: 1.2692, test_f1: 0.6257
 epoch: 67, train_loss: 0.5444, test_loss: 1.3248, test_f1: 0.6131
 epoch: 68, train_loss: 0.5376, test_loss: 1.3095, test_f1: 0.6269
 epoch: 69, train_loss: 0.5253, test_loss: 1.3878, test_f1: 0.6293
 epoch: 70, train_loss: 0.5212, test_loss: 1.3087, test_f1: 0.6150
 epoch: 71, train_loss: 0.5382, test_loss: 1.4076, test_f1: 0.5885
 epoch: 72, train_loss: 0.5285, test_loss: 1.3544, test_f1: 0.6129
 epoch: 73, train_loss: 0.5256, test_loss: 1.3344, test_f1: 0.6133
 epoch: 74, train_loss: 0.5105, test_loss: 1.3567, test_f1: 0.6092
 epoch: 75, train_loss: 0.5203, test_loss: 1.2867, test_f1: 0.6077
 epoch: 76, train_loss: 0.4953, test_loss: 1.3012, test_f1: 0.6145
 epoch: 77, train_loss: 0.5105, test_loss: 1.3230, test_f1: 0.6112
 epoch: 78, train_loss: 0.4957, test_loss: 1.3294, test_f1: 0.6249
 epoch: 79, train_loss: 0.5160, test_loss: 1.3406, test_f1: 0.6172
 epoch: 80, train_loss: 0.4907, test_loss: 1.4824, test_f1: 0.6218
 epoch: 81, train_loss: 0.5118, test_loss: 1.3375, test_f1: 0.6328
 epoch: 82, train_loss: 0.4830, test_loss: 1.2827, test_f1: 0.6292
 epoch: 83, train_loss: 0.4989, test_loss: 1.4055, test_f1: 0.6316
 epoch: 84, train_loss: 0.4942, test_loss: 1.4807, test_f1: 0.6009
 epoch: 85, train_loss: 0.4839, test_loss: 1.3596, test_f1: 0.6100
 epoch: 86, train_loss: 0.4926, test_loss: 1.3849, test_f1: 0.6072
 epoch: 87, train_loss: 0.4845, test_loss: 1.3309, test_f1: 0.6074
 epoch: 88, train_loss: 0.4818, test_loss: 1.3518, test_f1: 0.6511
 epoch: 89, train_loss: 0.4786, test_loss: 1.4145, test_f1: 0.6474
 epoch: 90, train_loss: 0.4627, test_loss: 1.3842, test_f1: 0.6505
 epoch: 91, train_loss: 0.4787, test_loss: 1.5213, test_f1: 0.6431
 epoch: 92, train_loss: 0.4806, test_loss: 1.4162, test_f1: 0.6405
 epoch: 93, train_loss: 0.4682, test_loss: 1.4037, test_f1: 0.6468
 epoch: 94, train_loss: 0.4711, test_loss: 1.4176, test_f1: 0.6328
 epoch: 95, train_loss: 0.4485, test_loss: 1.4804, test_f1: 0.6290
 epoch: 96, train_loss: 0.4907, test_loss: 1.4158, test_f1: 0.6521
 epoch: 97, train_loss: 0.4587, test_loss: 1.4643, test_f1: 0.6221
 epoch: 98, train_loss: 0.4537, test_loss: 1.4061, test_f1: 0.6430
 epoch: 99, train_loss: 0.4553, test_loss: 1.5698, test_f1: 0.6174
##################ITERATION #1 ****************************************
 epoch: 0, train_loss: 1.1955, test_loss: 1.2427, test_f1: 0.3302
 epoch: 1, train_loss: 1.0483, test_loss: 1.0736, test_f1: 0.4716
 epoch: 2, train_loss: 0.9642, test_loss: 1.0355, test_f1: 0.5348
 epoch: 3, train_loss: 0.9184, test_loss: 0.9697, test_f1: 0.5364
 epoch: 4, train_loss: 0.8848, test_loss: 1.0076, test_f1: 0.5613
 epoch: 5, train_loss: 0.8393, test_loss: 1.0031, test_f1: 0.5671
 epoch: 6, train_loss: 0.8234, test_loss: 1.0422, test_f1: 0.5709
 epoch: 7, train_loss: 0.7938, test_loss: 1.1030, test_f1: 0.6084
 epoch: 8, train_loss: 0.7875, test_loss: 1.0962, test_f1: 0.5693
 epoch: 9, train_loss: 0.7595, test_loss: 0.9807, test_f1: 0.6291
 epoch: 10, train_loss: 0.7551, test_loss: 1.0275, test_f1: 0.6165
 epoch: 11, train_loss: 0.7357, test_loss: 1.0491, test_f1: 0.5769
 epoch: 12, train_loss: 0.7449, test_loss: 1.1284, test_f1: 0.6148
 epoch: 13, train_loss: 0.7268, test_loss: 1.0717, test_f1: 0.5909
 epoch: 14, train_loss: 0.7209, test_loss: 1.0951, test_f1: 0.5701
 epoch: 15, train_loss: 0.6985, test_loss: 1.1665, test_f1: 0.5166
 epoch: 16, train_loss: 0.6906, test_loss: 1.0377, test_f1: 0.5536
 epoch: 17, train_loss: 0.7060, test_loss: 1.1108, test_f1: 0.5762
 epoch: 18, train_loss: 0.6917, test_loss: 1.1208, test_f1: 0.5972
 epoch: 19, train_loss: 0.6969, test_loss: 1.1466, test_f1: 0.5521
 epoch: 20, train_loss: 0.6963, test_loss: 1.1703, test_f1: 0.5653
 epoch: 21, train_loss: 0.6834, test_loss: 1.0711, test_f1: 0.5700
 epoch: 22, train_loss: 0.6620, test_loss: 1.3075, test_f1: 0.5646
 epoch: 23, train_loss: 0.6584, test_loss: 1.1060, test_f1: 0.5945
 epoch: 24, train_loss: 0.6595, test_loss: 1.1587, test_f1: 0.5915
 epoch: 25, train_loss: 0.6524, test_loss: 1.1034, test_f1: 0.5546
 epoch: 26, train_loss: 0.6342, test_loss: 1.2004, test_f1: 0.5524
 epoch: 27, train_loss: 0.6472, test_loss: 1.1353, test_f1: 0.5611
 epoch: 28, train_loss: 0.6312, test_loss: 1.1345, test_f1: 0.5669
 epoch: 29, train_loss: 0.6328, test_loss: 1.1834, test_f1: 0.6199
 epoch: 30, train_loss: 0.6201, test_loss: 1.0728, test_f1: 0.5995
 epoch: 31, train_loss: 0.6344, test_loss: 1.3394, test_f1: 0.5797
 epoch: 32, train_loss: 0.6172, test_loss: 1.1508, test_f1: 0.5736
 epoch: 33, train_loss: 0.5943, test_loss: 1.1771, test_f1: 0.5883
 epoch: 34, train_loss: 0.5908, test_loss: 1.3286, test_f1: 0.5633
 epoch: 35, train_loss: 0.6073, test_loss: 1.3336, test_f1: 0.5717
 epoch: 36, train_loss: 0.5951, test_loss: 1.2530, test_f1: 0.5898
 epoch: 37, train_loss: 0.6113, test_loss: 1.2741, test_f1: 0.5647
 epoch: 38, train_loss: 0.5731, test_loss: 1.1809, test_f1: 0.5579
 epoch: 39, train_loss: 0.5879, test_loss: 1.1323, test_f1: 0.5887
 epoch: 40, train_loss: 0.5921, test_loss: 1.3765, test_f1: 0.5810
 epoch: 41, train_loss: 0.5684, test_loss: 1.2056, test_f1: 0.5897
 epoch: 42, train_loss: 0.5769, test_loss: 1.1880, test_f1: 0.5903
 epoch: 43, train_loss: 0.5715, test_loss: 1.3453, test_f1: 0.5621
 epoch: 44, train_loss: 0.5663, test_loss: 1.3218, test_f1: 0.5910
 epoch: 45, train_loss: 0.5604, test_loss: 1.2247, test_f1: 0.5790
 epoch: 46, train_loss: 0.5648, test_loss: 1.2460, test_f1: 0.6026
 epoch: 47, train_loss: 0.5582, test_loss: 1.3111, test_f1: 0.5914
 epoch: 48, train_loss: 0.5626, test_loss: 1.4488, test_f1: 0.5999
 epoch: 49, train_loss: 0.5443, test_loss: 1.4091, test_f1: 0.5914
 epoch: 50, train_loss: 0.5512, test_loss: 1.3735, test_f1: 0.6061
 epoch: 51, train_loss: 0.5506, test_loss: 1.3852, test_f1: 0.6365
 epoch: 52, train_loss: 0.5335, test_loss: 1.3648, test_f1: 0.6436
 epoch: 53, train_loss: 0.4898, test_loss: 1.1808, test_f1: 0.6293
 epoch: 54, train_loss: 0.5074, test_loss: 1.1744, test_f1: 0.6193
 epoch: 55, train_loss: 0.4959, test_loss: 1.2018, test_f1: 0.6185
 epoch: 56, train_loss: 0.4827, test_loss: 1.2286, test_f1: 0.6329
 epoch: 57, train_loss: 0.4829, test_loss: 1.2120, test_f1: 0.5976
 epoch: 58, train_loss: 0.4898, test_loss: 1.3099, test_f1: 0.5615
 epoch: 59, train_loss: 0.4980, test_loss: 1.4037, test_f1: 0.6003
 epoch: 60, train_loss: 0.4788, test_loss: 1.4349, test_f1: 0.5968
 epoch: 61, train_loss: 0.4839, test_loss: 1.3637, test_f1: 0.5845
 epoch: 62, train_loss: 0.4657, test_loss: 1.3801, test_f1: 0.5917
 epoch: 63, train_loss: 0.4795, test_loss: 1.3841, test_f1: 0.5985
 epoch: 64, train_loss: 0.4756, test_loss: 1.3970, test_f1: 0.6554
 epoch: 65, train_loss: 0.4709, test_loss: 1.4682, test_f1: 0.6182
 epoch: 66, train_loss: 0.4661, test_loss: 1.4900, test_f1: 0.6096
 epoch: 67, train_loss: 0.4915, test_loss: 1.3288, test_f1: 0.6007
 epoch: 68, train_loss: 0.4543, test_loss: 1.4088, test_f1: 0.6402
 epoch: 69, train_loss: 0.4517, test_loss: 1.3917, test_f1: 0.6207
 epoch: 70, train_loss: 0.4770, test_loss: 1.2732, test_f1: 0.6315
 epoch: 71, train_loss: 0.4530, test_loss: 1.4417, test_f1: 0.6010
 epoch: 72, train_loss: 0.4575, test_loss: 1.3293, test_f1: 0.6082
 epoch: 73, train_loss: 0.4586, test_loss: 1.3499, test_f1: 0.6244
 epoch: 74, train_loss: 0.4419, test_loss: 1.3676, test_f1: 0.6360
 epoch: 75, train_loss: 0.4668, test_loss: 1.3889, test_f1: 0.6239
 epoch: 76, train_loss: 0.4283, test_loss: 1.2515, test_f1: 0.6371
 epoch: 77, train_loss: 0.4449, test_loss: 1.4139, test_f1: 0.6251
 epoch: 78, train_loss: 0.4385, test_loss: 1.5121, test_f1: 0.6224
 epoch: 79, train_loss: 0.4211, test_loss: 1.3867, test_f1: 0.6177
 epoch: 80, train_loss: 0.4374, test_loss: 1.4497, test_f1: 0.6131
 epoch: 81, train_loss: 0.4409, test_loss: 1.5786, test_f1: 0.6382
 epoch: 82, train_loss: 0.4272, test_loss: 1.5394, test_f1: 0.6425
 epoch: 83, train_loss: 0.4207, test_loss: 1.4475, test_f1: 0.6140
 epoch: 84, train_loss: 0.4035, test_loss: 1.5156, test_f1: 0.6098
 epoch: 85, train_loss: 0.4217, test_loss: 1.4426, test_f1: 0.6019
 epoch: 86, train_loss: 0.4322, test_loss: 1.4377, test_f1: 0.6284
 epoch: 87, train_loss: 0.4187, test_loss: 1.5099, test_f1: 0.6351
 epoch: 88, train_loss: 0.4126, test_loss: 1.6172, test_f1: 0.6049
 epoch: 89, train_loss: 0.4366, test_loss: 1.3698, test_f1: 0.6211
 epoch: 90, train_loss: 0.4143, test_loss: 1.4390, test_f1: 0.6173
 epoch: 91, train_loss: 0.4181, test_loss: 1.5251, test_f1: 0.6177
 epoch: 92, train_loss: 0.4226, test_loss: 1.5968, test_f1: 0.6183
 epoch: 93, train_loss: 0.4158, test_loss: 1.4784, test_f1: 0.6245
 epoch: 94, train_loss: 0.4115, test_loss: 1.3674, test_f1: 0.6175
 epoch: 95, train_loss: 0.4018, test_loss: 1.4417, test_f1: 0.6289
 epoch: 96, train_loss: 0.4154, test_loss: 1.6144, test_f1: 0.6486
 epoch: 97, train_loss: 0.4169, test_loss: 1.5425, test_f1: 0.6232
 epoch: 98, train_loss: 0.4075, test_loss: 1.6682, test_f1: 0.6110
 epoch: 99, train_loss: 0.3793, test_loss: 1.5223, test_f1: 0.6362
##################ITERATION #2 ****************************************
 epoch: 0, train_loss: 1.1982, test_loss: 1.2130, test_f1: 0.3122
 epoch: 1, train_loss: 1.0567, test_loss: 1.0747, test_f1: 0.4986
 epoch: 2, train_loss: 0.9892, test_loss: 1.0293, test_f1: 0.5440
 epoch: 3, train_loss: 0.9498, test_loss: 0.9968, test_f1: 0.5549
 epoch: 4, train_loss: 0.8941, test_loss: 0.9889, test_f1: 0.5695
 epoch: 5, train_loss: 0.8700, test_loss: 1.0137, test_f1: 0.5499
 epoch: 6, train_loss: 0.8588, test_loss: 1.0149, test_f1: 0.5706
 epoch: 7, train_loss: 0.8591, test_loss: 0.9887, test_f1: 0.5769
 epoch: 8, train_loss: 0.8392, test_loss: 1.1388, test_f1: 0.4515
 epoch: 9, train_loss: 0.8249, test_loss: 1.0325, test_f1: 0.5837
 epoch: 10, train_loss: 0.8097, test_loss: 1.0753, test_f1: 0.5514
 epoch: 11, train_loss: 0.7817, test_loss: 0.9844, test_f1: 0.6196
 epoch: 12, train_loss: 0.7721, test_loss: 1.0112, test_f1: 0.5943
 epoch: 13, train_loss: 0.7564, test_loss: 0.9607, test_f1: 0.6174
 epoch: 14, train_loss: 0.7450, test_loss: 1.0159, test_f1: 0.6093
 epoch: 15, train_loss: 0.7422, test_loss: 1.0688, test_f1: 0.5802
 epoch: 16, train_loss: 0.7125, test_loss: 1.0400, test_f1: 0.6133
 epoch: 17, train_loss: 0.7001, test_loss: 1.1884, test_f1: 0.6083
 epoch: 18, train_loss: 0.7252, test_loss: 1.2188, test_f1: 0.5589
 epoch: 19, train_loss: 0.6963, test_loss: 1.1827, test_f1: 0.5829
 epoch: 20, train_loss: 0.7065, test_loss: 1.0636, test_f1: 0.6295
 epoch: 21, train_loss: 0.6742, test_loss: 0.9968, test_f1: 0.6449
 epoch: 22, train_loss: 0.6893, test_loss: 1.2315, test_f1: 0.5818
 epoch: 23, train_loss: 0.6761, test_loss: 1.1785, test_f1: 0.5832
 epoch: 24, train_loss: 0.6532, test_loss: 1.0984, test_f1: 0.6067
 epoch: 25, train_loss: 0.6793, test_loss: 1.1205, test_f1: 0.5894
 epoch: 26, train_loss: 0.6582, test_loss: 1.1157, test_f1: 0.6174
 epoch: 27, train_loss: 0.6517, test_loss: 1.4035, test_f1: 0.5666
 epoch: 28, train_loss: 0.6374, test_loss: 1.3448, test_f1: 0.5721
 epoch: 29, train_loss: 0.6244, test_loss: 1.1850, test_f1: 0.5870
 epoch: 30, train_loss: 0.6370, test_loss: 1.2330, test_f1: 0.5842
 epoch: 31, train_loss: 0.6313, test_loss: 1.2633, test_f1: 0.5613
 epoch: 32, train_loss: 0.6040, test_loss: 1.2473, test_f1: 0.5951
 epoch: 33, train_loss: 0.5917, test_loss: 1.2894, test_f1: 0.5801
 epoch: 34, train_loss: 0.6164, test_loss: 1.3955, test_f1: 0.5787
 epoch: 35, train_loss: 0.5997, test_loss: 1.3778, test_f1: 0.5521
 epoch: 36, train_loss: 0.5980, test_loss: 1.3235, test_f1: 0.5929
 epoch: 37, train_loss: 0.5851, test_loss: 1.4065, test_f1: 0.5456
 epoch: 38, train_loss: 0.5662, test_loss: 1.2986, test_f1: 0.5987
 epoch: 39, train_loss: 0.5850, test_loss: 1.4312, test_f1: 0.5594
 epoch: 40, train_loss: 0.5722, test_loss: 1.1900, test_f1: 0.5823
 epoch: 41, train_loss: 0.5602, test_loss: 1.4172, test_f1: 0.5723
 epoch: 42, train_loss: 0.5612, test_loss: 1.3548, test_f1: 0.6411
 epoch: 43, train_loss: 0.5732, test_loss: 1.4436, test_f1: 0.6120
 epoch: 44, train_loss: 0.5613, test_loss: 1.4413, test_f1: 0.5771
 epoch: 45, train_loss: 0.5571, test_loss: 1.4187, test_f1: 0.6043
 epoch: 46, train_loss: 0.5541, test_loss: 1.3808, test_f1: 0.6318
 epoch: 47, train_loss: 0.5435, test_loss: 1.2756, test_f1: 0.6107
 epoch: 48, train_loss: 0.5254, test_loss: 1.9316, test_f1: 0.5431
 epoch: 49, train_loss: 0.5437, test_loss: 1.4391, test_f1: 0.5674
 epoch: 50, train_loss: 0.5341, test_loss: 1.5269, test_f1: 0.6176
 epoch: 51, train_loss: 0.5145, test_loss: 1.3975, test_f1: 0.6057
 epoch: 52, train_loss: 0.4856, test_loss: 1.5363, test_f1: 0.5873
 epoch: 53, train_loss: 0.4805, test_loss: 1.6558, test_f1: 0.5526
 epoch: 54, train_loss: 0.4779, test_loss: 1.7984, test_f1: 0.5740
 epoch: 55, train_loss: 0.4853, test_loss: 1.4708, test_f1: 0.5938
 epoch: 56, train_loss: 0.4643, test_loss: 1.5634, test_f1: 0.6207
 epoch: 57, train_loss: 0.4869, test_loss: 1.6587, test_f1: 0.5835
 epoch: 58, train_loss: 0.4790, test_loss: 1.5196, test_f1: 0.6123
 epoch: 59, train_loss: 0.4407, test_loss: 1.7147, test_f1: 0.6190
 epoch: 60, train_loss: 0.4596, test_loss: 1.6089, test_f1: 0.5968
 epoch: 61, train_loss: 0.4582, test_loss: 1.6795, test_f1: 0.6071
 epoch: 62, train_loss: 0.4417, test_loss: 1.7190, test_f1: 0.5928
 epoch: 63, train_loss: 0.4385, test_loss: 1.6877, test_f1: 0.6003
 epoch: 64, train_loss: 0.4624, test_loss: 1.5748, test_f1: 0.6077
 epoch: 65, train_loss: 0.4473, test_loss: 1.8954, test_f1: 0.5768
 epoch: 66, train_loss: 0.4544, test_loss: 1.8659, test_f1: 0.5960
 epoch: 67, train_loss: 0.4402, test_loss: 2.0141, test_f1: 0.5914
 epoch: 68, train_loss: 0.4177, test_loss: 1.8555, test_f1: 0.5748
 epoch: 69, train_loss: 0.4399, test_loss: 1.7593, test_f1: 0.5933
 epoch: 70, train_loss: 0.4304, test_loss: 1.9295, test_f1: 0.5997
 epoch: 71, train_loss: 0.4328, test_loss: 1.9704, test_f1: 0.5971
 epoch: 72, train_loss: 0.4241, test_loss: 1.9016, test_f1: 0.6279
 epoch: 73, train_loss: 0.4205, test_loss: 2.0263, test_f1: 0.5954
 epoch: 74, train_loss: 0.3886, test_loss: 1.8610, test_f1: 0.5867
 epoch: 75, train_loss: 0.4126, test_loss: 2.1026, test_f1: 0.5847
 epoch: 76, train_loss: 0.4150, test_loss: 2.1923, test_f1: 0.5923
 epoch: 77, train_loss: 0.3958, test_loss: 1.8345, test_f1: 0.5892
 epoch: 78, train_loss: 0.3958, test_loss: 2.0797, test_f1: 0.5815
 epoch: 79, train_loss: 0.4289, test_loss: 1.9544, test_f1: 0.5930
 epoch: 80, train_loss: 0.4164, test_loss: 2.1681, test_f1: 0.5968
 epoch: 81, train_loss: 0.4189, test_loss: 2.1537, test_f1: 0.5708
 epoch: 82, train_loss: 0.4107, test_loss: 2.0803, test_f1: 0.6009
 epoch: 83, train_loss: 0.4036, test_loss: 1.8651, test_f1: 0.5869
 epoch: 84, train_loss: 0.3847, test_loss: 1.9768, test_f1: 0.6122
 epoch: 85, train_loss: 0.3890, test_loss: 1.8494, test_f1: 0.6014
 epoch: 86, train_loss: 0.4031, test_loss: 1.9068, test_f1: 0.5764
 epoch: 87, train_loss: 0.3883, test_loss: 1.8921, test_f1: 0.6067
 epoch: 88, train_loss: 0.3708, test_loss: 1.9794, test_f1: 0.6307
 epoch: 89, train_loss: 0.4058, test_loss: 2.0132, test_f1: 0.5791
 epoch: 90, train_loss: 0.3673, test_loss: 2.0296, test_f1: 0.5975
 epoch: 91, train_loss: 0.3846, test_loss: 1.9937, test_f1: 0.5775
 epoch: 92, train_loss: 0.3770, test_loss: 2.2792, test_f1: 0.5333
 epoch: 93, train_loss: 0.3778, test_loss: 1.8785, test_f1: 0.5936
 epoch: 94, train_loss: 0.3717, test_loss: 2.3786, test_f1: 0.5719
 epoch: 95, train_loss: 0.3734, test_loss: 2.0548, test_f1: 0.5838
 epoch: 96, train_loss: 0.3684, test_loss: 2.2492, test_f1: 0.5709
 epoch: 97, train_loss: 0.3925, test_loss: 2.0005, test_f1: 0.5823
 epoch: 98, train_loss: 0.3551, test_loss: 2.1589, test_f1: 0.6206
 epoch: 99, train_loss: 0.3577, test_loss: 2.1606, test_f1: 0.6129
##################ITERATION #3 ****************************************
 epoch: 0, train_loss: 1.3097, test_loss: 1.2087, test_f1: 0.3211
 epoch: 1, train_loss: 1.0476, test_loss: 1.0673, test_f1: 0.5245
 epoch: 2, train_loss: 1.0047, test_loss: 1.0227, test_f1: 0.5589
 epoch: 3, train_loss: 0.9222, test_loss: 1.0114, test_f1: 0.5692
 epoch: 4, train_loss: 0.8868, test_loss: 0.9921, test_f1: 0.5776
 epoch: 5, train_loss: 0.8625, test_loss: 1.0190, test_f1: 0.5856
 epoch: 6, train_loss: 0.8350, test_loss: 0.9825, test_f1: 0.5958
 epoch: 7, train_loss: 0.8098, test_loss: 0.9974, test_f1: 0.6104
 epoch: 8, train_loss: 0.7949, test_loss: 1.0005, test_f1: 0.5916
 epoch: 9, train_loss: 0.7853, test_loss: 1.0349, test_f1: 0.5830
 epoch: 10, train_loss: 0.7703, test_loss: 0.9426, test_f1: 0.6131
 epoch: 11, train_loss: 0.7453, test_loss: 1.0401, test_f1: 0.6097
 epoch: 12, train_loss: 0.7431, test_loss: 1.0076, test_f1: 0.5852
 epoch: 13, train_loss: 0.7243, test_loss: 1.0119, test_f1: 0.5589
 epoch: 14, train_loss: 0.7121, test_loss: 1.0100, test_f1: 0.5675
 epoch: 15, train_loss: 0.7005, test_loss: 1.0482, test_f1: 0.5891
 epoch: 16, train_loss: 0.7047, test_loss: 1.0086, test_f1: 0.5918
 epoch: 17, train_loss: 0.6904, test_loss: 1.0981, test_f1: 0.6146
 epoch: 18, train_loss: 0.6769, test_loss: 1.1145, test_f1: 0.5294
 epoch: 19, train_loss: 0.7039, test_loss: 1.0176, test_f1: 0.5937
 epoch: 20, train_loss: 0.6660, test_loss: 1.2521, test_f1: 0.5538
 epoch: 21, train_loss: 0.6453, test_loss: 0.9921, test_f1: 0.5994
 epoch: 22, train_loss: 0.6568, test_loss: 1.0323, test_f1: 0.5833
 epoch: 23, train_loss: 0.6545, test_loss: 1.1809, test_f1: 0.5674
 epoch: 24, train_loss: 0.6460, test_loss: 0.9985, test_f1: 0.6073
 epoch: 25, train_loss: 0.6326, test_loss: 1.0758, test_f1: 0.5754
 epoch: 26, train_loss: 0.6282, test_loss: 1.1596, test_f1: 0.6135
 epoch: 27, train_loss: 0.6348, test_loss: 1.0919, test_f1: 0.5819
 epoch: 28, train_loss: 0.6086, test_loss: 1.0718, test_f1: 0.6358
 epoch: 29, train_loss: 0.6145, test_loss: 1.1837, test_f1: 0.5399
 epoch: 30, train_loss: 0.5928, test_loss: 1.2601, test_f1: 0.5806
 epoch: 31, train_loss: 0.5675, test_loss: 1.1540, test_f1: 0.5585
 epoch: 32, train_loss: 0.5983, test_loss: 1.3323, test_f1: 0.5736
 epoch: 33, train_loss: 0.5590, test_loss: 1.0571, test_f1: 0.6118
 epoch: 34, train_loss: 0.5788, test_loss: 1.3647, test_f1: 0.5698
 epoch: 35, train_loss: 0.5877, test_loss: 1.2784, test_f1: 0.5660
 epoch: 36, train_loss: 0.5727, test_loss: 1.2117, test_f1: 0.5995
 epoch: 37, train_loss: 0.5658, test_loss: 1.0994, test_f1: 0.6102
 epoch: 38, train_loss: 0.5695, test_loss: 1.3270, test_f1: 0.5623
 epoch: 39, train_loss: 0.5454, test_loss: 1.1169, test_f1: 0.6144
 epoch: 40, train_loss: 0.5492, test_loss: 1.3482, test_f1: 0.5624
 epoch: 41, train_loss: 0.5313, test_loss: 1.2081, test_f1: 0.6184
 epoch: 42, train_loss: 0.5450, test_loss: 1.3599, test_f1: 0.5317
 epoch: 43, train_loss: 0.5344, test_loss: 1.4785, test_f1: 0.5357
 epoch: 44, train_loss: 0.5451, test_loss: 1.3368, test_f1: 0.5730
 epoch: 45, train_loss: 0.5115, test_loss: 1.4011, test_f1: 0.5814
 epoch: 46, train_loss: 0.5272, test_loss: 1.3596, test_f1: 0.5930
 epoch: 47, train_loss: 0.5305, test_loss: 1.5093, test_f1: 0.6146
 epoch: 48, train_loss: 0.5237, test_loss: 1.3193, test_f1: 0.5972
 epoch: 49, train_loss: 0.5156, test_loss: 1.4848, test_f1: 0.6131
 epoch: 50, train_loss: 0.5155, test_loss: 1.4521, test_f1: 0.6093
 epoch: 51, train_loss: 0.4908, test_loss: 1.4769, test_f1: 0.6116
 epoch: 52, train_loss: 0.5076, test_loss: 1.4333, test_f1: 0.6035
 epoch: 53, train_loss: 0.4615, test_loss: 1.4538, test_f1: 0.6144
 epoch: 54, train_loss: 0.4582, test_loss: 1.6025, test_f1: 0.6258
 epoch: 55, train_loss: 0.4550, test_loss: 1.5571, test_f1: 0.5965
 epoch: 56, train_loss: 0.4583, test_loss: 1.4479, test_f1: 0.5905
 epoch: 57, train_loss: 0.4503, test_loss: 1.6116, test_f1: 0.6164
 epoch: 58, train_loss: 0.4343, test_loss: 1.6518, test_f1: 0.6029
 epoch: 59, train_loss: 0.4547, test_loss: 1.6716, test_f1: 0.6341
 epoch: 60, train_loss: 0.4375, test_loss: 1.7512, test_f1: 0.5853
 epoch: 61, train_loss: 0.4385, test_loss: 1.7289, test_f1: 0.6204
 epoch: 62, train_loss: 0.4352, test_loss: 1.6803, test_f1: 0.5872
 epoch: 63, train_loss: 0.4479, test_loss: 1.7233, test_f1: 0.5791
 epoch: 64, train_loss: 0.4203, test_loss: 1.7263, test_f1: 0.6006
 epoch: 65, train_loss: 0.4283, test_loss: 1.8223, test_f1: 0.6018
 epoch: 66, train_loss: 0.4273, test_loss: 1.6653, test_f1: 0.5920
 epoch: 67, train_loss: 0.4368, test_loss: 1.6772, test_f1: 0.6348
 epoch: 68, train_loss: 0.4228, test_loss: 1.9048, test_f1: 0.6183
 epoch: 69, train_loss: 0.4244, test_loss: 1.7752, test_f1: 0.6263
 epoch: 70, train_loss: 0.4095, test_loss: 1.8775, test_f1: 0.5879
 epoch: 71, train_loss: 0.4074, test_loss: 1.9075, test_f1: 0.5992
 epoch: 72, train_loss: 0.4180, test_loss: 1.9106, test_f1: 0.6112
 epoch: 73, train_loss: 0.4112, test_loss: 2.0915, test_f1: 0.6014
 epoch: 74, train_loss: 0.3932, test_loss: 2.0535, test_f1: 0.5598
 epoch: 75, train_loss: 0.3980, test_loss: 1.9636, test_f1: 0.6008
 epoch: 76, train_loss: 0.3721, test_loss: 2.0160, test_f1: 0.5718
 epoch: 77, train_loss: 0.3781, test_loss: 2.0428, test_f1: 0.5748
 epoch: 78, train_loss: 0.3688, test_loss: 1.8952, test_f1: 0.5693
 epoch: 79, train_loss: 0.3919, test_loss: 2.1081, test_f1: 0.5862
 epoch: 80, train_loss: 0.3671, test_loss: 2.1489, test_f1: 0.5570
 epoch: 81, train_loss: 0.3826, test_loss: 2.1794, test_f1: 0.5970
 epoch: 82, train_loss: 0.3706, test_loss: 2.2611, test_f1: 0.6160
 epoch: 83, train_loss: 0.3766, test_loss: 2.3362, test_f1: 0.5720
 epoch: 84, train_loss: 0.3899, test_loss: 2.2309, test_f1: 0.5765
 epoch: 85, train_loss: 0.3726, test_loss: 1.9160, test_f1: 0.6111
 epoch: 86, train_loss: 0.3758, test_loss: 2.0816, test_f1: 0.5766
 epoch: 87, train_loss: 0.3841, test_loss: 2.2746, test_f1: 0.5830
 epoch: 88, train_loss: 0.3468, test_loss: 2.2553, test_f1: 0.5954
 epoch: 89, train_loss: 0.3846, test_loss: 2.0889, test_f1: 0.5930
 epoch: 90, train_loss: 0.3431, test_loss: 2.2870, test_f1: 0.5975
 epoch: 91, train_loss: 0.3681, test_loss: 2.0845, test_f1: 0.6059
 epoch: 92, train_loss: 0.3443, test_loss: 1.9621, test_f1: 0.6294
 epoch: 93, train_loss: 0.3519, test_loss: 2.2678, test_f1: 0.6009
 epoch: 94, train_loss: 0.3566, test_loss: 2.2141, test_f1: 0.5816
 epoch: 95, train_loss: 0.3367, test_loss: 2.3108, test_f1: 0.5504
 epoch: 96, train_loss: 0.3342, test_loss: 2.1176, test_f1: 0.6096
 epoch: 97, train_loss: 0.3244, test_loss: 2.3073, test_f1: 0.5583
 epoch: 98, train_loss: 0.3363, test_loss: 2.1310, test_f1: 0.5914
 epoch: 99, train_loss: 0.3302, test_loss: 2.3359, test_f1: 0.6344
##################ITERATION #4 ****************************************
 epoch: 0, train_loss: 1.2667, test_loss: 1.2827, test_f1: 0.3568
 epoch: 1, train_loss: 1.1197, test_loss: 1.1127, test_f1: 0.4531
 epoch: 2, train_loss: 1.0258, test_loss: 1.0728, test_f1: 0.4928
 epoch: 3, train_loss: 0.9911, test_loss: 1.0315, test_f1: 0.5224
 epoch: 4, train_loss: 0.9582, test_loss: 1.0213, test_f1: 0.5054
 epoch: 5, train_loss: 0.9178, test_loss: 1.0730, test_f1: 0.5366
 epoch: 6, train_loss: 0.8969, test_loss: 1.0140, test_f1: 0.5014
 epoch: 7, train_loss: 0.8807, test_loss: 1.5603, test_f1: 0.4248
 epoch: 8, train_loss: 0.8547, test_loss: 1.1279, test_f1: 0.5052
 epoch: 9, train_loss: 0.8410, test_loss: 1.0267, test_f1: 0.4612
 epoch: 10, train_loss: 0.8142, test_loss: 1.0993, test_f1: 0.5809
 epoch: 11, train_loss: 0.8212, test_loss: 1.0546, test_f1: 0.5554
 epoch: 12, train_loss: 0.8109, test_loss: 0.9689, test_f1: 0.5619
 epoch: 13, train_loss: 0.7917, test_loss: 0.9511, test_f1: 0.6300
 epoch: 14, train_loss: 0.7819, test_loss: 1.0084, test_f1: 0.5279
 epoch: 15, train_loss: 0.7642, test_loss: 0.9903, test_f1: 0.5578
 epoch: 16, train_loss: 0.7521, test_loss: 1.2195, test_f1: 0.5207
 epoch: 17, train_loss: 0.7598, test_loss: 1.1994, test_f1: 0.5520
 epoch: 18, train_loss: 0.7430, test_loss: 1.0301, test_f1: 0.5754
 epoch: 19, train_loss: 0.7071, test_loss: 0.9729, test_f1: 0.5862
 epoch: 20, train_loss: 0.7184, test_loss: 1.0057, test_f1: 0.5445
 epoch: 21, train_loss: 0.7041, test_loss: 0.9784, test_f1: 0.5738
 epoch: 22, train_loss: 0.7037, test_loss: 1.2436, test_f1: 0.5180
 epoch: 23, train_loss: 0.7173, test_loss: 1.1476, test_f1: 0.5382
 epoch: 24, train_loss: 0.6907, test_loss: 1.0139, test_f1: 0.5627
 epoch: 25, train_loss: 0.6826, test_loss: 1.1252, test_f1: 0.4867
 epoch: 26, train_loss: 0.6695, test_loss: 1.0238, test_f1: 0.5702
 epoch: 27, train_loss: 0.6731, test_loss: 1.0793, test_f1: 0.5864
 epoch: 28, train_loss: 0.6662, test_loss: 1.0829, test_f1: 0.6054
 epoch: 29, train_loss: 0.6503, test_loss: 1.2601, test_f1: 0.4777
 epoch: 30, train_loss: 0.6598, test_loss: 1.0366, test_f1: 0.5980
 epoch: 31, train_loss: 0.6442, test_loss: 1.0614, test_f1: 0.5974
 epoch: 32, train_loss: 0.6400, test_loss: 0.8926, test_f1: 0.6327
 epoch: 33, train_loss: 0.6299, test_loss: 1.0549, test_f1: 0.5785
 epoch: 34, train_loss: 0.6584, test_loss: 1.0557, test_f1: 0.5640
 epoch: 35, train_loss: 0.6453, test_loss: 1.0936, test_f1: 0.6304
 epoch: 36, train_loss: 0.6333, test_loss: 1.0964, test_f1: 0.5937
 epoch: 37, train_loss: 0.6138, test_loss: 1.0003, test_f1: 0.6485
 epoch: 38, train_loss: 0.6179, test_loss: 1.0204, test_f1: 0.6505
 epoch: 39, train_loss: 0.6118, test_loss: 1.2028, test_f1: 0.5370
 epoch: 40, train_loss: 0.6087, test_loss: 1.1168, test_f1: 0.5900
 epoch: 41, train_loss: 0.5905, test_loss: 1.0933, test_f1: 0.5808
 epoch: 42, train_loss: 0.5948, test_loss: 1.1326, test_f1: 0.5237
 epoch: 43, train_loss: 0.5889, test_loss: 1.1016, test_f1: 0.5636
 epoch: 44, train_loss: 0.6105, test_loss: 1.2866, test_f1: 0.4996
 epoch: 45, train_loss: 0.6037, test_loss: 1.0884, test_f1: 0.6201
 epoch: 46, train_loss: 0.5865, test_loss: 1.1750, test_f1: 0.6350
 epoch: 47, train_loss: 0.5969, test_loss: 1.3870, test_f1: 0.4755
 epoch: 48, train_loss: 0.5905, test_loss: 1.0663, test_f1: 0.5940
 epoch: 49, train_loss: 0.5904, test_loss: 1.1099, test_f1: 0.5962
 epoch: 50, train_loss: 0.5778, test_loss: 1.1272, test_f1: 0.6310
 epoch: 51, train_loss: 0.5431, test_loss: 1.0859, test_f1: 0.5947
 epoch: 52, train_loss: 0.5243, test_loss: 1.1469, test_f1: 0.6006
 epoch: 53, train_loss: 0.5060, test_loss: 1.1651, test_f1: 0.6198
 epoch: 54, train_loss: 0.5395, test_loss: 1.1603, test_f1: 0.6189
 epoch: 55, train_loss: 0.5313, test_loss: 1.0496, test_f1: 0.6119
 epoch: 56, train_loss: 0.5225, test_loss: 1.1147, test_f1: 0.6308
 epoch: 57, train_loss: 0.5040, test_loss: 1.2563, test_f1: 0.6241
 epoch: 58, train_loss: 0.5117, test_loss: 1.1807, test_f1: 0.6328
 epoch: 59, train_loss: 0.5181, test_loss: 1.1118, test_f1: 0.6134
 epoch: 60, train_loss: 0.5063, test_loss: 1.2103, test_f1: 0.6107
 epoch: 61, train_loss: 0.4875, test_loss: 1.1962, test_f1: 0.6076
 epoch: 62, train_loss: 0.4906, test_loss: 1.2689, test_f1: 0.5806
 epoch: 63, train_loss: 0.4954, test_loss: 1.1084, test_f1: 0.6307
 epoch: 64, train_loss: 0.4936, test_loss: 1.2725, test_f1: 0.6104
 epoch: 65, train_loss: 0.4988, test_loss: 1.3193, test_f1: 0.5859
 epoch: 66, train_loss: 0.4757, test_loss: 1.1729, test_f1: 0.6125
 epoch: 67, train_loss: 0.5113, test_loss: 1.1783, test_f1: 0.5966
 epoch: 68, train_loss: 0.4565, test_loss: 1.3299, test_f1: 0.5866
 epoch: 69, train_loss: 0.4873, test_loss: 1.4030, test_f1: 0.5853
 epoch: 70, train_loss: 0.4767, test_loss: 1.2595, test_f1: 0.5912
 epoch: 71, train_loss: 0.4707, test_loss: 1.2017, test_f1: 0.6137
 epoch: 72, train_loss: 0.4602, test_loss: 1.2250, test_f1: 0.6046
 epoch: 73, train_loss: 0.4537, test_loss: 1.2640, test_f1: 0.5886
 epoch: 74, train_loss: 0.4801, test_loss: 1.2627, test_f1: 0.5958
 epoch: 75, train_loss: 0.4377, test_loss: 1.3149, test_f1: 0.6178
 epoch: 76, train_loss: 0.4647, test_loss: 1.4171, test_f1: 0.6025
 epoch: 77, train_loss: 0.4634, test_loss: 1.3961, test_f1: 0.6011
 epoch: 78, train_loss: 0.4732, test_loss: 1.3021, test_f1: 0.5746
 epoch: 79, train_loss: 0.4577, test_loss: 1.3942, test_f1: 0.6112
 epoch: 80, train_loss: 0.4673, test_loss: 1.4539, test_f1: 0.5987
 epoch: 81, train_loss: 0.4610, test_loss: 1.2704, test_f1: 0.6145
 epoch: 82, train_loss: 0.4501, test_loss: 1.4409, test_f1: 0.6109
 epoch: 83, train_loss: 0.4437, test_loss: 1.4237, test_f1: 0.5939
 epoch: 84, train_loss: 0.4406, test_loss: 1.5469, test_f1: 0.6381
 epoch: 85, train_loss: 0.4616, test_loss: 1.5490, test_f1: 0.5781
 epoch: 86, train_loss: 0.4696, test_loss: 1.4571, test_f1: 0.6430
 epoch: 87, train_loss: 0.4520, test_loss: 1.4655, test_f1: 0.6284
 epoch: 88, train_loss: 0.4399, test_loss: 1.5575, test_f1: 0.6041
 epoch: 89, train_loss: 0.4391, test_loss: 1.3933, test_f1: 0.6358
 epoch: 90, train_loss: 0.4351, test_loss: 1.6527, test_f1: 0.5830
 epoch: 91, train_loss: 0.4236, test_loss: 1.3510, test_f1: 0.6245
 epoch: 92, train_loss: 0.4224, test_loss: 1.4653, test_f1: 0.6085
 epoch: 93, train_loss: 0.4416, test_loss: 1.5250, test_f1: 0.5738
 epoch: 94, train_loss: 0.4303, test_loss: 1.5213, test_f1: 0.5928
 epoch: 95, train_loss: 0.4151, test_loss: 1.5011, test_f1: 0.6129
 epoch: 96, train_loss: 0.4297, test_loss: 1.6681, test_f1: 0.6072
 epoch: 97, train_loss: 0.4141, test_loss: 1.3540, test_f1: 0.6623
 epoch: 98, train_loss: 0.4081, test_loss: 1.3194, test_f1: 0.6378
 epoch: 99, train_loss: 0.3984, test_loss: 1.4316, test_f1: 0.6425
##################ITERATION #5 ****************************************
 epoch: 0, train_loss: 1.2662, test_loss: 1.2372, test_f1: 0.4924
 epoch: 1, train_loss: 1.0357, test_loss: 1.1219, test_f1: 0.4429
 epoch: 2, train_loss: 0.9836, test_loss: 1.1255, test_f1: 0.4709
 epoch: 3, train_loss: 0.9388, test_loss: 1.0636, test_f1: 0.5256
 epoch: 4, train_loss: 0.9073, test_loss: 0.9963, test_f1: 0.5550
 epoch: 5, train_loss: 0.9025, test_loss: 1.0614, test_f1: 0.5274
 epoch: 6, train_loss: 0.8661, test_loss: 0.9873, test_f1: 0.5115
 epoch: 7, train_loss: 0.8576, test_loss: 0.9934, test_f1: 0.5707
 epoch: 8, train_loss: 0.8368, test_loss: 1.0012, test_f1: 0.5186
 epoch: 9, train_loss: 0.8222, test_loss: 0.9882, test_f1: 0.5564
 epoch: 10, train_loss: 0.8049, test_loss: 1.0147, test_f1: 0.5025
 epoch: 11, train_loss: 0.7908, test_loss: 0.9963, test_f1: 0.5375
 epoch: 12, train_loss: 0.7815, test_loss: 1.0175, test_f1: 0.5830
 epoch: 13, train_loss: 0.7871, test_loss: 0.9616, test_f1: 0.5799
 epoch: 14, train_loss: 0.7760, test_loss: 1.0885, test_f1: 0.5286
 epoch: 15, train_loss: 0.7414, test_loss: 1.0061, test_f1: 0.5270
 epoch: 16, train_loss: 0.7609, test_loss: 1.0781, test_f1: 0.5590
 epoch: 17, train_loss: 0.7481, test_loss: 1.0627, test_f1: 0.5689
 epoch: 18, train_loss: 0.7234, test_loss: 1.0275, test_f1: 0.5756
 epoch: 19, train_loss: 0.7120, test_loss: 1.0157, test_f1: 0.5998
 epoch: 20, train_loss: 0.7029, test_loss: 1.0023, test_f1: 0.5912
 epoch: 21, train_loss: 0.7079, test_loss: 0.9905, test_f1: 0.6116
 epoch: 22, train_loss: 0.7133, test_loss: 1.2670, test_f1: 0.5173
 epoch: 23, train_loss: 0.7026, test_loss: 1.0283, test_f1: 0.5950
 epoch: 24, train_loss: 0.6943, test_loss: 1.0527, test_f1: 0.5723
 epoch: 25, train_loss: 0.6837, test_loss: 1.1794, test_f1: 0.6076
 epoch: 26, train_loss: 0.6839, test_loss: 1.0997, test_f1: 0.5873
 epoch: 27, train_loss: 0.6745, test_loss: 1.1414, test_f1: 0.5795
 epoch: 28, train_loss: 0.6517, test_loss: 1.2689, test_f1: 0.5595
 epoch: 29, train_loss: 0.6623, test_loss: 1.2804, test_f1: 0.5362
 epoch: 30, train_loss: 0.6528, test_loss: 1.3474, test_f1: 0.5697
 epoch: 31, train_loss: 0.6559, test_loss: 1.2680, test_f1: 0.6347
 epoch: 32, train_loss: 0.6554, test_loss: 1.1781, test_f1: 0.6565
 epoch: 33, train_loss: 0.6373, test_loss: 1.2007, test_f1: 0.6095
 epoch: 34, train_loss: 0.6327, test_loss: 1.2769, test_f1: 0.5921
 epoch: 35, train_loss: 0.6111, test_loss: 1.1787, test_f1: 0.6428
 epoch: 36, train_loss: 0.6136, test_loss: 1.2699, test_f1: 0.5786
 epoch: 37, train_loss: 0.6263, test_loss: 1.2435, test_f1: 0.6073
 epoch: 38, train_loss: 0.6113, test_loss: 1.3247, test_f1: 0.5979
 epoch: 39, train_loss: 0.6185, test_loss: 1.3102, test_f1: 0.6350
 epoch: 40, train_loss: 0.5926, test_loss: 1.2962, test_f1: 0.6165
 epoch: 41, train_loss: 0.6054, test_loss: 1.3075, test_f1: 0.5926
 epoch: 42, train_loss: 0.6102, test_loss: 1.2676, test_f1: 0.6294
 epoch: 43, train_loss: 0.5807, test_loss: 1.3372, test_f1: 0.6519
 epoch: 44, train_loss: 0.5982, test_loss: 1.2653, test_f1: 0.5947
 epoch: 45, train_loss: 0.5965, test_loss: 1.2884, test_f1: 0.5886
 epoch: 46, train_loss: 0.5742, test_loss: 1.2424, test_f1: 0.5901
 epoch: 47, train_loss: 0.5743, test_loss: 1.4336, test_f1: 0.5471
 epoch: 48, train_loss: 0.5549, test_loss: 1.2886, test_f1: 0.6360
 epoch: 49, train_loss: 0.5519, test_loss: 1.2670, test_f1: 0.6143
 epoch: 50, train_loss: 0.5505, test_loss: 1.3131, test_f1: 0.6004
 epoch: 51, train_loss: 0.5567, test_loss: 1.3667, test_f1: 0.6460
 epoch: 52, train_loss: 0.5026, test_loss: 1.3211, test_f1: 0.6256
 epoch: 53, train_loss: 0.5325, test_loss: 1.4361, test_f1: 0.6533
 epoch: 54, train_loss: 0.5451, test_loss: 1.4329, test_f1: 0.6275
 epoch: 55, train_loss: 0.4947, test_loss: 1.4763, test_f1: 0.6026
 epoch: 56, train_loss: 0.5151, test_loss: 1.3990, test_f1: 0.6555
 epoch: 57, train_loss: 0.5318, test_loss: 1.4116, test_f1: 0.6584
 epoch: 58, train_loss: 0.5043, test_loss: 1.3128, test_f1: 0.6219
 epoch: 59, train_loss: 0.5133, test_loss: 1.4097, test_f1: 0.6035
 epoch: 60, train_loss: 0.5097, test_loss: 1.3186, test_f1: 0.6494
 epoch: 61, train_loss: 0.5105, test_loss: 1.4001, test_f1: 0.6033
 epoch: 62, train_loss: 0.4892, test_loss: 1.3960, test_f1: 0.6483
 epoch: 63, train_loss: 0.4994, test_loss: 1.4595, test_f1: 0.6182
 epoch: 64, train_loss: 0.4874, test_loss: 1.4464, test_f1: 0.6396
 epoch: 65, train_loss: 0.4804, test_loss: 1.3779, test_f1: 0.6413
 epoch: 66, train_loss: 0.4897, test_loss: 1.4345, test_f1: 0.6399
 epoch: 67, train_loss: 0.4617, test_loss: 1.5211, test_f1: 0.6531
 epoch: 68, train_loss: 0.4747, test_loss: 1.4942, test_f1: 0.6249
 epoch: 69, train_loss: 0.4553, test_loss: 1.4655, test_f1: 0.6864
 epoch: 70, train_loss: 0.4860, test_loss: 1.4219, test_f1: 0.6719
 epoch: 71, train_loss: 0.4827, test_loss: 1.4515, test_f1: 0.6389
 epoch: 72, train_loss: 0.4711, test_loss: 1.4630, test_f1: 0.6479
 epoch: 73, train_loss: 0.4812, test_loss: 1.5710, test_f1: 0.6193
 epoch: 74, train_loss: 0.4705, test_loss: 1.4595, test_f1: 0.6075
 epoch: 75, train_loss: 0.4593, test_loss: 1.4875, test_f1: 0.6316
 epoch: 76, train_loss: 0.4620, test_loss: 1.4244, test_f1: 0.6180
 epoch: 77, train_loss: 0.4695, test_loss: 1.4109, test_f1: 0.6280
 epoch: 78, train_loss: 0.4473, test_loss: 1.5648, test_f1: 0.6245
 epoch: 79, train_loss: 0.4594, test_loss: 1.5659, test_f1: 0.6348
 epoch: 80, train_loss: 0.4580, test_loss: 1.5173, test_f1: 0.6242
 epoch: 81, train_loss: 0.4463, test_loss: 1.4805, test_f1: 0.6310
 epoch: 82, train_loss: 0.4196, test_loss: 1.4372, test_f1: 0.6410
 epoch: 83, train_loss: 0.4306, test_loss: 1.4206, test_f1: 0.6277
 epoch: 84, train_loss: 0.4509, test_loss: 1.5099, test_f1: 0.6336
 epoch: 85, train_loss: 0.4275, test_loss: 1.4799, test_f1: 0.6261
 epoch: 86, train_loss: 0.4409, test_loss: 1.4964, test_f1: 0.6058
 epoch: 87, train_loss: 0.4485, test_loss: 1.5556, test_f1: 0.6456
 epoch: 88, train_loss: 0.4555, test_loss: 1.4561, test_f1: 0.6441
 epoch: 89, train_loss: 0.4609, test_loss: 1.4511, test_f1: 0.6244
 epoch: 90, train_loss: 0.4122, test_loss: 1.5013, test_f1: 0.6400
 epoch: 91, train_loss: 0.4395, test_loss: 1.7147, test_f1: 0.6179
 epoch: 92, train_loss: 0.4576, test_loss: 1.5503, test_f1: 0.5896
 epoch: 93, train_loss: 0.4519, test_loss: 1.3934, test_f1: 0.6668
 epoch: 94, train_loss: 0.4371, test_loss: 1.5694, test_f1: 0.6078
 epoch: 95, train_loss: 0.4173, test_loss: 1.5595, test_f1: 0.6340
 epoch: 96, train_loss: 0.4264, test_loss: 1.4711, test_f1: 0.6396
 epoch: 97, train_loss: 0.4194, test_loss: 1.5851, test_f1: 0.6263
 epoch: 98, train_loss: 0.4254, test_loss: 1.5611, test_f1: 0.6022
 epoch: 99, train_loss: 0.4020, test_loss: 1.7163, test_f1: 0.6175
##################ITERATION #6 ****************************************
 epoch: 0, train_loss: 1.3017, test_loss: 1.2572, test_f1: 0.3935
 epoch: 1, train_loss: 1.0343, test_loss: 1.1128, test_f1: 0.5302
 epoch: 2, train_loss: 0.9980, test_loss: 1.1178, test_f1: 0.5397
 epoch: 3, train_loss: 0.9424, test_loss: 1.0541, test_f1: 0.5106
 epoch: 4, train_loss: 0.9209, test_loss: 1.0539, test_f1: 0.5445
 epoch: 5, train_loss: 0.9053, test_loss: 1.0277, test_f1: 0.5247
 epoch: 6, train_loss: 0.8761, test_loss: 1.0274, test_f1: 0.5585
 epoch: 7, train_loss: 0.8557, test_loss: 1.0293, test_f1: 0.6014
 epoch: 8, train_loss: 0.8295, test_loss: 0.9871, test_f1: 0.5500
 epoch: 9, train_loss: 0.8336, test_loss: 0.9876, test_f1: 0.5345
 epoch: 10, train_loss: 0.8422, test_loss: 0.9743, test_f1: 0.5496
 epoch: 11, train_loss: 0.8290, test_loss: 0.9614, test_f1: 0.6322
 epoch: 12, train_loss: 0.8031, test_loss: 0.9882, test_f1: 0.6145
 epoch: 13, train_loss: 0.7705, test_loss: 0.9795, test_f1: 0.5878
 epoch: 14, train_loss: 0.7607, test_loss: 0.9890, test_f1: 0.6010
 epoch: 15, train_loss: 0.7995, test_loss: 1.0522, test_f1: 0.5886
 epoch: 16, train_loss: 0.7642, test_loss: 0.9913, test_f1: 0.6303
 epoch: 17, train_loss: 0.7465, test_loss: 0.9620, test_f1: 0.6374
 epoch: 18, train_loss: 0.7439, test_loss: 0.9596, test_f1: 0.6046
 epoch: 19, train_loss: 0.7524, test_loss: 0.9680, test_f1: 0.5889
 epoch: 20, train_loss: 0.7370, test_loss: 0.9537, test_f1: 0.5977
 epoch: 21, train_loss: 0.7261, test_loss: 0.9617, test_f1: 0.5840
 epoch: 22, train_loss: 0.7427, test_loss: 0.9833, test_f1: 0.5454
 epoch: 23, train_loss: 0.7438, test_loss: 0.9385, test_f1: 0.6227
 epoch: 24, train_loss: 0.7054, test_loss: 1.0248, test_f1: 0.6018
 epoch: 25, train_loss: 0.7011, test_loss: 0.9676, test_f1: 0.6079
 epoch: 26, train_loss: 0.7033, test_loss: 0.9155, test_f1: 0.6207
 epoch: 27, train_loss: 0.6798, test_loss: 0.9755, test_f1: 0.5662
 epoch: 28, train_loss: 0.6932, test_loss: 0.9221, test_f1: 0.6036
 epoch: 29, train_loss: 0.6954, test_loss: 0.9660, test_f1: 0.5868
 epoch: 30, train_loss: 0.6757, test_loss: 0.9740, test_f1: 0.5783
 epoch: 31, train_loss: 0.6644, test_loss: 1.0255, test_f1: 0.6177
 epoch: 32, train_loss: 0.6580, test_loss: 1.0445, test_f1: 0.5735
 epoch: 33, train_loss: 0.6573, test_loss: 0.9944, test_f1: 0.6163
 epoch: 34, train_loss: 0.6507, test_loss: 0.9880, test_f1: 0.6102
 epoch: 35, train_loss: 0.6542, test_loss: 0.9516, test_f1: 0.6358
 epoch: 36, train_loss: 0.6375, test_loss: 0.9848, test_f1: 0.6156
 epoch: 37, train_loss: 0.6503, test_loss: 0.9656, test_f1: 0.5894
 epoch: 38, train_loss: 0.6471, test_loss: 0.9928, test_f1: 0.6308
 epoch: 39, train_loss: 0.6466, test_loss: 0.9782, test_f1: 0.6145
 epoch: 40, train_loss: 0.6240, test_loss: 1.0890, test_f1: 0.6214
 epoch: 41, train_loss: 0.6347, test_loss: 1.0770, test_f1: 0.5867
 epoch: 42, train_loss: 0.6216, test_loss: 0.9499, test_f1: 0.6138
 epoch: 43, train_loss: 0.6363, test_loss: 1.1164, test_f1: 0.6098
 epoch: 44, train_loss: 0.6299, test_loss: 0.9497, test_f1: 0.6234
 epoch: 45, train_loss: 0.6130, test_loss: 1.0696, test_f1: 0.6197
 epoch: 46, train_loss: 0.6234, test_loss: 1.0097, test_f1: 0.5714
 epoch: 47, train_loss: 0.6204, test_loss: 1.0642, test_f1: 0.6082
 epoch: 48, train_loss: 0.5796, test_loss: 0.9643, test_f1: 0.6145
 epoch: 49, train_loss: 0.5851, test_loss: 1.0258, test_f1: 0.5922
 epoch: 50, train_loss: 0.6254, test_loss: 1.1825, test_f1: 0.6042
 epoch: 51, train_loss: 0.5782, test_loss: 1.0802, test_f1: 0.6304
 epoch: 52, train_loss: 0.5742, test_loss: 1.0380, test_f1: 0.6106
 epoch: 53, train_loss: 0.5477, test_loss: 1.0439, test_f1: 0.5825
 epoch: 54, train_loss: 0.5583, test_loss: 1.0709, test_f1: 0.5927
 epoch: 55, train_loss: 0.5578, test_loss: 1.0488, test_f1: 0.5994
 epoch: 56, train_loss: 0.5531, test_loss: 1.0620, test_f1: 0.6399
 epoch: 57, train_loss: 0.5543, test_loss: 1.0672, test_f1: 0.5942
 epoch: 58, train_loss: 0.5523, test_loss: 1.1163, test_f1: 0.6108
 epoch: 59, train_loss: 0.5464, test_loss: 1.0645, test_f1: 0.6273
 epoch: 60, train_loss: 0.5312, test_loss: 1.0130, test_f1: 0.5995
 epoch: 61, train_loss: 0.5154, test_loss: 1.1168, test_f1: 0.6033
 epoch: 62, train_loss: 0.5272, test_loss: 1.1226, test_f1: 0.5703
 epoch: 63, train_loss: 0.5311, test_loss: 1.1266, test_f1: 0.6275
 epoch: 64, train_loss: 0.5345, test_loss: 1.1223, test_f1: 0.6358
 epoch: 65, train_loss: 0.5185, test_loss: 1.1448, test_f1: 0.6315
 epoch: 66, train_loss: 0.5188, test_loss: 1.1386, test_f1: 0.6460
 epoch: 67, train_loss: 0.5252, test_loss: 1.2189, test_f1: 0.6136
 epoch: 68, train_loss: 0.5151, test_loss: 1.1938, test_f1: 0.6243
 epoch: 69, train_loss: 0.5059, test_loss: 1.1046, test_f1: 0.6117
 epoch: 70, train_loss: 0.5008, test_loss: 1.1538, test_f1: 0.6599
 epoch: 71, train_loss: 0.4836, test_loss: 1.1599, test_f1: 0.5739
 epoch: 72, train_loss: 0.4850, test_loss: 1.2233, test_f1: 0.6336
 epoch: 73, train_loss: 0.5174, test_loss: 1.1898, test_f1: 0.6227
 epoch: 74, train_loss: 0.4908, test_loss: 1.2476, test_f1: 0.6165
 epoch: 75, train_loss: 0.4966, test_loss: 1.1548, test_f1: 0.5633
 epoch: 76, train_loss: 0.5081, test_loss: 1.1836, test_f1: 0.6246
 epoch: 77, train_loss: 0.5069, test_loss: 1.1555, test_f1: 0.6131
 epoch: 78, train_loss: 0.5061, test_loss: 1.1316, test_f1: 0.5952
 epoch: 79, train_loss: 0.4798, test_loss: 1.2100, test_f1: 0.6039
 epoch: 80, train_loss: 0.5133, test_loss: 1.1789, test_f1: 0.6473
 epoch: 81, train_loss: 0.4896, test_loss: 1.3001, test_f1: 0.6483
 epoch: 82, train_loss: 0.4775, test_loss: 1.2837, test_f1: 0.6056
 epoch: 83, train_loss: 0.4953, test_loss: 1.2754, test_f1: 0.6237
 epoch: 84, train_loss: 0.4718, test_loss: 1.2860, test_f1: 0.6068
 epoch: 85, train_loss: 0.5031, test_loss: 1.3572, test_f1: 0.6133
 epoch: 86, train_loss: 0.4825, test_loss: 1.3430, test_f1: 0.6385
 epoch: 87, train_loss: 0.4795, test_loss: 1.2107, test_f1: 0.6400
 epoch: 88, train_loss: 0.4522, test_loss: 1.2602, test_f1: 0.6133
 epoch: 89, train_loss: 0.4646, test_loss: 1.3593, test_f1: 0.5750
 epoch: 90, train_loss: 0.4674, test_loss: 1.3474, test_f1: 0.6309
 epoch: 91, train_loss: 0.4786, test_loss: 1.2765, test_f1: 0.6707
 epoch: 92, train_loss: 0.4554, test_loss: 1.3103, test_f1: 0.6200
 epoch: 93, train_loss: 0.4632, test_loss: 1.4532, test_f1: 0.6382
 epoch: 94, train_loss: 0.4600, test_loss: 1.3192, test_f1: 0.6484
 epoch: 95, train_loss: 0.4473, test_loss: 1.3589, test_f1: 0.6271
 epoch: 96, train_loss: 0.4572, test_loss: 1.3629, test_f1: 0.6243
 epoch: 97, train_loss: 0.4424, test_loss: 1.4410, test_f1: 0.6202
 epoch: 98, train_loss: 0.4558, test_loss: 1.4145, test_f1: 0.5829
 epoch: 99, train_loss: 0.4568, test_loss: 1.4292, test_f1: 0.6458
##################ITERATION #7 ****************************************
 epoch: 0, train_loss: 1.5413, test_loss: 1.2805, test_f1: 0.2927
 epoch: 1, train_loss: 1.1287, test_loss: 1.1105, test_f1: 0.4882
 epoch: 2, train_loss: 1.0151, test_loss: 1.0683, test_f1: 0.4947
 epoch: 3, train_loss: 0.9647, test_loss: 1.0559, test_f1: 0.5148
 epoch: 4, train_loss: 0.9450, test_loss: 1.0495, test_f1: 0.5616
 epoch: 5, train_loss: 0.9186, test_loss: 1.0246, test_f1: 0.5268
 epoch: 6, train_loss: 0.8582, test_loss: 1.0495, test_f1: 0.5316
 epoch: 7, train_loss: 0.8604, test_loss: 1.0372, test_f1: 0.5448
 epoch: 8, train_loss: 0.8373, test_loss: 1.0021, test_f1: 0.5749
 epoch: 9, train_loss: 0.8324, test_loss: 1.0482, test_f1: 0.5554
 epoch: 10, train_loss: 0.8075, test_loss: 1.0155, test_f1: 0.5574
 epoch: 11, train_loss: 0.8149, test_loss: 1.0402, test_f1: 0.5637
 epoch: 12, train_loss: 0.8056, test_loss: 1.0165, test_f1: 0.5215
 epoch: 13, train_loss: 0.7850, test_loss: 1.0111, test_f1: 0.5814
 epoch: 14, train_loss: 0.7831, test_loss: 0.9937, test_f1: 0.5848
 epoch: 15, train_loss: 0.7715, test_loss: 1.0246, test_f1: 0.5938
 epoch: 16, train_loss: 0.7531, test_loss: 1.1256, test_f1: 0.5695
 epoch: 17, train_loss: 0.7437, test_loss: 0.9833, test_f1: 0.5908
 epoch: 18, train_loss: 0.7420, test_loss: 1.0320, test_f1: 0.5740
 epoch: 19, train_loss: 0.7492, test_loss: 1.0583, test_f1: 0.5705
 epoch: 20, train_loss: 0.7387, test_loss: 1.0980, test_f1: 0.5420
 epoch: 21, train_loss: 0.7066, test_loss: 1.0443, test_f1: 0.5769
 epoch: 22, train_loss: 0.7198, test_loss: 1.0137, test_f1: 0.5835
 epoch: 23, train_loss: 0.7068, test_loss: 1.0042, test_f1: 0.5877
 epoch: 24, train_loss: 0.7050, test_loss: 1.0755, test_f1: 0.5509
 epoch: 25, train_loss: 0.6782, test_loss: 1.0963, test_f1: 0.5540
 epoch: 26, train_loss: 0.6822, test_loss: 1.0137, test_f1: 0.5985
 epoch: 27, train_loss: 0.6801, test_loss: 1.0558, test_f1: 0.5629
 epoch: 28, train_loss: 0.6889, test_loss: 1.0523, test_f1: 0.6102
 epoch: 29, train_loss: 0.6562, test_loss: 1.1653, test_f1: 0.6002
 epoch: 30, train_loss: 0.6570, test_loss: 1.0908, test_f1: 0.5666
 epoch: 31, train_loss: 0.6542, test_loss: 1.0682, test_f1: 0.5874
 epoch: 32, train_loss: 0.6411, test_loss: 1.2464, test_f1: 0.5705
 epoch: 33, train_loss: 0.6234, test_loss: 1.2123, test_f1: 0.5968
 epoch: 34, train_loss: 0.6403, test_loss: 1.1270, test_f1: 0.6054
 epoch: 35, train_loss: 0.6410, test_loss: 1.1834, test_f1: 0.5885
 epoch: 36, train_loss: 0.6182, test_loss: 1.1832, test_f1: 0.5698
 epoch: 37, train_loss: 0.6030, test_loss: 1.1032, test_f1: 0.5964
 epoch: 38, train_loss: 0.6184, test_loss: 1.1345, test_f1: 0.6121
 epoch: 39, train_loss: 0.6040, test_loss: 1.2512, test_f1: 0.5371
 epoch: 40, train_loss: 0.5979, test_loss: 1.1988, test_f1: 0.5776
 epoch: 41, train_loss: 0.6042, test_loss: 1.3821, test_f1: 0.5562
 epoch: 42, train_loss: 0.5752, test_loss: 1.1559, test_f1: 0.6079
 epoch: 43, train_loss: 0.5660, test_loss: 1.1995, test_f1: 0.5931
 epoch: 44, train_loss: 0.5822, test_loss: 1.2714, test_f1: 0.5880
 epoch: 45, train_loss: 0.5874, test_loss: 1.3556, test_f1: 0.5604
 epoch: 46, train_loss: 0.5491, test_loss: 1.4486, test_f1: 0.5621
 epoch: 47, train_loss: 0.5743, test_loss: 1.1401, test_f1: 0.6247
 epoch: 48, train_loss: 0.5629, test_loss: 1.2013, test_f1: 0.5991
 epoch: 49, train_loss: 0.5663, test_loss: 1.2309, test_f1: 0.5769
 epoch: 50, train_loss: 0.5243, test_loss: 1.3453, test_f1: 0.5962
 epoch: 51, train_loss: 0.5216, test_loss: 1.3260, test_f1: 0.6105
 epoch: 52, train_loss: 0.5147, test_loss: 1.3136, test_f1: 0.6047
 epoch: 53, train_loss: 0.4884, test_loss: 1.3172, test_f1: 0.5889
 epoch: 54, train_loss: 0.4870, test_loss: 1.2994, test_f1: 0.5997
 epoch: 55, train_loss: 0.4642, test_loss: 1.2749, test_f1: 0.6119
 epoch: 56, train_loss: 0.4682, test_loss: 1.2822, test_f1: 0.5928
 epoch: 57, train_loss: 0.4773, test_loss: 1.3509, test_f1: 0.6232
 epoch: 58, train_loss: 0.4658, test_loss: 1.3895, test_f1: 0.5871
 epoch: 59, train_loss: 0.4893, test_loss: 1.3073, test_f1: 0.6279
 epoch: 60, train_loss: 0.4672, test_loss: 1.3230, test_f1: 0.5917
 epoch: 61, train_loss: 0.4621, test_loss: 1.3624, test_f1: 0.6308
 epoch: 62, train_loss: 0.4587, test_loss: 1.3705, test_f1: 0.6040
 epoch: 63, train_loss: 0.4646, test_loss: 1.4616, test_f1: 0.5885
 epoch: 64, train_loss: 0.4505, test_loss: 1.4240, test_f1: 0.6160
 epoch: 65, train_loss: 0.4500, test_loss: 1.3921, test_f1: 0.6201
 epoch: 66, train_loss: 0.4464, test_loss: 1.4745, test_f1: 0.6188
 epoch: 67, train_loss: 0.5003, test_loss: 1.3891, test_f1: 0.6212
 epoch: 68, train_loss: 0.4336, test_loss: 1.4143, test_f1: 0.6154
 epoch: 69, train_loss: 0.4409, test_loss: 1.3846, test_f1: 0.6078
 epoch: 70, train_loss: 0.4214, test_loss: 1.4891, test_f1: 0.6457
 epoch: 71, train_loss: 0.4521, test_loss: 1.4358, test_f1: 0.6334
 epoch: 72, train_loss: 0.4322, test_loss: 1.5070, test_f1: 0.6216
 epoch: 73, train_loss: 0.4259, test_loss: 1.4688, test_f1: 0.6227
 epoch: 74, train_loss: 0.4184, test_loss: 1.5119, test_f1: 0.6148
 epoch: 75, train_loss: 0.4460, test_loss: 1.6622, test_f1: 0.5579
 epoch: 76, train_loss: 0.4388, test_loss: 1.4469, test_f1: 0.6047
 epoch: 77, train_loss: 0.4253, test_loss: 1.5174, test_f1: 0.6256
 epoch: 78, train_loss: 0.4336, test_loss: 1.4299, test_f1: 0.6317
 epoch: 79, train_loss: 0.4185, test_loss: 1.4932, test_f1: 0.6237
 epoch: 80, train_loss: 0.4042, test_loss: 1.5419, test_f1: 0.6185
 epoch: 81, train_loss: 0.4143, test_loss: 1.5240, test_f1: 0.6003
 epoch: 82, train_loss: 0.4000, test_loss: 1.5778, test_f1: 0.6212
 epoch: 83, train_loss: 0.4109, test_loss: 1.5279, test_f1: 0.6090
 epoch: 84, train_loss: 0.3888, test_loss: 1.5640, test_f1: 0.6208
 epoch: 85, train_loss: 0.4304, test_loss: 1.5519, test_f1: 0.6170
 epoch: 86, train_loss: 0.4061, test_loss: 1.5013, test_f1: 0.6041
 epoch: 87, train_loss: 0.4134, test_loss: 1.4650, test_f1: 0.6260
 epoch: 88, train_loss: 0.4229, test_loss: 1.5767, test_f1: 0.6288
 epoch: 89, train_loss: 0.4001, test_loss: 1.5649, test_f1: 0.6129
 epoch: 90, train_loss: 0.3649, test_loss: 1.6070, test_f1: 0.6010
 epoch: 91, train_loss: 0.3959, test_loss: 1.5103, test_f1: 0.6244
 epoch: 92, train_loss: 0.3945, test_loss: 1.8278, test_f1: 0.6173
 epoch: 93, train_loss: 0.3669, test_loss: 1.7422, test_f1: 0.6045
 epoch: 94, train_loss: 0.3904, test_loss: 1.7647, test_f1: 0.5828
 epoch: 95, train_loss: 0.3683, test_loss: 1.5943, test_f1: 0.6357
 epoch: 96, train_loss: 0.4048, test_loss: 1.7617, test_f1: 0.6025
 epoch: 97, train_loss: 0.4058, test_loss: 1.6495, test_f1: 0.6027
 epoch: 98, train_loss: 0.3744, test_loss: 1.6505, test_f1: 0.5983
 epoch: 99, train_loss: 0.3785, test_loss: 1.5001, test_f1: 0.6118
##################ITERATION #8 ****************************************
 epoch: 0, train_loss: 1.3322, test_loss: 1.3277, test_f1: 0.2918
 epoch: 1, train_loss: 1.0696, test_loss: 1.1136, test_f1: 0.4937
 epoch: 2, train_loss: 1.0220, test_loss: 1.1346, test_f1: 0.4533
 epoch: 3, train_loss: 0.9970, test_loss: 1.1041, test_f1: 0.4342
 epoch: 4, train_loss: 0.9560, test_loss: 1.0641, test_f1: 0.5236
 epoch: 5, train_loss: 0.9544, test_loss: 1.0301, test_f1: 0.5826
 epoch: 6, train_loss: 0.9032, test_loss: 1.0537, test_f1: 0.5477
 epoch: 7, train_loss: 0.8733, test_loss: 1.0640, test_f1: 0.5277
 epoch: 8, train_loss: 0.8652, test_loss: 2.2478, test_f1: 0.5278
 epoch: 9, train_loss: 0.8294, test_loss: 1.6733, test_f1: 0.4952
 epoch: 10, train_loss: 0.8248, test_loss: 1.0257, test_f1: 0.5812
 epoch: 11, train_loss: 0.8410, test_loss: 1.0099, test_f1: 0.5681
 epoch: 12, train_loss: 0.8022, test_loss: 1.3961, test_f1: 0.5066
 epoch: 13, train_loss: 0.8089, test_loss: 1.1052, test_f1: 0.5059
 epoch: 14, train_loss: 0.7847, test_loss: 1.3305, test_f1: 0.4892
 epoch: 15, train_loss: 0.7690, test_loss: 1.0042, test_f1: 0.5684
 epoch: 16, train_loss: 0.7709, test_loss: 1.0004, test_f1: 0.5639
 epoch: 17, train_loss: 0.7302, test_loss: 1.1987, test_f1: 0.5733
 epoch: 18, train_loss: 0.7460, test_loss: 1.0636, test_f1: 0.5794
 epoch: 19, train_loss: 0.7133, test_loss: 1.0804, test_f1: 0.5424
 epoch: 20, train_loss: 0.7402, test_loss: 1.0967, test_f1: 0.5584
 epoch: 21, train_loss: 0.7319, test_loss: 1.0947, test_f1: 0.5295
 epoch: 22, train_loss: 0.7072, test_loss: 0.9823, test_f1: 0.6060
 epoch: 23, train_loss: 0.6766, test_loss: 1.0898, test_f1: 0.5212
 epoch: 24, train_loss: 0.6858, test_loss: 1.1035, test_f1: 0.5519
 epoch: 25, train_loss: 0.7139, test_loss: 1.0072, test_f1: 0.5764
 epoch: 26, train_loss: 0.6808, test_loss: 1.1237, test_f1: 0.5495
 epoch: 27, train_loss: 0.6831, test_loss: 1.0723, test_f1: 0.5315
 epoch: 28, train_loss: 0.6541, test_loss: 1.0934, test_f1: 0.5812
 epoch: 29, train_loss: 0.6621, test_loss: 1.1295, test_f1: 0.5613
 epoch: 30, train_loss: 0.6467, test_loss: 1.0990, test_f1: 0.5560
 epoch: 31, train_loss: 0.6381, test_loss: 1.1050, test_f1: 0.5578
 epoch: 32, train_loss: 0.6531, test_loss: 1.1405, test_f1: 0.5042
 epoch: 33, train_loss: 0.6540, test_loss: 1.0918, test_f1: 0.5310
 epoch: 34, train_loss: 0.6291, test_loss: 1.1225, test_f1: 0.5264
 epoch: 35, train_loss: 0.6258, test_loss: 1.2189, test_f1: 0.5285
 epoch: 36, train_loss: 0.6322, test_loss: 1.1491, test_f1: 0.5621
 epoch: 37, train_loss: 0.6025, test_loss: 1.0980, test_f1: 0.5785
 epoch: 38, train_loss: 0.6004, test_loss: 1.2238, test_f1: 0.5425
 epoch: 39, train_loss: 0.6052, test_loss: 1.1296, test_f1: 0.6060
 epoch: 40, train_loss: 0.5999, test_loss: 1.1316, test_f1: 0.5777
 epoch: 41, train_loss: 0.5986, test_loss: 1.2308, test_f1: 0.5600
 epoch: 42, train_loss: 0.5971, test_loss: 1.0832, test_f1: 0.6087
 epoch: 43, train_loss: 0.5704, test_loss: 1.1857, test_f1: 0.5802
 epoch: 44, train_loss: 0.5696, test_loss: 1.2369, test_f1: 0.5321
 epoch: 45, train_loss: 0.6055, test_loss: 1.1537, test_f1: 0.6119
 epoch: 46, train_loss: 0.5601, test_loss: 1.3171, test_f1: 0.5693
 epoch: 47, train_loss: 0.5690, test_loss: 1.2950, test_f1: 0.5441
 epoch: 48, train_loss: 0.5705, test_loss: 1.0833, test_f1: 0.6086
 epoch: 49, train_loss: 0.5501, test_loss: 1.2603, test_f1: 0.5221
 epoch: 50, train_loss: 0.5351, test_loss: 1.4032, test_f1: 0.5484
 epoch: 51, train_loss: 0.5317, test_loss: 1.1861, test_f1: 0.5992
 epoch: 52, train_loss: 0.4989, test_loss: 1.3021, test_f1: 0.5694
 epoch: 53, train_loss: 0.4969, test_loss: 1.2304, test_f1: 0.5860
 epoch: 54, train_loss: 0.5109, test_loss: 1.3454, test_f1: 0.5831
 epoch: 55, train_loss: 0.4826, test_loss: 1.3634, test_f1: 0.5614
 epoch: 56, train_loss: 0.5027, test_loss: 1.3302, test_f1: 0.5564
 epoch: 57, train_loss: 0.4767, test_loss: 1.4192, test_f1: 0.5151
 epoch: 58, train_loss: 0.5032, test_loss: 1.3843, test_f1: 0.5715
 epoch: 59, train_loss: 0.4859, test_loss: 1.5578, test_f1: 0.5665
 epoch: 60, train_loss: 0.4918, test_loss: 1.4726, test_f1: 0.5822
 epoch: 61, train_loss: 0.4853, test_loss: 1.5136, test_f1: 0.5421
 epoch: 62, train_loss: 0.4808, test_loss: 1.4501, test_f1: 0.5669
 epoch: 63, train_loss: 0.4808, test_loss: 1.6326, test_f1: 0.5282
 epoch: 64, train_loss: 0.5092, test_loss: 1.3243, test_f1: 0.5879
 epoch: 65, train_loss: 0.4739, test_loss: 1.5283, test_f1: 0.5707
 epoch: 66, train_loss: 0.4807, test_loss: 1.4568, test_f1: 0.5650
 epoch: 67, train_loss: 0.4729, test_loss: 1.4604, test_f1: 0.5605
 epoch: 68, train_loss: 0.4671, test_loss: 1.6587, test_f1: 0.5533
 epoch: 69, train_loss: 0.4533, test_loss: 1.3767, test_f1: 0.5998
 epoch: 70, train_loss: 0.4536, test_loss: 1.5140, test_f1: 0.5941
 epoch: 71, train_loss: 0.4539, test_loss: 1.6244, test_f1: 0.5502
 epoch: 72, train_loss: 0.4563, test_loss: 1.6650, test_f1: 0.5707
 epoch: 73, train_loss: 0.4535, test_loss: 1.6445, test_f1: 0.5706
 epoch: 74, train_loss: 0.4464, test_loss: 1.5170, test_f1: 0.6081
 epoch: 75, train_loss: 0.4440, test_loss: 1.5878, test_f1: 0.5669
 epoch: 76, train_loss: 0.4573, test_loss: 1.4444, test_f1: 0.6132
 epoch: 77, train_loss: 0.4368, test_loss: 1.5480, test_f1: 0.5817
 epoch: 78, train_loss: 0.4285, test_loss: 1.6298, test_f1: 0.5851
 epoch: 79, train_loss: 0.4416, test_loss: 1.7315, test_f1: 0.5349
 epoch: 80, train_loss: 0.4414, test_loss: 1.4932, test_f1: 0.5802
 epoch: 81, train_loss: 0.4442, test_loss: 1.6885, test_f1: 0.5678
 epoch: 82, train_loss: 0.4305, test_loss: 1.5103, test_f1: 0.6042
 epoch: 83, train_loss: 0.4326, test_loss: 1.7605, test_f1: 0.5268
 epoch: 84, train_loss: 0.4237, test_loss: 1.5440, test_f1: 0.6324
 epoch: 85, train_loss: 0.4078, test_loss: 1.7122, test_f1: 0.5949
 epoch: 86, train_loss: 0.4310, test_loss: 1.6000, test_f1: 0.5618
 epoch: 87, train_loss: 0.4145, test_loss: 1.8406, test_f1: 0.5610
 epoch: 88, train_loss: 0.4382, test_loss: 1.5699, test_f1: 0.5784
 epoch: 89, train_loss: 0.4288, test_loss: 1.6981, test_f1: 0.5840
 epoch: 90, train_loss: 0.4165, test_loss: 1.6210, test_f1: 0.5675
 epoch: 91, train_loss: 0.4291, test_loss: 1.5780, test_f1: 0.5839
 epoch: 92, train_loss: 0.3975, test_loss: 1.6208, test_f1: 0.5963
 epoch: 93, train_loss: 0.4067, test_loss: 1.7230, test_f1: 0.5715
 epoch: 94, train_loss: 0.4047, test_loss: 1.7704, test_f1: 0.5548
 epoch: 95, train_loss: 0.4111, test_loss: 1.7718, test_f1: 0.5444
 epoch: 96, train_loss: 0.4047, test_loss: 1.5639, test_f1: 0.5450
 epoch: 97, train_loss: 0.4177, test_loss: 1.5839, test_f1: 0.5943
 epoch: 98, train_loss: 0.4126, test_loss: 1.5277, test_f1: 0.5821
 epoch: 99, train_loss: 0.4212, test_loss: 1.6422, test_f1: 0.5647
##################ITERATION #9 ****************************************
 epoch: 0, train_loss: 1.6955, test_loss: 1.3107, test_f1: 0.3077
 epoch: 1, train_loss: 1.0723, test_loss: 1.1190, test_f1: 0.4661
 epoch: 2, train_loss: 1.0104, test_loss: 1.1275, test_f1: 0.4615
 epoch: 3, train_loss: 0.9711, test_loss: 1.0773, test_f1: 0.4707
 epoch: 4, train_loss: 0.9373, test_loss: 1.0819, test_f1: 0.4951
 epoch: 5, train_loss: 0.9021, test_loss: 1.0138, test_f1: 0.4752
 epoch: 6, train_loss: 0.8633, test_loss: 1.0471, test_f1: 0.5213
 epoch: 7, train_loss: 0.8612, test_loss: 1.0208, test_f1: 0.5313
 epoch: 8, train_loss: 0.8468, test_loss: 0.9804, test_f1: 0.5876
 epoch: 9, train_loss: 0.8447, test_loss: 0.9920, test_f1: 0.5377
 epoch: 10, train_loss: 0.8257, test_loss: 1.0826, test_f1: 0.5263
 epoch: 11, train_loss: 0.8187, test_loss: 0.9790, test_f1: 0.5409
 epoch: 12, train_loss: 0.8044, test_loss: 1.0262, test_f1: 0.5614
 epoch: 13, train_loss: 0.7824, test_loss: 1.0236, test_f1: 0.5595
 epoch: 14, train_loss: 0.7797, test_loss: 0.9654, test_f1: 0.5702
 epoch: 15, train_loss: 0.7552, test_loss: 1.0081, test_f1: 0.5468
 epoch: 16, train_loss: 0.7576, test_loss: 1.0788, test_f1: 0.4680
 epoch: 17, train_loss: 0.7569, test_loss: 0.9813, test_f1: 0.5751
 epoch: 18, train_loss: 0.7426, test_loss: 1.0230, test_f1: 0.5765
 epoch: 19, train_loss: 0.7224, test_loss: 0.9665, test_f1: 0.5952
 epoch: 20, train_loss: 0.7125, test_loss: 1.0920, test_f1: 0.5114
 epoch: 21, train_loss: 0.7221, test_loss: 1.0500, test_f1: 0.5629
 epoch: 22, train_loss: 0.7249, test_loss: 1.0806, test_f1: 0.6367
 epoch: 23, train_loss: 0.7199, test_loss: 1.0777, test_f1: 0.5545
 epoch: 24, train_loss: 0.6729, test_loss: 1.0233, test_f1: 0.6383
 epoch: 25, train_loss: 0.6881, test_loss: 1.0443, test_f1: 0.5981
 epoch: 26, train_loss: 0.6841, test_loss: 0.9932, test_f1: 0.6190
 epoch: 27, train_loss: 0.6651, test_loss: 0.9842, test_f1: 0.6216
 epoch: 28, train_loss: 0.6666, test_loss: 1.0512, test_f1: 0.6008
 epoch: 29, train_loss: 0.6672, test_loss: 1.0729, test_f1: 0.5829
 epoch: 30, train_loss: 0.6543, test_loss: 1.0467, test_f1: 0.6035
 epoch: 31, train_loss: 0.6517, test_loss: 1.1386, test_f1: 0.5879
 epoch: 32, train_loss: 0.6466, test_loss: 1.0386, test_f1: 0.6151
 epoch: 33, train_loss: 0.6318, test_loss: 1.0352, test_f1: 0.6677
 epoch: 34, train_loss: 0.6397, test_loss: 1.0794, test_f1: 0.5861
 epoch: 35, train_loss: 0.6277, test_loss: 1.0113, test_f1: 0.6129
 epoch: 36, train_loss: 0.6103, test_loss: 1.0961, test_f1: 0.6364
 epoch: 37, train_loss: 0.6133, test_loss: 1.0867, test_f1: 0.5891
 epoch: 38, train_loss: 0.5812, test_loss: 1.0274, test_f1: 0.6372
 epoch: 39, train_loss: 0.5846, test_loss: 1.0537, test_f1: 0.6035
 epoch: 40, train_loss: 0.5995, test_loss: 1.2797, test_f1: 0.5760
 epoch: 41, train_loss: 0.6232, test_loss: 1.1522, test_f1: 0.6104
 epoch: 42, train_loss: 0.5845, test_loss: 1.1281, test_f1: 0.5936
 epoch: 43, train_loss: 0.5899, test_loss: 1.2155, test_f1: 0.6159
 epoch: 44, train_loss: 0.5580, test_loss: 1.1615, test_f1: 0.6026
 epoch: 45, train_loss: 0.5614, test_loss: 1.1865, test_f1: 0.6054
 epoch: 46, train_loss: 0.5664, test_loss: 1.1093, test_f1: 0.6264
 epoch: 47, train_loss: 0.5577, test_loss: 1.1818, test_f1: 0.5946
 epoch: 48, train_loss: 0.5623, test_loss: 1.0419, test_f1: 0.6501
 epoch: 49, train_loss: 0.5691, test_loss: 1.2160, test_f1: 0.5778
 epoch: 50, train_loss: 0.5637, test_loss: 1.2069, test_f1: 0.6005
 epoch: 51, train_loss: 0.5213, test_loss: 1.1337, test_f1: 0.6101
 epoch: 52, train_loss: 0.5189, test_loss: 1.0818, test_f1: 0.6217
 epoch: 53, train_loss: 0.4999, test_loss: 1.2533, test_f1: 0.5899
 epoch: 54, train_loss: 0.5313, test_loss: 1.1508, test_f1: 0.6178
 epoch: 55, train_loss: 0.4898, test_loss: 1.2946, test_f1: 0.6000
 epoch: 56, train_loss: 0.4886, test_loss: 1.1541, test_f1: 0.6004
 epoch: 57, train_loss: 0.5079, test_loss: 1.2449, test_f1: 0.5949
 epoch: 58, train_loss: 0.4759, test_loss: 1.3039, test_f1: 0.6241
 epoch: 59, train_loss: 0.4756, test_loss: 1.2001, test_f1: 0.6097
 epoch: 60, train_loss: 0.4819, test_loss: 1.3229, test_f1: 0.5893
 epoch: 61, train_loss: 0.4840, test_loss: 1.2916, test_f1: 0.6074
 epoch: 62, train_loss: 0.4896, test_loss: 1.4391, test_f1: 0.5869
 epoch: 63, train_loss: 0.4817, test_loss: 1.2900, test_f1: 0.6235
 epoch: 64, train_loss: 0.4838, test_loss: 1.3049, test_f1: 0.5896
 epoch: 65, train_loss: 0.4446, test_loss: 1.4122, test_f1: 0.5836
 epoch: 66, train_loss: 0.4832, test_loss: 1.3137, test_f1: 0.6469
 epoch: 67, train_loss: 0.4772, test_loss: 1.2752, test_f1: 0.6342
 epoch: 68, train_loss: 0.4449, test_loss: 1.3489, test_f1: 0.5851
 epoch: 69, train_loss: 0.4527, test_loss: 1.2984, test_f1: 0.6203
 epoch: 70, train_loss: 0.4518, test_loss: 1.3697, test_f1: 0.5667
 epoch: 71, train_loss: 0.4833, test_loss: 1.3337, test_f1: 0.5980
 epoch: 72, train_loss: 0.4253, test_loss: 1.4526, test_f1: 0.5992
 epoch: 73, train_loss: 0.4542, test_loss: 1.3202, test_f1: 0.6019
 epoch: 74, train_loss: 0.4694, test_loss: 1.3396, test_f1: 0.6442
 epoch: 75, train_loss: 0.4683, test_loss: 1.4479, test_f1: 0.5786
 epoch: 76, train_loss: 0.4327, test_loss: 1.5374, test_f1: 0.5969
 epoch: 77, train_loss: 0.4401, test_loss: 1.3955, test_f1: 0.6230
 epoch: 78, train_loss: 0.4187, test_loss: 1.3379, test_f1: 0.5933
 epoch: 79, train_loss: 0.4286, test_loss: 1.5047, test_f1: 0.6121
 epoch: 80, train_loss: 0.4355, test_loss: 1.3497, test_f1: 0.6061
 epoch: 81, train_loss: 0.4269, test_loss: 1.5326, test_f1: 0.6173
 epoch: 82, train_loss: 0.4348, test_loss: 1.4545, test_f1: 0.5985
 epoch: 83, train_loss: 0.4312, test_loss: 1.3313, test_f1: 0.6445
 epoch: 84, train_loss: 0.4485, test_loss: 1.5958, test_f1: 0.5880
 epoch: 85, train_loss: 0.4218, test_loss: 1.5696, test_f1: 0.6055
 epoch: 86, train_loss: 0.4161, test_loss: 1.4465, test_f1: 0.6360
 epoch: 87, train_loss: 0.4086, test_loss: 1.3616, test_f1: 0.6190
 epoch: 88, train_loss: 0.3928, test_loss: 1.5978, test_f1: 0.6259
 epoch: 89, train_loss: 0.4132, test_loss: 1.5533, test_f1: 0.6087
 epoch: 90, train_loss: 0.4237, test_loss: 1.4382, test_f1: 0.6319
 epoch: 91, train_loss: 0.4333, test_loss: 1.7871, test_f1: 0.5680
 epoch: 92, train_loss: 0.4281, test_loss: 1.4720, test_f1: 0.6104
 epoch: 93, train_loss: 0.3828, test_loss: 1.5436, test_f1: 0.5815
 epoch: 94, train_loss: 0.4072, test_loss: 1.5381, test_f1: 0.5929
 epoch: 95, train_loss: 0.3796, test_loss: 1.5089, test_f1: 0.6038
 epoch: 96, train_loss: 0.3975, test_loss: 1.5350, test_f1: 0.6341
 epoch: 97, train_loss: 0.4188, test_loss: 1.6188, test_f1: 0.6283
 epoch: 98, train_loss: 0.3707, test_loss: 1.5620, test_f1: 0.6440
 epoch: 99, train_loss: 0.4045, test_loss: 1.6420, test_f1: 0.5864

Training completed in 816.25 seconds
Best F1: 0.6864 at epoch 69
Mean F1 across iterations: 0.6553  0.0159
========================FINAL RESULTS================================
FEGIN weighted F1: 0.6864  0.0159
python main.py --data ltspice_demos --representation component_pin --model FEGIN --layers 2 --hiddens 32 --batch_size 32 --lr 0.001 --emb_size 512 --epochs 100 --save_appendix component_pin_L2_H32_BS32_LR0.001_E512 --no_val
-----



STDERR:
  File "main.py", line 370, in <module>
    main()
  File "main.py", line 254, in main
    dataset = dataset_class(
  File "/home/philip/projects/ltspice_examples_code_repo/Circuit-Completion-Using-GNNs/component_classification_with_link_prediction_head/evaluation/FEGIN/kernel/circuit_datasets.py", line 15, in __init__
    self.data, self.slices = torch.load(self.processed_paths[0])
  File "/home/philip/.local/lib/python3.8/site-packages/torch/serialization.py", line 1040, in load
    warnings.warn(
  File "/usr/lib/python3.8/warnings.py", line 109, in _showwarnmsg
    sw(msg.message, msg.category, msg.filename, msg.lineno,
  File "main.py", line 47, in warn_with_traceback
    traceback.print_stack(file=log)
/home/philip/projects/ltspice_examples_code_repo/Circuit-Completion-Using-GNNs/component_classification_with_link_prediction_head/evaluation/FEGIN/kernel/circuit_datasets.py:15: FutureWarning: You are using `torch.load` with `weights_only=False` (the current default value), which uses the default pickle module implicitly. It is possible to construct malicious pickle data which will execute arbitrary code during unpickling (See https://github.com/pytorch/pytorch/blob/main/SECURITY.md#untrusted-models for more details). In a future release, the default value for `weights_only` will be flipped to `True`. This limits the functions that could be executed during unpickling. Arbitrary objects will no longer be allowed to be loaded via this mode unless they are explicitly allowlisted by the user via `torch.serialization.add_safe_globals`. We recommend you start setting `weights_only=True` for any use case where you don't have full control of the loaded file. Please open an issue on GitHub for any issues related to this experimental feature.
  self.data, self.slices = torch.load(self.processed_paths[0])
