STDOUT:
Results will be saved in /home/philip/projects/ltspice_examples_code_repo/Circuit-Completion-Using-GNNs/component_classification_with_link_prediction_head/evaluation/FEGIN/results/model_FEGIN_dataset_ltspice_demos
Command line input: python main.py --data ltspice_demos --representation component_pin_net --model FEGIN --layers 3 --hiddens 32 --batch_size 256 --lr 0.1 --emb_size 128 --epochs 100 --save_appendix component_pin_net_L3_H32_BS256_LR0.1_E128 --no_val
 is saved.
-----
ltspice_demos - FEGIN
Using 3 layers, 32 hidden units, h = 2
Loading component_pin_net representation dataset
ENTERED
Training FEGIN on component_pin_net representation
Train: 1565, Test: 383
##################ITERATION #0 ****************************************
 epoch: 0, train_loss: 1.7305, test_loss: 1.3065, test_f1: 0.2281
 epoch: 1, train_loss: 1.2125, test_loss: 1.3040, test_f1: 0.2281
 epoch: 2, train_loss: 1.1224, test_loss: 1.3613, test_f1: 0.2281
 epoch: 3, train_loss: 1.0799, test_loss: 1.4374, test_f1: 0.1368
 epoch: 4, train_loss: 1.0711, test_loss: 1.3241, test_f1: 0.2586
 epoch: 5, train_loss: 1.0482, test_loss: 1.3794, test_f1: 0.2390
 epoch: 6, train_loss: 1.1045, test_loss: 1.1781, test_f1: 0.3205
 epoch: 7, train_loss: 1.0803, test_loss: 1.1802, test_f1: 0.3146
 epoch: 8, train_loss: 1.0864, test_loss: 1.1449, test_f1: 0.3317
 epoch: 9, train_loss: 1.1171, test_loss: 1.3648, test_f1: 0.2390
 epoch: 10, train_loss: 1.0813, test_loss: 1.3489, test_f1: 0.2281
 epoch: 11, train_loss: 1.0880, test_loss: 1.1545, test_f1: 0.3262
 epoch: 12, train_loss: 1.0729, test_loss: 1.1446, test_f1: 0.3290
 epoch: 13, train_loss: 1.0787, test_loss: 1.1515, test_f1: 0.3290
 epoch: 14, train_loss: 1.0831, test_loss: 1.1592, test_f1: 0.3290
 epoch: 15, train_loss: 1.0691, test_loss: 1.1525, test_f1: 0.3290
 epoch: 16, train_loss: 1.0808, test_loss: 1.1569, test_f1: 0.3290
 epoch: 17, train_loss: 1.0804, test_loss: 1.1498, test_f1: 0.3290
 epoch: 18, train_loss: 1.0738, test_loss: 1.1445, test_f1: 0.3344
 epoch: 19, train_loss: 1.0632, test_loss: 1.1501, test_f1: 0.3290
 epoch: 20, train_loss: 1.0610, test_loss: 1.1577, test_f1: 0.3290
 epoch: 21, train_loss: 1.0595, test_loss: 1.1297, test_f1: 0.3395
 epoch: 22, train_loss: 1.0621, test_loss: 1.1233, test_f1: 0.3395
 epoch: 23, train_loss: 1.0584, test_loss: 1.1429, test_f1: 0.3317
 epoch: 24, train_loss: 1.0578, test_loss: 1.1459, test_f1: 0.3344
 epoch: 25, train_loss: 1.0609, test_loss: 1.1521, test_f1: 0.3290
 epoch: 26, train_loss: 1.0663, test_loss: 1.1677, test_f1: 0.3234
 epoch: 27, train_loss: 1.0675, test_loss: 1.1552, test_f1: 0.3290
 epoch: 28, train_loss: 1.0534, test_loss: 1.1386, test_f1: 0.3344
 epoch: 29, train_loss: 1.1171, test_loss: 1.3588, test_f1: 0.2390
 epoch: 30, train_loss: 1.1219, test_loss: 1.1697, test_f1: 0.3205
 epoch: 31, train_loss: 1.0748, test_loss: 1.1490, test_f1: 0.3290
 epoch: 32, train_loss: 1.0684, test_loss: 1.1553, test_f1: 0.2334
 epoch: 33, train_loss: 1.0715, test_loss: 1.1566, test_f1: 0.3262
 epoch: 34, train_loss: 1.1505, test_loss: 1.3170, test_f1: 0.2390
 epoch: 35, train_loss: 1.1607, test_loss: 1.2802, test_f1: 0.2491
 epoch: 36, train_loss: 1.0931, test_loss: 1.1925, test_f1: 0.3115
 epoch: 37, train_loss: 1.0694, test_loss: 1.1705, test_f1: 0.3262
 epoch: 38, train_loss: 1.0693, test_loss: 1.1593, test_f1: 0.3290
 epoch: 39, train_loss: 1.0772, test_loss: 1.1546, test_f1: 0.3290
 epoch: 40, train_loss: 1.0799, test_loss: 1.2040, test_f1: 0.3083
 epoch: 41, train_loss: 1.1194, test_loss: 1.1479, test_f1: 0.3290
 epoch: 42, train_loss: 1.0724, test_loss: 1.1504, test_f1: 0.3290
 epoch: 43, train_loss: 1.0703, test_loss: 1.1332, test_f1: 0.3344
 epoch: 44, train_loss: 1.0624, test_loss: 1.1273, test_f1: 0.3370
 epoch: 45, train_loss: 1.0631, test_loss: 1.1313, test_f1: 0.3370
 epoch: 46, train_loss: 1.1028, test_loss: 1.1509, test_f1: 0.3290
 epoch: 47, train_loss: 1.0852, test_loss: 1.1490, test_f1: 0.3290
 epoch: 48, train_loss: 1.0926, test_loss: 1.1486, test_f1: 0.3290
 epoch: 49, train_loss: 1.0830, test_loss: 1.1504, test_f1: 0.3290
 epoch: 50, train_loss: 1.0733, test_loss: 1.1516, test_f1: 0.3290
 epoch: 51, train_loss: 1.0711, test_loss: 1.1539, test_f1: 0.3290
 epoch: 52, train_loss: 1.0715, test_loss: 1.1534, test_f1: 0.3290
 epoch: 53, train_loss: 1.0749, test_loss: 1.1528, test_f1: 0.3290
 epoch: 54, train_loss: 1.0711, test_loss: 1.1510, test_f1: 0.3290
 epoch: 55, train_loss: 1.0709, test_loss: 1.1498, test_f1: 0.3290
 epoch: 56, train_loss: 1.0713, test_loss: 1.1484, test_f1: 0.3290
 epoch: 57, train_loss: 1.0714, test_loss: 1.1482, test_f1: 0.3290
 epoch: 58, train_loss: 1.0713, test_loss: 1.1483, test_f1: 0.3290
 epoch: 59, train_loss: 1.0713, test_loss: 1.1475, test_f1: 0.3290
 epoch: 60, train_loss: 1.0709, test_loss: 1.1520, test_f1: 0.3290
 epoch: 61, train_loss: 1.0709, test_loss: 1.1531, test_f1: 0.3290
 epoch: 62, train_loss: 1.0714, test_loss: 1.1504, test_f1: 0.3290
 epoch: 63, train_loss: 1.0714, test_loss: 1.1501, test_f1: 0.3290
 epoch: 64, train_loss: 1.0712, test_loss: 1.1506, test_f1: 0.3290
 epoch: 65, train_loss: 1.0713, test_loss: 1.1482, test_f1: 0.3290
 epoch: 66, train_loss: 1.0710, test_loss: 1.1484, test_f1: 0.3290
 epoch: 67, train_loss: 1.0716, test_loss: 1.1487, test_f1: 0.3290
 epoch: 68, train_loss: 1.0713, test_loss: 1.1457, test_f1: 0.3290
 epoch: 69, train_loss: 1.0713, test_loss: 1.1443, test_f1: 0.3290
 epoch: 70, train_loss: 1.0714, test_loss: 1.1467, test_f1: 0.3290
 epoch: 71, train_loss: 1.0708, test_loss: 1.1500, test_f1: 0.3290
 epoch: 72, train_loss: 1.0708, test_loss: 1.1527, test_f1: 0.3290
 epoch: 73, train_loss: 1.0711, test_loss: 1.1508, test_f1: 0.3290
 epoch: 74, train_loss: 1.0708, test_loss: 1.1487, test_f1: 0.3290
 epoch: 75, train_loss: 1.0711, test_loss: 1.1508, test_f1: 0.3290
 epoch: 76, train_loss: 1.0732, test_loss: 1.1546, test_f1: 0.3290
 epoch: 77, train_loss: 1.0722, test_loss: 1.1561, test_f1: 0.3290
 epoch: 78, train_loss: 1.0713, test_loss: 1.1559, test_f1: 0.3290
 epoch: 79, train_loss: 1.0717, test_loss: 1.1509, test_f1: 0.3290
 epoch: 80, train_loss: 1.0710, test_loss: 1.1462, test_f1: 0.3290
 epoch: 81, train_loss: 1.0711, test_loss: 1.1472, test_f1: 0.3290
 epoch: 82, train_loss: 1.0718, test_loss: 1.1503, test_f1: 0.3290
 epoch: 83, train_loss: 1.0713, test_loss: 1.1519, test_f1: 0.3290
 epoch: 84, train_loss: 1.0722, test_loss: 1.1552, test_f1: 0.3290
 epoch: 85, train_loss: 1.0717, test_loss: 1.1549, test_f1: 0.3290
 epoch: 86, train_loss: 1.0712, test_loss: 1.1524, test_f1: 0.3290
 epoch: 87, train_loss: 1.0712, test_loss: 1.1497, test_f1: 0.3290
 epoch: 88, train_loss: 1.0713, test_loss: 1.1498, test_f1: 0.3290
 epoch: 89, train_loss: 1.0723, test_loss: 1.1475, test_f1: 0.3290
 epoch: 90, train_loss: 1.0720, test_loss: 1.1489, test_f1: 0.3290
 epoch: 91, train_loss: 1.0717, test_loss: 1.1524, test_f1: 0.3290
 epoch: 92, train_loss: 1.0715, test_loss: 1.1547, test_f1: 0.3290
 epoch: 93, train_loss: 1.0711, test_loss: 1.1524, test_f1: 0.3290
 epoch: 94, train_loss: 1.0709, test_loss: 1.1503, test_f1: 0.3290
 epoch: 95, train_loss: 1.0708, test_loss: 1.1515, test_f1: 0.3290
 epoch: 96, train_loss: 1.0713, test_loss: 1.1497, test_f1: 0.3290
 epoch: 97, train_loss: 1.0708, test_loss: 1.1465, test_f1: 0.3290
 epoch: 98, train_loss: 1.0713, test_loss: 1.1491, test_f1: 0.3290
 epoch: 99, train_loss: 1.0709, test_loss: 1.1504, test_f1: 0.3290
##################ITERATION #1 ****************************************
 epoch: 0, train_loss: 1.7043, test_loss: 91.7025, test_f1: 0.0301
 epoch: 1, train_loss: 1.1662, test_loss: 10.1322, test_f1: 0.1361
 epoch: 2, train_loss: 1.0837, test_loss: 1.1456, test_f1: 0.3249
 epoch: 3, train_loss: 1.0637, test_loss: 1.1351, test_f1: 0.3370
 epoch: 4, train_loss: 1.0503, test_loss: 1.1704, test_f1: 0.3205
 epoch: 5, train_loss: 1.0454, test_loss: 1.1121, test_f1: 0.3420
 epoch: 6, train_loss: 1.0352, test_loss: 1.0989, test_f1: 0.3444
 epoch: 7, train_loss: 1.0452, test_loss: 1.1297, test_f1: 0.3344
 epoch: 8, train_loss: 1.0533, test_loss: 1.4806, test_f1: 0.2966
 epoch: 9, train_loss: 1.0419, test_loss: 1.1058, test_f1: 0.3462
 epoch: 10, train_loss: 1.0294, test_loss: 1.1307, test_f1: 0.3370
 epoch: 11, train_loss: 1.0330, test_loss: 1.1031, test_f1: 0.3444
 epoch: 12, train_loss: 1.0322, test_loss: 1.0924, test_f1: 0.3444
 epoch: 13, train_loss: 1.0363, test_loss: 1.1011, test_f1: 0.3444
 epoch: 14, train_loss: 1.0368, test_loss: 1.0980, test_f1: 0.3461
 epoch: 15, train_loss: 1.0192, test_loss: 1.0967, test_f1: 0.3454
 epoch: 16, train_loss: 1.0128, test_loss: 1.1182, test_f1: 0.3395
 epoch: 17, train_loss: 1.0171, test_loss: 1.2156, test_f1: 0.3115
 epoch: 18, train_loss: 1.0349, test_loss: 1.1338, test_f1: 0.3317
 epoch: 19, train_loss: 1.0147, test_loss: 1.1663, test_f1: 0.3179
 epoch: 20, train_loss: 1.0152, test_loss: 1.5896, test_f1: 0.2878
 epoch: 21, train_loss: 1.0295, test_loss: 1.4587, test_f1: 0.2825
 epoch: 22, train_loss: 1.0315, test_loss: 3.2796, test_f1: 0.2262
 epoch: 23, train_loss: 1.0452, test_loss: 1.2231, test_f1: 0.3190
 epoch: 24, train_loss: 1.0456, test_loss: 1.1592, test_f1: 0.3290
 epoch: 25, train_loss: 1.0414, test_loss: 1.1627, test_f1: 0.3290
 epoch: 26, train_loss: 1.0339, test_loss: 1.1502, test_f1: 0.3344
 epoch: 27, train_loss: 1.0393, test_loss: 1.1396, test_f1: 0.3370
 epoch: 28, train_loss: 1.0306, test_loss: 1.1429, test_f1: 0.3317
 epoch: 29, train_loss: 1.0211, test_loss: 1.1877, test_f1: 0.3234
 epoch: 30, train_loss: 1.0447, test_loss: 1.3318, test_f1: 0.2631
 epoch: 31, train_loss: 1.0509, test_loss: 13.9127, test_f1: 0.2415
 epoch: 32, train_loss: 1.0448, test_loss: 1.1443, test_f1: 0.3317
 epoch: 33, train_loss: 1.0225, test_loss: 1.1787, test_f1: 0.3234
 epoch: 34, train_loss: 1.0239, test_loss: 1.1233, test_f1: 0.3370
 epoch: 35, train_loss: 1.0343, test_loss: 1.1821, test_f1: 0.3602
 epoch: 36, train_loss: 1.0204, test_loss: 1.1181, test_f1: 0.3460
 epoch: 37, train_loss: 1.0067, test_loss: 1.0999, test_f1: 0.3454
 epoch: 38, train_loss: 1.0322, test_loss: 1.1212, test_f1: 0.3388
 epoch: 39, train_loss: 1.0367, test_loss: 1.1339, test_f1: 0.3388
 epoch: 40, train_loss: 1.0357, test_loss: 1.1738, test_f1: 0.3262
 epoch: 41, train_loss: 1.0491, test_loss: 1.1482, test_f1: 0.3317
 epoch: 42, train_loss: 1.0267, test_loss: 1.1876, test_f1: 0.3089
 epoch: 43, train_loss: 1.0151, test_loss: 1.1798, test_f1: 0.3087
 epoch: 44, train_loss: 1.0316, test_loss: 1.1484, test_f1: 0.3317
 epoch: 45, train_loss: 1.0368, test_loss: 1.1051, test_f1: 0.3421
 epoch: 46, train_loss: 1.0079, test_loss: 2.0110, test_f1: 0.2346
 epoch: 47, train_loss: 1.0206, test_loss: 1.0908, test_f1: 0.3538
 epoch: 48, train_loss: 1.0140, test_loss: 1.1283, test_f1: 0.3549
 epoch: 49, train_loss: 1.0117, test_loss: 1.1775, test_f1: 0.3126
 epoch: 50, train_loss: 1.0038, test_loss: 1.1045, test_f1: 0.3420
 epoch: 51, train_loss: 0.9912, test_loss: 1.0999, test_f1: 0.3420
 epoch: 52, train_loss: 0.9921, test_loss: 1.0854, test_f1: 0.3522
 epoch: 53, train_loss: 0.9924, test_loss: 1.1630, test_f1: 0.3191
 epoch: 54, train_loss: 1.0163, test_loss: 1.1655, test_f1: 0.3262
 epoch: 55, train_loss: 1.0063, test_loss: 1.2550, test_f1: 0.2949
 epoch: 56, train_loss: 1.0043, test_loss: 1.1331, test_f1: 0.3326
 epoch: 57, train_loss: 1.0012, test_loss: 1.1516, test_f1: 0.3109
 epoch: 58, train_loss: 1.0046, test_loss: 1.1945, test_f1: 0.3064
 epoch: 59, train_loss: 1.0046, test_loss: 1.2818, test_f1: 0.3040
 epoch: 60, train_loss: 0.9963, test_loss: 1.1565, test_f1: 0.3101
 epoch: 61, train_loss: 0.9985, test_loss: 1.2250, test_f1: 0.3045
 epoch: 62, train_loss: 0.9921, test_loss: 1.2346, test_f1: 0.3004
 epoch: 63, train_loss: 0.9909, test_loss: 1.3476, test_f1: 0.2893
 epoch: 64, train_loss: 0.9899, test_loss: 1.1514, test_f1: 0.3160
 epoch: 65, train_loss: 0.9923, test_loss: 1.0891, test_f1: 0.3468
 epoch: 66, train_loss: 0.9906, test_loss: 1.0995, test_f1: 0.3445
 epoch: 67, train_loss: 0.9936, test_loss: 1.1313, test_f1: 0.3284
 epoch: 68, train_loss: 0.9917, test_loss: 1.3250, test_f1: 0.2931
 epoch: 69, train_loss: 0.9871, test_loss: 1.1805, test_f1: 0.3184
 epoch: 70, train_loss: 0.9867, test_loss: 1.1410, test_f1: 0.3250
 epoch: 71, train_loss: 0.9869, test_loss: 1.1096, test_f1: 0.3438
 epoch: 72, train_loss: 1.0016, test_loss: 1.1254, test_f1: 0.3370
 epoch: 73, train_loss: 0.9938, test_loss: 1.1538, test_f1: 0.3290
 epoch: 74, train_loss: 0.9974, test_loss: 1.0770, test_f1: 0.3507
 epoch: 75, train_loss: 0.9899, test_loss: 1.0934, test_f1: 0.3529
 epoch: 76, train_loss: 0.9888, test_loss: 1.1417, test_f1: 0.3270
 epoch: 77, train_loss: 0.9894, test_loss: 1.7836, test_f1: 0.2733
 epoch: 78, train_loss: 0.9923, test_loss: 2.1209, test_f1: 0.2777
 epoch: 79, train_loss: 0.9868, test_loss: 1.6636, test_f1: 0.2948
 epoch: 80, train_loss: 0.9881, test_loss: 1.1833, test_f1: 0.3157
 epoch: 81, train_loss: 0.9838, test_loss: 1.0851, test_f1: 0.3514
 epoch: 82, train_loss: 0.9953, test_loss: 1.1423, test_f1: 0.3370
 epoch: 83, train_loss: 1.1002, test_loss: 1.2093, test_f1: 0.3195
 epoch: 84, train_loss: 1.0992, test_loss: 1.1664, test_f1: 0.3304
 epoch: 85, train_loss: 1.0832, test_loss: 1.1549, test_f1: 0.3290
 epoch: 86, train_loss: 1.0634, test_loss: 1.1325, test_f1: 0.3395
 epoch: 87, train_loss: 1.0346, test_loss: 1.1201, test_f1: 0.3388
 epoch: 88, train_loss: 1.0292, test_loss: 1.1473, test_f1: 0.3317
 epoch: 89, train_loss: 1.0268, test_loss: 1.1390, test_f1: 0.3344
 epoch: 90, train_loss: 1.0235, test_loss: 1.1344, test_f1: 0.3395
 epoch: 91, train_loss: 1.0206, test_loss: 1.1223, test_f1: 0.3395
 epoch: 92, train_loss: 1.0141, test_loss: 1.1427, test_f1: 0.3344
 epoch: 93, train_loss: 1.0149, test_loss: 1.1367, test_f1: 0.3331
 epoch: 94, train_loss: 1.0147, test_loss: 1.1207, test_f1: 0.3469
 epoch: 95, train_loss: 1.0138, test_loss: 1.1200, test_f1: 0.3391
 epoch: 96, train_loss: 1.0111, test_loss: 1.2978, test_f1: 0.3001
 epoch: 97, train_loss: 1.0005, test_loss: 1.1679, test_f1: 0.3156
 epoch: 98, train_loss: 1.0061, test_loss: 1.0908, test_f1: 0.3477
 epoch: 99, train_loss: 0.9996, test_loss: 1.1138, test_f1: 0.3420
##################ITERATION #2 ****************************************
 epoch: 0, train_loss: 1.4016, test_loss: 5.6875, test_f1: 0.2281
 epoch: 1, train_loss: 1.3157, test_loss: 1.6885, test_f1: 0.2281
 epoch: 2, train_loss: 1.2815, test_loss: 1.3266, test_f1: 0.2302
 epoch: 3, train_loss: 1.1950, test_loss: 1.2691, test_f1: 0.3100
 epoch: 4, train_loss: 1.1085, test_loss: 1.3300, test_f1: 0.3163
 epoch: 5, train_loss: 1.0767, test_loss: 2.5018, test_f1: 0.2658
 epoch: 6, train_loss: 1.0741, test_loss: 1.4164, test_f1: 0.2840
 epoch: 7, train_loss: 1.0491, test_loss: 1.2520, test_f1: 0.3021
 epoch: 8, train_loss: 1.0518, test_loss: 1.1192, test_f1: 0.3395
 epoch: 9, train_loss: 1.0415, test_loss: 1.1322, test_f1: 0.3319
 epoch: 10, train_loss: 1.1142, test_loss: 1.3021, test_f1: 0.2718
 epoch: 11, train_loss: 1.1016, test_loss: 1.1283, test_f1: 0.3317
 epoch: 12, train_loss: 1.0592, test_loss: 1.8750, test_f1: 0.2409
 epoch: 13, train_loss: 1.0440, test_loss: 2.2277, test_f1: 0.2363
 epoch: 14, train_loss: 1.0392, test_loss: 1.1210, test_f1: 0.3369
 epoch: 15, train_loss: 1.0528, test_loss: 1.1405, test_f1: 0.3344
 epoch: 16, train_loss: 1.0353, test_loss: 1.1250, test_f1: 0.3395
 epoch: 17, train_loss: 1.0219, test_loss: 1.1549, test_f1: 0.3317
 epoch: 18, train_loss: 1.0251, test_loss: 1.1636, test_f1: 0.3262
 epoch: 19, train_loss: 1.0170, test_loss: 1.1925, test_f1: 0.3176
 epoch: 20, train_loss: 1.0237, test_loss: 1.1752, test_f1: 0.3176
 epoch: 21, train_loss: 1.0220, test_loss: 1.1354, test_f1: 0.3344
 epoch: 22, train_loss: 1.0242, test_loss: 1.1251, test_f1: 0.3345
 epoch: 23, train_loss: 1.0173, test_loss: 1.3610, test_f1: 0.2950
 epoch: 24, train_loss: 1.0179, test_loss: 1.1994, test_f1: 0.3248
 epoch: 25, train_loss: 1.0488, test_loss: 2.4465, test_f1: 0.2344
 epoch: 26, train_loss: 1.0190, test_loss: 1.0988, test_f1: 0.3461
 epoch: 27, train_loss: 1.0231, test_loss: 1.1629, test_f1: 0.3344
 epoch: 28, train_loss: 1.0141, test_loss: 1.1410, test_f1: 0.3344
 epoch: 29, train_loss: 1.0221, test_loss: 1.3650, test_f1: 0.2491
 epoch: 30, train_loss: 1.0191, test_loss: 1.2273, test_f1: 0.3018
 epoch: 31, train_loss: 1.0024, test_loss: 1.1285, test_f1: 0.4359
 epoch: 32, train_loss: 0.9993, test_loss: 1.1633, test_f1: 0.3630
 epoch: 33, train_loss: 0.9962, test_loss: 1.1982, test_f1: 0.3253
 epoch: 34, train_loss: 1.0151, test_loss: 1.1174, test_f1: 0.3372
 epoch: 35, train_loss: 1.0407, test_loss: 11.1716, test_f1: 0.1653
 epoch: 36, train_loss: 1.0323, test_loss: 8.9698, test_f1: 0.2244
 epoch: 37, train_loss: 1.0474, test_loss: 1.1769, test_f1: 0.3470
 epoch: 38, train_loss: 1.0863, test_loss: 1.0763, test_f1: 0.3787
 epoch: 39, train_loss: 1.0751, test_loss: 1.1033, test_f1: 0.3553
 epoch: 40, train_loss: 1.0469, test_loss: 1.3242, test_f1: 0.2828
 epoch: 41, train_loss: 1.0275, test_loss: 1.1183, test_f1: 0.3395
 epoch: 42, train_loss: 1.0248, test_loss: 1.1525, test_f1: 0.3344
 epoch: 43, train_loss: 1.0258, test_loss: 1.1722, test_f1: 0.3290
 epoch: 44, train_loss: 1.0215, test_loss: 1.1720, test_f1: 0.3290
 epoch: 45, train_loss: 1.0330, test_loss: 1.1177, test_f1: 0.3395
 epoch: 46, train_loss: 1.0672, test_loss: 1.8145, test_f1: 0.2958
 epoch: 47, train_loss: 1.0636, test_loss: 2.7137, test_f1: 0.2055
 epoch: 48, train_loss: 1.0540, test_loss: 3.7285, test_f1: 0.3688
 epoch: 49, train_loss: 1.0468, test_loss: 2.5454, test_f1: 0.3776
 epoch: 50, train_loss: 1.0476, test_loss: 1.1180, test_f1: 0.4680
 epoch: 51, train_loss: 1.0411, test_loss: 1.1120, test_f1: 0.4407
 epoch: 52, train_loss: 1.0418, test_loss: 1.1186, test_f1: 0.4387
 epoch: 53, train_loss: 1.0382, test_loss: 1.1199, test_f1: 0.3395
 epoch: 54, train_loss: 1.0360, test_loss: 1.1285, test_f1: 0.4279
 epoch: 55, train_loss: 1.0302, test_loss: 1.1198, test_f1: 0.4415
 epoch: 56, train_loss: 1.0313, test_loss: 1.1217, test_f1: 0.4325
 epoch: 57, train_loss: 1.0246, test_loss: 1.1158, test_f1: 0.4335
 epoch: 58, train_loss: 1.0280, test_loss: 1.1227, test_f1: 0.3395
 epoch: 59, train_loss: 1.0367, test_loss: 1.1201, test_f1: 0.3395
 epoch: 60, train_loss: 1.0222, test_loss: 1.1194, test_f1: 0.4345
 epoch: 61, train_loss: 1.0234, test_loss: 1.1086, test_f1: 0.4421
 epoch: 62, train_loss: 1.0210, test_loss: 1.1345, test_f1: 0.4218
 epoch: 63, train_loss: 1.0229, test_loss: 1.1423, test_f1: 0.4292
 epoch: 64, train_loss: 1.0282, test_loss: 1.1144, test_f1: 0.4240
 epoch: 65, train_loss: 1.0132, test_loss: 1.0789, test_f1: 0.3349
 epoch: 66, train_loss: 1.0143, test_loss: 1.0960, test_f1: 0.3717
 epoch: 67, train_loss: 1.0124, test_loss: 1.1083, test_f1: 0.4234
 epoch: 68, train_loss: 1.0053, test_loss: 1.0906, test_f1: 0.3395
 epoch: 69, train_loss: 1.0210, test_loss: 1.0685, test_f1: 0.3540
 epoch: 70, train_loss: 1.0039, test_loss: 1.0931, test_f1: 0.4114
 epoch: 71, train_loss: 1.0172, test_loss: 1.1055, test_f1: 0.3587
 epoch: 72, train_loss: 1.0052, test_loss: 1.0804, test_f1: 0.3508
 epoch: 73, train_loss: 1.0151, test_loss: 1.1143, test_f1: 0.3400
 epoch: 74, train_loss: 1.0200, test_loss: 1.0866, test_f1: 0.3430
 epoch: 75, train_loss: 0.9960, test_loss: 1.0950, test_f1: 0.3719
 epoch: 76, train_loss: 0.9947, test_loss: 1.0782, test_f1: 0.3709
 epoch: 77, train_loss: 1.0017, test_loss: 1.0832, test_f1: 0.4852
 epoch: 78, train_loss: 0.9939, test_loss: 1.0802, test_f1: 0.4660
 epoch: 79, train_loss: 0.9918, test_loss: 1.1372, test_f1: 0.3374
 epoch: 80, train_loss: 1.0161, test_loss: 1.1566, test_f1: 0.3344
 epoch: 81, train_loss: 1.0120, test_loss: 1.1387, test_f1: 0.3354
 epoch: 82, train_loss: 1.0047, test_loss: 1.0922, test_f1: 0.3503
 epoch: 83, train_loss: 1.0036, test_loss: 1.0849, test_f1: 0.3583
 epoch: 84, train_loss: 1.0094, test_loss: 1.1213, test_f1: 0.3428
 epoch: 85, train_loss: 0.9998, test_loss: 1.1204, test_f1: 0.3384
 epoch: 86, train_loss: 0.9956, test_loss: 1.1888, test_f1: 0.3338
 epoch: 87, train_loss: 1.0256, test_loss: 1.1393, test_f1: 0.3290
 epoch: 88, train_loss: 1.0135, test_loss: 1.0966, test_f1: 0.4822
 epoch: 89, train_loss: 1.0089, test_loss: 1.0926, test_f1: 0.4419
 epoch: 90, train_loss: 0.9997, test_loss: 1.0783, test_f1: 0.3451
 epoch: 91, train_loss: 1.0009, test_loss: 1.1448, test_f1: 0.3300
 epoch: 92, train_loss: 0.9948, test_loss: 1.1779, test_f1: 0.3353
 epoch: 93, train_loss: 1.0076, test_loss: 1.1008, test_f1: 0.3353
 epoch: 94, train_loss: 1.0005, test_loss: 1.0764, test_f1: 0.3784
 epoch: 95, train_loss: 0.9988, test_loss: 1.1171, test_f1: 0.3395
 epoch: 96, train_loss: 0.9926, test_loss: 1.0548, test_f1: 0.3525
 epoch: 97, train_loss: 0.9831, test_loss: 1.0954, test_f1: 0.3559
 epoch: 98, train_loss: 0.9824, test_loss: 1.1471, test_f1: 0.3444
 epoch: 99, train_loss: 0.9886, test_loss: 1.0873, test_f1: 0.3508
##################ITERATION #3 ****************************************
 epoch: 0, train_loss: 2.1579, test_loss: 1.5311, test_f1: 0.2281
 epoch: 1, train_loss: 1.1701, test_loss: 1.5132, test_f1: 0.2281
 epoch: 2, train_loss: 1.1302, test_loss: 1.4953, test_f1: 0.2281
 epoch: 3, train_loss: 1.0954, test_loss: 1.4492, test_f1: 0.2336
 epoch: 4, train_loss: 1.0578, test_loss: 1.3697, test_f1: 0.2626
 epoch: 5, train_loss: 1.1817, test_loss: 1.2522, test_f1: 0.3004
 epoch: 6, train_loss: 1.1020, test_loss: 1.1436, test_f1: 0.3341
 epoch: 7, train_loss: 1.0434, test_loss: 1.1247, test_f1: 0.3420
 epoch: 8, train_loss: 1.0554, test_loss: 1.1590, test_f1: 0.3262
 epoch: 9, train_loss: 1.0478, test_loss: 1.1364, test_f1: 0.3317
 epoch: 10, train_loss: 1.0289, test_loss: 1.1243, test_f1: 0.3344
 epoch: 11, train_loss: 1.0459, test_loss: 1.2043, test_f1: 0.3115
 epoch: 12, train_loss: 1.0289, test_loss: 1.1984, test_f1: 0.3176
 epoch: 13, train_loss: 1.0410, test_loss: 1.1605, test_f1: 0.3290
 epoch: 14, train_loss: 1.0348, test_loss: 1.1558, test_f1: 0.3317
 epoch: 15, train_loss: 1.0271, test_loss: 1.1375, test_f1: 0.3344
 epoch: 16, train_loss: 1.0239, test_loss: 1.3372, test_f1: 0.2631
 epoch: 17, train_loss: 1.0303, test_loss: 1.1552, test_f1: 0.3234
 epoch: 18, train_loss: 1.0232, test_loss: 1.1370, test_f1: 0.3317
 epoch: 19, train_loss: 1.0059, test_loss: 1.1428, test_f1: 0.3317
 epoch: 20, train_loss: 1.0281, test_loss: 1.2174, test_f1: 0.3027
 epoch: 21, train_loss: 1.0324, test_loss: 1.1431, test_f1: 0.3350
 epoch: 22, train_loss: 1.0387, test_loss: 1.1645, test_f1: 0.3295
 epoch: 23, train_loss: 1.0253, test_loss: 1.1378, test_f1: 0.3510
 epoch: 24, train_loss: 1.0222, test_loss: 1.1222, test_f1: 0.3385
 epoch: 25, train_loss: 1.0199, test_loss: 1.1770, test_f1: 0.3290
 epoch: 26, train_loss: 1.0204, test_loss: 1.1643, test_f1: 0.3295
 epoch: 27, train_loss: 1.0070, test_loss: 1.1425, test_f1: 0.3344
 epoch: 28, train_loss: 1.0109, test_loss: 1.6075, test_f1: 0.2877
 epoch: 29, train_loss: 1.0181, test_loss: 1.5075, test_f1: 0.2978
 epoch: 30, train_loss: 1.0106, test_loss: 1.1659, test_f1: 0.3434
 epoch: 31, train_loss: 1.0108, test_loss: 1.1452, test_f1: 0.3234
 epoch: 32, train_loss: 1.0018, test_loss: 1.1467, test_f1: 0.3262
 epoch: 33, train_loss: 1.0075, test_loss: 1.1557, test_f1: 0.2924
 epoch: 34, train_loss: 1.0218, test_loss: 1.2288, test_f1: 0.3146
 epoch: 35, train_loss: 1.0179, test_loss: 1.1400, test_f1: 0.3344
 epoch: 36, train_loss: 1.0108, test_loss: 1.1661, test_f1: 0.3317
 epoch: 37, train_loss: 1.0046, test_loss: 1.1577, test_f1: 0.2957
 epoch: 38, train_loss: 1.0019, test_loss: 1.1664, test_f1: 0.3317
 epoch: 39, train_loss: 1.0017, test_loss: 1.1823, test_f1: 0.3290
 epoch: 40, train_loss: 1.0097, test_loss: 1.2259, test_f1: 0.3129
 epoch: 41, train_loss: 1.0039, test_loss: 1.3591, test_f1: 0.2759
 epoch: 42, train_loss: 1.0040, test_loss: 1.1643, test_f1: 0.3317
 epoch: 43, train_loss: 1.0186, test_loss: 1.4797, test_f1: 0.2281
 epoch: 44, train_loss: 1.1419, test_loss: 1.1489, test_f1: 0.4218
 epoch: 45, train_loss: 1.0424, test_loss: 1.2790, test_f1: 0.3262
 epoch: 46, train_loss: 1.0370, test_loss: 1.1318, test_f1: 0.3733
 epoch: 47, train_loss: 1.0066, test_loss: 1.0721, test_f1: 0.3668
 epoch: 48, train_loss: 1.0133, test_loss: 1.1618, test_f1: 0.3290
 epoch: 49, train_loss: 1.0118, test_loss: 1.1853, test_f1: 0.3394
 epoch: 50, train_loss: 1.0181, test_loss: 1.1958, test_f1: 0.3267
 epoch: 51, train_loss: 1.0356, test_loss: 1.4370, test_f1: 0.2495
 epoch: 52, train_loss: 1.0379, test_loss: 1.0959, test_f1: 0.3365
 epoch: 53, train_loss: 1.0195, test_loss: 1.1462, test_f1: 0.4023
 epoch: 54, train_loss: 1.0115, test_loss: 1.1156, test_f1: 0.4011
 epoch: 55, train_loss: 1.0068, test_loss: 1.0985, test_f1: 0.4282
 epoch: 56, train_loss: 1.0080, test_loss: 1.1484, test_f1: 0.3353
 epoch: 57, train_loss: 1.0223, test_loss: 1.1669, test_f1: 0.2966
 epoch: 58, train_loss: 1.0165, test_loss: 1.1180, test_f1: 0.3344
 epoch: 59, train_loss: 1.0197, test_loss: 1.1271, test_f1: 0.3290
 epoch: 60, train_loss: 1.0321, test_loss: 1.1223, test_f1: 0.4222
 epoch: 61, train_loss: 1.0254, test_loss: 1.1380, test_f1: 0.4298
 epoch: 62, train_loss: 1.0314, test_loss: 1.1009, test_f1: 0.4276
 epoch: 63, train_loss: 1.0117, test_loss: 1.0851, test_f1: 0.4251
 epoch: 64, train_loss: 1.0182, test_loss: 1.1470, test_f1: 0.3503
 epoch: 65, train_loss: 1.0014, test_loss: 1.1304, test_f1: 0.3344
 epoch: 66, train_loss: 0.9999, test_loss: 1.1072, test_f1: 0.3395
 epoch: 67, train_loss: 1.0019, test_loss: 1.0893, test_f1: 0.4212
 epoch: 68, train_loss: 0.9994, test_loss: 1.1189, test_f1: 0.4294
 epoch: 69, train_loss: 0.9962, test_loss: 1.1015, test_f1: 0.4239
 epoch: 70, train_loss: 0.9884, test_loss: 1.1036, test_f1: 0.4188
 epoch: 71, train_loss: 0.9875, test_loss: 1.1268, test_f1: 0.4308
 epoch: 72, train_loss: 0.9869, test_loss: 1.1676, test_f1: 0.3631
 epoch: 73, train_loss: 0.9897, test_loss: 1.1314, test_f1: 0.4154
 epoch: 74, train_loss: 0.9849, test_loss: 1.0942, test_f1: 0.4488
 epoch: 75, train_loss: 0.9799, test_loss: 1.0949, test_f1: 0.3395
 epoch: 76, train_loss: 0.9834, test_loss: 1.0971, test_f1: 0.4376
 epoch: 77, train_loss: 0.9839, test_loss: 1.1049, test_f1: 0.4206
 epoch: 78, train_loss: 0.9729, test_loss: 1.1083, test_f1: 0.4188
 epoch: 79, train_loss: 0.9871, test_loss: 1.1117, test_f1: 0.4100
 epoch: 80, train_loss: 0.9840, test_loss: 1.1384, test_f1: 0.4308
 epoch: 81, train_loss: 0.9805, test_loss: 1.1464, test_f1: 0.3344
 epoch: 82, train_loss: 0.9753, test_loss: 1.1234, test_f1: 0.4281
 epoch: 83, train_loss: 0.9773, test_loss: 1.1375, test_f1: 0.3750
 epoch: 84, train_loss: 0.9727, test_loss: 1.0957, test_f1: 0.4350
 epoch: 85, train_loss: 0.9791, test_loss: 1.1438, test_f1: 0.3698
 epoch: 86, train_loss: 0.9775, test_loss: 1.1000, test_f1: 0.4166
 epoch: 87, train_loss: 0.9844, test_loss: 1.1256, test_f1: 0.4127
 epoch: 88, train_loss: 0.9838, test_loss: 1.1040, test_f1: 0.4412
 epoch: 89, train_loss: 0.9919, test_loss: 1.1450, test_f1: 0.4383
 epoch: 90, train_loss: 0.9893, test_loss: 1.1102, test_f1: 0.4529
 epoch: 91, train_loss: 0.9772, test_loss: 1.0919, test_f1: 0.3374
 epoch: 92, train_loss: 0.9802, test_loss: 1.1311, test_f1: 0.3432
 epoch: 93, train_loss: 0.9870, test_loss: 1.2028, test_f1: 0.3565
 epoch: 94, train_loss: 0.9733, test_loss: 1.1664, test_f1: 0.2930
 epoch: 95, train_loss: 0.9780, test_loss: 1.1639, test_f1: 0.3414
 epoch: 96, train_loss: 0.9681, test_loss: 1.0953, test_f1: 0.3552
 epoch: 97, train_loss: 0.9770, test_loss: 1.1619, test_f1: 0.3433
 epoch: 98, train_loss: 0.9760, test_loss: 1.1511, test_f1: 0.3609
 epoch: 99, train_loss: 0.9813, test_loss: 1.0921, test_f1: 0.4577
##################ITERATION #4 ****************************************
 epoch: 0, train_loss: 1.4197, test_loss: 1.5264, test_f1: 0.2830
 epoch: 1, train_loss: 1.3033, test_loss: 1.4963, test_f1: 0.2281
 epoch: 2, train_loss: 1.1080, test_loss: 1.2492, test_f1: 0.3516
 epoch: 3, train_loss: 1.0640, test_loss: 1.1450, test_f1: 0.3344
 epoch: 4, train_loss: 1.0482, test_loss: 1.1370, test_f1: 0.3370
 epoch: 5, train_loss: 1.0400, test_loss: 1.1437, test_f1: 0.3395
 epoch: 6, train_loss: 1.0360, test_loss: 1.1921, test_f1: 0.3234
 epoch: 7, train_loss: 1.0304, test_loss: 1.1617, test_f1: 0.3290
 epoch: 8, train_loss: 1.0459, test_loss: 1.2284, test_f1: 0.2169
 epoch: 9, train_loss: 1.0338, test_loss: 1.1859, test_f1: 0.3262
 epoch: 10, train_loss: 1.0306, test_loss: 1.0995, test_f1: 0.3468
 epoch: 11, train_loss: 1.0243, test_loss: 1.0925, test_f1: 0.3419
 epoch: 12, train_loss: 1.0182, test_loss: 1.0897, test_f1: 0.3470
 epoch: 13, train_loss: 1.0152, test_loss: 1.1694, test_f1: 0.3290
 epoch: 14, train_loss: 1.0696, test_loss: 1.0999, test_f1: 0.3671
 epoch: 15, train_loss: 1.0783, test_loss: 1.1077, test_f1: 0.3395
 epoch: 16, train_loss: 1.0730, test_loss: 1.1311, test_f1: 0.3290
 epoch: 17, train_loss: 1.0457, test_loss: 1.1348, test_f1: 0.3317
 epoch: 18, train_loss: 1.0470, test_loss: 1.1292, test_f1: 0.3395
 epoch: 19, train_loss: 1.0504, test_loss: 1.1576, test_f1: 0.3290
 epoch: 20, train_loss: 1.0909, test_loss: 1.1616, test_f1: 0.3290
 epoch: 21, train_loss: 1.0728, test_loss: 1.1518, test_f1: 0.3290
 epoch: 22, train_loss: 1.0725, test_loss: 1.1491, test_f1: 0.3290
 epoch: 23, train_loss: 1.0569, test_loss: 1.1494, test_f1: 0.3290
 epoch: 24, train_loss: 1.0925, test_loss: 1.1484, test_f1: 0.3290
 epoch: 25, train_loss: 1.0781, test_loss: 1.1283, test_f1: 0.3370
 epoch: 26, train_loss: 1.0529, test_loss: 1.1190, test_f1: 0.3395
 epoch: 27, train_loss: 1.0499, test_loss: 1.0974, test_f1: 0.3434
 epoch: 28, train_loss: 1.0470, test_loss: 1.1505, test_f1: 0.3309
 epoch: 29, train_loss: 1.0642, test_loss: 1.1332, test_f1: 0.3395
 epoch: 30, train_loss: 1.0414, test_loss: 1.0983, test_f1: 0.3488
 epoch: 31, train_loss: 1.0309, test_loss: 1.1503, test_f1: 0.3317
 epoch: 32, train_loss: 1.0371, test_loss: 1.1187, test_f1: 0.3370
 epoch: 33, train_loss: 1.0306, test_loss: 1.1109, test_f1: 0.3395
 epoch: 34, train_loss: 1.0263, test_loss: 1.0978, test_f1: 0.3420
 epoch: 35, train_loss: 1.0239, test_loss: 1.1735, test_f1: 0.3290
 epoch: 36, train_loss: 1.0231, test_loss: 1.1073, test_f1: 0.3395
 epoch: 37, train_loss: 1.0209, test_loss: 1.1595, test_f1: 0.3290
 epoch: 38, train_loss: 1.0285, test_loss: 1.2440, test_f1: 0.2984
 epoch: 39, train_loss: 1.1699, test_loss: 1.1611, test_f1: 0.3262
 epoch: 40, train_loss: 1.0725, test_loss: 1.1149, test_f1: 0.3400
 epoch: 41, train_loss: 1.0424, test_loss: 1.1380, test_f1: 0.3317
 epoch: 42, train_loss: 1.0608, test_loss: 1.1703, test_f1: 0.3234
 epoch: 43, train_loss: 1.0655, test_loss: 1.1528, test_f1: 0.3290
 epoch: 44, train_loss: 1.0491, test_loss: 1.1180, test_f1: 0.3395
 epoch: 45, train_loss: 1.0582, test_loss: 1.1382, test_f1: 0.3327
 epoch: 46, train_loss: 1.0325, test_loss: 1.1443, test_f1: 0.3295
 epoch: 47, train_loss: 1.0272, test_loss: 1.1350, test_f1: 0.3370
 epoch: 48, train_loss: 1.0262, test_loss: 1.1218, test_f1: 0.3370
 epoch: 49, train_loss: 1.0294, test_loss: 1.1411, test_f1: 0.3370
 epoch: 50, train_loss: 1.0155, test_loss: 1.1135, test_f1: 0.3420
 epoch: 51, train_loss: 1.0188, test_loss: 1.1349, test_f1: 0.3370
 epoch: 52, train_loss: 1.0229, test_loss: 1.1074, test_f1: 0.3425
 epoch: 53, train_loss: 1.0159, test_loss: 1.1069, test_f1: 0.3405
 epoch: 54, train_loss: 1.0260, test_loss: 1.1543, test_f1: 0.3317
 epoch: 55, train_loss: 1.0447, test_loss: 1.1490, test_f1: 0.3344
 epoch: 56, train_loss: 1.0318, test_loss: 1.1302, test_f1: 0.3400
 epoch: 57, train_loss: 1.0285, test_loss: 1.1234, test_f1: 0.3549
 epoch: 58, train_loss: 1.0193, test_loss: 1.1125, test_f1: 0.3457
 epoch: 59, train_loss: 1.0114, test_loss: 1.1214, test_f1: 0.3395
 epoch: 60, train_loss: 1.0178, test_loss: 1.1704, test_f1: 0.3317
 epoch: 61, train_loss: 1.0109, test_loss: 1.1669, test_f1: 0.3317
 epoch: 62, train_loss: 1.0093, test_loss: 1.1475, test_f1: 0.3428
 epoch: 63, train_loss: 1.0095, test_loss: 1.1009, test_f1: 0.3525
 epoch: 64, train_loss: 1.0040, test_loss: 1.1001, test_f1: 0.3492
 epoch: 65, train_loss: 1.0106, test_loss: 1.1222, test_f1: 0.3395
 epoch: 66, train_loss: 1.0059, test_loss: 1.1125, test_f1: 0.3379
 epoch: 67, train_loss: 1.0062, test_loss: 1.1084, test_f1: 0.3513
 epoch: 68, train_loss: 1.0020, test_loss: 1.1231, test_f1: 0.3395
 epoch: 69, train_loss: 0.9980, test_loss: 1.1242, test_f1: 0.3395
 epoch: 70, train_loss: 1.0011, test_loss: 1.1111, test_f1: 0.3463
 epoch: 71, train_loss: 1.0036, test_loss: 1.1408, test_f1: 0.3370
 epoch: 72, train_loss: 1.0225, test_loss: 1.2563, test_f1: 0.3051
 epoch: 73, train_loss: 1.0224, test_loss: 1.1350, test_f1: 0.3288
 epoch: 74, train_loss: 0.9997, test_loss: 1.0998, test_f1: 0.3420
 epoch: 75, train_loss: 0.9984, test_loss: 1.1059, test_f1: 0.3468
 epoch: 76, train_loss: 1.0041, test_loss: 1.1125, test_f1: 0.3408
 epoch: 77, train_loss: 0.9987, test_loss: 1.1136, test_f1: 0.3529
 epoch: 78, train_loss: 0.9957, test_loss: 1.1190, test_f1: 0.3622
 epoch: 79, train_loss: 0.9996, test_loss: 1.1503, test_f1: 0.3370
 epoch: 80, train_loss: 1.0004, test_loss: 1.1532, test_f1: 0.3370
 epoch: 81, train_loss: 1.0073, test_loss: 1.1530, test_f1: 0.3370
 epoch: 82, train_loss: 1.0318, test_loss: 1.1666, test_f1: 0.3295
 epoch: 83, train_loss: 1.0375, test_loss: 1.1355, test_f1: 0.3395
 epoch: 84, train_loss: 1.0372, test_loss: 1.1329, test_f1: 0.3395
 epoch: 85, train_loss: 1.0317, test_loss: 1.0745, test_f1: 0.3530
 epoch: 86, train_loss: 1.0377, test_loss: 1.1457, test_f1: 0.3344
 epoch: 87, train_loss: 1.0418, test_loss: 1.1415, test_f1: 0.3317
 epoch: 88, train_loss: 1.0316, test_loss: 1.1062, test_f1: 0.3444
 epoch: 89, train_loss: 1.0272, test_loss: 2.0134, test_f1: 0.2432
 epoch: 90, train_loss: 1.0395, test_loss: 1.1431, test_f1: 0.3381
 epoch: 91, train_loss: 1.0496, test_loss: 1.1445, test_f1: 0.3330
 epoch: 92, train_loss: 1.0339, test_loss: 1.1327, test_f1: 0.3317
 epoch: 93, train_loss: 1.0226, test_loss: 1.1386, test_f1: 0.3317
 epoch: 94, train_loss: 1.0269, test_loss: 1.1428, test_f1: 0.3317
 epoch: 95, train_loss: 1.0221, test_loss: 1.1558, test_f1: 0.3317
 epoch: 96, train_loss: 1.0185, test_loss: 1.1614, test_f1: 0.3317
 epoch: 97, train_loss: 1.0102, test_loss: 1.1535, test_f1: 0.3317
 epoch: 98, train_loss: 1.0235, test_loss: 1.1620, test_f1: 0.3317
 epoch: 99, train_loss: 1.0134, test_loss: 1.1495, test_f1: 0.3317
##################ITERATION #5 ****************************************
 epoch: 0, train_loss: 1.2934, test_loss: 1.4070, test_f1: 0.2281
 epoch: 1, train_loss: 1.1976, test_loss: 1.1268, test_f1: 0.3370
 epoch: 2, train_loss: 1.0754, test_loss: 1.2237, test_f1: 0.2251
 epoch: 3, train_loss: 1.0691, test_loss: 1.1242, test_f1: 0.3412
 epoch: 4, train_loss: 1.0549, test_loss: 1.1118, test_f1: 0.3405
 epoch: 5, train_loss: 1.0510, test_loss: 1.1314, test_f1: 0.3370
 epoch: 6, train_loss: 1.0479, test_loss: 1.1066, test_f1: 0.3454
 epoch: 7, train_loss: 1.0396, test_loss: 1.1734, test_f1: 0.3262
 epoch: 8, train_loss: 1.0387, test_loss: 1.1149, test_f1: 0.3412
 epoch: 9, train_loss: 1.0496, test_loss: 1.1888, test_f1: 0.3176
 epoch: 10, train_loss: 1.0413, test_loss: 1.1082, test_f1: 0.3461
 epoch: 11, train_loss: 1.0354, test_loss: 1.1308, test_f1: 0.3344
 epoch: 12, train_loss: 1.0234, test_loss: 1.6869, test_f1: 0.2869
 epoch: 13, train_loss: 1.0204, test_loss: 1.1436, test_f1: 0.3317
 epoch: 14, train_loss: 1.0203, test_loss: 1.1660, test_f1: 0.3272
 epoch: 15, train_loss: 1.0564, test_loss: 7.0657, test_f1: 0.1644
 epoch: 16, train_loss: 1.0422, test_loss: 6.5000, test_f1: 0.1496
 epoch: 17, train_loss: 1.0424, test_loss: 1.1546, test_f1: 0.3531
 epoch: 18, train_loss: 1.0330, test_loss: 1.1422, test_f1: 0.3395
 epoch: 19, train_loss: 1.0159, test_loss: 1.1983, test_f1: 0.3234
 epoch: 20, train_loss: 1.0194, test_loss: 1.3700, test_f1: 0.2586
 epoch: 21, train_loss: 1.0526, test_loss: 1.2451, test_f1: 0.3022
 epoch: 22, train_loss: 1.0410, test_loss: 1.1607, test_f1: 0.3290
 epoch: 23, train_loss: 1.0334, test_loss: 1.1287, test_f1: 0.3395
 epoch: 24, train_loss: 1.0548, test_loss: 4.1050, test_f1: 0.2363
 epoch: 25, train_loss: 1.0409, test_loss: 1.1225, test_f1: 0.3473
 epoch: 26, train_loss: 1.0679, test_loss: 1.1617, test_f1: 0.3290
 epoch: 27, train_loss: 1.0534, test_loss: 1.1277, test_f1: 0.3348
 epoch: 28, train_loss: 1.0499, test_loss: 1.1296, test_f1: 0.3344
 epoch: 29, train_loss: 1.0405, test_loss: 1.1215, test_f1: 0.3395
 epoch: 30, train_loss: 1.0314, test_loss: 1.1353, test_f1: 0.3395
 epoch: 31, train_loss: 1.0228, test_loss: 1.1365, test_f1: 0.3395
 epoch: 32, train_loss: 1.0498, test_loss: 1.2793, test_f1: 0.2852
 epoch: 33, train_loss: 1.0431, test_loss: 1.3827, test_f1: 0.2390
 epoch: 34, train_loss: 1.0517, test_loss: 1.3924, test_f1: 0.2491
 epoch: 35, train_loss: 1.0408, test_loss: 1.1140, test_f1: 0.3545
 epoch: 36, train_loss: 1.0264, test_loss: 1.1083, test_f1: 0.3544
 epoch: 37, train_loss: 1.0222, test_loss: 1.1329, test_f1: 0.3332
 epoch: 38, train_loss: 1.0377, test_loss: 1.1241, test_f1: 0.3416
 epoch: 39, train_loss: 1.0242, test_loss: 2.1888, test_f1: 0.2355
 epoch: 40, train_loss: 1.0803, test_loss: 1.4492, test_f1: 0.2714
 epoch: 41, train_loss: 1.0363, test_loss: 1.1000, test_f1: 0.3444
 epoch: 42, train_loss: 1.0499, test_loss: 1.1625, test_f1: 0.3880
 epoch: 43, train_loss: 1.0350, test_loss: 1.1632, test_f1: 0.3371
 epoch: 44, train_loss: 1.0184, test_loss: 1.1405, test_f1: 0.3294
 epoch: 45, train_loss: 1.0159, test_loss: 1.1597, test_f1: 0.3317
 epoch: 46, train_loss: 1.0285, test_loss: 1.1575, test_f1: 0.3698
 epoch: 47, train_loss: 1.0153, test_loss: 1.1214, test_f1: 0.3395
 epoch: 48, train_loss: 1.0264, test_loss: 1.1359, test_f1: 0.3395
 epoch: 49, train_loss: 1.0262, test_loss: 1.1600, test_f1: 0.3317
 epoch: 50, train_loss: 1.0346, test_loss: 1.1567, test_f1: 0.3595
 epoch: 51, train_loss: 1.0313, test_loss: 1.1427, test_f1: 0.3639
 epoch: 52, train_loss: 1.0282, test_loss: 1.1286, test_f1: 0.3781
 epoch: 53, train_loss: 1.0032, test_loss: 1.1254, test_f1: 0.3816
 epoch: 54, train_loss: 0.9963, test_loss: 1.1284, test_f1: 0.3451
 epoch: 55, train_loss: 1.0042, test_loss: 1.1316, test_f1: 0.3395
 epoch: 56, train_loss: 0.9923, test_loss: 1.1281, test_f1: 0.3788
 epoch: 57, train_loss: 1.0059, test_loss: 1.1331, test_f1: 0.3737
 epoch: 58, train_loss: 1.0005, test_loss: 1.1557, test_f1: 0.3725
 epoch: 59, train_loss: 1.0011, test_loss: 1.1558, test_f1: 0.3750
 epoch: 60, train_loss: 0.9932, test_loss: 1.1563, test_f1: 0.3801
 epoch: 61, train_loss: 0.9955, test_loss: 1.1371, test_f1: 0.3827
 epoch: 62, train_loss: 0.9974, test_loss: 1.1288, test_f1: 0.3837
 epoch: 63, train_loss: 1.0010, test_loss: 1.1313, test_f1: 0.3796
 epoch: 64, train_loss: 1.0016, test_loss: 1.1344, test_f1: 0.3729
 epoch: 65, train_loss: 1.0181, test_loss: 1.1368, test_f1: 0.3797
 epoch: 66, train_loss: 1.0057, test_loss: 1.1503, test_f1: 0.3685
 epoch: 67, train_loss: 1.0002, test_loss: 1.1283, test_f1: 0.3917
 epoch: 68, train_loss: 0.9996, test_loss: 1.1210, test_f1: 0.3840
 epoch: 69, train_loss: 0.9927, test_loss: 1.1784, test_f1: 0.3297
 epoch: 70, train_loss: 0.9995, test_loss: 1.1515, test_f1: 0.3322
 epoch: 71, train_loss: 0.9918, test_loss: 1.1436, test_f1: 0.3451
 epoch: 72, train_loss: 1.0122, test_loss: 1.1489, test_f1: 0.3331
 epoch: 73, train_loss: 1.0071, test_loss: 1.1303, test_f1: 0.3968
 epoch: 74, train_loss: 0.9944, test_loss: 1.1316, test_f1: 0.3863
 epoch: 75, train_loss: 0.9904, test_loss: 1.1524, test_f1: 0.3801
 epoch: 76, train_loss: 1.0030, test_loss: 1.1633, test_f1: 0.3852
 epoch: 77, train_loss: 1.0055, test_loss: 1.1656, test_f1: 0.3791
 epoch: 78, train_loss: 0.9966, test_loss: 1.1526, test_f1: 0.3814
 epoch: 79, train_loss: 1.0002, test_loss: 1.1460, test_f1: 0.3826
 epoch: 80, train_loss: 0.9948, test_loss: 1.1454, test_f1: 0.3796
 epoch: 81, train_loss: 1.0014, test_loss: 1.1618, test_f1: 0.3648
 epoch: 82, train_loss: 0.9978, test_loss: 1.1271, test_f1: 0.3764
 epoch: 83, train_loss: 1.0002, test_loss: 1.1840, test_f1: 0.3317
 epoch: 84, train_loss: 0.9899, test_loss: 1.1931, test_f1: 0.3290
 epoch: 85, train_loss: 1.0061, test_loss: 1.1334, test_f1: 0.3853
 epoch: 86, train_loss: 0.9904, test_loss: 1.1197, test_f1: 0.3451
 epoch: 87, train_loss: 0.9899, test_loss: 1.1160, test_f1: 0.3384
 epoch: 88, train_loss: 0.9950, test_loss: 1.1081, test_f1: 0.3384
 epoch: 89, train_loss: 0.9935, test_loss: 1.1080, test_f1: 0.3384
 epoch: 90, train_loss: 0.9916, test_loss: 1.1110, test_f1: 0.3656
 epoch: 91, train_loss: 0.9899, test_loss: 1.1137, test_f1: 0.3813
 epoch: 92, train_loss: 0.9848, test_loss: 1.1131, test_f1: 0.3882
 epoch: 93, train_loss: 0.9817, test_loss: 1.1148, test_f1: 0.3917
 epoch: 94, train_loss: 0.9953, test_loss: 1.1105, test_f1: 0.3896
 epoch: 95, train_loss: 0.9931, test_loss: 1.1128, test_f1: 0.3934
 epoch: 96, train_loss: 0.9849, test_loss: 1.1123, test_f1: 0.3917
 epoch: 97, train_loss: 0.9904, test_loss: 1.1223, test_f1: 0.3916
 epoch: 98, train_loss: 0.9930, test_loss: 1.1260, test_f1: 0.3933
 epoch: 99, train_loss: 0.9985, test_loss: 1.1296, test_f1: 0.3864
##################ITERATION #6 ****************************************
 epoch: 0, train_loss: 1.3390, test_loss: 1.3806, test_f1: 0.2281
 epoch: 1, train_loss: 1.2853, test_loss: 1.3251, test_f1: 0.2281
 epoch: 2, train_loss: 1.2587, test_loss: 1.3052, test_f1: 0.2281
 epoch: 3, train_loss: 1.2546, test_loss: 1.3000, test_f1: 0.2281
 epoch: 4, train_loss: 1.2541, test_loss: 1.3009, test_f1: 0.2281
 epoch: 5, train_loss: 1.2524, test_loss: 1.3034, test_f1: 0.2281
 epoch: 6, train_loss: 1.2525, test_loss: 1.3072, test_f1: 0.2281
 epoch: 7, train_loss: 1.2526, test_loss: 1.3056, test_f1: 0.2281
 epoch: 8, train_loss: 1.2525, test_loss: 1.3021, test_f1: 0.2281
 epoch: 9, train_loss: 1.2528, test_loss: 1.3015, test_f1: 0.2281
 epoch: 10, train_loss: 1.2529, test_loss: 1.3016, test_f1: 0.2281
 epoch: 11, train_loss: 1.2529, test_loss: 1.3018, test_f1: 0.2281
 epoch: 12, train_loss: 1.2526, test_loss: 1.3039, test_f1: 0.2281
 epoch: 13, train_loss: 1.2525, test_loss: 1.3062, test_f1: 0.2281
 epoch: 14, train_loss: 1.2533, test_loss: 1.3063, test_f1: 0.2281
 epoch: 15, train_loss: 1.2529, test_loss: 1.3055, test_f1: 0.2281
 epoch: 16, train_loss: 1.2530, test_loss: 1.3063, test_f1: 0.2281
 epoch: 17, train_loss: 1.2540, test_loss: 1.3013, test_f1: 0.2281
 epoch: 18, train_loss: 1.2542, test_loss: 1.3027, test_f1: 0.2281
 epoch: 19, train_loss: 1.2526, test_loss: 1.3061, test_f1: 0.2281
 epoch: 20, train_loss: 1.2527, test_loss: 1.3083, test_f1: 0.2281
 epoch: 21, train_loss: 1.2529, test_loss: 1.3058, test_f1: 0.2281
 epoch: 22, train_loss: 1.2523, test_loss: 1.3035, test_f1: 0.2281
 epoch: 23, train_loss: 1.2530, test_loss: 1.3029, test_f1: 0.2281
 epoch: 24, train_loss: 1.2523, test_loss: 1.3038, test_f1: 0.2281
 epoch: 25, train_loss: 1.2526, test_loss: 1.3033, test_f1: 0.2281
 epoch: 26, train_loss: 1.2524, test_loss: 1.3042, test_f1: 0.2281
 epoch: 27, train_loss: 1.2532, test_loss: 1.3082, test_f1: 0.2281
 epoch: 28, train_loss: 1.2525, test_loss: 1.3097, test_f1: 0.2281
 epoch: 29, train_loss: 1.2542, test_loss: 1.3054, test_f1: 0.2281
 epoch: 30, train_loss: 1.2525, test_loss: 1.3010, test_f1: 0.2281
 epoch: 31, train_loss: 1.2532, test_loss: 1.3027, test_f1: 0.2281
 epoch: 32, train_loss: 1.2532, test_loss: 1.3060, test_f1: 0.2281
 epoch: 33, train_loss: 1.2539, test_loss: 1.3024, test_f1: 0.2281
 epoch: 34, train_loss: 1.2539, test_loss: 1.3073, test_f1: 0.2281
 epoch: 35, train_loss: 1.2533, test_loss: 1.3098, test_f1: 0.2281
 epoch: 36, train_loss: 1.2534, test_loss: 1.3073, test_f1: 0.2281
 epoch: 37, train_loss: 1.2532, test_loss: 1.3025, test_f1: 0.2281
 epoch: 38, train_loss: 1.2534, test_loss: 1.3059, test_f1: 0.2281
 epoch: 39, train_loss: 1.2538, test_loss: 1.3109, test_f1: 0.2281
 epoch: 40, train_loss: 1.2542, test_loss: 1.3099, test_f1: 0.2281
 epoch: 41, train_loss: 1.2527, test_loss: 1.3047, test_f1: 0.2281
 epoch: 42, train_loss: 1.2526, test_loss: 1.3001, test_f1: 0.2281
 epoch: 43, train_loss: 1.2534, test_loss: 1.3016, test_f1: 0.2281
 epoch: 44, train_loss: 1.2527, test_loss: 1.3095, test_f1: 0.2281
 epoch: 45, train_loss: 1.2541, test_loss: 1.3131, test_f1: 0.2281
 epoch: 46, train_loss: 1.2532, test_loss: 1.3067, test_f1: 0.2281
 epoch: 47, train_loss: 1.2525, test_loss: 1.3014, test_f1: 0.2281
 epoch: 48, train_loss: 1.2528, test_loss: 1.3023, test_f1: 0.2281
 epoch: 49, train_loss: 1.2525, test_loss: 1.3050, test_f1: 0.2281
 epoch: 50, train_loss: 1.2524, test_loss: 1.3051, test_f1: 0.2281
 epoch: 51, train_loss: 1.2525, test_loss: 1.3066, test_f1: 0.2281
 epoch: 52, train_loss: 1.2532, test_loss: 1.3052, test_f1: 0.2281
 epoch: 53, train_loss: 1.2532, test_loss: 1.3029, test_f1: 0.2281
 epoch: 54, train_loss: 1.2529, test_loss: 1.3022, test_f1: 0.2281
 epoch: 55, train_loss: 1.2524, test_loss: 1.3018, test_f1: 0.2281
 epoch: 56, train_loss: 1.2528, test_loss: 1.3009, test_f1: 0.2281
 epoch: 57, train_loss: 1.2528, test_loss: 1.3013, test_f1: 0.2281
 epoch: 58, train_loss: 1.2524, test_loss: 1.3028, test_f1: 0.2281
 epoch: 59, train_loss: 1.2521, test_loss: 1.3054, test_f1: 0.2281
 epoch: 60, train_loss: 1.2523, test_loss: 1.3065, test_f1: 0.2281
 epoch: 61, train_loss: 1.2526, test_loss: 1.3063, test_f1: 0.2281
 epoch: 62, train_loss: 1.2522, test_loss: 1.3061, test_f1: 0.2281
 epoch: 63, train_loss: 1.2521, test_loss: 1.3053, test_f1: 0.2281
 epoch: 64, train_loss: 1.2523, test_loss: 1.3046, test_f1: 0.2281
 epoch: 65, train_loss: 1.2527, test_loss: 1.3069, test_f1: 0.2281
 epoch: 66, train_loss: 1.2532, test_loss: 1.3080, test_f1: 0.2281
 epoch: 67, train_loss: 1.2535, test_loss: 1.3097, test_f1: 0.2281
 epoch: 68, train_loss: 1.2526, test_loss: 1.3043, test_f1: 0.2281
 epoch: 69, train_loss: 1.2520, test_loss: 1.3028, test_f1: 0.2281
 epoch: 70, train_loss: 1.2525, test_loss: 1.3035, test_f1: 0.2281
 epoch: 71, train_loss: 1.2537, test_loss: 1.3051, test_f1: 0.2281
 epoch: 72, train_loss: 1.2526, test_loss: 1.3081, test_f1: 0.2281
 epoch: 73, train_loss: 1.2529, test_loss: 1.3078, test_f1: 0.2281
 epoch: 74, train_loss: 1.2530, test_loss: 1.3071, test_f1: 0.2281
 epoch: 75, train_loss: 1.2523, test_loss: 1.3048, test_f1: 0.2281
 epoch: 76, train_loss: 1.2525, test_loss: 1.3053, test_f1: 0.2281
 epoch: 77, train_loss: 1.2526, test_loss: 1.3077, test_f1: 0.2281
 epoch: 78, train_loss: 1.2525, test_loss: 1.3097, test_f1: 0.2281
 epoch: 79, train_loss: 1.2537, test_loss: 1.3103, test_f1: 0.2281
 epoch: 80, train_loss: 1.2527, test_loss: 1.3054, test_f1: 0.2281
 epoch: 81, train_loss: 1.2524, test_loss: 1.3034, test_f1: 0.2281
 epoch: 82, train_loss: 1.2531, test_loss: 1.3039, test_f1: 0.2281
 epoch: 83, train_loss: 1.2528, test_loss: 1.3079, test_f1: 0.2281
 epoch: 84, train_loss: 1.2522, test_loss: 1.3076, test_f1: 0.2281
 epoch: 85, train_loss: 1.2524, test_loss: 1.3039, test_f1: 0.2281
 epoch: 86, train_loss: 1.2522, test_loss: 1.3031, test_f1: 0.2281
 epoch: 87, train_loss: 1.2523, test_loss: 1.3057, test_f1: 0.2281
 epoch: 88, train_loss: 1.2527, test_loss: 1.3082, test_f1: 0.2281
 epoch: 89, train_loss: 1.2526, test_loss: 1.3064, test_f1: 0.2281
 epoch: 90, train_loss: 1.2525, test_loss: 1.3058, test_f1: 0.2281
 epoch: 91, train_loss: 1.2528, test_loss: 1.3081, test_f1: 0.2281
 epoch: 92, train_loss: 1.2530, test_loss: 1.3074, test_f1: 0.2281
 epoch: 93, train_loss: 1.2522, test_loss: 1.3066, test_f1: 0.2281
 epoch: 94, train_loss: 1.2529, test_loss: 1.3049, test_f1: 0.2281
 epoch: 95, train_loss: 1.2526, test_loss: 1.3065, test_f1: 0.2281
 epoch: 96, train_loss: 1.2529, test_loss: 1.3065, test_f1: 0.2281
 epoch: 97, train_loss: 1.2525, test_loss: 1.3043, test_f1: 0.2281
 epoch: 98, train_loss: 1.2522, test_loss: 1.3040, test_f1: 0.2281
 epoch: 99, train_loss: 1.2523, test_loss: 1.3039, test_f1: 0.2281
##################ITERATION #7 ****************************************
 epoch: 0, train_loss: 1.3019, test_loss: 1.3144, test_f1: 0.2281
 epoch: 1, train_loss: 1.2601, test_loss: 1.3065, test_f1: 0.2281
 epoch: 2, train_loss: 1.2562, test_loss: 1.3072, test_f1: 0.2281
 epoch: 3, train_loss: 1.2532, test_loss: 1.3041, test_f1: 0.2281
 epoch: 4, train_loss: 1.2523, test_loss: 1.3036, test_f1: 0.2281
 epoch: 5, train_loss: 1.2532, test_loss: 1.3016, test_f1: 0.2281
 epoch: 6, train_loss: 1.2529, test_loss: 1.3032, test_f1: 0.2281
 epoch: 7, train_loss: 1.2533, test_loss: 1.3101, test_f1: 0.2281
 epoch: 8, train_loss: 1.2531, test_loss: 1.3070, test_f1: 0.2281
 epoch: 9, train_loss: 1.2525, test_loss: 1.3007, test_f1: 0.2281
 epoch: 10, train_loss: 1.2533, test_loss: 1.3022, test_f1: 0.2281
 epoch: 11, train_loss: 1.2524, test_loss: 1.3083, test_f1: 0.2281
 epoch: 12, train_loss: 1.2523, test_loss: 1.3096, test_f1: 0.2281
 epoch: 13, train_loss: 1.2529, test_loss: 1.3046, test_f1: 0.2281
 epoch: 14, train_loss: 1.2533, test_loss: 1.3013, test_f1: 0.2281
 epoch: 15, train_loss: 1.2526, test_loss: 1.3053, test_f1: 0.2281
 epoch: 16, train_loss: 1.2520, test_loss: 1.3080, test_f1: 0.2281
 epoch: 17, train_loss: 1.2528, test_loss: 1.3100, test_f1: 0.2281
 epoch: 18, train_loss: 1.2528, test_loss: 1.3054, test_f1: 0.2281
 epoch: 19, train_loss: 1.2522, test_loss: 1.3023, test_f1: 0.2281
 epoch: 20, train_loss: 1.2524, test_loss: 1.3018, test_f1: 0.2281
 epoch: 21, train_loss: 1.2531, test_loss: 1.3020, test_f1: 0.2281
 epoch: 22, train_loss: 1.2530, test_loss: 1.3042, test_f1: 0.2281
 epoch: 23, train_loss: 1.2525, test_loss: 1.3064, test_f1: 0.2281
 epoch: 24, train_loss: 1.2537, test_loss: 1.3118, test_f1: 0.2281
 epoch: 25, train_loss: 1.2538, test_loss: 1.3093, test_f1: 0.2281
 epoch: 26, train_loss: 1.2529, test_loss: 1.3078, test_f1: 0.2281
 epoch: 27, train_loss: 1.2527, test_loss: 1.3076, test_f1: 0.2281
 epoch: 28, train_loss: 1.2525, test_loss: 1.3075, test_f1: 0.2281
 epoch: 29, train_loss: 1.2542, test_loss: 1.3028, test_f1: 0.2281
 epoch: 30, train_loss: 1.2531, test_loss: 1.3030, test_f1: 0.2281
 epoch: 31, train_loss: 1.2523, test_loss: 1.3038, test_f1: 0.2281
 epoch: 32, train_loss: 1.2525, test_loss: 1.3043, test_f1: 0.2281
 epoch: 33, train_loss: 1.2534, test_loss: 1.3092, test_f1: 0.2281
 epoch: 34, train_loss: 1.2534, test_loss: 1.3095, test_f1: 0.2281
 epoch: 35, train_loss: 1.2526, test_loss: 1.3047, test_f1: 0.2281
 epoch: 36, train_loss: 1.2553, test_loss: 1.3014, test_f1: 0.2281
 epoch: 37, train_loss: 1.2562, test_loss: 1.3011, test_f1: 0.2281
 epoch: 38, train_loss: 1.2537, test_loss: 1.3109, test_f1: 0.2281
 epoch: 39, train_loss: 1.2565, test_loss: 1.3165, test_f1: 0.2281
 epoch: 40, train_loss: 1.2546, test_loss: 1.3091, test_f1: 0.2281
 epoch: 41, train_loss: 1.2518, test_loss: 1.3027, test_f1: 0.2281
 epoch: 42, train_loss: 1.2537, test_loss: 1.3020, test_f1: 0.2281
 epoch: 43, train_loss: 1.2525, test_loss: 1.3067, test_f1: 0.2281
 epoch: 44, train_loss: 1.2526, test_loss: 1.3101, test_f1: 0.2281
 epoch: 45, train_loss: 1.2531, test_loss: 1.3066, test_f1: 0.2281
 epoch: 46, train_loss: 1.2530, test_loss: 1.3076, test_f1: 0.2281
 epoch: 47, train_loss: 1.2538, test_loss: 1.3102, test_f1: 0.2281
 epoch: 48, train_loss: 1.2520, test_loss: 1.3031, test_f1: 0.2281
 epoch: 49, train_loss: 1.2539, test_loss: 1.3016, test_f1: 0.2281
 epoch: 50, train_loss: 1.2531, test_loss: 1.3063, test_f1: 0.2281
 epoch: 51, train_loss: 1.2529, test_loss: 1.3051, test_f1: 0.2281
 epoch: 52, train_loss: 1.2524, test_loss: 1.3058, test_f1: 0.2281
 epoch: 53, train_loss: 1.2522, test_loss: 1.3046, test_f1: 0.2281
 epoch: 54, train_loss: 1.2522, test_loss: 1.3042, test_f1: 0.2281
 epoch: 55, train_loss: 1.2521, test_loss: 1.3047, test_f1: 0.2281
 epoch: 56, train_loss: 1.2525, test_loss: 1.3024, test_f1: 0.2281
 epoch: 57, train_loss: 1.2525, test_loss: 1.3041, test_f1: 0.2281
 epoch: 58, train_loss: 1.2526, test_loss: 1.3052, test_f1: 0.2281
 epoch: 59, train_loss: 1.2525, test_loss: 1.3065, test_f1: 0.2281
 epoch: 60, train_loss: 1.2518, test_loss: 1.3039, test_f1: 0.2281
 epoch: 61, train_loss: 1.2524, test_loss: 1.3040, test_f1: 0.2281
 epoch: 62, train_loss: 1.2534, test_loss: 1.3028, test_f1: 0.2281
 epoch: 63, train_loss: 1.2538, test_loss: 1.3025, test_f1: 0.2281
 epoch: 64, train_loss: 1.2537, test_loss: 1.3023, test_f1: 0.2281
 epoch: 65, train_loss: 1.2526, test_loss: 1.3046, test_f1: 0.2281
 epoch: 66, train_loss: 1.2521, test_loss: 1.3058, test_f1: 0.2281
 epoch: 67, train_loss: 1.2522, test_loss: 1.3054, test_f1: 0.2281
 epoch: 68, train_loss: 1.2523, test_loss: 1.3047, test_f1: 0.2281
 epoch: 69, train_loss: 1.2524, test_loss: 1.3048, test_f1: 0.2281
 epoch: 70, train_loss: 1.2527, test_loss: 1.3040, test_f1: 0.2281
 epoch: 71, train_loss: 1.2533, test_loss: 1.3026, test_f1: 0.2281
 epoch: 72, train_loss: 1.2533, test_loss: 1.3021, test_f1: 0.2281
 epoch: 73, train_loss: 1.2534, test_loss: 1.3010, test_f1: 0.2281
 epoch: 74, train_loss: 1.2527, test_loss: 1.3034, test_f1: 0.2281
 epoch: 75, train_loss: 1.2525, test_loss: 1.3056, test_f1: 0.2281
 epoch: 76, train_loss: 1.2524, test_loss: 1.3089, test_f1: 0.2281
 epoch: 77, train_loss: 1.2525, test_loss: 1.3086, test_f1: 0.2281
 epoch: 78, train_loss: 1.2526, test_loss: 1.3063, test_f1: 0.2281
 epoch: 79, train_loss: 1.2522, test_loss: 1.3065, test_f1: 0.2281
 epoch: 80, train_loss: 1.2522, test_loss: 1.3076, test_f1: 0.2281
 epoch: 81, train_loss: 1.2522, test_loss: 1.3055, test_f1: 0.2281
 epoch: 82, train_loss: 1.2524, test_loss: 1.3064, test_f1: 0.2281
 epoch: 83, train_loss: 1.2525, test_loss: 1.3067, test_f1: 0.2281
 epoch: 84, train_loss: 1.2525, test_loss: 1.3063, test_f1: 0.2281
 epoch: 85, train_loss: 1.2525, test_loss: 1.3045, test_f1: 0.2281
 epoch: 86, train_loss: 1.2521, test_loss: 1.3041, test_f1: 0.2281
 epoch: 87, train_loss: 1.2521, test_loss: 1.3056, test_f1: 0.2281
 epoch: 88, train_loss: 1.2528, test_loss: 1.3070, test_f1: 0.2281
 epoch: 89, train_loss: 1.2529, test_loss: 1.3064, test_f1: 0.2281
 epoch: 90, train_loss: 1.2530, test_loss: 1.3042, test_f1: 0.2281
 epoch: 91, train_loss: 1.2530, test_loss: 1.3044, test_f1: 0.2281
 epoch: 92, train_loss: 1.2523, test_loss: 1.3027, test_f1: 0.2281
 epoch: 93, train_loss: 1.2519, test_loss: 1.3039, test_f1: 0.2281
 epoch: 94, train_loss: 1.2527, test_loss: 1.3047, test_f1: 0.2281
 epoch: 95, train_loss: 1.2525, test_loss: 1.3036, test_f1: 0.2281
 epoch: 96, train_loss: 1.2526, test_loss: 1.3016, test_f1: 0.2281
 epoch: 97, train_loss: 1.2526, test_loss: 1.3013, test_f1: 0.2281
 epoch: 98, train_loss: 1.2531, test_loss: 1.3021, test_f1: 0.2281
 epoch: 99, train_loss: 1.2529, test_loss: 1.3038, test_f1: 0.2281
##################ITERATION #8 ****************************************
 epoch: 0, train_loss: 1.2650, test_loss: 1.3035, test_f1: 0.2281
 epoch: 1, train_loss: 1.2524, test_loss: 1.3088, test_f1: 0.2281
 epoch: 2, train_loss: 1.2533, test_loss: 1.3096, test_f1: 0.2281
 epoch: 3, train_loss: 1.2534, test_loss: 1.3067, test_f1: 0.2281
 epoch: 4, train_loss: 1.2533, test_loss: 1.3023, test_f1: 0.2281
 epoch: 5, train_loss: 1.2527, test_loss: 1.3052, test_f1: 0.2281
 epoch: 6, train_loss: 1.2537, test_loss: 1.3047, test_f1: 0.2281
 epoch: 7, train_loss: 1.2524, test_loss: 1.3052, test_f1: 0.2281
 epoch: 8, train_loss: 1.2521, test_loss: 1.3000, test_f1: 0.2281
 epoch: 9, train_loss: 1.2536, test_loss: 1.3016, test_f1: 0.2281
 epoch: 10, train_loss: 1.2538, test_loss: 1.3110, test_f1: 0.2281
 epoch: 11, train_loss: 1.2533, test_loss: 1.3051, test_f1: 0.2281
 epoch: 12, train_loss: 1.2516, test_loss: 1.3046, test_f1: 0.2281
 epoch: 13, train_loss: 1.2528, test_loss: 1.3057, test_f1: 0.2281
 epoch: 14, train_loss: 1.2531, test_loss: 1.3066, test_f1: 0.2281
 epoch: 15, train_loss: 1.2540, test_loss: 1.3115, test_f1: 0.2281
 epoch: 16, train_loss: 1.2536, test_loss: 1.3099, test_f1: 0.2281
 epoch: 17, train_loss: 1.2542, test_loss: 1.3074, test_f1: 0.2281
 epoch: 18, train_loss: 1.2531, test_loss: 1.3052, test_f1: 0.2281
 epoch: 19, train_loss: 1.2534, test_loss: 1.3044, test_f1: 0.2281
 epoch: 20, train_loss: 1.2534, test_loss: 1.3067, test_f1: 0.2281
 epoch: 21, train_loss: 1.2533, test_loss: 1.3062, test_f1: 0.2281
 epoch: 22, train_loss: 1.2538, test_loss: 1.3078, test_f1: 0.2281
 epoch: 23, train_loss: 1.2543, test_loss: 1.3063, test_f1: 0.2281
 epoch: 24, train_loss: 1.2526, test_loss: 1.3091, test_f1: 0.2281
 epoch: 25, train_loss: 1.2539, test_loss: 1.3081, test_f1: 0.2281
 epoch: 26, train_loss: 1.2541, test_loss: 1.3058, test_f1: 0.2281
 epoch: 27, train_loss: 1.2535, test_loss: 1.3074, test_f1: 0.2281
 epoch: 28, train_loss: 1.2517, test_loss: 1.3068, test_f1: 0.2281
 epoch: 29, train_loss: 1.2524, test_loss: 1.3030, test_f1: 0.2281
 epoch: 30, train_loss: 1.2525, test_loss: 1.3011, test_f1: 0.2281
 epoch: 31, train_loss: 1.2535, test_loss: 1.3033, test_f1: 0.2281
 epoch: 32, train_loss: 1.2528, test_loss: 1.3058, test_f1: 0.2281
 epoch: 33, train_loss: 1.2520, test_loss: 1.3017, test_f1: 0.2281
 epoch: 34, train_loss: 1.2544, test_loss: 1.3013, test_f1: 0.2281
 epoch: 35, train_loss: 1.2527, test_loss: 1.3036, test_f1: 0.2281
 epoch: 36, train_loss: 1.2545, test_loss: 1.3058, test_f1: 0.2281
 epoch: 37, train_loss: 1.2533, test_loss: 1.3007, test_f1: 0.2281
 epoch: 38, train_loss: 1.2540, test_loss: 1.3013, test_f1: 0.2281
 epoch: 39, train_loss: 1.2549, test_loss: 1.3057, test_f1: 0.2281
 epoch: 40, train_loss: 1.2549, test_loss: 1.3168, test_f1: 0.2281
 epoch: 41, train_loss: 1.2544, test_loss: 1.3091, test_f1: 0.2281
 epoch: 42, train_loss: 1.2530, test_loss: 1.3062, test_f1: 0.2281
 epoch: 43, train_loss: 1.2529, test_loss: 1.3083, test_f1: 0.2281
 epoch: 44, train_loss: 1.2527, test_loss: 1.3041, test_f1: 0.2281
 epoch: 45, train_loss: 1.2523, test_loss: 1.3044, test_f1: 0.2281
 epoch: 46, train_loss: 1.2530, test_loss: 1.3069, test_f1: 0.2281
 epoch: 47, train_loss: 1.2543, test_loss: 1.3073, test_f1: 0.2281
 epoch: 48, train_loss: 1.2531, test_loss: 1.3050, test_f1: 0.2281
 epoch: 49, train_loss: 1.2547, test_loss: 1.3066, test_f1: 0.2281
 epoch: 50, train_loss: 1.2535, test_loss: 1.3071, test_f1: 0.2281
 epoch: 51, train_loss: 1.2534, test_loss: 1.3047, test_f1: 0.2281
 epoch: 52, train_loss: 1.2523, test_loss: 1.3043, test_f1: 0.2281
 epoch: 53, train_loss: 1.2520, test_loss: 1.3072, test_f1: 0.2281
 epoch: 54, train_loss: 1.2524, test_loss: 1.3069, test_f1: 0.2281
 epoch: 55, train_loss: 1.2525, test_loss: 1.3059, test_f1: 0.2281
 epoch: 56, train_loss: 1.2519, test_loss: 1.3047, test_f1: 0.2281
 epoch: 57, train_loss: 1.2528, test_loss: 1.3064, test_f1: 0.2281
 epoch: 58, train_loss: 1.2526, test_loss: 1.3039, test_f1: 0.2281
 epoch: 59, train_loss: 1.2528, test_loss: 1.3055, test_f1: 0.2281
 epoch: 60, train_loss: 1.2526, test_loss: 1.3077, test_f1: 0.2281
 epoch: 61, train_loss: 1.2530, test_loss: 1.3090, test_f1: 0.2281
 epoch: 62, train_loss: 1.2528, test_loss: 1.3068, test_f1: 0.2281
 epoch: 63, train_loss: 1.2522, test_loss: 1.3052, test_f1: 0.2281
 epoch: 64, train_loss: 1.2522, test_loss: 1.3020, test_f1: 0.2281
 epoch: 65, train_loss: 1.2527, test_loss: 1.3021, test_f1: 0.2281
 epoch: 66, train_loss: 1.2522, test_loss: 1.3053, test_f1: 0.2281
 epoch: 67, train_loss: 1.2521, test_loss: 1.3083, test_f1: 0.2281
 epoch: 68, train_loss: 1.2528, test_loss: 1.3077, test_f1: 0.2281
 epoch: 69, train_loss: 1.2526, test_loss: 1.3038, test_f1: 0.2281
 epoch: 70, train_loss: 1.2519, test_loss: 1.3014, test_f1: 0.2281
 epoch: 71, train_loss: 1.2525, test_loss: 1.3016, test_f1: 0.2281
 epoch: 72, train_loss: 1.2520, test_loss: 1.3025, test_f1: 0.2281
 epoch: 73, train_loss: 1.2529, test_loss: 1.3051, test_f1: 0.2281
 epoch: 74, train_loss: 1.2529, test_loss: 1.3067, test_f1: 0.2281
 epoch: 75, train_loss: 1.2522, test_loss: 1.3054, test_f1: 0.2281
 epoch: 76, train_loss: 1.2524, test_loss: 1.3043, test_f1: 0.2281
 epoch: 77, train_loss: 1.2521, test_loss: 1.3041, test_f1: 0.2281
 epoch: 78, train_loss: 1.2521, test_loss: 1.3039, test_f1: 0.2281
 epoch: 79, train_loss: 1.2522, test_loss: 1.3038, test_f1: 0.2281
 epoch: 80, train_loss: 1.2523, test_loss: 1.3054, test_f1: 0.2281
 epoch: 81, train_loss: 1.2520, test_loss: 1.3066, test_f1: 0.2281
 epoch: 82, train_loss: 1.2525, test_loss: 1.3097, test_f1: 0.2281
 epoch: 83, train_loss: 1.2525, test_loss: 1.3065, test_f1: 0.2281
 epoch: 84, train_loss: 1.2527, test_loss: 1.3062, test_f1: 0.2281
 epoch: 85, train_loss: 1.2538, test_loss: 1.3058, test_f1: 0.2281
 epoch: 86, train_loss: 1.2530, test_loss: 1.3073, test_f1: 0.2281
 epoch: 87, train_loss: 1.2522, test_loss: 1.3074, test_f1: 0.2281
 epoch: 88, train_loss: 1.2525, test_loss: 1.3058, test_f1: 0.2281
 epoch: 89, train_loss: 1.2522, test_loss: 1.3056, test_f1: 0.2281
 epoch: 90, train_loss: 1.2523, test_loss: 1.3060, test_f1: 0.2281
 epoch: 91, train_loss: 1.2526, test_loss: 1.3057, test_f1: 0.2281
 epoch: 92, train_loss: 1.2522, test_loss: 1.3034, test_f1: 0.2281
 epoch: 93, train_loss: 1.2531, test_loss: 1.3026, test_f1: 0.2281
 epoch: 94, train_loss: 1.2534, test_loss: 1.3047, test_f1: 0.2281
 epoch: 95, train_loss: 1.2537, test_loss: 1.3060, test_f1: 0.2281
 epoch: 96, train_loss: 1.2534, test_loss: 1.3064, test_f1: 0.2281
 epoch: 97, train_loss: 1.2528, test_loss: 1.3059, test_f1: 0.2281
 epoch: 98, train_loss: 1.2527, test_loss: 1.3049, test_f1: 0.2281
 epoch: 99, train_loss: 1.2523, test_loss: 1.3023, test_f1: 0.2281
##################ITERATION #9 ****************************************
 epoch: 0, train_loss: 1.2550, test_loss: 1.3132, test_f1: 0.1365
 epoch: 1, train_loss: 1.2545, test_loss: 1.3048, test_f1: 0.2281
 epoch: 2, train_loss: 1.2530, test_loss: 1.3007, test_f1: 0.2281
 epoch: 3, train_loss: 1.2536, test_loss: 1.3012, test_f1: 0.2281
 epoch: 4, train_loss: 1.2524, test_loss: 1.3064, test_f1: 0.2281
 epoch: 5, train_loss: 1.2527, test_loss: 1.3086, test_f1: 0.2281
 epoch: 6, train_loss: 1.2535, test_loss: 1.3080, test_f1: 0.2281
 epoch: 7, train_loss: 1.2539, test_loss: 1.3028, test_f1: 0.2281
 epoch: 8, train_loss: 1.2533, test_loss: 1.3076, test_f1: 0.2281
 epoch: 9, train_loss: 1.2520, test_loss: 1.3054, test_f1: 0.2281
 epoch: 10, train_loss: 1.2535, test_loss: 1.3063, test_f1: 0.2281
 epoch: 11, train_loss: 1.2542, test_loss: 1.3020, test_f1: 0.2281
 epoch: 12, train_loss: 1.2530, test_loss: 1.3019, test_f1: 0.2281
 epoch: 13, train_loss: 1.2524, test_loss: 1.3058, test_f1: 0.2281
 epoch: 14, train_loss: 1.2528, test_loss: 1.3088, test_f1: 0.2281
 epoch: 15, train_loss: 1.2528, test_loss: 1.3068, test_f1: 0.2281
 epoch: 16, train_loss: 1.2527, test_loss: 1.3007, test_f1: 0.2281
 epoch: 17, train_loss: 1.2528, test_loss: 1.3052, test_f1: 0.2281
 epoch: 18, train_loss: 1.2532, test_loss: 1.3069, test_f1: 0.2281
 epoch: 19, train_loss: 1.2526, test_loss: 1.3105, test_f1: 0.2281
 epoch: 20, train_loss: 1.2537, test_loss: 1.3101, test_f1: 0.2281
 epoch: 21, train_loss: 1.2528, test_loss: 1.3038, test_f1: 0.2281
 epoch: 22, train_loss: 1.2535, test_loss: 1.3000, test_f1: 0.2281
 epoch: 23, train_loss: 1.2537, test_loss: 1.2998, test_f1: 0.2281
 epoch: 24, train_loss: 1.2544, test_loss: 1.3075, test_f1: 0.2281
 epoch: 25, train_loss: 1.2524, test_loss: 1.3085, test_f1: 0.2281
 epoch: 26, train_loss: 1.2527, test_loss: 1.3037, test_f1: 0.2281
 epoch: 27, train_loss: 1.2531, test_loss: 1.3038, test_f1: 0.2281
 epoch: 28, train_loss: 1.2523, test_loss: 1.3038, test_f1: 0.2281
 epoch: 29, train_loss: 1.2522, test_loss: 1.3066, test_f1: 0.2281
 epoch: 30, train_loss: 1.2526, test_loss: 1.3059, test_f1: 0.2281
 epoch: 31, train_loss: 1.2522, test_loss: 1.3050, test_f1: 0.2281
 epoch: 32, train_loss: 1.2533, test_loss: 1.3075, test_f1: 0.2281
 epoch: 33, train_loss: 1.2527, test_loss: 1.3031, test_f1: 0.2281
 epoch: 34, train_loss: 1.2527, test_loss: 1.3048, test_f1: 0.2281
 epoch: 35, train_loss: 1.2524, test_loss: 1.3021, test_f1: 0.2281
 epoch: 36, train_loss: 1.2527, test_loss: 1.3014, test_f1: 0.2281
 epoch: 37, train_loss: 1.2536, test_loss: 1.3051, test_f1: 0.2281
 epoch: 38, train_loss: 1.2534, test_loss: 1.3049, test_f1: 0.2281
 epoch: 39, train_loss: 1.2542, test_loss: 1.3037, test_f1: 0.2281
 epoch: 40, train_loss: 1.2527, test_loss: 1.3059, test_f1: 0.2281
 epoch: 41, train_loss: 1.2538, test_loss: 1.3075, test_f1: 0.2281
 epoch: 42, train_loss: 1.2546, test_loss: 1.3070, test_f1: 0.2281
 epoch: 43, train_loss: 1.2539, test_loss: 1.3065, test_f1: 0.2281
 epoch: 44, train_loss: 1.2522, test_loss: 1.3051, test_f1: 0.2281
 epoch: 45, train_loss: 1.2528, test_loss: 1.3042, test_f1: 0.2281
 epoch: 46, train_loss: 1.2522, test_loss: 1.3078, test_f1: 0.2281
 epoch: 47, train_loss: 1.2533, test_loss: 1.3103, test_f1: 0.2281
 epoch: 48, train_loss: 1.2535, test_loss: 1.3111, test_f1: 0.2281
 epoch: 49, train_loss: 1.2548, test_loss: 1.3109, test_f1: 0.2281
 epoch: 50, train_loss: 1.2532, test_loss: 1.3027, test_f1: 0.2281
 epoch: 51, train_loss: 1.2524, test_loss: 1.3013, test_f1: 0.2281
 epoch: 52, train_loss: 1.2534, test_loss: 1.3027, test_f1: 0.2281
 epoch: 53, train_loss: 1.2542, test_loss: 1.3054, test_f1: 0.2281
 epoch: 54, train_loss: 1.2537, test_loss: 1.3051, test_f1: 0.2281
 epoch: 55, train_loss: 1.2531, test_loss: 1.3042, test_f1: 0.2281
 epoch: 56, train_loss: 1.2523, test_loss: 1.3054, test_f1: 0.2281
 epoch: 57, train_loss: 1.2522, test_loss: 1.3039, test_f1: 0.2281
 epoch: 58, train_loss: 1.2524, test_loss: 1.3024, test_f1: 0.2281
 epoch: 59, train_loss: 1.2523, test_loss: 1.3030, test_f1: 0.2281
 epoch: 60, train_loss: 1.2523, test_loss: 1.3022, test_f1: 0.2281
 epoch: 61, train_loss: 1.2522, test_loss: 1.3022, test_f1: 0.2281
 epoch: 62, train_loss: 1.2523, test_loss: 1.3036, test_f1: 0.2281
 epoch: 63, train_loss: 1.2522, test_loss: 1.3051, test_f1: 0.2281
 epoch: 64, train_loss: 1.2527, test_loss: 1.3054, test_f1: 0.2281
 epoch: 65, train_loss: 1.2529, test_loss: 1.3055, test_f1: 0.2281
 epoch: 66, train_loss: 1.2526, test_loss: 1.3033, test_f1: 0.2281
 epoch: 67, train_loss: 1.2529, test_loss: 1.3028, test_f1: 0.2281
 epoch: 68, train_loss: 1.2528, test_loss: 1.3039, test_f1: 0.2281
 epoch: 69, train_loss: 1.2526, test_loss: 1.3053, test_f1: 0.2281
 epoch: 70, train_loss: 1.2523, test_loss: 1.3073, test_f1: 0.2281
 epoch: 71, train_loss: 1.2527, test_loss: 1.3080, test_f1: 0.2281
 epoch: 72, train_loss: 1.2535, test_loss: 1.3046, test_f1: 0.2281
 epoch: 73, train_loss: 1.2526, test_loss: 1.3024, test_f1: 0.2281
 epoch: 74, train_loss: 1.2535, test_loss: 1.3053, test_f1: 0.2281
 epoch: 75, train_loss: 1.2529, test_loss: 1.3055, test_f1: 0.2281
 epoch: 76, train_loss: 1.2522, test_loss: 1.3057, test_f1: 0.2281
 epoch: 77, train_loss: 1.2531, test_loss: 1.3061, test_f1: 0.2281
 epoch: 78, train_loss: 1.2528, test_loss: 1.3050, test_f1: 0.2281
 epoch: 79, train_loss: 1.2527, test_loss: 1.3042, test_f1: 0.2281
 epoch: 80, train_loss: 1.2522, test_loss: 1.3052, test_f1: 0.2281
 epoch: 81, train_loss: 1.2523, test_loss: 1.3070, test_f1: 0.2281
 epoch: 82, train_loss: 1.2521, test_loss: 1.3060, test_f1: 0.2281
 epoch: 83, train_loss: 1.2521, test_loss: 1.3034, test_f1: 0.2281
 epoch: 84, train_loss: 1.2521, test_loss: 1.3032, test_f1: 0.2281
 epoch: 85, train_loss: 1.2522, test_loss: 1.3031, test_f1: 0.2281
 epoch: 86, train_loss: 1.2524, test_loss: 1.3029, test_f1: 0.2281
 epoch: 87, train_loss: 1.2525, test_loss: 1.3041, test_f1: 0.2281
 epoch: 88, train_loss: 1.2521, test_loss: 1.3039, test_f1: 0.2281
 epoch: 89, train_loss: 1.2529, test_loss: 1.3041, test_f1: 0.2281
 epoch: 90, train_loss: 1.2524, test_loss: 1.3043, test_f1: 0.2281
 epoch: 91, train_loss: 1.2525, test_loss: 1.3038, test_f1: 0.2281
 epoch: 92, train_loss: 1.2529, test_loss: 1.3065, test_f1: 0.2281
 epoch: 93, train_loss: 1.2525, test_loss: 1.3083, test_f1: 0.2281
 epoch: 94, train_loss: 1.2526, test_loss: 1.3084, test_f1: 0.2281
 epoch: 95, train_loss: 1.2524, test_loss: 1.3077, test_f1: 0.2281
 epoch: 96, train_loss: 1.2524, test_loss: 1.3066, test_f1: 0.2281
 epoch: 97, train_loss: 1.2523, test_loss: 1.3059, test_f1: 0.2281
 epoch: 98, train_loss: 1.2533, test_loss: 1.3050, test_f1: 0.2281
 epoch: 99, train_loss: 1.2525, test_loss: 1.3020, test_f1: 0.2281

Training completed in 302.59 seconds
Best F1: 0.4852 at epoch 77
Mean F1 across iterations: 0.3319  0.0942
========================FINAL RESULTS================================
FEGIN weighted F1: 0.4852  0.0942
python main.py --data ltspice_demos --representation component_pin_net --model FEGIN --layers 3 --hiddens 32 --batch_size 256 --lr 0.1 --emb_size 128 --epochs 100 --save_appendix component_pin_net_L3_H32_BS256_LR0.1_E128 --no_val
-----



STDERR:
  File "main.py", line 370, in <module>
    main()
  File "main.py", line 254, in main
    dataset = dataset_class(
  File "/home/philip/projects/ltspice_examples_code_repo/Circuit-Completion-Using-GNNs/component_classification_with_link_prediction_head/evaluation/FEGIN/kernel/circuit_datasets.py", line 15, in __init__
    self.data, self.slices = torch.load(self.processed_paths[0])
  File "/home/philip/.local/lib/python3.8/site-packages/torch/serialization.py", line 1040, in load
    warnings.warn(
  File "/usr/lib/python3.8/warnings.py", line 109, in _showwarnmsg
    sw(msg.message, msg.category, msg.filename, msg.lineno,
  File "main.py", line 47, in warn_with_traceback
    traceback.print_stack(file=log)
/home/philip/projects/ltspice_examples_code_repo/Circuit-Completion-Using-GNNs/component_classification_with_link_prediction_head/evaluation/FEGIN/kernel/circuit_datasets.py:15: FutureWarning: You are using `torch.load` with `weights_only=False` (the current default value), which uses the default pickle module implicitly. It is possible to construct malicious pickle data which will execute arbitrary code during unpickling (See https://github.com/pytorch/pytorch/blob/main/SECURITY.md#untrusted-models for more details). In a future release, the default value for `weights_only` will be flipped to `True`. This limits the functions that could be executed during unpickling. Arbitrary objects will no longer be allowed to be loaded via this mode unless they are explicitly allowlisted by the user via `torch.serialization.add_safe_globals`. We recommend you start setting `weights_only=True` for any use case where you don't have full control of the loaded file. Please open an issue on GitHub for any issues related to this experimental feature.
  self.data, self.slices = torch.load(self.processed_paths[0])
