STDOUT:
Results will be saved in /home/philip/projects/ltspice_examples_code_repo/Circuit-Completion-Using-GNNs/component_classification_with_link_prediction_head/evaluation/FEGIN/results/model_FEGIN_dataset_ltspice_demos
Command line input: python main.py --data ltspice_demos --representation component_pin --model FEGIN --layers 2 --hiddens 128 --batch_size 128 --lr 0.001 --emb_size 250 --epochs 100 --save_appendix component_pin_L2_H128_BS128_LR0.001_E250 --no_val
 is saved.
-----
ltspice_demos - FEGIN
Using 2 layers, 128 hidden units, h = 2
Loading component_pin representation dataset
ENTERED
Training FEGIN on component_pin representation
Train: 1565, Test: 383
##################ITERATION #0 ****************************************
 epoch: 0, train_loss: 1.2919, test_loss: 1.3060, test_f1: 0.3083
 epoch: 1, train_loss: 1.1478, test_loss: 1.2782, test_f1: 0.2868
 epoch: 2, train_loss: 1.0631, test_loss: 1.2601, test_f1: 0.3480
 epoch: 3, train_loss: 0.9855, test_loss: 1.2430, test_f1: 0.3757
 epoch: 4, train_loss: 0.9230, test_loss: 1.1231, test_f1: 0.4757
 epoch: 5, train_loss: 0.8912, test_loss: 1.0336, test_f1: 0.5691
 epoch: 6, train_loss: 0.8392, test_loss: 0.9885, test_f1: 0.5874
 epoch: 7, train_loss: 0.8121, test_loss: 0.9771, test_f1: 0.5696
 epoch: 8, train_loss: 0.7713, test_loss: 1.0094, test_f1: 0.5609
 epoch: 9, train_loss: 0.7611, test_loss: 1.0489, test_f1: 0.5088
 epoch: 10, train_loss: 0.7285, test_loss: 1.0648, test_f1: 0.5725
 epoch: 11, train_loss: 0.6978, test_loss: 1.0104, test_f1: 0.5662
 epoch: 12, train_loss: 0.6871, test_loss: 1.1748, test_f1: 0.5251
 epoch: 13, train_loss: 0.6480, test_loss: 1.0777, test_f1: 0.5563
 epoch: 14, train_loss: 0.6709, test_loss: 1.0063, test_f1: 0.5896
 epoch: 15, train_loss: 0.6349, test_loss: 1.2387, test_f1: 0.5391
 epoch: 16, train_loss: 0.6195, test_loss: 0.9806, test_f1: 0.5780
 epoch: 17, train_loss: 0.6058, test_loss: 1.1942, test_f1: 0.5665
 epoch: 18, train_loss: 0.5562, test_loss: 0.9788, test_f1: 0.6447
 epoch: 19, train_loss: 0.5366, test_loss: 1.1191, test_f1: 0.5751
 epoch: 20, train_loss: 0.5203, test_loss: 1.1979, test_f1: 0.5899
 epoch: 21, train_loss: 0.5239, test_loss: 1.2369, test_f1: 0.5651
 epoch: 22, train_loss: 0.5510, test_loss: 1.2609, test_f1: 0.5843
 epoch: 23, train_loss: 0.5286, test_loss: 1.3855, test_f1: 0.4902
 epoch: 24, train_loss: 0.5256, test_loss: 1.1859, test_f1: 0.5896
 epoch: 25, train_loss: 0.5270, test_loss: 1.1644, test_f1: 0.5824
 epoch: 26, train_loss: 0.5033, test_loss: 1.1219, test_f1: 0.5985
 epoch: 27, train_loss: 0.4582, test_loss: 1.2263, test_f1: 0.5990
 epoch: 28, train_loss: 0.4671, test_loss: 1.3880, test_f1: 0.5932
 epoch: 29, train_loss: 0.4494, test_loss: 1.1977, test_f1: 0.6064
 epoch: 30, train_loss: 0.4538, test_loss: 1.1609, test_f1: 0.6115
 epoch: 31, train_loss: 0.4280, test_loss: 1.4640, test_f1: 0.6093
 epoch: 32, train_loss: 0.3883, test_loss: 1.6326, test_f1: 0.6298
 epoch: 33, train_loss: 0.3867, test_loss: 1.6579, test_f1: 0.5270
 epoch: 34, train_loss: 0.3657, test_loss: 1.7433, test_f1: 0.5272
 epoch: 35, train_loss: 0.3485, test_loss: 1.6264, test_f1: 0.5995
 epoch: 36, train_loss: 0.3417, test_loss: 1.7513, test_f1: 0.6003
 epoch: 37, train_loss: 0.3329, test_loss: 1.7601, test_f1: 0.6336
 epoch: 38, train_loss: 0.3501, test_loss: 1.7518, test_f1: 0.5748
 epoch: 39, train_loss: 0.3228, test_loss: 1.6319, test_f1: 0.6378
 epoch: 40, train_loss: 0.3285, test_loss: 1.9386, test_f1: 0.6174
 epoch: 41, train_loss: 0.3356, test_loss: 1.8256, test_f1: 0.5749
 epoch: 42, train_loss: 0.2969, test_loss: 1.7356, test_f1: 0.5954
 epoch: 43, train_loss: 0.2659, test_loss: 2.1274, test_f1: 0.6145
 epoch: 44, train_loss: 0.3035, test_loss: 1.7870, test_f1: 0.5723
 epoch: 45, train_loss: 0.2850, test_loss: 1.6634, test_f1: 0.6533
 epoch: 46, train_loss: 0.2861, test_loss: 2.0614, test_f1: 0.5686
 epoch: 47, train_loss: 0.3026, test_loss: 2.2024, test_f1: 0.5497
 epoch: 48, train_loss: 0.2729, test_loss: 1.9403, test_f1: 0.5936
 epoch: 49, train_loss: 0.2585, test_loss: 1.9394, test_f1: 0.6660
 epoch: 50, train_loss: 0.2357, test_loss: 1.8973, test_f1: 0.5915
 epoch: 51, train_loss: 0.2001, test_loss: 2.0119, test_f1: 0.5812
 epoch: 52, train_loss: 0.1997, test_loss: 2.1555, test_f1: 0.5719
 epoch: 53, train_loss: 0.2020, test_loss: 2.1978, test_f1: 0.6140
 epoch: 54, train_loss: 0.1737, test_loss: 2.0174, test_f1: 0.6106
 epoch: 55, train_loss: 0.1938, test_loss: 2.3248, test_f1: 0.6044
 epoch: 56, train_loss: 0.1763, test_loss: 2.1621, test_f1: 0.5795
 epoch: 57, train_loss: 0.1624, test_loss: 2.0425, test_f1: 0.6085
 epoch: 58, train_loss: 0.1663, test_loss: 1.9891, test_f1: 0.6023
 epoch: 59, train_loss: 0.1480, test_loss: 2.1322, test_f1: 0.6058
 epoch: 60, train_loss: 0.1712, test_loss: 1.9761, test_f1: 0.6093
 epoch: 61, train_loss: 0.1640, test_loss: 2.4774, test_f1: 0.6203
 epoch: 62, train_loss: 0.1775, test_loss: 2.3134, test_f1: 0.6056
 epoch: 63, train_loss: 0.1823, test_loss: 2.3076, test_f1: 0.5909
 epoch: 64, train_loss: 0.1504, test_loss: 2.1639, test_f1: 0.6251
 epoch: 65, train_loss: 0.1567, test_loss: 2.2684, test_f1: 0.6235
 epoch: 66, train_loss: 0.1340, test_loss: 2.3737, test_f1: 0.5868
 epoch: 67, train_loss: 0.1413, test_loss: 2.1885, test_f1: 0.6171
 epoch: 68, train_loss: 0.1461, test_loss: 2.3987, test_f1: 0.6015
 epoch: 69, train_loss: 0.1186, test_loss: 2.6419, test_f1: 0.5447
 epoch: 70, train_loss: 0.1083, test_loss: 2.2423, test_f1: 0.6258
 epoch: 71, train_loss: 0.1171, test_loss: 2.4313, test_f1: 0.6347
 epoch: 72, train_loss: 0.1045, test_loss: 2.3344, test_f1: 0.6111
 epoch: 73, train_loss: 0.1273, test_loss: 2.4475, test_f1: 0.6098
 epoch: 74, train_loss: 0.1415, test_loss: 2.6151, test_f1: 0.5915
 epoch: 75, train_loss: 0.1127, test_loss: 2.9561, test_f1: 0.5617
 epoch: 76, train_loss: 0.1026, test_loss: 2.7655, test_f1: 0.5712
 epoch: 77, train_loss: 0.0935, test_loss: 2.8880, test_f1: 0.5860
 epoch: 78, train_loss: 0.0788, test_loss: 2.9542, test_f1: 0.6002
 epoch: 79, train_loss: 0.0933, test_loss: 2.5399, test_f1: 0.5993
 epoch: 80, train_loss: 0.0972, test_loss: 2.4925, test_f1: 0.6014
 epoch: 81, train_loss: 0.1128, test_loss: 2.7126, test_f1: 0.5747
 epoch: 82, train_loss: 0.1064, test_loss: 2.6649, test_f1: 0.5693
 epoch: 83, train_loss: 0.1117, test_loss: 2.8932, test_f1: 0.5899
 epoch: 84, train_loss: 0.1178, test_loss: 2.3672, test_f1: 0.6254
 epoch: 85, train_loss: 0.1152, test_loss: 2.9234, test_f1: 0.5881
 epoch: 86, train_loss: 0.1022, test_loss: 3.0365, test_f1: 0.5804
 epoch: 87, train_loss: 0.1061, test_loss: 2.7709, test_f1: 0.5819
 epoch: 88, train_loss: 0.0920, test_loss: 3.1313, test_f1: 0.5758
 epoch: 89, train_loss: 0.0989, test_loss: 2.5289, test_f1: 0.6312
 epoch: 90, train_loss: 0.1058, test_loss: 2.7655, test_f1: 0.5999
 epoch: 91, train_loss: 0.1035, test_loss: 3.0787, test_f1: 0.5963
 epoch: 92, train_loss: 0.1241, test_loss: 3.1198, test_f1: 0.6132
 epoch: 93, train_loss: 0.1350, test_loss: 2.9562, test_f1: 0.5589
 epoch: 94, train_loss: 0.1101, test_loss: 2.8816, test_f1: 0.5788
 epoch: 95, train_loss: 0.0986, test_loss: 2.9715, test_f1: 0.6015
 epoch: 96, train_loss: 0.1143, test_loss: 2.7395, test_f1: 0.5969
 epoch: 97, train_loss: 0.1055, test_loss: 2.9524, test_f1: 0.5811
 epoch: 98, train_loss: 0.1040, test_loss: 2.9830, test_f1: 0.5825
 epoch: 99, train_loss: 0.1038, test_loss: 2.9501, test_f1: 0.6053
##################ITERATION #1 ****************************************
 epoch: 0, train_loss: 1.1685, test_loss: 1.2976, test_f1: 0.3412
 epoch: 1, train_loss: 0.9716, test_loss: 1.3187, test_f1: 0.3242
 epoch: 2, train_loss: 0.9154, test_loss: 1.1753, test_f1: 0.4724
 epoch: 3, train_loss: 0.8607, test_loss: 1.0080, test_f1: 0.5671
 epoch: 4, train_loss: 0.8197, test_loss: 0.9627, test_f1: 0.5607
 epoch: 5, train_loss: 0.7642, test_loss: 0.9596, test_f1: 0.5782
 epoch: 6, train_loss: 0.7276, test_loss: 1.0495, test_f1: 0.5594
 epoch: 7, train_loss: 0.7102, test_loss: 1.1107, test_f1: 0.5825
 epoch: 8, train_loss: 0.7068, test_loss: 1.1192, test_f1: 0.5136
 epoch: 9, train_loss: 0.6493, test_loss: 1.0332, test_f1: 0.5773
 epoch: 10, train_loss: 0.6280, test_loss: 1.1008, test_f1: 0.5769
 epoch: 11, train_loss: 0.6241, test_loss: 1.0779, test_f1: 0.5676
 epoch: 12, train_loss: 0.6090, test_loss: 1.1491, test_f1: 0.5262
 epoch: 13, train_loss: 0.5756, test_loss: 1.3714, test_f1: 0.5368
 epoch: 14, train_loss: 0.6012, test_loss: 1.1593, test_f1: 0.6035
 epoch: 15, train_loss: 0.5418, test_loss: 1.0825, test_f1: 0.5901
 epoch: 16, train_loss: 0.5526, test_loss: 1.1428, test_f1: 0.5649
 epoch: 17, train_loss: 0.5225, test_loss: 1.1921, test_f1: 0.5499
 epoch: 18, train_loss: 0.5346, test_loss: 1.0792, test_f1: 0.6396
 epoch: 19, train_loss: 0.5060, test_loss: 1.3316, test_f1: 0.5764
 epoch: 20, train_loss: 0.4973, test_loss: 1.2185, test_f1: 0.5945
 epoch: 21, train_loss: 0.4640, test_loss: 1.1599, test_f1: 0.6407
 epoch: 22, train_loss: 0.4597, test_loss: 1.3060, test_f1: 0.6565
 epoch: 23, train_loss: 0.4833, test_loss: 1.3141, test_f1: 0.6247
 epoch: 24, train_loss: 0.4612, test_loss: 1.2095, test_f1: 0.6022
 epoch: 25, train_loss: 0.4134, test_loss: 1.3688, test_f1: 0.5724
 epoch: 26, train_loss: 0.4349, test_loss: 1.2971, test_f1: 0.6184
 epoch: 27, train_loss: 0.4124, test_loss: 1.5894, test_f1: 0.6226
 epoch: 28, train_loss: 0.3857, test_loss: 1.3574, test_f1: 0.6121
 epoch: 29, train_loss: 0.3870, test_loss: 1.7409, test_f1: 0.5905
 epoch: 30, train_loss: 0.3809, test_loss: 1.3967, test_f1: 0.6243
 epoch: 31, train_loss: 0.3726, test_loss: 1.5207, test_f1: 0.6292
 epoch: 32, train_loss: 0.3373, test_loss: 1.5080, test_f1: 0.6093
 epoch: 33, train_loss: 0.3284, test_loss: 1.6579, test_f1: 0.5714
 epoch: 34, train_loss: 0.3661, test_loss: 1.5341, test_f1: 0.6235
 epoch: 35, train_loss: 0.3467, test_loss: 1.5813, test_f1: 0.6276
 epoch: 36, train_loss: 0.3342, test_loss: 1.9578, test_f1: 0.5977
 epoch: 37, train_loss: 0.3466, test_loss: 1.9779, test_f1: 0.5999
 epoch: 38, train_loss: 0.3157, test_loss: 1.7760, test_f1: 0.5991
 epoch: 39, train_loss: 0.2828, test_loss: 1.8913, test_f1: 0.6132
 epoch: 40, train_loss: 0.2911, test_loss: 2.0990, test_f1: 0.5735
 epoch: 41, train_loss: 0.2963, test_loss: 1.8330, test_f1: 0.6671
 epoch: 42, train_loss: 0.2650, test_loss: 1.8552, test_f1: 0.6385
 epoch: 43, train_loss: 0.2661, test_loss: 1.9687, test_f1: 0.5595
 epoch: 44, train_loss: 0.2514, test_loss: 1.8800, test_f1: 0.6580
 epoch: 45, train_loss: 0.2597, test_loss: 2.0949, test_f1: 0.6242
 epoch: 46, train_loss: 0.2619, test_loss: 1.9595, test_f1: 0.6091
 epoch: 47, train_loss: 0.2307, test_loss: 2.0841, test_f1: 0.6229
 epoch: 48, train_loss: 0.2135, test_loss: 2.2520, test_f1: 0.6221
 epoch: 49, train_loss: 0.1996, test_loss: 2.0823, test_f1: 0.6545
 epoch: 50, train_loss: 0.1877, test_loss: 2.2135, test_f1: 0.6365
 epoch: 51, train_loss: 0.1774, test_loss: 2.1938, test_f1: 0.6582
 epoch: 52, train_loss: 0.1678, test_loss: 2.2740, test_f1: 0.6555
 epoch: 53, train_loss: 0.1687, test_loss: 2.3078, test_f1: 0.6401
 epoch: 54, train_loss: 0.1543, test_loss: 2.2434, test_f1: 0.6137
 epoch: 55, train_loss: 0.1506, test_loss: 2.2897, test_f1: 0.6267
 epoch: 56, train_loss: 0.1480, test_loss: 2.1504, test_f1: 0.6147
 epoch: 57, train_loss: 0.1612, test_loss: 2.6060, test_f1: 0.5942
 epoch: 58, train_loss: 0.1512, test_loss: 2.7563, test_f1: 0.5852
 epoch: 59, train_loss: 0.1314, test_loss: 2.2643, test_f1: 0.6249
 epoch: 60, train_loss: 0.1251, test_loss: 2.5131, test_f1: 0.6518
 epoch: 61, train_loss: 0.1332, test_loss: 2.6348, test_f1: 0.6119
 epoch: 62, train_loss: 0.1156, test_loss: 2.5144, test_f1: 0.6277
 epoch: 63, train_loss: 0.1381, test_loss: 2.4378, test_f1: 0.6115
 epoch: 64, train_loss: 0.1176, test_loss: 2.5339, test_f1: 0.6323
 epoch: 65, train_loss: 0.0923, test_loss: 2.7802, test_f1: 0.6156
 epoch: 66, train_loss: 0.1079, test_loss: 2.8258, test_f1: 0.6132
 epoch: 67, train_loss: 0.1562, test_loss: 2.9377, test_f1: 0.6113
 epoch: 68, train_loss: 0.1279, test_loss: 2.6203, test_f1: 0.6092
 epoch: 69, train_loss: 0.1057, test_loss: 2.8815, test_f1: 0.6126
 epoch: 70, train_loss: 0.0995, test_loss: 2.7359, test_f1: 0.5990
 epoch: 71, train_loss: 0.1197, test_loss: 2.5609, test_f1: 0.6305
 epoch: 72, train_loss: 0.1068, test_loss: 2.5898, test_f1: 0.6130
 epoch: 73, train_loss: 0.1023, test_loss: 2.9006, test_f1: 0.5860
 epoch: 74, train_loss: 0.0888, test_loss: 2.6749, test_f1: 0.6194
 epoch: 75, train_loss: 0.0914, test_loss: 2.9838, test_f1: 0.5906
 epoch: 76, train_loss: 0.0885, test_loss: 2.7449, test_f1: 0.6013
 epoch: 77, train_loss: 0.0961, test_loss: 2.8601, test_f1: 0.5966
 epoch: 78, train_loss: 0.1190, test_loss: 2.8467, test_f1: 0.6110
 epoch: 79, train_loss: 0.1010, test_loss: 3.1686, test_f1: 0.5787
 epoch: 80, train_loss: 0.0959, test_loss: 2.8894, test_f1: 0.6421
 epoch: 81, train_loss: 0.0875, test_loss: 2.7039, test_f1: 0.6288
 epoch: 82, train_loss: 0.0766, test_loss: 2.8500, test_f1: 0.6446
 epoch: 83, train_loss: 0.0843, test_loss: 2.8059, test_f1: 0.5853
 epoch: 84, train_loss: 0.0992, test_loss: 2.7196, test_f1: 0.6186
 epoch: 85, train_loss: 0.0964, test_loss: 2.7767, test_f1: 0.6151
 epoch: 86, train_loss: 0.0749, test_loss: 3.1254, test_f1: 0.6248
 epoch: 87, train_loss: 0.1044, test_loss: 2.9809, test_f1: 0.6092
 epoch: 88, train_loss: 0.0985, test_loss: 2.8319, test_f1: 0.6411
 epoch: 89, train_loss: 0.0892, test_loss: 2.9928, test_f1: 0.6340
 epoch: 90, train_loss: 0.0836, test_loss: 2.7632, test_f1: 0.6476
 epoch: 91, train_loss: 0.0997, test_loss: 3.1226, test_f1: 0.5820
 epoch: 92, train_loss: 0.1271, test_loss: 3.4378, test_f1: 0.5814
 epoch: 93, train_loss: 0.0678, test_loss: 3.3109, test_f1: 0.6232
 epoch: 94, train_loss: 0.0667, test_loss: 3.0305, test_f1: 0.6243
 epoch: 95, train_loss: 0.1040, test_loss: 3.3045, test_f1: 0.5964
 epoch: 96, train_loss: 0.1186, test_loss: 3.3008, test_f1: 0.5807
 epoch: 97, train_loss: 0.0917, test_loss: 2.8559, test_f1: 0.6059
 epoch: 98, train_loss: 0.0794, test_loss: 3.1786, test_f1: 0.5868
 epoch: 99, train_loss: 0.0803, test_loss: 3.2060, test_f1: 0.6008
##################ITERATION #2 ****************************************
 epoch: 0, train_loss: 1.1309, test_loss: 1.3443, test_f1: 0.2870
 epoch: 1, train_loss: 0.9754, test_loss: 1.2855, test_f1: 0.2336
 epoch: 2, train_loss: 0.9112, test_loss: 1.1133, test_f1: 0.4307
 epoch: 3, train_loss: 0.8618, test_loss: 1.0921, test_f1: 0.4943
 epoch: 4, train_loss: 0.8226, test_loss: 1.0254, test_f1: 0.5381
 epoch: 5, train_loss: 0.7767, test_loss: 1.0275, test_f1: 0.5744
 epoch: 6, train_loss: 0.7372, test_loss: 1.0077, test_f1: 0.5909
 epoch: 7, train_loss: 0.7287, test_loss: 1.0942, test_f1: 0.4948
 epoch: 8, train_loss: 0.7014, test_loss: 0.9949, test_f1: 0.6241
 epoch: 9, train_loss: 0.7110, test_loss: 1.0038, test_f1: 0.6054
 epoch: 10, train_loss: 0.6714, test_loss: 1.0664, test_f1: 0.5031
 epoch: 11, train_loss: 0.6241, test_loss: 1.1007, test_f1: 0.6027
 epoch: 12, train_loss: 0.6253, test_loss: 1.1104, test_f1: 0.5081
 epoch: 13, train_loss: 0.5928, test_loss: 1.1252, test_f1: 0.6559
 epoch: 14, train_loss: 0.5742, test_loss: 1.1267, test_f1: 0.6419
 epoch: 15, train_loss: 0.5549, test_loss: 1.1877, test_f1: 0.6035
 epoch: 16, train_loss: 0.5402, test_loss: 1.4086, test_f1: 0.5682
 epoch: 17, train_loss: 0.5453, test_loss: 1.1126, test_f1: 0.6293
 epoch: 18, train_loss: 0.5154, test_loss: 1.2949, test_f1: 0.5842
 epoch: 19, train_loss: 0.5012, test_loss: 1.1125, test_f1: 0.6352
 epoch: 20, train_loss: 0.4936, test_loss: 1.4243, test_f1: 0.5854
 epoch: 21, train_loss: 0.4703, test_loss: 1.2332, test_f1: 0.6453
 epoch: 22, train_loss: 0.4403, test_loss: 1.4504, test_f1: 0.6498
 epoch: 23, train_loss: 0.4473, test_loss: 1.5494, test_f1: 0.5149
 epoch: 24, train_loss: 0.4721, test_loss: 1.3255, test_f1: 0.6344
 epoch: 25, train_loss: 0.4710, test_loss: 1.5688, test_f1: 0.5765
 epoch: 26, train_loss: 0.4490, test_loss: 2.0326, test_f1: 0.5224
 epoch: 27, train_loss: 0.4152, test_loss: 1.5914, test_f1: 0.6075
 epoch: 28, train_loss: 0.3927, test_loss: 1.4125, test_f1: 0.6323
 epoch: 29, train_loss: 0.3737, test_loss: 1.2778, test_f1: 0.6210
 epoch: 30, train_loss: 0.3907, test_loss: 1.6569, test_f1: 0.6410
 epoch: 31, train_loss: 0.3702, test_loss: 1.5439, test_f1: 0.6132
 epoch: 32, train_loss: 0.3439, test_loss: 1.5398, test_f1: 0.6222
 epoch: 33, train_loss: 0.3116, test_loss: 1.5681, test_f1: 0.6265
 epoch: 34, train_loss: 0.2988, test_loss: 1.6212, test_f1: 0.6053
 epoch: 35, train_loss: 0.3354, test_loss: 1.8261, test_f1: 0.6181
 epoch: 36, train_loss: 0.3539, test_loss: 1.4857, test_f1: 0.6295
 epoch: 37, train_loss: 0.3015, test_loss: 1.9146, test_f1: 0.6000
 epoch: 38, train_loss: 0.3072, test_loss: 1.9337, test_f1: 0.5741
 epoch: 39, train_loss: 0.3543, test_loss: 1.8231, test_f1: 0.6302
 epoch: 40, train_loss: 0.3574, test_loss: 1.9309, test_f1: 0.6061
 epoch: 41, train_loss: 0.3306, test_loss: 1.6171, test_f1: 0.6304
 epoch: 42, train_loss: 0.3143, test_loss: 1.6113, test_f1: 0.6234
 epoch: 43, train_loss: 0.3096, test_loss: 1.7293, test_f1: 0.6177
 epoch: 44, train_loss: 0.3082, test_loss: 2.0924, test_f1: 0.5421
 epoch: 45, train_loss: 0.2829, test_loss: 1.9735, test_f1: 0.5886
 epoch: 46, train_loss: 0.2596, test_loss: 1.6055, test_f1: 0.6349
 epoch: 47, train_loss: 0.2654, test_loss: 1.9483, test_f1: 0.5546
 epoch: 48, train_loss: 0.2686, test_loss: 1.7713, test_f1: 0.6450
 epoch: 49, train_loss: 0.2451, test_loss: 1.9758, test_f1: 0.6183
 epoch: 50, train_loss: 0.2271, test_loss: 1.7041, test_f1: 0.5888
 epoch: 51, train_loss: 0.2380, test_loss: 1.9433, test_f1: 0.6219
 epoch: 52, train_loss: 0.1769, test_loss: 2.0101, test_f1: 0.6221
 epoch: 53, train_loss: 0.1630, test_loss: 1.9216, test_f1: 0.6378
 epoch: 54, train_loss: 0.1514, test_loss: 2.2712, test_f1: 0.6065
 epoch: 55, train_loss: 0.1440, test_loss: 2.1784, test_f1: 0.6118
 epoch: 56, train_loss: 0.1447, test_loss: 2.3721, test_f1: 0.5933
 epoch: 57, train_loss: 0.1380, test_loss: 2.2546, test_f1: 0.6220
 epoch: 58, train_loss: 0.1407, test_loss: 2.4152, test_f1: 0.6114
 epoch: 59, train_loss: 0.1669, test_loss: 2.3344, test_f1: 0.5945
 epoch: 60, train_loss: 0.1285, test_loss: 2.1775, test_f1: 0.6393
 epoch: 61, train_loss: 0.1162, test_loss: 2.3636, test_f1: 0.6156
 epoch: 62, train_loss: 0.1307, test_loss: 2.4824, test_f1: 0.5841
 epoch: 63, train_loss: 0.1288, test_loss: 2.3743, test_f1: 0.6059
 epoch: 64, train_loss: 0.1392, test_loss: 2.5898, test_f1: 0.6164
 epoch: 65, train_loss: 0.1378, test_loss: 2.4835, test_f1: 0.6203
 epoch: 66, train_loss: 0.1088, test_loss: 2.7430, test_f1: 0.5746
 epoch: 67, train_loss: 0.1256, test_loss: 2.4524, test_f1: 0.6018
 epoch: 68, train_loss: 0.1170, test_loss: 2.4603, test_f1: 0.6217
 epoch: 69, train_loss: 0.1416, test_loss: 2.5376, test_f1: 0.6225
 epoch: 70, train_loss: 0.1289, test_loss: 2.7120, test_f1: 0.6141
 epoch: 71, train_loss: 0.1043, test_loss: 2.6454, test_f1: 0.6090
 epoch: 72, train_loss: 0.1095, test_loss: 2.7110, test_f1: 0.6068
 epoch: 73, train_loss: 0.1352, test_loss: 2.7016, test_f1: 0.6053
 epoch: 74, train_loss: 0.1195, test_loss: 2.6779, test_f1: 0.6070
 epoch: 75, train_loss: 0.0906, test_loss: 2.6519, test_f1: 0.5954
 epoch: 76, train_loss: 0.1155, test_loss: 2.7776, test_f1: 0.5939
 epoch: 77, train_loss: 0.1033, test_loss: 2.8202, test_f1: 0.6004
 epoch: 78, train_loss: 0.1178, test_loss: 2.6324, test_f1: 0.6416
 epoch: 79, train_loss: 0.0997, test_loss: 2.8642, test_f1: 0.5689
 epoch: 80, train_loss: 0.1238, test_loss: 2.9394, test_f1: 0.5839
 epoch: 81, train_loss: 0.1178, test_loss: 3.0879, test_f1: 0.6075
 epoch: 82, train_loss: 0.1059, test_loss: 2.7069, test_f1: 0.6026
 epoch: 83, train_loss: 0.0959, test_loss: 2.8154, test_f1: 0.6176
 epoch: 84, train_loss: 0.1028, test_loss: 2.9707, test_f1: 0.5877
 epoch: 85, train_loss: 0.0809, test_loss: 2.9930, test_f1: 0.5872
 epoch: 86, train_loss: 0.1026, test_loss: 3.2355, test_f1: 0.6047
 epoch: 87, train_loss: 0.0916, test_loss: 3.0841, test_f1: 0.6041
 epoch: 88, train_loss: 0.0914, test_loss: 3.1004, test_f1: 0.5947
 epoch: 89, train_loss: 0.1075, test_loss: 2.7837, test_f1: 0.6270
 epoch: 90, train_loss: 0.1037, test_loss: 2.8290, test_f1: 0.6110
 epoch: 91, train_loss: 0.1036, test_loss: 2.8299, test_f1: 0.5884
 epoch: 92, train_loss: 0.0851, test_loss: 3.0671, test_f1: 0.6075
 epoch: 93, train_loss: 0.1049, test_loss: 3.0773, test_f1: 0.6024
 epoch: 94, train_loss: 0.1546, test_loss: 3.4708, test_f1: 0.6057
 epoch: 95, train_loss: 0.1410, test_loss: 2.9976, test_f1: 0.5819
 epoch: 96, train_loss: 0.1005, test_loss: 2.6615, test_f1: 0.6135
 epoch: 97, train_loss: 0.0891, test_loss: 3.1886, test_f1: 0.6055
 epoch: 98, train_loss: 0.0797, test_loss: 3.1629, test_f1: 0.5889
 epoch: 99, train_loss: 0.0647, test_loss: 3.1956, test_f1: 0.5973
##################ITERATION #3 ****************************************
 epoch: 0, train_loss: 1.1329, test_loss: 1.3453, test_f1: 0.3030
 epoch: 1, train_loss: 0.9383, test_loss: 1.3877, test_f1: 0.2399
 epoch: 2, train_loss: 0.8676, test_loss: 1.2689, test_f1: 0.3862
 epoch: 3, train_loss: 0.8229, test_loss: 1.0771, test_f1: 0.5177
 epoch: 4, train_loss: 0.7936, test_loss: 1.0222, test_f1: 0.5900
 epoch: 5, train_loss: 0.7441, test_loss: 1.1387, test_f1: 0.5779
 epoch: 6, train_loss: 0.7285, test_loss: 0.9576, test_f1: 0.6008
 epoch: 7, train_loss: 0.7103, test_loss: 1.0633, test_f1: 0.5830
 epoch: 8, train_loss: 0.6834, test_loss: 1.0016, test_f1: 0.5812
 epoch: 9, train_loss: 0.6599, test_loss: 1.0621, test_f1: 0.5985
 epoch: 10, train_loss: 0.6570, test_loss: 1.0890, test_f1: 0.5668
 epoch: 11, train_loss: 0.6453, test_loss: 0.9945, test_f1: 0.6166
 epoch: 12, train_loss: 0.6290, test_loss: 1.0893, test_f1: 0.6017
 epoch: 13, train_loss: 0.5998, test_loss: 1.0072, test_f1: 0.5665
 epoch: 14, train_loss: 0.5952, test_loss: 1.4907, test_f1: 0.5879
 epoch: 15, train_loss: 0.5648, test_loss: 1.1676, test_f1: 0.6107
 epoch: 16, train_loss: 0.5692, test_loss: 1.0941, test_f1: 0.6137
 epoch: 17, train_loss: 0.5505, test_loss: 1.0733, test_f1: 0.5799
 epoch: 18, train_loss: 0.5271, test_loss: 1.1763, test_f1: 0.6215
 epoch: 19, train_loss: 0.5062, test_loss: 1.2720, test_f1: 0.5966
 epoch: 20, train_loss: 0.4891, test_loss: 1.1199, test_f1: 0.5960
 epoch: 21, train_loss: 0.4806, test_loss: 1.3980, test_f1: 0.5724
 epoch: 22, train_loss: 0.4501, test_loss: 1.1930, test_f1: 0.6325
 epoch: 23, train_loss: 0.4620, test_loss: 1.2228, test_f1: 0.6362
 epoch: 24, train_loss: 0.4732, test_loss: 1.1623, test_f1: 0.5940
 epoch: 25, train_loss: 0.4167, test_loss: 1.0606, test_f1: 0.6693
 epoch: 26, train_loss: 0.3904, test_loss: 1.2452, test_f1: 0.6238
 epoch: 27, train_loss: 0.3883, test_loss: 1.3318, test_f1: 0.5840
 epoch: 28, train_loss: 0.3791, test_loss: 1.4951, test_f1: 0.6444
 epoch: 29, train_loss: 0.3578, test_loss: 1.3607, test_f1: 0.6209
 epoch: 30, train_loss: 0.3968, test_loss: 1.5101, test_f1: 0.5882
 epoch: 31, train_loss: 0.4031, test_loss: 1.7940, test_f1: 0.5793
 epoch: 32, train_loss: 0.3949, test_loss: 1.3768, test_f1: 0.6239
 epoch: 33, train_loss: 0.3785, test_loss: 1.4094, test_f1: 0.6566
 epoch: 34, train_loss: 0.3674, test_loss: 1.2750, test_f1: 0.6638
 epoch: 35, train_loss: 0.3313, test_loss: 1.3272, test_f1: 0.6298
 epoch: 36, train_loss: 0.3209, test_loss: 1.6749, test_f1: 0.6224
 epoch: 37, train_loss: 0.3189, test_loss: 1.3745, test_f1: 0.6522
 epoch: 38, train_loss: 0.2835, test_loss: 1.6457, test_f1: 0.5946
 epoch: 39, train_loss: 0.3140, test_loss: 1.4417, test_f1: 0.6650
 epoch: 40, train_loss: 0.2878, test_loss: 1.5280, test_f1: 0.6341
 epoch: 41, train_loss: 0.2727, test_loss: 1.5593, test_f1: 0.6336
 epoch: 42, train_loss: 0.2732, test_loss: 1.4671, test_f1: 0.6505
 epoch: 43, train_loss: 0.2772, test_loss: 1.8438, test_f1: 0.6070
 epoch: 44, train_loss: 0.2839, test_loss: 1.9336, test_f1: 0.6406
 epoch: 45, train_loss: 0.3003, test_loss: 1.6406, test_f1: 0.6294
 epoch: 46, train_loss: 0.3139, test_loss: 1.4395, test_f1: 0.6645
 epoch: 47, train_loss: 0.2718, test_loss: 2.2436, test_f1: 0.5415
 epoch: 48, train_loss: 0.2877, test_loss: 1.6690, test_f1: 0.6282
 epoch: 49, train_loss: 0.3016, test_loss: 1.7269, test_f1: 0.6212
 epoch: 50, train_loss: 0.2530, test_loss: 1.5715, test_f1: 0.6084
 epoch: 51, train_loss: 0.2315, test_loss: 1.5161, test_f1: 0.6323
 epoch: 52, train_loss: 0.2112, test_loss: 1.7080, test_f1: 0.6210
 epoch: 53, train_loss: 0.1821, test_loss: 1.6835, test_f1: 0.6219
 epoch: 54, train_loss: 0.1628, test_loss: 1.8927, test_f1: 0.6257
 epoch: 55, train_loss: 0.1651, test_loss: 1.7675, test_f1: 0.6368
 epoch: 56, train_loss: 0.1706, test_loss: 1.8988, test_f1: 0.6245
 epoch: 57, train_loss: 0.1605, test_loss: 1.8361, test_f1: 0.6497
 epoch: 58, train_loss: 0.1547, test_loss: 2.0363, test_f1: 0.6560
 epoch: 59, train_loss: 0.1478, test_loss: 1.9540, test_f1: 0.6364
 epoch: 60, train_loss: 0.1348, test_loss: 2.0130, test_f1: 0.6211
 epoch: 61, train_loss: 0.1368, test_loss: 2.0204, test_f1: 0.6486
 epoch: 62, train_loss: 0.1518, test_loss: 2.0556, test_f1: 0.6235
 epoch: 63, train_loss: 0.1531, test_loss: 2.1229, test_f1: 0.6034
 epoch: 64, train_loss: 0.1199, test_loss: 1.9491, test_f1: 0.6345
 epoch: 65, train_loss: 0.1202, test_loss: 2.2736, test_f1: 0.6244
 epoch: 66, train_loss: 0.1239, test_loss: 2.2660, test_f1: 0.6189
 epoch: 67, train_loss: 0.1419, test_loss: 2.3639, test_f1: 0.6199
 epoch: 68, train_loss: 0.1369, test_loss: 2.3081, test_f1: 0.6082
 epoch: 69, train_loss: 0.1202, test_loss: 2.4299, test_f1: 0.6263
 epoch: 70, train_loss: 0.1324, test_loss: 2.4755, test_f1: 0.6200
 epoch: 71, train_loss: 0.1243, test_loss: 2.1564, test_f1: 0.6389
 epoch: 72, train_loss: 0.1213, test_loss: 2.0949, test_f1: 0.6159
 epoch: 73, train_loss: 0.1568, test_loss: 2.3558, test_f1: 0.6265
 epoch: 74, train_loss: 0.1400, test_loss: 2.4644, test_f1: 0.6289
 epoch: 75, train_loss: 0.1266, test_loss: 2.2711, test_f1: 0.6230
 epoch: 76, train_loss: 0.1332, test_loss: 2.6023, test_f1: 0.6247
 epoch: 77, train_loss: 0.1091, test_loss: 2.3409, test_f1: 0.6310
 epoch: 78, train_loss: 0.1146, test_loss: 2.1542, test_f1: 0.6225
 epoch: 79, train_loss: 0.0995, test_loss: 2.2953, test_f1: 0.6265
 epoch: 80, train_loss: 0.1021, test_loss: 2.6944, test_f1: 0.6087
 epoch: 81, train_loss: 0.0974, test_loss: 2.4343, test_f1: 0.6291
 epoch: 82, train_loss: 0.1152, test_loss: 2.5166, test_f1: 0.6526
 epoch: 83, train_loss: 0.1063, test_loss: 2.3697, test_f1: 0.6343
 epoch: 84, train_loss: 0.1085, test_loss: 2.4646, test_f1: 0.6180
 epoch: 85, train_loss: 0.0964, test_loss: 2.5623, test_f1: 0.6342
 epoch: 86, train_loss: 0.0763, test_loss: 2.2685, test_f1: 0.6168
 epoch: 87, train_loss: 0.0872, test_loss: 2.2552, test_f1: 0.6304
 epoch: 88, train_loss: 0.0813, test_loss: 2.4397, test_f1: 0.6169
 epoch: 89, train_loss: 0.0739, test_loss: 2.5294, test_f1: 0.6285
 epoch: 90, train_loss: 0.1032, test_loss: 2.5797, test_f1: 0.6089
 epoch: 91, train_loss: 0.1460, test_loss: 2.8938, test_f1: 0.6091
 epoch: 92, train_loss: 0.1119, test_loss: 3.0203, test_f1: 0.6273
 epoch: 93, train_loss: 0.1198, test_loss: 2.3553, test_f1: 0.6221
 epoch: 94, train_loss: 0.1092, test_loss: 2.5359, test_f1: 0.6113
 epoch: 95, train_loss: 0.0895, test_loss: 2.3409, test_f1: 0.6250
 epoch: 96, train_loss: 0.0981, test_loss: 2.3307, test_f1: 0.6410
 epoch: 97, train_loss: 0.0959, test_loss: 2.3841, test_f1: 0.6389
 epoch: 98, train_loss: 0.1020, test_loss: 2.7002, test_f1: 0.6302
 epoch: 99, train_loss: 0.1176, test_loss: 2.4063, test_f1: 0.6016
##################ITERATION #4 ****************************************
 epoch: 0, train_loss: 1.2520, test_loss: 1.3732, test_f1: 0.1745
 epoch: 1, train_loss: 0.9947, test_loss: 1.3852, test_f1: 0.3473
 epoch: 2, train_loss: 0.9299, test_loss: 1.3108, test_f1: 0.3420
 epoch: 3, train_loss: 0.8746, test_loss: 1.1821, test_f1: 0.4946
 epoch: 4, train_loss: 0.8200, test_loss: 1.1598, test_f1: 0.4973
 epoch: 5, train_loss: 0.7960, test_loss: 1.0428, test_f1: 0.5501
 epoch: 6, train_loss: 0.7659, test_loss: 1.0851, test_f1: 0.5112
 epoch: 7, train_loss: 0.7428, test_loss: 1.0123, test_f1: 0.5965
 epoch: 8, train_loss: 0.7210, test_loss: 1.0411, test_f1: 0.5529
 epoch: 9, train_loss: 0.6756, test_loss: 1.0373, test_f1: 0.5724
 epoch: 10, train_loss: 0.6528, test_loss: 1.0377, test_f1: 0.6009
 epoch: 11, train_loss: 0.6313, test_loss: 1.0046, test_f1: 0.5536
 epoch: 12, train_loss: 0.6021, test_loss: 1.2150, test_f1: 0.5287
 epoch: 13, train_loss: 0.6060, test_loss: 0.9977, test_f1: 0.6016
 epoch: 14, train_loss: 0.6035, test_loss: 1.2065, test_f1: 0.5671
 epoch: 15, train_loss: 0.5598, test_loss: 1.1971, test_f1: 0.5907
 epoch: 16, train_loss: 0.5567, test_loss: 1.1480, test_f1: 0.5663
 epoch: 17, train_loss: 0.5390, test_loss: 1.1317, test_f1: 0.6361
 epoch: 18, train_loss: 0.5094, test_loss: 1.2438, test_f1: 0.6001
 epoch: 19, train_loss: 0.5006, test_loss: 1.1731, test_f1: 0.5841
 epoch: 20, train_loss: 0.4950, test_loss: 1.2144, test_f1: 0.5711
 epoch: 21, train_loss: 0.4680, test_loss: 1.0630, test_f1: 0.6280
 epoch: 22, train_loss: 0.4511, test_loss: 1.2318, test_f1: 0.6184
 epoch: 23, train_loss: 0.4426, test_loss: 1.2986, test_f1: 0.5634
 epoch: 24, train_loss: 0.3990, test_loss: 1.3763, test_f1: 0.6155
 epoch: 25, train_loss: 0.3808, test_loss: 1.4943, test_f1: 0.5849
 epoch: 26, train_loss: 0.4232, test_loss: 1.4727, test_f1: 0.5632
 epoch: 27, train_loss: 0.4272, test_loss: 1.3300, test_f1: 0.6126
 epoch: 28, train_loss: 0.3990, test_loss: 1.4103, test_f1: 0.6250
 epoch: 29, train_loss: 0.3924, test_loss: 1.5775, test_f1: 0.5280
 epoch: 30, train_loss: 0.3889, test_loss: 1.6042, test_f1: 0.5449
 epoch: 31, train_loss: 0.3973, test_loss: 1.5193, test_f1: 0.5918
 epoch: 32, train_loss: 0.3942, test_loss: 1.6503, test_f1: 0.6314
 epoch: 33, train_loss: 0.3658, test_loss: 1.4426, test_f1: 0.6382
 epoch: 34, train_loss: 0.3415, test_loss: 1.4039, test_f1: 0.6285
 epoch: 35, train_loss: 0.3682, test_loss: 1.4759, test_f1: 0.6259
 epoch: 36, train_loss: 0.3357, test_loss: 1.3707, test_f1: 0.6466
 epoch: 37, train_loss: 0.3191, test_loss: 1.6283, test_f1: 0.5967
 epoch: 38, train_loss: 0.3048, test_loss: 1.5312, test_f1: 0.6101
 epoch: 39, train_loss: 0.3041, test_loss: 1.7311, test_f1: 0.5910
 epoch: 40, train_loss: 0.2916, test_loss: 1.7814, test_f1: 0.6477
 epoch: 41, train_loss: 0.3161, test_loss: 2.2050, test_f1: 0.5387
 epoch: 42, train_loss: 0.3069, test_loss: 1.7517, test_f1: 0.5652
 epoch: 43, train_loss: 0.2897, test_loss: 1.4523, test_f1: 0.6127
 epoch: 44, train_loss: 0.2633, test_loss: 1.6474, test_f1: 0.6514
 epoch: 45, train_loss: 0.2796, test_loss: 1.7523, test_f1: 0.6441
 epoch: 46, train_loss: 0.3209, test_loss: 1.6158, test_f1: 0.6175
 epoch: 47, train_loss: 0.2944, test_loss: 1.8145, test_f1: 0.6026
 epoch: 48, train_loss: 0.2962, test_loss: 1.9172, test_f1: 0.6167
 epoch: 49, train_loss: 0.2459, test_loss: 1.8812, test_f1: 0.6013
 epoch: 50, train_loss: 0.2617, test_loss: 1.8563, test_f1: 0.6631
 epoch: 51, train_loss: 0.2157, test_loss: 2.0001, test_f1: 0.6481
 epoch: 52, train_loss: 0.1912, test_loss: 2.0639, test_f1: 0.6389
 epoch: 53, train_loss: 0.1751, test_loss: 2.1026, test_f1: 0.6033
 epoch: 54, train_loss: 0.1905, test_loss: 2.0738, test_f1: 0.6289
 epoch: 55, train_loss: 0.1628, test_loss: 1.9236, test_f1: 0.6157
 epoch: 56, train_loss: 0.1515, test_loss: 2.2049, test_f1: 0.6081
 epoch: 57, train_loss: 0.1594, test_loss: 2.2586, test_f1: 0.6091
 epoch: 58, train_loss: 0.1620, test_loss: 2.2159, test_f1: 0.6300
 epoch: 59, train_loss: 0.1803, test_loss: 2.3255, test_f1: 0.6224
 epoch: 60, train_loss: 0.1666, test_loss: 2.3752, test_f1: 0.6028
 epoch: 61, train_loss: 0.1354, test_loss: 2.3441, test_f1: 0.6130
 epoch: 62, train_loss: 0.1519, test_loss: 2.2494, test_f1: 0.6146
 epoch: 63, train_loss: 0.1362, test_loss: 2.5094, test_f1: 0.5908
 epoch: 64, train_loss: 0.1417, test_loss: 2.3791, test_f1: 0.6204
 epoch: 65, train_loss: 0.1356, test_loss: 2.3347, test_f1: 0.6320
 epoch: 66, train_loss: 0.1345, test_loss: 2.3853, test_f1: 0.6236
 epoch: 67, train_loss: 0.1304, test_loss: 2.6366, test_f1: 0.6107
 epoch: 68, train_loss: 0.1349, test_loss: 2.7774, test_f1: 0.6040
 epoch: 69, train_loss: 0.1450, test_loss: 2.4911, test_f1: 0.6268
 epoch: 70, train_loss: 0.1531, test_loss: 2.5165, test_f1: 0.6280
 epoch: 71, train_loss: 0.1380, test_loss: 2.6077, test_f1: 0.5989
 epoch: 72, train_loss: 0.1498, test_loss: 2.4515, test_f1: 0.6484
 epoch: 73, train_loss: 0.1574, test_loss: 2.5466, test_f1: 0.6271
 epoch: 74, train_loss: 0.1309, test_loss: 2.7887, test_f1: 0.5848
 epoch: 75, train_loss: 0.1283, test_loss: 2.5776, test_f1: 0.6204
 epoch: 76, train_loss: 0.1157, test_loss: 2.5769, test_f1: 0.6177
 epoch: 77, train_loss: 0.1179, test_loss: 2.7193, test_f1: 0.6352
 epoch: 78, train_loss: 0.1391, test_loss: 2.6178, test_f1: 0.6227
 epoch: 79, train_loss: 0.1118, test_loss: 2.7340, test_f1: 0.5983
 epoch: 80, train_loss: 0.1066, test_loss: 2.7451, test_f1: 0.6164
 epoch: 81, train_loss: 0.1003, test_loss: 2.5622, test_f1: 0.6316
 epoch: 82, train_loss: 0.1080, test_loss: 2.9505, test_f1: 0.5678
 epoch: 83, train_loss: 0.1308, test_loss: 2.6238, test_f1: 0.6320
 epoch: 84, train_loss: 0.0998, test_loss: 2.8862, test_f1: 0.6250
 epoch: 85, train_loss: 0.1103, test_loss: 2.8740, test_f1: 0.6067
 epoch: 86, train_loss: 0.0934, test_loss: 2.9605, test_f1: 0.6254
 epoch: 87, train_loss: 0.0741, test_loss: 2.9174, test_f1: 0.6290
 epoch: 88, train_loss: 0.0833, test_loss: 2.8034, test_f1: 0.6291
 epoch: 89, train_loss: 0.0847, test_loss: 2.8420, test_f1: 0.6199
 epoch: 90, train_loss: 0.0907, test_loss: 3.1560, test_f1: 0.5941
 epoch: 91, train_loss: 0.1302, test_loss: 3.1850, test_f1: 0.5923
 epoch: 92, train_loss: 0.1437, test_loss: 3.2262, test_f1: 0.5908
 epoch: 93, train_loss: 0.1191, test_loss: 3.0633, test_f1: 0.5816
 epoch: 94, train_loss: 0.1458, test_loss: 2.8873, test_f1: 0.5885
 epoch: 95, train_loss: 0.1590, test_loss: 2.7123, test_f1: 0.5940
 epoch: 96, train_loss: 0.1549, test_loss: 2.8291, test_f1: 0.6214
 epoch: 97, train_loss: 0.1234, test_loss: 2.6266, test_f1: 0.6013
 epoch: 98, train_loss: 0.1062, test_loss: 2.7851, test_f1: 0.6208
 epoch: 99, train_loss: 0.0949, test_loss: 2.9253, test_f1: 0.6437
##################ITERATION #5 ****************************************
 epoch: 0, train_loss: 1.2658, test_loss: 1.4432, test_f1: 0.2655
 epoch: 1, train_loss: 1.0094, test_loss: 1.3933, test_f1: 0.2710
 epoch: 2, train_loss: 0.9179, test_loss: 1.3203, test_f1: 0.3132
 epoch: 3, train_loss: 0.8591, test_loss: 1.1676, test_f1: 0.4479
 epoch: 4, train_loss: 0.8015, test_loss: 1.0893, test_f1: 0.5614
 epoch: 5, train_loss: 0.7797, test_loss: 1.0437, test_f1: 0.5575
 epoch: 6, train_loss: 0.7522, test_loss: 1.0029, test_f1: 0.5932
 epoch: 7, train_loss: 0.7187, test_loss: 1.0360, test_f1: 0.5504
 epoch: 8, train_loss: 0.6920, test_loss: 1.1152, test_f1: 0.5131
 epoch: 9, train_loss: 0.6732, test_loss: 1.0010, test_f1: 0.5494
 epoch: 10, train_loss: 0.6379, test_loss: 0.9906, test_f1: 0.6007
 epoch: 11, train_loss: 0.6235, test_loss: 1.1068, test_f1: 0.5434
 epoch: 12, train_loss: 0.6256, test_loss: 1.1609, test_f1: 0.5047
 epoch: 13, train_loss: 0.6214, test_loss: 1.0629, test_f1: 0.5473
 epoch: 14, train_loss: 0.5944, test_loss: 1.0641, test_f1: 0.5720
 epoch: 15, train_loss: 0.5712, test_loss: 1.2285, test_f1: 0.5208
 epoch: 16, train_loss: 0.5744, test_loss: 1.2641, test_f1: 0.5353
 epoch: 17, train_loss: 0.5642, test_loss: 1.1144, test_f1: 0.5980
 epoch: 18, train_loss: 0.5288, test_loss: 1.1286, test_f1: 0.5897
 epoch: 19, train_loss: 0.5076, test_loss: 1.1378, test_f1: 0.6139
 epoch: 20, train_loss: 0.4841, test_loss: 1.1268, test_f1: 0.6201
 epoch: 21, train_loss: 0.5014, test_loss: 1.1629, test_f1: 0.5984
 epoch: 22, train_loss: 0.4845, test_loss: 1.1548, test_f1: 0.6309
 epoch: 23, train_loss: 0.4641, test_loss: 1.3654, test_f1: 0.5046
 epoch: 24, train_loss: 0.4412, test_loss: 1.2932, test_f1: 0.6091
 epoch: 25, train_loss: 0.4029, test_loss: 1.5607, test_f1: 0.5641
 epoch: 26, train_loss: 0.4412, test_loss: 1.4944, test_f1: 0.5902
 epoch: 27, train_loss: 0.4598, test_loss: 1.3933, test_f1: 0.6118
 epoch: 28, train_loss: 0.4351, test_loss: 1.2792, test_f1: 0.6247
 epoch: 29, train_loss: 0.3813, test_loss: 1.7227, test_f1: 0.5891
 epoch: 30, train_loss: 0.3641, test_loss: 1.5254, test_f1: 0.5594
 epoch: 31, train_loss: 0.3809, test_loss: 1.6341, test_f1: 0.5598
 epoch: 32, train_loss: 0.4001, test_loss: 1.9923, test_f1: 0.5368
 epoch: 33, train_loss: 0.3543, test_loss: 1.6617, test_f1: 0.5921
 epoch: 34, train_loss: 0.3630, test_loss: 1.5733, test_f1: 0.6187
 epoch: 35, train_loss: 0.3533, test_loss: 1.6533, test_f1: 0.5735
 epoch: 36, train_loss: 0.3491, test_loss: 1.5567, test_f1: 0.5781
 epoch: 37, train_loss: 0.3181, test_loss: 1.6166, test_f1: 0.5948
 epoch: 38, train_loss: 0.3377, test_loss: 1.4704, test_f1: 0.6184
 epoch: 39, train_loss: 0.3743, test_loss: 1.6615, test_f1: 0.6141
 epoch: 40, train_loss: 0.3370, test_loss: 2.0804, test_f1: 0.5800
 epoch: 41, train_loss: 0.3472, test_loss: 1.7452, test_f1: 0.6049
 epoch: 42, train_loss: 0.2976, test_loss: 2.0688, test_f1: 0.5457
 epoch: 43, train_loss: 0.2874, test_loss: 1.8743, test_f1: 0.6122
 epoch: 44, train_loss: 0.3000, test_loss: 1.7448, test_f1: 0.6004
 epoch: 45, train_loss: 0.2735, test_loss: 1.8875, test_f1: 0.5761
 epoch: 46, train_loss: 0.2593, test_loss: 1.7603, test_f1: 0.5924
 epoch: 47, train_loss: 0.2428, test_loss: 1.9083, test_f1: 0.5727
 epoch: 48, train_loss: 0.2474, test_loss: 2.0687, test_f1: 0.5775
 epoch: 49, train_loss: 0.2349, test_loss: 1.8412, test_f1: 0.5894
 epoch: 50, train_loss: 0.2509, test_loss: 2.1525, test_f1: 0.5582
 epoch: 51, train_loss: 0.2387, test_loss: 1.7997, test_f1: 0.6115
 epoch: 52, train_loss: 0.2086, test_loss: 2.0579, test_f1: 0.5966
 epoch: 53, train_loss: 0.1822, test_loss: 1.9392, test_f1: 0.6051
 epoch: 54, train_loss: 0.1868, test_loss: 2.1725, test_f1: 0.5973
 epoch: 55, train_loss: 0.1741, test_loss: 2.2588, test_f1: 0.6010
 epoch: 56, train_loss: 0.1782, test_loss: 2.0921, test_f1: 0.6182
 epoch: 57, train_loss: 0.1617, test_loss: 1.9768, test_f1: 0.6349
 epoch: 58, train_loss: 0.1566, test_loss: 2.0770, test_f1: 0.6083
 epoch: 59, train_loss: 0.1479, test_loss: 2.2408, test_f1: 0.6187
 epoch: 60, train_loss: 0.1414, test_loss: 2.1907, test_f1: 0.6178
 epoch: 61, train_loss: 0.1516, test_loss: 2.3456, test_f1: 0.5858
 epoch: 62, train_loss: 0.1307, test_loss: 2.4112, test_f1: 0.6177
 epoch: 63, train_loss: 0.1555, test_loss: 2.4077, test_f1: 0.5883
 epoch: 64, train_loss: 0.1417, test_loss: 2.5156, test_f1: 0.5964
 epoch: 65, train_loss: 0.1554, test_loss: 2.3953, test_f1: 0.5695
 epoch: 66, train_loss: 0.1764, test_loss: 2.3571, test_f1: 0.6065
 epoch: 67, train_loss: 0.1539, test_loss: 2.4598, test_f1: 0.5953
 epoch: 68, train_loss: 0.1422, test_loss: 2.4465, test_f1: 0.6116
 epoch: 69, train_loss: 0.1410, test_loss: 2.3339, test_f1: 0.5932
 epoch: 70, train_loss: 0.1366, test_loss: 2.5710, test_f1: 0.5858
 epoch: 71, train_loss: 0.1457, test_loss: 2.3108, test_f1: 0.6064
 epoch: 72, train_loss: 0.1231, test_loss: 2.4583, test_f1: 0.6063
 epoch: 73, train_loss: 0.1112, test_loss: 2.2385, test_f1: 0.6088
 epoch: 74, train_loss: 0.1301, test_loss: 2.4801, test_f1: 0.5965
 epoch: 75, train_loss: 0.1303, test_loss: 2.6363, test_f1: 0.5802
 epoch: 76, train_loss: 0.1026, test_loss: 2.5114, test_f1: 0.5942
 epoch: 77, train_loss: 0.0941, test_loss: 2.4788, test_f1: 0.6024
 epoch: 78, train_loss: 0.1087, test_loss: 2.6631, test_f1: 0.5918
 epoch: 79, train_loss: 0.1065, test_loss: 2.4972, test_f1: 0.6139
 epoch: 80, train_loss: 0.1083, test_loss: 2.6269, test_f1: 0.6052
 epoch: 81, train_loss: 0.1180, test_loss: 2.5303, test_f1: 0.5993
 epoch: 82, train_loss: 0.1099, test_loss: 2.6361, test_f1: 0.5747
 epoch: 83, train_loss: 0.1250, test_loss: 2.6018, test_f1: 0.6069
 epoch: 84, train_loss: 0.1252, test_loss: 2.6931, test_f1: 0.5986
 epoch: 85, train_loss: 0.1089, test_loss: 2.5669, test_f1: 0.6304
 epoch: 86, train_loss: 0.1208, test_loss: 2.6003, test_f1: 0.6108
 epoch: 87, train_loss: 0.1122, test_loss: 2.7444, test_f1: 0.6053
 epoch: 88, train_loss: 0.0934, test_loss: 2.8902, test_f1: 0.6022
 epoch: 89, train_loss: 0.1041, test_loss: 2.4986, test_f1: 0.6109
 epoch: 90, train_loss: 0.1120, test_loss: 2.5493, test_f1: 0.6038
 epoch: 91, train_loss: 0.1385, test_loss: 2.8709, test_f1: 0.6372
 epoch: 92, train_loss: 0.1230, test_loss: 2.5866, test_f1: 0.5738
 epoch: 93, train_loss: 0.1271, test_loss: 3.0017, test_f1: 0.6127
 epoch: 94, train_loss: 0.1015, test_loss: 2.4144, test_f1: 0.6170
 epoch: 95, train_loss: 0.0990, test_loss: 2.6262, test_f1: 0.6122
 epoch: 96, train_loss: 0.1072, test_loss: 2.6753, test_f1: 0.6110
 epoch: 97, train_loss: 0.1427, test_loss: 2.7637, test_f1: 0.5738
 epoch: 98, train_loss: 0.1429, test_loss: 2.6615, test_f1: 0.6046
 epoch: 99, train_loss: 0.1067, test_loss: 2.6349, test_f1: 0.6022
##################ITERATION #6 ****************************************
 epoch: 0, train_loss: 1.2585, test_loss: 1.4267, test_f1: 0.2663
 epoch: 1, train_loss: 0.9985, test_loss: 1.3774, test_f1: 0.3142
 epoch: 2, train_loss: 0.9478, test_loss: 1.1806, test_f1: 0.4333
 epoch: 3, train_loss: 0.8817, test_loss: 1.1237, test_f1: 0.4865
 epoch: 4, train_loss: 0.8655, test_loss: 1.1279, test_f1: 0.5060
 epoch: 5, train_loss: 0.8091, test_loss: 1.0780, test_f1: 0.5307
 epoch: 6, train_loss: 0.7508, test_loss: 1.0520, test_f1: 0.5675
 epoch: 7, train_loss: 0.7114, test_loss: 1.0107, test_f1: 0.6261
 epoch: 8, train_loss: 0.6913, test_loss: 1.0431, test_f1: 0.6063
 epoch: 9, train_loss: 0.6943, test_loss: 0.8953, test_f1: 0.6521
 epoch: 10, train_loss: 0.6609, test_loss: 1.0651, test_f1: 0.6163
 epoch: 11, train_loss: 0.6485, test_loss: 1.0256, test_f1: 0.6088
 epoch: 12, train_loss: 0.6340, test_loss: 1.1052, test_f1: 0.6008
 epoch: 13, train_loss: 0.6026, test_loss: 0.9565, test_f1: 0.6470
 epoch: 14, train_loss: 0.5890, test_loss: 1.0809, test_f1: 0.6153
 epoch: 15, train_loss: 0.5576, test_loss: 1.1023, test_f1: 0.6144
 epoch: 16, train_loss: 0.5707, test_loss: 1.1441, test_f1: 0.5887
 epoch: 17, train_loss: 0.5273, test_loss: 0.9146, test_f1: 0.6742
 epoch: 18, train_loss: 0.5193, test_loss: 1.3681, test_f1: 0.5529
 epoch: 19, train_loss: 0.5539, test_loss: 1.1252, test_f1: 0.6516
 epoch: 20, train_loss: 0.5233, test_loss: 1.1398, test_f1: 0.6206
 epoch: 21, train_loss: 0.4855, test_loss: 1.1179, test_f1: 0.6300
 epoch: 22, train_loss: 0.5021, test_loss: 1.2527, test_f1: 0.5888
 epoch: 23, train_loss: 0.4592, test_loss: 1.2124, test_f1: 0.6049
 epoch: 24, train_loss: 0.4275, test_loss: 1.1033, test_f1: 0.6093
 epoch: 25, train_loss: 0.4109, test_loss: 1.3424, test_f1: 0.6528
 epoch: 26, train_loss: 0.4296, test_loss: 1.3432, test_f1: 0.5934
 epoch: 27, train_loss: 0.4267, test_loss: 1.3501, test_f1: 0.6083
 epoch: 28, train_loss: 0.4762, test_loss: 1.2887, test_f1: 0.5735
 epoch: 29, train_loss: 0.4346, test_loss: 1.2053, test_f1: 0.6381
 epoch: 30, train_loss: 0.3822, test_loss: 1.2750, test_f1: 0.5791
 epoch: 31, train_loss: 0.3879, test_loss: 1.2635, test_f1: 0.6313
 epoch: 32, train_loss: 0.3762, test_loss: 1.2802, test_f1: 0.6184
 epoch: 33, train_loss: 0.3870, test_loss: 1.7397, test_f1: 0.5670
 epoch: 34, train_loss: 0.4095, test_loss: 1.2357, test_f1: 0.6023
 epoch: 35, train_loss: 0.3624, test_loss: 1.3796, test_f1: 0.6456
 epoch: 36, train_loss: 0.3525, test_loss: 1.5023, test_f1: 0.6189
 epoch: 37, train_loss: 0.3613, test_loss: 1.2499, test_f1: 0.6135
 epoch: 38, train_loss: 0.3265, test_loss: 1.3921, test_f1: 0.6214
 epoch: 39, train_loss: 0.3214, test_loss: 1.5633, test_f1: 0.6109
 epoch: 40, train_loss: 0.3188, test_loss: 1.6093, test_f1: 0.6186
 epoch: 41, train_loss: 0.3359, test_loss: 1.3739, test_f1: 0.6742
 epoch: 42, train_loss: 0.3058, test_loss: 1.4065, test_f1: 0.6157
 epoch: 43, train_loss: 0.3510, test_loss: 1.7026, test_f1: 0.6174
 epoch: 44, train_loss: 0.2781, test_loss: 1.5569, test_f1: 0.6271
 epoch: 45, train_loss: 0.2773, test_loss: 1.7873, test_f1: 0.5769
 epoch: 46, train_loss: 0.2809, test_loss: 1.4487, test_f1: 0.6398
 epoch: 47, train_loss: 0.2599, test_loss: 1.4710, test_f1: 0.6197
 epoch: 48, train_loss: 0.2406, test_loss: 1.7587, test_f1: 0.6471
 epoch: 49, train_loss: 0.2940, test_loss: 1.6896, test_f1: 0.6215
 epoch: 50, train_loss: 0.3147, test_loss: 1.6860, test_f1: 0.6146
 epoch: 51, train_loss: 0.2795, test_loss: 1.5479, test_f1: 0.6636
 epoch: 52, train_loss: 0.2015, test_loss: 1.5039, test_f1: 0.6553
 epoch: 53, train_loss: 0.2062, test_loss: 1.6179, test_f1: 0.6313
 epoch: 54, train_loss: 0.1919, test_loss: 1.5883, test_f1: 0.6431
 epoch: 55, train_loss: 0.1766, test_loss: 1.7760, test_f1: 0.6310
 epoch: 56, train_loss: 0.1478, test_loss: 1.8102, test_f1: 0.6407
 epoch: 57, train_loss: 0.1715, test_loss: 1.8026, test_f1: 0.6485
 epoch: 58, train_loss: 0.1646, test_loss: 1.7572, test_f1: 0.6623
 epoch: 59, train_loss: 0.1655, test_loss: 1.8139, test_f1: 0.6551
 epoch: 60, train_loss: 0.1577, test_loss: 1.6589, test_f1: 0.6682
 epoch: 61, train_loss: 0.1269, test_loss: 1.9826, test_f1: 0.6466
 epoch: 62, train_loss: 0.1596, test_loss: 2.0138, test_f1: 0.6461
 epoch: 63, train_loss: 0.2077, test_loss: 1.7215, test_f1: 0.6171
 epoch: 64, train_loss: 0.2042, test_loss: 1.9245, test_f1: 0.6374
 epoch: 65, train_loss: 0.1672, test_loss: 1.9065, test_f1: 0.6360
 epoch: 66, train_loss: 0.1534, test_loss: 1.9100, test_f1: 0.6450
 epoch: 67, train_loss: 0.1760, test_loss: 2.1703, test_f1: 0.6481
 epoch: 68, train_loss: 0.1595, test_loss: 1.8378, test_f1: 0.6530
 epoch: 69, train_loss: 0.1683, test_loss: 1.8257, test_f1: 0.6361
 epoch: 70, train_loss: 0.1483, test_loss: 1.9747, test_f1: 0.6461
 epoch: 71, train_loss: 0.1374, test_loss: 1.9612, test_f1: 0.6358
 epoch: 72, train_loss: 0.1631, test_loss: 1.9006, test_f1: 0.6461
 epoch: 73, train_loss: 0.1827, test_loss: 2.0812, test_f1: 0.6060
 epoch: 74, train_loss: 0.1827, test_loss: 1.9795, test_f1: 0.6198
 epoch: 75, train_loss: 0.1709, test_loss: 2.1990, test_f1: 0.6205
 epoch: 76, train_loss: 0.1354, test_loss: 1.8175, test_f1: 0.6677
 epoch: 77, train_loss: 0.1294, test_loss: 1.8894, test_f1: 0.6522
 epoch: 78, train_loss: 0.1189, test_loss: 2.0022, test_f1: 0.6542
 epoch: 79, train_loss: 0.1168, test_loss: 1.8824, test_f1: 0.6571
 epoch: 80, train_loss: 0.1152, test_loss: 2.1815, test_f1: 0.6328
 epoch: 81, train_loss: 0.1231, test_loss: 2.1758, test_f1: 0.6145
 epoch: 82, train_loss: 0.1260, test_loss: 2.1636, test_f1: 0.6671
 epoch: 83, train_loss: 0.1369, test_loss: 2.2215, test_f1: 0.6272
 epoch: 84, train_loss: 0.1145, test_loss: 2.1566, test_f1: 0.6407
 epoch: 85, train_loss: 0.1023, test_loss: 2.0006, test_f1: 0.6603
 epoch: 86, train_loss: 0.0897, test_loss: 2.2734, test_f1: 0.6388
 epoch: 87, train_loss: 0.0950, test_loss: 2.2625, test_f1: 0.6493
 epoch: 88, train_loss: 0.0775, test_loss: 2.2969, test_f1: 0.6615
 epoch: 89, train_loss: 0.1018, test_loss: 2.2293, test_f1: 0.6658
 epoch: 90, train_loss: 0.0971, test_loss: 2.3530, test_f1: 0.6308
 epoch: 91, train_loss: 0.0898, test_loss: 2.4620, test_f1: 0.6061
 epoch: 92, train_loss: 0.1054, test_loss: 2.2703, test_f1: 0.6281
 epoch: 93, train_loss: 0.1556, test_loss: 2.3109, test_f1: 0.6445
 epoch: 94, train_loss: 0.1867, test_loss: 2.4340, test_f1: 0.6271
 epoch: 95, train_loss: 0.1983, test_loss: 2.1525, test_f1: 0.6402
 epoch: 96, train_loss: 0.1354, test_loss: 2.2626, test_f1: 0.6327
 epoch: 97, train_loss: 0.1145, test_loss: 2.5678, test_f1: 0.6273
 epoch: 98, train_loss: 0.0975, test_loss: 2.4292, test_f1: 0.6236
 epoch: 99, train_loss: 0.0910, test_loss: 2.3405, test_f1: 0.5961
##################ITERATION #7 ****************************************
 epoch: 0, train_loss: 1.4077, test_loss: 1.5459, test_f1: 0.2392
 epoch: 1, train_loss: 1.0444, test_loss: 1.3762, test_f1: 0.2611
 epoch: 2, train_loss: 0.9452, test_loss: 1.2634, test_f1: 0.3474
 epoch: 3, train_loss: 0.8834, test_loss: 1.2384, test_f1: 0.4083
 epoch: 4, train_loss: 0.8281, test_loss: 1.1199, test_f1: 0.5465
 epoch: 5, train_loss: 0.8062, test_loss: 1.0157, test_f1: 0.5529
 epoch: 6, train_loss: 0.7908, test_loss: 1.0042, test_f1: 0.5624
 epoch: 7, train_loss: 0.7628, test_loss: 0.9895, test_f1: 0.5665
 epoch: 8, train_loss: 0.7237, test_loss: 1.0630, test_f1: 0.5800
 epoch: 9, train_loss: 0.7023, test_loss: 1.0480, test_f1: 0.6178
 epoch: 10, train_loss: 0.6870, test_loss: 1.0428, test_f1: 0.6083
 epoch: 11, train_loss: 0.6380, test_loss: 1.0311, test_f1: 0.5788
 epoch: 12, train_loss: 0.6709, test_loss: 1.1491, test_f1: 0.5552
 epoch: 13, train_loss: 0.6226, test_loss: 1.2679, test_f1: 0.5156
 epoch: 14, train_loss: 0.6112, test_loss: 1.1694, test_f1: 0.6136
 epoch: 15, train_loss: 0.5944, test_loss: 1.0995, test_f1: 0.6472
 epoch: 16, train_loss: 0.5842, test_loss: 1.0815, test_f1: 0.6022
 epoch: 17, train_loss: 0.5749, test_loss: 1.5129, test_f1: 0.4684
 epoch: 18, train_loss: 0.6188, test_loss: 1.1844, test_f1: 0.5654
 epoch: 19, train_loss: 0.5620, test_loss: 1.2892, test_f1: 0.5831
 epoch: 20, train_loss: 0.5366, test_loss: 1.1488, test_f1: 0.6175
 epoch: 21, train_loss: 0.5043, test_loss: 1.3617, test_f1: 0.5770
 epoch: 22, train_loss: 0.5139, test_loss: 1.4542, test_f1: 0.5585
 epoch: 23, train_loss: 0.5079, test_loss: 1.1263, test_f1: 0.5856
 epoch: 24, train_loss: 0.4921, test_loss: 1.1461, test_f1: 0.5701
 epoch: 25, train_loss: 0.4985, test_loss: 1.1534, test_f1: 0.6171
 epoch: 26, train_loss: 0.4640, test_loss: 1.4207, test_f1: 0.5721
 epoch: 27, train_loss: 0.4661, test_loss: 1.1701, test_f1: 0.6337
 epoch: 28, train_loss: 0.4417, test_loss: 1.6767, test_f1: 0.5468
 epoch: 29, train_loss: 0.4327, test_loss: 1.2583, test_f1: 0.5980
 epoch: 30, train_loss: 0.4517, test_loss: 1.3916, test_f1: 0.5560
 epoch: 31, train_loss: 0.4281, test_loss: 1.4237, test_f1: 0.5609
 epoch: 32, train_loss: 0.4598, test_loss: 1.3224, test_f1: 0.5959
 epoch: 33, train_loss: 0.4264, test_loss: 1.2411, test_f1: 0.6182
 epoch: 34, train_loss: 0.3739, test_loss: 1.9386, test_f1: 0.5047
 epoch: 35, train_loss: 0.3743, test_loss: 1.5856, test_f1: 0.6127
 epoch: 36, train_loss: 0.3601, test_loss: 1.2212, test_f1: 0.6451
 epoch: 37, train_loss: 0.3465, test_loss: 1.4638, test_f1: 0.5986
 epoch: 38, train_loss: 0.3330, test_loss: 1.5637, test_f1: 0.6238
 epoch: 39, train_loss: 0.3777, test_loss: 1.6350, test_f1: 0.6323
 epoch: 40, train_loss: 0.3681, test_loss: 1.6536, test_f1: 0.6237
 epoch: 41, train_loss: 0.3501, test_loss: 1.3840, test_f1: 0.6129
 epoch: 42, train_loss: 0.3551, test_loss: 1.6769, test_f1: 0.5913
 epoch: 43, train_loss: 0.3193, test_loss: 1.5756, test_f1: 0.5761
 epoch: 44, train_loss: 0.3111, test_loss: 1.6105, test_f1: 0.6025
 epoch: 45, train_loss: 0.3322, test_loss: 1.5454, test_f1: 0.6097
 epoch: 46, train_loss: 0.3141, test_loss: 1.6599, test_f1: 0.6112
 epoch: 47, train_loss: 0.3013, test_loss: 1.6248, test_f1: 0.6268
 epoch: 48, train_loss: 0.3179, test_loss: 1.6572, test_f1: 0.6041
 epoch: 49, train_loss: 0.2802, test_loss: 1.7263, test_f1: 0.6163
 epoch: 50, train_loss: 0.2714, test_loss: 1.6136, test_f1: 0.6089
 epoch: 51, train_loss: 0.2767, test_loss: 1.7021, test_f1: 0.6427
 epoch: 52, train_loss: 0.2444, test_loss: 1.7764, test_f1: 0.6035
 epoch: 53, train_loss: 0.2163, test_loss: 1.6159, test_f1: 0.6279
 epoch: 54, train_loss: 0.2113, test_loss: 1.7127, test_f1: 0.6354
 epoch: 55, train_loss: 0.2055, test_loss: 1.7495, test_f1: 0.6059
 epoch: 56, train_loss: 0.2054, test_loss: 1.8926, test_f1: 0.5960
 epoch: 57, train_loss: 0.1909, test_loss: 2.0571, test_f1: 0.5819
 epoch: 58, train_loss: 0.2034, test_loss: 1.9987, test_f1: 0.6119
 epoch: 59, train_loss: 0.1840, test_loss: 2.1200, test_f1: 0.5997
 epoch: 60, train_loss: 0.1726, test_loss: 2.1810, test_f1: 0.5953
 epoch: 61, train_loss: 0.1679, test_loss: 1.9766, test_f1: 0.6306
 epoch: 62, train_loss: 0.1632, test_loss: 2.1823, test_f1: 0.6009
 epoch: 63, train_loss: 0.1728, test_loss: 2.2814, test_f1: 0.5741
 epoch: 64, train_loss: 0.2123, test_loss: 2.0580, test_f1: 0.5961
 epoch: 65, train_loss: 0.2060, test_loss: 2.0588, test_f1: 0.6083
 epoch: 66, train_loss: 0.2076, test_loss: 2.0035, test_f1: 0.6169
 epoch: 67, train_loss: 0.1956, test_loss: 2.1311, test_f1: 0.6125
 epoch: 68, train_loss: 0.1621, test_loss: 1.9036, test_f1: 0.6155
 epoch: 69, train_loss: 0.1545, test_loss: 2.2023, test_f1: 0.6055
 epoch: 70, train_loss: 0.1700, test_loss: 2.0506, test_f1: 0.6388
 epoch: 71, train_loss: 0.1408, test_loss: 2.3543, test_f1: 0.5917
 epoch: 72, train_loss: 0.1692, test_loss: 2.1865, test_f1: 0.5890
 epoch: 73, train_loss: 0.1392, test_loss: 2.2645, test_f1: 0.6223
 epoch: 74, train_loss: 0.1327, test_loss: 2.1896, test_f1: 0.6193
 epoch: 75, train_loss: 0.1391, test_loss: 2.1856, test_f1: 0.6167
 epoch: 76, train_loss: 0.1397, test_loss: 2.2176, test_f1: 0.6234
 epoch: 77, train_loss: 0.1713, test_loss: 2.3643, test_f1: 0.6402
 epoch: 78, train_loss: 0.1599, test_loss: 2.1436, test_f1: 0.6293
 epoch: 79, train_loss: 0.1334, test_loss: 2.3913, test_f1: 0.6210
 epoch: 80, train_loss: 0.1406, test_loss: 2.3452, test_f1: 0.6140
 epoch: 81, train_loss: 0.1380, test_loss: 2.2243, test_f1: 0.6348
 epoch: 82, train_loss: 0.1365, test_loss: 2.3403, test_f1: 0.6215
 epoch: 83, train_loss: 0.1799, test_loss: 2.3280, test_f1: 0.6264
 epoch: 84, train_loss: 0.1916, test_loss: 2.3441, test_f1: 0.6009
 epoch: 85, train_loss: 0.1599, test_loss: 2.5985, test_f1: 0.5719
 epoch: 86, train_loss: 0.1618, test_loss: 2.4391, test_f1: 0.6083
 epoch: 87, train_loss: 0.1476, test_loss: 2.1758, test_f1: 0.6503
 epoch: 88, train_loss: 0.1470, test_loss: 2.5646, test_f1: 0.5736
 epoch: 89, train_loss: 0.1274, test_loss: 2.5246, test_f1: 0.6191
 epoch: 90, train_loss: 0.1410, test_loss: 2.4392, test_f1: 0.6315
 epoch: 91, train_loss: 0.1360, test_loss: 2.1647, test_f1: 0.6342
 epoch: 92, train_loss: 0.1417, test_loss: 2.3407, test_f1: 0.6040
 epoch: 93, train_loss: 0.1309, test_loss: 2.5172, test_f1: 0.6255
 epoch: 94, train_loss: 0.1292, test_loss: 2.4838, test_f1: 0.6103
 epoch: 95, train_loss: 0.1372, test_loss: 2.2805, test_f1: 0.6282
 epoch: 96, train_loss: 0.1399, test_loss: 2.3549, test_f1: 0.6138
 epoch: 97, train_loss: 0.1490, test_loss: 2.2640, test_f1: 0.6124
 epoch: 98, train_loss: 0.1502, test_loss: 2.3794, test_f1: 0.6259
 epoch: 99, train_loss: 0.1091, test_loss: 2.3801, test_f1: 0.5889
##################ITERATION #8 ****************************************
 epoch: 0, train_loss: 1.3568, test_loss: 1.5515, test_f1: 0.2256
 epoch: 1, train_loss: 1.0623, test_loss: 1.4766, test_f1: 0.2397
 epoch: 2, train_loss: 0.9363, test_loss: 1.2500, test_f1: 0.3408
 epoch: 3, train_loss: 0.8695, test_loss: 1.1620, test_f1: 0.4571
 epoch: 4, train_loss: 0.8353, test_loss: 1.0919, test_f1: 0.5211
 epoch: 5, train_loss: 0.7952, test_loss: 1.0595, test_f1: 0.5692
 epoch: 6, train_loss: 0.7573, test_loss: 1.0111, test_f1: 0.5481
 epoch: 7, train_loss: 0.7503, test_loss: 1.1428, test_f1: 0.5446
 epoch: 8, train_loss: 0.7123, test_loss: 1.0737, test_f1: 0.5546
 epoch: 9, train_loss: 0.7195, test_loss: 1.0099, test_f1: 0.5940
 epoch: 10, train_loss: 0.6925, test_loss: 0.9803, test_f1: 0.6140
 epoch: 11, train_loss: 0.6578, test_loss: 1.0626, test_f1: 0.6142
 epoch: 12, train_loss: 0.6214, test_loss: 1.1514, test_f1: 0.5999
 epoch: 13, train_loss: 0.6340, test_loss: 1.1511, test_f1: 0.6442
 epoch: 14, train_loss: 0.6100, test_loss: 1.0873, test_f1: 0.5731
 epoch: 15, train_loss: 0.5992, test_loss: 1.0648, test_f1: 0.6000
 epoch: 16, train_loss: 0.5744, test_loss: 1.1112, test_f1: 0.6043
 epoch: 17, train_loss: 0.5790, test_loss: 1.5881, test_f1: 0.5154
 epoch: 18, train_loss: 0.5411, test_loss: 1.1849, test_f1: 0.5812
 epoch: 19, train_loss: 0.5292, test_loss: 1.0731, test_f1: 0.5912
 epoch: 20, train_loss: 0.5260, test_loss: 1.2512, test_f1: 0.5820
 epoch: 21, train_loss: 0.5124, test_loss: 1.2290, test_f1: 0.6351
 epoch: 22, train_loss: 0.5239, test_loss: 1.1983, test_f1: 0.6226
 epoch: 23, train_loss: 0.4821, test_loss: 1.0671, test_f1: 0.6846
 epoch: 24, train_loss: 0.4801, test_loss: 1.4588, test_f1: 0.5109
 epoch: 25, train_loss: 0.4760, test_loss: 1.2232, test_f1: 0.6439
 epoch: 26, train_loss: 0.4459, test_loss: 1.4609, test_f1: 0.5416
 epoch: 27, train_loss: 0.4439, test_loss: 1.3691, test_f1: 0.6185
 epoch: 28, train_loss: 0.4042, test_loss: 1.6265, test_f1: 0.6104
 epoch: 29, train_loss: 0.3984, test_loss: 1.3429, test_f1: 0.6425
 epoch: 30, train_loss: 0.3889, test_loss: 1.2679, test_f1: 0.6477
 epoch: 31, train_loss: 0.4083, test_loss: 1.3781, test_f1: 0.6597
 epoch: 32, train_loss: 0.3842, test_loss: 1.2769, test_f1: 0.6268
 epoch: 33, train_loss: 0.3877, test_loss: 1.4319, test_f1: 0.6025
 epoch: 34, train_loss: 0.3514, test_loss: 1.3990, test_f1: 0.6558
 epoch: 35, train_loss: 0.3642, test_loss: 1.4321, test_f1: 0.6332
 epoch: 36, train_loss: 0.3624, test_loss: 1.4314, test_f1: 0.6074
 epoch: 37, train_loss: 0.3424, test_loss: 1.4476, test_f1: 0.6009
 epoch: 38, train_loss: 0.3613, test_loss: 1.3266, test_f1: 0.6422
 epoch: 39, train_loss: 0.3234, test_loss: 1.6219, test_f1: 0.5718
 epoch: 40, train_loss: 0.3352, test_loss: 1.5109, test_f1: 0.6342
 epoch: 41, train_loss: 0.4183, test_loss: 1.5443, test_f1: 0.5487
 epoch: 42, train_loss: 0.3989, test_loss: 1.4517, test_f1: 0.5732
 epoch: 43, train_loss: 0.3404, test_loss: 1.4346, test_f1: 0.6200
 epoch: 44, train_loss: 0.3018, test_loss: 1.3155, test_f1: 0.6604
 epoch: 45, train_loss: 0.3636, test_loss: 1.4984, test_f1: 0.6102
 epoch: 46, train_loss: 0.3605, test_loss: 1.5119, test_f1: 0.6265
 epoch: 47, train_loss: 0.3094, test_loss: 1.4380, test_f1: 0.6590
 epoch: 48, train_loss: 0.2920, test_loss: 1.3998, test_f1: 0.6260
 epoch: 49, train_loss: 0.3007, test_loss: 1.5875, test_f1: 0.6080
 epoch: 50, train_loss: 0.3323, test_loss: 1.5795, test_f1: 0.6144
 epoch: 51, train_loss: 0.2907, test_loss: 1.5362, test_f1: 0.6378
 epoch: 52, train_loss: 0.2308, test_loss: 1.6062, test_f1: 0.6267
 epoch: 53, train_loss: 0.2192, test_loss: 1.7874, test_f1: 0.6228
 epoch: 54, train_loss: 0.2059, test_loss: 1.7863, test_f1: 0.5958
 epoch: 55, train_loss: 0.1889, test_loss: 1.8264, test_f1: 0.6083
 epoch: 56, train_loss: 0.2068, test_loss: 1.8494, test_f1: 0.6406
 epoch: 57, train_loss: 0.1847, test_loss: 1.8049, test_f1: 0.6355
 epoch: 58, train_loss: 0.1745, test_loss: 1.8215, test_f1: 0.6256
 epoch: 59, train_loss: 0.1897, test_loss: 1.9352, test_f1: 0.6073
 epoch: 60, train_loss: 0.1905, test_loss: 2.1312, test_f1: 0.6463
 epoch: 61, train_loss: 0.1949, test_loss: 1.8784, test_f1: 0.6090
 epoch: 62, train_loss: 0.1728, test_loss: 1.9964, test_f1: 0.6064
 epoch: 63, train_loss: 0.1871, test_loss: 1.9085, test_f1: 0.6302
 epoch: 64, train_loss: 0.1971, test_loss: 1.9555, test_f1: 0.6303
 epoch: 65, train_loss: 0.1864, test_loss: 1.9987, test_f1: 0.6293
 epoch: 66, train_loss: 0.1468, test_loss: 2.0052, test_f1: 0.6043
 epoch: 67, train_loss: 0.1792, test_loss: 1.9655, test_f1: 0.6042
 epoch: 68, train_loss: 0.1600, test_loss: 2.1110, test_f1: 0.6622
 epoch: 69, train_loss: 0.1824, test_loss: 2.0693, test_f1: 0.6130
 epoch: 70, train_loss: 0.1581, test_loss: 2.0089, test_f1: 0.6114
 epoch: 71, train_loss: 0.1567, test_loss: 1.9732, test_f1: 0.6140
 epoch: 72, train_loss: 0.1646, test_loss: 2.2219, test_f1: 0.6238
 epoch: 73, train_loss: 0.1371, test_loss: 2.1220, test_f1: 0.6031
 epoch: 74, train_loss: 0.1616, test_loss: 2.2004, test_f1: 0.6079
 epoch: 75, train_loss: 0.1695, test_loss: 2.1628, test_f1: 0.6288
 epoch: 76, train_loss: 0.1369, test_loss: 2.3804, test_f1: 0.6553
 epoch: 77, train_loss: 0.1506, test_loss: 2.3900, test_f1: 0.6031
 epoch: 78, train_loss: 0.1803, test_loss: 2.1411, test_f1: 0.6339
 epoch: 79, train_loss: 0.1602, test_loss: 2.2366, test_f1: 0.6549
 epoch: 80, train_loss: 0.1392, test_loss: 1.9426, test_f1: 0.6340
 epoch: 81, train_loss: 0.1304, test_loss: 2.1463, test_f1: 0.6164
 epoch: 82, train_loss: 0.1424, test_loss: 2.0433, test_f1: 0.6264
 epoch: 83, train_loss: 0.1306, test_loss: 2.2955, test_f1: 0.6178
 epoch: 84, train_loss: 0.1535, test_loss: 2.3230, test_f1: 0.5957
 epoch: 85, train_loss: 0.1374, test_loss: 2.4194, test_f1: 0.5990
 epoch: 86, train_loss: 0.1133, test_loss: 2.2627, test_f1: 0.6089
 epoch: 87, train_loss: 0.1179, test_loss: 2.4552, test_f1: 0.5896
 epoch: 88, train_loss: 0.1486, test_loss: 2.4418, test_f1: 0.5985
 epoch: 89, train_loss: 0.1976, test_loss: 2.3287, test_f1: 0.5526
 epoch: 90, train_loss: 0.1955, test_loss: 2.0237, test_f1: 0.6276
 epoch: 91, train_loss: 0.1438, test_loss: 2.3579, test_f1: 0.5933
 epoch: 92, train_loss: 0.1328, test_loss: 2.4913, test_f1: 0.5849
 epoch: 93, train_loss: 0.1136, test_loss: 2.4453, test_f1: 0.5973
 epoch: 94, train_loss: 0.1336, test_loss: 2.4730, test_f1: 0.5805
 epoch: 95, train_loss: 0.1144, test_loss: 2.3283, test_f1: 0.5974
 epoch: 96, train_loss: 0.1090, test_loss: 2.4893, test_f1: 0.6060
 epoch: 97, train_loss: 0.1195, test_loss: 2.5536, test_f1: 0.5828
 epoch: 98, train_loss: 0.0993, test_loss: 2.5233, test_f1: 0.6328
 epoch: 99, train_loss: 0.1021, test_loss: 2.2430, test_f1: 0.6121
##################ITERATION #9 ****************************************
 epoch: 0, train_loss: 1.4352, test_loss: 1.5080, test_f1: 0.2491
 epoch: 1, train_loss: 1.0578, test_loss: 1.3831, test_f1: 0.4055
 epoch: 2, train_loss: 0.9786, test_loss: 1.4448, test_f1: 0.3025
 epoch: 3, train_loss: 0.8794, test_loss: 1.2199, test_f1: 0.5287
 epoch: 4, train_loss: 0.8223, test_loss: 1.1860, test_f1: 0.5380
 epoch: 5, train_loss: 0.8055, test_loss: 1.0550, test_f1: 0.5815
 epoch: 6, train_loss: 0.7766, test_loss: 1.1276, test_f1: 0.5854
 epoch: 7, train_loss: 0.7467, test_loss: 1.0949, test_f1: 0.5465
 epoch: 8, train_loss: 0.7298, test_loss: 1.1292, test_f1: 0.5953
 epoch: 9, train_loss: 0.7071, test_loss: 1.1174, test_f1: 0.5724
 epoch: 10, train_loss: 0.7220, test_loss: 1.1946, test_f1: 0.5861
 epoch: 11, train_loss: 0.6605, test_loss: 1.1228, test_f1: 0.5991
 epoch: 12, train_loss: 0.6386, test_loss: 1.0413, test_f1: 0.6172
 epoch: 13, train_loss: 0.6373, test_loss: 1.2225, test_f1: 0.6177
 epoch: 14, train_loss: 0.6286, test_loss: 1.1427, test_f1: 0.5666
 epoch: 15, train_loss: 0.6059, test_loss: 1.0995, test_f1: 0.5893
 epoch: 16, train_loss: 0.5859, test_loss: 1.1378, test_f1: 0.6245
 epoch: 17, train_loss: 0.5835, test_loss: 1.1794, test_f1: 0.6053
 epoch: 18, train_loss: 0.5391, test_loss: 1.1391, test_f1: 0.6156
 epoch: 19, train_loss: 0.5412, test_loss: 1.2273, test_f1: 0.6116
 epoch: 20, train_loss: 0.4986, test_loss: 1.1494, test_f1: 0.6009
 epoch: 21, train_loss: 0.5118, test_loss: 1.2614, test_f1: 0.5968
 epoch: 22, train_loss: 0.4827, test_loss: 1.2462, test_f1: 0.6313
 epoch: 23, train_loss: 0.5168, test_loss: 1.3275, test_f1: 0.6888
 epoch: 24, train_loss: 0.5230, test_loss: 1.1539, test_f1: 0.6235
 epoch: 25, train_loss: 0.4734, test_loss: 1.1592, test_f1: 0.6470
 epoch: 26, train_loss: 0.4568, test_loss: 1.1543, test_f1: 0.6210
 epoch: 27, train_loss: 0.4400, test_loss: 1.2211, test_f1: 0.6316
 epoch: 28, train_loss: 0.4507, test_loss: 1.2832, test_f1: 0.6687
 epoch: 29, train_loss: 0.4008, test_loss: 1.5707, test_f1: 0.5800
 epoch: 30, train_loss: 0.4433, test_loss: 1.2577, test_f1: 0.5952
 epoch: 31, train_loss: 0.3998, test_loss: 1.3832, test_f1: 0.6162
 epoch: 32, train_loss: 0.4115, test_loss: 1.5018, test_f1: 0.6016
 epoch: 33, train_loss: 0.3777, test_loss: 1.5648, test_f1: 0.5947
 epoch: 34, train_loss: 0.3605, test_loss: 1.6514, test_f1: 0.5760
 epoch: 35, train_loss: 0.3355, test_loss: 1.4475, test_f1: 0.5824
 epoch: 36, train_loss: 0.3628, test_loss: 1.3352, test_f1: 0.5997
 epoch: 37, train_loss: 0.3525, test_loss: 1.4100, test_f1: 0.6531
 epoch: 38, train_loss: 0.3746, test_loss: 1.9990, test_f1: 0.5787
 epoch: 39, train_loss: 0.3511, test_loss: 1.4746, test_f1: 0.6357
 epoch: 40, train_loss: 0.3380, test_loss: 1.4007, test_f1: 0.6259
 epoch: 41, train_loss: 0.3287, test_loss: 1.7971, test_f1: 0.5735
 epoch: 42, train_loss: 0.3063, test_loss: 1.8709, test_f1: 0.5886
 epoch: 43, train_loss: 0.3411, test_loss: 2.0126, test_f1: 0.5304
 epoch: 44, train_loss: 0.3796, test_loss: 1.6886, test_f1: 0.5812
 epoch: 45, train_loss: 0.3755, test_loss: 1.6363, test_f1: 0.5902
 epoch: 46, train_loss: 0.3071, test_loss: 1.9798, test_f1: 0.5927
 epoch: 47, train_loss: 0.3123, test_loss: 1.5292, test_f1: 0.5432
 epoch: 48, train_loss: 0.2678, test_loss: 1.7362, test_f1: 0.6301
 epoch: 49, train_loss: 0.2661, test_loss: 1.4930, test_f1: 0.6139
 epoch: 50, train_loss: 0.2595, test_loss: 1.8351, test_f1: 0.5883
 epoch: 51, train_loss: 0.2239, test_loss: 1.9048, test_f1: 0.6327
 epoch: 52, train_loss: 0.2242, test_loss: 1.7055, test_f1: 0.5809
 epoch: 53, train_loss: 0.1878, test_loss: 1.5666, test_f1: 0.6924
 epoch: 54, train_loss: 0.2005, test_loss: 1.6295, test_f1: 0.6248
 epoch: 55, train_loss: 0.1809, test_loss: 1.8933, test_f1: 0.6090
 epoch: 56, train_loss: 0.1627, test_loss: 1.9128, test_f1: 0.5869
 epoch: 57, train_loss: 0.1626, test_loss: 1.8668, test_f1: 0.6489
 epoch: 58, train_loss: 0.1625, test_loss: 1.8800, test_f1: 0.6155
 epoch: 59, train_loss: 0.1589, test_loss: 2.0777, test_f1: 0.6239
 epoch: 60, train_loss: 0.1619, test_loss: 2.0009, test_f1: 0.6033
 epoch: 61, train_loss: 0.1563, test_loss: 2.0711, test_f1: 0.6135
 epoch: 62, train_loss: 0.1447, test_loss: 1.9066, test_f1: 0.6325
 epoch: 63, train_loss: 0.1710, test_loss: 2.3304, test_f1: 0.6081
 epoch: 64, train_loss: 0.1925, test_loss: 2.2374, test_f1: 0.5922
 epoch: 65, train_loss: 0.1525, test_loss: 2.0600, test_f1: 0.6351
 epoch: 66, train_loss: 0.1446, test_loss: 2.2575, test_f1: 0.6104
 epoch: 67, train_loss: 0.1613, test_loss: 1.9636, test_f1: 0.6639
 epoch: 68, train_loss: 0.1663, test_loss: 2.1820, test_f1: 0.6020
 epoch: 69, train_loss: 0.1654, test_loss: 2.1110, test_f1: 0.6335
 epoch: 70, train_loss: 0.1453, test_loss: 2.1304, test_f1: 0.5976
 epoch: 71, train_loss: 0.1662, test_loss: 2.1708, test_f1: 0.6317
 epoch: 72, train_loss: 0.1514, test_loss: 1.9400, test_f1: 0.6058
 epoch: 73, train_loss: 0.1429, test_loss: 2.4161, test_f1: 0.5991
 epoch: 74, train_loss: 0.1413, test_loss: 2.2431, test_f1: 0.6009
 epoch: 75, train_loss: 0.1282, test_loss: 2.1908, test_f1: 0.6179
 epoch: 76, train_loss: 0.1366, test_loss: 2.1845, test_f1: 0.6482
 epoch: 77, train_loss: 0.1470, test_loss: 1.9780, test_f1: 0.6286
 epoch: 78, train_loss: 0.1434, test_loss: 2.1668, test_f1: 0.6314
 epoch: 79, train_loss: 0.1374, test_loss: 2.1227, test_f1: 0.6135
 epoch: 80, train_loss: 0.1226, test_loss: 2.1958, test_f1: 0.6248
 epoch: 81, train_loss: 0.1375, test_loss: 2.2994, test_f1: 0.6032
 epoch: 82, train_loss: 0.1189, test_loss: 2.1138, test_f1: 0.6306
 epoch: 83, train_loss: 0.1378, test_loss: 2.0910, test_f1: 0.6201
 epoch: 84, train_loss: 0.1029, test_loss: 2.4359, test_f1: 0.5942
 epoch: 85, train_loss: 0.1208, test_loss: 2.5989, test_f1: 0.5955
 epoch: 86, train_loss: 0.1061, test_loss: 2.5086, test_f1: 0.6346
 epoch: 87, train_loss: 0.0975, test_loss: 2.4902, test_f1: 0.6092
 epoch: 88, train_loss: 0.0835, test_loss: 2.6619, test_f1: 0.5912
 epoch: 89, train_loss: 0.0801, test_loss: 2.7375, test_f1: 0.5944
 epoch: 90, train_loss: 0.0953, test_loss: 2.7438, test_f1: 0.6222
 epoch: 91, train_loss: 0.1293, test_loss: 3.2179, test_f1: 0.5864
 epoch: 92, train_loss: 0.1292, test_loss: 2.3924, test_f1: 0.6093
 epoch: 93, train_loss: 0.1198, test_loss: 2.4280, test_f1: 0.6195
 epoch: 94, train_loss: 0.1344, test_loss: 2.5470, test_f1: 0.6153
 epoch: 95, train_loss: 0.1301, test_loss: 2.4001, test_f1: 0.6143
 epoch: 96, train_loss: 0.1187, test_loss: 2.4267, test_f1: 0.6021
 epoch: 97, train_loss: 0.1129, test_loss: 2.5316, test_f1: 0.5983
 epoch: 98, train_loss: 0.1084, test_loss: 2.9414, test_f1: 0.5885
 epoch: 99, train_loss: 0.1162, test_loss: 2.4989, test_f1: 0.6070

Training completed in 326.99 seconds
Best F1: 0.6924 at epoch 53
Mean F1 across iterations: 0.6660  0.0152
========================FINAL RESULTS================================
FEGIN weighted F1: 0.6924  0.0152
python main.py --data ltspice_demos --representation component_pin --model FEGIN --layers 2 --hiddens 128 --batch_size 128 --lr 0.001 --emb_size 250 --epochs 100 --save_appendix component_pin_L2_H128_BS128_LR0.001_E250 --no_val
-----



STDERR:
  File "main.py", line 370, in <module>
    main()
  File "main.py", line 254, in main
    dataset = dataset_class(
  File "/home/philip/projects/ltspice_examples_code_repo/Circuit-Completion-Using-GNNs/component_classification_with_link_prediction_head/evaluation/FEGIN/kernel/circuit_datasets.py", line 15, in __init__
    self.data, self.slices = torch.load(self.processed_paths[0])
  File "/home/philip/.local/lib/python3.8/site-packages/torch/serialization.py", line 1040, in load
    warnings.warn(
  File "/usr/lib/python3.8/warnings.py", line 109, in _showwarnmsg
    sw(msg.message, msg.category, msg.filename, msg.lineno,
  File "main.py", line 47, in warn_with_traceback
    traceback.print_stack(file=log)
/home/philip/projects/ltspice_examples_code_repo/Circuit-Completion-Using-GNNs/component_classification_with_link_prediction_head/evaluation/FEGIN/kernel/circuit_datasets.py:15: FutureWarning: You are using `torch.load` with `weights_only=False` (the current default value), which uses the default pickle module implicitly. It is possible to construct malicious pickle data which will execute arbitrary code during unpickling (See https://github.com/pytorch/pytorch/blob/main/SECURITY.md#untrusted-models for more details). In a future release, the default value for `weights_only` will be flipped to `True`. This limits the functions that could be executed during unpickling. Arbitrary objects will no longer be allowed to be loaded via this mode unless they are explicitly allowlisted by the user via `torch.serialization.add_safe_globals`. We recommend you start setting `weights_only=True` for any use case where you don't have full control of the loaded file. Please open an issue on GitHub for any issues related to this experimental feature.
  self.data, self.slices = torch.load(self.processed_paths[0])
