STDOUT:
Results will be saved in /home/philip/projects/ltspice_examples_code_repo/Circuit-Completion-Using-GNNs/component_classification_with_link_prediction_head/evaluation/FEGIN/results/model_FEGIN_dataset_ltspice_examples
Command line input: python main.py --data ltspice_examples --representation component_pin_net --model FEGIN --layers 6 --hiddens 64 --batch_size 64 --lr 0.001 --emb_size 512 --epochs 100 --save_appendix component_pin_net_L6_H64_BS64_LR0.001_E512 --no_val
 is saved.
-----
ltspice_examples - FEGIN
Using 6 layers, 64 hidden units, h = 2
Loading component_pin_net representation dataset
ENTERED
Training FEGIN on component_pin_net representation
Train: 3558, Test: 846
##################ITERATION #0 ****************************************
 epoch: 0, train_loss: 1.2085, test_loss: 1.1109, test_f1: 0.3260
 epoch: 1, train_loss: 1.0393, test_loss: 0.9867, test_f1: 0.5034
 epoch: 2, train_loss: 1.0001, test_loss: 0.9910, test_f1: 0.5021
 epoch: 3, train_loss: 0.9590, test_loss: 0.9929, test_f1: 0.5071
 epoch: 4, train_loss: 0.9292, test_loss: 0.9701, test_f1: 0.4918
 epoch: 5, train_loss: 0.9117, test_loss: 0.9746, test_f1: 0.5175
 epoch: 6, train_loss: 0.8797, test_loss: 0.9494, test_f1: 0.5367
 epoch: 7, train_loss: 0.8735, test_loss: 0.8523, test_f1: 0.5468
 epoch: 8, train_loss: 0.8630, test_loss: 0.9718, test_f1: 0.4971
 epoch: 9, train_loss: 0.8383, test_loss: 0.9002, test_f1: 0.5448
 epoch: 10, train_loss: 0.8226, test_loss: 0.9963, test_f1: 0.5561
 epoch: 11, train_loss: 0.8133, test_loss: 0.8806, test_f1: 0.5277
 epoch: 12, train_loss: 0.7860, test_loss: 0.8603, test_f1: 0.5894
 epoch: 13, train_loss: 0.7745, test_loss: 0.9346, test_f1: 0.5895
 epoch: 14, train_loss: 0.7632, test_loss: 0.8197, test_f1: 0.5896
 epoch: 15, train_loss: 0.7482, test_loss: 0.8714, test_f1: 0.5717
 epoch: 16, train_loss: 0.7319, test_loss: 0.8629, test_f1: 0.5460
 epoch: 17, train_loss: 0.7259, test_loss: 0.8567, test_f1: 0.5802
 epoch: 18, train_loss: 0.7132, test_loss: 0.8403, test_f1: 0.5656
 epoch: 19, train_loss: 0.6958, test_loss: 0.9041, test_f1: 0.6238
 epoch: 20, train_loss: 0.6806, test_loss: 0.9014, test_f1: 0.5693
 epoch: 21, train_loss: 0.6808, test_loss: 0.8472, test_f1: 0.6142
 epoch: 22, train_loss: 0.6519, test_loss: 0.8145, test_f1: 0.6243
 epoch: 23, train_loss: 0.6561, test_loss: 0.9859, test_f1: 0.5634
 epoch: 24, train_loss: 0.6410, test_loss: 0.9712, test_f1: 0.5999
 epoch: 25, train_loss: 0.6386, test_loss: 0.8405, test_f1: 0.6063
 epoch: 26, train_loss: 0.6173, test_loss: 0.9094, test_f1: 0.6222
 epoch: 27, train_loss: 0.6311, test_loss: 0.8235, test_f1: 0.6305
 epoch: 28, train_loss: 0.6019, test_loss: 0.8818, test_f1: 0.6024
 epoch: 29, train_loss: 0.6049, test_loss: 0.8619, test_f1: 0.6172
 epoch: 30, train_loss: 0.5762, test_loss: 0.9601, test_f1: 0.6174
 epoch: 31, train_loss: 0.5680, test_loss: 1.0278, test_f1: 0.6413
 epoch: 32, train_loss: 0.5668, test_loss: 0.9377, test_f1: 0.6485
 epoch: 33, train_loss: 0.5823, test_loss: 1.0417, test_f1: 0.5936
 epoch: 34, train_loss: 0.5584, test_loss: 1.0212, test_f1: 0.6302
 epoch: 35, train_loss: 0.5659, test_loss: 0.9744, test_f1: 0.6544
 epoch: 36, train_loss: 0.5507, test_loss: 1.0500, test_f1: 0.6485
 epoch: 37, train_loss: 0.5482, test_loss: 1.0210, test_f1: 0.6180
 epoch: 38, train_loss: 0.5314, test_loss: 0.9625, test_f1: 0.6342
 epoch: 39, train_loss: 0.5247, test_loss: 1.0014, test_f1: 0.6572
 epoch: 40, train_loss: 0.5115, test_loss: 0.9803, test_f1: 0.6561
 epoch: 41, train_loss: 0.5158, test_loss: 0.9536, test_f1: 0.6605
 epoch: 42, train_loss: 0.5409, test_loss: 1.1488, test_f1: 0.6248
 epoch: 43, train_loss: 0.5207, test_loss: 1.0138, test_f1: 0.6695
 epoch: 44, train_loss: 0.5075, test_loss: 1.0642, test_f1: 0.6692
 epoch: 45, train_loss: 0.5076, test_loss: 1.0556, test_f1: 0.6464
 epoch: 46, train_loss: 0.4925, test_loss: 0.9999, test_f1: 0.6340
 epoch: 47, train_loss: 0.4819, test_loss: 0.9161, test_f1: 0.6297
 epoch: 48, train_loss: 0.4932, test_loss: 1.0377, test_f1: 0.6492
 epoch: 49, train_loss: 0.4816, test_loss: 1.2011, test_f1: 0.6556
 epoch: 50, train_loss: 0.4784, test_loss: 1.1363, test_f1: 0.6448
 epoch: 51, train_loss: 0.4348, test_loss: 1.1177, test_f1: 0.6699
 epoch: 52, train_loss: 0.4204, test_loss: 1.1598, test_f1: 0.6638
 epoch: 53, train_loss: 0.3949, test_loss: 1.1679, test_f1: 0.6939
 epoch: 54, train_loss: 0.3910, test_loss: 1.1655, test_f1: 0.6885
 epoch: 55, train_loss: 0.3952, test_loss: 1.2367, test_f1: 0.6616
 epoch: 56, train_loss: 0.3747, test_loss: 1.2987, test_f1: 0.6816
 epoch: 57, train_loss: 0.3829, test_loss: 1.2887, test_f1: 0.6705
 epoch: 58, train_loss: 0.3745, test_loss: 1.3089, test_f1: 0.6686
 epoch: 59, train_loss: 0.3539, test_loss: 1.3547, test_f1: 0.6653
 epoch: 60, train_loss: 0.3761, test_loss: 1.2838, test_f1: 0.6781
 epoch: 61, train_loss: 0.3691, test_loss: 1.2443, test_f1: 0.6988
 epoch: 62, train_loss: 0.3493, test_loss: 1.3582, test_f1: 0.6871
 epoch: 63, train_loss: 0.3495, test_loss: 1.3964, test_f1: 0.6670
 epoch: 64, train_loss: 0.3337, test_loss: 1.3271, test_f1: 0.6883
 epoch: 65, train_loss: 0.3405, test_loss: 1.3631, test_f1: 0.6789
 epoch: 66, train_loss: 0.3483, test_loss: 1.4352, test_f1: 0.6723
 epoch: 67, train_loss: 0.3216, test_loss: 1.3876, test_f1: 0.6747
 epoch: 68, train_loss: 0.3154, test_loss: 1.3596, test_f1: 0.6731
 epoch: 69, train_loss: 0.3225, test_loss: 1.5182, test_f1: 0.6726
 epoch: 70, train_loss: 0.3155, test_loss: 1.4736, test_f1: 0.6872
 epoch: 71, train_loss: 0.3399, test_loss: 1.4383, test_f1: 0.6815
 epoch: 72, train_loss: 0.3188, test_loss: 1.4618, test_f1: 0.6704
 epoch: 73, train_loss: 0.3296, test_loss: 1.3576, test_f1: 0.6876
 epoch: 74, train_loss: 0.3151, test_loss: 1.4396, test_f1: 0.6783
 epoch: 75, train_loss: 0.3094, test_loss: 1.5355, test_f1: 0.6543
 epoch: 76, train_loss: 0.2885, test_loss: 1.4909, test_f1: 0.6980
 epoch: 77, train_loss: 0.3217, test_loss: 1.4819, test_f1: 0.6548
 epoch: 78, train_loss: 0.3143, test_loss: 1.3976, test_f1: 0.6851
 epoch: 79, train_loss: 0.3034, test_loss: 1.5123, test_f1: 0.6722
 epoch: 80, train_loss: 0.2873, test_loss: 1.5892, test_f1: 0.6688
 epoch: 81, train_loss: 0.2868, test_loss: 1.5933, test_f1: 0.6654
 epoch: 82, train_loss: 0.2860, test_loss: 1.5740, test_f1: 0.6947
 epoch: 83, train_loss: 0.2908, test_loss: 1.5988, test_f1: 0.6741
 epoch: 84, train_loss: 0.2841, test_loss: 1.5488, test_f1: 0.6793
 epoch: 85, train_loss: 0.2844, test_loss: 1.4833, test_f1: 0.6907
 epoch: 86, train_loss: 0.2946, test_loss: 1.6524, test_f1: 0.6733
 epoch: 87, train_loss: 0.2719, test_loss: 1.6702, test_f1: 0.6840
 epoch: 88, train_loss: 0.2639, test_loss: 1.7177, test_f1: 0.6767
 epoch: 89, train_loss: 0.2618, test_loss: 1.7901, test_f1: 0.6584
 epoch: 90, train_loss: 0.2721, test_loss: 1.5470, test_f1: 0.6824
 epoch: 91, train_loss: 0.2737, test_loss: 1.6657, test_f1: 0.6725
 epoch: 92, train_loss: 0.2585, test_loss: 1.7322, test_f1: 0.6794
 epoch: 93, train_loss: 0.2738, test_loss: 1.7554, test_f1: 0.6756
 epoch: 94, train_loss: 0.2952, test_loss: 1.6483, test_f1: 0.6613
 epoch: 95, train_loss: 0.2565, test_loss: 1.6084, test_f1: 0.6990
 epoch: 96, train_loss: 0.2327, test_loss: 1.7418, test_f1: 0.6878
 epoch: 97, train_loss: 0.2471, test_loss: 1.7509, test_f1: 0.6891
 epoch: 98, train_loss: 0.2291, test_loss: 1.7258, test_f1: 0.6824
 epoch: 99, train_loss: 0.2399, test_loss: 1.7989, test_f1: 0.7141
##################ITERATION #1 ****************************************
 epoch: 0, train_loss: 1.0924, test_loss: 1.0778, test_f1: 0.4135
 epoch: 1, train_loss: 0.9869, test_loss: 0.9601, test_f1: 0.4945
 epoch: 2, train_loss: 0.9522, test_loss: 0.8997, test_f1: 0.5235
 epoch: 3, train_loss: 0.9270, test_loss: 0.9420, test_f1: 0.5169
 epoch: 4, train_loss: 0.9137, test_loss: 0.9006, test_f1: 0.5261
 epoch: 5, train_loss: 0.8925, test_loss: 0.8443, test_f1: 0.5793
 epoch: 6, train_loss: 0.8708, test_loss: 0.8509, test_f1: 0.5413
 epoch: 7, train_loss: 0.8580, test_loss: 0.8849, test_f1: 0.5423
 epoch: 8, train_loss: 0.8447, test_loss: 0.8554, test_f1: 0.5785
 epoch: 9, train_loss: 0.8210, test_loss: 0.8393, test_f1: 0.5704
 epoch: 10, train_loss: 0.8121, test_loss: 0.8254, test_f1: 0.5839
 epoch: 11, train_loss: 0.7825, test_loss: 0.8967, test_f1: 0.5848
 epoch: 12, train_loss: 0.7665, test_loss: 0.8469, test_f1: 0.6255
 epoch: 13, train_loss: 0.7540, test_loss: 0.7967, test_f1: 0.6205
 epoch: 14, train_loss: 0.7432, test_loss: 0.7655, test_f1: 0.6165
 epoch: 15, train_loss: 0.7320, test_loss: 0.8864, test_f1: 0.5735
 epoch: 16, train_loss: 0.7226, test_loss: 0.7646, test_f1: 0.6323
 epoch: 17, train_loss: 0.7051, test_loss: 0.8036, test_f1: 0.6088
 epoch: 18, train_loss: 0.6997, test_loss: 0.9133, test_f1: 0.5905
 epoch: 19, train_loss: 0.6935, test_loss: 0.7328, test_f1: 0.6464
 epoch: 20, train_loss: 0.7055, test_loss: 0.7616, test_f1: 0.6535
 epoch: 21, train_loss: 0.6849, test_loss: 0.8418, test_f1: 0.5913
 epoch: 22, train_loss: 0.6488, test_loss: 0.7269, test_f1: 0.6479
 epoch: 23, train_loss: 0.6529, test_loss: 0.8275, test_f1: 0.6311
 epoch: 24, train_loss: 0.6261, test_loss: 0.8164, test_f1: 0.6390
 epoch: 25, train_loss: 0.6433, test_loss: 0.8743, test_f1: 0.6158
 epoch: 26, train_loss: 0.6366, test_loss: 0.8322, test_f1: 0.6422
 epoch: 27, train_loss: 0.6058, test_loss: 0.7109, test_f1: 0.6475
 epoch: 28, train_loss: 0.6191, test_loss: 0.7545, test_f1: 0.6616
 epoch: 29, train_loss: 0.6017, test_loss: 0.8647, test_f1: 0.6663
 epoch: 30, train_loss: 0.5984, test_loss: 0.7614, test_f1: 0.6488
 epoch: 31, train_loss: 0.5982, test_loss: 0.8223, test_f1: 0.6584
 epoch: 32, train_loss: 0.5813, test_loss: 0.8086, test_f1: 0.6141
 epoch: 33, train_loss: 0.5650, test_loss: 1.0030, test_f1: 0.6079
 epoch: 34, train_loss: 0.5953, test_loss: 0.8968, test_f1: 0.6397
 epoch: 35, train_loss: 0.5658, test_loss: 0.7848, test_f1: 0.6362
 epoch: 36, train_loss: 0.5438, test_loss: 0.8835, test_f1: 0.6312
 epoch: 37, train_loss: 0.5469, test_loss: 0.7046, test_f1: 0.6579
 epoch: 38, train_loss: 0.5510, test_loss: 0.8411, test_f1: 0.6671
 epoch: 39, train_loss: 0.5247, test_loss: 0.9583, test_f1: 0.6404
 epoch: 40, train_loss: 0.5048, test_loss: 0.8597, test_f1: 0.6424
 epoch: 41, train_loss: 0.5129, test_loss: 0.8680, test_f1: 0.6362
 epoch: 42, train_loss: 0.5140, test_loss: 0.8678, test_f1: 0.6630
 epoch: 43, train_loss: 0.5033, test_loss: 0.9902, test_f1: 0.6363
 epoch: 44, train_loss: 0.5099, test_loss: 0.9647, test_f1: 0.6713
 epoch: 45, train_loss: 0.4966, test_loss: 0.9406, test_f1: 0.6223
 epoch: 46, train_loss: 0.4772, test_loss: 0.9511, test_f1: 0.6301
 epoch: 47, train_loss: 0.4780, test_loss: 0.9778, test_f1: 0.6348
 epoch: 48, train_loss: 0.4819, test_loss: 0.9368, test_f1: 0.6753
 epoch: 49, train_loss: 0.4599, test_loss: 0.9698, test_f1: 0.6588
 epoch: 50, train_loss: 0.4504, test_loss: 1.0984, test_f1: 0.6454
 epoch: 51, train_loss: 0.4157, test_loss: 0.9943, test_f1: 0.6731
 epoch: 52, train_loss: 0.4033, test_loss: 1.0673, test_f1: 0.6480
 epoch: 53, train_loss: 0.3960, test_loss: 1.0958, test_f1: 0.6661
 epoch: 54, train_loss: 0.3773, test_loss: 1.1046, test_f1: 0.6790
 epoch: 55, train_loss: 0.3841, test_loss: 1.1826, test_f1: 0.6816
 epoch: 56, train_loss: 0.3832, test_loss: 1.1290, test_f1: 0.6522
 epoch: 57, train_loss: 0.3676, test_loss: 1.1782, test_f1: 0.6620
 epoch: 58, train_loss: 0.3647, test_loss: 1.1869, test_f1: 0.6591
 epoch: 59, train_loss: 0.3500, test_loss: 1.2038, test_f1: 0.6454
 epoch: 60, train_loss: 0.3519, test_loss: 1.2201, test_f1: 0.6536
 epoch: 61, train_loss: 0.3473, test_loss: 1.2804, test_f1: 0.6548
 epoch: 62, train_loss: 0.3512, test_loss: 1.2041, test_f1: 0.6500
 epoch: 63, train_loss: 0.3350, test_loss: 1.2536, test_f1: 0.6716
 epoch: 64, train_loss: 0.3284, test_loss: 1.1601, test_f1: 0.6917
 epoch: 65, train_loss: 0.3562, test_loss: 1.2808, test_f1: 0.6683
 epoch: 66, train_loss: 0.3286, test_loss: 1.2622, test_f1: 0.6437
 epoch: 67, train_loss: 0.3259, test_loss: 1.3304, test_f1: 0.6653
 epoch: 68, train_loss: 0.3118, test_loss: 1.3837, test_f1: 0.6565
 epoch: 69, train_loss: 0.3179, test_loss: 1.3622, test_f1: 0.6604
 epoch: 70, train_loss: 0.3116, test_loss: 1.4689, test_f1: 0.6646
 epoch: 71, train_loss: 0.3037, test_loss: 1.3773, test_f1: 0.6643
 epoch: 72, train_loss: 0.2967, test_loss: 1.4729, test_f1: 0.6597
 epoch: 73, train_loss: 0.3156, test_loss: 1.4238, test_f1: 0.6371
 epoch: 74, train_loss: 0.3057, test_loss: 1.3790, test_f1: 0.6672
 epoch: 75, train_loss: 0.3038, test_loss: 1.4339, test_f1: 0.6669
 epoch: 76, train_loss: 0.2797, test_loss: 1.4821, test_f1: 0.6714
 epoch: 77, train_loss: 0.2867, test_loss: 1.4675, test_f1: 0.6577
 epoch: 78, train_loss: 0.3000, test_loss: 1.6166, test_f1: 0.6359
 epoch: 79, train_loss: 0.2845, test_loss: 1.4817, test_f1: 0.6771
 epoch: 80, train_loss: 0.2753, test_loss: 1.5311, test_f1: 0.6500
 epoch: 81, train_loss: 0.2649, test_loss: 1.5103, test_f1: 0.6583
 epoch: 82, train_loss: 0.2706, test_loss: 1.5653, test_f1: 0.6555
 epoch: 83, train_loss: 0.2802, test_loss: 1.4899, test_f1: 0.6502
 epoch: 84, train_loss: 0.2829, test_loss: 1.5886, test_f1: 0.6563
 epoch: 85, train_loss: 0.2578, test_loss: 1.5740, test_f1: 0.6525
 epoch: 86, train_loss: 0.2721, test_loss: 1.5685, test_f1: 0.6511
 epoch: 87, train_loss: 0.2706, test_loss: 1.6266, test_f1: 0.6578
 epoch: 88, train_loss: 0.2573, test_loss: 1.6588, test_f1: 0.6495
 epoch: 89, train_loss: 0.2362, test_loss: 1.6205, test_f1: 0.6551
 epoch: 90, train_loss: 0.2569, test_loss: 1.6633, test_f1: 0.6688
 epoch: 91, train_loss: 0.2661, test_loss: 1.7190, test_f1: 0.6529
 epoch: 92, train_loss: 0.2564, test_loss: 1.7080, test_f1: 0.6485
 epoch: 93, train_loss: 0.2377, test_loss: 1.6622, test_f1: 0.6650
 epoch: 94, train_loss: 0.2466, test_loss: 1.6924, test_f1: 0.6559
 epoch: 95, train_loss: 0.2515, test_loss: 1.5973, test_f1: 0.6627
 epoch: 96, train_loss: 0.2265, test_loss: 1.8660, test_f1: 0.6530
 epoch: 97, train_loss: 0.2334, test_loss: 1.8722, test_f1: 0.6569
 epoch: 98, train_loss: 0.2461, test_loss: 1.9375, test_f1: 0.6455
 epoch: 99, train_loss: 0.2496, test_loss: 1.7513, test_f1: 0.6400
##################ITERATION #2 ****************************************
 epoch: 0, train_loss: 1.1249, test_loss: 1.5618, test_f1: 0.2414
 epoch: 1, train_loss: 0.9906, test_loss: 0.9709, test_f1: 0.4869
 epoch: 2, train_loss: 0.9400, test_loss: 0.9208, test_f1: 0.5118
 epoch: 3, train_loss: 0.9166, test_loss: 0.9400, test_f1: 0.5609
 epoch: 4, train_loss: 0.8909, test_loss: 0.9142, test_f1: 0.5525
 epoch: 5, train_loss: 0.8707, test_loss: 0.8515, test_f1: 0.5541
 epoch: 6, train_loss: 0.8541, test_loss: 0.8198, test_f1: 0.5727
 epoch: 7, train_loss: 0.8397, test_loss: 0.8841, test_f1: 0.5873
 epoch: 8, train_loss: 0.8123, test_loss: 0.8141, test_f1: 0.6029
 epoch: 9, train_loss: 0.8055, test_loss: 0.9016, test_f1: 0.6014
 epoch: 10, train_loss: 0.8078, test_loss: 0.8544, test_f1: 0.6285
 epoch: 11, train_loss: 0.7931, test_loss: 0.7744, test_f1: 0.6168
 epoch: 12, train_loss: 0.7661, test_loss: 0.8418, test_f1: 0.6236
 epoch: 13, train_loss: 0.7555, test_loss: 0.7870, test_f1: 0.6052
 epoch: 14, train_loss: 0.7455, test_loss: 0.8167, test_f1: 0.5973
 epoch: 15, train_loss: 0.7378, test_loss: 0.8837, test_f1: 0.6382
 epoch: 16, train_loss: 0.7276, test_loss: 0.7716, test_f1: 0.6261
 epoch: 17, train_loss: 0.7124, test_loss: 0.8268, test_f1: 0.6060
 epoch: 18, train_loss: 0.7104, test_loss: 0.7632, test_f1: 0.6501
 epoch: 19, train_loss: 0.6893, test_loss: 0.7868, test_f1: 0.6281
 epoch: 20, train_loss: 0.6778, test_loss: 0.8327, test_f1: 0.6494
 epoch: 21, train_loss: 0.6631, test_loss: 0.7857, test_f1: 0.6462
 epoch: 22, train_loss: 0.6617, test_loss: 0.7619, test_f1: 0.6294
 epoch: 23, train_loss: 0.6572, test_loss: 0.7327, test_f1: 0.6412
 epoch: 24, train_loss: 0.6536, test_loss: 0.8099, test_f1: 0.6154
 epoch: 25, train_loss: 0.6576, test_loss: 0.7193, test_f1: 0.6437
 epoch: 26, train_loss: 0.6260, test_loss: 0.7917, test_f1: 0.6532
 epoch: 27, train_loss: 0.6226, test_loss: 0.8273, test_f1: 0.6218
 epoch: 28, train_loss: 0.6066, test_loss: 0.8096, test_f1: 0.6795
 epoch: 29, train_loss: 0.5906, test_loss: 0.8062, test_f1: 0.6405
 epoch: 30, train_loss: 0.5787, test_loss: 0.8745, test_f1: 0.6285
 epoch: 31, train_loss: 0.5900, test_loss: 0.8084, test_f1: 0.6820
 epoch: 32, train_loss: 0.5699, test_loss: 0.7781, test_f1: 0.6615
 epoch: 33, train_loss: 0.5626, test_loss: 0.9349, test_f1: 0.6247
 epoch: 34, train_loss: 0.5527, test_loss: 0.8849, test_f1: 0.6304
 epoch: 35, train_loss: 0.5428, test_loss: 0.8321, test_f1: 0.6654
 epoch: 36, train_loss: 0.5368, test_loss: 0.8496, test_f1: 0.6588
 epoch: 37, train_loss: 0.5477, test_loss: 0.8715, test_f1: 0.6251
 epoch: 38, train_loss: 0.5252, test_loss: 0.8796, test_f1: 0.6748
 epoch: 39, train_loss: 0.5140, test_loss: 0.8556, test_f1: 0.6695
 epoch: 40, train_loss: 0.5223, test_loss: 0.9661, test_f1: 0.6649
 epoch: 41, train_loss: 0.5198, test_loss: 0.8952, test_f1: 0.6570
 epoch: 42, train_loss: 0.5002, test_loss: 0.9378, test_f1: 0.6579
 epoch: 43, train_loss: 0.5229, test_loss: 0.9396, test_f1: 0.6485
 epoch: 44, train_loss: 0.4874, test_loss: 1.0131, test_f1: 0.6431
 epoch: 45, train_loss: 0.4686, test_loss: 0.9479, test_f1: 0.6666
 epoch: 46, train_loss: 0.4975, test_loss: 0.9291, test_f1: 0.6783
 epoch: 47, train_loss: 0.4684, test_loss: 0.9347, test_f1: 0.6463
 epoch: 48, train_loss: 0.4663, test_loss: 0.8878, test_f1: 0.6763
 epoch: 49, train_loss: 0.4780, test_loss: 0.9012, test_f1: 0.6517
 epoch: 50, train_loss: 0.4612, test_loss: 0.9570, test_f1: 0.6625
 epoch: 51, train_loss: 0.4228, test_loss: 1.0171, test_f1: 0.6585
 epoch: 52, train_loss: 0.4029, test_loss: 0.9167, test_f1: 0.6757
 epoch: 53, train_loss: 0.3988, test_loss: 0.9609, test_f1: 0.6666
 epoch: 54, train_loss: 0.3864, test_loss: 0.9371, test_f1: 0.6758
 epoch: 55, train_loss: 0.3726, test_loss: 1.0746, test_f1: 0.6785
 epoch: 56, train_loss: 0.3827, test_loss: 1.0821, test_f1: 0.6697
 epoch: 57, train_loss: 0.3683, test_loss: 1.0890, test_f1: 0.6912
 epoch: 58, train_loss: 0.3810, test_loss: 1.0154, test_f1: 0.6856
 epoch: 59, train_loss: 0.3690, test_loss: 1.1282, test_f1: 0.6724
 epoch: 60, train_loss: 0.3532, test_loss: 1.0632, test_f1: 0.6684
 epoch: 61, train_loss: 0.3710, test_loss: 1.0316, test_f1: 0.6739
 epoch: 62, train_loss: 0.3494, test_loss: 1.0650, test_f1: 0.6749
 epoch: 63, train_loss: 0.3410, test_loss: 1.1305, test_f1: 0.6642
 epoch: 64, train_loss: 0.3395, test_loss: 1.1753, test_f1: 0.6828
 epoch: 65, train_loss: 0.3231, test_loss: 1.0574, test_f1: 0.6828
 epoch: 66, train_loss: 0.3084, test_loss: 1.1883, test_f1: 0.6841
 epoch: 67, train_loss: 0.3245, test_loss: 1.1618, test_f1: 0.6934
 epoch: 68, train_loss: 0.3064, test_loss: 1.2223, test_f1: 0.6846
 epoch: 69, train_loss: 0.3177, test_loss: 1.1084, test_f1: 0.6787
 epoch: 70, train_loss: 0.3321, test_loss: 1.2560, test_f1: 0.6667
 epoch: 71, train_loss: 0.3153, test_loss: 1.3612, test_f1: 0.6771
 epoch: 72, train_loss: 0.3059, test_loss: 1.3471, test_f1: 0.6652
 epoch: 73, train_loss: 0.3237, test_loss: 1.2932, test_f1: 0.6641
 epoch: 74, train_loss: 0.3289, test_loss: 1.1616, test_f1: 0.7018
 epoch: 75, train_loss: 0.2920, test_loss: 1.2668, test_f1: 0.6790
 epoch: 76, train_loss: 0.3188, test_loss: 1.0497, test_f1: 0.6965
 epoch: 77, train_loss: 0.3043, test_loss: 1.3423, test_f1: 0.6893
 epoch: 78, train_loss: 0.2792, test_loss: 1.2903, test_f1: 0.6848
 epoch: 79, train_loss: 0.2949, test_loss: 1.2451, test_f1: 0.6934
 epoch: 80, train_loss: 0.2878, test_loss: 1.2794, test_f1: 0.6737
 epoch: 81, train_loss: 0.2917, test_loss: 1.2709, test_f1: 0.6830
 epoch: 82, train_loss: 0.2724, test_loss: 1.3913, test_f1: 0.6697
 epoch: 83, train_loss: 0.2563, test_loss: 1.3451, test_f1: 0.6785
 epoch: 84, train_loss: 0.2750, test_loss: 1.2779, test_f1: 0.6695
 epoch: 85, train_loss: 0.2771, test_loss: 1.2039, test_f1: 0.6855
 epoch: 86, train_loss: 0.2659, test_loss: 1.2052, test_f1: 0.6869
 epoch: 87, train_loss: 0.2735, test_loss: 1.3053, test_f1: 0.6755
 epoch: 88, train_loss: 0.2649, test_loss: 1.2981, test_f1: 0.7031
 epoch: 89, train_loss: 0.2767, test_loss: 1.2905, test_f1: 0.7052
 epoch: 90, train_loss: 0.2544, test_loss: 1.2712, test_f1: 0.6846
 epoch: 91, train_loss: 0.2450, test_loss: 1.3977, test_f1: 0.6942
 epoch: 92, train_loss: 0.2389, test_loss: 1.3287, test_f1: 0.6819
 epoch: 93, train_loss: 0.2656, test_loss: 1.4088, test_f1: 0.6891
 epoch: 94, train_loss: 0.2444, test_loss: 1.3683, test_f1: 0.6913
 epoch: 95, train_loss: 0.2496, test_loss: 1.3714, test_f1: 0.6910
 epoch: 96, train_loss: 0.2456, test_loss: 1.4890, test_f1: 0.6847
 epoch: 97, train_loss: 0.2413, test_loss: 1.5159, test_f1: 0.6765
 epoch: 98, train_loss: 0.2334, test_loss: 1.4156, test_f1: 0.7010
 epoch: 99, train_loss: 0.2446, test_loss: 1.5195, test_f1: 0.6702
##################ITERATION #3 ****************************************
 epoch: 0, train_loss: 1.1408, test_loss: 1.0650, test_f1: 0.4209
 epoch: 1, train_loss: 0.9891, test_loss: 0.9995, test_f1: 0.4950
 epoch: 2, train_loss: 0.9555, test_loss: 0.9587, test_f1: 0.5450
 epoch: 3, train_loss: 0.9352, test_loss: 0.9368, test_f1: 0.5260
 epoch: 4, train_loss: 0.9138, test_loss: 0.9235, test_f1: 0.5594
 epoch: 5, train_loss: 0.8858, test_loss: 0.8801, test_f1: 0.5816
 epoch: 6, train_loss: 0.8783, test_loss: 0.8903, test_f1: 0.5578
 epoch: 7, train_loss: 0.8508, test_loss: 0.8372, test_f1: 0.5922
 epoch: 8, train_loss: 0.8385, test_loss: 0.8621, test_f1: 0.5551
 epoch: 9, train_loss: 0.8240, test_loss: 0.8386, test_f1: 0.5828
 epoch: 10, train_loss: 0.8105, test_loss: 0.8115, test_f1: 0.6216
 epoch: 11, train_loss: 0.7883, test_loss: 0.8266, test_f1: 0.6138
 epoch: 12, train_loss: 0.7732, test_loss: 0.7894, test_f1: 0.6107
 epoch: 13, train_loss: 0.7633, test_loss: 0.7810, test_f1: 0.6127
 epoch: 14, train_loss: 0.7534, test_loss: 0.7458, test_f1: 0.6360
 epoch: 15, train_loss: 0.7173, test_loss: 0.8312, test_f1: 0.6434
 epoch: 16, train_loss: 0.7067, test_loss: 0.7960, test_f1: 0.6364
 epoch: 17, train_loss: 0.7039, test_loss: 0.8280, test_f1: 0.6391
 epoch: 18, train_loss: 0.6950, test_loss: 0.7779, test_f1: 0.6525
 epoch: 19, train_loss: 0.6854, test_loss: 0.8090, test_f1: 0.6221
 epoch: 20, train_loss: 0.6832, test_loss: 0.7608, test_f1: 0.6523
 epoch: 21, train_loss: 0.6522, test_loss: 0.7552, test_f1: 0.6499
 epoch: 22, train_loss: 0.6462, test_loss: 0.8261, test_f1: 0.6515
 epoch: 23, train_loss: 0.6496, test_loss: 0.8498, test_f1: 0.6400
 epoch: 24, train_loss: 0.6311, test_loss: 0.8352, test_f1: 0.6529
 epoch: 25, train_loss: 0.6146, test_loss: 0.7726, test_f1: 0.6453
 epoch: 26, train_loss: 0.5984, test_loss: 0.7809, test_f1: 0.6482
 epoch: 27, train_loss: 0.5814, test_loss: 0.8139, test_f1: 0.6455
 epoch: 28, train_loss: 0.6222, test_loss: 0.8024, test_f1: 0.6740
 epoch: 29, train_loss: 0.5845, test_loss: 0.8554, test_f1: 0.6632
 epoch: 30, train_loss: 0.5845, test_loss: 0.8084, test_f1: 0.6489
 epoch: 31, train_loss: 0.5572, test_loss: 0.8867, test_f1: 0.6478
 epoch: 32, train_loss: 0.5756, test_loss: 0.8962, test_f1: 0.6377
 epoch: 33, train_loss: 0.5553, test_loss: 0.8051, test_f1: 0.6478
 epoch: 34, train_loss: 0.5488, test_loss: 0.8212, test_f1: 0.6510
 epoch: 35, train_loss: 0.5468, test_loss: 0.9496, test_f1: 0.6546
 epoch: 36, train_loss: 0.5339, test_loss: 0.8652, test_f1: 0.6438
 epoch: 37, train_loss: 0.5402, test_loss: 0.8804, test_f1: 0.6474
 epoch: 38, train_loss: 0.4940, test_loss: 0.8904, test_f1: 0.6558
 epoch: 39, train_loss: 0.5121, test_loss: 0.9535, test_f1: 0.6511
 epoch: 40, train_loss: 0.4993, test_loss: 0.8772, test_f1: 0.6610
 epoch: 41, train_loss: 0.4936, test_loss: 1.0176, test_f1: 0.6417
 epoch: 42, train_loss: 0.4807, test_loss: 0.9031, test_f1: 0.6619
 epoch: 43, train_loss: 0.4935, test_loss: 0.9556, test_f1: 0.6633
 epoch: 44, train_loss: 0.4736, test_loss: 0.9261, test_f1: 0.6533
 epoch: 45, train_loss: 0.4652, test_loss: 0.9288, test_f1: 0.6669
 epoch: 46, train_loss: 0.4793, test_loss: 0.8844, test_f1: 0.6558
 epoch: 47, train_loss: 0.4544, test_loss: 0.9564, test_f1: 0.6543
 epoch: 48, train_loss: 0.4769, test_loss: 0.8993, test_f1: 0.6407
 epoch: 49, train_loss: 0.4616, test_loss: 0.8774, test_f1: 0.6556
 epoch: 50, train_loss: 0.4387, test_loss: 1.0077, test_f1: 0.6590
 epoch: 51, train_loss: 0.3937, test_loss: 0.9829, test_f1: 0.6724
 epoch: 52, train_loss: 0.3785, test_loss: 0.9930, test_f1: 0.6808
 epoch: 53, train_loss: 0.3658, test_loss: 1.0474, test_f1: 0.6638
 epoch: 54, train_loss: 0.3581, test_loss: 1.0661, test_f1: 0.6622
 epoch: 55, train_loss: 0.3467, test_loss: 1.0317, test_f1: 0.6754
 epoch: 56, train_loss: 0.3310, test_loss: 1.0334, test_f1: 0.6905
 epoch: 57, train_loss: 0.3333, test_loss: 1.1293, test_f1: 0.6617
 epoch: 58, train_loss: 0.3395, test_loss: 1.0548, test_f1: 0.6769
 epoch: 59, train_loss: 0.3270, test_loss: 1.1056, test_f1: 0.6797
 epoch: 60, train_loss: 0.3449, test_loss: 1.0978, test_f1: 0.6771
 epoch: 61, train_loss: 0.3400, test_loss: 1.1031, test_f1: 0.6830
 epoch: 62, train_loss: 0.3147, test_loss: 1.0953, test_f1: 0.6708
 epoch: 63, train_loss: 0.3125, test_loss: 1.1427, test_f1: 0.6766
 epoch: 64, train_loss: 0.3308, test_loss: 1.2205, test_f1: 0.6696
 epoch: 65, train_loss: 0.3103, test_loss: 1.1120, test_f1: 0.6674
 epoch: 66, train_loss: 0.3431, test_loss: 1.0923, test_f1: 0.6786
 epoch: 67, train_loss: 0.3357, test_loss: 1.0684, test_f1: 0.6746
 epoch: 68, train_loss: 0.3225, test_loss: 1.1844, test_f1: 0.6782
 epoch: 69, train_loss: 0.3103, test_loss: 1.2338, test_f1: 0.6770
 epoch: 70, train_loss: 0.3175, test_loss: 1.0658, test_f1: 0.6821
 epoch: 71, train_loss: 0.2909, test_loss: 1.1635, test_f1: 0.6513
 epoch: 72, train_loss: 0.3038, test_loss: 1.2240, test_f1: 0.6674
 epoch: 73, train_loss: 0.3043, test_loss: 1.2954, test_f1: 0.6718
 epoch: 74, train_loss: 0.3022, test_loss: 1.3089, test_f1: 0.6642
 epoch: 75, train_loss: 0.2802, test_loss: 1.2457, test_f1: 0.6698
 epoch: 76, train_loss: 0.2854, test_loss: 1.2135, test_f1: 0.6763
 epoch: 77, train_loss: 0.2886, test_loss: 1.2643, test_f1: 0.6855
 epoch: 78, train_loss: 0.2729, test_loss: 1.3801, test_f1: 0.6765
 epoch: 79, train_loss: 0.2913, test_loss: 1.3719, test_f1: 0.6576
 epoch: 80, train_loss: 0.2738, test_loss: 1.3342, test_f1: 0.6735
 epoch: 81, train_loss: 0.2584, test_loss: 1.3097, test_f1: 0.6724
 epoch: 82, train_loss: 0.2709, test_loss: 1.3622, test_f1: 0.6663
 epoch: 83, train_loss: 0.2548, test_loss: 1.3494, test_f1: 0.6644
 epoch: 84, train_loss: 0.2512, test_loss: 1.4733, test_f1: 0.6572
 epoch: 85, train_loss: 0.2403, test_loss: 1.4639, test_f1: 0.6646
 epoch: 86, train_loss: 0.2629, test_loss: 1.4409, test_f1: 0.6675
 epoch: 87, train_loss: 0.2684, test_loss: 1.3033, test_f1: 0.6758
 epoch: 88, train_loss: 0.2332, test_loss: 1.3726, test_f1: 0.6706
 epoch: 89, train_loss: 0.2382, test_loss: 1.3300, test_f1: 0.6870
 epoch: 90, train_loss: 0.2526, test_loss: 1.4098, test_f1: 0.6464
 epoch: 91, train_loss: 0.2687, test_loss: 1.5112, test_f1: 0.6653
 epoch: 92, train_loss: 0.2588, test_loss: 1.4248, test_f1: 0.6707
 epoch: 93, train_loss: 0.2415, test_loss: 1.4302, test_f1: 0.6712
 epoch: 94, train_loss: 0.2442, test_loss: 1.4731, test_f1: 0.6792
 epoch: 95, train_loss: 0.2528, test_loss: 1.3860, test_f1: 0.6926
 epoch: 96, train_loss: 0.2519, test_loss: 1.3867, test_f1: 0.6751
 epoch: 97, train_loss: 0.2358, test_loss: 1.5447, test_f1: 0.6585
 epoch: 98, train_loss: 0.2384, test_loss: 1.5364, test_f1: 0.6672
 epoch: 99, train_loss: 0.2211, test_loss: 1.3597, test_f1: 0.6711
##################ITERATION #4 ****************************************
 epoch: 0, train_loss: 1.2017, test_loss: 1.2212, test_f1: 0.3522
 epoch: 1, train_loss: 1.0165, test_loss: 1.0622, test_f1: 0.4851
 epoch: 2, train_loss: 0.9622, test_loss: 0.9644, test_f1: 0.5303
 epoch: 3, train_loss: 0.9317, test_loss: 0.9675, test_f1: 0.5339
 epoch: 4, train_loss: 0.9110, test_loss: 0.9480, test_f1: 0.5355
 epoch: 5, train_loss: 0.8925, test_loss: 0.9563, test_f1: 0.5283
 epoch: 6, train_loss: 0.8606, test_loss: 0.8530, test_f1: 0.5350
 epoch: 7, train_loss: 0.8479, test_loss: 0.8729, test_f1: 0.5499
 epoch: 8, train_loss: 0.8312, test_loss: 0.7867, test_f1: 0.5684
 epoch: 9, train_loss: 0.8027, test_loss: 0.8313, test_f1: 0.5627
 epoch: 10, train_loss: 0.7945, test_loss: 0.7553, test_f1: 0.6140
 epoch: 11, train_loss: 0.7755, test_loss: 0.7979, test_f1: 0.5776
 epoch: 12, train_loss: 0.7698, test_loss: 0.7904, test_f1: 0.5930
 epoch: 13, train_loss: 0.7571, test_loss: 0.7672, test_f1: 0.5869
 epoch: 14, train_loss: 0.7304, test_loss: 0.7831, test_f1: 0.6067
 epoch: 15, train_loss: 0.7127, test_loss: 0.7644, test_f1: 0.6349
 epoch: 16, train_loss: 0.7164, test_loss: 0.7321, test_f1: 0.6511
 epoch: 17, train_loss: 0.7029, test_loss: 0.7632, test_f1: 0.6214
 epoch: 18, train_loss: 0.6993, test_loss: 0.7724, test_f1: 0.6267
 epoch: 19, train_loss: 0.6908, test_loss: 0.7832, test_f1: 0.5874
 epoch: 20, train_loss: 0.6725, test_loss: 0.7434, test_f1: 0.6195
 epoch: 21, train_loss: 0.6740, test_loss: 0.7953, test_f1: 0.6307
 epoch: 22, train_loss: 0.6469, test_loss: 0.7761, test_f1: 0.6494
 epoch: 23, train_loss: 0.6500, test_loss: 0.7352, test_f1: 0.6620
 epoch: 24, train_loss: 0.6325, test_loss: 0.7711, test_f1: 0.6216
 epoch: 25, train_loss: 0.6296, test_loss: 0.8966, test_f1: 0.5907
 epoch: 26, train_loss: 0.6567, test_loss: 0.8121, test_f1: 0.6221
 epoch: 27, train_loss: 0.6054, test_loss: 0.7377, test_f1: 0.6595
 epoch: 28, train_loss: 0.5924, test_loss: 0.7835, test_f1: 0.6473
 epoch: 29, train_loss: 0.6233, test_loss: 0.7975, test_f1: 0.6405
 epoch: 30, train_loss: 0.5865, test_loss: 0.8336, test_f1: 0.6349
 epoch: 31, train_loss: 0.6022, test_loss: 0.7514, test_f1: 0.6437
 epoch: 32, train_loss: 0.6016, test_loss: 0.8182, test_f1: 0.6429
 epoch: 33, train_loss: 0.5912, test_loss: 0.7572, test_f1: 0.6452
 epoch: 34, train_loss: 0.5684, test_loss: 0.8246, test_f1: 0.6287
 epoch: 35, train_loss: 0.5590, test_loss: 0.7544, test_f1: 0.6422
 epoch: 36, train_loss: 0.5408, test_loss: 0.9335, test_f1: 0.5983
 epoch: 37, train_loss: 0.5533, test_loss: 0.7433, test_f1: 0.6643
 epoch: 38, train_loss: 0.5376, test_loss: 0.7590, test_f1: 0.6633
 epoch: 39, train_loss: 0.5328, test_loss: 0.8187, test_f1: 0.6441
 epoch: 40, train_loss: 0.5271, test_loss: 0.7870, test_f1: 0.6770
 epoch: 41, train_loss: 0.5252, test_loss: 0.8978, test_f1: 0.6250
 epoch: 42, train_loss: 0.5058, test_loss: 0.8915, test_f1: 0.6446
 epoch: 43, train_loss: 0.5043, test_loss: 0.8672, test_f1: 0.6509
 epoch: 44, train_loss: 0.5093, test_loss: 0.7774, test_f1: 0.6585
 epoch: 45, train_loss: 0.4780, test_loss: 0.9001, test_f1: 0.6369
 epoch: 46, train_loss: 0.4868, test_loss: 0.8261, test_f1: 0.6536
 epoch: 47, train_loss: 0.4912, test_loss: 0.8516, test_f1: 0.6372
 epoch: 48, train_loss: 0.4765, test_loss: 0.9488, test_f1: 0.6620
 epoch: 49, train_loss: 0.4812, test_loss: 0.8738, test_f1: 0.6444
 epoch: 50, train_loss: 0.4628, test_loss: 0.9310, test_f1: 0.6470
 epoch: 51, train_loss: 0.4411, test_loss: 0.9366, test_f1: 0.6571
 epoch: 52, train_loss: 0.4091, test_loss: 0.8397, test_f1: 0.7032
 epoch: 53, train_loss: 0.3871, test_loss: 0.9095, test_f1: 0.6513
 epoch: 54, train_loss: 0.3803, test_loss: 0.9021, test_f1: 0.6842
 epoch: 55, train_loss: 0.3763, test_loss: 0.9906, test_f1: 0.6584
 epoch: 56, train_loss: 0.3798, test_loss: 0.9750, test_f1: 0.6437
 epoch: 57, train_loss: 0.3725, test_loss: 1.0077, test_f1: 0.6400
 epoch: 58, train_loss: 0.3736, test_loss: 1.0375, test_f1: 0.6524
 epoch: 59, train_loss: 0.3666, test_loss: 1.0046, test_f1: 0.6543
 epoch: 60, train_loss: 0.3564, test_loss: 1.0082, test_f1: 0.6594
 epoch: 61, train_loss: 0.3658, test_loss: 1.1214, test_f1: 0.6375
 epoch: 62, train_loss: 0.3469, test_loss: 0.9245, test_f1: 0.6802
 epoch: 63, train_loss: 0.3368, test_loss: 1.0140, test_f1: 0.6628
 epoch: 64, train_loss: 0.3483, test_loss: 0.9711, test_f1: 0.6728
 epoch: 65, train_loss: 0.3380, test_loss: 1.0540, test_f1: 0.6553
 epoch: 66, train_loss: 0.3329, test_loss: 0.9892, test_f1: 0.6571
 epoch: 67, train_loss: 0.3452, test_loss: 1.1863, test_f1: 0.6523
 epoch: 68, train_loss: 0.3442, test_loss: 1.1681, test_f1: 0.6498
 epoch: 69, train_loss: 0.3186, test_loss: 1.0429, test_f1: 0.6723
 epoch: 70, train_loss: 0.3258, test_loss: 1.1330, test_f1: 0.6578
 epoch: 71, train_loss: 0.3191, test_loss: 1.1226, test_f1: 0.6639
 epoch: 72, train_loss: 0.3304, test_loss: 1.1750, test_f1: 0.6832
 epoch: 73, train_loss: 0.3132, test_loss: 1.0902, test_f1: 0.6575
 epoch: 74, train_loss: 0.3156, test_loss: 1.1041, test_f1: 0.6739
 epoch: 75, train_loss: 0.3084, test_loss: 1.1519, test_f1: 0.6674
 epoch: 76, train_loss: 0.3117, test_loss: 1.0824, test_f1: 0.6667
 epoch: 77, train_loss: 0.2952, test_loss: 1.1211, test_f1: 0.6603
 epoch: 78, train_loss: 0.2984, test_loss: 1.2851, test_f1: 0.6646
 epoch: 79, train_loss: 0.2776, test_loss: 1.1990, test_f1: 0.6594
 epoch: 80, train_loss: 0.2980, test_loss: 1.1386, test_f1: 0.6685
 epoch: 81, train_loss: 0.2969, test_loss: 1.1922, test_f1: 0.6519
 epoch: 82, train_loss: 0.2906, test_loss: 1.1038, test_f1: 0.6497
 epoch: 83, train_loss: 0.2929, test_loss: 1.2143, test_f1: 0.6640
 epoch: 84, train_loss: 0.2841, test_loss: 1.2033, test_f1: 0.6637
 epoch: 85, train_loss: 0.2683, test_loss: 1.2751, test_f1: 0.6559
 epoch: 86, train_loss: 0.2596, test_loss: 1.3192, test_f1: 0.6554
 epoch: 87, train_loss: 0.2720, test_loss: 1.2955, test_f1: 0.6585
 epoch: 88, train_loss: 0.2753, test_loss: 1.2536, test_f1: 0.6696
 epoch: 89, train_loss: 0.2690, test_loss: 1.3073, test_f1: 0.6514
 epoch: 90, train_loss: 0.2746, test_loss: 1.3845, test_f1: 0.6524
 epoch: 91, train_loss: 0.2594, test_loss: 1.2975, test_f1: 0.6573
 epoch: 92, train_loss: 0.2476, test_loss: 1.3506, test_f1: 0.6568
 epoch: 93, train_loss: 0.2724, test_loss: 1.2896, test_f1: 0.6497
 epoch: 94, train_loss: 0.2633, test_loss: 1.2635, test_f1: 0.6495
 epoch: 95, train_loss: 0.2576, test_loss: 1.3205, test_f1: 0.6614
 epoch: 96, train_loss: 0.2564, test_loss: 1.3783, test_f1: 0.6500
 epoch: 97, train_loss: 0.2550, test_loss: 1.3375, test_f1: 0.6608
 epoch: 98, train_loss: 0.2434, test_loss: 1.2023, test_f1: 0.6795
 epoch: 99, train_loss: 0.2462, test_loss: 1.2983, test_f1: 0.6676
##################ITERATION #5 ****************************************
 epoch: 0, train_loss: 1.2657, test_loss: 1.8101, test_f1: 0.3050
 epoch: 1, train_loss: 1.0258, test_loss: 0.9536, test_f1: 0.4981
 epoch: 2, train_loss: 0.9657, test_loss: 0.8945, test_f1: 0.5667
 epoch: 3, train_loss: 0.9441, test_loss: 0.8787, test_f1: 0.5202
 epoch: 4, train_loss: 0.9224, test_loss: 0.8621, test_f1: 0.5421
 epoch: 5, train_loss: 0.8993, test_loss: 0.8666, test_f1: 0.5145
 epoch: 6, train_loss: 0.8978, test_loss: 0.8535, test_f1: 0.5907
 epoch: 7, train_loss: 0.8667, test_loss: 0.8306, test_f1: 0.5845
 epoch: 8, train_loss: 0.8386, test_loss: 0.8411, test_f1: 0.5461
 epoch: 9, train_loss: 0.8446, test_loss: 0.8088, test_f1: 0.5821
 epoch: 10, train_loss: 0.8125, test_loss: 0.8238, test_f1: 0.5735
 epoch: 11, train_loss: 0.8000, test_loss: 0.8030, test_f1: 0.5941
 epoch: 12, train_loss: 0.7938, test_loss: 0.8050, test_f1: 0.5900
 epoch: 13, train_loss: 0.7870, test_loss: 0.8363, test_f1: 0.5775
 epoch: 14, train_loss: 0.7641, test_loss: 0.7512, test_f1: 0.6248
 epoch: 15, train_loss: 0.7407, test_loss: 0.7905, test_f1: 0.6203
 epoch: 16, train_loss: 0.7533, test_loss: 0.7068, test_f1: 0.6482
 epoch: 17, train_loss: 0.7320, test_loss: 0.7358, test_f1: 0.6498
 epoch: 18, train_loss: 0.7109, test_loss: 0.7064, test_f1: 0.6296
 epoch: 19, train_loss: 0.6964, test_loss: 0.7230, test_f1: 0.6474
 epoch: 20, train_loss: 0.6864, test_loss: 0.7869, test_f1: 0.6533
 epoch: 21, train_loss: 0.6865, test_loss: 0.7314, test_f1: 0.6714
 epoch: 22, train_loss: 0.6862, test_loss: 0.7265, test_f1: 0.6826
 epoch: 23, train_loss: 0.6544, test_loss: 0.7247, test_f1: 0.6545
 epoch: 24, train_loss: 0.6364, test_loss: 0.7807, test_f1: 0.6583
 epoch: 25, train_loss: 0.6443, test_loss: 0.8549, test_f1: 0.6329
 epoch: 26, train_loss: 0.6313, test_loss: 0.7082, test_f1: 0.6754
 epoch: 27, train_loss: 0.6302, test_loss: 0.7350, test_f1: 0.6673
 epoch: 28, train_loss: 0.6183, test_loss: 0.7648, test_f1: 0.6549
 epoch: 29, train_loss: 0.6033, test_loss: 0.6861, test_f1: 0.6736
 epoch: 30, train_loss: 0.6093, test_loss: 0.7485, test_f1: 0.6515
 epoch: 31, train_loss: 0.5926, test_loss: 0.7002, test_f1: 0.6821
 epoch: 32, train_loss: 0.5923, test_loss: 0.7339, test_f1: 0.6616
 epoch: 33, train_loss: 0.6033, test_loss: 0.6943, test_f1: 0.6728
 epoch: 34, train_loss: 0.5800, test_loss: 0.6924, test_f1: 0.6851
 epoch: 35, train_loss: 0.5774, test_loss: 0.7339, test_f1: 0.6453
 epoch: 36, train_loss: 0.5524, test_loss: 0.7592, test_f1: 0.7125
 epoch: 37, train_loss: 0.5543, test_loss: 0.7465, test_f1: 0.6687
 epoch: 38, train_loss: 0.5506, test_loss: 0.6879, test_f1: 0.6850
 epoch: 39, train_loss: 0.5507, test_loss: 0.7378, test_f1: 0.6919
 epoch: 40, train_loss: 0.5252, test_loss: 0.7829, test_f1: 0.6742
 epoch: 41, train_loss: 0.5376, test_loss: 0.7474, test_f1: 0.7144
 epoch: 42, train_loss: 0.5287, test_loss: 0.8033, test_f1: 0.6772
 epoch: 43, train_loss: 0.5197, test_loss: 0.8202, test_f1: 0.6792
 epoch: 44, train_loss: 0.5258, test_loss: 0.7933, test_f1: 0.6648
 epoch: 45, train_loss: 0.4951, test_loss: 0.9200, test_f1: 0.6678
 epoch: 46, train_loss: 0.4978, test_loss: 0.8464, test_f1: 0.6804
 epoch: 47, train_loss: 0.4813, test_loss: 0.8272, test_f1: 0.6863
 epoch: 48, train_loss: 0.4965, test_loss: 0.7711, test_f1: 0.6677
 epoch: 49, train_loss: 0.4908, test_loss: 0.7971, test_f1: 0.7000
 epoch: 50, train_loss: 0.4751, test_loss: 0.8042, test_f1: 0.6931
 epoch: 51, train_loss: 0.4450, test_loss: 0.7946, test_f1: 0.6919
 epoch: 52, train_loss: 0.4126, test_loss: 0.8035, test_f1: 0.6783
 epoch: 53, train_loss: 0.4076, test_loss: 0.8362, test_f1: 0.6780
 epoch: 54, train_loss: 0.4103, test_loss: 0.8094, test_f1: 0.6808
 epoch: 55, train_loss: 0.3874, test_loss: 0.8269, test_f1: 0.7278
 epoch: 56, train_loss: 0.3952, test_loss: 0.8154, test_f1: 0.6773
 epoch: 57, train_loss: 0.3925, test_loss: 0.9466, test_f1: 0.6659
 epoch: 58, train_loss: 0.3928, test_loss: 0.8850, test_f1: 0.6795
 epoch: 59, train_loss: 0.3758, test_loss: 0.9024, test_f1: 0.6851
 epoch: 60, train_loss: 0.3874, test_loss: 0.9080, test_f1: 0.7127
 epoch: 61, train_loss: 0.3643, test_loss: 0.8746, test_f1: 0.6675
 epoch: 62, train_loss: 0.3602, test_loss: 0.9399, test_f1: 0.6853
 epoch: 63, train_loss: 0.3605, test_loss: 0.9731, test_f1: 0.6924
 epoch: 64, train_loss: 0.3540, test_loss: 0.9537, test_f1: 0.6973
 epoch: 65, train_loss: 0.3534, test_loss: 0.9180, test_f1: 0.6948
 epoch: 66, train_loss: 0.3512, test_loss: 0.9572, test_f1: 0.6764
 epoch: 67, train_loss: 0.3510, test_loss: 1.0977, test_f1: 0.6707
 epoch: 68, train_loss: 0.3510, test_loss: 0.9920, test_f1: 0.6787
 epoch: 69, train_loss: 0.3515, test_loss: 1.1028, test_f1: 0.6717
 epoch: 70, train_loss: 0.3251, test_loss: 0.9926, test_f1: 0.7009
 epoch: 71, train_loss: 0.3554, test_loss: 1.0551, test_f1: 0.6917
 epoch: 72, train_loss: 0.3499, test_loss: 0.9620, test_f1: 0.6784
 epoch: 73, train_loss: 0.3220, test_loss: 1.1335, test_f1: 0.6499
 epoch: 74, train_loss: 0.3292, test_loss: 1.1756, test_f1: 0.6693
 epoch: 75, train_loss: 0.3327, test_loss: 1.1304, test_f1: 0.6764
 epoch: 76, train_loss: 0.2932, test_loss: 1.1013, test_f1: 0.6675
 epoch: 77, train_loss: 0.3186, test_loss: 1.2224, test_f1: 0.6653
 epoch: 78, train_loss: 0.3346, test_loss: 1.1274, test_f1: 0.7005
 epoch: 79, train_loss: 0.3099, test_loss: 1.1547, test_f1: 0.6667
 epoch: 80, train_loss: 0.3014, test_loss: 1.1970, test_f1: 0.6558
 epoch: 81, train_loss: 0.3128, test_loss: 1.2266, test_f1: 0.6544
 epoch: 82, train_loss: 0.3021, test_loss: 1.2159, test_f1: 0.6645
 epoch: 83, train_loss: 0.3069, test_loss: 1.2906, test_f1: 0.6372
 epoch: 84, train_loss: 0.3037, test_loss: 1.1760, test_f1: 0.6988
 epoch: 85, train_loss: 0.2904, test_loss: 1.2194, test_f1: 0.6717
 epoch: 86, train_loss: 0.2987, test_loss: 1.2663, test_f1: 0.6893
 epoch: 87, train_loss: 0.2881, test_loss: 1.2536, test_f1: 0.6713
 epoch: 88, train_loss: 0.2951, test_loss: 1.2809, test_f1: 0.6514
 epoch: 89, train_loss: 0.2841, test_loss: 1.4191, test_f1: 0.6556
 epoch: 90, train_loss: 0.2797, test_loss: 1.3666, test_f1: 0.6598
 epoch: 91, train_loss: 0.2832, test_loss: 1.2633, test_f1: 0.6565
 epoch: 92, train_loss: 0.2777, test_loss: 1.2832, test_f1: 0.6446
 epoch: 93, train_loss: 0.2653, test_loss: 1.3683, test_f1: 0.6627
 epoch: 94, train_loss: 0.2655, test_loss: 1.3124, test_f1: 0.6594
 epoch: 95, train_loss: 0.2595, test_loss: 1.3131, test_f1: 0.6525
 epoch: 96, train_loss: 0.2818, test_loss: 1.3347, test_f1: 0.6605
 epoch: 97, train_loss: 0.2642, test_loss: 1.4188, test_f1: 0.6367
 epoch: 98, train_loss: 0.2583, test_loss: 1.2176, test_f1: 0.6877
 epoch: 99, train_loss: 0.2743, test_loss: 1.5199, test_f1: 0.6455
##################ITERATION #6 ****************************************
 epoch: 0, train_loss: 1.3153, test_loss: 1.2370, test_f1: 0.4024
 epoch: 1, train_loss: 1.0174, test_loss: 0.9792, test_f1: 0.4892
 epoch: 2, train_loss: 0.9697, test_loss: 0.9128, test_f1: 0.5089
 epoch: 3, train_loss: 0.9288, test_loss: 0.9492, test_f1: 0.5186
 epoch: 4, train_loss: 0.9117, test_loss: 0.9101, test_f1: 0.5594
 epoch: 5, train_loss: 0.8928, test_loss: 0.9120, test_f1: 0.5215
 epoch: 6, train_loss: 0.8781, test_loss: 0.8705, test_f1: 0.5965
 epoch: 7, train_loss: 0.8384, test_loss: 0.8474, test_f1: 0.5592
 epoch: 8, train_loss: 0.8403, test_loss: 0.8063, test_f1: 0.6215
 epoch: 9, train_loss: 0.8248, test_loss: 0.8446, test_f1: 0.5865
 epoch: 10, train_loss: 0.8078, test_loss: 0.8676, test_f1: 0.5741
 epoch: 11, train_loss: 0.7905, test_loss: 0.8368, test_f1: 0.5869
 epoch: 12, train_loss: 0.7801, test_loss: 0.8365, test_f1: 0.6133
 epoch: 13, train_loss: 0.7615, test_loss: 0.8253, test_f1: 0.6580
 epoch: 14, train_loss: 0.7637, test_loss: 0.8422, test_f1: 0.6522
 epoch: 15, train_loss: 0.7286, test_loss: 0.7549, test_f1: 0.6531
 epoch: 16, train_loss: 0.7300, test_loss: 0.7956, test_f1: 0.6392
 epoch: 17, train_loss: 0.7316, test_loss: 0.8085, test_f1: 0.6218
 epoch: 18, train_loss: 0.7226, test_loss: 0.7786, test_f1: 0.6570
 epoch: 19, train_loss: 0.7069, test_loss: 0.7880, test_f1: 0.6130
 epoch: 20, train_loss: 0.7012, test_loss: 0.7500, test_f1: 0.6701
 epoch: 21, train_loss: 0.6889, test_loss: 0.7524, test_f1: 0.6484
 epoch: 22, train_loss: 0.6737, test_loss: 0.7528, test_f1: 0.6423
 epoch: 23, train_loss: 0.6513, test_loss: 0.7265, test_f1: 0.6582
 epoch: 24, train_loss: 0.6395, test_loss: 0.8022, test_f1: 0.6580
 epoch: 25, train_loss: 0.6417, test_loss: 0.8543, test_f1: 0.6627
 epoch: 26, train_loss: 0.6213, test_loss: 0.7445, test_f1: 0.6876
 epoch: 27, train_loss: 0.6149, test_loss: 0.7633, test_f1: 0.6578
 epoch: 28, train_loss: 0.6146, test_loss: 0.7662, test_f1: 0.6600
 epoch: 29, train_loss: 0.6287, test_loss: 0.8217, test_f1: 0.6467
 epoch: 30, train_loss: 0.6066, test_loss: 0.7978, test_f1: 0.6488
 epoch: 31, train_loss: 0.5809, test_loss: 0.7515, test_f1: 0.6738
 epoch: 32, train_loss: 0.5708, test_loss: 0.7749, test_f1: 0.6574
 epoch: 33, train_loss: 0.5852, test_loss: 0.7407, test_f1: 0.6542
 epoch: 34, train_loss: 0.5638, test_loss: 0.7818, test_f1: 0.6958
 epoch: 35, train_loss: 0.5676, test_loss: 0.8257, test_f1: 0.6353
 epoch: 36, train_loss: 0.5544, test_loss: 0.7990, test_f1: 0.6718
 epoch: 37, train_loss: 0.5561, test_loss: 0.7842, test_f1: 0.6735
 epoch: 38, train_loss: 0.5363, test_loss: 0.8795, test_f1: 0.6537
 epoch: 39, train_loss: 0.5425, test_loss: 0.7490, test_f1: 0.6647
 epoch: 40, train_loss: 0.5421, test_loss: 0.8892, test_f1: 0.6230
 epoch: 41, train_loss: 0.5208, test_loss: 0.9095, test_f1: 0.6305
 epoch: 42, train_loss: 0.5080, test_loss: 0.8935, test_f1: 0.6530
 epoch: 43, train_loss: 0.5458, test_loss: 0.8124, test_f1: 0.6732
 epoch: 44, train_loss: 0.5272, test_loss: 0.9160, test_f1: 0.6555
 epoch: 45, train_loss: 0.5030, test_loss: 0.8714, test_f1: 0.6682
 epoch: 46, train_loss: 0.4908, test_loss: 0.8970, test_f1: 0.6499
 epoch: 47, train_loss: 0.5113, test_loss: 0.7674, test_f1: 0.6706
 epoch: 48, train_loss: 0.4948, test_loss: 0.7656, test_f1: 0.6897
 epoch: 49, train_loss: 0.4704, test_loss: 0.8743, test_f1: 0.6757
 epoch: 50, train_loss: 0.4908, test_loss: 0.8645, test_f1: 0.6535
 epoch: 51, train_loss: 0.4443, test_loss: 0.8506, test_f1: 0.6844
 epoch: 52, train_loss: 0.4206, test_loss: 0.9185, test_f1: 0.6772
 epoch: 53, train_loss: 0.4112, test_loss: 0.8902, test_f1: 0.6785
 epoch: 54, train_loss: 0.4062, test_loss: 0.9443, test_f1: 0.6730
 epoch: 55, train_loss: 0.3936, test_loss: 0.9365, test_f1: 0.6795
 epoch: 56, train_loss: 0.3993, test_loss: 0.9760, test_f1: 0.6552
 epoch: 57, train_loss: 0.3809, test_loss: 0.9304, test_f1: 0.6562
 epoch: 58, train_loss: 0.3968, test_loss: 0.9897, test_f1: 0.6641
 epoch: 59, train_loss: 0.4075, test_loss: 0.9642, test_f1: 0.6742
 epoch: 60, train_loss: 0.3973, test_loss: 0.9552, test_f1: 0.6778
 epoch: 61, train_loss: 0.3715, test_loss: 0.9906, test_f1: 0.6716
 epoch: 62, train_loss: 0.3727, test_loss: 1.0314, test_f1: 0.6854
 epoch: 63, train_loss: 0.3534, test_loss: 0.9964, test_f1: 0.6768
 epoch: 64, train_loss: 0.3588, test_loss: 1.1089, test_f1: 0.6629
 epoch: 65, train_loss: 0.3568, test_loss: 1.0943, test_f1: 0.6492
 epoch: 66, train_loss: 0.3614, test_loss: 1.0607, test_f1: 0.6691
 epoch: 67, train_loss: 0.3707, test_loss: 1.1413, test_f1: 0.6607
 epoch: 68, train_loss: 0.3691, test_loss: 1.0976, test_f1: 0.6615
 epoch: 69, train_loss: 0.3468, test_loss: 1.0778, test_f1: 0.6701
 epoch: 70, train_loss: 0.3520, test_loss: 1.1266, test_f1: 0.6697
 epoch: 71, train_loss: 0.3523, test_loss: 1.0291, test_f1: 0.6695
 epoch: 72, train_loss: 0.3502, test_loss: 1.1235, test_f1: 0.6599
 epoch: 73, train_loss: 0.3737, test_loss: 1.0099, test_f1: 0.6732
 epoch: 74, train_loss: 0.3492, test_loss: 1.0555, test_f1: 0.6732
 epoch: 75, train_loss: 0.3338, test_loss: 1.1332, test_f1: 0.6661
 epoch: 76, train_loss: 0.3369, test_loss: 1.1809, test_f1: 0.6637
 epoch: 77, train_loss: 0.3315, test_loss: 1.1741, test_f1: 0.6688
 epoch: 78, train_loss: 0.3215, test_loss: 1.1199, test_f1: 0.6797
 epoch: 79, train_loss: 0.3240, test_loss: 1.1302, test_f1: 0.6816
 epoch: 80, train_loss: 0.3235, test_loss: 1.1812, test_f1: 0.6667
 epoch: 81, train_loss: 0.3256, test_loss: 1.3419, test_f1: 0.6480
 epoch: 82, train_loss: 0.3080, test_loss: 1.2279, test_f1: 0.6546
 epoch: 83, train_loss: 0.3256, test_loss: 1.1282, test_f1: 0.6584
 epoch: 84, train_loss: 0.3224, test_loss: 1.2943, test_f1: 0.6559
 epoch: 85, train_loss: 0.3103, test_loss: 1.2319, test_f1: 0.6559
 epoch: 86, train_loss: 0.2916, test_loss: 1.1887, test_f1: 0.6688
 epoch: 87, train_loss: 0.3035, test_loss: 1.2417, test_f1: 0.6693
 epoch: 88, train_loss: 0.2969, test_loss: 1.2190, test_f1: 0.6696
 epoch: 89, train_loss: 0.3153, test_loss: 1.2437, test_f1: 0.6600
 epoch: 90, train_loss: 0.3046, test_loss: 1.3100, test_f1: 0.6542
 epoch: 91, train_loss: 0.2916, test_loss: 1.3435, test_f1: 0.6423
 epoch: 92, train_loss: 0.3068, test_loss: 1.2556, test_f1: 0.6522
 epoch: 93, train_loss: 0.2828, test_loss: 1.2635, test_f1: 0.6477
 epoch: 94, train_loss: 0.3039, test_loss: 1.3052, test_f1: 0.6516
 epoch: 95, train_loss: 0.2960, test_loss: 1.2950, test_f1: 0.6569
 epoch: 96, train_loss: 0.2832, test_loss: 1.3317, test_f1: 0.6427
 epoch: 97, train_loss: 0.2855, test_loss: 1.2714, test_f1: 0.6625
 epoch: 98, train_loss: 0.2762, test_loss: 1.3545, test_f1: 0.6638
 epoch: 99, train_loss: 0.2879, test_loss: 1.3693, test_f1: 0.6454
##################ITERATION #7 ****************************************
 epoch: 0, train_loss: 1.3902, test_loss: 1.0419, test_f1: 0.4694
 epoch: 1, train_loss: 1.0429, test_loss: 0.9619, test_f1: 0.4992
 epoch: 2, train_loss: 0.9935, test_loss: 0.9340, test_f1: 0.5000
 epoch: 3, train_loss: 0.9553, test_loss: 0.9084, test_f1: 0.5181
 epoch: 4, train_loss: 0.9471, test_loss: 0.8725, test_f1: 0.5655
 epoch: 5, train_loss: 0.9206, test_loss: 0.8603, test_f1: 0.5563
 epoch: 6, train_loss: 0.9023, test_loss: 0.8534, test_f1: 0.5632
 epoch: 7, train_loss: 0.8920, test_loss: 0.8473, test_f1: 0.5653
 epoch: 8, train_loss: 0.8708, test_loss: 0.9526, test_f1: 0.5265
 epoch: 9, train_loss: 0.8745, test_loss: 0.8541, test_f1: 0.5635
 epoch: 10, train_loss: 0.8468, test_loss: 0.8825, test_f1: 0.5286
 epoch: 11, train_loss: 0.8230, test_loss: 0.8297, test_f1: 0.5850
 epoch: 12, train_loss: 0.8163, test_loss: 0.8015, test_f1: 0.6038
 epoch: 13, train_loss: 0.8152, test_loss: 0.8644, test_f1: 0.5944
 epoch: 14, train_loss: 0.8213, test_loss: 0.8035, test_f1: 0.6138
 epoch: 15, train_loss: 0.7935, test_loss: 0.8487, test_f1: 0.6073
 epoch: 16, train_loss: 0.7751, test_loss: 0.8367, test_f1: 0.5715
 epoch: 17, train_loss: 0.7767, test_loss: 0.7858, test_f1: 0.6178
 epoch: 18, train_loss: 0.7587, test_loss: 0.7623, test_f1: 0.6244
 epoch: 19, train_loss: 0.7495, test_loss: 0.8279, test_f1: 0.5846
 epoch: 20, train_loss: 0.7537, test_loss: 0.7578, test_f1: 0.6381
 epoch: 21, train_loss: 0.7221, test_loss: 0.8130, test_f1: 0.6151
 epoch: 22, train_loss: 0.7252, test_loss: 0.7993, test_f1: 0.6291
 epoch: 23, train_loss: 0.7073, test_loss: 0.8669, test_f1: 0.5841
 epoch: 24, train_loss: 0.7024, test_loss: 0.8778, test_f1: 0.6376
 epoch: 25, train_loss: 0.6929, test_loss: 0.7813, test_f1: 0.6505
 epoch: 26, train_loss: 0.6844, test_loss: 0.7769, test_f1: 0.6635
 epoch: 27, train_loss: 0.6902, test_loss: 0.9024, test_f1: 0.6000
 epoch: 28, train_loss: 0.6659, test_loss: 0.7518, test_f1: 0.6504
 epoch: 29, train_loss: 0.6634, test_loss: 0.8702, test_f1: 0.6121
 epoch: 30, train_loss: 0.6445, test_loss: 0.8422, test_f1: 0.6278
 epoch: 31, train_loss: 0.6472, test_loss: 0.7763, test_f1: 0.6475
 epoch: 32, train_loss: 0.6444, test_loss: 0.8335, test_f1: 0.6323
 epoch: 33, train_loss: 0.6404, test_loss: 0.7861, test_f1: 0.6667
 epoch: 34, train_loss: 0.6212, test_loss: 0.7906, test_f1: 0.6650
 epoch: 35, train_loss: 0.6076, test_loss: 0.7774, test_f1: 0.6769
 epoch: 36, train_loss: 0.5980, test_loss: 0.7268, test_f1: 0.6582
 epoch: 37, train_loss: 0.6059, test_loss: 0.7032, test_f1: 0.6657
 epoch: 38, train_loss: 0.5896, test_loss: 0.7933, test_f1: 0.6725
 epoch: 39, train_loss: 0.5692, test_loss: 0.7295, test_f1: 0.6912
 epoch: 40, train_loss: 0.5816, test_loss: 0.8104, test_f1: 0.6697
 epoch: 41, train_loss: 0.5685, test_loss: 0.8448, test_f1: 0.6484
 epoch: 42, train_loss: 0.5572, test_loss: 0.8109, test_f1: 0.6769
 epoch: 43, train_loss: 0.5612, test_loss: 0.7219, test_f1: 0.6782
 epoch: 44, train_loss: 0.5442, test_loss: 0.7435, test_f1: 0.6847
 epoch: 45, train_loss: 0.5480, test_loss: 0.8293, test_f1: 0.6739
 epoch: 46, train_loss: 0.5311, test_loss: 0.9422, test_f1: 0.6147
 epoch: 47, train_loss: 0.5479, test_loss: 0.7960, test_f1: 0.6705
 epoch: 48, train_loss: 0.5285, test_loss: 0.7485, test_f1: 0.6659
 epoch: 49, train_loss: 0.5267, test_loss: 0.8048, test_f1: 0.6547
 epoch: 50, train_loss: 0.5263, test_loss: 0.9107, test_f1: 0.6127
 epoch: 51, train_loss: 0.4806, test_loss: 0.7881, test_f1: 0.6624
 epoch: 52, train_loss: 0.4573, test_loss: 0.8437, test_f1: 0.6626
 epoch: 53, train_loss: 0.4556, test_loss: 0.8387, test_f1: 0.6603
 epoch: 54, train_loss: 0.4450, test_loss: 0.8913, test_f1: 0.6782
 epoch: 55, train_loss: 0.4338, test_loss: 0.9816, test_f1: 0.6703
 epoch: 56, train_loss: 0.4162, test_loss: 0.9136, test_f1: 0.6673
 epoch: 57, train_loss: 0.4282, test_loss: 0.8703, test_f1: 0.6413
 epoch: 58, train_loss: 0.4182, test_loss: 0.9639, test_f1: 0.6609
 epoch: 59, train_loss: 0.4029, test_loss: 1.0048, test_f1: 0.6624
 epoch: 60, train_loss: 0.3956, test_loss: 1.0067, test_f1: 0.6536
 epoch: 61, train_loss: 0.4151, test_loss: 1.0722, test_f1: 0.6561
 epoch: 62, train_loss: 0.3884, test_loss: 1.0880, test_f1: 0.6552
 epoch: 63, train_loss: 0.4114, test_loss: 1.0133, test_f1: 0.6556
 epoch: 64, train_loss: 0.3944, test_loss: 1.1019, test_f1: 0.6300
 epoch: 65, train_loss: 0.3892, test_loss: 1.0007, test_f1: 0.6419
 epoch: 66, train_loss: 0.3916, test_loss: 1.0508, test_f1: 0.6555
 epoch: 67, train_loss: 0.3828, test_loss: 1.1933, test_f1: 0.6264
 epoch: 68, train_loss: 0.4029, test_loss: 0.9240, test_f1: 0.6639
 epoch: 69, train_loss: 0.3914, test_loss: 1.0688, test_f1: 0.6464
 epoch: 70, train_loss: 0.3732, test_loss: 1.0626, test_f1: 0.6679
 epoch: 71, train_loss: 0.3993, test_loss: 0.9578, test_f1: 0.6734
 epoch: 72, train_loss: 0.3870, test_loss: 1.0164, test_f1: 0.6508
 epoch: 73, train_loss: 0.3558, test_loss: 1.1337, test_f1: 0.6550
 epoch: 74, train_loss: 0.3744, test_loss: 1.1597, test_f1: 0.6722
 epoch: 75, train_loss: 0.3668, test_loss: 1.0789, test_f1: 0.6575
 epoch: 76, train_loss: 0.3637, test_loss: 1.2054, test_f1: 0.6546
 epoch: 77, train_loss: 0.3625, test_loss: 1.1639, test_f1: 0.6551
 epoch: 78, train_loss: 0.3609, test_loss: 1.1179, test_f1: 0.6539
 epoch: 79, train_loss: 0.3554, test_loss: 1.1944, test_f1: 0.6471
 epoch: 80, train_loss: 0.3663, test_loss: 1.2517, test_f1: 0.6406
 epoch: 81, train_loss: 0.3551, test_loss: 1.1622, test_f1: 0.6756
 epoch: 82, train_loss: 0.3453, test_loss: 1.1758, test_f1: 0.6558
 epoch: 83, train_loss: 0.3679, test_loss: 1.2164, test_f1: 0.6579
 epoch: 84, train_loss: 0.3540, test_loss: 1.1716, test_f1: 0.6600
 epoch: 85, train_loss: 0.3283, test_loss: 1.2601, test_f1: 0.6602
 epoch: 86, train_loss: 0.3293, test_loss: 1.1908, test_f1: 0.6633
 epoch: 87, train_loss: 0.3154, test_loss: 1.2621, test_f1: 0.6414
 epoch: 88, train_loss: 0.3403, test_loss: 1.2134, test_f1: 0.6415
 epoch: 89, train_loss: 0.3419, test_loss: 1.2048, test_f1: 0.6564
 epoch: 90, train_loss: 0.3256, test_loss: 1.2662, test_f1: 0.6443
 epoch: 91, train_loss: 0.3159, test_loss: 1.2417, test_f1: 0.6671
 epoch: 92, train_loss: 0.3143, test_loss: 1.0696, test_f1: 0.6773
 epoch: 93, train_loss: 0.3277, test_loss: 1.3666, test_f1: 0.6465
 epoch: 94, train_loss: 0.3106, test_loss: 1.2365, test_f1: 0.6639
 epoch: 95, train_loss: 0.2998, test_loss: 1.3522, test_f1: 0.6647
 epoch: 96, train_loss: 0.3275, test_loss: 1.1404, test_f1: 0.6763
 epoch: 97, train_loss: 0.3122, test_loss: 1.3224, test_f1: 0.6556
 epoch: 98, train_loss: 0.3005, test_loss: 1.2640, test_f1: 0.6726
 epoch: 99, train_loss: 0.3005, test_loss: 1.3236, test_f1: 0.6741
##################ITERATION #8 ****************************************
 epoch: 0, train_loss: 1.2354, test_loss: 1.1065, test_f1: 0.3869
 epoch: 1, train_loss: 1.0014, test_loss: 0.9453, test_f1: 0.4983
 epoch: 2, train_loss: 0.9473, test_loss: 0.9276, test_f1: 0.5258
 epoch: 3, train_loss: 0.9308, test_loss: 0.9022, test_f1: 0.5064
 epoch: 4, train_loss: 0.9058, test_loss: 0.8812, test_f1: 0.4796
 epoch: 5, train_loss: 0.8927, test_loss: 0.8550, test_f1: 0.5422
 epoch: 6, train_loss: 0.8622, test_loss: 0.8132, test_f1: 0.5762
 epoch: 7, train_loss: 0.8437, test_loss: 0.8058, test_f1: 0.5773
 epoch: 8, train_loss: 0.8280, test_loss: 0.8363, test_f1: 0.5413
 epoch: 9, train_loss: 0.8221, test_loss: 0.8309, test_f1: 0.5713
 epoch: 10, train_loss: 0.8203, test_loss: 0.7687, test_f1: 0.5914
 epoch: 11, train_loss: 0.7804, test_loss: 0.7681, test_f1: 0.6023
 epoch: 12, train_loss: 0.7618, test_loss: 0.8402, test_f1: 0.5755
 epoch: 13, train_loss: 0.7602, test_loss: 0.7926, test_f1: 0.6123
 epoch: 14, train_loss: 0.7530, test_loss: 0.7505, test_f1: 0.6317
 epoch: 15, train_loss: 0.7299, test_loss: 0.7388, test_f1: 0.6410
 epoch: 16, train_loss: 0.7254, test_loss: 0.7815, test_f1: 0.6053
 epoch: 17, train_loss: 0.7074, test_loss: 0.7043, test_f1: 0.6223
 epoch: 18, train_loss: 0.7126, test_loss: 0.7705, test_f1: 0.6388
 epoch: 19, train_loss: 0.6797, test_loss: 0.7119, test_f1: 0.6559
 epoch: 20, train_loss: 0.6777, test_loss: 0.7047, test_f1: 0.6481
 epoch: 21, train_loss: 0.6708, test_loss: 0.7898, test_f1: 0.6212
 epoch: 22, train_loss: 0.6603, test_loss: 0.8271, test_f1: 0.6395
 epoch: 23, train_loss: 0.6346, test_loss: 0.7030, test_f1: 0.6551
 epoch: 24, train_loss: 0.6481, test_loss: 0.8104, test_f1: 0.5992
 epoch: 25, train_loss: 0.6388, test_loss: 0.7045, test_f1: 0.6712
 epoch: 26, train_loss: 0.6314, test_loss: 0.7512, test_f1: 0.6450
 epoch: 27, train_loss: 0.6419, test_loss: 0.7600, test_f1: 0.6186
 epoch: 28, train_loss: 0.5980, test_loss: 0.6937, test_f1: 0.6738
 epoch: 29, train_loss: 0.5872, test_loss: 0.7509, test_f1: 0.6603
 epoch: 30, train_loss: 0.5838, test_loss: 0.7458, test_f1: 0.6657
 epoch: 31, train_loss: 0.6035, test_loss: 0.7223, test_f1: 0.6616
 epoch: 32, train_loss: 0.5761, test_loss: 0.8142, test_f1: 0.6560
 epoch: 33, train_loss: 0.5627, test_loss: 0.7088, test_f1: 0.6758
 epoch: 34, train_loss: 0.5786, test_loss: 0.6792, test_f1: 0.6973
 epoch: 35, train_loss: 0.5671, test_loss: 0.7717, test_f1: 0.6536
 epoch: 36, train_loss: 0.5361, test_loss: 0.7286, test_f1: 0.6822
 epoch: 37, train_loss: 0.5552, test_loss: 0.7890, test_f1: 0.6708
 epoch: 38, train_loss: 0.5495, test_loss: 0.7905, test_f1: 0.6667
 epoch: 39, train_loss: 0.5782, test_loss: 0.7015, test_f1: 0.6913
 epoch: 40, train_loss: 0.5840, test_loss: 0.8366, test_f1: 0.6439
 epoch: 41, train_loss: 0.5442, test_loss: 0.7551, test_f1: 0.7084
 epoch: 42, train_loss: 0.5410, test_loss: 0.7166, test_f1: 0.7187
 epoch: 43, train_loss: 0.5164, test_loss: 0.7873, test_f1: 0.6884
 epoch: 44, train_loss: 0.5168, test_loss: 0.7607, test_f1: 0.6687
 epoch: 45, train_loss: 0.5063, test_loss: 0.8124, test_f1: 0.6585
 epoch: 46, train_loss: 0.5183, test_loss: 0.9215, test_f1: 0.6742
 epoch: 47, train_loss: 0.4956, test_loss: 0.8520, test_f1: 0.6887
 epoch: 48, train_loss: 0.5199, test_loss: 0.8569, test_f1: 0.6490
 epoch: 49, train_loss: 0.4973, test_loss: 0.7692, test_f1: 0.6893
 epoch: 50, train_loss: 0.4850, test_loss: 0.7319, test_f1: 0.7049
 epoch: 51, train_loss: 0.4380, test_loss: 0.8152, test_f1: 0.7037
 epoch: 52, train_loss: 0.4194, test_loss: 0.8173, test_f1: 0.7032
 epoch: 53, train_loss: 0.3970, test_loss: 0.8315, test_f1: 0.6905
 epoch: 54, train_loss: 0.4033, test_loss: 0.8846, test_f1: 0.6864
 epoch: 55, train_loss: 0.3930, test_loss: 0.9153, test_f1: 0.6789
 epoch: 56, train_loss: 0.3887, test_loss: 0.9179, test_f1: 0.6913
 epoch: 57, train_loss: 0.4067, test_loss: 0.7974, test_f1: 0.7096
 epoch: 58, train_loss: 0.4064, test_loss: 0.8338, test_f1: 0.6915
 epoch: 59, train_loss: 0.3849, test_loss: 0.8692, test_f1: 0.6928
 epoch: 60, train_loss: 0.3801, test_loss: 0.8721, test_f1: 0.6916
 epoch: 61, train_loss: 0.3734, test_loss: 1.0205, test_f1: 0.6915
 epoch: 62, train_loss: 0.3756, test_loss: 0.9580, test_f1: 0.6984
 epoch: 63, train_loss: 0.3712, test_loss: 1.0023, test_f1: 0.6556
 epoch: 64, train_loss: 0.3632, test_loss: 1.0439, test_f1: 0.6913
 epoch: 65, train_loss: 0.3562, test_loss: 0.9913, test_f1: 0.6910
 epoch: 66, train_loss: 0.3535, test_loss: 1.0086, test_f1: 0.6770
 epoch: 67, train_loss: 0.3453, test_loss: 0.9832, test_f1: 0.6808
 epoch: 68, train_loss: 0.3394, test_loss: 1.0475, test_f1: 0.6945
 epoch: 69, train_loss: 0.3435, test_loss: 1.1173, test_f1: 0.6858
 epoch: 70, train_loss: 0.3540, test_loss: 0.9697, test_f1: 0.6936
 epoch: 71, train_loss: 0.3592, test_loss: 1.0027, test_f1: 0.6815
 epoch: 72, train_loss: 0.3407, test_loss: 1.0756, test_f1: 0.7000
 epoch: 73, train_loss: 0.3486, test_loss: 1.0408, test_f1: 0.6828
 epoch: 74, train_loss: 0.3237, test_loss: 1.1042, test_f1: 0.6881
 epoch: 75, train_loss: 0.3349, test_loss: 1.0702, test_f1: 0.6910
 epoch: 76, train_loss: 0.3366, test_loss: 1.1268, test_f1: 0.6926
 epoch: 77, train_loss: 0.3160, test_loss: 1.1021, test_f1: 0.6960
 epoch: 78, train_loss: 0.3189, test_loss: 1.0679, test_f1: 0.6998
 epoch: 79, train_loss: 0.3273, test_loss: 1.0867, test_f1: 0.6958
 epoch: 80, train_loss: 0.3284, test_loss: 1.1116, test_f1: 0.6800
 epoch: 81, train_loss: 0.3291, test_loss: 1.0633, test_f1: 0.6785
 epoch: 82, train_loss: 0.3230, test_loss: 1.1246, test_f1: 0.6642
 epoch: 83, train_loss: 0.2996, test_loss: 1.0919, test_f1: 0.6777
 epoch: 84, train_loss: 0.3076, test_loss: 1.0954, test_f1: 0.6936
 epoch: 85, train_loss: 0.3107, test_loss: 1.1433, test_f1: 0.6902
 epoch: 86, train_loss: 0.3034, test_loss: 1.1246, test_f1: 0.7073
 epoch: 87, train_loss: 0.3272, test_loss: 1.1020, test_f1: 0.6914
 epoch: 88, train_loss: 0.3101, test_loss: 1.1947, test_f1: 0.6779
 epoch: 89, train_loss: 0.2904, test_loss: 1.0605, test_f1: 0.6982
 epoch: 90, train_loss: 0.3033, test_loss: 1.1661, test_f1: 0.6526
 epoch: 91, train_loss: 0.2960, test_loss: 1.1409, test_f1: 0.6824
 epoch: 92, train_loss: 0.3103, test_loss: 1.2524, test_f1: 0.6767
 epoch: 93, train_loss: 0.2801, test_loss: 1.2481, test_f1: 0.6683
 epoch: 94, train_loss: 0.2820, test_loss: 1.1814, test_f1: 0.6807
 epoch: 95, train_loss: 0.2638, test_loss: 1.2437, test_f1: 0.6686
 epoch: 96, train_loss: 0.2696, test_loss: 1.3366, test_f1: 0.6486
 epoch: 97, train_loss: 0.3076, test_loss: 1.2249, test_f1: 0.6786
 epoch: 98, train_loss: 0.2735, test_loss: 1.3617, test_f1: 0.6660
 epoch: 99, train_loss: 0.2616, test_loss: 1.2929, test_f1: 0.6811
##################ITERATION #9 ****************************************
 epoch: 0, train_loss: 1.3686, test_loss: 1.1176, test_f1: 0.4122
 epoch: 1, train_loss: 1.0191, test_loss: 1.0111, test_f1: 0.5021
 epoch: 2, train_loss: 0.9605, test_loss: 0.9065, test_f1: 0.5125
 epoch: 3, train_loss: 0.9375, test_loss: 0.9572, test_f1: 0.5639
 epoch: 4, train_loss: 0.9120, test_loss: 0.9159, test_f1: 0.5413
 epoch: 5, train_loss: 0.8889, test_loss: 0.8822, test_f1: 0.5803
 epoch: 6, train_loss: 0.8706, test_loss: 0.8575, test_f1: 0.5645
 epoch: 7, train_loss: 0.8696, test_loss: 0.8993, test_f1: 0.5579
 epoch: 8, train_loss: 0.8400, test_loss: 0.8401, test_f1: 0.5931
 epoch: 9, train_loss: 0.8171, test_loss: 0.8108, test_f1: 0.6199
 epoch: 10, train_loss: 0.8089, test_loss: 0.7991, test_f1: 0.5950
 epoch: 11, train_loss: 0.7912, test_loss: 0.7925, test_f1: 0.5952
 epoch: 12, train_loss: 0.7709, test_loss: 0.8183, test_f1: 0.6042
 epoch: 13, train_loss: 0.7569, test_loss: 0.8350, test_f1: 0.5976
 epoch: 14, train_loss: 0.7504, test_loss: 0.8532, test_f1: 0.5905
 epoch: 15, train_loss: 0.7568, test_loss: 0.8311, test_f1: 0.6048
 epoch: 16, train_loss: 0.7343, test_loss: 0.7577, test_f1: 0.6235
 epoch: 17, train_loss: 0.7267, test_loss: 0.8162, test_f1: 0.6249
 epoch: 18, train_loss: 0.7181, test_loss: 0.7385, test_f1: 0.6579
 epoch: 19, train_loss: 0.6996, test_loss: 0.7693, test_f1: 0.6532
 epoch: 20, train_loss: 0.6891, test_loss: 0.7406, test_f1: 0.6499
 epoch: 21, train_loss: 0.6886, test_loss: 0.7467, test_f1: 0.6595
 epoch: 22, train_loss: 0.6608, test_loss: 0.8162, test_f1: 0.6240
 epoch: 23, train_loss: 0.6656, test_loss: 0.7796, test_f1: 0.6473
 epoch: 24, train_loss: 0.6502, test_loss: 0.8010, test_f1: 0.6740
 epoch: 25, train_loss: 0.6413, test_loss: 0.7711, test_f1: 0.6211
 epoch: 26, train_loss: 0.6452, test_loss: 0.7422, test_f1: 0.6257
 epoch: 27, train_loss: 0.6260, test_loss: 0.8245, test_f1: 0.6489
 epoch: 28, train_loss: 0.6074, test_loss: 0.8008, test_f1: 0.6331
 epoch: 29, train_loss: 0.6319, test_loss: 0.8289, test_f1: 0.6362
 epoch: 30, train_loss: 0.6174, test_loss: 0.7542, test_f1: 0.6401
 epoch: 31, train_loss: 0.6012, test_loss: 0.7814, test_f1: 0.6650
 epoch: 32, train_loss: 0.5833, test_loss: 0.8640, test_f1: 0.6480
 epoch: 33, train_loss: 0.5901, test_loss: 0.7478, test_f1: 0.6331
 epoch: 34, train_loss: 0.5633, test_loss: 0.7893, test_f1: 0.6398
 epoch: 35, train_loss: 0.5514, test_loss: 0.8873, test_f1: 0.6305
 epoch: 36, train_loss: 0.5743, test_loss: 0.8025, test_f1: 0.6358
 epoch: 37, train_loss: 0.5564, test_loss: 0.7296, test_f1: 0.6745
 epoch: 38, train_loss: 0.5560, test_loss: 0.8059, test_f1: 0.6411
 epoch: 39, train_loss: 0.5406, test_loss: 0.8522, test_f1: 0.6554
 epoch: 40, train_loss: 0.5342, test_loss: 0.8546, test_f1: 0.6387
 epoch: 41, train_loss: 0.5262, test_loss: 0.8283, test_f1: 0.6570
 epoch: 42, train_loss: 0.5249, test_loss: 0.8909, test_f1: 0.6233
 epoch: 43, train_loss: 0.5004, test_loss: 0.9680, test_f1: 0.6569
 epoch: 44, train_loss: 0.5090, test_loss: 0.8913, test_f1: 0.6326
 epoch: 45, train_loss: 0.5018, test_loss: 0.7982, test_f1: 0.6861
 epoch: 46, train_loss: 0.5052, test_loss: 0.8966, test_f1: 0.6222
 epoch: 47, train_loss: 0.5150, test_loss: 0.8740, test_f1: 0.6464
 epoch: 48, train_loss: 0.5055, test_loss: 0.9574, test_f1: 0.6433
 epoch: 49, train_loss: 0.4769, test_loss: 0.9027, test_f1: 0.6580
 epoch: 50, train_loss: 0.4834, test_loss: 0.9049, test_f1: 0.6352
 epoch: 51, train_loss: 0.4364, test_loss: 1.0111, test_f1: 0.6449
 epoch: 52, train_loss: 0.4187, test_loss: 1.0253, test_f1: 0.6432
 epoch: 53, train_loss: 0.4203, test_loss: 1.0308, test_f1: 0.6618
 epoch: 54, train_loss: 0.4070, test_loss: 0.9926, test_f1: 0.6495
 epoch: 55, train_loss: 0.3878, test_loss: 1.0069, test_f1: 0.6422
 epoch: 56, train_loss: 0.3776, test_loss: 1.1458, test_f1: 0.6344
 epoch: 57, train_loss: 0.3770, test_loss: 1.1236, test_f1: 0.6267
 epoch: 58, train_loss: 0.3824, test_loss: 1.0393, test_f1: 0.6503
 epoch: 59, train_loss: 0.3770, test_loss: 1.1293, test_f1: 0.6408
 epoch: 60, train_loss: 0.3670, test_loss: 1.0556, test_f1: 0.6541
 epoch: 61, train_loss: 0.3512, test_loss: 1.1684, test_f1: 0.6424
 epoch: 62, train_loss: 0.3567, test_loss: 1.1403, test_f1: 0.6271
 epoch: 63, train_loss: 0.3609, test_loss: 1.1839, test_f1: 0.6561
 epoch: 64, train_loss: 0.3560, test_loss: 1.1908, test_f1: 0.6547
 epoch: 65, train_loss: 0.3582, test_loss: 1.2022, test_f1: 0.6338
 epoch: 66, train_loss: 0.3664, test_loss: 1.1914, test_f1: 0.6464
 epoch: 67, train_loss: 0.3437, test_loss: 1.2001, test_f1: 0.6426
 epoch: 68, train_loss: 0.3554, test_loss: 1.1241, test_f1: 0.6399
 epoch: 69, train_loss: 0.3515, test_loss: 1.3058, test_f1: 0.6529
 epoch: 70, train_loss: 0.3317, test_loss: 1.2400, test_f1: 0.6540
 epoch: 71, train_loss: 0.3332, test_loss: 1.1796, test_f1: 0.6369
 epoch: 72, train_loss: 0.3306, test_loss: 1.3090, test_f1: 0.6350
 epoch: 73, train_loss: 0.3164, test_loss: 1.2017, test_f1: 0.6569
 epoch: 74, train_loss: 0.3228, test_loss: 1.3508, test_f1: 0.6477
 epoch: 75, train_loss: 0.3238, test_loss: 1.2680, test_f1: 0.6553
 epoch: 76, train_loss: 0.3010, test_loss: 1.4617, test_f1: 0.6261
 epoch: 77, train_loss: 0.3223, test_loss: 1.3266, test_f1: 0.6501
 epoch: 78, train_loss: 0.3090, test_loss: 1.2312, test_f1: 0.6544
 epoch: 79, train_loss: 0.3424, test_loss: 1.3138, test_f1: 0.6365
 epoch: 80, train_loss: 0.3072, test_loss: 1.3540, test_f1: 0.6149
 epoch: 81, train_loss: 0.3029, test_loss: 1.3468, test_f1: 0.6552
 epoch: 82, train_loss: 0.3164, test_loss: 1.4395, test_f1: 0.6591
 epoch: 83, train_loss: 0.2995, test_loss: 1.4969, test_f1: 0.6535
 epoch: 84, train_loss: 0.2867, test_loss: 1.4035, test_f1: 0.6477
 epoch: 85, train_loss: 0.2995, test_loss: 1.4525, test_f1: 0.6391
 epoch: 86, train_loss: 0.2968, test_loss: 1.4123, test_f1: 0.6425
 epoch: 87, train_loss: 0.2875, test_loss: 1.3556, test_f1: 0.6386
 epoch: 88, train_loss: 0.2738, test_loss: 1.3722, test_f1: 0.6527
 epoch: 89, train_loss: 0.2888, test_loss: 1.4479, test_f1: 0.6570
 epoch: 90, train_loss: 0.2792, test_loss: 1.5116, test_f1: 0.6395
 epoch: 91, train_loss: 0.2722, test_loss: 1.4673, test_f1: 0.6280
 epoch: 92, train_loss: 0.2738, test_loss: 1.4175, test_f1: 0.6661
 epoch: 93, train_loss: 0.2900, test_loss: 1.4597, test_f1: 0.6495
 epoch: 94, train_loss: 0.2714, test_loss: 1.4587, test_f1: 0.6354
 epoch: 95, train_loss: 0.2720, test_loss: 1.4918, test_f1: 0.6453
 epoch: 96, train_loss: 0.2732, test_loss: 1.5143, test_f1: 0.6526
 epoch: 97, train_loss: 0.2740, test_loss: 1.5384, test_f1: 0.6648
 epoch: 98, train_loss: 0.2672, test_loss: 1.4775, test_f1: 0.6491
 epoch: 99, train_loss: 0.2539, test_loss: 1.5156, test_f1: 0.6434

Training completed in 893.21 seconds
Best F1: 0.7278 at epoch 55
Mean F1 across iterations: 0.7026  0.0130
========================FINAL RESULTS================================
FEGIN weighted F1: 0.7278  0.0130
python main.py --data ltspice_examples --representation component_pin_net --model FEGIN --layers 6 --hiddens 64 --batch_size 64 --lr 0.001 --emb_size 512 --epochs 100 --save_appendix component_pin_net_L6_H64_BS64_LR0.001_E512 --no_val
-----



STDERR:
  File "main.py", line 370, in <module>
    main()
  File "main.py", line 254, in main
    dataset = dataset_class(
  File "/home/philip/projects/ltspice_examples_code_repo/Circuit-Completion-Using-GNNs/component_classification_with_link_prediction_head/evaluation/FEGIN/kernel/circuit_datasets.py", line 15, in __init__
    self.data, self.slices = torch.load(self.processed_paths[0])
  File "/home/philip/.local/lib/python3.8/site-packages/torch/serialization.py", line 1040, in load
    warnings.warn(
  File "/usr/lib/python3.8/warnings.py", line 109, in _showwarnmsg
    sw(msg.message, msg.category, msg.filename, msg.lineno,
  File "main.py", line 47, in warn_with_traceback
    traceback.print_stack(file=log)
/home/philip/projects/ltspice_examples_code_repo/Circuit-Completion-Using-GNNs/component_classification_with_link_prediction_head/evaluation/FEGIN/kernel/circuit_datasets.py:15: FutureWarning: You are using `torch.load` with `weights_only=False` (the current default value), which uses the default pickle module implicitly. It is possible to construct malicious pickle data which will execute arbitrary code during unpickling (See https://github.com/pytorch/pytorch/blob/main/SECURITY.md#untrusted-models for more details). In a future release, the default value for `weights_only` will be flipped to `True`. This limits the functions that could be executed during unpickling. Arbitrary objects will no longer be allowed to be loaded via this mode unless they are explicitly allowlisted by the user via `torch.serialization.add_safe_globals`. We recommend you start setting `weights_only=True` for any use case where you don't have full control of the loaded file. Please open an issue on GitHub for any issues related to this experimental feature.
  self.data, self.slices = torch.load(self.processed_paths[0])
