STDOUT:
Results will be saved in /home/philip/projects/llm_inference_code_repo/Circuit-Completion-Using-GNNs/component_classification_with_link_prediction_head/evaluation/FEGIN/results/model_FEGIN_dataset_ltspice_examples
Command line input: python main.py --data ltspice_examples --representation component_pin_net --model FEGIN --layers 6 --hiddens 128 --batch_size 32 --lr 0.001 --emb_size 128 --epochs 100 --save_appendix component_pin_net_L6_H128_BS32_LR0.001_E128 --no_val
 is saved.
-----
ltspice_examples - FEGIN
Using 6 layers, 128 hidden units, h = 2
Loading component_pin_net representation dataset
ENTERED
Training FEGIN on component_pin_net representation
Train: 3558, Test: 846
##################ITERATION #0 ****************************************
 epoch: 0, train_loss: 1.1222, test_loss: 1.0517, test_f1: 0.4746
 epoch: 1, train_loss: 1.0029, test_loss: 0.9758, test_f1: 0.4826
 epoch: 2, train_loss: 0.9560, test_loss: 0.9423, test_f1: 0.5157
 epoch: 3, train_loss: 0.9313, test_loss: 0.8736, test_f1: 0.5197
 epoch: 4, train_loss: 0.9004, test_loss: 0.8610, test_f1: 0.5311
 epoch: 5, train_loss: 0.8784, test_loss: 0.8376, test_f1: 0.5560
 epoch: 6, train_loss: 0.8696, test_loss: 0.8824, test_f1: 0.5791
 epoch: 7, train_loss: 0.8458, test_loss: 0.8086, test_f1: 0.5838
 epoch: 8, train_loss: 0.8386, test_loss: 0.8565, test_f1: 0.5698
 epoch: 9, train_loss: 0.8173, test_loss: 0.7667, test_f1: 0.5843
 epoch: 10, train_loss: 0.7928, test_loss: 0.7380, test_f1: 0.6654
 epoch: 11, train_loss: 0.7867, test_loss: 0.8163, test_f1: 0.5953
 epoch: 12, train_loss: 0.7519, test_loss: 0.8004, test_f1: 0.5764
 epoch: 13, train_loss: 0.7557, test_loss: 0.8755, test_f1: 0.6138
 epoch: 14, train_loss: 0.7268, test_loss: 0.8526, test_f1: 0.6189
 epoch: 15, train_loss: 0.7263, test_loss: 0.8508, test_f1: 0.6550
 epoch: 16, train_loss: 0.6842, test_loss: 0.8238, test_f1: 0.6576
 epoch: 17, train_loss: 0.6961, test_loss: 0.8249, test_f1: 0.6044
 epoch: 18, train_loss: 0.6715, test_loss: 0.7973, test_f1: 0.6638
 epoch: 19, train_loss: 0.6673, test_loss: 0.8203, test_f1: 0.6635
 epoch: 20, train_loss: 0.6652, test_loss: 0.7900, test_f1: 0.6736
 epoch: 21, train_loss: 0.6447, test_loss: 0.9085, test_f1: 0.6344
 epoch: 22, train_loss: 0.6319, test_loss: 1.0231, test_f1: 0.5990
 epoch: 23, train_loss: 0.6395, test_loss: 0.7667, test_f1: 0.6665
 epoch: 24, train_loss: 0.6270, test_loss: 0.7952, test_f1: 0.6611
 epoch: 25, train_loss: 0.6415, test_loss: 0.8215, test_f1: 0.6294
 epoch: 26, train_loss: 0.6025, test_loss: 0.9607, test_f1: 0.6599
 epoch: 27, train_loss: 0.5821, test_loss: 1.0181, test_f1: 0.6154
 epoch: 28, train_loss: 0.5624, test_loss: 1.0249, test_f1: 0.6484
 epoch: 29, train_loss: 0.5746, test_loss: 0.9037, test_f1: 0.6794
 epoch: 30, train_loss: 0.5698, test_loss: 0.9634, test_f1: 0.6595
 epoch: 31, train_loss: 0.5392, test_loss: 1.1023, test_f1: 0.6524
 epoch: 32, train_loss: 0.5385, test_loss: 0.7593, test_f1: 0.6801
 epoch: 33, train_loss: 0.5551, test_loss: 0.7879, test_f1: 0.6611
 epoch: 34, train_loss: 0.5232, test_loss: 0.9073, test_f1: 0.6963
 epoch: 35, train_loss: 0.5339, test_loss: 0.9896, test_f1: 0.6702
 epoch: 36, train_loss: 0.5124, test_loss: 0.8869, test_f1: 0.6643
 epoch: 37, train_loss: 0.5476, test_loss: 0.8211, test_f1: 0.6561
 epoch: 38, train_loss: 0.5276, test_loss: 0.9152, test_f1: 0.6776
 epoch: 39, train_loss: 0.5204, test_loss: 0.9073, test_f1: 0.6927
 epoch: 40, train_loss: 0.4909, test_loss: 0.9239, test_f1: 0.6789
 epoch: 41, train_loss: 0.4777, test_loss: 1.0522, test_f1: 0.6335
 epoch: 42, train_loss: 0.4972, test_loss: 0.9837, test_f1: 0.6783
 epoch: 43, train_loss: 0.4882, test_loss: 0.9748, test_f1: 0.6785
 epoch: 44, train_loss: 0.4742, test_loss: 1.0623, test_f1: 0.6816
 epoch: 45, train_loss: 0.4489, test_loss: 1.0366, test_f1: 0.6959
 epoch: 46, train_loss: 0.4667, test_loss: 0.9322, test_f1: 0.6861
 epoch: 47, train_loss: 0.4345, test_loss: 1.1017, test_f1: 0.6838
 epoch: 48, train_loss: 0.4339, test_loss: 1.0771, test_f1: 0.6719
 epoch: 49, train_loss: 0.4335, test_loss: 1.2321, test_f1: 0.6803
 epoch: 50, train_loss: 0.4311, test_loss: 1.0747, test_f1: 0.6750
 epoch: 51, train_loss: 0.3803, test_loss: 1.0726, test_f1: 0.7077
 epoch: 52, train_loss: 0.3647, test_loss: 1.1098, test_f1: 0.6928
 epoch: 53, train_loss: 0.3583, test_loss: 1.1708, test_f1: 0.7031
 epoch: 54, train_loss: 0.3387, test_loss: 1.1740, test_f1: 0.6950
 epoch: 55, train_loss: 0.3494, test_loss: 1.2400, test_f1: 0.6951
 epoch: 56, train_loss: 0.3391, test_loss: 1.1083, test_f1: 0.7017
 epoch: 57, train_loss: 0.3397, test_loss: 1.1701, test_f1: 0.7314
 epoch: 58, train_loss: 0.3381, test_loss: 1.2328, test_f1: 0.6945
 epoch: 59, train_loss: 0.3268, test_loss: 1.2660, test_f1: 0.6894
 epoch: 60, train_loss: 0.3294, test_loss: 1.1253, test_f1: 0.7034
 epoch: 61, train_loss: 0.3226, test_loss: 1.3107, test_f1: 0.7202
 epoch: 62, train_loss: 0.3212, test_loss: 1.2185, test_f1: 0.7266
 epoch: 63, train_loss: 0.3050, test_loss: 1.1794, test_f1: 0.7201
 epoch: 64, train_loss: 0.2973, test_loss: 1.3792, test_f1: 0.6995
 epoch: 65, train_loss: 0.3098, test_loss: 1.3660, test_f1: 0.7098
 epoch: 66, train_loss: 0.2871, test_loss: 1.3472, test_f1: 0.6951
 epoch: 67, train_loss: 0.2938, test_loss: 1.3110, test_f1: 0.7015
 epoch: 68, train_loss: 0.3049, test_loss: 1.4068, test_f1: 0.7188
 epoch: 69, train_loss: 0.2897, test_loss: 1.4112, test_f1: 0.7301
 epoch: 70, train_loss: 0.2870, test_loss: 1.3326, test_f1: 0.6978
 epoch: 71, train_loss: 0.2837, test_loss: 1.4227, test_f1: 0.7060
 epoch: 72, train_loss: 0.2758, test_loss: 1.2797, test_f1: 0.6910
 epoch: 73, train_loss: 0.3130, test_loss: 1.3150, test_f1: 0.7066
 epoch: 74, train_loss: 0.2709, test_loss: 1.3474, test_f1: 0.6996
 epoch: 75, train_loss: 0.2615, test_loss: 1.3533, test_f1: 0.7024
 epoch: 76, train_loss: 0.2667, test_loss: 1.3921, test_f1: 0.6776
 epoch: 77, train_loss: 0.2805, test_loss: 1.2175, test_f1: 0.7163
 epoch: 78, train_loss: 0.2520, test_loss: 1.4604, test_f1: 0.7243
 epoch: 79, train_loss: 0.2802, test_loss: 1.3981, test_f1: 0.7072
 epoch: 80, train_loss: 0.2640, test_loss: 1.4860, test_f1: 0.7111
 epoch: 81, train_loss: 0.2480, test_loss: 1.4791, test_f1: 0.7050
 epoch: 82, train_loss: 0.2563, test_loss: 1.4967, test_f1: 0.7247
 epoch: 83, train_loss: 0.2604, test_loss: 1.4301, test_f1: 0.7198
 epoch: 84, train_loss: 0.2393, test_loss: 1.5061, test_f1: 0.7110
 epoch: 85, train_loss: 0.2495, test_loss: 1.4666, test_f1: 0.7296
 epoch: 86, train_loss: 0.2509, test_loss: 1.5126, test_f1: 0.7070
 epoch: 87, train_loss: 0.2271, test_loss: 1.5464, test_f1: 0.7247
 epoch: 88, train_loss: 0.2412, test_loss: 1.4400, test_f1: 0.7159
 epoch: 89, train_loss: 0.2305, test_loss: 1.6557, test_f1: 0.7165
 epoch: 90, train_loss: 0.2169, test_loss: 1.6334, test_f1: 0.7214
 epoch: 91, train_loss: 0.2250, test_loss: 1.5702, test_f1: 0.6875
 epoch: 92, train_loss: 0.1975, test_loss: 1.7065, test_f1: 0.6808
 epoch: 93, train_loss: 0.2332, test_loss: 1.5749, test_f1: 0.7002
 epoch: 94, train_loss: 0.2425, test_loss: 1.4645, test_f1: 0.6798
 epoch: 95, train_loss: 0.2271, test_loss: 1.5494, test_f1: 0.7236
 epoch: 96, train_loss: 0.2285, test_loss: 1.6384, test_f1: 0.7102
 epoch: 97, train_loss: 0.2062, test_loss: 1.6979, test_f1: 0.7051
 epoch: 98, train_loss: 0.2091, test_loss: 1.7413, test_f1: 0.6891
 epoch: 99, train_loss: 0.2087, test_loss: 1.6615, test_f1: 0.6990
##################ITERATION #1 ****************************************
 epoch: 0, train_loss: 1.0718, test_loss: 0.9075, test_f1: 0.5480
 epoch: 1, train_loss: 0.9505, test_loss: 0.9164, test_f1: 0.4877
 epoch: 2, train_loss: 0.9098, test_loss: 0.9080, test_f1: 0.5547
 epoch: 3, train_loss: 0.9039, test_loss: 0.9238, test_f1: 0.5000
 epoch: 4, train_loss: 0.8666, test_loss: 0.8564, test_f1: 0.5568
 epoch: 5, train_loss: 0.8427, test_loss: 0.8883, test_f1: 0.5803
 epoch: 6, train_loss: 0.8300, test_loss: 0.8235, test_f1: 0.5930
 epoch: 7, train_loss: 0.8131, test_loss: 0.8240, test_f1: 0.5968
 epoch: 8, train_loss: 0.7937, test_loss: 0.8775, test_f1: 0.6053
 epoch: 9, train_loss: 0.7640, test_loss: 0.8720, test_f1: 0.6303
 epoch: 10, train_loss: 0.7544, test_loss: 0.8683, test_f1: 0.6626
 epoch: 11, train_loss: 0.7313, test_loss: 0.7781, test_f1: 0.6485
 epoch: 12, train_loss: 0.7318, test_loss: 0.8000, test_f1: 0.6524
 epoch: 13, train_loss: 0.7127, test_loss: 0.7896, test_f1: 0.6143
 epoch: 14, train_loss: 0.6872, test_loss: 0.7635, test_f1: 0.6540
 epoch: 15, train_loss: 0.6980, test_loss: 0.8375, test_f1: 0.6419
 epoch: 16, train_loss: 0.6848, test_loss: 0.7795, test_f1: 0.6605
 epoch: 17, train_loss: 0.6520, test_loss: 0.7244, test_f1: 0.6979
 epoch: 18, train_loss: 0.6697, test_loss: 0.7801, test_f1: 0.6613
 epoch: 19, train_loss: 0.6391, test_loss: 0.7758, test_f1: 0.6511
 epoch: 20, train_loss: 0.6334, test_loss: 0.8017, test_f1: 0.7068
 epoch: 21, train_loss: 0.6149, test_loss: 0.8441, test_f1: 0.6519
 epoch: 22, train_loss: 0.6022, test_loss: 0.8235, test_f1: 0.6445
 epoch: 23, train_loss: 0.6035, test_loss: 0.7562, test_f1: 0.6649
 epoch: 24, train_loss: 0.5820, test_loss: 0.7754, test_f1: 0.6693
 epoch: 25, train_loss: 0.5826, test_loss: 0.8126, test_f1: 0.6727
 epoch: 26, train_loss: 0.5685, test_loss: 0.7747, test_f1: 0.6625
 epoch: 27, train_loss: 0.5532, test_loss: 0.9020, test_f1: 0.6609
 epoch: 28, train_loss: 0.5581, test_loss: 0.8300, test_f1: 0.6485
 epoch: 29, train_loss: 0.5372, test_loss: 0.8522, test_f1: 0.7093
 epoch: 30, train_loss: 0.5242, test_loss: 0.9210, test_f1: 0.6534
 epoch: 31, train_loss: 0.5075, test_loss: 0.8706, test_f1: 0.6733
 epoch: 32, train_loss: 0.5309, test_loss: 0.8332, test_f1: 0.6772
 epoch: 33, train_loss: 0.5095, test_loss: 0.8080, test_f1: 0.6759
 epoch: 34, train_loss: 0.4984, test_loss: 0.8558, test_f1: 0.6543
 epoch: 35, train_loss: 0.4758, test_loss: 0.8781, test_f1: 0.6779
 epoch: 36, train_loss: 0.4721, test_loss: 1.0159, test_f1: 0.6691
 epoch: 37, train_loss: 0.4816, test_loss: 0.8894, test_f1: 0.6667
 epoch: 38, train_loss: 0.4432, test_loss: 1.0108, test_f1: 0.6542
 epoch: 39, train_loss: 0.4748, test_loss: 0.9014, test_f1: 0.6489
 epoch: 40, train_loss: 0.4427, test_loss: 0.9226, test_f1: 0.6651
 epoch: 41, train_loss: 0.4596, test_loss: 1.0667, test_f1: 0.6503
 epoch: 42, train_loss: 0.4583, test_loss: 0.8558, test_f1: 0.6748
 epoch: 43, train_loss: 0.4334, test_loss: 0.9664, test_f1: 0.6449
 epoch: 44, train_loss: 0.4337, test_loss: 0.8992, test_f1: 0.6605
 epoch: 45, train_loss: 0.4214, test_loss: 0.9093, test_f1: 0.6556
 epoch: 46, train_loss: 0.4194, test_loss: 1.0154, test_f1: 0.6619
 epoch: 47, train_loss: 0.3938, test_loss: 0.9758, test_f1: 0.6678
 epoch: 48, train_loss: 0.3948, test_loss: 1.0672, test_f1: 0.6578
 epoch: 49, train_loss: 0.3883, test_loss: 0.9475, test_f1: 0.6674
 epoch: 50, train_loss: 0.3701, test_loss: 0.9943, test_f1: 0.6744
 epoch: 51, train_loss: 0.3400, test_loss: 1.0783, test_f1: 0.6703
 epoch: 52, train_loss: 0.3151, test_loss: 1.0741, test_f1: 0.6821
 epoch: 53, train_loss: 0.2921, test_loss: 1.1268, test_f1: 0.6856
 epoch: 54, train_loss: 0.2816, test_loss: 1.2034, test_f1: 0.6651
 epoch: 55, train_loss: 0.2718, test_loss: 1.2562, test_f1: 0.6753
 epoch: 56, train_loss: 0.2852, test_loss: 1.1911, test_f1: 0.6726
 epoch: 57, train_loss: 0.3002, test_loss: 1.2116, test_f1: 0.6819
 epoch: 58, train_loss: 0.2621, test_loss: 1.3180, test_f1: 0.6881
 epoch: 59, train_loss: 0.2490, test_loss: 1.3586, test_f1: 0.6720
 epoch: 60, train_loss: 0.2611, test_loss: 1.3959, test_f1: 0.6562
 epoch: 61, train_loss: 0.2693, test_loss: 1.2222, test_f1: 0.6848
 epoch: 62, train_loss: 0.2660, test_loss: 1.4124, test_f1: 0.6708
 epoch: 63, train_loss: 0.2661, test_loss: 1.3505, test_f1: 0.6648
 epoch: 64, train_loss: 0.2373, test_loss: 1.4818, test_f1: 0.6573
 epoch: 65, train_loss: 0.2339, test_loss: 1.3787, test_f1: 0.6610
 epoch: 66, train_loss: 0.2610, test_loss: 1.3418, test_f1: 0.6643
 epoch: 67, train_loss: 0.2211, test_loss: 1.3326, test_f1: 0.6583
 epoch: 68, train_loss: 0.2373, test_loss: 1.3174, test_f1: 0.6711
 epoch: 69, train_loss: 0.2480, test_loss: 1.3386, test_f1: 0.6818
 epoch: 70, train_loss: 0.2228, test_loss: 1.4979, test_f1: 0.6641
 epoch: 71, train_loss: 0.2313, test_loss: 1.4397, test_f1: 0.6742
 epoch: 72, train_loss: 0.2452, test_loss: 1.4695, test_f1: 0.6562
 epoch: 73, train_loss: 0.2289, test_loss: 1.3211, test_f1: 0.6693
 epoch: 74, train_loss: 0.2131, test_loss: 1.4131, test_f1: 0.6819
 epoch: 75, train_loss: 0.2327, test_loss: 1.4915, test_f1: 0.6738
 epoch: 76, train_loss: 0.2044, test_loss: 1.4331, test_f1: 0.6797
 epoch: 77, train_loss: 0.2264, test_loss: 1.4759, test_f1: 0.6540
 epoch: 78, train_loss: 0.2044, test_loss: 1.4360, test_f1: 0.6645
 epoch: 79, train_loss: 0.2016, test_loss: 1.4377, test_f1: 0.6792
 epoch: 80, train_loss: 0.2284, test_loss: 1.3814, test_f1: 0.6753
 epoch: 81, train_loss: 0.1995, test_loss: 1.5087, test_f1: 0.6753
 epoch: 82, train_loss: 0.2142, test_loss: 1.5386, test_f1: 0.6614
 epoch: 83, train_loss: 0.1843, test_loss: 1.4691, test_f1: 0.6798
 epoch: 84, train_loss: 0.1994, test_loss: 1.7170, test_f1: 0.6735
 epoch: 85, train_loss: 0.1699, test_loss: 1.7685, test_f1: 0.6694
 epoch: 86, train_loss: 0.2018, test_loss: 1.6533, test_f1: 0.6689
 epoch: 87, train_loss: 0.1953, test_loss: 1.5848, test_f1: 0.6696
 epoch: 88, train_loss: 0.1931, test_loss: 1.7342, test_f1: 0.6658
 epoch: 89, train_loss: 0.1814, test_loss: 1.5658, test_f1: 0.6731
 epoch: 90, train_loss: 0.1868, test_loss: 1.6708, test_f1: 0.6789
 epoch: 91, train_loss: 0.1880, test_loss: 1.6447, test_f1: 0.6558
 epoch: 92, train_loss: 0.1950, test_loss: 1.6238, test_f1: 0.6773
 epoch: 93, train_loss: 0.1876, test_loss: 1.5508, test_f1: 0.6769
 epoch: 94, train_loss: 0.1877, test_loss: 1.7149, test_f1: 0.6643
 epoch: 95, train_loss: 0.1845, test_loss: 1.7814, test_f1: 0.6649
 epoch: 96, train_loss: 0.1740, test_loss: 1.9026, test_f1: 0.6579
 epoch: 97, train_loss: 0.1557, test_loss: 1.7989, test_f1: 0.6792
 epoch: 98, train_loss: 0.1693, test_loss: 1.7989, test_f1: 0.6769
 epoch: 99, train_loss: 0.1701, test_loss: 1.7401, test_f1: 0.6671
##################ITERATION #2 ****************************************
 epoch: 0, train_loss: 1.1254, test_loss: 0.9762, test_f1: 0.5451
 epoch: 1, train_loss: 0.9516, test_loss: 0.9022, test_f1: 0.5512
 epoch: 2, train_loss: 0.9163, test_loss: 0.9652, test_f1: 0.5491
 epoch: 3, train_loss: 0.8935, test_loss: 0.8360, test_f1: 0.5836
 epoch: 4, train_loss: 0.8620, test_loss: 0.8437, test_f1: 0.5803
 epoch: 5, train_loss: 0.8397, test_loss: 0.8658, test_f1: 0.5720
 epoch: 6, train_loss: 0.8158, test_loss: 0.8618, test_f1: 0.5689
 epoch: 7, train_loss: 0.8038, test_loss: 0.7780, test_f1: 0.6044
 epoch: 8, train_loss: 0.7797, test_loss: 0.8425, test_f1: 0.6114
 epoch: 9, train_loss: 0.7526, test_loss: 0.8257, test_f1: 0.6492
 epoch: 10, train_loss: 0.7457, test_loss: 0.8128, test_f1: 0.6430
 epoch: 11, train_loss: 0.7297, test_loss: 0.8055, test_f1: 0.6426
 epoch: 12, train_loss: 0.7129, test_loss: 0.7322, test_f1: 0.6381
 epoch: 13, train_loss: 0.7020, test_loss: 0.7518, test_f1: 0.6431
 epoch: 14, train_loss: 0.6915, test_loss: 0.7959, test_f1: 0.6412
 epoch: 15, train_loss: 0.6728, test_loss: 0.7157, test_f1: 0.6608
 epoch: 16, train_loss: 0.6550, test_loss: 0.7957, test_f1: 0.6911
 epoch: 17, train_loss: 0.6549, test_loss: 0.7950, test_f1: 0.6530
 epoch: 18, train_loss: 0.6524, test_loss: 0.8964, test_f1: 0.6340
 epoch: 19, train_loss: 0.6192, test_loss: 0.8582, test_f1: 0.6267
 epoch: 20, train_loss: 0.6312, test_loss: 0.7404, test_f1: 0.6607
 epoch: 21, train_loss: 0.6092, test_loss: 0.7048, test_f1: 0.6912
 epoch: 22, train_loss: 0.6030, test_loss: 0.7747, test_f1: 0.6501
 epoch: 23, train_loss: 0.5933, test_loss: 0.7874, test_f1: 0.6460
 epoch: 24, train_loss: 0.5771, test_loss: 0.7730, test_f1: 0.6655
 epoch: 25, train_loss: 0.5475, test_loss: 0.8512, test_f1: 0.6433
 epoch: 26, train_loss: 0.5529, test_loss: 0.7634, test_f1: 0.6711
 epoch: 27, train_loss: 0.5433, test_loss: 0.8468, test_f1: 0.6684
 epoch: 28, train_loss: 0.5369, test_loss: 0.8696, test_f1: 0.6486
 epoch: 29, train_loss: 0.5223, test_loss: 0.8648, test_f1: 0.6633
 epoch: 30, train_loss: 0.5187, test_loss: 0.9340, test_f1: 0.6502
 epoch: 31, train_loss: 0.5342, test_loss: 0.7992, test_f1: 0.6565
 epoch: 32, train_loss: 0.4963, test_loss: 0.8899, test_f1: 0.6420
 epoch: 33, train_loss: 0.4924, test_loss: 0.9552, test_f1: 0.6597
 epoch: 34, train_loss: 0.5224, test_loss: 0.8217, test_f1: 0.6710
 epoch: 35, train_loss: 0.4933, test_loss: 0.9142, test_f1: 0.6670
 epoch: 36, train_loss: 0.4763, test_loss: 0.9760, test_f1: 0.6426
 epoch: 37, train_loss: 0.4603, test_loss: 0.9107, test_f1: 0.6601
 epoch: 38, train_loss: 0.4500, test_loss: 1.0083, test_f1: 0.6776
 epoch: 39, train_loss: 0.4408, test_loss: 0.8658, test_f1: 0.6659
 epoch: 40, train_loss: 0.4681, test_loss: 0.7552, test_f1: 0.6737
 epoch: 41, train_loss: 0.4340, test_loss: 0.8947, test_f1: 0.6735
 epoch: 42, train_loss: 0.4359, test_loss: 0.8937, test_f1: 0.6777
 epoch: 43, train_loss: 0.4391, test_loss: 0.9152, test_f1: 0.6571
 epoch: 44, train_loss: 0.4140, test_loss: 0.7840, test_f1: 0.6672
 epoch: 45, train_loss: 0.4313, test_loss: 1.0039, test_f1: 0.6541
 epoch: 46, train_loss: 0.4273, test_loss: 0.9014, test_f1: 0.6739
 epoch: 47, train_loss: 0.4279, test_loss: 0.8395, test_f1: 0.6852
 epoch: 48, train_loss: 0.4015, test_loss: 0.8147, test_f1: 0.6603
 epoch: 49, train_loss: 0.3690, test_loss: 1.0015, test_f1: 0.6658
 epoch: 50, train_loss: 0.3862, test_loss: 1.0213, test_f1: 0.6877
 epoch: 51, train_loss: 0.3511, test_loss: 0.9850, test_f1: 0.6946
 epoch: 52, train_loss: 0.3221, test_loss: 1.0589, test_f1: 0.6755
 epoch: 53, train_loss: 0.3135, test_loss: 1.0800, test_f1: 0.6741
 epoch: 54, train_loss: 0.2915, test_loss: 1.1367, test_f1: 0.6717
 epoch: 55, train_loss: 0.2999, test_loss: 1.1469, test_f1: 0.6801
 epoch: 56, train_loss: 0.3000, test_loss: 1.0469, test_f1: 0.6879
 epoch: 57, train_loss: 0.2740, test_loss: 1.1979, test_f1: 0.6793
 epoch: 58, train_loss: 0.2828, test_loss: 1.1280, test_f1: 0.6768
 epoch: 59, train_loss: 0.2849, test_loss: 1.1530, test_f1: 0.6692
 epoch: 60, train_loss: 0.2667, test_loss: 1.3194, test_f1: 0.6713
 epoch: 61, train_loss: 0.2724, test_loss: 1.1797, test_f1: 0.6859
 epoch: 62, train_loss: 0.2621, test_loss: 1.2360, test_f1: 0.6737
 epoch: 63, train_loss: 0.2554, test_loss: 1.2643, test_f1: 0.6624
 epoch: 64, train_loss: 0.2711, test_loss: 1.4203, test_f1: 0.6635
 epoch: 65, train_loss: 0.2415, test_loss: 1.4087, test_f1: 0.6800
 epoch: 66, train_loss: 0.2544, test_loss: 1.2886, test_f1: 0.6766
 epoch: 67, train_loss: 0.2450, test_loss: 1.3413, test_f1: 0.6796
 epoch: 68, train_loss: 0.2396, test_loss: 1.3296, test_f1: 0.6779
 epoch: 69, train_loss: 0.2484, test_loss: 1.3174, test_f1: 0.6795
 epoch: 70, train_loss: 0.2376, test_loss: 1.2957, test_f1: 0.6767
 epoch: 71, train_loss: 0.2364, test_loss: 1.3561, test_f1: 0.6713
 epoch: 72, train_loss: 0.2466, test_loss: 1.3834, test_f1: 0.6767
 epoch: 73, train_loss: 0.2217, test_loss: 1.3140, test_f1: 0.6841
 epoch: 74, train_loss: 0.2281, test_loss: 1.5792, test_f1: 0.6636
 epoch: 75, train_loss: 0.2449, test_loss: 1.4372, test_f1: 0.6722
 epoch: 76, train_loss: 0.2382, test_loss: 1.5011, test_f1: 0.6753
 epoch: 77, train_loss: 0.2105, test_loss: 1.6083, test_f1: 0.6595
 epoch: 78, train_loss: 0.2130, test_loss: 1.4998, test_f1: 0.6731
 epoch: 79, train_loss: 0.2301, test_loss: 1.3844, test_f1: 0.6595
 epoch: 80, train_loss: 0.2241, test_loss: 1.3569, test_f1: 0.6737
 epoch: 81, train_loss: 0.2136, test_loss: 1.4825, test_f1: 0.6730
 epoch: 82, train_loss: 0.2150, test_loss: 1.6624, test_f1: 0.6553
 epoch: 83, train_loss: 0.2038, test_loss: 1.5962, test_f1: 0.6522
 epoch: 84, train_loss: 0.1923, test_loss: 1.4658, test_f1: 0.6704
 epoch: 85, train_loss: 0.1978, test_loss: 1.5089, test_f1: 0.6472
 epoch: 86, train_loss: 0.2074, test_loss: 1.4555, test_f1: 0.6667
 epoch: 87, train_loss: 0.2149, test_loss: 1.4836, test_f1: 0.6639
 epoch: 88, train_loss: 0.1983, test_loss: 1.5992, test_f1: 0.6503
 epoch: 89, train_loss: 0.1894, test_loss: 1.5013, test_f1: 0.6575
 epoch: 90, train_loss: 0.1998, test_loss: 1.4438, test_f1: 0.6693
 epoch: 91, train_loss: 0.1901, test_loss: 1.5033, test_f1: 0.6758
 epoch: 92, train_loss: 0.2029, test_loss: 1.3491, test_f1: 0.6711
 epoch: 93, train_loss: 0.2042, test_loss: 1.6310, test_f1: 0.6577
 epoch: 94, train_loss: 0.1980, test_loss: 1.4263, test_f1: 0.6642
 epoch: 95, train_loss: 0.1588, test_loss: 1.4955, test_f1: 0.6525
 epoch: 96, train_loss: 0.2067, test_loss: 1.5543, test_f1: 0.6664
 epoch: 97, train_loss: 0.1804, test_loss: 1.5598, test_f1: 0.6648
 epoch: 98, train_loss: 0.1742, test_loss: 1.5195, test_f1: 0.6800
 epoch: 99, train_loss: 0.2140, test_loss: 1.4476, test_f1: 0.6798
##################ITERATION #3 ****************************************
 epoch: 0, train_loss: 1.1582, test_loss: 0.9688, test_f1: 0.4746
 epoch: 1, train_loss: 0.9579, test_loss: 0.9652, test_f1: 0.5066
 epoch: 2, train_loss: 0.9283, test_loss: 0.9123, test_f1: 0.5235
 epoch: 3, train_loss: 0.8982, test_loss: 0.8343, test_f1: 0.6032
 epoch: 4, train_loss: 0.8799, test_loss: 0.9193, test_f1: 0.5768
 epoch: 5, train_loss: 0.8470, test_loss: 0.8441, test_f1: 0.5682
 epoch: 6, train_loss: 0.8253, test_loss: 0.8574, test_f1: 0.6110
 epoch: 7, train_loss: 0.8186, test_loss: 0.8157, test_f1: 0.6033
 epoch: 8, train_loss: 0.8074, test_loss: 0.7669, test_f1: 0.6592
 epoch: 9, train_loss: 0.7691, test_loss: 0.8047, test_f1: 0.5763
 epoch: 10, train_loss: 0.7617, test_loss: 0.7260, test_f1: 0.6489
 epoch: 11, train_loss: 0.7519, test_loss: 0.7075, test_f1: 0.6758
 epoch: 12, train_loss: 0.7109, test_loss: 0.7288, test_f1: 0.6562
 epoch: 13, train_loss: 0.7231, test_loss: 0.7210, test_f1: 0.6747
 epoch: 14, train_loss: 0.7059, test_loss: 0.7626, test_f1: 0.6235
 epoch: 15, train_loss: 0.7168, test_loss: 0.7348, test_f1: 0.6338
 epoch: 16, train_loss: 0.6727, test_loss: 0.7276, test_f1: 0.6527
 epoch: 17, train_loss: 0.6889, test_loss: 0.7258, test_f1: 0.6476
 epoch: 18, train_loss: 0.6592, test_loss: 0.6651, test_f1: 0.6693
 epoch: 19, train_loss: 0.6465, test_loss: 0.7694, test_f1: 0.6210
 epoch: 20, train_loss: 0.6272, test_loss: 0.6670, test_f1: 0.6859
 epoch: 21, train_loss: 0.6362, test_loss: 0.7366, test_f1: 0.6553
 epoch: 22, train_loss: 0.6234, test_loss: 0.7680, test_f1: 0.6637
 epoch: 23, train_loss: 0.6019, test_loss: 0.6755, test_f1: 0.6715
 epoch: 24, train_loss: 0.5803, test_loss: 0.7421, test_f1: 0.6428
 epoch: 25, train_loss: 0.5875, test_loss: 0.6734, test_f1: 0.7192
 epoch: 26, train_loss: 0.5856, test_loss: 0.7846, test_f1: 0.6746
 epoch: 27, train_loss: 0.5698, test_loss: 0.7151, test_f1: 0.6631
 epoch: 28, train_loss: 0.5777, test_loss: 0.6495, test_f1: 0.6777
 epoch: 29, train_loss: 0.5293, test_loss: 0.7534, test_f1: 0.6783
 epoch: 30, train_loss: 0.5247, test_loss: 0.7463, test_f1: 0.6607
 epoch: 31, train_loss: 0.5547, test_loss: 0.6959, test_f1: 0.6633
 epoch: 32, train_loss: 0.5255, test_loss: 0.6850, test_f1: 0.6961
 epoch: 33, train_loss: 0.5287, test_loss: 0.8034, test_f1: 0.6753
 epoch: 34, train_loss: 0.5306, test_loss: 0.8444, test_f1: 0.6763
 epoch: 35, train_loss: 0.5263, test_loss: 0.7413, test_f1: 0.7078
 epoch: 36, train_loss: 0.5165, test_loss: 0.7981, test_f1: 0.6796
 epoch: 37, train_loss: 0.4734, test_loss: 0.7733, test_f1: 0.6664
 epoch: 38, train_loss: 0.4764, test_loss: 0.8556, test_f1: 0.6781
 epoch: 39, train_loss: 0.4801, test_loss: 0.7235, test_f1: 0.6620
 epoch: 40, train_loss: 0.4797, test_loss: 0.7150, test_f1: 0.6714
 epoch: 41, train_loss: 0.4666, test_loss: 0.7015, test_f1: 0.7056
 epoch: 42, train_loss: 0.4401, test_loss: 0.8589, test_f1: 0.6699
 epoch: 43, train_loss: 0.4310, test_loss: 0.7705, test_f1: 0.6728
 epoch: 44, train_loss: 0.4344, test_loss: 0.7729, test_f1: 0.6730
 epoch: 45, train_loss: 0.4599, test_loss: 0.7810, test_f1: 0.6684
 epoch: 46, train_loss: 0.4277, test_loss: 0.7820, test_f1: 0.6971
 epoch: 47, train_loss: 0.4408, test_loss: 0.8423, test_f1: 0.6503
 epoch: 48, train_loss: 0.4165, test_loss: 0.8139, test_f1: 0.6858
 epoch: 49, train_loss: 0.4156, test_loss: 0.8859, test_f1: 0.6775
 epoch: 50, train_loss: 0.4081, test_loss: 0.8531, test_f1: 0.6643
 epoch: 51, train_loss: 0.3376, test_loss: 0.8361, test_f1: 0.6700
 epoch: 52, train_loss: 0.3377, test_loss: 0.9072, test_f1: 0.6781
 epoch: 53, train_loss: 0.3247, test_loss: 0.8780, test_f1: 0.6919
 epoch: 54, train_loss: 0.3122, test_loss: 0.9552, test_f1: 0.6934
 epoch: 55, train_loss: 0.3010, test_loss: 0.9988, test_f1: 0.6795
 epoch: 56, train_loss: 0.2912, test_loss: 1.0488, test_f1: 0.6819
 epoch: 57, train_loss: 0.3009, test_loss: 1.0410, test_f1: 0.6764
 epoch: 58, train_loss: 0.3023, test_loss: 0.9049, test_f1: 0.6802
 epoch: 59, train_loss: 0.3302, test_loss: 0.9508, test_f1: 0.6651
 epoch: 60, train_loss: 0.3129, test_loss: 0.9010, test_f1: 0.6980
 epoch: 61, train_loss: 0.2945, test_loss: 0.9903, test_f1: 0.6970
 epoch: 62, train_loss: 0.2522, test_loss: 1.0253, test_f1: 0.6767
 epoch: 63, train_loss: 0.2750, test_loss: 1.1070, test_f1: 0.6804
 epoch: 64, train_loss: 0.2802, test_loss: 1.1559, test_f1: 0.6910
 epoch: 65, train_loss: 0.2693, test_loss: 1.1139, test_f1: 0.6912
 epoch: 66, train_loss: 0.2690, test_loss: 1.0921, test_f1: 0.6870
 epoch: 67, train_loss: 0.2588, test_loss: 1.1357, test_f1: 0.6822
 epoch: 68, train_loss: 0.2566, test_loss: 1.0873, test_f1: 0.6659
 epoch: 69, train_loss: 0.2627, test_loss: 1.0846, test_f1: 0.6932
 epoch: 70, train_loss: 0.2556, test_loss: 1.1777, test_f1: 0.6942
 epoch: 71, train_loss: 0.2391, test_loss: 1.1912, test_f1: 0.6780
 epoch: 72, train_loss: 0.2498, test_loss: 1.1125, test_f1: 0.6907
 epoch: 73, train_loss: 0.2414, test_loss: 1.1204, test_f1: 0.7036
 epoch: 74, train_loss: 0.2466, test_loss: 1.1123, test_f1: 0.6940
 epoch: 75, train_loss: 0.2361, test_loss: 1.3134, test_f1: 0.6610
 epoch: 76, train_loss: 0.2242, test_loss: 1.2693, test_f1: 0.6924
 epoch: 77, train_loss: 0.2062, test_loss: 1.2456, test_f1: 0.6794
 epoch: 78, train_loss: 0.2114, test_loss: 1.3108, test_f1: 0.6887
 epoch: 79, train_loss: 0.2162, test_loss: 1.4048, test_f1: 0.6813
 epoch: 80, train_loss: 0.2177, test_loss: 1.2884, test_f1: 0.7033
 epoch: 81, train_loss: 0.2411, test_loss: 1.1791, test_f1: 0.6840
 epoch: 82, train_loss: 0.2382, test_loss: 1.2608, test_f1: 0.6675
 epoch: 83, train_loss: 0.2129, test_loss: 1.2344, test_f1: 0.6808
 epoch: 84, train_loss: 0.2131, test_loss: 1.2705, test_f1: 0.7065
 epoch: 85, train_loss: 0.2072, test_loss: 1.3463, test_f1: 0.6839
 epoch: 86, train_loss: 0.1823, test_loss: 1.2769, test_f1: 0.6907
 epoch: 87, train_loss: 0.1931, test_loss: 1.3648, test_f1: 0.6801
 epoch: 88, train_loss: 0.2087, test_loss: 1.1712, test_f1: 0.6913
 epoch: 89, train_loss: 0.2190, test_loss: 1.2622, test_f1: 0.6763
 epoch: 90, train_loss: 0.2019, test_loss: 1.3377, test_f1: 0.6794
 epoch: 91, train_loss: 0.1925, test_loss: 1.2167, test_f1: 0.6869
 epoch: 92, train_loss: 0.2121, test_loss: 1.2506, test_f1: 0.6817
 epoch: 93, train_loss: 0.1826, test_loss: 1.3024, test_f1: 0.6897
 epoch: 94, train_loss: 0.1926, test_loss: 1.2972, test_f1: 0.6916
 epoch: 95, train_loss: 0.1806, test_loss: 1.4310, test_f1: 0.6836
 epoch: 96, train_loss: 0.1696, test_loss: 1.4783, test_f1: 0.6732
 epoch: 97, train_loss: 0.2025, test_loss: 1.4611, test_f1: 0.6875
 epoch: 98, train_loss: 0.2207, test_loss: 1.3911, test_f1: 0.6898
 epoch: 99, train_loss: 0.2061, test_loss: 1.4479, test_f1: 0.6815
##################ITERATION #4 ****************************************
 epoch: 0, train_loss: 1.1783, test_loss: 1.0042, test_f1: 0.4976
 epoch: 1, train_loss: 0.9666, test_loss: 0.9102, test_f1: 0.5176
 epoch: 2, train_loss: 0.9401, test_loss: 0.8888, test_f1: 0.4987
 epoch: 3, train_loss: 0.9055, test_loss: 0.8411, test_f1: 0.5482
 epoch: 4, train_loss: 0.8921, test_loss: 0.8388, test_f1: 0.5298
 epoch: 5, train_loss: 0.8646, test_loss: 0.8254, test_f1: 0.5489
 epoch: 6, train_loss: 0.8349, test_loss: 0.9153, test_f1: 0.5476
 epoch: 7, train_loss: 0.8262, test_loss: 0.8064, test_f1: 0.5937
 epoch: 8, train_loss: 0.7951, test_loss: 0.7836, test_f1: 0.5914
 epoch: 9, train_loss: 0.7845, test_loss: 0.7769, test_f1: 0.5934
 epoch: 10, train_loss: 0.7707, test_loss: 0.7567, test_f1: 0.6321
 epoch: 11, train_loss: 0.7494, test_loss: 0.7878, test_f1: 0.6427
 epoch: 12, train_loss: 0.7308, test_loss: 0.7115, test_f1: 0.6635
 epoch: 13, train_loss: 0.7169, test_loss: 0.7304, test_f1: 0.6922
 epoch: 14, train_loss: 0.6880, test_loss: 0.7310, test_f1: 0.6316
 epoch: 15, train_loss: 0.7108, test_loss: 0.7469, test_f1: 0.6243
 epoch: 16, train_loss: 0.6679, test_loss: 0.7637, test_f1: 0.6447
 epoch: 17, train_loss: 0.6506, test_loss: 0.7514, test_f1: 0.6736
 epoch: 18, train_loss: 0.6482, test_loss: 0.7864, test_f1: 0.6189
 epoch: 19, train_loss: 0.6468, test_loss: 0.7709, test_f1: 0.6735
 epoch: 20, train_loss: 0.6336, test_loss: 0.7443, test_f1: 0.6537
 epoch: 21, train_loss: 0.6163, test_loss: 0.6808, test_f1: 0.6962
 epoch: 22, train_loss: 0.6112, test_loss: 0.7865, test_f1: 0.6625
 epoch: 23, train_loss: 0.6040, test_loss: 0.6910, test_f1: 0.6756
 epoch: 24, train_loss: 0.5913, test_loss: 0.7859, test_f1: 0.6517
 epoch: 25, train_loss: 0.5745, test_loss: 0.6858, test_f1: 0.6885
 epoch: 26, train_loss: 0.5704, test_loss: 0.7374, test_f1: 0.6829
 epoch: 27, train_loss: 0.5575, test_loss: 0.7281, test_f1: 0.6714
 epoch: 28, train_loss: 0.5681, test_loss: 0.6723, test_f1: 0.7006
 epoch: 29, train_loss: 0.5511, test_loss: 0.6857, test_f1: 0.6622
 epoch: 30, train_loss: 0.5580, test_loss: 0.8358, test_f1: 0.6746
 epoch: 31, train_loss: 0.5536, test_loss: 0.8148, test_f1: 0.6814
 epoch: 32, train_loss: 0.5375, test_loss: 0.8380, test_f1: 0.6799
 epoch: 33, train_loss: 0.5266, test_loss: 0.9492, test_f1: 0.6886
 epoch: 34, train_loss: 0.5161, test_loss: 0.8776, test_f1: 0.6972
 epoch: 35, train_loss: 0.5054, test_loss: 0.8010, test_f1: 0.6627
 epoch: 36, train_loss: 0.4970, test_loss: 0.8996, test_f1: 0.6845
 epoch: 37, train_loss: 0.4926, test_loss: 0.7885, test_f1: 0.6555
 epoch: 38, train_loss: 0.4838, test_loss: 0.7435, test_f1: 0.7145
 epoch: 39, train_loss: 0.4660, test_loss: 0.9035, test_f1: 0.6805
 epoch: 40, train_loss: 0.4718, test_loss: 0.8866, test_f1: 0.6854
 epoch: 41, train_loss: 0.4537, test_loss: 0.9179, test_f1: 0.7016
 epoch: 42, train_loss: 0.4510, test_loss: 0.8891, test_f1: 0.6958
 epoch: 43, train_loss: 0.4605, test_loss: 0.9280, test_f1: 0.6828
 epoch: 44, train_loss: 0.4160, test_loss: 0.8715, test_f1: 0.6791
 epoch: 45, train_loss: 0.4602, test_loss: 0.8156, test_f1: 0.7010
 epoch: 46, train_loss: 0.4269, test_loss: 0.9439, test_f1: 0.6645
 epoch: 47, train_loss: 0.4263, test_loss: 0.9903, test_f1: 0.6905
 epoch: 48, train_loss: 0.4198, test_loss: 0.9650, test_f1: 0.6799
 epoch: 49, train_loss: 0.4165, test_loss: 0.8998, test_f1: 0.6737
 epoch: 50, train_loss: 0.4181, test_loss: 0.8818, test_f1: 0.6799
 epoch: 51, train_loss: 0.3633, test_loss: 1.0124, test_f1: 0.7036
 epoch: 52, train_loss: 0.3413, test_loss: 0.9977, test_f1: 0.6954
 epoch: 53, train_loss: 0.3293, test_loss: 1.0975, test_f1: 0.6906
 epoch: 54, train_loss: 0.3171, test_loss: 1.1583, test_f1: 0.6831
 epoch: 55, train_loss: 0.3143, test_loss: 1.1595, test_f1: 0.7191
 epoch: 56, train_loss: 0.3120, test_loss: 1.0605, test_f1: 0.6819
 epoch: 57, train_loss: 0.2953, test_loss: 1.1144, test_f1: 0.6793
 epoch: 58, train_loss: 0.2992, test_loss: 1.0408, test_f1: 0.6964
 epoch: 59, train_loss: 0.3082, test_loss: 1.0890, test_f1: 0.6859
 epoch: 60, train_loss: 0.2911, test_loss: 1.0230, test_f1: 0.6738
 epoch: 61, train_loss: 0.2881, test_loss: 1.2004, test_f1: 0.6870
 epoch: 62, train_loss: 0.2716, test_loss: 1.2126, test_f1: 0.7030
 epoch: 63, train_loss: 0.2908, test_loss: 1.2611, test_f1: 0.6920
 epoch: 64, train_loss: 0.2811, test_loss: 1.2523, test_f1: 0.6883
 epoch: 65, train_loss: 0.2712, test_loss: 1.0746, test_f1: 0.7007
 epoch: 66, train_loss: 0.2720, test_loss: 1.2600, test_f1: 0.6931
 epoch: 67, train_loss: 0.2618, test_loss: 1.2198, test_f1: 0.6879
 epoch: 68, train_loss: 0.2624, test_loss: 1.1632, test_f1: 0.6775
 epoch: 69, train_loss: 0.2532, test_loss: 1.2513, test_f1: 0.6822
 epoch: 70, train_loss: 0.2512, test_loss: 1.3310, test_f1: 0.6800
 epoch: 71, train_loss: 0.2593, test_loss: 1.3684, test_f1: 0.6855
 epoch: 72, train_loss: 0.2581, test_loss: 1.4417, test_f1: 0.6986
 epoch: 73, train_loss: 0.2523, test_loss: 1.3719, test_f1: 0.6895
 epoch: 74, train_loss: 0.2609, test_loss: 1.4942, test_f1: 0.6842
 epoch: 75, train_loss: 0.2427, test_loss: 1.3840, test_f1: 0.6821
 epoch: 76, train_loss: 0.2195, test_loss: 1.4370, test_f1: 0.6858
 epoch: 77, train_loss: 0.2384, test_loss: 1.3565, test_f1: 0.6954
 epoch: 78, train_loss: 0.2484, test_loss: 1.5487, test_f1: 0.6894
 epoch: 79, train_loss: 0.2302, test_loss: 1.5414, test_f1: 0.6920
 epoch: 80, train_loss: 0.2714, test_loss: 1.3389, test_f1: 0.6877
 epoch: 81, train_loss: 0.2177, test_loss: 1.4198, test_f1: 0.6711
 epoch: 82, train_loss: 0.2257, test_loss: 1.5044, test_f1: 0.6866
 epoch: 83, train_loss: 0.2273, test_loss: 1.3999, test_f1: 0.6781
 epoch: 84, train_loss: 0.2077, test_loss: 1.5159, test_f1: 0.6735
 epoch: 85, train_loss: 0.2173, test_loss: 1.5689, test_f1: 0.6895
 epoch: 86, train_loss: 0.2031, test_loss: 1.4536, test_f1: 0.6817
 epoch: 87, train_loss: 0.1947, test_loss: 1.5659, test_f1: 0.6883
 epoch: 88, train_loss: 0.2038, test_loss: 1.6766, test_f1: 0.6885
 epoch: 89, train_loss: 0.2077, test_loss: 1.5432, test_f1: 0.6899
 epoch: 90, train_loss: 0.2052, test_loss: 1.6490, test_f1: 0.6933
 epoch: 91, train_loss: 0.2347, test_loss: 1.4763, test_f1: 0.6933
 epoch: 92, train_loss: 0.2044, test_loss: 1.4061, test_f1: 0.6824
 epoch: 93, train_loss: 0.2032, test_loss: 1.5737, test_f1: 0.6792
 epoch: 94, train_loss: 0.2172, test_loss: 1.4693, test_f1: 0.6855
 epoch: 95, train_loss: 0.1959, test_loss: 1.6191, test_f1: 0.6693
 epoch: 96, train_loss: 0.2105, test_loss: 1.7439, test_f1: 0.6636
 epoch: 97, train_loss: 0.1930, test_loss: 1.8612, test_f1: 0.6873
 epoch: 98, train_loss: 0.1820, test_loss: 1.6550, test_f1: 0.6698
 epoch: 99, train_loss: 0.1845, test_loss: 1.8103, test_f1: 0.6763
##################ITERATION #5 ****************************************
 epoch: 0, train_loss: 1.1996, test_loss: 0.9940, test_f1: 0.4586
 epoch: 1, train_loss: 0.9831, test_loss: 0.9699, test_f1: 0.4910
 epoch: 2, train_loss: 0.9490, test_loss: 0.9599, test_f1: 0.4661
 epoch: 3, train_loss: 0.9330, test_loss: 0.9200, test_f1: 0.5336
 epoch: 4, train_loss: 0.8927, test_loss: 0.8794, test_f1: 0.5737
 epoch: 5, train_loss: 0.8893, test_loss: 0.8717, test_f1: 0.5381
 epoch: 6, train_loss: 0.8673, test_loss: 0.8347, test_f1: 0.5722
 epoch: 7, train_loss: 0.8243, test_loss: 0.7803, test_f1: 0.5848
 epoch: 8, train_loss: 0.7982, test_loss: 0.8536, test_f1: 0.5429
 epoch: 9, train_loss: 0.7918, test_loss: 0.7399, test_f1: 0.6443
 epoch: 10, train_loss: 0.7713, test_loss: 0.7327, test_f1: 0.6381
 epoch: 11, train_loss: 0.7591, test_loss: 0.7329, test_f1: 0.6343
 epoch: 12, train_loss: 0.7397, test_loss: 0.7760, test_f1: 0.6004
 epoch: 13, train_loss: 0.7309, test_loss: 0.7419, test_f1: 0.6614
 epoch: 14, train_loss: 0.7193, test_loss: 0.6980, test_f1: 0.6628
 epoch: 15, train_loss: 0.6898, test_loss: 0.8016, test_f1: 0.6428
 epoch: 16, train_loss: 0.6852, test_loss: 0.7441, test_f1: 0.6576
 epoch: 17, train_loss: 0.6902, test_loss: 0.7970, test_f1: 0.6476
 epoch: 18, train_loss: 0.6741, test_loss: 0.7495, test_f1: 0.6516
 epoch: 19, train_loss: 0.6445, test_loss: 0.7179, test_f1: 0.6632
 epoch: 20, train_loss: 0.6393, test_loss: 0.7943, test_f1: 0.6591
 epoch: 21, train_loss: 0.6293, test_loss: 0.7353, test_f1: 0.6457
 epoch: 22, train_loss: 0.6197, test_loss: 0.7169, test_f1: 0.6711
 epoch: 23, train_loss: 0.6071, test_loss: 0.8876, test_f1: 0.6391
 epoch: 24, train_loss: 0.6126, test_loss: 0.8376, test_f1: 0.5897
 epoch: 25, train_loss: 0.6020, test_loss: 0.8684, test_f1: 0.6287
 epoch: 26, train_loss: 0.5739, test_loss: 0.7826, test_f1: 0.6801
 epoch: 27, train_loss: 0.5694, test_loss: 0.7325, test_f1: 0.6471
 epoch: 28, train_loss: 0.5976, test_loss: 0.7456, test_f1: 0.6600
 epoch: 29, train_loss: 0.5573, test_loss: 0.7853, test_f1: 0.6559
 epoch: 30, train_loss: 0.5486, test_loss: 0.8304, test_f1: 0.6359
 epoch: 31, train_loss: 0.5362, test_loss: 0.8513, test_f1: 0.6751
 epoch: 32, train_loss: 0.5229, test_loss: 0.9785, test_f1: 0.6822
 epoch: 33, train_loss: 0.5198, test_loss: 0.8422, test_f1: 0.6576
 epoch: 34, train_loss: 0.5128, test_loss: 0.8181, test_f1: 0.6686
 epoch: 35, train_loss: 0.5029, test_loss: 0.9164, test_f1: 0.6767
 epoch: 36, train_loss: 0.5025, test_loss: 0.7766, test_f1: 0.6881
 epoch: 37, train_loss: 0.4957, test_loss: 0.9162, test_f1: 0.6492
 epoch: 38, train_loss: 0.5076, test_loss: 0.7757, test_f1: 0.7005
 epoch: 39, train_loss: 0.4755, test_loss: 0.8333, test_f1: 0.6718
 epoch: 40, train_loss: 0.4762, test_loss: 0.8755, test_f1: 0.6885
 epoch: 41, train_loss: 0.4763, test_loss: 0.9282, test_f1: 0.6929
 epoch: 42, train_loss: 0.4503, test_loss: 0.9236, test_f1: 0.6794
 epoch: 43, train_loss: 0.4409, test_loss: 0.8129, test_f1: 0.6816
 epoch: 44, train_loss: 0.4331, test_loss: 1.0865, test_f1: 0.7004
 epoch: 45, train_loss: 0.4524, test_loss: 0.9801, test_f1: 0.6751
 epoch: 46, train_loss: 0.4157, test_loss: 0.9588, test_f1: 0.6743
 epoch: 47, train_loss: 0.4224, test_loss: 0.9174, test_f1: 0.6777
 epoch: 48, train_loss: 0.4132, test_loss: 1.1383, test_f1: 0.6289
 epoch: 49, train_loss: 0.4346, test_loss: 0.9998, test_f1: 0.6879
 epoch: 50, train_loss: 0.4223, test_loss: 0.9525, test_f1: 0.6745
 epoch: 51, train_loss: 0.3628, test_loss: 1.0337, test_f1: 0.6786
 epoch: 52, train_loss: 0.3422, test_loss: 1.1080, test_f1: 0.6923
 epoch: 53, train_loss: 0.3248, test_loss: 1.0866, test_f1: 0.6551
 epoch: 54, train_loss: 0.3289, test_loss: 1.2829, test_f1: 0.6854
 epoch: 55, train_loss: 0.3258, test_loss: 1.0422, test_f1: 0.6900
 epoch: 56, train_loss: 0.3230, test_loss: 1.0976, test_f1: 0.6804
 epoch: 57, train_loss: 0.2976, test_loss: 1.0894, test_f1: 0.6864
 epoch: 58, train_loss: 0.3027, test_loss: 1.1042, test_f1: 0.6830
 epoch: 59, train_loss: 0.3271, test_loss: 1.2966, test_f1: 0.6719
 epoch: 60, train_loss: 0.2844, test_loss: 1.2092, test_f1: 0.6739
 epoch: 61, train_loss: 0.2991, test_loss: 1.1577, test_f1: 0.6762
 epoch: 62, train_loss: 0.2941, test_loss: 1.1569, test_f1: 0.6842
 epoch: 63, train_loss: 0.2839, test_loss: 1.2911, test_f1: 0.6891
 epoch: 64, train_loss: 0.3012, test_loss: 1.3609, test_f1: 0.6825
 epoch: 65, train_loss: 0.2847, test_loss: 1.3113, test_f1: 0.6803
 epoch: 66, train_loss: 0.2732, test_loss: 1.2242, test_f1: 0.6764
 epoch: 67, train_loss: 0.2498, test_loss: 1.3560, test_f1: 0.6829
 epoch: 68, train_loss: 0.2788, test_loss: 1.2694, test_f1: 0.6582
 epoch: 69, train_loss: 0.2745, test_loss: 1.3078, test_f1: 0.6754
 epoch: 70, train_loss: 0.2683, test_loss: 1.3375, test_f1: 0.6736
 epoch: 71, train_loss: 0.2509, test_loss: 1.3395, test_f1: 0.6643
 epoch: 72, train_loss: 0.2452, test_loss: 1.4674, test_f1: 0.6783
 epoch: 73, train_loss: 0.2689, test_loss: 1.1521, test_f1: 0.6718
 epoch: 74, train_loss: 0.2576, test_loss: 1.1372, test_f1: 0.6788
 epoch: 75, train_loss: 0.2415, test_loss: 1.3128, test_f1: 0.6818
 epoch: 76, train_loss: 0.2337, test_loss: 1.2854, test_f1: 0.7015
 epoch: 77, train_loss: 0.2264, test_loss: 1.2851, test_f1: 0.6855
 epoch: 78, train_loss: 0.2274, test_loss: 1.3176, test_f1: 0.6640
 epoch: 79, train_loss: 0.2311, test_loss: 1.3769, test_f1: 0.6611
 epoch: 80, train_loss: 0.2402, test_loss: 1.3182, test_f1: 0.6729
 epoch: 81, train_loss: 0.2152, test_loss: 1.3654, test_f1: 0.6824
 epoch: 82, train_loss: 0.2234, test_loss: 1.4038, test_f1: 0.6865
 epoch: 83, train_loss: 0.2738, test_loss: 1.4518, test_f1: 0.6752
 epoch: 84, train_loss: 0.2612, test_loss: 1.4533, test_f1: 0.6559
 epoch: 85, train_loss: 0.2249, test_loss: 1.3428, test_f1: 0.6514
 epoch: 86, train_loss: 0.2315, test_loss: 1.5879, test_f1: 0.6481
 epoch: 87, train_loss: 0.2229, test_loss: 1.2903, test_f1: 0.6836
 epoch: 88, train_loss: 0.2055, test_loss: 1.3220, test_f1: 0.6808
 epoch: 89, train_loss: 0.2185, test_loss: 1.3212, test_f1: 0.6850
 epoch: 90, train_loss: 0.2039, test_loss: 1.3278, test_f1: 0.6771
 epoch: 91, train_loss: 0.2076, test_loss: 1.4026, test_f1: 0.6620
 epoch: 92, train_loss: 0.2072, test_loss: 1.4794, test_f1: 0.6516
 epoch: 93, train_loss: 0.1947, test_loss: 1.4600, test_f1: 0.6743
 epoch: 94, train_loss: 0.2020, test_loss: 1.5253, test_f1: 0.6732
 epoch: 95, train_loss: 0.1814, test_loss: 1.5369, test_f1: 0.6737
 epoch: 96, train_loss: 0.1969, test_loss: 1.7872, test_f1: 0.6623
 epoch: 97, train_loss: 0.1755, test_loss: 1.6976, test_f1: 0.6792
 epoch: 98, train_loss: 0.1953, test_loss: 1.6730, test_f1: 0.6708
 epoch: 99, train_loss: 0.1766, test_loss: 1.6014, test_f1: 0.6784
##################ITERATION #6 ****************************************
 epoch: 0, train_loss: 1.1928, test_loss: 0.9864, test_f1: 0.4727
 epoch: 1, train_loss: 0.9675, test_loss: 0.9305, test_f1: 0.5055
 epoch: 2, train_loss: 0.9295, test_loss: 0.8921, test_f1: 0.5317
 epoch: 3, train_loss: 0.9000, test_loss: 0.8957, test_f1: 0.5084
 epoch: 4, train_loss: 0.8700, test_loss: 0.8747, test_f1: 0.5258
 epoch: 5, train_loss: 0.8564, test_loss: 0.8356, test_f1: 0.5587
 epoch: 6, train_loss: 0.8345, test_loss: 0.8197, test_f1: 0.5716
 epoch: 7, train_loss: 0.8132, test_loss: 0.7699, test_f1: 0.6140
 epoch: 8, train_loss: 0.7896, test_loss: 0.8180, test_f1: 0.5544
 epoch: 9, train_loss: 0.7825, test_loss: 0.7280, test_f1: 0.6422
 epoch: 10, train_loss: 0.7452, test_loss: 0.7400, test_f1: 0.6309
 epoch: 11, train_loss: 0.7553, test_loss: 0.7459, test_f1: 0.6318
 epoch: 12, train_loss: 0.7211, test_loss: 0.7157, test_f1: 0.6488
 epoch: 13, train_loss: 0.7104, test_loss: 0.7573, test_f1: 0.6047
 epoch: 14, train_loss: 0.6956, test_loss: 0.7008, test_f1: 0.6504
 epoch: 15, train_loss: 0.6857, test_loss: 0.8167, test_f1: 0.6506
 epoch: 16, train_loss: 0.6796, test_loss: 0.7672, test_f1: 0.6537
 epoch: 17, train_loss: 0.6590, test_loss: 0.6740, test_f1: 0.6782
 epoch: 18, train_loss: 0.6799, test_loss: 0.7379, test_f1: 0.6509
 epoch: 19, train_loss: 0.6467, test_loss: 0.7984, test_f1: 0.6259
 epoch: 20, train_loss: 0.6377, test_loss: 0.7283, test_f1: 0.6553
 epoch: 21, train_loss: 0.6096, test_loss: 0.8198, test_f1: 0.6658
 epoch: 22, train_loss: 0.6281, test_loss: 0.7995, test_f1: 0.6430
 epoch: 23, train_loss: 0.6167, test_loss: 0.9138, test_f1: 0.6519
 epoch: 24, train_loss: 0.6130, test_loss: 0.9066, test_f1: 0.6187
 epoch: 25, train_loss: 0.5972, test_loss: 0.7449, test_f1: 0.6730
 epoch: 26, train_loss: 0.5906, test_loss: 0.7634, test_f1: 0.6583
 epoch: 27, train_loss: 0.5619, test_loss: 0.7921, test_f1: 0.6559
 epoch: 28, train_loss: 0.5603, test_loss: 0.7101, test_f1: 0.6706
 epoch: 29, train_loss: 0.5438, test_loss: 0.6989, test_f1: 0.6737
 epoch: 30, train_loss: 0.5501, test_loss: 0.7293, test_f1: 0.6661
 epoch: 31, train_loss: 0.5477, test_loss: 0.7217, test_f1: 0.6571
 epoch: 32, train_loss: 0.5301, test_loss: 0.7536, test_f1: 0.6980
 epoch: 33, train_loss: 0.5184, test_loss: 0.8692, test_f1: 0.6643
 epoch: 34, train_loss: 0.5095, test_loss: 0.8859, test_f1: 0.6776
 epoch: 35, train_loss: 0.5025, test_loss: 0.8097, test_f1: 0.6507
 epoch: 36, train_loss: 0.5025, test_loss: 0.7624, test_f1: 0.6725
 epoch: 37, train_loss: 0.4946, test_loss: 0.7509, test_f1: 0.6564
 epoch: 38, train_loss: 0.4938, test_loss: 0.7497, test_f1: 0.6625
 epoch: 39, train_loss: 0.4941, test_loss: 0.7797, test_f1: 0.6538
 epoch: 40, train_loss: 0.4830, test_loss: 0.9196, test_f1: 0.6530
 epoch: 41, train_loss: 0.4871, test_loss: 0.8735, test_f1: 0.6951
 epoch: 42, train_loss: 0.4606, test_loss: 0.9168, test_f1: 0.6389
 epoch: 43, train_loss: 0.5222, test_loss: 0.8847, test_f1: 0.6583
 epoch: 44, train_loss: 0.4717, test_loss: 0.8313, test_f1: 0.6688
 epoch: 45, train_loss: 0.4577, test_loss: 0.8580, test_f1: 0.6578
 epoch: 46, train_loss: 0.4644, test_loss: 0.8113, test_f1: 0.6739
 epoch: 47, train_loss: 0.4444, test_loss: 0.7949, test_f1: 0.6689
 epoch: 48, train_loss: 0.4521, test_loss: 0.9065, test_f1: 0.6734
 epoch: 49, train_loss: 0.4286, test_loss: 0.8445, test_f1: 0.6763
 epoch: 50, train_loss: 0.3923, test_loss: 0.8443, test_f1: 0.6843
 epoch: 51, train_loss: 0.3653, test_loss: 0.9391, test_f1: 0.6675
 epoch: 52, train_loss: 0.3498, test_loss: 0.9062, test_f1: 0.6847
 epoch: 53, train_loss: 0.3372, test_loss: 0.9104, test_f1: 0.6779
 epoch: 54, train_loss: 0.3381, test_loss: 1.0236, test_f1: 0.6821
 epoch: 55, train_loss: 0.3203, test_loss: 1.0623, test_f1: 0.6748
 epoch: 56, train_loss: 0.3258, test_loss: 1.1008, test_f1: 0.6736
 epoch: 57, train_loss: 0.2986, test_loss: 1.1097, test_f1: 0.6736
 epoch: 58, train_loss: 0.2954, test_loss: 1.0676, test_f1: 0.6842
 epoch: 59, train_loss: 0.3075, test_loss: 1.1404, test_f1: 0.6917
 epoch: 60, train_loss: 0.3319, test_loss: 1.2229, test_f1: 0.6585
 epoch: 61, train_loss: 0.2928, test_loss: 1.1762, test_f1: 0.6615
 epoch: 62, train_loss: 0.2993, test_loss: 1.0836, test_f1: 0.6689
 epoch: 63, train_loss: 0.2829, test_loss: 1.1631, test_f1: 0.6617
 epoch: 64, train_loss: 0.2765, test_loss: 1.1149, test_f1: 0.6742
 epoch: 65, train_loss: 0.2831, test_loss: 1.1612, test_f1: 0.6811
 epoch: 66, train_loss: 0.2687, test_loss: 1.1668, test_f1: 0.6616
 epoch: 67, train_loss: 0.2854, test_loss: 1.1235, test_f1: 0.6758
 epoch: 68, train_loss: 0.2753, test_loss: 1.1614, test_f1: 0.6630
 epoch: 69, train_loss: 0.2583, test_loss: 1.2836, test_f1: 0.6766
 epoch: 70, train_loss: 0.2540, test_loss: 1.4085, test_f1: 0.6764
 epoch: 71, train_loss: 0.2808, test_loss: 1.3250, test_f1: 0.6587
 epoch: 72, train_loss: 0.2567, test_loss: 1.2313, test_f1: 0.6459
 epoch: 73, train_loss: 0.2585, test_loss: 1.2361, test_f1: 0.6649
 epoch: 74, train_loss: 0.2843, test_loss: 1.1704, test_f1: 0.6746
 epoch: 75, train_loss: 0.2582, test_loss: 1.1766, test_f1: 0.6579
 epoch: 76, train_loss: 0.2418, test_loss: 1.2616, test_f1: 0.6603
 epoch: 77, train_loss: 0.2542, test_loss: 1.2400, test_f1: 0.6675
 epoch: 78, train_loss: 0.2626, test_loss: 1.2302, test_f1: 0.6677
 epoch: 79, train_loss: 0.2390, test_loss: 1.1688, test_f1: 0.6690
 epoch: 80, train_loss: 0.2315, test_loss: 1.3465, test_f1: 0.6817
 epoch: 81, train_loss: 0.2393, test_loss: 1.3408, test_f1: 0.6555
 epoch: 82, train_loss: 0.2527, test_loss: 1.3219, test_f1: 0.6622
 epoch: 83, train_loss: 0.2250, test_loss: 1.3700, test_f1: 0.6585
 epoch: 84, train_loss: 0.2195, test_loss: 1.3781, test_f1: 0.6735
 epoch: 85, train_loss: 0.2081, test_loss: 1.4007, test_f1: 0.6690
 epoch: 86, train_loss: 0.2457, test_loss: 1.3402, test_f1: 0.6641
 epoch: 87, train_loss: 0.2245, test_loss: 1.3659, test_f1: 0.6699
 epoch: 88, train_loss: 0.2126, test_loss: 1.4773, test_f1: 0.6617
 epoch: 89, train_loss: 0.2065, test_loss: 1.4564, test_f1: 0.6806
 epoch: 90, train_loss: 0.2158, test_loss: 1.3828, test_f1: 0.6635
 epoch: 91, train_loss: 0.2085, test_loss: 1.3066, test_f1: 0.6617
 epoch: 92, train_loss: 0.1975, test_loss: 1.4591, test_f1: 0.6709
 epoch: 93, train_loss: 0.2172, test_loss: 1.3881, test_f1: 0.6562
 epoch: 94, train_loss: 0.1935, test_loss: 1.3340, test_f1: 0.6731
 epoch: 95, train_loss: 0.1930, test_loss: 1.4085, test_f1: 0.6671
 epoch: 96, train_loss: 0.2035, test_loss: 1.5081, test_f1: 0.6654
 epoch: 97, train_loss: 0.1871, test_loss: 1.5240, test_f1: 0.6657
 epoch: 98, train_loss: 0.1984, test_loss: 1.5446, test_f1: 0.6729
 epoch: 99, train_loss: 0.2183, test_loss: 1.3870, test_f1: 0.6666
##################ITERATION #7 ****************************************
 epoch: 0, train_loss: 1.2091, test_loss: 1.0009, test_f1: 0.4688
 epoch: 1, train_loss: 0.9820, test_loss: 0.9122, test_f1: 0.5369
 epoch: 2, train_loss: 0.9204, test_loss: 0.9182, test_f1: 0.5207
 epoch: 3, train_loss: 0.9016, test_loss: 0.8387, test_f1: 0.5588
 epoch: 4, train_loss: 0.8690, test_loss: 0.8428, test_f1: 0.6067
 epoch: 5, train_loss: 0.8629, test_loss: 0.7944, test_f1: 0.5974
 epoch: 6, train_loss: 0.8143, test_loss: 0.8030, test_f1: 0.6016
 epoch: 7, train_loss: 0.8113, test_loss: 0.7777, test_f1: 0.5789
 epoch: 8, train_loss: 0.7791, test_loss: 0.7888, test_f1: 0.6371
 epoch: 9, train_loss: 0.7725, test_loss: 0.7542, test_f1: 0.6124
 epoch: 10, train_loss: 0.7574, test_loss: 0.7342, test_f1: 0.6448
 epoch: 11, train_loss: 0.7393, test_loss: 0.7482, test_f1: 0.6298
 epoch: 12, train_loss: 0.7395, test_loss: 0.7844, test_f1: 0.6165
 epoch: 13, train_loss: 0.7188, test_loss: 0.7067, test_f1: 0.7010
 epoch: 14, train_loss: 0.7171, test_loss: 0.7552, test_f1: 0.6798
 epoch: 15, train_loss: 0.6660, test_loss: 0.7121, test_f1: 0.6714
 epoch: 16, train_loss: 0.6993, test_loss: 0.7884, test_f1: 0.6604
 epoch: 17, train_loss: 0.6580, test_loss: 0.6746, test_f1: 0.6677
 epoch: 18, train_loss: 0.6443, test_loss: 0.6621, test_f1: 0.6808
 epoch: 19, train_loss: 0.6181, test_loss: 0.6920, test_f1: 0.6952
 epoch: 20, train_loss: 0.6158, test_loss: 0.7062, test_f1: 0.6602
 epoch: 21, train_loss: 0.6048, test_loss: 0.6450, test_f1: 0.6926
 epoch: 22, train_loss: 0.6026, test_loss: 0.7354, test_f1: 0.6672
 epoch: 23, train_loss: 0.5849, test_loss: 0.6979, test_f1: 0.6776
 epoch: 24, train_loss: 0.5882, test_loss: 0.7031, test_f1: 0.6524
 epoch: 25, train_loss: 0.5734, test_loss: 0.6929, test_f1: 0.7034
 epoch: 26, train_loss: 0.5482, test_loss: 0.8166, test_f1: 0.6837
 epoch: 27, train_loss: 0.5512, test_loss: 0.7202, test_f1: 0.6813
 epoch: 28, train_loss: 0.5323, test_loss: 0.7596, test_f1: 0.7000
 epoch: 29, train_loss: 0.5286, test_loss: 0.6697, test_f1: 0.7258
 epoch: 30, train_loss: 0.5119, test_loss: 0.7452, test_f1: 0.6577
 epoch: 31, train_loss: 0.5308, test_loss: 0.7578, test_f1: 0.6930
 epoch: 32, train_loss: 0.5048, test_loss: 0.7314, test_f1: 0.6815
 epoch: 33, train_loss: 0.4981, test_loss: 0.7438, test_f1: 0.6785
 epoch: 34, train_loss: 0.5172, test_loss: 0.7656, test_f1: 0.6713
 epoch: 35, train_loss: 0.4822, test_loss: 0.8336, test_f1: 0.6869
 epoch: 36, train_loss: 0.4737, test_loss: 0.8593, test_f1: 0.6701
 epoch: 37, train_loss: 0.4949, test_loss: 0.6940, test_f1: 0.6961
 epoch: 38, train_loss: 0.4797, test_loss: 0.7111, test_f1: 0.6981
 epoch: 39, train_loss: 0.4648, test_loss: 0.6955, test_f1: 0.7211
 epoch: 40, train_loss: 0.4379, test_loss: 0.7542, test_f1: 0.6637
 epoch: 41, train_loss: 0.4596, test_loss: 0.7824, test_f1: 0.7018
 epoch: 42, train_loss: 0.4444, test_loss: 0.7229, test_f1: 0.7008
 epoch: 43, train_loss: 0.4432, test_loss: 0.7663, test_f1: 0.6763
 epoch: 44, train_loss: 0.4047, test_loss: 0.7657, test_f1: 0.6951
 epoch: 45, train_loss: 0.4281, test_loss: 0.7502, test_f1: 0.7207
 epoch: 46, train_loss: 0.4140, test_loss: 0.7914, test_f1: 0.6823
 epoch: 47, train_loss: 0.4208, test_loss: 0.7740, test_f1: 0.7065
 epoch: 48, train_loss: 0.4145, test_loss: 0.7909, test_f1: 0.6822
 epoch: 49, train_loss: 0.4020, test_loss: 0.7709, test_f1: 0.6937
 epoch: 50, train_loss: 0.3871, test_loss: 0.7752, test_f1: 0.7052
 epoch: 51, train_loss: 0.3472, test_loss: 0.7742, test_f1: 0.7085
 epoch: 52, train_loss: 0.3207, test_loss: 0.8960, test_f1: 0.6939
 epoch: 53, train_loss: 0.3278, test_loss: 0.8966, test_f1: 0.6819
 epoch: 54, train_loss: 0.3134, test_loss: 0.8640, test_f1: 0.7046
 epoch: 55, train_loss: 0.3246, test_loss: 0.8979, test_f1: 0.6848
 epoch: 56, train_loss: 0.2838, test_loss: 0.9100, test_f1: 0.6937
 epoch: 57, train_loss: 0.3057, test_loss: 0.9604, test_f1: 0.7004
 epoch: 58, train_loss: 0.2905, test_loss: 0.9523, test_f1: 0.6827
 epoch: 59, train_loss: 0.3034, test_loss: 0.8879, test_f1: 0.6985
 epoch: 60, train_loss: 0.3149, test_loss: 1.0154, test_f1: 0.6851
 epoch: 61, train_loss: 0.3021, test_loss: 0.8978, test_f1: 0.6823
 epoch: 62, train_loss: 0.2991, test_loss: 0.9542, test_f1: 0.6714
 epoch: 63, train_loss: 0.3111, test_loss: 0.9387, test_f1: 0.6783
 epoch: 64, train_loss: 0.2583, test_loss: 0.9368, test_f1: 0.6944
 epoch: 65, train_loss: 0.2554, test_loss: 1.0796, test_f1: 0.6756
 epoch: 66, train_loss: 0.2809, test_loss: 1.0510, test_f1: 0.6978
 epoch: 67, train_loss: 0.2811, test_loss: 0.9599, test_f1: 0.6941
 epoch: 68, train_loss: 0.2700, test_loss: 0.9578, test_f1: 0.6752
 epoch: 69, train_loss: 0.2758, test_loss: 0.9462, test_f1: 0.6990
 epoch: 70, train_loss: 0.2544, test_loss: 0.9591, test_f1: 0.7202
 epoch: 71, train_loss: 0.2716, test_loss: 0.9910, test_f1: 0.6911
 epoch: 72, train_loss: 0.2295, test_loss: 1.0018, test_f1: 0.6868
 epoch: 73, train_loss: 0.2404, test_loss: 1.1580, test_f1: 0.6633
 epoch: 74, train_loss: 0.2597, test_loss: 1.1236, test_f1: 0.6915
 epoch: 75, train_loss: 0.2452, test_loss: 1.0576, test_f1: 0.6721
 epoch: 76, train_loss: 0.2510, test_loss: 1.0697, test_f1: 0.6902
 epoch: 77, train_loss: 0.2468, test_loss: 1.0221, test_f1: 0.6975
 epoch: 78, train_loss: 0.2238, test_loss: 1.1363, test_f1: 0.6822
 epoch: 79, train_loss: 0.2076, test_loss: 1.2337, test_f1: 0.6685
 epoch: 80, train_loss: 0.2127, test_loss: 1.3793, test_f1: 0.6589
 epoch: 81, train_loss: 0.2324, test_loss: 1.2979, test_f1: 0.6772
 epoch: 82, train_loss: 0.2228, test_loss: 1.2638, test_f1: 0.6582
 epoch: 83, train_loss: 0.2371, test_loss: 1.1513, test_f1: 0.6945
 epoch: 84, train_loss: 0.2114, test_loss: 1.2021, test_f1: 0.6584
 epoch: 85, train_loss: 0.1939, test_loss: 1.2184, test_f1: 0.6846
 epoch: 86, train_loss: 0.2203, test_loss: 1.2801, test_f1: 0.6740
 epoch: 87, train_loss: 0.2244, test_loss: 1.2624, test_f1: 0.6778
 epoch: 88, train_loss: 0.2089, test_loss: 1.2194, test_f1: 0.6833
 epoch: 89, train_loss: 0.2091, test_loss: 1.2444, test_f1: 0.6713
 epoch: 90, train_loss: 0.2169, test_loss: 1.3117, test_f1: 0.6563
 epoch: 91, train_loss: 0.2080, test_loss: 1.4016, test_f1: 0.6895
 epoch: 92, train_loss: 0.2167, test_loss: 1.1881, test_f1: 0.6873
 epoch: 93, train_loss: 0.2053, test_loss: 1.3352, test_f1: 0.6630
 epoch: 94, train_loss: 0.2053, test_loss: 1.1894, test_f1: 0.6888
 epoch: 95, train_loss: 0.1933, test_loss: 1.3313, test_f1: 0.6792
 epoch: 96, train_loss: 0.2104, test_loss: 1.3571, test_f1: 0.6635
 epoch: 97, train_loss: 0.2059, test_loss: 1.3841, test_f1: 0.6763
 epoch: 98, train_loss: 0.2053, test_loss: 1.2958, test_f1: 0.6597
 epoch: 99, train_loss: 0.1968, test_loss: 1.2957, test_f1: 0.6807
##################ITERATION #8 ****************************************
 epoch: 0, train_loss: 1.2269, test_loss: 1.0375, test_f1: 0.4051
 epoch: 1, train_loss: 0.9754, test_loss: 1.0131, test_f1: 0.5010
 epoch: 2, train_loss: 0.9507, test_loss: 0.9566, test_f1: 0.5114
 epoch: 3, train_loss: 0.9148, test_loss: 0.8855, test_f1: 0.5306
 epoch: 4, train_loss: 0.8930, test_loss: 0.9305, test_f1: 0.5653
 epoch: 5, train_loss: 0.8594, test_loss: 1.0028, test_f1: 0.5320
 epoch: 6, train_loss: 0.8341, test_loss: 0.8032, test_f1: 0.5734
 epoch: 7, train_loss: 0.7989, test_loss: 0.8432, test_f1: 0.5671
 epoch: 8, train_loss: 0.8020, test_loss: 0.8164, test_f1: 0.5829
 epoch: 9, train_loss: 0.7802, test_loss: 0.8185, test_f1: 0.6092
 epoch: 10, train_loss: 0.7526, test_loss: 0.8226, test_f1: 0.5744
 epoch: 11, train_loss: 0.7363, test_loss: 0.7513, test_f1: 0.5966
 epoch: 12, train_loss: 0.7322, test_loss: 0.7741, test_f1: 0.5891
 epoch: 13, train_loss: 0.7163, test_loss: 0.7383, test_f1: 0.6061
 epoch: 14, train_loss: 0.7073, test_loss: 0.7150, test_f1: 0.6739
 epoch: 15, train_loss: 0.6735, test_loss: 0.7326, test_f1: 0.6395
 epoch: 16, train_loss: 0.6819, test_loss: 0.7098, test_f1: 0.6512
 epoch: 17, train_loss: 0.6631, test_loss: 0.7132, test_f1: 0.6733
 epoch: 18, train_loss: 0.6561, test_loss: 0.7438, test_f1: 0.6706
 epoch: 19, train_loss: 0.6391, test_loss: 0.7501, test_f1: 0.6638
 epoch: 20, train_loss: 0.6361, test_loss: 0.7115, test_f1: 0.6769
 epoch: 21, train_loss: 0.6300, test_loss: 0.6811, test_f1: 0.6719
 epoch: 22, train_loss: 0.5949, test_loss: 0.7850, test_f1: 0.6500
 epoch: 23, train_loss: 0.5994, test_loss: 0.7075, test_f1: 0.6664
 epoch: 24, train_loss: 0.5975, test_loss: 0.7756, test_f1: 0.6435
 epoch: 25, train_loss: 0.5886, test_loss: 0.6984, test_f1: 0.6873
 epoch: 26, train_loss: 0.5703, test_loss: 0.7075, test_f1: 0.6707
 epoch: 27, train_loss: 0.5766, test_loss: 0.7253, test_f1: 0.6603
 epoch: 28, train_loss: 0.5692, test_loss: 0.6807, test_f1: 0.6969
 epoch: 29, train_loss: 0.5625, test_loss: 0.7286, test_f1: 0.6761
 epoch: 30, train_loss: 0.5577, test_loss: 0.6942, test_f1: 0.6779
 epoch: 31, train_loss: 0.5324, test_loss: 0.6633, test_f1: 0.6867
 epoch: 32, train_loss: 0.5313, test_loss: 0.6711, test_f1: 0.6849
 epoch: 33, train_loss: 0.5443, test_loss: 0.7116, test_f1: 0.6753
 epoch: 34, train_loss: 0.5178, test_loss: 0.6745, test_f1: 0.6776
 epoch: 35, train_loss: 0.5100, test_loss: 0.7616, test_f1: 0.6735
 epoch: 36, train_loss: 0.5024, test_loss: 0.6917, test_f1: 0.7008
 epoch: 37, train_loss: 0.5062, test_loss: 0.7616, test_f1: 0.6831
 epoch: 38, train_loss: 0.4976, test_loss: 0.7734, test_f1: 0.6851
 epoch: 39, train_loss: 0.5004, test_loss: 0.6730, test_f1: 0.7272
 epoch: 40, train_loss: 0.4591, test_loss: 0.7754, test_f1: 0.6875
 epoch: 41, train_loss: 0.4713, test_loss: 0.7346, test_f1: 0.6809
 epoch: 42, train_loss: 0.4835, test_loss: 0.7701, test_f1: 0.6727
 epoch: 43, train_loss: 0.4671, test_loss: 0.7547, test_f1: 0.6751
 epoch: 44, train_loss: 0.4638, test_loss: 0.6946, test_f1: 0.6952
 epoch: 45, train_loss: 0.4451, test_loss: 0.7113, test_f1: 0.6941
 epoch: 46, train_loss: 0.4665, test_loss: 0.7775, test_f1: 0.6660
 epoch: 47, train_loss: 0.4364, test_loss: 0.8556, test_f1: 0.6628
 epoch: 48, train_loss: 0.4368, test_loss: 0.7462, test_f1: 0.6901
 epoch: 49, train_loss: 0.4283, test_loss: 0.7704, test_f1: 0.6936
 epoch: 50, train_loss: 0.4442, test_loss: 0.7530, test_f1: 0.6933
 epoch: 51, train_loss: 0.3725, test_loss: 0.7990, test_f1: 0.6610
 epoch: 52, train_loss: 0.3708, test_loss: 0.7862, test_f1: 0.6863
 epoch: 53, train_loss: 0.3461, test_loss: 0.8248, test_f1: 0.6887
 epoch: 54, train_loss: 0.3283, test_loss: 0.9042, test_f1: 0.6813
 epoch: 55, train_loss: 0.3542, test_loss: 0.8563, test_f1: 0.6844
 epoch: 56, train_loss: 0.3133, test_loss: 0.9442, test_f1: 0.6581
 epoch: 57, train_loss: 0.3250, test_loss: 0.8814, test_f1: 0.6809
 epoch: 58, train_loss: 0.3351, test_loss: 0.8482, test_f1: 0.6616
 epoch: 59, train_loss: 0.3033, test_loss: 0.9278, test_f1: 0.6789
 epoch: 60, train_loss: 0.3138, test_loss: 0.9321, test_f1: 0.6760
 epoch: 61, train_loss: 0.3113, test_loss: 0.9656, test_f1: 0.6720
 epoch: 62, train_loss: 0.2760, test_loss: 1.0570, test_f1: 0.6701
 epoch: 63, train_loss: 0.2883, test_loss: 0.9506, test_f1: 0.6788
 epoch: 64, train_loss: 0.3097, test_loss: 1.0010, test_f1: 0.6642
 epoch: 65, train_loss: 0.3027, test_loss: 0.9301, test_f1: 0.6835
 epoch: 66, train_loss: 0.2762, test_loss: 0.9294, test_f1: 0.6917
 epoch: 67, train_loss: 0.2709, test_loss: 1.0866, test_f1: 0.6651
 epoch: 68, train_loss: 0.3048, test_loss: 1.0238, test_f1: 0.6723
 epoch: 69, train_loss: 0.2584, test_loss: 1.0858, test_f1: 0.6678
 epoch: 70, train_loss: 0.2716, test_loss: 0.9666, test_f1: 0.7061
 epoch: 71, train_loss: 0.2783, test_loss: 1.0420, test_f1: 0.6824
 epoch: 72, train_loss: 0.2741, test_loss: 1.1318, test_f1: 0.6691
 epoch: 73, train_loss: 0.2991, test_loss: 1.0622, test_f1: 0.6822
 epoch: 74, train_loss: 0.2768, test_loss: 0.9874, test_f1: 0.6726
 epoch: 75, train_loss: 0.2710, test_loss: 1.0085, test_f1: 0.6749
 epoch: 76, train_loss: 0.2408, test_loss: 1.1597, test_f1: 0.6810
 epoch: 77, train_loss: 0.2325, test_loss: 1.1835, test_f1: 0.6630
 epoch: 78, train_loss: 0.2465, test_loss: 1.1033, test_f1: 0.6784
 epoch: 79, train_loss: 0.2510, test_loss: 1.1089, test_f1: 0.6686
 epoch: 80, train_loss: 0.2176, test_loss: 1.1787, test_f1: 0.6842
 epoch: 81, train_loss: 0.2113, test_loss: 1.1780, test_f1: 0.6679
 epoch: 82, train_loss: 0.2245, test_loss: 1.1489, test_f1: 0.6798
 epoch: 83, train_loss: 0.2204, test_loss: 1.2561, test_f1: 0.6890
 epoch: 84, train_loss: 0.2238, test_loss: 1.2863, test_f1: 0.6558
 epoch: 85, train_loss: 0.2522, test_loss: 1.1566, test_f1: 0.6811
 epoch: 86, train_loss: 0.2452, test_loss: 1.1051, test_f1: 0.6813
 epoch: 87, train_loss: 0.2258, test_loss: 1.0988, test_f1: 0.6738
 epoch: 88, train_loss: 0.2137, test_loss: 1.1369, test_f1: 0.6876
 epoch: 89, train_loss: 0.2113, test_loss: 1.2717, test_f1: 0.6689
 epoch: 90, train_loss: 0.2126, test_loss: 1.2464, test_f1: 0.6849
 epoch: 91, train_loss: 0.2172, test_loss: 1.3230, test_f1: 0.6667
 epoch: 92, train_loss: 0.2127, test_loss: 1.2640, test_f1: 0.6769
 epoch: 93, train_loss: 0.1887, test_loss: 1.4147, test_f1: 0.6515
 epoch: 94, train_loss: 0.1961, test_loss: 1.4145, test_f1: 0.6751
 epoch: 95, train_loss: 0.2151, test_loss: 1.3009, test_f1: 0.6639
 epoch: 96, train_loss: 0.2024, test_loss: 1.2823, test_f1: 0.6776
 epoch: 97, train_loss: 0.2023, test_loss: 1.3323, test_f1: 0.6637
 epoch: 98, train_loss: 0.1979, test_loss: 1.4363, test_f1: 0.6690
 epoch: 99, train_loss: 0.2423, test_loss: 1.3047, test_f1: 0.6619
##################ITERATION #9 ****************************************
 epoch: 0, train_loss: 1.2013, test_loss: 1.0596, test_f1: 0.4930
 epoch: 1, train_loss: 0.9745, test_loss: 0.9527, test_f1: 0.5128
 epoch: 2, train_loss: 0.9449, test_loss: 0.9790, test_f1: 0.4995
 epoch: 3, train_loss: 0.9204, test_loss: 0.8711, test_f1: 0.5476
 epoch: 4, train_loss: 0.8957, test_loss: 0.8836, test_f1: 0.5519
 epoch: 5, train_loss: 0.8609, test_loss: 0.8617, test_f1: 0.5832
 epoch: 6, train_loss: 0.8373, test_loss: 0.8217, test_f1: 0.5651
 epoch: 7, train_loss: 0.8147, test_loss: 0.7928, test_f1: 0.6164
 epoch: 8, train_loss: 0.7867, test_loss: 0.7846, test_f1: 0.6506
 epoch: 9, train_loss: 0.7587, test_loss: 0.7892, test_f1: 0.5938
 epoch: 10, train_loss: 0.7588, test_loss: 0.7439, test_f1: 0.6386
 epoch: 11, train_loss: 0.7454, test_loss: 0.7335, test_f1: 0.6457
 epoch: 12, train_loss: 0.7239, test_loss: 0.7144, test_f1: 0.6083
 epoch: 13, train_loss: 0.7044, test_loss: 0.7505, test_f1: 0.6400
 epoch: 14, train_loss: 0.7012, test_loss: 0.6950, test_f1: 0.6768
 epoch: 15, train_loss: 0.6812, test_loss: 0.6823, test_f1: 0.6640
 epoch: 16, train_loss: 0.6631, test_loss: 0.7038, test_f1: 0.6795
 epoch: 17, train_loss: 0.6597, test_loss: 0.6625, test_f1: 0.6729
 epoch: 18, train_loss: 0.6514, test_loss: 0.7484, test_f1: 0.6453
 epoch: 19, train_loss: 0.6307, test_loss: 0.6610, test_f1: 0.7136
 epoch: 20, train_loss: 0.6242, test_loss: 0.7216, test_f1: 0.6662
 epoch: 21, train_loss: 0.6336, test_loss: 0.7013, test_f1: 0.6876
 epoch: 22, train_loss: 0.6048, test_loss: 0.7231, test_f1: 0.6672
 epoch: 23, train_loss: 0.6171, test_loss: 0.6795, test_f1: 0.6944
 epoch: 24, train_loss: 0.5700, test_loss: 0.6701, test_f1: 0.7102
 epoch: 25, train_loss: 0.5875, test_loss: 0.6546, test_f1: 0.6861
 epoch: 26, train_loss: 0.5759, test_loss: 0.6399, test_f1: 0.6830
 epoch: 27, train_loss: 0.5754, test_loss: 0.6686, test_f1: 0.6745
 epoch: 28, train_loss: 0.5377, test_loss: 0.6760, test_f1: 0.6826
 epoch: 29, train_loss: 0.5502, test_loss: 0.7088, test_f1: 0.6590
 epoch: 30, train_loss: 0.5273, test_loss: 0.6730, test_f1: 0.7137
 epoch: 31, train_loss: 0.5230, test_loss: 0.6670, test_f1: 0.7181
 epoch: 32, train_loss: 0.5254, test_loss: 0.6702, test_f1: 0.6654
 epoch: 33, train_loss: 0.5454, test_loss: 0.6810, test_f1: 0.6775
 epoch: 34, train_loss: 0.5130, test_loss: 0.7491, test_f1: 0.6794
 epoch: 35, train_loss: 0.4843, test_loss: 0.6961, test_f1: 0.7000
 epoch: 36, train_loss: 0.4945, test_loss: 0.6987, test_f1: 0.6840
 epoch: 37, train_loss: 0.4849, test_loss: 0.6412, test_f1: 0.6979
 epoch: 38, train_loss: 0.4822, test_loss: 0.6874, test_f1: 0.7068
 epoch: 39, train_loss: 0.4600, test_loss: 0.7752, test_f1: 0.6657
 epoch: 40, train_loss: 0.4686, test_loss: 0.7141, test_f1: 0.6881
 epoch: 41, train_loss: 0.4493, test_loss: 0.8008, test_f1: 0.6753
 epoch: 42, train_loss: 0.4775, test_loss: 0.7610, test_f1: 0.6975
 epoch: 43, train_loss: 0.4596, test_loss: 0.7946, test_f1: 0.6772
 epoch: 44, train_loss: 0.4168, test_loss: 0.8543, test_f1: 0.6911
 epoch: 45, train_loss: 0.4398, test_loss: 0.8353, test_f1: 0.6753
 epoch: 46, train_loss: 0.4193, test_loss: 0.7262, test_f1: 0.6991
 epoch: 47, train_loss: 0.4270, test_loss: 0.7437, test_f1: 0.7200
 epoch: 48, train_loss: 0.4462, test_loss: 0.8400, test_f1: 0.6972
 epoch: 49, train_loss: 0.4424, test_loss: 0.8581, test_f1: 0.6510
 epoch: 50, train_loss: 0.4439, test_loss: 0.8026, test_f1: 0.6655
 epoch: 51, train_loss: 0.3672, test_loss: 0.8522, test_f1: 0.6801
 epoch: 52, train_loss: 0.3462, test_loss: 0.9497, test_f1: 0.6793
 epoch: 53, train_loss: 0.3328, test_loss: 0.8991, test_f1: 0.6933
 epoch: 54, train_loss: 0.3271, test_loss: 0.9775, test_f1: 0.6821
 epoch: 55, train_loss: 0.3172, test_loss: 0.9963, test_f1: 0.6907
 epoch: 56, train_loss: 0.3115, test_loss: 1.0390, test_f1: 0.6808
 epoch: 57, train_loss: 0.3143, test_loss: 1.0678, test_f1: 0.6776
 epoch: 58, train_loss: 0.3159, test_loss: 1.0281, test_f1: 0.6623
 epoch: 59, train_loss: 0.3027, test_loss: 1.0842, test_f1: 0.6587
 epoch: 60, train_loss: 0.2854, test_loss: 1.0912, test_f1: 0.6755
 epoch: 61, train_loss: 0.3055, test_loss: 1.0390, test_f1: 0.6883
 epoch: 62, train_loss: 0.2780, test_loss: 1.0696, test_f1: 0.6762
 epoch: 63, train_loss: 0.2825, test_loss: 1.1466, test_f1: 0.6704
 epoch: 64, train_loss: 0.2865, test_loss: 1.1079, test_f1: 0.6774
 epoch: 65, train_loss: 0.2714, test_loss: 1.2742, test_f1: 0.6780
 epoch: 66, train_loss: 0.2624, test_loss: 1.1421, test_f1: 0.6887
 epoch: 67, train_loss: 0.2569, test_loss: 1.1567, test_f1: 0.6652
 epoch: 68, train_loss: 0.2607, test_loss: 1.1662, test_f1: 0.6724
 epoch: 69, train_loss: 0.2643, test_loss: 1.1670, test_f1: 0.6689
 epoch: 70, train_loss: 0.2703, test_loss: 1.2717, test_f1: 0.6738
 epoch: 71, train_loss: 0.2439, test_loss: 1.2332, test_f1: 0.6688
 epoch: 72, train_loss: 0.2418, test_loss: 1.3114, test_f1: 0.6658
 epoch: 73, train_loss: 0.2504, test_loss: 1.2302, test_f1: 0.6886
 epoch: 74, train_loss: 0.2561, test_loss: 1.2383, test_f1: 0.6815
 epoch: 75, train_loss: 0.2717, test_loss: 1.2875, test_f1: 0.6800
 epoch: 76, train_loss: 0.2423, test_loss: 1.3082, test_f1: 0.6864
 epoch: 77, train_loss: 0.2455, test_loss: 1.2135, test_f1: 0.6777
 epoch: 78, train_loss: 0.2527, test_loss: 1.2844, test_f1: 0.6734
 epoch: 79, train_loss: 0.2323, test_loss: 1.2721, test_f1: 0.6831
 epoch: 80, train_loss: 0.2519, test_loss: 1.2250, test_f1: 0.6868
 epoch: 81, train_loss: 0.2294, test_loss: 1.3665, test_f1: 0.6727
 epoch: 82, train_loss: 0.2297, test_loss: 1.1849, test_f1: 0.6751
 epoch: 83, train_loss: 0.2271, test_loss: 1.2893, test_f1: 0.6854
 epoch: 84, train_loss: 0.2243, test_loss: 1.3445, test_f1: 0.6669
 epoch: 85, train_loss: 0.2466, test_loss: 1.4219, test_f1: 0.6482
 epoch: 86, train_loss: 0.2157, test_loss: 1.3611, test_f1: 0.6694
 epoch: 87, train_loss: 0.2043, test_loss: 1.4204, test_f1: 0.6833
 epoch: 88, train_loss: 0.2016, test_loss: 1.4350, test_f1: 0.6748
 epoch: 89, train_loss: 0.1891, test_loss: 1.5305, test_f1: 0.6697
 epoch: 90, train_loss: 0.2070, test_loss: 1.4529, test_f1: 0.6952
 epoch: 91, train_loss: 0.2084, test_loss: 1.4093, test_f1: 0.6612
 epoch: 92, train_loss: 0.2069, test_loss: 1.4474, test_f1: 0.6723
 epoch: 93, train_loss: 0.1985, test_loss: 1.5139, test_f1: 0.6697
 epoch: 94, train_loss: 0.2073, test_loss: 1.4189, test_f1: 0.6691
 epoch: 95, train_loss: 0.2056, test_loss: 1.4299, test_f1: 0.6640
 epoch: 96, train_loss: 0.2070, test_loss: 1.3274, test_f1: 0.6632
 epoch: 97, train_loss: 0.2073, test_loss: 1.3061, test_f1: 0.6614
 epoch: 98, train_loss: 0.1923, test_loss: 1.5836, test_f1: 0.6592
 epoch: 99, train_loss: 0.1893, test_loss: 1.4240, test_f1: 0.6646

Training completed in 2692.82 seconds
Best F1: 0.7314 at epoch 57
Mean F1 across iterations: 0.7146  0.0123
========================FINAL RESULTS================================
FEGIN weighted F1: 0.7314  0.0123
python main.py --data ltspice_examples --representation component_pin_net --model FEGIN --layers 6 --hiddens 128 --batch_size 32 --lr 0.001 --emb_size 128 --epochs 100 --save_appendix component_pin_net_L6_H128_BS32_LR0.001_E128 --no_val
-----



STDERR:
  File "main.py", line 370, in <module>
    main()
  File "main.py", line 254, in main
    dataset = dataset_class(
  File "/home/philip/projects/llm_inference_code_repo/Circuit-Completion-Using-GNNs/component_classification_with_link_prediction_head/evaluation/FEGIN/kernel/circuit_datasets.py", line 15, in __init__
    self.data, self.slices = torch.load(self.processed_paths[0])
  File "/home/philip/.local/lib/python3.8/site-packages/torch/serialization.py", line 1040, in load
    warnings.warn(
  File "/usr/lib/python3.8/warnings.py", line 109, in _showwarnmsg
    sw(msg.message, msg.category, msg.filename, msg.lineno,
  File "main.py", line 47, in warn_with_traceback
    traceback.print_stack(file=log)
/home/philip/projects/llm_inference_code_repo/Circuit-Completion-Using-GNNs/component_classification_with_link_prediction_head/evaluation/FEGIN/kernel/circuit_datasets.py:15: FutureWarning: You are using `torch.load` with `weights_only=False` (the current default value), which uses the default pickle module implicitly. It is possible to construct malicious pickle data which will execute arbitrary code during unpickling (See https://github.com/pytorch/pytorch/blob/main/SECURITY.md#untrusted-models for more details). In a future release, the default value for `weights_only` will be flipped to `True`. This limits the functions that could be executed during unpickling. Arbitrary objects will no longer be allowed to be loaded via this mode unless they are explicitly allowlisted by the user via `torch.serialization.add_safe_globals`. We recommend you start setting `weights_only=True` for any use case where you don't have full control of the loaded file. Please open an issue on GitHub for any issues related to this experimental feature.
  self.data, self.slices = torch.load(self.processed_paths[0])
