STDOUT:
Results will be saved in /home/philip/projects/llm_inference_code_repo/Circuit-Completion-Using-GNNs/component_classification_with_link_prediction_head/evaluation/FEGIN/results/model_FEGIN_dataset_ltspice_examples
Command line input: python main.py --data ltspice_examples --representation component_net --model FEGIN --layers 4 --hiddens 64 --batch_size 256 --lr 0.0001 --emb_size 250 --epochs 100 --save_appendix component_net_L4_H64_BS256_LR0.0001_E250 --no_val
 is saved.
-----
ltspice_examples - FEGIN
Using 4 layers, 64 hidden units, h = 2
Loading component_net representation dataset
ENTERED
Training FEGIN on component_net representation
Train: 3558, Test: 846
##################ITERATION #0 ****************************************
 epoch: 0, train_loss: 1.3695, test_loss: 1.3733, test_f1: 0.2270
 epoch: 1, train_loss: 1.3609, test_loss: 1.3683, test_f1: 0.2270
 epoch: 2, train_loss: 1.3549, test_loss: 1.3636, test_f1: 0.2270
 epoch: 3, train_loss: 1.3488, test_loss: 1.3564, test_f1: 0.2270
 epoch: 4, train_loss: 1.3417, test_loss: 1.3453, test_f1: 0.2270
 epoch: 5, train_loss: 1.3339, test_loss: 1.3341, test_f1: 0.2270
 epoch: 6, train_loss: 1.3257, test_loss: 1.3240, test_f1: 0.2270
 epoch: 7, train_loss: 1.3168, test_loss: 1.3139, test_f1: 0.2270
 epoch: 8, train_loss: 1.3079, test_loss: 1.3039, test_f1: 0.2270
 epoch: 9, train_loss: 1.2980, test_loss: 1.2935, test_f1: 0.2270
 epoch: 10, train_loss: 1.2878, test_loss: 1.2837, test_f1: 0.2270
 epoch: 11, train_loss: 1.2768, test_loss: 1.2730, test_f1: 0.2270
 epoch: 12, train_loss: 1.2687, test_loss: 1.2622, test_f1: 0.2270
 epoch: 13, train_loss: 1.2590, test_loss: 1.2521, test_f1: 0.2270
 epoch: 14, train_loss: 1.2505, test_loss: 1.2413, test_f1: 0.2270
 epoch: 15, train_loss: 1.2380, test_loss: 1.2321, test_f1: 0.2270
 epoch: 16, train_loss: 1.2332, test_loss: 1.2238, test_f1: 0.2270
 epoch: 17, train_loss: 1.2257, test_loss: 1.2125, test_f1: 0.2270
 epoch: 18, train_loss: 1.2150, test_loss: 1.2068, test_f1: 0.2270
 epoch: 19, train_loss: 1.2098, test_loss: 1.1962, test_f1: 0.2270
 epoch: 20, train_loss: 1.2041, test_loss: 1.1904, test_f1: 0.2320
 epoch: 21, train_loss: 1.1961, test_loss: 1.1798, test_f1: 0.2617
 epoch: 22, train_loss: 1.1866, test_loss: 1.1709, test_f1: 0.3018
 epoch: 23, train_loss: 1.1771, test_loss: 1.1644, test_f1: 0.3141
 epoch: 24, train_loss: 1.1695, test_loss: 1.1550, test_f1: 0.3309
 epoch: 25, train_loss: 1.1610, test_loss: 1.1481, test_f1: 0.3379
 epoch: 26, train_loss: 1.1525, test_loss: 1.1397, test_f1: 0.3529
 epoch: 27, train_loss: 1.1428, test_loss: 1.1292, test_f1: 0.3597
 epoch: 28, train_loss: 1.1377, test_loss: 1.1235, test_f1: 0.3968
 epoch: 29, train_loss: 1.1253, test_loss: 1.1105, test_f1: 0.4057
 epoch: 30, train_loss: 1.1105, test_loss: 1.1052, test_f1: 0.4222
 epoch: 31, train_loss: 1.1104, test_loss: 1.0914, test_f1: 0.4324
 epoch: 32, train_loss: 1.1002, test_loss: 1.0867, test_f1: 0.4418
 epoch: 33, train_loss: 1.0836, test_loss: 1.0724, test_f1: 0.4578
 epoch: 34, train_loss: 1.0703, test_loss: 1.0692, test_f1: 0.4792
 epoch: 35, train_loss: 1.0636, test_loss: 1.0470, test_f1: 0.4757
 epoch: 36, train_loss: 1.0500, test_loss: 1.0414, test_f1: 0.4904
 epoch: 37, train_loss: 1.0385, test_loss: 1.0317, test_f1: 0.4967
 epoch: 38, train_loss: 1.0279, test_loss: 1.0202, test_f1: 0.4995
 epoch: 39, train_loss: 1.0195, test_loss: 1.0020, test_f1: 0.5122
 epoch: 40, train_loss: 1.0024, test_loss: 1.0011, test_f1: 0.5158
 epoch: 41, train_loss: 0.9902, test_loss: 0.9768, test_f1: 0.5348
 epoch: 42, train_loss: 0.9872, test_loss: 0.9743, test_f1: 0.5323
 epoch: 43, train_loss: 0.9619, test_loss: 0.9659, test_f1: 0.5059
 epoch: 44, train_loss: 0.9565, test_loss: 0.9534, test_f1: 0.5116
 epoch: 45, train_loss: 0.9488, test_loss: 0.9497, test_f1: 0.5246
 epoch: 46, train_loss: 0.9412, test_loss: 0.9425, test_f1: 0.5194
 epoch: 47, train_loss: 0.9404, test_loss: 0.9419, test_f1: 0.5218
 epoch: 48, train_loss: 0.9360, test_loss: 0.9271, test_f1: 0.5378
 epoch: 49, train_loss: 0.9227, test_loss: 0.9389, test_f1: 0.5170
 epoch: 50, train_loss: 0.9037, test_loss: 0.9349, test_f1: 0.5205
 epoch: 51, train_loss: 0.9004, test_loss: 0.9281, test_f1: 0.5212
 epoch: 52, train_loss: 0.8966, test_loss: 0.9212, test_f1: 0.5239
 epoch: 53, train_loss: 0.8975, test_loss: 0.9201, test_f1: 0.5238
 epoch: 54, train_loss: 0.8817, test_loss: 0.9188, test_f1: 0.5275
 epoch: 55, train_loss: 0.8805, test_loss: 0.9203, test_f1: 0.5230
 epoch: 56, train_loss: 0.8776, test_loss: 0.9202, test_f1: 0.5170
 epoch: 57, train_loss: 0.8747, test_loss: 0.9146, test_f1: 0.5257
 epoch: 58, train_loss: 0.8819, test_loss: 0.9119, test_f1: 0.5262
 epoch: 59, train_loss: 0.8681, test_loss: 0.9159, test_f1: 0.5293
 epoch: 60, train_loss: 0.8706, test_loss: 0.9269, test_f1: 0.5256
 epoch: 61, train_loss: 0.8654, test_loss: 0.9145, test_f1: 0.5295
 epoch: 62, train_loss: 0.8697, test_loss: 0.9119, test_f1: 0.5269
 epoch: 63, train_loss: 0.8614, test_loss: 0.9155, test_f1: 0.5285
 epoch: 64, train_loss: 0.8593, test_loss: 0.9165, test_f1: 0.5294
 epoch: 65, train_loss: 0.8640, test_loss: 0.9087, test_f1: 0.5228
 epoch: 66, train_loss: 0.8604, test_loss: 0.9132, test_f1: 0.5192
 epoch: 67, train_loss: 0.8544, test_loss: 0.9155, test_f1: 0.5153
 epoch: 68, train_loss: 0.8445, test_loss: 0.9150, test_f1: 0.5241
 epoch: 69, train_loss: 0.8531, test_loss: 0.9136, test_f1: 0.5215
 epoch: 70, train_loss: 0.8462, test_loss: 0.9108, test_f1: 0.5269
 epoch: 71, train_loss: 0.8384, test_loss: 0.9143, test_f1: 0.5247
 epoch: 72, train_loss: 0.8410, test_loss: 0.9164, test_f1: 0.5207
 epoch: 73, train_loss: 0.8406, test_loss: 0.9175, test_f1: 0.5159
 epoch: 74, train_loss: 0.8395, test_loss: 0.9114, test_f1: 0.5225
 epoch: 75, train_loss: 0.8398, test_loss: 0.9124, test_f1: 0.5216
 epoch: 76, train_loss: 0.8369, test_loss: 0.9195, test_f1: 0.5283
 epoch: 77, train_loss: 0.8323, test_loss: 0.9122, test_f1: 0.5150
 epoch: 78, train_loss: 0.8262, test_loss: 0.9247, test_f1: 0.5227
 epoch: 79, train_loss: 0.8433, test_loss: 0.9234, test_f1: 0.5211
 epoch: 80, train_loss: 0.8252, test_loss: 0.9275, test_f1: 0.5258
 epoch: 81, train_loss: 0.8341, test_loss: 0.9289, test_f1: 0.5297
 epoch: 82, train_loss: 0.8255, test_loss: 0.9192, test_f1: 0.5222
 epoch: 83, train_loss: 0.8210, test_loss: 0.9194, test_f1: 0.5303
 epoch: 84, train_loss: 0.8249, test_loss: 0.9207, test_f1: 0.5258
 epoch: 85, train_loss: 0.8234, test_loss: 0.9169, test_f1: 0.5268
 epoch: 86, train_loss: 0.8197, test_loss: 0.9122, test_f1: 0.5255
 epoch: 87, train_loss: 0.8229, test_loss: 0.9249, test_f1: 0.5362
 epoch: 88, train_loss: 0.8271, test_loss: 0.9275, test_f1: 0.5267
 epoch: 89, train_loss: 0.8190, test_loss: 0.9098, test_f1: 0.5286
 epoch: 90, train_loss: 0.8190, test_loss: 0.9198, test_f1: 0.5253
 epoch: 91, train_loss: 0.8076, test_loss: 0.9172, test_f1: 0.5264
 epoch: 92, train_loss: 0.8148, test_loss: 0.9172, test_f1: 0.5280
 epoch: 93, train_loss: 0.8127, test_loss: 0.9202, test_f1: 0.5270
 epoch: 94, train_loss: 0.8053, test_loss: 0.9247, test_f1: 0.5242
 epoch: 95, train_loss: 0.8093, test_loss: 0.9246, test_f1: 0.5287
 epoch: 96, train_loss: 0.8066, test_loss: 0.9141, test_f1: 0.5322
 epoch: 97, train_loss: 0.8057, test_loss: 0.9169, test_f1: 0.5312
 epoch: 98, train_loss: 0.8007, test_loss: 0.9311, test_f1: 0.5256
 epoch: 99, train_loss: 0.7979, test_loss: 0.9244, test_f1: 0.5322
##################ITERATION #1 ****************************************
 epoch: 0, train_loss: 1.3338, test_loss: 1.3605, test_f1: 0.2270
 epoch: 1, train_loss: 1.3074, test_loss: 1.3502, test_f1: 0.2270
 epoch: 2, train_loss: 1.2913, test_loss: 1.3295, test_f1: 0.2270
 epoch: 3, train_loss: 1.2763, test_loss: 1.3015, test_f1: 0.2270
 epoch: 4, train_loss: 1.2649, test_loss: 1.2776, test_f1: 0.2270
 epoch: 5, train_loss: 1.2515, test_loss: 1.2562, test_f1: 0.2270
 epoch: 6, train_loss: 1.2371, test_loss: 1.2332, test_f1: 0.2631
 epoch: 7, train_loss: 1.2236, test_loss: 1.2118, test_f1: 0.2870
 epoch: 8, train_loss: 1.2102, test_loss: 1.1937, test_f1: 0.2932
 epoch: 9, train_loss: 1.1966, test_loss: 1.1765, test_f1: 0.3163
 epoch: 10, train_loss: 1.1839, test_loss: 1.1584, test_f1: 0.3309
 epoch: 11, train_loss: 1.1705, test_loss: 1.1418, test_f1: 0.3591
 epoch: 12, train_loss: 1.1518, test_loss: 1.1253, test_f1: 0.4084
 epoch: 13, train_loss: 1.1366, test_loss: 1.1050, test_f1: 0.4260
 epoch: 14, train_loss: 1.1238, test_loss: 1.0868, test_f1: 0.4536
 epoch: 15, train_loss: 1.1016, test_loss: 1.0726, test_f1: 0.4709
 epoch: 16, train_loss: 1.0912, test_loss: 1.0553, test_f1: 0.4611
 epoch: 17, train_loss: 1.0707, test_loss: 1.0429, test_f1: 0.4669
 epoch: 18, train_loss: 1.0596, test_loss: 1.0297, test_f1: 0.4689
 epoch: 19, train_loss: 1.0448, test_loss: 1.0175, test_f1: 0.4737
 epoch: 20, train_loss: 1.0308, test_loss: 1.0077, test_f1: 0.4769
 epoch: 21, train_loss: 1.0169, test_loss: 0.9923, test_f1: 0.4817
 epoch: 22, train_loss: 1.0041, test_loss: 0.9848, test_f1: 0.4928
 epoch: 23, train_loss: 0.9932, test_loss: 0.9764, test_f1: 0.4983
 epoch: 24, train_loss: 0.9857, test_loss: 0.9659, test_f1: 0.4950
 epoch: 25, train_loss: 0.9755, test_loss: 0.9600, test_f1: 0.5032
 epoch: 26, train_loss: 0.9657, test_loss: 0.9503, test_f1: 0.5193
 epoch: 27, train_loss: 0.9537, test_loss: 0.9452, test_f1: 0.5080
 epoch: 28, train_loss: 0.9442, test_loss: 0.9392, test_f1: 0.5122
 epoch: 29, train_loss: 0.9363, test_loss: 0.9350, test_f1: 0.5224
 epoch: 30, train_loss: 0.9251, test_loss: 0.9275, test_f1: 0.5245
 epoch: 31, train_loss: 0.9210, test_loss: 0.9311, test_f1: 0.5240
 epoch: 32, train_loss: 0.9159, test_loss: 0.9271, test_f1: 0.5278
 epoch: 33, train_loss: 0.9076, test_loss: 0.9283, test_f1: 0.5158
 epoch: 34, train_loss: 0.8948, test_loss: 0.9209, test_f1: 0.5329
 epoch: 35, train_loss: 0.8865, test_loss: 0.9270, test_f1: 0.5079
 epoch: 36, train_loss: 0.8794, test_loss: 0.9188, test_f1: 0.5236
 epoch: 37, train_loss: 0.8788, test_loss: 0.9194, test_f1: 0.5345
 epoch: 38, train_loss: 0.8753, test_loss: 0.9232, test_f1: 0.5337
 epoch: 39, train_loss: 0.8701, test_loss: 0.9330, test_f1: 0.5076
 epoch: 40, train_loss: 0.8759, test_loss: 0.9197, test_f1: 0.5300
 epoch: 41, train_loss: 0.8715, test_loss: 0.9177, test_f1: 0.5228
 epoch: 42, train_loss: 0.8643, test_loss: 0.9189, test_f1: 0.5336
 epoch: 43, train_loss: 0.8613, test_loss: 0.9226, test_f1: 0.5368
 epoch: 44, train_loss: 0.8567, test_loss: 0.9210, test_f1: 0.5405
 epoch: 45, train_loss: 0.8503, test_loss: 0.9166, test_f1: 0.5233
 epoch: 46, train_loss: 0.8391, test_loss: 0.9185, test_f1: 0.5247
 epoch: 47, train_loss: 0.8371, test_loss: 0.9197, test_f1: 0.5406
 epoch: 48, train_loss: 0.8388, test_loss: 0.9206, test_f1: 0.5406
 epoch: 49, train_loss: 0.8340, test_loss: 0.9323, test_f1: 0.5361
 epoch: 50, train_loss: 0.8379, test_loss: 0.9259, test_f1: 0.5419
 epoch: 51, train_loss: 0.8244, test_loss: 0.9137, test_f1: 0.5439
 epoch: 52, train_loss: 0.8234, test_loss: 0.9192, test_f1: 0.5518
 epoch: 53, train_loss: 0.8252, test_loss: 0.9211, test_f1: 0.5493
 epoch: 54, train_loss: 0.8266, test_loss: 0.9092, test_f1: 0.5451
 epoch: 55, train_loss: 0.8222, test_loss: 0.9186, test_f1: 0.5477
 epoch: 56, train_loss: 0.8124, test_loss: 0.9135, test_f1: 0.5479
 epoch: 57, train_loss: 0.8179, test_loss: 0.9223, test_f1: 0.5432
 epoch: 58, train_loss: 0.8229, test_loss: 0.9145, test_f1: 0.5446
 epoch: 59, train_loss: 0.8107, test_loss: 0.9141, test_f1: 0.5429
 epoch: 60, train_loss: 0.8190, test_loss: 0.9235, test_f1: 0.5367
 epoch: 61, train_loss: 0.8101, test_loss: 0.9162, test_f1: 0.5481
 epoch: 62, train_loss: 0.8088, test_loss: 0.9172, test_f1: 0.5450
 epoch: 63, train_loss: 0.8049, test_loss: 0.9198, test_f1: 0.5336
 epoch: 64, train_loss: 0.8112, test_loss: 0.9201, test_f1: 0.5453
 epoch: 65, train_loss: 0.8098, test_loss: 0.9176, test_f1: 0.5441
 epoch: 66, train_loss: 0.8015, test_loss: 0.9254, test_f1: 0.5387
 epoch: 67, train_loss: 0.8007, test_loss: 0.9130, test_f1: 0.5330
 epoch: 68, train_loss: 0.7983, test_loss: 0.9215, test_f1: 0.5412
 epoch: 69, train_loss: 0.7995, test_loss: 0.9262, test_f1: 0.5413
 epoch: 70, train_loss: 0.8002, test_loss: 0.9156, test_f1: 0.5397
 epoch: 71, train_loss: 0.7998, test_loss: 0.9259, test_f1: 0.5450
 epoch: 72, train_loss: 0.7897, test_loss: 0.9266, test_f1: 0.5470
 epoch: 73, train_loss: 0.7917, test_loss: 0.9210, test_f1: 0.5436
 epoch: 74, train_loss: 0.7953, test_loss: 0.9272, test_f1: 0.5397
 epoch: 75, train_loss: 0.7939, test_loss: 0.9246, test_f1: 0.5431
 epoch: 76, train_loss: 0.7920, test_loss: 0.9150, test_f1: 0.5445
 epoch: 77, train_loss: 0.7865, test_loss: 0.9216, test_f1: 0.5382
 epoch: 78, train_loss: 0.7811, test_loss: 0.9179, test_f1: 0.5457
 epoch: 79, train_loss: 0.7916, test_loss: 0.9254, test_f1: 0.5428
 epoch: 80, train_loss: 0.7855, test_loss: 0.9211, test_f1: 0.5468
 epoch: 81, train_loss: 0.7767, test_loss: 0.9245, test_f1: 0.5378
 epoch: 82, train_loss: 0.7855, test_loss: 0.9213, test_f1: 0.5468
 epoch: 83, train_loss: 0.7754, test_loss: 0.9315, test_f1: 0.5427
 epoch: 84, train_loss: 0.7800, test_loss: 0.9269, test_f1: 0.5476
 epoch: 85, train_loss: 0.7766, test_loss: 0.9202, test_f1: 0.5504
 epoch: 86, train_loss: 0.7754, test_loss: 0.9345, test_f1: 0.5448
 epoch: 87, train_loss: 0.7703, test_loss: 0.9187, test_f1: 0.5522
 epoch: 88, train_loss: 0.7830, test_loss: 0.9284, test_f1: 0.5487
 epoch: 89, train_loss: 0.7736, test_loss: 0.9274, test_f1: 0.5372
 epoch: 90, train_loss: 0.7764, test_loss: 0.9253, test_f1: 0.5474
 epoch: 91, train_loss: 0.7728, test_loss: 0.9183, test_f1: 0.5506
 epoch: 92, train_loss: 0.7692, test_loss: 0.9226, test_f1: 0.5499
 epoch: 93, train_loss: 0.7647, test_loss: 0.9312, test_f1: 0.5537
 epoch: 94, train_loss: 0.7755, test_loss: 0.9289, test_f1: 0.5458
 epoch: 95, train_loss: 0.7725, test_loss: 0.9316, test_f1: 0.5451
 epoch: 96, train_loss: 0.7705, test_loss: 0.9185, test_f1: 0.5532
 epoch: 97, train_loss: 0.7623, test_loss: 0.9311, test_f1: 0.5505
 epoch: 98, train_loss: 0.7615, test_loss: 0.9252, test_f1: 0.5534
 epoch: 99, train_loss: 0.7612, test_loss: 0.9196, test_f1: 0.5499
##################ITERATION #2 ****************************************
 epoch: 0, train_loss: 1.3283, test_loss: 1.3495, test_f1: 0.2270
 epoch: 1, train_loss: 1.2947, test_loss: 1.3360, test_f1: 0.2270
 epoch: 2, train_loss: 1.2772, test_loss: 1.3168, test_f1: 0.2270
 epoch: 3, train_loss: 1.2621, test_loss: 1.2792, test_f1: 0.2765
 epoch: 4, train_loss: 1.2475, test_loss: 1.2450, test_f1: 0.2969
 epoch: 5, train_loss: 1.2321, test_loss: 1.2185, test_f1: 0.3367
 epoch: 6, train_loss: 1.2115, test_loss: 1.1967, test_f1: 0.3836
 epoch: 7, train_loss: 1.1969, test_loss: 1.1728, test_f1: 0.4048
 epoch: 8, train_loss: 1.1783, test_loss: 1.1520, test_f1: 0.4302
 epoch: 9, train_loss: 1.1652, test_loss: 1.1309, test_f1: 0.4370
 epoch: 10, train_loss: 1.1465, test_loss: 1.1108, test_f1: 0.4381
 epoch: 11, train_loss: 1.1243, test_loss: 1.0919, test_f1: 0.4331
 epoch: 12, train_loss: 1.1116, test_loss: 1.0735, test_f1: 0.4491
 epoch: 13, train_loss: 1.0930, test_loss: 1.0550, test_f1: 0.4590
 epoch: 14, train_loss: 1.0705, test_loss: 1.0412, test_f1: 0.4628
 epoch: 15, train_loss: 1.0661, test_loss: 1.0251, test_f1: 0.4812
 epoch: 16, train_loss: 1.0456, test_loss: 1.0112, test_f1: 0.4884
 epoch: 17, train_loss: 1.0339, test_loss: 0.9954, test_f1: 0.4959
 epoch: 18, train_loss: 1.0217, test_loss: 0.9839, test_f1: 0.4949
 epoch: 19, train_loss: 1.0111, test_loss: 0.9718, test_f1: 0.4940
 epoch: 20, train_loss: 1.0008, test_loss: 0.9673, test_f1: 0.4953
 epoch: 21, train_loss: 0.9876, test_loss: 0.9583, test_f1: 0.4999
 epoch: 22, train_loss: 0.9803, test_loss: 0.9501, test_f1: 0.5023
 epoch: 23, train_loss: 0.9647, test_loss: 0.9399, test_f1: 0.4949
 epoch: 24, train_loss: 0.9601, test_loss: 0.9431, test_f1: 0.4974
 epoch: 25, train_loss: 0.9554, test_loss: 0.9360, test_f1: 0.5037
 epoch: 26, train_loss: 0.9449, test_loss: 0.9502, test_f1: 0.5021
 epoch: 27, train_loss: 0.9431, test_loss: 0.9258, test_f1: 0.5157
 epoch: 28, train_loss: 0.9388, test_loss: 0.9210, test_f1: 0.5203
 epoch: 29, train_loss: 0.9287, test_loss: 0.9148, test_f1: 0.5258
 epoch: 30, train_loss: 0.9189, test_loss: 0.9156, test_f1: 0.5252
 epoch: 31, train_loss: 0.9147, test_loss: 0.9158, test_f1: 0.5242
 epoch: 32, train_loss: 0.9017, test_loss: 0.9220, test_f1: 0.5152
 epoch: 33, train_loss: 0.8969, test_loss: 0.9148, test_f1: 0.5228
 epoch: 34, train_loss: 0.8895, test_loss: 0.9331, test_f1: 0.5158
 epoch: 35, train_loss: 0.8920, test_loss: 0.9155, test_f1: 0.5303
 epoch: 36, train_loss: 0.8816, test_loss: 0.8976, test_f1: 0.5330
 epoch: 37, train_loss: 0.8778, test_loss: 0.9342, test_f1: 0.5078
 epoch: 38, train_loss: 0.8759, test_loss: 0.9146, test_f1: 0.5423
 epoch: 39, train_loss: 0.8722, test_loss: 0.9084, test_f1: 0.5395
 epoch: 40, train_loss: 0.8660, test_loss: 0.8995, test_f1: 0.5367
 epoch: 41, train_loss: 0.8672, test_loss: 0.9118, test_f1: 0.5348
 epoch: 42, train_loss: 0.8526, test_loss: 0.9182, test_f1: 0.5327
 epoch: 43, train_loss: 0.8533, test_loss: 0.8999, test_f1: 0.5389
 epoch: 44, train_loss: 0.8504, test_loss: 0.9108, test_f1: 0.5322
 epoch: 45, train_loss: 0.8443, test_loss: 0.9341, test_f1: 0.5273
 epoch: 46, train_loss: 0.8470, test_loss: 0.9086, test_f1: 0.5392
 epoch: 47, train_loss: 0.8382, test_loss: 0.8973, test_f1: 0.5435
 epoch: 48, train_loss: 0.8383, test_loss: 0.9060, test_f1: 0.5460
 epoch: 49, train_loss: 0.8372, test_loss: 0.9181, test_f1: 0.5300
 epoch: 50, train_loss: 0.8267, test_loss: 0.9005, test_f1: 0.5385
 epoch: 51, train_loss: 0.8225, test_loss: 0.9077, test_f1: 0.5425
 epoch: 52, train_loss: 0.8220, test_loss: 0.9012, test_f1: 0.5362
 epoch: 53, train_loss: 0.8179, test_loss: 0.9013, test_f1: 0.5413
 epoch: 54, train_loss: 0.8150, test_loss: 0.8992, test_f1: 0.5435
 epoch: 55, train_loss: 0.8136, test_loss: 0.8927, test_f1: 0.5426
 epoch: 56, train_loss: 0.8179, test_loss: 0.8939, test_f1: 0.5426
 epoch: 57, train_loss: 0.8126, test_loss: 0.8884, test_f1: 0.5411
 epoch: 58, train_loss: 0.8133, test_loss: 0.8842, test_f1: 0.5457
 epoch: 59, train_loss: 0.8078, test_loss: 0.8870, test_f1: 0.5444
 epoch: 60, train_loss: 0.8070, test_loss: 0.8808, test_f1: 0.5484
 epoch: 61, train_loss: 0.8057, test_loss: 0.8790, test_f1: 0.5453
 epoch: 62, train_loss: 0.8075, test_loss: 0.8836, test_f1: 0.5524
 epoch: 63, train_loss: 0.8021, test_loss: 0.8742, test_f1: 0.5457
 epoch: 64, train_loss: 0.7967, test_loss: 0.8864, test_f1: 0.5440
 epoch: 65, train_loss: 0.8000, test_loss: 0.8897, test_f1: 0.5463
 epoch: 66, train_loss: 0.8030, test_loss: 0.8865, test_f1: 0.5470
 epoch: 67, train_loss: 0.7976, test_loss: 0.8892, test_f1: 0.5495
 epoch: 68, train_loss: 0.7966, test_loss: 0.8799, test_f1: 0.5416
 epoch: 69, train_loss: 0.7936, test_loss: 0.8805, test_f1: 0.5473
 epoch: 70, train_loss: 0.7932, test_loss: 0.8818, test_f1: 0.5532
 epoch: 71, train_loss: 0.7904, test_loss: 0.8867, test_f1: 0.5468
 epoch: 72, train_loss: 0.7801, test_loss: 0.8893, test_f1: 0.5509
 epoch: 73, train_loss: 0.7894, test_loss: 0.8868, test_f1: 0.5492
 epoch: 74, train_loss: 0.7899, test_loss: 0.8887, test_f1: 0.5436
 epoch: 75, train_loss: 0.7800, test_loss: 0.8850, test_f1: 0.5432
 epoch: 76, train_loss: 0.7772, test_loss: 0.8707, test_f1: 0.5460
 epoch: 77, train_loss: 0.7835, test_loss: 0.9013, test_f1: 0.5475
 epoch: 78, train_loss: 0.7748, test_loss: 0.8868, test_f1: 0.5470
 epoch: 79, train_loss: 0.7831, test_loss: 0.8880, test_f1: 0.5490
 epoch: 80, train_loss: 0.7786, test_loss: 0.8704, test_f1: 0.5465
 epoch: 81, train_loss: 0.7872, test_loss: 0.8891, test_f1: 0.5405
 epoch: 82, train_loss: 0.7798, test_loss: 0.8724, test_f1: 0.5454
 epoch: 83, train_loss: 0.7740, test_loss: 0.8900, test_f1: 0.5482
 epoch: 84, train_loss: 0.7782, test_loss: 0.8832, test_f1: 0.5472
 epoch: 85, train_loss: 0.7742, test_loss: 0.8694, test_f1: 0.5500
 epoch: 86, train_loss: 0.7715, test_loss: 0.8845, test_f1: 0.5477
 epoch: 87, train_loss: 0.7622, test_loss: 0.8846, test_f1: 0.5510
 epoch: 88, train_loss: 0.7634, test_loss: 0.8861, test_f1: 0.5493
 epoch: 89, train_loss: 0.7636, test_loss: 0.8982, test_f1: 0.5450
 epoch: 90, train_loss: 0.7696, test_loss: 0.8884, test_f1: 0.5432
 epoch: 91, train_loss: 0.7592, test_loss: 0.8702, test_f1: 0.5500
 epoch: 92, train_loss: 0.7655, test_loss: 0.8890, test_f1: 0.5460
 epoch: 93, train_loss: 0.7607, test_loss: 0.8773, test_f1: 0.5486
 epoch: 94, train_loss: 0.7627, test_loss: 0.8818, test_f1: 0.5427
 epoch: 95, train_loss: 0.7664, test_loss: 0.8745, test_f1: 0.5485
 epoch: 96, train_loss: 0.7522, test_loss: 0.8710, test_f1: 0.5461
 epoch: 97, train_loss: 0.7614, test_loss: 0.8811, test_f1: 0.5509
 epoch: 98, train_loss: 0.7614, test_loss: 0.8741, test_f1: 0.5568
 epoch: 99, train_loss: 0.7472, test_loss: 0.8888, test_f1: 0.5457
##################ITERATION #3 ****************************************
 epoch: 0, train_loss: 1.2920, test_loss: 1.3285, test_f1: 0.2270
 epoch: 1, train_loss: 1.2484, test_loss: 1.3161, test_f1: 0.2270
 epoch: 2, train_loss: 1.2298, test_loss: 1.2838, test_f1: 0.2611
 epoch: 3, train_loss: 1.2078, test_loss: 1.2393, test_f1: 0.2913
 epoch: 4, train_loss: 1.1870, test_loss: 1.1975, test_f1: 0.3628
 epoch: 5, train_loss: 1.1710, test_loss: 1.1536, test_f1: 0.4103
 epoch: 6, train_loss: 1.1503, test_loss: 1.1211, test_f1: 0.4222
 epoch: 7, train_loss: 1.1345, test_loss: 1.0963, test_f1: 0.4334
 epoch: 8, train_loss: 1.1233, test_loss: 1.0797, test_f1: 0.4389
 epoch: 9, train_loss: 1.1007, test_loss: 1.0611, test_f1: 0.4425
 epoch: 10, train_loss: 1.0904, test_loss: 1.0480, test_f1: 0.4406
 epoch: 11, train_loss: 1.0746, test_loss: 1.0330, test_f1: 0.4471
 epoch: 12, train_loss: 1.0674, test_loss: 1.0217, test_f1: 0.4485
 epoch: 13, train_loss: 1.0501, test_loss: 1.0104, test_f1: 0.4500
 epoch: 14, train_loss: 1.0362, test_loss: 0.9984, test_f1: 0.4500
 epoch: 15, train_loss: 1.0335, test_loss: 0.9908, test_f1: 0.4442
 epoch: 16, train_loss: 1.0133, test_loss: 0.9821, test_f1: 0.4528
 epoch: 17, train_loss: 1.0041, test_loss: 0.9738, test_f1: 0.4553
 epoch: 18, train_loss: 0.9930, test_loss: 0.9594, test_f1: 0.4618
 epoch: 19, train_loss: 0.9880, test_loss: 0.9534, test_f1: 0.4683
 epoch: 20, train_loss: 0.9791, test_loss: 0.9528, test_f1: 0.4755
 epoch: 21, train_loss: 0.9656, test_loss: 0.9375, test_f1: 0.4797
 epoch: 22, train_loss: 0.9615, test_loss: 0.9320, test_f1: 0.4852
 epoch: 23, train_loss: 0.9589, test_loss: 0.9383, test_f1: 0.4868
 epoch: 24, train_loss: 0.9467, test_loss: 0.9168, test_f1: 0.4992
 epoch: 25, train_loss: 0.9439, test_loss: 0.9275, test_f1: 0.4884
 epoch: 26, train_loss: 0.9429, test_loss: 0.9138, test_f1: 0.5005
 epoch: 27, train_loss: 0.9294, test_loss: 0.9185, test_f1: 0.4939
 epoch: 28, train_loss: 0.9181, test_loss: 0.9224, test_f1: 0.4971
 epoch: 29, train_loss: 0.9164, test_loss: 0.9102, test_f1: 0.5047
 epoch: 30, train_loss: 0.9079, test_loss: 0.9018, test_f1: 0.5155
 epoch: 31, train_loss: 0.9047, test_loss: 0.9040, test_f1: 0.5132
 epoch: 32, train_loss: 0.9043, test_loss: 0.8942, test_f1: 0.5154
 epoch: 33, train_loss: 0.8966, test_loss: 0.9100, test_f1: 0.5099
 epoch: 34, train_loss: 0.8865, test_loss: 0.8800, test_f1: 0.5198
 epoch: 35, train_loss: 0.8900, test_loss: 0.9051, test_f1: 0.5088
 epoch: 36, train_loss: 0.8802, test_loss: 0.8818, test_f1: 0.5262
 epoch: 37, train_loss: 0.8736, test_loss: 0.8855, test_f1: 0.5232
 epoch: 38, train_loss: 0.8785, test_loss: 0.8903, test_f1: 0.5246
 epoch: 39, train_loss: 0.8674, test_loss: 0.8707, test_f1: 0.5203
 epoch: 40, train_loss: 0.8695, test_loss: 0.8903, test_f1: 0.5492
 epoch: 41, train_loss: 0.8597, test_loss: 0.8959, test_f1: 0.5216
 epoch: 42, train_loss: 0.8594, test_loss: 0.8806, test_f1: 0.5331
 epoch: 43, train_loss: 0.8458, test_loss: 0.8859, test_f1: 0.5236
 epoch: 44, train_loss: 0.8494, test_loss: 0.8761, test_f1: 0.5353
 epoch: 45, train_loss: 0.8432, test_loss: 0.8803, test_f1: 0.5371
 epoch: 46, train_loss: 0.8410, test_loss: 0.8906, test_f1: 0.5212
 epoch: 47, train_loss: 0.8412, test_loss: 0.8881, test_f1: 0.5579
 epoch: 48, train_loss: 0.8371, test_loss: 0.8963, test_f1: 0.5466
 epoch: 49, train_loss: 0.8339, test_loss: 0.8899, test_f1: 0.5303
 epoch: 50, train_loss: 0.8240, test_loss: 0.8729, test_f1: 0.5554
 epoch: 51, train_loss: 0.8231, test_loss: 0.8816, test_f1: 0.5491
 epoch: 52, train_loss: 0.8195, test_loss: 0.8762, test_f1: 0.5497
 epoch: 53, train_loss: 0.8149, test_loss: 0.8817, test_f1: 0.5499
 epoch: 54, train_loss: 0.8237, test_loss: 0.8732, test_f1: 0.5357
 epoch: 55, train_loss: 0.8131, test_loss: 0.8752, test_f1: 0.5528
 epoch: 56, train_loss: 0.8097, test_loss: 0.8750, test_f1: 0.5569
 epoch: 57, train_loss: 0.8046, test_loss: 0.8816, test_f1: 0.5452
 epoch: 58, train_loss: 0.8093, test_loss: 0.8814, test_f1: 0.5362
 epoch: 59, train_loss: 0.8094, test_loss: 0.8818, test_f1: 0.5325
 epoch: 60, train_loss: 0.8059, test_loss: 0.8927, test_f1: 0.5520
 epoch: 61, train_loss: 0.8064, test_loss: 0.8924, test_f1: 0.5514
 epoch: 62, train_loss: 0.7997, test_loss: 0.8741, test_f1: 0.5593
 epoch: 63, train_loss: 0.8016, test_loss: 0.8766, test_f1: 0.5276
 epoch: 64, train_loss: 0.7959, test_loss: 0.8832, test_f1: 0.5425
 epoch: 65, train_loss: 0.8036, test_loss: 0.8898, test_f1: 0.5339
 epoch: 66, train_loss: 0.7998, test_loss: 0.8819, test_f1: 0.5358
 epoch: 67, train_loss: 0.7951, test_loss: 0.8816, test_f1: 0.5611
 epoch: 68, train_loss: 0.7916, test_loss: 0.8779, test_f1: 0.5514
 epoch: 69, train_loss: 0.7943, test_loss: 0.8740, test_f1: 0.5408
 epoch: 70, train_loss: 0.7900, test_loss: 0.8786, test_f1: 0.5406
 epoch: 71, train_loss: 0.7989, test_loss: 0.8869, test_f1: 0.5356
 epoch: 72, train_loss: 0.7832, test_loss: 0.8865, test_f1: 0.5369
 epoch: 73, train_loss: 0.7833, test_loss: 0.8807, test_f1: 0.5387
 epoch: 74, train_loss: 0.7846, test_loss: 0.8911, test_f1: 0.5389
 epoch: 75, train_loss: 0.7795, test_loss: 0.8893, test_f1: 0.5368
 epoch: 76, train_loss: 0.7864, test_loss: 0.8886, test_f1: 0.5447
 epoch: 77, train_loss: 0.7736, test_loss: 0.8907, test_f1: 0.5436
 epoch: 78, train_loss: 0.7791, test_loss: 0.8804, test_f1: 0.5392
 epoch: 79, train_loss: 0.7774, test_loss: 0.8816, test_f1: 0.5379
 epoch: 80, train_loss: 0.7737, test_loss: 0.8787, test_f1: 0.5426
 epoch: 81, train_loss: 0.7831, test_loss: 0.8873, test_f1: 0.5331
 epoch: 82, train_loss: 0.7843, test_loss: 0.8808, test_f1: 0.5449
 epoch: 83, train_loss: 0.7800, test_loss: 0.8927, test_f1: 0.5428
 epoch: 84, train_loss: 0.7771, test_loss: 0.9004, test_f1: 0.5425
 epoch: 85, train_loss: 0.7770, test_loss: 0.8764, test_f1: 0.5446
 epoch: 86, train_loss: 0.7808, test_loss: 0.8914, test_f1: 0.5398
 epoch: 87, train_loss: 0.7698, test_loss: 0.8814, test_f1: 0.5403
 epoch: 88, train_loss: 0.7743, test_loss: 0.8897, test_f1: 0.5380
 epoch: 89, train_loss: 0.7640, test_loss: 0.8912, test_f1: 0.5450
 epoch: 90, train_loss: 0.7715, test_loss: 0.8938, test_f1: 0.5413
 epoch: 91, train_loss: 0.7642, test_loss: 0.8869, test_f1: 0.5418
 epoch: 92, train_loss: 0.7782, test_loss: 0.8992, test_f1: 0.5412
 epoch: 93, train_loss: 0.7681, test_loss: 0.8962, test_f1: 0.5679
 epoch: 94, train_loss: 0.7756, test_loss: 0.8975, test_f1: 0.5512
 epoch: 95, train_loss: 0.7570, test_loss: 0.8913, test_f1: 0.5593
 epoch: 96, train_loss: 0.7561, test_loss: 0.8900, test_f1: 0.5447
 epoch: 97, train_loss: 0.7587, test_loss: 0.8951, test_f1: 0.5411
 epoch: 98, train_loss: 0.7689, test_loss: 0.9070, test_f1: 0.5561
 epoch: 99, train_loss: 0.7524, test_loss: 0.8761, test_f1: 0.5620
##################ITERATION #4 ****************************************
 epoch: 0, train_loss: 1.2816, test_loss: 1.3231, test_f1: 0.2270
 epoch: 1, train_loss: 1.2277, test_loss: 1.3043, test_f1: 0.2270
 epoch: 2, train_loss: 1.2098, test_loss: 1.2641, test_f1: 0.2637
 epoch: 3, train_loss: 1.1916, test_loss: 1.2133, test_f1: 0.3228
 epoch: 4, train_loss: 1.1638, test_loss: 1.1670, test_f1: 0.3788
 epoch: 5, train_loss: 1.1470, test_loss: 1.1261, test_f1: 0.4285
 epoch: 6, train_loss: 1.1281, test_loss: 1.0889, test_f1: 0.4651
 epoch: 7, train_loss: 1.1033, test_loss: 1.0592, test_f1: 0.4768
 epoch: 8, train_loss: 1.0878, test_loss: 1.0448, test_f1: 0.4818
 epoch: 9, train_loss: 1.0744, test_loss: 1.0246, test_f1: 0.4930
 epoch: 10, train_loss: 1.0586, test_loss: 1.0056, test_f1: 0.5014
 epoch: 11, train_loss: 1.0390, test_loss: 0.9932, test_f1: 0.4931
 epoch: 12, train_loss: 1.0289, test_loss: 0.9745, test_f1: 0.5022
 epoch: 13, train_loss: 1.0144, test_loss: 0.9748, test_f1: 0.4882
 epoch: 14, train_loss: 1.0109, test_loss: 0.9588, test_f1: 0.4822
 epoch: 15, train_loss: 0.9901, test_loss: 0.9550, test_f1: 0.4824
 epoch: 16, train_loss: 0.9916, test_loss: 0.9468, test_f1: 0.4927
 epoch: 17, train_loss: 0.9819, test_loss: 0.9368, test_f1: 0.5049
 epoch: 18, train_loss: 0.9568, test_loss: 0.9247, test_f1: 0.5045
 epoch: 19, train_loss: 0.9593, test_loss: 0.9270, test_f1: 0.4964
 epoch: 20, train_loss: 0.9549, test_loss: 0.9191, test_f1: 0.5048
 epoch: 21, train_loss: 0.9527, test_loss: 0.9108, test_f1: 0.5107
 epoch: 22, train_loss: 0.9413, test_loss: 0.9052, test_f1: 0.5123
 epoch: 23, train_loss: 0.9337, test_loss: 0.9194, test_f1: 0.4962
 epoch: 24, train_loss: 0.9230, test_loss: 0.9018, test_f1: 0.5115
 epoch: 25, train_loss: 0.9285, test_loss: 0.8989, test_f1: 0.5111
 epoch: 26, train_loss: 0.9184, test_loss: 0.8892, test_f1: 0.5235
 epoch: 27, train_loss: 0.9137, test_loss: 0.8802, test_f1: 0.5269
 epoch: 28, train_loss: 0.9156, test_loss: 0.8914, test_f1: 0.5217
 epoch: 29, train_loss: 0.8983, test_loss: 0.8945, test_f1: 0.5196
 epoch: 30, train_loss: 0.8977, test_loss: 0.8871, test_f1: 0.5189
 epoch: 31, train_loss: 0.8827, test_loss: 0.8804, test_f1: 0.5198
 epoch: 32, train_loss: 0.8786, test_loss: 0.8868, test_f1: 0.5131
 epoch: 33, train_loss: 0.8807, test_loss: 0.8976, test_f1: 0.5216
 epoch: 34, train_loss: 0.8796, test_loss: 0.8828, test_f1: 0.5231
 epoch: 35, train_loss: 0.8794, test_loss: 0.8842, test_f1: 0.5244
 epoch: 36, train_loss: 0.8689, test_loss: 0.8826, test_f1: 0.5151
 epoch: 37, train_loss: 0.8700, test_loss: 0.8759, test_f1: 0.5289
 epoch: 38, train_loss: 0.8652, test_loss: 0.8879, test_f1: 0.5333
 epoch: 39, train_loss: 0.8613, test_loss: 0.8744, test_f1: 0.5301
 epoch: 40, train_loss: 0.8529, test_loss: 0.8805, test_f1: 0.5238
 epoch: 41, train_loss: 0.8561, test_loss: 0.8788, test_f1: 0.5417
 epoch: 42, train_loss: 0.8472, test_loss: 0.8790, test_f1: 0.5342
 epoch: 43, train_loss: 0.8485, test_loss: 0.8808, test_f1: 0.5387
 epoch: 44, train_loss: 0.8307, test_loss: 0.8732, test_f1: 0.5402
 epoch: 45, train_loss: 0.8389, test_loss: 0.8736, test_f1: 0.5314
 epoch: 46, train_loss: 0.8370, test_loss: 0.8848, test_f1: 0.5309
 epoch: 47, train_loss: 0.8349, test_loss: 0.8774, test_f1: 0.5464
 epoch: 48, train_loss: 0.8196, test_loss: 0.8815, test_f1: 0.5397
 epoch: 49, train_loss: 0.8237, test_loss: 0.8804, test_f1: 0.5333
 epoch: 50, train_loss: 0.8219, test_loss: 0.9068, test_f1: 0.5342
 epoch: 51, train_loss: 0.8108, test_loss: 0.8861, test_f1: 0.5430
 epoch: 52, train_loss: 0.8121, test_loss: 0.8831, test_f1: 0.5395
 epoch: 53, train_loss: 0.8124, test_loss: 0.8819, test_f1: 0.5432
 epoch: 54, train_loss: 0.8027, test_loss: 0.8808, test_f1: 0.5414
 epoch: 55, train_loss: 0.8063, test_loss: 0.8865, test_f1: 0.5483
 epoch: 56, train_loss: 0.8009, test_loss: 0.8771, test_f1: 0.5527
 epoch: 57, train_loss: 0.8063, test_loss: 0.8766, test_f1: 0.5450
 epoch: 58, train_loss: 0.7988, test_loss: 0.8820, test_f1: 0.5417
 epoch: 59, train_loss: 0.7999, test_loss: 0.8815, test_f1: 0.5473
 epoch: 60, train_loss: 0.7983, test_loss: 0.8886, test_f1: 0.5477
 epoch: 61, train_loss: 0.8016, test_loss: 0.8835, test_f1: 0.5488
 epoch: 62, train_loss: 0.7938, test_loss: 0.8849, test_f1: 0.5463
 epoch: 63, train_loss: 0.7866, test_loss: 0.8824, test_f1: 0.5441
 epoch: 64, train_loss: 0.7913, test_loss: 0.8912, test_f1: 0.5565
 epoch: 65, train_loss: 0.7912, test_loss: 0.8822, test_f1: 0.5518
 epoch: 66, train_loss: 0.7918, test_loss: 0.8880, test_f1: 0.5481
 epoch: 67, train_loss: 0.7918, test_loss: 0.8953, test_f1: 0.5517
 epoch: 68, train_loss: 0.7855, test_loss: 0.8853, test_f1: 0.5545
 epoch: 69, train_loss: 0.7900, test_loss: 0.9072, test_f1: 0.5501
 epoch: 70, train_loss: 0.7906, test_loss: 0.9006, test_f1: 0.5539
 epoch: 71, train_loss: 0.7854, test_loss: 0.8884, test_f1: 0.5513
 epoch: 72, train_loss: 0.7883, test_loss: 0.9015, test_f1: 0.5515
 epoch: 73, train_loss: 0.7804, test_loss: 0.9010, test_f1: 0.5507
 epoch: 74, train_loss: 0.7712, test_loss: 0.8969, test_f1: 0.5559
 epoch: 75, train_loss: 0.7763, test_loss: 0.8977, test_f1: 0.5548
 epoch: 76, train_loss: 0.7744, test_loss: 0.8896, test_f1: 0.5641
 epoch: 77, train_loss: 0.7800, test_loss: 0.9019, test_f1: 0.5574
 epoch: 78, train_loss: 0.7721, test_loss: 0.8880, test_f1: 0.5692
 epoch: 79, train_loss: 0.7707, test_loss: 0.8909, test_f1: 0.5679
 epoch: 80, train_loss: 0.7684, test_loss: 0.8969, test_f1: 0.5591
 epoch: 81, train_loss: 0.7714, test_loss: 0.8945, test_f1: 0.5757
 epoch: 82, train_loss: 0.7674, test_loss: 0.8932, test_f1: 0.5663
 epoch: 83, train_loss: 0.7667, test_loss: 0.8973, test_f1: 0.5743
 epoch: 84, train_loss: 0.7640, test_loss: 0.9012, test_f1: 0.5718
 epoch: 85, train_loss: 0.7697, test_loss: 0.9024, test_f1: 0.5763
 epoch: 86, train_loss: 0.7649, test_loss: 0.9021, test_f1: 0.5762
 epoch: 87, train_loss: 0.7616, test_loss: 0.9000, test_f1: 0.5744
 epoch: 88, train_loss: 0.7538, test_loss: 0.9018, test_f1: 0.5857
 epoch: 89, train_loss: 0.7636, test_loss: 0.8978, test_f1: 0.5854
 epoch: 90, train_loss: 0.7576, test_loss: 0.9016, test_f1: 0.5637
 epoch: 91, train_loss: 0.7600, test_loss: 0.8976, test_f1: 0.5772
 epoch: 92, train_loss: 0.7490, test_loss: 0.9012, test_f1: 0.5778
 epoch: 93, train_loss: 0.7433, test_loss: 0.9068, test_f1: 0.5788
 epoch: 94, train_loss: 0.7479, test_loss: 0.8973, test_f1: 0.5793
 epoch: 95, train_loss: 0.7567, test_loss: 0.9026, test_f1: 0.5741
 epoch: 96, train_loss: 0.7472, test_loss: 0.9040, test_f1: 0.5757
 epoch: 97, train_loss: 0.7465, test_loss: 0.9086, test_f1: 0.5813
 epoch: 98, train_loss: 0.7425, test_loss: 0.9048, test_f1: 0.5797
 epoch: 99, train_loss: 0.7412, test_loss: 0.9027, test_f1: 0.5825
##################ITERATION #5 ****************************************
 epoch: 0, train_loss: 1.2897, test_loss: 1.3197, test_f1: 0.2270
 epoch: 1, train_loss: 1.2164, test_loss: 1.2999, test_f1: 0.2270
 epoch: 2, train_loss: 1.1966, test_loss: 1.2602, test_f1: 0.2619
 epoch: 3, train_loss: 1.1735, test_loss: 1.2300, test_f1: 0.2803
 epoch: 4, train_loss: 1.1563, test_loss: 1.2026, test_f1: 0.2854
 epoch: 5, train_loss: 1.1378, test_loss: 1.1607, test_f1: 0.3302
 epoch: 6, train_loss: 1.1265, test_loss: 1.1075, test_f1: 0.3803
 epoch: 7, train_loss: 1.1081, test_loss: 1.0726, test_f1: 0.4304
 epoch: 8, train_loss: 1.0924, test_loss: 1.0559, test_f1: 0.4458
 epoch: 9, train_loss: 1.0788, test_loss: 1.0430, test_f1: 0.4633
 epoch: 10, train_loss: 1.0658, test_loss: 1.0334, test_f1: 0.4550
 epoch: 11, train_loss: 1.0576, test_loss: 1.0227, test_f1: 0.4618
 epoch: 12, train_loss: 1.0383, test_loss: 1.0099, test_f1: 0.4716
 epoch: 13, train_loss: 1.0342, test_loss: 1.0064, test_f1: 0.4674
 epoch: 14, train_loss: 1.0178, test_loss: 0.9954, test_f1: 0.4768
 epoch: 15, train_loss: 1.0126, test_loss: 0.9870, test_f1: 0.4758
 epoch: 16, train_loss: 1.0047, test_loss: 0.9861, test_f1: 0.4764
 epoch: 17, train_loss: 0.9939, test_loss: 0.9792, test_f1: 0.4801
 epoch: 18, train_loss: 0.9823, test_loss: 0.9816, test_f1: 0.4842
 epoch: 19, train_loss: 0.9818, test_loss: 0.9742, test_f1: 0.4890
 epoch: 20, train_loss: 0.9642, test_loss: 0.9640, test_f1: 0.4923
 epoch: 21, train_loss: 0.9698, test_loss: 0.9681, test_f1: 0.4881
 epoch: 22, train_loss: 0.9585, test_loss: 0.9656, test_f1: 0.4891
 epoch: 23, train_loss: 0.9444, test_loss: 0.9590, test_f1: 0.4908
 epoch: 24, train_loss: 0.9440, test_loss: 0.9544, test_f1: 0.4970
 epoch: 25, train_loss: 0.9438, test_loss: 0.9475, test_f1: 0.4961
 epoch: 26, train_loss: 0.9296, test_loss: 0.9546, test_f1: 0.4915
 epoch: 27, train_loss: 0.9230, test_loss: 0.9477, test_f1: 0.4963
 epoch: 28, train_loss: 0.9147, test_loss: 0.9456, test_f1: 0.4953
 epoch: 29, train_loss: 0.9186, test_loss: 0.9366, test_f1: 0.5066
 epoch: 30, train_loss: 0.9154, test_loss: 0.9483, test_f1: 0.4992
 epoch: 31, train_loss: 0.9079, test_loss: 0.9427, test_f1: 0.5021
 epoch: 32, train_loss: 0.9011, test_loss: 0.9396, test_f1: 0.4950
 epoch: 33, train_loss: 0.8938, test_loss: 0.9349, test_f1: 0.5011
 epoch: 34, train_loss: 0.8905, test_loss: 0.9396, test_f1: 0.4923
 epoch: 35, train_loss: 0.8778, test_loss: 0.9334, test_f1: 0.5073
 epoch: 36, train_loss: 0.8831, test_loss: 0.9253, test_f1: 0.5149
 epoch: 37, train_loss: 0.8782, test_loss: 0.9301, test_f1: 0.5041
 epoch: 38, train_loss: 0.8659, test_loss: 0.9301, test_f1: 0.5195
 epoch: 39, train_loss: 0.8622, test_loss: 0.9290, test_f1: 0.5053
 epoch: 40, train_loss: 0.8717, test_loss: 0.9362, test_f1: 0.5017
 epoch: 41, train_loss: 0.8516, test_loss: 0.9289, test_f1: 0.5114
 epoch: 42, train_loss: 0.8562, test_loss: 0.9319, test_f1: 0.5182
 epoch: 43, train_loss: 0.8597, test_loss: 0.9284, test_f1: 0.5105
 epoch: 44, train_loss: 0.8539, test_loss: 0.9305, test_f1: 0.5105
 epoch: 45, train_loss: 0.8488, test_loss: 0.9231, test_f1: 0.5224
 epoch: 46, train_loss: 0.8493, test_loss: 0.9548, test_f1: 0.5071
 epoch: 47, train_loss: 0.8417, test_loss: 0.9489, test_f1: 0.5053
 epoch: 48, train_loss: 0.8347, test_loss: 0.9271, test_f1: 0.5143
 epoch: 49, train_loss: 0.8305, test_loss: 0.9199, test_f1: 0.5203
 epoch: 50, train_loss: 0.8196, test_loss: 0.9257, test_f1: 0.5182
 epoch: 51, train_loss: 0.8275, test_loss: 0.9218, test_f1: 0.5092
 epoch: 52, train_loss: 0.8184, test_loss: 0.9230, test_f1: 0.5087
 epoch: 53, train_loss: 0.8299, test_loss: 0.9315, test_f1: 0.5121
 epoch: 54, train_loss: 0.8171, test_loss: 0.9393, test_f1: 0.5152
 epoch: 55, train_loss: 0.8194, test_loss: 0.9412, test_f1: 0.5066
 epoch: 56, train_loss: 0.8125, test_loss: 0.9389, test_f1: 0.5096
 epoch: 57, train_loss: 0.8109, test_loss: 0.9326, test_f1: 0.5083
 epoch: 58, train_loss: 0.8161, test_loss: 0.9354, test_f1: 0.5096
 epoch: 59, train_loss: 0.8105, test_loss: 0.9331, test_f1: 0.5105
 epoch: 60, train_loss: 0.8119, test_loss: 0.9289, test_f1: 0.5137
 epoch: 61, train_loss: 0.8013, test_loss: 0.9336, test_f1: 0.5211
 epoch: 62, train_loss: 0.8167, test_loss: 0.9336, test_f1: 0.5162
 epoch: 63, train_loss: 0.7991, test_loss: 0.9368, test_f1: 0.5173
 epoch: 64, train_loss: 0.8154, test_loss: 0.9454, test_f1: 0.5139
 epoch: 65, train_loss: 0.8038, test_loss: 0.9372, test_f1: 0.5138
 epoch: 66, train_loss: 0.8004, test_loss: 0.9374, test_f1: 0.5172
 epoch: 67, train_loss: 0.8083, test_loss: 0.9351, test_f1: 0.5179
 epoch: 68, train_loss: 0.7888, test_loss: 0.9453, test_f1: 0.5132
 epoch: 69, train_loss: 0.7940, test_loss: 0.9350, test_f1: 0.5152
 epoch: 70, train_loss: 0.7934, test_loss: 0.9350, test_f1: 0.5151
 epoch: 71, train_loss: 0.7970, test_loss: 0.9406, test_f1: 0.5154
 epoch: 72, train_loss: 0.7875, test_loss: 0.9453, test_f1: 0.5148
 epoch: 73, train_loss: 0.7851, test_loss: 0.9497, test_f1: 0.5169
 epoch: 74, train_loss: 0.7861, test_loss: 0.9497, test_f1: 0.5160
 epoch: 75, train_loss: 0.7891, test_loss: 0.9459, test_f1: 0.5183
 epoch: 76, train_loss: 0.7923, test_loss: 0.9432, test_f1: 0.5243
 epoch: 77, train_loss: 0.7903, test_loss: 0.9503, test_f1: 0.5188
 epoch: 78, train_loss: 0.7825, test_loss: 0.9466, test_f1: 0.5191
 epoch: 79, train_loss: 0.7784, test_loss: 0.9483, test_f1: 0.5234
 epoch: 80, train_loss: 0.7798, test_loss: 0.9568, test_f1: 0.5195
 epoch: 81, train_loss: 0.7907, test_loss: 0.9530, test_f1: 0.5241
 epoch: 82, train_loss: 0.7812, test_loss: 0.9432, test_f1: 0.5296
 epoch: 83, train_loss: 0.7725, test_loss: 0.9463, test_f1: 0.5288
 epoch: 84, train_loss: 0.7742, test_loss: 0.9484, test_f1: 0.5165
 epoch: 85, train_loss: 0.7706, test_loss: 0.9487, test_f1: 0.5278
 epoch: 86, train_loss: 0.7671, test_loss: 0.9483, test_f1: 0.5247
 epoch: 87, train_loss: 0.7722, test_loss: 0.9529, test_f1: 0.5316
 epoch: 88, train_loss: 0.7783, test_loss: 0.9414, test_f1: 0.5288
 epoch: 89, train_loss: 0.7631, test_loss: 0.9503, test_f1: 0.5265
 epoch: 90, train_loss: 0.7690, test_loss: 0.9511, test_f1: 0.5334
 epoch: 91, train_loss: 0.7680, test_loss: 0.9530, test_f1: 0.5325
 epoch: 92, train_loss: 0.7698, test_loss: 0.9507, test_f1: 0.5367
 epoch: 93, train_loss: 0.7645, test_loss: 0.9492, test_f1: 0.5319
 epoch: 94, train_loss: 0.7603, test_loss: 0.9527, test_f1: 0.5295
 epoch: 95, train_loss: 0.7596, test_loss: 0.9493, test_f1: 0.5306
 epoch: 96, train_loss: 0.7723, test_loss: 0.9438, test_f1: 0.5320
 epoch: 97, train_loss: 0.7600, test_loss: 0.9513, test_f1: 0.5376
 epoch: 98, train_loss: 0.7601, test_loss: 0.9600, test_f1: 0.5263
 epoch: 99, train_loss: 0.7568, test_loss: 0.9565, test_f1: 0.5396
##################ITERATION #6 ****************************************
 epoch: 0, train_loss: 1.2841, test_loss: 1.3181, test_f1: 0.2270
 epoch: 1, train_loss: 1.2172, test_loss: 1.3006, test_f1: 0.2270
 epoch: 2, train_loss: 1.1762, test_loss: 1.2532, test_f1: 0.2295
 epoch: 3, train_loss: 1.1598, test_loss: 1.1911, test_f1: 0.3705
 epoch: 4, train_loss: 1.1455, test_loss: 1.1488, test_f1: 0.4305
 epoch: 5, train_loss: 1.1235, test_loss: 1.1019, test_f1: 0.4606
 epoch: 6, train_loss: 1.1114, test_loss: 1.0694, test_f1: 0.4506
 epoch: 7, train_loss: 1.0928, test_loss: 1.0427, test_f1: 0.4683
 epoch: 8, train_loss: 1.0728, test_loss: 1.0298, test_f1: 0.4727
 epoch: 9, train_loss: 1.0631, test_loss: 1.0176, test_f1: 0.4711
 epoch: 10, train_loss: 1.0426, test_loss: 1.0086, test_f1: 0.4644
 epoch: 11, train_loss: 1.0486, test_loss: 0.9971, test_f1: 0.4671
 epoch: 12, train_loss: 1.0200, test_loss: 0.9909, test_f1: 0.4745
 epoch: 13, train_loss: 1.0154, test_loss: 0.9869, test_f1: 0.4853
 epoch: 14, train_loss: 1.0082, test_loss: 0.9820, test_f1: 0.4808
 epoch: 15, train_loss: 1.0004, test_loss: 0.9863, test_f1: 0.4747
 epoch: 16, train_loss: 0.9892, test_loss: 0.9709, test_f1: 0.4874
 epoch: 17, train_loss: 0.9797, test_loss: 0.9686, test_f1: 0.5194
 epoch: 18, train_loss: 0.9725, test_loss: 0.9637, test_f1: 0.5138
 epoch: 19, train_loss: 0.9696, test_loss: 0.9846, test_f1: 0.4966
 epoch: 20, train_loss: 0.9620, test_loss: 0.9600, test_f1: 0.5149
 epoch: 21, train_loss: 0.9555, test_loss: 0.9568, test_f1: 0.5200
 epoch: 22, train_loss: 0.9444, test_loss: 0.9669, test_f1: 0.4819
 epoch: 23, train_loss: 0.9447, test_loss: 0.9691, test_f1: 0.5056
 epoch: 24, train_loss: 0.9315, test_loss: 0.9499, test_f1: 0.5046
 epoch: 25, train_loss: 0.9278, test_loss: 0.9540, test_f1: 0.4922
 epoch: 26, train_loss: 0.9176, test_loss: 0.9668, test_f1: 0.4851
 epoch: 27, train_loss: 0.9187, test_loss: 0.9564, test_f1: 0.5018
 epoch: 28, train_loss: 0.9170, test_loss: 0.9484, test_f1: 0.5089
 epoch: 29, train_loss: 0.9078, test_loss: 0.9603, test_f1: 0.4949
 epoch: 30, train_loss: 0.9054, test_loss: 0.9547, test_f1: 0.4994
 epoch: 31, train_loss: 0.8997, test_loss: 0.9483, test_f1: 0.5020
 epoch: 32, train_loss: 0.8918, test_loss: 0.9456, test_f1: 0.5111
 epoch: 33, train_loss: 0.9031, test_loss: 0.9490, test_f1: 0.5074
 epoch: 34, train_loss: 0.8908, test_loss: 0.9549, test_f1: 0.4898
 epoch: 35, train_loss: 0.8843, test_loss: 0.9374, test_f1: 0.5143
 epoch: 36, train_loss: 0.8755, test_loss: 0.9654, test_f1: 0.4988
 epoch: 37, train_loss: 0.8741, test_loss: 0.9565, test_f1: 0.4957
 epoch: 38, train_loss: 0.8725, test_loss: 0.9608, test_f1: 0.5028
 epoch: 39, train_loss: 0.8651, test_loss: 0.9827, test_f1: 0.4942
 epoch: 40, train_loss: 0.8650, test_loss: 0.9540, test_f1: 0.4938
 epoch: 41, train_loss: 0.8686, test_loss: 0.9642, test_f1: 0.5068
 epoch: 42, train_loss: 0.8584, test_loss: 0.9731, test_f1: 0.5089
 epoch: 43, train_loss: 0.8510, test_loss: 0.9666, test_f1: 0.5147
 epoch: 44, train_loss: 0.8473, test_loss: 0.9638, test_f1: 0.5160
 epoch: 45, train_loss: 0.8516, test_loss: 0.9823, test_f1: 0.4936
 epoch: 46, train_loss: 0.8417, test_loss: 0.9680, test_f1: 0.5138
 epoch: 47, train_loss: 0.8498, test_loss: 0.9843, test_f1: 0.5059
 epoch: 48, train_loss: 0.8453, test_loss: 0.9781, test_f1: 0.5137
 epoch: 49, train_loss: 0.8393, test_loss: 0.9645, test_f1: 0.5208
 epoch: 50, train_loss: 0.8320, test_loss: 0.9677, test_f1: 0.5169
 epoch: 51, train_loss: 0.8194, test_loss: 0.9700, test_f1: 0.5132
 epoch: 52, train_loss: 0.8391, test_loss: 0.9768, test_f1: 0.5144
 epoch: 53, train_loss: 0.8273, test_loss: 0.9843, test_f1: 0.5118
 epoch: 54, train_loss: 0.8260, test_loss: 0.9790, test_f1: 0.5113
 epoch: 55, train_loss: 0.8177, test_loss: 0.9778, test_f1: 0.5177
 epoch: 56, train_loss: 0.8212, test_loss: 0.9777, test_f1: 0.5174
 epoch: 57, train_loss: 0.8148, test_loss: 0.9885, test_f1: 0.5167
 epoch: 58, train_loss: 0.8124, test_loss: 0.9846, test_f1: 0.5245
 epoch: 59, train_loss: 0.8222, test_loss: 0.9775, test_f1: 0.5222
 epoch: 60, train_loss: 0.8188, test_loss: 0.9962, test_f1: 0.5207
 epoch: 61, train_loss: 0.8104, test_loss: 1.0019, test_f1: 0.5051
 epoch: 62, train_loss: 0.8182, test_loss: 0.9724, test_f1: 0.5129
 epoch: 63, train_loss: 0.8060, test_loss: 0.9840, test_f1: 0.5221
 epoch: 64, train_loss: 0.8059, test_loss: 1.0066, test_f1: 0.5145
 epoch: 65, train_loss: 0.8097, test_loss: 0.9824, test_f1: 0.5084
 epoch: 66, train_loss: 0.8107, test_loss: 0.9936, test_f1: 0.5125
 epoch: 67, train_loss: 0.8132, test_loss: 0.9940, test_f1: 0.5189
 epoch: 68, train_loss: 0.7980, test_loss: 1.0022, test_f1: 0.5252
 epoch: 69, train_loss: 0.8109, test_loss: 0.9967, test_f1: 0.5169
 epoch: 70, train_loss: 0.8019, test_loss: 1.0137, test_f1: 0.5047
 epoch: 71, train_loss: 0.8020, test_loss: 1.0026, test_f1: 0.5212
 epoch: 72, train_loss: 0.7973, test_loss: 0.9981, test_f1: 0.5290
 epoch: 73, train_loss: 0.7987, test_loss: 0.9976, test_f1: 0.5169
 epoch: 74, train_loss: 0.8017, test_loss: 1.0000, test_f1: 0.5261
 epoch: 75, train_loss: 0.7911, test_loss: 1.0095, test_f1: 0.5189
 epoch: 76, train_loss: 0.7910, test_loss: 1.0132, test_f1: 0.5228
 epoch: 77, train_loss: 0.8020, test_loss: 1.0154, test_f1: 0.5321
 epoch: 78, train_loss: 0.7932, test_loss: 0.9927, test_f1: 0.5348
 epoch: 79, train_loss: 0.7924, test_loss: 1.0197, test_f1: 0.5236
 epoch: 80, train_loss: 0.7934, test_loss: 1.0009, test_f1: 0.5239
 epoch: 81, train_loss: 0.7837, test_loss: 1.0064, test_f1: 0.5353
 epoch: 82, train_loss: 0.7866, test_loss: 1.0144, test_f1: 0.5321
 epoch: 83, train_loss: 0.7835, test_loss: 1.0061, test_f1: 0.5375
 epoch: 84, train_loss: 0.7753, test_loss: 1.0018, test_f1: 0.5375
 epoch: 85, train_loss: 0.7912, test_loss: 1.0035, test_f1: 0.5356
 epoch: 86, train_loss: 0.7813, test_loss: 1.0248, test_f1: 0.5214
 epoch: 87, train_loss: 0.7800, test_loss: 1.0202, test_f1: 0.5368
 epoch: 88, train_loss: 0.7846, test_loss: 1.0116, test_f1: 0.5537
 epoch: 89, train_loss: 0.7889, test_loss: 0.9980, test_f1: 0.5453
 epoch: 90, train_loss: 0.7719, test_loss: 1.0011, test_f1: 0.5342
 epoch: 91, train_loss: 0.7780, test_loss: 1.0008, test_f1: 0.5260
 epoch: 92, train_loss: 0.7704, test_loss: 1.0189, test_f1: 0.5233
 epoch: 93, train_loss: 0.7755, test_loss: 1.0107, test_f1: 0.5379
 epoch: 94, train_loss: 0.7715, test_loss: 1.0115, test_f1: 0.5321
 epoch: 95, train_loss: 0.7717, test_loss: 0.9990, test_f1: 0.5346
 epoch: 96, train_loss: 0.7700, test_loss: 0.9971, test_f1: 0.5363
 epoch: 97, train_loss: 0.7770, test_loss: 1.0080, test_f1: 0.5400
 epoch: 98, train_loss: 0.7708, test_loss: 1.0108, test_f1: 0.5441
 epoch: 99, train_loss: 0.7582, test_loss: 1.0235, test_f1: 0.5520
##################ITERATION #7 ****************************************
 epoch: 0, train_loss: 1.3103, test_loss: 1.3170, test_f1: 0.2270
 epoch: 1, train_loss: 1.2174, test_loss: 1.2987, test_f1: 0.2270
 epoch: 2, train_loss: 1.1966, test_loss: 1.2531, test_f1: 0.2764
 epoch: 3, train_loss: 1.1604, test_loss: 1.2012, test_f1: 0.3193
 epoch: 4, train_loss: 1.1389, test_loss: 1.1379, test_f1: 0.4123
 epoch: 5, train_loss: 1.1214, test_loss: 1.0840, test_f1: 0.4365
 epoch: 6, train_loss: 1.1052, test_loss: 1.0579, test_f1: 0.4312
 epoch: 7, train_loss: 1.0879, test_loss: 1.0290, test_f1: 0.4671
 epoch: 8, train_loss: 1.0695, test_loss: 1.0070, test_f1: 0.4738
 epoch: 9, train_loss: 1.0557, test_loss: 0.9937, test_f1: 0.5043
 epoch: 10, train_loss: 1.0465, test_loss: 0.9917, test_f1: 0.4836
 epoch: 11, train_loss: 1.0354, test_loss: 0.9828, test_f1: 0.5161
 epoch: 12, train_loss: 1.0154, test_loss: 0.9708, test_f1: 0.5033
 epoch: 13, train_loss: 1.0090, test_loss: 0.9732, test_f1: 0.5163
 epoch: 14, train_loss: 1.0048, test_loss: 0.9637, test_f1: 0.5209
 epoch: 15, train_loss: 0.9865, test_loss: 0.9576, test_f1: 0.5002
 epoch: 16, train_loss: 0.9814, test_loss: 0.9495, test_f1: 0.5089
 epoch: 17, train_loss: 0.9714, test_loss: 0.9475, test_f1: 0.5080
 epoch: 18, train_loss: 0.9653, test_loss: 0.9439, test_f1: 0.5171
 epoch: 19, train_loss: 0.9563, test_loss: 0.9436, test_f1: 0.5188
 epoch: 20, train_loss: 0.9533, test_loss: 0.9325, test_f1: 0.5166
 epoch: 21, train_loss: 0.9450, test_loss: 0.9287, test_f1: 0.5101
 epoch: 22, train_loss: 0.9390, test_loss: 0.9251, test_f1: 0.5161
 epoch: 23, train_loss: 0.9369, test_loss: 0.9223, test_f1: 0.5188
 epoch: 24, train_loss: 0.9338, test_loss: 0.9319, test_f1: 0.5178
 epoch: 25, train_loss: 0.9212, test_loss: 0.9299, test_f1: 0.5193
 epoch: 26, train_loss: 0.9156, test_loss: 0.9263, test_f1: 0.5090
 epoch: 27, train_loss: 0.9219, test_loss: 0.9189, test_f1: 0.5179
 epoch: 28, train_loss: 0.9098, test_loss: 0.9172, test_f1: 0.5235
 epoch: 29, train_loss: 0.9072, test_loss: 0.9274, test_f1: 0.5208
 epoch: 30, train_loss: 0.9023, test_loss: 0.9170, test_f1: 0.5263
 epoch: 31, train_loss: 0.8942, test_loss: 0.9124, test_f1: 0.5123
 epoch: 32, train_loss: 0.8969, test_loss: 0.9144, test_f1: 0.5262
 epoch: 33, train_loss: 0.8900, test_loss: 0.9143, test_f1: 0.5233
 epoch: 34, train_loss: 0.8880, test_loss: 0.9108, test_f1: 0.5207
 epoch: 35, train_loss: 0.8862, test_loss: 0.9121, test_f1: 0.5232
 epoch: 36, train_loss: 0.8751, test_loss: 0.9040, test_f1: 0.5309
 epoch: 37, train_loss: 0.8752, test_loss: 0.9280, test_f1: 0.5198
 epoch: 38, train_loss: 0.8776, test_loss: 0.9112, test_f1: 0.5266
 epoch: 39, train_loss: 0.8790, test_loss: 0.9165, test_f1: 0.5248
 epoch: 40, train_loss: 0.8731, test_loss: 0.9067, test_f1: 0.5227
 epoch: 41, train_loss: 0.8597, test_loss: 0.9124, test_f1: 0.5256
 epoch: 42, train_loss: 0.8572, test_loss: 0.9183, test_f1: 0.5347
 epoch: 43, train_loss: 0.8630, test_loss: 0.9060, test_f1: 0.5334
 epoch: 44, train_loss: 0.8548, test_loss: 0.9058, test_f1: 0.5262
 epoch: 45, train_loss: 0.8520, test_loss: 0.9022, test_f1: 0.5370
 epoch: 46, train_loss: 0.8439, test_loss: 0.9124, test_f1: 0.5366
 epoch: 47, train_loss: 0.8421, test_loss: 0.9350, test_f1: 0.5211
 epoch: 48, train_loss: 0.8402, test_loss: 0.9121, test_f1: 0.5338
 epoch: 49, train_loss: 0.8301, test_loss: 0.9110, test_f1: 0.5340
 epoch: 50, train_loss: 0.8280, test_loss: 0.9142, test_f1: 0.5454
 epoch: 51, train_loss: 0.8234, test_loss: 0.9203, test_f1: 0.5334
 epoch: 52, train_loss: 0.8349, test_loss: 0.9286, test_f1: 0.5278
 epoch: 53, train_loss: 0.8214, test_loss: 0.9215, test_f1: 0.5340
 epoch: 54, train_loss: 0.8374, test_loss: 0.9142, test_f1: 0.5435
 epoch: 55, train_loss: 0.8202, test_loss: 0.9109, test_f1: 0.5411
 epoch: 56, train_loss: 0.8319, test_loss: 0.9172, test_f1: 0.5384
 epoch: 57, train_loss: 0.8212, test_loss: 0.9252, test_f1: 0.5366
 epoch: 58, train_loss: 0.8264, test_loss: 0.9348, test_f1: 0.5229
 epoch: 59, train_loss: 0.8168, test_loss: 0.9158, test_f1: 0.5422
 epoch: 60, train_loss: 0.8157, test_loss: 0.9328, test_f1: 0.5247
 epoch: 61, train_loss: 0.8242, test_loss: 0.9264, test_f1: 0.5334
 epoch: 62, train_loss: 0.8119, test_loss: 0.9289, test_f1: 0.5287
 epoch: 63, train_loss: 0.8160, test_loss: 0.9140, test_f1: 0.5390
 epoch: 64, train_loss: 0.8104, test_loss: 0.9246, test_f1: 0.5291
 epoch: 65, train_loss: 0.8151, test_loss: 0.9160, test_f1: 0.5378
 epoch: 66, train_loss: 0.8158, test_loss: 0.9306, test_f1: 0.5291
 epoch: 67, train_loss: 0.8016, test_loss: 0.9264, test_f1: 0.5375
 epoch: 68, train_loss: 0.8086, test_loss: 0.9285, test_f1: 0.5385
 epoch: 69, train_loss: 0.8069, test_loss: 0.9310, test_f1: 0.5395
 epoch: 70, train_loss: 0.8035, test_loss: 0.9229, test_f1: 0.5410
 epoch: 71, train_loss: 0.8016, test_loss: 0.9292, test_f1: 0.5399
 epoch: 72, train_loss: 0.8029, test_loss: 0.9249, test_f1: 0.5420
 epoch: 73, train_loss: 0.7968, test_loss: 0.9318, test_f1: 0.5306
 epoch: 74, train_loss: 0.8064, test_loss: 0.9344, test_f1: 0.5353
 epoch: 75, train_loss: 0.7984, test_loss: 0.9223, test_f1: 0.5464
 epoch: 76, train_loss: 0.7948, test_loss: 0.9275, test_f1: 0.5341
 epoch: 77, train_loss: 0.7915, test_loss: 0.9283, test_f1: 0.5300
 epoch: 78, train_loss: 0.7854, test_loss: 0.9380, test_f1: 0.5324
 epoch: 79, train_loss: 0.7898, test_loss: 0.9285, test_f1: 0.5366
 epoch: 80, train_loss: 0.7777, test_loss: 0.9345, test_f1: 0.5339
 epoch: 81, train_loss: 0.7819, test_loss: 0.9341, test_f1: 0.5405
 epoch: 82, train_loss: 0.7854, test_loss: 0.9394, test_f1: 0.5354
 epoch: 83, train_loss: 0.7859, test_loss: 0.9366, test_f1: 0.5326
 epoch: 84, train_loss: 0.7841, test_loss: 0.9240, test_f1: 0.5375
 epoch: 85, train_loss: 0.7865, test_loss: 0.9471, test_f1: 0.5334
 epoch: 86, train_loss: 0.7878, test_loss: 0.9406, test_f1: 0.5333
 epoch: 87, train_loss: 0.7853, test_loss: 0.9338, test_f1: 0.5368
 epoch: 88, train_loss: 0.7864, test_loss: 0.9354, test_f1: 0.5349
 epoch: 89, train_loss: 0.7752, test_loss: 0.9326, test_f1: 0.5409
 epoch: 90, train_loss: 0.7765, test_loss: 0.9309, test_f1: 0.5409
 epoch: 91, train_loss: 0.7741, test_loss: 0.9462, test_f1: 0.5330
 epoch: 92, train_loss: 0.7757, test_loss: 0.9346, test_f1: 0.5448
 epoch: 93, train_loss: 0.7809, test_loss: 0.9452, test_f1: 0.5372
 epoch: 94, train_loss: 0.7762, test_loss: 0.9508, test_f1: 0.5298
 epoch: 95, train_loss: 0.7700, test_loss: 0.9421, test_f1: 0.5529
 epoch: 96, train_loss: 0.7661, test_loss: 0.9470, test_f1: 0.5454
 epoch: 97, train_loss: 0.7667, test_loss: 0.9411, test_f1: 0.5393
 epoch: 98, train_loss: 0.7664, test_loss: 0.9338, test_f1: 0.5375
 epoch: 99, train_loss: 0.7740, test_loss: 0.9497, test_f1: 0.5393
##################ITERATION #8 ****************************************
 epoch: 0, train_loss: 1.3199, test_loss: 1.3131, test_f1: 0.2270
 epoch: 1, train_loss: 1.2238, test_loss: 1.2775, test_f1: 0.2270
 epoch: 2, train_loss: 1.1999, test_loss: 1.2392, test_f1: 0.2877
 epoch: 3, train_loss: 1.1715, test_loss: 1.1691, test_f1: 0.3425
 epoch: 4, train_loss: 1.1480, test_loss: 1.1162, test_f1: 0.3729
 epoch: 5, train_loss: 1.1331, test_loss: 1.0758, test_f1: 0.4176
 epoch: 6, train_loss: 1.1147, test_loss: 1.0551, test_f1: 0.4474
 epoch: 7, train_loss: 1.1013, test_loss: 1.0386, test_f1: 0.4536
 epoch: 8, train_loss: 1.0892, test_loss: 1.0271, test_f1: 0.4595
 epoch: 9, train_loss: 1.0726, test_loss: 1.0159, test_f1: 0.4599
 epoch: 10, train_loss: 1.0568, test_loss: 1.0030, test_f1: 0.4567
 epoch: 11, train_loss: 1.0450, test_loss: 0.9912, test_f1: 0.4610
 epoch: 12, train_loss: 1.0272, test_loss: 0.9866, test_f1: 0.4575
 epoch: 13, train_loss: 1.0256, test_loss: 0.9771, test_f1: 0.4567
 epoch: 14, train_loss: 1.0068, test_loss: 0.9710, test_f1: 0.4785
 epoch: 15, train_loss: 1.0008, test_loss: 0.9679, test_f1: 0.4772
 epoch: 16, train_loss: 0.9985, test_loss: 0.9624, test_f1: 0.4821
 epoch: 17, train_loss: 0.9792, test_loss: 0.9568, test_f1: 0.4836
 epoch: 18, train_loss: 0.9756, test_loss: 0.9551, test_f1: 0.4855
 epoch: 19, train_loss: 0.9652, test_loss: 0.9500, test_f1: 0.4896
 epoch: 20, train_loss: 0.9535, test_loss: 0.9365, test_f1: 0.4890
 epoch: 21, train_loss: 0.9480, test_loss: 0.9369, test_f1: 0.4893
 epoch: 22, train_loss: 0.9486, test_loss: 0.9453, test_f1: 0.4863
 epoch: 23, train_loss: 0.9525, test_loss: 0.9487, test_f1: 0.4824
 epoch: 24, train_loss: 0.9391, test_loss: 0.9283, test_f1: 0.5196
 epoch: 25, train_loss: 0.9241, test_loss: 0.9398, test_f1: 0.5122
 epoch: 26, train_loss: 0.9218, test_loss: 0.9496, test_f1: 0.5044
 epoch: 27, train_loss: 0.9179, test_loss: 0.9386, test_f1: 0.5135
 epoch: 28, train_loss: 0.9108, test_loss: 0.9298, test_f1: 0.5179
 epoch: 29, train_loss: 0.9066, test_loss: 0.9453, test_f1: 0.5055
 epoch: 30, train_loss: 0.9041, test_loss: 0.9594, test_f1: 0.5078
 epoch: 31, train_loss: 0.9000, test_loss: 0.9317, test_f1: 0.5171
 epoch: 32, train_loss: 0.8841, test_loss: 0.9332, test_f1: 0.5195
 epoch: 33, train_loss: 0.8817, test_loss: 0.9603, test_f1: 0.5000
 epoch: 34, train_loss: 0.8819, test_loss: 0.9476, test_f1: 0.5078
 epoch: 35, train_loss: 0.8756, test_loss: 0.9363, test_f1: 0.5201
 epoch: 36, train_loss: 0.8744, test_loss: 0.9400, test_f1: 0.5173
 epoch: 37, train_loss: 0.8695, test_loss: 0.9570, test_f1: 0.5091
 epoch: 38, train_loss: 0.8664, test_loss: 0.9389, test_f1: 0.5127
 epoch: 39, train_loss: 0.8627, test_loss: 0.9679, test_f1: 0.5121
 epoch: 40, train_loss: 0.8549, test_loss: 0.9733, test_f1: 0.5124
 epoch: 41, train_loss: 0.8569, test_loss: 0.9812, test_f1: 0.5091
 epoch: 42, train_loss: 0.8526, test_loss: 0.9617, test_f1: 0.5104
 epoch: 43, train_loss: 0.8444, test_loss: 0.9474, test_f1: 0.5167
 epoch: 44, train_loss: 0.8467, test_loss: 0.9533, test_f1: 0.5205
 epoch: 45, train_loss: 0.8467, test_loss: 0.9687, test_f1: 0.5266
 epoch: 46, train_loss: 0.8428, test_loss: 0.9410, test_f1: 0.5153
 epoch: 47, train_loss: 0.8385, test_loss: 0.9503, test_f1: 0.5200
 epoch: 48, train_loss: 0.8244, test_loss: 0.9463, test_f1: 0.5252
 epoch: 49, train_loss: 0.8287, test_loss: 0.9832, test_f1: 0.5204
 epoch: 50, train_loss: 0.8283, test_loss: 0.9480, test_f1: 0.5230
 epoch: 51, train_loss: 0.8162, test_loss: 0.9633, test_f1: 0.5284
 epoch: 52, train_loss: 0.8165, test_loss: 0.9644, test_f1: 0.5223
 epoch: 53, train_loss: 0.8165, test_loss: 0.9779, test_f1: 0.5350
 epoch: 54, train_loss: 0.8116, test_loss: 0.9729, test_f1: 0.5261
 epoch: 55, train_loss: 0.8057, test_loss: 0.9654, test_f1: 0.5188
 epoch: 56, train_loss: 0.8125, test_loss: 0.9700, test_f1: 0.5316
 epoch: 57, train_loss: 0.8084, test_loss: 0.9701, test_f1: 0.5316
 epoch: 58, train_loss: 0.8168, test_loss: 0.9689, test_f1: 0.5327
 epoch: 59, train_loss: 0.8090, test_loss: 0.9668, test_f1: 0.5305
 epoch: 60, train_loss: 0.8052, test_loss: 0.9652, test_f1: 0.5160
 epoch: 61, train_loss: 0.8077, test_loss: 0.9615, test_f1: 0.5207
 epoch: 62, train_loss: 0.8011, test_loss: 0.9775, test_f1: 0.5219
 epoch: 63, train_loss: 0.7981, test_loss: 0.9782, test_f1: 0.5226
 epoch: 64, train_loss: 0.8036, test_loss: 0.9713, test_f1: 0.5206
 epoch: 65, train_loss: 0.7963, test_loss: 0.9812, test_f1: 0.5354
 epoch: 66, train_loss: 0.8001, test_loss: 0.9801, test_f1: 0.5284
 epoch: 67, train_loss: 0.7901, test_loss: 0.9882, test_f1: 0.5232
 epoch: 68, train_loss: 0.7994, test_loss: 0.9815, test_f1: 0.5372
 epoch: 69, train_loss: 0.7945, test_loss: 1.0004, test_f1: 0.5275
 epoch: 70, train_loss: 0.7873, test_loss: 0.9747, test_f1: 0.5321
 epoch: 71, train_loss: 0.7910, test_loss: 0.9843, test_f1: 0.5398
 epoch: 72, train_loss: 0.7797, test_loss: 0.9869, test_f1: 0.5239
 epoch: 73, train_loss: 0.7906, test_loss: 0.9943, test_f1: 0.5329
 epoch: 74, train_loss: 0.7918, test_loss: 0.9863, test_f1: 0.5240
 epoch: 75, train_loss: 0.7939, test_loss: 0.9854, test_f1: 0.5346
 epoch: 76, train_loss: 0.7809, test_loss: 0.9828, test_f1: 0.5363
 epoch: 77, train_loss: 0.7798, test_loss: 0.9913, test_f1: 0.5296
 epoch: 78, train_loss: 0.7819, test_loss: 0.9835, test_f1: 0.5341
 epoch: 79, train_loss: 0.7855, test_loss: 0.9988, test_f1: 0.5281
 epoch: 80, train_loss: 0.7839, test_loss: 0.9966, test_f1: 0.5438
 epoch: 81, train_loss: 0.7875, test_loss: 1.0010, test_f1: 0.5431
 epoch: 82, train_loss: 0.7825, test_loss: 1.0018, test_f1: 0.5291
 epoch: 83, train_loss: 0.7765, test_loss: 1.0105, test_f1: 0.5312
 epoch: 84, train_loss: 0.7712, test_loss: 1.0120, test_f1: 0.5355
 epoch: 85, train_loss: 0.7645, test_loss: 1.0048, test_f1: 0.5503
 epoch: 86, train_loss: 0.7746, test_loss: 0.9910, test_f1: 0.5415
 epoch: 87, train_loss: 0.7684, test_loss: 1.0138, test_f1: 0.5403
 epoch: 88, train_loss: 0.7628, test_loss: 1.0079, test_f1: 0.5451
 epoch: 89, train_loss: 0.7729, test_loss: 1.0116, test_f1: 0.5453
 epoch: 90, train_loss: 0.7717, test_loss: 1.0087, test_f1: 0.5427
 epoch: 91, train_loss: 0.7776, test_loss: 0.9937, test_f1: 0.5420
 epoch: 92, train_loss: 0.7672, test_loss: 1.0030, test_f1: 0.5403
 epoch: 93, train_loss: 0.7642, test_loss: 1.0037, test_f1: 0.5449
 epoch: 94, train_loss: 0.7684, test_loss: 1.0055, test_f1: 0.5435
 epoch: 95, train_loss: 0.7732, test_loss: 1.0073, test_f1: 0.5408
 epoch: 96, train_loss: 0.7605, test_loss: 1.0182, test_f1: 0.5495
 epoch: 97, train_loss: 0.7622, test_loss: 0.9975, test_f1: 0.5535
 epoch: 98, train_loss: 0.7579, test_loss: 1.0029, test_f1: 0.5544
 epoch: 99, train_loss: 0.7679, test_loss: 1.0014, test_f1: 0.5546
##################ITERATION #9 ****************************************
 epoch: 0, train_loss: 1.3074, test_loss: 1.3461, test_f1: 0.2270
 epoch: 1, train_loss: 1.2225, test_loss: 1.3103, test_f1: 0.2297
 epoch: 2, train_loss: 1.1788, test_loss: 1.2734, test_f1: 0.3125
 epoch: 3, train_loss: 1.1609, test_loss: 1.2563, test_f1: 0.3107
 epoch: 4, train_loss: 1.1397, test_loss: 1.1743, test_f1: 0.3435
 epoch: 5, train_loss: 1.1176, test_loss: 1.0933, test_f1: 0.4529
 epoch: 6, train_loss: 1.0857, test_loss: 1.0481, test_f1: 0.4568
 epoch: 7, train_loss: 1.0828, test_loss: 1.0260, test_f1: 0.4575
 epoch: 8, train_loss: 1.0636, test_loss: 1.0176, test_f1: 0.4571
 epoch: 9, train_loss: 1.0521, test_loss: 1.0064, test_f1: 0.4682
 epoch: 10, train_loss: 1.0368, test_loss: 0.9973, test_f1: 0.4560
 epoch: 11, train_loss: 1.0269, test_loss: 0.9878, test_f1: 0.4691
 epoch: 12, train_loss: 1.0114, test_loss: 0.9817, test_f1: 0.4728
 epoch: 13, train_loss: 1.0159, test_loss: 0.9727, test_f1: 0.4696
 epoch: 14, train_loss: 1.0113, test_loss: 0.9681, test_f1: 0.4758
 epoch: 15, train_loss: 0.9999, test_loss: 0.9628, test_f1: 0.4752
 epoch: 16, train_loss: 0.9858, test_loss: 0.9623, test_f1: 0.4847
 epoch: 17, train_loss: 0.9775, test_loss: 0.9631, test_f1: 0.4890
 epoch: 18, train_loss: 0.9674, test_loss: 0.9582, test_f1: 0.4942
 epoch: 19, train_loss: 0.9582, test_loss: 0.9534, test_f1: 0.5040
 epoch: 20, train_loss: 0.9649, test_loss: 0.9442, test_f1: 0.5045
 epoch: 21, train_loss: 0.9541, test_loss: 0.9459, test_f1: 0.5016
 epoch: 22, train_loss: 0.9530, test_loss: 0.9412, test_f1: 0.4920
 epoch: 23, train_loss: 0.9426, test_loss: 0.9368, test_f1: 0.5090
 epoch: 24, train_loss: 0.9378, test_loss: 0.9336, test_f1: 0.5160
 epoch: 25, train_loss: 0.9348, test_loss: 0.9316, test_f1: 0.5241
 epoch: 26, train_loss: 0.9353, test_loss: 0.9325, test_f1: 0.5207
 epoch: 27, train_loss: 0.9236, test_loss: 0.9248, test_f1: 0.5165
 epoch: 28, train_loss: 0.9201, test_loss: 0.9376, test_f1: 0.5140
 epoch: 29, train_loss: 0.9106, test_loss: 0.9363, test_f1: 0.5156
 epoch: 30, train_loss: 0.9137, test_loss: 0.9324, test_f1: 0.5196
 epoch: 31, train_loss: 0.9015, test_loss: 0.9232, test_f1: 0.5210
 epoch: 32, train_loss: 0.9045, test_loss: 0.9146, test_f1: 0.5092
 epoch: 33, train_loss: 0.8903, test_loss: 0.9285, test_f1: 0.5199
 epoch: 34, train_loss: 0.8919, test_loss: 0.9167, test_f1: 0.5338
 epoch: 35, train_loss: 0.8945, test_loss: 0.9131, test_f1: 0.5202
 epoch: 36, train_loss: 0.8897, test_loss: 0.9165, test_f1: 0.5118
 epoch: 37, train_loss: 0.8834, test_loss: 0.9261, test_f1: 0.5154
 epoch: 38, train_loss: 0.8820, test_loss: 0.9190, test_f1: 0.5150
 epoch: 39, train_loss: 0.8727, test_loss: 0.9222, test_f1: 0.5229
 epoch: 40, train_loss: 0.8663, test_loss: 0.9139, test_f1: 0.5174
 epoch: 41, train_loss: 0.8809, test_loss: 0.9170, test_f1: 0.5176
 epoch: 42, train_loss: 0.8741, test_loss: 0.9112, test_f1: 0.5252
 epoch: 43, train_loss: 0.8697, test_loss: 0.9136, test_f1: 0.5282
 epoch: 44, train_loss: 0.8565, test_loss: 0.9145, test_f1: 0.5155
 epoch: 45, train_loss: 0.8572, test_loss: 0.9160, test_f1: 0.5266
 epoch: 46, train_loss: 0.8559, test_loss: 0.9243, test_f1: 0.5279
 epoch: 47, train_loss: 0.8453, test_loss: 0.9233, test_f1: 0.5368
 epoch: 48, train_loss: 0.8484, test_loss: 0.9074, test_f1: 0.5455
 epoch: 49, train_loss: 0.8448, test_loss: 0.9242, test_f1: 0.5411
 epoch: 50, train_loss: 0.8428, test_loss: 0.9302, test_f1: 0.5415
 epoch: 51, train_loss: 0.8408, test_loss: 0.9268, test_f1: 0.5359
 epoch: 52, train_loss: 0.8367, test_loss: 0.9218, test_f1: 0.5410
 epoch: 53, train_loss: 0.8308, test_loss: 0.9218, test_f1: 0.5430
 epoch: 54, train_loss: 0.8353, test_loss: 0.9189, test_f1: 0.5424
 epoch: 55, train_loss: 0.8297, test_loss: 0.9208, test_f1: 0.5408
 epoch: 56, train_loss: 0.8263, test_loss: 0.9158, test_f1: 0.5440
 epoch: 57, train_loss: 0.8293, test_loss: 0.9079, test_f1: 0.5441
 epoch: 58, train_loss: 0.8275, test_loss: 0.9209, test_f1: 0.5468
 epoch: 59, train_loss: 0.8229, test_loss: 0.9244, test_f1: 0.5426
 epoch: 60, train_loss: 0.8274, test_loss: 0.9169, test_f1: 0.5449
 epoch: 61, train_loss: 0.8143, test_loss: 0.9184, test_f1: 0.5475
 epoch: 62, train_loss: 0.8194, test_loss: 0.9303, test_f1: 0.5459
 epoch: 63, train_loss: 0.8192, test_loss: 0.9257, test_f1: 0.5500
 epoch: 64, train_loss: 0.8129, test_loss: 0.9195, test_f1: 0.5439
 epoch: 65, train_loss: 0.8190, test_loss: 0.9192, test_f1: 0.5558
 epoch: 66, train_loss: 0.8112, test_loss: 0.9162, test_f1: 0.5446
 epoch: 67, train_loss: 0.8221, test_loss: 0.9096, test_f1: 0.5589
 epoch: 68, train_loss: 0.8138, test_loss: 0.9185, test_f1: 0.5450
 epoch: 69, train_loss: 0.8175, test_loss: 0.9245, test_f1: 0.5519
 epoch: 70, train_loss: 0.8149, test_loss: 0.9199, test_f1: 0.5578
 epoch: 71, train_loss: 0.8119, test_loss: 0.9255, test_f1: 0.5515
 epoch: 72, train_loss: 0.8046, test_loss: 0.9195, test_f1: 0.5516
 epoch: 73, train_loss: 0.8136, test_loss: 0.9127, test_f1: 0.5432
 epoch: 74, train_loss: 0.7989, test_loss: 0.9124, test_f1: 0.5585
 epoch: 75, train_loss: 0.8036, test_loss: 0.9235, test_f1: 0.5570
 epoch: 76, train_loss: 0.8066, test_loss: 0.9250, test_f1: 0.5480
 epoch: 77, train_loss: 0.8012, test_loss: 0.9296, test_f1: 0.5539
 epoch: 78, train_loss: 0.8050, test_loss: 0.9179, test_f1: 0.5482
 epoch: 79, train_loss: 0.7946, test_loss: 0.9307, test_f1: 0.5670
 epoch: 80, train_loss: 0.7980, test_loss: 0.9308, test_f1: 0.5592
 epoch: 81, train_loss: 0.8040, test_loss: 0.9305, test_f1: 0.5715
 epoch: 82, train_loss: 0.7964, test_loss: 0.9232, test_f1: 0.5714
 epoch: 83, train_loss: 0.7974, test_loss: 0.9360, test_f1: 0.5703
 epoch: 84, train_loss: 0.7961, test_loss: 0.9245, test_f1: 0.5722
 epoch: 85, train_loss: 0.7962, test_loss: 0.9310, test_f1: 0.5682
 epoch: 86, train_loss: 0.7937, test_loss: 0.9291, test_f1: 0.5883
 epoch: 87, train_loss: 0.7894, test_loss: 0.9146, test_f1: 0.5764
 epoch: 88, train_loss: 0.7897, test_loss: 0.9305, test_f1: 0.5716
 epoch: 89, train_loss: 0.7880, test_loss: 0.9319, test_f1: 0.5690
 epoch: 90, train_loss: 0.7814, test_loss: 0.9261, test_f1: 0.5718
 epoch: 91, train_loss: 0.7947, test_loss: 0.9323, test_f1: 0.5718
 epoch: 92, train_loss: 0.7873, test_loss: 0.9218, test_f1: 0.5755
 epoch: 93, train_loss: 0.8004, test_loss: 0.9081, test_f1: 0.5817
 epoch: 94, train_loss: 0.7875, test_loss: 0.9153, test_f1: 0.5735
 epoch: 95, train_loss: 0.7829, test_loss: 0.9302, test_f1: 0.5672
 epoch: 96, train_loss: 0.7845, test_loss: 0.9320, test_f1: 0.5751
 epoch: 97, train_loss: 0.7765, test_loss: 0.9255, test_f1: 0.5797
 epoch: 98, train_loss: 0.7836, test_loss: 0.9361, test_f1: 0.5800
 epoch: 99, train_loss: 0.7751, test_loss: 0.9413, test_f1: 0.5794

Training completed in 642.56 seconds
Best F1: 0.5883 at epoch 86
Mean F1 across iterations: 0.5591  0.0161
========================FINAL RESULTS================================
FEGIN weighted F1: 0.5883  0.0161
python main.py --data ltspice_examples --representation component_net --model FEGIN --layers 4 --hiddens 64 --batch_size 256 --lr 0.0001 --emb_size 250 --epochs 100 --save_appendix component_net_L4_H64_BS256_LR0.0001_E250 --no_val
-----



STDERR:
  File "main.py", line 370, in <module>
    main()
  File "main.py", line 254, in main
    dataset = dataset_class(
  File "/home/philip/projects/llm_inference_code_repo/Circuit-Completion-Using-GNNs/component_classification_with_link_prediction_head/evaluation/FEGIN/kernel/circuit_datasets.py", line 15, in __init__
    self.data, self.slices = torch.load(self.processed_paths[0])
  File "/home/philip/.local/lib/python3.8/site-packages/torch/serialization.py", line 1040, in load
    warnings.warn(
  File "/usr/lib/python3.8/warnings.py", line 109, in _showwarnmsg
    sw(msg.message, msg.category, msg.filename, msg.lineno,
  File "main.py", line 47, in warn_with_traceback
    traceback.print_stack(file=log)
/home/philip/projects/llm_inference_code_repo/Circuit-Completion-Using-GNNs/component_classification_with_link_prediction_head/evaluation/FEGIN/kernel/circuit_datasets.py:15: FutureWarning: You are using `torch.load` with `weights_only=False` (the current default value), which uses the default pickle module implicitly. It is possible to construct malicious pickle data which will execute arbitrary code during unpickling (See https://github.com/pytorch/pytorch/blob/main/SECURITY.md#untrusted-models for more details). In a future release, the default value for `weights_only` will be flipped to `True`. This limits the functions that could be executed during unpickling. Arbitrary objects will no longer be allowed to be loaded via this mode unless they are explicitly allowlisted by the user via `torch.serialization.add_safe_globals`. We recommend you start setting `weights_only=True` for any use case where you don't have full control of the loaded file. Please open an issue on GitHub for any issues related to this experimental feature.
  self.data, self.slices = torch.load(self.processed_paths[0])
