STDOUT:
Results will be saved in /home/philip/projects/llm_inference_code_repo/Circuit-Completion-Using-GNNs/component_classification_with_link_prediction_head/evaluation/FEGIN/results/model_FEGIN_dataset_ltspice_examples
Command line input: python main.py --data ltspice_examples --representation component_net --model FEGIN --layers 4 --hiddens 16 --batch_size 64 --lr 0.01 --emb_size 250 --epochs 100 --save_appendix component_net_L4_H16_BS64_LR0.01_E250 --no_val
 is saved.
-----
ltspice_examples - FEGIN
Using 4 layers, 16 hidden units, h = 2
Loading component_net representation dataset
ENTERED
Training FEGIN on component_net representation
Train: 3558, Test: 846
##################ITERATION #0 ****************************************
 epoch: 0, train_loss: 1.2892, test_loss: 1.1746, test_f1: 0.2836
 epoch: 1, train_loss: 1.1124, test_loss: 1.0944, test_f1: 0.4503
 epoch: 2, train_loss: 1.0636, test_loss: 1.0442, test_f1: 0.4182
 epoch: 3, train_loss: 1.0346, test_loss: 1.0174, test_f1: 0.4933
 epoch: 4, train_loss: 1.0279, test_loss: 1.0328, test_f1: 0.4434
 epoch: 5, train_loss: 1.0067, test_loss: 0.9935, test_f1: 0.4903
 epoch: 6, train_loss: 1.0133, test_loss: 0.9597, test_f1: 0.4701
 epoch: 7, train_loss: 0.9952, test_loss: 1.0263, test_f1: 0.4426
 epoch: 8, train_loss: 0.9800, test_loss: 0.9537, test_f1: 0.5131
 epoch: 9, train_loss: 0.9626, test_loss: 0.9620, test_f1: 0.4565
 epoch: 10, train_loss: 0.9727, test_loss: 1.0606, test_f1: 0.4576
 epoch: 11, train_loss: 0.9706, test_loss: 1.0057, test_f1: 0.4382
 epoch: 12, train_loss: 0.9599, test_loss: 0.9287, test_f1: 0.5105
 epoch: 13, train_loss: 0.9733, test_loss: 0.9478, test_f1: 0.5304
 epoch: 14, train_loss: 0.9667, test_loss: 0.9925, test_f1: 0.4943
 epoch: 15, train_loss: 0.9600, test_loss: 1.0128, test_f1: 0.4753
 epoch: 16, train_loss: 0.9492, test_loss: 0.9720, test_f1: 0.5314
 epoch: 17, train_loss: 0.9554, test_loss: 1.0214, test_f1: 0.4513
 epoch: 18, train_loss: 0.9412, test_loss: 1.0189, test_f1: 0.4819
 epoch: 19, train_loss: 0.9286, test_loss: 0.9802, test_f1: 0.4902
 epoch: 20, train_loss: 0.9310, test_loss: 0.9699, test_f1: 0.5131
 epoch: 21, train_loss: 0.9255, test_loss: 1.0624, test_f1: 0.4938
 epoch: 22, train_loss: 0.9295, test_loss: 0.9904, test_f1: 0.4797
 epoch: 23, train_loss: 0.9180, test_loss: 1.0080, test_f1: 0.4916
 epoch: 24, train_loss: 0.9171, test_loss: 1.0043, test_f1: 0.5039
 epoch: 25, train_loss: 0.9202, test_loss: 1.0651, test_f1: 0.4984
 epoch: 26, train_loss: 0.9243, test_loss: 0.9918, test_f1: 0.5065
 epoch: 27, train_loss: 0.9118, test_loss: 0.9879, test_f1: 0.5158
 epoch: 28, train_loss: 0.9044, test_loss: 0.9660, test_f1: 0.5358
 epoch: 29, train_loss: 0.8996, test_loss: 0.9731, test_f1: 0.5486
 epoch: 30, train_loss: 0.9102, test_loss: 0.9984, test_f1: 0.5052
 epoch: 31, train_loss: 0.9023, test_loss: 0.9908, test_f1: 0.5168
 epoch: 32, train_loss: 0.8969, test_loss: 0.9885, test_f1: 0.5211
 epoch: 33, train_loss: 0.9052, test_loss: 0.9511, test_f1: 0.5368
 epoch: 34, train_loss: 0.8974, test_loss: 0.9457, test_f1: 0.5346
 epoch: 35, train_loss: 0.8838, test_loss: 0.9317, test_f1: 0.5403
 epoch: 36, train_loss: 0.9095, test_loss: 0.9864, test_f1: 0.5270
 epoch: 37, train_loss: 0.8823, test_loss: 0.9298, test_f1: 0.5377
 epoch: 38, train_loss: 0.8754, test_loss: 1.0219, test_f1: 0.5199
 epoch: 39, train_loss: 0.8904, test_loss: 0.9722, test_f1: 0.5469
 epoch: 40, train_loss: 0.8765, test_loss: 0.9260, test_f1: 0.5529
 epoch: 41, train_loss: 0.8832, test_loss: 0.9494, test_f1: 0.5080
 epoch: 42, train_loss: 0.8768, test_loss: 0.9230, test_f1: 0.5478
 epoch: 43, train_loss: 0.8761, test_loss: 0.9351, test_f1: 0.5773
 epoch: 44, train_loss: 0.8729, test_loss: 0.9167, test_f1: 0.5139
 epoch: 45, train_loss: 0.8677, test_loss: 0.9032, test_f1: 0.5276
 epoch: 46, train_loss: 0.8670, test_loss: 0.9025, test_f1: 0.4966
 epoch: 47, train_loss: 0.8639, test_loss: 0.9306, test_f1: 0.5147
 epoch: 48, train_loss: 0.8695, test_loss: 0.9973, test_f1: 0.5213
 epoch: 49, train_loss: 0.8712, test_loss: 0.9410, test_f1: 0.5200
 epoch: 50, train_loss: 0.8613, test_loss: 0.9377, test_f1: 0.5637
 epoch: 51, train_loss: 0.8578, test_loss: 0.9753, test_f1: 0.5396
 epoch: 52, train_loss: 0.8366, test_loss: 0.9642, test_f1: 0.5483
 epoch: 53, train_loss: 0.8361, test_loss: 0.9251, test_f1: 0.5245
 epoch: 54, train_loss: 0.8353, test_loss: 0.9766, test_f1: 0.5816
 epoch: 55, train_loss: 0.8460, test_loss: 0.9622, test_f1: 0.5495
 epoch: 56, train_loss: 0.8314, test_loss: 1.0081, test_f1: 0.5930
 epoch: 57, train_loss: 0.8282, test_loss: 0.9950, test_f1: 0.5141
 epoch: 58, train_loss: 0.8387, test_loss: 0.9758, test_f1: 0.5410
 epoch: 59, train_loss: 0.8320, test_loss: 0.9707, test_f1: 0.5400
 epoch: 60, train_loss: 0.8394, test_loss: 1.0209, test_f1: 0.5465
 epoch: 61, train_loss: 0.8326, test_loss: 0.9624, test_f1: 0.5352
 epoch: 62, train_loss: 0.8314, test_loss: 1.0038, test_f1: 0.5879
 epoch: 63, train_loss: 0.8333, test_loss: 1.0093, test_f1: 0.5674
 epoch: 64, train_loss: 0.8371, test_loss: 0.9476, test_f1: 0.5669
 epoch: 65, train_loss: 0.8259, test_loss: 1.0219, test_f1: 0.5329
 epoch: 66, train_loss: 0.8248, test_loss: 0.8980, test_f1: 0.6109
 epoch: 67, train_loss: 0.8197, test_loss: 0.9026, test_f1: 0.5371
 epoch: 68, train_loss: 0.8305, test_loss: 0.9723, test_f1: 0.5852
 epoch: 69, train_loss: 0.8286, test_loss: 1.0855, test_f1: 0.5110
 epoch: 70, train_loss: 0.8108, test_loss: 0.9746, test_f1: 0.5946
 epoch: 71, train_loss: 0.8102, test_loss: 0.9708, test_f1: 0.5849
 epoch: 72, train_loss: 0.8182, test_loss: 0.9755, test_f1: 0.5948
 epoch: 73, train_loss: 0.7995, test_loss: 0.9709, test_f1: 0.5862
 epoch: 74, train_loss: 0.8068, test_loss: 1.0083, test_f1: 0.6105
 epoch: 75, train_loss: 0.8109, test_loss: 0.9927, test_f1: 0.5997
 epoch: 76, train_loss: 0.8134, test_loss: 0.9862, test_f1: 0.5571
 epoch: 77, train_loss: 0.8011, test_loss: 1.0201, test_f1: 0.5520
 epoch: 78, train_loss: 0.8030, test_loss: 0.9631, test_f1: 0.6134
 epoch: 79, train_loss: 0.8038, test_loss: 0.9696, test_f1: 0.5519
 epoch: 80, train_loss: 0.8110, test_loss: 1.0001, test_f1: 0.5525
 epoch: 81, train_loss: 0.7957, test_loss: 0.9801, test_f1: 0.5717
 epoch: 82, train_loss: 0.8025, test_loss: 0.9729, test_f1: 0.6227
 epoch: 83, train_loss: 0.7993, test_loss: 0.9438, test_f1: 0.5408
 epoch: 84, train_loss: 0.7880, test_loss: 0.9918, test_f1: 0.6066
 epoch: 85, train_loss: 0.8091, test_loss: 1.0252, test_f1: 0.5432
 epoch: 86, train_loss: 0.7954, test_loss: 0.9879, test_f1: 0.6092
 epoch: 87, train_loss: 0.7915, test_loss: 0.9879, test_f1: 0.6110
 epoch: 88, train_loss: 0.8050, test_loss: 1.0609, test_f1: 0.5540
 epoch: 89, train_loss: 0.7961, test_loss: 0.9013, test_f1: 0.5845
 epoch: 90, train_loss: 0.7829, test_loss: 0.9819, test_f1: 0.5902
 epoch: 91, train_loss: 0.8029, test_loss: 0.9596, test_f1: 0.6274
 epoch: 92, train_loss: 0.7917, test_loss: 1.0128, test_f1: 0.5701
 epoch: 93, train_loss: 0.7993, test_loss: 0.9676, test_f1: 0.5991
 epoch: 94, train_loss: 0.7812, test_loss: 0.9828, test_f1: 0.6243
 epoch: 95, train_loss: 0.7962, test_loss: 1.0060, test_f1: 0.6205
 epoch: 96, train_loss: 0.7901, test_loss: 0.9635, test_f1: 0.5734
 epoch: 97, train_loss: 0.7946, test_loss: 0.9951, test_f1: 0.6382
 epoch: 98, train_loss: 0.7821, test_loss: 0.9412, test_f1: 0.6327
 epoch: 99, train_loss: 0.7767, test_loss: 0.9463, test_f1: 0.6225
##################ITERATION #1 ****************************************
 epoch: 0, train_loss: 1.1829, test_loss: 1.0547, test_f1: 0.3510
 epoch: 1, train_loss: 1.0529, test_loss: 1.0904, test_f1: 0.4922
 epoch: 2, train_loss: 1.0243, test_loss: 1.0687, test_f1: 0.4523
 epoch: 3, train_loss: 0.9964, test_loss: 1.0303, test_f1: 0.4875
 epoch: 4, train_loss: 0.9941, test_loss: 1.0400, test_f1: 0.4678
 epoch: 5, train_loss: 0.9831, test_loss: 0.9902, test_f1: 0.4692
 epoch: 6, train_loss: 0.9738, test_loss: 0.9465, test_f1: 0.5045
 epoch: 7, train_loss: 0.9698, test_loss: 1.0893, test_f1: 0.3814
 epoch: 8, train_loss: 0.9611, test_loss: 1.0526, test_f1: 0.4285
 epoch: 9, train_loss: 0.9636, test_loss: 1.0751, test_f1: 0.4607
 epoch: 10, train_loss: 0.9597, test_loss: 0.9960, test_f1: 0.4872
 epoch: 11, train_loss: 0.9506, test_loss: 0.9505, test_f1: 0.5253
 epoch: 12, train_loss: 0.9459, test_loss: 1.0097, test_f1: 0.5008
 epoch: 13, train_loss: 0.9254, test_loss: 1.0382, test_f1: 0.5282
 epoch: 14, train_loss: 0.9423, test_loss: 0.9930, test_f1: 0.4515
 epoch: 15, train_loss: 0.9352, test_loss: 0.9993, test_f1: 0.4911
 epoch: 16, train_loss: 0.9201, test_loss: 1.0413, test_f1: 0.4756
 epoch: 17, train_loss: 0.9203, test_loss: 0.9434, test_f1: 0.4697
 epoch: 18, train_loss: 0.9182, test_loss: 0.9843, test_f1: 0.4766
 epoch: 19, train_loss: 0.9099, test_loss: 0.9732, test_f1: 0.5046
 epoch: 20, train_loss: 0.9024, test_loss: 0.9683, test_f1: 0.5623
 epoch: 21, train_loss: 0.9131, test_loss: 0.9705, test_f1: 0.4803
 epoch: 22, train_loss: 0.9047, test_loss: 0.9470, test_f1: 0.4915
 epoch: 23, train_loss: 0.8952, test_loss: 1.0045, test_f1: 0.5212
 epoch: 24, train_loss: 0.8994, test_loss: 0.9927, test_f1: 0.5440
 epoch: 25, train_loss: 0.8895, test_loss: 1.0009, test_f1: 0.4825
 epoch: 26, train_loss: 0.9032, test_loss: 1.0103, test_f1: 0.4923
 epoch: 27, train_loss: 0.8965, test_loss: 0.9810, test_f1: 0.4538
 epoch: 28, train_loss: 0.8985, test_loss: 0.9874, test_f1: 0.4777
 epoch: 29, train_loss: 0.8870, test_loss: 1.0026, test_f1: 0.4936
 epoch: 30, train_loss: 0.8860, test_loss: 1.0039, test_f1: 0.5343
 epoch: 31, train_loss: 0.8830, test_loss: 1.0062, test_f1: 0.5229
 epoch: 32, train_loss: 0.8740, test_loss: 1.0492, test_f1: 0.4797
 epoch: 33, train_loss: 0.8840, test_loss: 1.0050, test_f1: 0.5809
 epoch: 34, train_loss: 0.8847, test_loss: 1.0227, test_f1: 0.5631
 epoch: 35, train_loss: 0.8908, test_loss: 1.0435, test_f1: 0.4810
 epoch: 36, train_loss: 0.8864, test_loss: 1.0461, test_f1: 0.4798
 epoch: 37, train_loss: 0.8842, test_loss: 1.1307, test_f1: 0.4609
 epoch: 38, train_loss: 0.8878, test_loss: 0.9682, test_f1: 0.4864
 epoch: 39, train_loss: 0.8761, test_loss: 0.9837, test_f1: 0.5199
 epoch: 40, train_loss: 0.8695, test_loss: 1.0650, test_f1: 0.5297
 epoch: 41, train_loss: 0.8713, test_loss: 1.0252, test_f1: 0.4944
 epoch: 42, train_loss: 0.8688, test_loss: 1.0474, test_f1: 0.4788
 epoch: 43, train_loss: 0.8745, test_loss: 1.0527, test_f1: 0.5053
 epoch: 44, train_loss: 0.8651, test_loss: 1.0043, test_f1: 0.4958
 epoch: 45, train_loss: 0.8652, test_loss: 1.0520, test_f1: 0.5523
 epoch: 46, train_loss: 0.8509, test_loss: 1.0237, test_f1: 0.5035
 epoch: 47, train_loss: 0.8668, test_loss: 0.9954, test_f1: 0.5602
 epoch: 48, train_loss: 0.8763, test_loss: 0.9244, test_f1: 0.5378
 epoch: 49, train_loss: 0.8745, test_loss: 1.0442, test_f1: 0.5477
 epoch: 50, train_loss: 0.8554, test_loss: 0.9973, test_f1: 0.5722
 epoch: 51, train_loss: 0.8372, test_loss: 1.0058, test_f1: 0.5071
 epoch: 52, train_loss: 0.8405, test_loss: 0.9761, test_f1: 0.5226
 epoch: 53, train_loss: 0.8253, test_loss: 0.9699, test_f1: 0.5202
 epoch: 54, train_loss: 0.8192, test_loss: 0.9965, test_f1: 0.5466
 epoch: 55, train_loss: 0.8198, test_loss: 0.9797, test_f1: 0.5482
 epoch: 56, train_loss: 0.8105, test_loss: 0.9590, test_f1: 0.5496
 epoch: 57, train_loss: 0.8169, test_loss: 0.9444, test_f1: 0.5736
 epoch: 58, train_loss: 0.8234, test_loss: 1.0382, test_f1: 0.5304
 epoch: 59, train_loss: 0.8120, test_loss: 0.9838, test_f1: 0.5523
 epoch: 60, train_loss: 0.8091, test_loss: 0.9605, test_f1: 0.5405
 epoch: 61, train_loss: 0.8146, test_loss: 0.9507, test_f1: 0.5403
 epoch: 62, train_loss: 0.8108, test_loss: 1.0276, test_f1: 0.5121
 epoch: 63, train_loss: 0.8082, test_loss: 0.9692, test_f1: 0.5448
 epoch: 64, train_loss: 0.7948, test_loss: 1.0204, test_f1: 0.5756
 epoch: 65, train_loss: 0.7961, test_loss: 0.9478, test_f1: 0.5900
 epoch: 66, train_loss: 0.7999, test_loss: 0.9953, test_f1: 0.5368
 epoch: 67, train_loss: 0.7874, test_loss: 0.9604, test_f1: 0.5962
 epoch: 68, train_loss: 0.8037, test_loss: 0.9926, test_f1: 0.5567
 epoch: 69, train_loss: 0.8014, test_loss: 0.9530, test_f1: 0.5531
 epoch: 70, train_loss: 0.7928, test_loss: 1.0074, test_f1: 0.5764
 epoch: 71, train_loss: 0.8025, test_loss: 0.9426, test_f1: 0.5857
 epoch: 72, train_loss: 0.7892, test_loss: 0.9450, test_f1: 0.5621
 epoch: 73, train_loss: 0.7903, test_loss: 0.9124, test_f1: 0.5958
 epoch: 74, train_loss: 0.7986, test_loss: 0.9613, test_f1: 0.5621
 epoch: 75, train_loss: 0.7778, test_loss: 1.0336, test_f1: 0.5662
 epoch: 76, train_loss: 0.8087, test_loss: 0.9708, test_f1: 0.5687
 epoch: 77, train_loss: 0.7869, test_loss: 0.9938, test_f1: 0.5680
 epoch: 78, train_loss: 0.7851, test_loss: 0.9790, test_f1: 0.5955
 epoch: 79, train_loss: 0.7773, test_loss: 0.9670, test_f1: 0.6158
 epoch: 80, train_loss: 0.7868, test_loss: 0.9423, test_f1: 0.6026
 epoch: 81, train_loss: 0.7859, test_loss: 0.9896, test_f1: 0.5866
 epoch: 82, train_loss: 0.7805, test_loss: 0.9918, test_f1: 0.5866
 epoch: 83, train_loss: 0.7901, test_loss: 0.9423, test_f1: 0.6253
 epoch: 84, train_loss: 0.7760, test_loss: 0.9396, test_f1: 0.6128
 epoch: 85, train_loss: 0.7777, test_loss: 0.9777, test_f1: 0.5928
 epoch: 86, train_loss: 0.7755, test_loss: 0.9854, test_f1: 0.5815
 epoch: 87, train_loss: 0.7904, test_loss: 0.9487, test_f1: 0.6062
 epoch: 88, train_loss: 0.7770, test_loss: 0.9538, test_f1: 0.5830
 epoch: 89, train_loss: 0.7618, test_loss: 1.0063, test_f1: 0.5972
 epoch: 90, train_loss: 0.7654, test_loss: 1.0905, test_f1: 0.5741
 epoch: 91, train_loss: 0.7760, test_loss: 1.0103, test_f1: 0.5775
 epoch: 92, train_loss: 0.7646, test_loss: 0.9596, test_f1: 0.6021
 epoch: 93, train_loss: 0.7803, test_loss: 0.9498, test_f1: 0.5618
 epoch: 94, train_loss: 0.7762, test_loss: 0.9082, test_f1: 0.5771
 epoch: 95, train_loss: 0.7625, test_loss: 0.9476, test_f1: 0.6049
 epoch: 96, train_loss: 0.7677, test_loss: 1.0109, test_f1: 0.5983
 epoch: 97, train_loss: 0.7681, test_loss: 1.0394, test_f1: 0.5771
 epoch: 98, train_loss: 0.7573, test_loss: 0.9190, test_f1: 0.6208
 epoch: 99, train_loss: 0.7584, test_loss: 0.9596, test_f1: 0.6123
##################ITERATION #2 ****************************************
 epoch: 0, train_loss: 1.2143, test_loss: 1.0791, test_f1: 0.3728
 epoch: 1, train_loss: 1.0877, test_loss: 1.0634, test_f1: 0.4288
 epoch: 2, train_loss: 1.0296, test_loss: 1.0565, test_f1: 0.4819
 epoch: 3, train_loss: 0.9992, test_loss: 1.0578, test_f1: 0.4567
 epoch: 4, train_loss: 0.9921, test_loss: 1.0148, test_f1: 0.4802
 epoch: 5, train_loss: 0.9879, test_loss: 1.0325, test_f1: 0.5122
 epoch: 6, train_loss: 0.9828, test_loss: 0.9444, test_f1: 0.4752
 epoch: 7, train_loss: 0.9654, test_loss: 1.0606, test_f1: 0.5136
 epoch: 8, train_loss: 0.9673, test_loss: 0.9702, test_f1: 0.5462
 epoch: 9, train_loss: 0.9472, test_loss: 0.9938, test_f1: 0.4682
 epoch: 10, train_loss: 0.9300, test_loss: 0.9634, test_f1: 0.4627
 epoch: 11, train_loss: 0.9351, test_loss: 1.0025, test_f1: 0.4643
 epoch: 12, train_loss: 0.9337, test_loss: 0.9664, test_f1: 0.5223
 epoch: 13, train_loss: 0.9311, test_loss: 0.9708, test_f1: 0.5188
 epoch: 14, train_loss: 0.9314, test_loss: 1.0507, test_f1: 0.4957
 epoch: 15, train_loss: 0.9153, test_loss: 1.0480, test_f1: 0.4945
 epoch: 16, train_loss: 0.9211, test_loss: 0.9599, test_f1: 0.5462
 epoch: 17, train_loss: 0.9221, test_loss: 1.0026, test_f1: 0.4722
 epoch: 18, train_loss: 0.9203, test_loss: 1.0011, test_f1: 0.5647
 epoch: 19, train_loss: 0.9121, test_loss: 1.0751, test_f1: 0.4792
 epoch: 20, train_loss: 0.9004, test_loss: 0.9847, test_f1: 0.5585
 epoch: 21, train_loss: 0.9039, test_loss: 1.0355, test_f1: 0.4989
 epoch: 22, train_loss: 0.9059, test_loss: 0.9960, test_f1: 0.5530
 epoch: 23, train_loss: 0.8948, test_loss: 0.9722, test_f1: 0.4855
 epoch: 24, train_loss: 0.8840, test_loss: 1.0015, test_f1: 0.4893
 epoch: 25, train_loss: 0.8896, test_loss: 0.9263, test_f1: 0.4982
 epoch: 26, train_loss: 0.8913, test_loss: 0.9385, test_f1: 0.5474
 epoch: 27, train_loss: 0.8866, test_loss: 1.0562, test_f1: 0.4734
 epoch: 28, train_loss: 0.8745, test_loss: 0.9950, test_f1: 0.4938
 epoch: 29, train_loss: 0.8786, test_loss: 0.9989, test_f1: 0.5168
 epoch: 30, train_loss: 0.8705, test_loss: 0.9672, test_f1: 0.5166
 epoch: 31, train_loss: 0.8857, test_loss: 0.9977, test_f1: 0.5106
 epoch: 32, train_loss: 0.8762, test_loss: 0.9257, test_f1: 0.5071
 epoch: 33, train_loss: 0.8694, test_loss: 0.9698, test_f1: 0.4905
 epoch: 34, train_loss: 0.8663, test_loss: 0.9841, test_f1: 0.5544
 epoch: 35, train_loss: 0.8544, test_loss: 0.9694, test_f1: 0.4919
 epoch: 36, train_loss: 0.8599, test_loss: 0.9754, test_f1: 0.5074
 epoch: 37, train_loss: 0.8526, test_loss: 1.0652, test_f1: 0.4873
 epoch: 38, train_loss: 0.8560, test_loss: 0.9921, test_f1: 0.4768
 epoch: 39, train_loss: 0.8595, test_loss: 0.9515, test_f1: 0.5173
 epoch: 40, train_loss: 0.8621, test_loss: 0.9425, test_f1: 0.5670
 epoch: 41, train_loss: 0.8627, test_loss: 1.0557, test_f1: 0.5107
 epoch: 42, train_loss: 0.8520, test_loss: 0.9880, test_f1: 0.5384
 epoch: 43, train_loss: 0.8575, test_loss: 0.9731, test_f1: 0.5159
 epoch: 44, train_loss: 0.8567, test_loss: 1.0189, test_f1: 0.5099
 epoch: 45, train_loss: 0.8381, test_loss: 0.9671, test_f1: 0.5701
 epoch: 46, train_loss: 0.8360, test_loss: 1.0171, test_f1: 0.5089
 epoch: 47, train_loss: 0.8446, test_loss: 0.9213, test_f1: 0.5445
 epoch: 48, train_loss: 0.8448, test_loss: 1.0175, test_f1: 0.5420
 epoch: 49, train_loss: 0.8263, test_loss: 1.0066, test_f1: 0.5245
 epoch: 50, train_loss: 0.8513, test_loss: 0.9826, test_f1: 0.5412
 epoch: 51, train_loss: 0.8268, test_loss: 0.9578, test_f1: 0.5841
 epoch: 52, train_loss: 0.8125, test_loss: 0.9481, test_f1: 0.5309
 epoch: 53, train_loss: 0.8047, test_loss: 0.9786, test_f1: 0.5584
 epoch: 54, train_loss: 0.7912, test_loss: 1.0122, test_f1: 0.5228
 epoch: 55, train_loss: 0.7939, test_loss: 0.9835, test_f1: 0.5962
 epoch: 56, train_loss: 0.7995, test_loss: 1.0144, test_f1: 0.5385
 epoch: 57, train_loss: 0.7831, test_loss: 0.9937, test_f1: 0.5778
 epoch: 58, train_loss: 0.7883, test_loss: 0.9904, test_f1: 0.5881
 epoch: 59, train_loss: 0.7862, test_loss: 0.9993, test_f1: 0.5607
 epoch: 60, train_loss: 0.7894, test_loss: 1.0035, test_f1: 0.5624
 epoch: 61, train_loss: 0.7857, test_loss: 0.9992, test_f1: 0.5752
 epoch: 62, train_loss: 0.7983, test_loss: 0.9874, test_f1: 0.5948
 epoch: 63, train_loss: 0.7763, test_loss: 0.9788, test_f1: 0.5377
 epoch: 64, train_loss: 0.7795, test_loss: 0.9675, test_f1: 0.5348
 epoch: 65, train_loss: 0.7716, test_loss: 0.9703, test_f1: 0.6037
 epoch: 66, train_loss: 0.7753, test_loss: 0.9778, test_f1: 0.5808
 epoch: 67, train_loss: 0.7820, test_loss: 0.9626, test_f1: 0.5821
 epoch: 68, train_loss: 0.7640, test_loss: 0.9652, test_f1: 0.6072
 epoch: 69, train_loss: 0.7844, test_loss: 1.0095, test_f1: 0.5643
 epoch: 70, train_loss: 0.7650, test_loss: 0.9858, test_f1: 0.5932
 epoch: 71, train_loss: 0.7725, test_loss: 1.0044, test_f1: 0.6143
 epoch: 72, train_loss: 0.7712, test_loss: 0.9862, test_f1: 0.5665
 epoch: 73, train_loss: 0.7752, test_loss: 0.9970, test_f1: 0.5989
 epoch: 74, train_loss: 0.7693, test_loss: 0.9964, test_f1: 0.6163
 epoch: 75, train_loss: 0.7563, test_loss: 0.9638, test_f1: 0.5746
 epoch: 76, train_loss: 0.7693, test_loss: 0.9946, test_f1: 0.5911
 epoch: 77, train_loss: 0.7646, test_loss: 0.9728, test_f1: 0.5940
 epoch: 78, train_loss: 0.7695, test_loss: 0.9825, test_f1: 0.6061
 epoch: 79, train_loss: 0.7708, test_loss: 0.9864, test_f1: 0.5897
 epoch: 80, train_loss: 0.7420, test_loss: 0.9664, test_f1: 0.5994
 epoch: 81, train_loss: 0.7521, test_loss: 0.9018, test_f1: 0.6067
 epoch: 82, train_loss: 0.7613, test_loss: 1.0029, test_f1: 0.5917
 epoch: 83, train_loss: 0.7782, test_loss: 1.0610, test_f1: 0.6124
 epoch: 84, train_loss: 0.7716, test_loss: 0.9610, test_f1: 0.6190
 epoch: 85, train_loss: 0.7348, test_loss: 0.9896, test_f1: 0.6152
 epoch: 86, train_loss: 0.7631, test_loss: 1.0375, test_f1: 0.6176
 epoch: 87, train_loss: 0.7436, test_loss: 0.9888, test_f1: 0.6312
 epoch: 88, train_loss: 0.7530, test_loss: 0.9516, test_f1: 0.6064
 epoch: 89, train_loss: 0.7457, test_loss: 0.9571, test_f1: 0.6465
 epoch: 90, train_loss: 0.7416, test_loss: 0.9102, test_f1: 0.6360
 epoch: 91, train_loss: 0.7521, test_loss: 0.9500, test_f1: 0.6209
 epoch: 92, train_loss: 0.7331, test_loss: 0.9504, test_f1: 0.6083
 epoch: 93, train_loss: 0.7379, test_loss: 0.9749, test_f1: 0.6309
 epoch: 94, train_loss: 0.7332, test_loss: 0.9830, test_f1: 0.6032
 epoch: 95, train_loss: 0.7368, test_loss: 0.9844, test_f1: 0.6016
 epoch: 96, train_loss: 0.7360, test_loss: 0.9830, test_f1: 0.5983
 epoch: 97, train_loss: 0.7302, test_loss: 0.9247, test_f1: 0.6224
 epoch: 98, train_loss: 0.7329, test_loss: 0.9759, test_f1: 0.6215
 epoch: 99, train_loss: 0.7395, test_loss: 1.0151, test_f1: 0.5807
##################ITERATION #3 ****************************************
 epoch: 0, train_loss: 1.2374, test_loss: 1.1434, test_f1: 0.3833
 epoch: 1, train_loss: 1.0992, test_loss: 1.0547, test_f1: 0.4145
 epoch: 2, train_loss: 1.0507, test_loss: 1.0872, test_f1: 0.4525
 epoch: 3, train_loss: 1.0339, test_loss: 1.0523, test_f1: 0.4625
 epoch: 4, train_loss: 1.0153, test_loss: 1.0337, test_f1: 0.4587
 epoch: 5, train_loss: 0.9889, test_loss: 1.0262, test_f1: 0.5223
 epoch: 6, train_loss: 0.9998, test_loss: 1.0446, test_f1: 0.4132
 epoch: 7, train_loss: 0.9833, test_loss: 1.0537, test_f1: 0.4673
 epoch: 8, train_loss: 0.9778, test_loss: 1.0042, test_f1: 0.4416
 epoch: 9, train_loss: 0.9642, test_loss: 0.9667, test_f1: 0.4808
 epoch: 10, train_loss: 0.9580, test_loss: 0.9779, test_f1: 0.5389
 epoch: 11, train_loss: 0.9627, test_loss: 0.9713, test_f1: 0.4648
 epoch: 12, train_loss: 0.9490, test_loss: 0.9941, test_f1: 0.4655
 epoch: 13, train_loss: 0.9432, test_loss: 1.0207, test_f1: 0.4617
 epoch: 14, train_loss: 0.9394, test_loss: 0.9481, test_f1: 0.4904
 epoch: 15, train_loss: 0.9280, test_loss: 0.9689, test_f1: 0.5179
 epoch: 16, train_loss: 0.9258, test_loss: 0.9225, test_f1: 0.5238
 epoch: 17, train_loss: 0.9073, test_loss: 0.9582, test_f1: 0.4999
 epoch: 18, train_loss: 0.9278, test_loss: 0.9777, test_f1: 0.5128
 epoch: 19, train_loss: 0.9181, test_loss: 0.9893, test_f1: 0.4940
 epoch: 20, train_loss: 0.9214, test_loss: 0.8820, test_f1: 0.5121
 epoch: 21, train_loss: 0.9194, test_loss: 0.9525, test_f1: 0.4900
 epoch: 22, train_loss: 0.9044, test_loss: 0.9444, test_f1: 0.5307
 epoch: 23, train_loss: 0.9037, test_loss: 0.9603, test_f1: 0.5407
 epoch: 24, train_loss: 0.8962, test_loss: 0.9710, test_f1: 0.5220
 epoch: 25, train_loss: 0.9007, test_loss: 0.9807, test_f1: 0.5134
 epoch: 26, train_loss: 0.9050, test_loss: 0.9453, test_f1: 0.5277
 epoch: 27, train_loss: 0.8856, test_loss: 0.9957, test_f1: 0.5282
 epoch: 28, train_loss: 0.8700, test_loss: 0.8536, test_f1: 0.5259
 epoch: 29, train_loss: 0.8949, test_loss: 0.9752, test_f1: 0.5350
 epoch: 30, train_loss: 0.8791, test_loss: 0.9210, test_f1: 0.5182
 epoch: 31, train_loss: 0.8644, test_loss: 0.9190, test_f1: 0.5645
 epoch: 32, train_loss: 0.8653, test_loss: 0.9762, test_f1: 0.5143
 epoch: 33, train_loss: 0.8680, test_loss: 0.9482, test_f1: 0.5331
 epoch: 34, train_loss: 0.8615, test_loss: 0.9321, test_f1: 0.5327
 epoch: 35, train_loss: 0.8573, test_loss: 0.9180, test_f1: 0.5345
 epoch: 36, train_loss: 0.8596, test_loss: 0.9092, test_f1: 0.5768
 epoch: 37, train_loss: 0.8567, test_loss: 0.9492, test_f1: 0.5293
 epoch: 38, train_loss: 0.8476, test_loss: 0.9021, test_f1: 0.5484
 epoch: 39, train_loss: 0.8380, test_loss: 0.9375, test_f1: 0.5377
 epoch: 40, train_loss: 0.8518, test_loss: 0.9836, test_f1: 0.5150
 epoch: 41, train_loss: 0.8368, test_loss: 0.9025, test_f1: 0.5354
 epoch: 42, train_loss: 0.8476, test_loss: 0.9171, test_f1: 0.5408
 epoch: 43, train_loss: 0.8411, test_loss: 0.9259, test_f1: 0.5392
 epoch: 44, train_loss: 0.8398, test_loss: 0.8976, test_f1: 0.5632
 epoch: 45, train_loss: 0.8439, test_loss: 0.9226, test_f1: 0.5932
 epoch: 46, train_loss: 0.8422, test_loss: 0.9390, test_f1: 0.5278
 epoch: 47, train_loss: 0.8341, test_loss: 0.8951, test_f1: 0.5584
 epoch: 48, train_loss: 0.8331, test_loss: 0.9579, test_f1: 0.5717
 epoch: 49, train_loss: 0.8226, test_loss: 0.9275, test_f1: 0.5968
 epoch: 50, train_loss: 0.8290, test_loss: 0.9199, test_f1: 0.5909
 epoch: 51, train_loss: 0.8085, test_loss: 0.8684, test_f1: 0.5534
 epoch: 52, train_loss: 0.7914, test_loss: 0.8859, test_f1: 0.5863
 epoch: 53, train_loss: 0.7853, test_loss: 0.8865, test_f1: 0.6006
 epoch: 54, train_loss: 0.7804, test_loss: 0.8806, test_f1: 0.5924
 epoch: 55, train_loss: 0.7758, test_loss: 0.9035, test_f1: 0.5895
 epoch: 56, train_loss: 0.7873, test_loss: 0.9020, test_f1: 0.5580
 epoch: 57, train_loss: 0.7866, test_loss: 0.9030, test_f1: 0.6094
 epoch: 58, train_loss: 0.7713, test_loss: 0.9294, test_f1: 0.5819
 epoch: 59, train_loss: 0.7845, test_loss: 0.9338, test_f1: 0.5509
 epoch: 60, train_loss: 0.7705, test_loss: 0.9278, test_f1: 0.5964
 epoch: 61, train_loss: 0.7792, test_loss: 0.9360, test_f1: 0.5830
 epoch: 62, train_loss: 0.7781, test_loss: 0.9004, test_f1: 0.5892
 epoch: 63, train_loss: 0.7704, test_loss: 0.9255, test_f1: 0.6043
 epoch: 64, train_loss: 0.7776, test_loss: 0.9497, test_f1: 0.5959
 epoch: 65, train_loss: 0.7583, test_loss: 0.9221, test_f1: 0.6075
 epoch: 66, train_loss: 0.7697, test_loss: 0.9678, test_f1: 0.5651
 epoch: 67, train_loss: 0.7632, test_loss: 0.9543, test_f1: 0.5821
 epoch: 68, train_loss: 0.7701, test_loss: 0.9346, test_f1: 0.6297
 epoch: 69, train_loss: 0.7824, test_loss: 0.9475, test_f1: 0.6018
 epoch: 70, train_loss: 0.7723, test_loss: 0.9236, test_f1: 0.6107
 epoch: 71, train_loss: 0.7592, test_loss: 0.8982, test_f1: 0.5899
 epoch: 72, train_loss: 0.7681, test_loss: 0.8845, test_f1: 0.5794
 epoch: 73, train_loss: 0.7638, test_loss: 0.8962, test_f1: 0.5826
 epoch: 74, train_loss: 0.7736, test_loss: 0.9532, test_f1: 0.5987
 epoch: 75, train_loss: 0.7498, test_loss: 0.8871, test_f1: 0.6283
 epoch: 76, train_loss: 0.7461, test_loss: 0.9150, test_f1: 0.6092
 epoch: 77, train_loss: 0.7468, test_loss: 0.9604, test_f1: 0.5927
 epoch: 78, train_loss: 0.7432, test_loss: 0.9122, test_f1: 0.5742
 epoch: 79, train_loss: 0.7526, test_loss: 0.9391, test_f1: 0.6132
 epoch: 80, train_loss: 0.7520, test_loss: 0.9274, test_f1: 0.6208
 epoch: 81, train_loss: 0.7463, test_loss: 0.9088, test_f1: 0.6054
 epoch: 82, train_loss: 0.7593, test_loss: 0.9257, test_f1: 0.6171
 epoch: 83, train_loss: 0.7462, test_loss: 0.9073, test_f1: 0.5968
 epoch: 84, train_loss: 0.7621, test_loss: 0.9395, test_f1: 0.5985
 epoch: 85, train_loss: 0.7535, test_loss: 1.0071, test_f1: 0.5892
 epoch: 86, train_loss: 0.7453, test_loss: 0.9851, test_f1: 0.5912
 epoch: 87, train_loss: 0.7574, test_loss: 1.0254, test_f1: 0.5796
 epoch: 88, train_loss: 0.7712, test_loss: 0.9118, test_f1: 0.6142
 epoch: 89, train_loss: 0.7514, test_loss: 1.0096, test_f1: 0.5744
 epoch: 90, train_loss: 0.7455, test_loss: 0.9740, test_f1: 0.6258
 epoch: 91, train_loss: 0.7465, test_loss: 0.9670, test_f1: 0.6094
 epoch: 92, train_loss: 0.7346, test_loss: 0.9525, test_f1: 0.6295
 epoch: 93, train_loss: 0.7441, test_loss: 0.9254, test_f1: 0.6241
 epoch: 94, train_loss: 0.7387, test_loss: 0.9489, test_f1: 0.6379
 epoch: 95, train_loss: 0.7413, test_loss: 0.9675, test_f1: 0.6217
 epoch: 96, train_loss: 0.7440, test_loss: 0.9741, test_f1: 0.6045
 epoch: 97, train_loss: 0.7174, test_loss: 1.0070, test_f1: 0.6483
 epoch: 98, train_loss: 0.7459, test_loss: 0.9489, test_f1: 0.6203
 epoch: 99, train_loss: 0.7288, test_loss: 0.9822, test_f1: 0.5944
##################ITERATION #4 ****************************************
 epoch: 0, train_loss: 1.1925, test_loss: 1.0503, test_f1: 0.4504
 epoch: 1, train_loss: 1.0655, test_loss: 1.1190, test_f1: 0.4593
 epoch: 2, train_loss: 1.0341, test_loss: 1.0539, test_f1: 0.4773
 epoch: 3, train_loss: 1.0120, test_loss: 1.0075, test_f1: 0.4598
 epoch: 4, train_loss: 0.9933, test_loss: 1.0624, test_f1: 0.5164
 epoch: 5, train_loss: 0.9927, test_loss: 1.0767, test_f1: 0.4978
 epoch: 6, train_loss: 0.9800, test_loss: 1.0546, test_f1: 0.4960
 epoch: 7, train_loss: 0.9772, test_loss: 0.9665, test_f1: 0.4682
 epoch: 8, train_loss: 0.9657, test_loss: 0.9579, test_f1: 0.4658
 epoch: 9, train_loss: 0.9539, test_loss: 0.9311, test_f1: 0.5077
 epoch: 10, train_loss: 0.9615, test_loss: 1.0444, test_f1: 0.5058
 epoch: 11, train_loss: 0.9452, test_loss: 0.9464, test_f1: 0.4882
 epoch: 12, train_loss: 0.9416, test_loss: 1.0327, test_f1: 0.5279
 epoch: 13, train_loss: 0.9436, test_loss: 1.0034, test_f1: 0.4607
 epoch: 14, train_loss: 0.9786, test_loss: 0.9977, test_f1: 0.4931
 epoch: 15, train_loss: 0.9574, test_loss: 1.0024, test_f1: 0.4931
 epoch: 16, train_loss: 0.9438, test_loss: 0.9881, test_f1: 0.5710
 epoch: 17, train_loss: 0.9374, test_loss: 0.9911, test_f1: 0.4989
 epoch: 18, train_loss: 0.9326, test_loss: 1.0014, test_f1: 0.5005
 epoch: 19, train_loss: 0.9326, test_loss: 0.9573, test_f1: 0.5167
 epoch: 20, train_loss: 0.9242, test_loss: 0.9723, test_f1: 0.5538
 epoch: 21, train_loss: 0.9132, test_loss: 0.9751, test_f1: 0.5369
 epoch: 22, train_loss: 0.9096, test_loss: 1.0340, test_f1: 0.4863
 epoch: 23, train_loss: 0.9178, test_loss: 0.9878, test_f1: 0.4932
 epoch: 24, train_loss: 0.9143, test_loss: 1.0297, test_f1: 0.4976
 epoch: 25, train_loss: 0.9138, test_loss: 0.9283, test_f1: 0.5326
 epoch: 26, train_loss: 0.9048, test_loss: 0.9989, test_f1: 0.5108
 epoch: 27, train_loss: 0.8981, test_loss: 0.9710, test_f1: 0.5020
 epoch: 28, train_loss: 0.8872, test_loss: 0.9955, test_f1: 0.5121
 epoch: 29, train_loss: 0.8953, test_loss: 0.9644, test_f1: 0.5154
 epoch: 30, train_loss: 0.9243, test_loss: 0.9954, test_f1: 0.5145
 epoch: 31, train_loss: 0.9010, test_loss: 0.9837, test_f1: 0.5526
 epoch: 32, train_loss: 0.8940, test_loss: 0.9776, test_f1: 0.5060
 epoch: 33, train_loss: 0.9051, test_loss: 1.0427, test_f1: 0.4695
 epoch: 34, train_loss: 0.8828, test_loss: 0.9936, test_f1: 0.4990
 epoch: 35, train_loss: 0.8881, test_loss: 0.9635, test_f1: 0.5559
 epoch: 36, train_loss: 0.8838, test_loss: 0.9725, test_f1: 0.5432
 epoch: 37, train_loss: 0.8689, test_loss: 0.9695, test_f1: 0.5441
 epoch: 38, train_loss: 0.8730, test_loss: 0.9918, test_f1: 0.5302
 epoch: 39, train_loss: 0.8801, test_loss: 1.0258, test_f1: 0.5599
 epoch: 40, train_loss: 0.8754, test_loss: 1.0088, test_f1: 0.5131
 epoch: 41, train_loss: 0.8833, test_loss: 1.0088, test_f1: 0.5405
 epoch: 42, train_loss: 0.8743, test_loss: 1.0120, test_f1: 0.5126
 epoch: 43, train_loss: 0.8772, test_loss: 0.9999, test_f1: 0.5642
 epoch: 44, train_loss: 0.8818, test_loss: 0.9814, test_f1: 0.5268
 epoch: 45, train_loss: 0.8619, test_loss: 1.0038, test_f1: 0.5687
 epoch: 46, train_loss: 0.8528, test_loss: 0.9880, test_f1: 0.5217
 epoch: 47, train_loss: 0.8696, test_loss: 1.0457, test_f1: 0.5573
 epoch: 48, train_loss: 0.8889, test_loss: 1.0152, test_f1: 0.5195
 epoch: 49, train_loss: 0.8739, test_loss: 0.9979, test_f1: 0.5629
 epoch: 50, train_loss: 0.8735, test_loss: 1.0213, test_f1: 0.5288
 epoch: 51, train_loss: 0.8630, test_loss: 1.0360, test_f1: 0.5097
 epoch: 52, train_loss: 0.8431, test_loss: 0.9873, test_f1: 0.5748
 epoch: 53, train_loss: 0.8410, test_loss: 0.9987, test_f1: 0.5427
 epoch: 54, train_loss: 0.8381, test_loss: 1.0093, test_f1: 0.5485
 epoch: 55, train_loss: 0.8345, test_loss: 0.9980, test_f1: 0.5051
 epoch: 56, train_loss: 0.8331, test_loss: 1.0055, test_f1: 0.5452
 epoch: 57, train_loss: 0.8375, test_loss: 0.9682, test_f1: 0.5514
 epoch: 58, train_loss: 0.8218, test_loss: 0.9647, test_f1: 0.5561
 epoch: 59, train_loss: 0.8398, test_loss: 0.9234, test_f1: 0.5412
 epoch: 60, train_loss: 0.8409, test_loss: 0.9896, test_f1: 0.5254
 epoch: 61, train_loss: 0.8360, test_loss: 0.9754, test_f1: 0.5436
 epoch: 62, train_loss: 0.8339, test_loss: 0.9909, test_f1: 0.5502
 epoch: 63, train_loss: 0.8228, test_loss: 0.9971, test_f1: 0.5561
 epoch: 64, train_loss: 0.8380, test_loss: 0.9962, test_f1: 0.5439
 epoch: 65, train_loss: 0.8173, test_loss: 0.9420, test_f1: 0.5947
 epoch: 66, train_loss: 0.8231, test_loss: 0.9604, test_f1: 0.5965
 epoch: 67, train_loss: 0.8342, test_loss: 1.0071, test_f1: 0.5882
 epoch: 68, train_loss: 0.8283, test_loss: 1.0030, test_f1: 0.5947
 epoch: 69, train_loss: 0.8214, test_loss: 0.9957, test_f1: 0.6082
 epoch: 70, train_loss: 0.8173, test_loss: 0.9848, test_f1: 0.5853
 epoch: 71, train_loss: 0.8072, test_loss: 0.9631, test_f1: 0.6042
 epoch: 72, train_loss: 0.8137, test_loss: 0.9608, test_f1: 0.5862
 epoch: 73, train_loss: 0.8244, test_loss: 0.9855, test_f1: 0.5573
 epoch: 74, train_loss: 0.8082, test_loss: 0.9793, test_f1: 0.6075
 epoch: 75, train_loss: 0.8191, test_loss: 0.9796, test_f1: 0.5667
 epoch: 76, train_loss: 0.7972, test_loss: 0.9980, test_f1: 0.5810
 epoch: 77, train_loss: 0.8102, test_loss: 1.0098, test_f1: 0.5835
 epoch: 78, train_loss: 0.8150, test_loss: 0.9580, test_f1: 0.6029
 epoch: 79, train_loss: 0.8160, test_loss: 0.9564, test_f1: 0.6023
 epoch: 80, train_loss: 0.8037, test_loss: 0.9984, test_f1: 0.5653
 epoch: 81, train_loss: 0.8104, test_loss: 0.9866, test_f1: 0.6004
 epoch: 82, train_loss: 0.8056, test_loss: 0.9742, test_f1: 0.5952
 epoch: 83, train_loss: 0.8033, test_loss: 0.9701, test_f1: 0.5883
 epoch: 84, train_loss: 0.8115, test_loss: 0.9502, test_f1: 0.5698
 epoch: 85, train_loss: 0.8057, test_loss: 0.9903, test_f1: 0.5780
 epoch: 86, train_loss: 0.8041, test_loss: 0.9642, test_f1: 0.6115
 epoch: 87, train_loss: 0.8127, test_loss: 0.9778, test_f1: 0.5758
 epoch: 88, train_loss: 0.7984, test_loss: 0.9736, test_f1: 0.5792
 epoch: 89, train_loss: 0.8034, test_loss: 0.9878, test_f1: 0.5722
 epoch: 90, train_loss: 0.8014, test_loss: 0.9860, test_f1: 0.5750
 epoch: 91, train_loss: 0.7999, test_loss: 1.0039, test_f1: 0.5611
 epoch: 92, train_loss: 0.8001, test_loss: 0.9527, test_f1: 0.5847
 epoch: 93, train_loss: 0.7982, test_loss: 0.9595, test_f1: 0.5777
 epoch: 94, train_loss: 0.7976, test_loss: 0.9426, test_f1: 0.5852
 epoch: 95, train_loss: 0.7982, test_loss: 0.9982, test_f1: 0.5925
 epoch: 96, train_loss: 0.7963, test_loss: 0.9678, test_f1: 0.6062
 epoch: 97, train_loss: 0.7964, test_loss: 0.9421, test_f1: 0.6065
 epoch: 98, train_loss: 0.7911, test_loss: 0.9631, test_f1: 0.5829
 epoch: 99, train_loss: 0.7905, test_loss: 0.9824, test_f1: 0.5926
##################ITERATION #5 ****************************************
 epoch: 0, train_loss: 1.1954, test_loss: 1.0914, test_f1: 0.3916
 epoch: 1, train_loss: 1.0672, test_loss: 1.0951, test_f1: 0.4621
 epoch: 2, train_loss: 1.0637, test_loss: 1.0913, test_f1: 0.4645
 epoch: 3, train_loss: 1.0167, test_loss: 1.0342, test_f1: 0.4337
 epoch: 4, train_loss: 1.0198, test_loss: 0.9935, test_f1: 0.3965
 epoch: 5, train_loss: 0.9957, test_loss: 1.0305, test_f1: 0.4660
 epoch: 6, train_loss: 0.9942, test_loss: 0.9790, test_f1: 0.4665
 epoch: 7, train_loss: 0.9885, test_loss: 0.9840, test_f1: 0.5070
 epoch: 8, train_loss: 0.9742, test_loss: 0.9449, test_f1: 0.4826
 epoch: 9, train_loss: 0.9784, test_loss: 0.9093, test_f1: 0.5611
 epoch: 10, train_loss: 0.9534, test_loss: 0.9027, test_f1: 0.5414
 epoch: 11, train_loss: 0.9439, test_loss: 1.0223, test_f1: 0.5182
 epoch: 12, train_loss: 0.9265, test_loss: 0.9495, test_f1: 0.5120
 epoch: 13, train_loss: 0.9312, test_loss: 1.1153, test_f1: 0.4537
 epoch: 14, train_loss: 0.9412, test_loss: 0.9675, test_f1: 0.4796
 epoch: 15, train_loss: 0.9408, test_loss: 0.9745, test_f1: 0.5042
 epoch: 16, train_loss: 0.9274, test_loss: 0.9998, test_f1: 0.4844
 epoch: 17, train_loss: 0.9322, test_loss: 0.9435, test_f1: 0.4886
 epoch: 18, train_loss: 0.9218, test_loss: 0.9340, test_f1: 0.4821
 epoch: 19, train_loss: 0.9164, test_loss: 0.9186, test_f1: 0.4881
 epoch: 20, train_loss: 0.9094, test_loss: 0.9808, test_f1: 0.5194
 epoch: 21, train_loss: 0.9212, test_loss: 0.9189, test_f1: 0.5249
 epoch: 22, train_loss: 0.9035, test_loss: 0.9754, test_f1: 0.4645
 epoch: 23, train_loss: 0.9167, test_loss: 0.9299, test_f1: 0.4975
 epoch: 24, train_loss: 0.9218, test_loss: 0.8618, test_f1: 0.5210
 epoch: 25, train_loss: 0.9133, test_loss: 0.9755, test_f1: 0.4947
 epoch: 26, train_loss: 0.9030, test_loss: 1.0248, test_f1: 0.4925
 epoch: 27, train_loss: 0.8930, test_loss: 0.9820, test_f1: 0.5202
 epoch: 28, train_loss: 0.8873, test_loss: 0.9554, test_f1: 0.5663
 epoch: 29, train_loss: 0.8816, test_loss: 0.9711, test_f1: 0.5540
 epoch: 30, train_loss: 0.8801, test_loss: 0.9629, test_f1: 0.5269
 epoch: 31, train_loss: 0.8776, test_loss: 1.0451, test_f1: 0.4912
 epoch: 32, train_loss: 0.8933, test_loss: 0.9422, test_f1: 0.5210
 epoch: 33, train_loss: 0.8906, test_loss: 0.9341, test_f1: 0.5381
 epoch: 34, train_loss: 0.8726, test_loss: 0.9216, test_f1: 0.4929
 epoch: 35, train_loss: 0.8731, test_loss: 0.9575, test_f1: 0.5484
 epoch: 36, train_loss: 0.8638, test_loss: 0.9482, test_f1: 0.5742
 epoch: 37, train_loss: 0.8719, test_loss: 0.9404, test_f1: 0.5443
 epoch: 38, train_loss: 0.8558, test_loss: 0.8850, test_f1: 0.5438
 epoch: 39, train_loss: 0.8485, test_loss: 0.9650, test_f1: 0.4860
 epoch: 40, train_loss: 0.8477, test_loss: 0.9590, test_f1: 0.5458
 epoch: 41, train_loss: 0.8441, test_loss: 0.9348, test_f1: 0.5153
 epoch: 42, train_loss: 0.8629, test_loss: 0.9436, test_f1: 0.5559
 epoch: 43, train_loss: 0.8537, test_loss: 0.9478, test_f1: 0.5099
 epoch: 44, train_loss: 0.8440, test_loss: 0.9270, test_f1: 0.5725
 epoch: 45, train_loss: 0.8586, test_loss: 0.9443, test_f1: 0.5944
 epoch: 46, train_loss: 0.8450, test_loss: 0.9424, test_f1: 0.5730
 epoch: 47, train_loss: 0.8386, test_loss: 0.9834, test_f1: 0.5690
 epoch: 48, train_loss: 0.8445, test_loss: 0.9214, test_f1: 0.5273
 epoch: 49, train_loss: 0.8507, test_loss: 0.9538, test_f1: 0.5467
 epoch: 50, train_loss: 0.8187, test_loss: 0.9755, test_f1: 0.5352
 epoch: 51, train_loss: 0.8349, test_loss: 0.9227, test_f1: 0.5517
 epoch: 52, train_loss: 0.8074, test_loss: 0.9345, test_f1: 0.5840
 epoch: 53, train_loss: 0.8072, test_loss: 0.9011, test_f1: 0.5854
 epoch: 54, train_loss: 0.8082, test_loss: 0.9314, test_f1: 0.6047
 epoch: 55, train_loss: 0.7924, test_loss: 0.9120, test_f1: 0.5798
 epoch: 56, train_loss: 0.7979, test_loss: 0.9352, test_f1: 0.5460
 epoch: 57, train_loss: 0.7919, test_loss: 0.9883, test_f1: 0.5775
 epoch: 58, train_loss: 0.8017, test_loss: 0.9107, test_f1: 0.6252
 epoch: 59, train_loss: 0.7886, test_loss: 0.9351, test_f1: 0.5824
 epoch: 60, train_loss: 0.7912, test_loss: 0.9246, test_f1: 0.5974
 epoch: 61, train_loss: 0.7954, test_loss: 0.8962, test_f1: 0.6123
 epoch: 62, train_loss: 0.7866, test_loss: 0.9314, test_f1: 0.6004
 epoch: 63, train_loss: 0.8019, test_loss: 0.9323, test_f1: 0.5884
 epoch: 64, train_loss: 0.7838, test_loss: 0.9316, test_f1: 0.5860
 epoch: 65, train_loss: 0.7839, test_loss: 0.9178, test_f1: 0.6159
 epoch: 66, train_loss: 0.7857, test_loss: 0.9329, test_f1: 0.5682
 epoch: 67, train_loss: 0.7876, test_loss: 0.9254, test_f1: 0.6067
 epoch: 68, train_loss: 0.7916, test_loss: 0.9237, test_f1: 0.5683
 epoch: 69, train_loss: 0.7860, test_loss: 0.9193, test_f1: 0.5948
 epoch: 70, train_loss: 0.7829, test_loss: 0.8898, test_f1: 0.5956
 epoch: 71, train_loss: 0.7677, test_loss: 0.8989, test_f1: 0.6158
 epoch: 72, train_loss: 0.7692, test_loss: 0.9296, test_f1: 0.5874
 epoch: 73, train_loss: 0.7622, test_loss: 0.9421, test_f1: 0.5903
 epoch: 74, train_loss: 0.7802, test_loss: 0.9448, test_f1: 0.5691
 epoch: 75, train_loss: 0.7637, test_loss: 0.9293, test_f1: 0.6112
 epoch: 76, train_loss: 0.7687, test_loss: 0.9783, test_f1: 0.5766
 epoch: 77, train_loss: 0.7690, test_loss: 0.9812, test_f1: 0.5733
 epoch: 78, train_loss: 0.7728, test_loss: 0.9293, test_f1: 0.6049
 epoch: 79, train_loss: 0.7659, test_loss: 0.9383, test_f1: 0.6128
 epoch: 80, train_loss: 0.7583, test_loss: 0.9470, test_f1: 0.5981
 epoch: 81, train_loss: 0.7683, test_loss: 1.0115, test_f1: 0.5605
 epoch: 82, train_loss: 0.7704, test_loss: 0.9287, test_f1: 0.5964
 epoch: 83, train_loss: 0.7623, test_loss: 0.9333, test_f1: 0.6235
 epoch: 84, train_loss: 0.7546, test_loss: 0.8964, test_f1: 0.6032
 epoch: 85, train_loss: 0.7486, test_loss: 0.9246, test_f1: 0.6087
 epoch: 86, train_loss: 0.7454, test_loss: 0.9193, test_f1: 0.6233
 epoch: 87, train_loss: 0.7320, test_loss: 0.9037, test_f1: 0.6330
 epoch: 88, train_loss: 0.7518, test_loss: 0.8983, test_f1: 0.6311
 epoch: 89, train_loss: 0.7466, test_loss: 0.9110, test_f1: 0.6341
 epoch: 90, train_loss: 0.7502, test_loss: 0.9486, test_f1: 0.5903
 epoch: 91, train_loss: 0.7496, test_loss: 0.8950, test_f1: 0.5876
 epoch: 92, train_loss: 0.7479, test_loss: 0.8981, test_f1: 0.6565
 epoch: 93, train_loss: 0.7309, test_loss: 0.9486, test_f1: 0.6127
 epoch: 94, train_loss: 0.7416, test_loss: 0.9308, test_f1: 0.6027
 epoch: 95, train_loss: 0.7467, test_loss: 0.9295, test_f1: 0.6371
 epoch: 96, train_loss: 0.7395, test_loss: 0.9561, test_f1: 0.6299
 epoch: 97, train_loss: 0.7519, test_loss: 0.9002, test_f1: 0.6130
 epoch: 98, train_loss: 0.7478, test_loss: 0.9408, test_f1: 0.6058
 epoch: 99, train_loss: 0.7337, test_loss: 0.9026, test_f1: 0.6361
##################ITERATION #6 ****************************************
 epoch: 0, train_loss: 1.2223, test_loss: 1.0378, test_f1: 0.4404
 epoch: 1, train_loss: 1.0445, test_loss: 1.0069, test_f1: 0.4321
 epoch: 2, train_loss: 1.0204, test_loss: 1.0064, test_f1: 0.4663
 epoch: 3, train_loss: 0.9960, test_loss: 1.0343, test_f1: 0.4505
 epoch: 4, train_loss: 0.9851, test_loss: 1.0031, test_f1: 0.4588
 epoch: 5, train_loss: 0.9777, test_loss: 1.0097, test_f1: 0.4740
 epoch: 6, train_loss: 0.9740, test_loss: 1.0533, test_f1: 0.4448
 epoch: 7, train_loss: 0.9622, test_loss: 0.9772, test_f1: 0.4705
 epoch: 8, train_loss: 0.9619, test_loss: 1.0351, test_f1: 0.5039
 epoch: 9, train_loss: 0.9584, test_loss: 1.0482, test_f1: 0.5041
 epoch: 10, train_loss: 0.9578, test_loss: 0.9867, test_f1: 0.4493
 epoch: 11, train_loss: 0.9778, test_loss: 1.0450, test_f1: 0.4801
 epoch: 12, train_loss: 0.9506, test_loss: 1.0068, test_f1: 0.4882
 epoch: 13, train_loss: 0.9441, test_loss: 1.0298, test_f1: 0.4947
 epoch: 14, train_loss: 0.9425, test_loss: 1.0193, test_f1: 0.4753
 epoch: 15, train_loss: 0.9371, test_loss: 1.0167, test_f1: 0.4911
 epoch: 16, train_loss: 0.9328, test_loss: 0.9619, test_f1: 0.5009
 epoch: 17, train_loss: 0.9261, test_loss: 1.0318, test_f1: 0.4927
 epoch: 18, train_loss: 0.9323, test_loss: 0.9890, test_f1: 0.4929
 epoch: 19, train_loss: 0.9248, test_loss: 0.9954, test_f1: 0.4927
 epoch: 20, train_loss: 0.9232, test_loss: 0.9955, test_f1: 0.5007
 epoch: 21, train_loss: 0.9296, test_loss: 0.9791, test_f1: 0.4858
 epoch: 22, train_loss: 0.9077, test_loss: 0.9890, test_f1: 0.5089
 epoch: 23, train_loss: 0.9109, test_loss: 0.9687, test_f1: 0.5015
 epoch: 24, train_loss: 0.9078, test_loss: 0.9813, test_f1: 0.5194
 epoch: 25, train_loss: 0.9078, test_loss: 0.9986, test_f1: 0.5077
 epoch: 26, train_loss: 0.9077, test_loss: 0.9749, test_f1: 0.5125
 epoch: 27, train_loss: 0.9041, test_loss: 0.9995, test_f1: 0.5138
 epoch: 28, train_loss: 0.8893, test_loss: 1.0127, test_f1: 0.4893
 epoch: 29, train_loss: 0.9004, test_loss: 0.9619, test_f1: 0.5095
 epoch: 30, train_loss: 0.8898, test_loss: 0.9683, test_f1: 0.5231
 epoch: 31, train_loss: 0.8890, test_loss: 0.9515, test_f1: 0.5203
 epoch: 32, train_loss: 0.8894, test_loss: 0.9793, test_f1: 0.5314
 epoch: 33, train_loss: 0.8956, test_loss: 1.0118, test_f1: 0.4775
 epoch: 34, train_loss: 0.8844, test_loss: 0.9921, test_f1: 0.4750
 epoch: 35, train_loss: 0.9029, test_loss: 0.9813, test_f1: 0.5335
 epoch: 36, train_loss: 0.8991, test_loss: 0.9778, test_f1: 0.5061
 epoch: 37, train_loss: 0.8680, test_loss: 0.9925, test_f1: 0.5515
 epoch: 38, train_loss: 0.8792, test_loss: 0.9700, test_f1: 0.5219
 epoch: 39, train_loss: 0.8891, test_loss: 0.9531, test_f1: 0.5128
 epoch: 40, train_loss: 0.8746, test_loss: 1.0070, test_f1: 0.5164
 epoch: 41, train_loss: 0.8831, test_loss: 0.9687, test_f1: 0.5191
 epoch: 42, train_loss: 0.9069, test_loss: 0.9961, test_f1: 0.5110
 epoch: 43, train_loss: 0.8917, test_loss: 0.9909, test_f1: 0.5300
 epoch: 44, train_loss: 0.8799, test_loss: 1.0082, test_f1: 0.4945
 epoch: 45, train_loss: 0.8802, test_loss: 1.0236, test_f1: 0.4966
 epoch: 46, train_loss: 0.8852, test_loss: 0.9954, test_f1: 0.5553
 epoch: 47, train_loss: 0.8806, test_loss: 0.9933, test_f1: 0.5270
 epoch: 48, train_loss: 0.8736, test_loss: 1.0406, test_f1: 0.5121
 epoch: 49, train_loss: 0.8918, test_loss: 1.0225, test_f1: 0.5257
 epoch: 50, train_loss: 0.8857, test_loss: 0.9786, test_f1: 0.5117
 epoch: 51, train_loss: 0.8863, test_loss: 0.9870, test_f1: 0.5417
 epoch: 52, train_loss: 0.8653, test_loss: 0.9710, test_f1: 0.5210
 epoch: 53, train_loss: 0.8711, test_loss: 0.9890, test_f1: 0.5094
 epoch: 54, train_loss: 0.8619, test_loss: 0.9698, test_f1: 0.5347
 epoch: 55, train_loss: 0.8575, test_loss: 0.9705, test_f1: 0.5529
 epoch: 56, train_loss: 0.8454, test_loss: 1.0029, test_f1: 0.5203
 epoch: 57, train_loss: 0.8438, test_loss: 1.1171, test_f1: 0.5026
 epoch: 58, train_loss: 0.8416, test_loss: 0.9666, test_f1: 0.5428
 epoch: 59, train_loss: 0.8504, test_loss: 0.9814, test_f1: 0.5590
 epoch: 60, train_loss: 0.8357, test_loss: 0.9620, test_f1: 0.5609
 epoch: 61, train_loss: 0.8372, test_loss: 0.9664, test_f1: 0.5616
 epoch: 62, train_loss: 0.8390, test_loss: 0.9587, test_f1: 0.5512
 epoch: 63, train_loss: 0.8267, test_loss: 0.9678, test_f1: 0.5702
 epoch: 64, train_loss: 0.8340, test_loss: 0.9812, test_f1: 0.5594
 epoch: 65, train_loss: 0.8323, test_loss: 0.9349, test_f1: 0.5775
 epoch: 66, train_loss: 0.8295, test_loss: 0.9498, test_f1: 0.5482
 epoch: 67, train_loss: 0.8109, test_loss: 0.9540, test_f1: 0.5524
 epoch: 68, train_loss: 0.8370, test_loss: 0.9348, test_f1: 0.5377
 epoch: 69, train_loss: 0.8296, test_loss: 1.1967, test_f1: 0.4801
 epoch: 70, train_loss: 0.8186, test_loss: 0.9624, test_f1: 0.5582
 epoch: 71, train_loss: 0.8153, test_loss: 0.9623, test_f1: 0.5451
 epoch: 72, train_loss: 0.8268, test_loss: 0.9549, test_f1: 0.5588
 epoch: 73, train_loss: 0.8110, test_loss: 0.9569, test_f1: 0.5460
 epoch: 74, train_loss: 0.8270, test_loss: 0.9517, test_f1: 0.5496
 epoch: 75, train_loss: 0.8260, test_loss: 0.9336, test_f1: 0.5630
 epoch: 76, train_loss: 0.8123, test_loss: 0.9334, test_f1: 0.5469
 epoch: 77, train_loss: 0.7987, test_loss: 0.9557, test_f1: 0.5766
 epoch: 78, train_loss: 0.8071, test_loss: 0.9470, test_f1: 0.5806
 epoch: 79, train_loss: 0.8001, test_loss: 0.9402, test_f1: 0.5639
 epoch: 80, train_loss: 0.8120, test_loss: 0.9753, test_f1: 0.5817
 epoch: 81, train_loss: 0.8001, test_loss: 0.9372, test_f1: 0.5296
 epoch: 82, train_loss: 0.8157, test_loss: 0.9572, test_f1: 0.5532
 epoch: 83, train_loss: 0.8015, test_loss: 0.9562, test_f1: 0.5309
 epoch: 84, train_loss: 0.8225, test_loss: 0.9858, test_f1: 0.5521
 epoch: 85, train_loss: 0.8031, test_loss: 0.9448, test_f1: 0.5703
 epoch: 86, train_loss: 0.7805, test_loss: 0.9340, test_f1: 0.5573
 epoch: 87, train_loss: 0.8024, test_loss: 0.9506, test_f1: 0.5871
 epoch: 88, train_loss: 0.7965, test_loss: 0.9271, test_f1: 0.5606
 epoch: 89, train_loss: 0.7860, test_loss: 0.9507, test_f1: 0.5819
 epoch: 90, train_loss: 0.7958, test_loss: 0.9839, test_f1: 0.5547
 epoch: 91, train_loss: 0.8040, test_loss: 0.9257, test_f1: 0.5589
 epoch: 92, train_loss: 0.8170, test_loss: 0.9589, test_f1: 0.5533
 epoch: 93, train_loss: 0.8039, test_loss: 0.9569, test_f1: 0.5630
 epoch: 94, train_loss: 0.7840, test_loss: 1.0077, test_f1: 0.5430
 epoch: 95, train_loss: 0.7871, test_loss: 0.9357, test_f1: 0.5841
 epoch: 96, train_loss: 0.7822, test_loss: 0.9476, test_f1: 0.5749
 epoch: 97, train_loss: 0.7740, test_loss: 0.9684, test_f1: 0.5634
 epoch: 98, train_loss: 0.7706, test_loss: 0.9595, test_f1: 0.5751
 epoch: 99, train_loss: 0.7777, test_loss: 0.9427, test_f1: 0.5891
##################ITERATION #7 ****************************************
 epoch: 0, train_loss: 1.2047, test_loss: 1.1075, test_f1: 0.3511
 epoch: 1, train_loss: 1.0675, test_loss: 1.0282, test_f1: 0.4025
 epoch: 2, train_loss: 1.0384, test_loss: 1.0481, test_f1: 0.4496
 epoch: 3, train_loss: 1.0164, test_loss: 1.0836, test_f1: 0.4400
 epoch: 4, train_loss: 1.0132, test_loss: 1.0138, test_f1: 0.4571
 epoch: 5, train_loss: 1.0059, test_loss: 0.9838, test_f1: 0.4449
 epoch: 6, train_loss: 0.9942, test_loss: 1.0307, test_f1: 0.4646
 epoch: 7, train_loss: 0.9678, test_loss: 1.0240, test_f1: 0.5077
 epoch: 8, train_loss: 0.9690, test_loss: 1.0236, test_f1: 0.4873
 epoch: 9, train_loss: 0.9848, test_loss: 0.9870, test_f1: 0.5283
 epoch: 10, train_loss: 0.9718, test_loss: 1.0273, test_f1: 0.4832
 epoch: 11, train_loss: 0.9682, test_loss: 1.0356, test_f1: 0.4626
 epoch: 12, train_loss: 0.9479, test_loss: 1.0091, test_f1: 0.5054
 epoch: 13, train_loss: 0.9521, test_loss: 1.0590, test_f1: 0.4268
 epoch: 14, train_loss: 0.9495, test_loss: 0.9879, test_f1: 0.4555
 epoch: 15, train_loss: 0.9424, test_loss: 0.9184, test_f1: 0.5004
 epoch: 16, train_loss: 0.9369, test_loss: 0.9525, test_f1: 0.5051
 epoch: 17, train_loss: 0.9282, test_loss: 0.9817, test_f1: 0.5491
 epoch: 18, train_loss: 0.9259, test_loss: 0.9208, test_f1: 0.5110
 epoch: 19, train_loss: 0.9655, test_loss: 0.9540, test_f1: 0.4822
 epoch: 20, train_loss: 0.9193, test_loss: 0.9965, test_f1: 0.4940
 epoch: 21, train_loss: 0.9258, test_loss: 1.0066, test_f1: 0.4888
 epoch: 22, train_loss: 0.9092, test_loss: 0.9882, test_f1: 0.5112
 epoch: 23, train_loss: 0.9158, test_loss: 0.8747, test_f1: 0.5256
 epoch: 24, train_loss: 0.9100, test_loss: 0.9654, test_f1: 0.5587
 epoch: 25, train_loss: 0.9011, test_loss: 1.0366, test_f1: 0.4852
 epoch: 26, train_loss: 0.9136, test_loss: 0.9765, test_f1: 0.4988
 epoch: 27, train_loss: 0.9061, test_loss: 0.9533, test_f1: 0.4987
 epoch: 28, train_loss: 0.9161, test_loss: 0.9711, test_f1: 0.5108
 epoch: 29, train_loss: 0.9033, test_loss: 0.9507, test_f1: 0.5229
 epoch: 30, train_loss: 0.9052, test_loss: 0.9497, test_f1: 0.5541
 epoch: 31, train_loss: 0.9084, test_loss: 0.9725, test_f1: 0.5027
 epoch: 32, train_loss: 0.8953, test_loss: 1.0089, test_f1: 0.5106
 epoch: 33, train_loss: 0.8970, test_loss: 0.9906, test_f1: 0.5084
 epoch: 34, train_loss: 0.8944, test_loss: 0.9824, test_f1: 0.4870
 epoch: 35, train_loss: 0.9014, test_loss: 0.9781, test_f1: 0.4805
 epoch: 36, train_loss: 0.8860, test_loss: 0.9863, test_f1: 0.4885
 epoch: 37, train_loss: 0.8789, test_loss: 0.9639, test_f1: 0.5238
 epoch: 38, train_loss: 0.8869, test_loss: 0.9953, test_f1: 0.4883
 epoch: 39, train_loss: 0.8851, test_loss: 1.0192, test_f1: 0.4987
 epoch: 40, train_loss: 0.8778, test_loss: 0.8764, test_f1: 0.5252
 epoch: 41, train_loss: 0.8761, test_loss: 0.9294, test_f1: 0.5261
 epoch: 42, train_loss: 0.8801, test_loss: 0.9357, test_f1: 0.5067
 epoch: 43, train_loss: 0.8861, test_loss: 1.0566, test_f1: 0.4799
 epoch: 44, train_loss: 0.8794, test_loss: 0.9851, test_f1: 0.5133
 epoch: 45, train_loss: 0.8779, test_loss: 0.9554, test_f1: 0.5218
 epoch: 46, train_loss: 0.8736, test_loss: 0.9197, test_f1: 0.5229
 epoch: 47, train_loss: 0.8610, test_loss: 1.0185, test_f1: 0.5090
 epoch: 48, train_loss: 0.8904, test_loss: 0.9231, test_f1: 0.5146
 epoch: 49, train_loss: 0.8721, test_loss: 0.9841, test_f1: 0.5857
 epoch: 50, train_loss: 0.8758, test_loss: 0.9864, test_f1: 0.4861
 epoch: 51, train_loss: 0.8642, test_loss: 0.9469, test_f1: 0.5130
 epoch: 52, train_loss: 0.8474, test_loss: 0.9569, test_f1: 0.5145
 epoch: 53, train_loss: 0.8491, test_loss: 0.9749, test_f1: 0.5199
 epoch: 54, train_loss: 0.8440, test_loss: 0.9546, test_f1: 0.5069
 epoch: 55, train_loss: 0.8415, test_loss: 0.9461, test_f1: 0.5199
 epoch: 56, train_loss: 0.8460, test_loss: 0.9506, test_f1: 0.5465
 epoch: 57, train_loss: 0.8406, test_loss: 0.9828, test_f1: 0.5048
 epoch: 58, train_loss: 0.8292, test_loss: 0.9606, test_f1: 0.5288
 epoch: 59, train_loss: 0.8281, test_loss: 0.9095, test_f1: 0.5660
 epoch: 60, train_loss: 0.8230, test_loss: 0.9592, test_f1: 0.5486
 epoch: 61, train_loss: 0.8313, test_loss: 0.9165, test_f1: 0.5766
 epoch: 62, train_loss: 0.8294, test_loss: 0.9635, test_f1: 0.5459
 epoch: 63, train_loss: 0.8339, test_loss: 0.9670, test_f1: 0.5383
 epoch: 64, train_loss: 0.8311, test_loss: 0.9165, test_f1: 0.5159
 epoch: 65, train_loss: 0.8295, test_loss: 0.9964, test_f1: 0.5202
 epoch: 66, train_loss: 0.8214, test_loss: 0.9543, test_f1: 0.5448
 epoch: 67, train_loss: 0.8262, test_loss: 0.9869, test_f1: 0.5184
 epoch: 68, train_loss: 0.8370, test_loss: 0.9300, test_f1: 0.5440
 epoch: 69, train_loss: 0.8287, test_loss: 0.9609, test_f1: 0.5284
 epoch: 70, train_loss: 0.8293, test_loss: 0.9897, test_f1: 0.5179
 epoch: 71, train_loss: 0.8270, test_loss: 0.9434, test_f1: 0.5679
 epoch: 72, train_loss: 0.8233, test_loss: 1.0001, test_f1: 0.5096
 epoch: 73, train_loss: 0.8293, test_loss: 0.9781, test_f1: 0.5487
 epoch: 74, train_loss: 0.8213, test_loss: 0.9677, test_f1: 0.5267
 epoch: 75, train_loss: 0.8144, test_loss: 0.9926, test_f1: 0.5167
 epoch: 76, train_loss: 0.8137, test_loss: 0.9860, test_f1: 0.5807
 epoch: 77, train_loss: 0.8163, test_loss: 0.9846, test_f1: 0.5060
 epoch: 78, train_loss: 0.8144, test_loss: 0.9314, test_f1: 0.5683
 epoch: 79, train_loss: 0.8091, test_loss: 0.9060, test_f1: 0.5507
 epoch: 80, train_loss: 0.8153, test_loss: 0.8942, test_f1: 0.5537
 epoch: 81, train_loss: 0.8175, test_loss: 0.8782, test_f1: 0.5554
 epoch: 82, train_loss: 0.8079, test_loss: 0.9624, test_f1: 0.5277
 epoch: 83, train_loss: 0.8142, test_loss: 0.9637, test_f1: 0.5387
 epoch: 84, train_loss: 0.8025, test_loss: 1.0450, test_f1: 0.5328
 epoch: 85, train_loss: 0.8190, test_loss: 1.0460, test_f1: 0.5326
 epoch: 86, train_loss: 0.8043, test_loss: 0.9360, test_f1: 0.5469
 epoch: 87, train_loss: 0.8059, test_loss: 0.9353, test_f1: 0.5585
 epoch: 88, train_loss: 0.8030, test_loss: 0.9554, test_f1: 0.5525
 epoch: 89, train_loss: 0.8027, test_loss: 0.9542, test_f1: 0.5783
 epoch: 90, train_loss: 0.8034, test_loss: 0.9596, test_f1: 0.5459
 epoch: 91, train_loss: 0.8132, test_loss: 0.9688, test_f1: 0.5638
 epoch: 92, train_loss: 0.8095, test_loss: 0.9611, test_f1: 0.5428
 epoch: 93, train_loss: 0.7975, test_loss: 1.0028, test_f1: 0.5517
 epoch: 94, train_loss: 0.8233, test_loss: 1.0655, test_f1: 0.5014
 epoch: 95, train_loss: 0.8050, test_loss: 0.9877, test_f1: 0.5180
 epoch: 96, train_loss: 0.7914, test_loss: 0.9809, test_f1: 0.5571
 epoch: 97, train_loss: 0.7992, test_loss: 0.9774, test_f1: 0.5315
 epoch: 98, train_loss: 0.7912, test_loss: 0.9891, test_f1: 0.5691
 epoch: 99, train_loss: 0.7925, test_loss: 1.0295, test_f1: 0.5288
##################ITERATION #8 ****************************************
 epoch: 0, train_loss: 1.1842, test_loss: 1.0776, test_f1: 0.4420
 epoch: 1, train_loss: 1.0349, test_loss: 1.0778, test_f1: 0.4694
 epoch: 2, train_loss: 1.0365, test_loss: 1.0418, test_f1: 0.4817
 epoch: 3, train_loss: 1.0060, test_loss: 1.0938, test_f1: 0.5061
 epoch: 4, train_loss: 0.9910, test_loss: 1.0528, test_f1: 0.5219
 epoch: 5, train_loss: 0.9889, test_loss: 1.0293, test_f1: 0.4865
 epoch: 6, train_loss: 0.9714, test_loss: 1.0061, test_f1: 0.4722
 epoch: 7, train_loss: 0.9711, test_loss: 1.2550, test_f1: 0.3856
 epoch: 8, train_loss: 0.9848, test_loss: 1.0358, test_f1: 0.4486
 epoch: 9, train_loss: 0.9679, test_loss: 1.0680, test_f1: 0.4486
 epoch: 10, train_loss: 0.9766, test_loss: 1.0348, test_f1: 0.4759
 epoch: 11, train_loss: 0.9649, test_loss: 0.9747, test_f1: 0.4808
 epoch: 12, train_loss: 0.9503, test_loss: 1.0286, test_f1: 0.4986
 epoch: 13, train_loss: 0.9384, test_loss: 0.9963, test_f1: 0.4928
 epoch: 14, train_loss: 0.9494, test_loss: 0.9976, test_f1: 0.4887
 epoch: 15, train_loss: 0.9431, test_loss: 0.9895, test_f1: 0.4810
 epoch: 16, train_loss: 0.9261, test_loss: 0.9636, test_f1: 0.5125
 epoch: 17, train_loss: 0.9251, test_loss: 0.9501, test_f1: 0.4901
 epoch: 18, train_loss: 0.9215, test_loss: 0.9992, test_f1: 0.4887
 epoch: 19, train_loss: 0.9231, test_loss: 1.0076, test_f1: 0.4848
 epoch: 20, train_loss: 0.9155, test_loss: 0.9859, test_f1: 0.4919
 epoch: 21, train_loss: 0.9064, test_loss: 0.9516, test_f1: 0.5167
 epoch: 22, train_loss: 0.8993, test_loss: 0.9583, test_f1: 0.4978
 epoch: 23, train_loss: 0.9014, test_loss: 1.0767, test_f1: 0.4640
 epoch: 24, train_loss: 0.9076, test_loss: 0.9952, test_f1: 0.4956
 epoch: 25, train_loss: 0.9152, test_loss: 0.9948, test_f1: 0.5083
 epoch: 26, train_loss: 0.8901, test_loss: 0.9768, test_f1: 0.5059
 epoch: 27, train_loss: 0.8921, test_loss: 1.0033, test_f1: 0.5262
 epoch: 28, train_loss: 0.8814, test_loss: 1.0114, test_f1: 0.4702
 epoch: 29, train_loss: 0.8836, test_loss: 0.9648, test_f1: 0.5831
 epoch: 30, train_loss: 0.8867, test_loss: 0.9561, test_f1: 0.5735
 epoch: 31, train_loss: 0.8846, test_loss: 0.9645, test_f1: 0.5523
 epoch: 32, train_loss: 0.8649, test_loss: 0.9711, test_f1: 0.5416
 epoch: 33, train_loss: 0.8741, test_loss: 1.0019, test_f1: 0.5380
 epoch: 34, train_loss: 0.8763, test_loss: 0.9773, test_f1: 0.5109
 epoch: 35, train_loss: 0.8697, test_loss: 0.9771, test_f1: 0.5135
 epoch: 36, train_loss: 0.8637, test_loss: 0.9684, test_f1: 0.5552
 epoch: 37, train_loss: 0.8571, test_loss: 0.9802, test_f1: 0.5159
 epoch: 38, train_loss: 0.8683, test_loss: 0.9741, test_f1: 0.5113
 epoch: 39, train_loss: 0.8612, test_loss: 1.0348, test_f1: 0.5178
 epoch: 40, train_loss: 0.8636, test_loss: 0.9632, test_f1: 0.5171
 epoch: 41, train_loss: 0.8811, test_loss: 0.9458, test_f1: 0.5235
 epoch: 42, train_loss: 0.8507, test_loss: 0.9738, test_f1: 0.5590
 epoch: 43, train_loss: 0.8389, test_loss: 0.9232, test_f1: 0.5576
 epoch: 44, train_loss: 0.8508, test_loss: 0.9913, test_f1: 0.4792
 epoch: 45, train_loss: 0.8612, test_loss: 0.9421, test_f1: 0.5881
 epoch: 46, train_loss: 0.8411, test_loss: 1.0028, test_f1: 0.4878
 epoch: 47, train_loss: 0.8395, test_loss: 0.9559, test_f1: 0.5387
 epoch: 48, train_loss: 0.8587, test_loss: 1.0477, test_f1: 0.5090
 epoch: 49, train_loss: 0.8583, test_loss: 0.9636, test_f1: 0.5315
 epoch: 50, train_loss: 0.8294, test_loss: 0.9367, test_f1: 0.5446
 epoch: 51, train_loss: 0.8259, test_loss: 0.9305, test_f1: 0.5456
 epoch: 52, train_loss: 0.8157, test_loss: 0.9266, test_f1: 0.5509
 epoch: 53, train_loss: 0.8091, test_loss: 0.9318, test_f1: 0.5438
 epoch: 54, train_loss: 0.8033, test_loss: 0.9492, test_f1: 0.5538
 epoch: 55, train_loss: 0.7893, test_loss: 0.9354, test_f1: 0.5656
 epoch: 56, train_loss: 0.8040, test_loss: 0.9626, test_f1: 0.5372
 epoch: 57, train_loss: 0.7981, test_loss: 0.9204, test_f1: 0.5573
 epoch: 58, train_loss: 0.7840, test_loss: 0.9081, test_f1: 0.5469
 epoch: 59, train_loss: 0.7972, test_loss: 0.9037, test_f1: 0.5483
 epoch: 60, train_loss: 0.8020, test_loss: 0.9236, test_f1: 0.5501
 epoch: 61, train_loss: 0.7640, test_loss: 0.9801, test_f1: 0.5122
 epoch: 62, train_loss: 0.7981, test_loss: 0.8965, test_f1: 0.5484
 epoch: 63, train_loss: 0.7810, test_loss: 0.9667, test_f1: 0.5450
 epoch: 64, train_loss: 0.7863, test_loss: 0.9151, test_f1: 0.5512
 epoch: 65, train_loss: 0.7879, test_loss: 0.9265, test_f1: 0.5339
 epoch: 66, train_loss: 0.7768, test_loss: 1.0111, test_f1: 0.5500
 epoch: 67, train_loss: 0.7764, test_loss: 0.9373, test_f1: 0.5418
 epoch: 68, train_loss: 0.7711, test_loss: 0.9309, test_f1: 0.5670
 epoch: 69, train_loss: 0.7796, test_loss: 0.9270, test_f1: 0.5501
 epoch: 70, train_loss: 0.7778, test_loss: 0.9846, test_f1: 0.5296
 epoch: 71, train_loss: 0.7790, test_loss: 0.9385, test_f1: 0.5825
 epoch: 72, train_loss: 0.7733, test_loss: 0.9193, test_f1: 0.5476
 epoch: 73, train_loss: 0.7755, test_loss: 0.9181, test_f1: 0.5564
 epoch: 74, train_loss: 0.7785, test_loss: 0.9517, test_f1: 0.5615
 epoch: 75, train_loss: 0.7657, test_loss: 0.9420, test_f1: 0.5733
 epoch: 76, train_loss: 0.7680, test_loss: 0.9183, test_f1: 0.5602
 epoch: 77, train_loss: 0.7529, test_loss: 0.9051, test_f1: 0.5584
 epoch: 78, train_loss: 0.7562, test_loss: 0.9076, test_f1: 0.5597
 epoch: 79, train_loss: 0.7681, test_loss: 0.9548, test_f1: 0.5485
 epoch: 80, train_loss: 0.7607, test_loss: 0.9288, test_f1: 0.5995
 epoch: 81, train_loss: 0.7512, test_loss: 0.9195, test_f1: 0.5863
 epoch: 82, train_loss: 0.7726, test_loss: 0.9222, test_f1: 0.5500
 epoch: 83, train_loss: 0.7622, test_loss: 0.9020, test_f1: 0.6147
 epoch: 84, train_loss: 0.7599, test_loss: 0.9399, test_f1: 0.5295
 epoch: 85, train_loss: 0.7645, test_loss: 0.9259, test_f1: 0.5592
 epoch: 86, train_loss: 0.7578, test_loss: 0.9166, test_f1: 0.5518
 epoch: 87, train_loss: 0.7569, test_loss: 0.9275, test_f1: 0.5649
 epoch: 88, train_loss: 0.7648, test_loss: 0.9659, test_f1: 0.5752
 epoch: 89, train_loss: 0.7587, test_loss: 0.9390, test_f1: 0.5741
 epoch: 90, train_loss: 0.7430, test_loss: 0.9133, test_f1: 0.5729
 epoch: 91, train_loss: 0.7544, test_loss: 0.9080, test_f1: 0.5847
 epoch: 92, train_loss: 0.7506, test_loss: 0.9209, test_f1: 0.5639
 epoch: 93, train_loss: 0.7513, test_loss: 0.9188, test_f1: 0.6113
 epoch: 94, train_loss: 0.7728, test_loss: 0.9204, test_f1: 0.5892
 epoch: 95, train_loss: 0.7437, test_loss: 0.9206, test_f1: 0.6149
 epoch: 96, train_loss: 0.7498, test_loss: 0.9287, test_f1: 0.6101
 epoch: 97, train_loss: 0.7491, test_loss: 0.9377, test_f1: 0.6325
 epoch: 98, train_loss: 0.7586, test_loss: 0.9374, test_f1: 0.6007
 epoch: 99, train_loss: 0.7506, test_loss: 0.9446, test_f1: 0.6000
##################ITERATION #9 ****************************************
 epoch: 0, train_loss: 1.2238, test_loss: 1.0830, test_f1: 0.4315
 epoch: 1, train_loss: 1.0384, test_loss: 1.0675, test_f1: 0.5064
 epoch: 2, train_loss: 1.0234, test_loss: 0.9949, test_f1: 0.4850
 epoch: 3, train_loss: 1.0039, test_loss: 1.0417, test_f1: 0.4783
 epoch: 4, train_loss: 0.9942, test_loss: 1.0360, test_f1: 0.4834
 epoch: 5, train_loss: 0.9744, test_loss: 1.0425, test_f1: 0.4782
 epoch: 6, train_loss: 0.9788, test_loss: 1.0243, test_f1: 0.4643
 epoch: 7, train_loss: 0.9736, test_loss: 1.0663, test_f1: 0.4723
 epoch: 8, train_loss: 0.9656, test_loss: 1.0319, test_f1: 0.4934
 epoch: 9, train_loss: 0.9528, test_loss: 1.0208, test_f1: 0.5228
 epoch: 10, train_loss: 0.9470, test_loss: 1.0151, test_f1: 0.4756
 epoch: 11, train_loss: 0.9546, test_loss: 1.0314, test_f1: 0.5253
 epoch: 12, train_loss: 0.9469, test_loss: 1.0507, test_f1: 0.4965
 epoch: 13, train_loss: 0.9407, test_loss: 1.0565, test_f1: 0.4860
 epoch: 14, train_loss: 0.9348, test_loss: 1.0327, test_f1: 0.4954
 epoch: 15, train_loss: 0.9274, test_loss: 1.0837, test_f1: 0.4827
 epoch: 16, train_loss: 0.9540, test_loss: 1.0088, test_f1: 0.4999
 epoch: 17, train_loss: 0.9284, test_loss: 1.0069, test_f1: 0.4963
 epoch: 18, train_loss: 0.9254, test_loss: 0.9613, test_f1: 0.4690
 epoch: 19, train_loss: 0.9467, test_loss: 1.0201, test_f1: 0.4892
 epoch: 20, train_loss: 0.9210, test_loss: 0.9811, test_f1: 0.4787
 epoch: 21, train_loss: 0.9300, test_loss: 0.9488, test_f1: 0.5282
 epoch: 22, train_loss: 0.9286, test_loss: 0.9353, test_f1: 0.4841
 epoch: 23, train_loss: 0.9035, test_loss: 0.8876, test_f1: 0.5110
 epoch: 24, train_loss: 0.9229, test_loss: 0.9104, test_f1: 0.5215
 epoch: 25, train_loss: 0.9157, test_loss: 0.9500, test_f1: 0.4985
 epoch: 26, train_loss: 0.9118, test_loss: 0.9813, test_f1: 0.4708
 epoch: 27, train_loss: 0.9452, test_loss: 1.0295, test_f1: 0.5018
 epoch: 28, train_loss: 0.9322, test_loss: 0.9570, test_f1: 0.4955
 epoch: 29, train_loss: 0.9328, test_loss: 0.9290, test_f1: 0.5272
 epoch: 30, train_loss: 0.9047, test_loss: 0.9558, test_f1: 0.4978
 epoch: 31, train_loss: 0.9004, test_loss: 0.9178, test_f1: 0.5383
 epoch: 32, train_loss: 0.9024, test_loss: 1.0038, test_f1: 0.5037
 epoch: 33, train_loss: 0.9032, test_loss: 0.9335, test_f1: 0.5529
 epoch: 34, train_loss: 0.8978, test_loss: 0.9089, test_f1: 0.5403
 epoch: 35, train_loss: 0.8877, test_loss: 0.9510, test_f1: 0.5312
 epoch: 36, train_loss: 0.8820, test_loss: 0.9571, test_f1: 0.5291
 epoch: 37, train_loss: 0.8814, test_loss: 0.9814, test_f1: 0.5101
 epoch: 38, train_loss: 0.8861, test_loss: 0.9583, test_f1: 0.5157
 epoch: 39, train_loss: 0.8753, test_loss: 0.9659, test_f1: 0.5254
 epoch: 40, train_loss: 0.8866, test_loss: 0.9908, test_f1: 0.4860
 epoch: 41, train_loss: 0.8894, test_loss: 0.9197, test_f1: 0.4967
 epoch: 42, train_loss: 0.8712, test_loss: 0.9381, test_f1: 0.5629
 epoch: 43, train_loss: 0.8563, test_loss: 1.0039, test_f1: 0.5416
 epoch: 44, train_loss: 0.8662, test_loss: 1.0172, test_f1: 0.4961
 epoch: 45, train_loss: 0.8527, test_loss: 0.9681, test_f1: 0.5208
 epoch: 46, train_loss: 0.8531, test_loss: 0.9667, test_f1: 0.5385
 epoch: 47, train_loss: 0.8623, test_loss: 0.9712, test_f1: 0.4961
 epoch: 48, train_loss: 0.8599, test_loss: 0.9579, test_f1: 0.5766
 epoch: 49, train_loss: 0.8532, test_loss: 0.9563, test_f1: 0.5699
 epoch: 50, train_loss: 0.8675, test_loss: 0.9788, test_f1: 0.5269
 epoch: 51, train_loss: 0.8493, test_loss: 0.9716, test_f1: 0.5191
 epoch: 52, train_loss: 0.8342, test_loss: 0.9414, test_f1: 0.5623
 epoch: 53, train_loss: 0.8186, test_loss: 0.9219, test_f1: 0.5916
 epoch: 54, train_loss: 0.8199, test_loss: 0.9168, test_f1: 0.5853
 epoch: 55, train_loss: 0.8252, test_loss: 0.9234, test_f1: 0.5967
 epoch: 56, train_loss: 0.8219, test_loss: 0.9226, test_f1: 0.6006
 epoch: 57, train_loss: 0.8248, test_loss: 0.9329, test_f1: 0.5964
 epoch: 58, train_loss: 0.8324, test_loss: 0.9351, test_f1: 0.5435
 epoch: 59, train_loss: 0.8333, test_loss: 0.9285, test_f1: 0.5798
 epoch: 60, train_loss: 0.8142, test_loss: 0.9351, test_f1: 0.5923
 epoch: 61, train_loss: 0.8161, test_loss: 0.9152, test_f1: 0.5964
 epoch: 62, train_loss: 0.8084, test_loss: 0.9205, test_f1: 0.5183
 epoch: 63, train_loss: 0.8226, test_loss: 0.9157, test_f1: 0.5825
 epoch: 64, train_loss: 0.8065, test_loss: 0.9249, test_f1: 0.5746
 epoch: 65, train_loss: 0.8074, test_loss: 0.9198, test_f1: 0.5315
 epoch: 66, train_loss: 0.8060, test_loss: 0.9143, test_f1: 0.5954
 epoch: 67, train_loss: 0.8112, test_loss: 0.9054, test_f1: 0.6090
 epoch: 68, train_loss: 0.7997, test_loss: 0.9504, test_f1: 0.5304
 epoch: 69, train_loss: 0.8188, test_loss: 0.9050, test_f1: 0.5885
 epoch: 70, train_loss: 0.7940, test_loss: 0.9387, test_f1: 0.5515
 epoch: 71, train_loss: 0.8035, test_loss: 0.8779, test_f1: 0.6010
 epoch: 72, train_loss: 0.7877, test_loss: 0.8952, test_f1: 0.5757
 epoch: 73, train_loss: 0.7913, test_loss: 0.9038, test_f1: 0.5985
 epoch: 74, train_loss: 0.7959, test_loss: 0.9111, test_f1: 0.5344
 epoch: 75, train_loss: 0.7937, test_loss: 0.8936, test_f1: 0.5468
 epoch: 76, train_loss: 0.7836, test_loss: 0.8701, test_f1: 0.5938
 epoch: 77, train_loss: 0.7880, test_loss: 0.8995, test_f1: 0.5835
 epoch: 78, train_loss: 0.7921, test_loss: 0.9023, test_f1: 0.5740
 epoch: 79, train_loss: 0.7850, test_loss: 0.9005, test_f1: 0.6041
 epoch: 80, train_loss: 0.7856, test_loss: 0.9262, test_f1: 0.5540
 epoch: 81, train_loss: 0.7869, test_loss: 0.9011, test_f1: 0.5970
 epoch: 82, train_loss: 0.7915, test_loss: 0.8989, test_f1: 0.5418
 epoch: 83, train_loss: 0.7926, test_loss: 0.8808, test_f1: 0.5768
 epoch: 84, train_loss: 0.7800, test_loss: 0.8780, test_f1: 0.5839
 epoch: 85, train_loss: 0.7875, test_loss: 0.8776, test_f1: 0.5996
 epoch: 86, train_loss: 0.7964, test_loss: 0.8970, test_f1: 0.5838
 epoch: 87, train_loss: 0.7705, test_loss: 0.9030, test_f1: 0.5492
 epoch: 88, train_loss: 0.7747, test_loss: 0.8775, test_f1: 0.6160
 epoch: 89, train_loss: 0.7855, test_loss: 0.8825, test_f1: 0.6150
 epoch: 90, train_loss: 0.7865, test_loss: 0.9157, test_f1: 0.6280
 epoch: 91, train_loss: 0.7817, test_loss: 0.9228, test_f1: 0.5763
 epoch: 92, train_loss: 0.7780, test_loss: 0.8798, test_f1: 0.6219
 epoch: 93, train_loss: 0.7765, test_loss: 0.8846, test_f1: 0.6161
 epoch: 94, train_loss: 0.7742, test_loss: 0.8648, test_f1: 0.6114
 epoch: 95, train_loss: 0.7681, test_loss: 0.8802, test_f1: 0.6181
 epoch: 96, train_loss: 0.7754, test_loss: 0.8737, test_f1: 0.5955
 epoch: 97, train_loss: 0.7688, test_loss: 0.8986, test_f1: 0.6057
 epoch: 98, train_loss: 0.7606, test_loss: 0.8812, test_f1: 0.6007
 epoch: 99, train_loss: 0.7584, test_loss: 0.8808, test_f1: 0.6085

Training completed in 758.40 seconds
Best F1: 0.6565 at epoch 92
Mean F1 across iterations: 0.6262  0.0229
========================FINAL RESULTS================================
FEGIN weighted F1: 0.6565  0.0229
python main.py --data ltspice_examples --representation component_net --model FEGIN --layers 4 --hiddens 16 --batch_size 64 --lr 0.01 --emb_size 250 --epochs 100 --save_appendix component_net_L4_H16_BS64_LR0.01_E250 --no_val
-----



STDERR:
  File "main.py", line 370, in <module>
    main()
  File "main.py", line 254, in main
    dataset = dataset_class(
  File "/home/philip/projects/llm_inference_code_repo/Circuit-Completion-Using-GNNs/component_classification_with_link_prediction_head/evaluation/FEGIN/kernel/circuit_datasets.py", line 15, in __init__
    self.data, self.slices = torch.load(self.processed_paths[0])
  File "/home/philip/.local/lib/python3.8/site-packages/torch/serialization.py", line 1040, in load
    warnings.warn(
  File "/usr/lib/python3.8/warnings.py", line 109, in _showwarnmsg
    sw(msg.message, msg.category, msg.filename, msg.lineno,
  File "main.py", line 47, in warn_with_traceback
    traceback.print_stack(file=log)
/home/philip/projects/llm_inference_code_repo/Circuit-Completion-Using-GNNs/component_classification_with_link_prediction_head/evaluation/FEGIN/kernel/circuit_datasets.py:15: FutureWarning: You are using `torch.load` with `weights_only=False` (the current default value), which uses the default pickle module implicitly. It is possible to construct malicious pickle data which will execute arbitrary code during unpickling (See https://github.com/pytorch/pytorch/blob/main/SECURITY.md#untrusted-models for more details). In a future release, the default value for `weights_only` will be flipped to `True`. This limits the functions that could be executed during unpickling. Arbitrary objects will no longer be allowed to be loaded via this mode unless they are explicitly allowlisted by the user via `torch.serialization.add_safe_globals`. We recommend you start setting `weights_only=True` for any use case where you don't have full control of the loaded file. Please open an issue on GitHub for any issues related to this experimental feature.
  self.data, self.slices = torch.load(self.processed_paths[0])
