STDOUT:
Results will be saved in /home/philip/projects/llm_inference_code_repo/Circuit-Completion-Using-GNNs/component_classification_with_link_prediction_head/evaluation/FEGIN/results/model_FEGIN_dataset_ltspice_examples
Command line input: python main.py --data ltspice_examples --representation component_component --model FEGIN --layers 6 --hiddens 64 --batch_size 256 --lr 0.0001 --emb_size 250 --epochs 100 --save_appendix component_component_L6_H64_BS256_LR0.0001_E250 --no_val
 is saved.
-----
ltspice_examples - FEGIN
Using 6 layers, 64 hidden units, h = 2
Loading component_component representation dataset
ENTERED
Training FEGIN on component_component representation
Train: 3556, Test: 845
##################ITERATION #0 ****************************************
 epoch: 0, train_loss: 1.3614, test_loss: 1.3601, test_f1: 0.2274
 epoch: 1, train_loss: 1.3540, test_loss: 1.3556, test_f1: 0.2276
 epoch: 2, train_loss: 1.3488, test_loss: 1.3512, test_f1: 0.2276
 epoch: 3, train_loss: 1.3438, test_loss: 1.3447, test_f1: 0.2274
 epoch: 4, train_loss: 1.3369, test_loss: 1.3374, test_f1: 0.2274
 epoch: 5, train_loss: 1.3301, test_loss: 1.3282, test_f1: 0.2274
 epoch: 6, train_loss: 1.3218, test_loss: 1.3181, test_f1: 0.2327
 epoch: 7, train_loss: 1.3128, test_loss: 1.3079, test_f1: 0.2274
 epoch: 8, train_loss: 1.3035, test_loss: 1.2982, test_f1: 0.2274
 epoch: 9, train_loss: 1.2943, test_loss: 1.2876, test_f1: 0.2274
 epoch: 10, train_loss: 1.2836, test_loss: 1.2772, test_f1: 0.2274
 epoch: 11, train_loss: 1.2732, test_loss: 1.2672, test_f1: 0.2300
 epoch: 12, train_loss: 1.2631, test_loss: 1.2585, test_f1: 0.2300
 epoch: 13, train_loss: 1.2538, test_loss: 1.2504, test_f1: 0.2375
 epoch: 14, train_loss: 1.2482, test_loss: 1.2349, test_f1: 0.2436
 epoch: 15, train_loss: 1.2375, test_loss: 1.2269, test_f1: 0.2684
 epoch: 16, train_loss: 1.2284, test_loss: 1.2146, test_f1: 0.2892
 epoch: 17, train_loss: 1.2200, test_loss: 1.2040, test_f1: 0.3026
 epoch: 18, train_loss: 1.2081, test_loss: 1.1937, test_f1: 0.3079
 epoch: 19, train_loss: 1.1999, test_loss: 1.1882, test_f1: 0.3323
 epoch: 20, train_loss: 1.1950, test_loss: 1.1733, test_f1: 0.3331
 epoch: 21, train_loss: 1.1845, test_loss: 1.1696, test_f1: 0.3385
 epoch: 22, train_loss: 1.1732, test_loss: 1.1584, test_f1: 0.3617
 epoch: 23, train_loss: 1.1658, test_loss: 1.1473, test_f1: 0.3593
 epoch: 24, train_loss: 1.1581, test_loss: 1.1418, test_f1: 0.3636
 epoch: 25, train_loss: 1.1483, test_loss: 1.1298, test_f1: 0.3766
 epoch: 26, train_loss: 1.1435, test_loss: 1.1293, test_f1: 0.3796
 epoch: 27, train_loss: 1.1329, test_loss: 1.1255, test_f1: 0.3829
 epoch: 28, train_loss: 1.1192, test_loss: 1.1140, test_f1: 0.3947
 epoch: 29, train_loss: 1.1158, test_loss: 1.1121, test_f1: 0.4020
 epoch: 30, train_loss: 1.1045, test_loss: 1.1062, test_f1: 0.4017
 epoch: 31, train_loss: 1.0982, test_loss: 1.1056, test_f1: 0.4007
 epoch: 32, train_loss: 1.0899, test_loss: 1.1038, test_f1: 0.3928
 epoch: 33, train_loss: 1.0835, test_loss: 1.1015, test_f1: 0.3985
 epoch: 34, train_loss: 1.0788, test_loss: 1.1046, test_f1: 0.4055
 epoch: 35, train_loss: 1.0679, test_loss: 1.1013, test_f1: 0.4262
 epoch: 36, train_loss: 1.0616, test_loss: 1.1040, test_f1: 0.4562
 epoch: 37, train_loss: 1.0588, test_loss: 1.0921, test_f1: 0.4608
 epoch: 38, train_loss: 1.0506, test_loss: 1.0990, test_f1: 0.4548
 epoch: 39, train_loss: 1.0422, test_loss: 1.0994, test_f1: 0.4634
 epoch: 40, train_loss: 1.0375, test_loss: 1.0988, test_f1: 0.4641
 epoch: 41, train_loss: 1.0371, test_loss: 1.0887, test_f1: 0.4585
 epoch: 42, train_loss: 1.0203, test_loss: 1.1005, test_f1: 0.4561
 epoch: 43, train_loss: 1.0214, test_loss: 1.0965, test_f1: 0.4638
 epoch: 44, train_loss: 1.0083, test_loss: 1.1020, test_f1: 0.4645
 epoch: 45, train_loss: 1.0107, test_loss: 1.1057, test_f1: 0.4446
 epoch: 46, train_loss: 1.0022, test_loss: 1.1065, test_f1: 0.4484
 epoch: 47, train_loss: 1.0002, test_loss: 1.1077, test_f1: 0.4749
 epoch: 48, train_loss: 0.9912, test_loss: 1.1105, test_f1: 0.4674
 epoch: 49, train_loss: 0.9871, test_loss: 1.1044, test_f1: 0.4499
 epoch: 50, train_loss: 0.9801, test_loss: 1.1116, test_f1: 0.4593
 epoch: 51, train_loss: 0.9799, test_loss: 1.1151, test_f1: 0.4607
 epoch: 52, train_loss: 0.9707, test_loss: 1.1160, test_f1: 0.4612
 epoch: 53, train_loss: 0.9709, test_loss: 1.1010, test_f1: 0.4615
 epoch: 54, train_loss: 0.9646, test_loss: 1.1100, test_f1: 0.4630
 epoch: 55, train_loss: 0.9628, test_loss: 1.1125, test_f1: 0.4639
 epoch: 56, train_loss: 0.9733, test_loss: 1.1130, test_f1: 0.4615
 epoch: 57, train_loss: 0.9601, test_loss: 1.1216, test_f1: 0.4669
 epoch: 58, train_loss: 0.9599, test_loss: 1.1143, test_f1: 0.4641
 epoch: 59, train_loss: 0.9593, test_loss: 1.1184, test_f1: 0.4684
 epoch: 60, train_loss: 0.9494, test_loss: 1.1173, test_f1: 0.4617
 epoch: 61, train_loss: 0.9428, test_loss: 1.1233, test_f1: 0.4668
 epoch: 62, train_loss: 0.9499, test_loss: 1.1211, test_f1: 0.4738
 epoch: 63, train_loss: 0.9456, test_loss: 1.1102, test_f1: 0.4737
 epoch: 64, train_loss: 0.9529, test_loss: 1.1239, test_f1: 0.4694
 epoch: 65, train_loss: 0.9483, test_loss: 1.1270, test_f1: 0.4681
 epoch: 66, train_loss: 0.9412, test_loss: 1.1258, test_f1: 0.4575
 epoch: 67, train_loss: 0.9450, test_loss: 1.1168, test_f1: 0.4722
 epoch: 68, train_loss: 0.9307, test_loss: 1.1221, test_f1: 0.4638
 epoch: 69, train_loss: 0.9271, test_loss: 1.1235, test_f1: 0.4676
 epoch: 70, train_loss: 0.9297, test_loss: 1.1250, test_f1: 0.4790
 epoch: 71, train_loss: 0.9330, test_loss: 1.1271, test_f1: 0.4657
 epoch: 72, train_loss: 0.9315, test_loss: 1.1213, test_f1: 0.4730
 epoch: 73, train_loss: 0.9234, test_loss: 1.1235, test_f1: 0.4630
 epoch: 74, train_loss: 0.9268, test_loss: 1.1217, test_f1: 0.4751
 epoch: 75, train_loss: 0.9283, test_loss: 1.1389, test_f1: 0.4653
 epoch: 76, train_loss: 0.9217, test_loss: 1.1332, test_f1: 0.4702
 epoch: 77, train_loss: 0.9114, test_loss: 1.1249, test_f1: 0.4697
 epoch: 78, train_loss: 0.9081, test_loss: 1.1313, test_f1: 0.4713
 epoch: 79, train_loss: 0.9140, test_loss: 1.1354, test_f1: 0.4691
 epoch: 80, train_loss: 0.9130, test_loss: 1.1373, test_f1: 0.4643
 epoch: 81, train_loss: 0.9101, test_loss: 1.1305, test_f1: 0.4688
 epoch: 82, train_loss: 0.9106, test_loss: 1.1401, test_f1: 0.4711
 epoch: 83, train_loss: 0.9043, test_loss: 1.1313, test_f1: 0.4689
 epoch: 84, train_loss: 0.9001, test_loss: 1.1456, test_f1: 0.4666
 epoch: 85, train_loss: 0.9018, test_loss: 1.1296, test_f1: 0.4787
 epoch: 86, train_loss: 0.8978, test_loss: 1.1380, test_f1: 0.4689
 epoch: 87, train_loss: 0.8927, test_loss: 1.1413, test_f1: 0.4684
 epoch: 88, train_loss: 0.8993, test_loss: 1.1394, test_f1: 0.4671
 epoch: 89, train_loss: 0.8930, test_loss: 1.1439, test_f1: 0.4732
 epoch: 90, train_loss: 0.8993, test_loss: 1.1413, test_f1: 0.4737
 epoch: 91, train_loss: 0.8831, test_loss: 1.1468, test_f1: 0.4719
 epoch: 92, train_loss: 0.8832, test_loss: 1.1402, test_f1: 0.4725
 epoch: 93, train_loss: 0.8844, test_loss: 1.1327, test_f1: 0.4753
 epoch: 94, train_loss: 0.8933, test_loss: 1.1334, test_f1: 0.4807
 epoch: 95, train_loss: 0.8941, test_loss: 1.1425, test_f1: 0.4751
 epoch: 96, train_loss: 0.8891, test_loss: 1.1465, test_f1: 0.4720
 epoch: 97, train_loss: 0.8837, test_loss: 1.1491, test_f1: 0.4767
 epoch: 98, train_loss: 0.8751, test_loss: 1.1444, test_f1: 0.4739
 epoch: 99, train_loss: 0.8708, test_loss: 1.1428, test_f1: 0.4740
##################ITERATION #1 ****************************************
 epoch: 0, train_loss: 1.3376, test_loss: 1.3520, test_f1: 0.2274
 epoch: 1, train_loss: 1.3226, test_loss: 1.3427, test_f1: 0.2274
 epoch: 2, train_loss: 1.3131, test_loss: 1.3263, test_f1: 0.2274
 epoch: 3, train_loss: 1.3000, test_loss: 1.3096, test_f1: 0.2276
 epoch: 4, train_loss: 1.2895, test_loss: 1.2928, test_f1: 0.2276
 epoch: 5, train_loss: 1.2800, test_loss: 1.2780, test_f1: 0.2271
 epoch: 6, train_loss: 1.2712, test_loss: 1.2664, test_f1: 0.2276
 epoch: 7, train_loss: 1.2599, test_loss: 1.2566, test_f1: 0.2257
 epoch: 8, train_loss: 1.2520, test_loss: 1.2484, test_f1: 0.2275
 epoch: 9, train_loss: 1.2475, test_loss: 1.2417, test_f1: 0.2375
 epoch: 10, train_loss: 1.2410, test_loss: 1.2340, test_f1: 0.2377
 epoch: 11, train_loss: 1.2336, test_loss: 1.2276, test_f1: 0.2731
 epoch: 12, train_loss: 1.2280, test_loss: 1.2230, test_f1: 0.3054
 epoch: 13, train_loss: 1.2231, test_loss: 1.2185, test_f1: 0.3171
 epoch: 14, train_loss: 1.2175, test_loss: 1.2132, test_f1: 0.3430
 epoch: 15, train_loss: 1.2098, test_loss: 1.2080, test_f1: 0.3488
 epoch: 16, train_loss: 1.2030, test_loss: 1.2026, test_f1: 0.3614
 epoch: 17, train_loss: 1.1968, test_loss: 1.1954, test_f1: 0.3711
 epoch: 18, train_loss: 1.1876, test_loss: 1.1931, test_f1: 0.3751
 epoch: 19, train_loss: 1.1846, test_loss: 1.1862, test_f1: 0.3807
 epoch: 20, train_loss: 1.1832, test_loss: 1.1798, test_f1: 0.3880
 epoch: 21, train_loss: 1.1752, test_loss: 1.1762, test_f1: 0.4066
 epoch: 22, train_loss: 1.1671, test_loss: 1.1692, test_f1: 0.4212
 epoch: 23, train_loss: 1.1562, test_loss: 1.1668, test_f1: 0.4275
 epoch: 24, train_loss: 1.1502, test_loss: 1.1665, test_f1: 0.4331
 epoch: 25, train_loss: 1.1364, test_loss: 1.1602, test_f1: 0.4362
 epoch: 26, train_loss: 1.1342, test_loss: 1.1602, test_f1: 0.4288
 epoch: 27, train_loss: 1.1296, test_loss: 1.1547, test_f1: 0.4393
 epoch: 28, train_loss: 1.1185, test_loss: 1.1540, test_f1: 0.4184
 epoch: 29, train_loss: 1.1026, test_loss: 1.1506, test_f1: 0.4268
 epoch: 30, train_loss: 1.0989, test_loss: 1.1456, test_f1: 0.4465
 epoch: 31, train_loss: 1.0921, test_loss: 1.1485, test_f1: 0.4478
 epoch: 32, train_loss: 1.0889, test_loss: 1.1404, test_f1: 0.4354
 epoch: 33, train_loss: 1.0776, test_loss: 1.1429, test_f1: 0.4424
 epoch: 34, train_loss: 1.0765, test_loss: 1.1473, test_f1: 0.4534
 epoch: 35, train_loss: 1.0683, test_loss: 1.1472, test_f1: 0.4558
 epoch: 36, train_loss: 1.0585, test_loss: 1.1498, test_f1: 0.4683
 epoch: 37, train_loss: 1.0521, test_loss: 1.1471, test_f1: 0.4611
 epoch: 38, train_loss: 1.0423, test_loss: 1.1274, test_f1: 0.4541
 epoch: 39, train_loss: 1.0376, test_loss: 1.1605, test_f1: 0.4567
 epoch: 40, train_loss: 1.0374, test_loss: 1.1408, test_f1: 0.4651
 epoch: 41, train_loss: 1.0219, test_loss: 1.1355, test_f1: 0.4672
 epoch: 42, train_loss: 1.0256, test_loss: 1.1502, test_f1: 0.4524
 epoch: 43, train_loss: 1.0135, test_loss: 1.1307, test_f1: 0.4653
 epoch: 44, train_loss: 1.0060, test_loss: 1.1666, test_f1: 0.4655
 epoch: 45, train_loss: 1.0106, test_loss: 1.1238, test_f1: 0.4621
 epoch: 46, train_loss: 1.0097, test_loss: 1.1482, test_f1: 0.4694
 epoch: 47, train_loss: 0.9899, test_loss: 1.1218, test_f1: 0.4651
 epoch: 48, train_loss: 0.9852, test_loss: 1.1303, test_f1: 0.4723
 epoch: 49, train_loss: 0.9829, test_loss: 1.1451, test_f1: 0.4702
 epoch: 50, train_loss: 0.9806, test_loss: 1.1267, test_f1: 0.4655
 epoch: 51, train_loss: 0.9833, test_loss: 1.1506, test_f1: 0.4734
 epoch: 52, train_loss: 0.9885, test_loss: 1.1308, test_f1: 0.4743
 epoch: 53, train_loss: 0.9652, test_loss: 1.1531, test_f1: 0.4573
 epoch: 54, train_loss: 0.9725, test_loss: 1.1453, test_f1: 0.4647
 epoch: 55, train_loss: 0.9719, test_loss: 1.1394, test_f1: 0.4696
 epoch: 56, train_loss: 0.9622, test_loss: 1.1457, test_f1: 0.4682
 epoch: 57, train_loss: 0.9565, test_loss: 1.1601, test_f1: 0.4533
 epoch: 58, train_loss: 0.9490, test_loss: 1.1632, test_f1: 0.4758
 epoch: 59, train_loss: 0.9564, test_loss: 1.1436, test_f1: 0.4666
 epoch: 60, train_loss: 0.9621, test_loss: 1.1518, test_f1: 0.4611
 epoch: 61, train_loss: 0.9470, test_loss: 1.1504, test_f1: 0.4722
 epoch: 62, train_loss: 0.9490, test_loss: 1.1454, test_f1: 0.4618
 epoch: 63, train_loss: 0.9412, test_loss: 1.1507, test_f1: 0.4656
 epoch: 64, train_loss: 0.9481, test_loss: 1.1426, test_f1: 0.4663
 epoch: 65, train_loss: 0.9423, test_loss: 1.1655, test_f1: 0.4565
 epoch: 66, train_loss: 0.9522, test_loss: 1.1509, test_f1: 0.4782
 epoch: 67, train_loss: 0.9359, test_loss: 1.1502, test_f1: 0.4729
 epoch: 68, train_loss: 0.9406, test_loss: 1.1587, test_f1: 0.4722
 epoch: 69, train_loss: 0.9340, test_loss: 1.1566, test_f1: 0.4728
 epoch: 70, train_loss: 0.9377, test_loss: 1.1669, test_f1: 0.4638
 epoch: 71, train_loss: 0.9265, test_loss: 1.1444, test_f1: 0.4755
 epoch: 72, train_loss: 0.9279, test_loss: 1.1628, test_f1: 0.4660
 epoch: 73, train_loss: 0.9240, test_loss: 1.1655, test_f1: 0.4635
 epoch: 74, train_loss: 0.9284, test_loss: 1.1612, test_f1: 0.4614
 epoch: 75, train_loss: 0.9149, test_loss: 1.1761, test_f1: 0.4660
 epoch: 76, train_loss: 0.9129, test_loss: 1.1688, test_f1: 0.4724
 epoch: 77, train_loss: 0.9170, test_loss: 1.1536, test_f1: 0.4799
 epoch: 78, train_loss: 0.9271, test_loss: 1.1625, test_f1: 0.4549
 epoch: 79, train_loss: 0.9291, test_loss: 1.1705, test_f1: 0.4745
 epoch: 80, train_loss: 0.9054, test_loss: 1.1686, test_f1: 0.4644
 epoch: 81, train_loss: 0.9159, test_loss: 1.1862, test_f1: 0.4512
 epoch: 82, train_loss: 0.9058, test_loss: 1.1740, test_f1: 0.4765
 epoch: 83, train_loss: 0.9239, test_loss: 1.1611, test_f1: 0.4708
 epoch: 84, train_loss: 0.9074, test_loss: 1.1798, test_f1: 0.4549
 epoch: 85, train_loss: 0.9084, test_loss: 1.1706, test_f1: 0.4679
 epoch: 86, train_loss: 0.9018, test_loss: 1.1748, test_f1: 0.4486
 epoch: 87, train_loss: 0.9058, test_loss: 1.1885, test_f1: 0.4547
 epoch: 88, train_loss: 0.8939, test_loss: 1.1916, test_f1: 0.4666
 epoch: 89, train_loss: 0.8934, test_loss: 1.1981, test_f1: 0.4632
 epoch: 90, train_loss: 0.8937, test_loss: 1.2062, test_f1: 0.4581
 epoch: 91, train_loss: 0.8959, test_loss: 1.1825, test_f1: 0.4743
 epoch: 92, train_loss: 0.8913, test_loss: 1.2290, test_f1: 0.4583
 epoch: 93, train_loss: 0.8935, test_loss: 1.1838, test_f1: 0.4792
 epoch: 94, train_loss: 0.8881, test_loss: 1.2015, test_f1: 0.4686
 epoch: 95, train_loss: 0.8830, test_loss: 1.2079, test_f1: 0.4747
 epoch: 96, train_loss: 0.8852, test_loss: 1.1822, test_f1: 0.4758
 epoch: 97, train_loss: 0.8867, test_loss: 1.2038, test_f1: 0.4699
 epoch: 98, train_loss: 0.8779, test_loss: 1.1829, test_f1: 0.4701
 epoch: 99, train_loss: 0.8868, test_loss: 1.1945, test_f1: 0.4695
##################ITERATION #2 ****************************************
 epoch: 0, train_loss: 1.3227, test_loss: 1.3399, test_f1: 0.2274
 epoch: 1, train_loss: 1.3004, test_loss: 1.3261, test_f1: 0.2274
 epoch: 2, train_loss: 1.2848, test_loss: 1.2988, test_f1: 0.2274
 epoch: 3, train_loss: 1.2724, test_loss: 1.2708, test_f1: 0.2555
 epoch: 4, train_loss: 1.2592, test_loss: 1.2504, test_f1: 0.2853
 epoch: 5, train_loss: 1.2497, test_loss: 1.2347, test_f1: 0.3098
 epoch: 6, train_loss: 1.2376, test_loss: 1.2231, test_f1: 0.3300
 epoch: 7, train_loss: 1.2275, test_loss: 1.2119, test_f1: 0.3334
 epoch: 8, train_loss: 1.2177, test_loss: 1.2029, test_f1: 0.3606
 epoch: 9, train_loss: 1.2103, test_loss: 1.1951, test_f1: 0.3929
 epoch: 10, train_loss: 1.2039, test_loss: 1.1882, test_f1: 0.3999
 epoch: 11, train_loss: 1.1946, test_loss: 1.1827, test_f1: 0.3997
 epoch: 12, train_loss: 1.1851, test_loss: 1.1752, test_f1: 0.4124
 epoch: 13, train_loss: 1.1808, test_loss: 1.1696, test_f1: 0.4129
 epoch: 14, train_loss: 1.1767, test_loss: 1.1641, test_f1: 0.4219
 epoch: 15, train_loss: 1.1658, test_loss: 1.1604, test_f1: 0.4263
 epoch: 16, train_loss: 1.1663, test_loss: 1.1573, test_f1: 0.4335
 epoch: 17, train_loss: 1.1549, test_loss: 1.1519, test_f1: 0.4488
 epoch: 18, train_loss: 1.1462, test_loss: 1.1469, test_f1: 0.4492
 epoch: 19, train_loss: 1.1406, test_loss: 1.1450, test_f1: 0.4492
 epoch: 20, train_loss: 1.1364, test_loss: 1.1397, test_f1: 0.4490
 epoch: 21, train_loss: 1.1290, test_loss: 1.1342, test_f1: 0.4446
 epoch: 22, train_loss: 1.1250, test_loss: 1.1310, test_f1: 0.4538
 epoch: 23, train_loss: 1.1139, test_loss: 1.1270, test_f1: 0.4452
 epoch: 24, train_loss: 1.1065, test_loss: 1.1270, test_f1: 0.4508
 epoch: 25, train_loss: 1.1052, test_loss: 1.1216, test_f1: 0.4473
 epoch: 26, train_loss: 1.0949, test_loss: 1.1183, test_f1: 0.4625
 epoch: 27, train_loss: 1.0870, test_loss: 1.1200, test_f1: 0.4590
 epoch: 28, train_loss: 1.0841, test_loss: 1.1201, test_f1: 0.4540
 epoch: 29, train_loss: 1.0781, test_loss: 1.1104, test_f1: 0.4533
 epoch: 30, train_loss: 1.0655, test_loss: 1.1063, test_f1: 0.4679
 epoch: 31, train_loss: 1.0673, test_loss: 1.1052, test_f1: 0.4591
 epoch: 32, train_loss: 1.0588, test_loss: 1.1033, test_f1: 0.4677
 epoch: 33, train_loss: 1.0560, test_loss: 1.0982, test_f1: 0.4642
 epoch: 34, train_loss: 1.0526, test_loss: 1.0871, test_f1: 0.4712
 epoch: 35, train_loss: 1.0364, test_loss: 1.0897, test_f1: 0.4778
 epoch: 36, train_loss: 1.0272, test_loss: 1.0844, test_f1: 0.4830
 epoch: 37, train_loss: 1.0167, test_loss: 1.0955, test_f1: 0.4656
 epoch: 38, train_loss: 1.0145, test_loss: 1.0824, test_f1: 0.4771
 epoch: 39, train_loss: 1.0098, test_loss: 1.0968, test_f1: 0.4889
 epoch: 40, train_loss: 1.0139, test_loss: 1.0788, test_f1: 0.4776
 epoch: 41, train_loss: 1.0011, test_loss: 1.0832, test_f1: 0.4822
 epoch: 42, train_loss: 0.9959, test_loss: 1.0653, test_f1: 0.4791
 epoch: 43, train_loss: 0.9855, test_loss: 1.0784, test_f1: 0.4881
 epoch: 44, train_loss: 0.9768, test_loss: 1.0821, test_f1: 0.4857
 epoch: 45, train_loss: 0.9770, test_loss: 1.0736, test_f1: 0.4865
 epoch: 46, train_loss: 0.9659, test_loss: 1.0813, test_f1: 0.4770
 epoch: 47, train_loss: 0.9644, test_loss: 1.0763, test_f1: 0.4913
 epoch: 48, train_loss: 0.9600, test_loss: 1.0685, test_f1: 0.4982
 epoch: 49, train_loss: 0.9646, test_loss: 1.0828, test_f1: 0.4941
 epoch: 50, train_loss: 0.9492, test_loss: 1.0691, test_f1: 0.4957
 epoch: 51, train_loss: 0.9420, test_loss: 1.0613, test_f1: 0.4934
 epoch: 52, train_loss: 0.9395, test_loss: 1.0655, test_f1: 0.4949
 epoch: 53, train_loss: 0.9327, test_loss: 1.0810, test_f1: 0.4915
 epoch: 54, train_loss: 0.9233, test_loss: 1.0772, test_f1: 0.4902
 epoch: 55, train_loss: 0.9270, test_loss: 1.0782, test_f1: 0.4928
 epoch: 56, train_loss: 0.9234, test_loss: 1.0718, test_f1: 0.4956
 epoch: 57, train_loss: 0.9129, test_loss: 1.0779, test_f1: 0.4940
 epoch: 58, train_loss: 0.9186, test_loss: 1.0854, test_f1: 0.4767
 epoch: 59, train_loss: 0.9229, test_loss: 1.0798, test_f1: 0.4725
 epoch: 60, train_loss: 0.9043, test_loss: 1.0820, test_f1: 0.4847
 epoch: 61, train_loss: 0.9055, test_loss: 1.0778, test_f1: 0.4861
 epoch: 62, train_loss: 0.8995, test_loss: 1.0861, test_f1: 0.4920
 epoch: 63, train_loss: 0.8985, test_loss: 1.0959, test_f1: 0.4955
 epoch: 64, train_loss: 0.9017, test_loss: 1.0811, test_f1: 0.5022
 epoch: 65, train_loss: 0.8958, test_loss: 1.0818, test_f1: 0.4971
 epoch: 66, train_loss: 0.8958, test_loss: 1.0929, test_f1: 0.4937
 epoch: 67, train_loss: 0.8916, test_loss: 1.0908, test_f1: 0.4988
 epoch: 68, train_loss: 0.8893, test_loss: 1.0894, test_f1: 0.5005
 epoch: 69, train_loss: 0.8801, test_loss: 1.0778, test_f1: 0.4983
 epoch: 70, train_loss: 0.8704, test_loss: 1.0837, test_f1: 0.4953
 epoch: 71, train_loss: 0.8756, test_loss: 1.0948, test_f1: 0.4974
 epoch: 72, train_loss: 0.8795, test_loss: 1.0899, test_f1: 0.5014
 epoch: 73, train_loss: 0.8791, test_loss: 1.0821, test_f1: 0.4968
 epoch: 74, train_loss: 0.8797, test_loss: 1.0947, test_f1: 0.4970
 epoch: 75, train_loss: 0.8734, test_loss: 1.1017, test_f1: 0.4846
 epoch: 76, train_loss: 0.8675, test_loss: 1.0915, test_f1: 0.4904
 epoch: 77, train_loss: 0.8661, test_loss: 1.0890, test_f1: 0.4821
 epoch: 78, train_loss: 0.8628, test_loss: 1.0837, test_f1: 0.4954
 epoch: 79, train_loss: 0.8663, test_loss: 1.0819, test_f1: 0.4987
 epoch: 80, train_loss: 0.8645, test_loss: 1.0910, test_f1: 0.4977
 epoch: 81, train_loss: 0.8561, test_loss: 1.0936, test_f1: 0.4948
 epoch: 82, train_loss: 0.8446, test_loss: 1.1065, test_f1: 0.4931
 epoch: 83, train_loss: 0.8568, test_loss: 1.1017, test_f1: 0.4916
 epoch: 84, train_loss: 0.8483, test_loss: 1.1079, test_f1: 0.4958
 epoch: 85, train_loss: 0.8575, test_loss: 1.1032, test_f1: 0.4887
 epoch: 86, train_loss: 0.8550, test_loss: 1.1106, test_f1: 0.4762
 epoch: 87, train_loss: 0.8500, test_loss: 1.1009, test_f1: 0.4779
 epoch: 88, train_loss: 0.8449, test_loss: 1.1032, test_f1: 0.4838
 epoch: 89, train_loss: 0.8462, test_loss: 1.0992, test_f1: 0.4823
 epoch: 90, train_loss: 0.8389, test_loss: 1.1009, test_f1: 0.4873
 epoch: 91, train_loss: 0.8482, test_loss: 1.1025, test_f1: 0.4811
 epoch: 92, train_loss: 0.8338, test_loss: 1.0985, test_f1: 0.4962
 epoch: 93, train_loss: 0.8228, test_loss: 1.0952, test_f1: 0.4911
 epoch: 94, train_loss: 0.8364, test_loss: 1.1098, test_f1: 0.4875
 epoch: 95, train_loss: 0.8291, test_loss: 1.1125, test_f1: 0.4846
 epoch: 96, train_loss: 0.8307, test_loss: 1.0952, test_f1: 0.4928
 epoch: 97, train_loss: 0.8169, test_loss: 1.1164, test_f1: 0.4795
 epoch: 98, train_loss: 0.8258, test_loss: 1.1114, test_f1: 0.4815
 epoch: 99, train_loss: 0.8243, test_loss: 1.1119, test_f1: 0.4813
##################ITERATION #3 ****************************************
 epoch: 0, train_loss: 1.3015, test_loss: 1.3345, test_f1: 0.2274
 epoch: 1, train_loss: 1.2769, test_loss: 1.3168, test_f1: 0.2274
 epoch: 2, train_loss: 1.2626, test_loss: 1.2857, test_f1: 0.2556
 epoch: 3, train_loss: 1.2489, test_loss: 1.2609, test_f1: 0.2683
 epoch: 4, train_loss: 1.2364, test_loss: 1.2358, test_f1: 0.2829
 epoch: 5, train_loss: 1.2221, test_loss: 1.2173, test_f1: 0.3260
 epoch: 6, train_loss: 1.2135, test_loss: 1.2042, test_f1: 0.3252
 epoch: 7, train_loss: 1.2066, test_loss: 1.1953, test_f1: 0.3313
 epoch: 8, train_loss: 1.1940, test_loss: 1.1875, test_f1: 0.3415
 epoch: 9, train_loss: 1.1886, test_loss: 1.1790, test_f1: 0.3607
 epoch: 10, train_loss: 1.1758, test_loss: 1.1727, test_f1: 0.3660
 epoch: 11, train_loss: 1.1686, test_loss: 1.1660, test_f1: 0.3733
 epoch: 12, train_loss: 1.1638, test_loss: 1.1586, test_f1: 0.3879
 epoch: 13, train_loss: 1.1544, test_loss: 1.1527, test_f1: 0.4016
 epoch: 14, train_loss: 1.1475, test_loss: 1.1478, test_f1: 0.4091
 epoch: 15, train_loss: 1.1394, test_loss: 1.1437, test_f1: 0.4107
 epoch: 16, train_loss: 1.1363, test_loss: 1.1401, test_f1: 0.4125
 epoch: 17, train_loss: 1.1310, test_loss: 1.1399, test_f1: 0.4074
 epoch: 18, train_loss: 1.1184, test_loss: 1.1331, test_f1: 0.4154
 epoch: 19, train_loss: 1.1109, test_loss: 1.1326, test_f1: 0.4311
 epoch: 20, train_loss: 1.1088, test_loss: 1.1244, test_f1: 0.4249
 epoch: 21, train_loss: 1.0923, test_loss: 1.1169, test_f1: 0.4278
 epoch: 22, train_loss: 1.0957, test_loss: 1.1173, test_f1: 0.4322
 epoch: 23, train_loss: 1.0929, test_loss: 1.1066, test_f1: 0.4393
 epoch: 24, train_loss: 1.0797, test_loss: 1.1084, test_f1: 0.4218
 epoch: 25, train_loss: 1.0792, test_loss: 1.0977, test_f1: 0.4381
 epoch: 26, train_loss: 1.0743, test_loss: 1.0968, test_f1: 0.4483
 epoch: 27, train_loss: 1.0674, test_loss: 1.1060, test_f1: 0.4442
 epoch: 28, train_loss: 1.0553, test_loss: 1.0956, test_f1: 0.4401
 epoch: 29, train_loss: 1.0561, test_loss: 1.0892, test_f1: 0.4451
 epoch: 30, train_loss: 1.0486, test_loss: 1.0846, test_f1: 0.4436
 epoch: 31, train_loss: 1.0359, test_loss: 1.0931, test_f1: 0.4478
 epoch: 32, train_loss: 1.0343, test_loss: 1.0865, test_f1: 0.4560
 epoch: 33, train_loss: 1.0184, test_loss: 1.0864, test_f1: 0.4555
 epoch: 34, train_loss: 1.0165, test_loss: 1.0740, test_f1: 0.4658
 epoch: 35, train_loss: 1.0087, test_loss: 1.0791, test_f1: 0.4572
 epoch: 36, train_loss: 1.0067, test_loss: 1.0775, test_f1: 0.4579
 epoch: 37, train_loss: 0.9939, test_loss: 1.0749, test_f1: 0.4683
 epoch: 38, train_loss: 0.9949, test_loss: 1.0878, test_f1: 0.4581
 epoch: 39, train_loss: 0.9933, test_loss: 1.0792, test_f1: 0.4421
 epoch: 40, train_loss: 0.9804, test_loss: 1.0661, test_f1: 0.4591
 epoch: 41, train_loss: 0.9765, test_loss: 1.0729, test_f1: 0.4649
 epoch: 42, train_loss: 0.9736, test_loss: 1.0820, test_f1: 0.4576
 epoch: 43, train_loss: 0.9686, test_loss: 1.0933, test_f1: 0.4596
 epoch: 44, train_loss: 0.9652, test_loss: 1.0836, test_f1: 0.4611
 epoch: 45, train_loss: 0.9547, test_loss: 1.0754, test_f1: 0.4641
 epoch: 46, train_loss: 0.9475, test_loss: 1.0884, test_f1: 0.4652
 epoch: 47, train_loss: 0.9480, test_loss: 1.1006, test_f1: 0.4539
 epoch: 48, train_loss: 0.9431, test_loss: 1.0864, test_f1: 0.4706
 epoch: 49, train_loss: 0.9338, test_loss: 1.0800, test_f1: 0.4723
 epoch: 50, train_loss: 0.9289, test_loss: 1.0966, test_f1: 0.4597
 epoch: 51, train_loss: 0.9074, test_loss: 1.0908, test_f1: 0.4689
 epoch: 52, train_loss: 0.9109, test_loss: 1.1035, test_f1: 0.4688
 epoch: 53, train_loss: 0.9178, test_loss: 1.1033, test_f1: 0.4653
 epoch: 54, train_loss: 0.9062, test_loss: 1.1036, test_f1: 0.4641
 epoch: 55, train_loss: 0.9211, test_loss: 1.1082, test_f1: 0.4604
 epoch: 56, train_loss: 0.9059, test_loss: 1.0976, test_f1: 0.4672
 epoch: 57, train_loss: 0.9123, test_loss: 1.1119, test_f1: 0.4592
 epoch: 58, train_loss: 0.9120, test_loss: 1.1170, test_f1: 0.4609
 epoch: 59, train_loss: 0.8914, test_loss: 1.1015, test_f1: 0.4679
 epoch: 60, train_loss: 0.8957, test_loss: 1.1130, test_f1: 0.4645
 epoch: 61, train_loss: 0.9008, test_loss: 1.1090, test_f1: 0.4721
 epoch: 62, train_loss: 0.9042, test_loss: 1.0978, test_f1: 0.4793
 epoch: 63, train_loss: 0.8999, test_loss: 1.1060, test_f1: 0.4743
 epoch: 64, train_loss: 0.9009, test_loss: 1.1084, test_f1: 0.4751
 epoch: 65, train_loss: 0.8995, test_loss: 1.1093, test_f1: 0.4573
 epoch: 66, train_loss: 0.8883, test_loss: 1.1144, test_f1: 0.4667
 epoch: 67, train_loss: 0.8888, test_loss: 1.1112, test_f1: 0.4657
 epoch: 68, train_loss: 0.8914, test_loss: 1.1222, test_f1: 0.4627
 epoch: 69, train_loss: 0.8846, test_loss: 1.1221, test_f1: 0.4613
 epoch: 70, train_loss: 0.8748, test_loss: 1.1200, test_f1: 0.4552
 epoch: 71, train_loss: 0.8873, test_loss: 1.1350, test_f1: 0.4596
 epoch: 72, train_loss: 0.8831, test_loss: 1.1328, test_f1: 0.4595
 epoch: 73, train_loss: 0.8870, test_loss: 1.1351, test_f1: 0.4577
 epoch: 74, train_loss: 0.8809, test_loss: 1.1197, test_f1: 0.4631
 epoch: 75, train_loss: 0.8685, test_loss: 1.1407, test_f1: 0.4553
 epoch: 76, train_loss: 0.8786, test_loss: 1.1582, test_f1: 0.4530
 epoch: 77, train_loss: 0.8609, test_loss: 1.1523, test_f1: 0.4544
 epoch: 78, train_loss: 0.8865, test_loss: 1.1537, test_f1: 0.4585
 epoch: 79, train_loss: 0.8755, test_loss: 1.1551, test_f1: 0.4616
 epoch: 80, train_loss: 0.8736, test_loss: 1.1383, test_f1: 0.4658
 epoch: 81, train_loss: 0.8618, test_loss: 1.1486, test_f1: 0.4626
 epoch: 82, train_loss: 0.8705, test_loss: 1.1471, test_f1: 0.4686
 epoch: 83, train_loss: 0.8640, test_loss: 1.1444, test_f1: 0.4625
 epoch: 84, train_loss: 0.8646, test_loss: 1.1537, test_f1: 0.4579
 epoch: 85, train_loss: 0.8574, test_loss: 1.1540, test_f1: 0.4611
 epoch: 86, train_loss: 0.8599, test_loss: 1.1437, test_f1: 0.4604
 epoch: 87, train_loss: 0.8753, test_loss: 1.1537, test_f1: 0.4603
 epoch: 88, train_loss: 0.8619, test_loss: 1.1702, test_f1: 0.4534
 epoch: 89, train_loss: 0.8511, test_loss: 1.1650, test_f1: 0.4595
 epoch: 90, train_loss: 0.8491, test_loss: 1.1654, test_f1: 0.4622
 epoch: 91, train_loss: 0.8498, test_loss: 1.1615, test_f1: 0.4690
 epoch: 92, train_loss: 0.8428, test_loss: 1.1520, test_f1: 0.4631
 epoch: 93, train_loss: 0.8488, test_loss: 1.1839, test_f1: 0.4591
 epoch: 94, train_loss: 0.8520, test_loss: 1.1812, test_f1: 0.4612
 epoch: 95, train_loss: 0.8436, test_loss: 1.1587, test_f1: 0.4548
 epoch: 96, train_loss: 0.8344, test_loss: 1.2020, test_f1: 0.4550
 epoch: 97, train_loss: 0.8381, test_loss: 1.1941, test_f1: 0.4573
 epoch: 98, train_loss: 0.8499, test_loss: 1.1812, test_f1: 0.4604
 epoch: 99, train_loss: 0.8293, test_loss: 1.1873, test_f1: 0.4495
##################ITERATION #4 ****************************************
 epoch: 0, train_loss: 1.2991, test_loss: 1.3097, test_f1: 0.2274
 epoch: 1, train_loss: 1.2695, test_loss: 1.2969, test_f1: 0.2274
 epoch: 2, train_loss: 1.2480, test_loss: 1.2691, test_f1: 0.2375
 epoch: 3, train_loss: 1.2433, test_loss: 1.2370, test_f1: 0.3047
 epoch: 4, train_loss: 1.2315, test_loss: 1.2217, test_f1: 0.3289
 epoch: 5, train_loss: 1.2210, test_loss: 1.2142, test_f1: 0.3330
 epoch: 6, train_loss: 1.2131, test_loss: 1.2055, test_f1: 0.3539
 epoch: 7, train_loss: 1.2093, test_loss: 1.1960, test_f1: 0.3668
 epoch: 8, train_loss: 1.1999, test_loss: 1.1881, test_f1: 0.3852
 epoch: 9, train_loss: 1.1893, test_loss: 1.1830, test_f1: 0.3864
 epoch: 10, train_loss: 1.1891, test_loss: 1.1793, test_f1: 0.3981
 epoch: 11, train_loss: 1.1846, test_loss: 1.1714, test_f1: 0.3997
 epoch: 12, train_loss: 1.1812, test_loss: 1.1642, test_f1: 0.4031
 epoch: 13, train_loss: 1.1699, test_loss: 1.1619, test_f1: 0.3990
 epoch: 14, train_loss: 1.1602, test_loss: 1.1605, test_f1: 0.4034
 epoch: 15, train_loss: 1.1590, test_loss: 1.1550, test_f1: 0.3965
 epoch: 16, train_loss: 1.1481, test_loss: 1.1491, test_f1: 0.3990
 epoch: 17, train_loss: 1.1484, test_loss: 1.1411, test_f1: 0.3994
 epoch: 18, train_loss: 1.1351, test_loss: 1.1368, test_f1: 0.4045
 epoch: 19, train_loss: 1.1304, test_loss: 1.1340, test_f1: 0.4198
 epoch: 20, train_loss: 1.1262, test_loss: 1.1311, test_f1: 0.4057
 epoch: 21, train_loss: 1.1234, test_loss: 1.1306, test_f1: 0.4003
 epoch: 22, train_loss: 1.1252, test_loss: 1.1264, test_f1: 0.4102
 epoch: 23, train_loss: 1.1146, test_loss: 1.1201, test_f1: 0.4075
 epoch: 24, train_loss: 1.1073, test_loss: 1.1162, test_f1: 0.4241
 epoch: 25, train_loss: 1.1013, test_loss: 1.1135, test_f1: 0.4167
 epoch: 26, train_loss: 1.0923, test_loss: 1.1092, test_f1: 0.4097
 epoch: 27, train_loss: 1.0937, test_loss: 1.1063, test_f1: 0.4157
 epoch: 28, train_loss: 1.0813, test_loss: 1.1049, test_f1: 0.4182
 epoch: 29, train_loss: 1.0717, test_loss: 1.1009, test_f1: 0.4171
 epoch: 30, train_loss: 1.0706, test_loss: 1.0973, test_f1: 0.4250
 epoch: 31, train_loss: 1.0656, test_loss: 1.0829, test_f1: 0.4326
 epoch: 32, train_loss: 1.0646, test_loss: 1.0766, test_f1: 0.4367
 epoch: 33, train_loss: 1.0539, test_loss: 1.0731, test_f1: 0.4396
 epoch: 34, train_loss: 1.0466, test_loss: 1.0761, test_f1: 0.4350
 epoch: 35, train_loss: 1.0451, test_loss: 1.0723, test_f1: 0.4346
 epoch: 36, train_loss: 1.0405, test_loss: 1.0767, test_f1: 0.4396
 epoch: 37, train_loss: 1.0301, test_loss: 1.0739, test_f1: 0.4325
 epoch: 38, train_loss: 1.0267, test_loss: 1.0645, test_f1: 0.4415
 epoch: 39, train_loss: 1.0228, test_loss: 1.0604, test_f1: 0.4374
 epoch: 40, train_loss: 1.0143, test_loss: 1.0681, test_f1: 0.4359
 epoch: 41, train_loss: 1.0020, test_loss: 1.0746, test_f1: 0.4307
 epoch: 42, train_loss: 0.9906, test_loss: 1.0706, test_f1: 0.4333
 epoch: 43, train_loss: 0.9959, test_loss: 1.0601, test_f1: 0.4420
 epoch: 44, train_loss: 0.9918, test_loss: 1.0581, test_f1: 0.4305
 epoch: 45, train_loss: 0.9887, test_loss: 1.0725, test_f1: 0.4504
 epoch: 46, train_loss: 0.9825, test_loss: 1.0704, test_f1: 0.4488
 epoch: 47, train_loss: 0.9767, test_loss: 1.0620, test_f1: 0.4297
 epoch: 48, train_loss: 0.9730, test_loss: 1.0665, test_f1: 0.4459
 epoch: 49, train_loss: 0.9675, test_loss: 1.0589, test_f1: 0.4375
 epoch: 50, train_loss: 0.9574, test_loss: 1.0776, test_f1: 0.4553
 epoch: 51, train_loss: 0.9491, test_loss: 1.0688, test_f1: 0.4356
 epoch: 52, train_loss: 0.9499, test_loss: 1.0641, test_f1: 0.4447
 epoch: 53, train_loss: 0.9543, test_loss: 1.0588, test_f1: 0.4426
 epoch: 54, train_loss: 0.9408, test_loss: 1.0589, test_f1: 0.4452
 epoch: 55, train_loss: 0.9354, test_loss: 1.0729, test_f1: 0.4395
 epoch: 56, train_loss: 0.9351, test_loss: 1.0730, test_f1: 0.4327
 epoch: 57, train_loss: 0.9486, test_loss: 1.0662, test_f1: 0.4473
 epoch: 58, train_loss: 0.9292, test_loss: 1.0714, test_f1: 0.4562
 epoch: 59, train_loss: 0.9357, test_loss: 1.0633, test_f1: 0.4550
 epoch: 60, train_loss: 0.9242, test_loss: 1.0713, test_f1: 0.4458
 epoch: 61, train_loss: 0.9184, test_loss: 1.0844, test_f1: 0.4491
 epoch: 62, train_loss: 0.9196, test_loss: 1.0693, test_f1: 0.4621
 epoch: 63, train_loss: 0.9203, test_loss: 1.0742, test_f1: 0.4508
 epoch: 64, train_loss: 0.9268, test_loss: 1.0779, test_f1: 0.4542
 epoch: 65, train_loss: 0.9217, test_loss: 1.0797, test_f1: 0.4498
 epoch: 66, train_loss: 0.9175, test_loss: 1.0724, test_f1: 0.4482
 epoch: 67, train_loss: 0.9183, test_loss: 1.0830, test_f1: 0.4409
 epoch: 68, train_loss: 0.9120, test_loss: 1.0881, test_f1: 0.4509
 epoch: 69, train_loss: 0.9044, test_loss: 1.0683, test_f1: 0.4516
 epoch: 70, train_loss: 0.8981, test_loss: 1.0653, test_f1: 0.4440
 epoch: 71, train_loss: 0.9013, test_loss: 1.0698, test_f1: 0.4446
 epoch: 72, train_loss: 0.8999, test_loss: 1.0858, test_f1: 0.4569
 epoch: 73, train_loss: 0.8911, test_loss: 1.0761, test_f1: 0.4505
 epoch: 74, train_loss: 0.9004, test_loss: 1.0919, test_f1: 0.4532
 epoch: 75, train_loss: 0.8982, test_loss: 1.0788, test_f1: 0.4480
 epoch: 76, train_loss: 0.8962, test_loss: 1.0812, test_f1: 0.4571
 epoch: 77, train_loss: 0.8902, test_loss: 1.0830, test_f1: 0.4533
 epoch: 78, train_loss: 0.8887, test_loss: 1.0824, test_f1: 0.4584
 epoch: 79, train_loss: 0.8793, test_loss: 1.0798, test_f1: 0.4579
 epoch: 80, train_loss: 0.8772, test_loss: 1.0784, test_f1: 0.4527
 epoch: 81, train_loss: 0.8820, test_loss: 1.0870, test_f1: 0.4564
 epoch: 82, train_loss: 0.8926, test_loss: 1.0922, test_f1: 0.4438
 epoch: 83, train_loss: 0.8817, test_loss: 1.1000, test_f1: 0.4554
 epoch: 84, train_loss: 0.8825, test_loss: 1.0929, test_f1: 0.4524
 epoch: 85, train_loss: 0.8797, test_loss: 1.0881, test_f1: 0.4566
 epoch: 86, train_loss: 0.8691, test_loss: 1.0942, test_f1: 0.4569
 epoch: 87, train_loss: 0.8767, test_loss: 1.0884, test_f1: 0.4556
 epoch: 88, train_loss: 0.8684, test_loss: 1.1064, test_f1: 0.4525
 epoch: 89, train_loss: 0.8613, test_loss: 1.1087, test_f1: 0.4500
 epoch: 90, train_loss: 0.8599, test_loss: 1.0994, test_f1: 0.4449
 epoch: 91, train_loss: 0.8688, test_loss: 1.1000, test_f1: 0.4576
 epoch: 92, train_loss: 0.8524, test_loss: 1.1054, test_f1: 0.4559
 epoch: 93, train_loss: 0.8577, test_loss: 1.1038, test_f1: 0.4512
 epoch: 94, train_loss: 0.8653, test_loss: 1.1109, test_f1: 0.4638
 epoch: 95, train_loss: 0.8584, test_loss: 1.1010, test_f1: 0.4505
 epoch: 96, train_loss: 0.8497, test_loss: 1.1039, test_f1: 0.4597
 epoch: 97, train_loss: 0.8499, test_loss: 1.0980, test_f1: 0.4575
 epoch: 98, train_loss: 0.8571, test_loss: 1.1327, test_f1: 0.4499
 epoch: 99, train_loss: 0.8617, test_loss: 1.1089, test_f1: 0.4540
##################ITERATION #5 ****************************************
 epoch: 0, train_loss: 1.3073, test_loss: 1.3183, test_f1: 0.2274
 epoch: 1, train_loss: 1.2768, test_loss: 1.2976, test_f1: 0.2274
 epoch: 2, train_loss: 1.2592, test_loss: 1.2671, test_f1: 0.2661
 epoch: 3, train_loss: 1.2472, test_loss: 1.2359, test_f1: 0.3111
 epoch: 4, train_loss: 1.2387, test_loss: 1.2170, test_f1: 0.3314
 epoch: 5, train_loss: 1.2257, test_loss: 1.2065, test_f1: 0.3178
 epoch: 6, train_loss: 1.2232, test_loss: 1.1943, test_f1: 0.3297
 epoch: 7, train_loss: 1.2088, test_loss: 1.1832, test_f1: 0.3303
 epoch: 8, train_loss: 1.2020, test_loss: 1.1719, test_f1: 0.3436
 epoch: 9, train_loss: 1.1958, test_loss: 1.1607, test_f1: 0.3675
 epoch: 10, train_loss: 1.1906, test_loss: 1.1539, test_f1: 0.3797
 epoch: 11, train_loss: 1.1744, test_loss: 1.1420, test_f1: 0.4205
 epoch: 12, train_loss: 1.1690, test_loss: 1.1338, test_f1: 0.4143
 epoch: 13, train_loss: 1.1603, test_loss: 1.1283, test_f1: 0.4259
 epoch: 14, train_loss: 1.1541, test_loss: 1.1175, test_f1: 0.4373
 epoch: 15, train_loss: 1.1450, test_loss: 1.1135, test_f1: 0.4355
 epoch: 16, train_loss: 1.1365, test_loss: 1.1067, test_f1: 0.4401
 epoch: 17, train_loss: 1.1311, test_loss: 1.0989, test_f1: 0.4483
 epoch: 18, train_loss: 1.1233, test_loss: 1.0928, test_f1: 0.4419
 epoch: 19, train_loss: 1.1145, test_loss: 1.0920, test_f1: 0.4441
 epoch: 20, train_loss: 1.1126, test_loss: 1.0879, test_f1: 0.4475
 epoch: 21, train_loss: 1.1008, test_loss: 1.0814, test_f1: 0.4398
 epoch: 22, train_loss: 1.0927, test_loss: 1.0742, test_f1: 0.4348
 epoch: 23, train_loss: 1.0934, test_loss: 1.0686, test_f1: 0.4364
 epoch: 24, train_loss: 1.0845, test_loss: 1.0659, test_f1: 0.4379
 epoch: 25, train_loss: 1.0735, test_loss: 1.0654, test_f1: 0.4320
 epoch: 26, train_loss: 1.0736, test_loss: 1.0606, test_f1: 0.4409
 epoch: 27, train_loss: 1.0692, test_loss: 1.0561, test_f1: 0.4422
 epoch: 28, train_loss: 1.0638, test_loss: 1.0576, test_f1: 0.4285
 epoch: 29, train_loss: 1.0593, test_loss: 1.0638, test_f1: 0.4313
 epoch: 30, train_loss: 1.0551, test_loss: 1.0592, test_f1: 0.4242
 epoch: 31, train_loss: 1.0455, test_loss: 1.0564, test_f1: 0.4438
 epoch: 32, train_loss: 1.0368, test_loss: 1.0592, test_f1: 0.4423
 epoch: 33, train_loss: 1.0304, test_loss: 1.0510, test_f1: 0.4489
 epoch: 34, train_loss: 1.0371, test_loss: 1.0596, test_f1: 0.4366
 epoch: 35, train_loss: 1.0270, test_loss: 1.0599, test_f1: 0.4361
 epoch: 36, train_loss: 1.0212, test_loss: 1.0644, test_f1: 0.4268
 epoch: 37, train_loss: 1.0165, test_loss: 1.0518, test_f1: 0.4343
 epoch: 38, train_loss: 1.0085, test_loss: 1.0421, test_f1: 0.4450
 epoch: 39, train_loss: 0.9960, test_loss: 1.0555, test_f1: 0.4363
 epoch: 40, train_loss: 1.0014, test_loss: 1.0409, test_f1: 0.4540
 epoch: 41, train_loss: 0.9891, test_loss: 1.0657, test_f1: 0.4428
 epoch: 42, train_loss: 0.9947, test_loss: 1.0571, test_f1: 0.4566
 epoch: 43, train_loss: 0.9883, test_loss: 1.0613, test_f1: 0.4502
 epoch: 44, train_loss: 0.9763, test_loss: 1.0633, test_f1: 0.4553
 epoch: 45, train_loss: 0.9733, test_loss: 1.0386, test_f1: 0.4614
 epoch: 46, train_loss: 0.9757, test_loss: 1.0436, test_f1: 0.4662
 epoch: 47, train_loss: 0.9651, test_loss: 1.0503, test_f1: 0.4640
 epoch: 48, train_loss: 0.9761, test_loss: 1.0343, test_f1: 0.4658
 epoch: 49, train_loss: 0.9528, test_loss: 1.0490, test_f1: 0.4717
 epoch: 50, train_loss: 0.9400, test_loss: 1.0428, test_f1: 0.4653
 epoch: 51, train_loss: 0.9441, test_loss: 1.0471, test_f1: 0.4698
 epoch: 52, train_loss: 0.9266, test_loss: 1.0649, test_f1: 0.4720
 epoch: 53, train_loss: 0.9373, test_loss: 1.0749, test_f1: 0.4737
 epoch: 54, train_loss: 0.9307, test_loss: 1.0894, test_f1: 0.4519
 epoch: 55, train_loss: 0.9281, test_loss: 1.0804, test_f1: 0.4602
 epoch: 56, train_loss: 0.9420, test_loss: 1.0854, test_f1: 0.4567
 epoch: 57, train_loss: 0.9223, test_loss: 1.0768, test_f1: 0.4711
 epoch: 58, train_loss: 0.9268, test_loss: 1.0688, test_f1: 0.4766
 epoch: 59, train_loss: 0.9325, test_loss: 1.0717, test_f1: 0.4740
 epoch: 60, train_loss: 0.9320, test_loss: 1.0777, test_f1: 0.4637
 epoch: 61, train_loss: 0.9103, test_loss: 1.0866, test_f1: 0.4696
 epoch: 62, train_loss: 0.9288, test_loss: 1.0753, test_f1: 0.4611
 epoch: 63, train_loss: 0.9196, test_loss: 1.0625, test_f1: 0.4631
 epoch: 64, train_loss: 0.9167, test_loss: 1.0647, test_f1: 0.4644
 epoch: 65, train_loss: 0.9063, test_loss: 1.0598, test_f1: 0.4705
 epoch: 66, train_loss: 0.9146, test_loss: 1.0602, test_f1: 0.4637
 epoch: 67, train_loss: 0.9022, test_loss: 1.0702, test_f1: 0.4715
 epoch: 68, train_loss: 0.8973, test_loss: 1.0794, test_f1: 0.4702
 epoch: 69, train_loss: 0.8947, test_loss: 1.0991, test_f1: 0.4609
 epoch: 70, train_loss: 0.9024, test_loss: 1.0787, test_f1: 0.4732
 epoch: 71, train_loss: 0.8986, test_loss: 1.0609, test_f1: 0.4654
 epoch: 72, train_loss: 0.8979, test_loss: 1.0952, test_f1: 0.4768
 epoch: 73, train_loss: 0.8947, test_loss: 1.0998, test_f1: 0.4763
 epoch: 74, train_loss: 0.8977, test_loss: 1.1007, test_f1: 0.4710
 epoch: 75, train_loss: 0.8884, test_loss: 1.1095, test_f1: 0.4607
 epoch: 76, train_loss: 0.8949, test_loss: 1.0992, test_f1: 0.4684
 epoch: 77, train_loss: 0.8887, test_loss: 1.1173, test_f1: 0.4709
 epoch: 78, train_loss: 0.8923, test_loss: 1.0913, test_f1: 0.4698
 epoch: 79, train_loss: 0.8857, test_loss: 1.0985, test_f1: 0.4707
 epoch: 80, train_loss: 0.8708, test_loss: 1.0846, test_f1: 0.4728
 epoch: 81, train_loss: 0.8886, test_loss: 1.0982, test_f1: 0.4729
 epoch: 82, train_loss: 0.8779, test_loss: 1.0892, test_f1: 0.4765
 epoch: 83, train_loss: 0.8772, test_loss: 1.1010, test_f1: 0.4713
 epoch: 84, train_loss: 0.8608, test_loss: 1.1362, test_f1: 0.4629
 epoch: 85, train_loss: 0.8709, test_loss: 1.1315, test_f1: 0.4660
 epoch: 86, train_loss: 0.8825, test_loss: 1.1457, test_f1: 0.4507
 epoch: 87, train_loss: 0.8871, test_loss: 1.1179, test_f1: 0.4716
 epoch: 88, train_loss: 0.8548, test_loss: 1.1214, test_f1: 0.4671
 epoch: 89, train_loss: 0.8635, test_loss: 1.1330, test_f1: 0.4745
 epoch: 90, train_loss: 0.8615, test_loss: 1.1202, test_f1: 0.4730
 epoch: 91, train_loss: 0.8809, test_loss: 1.1121, test_f1: 0.4605
 epoch: 92, train_loss: 0.8560, test_loss: 1.0742, test_f1: 0.4811
 epoch: 93, train_loss: 0.8613, test_loss: 1.0904, test_f1: 0.4797
 epoch: 94, train_loss: 0.8668, test_loss: 1.1273, test_f1: 0.4728
 epoch: 95, train_loss: 0.8567, test_loss: 1.1313, test_f1: 0.4770
 epoch: 96, train_loss: 0.8573, test_loss: 1.1282, test_f1: 0.4779
 epoch: 97, train_loss: 0.8627, test_loss: 1.1353, test_f1: 0.4718
 epoch: 98, train_loss: 0.8526, test_loss: 1.1473, test_f1: 0.4709
 epoch: 99, train_loss: 0.8431, test_loss: 1.1519, test_f1: 0.4657
##################ITERATION #6 ****************************************
 epoch: 0, train_loss: 1.2941, test_loss: 1.3205, test_f1: 0.2274
 epoch: 1, train_loss: 1.2652, test_loss: 1.2991, test_f1: 0.2350
 epoch: 2, train_loss: 1.2505, test_loss: 1.2668, test_f1: 0.2562
 epoch: 3, train_loss: 1.2412, test_loss: 1.2310, test_f1: 0.3623
 epoch: 4, train_loss: 1.2225, test_loss: 1.2105, test_f1: 0.3999
 epoch: 5, train_loss: 1.2198, test_loss: 1.1968, test_f1: 0.4066
 epoch: 6, train_loss: 1.2066, test_loss: 1.1849, test_f1: 0.4283
 epoch: 7, train_loss: 1.2053, test_loss: 1.1767, test_f1: 0.4218
 epoch: 8, train_loss: 1.2001, test_loss: 1.1740, test_f1: 0.4274
 epoch: 9, train_loss: 1.1929, test_loss: 1.1680, test_f1: 0.4315
 epoch: 10, train_loss: 1.1813, test_loss: 1.1640, test_f1: 0.4263
 epoch: 11, train_loss: 1.1825, test_loss: 1.1606, test_f1: 0.4246
 epoch: 12, train_loss: 1.1790, test_loss: 1.1543, test_f1: 0.4237
 epoch: 13, train_loss: 1.1701, test_loss: 1.1478, test_f1: 0.4281
 epoch: 14, train_loss: 1.1601, test_loss: 1.1483, test_f1: 0.4330
 epoch: 15, train_loss: 1.1589, test_loss: 1.1426, test_f1: 0.4431
 epoch: 16, train_loss: 1.1533, test_loss: 1.1337, test_f1: 0.4375
 epoch: 17, train_loss: 1.1418, test_loss: 1.1305, test_f1: 0.4440
 epoch: 18, train_loss: 1.1406, test_loss: 1.1263, test_f1: 0.4371
 epoch: 19, train_loss: 1.1287, test_loss: 1.1219, test_f1: 0.4450
 epoch: 20, train_loss: 1.1254, test_loss: 1.1223, test_f1: 0.4315
 epoch: 21, train_loss: 1.1253, test_loss: 1.1135, test_f1: 0.4330
 epoch: 22, train_loss: 1.1151, test_loss: 1.1117, test_f1: 0.4331
 epoch: 23, train_loss: 1.1085, test_loss: 1.1097, test_f1: 0.4497
 epoch: 24, train_loss: 1.1091, test_loss: 1.1068, test_f1: 0.4442
 epoch: 25, train_loss: 1.0979, test_loss: 1.1029, test_f1: 0.4404
 epoch: 26, train_loss: 1.0829, test_loss: 1.1046, test_f1: 0.4488
 epoch: 27, train_loss: 1.0917, test_loss: 1.1016, test_f1: 0.4454
 epoch: 28, train_loss: 1.0806, test_loss: 1.0937, test_f1: 0.4464
 epoch: 29, train_loss: 1.0807, test_loss: 1.1126, test_f1: 0.4467
 epoch: 30, train_loss: 1.0712, test_loss: 1.0986, test_f1: 0.4468
 epoch: 31, train_loss: 1.0714, test_loss: 1.0819, test_f1: 0.4672
 epoch: 32, train_loss: 1.0587, test_loss: 1.0969, test_f1: 0.4447
 epoch: 33, train_loss: 1.0602, test_loss: 1.0840, test_f1: 0.4471
 epoch: 34, train_loss: 1.0521, test_loss: 1.0871, test_f1: 0.4512
 epoch: 35, train_loss: 1.0441, test_loss: 1.0857, test_f1: 0.4480
 epoch: 36, train_loss: 1.0251, test_loss: 1.0855, test_f1: 0.4409
 epoch: 37, train_loss: 1.0182, test_loss: 1.0765, test_f1: 0.4509
 epoch: 38, train_loss: 1.0367, test_loss: 1.0913, test_f1: 0.4443
 epoch: 39, train_loss: 1.0227, test_loss: 1.0900, test_f1: 0.4566
 epoch: 40, train_loss: 1.0122, test_loss: 1.0701, test_f1: 0.4615
 epoch: 41, train_loss: 1.0226, test_loss: 1.0717, test_f1: 0.4610
 epoch: 42, train_loss: 1.0035, test_loss: 1.0697, test_f1: 0.4637
 epoch: 43, train_loss: 1.0000, test_loss: 1.0824, test_f1: 0.4629
 epoch: 44, train_loss: 0.9842, test_loss: 1.0788, test_f1: 0.4654
 epoch: 45, train_loss: 0.9899, test_loss: 1.0574, test_f1: 0.4734
 epoch: 46, train_loss: 0.9928, test_loss: 1.0698, test_f1: 0.4592
 epoch: 47, train_loss: 0.9817, test_loss: 1.0833, test_f1: 0.4696
 epoch: 48, train_loss: 0.9634, test_loss: 1.0809, test_f1: 0.4733
 epoch: 49, train_loss: 0.9704, test_loss: 1.0859, test_f1: 0.4673
 epoch: 50, train_loss: 0.9622, test_loss: 1.0754, test_f1: 0.4756
 epoch: 51, train_loss: 0.9669, test_loss: 1.0817, test_f1: 0.4670
 epoch: 52, train_loss: 0.9729, test_loss: 1.0763, test_f1: 0.4691
 epoch: 53, train_loss: 0.9558, test_loss: 1.0740, test_f1: 0.4737
 epoch: 54, train_loss: 0.9427, test_loss: 1.0828, test_f1: 0.4588
 epoch: 55, train_loss: 0.9574, test_loss: 1.0831, test_f1: 0.4574
 epoch: 56, train_loss: 0.9502, test_loss: 1.0726, test_f1: 0.4657
 epoch: 57, train_loss: 0.9384, test_loss: 1.0752, test_f1: 0.4742
 epoch: 58, train_loss: 0.9488, test_loss: 1.0725, test_f1: 0.4694
 epoch: 59, train_loss: 0.9366, test_loss: 1.0675, test_f1: 0.4729
 epoch: 60, train_loss: 0.9251, test_loss: 1.0856, test_f1: 0.4685
 epoch: 61, train_loss: 0.9430, test_loss: 1.0911, test_f1: 0.4717
 epoch: 62, train_loss: 0.9405, test_loss: 1.0790, test_f1: 0.4714
 epoch: 63, train_loss: 0.9394, test_loss: 1.0655, test_f1: 0.4720
 epoch: 64, train_loss: 0.9316, test_loss: 1.0810, test_f1: 0.4685
 epoch: 65, train_loss: 0.9366, test_loss: 1.0806, test_f1: 0.4698
 epoch: 66, train_loss: 0.9310, test_loss: 1.0824, test_f1: 0.4634
 epoch: 67, train_loss: 0.9245, test_loss: 1.0788, test_f1: 0.4613
 epoch: 68, train_loss: 0.9323, test_loss: 1.0844, test_f1: 0.4691
 epoch: 69, train_loss: 0.9105, test_loss: 1.0841, test_f1: 0.4785
 epoch: 70, train_loss: 0.9281, test_loss: 1.0782, test_f1: 0.4770
 epoch: 71, train_loss: 0.9140, test_loss: 1.0993, test_f1: 0.4534
 epoch: 72, train_loss: 0.9161, test_loss: 1.0970, test_f1: 0.4542
 epoch: 73, train_loss: 0.9258, test_loss: 1.0925, test_f1: 0.4545
 epoch: 74, train_loss: 0.9057, test_loss: 1.0897, test_f1: 0.4648
 epoch: 75, train_loss: 0.9055, test_loss: 1.0976, test_f1: 0.4611
 epoch: 76, train_loss: 0.9072, test_loss: 1.0940, test_f1: 0.4645
 epoch: 77, train_loss: 0.9169, test_loss: 1.0876, test_f1: 0.4702
 epoch: 78, train_loss: 0.9045, test_loss: 1.1196, test_f1: 0.4548
 epoch: 79, train_loss: 0.9011, test_loss: 1.1058, test_f1: 0.4561
 epoch: 80, train_loss: 0.9036, test_loss: 1.1068, test_f1: 0.4577
 epoch: 81, train_loss: 0.8978, test_loss: 1.1135, test_f1: 0.4631
 epoch: 82, train_loss: 0.8924, test_loss: 1.0898, test_f1: 0.4543
 epoch: 83, train_loss: 0.8928, test_loss: 1.1124, test_f1: 0.4509
 epoch: 84, train_loss: 0.8883, test_loss: 1.1131, test_f1: 0.4507
 epoch: 85, train_loss: 0.8921, test_loss: 1.1072, test_f1: 0.4510
 epoch: 86, train_loss: 0.8782, test_loss: 1.1137, test_f1: 0.4605
 epoch: 87, train_loss: 0.9013, test_loss: 1.1098, test_f1: 0.4486
 epoch: 88, train_loss: 0.8965, test_loss: 1.1133, test_f1: 0.4612
 epoch: 89, train_loss: 0.9016, test_loss: 1.1147, test_f1: 0.4516
 epoch: 90, train_loss: 0.8777, test_loss: 1.1292, test_f1: 0.4497
 epoch: 91, train_loss: 0.8882, test_loss: 1.1216, test_f1: 0.4580
 epoch: 92, train_loss: 0.8727, test_loss: 1.1185, test_f1: 0.4521
 epoch: 93, train_loss: 0.8866, test_loss: 1.1194, test_f1: 0.4555
 epoch: 94, train_loss: 0.8710, test_loss: 1.1032, test_f1: 0.4520
 epoch: 95, train_loss: 0.8760, test_loss: 1.1046, test_f1: 0.4547
 epoch: 96, train_loss: 0.8621, test_loss: 1.1109, test_f1: 0.4371
 epoch: 97, train_loss: 0.8731, test_loss: 1.1229, test_f1: 0.4381
 epoch: 98, train_loss: 0.8727, test_loss: 1.1492, test_f1: 0.4285
 epoch: 99, train_loss: 0.8698, test_loss: 1.1606, test_f1: 0.4523
##################ITERATION #7 ****************************************
 epoch: 0, train_loss: 1.3142, test_loss: 1.2989, test_f1: 0.2274
 epoch: 1, train_loss: 1.2764, test_loss: 1.2821, test_f1: 0.2381
 epoch: 2, train_loss: 1.2563, test_loss: 1.2577, test_f1: 0.2559
 epoch: 3, train_loss: 1.2361, test_loss: 1.2294, test_f1: 0.2644
 epoch: 4, train_loss: 1.2238, test_loss: 1.2055, test_f1: 0.3584
 epoch: 5, train_loss: 1.2144, test_loss: 1.1874, test_f1: 0.3876
 epoch: 6, train_loss: 1.2053, test_loss: 1.1789, test_f1: 0.4029
 epoch: 7, train_loss: 1.1942, test_loss: 1.1683, test_f1: 0.4190
 epoch: 8, train_loss: 1.1816, test_loss: 1.1601, test_f1: 0.4196
 epoch: 9, train_loss: 1.1784, test_loss: 1.1523, test_f1: 0.4226
 epoch: 10, train_loss: 1.1661, test_loss: 1.1443, test_f1: 0.4302
 epoch: 11, train_loss: 1.1615, test_loss: 1.1351, test_f1: 0.4349
 epoch: 12, train_loss: 1.1483, test_loss: 1.1250, test_f1: 0.4392
 epoch: 13, train_loss: 1.1478, test_loss: 1.1206, test_f1: 0.4465
 epoch: 14, train_loss: 1.1403, test_loss: 1.1144, test_f1: 0.4514
 epoch: 15, train_loss: 1.1310, test_loss: 1.1109, test_f1: 0.4394
 epoch: 16, train_loss: 1.1262, test_loss: 1.1076, test_f1: 0.4533
 epoch: 17, train_loss: 1.1130, test_loss: 1.1045, test_f1: 0.4452
 epoch: 18, train_loss: 1.1058, test_loss: 1.0952, test_f1: 0.4446
 epoch: 19, train_loss: 1.0981, test_loss: 1.0943, test_f1: 0.4405
 epoch: 20, train_loss: 1.0981, test_loss: 1.0956, test_f1: 0.4462
 epoch: 21, train_loss: 1.0848, test_loss: 1.0853, test_f1: 0.4504
 epoch: 22, train_loss: 1.0850, test_loss: 1.0892, test_f1: 0.4367
 epoch: 23, train_loss: 1.0814, test_loss: 1.0878, test_f1: 0.4454
 epoch: 24, train_loss: 1.0694, test_loss: 1.0948, test_f1: 0.4329
 epoch: 25, train_loss: 1.0613, test_loss: 1.0846, test_f1: 0.4329
 epoch: 26, train_loss: 1.0612, test_loss: 1.0721, test_f1: 0.4390
 epoch: 27, train_loss: 1.0581, test_loss: 1.0882, test_f1: 0.4298
 epoch: 28, train_loss: 1.0419, test_loss: 1.0969, test_f1: 0.4421
 epoch: 29, train_loss: 1.0483, test_loss: 1.0914, test_f1: 0.4356
 epoch: 30, train_loss: 1.0280, test_loss: 1.0788, test_f1: 0.4413
 epoch: 31, train_loss: 1.0370, test_loss: 1.0551, test_f1: 0.4608
 epoch: 32, train_loss: 1.0291, test_loss: 1.0505, test_f1: 0.4579
 epoch: 33, train_loss: 1.0228, test_loss: 1.0609, test_f1: 0.4566
 epoch: 34, train_loss: 1.0093, test_loss: 1.0657, test_f1: 0.4418
 epoch: 35, train_loss: 1.0071, test_loss: 1.0722, test_f1: 0.4335
 epoch: 36, train_loss: 1.0082, test_loss: 1.0557, test_f1: 0.4667
 epoch: 37, train_loss: 0.9958, test_loss: 1.0487, test_f1: 0.4541
 epoch: 38, train_loss: 1.0028, test_loss: 1.0562, test_f1: 0.4457
 epoch: 39, train_loss: 0.9884, test_loss: 1.0560, test_f1: 0.4601
 epoch: 40, train_loss: 0.9914, test_loss: 1.0429, test_f1: 0.4605
 epoch: 41, train_loss: 0.9865, test_loss: 1.0383, test_f1: 0.4644
 epoch: 42, train_loss: 0.9796, test_loss: 1.0386, test_f1: 0.4621
 epoch: 43, train_loss: 0.9729, test_loss: 1.0458, test_f1: 0.4682
 epoch: 44, train_loss: 0.9601, test_loss: 1.0557, test_f1: 0.4572
 epoch: 45, train_loss: 0.9661, test_loss: 1.0501, test_f1: 0.4654
 epoch: 46, train_loss: 0.9511, test_loss: 1.0617, test_f1: 0.4550
 epoch: 47, train_loss: 0.9489, test_loss: 1.0587, test_f1: 0.4514
 epoch: 48, train_loss: 0.9495, test_loss: 1.0489, test_f1: 0.4535
 epoch: 49, train_loss: 0.9319, test_loss: 1.0496, test_f1: 0.4574
 epoch: 50, train_loss: 0.9354, test_loss: 1.0535, test_f1: 0.4583
 epoch: 51, train_loss: 0.9338, test_loss: 1.0422, test_f1: 0.4632
 epoch: 52, train_loss: 0.9287, test_loss: 1.0526, test_f1: 0.4649
 epoch: 53, train_loss: 0.9246, test_loss: 1.0493, test_f1: 0.4624
 epoch: 54, train_loss: 0.9354, test_loss: 1.0488, test_f1: 0.4690
 epoch: 55, train_loss: 0.9089, test_loss: 1.0607, test_f1: 0.4723
 epoch: 56, train_loss: 0.9132, test_loss: 1.0635, test_f1: 0.4579
 epoch: 57, train_loss: 0.9117, test_loss: 1.0677, test_f1: 0.4608
 epoch: 58, train_loss: 0.9064, test_loss: 1.0538, test_f1: 0.4735
 epoch: 59, train_loss: 0.9013, test_loss: 1.0599, test_f1: 0.4710
 epoch: 60, train_loss: 0.9063, test_loss: 1.0448, test_f1: 0.4663
 epoch: 61, train_loss: 0.9005, test_loss: 1.0534, test_f1: 0.4674
 epoch: 62, train_loss: 0.8926, test_loss: 1.0577, test_f1: 0.4657
 epoch: 63, train_loss: 0.9059, test_loss: 1.0595, test_f1: 0.4660
 epoch: 64, train_loss: 0.8946, test_loss: 1.0744, test_f1: 0.4638
 epoch: 65, train_loss: 0.8944, test_loss: 1.0742, test_f1: 0.4549
 epoch: 66, train_loss: 0.8830, test_loss: 1.0661, test_f1: 0.4673
 epoch: 67, train_loss: 0.8831, test_loss: 1.0582, test_f1: 0.4681
 epoch: 68, train_loss: 0.8876, test_loss: 1.0720, test_f1: 0.4546
 epoch: 69, train_loss: 0.8826, test_loss: 1.0695, test_f1: 0.4658
 epoch: 70, train_loss: 0.8840, test_loss: 1.0794, test_f1: 0.4618
 epoch: 71, train_loss: 0.8733, test_loss: 1.0916, test_f1: 0.4587
 epoch: 72, train_loss: 0.8818, test_loss: 1.0901, test_f1: 0.4472
 epoch: 73, train_loss: 0.8819, test_loss: 1.0879, test_f1: 0.4557
 epoch: 74, train_loss: 0.8775, test_loss: 1.0767, test_f1: 0.4592
 epoch: 75, train_loss: 0.8903, test_loss: 1.0724, test_f1: 0.4553
 epoch: 76, train_loss: 0.8725, test_loss: 1.0727, test_f1: 0.4580
 epoch: 77, train_loss: 0.8921, test_loss: 1.0891, test_f1: 0.4509
 epoch: 78, train_loss: 0.8722, test_loss: 1.0869, test_f1: 0.4485
 epoch: 79, train_loss: 0.8796, test_loss: 1.0809, test_f1: 0.4602
 epoch: 80, train_loss: 0.8666, test_loss: 1.0701, test_f1: 0.4608
 epoch: 81, train_loss: 0.8761, test_loss: 1.0657, test_f1: 0.4636
 epoch: 82, train_loss: 0.8585, test_loss: 1.0776, test_f1: 0.4563
 epoch: 83, train_loss: 0.8682, test_loss: 1.0918, test_f1: 0.4623
 epoch: 84, train_loss: 0.8582, test_loss: 1.0776, test_f1: 0.4574
 epoch: 85, train_loss: 0.8681, test_loss: 1.0919, test_f1: 0.4649
 epoch: 86, train_loss: 0.8645, test_loss: 1.0884, test_f1: 0.4579
 epoch: 87, train_loss: 0.8463, test_loss: 1.0838, test_f1: 0.4602
 epoch: 88, train_loss: 0.8563, test_loss: 1.0915, test_f1: 0.4703
 epoch: 89, train_loss: 0.8454, test_loss: 1.0932, test_f1: 0.4614
 epoch: 90, train_loss: 0.8462, test_loss: 1.0810, test_f1: 0.4725
 epoch: 91, train_loss: 0.8497, test_loss: 1.0936, test_f1: 0.4604
 epoch: 92, train_loss: 0.8469, test_loss: 1.0899, test_f1: 0.4518
 epoch: 93, train_loss: 0.8359, test_loss: 1.0978, test_f1: 0.4651
 epoch: 94, train_loss: 0.8338, test_loss: 1.0972, test_f1: 0.4665
 epoch: 95, train_loss: 0.8342, test_loss: 1.1048, test_f1: 0.4563
 epoch: 96, train_loss: 0.8305, test_loss: 1.1006, test_f1: 0.4532
 epoch: 97, train_loss: 0.8271, test_loss: 1.0946, test_f1: 0.4527
 epoch: 98, train_loss: 0.8365, test_loss: 1.1048, test_f1: 0.4526
 epoch: 99, train_loss: 0.8307, test_loss: 1.1028, test_f1: 0.4605
##################ITERATION #8 ****************************************
 epoch: 0, train_loss: 1.3195, test_loss: 1.3074, test_f1: 0.2274
 epoch: 1, train_loss: 1.2672, test_loss: 1.2862, test_f1: 0.2274
 epoch: 2, train_loss: 1.2527, test_loss: 1.2604, test_f1: 0.3078
 epoch: 3, train_loss: 1.2347, test_loss: 1.2440, test_f1: 0.3218
 epoch: 4, train_loss: 1.2182, test_loss: 1.2017, test_f1: 0.3751
 epoch: 5, train_loss: 1.2106, test_loss: 1.1775, test_f1: 0.3942
 epoch: 6, train_loss: 1.2112, test_loss: 1.1660, test_f1: 0.4291
 epoch: 7, train_loss: 1.1895, test_loss: 1.1611, test_f1: 0.4067
 epoch: 8, train_loss: 1.1855, test_loss: 1.1568, test_f1: 0.4111
 epoch: 9, train_loss: 1.1800, test_loss: 1.1528, test_f1: 0.4155
 epoch: 10, train_loss: 1.1756, test_loss: 1.1474, test_f1: 0.4167
 epoch: 11, train_loss: 1.1698, test_loss: 1.1405, test_f1: 0.4212
 epoch: 12, train_loss: 1.1611, test_loss: 1.1371, test_f1: 0.4128
 epoch: 13, train_loss: 1.1554, test_loss: 1.1356, test_f1: 0.4220
 epoch: 14, train_loss: 1.1547, test_loss: 1.1277, test_f1: 0.4264
 epoch: 15, train_loss: 1.1451, test_loss: 1.1256, test_f1: 0.4253
 epoch: 16, train_loss: 1.1411, test_loss: 1.1234, test_f1: 0.4276
 epoch: 17, train_loss: 1.1323, test_loss: 1.1167, test_f1: 0.4264
 epoch: 18, train_loss: 1.1379, test_loss: 1.1157, test_f1: 0.4287
 epoch: 19, train_loss: 1.1237, test_loss: 1.1080, test_f1: 0.4276
 epoch: 20, train_loss: 1.1197, test_loss: 1.1013, test_f1: 0.4430
 epoch: 21, train_loss: 1.1080, test_loss: 1.1014, test_f1: 0.4438
 epoch: 22, train_loss: 1.1101, test_loss: 1.1019, test_f1: 0.4394
 epoch: 23, train_loss: 1.0960, test_loss: 1.0969, test_f1: 0.4365
 epoch: 24, train_loss: 1.0992, test_loss: 1.0848, test_f1: 0.4436
 epoch: 25, train_loss: 1.0781, test_loss: 1.0808, test_f1: 0.4489
 epoch: 26, train_loss: 1.0803, test_loss: 1.0830, test_f1: 0.4439
 epoch: 27, train_loss: 1.0786, test_loss: 1.0762, test_f1: 0.4546
 epoch: 28, train_loss: 1.0649, test_loss: 1.0700, test_f1: 0.4563
 epoch: 29, train_loss: 1.0589, test_loss: 1.0591, test_f1: 0.4624
 epoch: 30, train_loss: 1.0615, test_loss: 1.0563, test_f1: 0.4658
 epoch: 31, train_loss: 1.0598, test_loss: 1.0658, test_f1: 0.4597
 epoch: 32, train_loss: 1.0472, test_loss: 1.0515, test_f1: 0.4648
 epoch: 33, train_loss: 1.0367, test_loss: 1.0516, test_f1: 0.4563
 epoch: 34, train_loss: 1.0503, test_loss: 1.0496, test_f1: 0.4646
 epoch: 35, train_loss: 1.0237, test_loss: 1.0456, test_f1: 0.4676
 epoch: 36, train_loss: 1.0399, test_loss: 1.0487, test_f1: 0.4646
 epoch: 37, train_loss: 1.0226, test_loss: 1.0517, test_f1: 0.4627
 epoch: 38, train_loss: 1.0150, test_loss: 1.0438, test_f1: 0.4682
 epoch: 39, train_loss: 1.0158, test_loss: 1.0452, test_f1: 0.4789
 epoch: 40, train_loss: 0.9981, test_loss: 1.0403, test_f1: 0.4790
 epoch: 41, train_loss: 1.0165, test_loss: 1.0423, test_f1: 0.4694
 epoch: 42, train_loss: 0.9899, test_loss: 1.0371, test_f1: 0.4679
 epoch: 43, train_loss: 1.0001, test_loss: 1.0335, test_f1: 0.4723
 epoch: 44, train_loss: 0.9886, test_loss: 1.0445, test_f1: 0.4644
 epoch: 45, train_loss: 0.9912, test_loss: 1.0327, test_f1: 0.4672
 epoch: 46, train_loss: 0.9772, test_loss: 1.0292, test_f1: 0.4643
 epoch: 47, train_loss: 0.9739, test_loss: 1.0381, test_f1: 0.4738
 epoch: 48, train_loss: 0.9778, test_loss: 1.0288, test_f1: 0.4734
 epoch: 49, train_loss: 0.9739, test_loss: 1.0334, test_f1: 0.4693
 epoch: 50, train_loss: 0.9617, test_loss: 1.0260, test_f1: 0.4710
 epoch: 51, train_loss: 0.9516, test_loss: 1.0439, test_f1: 0.4551
 epoch: 52, train_loss: 0.9518, test_loss: 1.0337, test_f1: 0.4692
 epoch: 53, train_loss: 0.9519, test_loss: 1.0295, test_f1: 0.4679
 epoch: 54, train_loss: 0.9434, test_loss: 1.0414, test_f1: 0.4646
 epoch: 55, train_loss: 0.9532, test_loss: 1.0272, test_f1: 0.4687
 epoch: 56, train_loss: 0.9565, test_loss: 1.0204, test_f1: 0.4695
 epoch: 57, train_loss: 0.9485, test_loss: 1.0454, test_f1: 0.4518
 epoch: 58, train_loss: 0.9521, test_loss: 1.0393, test_f1: 0.4651
 epoch: 59, train_loss: 0.9357, test_loss: 1.0350, test_f1: 0.4738
 epoch: 60, train_loss: 0.9418, test_loss: 1.0339, test_f1: 0.4636
 epoch: 61, train_loss: 0.9394, test_loss: 1.0235, test_f1: 0.4729
 epoch: 62, train_loss: 0.9335, test_loss: 1.0243, test_f1: 0.4648
 epoch: 63, train_loss: 0.9274, test_loss: 1.0377, test_f1: 0.4711
 epoch: 64, train_loss: 0.9289, test_loss: 1.0435, test_f1: 0.4550
 epoch: 65, train_loss: 0.9329, test_loss: 1.0453, test_f1: 0.4672
 epoch: 66, train_loss: 0.9292, test_loss: 1.0432, test_f1: 0.4663
 epoch: 67, train_loss: 0.9269, test_loss: 1.0361, test_f1: 0.4645
 epoch: 68, train_loss: 0.9130, test_loss: 1.0414, test_f1: 0.4532
 epoch: 69, train_loss: 0.9124, test_loss: 1.0536, test_f1: 0.4578
 epoch: 70, train_loss: 0.9160, test_loss: 1.0544, test_f1: 0.4542
 epoch: 71, train_loss: 0.9100, test_loss: 1.0652, test_f1: 0.4665
 epoch: 72, train_loss: 0.9199, test_loss: 1.0619, test_f1: 0.4572
 epoch: 73, train_loss: 0.9105, test_loss: 1.0605, test_f1: 0.4598
 epoch: 74, train_loss: 0.9111, test_loss: 1.0572, test_f1: 0.4643
 epoch: 75, train_loss: 0.9089, test_loss: 1.0545, test_f1: 0.4629
 epoch: 76, train_loss: 0.8982, test_loss: 1.0580, test_f1: 0.4668
 epoch: 77, train_loss: 0.9040, test_loss: 1.0734, test_f1: 0.4637
 epoch: 78, train_loss: 0.9042, test_loss: 1.0513, test_f1: 0.4708
 epoch: 79, train_loss: 0.9023, test_loss: 1.0543, test_f1: 0.4712
 epoch: 80, train_loss: 0.8981, test_loss: 1.0985, test_f1: 0.4565
 epoch: 81, train_loss: 0.8898, test_loss: 1.0824, test_f1: 0.4629
 epoch: 82, train_loss: 0.8910, test_loss: 1.0956, test_f1: 0.4635
 epoch: 83, train_loss: 0.8951, test_loss: 1.0937, test_f1: 0.4602
 epoch: 84, train_loss: 0.8900, test_loss: 1.0948, test_f1: 0.4647
 epoch: 85, train_loss: 0.8910, test_loss: 1.0799, test_f1: 0.4606
 epoch: 86, train_loss: 0.8941, test_loss: 1.0623, test_f1: 0.4659
 epoch: 87, train_loss: 0.8960, test_loss: 1.0471, test_f1: 0.4647
 epoch: 88, train_loss: 0.8767, test_loss: 1.0515, test_f1: 0.4626
 epoch: 89, train_loss: 0.8756, test_loss: 1.0667, test_f1: 0.4579
 epoch: 90, train_loss: 0.8819, test_loss: 1.0560, test_f1: 0.4541
 epoch: 91, train_loss: 0.8681, test_loss: 1.0714, test_f1: 0.4589
 epoch: 92, train_loss: 0.8761, test_loss: 1.0945, test_f1: 0.4527
 epoch: 93, train_loss: 0.8745, test_loss: 1.0843, test_f1: 0.4586
 epoch: 94, train_loss: 0.8762, test_loss: 1.1004, test_f1: 0.4684
 epoch: 95, train_loss: 0.8773, test_loss: 1.1081, test_f1: 0.4501
 epoch: 96, train_loss: 0.8694, test_loss: 1.1035, test_f1: 0.4463
 epoch: 97, train_loss: 0.8661, test_loss: 1.0999, test_f1: 0.4649
 epoch: 98, train_loss: 0.8747, test_loss: 1.0903, test_f1: 0.4675
 epoch: 99, train_loss: 0.8670, test_loss: 1.1119, test_f1: 0.4485
##################ITERATION #9 ****************************************
 epoch: 0, train_loss: 1.3284, test_loss: 1.3218, test_f1: 0.2274
 epoch: 1, train_loss: 1.2729, test_loss: 1.3049, test_f1: 0.2489
 epoch: 2, train_loss: 1.2506, test_loss: 1.2747, test_f1: 0.2634
 epoch: 3, train_loss: 1.2372, test_loss: 1.2455, test_f1: 0.3176
 epoch: 4, train_loss: 1.2259, test_loss: 1.2100, test_f1: 0.4076
 epoch: 5, train_loss: 1.2196, test_loss: 1.1922, test_f1: 0.3930
 epoch: 6, train_loss: 1.2142, test_loss: 1.1895, test_f1: 0.3912
 epoch: 7, train_loss: 1.2013, test_loss: 1.1813, test_f1: 0.4188
 epoch: 8, train_loss: 1.1902, test_loss: 1.1710, test_f1: 0.4244
 epoch: 9, train_loss: 1.1851, test_loss: 1.1665, test_f1: 0.4129
 epoch: 10, train_loss: 1.1762, test_loss: 1.1692, test_f1: 0.4200
 epoch: 11, train_loss: 1.1741, test_loss: 1.1579, test_f1: 0.4245
 epoch: 12, train_loss: 1.1575, test_loss: 1.1493, test_f1: 0.4305
 epoch: 13, train_loss: 1.1548, test_loss: 1.1477, test_f1: 0.4373
 epoch: 14, train_loss: 1.1563, test_loss: 1.1302, test_f1: 0.4185
 epoch: 15, train_loss: 1.1460, test_loss: 1.1272, test_f1: 0.4240
 epoch: 16, train_loss: 1.1408, test_loss: 1.1155, test_f1: 0.4237
 epoch: 17, train_loss: 1.1323, test_loss: 1.1096, test_f1: 0.4244
 epoch: 18, train_loss: 1.1360, test_loss: 1.1006, test_f1: 0.4420
 epoch: 19, train_loss: 1.1183, test_loss: 1.0986, test_f1: 0.4328
 epoch: 20, train_loss: 1.1172, test_loss: 1.0864, test_f1: 0.4520
 epoch: 21, train_loss: 1.0909, test_loss: 1.0801, test_f1: 0.4464
 epoch: 22, train_loss: 1.1013, test_loss: 1.0794, test_f1: 0.4449
 epoch: 23, train_loss: 1.0940, test_loss: 1.0763, test_f1: 0.4453
 epoch: 24, train_loss: 1.0851, test_loss: 1.0778, test_f1: 0.4356
 epoch: 25, train_loss: 1.0796, test_loss: 1.0646, test_f1: 0.4443
 epoch: 26, train_loss: 1.0725, test_loss: 1.0562, test_f1: 0.4353
 epoch: 27, train_loss: 1.0604, test_loss: 1.0553, test_f1: 0.4552
 epoch: 28, train_loss: 1.0645, test_loss: 1.0566, test_f1: 0.4462
 epoch: 29, train_loss: 1.0561, test_loss: 1.0420, test_f1: 0.4509
 epoch: 30, train_loss: 1.0589, test_loss: 1.0364, test_f1: 0.4522
 epoch: 31, train_loss: 1.0484, test_loss: 1.0425, test_f1: 0.4522
 epoch: 32, train_loss: 1.0369, test_loss: 1.0393, test_f1: 0.4544
 epoch: 33, train_loss: 1.0354, test_loss: 1.0324, test_f1: 0.4331
 epoch: 34, train_loss: 1.0327, test_loss: 1.0337, test_f1: 0.4404
 epoch: 35, train_loss: 1.0333, test_loss: 1.0260, test_f1: 0.4419
 epoch: 36, train_loss: 1.0114, test_loss: 1.0277, test_f1: 0.4525
 epoch: 37, train_loss: 1.0077, test_loss: 1.0275, test_f1: 0.4504
 epoch: 38, train_loss: 1.0087, test_loss: 1.0335, test_f1: 0.4501
 epoch: 39, train_loss: 1.0062, test_loss: 1.0279, test_f1: 0.4487
 epoch: 40, train_loss: 0.9978, test_loss: 1.0272, test_f1: 0.4408
 epoch: 41, train_loss: 0.9867, test_loss: 1.0176, test_f1: 0.4376
 epoch: 42, train_loss: 0.9896, test_loss: 1.0235, test_f1: 0.4364
 epoch: 43, train_loss: 0.9928, test_loss: 1.0335, test_f1: 0.4283
 epoch: 44, train_loss: 0.9741, test_loss: 1.0276, test_f1: 0.4410
 epoch: 45, train_loss: 0.9794, test_loss: 1.0241, test_f1: 0.4394
 epoch: 46, train_loss: 0.9758, test_loss: 1.0209, test_f1: 0.4530
 epoch: 47, train_loss: 0.9685, test_loss: 1.0226, test_f1: 0.4448
 epoch: 48, train_loss: 0.9620, test_loss: 1.0261, test_f1: 0.4554
 epoch: 49, train_loss: 0.9543, test_loss: 1.0143, test_f1: 0.4578
 epoch: 50, train_loss: 0.9541, test_loss: 1.0212, test_f1: 0.4596
 epoch: 51, train_loss: 0.9555, test_loss: 1.0233, test_f1: 0.4474
 epoch: 52, train_loss: 0.9276, test_loss: 1.0282, test_f1: 0.4508
 epoch: 53, train_loss: 0.9362, test_loss: 1.0217, test_f1: 0.4416
 epoch: 54, train_loss: 0.9271, test_loss: 1.0169, test_f1: 0.4442
 epoch: 55, train_loss: 0.9361, test_loss: 1.0258, test_f1: 0.4394
 epoch: 56, train_loss: 0.9315, test_loss: 1.0244, test_f1: 0.4496
 epoch: 57, train_loss: 0.9483, test_loss: 1.0283, test_f1: 0.4458
 epoch: 58, train_loss: 0.9298, test_loss: 1.0329, test_f1: 0.4404
 epoch: 59, train_loss: 0.9239, test_loss: 1.0325, test_f1: 0.4414
 epoch: 60, train_loss: 0.9296, test_loss: 1.0234, test_f1: 0.4444
 epoch: 61, train_loss: 0.9253, test_loss: 1.0201, test_f1: 0.4499
 epoch: 62, train_loss: 0.9156, test_loss: 1.0191, test_f1: 0.4532
 epoch: 63, train_loss: 0.9243, test_loss: 1.0197, test_f1: 0.4422
 epoch: 64, train_loss: 0.9179, test_loss: 1.0269, test_f1: 0.4389
 epoch: 65, train_loss: 0.9057, test_loss: 1.0277, test_f1: 0.4436
 epoch: 66, train_loss: 0.9261, test_loss: 1.0329, test_f1: 0.4478
 epoch: 67, train_loss: 0.9150, test_loss: 1.0252, test_f1: 0.4461
 epoch: 68, train_loss: 0.9138, test_loss: 1.0228, test_f1: 0.4495
 epoch: 69, train_loss: 0.9084, test_loss: 1.0362, test_f1: 0.4415
 epoch: 70, train_loss: 0.8997, test_loss: 1.0324, test_f1: 0.4441
 epoch: 71, train_loss: 0.8991, test_loss: 1.0304, test_f1: 0.4454
 epoch: 72, train_loss: 0.8973, test_loss: 1.0368, test_f1: 0.4455
 epoch: 73, train_loss: 0.9127, test_loss: 1.0262, test_f1: 0.4512
 epoch: 74, train_loss: 0.9004, test_loss: 1.0306, test_f1: 0.4552
 epoch: 75, train_loss: 0.8784, test_loss: 1.0390, test_f1: 0.4552
 epoch: 76, train_loss: 0.9062, test_loss: 1.0377, test_f1: 0.4542
 epoch: 77, train_loss: 0.8877, test_loss: 1.0480, test_f1: 0.4458
 epoch: 78, train_loss: 0.8768, test_loss: 1.0386, test_f1: 0.4459
 epoch: 79, train_loss: 0.8825, test_loss: 1.0532, test_f1: 0.4473
 epoch: 80, train_loss: 0.8877, test_loss: 1.0514, test_f1: 0.4390
 epoch: 81, train_loss: 0.8803, test_loss: 1.0419, test_f1: 0.4484
 epoch: 82, train_loss: 0.8734, test_loss: 1.0426, test_f1: 0.4509
 epoch: 83, train_loss: 0.8667, test_loss: 1.0526, test_f1: 0.4411
 epoch: 84, train_loss: 0.8786, test_loss: 1.0512, test_f1: 0.4359
 epoch: 85, train_loss: 0.8854, test_loss: 1.0547, test_f1: 0.4426
 epoch: 86, train_loss: 0.8819, test_loss: 1.0606, test_f1: 0.4339
 epoch: 87, train_loss: 0.8692, test_loss: 1.0540, test_f1: 0.4401
 epoch: 88, train_loss: 0.8678, test_loss: 1.0461, test_f1: 0.4592
 epoch: 89, train_loss: 0.8759, test_loss: 1.0508, test_f1: 0.4499
 epoch: 90, train_loss: 0.8695, test_loss: 1.0596, test_f1: 0.4419
 epoch: 91, train_loss: 0.8593, test_loss: 1.0640, test_f1: 0.4445
 epoch: 92, train_loss: 0.8592, test_loss: 1.0639, test_f1: 0.4578
 epoch: 93, train_loss: 0.8644, test_loss: 1.0622, test_f1: 0.4509
 epoch: 94, train_loss: 0.8507, test_loss: 1.0629, test_f1: 0.4601
 epoch: 95, train_loss: 0.8469, test_loss: 1.0617, test_f1: 0.4522
 epoch: 96, train_loss: 0.8508, test_loss: 1.0661, test_f1: 0.4582
 epoch: 97, train_loss: 0.8566, test_loss: 1.0766, test_f1: 0.4512
 epoch: 98, train_loss: 0.8527, test_loss: 1.0832, test_f1: 0.4441
 epoch: 99, train_loss: 0.8491, test_loss: 1.0732, test_f1: 0.4585

Training completed in 625.51 seconds
Best F1: 0.5022 at epoch 64
Mean F1 across iterations: 0.4778  0.0107
========================FINAL RESULTS================================
FEGIN weighted F1: 0.5022  0.0107
python main.py --data ltspice_examples --representation component_component --model FEGIN --layers 6 --hiddens 64 --batch_size 256 --lr 0.0001 --emb_size 250 --epochs 100 --save_appendix component_component_L6_H64_BS256_LR0.0001_E250 --no_val
-----



STDERR:
  File "main.py", line 370, in <module>
    main()
  File "main.py", line 254, in main
    dataset = dataset_class(
  File "/home/philip/projects/llm_inference_code_repo/Circuit-Completion-Using-GNNs/component_classification_with_link_prediction_head/evaluation/FEGIN/kernel/circuit_datasets.py", line 15, in __init__
    self.data, self.slices = torch.load(self.processed_paths[0])
  File "/home/philip/.local/lib/python3.8/site-packages/torch/serialization.py", line 1040, in load
    warnings.warn(
  File "/usr/lib/python3.8/warnings.py", line 109, in _showwarnmsg
    sw(msg.message, msg.category, msg.filename, msg.lineno,
  File "main.py", line 47, in warn_with_traceback
    traceback.print_stack(file=log)
/home/philip/projects/llm_inference_code_repo/Circuit-Completion-Using-GNNs/component_classification_with_link_prediction_head/evaluation/FEGIN/kernel/circuit_datasets.py:15: FutureWarning: You are using `torch.load` with `weights_only=False` (the current default value), which uses the default pickle module implicitly. It is possible to construct malicious pickle data which will execute arbitrary code during unpickling (See https://github.com/pytorch/pytorch/blob/main/SECURITY.md#untrusted-models for more details). In a future release, the default value for `weights_only` will be flipped to `True`. This limits the functions that could be executed during unpickling. Arbitrary objects will no longer be allowed to be loaded via this mode unless they are explicitly allowlisted by the user via `torch.serialization.add_safe_globals`. We recommend you start setting `weights_only=True` for any use case where you don't have full control of the loaded file. Please open an issue on GitHub for any issues related to this experimental feature.
  self.data, self.slices = torch.load(self.processed_paths[0])
