STDOUT:
Results will be saved in /home/philip/projects/ltspice_examples_code_repo/Circuit-Completion-Using-GNNs/component_classification_with_link_prediction_head/evaluation/FEGIN/results/model_FEGIN_dataset_ltspice_examples
Command line input: python main.py --data ltspice_examples --representation component_net --model FEGIN --layers 4 --hiddens 16 --batch_size 64 --lr 0.01 --emb_size 250 --epochs 100 --save_appendix component_net_L4_H16_BS64_LR0.01_E250 --no_val
 is saved.
-----
ltspice_examples - FEGIN
Using 4 layers, 16 hidden units, h = 2
Loading component_net representation dataset
ENTERED
Training FEGIN on component_net representation
Train: 3558, Test: 846
##################ITERATION #0 ****************************************
 epoch: 0, train_loss: 1.2868, test_loss: 1.1618, test_f1: 0.3756
 epoch: 1, train_loss: 1.1111, test_loss: 1.0636, test_f1: 0.3469
 epoch: 2, train_loss: 1.0523, test_loss: 1.1466, test_f1: 0.3781
 epoch: 3, train_loss: 1.0626, test_loss: 1.1168, test_f1: 0.4167
 epoch: 4, train_loss: 1.0345, test_loss: 1.0898, test_f1: 0.4519
 epoch: 5, train_loss: 1.0164, test_loss: 1.0044, test_f1: 0.4492
 epoch: 6, train_loss: 0.9967, test_loss: 1.0312, test_f1: 0.4038
 epoch: 7, train_loss: 0.9905, test_loss: 1.0833, test_f1: 0.4932
 epoch: 8, train_loss: 0.9946, test_loss: 1.0222, test_f1: 0.4578
 epoch: 9, train_loss: 0.9813, test_loss: 1.0494, test_f1: 0.5235
 epoch: 10, train_loss: 0.9684, test_loss: 1.0124, test_f1: 0.4855
 epoch: 11, train_loss: 0.9546, test_loss: 1.0129, test_f1: 0.5190
 epoch: 12, train_loss: 0.9417, test_loss: 1.0768, test_f1: 0.4850
 epoch: 13, train_loss: 0.9339, test_loss: 1.0240, test_f1: 0.5207
 epoch: 14, train_loss: 0.9419, test_loss: 0.9861, test_f1: 0.5149
 epoch: 15, train_loss: 0.9345, test_loss: 0.9805, test_f1: 0.4910
 epoch: 16, train_loss: 0.9345, test_loss: 0.9788, test_f1: 0.5407
 epoch: 17, train_loss: 0.9304, test_loss: 1.0016, test_f1: 0.4660
 epoch: 18, train_loss: 0.9032, test_loss: 1.0358, test_f1: 0.4813
 epoch: 19, train_loss: 0.9155, test_loss: 0.9879, test_f1: 0.4992
 epoch: 20, train_loss: 0.9106, test_loss: 1.0223, test_f1: 0.4960
 epoch: 21, train_loss: 0.9066, test_loss: 1.0074, test_f1: 0.4909
 epoch: 22, train_loss: 0.9095, test_loss: 0.9916, test_f1: 0.4976
 epoch: 23, train_loss: 0.8977, test_loss: 0.9751, test_f1: 0.5007
 epoch: 24, train_loss: 0.8988, test_loss: 1.0506, test_f1: 0.4936
 epoch: 25, train_loss: 0.8980, test_loss: 1.0097, test_f1: 0.5093
 epoch: 26, train_loss: 0.9099, test_loss: 1.0045, test_f1: 0.4866
 epoch: 27, train_loss: 0.8922, test_loss: 0.9904, test_f1: 0.5187
 epoch: 28, train_loss: 0.9040, test_loss: 1.0066, test_f1: 0.5455
 epoch: 29, train_loss: 0.8858, test_loss: 1.0020, test_f1: 0.4913
 epoch: 30, train_loss: 0.8953, test_loss: 0.9802, test_f1: 0.4898
 epoch: 31, train_loss: 0.8839, test_loss: 1.0180, test_f1: 0.4771
 epoch: 32, train_loss: 0.8787, test_loss: 0.9712, test_f1: 0.5049
 epoch: 33, train_loss: 0.8891, test_loss: 1.0191, test_f1: 0.5482
 epoch: 34, train_loss: 0.8797, test_loss: 1.0035, test_f1: 0.4970
 epoch: 35, train_loss: 0.8657, test_loss: 1.0612, test_f1: 0.4920
 epoch: 36, train_loss: 0.8746, test_loss: 0.9798, test_f1: 0.4980
 epoch: 37, train_loss: 0.8633, test_loss: 1.0032, test_f1: 0.5072
 epoch: 38, train_loss: 0.8679, test_loss: 1.0353, test_f1: 0.4829
 epoch: 39, train_loss: 0.9005, test_loss: 1.0123, test_f1: 0.4894
 epoch: 40, train_loss: 0.8982, test_loss: 0.9217, test_f1: 0.4976
 epoch: 41, train_loss: 0.8805, test_loss: 1.0195, test_f1: 0.5148
 epoch: 42, train_loss: 0.8766, test_loss: 0.9616, test_f1: 0.5281
 epoch: 43, train_loss: 0.8575, test_loss: 0.9854, test_f1: 0.4930
 epoch: 44, train_loss: 0.8767, test_loss: 0.9978, test_f1: 0.4959
 epoch: 45, train_loss: 0.8801, test_loss: 0.9975, test_f1: 0.5017
 epoch: 46, train_loss: 0.8771, test_loss: 1.0010, test_f1: 0.4949
 epoch: 47, train_loss: 0.8721, test_loss: 0.9554, test_f1: 0.5406
 epoch: 48, train_loss: 0.8788, test_loss: 1.0108, test_f1: 0.5486
 epoch: 49, train_loss: 0.8629, test_loss: 1.0441, test_f1: 0.4836
 epoch: 50, train_loss: 0.8593, test_loss: 1.0424, test_f1: 0.5135
 epoch: 51, train_loss: 0.8396, test_loss: 1.0183, test_f1: 0.5097
 epoch: 52, train_loss: 0.8323, test_loss: 1.0521, test_f1: 0.5222
 epoch: 53, train_loss: 0.8328, test_loss: 1.0405, test_f1: 0.5140
 epoch: 54, train_loss: 0.8292, test_loss: 1.0625, test_f1: 0.5519
 epoch: 55, train_loss: 0.8154, test_loss: 1.0469, test_f1: 0.5910
 epoch: 56, train_loss: 0.8268, test_loss: 1.0241, test_f1: 0.5222
 epoch: 57, train_loss: 0.8262, test_loss: 1.0348, test_f1: 0.5014
 epoch: 58, train_loss: 0.8263, test_loss: 1.0411, test_f1: 0.5488
 epoch: 59, train_loss: 0.8276, test_loss: 1.0684, test_f1: 0.5688
 epoch: 60, train_loss: 0.8200, test_loss: 1.0766, test_f1: 0.5175
 epoch: 61, train_loss: 0.8136, test_loss: 1.0347, test_f1: 0.5546
 epoch: 62, train_loss: 0.8091, test_loss: 1.0349, test_f1: 0.5065
 epoch: 63, train_loss: 0.8011, test_loss: 1.0313, test_f1: 0.5641
 epoch: 64, train_loss: 0.8173, test_loss: 1.0399, test_f1: 0.5209
 epoch: 65, train_loss: 0.8058, test_loss: 1.0497, test_f1: 0.5205
 epoch: 66, train_loss: 0.7944, test_loss: 1.0502, test_f1: 0.5242
 epoch: 67, train_loss: 0.7997, test_loss: 1.0401, test_f1: 0.5348
 epoch: 68, train_loss: 0.8026, test_loss: 1.0483, test_f1: 0.5341
 epoch: 69, train_loss: 0.8045, test_loss: 1.0037, test_f1: 0.5775
 epoch: 70, train_loss: 0.8104, test_loss: 1.0588, test_f1: 0.5623
 epoch: 71, train_loss: 0.8056, test_loss: 1.0062, test_f1: 0.5259
 epoch: 72, train_loss: 0.7954, test_loss: 1.0234, test_f1: 0.5292
 epoch: 73, train_loss: 0.7903, test_loss: 1.0475, test_f1: 0.5351
 epoch: 74, train_loss: 0.7952, test_loss: 1.0239, test_f1: 0.5327
 epoch: 75, train_loss: 0.7937, test_loss: 1.0437, test_f1: 0.5544
 epoch: 76, train_loss: 0.8060, test_loss: 1.0516, test_f1: 0.5397
 epoch: 77, train_loss: 0.7980, test_loss: 1.0120, test_f1: 0.5880
 epoch: 78, train_loss: 0.7889, test_loss: 1.0308, test_f1: 0.5444
 epoch: 79, train_loss: 0.7847, test_loss: 1.0392, test_f1: 0.5554
 epoch: 80, train_loss: 0.7895, test_loss: 1.0888, test_f1: 0.5499
 epoch: 81, train_loss: 0.7818, test_loss: 1.0634, test_f1: 0.5283
 epoch: 82, train_loss: 0.7966, test_loss: 1.0626, test_f1: 0.5658
 epoch: 83, train_loss: 0.7832, test_loss: 1.0333, test_f1: 0.5581
 epoch: 84, train_loss: 0.7848, test_loss: 1.0704, test_f1: 0.5760
 epoch: 85, train_loss: 0.7813, test_loss: 1.0572, test_f1: 0.5909
 epoch: 86, train_loss: 0.7916, test_loss: 1.0384, test_f1: 0.5630
 epoch: 87, train_loss: 0.7786, test_loss: 1.0534, test_f1: 0.5953
 epoch: 88, train_loss: 0.7802, test_loss: 1.0483, test_f1: 0.5548
 epoch: 89, train_loss: 0.7759, test_loss: 1.0582, test_f1: 0.5680
 epoch: 90, train_loss: 0.7682, test_loss: 1.0515, test_f1: 0.5480
 epoch: 91, train_loss: 0.7834, test_loss: 1.0586, test_f1: 0.5549
 epoch: 92, train_loss: 0.7739, test_loss: 1.0465, test_f1: 0.5616
 epoch: 93, train_loss: 0.7750, test_loss: 1.0545, test_f1: 0.6164
 epoch: 94, train_loss: 0.7821, test_loss: 1.0652, test_f1: 0.5338
 epoch: 95, train_loss: 0.7751, test_loss: 1.0255, test_f1: 0.5513
 epoch: 96, train_loss: 0.7715, test_loss: 1.0049, test_f1: 0.5589
 epoch: 97, train_loss: 0.7682, test_loss: 1.0421, test_f1: 0.5436
 epoch: 98, train_loss: 0.7741, test_loss: 1.0445, test_f1: 0.5520
 epoch: 99, train_loss: 0.7704, test_loss: 1.0595, test_f1: 0.5876
##################ITERATION #1 ****************************************
 epoch: 0, train_loss: 1.2119, test_loss: 1.0801, test_f1: 0.4006
 epoch: 1, train_loss: 1.0782, test_loss: 1.0442, test_f1: 0.4561
 epoch: 2, train_loss: 1.0377, test_loss: 1.0583, test_f1: 0.5018
 epoch: 3, train_loss: 1.0011, test_loss: 1.0362, test_f1: 0.5128
 epoch: 4, train_loss: 0.9887, test_loss: 1.0114, test_f1: 0.4594
 epoch: 5, train_loss: 0.9769, test_loss: 0.9742, test_f1: 0.4924
 epoch: 6, train_loss: 0.9672, test_loss: 1.0032, test_f1: 0.4937
 epoch: 7, train_loss: 0.9633, test_loss: 1.0388, test_f1: 0.4386
 epoch: 8, train_loss: 0.9838, test_loss: 1.0048, test_f1: 0.4729
 epoch: 9, train_loss: 0.9831, test_loss: 1.0410, test_f1: 0.4694
 epoch: 10, train_loss: 0.9613, test_loss: 0.9911, test_f1: 0.5117
 epoch: 11, train_loss: 0.9582, test_loss: 0.9544, test_f1: 0.5176
 epoch: 12, train_loss: 0.9473, test_loss: 0.9889, test_f1: 0.4712
 epoch: 13, train_loss: 0.9480, test_loss: 0.9845, test_f1: 0.4629
 epoch: 14, train_loss: 0.9297, test_loss: 0.9606, test_f1: 0.5220
 epoch: 15, train_loss: 0.9283, test_loss: 0.9492, test_f1: 0.4973
 epoch: 16, train_loss: 0.9400, test_loss: 0.9205, test_f1: 0.5014
 epoch: 17, train_loss: 0.9238, test_loss: 1.0156, test_f1: 0.5071
 epoch: 18, train_loss: 0.9684, test_loss: 1.0106, test_f1: 0.5109
 epoch: 19, train_loss: 0.9430, test_loss: 0.9887, test_f1: 0.5003
 epoch: 20, train_loss: 0.9211, test_loss: 0.9507, test_f1: 0.4838
 epoch: 21, train_loss: 0.9369, test_loss: 1.0427, test_f1: 0.4891
 epoch: 22, train_loss: 0.9168, test_loss: 0.9949, test_f1: 0.4892
 epoch: 23, train_loss: 0.9217, test_loss: 1.0216, test_f1: 0.4774
 epoch: 24, train_loss: 0.9169, test_loss: 1.0026, test_f1: 0.5002
 epoch: 25, train_loss: 0.9018, test_loss: 0.9609, test_f1: 0.4978
 epoch: 26, train_loss: 0.9007, test_loss: 1.0049, test_f1: 0.4981
 epoch: 27, train_loss: 0.9118, test_loss: 1.0046, test_f1: 0.5118
 epoch: 28, train_loss: 0.9013, test_loss: 1.0459, test_f1: 0.4594
 epoch: 29, train_loss: 0.9071, test_loss: 0.9550, test_f1: 0.4975
 epoch: 30, train_loss: 0.9103, test_loss: 0.9837, test_f1: 0.5060
 epoch: 31, train_loss: 0.9214, test_loss: 1.0169, test_f1: 0.5135
 epoch: 32, train_loss: 0.9127, test_loss: 0.9818, test_f1: 0.5079
 epoch: 33, train_loss: 0.8968, test_loss: 0.9596, test_f1: 0.5385
 epoch: 34, train_loss: 0.9048, test_loss: 0.9609, test_f1: 0.5327
 epoch: 35, train_loss: 0.8905, test_loss: 0.9819, test_f1: 0.4991
 epoch: 36, train_loss: 0.8968, test_loss: 0.9655, test_f1: 0.4974
 epoch: 37, train_loss: 0.8808, test_loss: 0.9561, test_f1: 0.5039
 epoch: 38, train_loss: 0.8711, test_loss: 0.9022, test_f1: 0.5363
 epoch: 39, train_loss: 0.8756, test_loss: 0.9487, test_f1: 0.5195
 epoch: 40, train_loss: 0.8798, test_loss: 0.9724, test_f1: 0.5130
 epoch: 41, train_loss: 0.8711, test_loss: 0.9118, test_f1: 0.5407
 epoch: 42, train_loss: 0.8947, test_loss: 0.9635, test_f1: 0.5054
 epoch: 43, train_loss: 0.8872, test_loss: 0.9951, test_f1: 0.5054
 epoch: 44, train_loss: 0.8677, test_loss: 0.9275, test_f1: 0.5562
 epoch: 45, train_loss: 0.8982, test_loss: 0.9308, test_f1: 0.5638
 epoch: 46, train_loss: 0.8658, test_loss: 0.9643, test_f1: 0.5422
 epoch: 47, train_loss: 0.8595, test_loss: 0.9392, test_f1: 0.5293
 epoch: 48, train_loss: 0.8801, test_loss: 1.0477, test_f1: 0.5203
 epoch: 49, train_loss: 0.8640, test_loss: 0.9852, test_f1: 0.5129
 epoch: 50, train_loss: 0.8610, test_loss: 0.8936, test_f1: 0.5494
 epoch: 51, train_loss: 0.8469, test_loss: 0.9088, test_f1: 0.5663
 epoch: 52, train_loss: 0.8262, test_loss: 0.9381, test_f1: 0.5778
 epoch: 53, train_loss: 0.8321, test_loss: 0.9035, test_f1: 0.5726
 epoch: 54, train_loss: 0.8268, test_loss: 0.9414, test_f1: 0.6088
 epoch: 55, train_loss: 0.8324, test_loss: 0.9374, test_f1: 0.5419
 epoch: 56, train_loss: 0.8287, test_loss: 0.8749, test_f1: 0.5762
 epoch: 57, train_loss: 0.8133, test_loss: 0.9123, test_f1: 0.5816
 epoch: 58, train_loss: 0.8077, test_loss: 0.9099, test_f1: 0.5865
 epoch: 59, train_loss: 0.8133, test_loss: 0.9087, test_f1: 0.5613
 epoch: 60, train_loss: 0.7933, test_loss: 0.9140, test_f1: 0.5728
 epoch: 61, train_loss: 0.8097, test_loss: 0.9412, test_f1: 0.5931
 epoch: 62, train_loss: 0.8134, test_loss: 0.9231, test_f1: 0.5714
 epoch: 63, train_loss: 0.8131, test_loss: 0.9141, test_f1: 0.5657
 epoch: 64, train_loss: 0.8123, test_loss: 0.9421, test_f1: 0.6259
 epoch: 65, train_loss: 0.8022, test_loss: 0.9812, test_f1: 0.5979
 epoch: 66, train_loss: 0.8039, test_loss: 0.9320, test_f1: 0.6055
 epoch: 67, train_loss: 0.7956, test_loss: 0.9313, test_f1: 0.5745
 epoch: 68, train_loss: 0.7979, test_loss: 0.9599, test_f1: 0.5718
 epoch: 69, train_loss: 0.8030, test_loss: 0.9114, test_f1: 0.5769
 epoch: 70, train_loss: 0.8023, test_loss: 0.9046, test_f1: 0.5801
 epoch: 71, train_loss: 0.7920, test_loss: 0.9469, test_f1: 0.5450
 epoch: 72, train_loss: 0.8016, test_loss: 0.9805, test_f1: 0.5833
 epoch: 73, train_loss: 0.8148, test_loss: 0.8825, test_f1: 0.5746
 epoch: 74, train_loss: 0.8097, test_loss: 0.9281, test_f1: 0.6051
 epoch: 75, train_loss: 0.7877, test_loss: 0.9538, test_f1: 0.5978
 epoch: 76, train_loss: 0.8033, test_loss: 0.9143, test_f1: 0.5544
 epoch: 77, train_loss: 0.7894, test_loss: 0.9321, test_f1: 0.5756
 epoch: 78, train_loss: 0.7905, test_loss: 0.9093, test_f1: 0.6270
 epoch: 79, train_loss: 0.7875, test_loss: 0.9859, test_f1: 0.5477
 epoch: 80, train_loss: 0.7823, test_loss: 0.9138, test_f1: 0.5980
 epoch: 81, train_loss: 0.7781, test_loss: 0.9223, test_f1: 0.5694
 epoch: 82, train_loss: 0.7937, test_loss: 1.0054, test_f1: 0.5590
 epoch: 83, train_loss: 0.7878, test_loss: 0.9354, test_f1: 0.5705
 epoch: 84, train_loss: 0.7874, test_loss: 0.9898, test_f1: 0.5786
 epoch: 85, train_loss: 0.7777, test_loss: 0.9431, test_f1: 0.6277
 epoch: 86, train_loss: 0.7781, test_loss: 0.9415, test_f1: 0.5961
 epoch: 87, train_loss: 0.7873, test_loss: 0.9253, test_f1: 0.6092
 epoch: 88, train_loss: 0.7774, test_loss: 0.9488, test_f1: 0.5718
 epoch: 89, train_loss: 0.7737, test_loss: 0.9151, test_f1: 0.6111
 epoch: 90, train_loss: 0.7875, test_loss: 0.9525, test_f1: 0.5799
 epoch: 91, train_loss: 0.7879, test_loss: 0.9268, test_f1: 0.5967
 epoch: 92, train_loss: 0.7768, test_loss: 0.9512, test_f1: 0.5903
 epoch: 93, train_loss: 0.7795, test_loss: 0.9796, test_f1: 0.6016
 epoch: 94, train_loss: 0.7660, test_loss: 0.9837, test_f1: 0.6025
 epoch: 95, train_loss: 0.7800, test_loss: 1.0260, test_f1: 0.5743
 epoch: 96, train_loss: 0.7794, test_loss: 1.0351, test_f1: 0.5319
 epoch: 97, train_loss: 0.7757, test_loss: 1.0563, test_f1: 0.5936
 epoch: 98, train_loss: 0.7788, test_loss: 1.1332, test_f1: 0.5865
 epoch: 99, train_loss: 0.7730, test_loss: 0.9886, test_f1: 0.5876
##################ITERATION #2 ****************************************
 epoch: 0, train_loss: 1.2218, test_loss: 1.0964, test_f1: 0.4007
 epoch: 1, train_loss: 1.0900, test_loss: 1.0881, test_f1: 0.4146
 epoch: 2, train_loss: 1.0650, test_loss: 1.1413, test_f1: 0.4182
 epoch: 3, train_loss: 1.0369, test_loss: 1.1000, test_f1: 0.4540
 epoch: 4, train_loss: 1.0251, test_loss: 1.1249, test_f1: 0.4777
 epoch: 5, train_loss: 1.0132, test_loss: 1.1744, test_f1: 0.4135
 epoch: 6, train_loss: 1.0102, test_loss: 1.0536, test_f1: 0.4063
 epoch: 7, train_loss: 1.0051, test_loss: 1.0769, test_f1: 0.4752
 epoch: 8, train_loss: 0.9975, test_loss: 1.0907, test_f1: 0.4577
 epoch: 9, train_loss: 0.9863, test_loss: 1.0112, test_f1: 0.5024
 epoch: 10, train_loss: 0.9898, test_loss: 1.0204, test_f1: 0.4674
 epoch: 11, train_loss: 0.9687, test_loss: 1.0136, test_f1: 0.4733
 epoch: 12, train_loss: 0.9683, test_loss: 1.0179, test_f1: 0.4566
 epoch: 13, train_loss: 0.9495, test_loss: 1.0375, test_f1: 0.4938
 epoch: 14, train_loss: 0.9599, test_loss: 1.0539, test_f1: 0.4659
 epoch: 15, train_loss: 0.9498, test_loss: 1.0491, test_f1: 0.4954
 epoch: 16, train_loss: 0.9436, test_loss: 0.9832, test_f1: 0.4854
 epoch: 17, train_loss: 0.9368, test_loss: 1.0376, test_f1: 0.5182
 epoch: 18, train_loss: 0.9605, test_loss: 0.9319, test_f1: 0.5071
 epoch: 19, train_loss: 0.9416, test_loss: 1.0021, test_f1: 0.4816
 epoch: 20, train_loss: 0.9298, test_loss: 1.0077, test_f1: 0.4787
 epoch: 21, train_loss: 0.9361, test_loss: 1.0182, test_f1: 0.4933
 epoch: 22, train_loss: 0.9481, test_loss: 0.9562, test_f1: 0.4852
 epoch: 23, train_loss: 0.9322, test_loss: 0.9265, test_f1: 0.4396
 epoch: 24, train_loss: 0.9391, test_loss: 0.9732, test_f1: 0.4815
 epoch: 25, train_loss: 0.9273, test_loss: 0.9590, test_f1: 0.4862
 epoch: 26, train_loss: 0.9178, test_loss: 0.9533, test_f1: 0.5273
 epoch: 27, train_loss: 0.9183, test_loss: 0.9805, test_f1: 0.5110
 epoch: 28, train_loss: 0.9290, test_loss: 0.9825, test_f1: 0.5085
 epoch: 29, train_loss: 0.9265, test_loss: 0.9512, test_f1: 0.4967
 epoch: 30, train_loss: 0.9163, test_loss: 0.9135, test_f1: 0.5180
 epoch: 31, train_loss: 0.9115, test_loss: 1.0075, test_f1: 0.4726
 epoch: 32, train_loss: 0.8997, test_loss: 0.9748, test_f1: 0.4839
 epoch: 33, train_loss: 0.9051, test_loss: 0.9766, test_f1: 0.5033
 epoch: 34, train_loss: 0.8957, test_loss: 0.9780, test_f1: 0.5170
 epoch: 35, train_loss: 0.9007, test_loss: 0.9813, test_f1: 0.5179
 epoch: 36, train_loss: 0.8904, test_loss: 1.0554, test_f1: 0.4649
 epoch: 37, train_loss: 0.8910, test_loss: 0.9244, test_f1: 0.5607
 epoch: 38, train_loss: 0.8761, test_loss: 0.9679, test_f1: 0.5023
 epoch: 39, train_loss: 0.8817, test_loss: 0.9383, test_f1: 0.5113
 epoch: 40, train_loss: 0.8773, test_loss: 0.9576, test_f1: 0.5474
 epoch: 41, train_loss: 0.8836, test_loss: 0.9233, test_f1: 0.5158
 epoch: 42, train_loss: 0.8716, test_loss: 0.9254, test_f1: 0.5359
 epoch: 43, train_loss: 0.8653, test_loss: 0.8855, test_f1: 0.4993
 epoch: 44, train_loss: 0.8591, test_loss: 0.9977, test_f1: 0.5032
 epoch: 45, train_loss: 0.9102, test_loss: 1.0109, test_f1: 0.4883
 epoch: 46, train_loss: 0.8876, test_loss: 0.8833, test_f1: 0.5386
 epoch: 47, train_loss: 0.8741, test_loss: 0.9671, test_f1: 0.5032
 epoch: 48, train_loss: 0.8587, test_loss: 0.9358, test_f1: 0.5220
 epoch: 49, train_loss: 0.8698, test_loss: 0.8851, test_f1: 0.5127
 epoch: 50, train_loss: 0.8685, test_loss: 0.8410, test_f1: 0.5133
 epoch: 51, train_loss: 0.8470, test_loss: 0.9453, test_f1: 0.5294
 epoch: 52, train_loss: 0.8348, test_loss: 0.9381, test_f1: 0.5349
 epoch: 53, train_loss: 0.8271, test_loss: 0.9599, test_f1: 0.5464
 epoch: 54, train_loss: 0.8297, test_loss: 0.9393, test_f1: 0.5097
 epoch: 55, train_loss: 0.8247, test_loss: 0.9288, test_f1: 0.5098
 epoch: 56, train_loss: 0.8306, test_loss: 1.0063, test_f1: 0.4983
 epoch: 57, train_loss: 0.8406, test_loss: 0.9522, test_f1: 0.5197
 epoch: 58, train_loss: 0.8298, test_loss: 0.9117, test_f1: 0.5281
 epoch: 59, train_loss: 0.8247, test_loss: 0.9099, test_f1: 0.5095
 epoch: 60, train_loss: 0.8276, test_loss: 0.9377, test_f1: 0.5164
 epoch: 61, train_loss: 0.8207, test_loss: 0.9280, test_f1: 0.5173
 epoch: 62, train_loss: 0.8199, test_loss: 0.9302, test_f1: 0.5466
 epoch: 63, train_loss: 0.8265, test_loss: 0.8600, test_f1: 0.5405
 epoch: 64, train_loss: 0.8184, test_loss: 0.8742, test_f1: 0.5160
 epoch: 65, train_loss: 0.8220, test_loss: 0.9113, test_f1: 0.4979
 epoch: 66, train_loss: 0.8212, test_loss: 0.9099, test_f1: 0.5137
 epoch: 67, train_loss: 0.8178, test_loss: 0.9446, test_f1: 0.5044
 epoch: 68, train_loss: 0.8188, test_loss: 0.9121, test_f1: 0.5187
 epoch: 69, train_loss: 0.8073, test_loss: 0.8932, test_f1: 0.5226
 epoch: 70, train_loss: 0.8107, test_loss: 0.8893, test_f1: 0.5804
 epoch: 71, train_loss: 0.8094, test_loss: 0.9899, test_f1: 0.5043
 epoch: 72, train_loss: 0.8180, test_loss: 0.8930, test_f1: 0.5544
 epoch: 73, train_loss: 0.8184, test_loss: 0.9061, test_f1: 0.5449
 epoch: 74, train_loss: 0.8056, test_loss: 0.9091, test_f1: 0.5232
 epoch: 75, train_loss: 0.8100, test_loss: 0.8988, test_f1: 0.5260
 epoch: 76, train_loss: 0.8093, test_loss: 0.9107, test_f1: 0.5076
 epoch: 77, train_loss: 0.8016, test_loss: 0.9063, test_f1: 0.5668
 epoch: 78, train_loss: 0.8094, test_loss: 0.9143, test_f1: 0.5252
 epoch: 79, train_loss: 0.8074, test_loss: 0.9132, test_f1: 0.5286
 epoch: 80, train_loss: 0.8143, test_loss: 0.8975, test_f1: 0.5669
 epoch: 81, train_loss: 0.8113, test_loss: 0.9118, test_f1: 0.5446
 epoch: 82, train_loss: 0.8032, test_loss: 0.9437, test_f1: 0.5006
 epoch: 83, train_loss: 0.8099, test_loss: 0.9063, test_f1: 0.5059
 epoch: 84, train_loss: 0.8094, test_loss: 0.9352, test_f1: 0.5403
 epoch: 85, train_loss: 0.7989, test_loss: 0.9256, test_f1: 0.5001
 epoch: 86, train_loss: 0.8021, test_loss: 0.9230, test_f1: 0.5171
 epoch: 87, train_loss: 0.7983, test_loss: 0.9099, test_f1: 0.5174
 epoch: 88, train_loss: 0.7961, test_loss: 0.9074, test_f1: 0.5679
 epoch: 89, train_loss: 0.7979, test_loss: 0.9288, test_f1: 0.5129
 epoch: 90, train_loss: 0.7781, test_loss: 0.9146, test_f1: 0.5826
 epoch: 91, train_loss: 0.7883, test_loss: 0.9020, test_f1: 0.5877
 epoch: 92, train_loss: 0.8104, test_loss: 0.8982, test_f1: 0.5122
 epoch: 93, train_loss: 0.7992, test_loss: 0.9062, test_f1: 0.5022
 epoch: 94, train_loss: 0.7974, test_loss: 0.8757, test_f1: 0.5324
 epoch: 95, train_loss: 0.7886, test_loss: 0.8928, test_f1: 0.5650
 epoch: 96, train_loss: 0.8025, test_loss: 0.9033, test_f1: 0.5241
 epoch: 97, train_loss: 0.7926, test_loss: 0.8661, test_f1: 0.5712
 epoch: 98, train_loss: 0.8008, test_loss: 0.9323, test_f1: 0.5352
 epoch: 99, train_loss: 0.7942, test_loss: 0.8983, test_f1: 0.5361
##################ITERATION #3 ****************************************
 epoch: 0, train_loss: 1.2132, test_loss: 1.0888, test_f1: 0.3429
 epoch: 1, train_loss: 1.0628, test_loss: 1.0283, test_f1: 0.4377
 epoch: 2, train_loss: 1.0242, test_loss: 1.0823, test_f1: 0.3796
 epoch: 3, train_loss: 1.0057, test_loss: 0.9509, test_f1: 0.4859
 epoch: 4, train_loss: 0.9874, test_loss: 0.9437, test_f1: 0.4792
 epoch: 5, train_loss: 0.9808, test_loss: 0.9485, test_f1: 0.4902
 epoch: 6, train_loss: 0.9683, test_loss: 0.9569, test_f1: 0.5155
 epoch: 7, train_loss: 0.9516, test_loss: 0.9509, test_f1: 0.4851
 epoch: 8, train_loss: 0.9553, test_loss: 0.9814, test_f1: 0.4739
 epoch: 9, train_loss: 0.9496, test_loss: 0.9451, test_f1: 0.5117
 epoch: 10, train_loss: 0.9480, test_loss: 0.9921, test_f1: 0.4796
 epoch: 11, train_loss: 0.9436, test_loss: 0.9800, test_f1: 0.4839
 epoch: 12, train_loss: 0.9684, test_loss: 0.9092, test_f1: 0.5357
 epoch: 13, train_loss: 0.9564, test_loss: 0.8895, test_f1: 0.4977
 epoch: 14, train_loss: 0.9438, test_loss: 0.9707, test_f1: 0.4715
 epoch: 15, train_loss: 0.9208, test_loss: 0.8921, test_f1: 0.5453
 epoch: 16, train_loss: 0.9402, test_loss: 0.9239, test_f1: 0.4812
 epoch: 17, train_loss: 0.9239, test_loss: 0.9830, test_f1: 0.5144
 epoch: 18, train_loss: 0.9193, test_loss: 0.9043, test_f1: 0.4933
 epoch: 19, train_loss: 0.9010, test_loss: 0.9318, test_f1: 0.5019
 epoch: 20, train_loss: 0.9202, test_loss: 0.9489, test_f1: 0.5088
 epoch: 21, train_loss: 0.8979, test_loss: 0.9703, test_f1: 0.4981
 epoch: 22, train_loss: 0.8927, test_loss: 0.9264, test_f1: 0.5033
 epoch: 23, train_loss: 0.8969, test_loss: 0.8661, test_f1: 0.5319
 epoch: 24, train_loss: 0.9175, test_loss: 0.9381, test_f1: 0.5086
 epoch: 25, train_loss: 0.9046, test_loss: 0.9312, test_f1: 0.4978
 epoch: 26, train_loss: 0.8914, test_loss: 0.9828, test_f1: 0.5000
 epoch: 27, train_loss: 0.8773, test_loss: 0.8598, test_f1: 0.5120
 epoch: 28, train_loss: 0.8902, test_loss: 0.8841, test_f1: 0.5151
 epoch: 29, train_loss: 0.8965, test_loss: 0.9789, test_f1: 0.4761
 epoch: 30, train_loss: 0.8773, test_loss: 0.9870, test_f1: 0.5643
 epoch: 31, train_loss: 0.8881, test_loss: 0.9709, test_f1: 0.5097
 epoch: 32, train_loss: 0.8803, test_loss: 0.9098, test_f1: 0.5157
 epoch: 33, train_loss: 0.8670, test_loss: 0.9632, test_f1: 0.5553
 epoch: 34, train_loss: 0.8876, test_loss: 0.8911, test_f1: 0.5374
 epoch: 35, train_loss: 0.8754, test_loss: 0.9061, test_f1: 0.5565
 epoch: 36, train_loss: 0.8620, test_loss: 0.9592, test_f1: 0.5137
 epoch: 37, train_loss: 0.8678, test_loss: 0.9309, test_f1: 0.5532
 epoch: 38, train_loss: 0.8642, test_loss: 0.9393, test_f1: 0.5202
 epoch: 39, train_loss: 0.8695, test_loss: 0.9926, test_f1: 0.5127
 epoch: 40, train_loss: 0.8794, test_loss: 0.9739, test_f1: 0.5094
 epoch: 41, train_loss: 0.8737, test_loss: 0.8696, test_f1: 0.5174
 epoch: 42, train_loss: 0.8675, test_loss: 0.9316, test_f1: 0.5378
 epoch: 43, train_loss: 0.8619, test_loss: 0.9918, test_f1: 0.5016
 epoch: 44, train_loss: 0.8681, test_loss: 0.9225, test_f1: 0.5361
 epoch: 45, train_loss: 0.8573, test_loss: 0.9475, test_f1: 0.5209
 epoch: 46, train_loss: 0.8483, test_loss: 0.9464, test_f1: 0.5264
 epoch: 47, train_loss: 0.8694, test_loss: 0.9561, test_f1: 0.5333
 epoch: 48, train_loss: 0.8671, test_loss: 0.9482, test_f1: 0.5436
 epoch: 49, train_loss: 0.8467, test_loss: 0.9091, test_f1: 0.5620
 epoch: 50, train_loss: 0.8619, test_loss: 0.8598, test_f1: 0.5317
 epoch: 51, train_loss: 0.8338, test_loss: 0.9083, test_f1: 0.5644
 epoch: 52, train_loss: 0.8261, test_loss: 0.9022, test_f1: 0.5489
 epoch: 53, train_loss: 0.8205, test_loss: 0.8574, test_f1: 0.5101
 epoch: 54, train_loss: 0.8222, test_loss: 0.9782, test_f1: 0.5278
 epoch: 55, train_loss: 0.8357, test_loss: 0.9434, test_f1: 0.5382
 epoch: 56, train_loss: 0.8190, test_loss: 0.8976, test_f1: 0.5352
 epoch: 57, train_loss: 0.8142, test_loss: 0.8881, test_f1: 0.5565
 epoch: 58, train_loss: 0.7959, test_loss: 0.9066, test_f1: 0.5585
 epoch: 59, train_loss: 0.8069, test_loss: 0.8512, test_f1: 0.5633
 epoch: 60, train_loss: 0.8075, test_loss: 0.9218, test_f1: 0.5793
 epoch: 61, train_loss: 0.8113, test_loss: 0.9176, test_f1: 0.5732
 epoch: 62, train_loss: 0.7978, test_loss: 0.9708, test_f1: 0.5906
 epoch: 63, train_loss: 0.8101, test_loss: 0.9011, test_f1: 0.5785
 epoch: 64, train_loss: 0.7961, test_loss: 0.8862, test_f1: 0.5788
 epoch: 65, train_loss: 0.8059, test_loss: 0.9343, test_f1: 0.5817
 epoch: 66, train_loss: 0.7982, test_loss: 0.9323, test_f1: 0.5938
 epoch: 67, train_loss: 0.8027, test_loss: 0.9421, test_f1: 0.5853
 epoch: 68, train_loss: 0.7838, test_loss: 0.8990, test_f1: 0.6075
 epoch: 69, train_loss: 0.8044, test_loss: 0.8434, test_f1: 0.6035
 epoch: 70, train_loss: 0.8010, test_loss: 0.9546, test_f1: 0.5682
 epoch: 71, train_loss: 0.7973, test_loss: 0.9873, test_f1: 0.5787
 epoch: 72, train_loss: 0.7924, test_loss: 0.9141, test_f1: 0.6031
 epoch: 73, train_loss: 0.7810, test_loss: 0.9352, test_f1: 0.5737
 epoch: 74, train_loss: 0.7897, test_loss: 0.9075, test_f1: 0.6012
 epoch: 75, train_loss: 0.8003, test_loss: 0.9365, test_f1: 0.5799
 epoch: 76, train_loss: 0.7979, test_loss: 0.9301, test_f1: 0.5841
 epoch: 77, train_loss: 0.8153, test_loss: 0.9275, test_f1: 0.5814
 epoch: 78, train_loss: 0.7925, test_loss: 0.9263, test_f1: 0.5764
 epoch: 79, train_loss: 0.7971, test_loss: 0.9769, test_f1: 0.5736
 epoch: 80, train_loss: 0.7828, test_loss: 0.9317, test_f1: 0.5924
 epoch: 81, train_loss: 0.7860, test_loss: 0.9345, test_f1: 0.5828
 epoch: 82, train_loss: 0.7873, test_loss: 0.9394, test_f1: 0.5918
 epoch: 83, train_loss: 0.7911, test_loss: 0.9194, test_f1: 0.5809
 epoch: 84, train_loss: 0.7914, test_loss: 0.8774, test_f1: 0.5965
 epoch: 85, train_loss: 0.7727, test_loss: 0.9567, test_f1: 0.5733
 epoch: 86, train_loss: 0.7738, test_loss: 0.9078, test_f1: 0.6094
 epoch: 87, train_loss: 0.7835, test_loss: 0.9698, test_f1: 0.5721
 epoch: 88, train_loss: 0.7906, test_loss: 0.9984, test_f1: 0.5923
 epoch: 89, train_loss: 0.7783, test_loss: 0.9457, test_f1: 0.5856
 epoch: 90, train_loss: 0.7878, test_loss: 0.9653, test_f1: 0.5641
 epoch: 91, train_loss: 0.7736, test_loss: 0.9231, test_f1: 0.6122
 epoch: 92, train_loss: 0.7712, test_loss: 0.9554, test_f1: 0.5851
 epoch: 93, train_loss: 0.7634, test_loss: 0.8788, test_f1: 0.5989
 epoch: 94, train_loss: 0.7633, test_loss: 0.9433, test_f1: 0.5835
 epoch: 95, train_loss: 0.7730, test_loss: 0.9360, test_f1: 0.5955
 epoch: 96, train_loss: 0.7653, test_loss: 0.9288, test_f1: 0.5859
 epoch: 97, train_loss: 0.7632, test_loss: 0.9269, test_f1: 0.5576
 epoch: 98, train_loss: 0.7639, test_loss: 0.9306, test_f1: 0.6031
 epoch: 99, train_loss: 0.7681, test_loss: 0.8920, test_f1: 0.6195
##################ITERATION #4 ****************************************
 epoch: 0, train_loss: 1.1728, test_loss: 0.9968, test_f1: 0.4456
 epoch: 1, train_loss: 1.0468, test_loss: 1.0418, test_f1: 0.4516
 epoch: 2, train_loss: 1.0205, test_loss: 1.0104, test_f1: 0.5044
 epoch: 3, train_loss: 1.0018, test_loss: 1.0342, test_f1: 0.4654
 epoch: 4, train_loss: 0.9852, test_loss: 1.0527, test_f1: 0.4730
 epoch: 5, train_loss: 0.9979, test_loss: 1.0212, test_f1: 0.4521
 epoch: 6, train_loss: 0.9806, test_loss: 1.0084, test_f1: 0.4650
 epoch: 7, train_loss: 0.9751, test_loss: 0.9627, test_f1: 0.4867
 epoch: 8, train_loss: 0.9541, test_loss: 1.0096, test_f1: 0.5034
 epoch: 9, train_loss: 0.9511, test_loss: 1.0022, test_f1: 0.5020
 epoch: 10, train_loss: 0.9465, test_loss: 0.9799, test_f1: 0.4784
 epoch: 11, train_loss: 0.9488, test_loss: 0.9432, test_f1: 0.5464
 epoch: 12, train_loss: 0.9389, test_loss: 0.9769, test_f1: 0.5319
 epoch: 13, train_loss: 0.9426, test_loss: 0.9646, test_f1: 0.4918
 epoch: 14, train_loss: 0.9301, test_loss: 1.0150, test_f1: 0.5075
 epoch: 15, train_loss: 0.9447, test_loss: 0.9584, test_f1: 0.4932
 epoch: 16, train_loss: 0.9269, test_loss: 0.9522, test_f1: 0.5162
 epoch: 17, train_loss: 0.9182, test_loss: 0.9350, test_f1: 0.4915
 epoch: 18, train_loss: 0.9200, test_loss: 0.9580, test_f1: 0.5041
 epoch: 19, train_loss: 0.9076, test_loss: 1.0293, test_f1: 0.4760
 epoch: 20, train_loss: 0.9276, test_loss: 0.9438, test_f1: 0.5109
 epoch: 21, train_loss: 0.9118, test_loss: 0.9011, test_f1: 0.5022
 epoch: 22, train_loss: 0.9010, test_loss: 0.8940, test_f1: 0.5069
 epoch: 23, train_loss: 0.9049, test_loss: 0.9846, test_f1: 0.5546
 epoch: 24, train_loss: 0.9010, test_loss: 1.0096, test_f1: 0.5110
 epoch: 25, train_loss: 0.8985, test_loss: 0.8711, test_f1: 0.5057
 epoch: 26, train_loss: 0.8870, test_loss: 0.9075, test_f1: 0.5273
 epoch: 27, train_loss: 0.8905, test_loss: 0.9327, test_f1: 0.5085
 epoch: 28, train_loss: 0.8951, test_loss: 0.9395, test_f1: 0.5117
 epoch: 29, train_loss: 0.8810, test_loss: 0.8966, test_f1: 0.5186
 epoch: 30, train_loss: 0.8852, test_loss: 0.9270, test_f1: 0.5371
 epoch: 31, train_loss: 0.8928, test_loss: 0.9580, test_f1: 0.5108
 epoch: 32, train_loss: 0.8823, test_loss: 0.9370, test_f1: 0.5128
 epoch: 33, train_loss: 0.8801, test_loss: 0.9318, test_f1: 0.5316
 epoch: 34, train_loss: 0.8603, test_loss: 0.9296, test_f1: 0.4851
 epoch: 35, train_loss: 0.8662, test_loss: 0.9328, test_f1: 0.5516
 epoch: 36, train_loss: 0.8576, test_loss: 0.9205, test_f1: 0.5306
 epoch: 37, train_loss: 0.8662, test_loss: 0.9170, test_f1: 0.5420
 epoch: 38, train_loss: 0.8739, test_loss: 0.8911, test_f1: 0.5246
 epoch: 39, train_loss: 0.8566, test_loss: 0.9260, test_f1: 0.5077
 epoch: 40, train_loss: 0.8730, test_loss: 0.9224, test_f1: 0.4974
 epoch: 41, train_loss: 0.8467, test_loss: 0.9103, test_f1: 0.5680
 epoch: 42, train_loss: 0.8624, test_loss: 0.9282, test_f1: 0.5089
 epoch: 43, train_loss: 0.8526, test_loss: 0.9145, test_f1: 0.5220
 epoch: 44, train_loss: 0.8476, test_loss: 0.8978, test_f1: 0.5839
 epoch: 45, train_loss: 0.8356, test_loss: 0.9147, test_f1: 0.5041
 epoch: 46, train_loss: 0.8441, test_loss: 0.9235, test_f1: 0.5608
 epoch: 47, train_loss: 0.8500, test_loss: 0.8887, test_f1: 0.6000
 epoch: 48, train_loss: 0.8312, test_loss: 0.9059, test_f1: 0.5681
 epoch: 49, train_loss: 0.8318, test_loss: 0.9311, test_f1: 0.5180
 epoch: 50, train_loss: 0.8404, test_loss: 0.9150, test_f1: 0.5705
 epoch: 51, train_loss: 0.8035, test_loss: 0.9113, test_f1: 0.5523
 epoch: 52, train_loss: 0.8171, test_loss: 0.8781, test_f1: 0.5676
 epoch: 53, train_loss: 0.8010, test_loss: 0.8870, test_f1: 0.5953
 epoch: 54, train_loss: 0.8041, test_loss: 0.8869, test_f1: 0.6236
 epoch: 55, train_loss: 0.7895, test_loss: 0.8797, test_f1: 0.5976
 epoch: 56, train_loss: 0.7951, test_loss: 0.9039, test_f1: 0.5770
 epoch: 57, train_loss: 0.8147, test_loss: 0.8873, test_f1: 0.5871
 epoch: 58, train_loss: 0.8047, test_loss: 0.9003, test_f1: 0.5728
 epoch: 59, train_loss: 0.7978, test_loss: 0.8733, test_f1: 0.5906
 epoch: 60, train_loss: 0.8015, test_loss: 0.8892, test_f1: 0.5964
 epoch: 61, train_loss: 0.7899, test_loss: 0.8953, test_f1: 0.5883
 epoch: 62, train_loss: 0.7942, test_loss: 0.8839, test_f1: 0.5698
 epoch: 63, train_loss: 0.8020, test_loss: 0.8740, test_f1: 0.6103
 epoch: 64, train_loss: 0.7883, test_loss: 0.8991, test_f1: 0.5889
 epoch: 65, train_loss: 0.7854, test_loss: 0.8951, test_f1: 0.6009
 epoch: 66, train_loss: 0.7745, test_loss: 0.9246, test_f1: 0.5849
 epoch: 67, train_loss: 0.7835, test_loss: 0.8901, test_f1: 0.5989
 epoch: 68, train_loss: 0.7700, test_loss: 0.8655, test_f1: 0.5851
 epoch: 69, train_loss: 0.7894, test_loss: 0.8862, test_f1: 0.5960
 epoch: 70, train_loss: 0.7835, test_loss: 0.8647, test_f1: 0.6176
 epoch: 71, train_loss: 0.7937, test_loss: 0.8974, test_f1: 0.5873
 epoch: 72, train_loss: 0.7800, test_loss: 0.8787, test_f1: 0.5926
 epoch: 73, train_loss: 0.7818, test_loss: 0.8998, test_f1: 0.5970
 epoch: 74, train_loss: 0.7810, test_loss: 0.8935, test_f1: 0.6223
 epoch: 75, train_loss: 0.7640, test_loss: 0.9439, test_f1: 0.5665
 epoch: 76, train_loss: 0.7665, test_loss: 0.8937, test_f1: 0.6045
 epoch: 77, train_loss: 0.7555, test_loss: 0.8615, test_f1: 0.6072
 epoch: 78, train_loss: 0.7814, test_loss: 0.8959, test_f1: 0.6076
 epoch: 79, train_loss: 0.7786, test_loss: 0.9034, test_f1: 0.5983
 epoch: 80, train_loss: 0.7763, test_loss: 0.8720, test_f1: 0.6046
 epoch: 81, train_loss: 0.7732, test_loss: 0.8749, test_f1: 0.6102
 epoch: 82, train_loss: 0.7517, test_loss: 0.8949, test_f1: 0.5982
 epoch: 83, train_loss: 0.7640, test_loss: 0.9070, test_f1: 0.5705
 epoch: 84, train_loss: 0.7555, test_loss: 0.8624, test_f1: 0.5998
 epoch: 85, train_loss: 0.7634, test_loss: 0.9247, test_f1: 0.5929
 epoch: 86, train_loss: 0.7596, test_loss: 0.9126, test_f1: 0.5831
 epoch: 87, train_loss: 0.7496, test_loss: 0.8955, test_f1: 0.6112
 epoch: 88, train_loss: 0.7400, test_loss: 0.9087, test_f1: 0.6008
 epoch: 89, train_loss: 0.7556, test_loss: 0.9034, test_f1: 0.6177
 epoch: 90, train_loss: 0.7602, test_loss: 0.9065, test_f1: 0.6141
 epoch: 91, train_loss: 0.7551, test_loss: 0.8836, test_f1: 0.6240
 epoch: 92, train_loss: 0.7495, test_loss: 0.8766, test_f1: 0.6086
 epoch: 93, train_loss: 0.7439, test_loss: 0.8784, test_f1: 0.6083
 epoch: 94, train_loss: 0.7461, test_loss: 0.9069, test_f1: 0.5979
 epoch: 95, train_loss: 0.7524, test_loss: 0.9530, test_f1: 0.5859
 epoch: 96, train_loss: 0.7444, test_loss: 0.8931, test_f1: 0.6313
 epoch: 97, train_loss: 0.7301, test_loss: 0.8889, test_f1: 0.6374
 epoch: 98, train_loss: 0.7480, test_loss: 0.8994, test_f1: 0.6158
 epoch: 99, train_loss: 0.7437, test_loss: 0.8886, test_f1: 0.6033
##################ITERATION #5 ****************************************
 epoch: 0, train_loss: 1.2371, test_loss: 1.0786, test_f1: 0.4229
 epoch: 1, train_loss: 1.0892, test_loss: 1.0512, test_f1: 0.4207
 epoch: 2, train_loss: 1.0461, test_loss: 1.0337, test_f1: 0.4269
 epoch: 3, train_loss: 1.0220, test_loss: 1.1287, test_f1: 0.3749
 epoch: 4, train_loss: 1.0177, test_loss: 1.0216, test_f1: 0.4573
 epoch: 5, train_loss: 0.9778, test_loss: 1.0236, test_f1: 0.4669
 epoch: 6, train_loss: 0.9776, test_loss: 1.0179, test_f1: 0.5310
 epoch: 7, train_loss: 0.9571, test_loss: 0.9933, test_f1: 0.4774
 epoch: 8, train_loss: 0.9628, test_loss: 1.0020, test_f1: 0.4833
 epoch: 9, train_loss: 0.9508, test_loss: 0.9883, test_f1: 0.4870
 epoch: 10, train_loss: 0.9490, test_loss: 0.9473, test_f1: 0.4876
 epoch: 11, train_loss: 0.9337, test_loss: 0.9787, test_f1: 0.5110
 epoch: 12, train_loss: 0.9357, test_loss: 0.9608, test_f1: 0.5149
 epoch: 13, train_loss: 0.9438, test_loss: 0.9761, test_f1: 0.4968
 epoch: 14, train_loss: 0.9490, test_loss: 0.9467, test_f1: 0.5039
 epoch: 15, train_loss: 0.9282, test_loss: 0.8769, test_f1: 0.5303
 epoch: 16, train_loss: 0.9280, test_loss: 0.9611, test_f1: 0.4894
 epoch: 17, train_loss: 0.9247, test_loss: 0.9713, test_f1: 0.4757
 epoch: 18, train_loss: 0.9076, test_loss: 0.9227, test_f1: 0.5083
 epoch: 19, train_loss: 0.9031, test_loss: 0.8621, test_f1: 0.5212
 epoch: 20, train_loss: 0.9044, test_loss: 0.9197, test_f1: 0.5075
 epoch: 21, train_loss: 0.8904, test_loss: 0.9393, test_f1: 0.4921
 epoch: 22, train_loss: 0.8876, test_loss: 0.9564, test_f1: 0.5433
 epoch: 23, train_loss: 0.8889, test_loss: 0.9208, test_f1: 0.5422
 epoch: 24, train_loss: 0.8768, test_loss: 0.8949, test_f1: 0.5262
 epoch: 25, train_loss: 0.8870, test_loss: 0.9310, test_f1: 0.5085
 epoch: 26, train_loss: 0.8543, test_loss: 0.8965, test_f1: 0.5432
 epoch: 27, train_loss: 0.8732, test_loss: 0.9265, test_f1: 0.5093
 epoch: 28, train_loss: 0.8815, test_loss: 0.9102, test_f1: 0.5312
 epoch: 29, train_loss: 0.8713, test_loss: 0.9199, test_f1: 0.5298
 epoch: 30, train_loss: 0.8502, test_loss: 0.9266, test_f1: 0.5319
 epoch: 31, train_loss: 0.8513, test_loss: 0.9284, test_f1: 0.5422
 epoch: 32, train_loss: 0.8647, test_loss: 0.9052, test_f1: 0.5385
 epoch: 33, train_loss: 0.8498, test_loss: 0.9608, test_f1: 0.5532
 epoch: 34, train_loss: 0.8610, test_loss: 0.9314, test_f1: 0.5173
 epoch: 35, train_loss: 0.8452, test_loss: 0.9207, test_f1: 0.5322
 epoch: 36, train_loss: 0.8417, test_loss: 0.8736, test_f1: 0.5305
 epoch: 37, train_loss: 0.8512, test_loss: 0.9684, test_f1: 0.5265
 epoch: 38, train_loss: 0.8320, test_loss: 0.9048, test_f1: 0.5617
 epoch: 39, train_loss: 0.8314, test_loss: 0.9253, test_f1: 0.5259
 epoch: 40, train_loss: 0.8460, test_loss: 0.9219, test_f1: 0.5362
 epoch: 41, train_loss: 0.8381, test_loss: 0.9276, test_f1: 0.5171
 epoch: 42, train_loss: 0.8266, test_loss: 0.9716, test_f1: 0.5383
 epoch: 43, train_loss: 0.8444, test_loss: 0.9733, test_f1: 0.5036
 epoch: 44, train_loss: 0.8372, test_loss: 0.9556, test_f1: 0.5505
 epoch: 45, train_loss: 0.8339, test_loss: 0.9243, test_f1: 0.5288
 epoch: 46, train_loss: 0.8268, test_loss: 0.9179, test_f1: 0.5874
 epoch: 47, train_loss: 0.8246, test_loss: 0.9424, test_f1: 0.5402
 epoch: 48, train_loss: 0.8259, test_loss: 0.9019, test_f1: 0.5345
 epoch: 49, train_loss: 0.8292, test_loss: 0.9382, test_f1: 0.5346
 epoch: 50, train_loss: 0.8234, test_loss: 0.9264, test_f1: 0.5351
 epoch: 51, train_loss: 0.8293, test_loss: 0.9055, test_f1: 0.5579
 epoch: 52, train_loss: 0.8084, test_loss: 0.9077, test_f1: 0.5599
 epoch: 53, train_loss: 0.7935, test_loss: 0.9024, test_f1: 0.5664
 epoch: 54, train_loss: 0.7941, test_loss: 0.8798, test_f1: 0.5807
 epoch: 55, train_loss: 0.8033, test_loss: 0.8893, test_f1: 0.5935
 epoch: 56, train_loss: 0.7722, test_loss: 0.9057, test_f1: 0.5536
 epoch: 57, train_loss: 0.7925, test_loss: 0.8985, test_f1: 0.5446
 epoch: 58, train_loss: 0.8007, test_loss: 0.8843, test_f1: 0.5643
 epoch: 59, train_loss: 0.7739, test_loss: 0.9049, test_f1: 0.5796
 epoch: 60, train_loss: 0.7900, test_loss: 0.8860, test_f1: 0.5898
 epoch: 61, train_loss: 0.7809, test_loss: 0.8768, test_f1: 0.6083
 epoch: 62, train_loss: 0.7827, test_loss: 0.8629, test_f1: 0.5962
 epoch: 63, train_loss: 0.7829, test_loss: 0.8925, test_f1: 0.5645
 epoch: 64, train_loss: 0.7846, test_loss: 0.9501, test_f1: 0.5384
 epoch: 65, train_loss: 0.7633, test_loss: 0.8911, test_f1: 0.5813
 epoch: 66, train_loss: 0.7738, test_loss: 0.9005, test_f1: 0.6274
 epoch: 67, train_loss: 0.7698, test_loss: 0.8978, test_f1: 0.6020
 epoch: 68, train_loss: 0.7865, test_loss: 0.9021, test_f1: 0.5736
 epoch: 69, train_loss: 0.7829, test_loss: 0.8807, test_f1: 0.6223
 epoch: 70, train_loss: 0.7726, test_loss: 0.8926, test_f1: 0.5897
 epoch: 71, train_loss: 0.7575, test_loss: 0.9050, test_f1: 0.6051
 epoch: 72, train_loss: 0.7706, test_loss: 0.8875, test_f1: 0.6349
 epoch: 73, train_loss: 0.7634, test_loss: 0.8997, test_f1: 0.6224
 epoch: 74, train_loss: 0.7610, test_loss: 0.9207, test_f1: 0.6001
 epoch: 75, train_loss: 0.7659, test_loss: 0.8841, test_f1: 0.6353
 epoch: 76, train_loss: 0.7554, test_loss: 0.8927, test_f1: 0.6066
 epoch: 77, train_loss: 0.7621, test_loss: 0.8857, test_f1: 0.6371
 epoch: 78, train_loss: 0.7638, test_loss: 0.9023, test_f1: 0.5890
 epoch: 79, train_loss: 0.7598, test_loss: 0.9018, test_f1: 0.6345
 epoch: 80, train_loss: 0.7773, test_loss: 0.8846, test_f1: 0.6242
 epoch: 81, train_loss: 0.7687, test_loss: 0.8925, test_f1: 0.5995
 epoch: 82, train_loss: 0.7372, test_loss: 0.8971, test_f1: 0.6450
 epoch: 83, train_loss: 0.7524, test_loss: 0.9002, test_f1: 0.6002
 epoch: 84, train_loss: 0.7579, test_loss: 0.8750, test_f1: 0.6184
 epoch: 85, train_loss: 0.7463, test_loss: 0.9019, test_f1: 0.6136
 epoch: 86, train_loss: 0.7589, test_loss: 0.8977, test_f1: 0.5945
 epoch: 87, train_loss: 0.7601, test_loss: 0.9066, test_f1: 0.6211
 epoch: 88, train_loss: 0.7447, test_loss: 0.8882, test_f1: 0.6171
 epoch: 89, train_loss: 0.7531, test_loss: 0.9126, test_f1: 0.6335
 epoch: 90, train_loss: 0.7483, test_loss: 0.8780, test_f1: 0.6079
 epoch: 91, train_loss: 0.7534, test_loss: 0.9045, test_f1: 0.6073
 epoch: 92, train_loss: 0.7542, test_loss: 0.8960, test_f1: 0.6135
 epoch: 93, train_loss: 0.7427, test_loss: 0.8841, test_f1: 0.6099
 epoch: 94, train_loss: 0.7423, test_loss: 0.8997, test_f1: 0.6114
 epoch: 95, train_loss: 0.7447, test_loss: 0.9073, test_f1: 0.6012
 epoch: 96, train_loss: 0.7499, test_loss: 0.8969, test_f1: 0.5831
 epoch: 97, train_loss: 0.7380, test_loss: 0.8969, test_f1: 0.6248
 epoch: 98, train_loss: 0.7509, test_loss: 0.9010, test_f1: 0.5940
 epoch: 99, train_loss: 0.7440, test_loss: 0.9027, test_f1: 0.5790
##################ITERATION #6 ****************************************
 epoch: 0, train_loss: 1.1596, test_loss: 1.0827, test_f1: 0.3954
 epoch: 1, train_loss: 1.0261, test_loss: 1.1076, test_f1: 0.3518
 epoch: 2, train_loss: 1.0377, test_loss: 1.0616, test_f1: 0.4711
 epoch: 3, train_loss: 1.0199, test_loss: 1.0025, test_f1: 0.4510
 epoch: 4, train_loss: 0.9920, test_loss: 0.9632, test_f1: 0.4352
 epoch: 5, train_loss: 0.9837, test_loss: 0.9629, test_f1: 0.4570
 epoch: 6, train_loss: 0.9747, test_loss: 0.9951, test_f1: 0.5017
 epoch: 7, train_loss: 0.9662, test_loss: 0.9077, test_f1: 0.5178
 epoch: 8, train_loss: 0.9580, test_loss: 0.9484, test_f1: 0.4802
 epoch: 9, train_loss: 0.9456, test_loss: 0.9440, test_f1: 0.4949
 epoch: 10, train_loss: 0.9437, test_loss: 1.0109, test_f1: 0.5343
 epoch: 11, train_loss: 0.9534, test_loss: 0.9889, test_f1: 0.5117
 epoch: 12, train_loss: 0.9430, test_loss: 1.0005, test_f1: 0.5027
 epoch: 13, train_loss: 0.9324, test_loss: 0.9779, test_f1: 0.5127
 epoch: 14, train_loss: 0.9291, test_loss: 0.9656, test_f1: 0.5344
 epoch: 15, train_loss: 0.9189, test_loss: 0.9752, test_f1: 0.4996
 epoch: 16, train_loss: 0.9220, test_loss: 0.9724, test_f1: 0.5206
 epoch: 17, train_loss: 0.9146, test_loss: 0.9603, test_f1: 0.5146
 epoch: 18, train_loss: 0.9205, test_loss: 0.9870, test_f1: 0.4971
 epoch: 19, train_loss: 0.9159, test_loss: 1.0028, test_f1: 0.4994
 epoch: 20, train_loss: 0.9123, test_loss: 0.9588, test_f1: 0.4736
 epoch: 21, train_loss: 0.8991, test_loss: 0.9613, test_f1: 0.5344
 epoch: 22, train_loss: 0.8946, test_loss: 0.9198, test_f1: 0.5399
 epoch: 23, train_loss: 0.8917, test_loss: 0.9149, test_f1: 0.5171
 epoch: 24, train_loss: 0.8895, test_loss: 0.9000, test_f1: 0.5394
 epoch: 25, train_loss: 0.8907, test_loss: 0.8827, test_f1: 0.5132
 epoch: 26, train_loss: 0.8975, test_loss: 0.9164, test_f1: 0.5632
 epoch: 27, train_loss: 0.9063, test_loss: 0.9479, test_f1: 0.5142
 epoch: 28, train_loss: 0.8881, test_loss: 0.9213, test_f1: 0.5505
 epoch: 29, train_loss: 0.8740, test_loss: 0.9344, test_f1: 0.5281
 epoch: 30, train_loss: 0.8816, test_loss: 0.9669, test_f1: 0.5127
 epoch: 31, train_loss: 0.8934, test_loss: 0.9540, test_f1: 0.4851
 epoch: 32, train_loss: 0.8816, test_loss: 0.9217, test_f1: 0.5111
 epoch: 33, train_loss: 0.8681, test_loss: 0.8881, test_f1: 0.5336
 epoch: 34, train_loss: 0.8753, test_loss: 0.9346, test_f1: 0.4913
 epoch: 35, train_loss: 0.8743, test_loss: 0.9232, test_f1: 0.5880
 epoch: 36, train_loss: 0.8692, test_loss: 0.8795, test_f1: 0.5709
 epoch: 37, train_loss: 0.8537, test_loss: 0.9214, test_f1: 0.5345
 epoch: 38, train_loss: 0.8636, test_loss: 0.9118, test_f1: 0.5666
 epoch: 39, train_loss: 0.8617, test_loss: 0.9873, test_f1: 0.5066
 epoch: 40, train_loss: 0.8698, test_loss: 0.9441, test_f1: 0.5248
 epoch: 41, train_loss: 0.8565, test_loss: 0.8976, test_f1: 0.5926
 epoch: 42, train_loss: 0.8571, test_loss: 0.9235, test_f1: 0.5418
 epoch: 43, train_loss: 0.8515, test_loss: 0.9177, test_f1: 0.5121
 epoch: 44, train_loss: 0.8701, test_loss: 0.8965, test_f1: 0.5275
 epoch: 45, train_loss: 0.8691, test_loss: 0.9060, test_f1: 0.5238
 epoch: 46, train_loss: 0.8619, test_loss: 0.9712, test_f1: 0.4879
 epoch: 47, train_loss: 0.8385, test_loss: 0.8774, test_f1: 0.5291
 epoch: 48, train_loss: 0.8508, test_loss: 0.8818, test_f1: 0.5418
 epoch: 49, train_loss: 0.8511, test_loss: 0.8296, test_f1: 0.5370
 epoch: 50, train_loss: 0.8406, test_loss: 0.8812, test_f1: 0.5786
 epoch: 51, train_loss: 0.8107, test_loss: 0.8801, test_f1: 0.5307
 epoch: 52, train_loss: 0.8210, test_loss: 0.9185, test_f1: 0.5457
 epoch: 53, train_loss: 0.8194, test_loss: 0.8716, test_f1: 0.5512
 epoch: 54, train_loss: 0.8060, test_loss: 0.8668, test_f1: 0.5722
 epoch: 55, train_loss: 0.8037, test_loss: 0.8314, test_f1: 0.5462
 epoch: 56, train_loss: 0.7950, test_loss: 0.8650, test_f1: 0.5459
 epoch: 57, train_loss: 0.7913, test_loss: 0.8562, test_f1: 0.5583
 epoch: 58, train_loss: 0.8127, test_loss: 0.8568, test_f1: 0.5654
 epoch: 59, train_loss: 0.7989, test_loss: 0.9137, test_f1: 0.5462
 epoch: 60, train_loss: 0.8060, test_loss: 0.8644, test_f1: 0.5798
 epoch: 61, train_loss: 0.7971, test_loss: 0.8441, test_f1: 0.5868
 epoch: 62, train_loss: 0.7955, test_loss: 0.8635, test_f1: 0.5901
 epoch: 63, train_loss: 0.7933, test_loss: 0.8309, test_f1: 0.5894
 epoch: 64, train_loss: 0.7903, test_loss: 0.8568, test_f1: 0.5920
 epoch: 65, train_loss: 0.7825, test_loss: 0.8925, test_f1: 0.5548
 epoch: 66, train_loss: 0.7983, test_loss: 0.8781, test_f1: 0.5735
 epoch: 67, train_loss: 0.7815, test_loss: 0.8478, test_f1: 0.5687
 epoch: 68, train_loss: 0.7782, test_loss: 0.8840, test_f1: 0.5625
 epoch: 69, train_loss: 0.7947, test_loss: 0.8658, test_f1: 0.5343
 epoch: 70, train_loss: 0.7958, test_loss: 0.8559, test_f1: 0.5928
 epoch: 71, train_loss: 0.7907, test_loss: 0.8657, test_f1: 0.5564
 epoch: 72, train_loss: 0.7804, test_loss: 0.8711, test_f1: 0.5632
 epoch: 73, train_loss: 0.7744, test_loss: 0.8314, test_f1: 0.5846
 epoch: 74, train_loss: 0.7683, test_loss: 0.8406, test_f1: 0.5882
 epoch: 75, train_loss: 0.7703, test_loss: 0.8779, test_f1: 0.5552
 epoch: 76, train_loss: 0.7778, test_loss: 0.8332, test_f1: 0.6070
 epoch: 77, train_loss: 0.7769, test_loss: 0.8392, test_f1: 0.5740
 epoch: 78, train_loss: 0.7767, test_loss: 0.8264, test_f1: 0.5885
 epoch: 79, train_loss: 0.7623, test_loss: 0.8588, test_f1: 0.5727
 epoch: 80, train_loss: 0.7704, test_loss: 0.8497, test_f1: 0.5886
 epoch: 81, train_loss: 0.7545, test_loss: 0.8734, test_f1: 0.5524
 epoch: 82, train_loss: 0.7552, test_loss: 0.8732, test_f1: 0.5900
 epoch: 83, train_loss: 0.7687, test_loss: 0.8453, test_f1: 0.5806
 epoch: 84, train_loss: 0.7779, test_loss: 0.8377, test_f1: 0.6012
 epoch: 85, train_loss: 0.7734, test_loss: 0.8768, test_f1: 0.5515
 epoch: 86, train_loss: 0.7638, test_loss: 0.8750, test_f1: 0.5930
 epoch: 87, train_loss: 0.7606, test_loss: 0.8454, test_f1: 0.5998
 epoch: 88, train_loss: 0.7613, test_loss: 0.8648, test_f1: 0.5718
 epoch: 89, train_loss: 0.7569, test_loss: 0.8546, test_f1: 0.6099
 epoch: 90, train_loss: 0.7746, test_loss: 0.8531, test_f1: 0.6026
 epoch: 91, train_loss: 0.7491, test_loss: 0.8546, test_f1: 0.5866
 epoch: 92, train_loss: 0.7487, test_loss: 0.8699, test_f1: 0.5955
 epoch: 93, train_loss: 0.7503, test_loss: 0.8541, test_f1: 0.6135
 epoch: 94, train_loss: 0.7536, test_loss: 0.8318, test_f1: 0.5632
 epoch: 95, train_loss: 0.7563, test_loss: 0.8409, test_f1: 0.6137
 epoch: 96, train_loss: 0.7707, test_loss: 0.8655, test_f1: 0.5662
 epoch: 97, train_loss: 0.7516, test_loss: 0.8448, test_f1: 0.5992
 epoch: 98, train_loss: 0.7605, test_loss: 0.8467, test_f1: 0.5957
 epoch: 99, train_loss: 0.7379, test_loss: 0.8470, test_f1: 0.5904
##################ITERATION #7 ****************************************
 epoch: 0, train_loss: 1.2032, test_loss: 1.0519, test_f1: 0.3810
 epoch: 1, train_loss: 1.0658, test_loss: 1.0549, test_f1: 0.4362
 epoch: 2, train_loss: 1.0264, test_loss: 1.0670, test_f1: 0.4136
 epoch: 3, train_loss: 1.0183, test_loss: 1.0169, test_f1: 0.4633
 epoch: 4, train_loss: 0.9921, test_loss: 1.0076, test_f1: 0.4322
 epoch: 5, train_loss: 0.9885, test_loss: 1.0280, test_f1: 0.5067
 epoch: 6, train_loss: 0.9689, test_loss: 1.0184, test_f1: 0.4932
 epoch: 7, train_loss: 0.9768, test_loss: 1.0089, test_f1: 0.4626
 epoch: 8, train_loss: 0.9649, test_loss: 0.9676, test_f1: 0.4757
 epoch: 9, train_loss: 0.9347, test_loss: 1.0197, test_f1: 0.4637
 epoch: 10, train_loss: 0.9545, test_loss: 1.0039, test_f1: 0.4663
 epoch: 11, train_loss: 0.9409, test_loss: 1.0285, test_f1: 0.4752
 epoch: 12, train_loss: 0.9367, test_loss: 0.9981, test_f1: 0.4854
 epoch: 13, train_loss: 0.9250, test_loss: 0.9445, test_f1: 0.5069
 epoch: 14, train_loss: 0.9366, test_loss: 0.9767, test_f1: 0.4798
 epoch: 15, train_loss: 0.9250, test_loss: 0.9335, test_f1: 0.4999
 epoch: 16, train_loss: 0.9235, test_loss: 0.9741, test_f1: 0.4890
 epoch: 17, train_loss: 0.9078, test_loss: 0.9611, test_f1: 0.4868
 epoch: 18, train_loss: 0.9079, test_loss: 0.9674, test_f1: 0.5447
 epoch: 19, train_loss: 0.8942, test_loss: 1.0360, test_f1: 0.4708
 epoch: 20, train_loss: 0.9138, test_loss: 0.9629, test_f1: 0.5010
 epoch: 21, train_loss: 0.8985, test_loss: 0.9475, test_f1: 0.4978
 epoch: 22, train_loss: 0.8983, test_loss: 0.9519, test_f1: 0.4985
 epoch: 23, train_loss: 0.9113, test_loss: 0.9154, test_f1: 0.5379
 epoch: 24, train_loss: 0.9017, test_loss: 0.9890, test_f1: 0.4905
 epoch: 25, train_loss: 0.8898, test_loss: 0.9818, test_f1: 0.5072
 epoch: 26, train_loss: 0.8921, test_loss: 0.9949, test_f1: 0.4948
 epoch: 27, train_loss: 0.8959, test_loss: 0.9987, test_f1: 0.5038
 epoch: 28, train_loss: 0.8907, test_loss: 1.0048, test_f1: 0.5211
 epoch: 29, train_loss: 0.8885, test_loss: 0.9873, test_f1: 0.5377
 epoch: 30, train_loss: 0.8888, test_loss: 1.0832, test_f1: 0.4726
 epoch: 31, train_loss: 0.8878, test_loss: 0.9451, test_f1: 0.4944
 epoch: 32, train_loss: 0.8681, test_loss: 0.9671, test_f1: 0.4970
 epoch: 33, train_loss: 0.8669, test_loss: 0.9570, test_f1: 0.5152
 epoch: 34, train_loss: 0.8730, test_loss: 0.9482, test_f1: 0.5235
 epoch: 35, train_loss: 0.8708, test_loss: 0.9575, test_f1: 0.5108
 epoch: 36, train_loss: 0.8775, test_loss: 0.9497, test_f1: 0.4986
 epoch: 37, train_loss: 0.8702, test_loss: 0.9621, test_f1: 0.5312
 epoch: 38, train_loss: 0.8665, test_loss: 0.9477, test_f1: 0.5361
 epoch: 39, train_loss: 0.8576, test_loss: 0.9764, test_f1: 0.4789
 epoch: 40, train_loss: 0.8649, test_loss: 0.9512, test_f1: 0.5125
 epoch: 41, train_loss: 0.8560, test_loss: 1.0529, test_f1: 0.5150
 epoch: 42, train_loss: 0.8564, test_loss: 0.9617, test_f1: 0.5120
 epoch: 43, train_loss: 0.8521, test_loss: 0.9131, test_f1: 0.5291
 epoch: 44, train_loss: 0.8552, test_loss: 0.9265, test_f1: 0.5223
 epoch: 45, train_loss: 0.8587, test_loss: 1.0378, test_f1: 0.4876
 epoch: 46, train_loss: 0.8626, test_loss: 0.9426, test_f1: 0.5036
 epoch: 47, train_loss: 0.8404, test_loss: 0.9276, test_f1: 0.5585
 epoch: 48, train_loss: 0.8343, test_loss: 0.9330, test_f1: 0.5600
 epoch: 49, train_loss: 0.8484, test_loss: 1.0297, test_f1: 0.4791
 epoch: 50, train_loss: 0.8511, test_loss: 0.9417, test_f1: 0.5537
 epoch: 51, train_loss: 0.8206, test_loss: 0.9441, test_f1: 0.5216
 epoch: 52, train_loss: 0.8195, test_loss: 0.9220, test_f1: 0.5265
 epoch: 53, train_loss: 0.8127, test_loss: 0.9728, test_f1: 0.5084
 epoch: 54, train_loss: 0.8047, test_loss: 0.9339, test_f1: 0.5246
 epoch: 55, train_loss: 0.8065, test_loss: 0.9407, test_f1: 0.5147
 epoch: 56, train_loss: 0.7952, test_loss: 0.9903, test_f1: 0.5144
 epoch: 57, train_loss: 0.7955, test_loss: 0.9219, test_f1: 0.5288
 epoch: 58, train_loss: 0.8001, test_loss: 1.0141, test_f1: 0.5030
 epoch: 59, train_loss: 0.8057, test_loss: 0.9041, test_f1: 0.5331
 epoch: 60, train_loss: 0.7952, test_loss: 0.9751, test_f1: 0.5025
 epoch: 61, train_loss: 0.7935, test_loss: 0.9362, test_f1: 0.5208
 epoch: 62, train_loss: 0.7974, test_loss: 0.9580, test_f1: 0.5155
 epoch: 63, train_loss: 0.7810, test_loss: 0.9175, test_f1: 0.5492
 epoch: 64, train_loss: 0.7889, test_loss: 0.9536, test_f1: 0.5647
 epoch: 65, train_loss: 0.7932, test_loss: 0.9473, test_f1: 0.5648
 epoch: 66, train_loss: 0.8022, test_loss: 0.9491, test_f1: 0.5253
 epoch: 67, train_loss: 0.7954, test_loss: 0.9285, test_f1: 0.5222
 epoch: 68, train_loss: 0.7870, test_loss: 0.9640, test_f1: 0.5228
 epoch: 69, train_loss: 0.7869, test_loss: 0.9352, test_f1: 0.5270
 epoch: 70, train_loss: 0.7866, test_loss: 0.9937, test_f1: 0.5314
 epoch: 71, train_loss: 0.7700, test_loss: 0.9793, test_f1: 0.5627
 epoch: 72, train_loss: 0.7731, test_loss: 0.9700, test_f1: 0.5256
 epoch: 73, train_loss: 0.7797, test_loss: 0.9432, test_f1: 0.5355
 epoch: 74, train_loss: 0.7879, test_loss: 0.9456, test_f1: 0.5382
 epoch: 75, train_loss: 0.7767, test_loss: 0.9673, test_f1: 0.5370
 epoch: 76, train_loss: 0.7770, test_loss: 0.9794, test_f1: 0.5418
 epoch: 77, train_loss: 0.7713, test_loss: 0.9768, test_f1: 0.5378
 epoch: 78, train_loss: 0.7776, test_loss: 0.9193, test_f1: 0.5570
 epoch: 79, train_loss: 0.7777, test_loss: 1.0171, test_f1: 0.5248
 epoch: 80, train_loss: 0.7809, test_loss: 0.9531, test_f1: 0.5156
 epoch: 81, train_loss: 0.7776, test_loss: 0.9137, test_f1: 0.5592
 epoch: 82, train_loss: 0.7768, test_loss: 0.9594, test_f1: 0.5717
 epoch: 83, train_loss: 0.7675, test_loss: 0.9248, test_f1: 0.5622
 epoch: 84, train_loss: 0.7775, test_loss: 0.9140, test_f1: 0.5880
 epoch: 85, train_loss: 0.7601, test_loss: 0.9864, test_f1: 0.5563
 epoch: 86, train_loss: 0.7538, test_loss: 0.9091, test_f1: 0.5967
 epoch: 87, train_loss: 0.7591, test_loss: 0.9710, test_f1: 0.5610
 epoch: 88, train_loss: 0.7662, test_loss: 0.9784, test_f1: 0.5650
 epoch: 89, train_loss: 0.7654, test_loss: 0.9317, test_f1: 0.5723
 epoch: 90, train_loss: 0.7511, test_loss: 0.9341, test_f1: 0.5811
 epoch: 91, train_loss: 0.7656, test_loss: 0.9575, test_f1: 0.5720
 epoch: 92, train_loss: 0.7683, test_loss: 0.9877, test_f1: 0.5566
 epoch: 93, train_loss: 0.7607, test_loss: 0.9334, test_f1: 0.5867
 epoch: 94, train_loss: 0.7504, test_loss: 0.9901, test_f1: 0.5784
 epoch: 95, train_loss: 0.7424, test_loss: 0.9257, test_f1: 0.5615
 epoch: 96, train_loss: 0.7581, test_loss: 0.9748, test_f1: 0.5779
 epoch: 97, train_loss: 0.7387, test_loss: 0.9899, test_f1: 0.5731
 epoch: 98, train_loss: 0.7572, test_loss: 0.9726, test_f1: 0.5858
 epoch: 99, train_loss: 0.7507, test_loss: 0.9620, test_f1: 0.5866
##################ITERATION #8 ****************************************
 epoch: 0, train_loss: 1.2363, test_loss: 1.1286, test_f1: 0.4330
 epoch: 1, train_loss: 1.0987, test_loss: 0.9893, test_f1: 0.4496
 epoch: 2, train_loss: 1.0485, test_loss: 0.9927, test_f1: 0.4538
 epoch: 3, train_loss: 1.0387, test_loss: 1.0341, test_f1: 0.4668
 epoch: 4, train_loss: 1.0132, test_loss: 1.0201, test_f1: 0.4541
 epoch: 5, train_loss: 0.9874, test_loss: 1.0194, test_f1: 0.4536
 epoch: 6, train_loss: 0.9900, test_loss: 0.9936, test_f1: 0.4875
 epoch: 7, train_loss: 0.9786, test_loss: 0.9850, test_f1: 0.4993
 epoch: 8, train_loss: 0.9628, test_loss: 0.9712, test_f1: 0.4837
 epoch: 9, train_loss: 0.9691, test_loss: 0.9904, test_f1: 0.4507
 epoch: 10, train_loss: 0.9636, test_loss: 0.9611, test_f1: 0.5350
 epoch: 11, train_loss: 0.9540, test_loss: 0.9505, test_f1: 0.5010
 epoch: 12, train_loss: 0.9702, test_loss: 0.9607, test_f1: 0.4821
 epoch: 13, train_loss: 0.9421, test_loss: 0.9878, test_f1: 0.5154
 epoch: 14, train_loss: 0.9445, test_loss: 0.9281, test_f1: 0.4922
 epoch: 15, train_loss: 0.9572, test_loss: 0.9593, test_f1: 0.4930
 epoch: 16, train_loss: 0.9464, test_loss: 1.0164, test_f1: 0.4673
 epoch: 17, train_loss: 0.9399, test_loss: 0.9221, test_f1: 0.5090
 epoch: 18, train_loss: 0.9503, test_loss: 0.9509, test_f1: 0.4892
 epoch: 19, train_loss: 0.9453, test_loss: 0.9725, test_f1: 0.5103
 epoch: 20, train_loss: 0.9298, test_loss: 0.9826, test_f1: 0.4795
 epoch: 21, train_loss: 0.9228, test_loss: 0.9501, test_f1: 0.4692
 epoch: 22, train_loss: 0.9527, test_loss: 0.9931, test_f1: 0.4991
 epoch: 23, train_loss: 0.9135, test_loss: 0.9610, test_f1: 0.4824
 epoch: 24, train_loss: 0.9305, test_loss: 0.9375, test_f1: 0.4874
 epoch: 25, train_loss: 0.9076, test_loss: 0.9582, test_f1: 0.4914
 epoch: 26, train_loss: 0.9094, test_loss: 0.9323, test_f1: 0.5145
 epoch: 27, train_loss: 0.9049, test_loss: 0.9933, test_f1: 0.4915
 epoch: 28, train_loss: 0.9271, test_loss: 1.0033, test_f1: 0.4708
 epoch: 29, train_loss: 0.9013, test_loss: 1.0264, test_f1: 0.5069
 epoch: 30, train_loss: 0.9070, test_loss: 0.9042, test_f1: 0.4797
 epoch: 31, train_loss: 0.8988, test_loss: 0.9815, test_f1: 0.4838
 epoch: 32, train_loss: 0.8948, test_loss: 0.8741, test_f1: 0.5346
 epoch: 33, train_loss: 0.8961, test_loss: 1.0117, test_f1: 0.5294
 epoch: 34, train_loss: 0.8864, test_loss: 0.9132, test_f1: 0.5196
 epoch: 35, train_loss: 0.8778, test_loss: 0.9261, test_f1: 0.4865
 epoch: 36, train_loss: 0.8800, test_loss: 1.0450, test_f1: 0.4754
 epoch: 37, train_loss: 0.8797, test_loss: 0.9266, test_f1: 0.5122
 epoch: 38, train_loss: 0.8779, test_loss: 0.9146, test_f1: 0.5329
 epoch: 39, train_loss: 0.8806, test_loss: 0.9621, test_f1: 0.5025
 epoch: 40, train_loss: 0.8718, test_loss: 0.9723, test_f1: 0.5222
 epoch: 41, train_loss: 0.8752, test_loss: 0.9291, test_f1: 0.5159
 epoch: 42, train_loss: 0.8637, test_loss: 0.9083, test_f1: 0.5412
 epoch: 43, train_loss: 0.8542, test_loss: 0.9177, test_f1: 0.5380
 epoch: 44, train_loss: 0.8544, test_loss: 0.9346, test_f1: 0.5184
 epoch: 45, train_loss: 0.8554, test_loss: 1.0524, test_f1: 0.5156
 epoch: 46, train_loss: 0.8545, test_loss: 0.9226, test_f1: 0.4984
 epoch: 47, train_loss: 0.8467, test_loss: 0.9388, test_f1: 0.5640
 epoch: 48, train_loss: 0.8640, test_loss: 0.9047, test_f1: 0.5502
 epoch: 49, train_loss: 0.8493, test_loss: 0.9086, test_f1: 0.5472
 epoch: 50, train_loss: 0.8676, test_loss: 0.9333, test_f1: 0.5761
 epoch: 51, train_loss: 0.8316, test_loss: 0.9146, test_f1: 0.5470
 epoch: 52, train_loss: 0.8129, test_loss: 0.9165, test_f1: 0.5779
 epoch: 53, train_loss: 0.8137, test_loss: 0.9044, test_f1: 0.5316
 epoch: 54, train_loss: 0.8124, test_loss: 0.9213, test_f1: 0.5692
 epoch: 55, train_loss: 0.8063, test_loss: 0.9124, test_f1: 0.5822
 epoch: 56, train_loss: 0.8086, test_loss: 0.8983, test_f1: 0.5805
 epoch: 57, train_loss: 0.8142, test_loss: 0.9390, test_f1: 0.5763
 epoch: 58, train_loss: 0.7945, test_loss: 0.9371, test_f1: 0.5878
 epoch: 59, train_loss: 0.7881, test_loss: 0.9322, test_f1: 0.5530
 epoch: 60, train_loss: 0.8058, test_loss: 0.9540, test_f1: 0.5555
 epoch: 61, train_loss: 0.7961, test_loss: 0.9184, test_f1: 0.6002
 epoch: 62, train_loss: 0.7892, test_loss: 0.9141, test_f1: 0.6109
 epoch: 63, train_loss: 0.7972, test_loss: 0.9299, test_f1: 0.5864
 epoch: 64, train_loss: 0.7898, test_loss: 0.8989, test_f1: 0.6003
 epoch: 65, train_loss: 0.7930, test_loss: 0.9068, test_f1: 0.5725
 epoch: 66, train_loss: 0.7845, test_loss: 0.9406, test_f1: 0.5911
 epoch: 67, train_loss: 0.7872, test_loss: 0.9716, test_f1: 0.5608
 epoch: 68, train_loss: 0.7816, test_loss: 0.9133, test_f1: 0.6075
 epoch: 69, train_loss: 0.7849, test_loss: 0.9248, test_f1: 0.5770
 epoch: 70, train_loss: 0.8078, test_loss: 1.0043, test_f1: 0.5694
 epoch: 71, train_loss: 0.7867, test_loss: 0.9262, test_f1: 0.5868
 epoch: 72, train_loss: 0.7715, test_loss: 0.9292, test_f1: 0.5894
 epoch: 73, train_loss: 0.7702, test_loss: 0.9610, test_f1: 0.5906
 epoch: 74, train_loss: 0.7855, test_loss: 0.9228, test_f1: 0.5881
 epoch: 75, train_loss: 0.7856, test_loss: 0.9673, test_f1: 0.5936
 epoch: 76, train_loss: 0.7751, test_loss: 0.9728, test_f1: 0.5918
 epoch: 77, train_loss: 0.7877, test_loss: 0.9361, test_f1: 0.5912
 epoch: 78, train_loss: 0.7684, test_loss: 0.9199, test_f1: 0.6045
 epoch: 79, train_loss: 0.7906, test_loss: 0.9621, test_f1: 0.6026
 epoch: 80, train_loss: 0.7667, test_loss: 0.8704, test_f1: 0.6191
 epoch: 81, train_loss: 0.7731, test_loss: 0.8854, test_f1: 0.6182
 epoch: 82, train_loss: 0.7630, test_loss: 0.8692, test_f1: 0.6054
 epoch: 83, train_loss: 0.7732, test_loss: 0.9408, test_f1: 0.6090
 epoch: 84, train_loss: 0.7736, test_loss: 0.9014, test_f1: 0.6260
 epoch: 85, train_loss: 0.7631, test_loss: 0.9179, test_f1: 0.6192
 epoch: 86, train_loss: 0.7872, test_loss: 0.9245, test_f1: 0.6346
 epoch: 87, train_loss: 0.7752, test_loss: 0.9084, test_f1: 0.6358
 epoch: 88, train_loss: 0.7554, test_loss: 0.9368, test_f1: 0.6266
 epoch: 89, train_loss: 0.7778, test_loss: 0.9042, test_f1: 0.6383
 epoch: 90, train_loss: 0.7662, test_loss: 0.9306, test_f1: 0.6345
 epoch: 91, train_loss: 0.7516, test_loss: 0.9401, test_f1: 0.6311
 epoch: 92, train_loss: 0.7536, test_loss: 0.9495, test_f1: 0.6068
 epoch: 93, train_loss: 0.7528, test_loss: 0.9368, test_f1: 0.6232
 epoch: 94, train_loss: 0.7696, test_loss: 0.9369, test_f1: 0.6503
 epoch: 95, train_loss: 0.7410, test_loss: 0.9203, test_f1: 0.6254
 epoch: 96, train_loss: 0.7455, test_loss: 0.9200, test_f1: 0.6154
 epoch: 97, train_loss: 0.7528, test_loss: 0.9432, test_f1: 0.6139
 epoch: 98, train_loss: 0.7647, test_loss: 0.9445, test_f1: 0.6176
 epoch: 99, train_loss: 0.7407, test_loss: 0.9070, test_f1: 0.5978
##################ITERATION #9 ****************************************
 epoch: 0, train_loss: 1.2563, test_loss: 1.2029, test_f1: 0.3203
 epoch: 1, train_loss: 1.1200, test_loss: 1.0418, test_f1: 0.4310
 epoch: 2, train_loss: 1.0528, test_loss: 0.9931, test_f1: 0.4597
 epoch: 3, train_loss: 1.0143, test_loss: 1.0211, test_f1: 0.4487
 epoch: 4, train_loss: 0.9930, test_loss: 1.0438, test_f1: 0.4661
 epoch: 5, train_loss: 0.9868, test_loss: 1.0578, test_f1: 0.4704
 epoch: 6, train_loss: 0.9786, test_loss: 1.0081, test_f1: 0.4723
 epoch: 7, train_loss: 0.9699, test_loss: 0.9991, test_f1: 0.5150
 epoch: 8, train_loss: 0.9640, test_loss: 1.0270, test_f1: 0.4860
 epoch: 9, train_loss: 0.9472, test_loss: 0.9490, test_f1: 0.5274
 epoch: 10, train_loss: 0.9491, test_loss: 1.0829, test_f1: 0.4026
 epoch: 11, train_loss: 0.9497, test_loss: 1.0082, test_f1: 0.5013
 epoch: 12, train_loss: 0.9482, test_loss: 0.9096, test_f1: 0.4874
 epoch: 13, train_loss: 0.9265, test_loss: 0.9961, test_f1: 0.5005
 epoch: 14, train_loss: 0.9370, test_loss: 1.0039, test_f1: 0.4980
 epoch: 15, train_loss: 0.9630, test_loss: 0.9623, test_f1: 0.5457
 epoch: 16, train_loss: 0.9467, test_loss: 0.9919, test_f1: 0.4959
 epoch: 17, train_loss: 0.9314, test_loss: 0.9825, test_f1: 0.5004
 epoch: 18, train_loss: 0.9181, test_loss: 1.0181, test_f1: 0.4828
 epoch: 19, train_loss: 0.9209, test_loss: 0.9749, test_f1: 0.5018
 epoch: 20, train_loss: 0.9151, test_loss: 0.9686, test_f1: 0.5347
 epoch: 21, train_loss: 0.9010, test_loss: 0.9921, test_f1: 0.5361
 epoch: 22, train_loss: 0.9026, test_loss: 0.9736, test_f1: 0.5049
 epoch: 23, train_loss: 0.8934, test_loss: 0.9798, test_f1: 0.5060
 epoch: 24, train_loss: 0.9066, test_loss: 0.9821, test_f1: 0.4920
 epoch: 25, train_loss: 0.9020, test_loss: 0.9846, test_f1: 0.5040
 epoch: 26, train_loss: 0.8998, test_loss: 0.9757, test_f1: 0.5099
 epoch: 27, train_loss: 0.8970, test_loss: 0.9406, test_f1: 0.5092
 epoch: 28, train_loss: 0.8820, test_loss: 0.9439, test_f1: 0.5380
 epoch: 29, train_loss: 0.8785, test_loss: 0.9348, test_f1: 0.5005
 epoch: 30, train_loss: 0.8903, test_loss: 0.9525, test_f1: 0.5053
 epoch: 31, train_loss: 0.8742, test_loss: 0.9370, test_f1: 0.5162
 epoch: 32, train_loss: 0.8719, test_loss: 0.9390, test_f1: 0.5340
 epoch: 33, train_loss: 0.8749, test_loss: 0.9511, test_f1: 0.5547
 epoch: 34, train_loss: 0.8698, test_loss: 0.9623, test_f1: 0.5025
 epoch: 35, train_loss: 0.8734, test_loss: 0.9770, test_f1: 0.5430
 epoch: 36, train_loss: 0.8585, test_loss: 0.9417, test_f1: 0.5102
 epoch: 37, train_loss: 0.8649, test_loss: 0.9573, test_f1: 0.5061
 epoch: 38, train_loss: 0.8633, test_loss: 0.9489, test_f1: 0.5149
 epoch: 39, train_loss: 0.8671, test_loss: 0.9298, test_f1: 0.5278
 epoch: 40, train_loss: 0.8561, test_loss: 0.9537, test_f1: 0.5007
 epoch: 41, train_loss: 0.8594, test_loss: 0.9213, test_f1: 0.5133
 epoch: 42, train_loss: 0.8581, test_loss: 0.9296, test_f1: 0.5143
 epoch: 43, train_loss: 0.8552, test_loss: 0.9216, test_f1: 0.5096
 epoch: 44, train_loss: 0.8488, test_loss: 0.9358, test_f1: 0.5061
 epoch: 45, train_loss: 0.8400, test_loss: 0.9754, test_f1: 0.5027
 epoch: 46, train_loss: 0.8385, test_loss: 0.9327, test_f1: 0.5669
 epoch: 47, train_loss: 0.8398, test_loss: 1.0220, test_f1: 0.4910
 epoch: 48, train_loss: 0.8617, test_loss: 0.9508, test_f1: 0.5073
 epoch: 49, train_loss: 0.8512, test_loss: 0.9289, test_f1: 0.5244
 epoch: 50, train_loss: 0.8273, test_loss: 0.9155, test_f1: 0.5690
 epoch: 51, train_loss: 0.8125, test_loss: 0.8975, test_f1: 0.5843
 epoch: 52, train_loss: 0.8203, test_loss: 0.9155, test_f1: 0.5168
 epoch: 53, train_loss: 0.8275, test_loss: 0.9313, test_f1: 0.5050
 epoch: 54, train_loss: 0.8129, test_loss: 0.9081, test_f1: 0.5338
 epoch: 55, train_loss: 0.8110, test_loss: 0.9157, test_f1: 0.5731
 epoch: 56, train_loss: 0.8141, test_loss: 0.8808, test_f1: 0.5318
 epoch: 57, train_loss: 0.8056, test_loss: 0.8861, test_f1: 0.5287
 epoch: 58, train_loss: 0.8066, test_loss: 0.9051, test_f1: 0.5435
 epoch: 59, train_loss: 0.8052, test_loss: 0.8832, test_f1: 0.5896
 epoch: 60, train_loss: 0.8041, test_loss: 0.8822, test_f1: 0.5765
 epoch: 61, train_loss: 0.8109, test_loss: 0.8992, test_f1: 0.5788
 epoch: 62, train_loss: 0.7900, test_loss: 0.8784, test_f1: 0.5436
 epoch: 63, train_loss: 0.8078, test_loss: 0.8852, test_f1: 0.5299
 epoch: 64, train_loss: 0.8121, test_loss: 0.8506, test_f1: 0.6300
 epoch: 65, train_loss: 0.8011, test_loss: 0.8510, test_f1: 0.5791
 epoch: 66, train_loss: 0.8034, test_loss: 0.8781, test_f1: 0.6267
 epoch: 67, train_loss: 0.7876, test_loss: 0.8397, test_f1: 0.6210
 epoch: 68, train_loss: 0.7860, test_loss: 0.8890, test_f1: 0.5183
 epoch: 69, train_loss: 0.7865, test_loss: 0.8792, test_f1: 0.6038
 epoch: 70, train_loss: 0.7865, test_loss: 0.8995, test_f1: 0.6181
 epoch: 71, train_loss: 0.7820, test_loss: 0.8666, test_f1: 0.5482
 epoch: 72, train_loss: 0.7925, test_loss: 0.8747, test_f1: 0.5260
 epoch: 73, train_loss: 0.7815, test_loss: 0.8898, test_f1: 0.5196
 epoch: 74, train_loss: 0.7927, test_loss: 0.8888, test_f1: 0.5405
 epoch: 75, train_loss: 0.7727, test_loss: 0.8769, test_f1: 0.5733
 epoch: 76, train_loss: 0.7813, test_loss: 0.9033, test_f1: 0.5472
 epoch: 77, train_loss: 0.7760, test_loss: 0.8848, test_f1: 0.5547
 epoch: 78, train_loss: 0.7737, test_loss: 0.8485, test_f1: 0.5411
 epoch: 79, train_loss: 0.7763, test_loss: 0.8639, test_f1: 0.5919
 epoch: 80, train_loss: 0.7769, test_loss: 0.8589, test_f1: 0.5687
 epoch: 81, train_loss: 0.7851, test_loss: 0.9038, test_f1: 0.5537
 epoch: 82, train_loss: 0.7797, test_loss: 0.8499, test_f1: 0.6045
 epoch: 83, train_loss: 0.7872, test_loss: 0.8683, test_f1: 0.5445
 epoch: 84, train_loss: 0.7720, test_loss: 0.8366, test_f1: 0.5858
 epoch: 85, train_loss: 0.7890, test_loss: 0.8421, test_f1: 0.5581
 epoch: 86, train_loss: 0.7796, test_loss: 0.8617, test_f1: 0.6122
 epoch: 87, train_loss: 0.7750, test_loss: 0.9103, test_f1: 0.5045
 epoch: 88, train_loss: 0.7684, test_loss: 0.8604, test_f1: 0.5655
 epoch: 89, train_loss: 0.7625, test_loss: 0.8746, test_f1: 0.5962
 epoch: 90, train_loss: 0.7675, test_loss: 0.8671, test_f1: 0.5597
 epoch: 91, train_loss: 0.7638, test_loss: 0.8933, test_f1: 0.5389
 epoch: 92, train_loss: 0.7707, test_loss: 0.8934, test_f1: 0.6216
 epoch: 93, train_loss: 0.7731, test_loss: 0.8649, test_f1: 0.5986
 epoch: 94, train_loss: 0.7609, test_loss: 0.8538, test_f1: 0.5979
 epoch: 95, train_loss: 0.7623, test_loss: 0.8486, test_f1: 0.5857
 epoch: 96, train_loss: 0.7636, test_loss: 0.8629, test_f1: 0.6116
 epoch: 97, train_loss: 0.7605, test_loss: 0.8560, test_f1: 0.5897
 epoch: 98, train_loss: 0.7649, test_loss: 0.8346, test_f1: 0.5638
 epoch: 99, train_loss: 0.7537, test_loss: 0.8509, test_f1: 0.5845

Training completed in 675.81 seconds
Best F1: 0.6503 at epoch 94
Mean F1 across iterations: 0.6224  0.0190
========================FINAL RESULTS================================
FEGIN weighted F1: 0.6503  0.0190
python main.py --data ltspice_examples --representation component_net --model FEGIN --layers 4 --hiddens 16 --batch_size 64 --lr 0.01 --emb_size 250 --epochs 100 --save_appendix component_net_L4_H16_BS64_LR0.01_E250 --no_val
-----



STDERR:
  File "main.py", line 370, in <module>
    main()
  File "main.py", line 254, in main
    dataset = dataset_class(
  File "/home/philip/projects/ltspice_examples_code_repo/Circuit-Completion-Using-GNNs/component_classification_with_link_prediction_head/evaluation/FEGIN/kernel/circuit_datasets.py", line 15, in __init__
    self.data, self.slices = torch.load(self.processed_paths[0])
  File "/home/philip/.local/lib/python3.8/site-packages/torch/serialization.py", line 1040, in load
    warnings.warn(
  File "/usr/lib/python3.8/warnings.py", line 109, in _showwarnmsg
    sw(msg.message, msg.category, msg.filename, msg.lineno,
  File "main.py", line 47, in warn_with_traceback
    traceback.print_stack(file=log)
/home/philip/projects/ltspice_examples_code_repo/Circuit-Completion-Using-GNNs/component_classification_with_link_prediction_head/evaluation/FEGIN/kernel/circuit_datasets.py:15: FutureWarning: You are using `torch.load` with `weights_only=False` (the current default value), which uses the default pickle module implicitly. It is possible to construct malicious pickle data which will execute arbitrary code during unpickling (See https://github.com/pytorch/pytorch/blob/main/SECURITY.md#untrusted-models for more details). In a future release, the default value for `weights_only` will be flipped to `True`. This limits the functions that could be executed during unpickling. Arbitrary objects will no longer be allowed to be loaded via this mode unless they are explicitly allowlisted by the user via `torch.serialization.add_safe_globals`. We recommend you start setting `weights_only=True` for any use case where you don't have full control of the loaded file. Please open an issue on GitHub for any issues related to this experimental feature.
  self.data, self.slices = torch.load(self.processed_paths[0])
