STDOUT:
Results will be saved in /home/philip/projects/ltspice_examples_code_repo/Circuit-Completion-Using-GNNs/component_classification_with_link_prediction_head/evaluation/FEGIN/results/model_FEGIN_dataset_ltspice_demos
Command line input: python main.py --data ltspice_demos --representation component_component --model FEGIN --layers 5 --hiddens 128 --batch_size 256 --lr 0.001 --emb_size 512 --epochs 100 --save_appendix component_component_L5_H128_BS256_LR0.001_E512 --no_val
 is saved.
-----
ltspice_demos - FEGIN
Using 5 layers, 128 hidden units, h = 2
Loading component_component representation dataset
ENTERED
Training FEGIN on component_component representation
Train: 1565, Test: 383
##################ITERATION #0 ****************************************
 epoch: 0, train_loss: 1.3417, test_loss: 1.3405, test_f1: 0.1432
 epoch: 1, train_loss: 1.2096, test_loss: 1.3067, test_f1: 0.3404
 epoch: 2, train_loss: 1.1719, test_loss: 1.2964, test_f1: 0.3588
 epoch: 3, train_loss: 1.1226, test_loss: 1.2572, test_f1: 0.3519
 epoch: 4, train_loss: 1.0832, test_loss: 1.3286, test_f1: 0.3477
 epoch: 5, train_loss: 1.0526, test_loss: 1.3120, test_f1: 0.3502
 epoch: 6, train_loss: 1.0170, test_loss: 1.2637, test_f1: 0.3405
 epoch: 7, train_loss: 0.9768, test_loss: 1.1480, test_f1: 0.4795
 epoch: 8, train_loss: 0.9636, test_loss: 1.1578, test_f1: 0.4642
 epoch: 9, train_loss: 0.9362, test_loss: 1.2174, test_f1: 0.4150
 epoch: 10, train_loss: 0.9254, test_loss: 1.2427, test_f1: 0.4419
 epoch: 11, train_loss: 0.9176, test_loss: 1.1444, test_f1: 0.5322
 epoch: 12, train_loss: 0.8753, test_loss: 1.2229, test_f1: 0.4293
 epoch: 13, train_loss: 0.8458, test_loss: 1.2413, test_f1: 0.4312
 epoch: 14, train_loss: 0.8347, test_loss: 1.2560, test_f1: 0.4681
 epoch: 15, train_loss: 0.8380, test_loss: 1.2012, test_f1: 0.5112
 epoch: 16, train_loss: 0.7807, test_loss: 1.1747, test_f1: 0.5634
 epoch: 17, train_loss: 0.7550, test_loss: 1.2235, test_f1: 0.5487
 epoch: 18, train_loss: 0.7453, test_loss: 1.3110, test_f1: 0.5347
 epoch: 19, train_loss: 0.7359, test_loss: 1.4163, test_f1: 0.4564
 epoch: 20, train_loss: 0.7488, test_loss: 1.5202, test_f1: 0.5600
 epoch: 21, train_loss: 0.7576, test_loss: 1.4874, test_f1: 0.5207
 epoch: 22, train_loss: 0.7386, test_loss: 1.5100, test_f1: 0.4839
 epoch: 23, train_loss: 0.7248, test_loss: 1.4130, test_f1: 0.5405
 epoch: 24, train_loss: 0.7069, test_loss: 1.2824, test_f1: 0.5394
 epoch: 25, train_loss: 0.6844, test_loss: 1.2838, test_f1: 0.4848
 epoch: 26, train_loss: 0.6567, test_loss: 1.3150, test_f1: 0.5335
 epoch: 27, train_loss: 0.6662, test_loss: 1.3878, test_f1: 0.5485
 epoch: 28, train_loss: 0.6459, test_loss: 1.4782, test_f1: 0.5313
 epoch: 29, train_loss: 0.6575, test_loss: 1.3952, test_f1: 0.5303
 epoch: 30, train_loss: 0.6370, test_loss: 1.6273, test_f1: 0.5430
 epoch: 31, train_loss: 0.6702, test_loss: 1.5187, test_f1: 0.5741
 epoch: 32, train_loss: 0.6531, test_loss: 1.3823, test_f1: 0.5571
 epoch: 33, train_loss: 0.6273, test_loss: 1.3291, test_f1: 0.5629
 epoch: 34, train_loss: 0.6271, test_loss: 1.4125, test_f1: 0.5347
 epoch: 35, train_loss: 0.5885, test_loss: 1.4682, test_f1: 0.5957
 epoch: 36, train_loss: 0.5661, test_loss: 1.4336, test_f1: 0.6017
 epoch: 37, train_loss: 0.5924, test_loss: 1.4229, test_f1: 0.5745
 epoch: 38, train_loss: 0.5953, test_loss: 1.5474, test_f1: 0.5010
 epoch: 39, train_loss: 0.5765, test_loss: 1.5366, test_f1: 0.5438
 epoch: 40, train_loss: 0.5904, test_loss: 1.5116, test_f1: 0.5431
 epoch: 41, train_loss: 0.5657, test_loss: 1.4430, test_f1: 0.5890
 epoch: 42, train_loss: 0.5471, test_loss: 1.5937, test_f1: 0.5672
 epoch: 43, train_loss: 0.5339, test_loss: 1.5895, test_f1: 0.5352
 epoch: 44, train_loss: 0.5121, test_loss: 1.6036, test_f1: 0.5158
 epoch: 45, train_loss: 0.5425, test_loss: 1.5537, test_f1: 0.5567
 epoch: 46, train_loss: 0.5405, test_loss: 1.7518, test_f1: 0.5404
 epoch: 47, train_loss: 0.5254, test_loss: 1.6020, test_f1: 0.5314
 epoch: 48, train_loss: 0.5153, test_loss: 1.8277, test_f1: 0.5029
 epoch: 49, train_loss: 0.4947, test_loss: 2.1696, test_f1: 0.4669
 epoch: 50, train_loss: 0.4811, test_loss: 2.2959, test_f1: 0.5028
 epoch: 51, train_loss: 0.4333, test_loss: 1.9655, test_f1: 0.5394
 epoch: 52, train_loss: 0.4293, test_loss: 1.8107, test_f1: 0.5634
 epoch: 53, train_loss: 0.4165, test_loss: 1.7912, test_f1: 0.5748
 epoch: 54, train_loss: 0.4349, test_loss: 1.9848, test_f1: 0.5741
 epoch: 55, train_loss: 0.4127, test_loss: 2.1427, test_f1: 0.5238
 epoch: 56, train_loss: 0.3892, test_loss: 2.0645, test_f1: 0.5337
 epoch: 57, train_loss: 0.3700, test_loss: 2.0000, test_f1: 0.5415
 epoch: 58, train_loss: 0.3929, test_loss: 2.0928, test_f1: 0.5682
 epoch: 59, train_loss: 0.3837, test_loss: 2.4322, test_f1: 0.5345
 epoch: 60, train_loss: 0.3804, test_loss: 2.5681, test_f1: 0.5765
 epoch: 61, train_loss: 0.3665, test_loss: 2.3835, test_f1: 0.5867
 epoch: 62, train_loss: 0.3697, test_loss: 2.1191, test_f1: 0.5342
 epoch: 63, train_loss: 0.3712, test_loss: 2.0708, test_f1: 0.4975
 epoch: 64, train_loss: 0.4058, test_loss: 1.8611, test_f1: 0.5443
 epoch: 65, train_loss: 0.4040, test_loss: 1.9479, test_f1: 0.4910
 epoch: 66, train_loss: 0.4393, test_loss: 1.8781, test_f1: 0.5165
 epoch: 67, train_loss: 0.4439, test_loss: 1.9666, test_f1: 0.5007
 epoch: 68, train_loss: 0.4205, test_loss: 1.9506, test_f1: 0.5233
 epoch: 69, train_loss: 0.4096, test_loss: 1.7884, test_f1: 0.5340
 epoch: 70, train_loss: 0.3946, test_loss: 1.8151, test_f1: 0.5729
 epoch: 71, train_loss: 0.3912, test_loss: 1.7450, test_f1: 0.5722
 epoch: 72, train_loss: 0.3715, test_loss: 1.8443, test_f1: 0.5460
 epoch: 73, train_loss: 0.3516, test_loss: 1.8460, test_f1: 0.5390
 epoch: 74, train_loss: 0.3387, test_loss: 1.9638, test_f1: 0.5368
 epoch: 75, train_loss: 0.3559, test_loss: 1.9316, test_f1: 0.5153
 epoch: 76, train_loss: 0.3711, test_loss: 1.9516, test_f1: 0.5574
 epoch: 77, train_loss: 0.3527, test_loss: 1.9715, test_f1: 0.5529
 epoch: 78, train_loss: 0.3403, test_loss: 1.9708, test_f1: 0.5664
 epoch: 79, train_loss: 0.3401, test_loss: 2.0677, test_f1: 0.5585
 epoch: 80, train_loss: 0.3484, test_loss: 1.9989, test_f1: 0.5587
 epoch: 81, train_loss: 0.3290, test_loss: 2.0191, test_f1: 0.5561
 epoch: 82, train_loss: 0.3277, test_loss: 2.2685, test_f1: 0.5294
 epoch: 83, train_loss: 0.3819, test_loss: 2.1347, test_f1: 0.5475
 epoch: 84, train_loss: 0.3283, test_loss: 2.0769, test_f1: 0.5458
 epoch: 85, train_loss: 0.3383, test_loss: 2.2104, test_f1: 0.5343
 epoch: 86, train_loss: 0.3105, test_loss: 2.1089, test_f1: 0.5469
 epoch: 87, train_loss: 0.3124, test_loss: 2.0955, test_f1: 0.5427
 epoch: 88, train_loss: 0.2943, test_loss: 2.1405, test_f1: 0.5384
 epoch: 89, train_loss: 0.2830, test_loss: 2.1617, test_f1: 0.5425
 epoch: 90, train_loss: 0.2725, test_loss: 2.1640, test_f1: 0.5516
 epoch: 91, train_loss: 0.2944, test_loss: 2.2269, test_f1: 0.5455
 epoch: 92, train_loss: 0.2937, test_loss: 2.2289, test_f1: 0.5600
 epoch: 93, train_loss: 0.2912, test_loss: 2.1606, test_f1: 0.5478
 epoch: 94, train_loss: 0.3049, test_loss: 2.4681, test_f1: 0.5372
 epoch: 95, train_loss: 0.2932, test_loss: 2.3414, test_f1: 0.4999
 epoch: 96, train_loss: 0.3111, test_loss: 2.2716, test_f1: 0.4678
 epoch: 97, train_loss: 0.3034, test_loss: 2.1501, test_f1: 0.5175
 epoch: 98, train_loss: 0.2926, test_loss: 2.2033, test_f1: 0.5530
 epoch: 99, train_loss: 0.3346, test_loss: 2.3333, test_f1: 0.5530
##################ITERATION #1 ****************************************
 epoch: 0, train_loss: 1.2538, test_loss: 1.3188, test_f1: 0.3217
 epoch: 1, train_loss: 1.1219, test_loss: 1.2764, test_f1: 0.3399
 epoch: 2, train_loss: 1.0689, test_loss: 1.2203, test_f1: 0.3567
 epoch: 3, train_loss: 1.0108, test_loss: 1.2051, test_f1: 0.3806
 epoch: 4, train_loss: 0.9692, test_loss: 1.1746, test_f1: 0.4059
 epoch: 5, train_loss: 0.9133, test_loss: 1.1821, test_f1: 0.5081
 epoch: 6, train_loss: 0.8847, test_loss: 1.2134, test_f1: 0.5308
 epoch: 7, train_loss: 0.8776, test_loss: 1.1899, test_f1: 0.5123
 epoch: 8, train_loss: 0.8371, test_loss: 1.1340, test_f1: 0.5228
 epoch: 9, train_loss: 0.7952, test_loss: 1.2151, test_f1: 0.4702
 epoch: 10, train_loss: 0.7831, test_loss: 1.2624, test_f1: 0.4995
 epoch: 11, train_loss: 0.7815, test_loss: 1.3420, test_f1: 0.5507
 epoch: 12, train_loss: 0.7719, test_loss: 1.4048, test_f1: 0.5097
 epoch: 13, train_loss: 0.7681, test_loss: 1.4125, test_f1: 0.6077
 epoch: 14, train_loss: 0.7542, test_loss: 1.3218, test_f1: 0.5245
 epoch: 15, train_loss: 0.7604, test_loss: 1.3327, test_f1: 0.5509
 epoch: 16, train_loss: 0.7368, test_loss: 1.3290, test_f1: 0.5781
 epoch: 17, train_loss: 0.6918, test_loss: 1.4964, test_f1: 0.5808
 epoch: 18, train_loss: 0.6763, test_loss: 1.3858, test_f1: 0.5616
 epoch: 19, train_loss: 0.6329, test_loss: 1.3275, test_f1: 0.5906
 epoch: 20, train_loss: 0.6513, test_loss: 1.3505, test_f1: 0.6144
 epoch: 21, train_loss: 0.6806, test_loss: 1.5014, test_f1: 0.5921
 epoch: 22, train_loss: 0.6179, test_loss: 1.7665, test_f1: 0.5729
 epoch: 23, train_loss: 0.6212, test_loss: 1.6697, test_f1: 0.5897
 epoch: 24, train_loss: 0.5866, test_loss: 1.5867, test_f1: 0.5545
 epoch: 25, train_loss: 0.5622, test_loss: 1.6949, test_f1: 0.5513
 epoch: 26, train_loss: 0.5806, test_loss: 1.7582, test_f1: 0.5632
 epoch: 27, train_loss: 0.5747, test_loss: 1.8182, test_f1: 0.5692
 epoch: 28, train_loss: 0.5997, test_loss: 1.8696, test_f1: 0.5691
 epoch: 29, train_loss: 0.5826, test_loss: 1.4938, test_f1: 0.5362
 epoch: 30, train_loss: 0.6041, test_loss: 1.4789, test_f1: 0.5872
 epoch: 31, train_loss: 0.6270, test_loss: 1.9955, test_f1: 0.5263
 epoch: 32, train_loss: 0.5996, test_loss: 2.0061, test_f1: 0.6134
 epoch: 33, train_loss: 0.5446, test_loss: 2.1852, test_f1: 0.5674
 epoch: 34, train_loss: 0.5233, test_loss: 2.7049, test_f1: 0.5659
 epoch: 35, train_loss: 0.5135, test_loss: 2.7502, test_f1: 0.5665
 epoch: 36, train_loss: 0.4843, test_loss: 2.2008, test_f1: 0.5720
 epoch: 37, train_loss: 0.5119, test_loss: 2.1519, test_f1: 0.4983
 epoch: 38, train_loss: 0.4970, test_loss: 2.3577, test_f1: 0.5348
 epoch: 39, train_loss: 0.5616, test_loss: 1.9812, test_f1: 0.5548
 epoch: 40, train_loss: 0.5516, test_loss: 2.5401, test_f1: 0.5586
 epoch: 41, train_loss: 0.5176, test_loss: 2.4026, test_f1: 0.5534
 epoch: 42, train_loss: 0.5084, test_loss: 1.9787, test_f1: 0.5774
 epoch: 43, train_loss: 0.5026, test_loss: 1.6159, test_f1: 0.5863
 epoch: 44, train_loss: 0.4982, test_loss: 2.0188, test_f1: 0.5555
 epoch: 45, train_loss: 0.4788, test_loss: 2.4579, test_f1: 0.5399
 epoch: 46, train_loss: 0.4540, test_loss: 1.9454, test_f1: 0.5543
 epoch: 47, train_loss: 0.4780, test_loss: 1.7021, test_f1: 0.5139
 epoch: 48, train_loss: 0.4596, test_loss: 1.8706, test_f1: 0.5378
 epoch: 49, train_loss: 0.4352, test_loss: 1.6794, test_f1: 0.5887
 epoch: 50, train_loss: 0.4414, test_loss: 1.8220, test_f1: 0.5793
 epoch: 51, train_loss: 0.4355, test_loss: 1.6404, test_f1: 0.5778
 epoch: 52, train_loss: 0.3964, test_loss: 1.9144, test_f1: 0.5566
 epoch: 53, train_loss: 0.4115, test_loss: 1.8951, test_f1: 0.5768
 epoch: 54, train_loss: 0.3767, test_loss: 1.9859, test_f1: 0.5760
 epoch: 55, train_loss: 0.3829, test_loss: 2.0534, test_f1: 0.5567
 epoch: 56, train_loss: 0.3768, test_loss: 1.9419, test_f1: 0.5670
 epoch: 57, train_loss: 0.3373, test_loss: 2.1261, test_f1: 0.5600
 epoch: 58, train_loss: 0.3458, test_loss: 2.2647, test_f1: 0.5621
 epoch: 59, train_loss: 0.3353, test_loss: 1.9854, test_f1: 0.5908
 epoch: 60, train_loss: 0.3398, test_loss: 1.9111, test_f1: 0.5823
 epoch: 61, train_loss: 0.3154, test_loss: 1.9492, test_f1: 0.5881
 epoch: 62, train_loss: 0.3074, test_loss: 2.1521, test_f1: 0.5410
 epoch: 63, train_loss: 0.3078, test_loss: 2.2251, test_f1: 0.5395
 epoch: 64, train_loss: 0.3202, test_loss: 2.1674, test_f1: 0.5769
 epoch: 65, train_loss: 0.3642, test_loss: 2.1516, test_f1: 0.5825
 epoch: 66, train_loss: 0.3388, test_loss: 2.0845, test_f1: 0.5705
 epoch: 67, train_loss: 0.3478, test_loss: 1.9844, test_f1: 0.5814
 epoch: 68, train_loss: 0.3590, test_loss: 1.7856, test_f1: 0.5988
 epoch: 69, train_loss: 0.3516, test_loss: 2.1585, test_f1: 0.5801
 epoch: 70, train_loss: 0.3419, test_loss: 2.1728, test_f1: 0.5205
 epoch: 71, train_loss: 0.3151, test_loss: 2.2461, test_f1: 0.5621
 epoch: 72, train_loss: 0.3238, test_loss: 2.1225, test_f1: 0.5495
 epoch: 73, train_loss: 0.3173, test_loss: 2.0530, test_f1: 0.5646
 epoch: 74, train_loss: 0.3281, test_loss: 2.0059, test_f1: 0.5571
 epoch: 75, train_loss: 0.3637, test_loss: 1.9941, test_f1: 0.5171
 epoch: 76, train_loss: 0.3679, test_loss: 1.9607, test_f1: 0.5354
 epoch: 77, train_loss: 0.3505, test_loss: 1.9100, test_f1: 0.5791
 epoch: 78, train_loss: 0.3469, test_loss: 1.9915, test_f1: 0.5802
 epoch: 79, train_loss: 0.3129, test_loss: 2.0507, test_f1: 0.5538
 epoch: 80, train_loss: 0.3467, test_loss: 1.9481, test_f1: 0.5829
 epoch: 81, train_loss: 0.3020, test_loss: 1.8866, test_f1: 0.5888
 epoch: 82, train_loss: 0.3164, test_loss: 2.1326, test_f1: 0.5783
 epoch: 83, train_loss: 0.3115, test_loss: 2.0814, test_f1: 0.5872
 epoch: 84, train_loss: 0.3353, test_loss: 2.1380, test_f1: 0.5783
 epoch: 85, train_loss: 0.3139, test_loss: 2.1745, test_f1: 0.5572
 epoch: 86, train_loss: 0.3102, test_loss: 2.1025, test_f1: 0.5732
 epoch: 87, train_loss: 0.2885, test_loss: 2.3297, test_f1: 0.5715
 epoch: 88, train_loss: 0.2825, test_loss: 2.2955, test_f1: 0.5657
 epoch: 89, train_loss: 0.2924, test_loss: 2.2735, test_f1: 0.5652
 epoch: 90, train_loss: 0.2846, test_loss: 2.1943, test_f1: 0.5888
 epoch: 91, train_loss: 0.2668, test_loss: 2.3359, test_f1: 0.5775
 epoch: 92, train_loss: 0.2620, test_loss: 2.3109, test_f1: 0.5824
 epoch: 93, train_loss: 0.2800, test_loss: 2.1421, test_f1: 0.5957
 epoch: 94, train_loss: 0.2714, test_loss: 2.3128, test_f1: 0.5766
 epoch: 95, train_loss: 0.2712, test_loss: 2.4194, test_f1: 0.5620
 epoch: 96, train_loss: 0.2604, test_loss: 2.2765, test_f1: 0.5769
 epoch: 97, train_loss: 0.2570, test_loss: 2.6737, test_f1: 0.5616
 epoch: 98, train_loss: 0.2862, test_loss: 2.4963, test_f1: 0.5753
 epoch: 99, train_loss: 0.2743, test_loss: 2.3123, test_f1: 0.5409
##################ITERATION #2 ****************************************
 epoch: 0, train_loss: 1.2477, test_loss: 1.3557, test_f1: 0.1654
 epoch: 1, train_loss: 1.1156, test_loss: 1.3045, test_f1: 0.2554
 epoch: 2, train_loss: 1.0558, test_loss: 1.2496, test_f1: 0.4114
 epoch: 3, train_loss: 1.0059, test_loss: 1.2112, test_f1: 0.4697
 epoch: 4, train_loss: 0.9768, test_loss: 1.1809, test_f1: 0.5156
 epoch: 5, train_loss: 0.9284, test_loss: 1.1778, test_f1: 0.5018
 epoch: 6, train_loss: 0.9050, test_loss: 1.1591, test_f1: 0.5520
 epoch: 7, train_loss: 0.8737, test_loss: 1.1361, test_f1: 0.5711
 epoch: 8, train_loss: 0.8393, test_loss: 1.2732, test_f1: 0.4372
 epoch: 9, train_loss: 0.8113, test_loss: 1.1464, test_f1: 0.5358
 epoch: 10, train_loss: 0.7938, test_loss: 1.2570, test_f1: 0.4972
 epoch: 11, train_loss: 0.7848, test_loss: 1.2269, test_f1: 0.5685
 epoch: 12, train_loss: 0.7707, test_loss: 1.2431, test_f1: 0.5480
 epoch: 13, train_loss: 0.7495, test_loss: 1.4831, test_f1: 0.5429
 epoch: 14, train_loss: 0.7806, test_loss: 1.5442, test_f1: 0.4776
 epoch: 15, train_loss: 0.7461, test_loss: 1.7439, test_f1: 0.5254
 epoch: 16, train_loss: 0.7297, test_loss: 1.6480, test_f1: 0.5252
 epoch: 17, train_loss: 0.7126, test_loss: 1.2711, test_f1: 0.5537
 epoch: 18, train_loss: 0.7168, test_loss: 1.0684, test_f1: 0.5724
 epoch: 19, train_loss: 0.7042, test_loss: 1.3998, test_f1: 0.5555
 epoch: 20, train_loss: 0.6751, test_loss: 1.2509, test_f1: 0.5951
 epoch: 21, train_loss: 0.6579, test_loss: 1.4201, test_f1: 0.5333
 epoch: 22, train_loss: 0.6336, test_loss: 1.6073, test_f1: 0.5178
 epoch: 23, train_loss: 0.6363, test_loss: 1.7442, test_f1: 0.5461
 epoch: 24, train_loss: 0.6214, test_loss: 1.5496, test_f1: 0.5662
 epoch: 25, train_loss: 0.6136, test_loss: 1.8447, test_f1: 0.5407
 epoch: 26, train_loss: 0.6337, test_loss: 1.7960, test_f1: 0.5346
 epoch: 27, train_loss: 0.6422, test_loss: 1.8619, test_f1: 0.5372
 epoch: 28, train_loss: 0.6133, test_loss: 1.5396, test_f1: 0.5395
 epoch: 29, train_loss: 0.6031, test_loss: 1.5738, test_f1: 0.5731
 epoch: 30, train_loss: 0.5822, test_loss: 1.7009, test_f1: 0.5312
 epoch: 31, train_loss: 0.5686, test_loss: 1.6636, test_f1: 0.5366
 epoch: 32, train_loss: 0.5886, test_loss: 1.7996, test_f1: 0.5358
 epoch: 33, train_loss: 0.5619, test_loss: 2.0125, test_f1: 0.5245
 epoch: 34, train_loss: 0.5616, test_loss: 1.7877, test_f1: 0.5622
 epoch: 35, train_loss: 0.5668, test_loss: 1.6709, test_f1: 0.5735
 epoch: 36, train_loss: 0.5787, test_loss: 1.7345, test_f1: 0.5031
 epoch: 37, train_loss: 0.5774, test_loss: 1.7076, test_f1: 0.5383
 epoch: 38, train_loss: 0.5768, test_loss: 1.4727, test_f1: 0.6000
 epoch: 39, train_loss: 0.5796, test_loss: 1.6984, test_f1: 0.5558
 epoch: 40, train_loss: 0.5648, test_loss: 1.6679, test_f1: 0.5234
 epoch: 41, train_loss: 0.5666, test_loss: 1.5831, test_f1: 0.5525
 epoch: 42, train_loss: 0.5743, test_loss: 1.4799, test_f1: 0.5581
 epoch: 43, train_loss: 0.5644, test_loss: 1.4323, test_f1: 0.5988
 epoch: 44, train_loss: 0.5356, test_loss: 1.9094, test_f1: 0.5501
 epoch: 45, train_loss: 0.4933, test_loss: 1.7565, test_f1: 0.5550
 epoch: 46, train_loss: 0.5008, test_loss: 1.6107, test_f1: 0.5452
 epoch: 47, train_loss: 0.5023, test_loss: 1.7673, test_f1: 0.5668
 epoch: 48, train_loss: 0.5142, test_loss: 1.5745, test_f1: 0.5884
 epoch: 49, train_loss: 0.5341, test_loss: 1.8953, test_f1: 0.5236
 epoch: 50, train_loss: 0.5183, test_loss: 1.8996, test_f1: 0.5260
 epoch: 51, train_loss: 0.4688, test_loss: 1.7756, test_f1: 0.5384
 epoch: 52, train_loss: 0.4487, test_loss: 1.7157, test_f1: 0.5562
 epoch: 53, train_loss: 0.4314, test_loss: 1.5684, test_f1: 0.6027
 epoch: 54, train_loss: 0.3952, test_loss: 1.4887, test_f1: 0.6054
 epoch: 55, train_loss: 0.3974, test_loss: 1.5687, test_f1: 0.5873
 epoch: 56, train_loss: 0.4043, test_loss: 1.6728, test_f1: 0.5564
 epoch: 57, train_loss: 0.3952, test_loss: 1.6304, test_f1: 0.5799
 epoch: 58, train_loss: 0.3904, test_loss: 1.5339, test_f1: 0.5981
 epoch: 59, train_loss: 0.3734, test_loss: 1.5691, test_f1: 0.5765
 epoch: 60, train_loss: 0.3698, test_loss: 1.7333, test_f1: 0.5598
 epoch: 61, train_loss: 0.3789, test_loss: 1.8774, test_f1: 0.5318
 epoch: 62, train_loss: 0.3908, test_loss: 1.8572, test_f1: 0.5360
 epoch: 63, train_loss: 0.3852, test_loss: 1.7564, test_f1: 0.5754
 epoch: 64, train_loss: 0.4000, test_loss: 1.8002, test_f1: 0.5819
 epoch: 65, train_loss: 0.4002, test_loss: 1.8967, test_f1: 0.5704
 epoch: 66, train_loss: 0.4028, test_loss: 1.9237, test_f1: 0.5502
 epoch: 67, train_loss: 0.3602, test_loss: 2.1328, test_f1: 0.5499
 epoch: 68, train_loss: 0.3899, test_loss: 2.1452, test_f1: 0.5343
 epoch: 69, train_loss: 0.4051, test_loss: 1.8162, test_f1: 0.5558
 epoch: 70, train_loss: 0.3534, test_loss: 1.6414, test_f1: 0.5912
 epoch: 71, train_loss: 0.3488, test_loss: 1.6911, test_f1: 0.5983
 epoch: 72, train_loss: 0.3421, test_loss: 2.0165, test_f1: 0.5539
 epoch: 73, train_loss: 0.3542, test_loss: 2.1034, test_f1: 0.5511
 epoch: 74, train_loss: 0.3427, test_loss: 1.9684, test_f1: 0.5699
 epoch: 75, train_loss: 0.3237, test_loss: 1.9840, test_f1: 0.5838
 epoch: 76, train_loss: 0.3751, test_loss: 1.9536, test_f1: 0.5745
 epoch: 77, train_loss: 0.3506, test_loss: 2.2885, test_f1: 0.5363
 epoch: 78, train_loss: 0.3407, test_loss: 2.1464, test_f1: 0.5665
 epoch: 79, train_loss: 0.3646, test_loss: 2.2134, test_f1: 0.5770
 epoch: 80, train_loss: 0.3480, test_loss: 2.1934, test_f1: 0.5611
 epoch: 81, train_loss: 0.3426, test_loss: 2.1715, test_f1: 0.5639
 epoch: 82, train_loss: 0.3303, test_loss: 2.1176, test_f1: 0.5542
 epoch: 83, train_loss: 0.2900, test_loss: 2.1596, test_f1: 0.5569
 epoch: 84, train_loss: 0.3108, test_loss: 2.2526, test_f1: 0.5435
 epoch: 85, train_loss: 0.3093, test_loss: 2.3678, test_f1: 0.5710
 epoch: 86, train_loss: 0.3012, test_loss: 2.5624, test_f1: 0.5566
 epoch: 87, train_loss: 0.3079, test_loss: 2.4735, test_f1: 0.5590
 epoch: 88, train_loss: 0.2996, test_loss: 2.3958, test_f1: 0.5745
 epoch: 89, train_loss: 0.3100, test_loss: 2.3920, test_f1: 0.5715
 epoch: 90, train_loss: 0.3098, test_loss: 2.2286, test_f1: 0.5406
 epoch: 91, train_loss: 0.3073, test_loss: 2.2884, test_f1: 0.5700
 epoch: 92, train_loss: 0.3083, test_loss: 2.3937, test_f1: 0.5760
 epoch: 93, train_loss: 0.3388, test_loss: 2.8031, test_f1: 0.5547
 epoch: 94, train_loss: 0.3298, test_loss: 2.7091, test_f1: 0.5522
 epoch: 95, train_loss: 0.3218, test_loss: 2.5090, test_f1: 0.5366
 epoch: 96, train_loss: 0.3083, test_loss: 2.3214, test_f1: 0.5611
 epoch: 97, train_loss: 0.3056, test_loss: 2.4951, test_f1: 0.5449
 epoch: 98, train_loss: 0.2896, test_loss: 2.5280, test_f1: 0.5377
 epoch: 99, train_loss: 0.2973, test_loss: 2.3765, test_f1: 0.5206
##################ITERATION #3 ****************************************
 epoch: 0, train_loss: 1.2218, test_loss: 1.2984, test_f1: 0.1970
 epoch: 1, train_loss: 1.0962, test_loss: 1.2952, test_f1: 0.3004
 epoch: 2, train_loss: 1.0290, test_loss: 1.2432, test_f1: 0.3363
 epoch: 3, train_loss: 1.0000, test_loss: 1.2187, test_f1: 0.3986
 epoch: 4, train_loss: 0.9516, test_loss: 1.1944, test_f1: 0.4487
 epoch: 5, train_loss: 0.9106, test_loss: 1.1424, test_f1: 0.5276
 epoch: 6, train_loss: 0.8773, test_loss: 1.1373, test_f1: 0.5001
 epoch: 7, train_loss: 0.8571, test_loss: 1.1318, test_f1: 0.5102
 epoch: 8, train_loss: 0.8363, test_loss: 1.0959, test_f1: 0.5789
 epoch: 9, train_loss: 0.8133, test_loss: 1.1215, test_f1: 0.5620
 epoch: 10, train_loss: 0.7782, test_loss: 1.0889, test_f1: 0.5717
 epoch: 11, train_loss: 0.7851, test_loss: 1.1902, test_f1: 0.5192
 epoch: 12, train_loss: 0.7820, test_loss: 1.4830, test_f1: 0.4958
 epoch: 13, train_loss: 0.7745, test_loss: 1.3386, test_f1: 0.5396
 epoch: 14, train_loss: 0.7632, test_loss: 1.3496, test_f1: 0.5562
 epoch: 15, train_loss: 0.7479, test_loss: 1.2437, test_f1: 0.5733
 epoch: 16, train_loss: 0.7321, test_loss: 1.3687, test_f1: 0.5645
 epoch: 17, train_loss: 0.6980, test_loss: 1.2685, test_f1: 0.5502
 epoch: 18, train_loss: 0.6837, test_loss: 1.2858, test_f1: 0.5918
 epoch: 19, train_loss: 0.6851, test_loss: 1.3456, test_f1: 0.5793
 epoch: 20, train_loss: 0.6983, test_loss: 1.2559, test_f1: 0.5950
 epoch: 21, train_loss: 0.6586, test_loss: 1.3668, test_f1: 0.5669
 epoch: 22, train_loss: 0.6374, test_loss: 1.4084, test_f1: 0.5342
 epoch: 23, train_loss: 0.6426, test_loss: 1.4369, test_f1: 0.5747
 epoch: 24, train_loss: 0.6050, test_loss: 1.4883, test_f1: 0.5583
 epoch: 25, train_loss: 0.6151, test_loss: 1.4012, test_f1: 0.5451
 epoch: 26, train_loss: 0.6427, test_loss: 1.3374, test_f1: 0.5495
 epoch: 27, train_loss: 0.6004, test_loss: 1.8758, test_f1: 0.4406
 epoch: 28, train_loss: 0.6257, test_loss: 1.5376, test_f1: 0.5320
 epoch: 29, train_loss: 0.5877, test_loss: 1.4125, test_f1: 0.5481
 epoch: 30, train_loss: 0.5425, test_loss: 1.7849, test_f1: 0.4967
 epoch: 31, train_loss: 0.5712, test_loss: 1.8727, test_f1: 0.5350
 epoch: 32, train_loss: 0.5808, test_loss: 1.5873, test_f1: 0.5526
 epoch: 33, train_loss: 0.5683, test_loss: 1.5915, test_f1: 0.5786
 epoch: 34, train_loss: 0.5950, test_loss: 1.5938, test_f1: 0.5580
 epoch: 35, train_loss: 0.5938, test_loss: 1.6273, test_f1: 0.5508
 epoch: 36, train_loss: 0.5700, test_loss: 1.6051, test_f1: 0.5076
 epoch: 37, train_loss: 0.5392, test_loss: 2.1353, test_f1: 0.4338
 epoch: 38, train_loss: 0.5757, test_loss: 2.3870, test_f1: 0.4761
 epoch: 39, train_loss: 0.5725, test_loss: 2.5156, test_f1: 0.5238
 epoch: 40, train_loss: 0.5918, test_loss: 1.9089, test_f1: 0.5693
 epoch: 41, train_loss: 0.5735, test_loss: 1.7806, test_f1: 0.5611
 epoch: 42, train_loss: 0.5868, test_loss: 1.8266, test_f1: 0.5603
 epoch: 43, train_loss: 0.5687, test_loss: 1.7044, test_f1: 0.5693
 epoch: 44, train_loss: 0.5578, test_loss: 1.5563, test_f1: 0.5945
 epoch: 45, train_loss: 0.4903, test_loss: 1.5209, test_f1: 0.5929
 epoch: 46, train_loss: 0.5243, test_loss: 1.7172, test_f1: 0.5816
 epoch: 47, train_loss: 0.4826, test_loss: 1.8072, test_f1: 0.5690
 epoch: 48, train_loss: 0.5052, test_loss: 1.7825, test_f1: 0.5545
 epoch: 49, train_loss: 0.4699, test_loss: 1.8327, test_f1: 0.5370
 epoch: 50, train_loss: 0.4577, test_loss: 1.6766, test_f1: 0.6055
 epoch: 51, train_loss: 0.4557, test_loss: 1.7029, test_f1: 0.6347
 epoch: 52, train_loss: 0.4447, test_loss: 1.8591, test_f1: 0.6079
 epoch: 53, train_loss: 0.4266, test_loss: 1.9432, test_f1: 0.5873
 epoch: 54, train_loss: 0.4267, test_loss: 1.9888, test_f1: 0.5809
 epoch: 55, train_loss: 0.3816, test_loss: 2.0313, test_f1: 0.5567
 epoch: 56, train_loss: 0.3862, test_loss: 2.1379, test_f1: 0.5654
 epoch: 57, train_loss: 0.3643, test_loss: 2.1235, test_f1: 0.5718
 epoch: 58, train_loss: 0.3610, test_loss: 2.1693, test_f1: 0.5596
 epoch: 59, train_loss: 0.3735, test_loss: 2.2650, test_f1: 0.5806
 epoch: 60, train_loss: 0.3500, test_loss: 2.1168, test_f1: 0.5906
 epoch: 61, train_loss: 0.3289, test_loss: 2.1328, test_f1: 0.5900
 epoch: 62, train_loss: 0.3206, test_loss: 2.2587, test_f1: 0.5516
 epoch: 63, train_loss: 0.3578, test_loss: 2.2543, test_f1: 0.5521
 epoch: 64, train_loss: 0.3510, test_loss: 2.3470, test_f1: 0.5518
 epoch: 65, train_loss: 0.3334, test_loss: 2.5319, test_f1: 0.5309
 epoch: 66, train_loss: 0.3358, test_loss: 2.4126, test_f1: 0.5292
 epoch: 67, train_loss: 0.3286, test_loss: 2.2375, test_f1: 0.5830
 epoch: 68, train_loss: 0.3202, test_loss: 2.1110, test_f1: 0.5785
 epoch: 69, train_loss: 0.3062, test_loss: 2.0933, test_f1: 0.5876
 epoch: 70, train_loss: 0.3082, test_loss: 2.3121, test_f1: 0.5880
 epoch: 71, train_loss: 0.3129, test_loss: 2.3241, test_f1: 0.6072
 epoch: 72, train_loss: 0.3289, test_loss: 2.2614, test_f1: 0.5609
 epoch: 73, train_loss: 0.3395, test_loss: 2.5422, test_f1: 0.5208
 epoch: 74, train_loss: 0.3603, test_loss: 2.7931, test_f1: 0.4813
 epoch: 75, train_loss: 0.4311, test_loss: 2.2245, test_f1: 0.5414
 epoch: 76, train_loss: 0.4080, test_loss: 2.1470, test_f1: 0.5570
 epoch: 77, train_loss: 0.3905, test_loss: 2.1558, test_f1: 0.5631
 epoch: 78, train_loss: 0.4116, test_loss: 2.2939, test_f1: 0.5266
 epoch: 79, train_loss: 0.4058, test_loss: 2.3285, test_f1: 0.5048
 epoch: 80, train_loss: 0.3877, test_loss: 2.3466, test_f1: 0.5439
 epoch: 81, train_loss: 0.3668, test_loss: 2.4227, test_f1: 0.5659
 epoch: 82, train_loss: 0.3396, test_loss: 2.3865, test_f1: 0.5663
 epoch: 83, train_loss: 0.3158, test_loss: 2.2932, test_f1: 0.5701
 epoch: 84, train_loss: 0.3102, test_loss: 2.3892, test_f1: 0.5655
 epoch: 85, train_loss: 0.3120, test_loss: 2.5206, test_f1: 0.5389
 epoch: 86, train_loss: 0.3145, test_loss: 2.3045, test_f1: 0.5383
 epoch: 87, train_loss: 0.3386, test_loss: 2.2254, test_f1: 0.5762
 epoch: 88, train_loss: 0.3489, test_loss: 2.2486, test_f1: 0.5675
 epoch: 89, train_loss: 0.3440, test_loss: 2.3130, test_f1: 0.5931
 epoch: 90, train_loss: 0.3150, test_loss: 2.3846, test_f1: 0.5617
 epoch: 91, train_loss: 0.3415, test_loss: 2.2491, test_f1: 0.5725
 epoch: 92, train_loss: 0.3196, test_loss: 2.3820, test_f1: 0.5722
 epoch: 93, train_loss: 0.3345, test_loss: 2.4139, test_f1: 0.6069
 epoch: 94, train_loss: 0.3041, test_loss: 2.2927, test_f1: 0.5976
 epoch: 95, train_loss: 0.3050, test_loss: 2.2661, test_f1: 0.5855
 epoch: 96, train_loss: 0.3059, test_loss: 2.1809, test_f1: 0.5677
 epoch: 97, train_loss: 0.3154, test_loss: 2.1973, test_f1: 0.5717
 epoch: 98, train_loss: 0.3291, test_loss: 2.3192, test_f1: 0.5710
 epoch: 99, train_loss: 0.3190, test_loss: 2.5650, test_f1: 0.5569
##################ITERATION #4 ****************************************
 epoch: 0, train_loss: 1.2719, test_loss: 1.4113, test_f1: 0.1836
 epoch: 1, train_loss: 1.1104, test_loss: 1.3331, test_f1: 0.1368
 epoch: 2, train_loss: 1.0488, test_loss: 1.2747, test_f1: 0.2632
 epoch: 3, train_loss: 1.0089, test_loss: 1.2427, test_f1: 0.3517
 epoch: 4, train_loss: 0.9756, test_loss: 1.1738, test_f1: 0.4796
 epoch: 5, train_loss: 0.9316, test_loss: 1.1861, test_f1: 0.5316
 epoch: 6, train_loss: 0.9189, test_loss: 1.1936, test_f1: 0.4748
 epoch: 7, train_loss: 0.8970, test_loss: 1.1527, test_f1: 0.5112
 epoch: 8, train_loss: 0.8689, test_loss: 1.1267, test_f1: 0.6068
 epoch: 9, train_loss: 0.8328, test_loss: 1.1803, test_f1: 0.5422
 epoch: 10, train_loss: 0.8059, test_loss: 1.1649, test_f1: 0.5798
 epoch: 11, train_loss: 0.7991, test_loss: 1.1982, test_f1: 0.5263
 epoch: 12, train_loss: 0.7804, test_loss: 1.2428, test_f1: 0.5242
 epoch: 13, train_loss: 0.7875, test_loss: 1.2979, test_f1: 0.5467
 epoch: 14, train_loss: 0.7672, test_loss: 1.3303, test_f1: 0.5602
 epoch: 15, train_loss: 0.7326, test_loss: 1.3471, test_f1: 0.5631
 epoch: 16, train_loss: 0.7531, test_loss: 1.6448, test_f1: 0.4842
 epoch: 17, train_loss: 0.7749, test_loss: 1.3938, test_f1: 0.5031
 epoch: 18, train_loss: 0.7623, test_loss: 1.3216, test_f1: 0.5788
 epoch: 19, train_loss: 0.7174, test_loss: 1.3363, test_f1: 0.5665
 epoch: 20, train_loss: 0.6952, test_loss: 1.3003, test_f1: 0.5642
 epoch: 21, train_loss: 0.6683, test_loss: 1.3887, test_f1: 0.5466
 epoch: 22, train_loss: 0.6911, test_loss: 1.3641, test_f1: 0.5800
 epoch: 23, train_loss: 0.6894, test_loss: 1.5039, test_f1: 0.5508
 epoch: 24, train_loss: 0.6745, test_loss: 1.5321, test_f1: 0.5181
 epoch: 25, train_loss: 0.6349, test_loss: 1.4223, test_f1: 0.5295
 epoch: 26, train_loss: 0.6590, test_loss: 1.4740, test_f1: 0.5482
 epoch: 27, train_loss: 0.6719, test_loss: 1.3794, test_f1: 0.5970
 epoch: 28, train_loss: 0.6305, test_loss: 1.3806, test_f1: 0.5328
 epoch: 29, train_loss: 0.5972, test_loss: 1.4980, test_f1: 0.5467
 epoch: 30, train_loss: 0.6165, test_loss: 1.6145, test_f1: 0.5789
 epoch: 31, train_loss: 0.5960, test_loss: 1.6984, test_f1: 0.5486
 epoch: 32, train_loss: 0.5812, test_loss: 1.6418, test_f1: 0.5063
 epoch: 33, train_loss: 0.5977, test_loss: 1.5376, test_f1: 0.5564
 epoch: 34, train_loss: 0.5761, test_loss: 1.7366, test_f1: 0.4943
 epoch: 35, train_loss: 0.5934, test_loss: 1.7591, test_f1: 0.5482
 epoch: 36, train_loss: 0.5835, test_loss: 1.5344, test_f1: 0.5826
 epoch: 37, train_loss: 0.5627, test_loss: 1.7363, test_f1: 0.5513
 epoch: 38, train_loss: 0.5741, test_loss: 1.5445, test_f1: 0.5862
 epoch: 39, train_loss: 0.5227, test_loss: 2.0493, test_f1: 0.5094
 epoch: 40, train_loss: 0.5433, test_loss: 1.9101, test_f1: 0.4785
 epoch: 41, train_loss: 0.5488, test_loss: 1.6614, test_f1: 0.5422
 epoch: 42, train_loss: 0.5989, test_loss: 2.1869, test_f1: 0.4745
 epoch: 43, train_loss: 0.6376, test_loss: 1.7205, test_f1: 0.5598
 epoch: 44, train_loss: 0.6555, test_loss: 1.7603, test_f1: 0.4977
 epoch: 45, train_loss: 0.5871, test_loss: 1.7197, test_f1: 0.5563
 epoch: 46, train_loss: 0.5421, test_loss: 1.7116, test_f1: 0.5522
 epoch: 47, train_loss: 0.5525, test_loss: 1.5815, test_f1: 0.5809
 epoch: 48, train_loss: 0.5456, test_loss: 1.5324, test_f1: 0.6132
 epoch: 49, train_loss: 0.5585, test_loss: 1.4210, test_f1: 0.6127
 epoch: 50, train_loss: 0.5415, test_loss: 1.3788, test_f1: 0.6116
 epoch: 51, train_loss: 0.5199, test_loss: 1.4667, test_f1: 0.6002
 epoch: 52, train_loss: 0.5034, test_loss: 1.5679, test_f1: 0.5797
 epoch: 53, train_loss: 0.4744, test_loss: 1.7566, test_f1: 0.5462
 epoch: 54, train_loss: 0.4569, test_loss: 1.6008, test_f1: 0.5548
 epoch: 55, train_loss: 0.4569, test_loss: 1.5852, test_f1: 0.5730
 epoch: 56, train_loss: 0.4368, test_loss: 1.5173, test_f1: 0.5718
 epoch: 57, train_loss: 0.4386, test_loss: 1.4883, test_f1: 0.5989
 epoch: 58, train_loss: 0.4335, test_loss: 1.7580, test_f1: 0.5541
 epoch: 59, train_loss: 0.4404, test_loss: 1.7728, test_f1: 0.5690
 epoch: 60, train_loss: 0.4025, test_loss: 1.7841, test_f1: 0.5746
 epoch: 61, train_loss: 0.4113, test_loss: 1.8728, test_f1: 0.5709
 epoch: 62, train_loss: 0.4069, test_loss: 1.8501, test_f1: 0.5699
 epoch: 63, train_loss: 0.4156, test_loss: 1.8176, test_f1: 0.5699
 epoch: 64, train_loss: 0.4112, test_loss: 1.8692, test_f1: 0.5755
 epoch: 65, train_loss: 0.3940, test_loss: 1.8502, test_f1: 0.5460
 epoch: 66, train_loss: 0.3921, test_loss: 1.6939, test_f1: 0.5556
 epoch: 67, train_loss: 0.3755, test_loss: 1.6440, test_f1: 0.5593
 epoch: 68, train_loss: 0.3855, test_loss: 1.8471, test_f1: 0.5574
 epoch: 69, train_loss: 0.3709, test_loss: 1.9304, test_f1: 0.5889
 epoch: 70, train_loss: 0.3584, test_loss: 1.8804, test_f1: 0.5567
 epoch: 71, train_loss: 0.3732, test_loss: 1.6931, test_f1: 0.5553
 epoch: 72, train_loss: 0.3898, test_loss: 1.8766, test_f1: 0.5819
 epoch: 73, train_loss: 0.3878, test_loss: 2.4138, test_f1: 0.5007
 epoch: 74, train_loss: 0.4375, test_loss: 2.0640, test_f1: 0.5629
 epoch: 75, train_loss: 0.4129, test_loss: 1.9314, test_f1: 0.5864
 epoch: 76, train_loss: 0.4025, test_loss: 1.8292, test_f1: 0.5819
 epoch: 77, train_loss: 0.4090, test_loss: 1.8856, test_f1: 0.5794
 epoch: 78, train_loss: 0.3703, test_loss: 2.3192, test_f1: 0.5741
 epoch: 79, train_loss: 0.3613, test_loss: 2.3562, test_f1: 0.5758
 epoch: 80, train_loss: 0.3445, test_loss: 2.3648, test_f1: 0.5573
 epoch: 81, train_loss: 0.3287, test_loss: 2.2035, test_f1: 0.5607
 epoch: 82, train_loss: 0.3718, test_loss: 2.0066, test_f1: 0.6068
 epoch: 83, train_loss: 0.3752, test_loss: 2.0827, test_f1: 0.5663
 epoch: 84, train_loss: 0.3717, test_loss: 2.0108, test_f1: 0.5911
 epoch: 85, train_loss: 0.3630, test_loss: 2.2136, test_f1: 0.5578
 epoch: 86, train_loss: 0.3522, test_loss: 2.0585, test_f1: 0.5388
 epoch: 87, train_loss: 0.3536, test_loss: 1.9434, test_f1: 0.5751
 epoch: 88, train_loss: 0.3366, test_loss: 2.2129, test_f1: 0.5665
 epoch: 89, train_loss: 0.3232, test_loss: 2.1650, test_f1: 0.5634
 epoch: 90, train_loss: 0.3124, test_loss: 2.0347, test_f1: 0.5394
 epoch: 91, train_loss: 0.3115, test_loss: 1.9401, test_f1: 0.5683
 epoch: 92, train_loss: 0.3325, test_loss: 1.9783, test_f1: 0.5994
 epoch: 93, train_loss: 0.3025, test_loss: 1.9376, test_f1: 0.5897
 epoch: 94, train_loss: 0.2895, test_loss: 1.9341, test_f1: 0.5358
 epoch: 95, train_loss: 0.3205, test_loss: 1.9739, test_f1: 0.5752
 epoch: 96, train_loss: 0.2707, test_loss: 2.0029, test_f1: 0.5575
 epoch: 97, train_loss: 0.2955, test_loss: 2.0948, test_f1: 0.5863
 epoch: 98, train_loss: 0.2772, test_loss: 2.0879, test_f1: 0.5801
 epoch: 99, train_loss: 0.3099, test_loss: 2.1962, test_f1: 0.5811
##################ITERATION #5 ****************************************
 epoch: 0, train_loss: 1.2630, test_loss: 1.3772, test_f1: 0.1653
 epoch: 1, train_loss: 1.1298, test_loss: 1.3198, test_f1: 0.2079
 epoch: 2, train_loss: 1.0568, test_loss: 1.2907, test_f1: 0.2636
 epoch: 3, train_loss: 1.0325, test_loss: 1.2356, test_f1: 0.3521
 epoch: 4, train_loss: 0.9910, test_loss: 1.2002, test_f1: 0.4084
 epoch: 5, train_loss: 0.9588, test_loss: 1.2233, test_f1: 0.3321
 epoch: 6, train_loss: 0.9373, test_loss: 1.2200, test_f1: 0.4245
 epoch: 7, train_loss: 0.9132, test_loss: 1.1132, test_f1: 0.5008
 epoch: 8, train_loss: 0.8958, test_loss: 1.0944, test_f1: 0.5608
 epoch: 9, train_loss: 0.8777, test_loss: 1.1858, test_f1: 0.4600
 epoch: 10, train_loss: 0.8587, test_loss: 1.2859, test_f1: 0.5361
 epoch: 11, train_loss: 0.8398, test_loss: 1.1766, test_f1: 0.5630
 epoch: 12, train_loss: 0.8529, test_loss: 1.1825, test_f1: 0.5188
 epoch: 13, train_loss: 0.8470, test_loss: 1.3623, test_f1: 0.4927
 epoch: 14, train_loss: 0.8213, test_loss: 1.3372, test_f1: 0.5186
 epoch: 15, train_loss: 0.8267, test_loss: 1.2421, test_f1: 0.5463
 epoch: 16, train_loss: 0.8015, test_loss: 1.2840, test_f1: 0.4999
 epoch: 17, train_loss: 0.7939, test_loss: 1.1418, test_f1: 0.5466
 epoch: 18, train_loss: 0.7861, test_loss: 1.2962, test_f1: 0.5692
 epoch: 19, train_loss: 0.7798, test_loss: 1.5470, test_f1: 0.4769
 epoch: 20, train_loss: 0.7810, test_loss: 1.3455, test_f1: 0.5729
 epoch: 21, train_loss: 0.7468, test_loss: 1.2365, test_f1: 0.5591
 epoch: 22, train_loss: 0.7229, test_loss: 1.3397, test_f1: 0.5324
 epoch: 23, train_loss: 0.7221, test_loss: 1.4691, test_f1: 0.5751
 epoch: 24, train_loss: 0.6964, test_loss: 1.4231, test_f1: 0.5874
 epoch: 25, train_loss: 0.6875, test_loss: 1.4169, test_f1: 0.5641
 epoch: 26, train_loss: 0.6754, test_loss: 1.3062, test_f1: 0.5976
 epoch: 27, train_loss: 0.6652, test_loss: 1.6207, test_f1: 0.5415
 epoch: 28, train_loss: 0.6245, test_loss: 1.8020, test_f1: 0.4870
 epoch: 29, train_loss: 0.6505, test_loss: 1.6027, test_f1: 0.5245
 epoch: 30, train_loss: 0.6817, test_loss: 1.5264, test_f1: 0.5486
 epoch: 31, train_loss: 0.6881, test_loss: 1.2448, test_f1: 0.6176
 epoch: 32, train_loss: 0.6804, test_loss: 1.2776, test_f1: 0.5213
 epoch: 33, train_loss: 0.6441, test_loss: 1.3567, test_f1: 0.5759
 epoch: 34, train_loss: 0.6689, test_loss: 1.4925, test_f1: 0.5578
 epoch: 35, train_loss: 0.6825, test_loss: 1.8166, test_f1: 0.4349
 epoch: 36, train_loss: 0.6365, test_loss: 1.4731, test_f1: 0.5966
 epoch: 37, train_loss: 0.6166, test_loss: 1.6196, test_f1: 0.5334
 epoch: 38, train_loss: 0.6090, test_loss: 1.5942, test_f1: 0.5895
 epoch: 39, train_loss: 0.5973, test_loss: 1.5963, test_f1: 0.5496
 epoch: 40, train_loss: 0.5940, test_loss: 1.5659, test_f1: 0.5321
 epoch: 41, train_loss: 0.6157, test_loss: 1.6372, test_f1: 0.5210
 epoch: 42, train_loss: 0.6495, test_loss: 1.5419, test_f1: 0.5723
 epoch: 43, train_loss: 0.6086, test_loss: 1.3534, test_f1: 0.5944
 epoch: 44, train_loss: 0.6055, test_loss: 1.6414, test_f1: 0.5174
 epoch: 45, train_loss: 0.6061, test_loss: 1.8305, test_f1: 0.5022
 epoch: 46, train_loss: 0.5957, test_loss: 1.5134, test_f1: 0.5343
 epoch: 47, train_loss: 0.5679, test_loss: 1.5560, test_f1: 0.5529
 epoch: 48, train_loss: 0.5632, test_loss: 1.6393, test_f1: 0.5299
 epoch: 49, train_loss: 0.5706, test_loss: 1.4872, test_f1: 0.5791
 epoch: 50, train_loss: 0.5524, test_loss: 1.3735, test_f1: 0.6168
 epoch: 51, train_loss: 0.5321, test_loss: 1.4339, test_f1: 0.6162
 epoch: 52, train_loss: 0.5099, test_loss: 1.5555, test_f1: 0.5462
 epoch: 53, train_loss: 0.4979, test_loss: 1.6006, test_f1: 0.5232
 epoch: 54, train_loss: 0.5036, test_loss: 1.7549, test_f1: 0.5386
 epoch: 55, train_loss: 0.4832, test_loss: 1.6149, test_f1: 0.5040
 epoch: 56, train_loss: 0.4742, test_loss: 1.6612, test_f1: 0.5142
 epoch: 57, train_loss: 0.4695, test_loss: 1.7756, test_f1: 0.5476
 epoch: 58, train_loss: 0.4458, test_loss: 1.7671, test_f1: 0.5373
 epoch: 59, train_loss: 0.4444, test_loss: 1.8746, test_f1: 0.5466
 epoch: 60, train_loss: 0.4257, test_loss: 1.8322, test_f1: 0.5644
 epoch: 61, train_loss: 0.4361, test_loss: 1.8117, test_f1: 0.5896
 epoch: 62, train_loss: 0.4072, test_loss: 1.8046, test_f1: 0.5695
 epoch: 63, train_loss: 0.4135, test_loss: 1.9364, test_f1: 0.5514
 epoch: 64, train_loss: 0.4060, test_loss: 1.8218, test_f1: 0.5626
 epoch: 65, train_loss: 0.4061, test_loss: 1.6950, test_f1: 0.5777
 epoch: 66, train_loss: 0.4154, test_loss: 1.8028, test_f1: 0.5795
 epoch: 67, train_loss: 0.4211, test_loss: 1.8649, test_f1: 0.5234
 epoch: 68, train_loss: 0.4076, test_loss: 1.7382, test_f1: 0.5501
 epoch: 69, train_loss: 0.3964, test_loss: 1.7832, test_f1: 0.5466
 epoch: 70, train_loss: 0.3764, test_loss: 1.7809, test_f1: 0.5621
 epoch: 71, train_loss: 0.3719, test_loss: 1.7490, test_f1: 0.5624
 epoch: 72, train_loss: 0.4036, test_loss: 1.7333, test_f1: 0.5452
 epoch: 73, train_loss: 0.3987, test_loss: 1.9229, test_f1: 0.5561
 epoch: 74, train_loss: 0.3929, test_loss: 2.2478, test_f1: 0.5046
 epoch: 75, train_loss: 0.3693, test_loss: 2.0849, test_f1: 0.5332
 epoch: 76, train_loss: 0.3615, test_loss: 1.8835, test_f1: 0.5623
 epoch: 77, train_loss: 0.3832, test_loss: 1.7995, test_f1: 0.5595
 epoch: 78, train_loss: 0.3970, test_loss: 1.9153, test_f1: 0.5113
 epoch: 79, train_loss: 0.3542, test_loss: 2.0341, test_f1: 0.5507
 epoch: 80, train_loss: 0.4121, test_loss: 2.3388, test_f1: 0.5017
 epoch: 81, train_loss: 0.4721, test_loss: 2.1573, test_f1: 0.4871
 epoch: 82, train_loss: 0.4581, test_loss: 1.9590, test_f1: 0.5038
 epoch: 83, train_loss: 0.4435, test_loss: 2.1674, test_f1: 0.5311
 epoch: 84, train_loss: 0.4033, test_loss: 2.0920, test_f1: 0.5412
 epoch: 85, train_loss: 0.4007, test_loss: 1.9929, test_f1: 0.5402
 epoch: 86, train_loss: 0.3979, test_loss: 2.0761, test_f1: 0.5501
 epoch: 87, train_loss: 0.4107, test_loss: 2.0694, test_f1: 0.5600
 epoch: 88, train_loss: 0.3803, test_loss: 2.0664, test_f1: 0.5645
 epoch: 89, train_loss: 0.3969, test_loss: 2.2076, test_f1: 0.5239
 epoch: 90, train_loss: 0.4041, test_loss: 2.0799, test_f1: 0.5490
 epoch: 91, train_loss: 0.3827, test_loss: 1.9567, test_f1: 0.5312
 epoch: 92, train_loss: 0.3939, test_loss: 2.3587, test_f1: 0.5142
 epoch: 93, train_loss: 0.4049, test_loss: 2.4647, test_f1: 0.4981
 epoch: 94, train_loss: 0.3859, test_loss: 2.3011, test_f1: 0.5329
 epoch: 95, train_loss: 0.3817, test_loss: 2.0434, test_f1: 0.5319
 epoch: 96, train_loss: 0.3743, test_loss: 2.0002, test_f1: 0.5646
 epoch: 97, train_loss: 0.3385, test_loss: 2.0661, test_f1: 0.5426
 epoch: 98, train_loss: 0.3376, test_loss: 2.2703, test_f1: 0.5433
 epoch: 99, train_loss: 0.3215, test_loss: 2.3244, test_f1: 0.5235
##################ITERATION #6 ****************************************
 epoch: 0, train_loss: 1.2572, test_loss: 1.3693, test_f1: 0.1365
 epoch: 1, train_loss: 1.1340, test_loss: 1.3512, test_f1: 0.2301
 epoch: 2, train_loss: 1.0681, test_loss: 1.3201, test_f1: 0.2223
 epoch: 3, train_loss: 1.0349, test_loss: 1.2672, test_f1: 0.3542
 epoch: 4, train_loss: 0.9809, test_loss: 1.2301, test_f1: 0.5042
 epoch: 5, train_loss: 0.9514, test_loss: 1.2382, test_f1: 0.4434
 epoch: 6, train_loss: 0.9039, test_loss: 1.1574, test_f1: 0.5276
 epoch: 7, train_loss: 0.8671, test_loss: 1.3229, test_f1: 0.5254
 epoch: 8, train_loss: 0.8521, test_loss: 1.4091, test_f1: 0.5073
 epoch: 9, train_loss: 0.8717, test_loss: 1.5315, test_f1: 0.5481
 epoch: 10, train_loss: 0.8245, test_loss: 1.4157, test_f1: 0.5645
 epoch: 11, train_loss: 0.8140, test_loss: 1.3353, test_f1: 0.5128
 epoch: 12, train_loss: 0.8115, test_loss: 1.5654, test_f1: 0.4989
 epoch: 13, train_loss: 0.7957, test_loss: 1.3468, test_f1: 0.6214
 epoch: 14, train_loss: 0.7546, test_loss: 1.5005, test_f1: 0.5085
 epoch: 15, train_loss: 0.7414, test_loss: 1.3688, test_f1: 0.5627
 epoch: 16, train_loss: 0.7243, test_loss: 1.7752, test_f1: 0.5076
 epoch: 17, train_loss: 0.7138, test_loss: 1.5568, test_f1: 0.4919
 epoch: 18, train_loss: 0.7232, test_loss: 1.4262, test_f1: 0.5290
 epoch: 19, train_loss: 0.6816, test_loss: 1.5577, test_f1: 0.5125
 epoch: 20, train_loss: 0.6579, test_loss: 1.6284, test_f1: 0.5048
 epoch: 21, train_loss: 0.6654, test_loss: 1.6397, test_f1: 0.4975
 epoch: 22, train_loss: 0.6967, test_loss: 1.5753, test_f1: 0.5069
 epoch: 23, train_loss: 0.6731, test_loss: 1.8497, test_f1: 0.4894
 epoch: 24, train_loss: 0.6682, test_loss: 1.9083, test_f1: 0.5085
 epoch: 25, train_loss: 0.6736, test_loss: 1.7202, test_f1: 0.5828
 epoch: 26, train_loss: 0.6785, test_loss: 1.6731, test_f1: 0.5519
 epoch: 27, train_loss: 0.7109, test_loss: 1.5430, test_f1: 0.5449
 epoch: 28, train_loss: 0.6715, test_loss: 1.5341, test_f1: 0.5368
 epoch: 29, train_loss: 0.6495, test_loss: 1.6014, test_f1: 0.5709
 epoch: 30, train_loss: 0.6562, test_loss: 1.4853, test_f1: 0.5549
 epoch: 31, train_loss: 0.6215, test_loss: 1.7113, test_f1: 0.5752
 epoch: 32, train_loss: 0.6209, test_loss: 1.7446, test_f1: 0.5617
 epoch: 33, train_loss: 0.6372, test_loss: 1.9044, test_f1: 0.5290
 epoch: 34, train_loss: 0.6471, test_loss: 1.8401, test_f1: 0.4988
 epoch: 35, train_loss: 0.6344, test_loss: 2.0105, test_f1: 0.5041
 epoch: 36, train_loss: 0.6479, test_loss: 1.9047, test_f1: 0.4994
 epoch: 37, train_loss: 0.6792, test_loss: 1.6596, test_f1: 0.5322
 epoch: 38, train_loss: 0.6556, test_loss: 1.6445, test_f1: 0.5058
 epoch: 39, train_loss: 0.6051, test_loss: 1.4415, test_f1: 0.5750
 epoch: 40, train_loss: 0.6115, test_loss: 1.5159, test_f1: 0.5494
 epoch: 41, train_loss: 0.5998, test_loss: 1.4700, test_f1: 0.5242
 epoch: 42, train_loss: 0.5914, test_loss: 1.5223, test_f1: 0.5169
 epoch: 43, train_loss: 0.5553, test_loss: 1.4127, test_f1: 0.5714
 epoch: 44, train_loss: 0.5390, test_loss: 1.6160, test_f1: 0.5715
 epoch: 45, train_loss: 0.5597, test_loss: 1.7653, test_f1: 0.5690
 epoch: 46, train_loss: 0.5934, test_loss: 1.6285, test_f1: 0.5433
 epoch: 47, train_loss: 0.5848, test_loss: 1.4748, test_f1: 0.5490
 epoch: 48, train_loss: 0.5923, test_loss: 1.8487, test_f1: 0.5198
 epoch: 49, train_loss: 0.5729, test_loss: 1.8745, test_f1: 0.4929
 epoch: 50, train_loss: 0.5885, test_loss: 1.5285, test_f1: 0.5281
 epoch: 51, train_loss: 0.5572, test_loss: 1.5562, test_f1: 0.5359
 epoch: 52, train_loss: 0.5239, test_loss: 1.7083, test_f1: 0.5314
 epoch: 53, train_loss: 0.5009, test_loss: 1.7005, test_f1: 0.5526
 epoch: 54, train_loss: 0.4737, test_loss: 1.7894, test_f1: 0.5330
 epoch: 55, train_loss: 0.4786, test_loss: 1.8151, test_f1: 0.5557
 epoch: 56, train_loss: 0.4502, test_loss: 1.7825, test_f1: 0.5694
 epoch: 57, train_loss: 0.4531, test_loss: 1.8261, test_f1: 0.5486
 epoch: 58, train_loss: 0.4724, test_loss: 2.0421, test_f1: 0.5610
 epoch: 59, train_loss: 0.4386, test_loss: 2.1309, test_f1: 0.5366
 epoch: 60, train_loss: 0.4201, test_loss: 2.1957, test_f1: 0.5197
 epoch: 61, train_loss: 0.4347, test_loss: 2.0194, test_f1: 0.5292
 epoch: 62, train_loss: 0.4134, test_loss: 2.0372, test_f1: 0.5700
 epoch: 63, train_loss: 0.3999, test_loss: 2.3027, test_f1: 0.5533
 epoch: 64, train_loss: 0.4071, test_loss: 2.0753, test_f1: 0.5408
 epoch: 65, train_loss: 0.3917, test_loss: 2.1020, test_f1: 0.5369
 epoch: 66, train_loss: 0.3930, test_loss: 2.0214, test_f1: 0.5188
 epoch: 67, train_loss: 0.3982, test_loss: 1.9833, test_f1: 0.5617
 epoch: 68, train_loss: 0.3881, test_loss: 1.9216, test_f1: 0.6030
 epoch: 69, train_loss: 0.3800, test_loss: 2.1403, test_f1: 0.5807
 epoch: 70, train_loss: 0.3874, test_loss: 2.1878, test_f1: 0.5617
 epoch: 71, train_loss: 0.3704, test_loss: 2.4827, test_f1: 0.5327
 epoch: 72, train_loss: 0.3754, test_loss: 2.4942, test_f1: 0.5131
 epoch: 73, train_loss: 0.4033, test_loss: 2.6377, test_f1: 0.5215
 epoch: 74, train_loss: 0.3952, test_loss: 2.5162, test_f1: 0.5083
 epoch: 75, train_loss: 0.4100, test_loss: 2.4333, test_f1: 0.5071
 epoch: 76, train_loss: 0.3891, test_loss: 2.3149, test_f1: 0.5220
 epoch: 77, train_loss: 0.3590, test_loss: 2.4973, test_f1: 0.5025
 epoch: 78, train_loss: 0.3436, test_loss: 2.3411, test_f1: 0.5650
 epoch: 79, train_loss: 0.3296, test_loss: 2.2749, test_f1: 0.5740
 epoch: 80, train_loss: 0.3331, test_loss: 2.3593, test_f1: 0.5526
 epoch: 81, train_loss: 0.3265, test_loss: 2.5413, test_f1: 0.5278
 epoch: 82, train_loss: 0.3281, test_loss: 2.5412, test_f1: 0.5575
 epoch: 83, train_loss: 0.3201, test_loss: 2.5815, test_f1: 0.5424
 epoch: 84, train_loss: 0.3219, test_loss: 2.5563, test_f1: 0.5555
 epoch: 85, train_loss: 0.3222, test_loss: 2.5170, test_f1: 0.5608
 epoch: 86, train_loss: 0.3632, test_loss: 2.4391, test_f1: 0.5577
 epoch: 87, train_loss: 0.3510, test_loss: 2.3973, test_f1: 0.5945
 epoch: 88, train_loss: 0.3418, test_loss: 2.5714, test_f1: 0.5477
 epoch: 89, train_loss: 0.3637, test_loss: 2.7185, test_f1: 0.5496
 epoch: 90, train_loss: 0.3469, test_loss: 2.6827, test_f1: 0.5352
 epoch: 91, train_loss: 0.3565, test_loss: 2.7189, test_f1: 0.5556
 epoch: 92, train_loss: 0.3504, test_loss: 2.3679, test_f1: 0.5720
 epoch: 93, train_loss: 0.3641, test_loss: 2.2875, test_f1: 0.5789
 epoch: 94, train_loss: 0.3361, test_loss: 2.2885, test_f1: 0.5568
 epoch: 95, train_loss: 0.3356, test_loss: 2.3118, test_f1: 0.5340
 epoch: 96, train_loss: 0.3581, test_loss: 2.5068, test_f1: 0.5409
 epoch: 97, train_loss: 0.3496, test_loss: 2.4638, test_f1: 0.5671
 epoch: 98, train_loss: 0.3401, test_loss: 2.4143, test_f1: 0.5611
 epoch: 99, train_loss: 0.3232, test_loss: 2.5051, test_f1: 0.5711
##################ITERATION #7 ****************************************
 epoch: 0, train_loss: 1.2666, test_loss: 1.4091, test_f1: 0.1365
 epoch: 1, train_loss: 1.1200, test_loss: 1.3098, test_f1: 0.2810
 epoch: 2, train_loss: 1.0704, test_loss: 1.3365, test_f1: 0.3645
 epoch: 3, train_loss: 1.0230, test_loss: 1.2429, test_f1: 0.2997
 epoch: 4, train_loss: 0.9649, test_loss: 1.2154, test_f1: 0.4336
 epoch: 5, train_loss: 0.9370, test_loss: 1.1819, test_f1: 0.4014
 epoch: 6, train_loss: 0.8964, test_loss: 1.1746, test_f1: 0.3946
 epoch: 7, train_loss: 0.8664, test_loss: 1.1187, test_f1: 0.5255
 epoch: 8, train_loss: 0.8594, test_loss: 1.1069, test_f1: 0.4939
 epoch: 9, train_loss: 0.8013, test_loss: 1.0621, test_f1: 0.5412
 epoch: 10, train_loss: 0.7878, test_loss: 1.0867, test_f1: 0.5267
 epoch: 11, train_loss: 0.7736, test_loss: 1.0924, test_f1: 0.5340
 epoch: 12, train_loss: 0.7535, test_loss: 1.1438, test_f1: 0.5648
 epoch: 13, train_loss: 0.7293, test_loss: 1.1597, test_f1: 0.5424
 epoch: 14, train_loss: 0.7289, test_loss: 1.1441, test_f1: 0.5664
 epoch: 15, train_loss: 0.7489, test_loss: 1.3665, test_f1: 0.5645
 epoch: 16, train_loss: 0.7217, test_loss: 1.3670, test_f1: 0.5144
 epoch: 17, train_loss: 0.7063, test_loss: 1.2138, test_f1: 0.5539
 epoch: 18, train_loss: 0.6869, test_loss: 1.2435, test_f1: 0.6139
 epoch: 19, train_loss: 0.6913, test_loss: 1.3277, test_f1: 0.5962
 epoch: 20, train_loss: 0.7140, test_loss: 1.6127, test_f1: 0.5618
 epoch: 21, train_loss: 0.7013, test_loss: 1.5939, test_f1: 0.4444
 epoch: 22, train_loss: 0.6727, test_loss: 1.4694, test_f1: 0.5754
 epoch: 23, train_loss: 0.6723, test_loss: 1.3009, test_f1: 0.6071
 epoch: 24, train_loss: 0.6326, test_loss: 1.5523, test_f1: 0.5560
 epoch: 25, train_loss: 0.6103, test_loss: 1.5688, test_f1: 0.5591
 epoch: 26, train_loss: 0.6210, test_loss: 1.5658, test_f1: 0.5284
 epoch: 27, train_loss: 0.6345, test_loss: 1.5959, test_f1: 0.5333
 epoch: 28, train_loss: 0.6251, test_loss: 1.5636, test_f1: 0.5524
 epoch: 29, train_loss: 0.5922, test_loss: 1.4380, test_f1: 0.5509
 epoch: 30, train_loss: 0.5640, test_loss: 1.5996, test_f1: 0.4980
 epoch: 31, train_loss: 0.6014, test_loss: 1.4989, test_f1: 0.5489
 epoch: 32, train_loss: 0.6202, test_loss: 1.5290, test_f1: 0.5186
 epoch: 33, train_loss: 0.6111, test_loss: 1.3693, test_f1: 0.5565
 epoch: 34, train_loss: 0.5775, test_loss: 1.3708, test_f1: 0.5836
 epoch: 35, train_loss: 0.5598, test_loss: 1.5787, test_f1: 0.5147
 epoch: 36, train_loss: 0.5402, test_loss: 1.7035, test_f1: 0.5161
 epoch: 37, train_loss: 0.5284, test_loss: 1.3858, test_f1: 0.6059
 epoch: 38, train_loss: 0.5160, test_loss: 1.6866, test_f1: 0.5458
 epoch: 39, train_loss: 0.5127, test_loss: 1.7720, test_f1: 0.5355
 epoch: 40, train_loss: 0.5347, test_loss: 1.6128, test_f1: 0.5609
 epoch: 41, train_loss: 0.5336, test_loss: 1.6035, test_f1: 0.5206
 epoch: 42, train_loss: 0.5535, test_loss: 2.0382, test_f1: 0.4748
 epoch: 43, train_loss: 0.5216, test_loss: 1.9494, test_f1: 0.5196
 epoch: 44, train_loss: 0.5016, test_loss: 1.8814, test_f1: 0.5534
 epoch: 45, train_loss: 0.4919, test_loss: 1.9498, test_f1: 0.5568
 epoch: 46, train_loss: 0.4654, test_loss: 1.8601, test_f1: 0.5632
 epoch: 47, train_loss: 0.4725, test_loss: 1.8698, test_f1: 0.5281
 epoch: 48, train_loss: 0.4478, test_loss: 2.1824, test_f1: 0.5158
 epoch: 49, train_loss: 0.4690, test_loss: 2.0317, test_f1: 0.4518
 epoch: 50, train_loss: 0.4893, test_loss: 1.7121, test_f1: 0.5559
 epoch: 51, train_loss: 0.4427, test_loss: 1.6857, test_f1: 0.5620
 epoch: 52, train_loss: 0.4248, test_loss: 2.0752, test_f1: 0.5671
 epoch: 53, train_loss: 0.3994, test_loss: 2.1040, test_f1: 0.5658
 epoch: 54, train_loss: 0.3792, test_loss: 1.9110, test_f1: 0.5906
 epoch: 55, train_loss: 0.3815, test_loss: 1.9073, test_f1: 0.5786
 epoch: 56, train_loss: 0.3777, test_loss: 1.9398, test_f1: 0.5423
 epoch: 57, train_loss: 0.3794, test_loss: 2.0221, test_f1: 0.5390
 epoch: 58, train_loss: 0.3872, test_loss: 1.8858, test_f1: 0.6001
 epoch: 59, train_loss: 0.3737, test_loss: 1.8604, test_f1: 0.6153
 epoch: 60, train_loss: 0.3682, test_loss: 1.9616, test_f1: 0.5787
 epoch: 61, train_loss: 0.3462, test_loss: 1.8852, test_f1: 0.5778
 epoch: 62, train_loss: 0.3255, test_loss: 2.0584, test_f1: 0.5532
 epoch: 63, train_loss: 0.3391, test_loss: 2.3358, test_f1: 0.5435
 epoch: 64, train_loss: 0.3460, test_loss: 2.6495, test_f1: 0.5231
 epoch: 65, train_loss: 0.3771, test_loss: 2.4418, test_f1: 0.5869
 epoch: 66, train_loss: 0.3828, test_loss: 2.2865, test_f1: 0.5969
 epoch: 67, train_loss: 0.3602, test_loss: 2.3090, test_f1: 0.5943
 epoch: 68, train_loss: 0.3266, test_loss: 2.3426, test_f1: 0.5939
 epoch: 69, train_loss: 0.3239, test_loss: 2.3268, test_f1: 0.5339
 epoch: 70, train_loss: 0.3297, test_loss: 2.5154, test_f1: 0.5274
 epoch: 71, train_loss: 0.3220, test_loss: 2.4925, test_f1: 0.5795
 epoch: 72, train_loss: 0.3179, test_loss: 2.4788, test_f1: 0.5576
 epoch: 73, train_loss: 0.3454, test_loss: 2.2860, test_f1: 0.5713
 epoch: 74, train_loss: 0.3285, test_loss: 2.2710, test_f1: 0.5746
 epoch: 75, train_loss: 0.2999, test_loss: 2.4044, test_f1: 0.5667
 epoch: 76, train_loss: 0.3241, test_loss: 2.5975, test_f1: 0.5466
 epoch: 77, train_loss: 0.3574, test_loss: 2.6970, test_f1: 0.5373
 epoch: 78, train_loss: 0.3313, test_loss: 2.9044, test_f1: 0.5630
 epoch: 79, train_loss: 0.3053, test_loss: 2.9454, test_f1: 0.5321
 epoch: 80, train_loss: 0.2934, test_loss: 2.9287, test_f1: 0.5019
 epoch: 81, train_loss: 0.3136, test_loss: 2.8072, test_f1: 0.5481
 epoch: 82, train_loss: 0.2852, test_loss: 2.7975, test_f1: 0.5602
 epoch: 83, train_loss: 0.3017, test_loss: 2.6771, test_f1: 0.5495
 epoch: 84, train_loss: 0.3294, test_loss: 2.5634, test_f1: 0.5629
 epoch: 85, train_loss: 0.3111, test_loss: 2.5589, test_f1: 0.5445
 epoch: 86, train_loss: 0.3157, test_loss: 2.4853, test_f1: 0.5667
 epoch: 87, train_loss: 0.3030, test_loss: 2.7921, test_f1: 0.5709
 epoch: 88, train_loss: 0.2891, test_loss: 2.6717, test_f1: 0.5404
 epoch: 89, train_loss: 0.2794, test_loss: 2.5741, test_f1: 0.5553
 epoch: 90, train_loss: 0.3006, test_loss: 2.5447, test_f1: 0.5518
 epoch: 91, train_loss: 0.2722, test_loss: 2.4622, test_f1: 0.5817
 epoch: 92, train_loss: 0.3095, test_loss: 2.3879, test_f1: 0.5589
 epoch: 93, train_loss: 0.2919, test_loss: 2.2762, test_f1: 0.5644
 epoch: 94, train_loss: 0.3238, test_loss: 2.2909, test_f1: 0.5737
 epoch: 95, train_loss: 0.2835, test_loss: 2.5210, test_f1: 0.5308
 epoch: 96, train_loss: 0.2967, test_loss: 2.5943, test_f1: 0.5410
 epoch: 97, train_loss: 0.2637, test_loss: 2.3971, test_f1: 0.5972
 epoch: 98, train_loss: 0.2928, test_loss: 2.5569, test_f1: 0.5797
 epoch: 99, train_loss: 0.2752, test_loss: 2.7747, test_f1: 0.5463
##################ITERATION #8 ****************************************
 epoch: 0, train_loss: 1.2455, test_loss: 1.3261, test_f1: 0.2110
 epoch: 1, train_loss: 1.1513, test_loss: 1.3178, test_f1: 0.2110
 epoch: 2, train_loss: 1.0525, test_loss: 1.3038, test_f1: 0.3261
 epoch: 3, train_loss: 1.0278, test_loss: 1.2647, test_f1: 0.3685
 epoch: 4, train_loss: 1.0100, test_loss: 1.2622, test_f1: 0.4488
 epoch: 5, train_loss: 0.9602, test_loss: 1.1959, test_f1: 0.4737
 epoch: 6, train_loss: 0.9356, test_loss: 1.2049, test_f1: 0.4970
 epoch: 7, train_loss: 0.8952, test_loss: 1.1134, test_f1: 0.4796
 epoch: 8, train_loss: 0.8508, test_loss: 1.1889, test_f1: 0.4656
 epoch: 9, train_loss: 0.8488, test_loss: 1.1595, test_f1: 0.5517
 epoch: 10, train_loss: 0.8616, test_loss: 1.2294, test_f1: 0.5032
 epoch: 11, train_loss: 0.8360, test_loss: 1.3552, test_f1: 0.4162
 epoch: 12, train_loss: 0.8245, test_loss: 1.2788, test_f1: 0.5114
 epoch: 13, train_loss: 0.8274, test_loss: 1.3994, test_f1: 0.4510
 epoch: 14, train_loss: 0.8095, test_loss: 1.3879, test_f1: 0.4792
 epoch: 15, train_loss: 0.7474, test_loss: 1.3399, test_f1: 0.4959
 epoch: 16, train_loss: 0.7388, test_loss: 1.5690, test_f1: 0.5234
 epoch: 17, train_loss: 0.7420, test_loss: 1.5722, test_f1: 0.4787
 epoch: 18, train_loss: 0.7148, test_loss: 1.4060, test_f1: 0.5174
 epoch: 19, train_loss: 0.7424, test_loss: 1.4907, test_f1: 0.5299
 epoch: 20, train_loss: 0.6801, test_loss: 1.6450, test_f1: 0.4891
 epoch: 21, train_loss: 0.6395, test_loss: 1.6262, test_f1: 0.5194
 epoch: 22, train_loss: 0.6518, test_loss: 1.9236, test_f1: 0.4311
 epoch: 23, train_loss: 0.6410, test_loss: 1.8885, test_f1: 0.5160
 epoch: 24, train_loss: 0.6464, test_loss: 2.0786, test_f1: 0.4805
 epoch: 25, train_loss: 0.6299, test_loss: 1.9924, test_f1: 0.5273
 epoch: 26, train_loss: 0.5967, test_loss: 1.7551, test_f1: 0.5615
 epoch: 27, train_loss: 0.6225, test_loss: 1.4079, test_f1: 0.5539
 epoch: 28, train_loss: 0.6185, test_loss: 1.2548, test_f1: 0.5983
 epoch: 29, train_loss: 0.6150, test_loss: 1.2238, test_f1: 0.5603
 epoch: 30, train_loss: 0.6319, test_loss: 1.4900, test_f1: 0.5454
 epoch: 31, train_loss: 0.6128, test_loss: 1.3796, test_f1: 0.5457
 epoch: 32, train_loss: 0.5970, test_loss: 1.4342, test_f1: 0.4976
 epoch: 33, train_loss: 0.5854, test_loss: 1.5629, test_f1: 0.4910
 epoch: 34, train_loss: 0.5962, test_loss: 1.5106, test_f1: 0.5007
 epoch: 35, train_loss: 0.6125, test_loss: 1.8336, test_f1: 0.4855
 epoch: 36, train_loss: 0.5758, test_loss: 1.7726, test_f1: 0.5285
 epoch: 37, train_loss: 0.5665, test_loss: 1.7753, test_f1: 0.5344
 epoch: 38, train_loss: 0.5884, test_loss: 1.9235, test_f1: 0.4975
 epoch: 39, train_loss: 0.5461, test_loss: 1.7981, test_f1: 0.5421
 epoch: 40, train_loss: 0.5567, test_loss: 1.6525, test_f1: 0.5257
 epoch: 41, train_loss: 0.6006, test_loss: 1.5307, test_f1: 0.5839
 epoch: 42, train_loss: 0.6322, test_loss: 1.5863, test_f1: 0.5118
 epoch: 43, train_loss: 0.6100, test_loss: 1.8196, test_f1: 0.6162
 epoch: 44, train_loss: 0.5571, test_loss: 1.6283, test_f1: 0.5738
 epoch: 45, train_loss: 0.6011, test_loss: 1.5056, test_f1: 0.5794
 epoch: 46, train_loss: 0.5507, test_loss: 1.7276, test_f1: 0.5075
 epoch: 47, train_loss: 0.5063, test_loss: 1.7162, test_f1: 0.5430
 epoch: 48, train_loss: 0.5121, test_loss: 1.7008, test_f1: 0.5197
 epoch: 49, train_loss: 0.4999, test_loss: 1.6458, test_f1: 0.5680
 epoch: 50, train_loss: 0.5069, test_loss: 1.7531, test_f1: 0.4911
 epoch: 51, train_loss: 0.4898, test_loss: 1.8462, test_f1: 0.4834
 epoch: 52, train_loss: 0.4521, test_loss: 1.5579, test_f1: 0.5236
 epoch: 53, train_loss: 0.4587, test_loss: 1.5219, test_f1: 0.5353
 epoch: 54, train_loss: 0.4456, test_loss: 1.6232, test_f1: 0.5764
 epoch: 55, train_loss: 0.4336, test_loss: 1.7358, test_f1: 0.5527
 epoch: 56, train_loss: 0.4055, test_loss: 1.8521, test_f1: 0.5487
 epoch: 57, train_loss: 0.4179, test_loss: 2.0742, test_f1: 0.5293
 epoch: 58, train_loss: 0.3864, test_loss: 2.0872, test_f1: 0.4887
 epoch: 59, train_loss: 0.3800, test_loss: 1.9289, test_f1: 0.5513
 epoch: 60, train_loss: 0.3970, test_loss: 1.8106, test_f1: 0.5451
 epoch: 61, train_loss: 0.3776, test_loss: 1.9678, test_f1: 0.5420
 epoch: 62, train_loss: 0.3472, test_loss: 1.9074, test_f1: 0.5570
 epoch: 63, train_loss: 0.3858, test_loss: 1.7489, test_f1: 0.5977
 epoch: 64, train_loss: 0.3577, test_loss: 1.7379, test_f1: 0.5885
 epoch: 65, train_loss: 0.3463, test_loss: 1.8711, test_f1: 0.5368
 epoch: 66, train_loss: 0.3581, test_loss: 1.9839, test_f1: 0.5436
 epoch: 67, train_loss: 0.3561, test_loss: 2.1911, test_f1: 0.5296
 epoch: 68, train_loss: 0.3539, test_loss: 2.0154, test_f1: 0.5703
 epoch: 69, train_loss: 0.3839, test_loss: 1.8661, test_f1: 0.5536
 epoch: 70, train_loss: 0.3730, test_loss: 1.7707, test_f1: 0.5699
 epoch: 71, train_loss: 0.3644, test_loss: 1.9014, test_f1: 0.5813
 epoch: 72, train_loss: 0.3584, test_loss: 2.1482, test_f1: 0.5489
 epoch: 73, train_loss: 0.3692, test_loss: 2.1034, test_f1: 0.5656
 epoch: 74, train_loss: 0.3486, test_loss: 2.0939, test_f1: 0.5575
 epoch: 75, train_loss: 0.3577, test_loss: 2.1485, test_f1: 0.5614
 epoch: 76, train_loss: 0.3565, test_loss: 2.1087, test_f1: 0.5567
 epoch: 77, train_loss: 0.3500, test_loss: 2.0913, test_f1: 0.5558
 epoch: 78, train_loss: 0.3337, test_loss: 2.3994, test_f1: 0.5146
 epoch: 79, train_loss: 0.3374, test_loss: 2.2431, test_f1: 0.5392
 epoch: 80, train_loss: 0.3201, test_loss: 2.3144, test_f1: 0.5349
 epoch: 81, train_loss: 0.3333, test_loss: 2.1368, test_f1: 0.5572
 epoch: 82, train_loss: 0.3460, test_loss: 2.1030, test_f1: 0.5792
 epoch: 83, train_loss: 0.3502, test_loss: 1.9830, test_f1: 0.5904
 epoch: 84, train_loss: 0.3923, test_loss: 2.0395, test_f1: 0.5647
 epoch: 85, train_loss: 0.3457, test_loss: 2.3978, test_f1: 0.5362
 epoch: 86, train_loss: 0.3402, test_loss: 2.1933, test_f1: 0.5430
 epoch: 87, train_loss: 0.3795, test_loss: 2.1174, test_f1: 0.5279
 epoch: 88, train_loss: 0.3539, test_loss: 2.0737, test_f1: 0.5555
 epoch: 89, train_loss: 0.3517, test_loss: 2.2206, test_f1: 0.5447
 epoch: 90, train_loss: 0.3398, test_loss: 2.3067, test_f1: 0.5317
 epoch: 91, train_loss: 0.3510, test_loss: 2.3365, test_f1: 0.5421
 epoch: 92, train_loss: 0.3454, test_loss: 2.3560, test_f1: 0.5287
 epoch: 93, train_loss: 0.3309, test_loss: 2.1929, test_f1: 0.5188
 epoch: 94, train_loss: 0.3407, test_loss: 2.1757, test_f1: 0.5600
 epoch: 95, train_loss: 0.3509, test_loss: 2.3345, test_f1: 0.4866
 epoch: 96, train_loss: 0.3422, test_loss: 2.2670, test_f1: 0.5065
 epoch: 97, train_loss: 0.3371, test_loss: 2.0109, test_f1: 0.5526
 epoch: 98, train_loss: 0.3364, test_loss: 2.0186, test_f1: 0.5984
 epoch: 99, train_loss: 0.2829, test_loss: 1.9204, test_f1: 0.5912
##################ITERATION #9 ****************************************
 epoch: 0, train_loss: 1.2829, test_loss: 1.4194, test_f1: 0.2110
 epoch: 1, train_loss: 1.0881, test_loss: 1.3674, test_f1: 0.1786
 epoch: 2, train_loss: 1.0145, test_loss: 1.3117, test_f1: 0.1931
 epoch: 3, train_loss: 0.9790, test_loss: 1.2574, test_f1: 0.2886
 epoch: 4, train_loss: 0.9130, test_loss: 1.1694, test_f1: 0.4287
 epoch: 5, train_loss: 0.8927, test_loss: 1.1287, test_f1: 0.5000
 epoch: 6, train_loss: 0.8877, test_loss: 1.1421, test_f1: 0.5278
 epoch: 7, train_loss: 0.8538, test_loss: 1.1468, test_f1: 0.5370
 epoch: 8, train_loss: 0.8334, test_loss: 1.1693, test_f1: 0.4571
 epoch: 9, train_loss: 0.8120, test_loss: 1.2143, test_f1: 0.5019
 epoch: 10, train_loss: 0.7915, test_loss: 1.1447, test_f1: 0.5645
 epoch: 11, train_loss: 0.7756, test_loss: 1.2077, test_f1: 0.5058
 epoch: 12, train_loss: 0.7404, test_loss: 1.3101, test_f1: 0.5254
 epoch: 13, train_loss: 0.7229, test_loss: 1.2064, test_f1: 0.5884
 epoch: 14, train_loss: 0.7283, test_loss: 1.2892, test_f1: 0.5706
 epoch: 15, train_loss: 0.7082, test_loss: 1.3984, test_f1: 0.5875
 epoch: 16, train_loss: 0.6867, test_loss: 1.3029, test_f1: 0.5413
 epoch: 17, train_loss: 0.6744, test_loss: 1.1805, test_f1: 0.5976
 epoch: 18, train_loss: 0.6775, test_loss: 1.4452, test_f1: 0.5051
 epoch: 19, train_loss: 0.6795, test_loss: 1.2856, test_f1: 0.5093
 epoch: 20, train_loss: 0.6671, test_loss: 1.3452, test_f1: 0.5316
 epoch: 21, train_loss: 0.7000, test_loss: 1.4966, test_f1: 0.5019
 epoch: 22, train_loss: 0.6877, test_loss: 1.3202, test_f1: 0.5971
 epoch: 23, train_loss: 0.6879, test_loss: 1.4663, test_f1: 0.5808
 epoch: 24, train_loss: 0.6488, test_loss: 1.3474, test_f1: 0.5427
 epoch: 25, train_loss: 0.6328, test_loss: 1.2414, test_f1: 0.6004
 epoch: 26, train_loss: 0.6215, test_loss: 1.3439, test_f1: 0.6009
 epoch: 27, train_loss: 0.6119, test_loss: 1.4861, test_f1: 0.5336
 epoch: 28, train_loss: 0.6067, test_loss: 1.6422, test_f1: 0.5709
 epoch: 29, train_loss: 0.6284, test_loss: 1.5148, test_f1: 0.5645
 epoch: 30, train_loss: 0.6265, test_loss: 1.2627, test_f1: 0.5921
 epoch: 31, train_loss: 0.6054, test_loss: 1.2927, test_f1: 0.5667
 epoch: 32, train_loss: 0.6307, test_loss: 1.3138, test_f1: 0.5595
 epoch: 33, train_loss: 0.5812, test_loss: 1.4150, test_f1: 0.5781
 epoch: 34, train_loss: 0.6029, test_loss: 1.5945, test_f1: 0.5400
 epoch: 35, train_loss: 0.5874, test_loss: 1.6136, test_f1: 0.5590
 epoch: 36, train_loss: 0.5580, test_loss: 1.4925, test_f1: 0.6359
 epoch: 37, train_loss: 0.5572, test_loss: 1.4826, test_f1: 0.5688
 epoch: 38, train_loss: 0.5185, test_loss: 1.4501, test_f1: 0.6138
 epoch: 39, train_loss: 0.5281, test_loss: 1.4337, test_f1: 0.6053
 epoch: 40, train_loss: 0.5233, test_loss: 1.3662, test_f1: 0.5886
 epoch: 41, train_loss: 0.5332, test_loss: 1.3062, test_f1: 0.5951
 epoch: 42, train_loss: 0.5097, test_loss: 1.3895, test_f1: 0.5884
 epoch: 43, train_loss: 0.5025, test_loss: 1.3927, test_f1: 0.5913
 epoch: 44, train_loss: 0.4803, test_loss: 1.6729, test_f1: 0.5518
 epoch: 45, train_loss: 0.5102, test_loss: 1.5839, test_f1: 0.5252
 epoch: 46, train_loss: 0.5607, test_loss: 1.4892, test_f1: 0.5435
 epoch: 47, train_loss: 0.5262, test_loss: 1.3778, test_f1: 0.5819
 epoch: 48, train_loss: 0.5195, test_loss: 1.4113, test_f1: 0.5615
 epoch: 49, train_loss: 0.5025, test_loss: 1.3012, test_f1: 0.5265
 epoch: 50, train_loss: 0.5068, test_loss: 1.2941, test_f1: 0.5505
 epoch: 51, train_loss: 0.4948, test_loss: 1.5307, test_f1: 0.5483
 epoch: 52, train_loss: 0.4616, test_loss: 1.5592, test_f1: 0.5308
 epoch: 53, train_loss: 0.4527, test_loss: 1.3583, test_f1: 0.5881
 epoch: 54, train_loss: 0.4271, test_loss: 1.3276, test_f1: 0.5721
 epoch: 55, train_loss: 0.4171, test_loss: 1.4294, test_f1: 0.5572
 epoch: 56, train_loss: 0.4009, test_loss: 1.5308, test_f1: 0.5551
 epoch: 57, train_loss: 0.3961, test_loss: 1.5290, test_f1: 0.5684
 epoch: 58, train_loss: 0.3733, test_loss: 1.5316, test_f1: 0.5691
 epoch: 59, train_loss: 0.3992, test_loss: 1.5388, test_f1: 0.5843
 epoch: 60, train_loss: 0.4110, test_loss: 1.5469, test_f1: 0.5665
 epoch: 61, train_loss: 0.4058, test_loss: 1.5902, test_f1: 0.5718
 epoch: 62, train_loss: 0.4078, test_loss: 1.6403, test_f1: 0.5368
 epoch: 63, train_loss: 0.3990, test_loss: 1.6710, test_f1: 0.5430
 epoch: 64, train_loss: 0.3892, test_loss: 1.5762, test_f1: 0.5096
 epoch: 65, train_loss: 0.3789, test_loss: 1.5829, test_f1: 0.5479
 epoch: 66, train_loss: 0.4132, test_loss: 1.6986, test_f1: 0.5133
 epoch: 67, train_loss: 0.3545, test_loss: 1.6189, test_f1: 0.5455
 epoch: 68, train_loss: 0.3506, test_loss: 1.5775, test_f1: 0.5690
 epoch: 69, train_loss: 0.3333, test_loss: 1.5737, test_f1: 0.5680
 epoch: 70, train_loss: 0.3551, test_loss: 1.7125, test_f1: 0.5539
 epoch: 71, train_loss: 0.3605, test_loss: 1.7051, test_f1: 0.5539
 epoch: 72, train_loss: 0.3810, test_loss: 1.6059, test_f1: 0.5572
 epoch: 73, train_loss: 0.3728, test_loss: 1.5630, test_f1: 0.5707
 epoch: 74, train_loss: 0.3548, test_loss: 1.6694, test_f1: 0.5608
 epoch: 75, train_loss: 0.3705, test_loss: 1.6399, test_f1: 0.5725
 epoch: 76, train_loss: 0.3611, test_loss: 1.5693, test_f1: 0.5734
 epoch: 77, train_loss: 0.3557, test_loss: 1.6401, test_f1: 0.5675
 epoch: 78, train_loss: 0.3386, test_loss: 1.6319, test_f1: 0.5774
 epoch: 79, train_loss: 0.3262, test_loss: 1.6541, test_f1: 0.5703
 epoch: 80, train_loss: 0.3284, test_loss: 1.6949, test_f1: 0.5924
 epoch: 81, train_loss: 0.3496, test_loss: 1.6470, test_f1: 0.5897
 epoch: 82, train_loss: 0.3241, test_loss: 1.7748, test_f1: 0.5757
 epoch: 83, train_loss: 0.3444, test_loss: 1.8124, test_f1: 0.5744
 epoch: 84, train_loss: 0.3428, test_loss: 1.9585, test_f1: 0.5550
 epoch: 85, train_loss: 0.3008, test_loss: 1.8951, test_f1: 0.5729
 epoch: 86, train_loss: 0.3113, test_loss: 1.8014, test_f1: 0.5621
 epoch: 87, train_loss: 0.3491, test_loss: 1.7859, test_f1: 0.5308
 epoch: 88, train_loss: 0.3540, test_loss: 1.7719, test_f1: 0.5631
 epoch: 89, train_loss: 0.3447, test_loss: 1.8048, test_f1: 0.5916
 epoch: 90, train_loss: 0.3292, test_loss: 1.7257, test_f1: 0.5511
 epoch: 91, train_loss: 0.3258, test_loss: 1.7111, test_f1: 0.5704
 epoch: 92, train_loss: 0.3139, test_loss: 1.6677, test_f1: 0.5718
 epoch: 93, train_loss: 0.3097, test_loss: 1.7219, test_f1: 0.5628
 epoch: 94, train_loss: 0.2886, test_loss: 1.7319, test_f1: 0.5976
 epoch: 95, train_loss: 0.2927, test_loss: 1.7014, test_f1: 0.5964
 epoch: 96, train_loss: 0.2922, test_loss: 1.7564, test_f1: 0.5985
 epoch: 97, train_loss: 0.2788, test_loss: 1.7905, test_f1: 0.5856
 epoch: 98, train_loss: 0.2764, test_loss: 1.8841, test_f1: 0.5607
 epoch: 99, train_loss: 0.2967, test_loss: 1.8848, test_f1: 0.5742

Training completed in 308.32 seconds
Best F1: 0.6359 at epoch 36
Mean F1 across iterations: 0.6176  0.0104
========================FINAL RESULTS================================
FEGIN weighted F1: 0.6359  0.0104
python main.py --data ltspice_demos --representation component_component --model FEGIN --layers 5 --hiddens 128 --batch_size 256 --lr 0.001 --emb_size 512 --epochs 100 --save_appendix component_component_L5_H128_BS256_LR0.001_E512 --no_val
-----



STDERR:
  File "main.py", line 370, in <module>
    main()
  File "main.py", line 254, in main
    dataset = dataset_class(
  File "/home/philip/projects/ltspice_examples_code_repo/Circuit-Completion-Using-GNNs/component_classification_with_link_prediction_head/evaluation/FEGIN/kernel/circuit_datasets.py", line 15, in __init__
    self.data, self.slices = torch.load(self.processed_paths[0])
  File "/home/philip/.local/lib/python3.8/site-packages/torch/serialization.py", line 1040, in load
    warnings.warn(
  File "/usr/lib/python3.8/warnings.py", line 109, in _showwarnmsg
    sw(msg.message, msg.category, msg.filename, msg.lineno,
  File "main.py", line 47, in warn_with_traceback
    traceback.print_stack(file=log)
/home/philip/projects/ltspice_examples_code_repo/Circuit-Completion-Using-GNNs/component_classification_with_link_prediction_head/evaluation/FEGIN/kernel/circuit_datasets.py:15: FutureWarning: You are using `torch.load` with `weights_only=False` (the current default value), which uses the default pickle module implicitly. It is possible to construct malicious pickle data which will execute arbitrary code during unpickling (See https://github.com/pytorch/pytorch/blob/main/SECURITY.md#untrusted-models for more details). In a future release, the default value for `weights_only` will be flipped to `True`. This limits the functions that could be executed during unpickling. Arbitrary objects will no longer be allowed to be loaded via this mode unless they are explicitly allowlisted by the user via `torch.serialization.add_safe_globals`. We recommend you start setting `weights_only=True` for any use case where you don't have full control of the loaded file. Please open an issue on GitHub for any issues related to this experimental feature.
  self.data, self.slices = torch.load(self.processed_paths[0])
