STDOUT:
Results will be saved in /home/philip/projects/ltspice_examples_code_repo/Circuit-Completion-Using-GNNs/component_classification_with_link_prediction_head/evaluation/FEGIN/results/model_FEGIN_dataset_ltspice_examples
Command line input: python main.py --data ltspice_examples --representation component_net --model FEGIN --layers 2 --hiddens 16 --batch_size 32 --lr 0.001 --emb_size 250 --epochs 100 --save_appendix component_net_L2_H16_BS32_LR0.001_E250 --no_val
 is saved.
-----
ltspice_examples - FEGIN
Using 2 layers, 16 hidden units, h = 2
Loading component_net representation dataset
ENTERED
Training FEGIN on component_net representation
Train: 3558, Test: 846
##################ITERATION #0 ****************************************
 epoch: 0, train_loss: 1.3459, test_loss: 1.2617, test_f1: 0.2270
 epoch: 1, train_loss: 1.2492, test_loss: 1.2114, test_f1: 0.2311
 epoch: 2, train_loss: 1.2042, test_loss: 1.1426, test_f1: 0.3654
 epoch: 3, train_loss: 1.1493, test_loss: 1.0792, test_f1: 0.3730
 epoch: 4, train_loss: 1.0913, test_loss: 1.0425, test_f1: 0.3485
 epoch: 5, train_loss: 1.0676, test_loss: 1.0315, test_f1: 0.3561
 epoch: 6, train_loss: 1.0460, test_loss: 1.0371, test_f1: 0.3653
 epoch: 7, train_loss: 1.0398, test_loss: 1.0063, test_f1: 0.3518
 epoch: 8, train_loss: 1.0315, test_loss: 1.0279, test_f1: 0.4325
 epoch: 9, train_loss: 1.0188, test_loss: 0.9762, test_f1: 0.4356
 epoch: 10, train_loss: 1.0063, test_loss: 0.9978, test_f1: 0.4662
 epoch: 11, train_loss: 0.9972, test_loss: 0.9976, test_f1: 0.4963
 epoch: 12, train_loss: 0.9948, test_loss: 0.9871, test_f1: 0.4572
 epoch: 13, train_loss: 0.9990, test_loss: 0.9707, test_f1: 0.4421
 epoch: 14, train_loss: 0.9905, test_loss: 0.9378, test_f1: 0.4763
 epoch: 15, train_loss: 0.9771, test_loss: 0.9402, test_f1: 0.4977
 epoch: 16, train_loss: 0.9743, test_loss: 0.9548, test_f1: 0.4571
 epoch: 17, train_loss: 0.9703, test_loss: 0.9411, test_f1: 0.5009
 epoch: 18, train_loss: 0.9638, test_loss: 0.9303, test_f1: 0.4886
 epoch: 19, train_loss: 0.9713, test_loss: 0.9332, test_f1: 0.4963
 epoch: 20, train_loss: 0.9633, test_loss: 0.9812, test_f1: 0.4658
 epoch: 21, train_loss: 0.9651, test_loss: 0.9474, test_f1: 0.4701
 epoch: 22, train_loss: 0.9523, test_loss: 0.9352, test_f1: 0.4881
 epoch: 23, train_loss: 0.9480, test_loss: 0.9905, test_f1: 0.4814
 epoch: 24, train_loss: 0.9604, test_loss: 0.9351, test_f1: 0.4870
 epoch: 25, train_loss: 0.9577, test_loss: 0.9329, test_f1: 0.4912
 epoch: 26, train_loss: 0.9474, test_loss: 0.9423, test_f1: 0.5044
 epoch: 27, train_loss: 0.9388, test_loss: 0.9541, test_f1: 0.4889
 epoch: 28, train_loss: 0.9327, test_loss: 0.9199, test_f1: 0.5033
 epoch: 29, train_loss: 0.9379, test_loss: 0.9075, test_f1: 0.4915
 epoch: 30, train_loss: 0.9300, test_loss: 0.9558, test_f1: 0.4743
 epoch: 31, train_loss: 0.9298, test_loss: 0.9092, test_f1: 0.5098
 epoch: 32, train_loss: 0.9316, test_loss: 0.9398, test_f1: 0.5122
 epoch: 33, train_loss: 0.9289, test_loss: 0.9063, test_f1: 0.5205
 epoch: 34, train_loss: 0.9141, test_loss: 0.9680, test_f1: 0.4951
 epoch: 35, train_loss: 0.9310, test_loss: 0.9081, test_f1: 0.4903
 epoch: 36, train_loss: 0.9176, test_loss: 0.8876, test_f1: 0.5088
 epoch: 37, train_loss: 0.9135, test_loss: 0.9127, test_f1: 0.5032
 epoch: 38, train_loss: 0.9227, test_loss: 0.9172, test_f1: 0.5222
 epoch: 39, train_loss: 0.9170, test_loss: 0.9638, test_f1: 0.5018
 epoch: 40, train_loss: 0.9043, test_loss: 0.9500, test_f1: 0.5057
 epoch: 41, train_loss: 0.9106, test_loss: 0.9728, test_f1: 0.4970
 epoch: 42, train_loss: 0.9070, test_loss: 0.9229, test_f1: 0.5170
 epoch: 43, train_loss: 0.9065, test_loss: 0.9080, test_f1: 0.5192
 epoch: 44, train_loss: 0.9053, test_loss: 0.9257, test_f1: 0.5109
 epoch: 45, train_loss: 0.9045, test_loss: 0.9081, test_f1: 0.5084
 epoch: 46, train_loss: 0.9085, test_loss: 0.9332, test_f1: 0.5111
 epoch: 47, train_loss: 0.8874, test_loss: 0.8854, test_f1: 0.5245
 epoch: 48, train_loss: 0.8998, test_loss: 0.9407, test_f1: 0.5042
 epoch: 49, train_loss: 0.9072, test_loss: 0.8918, test_f1: 0.5138
 epoch: 50, train_loss: 0.8956, test_loss: 1.0069, test_f1: 0.5171
 epoch: 51, train_loss: 0.8866, test_loss: 0.8866, test_f1: 0.5179
 epoch: 52, train_loss: 0.8783, test_loss: 0.9189, test_f1: 0.5135
 epoch: 53, train_loss: 0.8937, test_loss: 0.9433, test_f1: 0.4890
 epoch: 54, train_loss: 0.8833, test_loss: 0.9153, test_f1: 0.5114
 epoch: 55, train_loss: 0.8732, test_loss: 0.9106, test_f1: 0.5125
 epoch: 56, train_loss: 0.8815, test_loss: 0.9824, test_f1: 0.5038
 epoch: 57, train_loss: 0.8785, test_loss: 0.9006, test_f1: 0.5248
 epoch: 58, train_loss: 0.8786, test_loss: 0.9172, test_f1: 0.5228
 epoch: 59, train_loss: 0.8747, test_loss: 0.9380, test_f1: 0.5310
 epoch: 60, train_loss: 0.8782, test_loss: 0.9362, test_f1: 0.5244
 epoch: 61, train_loss: 0.8830, test_loss: 0.9483, test_f1: 0.5180
 epoch: 62, train_loss: 0.8770, test_loss: 0.9274, test_f1: 0.5309
 epoch: 63, train_loss: 0.8610, test_loss: 0.9022, test_f1: 0.5243
 epoch: 64, train_loss: 0.8873, test_loss: 0.9269, test_f1: 0.5457
 epoch: 65, train_loss: 0.8706, test_loss: 0.9209, test_f1: 0.5118
 epoch: 66, train_loss: 0.8695, test_loss: 0.9317, test_f1: 0.5538
 epoch: 67, train_loss: 0.8682, test_loss: 0.9610, test_f1: 0.5367
 epoch: 68, train_loss: 0.8631, test_loss: 0.9265, test_f1: 0.5301
 epoch: 69, train_loss: 0.8625, test_loss: 0.9416, test_f1: 0.5252
 epoch: 70, train_loss: 0.8669, test_loss: 0.9108, test_f1: 0.5408
 epoch: 71, train_loss: 0.8633, test_loss: 0.9499, test_f1: 0.5152
 epoch: 72, train_loss: 0.8663, test_loss: 0.9318, test_f1: 0.5248
 epoch: 73, train_loss: 0.8592, test_loss: 0.9416, test_f1: 0.5411
 epoch: 74, train_loss: 0.8609, test_loss: 0.9051, test_f1: 0.5314
 epoch: 75, train_loss: 0.8585, test_loss: 0.9360, test_f1: 0.5207
 epoch: 76, train_loss: 0.8635, test_loss: 0.9547, test_f1: 0.5431
 epoch: 77, train_loss: 0.8557, test_loss: 0.9296, test_f1: 0.5465
 epoch: 78, train_loss: 0.8642, test_loss: 0.9403, test_f1: 0.5305
 epoch: 79, train_loss: 0.8598, test_loss: 0.9419, test_f1: 0.5419
 epoch: 80, train_loss: 0.8614, test_loss: 0.9218, test_f1: 0.5235
 epoch: 81, train_loss: 0.8649, test_loss: 0.9148, test_f1: 0.5423
 epoch: 82, train_loss: 0.8545, test_loss: 0.9319, test_f1: 0.5434
 epoch: 83, train_loss: 0.8616, test_loss: 0.9566, test_f1: 0.5214
 epoch: 84, train_loss: 0.8473, test_loss: 0.9528, test_f1: 0.5210
 epoch: 85, train_loss: 0.8531, test_loss: 0.9870, test_f1: 0.5159
 epoch: 86, train_loss: 0.8500, test_loss: 0.9615, test_f1: 0.5460
 epoch: 87, train_loss: 0.8569, test_loss: 0.9525, test_f1: 0.5438
 epoch: 88, train_loss: 0.8571, test_loss: 0.9312, test_f1: 0.5363
 epoch: 89, train_loss: 0.8605, test_loss: 0.9427, test_f1: 0.5447
 epoch: 90, train_loss: 0.8469, test_loss: 0.9263, test_f1: 0.5507
 epoch: 91, train_loss: 0.8514, test_loss: 0.9645, test_f1: 0.5320
 epoch: 92, train_loss: 0.8471, test_loss: 0.9326, test_f1: 0.5313
 epoch: 93, train_loss: 0.8566, test_loss: 0.9373, test_f1: 0.5390
 epoch: 94, train_loss: 0.8564, test_loss: 0.9283, test_f1: 0.5470
 epoch: 95, train_loss: 0.8582, test_loss: 0.9233, test_f1: 0.5632
 epoch: 96, train_loss: 0.8514, test_loss: 0.9522, test_f1: 0.5578
 epoch: 97, train_loss: 0.8598, test_loss: 0.9413, test_f1: 0.5554
 epoch: 98, train_loss: 0.8559, test_loss: 0.9779, test_f1: 0.5605
 epoch: 99, train_loss: 0.8537, test_loss: 0.9187, test_f1: 0.5447
##################ITERATION #1 ****************************************
 epoch: 0, train_loss: 1.2347, test_loss: 1.1487, test_f1: 0.2767
 epoch: 1, train_loss: 1.1460, test_loss: 1.0703, test_f1: 0.3584
 epoch: 2, train_loss: 1.0897, test_loss: 1.0543, test_f1: 0.3974
 epoch: 3, train_loss: 1.0665, test_loss: 1.0508, test_f1: 0.4060
 epoch: 4, train_loss: 1.0443, test_loss: 1.0455, test_f1: 0.4195
 epoch: 5, train_loss: 1.0243, test_loss: 1.0231, test_f1: 0.4339
 epoch: 6, train_loss: 1.0195, test_loss: 1.0175, test_f1: 0.4665
 epoch: 7, train_loss: 1.0158, test_loss: 0.9939, test_f1: 0.4727
 epoch: 8, train_loss: 1.0007, test_loss: 1.0041, test_f1: 0.4910
 epoch: 9, train_loss: 0.9948, test_loss: 0.9926, test_f1: 0.4820
 epoch: 10, train_loss: 0.9903, test_loss: 0.9978, test_f1: 0.5006
 epoch: 11, train_loss: 0.9841, test_loss: 1.0113, test_f1: 0.4946
 epoch: 12, train_loss: 0.9823, test_loss: 0.9860, test_f1: 0.4847
 epoch: 13, train_loss: 0.9689, test_loss: 0.9879, test_f1: 0.4795
 epoch: 14, train_loss: 0.9607, test_loss: 0.9559, test_f1: 0.4979
 epoch: 15, train_loss: 0.9695, test_loss: 1.0162, test_f1: 0.4926
 epoch: 16, train_loss: 0.9690, test_loss: 1.0127, test_f1: 0.4930
 epoch: 17, train_loss: 0.9507, test_loss: 1.0172, test_f1: 0.4823
 epoch: 18, train_loss: 0.9591, test_loss: 1.0006, test_f1: 0.5006
 epoch: 19, train_loss: 0.9499, test_loss: 1.0381, test_f1: 0.4677
 epoch: 20, train_loss: 0.9461, test_loss: 1.0417, test_f1: 0.4956
 epoch: 21, train_loss: 0.9334, test_loss: 1.0283, test_f1: 0.4976
 epoch: 22, train_loss: 0.9475, test_loss: 1.0394, test_f1: 0.4971
 epoch: 23, train_loss: 0.9396, test_loss: 0.9783, test_f1: 0.5011
 epoch: 24, train_loss: 0.9442, test_loss: 0.9660, test_f1: 0.5159
 epoch: 25, train_loss: 0.9338, test_loss: 0.9987, test_f1: 0.5157
 epoch: 26, train_loss: 0.9329, test_loss: 0.9970, test_f1: 0.4847
 epoch: 27, train_loss: 0.9294, test_loss: 1.0107, test_f1: 0.5238
 epoch: 28, train_loss: 0.9187, test_loss: 0.9986, test_f1: 0.5117
 epoch: 29, train_loss: 0.9157, test_loss: 0.9720, test_f1: 0.5245
 epoch: 30, train_loss: 0.9219, test_loss: 0.9935, test_f1: 0.5165
 epoch: 31, train_loss: 0.9260, test_loss: 0.9775, test_f1: 0.5006
 epoch: 32, train_loss: 0.9192, test_loss: 0.9719, test_f1: 0.5214
 epoch: 33, train_loss: 0.9214, test_loss: 0.9826, test_f1: 0.5146
 epoch: 34, train_loss: 0.9124, test_loss: 0.9927, test_f1: 0.5151
 epoch: 35, train_loss: 0.9168, test_loss: 0.9820, test_f1: 0.5018
 epoch: 36, train_loss: 0.9122, test_loss: 1.0039, test_f1: 0.5119
 epoch: 37, train_loss: 0.9097, test_loss: 1.0117, test_f1: 0.5142
 epoch: 38, train_loss: 0.9121, test_loss: 0.9622, test_f1: 0.5320
 epoch: 39, train_loss: 0.8999, test_loss: 0.9758, test_f1: 0.5259
 epoch: 40, train_loss: 0.9102, test_loss: 0.9827, test_f1: 0.5214
 epoch: 41, train_loss: 0.9098, test_loss: 0.9837, test_f1: 0.5112
 epoch: 42, train_loss: 0.9080, test_loss: 0.9753, test_f1: 0.5307
 epoch: 43, train_loss: 0.8860, test_loss: 0.9569, test_f1: 0.5245
 epoch: 44, train_loss: 0.8924, test_loss: 0.9681, test_f1: 0.5232
 epoch: 45, train_loss: 0.8860, test_loss: 0.9593, test_f1: 0.5247
 epoch: 46, train_loss: 0.8983, test_loss: 0.9789, test_f1: 0.5064
 epoch: 47, train_loss: 0.9007, test_loss: 0.9818, test_f1: 0.5228
 epoch: 48, train_loss: 0.8933, test_loss: 0.9559, test_f1: 0.5064
 epoch: 49, train_loss: 0.9000, test_loss: 0.9437, test_f1: 0.5354
 epoch: 50, train_loss: 0.8770, test_loss: 0.9466, test_f1: 0.5219
 epoch: 51, train_loss: 0.8740, test_loss: 0.9425, test_f1: 0.5373
 epoch: 52, train_loss: 0.8822, test_loss: 0.9454, test_f1: 0.5307
 epoch: 53, train_loss: 0.8799, test_loss: 0.9309, test_f1: 0.5184
 epoch: 54, train_loss: 0.8723, test_loss: 0.9304, test_f1: 0.5343
 epoch: 55, train_loss: 0.8748, test_loss: 0.9420, test_f1: 0.5309
 epoch: 56, train_loss: 0.8825, test_loss: 0.9424, test_f1: 0.5276
 epoch: 57, train_loss: 0.8820, test_loss: 0.9409, test_f1: 0.5369
 epoch: 58, train_loss: 0.8815, test_loss: 0.9494, test_f1: 0.5373
 epoch: 59, train_loss: 0.8699, test_loss: 0.9478, test_f1: 0.5306
 epoch: 60, train_loss: 0.8590, test_loss: 0.9566, test_f1: 0.5275
 epoch: 61, train_loss: 0.8779, test_loss: 0.9522, test_f1: 0.5378
 epoch: 62, train_loss: 0.8790, test_loss: 0.9551, test_f1: 0.5414
 epoch: 63, train_loss: 0.8721, test_loss: 0.9482, test_f1: 0.5320
 epoch: 64, train_loss: 0.8707, test_loss: 0.9360, test_f1: 0.5376
 epoch: 65, train_loss: 0.8685, test_loss: 0.9459, test_f1: 0.5383
 epoch: 66, train_loss: 0.8757, test_loss: 0.9668, test_f1: 0.5283
 epoch: 67, train_loss: 0.8699, test_loss: 0.9463, test_f1: 0.5401
 epoch: 68, train_loss: 0.8625, test_loss: 0.9371, test_f1: 0.5397
 epoch: 69, train_loss: 0.8678, test_loss: 0.9490, test_f1: 0.5392
 epoch: 70, train_loss: 0.8674, test_loss: 0.9385, test_f1: 0.5400
 epoch: 71, train_loss: 0.8656, test_loss: 0.9190, test_f1: 0.5397
 epoch: 72, train_loss: 0.8611, test_loss: 0.9412, test_f1: 0.5287
 epoch: 73, train_loss: 0.8613, test_loss: 0.9381, test_f1: 0.5389
 epoch: 74, train_loss: 0.8627, test_loss: 0.9235, test_f1: 0.5444
 epoch: 75, train_loss: 0.8611, test_loss: 0.9393, test_f1: 0.5376
 epoch: 76, train_loss: 0.8588, test_loss: 0.9640, test_f1: 0.5402
 epoch: 77, train_loss: 0.8531, test_loss: 0.9604, test_f1: 0.5363
 epoch: 78, train_loss: 0.8576, test_loss: 0.9290, test_f1: 0.5399
 epoch: 79, train_loss: 0.8653, test_loss: 0.9413, test_f1: 0.5428
 epoch: 80, train_loss: 0.8541, test_loss: 0.9241, test_f1: 0.5405
 epoch: 81, train_loss: 0.8607, test_loss: 0.9384, test_f1: 0.5276
 epoch: 82, train_loss: 0.8612, test_loss: 0.9643, test_f1: 0.5215
 epoch: 83, train_loss: 0.8639, test_loss: 0.9520, test_f1: 0.5322
 epoch: 84, train_loss: 0.8523, test_loss: 0.9126, test_f1: 0.5386
 epoch: 85, train_loss: 0.8410, test_loss: 0.9341, test_f1: 0.5339
 epoch: 86, train_loss: 0.8602, test_loss: 0.9497, test_f1: 0.5354
 epoch: 87, train_loss: 0.8537, test_loss: 0.9300, test_f1: 0.5419
 epoch: 88, train_loss: 0.8500, test_loss: 0.9323, test_f1: 0.5385
 epoch: 89, train_loss: 0.8570, test_loss: 0.9462, test_f1: 0.5313
 epoch: 90, train_loss: 0.8488, test_loss: 0.9322, test_f1: 0.5383
 epoch: 91, train_loss: 0.8486, test_loss: 0.9519, test_f1: 0.5317
 epoch: 92, train_loss: 0.8592, test_loss: 0.9364, test_f1: 0.5370
 epoch: 93, train_loss: 0.8593, test_loss: 0.9458, test_f1: 0.5356
 epoch: 94, train_loss: 0.8517, test_loss: 0.9344, test_f1: 0.5444
 epoch: 95, train_loss: 0.8589, test_loss: 0.9177, test_f1: 0.5384
 epoch: 96, train_loss: 0.8402, test_loss: 0.9166, test_f1: 0.5452
 epoch: 97, train_loss: 0.8591, test_loss: 0.9490, test_f1: 0.5416
 epoch: 98, train_loss: 0.8574, test_loss: 0.9272, test_f1: 0.5302
 epoch: 99, train_loss: 0.8449, test_loss: 0.9319, test_f1: 0.5443
##################ITERATION #2 ****************************************
 epoch: 0, train_loss: 1.2212, test_loss: 1.1114, test_f1: 0.3672
 epoch: 1, train_loss: 1.1199, test_loss: 1.0495, test_f1: 0.3979
 epoch: 2, train_loss: 1.0708, test_loss: 1.0297, test_f1: 0.4347
 epoch: 3, train_loss: 1.0394, test_loss: 1.0055, test_f1: 0.4762
 epoch: 4, train_loss: 1.0185, test_loss: 1.0131, test_f1: 0.4534
 epoch: 5, train_loss: 1.0081, test_loss: 1.0050, test_f1: 0.4815
 epoch: 6, train_loss: 0.9946, test_loss: 0.9979, test_f1: 0.5032
 epoch: 7, train_loss: 0.9777, test_loss: 0.9765, test_f1: 0.4936
 epoch: 8, train_loss: 0.9840, test_loss: 0.9879, test_f1: 0.5065
 epoch: 9, train_loss: 0.9748, test_loss: 0.9593, test_f1: 0.5267
 epoch: 10, train_loss: 0.9741, test_loss: 0.9664, test_f1: 0.4463
 epoch: 11, train_loss: 0.9560, test_loss: 0.9559, test_f1: 0.5330
 epoch: 12, train_loss: 0.9507, test_loss: 0.9555, test_f1: 0.4984
 epoch: 13, train_loss: 0.9537, test_loss: 0.9543, test_f1: 0.5088
 epoch: 14, train_loss: 0.9532, test_loss: 0.9244, test_f1: 0.5479
 epoch: 15, train_loss: 0.9309, test_loss: 0.9729, test_f1: 0.5145
 epoch: 16, train_loss: 0.9464, test_loss: 0.9903, test_f1: 0.5063
 epoch: 17, train_loss: 0.9324, test_loss: 0.9577, test_f1: 0.4838
 epoch: 18, train_loss: 0.9421, test_loss: 0.9720, test_f1: 0.4934
 epoch: 19, train_loss: 0.9232, test_loss: 0.9579, test_f1: 0.5143
 epoch: 20, train_loss: 0.9262, test_loss: 0.9416, test_f1: 0.5017
 epoch: 21, train_loss: 0.9285, test_loss: 0.9309, test_f1: 0.5152
 epoch: 22, train_loss: 0.9153, test_loss: 0.9275, test_f1: 0.5277
 epoch: 23, train_loss: 0.9179, test_loss: 0.9251, test_f1: 0.5121
 epoch: 24, train_loss: 0.9167, test_loss: 0.9616, test_f1: 0.5141
 epoch: 25, train_loss: 0.9191, test_loss: 0.9539, test_f1: 0.5052
 epoch: 26, train_loss: 0.9034, test_loss: 0.9391, test_f1: 0.5195
 epoch: 27, train_loss: 0.9101, test_loss: 0.9266, test_f1: 0.5164
 epoch: 28, train_loss: 0.9096, test_loss: 0.9186, test_f1: 0.5159
 epoch: 29, train_loss: 0.9069, test_loss: 0.9406, test_f1: 0.5144
 epoch: 30, train_loss: 0.8989, test_loss: 0.9327, test_f1: 0.4978
 epoch: 31, train_loss: 0.9036, test_loss: 0.9122, test_f1: 0.5237
 epoch: 32, train_loss: 0.8950, test_loss: 0.9277, test_f1: 0.5111
 epoch: 33, train_loss: 0.8875, test_loss: 0.9816, test_f1: 0.4906
 epoch: 34, train_loss: 0.9030, test_loss: 0.9425, test_f1: 0.5397
 epoch: 35, train_loss: 0.8857, test_loss: 0.9476, test_f1: 0.5197
 epoch: 36, train_loss: 0.8932, test_loss: 0.9458, test_f1: 0.5067
 epoch: 37, train_loss: 0.8902, test_loss: 0.9207, test_f1: 0.5110
 epoch: 38, train_loss: 0.8931, test_loss: 0.9486, test_f1: 0.5214
 epoch: 39, train_loss: 0.8811, test_loss: 0.9511, test_f1: 0.5192
 epoch: 40, train_loss: 0.8756, test_loss: 0.9382, test_f1: 0.5206
 epoch: 41, train_loss: 0.8791, test_loss: 0.9408, test_f1: 0.5222
 epoch: 42, train_loss: 0.8821, test_loss: 0.8922, test_f1: 0.5330
 epoch: 43, train_loss: 0.8814, test_loss: 0.9458, test_f1: 0.5163
 epoch: 44, train_loss: 0.8810, test_loss: 0.9322, test_f1: 0.5230
 epoch: 45, train_loss: 0.8775, test_loss: 0.9173, test_f1: 0.5272
 epoch: 46, train_loss: 0.8735, test_loss: 0.9580, test_f1: 0.5213
 epoch: 47, train_loss: 0.8701, test_loss: 0.9563, test_f1: 0.5222
 epoch: 48, train_loss: 0.8744, test_loss: 0.9721, test_f1: 0.5246
 epoch: 49, train_loss: 0.8714, test_loss: 0.9563, test_f1: 0.5248
 epoch: 50, train_loss: 0.8673, test_loss: 0.9072, test_f1: 0.5297
 epoch: 51, train_loss: 0.8570, test_loss: 0.9240, test_f1: 0.5233
 epoch: 52, train_loss: 0.8501, test_loss: 0.8906, test_f1: 0.5474
 epoch: 53, train_loss: 0.8601, test_loss: 0.9242, test_f1: 0.5489
 epoch: 54, train_loss: 0.8490, test_loss: 0.9424, test_f1: 0.5357
 epoch: 55, train_loss: 0.8481, test_loss: 0.9109, test_f1: 0.5351
 epoch: 56, train_loss: 0.8511, test_loss: 0.9453, test_f1: 0.5236
 epoch: 57, train_loss: 0.8394, test_loss: 0.9089, test_f1: 0.5447
 epoch: 58, train_loss: 0.8480, test_loss: 0.9375, test_f1: 0.5421
 epoch: 59, train_loss: 0.8459, test_loss: 0.9443, test_f1: 0.5485
 epoch: 60, train_loss: 0.8522, test_loss: 0.9341, test_f1: 0.5414
 epoch: 61, train_loss: 0.8427, test_loss: 0.9371, test_f1: 0.5276
 epoch: 62, train_loss: 0.8475, test_loss: 0.9481, test_f1: 0.5411
 epoch: 63, train_loss: 0.8453, test_loss: 0.9360, test_f1: 0.5508
 epoch: 64, train_loss: 0.8357, test_loss: 0.9297, test_f1: 0.5265
 epoch: 65, train_loss: 0.8462, test_loss: 0.9525, test_f1: 0.5492
 epoch: 66, train_loss: 0.8435, test_loss: 0.9265, test_f1: 0.5290
 epoch: 67, train_loss: 0.8330, test_loss: 0.9446, test_f1: 0.5157
 epoch: 68, train_loss: 0.8428, test_loss: 0.9112, test_f1: 0.5491
 epoch: 69, train_loss: 0.8347, test_loss: 0.9478, test_f1: 0.5389
 epoch: 70, train_loss: 0.8447, test_loss: 0.9127, test_f1: 0.5462
 epoch: 71, train_loss: 0.8460, test_loss: 0.9463, test_f1: 0.5354
 epoch: 72, train_loss: 0.8359, test_loss: 0.9190, test_f1: 0.5465
 epoch: 73, train_loss: 0.8406, test_loss: 0.8923, test_f1: 0.5542
 epoch: 74, train_loss: 0.8316, test_loss: 0.9315, test_f1: 0.5447
 epoch: 75, train_loss: 0.8491, test_loss: 0.9156, test_f1: 0.5546
 epoch: 76, train_loss: 0.8323, test_loss: 0.9366, test_f1: 0.5389
 epoch: 77, train_loss: 0.8320, test_loss: 0.9152, test_f1: 0.5454
 epoch: 78, train_loss: 0.8356, test_loss: 0.9015, test_f1: 0.5540
 epoch: 79, train_loss: 0.8306, test_loss: 0.9535, test_f1: 0.5281
 epoch: 80, train_loss: 0.8175, test_loss: 0.9278, test_f1: 0.5414
 epoch: 81, train_loss: 0.8313, test_loss: 0.9278, test_f1: 0.5379
 epoch: 82, train_loss: 0.8346, test_loss: 0.9730, test_f1: 0.5320
 epoch: 83, train_loss: 0.8296, test_loss: 0.9296, test_f1: 0.5471
 epoch: 84, train_loss: 0.8213, test_loss: 0.9544, test_f1: 0.5467
 epoch: 85, train_loss: 0.8325, test_loss: 0.8991, test_f1: 0.5581
 epoch: 86, train_loss: 0.8275, test_loss: 0.9341, test_f1: 0.5411
 epoch: 87, train_loss: 0.8201, test_loss: 0.9284, test_f1: 0.5544
 epoch: 88, train_loss: 0.8278, test_loss: 0.9265, test_f1: 0.5463
 epoch: 89, train_loss: 0.8164, test_loss: 0.9805, test_f1: 0.5371
 epoch: 90, train_loss: 0.8168, test_loss: 0.9304, test_f1: 0.5294
 epoch: 91, train_loss: 0.8189, test_loss: 0.9580, test_f1: 0.5274
 epoch: 92, train_loss: 0.8032, test_loss: 0.9471, test_f1: 0.5450
 epoch: 93, train_loss: 0.8153, test_loss: 0.9505, test_f1: 0.5544
 epoch: 94, train_loss: 0.8222, test_loss: 0.9392, test_f1: 0.5504
 epoch: 95, train_loss: 0.8355, test_loss: 0.9193, test_f1: 0.5461
 epoch: 96, train_loss: 0.8165, test_loss: 0.9486, test_f1: 0.5540
 epoch: 97, train_loss: 0.8168, test_loss: 0.9336, test_f1: 0.5353
 epoch: 98, train_loss: 0.8275, test_loss: 0.9473, test_f1: 0.5503
 epoch: 99, train_loss: 0.8200, test_loss: 0.9669, test_f1: 0.5278
##################ITERATION #3 ****************************************
 epoch: 0, train_loss: 1.2311, test_loss: 1.1165, test_f1: 0.3421
 epoch: 1, train_loss: 1.1347, test_loss: 1.0544, test_f1: 0.4453
 epoch: 2, train_loss: 1.0981, test_loss: 1.0147, test_f1: 0.4534
 epoch: 3, train_loss: 1.0704, test_loss: 0.9944, test_f1: 0.4590
 epoch: 4, train_loss: 1.0411, test_loss: 1.0055, test_f1: 0.4386
 epoch: 5, train_loss: 1.0249, test_loss: 0.9883, test_f1: 0.4435
 epoch: 6, train_loss: 1.0188, test_loss: 0.9610, test_f1: 0.4522
 epoch: 7, train_loss: 1.0029, test_loss: 0.9811, test_f1: 0.4585
 epoch: 8, train_loss: 0.9874, test_loss: 0.9782, test_f1: 0.4482
 epoch: 9, train_loss: 0.9724, test_loss: 0.9540, test_f1: 0.4943
 epoch: 10, train_loss: 0.9735, test_loss: 0.9654, test_f1: 0.4933
 epoch: 11, train_loss: 0.9706, test_loss: 0.9669, test_f1: 0.5020
 epoch: 12, train_loss: 0.9832, test_loss: 0.9560, test_f1: 0.4992
 epoch: 13, train_loss: 0.9645, test_loss: 0.9535, test_f1: 0.4785
 epoch: 14, train_loss: 0.9692, test_loss: 0.9660, test_f1: 0.4874
 epoch: 15, train_loss: 0.9584, test_loss: 0.9884, test_f1: 0.4925
 epoch: 16, train_loss: 0.9431, test_loss: 0.9881, test_f1: 0.5005
 epoch: 17, train_loss: 0.9431, test_loss: 1.0073, test_f1: 0.4868
 epoch: 18, train_loss: 0.9433, test_loss: 0.9816, test_f1: 0.5014
 epoch: 19, train_loss: 0.9477, test_loss: 0.9680, test_f1: 0.4870
 epoch: 20, train_loss: 0.9303, test_loss: 0.9627, test_f1: 0.4954
 epoch: 21, train_loss: 0.9301, test_loss: 0.9692, test_f1: 0.4767
 epoch: 22, train_loss: 0.9377, test_loss: 0.9757, test_f1: 0.4892
 epoch: 23, train_loss: 0.9387, test_loss: 0.9380, test_f1: 0.5023
 epoch: 24, train_loss: 0.9434, test_loss: 0.9603, test_f1: 0.4943
 epoch: 25, train_loss: 0.9172, test_loss: 0.9432, test_f1: 0.4930
 epoch: 26, train_loss: 0.9280, test_loss: 0.9631, test_f1: 0.5067
 epoch: 27, train_loss: 0.9225, test_loss: 0.9579, test_f1: 0.5053
 epoch: 28, train_loss: 0.9193, test_loss: 0.9695, test_f1: 0.4925
 epoch: 29, train_loss: 0.9215, test_loss: 0.9572, test_f1: 0.4962
 epoch: 30, train_loss: 0.9215, test_loss: 0.9399, test_f1: 0.5021
 epoch: 31, train_loss: 0.9189, test_loss: 0.9514, test_f1: 0.4849
 epoch: 32, train_loss: 0.9042, test_loss: 0.9245, test_f1: 0.5168
 epoch: 33, train_loss: 0.9030, test_loss: 0.9328, test_f1: 0.5009
 epoch: 34, train_loss: 0.9012, test_loss: 0.9496, test_f1: 0.5274
 epoch: 35, train_loss: 0.9022, test_loss: 0.9797, test_f1: 0.5014
 epoch: 36, train_loss: 0.9230, test_loss: 0.9850, test_f1: 0.4904
 epoch: 37, train_loss: 0.8993, test_loss: 0.9473, test_f1: 0.5103
 epoch: 38, train_loss: 0.9058, test_loss: 0.9382, test_f1: 0.5158
 epoch: 39, train_loss: 0.8939, test_loss: 0.9647, test_f1: 0.4876
 epoch: 40, train_loss: 0.9022, test_loss: 0.9507, test_f1: 0.5117
 epoch: 41, train_loss: 0.8959, test_loss: 0.9487, test_f1: 0.5053
 epoch: 42, train_loss: 0.8981, test_loss: 1.0300, test_f1: 0.4536
 epoch: 43, train_loss: 0.8881, test_loss: 0.9757, test_f1: 0.5022
 epoch: 44, train_loss: 0.8962, test_loss: 0.9513, test_f1: 0.5151
 epoch: 45, train_loss: 0.8921, test_loss: 0.9540, test_f1: 0.5235
 epoch: 46, train_loss: 0.8960, test_loss: 0.9003, test_f1: 0.5276
 epoch: 47, train_loss: 0.8888, test_loss: 0.9533, test_f1: 0.5079
 epoch: 48, train_loss: 0.8921, test_loss: 0.9441, test_f1: 0.5223
 epoch: 49, train_loss: 0.8810, test_loss: 0.9431, test_f1: 0.5052
 epoch: 50, train_loss: 0.8853, test_loss: 0.9554, test_f1: 0.5395
 epoch: 51, train_loss: 0.8741, test_loss: 0.9454, test_f1: 0.5170
 epoch: 52, train_loss: 0.8757, test_loss: 0.9315, test_f1: 0.5168
 epoch: 53, train_loss: 0.8707, test_loss: 0.9365, test_f1: 0.5466
 epoch: 54, train_loss: 0.8640, test_loss: 0.9259, test_f1: 0.5307
 epoch: 55, train_loss: 0.8649, test_loss: 0.9250, test_f1: 0.5308
 epoch: 56, train_loss: 0.8648, test_loss: 0.9413, test_f1: 0.5399
 epoch: 57, train_loss: 0.8657, test_loss: 0.9281, test_f1: 0.5524
 epoch: 58, train_loss: 0.8594, test_loss: 0.9396, test_f1: 0.5198
 epoch: 59, train_loss: 0.8638, test_loss: 0.9446, test_f1: 0.5388
 epoch: 60, train_loss: 0.8647, test_loss: 0.9431, test_f1: 0.5386
 epoch: 61, train_loss: 0.8656, test_loss: 0.9411, test_f1: 0.5236
 epoch: 62, train_loss: 0.8590, test_loss: 0.9266, test_f1: 0.5316
 epoch: 63, train_loss: 0.8577, test_loss: 0.9420, test_f1: 0.5133
 epoch: 64, train_loss: 0.8702, test_loss: 0.9283, test_f1: 0.5315
 epoch: 65, train_loss: 0.8591, test_loss: 0.9443, test_f1: 0.5319
 epoch: 66, train_loss: 0.8598, test_loss: 0.9284, test_f1: 0.5354
 epoch: 67, train_loss: 0.8529, test_loss: 0.9256, test_f1: 0.5260
 epoch: 68, train_loss: 0.8500, test_loss: 0.9379, test_f1: 0.5468
 epoch: 69, train_loss: 0.8544, test_loss: 0.9615, test_f1: 0.5134
 epoch: 70, train_loss: 0.8579, test_loss: 0.9443, test_f1: 0.5532
 epoch: 71, train_loss: 0.8530, test_loss: 0.9154, test_f1: 0.5350
 epoch: 72, train_loss: 0.8579, test_loss: 0.9175, test_f1: 0.5398
 epoch: 73, train_loss: 0.8564, test_loss: 0.9411, test_f1: 0.5243
 epoch: 74, train_loss: 0.8520, test_loss: 0.9196, test_f1: 0.5305
 epoch: 75, train_loss: 0.8512, test_loss: 0.9397, test_f1: 0.5386
 epoch: 76, train_loss: 0.8500, test_loss: 0.9575, test_f1: 0.5054
 epoch: 77, train_loss: 0.8495, test_loss: 0.9537, test_f1: 0.5131
 epoch: 78, train_loss: 0.8452, test_loss: 0.9386, test_f1: 0.5301
 epoch: 79, train_loss: 0.8472, test_loss: 0.9147, test_f1: 0.5270
 epoch: 80, train_loss: 0.8387, test_loss: 0.9112, test_f1: 0.5593
 epoch: 81, train_loss: 0.8463, test_loss: 0.9302, test_f1: 0.5200
 epoch: 82, train_loss: 0.8585, test_loss: 0.9118, test_f1: 0.5548
 epoch: 83, train_loss: 0.8432, test_loss: 0.9683, test_f1: 0.5254
 epoch: 84, train_loss: 0.8494, test_loss: 0.9123, test_f1: 0.5268
 epoch: 85, train_loss: 0.8394, test_loss: 0.9201, test_f1: 0.5235
 epoch: 86, train_loss: 0.8313, test_loss: 0.9183, test_f1: 0.5471
 epoch: 87, train_loss: 0.8303, test_loss: 0.9213, test_f1: 0.5226
 epoch: 88, train_loss: 0.8364, test_loss: 0.9344, test_f1: 0.5382
 epoch: 89, train_loss: 0.8417, test_loss: 0.9218, test_f1: 0.5285
 epoch: 90, train_loss: 0.8452, test_loss: 0.9056, test_f1: 0.5401
 epoch: 91, train_loss: 0.8383, test_loss: 0.9021, test_f1: 0.5562
 epoch: 92, train_loss: 0.8281, test_loss: 0.9302, test_f1: 0.5368
 epoch: 93, train_loss: 0.8356, test_loss: 0.9015, test_f1: 0.5310
 epoch: 94, train_loss: 0.8285, test_loss: 0.8964, test_f1: 0.5360
 epoch: 95, train_loss: 0.8360, test_loss: 0.9089, test_f1: 0.5317
 epoch: 96, train_loss: 0.8294, test_loss: 0.9253, test_f1: 0.5303
 epoch: 97, train_loss: 0.8296, test_loss: 0.9115, test_f1: 0.5659
 epoch: 98, train_loss: 0.8239, test_loss: 0.9169, test_f1: 0.5301
 epoch: 99, train_loss: 0.8365, test_loss: 0.8933, test_f1: 0.5349
##################ITERATION #4 ****************************************
 epoch: 0, train_loss: 1.2582, test_loss: 1.1001, test_f1: 0.3544
 epoch: 1, train_loss: 1.1419, test_loss: 1.0558, test_f1: 0.3763
 epoch: 2, train_loss: 1.1013, test_loss: 1.0333, test_f1: 0.4088
 epoch: 3, train_loss: 1.0794, test_loss: 1.0100, test_f1: 0.4401
 epoch: 4, train_loss: 1.0570, test_loss: 0.9951, test_f1: 0.4549
 epoch: 5, train_loss: 1.0411, test_loss: 0.9892, test_f1: 0.4557
 epoch: 6, train_loss: 1.0310, test_loss: 1.0068, test_f1: 0.4333
 epoch: 7, train_loss: 1.0231, test_loss: 0.9859, test_f1: 0.4851
 epoch: 8, train_loss: 1.0128, test_loss: 1.0004, test_f1: 0.4454
 epoch: 9, train_loss: 1.0087, test_loss: 0.9800, test_f1: 0.4455
 epoch: 10, train_loss: 0.9995, test_loss: 0.9705, test_f1: 0.4707
 epoch: 11, train_loss: 0.9963, test_loss: 0.9964, test_f1: 0.4526
 epoch: 12, train_loss: 0.9964, test_loss: 0.9770, test_f1: 0.4789
 epoch: 13, train_loss: 0.9946, test_loss: 0.9594, test_f1: 0.4406
 epoch: 14, train_loss: 0.9807, test_loss: 0.9875, test_f1: 0.4746
 epoch: 15, train_loss: 0.9795, test_loss: 1.0108, test_f1: 0.4659
 epoch: 16, train_loss: 0.9689, test_loss: 0.9908, test_f1: 0.4517
 epoch: 17, train_loss: 0.9731, test_loss: 0.9827, test_f1: 0.4724
 epoch: 18, train_loss: 0.9698, test_loss: 0.9625, test_f1: 0.4641
 epoch: 19, train_loss: 0.9648, test_loss: 0.9625, test_f1: 0.4761
 epoch: 20, train_loss: 0.9629, test_loss: 1.0024, test_f1: 0.4862
 epoch: 21, train_loss: 0.9641, test_loss: 0.9774, test_f1: 0.4631
 epoch: 22, train_loss: 0.9618, test_loss: 1.0136, test_f1: 0.4623
 epoch: 23, train_loss: 0.9539, test_loss: 0.9900, test_f1: 0.4777
 epoch: 24, train_loss: 0.9543, test_loss: 0.9683, test_f1: 0.4755
 epoch: 25, train_loss: 0.9462, test_loss: 1.0027, test_f1: 0.4809
 epoch: 26, train_loss: 0.9453, test_loss: 0.9649, test_f1: 0.4911
 epoch: 27, train_loss: 0.9365, test_loss: 0.9664, test_f1: 0.4759
 epoch: 28, train_loss: 0.9375, test_loss: 0.9349, test_f1: 0.4967
 epoch: 29, train_loss: 0.9315, test_loss: 0.9612, test_f1: 0.4927
 epoch: 30, train_loss: 0.9252, test_loss: 0.9651, test_f1: 0.4855
 epoch: 31, train_loss: 0.9262, test_loss: 0.9995, test_f1: 0.4776
 epoch: 32, train_loss: 0.9359, test_loss: 0.9799, test_f1: 0.4772
 epoch: 33, train_loss: 0.9203, test_loss: 0.9633, test_f1: 0.5013
 epoch: 34, train_loss: 0.9168, test_loss: 0.9543, test_f1: 0.4805
 epoch: 35, train_loss: 0.9112, test_loss: 0.9635, test_f1: 0.4920
 epoch: 36, train_loss: 0.9135, test_loss: 0.9490, test_f1: 0.4975
 epoch: 37, train_loss: 0.9109, test_loss: 0.9678, test_f1: 0.4913
 epoch: 38, train_loss: 0.9116, test_loss: 0.9908, test_f1: 0.4939
 epoch: 39, train_loss: 0.9067, test_loss: 0.9465, test_f1: 0.5011
 epoch: 40, train_loss: 0.9036, test_loss: 0.9611, test_f1: 0.5033
 epoch: 41, train_loss: 0.9120, test_loss: 0.9456, test_f1: 0.5119
 epoch: 42, train_loss: 0.9082, test_loss: 0.9512, test_f1: 0.5027
 epoch: 43, train_loss: 0.8961, test_loss: 0.9563, test_f1: 0.4882
 epoch: 44, train_loss: 0.8951, test_loss: 0.9539, test_f1: 0.4987
 epoch: 45, train_loss: 0.8883, test_loss: 0.9485, test_f1: 0.5025
 epoch: 46, train_loss: 0.8838, test_loss: 0.9645, test_f1: 0.5028
 epoch: 47, train_loss: 0.8876, test_loss: 0.9431, test_f1: 0.5043
 epoch: 48, train_loss: 0.8962, test_loss: 0.9796, test_f1: 0.4934
 epoch: 49, train_loss: 0.8864, test_loss: 0.9739, test_f1: 0.4942
 epoch: 50, train_loss: 0.8814, test_loss: 0.9598, test_f1: 0.5117
 epoch: 51, train_loss: 0.8740, test_loss: 0.9489, test_f1: 0.5134
 epoch: 52, train_loss: 0.8802, test_loss: 0.9491, test_f1: 0.5075
 epoch: 53, train_loss: 0.8792, test_loss: 0.9342, test_f1: 0.5126
 epoch: 54, train_loss: 0.8701, test_loss: 0.9795, test_f1: 0.4990
 epoch: 55, train_loss: 0.8758, test_loss: 0.9580, test_f1: 0.5029
 epoch: 56, train_loss: 0.8670, test_loss: 0.9421, test_f1: 0.4943
 epoch: 57, train_loss: 0.8647, test_loss: 0.9487, test_f1: 0.5059
 epoch: 58, train_loss: 0.8560, test_loss: 0.9585, test_f1: 0.4963
 epoch: 59, train_loss: 0.8619, test_loss: 0.9743, test_f1: 0.5082
 epoch: 60, train_loss: 0.8600, test_loss: 0.9460, test_f1: 0.5131
 epoch: 61, train_loss: 0.8625, test_loss: 0.9568, test_f1: 0.5220
 epoch: 62, train_loss: 0.8584, test_loss: 0.9682, test_f1: 0.5148
 epoch: 63, train_loss: 0.8655, test_loss: 0.9596, test_f1: 0.5084
 epoch: 64, train_loss: 0.8673, test_loss: 0.9720, test_f1: 0.4971
 epoch: 65, train_loss: 0.8587, test_loss: 0.9735, test_f1: 0.5084
 epoch: 66, train_loss: 0.8612, test_loss: 0.9347, test_f1: 0.5123
 epoch: 67, train_loss: 0.8734, test_loss: 0.9570, test_f1: 0.5062
 epoch: 68, train_loss: 0.8582, test_loss: 0.9660, test_f1: 0.5088
 epoch: 69, train_loss: 0.8550, test_loss: 0.9408, test_f1: 0.5074
 epoch: 70, train_loss: 0.8630, test_loss: 0.9527, test_f1: 0.5147
 epoch: 71, train_loss: 0.8571, test_loss: 0.9511, test_f1: 0.5137
 epoch: 72, train_loss: 0.8488, test_loss: 0.9412, test_f1: 0.5097
 epoch: 73, train_loss: 0.8531, test_loss: 0.9605, test_f1: 0.5160
 epoch: 74, train_loss: 0.8575, test_loss: 0.9669, test_f1: 0.5114
 epoch: 75, train_loss: 0.8584, test_loss: 0.9448, test_f1: 0.5023
 epoch: 76, train_loss: 0.8481, test_loss: 0.9646, test_f1: 0.5018
 epoch: 77, train_loss: 0.8483, test_loss: 0.9553, test_f1: 0.5203
 epoch: 78, train_loss: 0.8427, test_loss: 0.9578, test_f1: 0.5114
 epoch: 79, train_loss: 0.8496, test_loss: 0.9685, test_f1: 0.5043
 epoch: 80, train_loss: 0.8409, test_loss: 0.9631, test_f1: 0.5180
 epoch: 81, train_loss: 0.8305, test_loss: 0.9484, test_f1: 0.5209
 epoch: 82, train_loss: 0.8410, test_loss: 0.9776, test_f1: 0.5037
 epoch: 83, train_loss: 0.8313, test_loss: 0.9473, test_f1: 0.5235
 epoch: 84, train_loss: 0.8496, test_loss: 0.9685, test_f1: 0.5254
 epoch: 85, train_loss: 0.8324, test_loss: 0.9501, test_f1: 0.5175
 epoch: 86, train_loss: 0.8385, test_loss: 0.9598, test_f1: 0.5137
 epoch: 87, train_loss: 0.8431, test_loss: 0.9761, test_f1: 0.5124
 epoch: 88, train_loss: 0.8389, test_loss: 0.9557, test_f1: 0.5179
 epoch: 89, train_loss: 0.8453, test_loss: 0.9507, test_f1: 0.5172
 epoch: 90, train_loss: 0.8420, test_loss: 0.9628, test_f1: 0.5241
 epoch: 91, train_loss: 0.8345, test_loss: 0.9574, test_f1: 0.5220
 epoch: 92, train_loss: 0.8283, test_loss: 0.9681, test_f1: 0.5239
 epoch: 93, train_loss: 0.8506, test_loss: 0.9673, test_f1: 0.5208
 epoch: 94, train_loss: 0.8319, test_loss: 0.9604, test_f1: 0.5302
 epoch: 95, train_loss: 0.8297, test_loss: 0.9648, test_f1: 0.5189
 epoch: 96, train_loss: 0.8346, test_loss: 0.9693, test_f1: 0.5296
 epoch: 97, train_loss: 0.8311, test_loss: 0.9585, test_f1: 0.5383
 epoch: 98, train_loss: 0.8255, test_loss: 0.9611, test_f1: 0.5259
 epoch: 99, train_loss: 0.8226, test_loss: 0.9533, test_f1: 0.5485
##################ITERATION #5 ****************************************
 epoch: 0, train_loss: 1.2944, test_loss: 1.0758, test_f1: 0.3741
 epoch: 1, train_loss: 1.1134, test_loss: 1.0529, test_f1: 0.3797
 epoch: 2, train_loss: 1.0793, test_loss: 1.0296, test_f1: 0.4270
 epoch: 3, train_loss: 1.0524, test_loss: 1.0310, test_f1: 0.4427
 epoch: 4, train_loss: 1.0418, test_loss: 1.0331, test_f1: 0.4500
 epoch: 5, train_loss: 1.0320, test_loss: 1.0181, test_f1: 0.4414
 epoch: 6, train_loss: 1.0234, test_loss: 1.0057, test_f1: 0.4691
 epoch: 7, train_loss: 1.0098, test_loss: 1.0033, test_f1: 0.4464
 epoch: 8, train_loss: 1.0045, test_loss: 0.9971, test_f1: 0.4749
 epoch: 9, train_loss: 1.0010, test_loss: 0.9890, test_f1: 0.4923
 epoch: 10, train_loss: 0.9969, test_loss: 0.9981, test_f1: 0.4942
 epoch: 11, train_loss: 0.9946, test_loss: 1.0129, test_f1: 0.4796
 epoch: 12, train_loss: 0.9873, test_loss: 0.9871, test_f1: 0.4975
 epoch: 13, train_loss: 0.9847, test_loss: 0.9699, test_f1: 0.4889
 epoch: 14, train_loss: 0.9815, test_loss: 0.9709, test_f1: 0.5088
 epoch: 15, train_loss: 0.9798, test_loss: 0.9763, test_f1: 0.4939
 epoch: 16, train_loss: 0.9663, test_loss: 0.9779, test_f1: 0.5025
 epoch: 17, train_loss: 0.9632, test_loss: 0.9392, test_f1: 0.5201
 epoch: 18, train_loss: 0.9611, test_loss: 0.9708, test_f1: 0.4967
 epoch: 19, train_loss: 0.9527, test_loss: 0.9510, test_f1: 0.4873
 epoch: 20, train_loss: 0.9526, test_loss: 0.9682, test_f1: 0.4919
 epoch: 21, train_loss: 0.9498, test_loss: 0.9539, test_f1: 0.5242
 epoch: 22, train_loss: 0.9373, test_loss: 0.9661, test_f1: 0.4847
 epoch: 23, train_loss: 0.9420, test_loss: 0.9585, test_f1: 0.4831
 epoch: 24, train_loss: 0.9404, test_loss: 0.9541, test_f1: 0.4896
 epoch: 25, train_loss: 0.9417, test_loss: 0.9535, test_f1: 0.5185
 epoch: 26, train_loss: 0.9354, test_loss: 0.9536, test_f1: 0.5251
 epoch: 27, train_loss: 0.9343, test_loss: 0.9612, test_f1: 0.5058
 epoch: 28, train_loss: 0.9331, test_loss: 0.9554, test_f1: 0.4947
 epoch: 29, train_loss: 0.9296, test_loss: 0.9666, test_f1: 0.5069
 epoch: 30, train_loss: 0.9353, test_loss: 0.9434, test_f1: 0.4931
 epoch: 31, train_loss: 0.9194, test_loss: 0.9812, test_f1: 0.4798
 epoch: 32, train_loss: 0.9191, test_loss: 0.9597, test_f1: 0.4872
 epoch: 33, train_loss: 0.9396, test_loss: 0.9309, test_f1: 0.5189
 epoch: 34, train_loss: 0.9284, test_loss: 0.9684, test_f1: 0.5060
 epoch: 35, train_loss: 0.9178, test_loss: 0.9563, test_f1: 0.5112
 epoch: 36, train_loss: 0.9144, test_loss: 0.9485, test_f1: 0.5128
 epoch: 37, train_loss: 0.9068, test_loss: 0.9601, test_f1: 0.5021
 epoch: 38, train_loss: 0.9201, test_loss: 0.9600, test_f1: 0.5187
 epoch: 39, train_loss: 0.9039, test_loss: 0.9502, test_f1: 0.5027
 epoch: 40, train_loss: 0.9189, test_loss: 0.9330, test_f1: 0.5159
 epoch: 41, train_loss: 0.9021, test_loss: 0.9509, test_f1: 0.5187
 epoch: 42, train_loss: 0.9073, test_loss: 0.9342, test_f1: 0.5157
 epoch: 43, train_loss: 0.8958, test_loss: 0.9475, test_f1: 0.5243
 epoch: 44, train_loss: 0.9018, test_loss: 0.9443, test_f1: 0.5098
 epoch: 45, train_loss: 0.9041, test_loss: 0.9454, test_f1: 0.5148
 epoch: 46, train_loss: 0.8848, test_loss: 0.9722, test_f1: 0.5096
 epoch: 47, train_loss: 0.8924, test_loss: 0.9327, test_f1: 0.5110
 epoch: 48, train_loss: 0.9048, test_loss: 0.9504, test_f1: 0.4908
 epoch: 49, train_loss: 0.8874, test_loss: 0.9450, test_f1: 0.4921
 epoch: 50, train_loss: 0.8958, test_loss: 0.9516, test_f1: 0.5036
 epoch: 51, train_loss: 0.8814, test_loss: 0.9233, test_f1: 0.5194
 epoch: 52, train_loss: 0.8706, test_loss: 0.9325, test_f1: 0.5135
 epoch: 53, train_loss: 0.8753, test_loss: 0.9300, test_f1: 0.5133
 epoch: 54, train_loss: 0.8671, test_loss: 0.9295, test_f1: 0.5061
 epoch: 55, train_loss: 0.8722, test_loss: 0.9391, test_f1: 0.4997
 epoch: 56, train_loss: 0.8794, test_loss: 0.9431, test_f1: 0.5373
 epoch: 57, train_loss: 0.8756, test_loss: 0.9443, test_f1: 0.5073
 epoch: 58, train_loss: 0.8683, test_loss: 0.9265, test_f1: 0.5227
 epoch: 59, train_loss: 0.8771, test_loss: 0.9324, test_f1: 0.5167
 epoch: 60, train_loss: 0.8690, test_loss: 0.9288, test_f1: 0.5147
 epoch: 61, train_loss: 0.8673, test_loss: 0.9344, test_f1: 0.5053
 epoch: 62, train_loss: 0.8627, test_loss: 0.9342, test_f1: 0.5132
 epoch: 63, train_loss: 0.8780, test_loss: 0.9402, test_f1: 0.4948
 epoch: 64, train_loss: 0.8666, test_loss: 0.9376, test_f1: 0.5317
 epoch: 65, train_loss: 0.8756, test_loss: 0.9404, test_f1: 0.5113
 epoch: 66, train_loss: 0.8694, test_loss: 0.9334, test_f1: 0.5192
 epoch: 67, train_loss: 0.8717, test_loss: 0.9378, test_f1: 0.5308
 epoch: 68, train_loss: 0.8706, test_loss: 0.9381, test_f1: 0.5313
 epoch: 69, train_loss: 0.8701, test_loss: 0.9332, test_f1: 0.5245
 epoch: 70, train_loss: 0.8584, test_loss: 0.9273, test_f1: 0.5325
 epoch: 71, train_loss: 0.8640, test_loss: 0.9449, test_f1: 0.5163
 epoch: 72, train_loss: 0.8753, test_loss: 0.9427, test_f1: 0.5094
 epoch: 73, train_loss: 0.8636, test_loss: 0.9111, test_f1: 0.5299
 epoch: 74, train_loss: 0.8574, test_loss: 0.9475, test_f1: 0.5270
 epoch: 75, train_loss: 0.8565, test_loss: 0.9314, test_f1: 0.5344
 epoch: 76, train_loss: 0.8735, test_loss: 0.9265, test_f1: 0.5144
 epoch: 77, train_loss: 0.8693, test_loss: 0.9314, test_f1: 0.5269
 epoch: 78, train_loss: 0.8582, test_loss: 0.9555, test_f1: 0.5087
 epoch: 79, train_loss: 0.8545, test_loss: 0.9295, test_f1: 0.5161
 epoch: 80, train_loss: 0.8579, test_loss: 0.9437, test_f1: 0.5323
 epoch: 81, train_loss: 0.8513, test_loss: 0.9359, test_f1: 0.5243
 epoch: 82, train_loss: 0.8544, test_loss: 0.9455, test_f1: 0.5332
 epoch: 83, train_loss: 0.8461, test_loss: 0.9330, test_f1: 0.5184
 epoch: 84, train_loss: 0.8507, test_loss: 0.9444, test_f1: 0.5221
 epoch: 85, train_loss: 0.8628, test_loss: 0.9335, test_f1: 0.5052
 epoch: 86, train_loss: 0.8452, test_loss: 0.9430, test_f1: 0.5311
 epoch: 87, train_loss: 0.8602, test_loss: 0.9578, test_f1: 0.5205
 epoch: 88, train_loss: 0.8564, test_loss: 0.9525, test_f1: 0.5216
 epoch: 89, train_loss: 0.8524, test_loss: 0.9611, test_f1: 0.5014
 epoch: 90, train_loss: 0.8608, test_loss: 0.9542, test_f1: 0.5173
 epoch: 91, train_loss: 0.8525, test_loss: 0.9389, test_f1: 0.5372
 epoch: 92, train_loss: 0.8532, test_loss: 0.9425, test_f1: 0.5297
 epoch: 93, train_loss: 0.8521, test_loss: 0.9503, test_f1: 0.5249
 epoch: 94, train_loss: 0.8505, test_loss: 0.9572, test_f1: 0.5112
 epoch: 95, train_loss: 0.8449, test_loss: 0.9267, test_f1: 0.5305
 epoch: 96, train_loss: 0.8431, test_loss: 0.9604, test_f1: 0.5079
 epoch: 97, train_loss: 0.8535, test_loss: 0.9562, test_f1: 0.5265
 epoch: 98, train_loss: 0.8493, test_loss: 0.9362, test_f1: 0.5298
 epoch: 99, train_loss: 0.8414, test_loss: 0.9531, test_f1: 0.5183
##################ITERATION #6 ****************************************
 epoch: 0, train_loss: 1.2539, test_loss: 1.0863, test_f1: 0.3549
 epoch: 1, train_loss: 1.1248, test_loss: 1.0552, test_f1: 0.3592
 epoch: 2, train_loss: 1.0954, test_loss: 1.0358, test_f1: 0.3630
 epoch: 3, train_loss: 1.0708, test_loss: 1.0575, test_f1: 0.3661
 epoch: 4, train_loss: 1.0479, test_loss: 1.0098, test_f1: 0.3878
 epoch: 5, train_loss: 1.0411, test_loss: 1.0115, test_f1: 0.4450
 epoch: 6, train_loss: 1.0092, test_loss: 1.0191, test_f1: 0.4502
 epoch: 7, train_loss: 1.0062, test_loss: 0.9968, test_f1: 0.4736
 epoch: 8, train_loss: 0.9940, test_loss: 0.9835, test_f1: 0.4760
 epoch: 9, train_loss: 0.9999, test_loss: 0.9931, test_f1: 0.4721
 epoch: 10, train_loss: 0.9764, test_loss: 0.9820, test_f1: 0.4668
 epoch: 11, train_loss: 0.9765, test_loss: 0.9902, test_f1: 0.4535
 epoch: 12, train_loss: 0.9765, test_loss: 0.9683, test_f1: 0.4691
 epoch: 13, train_loss: 0.9657, test_loss: 0.9439, test_f1: 0.4744
 epoch: 14, train_loss: 0.9559, test_loss: 1.0008, test_f1: 0.4536
 epoch: 15, train_loss: 0.9381, test_loss: 0.9663, test_f1: 0.4901
 epoch: 16, train_loss: 0.9488, test_loss: 0.9650, test_f1: 0.4764
 epoch: 17, train_loss: 0.9458, test_loss: 0.9464, test_f1: 0.4911
 epoch: 18, train_loss: 0.9363, test_loss: 0.9729, test_f1: 0.4936
 epoch: 19, train_loss: 0.9365, test_loss: 0.9457, test_f1: 0.4861
 epoch: 20, train_loss: 0.9311, test_loss: 0.9067, test_f1: 0.5034
 epoch: 21, train_loss: 0.9309, test_loss: 0.9674, test_f1: 0.4757
 epoch: 22, train_loss: 0.9324, test_loss: 0.9177, test_f1: 0.5009
 epoch: 23, train_loss: 0.9173, test_loss: 0.9230, test_f1: 0.4948
 epoch: 24, train_loss: 0.9283, test_loss: 0.9391, test_f1: 0.5038
 epoch: 25, train_loss: 0.9237, test_loss: 0.9403, test_f1: 0.4971
 epoch: 26, train_loss: 0.9230, test_loss: 0.9102, test_f1: 0.4958
 epoch: 27, train_loss: 0.9281, test_loss: 0.8867, test_f1: 0.4949
 epoch: 28, train_loss: 0.9112, test_loss: 0.8824, test_f1: 0.5045
 epoch: 29, train_loss: 0.9135, test_loss: 0.9251, test_f1: 0.4940
 epoch: 30, train_loss: 0.9081, test_loss: 0.9457, test_f1: 0.5018
 epoch: 31, train_loss: 0.8992, test_loss: 0.8952, test_f1: 0.5149
 epoch: 32, train_loss: 0.9013, test_loss: 0.8917, test_f1: 0.5047
 epoch: 33, train_loss: 0.8951, test_loss: 0.9099, test_f1: 0.5093
 epoch: 34, train_loss: 0.9091, test_loss: 0.8998, test_f1: 0.5127
 epoch: 35, train_loss: 0.9011, test_loss: 0.8884, test_f1: 0.5245
 epoch: 36, train_loss: 0.8989, test_loss: 0.8886, test_f1: 0.4925
 epoch: 37, train_loss: 0.8987, test_loss: 0.9288, test_f1: 0.5106
 epoch: 38, train_loss: 0.8973, test_loss: 0.9406, test_f1: 0.4980
 epoch: 39, train_loss: 0.8787, test_loss: 0.8898, test_f1: 0.5293
 epoch: 40, train_loss: 0.8964, test_loss: 0.9062, test_f1: 0.5218
 epoch: 41, train_loss: 0.8767, test_loss: 0.9148, test_f1: 0.5095
 epoch: 42, train_loss: 0.8880, test_loss: 0.9129, test_f1: 0.5024
 epoch: 43, train_loss: 0.8743, test_loss: 0.8925, test_f1: 0.5074
 epoch: 44, train_loss: 0.8771, test_loss: 0.9039, test_f1: 0.5021
 epoch: 45, train_loss: 0.8736, test_loss: 0.9015, test_f1: 0.5209
 epoch: 46, train_loss: 0.8760, test_loss: 0.8971, test_f1: 0.5398
 epoch: 47, train_loss: 0.8657, test_loss: 0.8857, test_f1: 0.5447
 epoch: 48, train_loss: 0.8661, test_loss: 0.9103, test_f1: 0.5072
 epoch: 49, train_loss: 0.8738, test_loss: 0.9049, test_f1: 0.5574
 epoch: 50, train_loss: 0.8660, test_loss: 0.9076, test_f1: 0.5168
 epoch: 51, train_loss: 0.8621, test_loss: 0.8864, test_f1: 0.5285
 epoch: 52, train_loss: 0.8460, test_loss: 0.8920, test_f1: 0.5267
 epoch: 53, train_loss: 0.8528, test_loss: 0.8809, test_f1: 0.5309
 epoch: 54, train_loss: 0.8551, test_loss: 0.8742, test_f1: 0.5046
 epoch: 55, train_loss: 0.8524, test_loss: 0.8664, test_f1: 0.5335
 epoch: 56, train_loss: 0.8486, test_loss: 0.8801, test_f1: 0.5166
 epoch: 57, train_loss: 0.8663, test_loss: 0.8713, test_f1: 0.5189
 epoch: 58, train_loss: 0.8512, test_loss: 0.9014, test_f1: 0.5174
 epoch: 59, train_loss: 0.8407, test_loss: 0.8950, test_f1: 0.5451
 epoch: 60, train_loss: 0.8483, test_loss: 0.8997, test_f1: 0.5505
 epoch: 61, train_loss: 0.8430, test_loss: 0.9031, test_f1: 0.5310
 epoch: 62, train_loss: 0.8428, test_loss: 0.8804, test_f1: 0.5329
 epoch: 63, train_loss: 0.8445, test_loss: 0.8945, test_f1: 0.5149
 epoch: 64, train_loss: 0.8459, test_loss: 0.8890, test_f1: 0.5286
 epoch: 65, train_loss: 0.8441, test_loss: 0.8912, test_f1: 0.5436
 epoch: 66, train_loss: 0.8428, test_loss: 0.8755, test_f1: 0.5463
 epoch: 67, train_loss: 0.8404, test_loss: 0.8846, test_f1: 0.5436
 epoch: 68, train_loss: 0.8370, test_loss: 0.8920, test_f1: 0.5352
 epoch: 69, train_loss: 0.8310, test_loss: 0.8790, test_f1: 0.5236
 epoch: 70, train_loss: 0.8357, test_loss: 0.8840, test_f1: 0.5507
 epoch: 71, train_loss: 0.8514, test_loss: 0.9076, test_f1: 0.5351
 epoch: 72, train_loss: 0.8218, test_loss: 0.8851, test_f1: 0.5753
 epoch: 73, train_loss: 0.8307, test_loss: 0.8832, test_f1: 0.5532
 epoch: 74, train_loss: 0.8238, test_loss: 0.8721, test_f1: 0.5250
 epoch: 75, train_loss: 0.8378, test_loss: 0.8934, test_f1: 0.5565
 epoch: 76, train_loss: 0.8253, test_loss: 0.8695, test_f1: 0.5602
 epoch: 77, train_loss: 0.8321, test_loss: 0.8934, test_f1: 0.5330
 epoch: 78, train_loss: 0.8319, test_loss: 0.9003, test_f1: 0.5332
 epoch: 79, train_loss: 0.8275, test_loss: 0.8970, test_f1: 0.5456
 epoch: 80, train_loss: 0.8295, test_loss: 0.8895, test_f1: 0.5179
 epoch: 81, train_loss: 0.8303, test_loss: 0.8889, test_f1: 0.5377
 epoch: 82, train_loss: 0.8298, test_loss: 0.8978, test_f1: 0.5371
 epoch: 83, train_loss: 0.8271, test_loss: 0.8883, test_f1: 0.5276
 epoch: 84, train_loss: 0.8191, test_loss: 0.8900, test_f1: 0.5355
 epoch: 85, train_loss: 0.8237, test_loss: 0.8774, test_f1: 0.5243
 epoch: 86, train_loss: 0.8211, test_loss: 0.8789, test_f1: 0.5335
 epoch: 87, train_loss: 0.8190, test_loss: 0.8945, test_f1: 0.5279
 epoch: 88, train_loss: 0.8222, test_loss: 0.9102, test_f1: 0.5255
 epoch: 89, train_loss: 0.8126, test_loss: 0.9085, test_f1: 0.5206
 epoch: 90, train_loss: 0.8217, test_loss: 0.8975, test_f1: 0.5525
 epoch: 91, train_loss: 0.8029, test_loss: 0.8795, test_f1: 0.5270
 epoch: 92, train_loss: 0.8169, test_loss: 0.8770, test_f1: 0.5447
 epoch: 93, train_loss: 0.8181, test_loss: 0.8962, test_f1: 0.5135
 epoch: 94, train_loss: 0.8115, test_loss: 0.8752, test_f1: 0.5449
 epoch: 95, train_loss: 0.8237, test_loss: 0.8956, test_f1: 0.5363
 epoch: 96, train_loss: 0.8254, test_loss: 0.8977, test_f1: 0.5354
 epoch: 97, train_loss: 0.8204, test_loss: 0.8817, test_f1: 0.5297
 epoch: 98, train_loss: 0.8150, test_loss: 0.8774, test_f1: 0.5240
 epoch: 99, train_loss: 0.8226, test_loss: 0.8829, test_f1: 0.5619
##################ITERATION #7 ****************************************
 epoch: 0, train_loss: 1.2435, test_loss: 1.0824, test_f1: 0.3917
 epoch: 1, train_loss: 1.1181, test_loss: 1.0419, test_f1: 0.4275
 epoch: 2, train_loss: 1.0819, test_loss: 1.0036, test_f1: 0.4395
 epoch: 3, train_loss: 1.0562, test_loss: 0.9966, test_f1: 0.4207
 epoch: 4, train_loss: 1.0508, test_loss: 1.0014, test_f1: 0.4566
 epoch: 5, train_loss: 1.0263, test_loss: 0.9792, test_f1: 0.4240
 epoch: 6, train_loss: 1.0244, test_loss: 0.9694, test_f1: 0.4534
 epoch: 7, train_loss: 1.0135, test_loss: 0.9882, test_f1: 0.4791
 epoch: 8, train_loss: 1.0055, test_loss: 1.0051, test_f1: 0.4607
 epoch: 9, train_loss: 0.9934, test_loss: 0.9635, test_f1: 0.4786
 epoch: 10, train_loss: 0.9971, test_loss: 0.9832, test_f1: 0.4745
 epoch: 11, train_loss: 0.9806, test_loss: 0.9562, test_f1: 0.4644
 epoch: 12, train_loss: 0.9759, test_loss: 0.9910, test_f1: 0.4619
 epoch: 13, train_loss: 0.9743, test_loss: 1.0083, test_f1: 0.4773
 epoch: 14, train_loss: 0.9747, test_loss: 1.0047, test_f1: 0.4967
 epoch: 15, train_loss: 0.9659, test_loss: 0.9887, test_f1: 0.4951
 epoch: 16, train_loss: 0.9639, test_loss: 0.9916, test_f1: 0.4863
 epoch: 17, train_loss: 0.9502, test_loss: 0.9807, test_f1: 0.4690
 epoch: 18, train_loss: 0.9465, test_loss: 0.9855, test_f1: 0.4768
 epoch: 19, train_loss: 0.9451, test_loss: 0.9749, test_f1: 0.4698
 epoch: 20, train_loss: 0.9422, test_loss: 0.9854, test_f1: 0.4525
 epoch: 21, train_loss: 0.9452, test_loss: 0.9940, test_f1: 0.4867
 epoch: 22, train_loss: 0.9374, test_loss: 0.9721, test_f1: 0.4730
 epoch: 23, train_loss: 0.9403, test_loss: 0.9839, test_f1: 0.4396
 epoch: 24, train_loss: 0.9346, test_loss: 0.9843, test_f1: 0.4951
 epoch: 25, train_loss: 0.9355, test_loss: 0.9790, test_f1: 0.4559
 epoch: 26, train_loss: 0.9314, test_loss: 0.9646, test_f1: 0.4766
 epoch: 27, train_loss: 0.9191, test_loss: 0.9616, test_f1: 0.4727
 epoch: 28, train_loss: 0.9290, test_loss: 0.9480, test_f1: 0.4903
 epoch: 29, train_loss: 0.9259, test_loss: 0.9588, test_f1: 0.4869
 epoch: 30, train_loss: 0.9188, test_loss: 0.9667, test_f1: 0.4965
 epoch: 31, train_loss: 0.9290, test_loss: 0.9718, test_f1: 0.4754
 epoch: 32, train_loss: 0.9162, test_loss: 0.9696, test_f1: 0.4662
 epoch: 33, train_loss: 0.9316, test_loss: 0.9737, test_f1: 0.4751
 epoch: 34, train_loss: 0.9165, test_loss: 0.9815, test_f1: 0.4836
 epoch: 35, train_loss: 0.9152, test_loss: 0.9643, test_f1: 0.4825
 epoch: 36, train_loss: 0.9027, test_loss: 1.0044, test_f1: 0.4776
 epoch: 37, train_loss: 0.9098, test_loss: 0.9835, test_f1: 0.4861
 epoch: 38, train_loss: 0.9044, test_loss: 1.0091, test_f1: 0.4806
 epoch: 39, train_loss: 0.9022, test_loss: 0.9883, test_f1: 0.4894
 epoch: 40, train_loss: 0.8976, test_loss: 0.9908, test_f1: 0.4957
 epoch: 41, train_loss: 0.9072, test_loss: 0.9808, test_f1: 0.4835
 epoch: 42, train_loss: 0.9046, test_loss: 1.0025, test_f1: 0.4790
 epoch: 43, train_loss: 0.9058, test_loss: 0.9921, test_f1: 0.4835
 epoch: 44, train_loss: 0.9008, test_loss: 1.0261, test_f1: 0.4899
 epoch: 45, train_loss: 0.8997, test_loss: 0.9746, test_f1: 0.4999
 epoch: 46, train_loss: 0.8991, test_loss: 1.0050, test_f1: 0.4818
 epoch: 47, train_loss: 0.8939, test_loss: 0.9928, test_f1: 0.4786
 epoch: 48, train_loss: 0.8856, test_loss: 1.0002, test_f1: 0.4867
 epoch: 49, train_loss: 0.8739, test_loss: 1.0031, test_f1: 0.4909
 epoch: 50, train_loss: 0.8892, test_loss: 1.0105, test_f1: 0.4692
 epoch: 51, train_loss: 0.8805, test_loss: 0.9816, test_f1: 0.4955
 epoch: 52, train_loss: 0.8792, test_loss: 0.9913, test_f1: 0.4905
 epoch: 53, train_loss: 0.8769, test_loss: 0.9885, test_f1: 0.4891
 epoch: 54, train_loss: 0.8746, test_loss: 0.9873, test_f1: 0.4880
 epoch: 55, train_loss: 0.8817, test_loss: 1.0054, test_f1: 0.5023
 epoch: 56, train_loss: 0.8771, test_loss: 1.0008, test_f1: 0.4906
 epoch: 57, train_loss: 0.8749, test_loss: 1.0065, test_f1: 0.4946
 epoch: 58, train_loss: 0.8688, test_loss: 0.9924, test_f1: 0.4884
 epoch: 59, train_loss: 0.8771, test_loss: 1.0009, test_f1: 0.4901
 epoch: 60, train_loss: 0.8694, test_loss: 1.0190, test_f1: 0.4872
 epoch: 61, train_loss: 0.8798, test_loss: 1.0203, test_f1: 0.4894
 epoch: 62, train_loss: 0.8765, test_loss: 0.9938, test_f1: 0.4977
 epoch: 63, train_loss: 0.8728, test_loss: 1.0021, test_f1: 0.4775
 epoch: 64, train_loss: 0.8651, test_loss: 1.0029, test_f1: 0.4823
 epoch: 65, train_loss: 0.8680, test_loss: 0.9891, test_f1: 0.5027
 epoch: 66, train_loss: 0.8642, test_loss: 0.9963, test_f1: 0.4959
 epoch: 67, train_loss: 0.8662, test_loss: 0.9859, test_f1: 0.5045
 epoch: 68, train_loss: 0.8626, test_loss: 0.9960, test_f1: 0.4942
 epoch: 69, train_loss: 0.8607, test_loss: 1.0072, test_f1: 0.4915
 epoch: 70, train_loss: 0.8527, test_loss: 1.0090, test_f1: 0.4918
 epoch: 71, train_loss: 0.8532, test_loss: 0.9926, test_f1: 0.5131
 epoch: 72, train_loss: 0.8584, test_loss: 0.9863, test_f1: 0.5035
 epoch: 73, train_loss: 0.8577, test_loss: 1.0157, test_f1: 0.4944
 epoch: 74, train_loss: 0.8654, test_loss: 0.9997, test_f1: 0.4900
 epoch: 75, train_loss: 0.8562, test_loss: 1.0299, test_f1: 0.4737
 epoch: 76, train_loss: 0.8566, test_loss: 1.0050, test_f1: 0.5049
 epoch: 77, train_loss: 0.8605, test_loss: 1.0324, test_f1: 0.4926
 epoch: 78, train_loss: 0.8635, test_loss: 0.9942, test_f1: 0.4891
 epoch: 79, train_loss: 0.8530, test_loss: 0.9985, test_f1: 0.4974
 epoch: 80, train_loss: 0.8421, test_loss: 1.0035, test_f1: 0.5036
 epoch: 81, train_loss: 0.8574, test_loss: 0.9888, test_f1: 0.5125
 epoch: 82, train_loss: 0.8515, test_loss: 1.0267, test_f1: 0.4854
 epoch: 83, train_loss: 0.8522, test_loss: 1.0157, test_f1: 0.4952
 epoch: 84, train_loss: 0.8592, test_loss: 0.9898, test_f1: 0.4941
 epoch: 85, train_loss: 0.8401, test_loss: 1.0125, test_f1: 0.4851
 epoch: 86, train_loss: 0.8484, test_loss: 0.9974, test_f1: 0.5049
 epoch: 87, train_loss: 0.8490, test_loss: 0.9926, test_f1: 0.5008
 epoch: 88, train_loss: 0.8516, test_loss: 1.0287, test_f1: 0.4957
 epoch: 89, train_loss: 0.8369, test_loss: 1.0092, test_f1: 0.5005
 epoch: 90, train_loss: 0.8397, test_loss: 0.9987, test_f1: 0.4991
 epoch: 91, train_loss: 0.8404, test_loss: 1.0025, test_f1: 0.5086
 epoch: 92, train_loss: 0.8303, test_loss: 0.9883, test_f1: 0.5139
 epoch: 93, train_loss: 0.8378, test_loss: 1.0010, test_f1: 0.5034
 epoch: 94, train_loss: 0.8490, test_loss: 1.0127, test_f1: 0.5014
 epoch: 95, train_loss: 0.8377, test_loss: 0.9862, test_f1: 0.5044
 epoch: 96, train_loss: 0.8369, test_loss: 0.9926, test_f1: 0.5047
 epoch: 97, train_loss: 0.8433, test_loss: 1.0069, test_f1: 0.5115
 epoch: 98, train_loss: 0.8367, test_loss: 1.0117, test_f1: 0.4975
 epoch: 99, train_loss: 0.8397, test_loss: 1.0275, test_f1: 0.5111
##################ITERATION #8 ****************************************
 epoch: 0, train_loss: 1.2873, test_loss: 1.0517, test_f1: 0.4131
 epoch: 1, train_loss: 1.1280, test_loss: 1.0336, test_f1: 0.4426
 epoch: 2, train_loss: 1.0870, test_loss: 1.0173, test_f1: 0.4500
 epoch: 3, train_loss: 1.0637, test_loss: 1.0145, test_f1: 0.4560
 epoch: 4, train_loss: 1.0446, test_loss: 1.0257, test_f1: 0.4629
 epoch: 5, train_loss: 1.0303, test_loss: 1.0057, test_f1: 0.4360
 epoch: 6, train_loss: 1.0249, test_loss: 1.0204, test_f1: 0.4616
 epoch: 7, train_loss: 1.0297, test_loss: 1.0283, test_f1: 0.4491
 epoch: 8, train_loss: 1.0081, test_loss: 1.0047, test_f1: 0.4656
 epoch: 9, train_loss: 1.0043, test_loss: 0.9789, test_f1: 0.4608
 epoch: 10, train_loss: 0.9897, test_loss: 0.9924, test_f1: 0.4642
 epoch: 11, train_loss: 0.9869, test_loss: 0.9927, test_f1: 0.4756
 epoch: 12, train_loss: 0.9880, test_loss: 1.0033, test_f1: 0.4533
 epoch: 13, train_loss: 0.9802, test_loss: 1.0031, test_f1: 0.4607
 epoch: 14, train_loss: 0.9805, test_loss: 0.9958, test_f1: 0.4727
 epoch: 15, train_loss: 0.9652, test_loss: 0.9861, test_f1: 0.4759
 epoch: 16, train_loss: 0.9567, test_loss: 0.9923, test_f1: 0.4931
 epoch: 17, train_loss: 0.9630, test_loss: 0.9958, test_f1: 0.4822
 epoch: 18, train_loss: 0.9662, test_loss: 0.9934, test_f1: 0.4900
 epoch: 19, train_loss: 0.9577, test_loss: 0.9957, test_f1: 0.4822
 epoch: 20, train_loss: 0.9492, test_loss: 1.0018, test_f1: 0.4800
 epoch: 21, train_loss: 0.9448, test_loss: 0.9825, test_f1: 0.5162
 epoch: 22, train_loss: 0.9579, test_loss: 0.9738, test_f1: 0.5055
 epoch: 23, train_loss: 0.9436, test_loss: 0.9682, test_f1: 0.4915
 epoch: 24, train_loss: 0.9252, test_loss: 0.9751, test_f1: 0.4851
 epoch: 25, train_loss: 0.9297, test_loss: 0.9684, test_f1: 0.5006
 epoch: 26, train_loss: 0.9301, test_loss: 0.9797, test_f1: 0.4936
 epoch: 27, train_loss: 0.9297, test_loss: 0.9733, test_f1: 0.5141
 epoch: 28, train_loss: 0.9254, test_loss: 0.9678, test_f1: 0.5095
 epoch: 29, train_loss: 0.9304, test_loss: 0.9863, test_f1: 0.5116
 epoch: 30, train_loss: 0.9302, test_loss: 0.9876, test_f1: 0.4845
 epoch: 31, train_loss: 0.9218, test_loss: 0.9799, test_f1: 0.4875
 epoch: 32, train_loss: 0.9220, test_loss: 0.9676, test_f1: 0.5133
 epoch: 33, train_loss: 0.9195, test_loss: 0.9744, test_f1: 0.5179
 epoch: 34, train_loss: 0.9120, test_loss: 0.9691, test_f1: 0.5098
 epoch: 35, train_loss: 0.9067, test_loss: 0.9658, test_f1: 0.5231
 epoch: 36, train_loss: 0.9059, test_loss: 0.9637, test_f1: 0.5132
 epoch: 37, train_loss: 0.9121, test_loss: 0.9808, test_f1: 0.5061
 epoch: 38, train_loss: 0.8932, test_loss: 0.9768, test_f1: 0.5208
 epoch: 39, train_loss: 0.8936, test_loss: 0.9743, test_f1: 0.5029
 epoch: 40, train_loss: 0.8980, test_loss: 0.9771, test_f1: 0.5074
 epoch: 41, train_loss: 0.8947, test_loss: 0.9682, test_f1: 0.5110
 epoch: 42, train_loss: 0.9004, test_loss: 0.9674, test_f1: 0.5170
 epoch: 43, train_loss: 0.8913, test_loss: 0.9719, test_f1: 0.5200
 epoch: 44, train_loss: 0.8778, test_loss: 0.9752, test_f1: 0.5168
 epoch: 45, train_loss: 0.8959, test_loss: 0.9527, test_f1: 0.5306
 epoch: 46, train_loss: 0.8964, test_loss: 0.9617, test_f1: 0.5112
 epoch: 47, train_loss: 0.8887, test_loss: 0.9492, test_f1: 0.5416
 epoch: 48, train_loss: 0.8981, test_loss: 0.9592, test_f1: 0.5308
 epoch: 49, train_loss: 0.8905, test_loss: 0.9541, test_f1: 0.5220
 epoch: 50, train_loss: 0.8709, test_loss: 0.9364, test_f1: 0.5333
 epoch: 51, train_loss: 0.8750, test_loss: 0.9407, test_f1: 0.5237
 epoch: 52, train_loss: 0.8776, test_loss: 0.9302, test_f1: 0.5354
 epoch: 53, train_loss: 0.8792, test_loss: 0.9419, test_f1: 0.5297
 epoch: 54, train_loss: 0.8745, test_loss: 0.9395, test_f1: 0.5355
 epoch: 55, train_loss: 0.8760, test_loss: 0.9277, test_f1: 0.5380
 epoch: 56, train_loss: 0.8788, test_loss: 0.9415, test_f1: 0.5326
 epoch: 57, train_loss: 0.8745, test_loss: 0.9441, test_f1: 0.5370
 epoch: 58, train_loss: 0.8748, test_loss: 0.9346, test_f1: 0.5120
 epoch: 59, train_loss: 0.8721, test_loss: 0.9377, test_f1: 0.5294
 epoch: 60, train_loss: 0.8610, test_loss: 0.9620, test_f1: 0.5209
 epoch: 61, train_loss: 0.8649, test_loss: 0.9470, test_f1: 0.5164
 epoch: 62, train_loss: 0.8630, test_loss: 0.9354, test_f1: 0.5350
 epoch: 63, train_loss: 0.8627, test_loss: 0.9290, test_f1: 0.5318
 epoch: 64, train_loss: 0.8720, test_loss: 0.9120, test_f1: 0.5256
 epoch: 65, train_loss: 0.8631, test_loss: 0.9392, test_f1: 0.5198
 epoch: 66, train_loss: 0.8533, test_loss: 0.9271, test_f1: 0.5265
 epoch: 67, train_loss: 0.8579, test_loss: 0.9250, test_f1: 0.5251
 epoch: 68, train_loss: 0.8508, test_loss: 0.9199, test_f1: 0.5243
 epoch: 69, train_loss: 0.8562, test_loss: 0.9376, test_f1: 0.5355
 epoch: 70, train_loss: 0.8628, test_loss: 0.9090, test_f1: 0.5189
 epoch: 71, train_loss: 0.8618, test_loss: 0.9196, test_f1: 0.5216
 epoch: 72, train_loss: 0.8576, test_loss: 0.9320, test_f1: 0.5231
 epoch: 73, train_loss: 0.8473, test_loss: 0.9195, test_f1: 0.5334
 epoch: 74, train_loss: 0.8551, test_loss: 0.9143, test_f1: 0.5283
 epoch: 75, train_loss: 0.8551, test_loss: 0.9114, test_f1: 0.5331
 epoch: 76, train_loss: 0.8455, test_loss: 0.9220, test_f1: 0.5287
 epoch: 77, train_loss: 0.8471, test_loss: 0.9308, test_f1: 0.5350
 epoch: 78, train_loss: 0.8607, test_loss: 0.9144, test_f1: 0.5329
 epoch: 79, train_loss: 0.8495, test_loss: 0.9055, test_f1: 0.5313
 epoch: 80, train_loss: 0.8501, test_loss: 0.9207, test_f1: 0.5200
 epoch: 81, train_loss: 0.8519, test_loss: 0.9022, test_f1: 0.5284
 epoch: 82, train_loss: 0.8593, test_loss: 0.9004, test_f1: 0.5426
 epoch: 83, train_loss: 0.8520, test_loss: 0.9151, test_f1: 0.5486
 epoch: 84, train_loss: 0.8577, test_loss: 0.9052, test_f1: 0.5336
 epoch: 85, train_loss: 0.8441, test_loss: 0.9257, test_f1: 0.5340
 epoch: 86, train_loss: 0.8418, test_loss: 0.9145, test_f1: 0.5321
 epoch: 87, train_loss: 0.8517, test_loss: 0.9201, test_f1: 0.5334
 epoch: 88, train_loss: 0.8401, test_loss: 0.9312, test_f1: 0.5368
 epoch: 89, train_loss: 0.8511, test_loss: 0.9230, test_f1: 0.5254
 epoch: 90, train_loss: 0.8528, test_loss: 0.9179, test_f1: 0.5383
 epoch: 91, train_loss: 0.8462, test_loss: 0.9234, test_f1: 0.5227
 epoch: 92, train_loss: 0.8416, test_loss: 0.9063, test_f1: 0.5469
 epoch: 93, train_loss: 0.8364, test_loss: 0.9095, test_f1: 0.5476
 epoch: 94, train_loss: 0.8437, test_loss: 0.9066, test_f1: 0.5387
 epoch: 95, train_loss: 0.8429, test_loss: 0.8921, test_f1: 0.5537
 epoch: 96, train_loss: 0.8358, test_loss: 0.9048, test_f1: 0.5280
 epoch: 97, train_loss: 0.8262, test_loss: 0.9012, test_f1: 0.5489
 epoch: 98, train_loss: 0.8450, test_loss: 0.9065, test_f1: 0.5427
 epoch: 99, train_loss: 0.8456, test_loss: 0.9052, test_f1: 0.5361
##################ITERATION #9 ****************************************
 epoch: 0, train_loss: 1.4681, test_loss: 1.1414, test_f1: 0.4061
 epoch: 1, train_loss: 1.1889, test_loss: 1.1159, test_f1: 0.4161
 epoch: 2, train_loss: 1.1379, test_loss: 1.0444, test_f1: 0.4765
 epoch: 3, train_loss: 1.0888, test_loss: 1.0331, test_f1: 0.4483
 epoch: 4, train_loss: 1.0826, test_loss: 1.0139, test_f1: 0.4645
 epoch: 5, train_loss: 1.0547, test_loss: 1.0082, test_f1: 0.4588
 epoch: 6, train_loss: 1.0446, test_loss: 1.0025, test_f1: 0.4494
 epoch: 7, train_loss: 1.0211, test_loss: 1.0079, test_f1: 0.4756
 epoch: 8, train_loss: 1.0142, test_loss: 0.9733, test_f1: 0.4536
 epoch: 9, train_loss: 1.0022, test_loss: 1.0092, test_f1: 0.4446
 epoch: 10, train_loss: 1.0045, test_loss: 0.9968, test_f1: 0.4416
 epoch: 11, train_loss: 1.0089, test_loss: 0.9836, test_f1: 0.4515
 epoch: 12, train_loss: 0.9831, test_loss: 0.9548, test_f1: 0.4516
 epoch: 13, train_loss: 0.9776, test_loss: 0.9736, test_f1: 0.4793
 epoch: 14, train_loss: 0.9802, test_loss: 0.9673, test_f1: 0.4709
 epoch: 15, train_loss: 0.9778, test_loss: 0.9720, test_f1: 0.4901
 epoch: 16, train_loss: 0.9740, test_loss: 0.9638, test_f1: 0.5025
 epoch: 17, train_loss: 0.9556, test_loss: 0.9840, test_f1: 0.4809
 epoch: 18, train_loss: 0.9637, test_loss: 0.9550, test_f1: 0.4801
 epoch: 19, train_loss: 0.9514, test_loss: 0.9682, test_f1: 0.4961
 epoch: 20, train_loss: 0.9582, test_loss: 0.9711, test_f1: 0.4976
 epoch: 21, train_loss: 0.9428, test_loss: 0.9786, test_f1: 0.4816
 epoch: 22, train_loss: 0.9382, test_loss: 0.9880, test_f1: 0.4976
 epoch: 23, train_loss: 0.9527, test_loss: 0.9802, test_f1: 0.4924
 epoch: 24, train_loss: 0.9495, test_loss: 0.9811, test_f1: 0.4965
 epoch: 25, train_loss: 0.9391, test_loss: 0.9770, test_f1: 0.4981
 epoch: 26, train_loss: 0.9418, test_loss: 0.9637, test_f1: 0.4946
 epoch: 27, train_loss: 0.9242, test_loss: 0.9636, test_f1: 0.4932
 epoch: 28, train_loss: 0.9345, test_loss: 0.9532, test_f1: 0.4874
 epoch: 29, train_loss: 0.9330, test_loss: 0.9674, test_f1: 0.5180
 epoch: 30, train_loss: 0.9156, test_loss: 0.9623, test_f1: 0.5040
 epoch: 31, train_loss: 0.9239, test_loss: 0.9706, test_f1: 0.5051
 epoch: 32, train_loss: 0.9270, test_loss: 0.9505, test_f1: 0.5104
 epoch: 33, train_loss: 0.9317, test_loss: 0.9664, test_f1: 0.5095
 epoch: 34, train_loss: 0.9168, test_loss: 0.9468, test_f1: 0.5063
 epoch: 35, train_loss: 0.9193, test_loss: 0.9690, test_f1: 0.5101
 epoch: 36, train_loss: 0.9179, test_loss: 0.9541, test_f1: 0.5008
 epoch: 37, train_loss: 0.9020, test_loss: 0.9609, test_f1: 0.5053
 epoch: 38, train_loss: 0.9056, test_loss: 0.9517, test_f1: 0.5095
 epoch: 39, train_loss: 0.9021, test_loss: 0.9468, test_f1: 0.5124
 epoch: 40, train_loss: 0.8994, test_loss: 0.9443, test_f1: 0.5149
 epoch: 41, train_loss: 0.9070, test_loss: 0.9619, test_f1: 0.5110
 epoch: 42, train_loss: 0.8957, test_loss: 0.9484, test_f1: 0.5101
 epoch: 43, train_loss: 0.8948, test_loss: 0.9362, test_f1: 0.4976
 epoch: 44, train_loss: 0.8882, test_loss: 0.9535, test_f1: 0.5026
 epoch: 45, train_loss: 0.8912, test_loss: 0.9420, test_f1: 0.5085
 epoch: 46, train_loss: 0.8876, test_loss: 0.9541, test_f1: 0.5142
 epoch: 47, train_loss: 0.8849, test_loss: 0.9270, test_f1: 0.5070
 epoch: 48, train_loss: 0.8873, test_loss: 0.9496, test_f1: 0.5246
 epoch: 49, train_loss: 0.8870, test_loss: 0.9201, test_f1: 0.5143
 epoch: 50, train_loss: 0.8927, test_loss: 0.9319, test_f1: 0.5250
 epoch: 51, train_loss: 0.8722, test_loss: 0.9165, test_f1: 0.5238
 epoch: 52, train_loss: 0.8727, test_loss: 0.9355, test_f1: 0.5249
 epoch: 53, train_loss: 0.8834, test_loss: 0.9218, test_f1: 0.5283
 epoch: 54, train_loss: 0.8743, test_loss: 0.9212, test_f1: 0.5214
 epoch: 55, train_loss: 0.8716, test_loss: 0.9197, test_f1: 0.5269
 epoch: 56, train_loss: 0.8596, test_loss: 0.9165, test_f1: 0.5338
 epoch: 57, train_loss: 0.8711, test_loss: 0.9097, test_f1: 0.5467
 epoch: 58, train_loss: 0.8741, test_loss: 0.9524, test_f1: 0.5238
 epoch: 59, train_loss: 0.8689, test_loss: 0.9240, test_f1: 0.5215
 epoch: 60, train_loss: 0.8611, test_loss: 0.9442, test_f1: 0.5346
 epoch: 61, train_loss: 0.8671, test_loss: 0.8999, test_f1: 0.5284
 epoch: 62, train_loss: 0.8686, test_loss: 0.9403, test_f1: 0.5183
 epoch: 63, train_loss: 0.8615, test_loss: 0.9164, test_f1: 0.5171
 epoch: 64, train_loss: 0.8557, test_loss: 0.9040, test_f1: 0.5256
 epoch: 65, train_loss: 0.8543, test_loss: 0.9065, test_f1: 0.5263
 epoch: 66, train_loss: 0.8705, test_loss: 0.9142, test_f1: 0.5274
 epoch: 67, train_loss: 0.8567, test_loss: 0.9134, test_f1: 0.5336
 epoch: 68, train_loss: 0.8559, test_loss: 0.9044, test_f1: 0.5258
 epoch: 69, train_loss: 0.8512, test_loss: 0.9027, test_f1: 0.5325
 epoch: 70, train_loss: 0.8545, test_loss: 0.8961, test_f1: 0.5339
 epoch: 71, train_loss: 0.8609, test_loss: 0.9313, test_f1: 0.5194
 epoch: 72, train_loss: 0.8495, test_loss: 0.9059, test_f1: 0.5246
 epoch: 73, train_loss: 0.8534, test_loss: 0.9057, test_f1: 0.5257
 epoch: 74, train_loss: 0.8480, test_loss: 0.8992, test_f1: 0.5383
 epoch: 75, train_loss: 0.8554, test_loss: 0.9095, test_f1: 0.5246
 epoch: 76, train_loss: 0.8612, test_loss: 0.9216, test_f1: 0.5303
 epoch: 77, train_loss: 0.8491, test_loss: 0.9266, test_f1: 0.5213
 epoch: 78, train_loss: 0.8471, test_loss: 0.9205, test_f1: 0.5243
 epoch: 79, train_loss: 0.8606, test_loss: 0.9220, test_f1: 0.5260
 epoch: 80, train_loss: 0.8377, test_loss: 0.9090, test_f1: 0.5213
 epoch: 81, train_loss: 0.8487, test_loss: 0.9188, test_f1: 0.5318
 epoch: 82, train_loss: 0.8426, test_loss: 0.9400, test_f1: 0.5200
 epoch: 83, train_loss: 0.8491, test_loss: 0.9282, test_f1: 0.5293
 epoch: 84, train_loss: 0.8484, test_loss: 0.9215, test_f1: 0.5184
 epoch: 85, train_loss: 0.8353, test_loss: 0.9080, test_f1: 0.5272
 epoch: 86, train_loss: 0.8446, test_loss: 0.9201, test_f1: 0.5194
 epoch: 87, train_loss: 0.8527, test_loss: 0.9111, test_f1: 0.5412
 epoch: 88, train_loss: 0.8408, test_loss: 0.9088, test_f1: 0.5509
 epoch: 89, train_loss: 0.8442, test_loss: 0.8941, test_f1: 0.5350
 epoch: 90, train_loss: 0.8349, test_loss: 0.9334, test_f1: 0.5336
 epoch: 91, train_loss: 0.8430, test_loss: 0.9262, test_f1: 0.5420
 epoch: 92, train_loss: 0.8357, test_loss: 0.9127, test_f1: 0.5308
 epoch: 93, train_loss: 0.8370, test_loss: 0.9272, test_f1: 0.5294
 epoch: 94, train_loss: 0.8423, test_loss: 0.8994, test_f1: 0.5293
 epoch: 95, train_loss: 0.8421, test_loss: 0.9084, test_f1: 0.5232
 epoch: 96, train_loss: 0.8415, test_loss: 0.9138, test_f1: 0.5593
 epoch: 97, train_loss: 0.8376, test_loss: 0.8932, test_f1: 0.5302
 epoch: 98, train_loss: 0.8475, test_loss: 0.8931, test_f1: 0.5442
 epoch: 99, train_loss: 0.8400, test_loss: 0.8964, test_f1: 0.5259

Training completed in 789.64 seconds
Best F1: 0.5753 at epoch 72
Mean F1 across iterations: 0.5520  0.0164
========================FINAL RESULTS================================
FEGIN weighted F1: 0.5753  0.0164
python main.py --data ltspice_examples --representation component_net --model FEGIN --layers 2 --hiddens 16 --batch_size 32 --lr 0.001 --emb_size 250 --epochs 100 --save_appendix component_net_L2_H16_BS32_LR0.001_E250 --no_val
-----



STDERR:
  File "main.py", line 370, in <module>
    main()
  File "main.py", line 254, in main
    dataset = dataset_class(
  File "/home/philip/projects/ltspice_examples_code_repo/Circuit-Completion-Using-GNNs/component_classification_with_link_prediction_head/evaluation/FEGIN/kernel/circuit_datasets.py", line 15, in __init__
    self.data, self.slices = torch.load(self.processed_paths[0])
  File "/home/philip/.local/lib/python3.8/site-packages/torch/serialization.py", line 1040, in load
    warnings.warn(
  File "/usr/lib/python3.8/warnings.py", line 109, in _showwarnmsg
    sw(msg.message, msg.category, msg.filename, msg.lineno,
  File "main.py", line 47, in warn_with_traceback
    traceback.print_stack(file=log)
/home/philip/projects/ltspice_examples_code_repo/Circuit-Completion-Using-GNNs/component_classification_with_link_prediction_head/evaluation/FEGIN/kernel/circuit_datasets.py:15: FutureWarning: You are using `torch.load` with `weights_only=False` (the current default value), which uses the default pickle module implicitly. It is possible to construct malicious pickle data which will execute arbitrary code during unpickling (See https://github.com/pytorch/pytorch/blob/main/SECURITY.md#untrusted-models for more details). In a future release, the default value for `weights_only` will be flipped to `True`. This limits the functions that could be executed during unpickling. Arbitrary objects will no longer be allowed to be loaded via this mode unless they are explicitly allowlisted by the user via `torch.serialization.add_safe_globals`. We recommend you start setting `weights_only=True` for any use case where you don't have full control of the loaded file. Please open an issue on GitHub for any issues related to this experimental feature.
  self.data, self.slices = torch.load(self.processed_paths[0])
