STDOUT:
Results will be saved in /home/philip/projects/ltspice_examples_code_repo/Circuit-Completion-Using-GNNs/component_classification_with_link_prediction_head/evaluation/FEGIN/results/model_FEGIN_dataset_ltspice_demos
Command line input: python main.py --data ltspice_demos --representation component_component --model FEGIN --layers 5 --hiddens 128 --batch_size 256 --lr 0.001 --emb_size 512 --epochs 100 --save_appendix component_component_L5_H128_BS256_LR0.001_E512 --no_val
 is saved.
-----
ltspice_demos - FEGIN
Using 5 layers, 128 hidden units, h = 2
Loading component_component representation dataset
ENTERED
Training FEGIN on component_component representation
Train: 1565, Test: 383
##################ITERATION #0 ****************************************
 epoch: 0, train_loss: 1.3418, test_loss: 1.3393, test_f1: 0.1437
 epoch: 1, train_loss: 1.2085, test_loss: 1.3027, test_f1: 0.3496
 epoch: 2, train_loss: 1.1692, test_loss: 1.3062, test_f1: 0.3473
 epoch: 3, train_loss: 1.1193, test_loss: 1.3045, test_f1: 0.3490
 epoch: 4, train_loss: 1.0801, test_loss: 1.2956, test_f1: 0.3753
 epoch: 5, train_loss: 1.0419, test_loss: 1.2990, test_f1: 0.3410
 epoch: 6, train_loss: 1.0279, test_loss: 1.2120, test_f1: 0.4254
 epoch: 7, train_loss: 0.9866, test_loss: 1.1652, test_f1: 0.4628
 epoch: 8, train_loss: 0.9710, test_loss: 1.1894, test_f1: 0.4782
 epoch: 9, train_loss: 0.9393, test_loss: 1.1437, test_f1: 0.4959
 epoch: 10, train_loss: 0.9132, test_loss: 1.1920, test_f1: 0.3878
 epoch: 11, train_loss: 0.8937, test_loss: 1.2069, test_f1: 0.5382
 epoch: 12, train_loss: 0.8491, test_loss: 1.2001, test_f1: 0.5172
 epoch: 13, train_loss: 0.8425, test_loss: 1.1860, test_f1: 0.4673
 epoch: 14, train_loss: 0.8403, test_loss: 1.3110, test_f1: 0.4913
 epoch: 15, train_loss: 0.8488, test_loss: 1.2664, test_f1: 0.4810
 epoch: 16, train_loss: 0.8007, test_loss: 1.2297, test_f1: 0.5472
 epoch: 17, train_loss: 0.7802, test_loss: 1.2021, test_f1: 0.5281
 epoch: 18, train_loss: 0.7511, test_loss: 1.2228, test_f1: 0.5448
 epoch: 19, train_loss: 0.7348, test_loss: 1.2932, test_f1: 0.5056
 epoch: 20, train_loss: 0.7309, test_loss: 1.4345, test_f1: 0.5047
 epoch: 21, train_loss: 0.7432, test_loss: 1.3720, test_f1: 0.5231
 epoch: 22, train_loss: 0.7047, test_loss: 1.4345, test_f1: 0.4639
 epoch: 23, train_loss: 0.6959, test_loss: 1.3946, test_f1: 0.5539
 epoch: 24, train_loss: 0.6782, test_loss: 1.4770, test_f1: 0.4806
 epoch: 25, train_loss: 0.6737, test_loss: 1.3348, test_f1: 0.5035
 epoch: 26, train_loss: 0.6385, test_loss: 1.3646, test_f1: 0.5062
 epoch: 27, train_loss: 0.6662, test_loss: 1.2689, test_f1: 0.5789
 epoch: 28, train_loss: 0.6405, test_loss: 1.4766, test_f1: 0.5402
 epoch: 29, train_loss: 0.6427, test_loss: 1.4980, test_f1: 0.5541
 epoch: 30, train_loss: 0.6314, test_loss: 1.6342, test_f1: 0.5154
 epoch: 31, train_loss: 0.6459, test_loss: 1.4562, test_f1: 0.5535
 epoch: 32, train_loss: 0.6541, test_loss: 1.4330, test_f1: 0.5027
 epoch: 33, train_loss: 0.6616, test_loss: 1.4469, test_f1: 0.4835
 epoch: 34, train_loss: 0.6572, test_loss: 2.0607, test_f1: 0.3620
 epoch: 35, train_loss: 0.6330, test_loss: 1.6597, test_f1: 0.4590
 epoch: 36, train_loss: 0.6098, test_loss: 1.7330, test_f1: 0.5658
 epoch: 37, train_loss: 0.6179, test_loss: 1.5964, test_f1: 0.5427
 epoch: 38, train_loss: 0.5994, test_loss: 1.5851, test_f1: 0.5118
 epoch: 39, train_loss: 0.5615, test_loss: 1.6688, test_f1: 0.4829
 epoch: 40, train_loss: 0.5862, test_loss: 1.5893, test_f1: 0.5202
 epoch: 41, train_loss: 0.5776, test_loss: 1.6920, test_f1: 0.5229
 epoch: 42, train_loss: 0.5848, test_loss: 1.7004, test_f1: 0.5431
 epoch: 43, train_loss: 0.5709, test_loss: 1.7974, test_f1: 0.4981
 epoch: 44, train_loss: 0.5792, test_loss: 1.8828, test_f1: 0.5190
 epoch: 45, train_loss: 0.5681, test_loss: 1.8359, test_f1: 0.5574
 epoch: 46, train_loss: 0.5653, test_loss: 2.0755, test_f1: 0.5115
 epoch: 47, train_loss: 0.5355, test_loss: 1.7571, test_f1: 0.5102
 epoch: 48, train_loss: 0.5325, test_loss: 1.8749, test_f1: 0.5326
 epoch: 49, train_loss: 0.5300, test_loss: 1.9318, test_f1: 0.5049
 epoch: 50, train_loss: 0.4919, test_loss: 1.6898, test_f1: 0.5247
 epoch: 51, train_loss: 0.4503, test_loss: 1.6895, test_f1: 0.4962
 epoch: 52, train_loss: 0.4565, test_loss: 1.6439, test_f1: 0.4966
 epoch: 53, train_loss: 0.4400, test_loss: 1.7563, test_f1: 0.5124
 epoch: 54, train_loss: 0.4438, test_loss: 2.0173, test_f1: 0.5194
 epoch: 55, train_loss: 0.4388, test_loss: 2.0003, test_f1: 0.5131
 epoch: 56, train_loss: 0.3982, test_loss: 1.8911, test_f1: 0.5006
 epoch: 57, train_loss: 0.3975, test_loss: 1.8506, test_f1: 0.5051
 epoch: 58, train_loss: 0.3945, test_loss: 2.0972, test_f1: 0.4433
 epoch: 59, train_loss: 0.4057, test_loss: 1.9852, test_f1: 0.5176
 epoch: 60, train_loss: 0.3845, test_loss: 2.0340, test_f1: 0.5190
 epoch: 61, train_loss: 0.3911, test_loss: 1.8776, test_f1: 0.5234
 epoch: 62, train_loss: 0.4244, test_loss: 1.8118, test_f1: 0.5564
 epoch: 63, train_loss: 0.3985, test_loss: 1.9460, test_f1: 0.5528
 epoch: 64, train_loss: 0.3927, test_loss: 1.9698, test_f1: 0.5434
 epoch: 65, train_loss: 0.3895, test_loss: 1.9955, test_f1: 0.5273
 epoch: 66, train_loss: 0.4008, test_loss: 2.0103, test_f1: 0.5163
 epoch: 67, train_loss: 0.3618, test_loss: 2.2953, test_f1: 0.5040
 epoch: 68, train_loss: 0.3884, test_loss: 2.1140, test_f1: 0.5225
 epoch: 69, train_loss: 0.3914, test_loss: 2.1602, test_f1: 0.5152
 epoch: 70, train_loss: 0.3776, test_loss: 2.1039, test_f1: 0.5314
 epoch: 71, train_loss: 0.3678, test_loss: 2.2081, test_f1: 0.5070
 epoch: 72, train_loss: 0.3532, test_loss: 2.4320, test_f1: 0.4918
 epoch: 73, train_loss: 0.3382, test_loss: 2.4613, test_f1: 0.4854
 epoch: 74, train_loss: 0.3528, test_loss: 2.5298, test_f1: 0.4848
 epoch: 75, train_loss: 0.3530, test_loss: 2.5530, test_f1: 0.5040
 epoch: 76, train_loss: 0.3468, test_loss: 2.5309, test_f1: 0.4882
 epoch: 77, train_loss: 0.3492, test_loss: 2.5606, test_f1: 0.5480
 epoch: 78, train_loss: 0.3438, test_loss: 2.4663, test_f1: 0.5097
 epoch: 79, train_loss: 0.3628, test_loss: 2.2784, test_f1: 0.4968
 epoch: 80, train_loss: 0.4050, test_loss: 2.4440, test_f1: 0.4807
 epoch: 81, train_loss: 0.3705, test_loss: 2.3092, test_f1: 0.5016
 epoch: 82, train_loss: 0.3997, test_loss: 2.2799, test_f1: 0.4943
 epoch: 83, train_loss: 0.3920, test_loss: 2.0309, test_f1: 0.5547
 epoch: 84, train_loss: 0.3802, test_loss: 2.0904, test_f1: 0.5517
 epoch: 85, train_loss: 0.3831, test_loss: 1.9817, test_f1: 0.5290
 epoch: 86, train_loss: 0.3702, test_loss: 1.9968, test_f1: 0.5136
 epoch: 87, train_loss: 0.3445, test_loss: 2.2279, test_f1: 0.4889
 epoch: 88, train_loss: 0.3158, test_loss: 2.3615, test_f1: 0.4809
 epoch: 89, train_loss: 0.3203, test_loss: 2.2479, test_f1: 0.5492
 epoch: 90, train_loss: 0.3096, test_loss: 2.3092, test_f1: 0.5589
 epoch: 91, train_loss: 0.3132, test_loss: 2.3139, test_f1: 0.5478
 epoch: 92, train_loss: 0.3094, test_loss: 2.4794, test_f1: 0.5149
 epoch: 93, train_loss: 0.2861, test_loss: 2.8294, test_f1: 0.5149
 epoch: 94, train_loss: 0.2956, test_loss: 2.7735, test_f1: 0.5519
 epoch: 95, train_loss: 0.2552, test_loss: 2.6663, test_f1: 0.5464
 epoch: 96, train_loss: 0.2723, test_loss: 2.6680, test_f1: 0.5159
 epoch: 97, train_loss: 0.2604, test_loss: 2.8356, test_f1: 0.4606
 epoch: 98, train_loss: 0.2541, test_loss: 2.6796, test_f1: 0.5231
 epoch: 99, train_loss: 0.2960, test_loss: 2.5725, test_f1: 0.5496
##################ITERATION #1 ****************************************
 epoch: 0, train_loss: 1.2498, test_loss: 1.3149, test_f1: 0.3605
 epoch: 1, train_loss: 1.1146, test_loss: 1.2669, test_f1: 0.3164
 epoch: 2, train_loss: 1.0560, test_loss: 1.1966, test_f1: 0.4292
 epoch: 3, train_loss: 1.0095, test_loss: 1.1738, test_f1: 0.4493
 epoch: 4, train_loss: 0.9692, test_loss: 1.1458, test_f1: 0.4421
 epoch: 5, train_loss: 0.9149, test_loss: 1.1273, test_f1: 0.5100
 epoch: 6, train_loss: 0.8854, test_loss: 1.1541, test_f1: 0.5038
 epoch: 7, train_loss: 0.8795, test_loss: 1.1851, test_f1: 0.5128
 epoch: 8, train_loss: 0.8443, test_loss: 1.1668, test_f1: 0.5193
 epoch: 9, train_loss: 0.8192, test_loss: 1.0948, test_f1: 0.5601
 epoch: 10, train_loss: 0.7944, test_loss: 1.2757, test_f1: 0.5040
 epoch: 11, train_loss: 0.8136, test_loss: 1.2465, test_f1: 0.5172
 epoch: 12, train_loss: 0.8111, test_loss: 1.1849, test_f1: 0.5444
 epoch: 13, train_loss: 0.7824, test_loss: 1.2108, test_f1: 0.5415
 epoch: 14, train_loss: 0.7339, test_loss: 1.2216, test_f1: 0.5797
 epoch: 15, train_loss: 0.7299, test_loss: 1.3379, test_f1: 0.5696
 epoch: 16, train_loss: 0.7017, test_loss: 1.3518, test_f1: 0.5663
 epoch: 17, train_loss: 0.6924, test_loss: 1.3502, test_f1: 0.5866
 epoch: 18, train_loss: 0.6576, test_loss: 1.3328, test_f1: 0.5809
 epoch: 19, train_loss: 0.6391, test_loss: 1.2980, test_f1: 0.5998
 epoch: 20, train_loss: 0.6607, test_loss: 1.5282, test_f1: 0.5780
 epoch: 21, train_loss: 0.6609, test_loss: 1.5876, test_f1: 0.5828
 epoch: 22, train_loss: 0.6316, test_loss: 1.6091, test_f1: 0.5588
 epoch: 23, train_loss: 0.6097, test_loss: 1.5357, test_f1: 0.6001
 epoch: 24, train_loss: 0.5830, test_loss: 1.7342, test_f1: 0.6008
 epoch: 25, train_loss: 0.5727, test_loss: 1.7124, test_f1: 0.5941
 epoch: 26, train_loss: 0.5720, test_loss: 1.8932, test_f1: 0.5315
 epoch: 27, train_loss: 0.5819, test_loss: 1.9439, test_f1: 0.5342
 epoch: 28, train_loss: 0.6128, test_loss: 1.7089, test_f1: 0.5424
 epoch: 29, train_loss: 0.5763, test_loss: 1.8013, test_f1: 0.5182
 epoch: 30, train_loss: 0.5860, test_loss: 1.7762, test_f1: 0.5590
 epoch: 31, train_loss: 0.6110, test_loss: 2.2401, test_f1: 0.4794
 epoch: 32, train_loss: 0.5816, test_loss: 2.3052, test_f1: 0.4752
 epoch: 33, train_loss: 0.5521, test_loss: 2.0453, test_f1: 0.5231
 epoch: 34, train_loss: 0.5414, test_loss: 1.7907, test_f1: 0.5633
 epoch: 35, train_loss: 0.5025, test_loss: 1.7031, test_f1: 0.5710
 epoch: 36, train_loss: 0.4839, test_loss: 1.9325, test_f1: 0.5244
 epoch: 37, train_loss: 0.5387, test_loss: 1.8636, test_f1: 0.5638
 epoch: 38, train_loss: 0.4930, test_loss: 1.9809, test_f1: 0.5224
 epoch: 39, train_loss: 0.5248, test_loss: 1.8172, test_f1: 0.5425
 epoch: 40, train_loss: 0.5096, test_loss: 2.0771, test_f1: 0.5474
 epoch: 41, train_loss: 0.4761, test_loss: 2.3595, test_f1: 0.5296
 epoch: 42, train_loss: 0.4959, test_loss: 2.3488, test_f1: 0.4978
 epoch: 43, train_loss: 0.4873, test_loss: 2.3944, test_f1: 0.4766
 epoch: 44, train_loss: 0.4958, test_loss: 1.9732, test_f1: 0.5827
 epoch: 45, train_loss: 0.4605, test_loss: 1.9008, test_f1: 0.5792
 epoch: 46, train_loss: 0.4364, test_loss: 2.1244, test_f1: 0.5586
 epoch: 47, train_loss: 0.4465, test_loss: 2.2657, test_f1: 0.5676
 epoch: 48, train_loss: 0.4236, test_loss: 2.2155, test_f1: 0.5607
 epoch: 49, train_loss: 0.4277, test_loss: 2.1235, test_f1: 0.5147
 epoch: 50, train_loss: 0.4291, test_loss: 2.4684, test_f1: 0.5929
 epoch: 51, train_loss: 0.4228, test_loss: 2.0942, test_f1: 0.6059
 epoch: 52, train_loss: 0.4015, test_loss: 1.9102, test_f1: 0.6008
 epoch: 53, train_loss: 0.3681, test_loss: 2.0320, test_f1: 0.5647
 epoch: 54, train_loss: 0.3683, test_loss: 2.2281, test_f1: 0.5363
 epoch: 55, train_loss: 0.3832, test_loss: 2.1559, test_f1: 0.5732
 epoch: 56, train_loss: 0.3729, test_loss: 1.9758, test_f1: 0.6057
 epoch: 57, train_loss: 0.3518, test_loss: 1.9657, test_f1: 0.5929
 epoch: 58, train_loss: 0.3479, test_loss: 1.9680, test_f1: 0.5991
 epoch: 59, train_loss: 0.3364, test_loss: 2.0578, test_f1: 0.6121
 epoch: 60, train_loss: 0.3324, test_loss: 2.3304, test_f1: 0.6060
 epoch: 61, train_loss: 0.3232, test_loss: 2.2552, test_f1: 0.5884
 epoch: 62, train_loss: 0.3166, test_loss: 2.1317, test_f1: 0.5732
 epoch: 63, train_loss: 0.2951, test_loss: 2.1121, test_f1: 0.5595
 epoch: 64, train_loss: 0.2892, test_loss: 2.2451, test_f1: 0.5298
 epoch: 65, train_loss: 0.3148, test_loss: 2.2483, test_f1: 0.5963
 epoch: 66, train_loss: 0.3372, test_loss: 2.9689, test_f1: 0.5927
 epoch: 67, train_loss: 0.3101, test_loss: 2.6819, test_f1: 0.5976
 epoch: 68, train_loss: 0.3168, test_loss: 2.6511, test_f1: 0.5836
 epoch: 69, train_loss: 0.3283, test_loss: 3.0654, test_f1: 0.5743
 epoch: 70, train_loss: 0.3506, test_loss: 2.3601, test_f1: 0.5738
 epoch: 71, train_loss: 0.3111, test_loss: 2.1292, test_f1: 0.5695
 epoch: 72, train_loss: 0.3047, test_loss: 2.3636, test_f1: 0.5752
 epoch: 73, train_loss: 0.3174, test_loss: 2.5405, test_f1: 0.5382
 epoch: 74, train_loss: 0.3088, test_loss: 2.3997, test_f1: 0.5517
 epoch: 75, train_loss: 0.3379, test_loss: 2.3550, test_f1: 0.5997
 epoch: 76, train_loss: 0.3747, test_loss: 2.3572, test_f1: 0.5787
 epoch: 77, train_loss: 0.3507, test_loss: 2.1797, test_f1: 0.6018
 epoch: 78, train_loss: 0.3523, test_loss: 2.2152, test_f1: 0.5866
 epoch: 79, train_loss: 0.3258, test_loss: 2.2959, test_f1: 0.5962
 epoch: 80, train_loss: 0.3301, test_loss: 2.3829, test_f1: 0.5545
 epoch: 81, train_loss: 0.3584, test_loss: 2.4883, test_f1: 0.5671
 epoch: 82, train_loss: 0.3151, test_loss: 2.5536, test_f1: 0.5727
 epoch: 83, train_loss: 0.3052, test_loss: 3.0320, test_f1: 0.6105
 epoch: 84, train_loss: 0.2969, test_loss: 3.6714, test_f1: 0.6023
 epoch: 85, train_loss: 0.2929, test_loss: 3.2999, test_f1: 0.5791
 epoch: 86, train_loss: 0.3088, test_loss: 3.2142, test_f1: 0.5998
 epoch: 87, train_loss: 0.2739, test_loss: 2.8070, test_f1: 0.5819
 epoch: 88, train_loss: 0.2701, test_loss: 2.5883, test_f1: 0.5969
 epoch: 89, train_loss: 0.2691, test_loss: 2.9797, test_f1: 0.6151
 epoch: 90, train_loss: 0.2950, test_loss: 3.1307, test_f1: 0.5846
 epoch: 91, train_loss: 0.2954, test_loss: 2.6627, test_f1: 0.6091
 epoch: 92, train_loss: 0.2946, test_loss: 2.6213, test_f1: 0.6017
 epoch: 93, train_loss: 0.2988, test_loss: 2.5951, test_f1: 0.6233
 epoch: 94, train_loss: 0.2635, test_loss: 2.5374, test_f1: 0.6164
 epoch: 95, train_loss: 0.2564, test_loss: 2.5274, test_f1: 0.5981
 epoch: 96, train_loss: 0.2522, test_loss: 2.7101, test_f1: 0.5931
 epoch: 97, train_loss: 0.2639, test_loss: 3.0589, test_f1: 0.5688
 epoch: 98, train_loss: 0.2725, test_loss: 3.2140, test_f1: 0.5763
 epoch: 99, train_loss: 0.2872, test_loss: 3.3201, test_f1: 0.5701
##################ITERATION #2 ****************************************
 epoch: 0, train_loss: 1.2372, test_loss: 1.3434, test_f1: 0.1836
 epoch: 1, train_loss: 1.1151, test_loss: 1.2919, test_f1: 0.2113
 epoch: 2, train_loss: 1.0573, test_loss: 1.2360, test_f1: 0.3869
 epoch: 3, train_loss: 1.0087, test_loss: 1.2091, test_f1: 0.4343
 epoch: 4, train_loss: 0.9853, test_loss: 1.1896, test_f1: 0.4316
 epoch: 5, train_loss: 0.9252, test_loss: 1.1104, test_f1: 0.5517
 epoch: 6, train_loss: 0.9096, test_loss: 1.1134, test_f1: 0.5258
 epoch: 7, train_loss: 0.8681, test_loss: 1.1101, test_f1: 0.5022
 epoch: 8, train_loss: 0.8427, test_loss: 1.1316, test_f1: 0.5160
 epoch: 9, train_loss: 0.7805, test_loss: 1.1574, test_f1: 0.5375
 epoch: 10, train_loss: 0.7880, test_loss: 1.2415, test_f1: 0.5145
 epoch: 11, train_loss: 0.7660, test_loss: 1.2976, test_f1: 0.5542
 epoch: 12, train_loss: 0.7737, test_loss: 1.3076, test_f1: 0.5605
 epoch: 13, train_loss: 0.7522, test_loss: 1.3967, test_f1: 0.4998
 epoch: 14, train_loss: 0.8071, test_loss: 1.2859, test_f1: 0.5209
 epoch: 15, train_loss: 0.7857, test_loss: 1.2561, test_f1: 0.5505
 epoch: 16, train_loss: 0.7521, test_loss: 1.4576, test_f1: 0.5372
 epoch: 17, train_loss: 0.7487, test_loss: 1.2872, test_f1: 0.5458
 epoch: 18, train_loss: 0.7370, test_loss: 1.2691, test_f1: 0.5561
 epoch: 19, train_loss: 0.7239, test_loss: 1.4276, test_f1: 0.5522
 epoch: 20, train_loss: 0.7015, test_loss: 1.4010, test_f1: 0.5593
 epoch: 21, train_loss: 0.6941, test_loss: 1.4145, test_f1: 0.5228
 epoch: 22, train_loss: 0.6561, test_loss: 1.4109, test_f1: 0.5677
 epoch: 23, train_loss: 0.6331, test_loss: 1.4143, test_f1: 0.5725
 epoch: 24, train_loss: 0.6305, test_loss: 1.5494, test_f1: 0.5759
 epoch: 25, train_loss: 0.6149, test_loss: 1.6490, test_f1: 0.5233
 epoch: 26, train_loss: 0.6156, test_loss: 1.7576, test_f1: 0.5447
 epoch: 27, train_loss: 0.6268, test_loss: 1.5874, test_f1: 0.5162
 epoch: 28, train_loss: 0.6266, test_loss: 1.6886, test_f1: 0.5216
 epoch: 29, train_loss: 0.6361, test_loss: 1.5482, test_f1: 0.5879
 epoch: 30, train_loss: 0.5842, test_loss: 1.5241, test_f1: 0.5547
 epoch: 31, train_loss: 0.5684, test_loss: 1.4673, test_f1: 0.5859
 epoch: 32, train_loss: 0.5771, test_loss: 1.6374, test_f1: 0.5767
 epoch: 33, train_loss: 0.5795, test_loss: 1.8066, test_f1: 0.4782
 epoch: 34, train_loss: 0.5970, test_loss: 1.4833, test_f1: 0.5570
 epoch: 35, train_loss: 0.5896, test_loss: 1.5785, test_f1: 0.5510
 epoch: 36, train_loss: 0.5770, test_loss: 1.4630, test_f1: 0.5515
 epoch: 37, train_loss: 0.5778, test_loss: 1.5139, test_f1: 0.5723
 epoch: 38, train_loss: 0.5491, test_loss: 1.5394, test_f1: 0.5794
 epoch: 39, train_loss: 0.5266, test_loss: 1.7325, test_f1: 0.5471
 epoch: 40, train_loss: 0.5345, test_loss: 1.9040, test_f1: 0.5424
 epoch: 41, train_loss: 0.5457, test_loss: 1.6497, test_f1: 0.5434
 epoch: 42, train_loss: 0.5994, test_loss: 1.4259, test_f1: 0.6034
 epoch: 43, train_loss: 0.5722, test_loss: 1.6211, test_f1: 0.5365
 epoch: 44, train_loss: 0.5685, test_loss: 1.3276, test_f1: 0.5717
 epoch: 45, train_loss: 0.5581, test_loss: 1.6648, test_f1: 0.4815
 epoch: 46, train_loss: 0.6020, test_loss: 1.8384, test_f1: 0.4671
 epoch: 47, train_loss: 0.5763, test_loss: 1.9622, test_f1: 0.4776
 epoch: 48, train_loss: 0.5567, test_loss: 1.6267, test_f1: 0.5127
 epoch: 49, train_loss: 0.5267, test_loss: 1.4770, test_f1: 0.5406
 epoch: 50, train_loss: 0.4925, test_loss: 1.6271, test_f1: 0.5849
 epoch: 51, train_loss: 0.4397, test_loss: 1.6340, test_f1: 0.5641
 epoch: 52, train_loss: 0.4307, test_loss: 1.6671, test_f1: 0.5459
 epoch: 53, train_loss: 0.4213, test_loss: 1.7058, test_f1: 0.5514
 epoch: 54, train_loss: 0.4223, test_loss: 1.6520, test_f1: 0.5453
 epoch: 55, train_loss: 0.4209, test_loss: 1.5867, test_f1: 0.5697
 epoch: 56, train_loss: 0.4317, test_loss: 1.6665, test_f1: 0.5689
 epoch: 57, train_loss: 0.4418, test_loss: 1.7353, test_f1: 0.5402
 epoch: 58, train_loss: 0.4384, test_loss: 1.7550, test_f1: 0.5179
 epoch: 59, train_loss: 0.4651, test_loss: 1.6671, test_f1: 0.5218
 epoch: 60, train_loss: 0.4284, test_loss: 1.7325, test_f1: 0.5585
 epoch: 61, train_loss: 0.4259, test_loss: 1.7387, test_f1: 0.5421
 epoch: 62, train_loss: 0.3964, test_loss: 1.6655, test_f1: 0.5542
 epoch: 63, train_loss: 0.4031, test_loss: 1.6874, test_f1: 0.5602
 epoch: 64, train_loss: 0.3971, test_loss: 1.7366, test_f1: 0.5664
 epoch: 65, train_loss: 0.3647, test_loss: 1.7986, test_f1: 0.5630
 epoch: 66, train_loss: 0.3916, test_loss: 1.8320, test_f1: 0.5547
 epoch: 67, train_loss: 0.3640, test_loss: 1.9322, test_f1: 0.5600
 epoch: 68, train_loss: 0.4155, test_loss: 1.9039, test_f1: 0.5266
 epoch: 69, train_loss: 0.4289, test_loss: 1.8030, test_f1: 0.5303
 epoch: 70, train_loss: 0.3807, test_loss: 1.7872, test_f1: 0.5275
 epoch: 71, train_loss: 0.3559, test_loss: 1.8391, test_f1: 0.5416
 epoch: 72, train_loss: 0.3475, test_loss: 1.9521, test_f1: 0.5527
 epoch: 73, train_loss: 0.3911, test_loss: 2.0617, test_f1: 0.5388
 epoch: 74, train_loss: 0.3527, test_loss: 1.8840, test_f1: 0.5672
 epoch: 75, train_loss: 0.3473, test_loss: 1.7033, test_f1: 0.5859
 epoch: 76, train_loss: 0.3712, test_loss: 1.8182, test_f1: 0.5479
 epoch: 77, train_loss: 0.3334, test_loss: 2.0493, test_f1: 0.5236
 epoch: 78, train_loss: 0.3222, test_loss: 2.0304, test_f1: 0.5480
 epoch: 79, train_loss: 0.3510, test_loss: 2.0377, test_f1: 0.5580
 epoch: 80, train_loss: 0.3672, test_loss: 2.3060, test_f1: 0.5216
 epoch: 81, train_loss: 0.3687, test_loss: 2.4711, test_f1: 0.5331
 epoch: 82, train_loss: 0.3544, test_loss: 2.2442, test_f1: 0.5752
 epoch: 83, train_loss: 0.3192, test_loss: 2.2422, test_f1: 0.5651
 epoch: 84, train_loss: 0.3261, test_loss: 2.2378, test_f1: 0.5221
 epoch: 85, train_loss: 0.3317, test_loss: 2.0758, test_f1: 0.5640
 epoch: 86, train_loss: 0.3070, test_loss: 2.2058, test_f1: 0.5533
 epoch: 87, train_loss: 0.3236, test_loss: 2.2472, test_f1: 0.5727
 epoch: 88, train_loss: 0.3088, test_loss: 2.2117, test_f1: 0.5339
 epoch: 89, train_loss: 0.3194, test_loss: 2.0492, test_f1: 0.5677
 epoch: 90, train_loss: 0.3242, test_loss: 2.1985, test_f1: 0.5660
 epoch: 91, train_loss: 0.3522, test_loss: 2.0444, test_f1: 0.5894
 epoch: 92, train_loss: 0.3561, test_loss: 1.9966, test_f1: 0.5798
 epoch: 93, train_loss: 0.3523, test_loss: 2.2601, test_f1: 0.5514
 epoch: 94, train_loss: 0.3384, test_loss: 2.0961, test_f1: 0.5666
 epoch: 95, train_loss: 0.3263, test_loss: 2.1363, test_f1: 0.5311
 epoch: 96, train_loss: 0.3241, test_loss: 2.1348, test_f1: 0.5453
 epoch: 97, train_loss: 0.3132, test_loss: 2.1747, test_f1: 0.5754
 epoch: 98, train_loss: 0.3178, test_loss: 2.0680, test_f1: 0.5738
 epoch: 99, train_loss: 0.3271, test_loss: 2.1117, test_f1: 0.5572
##################ITERATION #3 ****************************************
 epoch: 0, train_loss: 1.2238, test_loss: 1.3308, test_f1: 0.1788
 epoch: 1, train_loss: 1.0893, test_loss: 1.3127, test_f1: 0.2326
 epoch: 2, train_loss: 1.0536, test_loss: 1.2607, test_f1: 0.2863
 epoch: 3, train_loss: 1.0079, test_loss: 1.2760, test_f1: 0.3956
 epoch: 4, train_loss: 0.9564, test_loss: 1.2475, test_f1: 0.4179
 epoch: 5, train_loss: 0.9261, test_loss: 1.1551, test_f1: 0.5197
 epoch: 6, train_loss: 0.8697, test_loss: 1.0947, test_f1: 0.5491
 epoch: 7, train_loss: 0.8476, test_loss: 1.1543, test_f1: 0.4989
 epoch: 8, train_loss: 0.8437, test_loss: 1.0953, test_f1: 0.5356
 epoch: 9, train_loss: 0.7800, test_loss: 1.1018, test_f1: 0.5622
 epoch: 10, train_loss: 0.7744, test_loss: 1.1353, test_f1: 0.5712
 epoch: 11, train_loss: 0.8104, test_loss: 1.1992, test_f1: 0.5299
 epoch: 12, train_loss: 0.8002, test_loss: 1.1728, test_f1: 0.4802
 epoch: 13, train_loss: 0.7880, test_loss: 1.1968, test_f1: 0.5537
 epoch: 14, train_loss: 0.7767, test_loss: 1.4182, test_f1: 0.4618
 epoch: 15, train_loss: 0.7374, test_loss: 1.3632, test_f1: 0.5271
 epoch: 16, train_loss: 0.7637, test_loss: 1.2239, test_f1: 0.5584
 epoch: 17, train_loss: 0.7413, test_loss: 1.3360, test_f1: 0.5249
 epoch: 18, train_loss: 0.7148, test_loss: 1.2838, test_f1: 0.5475
 epoch: 19, train_loss: 0.7190, test_loss: 1.3206, test_f1: 0.5024
 epoch: 20, train_loss: 0.7178, test_loss: 1.1982, test_f1: 0.5781
 epoch: 21, train_loss: 0.6760, test_loss: 1.5369, test_f1: 0.5479
 epoch: 22, train_loss: 0.6474, test_loss: 1.4517, test_f1: 0.5224
 epoch: 23, train_loss: 0.6533, test_loss: 1.4618, test_f1: 0.5417
 epoch: 24, train_loss: 0.6489, test_loss: 1.3607, test_f1: 0.5882
 epoch: 25, train_loss: 0.6521, test_loss: 1.5357, test_f1: 0.5575
 epoch: 26, train_loss: 0.6337, test_loss: 1.4798, test_f1: 0.5487
 epoch: 27, train_loss: 0.5998, test_loss: 1.5068, test_f1: 0.5527
 epoch: 28, train_loss: 0.5941, test_loss: 1.8171, test_f1: 0.5134
 epoch: 29, train_loss: 0.5823, test_loss: 1.5432, test_f1: 0.5587
 epoch: 30, train_loss: 0.5622, test_loss: 1.6478, test_f1: 0.5543
 epoch: 31, train_loss: 0.5905, test_loss: 1.6595, test_f1: 0.5248
 epoch: 32, train_loss: 0.5812, test_loss: 1.6434, test_f1: 0.5758
 epoch: 33, train_loss: 0.5655, test_loss: 1.8325, test_f1: 0.5663
 epoch: 34, train_loss: 0.5675, test_loss: 1.4803, test_f1: 0.5789
 epoch: 35, train_loss: 0.5612, test_loss: 1.3179, test_f1: 0.6021
 epoch: 36, train_loss: 0.5640, test_loss: 1.6428, test_f1: 0.5296
 epoch: 37, train_loss: 0.5541, test_loss: 1.7005, test_f1: 0.5032
 epoch: 38, train_loss: 0.5748, test_loss: 1.5430, test_f1: 0.5606
 epoch: 39, train_loss: 0.5338, test_loss: 1.5967, test_f1: 0.5306
 epoch: 40, train_loss: 0.5667, test_loss: 1.6967, test_f1: 0.5152
 epoch: 41, train_loss: 0.5764, test_loss: 1.5360, test_f1: 0.5481
 epoch: 42, train_loss: 0.5665, test_loss: 1.4981, test_f1: 0.5691
 epoch: 43, train_loss: 0.5458, test_loss: 1.5450, test_f1: 0.5626
 epoch: 44, train_loss: 0.5245, test_loss: 1.5014, test_f1: 0.5463
 epoch: 45, train_loss: 0.5337, test_loss: 1.6375, test_f1: 0.5229
 epoch: 46, train_loss: 0.5376, test_loss: 1.4931, test_f1: 0.5722
 epoch: 47, train_loss: 0.5265, test_loss: 1.5694, test_f1: 0.5375
 epoch: 48, train_loss: 0.5056, test_loss: 1.6395, test_f1: 0.5862
 epoch: 49, train_loss: 0.5014, test_loss: 1.6739, test_f1: 0.5819
 epoch: 50, train_loss: 0.5385, test_loss: 1.6145, test_f1: 0.6088
 epoch: 51, train_loss: 0.4931, test_loss: 1.4705, test_f1: 0.6144
 epoch: 52, train_loss: 0.4722, test_loss: 1.4986, test_f1: 0.6047
 epoch: 53, train_loss: 0.4554, test_loss: 1.5902, test_f1: 0.5856
 epoch: 54, train_loss: 0.4519, test_loss: 1.8869, test_f1: 0.5342
 epoch: 55, train_loss: 0.4224, test_loss: 1.7089, test_f1: 0.5336
 epoch: 56, train_loss: 0.4204, test_loss: 1.8205, test_f1: 0.5358
 epoch: 57, train_loss: 0.4055, test_loss: 2.0429, test_f1: 0.5596
 epoch: 58, train_loss: 0.4266, test_loss: 2.0065, test_f1: 0.5512
 epoch: 59, train_loss: 0.4075, test_loss: 2.1035, test_f1: 0.5428
 epoch: 60, train_loss: 0.4489, test_loss: 2.3443, test_f1: 0.4754
 epoch: 61, train_loss: 0.4726, test_loss: 1.8487, test_f1: 0.5476
 epoch: 62, train_loss: 0.4383, test_loss: 1.8408, test_f1: 0.5713
 epoch: 63, train_loss: 0.4525, test_loss: 1.8510, test_f1: 0.5716
 epoch: 64, train_loss: 0.4442, test_loss: 1.7718, test_f1: 0.5748
 epoch: 65, train_loss: 0.4140, test_loss: 2.0095, test_f1: 0.5524
 epoch: 66, train_loss: 0.4050, test_loss: 2.0088, test_f1: 0.5360
 epoch: 67, train_loss: 0.3829, test_loss: 1.9973, test_f1: 0.5227
 epoch: 68, train_loss: 0.3657, test_loss: 2.0072, test_f1: 0.5490
 epoch: 69, train_loss: 0.3437, test_loss: 2.0167, test_f1: 0.5268
 epoch: 70, train_loss: 0.3402, test_loss: 1.9033, test_f1: 0.5402
 epoch: 71, train_loss: 0.3454, test_loss: 1.8766, test_f1: 0.5694
 epoch: 72, train_loss: 0.3721, test_loss: 2.0475, test_f1: 0.5657
 epoch: 73, train_loss: 0.3619, test_loss: 2.0631, test_f1: 0.5668
 epoch: 74, train_loss: 0.3699, test_loss: 2.0094, test_f1: 0.5645
 epoch: 75, train_loss: 0.3566, test_loss: 1.9390, test_f1: 0.5730
 epoch: 76, train_loss: 0.3471, test_loss: 2.0034, test_f1: 0.5693
 epoch: 77, train_loss: 0.3337, test_loss: 2.0991, test_f1: 0.5740
 epoch: 78, train_loss: 0.3579, test_loss: 2.3606, test_f1: 0.5124
 epoch: 79, train_loss: 0.3845, test_loss: 2.2726, test_f1: 0.5077
 epoch: 80, train_loss: 0.3637, test_loss: 2.4380, test_f1: 0.5081
 epoch: 81, train_loss: 0.3734, test_loss: 2.2308, test_f1: 0.5521
 epoch: 82, train_loss: 0.3541, test_loss: 2.2076, test_f1: 0.5341
 epoch: 83, train_loss: 0.3666, test_loss: 2.0060, test_f1: 0.5801
 epoch: 84, train_loss: 0.3310, test_loss: 2.1368, test_f1: 0.5637
 epoch: 85, train_loss: 0.3337, test_loss: 2.1405, test_f1: 0.5505
 epoch: 86, train_loss: 0.3231, test_loss: 1.9905, test_f1: 0.5760
 epoch: 87, train_loss: 0.3319, test_loss: 1.9272, test_f1: 0.5820
 epoch: 88, train_loss: 0.3340, test_loss: 2.1409, test_f1: 0.5548
 epoch: 89, train_loss: 0.3238, test_loss: 2.2382, test_f1: 0.5716
 epoch: 90, train_loss: 0.3021, test_loss: 2.1722, test_f1: 0.5414
 epoch: 91, train_loss: 0.3429, test_loss: 2.0930, test_f1: 0.5172
 epoch: 92, train_loss: 0.3126, test_loss: 1.9839, test_f1: 0.5970
 epoch: 93, train_loss: 0.3237, test_loss: 2.0704, test_f1: 0.5922
 epoch: 94, train_loss: 0.3136, test_loss: 2.0342, test_f1: 0.5642
 epoch: 95, train_loss: 0.3365, test_loss: 2.2402, test_f1: 0.5476
 epoch: 96, train_loss: 0.3331, test_loss: 2.2885, test_f1: 0.5500
 epoch: 97, train_loss: 0.3249, test_loss: 2.0215, test_f1: 0.5789
 epoch: 98, train_loss: 0.3080, test_loss: 2.1084, test_f1: 0.5780
 epoch: 99, train_loss: 0.3102, test_loss: 2.0062, test_f1: 0.5686
##################ITERATION #4 ****************************************
 epoch: 0, train_loss: 1.2879, test_loss: 1.4411, test_f1: 0.1365
 epoch: 1, train_loss: 1.1312, test_loss: 1.3288, test_f1: 0.3371
 epoch: 2, train_loss: 1.0720, test_loss: 1.2645, test_f1: 0.3431
 epoch: 3, train_loss: 1.0283, test_loss: 1.2617, test_f1: 0.3454
 epoch: 4, train_loss: 0.9968, test_loss: 1.2153, test_f1: 0.4140
 epoch: 5, train_loss: 0.9839, test_loss: 1.1770, test_f1: 0.5268
 epoch: 6, train_loss: 0.9427, test_loss: 1.1954, test_f1: 0.4660
 epoch: 7, train_loss: 0.8889, test_loss: 1.1997, test_f1: 0.4066
 epoch: 8, train_loss: 0.8985, test_loss: 1.2484, test_f1: 0.4942
 epoch: 9, train_loss: 0.8592, test_loss: 1.2280, test_f1: 0.5215
 epoch: 10, train_loss: 0.8640, test_loss: 1.0996, test_f1: 0.5446
 epoch: 11, train_loss: 0.8182, test_loss: 1.0720, test_f1: 0.5894
 epoch: 12, train_loss: 0.8066, test_loss: 1.1750, test_f1: 0.5550
 epoch: 13, train_loss: 0.8112, test_loss: 1.2687, test_f1: 0.5317
 epoch: 14, train_loss: 0.7829, test_loss: 1.2340, test_f1: 0.5852
 epoch: 15, train_loss: 0.7691, test_loss: 1.2413, test_f1: 0.5101
 epoch: 16, train_loss: 0.7446, test_loss: 1.2951, test_f1: 0.4874
 epoch: 17, train_loss: 0.7416, test_loss: 1.3085, test_f1: 0.5230
 epoch: 18, train_loss: 0.7268, test_loss: 1.3039, test_f1: 0.5448
 epoch: 19, train_loss: 0.7071, test_loss: 1.2536, test_f1: 0.5599
 epoch: 20, train_loss: 0.7281, test_loss: 1.6176, test_f1: 0.4640
 epoch: 21, train_loss: 0.7063, test_loss: 1.4412, test_f1: 0.5401
 epoch: 22, train_loss: 0.7563, test_loss: 1.2818, test_f1: 0.5711
 epoch: 23, train_loss: 0.7578, test_loss: 1.2695, test_f1: 0.5524
 epoch: 24, train_loss: 0.7184, test_loss: 1.2875, test_f1: 0.5002
 epoch: 25, train_loss: 0.7028, test_loss: 1.2359, test_f1: 0.5310
 epoch: 26, train_loss: 0.6938, test_loss: 1.2532, test_f1: 0.5618
 epoch: 27, train_loss: 0.6781, test_loss: 1.2359, test_f1: 0.5488
 epoch: 28, train_loss: 0.6525, test_loss: 1.2032, test_f1: 0.5959
 epoch: 29, train_loss: 0.6390, test_loss: 1.3686, test_f1: 0.5409
 epoch: 30, train_loss: 0.6270, test_loss: 1.5070, test_f1: 0.5224
 epoch: 31, train_loss: 0.6067, test_loss: 1.4463, test_f1: 0.5346
 epoch: 32, train_loss: 0.6349, test_loss: 1.5084, test_f1: 0.5712
 epoch: 33, train_loss: 0.6420, test_loss: 1.6088, test_f1: 0.5445
 epoch: 34, train_loss: 0.6365, test_loss: 1.5805, test_f1: 0.5256
 epoch: 35, train_loss: 0.6380, test_loss: 1.5562, test_f1: 0.5712
 epoch: 36, train_loss: 0.6245, test_loss: 1.5025, test_f1: 0.5796
 epoch: 37, train_loss: 0.5840, test_loss: 1.4073, test_f1: 0.6083
 epoch: 38, train_loss: 0.6211, test_loss: 1.7144, test_f1: 0.5759
 epoch: 39, train_loss: 0.5748, test_loss: 1.7081, test_f1: 0.5436
 epoch: 40, train_loss: 0.6099, test_loss: 1.5828, test_f1: 0.5567
 epoch: 41, train_loss: 0.5564, test_loss: 1.5146, test_f1: 0.5323
 epoch: 42, train_loss: 0.5752, test_loss: 1.5116, test_f1: 0.5542
 epoch: 43, train_loss: 0.5594, test_loss: 1.6543, test_f1: 0.5398
 epoch: 44, train_loss: 0.5541, test_loss: 1.7168, test_f1: 0.5858
 epoch: 45, train_loss: 0.5191, test_loss: 1.5806, test_f1: 0.5351
 epoch: 46, train_loss: 0.5115, test_loss: 1.6664, test_f1: 0.5559
 epoch: 47, train_loss: 0.5049, test_loss: 1.7282, test_f1: 0.5580
 epoch: 48, train_loss: 0.4959, test_loss: 1.5463, test_f1: 0.5688
 epoch: 49, train_loss: 0.4849, test_loss: 1.7159, test_f1: 0.5362
 epoch: 50, train_loss: 0.5250, test_loss: 1.7790, test_f1: 0.5235
 epoch: 51, train_loss: 0.4958, test_loss: 1.8003, test_f1: 0.5233
 epoch: 52, train_loss: 0.5184, test_loss: 1.9379, test_f1: 0.4806
 epoch: 53, train_loss: 0.5512, test_loss: 1.8529, test_f1: 0.5361
 epoch: 54, train_loss: 0.5346, test_loss: 1.7896, test_f1: 0.5078
 epoch: 55, train_loss: 0.5194, test_loss: 1.7001, test_f1: 0.5317
 epoch: 56, train_loss: 0.4930, test_loss: 1.6956, test_f1: 0.5345
 epoch: 57, train_loss: 0.4668, test_loss: 1.7476, test_f1: 0.5691
 epoch: 58, train_loss: 0.4489, test_loss: 1.7498, test_f1: 0.5669
 epoch: 59, train_loss: 0.4519, test_loss: 1.7995, test_f1: 0.5701
 epoch: 60, train_loss: 0.4312, test_loss: 1.8905, test_f1: 0.5441
 epoch: 61, train_loss: 0.4164, test_loss: 1.7682, test_f1: 0.5642
 epoch: 62, train_loss: 0.4020, test_loss: 1.7004, test_f1: 0.5657
 epoch: 63, train_loss: 0.4169, test_loss: 1.8844, test_f1: 0.5234
 epoch: 64, train_loss: 0.4032, test_loss: 2.0583, test_f1: 0.5019
 epoch: 65, train_loss: 0.4083, test_loss: 1.9560, test_f1: 0.5266
 epoch: 66, train_loss: 0.4276, test_loss: 1.7962, test_f1: 0.5351
 epoch: 67, train_loss: 0.3984, test_loss: 1.6676, test_f1: 0.5129
 epoch: 68, train_loss: 0.4341, test_loss: 1.6443, test_f1: 0.5828
 epoch: 69, train_loss: 0.3913, test_loss: 1.7821, test_f1: 0.5651
 epoch: 70, train_loss: 0.4033, test_loss: 1.8926, test_f1: 0.5439
 epoch: 71, train_loss: 0.4316, test_loss: 1.8303, test_f1: 0.6018
 epoch: 72, train_loss: 0.3820, test_loss: 1.7598, test_f1: 0.5947
 epoch: 73, train_loss: 0.3728, test_loss: 1.7671, test_f1: 0.6154
 epoch: 74, train_loss: 0.3791, test_loss: 1.8705, test_f1: 0.5948
 epoch: 75, train_loss: 0.3610, test_loss: 1.8609, test_f1: 0.5887
 epoch: 76, train_loss: 0.3626, test_loss: 1.8324, test_f1: 0.6183
 epoch: 77, train_loss: 0.3397, test_loss: 2.0043, test_f1: 0.6051
 epoch: 78, train_loss: 0.3380, test_loss: 2.0784, test_f1: 0.5952
 epoch: 79, train_loss: 0.3463, test_loss: 2.1359, test_f1: 0.5762
 epoch: 80, train_loss: 0.3583, test_loss: 2.1417, test_f1: 0.5503
 epoch: 81, train_loss: 0.3227, test_loss: 2.2619, test_f1: 0.5236
 epoch: 82, train_loss: 0.3373, test_loss: 2.1285, test_f1: 0.5843
 epoch: 83, train_loss: 0.3769, test_loss: 2.0029, test_f1: 0.5734
 epoch: 84, train_loss: 0.3448, test_loss: 1.9990, test_f1: 0.5737
 epoch: 85, train_loss: 0.3451, test_loss: 2.0528, test_f1: 0.5211
 epoch: 86, train_loss: 0.3476, test_loss: 1.8694, test_f1: 0.5611
 epoch: 87, train_loss: 0.3100, test_loss: 1.8161, test_f1: 0.5680
 epoch: 88, train_loss: 0.3045, test_loss: 2.0243, test_f1: 0.5541
 epoch: 89, train_loss: 0.2952, test_loss: 2.1368, test_f1: 0.5474
 epoch: 90, train_loss: 0.3209, test_loss: 1.9589, test_f1: 0.5614
 epoch: 91, train_loss: 0.3186, test_loss: 1.9482, test_f1: 0.5567
 epoch: 92, train_loss: 0.3402, test_loss: 2.1965, test_f1: 0.5615
 epoch: 93, train_loss: 0.3208, test_loss: 1.9819, test_f1: 0.5258
 epoch: 94, train_loss: 0.3248, test_loss: 1.9660, test_f1: 0.5551
 epoch: 95, train_loss: 0.2932, test_loss: 2.0658, test_f1: 0.5686
 epoch: 96, train_loss: 0.2964, test_loss: 2.1688, test_f1: 0.5659
 epoch: 97, train_loss: 0.3135, test_loss: 2.1840, test_f1: 0.5179
 epoch: 98, train_loss: 0.2924, test_loss: 2.0773, test_f1: 0.5688
 epoch: 99, train_loss: 0.3122, test_loss: 1.8646, test_f1: 0.6160
##################ITERATION #5 ****************************************
 epoch: 0, train_loss: 1.2796, test_loss: 1.3923, test_f1: 0.1365
 epoch: 1, train_loss: 1.1442, test_loss: 1.3094, test_f1: 0.2277
 epoch: 2, train_loss: 1.0581, test_loss: 1.2845, test_f1: 0.2477
 epoch: 3, train_loss: 1.0280, test_loss: 1.2353, test_f1: 0.4004
 epoch: 4, train_loss: 0.9984, test_loss: 1.1718, test_f1: 0.4972
 epoch: 5, train_loss: 0.9683, test_loss: 1.1349, test_f1: 0.5388
 epoch: 6, train_loss: 0.9445, test_loss: 1.1574, test_f1: 0.4603
 epoch: 7, train_loss: 0.9251, test_loss: 1.1440, test_f1: 0.5223
 epoch: 8, train_loss: 0.9080, test_loss: 1.1348, test_f1: 0.5674
 epoch: 9, train_loss: 0.8875, test_loss: 1.2278, test_f1: 0.5460
 epoch: 10, train_loss: 0.8550, test_loss: 1.1747, test_f1: 0.5432
 epoch: 11, train_loss: 0.8487, test_loss: 1.1531, test_f1: 0.5893
 epoch: 12, train_loss: 0.8300, test_loss: 1.2208, test_f1: 0.5171
 epoch: 13, train_loss: 0.8150, test_loss: 1.2111, test_f1: 0.5343
 epoch: 14, train_loss: 0.8073, test_loss: 1.2305, test_f1: 0.6008
 epoch: 15, train_loss: 0.7671, test_loss: 1.2242, test_f1: 0.5500
 epoch: 16, train_loss: 0.7578, test_loss: 1.3668, test_f1: 0.4914
 epoch: 17, train_loss: 0.7446, test_loss: 1.3238, test_f1: 0.5884
 epoch: 18, train_loss: 0.7680, test_loss: 1.3498, test_f1: 0.5237
 epoch: 19, train_loss: 0.7583, test_loss: 1.6328, test_f1: 0.4800
 epoch: 20, train_loss: 0.7436, test_loss: 1.6491, test_f1: 0.5488
 epoch: 21, train_loss: 0.7164, test_loss: 1.3694, test_f1: 0.5605
 epoch: 22, train_loss: 0.6739, test_loss: 1.4272, test_f1: 0.5353
 epoch: 23, train_loss: 0.6623, test_loss: 1.8573, test_f1: 0.4406
 epoch: 24, train_loss: 0.6472, test_loss: 1.5752, test_f1: 0.5396
 epoch: 25, train_loss: 0.7055, test_loss: 1.6424, test_f1: 0.5439
 epoch: 26, train_loss: 0.6543, test_loss: 1.6431, test_f1: 0.5090
 epoch: 27, train_loss: 0.6544, test_loss: 1.5775, test_f1: 0.5641
 epoch: 28, train_loss: 0.6160, test_loss: 1.5621, test_f1: 0.5433
 epoch: 29, train_loss: 0.6100, test_loss: 1.6897, test_f1: 0.5398
 epoch: 30, train_loss: 0.6076, test_loss: 1.5703, test_f1: 0.5514
 epoch: 31, train_loss: 0.6041, test_loss: 1.5070, test_f1: 0.5273
 epoch: 32, train_loss: 0.5850, test_loss: 1.3880, test_f1: 0.5461
 epoch: 33, train_loss: 0.5775, test_loss: 1.6268, test_f1: 0.5253
 epoch: 34, train_loss: 0.5760, test_loss: 2.5321, test_f1: 0.4924
 epoch: 35, train_loss: 0.5972, test_loss: 2.0264, test_f1: 0.5216
 epoch: 36, train_loss: 0.5687, test_loss: 2.0406, test_f1: 0.5204
 epoch: 37, train_loss: 0.5584, test_loss: 2.0134, test_f1: 0.5620
 epoch: 38, train_loss: 0.5565, test_loss: 1.7184, test_f1: 0.5310
 epoch: 39, train_loss: 0.5749, test_loss: 1.9029, test_f1: 0.4960
 epoch: 40, train_loss: 0.5654, test_loss: 1.9097, test_f1: 0.5471
 epoch: 41, train_loss: 0.6031, test_loss: 2.0265, test_f1: 0.5442
 epoch: 42, train_loss: 0.5752, test_loss: 2.0010, test_f1: 0.5638
 epoch: 43, train_loss: 0.5482, test_loss: 1.9950, test_f1: 0.5255
 epoch: 44, train_loss: 0.5164, test_loss: 2.0663, test_f1: 0.5178
 epoch: 45, train_loss: 0.5200, test_loss: 2.1064, test_f1: 0.5327
 epoch: 46, train_loss: 0.4947, test_loss: 2.2898, test_f1: 0.5302
 epoch: 47, train_loss: 0.5080, test_loss: 2.8152, test_f1: 0.5181
 epoch: 48, train_loss: 0.4918, test_loss: 2.6267, test_f1: 0.5102
 epoch: 49, train_loss: 0.5152, test_loss: 2.3739, test_f1: 0.5132
 epoch: 50, train_loss: 0.5375, test_loss: 2.4146, test_f1: 0.5116
 epoch: 51, train_loss: 0.5055, test_loss: 2.1029, test_f1: 0.5274
 epoch: 52, train_loss: 0.4797, test_loss: 2.1611, test_f1: 0.5287
 epoch: 53, train_loss: 0.4524, test_loss: 2.2465, test_f1: 0.5758
 epoch: 54, train_loss: 0.4555, test_loss: 2.3296, test_f1: 0.5479
 epoch: 55, train_loss: 0.4132, test_loss: 2.1281, test_f1: 0.5342
 epoch: 56, train_loss: 0.4252, test_loss: 2.1529, test_f1: 0.5324
 epoch: 57, train_loss: 0.4061, test_loss: 2.5775, test_f1: 0.4684
 epoch: 58, train_loss: 0.3969, test_loss: 2.4984, test_f1: 0.5291
 epoch: 59, train_loss: 0.3984, test_loss: 2.4049, test_f1: 0.5448
 epoch: 60, train_loss: 0.3921, test_loss: 2.2613, test_f1: 0.5372
 epoch: 61, train_loss: 0.4070, test_loss: 2.1557, test_f1: 0.5563
 epoch: 62, train_loss: 0.4144, test_loss: 1.9644, test_f1: 0.5429
 epoch: 63, train_loss: 0.3805, test_loss: 2.0834, test_f1: 0.5337
 epoch: 64, train_loss: 0.3689, test_loss: 2.0203, test_f1: 0.5513
 epoch: 65, train_loss: 0.3529, test_loss: 2.0759, test_f1: 0.5641
 epoch: 66, train_loss: 0.3261, test_loss: 2.3785, test_f1: 0.5178
 epoch: 67, train_loss: 0.3753, test_loss: 2.4996, test_f1: 0.5182
 epoch: 68, train_loss: 0.3804, test_loss: 2.1324, test_f1: 0.5522
 epoch: 69, train_loss: 0.3665, test_loss: 2.1576, test_f1: 0.5351
 epoch: 70, train_loss: 0.3686, test_loss: 2.3332, test_f1: 0.5417
 epoch: 71, train_loss: 0.3330, test_loss: 2.2895, test_f1: 0.5657
 epoch: 72, train_loss: 0.3522, test_loss: 2.8092, test_f1: 0.5471
 epoch: 73, train_loss: 0.3542, test_loss: 2.9461, test_f1: 0.5021
 epoch: 74, train_loss: 0.3535, test_loss: 2.7798, test_f1: 0.5222
 epoch: 75, train_loss: 0.3411, test_loss: 2.7221, test_f1: 0.5500
 epoch: 76, train_loss: 0.3372, test_loss: 2.5960, test_f1: 0.5550
 epoch: 77, train_loss: 0.3387, test_loss: 2.6360, test_f1: 0.5554
 epoch: 78, train_loss: 0.3161, test_loss: 2.7326, test_f1: 0.5630
 epoch: 79, train_loss: 0.3158, test_loss: 2.5975, test_f1: 0.5492
 epoch: 80, train_loss: 0.3027, test_loss: 2.5500, test_f1: 0.5247
 epoch: 81, train_loss: 0.3195, test_loss: 2.6794, test_f1: 0.5406
 epoch: 82, train_loss: 0.3153, test_loss: 2.5963, test_f1: 0.5495
 epoch: 83, train_loss: 0.2896, test_loss: 2.8408, test_f1: 0.5238
 epoch: 84, train_loss: 0.3014, test_loss: 2.7712, test_f1: 0.5548
 epoch: 85, train_loss: 0.2599, test_loss: 2.5388, test_f1: 0.5803
 epoch: 86, train_loss: 0.2903, test_loss: 2.8140, test_f1: 0.5447
 epoch: 87, train_loss: 0.3108, test_loss: 2.5643, test_f1: 0.5506
 epoch: 88, train_loss: 0.3337, test_loss: 2.4796, test_f1: 0.5648
 epoch: 89, train_loss: 0.3381, test_loss: 2.7513, test_f1: 0.5418
 epoch: 90, train_loss: 0.3485, test_loss: 2.7691, test_f1: 0.5192
 epoch: 91, train_loss: 0.2965, test_loss: 2.7334, test_f1: 0.5520
 epoch: 92, train_loss: 0.3260, test_loss: 2.6914, test_f1: 0.5526
 epoch: 93, train_loss: 0.4084, test_loss: 4.1844, test_f1: 0.4771
 epoch: 94, train_loss: 0.4596, test_loss: 3.8819, test_f1: 0.5010
 epoch: 95, train_loss: 0.4555, test_loss: 2.8383, test_f1: 0.4784
 epoch: 96, train_loss: 0.4272, test_loss: 2.4464, test_f1: 0.5334
 epoch: 97, train_loss: 0.3958, test_loss: 3.3903, test_f1: 0.5587
 epoch: 98, train_loss: 0.3676, test_loss: 4.8441, test_f1: 0.5278
 epoch: 99, train_loss: 0.3453, test_loss: 4.3016, test_f1: 0.5282
##################ITERATION #6 ****************************************
 epoch: 0, train_loss: 1.2637, test_loss: 1.3256, test_f1: 0.1365
 epoch: 1, train_loss: 1.1295, test_loss: 1.2821, test_f1: 0.2301
 epoch: 2, train_loss: 1.0695, test_loss: 1.2893, test_f1: 0.3679
 epoch: 3, train_loss: 1.0291, test_loss: 1.2303, test_f1: 0.3564
 epoch: 4, train_loss: 0.9748, test_loss: 1.1995, test_f1: 0.4796
 epoch: 5, train_loss: 0.9465, test_loss: 1.1861, test_f1: 0.5470
 epoch: 6, train_loss: 0.9003, test_loss: 1.2133, test_f1: 0.4855
 epoch: 7, train_loss: 0.8899, test_loss: 1.2248, test_f1: 0.4969
 epoch: 8, train_loss: 0.8386, test_loss: 1.3383, test_f1: 0.3937
 epoch: 9, train_loss: 0.8509, test_loss: 1.3258, test_f1: 0.4797
 epoch: 10, train_loss: 0.8266, test_loss: 1.2131, test_f1: 0.5680
 epoch: 11, train_loss: 0.8194, test_loss: 1.1943, test_f1: 0.5482
 epoch: 12, train_loss: 0.7891, test_loss: 1.2467, test_f1: 0.5628
 epoch: 13, train_loss: 0.7814, test_loss: 1.3559, test_f1: 0.5354
 epoch: 14, train_loss: 0.7937, test_loss: 1.2927, test_f1: 0.5781
 epoch: 15, train_loss: 0.7801, test_loss: 1.2936, test_f1: 0.5159
 epoch: 16, train_loss: 0.7451, test_loss: 1.1903, test_f1: 0.5694
 epoch: 17, train_loss: 0.7374, test_loss: 1.2473, test_f1: 0.5665
 epoch: 18, train_loss: 0.7384, test_loss: 1.3089, test_f1: 0.5350
 epoch: 19, train_loss: 0.7117, test_loss: 1.3318, test_f1: 0.5662
 epoch: 20, train_loss: 0.6812, test_loss: 1.2763, test_f1: 0.6208
 epoch: 21, train_loss: 0.6829, test_loss: 1.3923, test_f1: 0.5332
 epoch: 22, train_loss: 0.6981, test_loss: 1.4146, test_f1: 0.5231
 epoch: 23, train_loss: 0.7030, test_loss: 1.3909, test_f1: 0.5231
 epoch: 24, train_loss: 0.6590, test_loss: 1.4382, test_f1: 0.5235
 epoch: 25, train_loss: 0.6463, test_loss: 1.4079, test_f1: 0.5389
 epoch: 26, train_loss: 0.6133, test_loss: 1.4184, test_f1: 0.5073
 epoch: 27, train_loss: 0.6164, test_loss: 1.4930, test_f1: 0.5439
 epoch: 28, train_loss: 0.6070, test_loss: 1.4332, test_f1: 0.5812
 epoch: 29, train_loss: 0.6262, test_loss: 1.6047, test_f1: 0.5348
 epoch: 30, train_loss: 0.6229, test_loss: 1.7733, test_f1: 0.5063
 epoch: 31, train_loss: 0.6090, test_loss: 1.6998, test_f1: 0.5371
 epoch: 32, train_loss: 0.6398, test_loss: 1.5050, test_f1: 0.5486
 epoch: 33, train_loss: 0.6669, test_loss: 1.3215, test_f1: 0.5572
 epoch: 34, train_loss: 0.6474, test_loss: 1.5747, test_f1: 0.5553
 epoch: 35, train_loss: 0.6455, test_loss: 1.6111, test_f1: 0.5315
 epoch: 36, train_loss: 0.6188, test_loss: 1.4769, test_f1: 0.5506
 epoch: 37, train_loss: 0.6188, test_loss: 1.5334, test_f1: 0.5592
 epoch: 38, train_loss: 0.6228, test_loss: 1.4639, test_f1: 0.5657
 epoch: 39, train_loss: 0.6227, test_loss: 1.4098, test_f1: 0.5564
 epoch: 40, train_loss: 0.6039, test_loss: 1.5047, test_f1: 0.4941
 epoch: 41, train_loss: 0.5913, test_loss: 1.5217, test_f1: 0.5283
 epoch: 42, train_loss: 0.5702, test_loss: 1.5606, test_f1: 0.5663
 epoch: 43, train_loss: 0.5580, test_loss: 1.6566, test_f1: 0.5501
 epoch: 44, train_loss: 0.5543, test_loss: 1.8201, test_f1: 0.4993
 epoch: 45, train_loss: 0.5800, test_loss: 1.5618, test_f1: 0.5706
 epoch: 46, train_loss: 0.6205, test_loss: 1.3598, test_f1: 0.5784
 epoch: 47, train_loss: 0.5619, test_loss: 1.4908, test_f1: 0.5489
 epoch: 48, train_loss: 0.5735, test_loss: 1.5751, test_f1: 0.5210
 epoch: 49, train_loss: 0.5606, test_loss: 1.4990, test_f1: 0.5581
 epoch: 50, train_loss: 0.5262, test_loss: 1.5893, test_f1: 0.5455
 epoch: 51, train_loss: 0.4824, test_loss: 1.6629, test_f1: 0.5326
 epoch: 52, train_loss: 0.4721, test_loss: 1.6955, test_f1: 0.5429
 epoch: 53, train_loss: 0.4421, test_loss: 1.5674, test_f1: 0.5525
 epoch: 54, train_loss: 0.4134, test_loss: 1.7451, test_f1: 0.5263
 epoch: 55, train_loss: 0.4166, test_loss: 1.7833, test_f1: 0.5415
 epoch: 56, train_loss: 0.4276, test_loss: 1.6383, test_f1: 0.5727
 epoch: 57, train_loss: 0.3890, test_loss: 1.7652, test_f1: 0.5598
 epoch: 58, train_loss: 0.4251, test_loss: 1.9168, test_f1: 0.5577
 epoch: 59, train_loss: 0.4002, test_loss: 1.8506, test_f1: 0.5518
 epoch: 60, train_loss: 0.3821, test_loss: 1.9530, test_f1: 0.5463
 epoch: 61, train_loss: 0.4030, test_loss: 1.8991, test_f1: 0.5445
 epoch: 62, train_loss: 0.4124, test_loss: 1.8771, test_f1: 0.5536
 epoch: 63, train_loss: 0.3981, test_loss: 1.8534, test_f1: 0.5632
 epoch: 64, train_loss: 0.3832, test_loss: 1.8251, test_f1: 0.5660
 epoch: 65, train_loss: 0.3665, test_loss: 1.8436, test_f1: 0.5561
 epoch: 66, train_loss: 0.3810, test_loss: 1.8514, test_f1: 0.5733
 epoch: 67, train_loss: 0.3796, test_loss: 2.0280, test_f1: 0.5928
 epoch: 68, train_loss: 0.4161, test_loss: 1.9850, test_f1: 0.5510
 epoch: 69, train_loss: 0.4038, test_loss: 1.8970, test_f1: 0.5436
 epoch: 70, train_loss: 0.3946, test_loss: 1.8581, test_f1: 0.5350
 epoch: 71, train_loss: 0.3753, test_loss: 2.0475, test_f1: 0.5050
 epoch: 72, train_loss: 0.3664, test_loss: 2.1761, test_f1: 0.5184
 epoch: 73, train_loss: 0.3780, test_loss: 2.2772, test_f1: 0.5368
 epoch: 74, train_loss: 0.3633, test_loss: 2.2207, test_f1: 0.5532
 epoch: 75, train_loss: 0.3308, test_loss: 2.1280, test_f1: 0.5557
 epoch: 76, train_loss: 0.3452, test_loss: 2.1704, test_f1: 0.5504
 epoch: 77, train_loss: 0.3376, test_loss: 2.4110, test_f1: 0.5536
 epoch: 78, train_loss: 0.3334, test_loss: 2.1505, test_f1: 0.5709
 epoch: 79, train_loss: 0.3312, test_loss: 2.1716, test_f1: 0.5512
 epoch: 80, train_loss: 0.3261, test_loss: 2.2923, test_f1: 0.5268
 epoch: 81, train_loss: 0.3256, test_loss: 2.3812, test_f1: 0.5317
 epoch: 82, train_loss: 0.3329, test_loss: 2.4185, test_f1: 0.5496
 epoch: 83, train_loss: 0.3332, test_loss: 2.5528, test_f1: 0.5622
 epoch: 84, train_loss: 0.3324, test_loss: 2.6488, test_f1: 0.5209
 epoch: 85, train_loss: 0.3148, test_loss: 2.5291, test_f1: 0.5449
 epoch: 86, train_loss: 0.3225, test_loss: 2.5741, test_f1: 0.5388
 epoch: 87, train_loss: 0.3375, test_loss: 2.4379, test_f1: 0.5257
 epoch: 88, train_loss: 0.3437, test_loss: 2.3425, test_f1: 0.5081
 epoch: 89, train_loss: 0.3592, test_loss: 2.9088, test_f1: 0.5094
 epoch: 90, train_loss: 0.3392, test_loss: 2.9100, test_f1: 0.5112
 epoch: 91, train_loss: 0.3269, test_loss: 2.5728, test_f1: 0.5391
 epoch: 92, train_loss: 0.3220, test_loss: 2.2690, test_f1: 0.5518
 epoch: 93, train_loss: 0.3205, test_loss: 2.3817, test_f1: 0.5596
 epoch: 94, train_loss: 0.3333, test_loss: 2.3989, test_f1: 0.5299
 epoch: 95, train_loss: 0.3395, test_loss: 2.4030, test_f1: 0.5690
 epoch: 96, train_loss: 0.3540, test_loss: 2.5297, test_f1: 0.5342
 epoch: 97, train_loss: 0.3350, test_loss: 2.5431, test_f1: 0.5377
 epoch: 98, train_loss: 0.3342, test_loss: 2.5778, test_f1: 0.5546
 epoch: 99, train_loss: 0.2954, test_loss: 2.5773, test_f1: 0.5636
##################ITERATION #7 ****************************************
 epoch: 0, train_loss: 1.2630, test_loss: 1.4335, test_f1: 0.1614
 epoch: 1, train_loss: 1.1036, test_loss: 1.3445, test_f1: 0.1868
 epoch: 2, train_loss: 1.0750, test_loss: 1.3582, test_f1: 0.2435
 epoch: 3, train_loss: 1.0193, test_loss: 1.3013, test_f1: 0.2746
 epoch: 4, train_loss: 0.9787, test_loss: 1.2417, test_f1: 0.4380
 epoch: 5, train_loss: 0.9461, test_loss: 1.2498, test_f1: 0.4187
 epoch: 6, train_loss: 0.8950, test_loss: 1.1915, test_f1: 0.3896
 epoch: 7, train_loss: 0.8622, test_loss: 1.1353, test_f1: 0.5464
 epoch: 8, train_loss: 0.8355, test_loss: 1.2273, test_f1: 0.4730
 epoch: 9, train_loss: 0.8184, test_loss: 1.1848, test_f1: 0.4975
 epoch: 10, train_loss: 0.8132, test_loss: 1.1604, test_f1: 0.5721
 epoch: 11, train_loss: 0.8086, test_loss: 1.1389, test_f1: 0.5784
 epoch: 12, train_loss: 0.7767, test_loss: 1.1784, test_f1: 0.5503
 epoch: 13, train_loss: 0.7434, test_loss: 1.1771, test_f1: 0.5228
 epoch: 14, train_loss: 0.7229, test_loss: 1.2164, test_f1: 0.5539
 epoch: 15, train_loss: 0.7242, test_loss: 1.2491, test_f1: 0.5160
 epoch: 16, train_loss: 0.7160, test_loss: 1.3318, test_f1: 0.4675
 epoch: 17, train_loss: 0.6845, test_loss: 1.3591, test_f1: 0.5320
 epoch: 18, train_loss: 0.6882, test_loss: 1.2617, test_f1: 0.5704
 epoch: 19, train_loss: 0.7030, test_loss: 1.2794, test_f1: 0.6011
 epoch: 20, train_loss: 0.7115, test_loss: 1.3085, test_f1: 0.5985
 epoch: 21, train_loss: 0.7102, test_loss: 1.3444, test_f1: 0.5294
 epoch: 22, train_loss: 0.6577, test_loss: 1.3232, test_f1: 0.5725
 epoch: 23, train_loss: 0.6759, test_loss: 1.2922, test_f1: 0.6099
 epoch: 24, train_loss: 0.6403, test_loss: 1.3062, test_f1: 0.5557
 epoch: 25, train_loss: 0.6443, test_loss: 1.5690, test_f1: 0.5374
 epoch: 26, train_loss: 0.6196, test_loss: 1.3677, test_f1: 0.5644
 epoch: 27, train_loss: 0.6567, test_loss: 1.3242, test_f1: 0.5434
 epoch: 28, train_loss: 0.6614, test_loss: 1.3420, test_f1: 0.5371
 epoch: 29, train_loss: 0.6449, test_loss: 1.2936, test_f1: 0.5612
 epoch: 30, train_loss: 0.6061, test_loss: 1.3366, test_f1: 0.5510
 epoch: 31, train_loss: 0.6196, test_loss: 1.4753, test_f1: 0.5553
 epoch: 32, train_loss: 0.6185, test_loss: 1.3811, test_f1: 0.5675
 epoch: 33, train_loss: 0.5890, test_loss: 1.3550, test_f1: 0.5836
 epoch: 34, train_loss: 0.5728, test_loss: 1.4453, test_f1: 0.5706
 epoch: 35, train_loss: 0.5653, test_loss: 1.6902, test_f1: 0.5778
 epoch: 36, train_loss: 0.5458, test_loss: 1.6116, test_f1: 0.5757
 epoch: 37, train_loss: 0.5813, test_loss: 1.4800, test_f1: 0.6052
 epoch: 38, train_loss: 0.5549, test_loss: 1.5678, test_f1: 0.5426
 epoch: 39, train_loss: 0.5767, test_loss: 1.6542, test_f1: 0.5218
 epoch: 40, train_loss: 0.5482, test_loss: 1.6836, test_f1: 0.5615
 epoch: 41, train_loss: 0.5465, test_loss: 1.5330, test_f1: 0.5896
 epoch: 42, train_loss: 0.5522, test_loss: 1.6329, test_f1: 0.5408
 epoch: 43, train_loss: 0.5102, test_loss: 1.8129, test_f1: 0.5360
 epoch: 44, train_loss: 0.5564, test_loss: 1.8232, test_f1: 0.5902
 epoch: 45, train_loss: 0.5508, test_loss: 1.7366, test_f1: 0.5193
 epoch: 46, train_loss: 0.5545, test_loss: 1.5312, test_f1: 0.5323
 epoch: 47, train_loss: 0.5323, test_loss: 1.4762, test_f1: 0.5625
 epoch: 48, train_loss: 0.5269, test_loss: 1.7324, test_f1: 0.5454
 epoch: 49, train_loss: 0.4758, test_loss: 1.4440, test_f1: 0.5849
 epoch: 50, train_loss: 0.4743, test_loss: 1.3004, test_f1: 0.5979
 epoch: 51, train_loss: 0.4744, test_loss: 1.4091, test_f1: 0.5983
 epoch: 52, train_loss: 0.4602, test_loss: 1.6073, test_f1: 0.5636
 epoch: 53, train_loss: 0.4384, test_loss: 1.5875, test_f1: 0.5799
 epoch: 54, train_loss: 0.4197, test_loss: 1.6986, test_f1: 0.5778
 epoch: 55, train_loss: 0.4176, test_loss: 1.7614, test_f1: 0.5480
 epoch: 56, train_loss: 0.4292, test_loss: 1.5887, test_f1: 0.5839
 epoch: 57, train_loss: 0.3932, test_loss: 1.4607, test_f1: 0.6150
 epoch: 58, train_loss: 0.4380, test_loss: 1.5263, test_f1: 0.6161
 epoch: 59, train_loss: 0.4199, test_loss: 1.6633, test_f1: 0.5844
 epoch: 60, train_loss: 0.4045, test_loss: 1.7260, test_f1: 0.5675
 epoch: 61, train_loss: 0.4014, test_loss: 1.6741, test_f1: 0.5913
 epoch: 62, train_loss: 0.4052, test_loss: 1.7326, test_f1: 0.6021
 epoch: 63, train_loss: 0.3907, test_loss: 1.8485, test_f1: 0.5497
 epoch: 64, train_loss: 0.3729, test_loss: 1.8636, test_f1: 0.5631
 epoch: 65, train_loss: 0.3790, test_loss: 1.8370, test_f1: 0.5975
 epoch: 66, train_loss: 0.3992, test_loss: 1.7070, test_f1: 0.5974
 epoch: 67, train_loss: 0.3720, test_loss: 1.6330, test_f1: 0.5867
 epoch: 68, train_loss: 0.3686, test_loss: 1.6452, test_f1: 0.5934
 epoch: 69, train_loss: 0.3411, test_loss: 1.7896, test_f1: 0.5790
 epoch: 70, train_loss: 0.3394, test_loss: 1.9783, test_f1: 0.5561
 epoch: 71, train_loss: 0.3224, test_loss: 1.9607, test_f1: 0.5667
 epoch: 72, train_loss: 0.3083, test_loss: 1.8048, test_f1: 0.5717
 epoch: 73, train_loss: 0.3156, test_loss: 1.8368, test_f1: 0.5858
 epoch: 74, train_loss: 0.3275, test_loss: 1.9506, test_f1: 0.5669
 epoch: 75, train_loss: 0.3077, test_loss: 1.9786, test_f1: 0.5631
 epoch: 76, train_loss: 0.3093, test_loss: 2.0549, test_f1: 0.5598
 epoch: 77, train_loss: 0.3309, test_loss: 1.8720, test_f1: 0.5779
 epoch: 78, train_loss: 0.3044, test_loss: 1.8515, test_f1: 0.5793
 epoch: 79, train_loss: 0.2960, test_loss: 1.8510, test_f1: 0.5784
 epoch: 80, train_loss: 0.3306, test_loss: 1.7359, test_f1: 0.5881
 epoch: 81, train_loss: 0.3794, test_loss: 1.9537, test_f1: 0.5542
 epoch: 82, train_loss: 0.3322, test_loss: 2.0261, test_f1: 0.5531
 epoch: 83, train_loss: 0.3341, test_loss: 2.1263, test_f1: 0.5428
 epoch: 84, train_loss: 0.2995, test_loss: 2.0282, test_f1: 0.5660
 epoch: 85, train_loss: 0.3260, test_loss: 1.8805, test_f1: 0.5843
 epoch: 86, train_loss: 0.3008, test_loss: 1.7348, test_f1: 0.5985
 epoch: 87, train_loss: 0.3664, test_loss: 1.8341, test_f1: 0.5844
 epoch: 88, train_loss: 0.3737, test_loss: 2.0641, test_f1: 0.5361
 epoch: 89, train_loss: 0.3289, test_loss: 2.0586, test_f1: 0.5938
 epoch: 90, train_loss: 0.3447, test_loss: 1.9057, test_f1: 0.5977
 epoch: 91, train_loss: 0.3213, test_loss: 2.1179, test_f1: 0.5612
 epoch: 92, train_loss: 0.3370, test_loss: 2.2241, test_f1: 0.5353
 epoch: 93, train_loss: 0.3323, test_loss: 2.2191, test_f1: 0.5426
 epoch: 94, train_loss: 0.3404, test_loss: 2.2923, test_f1: 0.5253
 epoch: 95, train_loss: 0.3416, test_loss: 2.2966, test_f1: 0.5265
 epoch: 96, train_loss: 0.3098, test_loss: 2.2329, test_f1: 0.5292
 epoch: 97, train_loss: 0.3093, test_loss: 2.0832, test_f1: 0.5616
 epoch: 98, train_loss: 0.3139, test_loss: 1.9793, test_f1: 0.5782
 epoch: 99, train_loss: 0.3328, test_loss: 2.2307, test_f1: 0.5425
##################ITERATION #8 ****************************************
 epoch: 0, train_loss: 1.2576, test_loss: 1.3966, test_f1: 0.1365
 epoch: 1, train_loss: 1.1517, test_loss: 1.3525, test_f1: 0.2013
 epoch: 2, train_loss: 1.0672, test_loss: 1.2877, test_f1: 0.3305
 epoch: 3, train_loss: 1.0189, test_loss: 1.2558, test_f1: 0.3697
 epoch: 4, train_loss: 0.9879, test_loss: 1.2381, test_f1: 0.4012
 epoch: 5, train_loss: 0.9519, test_loss: 1.1584, test_f1: 0.5547
 epoch: 6, train_loss: 0.9224, test_loss: 1.1801, test_f1: 0.4951
 epoch: 7, train_loss: 0.8880, test_loss: 1.1594, test_f1: 0.5203
 epoch: 8, train_loss: 0.8652, test_loss: 1.3135, test_f1: 0.4870
 epoch: 9, train_loss: 0.8549, test_loss: 1.1812, test_f1: 0.5697
 epoch: 10, train_loss: 0.8539, test_loss: 1.1959, test_f1: 0.5427
 epoch: 11, train_loss: 0.8336, test_loss: 1.2153, test_f1: 0.4853
 epoch: 12, train_loss: 0.8148, test_loss: 1.1710, test_f1: 0.5032
 epoch: 13, train_loss: 0.7851, test_loss: 1.2368, test_f1: 0.5259
 epoch: 14, train_loss: 0.7636, test_loss: 1.3230, test_f1: 0.5172
 epoch: 15, train_loss: 0.7248, test_loss: 1.3111, test_f1: 0.5214
 epoch: 16, train_loss: 0.7277, test_loss: 1.2690, test_f1: 0.5357
 epoch: 17, train_loss: 0.7315, test_loss: 1.3739, test_f1: 0.5079
 epoch: 18, train_loss: 0.6932, test_loss: 1.4020, test_f1: 0.5213
 epoch: 19, train_loss: 0.7051, test_loss: 1.8606, test_f1: 0.3782
 epoch: 20, train_loss: 0.6720, test_loss: 1.4983, test_f1: 0.5775
 epoch: 21, train_loss: 0.6451, test_loss: 1.3828, test_f1: 0.5864
 epoch: 22, train_loss: 0.6098, test_loss: 1.6788, test_f1: 0.5178
 epoch: 23, train_loss: 0.6045, test_loss: 1.5406, test_f1: 0.5991
 epoch: 24, train_loss: 0.5951, test_loss: 1.6358, test_f1: 0.5496
 epoch: 25, train_loss: 0.5709, test_loss: 1.5002, test_f1: 0.5562
 epoch: 26, train_loss: 0.6194, test_loss: 1.5542, test_f1: 0.5241
 epoch: 27, train_loss: 0.6011, test_loss: 1.4353, test_f1: 0.5669
 epoch: 28, train_loss: 0.6031, test_loss: 1.5542, test_f1: 0.5324
 epoch: 29, train_loss: 0.6020, test_loss: 1.5649, test_f1: 0.5742
 epoch: 30, train_loss: 0.6441, test_loss: 1.6049, test_f1: 0.5002
 epoch: 31, train_loss: 0.6291, test_loss: 1.3906, test_f1: 0.5525
 epoch: 32, train_loss: 0.5939, test_loss: 1.5929, test_f1: 0.4872
 epoch: 33, train_loss: 0.5830, test_loss: 1.5091, test_f1: 0.5696
 epoch: 34, train_loss: 0.5782, test_loss: 1.6299, test_f1: 0.5383
 epoch: 35, train_loss: 0.5526, test_loss: 1.5326, test_f1: 0.5305
 epoch: 36, train_loss: 0.5056, test_loss: 1.8067, test_f1: 0.5641
 epoch: 37, train_loss: 0.5326, test_loss: 1.8435, test_f1: 0.5242
 epoch: 38, train_loss: 0.5223, test_loss: 1.7443, test_f1: 0.5629
 epoch: 39, train_loss: 0.5448, test_loss: 1.5954, test_f1: 0.5770
 epoch: 40, train_loss: 0.5016, test_loss: 1.4549, test_f1: 0.5799
 epoch: 41, train_loss: 0.5521, test_loss: 1.6567, test_f1: 0.5644
 epoch: 42, train_loss: 0.5597, test_loss: 1.7184, test_f1: 0.5368
 epoch: 43, train_loss: 0.5330, test_loss: 1.6055, test_f1: 0.5696
 epoch: 44, train_loss: 0.4850, test_loss: 1.6326, test_f1: 0.5709
 epoch: 45, train_loss: 0.5086, test_loss: 1.6796, test_f1: 0.6121
 epoch: 46, train_loss: 0.4905, test_loss: 1.8711, test_f1: 0.5089
 epoch: 47, train_loss: 0.4945, test_loss: 1.9893, test_f1: 0.5230
 epoch: 48, train_loss: 0.5137, test_loss: 1.5718, test_f1: 0.6102
 epoch: 49, train_loss: 0.5000, test_loss: 1.6240, test_f1: 0.5649
 epoch: 50, train_loss: 0.5149, test_loss: 1.7307, test_f1: 0.5787
 epoch: 51, train_loss: 0.4810, test_loss: 1.6945, test_f1: 0.5879
 epoch: 52, train_loss: 0.4484, test_loss: 1.6934, test_f1: 0.5818
 epoch: 53, train_loss: 0.4248, test_loss: 1.7407, test_f1: 0.5485
 epoch: 54, train_loss: 0.3956, test_loss: 1.8753, test_f1: 0.5368
 epoch: 55, train_loss: 0.4090, test_loss: 1.8093, test_f1: 0.5254
 epoch: 56, train_loss: 0.3838, test_loss: 1.7465, test_f1: 0.5577
 epoch: 57, train_loss: 0.3792, test_loss: 1.8035, test_f1: 0.5366
 epoch: 58, train_loss: 0.3589, test_loss: 1.7930, test_f1: 0.5311
 epoch: 59, train_loss: 0.3438, test_loss: 1.9472, test_f1: 0.5557
 epoch: 60, train_loss: 0.3648, test_loss: 1.9707, test_f1: 0.5436
 epoch: 61, train_loss: 0.3463, test_loss: 1.9897, test_f1: 0.5543
 epoch: 62, train_loss: 0.3324, test_loss: 2.1059, test_f1: 0.5282
 epoch: 63, train_loss: 0.3838, test_loss: 1.9168, test_f1: 0.5617
 epoch: 64, train_loss: 0.3353, test_loss: 1.8765, test_f1: 0.5565
 epoch: 65, train_loss: 0.3526, test_loss: 2.0418, test_f1: 0.5689
 epoch: 66, train_loss: 0.3887, test_loss: 2.0118, test_f1: 0.5543
 epoch: 67, train_loss: 0.4118, test_loss: 2.0520, test_f1: 0.5184
 epoch: 68, train_loss: 0.3709, test_loss: 2.0822, test_f1: 0.5529
 epoch: 69, train_loss: 0.3643, test_loss: 1.9424, test_f1: 0.5392
 epoch: 70, train_loss: 0.3692, test_loss: 1.9648, test_f1: 0.5275
 epoch: 71, train_loss: 0.3474, test_loss: 1.9443, test_f1: 0.5466
 epoch: 72, train_loss: 0.3185, test_loss: 2.0023, test_f1: 0.5531
 epoch: 73, train_loss: 0.3071, test_loss: 1.8880, test_f1: 0.5693
 epoch: 74, train_loss: 0.2948, test_loss: 1.9246, test_f1: 0.5350
 epoch: 75, train_loss: 0.3367, test_loss: 1.8288, test_f1: 0.5375
 epoch: 76, train_loss: 0.3369, test_loss: 2.0086, test_f1: 0.5253
 epoch: 77, train_loss: 0.3360, test_loss: 2.2216, test_f1: 0.5229
 epoch: 78, train_loss: 0.3061, test_loss: 2.0937, test_f1: 0.5684
 epoch: 79, train_loss: 0.3141, test_loss: 2.0650, test_f1: 0.5638
 epoch: 80, train_loss: 0.3179, test_loss: 2.1067, test_f1: 0.5474
 epoch: 81, train_loss: 0.3204, test_loss: 1.9288, test_f1: 0.5815
 epoch: 82, train_loss: 0.2944, test_loss: 1.8826, test_f1: 0.5851
 epoch: 83, train_loss: 0.2998, test_loss: 1.8752, test_f1: 0.5854
 epoch: 84, train_loss: 0.3055, test_loss: 2.0130, test_f1: 0.5697
 epoch: 85, train_loss: 0.2914, test_loss: 2.1159, test_f1: 0.5444
 epoch: 86, train_loss: 0.2983, test_loss: 2.2596, test_f1: 0.5725
 epoch: 87, train_loss: 0.3025, test_loss: 2.3616, test_f1: 0.5356
 epoch: 88, train_loss: 0.3012, test_loss: 2.4293, test_f1: 0.5465
 epoch: 89, train_loss: 0.2791, test_loss: 2.1023, test_f1: 0.5558
 epoch: 90, train_loss: 0.2982, test_loss: 2.1707, test_f1: 0.5710
 epoch: 91, train_loss: 0.2908, test_loss: 2.1889, test_f1: 0.5600
 epoch: 92, train_loss: 0.2966, test_loss: 2.3358, test_f1: 0.5235
 epoch: 93, train_loss: 0.3087, test_loss: 2.2769, test_f1: 0.5586
 epoch: 94, train_loss: 0.2819, test_loss: 2.4741, test_f1: 0.4994
 epoch: 95, train_loss: 0.3514, test_loss: 2.3626, test_f1: 0.5461
 epoch: 96, train_loss: 0.3353, test_loss: 2.1147, test_f1: 0.5909
 epoch: 97, train_loss: 0.2968, test_loss: 2.0203, test_f1: 0.5649
 epoch: 98, train_loss: 0.2646, test_loss: 2.1425, test_f1: 0.5573
 epoch: 99, train_loss: 0.2568, test_loss: 2.3437, test_f1: 0.5432
##################ITERATION #9 ****************************************
 epoch: 0, train_loss: 1.2818, test_loss: 1.4477, test_f1: 0.2014
 epoch: 1, train_loss: 1.1097, test_loss: 1.3802, test_f1: 0.1543
 epoch: 2, train_loss: 1.0403, test_loss: 1.3100, test_f1: 0.2554
 epoch: 3, train_loss: 0.9807, test_loss: 1.3026, test_f1: 0.2800
 epoch: 4, train_loss: 0.9351, test_loss: 1.2789, test_f1: 0.3528
 epoch: 5, train_loss: 0.9080, test_loss: 1.2138, test_f1: 0.4160
 epoch: 6, train_loss: 0.8680, test_loss: 1.1487, test_f1: 0.4876
 epoch: 7, train_loss: 0.8416, test_loss: 1.1636, test_f1: 0.5326
 epoch: 8, train_loss: 0.8095, test_loss: 1.2528, test_f1: 0.4617
 epoch: 9, train_loss: 0.8095, test_loss: 1.2083, test_f1: 0.4737
 epoch: 10, train_loss: 0.7857, test_loss: 1.1809, test_f1: 0.5433
 epoch: 11, train_loss: 0.7722, test_loss: 1.3145, test_f1: 0.4475
 epoch: 12, train_loss: 0.7762, test_loss: 1.2773, test_f1: 0.5233
 epoch: 13, train_loss: 0.7533, test_loss: 1.2698, test_f1: 0.5247
 epoch: 14, train_loss: 0.7159, test_loss: 1.3150, test_f1: 0.4827
 epoch: 15, train_loss: 0.7179, test_loss: 1.3972, test_f1: 0.5165
 epoch: 16, train_loss: 0.7290, test_loss: 1.4447, test_f1: 0.4905
 epoch: 17, train_loss: 0.7054, test_loss: 1.4142, test_f1: 0.5030
 epoch: 18, train_loss: 0.6997, test_loss: 1.3309, test_f1: 0.5528
 epoch: 19, train_loss: 0.7128, test_loss: 1.3197, test_f1: 0.5429
 epoch: 20, train_loss: 0.6692, test_loss: 1.3466, test_f1: 0.5299
 epoch: 21, train_loss: 0.6538, test_loss: 1.5069, test_f1: 0.5408
 epoch: 22, train_loss: 0.7105, test_loss: 1.4535, test_f1: 0.5177
 epoch: 23, train_loss: 0.6760, test_loss: 1.6999, test_f1: 0.5157
 epoch: 24, train_loss: 0.6530, test_loss: 1.4269, test_f1: 0.5239
 epoch: 25, train_loss: 0.6515, test_loss: 1.3914, test_f1: 0.5236
 epoch: 26, train_loss: 0.6496, test_loss: 1.4018, test_f1: 0.5279
 epoch: 27, train_loss: 0.6349, test_loss: 1.3477, test_f1: 0.5518
 epoch: 28, train_loss: 0.6654, test_loss: 1.6079, test_f1: 0.5391
 epoch: 29, train_loss: 0.6836, test_loss: 1.6349, test_f1: 0.5363
 epoch: 30, train_loss: 0.6163, test_loss: 1.4221, test_f1: 0.5116
 epoch: 31, train_loss: 0.5859, test_loss: 1.3667, test_f1: 0.5492
 epoch: 32, train_loss: 0.5663, test_loss: 1.3702, test_f1: 0.5512
 epoch: 33, train_loss: 0.5671, test_loss: 1.6994, test_f1: 0.5644
 epoch: 34, train_loss: 0.5601, test_loss: 1.7624, test_f1: 0.5017
 epoch: 35, train_loss: 0.5481, test_loss: 1.6293, test_f1: 0.5165
 epoch: 36, train_loss: 0.5325, test_loss: 1.4386, test_f1: 0.5879
 epoch: 37, train_loss: 0.5259, test_loss: 1.5607, test_f1: 0.5656
 epoch: 38, train_loss: 0.5123, test_loss: 1.5206, test_f1: 0.5526
 epoch: 39, train_loss: 0.5116, test_loss: 1.6705, test_f1: 0.5649
 epoch: 40, train_loss: 0.5132, test_loss: 1.6905, test_f1: 0.5306
 epoch: 41, train_loss: 0.5396, test_loss: 1.8945, test_f1: 0.5484
 epoch: 42, train_loss: 0.5037, test_loss: 1.7359, test_f1: 0.5749
 epoch: 43, train_loss: 0.4722, test_loss: 1.8897, test_f1: 0.5190
 epoch: 44, train_loss: 0.4903, test_loss: 1.9601, test_f1: 0.5305
 epoch: 45, train_loss: 0.4926, test_loss: 1.7619, test_f1: 0.5330
 epoch: 46, train_loss: 0.5019, test_loss: 2.0062, test_f1: 0.5199
 epoch: 47, train_loss: 0.4681, test_loss: 1.7663, test_f1: 0.5258
 epoch: 48, train_loss: 0.4974, test_loss: 1.8108, test_f1: 0.5469
 epoch: 49, train_loss: 0.4940, test_loss: 1.7465, test_f1: 0.5562
 epoch: 50, train_loss: 0.5027, test_loss: 2.4899, test_f1: 0.5130
 epoch: 51, train_loss: 0.4842, test_loss: 2.0317, test_f1: 0.5442
 epoch: 52, train_loss: 0.4823, test_loss: 1.7918, test_f1: 0.5550
 epoch: 53, train_loss: 0.4520, test_loss: 1.9095, test_f1: 0.6046
 epoch: 54, train_loss: 0.4587, test_loss: 1.7909, test_f1: 0.5933
 epoch: 55, train_loss: 0.4314, test_loss: 1.9559, test_f1: 0.5472
 epoch: 56, train_loss: 0.3985, test_loss: 1.9019, test_f1: 0.5570
 epoch: 57, train_loss: 0.3791, test_loss: 1.7852, test_f1: 0.5385
 epoch: 58, train_loss: 0.3654, test_loss: 1.9891, test_f1: 0.5456
 epoch: 59, train_loss: 0.3644, test_loss: 1.9208, test_f1: 0.5344
 epoch: 60, train_loss: 0.3876, test_loss: 2.0138, test_f1: 0.5556
 epoch: 61, train_loss: 0.4083, test_loss: 2.0447, test_f1: 0.5576
 epoch: 62, train_loss: 0.3956, test_loss: 1.9760, test_f1: 0.5461
 epoch: 63, train_loss: 0.3897, test_loss: 1.8158, test_f1: 0.5262
 epoch: 64, train_loss: 0.3829, test_loss: 2.1061, test_f1: 0.5614
 epoch: 65, train_loss: 0.3896, test_loss: 2.0164, test_f1: 0.5641
 epoch: 66, train_loss: 0.3763, test_loss: 2.0168, test_f1: 0.5978
 epoch: 67, train_loss: 0.4298, test_loss: 2.1399, test_f1: 0.5779
 epoch: 68, train_loss: 0.4062, test_loss: 1.9077, test_f1: 0.5973
 epoch: 69, train_loss: 0.3722, test_loss: 1.8681, test_f1: 0.5543
 epoch: 70, train_loss: 0.3667, test_loss: 1.9486, test_f1: 0.5724
 epoch: 71, train_loss: 0.3701, test_loss: 2.0696, test_f1: 0.5780
 epoch: 72, train_loss: 0.3548, test_loss: 2.1656, test_f1: 0.5621
 epoch: 73, train_loss: 0.3712, test_loss: 2.2224, test_f1: 0.5256
 epoch: 74, train_loss: 0.3260, test_loss: 2.2397, test_f1: 0.5336
 epoch: 75, train_loss: 0.3448, test_loss: 1.9142, test_f1: 0.5696
 epoch: 76, train_loss: 0.3500, test_loss: 2.0008, test_f1: 0.5684
 epoch: 77, train_loss: 0.3698, test_loss: 2.1425, test_f1: 0.5215
 epoch: 78, train_loss: 0.3611, test_loss: 2.0614, test_f1: 0.5233
 epoch: 79, train_loss: 0.3362, test_loss: 1.9217, test_f1: 0.5706
 epoch: 80, train_loss: 0.3466, test_loss: 2.0295, test_f1: 0.5223
 epoch: 81, train_loss: 0.3380, test_loss: 2.2504, test_f1: 0.5528
 epoch: 82, train_loss: 0.3339, test_loss: 2.2499, test_f1: 0.5810
 epoch: 83, train_loss: 0.3192, test_loss: 2.2465, test_f1: 0.5768
 epoch: 84, train_loss: 0.3193, test_loss: 2.3582, test_f1: 0.5720
 epoch: 85, train_loss: 0.2925, test_loss: 2.3547, test_f1: 0.5774
 epoch: 86, train_loss: 0.2885, test_loss: 2.2349, test_f1: 0.5623
 epoch: 87, train_loss: 0.3074, test_loss: 2.1320, test_f1: 0.5569
 epoch: 88, train_loss: 0.3317, test_loss: 2.0483, test_f1: 0.5900
 epoch: 89, train_loss: 0.3105, test_loss: 2.2430, test_f1: 0.5680
 epoch: 90, train_loss: 0.3128, test_loss: 2.3178, test_f1: 0.5573
 epoch: 91, train_loss: 0.3221, test_loss: 2.1488, test_f1: 0.5644
 epoch: 92, train_loss: 0.3136, test_loss: 2.1810, test_f1: 0.5582
 epoch: 93, train_loss: 0.2981, test_loss: 2.3010, test_f1: 0.5680
 epoch: 94, train_loss: 0.2977, test_loss: 2.3944, test_f1: 0.5505
 epoch: 95, train_loss: 0.3058, test_loss: 2.8009, test_f1: 0.5082
 epoch: 96, train_loss: 0.3166, test_loss: 2.4524, test_f1: 0.5620
 epoch: 97, train_loss: 0.2732, test_loss: 2.5076, test_f1: 0.5700
 epoch: 98, train_loss: 0.2975, test_loss: 2.4089, test_f1: 0.5826
 epoch: 99, train_loss: 0.3048, test_loss: 2.4122, test_f1: 0.5587

Training completed in 381.75 seconds
Best F1: 0.6233 at epoch 93
Mean F1 across iterations: 0.6093  0.0124
========================FINAL RESULTS================================
FEGIN weighted F1: 0.6233  0.0124
python main.py --data ltspice_demos --representation component_component --model FEGIN --layers 5 --hiddens 128 --batch_size 256 --lr 0.001 --emb_size 512 --epochs 100 --save_appendix component_component_L5_H128_BS256_LR0.001_E512 --no_val
-----



STDERR:
  File "main.py", line 370, in <module>
    main()
  File "main.py", line 254, in main
    dataset = dataset_class(
  File "/home/philip/projects/ltspice_examples_code_repo/Circuit-Completion-Using-GNNs/component_classification_with_link_prediction_head/evaluation/FEGIN/kernel/circuit_datasets.py", line 15, in __init__
    self.data, self.slices = torch.load(self.processed_paths[0])
  File "/home/philip/.local/lib/python3.8/site-packages/torch/serialization.py", line 1040, in load
    warnings.warn(
  File "/usr/lib/python3.8/warnings.py", line 109, in _showwarnmsg
    sw(msg.message, msg.category, msg.filename, msg.lineno,
  File "main.py", line 47, in warn_with_traceback
    traceback.print_stack(file=log)
/home/philip/projects/ltspice_examples_code_repo/Circuit-Completion-Using-GNNs/component_classification_with_link_prediction_head/evaluation/FEGIN/kernel/circuit_datasets.py:15: FutureWarning: You are using `torch.load` with `weights_only=False` (the current default value), which uses the default pickle module implicitly. It is possible to construct malicious pickle data which will execute arbitrary code during unpickling (See https://github.com/pytorch/pytorch/blob/main/SECURITY.md#untrusted-models for more details). In a future release, the default value for `weights_only` will be flipped to `True`. This limits the functions that could be executed during unpickling. Arbitrary objects will no longer be allowed to be loaded via this mode unless they are explicitly allowlisted by the user via `torch.serialization.add_safe_globals`. We recommend you start setting `weights_only=True` for any use case where you don't have full control of the loaded file. Please open an issue on GitHub for any issues related to this experimental feature.
  self.data, self.slices = torch.load(self.processed_paths[0])
