STDOUT:
Results will be saved in /home/philip/projects/ltspice_examples_code_repo/Circuit-Completion-Using-GNNs/component_classification_with_link_prediction_head/evaluation/FEGIN/results/model_FEGIN_dataset_ltspice_examples
Command line input: python main.py --data ltspice_examples --representation component_net --model FEGIN --layers 5 --hiddens 64 --batch_size 32 --lr 0.0001 --emb_size 250 --epochs 100 --save_appendix component_net_L5_H64_BS32_LR0.0001_E250 --no_val
 is saved.
-----
ltspice_examples - FEGIN
Using 5 layers, 64 hidden units, h = 2
Loading component_net representation dataset
ENTERED
Training FEGIN on component_net representation
Train: 3558, Test: 846
##################ITERATION #0 ****************************************
 epoch: 0, train_loss: 1.3793, test_loss: 1.3250, test_f1: 0.3019
 epoch: 1, train_loss: 1.2980, test_loss: 1.2595, test_f1: 0.2697
 epoch: 2, train_loss: 1.2537, test_loss: 1.2226, test_f1: 0.3077
 epoch: 3, train_loss: 1.2201, test_loss: 1.1816, test_f1: 0.3350
 epoch: 4, train_loss: 1.1885, test_loss: 1.1483, test_f1: 0.3489
 epoch: 5, train_loss: 1.1611, test_loss: 1.1212, test_f1: 0.3726
 epoch: 6, train_loss: 1.1384, test_loss: 1.0957, test_f1: 0.4263
 epoch: 7, train_loss: 1.1177, test_loss: 1.0723, test_f1: 0.4927
 epoch: 8, train_loss: 1.0930, test_loss: 1.0314, test_f1: 0.4994
 epoch: 9, train_loss: 1.0650, test_loss: 1.0127, test_f1: 0.5032
 epoch: 10, train_loss: 1.0444, test_loss: 1.0038, test_f1: 0.4826
 epoch: 11, train_loss: 1.0203, test_loss: 0.9783, test_f1: 0.5195
 epoch: 12, train_loss: 1.0092, test_loss: 0.9519, test_f1: 0.5184
 epoch: 13, train_loss: 0.9823, test_loss: 0.9608, test_f1: 0.4995
 epoch: 14, train_loss: 0.9779, test_loss: 0.9440, test_f1: 0.4888
 epoch: 15, train_loss: 0.9501, test_loss: 0.9562, test_f1: 0.5067
 epoch: 16, train_loss: 0.9442, test_loss: 0.9537, test_f1: 0.4816
 epoch: 17, train_loss: 0.9423, test_loss: 0.9253, test_f1: 0.5136
 epoch: 18, train_loss: 0.9226, test_loss: 0.9148, test_f1: 0.5148
 epoch: 19, train_loss: 0.9148, test_loss: 0.9372, test_f1: 0.5083
 epoch: 20, train_loss: 0.9213, test_loss: 0.9273, test_f1: 0.5176
 epoch: 21, train_loss: 0.9119, test_loss: 0.9393, test_f1: 0.5119
 epoch: 22, train_loss: 0.9005, test_loss: 0.9228, test_f1: 0.5276
 epoch: 23, train_loss: 0.8886, test_loss: 0.9159, test_f1: 0.5200
 epoch: 24, train_loss: 0.9032, test_loss: 0.9330, test_f1: 0.5127
 epoch: 25, train_loss: 0.8881, test_loss: 0.9453, test_f1: 0.5229
 epoch: 26, train_loss: 0.8822, test_loss: 0.9624, test_f1: 0.5175
 epoch: 27, train_loss: 0.8820, test_loss: 0.9593, test_f1: 0.5216
 epoch: 28, train_loss: 0.8740, test_loss: 0.9437, test_f1: 0.5305
 epoch: 29, train_loss: 0.8663, test_loss: 0.9380, test_f1: 0.5396
 epoch: 30, train_loss: 0.8691, test_loss: 0.9217, test_f1: 0.5167
 epoch: 31, train_loss: 0.8632, test_loss: 0.9224, test_f1: 0.5400
 epoch: 32, train_loss: 0.8632, test_loss: 0.9387, test_f1: 0.5230
 epoch: 33, train_loss: 0.8486, test_loss: 0.9488, test_f1: 0.5260
 epoch: 34, train_loss: 0.8521, test_loss: 0.9337, test_f1: 0.5229
 epoch: 35, train_loss: 0.8516, test_loss: 0.9361, test_f1: 0.5294
 epoch: 36, train_loss: 0.8548, test_loss: 0.9668, test_f1: 0.5166
 epoch: 37, train_loss: 0.8423, test_loss: 0.9438, test_f1: 0.5405
 epoch: 38, train_loss: 0.8398, test_loss: 0.9294, test_f1: 0.5492
 epoch: 39, train_loss: 0.8333, test_loss: 0.9548, test_f1: 0.5382
 epoch: 40, train_loss: 0.8400, test_loss: 0.9308, test_f1: 0.5510
 epoch: 41, train_loss: 0.8169, test_loss: 0.9726, test_f1: 0.5464
 epoch: 42, train_loss: 0.8291, test_loss: 0.9650, test_f1: 0.5324
 epoch: 43, train_loss: 0.8249, test_loss: 0.9534, test_f1: 0.5605
 epoch: 44, train_loss: 0.8134, test_loss: 0.9347, test_f1: 0.5539
 epoch: 45, train_loss: 0.8203, test_loss: 0.9432, test_f1: 0.5716
 epoch: 46, train_loss: 0.8078, test_loss: 0.9462, test_f1: 0.5488
 epoch: 47, train_loss: 0.8075, test_loss: 0.9441, test_f1: 0.5264
 epoch: 48, train_loss: 0.8075, test_loss: 0.9465, test_f1: 0.5551
 epoch: 49, train_loss: 0.7968, test_loss: 0.9698, test_f1: 0.5522
 epoch: 50, train_loss: 0.8002, test_loss: 0.9589, test_f1: 0.5788
 epoch: 51, train_loss: 0.8091, test_loss: 0.9501, test_f1: 0.5614
 epoch: 52, train_loss: 0.7827, test_loss: 0.9501, test_f1: 0.5621
 epoch: 53, train_loss: 0.7819, test_loss: 0.9393, test_f1: 0.5633
 epoch: 54, train_loss: 0.7892, test_loss: 0.9504, test_f1: 0.5760
 epoch: 55, train_loss: 0.7969, test_loss: 0.9610, test_f1: 0.5819
 epoch: 56, train_loss: 0.7847, test_loss: 0.9461, test_f1: 0.5806
 epoch: 57, train_loss: 0.7742, test_loss: 0.9403, test_f1: 0.5600
 epoch: 58, train_loss: 0.7845, test_loss: 0.9442, test_f1: 0.5808
 epoch: 59, train_loss: 0.7814, test_loss: 0.9416, test_f1: 0.5697
 epoch: 60, train_loss: 0.7804, test_loss: 0.9306, test_f1: 0.5859
 epoch: 61, train_loss: 0.7797, test_loss: 0.9491, test_f1: 0.5859
 epoch: 62, train_loss: 0.7781, test_loss: 0.9701, test_f1: 0.5600
 epoch: 63, train_loss: 0.7766, test_loss: 0.9517, test_f1: 0.5779
 epoch: 64, train_loss: 0.7688, test_loss: 0.9460, test_f1: 0.5792
 epoch: 65, train_loss: 0.7695, test_loss: 0.9501, test_f1: 0.5700
 epoch: 66, train_loss: 0.7565, test_loss: 0.9443, test_f1: 0.5610
 epoch: 67, train_loss: 0.7695, test_loss: 0.9730, test_f1: 0.5753
 epoch: 68, train_loss: 0.7712, test_loss: 0.9488, test_f1: 0.5829
 epoch: 69, train_loss: 0.7590, test_loss: 0.9547, test_f1: 0.5917
 epoch: 70, train_loss: 0.7690, test_loss: 0.9419, test_f1: 0.5942
 epoch: 71, train_loss: 0.7532, test_loss: 0.9626, test_f1: 0.5892
 epoch: 72, train_loss: 0.7579, test_loss: 0.9589, test_f1: 0.5885
 epoch: 73, train_loss: 0.7633, test_loss: 0.9351, test_f1: 0.5964
 epoch: 74, train_loss: 0.7599, test_loss: 0.9584, test_f1: 0.5912
 epoch: 75, train_loss: 0.7551, test_loss: 0.9638, test_f1: 0.5748
 epoch: 76, train_loss: 0.7530, test_loss: 0.9571, test_f1: 0.5756
 epoch: 77, train_loss: 0.7511, test_loss: 0.9325, test_f1: 0.5795
 epoch: 78, train_loss: 0.7460, test_loss: 0.9501, test_f1: 0.5708
 epoch: 79, train_loss: 0.7501, test_loss: 0.9580, test_f1: 0.5794
 epoch: 80, train_loss: 0.7408, test_loss: 0.9513, test_f1: 0.5981
 epoch: 81, train_loss: 0.7463, test_loss: 0.9478, test_f1: 0.5801
 epoch: 82, train_loss: 0.7473, test_loss: 0.9771, test_f1: 0.5952
 epoch: 83, train_loss: 0.7425, test_loss: 0.9695, test_f1: 0.6023
 epoch: 84, train_loss: 0.7423, test_loss: 0.9805, test_f1: 0.5979
 epoch: 85, train_loss: 0.7499, test_loss: 0.9631, test_f1: 0.5770
 epoch: 86, train_loss: 0.7386, test_loss: 0.9588, test_f1: 0.5873
 epoch: 87, train_loss: 0.7370, test_loss: 0.9651, test_f1: 0.5895
 epoch: 88, train_loss: 0.7427, test_loss: 0.9653, test_f1: 0.5849
 epoch: 89, train_loss: 0.7418, test_loss: 0.9717, test_f1: 0.5890
 epoch: 90, train_loss: 0.7393, test_loss: 0.9519, test_f1: 0.5806
 epoch: 91, train_loss: 0.7331, test_loss: 0.9550, test_f1: 0.5948
 epoch: 92, train_loss: 0.7237, test_loss: 0.9515, test_f1: 0.5876
 epoch: 93, train_loss: 0.7301, test_loss: 0.9821, test_f1: 0.5927
 epoch: 94, train_loss: 0.7383, test_loss: 0.9767, test_f1: 0.5971
 epoch: 95, train_loss: 0.7211, test_loss: 0.9646, test_f1: 0.5622
 epoch: 96, train_loss: 0.7329, test_loss: 0.9553, test_f1: 0.5868
 epoch: 97, train_loss: 0.7359, test_loss: 0.9575, test_f1: 0.5886
 epoch: 98, train_loss: 0.7332, test_loss: 0.9662, test_f1: 0.5897
 epoch: 99, train_loss: 0.7213, test_loss: 0.9477, test_f1: 0.5982
##################ITERATION #1 ****************************************
 epoch: 0, train_loss: 1.2811, test_loss: 1.2044, test_f1: 0.3058
 epoch: 1, train_loss: 1.2077, test_loss: 1.1575, test_f1: 0.3926
 epoch: 2, train_loss: 1.1694, test_loss: 1.1051, test_f1: 0.4376
 epoch: 3, train_loss: 1.1282, test_loss: 1.0651, test_f1: 0.4426
 epoch: 4, train_loss: 1.0906, test_loss: 1.0360, test_f1: 0.4558
 epoch: 5, train_loss: 1.0614, test_loss: 1.0015, test_f1: 0.4568
 epoch: 6, train_loss: 1.0261, test_loss: 0.9878, test_f1: 0.4685
 epoch: 7, train_loss: 1.0224, test_loss: 0.9654, test_f1: 0.4792
 epoch: 8, train_loss: 0.9959, test_loss: 0.9633, test_f1: 0.4724
 epoch: 9, train_loss: 0.9909, test_loss: 0.9360, test_f1: 0.5016
 epoch: 10, train_loss: 0.9674, test_loss: 0.9482, test_f1: 0.4917
 epoch: 11, train_loss: 0.9666, test_loss: 0.9402, test_f1: 0.5071
 epoch: 12, train_loss: 0.9572, test_loss: 0.9484, test_f1: 0.4997
 epoch: 13, train_loss: 0.9441, test_loss: 0.9434, test_f1: 0.5111
 epoch: 14, train_loss: 0.9464, test_loss: 0.9178, test_f1: 0.5483
 epoch: 15, train_loss: 0.9341, test_loss: 0.9177, test_f1: 0.5186
 epoch: 16, train_loss: 0.9312, test_loss: 0.9493, test_f1: 0.5056
 epoch: 17, train_loss: 0.9218, test_loss: 0.9290, test_f1: 0.5172
 epoch: 18, train_loss: 0.9083, test_loss: 0.9367, test_f1: 0.5292
 epoch: 19, train_loss: 0.9072, test_loss: 0.9162, test_f1: 0.5253
 epoch: 20, train_loss: 0.8999, test_loss: 0.9090, test_f1: 0.5231
 epoch: 21, train_loss: 0.8968, test_loss: 0.9046, test_f1: 0.5254
 epoch: 22, train_loss: 0.8964, test_loss: 0.9324, test_f1: 0.5129
 epoch: 23, train_loss: 0.8913, test_loss: 0.9313, test_f1: 0.5081
 epoch: 24, train_loss: 0.8900, test_loss: 0.9262, test_f1: 0.5221
 epoch: 25, train_loss: 0.8790, test_loss: 0.9151, test_f1: 0.5309
 epoch: 26, train_loss: 0.8792, test_loss: 0.9232, test_f1: 0.5216
 epoch: 27, train_loss: 0.8741, test_loss: 0.9448, test_f1: 0.5122
 epoch: 28, train_loss: 0.8648, test_loss: 0.9237, test_f1: 0.5382
 epoch: 29, train_loss: 0.8604, test_loss: 0.9575, test_f1: 0.5362
 epoch: 30, train_loss: 0.8683, test_loss: 0.9345, test_f1: 0.5339
 epoch: 31, train_loss: 0.8545, test_loss: 0.9346, test_f1: 0.5484
 epoch: 32, train_loss: 0.8381, test_loss: 0.9354, test_f1: 0.5255
 epoch: 33, train_loss: 0.8441, test_loss: 0.9457, test_f1: 0.5604
 epoch: 34, train_loss: 0.8408, test_loss: 0.9405, test_f1: 0.5520
 epoch: 35, train_loss: 0.8320, test_loss: 0.9630, test_f1: 0.5589
 epoch: 36, train_loss: 0.8368, test_loss: 0.9525, test_f1: 0.5603
 epoch: 37, train_loss: 0.8337, test_loss: 0.9486, test_f1: 0.5547
 epoch: 38, train_loss: 0.8365, test_loss: 0.9514, test_f1: 0.5475
 epoch: 39, train_loss: 0.8257, test_loss: 0.9218, test_f1: 0.5702
 epoch: 40, train_loss: 0.8195, test_loss: 0.9554, test_f1: 0.5369
 epoch: 41, train_loss: 0.8216, test_loss: 0.9449, test_f1: 0.5552
 epoch: 42, train_loss: 0.8090, test_loss: 0.9467, test_f1: 0.5453
 epoch: 43, train_loss: 0.8090, test_loss: 0.9456, test_f1: 0.5492
 epoch: 44, train_loss: 0.8021, test_loss: 0.9458, test_f1: 0.5509
 epoch: 45, train_loss: 0.8129, test_loss: 0.9634, test_f1: 0.5589
 epoch: 46, train_loss: 0.8103, test_loss: 0.9496, test_f1: 0.5602
 epoch: 47, train_loss: 0.8041, test_loss: 0.9519, test_f1: 0.5731
 epoch: 48, train_loss: 0.8040, test_loss: 0.9676, test_f1: 0.5655
 epoch: 49, train_loss: 0.7928, test_loss: 0.9641, test_f1: 0.5694
 epoch: 50, train_loss: 0.7940, test_loss: 0.9531, test_f1: 0.5729
 epoch: 51, train_loss: 0.7851, test_loss: 0.9502, test_f1: 0.5845
 epoch: 52, train_loss: 0.7784, test_loss: 0.9511, test_f1: 0.5698
 epoch: 53, train_loss: 0.7811, test_loss: 0.9471, test_f1: 0.5519
 epoch: 54, train_loss: 0.7825, test_loss: 0.9695, test_f1: 0.5586
 epoch: 55, train_loss: 0.7844, test_loss: 1.0054, test_f1: 0.5574
 epoch: 56, train_loss: 0.7576, test_loss: 0.9630, test_f1: 0.5579
 epoch: 57, train_loss: 0.7750, test_loss: 0.9546, test_f1: 0.5549
 epoch: 58, train_loss: 0.7597, test_loss: 0.9621, test_f1: 0.5616
 epoch: 59, train_loss: 0.7687, test_loss: 0.9720, test_f1: 0.5508
 epoch: 60, train_loss: 0.7611, test_loss: 0.9424, test_f1: 0.5650
 epoch: 61, train_loss: 0.7675, test_loss: 0.9503, test_f1: 0.5744
 epoch: 62, train_loss: 0.7670, test_loss: 0.9463, test_f1: 0.5561
 epoch: 63, train_loss: 0.7682, test_loss: 0.9644, test_f1: 0.5932
 epoch: 64, train_loss: 0.7628, test_loss: 0.9662, test_f1: 0.5423
 epoch: 65, train_loss: 0.7686, test_loss: 0.9496, test_f1: 0.5596
 epoch: 66, train_loss: 0.7565, test_loss: 0.9736, test_f1: 0.5610
 epoch: 67, train_loss: 0.7624, test_loss: 0.9816, test_f1: 0.5732
 epoch: 68, train_loss: 0.7631, test_loss: 0.9787, test_f1: 0.5815
 epoch: 69, train_loss: 0.7635, test_loss: 0.9960, test_f1: 0.5642
 epoch: 70, train_loss: 0.7525, test_loss: 0.9649, test_f1: 0.5892
 epoch: 71, train_loss: 0.7631, test_loss: 0.9523, test_f1: 0.5911
 epoch: 72, train_loss: 0.7484, test_loss: 0.9635, test_f1: 0.5543
 epoch: 73, train_loss: 0.7452, test_loss: 0.9718, test_f1: 0.5698
 epoch: 74, train_loss: 0.7491, test_loss: 0.9523, test_f1: 0.5680
 epoch: 75, train_loss: 0.7512, test_loss: 0.9689, test_f1: 0.5954
 epoch: 76, train_loss: 0.7438, test_loss: 0.9780, test_f1: 0.5790
 epoch: 77, train_loss: 0.7372, test_loss: 0.9627, test_f1: 0.5817
 epoch: 78, train_loss: 0.7436, test_loss: 0.9949, test_f1: 0.5711
 epoch: 79, train_loss: 0.7390, test_loss: 0.9732, test_f1: 0.5728
 epoch: 80, train_loss: 0.7419, test_loss: 0.9657, test_f1: 0.5776
 epoch: 81, train_loss: 0.7346, test_loss: 0.9929, test_f1: 0.5709
 epoch: 82, train_loss: 0.7391, test_loss: 0.9685, test_f1: 0.5881
 epoch: 83, train_loss: 0.7398, test_loss: 0.9691, test_f1: 0.5944
 epoch: 84, train_loss: 0.7414, test_loss: 0.9598, test_f1: 0.5533
 epoch: 85, train_loss: 0.7407, test_loss: 0.9837, test_f1: 0.5800
 epoch: 86, train_loss: 0.7501, test_loss: 0.9992, test_f1: 0.5809
 epoch: 87, train_loss: 0.7298, test_loss: 1.0022, test_f1: 0.5777
 epoch: 88, train_loss: 0.7426, test_loss: 0.9921, test_f1: 0.5853
 epoch: 89, train_loss: 0.7240, test_loss: 1.0071, test_f1: 0.5739
 epoch: 90, train_loss: 0.7320, test_loss: 0.9926, test_f1: 0.6061
 epoch: 91, train_loss: 0.7287, test_loss: 0.9645, test_f1: 0.5874
 epoch: 92, train_loss: 0.7287, test_loss: 0.9848, test_f1: 0.5767
 epoch: 93, train_loss: 0.7233, test_loss: 0.9784, test_f1: 0.5877
 epoch: 94, train_loss: 0.7247, test_loss: 0.9594, test_f1: 0.5754
 epoch: 95, train_loss: 0.7286, test_loss: 0.9856, test_f1: 0.5693
 epoch: 96, train_loss: 0.7264, test_loss: 0.9937, test_f1: 0.5971
 epoch: 97, train_loss: 0.7232, test_loss: 1.0100, test_f1: 0.5862
 epoch: 98, train_loss: 0.7205, test_loss: 0.9746, test_f1: 0.5835
 epoch: 99, train_loss: 0.7171, test_loss: 0.9883, test_f1: 0.5717
##################ITERATION #2 ****************************************
 epoch: 0, train_loss: 1.2584, test_loss: 1.1574, test_f1: 0.4043
 epoch: 1, train_loss: 1.1707, test_loss: 1.1018, test_f1: 0.4382
 epoch: 2, train_loss: 1.1318, test_loss: 1.0741, test_f1: 0.4421
 epoch: 3, train_loss: 1.1005, test_loss: 1.0250, test_f1: 0.4597
 epoch: 4, train_loss: 1.0697, test_loss: 1.0011, test_f1: 0.4568
 epoch: 5, train_loss: 1.0429, test_loss: 0.9842, test_f1: 0.4556
 epoch: 6, train_loss: 1.0143, test_loss: 0.9683, test_f1: 0.4686
 epoch: 7, train_loss: 1.0087, test_loss: 0.9624, test_f1: 0.4770
 epoch: 8, train_loss: 0.9995, test_loss: 0.9715, test_f1: 0.4592
 epoch: 9, train_loss: 0.9774, test_loss: 0.9393, test_f1: 0.4890
 epoch: 10, train_loss: 0.9638, test_loss: 0.9385, test_f1: 0.4737
 epoch: 11, train_loss: 0.9617, test_loss: 0.9303, test_f1: 0.5077
 epoch: 12, train_loss: 0.9555, test_loss: 0.9435, test_f1: 0.5286
 epoch: 13, train_loss: 0.9356, test_loss: 0.9299, test_f1: 0.5011
 epoch: 14, train_loss: 0.9291, test_loss: 0.9377, test_f1: 0.5168
 epoch: 15, train_loss: 0.9292, test_loss: 0.9501, test_f1: 0.5275
 epoch: 16, train_loss: 0.9224, test_loss: 0.9802, test_f1: 0.5284
 epoch: 17, train_loss: 0.9120, test_loss: 0.9333, test_f1: 0.5370
 epoch: 18, train_loss: 0.9074, test_loss: 0.9390, test_f1: 0.5442
 epoch: 19, train_loss: 0.8931, test_loss: 0.9195, test_f1: 0.5371
 epoch: 20, train_loss: 0.8994, test_loss: 0.9362, test_f1: 0.5248
 epoch: 21, train_loss: 0.8925, test_loss: 0.9427, test_f1: 0.5097
 epoch: 22, train_loss: 0.8914, test_loss: 0.9540, test_f1: 0.5120
 epoch: 23, train_loss: 0.8855, test_loss: 0.9321, test_f1: 0.5547
 epoch: 24, train_loss: 0.8929, test_loss: 0.9249, test_f1: 0.5493
 epoch: 25, train_loss: 0.8683, test_loss: 0.9331, test_f1: 0.5524
 epoch: 26, train_loss: 0.8654, test_loss: 0.9329, test_f1: 0.5700
 epoch: 27, train_loss: 0.8598, test_loss: 0.9270, test_f1: 0.5639
 epoch: 28, train_loss: 0.8583, test_loss: 0.9334, test_f1: 0.5710
 epoch: 29, train_loss: 0.8523, test_loss: 0.9755, test_f1: 0.5668
 epoch: 30, train_loss: 0.8548, test_loss: 0.9292, test_f1: 0.5638
 epoch: 31, train_loss: 0.8487, test_loss: 0.9446, test_f1: 0.5501
 epoch: 32, train_loss: 0.8421, test_loss: 0.9334, test_f1: 0.5510
 epoch: 33, train_loss: 0.8400, test_loss: 0.9310, test_f1: 0.5442
 epoch: 34, train_loss: 0.8326, test_loss: 0.9369, test_f1: 0.5622
 epoch: 35, train_loss: 0.8263, test_loss: 0.9537, test_f1: 0.5347
 epoch: 36, train_loss: 0.8325, test_loss: 0.9249, test_f1: 0.5630
 epoch: 37, train_loss: 0.8274, test_loss: 0.9069, test_f1: 0.5806
 epoch: 38, train_loss: 0.8239, test_loss: 0.9106, test_f1: 0.5715
 epoch: 39, train_loss: 0.8295, test_loss: 0.9302, test_f1: 0.5515
 epoch: 40, train_loss: 0.8334, test_loss: 0.9098, test_f1: 0.5732
 epoch: 41, train_loss: 0.8208, test_loss: 0.9167, test_f1: 0.5894
 epoch: 42, train_loss: 0.8050, test_loss: 0.9222, test_f1: 0.5743
 epoch: 43, train_loss: 0.8109, test_loss: 0.9394, test_f1: 0.5863
 epoch: 44, train_loss: 0.8009, test_loss: 0.9024, test_f1: 0.5848
 epoch: 45, train_loss: 0.8062, test_loss: 0.9567, test_f1: 0.5724
 epoch: 46, train_loss: 0.8105, test_loss: 0.9175, test_f1: 0.5705
 epoch: 47, train_loss: 0.8004, test_loss: 0.9354, test_f1: 0.5763
 epoch: 48, train_loss: 0.7946, test_loss: 0.9480, test_f1: 0.5913
 epoch: 49, train_loss: 0.7989, test_loss: 0.9621, test_f1: 0.5893
 epoch: 50, train_loss: 0.7768, test_loss: 0.9271, test_f1: 0.6022
 epoch: 51, train_loss: 0.7898, test_loss: 0.9139, test_f1: 0.5993
 epoch: 52, train_loss: 0.7823, test_loss: 0.9157, test_f1: 0.5793
 epoch: 53, train_loss: 0.7785, test_loss: 0.9360, test_f1: 0.5776
 epoch: 54, train_loss: 0.7780, test_loss: 0.9501, test_f1: 0.5694
 epoch: 55, train_loss: 0.7816, test_loss: 0.9303, test_f1: 0.5873
 epoch: 56, train_loss: 0.7748, test_loss: 0.9265, test_f1: 0.6064
 epoch: 57, train_loss: 0.7688, test_loss: 0.9168, test_f1: 0.5749
 epoch: 58, train_loss: 0.7647, test_loss: 0.9242, test_f1: 0.5796
 epoch: 59, train_loss: 0.7644, test_loss: 0.9077, test_f1: 0.6063
 epoch: 60, train_loss: 0.7664, test_loss: 0.9123, test_f1: 0.6027
 epoch: 61, train_loss: 0.7687, test_loss: 0.9422, test_f1: 0.6094
 epoch: 62, train_loss: 0.7614, test_loss: 0.9385, test_f1: 0.5874
 epoch: 63, train_loss: 0.7571, test_loss: 0.9229, test_f1: 0.5913
 epoch: 64, train_loss: 0.7554, test_loss: 0.9268, test_f1: 0.6023
 epoch: 65, train_loss: 0.7550, test_loss: 0.9163, test_f1: 0.5940
 epoch: 66, train_loss: 0.7432, test_loss: 0.9343, test_f1: 0.5947
 epoch: 67, train_loss: 0.7483, test_loss: 0.9386, test_f1: 0.5916
 epoch: 68, train_loss: 0.7527, test_loss: 0.9588, test_f1: 0.5996
 epoch: 69, train_loss: 0.7483, test_loss: 0.9277, test_f1: 0.5891
 epoch: 70, train_loss: 0.7448, test_loss: 0.9162, test_f1: 0.6046
 epoch: 71, train_loss: 0.7484, test_loss: 0.9217, test_f1: 0.5973
 epoch: 72, train_loss: 0.7462, test_loss: 0.9137, test_f1: 0.6131
 epoch: 73, train_loss: 0.7422, test_loss: 0.9217, test_f1: 0.5899
 epoch: 74, train_loss: 0.7532, test_loss: 0.9331, test_f1: 0.5962
 epoch: 75, train_loss: 0.7379, test_loss: 0.9332, test_f1: 0.5945
 epoch: 76, train_loss: 0.7375, test_loss: 0.9271, test_f1: 0.5808
 epoch: 77, train_loss: 0.7426, test_loss: 0.9209, test_f1: 0.6027
 epoch: 78, train_loss: 0.7317, test_loss: 0.9085, test_f1: 0.6061
 epoch: 79, train_loss: 0.7316, test_loss: 0.9459, test_f1: 0.6015
 epoch: 80, train_loss: 0.7377, test_loss: 0.9228, test_f1: 0.5773
 epoch: 81, train_loss: 0.7293, test_loss: 0.9268, test_f1: 0.5813
 epoch: 82, train_loss: 0.7268, test_loss: 0.9234, test_f1: 0.5999
 epoch: 83, train_loss: 0.7323, test_loss: 0.9210, test_f1: 0.6152
 epoch: 84, train_loss: 0.7257, test_loss: 0.9393, test_f1: 0.6214
 epoch: 85, train_loss: 0.7359, test_loss: 0.9169, test_f1: 0.6161
 epoch: 86, train_loss: 0.7268, test_loss: 0.9263, test_f1: 0.5738
 epoch: 87, train_loss: 0.7232, test_loss: 0.9429, test_f1: 0.5561
 epoch: 88, train_loss: 0.7157, test_loss: 0.9213, test_f1: 0.5948
 epoch: 89, train_loss: 0.7375, test_loss: 0.9441, test_f1: 0.6129
 epoch: 90, train_loss: 0.7223, test_loss: 0.9497, test_f1: 0.5650
 epoch: 91, train_loss: 0.7076, test_loss: 0.9246, test_f1: 0.6113
 epoch: 92, train_loss: 0.7154, test_loss: 0.9402, test_f1: 0.6181
 epoch: 93, train_loss: 0.7238, test_loss: 0.9421, test_f1: 0.5813
 epoch: 94, train_loss: 0.7210, test_loss: 0.9369, test_f1: 0.6048
 epoch: 95, train_loss: 0.7039, test_loss: 0.9426, test_f1: 0.5904
 epoch: 96, train_loss: 0.7236, test_loss: 0.9650, test_f1: 0.5848
 epoch: 97, train_loss: 0.7133, test_loss: 0.9504, test_f1: 0.5906
 epoch: 98, train_loss: 0.7116, test_loss: 0.9528, test_f1: 0.5795
 epoch: 99, train_loss: 0.7048, test_loss: 0.9632, test_f1: 0.5769
##################ITERATION #3 ****************************************
 epoch: 0, train_loss: 1.2616, test_loss: 1.1448, test_f1: 0.4193
 epoch: 1, train_loss: 1.1678, test_loss: 1.0920, test_f1: 0.4255
 epoch: 2, train_loss: 1.1288, test_loss: 1.0601, test_f1: 0.4564
 epoch: 3, train_loss: 1.0875, test_loss: 1.0170, test_f1: 0.4508
 epoch: 4, train_loss: 1.0666, test_loss: 0.9849, test_f1: 0.4682
 epoch: 5, train_loss: 1.0389, test_loss: 0.9637, test_f1: 0.4611
 epoch: 6, train_loss: 1.0199, test_loss: 0.9751, test_f1: 0.4527
 epoch: 7, train_loss: 0.9977, test_loss: 0.9605, test_f1: 0.4892
 epoch: 8, train_loss: 0.9950, test_loss: 0.9258, test_f1: 0.5019
 epoch: 9, train_loss: 0.9701, test_loss: 0.9256, test_f1: 0.4929
 epoch: 10, train_loss: 0.9584, test_loss: 0.9237, test_f1: 0.5016
 epoch: 11, train_loss: 0.9436, test_loss: 0.9218, test_f1: 0.5004
 epoch: 12, train_loss: 0.9364, test_loss: 0.8923, test_f1: 0.5013
 epoch: 13, train_loss: 0.9381, test_loss: 0.9178, test_f1: 0.5130
 epoch: 14, train_loss: 0.9299, test_loss: 0.9137, test_f1: 0.5120
 epoch: 15, train_loss: 0.9096, test_loss: 0.9164, test_f1: 0.5147
 epoch: 16, train_loss: 0.9234, test_loss: 0.9242, test_f1: 0.5171
 epoch: 17, train_loss: 0.9185, test_loss: 0.9270, test_f1: 0.5160
 epoch: 18, train_loss: 0.9085, test_loss: 0.9043, test_f1: 0.5222
 epoch: 19, train_loss: 0.8947, test_loss: 0.9126, test_f1: 0.5198
 epoch: 20, train_loss: 0.8965, test_loss: 0.9121, test_f1: 0.5227
 epoch: 21, train_loss: 0.8872, test_loss: 0.9335, test_f1: 0.5139
 epoch: 22, train_loss: 0.8909, test_loss: 0.9255, test_f1: 0.5148
 epoch: 23, train_loss: 0.8826, test_loss: 0.9056, test_f1: 0.5230
 epoch: 24, train_loss: 0.8773, test_loss: 0.9340, test_f1: 0.5233
 epoch: 25, train_loss: 0.8756, test_loss: 0.9209, test_f1: 0.5138
 epoch: 26, train_loss: 0.8674, test_loss: 0.9273, test_f1: 0.5398
 epoch: 27, train_loss: 0.8664, test_loss: 0.9595, test_f1: 0.4941
 epoch: 28, train_loss: 0.8548, test_loss: 0.9529, test_f1: 0.5349
 epoch: 29, train_loss: 0.8533, test_loss: 0.9183, test_f1: 0.5612
 epoch: 30, train_loss: 0.8422, test_loss: 0.9141, test_f1: 0.5624
 epoch: 31, train_loss: 0.8446, test_loss: 0.9380, test_f1: 0.5420
 epoch: 32, train_loss: 0.8509, test_loss: 0.9209, test_f1: 0.5436
 epoch: 33, train_loss: 0.8400, test_loss: 0.9303, test_f1: 0.5399
 epoch: 34, train_loss: 0.8327, test_loss: 0.9255, test_f1: 0.5454
 epoch: 35, train_loss: 0.8315, test_loss: 0.9399, test_f1: 0.5547
 epoch: 36, train_loss: 0.8385, test_loss: 0.9341, test_f1: 0.5571
 epoch: 37, train_loss: 0.8300, test_loss: 0.9459, test_f1: 0.5607
 epoch: 38, train_loss: 0.8277, test_loss: 0.9442, test_f1: 0.5648
 epoch: 39, train_loss: 0.8319, test_loss: 0.9436, test_f1: 0.5564
 epoch: 40, train_loss: 0.8158, test_loss: 0.9118, test_f1: 0.5513
 epoch: 41, train_loss: 0.8212, test_loss: 0.9207, test_f1: 0.5566
 epoch: 42, train_loss: 0.8113, test_loss: 0.9380, test_f1: 0.5716
 epoch: 43, train_loss: 0.8166, test_loss: 0.9507, test_f1: 0.5623
 epoch: 44, train_loss: 0.8185, test_loss: 0.9469, test_f1: 0.5778
 epoch: 45, train_loss: 0.8072, test_loss: 0.9374, test_f1: 0.5651
 epoch: 46, train_loss: 0.8052, test_loss: 0.9439, test_f1: 0.5480
 epoch: 47, train_loss: 0.7931, test_loss: 0.9392, test_f1: 0.5583
 epoch: 48, train_loss: 0.7925, test_loss: 0.9496, test_f1: 0.5592
 epoch: 49, train_loss: 0.7904, test_loss: 0.9552, test_f1: 0.5631
 epoch: 50, train_loss: 0.8014, test_loss: 0.9773, test_f1: 0.5657
 epoch: 51, train_loss: 0.7843, test_loss: 0.9768, test_f1: 0.5673
 epoch: 52, train_loss: 0.7731, test_loss: 0.9668, test_f1: 0.5761
 epoch: 53, train_loss: 0.7750, test_loss: 0.9383, test_f1: 0.5709
 epoch: 54, train_loss: 0.7760, test_loss: 0.9506, test_f1: 0.5816
 epoch: 55, train_loss: 0.7780, test_loss: 0.9487, test_f1: 0.5703
 epoch: 56, train_loss: 0.7699, test_loss: 0.9536, test_f1: 0.5723
 epoch: 57, train_loss: 0.7770, test_loss: 0.9625, test_f1: 0.5685
 epoch: 58, train_loss: 0.7721, test_loss: 0.9655, test_f1: 0.5698
 epoch: 59, train_loss: 0.7656, test_loss: 0.9653, test_f1: 0.5768
 epoch: 60, train_loss: 0.7665, test_loss: 0.9577, test_f1: 0.5763
 epoch: 61, train_loss: 0.7667, test_loss: 0.9580, test_f1: 0.5645
 epoch: 62, train_loss: 0.7652, test_loss: 0.9738, test_f1: 0.5713
 epoch: 63, train_loss: 0.7601, test_loss: 0.9558, test_f1: 0.5797
 epoch: 64, train_loss: 0.7727, test_loss: 0.9726, test_f1: 0.5656
 epoch: 65, train_loss: 0.7687, test_loss: 0.9516, test_f1: 0.5702
 epoch: 66, train_loss: 0.7632, test_loss: 0.9581, test_f1: 0.5747
 epoch: 67, train_loss: 0.7689, test_loss: 0.9557, test_f1: 0.5649
 epoch: 68, train_loss: 0.7559, test_loss: 0.9653, test_f1: 0.5735
 epoch: 69, train_loss: 0.7508, test_loss: 0.9607, test_f1: 0.5850
 epoch: 70, train_loss: 0.7529, test_loss: 0.9586, test_f1: 0.5628
 epoch: 71, train_loss: 0.7617, test_loss: 0.9903, test_f1: 0.5757
 epoch: 72, train_loss: 0.7575, test_loss: 0.9553, test_f1: 0.5570
 epoch: 73, train_loss: 0.7500, test_loss: 0.9562, test_f1: 0.5880
 epoch: 74, train_loss: 0.7386, test_loss: 0.9833, test_f1: 0.5780
 epoch: 75, train_loss: 0.7472, test_loss: 0.9701, test_f1: 0.5931
 epoch: 76, train_loss: 0.7396, test_loss: 0.9669, test_f1: 0.5779
 epoch: 77, train_loss: 0.7461, test_loss: 0.9441, test_f1: 0.5882
 epoch: 78, train_loss: 0.7359, test_loss: 0.9598, test_f1: 0.5696
 epoch: 79, train_loss: 0.7478, test_loss: 0.9479, test_f1: 0.5825
 epoch: 80, train_loss: 0.7396, test_loss: 0.9648, test_f1: 0.5941
 epoch: 81, train_loss: 0.7411, test_loss: 0.9578, test_f1: 0.5723
 epoch: 82, train_loss: 0.7369, test_loss: 0.9612, test_f1: 0.5710
 epoch: 83, train_loss: 0.7353, test_loss: 0.9511, test_f1: 0.5934
 epoch: 84, train_loss: 0.7405, test_loss: 0.9530, test_f1: 0.5842
 epoch: 85, train_loss: 0.7266, test_loss: 0.9616, test_f1: 0.5788
 epoch: 86, train_loss: 0.7276, test_loss: 0.9665, test_f1: 0.5916
 epoch: 87, train_loss: 0.7358, test_loss: 0.9643, test_f1: 0.5950
 epoch: 88, train_loss: 0.7317, test_loss: 0.9739, test_f1: 0.5784
 epoch: 89, train_loss: 0.7363, test_loss: 0.9711, test_f1: 0.5925
 epoch: 90, train_loss: 0.7299, test_loss: 0.9903, test_f1: 0.5764
 epoch: 91, train_loss: 0.7279, test_loss: 0.9769, test_f1: 0.5838
 epoch: 92, train_loss: 0.7203, test_loss: 0.9739, test_f1: 0.5909
 epoch: 93, train_loss: 0.7221, test_loss: 0.9730, test_f1: 0.5931
 epoch: 94, train_loss: 0.7227, test_loss: 0.9765, test_f1: 0.5767
 epoch: 95, train_loss: 0.7186, test_loss: 0.9703, test_f1: 0.5917
 epoch: 96, train_loss: 0.7195, test_loss: 0.9710, test_f1: 0.5742
 epoch: 97, train_loss: 0.7151, test_loss: 0.9677, test_f1: 0.5856
 epoch: 98, train_loss: 0.7205, test_loss: 0.9565, test_f1: 0.6016
 epoch: 99, train_loss: 0.7147, test_loss: 0.9862, test_f1: 0.5787
##################ITERATION #4 ****************************************
 epoch: 0, train_loss: 1.2687, test_loss: 1.1374, test_f1: 0.3758
 epoch: 1, train_loss: 1.1690, test_loss: 1.0968, test_f1: 0.4195
 epoch: 2, train_loss: 1.1313, test_loss: 1.0553, test_f1: 0.4561
 epoch: 3, train_loss: 1.0889, test_loss: 1.0237, test_f1: 0.4823
 epoch: 4, train_loss: 1.0659, test_loss: 1.0027, test_f1: 0.4771
 epoch: 5, train_loss: 1.0515, test_loss: 1.0041, test_f1: 0.4671
 epoch: 6, train_loss: 1.0272, test_loss: 0.9804, test_f1: 0.4843
 epoch: 7, train_loss: 1.0136, test_loss: 0.9716, test_f1: 0.4790
 epoch: 8, train_loss: 1.0059, test_loss: 0.9690, test_f1: 0.4970
 epoch: 9, train_loss: 0.9922, test_loss: 0.9590, test_f1: 0.5175
 epoch: 10, train_loss: 0.9858, test_loss: 0.9534, test_f1: 0.5154
 epoch: 11, train_loss: 0.9680, test_loss: 0.9579, test_f1: 0.4993
 epoch: 12, train_loss: 0.9613, test_loss: 0.9416, test_f1: 0.4945
 epoch: 13, train_loss: 0.9568, test_loss: 0.9361, test_f1: 0.4966
 epoch: 14, train_loss: 0.9506, test_loss: 0.9417, test_f1: 0.4982
 epoch: 15, train_loss: 0.9289, test_loss: 0.9164, test_f1: 0.4976
 epoch: 16, train_loss: 0.9302, test_loss: 0.9214, test_f1: 0.5183
 epoch: 17, train_loss: 0.9229, test_loss: 0.9193, test_f1: 0.5331
 epoch: 18, train_loss: 0.9323, test_loss: 0.9138, test_f1: 0.5413
 epoch: 19, train_loss: 0.9166, test_loss: 0.9219, test_f1: 0.5255
 epoch: 20, train_loss: 0.9126, test_loss: 0.9174, test_f1: 0.5450
 epoch: 21, train_loss: 0.8994, test_loss: 0.9168, test_f1: 0.5447
 epoch: 22, train_loss: 0.8917, test_loss: 0.9379, test_f1: 0.5330
 epoch: 23, train_loss: 0.8907, test_loss: 0.9215, test_f1: 0.5556
 epoch: 24, train_loss: 0.8873, test_loss: 0.9174, test_f1: 0.5717
 epoch: 25, train_loss: 0.8852, test_loss: 0.9282, test_f1: 0.5288
 epoch: 26, train_loss: 0.8768, test_loss: 0.9180, test_f1: 0.5447
 epoch: 27, train_loss: 0.8762, test_loss: 0.9223, test_f1: 0.5601
 epoch: 28, train_loss: 0.8758, test_loss: 0.9280, test_f1: 0.5550
 epoch: 29, train_loss: 0.8798, test_loss: 0.9113, test_f1: 0.5784
 epoch: 30, train_loss: 0.8725, test_loss: 0.9466, test_f1: 0.5653
 epoch: 31, train_loss: 0.8594, test_loss: 0.9155, test_f1: 0.5779
 epoch: 32, train_loss: 0.8627, test_loss: 0.9274, test_f1: 0.5606
 epoch: 33, train_loss: 0.8547, test_loss: 0.9028, test_f1: 0.5540
 epoch: 34, train_loss: 0.8521, test_loss: 0.9411, test_f1: 0.5412
 epoch: 35, train_loss: 0.8546, test_loss: 0.9158, test_f1: 0.5767
 epoch: 36, train_loss: 0.8444, test_loss: 0.9599, test_f1: 0.5687
 epoch: 37, train_loss: 0.8499, test_loss: 0.9446, test_f1: 0.5738
 epoch: 38, train_loss: 0.8380, test_loss: 0.9539, test_f1: 0.5620
 epoch: 39, train_loss: 0.8318, test_loss: 0.9167, test_f1: 0.5892
 epoch: 40, train_loss: 0.8412, test_loss: 0.9488, test_f1: 0.5449
 epoch: 41, train_loss: 0.8270, test_loss: 0.9393, test_f1: 0.5653
 epoch: 42, train_loss: 0.8166, test_loss: 0.9345, test_f1: 0.5492
 epoch: 43, train_loss: 0.8173, test_loss: 0.9656, test_f1: 0.5530
 epoch: 44, train_loss: 0.8235, test_loss: 0.9420, test_f1: 0.5423
 epoch: 45, train_loss: 0.8288, test_loss: 0.9292, test_f1: 0.5894
 epoch: 46, train_loss: 0.8047, test_loss: 0.9106, test_f1: 0.5559
 epoch: 47, train_loss: 0.8089, test_loss: 0.9146, test_f1: 0.5795
 epoch: 48, train_loss: 0.8028, test_loss: 0.9137, test_f1: 0.5822
 epoch: 49, train_loss: 0.7993, test_loss: 0.9500, test_f1: 0.5829
 epoch: 50, train_loss: 0.8052, test_loss: 0.8941, test_f1: 0.5855
 epoch: 51, train_loss: 0.7979, test_loss: 0.9053, test_f1: 0.5977
 epoch: 52, train_loss: 0.7967, test_loss: 0.9415, test_f1: 0.5963
 epoch: 53, train_loss: 0.7876, test_loss: 0.9303, test_f1: 0.5593
 epoch: 54, train_loss: 0.8009, test_loss: 0.9355, test_f1: 0.5976
 epoch: 55, train_loss: 0.7853, test_loss: 0.9301, test_f1: 0.5803
 epoch: 56, train_loss: 0.7923, test_loss: 0.9326, test_f1: 0.5772
 epoch: 57, train_loss: 0.7841, test_loss: 0.9392, test_f1: 0.5737
 epoch: 58, train_loss: 0.7784, test_loss: 0.9375, test_f1: 0.5901
 epoch: 59, train_loss: 0.7801, test_loss: 0.9527, test_f1: 0.5618
 epoch: 60, train_loss: 0.7821, test_loss: 0.9526, test_f1: 0.5673
 epoch: 61, train_loss: 0.7846, test_loss: 0.9456, test_f1: 0.5948
 epoch: 62, train_loss: 0.7762, test_loss: 0.9287, test_f1: 0.6011
 epoch: 63, train_loss: 0.7778, test_loss: 0.9492, test_f1: 0.5882
 epoch: 64, train_loss: 0.7645, test_loss: 0.9609, test_f1: 0.5985
 epoch: 65, train_loss: 0.7689, test_loss: 0.9654, test_f1: 0.5701
 epoch: 66, train_loss: 0.7747, test_loss: 0.9309, test_f1: 0.5876
 epoch: 67, train_loss: 0.7741, test_loss: 0.9483, test_f1: 0.5867
 epoch: 68, train_loss: 0.7570, test_loss: 0.9356, test_f1: 0.5740
 epoch: 69, train_loss: 0.7774, test_loss: 0.9634, test_f1: 0.5986
 epoch: 70, train_loss: 0.7654, test_loss: 0.9326, test_f1: 0.5633
 epoch: 71, train_loss: 0.7617, test_loss: 0.9415, test_f1: 0.5749
 epoch: 72, train_loss: 0.7623, test_loss: 0.9271, test_f1: 0.5757
 epoch: 73, train_loss: 0.7522, test_loss: 0.9464, test_f1: 0.5647
 epoch: 74, train_loss: 0.7574, test_loss: 0.9525, test_f1: 0.6008
 epoch: 75, train_loss: 0.7553, test_loss: 0.9433, test_f1: 0.5850
 epoch: 76, train_loss: 0.7532, test_loss: 0.9439, test_f1: 0.5844
 epoch: 77, train_loss: 0.7454, test_loss: 0.9487, test_f1: 0.5804
 epoch: 78, train_loss: 0.7444, test_loss: 0.9528, test_f1: 0.5654
 epoch: 79, train_loss: 0.7548, test_loss: 0.9648, test_f1: 0.5935
 epoch: 80, train_loss: 0.7468, test_loss: 0.9317, test_f1: 0.5784
 epoch: 81, train_loss: 0.7525, test_loss: 0.9673, test_f1: 0.5760
 epoch: 82, train_loss: 0.7523, test_loss: 0.9560, test_f1: 0.5621
 epoch: 83, train_loss: 0.7375, test_loss: 0.9392, test_f1: 0.5779
 epoch: 84, train_loss: 0.7357, test_loss: 0.9592, test_f1: 0.5858
 epoch: 85, train_loss: 0.7376, test_loss: 0.9589, test_f1: 0.5812
 epoch: 86, train_loss: 0.7447, test_loss: 0.9491, test_f1: 0.5822
 epoch: 87, train_loss: 0.7476, test_loss: 0.9689, test_f1: 0.5576
 epoch: 88, train_loss: 0.7521, test_loss: 0.9597, test_f1: 0.5916
 epoch: 89, train_loss: 0.7399, test_loss: 0.9421, test_f1: 0.5673
 epoch: 90, train_loss: 0.7395, test_loss: 0.9224, test_f1: 0.5769
 epoch: 91, train_loss: 0.7420, test_loss: 0.9619, test_f1: 0.5662
 epoch: 92, train_loss: 0.7249, test_loss: 0.9464, test_f1: 0.5807
 epoch: 93, train_loss: 0.7378, test_loss: 0.9486, test_f1: 0.5784
 epoch: 94, train_loss: 0.7259, test_loss: 0.9445, test_f1: 0.5766
 epoch: 95, train_loss: 0.7499, test_loss: 0.9631, test_f1: 0.5625
 epoch: 96, train_loss: 0.7290, test_loss: 0.9616, test_f1: 0.5862
 epoch: 97, train_loss: 0.7362, test_loss: 0.9633, test_f1: 0.5905
 epoch: 98, train_loss: 0.7346, test_loss: 0.9621, test_f1: 0.5928
 epoch: 99, train_loss: 0.7263, test_loss: 0.9528, test_f1: 0.5885
##################ITERATION #5 ****************************************
 epoch: 0, train_loss: 1.2601, test_loss: 1.1035, test_f1: 0.4009
 epoch: 1, train_loss: 1.1357, test_loss: 1.0558, test_f1: 0.4200
 epoch: 2, train_loss: 1.1043, test_loss: 1.0346, test_f1: 0.4216
 epoch: 3, train_loss: 1.0779, test_loss: 1.0301, test_f1: 0.4304
 epoch: 4, train_loss: 1.0715, test_loss: 0.9985, test_f1: 0.4692
 epoch: 5, train_loss: 1.0426, test_loss: 0.9892, test_f1: 0.4595
 epoch: 6, train_loss: 1.0246, test_loss: 0.9739, test_f1: 0.4741
 epoch: 7, train_loss: 1.0118, test_loss: 0.9872, test_f1: 0.4606
 epoch: 8, train_loss: 0.9998, test_loss: 0.9812, test_f1: 0.4707
 epoch: 9, train_loss: 0.9926, test_loss: 0.9646, test_f1: 0.4778
 epoch: 10, train_loss: 0.9978, test_loss: 0.9556, test_f1: 0.4768
 epoch: 11, train_loss: 0.9685, test_loss: 0.9630, test_f1: 0.4633
 epoch: 12, train_loss: 0.9661, test_loss: 0.9517, test_f1: 0.4705
 epoch: 13, train_loss: 0.9518, test_loss: 0.9582, test_f1: 0.5037
 epoch: 14, train_loss: 0.9515, test_loss: 0.9599, test_f1: 0.4817
 epoch: 15, train_loss: 0.9382, test_loss: 0.9831, test_f1: 0.4813
 epoch: 16, train_loss: 0.9250, test_loss: 0.9421, test_f1: 0.4768
 epoch: 17, train_loss: 0.9262, test_loss: 0.9607, test_f1: 0.4758
 epoch: 18, train_loss: 0.9203, test_loss: 0.9639, test_f1: 0.4806
 epoch: 19, train_loss: 0.9148, test_loss: 0.9569, test_f1: 0.5019
 epoch: 20, train_loss: 0.9121, test_loss: 0.9245, test_f1: 0.5069
 epoch: 21, train_loss: 0.8927, test_loss: 0.9227, test_f1: 0.5132
 epoch: 22, train_loss: 0.8970, test_loss: 0.9462, test_f1: 0.4994
 epoch: 23, train_loss: 0.8971, test_loss: 0.9596, test_f1: 0.5003
 epoch: 24, train_loss: 0.8855, test_loss: 0.9618, test_f1: 0.5057
 epoch: 25, train_loss: 0.8842, test_loss: 0.9576, test_f1: 0.4922
 epoch: 26, train_loss: 0.8809, test_loss: 0.9461, test_f1: 0.5168
 epoch: 27, train_loss: 0.8709, test_loss: 0.9317, test_f1: 0.5167
 epoch: 28, train_loss: 0.8722, test_loss: 0.9772, test_f1: 0.5161
 epoch: 29, train_loss: 0.8710, test_loss: 0.9574, test_f1: 0.5057
 epoch: 30, train_loss: 0.8631, test_loss: 0.9431, test_f1: 0.5353
 epoch: 31, train_loss: 0.8594, test_loss: 0.9458, test_f1: 0.5283
 epoch: 32, train_loss: 0.8476, test_loss: 0.9554, test_f1: 0.5154
 epoch: 33, train_loss: 0.8468, test_loss: 0.9590, test_f1: 0.5175
 epoch: 34, train_loss: 0.8471, test_loss: 0.9513, test_f1: 0.5304
 epoch: 35, train_loss: 0.8335, test_loss: 0.9842, test_f1: 0.5096
 epoch: 36, train_loss: 0.8390, test_loss: 0.9600, test_f1: 0.5253
 epoch: 37, train_loss: 0.8386, test_loss: 0.9941, test_f1: 0.5045
 epoch: 38, train_loss: 0.8241, test_loss: 0.9660, test_f1: 0.5211
 epoch: 39, train_loss: 0.8322, test_loss: 0.9690, test_f1: 0.5123
 epoch: 40, train_loss: 0.8272, test_loss: 0.9273, test_f1: 0.5400
 epoch: 41, train_loss: 0.8174, test_loss: 0.9657, test_f1: 0.5336
 epoch: 42, train_loss: 0.8157, test_loss: 0.9479, test_f1: 0.5263
 epoch: 43, train_loss: 0.8217, test_loss: 0.9652, test_f1: 0.5297
 epoch: 44, train_loss: 0.8182, test_loss: 0.9637, test_f1: 0.5205
 epoch: 45, train_loss: 0.8137, test_loss: 0.9760, test_f1: 0.5302
 epoch: 46, train_loss: 0.8014, test_loss: 0.9536, test_f1: 0.5406
 epoch: 47, train_loss: 0.8045, test_loss: 0.9720, test_f1: 0.5371
 epoch: 48, train_loss: 0.8018, test_loss: 0.9541, test_f1: 0.5309
 epoch: 49, train_loss: 0.8036, test_loss: 0.9781, test_f1: 0.5315
 epoch: 50, train_loss: 0.8025, test_loss: 0.9470, test_f1: 0.5572
 epoch: 51, train_loss: 0.7997, test_loss: 0.9768, test_f1: 0.5348
 epoch: 52, train_loss: 0.7964, test_loss: 0.9532, test_f1: 0.5468
 epoch: 53, train_loss: 0.7778, test_loss: 0.9501, test_f1: 0.5559
 epoch: 54, train_loss: 0.7798, test_loss: 0.9491, test_f1: 0.5524
 epoch: 55, train_loss: 0.7934, test_loss: 0.9508, test_f1: 0.5511
 epoch: 56, train_loss: 0.7784, test_loss: 0.9587, test_f1: 0.5536
 epoch: 57, train_loss: 0.7740, test_loss: 0.9434, test_f1: 0.5436
 epoch: 58, train_loss: 0.7675, test_loss: 0.9797, test_f1: 0.5553
 epoch: 59, train_loss: 0.7711, test_loss: 0.9577, test_f1: 0.5469
 epoch: 60, train_loss: 0.7718, test_loss: 0.9433, test_f1: 0.5509
 epoch: 61, train_loss: 0.7682, test_loss: 0.9518, test_f1: 0.5464
 epoch: 62, train_loss: 0.7706, test_loss: 0.9476, test_f1: 0.5546
 epoch: 63, train_loss: 0.7738, test_loss: 0.9745, test_f1: 0.5555
 epoch: 64, train_loss: 0.7695, test_loss: 0.9467, test_f1: 0.5669
 epoch: 65, train_loss: 0.7703, test_loss: 0.9447, test_f1: 0.5643
 epoch: 66, train_loss: 0.7542, test_loss: 0.9552, test_f1: 0.5658
 epoch: 67, train_loss: 0.7576, test_loss: 0.9365, test_f1: 0.5540
 epoch: 68, train_loss: 0.7554, test_loss: 0.9530, test_f1: 0.5727
 epoch: 69, train_loss: 0.7531, test_loss: 0.9441, test_f1: 0.5805
 epoch: 70, train_loss: 0.7563, test_loss: 0.9355, test_f1: 0.5768
 epoch: 71, train_loss: 0.7550, test_loss: 0.9391, test_f1: 0.5730
 epoch: 72, train_loss: 0.7598, test_loss: 0.9548, test_f1: 0.5523
 epoch: 73, train_loss: 0.7578, test_loss: 0.9658, test_f1: 0.5545
 epoch: 74, train_loss: 0.7598, test_loss: 0.9382, test_f1: 0.5649
 epoch: 75, train_loss: 0.7547, test_loss: 0.9626, test_f1: 0.5542
 epoch: 76, train_loss: 0.7461, test_loss: 0.9445, test_f1: 0.5669
 epoch: 77, train_loss: 0.7533, test_loss: 0.9747, test_f1: 0.5579
 epoch: 78, train_loss: 0.7550, test_loss: 0.9584, test_f1: 0.5705
 epoch: 79, train_loss: 0.7532, test_loss: 0.9554, test_f1: 0.5569
 epoch: 80, train_loss: 0.7601, test_loss: 0.9263, test_f1: 0.5653
 epoch: 81, train_loss: 0.7468, test_loss: 0.9614, test_f1: 0.5578
 epoch: 82, train_loss: 0.7296, test_loss: 0.9575, test_f1: 0.5695
 epoch: 83, train_loss: 0.7415, test_loss: 0.9540, test_f1: 0.5850
 epoch: 84, train_loss: 0.7544, test_loss: 0.9427, test_f1: 0.5820
 epoch: 85, train_loss: 0.7322, test_loss: 0.9370, test_f1: 0.5872
 epoch: 86, train_loss: 0.7374, test_loss: 0.9528, test_f1: 0.5942
 epoch: 87, train_loss: 0.7359, test_loss: 0.9496, test_f1: 0.5923
 epoch: 88, train_loss: 0.7388, test_loss: 0.9601, test_f1: 0.5592
 epoch: 89, train_loss: 0.7280, test_loss: 0.9550, test_f1: 0.5751
 epoch: 90, train_loss: 0.7426, test_loss: 0.9441, test_f1: 0.5818
 epoch: 91, train_loss: 0.7364, test_loss: 0.9624, test_f1: 0.5718
 epoch: 92, train_loss: 0.7307, test_loss: 0.9408, test_f1: 0.5841
 epoch: 93, train_loss: 0.7164, test_loss: 0.9588, test_f1: 0.5792
 epoch: 94, train_loss: 0.7279, test_loss: 0.9562, test_f1: 0.5682
 epoch: 95, train_loss: 0.7310, test_loss: 0.9534, test_f1: 0.5803
 epoch: 96, train_loss: 0.7192, test_loss: 0.9617, test_f1: 0.5751
 epoch: 97, train_loss: 0.7225, test_loss: 0.9628, test_f1: 0.5891
 epoch: 98, train_loss: 0.7160, test_loss: 0.9681, test_f1: 0.5721
 epoch: 99, train_loss: 0.7175, test_loss: 0.9580, test_f1: 0.5857
##################ITERATION #6 ****************************************
 epoch: 0, train_loss: 1.2585, test_loss: 1.1236, test_f1: 0.3757
 epoch: 1, train_loss: 1.1581, test_loss: 1.0740, test_f1: 0.4290
 epoch: 2, train_loss: 1.1144, test_loss: 1.0463, test_f1: 0.4098
 epoch: 3, train_loss: 1.0835, test_loss: 1.0131, test_f1: 0.4509
 epoch: 4, train_loss: 1.0637, test_loss: 0.9972, test_f1: 0.4399
 epoch: 5, train_loss: 1.0364, test_loss: 0.9827, test_f1: 0.4564
 epoch: 6, train_loss: 1.0161, test_loss: 0.9568, test_f1: 0.4789
 epoch: 7, train_loss: 1.0030, test_loss: 0.9451, test_f1: 0.4745
 epoch: 8, train_loss: 0.9897, test_loss: 0.9275, test_f1: 0.5079
 epoch: 9, train_loss: 0.9734, test_loss: 0.9345, test_f1: 0.5049
 epoch: 10, train_loss: 0.9717, test_loss: 0.9261, test_f1: 0.5190
 epoch: 11, train_loss: 0.9580, test_loss: 0.9524, test_f1: 0.4714
 epoch: 12, train_loss: 0.9515, test_loss: 0.9093, test_f1: 0.5379
 epoch: 13, train_loss: 0.9524, test_loss: 0.9221, test_f1: 0.5410
 epoch: 14, train_loss: 0.9356, test_loss: 0.9473, test_f1: 0.5049
 epoch: 15, train_loss: 0.9249, test_loss: 0.9309, test_f1: 0.5101
 epoch: 16, train_loss: 0.9246, test_loss: 0.9288, test_f1: 0.4973
 epoch: 17, train_loss: 0.9127, test_loss: 0.9382, test_f1: 0.4958
 epoch: 18, train_loss: 0.9189, test_loss: 0.9101, test_f1: 0.5036
 epoch: 19, train_loss: 0.8982, test_loss: 0.9357, test_f1: 0.4899
 epoch: 20, train_loss: 0.8908, test_loss: 0.9136, test_f1: 0.5136
 epoch: 21, train_loss: 0.8761, test_loss: 0.9393, test_f1: 0.4967
 epoch: 22, train_loss: 0.8868, test_loss: 0.9156, test_f1: 0.5024
 epoch: 23, train_loss: 0.8839, test_loss: 0.9258, test_f1: 0.5368
 epoch: 24, train_loss: 0.8765, test_loss: 0.9116, test_f1: 0.5214
 epoch: 25, train_loss: 0.8832, test_loss: 0.9260, test_f1: 0.5223
 epoch: 26, train_loss: 0.8759, test_loss: 0.9295, test_f1: 0.5292
 epoch: 27, train_loss: 0.8686, test_loss: 0.9056, test_f1: 0.5248
 epoch: 28, train_loss: 0.8685, test_loss: 0.9155, test_f1: 0.5229
 epoch: 29, train_loss: 0.8723, test_loss: 0.9307, test_f1: 0.5204
 epoch: 30, train_loss: 0.8545, test_loss: 0.9184, test_f1: 0.5205
 epoch: 31, train_loss: 0.8653, test_loss: 0.9417, test_f1: 0.5032
 epoch: 32, train_loss: 0.8474, test_loss: 0.9488, test_f1: 0.4981
 epoch: 33, train_loss: 0.8502, test_loss: 0.9457, test_f1: 0.5399
 epoch: 34, train_loss: 0.8422, test_loss: 0.9359, test_f1: 0.5530
 epoch: 35, train_loss: 0.8267, test_loss: 0.9110, test_f1: 0.5179
 epoch: 36, train_loss: 0.8390, test_loss: 0.9195, test_f1: 0.5394
 epoch: 37, train_loss: 0.8283, test_loss: 0.9421, test_f1: 0.5111
 epoch: 38, train_loss: 0.8340, test_loss: 0.9324, test_f1: 0.5328
 epoch: 39, train_loss: 0.8140, test_loss: 0.9448, test_f1: 0.5302
 epoch: 40, train_loss: 0.8205, test_loss: 0.9328, test_f1: 0.5478
 epoch: 41, train_loss: 0.8299, test_loss: 0.9490, test_f1: 0.5147
 epoch: 42, train_loss: 0.8149, test_loss: 0.9404, test_f1: 0.5454
 epoch: 43, train_loss: 0.8055, test_loss: 0.9394, test_f1: 0.5270
 epoch: 44, train_loss: 0.8109, test_loss: 0.9582, test_f1: 0.5400
 epoch: 45, train_loss: 0.8091, test_loss: 0.9573, test_f1: 0.5400
 epoch: 46, train_loss: 0.8050, test_loss: 0.9377, test_f1: 0.5606
 epoch: 47, train_loss: 0.8037, test_loss: 0.9405, test_f1: 0.5466
 epoch: 48, train_loss: 0.8040, test_loss: 0.9716, test_f1: 0.5799
 epoch: 49, train_loss: 0.8005, test_loss: 0.9492, test_f1: 0.5779
 epoch: 50, train_loss: 0.7940, test_loss: 0.9358, test_f1: 0.5556
 epoch: 51, train_loss: 0.7865, test_loss: 0.9527, test_f1: 0.5435
 epoch: 52, train_loss: 0.7790, test_loss: 0.9792, test_f1: 0.5445
 epoch: 53, train_loss: 0.7821, test_loss: 0.9436, test_f1: 0.5485
 epoch: 54, train_loss: 0.7784, test_loss: 0.9484, test_f1: 0.5473
 epoch: 55, train_loss: 0.7742, test_loss: 0.9392, test_f1: 0.5737
 epoch: 56, train_loss: 0.7745, test_loss: 0.9507, test_f1: 0.5672
 epoch: 57, train_loss: 0.7689, test_loss: 0.9543, test_f1: 0.5541
 epoch: 58, train_loss: 0.7740, test_loss: 0.9493, test_f1: 0.5508
 epoch: 59, train_loss: 0.7603, test_loss: 0.9573, test_f1: 0.5585
 epoch: 60, train_loss: 0.7678, test_loss: 0.9449, test_f1: 0.5612
 epoch: 61, train_loss: 0.7629, test_loss: 0.9604, test_f1: 0.5517
 epoch: 62, train_loss: 0.7623, test_loss: 0.9686, test_f1: 0.5441
 epoch: 63, train_loss: 0.7572, test_loss: 0.9545, test_f1: 0.5611
 epoch: 64, train_loss: 0.7638, test_loss: 0.9270, test_f1: 0.5748
 epoch: 65, train_loss: 0.7601, test_loss: 0.9521, test_f1: 0.5700
 epoch: 66, train_loss: 0.7642, test_loss: 0.9488, test_f1: 0.5764
 epoch: 67, train_loss: 0.7588, test_loss: 0.9695, test_f1: 0.5779
 epoch: 68, train_loss: 0.7627, test_loss: 0.9479, test_f1: 0.5817
 epoch: 69, train_loss: 0.7601, test_loss: 0.9781, test_f1: 0.5735
 epoch: 70, train_loss: 0.7562, test_loss: 0.9606, test_f1: 0.5827
 epoch: 71, train_loss: 0.7506, test_loss: 0.9654, test_f1: 0.5757
 epoch: 72, train_loss: 0.7605, test_loss: 0.9512, test_f1: 0.5828
 epoch: 73, train_loss: 0.7488, test_loss: 0.9937, test_f1: 0.5772
 epoch: 74, train_loss: 0.7443, test_loss: 0.9677, test_f1: 0.5715
 epoch: 75, train_loss: 0.7448, test_loss: 0.9628, test_f1: 0.5785
 epoch: 76, train_loss: 0.7505, test_loss: 0.9769, test_f1: 0.5726
 epoch: 77, train_loss: 0.7532, test_loss: 0.9726, test_f1: 0.5775
 epoch: 78, train_loss: 0.7475, test_loss: 0.9757, test_f1: 0.5798
 epoch: 79, train_loss: 0.7432, test_loss: 0.9801, test_f1: 0.5770
 epoch: 80, train_loss: 0.7324, test_loss: 0.9643, test_f1: 0.5595
 epoch: 81, train_loss: 0.7393, test_loss: 0.9641, test_f1: 0.5973
 epoch: 82, train_loss: 0.7444, test_loss: 0.9914, test_f1: 0.5603
 epoch: 83, train_loss: 0.7467, test_loss: 0.9616, test_f1: 0.5807
 epoch: 84, train_loss: 0.7370, test_loss: 0.9663, test_f1: 0.5682
 epoch: 85, train_loss: 0.7346, test_loss: 0.9657, test_f1: 0.5896
 epoch: 86, train_loss: 0.7418, test_loss: 0.9479, test_f1: 0.5846
 epoch: 87, train_loss: 0.7322, test_loss: 0.9580, test_f1: 0.5806
 epoch: 88, train_loss: 0.7377, test_loss: 0.9659, test_f1: 0.5862
 epoch: 89, train_loss: 0.7325, test_loss: 0.9638, test_f1: 0.5975
 epoch: 90, train_loss: 0.7294, test_loss: 0.9726, test_f1: 0.5817
 epoch: 91, train_loss: 0.7282, test_loss: 0.9703, test_f1: 0.5708
 epoch: 92, train_loss: 0.7252, test_loss: 0.9666, test_f1: 0.5707
 epoch: 93, train_loss: 0.7210, test_loss: 0.9732, test_f1: 0.5744
 epoch: 94, train_loss: 0.7215, test_loss: 0.9667, test_f1: 0.5827
 epoch: 95, train_loss: 0.7218, test_loss: 0.9781, test_f1: 0.5936
 epoch: 96, train_loss: 0.7200, test_loss: 0.9553, test_f1: 0.5732
 epoch: 97, train_loss: 0.7209, test_loss: 0.9775, test_f1: 0.5860
 epoch: 98, train_loss: 0.7258, test_loss: 0.9819, test_f1: 0.5740
 epoch: 99, train_loss: 0.7127, test_loss: 0.9625, test_f1: 0.5817
##################ITERATION #7 ****************************************
 epoch: 0, train_loss: 1.2936, test_loss: 1.1275, test_f1: 0.4192
 epoch: 1, train_loss: 1.1652, test_loss: 1.0801, test_f1: 0.4292
 epoch: 2, train_loss: 1.1421, test_loss: 1.0495, test_f1: 0.4434
 epoch: 3, train_loss: 1.1056, test_loss: 1.0179, test_f1: 0.4593
 epoch: 4, train_loss: 1.0839, test_loss: 1.0045, test_f1: 0.5062
 epoch: 5, train_loss: 1.0541, test_loss: 0.9913, test_f1: 0.4789
 epoch: 6, train_loss: 1.0418, test_loss: 0.9846, test_f1: 0.4883
 epoch: 7, train_loss: 1.0311, test_loss: 0.9806, test_f1: 0.4835
 epoch: 8, train_loss: 1.0049, test_loss: 0.9734, test_f1: 0.5011
 epoch: 9, train_loss: 1.0034, test_loss: 0.9721, test_f1: 0.4690
 epoch: 10, train_loss: 0.9903, test_loss: 0.9586, test_f1: 0.4949
 epoch: 11, train_loss: 0.9702, test_loss: 0.9647, test_f1: 0.4735
 epoch: 12, train_loss: 0.9700, test_loss: 0.9368, test_f1: 0.5033
 epoch: 13, train_loss: 0.9628, test_loss: 0.9481, test_f1: 0.5039
 epoch: 14, train_loss: 0.9485, test_loss: 0.9236, test_f1: 0.5029
 epoch: 15, train_loss: 0.9458, test_loss: 0.9597, test_f1: 0.4823
 epoch: 16, train_loss: 0.9240, test_loss: 0.9398, test_f1: 0.4994
 epoch: 17, train_loss: 0.9290, test_loss: 0.9422, test_f1: 0.5112
 epoch: 18, train_loss: 0.9173, test_loss: 0.9334, test_f1: 0.5117
 epoch: 19, train_loss: 0.9208, test_loss: 0.9388, test_f1: 0.5198
 epoch: 20, train_loss: 0.9120, test_loss: 0.9694, test_f1: 0.4831
 epoch: 21, train_loss: 0.9073, test_loss: 0.9528, test_f1: 0.5346
 epoch: 22, train_loss: 0.8948, test_loss: 0.9584, test_f1: 0.5003
 epoch: 23, train_loss: 0.9054, test_loss: 0.9649, test_f1: 0.5321
 epoch: 24, train_loss: 0.8936, test_loss: 0.9427, test_f1: 0.5353
 epoch: 25, train_loss: 0.8815, test_loss: 0.9508, test_f1: 0.5371
 epoch: 26, train_loss: 0.8799, test_loss: 0.9602, test_f1: 0.5178
 epoch: 27, train_loss: 0.8649, test_loss: 0.9657, test_f1: 0.5469
 epoch: 28, train_loss: 0.8721, test_loss: 0.9683, test_f1: 0.5242
 epoch: 29, train_loss: 0.8749, test_loss: 0.9477, test_f1: 0.5328
 epoch: 30, train_loss: 0.8654, test_loss: 0.9721, test_f1: 0.5445
 epoch: 31, train_loss: 0.8636, test_loss: 0.9674, test_f1: 0.5492
 epoch: 32, train_loss: 0.8551, test_loss: 0.9611, test_f1: 0.5350
 epoch: 33, train_loss: 0.8623, test_loss: 0.9506, test_f1: 0.5381
 epoch: 34, train_loss: 0.8471, test_loss: 0.9643, test_f1: 0.5402
 epoch: 35, train_loss: 0.8468, test_loss: 0.9492, test_f1: 0.5394
 epoch: 36, train_loss: 0.8421, test_loss: 0.9390, test_f1: 0.5388
 epoch: 37, train_loss: 0.8513, test_loss: 0.9432, test_f1: 0.5521
 epoch: 38, train_loss: 0.8358, test_loss: 0.9327, test_f1: 0.5420
 epoch: 39, train_loss: 0.8362, test_loss: 0.9590, test_f1: 0.5437
 epoch: 40, train_loss: 0.8257, test_loss: 0.9642, test_f1: 0.5352
 epoch: 41, train_loss: 0.8384, test_loss: 0.9372, test_f1: 0.5307
 epoch: 42, train_loss: 0.8246, test_loss: 0.9199, test_f1: 0.5702
 epoch: 43, train_loss: 0.8166, test_loss: 0.9398, test_f1: 0.5789
 epoch: 44, train_loss: 0.8268, test_loss: 0.9738, test_f1: 0.5559
 epoch: 45, train_loss: 0.8100, test_loss: 0.9394, test_f1: 0.5502
 epoch: 46, train_loss: 0.8064, test_loss: 0.9473, test_f1: 0.5703
 epoch: 47, train_loss: 0.8086, test_loss: 0.9710, test_f1: 0.5669
 epoch: 48, train_loss: 0.7978, test_loss: 0.9348, test_f1: 0.5644
 epoch: 49, train_loss: 0.7993, test_loss: 0.9500, test_f1: 0.5767
 epoch: 50, train_loss: 0.8018, test_loss: 0.9463, test_f1: 0.5709
 epoch: 51, train_loss: 0.7847, test_loss: 0.9455, test_f1: 0.5587
 epoch: 52, train_loss: 0.7972, test_loss: 0.9439, test_f1: 0.5824
 epoch: 53, train_loss: 0.7878, test_loss: 0.9480, test_f1: 0.5703
 epoch: 54, train_loss: 0.7787, test_loss: 0.9491, test_f1: 0.5752
 epoch: 55, train_loss: 0.7851, test_loss: 0.9356, test_f1: 0.5874
 epoch: 56, train_loss: 0.7752, test_loss: 0.9457, test_f1: 0.5719
 epoch: 57, train_loss: 0.7641, test_loss: 0.9497, test_f1: 0.5776
 epoch: 58, train_loss: 0.7676, test_loss: 0.9390, test_f1: 0.5841
 epoch: 59, train_loss: 0.7700, test_loss: 0.9509, test_f1: 0.5755
 epoch: 60, train_loss: 0.7678, test_loss: 0.9373, test_f1: 0.5755
 epoch: 61, train_loss: 0.7773, test_loss: 0.9216, test_f1: 0.5884
 epoch: 62, train_loss: 0.7660, test_loss: 0.9434, test_f1: 0.5745
 epoch: 63, train_loss: 0.7673, test_loss: 0.9486, test_f1: 0.5967
 epoch: 64, train_loss: 0.7667, test_loss: 0.9501, test_f1: 0.5661
 epoch: 65, train_loss: 0.7686, test_loss: 0.9521, test_f1: 0.5780
 epoch: 66, train_loss: 0.7662, test_loss: 0.9584, test_f1: 0.5782
 epoch: 67, train_loss: 0.7614, test_loss: 0.9415, test_f1: 0.5924
 epoch: 68, train_loss: 0.7533, test_loss: 0.9555, test_f1: 0.5881
 epoch: 69, train_loss: 0.7483, test_loss: 0.9363, test_f1: 0.5836
 epoch: 70, train_loss: 0.7521, test_loss: 0.9442, test_f1: 0.5960
 epoch: 71, train_loss: 0.7630, test_loss: 0.9511, test_f1: 0.6061
 epoch: 72, train_loss: 0.7576, test_loss: 0.9600, test_f1: 0.5857
 epoch: 73, train_loss: 0.7465, test_loss: 0.9215, test_f1: 0.5777
 epoch: 74, train_loss: 0.7556, test_loss: 0.9357, test_f1: 0.5781
 epoch: 75, train_loss: 0.7449, test_loss: 0.9577, test_f1: 0.5756
 epoch: 76, train_loss: 0.7519, test_loss: 0.9150, test_f1: 0.5915
 epoch: 77, train_loss: 0.7488, test_loss: 0.9340, test_f1: 0.5970
 epoch: 78, train_loss: 0.7468, test_loss: 0.9290, test_f1: 0.5907
 epoch: 79, train_loss: 0.7454, test_loss: 0.9567, test_f1: 0.5800
 epoch: 80, train_loss: 0.7347, test_loss: 0.9567, test_f1: 0.5896
 epoch: 81, train_loss: 0.7386, test_loss: 0.9502, test_f1: 0.5869
 epoch: 82, train_loss: 0.7258, test_loss: 0.9316, test_f1: 0.6013
 epoch: 83, train_loss: 0.7395, test_loss: 0.9612, test_f1: 0.5713
 epoch: 84, train_loss: 0.7344, test_loss: 0.9500, test_f1: 0.5817
 epoch: 85, train_loss: 0.7345, test_loss: 0.9358, test_f1: 0.6036
 epoch: 86, train_loss: 0.7437, test_loss: 0.9551, test_f1: 0.5710
 epoch: 87, train_loss: 0.7263, test_loss: 0.9558, test_f1: 0.5918
 epoch: 88, train_loss: 0.7204, test_loss: 0.9550, test_f1: 0.5986
 epoch: 89, train_loss: 0.7331, test_loss: 0.9438, test_f1: 0.6114
 epoch: 90, train_loss: 0.7173, test_loss: 0.9658, test_f1: 0.5601
 epoch: 91, train_loss: 0.7377, test_loss: 0.9303, test_f1: 0.5856
 epoch: 92, train_loss: 0.7224, test_loss: 0.9488, test_f1: 0.5949
 epoch: 93, train_loss: 0.7239, test_loss: 0.9606, test_f1: 0.5826
 epoch: 94, train_loss: 0.7089, test_loss: 0.9328, test_f1: 0.6219
 epoch: 95, train_loss: 0.7211, test_loss: 0.9502, test_f1: 0.5867
 epoch: 96, train_loss: 0.7177, test_loss: 0.9442, test_f1: 0.6070
 epoch: 97, train_loss: 0.7310, test_loss: 0.9515, test_f1: 0.5970
 epoch: 98, train_loss: 0.7160, test_loss: 0.9571, test_f1: 0.6151
 epoch: 99, train_loss: 0.7176, test_loss: 0.9504, test_f1: 0.5811
##################ITERATION #8 ****************************************
 epoch: 0, train_loss: 1.3023, test_loss: 1.1395, test_f1: 0.3504
 epoch: 1, train_loss: 1.1672, test_loss: 1.0980, test_f1: 0.4291
 epoch: 2, train_loss: 1.1273, test_loss: 1.0438, test_f1: 0.4417
 epoch: 3, train_loss: 1.0925, test_loss: 1.0410, test_f1: 0.4544
 epoch: 4, train_loss: 1.0775, test_loss: 1.0119, test_f1: 0.4601
 epoch: 5, train_loss: 1.0552, test_loss: 1.0011, test_f1: 0.4769
 epoch: 6, train_loss: 1.0341, test_loss: 0.9630, test_f1: 0.4996
 epoch: 7, train_loss: 1.0169, test_loss: 0.9588, test_f1: 0.4871
 epoch: 8, train_loss: 1.0110, test_loss: 0.9663, test_f1: 0.4928
 epoch: 9, train_loss: 0.9942, test_loss: 0.9530, test_f1: 0.5260
 epoch: 10, train_loss: 0.9752, test_loss: 0.9339, test_f1: 0.5004
 epoch: 11, train_loss: 0.9758, test_loss: 0.9550, test_f1: 0.4750
 epoch: 12, train_loss: 0.9662, test_loss: 0.9318, test_f1: 0.4765
 epoch: 13, train_loss: 0.9488, test_loss: 0.9539, test_f1: 0.5175
 epoch: 14, train_loss: 0.9579, test_loss: 0.9439, test_f1: 0.4982
 epoch: 15, train_loss: 0.9392, test_loss: 0.9366, test_f1: 0.5060
 epoch: 16, train_loss: 0.9331, test_loss: 0.9468, test_f1: 0.5040
 epoch: 17, train_loss: 0.9215, test_loss: 0.9128, test_f1: 0.5357
 epoch: 18, train_loss: 0.9272, test_loss: 0.9408, test_f1: 0.5092
 epoch: 19, train_loss: 0.9168, test_loss: 0.9280, test_f1: 0.5318
 epoch: 20, train_loss: 0.9124, test_loss: 0.9388, test_f1: 0.5014
 epoch: 21, train_loss: 0.8992, test_loss: 0.9253, test_f1: 0.5299
 epoch: 22, train_loss: 0.8994, test_loss: 0.9219, test_f1: 0.5075
 epoch: 23, train_loss: 0.8941, test_loss: 0.9331, test_f1: 0.5211
 epoch: 24, train_loss: 0.8885, test_loss: 0.9320, test_f1: 0.5539
 epoch: 25, train_loss: 0.8829, test_loss: 0.9452, test_f1: 0.5491
 epoch: 26, train_loss: 0.8673, test_loss: 0.9313, test_f1: 0.5474
 epoch: 27, train_loss: 0.8731, test_loss: 0.9336, test_f1: 0.5443
 epoch: 28, train_loss: 0.8661, test_loss: 0.9150, test_f1: 0.5518
 epoch: 29, train_loss: 0.8705, test_loss: 0.9287, test_f1: 0.5332
 epoch: 30, train_loss: 0.8609, test_loss: 0.9372, test_f1: 0.5378
 epoch: 31, train_loss: 0.8559, test_loss: 0.9164, test_f1: 0.5524
 epoch: 32, train_loss: 0.8554, test_loss: 0.9376, test_f1: 0.5550
 epoch: 33, train_loss: 0.8482, test_loss: 0.9260, test_f1: 0.5713
 epoch: 34, train_loss: 0.8529, test_loss: 0.9142, test_f1: 0.5685
 epoch: 35, train_loss: 0.8463, test_loss: 0.9326, test_f1: 0.5555
 epoch: 36, train_loss: 0.8478, test_loss: 0.9531, test_f1: 0.5348
 epoch: 37, train_loss: 0.8420, test_loss: 0.9147, test_f1: 0.5652
 epoch: 38, train_loss: 0.8302, test_loss: 0.9283, test_f1: 0.5563
 epoch: 39, train_loss: 0.8202, test_loss: 0.9253, test_f1: 0.5527
 epoch: 40, train_loss: 0.8277, test_loss: 0.9477, test_f1: 0.5581
 epoch: 41, train_loss: 0.8278, test_loss: 0.9351, test_f1: 0.5677
 epoch: 42, train_loss: 0.8175, test_loss: 0.9418, test_f1: 0.5412
 epoch: 43, train_loss: 0.8236, test_loss: 0.9413, test_f1: 0.5503
 epoch: 44, train_loss: 0.8088, test_loss: 0.9373, test_f1: 0.5584
 epoch: 45, train_loss: 0.8165, test_loss: 0.9312, test_f1: 0.5509
 epoch: 46, train_loss: 0.8259, test_loss: 0.9348, test_f1: 0.5519
 epoch: 47, train_loss: 0.8102, test_loss: 0.9429, test_f1: 0.5731
 epoch: 48, train_loss: 0.8130, test_loss: 0.9484, test_f1: 0.5623
 epoch: 49, train_loss: 0.8112, test_loss: 0.9380, test_f1: 0.5597
 epoch: 50, train_loss: 0.8015, test_loss: 0.9408, test_f1: 0.5546
 epoch: 51, train_loss: 0.8008, test_loss: 0.9243, test_f1: 0.5658
 epoch: 52, train_loss: 0.7846, test_loss: 0.9516, test_f1: 0.5554
 epoch: 53, train_loss: 0.7826, test_loss: 0.9307, test_f1: 0.5764
 epoch: 54, train_loss: 0.7798, test_loss: 0.9412, test_f1: 0.5555
 epoch: 55, train_loss: 0.7865, test_loss: 0.9205, test_f1: 0.5863
 epoch: 56, train_loss: 0.7838, test_loss: 0.9295, test_f1: 0.5802
 epoch: 57, train_loss: 0.7831, test_loss: 0.9252, test_f1: 0.5787
 epoch: 58, train_loss: 0.7739, test_loss: 0.9323, test_f1: 0.5756
 epoch: 59, train_loss: 0.7790, test_loss: 0.9463, test_f1: 0.5609
 epoch: 60, train_loss: 0.7775, test_loss: 0.9249, test_f1: 0.5688
 epoch: 61, train_loss: 0.7703, test_loss: 0.9257, test_f1: 0.5683
 epoch: 62, train_loss: 0.7753, test_loss: 0.9335, test_f1: 0.5710
 epoch: 63, train_loss: 0.7825, test_loss: 0.9302, test_f1: 0.5733
 epoch: 64, train_loss: 0.7679, test_loss: 0.9390, test_f1: 0.5594
 epoch: 65, train_loss: 0.7672, test_loss: 0.9367, test_f1: 0.5598
 epoch: 66, train_loss: 0.7713, test_loss: 0.9417, test_f1: 0.5536
 epoch: 67, train_loss: 0.7707, test_loss: 0.9362, test_f1: 0.5706
 epoch: 68, train_loss: 0.7570, test_loss: 0.9433, test_f1: 0.5833
 epoch: 69, train_loss: 0.7642, test_loss: 0.9391, test_f1: 0.5806
 epoch: 70, train_loss: 0.7664, test_loss: 0.9345, test_f1: 0.5722
 epoch: 71, train_loss: 0.7571, test_loss: 0.9370, test_f1: 0.5754
 epoch: 72, train_loss: 0.7560, test_loss: 0.9370, test_f1: 0.5705
 epoch: 73, train_loss: 0.7516, test_loss: 0.9612, test_f1: 0.5523
 epoch: 74, train_loss: 0.7438, test_loss: 0.9400, test_f1: 0.5729
 epoch: 75, train_loss: 0.7552, test_loss: 0.9434, test_f1: 0.5634
 epoch: 76, train_loss: 0.7581, test_loss: 0.9462, test_f1: 0.5876
 epoch: 77, train_loss: 0.7536, test_loss: 0.9395, test_f1: 0.5922
 epoch: 78, train_loss: 0.7495, test_loss: 0.9447, test_f1: 0.5852
 epoch: 79, train_loss: 0.7491, test_loss: 0.9506, test_f1: 0.5719
 epoch: 80, train_loss: 0.7515, test_loss: 0.9381, test_f1: 0.5738
 epoch: 81, train_loss: 0.7413, test_loss: 0.9452, test_f1: 0.5783
 epoch: 82, train_loss: 0.7460, test_loss: 0.9610, test_f1: 0.5619
 epoch: 83, train_loss: 0.7406, test_loss: 0.9603, test_f1: 0.5763
 epoch: 84, train_loss: 0.7447, test_loss: 0.9212, test_f1: 0.5855
 epoch: 85, train_loss: 0.7351, test_loss: 0.9446, test_f1: 0.5720
 epoch: 86, train_loss: 0.7467, test_loss: 0.9419, test_f1: 0.5679
 epoch: 87, train_loss: 0.7496, test_loss: 0.9506, test_f1: 0.5752
 epoch: 88, train_loss: 0.7372, test_loss: 0.9360, test_f1: 0.5849
 epoch: 89, train_loss: 0.7490, test_loss: 0.9579, test_f1: 0.5803
 epoch: 90, train_loss: 0.7343, test_loss: 0.9533, test_f1: 0.5865
 epoch: 91, train_loss: 0.7351, test_loss: 0.9549, test_f1: 0.5801
 epoch: 92, train_loss: 0.7269, test_loss: 0.9338, test_f1: 0.5881
 epoch: 93, train_loss: 0.7235, test_loss: 0.9361, test_f1: 0.5730
 epoch: 94, train_loss: 0.7243, test_loss: 0.9283, test_f1: 0.5876
 epoch: 95, train_loss: 0.7343, test_loss: 0.9495, test_f1: 0.5744
 epoch: 96, train_loss: 0.7243, test_loss: 0.9486, test_f1: 0.5941
 epoch: 97, train_loss: 0.7328, test_loss: 0.9401, test_f1: 0.5906
 epoch: 98, train_loss: 0.7274, test_loss: 0.9396, test_f1: 0.5765
 epoch: 99, train_loss: 0.7297, test_loss: 0.9482, test_f1: 0.5854
##################ITERATION #9 ****************************************
 epoch: 0, train_loss: 1.2726, test_loss: 1.1128, test_f1: 0.4212
 epoch: 1, train_loss: 1.1457, test_loss: 1.0616, test_f1: 0.4351
 epoch: 2, train_loss: 1.1175, test_loss: 1.0302, test_f1: 0.4741
 epoch: 3, train_loss: 1.1116, test_loss: 1.0153, test_f1: 0.4653
 epoch: 4, train_loss: 1.0861, test_loss: 1.0228, test_f1: 0.4577
 epoch: 5, train_loss: 1.0503, test_loss: 0.9768, test_f1: 0.4880
 epoch: 6, train_loss: 1.0354, test_loss: 0.9940, test_f1: 0.4609
 epoch: 7, train_loss: 1.0099, test_loss: 0.9685, test_f1: 0.4875
 epoch: 8, train_loss: 0.9989, test_loss: 0.9528, test_f1: 0.4925
 epoch: 9, train_loss: 0.9942, test_loss: 0.9846, test_f1: 0.4785
 epoch: 10, train_loss: 0.9775, test_loss: 0.9627, test_f1: 0.5038
 epoch: 11, train_loss: 0.9789, test_loss: 0.9372, test_f1: 0.5179
 epoch: 12, train_loss: 0.9683, test_loss: 0.9191, test_f1: 0.4903
 epoch: 13, train_loss: 0.9524, test_loss: 0.9361, test_f1: 0.5195
 epoch: 14, train_loss: 0.9445, test_loss: 0.9238, test_f1: 0.5283
 epoch: 15, train_loss: 0.9401, test_loss: 0.9115, test_f1: 0.5371
 epoch: 16, train_loss: 0.9310, test_loss: 0.9109, test_f1: 0.5075
 epoch: 17, train_loss: 0.9290, test_loss: 0.9214, test_f1: 0.5043
 epoch: 18, train_loss: 0.9250, test_loss: 0.9111, test_f1: 0.5181
 epoch: 19, train_loss: 0.9066, test_loss: 0.9162, test_f1: 0.5565
 epoch: 20, train_loss: 0.9056, test_loss: 0.9176, test_f1: 0.5619
 epoch: 21, train_loss: 0.9074, test_loss: 0.9385, test_f1: 0.5479
 epoch: 22, train_loss: 0.9015, test_loss: 0.9207, test_f1: 0.5175
 epoch: 23, train_loss: 0.9040, test_loss: 0.9217, test_f1: 0.5328
 epoch: 24, train_loss: 0.8964, test_loss: 0.9197, test_f1: 0.5394
 epoch: 25, train_loss: 0.8782, test_loss: 0.9054, test_f1: 0.5363
 epoch: 26, train_loss: 0.8865, test_loss: 0.9077, test_f1: 0.5442
 epoch: 27, train_loss: 0.8791, test_loss: 0.9160, test_f1: 0.5297
 epoch: 28, train_loss: 0.8783, test_loss: 0.8994, test_f1: 0.5300
 epoch: 29, train_loss: 0.8574, test_loss: 0.9217, test_f1: 0.5376
 epoch: 30, train_loss: 0.8599, test_loss: 0.8695, test_f1: 0.5497
 epoch: 31, train_loss: 0.8622, test_loss: 0.9083, test_f1: 0.5515
 epoch: 32, train_loss: 0.8678, test_loss: 0.9050, test_f1: 0.5649
 epoch: 33, train_loss: 0.8553, test_loss: 0.9187, test_f1: 0.5332
 epoch: 34, train_loss: 0.8564, test_loss: 0.9247, test_f1: 0.5708
 epoch: 35, train_loss: 0.8518, test_loss: 0.8974, test_f1: 0.5671
 epoch: 36, train_loss: 0.8531, test_loss: 0.9198, test_f1: 0.5397
 epoch: 37, train_loss: 0.8428, test_loss: 0.9121, test_f1: 0.5647
 epoch: 38, train_loss: 0.8272, test_loss: 0.9308, test_f1: 0.5481
 epoch: 39, train_loss: 0.8452, test_loss: 0.9185, test_f1: 0.5637
 epoch: 40, train_loss: 0.8321, test_loss: 0.9206, test_f1: 0.5314
 epoch: 41, train_loss: 0.8308, test_loss: 0.8795, test_f1: 0.5354
 epoch: 42, train_loss: 0.8276, test_loss: 0.9192, test_f1: 0.5619
 epoch: 43, train_loss: 0.8289, test_loss: 0.8998, test_f1: 0.5461
 epoch: 44, train_loss: 0.8213, test_loss: 0.8831, test_f1: 0.5604
 epoch: 45, train_loss: 0.8176, test_loss: 0.8775, test_f1: 0.5431
 epoch: 46, train_loss: 0.8187, test_loss: 0.9156, test_f1: 0.5547
 epoch: 47, train_loss: 0.8080, test_loss: 0.8937, test_f1: 0.5557
 epoch: 48, train_loss: 0.8111, test_loss: 0.9083, test_f1: 0.5545
 epoch: 49, train_loss: 0.7969, test_loss: 0.9148, test_f1: 0.5504
 epoch: 50, train_loss: 0.7948, test_loss: 0.9099, test_f1: 0.5559
 epoch: 51, train_loss: 0.7883, test_loss: 0.9037, test_f1: 0.5553
 epoch: 52, train_loss: 0.7967, test_loss: 0.9135, test_f1: 0.5684
 epoch: 53, train_loss: 0.7846, test_loss: 0.9129, test_f1: 0.5558
 epoch: 54, train_loss: 0.7920, test_loss: 0.9281, test_f1: 0.5600
 epoch: 55, train_loss: 0.7863, test_loss: 0.9192, test_f1: 0.5656
 epoch: 56, train_loss: 0.7899, test_loss: 0.9070, test_f1: 0.5642
 epoch: 57, train_loss: 0.7833, test_loss: 0.9101, test_f1: 0.5579
 epoch: 58, train_loss: 0.7809, test_loss: 0.9235, test_f1: 0.5671
 epoch: 59, train_loss: 0.7802, test_loss: 0.9082, test_f1: 0.5849
 epoch: 60, train_loss: 0.7675, test_loss: 0.9209, test_f1: 0.5817
 epoch: 61, train_loss: 0.7818, test_loss: 0.9139, test_f1: 0.5784
 epoch: 62, train_loss: 0.7674, test_loss: 0.9155, test_f1: 0.5722
 epoch: 63, train_loss: 0.7664, test_loss: 0.9261, test_f1: 0.5731
 epoch: 64, train_loss: 0.7576, test_loss: 0.9344, test_f1: 0.5732
 epoch: 65, train_loss: 0.7751, test_loss: 0.9270, test_f1: 0.5606
 epoch: 66, train_loss: 0.7738, test_loss: 0.9251, test_f1: 0.5899
 epoch: 67, train_loss: 0.7716, test_loss: 0.9262, test_f1: 0.5787
 epoch: 68, train_loss: 0.7673, test_loss: 0.9154, test_f1: 0.5760
 epoch: 69, train_loss: 0.7592, test_loss: 0.9186, test_f1: 0.5813
 epoch: 70, train_loss: 0.7622, test_loss: 0.9305, test_f1: 0.5817
 epoch: 71, train_loss: 0.7689, test_loss: 0.9270, test_f1: 0.5745
 epoch: 72, train_loss: 0.7485, test_loss: 0.9134, test_f1: 0.5798
 epoch: 73, train_loss: 0.7591, test_loss: 0.9038, test_f1: 0.5879
 epoch: 74, train_loss: 0.7457, test_loss: 0.9075, test_f1: 0.5950
 epoch: 75, train_loss: 0.7594, test_loss: 0.9188, test_f1: 0.5947
 epoch: 76, train_loss: 0.7526, test_loss: 0.9228, test_f1: 0.5897
 epoch: 77, train_loss: 0.7457, test_loss: 0.9047, test_f1: 0.5898
 epoch: 78, train_loss: 0.7593, test_loss: 0.9287, test_f1: 0.5973
 epoch: 79, train_loss: 0.7540, test_loss: 0.9288, test_f1: 0.5965
 epoch: 80, train_loss: 0.7517, test_loss: 0.9257, test_f1: 0.5942
 epoch: 81, train_loss: 0.7590, test_loss: 0.9270, test_f1: 0.5786
 epoch: 82, train_loss: 0.7420, test_loss: 0.9307, test_f1: 0.5810
 epoch: 83, train_loss: 0.7528, test_loss: 0.9378, test_f1: 0.5975
 epoch: 84, train_loss: 0.7344, test_loss: 0.9477, test_f1: 0.5847
 epoch: 85, train_loss: 0.7319, test_loss: 0.9255, test_f1: 0.5852
 epoch: 86, train_loss: 0.7359, test_loss: 0.9213, test_f1: 0.5919
 epoch: 87, train_loss: 0.7353, test_loss: 0.9429, test_f1: 0.6059
 epoch: 88, train_loss: 0.7387, test_loss: 0.9150, test_f1: 0.6034
 epoch: 89, train_loss: 0.7294, test_loss: 0.9228, test_f1: 0.5947
 epoch: 90, train_loss: 0.7346, test_loss: 0.9224, test_f1: 0.5961
 epoch: 91, train_loss: 0.7256, test_loss: 0.9448, test_f1: 0.5960
 epoch: 92, train_loss: 0.7382, test_loss: 0.9344, test_f1: 0.6027
 epoch: 93, train_loss: 0.7340, test_loss: 0.9084, test_f1: 0.6044
 epoch: 94, train_loss: 0.7442, test_loss: 0.9212, test_f1: 0.6144
 epoch: 95, train_loss: 0.7323, test_loss: 0.9193, test_f1: 0.5908
 epoch: 96, train_loss: 0.7272, test_loss: 0.9336, test_f1: 0.5914
 epoch: 97, train_loss: 0.7211, test_loss: 0.9505, test_f1: 0.5823
 epoch: 98, train_loss: 0.7256, test_loss: 0.9428, test_f1: 0.6011
 epoch: 99, train_loss: 0.7158, test_loss: 0.9289, test_f1: 0.6029

Training completed in 1272.52 seconds
Best F1: 0.6219 at epoch 94
Mean F1 across iterations: 0.6054  0.0098
========================FINAL RESULTS================================
FEGIN weighted F1: 0.6219  0.0098
python main.py --data ltspice_examples --representation component_net --model FEGIN --layers 5 --hiddens 64 --batch_size 32 --lr 0.0001 --emb_size 250 --epochs 100 --save_appendix component_net_L5_H64_BS32_LR0.0001_E250 --no_val
-----



STDERR:
  File "main.py", line 370, in <module>
    main()
  File "main.py", line 254, in main
    dataset = dataset_class(
  File "/home/philip/projects/ltspice_examples_code_repo/Circuit-Completion-Using-GNNs/component_classification_with_link_prediction_head/evaluation/FEGIN/kernel/circuit_datasets.py", line 15, in __init__
    self.data, self.slices = torch.load(self.processed_paths[0])
  File "/home/philip/.local/lib/python3.8/site-packages/torch/serialization.py", line 1040, in load
    warnings.warn(
  File "/usr/lib/python3.8/warnings.py", line 109, in _showwarnmsg
    sw(msg.message, msg.category, msg.filename, msg.lineno,
  File "main.py", line 47, in warn_with_traceback
    traceback.print_stack(file=log)
/home/philip/projects/ltspice_examples_code_repo/Circuit-Completion-Using-GNNs/component_classification_with_link_prediction_head/evaluation/FEGIN/kernel/circuit_datasets.py:15: FutureWarning: You are using `torch.load` with `weights_only=False` (the current default value), which uses the default pickle module implicitly. It is possible to construct malicious pickle data which will execute arbitrary code during unpickling (See https://github.com/pytorch/pytorch/blob/main/SECURITY.md#untrusted-models for more details). In a future release, the default value for `weights_only` will be flipped to `True`. This limits the functions that could be executed during unpickling. Arbitrary objects will no longer be allowed to be loaded via this mode unless they are explicitly allowlisted by the user via `torch.serialization.add_safe_globals`. We recommend you start setting `weights_only=True` for any use case where you don't have full control of the loaded file. Please open an issue on GitHub for any issues related to this experimental feature.
  self.data, self.slices = torch.load(self.processed_paths[0])
