STDOUT:
Results will be saved in /home/philip/projects/ltspice_examples_code_repo/Circuit-Completion-Using-GNNs/component_classification_with_link_prediction_head/evaluation/FEGIN/results/model_FEGIN_dataset_ltspice_demos
Command line input: python main.py --data ltspice_demos --representation component_component --model FEGIN --layers 5 --hiddens 32 --batch_size 32 --lr 0.0001 --emb_size 512 --epochs 100 --save_appendix component_component_L5_H32_BS32_LR0.0001_E512 --no_val
 is saved.
-----
ltspice_demos - FEGIN
Using 5 layers, 32 hidden units, h = 2
Loading component_component representation dataset
ENTERED
Training FEGIN on component_component representation
Train: 1565, Test: 383
##################ITERATION #0 ****************************************
 epoch: 0, train_loss: 1.3601, test_loss: 1.3601, test_f1: 0.2281
 epoch: 1, train_loss: 1.3496, test_loss: 1.3539, test_f1: 0.2281
 epoch: 2, train_loss: 1.3409, test_loss: 1.3459, test_f1: 0.2281
 epoch: 3, train_loss: 1.3324, test_loss: 1.3401, test_f1: 0.2281
 epoch: 4, train_loss: 1.3219, test_loss: 1.3307, test_f1: 0.2281
 epoch: 5, train_loss: 1.3105, test_loss: 1.3219, test_f1: 0.2281
 epoch: 6, train_loss: 1.2994, test_loss: 1.3111, test_f1: 0.2281
 epoch: 7, train_loss: 1.2857, test_loss: 1.3023, test_f1: 0.2281
 epoch: 8, train_loss: 1.2732, test_loss: 1.2930, test_f1: 0.2281
 epoch: 9, train_loss: 1.2597, test_loss: 1.2845, test_f1: 0.2281
 epoch: 10, train_loss: 1.2459, test_loss: 1.2756, test_f1: 0.2281
 epoch: 11, train_loss: 1.2358, test_loss: 1.2721, test_f1: 0.2281
 epoch: 12, train_loss: 1.2261, test_loss: 1.2650, test_f1: 0.2281
 epoch: 13, train_loss: 1.2147, test_loss: 1.2632, test_f1: 0.2281
 epoch: 14, train_loss: 1.2057, test_loss: 1.2607, test_f1: 0.2281
 epoch: 15, train_loss: 1.2026, test_loss: 1.2553, test_f1: 0.2281
 epoch: 16, train_loss: 1.1899, test_loss: 1.2555, test_f1: 0.2281
 epoch: 17, train_loss: 1.1885, test_loss: 1.2554, test_f1: 0.2449
 epoch: 18, train_loss: 1.1835, test_loss: 1.2560, test_f1: 0.2640
 epoch: 19, train_loss: 1.1845, test_loss: 1.2501, test_f1: 0.3251
 epoch: 20, train_loss: 1.1739, test_loss: 1.2582, test_f1: 0.3351
 epoch: 21, train_loss: 1.1769, test_loss: 1.2459, test_f1: 0.3090
 epoch: 22, train_loss: 1.1747, test_loss: 1.2558, test_f1: 0.3305
 epoch: 23, train_loss: 1.1596, test_loss: 1.2594, test_f1: 0.3350
 epoch: 24, train_loss: 1.1601, test_loss: 1.2588, test_f1: 0.3272
 epoch: 25, train_loss: 1.1590, test_loss: 1.2490, test_f1: 0.3494
 epoch: 26, train_loss: 1.1613, test_loss: 1.2391, test_f1: 0.3301
 epoch: 27, train_loss: 1.1515, test_loss: 1.2427, test_f1: 0.3467
 epoch: 28, train_loss: 1.1475, test_loss: 1.2293, test_f1: 0.3516
 epoch: 29, train_loss: 1.1482, test_loss: 1.2277, test_f1: 0.3477
 epoch: 30, train_loss: 1.1382, test_loss: 1.2261, test_f1: 0.3529
 epoch: 31, train_loss: 1.1404, test_loss: 1.2265, test_f1: 0.3510
 epoch: 32, train_loss: 1.1381, test_loss: 1.2355, test_f1: 0.3516
 epoch: 33, train_loss: 1.1384, test_loss: 1.2287, test_f1: 0.3497
 epoch: 34, train_loss: 1.1271, test_loss: 1.2318, test_f1: 0.3527
 epoch: 35, train_loss: 1.1255, test_loss: 1.2268, test_f1: 0.3469
 epoch: 36, train_loss: 1.1196, test_loss: 1.2251, test_f1: 0.3521
 epoch: 37, train_loss: 1.1119, test_loss: 1.2283, test_f1: 0.3535
 epoch: 38, train_loss: 1.1261, test_loss: 1.2198, test_f1: 0.3504
 epoch: 39, train_loss: 1.1180, test_loss: 1.2234, test_f1: 0.3563
 epoch: 40, train_loss: 1.1151, test_loss: 1.2214, test_f1: 0.3803
 epoch: 41, train_loss: 1.0986, test_loss: 1.2185, test_f1: 0.3928
 epoch: 42, train_loss: 1.1120, test_loss: 1.2270, test_f1: 0.3892
 epoch: 43, train_loss: 1.1005, test_loss: 1.2191, test_f1: 0.4155
 epoch: 44, train_loss: 1.0963, test_loss: 1.2136, test_f1: 0.4115
 epoch: 45, train_loss: 1.0932, test_loss: 1.2236, test_f1: 0.4023
 epoch: 46, train_loss: 1.0990, test_loss: 1.2050, test_f1: 0.4271
 epoch: 47, train_loss: 1.0952, test_loss: 1.2212, test_f1: 0.4145
 epoch: 48, train_loss: 1.0816, test_loss: 1.2094, test_f1: 0.4340
 epoch: 49, train_loss: 1.0876, test_loss: 1.1985, test_f1: 0.4307
 epoch: 50, train_loss: 1.0706, test_loss: 1.2134, test_f1: 0.4273
 epoch: 51, train_loss: 1.0675, test_loss: 1.1968, test_f1: 0.4299
 epoch: 52, train_loss: 1.0803, test_loss: 1.2036, test_f1: 0.4216
 epoch: 53, train_loss: 1.0819, test_loss: 1.1992, test_f1: 0.4159
 epoch: 54, train_loss: 1.0625, test_loss: 1.1957, test_f1: 0.4132
 epoch: 55, train_loss: 1.0655, test_loss: 1.1966, test_f1: 0.4212
 epoch: 56, train_loss: 1.0658, test_loss: 1.1911, test_f1: 0.4244
 epoch: 57, train_loss: 1.0673, test_loss: 1.1881, test_f1: 0.4246
 epoch: 58, train_loss: 1.0620, test_loss: 1.1859, test_f1: 0.4250
 epoch: 59, train_loss: 1.0645, test_loss: 1.1925, test_f1: 0.4208
 epoch: 60, train_loss: 1.0669, test_loss: 1.1963, test_f1: 0.4272
 epoch: 61, train_loss: 1.0548, test_loss: 1.1924, test_f1: 0.4242
 epoch: 62, train_loss: 1.0614, test_loss: 1.1824, test_f1: 0.4297
 epoch: 63, train_loss: 1.0550, test_loss: 1.1968, test_f1: 0.4222
 epoch: 64, train_loss: 1.0578, test_loss: 1.1982, test_f1: 0.4284
 epoch: 65, train_loss: 1.0374, test_loss: 1.1974, test_f1: 0.4334
 epoch: 66, train_loss: 1.0603, test_loss: 1.2002, test_f1: 0.4429
 epoch: 67, train_loss: 1.0495, test_loss: 1.2029, test_f1: 0.4390
 epoch: 68, train_loss: 1.0460, test_loss: 1.1871, test_f1: 0.4414
 epoch: 69, train_loss: 1.0488, test_loss: 1.1843, test_f1: 0.4449
 epoch: 70, train_loss: 1.0376, test_loss: 1.1846, test_f1: 0.4593
 epoch: 71, train_loss: 1.0314, test_loss: 1.2042, test_f1: 0.4592
 epoch: 72, train_loss: 1.0462, test_loss: 1.1923, test_f1: 0.4524
 epoch: 73, train_loss: 1.0396, test_loss: 1.1784, test_f1: 0.4542
 epoch: 74, train_loss: 1.0399, test_loss: 1.1682, test_f1: 0.4692
 epoch: 75, train_loss: 1.0306, test_loss: 1.1857, test_f1: 0.4797
 epoch: 76, train_loss: 1.0283, test_loss: 1.1732, test_f1: 0.4760
 epoch: 77, train_loss: 1.0271, test_loss: 1.1763, test_f1: 0.4907
 epoch: 78, train_loss: 1.0339, test_loss: 1.1820, test_f1: 0.4856
 epoch: 79, train_loss: 1.0238, test_loss: 1.1675, test_f1: 0.4947
 epoch: 80, train_loss: 1.0280, test_loss: 1.1730, test_f1: 0.4970
 epoch: 81, train_loss: 1.0302, test_loss: 1.1618, test_f1: 0.5008
 epoch: 82, train_loss: 1.0230, test_loss: 1.1607, test_f1: 0.4937
 epoch: 83, train_loss: 1.0370, test_loss: 1.1665, test_f1: 0.4905
 epoch: 84, train_loss: 1.0193, test_loss: 1.1757, test_f1: 0.5027
 epoch: 85, train_loss: 1.0165, test_loss: 1.1828, test_f1: 0.5083
 epoch: 86, train_loss: 1.0260, test_loss: 1.1700, test_f1: 0.5093
 epoch: 87, train_loss: 1.0258, test_loss: 1.1775, test_f1: 0.5090
 epoch: 88, train_loss: 1.0126, test_loss: 1.1687, test_f1: 0.5240
 epoch: 89, train_loss: 1.0110, test_loss: 1.1900, test_f1: 0.5170
 epoch: 90, train_loss: 1.0013, test_loss: 1.1776, test_f1: 0.5263
 epoch: 91, train_loss: 1.0000, test_loss: 1.1803, test_f1: 0.5240
 epoch: 92, train_loss: 1.0043, test_loss: 1.1667, test_f1: 0.5125
 epoch: 93, train_loss: 0.9964, test_loss: 1.1809, test_f1: 0.5251
 epoch: 94, train_loss: 1.0067, test_loss: 1.1793, test_f1: 0.5331
 epoch: 95, train_loss: 0.9988, test_loss: 1.1618, test_f1: 0.5287
 epoch: 96, train_loss: 1.0001, test_loss: 1.1643, test_f1: 0.5252
 epoch: 97, train_loss: 0.9961, test_loss: 1.1649, test_f1: 0.5253
 epoch: 98, train_loss: 1.0062, test_loss: 1.1762, test_f1: 0.5367
 epoch: 99, train_loss: 0.9921, test_loss: 1.1724, test_f1: 0.5249
##################ITERATION #1 ****************************************
 epoch: 0, train_loss: 1.3191, test_loss: 1.3769, test_f1: 0.2281
 epoch: 1, train_loss: 1.2938, test_loss: 1.4134, test_f1: 0.2281
 epoch: 2, train_loss: 1.2781, test_loss: 1.3779, test_f1: 0.2281
 epoch: 3, train_loss: 1.2600, test_loss: 1.3572, test_f1: 0.2281
 epoch: 4, train_loss: 1.2478, test_loss: 1.3555, test_f1: 0.2281
 epoch: 5, train_loss: 1.2336, test_loss: 1.3400, test_f1: 0.2281
 epoch: 6, train_loss: 1.2231, test_loss: 1.3129, test_f1: 0.2281
 epoch: 7, train_loss: 1.2199, test_loss: 1.3214, test_f1: 0.2281
 epoch: 8, train_loss: 1.2123, test_loss: 1.3173, test_f1: 0.2281
 epoch: 9, train_loss: 1.2093, test_loss: 1.3178, test_f1: 0.2281
 epoch: 10, train_loss: 1.2030, test_loss: 1.3083, test_f1: 0.2281
 epoch: 11, train_loss: 1.1973, test_loss: 1.2939, test_f1: 0.2281
 epoch: 12, train_loss: 1.1845, test_loss: 1.2895, test_f1: 0.2514
 epoch: 13, train_loss: 1.1821, test_loss: 1.2745, test_f1: 0.2577
 epoch: 14, train_loss: 1.1802, test_loss: 1.2762, test_f1: 0.2314
 epoch: 15, train_loss: 1.1814, test_loss: 1.2887, test_f1: 0.2314
 epoch: 16, train_loss: 1.1768, test_loss: 1.2683, test_f1: 0.2303
 epoch: 17, train_loss: 1.1757, test_loss: 1.2520, test_f1: 0.2359
 epoch: 18, train_loss: 1.1703, test_loss: 1.2542, test_f1: 0.2464
 epoch: 19, train_loss: 1.1717, test_loss: 1.2414, test_f1: 0.2464
 epoch: 20, train_loss: 1.1574, test_loss: 1.2637, test_f1: 0.2557
 epoch: 21, train_loss: 1.1482, test_loss: 1.2428, test_f1: 0.2582
 epoch: 22, train_loss: 1.1585, test_loss: 1.2464, test_f1: 0.2857
 epoch: 23, train_loss: 1.1479, test_loss: 1.2493, test_f1: 0.2880
 epoch: 24, train_loss: 1.1500, test_loss: 1.2544, test_f1: 0.2943
 epoch: 25, train_loss: 1.1412, test_loss: 1.2406, test_f1: 0.2849
 epoch: 26, train_loss: 1.1498, test_loss: 1.2666, test_f1: 0.3233
 epoch: 27, train_loss: 1.1296, test_loss: 1.2409, test_f1: 0.3099
 epoch: 28, train_loss: 1.1307, test_loss: 1.2160, test_f1: 0.3116
 epoch: 29, train_loss: 1.1324, test_loss: 1.2341, test_f1: 0.3116
 epoch: 30, train_loss: 1.1311, test_loss: 1.2274, test_f1: 0.3079
 epoch: 31, train_loss: 1.1213, test_loss: 1.2347, test_f1: 0.3189
 epoch: 32, train_loss: 1.1219, test_loss: 1.2137, test_f1: 0.3249
 epoch: 33, train_loss: 1.1172, test_loss: 1.2200, test_f1: 0.3299
 epoch: 34, train_loss: 1.1220, test_loss: 1.2205, test_f1: 0.3201
 epoch: 35, train_loss: 1.1075, test_loss: 1.2184, test_f1: 0.3376
 epoch: 36, train_loss: 1.1045, test_loss: 1.2170, test_f1: 0.3155
 epoch: 37, train_loss: 1.0970, test_loss: 1.2250, test_f1: 0.3598
 epoch: 38, train_loss: 1.0910, test_loss: 1.2444, test_f1: 0.3308
 epoch: 39, train_loss: 1.0895, test_loss: 1.2105, test_f1: 0.3398
 epoch: 40, train_loss: 1.0938, test_loss: 1.2569, test_f1: 0.3338
 epoch: 41, train_loss: 1.0823, test_loss: 1.2506, test_f1: 0.3828
 epoch: 42, train_loss: 1.0805, test_loss: 1.2854, test_f1: 0.3858
 epoch: 43, train_loss: 1.0776, test_loss: 1.2695, test_f1: 0.3816
 epoch: 44, train_loss: 1.0719, test_loss: 1.3263, test_f1: 0.3882
 epoch: 45, train_loss: 1.0660, test_loss: 1.2687, test_f1: 0.4140
 epoch: 46, train_loss: 1.0616, test_loss: 1.2461, test_f1: 0.3774
 epoch: 47, train_loss: 1.0776, test_loss: 1.2911, test_f1: 0.3731
 epoch: 48, train_loss: 1.0587, test_loss: 1.2997, test_f1: 0.3801
 epoch: 49, train_loss: 1.0487, test_loss: 1.2690, test_f1: 0.4372
 epoch: 50, train_loss: 1.0488, test_loss: 1.3282, test_f1: 0.4103
 epoch: 51, train_loss: 1.0373, test_loss: 1.2657, test_f1: 0.4032
 epoch: 52, train_loss: 1.0395, test_loss: 1.2853, test_f1: 0.4121
 epoch: 53, train_loss: 1.0489, test_loss: 1.2723, test_f1: 0.4117
 epoch: 54, train_loss: 1.0524, test_loss: 1.3297, test_f1: 0.4029
 epoch: 55, train_loss: 1.0472, test_loss: 1.3223, test_f1: 0.4070
 epoch: 56, train_loss: 1.0419, test_loss: 1.3217, test_f1: 0.4111
 epoch: 57, train_loss: 1.0361, test_loss: 1.3763, test_f1: 0.4030
 epoch: 58, train_loss: 1.0371, test_loss: 1.3354, test_f1: 0.4350
 epoch: 59, train_loss: 1.0391, test_loss: 1.4290, test_f1: 0.4098
 epoch: 60, train_loss: 1.0330, test_loss: 1.3768, test_f1: 0.3985
 epoch: 61, train_loss: 1.0402, test_loss: 1.2665, test_f1: 0.4061
 epoch: 62, train_loss: 1.0187, test_loss: 1.4090, test_f1: 0.4139
 epoch: 63, train_loss: 1.0236, test_loss: 1.3781, test_f1: 0.4419
 epoch: 64, train_loss: 1.0336, test_loss: 1.4991, test_f1: 0.4320
 epoch: 65, train_loss: 1.0300, test_loss: 1.3371, test_f1: 0.4326
 epoch: 66, train_loss: 1.0147, test_loss: 1.3783, test_f1: 0.4087
 epoch: 67, train_loss: 1.0356, test_loss: 1.3042, test_f1: 0.4552
 epoch: 68, train_loss: 1.0308, test_loss: 1.3128, test_f1: 0.3982
 epoch: 69, train_loss: 1.0097, test_loss: 1.3243, test_f1: 0.4071
 epoch: 70, train_loss: 1.0197, test_loss: 1.4489, test_f1: 0.4006
 epoch: 71, train_loss: 1.0090, test_loss: 1.4096, test_f1: 0.3980
 epoch: 72, train_loss: 1.0142, test_loss: 1.3594, test_f1: 0.4367
 epoch: 73, train_loss: 1.0104, test_loss: 1.4061, test_f1: 0.4463
 epoch: 74, train_loss: 1.0119, test_loss: 1.4404, test_f1: 0.4393
 epoch: 75, train_loss: 1.0290, test_loss: 1.3946, test_f1: 0.4701
 epoch: 76, train_loss: 1.0091, test_loss: 1.3269, test_f1: 0.4482
 epoch: 77, train_loss: 1.0104, test_loss: 1.3478, test_f1: 0.4563
 epoch: 78, train_loss: 1.0083, test_loss: 1.5193, test_f1: 0.4453
 epoch: 79, train_loss: 0.9987, test_loss: 1.4397, test_f1: 0.4490
 epoch: 80, train_loss: 0.9978, test_loss: 1.4714, test_f1: 0.4805
 epoch: 81, train_loss: 1.0042, test_loss: 1.4338, test_f1: 0.4701
 epoch: 82, train_loss: 0.9926, test_loss: 1.4298, test_f1: 0.4509
 epoch: 83, train_loss: 1.0007, test_loss: 1.4135, test_f1: 0.4530
 epoch: 84, train_loss: 0.9995, test_loss: 1.2696, test_f1: 0.4771
 epoch: 85, train_loss: 0.9935, test_loss: 1.3573, test_f1: 0.4459
 epoch: 86, train_loss: 1.0076, test_loss: 1.3760, test_f1: 0.4892
 epoch: 87, train_loss: 0.9947, test_loss: 1.4280, test_f1: 0.4763
 epoch: 88, train_loss: 0.9919, test_loss: 1.3365, test_f1: 0.4879
 epoch: 89, train_loss: 0.9895, test_loss: 1.3836, test_f1: 0.4652
 epoch: 90, train_loss: 0.9910, test_loss: 1.3435, test_f1: 0.4866
 epoch: 91, train_loss: 0.9950, test_loss: 1.4156, test_f1: 0.4638
 epoch: 92, train_loss: 0.9928, test_loss: 1.2671, test_f1: 0.5056
 epoch: 93, train_loss: 0.9764, test_loss: 1.4228, test_f1: 0.4834
 epoch: 94, train_loss: 0.9845, test_loss: 1.3105, test_f1: 0.5073
 epoch: 95, train_loss: 0.9727, test_loss: 1.4674, test_f1: 0.5106
 epoch: 96, train_loss: 0.9750, test_loss: 1.3975, test_f1: 0.4875
 epoch: 97, train_loss: 0.9804, test_loss: 1.3984, test_f1: 0.4912
 epoch: 98, train_loss: 0.9866, test_loss: 1.4454, test_f1: 0.4914
 epoch: 99, train_loss: 0.9810, test_loss: 1.4365, test_f1: 0.4995
##################ITERATION #2 ****************************************
 epoch: 0, train_loss: 1.2907, test_loss: 1.3244, test_f1: 0.2237
 epoch: 1, train_loss: 1.2708, test_loss: 1.4118, test_f1: 0.2270
 epoch: 2, train_loss: 1.2600, test_loss: 1.4417, test_f1: 0.2281
 epoch: 3, train_loss: 1.2509, test_loss: 1.4215, test_f1: 0.2270
 epoch: 4, train_loss: 1.2381, test_loss: 1.3864, test_f1: 0.2281
 epoch: 5, train_loss: 1.2333, test_loss: 1.3595, test_f1: 0.2263
 epoch: 6, train_loss: 1.2237, test_loss: 1.4161, test_f1: 0.2281
 epoch: 7, train_loss: 1.2198, test_loss: 1.4383, test_f1: 0.2278
 epoch: 8, train_loss: 1.2199, test_loss: 1.3503, test_f1: 0.2265
 epoch: 9, train_loss: 1.2091, test_loss: 1.4438, test_f1: 0.2274
 epoch: 10, train_loss: 1.2094, test_loss: 1.4818, test_f1: 0.2340
 epoch: 11, train_loss: 1.2014, test_loss: 1.3919, test_f1: 0.2322
 epoch: 12, train_loss: 1.2004, test_loss: 1.4582, test_f1: 0.2329
 epoch: 13, train_loss: 1.1915, test_loss: 1.5291, test_f1: 0.2325
 epoch: 14, train_loss: 1.1821, test_loss: 1.4515, test_f1: 0.2329
 epoch: 15, train_loss: 1.1854, test_loss: 1.4115, test_f1: 0.2447
 epoch: 16, train_loss: 1.1798, test_loss: 1.4404, test_f1: 0.2554
 epoch: 17, train_loss: 1.1691, test_loss: 1.4209, test_f1: 0.2875
 epoch: 18, train_loss: 1.1793, test_loss: 1.3166, test_f1: 0.2960
 epoch: 19, train_loss: 1.1600, test_loss: 1.4129, test_f1: 0.3116
 epoch: 20, train_loss: 1.1621, test_loss: 1.3718, test_f1: 0.3151
 epoch: 21, train_loss: 1.1467, test_loss: 1.4264, test_f1: 0.3109
 epoch: 22, train_loss: 1.1499, test_loss: 1.3327, test_f1: 0.3564
 epoch: 23, train_loss: 1.1445, test_loss: 1.4023, test_f1: 0.3737
 epoch: 24, train_loss: 1.1448, test_loss: 1.4109, test_f1: 0.3848
 epoch: 25, train_loss: 1.1405, test_loss: 1.3405, test_f1: 0.3845
 epoch: 26, train_loss: 1.1351, test_loss: 1.3263, test_f1: 0.4194
 epoch: 27, train_loss: 1.1329, test_loss: 1.3513, test_f1: 0.4376
 epoch: 28, train_loss: 1.1231, test_loss: 1.3084, test_f1: 0.4428
 epoch: 29, train_loss: 1.1224, test_loss: 1.3606, test_f1: 0.4453
 epoch: 30, train_loss: 1.1149, test_loss: 1.4058, test_f1: 0.4489
 epoch: 31, train_loss: 1.1044, test_loss: 1.3589, test_f1: 0.4345
 epoch: 32, train_loss: 1.1074, test_loss: 1.3284, test_f1: 0.4483
 epoch: 33, train_loss: 1.1007, test_loss: 1.3339, test_f1: 0.4473
 epoch: 34, train_loss: 1.1047, test_loss: 1.2735, test_f1: 0.4429
 epoch: 35, train_loss: 1.0871, test_loss: 1.2130, test_f1: 0.4495
 epoch: 36, train_loss: 1.0888, test_loss: 1.3431, test_f1: 0.4544
 epoch: 37, train_loss: 1.0824, test_loss: 1.2888, test_f1: 0.4453
 epoch: 38, train_loss: 1.0839, test_loss: 1.3122, test_f1: 0.4458
 epoch: 39, train_loss: 1.0688, test_loss: 1.3818, test_f1: 0.4521
 epoch: 40, train_loss: 1.0674, test_loss: 1.2039, test_f1: 0.4488
 epoch: 41, train_loss: 1.0766, test_loss: 1.1945, test_f1: 0.4506
 epoch: 42, train_loss: 1.0633, test_loss: 1.2251, test_f1: 0.4532
 epoch: 43, train_loss: 1.0504, test_loss: 1.2305, test_f1: 0.4417
 epoch: 44, train_loss: 1.0595, test_loss: 1.1945, test_f1: 0.4372
 epoch: 45, train_loss: 1.0577, test_loss: 1.2019, test_f1: 0.4557
 epoch: 46, train_loss: 1.0445, test_loss: 1.2190, test_f1: 0.4572
 epoch: 47, train_loss: 1.0471, test_loss: 1.1744, test_f1: 0.4584
 epoch: 48, train_loss: 1.0383, test_loss: 1.2301, test_f1: 0.4602
 epoch: 49, train_loss: 1.0406, test_loss: 1.1946, test_f1: 0.4685
 epoch: 50, train_loss: 1.0313, test_loss: 1.2629, test_f1: 0.4786
 epoch: 51, train_loss: 1.0295, test_loss: 1.2077, test_f1: 0.4735
 epoch: 52, train_loss: 1.0228, test_loss: 1.1852, test_f1: 0.4666
 epoch: 53, train_loss: 1.0210, test_loss: 1.1799, test_f1: 0.4593
 epoch: 54, train_loss: 1.0495, test_loss: 1.1957, test_f1: 0.4662
 epoch: 55, train_loss: 1.0159, test_loss: 1.2030, test_f1: 0.4828
 epoch: 56, train_loss: 1.0368, test_loss: 1.2043, test_f1: 0.4740
 epoch: 57, train_loss: 1.0140, test_loss: 1.2164, test_f1: 0.4746
 epoch: 58, train_loss: 1.0286, test_loss: 1.2103, test_f1: 0.5056
 epoch: 59, train_loss: 1.0242, test_loss: 1.1706, test_f1: 0.4843
 epoch: 60, train_loss: 1.0273, test_loss: 1.2318, test_f1: 0.5043
 epoch: 61, train_loss: 1.0108, test_loss: 1.1687, test_f1: 0.5041
 epoch: 62, train_loss: 1.0115, test_loss: 1.2068, test_f1: 0.4965
 epoch: 63, train_loss: 1.0129, test_loss: 1.2273, test_f1: 0.4992
 epoch: 64, train_loss: 1.0197, test_loss: 1.2210, test_f1: 0.5176
 epoch: 65, train_loss: 1.0031, test_loss: 1.2098, test_f1: 0.5122
 epoch: 66, train_loss: 1.0021, test_loss: 1.2220, test_f1: 0.5082
 epoch: 67, train_loss: 1.0067, test_loss: 1.2176, test_f1: 0.5102
 epoch: 68, train_loss: 1.0042, test_loss: 1.2330, test_f1: 0.5118
 epoch: 69, train_loss: 1.0056, test_loss: 1.2031, test_f1: 0.5104
 epoch: 70, train_loss: 1.0129, test_loss: 1.2196, test_f1: 0.5135
 epoch: 71, train_loss: 1.0022, test_loss: 1.2338, test_f1: 0.5179
 epoch: 72, train_loss: 1.0040, test_loss: 1.2988, test_f1: 0.5214
 epoch: 73, train_loss: 1.0041, test_loss: 1.2631, test_f1: 0.5254
 epoch: 74, train_loss: 1.0233, test_loss: 1.1683, test_f1: 0.5497
 epoch: 75, train_loss: 1.0145, test_loss: 1.2853, test_f1: 0.5268
 epoch: 76, train_loss: 0.9958, test_loss: 1.2316, test_f1: 0.5386
 epoch: 77, train_loss: 0.9969, test_loss: 1.2008, test_f1: 0.5408
 epoch: 78, train_loss: 0.9912, test_loss: 1.2730, test_f1: 0.5379
 epoch: 79, train_loss: 1.0095, test_loss: 1.2249, test_f1: 0.5331
 epoch: 80, train_loss: 1.0009, test_loss: 1.1965, test_f1: 0.5444
 epoch: 81, train_loss: 1.0034, test_loss: 1.2056, test_f1: 0.5497
 epoch: 82, train_loss: 0.9939, test_loss: 1.2071, test_f1: 0.5590
 epoch: 83, train_loss: 0.9870, test_loss: 1.1940, test_f1: 0.5497
 epoch: 84, train_loss: 0.9877, test_loss: 1.1965, test_f1: 0.5444
 epoch: 85, train_loss: 0.9799, test_loss: 1.2102, test_f1: 0.5420
 epoch: 86, train_loss: 0.9785, test_loss: 1.2881, test_f1: 0.5362
 epoch: 87, train_loss: 0.9846, test_loss: 1.2384, test_f1: 0.5430
 epoch: 88, train_loss: 0.9818, test_loss: 1.2589, test_f1: 0.5453
 epoch: 89, train_loss: 0.9723, test_loss: 1.2124, test_f1: 0.5515
 epoch: 90, train_loss: 0.9831, test_loss: 1.2440, test_f1: 0.5403
 epoch: 91, train_loss: 0.9723, test_loss: 1.1840, test_f1: 0.5458
 epoch: 92, train_loss: 0.9730, test_loss: 1.1871, test_f1: 0.5538
 epoch: 93, train_loss: 0.9713, test_loss: 1.2289, test_f1: 0.5526
 epoch: 94, train_loss: 0.9720, test_loss: 1.1956, test_f1: 0.5526
 epoch: 95, train_loss: 0.9665, test_loss: 1.1644, test_f1: 0.5525
 epoch: 96, train_loss: 0.9679, test_loss: 1.1914, test_f1: 0.5518
 epoch: 97, train_loss: 0.9891, test_loss: 1.1657, test_f1: 0.5703
 epoch: 98, train_loss: 0.9671, test_loss: 1.1642, test_f1: 0.5535
 epoch: 99, train_loss: 0.9647, test_loss: 1.2065, test_f1: 0.5585
##################ITERATION #3 ****************************************
 epoch: 0, train_loss: 1.2817, test_loss: 1.3112, test_f1: 0.2281
 epoch: 1, train_loss: 1.2549, test_loss: 1.3014, test_f1: 0.2205
 epoch: 2, train_loss: 1.2475, test_loss: 1.2961, test_f1: 0.2227
 epoch: 3, train_loss: 1.2319, test_loss: 1.2951, test_f1: 0.2205
 epoch: 4, train_loss: 1.2278, test_loss: 1.2826, test_f1: 0.2400
 epoch: 5, train_loss: 1.2183, test_loss: 1.2803, test_f1: 0.2383
 epoch: 6, train_loss: 1.2175, test_loss: 1.2749, test_f1: 0.2383
 epoch: 7, train_loss: 1.2057, test_loss: 1.2574, test_f1: 0.2631
 epoch: 8, train_loss: 1.2061, test_loss: 1.2639, test_f1: 0.2708
 epoch: 9, train_loss: 1.1950, test_loss: 1.2666, test_f1: 0.2706
 epoch: 10, train_loss: 1.1930, test_loss: 1.2512, test_f1: 0.2628
 epoch: 11, train_loss: 1.1795, test_loss: 1.2490, test_f1: 0.2904
 epoch: 12, train_loss: 1.1810, test_loss: 1.2617, test_f1: 0.2596
 epoch: 13, train_loss: 1.1696, test_loss: 1.2494, test_f1: 0.3178
 epoch: 14, train_loss: 1.1693, test_loss: 1.2469, test_f1: 0.2939
 epoch: 15, train_loss: 1.1757, test_loss: 1.2600, test_f1: 0.3316
 epoch: 16, train_loss: 1.1484, test_loss: 1.2400, test_f1: 0.3372
 epoch: 17, train_loss: 1.1534, test_loss: 1.2464, test_f1: 0.3624
 epoch: 18, train_loss: 1.1485, test_loss: 1.2547, test_f1: 0.3810
 epoch: 19, train_loss: 1.1446, test_loss: 1.2552, test_f1: 0.3762
 epoch: 20, train_loss: 1.1335, test_loss: 1.2356, test_f1: 0.3761
 epoch: 21, train_loss: 1.1343, test_loss: 1.2231, test_f1: 0.3863
 epoch: 22, train_loss: 1.1350, test_loss: 1.2261, test_f1: 0.3878
 epoch: 23, train_loss: 1.1227, test_loss: 1.2236, test_f1: 0.3891
 epoch: 24, train_loss: 1.1160, test_loss: 1.2145, test_f1: 0.3825
 epoch: 25, train_loss: 1.1129, test_loss: 1.2103, test_f1: 0.4041
 epoch: 26, train_loss: 1.1072, test_loss: 1.2092, test_f1: 0.4156
 epoch: 27, train_loss: 1.1051, test_loss: 1.2031, test_f1: 0.4127
 epoch: 28, train_loss: 1.1114, test_loss: 1.2043, test_f1: 0.4121
 epoch: 29, train_loss: 1.1097, test_loss: 1.1916, test_f1: 0.4201
 epoch: 30, train_loss: 1.0986, test_loss: 1.1941, test_f1: 0.4167
 epoch: 31, train_loss: 1.0947, test_loss: 1.1925, test_f1: 0.4265
 epoch: 32, train_loss: 1.1066, test_loss: 1.1913, test_f1: 0.4126
 epoch: 33, train_loss: 1.0863, test_loss: 1.1906, test_f1: 0.4202
 epoch: 34, train_loss: 1.0888, test_loss: 1.1944, test_f1: 0.4498
 epoch: 35, train_loss: 1.0791, test_loss: 1.1911, test_f1: 0.4346
 epoch: 36, train_loss: 1.0761, test_loss: 1.1813, test_f1: 0.4339
 epoch: 37, train_loss: 1.0717, test_loss: 1.1795, test_f1: 0.4547
 epoch: 38, train_loss: 1.0617, test_loss: 1.1843, test_f1: 0.4853
 epoch: 39, train_loss: 1.0688, test_loss: 1.1837, test_f1: 0.4397
 epoch: 40, train_loss: 1.0801, test_loss: 1.1807, test_f1: 0.4896
 epoch: 41, train_loss: 1.0548, test_loss: 1.1818, test_f1: 0.5017
 epoch: 42, train_loss: 1.0541, test_loss: 1.1803, test_f1: 0.5409
 epoch: 43, train_loss: 1.0518, test_loss: 1.1732, test_f1: 0.5312
 epoch: 44, train_loss: 1.0446, test_loss: 1.1730, test_f1: 0.5447
 epoch: 45, train_loss: 1.0428, test_loss: 1.1762, test_f1: 0.4961
 epoch: 46, train_loss: 1.0339, test_loss: 1.1749, test_f1: 0.5197
 epoch: 47, train_loss: 1.0456, test_loss: 1.1685, test_f1: 0.5520
 epoch: 48, train_loss: 1.0379, test_loss: 1.1769, test_f1: 0.5471
 epoch: 49, train_loss: 1.0368, test_loss: 1.1817, test_f1: 0.5406
 epoch: 50, train_loss: 1.0407, test_loss: 1.1723, test_f1: 0.5488
 epoch: 51, train_loss: 1.0374, test_loss: 1.1700, test_f1: 0.5490
 epoch: 52, train_loss: 1.0213, test_loss: 1.1793, test_f1: 0.5433
 epoch: 53, train_loss: 1.0133, test_loss: 1.1719, test_f1: 0.5544
 epoch: 54, train_loss: 1.0260, test_loss: 1.1769, test_f1: 0.5474
 epoch: 55, train_loss: 1.0347, test_loss: 1.1771, test_f1: 0.5491
 epoch: 56, train_loss: 1.0253, test_loss: 1.1769, test_f1: 0.5372
 epoch: 57, train_loss: 1.0358, test_loss: 1.1651, test_f1: 0.5372
 epoch: 58, train_loss: 1.0223, test_loss: 1.1711, test_f1: 0.5279
 epoch: 59, train_loss: 1.0051, test_loss: 1.1706, test_f1: 0.5382
 epoch: 60, train_loss: 1.0283, test_loss: 1.1703, test_f1: 0.5396
 epoch: 61, train_loss: 1.0178, test_loss: 1.1841, test_f1: 0.5333
 epoch: 62, train_loss: 1.0159, test_loss: 1.1693, test_f1: 0.5316
 epoch: 63, train_loss: 1.0226, test_loss: 1.1697, test_f1: 0.5378
 epoch: 64, train_loss: 1.0180, test_loss: 1.1676, test_f1: 0.5114
 epoch: 65, train_loss: 1.0134, test_loss: 1.1754, test_f1: 0.5363
 epoch: 66, train_loss: 1.0032, test_loss: 1.1737, test_f1: 0.5325
 epoch: 67, train_loss: 1.0061, test_loss: 1.1888, test_f1: 0.5429
 epoch: 68, train_loss: 1.0174, test_loss: 1.1760, test_f1: 0.5614
 epoch: 69, train_loss: 1.0126, test_loss: 1.1811, test_f1: 0.5441
 epoch: 70, train_loss: 0.9983, test_loss: 1.1767, test_f1: 0.5470
 epoch: 71, train_loss: 1.0158, test_loss: 1.1698, test_f1: 0.5595
 epoch: 72, train_loss: 1.0116, test_loss: 1.1753, test_f1: 0.5451
 epoch: 73, train_loss: 1.0087, test_loss: 1.1748, test_f1: 0.5626
 epoch: 74, train_loss: 1.0044, test_loss: 1.1825, test_f1: 0.5444
 epoch: 75, train_loss: 0.9845, test_loss: 1.1877, test_f1: 0.5339
 epoch: 76, train_loss: 0.9950, test_loss: 1.1942, test_f1: 0.5338
 epoch: 77, train_loss: 0.9880, test_loss: 1.1916, test_f1: 0.5225
 epoch: 78, train_loss: 0.9995, test_loss: 1.1821, test_f1: 0.5437
 epoch: 79, train_loss: 0.9887, test_loss: 1.1784, test_f1: 0.5454
 epoch: 80, train_loss: 0.9797, test_loss: 1.1792, test_f1: 0.5382
 epoch: 81, train_loss: 0.9959, test_loss: 1.1822, test_f1: 0.5556
 epoch: 82, train_loss: 0.9965, test_loss: 1.1739, test_f1: 0.5456
 epoch: 83, train_loss: 0.9872, test_loss: 1.1940, test_f1: 0.5337
 epoch: 84, train_loss: 1.0031, test_loss: 1.1998, test_f1: 0.5388
 epoch: 85, train_loss: 1.0008, test_loss: 1.1866, test_f1: 0.5588
 epoch: 86, train_loss: 0.9870, test_loss: 1.1908, test_f1: 0.5509
 epoch: 87, train_loss: 0.9749, test_loss: 1.1890, test_f1: 0.5570
 epoch: 88, train_loss: 0.9842, test_loss: 1.2021, test_f1: 0.5338
 epoch: 89, train_loss: 0.9678, test_loss: 1.1972, test_f1: 0.5584
 epoch: 90, train_loss: 0.9843, test_loss: 1.1969, test_f1: 0.5674
 epoch: 91, train_loss: 0.9823, test_loss: 1.1897, test_f1: 0.5663
 epoch: 92, train_loss: 0.9824, test_loss: 1.2108, test_f1: 0.5478
 epoch: 93, train_loss: 0.9806, test_loss: 1.1993, test_f1: 0.5564
 epoch: 94, train_loss: 0.9786, test_loss: 1.2026, test_f1: 0.5556
 epoch: 95, train_loss: 0.9731, test_loss: 1.2012, test_f1: 0.5629
 epoch: 96, train_loss: 0.9792, test_loss: 1.1900, test_f1: 0.5536
 epoch: 97, train_loss: 0.9784, test_loss: 1.2073, test_f1: 0.5666
 epoch: 98, train_loss: 0.9679, test_loss: 1.2202, test_f1: 0.5457
 epoch: 99, train_loss: 0.9766, test_loss: 1.2072, test_f1: 0.5520
##################ITERATION #4 ****************************************
 epoch: 0, train_loss: 1.2836, test_loss: 1.3296, test_f1: 0.2281
 epoch: 1, train_loss: 1.2613, test_loss: 1.4866, test_f1: 0.2557
 epoch: 2, train_loss: 1.2429, test_loss: 1.3785, test_f1: 0.2708
 epoch: 3, train_loss: 1.2274, test_loss: 1.3807, test_f1: 0.2613
 epoch: 4, train_loss: 1.2271, test_loss: 1.4323, test_f1: 0.2544
 epoch: 5, train_loss: 1.2232, test_loss: 1.3785, test_f1: 0.2483
 epoch: 6, train_loss: 1.2106, test_loss: 1.3194, test_f1: 0.2598
 epoch: 7, train_loss: 1.2067, test_loss: 1.3998, test_f1: 0.2588
 epoch: 8, train_loss: 1.2028, test_loss: 1.3184, test_f1: 0.2740
 epoch: 9, train_loss: 1.1913, test_loss: 1.3286, test_f1: 0.2875
 epoch: 10, train_loss: 1.1888, test_loss: 1.3239, test_f1: 0.3000
 epoch: 11, train_loss: 1.1822, test_loss: 1.3498, test_f1: 0.3508
 epoch: 12, train_loss: 1.1751, test_loss: 1.3189, test_f1: 0.3703
 epoch: 13, train_loss: 1.1686, test_loss: 1.2885, test_f1: 0.3670
 epoch: 14, train_loss: 1.1672, test_loss: 1.3459, test_f1: 0.3941
 epoch: 15, train_loss: 1.1510, test_loss: 1.3433, test_f1: 0.4123
 epoch: 16, train_loss: 1.1539, test_loss: 1.3241, test_f1: 0.4130
 epoch: 17, train_loss: 1.1487, test_loss: 1.2988, test_f1: 0.4053
 epoch: 18, train_loss: 1.1401, test_loss: 1.2940, test_f1: 0.4107
 epoch: 19, train_loss: 1.1380, test_loss: 1.3058, test_f1: 0.4137
 epoch: 20, train_loss: 1.1370, test_loss: 1.3273, test_f1: 0.3925
 epoch: 21, train_loss: 1.1230, test_loss: 1.3314, test_f1: 0.4166
 epoch: 22, train_loss: 1.1185, test_loss: 1.2848, test_f1: 0.4028
 epoch: 23, train_loss: 1.1215, test_loss: 1.3049, test_f1: 0.4081
 epoch: 24, train_loss: 1.1114, test_loss: 1.3128, test_f1: 0.4177
 epoch: 25, train_loss: 1.0979, test_loss: 1.3266, test_f1: 0.4099
 epoch: 26, train_loss: 1.0902, test_loss: 1.3105, test_f1: 0.3923
 epoch: 27, train_loss: 1.0958, test_loss: 1.3435, test_f1: 0.4306
 epoch: 28, train_loss: 1.0896, test_loss: 1.3461, test_f1: 0.4265
 epoch: 29, train_loss: 1.0735, test_loss: 1.3404, test_f1: 0.4304
 epoch: 30, train_loss: 1.0856, test_loss: 1.3511, test_f1: 0.4342
 epoch: 31, train_loss: 1.0703, test_loss: 1.3199, test_f1: 0.4228
 epoch: 32, train_loss: 1.0493, test_loss: 1.3600, test_f1: 0.4342
 epoch: 33, train_loss: 1.0716, test_loss: 1.3507, test_f1: 0.4450
 epoch: 34, train_loss: 1.0583, test_loss: 1.3766, test_f1: 0.4430
 epoch: 35, train_loss: 1.0603, test_loss: 1.3748, test_f1: 0.4389
 epoch: 36, train_loss: 1.0354, test_loss: 1.3548, test_f1: 0.4494
 epoch: 37, train_loss: 1.0453, test_loss: 1.3629, test_f1: 0.4760
 epoch: 38, train_loss: 1.0427, test_loss: 1.3562, test_f1: 0.4838
 epoch: 39, train_loss: 1.0206, test_loss: 1.3549, test_f1: 0.4840
 epoch: 40, train_loss: 1.0379, test_loss: 1.3585, test_f1: 0.5177
 epoch: 41, train_loss: 1.0267, test_loss: 1.3453, test_f1: 0.5030
 epoch: 42, train_loss: 1.0242, test_loss: 1.3318, test_f1: 0.4960
 epoch: 43, train_loss: 1.0294, test_loss: 1.3265, test_f1: 0.5034
 epoch: 44, train_loss: 1.0219, test_loss: 1.3408, test_f1: 0.5173
 epoch: 45, train_loss: 1.0239, test_loss: 1.3320, test_f1: 0.5280
 epoch: 46, train_loss: 1.0176, test_loss: 1.3125, test_f1: 0.5377
 epoch: 47, train_loss: 1.0063, test_loss: 1.3525, test_f1: 0.5300
 epoch: 48, train_loss: 1.0172, test_loss: 1.3259, test_f1: 0.5114
 epoch: 49, train_loss: 1.0134, test_loss: 1.3445, test_f1: 0.5208
 epoch: 50, train_loss: 1.0009, test_loss: 1.3261, test_f1: 0.5263
 epoch: 51, train_loss: 1.0041, test_loss: 1.3328, test_f1: 0.5390
 epoch: 52, train_loss: 0.9918, test_loss: 1.3148, test_f1: 0.5088
 epoch: 53, train_loss: 0.9993, test_loss: 1.3403, test_f1: 0.5259
 epoch: 54, train_loss: 0.9881, test_loss: 1.3257, test_f1: 0.5158
 epoch: 55, train_loss: 0.9945, test_loss: 1.3326, test_f1: 0.5024
 epoch: 56, train_loss: 0.9821, test_loss: 1.3171, test_f1: 0.5306
 epoch: 57, train_loss: 0.9890, test_loss: 1.3488, test_f1: 0.5087
 epoch: 58, train_loss: 0.9865, test_loss: 1.3033, test_f1: 0.5115
 epoch: 59, train_loss: 0.9983, test_loss: 1.3469, test_f1: 0.5153
 epoch: 60, train_loss: 0.9755, test_loss: 1.3348, test_f1: 0.5242
 epoch: 61, train_loss: 0.9887, test_loss: 1.3422, test_f1: 0.5480
 epoch: 62, train_loss: 0.9768, test_loss: 1.3445, test_f1: 0.5350
 epoch: 63, train_loss: 0.9693, test_loss: 1.3469, test_f1: 0.5344
 epoch: 64, train_loss: 0.9735, test_loss: 1.3499, test_f1: 0.5423
 epoch: 65, train_loss: 0.9659, test_loss: 1.3502, test_f1: 0.5031
 epoch: 66, train_loss: 0.9865, test_loss: 1.3539, test_f1: 0.5309
 epoch: 67, train_loss: 0.9718, test_loss: 1.3343, test_f1: 0.5527
 epoch: 68, train_loss: 0.9671, test_loss: 1.3586, test_f1: 0.5225
 epoch: 69, train_loss: 0.9754, test_loss: 1.3401, test_f1: 0.5388
 epoch: 70, train_loss: 0.9729, test_loss: 1.3524, test_f1: 0.5599
 epoch: 71, train_loss: 0.9651, test_loss: 1.3154, test_f1: 0.5591
 epoch: 72, train_loss: 0.9585, test_loss: 1.3410, test_f1: 0.5548
 epoch: 73, train_loss: 0.9696, test_loss: 1.3918, test_f1: 0.5441
 epoch: 74, train_loss: 0.9654, test_loss: 1.3668, test_f1: 0.5346
 epoch: 75, train_loss: 0.9538, test_loss: 1.3676, test_f1: 0.5211
 epoch: 76, train_loss: 0.9705, test_loss: 1.3768, test_f1: 0.5220
 epoch: 77, train_loss: 0.9640, test_loss: 1.3775, test_f1: 0.5406
 epoch: 78, train_loss: 0.9508, test_loss: 1.3537, test_f1: 0.5549
 epoch: 79, train_loss: 0.9620, test_loss: 1.3868, test_f1: 0.5290
 epoch: 80, train_loss: 0.9515, test_loss: 1.3974, test_f1: 0.5459
 epoch: 81, train_loss: 0.9441, test_loss: 1.3588, test_f1: 0.5470
 epoch: 82, train_loss: 0.9557, test_loss: 1.3754, test_f1: 0.5418
 epoch: 83, train_loss: 0.9431, test_loss: 1.3648, test_f1: 0.5316
 epoch: 84, train_loss: 0.9635, test_loss: 1.3813, test_f1: 0.5375
 epoch: 85, train_loss: 0.9543, test_loss: 1.3642, test_f1: 0.5430
 epoch: 86, train_loss: 0.9565, test_loss: 1.3267, test_f1: 0.5543
 epoch: 87, train_loss: 0.9405, test_loss: 1.3800, test_f1: 0.5348
 epoch: 88, train_loss: 0.9448, test_loss: 1.3851, test_f1: 0.5431
 epoch: 89, train_loss: 0.9386, test_loss: 1.3959, test_f1: 0.5062
 epoch: 90, train_loss: 0.9460, test_loss: 1.3954, test_f1: 0.5495
 epoch: 91, train_loss: 0.9540, test_loss: 1.4263, test_f1: 0.5333
 epoch: 92, train_loss: 0.9242, test_loss: 1.4360, test_f1: 0.5331
 epoch: 93, train_loss: 0.9489, test_loss: 1.3888, test_f1: 0.5285
 epoch: 94, train_loss: 0.9299, test_loss: 1.4199, test_f1: 0.5353
 epoch: 95, train_loss: 0.9411, test_loss: 1.4245, test_f1: 0.5498
 epoch: 96, train_loss: 0.9486, test_loss: 1.3711, test_f1: 0.5558
 epoch: 97, train_loss: 0.9179, test_loss: 1.3860, test_f1: 0.5648
 epoch: 98, train_loss: 0.9458, test_loss: 1.4407, test_f1: 0.5377
 epoch: 99, train_loss: 0.9311, test_loss: 1.4245, test_f1: 0.5437
##################ITERATION #5 ****************************************
 epoch: 0, train_loss: 1.2766, test_loss: 1.3608, test_f1: 0.2407
 epoch: 1, train_loss: 1.2542, test_loss: 1.3787, test_f1: 0.2806
 epoch: 2, train_loss: 1.2429, test_loss: 1.4463, test_f1: 0.3030
 epoch: 3, train_loss: 1.2224, test_loss: 1.3552, test_f1: 0.3457
 epoch: 4, train_loss: 1.2194, test_loss: 1.3650, test_f1: 0.3460
 epoch: 5, train_loss: 1.2072, test_loss: 1.3983, test_f1: 0.3918
 epoch: 6, train_loss: 1.1968, test_loss: 1.3344, test_f1: 0.3925
 epoch: 7, train_loss: 1.1888, test_loss: 1.3551, test_f1: 0.4004
 epoch: 8, train_loss: 1.1901, test_loss: 1.3192, test_f1: 0.4104
 epoch: 9, train_loss: 1.1725, test_loss: 1.3622, test_f1: 0.4140
 epoch: 10, train_loss: 1.1661, test_loss: 1.3419, test_f1: 0.4181
 epoch: 11, train_loss: 1.1594, test_loss: 1.3362, test_f1: 0.4437
 epoch: 12, train_loss: 1.1542, test_loss: 1.4043, test_f1: 0.4349
 epoch: 13, train_loss: 1.1371, test_loss: 1.3461, test_f1: 0.4360
 epoch: 14, train_loss: 1.1421, test_loss: 1.3317, test_f1: 0.4551
 epoch: 15, train_loss: 1.1253, test_loss: 1.3260, test_f1: 0.4302
 epoch: 16, train_loss: 1.1360, test_loss: 1.3038, test_f1: 0.4332
 epoch: 17, train_loss: 1.1195, test_loss: 1.3089, test_f1: 0.4506
 epoch: 18, train_loss: 1.1273, test_loss: 1.3721, test_f1: 0.4550
 epoch: 19, train_loss: 1.1116, test_loss: 1.2909, test_f1: 0.4534
 epoch: 20, train_loss: 1.1096, test_loss: 1.2952, test_f1: 0.4493
 epoch: 21, train_loss: 1.1162, test_loss: 1.3109, test_f1: 0.4547
 epoch: 22, train_loss: 1.0995, test_loss: 1.2875, test_f1: 0.4630
 epoch: 23, train_loss: 1.0894, test_loss: 1.2815, test_f1: 0.4599
 epoch: 24, train_loss: 1.0872, test_loss: 1.2971, test_f1: 0.4604
 epoch: 25, train_loss: 1.0875, test_loss: 1.2553, test_f1: 0.4620
 epoch: 26, train_loss: 1.0789, test_loss: 1.2790, test_f1: 0.4773
 epoch: 27, train_loss: 1.0790, test_loss: 1.2688, test_f1: 0.4577
 epoch: 28, train_loss: 1.0610, test_loss: 1.2356, test_f1: 0.4675
 epoch: 29, train_loss: 1.0724, test_loss: 1.2554, test_f1: 0.4804
 epoch: 30, train_loss: 1.0624, test_loss: 1.3734, test_f1: 0.4849
 epoch: 31, train_loss: 1.0595, test_loss: 1.2421, test_f1: 0.4774
 epoch: 32, train_loss: 1.0560, test_loss: 1.2526, test_f1: 0.4640
 epoch: 33, train_loss: 1.0645, test_loss: 1.2438, test_f1: 0.4878
 epoch: 34, train_loss: 1.0574, test_loss: 1.2573, test_f1: 0.4758
 epoch: 35, train_loss: 1.0359, test_loss: 1.2723, test_f1: 0.4561
 epoch: 36, train_loss: 1.0474, test_loss: 1.2260, test_f1: 0.4772
 epoch: 37, train_loss: 1.0482, test_loss: 1.2567, test_f1: 0.4750
 epoch: 38, train_loss: 1.0305, test_loss: 1.2545, test_f1: 0.4839
 epoch: 39, train_loss: 1.0428, test_loss: 1.2885, test_f1: 0.4977
 epoch: 40, train_loss: 1.0298, test_loss: 1.5975, test_f1: 0.4685
 epoch: 41, train_loss: 1.0541, test_loss: 1.2913, test_f1: 0.4929
 epoch: 42, train_loss: 1.0330, test_loss: 1.2600, test_f1: 0.5125
 epoch: 43, train_loss: 1.0387, test_loss: 1.2671, test_f1: 0.5225
 epoch: 44, train_loss: 1.0247, test_loss: 1.3794, test_f1: 0.4946
 epoch: 45, train_loss: 1.0233, test_loss: 1.2684, test_f1: 0.5270
 epoch: 46, train_loss: 1.0034, test_loss: 1.2724, test_f1: 0.5013
 epoch: 47, train_loss: 1.0109, test_loss: 1.2514, test_f1: 0.5265
 epoch: 48, train_loss: 1.0198, test_loss: 1.2147, test_f1: 0.5039
 epoch: 49, train_loss: 1.0165, test_loss: 1.1881, test_f1: 0.5214
 epoch: 50, train_loss: 0.9953, test_loss: 1.1889, test_f1: 0.5319
 epoch: 51, train_loss: 1.0044, test_loss: 1.1809, test_f1: 0.5382
 epoch: 52, train_loss: 0.9987, test_loss: 1.1819, test_f1: 0.5328
 epoch: 53, train_loss: 0.9925, test_loss: 1.1877, test_f1: 0.5496
 epoch: 54, train_loss: 0.9943, test_loss: 1.1888, test_f1: 0.5421
 epoch: 55, train_loss: 1.0023, test_loss: 1.1995, test_f1: 0.5518
 epoch: 56, train_loss: 0.9930, test_loss: 1.2026, test_f1: 0.5468
 epoch: 57, train_loss: 1.0040, test_loss: 1.1915, test_f1: 0.5205
 epoch: 58, train_loss: 0.9866, test_loss: 1.2113, test_f1: 0.5364
 epoch: 59, train_loss: 0.9941, test_loss: 1.2055, test_f1: 0.5417
 epoch: 60, train_loss: 0.9837, test_loss: 1.1938, test_f1: 0.5216
 epoch: 61, train_loss: 0.9840, test_loss: 1.2303, test_f1: 0.5173
 epoch: 62, train_loss: 0.9876, test_loss: 1.2222, test_f1: 0.5479
 epoch: 63, train_loss: 0.9834, test_loss: 1.2053, test_f1: 0.5340
 epoch: 64, train_loss: 0.9865, test_loss: 1.1995, test_f1: 0.5356
 epoch: 65, train_loss: 0.9814, test_loss: 1.2302, test_f1: 0.5254
 epoch: 66, train_loss: 0.9970, test_loss: 1.2209, test_f1: 0.5140
 epoch: 67, train_loss: 0.9864, test_loss: 1.2291, test_f1: 0.5268
 epoch: 68, train_loss: 0.9896, test_loss: 1.2077, test_f1: 0.5224
 epoch: 69, train_loss: 0.9733, test_loss: 1.2246, test_f1: 0.5309
 epoch: 70, train_loss: 0.9951, test_loss: 1.2031, test_f1: 0.5489
 epoch: 71, train_loss: 0.9700, test_loss: 1.2021, test_f1: 0.5264
 epoch: 72, train_loss: 0.9775, test_loss: 1.1889, test_f1: 0.5462
 epoch: 73, train_loss: 0.9723, test_loss: 1.1996, test_f1: 0.5280
 epoch: 74, train_loss: 0.9830, test_loss: 1.1905, test_f1: 0.5165
 epoch: 75, train_loss: 0.9703, test_loss: 1.1899, test_f1: 0.5433
 epoch: 76, train_loss: 0.9764, test_loss: 1.1856, test_f1: 0.5518
 epoch: 77, train_loss: 0.9637, test_loss: 1.1921, test_f1: 0.5510
 epoch: 78, train_loss: 0.9623, test_loss: 1.2083, test_f1: 0.5421
 epoch: 79, train_loss: 0.9580, test_loss: 1.2034, test_f1: 0.5341
 epoch: 80, train_loss: 0.9584, test_loss: 1.2019, test_f1: 0.5318
 epoch: 81, train_loss: 0.9622, test_loss: 1.2072, test_f1: 0.5568
 epoch: 82, train_loss: 0.9583, test_loss: 1.2601, test_f1: 0.5190
 epoch: 83, train_loss: 0.9580, test_loss: 1.2628, test_f1: 0.5430
 epoch: 84, train_loss: 0.9646, test_loss: 1.2828, test_f1: 0.5451
 epoch: 85, train_loss: 0.9640, test_loss: 1.2106, test_f1: 0.5410
 epoch: 86, train_loss: 0.9500, test_loss: 1.3610, test_f1: 0.5447
 epoch: 87, train_loss: 0.9638, test_loss: 1.2932, test_f1: 0.5215
 epoch: 88, train_loss: 0.9379, test_loss: 1.2239, test_f1: 0.5315
 epoch: 89, train_loss: 0.9456, test_loss: 1.2117, test_f1: 0.5473
 epoch: 90, train_loss: 0.9545, test_loss: 1.2706, test_f1: 0.5323
 epoch: 91, train_loss: 0.9336, test_loss: 1.2667, test_f1: 0.5279
 epoch: 92, train_loss: 0.9537, test_loss: 1.2452, test_f1: 0.5333
 epoch: 93, train_loss: 0.9480, test_loss: 1.2579, test_f1: 0.5303
 epoch: 94, train_loss: 0.9547, test_loss: 1.1980, test_f1: 0.5490
 epoch: 95, train_loss: 0.9583, test_loss: 1.2067, test_f1: 0.5319
 epoch: 96, train_loss: 0.9447, test_loss: 1.2165, test_f1: 0.5286
 epoch: 97, train_loss: 0.9479, test_loss: 1.2009, test_f1: 0.5352
 epoch: 98, train_loss: 0.9318, test_loss: 1.2290, test_f1: 0.5303
 epoch: 99, train_loss: 0.9613, test_loss: 1.2164, test_f1: 0.5297
##################ITERATION #6 ****************************************
 epoch: 0, train_loss: 1.3023, test_loss: 1.3270, test_f1: 0.2472
 epoch: 1, train_loss: 1.2712, test_loss: 1.3295, test_f1: 0.2513
 epoch: 2, train_loss: 1.2497, test_loss: 1.3155, test_f1: 0.2937
 epoch: 3, train_loss: 1.2444, test_loss: 1.3027, test_f1: 0.3065
 epoch: 4, train_loss: 1.2304, test_loss: 1.3141, test_f1: 0.3094
 epoch: 5, train_loss: 1.2305, test_loss: 1.3186, test_f1: 0.2933
 epoch: 6, train_loss: 1.2124, test_loss: 1.3414, test_f1: 0.2998
 epoch: 7, train_loss: 1.1995, test_loss: 1.3300, test_f1: 0.2943
 epoch: 8, train_loss: 1.1962, test_loss: 1.3419, test_f1: 0.3052
 epoch: 9, train_loss: 1.1988, test_loss: 1.3233, test_f1: 0.2829
 epoch: 10, train_loss: 1.1864, test_loss: 1.2950, test_f1: 0.2898
 epoch: 11, train_loss: 1.1862, test_loss: 1.2887, test_f1: 0.2917
 epoch: 12, train_loss: 1.1775, test_loss: 1.2824, test_f1: 0.3131
 epoch: 13, train_loss: 1.1773, test_loss: 1.2991, test_f1: 0.3185
 epoch: 14, train_loss: 1.1758, test_loss: 1.2650, test_f1: 0.2947
 epoch: 15, train_loss: 1.1694, test_loss: 1.2573, test_f1: 0.3301
 epoch: 16, train_loss: 1.1578, test_loss: 1.2621, test_f1: 0.3140
 epoch: 17, train_loss: 1.1454, test_loss: 1.2402, test_f1: 0.3326
 epoch: 18, train_loss: 1.1459, test_loss: 1.2467, test_f1: 0.3169
 epoch: 19, train_loss: 1.1416, test_loss: 1.2380, test_f1: 0.3299
 epoch: 20, train_loss: 1.1283, test_loss: 1.2334, test_f1: 0.3292
 epoch: 21, train_loss: 1.1360, test_loss: 1.2293, test_f1: 0.3864
 epoch: 22, train_loss: 1.1235, test_loss: 1.2323, test_f1: 0.3622
 epoch: 23, train_loss: 1.1243, test_loss: 1.2294, test_f1: 0.3757
 epoch: 24, train_loss: 1.1099, test_loss: 1.2277, test_f1: 0.3842
 epoch: 25, train_loss: 1.1097, test_loss: 1.2228, test_f1: 0.3565
 epoch: 26, train_loss: 1.1106, test_loss: 1.2139, test_f1: 0.3892
 epoch: 27, train_loss: 1.1002, test_loss: 1.2163, test_f1: 0.3959
 epoch: 28, train_loss: 1.1080, test_loss: 1.2199, test_f1: 0.3681
 epoch: 29, train_loss: 1.0886, test_loss: 1.2153, test_f1: 0.3993
 epoch: 30, train_loss: 1.0929, test_loss: 1.2314, test_f1: 0.4186
 epoch: 31, train_loss: 1.0977, test_loss: 1.2170, test_f1: 0.3915
 epoch: 32, train_loss: 1.0785, test_loss: 1.2113, test_f1: 0.3790
 epoch: 33, train_loss: 1.0935, test_loss: 1.2184, test_f1: 0.4010
 epoch: 34, train_loss: 1.0923, test_loss: 1.2143, test_f1: 0.3909
 epoch: 35, train_loss: 1.0809, test_loss: 1.2107, test_f1: 0.4222
 epoch: 36, train_loss: 1.0969, test_loss: 1.2045, test_f1: 0.3938
 epoch: 37, train_loss: 1.0661, test_loss: 1.2072, test_f1: 0.4165
 epoch: 38, train_loss: 1.0726, test_loss: 1.2084, test_f1: 0.3798
 epoch: 39, train_loss: 1.0571, test_loss: 1.2015, test_f1: 0.4177
 epoch: 40, train_loss: 1.0676, test_loss: 1.2009, test_f1: 0.4020
 epoch: 41, train_loss: 1.0570, test_loss: 1.1898, test_f1: 0.4277
 epoch: 42, train_loss: 1.0683, test_loss: 1.1981, test_f1: 0.4311
 epoch: 43, train_loss: 1.0450, test_loss: 1.1902, test_f1: 0.4320
 epoch: 44, train_loss: 1.0452, test_loss: 1.2137, test_f1: 0.4727
 epoch: 45, train_loss: 1.0581, test_loss: 1.1900, test_f1: 0.4222
 epoch: 46, train_loss: 1.0394, test_loss: 1.2038, test_f1: 0.4378
 epoch: 47, train_loss: 1.0538, test_loss: 1.1928, test_f1: 0.4632
 epoch: 48, train_loss: 1.0469, test_loss: 1.2143, test_f1: 0.4440
 epoch: 49, train_loss: 1.0311, test_loss: 1.1780, test_f1: 0.4493
 epoch: 50, train_loss: 1.0302, test_loss: 1.1868, test_f1: 0.4531
 epoch: 51, train_loss: 1.0293, test_loss: 1.1831, test_f1: 0.4638
 epoch: 52, train_loss: 1.0221, test_loss: 1.1770, test_f1: 0.4398
 epoch: 53, train_loss: 1.0342, test_loss: 1.2043, test_f1: 0.4630
 epoch: 54, train_loss: 1.0180, test_loss: 1.1936, test_f1: 0.4682
 epoch: 55, train_loss: 1.0284, test_loss: 1.1963, test_f1: 0.4525
 epoch: 56, train_loss: 1.0222, test_loss: 1.1905, test_f1: 0.4607
 epoch: 57, train_loss: 1.0293, test_loss: 1.1818, test_f1: 0.4771
 epoch: 58, train_loss: 1.0262, test_loss: 1.1910, test_f1: 0.4790
 epoch: 59, train_loss: 1.0129, test_loss: 1.1770, test_f1: 0.4742
 epoch: 60, train_loss: 1.0248, test_loss: 1.1776, test_f1: 0.4849
 epoch: 61, train_loss: 1.0131, test_loss: 1.1616, test_f1: 0.4710
 epoch: 62, train_loss: 1.0157, test_loss: 1.1824, test_f1: 0.4813
 epoch: 63, train_loss: 1.0187, test_loss: 1.1986, test_f1: 0.4743
 epoch: 64, train_loss: 1.0232, test_loss: 1.1779, test_f1: 0.4690
 epoch: 65, train_loss: 1.0108, test_loss: 1.1958, test_f1: 0.4741
 epoch: 66, train_loss: 1.0117, test_loss: 1.1804, test_f1: 0.4755
 epoch: 67, train_loss: 1.0124, test_loss: 1.1744, test_f1: 0.4655
 epoch: 68, train_loss: 1.0163, test_loss: 1.1794, test_f1: 0.4520
 epoch: 69, train_loss: 0.9999, test_loss: 1.1748, test_f1: 0.4507
 epoch: 70, train_loss: 1.0122, test_loss: 1.1793, test_f1: 0.4629
 epoch: 71, train_loss: 0.9901, test_loss: 1.1877, test_f1: 0.4918
 epoch: 72, train_loss: 1.0257, test_loss: 1.1774, test_f1: 0.4682
 epoch: 73, train_loss: 0.9966, test_loss: 1.1837, test_f1: 0.4663
 epoch: 74, train_loss: 1.0063, test_loss: 1.1886, test_f1: 0.4691
 epoch: 75, train_loss: 0.9963, test_loss: 1.1903, test_f1: 0.4551
 epoch: 76, train_loss: 1.0045, test_loss: 1.1831, test_f1: 0.4644
 epoch: 77, train_loss: 0.9871, test_loss: 1.1725, test_f1: 0.4895
 epoch: 78, train_loss: 1.0042, test_loss: 1.1882, test_f1: 0.4547
 epoch: 79, train_loss: 0.9931, test_loss: 1.1843, test_f1: 0.4702
 epoch: 80, train_loss: 0.9851, test_loss: 1.1895, test_f1: 0.4782
 epoch: 81, train_loss: 0.9899, test_loss: 1.1717, test_f1: 0.4583
 epoch: 82, train_loss: 0.9995, test_loss: 1.1727, test_f1: 0.4808
 epoch: 83, train_loss: 0.9946, test_loss: 1.1946, test_f1: 0.4822
 epoch: 84, train_loss: 0.9857, test_loss: 1.1839, test_f1: 0.4699
 epoch: 85, train_loss: 0.9844, test_loss: 1.1747, test_f1: 0.4695
 epoch: 86, train_loss: 0.9955, test_loss: 1.1762, test_f1: 0.4660
 epoch: 87, train_loss: 0.9854, test_loss: 1.1730, test_f1: 0.4727
 epoch: 88, train_loss: 0.9665, test_loss: 1.1822, test_f1: 0.4885
 epoch: 89, train_loss: 0.9844, test_loss: 1.1847, test_f1: 0.4794
 epoch: 90, train_loss: 1.0037, test_loss: 1.1976, test_f1: 0.4812
 epoch: 91, train_loss: 0.9919, test_loss: 1.2016, test_f1: 0.4805
 epoch: 92, train_loss: 0.9822, test_loss: 1.2179, test_f1: 0.4753
 epoch: 93, train_loss: 0.9946, test_loss: 1.1919, test_f1: 0.5113
 epoch: 94, train_loss: 0.9759, test_loss: 1.1882, test_f1: 0.4746
 epoch: 95, train_loss: 0.9634, test_loss: 1.1914, test_f1: 0.4847
 epoch: 96, train_loss: 0.9684, test_loss: 1.2015, test_f1: 0.4821
 epoch: 97, train_loss: 0.9734, test_loss: 1.1753, test_f1: 0.4695
 epoch: 98, train_loss: 0.9579, test_loss: 1.1700, test_f1: 0.4757
 epoch: 99, train_loss: 0.9682, test_loss: 1.1851, test_f1: 0.4688
##################ITERATION #7 ****************************************
 epoch: 0, train_loss: 1.2910, test_loss: 1.3161, test_f1: 0.2281
 epoch: 1, train_loss: 1.2533, test_loss: 1.2818, test_f1: 0.2285
 epoch: 2, train_loss: 1.2539, test_loss: 1.3055, test_f1: 0.2503
 epoch: 3, train_loss: 1.2474, test_loss: 1.2867, test_f1: 0.2737
 epoch: 4, train_loss: 1.2404, test_loss: 1.3270, test_f1: 0.2833
 epoch: 5, train_loss: 1.2316, test_loss: 1.3529, test_f1: 0.2920
 epoch: 6, train_loss: 1.2213, test_loss: 1.2844, test_f1: 0.3101
 epoch: 7, train_loss: 1.2133, test_loss: 1.2906, test_f1: 0.2967
 epoch: 8, train_loss: 1.2146, test_loss: 1.2791, test_f1: 0.3424
 epoch: 9, train_loss: 1.2121, test_loss: 1.2733, test_f1: 0.3454
 epoch: 10, train_loss: 1.2045, test_loss: 1.2758, test_f1: 0.3600
 epoch: 11, train_loss: 1.2034, test_loss: 1.3045, test_f1: 0.3424
 epoch: 12, train_loss: 1.1911, test_loss: 1.2896, test_f1: 0.3093
 epoch: 13, train_loss: 1.1980, test_loss: 1.2901, test_f1: 0.3574
 epoch: 14, train_loss: 1.1955, test_loss: 1.2754, test_f1: 0.3721
 epoch: 15, train_loss: 1.1834, test_loss: 1.2868, test_f1: 0.3362
 epoch: 16, train_loss: 1.1872, test_loss: 1.2640, test_f1: 0.3227
 epoch: 17, train_loss: 1.1722, test_loss: 1.2970, test_f1: 0.3333
 epoch: 18, train_loss: 1.1753, test_loss: 1.2953, test_f1: 0.3335
 epoch: 19, train_loss: 1.1730, test_loss: 1.3422, test_f1: 0.3250
 epoch: 20, train_loss: 1.1645, test_loss: 1.3549, test_f1: 0.3488
 epoch: 21, train_loss: 1.1620, test_loss: 1.2865, test_f1: 0.3530
 epoch: 22, train_loss: 1.1570, test_loss: 1.2642, test_f1: 0.3796
 epoch: 23, train_loss: 1.1721, test_loss: 1.2753, test_f1: 0.3469
 epoch: 24, train_loss: 1.1690, test_loss: 1.2402, test_f1: 0.3839
 epoch: 25, train_loss: 1.1458, test_loss: 1.2899, test_f1: 0.3851
 epoch: 26, train_loss: 1.1614, test_loss: 1.2628, test_f1: 0.3904
 epoch: 27, train_loss: 1.1594, test_loss: 1.2569, test_f1: 0.3868
 epoch: 28, train_loss: 1.1420, test_loss: 1.2503, test_f1: 0.3687
 epoch: 29, train_loss: 1.1413, test_loss: 1.2904, test_f1: 0.4010
 epoch: 30, train_loss: 1.1359, test_loss: 1.2499, test_f1: 0.3863
 epoch: 31, train_loss: 1.1346, test_loss: 1.2459, test_f1: 0.3857
 epoch: 32, train_loss: 1.1271, test_loss: 1.2678, test_f1: 0.3763
 epoch: 33, train_loss: 1.1361, test_loss: 1.2481, test_f1: 0.4178
 epoch: 34, train_loss: 1.1182, test_loss: 1.2626, test_f1: 0.3988
 epoch: 35, train_loss: 1.1264, test_loss: 1.2709, test_f1: 0.4056
 epoch: 36, train_loss: 1.1192, test_loss: 1.2972, test_f1: 0.3944
 epoch: 37, train_loss: 1.1165, test_loss: 1.3029, test_f1: 0.4062
 epoch: 38, train_loss: 1.1229, test_loss: 1.2980, test_f1: 0.3926
 epoch: 39, train_loss: 1.1218, test_loss: 1.2966, test_f1: 0.3962
 epoch: 40, train_loss: 1.1170, test_loss: 1.2600, test_f1: 0.3948
 epoch: 41, train_loss: 1.1119, test_loss: 1.2818, test_f1: 0.4028
 epoch: 42, train_loss: 1.1116, test_loss: 1.2589, test_f1: 0.4290
 epoch: 43, train_loss: 1.1049, test_loss: 1.3125, test_f1: 0.4279
 epoch: 44, train_loss: 1.1135, test_loss: 1.2856, test_f1: 0.4399
 epoch: 45, train_loss: 1.0878, test_loss: 1.2941, test_f1: 0.4403
 epoch: 46, train_loss: 1.0929, test_loss: 1.2697, test_f1: 0.4331
 epoch: 47, train_loss: 1.0961, test_loss: 1.2898, test_f1: 0.4372
 epoch: 48, train_loss: 1.0957, test_loss: 1.2711, test_f1: 0.4329
 epoch: 49, train_loss: 1.0908, test_loss: 1.2556, test_f1: 0.4384
 epoch: 50, train_loss: 1.0910, test_loss: 1.2662, test_f1: 0.4344
 epoch: 51, train_loss: 1.0804, test_loss: 1.2639, test_f1: 0.4337
 epoch: 52, train_loss: 1.0801, test_loss: 1.3028, test_f1: 0.4339
 epoch: 53, train_loss: 1.0812, test_loss: 1.2921, test_f1: 0.4394
 epoch: 54, train_loss: 1.0761, test_loss: 1.3114, test_f1: 0.4515
 epoch: 55, train_loss: 1.0775, test_loss: 1.2998, test_f1: 0.4497
 epoch: 56, train_loss: 1.0736, test_loss: 1.2967, test_f1: 0.4481
 epoch: 57, train_loss: 1.0802, test_loss: 1.2945, test_f1: 0.4417
 epoch: 58, train_loss: 1.0764, test_loss: 1.3330, test_f1: 0.4512
 epoch: 59, train_loss: 1.0616, test_loss: 1.3874, test_f1: 0.4574
 epoch: 60, train_loss: 1.0704, test_loss: 1.3649, test_f1: 0.4383
 epoch: 61, train_loss: 1.0702, test_loss: 1.3053, test_f1: 0.4467
 epoch: 62, train_loss: 1.0768, test_loss: 1.2753, test_f1: 0.4514
 epoch: 63, train_loss: 1.0593, test_loss: 1.3314, test_f1: 0.4509
 epoch: 64, train_loss: 1.0649, test_loss: 1.4531, test_f1: 0.4419
 epoch: 65, train_loss: 1.0583, test_loss: 1.3915, test_f1: 0.4411
 epoch: 66, train_loss: 1.0592, test_loss: 1.4658, test_f1: 0.4413
 epoch: 67, train_loss: 1.0761, test_loss: 1.4085, test_f1: 0.4489
 epoch: 68, train_loss: 1.0696, test_loss: 1.5245, test_f1: 0.4413
 epoch: 69, train_loss: 1.0556, test_loss: 1.5038, test_f1: 0.4467
 epoch: 70, train_loss: 1.0719, test_loss: 1.4085, test_f1: 0.4481
 epoch: 71, train_loss: 1.0650, test_loss: 1.3392, test_f1: 0.4592
 epoch: 72, train_loss: 1.0564, test_loss: 1.3193, test_f1: 0.4526
 epoch: 73, train_loss: 1.0437, test_loss: 1.4814, test_f1: 0.4553
 epoch: 74, train_loss: 1.0533, test_loss: 1.4290, test_f1: 0.4521
 epoch: 75, train_loss: 1.0459, test_loss: 1.3556, test_f1: 0.4601
 epoch: 76, train_loss: 1.0432, test_loss: 1.3032, test_f1: 0.4689
 epoch: 77, train_loss: 1.0558, test_loss: 1.3225, test_f1: 0.4726
 epoch: 78, train_loss: 1.0456, test_loss: 1.3713, test_f1: 0.4682
 epoch: 79, train_loss: 1.0457, test_loss: 1.3285, test_f1: 0.4752
 epoch: 80, train_loss: 1.0416, test_loss: 1.3329, test_f1: 0.4750
 epoch: 81, train_loss: 1.0349, test_loss: 1.3641, test_f1: 0.4659
 epoch: 82, train_loss: 1.0451, test_loss: 1.3427, test_f1: 0.4722
 epoch: 83, train_loss: 1.0478, test_loss: 1.4586, test_f1: 0.4797
 epoch: 84, train_loss: 1.0622, test_loss: 1.4232, test_f1: 0.4681
 epoch: 85, train_loss: 1.0391, test_loss: 1.3933, test_f1: 0.4614
 epoch: 86, train_loss: 1.0300, test_loss: 1.4195, test_f1: 0.4503
 epoch: 87, train_loss: 1.0482, test_loss: 1.4217, test_f1: 0.4545
 epoch: 88, train_loss: 1.0319, test_loss: 1.4824, test_f1: 0.4705
 epoch: 89, train_loss: 1.0311, test_loss: 1.3734, test_f1: 0.4674
 epoch: 90, train_loss: 1.0480, test_loss: 1.3826, test_f1: 0.4739
 epoch: 91, train_loss: 1.0412, test_loss: 1.5650, test_f1: 0.4877
 epoch: 92, train_loss: 1.0279, test_loss: 1.3716, test_f1: 0.4853
 epoch: 93, train_loss: 1.0483, test_loss: 1.4751, test_f1: 0.4808
 epoch: 94, train_loss: 1.0272, test_loss: 1.3759, test_f1: 0.4810
 epoch: 95, train_loss: 1.0273, test_loss: 1.3619, test_f1: 0.4845
 epoch: 96, train_loss: 1.0360, test_loss: 1.4009, test_f1: 0.4723
 epoch: 97, train_loss: 1.0217, test_loss: 1.4690, test_f1: 0.4781
 epoch: 98, train_loss: 1.0253, test_loss: 1.3642, test_f1: 0.4822
 epoch: 99, train_loss: 1.0209, test_loss: 1.4435, test_f1: 0.4887
##################ITERATION #8 ****************************************
 epoch: 0, train_loss: 1.2545, test_loss: 1.3011, test_f1: 0.2688
 epoch: 1, train_loss: 1.2492, test_loss: 1.3290, test_f1: 0.2806
 epoch: 2, train_loss: 1.2285, test_loss: 1.3083, test_f1: 0.2863
 epoch: 3, train_loss: 1.2241, test_loss: 1.3082, test_f1: 0.2913
 epoch: 4, train_loss: 1.2069, test_loss: 1.2959, test_f1: 0.3162
 epoch: 5, train_loss: 1.1939, test_loss: 1.2952, test_f1: 0.3304
 epoch: 6, train_loss: 1.2004, test_loss: 1.2974, test_f1: 0.3159
 epoch: 7, train_loss: 1.1869, test_loss: 1.2739, test_f1: 0.3237
 epoch: 8, train_loss: 1.1953, test_loss: 1.2563, test_f1: 0.3644
 epoch: 9, train_loss: 1.1792, test_loss: 1.2484, test_f1: 0.3720
 epoch: 10, train_loss: 1.1749, test_loss: 1.2517, test_f1: 0.3827
 epoch: 11, train_loss: 1.1675, test_loss: 1.2258, test_f1: 0.4040
 epoch: 12, train_loss: 1.1497, test_loss: 1.2168, test_f1: 0.4016
 epoch: 13, train_loss: 1.1533, test_loss: 1.2059, test_f1: 0.4358
 epoch: 14, train_loss: 1.1512, test_loss: 1.2091, test_f1: 0.4194
 epoch: 15, train_loss: 1.1415, test_loss: 1.1904, test_f1: 0.4451
 epoch: 16, train_loss: 1.1460, test_loss: 1.2001, test_f1: 0.4392
 epoch: 17, train_loss: 1.1498, test_loss: 1.1881, test_f1: 0.4624
 epoch: 18, train_loss: 1.1382, test_loss: 1.1824, test_f1: 0.4514
 epoch: 19, train_loss: 1.1293, test_loss: 1.1759, test_f1: 0.4552
 epoch: 20, train_loss: 1.1249, test_loss: 1.1829, test_f1: 0.4583
 epoch: 21, train_loss: 1.1235, test_loss: 1.1680, test_f1: 0.4895
 epoch: 22, train_loss: 1.1016, test_loss: 1.1650, test_f1: 0.4882
 epoch: 23, train_loss: 1.1144, test_loss: 1.1682, test_f1: 0.4843
 epoch: 24, train_loss: 1.1103, test_loss: 1.1810, test_f1: 0.4714
 epoch: 25, train_loss: 1.1072, test_loss: 1.1732, test_f1: 0.4801
 epoch: 26, train_loss: 1.1102, test_loss: 1.1713, test_f1: 0.4855
 epoch: 27, train_loss: 1.0947, test_loss: 1.1717, test_f1: 0.4752
 epoch: 28, train_loss: 1.0893, test_loss: 1.1694, test_f1: 0.4733
 epoch: 29, train_loss: 1.0804, test_loss: 1.1603, test_f1: 0.4867
 epoch: 30, train_loss: 1.0840, test_loss: 1.1626, test_f1: 0.4911
 epoch: 31, train_loss: 1.0823, test_loss: 1.1659, test_f1: 0.4817
 epoch: 32, train_loss: 1.0751, test_loss: 1.1751, test_f1: 0.4790
 epoch: 33, train_loss: 1.0820, test_loss: 1.1876, test_f1: 0.4770
 epoch: 34, train_loss: 1.0739, test_loss: 1.1875, test_f1: 0.4795
 epoch: 35, train_loss: 1.0636, test_loss: 1.1871, test_f1: 0.4815
 epoch: 36, train_loss: 1.0779, test_loss: 1.1968, test_f1: 0.4856
 epoch: 37, train_loss: 1.0450, test_loss: 1.1948, test_f1: 0.4645
 epoch: 38, train_loss: 1.0646, test_loss: 1.1823, test_f1: 0.4740
 epoch: 39, train_loss: 1.0504, test_loss: 1.2043, test_f1: 0.4524
 epoch: 40, train_loss: 1.0500, test_loss: 1.1762, test_f1: 0.4815
 epoch: 41, train_loss: 1.0355, test_loss: 1.1911, test_f1: 0.4674
 epoch: 42, train_loss: 1.0277, test_loss: 1.1963, test_f1: 0.4729
 epoch: 43, train_loss: 1.0382, test_loss: 1.2044, test_f1: 0.4719
 epoch: 44, train_loss: 1.0324, test_loss: 1.2243, test_f1: 0.4695
 epoch: 45, train_loss: 1.0404, test_loss: 1.2203, test_f1: 0.4705
 epoch: 46, train_loss: 1.0311, test_loss: 1.2130, test_f1: 0.4671
 epoch: 47, train_loss: 1.0296, test_loss: 1.2141, test_f1: 0.4775
 epoch: 48, train_loss: 1.0333, test_loss: 1.2439, test_f1: 0.4670
 epoch: 49, train_loss: 1.0288, test_loss: 1.2084, test_f1: 0.4657
 epoch: 50, train_loss: 1.0212, test_loss: 1.2187, test_f1: 0.4778
 epoch: 51, train_loss: 1.0182, test_loss: 1.2177, test_f1: 0.4706
 epoch: 52, train_loss: 1.0177, test_loss: 1.2064, test_f1: 0.4590
 epoch: 53, train_loss: 1.0125, test_loss: 1.2057, test_f1: 0.4518
 epoch: 54, train_loss: 1.0011, test_loss: 1.2054, test_f1: 0.4651
 epoch: 55, train_loss: 0.9976, test_loss: 1.2029, test_f1: 0.4711
 epoch: 56, train_loss: 1.0016, test_loss: 1.2087, test_f1: 0.4625
 epoch: 57, train_loss: 1.0138, test_loss: 1.2077, test_f1: 0.4783
 epoch: 58, train_loss: 0.9906, test_loss: 1.2194, test_f1: 0.4819
 epoch: 59, train_loss: 1.0146, test_loss: 1.2109, test_f1: 0.4778
 epoch: 60, train_loss: 0.9989, test_loss: 1.2165, test_f1: 0.4711
 epoch: 61, train_loss: 0.9946, test_loss: 1.2261, test_f1: 0.4723
 epoch: 62, train_loss: 1.0033, test_loss: 1.1997, test_f1: 0.4803
 epoch: 63, train_loss: 0.9819, test_loss: 1.1987, test_f1: 0.4869
 epoch: 64, train_loss: 0.9906, test_loss: 1.2157, test_f1: 0.4661
 epoch: 65, train_loss: 0.9932, test_loss: 1.2171, test_f1: 0.4830
 epoch: 66, train_loss: 0.9755, test_loss: 1.2154, test_f1: 0.4663
 epoch: 67, train_loss: 0.9863, test_loss: 1.2201, test_f1: 0.4665
 epoch: 68, train_loss: 0.9813, test_loss: 1.2300, test_f1: 0.4717
 epoch: 69, train_loss: 0.9843, test_loss: 1.2065, test_f1: 0.4812
 epoch: 70, train_loss: 1.0099, test_loss: 1.2218, test_f1: 0.4616
 epoch: 71, train_loss: 0.9907, test_loss: 1.2414, test_f1: 0.4713
 epoch: 72, train_loss: 0.9830, test_loss: 1.2377, test_f1: 0.4895
 epoch: 73, train_loss: 0.9898, test_loss: 1.2358, test_f1: 0.4802
 epoch: 74, train_loss: 0.9867, test_loss: 1.2242, test_f1: 0.4847
 epoch: 75, train_loss: 0.9728, test_loss: 1.2058, test_f1: 0.5030
 epoch: 76, train_loss: 0.9643, test_loss: 1.1950, test_f1: 0.4921
 epoch: 77, train_loss: 0.9687, test_loss: 1.2138, test_f1: 0.4905
 epoch: 78, train_loss: 0.9709, test_loss: 1.2260, test_f1: 0.4799
 epoch: 79, train_loss: 0.9717, test_loss: 1.1972, test_f1: 0.4935
 epoch: 80, train_loss: 0.9858, test_loss: 1.2273, test_f1: 0.4749
 epoch: 81, train_loss: 0.9733, test_loss: 1.2470, test_f1: 0.4821
 epoch: 82, train_loss: 0.9751, test_loss: 1.2507, test_f1: 0.4765
 epoch: 83, train_loss: 0.9563, test_loss: 1.2503, test_f1: 0.4693
 epoch: 84, train_loss: 0.9574, test_loss: 1.2337, test_f1: 0.4862
 epoch: 85, train_loss: 0.9670, test_loss: 1.2486, test_f1: 0.4845
 epoch: 86, train_loss: 0.9628, test_loss: 1.2657, test_f1: 0.4811
 epoch: 87, train_loss: 0.9495, test_loss: 1.2612, test_f1: 0.4833
 epoch: 88, train_loss: 0.9776, test_loss: 1.2619, test_f1: 0.4833
 epoch: 89, train_loss: 0.9576, test_loss: 1.2841, test_f1: 0.4684
 epoch: 90, train_loss: 0.9721, test_loss: 1.2928, test_f1: 0.4777
 epoch: 91, train_loss: 0.9743, test_loss: 1.2863, test_f1: 0.4749
 epoch: 92, train_loss: 0.9570, test_loss: 1.2777, test_f1: 0.4780
 epoch: 93, train_loss: 0.9670, test_loss: 1.3031, test_f1: 0.4855
 epoch: 94, train_loss: 0.9480, test_loss: 1.2968, test_f1: 0.4796
 epoch: 95, train_loss: 0.9586, test_loss: 1.2770, test_f1: 0.4885
 epoch: 96, train_loss: 0.9512, test_loss: 1.2686, test_f1: 0.4707
 epoch: 97, train_loss: 0.9538, test_loss: 1.2850, test_f1: 0.4702
 epoch: 98, train_loss: 0.9401, test_loss: 1.2517, test_f1: 0.4781
 epoch: 99, train_loss: 0.9374, test_loss: 1.2312, test_f1: 0.4777
##################ITERATION #9 ****************************************
 epoch: 0, train_loss: 1.2936, test_loss: 1.3427, test_f1: 0.2946
 epoch: 1, train_loss: 1.2514, test_loss: 1.3271, test_f1: 0.2390
 epoch: 2, train_loss: 1.2403, test_loss: 1.3157, test_f1: 0.2688
 epoch: 3, train_loss: 1.2261, test_loss: 1.3247, test_f1: 0.2717
 epoch: 4, train_loss: 1.2366, test_loss: 1.2823, test_f1: 0.3298
 epoch: 5, train_loss: 1.2064, test_loss: 1.2958, test_f1: 0.2936
 epoch: 6, train_loss: 1.2179, test_loss: 1.3016, test_f1: 0.3354
 epoch: 7, train_loss: 1.2020, test_loss: 1.2935, test_f1: 0.3070
 epoch: 8, train_loss: 1.2001, test_loss: 1.2799, test_f1: 0.3327
 epoch: 9, train_loss: 1.1979, test_loss: 1.2690, test_f1: 0.3478
 epoch: 10, train_loss: 1.1783, test_loss: 1.2564, test_f1: 0.3479
 epoch: 11, train_loss: 1.1841, test_loss: 1.2717, test_f1: 0.3778
 epoch: 12, train_loss: 1.1758, test_loss: 1.2653, test_f1: 0.3869
 epoch: 13, train_loss: 1.1728, test_loss: 1.2648, test_f1: 0.3670
 epoch: 14, train_loss: 1.1610, test_loss: 1.2426, test_f1: 0.3591
 epoch: 15, train_loss: 1.1659, test_loss: 1.2766, test_f1: 0.3703
 epoch: 16, train_loss: 1.1556, test_loss: 1.2563, test_f1: 0.3715
 epoch: 17, train_loss: 1.1364, test_loss: 1.2489, test_f1: 0.3852
 epoch: 18, train_loss: 1.1366, test_loss: 1.2280, test_f1: 0.3888
 epoch: 19, train_loss: 1.1542, test_loss: 1.2462, test_f1: 0.4019
 epoch: 20, train_loss: 1.1444, test_loss: 1.2276, test_f1: 0.3626
 epoch: 21, train_loss: 1.1340, test_loss: 1.2230, test_f1: 0.3789
 epoch: 22, train_loss: 1.1348, test_loss: 1.2292, test_f1: 0.3775
 epoch: 23, train_loss: 1.1175, test_loss: 1.2190, test_f1: 0.4038
 epoch: 24, train_loss: 1.1322, test_loss: 1.2114, test_f1: 0.3965
 epoch: 25, train_loss: 1.1219, test_loss: 1.2029, test_f1: 0.4172
 epoch: 26, train_loss: 1.1198, test_loss: 1.2064, test_f1: 0.4201
 epoch: 27, train_loss: 1.1206, test_loss: 1.2016, test_f1: 0.4125
 epoch: 28, train_loss: 1.1262, test_loss: 1.2034, test_f1: 0.3994
 epoch: 29, train_loss: 1.1107, test_loss: 1.2110, test_f1: 0.4188
 epoch: 30, train_loss: 1.1183, test_loss: 1.2055, test_f1: 0.4326
 epoch: 31, train_loss: 1.1057, test_loss: 1.1987, test_f1: 0.4362
 epoch: 32, train_loss: 1.0905, test_loss: 1.1994, test_f1: 0.4409
 epoch: 33, train_loss: 1.0942, test_loss: 1.2103, test_f1: 0.4546
 epoch: 34, train_loss: 1.0948, test_loss: 1.2063, test_f1: 0.4464
 epoch: 35, train_loss: 1.0991, test_loss: 1.1942, test_f1: 0.4394
 epoch: 36, train_loss: 1.0831, test_loss: 1.1928, test_f1: 0.4447
 epoch: 37, train_loss: 1.0867, test_loss: 1.1943, test_f1: 0.4444
 epoch: 38, train_loss: 1.0834, test_loss: 1.2057, test_f1: 0.4459
 epoch: 39, train_loss: 1.0848, test_loss: 1.1933, test_f1: 0.4652
 epoch: 40, train_loss: 1.0734, test_loss: 1.2001, test_f1: 0.4569
 epoch: 41, train_loss: 1.0713, test_loss: 1.1931, test_f1: 0.4584
 epoch: 42, train_loss: 1.0766, test_loss: 1.1961, test_f1: 0.4754
 epoch: 43, train_loss: 1.0645, test_loss: 1.1883, test_f1: 0.4848
 epoch: 44, train_loss: 1.0651, test_loss: 1.1911, test_f1: 0.4771
 epoch: 45, train_loss: 1.0726, test_loss: 1.1903, test_f1: 0.4763
 epoch: 46, train_loss: 1.0632, test_loss: 1.1997, test_f1: 0.4589
 epoch: 47, train_loss: 1.0616, test_loss: 1.1825, test_f1: 0.4571
 epoch: 48, train_loss: 1.0441, test_loss: 1.1905, test_f1: 0.4755
 epoch: 49, train_loss: 1.0593, test_loss: 1.1977, test_f1: 0.4687
 epoch: 50, train_loss: 1.0544, test_loss: 1.1777, test_f1: 0.4645
 epoch: 51, train_loss: 1.0452, test_loss: 1.1914, test_f1: 0.4520
 epoch: 52, train_loss: 1.0319, test_loss: 1.1860, test_f1: 0.4630
 epoch: 53, train_loss: 1.0417, test_loss: 1.1799, test_f1: 0.4655
 epoch: 54, train_loss: 1.0398, test_loss: 1.1859, test_f1: 0.4645
 epoch: 55, train_loss: 1.0482, test_loss: 1.1801, test_f1: 0.4790
 epoch: 56, train_loss: 1.0400, test_loss: 1.1880, test_f1: 0.4750
 epoch: 57, train_loss: 1.0329, test_loss: 1.1847, test_f1: 0.4778
 epoch: 58, train_loss: 1.0432, test_loss: 1.1864, test_f1: 0.4802
 epoch: 59, train_loss: 1.0453, test_loss: 1.1753, test_f1: 0.5028
 epoch: 60, train_loss: 1.0329, test_loss: 1.1841, test_f1: 0.4784
 epoch: 61, train_loss: 1.0222, test_loss: 1.1766, test_f1: 0.4850
 epoch: 62, train_loss: 1.0335, test_loss: 1.1870, test_f1: 0.4798
 epoch: 63, train_loss: 1.0346, test_loss: 1.1866, test_f1: 0.4797
 epoch: 64, train_loss: 1.0303, test_loss: 1.1886, test_f1: 0.4830
 epoch: 65, train_loss: 1.0298, test_loss: 1.1720, test_f1: 0.4859
 epoch: 66, train_loss: 1.0327, test_loss: 1.1810, test_f1: 0.4914
 epoch: 67, train_loss: 1.0360, test_loss: 1.1793, test_f1: 0.4972
 epoch: 68, train_loss: 1.0336, test_loss: 1.1818, test_f1: 0.4820
 epoch: 69, train_loss: 1.0285, test_loss: 1.1761, test_f1: 0.4952
 epoch: 70, train_loss: 1.0319, test_loss: 1.1733, test_f1: 0.4924
 epoch: 71, train_loss: 1.0128, test_loss: 1.1735, test_f1: 0.5071
 epoch: 72, train_loss: 1.0233, test_loss: 1.1841, test_f1: 0.4961
 epoch: 73, train_loss: 1.0188, test_loss: 1.1861, test_f1: 0.4892
 epoch: 74, train_loss: 1.0304, test_loss: 1.1810, test_f1: 0.4930
 epoch: 75, train_loss: 1.0437, test_loss: 1.1746, test_f1: 0.4992
 epoch: 76, train_loss: 1.0379, test_loss: 1.1741, test_f1: 0.4900
 epoch: 77, train_loss: 1.0123, test_loss: 1.1663, test_f1: 0.5045
 epoch: 78, train_loss: 1.0125, test_loss: 1.1709, test_f1: 0.4940
 epoch: 79, train_loss: 1.0187, test_loss: 1.1722, test_f1: 0.4726
 epoch: 80, train_loss: 1.0199, test_loss: 1.1776, test_f1: 0.4913
 epoch: 81, train_loss: 1.0040, test_loss: 1.1732, test_f1: 0.4970
 epoch: 82, train_loss: 1.0103, test_loss: 1.1820, test_f1: 0.4624
 epoch: 83, train_loss: 1.0073, test_loss: 1.1778, test_f1: 0.5009
 epoch: 84, train_loss: 0.9993, test_loss: 1.1831, test_f1: 0.4614
 epoch: 85, train_loss: 1.0154, test_loss: 1.1791, test_f1: 0.4739
 epoch: 86, train_loss: 1.0025, test_loss: 1.1740, test_f1: 0.4802
 epoch: 87, train_loss: 1.0047, test_loss: 1.1904, test_f1: 0.4891
 epoch: 88, train_loss: 1.0029, test_loss: 1.1702, test_f1: 0.4828
 epoch: 89, train_loss: 1.0032, test_loss: 1.1727, test_f1: 0.4899
 epoch: 90, train_loss: 0.9990, test_loss: 1.1636, test_f1: 0.4855
 epoch: 91, train_loss: 1.0018, test_loss: 1.1658, test_f1: 0.5091
 epoch: 92, train_loss: 1.0019, test_loss: 1.1633, test_f1: 0.4867
 epoch: 93, train_loss: 1.0055, test_loss: 1.1649, test_f1: 0.4807
 epoch: 94, train_loss: 1.0031, test_loss: 1.1754, test_f1: 0.4834
 epoch: 95, train_loss: 1.0079, test_loss: 1.1658, test_f1: 0.4909
 epoch: 96, train_loss: 1.0009, test_loss: 1.1679, test_f1: 0.4912
 epoch: 97, train_loss: 0.9903, test_loss: 1.1676, test_f1: 0.4788
 epoch: 98, train_loss: 1.0014, test_loss: 1.1564, test_f1: 0.4809
 epoch: 99, train_loss: 0.9952, test_loss: 1.1682, test_f1: 0.4943

Training completed in 719.04 seconds
Best F1: 0.5703 at epoch 97
Mean F1 across iterations: 0.5319  0.0292
========================FINAL RESULTS================================
FEGIN weighted F1: 0.5703  0.0292
python main.py --data ltspice_demos --representation component_component --model FEGIN --layers 5 --hiddens 32 --batch_size 32 --lr 0.0001 --emb_size 512 --epochs 100 --save_appendix component_component_L5_H32_BS32_LR0.0001_E512 --no_val
-----



STDERR:
  File "main.py", line 370, in <module>
    main()
  File "main.py", line 254, in main
    dataset = dataset_class(
  File "/home/philip/projects/ltspice_examples_code_repo/Circuit-Completion-Using-GNNs/component_classification_with_link_prediction_head/evaluation/FEGIN/kernel/circuit_datasets.py", line 15, in __init__
    self.data, self.slices = torch.load(self.processed_paths[0])
  File "/home/philip/.local/lib/python3.8/site-packages/torch/serialization.py", line 1040, in load
    warnings.warn(
  File "/usr/lib/python3.8/warnings.py", line 109, in _showwarnmsg
    sw(msg.message, msg.category, msg.filename, msg.lineno,
  File "main.py", line 47, in warn_with_traceback
    traceback.print_stack(file=log)
/home/philip/projects/ltspice_examples_code_repo/Circuit-Completion-Using-GNNs/component_classification_with_link_prediction_head/evaluation/FEGIN/kernel/circuit_datasets.py:15: FutureWarning: You are using `torch.load` with `weights_only=False` (the current default value), which uses the default pickle module implicitly. It is possible to construct malicious pickle data which will execute arbitrary code during unpickling (See https://github.com/pytorch/pytorch/blob/main/SECURITY.md#untrusted-models for more details). In a future release, the default value for `weights_only` will be flipped to `True`. This limits the functions that could be executed during unpickling. Arbitrary objects will no longer be allowed to be loaded via this mode unless they are explicitly allowlisted by the user via `torch.serialization.add_safe_globals`. We recommend you start setting `weights_only=True` for any use case where you don't have full control of the loaded file. Please open an issue on GitHub for any issues related to this experimental feature.
  self.data, self.slices = torch.load(self.processed_paths[0])
