STDOUT:
Results will be saved in /home/philip/projects/ltspice_examples_code_repo/Circuit-Completion-Using-GNNs/component_classification_with_link_prediction_head/evaluation/FEGIN/results/model_FEGIN_dataset_ltspice_demos
Command line input: python main.py --data ltspice_demos --representation component_pin --model FEGIN --layers 2 --hiddens 128 --batch_size 32 --lr 0.0001 --emb_size 128 --epochs 100 --save_appendix component_pin_L2_H128_BS32_LR0.0001_E128 --no_val
 is saved.
-----
ltspice_demos - FEGIN
Using 2 layers, 128 hidden units, h = 2
Loading component_pin representation dataset
ENTERED
Training FEGIN on component_pin representation
Train: 1565, Test: 383
##################ITERATION #0 ****************************************
 epoch: 0, train_loss: 1.3518, test_loss: 1.3472, test_f1: 0.3381
 epoch: 1, train_loss: 1.3004, test_loss: 1.3038, test_f1: 0.2850
 epoch: 2, train_loss: 1.2428, test_loss: 1.2569, test_f1: 0.2872
 epoch: 3, train_loss: 1.1858, test_loss: 1.2237, test_f1: 0.4206
 epoch: 4, train_loss: 1.1398, test_loss: 1.1913, test_f1: 0.4522
 epoch: 5, train_loss: 1.1032, test_loss: 1.1471, test_f1: 0.4490
 epoch: 6, train_loss: 1.0566, test_loss: 1.1168, test_f1: 0.4529
 epoch: 7, train_loss: 1.0256, test_loss: 1.0903, test_f1: 0.4567
 epoch: 8, train_loss: 1.0033, test_loss: 1.0657, test_f1: 0.4579
 epoch: 9, train_loss: 0.9812, test_loss: 1.0516, test_f1: 0.4487
 epoch: 10, train_loss: 0.9646, test_loss: 1.0416, test_f1: 0.4658
 epoch: 11, train_loss: 0.9478, test_loss: 1.0118, test_f1: 0.4538
 epoch: 12, train_loss: 0.9264, test_loss: 1.0199, test_f1: 0.4853
 epoch: 13, train_loss: 0.9066, test_loss: 0.9939, test_f1: 0.5396
 epoch: 14, train_loss: 0.8881, test_loss: 0.9884, test_f1: 0.5491
 epoch: 15, train_loss: 0.8743, test_loss: 0.9734, test_f1: 0.5543
 epoch: 16, train_loss: 0.8560, test_loss: 0.9619, test_f1: 0.5803
 epoch: 17, train_loss: 0.8430, test_loss: 0.9590, test_f1: 0.5983
 epoch: 18, train_loss: 0.8244, test_loss: 0.9651, test_f1: 0.6120
 epoch: 19, train_loss: 0.7988, test_loss: 0.9586, test_f1: 0.6047
 epoch: 20, train_loss: 0.7929, test_loss: 0.9584, test_f1: 0.6142
 epoch: 21, train_loss: 0.7740, test_loss: 0.9397, test_f1: 0.6253
 epoch: 22, train_loss: 0.7604, test_loss: 0.9421, test_f1: 0.6091
 epoch: 23, train_loss: 0.7494, test_loss: 0.9595, test_f1: 0.6161
 epoch: 24, train_loss: 0.7335, test_loss: 0.9393, test_f1: 0.6287
 epoch: 25, train_loss: 0.7129, test_loss: 0.9518, test_f1: 0.5983
 epoch: 26, train_loss: 0.7113, test_loss: 0.9519, test_f1: 0.6041
 epoch: 27, train_loss: 0.6985, test_loss: 0.9558, test_f1: 0.6224
 epoch: 28, train_loss: 0.6836, test_loss: 0.9763, test_f1: 0.5977
 epoch: 29, train_loss: 0.6864, test_loss: 0.9817, test_f1: 0.5857
 epoch: 30, train_loss: 0.6732, test_loss: 0.9718, test_f1: 0.6183
 epoch: 31, train_loss: 0.6664, test_loss: 0.9967, test_f1: 0.6014
 epoch: 32, train_loss: 0.6605, test_loss: 0.9965, test_f1: 0.6005
 epoch: 33, train_loss: 0.6555, test_loss: 0.9872, test_f1: 0.5902
 epoch: 34, train_loss: 0.6396, test_loss: 0.9824, test_f1: 0.6184
 epoch: 35, train_loss: 0.6260, test_loss: 1.0424, test_f1: 0.5953
 epoch: 36, train_loss: 0.6354, test_loss: 1.0233, test_f1: 0.5842
 epoch: 37, train_loss: 0.6234, test_loss: 0.9780, test_f1: 0.6322
 epoch: 38, train_loss: 0.6348, test_loss: 0.9982, test_f1: 0.6416
 epoch: 39, train_loss: 0.6103, test_loss: 1.0322, test_f1: 0.6140
 epoch: 40, train_loss: 0.5997, test_loss: 1.0306, test_f1: 0.6247
 epoch: 41, train_loss: 0.6063, test_loss: 1.0384, test_f1: 0.5854
 epoch: 42, train_loss: 0.5861, test_loss: 1.0195, test_f1: 0.6084
 epoch: 43, train_loss: 0.5691, test_loss: 0.9927, test_f1: 0.5954
 epoch: 44, train_loss: 0.5750, test_loss: 1.0439, test_f1: 0.5961
 epoch: 45, train_loss: 0.5789, test_loss: 1.0162, test_f1: 0.6002
 epoch: 46, train_loss: 0.5625, test_loss: 1.0367, test_f1: 0.5964
 epoch: 47, train_loss: 0.5782, test_loss: 1.0532, test_f1: 0.6301
 epoch: 48, train_loss: 0.5537, test_loss: 1.0242, test_f1: 0.6157
 epoch: 49, train_loss: 0.5396, test_loss: 0.9873, test_f1: 0.6419
 epoch: 50, train_loss: 0.5511, test_loss: 1.1395, test_f1: 0.5962
 epoch: 51, train_loss: 0.5156, test_loss: 1.0590, test_f1: 0.6078
 epoch: 52, train_loss: 0.5174, test_loss: 1.1228, test_f1: 0.6018
 epoch: 53, train_loss: 0.5131, test_loss: 1.0989, test_f1: 0.6055
 epoch: 54, train_loss: 0.5014, test_loss: 1.0480, test_f1: 0.6262
 epoch: 55, train_loss: 0.5128, test_loss: 1.0889, test_f1: 0.6155
 epoch: 56, train_loss: 0.5148, test_loss: 1.0290, test_f1: 0.6282
 epoch: 57, train_loss: 0.4979, test_loss: 1.0983, test_f1: 0.5994
 epoch: 58, train_loss: 0.4908, test_loss: 1.0975, test_f1: 0.6128
 epoch: 59, train_loss: 0.5016, test_loss: 1.0909, test_f1: 0.5971
 epoch: 60, train_loss: 0.4838, test_loss: 1.1065, test_f1: 0.6085
 epoch: 61, train_loss: 0.4725, test_loss: 1.1739, test_f1: 0.6261
 epoch: 62, train_loss: 0.4805, test_loss: 1.1767, test_f1: 0.5909
 epoch: 63, train_loss: 0.4782, test_loss: 1.1658, test_f1: 0.6316
 epoch: 64, train_loss: 0.4822, test_loss: 1.1437, test_f1: 0.6048
 epoch: 65, train_loss: 0.4834, test_loss: 1.1304, test_f1: 0.6331
 epoch: 66, train_loss: 0.4518, test_loss: 1.1606, test_f1: 0.6340
 epoch: 67, train_loss: 0.4708, test_loss: 1.1224, test_f1: 0.6567
 epoch: 68, train_loss: 0.4608, test_loss: 1.1299, test_f1: 0.6256
 epoch: 69, train_loss: 0.4552, test_loss: 1.2080, test_f1: 0.6281
 epoch: 70, train_loss: 0.4574, test_loss: 1.1755, test_f1: 0.6230
 epoch: 71, train_loss: 0.4504, test_loss: 1.2525, test_f1: 0.6502
 epoch: 72, train_loss: 0.4509, test_loss: 1.1045, test_f1: 0.6635
 epoch: 73, train_loss: 0.4423, test_loss: 1.1597, test_f1: 0.6358
 epoch: 74, train_loss: 0.4469, test_loss: 1.2300, test_f1: 0.6217
 epoch: 75, train_loss: 0.4362, test_loss: 1.2339, test_f1: 0.5931
 epoch: 76, train_loss: 0.4225, test_loss: 1.2423, test_f1: 0.6020
 epoch: 77, train_loss: 0.4415, test_loss: 1.2868, test_f1: 0.5948
 epoch: 78, train_loss: 0.4330, test_loss: 1.2191, test_f1: 0.6318
 epoch: 79, train_loss: 0.4248, test_loss: 1.1826, test_f1: 0.6388
 epoch: 80, train_loss: 0.4229, test_loss: 1.2454, test_f1: 0.6213
 epoch: 81, train_loss: 0.4243, test_loss: 1.2732, test_f1: 0.6352
 epoch: 82, train_loss: 0.4117, test_loss: 1.2498, test_f1: 0.6020
 epoch: 83, train_loss: 0.4196, test_loss: 1.2642, test_f1: 0.6283
 epoch: 84, train_loss: 0.4145, test_loss: 1.2652, test_f1: 0.6273
 epoch: 85, train_loss: 0.4258, test_loss: 1.3171, test_f1: 0.6057
 epoch: 86, train_loss: 0.4084, test_loss: 1.2413, test_f1: 0.6415
 epoch: 87, train_loss: 0.3903, test_loss: 1.3127, test_f1: 0.6054
 epoch: 88, train_loss: 0.4234, test_loss: 1.2553, test_f1: 0.6180
 epoch: 89, train_loss: 0.4200, test_loss: 1.2726, test_f1: 0.6362
 epoch: 90, train_loss: 0.4111, test_loss: 1.2467, test_f1: 0.6319
 epoch: 91, train_loss: 0.3913, test_loss: 1.2626, test_f1: 0.6131
 epoch: 92, train_loss: 0.3798, test_loss: 1.3103, test_f1: 0.6189
 epoch: 93, train_loss: 0.3768, test_loss: 1.2745, test_f1: 0.6348
 epoch: 94, train_loss: 0.3754, test_loss: 1.3918, test_f1: 0.6009
 epoch: 95, train_loss: 0.3758, test_loss: 1.3044, test_f1: 0.6175
 epoch: 96, train_loss: 0.3882, test_loss: 1.3662, test_f1: 0.6116
 epoch: 97, train_loss: 0.3810, test_loss: 1.3797, test_f1: 0.6225
 epoch: 98, train_loss: 0.3686, test_loss: 1.2954, test_f1: 0.6317
 epoch: 99, train_loss: 0.3807, test_loss: 1.4181, test_f1: 0.5988
##################ITERATION #1 ****************************************
 epoch: 0, train_loss: 1.2558, test_loss: 1.2930, test_f1: 0.2614
 epoch: 1, train_loss: 1.1781, test_loss: 1.2269, test_f1: 0.4075
 epoch: 2, train_loss: 1.1316, test_loss: 1.1870, test_f1: 0.4268
 epoch: 3, train_loss: 1.0720, test_loss: 1.1359, test_f1: 0.4276
 epoch: 4, train_loss: 1.0285, test_loss: 1.0980, test_f1: 0.4942
 epoch: 5, train_loss: 0.9865, test_loss: 1.0515, test_f1: 0.5292
 epoch: 6, train_loss: 0.9526, test_loss: 1.0407, test_f1: 0.5418
 epoch: 7, train_loss: 0.9198, test_loss: 1.0226, test_f1: 0.5444
 epoch: 8, train_loss: 0.9063, test_loss: 1.0180, test_f1: 0.5775
 epoch: 9, train_loss: 0.8756, test_loss: 1.0020, test_f1: 0.5901
 epoch: 10, train_loss: 0.8598, test_loss: 1.0041, test_f1: 0.5942
 epoch: 11, train_loss: 0.8426, test_loss: 0.9748, test_f1: 0.5974
 epoch: 12, train_loss: 0.8314, test_loss: 0.9793, test_f1: 0.5653
 epoch: 13, train_loss: 0.7991, test_loss: 0.9850, test_f1: 0.5822
 epoch: 14, train_loss: 0.7814, test_loss: 0.9857, test_f1: 0.5926
 epoch: 15, train_loss: 0.7758, test_loss: 0.9711, test_f1: 0.5760
 epoch: 16, train_loss: 0.7557, test_loss: 0.9819, test_f1: 0.5756
 epoch: 17, train_loss: 0.7398, test_loss: 1.0133, test_f1: 0.5695
 epoch: 18, train_loss: 0.7406, test_loss: 1.0170, test_f1: 0.5838
 epoch: 19, train_loss: 0.7221, test_loss: 1.0230, test_f1: 0.5804
 epoch: 20, train_loss: 0.7076, test_loss: 1.0108, test_f1: 0.6052
 epoch: 21, train_loss: 0.7079, test_loss: 0.9620, test_f1: 0.6010
 epoch: 22, train_loss: 0.6728, test_loss: 1.0213, test_f1: 0.6040
 epoch: 23, train_loss: 0.6750, test_loss: 1.0348, test_f1: 0.5985
 epoch: 24, train_loss: 0.6606, test_loss: 1.0672, test_f1: 0.5886
 epoch: 25, train_loss: 0.6603, test_loss: 1.0642, test_f1: 0.5640
 epoch: 26, train_loss: 0.6348, test_loss: 1.0032, test_f1: 0.6000
 epoch: 27, train_loss: 0.6458, test_loss: 1.0396, test_f1: 0.5774
 epoch: 28, train_loss: 0.6321, test_loss: 1.0132, test_f1: 0.5947
 epoch: 29, train_loss: 0.6113, test_loss: 1.0736, test_f1: 0.6050
 epoch: 30, train_loss: 0.6064, test_loss: 0.9999, test_f1: 0.5989
 epoch: 31, train_loss: 0.5859, test_loss: 1.0742, test_f1: 0.6082
 epoch: 32, train_loss: 0.5886, test_loss: 1.0592, test_f1: 0.5767
 epoch: 33, train_loss: 0.5824, test_loss: 1.0618, test_f1: 0.5898
 epoch: 34, train_loss: 0.5691, test_loss: 1.0862, test_f1: 0.5954
 epoch: 35, train_loss: 0.5803, test_loss: 1.1216, test_f1: 0.5957
 epoch: 36, train_loss: 0.5628, test_loss: 1.1574, test_f1: 0.5745
 epoch: 37, train_loss: 0.5593, test_loss: 1.1949, test_f1: 0.5809
 epoch: 38, train_loss: 0.5350, test_loss: 1.1178, test_f1: 0.5972
 epoch: 39, train_loss: 0.5343, test_loss: 1.1078, test_f1: 0.5953
 epoch: 40, train_loss: 0.5377, test_loss: 1.1794, test_f1: 0.6198
 epoch: 41, train_loss: 0.5068, test_loss: 1.2034, test_f1: 0.5771
 epoch: 42, train_loss: 0.4973, test_loss: 1.1735, test_f1: 0.5832
 epoch: 43, train_loss: 0.4944, test_loss: 1.2370, test_f1: 0.5663
 epoch: 44, train_loss: 0.5157, test_loss: 1.1097, test_f1: 0.5962
 epoch: 45, train_loss: 0.4933, test_loss: 1.2594, test_f1: 0.5859
 epoch: 46, train_loss: 0.4991, test_loss: 1.2704, test_f1: 0.5842
 epoch: 47, train_loss: 0.4700, test_loss: 1.3400, test_f1: 0.5817
 epoch: 48, train_loss: 0.4698, test_loss: 1.3231, test_f1: 0.5813
 epoch: 49, train_loss: 0.4675, test_loss: 1.2905, test_f1: 0.5800
 epoch: 50, train_loss: 0.4598, test_loss: 1.3870, test_f1: 0.5951
 epoch: 51, train_loss: 0.4371, test_loss: 1.3525, test_f1: 0.5926
 epoch: 52, train_loss: 0.4318, test_loss: 1.3461, test_f1: 0.5921
 epoch: 53, train_loss: 0.4232, test_loss: 1.3733, test_f1: 0.5675
 epoch: 54, train_loss: 0.4286, test_loss: 1.3808, test_f1: 0.5894
 epoch: 55, train_loss: 0.4276, test_loss: 1.3391, test_f1: 0.5936
 epoch: 56, train_loss: 0.4156, test_loss: 1.3966, test_f1: 0.5868
 epoch: 57, train_loss: 0.4267, test_loss: 1.3964, test_f1: 0.5855
 epoch: 58, train_loss: 0.4028, test_loss: 1.3965, test_f1: 0.5898
 epoch: 59, train_loss: 0.3926, test_loss: 1.3718, test_f1: 0.5818
 epoch: 60, train_loss: 0.4109, test_loss: 1.3337, test_f1: 0.6076
 epoch: 61, train_loss: 0.3960, test_loss: 1.3788, test_f1: 0.5875
 epoch: 62, train_loss: 0.3817, test_loss: 1.4235, test_f1: 0.5996
 epoch: 63, train_loss: 0.3800, test_loss: 1.4127, test_f1: 0.5920
 epoch: 64, train_loss: 0.3882, test_loss: 1.3609, test_f1: 0.6112
 epoch: 65, train_loss: 0.3860, test_loss: 1.4845, test_f1: 0.5986
 epoch: 66, train_loss: 0.3670, test_loss: 1.5179, test_f1: 0.5924
 epoch: 67, train_loss: 0.3643, test_loss: 1.5188, test_f1: 0.5893
 epoch: 68, train_loss: 0.3653, test_loss: 1.4966, test_f1: 0.5841
 epoch: 69, train_loss: 0.3690, test_loss: 1.5321, test_f1: 0.6091
 epoch: 70, train_loss: 0.3719, test_loss: 1.5568, test_f1: 0.6005
 epoch: 71, train_loss: 0.3686, test_loss: 1.5581, test_f1: 0.5867
 epoch: 72, train_loss: 0.3591, test_loss: 1.6126, test_f1: 0.5827
 epoch: 73, train_loss: 0.3574, test_loss: 1.6124, test_f1: 0.6019
 epoch: 74, train_loss: 0.3515, test_loss: 1.6284, test_f1: 0.5978
 epoch: 75, train_loss: 0.3471, test_loss: 1.6647, test_f1: 0.5793
 epoch: 76, train_loss: 0.3425, test_loss: 1.6384, test_f1: 0.6088
 epoch: 77, train_loss: 0.3430, test_loss: 1.6501, test_f1: 0.6116
 epoch: 78, train_loss: 0.3198, test_loss: 1.7271, test_f1: 0.5812
 epoch: 79, train_loss: 0.3204, test_loss: 1.6499, test_f1: 0.6009
 epoch: 80, train_loss: 0.3180, test_loss: 1.6327, test_f1: 0.5857
 epoch: 81, train_loss: 0.3242, test_loss: 1.7462, test_f1: 0.6077
 epoch: 82, train_loss: 0.3337, test_loss: 1.7371, test_f1: 0.6030
 epoch: 83, train_loss: 0.3453, test_loss: 1.7099, test_f1: 0.5984
 epoch: 84, train_loss: 0.3165, test_loss: 1.7978, test_f1: 0.5921
 epoch: 85, train_loss: 0.3214, test_loss: 1.7587, test_f1: 0.6081
 epoch: 86, train_loss: 0.3149, test_loss: 1.8021, test_f1: 0.5847
 epoch: 87, train_loss: 0.3079, test_loss: 1.8165, test_f1: 0.5984
 epoch: 88, train_loss: 0.3174, test_loss: 1.7088, test_f1: 0.6128
 epoch: 89, train_loss: 0.3185, test_loss: 1.7153, test_f1: 0.5986
 epoch: 90, train_loss: 0.2977, test_loss: 1.8716, test_f1: 0.5958
 epoch: 91, train_loss: 0.3047, test_loss: 1.8188, test_f1: 0.6061
 epoch: 92, train_loss: 0.2885, test_loss: 1.9469, test_f1: 0.5840
 epoch: 93, train_loss: 0.2953, test_loss: 1.7978, test_f1: 0.5977
 epoch: 94, train_loss: 0.2821, test_loss: 1.8809, test_f1: 0.5896
 epoch: 95, train_loss: 0.2753, test_loss: 1.7882, test_f1: 0.6051
 epoch: 96, train_loss: 0.2959, test_loss: 1.8403, test_f1: 0.6058
 epoch: 97, train_loss: 0.2885, test_loss: 1.8354, test_f1: 0.6149
 epoch: 98, train_loss: 0.3070, test_loss: 1.8304, test_f1: 0.6023
 epoch: 99, train_loss: 0.2882, test_loss: 2.0879, test_f1: 0.6023
##################ITERATION #2 ****************************************
 epoch: 0, train_loss: 1.2206, test_loss: 1.2587, test_f1: 0.3556
 epoch: 1, train_loss: 1.1261, test_loss: 1.1740, test_f1: 0.4468
 epoch: 2, train_loss: 1.0788, test_loss: 1.1343, test_f1: 0.4489
 epoch: 3, train_loss: 1.0381, test_loss: 1.1021, test_f1: 0.5102
 epoch: 4, train_loss: 1.0010, test_loss: 1.0643, test_f1: 0.4938
 epoch: 5, train_loss: 0.9676, test_loss: 1.0223, test_f1: 0.5660
 epoch: 6, train_loss: 0.9312, test_loss: 0.9955, test_f1: 0.5645
 epoch: 7, train_loss: 0.9141, test_loss: 0.9786, test_f1: 0.5943
 epoch: 8, train_loss: 0.8873, test_loss: 0.9681, test_f1: 0.5993
 epoch: 9, train_loss: 0.8678, test_loss: 0.9554, test_f1: 0.5907
 epoch: 10, train_loss: 0.8425, test_loss: 0.9470, test_f1: 0.5916
 epoch: 11, train_loss: 0.8253, test_loss: 0.9394, test_f1: 0.6039
 epoch: 12, train_loss: 0.8053, test_loss: 0.9468, test_f1: 0.6143
 epoch: 13, train_loss: 0.7968, test_loss: 0.9475, test_f1: 0.6268
 epoch: 14, train_loss: 0.7758, test_loss: 0.9378, test_f1: 0.6170
 epoch: 15, train_loss: 0.7457, test_loss: 0.9571, test_f1: 0.6034
 epoch: 16, train_loss: 0.7492, test_loss: 0.9455, test_f1: 0.6385
 epoch: 17, train_loss: 0.7265, test_loss: 0.9599, test_f1: 0.6091
 epoch: 18, train_loss: 0.7169, test_loss: 1.0075, test_f1: 0.5908
 epoch: 19, train_loss: 0.7067, test_loss: 0.9926, test_f1: 0.5928
 epoch: 20, train_loss: 0.6933, test_loss: 0.9852, test_f1: 0.6113
 epoch: 21, train_loss: 0.7000, test_loss: 0.9689, test_f1: 0.6016
 epoch: 22, train_loss: 0.6806, test_loss: 1.0522, test_f1: 0.6117
 epoch: 23, train_loss: 0.6737, test_loss: 1.0301, test_f1: 0.6037
 epoch: 24, train_loss: 0.6626, test_loss: 1.0005, test_f1: 0.6273
 epoch: 25, train_loss: 0.6515, test_loss: 1.0236, test_f1: 0.6184
 epoch: 26, train_loss: 0.6547, test_loss: 1.0430, test_f1: 0.6167
 epoch: 27, train_loss: 0.6249, test_loss: 1.0922, test_f1: 0.6181
 epoch: 28, train_loss: 0.6374, test_loss: 1.0513, test_f1: 0.6294
 epoch: 29, train_loss: 0.6317, test_loss: 1.0461, test_f1: 0.6186
 epoch: 30, train_loss: 0.6080, test_loss: 1.0441, test_f1: 0.6015
 epoch: 31, train_loss: 0.5962, test_loss: 1.0667, test_f1: 0.6008
 epoch: 32, train_loss: 0.5933, test_loss: 1.1315, test_f1: 0.5818
 epoch: 33, train_loss: 0.5856, test_loss: 1.0631, test_f1: 0.6140
 epoch: 34, train_loss: 0.5870, test_loss: 1.0707, test_f1: 0.6005
 epoch: 35, train_loss: 0.5772, test_loss: 1.2022, test_f1: 0.6075
 epoch: 36, train_loss: 0.5666, test_loss: 1.0875, test_f1: 0.6052
 epoch: 37, train_loss: 0.5615, test_loss: 1.1377, test_f1: 0.5966
 epoch: 38, train_loss: 0.5435, test_loss: 1.2264, test_f1: 0.5704
 epoch: 39, train_loss: 0.5381, test_loss: 1.1761, test_f1: 0.5727
 epoch: 40, train_loss: 0.5558, test_loss: 1.1103, test_f1: 0.6135
 epoch: 41, train_loss: 0.5347, test_loss: 1.1959, test_f1: 0.5939
 epoch: 42, train_loss: 0.5336, test_loss: 1.1695, test_f1: 0.6058
 epoch: 43, train_loss: 0.5159, test_loss: 1.2528, test_f1: 0.6049
 epoch: 44, train_loss: 0.5221, test_loss: 1.2500, test_f1: 0.5922
 epoch: 45, train_loss: 0.5178, test_loss: 1.2650, test_f1: 0.5909
 epoch: 46, train_loss: 0.5118, test_loss: 1.2237, test_f1: 0.6007
 epoch: 47, train_loss: 0.4846, test_loss: 1.3296, test_f1: 0.5814
 epoch: 48, train_loss: 0.4896, test_loss: 1.2499, test_f1: 0.5974
 epoch: 49, train_loss: 0.4917, test_loss: 1.2328, test_f1: 0.5938
 epoch: 50, train_loss: 0.4766, test_loss: 1.1623, test_f1: 0.6204
 epoch: 51, train_loss: 0.4712, test_loss: 1.2220, test_f1: 0.6158
 epoch: 52, train_loss: 0.4379, test_loss: 1.3073, test_f1: 0.6053
 epoch: 53, train_loss: 0.4407, test_loss: 1.3056, test_f1: 0.6099
 epoch: 54, train_loss: 0.4400, test_loss: 1.3417, test_f1: 0.5945
 epoch: 55, train_loss: 0.4434, test_loss: 1.4064, test_f1: 0.6017
 epoch: 56, train_loss: 0.4408, test_loss: 1.2661, test_f1: 0.5973
 epoch: 57, train_loss: 0.4321, test_loss: 1.3157, test_f1: 0.5950
 epoch: 58, train_loss: 0.4129, test_loss: 1.3409, test_f1: 0.5903
 epoch: 59, train_loss: 0.4328, test_loss: 1.4658, test_f1: 0.6051
 epoch: 60, train_loss: 0.4142, test_loss: 1.3230, test_f1: 0.6076
 epoch: 61, train_loss: 0.4074, test_loss: 1.4569, test_f1: 0.5898
 epoch: 62, train_loss: 0.4104, test_loss: 1.3771, test_f1: 0.6023
 epoch: 63, train_loss: 0.3995, test_loss: 1.4157, test_f1: 0.6414
 epoch: 64, train_loss: 0.4192, test_loss: 1.3663, test_f1: 0.6002
 epoch: 65, train_loss: 0.3978, test_loss: 1.3917, test_f1: 0.5777
 epoch: 66, train_loss: 0.3939, test_loss: 1.3478, test_f1: 0.5730
 epoch: 67, train_loss: 0.3949, test_loss: 1.4335, test_f1: 0.5867
 epoch: 68, train_loss: 0.3940, test_loss: 1.5292, test_f1: 0.5853
 epoch: 69, train_loss: 0.3935, test_loss: 1.4170, test_f1: 0.5789
 epoch: 70, train_loss: 0.3905, test_loss: 1.4804, test_f1: 0.6001
 epoch: 71, train_loss: 0.3787, test_loss: 1.3986, test_f1: 0.5899
 epoch: 72, train_loss: 0.3650, test_loss: 1.5738, test_f1: 0.6065
 epoch: 73, train_loss: 0.3748, test_loss: 1.4678, test_f1: 0.5856
 epoch: 74, train_loss: 0.3607, test_loss: 1.4631, test_f1: 0.5982
 epoch: 75, train_loss: 0.3537, test_loss: 1.4985, test_f1: 0.5927
 epoch: 76, train_loss: 0.3469, test_loss: 1.4637, test_f1: 0.5774
 epoch: 77, train_loss: 0.3533, test_loss: 1.5593, test_f1: 0.5721
 epoch: 78, train_loss: 0.3545, test_loss: 1.5140, test_f1: 0.5849
 epoch: 79, train_loss: 0.3681, test_loss: 1.5543, test_f1: 0.5832
 epoch: 80, train_loss: 0.3659, test_loss: 1.6490, test_f1: 0.5621
 epoch: 81, train_loss: 0.3433, test_loss: 1.6399, test_f1: 0.5935
 epoch: 82, train_loss: 0.3444, test_loss: 1.6254, test_f1: 0.5979
 epoch: 83, train_loss: 0.3429, test_loss: 1.7659, test_f1: 0.5613
 epoch: 84, train_loss: 0.3493, test_loss: 1.6036, test_f1: 0.5769
 epoch: 85, train_loss: 0.3364, test_loss: 1.5550, test_f1: 0.5806
 epoch: 86, train_loss: 0.3379, test_loss: 1.7165, test_f1: 0.5741
 epoch: 87, train_loss: 0.3386, test_loss: 1.6272, test_f1: 0.5864
 epoch: 88, train_loss: 0.3321, test_loss: 1.6227, test_f1: 0.5902
 epoch: 89, train_loss: 0.2997, test_loss: 1.6564, test_f1: 0.5905
 epoch: 90, train_loss: 0.3125, test_loss: 1.7488, test_f1: 0.5791
 epoch: 91, train_loss: 0.3196, test_loss: 1.6440, test_f1: 0.5768
 epoch: 92, train_loss: 0.3433, test_loss: 1.7751, test_f1: 0.5875
 epoch: 93, train_loss: 0.3090, test_loss: 1.6314, test_f1: 0.5906
 epoch: 94, train_loss: 0.2835, test_loss: 1.6763, test_f1: 0.5763
 epoch: 95, train_loss: 0.2977, test_loss: 1.8371, test_f1: 0.5713
 epoch: 96, train_loss: 0.3164, test_loss: 1.7745, test_f1: 0.5728
 epoch: 97, train_loss: 0.3008, test_loss: 1.7511, test_f1: 0.5593
 epoch: 98, train_loss: 0.3006, test_loss: 1.7617, test_f1: 0.5666
 epoch: 99, train_loss: 0.3001, test_loss: 1.7901, test_f1: 0.5489
##################ITERATION #3 ****************************************
 epoch: 0, train_loss: 1.2059, test_loss: 1.2305, test_f1: 0.3198
 epoch: 1, train_loss: 1.0926, test_loss: 1.1187, test_f1: 0.4900
 epoch: 2, train_loss: 1.0382, test_loss: 1.0855, test_f1: 0.5177
 epoch: 3, train_loss: 0.9945, test_loss: 1.0479, test_f1: 0.5491
 epoch: 4, train_loss: 0.9558, test_loss: 1.0246, test_f1: 0.5510
 epoch: 5, train_loss: 0.9121, test_loss: 1.0091, test_f1: 0.5845
 epoch: 6, train_loss: 0.8825, test_loss: 0.9952, test_f1: 0.5871
 epoch: 7, train_loss: 0.8510, test_loss: 1.0091, test_f1: 0.5739
 epoch: 8, train_loss: 0.8391, test_loss: 0.9393, test_f1: 0.6166
 epoch: 9, train_loss: 0.8062, test_loss: 0.9762, test_f1: 0.5808
 epoch: 10, train_loss: 0.7854, test_loss: 0.9853, test_f1: 0.5700
 epoch: 11, train_loss: 0.7786, test_loss: 0.9853, test_f1: 0.5855
 epoch: 12, train_loss: 0.7511, test_loss: 0.9543, test_f1: 0.6067
 epoch: 13, train_loss: 0.7478, test_loss: 0.9270, test_f1: 0.6286
 epoch: 14, train_loss: 0.7256, test_loss: 1.0091, test_f1: 0.5984
 epoch: 15, train_loss: 0.7136, test_loss: 0.9557, test_f1: 0.6056
 epoch: 16, train_loss: 0.7212, test_loss: 0.9680, test_f1: 0.5721
 epoch: 17, train_loss: 0.6854, test_loss: 1.0017, test_f1: 0.5838
 epoch: 18, train_loss: 0.6722, test_loss: 0.9938, test_f1: 0.5595
 epoch: 19, train_loss: 0.6779, test_loss: 1.1019, test_f1: 0.5431
 epoch: 20, train_loss: 0.6715, test_loss: 0.9750, test_f1: 0.5798
 epoch: 21, train_loss: 0.6695, test_loss: 0.9460, test_f1: 0.6231
 epoch: 22, train_loss: 0.6506, test_loss: 0.9942, test_f1: 0.5995
 epoch: 23, train_loss: 0.6502, test_loss: 1.0278, test_f1: 0.5610
 epoch: 24, train_loss: 0.6352, test_loss: 1.0546, test_f1: 0.5714
 epoch: 25, train_loss: 0.6147, test_loss: 0.9892, test_f1: 0.5678
 epoch: 26, train_loss: 0.6168, test_loss: 0.9882, test_f1: 0.5839
 epoch: 27, train_loss: 0.6011, test_loss: 1.0691, test_f1: 0.5750
 epoch: 28, train_loss: 0.5846, test_loss: 1.0319, test_f1: 0.5906
 epoch: 29, train_loss: 0.5816, test_loss: 1.0273, test_f1: 0.6210
 epoch: 30, train_loss: 0.5716, test_loss: 1.0567, test_f1: 0.5837
 epoch: 31, train_loss: 0.5842, test_loss: 1.1327, test_f1: 0.5447
 epoch: 32, train_loss: 0.5526, test_loss: 1.0601, test_f1: 0.5683
 epoch: 33, train_loss: 0.5571, test_loss: 0.9927, test_f1: 0.6048
 epoch: 34, train_loss: 0.5445, test_loss: 1.0642, test_f1: 0.5775
 epoch: 35, train_loss: 0.5374, test_loss: 1.1077, test_f1: 0.5952
 epoch: 36, train_loss: 0.5477, test_loss: 1.1062, test_f1: 0.6274
 epoch: 37, train_loss: 0.5360, test_loss: 1.1196, test_f1: 0.6312
 epoch: 38, train_loss: 0.5311, test_loss: 1.1111, test_f1: 0.5980
 epoch: 39, train_loss: 0.5407, test_loss: 1.1638, test_f1: 0.5982
 epoch: 40, train_loss: 0.5078, test_loss: 1.1606, test_f1: 0.6206
 epoch: 41, train_loss: 0.5115, test_loss: 1.1549, test_f1: 0.6037
 epoch: 42, train_loss: 0.4943, test_loss: 1.1350, test_f1: 0.5831
 epoch: 43, train_loss: 0.5029, test_loss: 1.1926, test_f1: 0.5688
 epoch: 44, train_loss: 0.4975, test_loss: 1.1452, test_f1: 0.6059
 epoch: 45, train_loss: 0.4676, test_loss: 1.2273, test_f1: 0.5847
 epoch: 46, train_loss: 0.4745, test_loss: 1.2467, test_f1: 0.5797
 epoch: 47, train_loss: 0.4696, test_loss: 1.2673, test_f1: 0.6165
 epoch: 48, train_loss: 0.4703, test_loss: 1.2613, test_f1: 0.5756
 epoch: 49, train_loss: 0.4707, test_loss: 1.2867, test_f1: 0.5850
 epoch: 50, train_loss: 0.4504, test_loss: 1.4255, test_f1: 0.5972
 epoch: 51, train_loss: 0.4425, test_loss: 1.3773, test_f1: 0.5907
 epoch: 52, train_loss: 0.4432, test_loss: 1.4096, test_f1: 0.5986
 epoch: 53, train_loss: 0.4414, test_loss: 1.3304, test_f1: 0.5769
 epoch: 54, train_loss: 0.4173, test_loss: 1.3725, test_f1: 0.6032
 epoch: 55, train_loss: 0.4172, test_loss: 1.3297, test_f1: 0.6124
 epoch: 56, train_loss: 0.4056, test_loss: 1.3684, test_f1: 0.5861
 epoch: 57, train_loss: 0.4017, test_loss: 1.4425, test_f1: 0.5990
 epoch: 58, train_loss: 0.4045, test_loss: 1.4071, test_f1: 0.5981
 epoch: 59, train_loss: 0.4003, test_loss: 1.3802, test_f1: 0.5762
 epoch: 60, train_loss: 0.4023, test_loss: 1.4708, test_f1: 0.6006
 epoch: 61, train_loss: 0.3856, test_loss: 1.5017, test_f1: 0.5916
 epoch: 62, train_loss: 0.3924, test_loss: 1.3909, test_f1: 0.6151
 epoch: 63, train_loss: 0.4015, test_loss: 1.5052, test_f1: 0.6009
 epoch: 64, train_loss: 0.3839, test_loss: 1.4454, test_f1: 0.5924
 epoch: 65, train_loss: 0.3923, test_loss: 1.5917, test_f1: 0.6083
 epoch: 66, train_loss: 0.3876, test_loss: 1.5646, test_f1: 0.5936
 epoch: 67, train_loss: 0.3622, test_loss: 1.5849, test_f1: 0.5860
 epoch: 68, train_loss: 0.3543, test_loss: 1.5627, test_f1: 0.5772
 epoch: 69, train_loss: 0.3557, test_loss: 1.5352, test_f1: 0.6225
 epoch: 70, train_loss: 0.3570, test_loss: 1.6776, test_f1: 0.5753
 epoch: 71, train_loss: 0.3711, test_loss: 1.4581, test_f1: 0.5993
 epoch: 72, train_loss: 0.3487, test_loss: 1.5914, test_f1: 0.6060
 epoch: 73, train_loss: 0.3632, test_loss: 1.6029, test_f1: 0.6119
 epoch: 74, train_loss: 0.3664, test_loss: 1.7958, test_f1: 0.5919
 epoch: 75, train_loss: 0.3509, test_loss: 1.7006, test_f1: 0.6132
 epoch: 76, train_loss: 0.3555, test_loss: 1.6687, test_f1: 0.5939
 epoch: 77, train_loss: 0.3540, test_loss: 1.6718, test_f1: 0.6013
 epoch: 78, train_loss: 0.3411, test_loss: 1.6519, test_f1: 0.6077
 epoch: 79, train_loss: 0.3407, test_loss: 1.7457, test_f1: 0.6146
 epoch: 80, train_loss: 0.3485, test_loss: 1.7622, test_f1: 0.6035
 epoch: 81, train_loss: 0.3218, test_loss: 1.7668, test_f1: 0.6182
 epoch: 82, train_loss: 0.3119, test_loss: 1.7442, test_f1: 0.6154
 epoch: 83, train_loss: 0.3371, test_loss: 1.8554, test_f1: 0.6045
 epoch: 84, train_loss: 0.3303, test_loss: 1.6916, test_f1: 0.6067
 epoch: 85, train_loss: 0.3073, test_loss: 1.8399, test_f1: 0.6065
 epoch: 86, train_loss: 0.3074, test_loss: 1.8471, test_f1: 0.5819
 epoch: 87, train_loss: 0.3221, test_loss: 2.0035, test_f1: 0.5844
 epoch: 88, train_loss: 0.3175, test_loss: 1.9375, test_f1: 0.5976
 epoch: 89, train_loss: 0.3155, test_loss: 1.9383, test_f1: 0.5990
 epoch: 90, train_loss: 0.3157, test_loss: 1.9615, test_f1: 0.5731
 epoch: 91, train_loss: 0.3017, test_loss: 2.0464, test_f1: 0.6032
 epoch: 92, train_loss: 0.3271, test_loss: 2.0979, test_f1: 0.5865
 epoch: 93, train_loss: 0.3031, test_loss: 2.0708, test_f1: 0.6057
 epoch: 94, train_loss: 0.3043, test_loss: 2.0300, test_f1: 0.6105
 epoch: 95, train_loss: 0.2947, test_loss: 1.9212, test_f1: 0.5959
 epoch: 96, train_loss: 0.3016, test_loss: 1.9105, test_f1: 0.5989
 epoch: 97, train_loss: 0.2980, test_loss: 2.1119, test_f1: 0.5753
 epoch: 98, train_loss: 0.2785, test_loss: 2.0141, test_f1: 0.5976
 epoch: 99, train_loss: 0.2672, test_loss: 1.9956, test_f1: 0.6058
##################ITERATION #4 ****************************************
 epoch: 0, train_loss: 1.1926, test_loss: 1.2102, test_f1: 0.3548
 epoch: 1, train_loss: 1.0809, test_loss: 1.1018, test_f1: 0.5079
 epoch: 2, train_loss: 1.0063, test_loss: 1.0630, test_f1: 0.5204
 epoch: 3, train_loss: 0.9804, test_loss: 1.0288, test_f1: 0.5254
 epoch: 4, train_loss: 0.9455, test_loss: 1.0005, test_f1: 0.5576
 epoch: 5, train_loss: 0.9180, test_loss: 1.0030, test_f1: 0.5224
 epoch: 6, train_loss: 0.8962, test_loss: 0.9744, test_f1: 0.5720
 epoch: 7, train_loss: 0.8780, test_loss: 0.9562, test_f1: 0.5808
 epoch: 8, train_loss: 0.8399, test_loss: 0.9701, test_f1: 0.5532
 epoch: 9, train_loss: 0.8220, test_loss: 0.9707, test_f1: 0.5547
 epoch: 10, train_loss: 0.8128, test_loss: 0.9586, test_f1: 0.5765
 epoch: 11, train_loss: 0.7944, test_loss: 0.9746, test_f1: 0.5660
 epoch: 12, train_loss: 0.7717, test_loss: 0.9800, test_f1: 0.5616
 epoch: 13, train_loss: 0.7541, test_loss: 1.0008, test_f1: 0.5814
 epoch: 14, train_loss: 0.7401, test_loss: 1.0427, test_f1: 0.5416
 epoch: 15, train_loss: 0.7358, test_loss: 0.9812, test_f1: 0.5698
 epoch: 16, train_loss: 0.7230, test_loss: 0.9749, test_f1: 0.5991
 epoch: 17, train_loss: 0.6892, test_loss: 1.0177, test_f1: 0.6226
 epoch: 18, train_loss: 0.7018, test_loss: 1.0415, test_f1: 0.6195
 epoch: 19, train_loss: 0.6924, test_loss: 1.0487, test_f1: 0.5994
 epoch: 20, train_loss: 0.6680, test_loss: 1.0795, test_f1: 0.6039
 epoch: 21, train_loss: 0.6633, test_loss: 1.0175, test_f1: 0.6056
 epoch: 22, train_loss: 0.6504, test_loss: 1.0747, test_f1: 0.6111
 epoch: 23, train_loss: 0.6526, test_loss: 1.0530, test_f1: 0.5818
 epoch: 24, train_loss: 0.6295, test_loss: 1.0971, test_f1: 0.5956
 epoch: 25, train_loss: 0.6239, test_loss: 1.1495, test_f1: 0.5606
 epoch: 26, train_loss: 0.6221, test_loss: 1.0508, test_f1: 0.6404
 epoch: 27, train_loss: 0.5989, test_loss: 1.1265, test_f1: 0.6166
 epoch: 28, train_loss: 0.5973, test_loss: 1.1760, test_f1: 0.6071
 epoch: 29, train_loss: 0.5907, test_loss: 1.1839, test_f1: 0.5575
 epoch: 30, train_loss: 0.5768, test_loss: 1.2459, test_f1: 0.5562
 epoch: 31, train_loss: 0.5820, test_loss: 1.1694, test_f1: 0.5887
 epoch: 32, train_loss: 0.5610, test_loss: 1.2408, test_f1: 0.5987
 epoch: 33, train_loss: 0.5544, test_loss: 1.1963, test_f1: 0.6002
 epoch: 34, train_loss: 0.5469, test_loss: 1.2090, test_f1: 0.5966
 epoch: 35, train_loss: 0.5445, test_loss: 1.3248, test_f1: 0.6098
 epoch: 36, train_loss: 0.5404, test_loss: 1.2619, test_f1: 0.5919
 epoch: 37, train_loss: 0.5471, test_loss: 1.4317, test_f1: 0.5721
 epoch: 38, train_loss: 0.5328, test_loss: 1.2808, test_f1: 0.6029
 epoch: 39, train_loss: 0.5265, test_loss: 1.3367, test_f1: 0.6222
 epoch: 40, train_loss: 0.5249, test_loss: 1.1959, test_f1: 0.6069
 epoch: 41, train_loss: 0.5262, test_loss: 1.3715, test_f1: 0.6009
 epoch: 42, train_loss: 0.4813, test_loss: 1.3881, test_f1: 0.6095
 epoch: 43, train_loss: 0.4984, test_loss: 1.3338, test_f1: 0.6044
 epoch: 44, train_loss: 0.4756, test_loss: 1.3466, test_f1: 0.6008
 epoch: 45, train_loss: 0.4879, test_loss: 1.4540, test_f1: 0.5995
 epoch: 46, train_loss: 0.4904, test_loss: 1.3817, test_f1: 0.5804
 epoch: 47, train_loss: 0.4747, test_loss: 1.4427, test_f1: 0.6168
 epoch: 48, train_loss: 0.4784, test_loss: 1.5726, test_f1: 0.6017
 epoch: 49, train_loss: 0.4375, test_loss: 1.4800, test_f1: 0.6018
 epoch: 50, train_loss: 0.4724, test_loss: 1.4055, test_f1: 0.6032
 epoch: 51, train_loss: 0.4459, test_loss: 1.3731, test_f1: 0.6033
 epoch: 52, train_loss: 0.4228, test_loss: 1.5190, test_f1: 0.5893
 epoch: 53, train_loss: 0.4171, test_loss: 1.5271, test_f1: 0.6039
 epoch: 54, train_loss: 0.4169, test_loss: 1.5504, test_f1: 0.5811
 epoch: 55, train_loss: 0.4152, test_loss: 1.5055, test_f1: 0.5887
 epoch: 56, train_loss: 0.3980, test_loss: 1.5339, test_f1: 0.5890
 epoch: 57, train_loss: 0.4014, test_loss: 1.5449, test_f1: 0.5777
 epoch: 58, train_loss: 0.4289, test_loss: 1.6276, test_f1: 0.5922
 epoch: 59, train_loss: 0.4083, test_loss: 1.5844, test_f1: 0.6087
 epoch: 60, train_loss: 0.3888, test_loss: 1.5764, test_f1: 0.6120
 epoch: 61, train_loss: 0.3821, test_loss: 1.6891, test_f1: 0.6008
 epoch: 62, train_loss: 0.3758, test_loss: 1.6775, test_f1: 0.5729
 epoch: 63, train_loss: 0.3853, test_loss: 1.6610, test_f1: 0.5957
 epoch: 64, train_loss: 0.3939, test_loss: 1.6702, test_f1: 0.5937
 epoch: 65, train_loss: 0.3747, test_loss: 1.6175, test_f1: 0.5999
 epoch: 66, train_loss: 0.3856, test_loss: 1.6822, test_f1: 0.5875
 epoch: 67, train_loss: 0.3656, test_loss: 1.6483, test_f1: 0.5927
 epoch: 68, train_loss: 0.3791, test_loss: 1.6797, test_f1: 0.5847
 epoch: 69, train_loss: 0.3584, test_loss: 1.6584, test_f1: 0.5947
 epoch: 70, train_loss: 0.3492, test_loss: 1.7973, test_f1: 0.5851
 epoch: 71, train_loss: 0.3615, test_loss: 1.8577, test_f1: 0.5737
 epoch: 72, train_loss: 0.3758, test_loss: 1.7113, test_f1: 0.6075
 epoch: 73, train_loss: 0.3470, test_loss: 1.7105, test_f1: 0.5886
 epoch: 74, train_loss: 0.3510, test_loss: 1.7681, test_f1: 0.6026
 epoch: 75, train_loss: 0.3624, test_loss: 1.7786, test_f1: 0.6000
 epoch: 76, train_loss: 0.3338, test_loss: 1.7669, test_f1: 0.6031
 epoch: 77, train_loss: 0.3273, test_loss: 1.9153, test_f1: 0.5793
 epoch: 78, train_loss: 0.3249, test_loss: 1.8684, test_f1: 0.5640
 epoch: 79, train_loss: 0.3319, test_loss: 2.0497, test_f1: 0.5673
 epoch: 80, train_loss: 0.3350, test_loss: 1.8296, test_f1: 0.6055
 epoch: 81, train_loss: 0.3372, test_loss: 1.8839, test_f1: 0.5906
 epoch: 82, train_loss: 0.3263, test_loss: 1.8291, test_f1: 0.5692
 epoch: 83, train_loss: 0.3250, test_loss: 1.9184, test_f1: 0.5773
 epoch: 84, train_loss: 0.3227, test_loss: 1.9296, test_f1: 0.6002
 epoch: 85, train_loss: 0.3199, test_loss: 2.0438, test_f1: 0.5862
 epoch: 86, train_loss: 0.3193, test_loss: 2.0654, test_f1: 0.5726
 epoch: 87, train_loss: 0.3060, test_loss: 1.9407, test_f1: 0.5965
 epoch: 88, train_loss: 0.3088, test_loss: 1.9592, test_f1: 0.5835
 epoch: 89, train_loss: 0.2976, test_loss: 1.9375, test_f1: 0.5827
 epoch: 90, train_loss: 0.3039, test_loss: 1.8304, test_f1: 0.6038
 epoch: 91, train_loss: 0.2960, test_loss: 1.9876, test_f1: 0.5599
 epoch: 92, train_loss: 0.2994, test_loss: 2.0656, test_f1: 0.5888
 epoch: 93, train_loss: 0.2931, test_loss: 2.2073, test_f1: 0.5759
 epoch: 94, train_loss: 0.3027, test_loss: 2.1697, test_f1: 0.5796
 epoch: 95, train_loss: 0.2888, test_loss: 2.2542, test_f1: 0.5667
 epoch: 96, train_loss: 0.2954, test_loss: 2.2742, test_f1: 0.5745
 epoch: 97, train_loss: 0.2920, test_loss: 2.1886, test_f1: 0.5541
 epoch: 98, train_loss: 0.2669, test_loss: 2.0431, test_f1: 0.5856
 epoch: 99, train_loss: 0.2739, test_loss: 2.0400, test_f1: 0.5926
##################ITERATION #5 ****************************************
 epoch: 0, train_loss: 1.1831, test_loss: 1.2605, test_f1: 0.2754
 epoch: 1, train_loss: 1.0692, test_loss: 1.1012, test_f1: 0.5097
 epoch: 2, train_loss: 1.0173, test_loss: 1.0611, test_f1: 0.5303
 epoch: 3, train_loss: 0.9961, test_loss: 1.0322, test_f1: 0.5520
 epoch: 4, train_loss: 0.9419, test_loss: 1.0180, test_f1: 0.5361
 epoch: 5, train_loss: 0.9245, test_loss: 1.0258, test_f1: 0.5514
 epoch: 6, train_loss: 0.8974, test_loss: 1.0105, test_f1: 0.5725
 epoch: 7, train_loss: 0.8695, test_loss: 1.0021, test_f1: 0.5620
 epoch: 8, train_loss: 0.8500, test_loss: 1.0066, test_f1: 0.5604
 epoch: 9, train_loss: 0.8331, test_loss: 1.0057, test_f1: 0.5925
 epoch: 10, train_loss: 0.8372, test_loss: 0.9994, test_f1: 0.6264
 epoch: 11, train_loss: 0.8082, test_loss: 0.9935, test_f1: 0.6038
 epoch: 12, train_loss: 0.8022, test_loss: 0.9976, test_f1: 0.6210
 epoch: 13, train_loss: 0.7750, test_loss: 0.9833, test_f1: 0.6234
 epoch: 14, train_loss: 0.7696, test_loss: 1.0088, test_f1: 0.6051
 epoch: 15, train_loss: 0.7557, test_loss: 1.0192, test_f1: 0.5636
 epoch: 16, train_loss: 0.7359, test_loss: 0.9821, test_f1: 0.6257
 epoch: 17, train_loss: 0.7271, test_loss: 0.9717, test_f1: 0.6307
 epoch: 18, train_loss: 0.7227, test_loss: 1.0306, test_f1: 0.5821
 epoch: 19, train_loss: 0.7083, test_loss: 1.0029, test_f1: 0.6185
 epoch: 20, train_loss: 0.7027, test_loss: 1.0617, test_f1: 0.5992
 epoch: 21, train_loss: 0.6888, test_loss: 1.0849, test_f1: 0.5909
 epoch: 22, train_loss: 0.6836, test_loss: 1.0067, test_f1: 0.5943
 epoch: 23, train_loss: 0.6832, test_loss: 1.0421, test_f1: 0.5911
 epoch: 24, train_loss: 0.6658, test_loss: 0.9970, test_f1: 0.5985
 epoch: 25, train_loss: 0.6589, test_loss: 1.1681, test_f1: 0.5533
 epoch: 26, train_loss: 0.6446, test_loss: 1.0397, test_f1: 0.6054
 epoch: 27, train_loss: 0.6465, test_loss: 1.0482, test_f1: 0.6067
 epoch: 28, train_loss: 0.6325, test_loss: 1.1190, test_f1: 0.6102
 epoch: 29, train_loss: 0.6052, test_loss: 1.0289, test_f1: 0.6129
 epoch: 30, train_loss: 0.6285, test_loss: 1.0244, test_f1: 0.6160
 epoch: 31, train_loss: 0.6018, test_loss: 1.0874, test_f1: 0.6007
 epoch: 32, train_loss: 0.5794, test_loss: 1.0219, test_f1: 0.6047
 epoch: 33, train_loss: 0.5812, test_loss: 1.1543, test_f1: 0.5986
 epoch: 34, train_loss: 0.5812, test_loss: 1.1221, test_f1: 0.5867
 epoch: 35, train_loss: 0.5535, test_loss: 1.0859, test_f1: 0.5858
 epoch: 36, train_loss: 0.5757, test_loss: 1.1017, test_f1: 0.5916
 epoch: 37, train_loss: 0.5570, test_loss: 1.0607, test_f1: 0.6001
 epoch: 38, train_loss: 0.5481, test_loss: 1.0770, test_f1: 0.5809
 epoch: 39, train_loss: 0.5522, test_loss: 1.0771, test_f1: 0.6139
 epoch: 40, train_loss: 0.5325, test_loss: 1.1851, test_f1: 0.5782
 epoch: 41, train_loss: 0.5525, test_loss: 1.1634, test_f1: 0.5813
 epoch: 42, train_loss: 0.5234, test_loss: 1.0965, test_f1: 0.6037
 epoch: 43, train_loss: 0.5338, test_loss: 1.1247, test_f1: 0.6030
 epoch: 44, train_loss: 0.5226, test_loss: 1.0554, test_f1: 0.6427
 epoch: 45, train_loss: 0.5121, test_loss: 1.0962, test_f1: 0.6297
 epoch: 46, train_loss: 0.5085, test_loss: 1.1409, test_f1: 0.5894
 epoch: 47, train_loss: 0.4891, test_loss: 1.0991, test_f1: 0.6008
 epoch: 48, train_loss: 0.4814, test_loss: 1.2004, test_f1: 0.5893
 epoch: 49, train_loss: 0.4862, test_loss: 1.0854, test_f1: 0.6635
 epoch: 50, train_loss: 0.4766, test_loss: 1.1782, test_f1: 0.6246
 epoch: 51, train_loss: 0.4433, test_loss: 1.2021, test_f1: 0.6068
 epoch: 52, train_loss: 0.4594, test_loss: 1.2621, test_f1: 0.5961
 epoch: 53, train_loss: 0.4342, test_loss: 1.2256, test_f1: 0.6033
 epoch: 54, train_loss: 0.4178, test_loss: 1.2656, test_f1: 0.5993
 epoch: 55, train_loss: 0.4478, test_loss: 1.2715, test_f1: 0.6082
 epoch: 56, train_loss: 0.4288, test_loss: 1.2535, test_f1: 0.6030
 epoch: 57, train_loss: 0.4102, test_loss: 1.2884, test_f1: 0.6032
 epoch: 58, train_loss: 0.4470, test_loss: 1.3095, test_f1: 0.6132
 epoch: 59, train_loss: 0.4183, test_loss: 1.2795, test_f1: 0.6174
 epoch: 60, train_loss: 0.4045, test_loss: 1.3663, test_f1: 0.5972
 epoch: 61, train_loss: 0.4164, test_loss: 1.2871, test_f1: 0.6029
 epoch: 62, train_loss: 0.3968, test_loss: 1.3232, test_f1: 0.5918
 epoch: 63, train_loss: 0.4256, test_loss: 1.3996, test_f1: 0.6089
 epoch: 64, train_loss: 0.4025, test_loss: 1.3205, test_f1: 0.5946
 epoch: 65, train_loss: 0.3969, test_loss: 1.3703, test_f1: 0.6093
 epoch: 66, train_loss: 0.4186, test_loss: 1.3884, test_f1: 0.5944
 epoch: 67, train_loss: 0.4023, test_loss: 1.3425, test_f1: 0.6064
 epoch: 68, train_loss: 0.3847, test_loss: 1.2903, test_f1: 0.6029
 epoch: 69, train_loss: 0.4002, test_loss: 1.3379, test_f1: 0.6227
 epoch: 70, train_loss: 0.3909, test_loss: 1.3423, test_f1: 0.5921
 epoch: 71, train_loss: 0.3754, test_loss: 1.2951, test_f1: 0.6431
 epoch: 72, train_loss: 0.3734, test_loss: 1.4649, test_f1: 0.5895
 epoch: 73, train_loss: 0.3723, test_loss: 1.4565, test_f1: 0.5805
 epoch: 74, train_loss: 0.3804, test_loss: 1.4737, test_f1: 0.5831
 epoch: 75, train_loss: 0.3743, test_loss: 1.4839, test_f1: 0.6271
 epoch: 76, train_loss: 0.3845, test_loss: 1.4855, test_f1: 0.5931
 epoch: 77, train_loss: 0.3748, test_loss: 1.4804, test_f1: 0.5909
 epoch: 78, train_loss: 0.3865, test_loss: 1.4970, test_f1: 0.5892
 epoch: 79, train_loss: 0.3608, test_loss: 1.4104, test_f1: 0.6140
 epoch: 80, train_loss: 0.3662, test_loss: 1.4942, test_f1: 0.5864
 epoch: 81, train_loss: 0.3536, test_loss: 1.4916, test_f1: 0.5953
 epoch: 82, train_loss: 0.3676, test_loss: 1.4274, test_f1: 0.6311
 epoch: 83, train_loss: 0.3408, test_loss: 1.5090, test_f1: 0.6141
 epoch: 84, train_loss: 0.3437, test_loss: 1.5031, test_f1: 0.6168
 epoch: 85, train_loss: 0.3227, test_loss: 1.5750, test_f1: 0.5868
 epoch: 86, train_loss: 0.3288, test_loss: 1.5276, test_f1: 0.5947
 epoch: 87, train_loss: 0.3271, test_loss: 1.4820, test_f1: 0.6227
 epoch: 88, train_loss: 0.3184, test_loss: 1.5136, test_f1: 0.6115
 epoch: 89, train_loss: 0.3531, test_loss: 1.5010, test_f1: 0.6113
 epoch: 90, train_loss: 0.3529, test_loss: 1.5771, test_f1: 0.5920
 epoch: 91, train_loss: 0.3258, test_loss: 1.4907, test_f1: 0.6059
 epoch: 92, train_loss: 0.3264, test_loss: 1.4489, test_f1: 0.6448
 epoch: 93, train_loss: 0.3461, test_loss: 1.4697, test_f1: 0.6401
 epoch: 94, train_loss: 0.3083, test_loss: 1.5402, test_f1: 0.6214
 epoch: 95, train_loss: 0.3210, test_loss: 1.5179, test_f1: 0.6259
 epoch: 96, train_loss: 0.2988, test_loss: 1.5744, test_f1: 0.6379
 epoch: 97, train_loss: 0.3059, test_loss: 1.5682, test_f1: 0.6539
 epoch: 98, train_loss: 0.3141, test_loss: 1.5844, test_f1: 0.6077
 epoch: 99, train_loss: 0.2981, test_loss: 1.5526, test_f1: 0.6614
##################ITERATION #6 ****************************************
 epoch: 0, train_loss: 1.2251, test_loss: 1.2337, test_f1: 0.3441
 epoch: 1, train_loss: 1.0756, test_loss: 1.1303, test_f1: 0.5190
 epoch: 2, train_loss: 1.0400, test_loss: 1.1032, test_f1: 0.5439
 epoch: 3, train_loss: 0.9905, test_loss: 1.0570, test_f1: 0.5460
 epoch: 4, train_loss: 0.9694, test_loss: 1.0215, test_f1: 0.5646
 epoch: 5, train_loss: 0.9324, test_loss: 1.0408, test_f1: 0.5534
 epoch: 6, train_loss: 0.9043, test_loss: 0.9930, test_f1: 0.5750
 epoch: 7, train_loss: 0.8899, test_loss: 0.9819, test_f1: 0.5885
 epoch: 8, train_loss: 0.8745, test_loss: 0.9816, test_f1: 0.5900
 epoch: 9, train_loss: 0.8326, test_loss: 0.9795, test_f1: 0.6111
 epoch: 10, train_loss: 0.8192, test_loss: 0.9679, test_f1: 0.5946
 epoch: 11, train_loss: 0.8164, test_loss: 0.9587, test_f1: 0.5894
 epoch: 12, train_loss: 0.8103, test_loss: 0.9586, test_f1: 0.6261
 epoch: 13, train_loss: 0.7958, test_loss: 0.9594, test_f1: 0.6063
 epoch: 14, train_loss: 0.7755, test_loss: 0.9510, test_f1: 0.6126
 epoch: 15, train_loss: 0.7633, test_loss: 0.9584, test_f1: 0.6196
 epoch: 16, train_loss: 0.7487, test_loss: 0.9678, test_f1: 0.6061
 epoch: 17, train_loss: 0.7308, test_loss: 0.9561, test_f1: 0.6183
 epoch: 18, train_loss: 0.7302, test_loss: 0.9762, test_f1: 0.6005
 epoch: 19, train_loss: 0.7111, test_loss: 0.9343, test_f1: 0.6256
 epoch: 20, train_loss: 0.7105, test_loss: 0.9467, test_f1: 0.6039
 epoch: 21, train_loss: 0.7079, test_loss: 0.9804, test_f1: 0.6272
 epoch: 22, train_loss: 0.6898, test_loss: 0.9574, test_f1: 0.6219
 epoch: 23, train_loss: 0.6922, test_loss: 0.9210, test_f1: 0.6214
 epoch: 24, train_loss: 0.6688, test_loss: 0.9175, test_f1: 0.6424
 epoch: 25, train_loss: 0.6761, test_loss: 0.9449, test_f1: 0.6464
 epoch: 26, train_loss: 0.6620, test_loss: 0.8805, test_f1: 0.6571
 epoch: 27, train_loss: 0.6529, test_loss: 0.9822, test_f1: 0.6208
 epoch: 28, train_loss: 0.6279, test_loss: 0.9421, test_f1: 0.6106
 epoch: 29, train_loss: 0.6552, test_loss: 1.0339, test_f1: 0.6214
 epoch: 30, train_loss: 0.6159, test_loss: 0.9786, test_f1: 0.6344
 epoch: 31, train_loss: 0.6052, test_loss: 1.0221, test_f1: 0.6166
 epoch: 32, train_loss: 0.5981, test_loss: 0.9801, test_f1: 0.6369
 epoch: 33, train_loss: 0.6014, test_loss: 0.9786, test_f1: 0.6420
 epoch: 34, train_loss: 0.5849, test_loss: 1.0333, test_f1: 0.6048
 epoch: 35, train_loss: 0.5739, test_loss: 1.0504, test_f1: 0.6172
 epoch: 36, train_loss: 0.5919, test_loss: 1.0594, test_f1: 0.6220
 epoch: 37, train_loss: 0.5795, test_loss: 0.9747, test_f1: 0.6418
 epoch: 38, train_loss: 0.5613, test_loss: 1.0458, test_f1: 0.6217
 epoch: 39, train_loss: 0.5604, test_loss: 1.1279, test_f1: 0.6022
 epoch: 40, train_loss: 0.5737, test_loss: 1.0640, test_f1: 0.6653
 epoch: 41, train_loss: 0.5652, test_loss: 1.1304, test_f1: 0.6258
 epoch: 42, train_loss: 0.5490, test_loss: 1.0666, test_f1: 0.6686
 epoch: 43, train_loss: 0.5509, test_loss: 1.0453, test_f1: 0.6303
 epoch: 44, train_loss: 0.5358, test_loss: 1.1190, test_f1: 0.6271
 epoch: 45, train_loss: 0.5208, test_loss: 1.1487, test_f1: 0.6341
 epoch: 46, train_loss: 0.5129, test_loss: 1.0526, test_f1: 0.6648
 epoch: 47, train_loss: 0.5063, test_loss: 1.1181, test_f1: 0.6354
 epoch: 48, train_loss: 0.5210, test_loss: 1.1631, test_f1: 0.6230
 epoch: 49, train_loss: 0.5016, test_loss: 1.2105, test_f1: 0.6141
 epoch: 50, train_loss: 0.4924, test_loss: 1.1437, test_f1: 0.6144
 epoch: 51, train_loss: 0.4733, test_loss: 1.2202, test_f1: 0.5849
 epoch: 52, train_loss: 0.4655, test_loss: 1.1807, test_f1: 0.6329
 epoch: 53, train_loss: 0.4722, test_loss: 1.1364, test_f1: 0.6377
 epoch: 54, train_loss: 0.4585, test_loss: 1.1889, test_f1: 0.6298
 epoch: 55, train_loss: 0.4880, test_loss: 1.1743, test_f1: 0.6333
 epoch: 56, train_loss: 0.4465, test_loss: 1.1376, test_f1: 0.6462
 epoch: 57, train_loss: 0.4483, test_loss: 1.2195, test_f1: 0.6419
 epoch: 58, train_loss: 0.4496, test_loss: 1.2582, test_f1: 0.6259
 epoch: 59, train_loss: 0.4426, test_loss: 1.1985, test_f1: 0.6366
 epoch: 60, train_loss: 0.4315, test_loss: 1.2152, test_f1: 0.6322
 epoch: 61, train_loss: 0.4341, test_loss: 1.2361, test_f1: 0.6383
 epoch: 62, train_loss: 0.4319, test_loss: 1.2487, test_f1: 0.6430
 epoch: 63, train_loss: 0.4343, test_loss: 1.2376, test_f1: 0.6362
 epoch: 64, train_loss: 0.4353, test_loss: 1.2251, test_f1: 0.6262
 epoch: 65, train_loss: 0.4073, test_loss: 1.1902, test_f1: 0.6513
 epoch: 66, train_loss: 0.4305, test_loss: 1.2520, test_f1: 0.6265
 epoch: 67, train_loss: 0.3959, test_loss: 1.2517, test_f1: 0.6335
 epoch: 68, train_loss: 0.4032, test_loss: 1.2470, test_f1: 0.6245
 epoch: 69, train_loss: 0.3989, test_loss: 1.2876, test_f1: 0.6186
 epoch: 70, train_loss: 0.4113, test_loss: 1.2561, test_f1: 0.6369
 epoch: 71, train_loss: 0.3902, test_loss: 1.2986, test_f1: 0.6373
 epoch: 72, train_loss: 0.4277, test_loss: 1.4161, test_f1: 0.6088
 epoch: 73, train_loss: 0.4077, test_loss: 1.3235, test_f1: 0.6254
 epoch: 74, train_loss: 0.4031, test_loss: 1.3408, test_f1: 0.6122
 epoch: 75, train_loss: 0.4145, test_loss: 1.2990, test_f1: 0.6337
 epoch: 76, train_loss: 0.3832, test_loss: 1.3488, test_f1: 0.6237
 epoch: 77, train_loss: 0.3891, test_loss: 1.3053, test_f1: 0.6342
 epoch: 78, train_loss: 0.3933, test_loss: 1.3208, test_f1: 0.6287
 epoch: 79, train_loss: 0.3797, test_loss: 1.2983, test_f1: 0.6416
 epoch: 80, train_loss: 0.4016, test_loss: 1.4339, test_f1: 0.6120
 epoch: 81, train_loss: 0.3750, test_loss: 1.3872, test_f1: 0.6180
 epoch: 82, train_loss: 0.4058, test_loss: 1.3733, test_f1: 0.6419
 epoch: 83, train_loss: 0.3771, test_loss: 1.3630, test_f1: 0.6391
 epoch: 84, train_loss: 0.3668, test_loss: 1.3469, test_f1: 0.6459
 epoch: 85, train_loss: 0.3808, test_loss: 1.3335, test_f1: 0.6080
 epoch: 86, train_loss: 0.3701, test_loss: 1.3578, test_f1: 0.6221
 epoch: 87, train_loss: 0.3653, test_loss: 1.4746, test_f1: 0.6343
 epoch: 88, train_loss: 0.3502, test_loss: 1.4490, test_f1: 0.6157
 epoch: 89, train_loss: 0.3613, test_loss: 1.4370, test_f1: 0.6318
 epoch: 90, train_loss: 0.3637, test_loss: 1.4262, test_f1: 0.6320
 epoch: 91, train_loss: 0.3463, test_loss: 1.4496, test_f1: 0.6239
 epoch: 92, train_loss: 0.3499, test_loss: 1.4876, test_f1: 0.6128
 epoch: 93, train_loss: 0.3370, test_loss: 1.4809, test_f1: 0.6126
 epoch: 94, train_loss: 0.3407, test_loss: 1.4303, test_f1: 0.6194
 epoch: 95, train_loss: 0.3327, test_loss: 1.5450, test_f1: 0.6250
 epoch: 96, train_loss: 0.3544, test_loss: 1.5074, test_f1: 0.5983
 epoch: 97, train_loss: 0.3390, test_loss: 1.4687, test_f1: 0.6227
 epoch: 98, train_loss: 0.3411, test_loss: 1.4840, test_f1: 0.6310
 epoch: 99, train_loss: 0.3410, test_loss: 1.4535, test_f1: 0.6267
##################ITERATION #7 ****************************************
 epoch: 0, train_loss: 1.2286, test_loss: 1.2712, test_f1: 0.2697
 epoch: 1, train_loss: 1.0574, test_loss: 1.1669, test_f1: 0.5429
 epoch: 2, train_loss: 0.9996, test_loss: 1.1567, test_f1: 0.5170
 epoch: 3, train_loss: 0.9811, test_loss: 1.0909, test_f1: 0.5272
 epoch: 4, train_loss: 0.9572, test_loss: 1.1160, test_f1: 0.5276
 epoch: 5, train_loss: 0.9387, test_loss: 1.0973, test_f1: 0.5193
 epoch: 6, train_loss: 0.9089, test_loss: 1.1532, test_f1: 0.5541
 epoch: 7, train_loss: 0.8713, test_loss: 1.0920, test_f1: 0.5378
 epoch: 8, train_loss: 0.8506, test_loss: 1.1253, test_f1: 0.5514
 epoch: 9, train_loss: 0.8441, test_loss: 1.1169, test_f1: 0.5389
 epoch: 10, train_loss: 0.8228, test_loss: 1.0952, test_f1: 0.5372
 epoch: 11, train_loss: 0.8041, test_loss: 1.0742, test_f1: 0.5415
 epoch: 12, train_loss: 0.7790, test_loss: 1.0764, test_f1: 0.5332
 epoch: 13, train_loss: 0.7645, test_loss: 1.0686, test_f1: 0.5325
 epoch: 14, train_loss: 0.7477, test_loss: 1.0642, test_f1: 0.5544
 epoch: 15, train_loss: 0.7485, test_loss: 1.0728, test_f1: 0.5487
 epoch: 16, train_loss: 0.7279, test_loss: 1.0828, test_f1: 0.5887
 epoch: 17, train_loss: 0.7287, test_loss: 1.1351, test_f1: 0.5950
 epoch: 18, train_loss: 0.7223, test_loss: 1.0542, test_f1: 0.5856
 epoch: 19, train_loss: 0.7046, test_loss: 1.0907, test_f1: 0.5716
 epoch: 20, train_loss: 0.6816, test_loss: 1.1628, test_f1: 0.5845
 epoch: 21, train_loss: 0.6774, test_loss: 1.1316, test_f1: 0.5743
 epoch: 22, train_loss: 0.6729, test_loss: 1.1230, test_f1: 0.6072
 epoch: 23, train_loss: 0.6729, test_loss: 1.1739, test_f1: 0.5478
 epoch: 24, train_loss: 0.6648, test_loss: 1.1014, test_f1: 0.5984
 epoch: 25, train_loss: 0.6526, test_loss: 1.1614, test_f1: 0.5775
 epoch: 26, train_loss: 0.6305, test_loss: 1.1769, test_f1: 0.5846
 epoch: 27, train_loss: 0.6265, test_loss: 1.1803, test_f1: 0.5841
 epoch: 28, train_loss: 0.6266, test_loss: 1.2913, test_f1: 0.5514
 epoch: 29, train_loss: 0.6005, test_loss: 1.1738, test_f1: 0.6094
 epoch: 30, train_loss: 0.6115, test_loss: 1.1339, test_f1: 0.5994
 epoch: 31, train_loss: 0.5980, test_loss: 1.2581, test_f1: 0.6148
 epoch: 32, train_loss: 0.6087, test_loss: 1.2272, test_f1: 0.5830
 epoch: 33, train_loss: 0.5850, test_loss: 1.2604, test_f1: 0.5829
 epoch: 34, train_loss: 0.5797, test_loss: 1.3162, test_f1: 0.6238
 epoch: 35, train_loss: 0.5630, test_loss: 1.2207, test_f1: 0.6174
 epoch: 36, train_loss: 0.5571, test_loss: 1.2551, test_f1: 0.6274
 epoch: 37, train_loss: 0.5403, test_loss: 1.2537, test_f1: 0.6305
 epoch: 38, train_loss: 0.5426, test_loss: 1.2485, test_f1: 0.6136
 epoch: 39, train_loss: 0.5335, test_loss: 1.2325, test_f1: 0.6276
 epoch: 40, train_loss: 0.5451, test_loss: 1.2939, test_f1: 0.6168
 epoch: 41, train_loss: 0.5288, test_loss: 1.2698, test_f1: 0.5934
 epoch: 42, train_loss: 0.5239, test_loss: 1.3881, test_f1: 0.5963
 epoch: 43, train_loss: 0.5122, test_loss: 1.2917, test_f1: 0.6002
 epoch: 44, train_loss: 0.5045, test_loss: 1.3024, test_f1: 0.6138
 epoch: 45, train_loss: 0.5042, test_loss: 1.2283, test_f1: 0.6207
 epoch: 46, train_loss: 0.4978, test_loss: 1.3072, test_f1: 0.6270
 epoch: 47, train_loss: 0.5032, test_loss: 1.3445, test_f1: 0.5962
 epoch: 48, train_loss: 0.4928, test_loss: 1.3198, test_f1: 0.6229
 epoch: 49, train_loss: 0.4744, test_loss: 1.4001, test_f1: 0.6477
 epoch: 50, train_loss: 0.4795, test_loss: 1.3516, test_f1: 0.6231
 epoch: 51, train_loss: 0.4599, test_loss: 1.4152, test_f1: 0.6466
 epoch: 52, train_loss: 0.4596, test_loss: 1.3962, test_f1: 0.6343
 epoch: 53, train_loss: 0.4415, test_loss: 1.3926, test_f1: 0.6155
 epoch: 54, train_loss: 0.4355, test_loss: 1.3609, test_f1: 0.6474
 epoch: 55, train_loss: 0.4355, test_loss: 1.4166, test_f1: 0.6223
 epoch: 56, train_loss: 0.4260, test_loss: 1.4682, test_f1: 0.6378
 epoch: 57, train_loss: 0.4227, test_loss: 1.4424, test_f1: 0.6345
 epoch: 58, train_loss: 0.4242, test_loss: 1.4309, test_f1: 0.6478
 epoch: 59, train_loss: 0.4261, test_loss: 1.4964, test_f1: 0.6318
 epoch: 60, train_loss: 0.4075, test_loss: 1.5062, test_f1: 0.6428
 epoch: 61, train_loss: 0.3933, test_loss: 1.4725, test_f1: 0.6137
 epoch: 62, train_loss: 0.4106, test_loss: 1.5115, test_f1: 0.6296
 epoch: 63, train_loss: 0.4144, test_loss: 1.5207, test_f1: 0.6224
 epoch: 64, train_loss: 0.4101, test_loss: 1.5367, test_f1: 0.6514
 epoch: 65, train_loss: 0.3836, test_loss: 1.4817, test_f1: 0.6523
 epoch: 66, train_loss: 0.3769, test_loss: 1.5505, test_f1: 0.6492
 epoch: 67, train_loss: 0.4034, test_loss: 1.5926, test_f1: 0.6359
 epoch: 68, train_loss: 0.3751, test_loss: 1.5479, test_f1: 0.6378
 epoch: 69, train_loss: 0.3941, test_loss: 1.6660, test_f1: 0.6187
 epoch: 70, train_loss: 0.3819, test_loss: 1.5996, test_f1: 0.6113
 epoch: 71, train_loss: 0.3766, test_loss: 1.6349, test_f1: 0.6178
 epoch: 72, train_loss: 0.3798, test_loss: 1.5916, test_f1: 0.6260
 epoch: 73, train_loss: 0.3828, test_loss: 1.4994, test_f1: 0.6542
 epoch: 74, train_loss: 0.3756, test_loss: 1.5793, test_f1: 0.6553
 epoch: 75, train_loss: 0.3689, test_loss: 1.5913, test_f1: 0.6363
 epoch: 76, train_loss: 0.3698, test_loss: 1.6522, test_f1: 0.6413
 epoch: 77, train_loss: 0.3598, test_loss: 1.5893, test_f1: 0.6340
 epoch: 78, train_loss: 0.3584, test_loss: 1.6527, test_f1: 0.6311
 epoch: 79, train_loss: 0.3497, test_loss: 1.6036, test_f1: 0.6447
 epoch: 80, train_loss: 0.3691, test_loss: 1.6744, test_f1: 0.6216
 epoch: 81, train_loss: 0.3345, test_loss: 1.7260, test_f1: 0.6105
 epoch: 82, train_loss: 0.3515, test_loss: 1.6354, test_f1: 0.6293
 epoch: 83, train_loss: 0.3359, test_loss: 1.6950, test_f1: 0.6315
 epoch: 84, train_loss: 0.3485, test_loss: 1.7797, test_f1: 0.6362
 epoch: 85, train_loss: 0.3239, test_loss: 1.7242, test_f1: 0.6262
 epoch: 86, train_loss: 0.3718, test_loss: 1.7494, test_f1: 0.6273
 epoch: 87, train_loss: 0.3349, test_loss: 1.8076, test_f1: 0.6238
 epoch: 88, train_loss: 0.3303, test_loss: 1.7840, test_f1: 0.6245
 epoch: 89, train_loss: 0.3318, test_loss: 1.8530, test_f1: 0.5993
 epoch: 90, train_loss: 0.3283, test_loss: 1.7631, test_f1: 0.6224
 epoch: 91, train_loss: 0.3318, test_loss: 1.8795, test_f1: 0.6137
 epoch: 92, train_loss: 0.3313, test_loss: 1.8655, test_f1: 0.6256
 epoch: 93, train_loss: 0.3318, test_loss: 1.8241, test_f1: 0.6227
 epoch: 94, train_loss: 0.3309, test_loss: 1.8315, test_f1: 0.6417
 epoch: 95, train_loss: 0.3156, test_loss: 1.8937, test_f1: 0.6115
 epoch: 96, train_loss: 0.3448, test_loss: 1.8440, test_f1: 0.6210
 epoch: 97, train_loss: 0.2962, test_loss: 1.7881, test_f1: 0.6110
 epoch: 98, train_loss: 0.3078, test_loss: 1.8311, test_f1: 0.6146
 epoch: 99, train_loss: 0.3190, test_loss: 1.8518, test_f1: 0.6259
##################ITERATION #8 ****************************************
 epoch: 0, train_loss: 1.2989, test_loss: 1.2493, test_f1: 0.3133
 epoch: 1, train_loss: 1.1005, test_loss: 1.0823, test_f1: 0.5003
 epoch: 2, train_loss: 1.0243, test_loss: 1.0519, test_f1: 0.5198
 epoch: 3, train_loss: 1.0132, test_loss: 1.0405, test_f1: 0.5509
 epoch: 4, train_loss: 0.9570, test_loss: 1.0174, test_f1: 0.5565
 epoch: 5, train_loss: 0.9294, test_loss: 1.0207, test_f1: 0.5679
 epoch: 6, train_loss: 0.9003, test_loss: 1.0058, test_f1: 0.5677
 epoch: 7, train_loss: 0.8810, test_loss: 1.0444, test_f1: 0.5640
 epoch: 8, train_loss: 0.8671, test_loss: 1.0291, test_f1: 0.5717
 epoch: 9, train_loss: 0.8342, test_loss: 1.0040, test_f1: 0.5426
 epoch: 10, train_loss: 0.8222, test_loss: 0.9778, test_f1: 0.5961
 epoch: 11, train_loss: 0.8081, test_loss: 0.9947, test_f1: 0.5615
 epoch: 12, train_loss: 0.8145, test_loss: 1.0062, test_f1: 0.5898
 epoch: 13, train_loss: 0.7842, test_loss: 0.9938, test_f1: 0.5798
 epoch: 14, train_loss: 0.7846, test_loss: 1.0079, test_f1: 0.5748
 epoch: 15, train_loss: 0.7624, test_loss: 0.9823, test_f1: 0.6015
 epoch: 16, train_loss: 0.7380, test_loss: 1.0328, test_f1: 0.5808
 epoch: 17, train_loss: 0.7343, test_loss: 1.0295, test_f1: 0.5826
 epoch: 18, train_loss: 0.7131, test_loss: 1.0447, test_f1: 0.5891
 epoch: 19, train_loss: 0.7277, test_loss: 1.0254, test_f1: 0.6054
 epoch: 20, train_loss: 0.7331, test_loss: 1.0560, test_f1: 0.6074
 epoch: 21, train_loss: 0.6877, test_loss: 1.0219, test_f1: 0.5961
 epoch: 22, train_loss: 0.6928, test_loss: 1.0176, test_f1: 0.6160
 epoch: 23, train_loss: 0.6771, test_loss: 1.0213, test_f1: 0.6012
 epoch: 24, train_loss: 0.6813, test_loss: 1.0517, test_f1: 0.5991
 epoch: 25, train_loss: 0.6724, test_loss: 1.0391, test_f1: 0.6225
 epoch: 26, train_loss: 0.6519, test_loss: 1.0255, test_f1: 0.6352
 epoch: 27, train_loss: 0.6454, test_loss: 1.0523, test_f1: 0.6117
 epoch: 28, train_loss: 0.6411, test_loss: 1.0328, test_f1: 0.5829
 epoch: 29, train_loss: 0.6261, test_loss: 1.0644, test_f1: 0.6191
 epoch: 30, train_loss: 0.6080, test_loss: 1.0797, test_f1: 0.6143
 epoch: 31, train_loss: 0.6089, test_loss: 1.1146, test_f1: 0.6220
 epoch: 32, train_loss: 0.6090, test_loss: 1.0694, test_f1: 0.5944
 epoch: 33, train_loss: 0.5876, test_loss: 1.1028, test_f1: 0.6091
 epoch: 34, train_loss: 0.5999, test_loss: 1.0778, test_f1: 0.6149
 epoch: 35, train_loss: 0.5820, test_loss: 1.1086, test_f1: 0.6093
 epoch: 36, train_loss: 0.5832, test_loss: 1.1474, test_f1: 0.5978
 epoch: 37, train_loss: 0.5756, test_loss: 1.1410, test_f1: 0.5913
 epoch: 38, train_loss: 0.5522, test_loss: 1.1276, test_f1: 0.5943
 epoch: 39, train_loss: 0.5659, test_loss: 1.1470, test_f1: 0.6017
 epoch: 40, train_loss: 0.5475, test_loss: 1.1727, test_f1: 0.6366
 epoch: 41, train_loss: 0.5463, test_loss: 1.1331, test_f1: 0.6282
 epoch: 42, train_loss: 0.5519, test_loss: 1.1875, test_f1: 0.5923
 epoch: 43, train_loss: 0.4943, test_loss: 1.2000, test_f1: 0.6216
 epoch: 44, train_loss: 0.5247, test_loss: 1.1932, test_f1: 0.6016
 epoch: 45, train_loss: 0.5285, test_loss: 1.2421, test_f1: 0.6125
 epoch: 46, train_loss: 0.5118, test_loss: 1.2155, test_f1: 0.6066
 epoch: 47, train_loss: 0.5108, test_loss: 1.2025, test_f1: 0.6040
 epoch: 48, train_loss: 0.5036, test_loss: 1.2237, test_f1: 0.6170
 epoch: 49, train_loss: 0.4872, test_loss: 1.2780, test_f1: 0.6075
 epoch: 50, train_loss: 0.4905, test_loss: 1.4064, test_f1: 0.5906
 epoch: 51, train_loss: 0.4574, test_loss: 1.2702, test_f1: 0.6087
 epoch: 52, train_loss: 0.4479, test_loss: 1.2850, test_f1: 0.6265
 epoch: 53, train_loss: 0.4350, test_loss: 1.3335, test_f1: 0.6139
 epoch: 54, train_loss: 0.4429, test_loss: 1.3563, test_f1: 0.5971
 epoch: 55, train_loss: 0.4313, test_loss: 1.3394, test_f1: 0.6124
 epoch: 56, train_loss: 0.4399, test_loss: 1.3159, test_f1: 0.6224
 epoch: 57, train_loss: 0.4294, test_loss: 1.3807, test_f1: 0.6021
 epoch: 58, train_loss: 0.4185, test_loss: 1.3661, test_f1: 0.6101
 epoch: 59, train_loss: 0.4251, test_loss: 1.3614, test_f1: 0.6062
 epoch: 60, train_loss: 0.4308, test_loss: 1.4087, test_f1: 0.6367
 epoch: 61, train_loss: 0.4234, test_loss: 1.3809, test_f1: 0.6202
 epoch: 62, train_loss: 0.4245, test_loss: 1.4475, test_f1: 0.6074
 epoch: 63, train_loss: 0.4123, test_loss: 1.4120, test_f1: 0.6329
 epoch: 64, train_loss: 0.4114, test_loss: 1.4387, test_f1: 0.6130
 epoch: 65, train_loss: 0.3978, test_loss: 1.4195, test_f1: 0.6233
 epoch: 66, train_loss: 0.3756, test_loss: 1.4138, test_f1: 0.6252
 epoch: 67, train_loss: 0.4076, test_loss: 1.4426, test_f1: 0.6262
 epoch: 68, train_loss: 0.3927, test_loss: 1.4990, test_f1: 0.6121
 epoch: 69, train_loss: 0.3888, test_loss: 1.3827, test_f1: 0.6422
 epoch: 70, train_loss: 0.3857, test_loss: 1.4501, test_f1: 0.6184
 epoch: 71, train_loss: 0.3595, test_loss: 1.4305, test_f1: 0.6458
 epoch: 72, train_loss: 0.3883, test_loss: 1.4737, test_f1: 0.6371
 epoch: 73, train_loss: 0.3644, test_loss: 1.5261, test_f1: 0.6229
 epoch: 74, train_loss: 0.3712, test_loss: 1.4944, test_f1: 0.6363
 epoch: 75, train_loss: 0.3845, test_loss: 1.5080, test_f1: 0.6087
 epoch: 76, train_loss: 0.3714, test_loss: 1.6097, test_f1: 0.5996
 epoch: 77, train_loss: 0.3596, test_loss: 1.5060, test_f1: 0.6273
 epoch: 78, train_loss: 0.3863, test_loss: 1.5338, test_f1: 0.6376
 epoch: 79, train_loss: 0.3515, test_loss: 1.5486, test_f1: 0.6158
 epoch: 80, train_loss: 0.3449, test_loss: 1.5570, test_f1: 0.6024
 epoch: 81, train_loss: 0.3375, test_loss: 1.6412, test_f1: 0.6118
 epoch: 82, train_loss: 0.3579, test_loss: 1.5986, test_f1: 0.6068
 epoch: 83, train_loss: 0.3328, test_loss: 1.5983, test_f1: 0.6334
 epoch: 84, train_loss: 0.3641, test_loss: 1.6181, test_f1: 0.6208
 epoch: 85, train_loss: 0.3386, test_loss: 1.5420, test_f1: 0.6493
 epoch: 86, train_loss: 0.3248, test_loss: 1.6410, test_f1: 0.6153
 epoch: 87, train_loss: 0.3387, test_loss: 1.5833, test_f1: 0.6058
 epoch: 88, train_loss: 0.3373, test_loss: 1.6727, test_f1: 0.6016
 epoch: 89, train_loss: 0.3492, test_loss: 1.6101, test_f1: 0.6171
 epoch: 90, train_loss: 0.3398, test_loss: 1.6652, test_f1: 0.6219
 epoch: 91, train_loss: 0.3304, test_loss: 1.6708, test_f1: 0.6296
 epoch: 92, train_loss: 0.3478, test_loss: 1.6659, test_f1: 0.6196
 epoch: 93, train_loss: 0.3366, test_loss: 1.7451, test_f1: 0.6241
 epoch: 94, train_loss: 0.3346, test_loss: 1.7185, test_f1: 0.6301
 epoch: 95, train_loss: 0.3294, test_loss: 1.7054, test_f1: 0.6298
 epoch: 96, train_loss: 0.2877, test_loss: 1.6491, test_f1: 0.6205
 epoch: 97, train_loss: 0.3231, test_loss: 1.7019, test_f1: 0.6197
 epoch: 98, train_loss: 0.3050, test_loss: 1.7068, test_f1: 0.6110
 epoch: 99, train_loss: 0.3124, test_loss: 1.7121, test_f1: 0.6049
##################ITERATION #9 ****************************************
 epoch: 0, train_loss: 1.2553, test_loss: 1.2775, test_f1: 0.3358
 epoch: 1, train_loss: 1.0405, test_loss: 1.1104, test_f1: 0.5723
 epoch: 2, train_loss: 0.9836, test_loss: 1.0451, test_f1: 0.5601
 epoch: 3, train_loss: 0.9371, test_loss: 1.0249, test_f1: 0.5702
 epoch: 4, train_loss: 0.9339, test_loss: 1.0185, test_f1: 0.5888
 epoch: 5, train_loss: 0.8968, test_loss: 1.0100, test_f1: 0.5946
 epoch: 6, train_loss: 0.8945, test_loss: 1.0129, test_f1: 0.5724
 epoch: 7, train_loss: 0.8542, test_loss: 1.0108, test_f1: 0.5826
 epoch: 8, train_loss: 0.8344, test_loss: 0.9795, test_f1: 0.5744
 epoch: 9, train_loss: 0.8288, test_loss: 0.9746, test_f1: 0.5816
 epoch: 10, train_loss: 0.7935, test_loss: 0.9707, test_f1: 0.5713
 epoch: 11, train_loss: 0.7977, test_loss: 0.9501, test_f1: 0.5976
 epoch: 12, train_loss: 0.7556, test_loss: 0.9479, test_f1: 0.6033
 epoch: 13, train_loss: 0.7565, test_loss: 0.9823, test_f1: 0.6011
 epoch: 14, train_loss: 0.7589, test_loss: 0.9601, test_f1: 0.5891
 epoch: 15, train_loss: 0.7331, test_loss: 0.9733, test_f1: 0.5726
 epoch: 16, train_loss: 0.7148, test_loss: 0.9684, test_f1: 0.5939
 epoch: 17, train_loss: 0.7243, test_loss: 1.0165, test_f1: 0.5771
 epoch: 18, train_loss: 0.6819, test_loss: 0.9781, test_f1: 0.5874
 epoch: 19, train_loss: 0.6923, test_loss: 0.9812, test_f1: 0.6140
 epoch: 20, train_loss: 0.6689, test_loss: 0.9832, test_f1: 0.5906
 epoch: 21, train_loss: 0.6308, test_loss: 0.9785, test_f1: 0.5935
 epoch: 22, train_loss: 0.6392, test_loss: 0.9552, test_f1: 0.6124
 epoch: 23, train_loss: 0.6323, test_loss: 0.9853, test_f1: 0.6193
 epoch: 24, train_loss: 0.6333, test_loss: 0.9915, test_f1: 0.6341
 epoch: 25, train_loss: 0.6340, test_loss: 0.9887, test_f1: 0.6138
 epoch: 26, train_loss: 0.5996, test_loss: 0.9458, test_f1: 0.6529
 epoch: 27, train_loss: 0.5958, test_loss: 1.0311, test_f1: 0.6172
 epoch: 28, train_loss: 0.5946, test_loss: 0.9965, test_f1: 0.6450
 epoch: 29, train_loss: 0.5914, test_loss: 0.9997, test_f1: 0.6033
 epoch: 30, train_loss: 0.5674, test_loss: 1.0067, test_f1: 0.6172
 epoch: 31, train_loss: 0.5695, test_loss: 1.0001, test_f1: 0.6419
 epoch: 32, train_loss: 0.5549, test_loss: 1.0593, test_f1: 0.6043
 epoch: 33, train_loss: 0.5498, test_loss: 1.0616, test_f1: 0.6102
 epoch: 34, train_loss: 0.5417, test_loss: 1.0546, test_f1: 0.5985
 epoch: 35, train_loss: 0.5423, test_loss: 1.0178, test_f1: 0.6296
 epoch: 36, train_loss: 0.5403, test_loss: 1.0252, test_f1: 0.6197
 epoch: 37, train_loss: 0.5182, test_loss: 1.0196, test_f1: 0.6144
 epoch: 38, train_loss: 0.5057, test_loss: 1.0977, test_f1: 0.6079
 epoch: 39, train_loss: 0.5127, test_loss: 1.0801, test_f1: 0.6286
 epoch: 40, train_loss: 0.5099, test_loss: 1.0937, test_f1: 0.6270
 epoch: 41, train_loss: 0.4926, test_loss: 1.1242, test_f1: 0.6058
 epoch: 42, train_loss: 0.4838, test_loss: 1.1685, test_f1: 0.6209
 epoch: 43, train_loss: 0.4670, test_loss: 1.1296, test_f1: 0.6185
 epoch: 44, train_loss: 0.4841, test_loss: 1.1428, test_f1: 0.6038
 epoch: 45, train_loss: 0.4620, test_loss: 1.0924, test_f1: 0.6272
 epoch: 46, train_loss: 0.4458, test_loss: 1.1185, test_f1: 0.6410
 epoch: 47, train_loss: 0.4603, test_loss: 1.0991, test_f1: 0.6126
 epoch: 48, train_loss: 0.4490, test_loss: 1.0834, test_f1: 0.6353
 epoch: 49, train_loss: 0.4484, test_loss: 1.1368, test_f1: 0.6379
 epoch: 50, train_loss: 0.4240, test_loss: 1.1290, test_f1: 0.6363
 epoch: 51, train_loss: 0.4010, test_loss: 1.1386, test_f1: 0.6410
 epoch: 52, train_loss: 0.4379, test_loss: 1.1526, test_f1: 0.6209
 epoch: 53, train_loss: 0.3840, test_loss: 1.1390, test_f1: 0.6370
 epoch: 54, train_loss: 0.4006, test_loss: 1.1472, test_f1: 0.6265
 epoch: 55, train_loss: 0.3787, test_loss: 1.1948, test_f1: 0.6240
 epoch: 56, train_loss: 0.3888, test_loss: 1.1972, test_f1: 0.6336
 epoch: 57, train_loss: 0.3923, test_loss: 1.2214, test_f1: 0.6160
 epoch: 58, train_loss: 0.3725, test_loss: 1.2401, test_f1: 0.6381
 epoch: 59, train_loss: 0.3858, test_loss: 1.2408, test_f1: 0.6199
 epoch: 60, train_loss: 0.3728, test_loss: 1.2457, test_f1: 0.6242
 epoch: 61, train_loss: 0.3661, test_loss: 1.2850, test_f1: 0.6206
 epoch: 62, train_loss: 0.3642, test_loss: 1.2448, test_f1: 0.6278
 epoch: 63, train_loss: 0.3638, test_loss: 1.2493, test_f1: 0.6536
 epoch: 64, train_loss: 0.3518, test_loss: 1.2760, test_f1: 0.6377
 epoch: 65, train_loss: 0.3584, test_loss: 1.3645, test_f1: 0.6137
 epoch: 66, train_loss: 0.3455, test_loss: 1.3222, test_f1: 0.6460
 epoch: 67, train_loss: 0.3519, test_loss: 1.3709, test_f1: 0.6173
 epoch: 68, train_loss: 0.3534, test_loss: 1.3089, test_f1: 0.6376
 epoch: 69, train_loss: 0.3274, test_loss: 1.3958, test_f1: 0.6287
 epoch: 70, train_loss: 0.3664, test_loss: 1.3096, test_f1: 0.6205
 epoch: 71, train_loss: 0.3351, test_loss: 1.4038, test_f1: 0.6167
 epoch: 72, train_loss: 0.3343, test_loss: 1.3571, test_f1: 0.6476
 epoch: 73, train_loss: 0.3364, test_loss: 1.2788, test_f1: 0.6435
 epoch: 74, train_loss: 0.3209, test_loss: 1.3619, test_f1: 0.6359
 epoch: 75, train_loss: 0.3327, test_loss: 1.3367, test_f1: 0.6376
 epoch: 76, train_loss: 0.3285, test_loss: 1.4548, test_f1: 0.6142
 epoch: 77, train_loss: 0.3133, test_loss: 1.3624, test_f1: 0.6399
 epoch: 78, train_loss: 0.3048, test_loss: 1.4481, test_f1: 0.6197
 epoch: 79, train_loss: 0.3116, test_loss: 1.4675, test_f1: 0.6417
 epoch: 80, train_loss: 0.3032, test_loss: 1.4794, test_f1: 0.6263
 epoch: 81, train_loss: 0.2981, test_loss: 1.4566, test_f1: 0.6369
 epoch: 82, train_loss: 0.3022, test_loss: 1.4829, test_f1: 0.6239
 epoch: 83, train_loss: 0.2982, test_loss: 1.5023, test_f1: 0.6342
 epoch: 84, train_loss: 0.3117, test_loss: 1.5381, test_f1: 0.6320
 epoch: 85, train_loss: 0.3024, test_loss: 1.5716, test_f1: 0.6242
 epoch: 86, train_loss: 0.3127, test_loss: 1.4631, test_f1: 0.6352
 epoch: 87, train_loss: 0.2957, test_loss: 1.5280, test_f1: 0.6238
 epoch: 88, train_loss: 0.2814, test_loss: 1.5285, test_f1: 0.6289
 epoch: 89, train_loss: 0.2926, test_loss: 1.4905, test_f1: 0.6587
 epoch: 90, train_loss: 0.2908, test_loss: 1.5679, test_f1: 0.6380
 epoch: 91, train_loss: 0.2794, test_loss: 1.4785, test_f1: 0.6482
 epoch: 92, train_loss: 0.2688, test_loss: 1.4691, test_f1: 0.6672
 epoch: 93, train_loss: 0.2859, test_loss: 1.6147, test_f1: 0.6386
 epoch: 94, train_loss: 0.2632, test_loss: 1.5484, test_f1: 0.5959
 epoch: 95, train_loss: 0.2739, test_loss: 1.5412, test_f1: 0.6536
 epoch: 96, train_loss: 0.2632, test_loss: 1.5041, test_f1: 0.6493
 epoch: 97, train_loss: 0.2861, test_loss: 1.6242, test_f1: 0.6241
 epoch: 98, train_loss: 0.2685, test_loss: 1.5199, test_f1: 0.6529
 epoch: 99, train_loss: 0.2646, test_loss: 1.6475, test_f1: 0.6456

Training completed in 512.93 seconds
Best F1: 0.6686 at epoch 42
Mean F1 across iterations: 0.6500  0.0157
========================FINAL RESULTS================================
FEGIN weighted F1: 0.6686  0.0157
python main.py --data ltspice_demos --representation component_pin --model FEGIN --layers 2 --hiddens 128 --batch_size 32 --lr 0.0001 --emb_size 128 --epochs 100 --save_appendix component_pin_L2_H128_BS32_LR0.0001_E128 --no_val
-----



STDERR:
  File "main.py", line 370, in <module>
    main()
  File "main.py", line 254, in main
    dataset = dataset_class(
  File "/home/philip/projects/ltspice_examples_code_repo/Circuit-Completion-Using-GNNs/component_classification_with_link_prediction_head/evaluation/FEGIN/kernel/circuit_datasets.py", line 15, in __init__
    self.data, self.slices = torch.load(self.processed_paths[0])
  File "/home/philip/.local/lib/python3.8/site-packages/torch/serialization.py", line 1040, in load
    warnings.warn(
  File "/usr/lib/python3.8/warnings.py", line 109, in _showwarnmsg
    sw(msg.message, msg.category, msg.filename, msg.lineno,
  File "main.py", line 47, in warn_with_traceback
    traceback.print_stack(file=log)
/home/philip/projects/ltspice_examples_code_repo/Circuit-Completion-Using-GNNs/component_classification_with_link_prediction_head/evaluation/FEGIN/kernel/circuit_datasets.py:15: FutureWarning: You are using `torch.load` with `weights_only=False` (the current default value), which uses the default pickle module implicitly. It is possible to construct malicious pickle data which will execute arbitrary code during unpickling (See https://github.com/pytorch/pytorch/blob/main/SECURITY.md#untrusted-models for more details). In a future release, the default value for `weights_only` will be flipped to `True`. This limits the functions that could be executed during unpickling. Arbitrary objects will no longer be allowed to be loaded via this mode unless they are explicitly allowlisted by the user via `torch.serialization.add_safe_globals`. We recommend you start setting `weights_only=True` for any use case where you don't have full control of the loaded file. Please open an issue on GitHub for any issues related to this experimental feature.
  self.data, self.slices = torch.load(self.processed_paths[0])
