STDOUT:
Results will be saved in /home/philip/projects/ltspice_examples_code_repo/Circuit-Completion-Using-GNNs/component_classification_with_link_prediction_head/evaluation/FEGIN/results/model_FEGIN_dataset_ltspice_demos
Command line input: python main.py --data ltspice_demos --representation component_net --model FEGIN --layers 4 --hiddens 16 --batch_size 256 --lr 0.1 --emb_size 512 --epochs 100 --save_appendix component_net_L4_H16_BS256_LR0.1_E512 --no_val
 is saved.
-----
ltspice_demos - FEGIN
Using 4 layers, 16 hidden units, h = 2
Loading component_net representation dataset
ENTERED
Training FEGIN on component_net representation
Train: 1565, Test: 383
##################ITERATION #0 ****************************************
 epoch: 0, train_loss: 1.3310, test_loss: 1.3531, test_f1: 0.2281
 epoch: 1, train_loss: 1.2521, test_loss: 1.3084, test_f1: 0.2281
 epoch: 2, train_loss: 1.2133, test_loss: 1.3388, test_f1: 0.2281
 epoch: 3, train_loss: 1.1718, test_loss: 1.3226, test_f1: 0.2390
 epoch: 4, train_loss: 1.1788, test_loss: 1.3317, test_f1: 0.2720
 epoch: 5, train_loss: 1.1547, test_loss: 1.2860, test_f1: 0.2491
 epoch: 6, train_loss: 1.1339, test_loss: 1.3684, test_f1: 0.2336
 epoch: 7, train_loss: 1.1457, test_loss: 1.2567, test_f1: 0.2721
 epoch: 8, train_loss: 1.1165, test_loss: 1.3477, test_f1: 0.2390
 epoch: 9, train_loss: 1.1033, test_loss: 1.2363, test_f1: 0.3508
 epoch: 10, train_loss: 1.0809, test_loss: 1.2628, test_f1: 0.3977
 epoch: 11, train_loss: 1.0556, test_loss: 1.2452, test_f1: 0.3154
 epoch: 12, train_loss: 1.0687, test_loss: 1.2545, test_f1: 0.3815
 epoch: 13, train_loss: 1.0648, test_loss: 1.2497, test_f1: 0.3207
 epoch: 14, train_loss: 1.0861, test_loss: 1.2097, test_f1: 0.3181
 epoch: 15, train_loss: 1.0477, test_loss: 1.1752, test_f1: 0.3101
 epoch: 16, train_loss: 1.0623, test_loss: 1.2077, test_f1: 0.3317
 epoch: 17, train_loss: 1.0536, test_loss: 1.1426, test_f1: 0.3317
 epoch: 18, train_loss: 1.0665, test_loss: 1.0995, test_f1: 0.3860
 epoch: 19, train_loss: 1.0586, test_loss: 1.1396, test_f1: 0.4169
 epoch: 20, train_loss: 1.0518, test_loss: 1.1222, test_f1: 0.3408
 epoch: 21, train_loss: 1.0743, test_loss: 1.1790, test_f1: 0.3262
 epoch: 22, train_loss: 1.0831, test_loss: 1.1811, test_f1: 0.4065
 epoch: 23, train_loss: 1.0602, test_loss: 1.1434, test_f1: 0.4224
 epoch: 24, train_loss: 1.0754, test_loss: 1.1968, test_f1: 0.3234
 epoch: 25, train_loss: 1.0621, test_loss: 1.1715, test_f1: 0.3317
 epoch: 26, train_loss: 1.0352, test_loss: 1.1907, test_f1: 0.2480
 epoch: 27, train_loss: 1.0392, test_loss: 1.1710, test_f1: 0.2786
 epoch: 28, train_loss: 1.0318, test_loss: 1.1493, test_f1: 0.3370
 epoch: 29, train_loss: 1.0542, test_loss: 1.2351, test_f1: 0.3051
 epoch: 30, train_loss: 1.0632, test_loss: 1.1315, test_f1: 0.3915
 epoch: 31, train_loss: 1.0494, test_loss: 1.1679, test_f1: 0.3262
 epoch: 32, train_loss: 1.0412, test_loss: 1.1783, test_f1: 0.3290
 epoch: 33, train_loss: 1.0293, test_loss: 1.2476, test_f1: 0.3115
 epoch: 34, train_loss: 1.0687, test_loss: 1.2083, test_f1: 0.3234
 epoch: 35, train_loss: 1.0511, test_loss: 1.1818, test_f1: 0.3262
 epoch: 36, train_loss: 1.0341, test_loss: 1.1543, test_f1: 0.3314
 epoch: 37, train_loss: 1.0285, test_loss: 1.2255, test_f1: 0.3115
 epoch: 38, train_loss: 1.0713, test_loss: 1.2586, test_f1: 0.2184
 epoch: 39, train_loss: 1.1297, test_loss: 1.3046, test_f1: 0.2586
 epoch: 40, train_loss: 1.1613, test_loss: 1.2425, test_f1: 0.2944
 epoch: 41, train_loss: 1.1026, test_loss: 1.1887, test_f1: 0.3447
 epoch: 42, train_loss: 1.0576, test_loss: 1.2719, test_f1: 0.3083
 epoch: 43, train_loss: 1.0500, test_loss: 1.1735, test_f1: 0.3234
 epoch: 44, train_loss: 1.0635, test_loss: 1.1286, test_f1: 0.3336
 epoch: 45, train_loss: 1.0406, test_loss: 1.1891, test_f1: 0.2758
 epoch: 46, train_loss: 1.0308, test_loss: 1.1322, test_f1: 0.3356
 epoch: 47, train_loss: 1.0224, test_loss: 1.0993, test_f1: 0.3227
 epoch: 48, train_loss: 1.0555, test_loss: 1.1405, test_f1: 0.3317
 epoch: 49, train_loss: 1.0557, test_loss: 1.1427, test_f1: 0.3397
 epoch: 50, train_loss: 1.0397, test_loss: 1.1073, test_f1: 0.3129
 epoch: 51, train_loss: 1.0307, test_loss: 1.1079, test_f1: 0.3372
 epoch: 52, train_loss: 1.0185, test_loss: 1.1068, test_f1: 0.3372
 epoch: 53, train_loss: 1.0153, test_loss: 1.1071, test_f1: 0.3372
 epoch: 54, train_loss: 1.0080, test_loss: 1.1122, test_f1: 0.3372
 epoch: 55, train_loss: 1.0239, test_loss: 1.1096, test_f1: 0.3370
 epoch: 56, train_loss: 1.0127, test_loss: 1.1071, test_f1: 0.3329
 epoch: 57, train_loss: 1.0222, test_loss: 1.1137, test_f1: 0.3395
 epoch: 58, train_loss: 1.0300, test_loss: 1.1204, test_f1: 0.3395
 epoch: 59, train_loss: 1.0236, test_loss: 1.0935, test_f1: 0.3372
 epoch: 60, train_loss: 1.0196, test_loss: 1.1265, test_f1: 0.3395
 epoch: 61, train_loss: 1.0118, test_loss: 1.1467, test_f1: 0.3138
 epoch: 62, train_loss: 0.9987, test_loss: 1.1238, test_f1: 0.3397
 epoch: 63, train_loss: 1.0121, test_loss: 1.1118, test_f1: 0.3401
 epoch: 64, train_loss: 1.0140, test_loss: 1.1032, test_f1: 0.3397
 epoch: 65, train_loss: 1.0017, test_loss: 1.0983, test_f1: 0.3395
 epoch: 66, train_loss: 1.0146, test_loss: 1.1228, test_f1: 0.4071
 epoch: 67, train_loss: 1.0169, test_loss: 1.1123, test_f1: 0.3365
 epoch: 68, train_loss: 1.0063, test_loss: 1.0876, test_f1: 0.3397
 epoch: 69, train_loss: 1.0145, test_loss: 1.0761, test_f1: 0.3397
 epoch: 70, train_loss: 1.0127, test_loss: 1.0969, test_f1: 0.3372
 epoch: 71, train_loss: 1.0408, test_loss: 1.1397, test_f1: 0.4137
 epoch: 72, train_loss: 1.0506, test_loss: 1.1354, test_f1: 0.3253
 epoch: 73, train_loss: 1.0309, test_loss: 1.0808, test_f1: 0.3397
 epoch: 74, train_loss: 1.0104, test_loss: 1.0689, test_f1: 0.3421
 epoch: 75, train_loss: 1.0086, test_loss: 1.0960, test_f1: 0.3491
 epoch: 76, train_loss: 1.0212, test_loss: 1.1001, test_f1: 0.4296
 epoch: 77, train_loss: 1.0099, test_loss: 1.1183, test_f1: 0.4218
 epoch: 78, train_loss: 1.0306, test_loss: 1.1178, test_f1: 0.3355
 epoch: 79, train_loss: 1.0297, test_loss: 1.1188, test_f1: 0.3121
 epoch: 80, train_loss: 1.0225, test_loss: 1.1289, test_f1: 0.3104
 epoch: 81, train_loss: 1.1371, test_loss: 1.3385, test_f1: 0.2336
 epoch: 82, train_loss: 1.1742, test_loss: 1.3476, test_f1: 0.2281
 epoch: 83, train_loss: 1.1488, test_loss: 1.2424, test_f1: 0.3028
 epoch: 84, train_loss: 1.0844, test_loss: 1.1717, test_f1: 0.4196
 epoch: 85, train_loss: 1.0711, test_loss: 1.1496, test_f1: 0.4461
 epoch: 86, train_loss: 1.0607, test_loss: 1.1378, test_f1: 0.4339
 epoch: 87, train_loss: 1.0478, test_loss: 1.1221, test_f1: 0.4354
 epoch: 88, train_loss: 1.0446, test_loss: 1.1180, test_f1: 0.4352
 epoch: 89, train_loss: 1.0400, test_loss: 1.1111, test_f1: 0.4157
 epoch: 90, train_loss: 1.0281, test_loss: 1.1974, test_f1: 0.4088
 epoch: 91, train_loss: 1.0203, test_loss: 1.3743, test_f1: 0.3723
 epoch: 92, train_loss: 1.0076, test_loss: 1.1053, test_f1: 0.3305
 epoch: 93, train_loss: 1.0114, test_loss: 1.1249, test_f1: 0.3241
 epoch: 94, train_loss: 1.0211, test_loss: 1.1073, test_f1: 0.4233
 epoch: 95, train_loss: 1.0162, test_loss: 1.1333, test_f1: 0.4284
 epoch: 96, train_loss: 0.9992, test_loss: 1.1378, test_f1: 0.4476
 epoch: 97, train_loss: 1.0150, test_loss: 1.1900, test_f1: 0.4273
 epoch: 98, train_loss: 1.0104, test_loss: 1.1146, test_f1: 0.4559
 epoch: 99, train_loss: 1.0091, test_loss: 1.1106, test_f1: 0.4275
##################ITERATION #1 ****************************************
 epoch: 0, train_loss: 1.3095, test_loss: 1.3046, test_f1: 0.2281
 epoch: 1, train_loss: 1.2575, test_loss: 1.3081, test_f1: 0.2307
 epoch: 2, train_loss: 1.2518, test_loss: 1.6087, test_f1: 0.3279
 epoch: 3, train_loss: 1.2506, test_loss: 1.3937, test_f1: 0.2721
 epoch: 4, train_loss: 1.2487, test_loss: 1.3063, test_f1: 0.2583
 epoch: 5, train_loss: 1.2464, test_loss: 1.3017, test_f1: 0.2551
 epoch: 6, train_loss: 1.2433, test_loss: 1.3038, test_f1: 0.2583
 epoch: 7, train_loss: 1.2422, test_loss: 1.2983, test_f1: 0.2551
 epoch: 8, train_loss: 1.2456, test_loss: 1.3065, test_f1: 0.2281
 epoch: 9, train_loss: 1.2444, test_loss: 1.3039, test_f1: 0.2281
 epoch: 10, train_loss: 1.2411, test_loss: 1.3038, test_f1: 0.2281
 epoch: 11, train_loss: 1.2366, test_loss: 1.2963, test_f1: 0.2490
 epoch: 12, train_loss: 1.2370, test_loss: 1.2925, test_f1: 0.2720
 epoch: 13, train_loss: 1.2317, test_loss: 1.3076, test_f1: 0.3250
 epoch: 14, train_loss: 1.2259, test_loss: 1.3074, test_f1: 0.2721
 epoch: 15, train_loss: 1.2125, test_loss: 1.3083, test_f1: 0.2281
 epoch: 16, train_loss: 1.2238, test_loss: 1.3786, test_f1: 0.2744
 epoch: 17, train_loss: 1.2087, test_loss: 1.4593, test_f1: 0.2281
 epoch: 18, train_loss: 1.2110, test_loss: 1.2969, test_f1: 0.2281
 epoch: 19, train_loss: 1.3500, test_loss: 1.3223, test_f1: 0.2281
 epoch: 20, train_loss: 1.2431, test_loss: 1.3114, test_f1: 0.2281
 epoch: 21, train_loss: 1.2199, test_loss: 1.3534, test_f1: 0.2281
 epoch: 22, train_loss: 1.2212, test_loss: 1.2658, test_f1: 0.2281
 epoch: 23, train_loss: 1.2166, test_loss: 1.2535, test_f1: 0.2281
 epoch: 24, train_loss: 1.2054, test_loss: 1.2722, test_f1: 0.2281
 epoch: 25, train_loss: 1.1967, test_loss: 1.2684, test_f1: 0.2281
 epoch: 26, train_loss: 1.2087, test_loss: 1.3278, test_f1: 0.2281
 epoch: 27, train_loss: 1.2122, test_loss: 1.3097, test_f1: 0.2980
 epoch: 28, train_loss: 1.1991, test_loss: 1.3226, test_f1: 0.2281
 epoch: 29, train_loss: 1.2052, test_loss: 1.3238, test_f1: 0.2961
 epoch: 30, train_loss: 1.2021, test_loss: 1.3235, test_f1: 0.2281
 epoch: 31, train_loss: 1.2119, test_loss: 1.3178, test_f1: 0.2281
 epoch: 32, train_loss: 1.2052, test_loss: 1.3174, test_f1: 0.3109
 epoch: 33, train_loss: 1.2044, test_loss: 1.3049, test_f1: 0.2281
 epoch: 34, train_loss: 1.1978, test_loss: 1.3082, test_f1: 0.2281
 epoch: 35, train_loss: 1.2006, test_loss: 1.3159, test_f1: 0.2281
 epoch: 36, train_loss: 1.1997, test_loss: 1.2966, test_f1: 0.2281
 epoch: 37, train_loss: 1.1983, test_loss: 1.2894, test_f1: 0.2281
 epoch: 38, train_loss: 1.1918, test_loss: 1.2977, test_f1: 0.2281
 epoch: 39, train_loss: 1.1952, test_loss: 1.3243, test_f1: 0.2281
 epoch: 40, train_loss: 1.1970, test_loss: 1.3099, test_f1: 0.2281
 epoch: 41, train_loss: 1.1961, test_loss: 1.2905, test_f1: 0.2875
 epoch: 42, train_loss: 1.1989, test_loss: 1.2863, test_f1: 0.2281
 epoch: 43, train_loss: 1.1931, test_loss: 1.2992, test_f1: 0.2281
 epoch: 44, train_loss: 1.1910, test_loss: 1.2855, test_f1: 0.2281
 epoch: 45, train_loss: 1.1731, test_loss: 1.2765, test_f1: 0.2281
 epoch: 46, train_loss: 1.1696, test_loss: 1.2318, test_f1: 0.2281
 epoch: 47, train_loss: 1.1492, test_loss: 1.2479, test_f1: 0.2229
 epoch: 48, train_loss: 1.1557, test_loss: 1.2310, test_f1: 0.3033
 epoch: 49, train_loss: 1.1835, test_loss: 1.2590, test_f1: 0.2660
 epoch: 50, train_loss: 1.1712, test_loss: 1.2905, test_f1: 0.2281
 epoch: 51, train_loss: 1.1717, test_loss: 1.2876, test_f1: 0.2281
 epoch: 52, train_loss: 1.1757, test_loss: 1.2880, test_f1: 0.2281
 epoch: 53, train_loss: 1.1871, test_loss: 1.2802, test_f1: 0.3514
 epoch: 54, train_loss: 1.1759, test_loss: 1.2718, test_f1: 0.3441
 epoch: 55, train_loss: 1.1678, test_loss: 1.2445, test_f1: 0.2281
 epoch: 56, train_loss: 1.1566, test_loss: 1.2595, test_f1: 0.2767
 epoch: 57, train_loss: 1.1484, test_loss: 1.2449, test_f1: 0.3142
 epoch: 58, train_loss: 1.1475, test_loss: 1.2433, test_f1: 0.3228
 epoch: 59, train_loss: 1.1766, test_loss: 1.2651, test_f1: 0.2281
 epoch: 60, train_loss: 1.1721, test_loss: 1.2750, test_f1: 0.2959
 epoch: 61, train_loss: 1.1652, test_loss: 1.2755, test_f1: 0.2989
 epoch: 62, train_loss: 1.1709, test_loss: 1.2692, test_f1: 0.2989
 epoch: 63, train_loss: 1.1578, test_loss: 1.2575, test_f1: 0.2281
 epoch: 64, train_loss: 1.1433, test_loss: 1.2538, test_f1: 0.2281
 epoch: 65, train_loss: 1.1384, test_loss: 1.2516, test_f1: 0.2281
 epoch: 66, train_loss: 1.1357, test_loss: 1.2601, test_f1: 0.2843
 epoch: 67, train_loss: 1.1370, test_loss: 1.2673, test_f1: 0.2474
 epoch: 68, train_loss: 1.1509, test_loss: 1.2797, test_f1: 0.1914
 epoch: 69, train_loss: 1.1567, test_loss: 1.2820, test_f1: 0.2281
 epoch: 70, train_loss: 1.1582, test_loss: 1.2512, test_f1: 0.2924
 epoch: 71, train_loss: 1.1466, test_loss: 1.2856, test_f1: 0.2281
 epoch: 72, train_loss: 1.1564, test_loss: 1.2836, test_f1: 0.2281
 epoch: 73, train_loss: 1.1455, test_loss: 1.2218, test_f1: 0.3014
 epoch: 74, train_loss: 1.1544, test_loss: 1.2350, test_f1: 0.2100
 epoch: 75, train_loss: 1.1542, test_loss: 1.2477, test_f1: 0.2770
 epoch: 76, train_loss: 1.1492, test_loss: 1.2505, test_f1: 0.2281
 epoch: 77, train_loss: 1.1481, test_loss: 1.2646, test_f1: 0.3134
 epoch: 78, train_loss: 1.1340, test_loss: 1.2516, test_f1: 0.2281
 epoch: 79, train_loss: 1.1379, test_loss: 1.2438, test_f1: 0.2281
 epoch: 80, train_loss: 1.1404, test_loss: 1.2283, test_f1: 0.2756
 epoch: 81, train_loss: 1.1470, test_loss: 1.3280, test_f1: 0.1469
 epoch: 82, train_loss: 1.1427, test_loss: 1.2796, test_f1: 0.2068
 epoch: 83, train_loss: 1.1314, test_loss: 1.2821, test_f1: 0.2153
 epoch: 84, train_loss: 1.1439, test_loss: 1.2241, test_f1: 0.2719
 epoch: 85, train_loss: 1.1487, test_loss: 1.2217, test_f1: 0.3089
 epoch: 86, train_loss: 1.1306, test_loss: 1.2530, test_f1: 0.3018
 epoch: 87, train_loss: 1.1222, test_loss: 1.2446, test_f1: 0.3138
 epoch: 88, train_loss: 1.1346, test_loss: 1.2517, test_f1: 0.3132
 epoch: 89, train_loss: 1.1215, test_loss: 1.2334, test_f1: 0.3140
 epoch: 90, train_loss: 1.1054, test_loss: 1.2436, test_f1: 0.3110
 epoch: 91, train_loss: 1.1149, test_loss: 1.2426, test_f1: 0.3089
 epoch: 92, train_loss: 1.1136, test_loss: 1.2307, test_f1: 0.3065
 epoch: 93, train_loss: 1.1297, test_loss: 1.2432, test_f1: 0.2931
 epoch: 94, train_loss: 1.1332, test_loss: 1.2476, test_f1: 0.2913
 epoch: 95, train_loss: 1.1116, test_loss: 1.2614, test_f1: 0.2956
 epoch: 96, train_loss: 1.1136, test_loss: 1.2336, test_f1: 0.2930
 epoch: 97, train_loss: 1.1190, test_loss: 1.2525, test_f1: 0.2204
 epoch: 98, train_loss: 1.1170, test_loss: 1.2464, test_f1: 0.2794
 epoch: 99, train_loss: 1.1200, test_loss: 1.2521, test_f1: 0.2834
##################ITERATION #2 ****************************************
 epoch: 0, train_loss: 1.2815, test_loss: 1.4309, test_f1: 0.2281
 epoch: 1, train_loss: 1.1672, test_loss: 1.4121, test_f1: 0.1365
 epoch: 2, train_loss: 1.1448, test_loss: 1.4155, test_f1: 0.2281
 epoch: 3, train_loss: 1.1479, test_loss: 1.4162, test_f1: 0.2336
 epoch: 4, train_loss: 1.1373, test_loss: 1.3406, test_f1: 0.2808
 epoch: 5, train_loss: 1.1187, test_loss: 1.3000, test_f1: 0.2913
 epoch: 6, train_loss: 1.1260, test_loss: 1.3173, test_f1: 0.2631
 epoch: 7, train_loss: 1.1249, test_loss: 1.2303, test_f1: 0.3078
 epoch: 8, train_loss: 1.1220, test_loss: 1.2413, test_f1: 0.3109
 epoch: 9, train_loss: 1.0972, test_loss: 1.4002, test_f1: 0.2336
 epoch: 10, train_loss: 1.1259, test_loss: 1.3199, test_f1: 0.2675
 epoch: 11, train_loss: 1.0897, test_loss: 1.2976, test_f1: 0.2028
 epoch: 12, train_loss: 1.1339, test_loss: 1.2049, test_f1: 0.3146
 epoch: 13, train_loss: 1.1055, test_loss: 1.3038, test_f1: 0.2631
 epoch: 14, train_loss: 1.1010, test_loss: 1.1530, test_f1: 0.3321
 epoch: 15, train_loss: 1.1014, test_loss: 1.2620, test_f1: 0.3051
 epoch: 16, train_loss: 1.0900, test_loss: 1.1780, test_f1: 0.2442
 epoch: 17, train_loss: 1.0897, test_loss: 1.3075, test_f1: 0.2675
 epoch: 18, train_loss: 1.0538, test_loss: 1.2112, test_f1: 0.3176
 epoch: 19, train_loss: 1.0484, test_loss: 1.1848, test_f1: 0.3290
 epoch: 20, train_loss: 1.0438, test_loss: 1.1988, test_f1: 0.3205
 epoch: 21, train_loss: 1.0529, test_loss: 1.2608, test_f1: 0.3115
 epoch: 22, train_loss: 1.0364, test_loss: 1.1712, test_f1: 0.3370
 epoch: 23, train_loss: 1.0289, test_loss: 1.1616, test_f1: 0.3395
 epoch: 24, train_loss: 1.0188, test_loss: 1.1568, test_f1: 0.3198
 epoch: 25, train_loss: 1.0196, test_loss: 1.2110, test_f1: 0.3147
 epoch: 26, train_loss: 1.0207, test_loss: 1.5962, test_f1: 0.2415
 epoch: 27, train_loss: 1.0322, test_loss: 1.3957, test_f1: 0.2836
 epoch: 28, train_loss: 1.0334, test_loss: 1.1335, test_f1: 0.3444
 epoch: 29, train_loss: 1.0384, test_loss: 1.1761, test_f1: 0.3290
 epoch: 30, train_loss: 1.0932, test_loss: 1.2881, test_f1: 0.2113
 epoch: 31, train_loss: 1.0472, test_loss: 1.2365, test_f1: 0.3212
 epoch: 32, train_loss: 1.0655, test_loss: 1.1129, test_f1: 0.3395
 epoch: 33, train_loss: 1.0396, test_loss: 1.1383, test_f1: 0.3277
 epoch: 34, train_loss: 1.0333, test_loss: 1.1046, test_f1: 0.3463
 epoch: 35, train_loss: 1.0321, test_loss: 1.1822, test_f1: 0.3109
 epoch: 36, train_loss: 1.0738, test_loss: 1.1651, test_f1: 0.3317
 epoch: 37, train_loss: 1.0768, test_loss: 1.1645, test_f1: 0.3290
 epoch: 38, train_loss: 1.0484, test_loss: 1.1642, test_f1: 0.3317
 epoch: 39, train_loss: 1.0489, test_loss: 1.1308, test_f1: 0.3370
 epoch: 40, train_loss: 1.0451, test_loss: 1.1137, test_f1: 0.3420
 epoch: 41, train_loss: 1.0260, test_loss: 1.1188, test_f1: 0.3492
 epoch: 42, train_loss: 1.0199, test_loss: 1.0925, test_f1: 0.3492
 epoch: 43, train_loss: 1.0473, test_loss: 1.0832, test_f1: 0.3484
 epoch: 44, train_loss: 1.0253, test_loss: 1.1542, test_f1: 0.2554
 epoch: 45, train_loss: 1.0209, test_loss: 1.0993, test_f1: 0.3461
 epoch: 46, train_loss: 1.0467, test_loss: 1.0914, test_f1: 0.3492
 epoch: 47, train_loss: 1.0691, test_loss: 1.1502, test_f1: 0.3304
 epoch: 48, train_loss: 1.0536, test_loss: 1.1668, test_f1: 0.3344
 epoch: 49, train_loss: 1.0427, test_loss: 1.3140, test_f1: 0.2838
 epoch: 50, train_loss: 1.0359, test_loss: 1.2158, test_f1: 0.3176
 epoch: 51, train_loss: 1.0312, test_loss: 1.1056, test_f1: 0.3492
 epoch: 52, train_loss: 1.0231, test_loss: 1.0821, test_f1: 0.3515
 epoch: 53, train_loss: 1.0203, test_loss: 1.0941, test_f1: 0.4112
 epoch: 54, train_loss: 1.0172, test_loss: 1.0784, test_f1: 0.3492
 epoch: 55, train_loss: 1.0239, test_loss: 1.0940, test_f1: 0.3492
 epoch: 56, train_loss: 1.0142, test_loss: 1.1174, test_f1: 0.3444
 epoch: 57, train_loss: 1.0136, test_loss: 1.0977, test_f1: 0.3492
 epoch: 58, train_loss: 1.0397, test_loss: 1.1830, test_f1: 0.3290
 epoch: 59, train_loss: 1.0115, test_loss: 1.2527, test_f1: 0.3115
 epoch: 60, train_loss: 1.0164, test_loss: 1.2086, test_f1: 0.3234
 epoch: 61, train_loss: 1.0089, test_loss: 1.1341, test_f1: 0.3344
 epoch: 62, train_loss: 1.0080, test_loss: 1.1047, test_f1: 0.3468
 epoch: 63, train_loss: 1.0113, test_loss: 1.1142, test_f1: 0.3420
 epoch: 64, train_loss: 1.0133, test_loss: 1.1327, test_f1: 0.3420
 epoch: 65, train_loss: 1.0039, test_loss: 1.1053, test_f1: 0.3492
 epoch: 66, train_loss: 0.9993, test_loss: 1.1279, test_f1: 0.3420
 epoch: 67, train_loss: 0.9944, test_loss: 1.1155, test_f1: 0.3492
 epoch: 68, train_loss: 0.9979, test_loss: 1.0910, test_f1: 0.3445
 epoch: 69, train_loss: 0.9915, test_loss: 1.0984, test_f1: 0.3431
 epoch: 70, train_loss: 0.9929, test_loss: 1.0947, test_f1: 0.3378
 epoch: 71, train_loss: 1.0032, test_loss: 1.1100, test_f1: 0.3492
 epoch: 72, train_loss: 0.9983, test_loss: 1.1196, test_f1: 0.3492
 epoch: 73, train_loss: 1.0022, test_loss: 1.1963, test_f1: 0.3344
 epoch: 74, train_loss: 0.9888, test_loss: 1.1359, test_f1: 0.3468
 epoch: 75, train_loss: 1.0152, test_loss: 1.1340, test_f1: 0.3444
 epoch: 76, train_loss: 0.9978, test_loss: 1.1274, test_f1: 0.3352
 epoch: 77, train_loss: 1.0002, test_loss: 1.1220, test_f1: 0.3375
 epoch: 78, train_loss: 0.9985, test_loss: 1.1417, test_f1: 0.3976
 epoch: 79, train_loss: 0.9959, test_loss: 1.2243, test_f1: 0.3204
 epoch: 80, train_loss: 1.0165, test_loss: 1.3321, test_f1: 0.2950
 epoch: 81, train_loss: 1.0027, test_loss: 1.4012, test_f1: 0.2936
 epoch: 82, train_loss: 1.0214, test_loss: 1.5646, test_f1: 0.2803
 epoch: 83, train_loss: 1.0252, test_loss: 1.2367, test_f1: 0.3099
 epoch: 84, train_loss: 0.9996, test_loss: 1.1812, test_f1: 0.3180
 epoch: 85, train_loss: 0.9930, test_loss: 1.2290, test_f1: 0.3720
 epoch: 86, train_loss: 1.0136, test_loss: 1.1656, test_f1: 0.3395
 epoch: 87, train_loss: 1.0015, test_loss: 1.1583, test_f1: 0.3290
 epoch: 88, train_loss: 0.9998, test_loss: 1.2129, test_f1: 0.2990
 epoch: 89, train_loss: 0.9923, test_loss: 1.1128, test_f1: 0.3421
 epoch: 90, train_loss: 0.9883, test_loss: 1.1411, test_f1: 0.3398
 epoch: 91, train_loss: 1.0221, test_loss: 1.1877, test_f1: 0.3344
 epoch: 92, train_loss: 1.0185, test_loss: 1.1385, test_f1: 0.3370
 epoch: 93, train_loss: 1.0063, test_loss: 1.1387, test_f1: 0.3395
 epoch: 94, train_loss: 1.0052, test_loss: 1.2766, test_f1: 0.3115
 epoch: 95, train_loss: 0.9989, test_loss: 1.2219, test_f1: 0.3205
 epoch: 96, train_loss: 0.9983, test_loss: 1.2777, test_f1: 0.3083
 epoch: 97, train_loss: 0.9965, test_loss: 1.1987, test_f1: 0.3262
 epoch: 98, train_loss: 0.9941, test_loss: 1.1780, test_f1: 0.3395
 epoch: 99, train_loss: 0.9885, test_loss: 1.0951, test_f1: 0.3445
##################ITERATION #3 ****************************************
 epoch: 0, train_loss: 1.5301, test_loss: 1.3858, test_f1: 0.2281
 epoch: 1, train_loss: 1.2216, test_loss: 1.3198, test_f1: 0.2281
 epoch: 2, train_loss: 1.2141, test_loss: 1.3091, test_f1: 0.2281
 epoch: 3, train_loss: 1.1536, test_loss: 1.4122, test_f1: 0.2829
 epoch: 4, train_loss: 1.1242, test_loss: 1.2431, test_f1: 0.2443
 epoch: 5, train_loss: 1.0907, test_loss: 1.2872, test_f1: 0.3320
 epoch: 6, train_loss: 1.1234, test_loss: 1.1802, test_f1: 0.3977
 epoch: 7, train_loss: 1.0873, test_loss: 1.2009, test_f1: 0.4157
 epoch: 8, train_loss: 1.0975, test_loss: 1.1926, test_f1: 0.3729
 epoch: 9, train_loss: 1.0824, test_loss: 1.1856, test_f1: 0.3500
 epoch: 10, train_loss: 1.0745, test_loss: 1.1803, test_f1: 0.4282
 epoch: 11, train_loss: 1.0502, test_loss: 1.2123, test_f1: 0.4222
 epoch: 12, train_loss: 1.0396, test_loss: 1.2835, test_f1: 0.4397
 epoch: 13, train_loss: 1.0493, test_loss: 1.1454, test_f1: 0.4492
 epoch: 14, train_loss: 1.0308, test_loss: 1.1553, test_f1: 0.3196
 epoch: 15, train_loss: 1.0595, test_loss: 1.3181, test_f1: 0.2818
 epoch: 16, train_loss: 1.0445, test_loss: 1.1482, test_f1: 0.4316
 epoch: 17, train_loss: 1.0196, test_loss: 1.3822, test_f1: 0.3805
 epoch: 18, train_loss: 1.0356, test_loss: 1.3159, test_f1: 0.3962
 epoch: 19, train_loss: 1.0158, test_loss: 1.4550, test_f1: 0.3006
 epoch: 20, train_loss: 1.0133, test_loss: 1.1708, test_f1: 0.4300
 epoch: 21, train_loss: 1.0209, test_loss: 1.1389, test_f1: 0.4091
 epoch: 22, train_loss: 1.0264, test_loss: 1.1652, test_f1: 0.4075
 epoch: 23, train_loss: 1.1023, test_loss: 1.1924, test_f1: 0.3706
 epoch: 24, train_loss: 1.0471, test_loss: 1.4159, test_f1: 0.3930
 epoch: 25, train_loss: 1.0400, test_loss: 1.1900, test_f1: 0.4356
 epoch: 26, train_loss: 1.0258, test_loss: 1.3218, test_f1: 0.3133
 epoch: 27, train_loss: 1.0298, test_loss: 1.1654, test_f1: 0.3262
 epoch: 28, train_loss: 1.0248, test_loss: 1.1997, test_f1: 0.4446
 epoch: 29, train_loss: 1.0166, test_loss: 1.1705, test_f1: 0.3281
 epoch: 30, train_loss: 1.0157, test_loss: 1.2736, test_f1: 0.3530
 epoch: 31, train_loss: 1.0064, test_loss: 1.1748, test_f1: 0.3344
 epoch: 32, train_loss: 1.0121, test_loss: 1.1736, test_f1: 0.4463
 epoch: 33, train_loss: 1.0247, test_loss: 1.0829, test_f1: 0.3355
 epoch: 34, train_loss: 0.9974, test_loss: 1.1431, test_f1: 0.4345
 epoch: 35, train_loss: 1.0063, test_loss: 1.1747, test_f1: 0.4510
 epoch: 36, train_loss: 1.0017, test_loss: 1.3948, test_f1: 0.3097
 epoch: 37, train_loss: 1.0314, test_loss: 1.2190, test_f1: 0.4181
 epoch: 38, train_loss: 1.0287, test_loss: 1.2904, test_f1: 0.4289
 epoch: 39, train_loss: 1.0083, test_loss: 1.3084, test_f1: 0.4205
 epoch: 40, train_loss: 1.0140, test_loss: 1.2071, test_f1: 0.4254
 epoch: 41, train_loss: 1.0199, test_loss: 1.1201, test_f1: 0.3381
 epoch: 42, train_loss: 1.0117, test_loss: 1.1476, test_f1: 0.4476
 epoch: 43, train_loss: 1.0225, test_loss: 1.2171, test_f1: 0.3290
 epoch: 44, train_loss: 1.0044, test_loss: 1.3464, test_f1: 0.3532
 epoch: 45, train_loss: 1.0016, test_loss: 1.1852, test_f1: 0.4064
 epoch: 46, train_loss: 0.9795, test_loss: 1.1178, test_f1: 0.3947
 epoch: 47, train_loss: 1.0227, test_loss: 1.1264, test_f1: 0.3329
 epoch: 48, train_loss: 0.9992, test_loss: 1.1164, test_f1: 0.4231
 epoch: 49, train_loss: 1.0092, test_loss: 1.1262, test_f1: 0.3420
 epoch: 50, train_loss: 1.0056, test_loss: 1.0763, test_f1: 0.3731
 epoch: 51, train_loss: 0.9871, test_loss: 1.1141, test_f1: 0.3745
 epoch: 52, train_loss: 0.9856, test_loss: 1.1113, test_f1: 0.3420
 epoch: 53, train_loss: 0.9882, test_loss: 1.0900, test_f1: 0.3420
 epoch: 54, train_loss: 1.0035, test_loss: 1.0939, test_f1: 0.4617
 epoch: 55, train_loss: 0.9987, test_loss: 1.0714, test_f1: 0.3943
 epoch: 56, train_loss: 0.9739, test_loss: 1.0793, test_f1: 0.3537
 epoch: 57, train_loss: 0.9846, test_loss: 1.1186, test_f1: 0.4447
 epoch: 58, train_loss: 0.9643, test_loss: 1.2120, test_f1: 0.4112
 epoch: 59, train_loss: 0.9625, test_loss: 1.1370, test_f1: 0.4166
 epoch: 60, train_loss: 0.9683, test_loss: 1.0734, test_f1: 0.3796
 epoch: 61, train_loss: 0.9536, test_loss: 1.2107, test_f1: 0.4745
 epoch: 62, train_loss: 0.9946, test_loss: 1.2874, test_f1: 0.3348
 epoch: 63, train_loss: 0.9757, test_loss: 1.1495, test_f1: 0.3400
 epoch: 64, train_loss: 0.9914, test_loss: 1.1080, test_f1: 0.4389
 epoch: 65, train_loss: 0.9869, test_loss: 1.0499, test_f1: 0.3515
 epoch: 66, train_loss: 0.9645, test_loss: 1.0446, test_f1: 0.4670
 epoch: 67, train_loss: 0.9664, test_loss: 1.0895, test_f1: 0.4428
 epoch: 68, train_loss: 0.9984, test_loss: 1.1302, test_f1: 0.3497
 epoch: 69, train_loss: 0.9943, test_loss: 1.0547, test_f1: 0.4912
 epoch: 70, train_loss: 1.0114, test_loss: 1.1212, test_f1: 0.4537
 epoch: 71, train_loss: 0.9896, test_loss: 1.1293, test_f1: 0.3348
 epoch: 72, train_loss: 0.9874, test_loss: 1.1764, test_f1: 0.3953
 epoch: 73, train_loss: 0.9738, test_loss: 1.0702, test_f1: 0.3429
 epoch: 74, train_loss: 0.9789, test_loss: 1.0343, test_f1: 0.4559
 epoch: 75, train_loss: 0.9780, test_loss: 1.0298, test_f1: 0.3454
 epoch: 76, train_loss: 0.9811, test_loss: 1.0426, test_f1: 0.4526
 epoch: 77, train_loss: 0.9715, test_loss: 1.1542, test_f1: 0.3344
 epoch: 78, train_loss: 0.9690, test_loss: 1.0901, test_f1: 0.4759
 epoch: 79, train_loss: 0.9600, test_loss: 1.0378, test_f1: 0.4803
 epoch: 80, train_loss: 0.9589, test_loss: 1.0372, test_f1: 0.3492
 epoch: 81, train_loss: 0.9655, test_loss: 1.0409, test_f1: 0.4123
 epoch: 82, train_loss: 0.9520, test_loss: 1.0491, test_f1: 0.3492
 epoch: 83, train_loss: 0.9467, test_loss: 1.0671, test_f1: 0.3492
 epoch: 84, train_loss: 0.9477, test_loss: 1.0868, test_f1: 0.4579
 epoch: 85, train_loss: 0.9453, test_loss: 1.0305, test_f1: 0.4246
 epoch: 86, train_loss: 0.9294, test_loss: 1.0177, test_f1: 0.4843
 epoch: 87, train_loss: 0.9346, test_loss: 1.0701, test_f1: 0.4567
 epoch: 88, train_loss: 0.9311, test_loss: 1.0856, test_f1: 0.4510
 epoch: 89, train_loss: 0.9961, test_loss: 1.1485, test_f1: 0.3993
 epoch: 90, train_loss: 0.9946, test_loss: 1.2458, test_f1: 0.4375
 epoch: 91, train_loss: 0.9717, test_loss: 1.3148, test_f1: 0.4037
 epoch: 92, train_loss: 0.9771, test_loss: 1.1236, test_f1: 0.3712
 epoch: 93, train_loss: 0.9725, test_loss: 1.1873, test_f1: 0.4232
 epoch: 94, train_loss: 0.9774, test_loss: 1.1459, test_f1: 0.3400
 epoch: 95, train_loss: 0.9625, test_loss: 1.2102, test_f1: 0.3780
 epoch: 96, train_loss: 0.9594, test_loss: 1.0388, test_f1: 0.3830
 epoch: 97, train_loss: 0.9475, test_loss: 1.0535, test_f1: 0.3514
 epoch: 98, train_loss: 0.9522, test_loss: 1.1245, test_f1: 0.4874
 epoch: 99, train_loss: 0.9408, test_loss: 1.0886, test_f1: 0.3658
##################ITERATION #4 ****************************************
 epoch: 0, train_loss: 1.4739, test_loss: 1.8679, test_f1: 0.2281
 epoch: 1, train_loss: 1.2016, test_loss: 1.9971, test_f1: 0.1365
 epoch: 2, train_loss: 1.1615, test_loss: 1.8677, test_f1: 0.1365
 epoch: 3, train_loss: 1.1193, test_loss: 1.3704, test_f1: 0.2281
 epoch: 4, train_loss: 1.1718, test_loss: 1.3020, test_f1: 0.3512
 epoch: 5, train_loss: 1.1446, test_loss: 1.2436, test_f1: 0.2585
 epoch: 6, train_loss: 1.1251, test_loss: 1.2332, test_f1: 0.3320
 epoch: 7, train_loss: 1.0783, test_loss: 1.1785, test_f1: 0.3602
 epoch: 8, train_loss: 1.0729, test_loss: 1.1513, test_f1: 0.3265
 epoch: 9, train_loss: 1.0763, test_loss: 1.1760, test_f1: 0.3987
 epoch: 10, train_loss: 1.0356, test_loss: 1.1937, test_f1: 0.3234
 epoch: 11, train_loss: 1.0499, test_loss: 1.4871, test_f1: 0.3251
 epoch: 12, train_loss: 1.1043, test_loss: 1.8446, test_f1: 0.3168
 epoch: 13, train_loss: 1.0687, test_loss: 1.3414, test_f1: 0.4147
 epoch: 14, train_loss: 1.0451, test_loss: 1.2482, test_f1: 0.4075
 epoch: 15, train_loss: 1.0368, test_loss: 1.2030, test_f1: 0.3796
 epoch: 16, train_loss: 1.0142, test_loss: 1.1696, test_f1: 0.3828
 epoch: 17, train_loss: 1.0190, test_loss: 1.2146, test_f1: 0.4059
 epoch: 18, train_loss: 1.1447, test_loss: 1.2483, test_f1: 0.2437
 epoch: 19, train_loss: 1.1476, test_loss: 1.4542, test_f1: 0.2795
 epoch: 20, train_loss: 1.0989, test_loss: 1.1771, test_f1: 0.3611
 epoch: 21, train_loss: 1.0786, test_loss: 1.2383, test_f1: 0.3461
 epoch: 22, train_loss: 1.0513, test_loss: 1.2006, test_f1: 0.3801
 epoch: 23, train_loss: 1.0413, test_loss: 1.1676, test_f1: 0.4103
 epoch: 24, train_loss: 1.0685, test_loss: 1.1744, test_f1: 0.4275
 epoch: 25, train_loss: 1.0327, test_loss: 1.1749, test_f1: 0.3205
 epoch: 26, train_loss: 1.0269, test_loss: 1.3343, test_f1: 0.4267
 epoch: 27, train_loss: 1.0214, test_loss: 1.1385, test_f1: 0.4457
 epoch: 28, train_loss: 1.0184, test_loss: 1.0934, test_f1: 0.3992
 epoch: 29, train_loss: 1.0222, test_loss: 1.1846, test_f1: 0.3714
 epoch: 30, train_loss: 1.0073, test_loss: 1.0710, test_f1: 0.3886
 epoch: 31, train_loss: 1.0127, test_loss: 1.1360, test_f1: 0.3869
 epoch: 32, train_loss: 1.0300, test_loss: 1.3557, test_f1: 0.3132
 epoch: 33, train_loss: 1.0662, test_loss: 1.1482, test_f1: 0.3325
 epoch: 34, train_loss: 1.0254, test_loss: 1.1885, test_f1: 0.4267
 epoch: 35, train_loss: 1.0251, test_loss: 1.2126, test_f1: 0.3973
 epoch: 36, train_loss: 1.0167, test_loss: 1.2545, test_f1: 0.4111
 epoch: 37, train_loss: 1.0116, test_loss: 1.2471, test_f1: 0.4041
 epoch: 38, train_loss: 1.0213, test_loss: 1.1766, test_f1: 0.3510
 epoch: 39, train_loss: 1.0209, test_loss: 1.1921, test_f1: 0.4246
 epoch: 40, train_loss: 1.0011, test_loss: 1.1730, test_f1: 0.4142
 epoch: 41, train_loss: 1.0172, test_loss: 1.1113, test_f1: 0.3681
 epoch: 42, train_loss: 0.9928, test_loss: 1.1282, test_f1: 0.3664
 epoch: 43, train_loss: 0.9961, test_loss: 1.1276, test_f1: 0.3636
 epoch: 44, train_loss: 0.9984, test_loss: 1.1413, test_f1: 0.4061
 epoch: 45, train_loss: 1.0078, test_loss: 1.4471, test_f1: 0.3395
 epoch: 46, train_loss: 1.0357, test_loss: 1.2253, test_f1: 0.4058
 epoch: 47, train_loss: 1.0081, test_loss: 1.2450, test_f1: 0.4321
 epoch: 48, train_loss: 0.9941, test_loss: 1.1151, test_f1: 0.4339
 epoch: 49, train_loss: 0.9752, test_loss: 1.0939, test_f1: 0.3872
 epoch: 50, train_loss: 0.9711, test_loss: 1.1492, test_f1: 0.4203
 epoch: 51, train_loss: 0.9777, test_loss: 1.0942, test_f1: 0.4522
 epoch: 52, train_loss: 0.9645, test_loss: 1.1175, test_f1: 0.4347
 epoch: 53, train_loss: 0.9544, test_loss: 1.1101, test_f1: 0.4294
 epoch: 54, train_loss: 0.9681, test_loss: 1.0965, test_f1: 0.3376
 epoch: 55, train_loss: 0.9702, test_loss: 1.1168, test_f1: 0.4191
 epoch: 56, train_loss: 0.9674, test_loss: 1.1201, test_f1: 0.4496
 epoch: 57, train_loss: 0.9724, test_loss: 1.0650, test_f1: 0.3444
 epoch: 58, train_loss: 0.9622, test_loss: 1.1463, test_f1: 0.4321
 epoch: 59, train_loss: 0.9601, test_loss: 1.1477, test_f1: 0.4371
 epoch: 60, train_loss: 0.9484, test_loss: 1.1113, test_f1: 0.4649
 epoch: 61, train_loss: 0.9543, test_loss: 1.0522, test_f1: 0.4677
 epoch: 62, train_loss: 0.9438, test_loss: 1.0764, test_f1: 0.3812
 epoch: 63, train_loss: 0.9439, test_loss: 1.0716, test_f1: 0.4697
 epoch: 64, train_loss: 0.9352, test_loss: 1.0832, test_f1: 0.4628
 epoch: 65, train_loss: 0.9485, test_loss: 1.0829, test_f1: 0.4672
 epoch: 66, train_loss: 0.9506, test_loss: 1.2269, test_f1: 0.4412
 epoch: 67, train_loss: 0.9583, test_loss: 1.1492, test_f1: 0.3864
 epoch: 68, train_loss: 0.9770, test_loss: 1.0984, test_f1: 0.3874
 epoch: 69, train_loss: 0.9741, test_loss: 1.0939, test_f1: 0.4722
 epoch: 70, train_loss: 0.9583, test_loss: 1.3267, test_f1: 0.3123
 epoch: 71, train_loss: 0.9574, test_loss: 1.0531, test_f1: 0.3857
 epoch: 72, train_loss: 0.9455, test_loss: 1.0640, test_f1: 0.4679
 epoch: 73, train_loss: 0.9378, test_loss: 1.0545, test_f1: 0.4738
 epoch: 74, train_loss: 0.9335, test_loss: 1.1026, test_f1: 0.4391
 epoch: 75, train_loss: 0.9425, test_loss: 1.1864, test_f1: 0.4301
 epoch: 76, train_loss: 0.9429, test_loss: 1.0814, test_f1: 0.4549
 epoch: 77, train_loss: 0.9294, test_loss: 1.4184, test_f1: 0.3937
 epoch: 78, train_loss: 0.9374, test_loss: 1.1692, test_f1: 0.4667
 epoch: 79, train_loss: 0.9340, test_loss: 1.1326, test_f1: 0.4348
 epoch: 80, train_loss: 0.9326, test_loss: 1.2348, test_f1: 0.4322
 epoch: 81, train_loss: 0.9276, test_loss: 1.3625, test_f1: 0.3663
 epoch: 82, train_loss: 0.9375, test_loss: 1.4049, test_f1: 0.4292
 epoch: 83, train_loss: 0.9291, test_loss: 1.2091, test_f1: 0.4409
 epoch: 84, train_loss: 0.9494, test_loss: 1.2527, test_f1: 0.4040
 epoch: 85, train_loss: 0.9589, test_loss: 1.1022, test_f1: 0.3742
 epoch: 86, train_loss: 0.9515, test_loss: 1.1029, test_f1: 0.4593
 epoch: 87, train_loss: 0.9446, test_loss: 1.0735, test_f1: 0.3954
 epoch: 88, train_loss: 0.9482, test_loss: 1.1352, test_f1: 0.3999
 epoch: 89, train_loss: 0.9324, test_loss: 1.7972, test_f1: 0.3164
 epoch: 90, train_loss: 0.9358, test_loss: 1.1624, test_f1: 0.4256
 epoch: 91, train_loss: 0.9463, test_loss: 1.0759, test_f1: 0.4276
 epoch: 92, train_loss: 0.9333, test_loss: 1.1670, test_f1: 0.4554
 epoch: 93, train_loss: 0.9289, test_loss: 1.1680, test_f1: 0.3529
 epoch: 94, train_loss: 0.9429, test_loss: 1.1503, test_f1: 0.4483
 epoch: 95, train_loss: 0.9337, test_loss: 1.2751, test_f1: 0.4095
 epoch: 96, train_loss: 0.9195, test_loss: 1.1930, test_f1: 0.4567
 epoch: 97, train_loss: 0.9442, test_loss: 1.1805, test_f1: 0.4501
 epoch: 98, train_loss: 0.9586, test_loss: 1.2755, test_f1: 0.3730
 epoch: 99, train_loss: 0.9406, test_loss: 1.3005, test_f1: 0.3147
##################ITERATION #5 ****************************************
 epoch: 0, train_loss: 1.3064, test_loss: 3.2698, test_f1: 0.1365
 epoch: 1, train_loss: 1.2120, test_loss: 1.6503, test_f1: 0.1379
 epoch: 2, train_loss: 1.1686, test_loss: 2.5196, test_f1: 0.1368
 epoch: 3, train_loss: 1.1400, test_loss: 2.7766, test_f1: 0.1368
 epoch: 4, train_loss: 1.0984, test_loss: 2.3409, test_f1: 0.1377
 epoch: 5, train_loss: 1.1069, test_loss: 1.9121, test_f1: 0.2447
 epoch: 6, train_loss: 1.0667, test_loss: 1.5733, test_f1: 0.2927
 epoch: 7, train_loss: 1.0784, test_loss: 1.4409, test_f1: 0.2931
 epoch: 8, train_loss: 1.1123, test_loss: 1.2222, test_f1: 0.3163
 epoch: 9, train_loss: 1.0706, test_loss: 1.1253, test_f1: 0.3667
 epoch: 10, train_loss: 1.0691, test_loss: 1.4866, test_f1: 0.2398
 epoch: 11, train_loss: 1.0692, test_loss: 1.4966, test_f1: 0.2935
 epoch: 12, train_loss: 1.0534, test_loss: 1.4123, test_f1: 0.3174
 epoch: 13, train_loss: 1.0393, test_loss: 1.2280, test_f1: 0.4042
 epoch: 14, train_loss: 1.0339, test_loss: 1.0989, test_f1: 0.3675
 epoch: 15, train_loss: 1.0209, test_loss: 1.1542, test_f1: 0.3757
 epoch: 16, train_loss: 1.0079, test_loss: 1.1538, test_f1: 0.3928
 epoch: 17, train_loss: 1.0000, test_loss: 1.0801, test_f1: 0.4181
 epoch: 18, train_loss: 1.0179, test_loss: 1.5074, test_f1: 0.3034
 epoch: 19, train_loss: 1.0349, test_loss: 1.5033, test_f1: 0.3048
 epoch: 20, train_loss: 1.0384, test_loss: 1.5004, test_f1: 0.2407
 epoch: 21, train_loss: 1.0377, test_loss: 1.1984, test_f1: 0.3986
 epoch: 22, train_loss: 1.0148, test_loss: 1.0846, test_f1: 0.4277
 epoch: 23, train_loss: 1.0121, test_loss: 1.2225, test_f1: 0.3875
 epoch: 24, train_loss: 1.0365, test_loss: 1.0738, test_f1: 0.4366
 epoch: 25, train_loss: 1.0500, test_loss: 1.3320, test_f1: 0.3762
 epoch: 26, train_loss: 1.0357, test_loss: 2.5613, test_f1: 0.2736
 epoch: 27, train_loss: 1.0632, test_loss: 1.4002, test_f1: 0.1672
 epoch: 28, train_loss: 1.0364, test_loss: 1.1480, test_f1: 0.3545
 epoch: 29, train_loss: 1.0469, test_loss: 1.9313, test_f1: 0.1852
 epoch: 30, train_loss: 1.0603, test_loss: 2.2822, test_f1: 0.1453
 epoch: 31, train_loss: 1.0441, test_loss: 2.7674, test_f1: 0.1374
 epoch: 32, train_loss: 1.0214, test_loss: 1.8270, test_f1: 0.2504
 epoch: 33, train_loss: 0.9975, test_loss: 1.1460, test_f1: 0.3325
 epoch: 34, train_loss: 0.9938, test_loss: 1.2262, test_f1: 0.4074
 epoch: 35, train_loss: 0.9981, test_loss: 1.3410, test_f1: 0.3422
 epoch: 36, train_loss: 1.0058, test_loss: 1.0892, test_f1: 0.4481
 epoch: 37, train_loss: 1.0571, test_loss: 1.9038, test_f1: 0.2625
 epoch: 38, train_loss: 1.0220, test_loss: 1.8562, test_f1: 0.2422
 epoch: 39, train_loss: 1.0448, test_loss: 1.2941, test_f1: 0.3195
 epoch: 40, train_loss: 1.0239, test_loss: 1.0923, test_f1: 0.4539
 epoch: 41, train_loss: 1.0384, test_loss: 1.0678, test_f1: 0.3409
 epoch: 42, train_loss: 0.9955, test_loss: 1.1865, test_f1: 0.3100
 epoch: 43, train_loss: 1.0169, test_loss: 1.3235, test_f1: 0.3234
 epoch: 44, train_loss: 1.0030, test_loss: 1.3129, test_f1: 0.3295
 epoch: 45, train_loss: 1.0138, test_loss: 1.1169, test_f1: 0.3212
 epoch: 46, train_loss: 0.9785, test_loss: 1.2112, test_f1: 0.4165
 epoch: 47, train_loss: 0.9712, test_loss: 1.1930, test_f1: 0.3291
 epoch: 48, train_loss: 0.9989, test_loss: 1.0797, test_f1: 0.4327
 epoch: 49, train_loss: 0.9914, test_loss: 1.0381, test_f1: 0.3537
 epoch: 50, train_loss: 0.9849, test_loss: 1.0882, test_f1: 0.3984
 epoch: 51, train_loss: 0.9953, test_loss: 1.1561, test_f1: 0.3075
 epoch: 52, train_loss: 0.9675, test_loss: 1.0912, test_f1: 0.3447
 epoch: 53, train_loss: 0.9654, test_loss: 1.1964, test_f1: 0.4815
 epoch: 54, train_loss: 0.9598, test_loss: 1.0526, test_f1: 0.4423
 epoch: 55, train_loss: 0.9526, test_loss: 1.0881, test_f1: 0.4779
 epoch: 56, train_loss: 0.9652, test_loss: 1.0672, test_f1: 0.4649
 epoch: 57, train_loss: 0.9665, test_loss: 1.0302, test_f1: 0.4904
 epoch: 58, train_loss: 0.9475, test_loss: 1.1861, test_f1: 0.3343
 epoch: 59, train_loss: 0.9349, test_loss: 1.0653, test_f1: 0.4041
 epoch: 60, train_loss: 0.9372, test_loss: 1.1076, test_f1: 0.3481
 epoch: 61, train_loss: 0.9455, test_loss: 1.0349, test_f1: 0.4930
 epoch: 62, train_loss: 0.9492, test_loss: 1.3261, test_f1: 0.3555
 epoch: 63, train_loss: 0.9420, test_loss: 1.2001, test_f1: 0.4220
 epoch: 64, train_loss: 0.9477, test_loss: 1.0393, test_f1: 0.3497
 epoch: 65, train_loss: 0.9361, test_loss: 1.0218, test_f1: 0.4684
 epoch: 66, train_loss: 0.9316, test_loss: 1.0449, test_f1: 0.3632
 epoch: 67, train_loss: 0.9351, test_loss: 1.0194, test_f1: 0.4708
 epoch: 68, train_loss: 0.9179, test_loss: 1.0144, test_f1: 0.4837
 epoch: 69, train_loss: 0.9332, test_loss: 1.0474, test_f1: 0.3790
 epoch: 70, train_loss: 0.9422, test_loss: 1.0319, test_f1: 0.3926
 epoch: 71, train_loss: 0.9540, test_loss: 1.5266, test_f1: 0.2918
 epoch: 72, train_loss: 0.9528, test_loss: 1.3548, test_f1: 0.3785
 epoch: 73, train_loss: 0.9538, test_loss: 1.4728, test_f1: 0.3705
 epoch: 74, train_loss: 0.9524, test_loss: 1.1346, test_f1: 0.4629
 epoch: 75, train_loss: 0.9394, test_loss: 1.1379, test_f1: 0.4800
 epoch: 76, train_loss: 0.9451, test_loss: 1.1811, test_f1: 0.3327
 epoch: 77, train_loss: 0.9612, test_loss: 1.0471, test_f1: 0.4671
 epoch: 78, train_loss: 0.9428, test_loss: 1.0402, test_f1: 0.3913
 epoch: 79, train_loss: 0.9453, test_loss: 0.9990, test_f1: 0.4435
 epoch: 80, train_loss: 0.9335, test_loss: 0.9997, test_f1: 0.4558
 epoch: 81, train_loss: 0.9405, test_loss: 1.1315, test_f1: 0.3353
 epoch: 82, train_loss: 0.9421, test_loss: 1.0491, test_f1: 0.4368
 epoch: 83, train_loss: 0.9370, test_loss: 1.0176, test_f1: 0.4856
 epoch: 84, train_loss: 0.9335, test_loss: 1.0393, test_f1: 0.3646
 epoch: 85, train_loss: 0.9308, test_loss: 1.0648, test_f1: 0.4371
 epoch: 86, train_loss: 0.9483, test_loss: 1.0748, test_f1: 0.4514
 epoch: 87, train_loss: 0.9493, test_loss: 1.1831, test_f1: 0.4114
 epoch: 88, train_loss: 0.9491, test_loss: 1.0414, test_f1: 0.3519
 epoch: 89, train_loss: 0.9298, test_loss: 1.0421, test_f1: 0.3752
 epoch: 90, train_loss: 0.9210, test_loss: 1.0773, test_f1: 0.4158
 epoch: 91, train_loss: 0.9191, test_loss: 1.0401, test_f1: 0.4931
 epoch: 92, train_loss: 0.9077, test_loss: 1.2436, test_f1: 0.3395
 epoch: 93, train_loss: 0.9211, test_loss: 1.2155, test_f1: 0.4924
 epoch: 94, train_loss: 0.9324, test_loss: 1.1649, test_f1: 0.4421
 epoch: 95, train_loss: 0.9110, test_loss: 1.2841, test_f1: 0.3234
 epoch: 96, train_loss: 0.9199, test_loss: 1.2099, test_f1: 0.4660
 epoch: 97, train_loss: 0.9133, test_loss: 1.3172, test_f1: 0.4591
 epoch: 98, train_loss: 0.9088, test_loss: 1.1842, test_f1: 0.5057
 epoch: 99, train_loss: 0.9181, test_loss: 1.5743, test_f1: 0.3634
##################ITERATION #6 ****************************************
 epoch: 0, train_loss: 1.3402, test_loss: 6.6172, test_f1: 0.0296
 epoch: 1, train_loss: 1.2106, test_loss: 2.1033, test_f1: 0.1365
 epoch: 2, train_loss: 1.1738, test_loss: 2.1665, test_f1: 0.2574
 epoch: 3, train_loss: 1.1409, test_loss: 2.0520, test_f1: 0.1645
 epoch: 4, train_loss: 1.1258, test_loss: 1.8198, test_f1: 0.3254
 epoch: 5, train_loss: 1.1276, test_loss: 2.5746, test_f1: 0.1377
 epoch: 6, train_loss: 1.0936, test_loss: 1.4840, test_f1: 0.3120
 epoch: 7, train_loss: 1.0479, test_loss: 1.3711, test_f1: 0.3856
 epoch: 8, train_loss: 1.0568, test_loss: 1.4106, test_f1: 0.3164
 epoch: 9, train_loss: 1.0413, test_loss: 1.1821, test_f1: 0.4212
 epoch: 10, train_loss: 1.0379, test_loss: 1.1419, test_f1: 0.4365
 epoch: 11, train_loss: 1.0525, test_loss: 1.2141, test_f1: 0.4505
 epoch: 12, train_loss: 1.0614, test_loss: 1.2232, test_f1: 0.3676
 epoch: 13, train_loss: 1.0495, test_loss: 1.0860, test_f1: 0.4762
 epoch: 14, train_loss: 1.0456, test_loss: 1.1713, test_f1: 0.3576
 epoch: 15, train_loss: 1.0318, test_loss: 1.1666, test_f1: 0.4277
 epoch: 16, train_loss: 1.0146, test_loss: 1.2860, test_f1: 0.4252
 epoch: 17, train_loss: 0.9999, test_loss: 1.2588, test_f1: 0.3320
 epoch: 18, train_loss: 1.0006, test_loss: 1.4124, test_f1: 0.3119
 epoch: 19, train_loss: 1.0172, test_loss: 1.2698, test_f1: 0.3205
 epoch: 20, train_loss: 0.9875, test_loss: 1.4349, test_f1: 0.3681
 epoch: 21, train_loss: 1.0011, test_loss: 1.1087, test_f1: 0.3344
 epoch: 22, train_loss: 0.9876, test_loss: 1.1047, test_f1: 0.4377
 epoch: 23, train_loss: 0.9881, test_loss: 1.0780, test_f1: 0.4492
 epoch: 24, train_loss: 1.0156, test_loss: 1.0858, test_f1: 0.3346
 epoch: 25, train_loss: 0.9899, test_loss: 1.3131, test_f1: 0.4390
 epoch: 26, train_loss: 0.9768, test_loss: 1.0568, test_f1: 0.3643
 epoch: 27, train_loss: 0.9836, test_loss: 1.0623, test_f1: 0.4963
 epoch: 28, train_loss: 0.9652, test_loss: 1.0954, test_f1: 0.3869
 epoch: 29, train_loss: 0.9828, test_loss: 1.1061, test_f1: 0.4155
 epoch: 30, train_loss: 0.9815, test_loss: 1.0840, test_f1: 0.5134
 epoch: 31, train_loss: 0.9624, test_loss: 1.2118, test_f1: 0.4644
 epoch: 32, train_loss: 0.9908, test_loss: 1.1808, test_f1: 0.4269
 epoch: 33, train_loss: 0.9945, test_loss: 1.2291, test_f1: 0.2552
 epoch: 34, train_loss: 0.9900, test_loss: 1.3301, test_f1: 0.4316
 epoch: 35, train_loss: 0.9831, test_loss: 1.1030, test_f1: 0.4528
 epoch: 36, train_loss: 1.0224, test_loss: 1.1971, test_f1: 0.4499
 epoch: 37, train_loss: 0.9772, test_loss: 1.2878, test_f1: 0.4477
 epoch: 38, train_loss: 0.9785, test_loss: 1.2535, test_f1: 0.4562
 epoch: 39, train_loss: 0.9547, test_loss: 1.1285, test_f1: 0.5092
 epoch: 40, train_loss: 1.0054, test_loss: 1.1813, test_f1: 0.4571
 epoch: 41, train_loss: 1.0015, test_loss: 1.3338, test_f1: 0.3568
 epoch: 42, train_loss: 0.9862, test_loss: 1.2299, test_f1: 0.4145
 epoch: 43, train_loss: 0.9819, test_loss: 1.2703, test_f1: 0.4013
 epoch: 44, train_loss: 0.9836, test_loss: 1.1744, test_f1: 0.3265
 epoch: 45, train_loss: 0.9715, test_loss: 1.1655, test_f1: 0.3262
 epoch: 46, train_loss: 0.9748, test_loss: 1.1815, test_f1: 0.3406
 epoch: 47, train_loss: 0.9554, test_loss: 1.1131, test_f1: 0.3756
 epoch: 48, train_loss: 0.9534, test_loss: 1.1356, test_f1: 0.4824
 epoch: 49, train_loss: 0.9655, test_loss: 1.0973, test_f1: 0.5092
 epoch: 50, train_loss: 0.9539, test_loss: 1.0329, test_f1: 0.4667
 epoch: 51, train_loss: 0.9646, test_loss: 1.0636, test_f1: 0.3760
 epoch: 52, train_loss: 0.9573, test_loss: 1.0489, test_f1: 0.5148
 epoch: 53, train_loss: 0.9753, test_loss: 1.0231, test_f1: 0.4690
 epoch: 54, train_loss: 0.9602, test_loss: 1.0439, test_f1: 0.4893
 epoch: 55, train_loss: 0.9551, test_loss: 1.0515, test_f1: 0.4546
 epoch: 56, train_loss: 0.9560, test_loss: 1.0552, test_f1: 0.4254
 epoch: 57, train_loss: 0.9371, test_loss: 1.0732, test_f1: 0.4326
 epoch: 58, train_loss: 0.9441, test_loss: 1.1224, test_f1: 0.4669
 epoch: 59, train_loss: 0.9399, test_loss: 1.1352, test_f1: 0.3842
 epoch: 60, train_loss: 0.9830, test_loss: 1.3595, test_f1: 0.4502
 epoch: 61, train_loss: 0.9604, test_loss: 1.2506, test_f1: 0.4511
 epoch: 62, train_loss: 0.9397, test_loss: 1.1732, test_f1: 0.4765
 epoch: 63, train_loss: 0.9430, test_loss: 1.3720, test_f1: 0.4859
 epoch: 64, train_loss: 0.9304, test_loss: 1.1397, test_f1: 0.5273
 epoch: 65, train_loss: 0.9152, test_loss: 1.1097, test_f1: 0.5285
 epoch: 66, train_loss: 0.9188, test_loss: 1.1131, test_f1: 0.4257
 epoch: 67, train_loss: 0.9256, test_loss: 1.1374, test_f1: 0.4710
 epoch: 68, train_loss: 0.9159, test_loss: 1.1594, test_f1: 0.4830
 epoch: 69, train_loss: 0.9147, test_loss: 1.2024, test_f1: 0.4471
 epoch: 70, train_loss: 0.9237, test_loss: 1.2493, test_f1: 0.3482
 epoch: 71, train_loss: 0.9552, test_loss: 1.1611, test_f1: 0.4566
 epoch: 72, train_loss: 0.9604, test_loss: 1.0716, test_f1: 0.4869
 epoch: 73, train_loss: 0.9405, test_loss: 1.1387, test_f1: 0.5228
 epoch: 74, train_loss: 0.9382, test_loss: 1.2183, test_f1: 0.5170
 epoch: 75, train_loss: 0.9436, test_loss: 1.1190, test_f1: 0.4625
 epoch: 76, train_loss: 0.9370, test_loss: 1.1234, test_f1: 0.5466
 epoch: 77, train_loss: 0.9536, test_loss: 1.1140, test_f1: 0.5025
 epoch: 78, train_loss: 0.9517, test_loss: 1.0990, test_f1: 0.4668
 epoch: 79, train_loss: 0.9554, test_loss: 1.1539, test_f1: 0.4764
 epoch: 80, train_loss: 0.9571, test_loss: 1.1851, test_f1: 0.4520
 epoch: 81, train_loss: 0.9625, test_loss: 1.1655, test_f1: 0.4260
 epoch: 82, train_loss: 0.9493, test_loss: 1.1330, test_f1: 0.5024
 epoch: 83, train_loss: 0.9477, test_loss: 1.0874, test_f1: 0.4550
 epoch: 84, train_loss: 0.9728, test_loss: 1.0838, test_f1: 0.5111
 epoch: 85, train_loss: 0.9548, test_loss: 1.1334, test_f1: 0.5351
 epoch: 86, train_loss: 0.9550, test_loss: 1.1168, test_f1: 0.5112
 epoch: 87, train_loss: 0.9435, test_loss: 1.1419, test_f1: 0.5186
 epoch: 88, train_loss: 0.9368, test_loss: 1.1292, test_f1: 0.4487
 epoch: 89, train_loss: 0.9281, test_loss: 1.1359, test_f1: 0.5160
 epoch: 90, train_loss: 0.9332, test_loss: 1.1397, test_f1: 0.5274
 epoch: 91, train_loss: 0.9376, test_loss: 1.0850, test_f1: 0.4763
 epoch: 92, train_loss: 0.9440, test_loss: 1.1282, test_f1: 0.4560
 epoch: 93, train_loss: 0.9260, test_loss: 1.2350, test_f1: 0.5436
 epoch: 94, train_loss: 0.9147, test_loss: 1.1363, test_f1: 0.5740
 epoch: 95, train_loss: 0.9354, test_loss: 1.1948, test_f1: 0.5469
 epoch: 96, train_loss: 0.9444, test_loss: 1.2814, test_f1: 0.4812
 epoch: 97, train_loss: 0.9410, test_loss: 1.1925, test_f1: 0.4295
 epoch: 98, train_loss: 0.9340, test_loss: 1.2304, test_f1: 0.4771
 epoch: 99, train_loss: 0.9334, test_loss: 1.1535, test_f1: 0.3588
##################ITERATION #7 ****************************************
 epoch: 0, train_loss: 1.3166, test_loss: 1.4040, test_f1: 0.2302
 epoch: 1, train_loss: 1.1930, test_loss: 1.3650, test_f1: 0.1365
 epoch: 2, train_loss: 1.1851, test_loss: 1.3956, test_f1: 0.2281
 epoch: 3, train_loss: 1.1675, test_loss: 1.3911, test_f1: 0.2281
 epoch: 4, train_loss: 1.1461, test_loss: 1.4149, test_f1: 0.1448
 epoch: 5, train_loss: 1.1178, test_loss: 1.2899, test_f1: 0.2617
 epoch: 6, train_loss: 1.1043, test_loss: 1.1983, test_f1: 0.3248
 epoch: 7, train_loss: 1.0973, test_loss: 1.3092, test_f1: 0.3853
 epoch: 8, train_loss: 1.0743, test_loss: 1.3272, test_f1: 0.2764
 epoch: 9, train_loss: 1.0873, test_loss: 1.1960, test_f1: 0.3242
 epoch: 10, train_loss: 1.0908, test_loss: 1.4040, test_f1: 0.2450
 epoch: 11, train_loss: 1.0764, test_loss: 1.1684, test_f1: 0.3303
 epoch: 12, train_loss: 1.0830, test_loss: 1.2155, test_f1: 0.3267
 epoch: 13, train_loss: 1.0479, test_loss: 1.1560, test_f1: 0.3277
 epoch: 14, train_loss: 1.0235, test_loss: 1.1470, test_f1: 0.3470
 epoch: 15, train_loss: 1.0266, test_loss: 1.1870, test_f1: 0.3279
 epoch: 16, train_loss: 0.9991, test_loss: 1.1419, test_f1: 0.3344
 epoch: 17, train_loss: 1.0094, test_loss: 1.1850, test_f1: 0.3208
 epoch: 18, train_loss: 1.0280, test_loss: 1.1711, test_f1: 0.3230
 epoch: 19, train_loss: 1.0419, test_loss: 1.1646, test_f1: 0.3317
 epoch: 20, train_loss: 1.0178, test_loss: 1.1481, test_f1: 0.3327
 epoch: 21, train_loss: 1.0373, test_loss: 1.2397, test_f1: 0.3181
 epoch: 22, train_loss: 1.0319, test_loss: 1.1465, test_f1: 0.3370
 epoch: 23, train_loss: 1.0212, test_loss: 1.1471, test_f1: 0.3307
 epoch: 24, train_loss: 1.0176, test_loss: 1.1039, test_f1: 0.4327
 epoch: 25, train_loss: 0.9988, test_loss: 1.1176, test_f1: 0.3388
 epoch: 26, train_loss: 0.9908, test_loss: 1.1069, test_f1: 0.4639
 epoch: 27, train_loss: 0.9841, test_loss: 1.1730, test_f1: 0.3290
 epoch: 28, train_loss: 0.9775, test_loss: 1.2043, test_f1: 0.3833
 epoch: 29, train_loss: 1.0342, test_loss: 1.2093, test_f1: 0.3248
 epoch: 30, train_loss: 1.0153, test_loss: 1.1776, test_f1: 0.4384
 epoch: 31, train_loss: 1.0648, test_loss: 1.2181, test_f1: 0.3239
 epoch: 32, train_loss: 1.0280, test_loss: 1.1198, test_f1: 0.3363
 epoch: 33, train_loss: 1.0182, test_loss: 1.1381, test_f1: 0.4026
 epoch: 34, train_loss: 1.0069, test_loss: 1.1148, test_f1: 0.3454
 epoch: 35, train_loss: 1.0077, test_loss: 1.1069, test_f1: 0.4194
 epoch: 36, train_loss: 0.9967, test_loss: 1.1171, test_f1: 0.3622
 epoch: 37, train_loss: 1.0169, test_loss: 1.2059, test_f1: 0.3281
 epoch: 38, train_loss: 0.9965, test_loss: 1.1414, test_f1: 0.4323
 epoch: 39, train_loss: 1.0004, test_loss: 1.1689, test_f1: 0.3411
 epoch: 40, train_loss: 0.9916, test_loss: 1.1134, test_f1: 0.3778
 epoch: 41, train_loss: 1.0143, test_loss: 1.1839, test_f1: 0.3300
 epoch: 42, train_loss: 0.9890, test_loss: 1.1006, test_f1: 0.3794
 epoch: 43, train_loss: 0.9951, test_loss: 1.0933, test_f1: 0.3810
 epoch: 44, train_loss: 0.9802, test_loss: 1.1547, test_f1: 0.3354
 epoch: 45, train_loss: 1.1013, test_loss: 1.2801, test_f1: 0.2383
 epoch: 46, train_loss: 1.0717, test_loss: 1.1694, test_f1: 0.3264
 epoch: 47, train_loss: 1.0282, test_loss: 1.1538, test_f1: 0.4065
 epoch: 48, train_loss: 1.0201, test_loss: 1.1219, test_f1: 0.3478
 epoch: 49, train_loss: 1.0029, test_loss: 1.0878, test_f1: 0.4474
 epoch: 50, train_loss: 0.9896, test_loss: 1.1250, test_f1: 0.3400
 epoch: 51, train_loss: 1.0065, test_loss: 1.1820, test_f1: 0.3943
 epoch: 52, train_loss: 0.9915, test_loss: 1.1555, test_f1: 0.3886
 epoch: 53, train_loss: 0.9789, test_loss: 1.1452, test_f1: 0.3454
 epoch: 54, train_loss: 0.9865, test_loss: 1.0970, test_f1: 0.4083
 epoch: 55, train_loss: 0.9923, test_loss: 1.1424, test_f1: 0.3811
 epoch: 56, train_loss: 0.9880, test_loss: 1.1705, test_f1: 0.3408
 epoch: 57, train_loss: 1.0022, test_loss: 1.2072, test_f1: 0.3290
 epoch: 58, train_loss: 0.9870, test_loss: 1.1820, test_f1: 0.3521
 epoch: 59, train_loss: 0.9898, test_loss: 1.1294, test_f1: 0.3568
 epoch: 60, train_loss: 0.9770, test_loss: 1.1249, test_f1: 0.3519
 epoch: 61, train_loss: 0.9891, test_loss: 1.1145, test_f1: 0.3630
 epoch: 62, train_loss: 0.9941, test_loss: 1.1005, test_f1: 0.3610
 epoch: 63, train_loss: 0.9720, test_loss: 1.0951, test_f1: 0.4937
 epoch: 64, train_loss: 0.9731, test_loss: 1.1235, test_f1: 0.3968
 epoch: 65, train_loss: 0.9843, test_loss: 1.1216, test_f1: 0.4042
 epoch: 66, train_loss: 0.9715, test_loss: 1.0915, test_f1: 0.4047
 epoch: 67, train_loss: 0.9686, test_loss: 1.1047, test_f1: 0.4829
 epoch: 68, train_loss: 0.9571, test_loss: 1.1340, test_f1: 0.4224
 epoch: 69, train_loss: 0.9625, test_loss: 1.1793, test_f1: 0.3458
 epoch: 70, train_loss: 0.9563, test_loss: 1.1404, test_f1: 0.4398
 epoch: 71, train_loss: 0.9574, test_loss: 1.0969, test_f1: 0.3927
 epoch: 72, train_loss: 0.9686, test_loss: 1.0740, test_f1: 0.5182
 epoch: 73, train_loss: 0.9645, test_loss: 1.0633, test_f1: 0.5303
 epoch: 74, train_loss: 0.9626, test_loss: 1.1068, test_f1: 0.4685
 epoch: 75, train_loss: 0.9829, test_loss: 1.0810, test_f1: 0.4945
 epoch: 76, train_loss: 1.0064, test_loss: 1.0622, test_f1: 0.4029
 epoch: 77, train_loss: 1.0109, test_loss: 1.0912, test_f1: 0.3826
 epoch: 78, train_loss: 1.0005, test_loss: 1.1709, test_f1: 0.2926
 epoch: 79, train_loss: 0.9836, test_loss: 1.2017, test_f1: 0.2930
 epoch: 80, train_loss: 1.0451, test_loss: 1.3232, test_f1: 0.2240
 epoch: 81, train_loss: 1.0833, test_loss: 1.3178, test_f1: 0.2402
 epoch: 82, train_loss: 1.0071, test_loss: 1.3938, test_f1: 0.2668
 epoch: 83, train_loss: 0.9939, test_loss: 1.3038, test_f1: 0.2219
 epoch: 84, train_loss: 1.0062, test_loss: 1.2635, test_f1: 0.2334
 epoch: 85, train_loss: 1.0159, test_loss: 1.2216, test_f1: 0.3290
 epoch: 86, train_loss: 1.0083, test_loss: 1.1989, test_f1: 0.2441
 epoch: 87, train_loss: 1.0003, test_loss: 1.1180, test_f1: 0.3835
 epoch: 88, train_loss: 0.9726, test_loss: 1.1128, test_f1: 0.3937
 epoch: 89, train_loss: 0.9801, test_loss: 1.1030, test_f1: 0.4675
 epoch: 90, train_loss: 0.9730, test_loss: 1.0684, test_f1: 0.5212
 epoch: 91, train_loss: 0.9758, test_loss: 1.0594, test_f1: 0.5335
 epoch: 92, train_loss: 1.0279, test_loss: 1.4263, test_f1: 0.3995
 epoch: 93, train_loss: 1.0456, test_loss: 1.1810, test_f1: 0.3750
 epoch: 94, train_loss: 1.0065, test_loss: 1.0871, test_f1: 0.3984
 epoch: 95, train_loss: 1.0050, test_loss: 1.1023, test_f1: 0.3870
 epoch: 96, train_loss: 0.9957, test_loss: 1.0756, test_f1: 0.5090
 epoch: 97, train_loss: 0.9752, test_loss: 1.0719, test_f1: 0.3998
 epoch: 98, train_loss: 0.9739, test_loss: 1.0934, test_f1: 0.3799
 epoch: 99, train_loss: 0.9820, test_loss: 1.1523, test_f1: 0.3404
##################ITERATION #8 ****************************************
 epoch: 0, train_loss: 1.3833, test_loss: 21.0323, test_f1: 0.1365
 epoch: 1, train_loss: 1.1958, test_loss: 5.6500, test_f1: 0.1368
 epoch: 2, train_loss: 1.1860, test_loss: 2.8868, test_f1: 0.1368
 epoch: 3, train_loss: 1.1597, test_loss: 1.6657, test_f1: 0.1418
 epoch: 4, train_loss: 1.1247, test_loss: 2.3251, test_f1: 0.2365
 epoch: 5, train_loss: 1.1421, test_loss: 1.7024, test_f1: 0.2674
 epoch: 6, train_loss: 1.1071, test_loss: 1.4212, test_f1: 0.2269
 epoch: 7, train_loss: 1.0831, test_loss: 1.4255, test_f1: 0.2705
 epoch: 8, train_loss: 1.0802, test_loss: 1.5164, test_f1: 0.2418
 epoch: 9, train_loss: 1.0582, test_loss: 1.6450, test_f1: 0.3460
 epoch: 10, train_loss: 1.0803, test_loss: 1.8101, test_f1: 0.2005
 epoch: 11, train_loss: 1.0799, test_loss: 1.2581, test_f1: 0.4168
 epoch: 12, train_loss: 1.0728, test_loss: 1.7194, test_f1: 0.2761
 epoch: 13, train_loss: 1.0600, test_loss: 1.5493, test_f1: 0.4369
 epoch: 14, train_loss: 1.0675, test_loss: 1.2442, test_f1: 0.4365
 epoch: 15, train_loss: 1.0410, test_loss: 1.1163, test_f1: 0.4033
 epoch: 16, train_loss: 1.0439, test_loss: 1.2623, test_f1: 0.4492
 epoch: 17, train_loss: 1.0262, test_loss: 1.2600, test_f1: 0.4314
 epoch: 18, train_loss: 1.0250, test_loss: 1.2925, test_f1: 0.4272
 epoch: 19, train_loss: 1.0480, test_loss: 1.2676, test_f1: 0.3800
 epoch: 20, train_loss: 1.0224, test_loss: 1.2006, test_f1: 0.4155
 epoch: 21, train_loss: 1.0087, test_loss: 1.2342, test_f1: 0.3262
 epoch: 22, train_loss: 1.0205, test_loss: 1.3515, test_f1: 0.4241
 epoch: 23, train_loss: 1.0337, test_loss: 1.3602, test_f1: 0.4562
 epoch: 24, train_loss: 1.0280, test_loss: 1.2051, test_f1: 0.4515
 epoch: 25, train_loss: 1.0039, test_loss: 1.2071, test_f1: 0.4099
 epoch: 26, train_loss: 1.0059, test_loss: 1.1395, test_f1: 0.4485
 epoch: 27, train_loss: 1.0682, test_loss: 1.7071, test_f1: 0.3542
 epoch: 28, train_loss: 1.0747, test_loss: 1.3403, test_f1: 0.3691
 epoch: 29, train_loss: 1.0619, test_loss: 1.4446, test_f1: 0.3870
 epoch: 30, train_loss: 1.0470, test_loss: 1.2219, test_f1: 0.3317
 epoch: 31, train_loss: 1.0343, test_loss: 1.2687, test_f1: 0.4222
 epoch: 32, train_loss: 1.0453, test_loss: 1.2179, test_f1: 0.3290
 epoch: 33, train_loss: 1.0541, test_loss: 1.1642, test_f1: 0.4095
 epoch: 34, train_loss: 1.0240, test_loss: 1.0913, test_f1: 0.3422
 epoch: 35, train_loss: 1.0273, test_loss: 1.1761, test_f1: 0.3262
 epoch: 36, train_loss: 1.0479, test_loss: 1.1460, test_f1: 0.3183
 epoch: 37, train_loss: 1.0169, test_loss: 1.1575, test_f1: 0.3515
 epoch: 38, train_loss: 1.0128, test_loss: 1.0999, test_f1: 0.3806
 epoch: 39, train_loss: 1.0041, test_loss: 1.1451, test_f1: 0.3901
 epoch: 40, train_loss: 0.9881, test_loss: 1.3095, test_f1: 0.3395
 epoch: 41, train_loss: 0.9834, test_loss: 1.2986, test_f1: 0.4473
 epoch: 42, train_loss: 0.9976, test_loss: 1.1589, test_f1: 0.3441
 epoch: 43, train_loss: 1.0033, test_loss: 1.2104, test_f1: 0.4310
 epoch: 44, train_loss: 1.0019, test_loss: 1.2919, test_f1: 0.3534
 epoch: 45, train_loss: 0.9848, test_loss: 1.3580, test_f1: 0.4107
 epoch: 46, train_loss: 1.0069, test_loss: 1.2799, test_f1: 0.3778
 epoch: 47, train_loss: 1.0114, test_loss: 1.1788, test_f1: 0.3370
 epoch: 48, train_loss: 1.0151, test_loss: 1.1394, test_f1: 0.4361
 epoch: 49, train_loss: 1.0053, test_loss: 1.2279, test_f1: 0.3244
 epoch: 50, train_loss: 1.0066, test_loss: 1.2168, test_f1: 0.3198
 epoch: 51, train_loss: 1.0254, test_loss: 1.2275, test_f1: 0.3132
 epoch: 52, train_loss: 1.0117, test_loss: 1.4346, test_f1: 0.2803
 epoch: 53, train_loss: 1.0273, test_loss: 1.3717, test_f1: 0.3430
 epoch: 54, train_loss: 0.9930, test_loss: 1.3336, test_f1: 0.4034
 epoch: 55, train_loss: 0.9855, test_loss: 1.3250, test_f1: 0.4273
 epoch: 56, train_loss: 0.9831, test_loss: 1.3229, test_f1: 0.3648
 epoch: 57, train_loss: 0.9655, test_loss: 1.3924, test_f1: 0.4283
 epoch: 58, train_loss: 0.9706, test_loss: 1.4091, test_f1: 0.4133
 epoch: 59, train_loss: 0.9648, test_loss: 1.3141, test_f1: 0.4127
 epoch: 60, train_loss: 0.9826, test_loss: 1.3111, test_f1: 0.4074
 epoch: 61, train_loss: 0.9650, test_loss: 1.3208, test_f1: 0.4108
 epoch: 62, train_loss: 0.9596, test_loss: 1.3615, test_f1: 0.4148
 epoch: 63, train_loss: 0.9670, test_loss: 1.2670, test_f1: 0.4603
 epoch: 64, train_loss: 0.9680, test_loss: 1.2256, test_f1: 0.3352
 epoch: 65, train_loss: 0.9701, test_loss: 1.1904, test_f1: 0.4154
 epoch: 66, train_loss: 0.9611, test_loss: 1.6489, test_f1: 0.3561
 epoch: 67, train_loss: 0.9791, test_loss: 1.4819, test_f1: 0.2683
 epoch: 68, train_loss: 0.9967, test_loss: 1.4214, test_f1: 0.3119
 epoch: 69, train_loss: 0.9903, test_loss: 1.6199, test_f1: 0.4179
 epoch: 70, train_loss: 0.9979, test_loss: 1.1415, test_f1: 0.3454
 epoch: 71, train_loss: 0.9739, test_loss: 1.1245, test_f1: 0.4062
 epoch: 72, train_loss: 1.0351, test_loss: 1.1311, test_f1: 0.3234
 epoch: 73, train_loss: 1.0123, test_loss: 1.0668, test_f1: 0.3797
 epoch: 74, train_loss: 0.9874, test_loss: 1.1382, test_f1: 0.4217
 epoch: 75, train_loss: 0.9898, test_loss: 1.1563, test_f1: 0.4299
 epoch: 76, train_loss: 0.9816, test_loss: 1.0805, test_f1: 0.4543
 epoch: 77, train_loss: 0.9862, test_loss: 1.1807, test_f1: 0.4179
 epoch: 78, train_loss: 0.9636, test_loss: 1.1849, test_f1: 0.4281
 epoch: 79, train_loss: 0.9621, test_loss: 1.1560, test_f1: 0.3649
 epoch: 80, train_loss: 0.9637, test_loss: 1.1416, test_f1: 0.4504
 epoch: 81, train_loss: 0.9563, test_loss: 1.0452, test_f1: 0.4523
 epoch: 82, train_loss: 0.9670, test_loss: 1.0790, test_f1: 0.4573
 epoch: 83, train_loss: 0.9625, test_loss: 1.2442, test_f1: 0.4377
 epoch: 84, train_loss: 0.9505, test_loss: 1.4073, test_f1: 0.4389
 epoch: 85, train_loss: 0.9567, test_loss: 1.4612, test_f1: 0.3854
 epoch: 86, train_loss: 0.9520, test_loss: 1.1691, test_f1: 0.4601
 epoch: 87, train_loss: 0.9470, test_loss: 1.1615, test_f1: 0.4516
 epoch: 88, train_loss: 0.9821, test_loss: 1.4507, test_f1: 0.3903
 epoch: 89, train_loss: 0.9979, test_loss: 1.2167, test_f1: 0.4423
 epoch: 90, train_loss: 0.9843, test_loss: 1.0734, test_f1: 0.3963
 epoch: 91, train_loss: 0.9758, test_loss: 1.1468, test_f1: 0.4374
 epoch: 92, train_loss: 0.9600, test_loss: 1.3843, test_f1: 0.4545
 epoch: 93, train_loss: 0.9562, test_loss: 1.2642, test_f1: 0.4716
 epoch: 94, train_loss: 0.9655, test_loss: 1.5002, test_f1: 0.3867
 epoch: 95, train_loss: 0.9648, test_loss: 1.4216, test_f1: 0.4611
 epoch: 96, train_loss: 0.9641, test_loss: 1.1143, test_f1: 0.4685
 epoch: 97, train_loss: 0.9674, test_loss: 1.1238, test_f1: 0.4595
 epoch: 98, train_loss: 0.9641, test_loss: 1.1233, test_f1: 0.4551
 epoch: 99, train_loss: 0.9559, test_loss: 1.0646, test_f1: 0.3475
##################ITERATION #9 ****************************************
 epoch: 0, train_loss: 1.4201, test_loss: 1.3227, test_f1: 0.2281
 epoch: 1, train_loss: 1.2559, test_loss: 1.3454, test_f1: 0.2281
 epoch: 2, train_loss: 1.2204, test_loss: 1.4609, test_f1: 0.1365
 epoch: 3, train_loss: 1.1737, test_loss: 1.4345, test_f1: 0.2281
 epoch: 4, train_loss: 1.1498, test_loss: 1.4565, test_f1: 0.2934
 epoch: 5, train_loss: 1.1742, test_loss: 1.5447, test_f1: 0.2618
 epoch: 6, train_loss: 1.1316, test_loss: 1.3194, test_f1: 0.2336
 epoch: 7, train_loss: 1.1086, test_loss: 1.2130, test_f1: 0.4153
 epoch: 8, train_loss: 1.0920, test_loss: 1.2314, test_f1: 0.3256
 epoch: 9, train_loss: 1.0784, test_loss: 1.7699, test_f1: 0.2222
 epoch: 10, train_loss: 1.0926, test_loss: 1.5525, test_f1: 0.2991
 epoch: 11, train_loss: 1.0690, test_loss: 1.7159, test_f1: 0.3114
 epoch: 12, train_loss: 1.0874, test_loss: 1.4195, test_f1: 0.3095
 epoch: 13, train_loss: 1.0723, test_loss: 1.2988, test_f1: 0.4032
 epoch: 14, train_loss: 1.0711, test_loss: 1.1605, test_f1: 0.4146
 epoch: 15, train_loss: 1.0426, test_loss: 1.2052, test_f1: 0.3510
 epoch: 16, train_loss: 1.0692, test_loss: 1.4525, test_f1: 0.3589
 epoch: 17, train_loss: 1.0518, test_loss: 1.3140, test_f1: 0.4179
 epoch: 18, train_loss: 1.0147, test_loss: 1.2191, test_f1: 0.4216
 epoch: 19, train_loss: 1.0401, test_loss: 1.2303, test_f1: 0.4081
 epoch: 20, train_loss: 1.0685, test_loss: 1.2800, test_f1: 0.4194
 epoch: 21, train_loss: 1.0115, test_loss: 1.3637, test_f1: 0.3976
 epoch: 22, train_loss: 1.0392, test_loss: 1.1091, test_f1: 0.4138
 epoch: 23, train_loss: 1.0451, test_loss: 1.3513, test_f1: 0.4204
 epoch: 24, train_loss: 1.0317, test_loss: 1.2256, test_f1: 0.4173
 epoch: 25, train_loss: 1.0063, test_loss: 1.0977, test_f1: 0.4672
 epoch: 26, train_loss: 0.9965, test_loss: 1.1426, test_f1: 0.4303
 epoch: 27, train_loss: 1.0016, test_loss: 1.1477, test_f1: 0.3597
 epoch: 28, train_loss: 1.0126, test_loss: 1.3418, test_f1: 0.4334
 epoch: 29, train_loss: 1.0060, test_loss: 1.0343, test_f1: 0.3429
 epoch: 30, train_loss: 1.0101, test_loss: 1.2002, test_f1: 0.4526
 epoch: 31, train_loss: 1.0269, test_loss: 1.1123, test_f1: 0.4246
 epoch: 32, train_loss: 1.0240, test_loss: 1.1350, test_f1: 0.4474
 epoch: 33, train_loss: 1.0515, test_loss: 1.1443, test_f1: 0.3396
 epoch: 34, train_loss: 1.0324, test_loss: 1.2251, test_f1: 0.4425
 epoch: 35, train_loss: 1.0622, test_loss: 1.3019, test_f1: 0.2838
 epoch: 36, train_loss: 1.0299, test_loss: 2.0974, test_f1: 0.2377
 epoch: 37, train_loss: 1.0322, test_loss: 1.3247, test_f1: 0.3284
 epoch: 38, train_loss: 1.0260, test_loss: 1.1517, test_f1: 0.4427
 epoch: 39, train_loss: 1.0226, test_loss: 1.1696, test_f1: 0.3646
 epoch: 40, train_loss: 1.0146, test_loss: 1.5020, test_f1: 0.3015
 epoch: 41, train_loss: 1.0698, test_loss: 1.2086, test_f1: 0.3083
 epoch: 42, train_loss: 1.0109, test_loss: 1.8652, test_f1: 0.4123
 epoch: 43, train_loss: 1.0113, test_loss: 1.3893, test_f1: 0.3419
 epoch: 44, train_loss: 1.0086, test_loss: 1.1705, test_f1: 0.2384
 epoch: 45, train_loss: 1.0217, test_loss: 1.0970, test_f1: 0.3368
 epoch: 46, train_loss: 1.0115, test_loss: 1.1157, test_f1: 0.4314
 epoch: 47, train_loss: 1.0010, test_loss: 1.1163, test_f1: 0.3958
 epoch: 48, train_loss: 1.0031, test_loss: 1.0841, test_f1: 0.3395
 epoch: 49, train_loss: 1.0085, test_loss: 1.0881, test_f1: 0.3607
 epoch: 50, train_loss: 1.0099, test_loss: 1.2503, test_f1: 0.4102
 epoch: 51, train_loss: 1.0360, test_loss: 1.1469, test_f1: 0.4542
 epoch: 52, train_loss: 0.9916, test_loss: 1.2688, test_f1: 0.4441
 epoch: 53, train_loss: 0.9914, test_loss: 1.3385, test_f1: 0.4540
 epoch: 54, train_loss: 0.9787, test_loss: 1.3144, test_f1: 0.4612
 epoch: 55, train_loss: 0.9746, test_loss: 1.3042, test_f1: 0.4604
 epoch: 56, train_loss: 0.9811, test_loss: 1.1576, test_f1: 0.4172
 epoch: 57, train_loss: 0.9899, test_loss: 1.1831, test_f1: 0.3984
 epoch: 58, train_loss: 0.9775, test_loss: 1.1781, test_f1: 0.4557
 epoch: 59, train_loss: 0.9811, test_loss: 1.2444, test_f1: 0.4118
 epoch: 60, train_loss: 0.9661, test_loss: 1.2177, test_f1: 0.4858
 epoch: 61, train_loss: 0.9585, test_loss: 1.1524, test_f1: 0.3697
 epoch: 62, train_loss: 0.9598, test_loss: 1.2294, test_f1: 0.4281
 epoch: 63, train_loss: 0.9647, test_loss: 1.1820, test_f1: 0.4396
 epoch: 64, train_loss: 0.9624, test_loss: 1.2219, test_f1: 0.4153
 epoch: 65, train_loss: 0.9714, test_loss: 1.2711, test_f1: 0.4300
 epoch: 66, train_loss: 0.9677, test_loss: 1.1505, test_f1: 0.3832
 epoch: 67, train_loss: 0.9574, test_loss: 1.1274, test_f1: 0.4195
 epoch: 68, train_loss: 0.9708, test_loss: 1.1974, test_f1: 0.4214
 epoch: 69, train_loss: 0.9732, test_loss: 1.1683, test_f1: 0.4809
 epoch: 70, train_loss: 0.9633, test_loss: 1.2779, test_f1: 0.4587
 epoch: 71, train_loss: 0.9686, test_loss: 1.4878, test_f1: 0.4212
 epoch: 72, train_loss: 0.9793, test_loss: 1.4927, test_f1: 0.4265
 epoch: 73, train_loss: 0.9932, test_loss: 1.2729, test_f1: 0.4131
 epoch: 74, train_loss: 0.9745, test_loss: 1.1941, test_f1: 0.4349
 epoch: 75, train_loss: 0.9788, test_loss: 1.1980, test_f1: 0.3526
 epoch: 76, train_loss: 0.9560, test_loss: 1.2389, test_f1: 0.4341
 epoch: 77, train_loss: 0.9601, test_loss: 1.1900, test_f1: 0.4121
 epoch: 78, train_loss: 0.9596, test_loss: 1.1614, test_f1: 0.4122
 epoch: 79, train_loss: 0.9741, test_loss: 1.1474, test_f1: 0.3265
 epoch: 80, train_loss: 0.9651, test_loss: 1.2124, test_f1: 0.4682
 epoch: 81, train_loss: 0.9658, test_loss: 1.2315, test_f1: 0.4440
 epoch: 82, train_loss: 0.9526, test_loss: 1.2384, test_f1: 0.3994
 epoch: 83, train_loss: 0.9517, test_loss: 1.3005, test_f1: 0.4169
 epoch: 84, train_loss: 0.9597, test_loss: 1.3650, test_f1: 0.3958
 epoch: 85, train_loss: 0.9787, test_loss: 1.3832, test_f1: 0.4347
 epoch: 86, train_loss: 0.9649, test_loss: 1.3818, test_f1: 0.4509
 epoch: 87, train_loss: 0.9531, test_loss: 1.3374, test_f1: 0.4306
 epoch: 88, train_loss: 0.9740, test_loss: 1.1924, test_f1: 0.3486
 epoch: 89, train_loss: 0.9624, test_loss: 1.1961, test_f1: 0.3700
 epoch: 90, train_loss: 0.9484, test_loss: 1.2445, test_f1: 0.4866
 epoch: 91, train_loss: 0.9523, test_loss: 1.1468, test_f1: 0.4293
 epoch: 92, train_loss: 0.9614, test_loss: 1.2112, test_f1: 0.4337
 epoch: 93, train_loss: 0.9411, test_loss: 1.3041, test_f1: 0.4676
 epoch: 94, train_loss: 0.9572, test_loss: 1.3215, test_f1: 0.4180
 epoch: 95, train_loss: 0.9453, test_loss: 1.3406, test_f1: 0.4328
 epoch: 96, train_loss: 0.9621, test_loss: 1.4519, test_f1: 0.3810
 epoch: 97, train_loss: 0.9569, test_loss: 1.2095, test_f1: 0.4527
 epoch: 98, train_loss: 0.9457, test_loss: 1.1875, test_f1: 0.4732
 epoch: 99, train_loss: 0.9386, test_loss: 1.1815, test_f1: 0.3708

Training completed in 480.78 seconds
Best F1: 0.5740 at epoch 94
Mean F1 across iterations: 0.4755  0.0585
========================FINAL RESULTS================================
FEGIN weighted F1: 0.5740  0.0585
python main.py --data ltspice_demos --representation component_net --model FEGIN --layers 4 --hiddens 16 --batch_size 256 --lr 0.1 --emb_size 512 --epochs 100 --save_appendix component_net_L4_H16_BS256_LR0.1_E512 --no_val
-----



STDERR:
  File "main.py", line 370, in <module>
    main()
  File "main.py", line 254, in main
    dataset = dataset_class(
  File "/home/philip/projects/ltspice_examples_code_repo/Circuit-Completion-Using-GNNs/component_classification_with_link_prediction_head/evaluation/FEGIN/kernel/circuit_datasets.py", line 15, in __init__
    self.data, self.slices = torch.load(self.processed_paths[0])
  File "/home/philip/.local/lib/python3.8/site-packages/torch/serialization.py", line 1040, in load
    warnings.warn(
  File "/usr/lib/python3.8/warnings.py", line 109, in _showwarnmsg
    sw(msg.message, msg.category, msg.filename, msg.lineno,
  File "main.py", line 47, in warn_with_traceback
    traceback.print_stack(file=log)
/home/philip/projects/ltspice_examples_code_repo/Circuit-Completion-Using-GNNs/component_classification_with_link_prediction_head/evaluation/FEGIN/kernel/circuit_datasets.py:15: FutureWarning: You are using `torch.load` with `weights_only=False` (the current default value), which uses the default pickle module implicitly. It is possible to construct malicious pickle data which will execute arbitrary code during unpickling (See https://github.com/pytorch/pytorch/blob/main/SECURITY.md#untrusted-models for more details). In a future release, the default value for `weights_only` will be flipped to `True`. This limits the functions that could be executed during unpickling. Arbitrary objects will no longer be allowed to be loaded via this mode unless they are explicitly allowlisted by the user via `torch.serialization.add_safe_globals`. We recommend you start setting `weights_only=True` for any use case where you don't have full control of the loaded file. Please open an issue on GitHub for any issues related to this experimental feature.
  self.data, self.slices = torch.load(self.processed_paths[0])
