STDOUT:
Results will be saved in /home/philip/projects/ltspice_examples_code_repo/Circuit-Completion-Using-GNNs/component_classification_with_link_prediction_head/evaluation/FEGIN/results/model_FEGIN_dataset_ltspice_examples
Command line input: python main.py --data ltspice_examples --representation component_component --model FEGIN --layers 4 --hiddens 64 --batch_size 64 --lr 0.0001 --emb_size 250 --epochs 100 --save_appendix component_component_L4_H64_BS64_LR0.0001_E250 --no_val
 is saved.
-----
ltspice_examples - FEGIN
Using 4 layers, 64 hidden units, h = 2
Loading component_component representation dataset
ENTERED
Training FEGIN on component_component representation
Train: 3556, Test: 845
##################ITERATION #0 ****************************************
 epoch: 0, train_loss: 1.3625, test_loss: 1.3549, test_f1: 0.2274
 epoch: 1, train_loss: 1.3369, test_loss: 1.3303, test_f1: 0.2274
 epoch: 2, train_loss: 1.3115, test_loss: 1.2982, test_f1: 0.2274
 epoch: 3, train_loss: 1.2817, test_loss: 1.2716, test_f1: 0.2274
 epoch: 4, train_loss: 1.2658, test_loss: 1.2494, test_f1: 0.2274
 epoch: 5, train_loss: 1.2523, test_loss: 1.2298, test_f1: 0.2274
 epoch: 6, train_loss: 1.2355, test_loss: 1.2158, test_f1: 0.2448
 epoch: 7, train_loss: 1.2253, test_loss: 1.1986, test_f1: 0.2680
 epoch: 8, train_loss: 1.2127, test_loss: 1.1856, test_f1: 0.3358
 epoch: 9, train_loss: 1.1996, test_loss: 1.1695, test_f1: 0.3845
 epoch: 10, train_loss: 1.1888, test_loss: 1.1517, test_f1: 0.3936
 epoch: 11, train_loss: 1.1741, test_loss: 1.1383, test_f1: 0.3781
 epoch: 12, train_loss: 1.1582, test_loss: 1.1206, test_f1: 0.3830
 epoch: 13, train_loss: 1.1460, test_loss: 1.1071, test_f1: 0.3826
 epoch: 14, train_loss: 1.1359, test_loss: 1.0949, test_f1: 0.3882
 epoch: 15, train_loss: 1.1243, test_loss: 1.0813, test_f1: 0.3816
 epoch: 16, train_loss: 1.1105, test_loss: 1.0734, test_f1: 0.4290
 epoch: 17, train_loss: 1.1030, test_loss: 1.0649, test_f1: 0.4642
 epoch: 18, train_loss: 1.0931, test_loss: 1.0529, test_f1: 0.4575
 epoch: 19, train_loss: 1.0794, test_loss: 1.0454, test_f1: 0.4588
 epoch: 20, train_loss: 1.0717, test_loss: 1.0416, test_f1: 0.4723
 epoch: 21, train_loss: 1.0655, test_loss: 1.0414, test_f1: 0.4676
 epoch: 22, train_loss: 1.0551, test_loss: 1.0229, test_f1: 0.4737
 epoch: 23, train_loss: 1.0482, test_loss: 1.0146, test_f1: 0.4780
 epoch: 24, train_loss: 1.0374, test_loss: 1.0247, test_f1: 0.4606
 epoch: 25, train_loss: 1.0359, test_loss: 1.0219, test_f1: 0.4595
 epoch: 26, train_loss: 1.0181, test_loss: 1.0252, test_f1: 0.4539
 epoch: 27, train_loss: 1.0166, test_loss: 1.0336, test_f1: 0.4686
 epoch: 28, train_loss: 1.0177, test_loss: 1.0166, test_f1: 0.4643
 epoch: 29, train_loss: 1.0079, test_loss: 0.9959, test_f1: 0.4658
 epoch: 30, train_loss: 1.0006, test_loss: 1.0074, test_f1: 0.4583
 epoch: 31, train_loss: 0.9944, test_loss: 0.9958, test_f1: 0.4745
 epoch: 32, train_loss: 0.9944, test_loss: 1.0004, test_f1: 0.4733
 epoch: 33, train_loss: 0.9887, test_loss: 1.0028, test_f1: 0.4747
 epoch: 34, train_loss: 0.9888, test_loss: 1.0024, test_f1: 0.4888
 epoch: 35, train_loss: 0.9837, test_loss: 1.0044, test_f1: 0.4872
 epoch: 36, train_loss: 0.9753, test_loss: 0.9977, test_f1: 0.4743
 epoch: 37, train_loss: 0.9769, test_loss: 0.9944, test_f1: 0.4797
 epoch: 38, train_loss: 0.9713, test_loss: 0.9836, test_f1: 0.4989
 epoch: 39, train_loss: 0.9617, test_loss: 0.9831, test_f1: 0.5067
 epoch: 40, train_loss: 0.9709, test_loss: 0.9964, test_f1: 0.4806
 epoch: 41, train_loss: 0.9675, test_loss: 1.0132, test_f1: 0.4610
 epoch: 42, train_loss: 0.9625, test_loss: 1.0012, test_f1: 0.5155
 epoch: 43, train_loss: 0.9505, test_loss: 1.0037, test_f1: 0.4845
 epoch: 44, train_loss: 0.9516, test_loss: 0.9950, test_f1: 0.4671
 epoch: 45, train_loss: 0.9358, test_loss: 1.0084, test_f1: 0.4690
 epoch: 46, train_loss: 0.9511, test_loss: 1.0024, test_f1: 0.4675
 epoch: 47, train_loss: 0.9397, test_loss: 0.9905, test_f1: 0.4967
 epoch: 48, train_loss: 0.9354, test_loss: 0.9848, test_f1: 0.4965
 epoch: 49, train_loss: 0.9222, test_loss: 0.9834, test_f1: 0.4943
 epoch: 50, train_loss: 0.9296, test_loss: 1.0079, test_f1: 0.4555
 epoch: 51, train_loss: 0.9285, test_loss: 0.9988, test_f1: 0.4551
 epoch: 52, train_loss: 0.9182, test_loss: 1.0047, test_f1: 0.4669
 epoch: 53, train_loss: 0.9240, test_loss: 1.0008, test_f1: 0.4854
 epoch: 54, train_loss: 0.9159, test_loss: 0.9978, test_f1: 0.4800
 epoch: 55, train_loss: 0.9039, test_loss: 1.0089, test_f1: 0.4842
 epoch: 56, train_loss: 0.9057, test_loss: 1.0001, test_f1: 0.4769
 epoch: 57, train_loss: 0.9012, test_loss: 1.0188, test_f1: 0.4585
 epoch: 58, train_loss: 0.9125, test_loss: 1.0053, test_f1: 0.4881
 epoch: 59, train_loss: 0.8958, test_loss: 1.0108, test_f1: 0.4874
 epoch: 60, train_loss: 0.9174, test_loss: 0.9944, test_f1: 0.4917
 epoch: 61, train_loss: 0.8920, test_loss: 1.0162, test_f1: 0.4790
 epoch: 62, train_loss: 0.8992, test_loss: 1.0119, test_f1: 0.4683
 epoch: 63, train_loss: 0.8993, test_loss: 1.0075, test_f1: 0.4832
 epoch: 64, train_loss: 0.9122, test_loss: 0.9963, test_f1: 0.4917
 epoch: 65, train_loss: 0.8961, test_loss: 1.0043, test_f1: 0.4891
 epoch: 66, train_loss: 0.8997, test_loss: 1.0032, test_f1: 0.4883
 epoch: 67, train_loss: 0.9035, test_loss: 1.0110, test_f1: 0.4745
 epoch: 68, train_loss: 0.8857, test_loss: 1.0045, test_f1: 0.4889
 epoch: 69, train_loss: 0.8948, test_loss: 1.0188, test_f1: 0.4665
 epoch: 70, train_loss: 0.8782, test_loss: 1.0258, test_f1: 0.4586
 epoch: 71, train_loss: 0.8914, test_loss: 1.0130, test_f1: 0.4900
 epoch: 72, train_loss: 0.8816, test_loss: 1.0080, test_f1: 0.4809
 epoch: 73, train_loss: 0.8905, test_loss: 1.0078, test_f1: 0.4833
 epoch: 74, train_loss: 0.8771, test_loss: 1.0201, test_f1: 0.4799
 epoch: 75, train_loss: 0.8839, test_loss: 0.9990, test_f1: 0.4953
 epoch: 76, train_loss: 0.8754, test_loss: 1.0033, test_f1: 0.4928
 epoch: 77, train_loss: 0.8791, test_loss: 1.0208, test_f1: 0.4815
 epoch: 78, train_loss: 0.8767, test_loss: 1.0102, test_f1: 0.4941
 epoch: 79, train_loss: 0.8762, test_loss: 1.0014, test_f1: 0.4955
 epoch: 80, train_loss: 0.8690, test_loss: 1.0098, test_f1: 0.4903
 epoch: 81, train_loss: 0.8769, test_loss: 1.0193, test_f1: 0.4832
 epoch: 82, train_loss: 0.8759, test_loss: 0.9987, test_f1: 0.4933
 epoch: 83, train_loss: 0.8719, test_loss: 1.0174, test_f1: 0.5016
 epoch: 84, train_loss: 0.8654, test_loss: 1.0278, test_f1: 0.4761
 epoch: 85, train_loss: 0.8595, test_loss: 1.0316, test_f1: 0.4817
 epoch: 86, train_loss: 0.8590, test_loss: 1.0236, test_f1: 0.4840
 epoch: 87, train_loss: 0.8767, test_loss: 1.0154, test_f1: 0.4878
 epoch: 88, train_loss: 0.8604, test_loss: 1.0100, test_f1: 0.4969
 epoch: 89, train_loss: 0.8557, test_loss: 1.0339, test_f1: 0.4915
 epoch: 90, train_loss: 0.8624, test_loss: 1.0135, test_f1: 0.4944
 epoch: 91, train_loss: 0.8646, test_loss: 1.0252, test_f1: 0.5099
 epoch: 92, train_loss: 0.8492, test_loss: 1.0374, test_f1: 0.4982
 epoch: 93, train_loss: 0.8542, test_loss: 1.0009, test_f1: 0.5035
 epoch: 94, train_loss: 0.8548, test_loss: 1.0074, test_f1: 0.4919
 epoch: 95, train_loss: 0.8602, test_loss: 1.0400, test_f1: 0.4958
 epoch: 96, train_loss: 0.8708, test_loss: 1.0336, test_f1: 0.4886
 epoch: 97, train_loss: 0.8628, test_loss: 1.0080, test_f1: 0.4926
 epoch: 98, train_loss: 0.8532, test_loss: 1.0292, test_f1: 0.4900
 epoch: 99, train_loss: 0.8377, test_loss: 1.0352, test_f1: 0.4896
##################ITERATION #1 ****************************************
 epoch: 0, train_loss: 1.3523, test_loss: 1.3030, test_f1: 0.2558
 epoch: 1, train_loss: 1.2842, test_loss: 1.2538, test_f1: 0.2888
 epoch: 2, train_loss: 1.2541, test_loss: 1.2238, test_f1: 0.2993
 epoch: 3, train_loss: 1.2324, test_loss: 1.2005, test_f1: 0.3616
 epoch: 4, train_loss: 1.2152, test_loss: 1.1838, test_f1: 0.3721
 epoch: 5, train_loss: 1.1973, test_loss: 1.1668, test_f1: 0.4079
 epoch: 6, train_loss: 1.1928, test_loss: 1.1496, test_f1: 0.4158
 epoch: 7, train_loss: 1.1712, test_loss: 1.1356, test_f1: 0.4260
 epoch: 8, train_loss: 1.1659, test_loss: 1.1226, test_f1: 0.4193
 epoch: 9, train_loss: 1.1529, test_loss: 1.1105, test_f1: 0.4442
 epoch: 10, train_loss: 1.1426, test_loss: 1.1056, test_f1: 0.4382
 epoch: 11, train_loss: 1.1270, test_loss: 1.0974, test_f1: 0.4435
 epoch: 12, train_loss: 1.1205, test_loss: 1.0892, test_f1: 0.4499
 epoch: 13, train_loss: 1.1124, test_loss: 1.0835, test_f1: 0.4504
 epoch: 14, train_loss: 1.1042, test_loss: 1.0808, test_f1: 0.4599
 epoch: 15, train_loss: 1.1004, test_loss: 1.0764, test_f1: 0.4658
 epoch: 16, train_loss: 1.0961, test_loss: 1.0701, test_f1: 0.4604
 epoch: 17, train_loss: 1.0834, test_loss: 1.0728, test_f1: 0.4557
 epoch: 18, train_loss: 1.0831, test_loss: 1.0729, test_f1: 0.4527
 epoch: 19, train_loss: 1.0764, test_loss: 1.0563, test_f1: 0.4757
 epoch: 20, train_loss: 1.0636, test_loss: 1.0468, test_f1: 0.4842
 epoch: 21, train_loss: 1.0651, test_loss: 1.0515, test_f1: 0.4722
 epoch: 22, train_loss: 1.0529, test_loss: 1.0449, test_f1: 0.4759
 epoch: 23, train_loss: 1.0498, test_loss: 1.0503, test_f1: 0.4502
 epoch: 24, train_loss: 1.0430, test_loss: 1.0432, test_f1: 0.4552
 epoch: 25, train_loss: 1.0416, test_loss: 1.0172, test_f1: 0.4886
 epoch: 26, train_loss: 1.0369, test_loss: 1.0284, test_f1: 0.4738
 epoch: 27, train_loss: 1.0182, test_loss: 1.0371, test_f1: 0.4578
 epoch: 28, train_loss: 1.0157, test_loss: 1.0315, test_f1: 0.4584
 epoch: 29, train_loss: 1.0220, test_loss: 1.0191, test_f1: 0.4771
 epoch: 30, train_loss: 1.0040, test_loss: 1.0171, test_f1: 0.4767
 epoch: 31, train_loss: 1.0107, test_loss: 1.0092, test_f1: 0.4804
 epoch: 32, train_loss: 1.0034, test_loss: 1.0077, test_f1: 0.4725
 epoch: 33, train_loss: 0.9867, test_loss: 1.0152, test_f1: 0.4712
 epoch: 34, train_loss: 0.9911, test_loss: 1.0240, test_f1: 0.4610
 epoch: 35, train_loss: 0.9832, test_loss: 1.0070, test_f1: 0.4867
 epoch: 36, train_loss: 0.9678, test_loss: 1.0051, test_f1: 0.4828
 epoch: 37, train_loss: 0.9582, test_loss: 0.9891, test_f1: 0.4971
 epoch: 38, train_loss: 0.9583, test_loss: 0.9997, test_f1: 0.5026
 epoch: 39, train_loss: 0.9525, test_loss: 1.0326, test_f1: 0.4732
 epoch: 40, train_loss: 0.9434, test_loss: 0.9892, test_f1: 0.4780
 epoch: 41, train_loss: 0.9396, test_loss: 1.0204, test_f1: 0.4830
 epoch: 42, train_loss: 0.9361, test_loss: 1.0011, test_f1: 0.4911
 epoch: 43, train_loss: 0.9396, test_loss: 1.0131, test_f1: 0.4723
 epoch: 44, train_loss: 0.9322, test_loss: 1.0069, test_f1: 0.4970
 epoch: 45, train_loss: 0.9308, test_loss: 0.9897, test_f1: 0.5042
 epoch: 46, train_loss: 0.9169, test_loss: 1.0266, test_f1: 0.4784
 epoch: 47, train_loss: 0.9191, test_loss: 1.0089, test_f1: 0.4852
 epoch: 48, train_loss: 0.9175, test_loss: 1.0060, test_f1: 0.4813
 epoch: 49, train_loss: 0.8999, test_loss: 1.0207, test_f1: 0.4770
 epoch: 50, train_loss: 0.8907, test_loss: 1.0360, test_f1: 0.4754
 epoch: 51, train_loss: 0.8922, test_loss: 1.0157, test_f1: 0.4803
 epoch: 52, train_loss: 0.8870, test_loss: 1.0154, test_f1: 0.5019
 epoch: 53, train_loss: 0.8902, test_loss: 1.0064, test_f1: 0.4963
 epoch: 54, train_loss: 0.8768, test_loss: 1.0376, test_f1: 0.4837
 epoch: 55, train_loss: 0.8824, test_loss: 1.0157, test_f1: 0.4929
 epoch: 56, train_loss: 0.8726, test_loss: 1.0375, test_f1: 0.4809
 epoch: 57, train_loss: 0.8718, test_loss: 1.0239, test_f1: 0.4758
 epoch: 58, train_loss: 0.8801, test_loss: 1.0234, test_f1: 0.4934
 epoch: 59, train_loss: 0.8893, test_loss: 1.0197, test_f1: 0.4699
 epoch: 60, train_loss: 0.8712, test_loss: 1.0093, test_f1: 0.4856
 epoch: 61, train_loss: 0.8651, test_loss: 1.0210, test_f1: 0.4773
 epoch: 62, train_loss: 0.8749, test_loss: 1.0307, test_f1: 0.4817
 epoch: 63, train_loss: 0.8553, test_loss: 1.0431, test_f1: 0.4881
 epoch: 64, train_loss: 0.8624, test_loss: 1.0417, test_f1: 0.4861
 epoch: 65, train_loss: 0.8585, test_loss: 1.0365, test_f1: 0.4773
 epoch: 66, train_loss: 0.8521, test_loss: 1.0325, test_f1: 0.4923
 epoch: 67, train_loss: 0.8570, test_loss: 1.0609, test_f1: 0.4714
 epoch: 68, train_loss: 0.8614, test_loss: 1.0364, test_f1: 0.4832
 epoch: 69, train_loss: 0.8530, test_loss: 1.0335, test_f1: 0.4891
 epoch: 70, train_loss: 0.8436, test_loss: 1.0462, test_f1: 0.4704
 epoch: 71, train_loss: 0.8551, test_loss: 1.0316, test_f1: 0.4837
 epoch: 72, train_loss: 0.8449, test_loss: 1.0319, test_f1: 0.5023
 epoch: 73, train_loss: 0.8310, test_loss: 1.0408, test_f1: 0.5109
 epoch: 74, train_loss: 0.8406, test_loss: 1.0663, test_f1: 0.4962
 epoch: 75, train_loss: 0.8321, test_loss: 1.0780, test_f1: 0.4988
 epoch: 76, train_loss: 0.8228, test_loss: 1.0574, test_f1: 0.4859
 epoch: 77, train_loss: 0.8301, test_loss: 1.0444, test_f1: 0.4970
 epoch: 78, train_loss: 0.8294, test_loss: 1.0364, test_f1: 0.4787
 epoch: 79, train_loss: 0.8249, test_loss: 1.0406, test_f1: 0.4941
 epoch: 80, train_loss: 0.8314, test_loss: 1.0321, test_f1: 0.4882
 epoch: 81, train_loss: 0.8267, test_loss: 1.0549, test_f1: 0.4810
 epoch: 82, train_loss: 0.8226, test_loss: 1.0789, test_f1: 0.4717
 epoch: 83, train_loss: 0.8187, test_loss: 1.0749, test_f1: 0.4943
 epoch: 84, train_loss: 0.8260, test_loss: 1.0786, test_f1: 0.4862
 epoch: 85, train_loss: 0.8130, test_loss: 1.0741, test_f1: 0.4977
 epoch: 86, train_loss: 0.8138, test_loss: 1.0558, test_f1: 0.4911
 epoch: 87, train_loss: 0.8142, test_loss: 1.1071, test_f1: 0.4837
 epoch: 88, train_loss: 0.8281, test_loss: 1.0716, test_f1: 0.4738
 epoch: 89, train_loss: 0.8104, test_loss: 1.0732, test_f1: 0.4724
 epoch: 90, train_loss: 0.8121, test_loss: 1.0862, test_f1: 0.4849
 epoch: 91, train_loss: 0.8100, test_loss: 1.0683, test_f1: 0.4999
 epoch: 92, train_loss: 0.7960, test_loss: 1.0508, test_f1: 0.5079
 epoch: 93, train_loss: 0.8116, test_loss: 1.0677, test_f1: 0.4818
 epoch: 94, train_loss: 0.8073, test_loss: 1.0722, test_f1: 0.5152
 epoch: 95, train_loss: 0.8014, test_loss: 1.0773, test_f1: 0.4963
 epoch: 96, train_loss: 0.7967, test_loss: 1.0761, test_f1: 0.5059
 epoch: 97, train_loss: 0.8048, test_loss: 1.0853, test_f1: 0.5049
 epoch: 98, train_loss: 0.7992, test_loss: 1.0758, test_f1: 0.4964
 epoch: 99, train_loss: 0.8118, test_loss: 1.0809, test_f1: 0.4994
##################ITERATION #2 ****************************************
 epoch: 0, train_loss: 1.3157, test_loss: 1.2979, test_f1: 0.3030
 epoch: 1, train_loss: 1.2566, test_loss: 1.2347, test_f1: 0.3226
 epoch: 2, train_loss: 1.2351, test_loss: 1.2122, test_f1: 0.3696
 epoch: 3, train_loss: 1.2207, test_loss: 1.1945, test_f1: 0.3716
 epoch: 4, train_loss: 1.2107, test_loss: 1.1770, test_f1: 0.3827
 epoch: 5, train_loss: 1.2001, test_loss: 1.1642, test_f1: 0.3924
 epoch: 6, train_loss: 1.1873, test_loss: 1.1545, test_f1: 0.4005
 epoch: 7, train_loss: 1.1742, test_loss: 1.1454, test_f1: 0.4103
 epoch: 8, train_loss: 1.1586, test_loss: 1.1335, test_f1: 0.4152
 epoch: 9, train_loss: 1.1537, test_loss: 1.1175, test_f1: 0.4179
 epoch: 10, train_loss: 1.1377, test_loss: 1.1105, test_f1: 0.4290
 epoch: 11, train_loss: 1.1238, test_loss: 1.1029, test_f1: 0.4256
 epoch: 12, train_loss: 1.1195, test_loss: 1.0865, test_f1: 0.4379
 epoch: 13, train_loss: 1.1047, test_loss: 1.0755, test_f1: 0.4369
 epoch: 14, train_loss: 1.1000, test_loss: 1.0674, test_f1: 0.4225
 epoch: 15, train_loss: 1.0835, test_loss: 1.0641, test_f1: 0.4472
 epoch: 16, train_loss: 1.0820, test_loss: 1.0491, test_f1: 0.4442
 epoch: 17, train_loss: 1.0679, test_loss: 1.0430, test_f1: 0.4491
 epoch: 18, train_loss: 1.0568, test_loss: 1.0291, test_f1: 0.4325
 epoch: 19, train_loss: 1.0464, test_loss: 1.0231, test_f1: 0.4483
 epoch: 20, train_loss: 1.0414, test_loss: 1.0184, test_f1: 0.4649
 epoch: 21, train_loss: 1.0335, test_loss: 1.0149, test_f1: 0.4536
 epoch: 22, train_loss: 1.0225, test_loss: 0.9991, test_f1: 0.4629
 epoch: 23, train_loss: 1.0129, test_loss: 1.0046, test_f1: 0.4562
 epoch: 24, train_loss: 1.0054, test_loss: 0.9979, test_f1: 0.4485
 epoch: 25, train_loss: 1.0036, test_loss: 0.9871, test_f1: 0.4479
 epoch: 26, train_loss: 0.9973, test_loss: 0.9828, test_f1: 0.4555
 epoch: 27, train_loss: 0.9856, test_loss: 0.9807, test_f1: 0.4605
 epoch: 28, train_loss: 0.9845, test_loss: 0.9798, test_f1: 0.4621
 epoch: 29, train_loss: 0.9725, test_loss: 0.9742, test_f1: 0.4610
 epoch: 30, train_loss: 0.9747, test_loss: 0.9876, test_f1: 0.4573
 epoch: 31, train_loss: 0.9649, test_loss: 0.9676, test_f1: 0.4552
 epoch: 32, train_loss: 0.9576, test_loss: 0.9830, test_f1: 0.4509
 epoch: 33, train_loss: 0.9567, test_loss: 0.9628, test_f1: 0.4627
 epoch: 34, train_loss: 0.9525, test_loss: 0.9749, test_f1: 0.4613
 epoch: 35, train_loss: 0.9390, test_loss: 0.9498, test_f1: 0.4871
 epoch: 36, train_loss: 0.9425, test_loss: 0.9611, test_f1: 0.4711
 epoch: 37, train_loss: 0.9374, test_loss: 0.9718, test_f1: 0.4715
 epoch: 38, train_loss: 0.9277, test_loss: 0.9656, test_f1: 0.4866
 epoch: 39, train_loss: 0.9346, test_loss: 0.9575, test_f1: 0.4876
 epoch: 40, train_loss: 0.9184, test_loss: 0.9587, test_f1: 0.4828
 epoch: 41, train_loss: 0.9120, test_loss: 0.9506, test_f1: 0.4871
 epoch: 42, train_loss: 0.9097, test_loss: 0.9466, test_f1: 0.4862
 epoch: 43, train_loss: 0.9002, test_loss: 0.9556, test_f1: 0.4758
 epoch: 44, train_loss: 0.8989, test_loss: 0.9620, test_f1: 0.4938
 epoch: 45, train_loss: 0.9049, test_loss: 0.9472, test_f1: 0.4994
 epoch: 46, train_loss: 0.8974, test_loss: 0.9528, test_f1: 0.4938
 epoch: 47, train_loss: 0.8938, test_loss: 0.9576, test_f1: 0.4954
 epoch: 48, train_loss: 0.8974, test_loss: 0.9531, test_f1: 0.4960
 epoch: 49, train_loss: 0.8847, test_loss: 0.9462, test_f1: 0.5032
 epoch: 50, train_loss: 0.8788, test_loss: 0.9410, test_f1: 0.4890
 epoch: 51, train_loss: 0.8747, test_loss: 0.9526, test_f1: 0.5003
 epoch: 52, train_loss: 0.8695, test_loss: 0.9455, test_f1: 0.5056
 epoch: 53, train_loss: 0.8614, test_loss: 0.9502, test_f1: 0.5023
 epoch: 54, train_loss: 0.8663, test_loss: 0.9640, test_f1: 0.4984
 epoch: 55, train_loss: 0.8578, test_loss: 0.9575, test_f1: 0.4995
 epoch: 56, train_loss: 0.8653, test_loss: 0.9480, test_f1: 0.4981
 epoch: 57, train_loss: 0.8572, test_loss: 0.9666, test_f1: 0.5118
 epoch: 58, train_loss: 0.8692, test_loss: 0.9549, test_f1: 0.5084
 epoch: 59, train_loss: 0.8534, test_loss: 0.9517, test_f1: 0.5172
 epoch: 60, train_loss: 0.8553, test_loss: 0.9570, test_f1: 0.5035
 epoch: 61, train_loss: 0.8552, test_loss: 0.9594, test_f1: 0.5142
 epoch: 62, train_loss: 0.8485, test_loss: 0.9632, test_f1: 0.5013
 epoch: 63, train_loss: 0.8496, test_loss: 0.9521, test_f1: 0.5114
 epoch: 64, train_loss: 0.8479, test_loss: 0.9542, test_f1: 0.5204
 epoch: 65, train_loss: 0.8406, test_loss: 0.9633, test_f1: 0.5140
 epoch: 66, train_loss: 0.8257, test_loss: 0.9588, test_f1: 0.5162
 epoch: 67, train_loss: 0.8313, test_loss: 0.9752, test_f1: 0.4998
 epoch: 68, train_loss: 0.8362, test_loss: 0.9685, test_f1: 0.5126
 epoch: 69, train_loss: 0.8398, test_loss: 0.9566, test_f1: 0.5127
 epoch: 70, train_loss: 0.8261, test_loss: 0.9878, test_f1: 0.5068
 epoch: 71, train_loss: 0.8414, test_loss: 0.9641, test_f1: 0.5153
 epoch: 72, train_loss: 0.8267, test_loss: 0.9579, test_f1: 0.5188
 epoch: 73, train_loss: 0.8147, test_loss: 0.9758, test_f1: 0.5254
 epoch: 74, train_loss: 0.8240, test_loss: 0.9619, test_f1: 0.5212
 epoch: 75, train_loss: 0.8257, test_loss: 0.9619, test_f1: 0.5246
 epoch: 76, train_loss: 0.8230, test_loss: 0.9753, test_f1: 0.5268
 epoch: 77, train_loss: 0.8220, test_loss: 0.9771, test_f1: 0.5222
 epoch: 78, train_loss: 0.8152, test_loss: 0.9775, test_f1: 0.5242
 epoch: 79, train_loss: 0.8154, test_loss: 0.9717, test_f1: 0.5213
 epoch: 80, train_loss: 0.8144, test_loss: 0.9868, test_f1: 0.5186
 epoch: 81, train_loss: 0.8101, test_loss: 0.9775, test_f1: 0.5351
 epoch: 82, train_loss: 0.8155, test_loss: 0.9674, test_f1: 0.5215
 epoch: 83, train_loss: 0.8251, test_loss: 0.9657, test_f1: 0.5262
 epoch: 84, train_loss: 0.8205, test_loss: 0.9821, test_f1: 0.5101
 epoch: 85, train_loss: 0.8080, test_loss: 0.9709, test_f1: 0.5208
 epoch: 86, train_loss: 0.8118, test_loss: 0.9831, test_f1: 0.5287
 epoch: 87, train_loss: 0.8060, test_loss: 0.9750, test_f1: 0.5331
 epoch: 88, train_loss: 0.8028, test_loss: 0.9750, test_f1: 0.5160
 epoch: 89, train_loss: 0.8021, test_loss: 0.9810, test_f1: 0.5321
 epoch: 90, train_loss: 0.8000, test_loss: 0.9773, test_f1: 0.5141
 epoch: 91, train_loss: 0.8075, test_loss: 0.9712, test_f1: 0.5290
 epoch: 92, train_loss: 0.8132, test_loss: 1.0019, test_f1: 0.5246
 epoch: 93, train_loss: 0.7921, test_loss: 0.9969, test_f1: 0.5181
 epoch: 94, train_loss: 0.8011, test_loss: 0.9876, test_f1: 0.5199
 epoch: 95, train_loss: 0.7979, test_loss: 0.9824, test_f1: 0.5187
 epoch: 96, train_loss: 0.8023, test_loss: 1.0025, test_f1: 0.5263
 epoch: 97, train_loss: 0.7896, test_loss: 0.9937, test_f1: 0.5363
 epoch: 98, train_loss: 0.7864, test_loss: 1.0073, test_f1: 0.5272
 epoch: 99, train_loss: 0.7917, test_loss: 1.0034, test_f1: 0.5246
##################ITERATION #3 ****************************************
 epoch: 0, train_loss: 1.3085, test_loss: 1.2580, test_f1: 0.2863
 epoch: 1, train_loss: 1.2534, test_loss: 1.2208, test_f1: 0.3142
 epoch: 2, train_loss: 1.2322, test_loss: 1.1977, test_f1: 0.3635
 epoch: 3, train_loss: 1.2132, test_loss: 1.1816, test_f1: 0.4013
 epoch: 4, train_loss: 1.2021, test_loss: 1.1682, test_f1: 0.3985
 epoch: 5, train_loss: 1.1903, test_loss: 1.1543, test_f1: 0.4039
 epoch: 6, train_loss: 1.1788, test_loss: 1.1421, test_f1: 0.4172
 epoch: 7, train_loss: 1.1657, test_loss: 1.1368, test_f1: 0.4166
 epoch: 8, train_loss: 1.1569, test_loss: 1.1253, test_f1: 0.4219
 epoch: 9, train_loss: 1.1448, test_loss: 1.1218, test_f1: 0.4230
 epoch: 10, train_loss: 1.1457, test_loss: 1.1101, test_f1: 0.4425
 epoch: 11, train_loss: 1.1277, test_loss: 1.1074, test_f1: 0.4224
 epoch: 12, train_loss: 1.1216, test_loss: 1.1048, test_f1: 0.4284
 epoch: 13, train_loss: 1.1143, test_loss: 1.0972, test_f1: 0.4473
 epoch: 14, train_loss: 1.1041, test_loss: 1.0974, test_f1: 0.4419
 epoch: 15, train_loss: 1.0962, test_loss: 1.0804, test_f1: 0.4426
 epoch: 16, train_loss: 1.0886, test_loss: 1.0787, test_f1: 0.4672
 epoch: 17, train_loss: 1.0893, test_loss: 1.0695, test_f1: 0.4745
 epoch: 18, train_loss: 1.0654, test_loss: 1.0691, test_f1: 0.4739
 epoch: 19, train_loss: 1.0643, test_loss: 1.0619, test_f1: 0.4678
 epoch: 20, train_loss: 1.0650, test_loss: 1.0496, test_f1: 0.4741
 epoch: 21, train_loss: 1.0570, test_loss: 1.0657, test_f1: 0.4679
 epoch: 22, train_loss: 1.0465, test_loss: 1.0536, test_f1: 0.4838
 epoch: 23, train_loss: 1.0442, test_loss: 1.0543, test_f1: 0.4681
 epoch: 24, train_loss: 1.0408, test_loss: 1.0442, test_f1: 0.4852
 epoch: 25, train_loss: 1.0313, test_loss: 1.0432, test_f1: 0.4837
 epoch: 26, train_loss: 1.0289, test_loss: 1.0438, test_f1: 0.4930
 epoch: 27, train_loss: 1.0239, test_loss: 1.0438, test_f1: 0.4800
 epoch: 28, train_loss: 1.0216, test_loss: 1.0282, test_f1: 0.4898
 epoch: 29, train_loss: 1.0155, test_loss: 1.0454, test_f1: 0.4803
 epoch: 30, train_loss: 1.0069, test_loss: 1.0128, test_f1: 0.5086
 epoch: 31, train_loss: 1.0018, test_loss: 1.0189, test_f1: 0.4964
 epoch: 32, train_loss: 0.9908, test_loss: 1.0277, test_f1: 0.4972
 epoch: 33, train_loss: 0.9912, test_loss: 1.0266, test_f1: 0.4924
 epoch: 34, train_loss: 0.9756, test_loss: 1.0182, test_f1: 0.4696
 epoch: 35, train_loss: 0.9780, test_loss: 1.0275, test_f1: 0.4930
 epoch: 36, train_loss: 0.9713, test_loss: 1.0254, test_f1: 0.4656
 epoch: 37, train_loss: 0.9703, test_loss: 1.0161, test_f1: 0.5004
 epoch: 38, train_loss: 0.9577, test_loss: 1.0339, test_f1: 0.4948
 epoch: 39, train_loss: 0.9545, test_loss: 1.0161, test_f1: 0.4959
 epoch: 40, train_loss: 0.9429, test_loss: 1.0256, test_f1: 0.4931
 epoch: 41, train_loss: 0.9470, test_loss: 1.0372, test_f1: 0.4833
 epoch: 42, train_loss: 0.9447, test_loss: 1.0469, test_f1: 0.4733
 epoch: 43, train_loss: 0.9375, test_loss: 1.0420, test_f1: 0.5043
 epoch: 44, train_loss: 0.9427, test_loss: 1.0307, test_f1: 0.5012
 epoch: 45, train_loss: 0.9307, test_loss: 1.0263, test_f1: 0.4883
 epoch: 46, train_loss: 0.9238, test_loss: 1.0360, test_f1: 0.4945
 epoch: 47, train_loss: 0.9169, test_loss: 1.0341, test_f1: 0.4923
 epoch: 48, train_loss: 0.9159, test_loss: 1.0359, test_f1: 0.4877
 epoch: 49, train_loss: 0.9190, test_loss: 1.0182, test_f1: 0.4940
 epoch: 50, train_loss: 0.9117, test_loss: 1.0171, test_f1: 0.5028
 epoch: 51, train_loss: 0.9014, test_loss: 1.0263, test_f1: 0.4995
 epoch: 52, train_loss: 0.8974, test_loss: 1.0292, test_f1: 0.5193
 epoch: 53, train_loss: 0.8932, test_loss: 1.0362, test_f1: 0.5101
 epoch: 54, train_loss: 0.9019, test_loss: 1.0246, test_f1: 0.5122
 epoch: 55, train_loss: 0.8850, test_loss: 1.0350, test_f1: 0.5015
 epoch: 56, train_loss: 0.8909, test_loss: 1.0396, test_f1: 0.5044
 epoch: 57, train_loss: 0.8791, test_loss: 1.0359, test_f1: 0.4980
 epoch: 58, train_loss: 0.8777, test_loss: 1.0365, test_f1: 0.5082
 epoch: 59, train_loss: 0.8827, test_loss: 1.0294, test_f1: 0.5130
 epoch: 60, train_loss: 0.8814, test_loss: 1.0392, test_f1: 0.5036
 epoch: 61, train_loss: 0.8842, test_loss: 1.0243, test_f1: 0.5335
 epoch: 62, train_loss: 0.8695, test_loss: 1.0385, test_f1: 0.5077
 epoch: 63, train_loss: 0.8750, test_loss: 1.0219, test_f1: 0.5201
 epoch: 64, train_loss: 0.8754, test_loss: 1.0473, test_f1: 0.5136
 epoch: 65, train_loss: 0.8798, test_loss: 1.0562, test_f1: 0.5079
 epoch: 66, train_loss: 0.8676, test_loss: 1.0551, test_f1: 0.5009
 epoch: 67, train_loss: 0.8615, test_loss: 1.0328, test_f1: 0.5173
 epoch: 68, train_loss: 0.8772, test_loss: 1.0227, test_f1: 0.5173
 epoch: 69, train_loss: 0.8668, test_loss: 1.0315, test_f1: 0.5264
 epoch: 70, train_loss: 0.8580, test_loss: 1.0394, test_f1: 0.5084
 epoch: 71, train_loss: 0.8710, test_loss: 1.0339, test_f1: 0.5093
 epoch: 72, train_loss: 0.8507, test_loss: 1.0422, test_f1: 0.5130
 epoch: 73, train_loss: 0.8671, test_loss: 1.0341, test_f1: 0.5256
 epoch: 74, train_loss: 0.8536, test_loss: 1.0600, test_f1: 0.5157
 epoch: 75, train_loss: 0.8533, test_loss: 1.0529, test_f1: 0.5207
 epoch: 76, train_loss: 0.8629, test_loss: 1.0477, test_f1: 0.5146
 epoch: 77, train_loss: 0.8503, test_loss: 1.0423, test_f1: 0.5143
 epoch: 78, train_loss: 0.8467, test_loss: 1.0484, test_f1: 0.5144
 epoch: 79, train_loss: 0.8466, test_loss: 1.0622, test_f1: 0.5081
 epoch: 80, train_loss: 0.8380, test_loss: 1.0445, test_f1: 0.5054
 epoch: 81, train_loss: 0.8383, test_loss: 1.0516, test_f1: 0.5171
 epoch: 82, train_loss: 0.8501, test_loss: 1.0520, test_f1: 0.5205
 epoch: 83, train_loss: 0.8432, test_loss: 1.0853, test_f1: 0.5178
 epoch: 84, train_loss: 0.8435, test_loss: 1.0506, test_f1: 0.5270
 epoch: 85, train_loss: 0.8239, test_loss: 1.0573, test_f1: 0.5307
 epoch: 86, train_loss: 0.8441, test_loss: 1.0639, test_f1: 0.5105
 epoch: 87, train_loss: 0.8349, test_loss: 1.0382, test_f1: 0.5298
 epoch: 88, train_loss: 0.8214, test_loss: 1.0430, test_f1: 0.5204
 epoch: 89, train_loss: 0.8377, test_loss: 1.0370, test_f1: 0.5277
 epoch: 90, train_loss: 0.8309, test_loss: 1.0507, test_f1: 0.5119
 epoch: 91, train_loss: 0.8217, test_loss: 1.0670, test_f1: 0.5107
 epoch: 92, train_loss: 0.8276, test_loss: 1.0622, test_f1: 0.5153
 epoch: 93, train_loss: 0.8241, test_loss: 1.0600, test_f1: 0.5242
 epoch: 94, train_loss: 0.8161, test_loss: 1.0578, test_f1: 0.5157
 epoch: 95, train_loss: 0.8129, test_loss: 1.0809, test_f1: 0.5169
 epoch: 96, train_loss: 0.8174, test_loss: 1.0553, test_f1: 0.5180
 epoch: 97, train_loss: 0.8114, test_loss: 1.0619, test_f1: 0.5094
 epoch: 98, train_loss: 0.8191, test_loss: 1.0646, test_f1: 0.5264
 epoch: 99, train_loss: 0.8132, test_loss: 1.0669, test_f1: 0.5304
##################ITERATION #4 ****************************************
 epoch: 0, train_loss: 1.3065, test_loss: 1.2660, test_f1: 0.2828
 epoch: 1, train_loss: 1.2467, test_loss: 1.2187, test_f1: 0.3490
 epoch: 2, train_loss: 1.2318, test_loss: 1.2046, test_f1: 0.3647
 epoch: 3, train_loss: 1.2108, test_loss: 1.1930, test_f1: 0.4045
 epoch: 4, train_loss: 1.2087, test_loss: 1.1804, test_f1: 0.4179
 epoch: 5, train_loss: 1.1971, test_loss: 1.1634, test_f1: 0.4091
 epoch: 6, train_loss: 1.1929, test_loss: 1.1604, test_f1: 0.4183
 epoch: 7, train_loss: 1.1778, test_loss: 1.1492, test_f1: 0.4109
 epoch: 8, train_loss: 1.1684, test_loss: 1.1416, test_f1: 0.4045
 epoch: 9, train_loss: 1.1509, test_loss: 1.1303, test_f1: 0.4031
 epoch: 10, train_loss: 1.1584, test_loss: 1.1223, test_f1: 0.4091
 epoch: 11, train_loss: 1.1400, test_loss: 1.1161, test_f1: 0.4132
 epoch: 12, train_loss: 1.1385, test_loss: 1.1147, test_f1: 0.4083
 epoch: 13, train_loss: 1.1245, test_loss: 1.1055, test_f1: 0.4071
 epoch: 14, train_loss: 1.1190, test_loss: 1.0958, test_f1: 0.4368
 epoch: 15, train_loss: 1.1048, test_loss: 1.0884, test_f1: 0.4216
 epoch: 16, train_loss: 1.1169, test_loss: 1.0747, test_f1: 0.4360
 epoch: 17, train_loss: 1.1117, test_loss: 1.0789, test_f1: 0.4188
 epoch: 18, train_loss: 1.1016, test_loss: 1.0582, test_f1: 0.4528
 epoch: 19, train_loss: 1.0918, test_loss: 1.0651, test_f1: 0.4543
 epoch: 20, train_loss: 1.0883, test_loss: 1.0571, test_f1: 0.4569
 epoch: 21, train_loss: 1.0773, test_loss: 1.0514, test_f1: 0.4596
 epoch: 22, train_loss: 1.0705, test_loss: 1.0437, test_f1: 0.4612
 epoch: 23, train_loss: 1.0620, test_loss: 1.0405, test_f1: 0.4561
 epoch: 24, train_loss: 1.0611, test_loss: 1.0211, test_f1: 0.4699
 epoch: 25, train_loss: 1.0548, test_loss: 1.0259, test_f1: 0.4606
 epoch: 26, train_loss: 1.0467, test_loss: 1.0155, test_f1: 0.4541
 epoch: 27, train_loss: 1.0292, test_loss: 1.0015, test_f1: 0.4679
 epoch: 28, train_loss: 1.0316, test_loss: 1.0047, test_f1: 0.4724
 epoch: 29, train_loss: 1.0316, test_loss: 0.9990, test_f1: 0.4719
 epoch: 30, train_loss: 1.0261, test_loss: 0.9844, test_f1: 0.4617
 epoch: 31, train_loss: 1.0159, test_loss: 0.9784, test_f1: 0.4785
 epoch: 32, train_loss: 1.0101, test_loss: 0.9805, test_f1: 0.4702
 epoch: 33, train_loss: 1.0078, test_loss: 0.9770, test_f1: 0.4771
 epoch: 34, train_loss: 1.0057, test_loss: 0.9768, test_f1: 0.4726
 epoch: 35, train_loss: 0.9978, test_loss: 0.9685, test_f1: 0.4798
 epoch: 36, train_loss: 0.9820, test_loss: 0.9634, test_f1: 0.4767
 epoch: 37, train_loss: 0.9808, test_loss: 0.9654, test_f1: 0.4748
 epoch: 38, train_loss: 0.9877, test_loss: 0.9654, test_f1: 0.4778
 epoch: 39, train_loss: 0.9634, test_loss: 0.9665, test_f1: 0.4904
 epoch: 40, train_loss: 0.9706, test_loss: 0.9612, test_f1: 0.4858
 epoch: 41, train_loss: 0.9639, test_loss: 0.9803, test_f1: 0.5015
 epoch: 42, train_loss: 0.9604, test_loss: 0.9672, test_f1: 0.5000
 epoch: 43, train_loss: 0.9611, test_loss: 0.9588, test_f1: 0.4791
 epoch: 44, train_loss: 0.9512, test_loss: 0.9539, test_f1: 0.4731
 epoch: 45, train_loss: 0.9534, test_loss: 0.9677, test_f1: 0.4769
 epoch: 46, train_loss: 0.9457, test_loss: 0.9594, test_f1: 0.5090
 epoch: 47, train_loss: 0.9456, test_loss: 0.9532, test_f1: 0.4975
 epoch: 48, train_loss: 0.9481, test_loss: 0.9520, test_f1: 0.5060
 epoch: 49, train_loss: 0.9288, test_loss: 0.9570, test_f1: 0.5143
 epoch: 50, train_loss: 0.9274, test_loss: 0.9497, test_f1: 0.4929
 epoch: 51, train_loss: 0.9250, test_loss: 0.9565, test_f1: 0.4946
 epoch: 52, train_loss: 0.9146, test_loss: 0.9375, test_f1: 0.5042
 epoch: 53, train_loss: 0.9175, test_loss: 0.9478, test_f1: 0.5196
 epoch: 54, train_loss: 0.9094, test_loss: 0.9601, test_f1: 0.4973
 epoch: 55, train_loss: 0.9066, test_loss: 0.9497, test_f1: 0.4991
 epoch: 56, train_loss: 0.8972, test_loss: 0.9539, test_f1: 0.5009
 epoch: 57, train_loss: 0.9106, test_loss: 0.9541, test_f1: 0.4947
 epoch: 58, train_loss: 0.8943, test_loss: 0.9679, test_f1: 0.4934
 epoch: 59, train_loss: 0.9013, test_loss: 0.9678, test_f1: 0.4862
 epoch: 60, train_loss: 0.8911, test_loss: 0.9627, test_f1: 0.4866
 epoch: 61, train_loss: 0.8970, test_loss: 0.9575, test_f1: 0.4830
 epoch: 62, train_loss: 0.9017, test_loss: 0.9611, test_f1: 0.4787
 epoch: 63, train_loss: 0.8932, test_loss: 0.9454, test_f1: 0.4855
 epoch: 64, train_loss: 0.9030, test_loss: 0.9415, test_f1: 0.5061
 epoch: 65, train_loss: 0.8889, test_loss: 0.9633, test_f1: 0.4868
 epoch: 66, train_loss: 0.8743, test_loss: 0.9724, test_f1: 0.4813
 epoch: 67, train_loss: 0.8875, test_loss: 0.9566, test_f1: 0.4998
 epoch: 68, train_loss: 0.8875, test_loss: 0.9670, test_f1: 0.4886
 epoch: 69, train_loss: 0.8774, test_loss: 0.9669, test_f1: 0.4998
 epoch: 70, train_loss: 0.8741, test_loss: 0.9820, test_f1: 0.4799
 epoch: 71, train_loss: 0.8705, test_loss: 0.9663, test_f1: 0.4922
 epoch: 72, train_loss: 0.8675, test_loss: 0.9560, test_f1: 0.4992
 epoch: 73, train_loss: 0.8721, test_loss: 0.9907, test_f1: 0.4821
 epoch: 74, train_loss: 0.8772, test_loss: 1.0005, test_f1: 0.4859
 epoch: 75, train_loss: 0.8696, test_loss: 0.9910, test_f1: 0.4965
 epoch: 76, train_loss: 0.8769, test_loss: 0.9912, test_f1: 0.4888
 epoch: 77, train_loss: 0.8633, test_loss: 0.9700, test_f1: 0.4825
 epoch: 78, train_loss: 0.8651, test_loss: 0.9874, test_f1: 0.4925
 epoch: 79, train_loss: 0.8662, test_loss: 0.9771, test_f1: 0.4940
 epoch: 80, train_loss: 0.8637, test_loss: 0.9798, test_f1: 0.4970
 epoch: 81, train_loss: 0.8722, test_loss: 0.9820, test_f1: 0.4982
 epoch: 82, train_loss: 0.8528, test_loss: 0.9944, test_f1: 0.4983
 epoch: 83, train_loss: 0.8493, test_loss: 1.0029, test_f1: 0.5111
 epoch: 84, train_loss: 0.8620, test_loss: 0.9844, test_f1: 0.4959
 epoch: 85, train_loss: 0.8549, test_loss: 1.0002, test_f1: 0.4994
 epoch: 86, train_loss: 0.8469, test_loss: 0.9943, test_f1: 0.4925
 epoch: 87, train_loss: 0.8447, test_loss: 0.9783, test_f1: 0.4911
 epoch: 88, train_loss: 0.8515, test_loss: 1.0002, test_f1: 0.5056
 epoch: 89, train_loss: 0.8458, test_loss: 0.9937, test_f1: 0.5063
 epoch: 90, train_loss: 0.8461, test_loss: 1.0059, test_f1: 0.4974
 epoch: 91, train_loss: 0.8474, test_loss: 1.0061, test_f1: 0.4843
 epoch: 92, train_loss: 0.8441, test_loss: 0.9929, test_f1: 0.4829
 epoch: 93, train_loss: 0.8413, test_loss: 0.9894, test_f1: 0.5107
 epoch: 94, train_loss: 0.8336, test_loss: 0.9882, test_f1: 0.4980
 epoch: 95, train_loss: 0.8410, test_loss: 0.9827, test_f1: 0.4950
 epoch: 96, train_loss: 0.8367, test_loss: 0.9942, test_f1: 0.5008
 epoch: 97, train_loss: 0.8277, test_loss: 0.9960, test_f1: 0.4932
 epoch: 98, train_loss: 0.8370, test_loss: 1.0107, test_f1: 0.5216
 epoch: 99, train_loss: 0.8384, test_loss: 1.0128, test_f1: 0.4957
##################ITERATION #5 ****************************************
 epoch: 0, train_loss: 1.3071, test_loss: 1.2606, test_f1: 0.3231
 epoch: 1, train_loss: 1.2421, test_loss: 1.2031, test_f1: 0.3822
 epoch: 2, train_loss: 1.2184, test_loss: 1.1792, test_f1: 0.4026
 epoch: 3, train_loss: 1.2027, test_loss: 1.1580, test_f1: 0.4196
 epoch: 4, train_loss: 1.1870, test_loss: 1.1464, test_f1: 0.4145
 epoch: 5, train_loss: 1.1867, test_loss: 1.1342, test_f1: 0.4176
 epoch: 6, train_loss: 1.1687, test_loss: 1.1311, test_f1: 0.4245
 epoch: 7, train_loss: 1.1662, test_loss: 1.1284, test_f1: 0.4237
 epoch: 8, train_loss: 1.1468, test_loss: 1.1145, test_f1: 0.4233
 epoch: 9, train_loss: 1.1436, test_loss: 1.1159, test_f1: 0.4008
 epoch: 10, train_loss: 1.1386, test_loss: 1.1098, test_f1: 0.4428
 epoch: 11, train_loss: 1.1258, test_loss: 1.1043, test_f1: 0.4424
 epoch: 12, train_loss: 1.1251, test_loss: 1.0973, test_f1: 0.4134
 epoch: 13, train_loss: 1.1151, test_loss: 1.0895, test_f1: 0.4128
 epoch: 14, train_loss: 1.1047, test_loss: 1.0910, test_f1: 0.4195
 epoch: 15, train_loss: 1.0996, test_loss: 1.0863, test_f1: 0.4238
 epoch: 16, train_loss: 1.0989, test_loss: 1.0694, test_f1: 0.4360
 epoch: 17, train_loss: 1.0811, test_loss: 1.0650, test_f1: 0.4270
 epoch: 18, train_loss: 1.0861, test_loss: 1.0694, test_f1: 0.4329
 epoch: 19, train_loss: 1.0822, test_loss: 1.0596, test_f1: 0.4433
 epoch: 20, train_loss: 1.0776, test_loss: 1.0503, test_f1: 0.4328
 epoch: 21, train_loss: 1.0637, test_loss: 1.0445, test_f1: 0.4459
 epoch: 22, train_loss: 1.0594, test_loss: 1.0451, test_f1: 0.4248
 epoch: 23, train_loss: 1.0537, test_loss: 1.0368, test_f1: 0.4327
 epoch: 24, train_loss: 1.0581, test_loss: 1.0412, test_f1: 0.4473
 epoch: 25, train_loss: 1.0436, test_loss: 1.0303, test_f1: 0.4341
 epoch: 26, train_loss: 1.0392, test_loss: 1.0408, test_f1: 0.4218
 epoch: 27, train_loss: 1.0298, test_loss: 1.0381, test_f1: 0.4279
 epoch: 28, train_loss: 1.0212, test_loss: 1.0404, test_f1: 0.4415
 epoch: 29, train_loss: 1.0245, test_loss: 1.0148, test_f1: 0.4419
 epoch: 30, train_loss: 1.0201, test_loss: 1.0093, test_f1: 0.4405
 epoch: 31, train_loss: 0.9972, test_loss: 1.0094, test_f1: 0.4412
 epoch: 32, train_loss: 1.0041, test_loss: 0.9931, test_f1: 0.4398
 epoch: 33, train_loss: 0.9871, test_loss: 1.0318, test_f1: 0.4383
 epoch: 34, train_loss: 0.9823, test_loss: 1.0107, test_f1: 0.4315
 epoch: 35, train_loss: 0.9841, test_loss: 0.9922, test_f1: 0.4458
 epoch: 36, train_loss: 0.9741, test_loss: 1.0220, test_f1: 0.4237
 epoch: 37, train_loss: 0.9588, test_loss: 0.9961, test_f1: 0.4279
 epoch: 38, train_loss: 0.9616, test_loss: 0.9851, test_f1: 0.4344
 epoch: 39, train_loss: 0.9697, test_loss: 0.9999, test_f1: 0.4517
 epoch: 40, train_loss: 0.9681, test_loss: 0.9868, test_f1: 0.4437
 epoch: 41, train_loss: 0.9503, test_loss: 0.9888, test_f1: 0.4641
 epoch: 42, train_loss: 0.9585, test_loss: 1.0127, test_f1: 0.4488
 epoch: 43, train_loss: 0.9354, test_loss: 1.0070, test_f1: 0.4404
 epoch: 44, train_loss: 0.9360, test_loss: 0.9989, test_f1: 0.4416
 epoch: 45, train_loss: 0.9376, test_loss: 1.0068, test_f1: 0.4443
 epoch: 46, train_loss: 0.9257, test_loss: 1.0131, test_f1: 0.4538
 epoch: 47, train_loss: 0.9337, test_loss: 1.0148, test_f1: 0.4386
 epoch: 48, train_loss: 0.9232, test_loss: 1.0292, test_f1: 0.4383
 epoch: 49, train_loss: 0.9321, test_loss: 0.9957, test_f1: 0.4676
 epoch: 50, train_loss: 0.9143, test_loss: 1.0237, test_f1: 0.4374
 epoch: 51, train_loss: 0.9140, test_loss: 1.0341, test_f1: 0.4257
 epoch: 52, train_loss: 0.9090, test_loss: 1.0049, test_f1: 0.4503
 epoch: 53, train_loss: 0.8965, test_loss: 1.0060, test_f1: 0.4345
 epoch: 54, train_loss: 0.8949, test_loss: 1.0083, test_f1: 0.4289
 epoch: 55, train_loss: 0.8961, test_loss: 1.0323, test_f1: 0.4340
 epoch: 56, train_loss: 0.8934, test_loss: 1.0064, test_f1: 0.4414
 epoch: 57, train_loss: 0.8870, test_loss: 0.9913, test_f1: 0.4565
 epoch: 58, train_loss: 0.8901, test_loss: 1.0125, test_f1: 0.4391
 epoch: 59, train_loss: 0.9026, test_loss: 1.0334, test_f1: 0.4567
 epoch: 60, train_loss: 0.8870, test_loss: 0.9965, test_f1: 0.4722
 epoch: 61, train_loss: 0.8890, test_loss: 1.0224, test_f1: 0.4719
 epoch: 62, train_loss: 0.8758, test_loss: 1.0160, test_f1: 0.4420
 epoch: 63, train_loss: 0.8811, test_loss: 1.0055, test_f1: 0.4617
 epoch: 64, train_loss: 0.8680, test_loss: 1.0028, test_f1: 0.4633
 epoch: 65, train_loss: 0.8794, test_loss: 1.0330, test_f1: 0.4525
 epoch: 66, train_loss: 0.8713, test_loss: 1.0362, test_f1: 0.4592
 epoch: 67, train_loss: 0.8615, test_loss: 1.0393, test_f1: 0.4545
 epoch: 68, train_loss: 0.8706, test_loss: 1.0054, test_f1: 0.4684
 epoch: 69, train_loss: 0.8599, test_loss: 1.0258, test_f1: 0.4518
 epoch: 70, train_loss: 0.8611, test_loss: 0.9979, test_f1: 0.4681
 epoch: 71, train_loss: 0.8844, test_loss: 1.0147, test_f1: 0.4879
 epoch: 72, train_loss: 0.8585, test_loss: 1.0345, test_f1: 0.4562
 epoch: 73, train_loss: 0.8575, test_loss: 1.0371, test_f1: 0.4463
 epoch: 74, train_loss: 0.8641, test_loss: 1.0270, test_f1: 0.4684
 epoch: 75, train_loss: 0.8506, test_loss: 1.0269, test_f1: 0.4666
 epoch: 76, train_loss: 0.8675, test_loss: 1.0124, test_f1: 0.4868
 epoch: 77, train_loss: 0.8575, test_loss: 1.0271, test_f1: 0.4815
 epoch: 78, train_loss: 0.8531, test_loss: 1.0146, test_f1: 0.4879
 epoch: 79, train_loss: 0.8569, test_loss: 1.0199, test_f1: 0.4773
 epoch: 80, train_loss: 0.8503, test_loss: 1.0255, test_f1: 0.4772
 epoch: 81, train_loss: 0.8473, test_loss: 1.0246, test_f1: 0.4732
 epoch: 82, train_loss: 0.8433, test_loss: 1.0253, test_f1: 0.4930
 epoch: 83, train_loss: 0.8419, test_loss: 1.0445, test_f1: 0.4461
 epoch: 84, train_loss: 0.8351, test_loss: 1.0337, test_f1: 0.4592
 epoch: 85, train_loss: 0.8545, test_loss: 1.0246, test_f1: 0.4702
 epoch: 86, train_loss: 0.8490, test_loss: 1.0166, test_f1: 0.4937
 epoch: 87, train_loss: 0.8314, test_loss: 1.0434, test_f1: 0.4654
 epoch: 88, train_loss: 0.8243, test_loss: 1.0461, test_f1: 0.4549
 epoch: 89, train_loss: 0.8464, test_loss: 1.0248, test_f1: 0.4958
 epoch: 90, train_loss: 0.8333, test_loss: 1.0620, test_f1: 0.4553
 epoch: 91, train_loss: 0.8360, test_loss: 1.0302, test_f1: 0.4767
 epoch: 92, train_loss: 0.8315, test_loss: 1.0499, test_f1: 0.4700
 epoch: 93, train_loss: 0.8239, test_loss: 1.0563, test_f1: 0.4579
 epoch: 94, train_loss: 0.8300, test_loss: 1.1150, test_f1: 0.4561
 epoch: 95, train_loss: 0.8213, test_loss: 1.0512, test_f1: 0.4548
 epoch: 96, train_loss: 0.8384, test_loss: 1.0636, test_f1: 0.4557
 epoch: 97, train_loss: 0.8132, test_loss: 1.0521, test_f1: 0.4768
 epoch: 98, train_loss: 0.8107, test_loss: 1.0490, test_f1: 0.4939
 epoch: 99, train_loss: 0.8107, test_loss: 1.0639, test_f1: 0.4698
##################ITERATION #6 ****************************************
 epoch: 0, train_loss: 1.3127, test_loss: 1.2443, test_f1: 0.3488
 epoch: 1, train_loss: 1.2378, test_loss: 1.2006, test_f1: 0.4074
 epoch: 2, train_loss: 1.2067, test_loss: 1.1786, test_f1: 0.4241
 epoch: 3, train_loss: 1.1903, test_loss: 1.1622, test_f1: 0.4302
 epoch: 4, train_loss: 1.1751, test_loss: 1.1473, test_f1: 0.4435
 epoch: 5, train_loss: 1.1611, test_loss: 1.1337, test_f1: 0.4463
 epoch: 6, train_loss: 1.1425, test_loss: 1.1246, test_f1: 0.4507
 epoch: 7, train_loss: 1.1311, test_loss: 1.1090, test_f1: 0.4542
 epoch: 8, train_loss: 1.1277, test_loss: 1.0931, test_f1: 0.4596
 epoch: 9, train_loss: 1.1127, test_loss: 1.0838, test_f1: 0.4527
 epoch: 10, train_loss: 1.1162, test_loss: 1.0786, test_f1: 0.4635
 epoch: 11, train_loss: 1.0977, test_loss: 1.0745, test_f1: 0.4732
 epoch: 12, train_loss: 1.0843, test_loss: 1.0632, test_f1: 0.4643
 epoch: 13, train_loss: 1.0857, test_loss: 1.0557, test_f1: 0.4721
 epoch: 14, train_loss: 1.0644, test_loss: 1.0470, test_f1: 0.4711
 epoch: 15, train_loss: 1.0606, test_loss: 1.0390, test_f1: 0.4805
 epoch: 16, train_loss: 1.0615, test_loss: 1.0360, test_f1: 0.4742
 epoch: 17, train_loss: 1.0496, test_loss: 1.0300, test_f1: 0.4764
 epoch: 18, train_loss: 1.0457, test_loss: 1.0234, test_f1: 0.4853
 epoch: 19, train_loss: 1.0344, test_loss: 1.0312, test_f1: 0.4778
 epoch: 20, train_loss: 1.0343, test_loss: 1.0221, test_f1: 0.4758
 epoch: 21, train_loss: 1.0193, test_loss: 0.9940, test_f1: 0.4894
 epoch: 22, train_loss: 1.0182, test_loss: 1.0083, test_f1: 0.4747
 epoch: 23, train_loss: 1.0108, test_loss: 1.0115, test_f1: 0.4680
 epoch: 24, train_loss: 1.0077, test_loss: 1.0021, test_f1: 0.4803
 epoch: 25, train_loss: 0.9927, test_loss: 1.0108, test_f1: 0.4762
 epoch: 26, train_loss: 0.9963, test_loss: 1.0176, test_f1: 0.4766
 epoch: 27, train_loss: 0.9832, test_loss: 0.9823, test_f1: 0.4907
 epoch: 28, train_loss: 0.9795, test_loss: 0.9929, test_f1: 0.4757
 epoch: 29, train_loss: 0.9820, test_loss: 0.9953, test_f1: 0.4633
 epoch: 30, train_loss: 0.9835, test_loss: 0.9973, test_f1: 0.4663
 epoch: 31, train_loss: 0.9750, test_loss: 0.9817, test_f1: 0.4785
 epoch: 32, train_loss: 0.9626, test_loss: 0.9800, test_f1: 0.4853
 epoch: 33, train_loss: 0.9576, test_loss: 0.9847, test_f1: 0.4799
 epoch: 34, train_loss: 0.9534, test_loss: 0.9720, test_f1: 0.4946
 epoch: 35, train_loss: 0.9528, test_loss: 0.9832, test_f1: 0.4792
 epoch: 36, train_loss: 0.9539, test_loss: 0.9726, test_f1: 0.4703
 epoch: 37, train_loss: 0.9624, test_loss: 0.9760, test_f1: 0.4813
 epoch: 38, train_loss: 0.9422, test_loss: 0.9846, test_f1: 0.4762
 epoch: 39, train_loss: 0.9239, test_loss: 0.9723, test_f1: 0.4853
 epoch: 40, train_loss: 0.9315, test_loss: 0.9776, test_f1: 0.4849
 epoch: 41, train_loss: 0.9266, test_loss: 0.9722, test_f1: 0.4719
 epoch: 42, train_loss: 0.9216, test_loss: 0.9779, test_f1: 0.4904
 epoch: 43, train_loss: 0.9221, test_loss: 0.9728, test_f1: 0.4714
 epoch: 44, train_loss: 0.9232, test_loss: 0.9734, test_f1: 0.4806
 epoch: 45, train_loss: 0.9176, test_loss: 0.9889, test_f1: 0.4786
 epoch: 46, train_loss: 0.9060, test_loss: 0.9904, test_f1: 0.4697
 epoch: 47, train_loss: 0.9063, test_loss: 0.9714, test_f1: 0.4901
 epoch: 48, train_loss: 0.9001, test_loss: 0.9781, test_f1: 0.4828
 epoch: 49, train_loss: 0.8892, test_loss: 0.9770, test_f1: 0.4879
 epoch: 50, train_loss: 0.8973, test_loss: 0.9925, test_f1: 0.4796
 epoch: 51, train_loss: 0.8919, test_loss: 0.9764, test_f1: 0.4792
 epoch: 52, train_loss: 0.8883, test_loss: 0.9880, test_f1: 0.4827
 epoch: 53, train_loss: 0.8800, test_loss: 0.9955, test_f1: 0.4851
 epoch: 54, train_loss: 0.8816, test_loss: 0.9851, test_f1: 0.4812
 epoch: 55, train_loss: 0.8707, test_loss: 1.0066, test_f1: 0.4818
 epoch: 56, train_loss: 0.8758, test_loss: 1.0004, test_f1: 0.4868
 epoch: 57, train_loss: 0.8673, test_loss: 0.9993, test_f1: 0.4801
 epoch: 58, train_loss: 0.8727, test_loss: 0.9927, test_f1: 0.4850
 epoch: 59, train_loss: 0.8732, test_loss: 1.0077, test_f1: 0.5003
 epoch: 60, train_loss: 0.8762, test_loss: 1.0021, test_f1: 0.4882
 epoch: 61, train_loss: 0.8627, test_loss: 1.0128, test_f1: 0.4915
 epoch: 62, train_loss: 0.8702, test_loss: 0.9938, test_f1: 0.4910
 epoch: 63, train_loss: 0.8612, test_loss: 1.0015, test_f1: 0.4874
 epoch: 64, train_loss: 0.8589, test_loss: 0.9960, test_f1: 0.4893
 epoch: 65, train_loss: 0.8519, test_loss: 1.0227, test_f1: 0.4849
 epoch: 66, train_loss: 0.8685, test_loss: 1.0044, test_f1: 0.4903
 epoch: 67, train_loss: 0.8675, test_loss: 0.9944, test_f1: 0.4959
 epoch: 68, train_loss: 0.8488, test_loss: 0.9987, test_f1: 0.4991
 epoch: 69, train_loss: 0.8603, test_loss: 0.9930, test_f1: 0.4919
 epoch: 70, train_loss: 0.8545, test_loss: 1.0247, test_f1: 0.4921
 epoch: 71, train_loss: 0.8583, test_loss: 1.0107, test_f1: 0.4908
 epoch: 72, train_loss: 0.8471, test_loss: 0.9990, test_f1: 0.5038
 epoch: 73, train_loss: 0.8454, test_loss: 1.0036, test_f1: 0.5087
 epoch: 74, train_loss: 0.8477, test_loss: 1.0159, test_f1: 0.5013
 epoch: 75, train_loss: 0.8329, test_loss: 0.9967, test_f1: 0.5015
 epoch: 76, train_loss: 0.8466, test_loss: 1.0261, test_f1: 0.5051
 epoch: 77, train_loss: 0.8460, test_loss: 1.0116, test_f1: 0.5005
 epoch: 78, train_loss: 0.8428, test_loss: 1.0314, test_f1: 0.4983
 epoch: 79, train_loss: 0.8332, test_loss: 1.0307, test_f1: 0.4900
 epoch: 80, train_loss: 0.8441, test_loss: 1.0177, test_f1: 0.5072
 epoch: 81, train_loss: 0.8313, test_loss: 1.0393, test_f1: 0.4951
 epoch: 82, train_loss: 0.8328, test_loss: 1.0207, test_f1: 0.5024
 epoch: 83, train_loss: 0.8240, test_loss: 1.0173, test_f1: 0.5018
 epoch: 84, train_loss: 0.8211, test_loss: 1.0282, test_f1: 0.5004
 epoch: 85, train_loss: 0.8329, test_loss: 1.0248, test_f1: 0.4864
 epoch: 86, train_loss: 0.8291, test_loss: 1.0138, test_f1: 0.5068
 epoch: 87, train_loss: 0.8260, test_loss: 1.0383, test_f1: 0.5010
 epoch: 88, train_loss: 0.8153, test_loss: 1.0135, test_f1: 0.5164
 epoch: 89, train_loss: 0.8207, test_loss: 1.0356, test_f1: 0.5018
 epoch: 90, train_loss: 0.8132, test_loss: 1.0523, test_f1: 0.5009
 epoch: 91, train_loss: 0.8219, test_loss: 1.0459, test_f1: 0.5101
 epoch: 92, train_loss: 0.8072, test_loss: 1.0487, test_f1: 0.5057
 epoch: 93, train_loss: 0.8131, test_loss: 1.0112, test_f1: 0.5181
 epoch: 94, train_loss: 0.8094, test_loss: 1.0442, test_f1: 0.5064
 epoch: 95, train_loss: 0.7969, test_loss: 1.0369, test_f1: 0.5211
 epoch: 96, train_loss: 0.8053, test_loss: 1.0476, test_f1: 0.5130
 epoch: 97, train_loss: 0.8302, test_loss: 1.0424, test_f1: 0.5105
 epoch: 98, train_loss: 0.8076, test_loss: 1.0461, test_f1: 0.4983
 epoch: 99, train_loss: 0.8273, test_loss: 1.0538, test_f1: 0.5207
##################ITERATION #7 ****************************************
 epoch: 0, train_loss: 1.3019, test_loss: 1.2436, test_f1: 0.3790
 epoch: 1, train_loss: 1.2406, test_loss: 1.1965, test_f1: 0.4057
 epoch: 2, train_loss: 1.2232, test_loss: 1.1708, test_f1: 0.4143
 epoch: 3, train_loss: 1.1957, test_loss: 1.1437, test_f1: 0.4230
 epoch: 4, train_loss: 1.1892, test_loss: 1.1278, test_f1: 0.4338
 epoch: 5, train_loss: 1.1634, test_loss: 1.1161, test_f1: 0.4422
 epoch: 6, train_loss: 1.1662, test_loss: 1.1076, test_f1: 0.4386
 epoch: 7, train_loss: 1.1516, test_loss: 1.0963, test_f1: 0.4351
 epoch: 8, train_loss: 1.1424, test_loss: 1.0906, test_f1: 0.4501
 epoch: 9, train_loss: 1.1297, test_loss: 1.0818, test_f1: 0.4247
 epoch: 10, train_loss: 1.1287, test_loss: 1.0758, test_f1: 0.4407
 epoch: 11, train_loss: 1.1125, test_loss: 1.0640, test_f1: 0.4432
 epoch: 12, train_loss: 1.1036, test_loss: 1.0550, test_f1: 0.4570
 epoch: 13, train_loss: 1.0892, test_loss: 1.0566, test_f1: 0.4556
 epoch: 14, train_loss: 1.0818, test_loss: 1.0485, test_f1: 0.4624
 epoch: 15, train_loss: 1.0789, test_loss: 1.0457, test_f1: 0.4766
 epoch: 16, train_loss: 1.0774, test_loss: 1.0349, test_f1: 0.4698
 epoch: 17, train_loss: 1.0741, test_loss: 1.0349, test_f1: 0.4720
 epoch: 18, train_loss: 1.0654, test_loss: 1.0389, test_f1: 0.4507
 epoch: 19, train_loss: 1.0543, test_loss: 1.0277, test_f1: 0.4574
 epoch: 20, train_loss: 1.0443, test_loss: 1.0440, test_f1: 0.4647
 epoch: 21, train_loss: 1.0327, test_loss: 1.0315, test_f1: 0.4725
 epoch: 22, train_loss: 1.0461, test_loss: 1.0320, test_f1: 0.4533
 epoch: 23, train_loss: 1.0246, test_loss: 1.0136, test_f1: 0.4571
 epoch: 24, train_loss: 1.0244, test_loss: 1.0122, test_f1: 0.4790
 epoch: 25, train_loss: 1.0133, test_loss: 1.0234, test_f1: 0.4587
 epoch: 26, train_loss: 1.0161, test_loss: 1.0208, test_f1: 0.4672
 epoch: 27, train_loss: 1.0107, test_loss: 1.0140, test_f1: 0.4586
 epoch: 28, train_loss: 1.0083, test_loss: 1.0129, test_f1: 0.4461
 epoch: 29, train_loss: 0.9923, test_loss: 0.9972, test_f1: 0.4592
 epoch: 30, train_loss: 0.9878, test_loss: 0.9954, test_f1: 0.4893
 epoch: 31, train_loss: 0.9861, test_loss: 1.0047, test_f1: 0.4818
 epoch: 32, train_loss: 0.9965, test_loss: 1.0129, test_f1: 0.4504
 epoch: 33, train_loss: 0.9792, test_loss: 1.0009, test_f1: 0.4396
 epoch: 34, train_loss: 0.9584, test_loss: 1.0090, test_f1: 0.4651
 epoch: 35, train_loss: 0.9627, test_loss: 0.9929, test_f1: 0.4816
 epoch: 36, train_loss: 0.9722, test_loss: 0.9996, test_f1: 0.4848
 epoch: 37, train_loss: 0.9701, test_loss: 1.0015, test_f1: 0.4638
 epoch: 38, train_loss: 0.9564, test_loss: 0.9980, test_f1: 0.4637
 epoch: 39, train_loss: 0.9501, test_loss: 1.0011, test_f1: 0.4562
 epoch: 40, train_loss: 0.9362, test_loss: 1.0069, test_f1: 0.4648
 epoch: 41, train_loss: 0.9360, test_loss: 0.9924, test_f1: 0.4799
 epoch: 42, train_loss: 0.9425, test_loss: 1.0054, test_f1: 0.4676
 epoch: 43, train_loss: 0.9337, test_loss: 0.9959, test_f1: 0.4693
 epoch: 44, train_loss: 0.9347, test_loss: 1.0061, test_f1: 0.4654
 epoch: 45, train_loss: 0.9290, test_loss: 1.0152, test_f1: 0.4567
 epoch: 46, train_loss: 0.9193, test_loss: 0.9979, test_f1: 0.4765
 epoch: 47, train_loss: 0.9094, test_loss: 1.0060, test_f1: 0.4719
 epoch: 48, train_loss: 0.9184, test_loss: 1.0118, test_f1: 0.4764
 epoch: 49, train_loss: 0.9114, test_loss: 1.0253, test_f1: 0.4806
 epoch: 50, train_loss: 0.9030, test_loss: 1.0282, test_f1: 0.4782
 epoch: 51, train_loss: 0.8923, test_loss: 1.0005, test_f1: 0.4854
 epoch: 52, train_loss: 0.9001, test_loss: 1.0282, test_f1: 0.4713
 epoch: 53, train_loss: 0.8952, test_loss: 1.0037, test_f1: 0.4847
 epoch: 54, train_loss: 0.8933, test_loss: 1.0104, test_f1: 0.4788
 epoch: 55, train_loss: 0.8812, test_loss: 1.0051, test_f1: 0.4905
 epoch: 56, train_loss: 0.8804, test_loss: 1.0169, test_f1: 0.4800
 epoch: 57, train_loss: 0.8857, test_loss: 1.0093, test_f1: 0.4805
 epoch: 58, train_loss: 0.8815, test_loss: 1.0181, test_f1: 0.4821
 epoch: 59, train_loss: 0.8670, test_loss: 1.0201, test_f1: 0.4866
 epoch: 60, train_loss: 0.8796, test_loss: 1.0134, test_f1: 0.4760
 epoch: 61, train_loss: 0.8712, test_loss: 1.0286, test_f1: 0.4711
 epoch: 62, train_loss: 0.8745, test_loss: 1.0264, test_f1: 0.4771
 epoch: 63, train_loss: 0.8816, test_loss: 1.0315, test_f1: 0.4790
 epoch: 64, train_loss: 0.8764, test_loss: 1.0318, test_f1: 0.4802
 epoch: 65, train_loss: 0.8678, test_loss: 1.0276, test_f1: 0.4827
 epoch: 66, train_loss: 0.8639, test_loss: 1.0246, test_f1: 0.4860
 epoch: 67, train_loss: 0.8758, test_loss: 1.0240, test_f1: 0.4894
 epoch: 68, train_loss: 0.8584, test_loss: 1.0238, test_f1: 0.4857
 epoch: 69, train_loss: 0.8630, test_loss: 1.0277, test_f1: 0.4924
 epoch: 70, train_loss: 0.8534, test_loss: 1.0247, test_f1: 0.4847
 epoch: 71, train_loss: 0.8530, test_loss: 1.0175, test_f1: 0.4871
 epoch: 72, train_loss: 0.8660, test_loss: 1.0314, test_f1: 0.4929
 epoch: 73, train_loss: 0.8559, test_loss: 1.0362, test_f1: 0.4907
 epoch: 74, train_loss: 0.8590, test_loss: 1.0384, test_f1: 0.4863
 epoch: 75, train_loss: 0.8593, test_loss: 1.0266, test_f1: 0.5016
 epoch: 76, train_loss: 0.8417, test_loss: 1.0314, test_f1: 0.4965
 epoch: 77, train_loss: 0.8547, test_loss: 1.0340, test_f1: 0.4941
 epoch: 78, train_loss: 0.8481, test_loss: 1.0419, test_f1: 0.4885
 epoch: 79, train_loss: 0.8517, test_loss: 1.0206, test_f1: 0.4981
 epoch: 80, train_loss: 0.8350, test_loss: 1.0346, test_f1: 0.4910
 epoch: 81, train_loss: 0.8410, test_loss: 1.0421, test_f1: 0.4923
 epoch: 82, train_loss: 0.8560, test_loss: 1.0395, test_f1: 0.5010
 epoch: 83, train_loss: 0.8327, test_loss: 1.0339, test_f1: 0.4987
 epoch: 84, train_loss: 0.8424, test_loss: 1.0314, test_f1: 0.5017
 epoch: 85, train_loss: 0.8300, test_loss: 1.0588, test_f1: 0.4915
 epoch: 86, train_loss: 0.8283, test_loss: 1.0437, test_f1: 0.5023
 epoch: 87, train_loss: 0.8328, test_loss: 1.0434, test_f1: 0.4915
 epoch: 88, train_loss: 0.8309, test_loss: 1.0480, test_f1: 0.4818
 epoch: 89, train_loss: 0.8320, test_loss: 1.0411, test_f1: 0.4921
 epoch: 90, train_loss: 0.8256, test_loss: 1.0574, test_f1: 0.4986
 epoch: 91, train_loss: 0.8225, test_loss: 1.0490, test_f1: 0.5052
 epoch: 92, train_loss: 0.8176, test_loss: 1.0604, test_f1: 0.4957
 epoch: 93, train_loss: 0.8249, test_loss: 1.0600, test_f1: 0.4961
 epoch: 94, train_loss: 0.8203, test_loss: 1.0597, test_f1: 0.4952
 epoch: 95, train_loss: 0.8158, test_loss: 1.0547, test_f1: 0.5017
 epoch: 96, train_loss: 0.8206, test_loss: 1.0516, test_f1: 0.4995
 epoch: 97, train_loss: 0.7995, test_loss: 1.0501, test_f1: 0.4983
 epoch: 98, train_loss: 0.8164, test_loss: 1.0426, test_f1: 0.5058
 epoch: 99, train_loss: 0.8284, test_loss: 1.0551, test_f1: 0.4925
##################ITERATION #8 ****************************************
 epoch: 0, train_loss: 1.3191, test_loss: 1.1954, test_f1: 0.3735
 epoch: 1, train_loss: 1.2406, test_loss: 1.1598, test_f1: 0.4288
 epoch: 2, train_loss: 1.2228, test_loss: 1.1358, test_f1: 0.4588
 epoch: 3, train_loss: 1.2028, test_loss: 1.1198, test_f1: 0.4490
 epoch: 4, train_loss: 1.1912, test_loss: 1.1070, test_f1: 0.4342
 epoch: 5, train_loss: 1.1672, test_loss: 1.0954, test_f1: 0.4387
 epoch: 6, train_loss: 1.1636, test_loss: 1.0869, test_f1: 0.4412
 epoch: 7, train_loss: 1.1426, test_loss: 1.0737, test_f1: 0.4368
 epoch: 8, train_loss: 1.1355, test_loss: 1.0588, test_f1: 0.4549
 epoch: 9, train_loss: 1.1205, test_loss: 1.0466, test_f1: 0.4506
 epoch: 10, train_loss: 1.1220, test_loss: 1.0587, test_f1: 0.4467
 epoch: 11, train_loss: 1.1093, test_loss: 1.0422, test_f1: 0.4513
 epoch: 12, train_loss: 1.0946, test_loss: 1.0316, test_f1: 0.4578
 epoch: 13, train_loss: 1.0967, test_loss: 1.0163, test_f1: 0.4744
 epoch: 14, train_loss: 1.0754, test_loss: 1.0128, test_f1: 0.4770
 epoch: 15, train_loss: 1.0755, test_loss: 1.0063, test_f1: 0.4600
 epoch: 16, train_loss: 1.0648, test_loss: 0.9888, test_f1: 0.4893
 epoch: 17, train_loss: 1.0678, test_loss: 0.9746, test_f1: 0.4902
 epoch: 18, train_loss: 1.0594, test_loss: 0.9884, test_f1: 0.4756
 epoch: 19, train_loss: 1.0545, test_loss: 0.9870, test_f1: 0.4834
 epoch: 20, train_loss: 1.0409, test_loss: 0.9785, test_f1: 0.4944
 epoch: 21, train_loss: 1.0367, test_loss: 0.9748, test_f1: 0.4796
 epoch: 22, train_loss: 1.0234, test_loss: 0.9685, test_f1: 0.4674
 epoch: 23, train_loss: 1.0331, test_loss: 0.9662, test_f1: 0.4809
 epoch: 24, train_loss: 1.0158, test_loss: 0.9686, test_f1: 0.4768
 epoch: 25, train_loss: 1.0209, test_loss: 0.9595, test_f1: 0.5096
 epoch: 26, train_loss: 1.0134, test_loss: 0.9637, test_f1: 0.4868
 epoch: 27, train_loss: 1.0102, test_loss: 0.9659, test_f1: 0.4825
 epoch: 28, train_loss: 0.9947, test_loss: 0.9526, test_f1: 0.5037
 epoch: 29, train_loss: 1.0006, test_loss: 0.9620, test_f1: 0.4914
 epoch: 30, train_loss: 0.9886, test_loss: 0.9547, test_f1: 0.5028
 epoch: 31, train_loss: 0.9866, test_loss: 0.9525, test_f1: 0.4994
 epoch: 32, train_loss: 0.9840, test_loss: 0.9548, test_f1: 0.4995
 epoch: 33, train_loss: 0.9901, test_loss: 0.9511, test_f1: 0.5015
 epoch: 34, train_loss: 0.9847, test_loss: 0.9428, test_f1: 0.5064
 epoch: 35, train_loss: 0.9734, test_loss: 0.9560, test_f1: 0.4883
 epoch: 36, train_loss: 0.9572, test_loss: 0.9513, test_f1: 0.4890
 epoch: 37, train_loss: 0.9602, test_loss: 0.9576, test_f1: 0.4929
 epoch: 38, train_loss: 0.9709, test_loss: 0.9542, test_f1: 0.4964
 epoch: 39, train_loss: 0.9579, test_loss: 0.9421, test_f1: 0.5136
 epoch: 40, train_loss: 0.9429, test_loss: 0.9503, test_f1: 0.5043
 epoch: 41, train_loss: 0.9505, test_loss: 0.9432, test_f1: 0.4942
 epoch: 42, train_loss: 0.9526, test_loss: 0.9469, test_f1: 0.5029
 epoch: 43, train_loss: 0.9432, test_loss: 0.9423, test_f1: 0.5099
 epoch: 44, train_loss: 0.9397, test_loss: 0.9392, test_f1: 0.5120
 epoch: 45, train_loss: 0.9450, test_loss: 0.9292, test_f1: 0.5061
 epoch: 46, train_loss: 0.9241, test_loss: 0.9538, test_f1: 0.5116
 epoch: 47, train_loss: 0.9349, test_loss: 0.9523, test_f1: 0.5175
 epoch: 48, train_loss: 0.9295, test_loss: 0.9334, test_f1: 0.5208
 epoch: 49, train_loss: 0.9251, test_loss: 0.9496, test_f1: 0.5130
 epoch: 50, train_loss: 0.9159, test_loss: 0.9386, test_f1: 0.5107
 epoch: 51, train_loss: 0.9088, test_loss: 0.9338, test_f1: 0.5189
 epoch: 52, train_loss: 0.9168, test_loss: 0.9386, test_f1: 0.5150
 epoch: 53, train_loss: 0.9033, test_loss: 0.9354, test_f1: 0.5151
 epoch: 54, train_loss: 0.9067, test_loss: 0.9371, test_f1: 0.5154
 epoch: 55, train_loss: 0.9062, test_loss: 0.9385, test_f1: 0.5036
 epoch: 56, train_loss: 0.9080, test_loss: 0.9415, test_f1: 0.5117
 epoch: 57, train_loss: 0.8941, test_loss: 0.9340, test_f1: 0.5215
 epoch: 58, train_loss: 0.8893, test_loss: 0.9448, test_f1: 0.5183
 epoch: 59, train_loss: 0.8994, test_loss: 0.9485, test_f1: 0.5232
 epoch: 60, train_loss: 0.8873, test_loss: 0.9489, test_f1: 0.5173
 epoch: 61, train_loss: 0.8957, test_loss: 0.9464, test_f1: 0.5140
 epoch: 62, train_loss: 0.8883, test_loss: 0.9484, test_f1: 0.5116
 epoch: 63, train_loss: 0.8983, test_loss: 0.9427, test_f1: 0.5161
 epoch: 64, train_loss: 0.8932, test_loss: 0.9369, test_f1: 0.5205
 epoch: 65, train_loss: 0.8846, test_loss: 0.9479, test_f1: 0.5218
 epoch: 66, train_loss: 0.8779, test_loss: 0.9641, test_f1: 0.5269
 epoch: 67, train_loss: 0.8746, test_loss: 0.9498, test_f1: 0.5128
 epoch: 68, train_loss: 0.8662, test_loss: 0.9536, test_f1: 0.5162
 epoch: 69, train_loss: 0.8881, test_loss: 0.9467, test_f1: 0.5321
 epoch: 70, train_loss: 0.8740, test_loss: 0.9486, test_f1: 0.5180
 epoch: 71, train_loss: 0.8719, test_loss: 0.9564, test_f1: 0.5295
 epoch: 72, train_loss: 0.8744, test_loss: 0.9477, test_f1: 0.5286
 epoch: 73, train_loss: 0.8639, test_loss: 0.9546, test_f1: 0.5259
 epoch: 74, train_loss: 0.8710, test_loss: 0.9507, test_f1: 0.5316
 epoch: 75, train_loss: 0.8681, test_loss: 0.9618, test_f1: 0.5218
 epoch: 76, train_loss: 0.8642, test_loss: 0.9597, test_f1: 0.5262
 epoch: 77, train_loss: 0.8734, test_loss: 0.9572, test_f1: 0.5251
 epoch: 78, train_loss: 0.8668, test_loss: 0.9554, test_f1: 0.5219
 epoch: 79, train_loss: 0.8498, test_loss: 0.9560, test_f1: 0.5294
 epoch: 80, train_loss: 0.8490, test_loss: 0.9443, test_f1: 0.5286
 epoch: 81, train_loss: 0.8608, test_loss: 0.9475, test_f1: 0.5344
 epoch: 82, train_loss: 0.8572, test_loss: 0.9618, test_f1: 0.5122
 epoch: 83, train_loss: 0.8535, test_loss: 0.9555, test_f1: 0.5116
 epoch: 84, train_loss: 0.8538, test_loss: 0.9538, test_f1: 0.5226
 epoch: 85, train_loss: 0.8485, test_loss: 0.9576, test_f1: 0.5266
 epoch: 86, train_loss: 0.8662, test_loss: 0.9431, test_f1: 0.5203
 epoch: 87, train_loss: 0.8386, test_loss: 0.9633, test_f1: 0.5114
 epoch: 88, train_loss: 0.8492, test_loss: 0.9559, test_f1: 0.5095
 epoch: 89, train_loss: 0.8441, test_loss: 0.9444, test_f1: 0.5184
 epoch: 90, train_loss: 0.8484, test_loss: 0.9535, test_f1: 0.5396
 epoch: 91, train_loss: 0.8351, test_loss: 0.9708, test_f1: 0.5272
 epoch: 92, train_loss: 0.8420, test_loss: 0.9656, test_f1: 0.5177
 epoch: 93, train_loss: 0.8407, test_loss: 0.9640, test_f1: 0.5209
 epoch: 94, train_loss: 0.8508, test_loss: 0.9629, test_f1: 0.5182
 epoch: 95, train_loss: 0.8391, test_loss: 0.9724, test_f1: 0.5096
 epoch: 96, train_loss: 0.8306, test_loss: 0.9691, test_f1: 0.5201
 epoch: 97, train_loss: 0.8342, test_loss: 0.9528, test_f1: 0.5348
 epoch: 98, train_loss: 0.8389, test_loss: 0.9626, test_f1: 0.5230
 epoch: 99, train_loss: 0.8384, test_loss: 0.9590, test_f1: 0.5231
##################ITERATION #9 ****************************************
 epoch: 0, train_loss: 1.3263, test_loss: 1.2317, test_f1: 0.3122
 epoch: 1, train_loss: 1.2541, test_loss: 1.2195, test_f1: 0.4218
 epoch: 2, train_loss: 1.2305, test_loss: 1.2015, test_f1: 0.4489
 epoch: 3, train_loss: 1.2092, test_loss: 1.1599, test_f1: 0.4561
 epoch: 4, train_loss: 1.1819, test_loss: 1.1480, test_f1: 0.4699
 epoch: 5, train_loss: 1.1728, test_loss: 1.1455, test_f1: 0.4726
 epoch: 6, train_loss: 1.1693, test_loss: 1.2395, test_f1: 0.4470
 epoch: 7, train_loss: 1.1708, test_loss: 1.1160, test_f1: 0.4809
 epoch: 8, train_loss: 1.1368, test_loss: 1.1002, test_f1: 0.4777
 epoch: 9, train_loss: 1.1448, test_loss: 1.0918, test_f1: 0.4814
 epoch: 10, train_loss: 1.1294, test_loss: 1.1928, test_f1: 0.4572
 epoch: 11, train_loss: 1.1187, test_loss: 1.0582, test_f1: 0.4906
 epoch: 12, train_loss: 1.1068, test_loss: 1.0542, test_f1: 0.4901
 epoch: 13, train_loss: 1.0932, test_loss: 1.1306, test_f1: 0.4481
 epoch: 14, train_loss: 1.0890, test_loss: 1.0940, test_f1: 0.4523
 epoch: 15, train_loss: 1.0741, test_loss: 1.0497, test_f1: 0.4696
 epoch: 16, train_loss: 1.0784, test_loss: 1.1702, test_f1: 0.4296
 epoch: 17, train_loss: 1.0704, test_loss: 1.1281, test_f1: 0.4475
 epoch: 18, train_loss: 1.0629, test_loss: 1.2329, test_f1: 0.4365
 epoch: 19, train_loss: 1.0481, test_loss: 1.0076, test_f1: 0.4800
 epoch: 20, train_loss: 1.0564, test_loss: 1.0001, test_f1: 0.4797
 epoch: 21, train_loss: 1.0484, test_loss: 0.9955, test_f1: 0.4679
 epoch: 22, train_loss: 1.0395, test_loss: 0.9911, test_f1: 0.4772
 epoch: 23, train_loss: 1.0317, test_loss: 1.0073, test_f1: 0.4874
 epoch: 24, train_loss: 1.0318, test_loss: 0.9871, test_f1: 0.4901
 epoch: 25, train_loss: 1.0271, test_loss: 0.9806, test_f1: 0.4796
 epoch: 26, train_loss: 1.0206, test_loss: 0.9704, test_f1: 0.4856
 epoch: 27, train_loss: 1.0081, test_loss: 0.9908, test_f1: 0.4966
 epoch: 28, train_loss: 0.9909, test_loss: 0.9689, test_f1: 0.4782
 epoch: 29, train_loss: 0.9968, test_loss: 0.9595, test_f1: 0.5046
 epoch: 30, train_loss: 0.9865, test_loss: 0.9737, test_f1: 0.4883
 epoch: 31, train_loss: 0.9791, test_loss: 0.9461, test_f1: 0.5051
 epoch: 32, train_loss: 0.9877, test_loss: 0.9491, test_f1: 0.4867
 epoch: 33, train_loss: 0.9692, test_loss: 0.9625, test_f1: 0.4643
 epoch: 34, train_loss: 0.9774, test_loss: 0.9394, test_f1: 0.5087
 epoch: 35, train_loss: 0.9586, test_loss: 0.9533, test_f1: 0.4748
 epoch: 36, train_loss: 0.9730, test_loss: 0.9376, test_f1: 0.5131
 epoch: 37, train_loss: 0.9551, test_loss: 0.9623, test_f1: 0.5000
 epoch: 38, train_loss: 0.9551, test_loss: 0.9558, test_f1: 0.5042
 epoch: 39, train_loss: 0.9408, test_loss: 0.9542, test_f1: 0.5043
 epoch: 40, train_loss: 0.9520, test_loss: 0.9475, test_f1: 0.5018
 epoch: 41, train_loss: 0.9542, test_loss: 0.9400, test_f1: 0.5106
 epoch: 42, train_loss: 0.9274, test_loss: 0.9523, test_f1: 0.5002
 epoch: 43, train_loss: 0.9316, test_loss: 0.9352, test_f1: 0.5122
 epoch: 44, train_loss: 0.9236, test_loss: 0.9550, test_f1: 0.4855
 epoch: 45, train_loss: 0.9259, test_loss: 0.9366, test_f1: 0.5120
 epoch: 46, train_loss: 0.9167, test_loss: 0.9627, test_f1: 0.5136
 epoch: 47, train_loss: 0.9242, test_loss: 0.9581, test_f1: 0.5092
 epoch: 48, train_loss: 0.9110, test_loss: 0.9475, test_f1: 0.5219
 epoch: 49, train_loss: 0.9163, test_loss: 0.9573, test_f1: 0.5204
 epoch: 50, train_loss: 0.9033, test_loss: 0.9565, test_f1: 0.5030
 epoch: 51, train_loss: 0.9020, test_loss: 0.9666, test_f1: 0.5230
 epoch: 52, train_loss: 0.9014, test_loss: 0.9599, test_f1: 0.5169
 epoch: 53, train_loss: 0.8994, test_loss: 0.9897, test_f1: 0.5196
 epoch: 54, train_loss: 0.8984, test_loss: 0.9749, test_f1: 0.5122
 epoch: 55, train_loss: 0.8902, test_loss: 0.9693, test_f1: 0.5063
 epoch: 56, train_loss: 0.8968, test_loss: 0.9615, test_f1: 0.5206
 epoch: 57, train_loss: 0.8898, test_loss: 0.9741, test_f1: 0.5145
 epoch: 58, train_loss: 0.8842, test_loss: 0.9737, test_f1: 0.5099
 epoch: 59, train_loss: 0.8829, test_loss: 0.9844, test_f1: 0.5128
 epoch: 60, train_loss: 0.8754, test_loss: 0.9848, test_f1: 0.5143
 epoch: 61, train_loss: 0.8913, test_loss: 0.9794, test_f1: 0.5086
 epoch: 62, train_loss: 0.8874, test_loss: 0.9688, test_f1: 0.5143
 epoch: 63, train_loss: 0.8777, test_loss: 0.9706, test_f1: 0.5364
 epoch: 64, train_loss: 0.8736, test_loss: 0.9916, test_f1: 0.4851
 epoch: 65, train_loss: 0.8691, test_loss: 0.9775, test_f1: 0.5086
 epoch: 66, train_loss: 0.8687, test_loss: 0.9723, test_f1: 0.5287
 epoch: 67, train_loss: 0.8611, test_loss: 0.9825, test_f1: 0.5129
 epoch: 68, train_loss: 0.8682, test_loss: 0.9953, test_f1: 0.4981
 epoch: 69, train_loss: 0.8657, test_loss: 1.0090, test_f1: 0.5224
 epoch: 70, train_loss: 0.8640, test_loss: 0.9884, test_f1: 0.5063
 epoch: 71, train_loss: 0.8572, test_loss: 0.9826, test_f1: 0.5253
 epoch: 72, train_loss: 0.8648, test_loss: 1.0246, test_f1: 0.5269
 epoch: 73, train_loss: 0.8582, test_loss: 1.0078, test_f1: 0.5235
 epoch: 74, train_loss: 0.8556, test_loss: 1.0328, test_f1: 0.5234
 epoch: 75, train_loss: 0.8560, test_loss: 1.0313, test_f1: 0.5289
 epoch: 76, train_loss: 0.8682, test_loss: 1.0230, test_f1: 0.5232
 epoch: 77, train_loss: 0.8522, test_loss: 1.0080, test_f1: 0.5180
 epoch: 78, train_loss: 0.8481, test_loss: 1.0071, test_f1: 0.5205
 epoch: 79, train_loss: 0.8450, test_loss: 0.9997, test_f1: 0.5089
 epoch: 80, train_loss: 0.8548, test_loss: 1.0063, test_f1: 0.5045
 epoch: 81, train_loss: 0.8604, test_loss: 0.9881, test_f1: 0.4909
 epoch: 82, train_loss: 0.8409, test_loss: 0.9729, test_f1: 0.5183
 epoch: 83, train_loss: 0.8498, test_loss: 0.9867, test_f1: 0.5119
 epoch: 84, train_loss: 0.8469, test_loss: 0.9877, test_f1: 0.5147
 epoch: 85, train_loss: 0.8326, test_loss: 1.0284, test_f1: 0.4976
 epoch: 86, train_loss: 0.8496, test_loss: 1.0628, test_f1: 0.5314
 epoch: 87, train_loss: 0.8321, test_loss: 1.0544, test_f1: 0.5241
 epoch: 88, train_loss: 0.8378, test_loss: 1.0545, test_f1: 0.5198
 epoch: 89, train_loss: 0.8269, test_loss: 1.0391, test_f1: 0.5116
 epoch: 90, train_loss: 0.8340, test_loss: 1.0229, test_f1: 0.5159
 epoch: 91, train_loss: 0.8245, test_loss: 1.0506, test_f1: 0.4949
 epoch: 92, train_loss: 0.8316, test_loss: 1.0326, test_f1: 0.5109
 epoch: 93, train_loss: 0.8265, test_loss: 1.0290, test_f1: 0.4963
 epoch: 94, train_loss: 0.8247, test_loss: 1.0173, test_f1: 0.5178
 epoch: 95, train_loss: 0.8281, test_loss: 1.0291, test_f1: 0.5161
 epoch: 96, train_loss: 0.8293, test_loss: 1.0220, test_f1: 0.5019
 epoch: 97, train_loss: 0.8150, test_loss: 1.0248, test_f1: 0.5155
 epoch: 98, train_loss: 0.8207, test_loss: 1.0236, test_f1: 0.5059
 epoch: 99, train_loss: 0.8060, test_loss: 1.0600, test_f1: 0.5084

Training completed in 673.06 seconds
Best F1: 0.5396 at epoch 90
Mean F1 across iterations: 0.5221  0.0138
========================FINAL RESULTS================================
FEGIN weighted F1: 0.5396  0.0138
python main.py --data ltspice_examples --representation component_component --model FEGIN --layers 4 --hiddens 64 --batch_size 64 --lr 0.0001 --emb_size 250 --epochs 100 --save_appendix component_component_L4_H64_BS64_LR0.0001_E250 --no_val
-----



STDERR:
  File "main.py", line 370, in <module>
    main()
  File "main.py", line 254, in main
    dataset = dataset_class(
  File "/home/philip/projects/ltspice_examples_code_repo/Circuit-Completion-Using-GNNs/component_classification_with_link_prediction_head/evaluation/FEGIN/kernel/circuit_datasets.py", line 15, in __init__
    self.data, self.slices = torch.load(self.processed_paths[0])
  File "/home/philip/.local/lib/python3.8/site-packages/torch/serialization.py", line 1040, in load
    warnings.warn(
  File "/usr/lib/python3.8/warnings.py", line 109, in _showwarnmsg
    sw(msg.message, msg.category, msg.filename, msg.lineno,
  File "main.py", line 47, in warn_with_traceback
    traceback.print_stack(file=log)
/home/philip/projects/ltspice_examples_code_repo/Circuit-Completion-Using-GNNs/component_classification_with_link_prediction_head/evaluation/FEGIN/kernel/circuit_datasets.py:15: FutureWarning: You are using `torch.load` with `weights_only=False` (the current default value), which uses the default pickle module implicitly. It is possible to construct malicious pickle data which will execute arbitrary code during unpickling (See https://github.com/pytorch/pytorch/blob/main/SECURITY.md#untrusted-models for more details). In a future release, the default value for `weights_only` will be flipped to `True`. This limits the functions that could be executed during unpickling. Arbitrary objects will no longer be allowed to be loaded via this mode unless they are explicitly allowlisted by the user via `torch.serialization.add_safe_globals`. We recommend you start setting `weights_only=True` for any use case where you don't have full control of the loaded file. Please open an issue on GitHub for any issues related to this experimental feature.
  self.data, self.slices = torch.load(self.processed_paths[0])
