STDOUT:
Results will be saved in /home/philip/projects/llm_inference_code_repo/Circuit-Completion-Using-GNNs/component_classification_with_link_prediction_head/evaluation/FEGIN/results/model_FEGIN_dataset_ltspice_examples
Command line input: python main.py --data ltspice_examples --representation component_pin_net --model FEGIN --layers 2 --hiddens 64 --batch_size 256 --lr 0.0001 --emb_size 250 --epochs 100 --save_appendix component_pin_net_L2_H64_BS256_LR0.0001_E250 --no_val
 is saved.
-----
ltspice_examples - FEGIN
Using 2 layers, 64 hidden units, h = 2
Loading component_pin_net representation dataset
ENTERED
Training FEGIN on component_pin_net representation
Train: 3558, Test: 846
##################ITERATION #0 ****************************************
 epoch: 0, train_loss: 1.3954, test_loss: 1.3929, test_f1: 0.1004
 epoch: 1, train_loss: 1.3883, test_loss: 1.3881, test_f1: 0.1004
 epoch: 2, train_loss: 1.3829, test_loss: 1.3830, test_f1: 0.1004
 epoch: 3, train_loss: 1.3780, test_loss: 1.3777, test_f1: 0.1004
 epoch: 4, train_loss: 1.3715, test_loss: 1.3700, test_f1: 0.1162
 epoch: 5, train_loss: 1.3639, test_loss: 1.3599, test_f1: 0.1264
 epoch: 6, train_loss: 1.3547, test_loss: 1.3477, test_f1: 0.2499
 epoch: 7, train_loss: 1.3441, test_loss: 1.3344, test_f1: 0.3488
 epoch: 8, train_loss: 1.3323, test_loss: 1.3201, test_f1: 0.3380
 epoch: 9, train_loss: 1.3170, test_loss: 1.3045, test_f1: 0.2957
 epoch: 10, train_loss: 1.3031, test_loss: 1.2877, test_f1: 0.2528
 epoch: 11, train_loss: 1.2860, test_loss: 1.2713, test_f1: 0.2344
 epoch: 12, train_loss: 1.2704, test_loss: 1.2551, test_f1: 0.2317
 epoch: 13, train_loss: 1.2584, test_loss: 1.2404, test_f1: 0.2323
 epoch: 14, train_loss: 1.2439, test_loss: 1.2266, test_f1: 0.2329
 epoch: 15, train_loss: 1.2325, test_loss: 1.2140, test_f1: 0.2337
 epoch: 16, train_loss: 1.2214, test_loss: 1.2026, test_f1: 0.2377
 epoch: 17, train_loss: 1.2108, test_loss: 1.1909, test_f1: 0.2467
 epoch: 18, train_loss: 1.2033, test_loss: 1.1808, test_f1: 0.2807
 epoch: 19, train_loss: 1.1901, test_loss: 1.1697, test_f1: 0.3120
 epoch: 20, train_loss: 1.1828, test_loss: 1.1591, test_f1: 0.3460
 epoch: 21, train_loss: 1.1744, test_loss: 1.1495, test_f1: 0.3650
 epoch: 22, train_loss: 1.1631, test_loss: 1.1390, test_f1: 0.3855
 epoch: 23, train_loss: 1.1581, test_loss: 1.1294, test_f1: 0.4103
 epoch: 24, train_loss: 1.1467, test_loss: 1.1209, test_f1: 0.4168
 epoch: 25, train_loss: 1.1403, test_loss: 1.1110, test_f1: 0.4404
 epoch: 26, train_loss: 1.1295, test_loss: 1.1017, test_f1: 0.4461
 epoch: 27, train_loss: 1.1217, test_loss: 1.0922, test_f1: 0.4698
 epoch: 28, train_loss: 1.1084, test_loss: 1.0823, test_f1: 0.4813
 epoch: 29, train_loss: 1.1010, test_loss: 1.0726, test_f1: 0.4959
 epoch: 30, train_loss: 1.0936, test_loss: 1.0624, test_f1: 0.4980
 epoch: 31, train_loss: 1.0820, test_loss: 1.0533, test_f1: 0.5024
 epoch: 32, train_loss: 1.0763, test_loss: 1.0452, test_f1: 0.4875
 epoch: 33, train_loss: 1.0636, test_loss: 1.0366, test_f1: 0.4933
 epoch: 34, train_loss: 1.0585, test_loss: 1.0281, test_f1: 0.4940
 epoch: 35, train_loss: 1.0522, test_loss: 1.0218, test_f1: 0.4932
 epoch: 36, train_loss: 1.0403, test_loss: 1.0127, test_f1: 0.4968
 epoch: 37, train_loss: 1.0314, test_loss: 1.0073, test_f1: 0.4943
 epoch: 38, train_loss: 1.0292, test_loss: 1.0003, test_f1: 0.5084
 epoch: 39, train_loss: 1.0145, test_loss: 0.9948, test_f1: 0.5020
 epoch: 40, train_loss: 1.0124, test_loss: 0.9933, test_f1: 0.5032
 epoch: 41, train_loss: 1.0046, test_loss: 0.9874, test_f1: 0.5062
 epoch: 42, train_loss: 1.0076, test_loss: 0.9807, test_f1: 0.5256
 epoch: 43, train_loss: 0.9992, test_loss: 0.9816, test_f1: 0.5122
 epoch: 44, train_loss: 0.9898, test_loss: 0.9727, test_f1: 0.5108
 epoch: 45, train_loss: 0.9866, test_loss: 0.9692, test_f1: 0.5179
 epoch: 46, train_loss: 0.9803, test_loss: 0.9691, test_f1: 0.5162
 epoch: 47, train_loss: 0.9790, test_loss: 0.9628, test_f1: 0.5101
 epoch: 48, train_loss: 0.9735, test_loss: 0.9604, test_f1: 0.5009
 epoch: 49, train_loss: 0.9718, test_loss: 0.9617, test_f1: 0.5121
 epoch: 50, train_loss: 0.9684, test_loss: 0.9576, test_f1: 0.5234
 epoch: 51, train_loss: 0.9628, test_loss: 0.9582, test_f1: 0.5141
 epoch: 52, train_loss: 0.9627, test_loss: 0.9544, test_f1: 0.5105
 epoch: 53, train_loss: 0.9544, test_loss: 0.9530, test_f1: 0.5137
 epoch: 54, train_loss: 0.9601, test_loss: 0.9502, test_f1: 0.5147
 epoch: 55, train_loss: 0.9578, test_loss: 0.9516, test_f1: 0.5207
 epoch: 56, train_loss: 0.9529, test_loss: 0.9497, test_f1: 0.5115
 epoch: 57, train_loss: 0.9545, test_loss: 0.9449, test_f1: 0.5209
 epoch: 58, train_loss: 0.9507, test_loss: 0.9468, test_f1: 0.5160
 epoch: 59, train_loss: 0.9535, test_loss: 0.9448, test_f1: 0.5125
 epoch: 60, train_loss: 0.9470, test_loss: 0.9507, test_f1: 0.5150
 epoch: 61, train_loss: 0.9504, test_loss: 0.9406, test_f1: 0.5189
 epoch: 62, train_loss: 0.9484, test_loss: 0.9414, test_f1: 0.5135
 epoch: 63, train_loss: 0.9446, test_loss: 0.9428, test_f1: 0.5119
 epoch: 64, train_loss: 0.9421, test_loss: 0.9433, test_f1: 0.5165
 epoch: 65, train_loss: 0.9473, test_loss: 0.9421, test_f1: 0.5161
 epoch: 66, train_loss: 0.9414, test_loss: 0.9376, test_f1: 0.5167
 epoch: 67, train_loss: 0.9405, test_loss: 0.9358, test_f1: 0.5195
 epoch: 68, train_loss: 0.9395, test_loss: 0.9372, test_f1: 0.5185
 epoch: 69, train_loss: 0.9309, test_loss: 0.9362, test_f1: 0.5203
 epoch: 70, train_loss: 0.9376, test_loss: 0.9384, test_f1: 0.5187
 epoch: 71, train_loss: 0.9379, test_loss: 0.9303, test_f1: 0.5171
 epoch: 72, train_loss: 0.9362, test_loss: 0.9325, test_f1: 0.5199
 epoch: 73, train_loss: 0.9240, test_loss: 0.9369, test_f1: 0.5220
 epoch: 74, train_loss: 0.9258, test_loss: 0.9298, test_f1: 0.5258
 epoch: 75, train_loss: 0.9313, test_loss: 0.9265, test_f1: 0.5209
 epoch: 76, train_loss: 0.9241, test_loss: 0.9274, test_f1: 0.5259
 epoch: 77, train_loss: 0.9237, test_loss: 0.9281, test_f1: 0.5254
 epoch: 78, train_loss: 0.9260, test_loss: 0.9246, test_f1: 0.5231
 epoch: 79, train_loss: 0.9258, test_loss: 0.9258, test_f1: 0.5241
 epoch: 80, train_loss: 0.9258, test_loss: 0.9241, test_f1: 0.5297
 epoch: 81, train_loss: 0.9248, test_loss: 0.9266, test_f1: 0.5262
 epoch: 82, train_loss: 0.9229, test_loss: 0.9283, test_f1: 0.5316
 epoch: 83, train_loss: 0.9217, test_loss: 0.9220, test_f1: 0.5297
 epoch: 84, train_loss: 0.9198, test_loss: 0.9206, test_f1: 0.5318
 epoch: 85, train_loss: 0.9188, test_loss: 0.9225, test_f1: 0.5320
 epoch: 86, train_loss: 0.9176, test_loss: 0.9166, test_f1: 0.5228
 epoch: 87, train_loss: 0.9175, test_loss: 0.9195, test_f1: 0.5288
 epoch: 88, train_loss: 0.9135, test_loss: 0.9188, test_f1: 0.5339
 epoch: 89, train_loss: 0.9190, test_loss: 0.9161, test_f1: 0.5290
 epoch: 90, train_loss: 0.9148, test_loss: 0.9194, test_f1: 0.5269
 epoch: 91, train_loss: 0.9116, test_loss: 0.9111, test_f1: 0.5257
 epoch: 92, train_loss: 0.9093, test_loss: 0.9170, test_f1: 0.5310
 epoch: 93, train_loss: 0.9086, test_loss: 0.9227, test_f1: 0.5350
 epoch: 94, train_loss: 0.9022, test_loss: 0.9108, test_f1: 0.5292
 epoch: 95, train_loss: 0.8992, test_loss: 0.9119, test_f1: 0.5304
 epoch: 96, train_loss: 0.9036, test_loss: 0.9145, test_f1: 0.5266
 epoch: 97, train_loss: 0.9053, test_loss: 0.9096, test_f1: 0.5301
 epoch: 98, train_loss: 0.9006, test_loss: 0.9102, test_f1: 0.5334
 epoch: 99, train_loss: 0.8978, test_loss: 0.9071, test_f1: 0.5312
##################ITERATION #1 ****************************************
 epoch: 0, train_loss: 1.3669, test_loss: 1.3708, test_f1: 0.1004
 epoch: 1, train_loss: 1.3461, test_loss: 1.3562, test_f1: 0.2632
 epoch: 2, train_loss: 1.3330, test_loss: 1.3418, test_f1: 0.2273
 epoch: 3, train_loss: 1.3154, test_loss: 1.3237, test_f1: 0.2327
 epoch: 4, train_loss: 1.3013, test_loss: 1.2972, test_f1: 0.2319
 epoch: 5, train_loss: 1.2852, test_loss: 1.2712, test_f1: 0.2305
 epoch: 6, train_loss: 1.2669, test_loss: 1.2477, test_f1: 0.2747
 epoch: 7, train_loss: 1.2489, test_loss: 1.2269, test_f1: 0.3130
 epoch: 8, train_loss: 1.2321, test_loss: 1.2076, test_f1: 0.3275
 epoch: 9, train_loss: 1.2178, test_loss: 1.1896, test_f1: 0.3367
 epoch: 10, train_loss: 1.2016, test_loss: 1.1727, test_f1: 0.3372
 epoch: 11, train_loss: 1.1886, test_loss: 1.1570, test_f1: 0.3393
 epoch: 12, train_loss: 1.1729, test_loss: 1.1416, test_f1: 0.3422
 epoch: 13, train_loss: 1.1562, test_loss: 1.1266, test_f1: 0.3422
 epoch: 14, train_loss: 1.1445, test_loss: 1.1128, test_f1: 0.3422
 epoch: 15, train_loss: 1.1283, test_loss: 1.0997, test_f1: 0.3403
 epoch: 16, train_loss: 1.1174, test_loss: 1.0872, test_f1: 0.3420
 epoch: 17, train_loss: 1.1116, test_loss: 1.0776, test_f1: 0.3428
 epoch: 18, train_loss: 1.1023, test_loss: 1.0681, test_f1: 0.3430
 epoch: 19, train_loss: 1.0922, test_loss: 1.0601, test_f1: 0.3419
 epoch: 20, train_loss: 1.0816, test_loss: 1.0547, test_f1: 0.3571
 epoch: 21, train_loss: 1.0737, test_loss: 1.0487, test_f1: 0.3825
 epoch: 22, train_loss: 1.0676, test_loss: 1.0428, test_f1: 0.3912
 epoch: 23, train_loss: 1.0589, test_loss: 1.0393, test_f1: 0.4007
 epoch: 24, train_loss: 1.0527, test_loss: 1.0353, test_f1: 0.4160
 epoch: 25, train_loss: 1.0462, test_loss: 1.0316, test_f1: 0.4179
 epoch: 26, train_loss: 1.0353, test_loss: 1.0281, test_f1: 0.4251
 epoch: 27, train_loss: 1.0356, test_loss: 1.0235, test_f1: 0.4300
 epoch: 28, train_loss: 1.0379, test_loss: 1.0217, test_f1: 0.4414
 epoch: 29, train_loss: 1.0220, test_loss: 1.0187, test_f1: 0.4461
 epoch: 30, train_loss: 1.0225, test_loss: 1.0148, test_f1: 0.4519
 epoch: 31, train_loss: 1.0130, test_loss: 1.0120, test_f1: 0.4526
 epoch: 32, train_loss: 1.0098, test_loss: 1.0097, test_f1: 0.4650
 epoch: 33, train_loss: 1.0074, test_loss: 1.0052, test_f1: 0.4716
 epoch: 34, train_loss: 0.9978, test_loss: 1.0017, test_f1: 0.4703
 epoch: 35, train_loss: 0.9936, test_loss: 1.0026, test_f1: 0.4803
 epoch: 36, train_loss: 0.9961, test_loss: 0.9970, test_f1: 0.4775
 epoch: 37, train_loss: 0.9934, test_loss: 0.9957, test_f1: 0.4819
 epoch: 38, train_loss: 0.9829, test_loss: 0.9929, test_f1: 0.4917
 epoch: 39, train_loss: 0.9801, test_loss: 0.9866, test_f1: 0.4881
 epoch: 40, train_loss: 0.9766, test_loss: 0.9841, test_f1: 0.4932
 epoch: 41, train_loss: 0.9724, test_loss: 0.9823, test_f1: 0.4873
 epoch: 42, train_loss: 0.9694, test_loss: 0.9832, test_f1: 0.4951
 epoch: 43, train_loss: 0.9699, test_loss: 0.9750, test_f1: 0.4907
 epoch: 44, train_loss: 0.9645, test_loss: 0.9773, test_f1: 0.4875
 epoch: 45, train_loss: 0.9670, test_loss: 0.9736, test_f1: 0.5005
 epoch: 46, train_loss: 0.9642, test_loss: 0.9709, test_f1: 0.5031
 epoch: 47, train_loss: 0.9534, test_loss: 0.9681, test_f1: 0.5020
 epoch: 48, train_loss: 0.9530, test_loss: 0.9600, test_f1: 0.5041
 epoch: 49, train_loss: 0.9536, test_loss: 0.9667, test_f1: 0.5133
 epoch: 50, train_loss: 0.9501, test_loss: 0.9585, test_f1: 0.5064
 epoch: 51, train_loss: 0.9448, test_loss: 0.9586, test_f1: 0.5033
 epoch: 52, train_loss: 0.9424, test_loss: 0.9597, test_f1: 0.5126
 epoch: 53, train_loss: 0.9419, test_loss: 0.9566, test_f1: 0.5061
 epoch: 54, train_loss: 0.9446, test_loss: 0.9564, test_f1: 0.5119
 epoch: 55, train_loss: 0.9376, test_loss: 0.9551, test_f1: 0.5077
 epoch: 56, train_loss: 0.9370, test_loss: 0.9550, test_f1: 0.5140
 epoch: 57, train_loss: 0.9381, test_loss: 0.9533, test_f1: 0.5072
 epoch: 58, train_loss: 0.9395, test_loss: 0.9477, test_f1: 0.5115
 epoch: 59, train_loss: 0.9349, test_loss: 0.9507, test_f1: 0.5071
 epoch: 60, train_loss: 0.9369, test_loss: 0.9477, test_f1: 0.5110
 epoch: 61, train_loss: 0.9311, test_loss: 0.9475, test_f1: 0.5183
 epoch: 62, train_loss: 0.9327, test_loss: 0.9464, test_f1: 0.5148
 epoch: 63, train_loss: 0.9281, test_loss: 0.9461, test_f1: 0.5158
 epoch: 64, train_loss: 0.9322, test_loss: 0.9443, test_f1: 0.5193
 epoch: 65, train_loss: 0.9290, test_loss: 0.9455, test_f1: 0.5210
 epoch: 66, train_loss: 0.9293, test_loss: 0.9451, test_f1: 0.5189
 epoch: 67, train_loss: 0.9248, test_loss: 0.9435, test_f1: 0.5223
 epoch: 68, train_loss: 0.9222, test_loss: 0.9403, test_f1: 0.5295
 epoch: 69, train_loss: 0.9196, test_loss: 0.9418, test_f1: 0.5198
 epoch: 70, train_loss: 0.9182, test_loss: 0.9422, test_f1: 0.5201
 epoch: 71, train_loss: 0.9249, test_loss: 0.9418, test_f1: 0.5310
 epoch: 72, train_loss: 0.9180, test_loss: 0.9405, test_f1: 0.5253
 epoch: 73, train_loss: 0.9195, test_loss: 0.9374, test_f1: 0.5253
 epoch: 74, train_loss: 0.9183, test_loss: 0.9395, test_f1: 0.5244
 epoch: 75, train_loss: 0.9194, test_loss: 0.9365, test_f1: 0.5291
 epoch: 76, train_loss: 0.9174, test_loss: 0.9373, test_f1: 0.5249
 epoch: 77, train_loss: 0.9129, test_loss: 0.9353, test_f1: 0.5230
 epoch: 78, train_loss: 0.9098, test_loss: 0.9345, test_f1: 0.5325
 epoch: 79, train_loss: 0.9139, test_loss: 0.9310, test_f1: 0.5332
 epoch: 80, train_loss: 0.9160, test_loss: 0.9300, test_f1: 0.5284
 epoch: 81, train_loss: 0.9068, test_loss: 0.9335, test_f1: 0.5256
 epoch: 82, train_loss: 0.9081, test_loss: 0.9291, test_f1: 0.5347
 epoch: 83, train_loss: 0.9128, test_loss: 0.9292, test_f1: 0.5255
 epoch: 84, train_loss: 0.9086, test_loss: 0.9288, test_f1: 0.5319
 epoch: 85, train_loss: 0.9072, test_loss: 0.9314, test_f1: 0.5305
 epoch: 86, train_loss: 0.9044, test_loss: 0.9259, test_f1: 0.5406
 epoch: 87, train_loss: 0.9007, test_loss: 0.9279, test_f1: 0.5292
 epoch: 88, train_loss: 0.9012, test_loss: 0.9265, test_f1: 0.5321
 epoch: 89, train_loss: 0.9030, test_loss: 0.9247, test_f1: 0.5339
 epoch: 90, train_loss: 0.9080, test_loss: 0.9251, test_f1: 0.5316
 epoch: 91, train_loss: 0.9030, test_loss: 0.9237, test_f1: 0.5413
 epoch: 92, train_loss: 0.9026, test_loss: 0.9254, test_f1: 0.5332
 epoch: 93, train_loss: 0.8960, test_loss: 0.9222, test_f1: 0.5411
 epoch: 94, train_loss: 0.8949, test_loss: 0.9267, test_f1: 0.5332
 epoch: 95, train_loss: 0.8964, test_loss: 0.9239, test_f1: 0.5354
 epoch: 96, train_loss: 0.8918, test_loss: 0.9206, test_f1: 0.5329
 epoch: 97, train_loss: 0.8896, test_loss: 0.9193, test_f1: 0.5453
 epoch: 98, train_loss: 0.8932, test_loss: 0.9205, test_f1: 0.5384
 epoch: 99, train_loss: 0.8937, test_loss: 0.9201, test_f1: 0.5316
##################ITERATION #2 ****************************************
 epoch: 0, train_loss: 1.3375, test_loss: 1.3432, test_f1: 0.2270
 epoch: 1, train_loss: 1.3069, test_loss: 1.3256, test_f1: 0.2270
 epoch: 2, train_loss: 1.2914, test_loss: 1.3047, test_f1: 0.2270
 epoch: 3, train_loss: 1.2740, test_loss: 1.2801, test_f1: 0.2270
 epoch: 4, train_loss: 1.2579, test_loss: 1.2507, test_f1: 0.2270
 epoch: 5, train_loss: 1.2407, test_loss: 1.2216, test_f1: 0.2853
 epoch: 6, train_loss: 1.2208, test_loss: 1.1950, test_f1: 0.3284
 epoch: 7, train_loss: 1.2015, test_loss: 1.1705, test_f1: 0.3516
 epoch: 8, train_loss: 1.1839, test_loss: 1.1484, test_f1: 0.3403
 epoch: 9, train_loss: 1.1594, test_loss: 1.1267, test_f1: 0.3422
 epoch: 10, train_loss: 1.1415, test_loss: 1.1085, test_f1: 0.3464
 epoch: 11, train_loss: 1.1249, test_loss: 1.0913, test_f1: 0.3580
 epoch: 12, train_loss: 1.1088, test_loss: 1.0768, test_f1: 0.3742
 epoch: 13, train_loss: 1.1022, test_loss: 1.0650, test_f1: 0.3790
 epoch: 14, train_loss: 1.0837, test_loss: 1.0553, test_f1: 0.3834
 epoch: 15, train_loss: 1.0744, test_loss: 1.0463, test_f1: 0.3926
 epoch: 16, train_loss: 1.0661, test_loss: 1.0385, test_f1: 0.3981
 epoch: 17, train_loss: 1.0573, test_loss: 1.0311, test_f1: 0.4003
 epoch: 18, train_loss: 1.0477, test_loss: 1.0273, test_f1: 0.4065
 epoch: 19, train_loss: 1.0417, test_loss: 1.0218, test_f1: 0.4106
 epoch: 20, train_loss: 1.0315, test_loss: 1.0158, test_f1: 0.4131
 epoch: 21, train_loss: 1.0355, test_loss: 1.0090, test_f1: 0.4230
 epoch: 22, train_loss: 1.0201, test_loss: 1.0043, test_f1: 0.4294
 epoch: 23, train_loss: 1.0162, test_loss: 1.0005, test_f1: 0.4323
 epoch: 24, train_loss: 1.0104, test_loss: 0.9954, test_f1: 0.4367
 epoch: 25, train_loss: 1.0059, test_loss: 0.9892, test_f1: 0.4492
 epoch: 26, train_loss: 0.9998, test_loss: 0.9860, test_f1: 0.4499
 epoch: 27, train_loss: 0.9929, test_loss: 0.9778, test_f1: 0.4610
 epoch: 28, train_loss: 0.9912, test_loss: 0.9736, test_f1: 0.4827
 epoch: 29, train_loss: 0.9905, test_loss: 0.9708, test_f1: 0.4842
 epoch: 30, train_loss: 0.9783, test_loss: 0.9698, test_f1: 0.4850
 epoch: 31, train_loss: 0.9803, test_loss: 0.9658, test_f1: 0.4862
 epoch: 32, train_loss: 0.9749, test_loss: 0.9640, test_f1: 0.4846
 epoch: 33, train_loss: 0.9759, test_loss: 0.9607, test_f1: 0.4915
 epoch: 34, train_loss: 0.9669, test_loss: 0.9537, test_f1: 0.4868
 epoch: 35, train_loss: 0.9618, test_loss: 0.9532, test_f1: 0.4945
 epoch: 36, train_loss: 0.9596, test_loss: 0.9508, test_f1: 0.4952
 epoch: 37, train_loss: 0.9577, test_loss: 0.9458, test_f1: 0.4895
 epoch: 38, train_loss: 0.9485, test_loss: 0.9420, test_f1: 0.4933
 epoch: 39, train_loss: 0.9496, test_loss: 0.9407, test_f1: 0.4978
 epoch: 40, train_loss: 0.9495, test_loss: 0.9322, test_f1: 0.4931
 epoch: 41, train_loss: 0.9477, test_loss: 0.9325, test_f1: 0.4941
 epoch: 42, train_loss: 0.9384, test_loss: 0.9317, test_f1: 0.4966
 epoch: 43, train_loss: 0.9335, test_loss: 0.9289, test_f1: 0.4956
 epoch: 44, train_loss: 0.9399, test_loss: 0.9235, test_f1: 0.5036
 epoch: 45, train_loss: 0.9343, test_loss: 0.9183, test_f1: 0.5050
 epoch: 46, train_loss: 0.9251, test_loss: 0.9175, test_f1: 0.5043
 epoch: 47, train_loss: 0.9225, test_loss: 0.9156, test_f1: 0.4995
 epoch: 48, train_loss: 0.9226, test_loss: 0.9134, test_f1: 0.5018
 epoch: 49, train_loss: 0.9137, test_loss: 0.9136, test_f1: 0.5066
 epoch: 50, train_loss: 0.9197, test_loss: 0.9127, test_f1: 0.5083
 epoch: 51, train_loss: 0.9157, test_loss: 0.9063, test_f1: 0.5029
 epoch: 52, train_loss: 0.9108, test_loss: 0.9078, test_f1: 0.5091
 epoch: 53, train_loss: 0.9121, test_loss: 0.9035, test_f1: 0.5048
 epoch: 54, train_loss: 0.9091, test_loss: 0.9047, test_f1: 0.5106
 epoch: 55, train_loss: 0.9048, test_loss: 0.9007, test_f1: 0.5058
 epoch: 56, train_loss: 0.9124, test_loss: 0.8990, test_f1: 0.5095
 epoch: 57, train_loss: 0.9070, test_loss: 0.8989, test_f1: 0.5081
 epoch: 58, train_loss: 0.9038, test_loss: 0.8988, test_f1: 0.5107
 epoch: 59, train_loss: 0.9007, test_loss: 0.8948, test_f1: 0.5117
 epoch: 60, train_loss: 0.8977, test_loss: 0.8935, test_f1: 0.5111
 epoch: 61, train_loss: 0.9034, test_loss: 0.8934, test_f1: 0.5215
 epoch: 62, train_loss: 0.8974, test_loss: 0.8929, test_f1: 0.5196
 epoch: 63, train_loss: 0.8960, test_loss: 0.8903, test_f1: 0.5174
 epoch: 64, train_loss: 0.8968, test_loss: 0.8921, test_f1: 0.5180
 epoch: 65, train_loss: 0.8932, test_loss: 0.8896, test_f1: 0.5198
 epoch: 66, train_loss: 0.8943, test_loss: 0.8870, test_f1: 0.5197
 epoch: 67, train_loss: 0.8901, test_loss: 0.8866, test_f1: 0.5179
 epoch: 68, train_loss: 0.8935, test_loss: 0.8867, test_f1: 0.5208
 epoch: 69, train_loss: 0.8873, test_loss: 0.8859, test_f1: 0.5267
 epoch: 70, train_loss: 0.8880, test_loss: 0.8860, test_f1: 0.5201
 epoch: 71, train_loss: 0.8883, test_loss: 0.8819, test_f1: 0.5229
 epoch: 72, train_loss: 0.8907, test_loss: 0.8835, test_f1: 0.5198
 epoch: 73, train_loss: 0.8858, test_loss: 0.8802, test_f1: 0.5254
 epoch: 74, train_loss: 0.8788, test_loss: 0.8808, test_f1: 0.5239
 epoch: 75, train_loss: 0.8789, test_loss: 0.8795, test_f1: 0.5286
 epoch: 76, train_loss: 0.8789, test_loss: 0.8791, test_f1: 0.5302
 epoch: 77, train_loss: 0.8752, test_loss: 0.8796, test_f1: 0.5373
 epoch: 78, train_loss: 0.8727, test_loss: 0.8785, test_f1: 0.5287
 epoch: 79, train_loss: 0.8721, test_loss: 0.8782, test_f1: 0.5293
 epoch: 80, train_loss: 0.8725, test_loss: 0.8761, test_f1: 0.5272
 epoch: 81, train_loss: 0.8702, test_loss: 0.8757, test_f1: 0.5304
 epoch: 82, train_loss: 0.8675, test_loss: 0.8748, test_f1: 0.5239
 epoch: 83, train_loss: 0.8728, test_loss: 0.8772, test_f1: 0.5274
 epoch: 84, train_loss: 0.8712, test_loss: 0.8752, test_f1: 0.5360
 epoch: 85, train_loss: 0.8713, test_loss: 0.8725, test_f1: 0.5460
 epoch: 86, train_loss: 0.8692, test_loss: 0.8720, test_f1: 0.5418
 epoch: 87, train_loss: 0.8657, test_loss: 0.8679, test_f1: 0.5413
 epoch: 88, train_loss: 0.8584, test_loss: 0.8703, test_f1: 0.5427
 epoch: 89, train_loss: 0.8619, test_loss: 0.8707, test_f1: 0.5310
 epoch: 90, train_loss: 0.8606, test_loss: 0.8703, test_f1: 0.5293
 epoch: 91, train_loss: 0.8603, test_loss: 0.8658, test_f1: 0.5348
 epoch: 92, train_loss: 0.8622, test_loss: 0.8675, test_f1: 0.5384
 epoch: 93, train_loss: 0.8515, test_loss: 0.8670, test_f1: 0.5440
 epoch: 94, train_loss: 0.8551, test_loss: 0.8679, test_f1: 0.5507
 epoch: 95, train_loss: 0.8461, test_loss: 0.8645, test_f1: 0.5459
 epoch: 96, train_loss: 0.8589, test_loss: 0.8639, test_f1: 0.5491
 epoch: 97, train_loss: 0.8552, test_loss: 0.8612, test_f1: 0.5373
 epoch: 98, train_loss: 0.8522, test_loss: 0.8621, test_f1: 0.5412
 epoch: 99, train_loss: 0.8562, test_loss: 0.8571, test_f1: 0.5455
##################ITERATION #3 ****************************************
 epoch: 0, train_loss: 1.3024, test_loss: 1.3300, test_f1: 0.2270
 epoch: 1, train_loss: 1.2772, test_loss: 1.3181, test_f1: 0.2270
 epoch: 2, train_loss: 1.2611, test_loss: 1.2959, test_f1: 0.2270
 epoch: 3, train_loss: 1.2451, test_loss: 1.2566, test_f1: 0.2270
 epoch: 4, train_loss: 1.2225, test_loss: 1.2161, test_f1: 0.2484
 epoch: 5, train_loss: 1.2085, test_loss: 1.1814, test_f1: 0.3121
 epoch: 6, train_loss: 1.1867, test_loss: 1.1514, test_f1: 0.3560
 epoch: 7, train_loss: 1.1651, test_loss: 1.1259, test_f1: 0.3746
 epoch: 8, train_loss: 1.1443, test_loss: 1.1039, test_f1: 0.3890
 epoch: 9, train_loss: 1.1247, test_loss: 1.0846, test_f1: 0.4008
 epoch: 10, train_loss: 1.1096, test_loss: 1.0681, test_f1: 0.4066
 epoch: 11, train_loss: 1.0981, test_loss: 1.0559, test_f1: 0.4159
 epoch: 12, train_loss: 1.0840, test_loss: 1.0461, test_f1: 0.4177
 epoch: 13, train_loss: 1.0683, test_loss: 1.0383, test_f1: 0.4168
 epoch: 14, train_loss: 1.0599, test_loss: 1.0325, test_f1: 0.4231
 epoch: 15, train_loss: 1.0558, test_loss: 1.0260, test_f1: 0.4255
 epoch: 16, train_loss: 1.0455, test_loss: 1.0223, test_f1: 0.4162
 epoch: 17, train_loss: 1.0389, test_loss: 1.0181, test_f1: 0.4315
 epoch: 18, train_loss: 1.0326, test_loss: 1.0153, test_f1: 0.4284
 epoch: 19, train_loss: 1.0316, test_loss: 1.0100, test_f1: 0.4298
 epoch: 20, train_loss: 1.0245, test_loss: 1.0050, test_f1: 0.4484
 epoch: 21, train_loss: 1.0215, test_loss: 1.0010, test_f1: 0.4546
 epoch: 22, train_loss: 1.0124, test_loss: 0.9973, test_f1: 0.4584
 epoch: 23, train_loss: 1.0106, test_loss: 0.9973, test_f1: 0.4651
 epoch: 24, train_loss: 1.0085, test_loss: 0.9899, test_f1: 0.4687
 epoch: 25, train_loss: 1.0049, test_loss: 0.9867, test_f1: 0.4733
 epoch: 26, train_loss: 1.0022, test_loss: 0.9874, test_f1: 0.4753
 epoch: 27, train_loss: 0.9953, test_loss: 0.9825, test_f1: 0.4746
 epoch: 28, train_loss: 0.9937, test_loss: 0.9788, test_f1: 0.4820
 epoch: 29, train_loss: 0.9843, test_loss: 0.9785, test_f1: 0.4756
 epoch: 30, train_loss: 0.9824, test_loss: 0.9695, test_f1: 0.4696
 epoch: 31, train_loss: 0.9805, test_loss: 0.9695, test_f1: 0.4974
 epoch: 32, train_loss: 0.9748, test_loss: 0.9643, test_f1: 0.4929
 epoch: 33, train_loss: 0.9737, test_loss: 0.9641, test_f1: 0.5027
 epoch: 34, train_loss: 0.9721, test_loss: 0.9588, test_f1: 0.5060
 epoch: 35, train_loss: 0.9640, test_loss: 0.9571, test_f1: 0.5159
 epoch: 36, train_loss: 0.9628, test_loss: 0.9515, test_f1: 0.5093
 epoch: 37, train_loss: 0.9590, test_loss: 0.9498, test_f1: 0.5154
 epoch: 38, train_loss: 0.9581, test_loss: 0.9440, test_f1: 0.5127
 epoch: 39, train_loss: 0.9552, test_loss: 0.9454, test_f1: 0.5253
 epoch: 40, train_loss: 0.9474, test_loss: 0.9464, test_f1: 0.5148
 epoch: 41, train_loss: 0.9398, test_loss: 0.9463, test_f1: 0.5090
 epoch: 42, train_loss: 0.9442, test_loss: 0.9414, test_f1: 0.5222
 epoch: 43, train_loss: 0.9420, test_loss: 0.9410, test_f1: 0.5180
 epoch: 44, train_loss: 0.9418, test_loss: 0.9374, test_f1: 0.5148
 epoch: 45, train_loss: 0.9385, test_loss: 0.9318, test_f1: 0.5267
 epoch: 46, train_loss: 0.9316, test_loss: 0.9312, test_f1: 0.5179
 epoch: 47, train_loss: 0.9270, test_loss: 0.9246, test_f1: 0.5280
 epoch: 48, train_loss: 0.9284, test_loss: 0.9228, test_f1: 0.5235
 epoch: 49, train_loss: 0.9294, test_loss: 0.9191, test_f1: 0.5294
 epoch: 50, train_loss: 0.9186, test_loss: 0.9199, test_f1: 0.5313
 epoch: 51, train_loss: 0.9137, test_loss: 0.9209, test_f1: 0.5249
 epoch: 52, train_loss: 0.9171, test_loss: 0.9205, test_f1: 0.5265
 epoch: 53, train_loss: 0.9175, test_loss: 0.9165, test_f1: 0.5249
 epoch: 54, train_loss: 0.9188, test_loss: 0.9167, test_f1: 0.5294
 epoch: 55, train_loss: 0.9166, test_loss: 0.9138, test_f1: 0.5268
 epoch: 56, train_loss: 0.9183, test_loss: 0.9145, test_f1: 0.5291
 epoch: 57, train_loss: 0.9131, test_loss: 0.9102, test_f1: 0.5310
 epoch: 58, train_loss: 0.9113, test_loss: 0.9115, test_f1: 0.5278
 epoch: 59, train_loss: 0.9105, test_loss: 0.9080, test_f1: 0.5347
 epoch: 60, train_loss: 0.9080, test_loss: 0.9088, test_f1: 0.5390
 epoch: 61, train_loss: 0.9082, test_loss: 0.9082, test_f1: 0.5375
 epoch: 62, train_loss: 0.9085, test_loss: 0.9015, test_f1: 0.5328
 epoch: 63, train_loss: 0.9078, test_loss: 0.9003, test_f1: 0.5399
 epoch: 64, train_loss: 0.8997, test_loss: 0.9007, test_f1: 0.5367
 epoch: 65, train_loss: 0.9035, test_loss: 0.8985, test_f1: 0.5380
 epoch: 66, train_loss: 0.9030, test_loss: 0.9007, test_f1: 0.5340
 epoch: 67, train_loss: 0.9038, test_loss: 0.8989, test_f1: 0.5350
 epoch: 68, train_loss: 0.8942, test_loss: 0.8972, test_f1: 0.5394
 epoch: 69, train_loss: 0.8973, test_loss: 0.8967, test_f1: 0.5394
 epoch: 70, train_loss: 0.8918, test_loss: 0.8964, test_f1: 0.5386
 epoch: 71, train_loss: 0.9012, test_loss: 0.8939, test_f1: 0.5367
 epoch: 72, train_loss: 0.8919, test_loss: 0.8929, test_f1: 0.5361
 epoch: 73, train_loss: 0.8986, test_loss: 0.8923, test_f1: 0.5409
 epoch: 74, train_loss: 0.8918, test_loss: 0.8911, test_f1: 0.5342
 epoch: 75, train_loss: 0.8898, test_loss: 0.8889, test_f1: 0.5418
 epoch: 76, train_loss: 0.8917, test_loss: 0.8937, test_f1: 0.5383
 epoch: 77, train_loss: 0.8846, test_loss: 0.8903, test_f1: 0.5338
 epoch: 78, train_loss: 0.8861, test_loss: 0.8885, test_f1: 0.5431
 epoch: 79, train_loss: 0.8792, test_loss: 0.8903, test_f1: 0.5383
 epoch: 80, train_loss: 0.8830, test_loss: 0.8878, test_f1: 0.5418
 epoch: 81, train_loss: 0.8812, test_loss: 0.8865, test_f1: 0.5379
 epoch: 82, train_loss: 0.8877, test_loss: 0.8838, test_f1: 0.5409
 epoch: 83, train_loss: 0.8805, test_loss: 0.8794, test_f1: 0.5398
 epoch: 84, train_loss: 0.8803, test_loss: 0.8788, test_f1: 0.5488
 epoch: 85, train_loss: 0.8766, test_loss: 0.8794, test_f1: 0.5442
 epoch: 86, train_loss: 0.8773, test_loss: 0.8808, test_f1: 0.5419
 epoch: 87, train_loss: 0.8752, test_loss: 0.8778, test_f1: 0.5442
 epoch: 88, train_loss: 0.8770, test_loss: 0.8770, test_f1: 0.5498
 epoch: 89, train_loss: 0.8708, test_loss: 0.8715, test_f1: 0.5434
 epoch: 90, train_loss: 0.8755, test_loss: 0.8761, test_f1: 0.5487
 epoch: 91, train_loss: 0.8724, test_loss: 0.8715, test_f1: 0.5462
 epoch: 92, train_loss: 0.8754, test_loss: 0.8760, test_f1: 0.5501
 epoch: 93, train_loss: 0.8677, test_loss: 0.8760, test_f1: 0.5520
 epoch: 94, train_loss: 0.8651, test_loss: 0.8706, test_f1: 0.5492
 epoch: 95, train_loss: 0.8685, test_loss: 0.8719, test_f1: 0.5529
 epoch: 96, train_loss: 0.8695, test_loss: 0.8719, test_f1: 0.5518
 epoch: 97, train_loss: 0.8732, test_loss: 0.8721, test_f1: 0.5538
 epoch: 98, train_loss: 0.8636, test_loss: 0.8729, test_f1: 0.5508
 epoch: 99, train_loss: 0.8661, test_loss: 0.8678, test_f1: 0.5525
##################ITERATION #4 ****************************************
 epoch: 0, train_loss: 1.2935, test_loss: 1.3273, test_f1: 0.2270
 epoch: 1, train_loss: 1.2476, test_loss: 1.3108, test_f1: 0.2270
 epoch: 2, train_loss: 1.2239, test_loss: 1.2909, test_f1: 0.2270
 epoch: 3, train_loss: 1.2042, test_loss: 1.2522, test_f1: 0.2270
 epoch: 4, train_loss: 1.1748, test_loss: 1.1856, test_f1: 0.3416
 epoch: 5, train_loss: 1.1543, test_loss: 1.1343, test_f1: 0.3541
 epoch: 6, train_loss: 1.1282, test_loss: 1.1016, test_f1: 0.3848
 epoch: 7, train_loss: 1.1099, test_loss: 1.0804, test_f1: 0.3961
 epoch: 8, train_loss: 1.0960, test_loss: 1.0656, test_f1: 0.4025
 epoch: 9, train_loss: 1.0805, test_loss: 1.0536, test_f1: 0.4181
 epoch: 10, train_loss: 1.0642, test_loss: 1.0455, test_f1: 0.4109
 epoch: 11, train_loss: 1.0558, test_loss: 1.0371, test_f1: 0.4193
 epoch: 12, train_loss: 1.0468, test_loss: 1.0315, test_f1: 0.4292
 epoch: 13, train_loss: 1.0396, test_loss: 1.0249, test_f1: 0.4348
 epoch: 14, train_loss: 1.0295, test_loss: 1.0196, test_f1: 0.4378
 epoch: 15, train_loss: 1.0216, test_loss: 1.0163, test_f1: 0.4385
 epoch: 16, train_loss: 1.0191, test_loss: 1.0126, test_f1: 0.4548
 epoch: 17, train_loss: 1.0110, test_loss: 1.0080, test_f1: 0.4570
 epoch: 18, train_loss: 1.0056, test_loss: 1.0007, test_f1: 0.4604
 epoch: 19, train_loss: 1.0064, test_loss: 0.9980, test_f1: 0.4589
 epoch: 20, train_loss: 1.0052, test_loss: 0.9957, test_f1: 0.4709
 epoch: 21, train_loss: 0.9946, test_loss: 0.9925, test_f1: 0.4697
 epoch: 22, train_loss: 0.9870, test_loss: 0.9881, test_f1: 0.4711
 epoch: 23, train_loss: 0.9865, test_loss: 0.9856, test_f1: 0.4807
 epoch: 24, train_loss: 0.9834, test_loss: 0.9812, test_f1: 0.4803
 epoch: 25, train_loss: 0.9775, test_loss: 0.9786, test_f1: 0.4802
 epoch: 26, train_loss: 0.9734, test_loss: 0.9747, test_f1: 0.4915
 epoch: 27, train_loss: 0.9732, test_loss: 0.9743, test_f1: 0.4880
 epoch: 28, train_loss: 0.9699, test_loss: 0.9701, test_f1: 0.4897
 epoch: 29, train_loss: 0.9705, test_loss: 0.9701, test_f1: 0.4927
 epoch: 30, train_loss: 0.9643, test_loss: 0.9658, test_f1: 0.4884
 epoch: 31, train_loss: 0.9572, test_loss: 0.9622, test_f1: 0.4885
 epoch: 32, train_loss: 0.9588, test_loss: 0.9580, test_f1: 0.4946
 epoch: 33, train_loss: 0.9532, test_loss: 0.9567, test_f1: 0.4946
 epoch: 34, train_loss: 0.9540, test_loss: 0.9499, test_f1: 0.4994
 epoch: 35, train_loss: 0.9522, test_loss: 0.9486, test_f1: 0.4970
 epoch: 36, train_loss: 0.9434, test_loss: 0.9440, test_f1: 0.5099
 epoch: 37, train_loss: 0.9435, test_loss: 0.9406, test_f1: 0.5123
 epoch: 38, train_loss: 0.9396, test_loss: 0.9333, test_f1: 0.5149
 epoch: 39, train_loss: 0.9391, test_loss: 0.9380, test_f1: 0.5137
 epoch: 40, train_loss: 0.9393, test_loss: 0.9375, test_f1: 0.5160
 epoch: 41, train_loss: 0.9291, test_loss: 0.9285, test_f1: 0.5154
 epoch: 42, train_loss: 0.9291, test_loss: 0.9240, test_f1: 0.5206
 epoch: 43, train_loss: 0.9279, test_loss: 0.9229, test_f1: 0.5201
 epoch: 44, train_loss: 0.9260, test_loss: 0.9187, test_f1: 0.5230
 epoch: 45, train_loss: 0.9195, test_loss: 0.9213, test_f1: 0.5204
 epoch: 46, train_loss: 0.9149, test_loss: 0.9148, test_f1: 0.5223
 epoch: 47, train_loss: 0.9196, test_loss: 0.9111, test_f1: 0.5294
 epoch: 48, train_loss: 0.9147, test_loss: 0.9119, test_f1: 0.5257
 epoch: 49, train_loss: 0.9091, test_loss: 0.9063, test_f1: 0.5254
 epoch: 50, train_loss: 0.9084, test_loss: 0.9014, test_f1: 0.5260
 epoch: 51, train_loss: 0.9055, test_loss: 0.9037, test_f1: 0.5304
 epoch: 52, train_loss: 0.9053, test_loss: 0.9042, test_f1: 0.5280
 epoch: 53, train_loss: 0.8960, test_loss: 0.8995, test_f1: 0.5302
 epoch: 54, train_loss: 0.9006, test_loss: 0.8988, test_f1: 0.5325
 epoch: 55, train_loss: 0.8998, test_loss: 0.8969, test_f1: 0.5321
 epoch: 56, train_loss: 0.8975, test_loss: 0.8969, test_f1: 0.5331
 epoch: 57, train_loss: 0.8923, test_loss: 0.8922, test_f1: 0.5307
 epoch: 58, train_loss: 0.8952, test_loss: 0.8910, test_f1: 0.5341
 epoch: 59, train_loss: 0.8962, test_loss: 0.8877, test_f1: 0.5374
 epoch: 60, train_loss: 0.8945, test_loss: 0.8897, test_f1: 0.5353
 epoch: 61, train_loss: 0.8789, test_loss: 0.8894, test_f1: 0.5412
 epoch: 62, train_loss: 0.8926, test_loss: 0.8863, test_f1: 0.5401
 epoch: 63, train_loss: 0.8804, test_loss: 0.8863, test_f1: 0.5376
 epoch: 64, train_loss: 0.8844, test_loss: 0.8836, test_f1: 0.5401
 epoch: 65, train_loss: 0.8828, test_loss: 0.8839, test_f1: 0.5411
 epoch: 66, train_loss: 0.8804, test_loss: 0.8801, test_f1: 0.5412
 epoch: 67, train_loss: 0.8862, test_loss: 0.8803, test_f1: 0.5447
 epoch: 68, train_loss: 0.8762, test_loss: 0.8837, test_f1: 0.5416
 epoch: 69, train_loss: 0.8842, test_loss: 0.8762, test_f1: 0.5470
 epoch: 70, train_loss: 0.8822, test_loss: 0.8745, test_f1: 0.5458
 epoch: 71, train_loss: 0.8716, test_loss: 0.8731, test_f1: 0.5441
 epoch: 72, train_loss: 0.8703, test_loss: 0.8724, test_f1: 0.5417
 epoch: 73, train_loss: 0.8748, test_loss: 0.8727, test_f1: 0.5430
 epoch: 74, train_loss: 0.8760, test_loss: 0.8666, test_f1: 0.5441
 epoch: 75, train_loss: 0.8707, test_loss: 0.8666, test_f1: 0.5452
 epoch: 76, train_loss: 0.8735, test_loss: 0.8661, test_f1: 0.5440
 epoch: 77, train_loss: 0.8705, test_loss: 0.8664, test_f1: 0.5472
 epoch: 78, train_loss: 0.8727, test_loss: 0.8669, test_f1: 0.5502
 epoch: 79, train_loss: 0.8582, test_loss: 0.8646, test_f1: 0.5513
 epoch: 80, train_loss: 0.8604, test_loss: 0.8665, test_f1: 0.5485
 epoch: 81, train_loss: 0.8599, test_loss: 0.8648, test_f1: 0.5462
 epoch: 82, train_loss: 0.8623, test_loss: 0.8634, test_f1: 0.5497
 epoch: 83, train_loss: 0.8584, test_loss: 0.8611, test_f1: 0.5532
 epoch: 84, train_loss: 0.8641, test_loss: 0.8606, test_f1: 0.5511
 epoch: 85, train_loss: 0.8604, test_loss: 0.8598, test_f1: 0.5442
 epoch: 86, train_loss: 0.8535, test_loss: 0.8594, test_f1: 0.5480
 epoch: 87, train_loss: 0.8598, test_loss: 0.8600, test_f1: 0.5503
 epoch: 88, train_loss: 0.8468, test_loss: 0.8624, test_f1: 0.5500
 epoch: 89, train_loss: 0.8510, test_loss: 0.8586, test_f1: 0.5472
 epoch: 90, train_loss: 0.8600, test_loss: 0.8582, test_f1: 0.5507
 epoch: 91, train_loss: 0.8511, test_loss: 0.8596, test_f1: 0.5479
 epoch: 92, train_loss: 0.8483, test_loss: 0.8549, test_f1: 0.5538
 epoch: 93, train_loss: 0.8501, test_loss: 0.8569, test_f1: 0.5462
 epoch: 94, train_loss: 0.8507, test_loss: 0.8545, test_f1: 0.5424
 epoch: 95, train_loss: 0.8430, test_loss: 0.8552, test_f1: 0.5468
 epoch: 96, train_loss: 0.8414, test_loss: 0.8555, test_f1: 0.5473
 epoch: 97, train_loss: 0.8414, test_loss: 0.8550, test_f1: 0.5445
 epoch: 98, train_loss: 0.8408, test_loss: 0.8527, test_f1: 0.5470
 epoch: 99, train_loss: 0.8430, test_loss: 0.8526, test_f1: 0.5450
##################ITERATION #5 ****************************************
 epoch: 0, train_loss: 1.2607, test_loss: 1.3100, test_f1: 0.2270
 epoch: 1, train_loss: 1.1945, test_loss: 1.3019, test_f1: 0.2270
 epoch: 2, train_loss: 1.1767, test_loss: 1.2663, test_f1: 0.2368
 epoch: 3, train_loss: 1.1543, test_loss: 1.2036, test_f1: 0.3457
 epoch: 4, train_loss: 1.1274, test_loss: 1.1423, test_f1: 0.3423
 epoch: 5, train_loss: 1.1112, test_loss: 1.0992, test_f1: 0.3476
 epoch: 6, train_loss: 1.0961, test_loss: 1.0724, test_f1: 0.3957
 epoch: 7, train_loss: 1.0831, test_loss: 1.0595, test_f1: 0.4070
 epoch: 8, train_loss: 1.0774, test_loss: 1.0503, test_f1: 0.4262
 epoch: 9, train_loss: 1.0650, test_loss: 1.0439, test_f1: 0.4291
 epoch: 10, train_loss: 1.0599, test_loss: 1.0380, test_f1: 0.4434
 epoch: 11, train_loss: 1.0466, test_loss: 1.0340, test_f1: 0.4407
 epoch: 12, train_loss: 1.0405, test_loss: 1.0304, test_f1: 0.4427
 epoch: 13, train_loss: 1.0335, test_loss: 1.0229, test_f1: 0.4523
 epoch: 14, train_loss: 1.0268, test_loss: 1.0214, test_f1: 0.4558
 epoch: 15, train_loss: 1.0253, test_loss: 1.0140, test_f1: 0.4717
 epoch: 16, train_loss: 1.0211, test_loss: 1.0102, test_f1: 0.4600
 epoch: 17, train_loss: 1.0078, test_loss: 1.0051, test_f1: 0.4799
 epoch: 18, train_loss: 1.0098, test_loss: 1.0015, test_f1: 0.4763
 epoch: 19, train_loss: 1.0046, test_loss: 0.9975, test_f1: 0.4802
 epoch: 20, train_loss: 0.9992, test_loss: 0.9905, test_f1: 0.4831
 epoch: 21, train_loss: 0.9918, test_loss: 0.9855, test_f1: 0.4839
 epoch: 22, train_loss: 0.9902, test_loss: 0.9805, test_f1: 0.4877
 epoch: 23, train_loss: 0.9805, test_loss: 0.9774, test_f1: 0.4890
 epoch: 24, train_loss: 0.9806, test_loss: 0.9778, test_f1: 0.5013
 epoch: 25, train_loss: 0.9784, test_loss: 0.9737, test_f1: 0.5015
 epoch: 26, train_loss: 0.9742, test_loss: 0.9744, test_f1: 0.5064
 epoch: 27, train_loss: 0.9675, test_loss: 0.9684, test_f1: 0.5037
 epoch: 28, train_loss: 0.9700, test_loss: 0.9609, test_f1: 0.4996
 epoch: 29, train_loss: 0.9638, test_loss: 0.9582, test_f1: 0.5040
 epoch: 30, train_loss: 0.9610, test_loss: 0.9592, test_f1: 0.5025
 epoch: 31, train_loss: 0.9590, test_loss: 0.9540, test_f1: 0.5021
 epoch: 32, train_loss: 0.9556, test_loss: 0.9501, test_f1: 0.5054
 epoch: 33, train_loss: 0.9486, test_loss: 0.9493, test_f1: 0.5083
 epoch: 34, train_loss: 0.9492, test_loss: 0.9473, test_f1: 0.5088
 epoch: 35, train_loss: 0.9457, test_loss: 0.9500, test_f1: 0.5174
 epoch: 36, train_loss: 0.9469, test_loss: 0.9504, test_f1: 0.5130
 epoch: 37, train_loss: 0.9400, test_loss: 0.9431, test_f1: 0.5108
 epoch: 38, train_loss: 0.9355, test_loss: 0.9381, test_f1: 0.5238
 epoch: 39, train_loss: 0.9330, test_loss: 0.9451, test_f1: 0.5096
 epoch: 40, train_loss: 0.9319, test_loss: 0.9381, test_f1: 0.5135
 epoch: 41, train_loss: 0.9287, test_loss: 0.9352, test_f1: 0.5131
 epoch: 42, train_loss: 0.9272, test_loss: 0.9421, test_f1: 0.5124
 epoch: 43, train_loss: 0.9214, test_loss: 0.9364, test_f1: 0.5095
 epoch: 44, train_loss: 0.9209, test_loss: 0.9415, test_f1: 0.5099
 epoch: 45, train_loss: 0.9143, test_loss: 0.9349, test_f1: 0.5169
 epoch: 46, train_loss: 0.9125, test_loss: 0.9310, test_f1: 0.5170
 epoch: 47, train_loss: 0.9129, test_loss: 0.9336, test_f1: 0.5064
 epoch: 48, train_loss: 0.9086, test_loss: 0.9308, test_f1: 0.5170
 epoch: 49, train_loss: 0.9098, test_loss: 0.9272, test_f1: 0.5227
 epoch: 50, train_loss: 0.9015, test_loss: 0.9333, test_f1: 0.5201
 epoch: 51, train_loss: 0.8990, test_loss: 0.9262, test_f1: 0.5198
 epoch: 52, train_loss: 0.9016, test_loss: 0.9242, test_f1: 0.5194
 epoch: 53, train_loss: 0.9003, test_loss: 0.9227, test_f1: 0.5198
 epoch: 54, train_loss: 0.9037, test_loss: 0.9236, test_f1: 0.5249
 epoch: 55, train_loss: 0.9031, test_loss: 0.9247, test_f1: 0.5226
 epoch: 56, train_loss: 0.8968, test_loss: 0.9221, test_f1: 0.5267
 epoch: 57, train_loss: 0.8956, test_loss: 0.9200, test_f1: 0.5283
 epoch: 58, train_loss: 0.9001, test_loss: 0.9211, test_f1: 0.5222
 epoch: 59, train_loss: 0.8930, test_loss: 0.9212, test_f1: 0.5278
 epoch: 60, train_loss: 0.8910, test_loss: 0.9183, test_f1: 0.5215
 epoch: 61, train_loss: 0.8861, test_loss: 0.9160, test_f1: 0.5239
 epoch: 62, train_loss: 0.8850, test_loss: 0.9118, test_f1: 0.5251
 epoch: 63, train_loss: 0.8864, test_loss: 0.9125, test_f1: 0.5268
 epoch: 64, train_loss: 0.8886, test_loss: 0.9118, test_f1: 0.5295
 epoch: 65, train_loss: 0.8808, test_loss: 0.9100, test_f1: 0.5329
 epoch: 66, train_loss: 0.8832, test_loss: 0.9130, test_f1: 0.5312
 epoch: 67, train_loss: 0.8888, test_loss: 0.9108, test_f1: 0.5313
 epoch: 68, train_loss: 0.8809, test_loss: 0.9098, test_f1: 0.5316
 epoch: 69, train_loss: 0.8804, test_loss: 0.9086, test_f1: 0.5306
 epoch: 70, train_loss: 0.8828, test_loss: 0.9095, test_f1: 0.5303
 epoch: 71, train_loss: 0.8739, test_loss: 0.9074, test_f1: 0.5234
 epoch: 72, train_loss: 0.8693, test_loss: 0.9059, test_f1: 0.5333
 epoch: 73, train_loss: 0.8769, test_loss: 0.8962, test_f1: 0.5329
 epoch: 74, train_loss: 0.8655, test_loss: 0.9030, test_f1: 0.5293
 epoch: 75, train_loss: 0.8736, test_loss: 0.9066, test_f1: 0.5316
 epoch: 76, train_loss: 0.8677, test_loss: 0.9020, test_f1: 0.5307
 epoch: 77, train_loss: 0.8704, test_loss: 0.9057, test_f1: 0.5297
 epoch: 78, train_loss: 0.8690, test_loss: 0.9005, test_f1: 0.5334
 epoch: 79, train_loss: 0.8686, test_loss: 0.8999, test_f1: 0.5255
 epoch: 80, train_loss: 0.8662, test_loss: 0.8975, test_f1: 0.5321
 epoch: 81, train_loss: 0.8557, test_loss: 0.8969, test_f1: 0.5318
 epoch: 82, train_loss: 0.8695, test_loss: 0.9047, test_f1: 0.5340
 epoch: 83, train_loss: 0.8647, test_loss: 0.9027, test_f1: 0.5373
 epoch: 84, train_loss: 0.8593, test_loss: 0.8928, test_f1: 0.5314
 epoch: 85, train_loss: 0.8658, test_loss: 0.9032, test_f1: 0.5333
 epoch: 86, train_loss: 0.8592, test_loss: 0.8983, test_f1: 0.5373
 epoch: 87, train_loss: 0.8570, test_loss: 0.8938, test_f1: 0.5333
 epoch: 88, train_loss: 0.8546, test_loss: 0.8976, test_f1: 0.5316
 epoch: 89, train_loss: 0.8572, test_loss: 0.8957, test_f1: 0.5322
 epoch: 90, train_loss: 0.8599, test_loss: 0.8925, test_f1: 0.5356
 epoch: 91, train_loss: 0.8538, test_loss: 0.8972, test_f1: 0.5310
 epoch: 92, train_loss: 0.8535, test_loss: 0.9057, test_f1: 0.5405
 epoch: 93, train_loss: 0.8525, test_loss: 0.9014, test_f1: 0.5386
 epoch: 94, train_loss: 0.8454, test_loss: 0.8892, test_f1: 0.5367
 epoch: 95, train_loss: 0.8514, test_loss: 0.8956, test_f1: 0.5366
 epoch: 96, train_loss: 0.8433, test_loss: 0.8922, test_f1: 0.5342
 epoch: 97, train_loss: 0.8483, test_loss: 0.8878, test_f1: 0.5369
 epoch: 98, train_loss: 0.8450, test_loss: 0.8894, test_f1: 0.5381
 epoch: 99, train_loss: 0.8434, test_loss: 0.8946, test_f1: 0.5367
##################ITERATION #6 ****************************************
 epoch: 0, train_loss: 1.2653, test_loss: 1.3109, test_f1: 0.2270
 epoch: 1, train_loss: 1.2088, test_loss: 1.2923, test_f1: 0.2270
 epoch: 2, train_loss: 1.1795, test_loss: 1.2388, test_f1: 0.2671
 epoch: 3, train_loss: 1.1503, test_loss: 1.1627, test_f1: 0.3308
 epoch: 4, train_loss: 1.1300, test_loss: 1.1043, test_f1: 0.3864
 epoch: 5, train_loss: 1.1121, test_loss: 1.0675, test_f1: 0.4317
 epoch: 6, train_loss: 1.0924, test_loss: 1.0437, test_f1: 0.4590
 epoch: 7, train_loss: 1.0784, test_loss: 1.0306, test_f1: 0.4593
 epoch: 8, train_loss: 1.0663, test_loss: 1.0209, test_f1: 0.4648
 epoch: 9, train_loss: 1.0532, test_loss: 1.0128, test_f1: 0.4714
 epoch: 10, train_loss: 1.0372, test_loss: 1.0061, test_f1: 0.4730
 epoch: 11, train_loss: 1.0388, test_loss: 1.0013, test_f1: 0.4695
 epoch: 12, train_loss: 1.0291, test_loss: 0.9959, test_f1: 0.4698
 epoch: 13, train_loss: 1.0194, test_loss: 0.9903, test_f1: 0.4708
 epoch: 14, train_loss: 1.0132, test_loss: 0.9866, test_f1: 0.4687
 epoch: 15, train_loss: 1.0084, test_loss: 0.9813, test_f1: 0.4722
 epoch: 16, train_loss: 1.0005, test_loss: 0.9782, test_f1: 0.4699
 epoch: 17, train_loss: 0.9969, test_loss: 0.9746, test_f1: 0.4681
 epoch: 18, train_loss: 0.9895, test_loss: 0.9700, test_f1: 0.4743
 epoch: 19, train_loss: 0.9872, test_loss: 0.9682, test_f1: 0.4784
 epoch: 20, train_loss: 0.9836, test_loss: 0.9654, test_f1: 0.4841
 epoch: 21, train_loss: 0.9760, test_loss: 0.9612, test_f1: 0.4962
 epoch: 22, train_loss: 0.9771, test_loss: 0.9578, test_f1: 0.4965
 epoch: 23, train_loss: 0.9734, test_loss: 0.9528, test_f1: 0.4938
 epoch: 24, train_loss: 0.9745, test_loss: 0.9504, test_f1: 0.4927
 epoch: 25, train_loss: 0.9650, test_loss: 0.9470, test_f1: 0.4955
 epoch: 26, train_loss: 0.9573, test_loss: 0.9444, test_f1: 0.4904
 epoch: 27, train_loss: 0.9581, test_loss: 0.9390, test_f1: 0.4914
 epoch: 28, train_loss: 0.9582, test_loss: 0.9399, test_f1: 0.4945
 epoch: 29, train_loss: 0.9526, test_loss: 0.9358, test_f1: 0.4979
 epoch: 30, train_loss: 0.9437, test_loss: 0.9317, test_f1: 0.5005
 epoch: 31, train_loss: 0.9432, test_loss: 0.9306, test_f1: 0.4989
 epoch: 32, train_loss: 0.9499, test_loss: 0.9276, test_f1: 0.4960
 epoch: 33, train_loss: 0.9416, test_loss: 0.9291, test_f1: 0.4969
 epoch: 34, train_loss: 0.9374, test_loss: 0.9220, test_f1: 0.5002
 epoch: 35, train_loss: 0.9307, test_loss: 0.9254, test_f1: 0.5054
 epoch: 36, train_loss: 0.9291, test_loss: 0.9186, test_f1: 0.5171
 epoch: 37, train_loss: 0.9243, test_loss: 0.9157, test_f1: 0.5173
 epoch: 38, train_loss: 0.9158, test_loss: 0.9151, test_f1: 0.5094
 epoch: 39, train_loss: 0.9177, test_loss: 0.9113, test_f1: 0.5201
 epoch: 40, train_loss: 0.9160, test_loss: 0.9079, test_f1: 0.5310
 epoch: 41, train_loss: 0.9124, test_loss: 0.9059, test_f1: 0.5331
 epoch: 42, train_loss: 0.9145, test_loss: 0.9016, test_f1: 0.5276
 epoch: 43, train_loss: 0.9078, test_loss: 0.9027, test_f1: 0.5399
 epoch: 44, train_loss: 0.9096, test_loss: 0.8948, test_f1: 0.5314
 epoch: 45, train_loss: 0.9042, test_loss: 0.8980, test_f1: 0.5436
 epoch: 46, train_loss: 0.9024, test_loss: 0.8873, test_f1: 0.5410
 epoch: 47, train_loss: 0.8922, test_loss: 0.8889, test_f1: 0.5445
 epoch: 48, train_loss: 0.8959, test_loss: 0.8909, test_f1: 0.5382
 epoch: 49, train_loss: 0.8924, test_loss: 0.8877, test_f1: 0.5436
 epoch: 50, train_loss: 0.8876, test_loss: 0.8794, test_f1: 0.5409
 epoch: 51, train_loss: 0.8879, test_loss: 0.8793, test_f1: 0.5295
 epoch: 52, train_loss: 0.8869, test_loss: 0.8804, test_f1: 0.5443
 epoch: 53, train_loss: 0.8804, test_loss: 0.8775, test_f1: 0.5429
 epoch: 54, train_loss: 0.8880, test_loss: 0.8765, test_f1: 0.5358
 epoch: 55, train_loss: 0.8802, test_loss: 0.8723, test_f1: 0.5440
 epoch: 56, train_loss: 0.8780, test_loss: 0.8755, test_f1: 0.5433
 epoch: 57, train_loss: 0.8759, test_loss: 0.8746, test_f1: 0.5442
 epoch: 58, train_loss: 0.8784, test_loss: 0.8759, test_f1: 0.5345
 epoch: 59, train_loss: 0.8695, test_loss: 0.8746, test_f1: 0.5450
 epoch: 60, train_loss: 0.8726, test_loss: 0.8716, test_f1: 0.5361
 epoch: 61, train_loss: 0.8759, test_loss: 0.8677, test_f1: 0.5409
 epoch: 62, train_loss: 0.8737, test_loss: 0.8657, test_f1: 0.5464
 epoch: 63, train_loss: 0.8720, test_loss: 0.8664, test_f1: 0.5500
 epoch: 64, train_loss: 0.8692, test_loss: 0.8678, test_f1: 0.5406
 epoch: 65, train_loss: 0.8624, test_loss: 0.8649, test_f1: 0.5501
 epoch: 66, train_loss: 0.8672, test_loss: 0.8659, test_f1: 0.5415
 epoch: 67, train_loss: 0.8644, test_loss: 0.8664, test_f1: 0.5458
 epoch: 68, train_loss: 0.8625, test_loss: 0.8628, test_f1: 0.5396
 epoch: 69, train_loss: 0.8652, test_loss: 0.8641, test_f1: 0.5394
 epoch: 70, train_loss: 0.8533, test_loss: 0.8637, test_f1: 0.5371
 epoch: 71, train_loss: 0.8638, test_loss: 0.8604, test_f1: 0.5621
 epoch: 72, train_loss: 0.8592, test_loss: 0.8600, test_f1: 0.5434
 epoch: 73, train_loss: 0.8628, test_loss: 0.8586, test_f1: 0.5541
 epoch: 74, train_loss: 0.8575, test_loss: 0.8545, test_f1: 0.5526
 epoch: 75, train_loss: 0.8532, test_loss: 0.8524, test_f1: 0.5555
 epoch: 76, train_loss: 0.8549, test_loss: 0.8559, test_f1: 0.5585
 epoch: 77, train_loss: 0.8532, test_loss: 0.8524, test_f1: 0.5669
 epoch: 78, train_loss: 0.8506, test_loss: 0.8523, test_f1: 0.5646
 epoch: 79, train_loss: 0.8472, test_loss: 0.8519, test_f1: 0.5558
 epoch: 80, train_loss: 0.8515, test_loss: 0.8472, test_f1: 0.5631
 epoch: 81, train_loss: 0.8446, test_loss: 0.8490, test_f1: 0.5562
 epoch: 82, train_loss: 0.8405, test_loss: 0.8479, test_f1: 0.5497
 epoch: 83, train_loss: 0.8452, test_loss: 0.8478, test_f1: 0.5465
 epoch: 84, train_loss: 0.8453, test_loss: 0.8452, test_f1: 0.5641
 epoch: 85, train_loss: 0.8384, test_loss: 0.8438, test_f1: 0.5655
 epoch: 86, train_loss: 0.8374, test_loss: 0.8413, test_f1: 0.5575
 epoch: 87, train_loss: 0.8350, test_loss: 0.8424, test_f1: 0.5624
 epoch: 88, train_loss: 0.8360, test_loss: 0.8407, test_f1: 0.5635
 epoch: 89, train_loss: 0.8455, test_loss: 0.8382, test_f1: 0.5644
 epoch: 90, train_loss: 0.8386, test_loss: 0.8378, test_f1: 0.5634
 epoch: 91, train_loss: 0.8375, test_loss: 0.8382, test_f1: 0.5625
 epoch: 92, train_loss: 0.8318, test_loss: 0.8339, test_f1: 0.5645
 epoch: 93, train_loss: 0.8312, test_loss: 0.8338, test_f1: 0.5602
 epoch: 94, train_loss: 0.8295, test_loss: 0.8343, test_f1: 0.5641
 epoch: 95, train_loss: 0.8247, test_loss: 0.8346, test_f1: 0.5625
 epoch: 96, train_loss: 0.8248, test_loss: 0.8379, test_f1: 0.5602
 epoch: 97, train_loss: 0.8196, test_loss: 0.8340, test_f1: 0.5608
 epoch: 98, train_loss: 0.8268, test_loss: 0.8301, test_f1: 0.5630
 epoch: 99, train_loss: 0.8275, test_loss: 0.8326, test_f1: 0.5678
##################ITERATION #7 ****************************************
 epoch: 0, train_loss: 1.3026, test_loss: 1.3581, test_f1: 0.2270
 epoch: 1, train_loss: 1.2081, test_loss: 1.3367, test_f1: 0.2270
 epoch: 2, train_loss: 1.1670, test_loss: 1.2666, test_f1: 0.3275
 epoch: 3, train_loss: 1.1371, test_loss: 1.1766, test_f1: 0.3425
 epoch: 4, train_loss: 1.1173, test_loss: 1.1113, test_f1: 0.3584
 epoch: 5, train_loss: 1.0984, test_loss: 1.0710, test_f1: 0.3891
 epoch: 6, train_loss: 1.0840, test_loss: 1.0504, test_f1: 0.4121
 epoch: 7, train_loss: 1.0685, test_loss: 1.0400, test_f1: 0.4211
 epoch: 8, train_loss: 1.0663, test_loss: 1.0333, test_f1: 0.4282
 epoch: 9, train_loss: 1.0556, test_loss: 1.0289, test_f1: 0.4365
 epoch: 10, train_loss: 1.0384, test_loss: 1.0233, test_f1: 0.4561
 epoch: 11, train_loss: 1.0310, test_loss: 1.0191, test_f1: 0.4605
 epoch: 12, train_loss: 1.0265, test_loss: 1.0138, test_f1: 0.4600
 epoch: 13, train_loss: 1.0183, test_loss: 1.0121, test_f1: 0.4620
 epoch: 14, train_loss: 1.0123, test_loss: 1.0080, test_f1: 0.4613
 epoch: 15, train_loss: 1.0016, test_loss: 1.0015, test_f1: 0.4635
 epoch: 16, train_loss: 0.9990, test_loss: 0.9944, test_f1: 0.4727
 epoch: 17, train_loss: 0.9900, test_loss: 0.9879, test_f1: 0.4852
 epoch: 18, train_loss: 0.9835, test_loss: 0.9862, test_f1: 0.4870
 epoch: 19, train_loss: 0.9858, test_loss: 0.9814, test_f1: 0.4936
 epoch: 20, train_loss: 0.9763, test_loss: 0.9775, test_f1: 0.4925
 epoch: 21, train_loss: 0.9754, test_loss: 0.9746, test_f1: 0.5003
 epoch: 22, train_loss: 0.9707, test_loss: 0.9737, test_f1: 0.4978
 epoch: 23, train_loss: 0.9651, test_loss: 0.9678, test_f1: 0.5021
 epoch: 24, train_loss: 0.9589, test_loss: 0.9622, test_f1: 0.5066
 epoch: 25, train_loss: 0.9647, test_loss: 0.9633, test_f1: 0.5164
 epoch: 26, train_loss: 0.9570, test_loss: 0.9640, test_f1: 0.5077
 epoch: 27, train_loss: 0.9521, test_loss: 0.9548, test_f1: 0.5098
 epoch: 28, train_loss: 0.9494, test_loss: 0.9555, test_f1: 0.5131
 epoch: 29, train_loss: 0.9534, test_loss: 0.9512, test_f1: 0.5243
 epoch: 30, train_loss: 0.9446, test_loss: 0.9528, test_f1: 0.5253
 epoch: 31, train_loss: 0.9418, test_loss: 0.9468, test_f1: 0.5128
 epoch: 32, train_loss: 0.9376, test_loss: 0.9499, test_f1: 0.5142
 epoch: 33, train_loss: 0.9360, test_loss: 0.9484, test_f1: 0.5295
 epoch: 34, train_loss: 0.9306, test_loss: 0.9451, test_f1: 0.5250
 epoch: 35, train_loss: 0.9299, test_loss: 0.9473, test_f1: 0.5222
 epoch: 36, train_loss: 0.9284, test_loss: 0.9365, test_f1: 0.5201
 epoch: 37, train_loss: 0.9187, test_loss: 0.9467, test_f1: 0.5344
 epoch: 38, train_loss: 0.9280, test_loss: 0.9399, test_f1: 0.5279
 epoch: 39, train_loss: 0.9184, test_loss: 0.9276, test_f1: 0.5358
 epoch: 40, train_loss: 0.9123, test_loss: 0.9341, test_f1: 0.5178
 epoch: 41, train_loss: 0.9102, test_loss: 0.9348, test_f1: 0.5343
 epoch: 42, train_loss: 0.9111, test_loss: 0.9226, test_f1: 0.5275
 epoch: 43, train_loss: 0.9029, test_loss: 0.9242, test_f1: 0.5330
 epoch: 44, train_loss: 0.9008, test_loss: 0.9235, test_f1: 0.5308
 epoch: 45, train_loss: 0.9012, test_loss: 0.9270, test_f1: 0.5351
 epoch: 46, train_loss: 0.8994, test_loss: 0.9151, test_f1: 0.5253
 epoch: 47, train_loss: 0.8925, test_loss: 0.9119, test_f1: 0.5327
 epoch: 48, train_loss: 0.8934, test_loss: 0.9112, test_f1: 0.5369
 epoch: 49, train_loss: 0.8948, test_loss: 0.9071, test_f1: 0.5422
 epoch: 50, train_loss: 0.8882, test_loss: 0.9079, test_f1: 0.5356
 epoch: 51, train_loss: 0.8817, test_loss: 0.9082, test_f1: 0.5386
 epoch: 52, train_loss: 0.8794, test_loss: 0.9117, test_f1: 0.5438
 epoch: 53, train_loss: 0.8770, test_loss: 0.9062, test_f1: 0.5408
 epoch: 54, train_loss: 0.8788, test_loss: 0.9003, test_f1: 0.5418
 epoch: 55, train_loss: 0.8720, test_loss: 0.8950, test_f1: 0.5426
 epoch: 56, train_loss: 0.8742, test_loss: 0.9034, test_f1: 0.5419
 epoch: 57, train_loss: 0.8756, test_loss: 0.9037, test_f1: 0.5385
 epoch: 58, train_loss: 0.8736, test_loss: 0.8972, test_f1: 0.5395
 epoch: 59, train_loss: 0.8712, test_loss: 0.9023, test_f1: 0.5441
 epoch: 60, train_loss: 0.8720, test_loss: 0.9029, test_f1: 0.5416
 epoch: 61, train_loss: 0.8636, test_loss: 0.8988, test_f1: 0.5453
 epoch: 62, train_loss: 0.8759, test_loss: 0.8976, test_f1: 0.5427
 epoch: 63, train_loss: 0.8630, test_loss: 0.8970, test_f1: 0.5430
 epoch: 64, train_loss: 0.8627, test_loss: 0.8945, test_f1: 0.5408
 epoch: 65, train_loss: 0.8666, test_loss: 0.8863, test_f1: 0.5418
 epoch: 66, train_loss: 0.8563, test_loss: 0.8937, test_f1: 0.5448
 epoch: 67, train_loss: 0.8624, test_loss: 0.8928, test_f1: 0.5448
 epoch: 68, train_loss: 0.8603, test_loss: 0.8874, test_f1: 0.5481
 epoch: 69, train_loss: 0.8644, test_loss: 0.8949, test_f1: 0.5429
 epoch: 70, train_loss: 0.8564, test_loss: 0.8928, test_f1: 0.5477
 epoch: 71, train_loss: 0.8626, test_loss: 0.8915, test_f1: 0.5484
 epoch: 72, train_loss: 0.8550, test_loss: 0.8932, test_f1: 0.5500
 epoch: 73, train_loss: 0.8525, test_loss: 0.8888, test_f1: 0.5471
 epoch: 74, train_loss: 0.8540, test_loss: 0.8835, test_f1: 0.5492
 epoch: 75, train_loss: 0.8510, test_loss: 0.8841, test_f1: 0.5474
 epoch: 76, train_loss: 0.8495, test_loss: 0.8826, test_f1: 0.5534
 epoch: 77, train_loss: 0.8509, test_loss: 0.8844, test_f1: 0.5543
 epoch: 78, train_loss: 0.8440, test_loss: 0.8850, test_f1: 0.5532
 epoch: 79, train_loss: 0.8441, test_loss: 0.8873, test_f1: 0.5544
 epoch: 80, train_loss: 0.8473, test_loss: 0.8826, test_f1: 0.5542
 epoch: 81, train_loss: 0.8467, test_loss: 0.8817, test_f1: 0.5566
 epoch: 82, train_loss: 0.8419, test_loss: 0.8807, test_f1: 0.5492
 epoch: 83, train_loss: 0.8475, test_loss: 0.8825, test_f1: 0.5564
 epoch: 84, train_loss: 0.8417, test_loss: 0.8757, test_f1: 0.5556
 epoch: 85, train_loss: 0.8437, test_loss: 0.8823, test_f1: 0.5498
 epoch: 86, train_loss: 0.8436, test_loss: 0.8770, test_f1: 0.5565
 epoch: 87, train_loss: 0.8469, test_loss: 0.8782, test_f1: 0.5568
 epoch: 88, train_loss: 0.8453, test_loss: 0.8777, test_f1: 0.5587
 epoch: 89, train_loss: 0.8385, test_loss: 0.8821, test_f1: 0.5540
 epoch: 90, train_loss: 0.8325, test_loss: 0.8758, test_f1: 0.5545
 epoch: 91, train_loss: 0.8387, test_loss: 0.8827, test_f1: 0.5517
 epoch: 92, train_loss: 0.8371, test_loss: 0.8792, test_f1: 0.5610
 epoch: 93, train_loss: 0.8353, test_loss: 0.8717, test_f1: 0.5607
 epoch: 94, train_loss: 0.8370, test_loss: 0.8705, test_f1: 0.5619
 epoch: 95, train_loss: 0.8397, test_loss: 0.8738, test_f1: 0.5628
 epoch: 96, train_loss: 0.8294, test_loss: 0.8741, test_f1: 0.5561
 epoch: 97, train_loss: 0.8229, test_loss: 0.8746, test_f1: 0.5604
 epoch: 98, train_loss: 0.8222, test_loss: 0.8723, test_f1: 0.5651
 epoch: 99, train_loss: 0.8328, test_loss: 0.8718, test_f1: 0.5595
##################ITERATION #8 ****************************************
 epoch: 0, train_loss: 1.3430, test_loss: 1.3153, test_f1: 0.2270
 epoch: 1, train_loss: 1.2414, test_loss: 1.2910, test_f1: 0.2270
 epoch: 2, train_loss: 1.1804, test_loss: 1.2337, test_f1: 0.2461
 epoch: 3, train_loss: 1.1403, test_loss: 1.1521, test_f1: 0.3611
 epoch: 4, train_loss: 1.1128, test_loss: 1.0883, test_f1: 0.3823
 epoch: 5, train_loss: 1.0925, test_loss: 1.0529, test_f1: 0.4182
 epoch: 6, train_loss: 1.0805, test_loss: 1.0368, test_f1: 0.4468
 epoch: 7, train_loss: 1.0620, test_loss: 1.0265, test_f1: 0.4520
 epoch: 8, train_loss: 1.0590, test_loss: 1.0206, test_f1: 0.4519
 epoch: 9, train_loss: 1.0377, test_loss: 1.0132, test_f1: 0.4483
 epoch: 10, train_loss: 1.0408, test_loss: 1.0066, test_f1: 0.4785
 epoch: 11, train_loss: 1.0259, test_loss: 0.9992, test_f1: 0.4833
 epoch: 12, train_loss: 1.0128, test_loss: 0.9925, test_f1: 0.4550
 epoch: 13, train_loss: 1.0126, test_loss: 0.9853, test_f1: 0.4764
 epoch: 14, train_loss: 1.0072, test_loss: 0.9748, test_f1: 0.4912
 epoch: 15, train_loss: 1.0002, test_loss: 0.9706, test_f1: 0.5019
 epoch: 16, train_loss: 0.9901, test_loss: 0.9662, test_f1: 0.5004
 epoch: 17, train_loss: 0.9852, test_loss: 0.9620, test_f1: 0.5016
 epoch: 18, train_loss: 0.9831, test_loss: 0.9575, test_f1: 0.5077
 epoch: 19, train_loss: 0.9773, test_loss: 0.9547, test_f1: 0.5116
 epoch: 20, train_loss: 0.9712, test_loss: 0.9541, test_f1: 0.5111
 epoch: 21, train_loss: 0.9659, test_loss: 0.9521, test_f1: 0.5034
 epoch: 22, train_loss: 0.9615, test_loss: 0.9473, test_f1: 0.5056
 epoch: 23, train_loss: 0.9647, test_loss: 0.9455, test_f1: 0.5121
 epoch: 24, train_loss: 0.9523, test_loss: 0.9353, test_f1: 0.5169
 epoch: 25, train_loss: 0.9524, test_loss: 0.9363, test_f1: 0.5169
 epoch: 26, train_loss: 0.9486, test_loss: 0.9330, test_f1: 0.5189
 epoch: 27, train_loss: 0.9423, test_loss: 0.9327, test_f1: 0.5186
 epoch: 28, train_loss: 0.9389, test_loss: 0.9307, test_f1: 0.5192
 epoch: 29, train_loss: 0.9422, test_loss: 0.9299, test_f1: 0.5175
 epoch: 30, train_loss: 0.9315, test_loss: 0.9243, test_f1: 0.5232
 epoch: 31, train_loss: 0.9289, test_loss: 0.9230, test_f1: 0.5265
 epoch: 32, train_loss: 0.9296, test_loss: 0.9229, test_f1: 0.5138
 epoch: 33, train_loss: 0.9237, test_loss: 0.9206, test_f1: 0.5248
 epoch: 34, train_loss: 0.9220, test_loss: 0.9182, test_f1: 0.5348
 epoch: 35, train_loss: 0.9233, test_loss: 0.9160, test_f1: 0.5189
 epoch: 36, train_loss: 0.9186, test_loss: 0.9128, test_f1: 0.5358
 epoch: 37, train_loss: 0.9148, test_loss: 0.9126, test_f1: 0.5389
 epoch: 38, train_loss: 0.9046, test_loss: 0.9153, test_f1: 0.5318
 epoch: 39, train_loss: 0.9040, test_loss: 0.9105, test_f1: 0.5301
 epoch: 40, train_loss: 0.9035, test_loss: 0.9089, test_f1: 0.5328
 epoch: 41, train_loss: 0.8968, test_loss: 0.8970, test_f1: 0.5272
 epoch: 42, train_loss: 0.8979, test_loss: 0.8985, test_f1: 0.5372
 epoch: 43, train_loss: 0.8975, test_loss: 0.9018, test_f1: 0.5471
 epoch: 44, train_loss: 0.8959, test_loss: 0.9030, test_f1: 0.5500
 epoch: 45, train_loss: 0.8921, test_loss: 0.9042, test_f1: 0.5307
 epoch: 46, train_loss: 0.8816, test_loss: 0.8998, test_f1: 0.5449
 epoch: 47, train_loss: 0.8807, test_loss: 0.8872, test_f1: 0.5466
 epoch: 48, train_loss: 0.8790, test_loss: 0.8912, test_f1: 0.5548
 epoch: 49, train_loss: 0.8755, test_loss: 0.8950, test_f1: 0.5431
 epoch: 50, train_loss: 0.8726, test_loss: 0.8937, test_f1: 0.5521
 epoch: 51, train_loss: 0.8754, test_loss: 0.8909, test_f1: 0.5489
 epoch: 52, train_loss: 0.8669, test_loss: 0.8891, test_f1: 0.5508
 epoch: 53, train_loss: 0.8753, test_loss: 0.8905, test_f1: 0.5600
 epoch: 54, train_loss: 0.8725, test_loss: 0.8878, test_f1: 0.5567
 epoch: 55, train_loss: 0.8628, test_loss: 0.8900, test_f1: 0.5567
 epoch: 56, train_loss: 0.8660, test_loss: 0.8846, test_f1: 0.5470
 epoch: 57, train_loss: 0.8635, test_loss: 0.8828, test_f1: 0.5598
 epoch: 58, train_loss: 0.8663, test_loss: 0.8847, test_f1: 0.5589
 epoch: 59, train_loss: 0.8658, test_loss: 0.8835, test_f1: 0.5555
 epoch: 60, train_loss: 0.8557, test_loss: 0.8853, test_f1: 0.5545
 epoch: 61, train_loss: 0.8623, test_loss: 0.8838, test_f1: 0.5494
 epoch: 62, train_loss: 0.8602, test_loss: 0.8854, test_f1: 0.5490
 epoch: 63, train_loss: 0.8601, test_loss: 0.8798, test_f1: 0.5566
 epoch: 64, train_loss: 0.8580, test_loss: 0.8796, test_f1: 0.5552
 epoch: 65, train_loss: 0.8509, test_loss: 0.8780, test_f1: 0.5562
 epoch: 66, train_loss: 0.8547, test_loss: 0.8791, test_f1: 0.5610
 epoch: 67, train_loss: 0.8522, test_loss: 0.8773, test_f1: 0.5489
 epoch: 68, train_loss: 0.8578, test_loss: 0.8755, test_f1: 0.5630
 epoch: 69, train_loss: 0.8491, test_loss: 0.8775, test_f1: 0.5609
 epoch: 70, train_loss: 0.8464, test_loss: 0.8775, test_f1: 0.5593
 epoch: 71, train_loss: 0.8482, test_loss: 0.8780, test_f1: 0.5639
 epoch: 72, train_loss: 0.8452, test_loss: 0.8759, test_f1: 0.5558
 epoch: 73, train_loss: 0.8471, test_loss: 0.8765, test_f1: 0.5477
 epoch: 74, train_loss: 0.8494, test_loss: 0.8723, test_f1: 0.5573
 epoch: 75, train_loss: 0.8417, test_loss: 0.8736, test_f1: 0.5615
 epoch: 76, train_loss: 0.8415, test_loss: 0.8721, test_f1: 0.5474
 epoch: 77, train_loss: 0.8444, test_loss: 0.8729, test_f1: 0.5628
 epoch: 78, train_loss: 0.8456, test_loss: 0.8762, test_f1: 0.5629
 epoch: 79, train_loss: 0.8365, test_loss: 0.8760, test_f1: 0.5535
 epoch: 80, train_loss: 0.8379, test_loss: 0.8699, test_f1: 0.5638
 epoch: 81, train_loss: 0.8326, test_loss: 0.8726, test_f1: 0.5639
 epoch: 82, train_loss: 0.8418, test_loss: 0.8731, test_f1: 0.5592
 epoch: 83, train_loss: 0.8422, test_loss: 0.8701, test_f1: 0.5614
 epoch: 84, train_loss: 0.8326, test_loss: 0.8713, test_f1: 0.5612
 epoch: 85, train_loss: 0.8355, test_loss: 0.8710, test_f1: 0.5502
 epoch: 86, train_loss: 0.8338, test_loss: 0.8728, test_f1: 0.5666
 epoch: 87, train_loss: 0.8338, test_loss: 0.8691, test_f1: 0.5563
 epoch: 88, train_loss: 0.8267, test_loss: 0.8651, test_f1: 0.5590
 epoch: 89, train_loss: 0.8253, test_loss: 0.8703, test_f1: 0.5577
 epoch: 90, train_loss: 0.8264, test_loss: 0.8671, test_f1: 0.5612
 epoch: 91, train_loss: 0.8304, test_loss: 0.8695, test_f1: 0.5560
 epoch: 92, train_loss: 0.8236, test_loss: 0.8625, test_f1: 0.5677
 epoch: 93, train_loss: 0.8252, test_loss: 0.8619, test_f1: 0.5608
 epoch: 94, train_loss: 0.8225, test_loss: 0.8608, test_f1: 0.5584
 epoch: 95, train_loss: 0.8219, test_loss: 0.8605, test_f1: 0.5590
 epoch: 96, train_loss: 0.8228, test_loss: 0.8648, test_f1: 0.5625
 epoch: 97, train_loss: 0.8222, test_loss: 0.8639, test_f1: 0.5612
 epoch: 98, train_loss: 0.8180, test_loss: 0.8659, test_f1: 0.5652
 epoch: 99, train_loss: 0.8175, test_loss: 0.8644, test_f1: 0.5651
##################ITERATION #9 ****************************************
 epoch: 0, train_loss: 1.2799, test_loss: 1.3188, test_f1: 0.2270
 epoch: 1, train_loss: 1.1964, test_loss: 1.3235, test_f1: 0.2270
 epoch: 2, train_loss: 1.1599, test_loss: 1.2703, test_f1: 0.2270
 epoch: 3, train_loss: 1.1324, test_loss: 1.1686, test_f1: 0.2701
 epoch: 4, train_loss: 1.1066, test_loss: 1.0946, test_f1: 0.4027
 epoch: 5, train_loss: 1.0949, test_loss: 1.0512, test_f1: 0.4453
 epoch: 6, train_loss: 1.0676, test_loss: 1.0275, test_f1: 0.4593
 epoch: 7, train_loss: 1.0510, test_loss: 1.0124, test_f1: 0.4677
 epoch: 8, train_loss: 1.0375, test_loss: 1.0020, test_f1: 0.4828
 epoch: 9, train_loss: 1.0360, test_loss: 0.9972, test_f1: 0.4934
 epoch: 10, train_loss: 1.0172, test_loss: 0.9888, test_f1: 0.4988
 epoch: 11, train_loss: 1.0095, test_loss: 0.9844, test_f1: 0.4990
 epoch: 12, train_loss: 1.0022, test_loss: 0.9823, test_f1: 0.5016
 epoch: 13, train_loss: 0.9979, test_loss: 0.9756, test_f1: 0.4977
 epoch: 14, train_loss: 0.9976, test_loss: 0.9736, test_f1: 0.5009
 epoch: 15, train_loss: 0.9823, test_loss: 0.9709, test_f1: 0.5070
 epoch: 16, train_loss: 0.9807, test_loss: 0.9655, test_f1: 0.5108
 epoch: 17, train_loss: 0.9773, test_loss: 0.9615, test_f1: 0.5104
 epoch: 18, train_loss: 0.9689, test_loss: 0.9592, test_f1: 0.5120
 epoch: 19, train_loss: 0.9683, test_loss: 0.9641, test_f1: 0.5105
 epoch: 20, train_loss: 0.9583, test_loss: 0.9587, test_f1: 0.5115
 epoch: 21, train_loss: 0.9534, test_loss: 0.9538, test_f1: 0.5122
 epoch: 22, train_loss: 0.9575, test_loss: 0.9505, test_f1: 0.5218
 epoch: 23, train_loss: 0.9495, test_loss: 0.9473, test_f1: 0.5202
 epoch: 24, train_loss: 0.9516, test_loss: 0.9439, test_f1: 0.5203
 epoch: 25, train_loss: 0.9372, test_loss: 0.9487, test_f1: 0.5076
 epoch: 26, train_loss: 0.9391, test_loss: 0.9456, test_f1: 0.5190
 epoch: 27, train_loss: 0.9453, test_loss: 0.9415, test_f1: 0.5191
 epoch: 28, train_loss: 0.9327, test_loss: 0.9366, test_f1: 0.5124
 epoch: 29, train_loss: 0.9354, test_loss: 0.9348, test_f1: 0.5255
 epoch: 30, train_loss: 0.9265, test_loss: 0.9361, test_f1: 0.5257
 epoch: 31, train_loss: 0.9274, test_loss: 0.9337, test_f1: 0.5177
 epoch: 32, train_loss: 0.9181, test_loss: 0.9363, test_f1: 0.5172
 epoch: 33, train_loss: 0.9194, test_loss: 0.9339, test_f1: 0.5113
 epoch: 34, train_loss: 0.9119, test_loss: 0.9256, test_f1: 0.5079
 epoch: 35, train_loss: 0.9151, test_loss: 0.9212, test_f1: 0.5181
 epoch: 36, train_loss: 0.9163, test_loss: 0.9221, test_f1: 0.5197
 epoch: 37, train_loss: 0.9109, test_loss: 0.9213, test_f1: 0.5157
 epoch: 38, train_loss: 0.8987, test_loss: 0.9222, test_f1: 0.5318
 epoch: 39, train_loss: 0.9006, test_loss: 0.9200, test_f1: 0.5195
 epoch: 40, train_loss: 0.8964, test_loss: 0.9142, test_f1: 0.5376
 epoch: 41, train_loss: 0.8998, test_loss: 0.9117, test_f1: 0.5264
 epoch: 42, train_loss: 0.8942, test_loss: 0.9125, test_f1: 0.5222
 epoch: 43, train_loss: 0.8873, test_loss: 0.9049, test_f1: 0.5240
 epoch: 44, train_loss: 0.8898, test_loss: 0.9037, test_f1: 0.5284
 epoch: 45, train_loss: 0.8892, test_loss: 0.8965, test_f1: 0.5282
 epoch: 46, train_loss: 0.8801, test_loss: 0.9040, test_f1: 0.5267
 epoch: 47, train_loss: 0.8767, test_loss: 0.8959, test_f1: 0.5286
 epoch: 48, train_loss: 0.8842, test_loss: 0.8967, test_f1: 0.5277
 epoch: 49, train_loss: 0.8764, test_loss: 0.8910, test_f1: 0.5333
 epoch: 50, train_loss: 0.8772, test_loss: 0.8927, test_f1: 0.5246
 epoch: 51, train_loss: 0.8709, test_loss: 0.8926, test_f1: 0.5273
 epoch: 52, train_loss: 0.8695, test_loss: 0.8888, test_f1: 0.5354
 epoch: 53, train_loss: 0.8728, test_loss: 0.8890, test_f1: 0.5414
 epoch: 54, train_loss: 0.8630, test_loss: 0.8924, test_f1: 0.5374
 epoch: 55, train_loss: 0.8653, test_loss: 0.8844, test_f1: 0.5294
 epoch: 56, train_loss: 0.8650, test_loss: 0.8872, test_f1: 0.5341
 epoch: 57, train_loss: 0.8601, test_loss: 0.8830, test_f1: 0.5353
 epoch: 58, train_loss: 0.8659, test_loss: 0.8885, test_f1: 0.5405
 epoch: 59, train_loss: 0.8633, test_loss: 0.8858, test_f1: 0.5360
 epoch: 60, train_loss: 0.8633, test_loss: 0.8813, test_f1: 0.5434
 epoch: 61, train_loss: 0.8587, test_loss: 0.8861, test_f1: 0.5358
 epoch: 62, train_loss: 0.8518, test_loss: 0.8751, test_f1: 0.5342
 epoch: 63, train_loss: 0.8583, test_loss: 0.8786, test_f1: 0.5241
 epoch: 64, train_loss: 0.8532, test_loss: 0.8807, test_f1: 0.5399
 epoch: 65, train_loss: 0.8536, test_loss: 0.8843, test_f1: 0.5280
 epoch: 66, train_loss: 0.8531, test_loss: 0.8775, test_f1: 0.5288
 epoch: 67, train_loss: 0.8507, test_loss: 0.8769, test_f1: 0.5350
 epoch: 68, train_loss: 0.8549, test_loss: 0.8775, test_f1: 0.5360
 epoch: 69, train_loss: 0.8595, test_loss: 0.8821, test_f1: 0.5402
 epoch: 70, train_loss: 0.8545, test_loss: 0.8797, test_f1: 0.5380
 epoch: 71, train_loss: 0.8501, test_loss: 0.8827, test_f1: 0.5368
 epoch: 72, train_loss: 0.8525, test_loss: 0.8789, test_f1: 0.5436
 epoch: 73, train_loss: 0.8471, test_loss: 0.8782, test_f1: 0.5381
 epoch: 74, train_loss: 0.8425, test_loss: 0.8787, test_f1: 0.5398
 epoch: 75, train_loss: 0.8495, test_loss: 0.8729, test_f1: 0.5427
 epoch: 76, train_loss: 0.8464, test_loss: 0.8730, test_f1: 0.5354
 epoch: 77, train_loss: 0.8386, test_loss: 0.8707, test_f1: 0.5361
 epoch: 78, train_loss: 0.8439, test_loss: 0.8745, test_f1: 0.5459
 epoch: 79, train_loss: 0.8399, test_loss: 0.8677, test_f1: 0.5328
 epoch: 80, train_loss: 0.8386, test_loss: 0.8701, test_f1: 0.5374
 epoch: 81, train_loss: 0.8403, test_loss: 0.8746, test_f1: 0.5436
 epoch: 82, train_loss: 0.8429, test_loss: 0.8711, test_f1: 0.5459
 epoch: 83, train_loss: 0.8430, test_loss: 0.8639, test_f1: 0.5408
 epoch: 84, train_loss: 0.8395, test_loss: 0.8631, test_f1: 0.5416
 epoch: 85, train_loss: 0.8374, test_loss: 0.8663, test_f1: 0.5481
 epoch: 86, train_loss: 0.8286, test_loss: 0.8709, test_f1: 0.5498
 epoch: 87, train_loss: 0.8321, test_loss: 0.8710, test_f1: 0.5542
 epoch: 88, train_loss: 0.8330, test_loss: 0.8666, test_f1: 0.5449
 epoch: 89, train_loss: 0.8352, test_loss: 0.8654, test_f1: 0.5440
 epoch: 90, train_loss: 0.8268, test_loss: 0.8645, test_f1: 0.5439
 epoch: 91, train_loss: 0.8372, test_loss: 0.8652, test_f1: 0.5532
 epoch: 92, train_loss: 0.8322, test_loss: 0.8651, test_f1: 0.5502
 epoch: 93, train_loss: 0.8329, test_loss: 0.8592, test_f1: 0.5442
 epoch: 94, train_loss: 0.8302, test_loss: 0.8678, test_f1: 0.5440
 epoch: 95, train_loss: 0.8341, test_loss: 0.8611, test_f1: 0.5426
 epoch: 96, train_loss: 0.8230, test_loss: 0.8627, test_f1: 0.5495
 epoch: 97, train_loss: 0.8278, test_loss: 0.8659, test_f1: 0.5497
 epoch: 98, train_loss: 0.8251, test_loss: 0.8584, test_f1: 0.5542
 epoch: 99, train_loss: 0.8287, test_loss: 0.8597, test_f1: 0.5448

Training completed in 683.82 seconds
Best F1: 0.5678 at epoch 99
Mean F1 across iterations: 0.5534  0.0106
========================FINAL RESULTS================================
FEGIN weighted F1: 0.5678  0.0106
python main.py --data ltspice_examples --representation component_pin_net --model FEGIN --layers 2 --hiddens 64 --batch_size 256 --lr 0.0001 --emb_size 250 --epochs 100 --save_appendix component_pin_net_L2_H64_BS256_LR0.0001_E250 --no_val
-----



STDERR:
  File "main.py", line 370, in <module>
    main()
  File "main.py", line 254, in main
    dataset = dataset_class(
  File "/home/philip/projects/llm_inference_code_repo/Circuit-Completion-Using-GNNs/component_classification_with_link_prediction_head/evaluation/FEGIN/kernel/circuit_datasets.py", line 15, in __init__
    self.data, self.slices = torch.load(self.processed_paths[0])
  File "/home/philip/.local/lib/python3.8/site-packages/torch/serialization.py", line 1040, in load
    warnings.warn(
  File "/usr/lib/python3.8/warnings.py", line 109, in _showwarnmsg
    sw(msg.message, msg.category, msg.filename, msg.lineno,
  File "main.py", line 47, in warn_with_traceback
    traceback.print_stack(file=log)
/home/philip/projects/llm_inference_code_repo/Circuit-Completion-Using-GNNs/component_classification_with_link_prediction_head/evaluation/FEGIN/kernel/circuit_datasets.py:15: FutureWarning: You are using `torch.load` with `weights_only=False` (the current default value), which uses the default pickle module implicitly. It is possible to construct malicious pickle data which will execute arbitrary code during unpickling (See https://github.com/pytorch/pytorch/blob/main/SECURITY.md#untrusted-models for more details). In a future release, the default value for `weights_only` will be flipped to `True`. This limits the functions that could be executed during unpickling. Arbitrary objects will no longer be allowed to be loaded via this mode unless they are explicitly allowlisted by the user via `torch.serialization.add_safe_globals`. We recommend you start setting `weights_only=True` for any use case where you don't have full control of the loaded file. Please open an issue on GitHub for any issues related to this experimental feature.
  self.data, self.slices = torch.load(self.processed_paths[0])
