STDOUT:
Results will be saved in /home/philip/projects/ltspice_examples_code_repo/Circuit-Completion-Using-GNNs/component_classification_with_link_prediction_head/evaluation/FEGIN/results/model_FEGIN_dataset_ltspice_examples
Command line input: python main.py --data ltspice_examples --representation component_net --model FEGIN --layers 5 --hiddens 64 --batch_size 64 --lr 0.001 --emb_size 512 --epochs 100 --save_appendix component_net_L5_H64_BS64_LR0.001_E512 --no_val
 is saved.
-----
ltspice_examples - FEGIN
Using 5 layers, 64 hidden units, h = 2
Loading component_net representation dataset
ENTERED
Training FEGIN on component_net representation
Train: 3558, Test: 846
##################ITERATION #0 ****************************************
 epoch: 0, train_loss: 1.2563, test_loss: 1.1361, test_f1: 0.3495
 epoch: 1, train_loss: 1.1056, test_loss: 1.0146, test_f1: 0.4804
 epoch: 2, train_loss: 1.0166, test_loss: 0.9595, test_f1: 0.4735
 epoch: 3, train_loss: 0.9709, test_loss: 0.9612, test_f1: 0.4991
 epoch: 4, train_loss: 0.9472, test_loss: 0.9416, test_f1: 0.4869
 epoch: 5, train_loss: 0.9260, test_loss: 0.9517, test_f1: 0.5291
 epoch: 6, train_loss: 0.9023, test_loss: 0.9502, test_f1: 0.5083
 epoch: 7, train_loss: 0.8990, test_loss: 0.9139, test_f1: 0.5500
 epoch: 8, train_loss: 0.8759, test_loss: 0.9141, test_f1: 0.5476
 epoch: 9, train_loss: 0.8612, test_loss: 0.9510, test_f1: 0.5673
 epoch: 10, train_loss: 0.8434, test_loss: 0.9785, test_f1: 0.4972
 epoch: 11, train_loss: 0.8367, test_loss: 0.9720, test_f1: 0.5146
 epoch: 12, train_loss: 0.8381, test_loss: 0.9067, test_f1: 0.5912
 epoch: 13, train_loss: 0.8167, test_loss: 1.0340, test_f1: 0.5511
 epoch: 14, train_loss: 0.8053, test_loss: 0.9713, test_f1: 0.5628
 epoch: 15, train_loss: 0.7915, test_loss: 0.9791, test_f1: 0.5885
 epoch: 16, train_loss: 0.7881, test_loss: 0.9358, test_f1: 0.5855
 epoch: 17, train_loss: 0.7774, test_loss: 0.9578, test_f1: 0.5794
 epoch: 18, train_loss: 0.7782, test_loss: 0.9525, test_f1: 0.6045
 epoch: 19, train_loss: 0.7659, test_loss: 0.9518, test_f1: 0.5861
 epoch: 20, train_loss: 0.7470, test_loss: 1.0064, test_f1: 0.5984
 epoch: 21, train_loss: 0.7449, test_loss: 0.9645, test_f1: 0.5852
 epoch: 22, train_loss: 0.7383, test_loss: 0.9835, test_f1: 0.5805
 epoch: 23, train_loss: 0.7419, test_loss: 0.9332, test_f1: 0.6240
 epoch: 24, train_loss: 0.7242, test_loss: 0.9672, test_f1: 0.6084
 epoch: 25, train_loss: 0.7173, test_loss: 0.9465, test_f1: 0.6299
 epoch: 26, train_loss: 0.7069, test_loss: 0.9990, test_f1: 0.6107
 epoch: 27, train_loss: 0.6985, test_loss: 1.0542, test_f1: 0.5970
 epoch: 28, train_loss: 0.6896, test_loss: 0.9944, test_f1: 0.6262
 epoch: 29, train_loss: 0.6680, test_loss: 1.0099, test_f1: 0.6180
 epoch: 30, train_loss: 0.6754, test_loss: 1.0659, test_f1: 0.5423
 epoch: 31, train_loss: 0.6833, test_loss: 0.9049, test_f1: 0.6353
 epoch: 32, train_loss: 0.6548, test_loss: 0.9084, test_f1: 0.6529
 epoch: 33, train_loss: 0.6618, test_loss: 1.0241, test_f1: 0.6298
 epoch: 34, train_loss: 0.6369, test_loss: 0.9816, test_f1: 0.6417
 epoch: 35, train_loss: 0.6313, test_loss: 0.9986, test_f1: 0.6128
 epoch: 36, train_loss: 0.6351, test_loss: 0.9457, test_f1: 0.6529
 epoch: 37, train_loss: 0.6154, test_loss: 0.9571, test_f1: 0.6356
 epoch: 38, train_loss: 0.6384, test_loss: 1.0241, test_f1: 0.6162
 epoch: 39, train_loss: 0.6125, test_loss: 1.0592, test_f1: 0.6252
 epoch: 40, train_loss: 0.5973, test_loss: 0.9838, test_f1: 0.6315
 epoch: 41, train_loss: 0.5811, test_loss: 1.0333, test_f1: 0.6410
 epoch: 42, train_loss: 0.5894, test_loss: 1.0754, test_f1: 0.6307
 epoch: 43, train_loss: 0.5746, test_loss: 1.0532, test_f1: 0.6408
 epoch: 44, train_loss: 0.5773, test_loss: 1.0547, test_f1: 0.6343
 epoch: 45, train_loss: 0.5695, test_loss: 0.9947, test_f1: 0.6441
 epoch: 46, train_loss: 0.5347, test_loss: 1.0754, test_f1: 0.6539
 epoch: 47, train_loss: 0.5665, test_loss: 1.0266, test_f1: 0.6550
 epoch: 48, train_loss: 0.5396, test_loss: 1.0026, test_f1: 0.6529
 epoch: 49, train_loss: 0.5447, test_loss: 1.0986, test_f1: 0.6270
 epoch: 50, train_loss: 0.5428, test_loss: 1.1076, test_f1: 0.6062
 epoch: 51, train_loss: 0.5134, test_loss: 1.1137, test_f1: 0.6426
 epoch: 52, train_loss: 0.4701, test_loss: 1.0674, test_f1: 0.6465
 epoch: 53, train_loss: 0.4848, test_loss: 1.1279, test_f1: 0.6400
 epoch: 54, train_loss: 0.4645, test_loss: 1.1057, test_f1: 0.6679
 epoch: 55, train_loss: 0.4433, test_loss: 1.1376, test_f1: 0.6673
 epoch: 56, train_loss: 0.4585, test_loss: 1.1687, test_f1: 0.6476
 epoch: 57, train_loss: 0.4552, test_loss: 1.1646, test_f1: 0.6588
 epoch: 58, train_loss: 0.4323, test_loss: 1.1809, test_f1: 0.6601
 epoch: 59, train_loss: 0.4326, test_loss: 1.2261, test_f1: 0.6258
 epoch: 60, train_loss: 0.4334, test_loss: 1.1793, test_f1: 0.6600
 epoch: 61, train_loss: 0.4247, test_loss: 1.1577, test_f1: 0.6772
 epoch: 62, train_loss: 0.4354, test_loss: 1.2034, test_f1: 0.6507
 epoch: 63, train_loss: 0.4205, test_loss: 1.2747, test_f1: 0.6372
 epoch: 64, train_loss: 0.4098, test_loss: 1.2243, test_f1: 0.6503
 epoch: 65, train_loss: 0.4160, test_loss: 1.1504, test_f1: 0.6667
 epoch: 66, train_loss: 0.3959, test_loss: 1.2669, test_f1: 0.6619
 epoch: 67, train_loss: 0.4093, test_loss: 1.3037, test_f1: 0.6456
 epoch: 68, train_loss: 0.3866, test_loss: 1.2552, test_f1: 0.6695
 epoch: 69, train_loss: 0.3932, test_loss: 1.2436, test_f1: 0.6659
 epoch: 70, train_loss: 0.3828, test_loss: 1.3347, test_f1: 0.6294
 epoch: 71, train_loss: 0.3957, test_loss: 1.2570, test_f1: 0.6440
 epoch: 72, train_loss: 0.3807, test_loss: 1.2954, test_f1: 0.6624
 epoch: 73, train_loss: 0.4036, test_loss: 1.3363, test_f1: 0.6366
 epoch: 74, train_loss: 0.3670, test_loss: 1.2887, test_f1: 0.6458
 epoch: 75, train_loss: 0.3656, test_loss: 1.4010, test_f1: 0.6423
 epoch: 76, train_loss: 0.3666, test_loss: 1.2958, test_f1: 0.6529
 epoch: 77, train_loss: 0.3669, test_loss: 1.3536, test_f1: 0.6334
 epoch: 78, train_loss: 0.3532, test_loss: 1.3443, test_f1: 0.6720
 epoch: 79, train_loss: 0.3511, test_loss: 1.3582, test_f1: 0.6651
 epoch: 80, train_loss: 0.3502, test_loss: 1.3820, test_f1: 0.6508
 epoch: 81, train_loss: 0.3477, test_loss: 1.3815, test_f1: 0.6500
 epoch: 82, train_loss: 0.3489, test_loss: 1.4893, test_f1: 0.6556
 epoch: 83, train_loss: 0.3517, test_loss: 1.4556, test_f1: 0.6421
 epoch: 84, train_loss: 0.3524, test_loss: 1.5367, test_f1: 0.6484
 epoch: 85, train_loss: 0.3466, test_loss: 1.4402, test_f1: 0.6311
 epoch: 86, train_loss: 0.3296, test_loss: 1.4469, test_f1: 0.6299
 epoch: 87, train_loss: 0.3254, test_loss: 1.4744, test_f1: 0.6744
 epoch: 88, train_loss: 0.3482, test_loss: 1.4731, test_f1: 0.6395
 epoch: 89, train_loss: 0.3147, test_loss: 1.5471, test_f1: 0.6453
 epoch: 90, train_loss: 0.3250, test_loss: 1.5424, test_f1: 0.6472
 epoch: 91, train_loss: 0.3114, test_loss: 1.4972, test_f1: 0.6403
 epoch: 92, train_loss: 0.3157, test_loss: 1.6749, test_f1: 0.6466
 epoch: 93, train_loss: 0.3283, test_loss: 1.7158, test_f1: 0.6420
 epoch: 94, train_loss: 0.3223, test_loss: 1.5873, test_f1: 0.6482
 epoch: 95, train_loss: 0.3049, test_loss: 1.5824, test_f1: 0.6396
 epoch: 96, train_loss: 0.3188, test_loss: 1.6663, test_f1: 0.6162
 epoch: 97, train_loss: 0.3145, test_loss: 1.5627, test_f1: 0.6482
 epoch: 98, train_loss: 0.3039, test_loss: 1.5787, test_f1: 0.6717
 epoch: 99, train_loss: 0.3078, test_loss: 1.5981, test_f1: 0.6596
##################ITERATION #1 ****************************************
 epoch: 0, train_loss: 1.1599, test_loss: 1.0322, test_f1: 0.5156
 epoch: 1, train_loss: 1.0271, test_loss: 0.9587, test_f1: 0.4725
 epoch: 2, train_loss: 0.9760, test_loss: 0.9349, test_f1: 0.4962
 epoch: 3, train_loss: 0.9601, test_loss: 0.8986, test_f1: 0.5119
 epoch: 4, train_loss: 0.9327, test_loss: 0.9542, test_f1: 0.5376
 epoch: 5, train_loss: 0.9177, test_loss: 0.8668, test_f1: 0.5206
 epoch: 6, train_loss: 0.9129, test_loss: 0.9292, test_f1: 0.5248
 epoch: 7, train_loss: 0.8953, test_loss: 0.8939, test_f1: 0.5693
 epoch: 8, train_loss: 0.8701, test_loss: 0.9092, test_f1: 0.5656
 epoch: 9, train_loss: 0.8571, test_loss: 0.8679, test_f1: 0.5587
 epoch: 10, train_loss: 0.8493, test_loss: 0.9497, test_f1: 0.5466
 epoch: 11, train_loss: 0.8406, test_loss: 0.9232, test_f1: 0.5804
 epoch: 12, train_loss: 0.8179, test_loss: 0.9638, test_f1: 0.5512
 epoch: 13, train_loss: 0.8096, test_loss: 0.9400, test_f1: 0.5818
 epoch: 14, train_loss: 0.8260, test_loss: 0.9179, test_f1: 0.5824
 epoch: 15, train_loss: 0.7888, test_loss: 0.9086, test_f1: 0.5976
 epoch: 16, train_loss: 0.7805, test_loss: 0.9281, test_f1: 0.5999
 epoch: 17, train_loss: 0.7807, test_loss: 0.9512, test_f1: 0.5874
 epoch: 18, train_loss: 0.7622, test_loss: 0.9662, test_f1: 0.5670
 epoch: 19, train_loss: 0.7630, test_loss: 0.9036, test_f1: 0.6228
 epoch: 20, train_loss: 0.7471, test_loss: 0.9830, test_f1: 0.5905
 epoch: 21, train_loss: 0.7398, test_loss: 0.9450, test_f1: 0.5981
 epoch: 22, train_loss: 0.7281, test_loss: 0.9409, test_f1: 0.6206
 epoch: 23, train_loss: 0.7283, test_loss: 1.0073, test_f1: 0.5961
 epoch: 24, train_loss: 0.7140, test_loss: 0.9004, test_f1: 0.6051
 epoch: 25, train_loss: 0.7148, test_loss: 0.9596, test_f1: 0.6057
 epoch: 26, train_loss: 0.7179, test_loss: 1.0194, test_f1: 0.5758
 epoch: 27, train_loss: 0.7064, test_loss: 0.9532, test_f1: 0.6155
 epoch: 28, train_loss: 0.7067, test_loss: 0.9947, test_f1: 0.5825
 epoch: 29, train_loss: 0.6850, test_loss: 0.9339, test_f1: 0.6178
 epoch: 30, train_loss: 0.6807, test_loss: 0.9908, test_f1: 0.5981
 epoch: 31, train_loss: 0.6807, test_loss: 0.9579, test_f1: 0.6367
 epoch: 32, train_loss: 0.6474, test_loss: 0.8484, test_f1: 0.6367
 epoch: 33, train_loss: 0.6594, test_loss: 0.9483, test_f1: 0.6321
 epoch: 34, train_loss: 0.6657, test_loss: 0.9980, test_f1: 0.6168
 epoch: 35, train_loss: 0.6390, test_loss: 1.0361, test_f1: 0.5949
 epoch: 36, train_loss: 0.6281, test_loss: 0.9600, test_f1: 0.6343
 epoch: 37, train_loss: 0.6217, test_loss: 0.9581, test_f1: 0.6293
 epoch: 38, train_loss: 0.6291, test_loss: 0.9264, test_f1: 0.6438
 epoch: 39, train_loss: 0.6382, test_loss: 0.9942, test_f1: 0.6240
 epoch: 40, train_loss: 0.6084, test_loss: 0.9823, test_f1: 0.6439
 epoch: 41, train_loss: 0.5897, test_loss: 0.9040, test_f1: 0.6396
 epoch: 42, train_loss: 0.5730, test_loss: 1.0751, test_f1: 0.6284
 epoch: 43, train_loss: 0.5892, test_loss: 1.0967, test_f1: 0.6267
 epoch: 44, train_loss: 0.5643, test_loss: 0.9897, test_f1: 0.6505
 epoch: 45, train_loss: 0.5829, test_loss: 1.1908, test_f1: 0.5939
 epoch: 46, train_loss: 0.5635, test_loss: 1.0179, test_f1: 0.6670
 epoch: 47, train_loss: 0.5404, test_loss: 1.0137, test_f1: 0.5966
 epoch: 48, train_loss: 0.5621, test_loss: 1.0080, test_f1: 0.6453
 epoch: 49, train_loss: 0.5368, test_loss: 1.0084, test_f1: 0.6562
 epoch: 50, train_loss: 0.5302, test_loss: 1.0076, test_f1: 0.6479
 epoch: 51, train_loss: 0.5025, test_loss: 0.9904, test_f1: 0.6738
 epoch: 52, train_loss: 0.4726, test_loss: 1.0201, test_f1: 0.6531
 epoch: 53, train_loss: 0.4502, test_loss: 1.0599, test_f1: 0.6445
 epoch: 54, train_loss: 0.4563, test_loss: 1.0334, test_f1: 0.6504
 epoch: 55, train_loss: 0.4356, test_loss: 1.1954, test_f1: 0.6120
 epoch: 56, train_loss: 0.4543, test_loss: 1.1277, test_f1: 0.6353
 epoch: 57, train_loss: 0.4482, test_loss: 1.1223, test_f1: 0.6563
 epoch: 58, train_loss: 0.4331, test_loss: 1.1383, test_f1: 0.6444
 epoch: 59, train_loss: 0.4337, test_loss: 1.1137, test_f1: 0.6679
 epoch: 60, train_loss: 0.4060, test_loss: 1.1136, test_f1: 0.6243
 epoch: 61, train_loss: 0.3932, test_loss: 1.1201, test_f1: 0.6375
 epoch: 62, train_loss: 0.3949, test_loss: 1.3650, test_f1: 0.6286
 epoch: 63, train_loss: 0.3964, test_loss: 1.2111, test_f1: 0.6334
 epoch: 64, train_loss: 0.3958, test_loss: 1.2280, test_f1: 0.6495
 epoch: 65, train_loss: 0.4002, test_loss: 1.1354, test_f1: 0.6300
 epoch: 66, train_loss: 0.3732, test_loss: 1.1877, test_f1: 0.6351
 epoch: 67, train_loss: 0.3912, test_loss: 1.2303, test_f1: 0.6352
 epoch: 68, train_loss: 0.3976, test_loss: 1.2374, test_f1: 0.6373
 epoch: 69, train_loss: 0.3846, test_loss: 1.1691, test_f1: 0.6489
 epoch: 70, train_loss: 0.3848, test_loss: 1.1981, test_f1: 0.6457
 epoch: 71, train_loss: 0.3700, test_loss: 1.2464, test_f1: 0.6295
 epoch: 72, train_loss: 0.3701, test_loss: 1.3120, test_f1: 0.6344
 epoch: 73, train_loss: 0.3530, test_loss: 1.3659, test_f1: 0.6406
 epoch: 74, train_loss: 0.3620, test_loss: 1.2973, test_f1: 0.6353
 epoch: 75, train_loss: 0.3591, test_loss: 1.2759, test_f1: 0.6399
 epoch: 76, train_loss: 0.3407, test_loss: 1.3044, test_f1: 0.6403
 epoch: 77, train_loss: 0.3483, test_loss: 1.3291, test_f1: 0.6367
 epoch: 78, train_loss: 0.3468, test_loss: 1.3615, test_f1: 0.6399
 epoch: 79, train_loss: 0.3400, test_loss: 1.4056, test_f1: 0.6575
 epoch: 80, train_loss: 0.3551, test_loss: 1.3096, test_f1: 0.6411
 epoch: 81, train_loss: 0.3401, test_loss: 1.4051, test_f1: 0.6230
 epoch: 82, train_loss: 0.3195, test_loss: 1.3350, test_f1: 0.6425
 epoch: 83, train_loss: 0.3346, test_loss: 1.4177, test_f1: 0.6237
 epoch: 84, train_loss: 0.3284, test_loss: 1.5107, test_f1: 0.6155
 epoch: 85, train_loss: 0.3314, test_loss: 1.4266, test_f1: 0.6350
 epoch: 86, train_loss: 0.3259, test_loss: 1.5849, test_f1: 0.6148
 epoch: 87, train_loss: 0.3323, test_loss: 1.3625, test_f1: 0.6550
 epoch: 88, train_loss: 0.3250, test_loss: 1.4139, test_f1: 0.6342
 epoch: 89, train_loss: 0.3091, test_loss: 1.5849, test_f1: 0.6285
 epoch: 90, train_loss: 0.3330, test_loss: 1.6777, test_f1: 0.6296
 epoch: 91, train_loss: 0.3129, test_loss: 1.4802, test_f1: 0.6352
 epoch: 92, train_loss: 0.3136, test_loss: 1.5256, test_f1: 0.6314
 epoch: 93, train_loss: 0.3131, test_loss: 1.5280, test_f1: 0.6144
 epoch: 94, train_loss: 0.2965, test_loss: 1.4869, test_f1: 0.6310
 epoch: 95, train_loss: 0.3294, test_loss: 1.4752, test_f1: 0.6360
 epoch: 96, train_loss: 0.2957, test_loss: 1.5111, test_f1: 0.6247
 epoch: 97, train_loss: 0.2803, test_loss: 1.5783, test_f1: 0.6461
 epoch: 98, train_loss: 0.3042, test_loss: 1.6300, test_f1: 0.6125
 epoch: 99, train_loss: 0.2871, test_loss: 1.6182, test_f1: 0.6284
##################ITERATION #2 ****************************************
 epoch: 0, train_loss: 1.1712, test_loss: 1.0871, test_f1: 0.3675
 epoch: 1, train_loss: 1.0266, test_loss: 0.9375, test_f1: 0.5098
 epoch: 2, train_loss: 0.9651, test_loss: 0.9736, test_f1: 0.5342
 epoch: 3, train_loss: 0.9489, test_loss: 0.9173, test_f1: 0.5283
 epoch: 4, train_loss: 0.9186, test_loss: 0.9190, test_f1: 0.5577
 epoch: 5, train_loss: 0.9093, test_loss: 0.9053, test_f1: 0.5593
 epoch: 6, train_loss: 0.8938, test_loss: 0.9040, test_f1: 0.5829
 epoch: 7, train_loss: 0.8707, test_loss: 0.9139, test_f1: 0.5855
 epoch: 8, train_loss: 0.8690, test_loss: 0.9141, test_f1: 0.5797
 epoch: 9, train_loss: 0.8548, test_loss: 0.9578, test_f1: 0.5614
 epoch: 10, train_loss: 0.8374, test_loss: 0.9406, test_f1: 0.5670
 epoch: 11, train_loss: 0.8379, test_loss: 0.9201, test_f1: 0.5840
 epoch: 12, train_loss: 0.8294, test_loss: 0.9213, test_f1: 0.6048
 epoch: 13, train_loss: 0.8211, test_loss: 0.9113, test_f1: 0.5858
 epoch: 14, train_loss: 0.7969, test_loss: 0.9379, test_f1: 0.5457
 epoch: 15, train_loss: 0.8019, test_loss: 0.9571, test_f1: 0.5852
 epoch: 16, train_loss: 0.7913, test_loss: 1.0276, test_f1: 0.5295
 epoch: 17, train_loss: 0.7684, test_loss: 0.9616, test_f1: 0.5741
 epoch: 18, train_loss: 0.7774, test_loss: 0.9617, test_f1: 0.5745
 epoch: 19, train_loss: 0.7587, test_loss: 0.9846, test_f1: 0.5756
 epoch: 20, train_loss: 0.7544, test_loss: 0.9579, test_f1: 0.5889
 epoch: 21, train_loss: 0.7456, test_loss: 0.9694, test_f1: 0.5975
 epoch: 22, train_loss: 0.7476, test_loss: 0.9589, test_f1: 0.6306
 epoch: 23, train_loss: 0.7347, test_loss: 0.9478, test_f1: 0.5948
 epoch: 24, train_loss: 0.7154, test_loss: 0.9884, test_f1: 0.5888
 epoch: 25, train_loss: 0.7448, test_loss: 0.9288, test_f1: 0.5981
 epoch: 26, train_loss: 0.7169, test_loss: 0.9664, test_f1: 0.5815
 epoch: 27, train_loss: 0.7115, test_loss: 0.9513, test_f1: 0.6114
 epoch: 28, train_loss: 0.6965, test_loss: 1.0056, test_f1: 0.5905
 epoch: 29, train_loss: 0.6849, test_loss: 0.9849, test_f1: 0.6191
 epoch: 30, train_loss: 0.6793, test_loss: 0.9826, test_f1: 0.6072
 epoch: 31, train_loss: 0.6731, test_loss: 1.0554, test_f1: 0.6403
 epoch: 32, train_loss: 0.6504, test_loss: 1.0193, test_f1: 0.6161
 epoch: 33, train_loss: 0.6634, test_loss: 1.1272, test_f1: 0.5815
 epoch: 34, train_loss: 0.6484, test_loss: 1.0320, test_f1: 0.6240
 epoch: 35, train_loss: 0.6527, test_loss: 1.0492, test_f1: 0.6144
 epoch: 36, train_loss: 0.6240, test_loss: 1.0377, test_f1: 0.5907
 epoch: 37, train_loss: 0.6449, test_loss: 1.0801, test_f1: 0.6184
 epoch: 38, train_loss: 0.6516, test_loss: 1.0356, test_f1: 0.6437
 epoch: 39, train_loss: 0.6212, test_loss: 1.0825, test_f1: 0.6106
 epoch: 40, train_loss: 0.6221, test_loss: 0.9987, test_f1: 0.6364
 epoch: 41, train_loss: 0.6034, test_loss: 1.1470, test_f1: 0.6167
 epoch: 42, train_loss: 0.5969, test_loss: 1.0467, test_f1: 0.6286
 epoch: 43, train_loss: 0.5903, test_loss: 1.0994, test_f1: 0.6194
 epoch: 44, train_loss: 0.5939, test_loss: 0.9578, test_f1: 0.6543
 epoch: 45, train_loss: 0.5709, test_loss: 1.0758, test_f1: 0.6352
 epoch: 46, train_loss: 0.5790, test_loss: 1.1155, test_f1: 0.6460
 epoch: 47, train_loss: 0.5693, test_loss: 1.0776, test_f1: 0.6439
 epoch: 48, train_loss: 0.5541, test_loss: 1.0533, test_f1: 0.6355
 epoch: 49, train_loss: 0.5459, test_loss: 1.1331, test_f1: 0.6351
 epoch: 50, train_loss: 0.5541, test_loss: 1.0458, test_f1: 0.6483
 epoch: 51, train_loss: 0.5228, test_loss: 1.0552, test_f1: 0.6522
 epoch: 52, train_loss: 0.4951, test_loss: 1.0508, test_f1: 0.6548
 epoch: 53, train_loss: 0.4809, test_loss: 1.0802, test_f1: 0.6660
 epoch: 54, train_loss: 0.4699, test_loss: 1.0698, test_f1: 0.6654
 epoch: 55, train_loss: 0.4708, test_loss: 1.0859, test_f1: 0.6472
 epoch: 56, train_loss: 0.4561, test_loss: 1.1245, test_f1: 0.6668
 epoch: 57, train_loss: 0.4579, test_loss: 1.1840, test_f1: 0.6345
 epoch: 58, train_loss: 0.4368, test_loss: 1.1318, test_f1: 0.6763
 epoch: 59, train_loss: 0.4393, test_loss: 1.2255, test_f1: 0.6528
 epoch: 60, train_loss: 0.4232, test_loss: 1.1764, test_f1: 0.6753
 epoch: 61, train_loss: 0.4242, test_loss: 1.1789, test_f1: 0.6860
 epoch: 62, train_loss: 0.4286, test_loss: 1.2199, test_f1: 0.6511
 epoch: 63, train_loss: 0.4224, test_loss: 1.1986, test_f1: 0.6529
 epoch: 64, train_loss: 0.4147, test_loss: 1.2261, test_f1: 0.6573
 epoch: 65, train_loss: 0.4109, test_loss: 1.2277, test_f1: 0.6613
 epoch: 66, train_loss: 0.4104, test_loss: 1.2405, test_f1: 0.6597
 epoch: 67, train_loss: 0.3985, test_loss: 1.2993, test_f1: 0.6382
 epoch: 68, train_loss: 0.4236, test_loss: 1.2251, test_f1: 0.6519
 epoch: 69, train_loss: 0.3967, test_loss: 1.2243, test_f1: 0.6667
 epoch: 70, train_loss: 0.3940, test_loss: 1.2372, test_f1: 0.6642
 epoch: 71, train_loss: 0.3903, test_loss: 1.2549, test_f1: 0.6683
 epoch: 72, train_loss: 0.3854, test_loss: 1.3568, test_f1: 0.6646
 epoch: 73, train_loss: 0.3678, test_loss: 1.2729, test_f1: 0.6716
 epoch: 74, train_loss: 0.3796, test_loss: 1.3461, test_f1: 0.6563
 epoch: 75, train_loss: 0.3689, test_loss: 1.3463, test_f1: 0.6446
 epoch: 76, train_loss: 0.3665, test_loss: 1.3544, test_f1: 0.6630
 epoch: 77, train_loss: 0.3741, test_loss: 1.3956, test_f1: 0.6284
 epoch: 78, train_loss: 0.3578, test_loss: 1.3370, test_f1: 0.6690
 epoch: 79, train_loss: 0.3771, test_loss: 1.3769, test_f1: 0.6457
 epoch: 80, train_loss: 0.3593, test_loss: 1.3224, test_f1: 0.6681
 epoch: 81, train_loss: 0.3571, test_loss: 1.3658, test_f1: 0.6670
 epoch: 82, train_loss: 0.3534, test_loss: 1.4225, test_f1: 0.6461
 epoch: 83, train_loss: 0.3576, test_loss: 1.4492, test_f1: 0.6446
 epoch: 84, train_loss: 0.3310, test_loss: 1.4696, test_f1: 0.6572
 epoch: 85, train_loss: 0.3372, test_loss: 1.4513, test_f1: 0.6526
 epoch: 86, train_loss: 0.3315, test_loss: 1.4303, test_f1: 0.6680
 epoch: 87, train_loss: 0.3341, test_loss: 1.4776, test_f1: 0.6928
 epoch: 88, train_loss: 0.3388, test_loss: 1.5301, test_f1: 0.6429
 epoch: 89, train_loss: 0.3340, test_loss: 1.5505, test_f1: 0.6606
 epoch: 90, train_loss: 0.3361, test_loss: 1.3758, test_f1: 0.6728
 epoch: 91, train_loss: 0.3138, test_loss: 1.4156, test_f1: 0.6650
 epoch: 92, train_loss: 0.3080, test_loss: 1.5471, test_f1: 0.6577
 epoch: 93, train_loss: 0.3220, test_loss: 1.4793, test_f1: 0.6586
 epoch: 94, train_loss: 0.3258, test_loss: 1.5529, test_f1: 0.6630
 epoch: 95, train_loss: 0.3312, test_loss: 1.6063, test_f1: 0.6719
 epoch: 96, train_loss: 0.3139, test_loss: 1.4667, test_f1: 0.6755
 epoch: 97, train_loss: 0.3040, test_loss: 1.5712, test_f1: 0.6390
 epoch: 98, train_loss: 0.3177, test_loss: 1.4605, test_f1: 0.6508
 epoch: 99, train_loss: 0.3070, test_loss: 1.5187, test_f1: 0.6587
##################ITERATION #3 ****************************************
 epoch: 0, train_loss: 1.2087, test_loss: 0.9996, test_f1: 0.4813
 epoch: 1, train_loss: 1.0261, test_loss: 0.9417, test_f1: 0.5034
 epoch: 2, train_loss: 0.9774, test_loss: 0.9169, test_f1: 0.5228
 epoch: 3, train_loss: 0.9529, test_loss: 0.9728, test_f1: 0.5062
 epoch: 4, train_loss: 0.9235, test_loss: 0.9380, test_f1: 0.4992
 epoch: 5, train_loss: 0.9116, test_loss: 0.9469, test_f1: 0.5301
 epoch: 6, train_loss: 0.8954, test_loss: 0.9904, test_f1: 0.5271
 epoch: 7, train_loss: 0.8810, test_loss: 0.9692, test_f1: 0.5794
 epoch: 8, train_loss: 0.8667, test_loss: 0.9249, test_f1: 0.5785
 epoch: 9, train_loss: 0.8680, test_loss: 0.9598, test_f1: 0.5744
 epoch: 10, train_loss: 0.8364, test_loss: 0.9933, test_f1: 0.5475
 epoch: 11, train_loss: 0.8350, test_loss: 0.9111, test_f1: 0.5680
 epoch: 12, train_loss: 0.8127, test_loss: 0.9445, test_f1: 0.5684
 epoch: 13, train_loss: 0.8087, test_loss: 0.9845, test_f1: 0.5730
 epoch: 14, train_loss: 0.8014, test_loss: 0.9649, test_f1: 0.5795
 epoch: 15, train_loss: 0.7839, test_loss: 0.9440, test_f1: 0.6068
 epoch: 16, train_loss: 0.7932, test_loss: 0.9139, test_f1: 0.5809
 epoch: 17, train_loss: 0.7711, test_loss: 0.9704, test_f1: 0.6056
 epoch: 18, train_loss: 0.7594, test_loss: 1.0076, test_f1: 0.5891
 epoch: 19, train_loss: 0.7463, test_loss: 0.9862, test_f1: 0.5679
 epoch: 20, train_loss: 0.7566, test_loss: 0.9715, test_f1: 0.6344
 epoch: 21, train_loss: 0.7514, test_loss: 0.9393, test_f1: 0.6353
 epoch: 22, train_loss: 0.7488, test_loss: 0.9930, test_f1: 0.5859
 epoch: 23, train_loss: 0.7146, test_loss: 0.9899, test_f1: 0.5907
 epoch: 24, train_loss: 0.7103, test_loss: 0.9789, test_f1: 0.6160
 epoch: 25, train_loss: 0.7092, test_loss: 1.0721, test_f1: 0.5957
 epoch: 26, train_loss: 0.7169, test_loss: 0.9824, test_f1: 0.6093
 epoch: 27, train_loss: 0.7025, test_loss: 1.0050, test_f1: 0.6095
 epoch: 28, train_loss: 0.6871, test_loss: 1.1358, test_f1: 0.5933
 epoch: 29, train_loss: 0.6761, test_loss: 0.9612, test_f1: 0.6416
 epoch: 30, train_loss: 0.6651, test_loss: 1.0228, test_f1: 0.6339
 epoch: 31, train_loss: 0.6705, test_loss: 1.0325, test_f1: 0.6416
 epoch: 32, train_loss: 0.6618, test_loss: 0.9322, test_f1: 0.6341
 epoch: 33, train_loss: 0.6546, test_loss: 0.9430, test_f1: 0.6442
 epoch: 34, train_loss: 0.6485, test_loss: 0.8855, test_f1: 0.6785
 epoch: 35, train_loss: 0.6588, test_loss: 0.9926, test_f1: 0.6067
 epoch: 36, train_loss: 0.6456, test_loss: 0.9536, test_f1: 0.6357
 epoch: 37, train_loss: 0.6177, test_loss: 1.0900, test_f1: 0.6354
 epoch: 38, train_loss: 0.6223, test_loss: 0.9667, test_f1: 0.6548
 epoch: 39, train_loss: 0.6105, test_loss: 0.9842, test_f1: 0.6651
 epoch: 40, train_loss: 0.5871, test_loss: 0.9250, test_f1: 0.6813
 epoch: 41, train_loss: 0.5890, test_loss: 0.9716, test_f1: 0.6793
 epoch: 42, train_loss: 0.5899, test_loss: 1.0269, test_f1: 0.6453
 epoch: 43, train_loss: 0.5776, test_loss: 0.9636, test_f1: 0.6343
 epoch: 44, train_loss: 0.5728, test_loss: 0.9727, test_f1: 0.6732
 epoch: 45, train_loss: 0.5615, test_loss: 0.9735, test_f1: 0.6861
 epoch: 46, train_loss: 0.5684, test_loss: 1.0830, test_f1: 0.6489
 epoch: 47, train_loss: 0.5532, test_loss: 1.0186, test_f1: 0.6323
 epoch: 48, train_loss: 0.5502, test_loss: 1.0168, test_f1: 0.6503
 epoch: 49, train_loss: 0.5612, test_loss: 1.0612, test_f1: 0.6297
 epoch: 50, train_loss: 0.5343, test_loss: 1.0246, test_f1: 0.6482
 epoch: 51, train_loss: 0.4910, test_loss: 1.0755, test_f1: 0.6911
 epoch: 52, train_loss: 0.4579, test_loss: 1.0724, test_f1: 0.6733
 epoch: 53, train_loss: 0.4660, test_loss: 1.0953, test_f1: 0.6918
 epoch: 54, train_loss: 0.4479, test_loss: 1.0697, test_f1: 0.6725
 epoch: 55, train_loss: 0.4421, test_loss: 1.0831, test_f1: 0.6689
 epoch: 56, train_loss: 0.4259, test_loss: 1.0521, test_f1: 0.6930
 epoch: 57, train_loss: 0.4356, test_loss: 1.1075, test_f1: 0.6763
 epoch: 58, train_loss: 0.4375, test_loss: 1.1141, test_f1: 0.6737
 epoch: 59, train_loss: 0.4222, test_loss: 1.1051, test_f1: 0.6818
 epoch: 60, train_loss: 0.4204, test_loss: 1.1143, test_f1: 0.6879
 epoch: 61, train_loss: 0.4123, test_loss: 1.1176, test_f1: 0.6954
 epoch: 62, train_loss: 0.4098, test_loss: 1.1719, test_f1: 0.6905
 epoch: 63, train_loss: 0.3995, test_loss: 1.1239, test_f1: 0.7004
 epoch: 64, train_loss: 0.3938, test_loss: 1.1571, test_f1: 0.6842
 epoch: 65, train_loss: 0.3993, test_loss: 1.1516, test_f1: 0.6981
 epoch: 66, train_loss: 0.4212, test_loss: 1.1771, test_f1: 0.6796
 epoch: 67, train_loss: 0.3976, test_loss: 1.1758, test_f1: 0.6635
 epoch: 68, train_loss: 0.3844, test_loss: 1.2043, test_f1: 0.6687
 epoch: 69, train_loss: 0.4096, test_loss: 1.2117, test_f1: 0.6660
 epoch: 70, train_loss: 0.3870, test_loss: 1.2259, test_f1: 0.6881
 epoch: 71, train_loss: 0.3519, test_loss: 1.1968, test_f1: 0.6731
 epoch: 72, train_loss: 0.3629, test_loss: 1.1965, test_f1: 0.6820
 epoch: 73, train_loss: 0.3763, test_loss: 1.2814, test_f1: 0.6842
 epoch: 74, train_loss: 0.3664, test_loss: 1.2055, test_f1: 0.6865
 epoch: 75, train_loss: 0.3593, test_loss: 1.2169, test_f1: 0.6819
 epoch: 76, train_loss: 0.3491, test_loss: 1.2399, test_f1: 0.6943
 epoch: 77, train_loss: 0.3577, test_loss: 1.2591, test_f1: 0.6821
 epoch: 78, train_loss: 0.3363, test_loss: 1.2446, test_f1: 0.6837
 epoch: 79, train_loss: 0.3374, test_loss: 1.3561, test_f1: 0.6612
 epoch: 80, train_loss: 0.3404, test_loss: 1.2853, test_f1: 0.6728
 epoch: 81, train_loss: 0.3533, test_loss: 1.3255, test_f1: 0.6770
 epoch: 82, train_loss: 0.3467, test_loss: 1.3564, test_f1: 0.6525
 epoch: 83, train_loss: 0.3322, test_loss: 1.2808, test_f1: 0.6669
 epoch: 84, train_loss: 0.3407, test_loss: 1.3562, test_f1: 0.6982
 epoch: 85, train_loss: 0.3329, test_loss: 1.2461, test_f1: 0.6805
 epoch: 86, train_loss: 0.3534, test_loss: 1.3201, test_f1: 0.6666
 epoch: 87, train_loss: 0.3318, test_loss: 1.3123, test_f1: 0.6646
 epoch: 88, train_loss: 0.3086, test_loss: 1.4308, test_f1: 0.6723
 epoch: 89, train_loss: 0.3259, test_loss: 1.3963, test_f1: 0.6770
 epoch: 90, train_loss: 0.3082, test_loss: 1.4554, test_f1: 0.6810
 epoch: 91, train_loss: 0.3149, test_loss: 1.3284, test_f1: 0.6890
 epoch: 92, train_loss: 0.3172, test_loss: 1.4858, test_f1: 0.6913
 epoch: 93, train_loss: 0.3069, test_loss: 1.4131, test_f1: 0.6656
 epoch: 94, train_loss: 0.3194, test_loss: 1.4667, test_f1: 0.6858
 epoch: 95, train_loss: 0.3174, test_loss: 1.3841, test_f1: 0.6638
 epoch: 96, train_loss: 0.3141, test_loss: 1.4598, test_f1: 0.6635
 epoch: 97, train_loss: 0.3086, test_loss: 1.4211, test_f1: 0.6584
 epoch: 98, train_loss: 0.3020, test_loss: 1.4665, test_f1: 0.6723
 epoch: 99, train_loss: 0.3137, test_loss: 1.4421, test_f1: 0.6647
##################ITERATION #4 ****************************************
 epoch: 0, train_loss: 1.2911, test_loss: 1.0256, test_f1: 0.4600
 epoch: 1, train_loss: 1.0676, test_loss: 0.9643, test_f1: 0.4714
 epoch: 2, train_loss: 1.0046, test_loss: 0.9662, test_f1: 0.4798
 epoch: 3, train_loss: 0.9735, test_loss: 0.9767, test_f1: 0.5030
 epoch: 4, train_loss: 0.9438, test_loss: 0.9877, test_f1: 0.4831
 epoch: 5, train_loss: 0.9337, test_loss: 0.9769, test_f1: 0.4792
 epoch: 6, train_loss: 0.9158, test_loss: 0.9881, test_f1: 0.4979
 epoch: 7, train_loss: 0.9021, test_loss: 1.0013, test_f1: 0.4713
 epoch: 8, train_loss: 0.9002, test_loss: 0.9975, test_f1: 0.4992
 epoch: 9, train_loss: 0.8877, test_loss: 0.9527, test_f1: 0.5343
 epoch: 10, train_loss: 0.8702, test_loss: 0.9770, test_f1: 0.5344
 epoch: 11, train_loss: 0.8614, test_loss: 0.9553, test_f1: 0.5472
 epoch: 12, train_loss: 0.8640, test_loss: 0.9520, test_f1: 0.5307
 epoch: 13, train_loss: 0.8298, test_loss: 0.9826, test_f1: 0.5253
 epoch: 14, train_loss: 0.8461, test_loss: 0.9779, test_f1: 0.5501
 epoch: 15, train_loss: 0.8312, test_loss: 0.9003, test_f1: 0.5387
 epoch: 16, train_loss: 0.8135, test_loss: 0.9316, test_f1: 0.5597
 epoch: 17, train_loss: 0.8115, test_loss: 0.9518, test_f1: 0.5461
 epoch: 18, train_loss: 0.8080, test_loss: 1.0020, test_f1: 0.5209
 epoch: 19, train_loss: 0.7937, test_loss: 1.0005, test_f1: 0.5416
 epoch: 20, train_loss: 0.8058, test_loss: 0.9989, test_f1: 0.5699
 epoch: 21, train_loss: 0.7907, test_loss: 0.9509, test_f1: 0.5663
 epoch: 22, train_loss: 0.7839, test_loss: 1.0413, test_f1: 0.5262
 epoch: 23, train_loss: 0.7948, test_loss: 0.9516, test_f1: 0.5529
 epoch: 24, train_loss: 0.7813, test_loss: 0.9641, test_f1: 0.5566
 epoch: 25, train_loss: 0.7893, test_loss: 0.9625, test_f1: 0.5548
 epoch: 26, train_loss: 0.7677, test_loss: 0.9573, test_f1: 0.5347
 epoch: 27, train_loss: 0.7536, test_loss: 0.9132, test_f1: 0.5498
 epoch: 28, train_loss: 0.7577, test_loss: 0.9633, test_f1: 0.5767
 epoch: 29, train_loss: 0.7516, test_loss: 0.9871, test_f1: 0.5451
 epoch: 30, train_loss: 0.7461, test_loss: 0.9805, test_f1: 0.5622
 epoch: 31, train_loss: 0.7466, test_loss: 0.9462, test_f1: 0.5721
 epoch: 32, train_loss: 0.7346, test_loss: 0.9668, test_f1: 0.5771
 epoch: 33, train_loss: 0.7191, test_loss: 1.0119, test_f1: 0.5819
 epoch: 34, train_loss: 0.7301, test_loss: 0.9560, test_f1: 0.5689
 epoch: 35, train_loss: 0.7289, test_loss: 1.0269, test_f1: 0.5474
 epoch: 36, train_loss: 0.7169, test_loss: 0.9707, test_f1: 0.5632
 epoch: 37, train_loss: 0.7205, test_loss: 1.0360, test_f1: 0.5605
 epoch: 38, train_loss: 0.6939, test_loss: 0.9777, test_f1: 0.5802
 epoch: 39, train_loss: 0.7098, test_loss: 0.9720, test_f1: 0.5641
 epoch: 40, train_loss: 0.6949, test_loss: 1.0076, test_f1: 0.6238
 epoch: 41, train_loss: 0.6855, test_loss: 1.0376, test_f1: 0.5839
 epoch: 42, train_loss: 0.6889, test_loss: 1.0594, test_f1: 0.5699
 epoch: 43, train_loss: 0.6865, test_loss: 0.9849, test_f1: 0.6015
 epoch: 44, train_loss: 0.6668, test_loss: 1.0132, test_f1: 0.5896
 epoch: 45, train_loss: 0.6649, test_loss: 1.0368, test_f1: 0.5879
 epoch: 46, train_loss: 0.6487, test_loss: 1.0387, test_f1: 0.5903
 epoch: 47, train_loss: 0.6612, test_loss: 1.0204, test_f1: 0.5857
 epoch: 48, train_loss: 0.6683, test_loss: 1.0038, test_f1: 0.6161
 epoch: 49, train_loss: 0.6462, test_loss: 1.0311, test_f1: 0.5944
 epoch: 50, train_loss: 0.6529, test_loss: 1.0182, test_f1: 0.6132
 epoch: 51, train_loss: 0.6199, test_loss: 0.9979, test_f1: 0.6153
 epoch: 52, train_loss: 0.5848, test_loss: 1.0229, test_f1: 0.6399
 epoch: 53, train_loss: 0.5903, test_loss: 1.0033, test_f1: 0.6146
 epoch: 54, train_loss: 0.5785, test_loss: 0.9959, test_f1: 0.6550
 epoch: 55, train_loss: 0.5776, test_loss: 0.9901, test_f1: 0.6186
 epoch: 56, train_loss: 0.5766, test_loss: 1.0314, test_f1: 0.6277
 epoch: 57, train_loss: 0.5494, test_loss: 1.0465, test_f1: 0.5971
 epoch: 58, train_loss: 0.5560, test_loss: 1.0240, test_f1: 0.6251
 epoch: 59, train_loss: 0.5522, test_loss: 1.0237, test_f1: 0.6398
 epoch: 60, train_loss: 0.5427, test_loss: 1.1182, test_f1: 0.6246
 epoch: 61, train_loss: 0.5316, test_loss: 1.0866, test_f1: 0.6221
 epoch: 62, train_loss: 0.5348, test_loss: 1.0199, test_f1: 0.6598
 epoch: 63, train_loss: 0.5447, test_loss: 1.0505, test_f1: 0.6207
 epoch: 64, train_loss: 0.5200, test_loss: 1.0503, test_f1: 0.6543
 epoch: 65, train_loss: 0.5165, test_loss: 1.0973, test_f1: 0.6255
 epoch: 66, train_loss: 0.5167, test_loss: 1.0455, test_f1: 0.6153
 epoch: 67, train_loss: 0.5154, test_loss: 1.1316, test_f1: 0.6557
 epoch: 68, train_loss: 0.4963, test_loss: 1.1254, test_f1: 0.6040
 epoch: 69, train_loss: 0.5120, test_loss: 1.0752, test_f1: 0.6414
 epoch: 70, train_loss: 0.5041, test_loss: 1.1797, test_f1: 0.6402
 epoch: 71, train_loss: 0.5104, test_loss: 1.1217, test_f1: 0.6251
 epoch: 72, train_loss: 0.5128, test_loss: 1.0729, test_f1: 0.6847
 epoch: 73, train_loss: 0.4925, test_loss: 1.1244, test_f1: 0.6456
 epoch: 74, train_loss: 0.4960, test_loss: 1.0968, test_f1: 0.6493
 epoch: 75, train_loss: 0.4772, test_loss: 1.1126, test_f1: 0.6553
 epoch: 76, train_loss: 0.4768, test_loss: 1.1766, test_f1: 0.6172
 epoch: 77, train_loss: 0.4688, test_loss: 1.1250, test_f1: 0.6143
 epoch: 78, train_loss: 0.4789, test_loss: 1.1391, test_f1: 0.6452
 epoch: 79, train_loss: 0.4678, test_loss: 1.1229, test_f1: 0.6345
 epoch: 80, train_loss: 0.4728, test_loss: 1.1780, test_f1: 0.6468
 epoch: 81, train_loss: 0.4631, test_loss: 1.1049, test_f1: 0.6333
 epoch: 82, train_loss: 0.4636, test_loss: 1.2105, test_f1: 0.6207
 epoch: 83, train_loss: 0.4559, test_loss: 1.2327, test_f1: 0.6188
 epoch: 84, train_loss: 0.4511, test_loss: 1.1143, test_f1: 0.6446
 epoch: 85, train_loss: 0.4639, test_loss: 1.1926, test_f1: 0.6297
 epoch: 86, train_loss: 0.4490, test_loss: 1.1998, test_f1: 0.6312
 epoch: 87, train_loss: 0.4555, test_loss: 1.0657, test_f1: 0.6372
 epoch: 88, train_loss: 0.4293, test_loss: 1.2044, test_f1: 0.6290
 epoch: 89, train_loss: 0.4367, test_loss: 1.2329, test_f1: 0.6612
 epoch: 90, train_loss: 0.4241, test_loss: 1.2892, test_f1: 0.6283
 epoch: 91, train_loss: 0.4394, test_loss: 1.2072, test_f1: 0.6647
 epoch: 92, train_loss: 0.4245, test_loss: 1.2249, test_f1: 0.6517
 epoch: 93, train_loss: 0.4367, test_loss: 1.1895, test_f1: 0.6318
 epoch: 94, train_loss: 0.4061, test_loss: 1.2144, test_f1: 0.6640
 epoch: 95, train_loss: 0.4292, test_loss: 1.1811, test_f1: 0.6721
 epoch: 96, train_loss: 0.4080, test_loss: 1.2146, test_f1: 0.6513
 epoch: 97, train_loss: 0.4210, test_loss: 1.1896, test_f1: 0.6583
 epoch: 98, train_loss: 0.4082, test_loss: 1.1767, test_f1: 0.6266
 epoch: 99, train_loss: 0.4000, test_loss: 1.2178, test_f1: 0.6300
##################ITERATION #5 ****************************************
 epoch: 0, train_loss: 1.3171, test_loss: 1.0299, test_f1: 0.4652
 epoch: 1, train_loss: 1.0517, test_loss: 0.9311, test_f1: 0.5267
 epoch: 2, train_loss: 0.9766, test_loss: 0.9024, test_f1: 0.5514
 epoch: 3, train_loss: 0.9665, test_loss: 0.9428, test_f1: 0.5403
 epoch: 4, train_loss: 0.9659, test_loss: 0.9140, test_f1: 0.5384
 epoch: 5, train_loss: 0.9436, test_loss: 0.9721, test_f1: 0.4946
 epoch: 6, train_loss: 0.9271, test_loss: 0.9375, test_f1: 0.5713
 epoch: 7, train_loss: 0.9136, test_loss: 0.9205, test_f1: 0.5567
 epoch: 8, train_loss: 0.9025, test_loss: 0.9663, test_f1: 0.5559
 epoch: 9, train_loss: 0.8942, test_loss: 0.9729, test_f1: 0.5295
 epoch: 10, train_loss: 0.8947, test_loss: 0.9552, test_f1: 0.5896
 epoch: 11, train_loss: 0.8673, test_loss: 0.9991, test_f1: 0.5548
 epoch: 12, train_loss: 0.8577, test_loss: 0.9782, test_f1: 0.5341
 epoch: 13, train_loss: 0.8468, test_loss: 0.8938, test_f1: 0.5886
 epoch: 14, train_loss: 0.8328, test_loss: 0.9698, test_f1: 0.5675
 epoch: 15, train_loss: 0.8193, test_loss: 0.9674, test_f1: 0.5780
 epoch: 16, train_loss: 0.8030, test_loss: 0.9213, test_f1: 0.5677
 epoch: 17, train_loss: 0.8031, test_loss: 1.0039, test_f1: 0.5339
 epoch: 18, train_loss: 0.8111, test_loss: 0.9859, test_f1: 0.5678
 epoch: 19, train_loss: 0.7985, test_loss: 0.9714, test_f1: 0.5795
 epoch: 20, train_loss: 0.7843, test_loss: 0.9560, test_f1: 0.5963
 epoch: 21, train_loss: 0.7593, test_loss: 1.0188, test_f1: 0.5786
 epoch: 22, train_loss: 0.7615, test_loss: 0.8960, test_f1: 0.5997
 epoch: 23, train_loss: 0.7768, test_loss: 0.9064, test_f1: 0.5760
 epoch: 24, train_loss: 0.7729, test_loss: 0.9519, test_f1: 0.5613
 epoch: 25, train_loss: 0.7406, test_loss: 0.9396, test_f1: 0.6076
 epoch: 26, train_loss: 0.7427, test_loss: 0.9704, test_f1: 0.6028
 epoch: 27, train_loss: 0.7342, test_loss: 0.9447, test_f1: 0.6196
 epoch: 28, train_loss: 0.7257, test_loss: 0.9691, test_f1: 0.5921
 epoch: 29, train_loss: 0.7225, test_loss: 0.9408, test_f1: 0.5575
 epoch: 30, train_loss: 0.7200, test_loss: 0.9562, test_f1: 0.5957
 epoch: 31, train_loss: 0.7164, test_loss: 0.9269, test_f1: 0.5886
 epoch: 32, train_loss: 0.7114, test_loss: 0.9340, test_f1: 0.6222
 epoch: 33, train_loss: 0.7180, test_loss: 0.9074, test_f1: 0.6090
 epoch: 34, train_loss: 0.7112, test_loss: 0.9540, test_f1: 0.5967
 epoch: 35, train_loss: 0.6888, test_loss: 0.9522, test_f1: 0.6091
 epoch: 36, train_loss: 0.6692, test_loss: 0.8921, test_f1: 0.6073
 epoch: 37, train_loss: 0.6853, test_loss: 0.9569, test_f1: 0.6016
 epoch: 38, train_loss: 0.6756, test_loss: 0.9409, test_f1: 0.5897
 epoch: 39, train_loss: 0.6809, test_loss: 1.0291, test_f1: 0.5928
 epoch: 40, train_loss: 0.6585, test_loss: 0.9551, test_f1: 0.5897
 epoch: 41, train_loss: 0.6517, test_loss: 0.9574, test_f1: 0.6139
 epoch: 42, train_loss: 0.6682, test_loss: 0.9572, test_f1: 0.6088
 epoch: 43, train_loss: 0.6478, test_loss: 0.9346, test_f1: 0.6212
 epoch: 44, train_loss: 0.6482, test_loss: 1.0210, test_f1: 0.6023
 epoch: 45, train_loss: 0.6353, test_loss: 0.9645, test_f1: 0.6092
 epoch: 46, train_loss: 0.6411, test_loss: 0.9806, test_f1: 0.6332
 epoch: 47, train_loss: 0.6376, test_loss: 1.0621, test_f1: 0.6004
 epoch: 48, train_loss: 0.6363, test_loss: 1.0014, test_f1: 0.6491
 epoch: 49, train_loss: 0.6000, test_loss: 1.0226, test_f1: 0.6401
 epoch: 50, train_loss: 0.6014, test_loss: 1.0036, test_f1: 0.6162
 epoch: 51, train_loss: 0.5880, test_loss: 0.9738, test_f1: 0.6348
 epoch: 52, train_loss: 0.5726, test_loss: 1.0017, test_f1: 0.6246
 epoch: 53, train_loss: 0.5517, test_loss: 0.9945, test_f1: 0.6431
 epoch: 54, train_loss: 0.5272, test_loss: 0.9684, test_f1: 0.6413
 epoch: 55, train_loss: 0.5233, test_loss: 1.0054, test_f1: 0.6625
 epoch: 56, train_loss: 0.5314, test_loss: 0.9810, test_f1: 0.6599
 epoch: 57, train_loss: 0.5283, test_loss: 1.0091, test_f1: 0.6575
 epoch: 58, train_loss: 0.5156, test_loss: 0.9906, test_f1: 0.6502
 epoch: 59, train_loss: 0.5155, test_loss: 1.0419, test_f1: 0.6515
 epoch: 60, train_loss: 0.5023, test_loss: 1.0288, test_f1: 0.6443
 epoch: 61, train_loss: 0.4862, test_loss: 1.0611, test_f1: 0.6662
 epoch: 62, train_loss: 0.4960, test_loss: 1.0766, test_f1: 0.6418
 epoch: 63, train_loss: 0.4869, test_loss: 1.1015, test_f1: 0.6586
 epoch: 64, train_loss: 0.4825, test_loss: 1.0713, test_f1: 0.6556
 epoch: 65, train_loss: 0.4819, test_loss: 1.1038, test_f1: 0.6498
 epoch: 66, train_loss: 0.4751, test_loss: 1.0710, test_f1: 0.6657
 epoch: 67, train_loss: 0.4714, test_loss: 1.0976, test_f1: 0.6422
 epoch: 68, train_loss: 0.4616, test_loss: 1.1274, test_f1: 0.6407
 epoch: 69, train_loss: 0.4583, test_loss: 1.1536, test_f1: 0.6496
 epoch: 70, train_loss: 0.4651, test_loss: 1.0786, test_f1: 0.6448
 epoch: 71, train_loss: 0.4473, test_loss: 1.0874, test_f1: 0.6671
 epoch: 72, train_loss: 0.4342, test_loss: 1.1627, test_f1: 0.6201
 epoch: 73, train_loss: 0.4449, test_loss: 1.1921, test_f1: 0.6157
 epoch: 74, train_loss: 0.4494, test_loss: 1.1254, test_f1: 0.6753
 epoch: 75, train_loss: 0.4396, test_loss: 1.1935, test_f1: 0.6527
 epoch: 76, train_loss: 0.4458, test_loss: 1.1380, test_f1: 0.6420
 epoch: 77, train_loss: 0.4235, test_loss: 1.1487, test_f1: 0.6472
 epoch: 78, train_loss: 0.4247, test_loss: 1.1682, test_f1: 0.6716
 epoch: 79, train_loss: 0.4036, test_loss: 1.1955, test_f1: 0.6662
 epoch: 80, train_loss: 0.4283, test_loss: 1.1392, test_f1: 0.6687
 epoch: 81, train_loss: 0.4007, test_loss: 1.1077, test_f1: 0.6339
 epoch: 82, train_loss: 0.4098, test_loss: 1.1165, test_f1: 0.6706
 epoch: 83, train_loss: 0.4300, test_loss: 1.2174, test_f1: 0.6442
 epoch: 84, train_loss: 0.4118, test_loss: 1.1387, test_f1: 0.6808
 epoch: 85, train_loss: 0.4186, test_loss: 1.1622, test_f1: 0.6467
 epoch: 86, train_loss: 0.4098, test_loss: 1.1896, test_f1: 0.6481
 epoch: 87, train_loss: 0.3770, test_loss: 1.2275, test_f1: 0.6434
 epoch: 88, train_loss: 0.4091, test_loss: 1.2799, test_f1: 0.6541
 epoch: 89, train_loss: 0.3686, test_loss: 1.2197, test_f1: 0.6170
 epoch: 90, train_loss: 0.3751, test_loss: 1.2101, test_f1: 0.6509
 epoch: 91, train_loss: 0.3935, test_loss: 1.2134, test_f1: 0.6624
 epoch: 92, train_loss: 0.3966, test_loss: 1.2867, test_f1: 0.6462
 epoch: 93, train_loss: 0.3884, test_loss: 1.2053, test_f1: 0.6346
 epoch: 94, train_loss: 0.3808, test_loss: 1.2640, test_f1: 0.6545
 epoch: 95, train_loss: 0.3959, test_loss: 1.2627, test_f1: 0.6409
 epoch: 96, train_loss: 0.3629, test_loss: 1.2431, test_f1: 0.6506
 epoch: 97, train_loss: 0.3575, test_loss: 1.2342, test_f1: 0.6696
 epoch: 98, train_loss: 0.3719, test_loss: 1.3315, test_f1: 0.6655
 epoch: 99, train_loss: 0.3817, test_loss: 1.3161, test_f1: 0.6587
##################ITERATION #6 ****************************************
 epoch: 0, train_loss: 1.3589, test_loss: 1.0277, test_f1: 0.4974
 epoch: 1, train_loss: 1.0406, test_loss: 1.0004, test_f1: 0.4946
 epoch: 2, train_loss: 1.0074, test_loss: 0.9571, test_f1: 0.5109
 epoch: 3, train_loss: 0.9755, test_loss: 0.9662, test_f1: 0.4989
 epoch: 4, train_loss: 0.9656, test_loss: 0.9373, test_f1: 0.4990
 epoch: 5, train_loss: 0.9574, test_loss: 0.9419, test_f1: 0.4999
 epoch: 6, train_loss: 0.9054, test_loss: 0.9193, test_f1: 0.5141
 epoch: 7, train_loss: 0.9128, test_loss: 0.9302, test_f1: 0.5233
 epoch: 8, train_loss: 0.9082, test_loss: 0.9531, test_f1: 0.5395
 epoch: 9, train_loss: 0.9032, test_loss: 0.9281, test_f1: 0.5604
 epoch: 10, train_loss: 0.8804, test_loss: 0.9343, test_f1: 0.5323
 epoch: 11, train_loss: 0.8725, test_loss: 0.9307, test_f1: 0.5407
 epoch: 12, train_loss: 0.8600, test_loss: 0.9220, test_f1: 0.5579
 epoch: 13, train_loss: 0.8644, test_loss: 0.9650, test_f1: 0.5517
 epoch: 14, train_loss: 0.8360, test_loss: 0.9683, test_f1: 0.5361
 epoch: 15, train_loss: 0.8250, test_loss: 0.9323, test_f1: 0.5745
 epoch: 16, train_loss: 0.8220, test_loss: 0.9280, test_f1: 0.5537
 epoch: 17, train_loss: 0.8144, test_loss: 0.9618, test_f1: 0.5614
 epoch: 18, train_loss: 0.8283, test_loss: 0.9091, test_f1: 0.5546
 epoch: 19, train_loss: 0.8129, test_loss: 0.9398, test_f1: 0.5612
 epoch: 20, train_loss: 0.8196, test_loss: 0.9277, test_f1: 0.5491
 epoch: 21, train_loss: 0.7872, test_loss: 0.9679, test_f1: 0.5398
 epoch: 22, train_loss: 0.7936, test_loss: 0.9249, test_f1: 0.5704
 epoch: 23, train_loss: 0.7726, test_loss: 0.9710, test_f1: 0.5823
 epoch: 24, train_loss: 0.7976, test_loss: 0.9293, test_f1: 0.5809
 epoch: 25, train_loss: 0.7882, test_loss: 0.9625, test_f1: 0.5916
 epoch: 26, train_loss: 0.7676, test_loss: 0.9535, test_f1: 0.5861
 epoch: 27, train_loss: 0.7596, test_loss: 0.9150, test_f1: 0.6291
 epoch: 28, train_loss: 0.7700, test_loss: 0.9219, test_f1: 0.5920
 epoch: 29, train_loss: 0.7841, test_loss: 1.0312, test_f1: 0.5823
 epoch: 30, train_loss: 0.7430, test_loss: 0.9244, test_f1: 0.5974
 epoch: 31, train_loss: 0.7374, test_loss: 0.9241, test_f1: 0.5921
 epoch: 32, train_loss: 0.7332, test_loss: 0.9103, test_f1: 0.5962
 epoch: 33, train_loss: 0.7287, test_loss: 0.9678, test_f1: 0.5988
 epoch: 34, train_loss: 0.7258, test_loss: 0.9904, test_f1: 0.5951
 epoch: 35, train_loss: 0.7044, test_loss: 0.9694, test_f1: 0.5712
 epoch: 36, train_loss: 0.7035, test_loss: 0.9628, test_f1: 0.6349
 epoch: 37, train_loss: 0.6991, test_loss: 0.9829, test_f1: 0.6047
 epoch: 38, train_loss: 0.6854, test_loss: 0.9748, test_f1: 0.5848
 epoch: 39, train_loss: 0.6946, test_loss: 1.0716, test_f1: 0.5910
 epoch: 40, train_loss: 0.6758, test_loss: 0.8558, test_f1: 0.6139
 epoch: 41, train_loss: 0.6851, test_loss: 0.9577, test_f1: 0.6252
 epoch: 42, train_loss: 0.6828, test_loss: 0.9636, test_f1: 0.5660
 epoch: 43, train_loss: 0.6632, test_loss: 0.9259, test_f1: 0.6197
 epoch: 44, train_loss: 0.6464, test_loss: 0.9794, test_f1: 0.6060
 epoch: 45, train_loss: 0.6859, test_loss: 0.9623, test_f1: 0.6213
 epoch: 46, train_loss: 0.6563, test_loss: 0.9431, test_f1: 0.6235
 epoch: 47, train_loss: 0.6421, test_loss: 0.9372, test_f1: 0.6043
 epoch: 48, train_loss: 0.6376, test_loss: 1.0784, test_f1: 0.5870
 epoch: 49, train_loss: 0.6394, test_loss: 1.0535, test_f1: 0.5873
 epoch: 50, train_loss: 0.6423, test_loss: 1.0702, test_f1: 0.5676
 epoch: 51, train_loss: 0.6043, test_loss: 0.9710, test_f1: 0.6089
 epoch: 52, train_loss: 0.5829, test_loss: 0.9768, test_f1: 0.6167
 epoch: 53, train_loss: 0.5619, test_loss: 0.9894, test_f1: 0.6397
 epoch: 54, train_loss: 0.5656, test_loss: 1.0086, test_f1: 0.6431
 epoch: 55, train_loss: 0.5392, test_loss: 1.0062, test_f1: 0.6163
 epoch: 56, train_loss: 0.5464, test_loss: 1.0747, test_f1: 0.6216
 epoch: 57, train_loss: 0.5502, test_loss: 1.0300, test_f1: 0.6201
 epoch: 58, train_loss: 0.5122, test_loss: 1.0501, test_f1: 0.6510
 epoch: 59, train_loss: 0.5299, test_loss: 1.0365, test_f1: 0.6223
 epoch: 60, train_loss: 0.5246, test_loss: 1.0285, test_f1: 0.6144
 epoch: 61, train_loss: 0.5187, test_loss: 1.0411, test_f1: 0.6147
 epoch: 62, train_loss: 0.5194, test_loss: 1.1046, test_f1: 0.6253
 epoch: 63, train_loss: 0.5026, test_loss: 1.1399, test_f1: 0.6114
 epoch: 64, train_loss: 0.5138, test_loss: 1.1118, test_f1: 0.6332
 epoch: 65, train_loss: 0.5229, test_loss: 1.0721, test_f1: 0.6207
 epoch: 66, train_loss: 0.5144, test_loss: 1.0825, test_f1: 0.6210
 epoch: 67, train_loss: 0.4817, test_loss: 1.0666, test_f1: 0.6429
 epoch: 68, train_loss: 0.4904, test_loss: 1.1591, test_f1: 0.6364
 epoch: 69, train_loss: 0.4869, test_loss: 1.1955, test_f1: 0.6272
 epoch: 70, train_loss: 0.4619, test_loss: 1.1076, test_f1: 0.6228
 epoch: 71, train_loss: 0.4697, test_loss: 1.0927, test_f1: 0.6219
 epoch: 72, train_loss: 0.4727, test_loss: 1.1497, test_f1: 0.6218
 epoch: 73, train_loss: 0.4865, test_loss: 1.1977, test_f1: 0.6442
 epoch: 74, train_loss: 0.4535, test_loss: 1.1204, test_f1: 0.6251
 epoch: 75, train_loss: 0.4670, test_loss: 1.1522, test_f1: 0.6525
 epoch: 76, train_loss: 0.4577, test_loss: 1.0835, test_f1: 0.6326
 epoch: 77, train_loss: 0.4461, test_loss: 1.2129, test_f1: 0.6032
 epoch: 78, train_loss: 0.4434, test_loss: 1.1888, test_f1: 0.6415
 epoch: 79, train_loss: 0.4539, test_loss: 1.1918, test_f1: 0.6427
 epoch: 80, train_loss: 0.4323, test_loss: 1.1813, test_f1: 0.6491
 epoch: 81, train_loss: 0.4319, test_loss: 1.1894, test_f1: 0.6304
 epoch: 82, train_loss: 0.4210, test_loss: 1.2745, test_f1: 0.6465
 epoch: 83, train_loss: 0.4362, test_loss: 1.1839, test_f1: 0.6553
 epoch: 84, train_loss: 0.4349, test_loss: 1.1781, test_f1: 0.6715
 epoch: 85, train_loss: 0.4174, test_loss: 1.2022, test_f1: 0.6453
 epoch: 86, train_loss: 0.4303, test_loss: 1.2827, test_f1: 0.6170
 epoch: 87, train_loss: 0.4051, test_loss: 1.2152, test_f1: 0.6357
 epoch: 88, train_loss: 0.4087, test_loss: 1.2625, test_f1: 0.6254
 epoch: 89, train_loss: 0.4184, test_loss: 1.2353, test_f1: 0.6446
 epoch: 90, train_loss: 0.4085, test_loss: 1.1204, test_f1: 0.6590
 epoch: 91, train_loss: 0.4161, test_loss: 1.3488, test_f1: 0.6325
 epoch: 92, train_loss: 0.4006, test_loss: 1.3037, test_f1: 0.6372
 epoch: 93, train_loss: 0.3968, test_loss: 1.2489, test_f1: 0.6348
 epoch: 94, train_loss: 0.3893, test_loss: 1.2857, test_f1: 0.6398
 epoch: 95, train_loss: 0.3780, test_loss: 1.3072, test_f1: 0.6298
 epoch: 96, train_loss: 0.3975, test_loss: 1.3408, test_f1: 0.6179
 epoch: 97, train_loss: 0.3779, test_loss: 1.2063, test_f1: 0.6423
 epoch: 98, train_loss: 0.3782, test_loss: 1.2995, test_f1: 0.6252
 epoch: 99, train_loss: 0.3772, test_loss: 1.3594, test_f1: 0.6448
##################ITERATION #7 ****************************************
 epoch: 0, train_loss: 1.3583, test_loss: 1.1191, test_f1: 0.4116
 epoch: 1, train_loss: 1.0385, test_loss: 0.9687, test_f1: 0.5337
 epoch: 2, train_loss: 0.9819, test_loss: 0.9580, test_f1: 0.5126
 epoch: 3, train_loss: 0.9536, test_loss: 0.9064, test_f1: 0.5139
 epoch: 4, train_loss: 0.9239, test_loss: 0.9440, test_f1: 0.5048
 epoch: 5, train_loss: 0.9221, test_loss: 0.9339, test_f1: 0.5036
 epoch: 6, train_loss: 0.9042, test_loss: 0.9520, test_f1: 0.5263
 epoch: 7, train_loss: 0.8904, test_loss: 0.9663, test_f1: 0.5541
 epoch: 8, train_loss: 0.8768, test_loss: 0.9383, test_f1: 0.5459
 epoch: 9, train_loss: 0.8628, test_loss: 0.9142, test_f1: 0.5481
 epoch: 10, train_loss: 0.8517, test_loss: 0.9094, test_f1: 0.5563
 epoch: 11, train_loss: 0.8349, test_loss: 0.9143, test_f1: 0.5703
 epoch: 12, train_loss: 0.8328, test_loss: 0.9462, test_f1: 0.5347
 epoch: 13, train_loss: 0.8267, test_loss: 0.9130, test_f1: 0.5769
 epoch: 14, train_loss: 0.8022, test_loss: 0.8987, test_f1: 0.5899
 epoch: 15, train_loss: 0.8023, test_loss: 0.9143, test_f1: 0.5840
 epoch: 16, train_loss: 0.8015, test_loss: 0.8843, test_f1: 0.5810
 epoch: 17, train_loss: 0.8057, test_loss: 0.9027, test_f1: 0.5817
 epoch: 18, train_loss: 0.7805, test_loss: 0.8992, test_f1: 0.6122
 epoch: 19, train_loss: 0.7843, test_loss: 0.9088, test_f1: 0.6336
 epoch: 20, train_loss: 0.7682, test_loss: 0.8859, test_f1: 0.5762
 epoch: 21, train_loss: 0.7793, test_loss: 0.8928, test_f1: 0.6231
 epoch: 22, train_loss: 0.7514, test_loss: 0.9099, test_f1: 0.5831
 epoch: 23, train_loss: 0.7436, test_loss: 0.9522, test_f1: 0.6155
 epoch: 24, train_loss: 0.7381, test_loss: 0.8753, test_f1: 0.6396
 epoch: 25, train_loss: 0.7336, test_loss: 0.9462, test_f1: 0.5968
 epoch: 26, train_loss: 0.7298, test_loss: 0.9515, test_f1: 0.5688
 epoch: 27, train_loss: 0.7125, test_loss: 0.9350, test_f1: 0.6200
 epoch: 28, train_loss: 0.7105, test_loss: 0.9046, test_f1: 0.5983
 epoch: 29, train_loss: 0.7004, test_loss: 0.9550, test_f1: 0.6716
 epoch: 30, train_loss: 0.6872, test_loss: 0.9522, test_f1: 0.6106
 epoch: 31, train_loss: 0.6982, test_loss: 0.9442, test_f1: 0.5946
 epoch: 32, train_loss: 0.6741, test_loss: 0.9856, test_f1: 0.6032
 epoch: 33, train_loss: 0.6826, test_loss: 1.0366, test_f1: 0.6015
 epoch: 34, train_loss: 0.6764, test_loss: 1.0256, test_f1: 0.6077
 epoch: 35, train_loss: 0.6790, test_loss: 1.0083, test_f1: 0.5787
 epoch: 36, train_loss: 0.6727, test_loss: 0.9248, test_f1: 0.6240
 epoch: 37, train_loss: 0.6729, test_loss: 0.9672, test_f1: 0.6004
 epoch: 38, train_loss: 0.6752, test_loss: 0.9122, test_f1: 0.6172
 epoch: 39, train_loss: 0.6442, test_loss: 0.9827, test_f1: 0.5968
 epoch: 40, train_loss: 0.6393, test_loss: 0.9553, test_f1: 0.6147
 epoch: 41, train_loss: 0.6452, test_loss: 0.9529, test_f1: 0.6205
 epoch: 42, train_loss: 0.6417, test_loss: 0.9467, test_f1: 0.6395
 epoch: 43, train_loss: 0.6294, test_loss: 0.9149, test_f1: 0.6307
 epoch: 44, train_loss: 0.6367, test_loss: 0.9476, test_f1: 0.6260
 epoch: 45, train_loss: 0.6141, test_loss: 0.9338, test_f1: 0.6308
 epoch: 46, train_loss: 0.5982, test_loss: 1.0001, test_f1: 0.5914
 epoch: 47, train_loss: 0.6205, test_loss: 1.0092, test_f1: 0.6124
 epoch: 48, train_loss: 0.6076, test_loss: 0.9392, test_f1: 0.6113
 epoch: 49, train_loss: 0.6078, test_loss: 1.0040, test_f1: 0.5939
 epoch: 50, train_loss: 0.5987, test_loss: 0.9272, test_f1: 0.6260
 epoch: 51, train_loss: 0.5750, test_loss: 0.9190, test_f1: 0.6457
 epoch: 52, train_loss: 0.5363, test_loss: 0.9460, test_f1: 0.6456
 epoch: 53, train_loss: 0.5121, test_loss: 0.9544, test_f1: 0.6204
 epoch: 54, train_loss: 0.5117, test_loss: 0.9735, test_f1: 0.6541
 epoch: 55, train_loss: 0.5118, test_loss: 0.9112, test_f1: 0.6603
 epoch: 56, train_loss: 0.5082, test_loss: 1.0049, test_f1: 0.6249
 epoch: 57, train_loss: 0.5098, test_loss: 1.0025, test_f1: 0.6597
 epoch: 58, train_loss: 0.4872, test_loss: 1.0149, test_f1: 0.6218
 epoch: 59, train_loss: 0.4909, test_loss: 0.9707, test_f1: 0.6606
 epoch: 60, train_loss: 0.4838, test_loss: 1.0068, test_f1: 0.6300
 epoch: 61, train_loss: 0.4645, test_loss: 1.0843, test_f1: 0.6325
 epoch: 62, train_loss: 0.4671, test_loss: 1.0301, test_f1: 0.6378
 epoch: 63, train_loss: 0.4640, test_loss: 1.0745, test_f1: 0.6297
 epoch: 64, train_loss: 0.4614, test_loss: 0.9988, test_f1: 0.6421
 epoch: 65, train_loss: 0.4564, test_loss: 1.0357, test_f1: 0.6289
 epoch: 66, train_loss: 0.4513, test_loss: 1.1176, test_f1: 0.6446
 epoch: 67, train_loss: 0.4652, test_loss: 1.0384, test_f1: 0.6319
 epoch: 68, train_loss: 0.4619, test_loss: 1.0085, test_f1: 0.6540
 epoch: 69, train_loss: 0.4440, test_loss: 1.0842, test_f1: 0.6344
 epoch: 70, train_loss: 0.4335, test_loss: 1.0469, test_f1: 0.6601
 epoch: 71, train_loss: 0.4471, test_loss: 1.0436, test_f1: 0.6566
 epoch: 72, train_loss: 0.4242, test_loss: 1.0359, test_f1: 0.6631
 epoch: 73, train_loss: 0.4432, test_loss: 0.9532, test_f1: 0.6565
 epoch: 74, train_loss: 0.4142, test_loss: 1.0312, test_f1: 0.6544
 epoch: 75, train_loss: 0.4080, test_loss: 1.1846, test_f1: 0.6355
 epoch: 76, train_loss: 0.4163, test_loss: 1.0792, test_f1: 0.6513
 epoch: 77, train_loss: 0.4076, test_loss: 1.0659, test_f1: 0.6638
 epoch: 78, train_loss: 0.4161, test_loss: 1.0825, test_f1: 0.6365
 epoch: 79, train_loss: 0.4117, test_loss: 1.1518, test_f1: 0.6150
 epoch: 80, train_loss: 0.3898, test_loss: 1.2341, test_f1: 0.6291
 epoch: 81, train_loss: 0.3961, test_loss: 1.1451, test_f1: 0.6738
 epoch: 82, train_loss: 0.3959, test_loss: 1.1043, test_f1: 0.6699
 epoch: 83, train_loss: 0.3825, test_loss: 1.1554, test_f1: 0.6838
 epoch: 84, train_loss: 0.3509, test_loss: 1.0758, test_f1: 0.6580
 epoch: 85, train_loss: 0.3735, test_loss: 1.1009, test_f1: 0.6658
 epoch: 86, train_loss: 0.3904, test_loss: 1.2291, test_f1: 0.6453
 epoch: 87, train_loss: 0.3854, test_loss: 1.1237, test_f1: 0.6585
 epoch: 88, train_loss: 0.3663, test_loss: 1.1425, test_f1: 0.6572
 epoch: 89, train_loss: 0.3605, test_loss: 1.1924, test_f1: 0.6596
 epoch: 90, train_loss: 0.3599, test_loss: 1.1592, test_f1: 0.6588
 epoch: 91, train_loss: 0.3601, test_loss: 1.1881, test_f1: 0.6515
 epoch: 92, train_loss: 0.3680, test_loss: 1.1567, test_f1: 0.6644
 epoch: 93, train_loss: 0.3548, test_loss: 1.1612, test_f1: 0.6438
 epoch: 94, train_loss: 0.3473, test_loss: 1.1709, test_f1: 0.6434
 epoch: 95, train_loss: 0.3531, test_loss: 1.2074, test_f1: 0.6422
 epoch: 96, train_loss: 0.3656, test_loss: 1.1972, test_f1: 0.6401
 epoch: 97, train_loss: 0.3488, test_loss: 1.1991, test_f1: 0.6554
 epoch: 98, train_loss: 0.3659, test_loss: 1.2160, test_f1: 0.6734
 epoch: 99, train_loss: 0.3370, test_loss: 1.2294, test_f1: 0.6562
##################ITERATION #8 ****************************************
 epoch: 0, train_loss: 1.3935, test_loss: 1.1036, test_f1: 0.3782
 epoch: 1, train_loss: 1.0531, test_loss: 0.9910, test_f1: 0.4810
 epoch: 2, train_loss: 0.9801, test_loss: 0.9637, test_f1: 0.4627
 epoch: 3, train_loss: 0.9719, test_loss: 0.9860, test_f1: 0.4815
 epoch: 4, train_loss: 0.9492, test_loss: 0.9752, test_f1: 0.4980
 epoch: 5, train_loss: 0.9310, test_loss: 1.0047, test_f1: 0.5330
 epoch: 6, train_loss: 0.9073, test_loss: 0.9849, test_f1: 0.5273
 epoch: 7, train_loss: 0.8932, test_loss: 0.9489, test_f1: 0.5181
 epoch: 8, train_loss: 0.8882, test_loss: 0.8921, test_f1: 0.5446
 epoch: 9, train_loss: 0.8679, test_loss: 0.9292, test_f1: 0.5488
 epoch: 10, train_loss: 0.8573, test_loss: 0.9303, test_f1: 0.5398
 epoch: 11, train_loss: 0.8565, test_loss: 1.0520, test_f1: 0.4993
 epoch: 12, train_loss: 0.8522, test_loss: 0.9190, test_f1: 0.5432
 epoch: 13, train_loss: 0.8297, test_loss: 0.9354, test_f1: 0.5503
 epoch: 14, train_loss: 0.8425, test_loss: 0.9265, test_f1: 0.5261
 epoch: 15, train_loss: 0.8207, test_loss: 0.8565, test_f1: 0.5596
 epoch: 16, train_loss: 0.8141, test_loss: 0.9022, test_f1: 0.5746
 epoch: 17, train_loss: 0.7980, test_loss: 0.9171, test_f1: 0.6171
 epoch: 18, train_loss: 0.8005, test_loss: 0.9304, test_f1: 0.5796
 epoch: 19, train_loss: 0.7851, test_loss: 0.9202, test_f1: 0.5873
 epoch: 20, train_loss: 0.7821, test_loss: 0.9637, test_f1: 0.5726
 epoch: 21, train_loss: 0.7737, test_loss: 0.9422, test_f1: 0.5776
 epoch: 22, train_loss: 0.7717, test_loss: 0.8840, test_f1: 0.5560
 epoch: 23, train_loss: 0.7892, test_loss: 0.9687, test_f1: 0.5668
 epoch: 24, train_loss: 0.7644, test_loss: 0.9422, test_f1: 0.5908
 epoch: 25, train_loss: 0.7661, test_loss: 0.9204, test_f1: 0.5990
 epoch: 26, train_loss: 0.7488, test_loss: 0.9870, test_f1: 0.6101
 epoch: 27, train_loss: 0.7406, test_loss: 0.9846, test_f1: 0.5862
 epoch: 28, train_loss: 0.7595, test_loss: 0.9234, test_f1: 0.5781
 epoch: 29, train_loss: 0.7424, test_loss: 0.8781, test_f1: 0.5981
 epoch: 30, train_loss: 0.7432, test_loss: 0.9227, test_f1: 0.5664
 epoch: 31, train_loss: 0.7155, test_loss: 0.9019, test_f1: 0.6114
 epoch: 32, train_loss: 0.7304, test_loss: 0.8982, test_f1: 0.5764
 epoch: 33, train_loss: 0.7095, test_loss: 1.1240, test_f1: 0.5567
 epoch: 34, train_loss: 0.7319, test_loss: 0.9743, test_f1: 0.5893
 epoch: 35, train_loss: 0.7000, test_loss: 0.9670, test_f1: 0.5897
 epoch: 36, train_loss: 0.7046, test_loss: 0.9044, test_f1: 0.5996
 epoch: 37, train_loss: 0.6849, test_loss: 0.9761, test_f1: 0.5960
 epoch: 38, train_loss: 0.6791, test_loss: 0.9812, test_f1: 0.6240
 epoch: 39, train_loss: 0.7018, test_loss: 0.8542, test_f1: 0.6233
 epoch: 40, train_loss: 0.6963, test_loss: 0.9125, test_f1: 0.5975
 epoch: 41, train_loss: 0.6629, test_loss: 1.0134, test_f1: 0.5878
 epoch: 42, train_loss: 0.6638, test_loss: 1.0047, test_f1: 0.6222
 epoch: 43, train_loss: 0.6723, test_loss: 0.9245, test_f1: 0.6208
 epoch: 44, train_loss: 0.6553, test_loss: 1.0446, test_f1: 0.6085
 epoch: 45, train_loss: 0.6587, test_loss: 0.9435, test_f1: 0.6171
 epoch: 46, train_loss: 0.6307, test_loss: 1.0178, test_f1: 0.6389
 epoch: 47, train_loss: 0.6324, test_loss: 1.0482, test_f1: 0.6551
 epoch: 48, train_loss: 0.6361, test_loss: 1.0761, test_f1: 0.6369
 epoch: 49, train_loss: 0.6290, test_loss: 1.0359, test_f1: 0.6043
 epoch: 50, train_loss: 0.6131, test_loss: 1.0559, test_f1: 0.5897
 epoch: 51, train_loss: 0.6022, test_loss: 1.0457, test_f1: 0.6386
 epoch: 52, train_loss: 0.5796, test_loss: 1.0464, test_f1: 0.6551
 epoch: 53, train_loss: 0.5443, test_loss: 1.0377, test_f1: 0.6488
 epoch: 54, train_loss: 0.5574, test_loss: 1.0606, test_f1: 0.6553
 epoch: 55, train_loss: 0.5347, test_loss: 1.1027, test_f1: 0.6635
 epoch: 56, train_loss: 0.5413, test_loss: 1.0771, test_f1: 0.6578
 epoch: 57, train_loss: 0.5328, test_loss: 1.0686, test_f1: 0.6316
 epoch: 58, train_loss: 0.5253, test_loss: 1.1014, test_f1: 0.6613
 epoch: 59, train_loss: 0.5228, test_loss: 1.1195, test_f1: 0.6598
 epoch: 60, train_loss: 0.5024, test_loss: 1.0732, test_f1: 0.6532
 epoch: 61, train_loss: 0.4967, test_loss: 1.1102, test_f1: 0.6474
 epoch: 62, train_loss: 0.5138, test_loss: 1.0918, test_f1: 0.6606
 epoch: 63, train_loss: 0.4919, test_loss: 1.0872, test_f1: 0.6550
 epoch: 64, train_loss: 0.5205, test_loss: 1.0556, test_f1: 0.6470
 epoch: 65, train_loss: 0.5145, test_loss: 1.1231, test_f1: 0.6522
 epoch: 66, train_loss: 0.4874, test_loss: 1.1022, test_f1: 0.6774
 epoch: 67, train_loss: 0.5007, test_loss: 1.0499, test_f1: 0.6923
 epoch: 68, train_loss: 0.4786, test_loss: 1.0748, test_f1: 0.6708
 epoch: 69, train_loss: 0.4734, test_loss: 1.1124, test_f1: 0.6688
 epoch: 70, train_loss: 0.4740, test_loss: 1.1072, test_f1: 0.6651
 epoch: 71, train_loss: 0.4787, test_loss: 1.0666, test_f1: 0.6653
 epoch: 72, train_loss: 0.4641, test_loss: 1.1404, test_f1: 0.6459
 epoch: 73, train_loss: 0.4583, test_loss: 1.1660, test_f1: 0.6571
 epoch: 74, train_loss: 0.4469, test_loss: 1.0882, test_f1: 0.6520
 epoch: 75, train_loss: 0.4615, test_loss: 1.1630, test_f1: 0.6527
 epoch: 76, train_loss: 0.4492, test_loss: 1.1125, test_f1: 0.6703
 epoch: 77, train_loss: 0.4416, test_loss: 1.1672, test_f1: 0.6495
 epoch: 78, train_loss: 0.4482, test_loss: 1.1045, test_f1: 0.6742
 epoch: 79, train_loss: 0.4335, test_loss: 1.1617, test_f1: 0.6715
 epoch: 80, train_loss: 0.4365, test_loss: 1.1723, test_f1: 0.6812
 epoch: 81, train_loss: 0.4312, test_loss: 1.1848, test_f1: 0.6914
 epoch: 82, train_loss: 0.4209, test_loss: 1.2066, test_f1: 0.6774
 epoch: 83, train_loss: 0.4255, test_loss: 1.1888, test_f1: 0.6668
 epoch: 84, train_loss: 0.4338, test_loss: 1.2092, test_f1: 0.6768
 epoch: 85, train_loss: 0.4019, test_loss: 1.1904, test_f1: 0.6901
 epoch: 86, train_loss: 0.4073, test_loss: 1.2211, test_f1: 0.6774
 epoch: 87, train_loss: 0.4151, test_loss: 1.2054, test_f1: 0.6625
 epoch: 88, train_loss: 0.4019, test_loss: 1.2175, test_f1: 0.6922
 epoch: 89, train_loss: 0.3978, test_loss: 1.2538, test_f1: 0.6709
 epoch: 90, train_loss: 0.3959, test_loss: 1.3229, test_f1: 0.6826
 epoch: 91, train_loss: 0.3978, test_loss: 1.3220, test_f1: 0.6674
 epoch: 92, train_loss: 0.3730, test_loss: 1.2710, test_f1: 0.6728
 epoch: 93, train_loss: 0.3924, test_loss: 1.2799, test_f1: 0.6644
 epoch: 94, train_loss: 0.3853, test_loss: 1.2857, test_f1: 0.6607
 epoch: 95, train_loss: 0.3768, test_loss: 1.2587, test_f1: 0.6865
 epoch: 96, train_loss: 0.3781, test_loss: 1.2859, test_f1: 0.6896
 epoch: 97, train_loss: 0.3668, test_loss: 1.3070, test_f1: 0.6776
 epoch: 98, train_loss: 0.3731, test_loss: 1.3151, test_f1: 0.6873
 epoch: 99, train_loss: 0.3703, test_loss: 1.2283, test_f1: 0.6982
##################ITERATION #9 ****************************************
 epoch: 0, train_loss: 1.3520, test_loss: 1.1138, test_f1: 0.4222
 epoch: 1, train_loss: 1.0633, test_loss: 0.9857, test_f1: 0.4492
 epoch: 2, train_loss: 1.0012, test_loss: 0.9776, test_f1: 0.4698
 epoch: 3, train_loss: 0.9810, test_loss: 0.9366, test_f1: 0.4849
 epoch: 4, train_loss: 0.9442, test_loss: 0.9626, test_f1: 0.4932
 epoch: 5, train_loss: 0.9295, test_loss: 0.9072, test_f1: 0.4974
 epoch: 6, train_loss: 0.9073, test_loss: 0.9387, test_f1: 0.5211
 epoch: 7, train_loss: 0.9025, test_loss: 0.9425, test_f1: 0.5221
 epoch: 8, train_loss: 0.8809, test_loss: 0.9284, test_f1: 0.5304
 epoch: 9, train_loss: 0.8643, test_loss: 0.9816, test_f1: 0.5207
 epoch: 10, train_loss: 0.8599, test_loss: 0.9803, test_f1: 0.5035
 epoch: 11, train_loss: 0.8529, test_loss: 0.9227, test_f1: 0.5404
 epoch: 12, train_loss: 0.8432, test_loss: 0.9275, test_f1: 0.5442
 epoch: 13, train_loss: 0.8395, test_loss: 0.9308, test_f1: 0.5388
 epoch: 14, train_loss: 0.8360, test_loss: 0.9501, test_f1: 0.5691
 epoch: 15, train_loss: 0.8231, test_loss: 0.9522, test_f1: 0.5523
 epoch: 16, train_loss: 0.8106, test_loss: 0.9276, test_f1: 0.5543
 epoch: 17, train_loss: 0.7944, test_loss: 0.9651, test_f1: 0.5556
 epoch: 18, train_loss: 0.7908, test_loss: 0.9840, test_f1: 0.5469
 epoch: 19, train_loss: 0.7814, test_loss: 0.9977, test_f1: 0.5446
 epoch: 20, train_loss: 0.7807, test_loss: 0.9640, test_f1: 0.5618
 epoch: 21, train_loss: 0.7758, test_loss: 1.0172, test_f1: 0.5689
 epoch: 22, train_loss: 0.7670, test_loss: 0.9448, test_f1: 0.5613
 epoch: 23, train_loss: 0.7733, test_loss: 0.9811, test_f1: 0.5624
 epoch: 24, train_loss: 0.7519, test_loss: 0.9882, test_f1: 0.5655
 epoch: 25, train_loss: 0.7526, test_loss: 1.0067, test_f1: 0.5775
 epoch: 26, train_loss: 0.7484, test_loss: 0.9477, test_f1: 0.6011
 epoch: 27, train_loss: 0.7279, test_loss: 1.0142, test_f1: 0.5869
 epoch: 28, train_loss: 0.7212, test_loss: 1.0590, test_f1: 0.6026
 epoch: 29, train_loss: 0.7230, test_loss: 0.9515, test_f1: 0.5979
 epoch: 30, train_loss: 0.7201, test_loss: 1.0015, test_f1: 0.5809
 epoch: 31, train_loss: 0.6822, test_loss: 0.9438, test_f1: 0.6094
 epoch: 32, train_loss: 0.7019, test_loss: 1.0151, test_f1: 0.5950
 epoch: 33, train_loss: 0.6852, test_loss: 0.9946, test_f1: 0.6153
 epoch: 34, train_loss: 0.6766, test_loss: 0.9965, test_f1: 0.6449
 epoch: 35, train_loss: 0.6782, test_loss: 1.1124, test_f1: 0.6115
 epoch: 36, train_loss: 0.6647, test_loss: 0.9923, test_f1: 0.6333
 epoch: 37, train_loss: 0.6596, test_loss: 1.0541, test_f1: 0.6060
 epoch: 38, train_loss: 0.6444, test_loss: 1.0529, test_f1: 0.6438
 epoch: 39, train_loss: 0.6488, test_loss: 0.9387, test_f1: 0.6354
 epoch: 40, train_loss: 0.6412, test_loss: 0.9841, test_f1: 0.6235
 epoch: 41, train_loss: 0.6405, test_loss: 1.0692, test_f1: 0.6347
 epoch: 42, train_loss: 0.6371, test_loss: 0.9543, test_f1: 0.6484
 epoch: 43, train_loss: 0.6353, test_loss: 1.0157, test_f1: 0.6400
 epoch: 44, train_loss: 0.6320, test_loss: 1.0289, test_f1: 0.6578
 epoch: 45, train_loss: 0.6077, test_loss: 0.9936, test_f1: 0.6590
 epoch: 46, train_loss: 0.6232, test_loss: 0.9683, test_f1: 0.6664
 epoch: 47, train_loss: 0.6032, test_loss: 0.9504, test_f1: 0.6586
 epoch: 48, train_loss: 0.6005, test_loss: 1.0151, test_f1: 0.6296
 epoch: 49, train_loss: 0.5836, test_loss: 1.0835, test_f1: 0.6590
 epoch: 50, train_loss: 0.5967, test_loss: 0.9874, test_f1: 0.6461
 epoch: 51, train_loss: 0.5571, test_loss: 1.0432, test_f1: 0.6717
 epoch: 52, train_loss: 0.5399, test_loss: 1.0172, test_f1: 0.6607
 epoch: 53, train_loss: 0.5264, test_loss: 1.0931, test_f1: 0.6580
 epoch: 54, train_loss: 0.5257, test_loss: 1.0737, test_f1: 0.6597
 epoch: 55, train_loss: 0.5161, test_loss: 1.0754, test_f1: 0.6568
 epoch: 56, train_loss: 0.5158, test_loss: 1.0685, test_f1: 0.6497
 epoch: 57, train_loss: 0.4976, test_loss: 1.1033, test_f1: 0.6655
 epoch: 58, train_loss: 0.4940, test_loss: 1.0829, test_f1: 0.6663
 epoch: 59, train_loss: 0.4788, test_loss: 1.1776, test_f1: 0.6822
 epoch: 60, train_loss: 0.4863, test_loss: 1.1287, test_f1: 0.6820
 epoch: 61, train_loss: 0.4665, test_loss: 1.0526, test_f1: 0.6592
 epoch: 62, train_loss: 0.4758, test_loss: 1.1886, test_f1: 0.6544
 epoch: 63, train_loss: 0.4765, test_loss: 1.1044, test_f1: 0.6722
 epoch: 64, train_loss: 0.4576, test_loss: 1.1085, test_f1: 0.6657
 epoch: 65, train_loss: 0.4618, test_loss: 1.0968, test_f1: 0.6695
 epoch: 66, train_loss: 0.4665, test_loss: 1.0758, test_f1: 0.6673
 epoch: 67, train_loss: 0.4563, test_loss: 1.1638, test_f1: 0.6699
 epoch: 68, train_loss: 0.4329, test_loss: 1.1562, test_f1: 0.6870
 epoch: 69, train_loss: 0.4400, test_loss: 1.1088, test_f1: 0.6893
 epoch: 70, train_loss: 0.4349, test_loss: 1.1917, test_f1: 0.6602
 epoch: 71, train_loss: 0.4412, test_loss: 1.1814, test_f1: 0.6623
 epoch: 72, train_loss: 0.4423, test_loss: 1.0861, test_f1: 0.6719
 epoch: 73, train_loss: 0.4243, test_loss: 1.1807, test_f1: 0.6681
 epoch: 74, train_loss: 0.4209, test_loss: 1.2017, test_f1: 0.6618
 epoch: 75, train_loss: 0.4153, test_loss: 1.2581, test_f1: 0.6759
 epoch: 76, train_loss: 0.4351, test_loss: 1.1994, test_f1: 0.6716
 epoch: 77, train_loss: 0.4064, test_loss: 1.1517, test_f1: 0.6680
 epoch: 78, train_loss: 0.4024, test_loss: 1.1937, test_f1: 0.6718
 epoch: 79, train_loss: 0.4205, test_loss: 1.1976, test_f1: 0.6397
 epoch: 80, train_loss: 0.4071, test_loss: 1.2358, test_f1: 0.6584
 epoch: 81, train_loss: 0.4111, test_loss: 1.2682, test_f1: 0.6827
 epoch: 82, train_loss: 0.3986, test_loss: 1.2120, test_f1: 0.6716
 epoch: 83, train_loss: 0.3979, test_loss: 1.2387, test_f1: 0.6621
 epoch: 84, train_loss: 0.4142, test_loss: 1.2012, test_f1: 0.6790
 epoch: 85, train_loss: 0.3857, test_loss: 1.2647, test_f1: 0.6674
 epoch: 86, train_loss: 0.3898, test_loss: 1.2028, test_f1: 0.6658
 epoch: 87, train_loss: 0.3726, test_loss: 1.2358, test_f1: 0.6736
 epoch: 88, train_loss: 0.3969, test_loss: 1.1961, test_f1: 0.6558
 epoch: 89, train_loss: 0.3736, test_loss: 1.1920, test_f1: 0.6727
 epoch: 90, train_loss: 0.3874, test_loss: 1.2543, test_f1: 0.6490
 epoch: 91, train_loss: 0.3670, test_loss: 1.2407, test_f1: 0.6412
 epoch: 92, train_loss: 0.3718, test_loss: 1.2825, test_f1: 0.6503
 epoch: 93, train_loss: 0.3497, test_loss: 1.2505, test_f1: 0.6491
 epoch: 94, train_loss: 0.3610, test_loss: 1.2711, test_f1: 0.6622
 epoch: 95, train_loss: 0.3737, test_loss: 1.3163, test_f1: 0.6848
 epoch: 96, train_loss: 0.3610, test_loss: 1.2847, test_f1: 0.6516
 epoch: 97, train_loss: 0.3785, test_loss: 1.2924, test_f1: 0.6648
 epoch: 98, train_loss: 0.3678, test_loss: 1.2960, test_f1: 0.6737
 epoch: 99, train_loss: 0.3334, test_loss: 1.3172, test_f1: 0.6477

Training completed in 752.91 seconds
Best F1: 0.7004 at epoch 63
Mean F1 across iterations: 0.6852  0.0094
========================FINAL RESULTS================================
FEGIN weighted F1: 0.7004  0.0094
python main.py --data ltspice_examples --representation component_net --model FEGIN --layers 5 --hiddens 64 --batch_size 64 --lr 0.001 --emb_size 512 --epochs 100 --save_appendix component_net_L5_H64_BS64_LR0.001_E512 --no_val
-----



STDERR:
  File "main.py", line 370, in <module>
    main()
  File "main.py", line 254, in main
    dataset = dataset_class(
  File "/home/philip/projects/ltspice_examples_code_repo/Circuit-Completion-Using-GNNs/component_classification_with_link_prediction_head/evaluation/FEGIN/kernel/circuit_datasets.py", line 15, in __init__
    self.data, self.slices = torch.load(self.processed_paths[0])
  File "/home/philip/.local/lib/python3.8/site-packages/torch/serialization.py", line 1040, in load
    warnings.warn(
  File "/usr/lib/python3.8/warnings.py", line 109, in _showwarnmsg
    sw(msg.message, msg.category, msg.filename, msg.lineno,
  File "main.py", line 47, in warn_with_traceback
    traceback.print_stack(file=log)
/home/philip/projects/ltspice_examples_code_repo/Circuit-Completion-Using-GNNs/component_classification_with_link_prediction_head/evaluation/FEGIN/kernel/circuit_datasets.py:15: FutureWarning: You are using `torch.load` with `weights_only=False` (the current default value), which uses the default pickle module implicitly. It is possible to construct malicious pickle data which will execute arbitrary code during unpickling (See https://github.com/pytorch/pytorch/blob/main/SECURITY.md#untrusted-models for more details). In a future release, the default value for `weights_only` will be flipped to `True`. This limits the functions that could be executed during unpickling. Arbitrary objects will no longer be allowed to be loaded via this mode unless they are explicitly allowlisted by the user via `torch.serialization.add_safe_globals`. We recommend you start setting `weights_only=True` for any use case where you don't have full control of the loaded file. Please open an issue on GitHub for any issues related to this experimental feature.
  self.data, self.slices = torch.load(self.processed_paths[0])
