STDOUT:
Results will be saved in /home/philip/projects/ltspice_examples_code_repo/Circuit-Completion-Using-GNNs/component_classification_with_link_prediction_head/evaluation/FEGIN/results/model_FEGIN_dataset_ltspice_demos
Command line input: python main.py --data ltspice_demos --representation component_net --model FEGIN --layers 3 --hiddens 16 --batch_size 256 --lr 0.01 --emb_size 250 --epochs 100 --save_appendix component_net_L3_H16_BS256_LR0.01_E250 --no_val
 is saved.
-----
ltspice_demos - FEGIN
Using 3 layers, 16 hidden units, h = 2
Loading component_net representation dataset
ENTERED
Training FEGIN on component_net representation
Train: 1565, Test: 383
##################ITERATION #0 ****************************************
 epoch: 0, train_loss: 1.3165, test_loss: 1.3117, test_f1: 0.1365
 epoch: 1, train_loss: 1.1906, test_loss: 1.3360, test_f1: 0.1365
 epoch: 2, train_loss: 1.1606, test_loss: 1.3297, test_f1: 0.2281
 epoch: 3, train_loss: 1.1493, test_loss: 1.3028, test_f1: 0.3429
 epoch: 4, train_loss: 1.1256, test_loss: 1.3046, test_f1: 0.3259
 epoch: 5, train_loss: 1.1119, test_loss: 1.2039, test_f1: 0.3428
 epoch: 6, train_loss: 1.1029, test_loss: 1.2150, test_f1: 0.3328
 epoch: 7, train_loss: 1.0817, test_loss: 1.1663, test_f1: 0.4219
 epoch: 8, train_loss: 1.0608, test_loss: 1.1568, test_f1: 0.4231
 epoch: 9, train_loss: 1.0491, test_loss: 1.0881, test_f1: 0.4430
 epoch: 10, train_loss: 1.0424, test_loss: 1.0876, test_f1: 0.4547
 epoch: 11, train_loss: 1.0119, test_loss: 1.1803, test_f1: 0.3500
 epoch: 12, train_loss: 0.9930, test_loss: 1.1992, test_f1: 0.4283
 epoch: 13, train_loss: 0.9729, test_loss: 1.1342, test_f1: 0.4263
 epoch: 14, train_loss: 0.9697, test_loss: 1.1290, test_f1: 0.4646
 epoch: 15, train_loss: 0.9529, test_loss: 1.1827, test_f1: 0.4490
 epoch: 16, train_loss: 0.9501, test_loss: 1.1456, test_f1: 0.4244
 epoch: 17, train_loss: 0.9491, test_loss: 1.3333, test_f1: 0.3935
 epoch: 18, train_loss: 0.9397, test_loss: 1.2406, test_f1: 0.3267
 epoch: 19, train_loss: 0.9252, test_loss: 1.0981, test_f1: 0.4848
 epoch: 20, train_loss: 0.9192, test_loss: 1.0845, test_f1: 0.5275
 epoch: 21, train_loss: 0.9187, test_loss: 1.1310, test_f1: 0.4878
 epoch: 22, train_loss: 0.8952, test_loss: 1.0208, test_f1: 0.5366
 epoch: 23, train_loss: 0.9024, test_loss: 1.0322, test_f1: 0.5042
 epoch: 24, train_loss: 0.9060, test_loss: 1.9873, test_f1: 0.3593
 epoch: 25, train_loss: 0.9175, test_loss: 1.5100, test_f1: 0.3635
 epoch: 26, train_loss: 0.9090, test_loss: 1.0322, test_f1: 0.4562
 epoch: 27, train_loss: 0.9235, test_loss: 1.1389, test_f1: 0.5261
 epoch: 28, train_loss: 0.9124, test_loss: 1.2079, test_f1: 0.5632
 epoch: 29, train_loss: 0.8824, test_loss: 1.1703, test_f1: 0.4860
 epoch: 30, train_loss: 0.8938, test_loss: 1.1042, test_f1: 0.5281
 epoch: 31, train_loss: 0.8790, test_loss: 1.1133, test_f1: 0.5506
 epoch: 32, train_loss: 0.8739, test_loss: 1.0708, test_f1: 0.5278
 epoch: 33, train_loss: 0.8704, test_loss: 1.2080, test_f1: 0.4015
 epoch: 34, train_loss: 0.9222, test_loss: 1.2375, test_f1: 0.4466
 epoch: 35, train_loss: 0.9175, test_loss: 1.2360, test_f1: 0.5184
 epoch: 36, train_loss: 0.9304, test_loss: 1.1779, test_f1: 0.5503
 epoch: 37, train_loss: 0.8995, test_loss: 1.1141, test_f1: 0.5448
 epoch: 38, train_loss: 0.8884, test_loss: 1.0999, test_f1: 0.5592
 epoch: 39, train_loss: 0.8980, test_loss: 1.0590, test_f1: 0.5571
 epoch: 40, train_loss: 0.8718, test_loss: 1.0550, test_f1: 0.5307
 epoch: 41, train_loss: 0.8788, test_loss: 1.1272, test_f1: 0.5170
 epoch: 42, train_loss: 0.8816, test_loss: 1.1045, test_f1: 0.5393
 epoch: 43, train_loss: 0.8576, test_loss: 1.1357, test_f1: 0.5664
 epoch: 44, train_loss: 0.8470, test_loss: 1.1273, test_f1: 0.5756
 epoch: 45, train_loss: 0.8624, test_loss: 1.0498, test_f1: 0.5560
 epoch: 46, train_loss: 0.8607, test_loss: 1.0968, test_f1: 0.5626
 epoch: 47, train_loss: 0.8507, test_loss: 1.1521, test_f1: 0.5745
 epoch: 48, train_loss: 0.8414, test_loss: 1.1435, test_f1: 0.5334
 epoch: 49, train_loss: 0.8423, test_loss: 1.1638, test_f1: 0.5659
 epoch: 50, train_loss: 0.8190, test_loss: 1.2504, test_f1: 0.5733
 epoch: 51, train_loss: 0.8421, test_loss: 1.1955, test_f1: 0.5443
 epoch: 52, train_loss: 0.8197, test_loss: 1.2113, test_f1: 0.5348
 epoch: 53, train_loss: 0.8270, test_loss: 1.0500, test_f1: 0.6001
 epoch: 54, train_loss: 0.8282, test_loss: 1.1692, test_f1: 0.5614
 epoch: 55, train_loss: 0.7999, test_loss: 1.1226, test_f1: 0.5897
 epoch: 56, train_loss: 0.8012, test_loss: 1.0680, test_f1: 0.5741
 epoch: 57, train_loss: 0.8238, test_loss: 1.1069, test_f1: 0.5517
 epoch: 58, train_loss: 0.8325, test_loss: 1.1463, test_f1: 0.5116
 epoch: 59, train_loss: 0.8191, test_loss: 1.0804, test_f1: 0.5848
 epoch: 60, train_loss: 0.7972, test_loss: 1.0814, test_f1: 0.5828
 epoch: 61, train_loss: 0.8089, test_loss: 1.1474, test_f1: 0.5629
 epoch: 62, train_loss: 0.7895, test_loss: 1.0981, test_f1: 0.5950
 epoch: 63, train_loss: 0.8056, test_loss: 1.1096, test_f1: 0.5769
 epoch: 64, train_loss: 0.7979, test_loss: 1.1887, test_f1: 0.5887
 epoch: 65, train_loss: 0.7779, test_loss: 1.1868, test_f1: 0.5266
 epoch: 66, train_loss: 0.7691, test_loss: 1.1860, test_f1: 0.5615
 epoch: 67, train_loss: 0.7869, test_loss: 1.1710, test_f1: 0.5677
 epoch: 68, train_loss: 0.7645, test_loss: 1.0801, test_f1: 0.5933
 epoch: 69, train_loss: 0.7732, test_loss: 1.0572, test_f1: 0.6075
 epoch: 70, train_loss: 0.7711, test_loss: 1.0727, test_f1: 0.5762
 epoch: 71, train_loss: 0.7618, test_loss: 1.1325, test_f1: 0.6003
 epoch: 72, train_loss: 0.7623, test_loss: 1.0835, test_f1: 0.6106
 epoch: 73, train_loss: 0.7537, test_loss: 1.0714, test_f1: 0.6013
 epoch: 74, train_loss: 0.7561, test_loss: 1.0410, test_f1: 0.6108
 epoch: 75, train_loss: 0.7598, test_loss: 1.0523, test_f1: 0.5880
 epoch: 76, train_loss: 0.7488, test_loss: 1.1871, test_f1: 0.6029
 epoch: 77, train_loss: 0.7493, test_loss: 1.2066, test_f1: 0.5640
 epoch: 78, train_loss: 0.7506, test_loss: 1.0982, test_f1: 0.5796
 epoch: 79, train_loss: 0.7537, test_loss: 1.3441, test_f1: 0.5663
 epoch: 80, train_loss: 0.7274, test_loss: 1.5324, test_f1: 0.5300
 epoch: 81, train_loss: 0.7676, test_loss: 1.2394, test_f1: 0.5794
 epoch: 82, train_loss: 0.7586, test_loss: 1.1703, test_f1: 0.5630
 epoch: 83, train_loss: 0.7556, test_loss: 1.1324, test_f1: 0.6101
 epoch: 84, train_loss: 0.7609, test_loss: 1.2363, test_f1: 0.5794
 epoch: 85, train_loss: 0.8169, test_loss: 1.2531, test_f1: 0.5749
 epoch: 86, train_loss: 0.8385, test_loss: 1.1005, test_f1: 0.5567
 epoch: 87, train_loss: 0.7854, test_loss: 1.0809, test_f1: 0.5694
 epoch: 88, train_loss: 0.7590, test_loss: 1.1451, test_f1: 0.5763
 epoch: 89, train_loss: 0.7529, test_loss: 1.2293, test_f1: 0.5803
 epoch: 90, train_loss: 0.7460, test_loss: 1.2102, test_f1: 0.5668
 epoch: 91, train_loss: 0.7303, test_loss: 1.1989, test_f1: 0.5914
 epoch: 92, train_loss: 0.7435, test_loss: 1.2295, test_f1: 0.5651
 epoch: 93, train_loss: 0.7328, test_loss: 1.2235, test_f1: 0.5873
 epoch: 94, train_loss: 0.7206, test_loss: 1.1982, test_f1: 0.5937
 epoch: 95, train_loss: 0.7157, test_loss: 1.1613, test_f1: 0.5636
 epoch: 96, train_loss: 0.7180, test_loss: 1.1852, test_f1: 0.5732
 epoch: 97, train_loss: 0.7250, test_loss: 1.1512, test_f1: 0.5834
 epoch: 98, train_loss: 0.7100, test_loss: 1.3128, test_f1: 0.5556
 epoch: 99, train_loss: 0.6949, test_loss: 1.3623, test_f1: 0.5738
##################ITERATION #1 ****************************************
 epoch: 0, train_loss: 1.2651, test_loss: 1.3176, test_f1: 0.2281
 epoch: 1, train_loss: 1.1826, test_loss: 1.3616, test_f1: 0.2281
 epoch: 2, train_loss: 1.1323, test_loss: 1.4553, test_f1: 0.2281
 epoch: 3, train_loss: 1.1086, test_loss: 1.5499, test_f1: 0.3057
 epoch: 4, train_loss: 1.0783, test_loss: 1.4892, test_f1: 0.2281
 epoch: 5, train_loss: 1.0454, test_loss: 1.2357, test_f1: 0.3586
 epoch: 6, train_loss: 1.0490, test_loss: 1.2343, test_f1: 0.4187
 epoch: 7, train_loss: 1.0234, test_loss: 1.2213, test_f1: 0.4476
 epoch: 8, train_loss: 0.9898, test_loss: 1.1522, test_f1: 0.4281
 epoch: 9, train_loss: 0.9783, test_loss: 1.0725, test_f1: 0.4783
 epoch: 10, train_loss: 0.9957, test_loss: 1.1268, test_f1: 0.4130
 epoch: 11, train_loss: 0.9929, test_loss: 1.0772, test_f1: 0.3841
 epoch: 12, train_loss: 0.9559, test_loss: 1.0629, test_f1: 0.4877
 epoch: 13, train_loss: 0.9430, test_loss: 1.1274, test_f1: 0.4705
 epoch: 14, train_loss: 0.9287, test_loss: 1.3844, test_f1: 0.3714
 epoch: 15, train_loss: 0.9255, test_loss: 1.4824, test_f1: 0.4367
 epoch: 16, train_loss: 0.9408, test_loss: 1.3272, test_f1: 0.4395
 epoch: 17, train_loss: 0.9171, test_loss: 1.0901, test_f1: 0.3780
 epoch: 18, train_loss: 0.9038, test_loss: 1.1050, test_f1: 0.5316
 epoch: 19, train_loss: 0.9114, test_loss: 1.1107, test_f1: 0.5059
 epoch: 20, train_loss: 0.9208, test_loss: 1.1184, test_f1: 0.3983
 epoch: 21, train_loss: 0.9401, test_loss: 1.2120, test_f1: 0.3915
 epoch: 22, train_loss: 0.9257, test_loss: 1.0886, test_f1: 0.4650
 epoch: 23, train_loss: 0.9047, test_loss: 1.4924, test_f1: 0.4406
 epoch: 24, train_loss: 0.9365, test_loss: 1.6207, test_f1: 0.4192
 epoch: 25, train_loss: 0.9502, test_loss: 1.1416, test_f1: 0.5107
 epoch: 26, train_loss: 0.9492, test_loss: 1.2686, test_f1: 0.4476
 epoch: 27, train_loss: 0.9342, test_loss: 1.3257, test_f1: 0.3881
 epoch: 28, train_loss: 0.9108, test_loss: 1.4704, test_f1: 0.5024
 epoch: 29, train_loss: 0.8852, test_loss: 1.3018, test_f1: 0.4574
 epoch: 30, train_loss: 0.9020, test_loss: 1.1710, test_f1: 0.4752
 epoch: 31, train_loss: 0.8919, test_loss: 1.1265, test_f1: 0.4715
 epoch: 32, train_loss: 0.8916, test_loss: 1.1244, test_f1: 0.5357
 epoch: 33, train_loss: 0.8706, test_loss: 1.0972, test_f1: 0.5028
 epoch: 34, train_loss: 0.8744, test_loss: 1.2101, test_f1: 0.4875
 epoch: 35, train_loss: 0.8852, test_loss: 1.1778, test_f1: 0.3945
 epoch: 36, train_loss: 0.8858, test_loss: 1.0820, test_f1: 0.5060
 epoch: 37, train_loss: 0.8874, test_loss: 1.1224, test_f1: 0.5116
 epoch: 38, train_loss: 0.8821, test_loss: 1.0264, test_f1: 0.5091
 epoch: 39, train_loss: 0.8804, test_loss: 1.0709, test_f1: 0.5705
 epoch: 40, train_loss: 0.8847, test_loss: 1.1999, test_f1: 0.4818
 epoch: 41, train_loss: 0.8925, test_loss: 1.0362, test_f1: 0.5492
 epoch: 42, train_loss: 0.8696, test_loss: 1.1183, test_f1: 0.5556
 epoch: 43, train_loss: 0.8781, test_loss: 1.0967, test_f1: 0.4991
 epoch: 44, train_loss: 0.8751, test_loss: 1.0394, test_f1: 0.5476
 epoch: 45, train_loss: 0.8724, test_loss: 1.0945, test_f1: 0.5484
 epoch: 46, train_loss: 0.8575, test_loss: 1.0486, test_f1: 0.4619
 epoch: 47, train_loss: 0.8354, test_loss: 1.0708, test_f1: 0.4532
 epoch: 48, train_loss: 0.8382, test_loss: 1.2128, test_f1: 0.5320
 epoch: 49, train_loss: 0.8384, test_loss: 1.1426, test_f1: 0.5230
 epoch: 50, train_loss: 0.8349, test_loss: 1.1312, test_f1: 0.5918
 epoch: 51, train_loss: 0.8313, test_loss: 1.1296, test_f1: 0.5704
 epoch: 52, train_loss: 0.8181, test_loss: 1.0883, test_f1: 0.5250
 epoch: 53, train_loss: 0.8140, test_loss: 1.1003, test_f1: 0.5342
 epoch: 54, train_loss: 0.8110, test_loss: 1.1164, test_f1: 0.6001
 epoch: 55, train_loss: 0.8039, test_loss: 1.0961, test_f1: 0.5715
 epoch: 56, train_loss: 0.8437, test_loss: 1.0486, test_f1: 0.5620
 epoch: 57, train_loss: 0.8235, test_loss: 1.0228, test_f1: 0.5543
 epoch: 58, train_loss: 0.8232, test_loss: 0.9921, test_f1: 0.5185
 epoch: 59, train_loss: 0.8098, test_loss: 1.0116, test_f1: 0.5886
 epoch: 60, train_loss: 0.8011, test_loss: 1.0130, test_f1: 0.5841
 epoch: 61, train_loss: 0.7995, test_loss: 1.0047, test_f1: 0.5524
 epoch: 62, train_loss: 0.8092, test_loss: 1.1033, test_f1: 0.5787
 epoch: 63, train_loss: 0.8148, test_loss: 1.2313, test_f1: 0.5313
 epoch: 64, train_loss: 0.8340, test_loss: 1.1067, test_f1: 0.5568
 epoch: 65, train_loss: 0.8023, test_loss: 1.0600, test_f1: 0.5782
 epoch: 66, train_loss: 0.8093, test_loss: 1.0039, test_f1: 0.6017
 epoch: 67, train_loss: 0.7991, test_loss: 1.0199, test_f1: 0.6110
 epoch: 68, train_loss: 0.7890, test_loss: 1.0553, test_f1: 0.6030
 epoch: 69, train_loss: 0.7793, test_loss: 1.0456, test_f1: 0.6086
 epoch: 70, train_loss: 0.7728, test_loss: 1.0039, test_f1: 0.6183
 epoch: 71, train_loss: 0.7629, test_loss: 1.0912, test_f1: 0.5736
 epoch: 72, train_loss: 0.7755, test_loss: 1.0203, test_f1: 0.5443
 epoch: 73, train_loss: 0.7684, test_loss: 0.9880, test_f1: 0.6012
 epoch: 74, train_loss: 0.7700, test_loss: 1.0597, test_f1: 0.5921
 epoch: 75, train_loss: 0.7691, test_loss: 0.9964, test_f1: 0.5863
 epoch: 76, train_loss: 0.7758, test_loss: 1.1072, test_f1: 0.5440
 epoch: 77, train_loss: 0.7557, test_loss: 1.0324, test_f1: 0.5784
 epoch: 78, train_loss: 0.7475, test_loss: 1.0509, test_f1: 0.5603
 epoch: 79, train_loss: 0.7663, test_loss: 1.0436, test_f1: 0.6035
 epoch: 80, train_loss: 0.7586, test_loss: 1.1000, test_f1: 0.5348
 epoch: 81, train_loss: 0.7692, test_loss: 1.2243, test_f1: 0.4959
 epoch: 82, train_loss: 0.7697, test_loss: 1.2779, test_f1: 0.5209
 epoch: 83, train_loss: 0.7347, test_loss: 1.3414, test_f1: 0.5821
 epoch: 84, train_loss: 0.7361, test_loss: 1.1523, test_f1: 0.5624
 epoch: 85, train_loss: 0.7399, test_loss: 1.1460, test_f1: 0.5673
 epoch: 86, train_loss: 0.7306, test_loss: 1.0516, test_f1: 0.6226
 epoch: 87, train_loss: 0.7269, test_loss: 1.1411, test_f1: 0.6244
 epoch: 88, train_loss: 0.7118, test_loss: 1.2800, test_f1: 0.5245
 epoch: 89, train_loss: 0.7044, test_loss: 1.3940, test_f1: 0.5453
 epoch: 90, train_loss: 0.7414, test_loss: 1.1263, test_f1: 0.5976
 epoch: 91, train_loss: 0.7123, test_loss: 1.0760, test_f1: 0.6029
 epoch: 92, train_loss: 0.7084, test_loss: 1.0836, test_f1: 0.5967
 epoch: 93, train_loss: 0.7070, test_loss: 1.0109, test_f1: 0.6341
 epoch: 94, train_loss: 0.7075, test_loss: 1.0855, test_f1: 0.6236
 epoch: 95, train_loss: 0.7038, test_loss: 1.3091, test_f1: 0.5905
 epoch: 96, train_loss: 0.7130, test_loss: 1.0892, test_f1: 0.5900
 epoch: 97, train_loss: 0.7143, test_loss: 1.0935, test_f1: 0.5737
 epoch: 98, train_loss: 0.7111, test_loss: 1.0734, test_f1: 0.6040
 epoch: 99, train_loss: 0.6909, test_loss: 1.0726, test_f1: 0.5993
##################ITERATION #2 ****************************************
 epoch: 0, train_loss: 1.2349, test_loss: 1.3979, test_f1: 0.1365
 epoch: 1, train_loss: 1.1394, test_loss: 1.3074, test_f1: 0.2281
 epoch: 2, train_loss: 1.0782, test_loss: 1.2642, test_f1: 0.2281
 epoch: 3, train_loss: 1.0672, test_loss: 1.2012, test_f1: 0.3062
 epoch: 4, train_loss: 1.0311, test_loss: 1.1692, test_f1: 0.4238
 epoch: 5, train_loss: 1.0186, test_loss: 1.1620, test_f1: 0.3605
 epoch: 6, train_loss: 0.9948, test_loss: 1.1848, test_f1: 0.3081
 epoch: 7, train_loss: 1.0007, test_loss: 1.1926, test_f1: 0.3748
 epoch: 8, train_loss: 1.0106, test_loss: 1.1674, test_f1: 0.4193
 epoch: 9, train_loss: 0.9874, test_loss: 1.1102, test_f1: 0.4642
 epoch: 10, train_loss: 0.9760, test_loss: 1.1362, test_f1: 0.4621
 epoch: 11, train_loss: 0.9550, test_loss: 1.1936, test_f1: 0.4407
 epoch: 12, train_loss: 0.9943, test_loss: 1.2328, test_f1: 0.4670
 epoch: 13, train_loss: 0.9676, test_loss: 1.1285, test_f1: 0.4832
 epoch: 14, train_loss: 0.9506, test_loss: 1.1303, test_f1: 0.4849
 epoch: 15, train_loss: 0.9431, test_loss: 1.0761, test_f1: 0.5064
 epoch: 16, train_loss: 0.9273, test_loss: 1.0854, test_f1: 0.4898
 epoch: 17, train_loss: 0.9278, test_loss: 1.0607, test_f1: 0.4939
 epoch: 18, train_loss: 0.9209, test_loss: 1.0259, test_f1: 0.5114
 epoch: 19, train_loss: 0.9220, test_loss: 1.0582, test_f1: 0.5202
 epoch: 20, train_loss: 0.9075, test_loss: 1.0504, test_f1: 0.5031
 epoch: 21, train_loss: 0.9023, test_loss: 1.1295, test_f1: 0.5141
 epoch: 22, train_loss: 0.8817, test_loss: 1.0763, test_f1: 0.5013
 epoch: 23, train_loss: 0.8780, test_loss: 1.0738, test_f1: 0.5162
 epoch: 24, train_loss: 0.8840, test_loss: 1.0976, test_f1: 0.5205
 epoch: 25, train_loss: 0.8725, test_loss: 1.0110, test_f1: 0.5503
 epoch: 26, train_loss: 0.8998, test_loss: 1.0093, test_f1: 0.5230
 epoch: 27, train_loss: 0.8865, test_loss: 1.1405, test_f1: 0.4843
 epoch: 28, train_loss: 0.8786, test_loss: 1.5444, test_f1: 0.4292
 epoch: 29, train_loss: 0.9175, test_loss: 1.2904, test_f1: 0.4304
 epoch: 30, train_loss: 0.9291, test_loss: 1.2276, test_f1: 0.4965
 epoch: 31, train_loss: 0.9063, test_loss: 1.0377, test_f1: 0.5028
 epoch: 32, train_loss: 0.8952, test_loss: 1.0581, test_f1: 0.5066
 epoch: 33, train_loss: 0.8883, test_loss: 1.0858, test_f1: 0.5086
 epoch: 34, train_loss: 0.8758, test_loss: 1.1019, test_f1: 0.5376
 epoch: 35, train_loss: 0.8788, test_loss: 1.0447, test_f1: 0.5671
 epoch: 36, train_loss: 0.8801, test_loss: 1.0288, test_f1: 0.5674
 epoch: 37, train_loss: 0.8915, test_loss: 1.0892, test_f1: 0.5373
 epoch: 38, train_loss: 0.8926, test_loss: 1.1062, test_f1: 0.4939
 epoch: 39, train_loss: 0.8853, test_loss: 1.1609, test_f1: 0.5154
 epoch: 40, train_loss: 0.8662, test_loss: 1.1339, test_f1: 0.5088
 epoch: 41, train_loss: 0.8593, test_loss: 1.1242, test_f1: 0.4737
 epoch: 42, train_loss: 0.8686, test_loss: 1.1245, test_f1: 0.5170
 epoch: 43, train_loss: 0.8523, test_loss: 1.0941, test_f1: 0.5670
 epoch: 44, train_loss: 0.8478, test_loss: 1.1872, test_f1: 0.5610
 epoch: 45, train_loss: 0.8522, test_loss: 1.1282, test_f1: 0.5445
 epoch: 46, train_loss: 0.8645, test_loss: 1.1025, test_f1: 0.5528
 epoch: 47, train_loss: 0.8779, test_loss: 1.1493, test_f1: 0.5343
 epoch: 48, train_loss: 0.8415, test_loss: 1.1165, test_f1: 0.5526
 epoch: 49, train_loss: 0.8245, test_loss: 1.0725, test_f1: 0.5553
 epoch: 50, train_loss: 0.8255, test_loss: 1.1158, test_f1: 0.5296
 epoch: 51, train_loss: 0.8286, test_loss: 1.0990, test_f1: 0.5551
 epoch: 52, train_loss: 0.8234, test_loss: 1.0429, test_f1: 0.5782
 epoch: 53, train_loss: 0.7995, test_loss: 1.0296, test_f1: 0.5505
 epoch: 54, train_loss: 0.8110, test_loss: 1.0556, test_f1: 0.5848
 epoch: 55, train_loss: 0.8171, test_loss: 1.0754, test_f1: 0.5632
 epoch: 56, train_loss: 0.8050, test_loss: 1.0795, test_f1: 0.5590
 epoch: 57, train_loss: 0.8027, test_loss: 1.1139, test_f1: 0.5436
 epoch: 58, train_loss: 0.7865, test_loss: 1.1107, test_f1: 0.5688
 epoch: 59, train_loss: 0.8000, test_loss: 1.1061, test_f1: 0.5469
 epoch: 60, train_loss: 0.7940, test_loss: 1.1941, test_f1: 0.5352
 epoch: 61, train_loss: 0.7793, test_loss: 1.1828, test_f1: 0.5388
 epoch: 62, train_loss: 0.7920, test_loss: 1.1238, test_f1: 0.5446
 epoch: 63, train_loss: 0.7671, test_loss: 1.1151, test_f1: 0.5607
 epoch: 64, train_loss: 0.7750, test_loss: 1.1927, test_f1: 0.5655
 epoch: 65, train_loss: 0.7727, test_loss: 1.1749, test_f1: 0.5457
 epoch: 66, train_loss: 0.7687, test_loss: 1.0885, test_f1: 0.5829
 epoch: 67, train_loss: 0.7698, test_loss: 1.1619, test_f1: 0.5377
 epoch: 68, train_loss: 0.7810, test_loss: 1.1301, test_f1: 0.5499
 epoch: 69, train_loss: 0.7967, test_loss: 1.1089, test_f1: 0.5631
 epoch: 70, train_loss: 0.7703, test_loss: 1.1104, test_f1: 0.5746
 epoch: 71, train_loss: 0.7810, test_loss: 1.1869, test_f1: 0.5100
 epoch: 72, train_loss: 0.7771, test_loss: 1.1338, test_f1: 0.5405
 epoch: 73, train_loss: 0.7763, test_loss: 1.0883, test_f1: 0.5364
 epoch: 74, train_loss: 0.7818, test_loss: 1.1243, test_f1: 0.5597
 epoch: 75, train_loss: 0.7681, test_loss: 1.0852, test_f1: 0.5367
 epoch: 76, train_loss: 0.7611, test_loss: 1.1134, test_f1: 0.5513
 epoch: 77, train_loss: 0.7484, test_loss: 1.1677, test_f1: 0.5393
 epoch: 78, train_loss: 0.7529, test_loss: 1.1243, test_f1: 0.5470
 epoch: 79, train_loss: 0.7456, test_loss: 1.1673, test_f1: 0.5653
 epoch: 80, train_loss: 0.7646, test_loss: 1.2163, test_f1: 0.5340
 epoch: 81, train_loss: 0.7553, test_loss: 1.1685, test_f1: 0.5835
 epoch: 82, train_loss: 0.7647, test_loss: 1.1023, test_f1: 0.5333
 epoch: 83, train_loss: 0.7482, test_loss: 1.1618, test_f1: 0.5294
 epoch: 84, train_loss: 0.7428, test_loss: 1.1111, test_f1: 0.5721
 epoch: 85, train_loss: 0.7270, test_loss: 1.0811, test_f1: 0.5750
 epoch: 86, train_loss: 0.7334, test_loss: 1.1105, test_f1: 0.5705
 epoch: 87, train_loss: 0.7404, test_loss: 1.1103, test_f1: 0.5539
 epoch: 88, train_loss: 0.7224, test_loss: 1.1948, test_f1: 0.5189
 epoch: 89, train_loss: 0.7324, test_loss: 1.2038, test_f1: 0.5430
 epoch: 90, train_loss: 0.7259, test_loss: 1.1536, test_f1: 0.5436
 epoch: 91, train_loss: 0.7284, test_loss: 1.2331, test_f1: 0.5488
 epoch: 92, train_loss: 0.7225, test_loss: 1.2181, test_f1: 0.5320
 epoch: 93, train_loss: 0.7286, test_loss: 1.1842, test_f1: 0.5818
 epoch: 94, train_loss: 0.7251, test_loss: 1.1815, test_f1: 0.5527
 epoch: 95, train_loss: 0.7149, test_loss: 1.1711, test_f1: 0.5602
 epoch: 96, train_loss: 0.6876, test_loss: 1.1873, test_f1: 0.5906
 epoch: 97, train_loss: 0.7090, test_loss: 1.2223, test_f1: 0.5923
 epoch: 98, train_loss: 0.7115, test_loss: 1.1633, test_f1: 0.5504
 epoch: 99, train_loss: 0.6924, test_loss: 1.1936, test_f1: 0.5470
##################ITERATION #3 ****************************************
 epoch: 0, train_loss: 1.2334, test_loss: 1.4642, test_f1: 0.2281
 epoch: 1, train_loss: 1.1848, test_loss: 1.4433, test_f1: 0.2583
 epoch: 2, train_loss: 1.1022, test_loss: 1.2750, test_f1: 0.2281
 epoch: 3, train_loss: 1.0632, test_loss: 1.1668, test_f1: 0.3674
 epoch: 4, train_loss: 1.0288, test_loss: 1.1297, test_f1: 0.3638
 epoch: 5, train_loss: 1.0293, test_loss: 1.1245, test_f1: 0.3725
 epoch: 6, train_loss: 0.9982, test_loss: 1.0990, test_f1: 0.4336
 epoch: 7, train_loss: 0.9746, test_loss: 1.0960, test_f1: 0.4461
 epoch: 8, train_loss: 0.9659, test_loss: 1.1012, test_f1: 0.4204
 epoch: 9, train_loss: 0.9521, test_loss: 1.1135, test_f1: 0.4502
 epoch: 10, train_loss: 0.9691, test_loss: 1.2548, test_f1: 0.4823
 epoch: 11, train_loss: 0.9516, test_loss: 1.0973, test_f1: 0.4925
 epoch: 12, train_loss: 0.9568, test_loss: 1.1219, test_f1: 0.4984
 epoch: 13, train_loss: 0.9365, test_loss: 1.2949, test_f1: 0.4697
 epoch: 14, train_loss: 0.9498, test_loss: 1.3233, test_f1: 0.4750
 epoch: 15, train_loss: 0.9263, test_loss: 1.3685, test_f1: 0.4267
 epoch: 16, train_loss: 0.9360, test_loss: 1.2796, test_f1: 0.4873
 epoch: 17, train_loss: 0.9175, test_loss: 1.1238, test_f1: 0.4981
 epoch: 18, train_loss: 0.9240, test_loss: 1.0884, test_f1: 0.5051
 epoch: 19, train_loss: 0.9333, test_loss: 1.0601, test_f1: 0.4822
 epoch: 20, train_loss: 0.9418, test_loss: 1.0855, test_f1: 0.3977
 epoch: 21, train_loss: 0.9282, test_loss: 1.1936, test_f1: 0.3934
 epoch: 22, train_loss: 0.9172, test_loss: 1.0183, test_f1: 0.5618
 epoch: 23, train_loss: 0.9034, test_loss: 1.0627, test_f1: 0.4066
 epoch: 24, train_loss: 0.9002, test_loss: 1.1576, test_f1: 0.4895
 epoch: 25, train_loss: 0.9026, test_loss: 1.0688, test_f1: 0.5439
 epoch: 26, train_loss: 0.8947, test_loss: 1.0280, test_f1: 0.5076
 epoch: 27, train_loss: 0.8931, test_loss: 0.9954, test_f1: 0.5158
 epoch: 28, train_loss: 0.9063, test_loss: 1.0996, test_f1: 0.4656
 epoch: 29, train_loss: 0.8859, test_loss: 1.0649, test_f1: 0.4870
 epoch: 30, train_loss: 0.9041, test_loss: 1.1525, test_f1: 0.4885
 epoch: 31, train_loss: 0.8810, test_loss: 1.1666, test_f1: 0.5247
 epoch: 32, train_loss: 0.8871, test_loss: 1.1840, test_f1: 0.4935
 epoch: 33, train_loss: 0.9090, test_loss: 1.0952, test_f1: 0.4892
 epoch: 34, train_loss: 0.8762, test_loss: 1.1052, test_f1: 0.5391
 epoch: 35, train_loss: 0.8857, test_loss: 1.2675, test_f1: 0.4601
 epoch: 36, train_loss: 0.8898, test_loss: 1.0499, test_f1: 0.5627
 epoch: 37, train_loss: 0.8592, test_loss: 1.0070, test_f1: 0.5460
 epoch: 38, train_loss: 0.8570, test_loss: 1.0096, test_f1: 0.5499
 epoch: 39, train_loss: 0.8600, test_loss: 1.0573, test_f1: 0.5464
 epoch: 40, train_loss: 0.8717, test_loss: 1.2317, test_f1: 0.4441
 epoch: 41, train_loss: 0.8767, test_loss: 1.1096, test_f1: 0.5124
 epoch: 42, train_loss: 0.8806, test_loss: 1.0444, test_f1: 0.5516
 epoch: 43, train_loss: 0.9001, test_loss: 1.0634, test_f1: 0.5309
 epoch: 44, train_loss: 0.8821, test_loss: 1.0024, test_f1: 0.5496
 epoch: 45, train_loss: 0.8637, test_loss: 1.0744, test_f1: 0.5182
 epoch: 46, train_loss: 0.8708, test_loss: 1.0411, test_f1: 0.5305
 epoch: 47, train_loss: 0.8478, test_loss: 1.1009, test_f1: 0.5563
 epoch: 48, train_loss: 0.8559, test_loss: 0.9682, test_f1: 0.5575
 epoch: 49, train_loss: 0.8477, test_loss: 1.0223, test_f1: 0.5481
 epoch: 50, train_loss: 0.8452, test_loss: 1.2560, test_f1: 0.4875
 epoch: 51, train_loss: 0.8314, test_loss: 1.1081, test_f1: 0.5174
 epoch: 52, train_loss: 0.8200, test_loss: 1.0572, test_f1: 0.5798
 epoch: 53, train_loss: 0.8135, test_loss: 1.0590, test_f1: 0.5260
 epoch: 54, train_loss: 0.8011, test_loss: 1.0258, test_f1: 0.5597
 epoch: 55, train_loss: 0.8017, test_loss: 1.0565, test_f1: 0.5599
 epoch: 56, train_loss: 0.8047, test_loss: 1.0908, test_f1: 0.5984
 epoch: 57, train_loss: 0.8016, test_loss: 1.0405, test_f1: 0.5647
 epoch: 58, train_loss: 0.7888, test_loss: 1.1338, test_f1: 0.5353
 epoch: 59, train_loss: 0.7959, test_loss: 1.1391, test_f1: 0.5517
 epoch: 60, train_loss: 0.7902, test_loss: 1.0655, test_f1: 0.5519
 epoch: 61, train_loss: 0.7908, test_loss: 1.0587, test_f1: 0.5576
 epoch: 62, train_loss: 0.7838, test_loss: 1.0238, test_f1: 0.5702
 epoch: 63, train_loss: 0.7751, test_loss: 1.1066, test_f1: 0.5548
 epoch: 64, train_loss: 0.7727, test_loss: 1.1409, test_f1: 0.5481
 epoch: 65, train_loss: 0.7900, test_loss: 1.1021, test_f1: 0.5757
 epoch: 66, train_loss: 0.7766, test_loss: 1.0492, test_f1: 0.5674
 epoch: 67, train_loss: 0.7623, test_loss: 1.0230, test_f1: 0.5833
 epoch: 68, train_loss: 0.7580, test_loss: 1.0360, test_f1: 0.5491
 epoch: 69, train_loss: 0.7668, test_loss: 1.1305, test_f1: 0.5253
 epoch: 70, train_loss: 0.7729, test_loss: 1.1590, test_f1: 0.5385
 epoch: 71, train_loss: 0.7760, test_loss: 1.1189, test_f1: 0.5534
 epoch: 72, train_loss: 0.7636, test_loss: 1.1017, test_f1: 0.5329
 epoch: 73, train_loss: 0.7646, test_loss: 1.1822, test_f1: 0.5440
 epoch: 74, train_loss: 0.7534, test_loss: 1.1291, test_f1: 0.5294
 epoch: 75, train_loss: 0.7761, test_loss: 1.1323, test_f1: 0.4878
 epoch: 76, train_loss: 0.7662, test_loss: 1.3529, test_f1: 0.4366
 epoch: 77, train_loss: 0.7511, test_loss: 1.1929, test_f1: 0.5616
 epoch: 78, train_loss: 0.7491, test_loss: 1.1869, test_f1: 0.5711
 epoch: 79, train_loss: 0.7441, test_loss: 1.1618, test_f1: 0.5777
 epoch: 80, train_loss: 0.7380, test_loss: 1.1391, test_f1: 0.5731
 epoch: 81, train_loss: 0.7438, test_loss: 1.1076, test_f1: 0.5483
 epoch: 82, train_loss: 0.7347, test_loss: 1.1830, test_f1: 0.5599
 epoch: 83, train_loss: 0.7609, test_loss: 1.1732, test_f1: 0.5303
 epoch: 84, train_loss: 0.7565, test_loss: 1.1887, test_f1: 0.5317
 epoch: 85, train_loss: 0.7374, test_loss: 1.1022, test_f1: 0.5641
 epoch: 86, train_loss: 0.7438, test_loss: 1.0770, test_f1: 0.5432
 epoch: 87, train_loss: 0.7336, test_loss: 1.1207, test_f1: 0.5620
 epoch: 88, train_loss: 0.7472, test_loss: 1.2060, test_f1: 0.5791
 epoch: 89, train_loss: 0.7317, test_loss: 1.2434, test_f1: 0.5750
 epoch: 90, train_loss: 0.7287, test_loss: 1.1091, test_f1: 0.6073
 epoch: 91, train_loss: 0.7530, test_loss: 1.0858, test_f1: 0.5499
 epoch: 92, train_loss: 0.7381, test_loss: 1.2282, test_f1: 0.5232
 epoch: 93, train_loss: 0.7455, test_loss: 1.2001, test_f1: 0.5103
 epoch: 94, train_loss: 0.7377, test_loss: 1.0864, test_f1: 0.5391
 epoch: 95, train_loss: 0.7394, test_loss: 1.0884, test_f1: 0.5809
 epoch: 96, train_loss: 0.7326, test_loss: 1.1777, test_f1: 0.5469
 epoch: 97, train_loss: 0.7193, test_loss: 1.1651, test_f1: 0.5736
 epoch: 98, train_loss: 0.7096, test_loss: 1.1342, test_f1: 0.5467
 epoch: 99, train_loss: 0.7145, test_loss: 1.0856, test_f1: 0.5453
##################ITERATION #4 ****************************************
 epoch: 0, train_loss: 1.2428, test_loss: 1.3009, test_f1: 0.2281
 epoch: 1, train_loss: 1.0912, test_loss: 1.3082, test_f1: 0.2336
 epoch: 2, train_loss: 1.0554, test_loss: 1.2960, test_f1: 0.2748
 epoch: 3, train_loss: 1.0610, test_loss: 1.2677, test_f1: 0.3331
 epoch: 4, train_loss: 1.0424, test_loss: 1.1921, test_f1: 0.3963
 epoch: 5, train_loss: 1.0119, test_loss: 1.1474, test_f1: 0.4417
 epoch: 6, train_loss: 0.9973, test_loss: 1.1480, test_f1: 0.4098
 epoch: 7, train_loss: 0.9711, test_loss: 1.1384, test_f1: 0.4482
 epoch: 8, train_loss: 0.9477, test_loss: 1.1534, test_f1: 0.4875
 epoch: 9, train_loss: 0.9518, test_loss: 1.1677, test_f1: 0.4849
 epoch: 10, train_loss: 0.9453, test_loss: 1.1245, test_f1: 0.5019
 epoch: 11, train_loss: 0.9424, test_loss: 1.2037, test_f1: 0.4707
 epoch: 12, train_loss: 0.9104, test_loss: 1.2976, test_f1: 0.4744
 epoch: 13, train_loss: 0.8988, test_loss: 1.1109, test_f1: 0.5045
 epoch: 14, train_loss: 0.8870, test_loss: 1.1543, test_f1: 0.4821
 epoch: 15, train_loss: 0.8831, test_loss: 1.5807, test_f1: 0.4156
 epoch: 16, train_loss: 0.9063, test_loss: 1.1013, test_f1: 0.5296
 epoch: 17, train_loss: 0.8945, test_loss: 1.1187, test_f1: 0.4792
 epoch: 18, train_loss: 0.8915, test_loss: 1.1631, test_f1: 0.5225
 epoch: 19, train_loss: 0.9012, test_loss: 1.0769, test_f1: 0.5367
 epoch: 20, train_loss: 0.8710, test_loss: 1.1001, test_f1: 0.5193
 epoch: 21, train_loss: 0.8592, test_loss: 1.1709, test_f1: 0.5144
 epoch: 22, train_loss: 0.8601, test_loss: 1.1307, test_f1: 0.5306
 epoch: 23, train_loss: 0.8471, test_loss: 1.0691, test_f1: 0.5667
 epoch: 24, train_loss: 0.8644, test_loss: 1.1703, test_f1: 0.5161
 epoch: 25, train_loss: 0.8445, test_loss: 1.0804, test_f1: 0.5200
 epoch: 26, train_loss: 0.8369, test_loss: 1.0667, test_f1: 0.5207
 epoch: 27, train_loss: 0.8267, test_loss: 1.0960, test_f1: 0.5110
 epoch: 28, train_loss: 0.8396, test_loss: 1.0773, test_f1: 0.5522
 epoch: 29, train_loss: 0.8158, test_loss: 1.0375, test_f1: 0.5353
 epoch: 30, train_loss: 0.8085, test_loss: 1.0740, test_f1: 0.5471
 epoch: 31, train_loss: 0.7895, test_loss: 1.0161, test_f1: 0.5641
 epoch: 32, train_loss: 0.7821, test_loss: 1.1085, test_f1: 0.4923
 epoch: 33, train_loss: 0.8033, test_loss: 1.1357, test_f1: 0.4790
 epoch: 34, train_loss: 0.7973, test_loss: 1.0650, test_f1: 0.5197
 epoch: 35, train_loss: 0.7956, test_loss: 1.0543, test_f1: 0.5554
 epoch: 36, train_loss: 0.7907, test_loss: 1.1153, test_f1: 0.5453
 epoch: 37, train_loss: 0.7632, test_loss: 1.0563, test_f1: 0.5775
 epoch: 38, train_loss: 0.7630, test_loss: 1.1034, test_f1: 0.5242
 epoch: 39, train_loss: 0.7896, test_loss: 1.0817, test_f1: 0.5711
 epoch: 40, train_loss: 0.7755, test_loss: 1.1197, test_f1: 0.5730
 epoch: 41, train_loss: 0.7787, test_loss: 1.0713, test_f1: 0.4813
 epoch: 42, train_loss: 0.7811, test_loss: 1.1188, test_f1: 0.5055
 epoch: 43, train_loss: 0.7621, test_loss: 1.1221, test_f1: 0.4967
 epoch: 44, train_loss: 0.7468, test_loss: 1.1937, test_f1: 0.5027
 epoch: 45, train_loss: 0.7520, test_loss: 1.1467, test_f1: 0.5525
 epoch: 46, train_loss: 0.7516, test_loss: 1.1500, test_f1: 0.5650
 epoch: 47, train_loss: 0.7782, test_loss: 1.1925, test_f1: 0.5102
 epoch: 48, train_loss: 0.7768, test_loss: 1.1016, test_f1: 0.5641
 epoch: 49, train_loss: 0.7550, test_loss: 1.2425, test_f1: 0.5622
 epoch: 50, train_loss: 0.8321, test_loss: 1.2084, test_f1: 0.5194
 epoch: 51, train_loss: 0.8209, test_loss: 1.1521, test_f1: 0.5700
 epoch: 52, train_loss: 0.7965, test_loss: 1.0763, test_f1: 0.5424
 epoch: 53, train_loss: 0.7826, test_loss: 1.2219, test_f1: 0.4562
 epoch: 54, train_loss: 0.7725, test_loss: 1.1457, test_f1: 0.5464
 epoch: 55, train_loss: 0.7564, test_loss: 1.1392, test_f1: 0.5155
 epoch: 56, train_loss: 0.7452, test_loss: 1.0825, test_f1: 0.5719
 epoch: 57, train_loss: 0.7242, test_loss: 1.0898, test_f1: 0.5779
 epoch: 58, train_loss: 0.7313, test_loss: 1.0264, test_f1: 0.5542
 epoch: 59, train_loss: 0.7209, test_loss: 1.0339, test_f1: 0.6113
 epoch: 60, train_loss: 0.7230, test_loss: 1.0381, test_f1: 0.5858
 epoch: 61, train_loss: 0.7091, test_loss: 1.0513, test_f1: 0.5707
 epoch: 62, train_loss: 0.7065, test_loss: 1.0771, test_f1: 0.5630
 epoch: 63, train_loss: 0.7236, test_loss: 1.1736, test_f1: 0.4906
 epoch: 64, train_loss: 0.7114, test_loss: 1.1567, test_f1: 0.5246
 epoch: 65, train_loss: 0.7002, test_loss: 1.1155, test_f1: 0.5145
 epoch: 66, train_loss: 0.6817, test_loss: 1.1233, test_f1: 0.5026
 epoch: 67, train_loss: 0.7094, test_loss: 1.1093, test_f1: 0.5060
 epoch: 68, train_loss: 0.6959, test_loss: 1.1370, test_f1: 0.5401
 epoch: 69, train_loss: 0.6944, test_loss: 1.1721, test_f1: 0.6207
 epoch: 70, train_loss: 0.7154, test_loss: 1.2742, test_f1: 0.5711
 epoch: 71, train_loss: 0.7155, test_loss: 1.0981, test_f1: 0.5855
 epoch: 72, train_loss: 0.7021, test_loss: 1.1649, test_f1: 0.5197
 epoch: 73, train_loss: 0.6921, test_loss: 1.1857, test_f1: 0.5317
 epoch: 74, train_loss: 0.7007, test_loss: 1.0904, test_f1: 0.5730
 epoch: 75, train_loss: 0.6780, test_loss: 1.1404, test_f1: 0.5689
 epoch: 76, train_loss: 0.6784, test_loss: 1.1774, test_f1: 0.5596
 epoch: 77, train_loss: 0.6728, test_loss: 1.1895, test_f1: 0.5567
 epoch: 78, train_loss: 0.6540, test_loss: 1.1335, test_f1: 0.5809
 epoch: 79, train_loss: 0.6588, test_loss: 1.0215, test_f1: 0.6042
 epoch: 80, train_loss: 0.6662, test_loss: 1.0435, test_f1: 0.5760
 epoch: 81, train_loss: 0.6737, test_loss: 1.1903, test_f1: 0.5208
 epoch: 82, train_loss: 0.6571, test_loss: 1.2760, test_f1: 0.5433
 epoch: 83, train_loss: 0.6528, test_loss: 1.2158, test_f1: 0.5548
 epoch: 84, train_loss: 0.6732, test_loss: 1.2552, test_f1: 0.5531
 epoch: 85, train_loss: 0.7048, test_loss: 1.1309, test_f1: 0.5104
 epoch: 86, train_loss: 0.6885, test_loss: 1.1798, test_f1: 0.4720
 epoch: 87, train_loss: 0.6630, test_loss: 1.2163, test_f1: 0.5059
 epoch: 88, train_loss: 0.6700, test_loss: 1.1848, test_f1: 0.5786
 epoch: 89, train_loss: 0.6531, test_loss: 1.1813, test_f1: 0.5880
 epoch: 90, train_loss: 0.6431, test_loss: 1.2724, test_f1: 0.5664
 epoch: 91, train_loss: 0.6535, test_loss: 1.2033, test_f1: 0.5299
 epoch: 92, train_loss: 0.6721, test_loss: 1.2832, test_f1: 0.5703
 epoch: 93, train_loss: 0.6584, test_loss: 1.4444, test_f1: 0.5519
 epoch: 94, train_loss: 0.6600, test_loss: 1.1852, test_f1: 0.5713
 epoch: 95, train_loss: 0.6910, test_loss: 1.1356, test_f1: 0.5613
 epoch: 96, train_loss: 0.6473, test_loss: 1.2572, test_f1: 0.5184
 epoch: 97, train_loss: 0.6623, test_loss: 1.3862, test_f1: 0.4826
 epoch: 98, train_loss: 0.6553, test_loss: 1.2930, test_f1: 0.5532
 epoch: 99, train_loss: 0.6886, test_loss: 1.2202, test_f1: 0.5422
##################ITERATION #5 ****************************************
 epoch: 0, train_loss: 1.4415, test_loss: 1.3878, test_f1: 0.2281
 epoch: 1, train_loss: 1.1766, test_loss: 1.3257, test_f1: 0.2285
 epoch: 2, train_loss: 1.1273, test_loss: 1.2577, test_f1: 0.3232
 epoch: 3, train_loss: 1.0670, test_loss: 1.1995, test_f1: 0.3675
 epoch: 4, train_loss: 1.0500, test_loss: 1.1681, test_f1: 0.4686
 epoch: 5, train_loss: 1.0032, test_loss: 1.1285, test_f1: 0.4367
 epoch: 6, train_loss: 1.0013, test_loss: 1.1112, test_f1: 0.4814
 epoch: 7, train_loss: 0.9989, test_loss: 1.0922, test_f1: 0.4907
 epoch: 8, train_loss: 0.9915, test_loss: 1.1303, test_f1: 0.4658
 epoch: 9, train_loss: 0.9807, test_loss: 1.1100, test_f1: 0.4753
 epoch: 10, train_loss: 0.9583, test_loss: 1.0607, test_f1: 0.5027
 epoch: 11, train_loss: 0.9620, test_loss: 1.1896, test_f1: 0.4808
 epoch: 12, train_loss: 0.9638, test_loss: 1.1384, test_f1: 0.4411
 epoch: 13, train_loss: 0.9510, test_loss: 1.0764, test_f1: 0.4408
 epoch: 14, train_loss: 0.9407, test_loss: 1.0686, test_f1: 0.4909
 epoch: 15, train_loss: 0.9355, test_loss: 1.0663, test_f1: 0.5023
 epoch: 16, train_loss: 0.9148, test_loss: 1.0733, test_f1: 0.5055
 epoch: 17, train_loss: 0.9295, test_loss: 1.0738, test_f1: 0.4543
 epoch: 18, train_loss: 0.9069, test_loss: 1.1363, test_f1: 0.5078
 epoch: 19, train_loss: 0.9007, test_loss: 1.0615, test_f1: 0.5224
 epoch: 20, train_loss: 0.9040, test_loss: 1.0631, test_f1: 0.5116
 epoch: 21, train_loss: 0.8959, test_loss: 1.1254, test_f1: 0.5358
 epoch: 22, train_loss: 0.9263, test_loss: 1.1356, test_f1: 0.5073
 epoch: 23, train_loss: 0.9242, test_loss: 1.2102, test_f1: 0.4019
 epoch: 24, train_loss: 0.9219, test_loss: 1.1643, test_f1: 0.4495
 epoch: 25, train_loss: 0.9115, test_loss: 1.1346, test_f1: 0.4810
 epoch: 26, train_loss: 0.9259, test_loss: 0.9989, test_f1: 0.5798
 epoch: 27, train_loss: 0.9147, test_loss: 1.1066, test_f1: 0.4925
 epoch: 28, train_loss: 0.9236, test_loss: 1.2848, test_f1: 0.4669
 epoch: 29, train_loss: 0.8982, test_loss: 1.2349, test_f1: 0.4196
 epoch: 30, train_loss: 0.8821, test_loss: 1.0780, test_f1: 0.5505
 epoch: 31, train_loss: 0.8906, test_loss: 1.0736, test_f1: 0.5607
 epoch: 32, train_loss: 0.8744, test_loss: 1.0651, test_f1: 0.5391
 epoch: 33, train_loss: 0.9051, test_loss: 1.0594, test_f1: 0.5210
 epoch: 34, train_loss: 0.8767, test_loss: 1.0977, test_f1: 0.5249
 epoch: 35, train_loss: 0.8765, test_loss: 1.2394, test_f1: 0.4576
 epoch: 36, train_loss: 0.8642, test_loss: 1.0296, test_f1: 0.5499
 epoch: 37, train_loss: 0.8563, test_loss: 1.0309, test_f1: 0.5224
 epoch: 38, train_loss: 0.8829, test_loss: 1.0366, test_f1: 0.5616
 epoch: 39, train_loss: 0.8736, test_loss: 1.2696, test_f1: 0.4445
 epoch: 40, train_loss: 0.8759, test_loss: 1.3867, test_f1: 0.3844
 epoch: 41, train_loss: 0.8842, test_loss: 1.0194, test_f1: 0.5670
 epoch: 42, train_loss: 0.8646, test_loss: 1.0330, test_f1: 0.5479
 epoch: 43, train_loss: 0.8516, test_loss: 1.1267, test_f1: 0.5545
 epoch: 44, train_loss: 0.8525, test_loss: 1.0707, test_f1: 0.5626
 epoch: 45, train_loss: 0.8541, test_loss: 1.0819, test_f1: 0.5502
 epoch: 46, train_loss: 0.8314, test_loss: 1.1472, test_f1: 0.5637
 epoch: 47, train_loss: 0.8298, test_loss: 1.0868, test_f1: 0.5758
 epoch: 48, train_loss: 0.8222, test_loss: 1.0752, test_f1: 0.5679
 epoch: 49, train_loss: 0.8284, test_loss: 1.2964, test_f1: 0.5220
 epoch: 50, train_loss: 0.8404, test_loss: 0.9846, test_f1: 0.5510
 epoch: 51, train_loss: 0.8486, test_loss: 1.0078, test_f1: 0.5228
 epoch: 52, train_loss: 0.8464, test_loss: 1.0482, test_f1: 0.5511
 epoch: 53, train_loss: 0.8053, test_loss: 1.0071, test_f1: 0.5741
 epoch: 54, train_loss: 0.8054, test_loss: 1.0951, test_f1: 0.5468
 epoch: 55, train_loss: 0.7908, test_loss: 1.0086, test_f1: 0.5650
 epoch: 56, train_loss: 0.7845, test_loss: 1.0870, test_f1: 0.5581
 epoch: 57, train_loss: 0.7741, test_loss: 1.0696, test_f1: 0.5736
 epoch: 58, train_loss: 0.7808, test_loss: 1.0848, test_f1: 0.5773
 epoch: 59, train_loss: 0.7634, test_loss: 1.1347, test_f1: 0.5765
 epoch: 60, train_loss: 0.7642, test_loss: 1.1179, test_f1: 0.5646
 epoch: 61, train_loss: 0.7708, test_loss: 1.1738, test_f1: 0.5618
 epoch: 62, train_loss: 0.7800, test_loss: 1.3181, test_f1: 0.5104
 epoch: 63, train_loss: 0.7971, test_loss: 1.0732, test_f1: 0.5698
 epoch: 64, train_loss: 0.7755, test_loss: 1.0776, test_f1: 0.5464
 epoch: 65, train_loss: 0.7879, test_loss: 1.1294, test_f1: 0.5443
 epoch: 66, train_loss: 0.7486, test_loss: 1.1733, test_f1: 0.5544
 epoch: 67, train_loss: 0.7721, test_loss: 1.1234, test_f1: 0.5715
 epoch: 68, train_loss: 0.7731, test_loss: 1.0599, test_f1: 0.5757
 epoch: 69, train_loss: 0.7704, test_loss: 1.0876, test_f1: 0.5573
 epoch: 70, train_loss: 0.7575, test_loss: 1.1993, test_f1: 0.5379
 epoch: 71, train_loss: 0.7398, test_loss: 1.1557, test_f1: 0.5506
 epoch: 72, train_loss: 0.7537, test_loss: 1.0550, test_f1: 0.5553
 epoch: 73, train_loss: 0.7554, test_loss: 1.0504, test_f1: 0.5573
 epoch: 74, train_loss: 0.7628, test_loss: 1.1516, test_f1: 0.5442
 epoch: 75, train_loss: 0.7461, test_loss: 1.2106, test_f1: 0.5479
 epoch: 76, train_loss: 0.7485, test_loss: 1.2001, test_f1: 0.5530
 epoch: 77, train_loss: 0.7394, test_loss: 1.0765, test_f1: 0.5612
 epoch: 78, train_loss: 0.7283, test_loss: 1.1910, test_f1: 0.5155
 epoch: 79, train_loss: 0.7307, test_loss: 1.1638, test_f1: 0.5462
 epoch: 80, train_loss: 0.7592, test_loss: 1.1258, test_f1: 0.5590
 epoch: 81, train_loss: 0.7305, test_loss: 1.3140, test_f1: 0.5298
 epoch: 82, train_loss: 0.8034, test_loss: 1.3582, test_f1: 0.5175
 epoch: 83, train_loss: 0.7582, test_loss: 1.1809, test_f1: 0.5596
 epoch: 84, train_loss: 0.7642, test_loss: 1.1631, test_f1: 0.5567
 epoch: 85, train_loss: 0.7576, test_loss: 1.1494, test_f1: 0.5479
 epoch: 86, train_loss: 0.7541, test_loss: 1.1597, test_f1: 0.5400
 epoch: 87, train_loss: 0.7448, test_loss: 1.1763, test_f1: 0.5478
 epoch: 88, train_loss: 0.7347, test_loss: 1.1094, test_f1: 0.5631
 epoch: 89, train_loss: 0.7279, test_loss: 1.2479, test_f1: 0.5188
 epoch: 90, train_loss: 0.7395, test_loss: 1.1246, test_f1: 0.5655
 epoch: 91, train_loss: 0.7258, test_loss: 1.3394, test_f1: 0.5487
 epoch: 92, train_loss: 0.7175, test_loss: 1.2616, test_f1: 0.5435
 epoch: 93, train_loss: 0.7094, test_loss: 1.1039, test_f1: 0.5602
 epoch: 94, train_loss: 0.7224, test_loss: 1.0952, test_f1: 0.5694
 epoch: 95, train_loss: 0.7253, test_loss: 1.2074, test_f1: 0.5578
 epoch: 96, train_loss: 0.7062, test_loss: 1.2004, test_f1: 0.5686
 epoch: 97, train_loss: 0.7173, test_loss: 1.2044, test_f1: 0.5548
 epoch: 98, train_loss: 0.7195, test_loss: 1.2670, test_f1: 0.5562
 epoch: 99, train_loss: 0.7476, test_loss: 1.4805, test_f1: 0.4979
##################ITERATION #6 ****************************************
 epoch: 0, train_loss: 1.3150, test_loss: 1.4824, test_f1: 0.1365
 epoch: 1, train_loss: 1.1862, test_loss: 1.2551, test_f1: 0.2387
 epoch: 2, train_loss: 1.1475, test_loss: 1.2569, test_f1: 0.2587
 epoch: 3, train_loss: 1.1095, test_loss: 1.2051, test_f1: 0.2938
 epoch: 4, train_loss: 1.0683, test_loss: 1.2180, test_f1: 0.2887
 epoch: 5, train_loss: 1.0343, test_loss: 1.1006, test_f1: 0.4215
 epoch: 6, train_loss: 0.9981, test_loss: 1.1364, test_f1: 0.4175
 epoch: 7, train_loss: 1.0073, test_loss: 1.0990, test_f1: 0.5131
 epoch: 8, train_loss: 0.9965, test_loss: 1.0850, test_f1: 0.5043
 epoch: 9, train_loss: 0.9880, test_loss: 1.0829, test_f1: 0.4281
 epoch: 10, train_loss: 0.9842, test_loss: 1.1593, test_f1: 0.4167
 epoch: 11, train_loss: 0.9790, test_loss: 1.2325, test_f1: 0.3904
 epoch: 12, train_loss: 0.9612, test_loss: 1.0978, test_f1: 0.5115
 epoch: 13, train_loss: 0.9491, test_loss: 1.1940, test_f1: 0.5030
 epoch: 14, train_loss: 0.9264, test_loss: 1.0612, test_f1: 0.5441
 epoch: 15, train_loss: 0.9262, test_loss: 1.0585, test_f1: 0.5298
 epoch: 16, train_loss: 0.9320, test_loss: 1.3039, test_f1: 0.4819
 epoch: 17, train_loss: 0.9188, test_loss: 1.1080, test_f1: 0.5064
 epoch: 18, train_loss: 0.9096, test_loss: 1.0628, test_f1: 0.5275
 epoch: 19, train_loss: 0.8953, test_loss: 1.1415, test_f1: 0.5171
 epoch: 20, train_loss: 0.9153, test_loss: 1.1154, test_f1: 0.5460
 epoch: 21, train_loss: 0.8954, test_loss: 1.0370, test_f1: 0.5357
 epoch: 22, train_loss: 0.8811, test_loss: 1.1534, test_f1: 0.5565
 epoch: 23, train_loss: 0.8906, test_loss: 1.2179, test_f1: 0.5203
 epoch: 24, train_loss: 0.9258, test_loss: 1.3127, test_f1: 0.4293
 epoch: 25, train_loss: 0.9097, test_loss: 1.1366, test_f1: 0.4744
 epoch: 26, train_loss: 0.8990, test_loss: 1.2272, test_f1: 0.5002
 epoch: 27, train_loss: 0.8807, test_loss: 1.2320, test_f1: 0.5049
 epoch: 28, train_loss: 0.8836, test_loss: 1.1023, test_f1: 0.5779
 epoch: 29, train_loss: 0.8793, test_loss: 1.0744, test_f1: 0.5821
 epoch: 30, train_loss: 0.8693, test_loss: 1.1541, test_f1: 0.5165
 epoch: 31, train_loss: 0.8713, test_loss: 1.0064, test_f1: 0.5897
 epoch: 32, train_loss: 0.8554, test_loss: 1.1499, test_f1: 0.5644
 epoch: 33, train_loss: 0.8517, test_loss: 1.0520, test_f1: 0.5988
 epoch: 34, train_loss: 0.8579, test_loss: 1.0745, test_f1: 0.5799
 epoch: 35, train_loss: 0.8584, test_loss: 1.1150, test_f1: 0.4974
 epoch: 36, train_loss: 0.8587, test_loss: 1.0873, test_f1: 0.5549
 epoch: 37, train_loss: 0.8531, test_loss: 1.0858, test_f1: 0.5264
 epoch: 38, train_loss: 0.8366, test_loss: 1.0776, test_f1: 0.4981
 epoch: 39, train_loss: 0.8342, test_loss: 1.1689, test_f1: 0.5292
 epoch: 40, train_loss: 0.8261, test_loss: 1.0729, test_f1: 0.5603
 epoch: 41, train_loss: 0.8370, test_loss: 1.0407, test_f1: 0.5736
 epoch: 42, train_loss: 0.8304, test_loss: 1.0627, test_f1: 0.5715
 epoch: 43, train_loss: 0.8261, test_loss: 1.0672, test_f1: 0.5721
 epoch: 44, train_loss: 0.8107, test_loss: 1.1038, test_f1: 0.5589
 epoch: 45, train_loss: 0.8023, test_loss: 1.1682, test_f1: 0.5618
 epoch: 46, train_loss: 0.8151, test_loss: 1.1478, test_f1: 0.5781
 epoch: 47, train_loss: 0.8035, test_loss: 1.1239, test_f1: 0.5421
 epoch: 48, train_loss: 0.8014, test_loss: 1.1143, test_f1: 0.5629
 epoch: 49, train_loss: 0.7826, test_loss: 1.0246, test_f1: 0.5842
 epoch: 50, train_loss: 0.7711, test_loss: 1.2087, test_f1: 0.5511
 epoch: 51, train_loss: 0.7741, test_loss: 1.3198, test_f1: 0.5411
 epoch: 52, train_loss: 0.8093, test_loss: 1.3719, test_f1: 0.5315
 epoch: 53, train_loss: 0.7986, test_loss: 1.0872, test_f1: 0.5760
 epoch: 54, train_loss: 0.7837, test_loss: 1.0967, test_f1: 0.5463
 epoch: 55, train_loss: 0.7754, test_loss: 1.1014, test_f1: 0.5315
 epoch: 56, train_loss: 0.7631, test_loss: 1.0936, test_f1: 0.5586
 epoch: 57, train_loss: 0.7624, test_loss: 1.0685, test_f1: 0.5992
 epoch: 58, train_loss: 0.7438, test_loss: 1.0748, test_f1: 0.5997
 epoch: 59, train_loss: 0.7507, test_loss: 1.0881, test_f1: 0.5928
 epoch: 60, train_loss: 0.7394, test_loss: 1.0999, test_f1: 0.5595
 epoch: 61, train_loss: 0.7318, test_loss: 1.0796, test_f1: 0.6033
 epoch: 62, train_loss: 0.7278, test_loss: 1.0991, test_f1: 0.5653
 epoch: 63, train_loss: 0.7201, test_loss: 1.1110, test_f1: 0.5843
 epoch: 64, train_loss: 0.7373, test_loss: 1.1604, test_f1: 0.5359
 epoch: 65, train_loss: 0.7238, test_loss: 1.1666, test_f1: 0.5749
 epoch: 66, train_loss: 0.7260, test_loss: 1.1225, test_f1: 0.5670
 epoch: 67, train_loss: 0.7150, test_loss: 1.0646, test_f1: 0.6010
 epoch: 68, train_loss: 0.7276, test_loss: 1.0169, test_f1: 0.5975
 epoch: 69, train_loss: 0.7328, test_loss: 1.2998, test_f1: 0.5443
 epoch: 70, train_loss: 0.7585, test_loss: 1.2925, test_f1: 0.5804
 epoch: 71, train_loss: 0.7055, test_loss: 1.1581, test_f1: 0.5580
 epoch: 72, train_loss: 0.7222, test_loss: 1.1893, test_f1: 0.5801
 epoch: 73, train_loss: 0.7214, test_loss: 1.2491, test_f1: 0.5582
 epoch: 74, train_loss: 0.7240, test_loss: 1.1280, test_f1: 0.6197
 epoch: 75, train_loss: 0.7232, test_loss: 1.2012, test_f1: 0.5570
 epoch: 76, train_loss: 0.7273, test_loss: 1.1459, test_f1: 0.5812
 epoch: 77, train_loss: 0.7083, test_loss: 1.0671, test_f1: 0.5804
 epoch: 78, train_loss: 0.7404, test_loss: 1.0353, test_f1: 0.6162
 epoch: 79, train_loss: 0.7148, test_loss: 1.0746, test_f1: 0.5974
 epoch: 80, train_loss: 0.7026, test_loss: 1.0816, test_f1: 0.6013
 epoch: 81, train_loss: 0.7022, test_loss: 1.1254, test_f1: 0.5859
 epoch: 82, train_loss: 0.6946, test_loss: 1.1889, test_f1: 0.5328
 epoch: 83, train_loss: 0.6855, test_loss: 1.1562, test_f1: 0.5460
 epoch: 84, train_loss: 0.6738, test_loss: 1.1690, test_f1: 0.5782
 epoch: 85, train_loss: 0.6731, test_loss: 1.1785, test_f1: 0.5741
 epoch: 86, train_loss: 0.6787, test_loss: 1.2022, test_f1: 0.5712
 epoch: 87, train_loss: 0.7025, test_loss: 1.2260, test_f1: 0.5781
 epoch: 88, train_loss: 0.6944, test_loss: 1.1942, test_f1: 0.5842
 epoch: 89, train_loss: 0.6975, test_loss: 1.1839, test_f1: 0.5521
 epoch: 90, train_loss: 0.7147, test_loss: 1.1317, test_f1: 0.6047
 epoch: 91, train_loss: 0.7063, test_loss: 1.1590, test_f1: 0.6076
 epoch: 92, train_loss: 0.7219, test_loss: 1.1337, test_f1: 0.5998
 epoch: 93, train_loss: 0.6883, test_loss: 1.2000, test_f1: 0.5902
 epoch: 94, train_loss: 0.6646, test_loss: 1.1310, test_f1: 0.6179
 epoch: 95, train_loss: 0.6749, test_loss: 1.1620, test_f1: 0.5761
 epoch: 96, train_loss: 0.6743, test_loss: 1.1376, test_f1: 0.5887
 epoch: 97, train_loss: 0.6824, test_loss: 1.1301, test_f1: 0.6029
 epoch: 98, train_loss: 0.6538, test_loss: 1.2284, test_f1: 0.5736
 epoch: 99, train_loss: 0.6670, test_loss: 1.3145, test_f1: 0.5625
##################ITERATION #7 ****************************************
 epoch: 0, train_loss: 1.3460, test_loss: 1.3553, test_f1: 0.2585
 epoch: 1, train_loss: 1.1873, test_loss: 1.2950, test_f1: 0.2722
 epoch: 2, train_loss: 1.1256, test_loss: 1.2517, test_f1: 0.2719
 epoch: 3, train_loss: 1.1214, test_loss: 1.2206, test_f1: 0.3291
 epoch: 4, train_loss: 1.0961, test_loss: 1.2009, test_f1: 0.3732
 epoch: 5, train_loss: 1.0612, test_loss: 1.1622, test_f1: 0.4197
 epoch: 6, train_loss: 1.0362, test_loss: 1.1460, test_f1: 0.4281
 epoch: 7, train_loss: 1.0356, test_loss: 1.1241, test_f1: 0.4668
 epoch: 8, train_loss: 1.0138, test_loss: 1.1336, test_f1: 0.4490
 epoch: 9, train_loss: 0.9770, test_loss: 1.1053, test_f1: 0.4966
 epoch: 10, train_loss: 0.9934, test_loss: 1.1017, test_f1: 0.4913
 epoch: 11, train_loss: 0.9788, test_loss: 1.1897, test_f1: 0.5148
 epoch: 12, train_loss: 0.9634, test_loss: 1.1064, test_f1: 0.5372
 epoch: 13, train_loss: 0.9528, test_loss: 1.1576, test_f1: 0.5201
 epoch: 14, train_loss: 0.9490, test_loss: 1.0996, test_f1: 0.5147
 epoch: 15, train_loss: 0.9488, test_loss: 1.0806, test_f1: 0.4958
 epoch: 16, train_loss: 0.9375, test_loss: 1.1183, test_f1: 0.5050
 epoch: 17, train_loss: 0.9280, test_loss: 1.0675, test_f1: 0.5414
 epoch: 18, train_loss: 0.9203, test_loss: 1.1177, test_f1: 0.5130
 epoch: 19, train_loss: 0.9206, test_loss: 1.0908, test_f1: 0.5298
 epoch: 20, train_loss: 0.9026, test_loss: 1.1193, test_f1: 0.5192
 epoch: 21, train_loss: 0.9077, test_loss: 1.0353, test_f1: 0.5565
 epoch: 22, train_loss: 0.8970, test_loss: 1.0306, test_f1: 0.5705
 epoch: 23, train_loss: 0.8929, test_loss: 1.0135, test_f1: 0.5358
 epoch: 24, train_loss: 0.8849, test_loss: 0.9588, test_f1: 0.5439
 epoch: 25, train_loss: 0.9049, test_loss: 1.1420, test_f1: 0.4678
 epoch: 26, train_loss: 0.9084, test_loss: 1.1082, test_f1: 0.4898
 epoch: 27, train_loss: 0.9068, test_loss: 1.1251, test_f1: 0.4653
 epoch: 28, train_loss: 0.8953, test_loss: 1.1179, test_f1: 0.4651
 epoch: 29, train_loss: 0.9199, test_loss: 1.0036, test_f1: 0.5503
 epoch: 30, train_loss: 0.8892, test_loss: 1.3629, test_f1: 0.4202
 epoch: 31, train_loss: 0.8829, test_loss: 1.5569, test_f1: 0.3765
 epoch: 32, train_loss: 0.8869, test_loss: 0.9931, test_f1: 0.5392
 epoch: 33, train_loss: 0.8767, test_loss: 1.2269, test_f1: 0.4236
 epoch: 34, train_loss: 0.8744, test_loss: 1.4989, test_f1: 0.4330
 epoch: 35, train_loss: 0.8771, test_loss: 2.5658, test_f1: 0.2701
 epoch: 36, train_loss: 0.9425, test_loss: 1.9585, test_f1: 0.2468
 epoch: 37, train_loss: 0.9410, test_loss: 1.2422, test_f1: 0.4429
 epoch: 38, train_loss: 0.9087, test_loss: 1.3365, test_f1: 0.4334
 epoch: 39, train_loss: 0.8928, test_loss: 1.1944, test_f1: 0.5633
 epoch: 40, train_loss: 0.8787, test_loss: 1.0516, test_f1: 0.5813
 epoch: 41, train_loss: 0.8617, test_loss: 1.0400, test_f1: 0.5647
 epoch: 42, train_loss: 0.8404, test_loss: 1.0466, test_f1: 0.5821
 epoch: 43, train_loss: 0.8377, test_loss: 1.0095, test_f1: 0.6092
 epoch: 44, train_loss: 0.8414, test_loss: 1.0192, test_f1: 0.5677
 epoch: 45, train_loss: 0.8472, test_loss: 1.2001, test_f1: 0.5602
 epoch: 46, train_loss: 0.8582, test_loss: 1.3260, test_f1: 0.4453
 epoch: 47, train_loss: 0.8362, test_loss: 1.0569, test_f1: 0.5088
 epoch: 48, train_loss: 0.8315, test_loss: 1.0263, test_f1: 0.5748
 epoch: 49, train_loss: 0.8154, test_loss: 1.1186, test_f1: 0.4746
 epoch: 50, train_loss: 0.8359, test_loss: 1.0505, test_f1: 0.5482
 epoch: 51, train_loss: 0.8056, test_loss: 1.0470, test_f1: 0.5639
 epoch: 52, train_loss: 0.7971, test_loss: 0.9957, test_f1: 0.5929
 epoch: 53, train_loss: 0.7787, test_loss: 0.9762, test_f1: 0.6123
 epoch: 54, train_loss: 0.7889, test_loss: 0.9873, test_f1: 0.5994
 epoch: 55, train_loss: 0.7792, test_loss: 1.0170, test_f1: 0.5843
 epoch: 56, train_loss: 0.7655, test_loss: 1.0376, test_f1: 0.5619
 epoch: 57, train_loss: 0.7661, test_loss: 1.0328, test_f1: 0.5708
 epoch: 58, train_loss: 0.7710, test_loss: 1.0316, test_f1: 0.5838
 epoch: 59, train_loss: 0.7467, test_loss: 1.0673, test_f1: 0.5597
 epoch: 60, train_loss: 0.7475, test_loss: 0.9734, test_f1: 0.6162
 epoch: 61, train_loss: 0.7533, test_loss: 0.9766, test_f1: 0.5750
 epoch: 62, train_loss: 0.7446, test_loss: 0.9954, test_f1: 0.5687
 epoch: 63, train_loss: 0.7632, test_loss: 1.0894, test_f1: 0.5799
 epoch: 64, train_loss: 0.7669, test_loss: 1.1470, test_f1: 0.5509
 epoch: 65, train_loss: 0.7548, test_loss: 1.0902, test_f1: 0.5120
 epoch: 66, train_loss: 0.7631, test_loss: 1.0603, test_f1: 0.5129
 epoch: 67, train_loss: 0.7705, test_loss: 1.1274, test_f1: 0.5552
 epoch: 68, train_loss: 0.7417, test_loss: 1.2829, test_f1: 0.4960
 epoch: 69, train_loss: 0.7431, test_loss: 1.1781, test_f1: 0.5448
 epoch: 70, train_loss: 0.7511, test_loss: 1.0440, test_f1: 0.5799
 epoch: 71, train_loss: 0.7407, test_loss: 1.0379, test_f1: 0.5769
 epoch: 72, train_loss: 0.7339, test_loss: 1.0885, test_f1: 0.5804
 epoch: 73, train_loss: 0.7317, test_loss: 1.0310, test_f1: 0.5795
 epoch: 74, train_loss: 0.7306, test_loss: 1.0514, test_f1: 0.5641
 epoch: 75, train_loss: 0.7298, test_loss: 1.0379, test_f1: 0.5690
 epoch: 76, train_loss: 0.7123, test_loss: 1.0849, test_f1: 0.4877
 epoch: 77, train_loss: 0.7072, test_loss: 1.0299, test_f1: 0.5559
 epoch: 78, train_loss: 0.7169, test_loss: 1.0243, test_f1: 0.5944
 epoch: 79, train_loss: 0.7030, test_loss: 1.0875, test_f1: 0.5570
 epoch: 80, train_loss: 0.7036, test_loss: 1.0416, test_f1: 0.6077
 epoch: 81, train_loss: 0.7017, test_loss: 1.1267, test_f1: 0.5664
 epoch: 82, train_loss: 0.7023, test_loss: 1.0950, test_f1: 0.6021
 epoch: 83, train_loss: 0.6850, test_loss: 1.1502, test_f1: 0.5615
 epoch: 84, train_loss: 0.7357, test_loss: 1.3651, test_f1: 0.4559
 epoch: 85, train_loss: 0.7159, test_loss: 1.2737, test_f1: 0.4551
 epoch: 86, train_loss: 0.7106, test_loss: 0.9522, test_f1: 0.6107
 epoch: 87, train_loss: 0.7003, test_loss: 0.9721, test_f1: 0.5554
 epoch: 88, train_loss: 0.7011, test_loss: 1.0321, test_f1: 0.5818
 epoch: 89, train_loss: 0.6895, test_loss: 1.0656, test_f1: 0.5811
 epoch: 90, train_loss: 0.6933, test_loss: 1.3374, test_f1: 0.4904
 epoch: 91, train_loss: 0.6920, test_loss: 1.1655, test_f1: 0.5390
 epoch: 92, train_loss: 0.7023, test_loss: 1.1786, test_f1: 0.5394
 epoch: 93, train_loss: 0.6902, test_loss: 1.0590, test_f1: 0.5984
 epoch: 94, train_loss: 0.6894, test_loss: 1.0726, test_f1: 0.5913
 epoch: 95, train_loss: 0.6893, test_loss: 1.0682, test_f1: 0.6027
 epoch: 96, train_loss: 0.6857, test_loss: 1.1154, test_f1: 0.5501
 epoch: 97, train_loss: 0.6933, test_loss: 1.2212, test_f1: 0.5775
 epoch: 98, train_loss: 0.6839, test_loss: 1.4243, test_f1: 0.5822
 epoch: 99, train_loss: 0.6816, test_loss: 1.3003, test_f1: 0.5448
##################ITERATION #8 ****************************************
 epoch: 0, train_loss: 1.3598, test_loss: 1.3208, test_f1: 0.2281
 epoch: 1, train_loss: 1.2067, test_loss: 1.3019, test_f1: 0.2281
 epoch: 2, train_loss: 1.1601, test_loss: 1.3257, test_f1: 0.2852
 epoch: 3, train_loss: 1.1224, test_loss: 1.4020, test_f1: 0.0990
 epoch: 4, train_loss: 1.1042, test_loss: 1.3858, test_f1: 0.1960
 epoch: 5, train_loss: 1.0903, test_loss: 1.3721, test_f1: 0.2173
 epoch: 6, train_loss: 1.0799, test_loss: 1.1972, test_f1: 0.3636
 epoch: 7, train_loss: 1.0670, test_loss: 1.1550, test_f1: 0.3994
 epoch: 8, train_loss: 1.0333, test_loss: 1.1321, test_f1: 0.4327
 epoch: 9, train_loss: 1.0300, test_loss: 1.1299, test_f1: 0.4398
 epoch: 10, train_loss: 1.0142, test_loss: 1.0655, test_f1: 0.4879
 epoch: 11, train_loss: 1.0153, test_loss: 1.0789, test_f1: 0.4580
 epoch: 12, train_loss: 0.9949, test_loss: 1.1438, test_f1: 0.4536
 epoch: 13, train_loss: 0.9787, test_loss: 1.1274, test_f1: 0.5114
 epoch: 14, train_loss: 0.9464, test_loss: 1.2045, test_f1: 0.4392
 epoch: 15, train_loss: 0.9477, test_loss: 1.1798, test_f1: 0.4648
 epoch: 16, train_loss: 0.9535, test_loss: 1.1903, test_f1: 0.4823
 epoch: 17, train_loss: 0.9408, test_loss: 1.1984, test_f1: 0.4959
 epoch: 18, train_loss: 0.9586, test_loss: 1.3956, test_f1: 0.3879
 epoch: 19, train_loss: 0.9422, test_loss: 1.1013, test_f1: 0.5208
 epoch: 20, train_loss: 0.9273, test_loss: 1.2189, test_f1: 0.4447
 epoch: 21, train_loss: 0.9198, test_loss: 1.1337, test_f1: 0.4824
 epoch: 22, train_loss: 0.9213, test_loss: 1.1375, test_f1: 0.4774
 epoch: 23, train_loss: 0.8999, test_loss: 1.1426, test_f1: 0.4938
 epoch: 24, train_loss: 0.9004, test_loss: 1.0800, test_f1: 0.5403
 epoch: 25, train_loss: 0.8864, test_loss: 1.1158, test_f1: 0.5497
 epoch: 26, train_loss: 0.9182, test_loss: 1.1612, test_f1: 0.4938
 epoch: 27, train_loss: 0.9041, test_loss: 1.1598, test_f1: 0.5084
 epoch: 28, train_loss: 0.9069, test_loss: 1.0650, test_f1: 0.5120
 epoch: 29, train_loss: 0.8882, test_loss: 1.0870, test_f1: 0.5416
 epoch: 30, train_loss: 0.8857, test_loss: 1.1125, test_f1: 0.5292
 epoch: 31, train_loss: 0.8833, test_loss: 1.3057, test_f1: 0.4201
 epoch: 32, train_loss: 0.8879, test_loss: 1.1715, test_f1: 0.5530
 epoch: 33, train_loss: 0.8911, test_loss: 1.2531, test_f1: 0.4273
 epoch: 34, train_loss: 0.8872, test_loss: 1.1196, test_f1: 0.4497
 epoch: 35, train_loss: 0.8856, test_loss: 1.2153, test_f1: 0.5070
 epoch: 36, train_loss: 0.8745, test_loss: 1.0831, test_f1: 0.5340
 epoch: 37, train_loss: 0.8807, test_loss: 1.1641, test_f1: 0.5165
 epoch: 38, train_loss: 0.8758, test_loss: 1.3346, test_f1: 0.5149
 epoch: 39, train_loss: 0.8756, test_loss: 1.4100, test_f1: 0.4571
 epoch: 40, train_loss: 0.8999, test_loss: 1.0845, test_f1: 0.5485
 epoch: 41, train_loss: 0.8658, test_loss: 1.1972, test_f1: 0.4378
 epoch: 42, train_loss: 0.8738, test_loss: 1.0609, test_f1: 0.5452
 epoch: 43, train_loss: 0.8539, test_loss: 1.3018, test_f1: 0.4909
 epoch: 44, train_loss: 0.8478, test_loss: 1.1973, test_f1: 0.5186
 epoch: 45, train_loss: 0.8409, test_loss: 1.1485, test_f1: 0.5180
 epoch: 46, train_loss: 0.8604, test_loss: 1.1908, test_f1: 0.5490
 epoch: 47, train_loss: 0.8408, test_loss: 1.2126, test_f1: 0.4922
 epoch: 48, train_loss: 0.8306, test_loss: 1.2935, test_f1: 0.5270
 epoch: 49, train_loss: 0.8318, test_loss: 1.1825, test_f1: 0.5287
 epoch: 50, train_loss: 0.8315, test_loss: 1.3777, test_f1: 0.5002
 epoch: 51, train_loss: 0.8318, test_loss: 1.1263, test_f1: 0.5394
 epoch: 52, train_loss: 0.8163, test_loss: 1.1306, test_f1: 0.5650
 epoch: 53, train_loss: 0.7964, test_loss: 1.1523, test_f1: 0.5325
 epoch: 54, train_loss: 0.7957, test_loss: 1.1319, test_f1: 0.5342
 epoch: 55, train_loss: 0.7885, test_loss: 1.0841, test_f1: 0.5483
 epoch: 56, train_loss: 0.8011, test_loss: 1.0784, test_f1: 0.5465
 epoch: 57, train_loss: 0.7810, test_loss: 1.1362, test_f1: 0.5195
 epoch: 58, train_loss: 0.7969, test_loss: 1.1796, test_f1: 0.5261
 epoch: 59, train_loss: 0.8300, test_loss: 1.0618, test_f1: 0.5814
 epoch: 60, train_loss: 0.8323, test_loss: 1.0966, test_f1: 0.5774
 epoch: 61, train_loss: 0.8113, test_loss: 1.2117, test_f1: 0.5295
 epoch: 62, train_loss: 0.7988, test_loss: 1.2831, test_f1: 0.5200
 epoch: 63, train_loss: 0.7947, test_loss: 1.0952, test_f1: 0.5474
 epoch: 64, train_loss: 0.7846, test_loss: 1.0509, test_f1: 0.5525
 epoch: 65, train_loss: 0.7889, test_loss: 1.0659, test_f1: 0.5484
 epoch: 66, train_loss: 0.7702, test_loss: 1.1388, test_f1: 0.5501
 epoch: 67, train_loss: 0.7742, test_loss: 1.2749, test_f1: 0.5157
 epoch: 68, train_loss: 0.7869, test_loss: 1.2135, test_f1: 0.5293
 epoch: 69, train_loss: 0.7797, test_loss: 1.1736, test_f1: 0.5449
 epoch: 70, train_loss: 0.7684, test_loss: 1.1340, test_f1: 0.5403
 epoch: 71, train_loss: 0.7648, test_loss: 1.0878, test_f1: 0.5829
 epoch: 72, train_loss: 0.7509, test_loss: 1.2572, test_f1: 0.5075
 epoch: 73, train_loss: 0.7506, test_loss: 1.2352, test_f1: 0.5337
 epoch: 74, train_loss: 0.7419, test_loss: 1.1388, test_f1: 0.5336
 epoch: 75, train_loss: 0.7679, test_loss: 1.2123, test_f1: 0.5696
 epoch: 76, train_loss: 0.7570, test_loss: 1.1333, test_f1: 0.5620
 epoch: 77, train_loss: 0.7417, test_loss: 1.2042, test_f1: 0.5397
 epoch: 78, train_loss: 0.7413, test_loss: 1.1513, test_f1: 0.5190
 epoch: 79, train_loss: 0.7581, test_loss: 1.2343, test_f1: 0.5150
 epoch: 80, train_loss: 0.7618, test_loss: 1.0764, test_f1: 0.6168
 epoch: 81, train_loss: 0.7430, test_loss: 1.1814, test_f1: 0.5606
 epoch: 82, train_loss: 0.7713, test_loss: 1.2480, test_f1: 0.4899
 epoch: 83, train_loss: 0.7546, test_loss: 1.2232, test_f1: 0.5842
 epoch: 84, train_loss: 0.7531, test_loss: 1.0802, test_f1: 0.5986
 epoch: 85, train_loss: 0.7374, test_loss: 1.1780, test_f1: 0.5807
 epoch: 86, train_loss: 0.7337, test_loss: 1.1959, test_f1: 0.5665
 epoch: 87, train_loss: 0.7456, test_loss: 1.1659, test_f1: 0.5634
 epoch: 88, train_loss: 0.7596, test_loss: 1.1029, test_f1: 0.5306
 epoch: 89, train_loss: 0.7520, test_loss: 1.1746, test_f1: 0.5578
 epoch: 90, train_loss: 0.7359, test_loss: 1.1720, test_f1: 0.5500
 epoch: 91, train_loss: 0.7359, test_loss: 1.1583, test_f1: 0.5595
 epoch: 92, train_loss: 0.7418, test_loss: 1.1944, test_f1: 0.5727
 epoch: 93, train_loss: 0.7597, test_loss: 1.4576, test_f1: 0.5055
 epoch: 94, train_loss: 0.7406, test_loss: 1.1663, test_f1: 0.5626
 epoch: 95, train_loss: 0.7289, test_loss: 1.2121, test_f1: 0.5271
 epoch: 96, train_loss: 0.7379, test_loss: 1.2778, test_f1: 0.5468
 epoch: 97, train_loss: 0.7335, test_loss: 1.1815, test_f1: 0.5408
 epoch: 98, train_loss: 0.7147, test_loss: 1.2403, test_f1: 0.5630
 epoch: 99, train_loss: 0.7342, test_loss: 1.1590, test_f1: 0.5503
##################ITERATION #9 ****************************************
 epoch: 0, train_loss: 1.5192, test_loss: 1.6169, test_f1: 0.3300
 epoch: 1, train_loss: 1.2290, test_loss: 1.5062, test_f1: 0.2723
 epoch: 2, train_loss: 1.1304, test_loss: 1.3637, test_f1: 0.2722
 epoch: 3, train_loss: 1.1197, test_loss: 1.3480, test_f1: 0.3232
 epoch: 4, train_loss: 1.0760, test_loss: 1.3028, test_f1: 0.3281
 epoch: 5, train_loss: 1.0569, test_loss: 1.2731, test_f1: 0.3252
 epoch: 6, train_loss: 1.0474, test_loss: 1.2173, test_f1: 0.3894
 epoch: 7, train_loss: 1.0297, test_loss: 1.2506, test_f1: 0.3597
 epoch: 8, train_loss: 1.0228, test_loss: 1.2569, test_f1: 0.3592
 epoch: 9, train_loss: 1.0255, test_loss: 1.1461, test_f1: 0.4635
 epoch: 10, train_loss: 0.9992, test_loss: 1.1132, test_f1: 0.5310
 epoch: 11, train_loss: 0.9950, test_loss: 1.1261, test_f1: 0.4588
 epoch: 12, train_loss: 0.9763, test_loss: 1.1595, test_f1: 0.4754
 epoch: 13, train_loss: 0.9979, test_loss: 1.0958, test_f1: 0.5137
 epoch: 14, train_loss: 0.9656, test_loss: 1.1167, test_f1: 0.4897
 epoch: 15, train_loss: 0.9692, test_loss: 1.3131, test_f1: 0.4180
 epoch: 16, train_loss: 0.9491, test_loss: 1.1906, test_f1: 0.5054
 epoch: 17, train_loss: 0.9692, test_loss: 1.0983, test_f1: 0.5179
 epoch: 18, train_loss: 0.9445, test_loss: 1.1275, test_f1: 0.4936
 epoch: 19, train_loss: 0.9412, test_loss: 1.0599, test_f1: 0.4984
 epoch: 20, train_loss: 0.9218, test_loss: 1.1267, test_f1: 0.5002
 epoch: 21, train_loss: 0.9062, test_loss: 1.0129, test_f1: 0.5372
 epoch: 22, train_loss: 0.8896, test_loss: 1.0821, test_f1: 0.4908
 epoch: 23, train_loss: 0.9251, test_loss: 0.9778, test_f1: 0.5502
 epoch: 24, train_loss: 0.9028, test_loss: 1.2195, test_f1: 0.4267
 epoch: 25, train_loss: 0.9303, test_loss: 1.1083, test_f1: 0.5106
 epoch: 26, train_loss: 0.8947, test_loss: 1.0658, test_f1: 0.5375
 epoch: 27, train_loss: 0.9200, test_loss: 1.2000, test_f1: 0.4857
 epoch: 28, train_loss: 0.8989, test_loss: 1.0347, test_f1: 0.5623
 epoch: 29, train_loss: 0.8921, test_loss: 1.0587, test_f1: 0.5414
 epoch: 30, train_loss: 0.9193, test_loss: 1.1309, test_f1: 0.5249
 epoch: 31, train_loss: 0.8928, test_loss: 1.1660, test_f1: 0.4578
 epoch: 32, train_loss: 0.8713, test_loss: 1.1934, test_f1: 0.4470
 epoch: 33, train_loss: 0.8727, test_loss: 0.9950, test_f1: 0.5701
 epoch: 34, train_loss: 0.8778, test_loss: 1.0582, test_f1: 0.5466
 epoch: 35, train_loss: 0.8689, test_loss: 1.0376, test_f1: 0.5293
 epoch: 36, train_loss: 0.8606, test_loss: 0.9713, test_f1: 0.5608
 epoch: 37, train_loss: 0.8496, test_loss: 1.0354, test_f1: 0.5385
 epoch: 38, train_loss: 0.8594, test_loss: 1.0827, test_f1: 0.5641
 epoch: 39, train_loss: 0.8299, test_loss: 1.1401, test_f1: 0.5478
 epoch: 40, train_loss: 0.8464, test_loss: 1.0423, test_f1: 0.5427
 epoch: 41, train_loss: 0.8612, test_loss: 1.0438, test_f1: 0.5419
 epoch: 42, train_loss: 0.8406, test_loss: 1.1587, test_f1: 0.5213
 epoch: 43, train_loss: 0.8634, test_loss: 1.3965, test_f1: 0.4408
 epoch: 44, train_loss: 0.8446, test_loss: 1.0717, test_f1: 0.5281
 epoch: 45, train_loss: 0.8193, test_loss: 1.1378, test_f1: 0.5415
 epoch: 46, train_loss: 0.8098, test_loss: 1.0062, test_f1: 0.5681
 epoch: 47, train_loss: 0.8011, test_loss: 1.1706, test_f1: 0.4810
 epoch: 48, train_loss: 0.8179, test_loss: 1.0958, test_f1: 0.5394
 epoch: 49, train_loss: 0.8077, test_loss: 1.4279, test_f1: 0.4750
 epoch: 50, train_loss: 0.8122, test_loss: 1.1876, test_f1: 0.5449
 epoch: 51, train_loss: 0.7913, test_loss: 1.0594, test_f1: 0.5548
 epoch: 52, train_loss: 0.7983, test_loss: 1.0620, test_f1: 0.5683
 epoch: 53, train_loss: 0.7661, test_loss: 1.1094, test_f1: 0.5704
 epoch: 54, train_loss: 0.7755, test_loss: 1.0693, test_f1: 0.5669
 epoch: 55, train_loss: 0.7793, test_loss: 1.1182, test_f1: 0.5494
 epoch: 56, train_loss: 0.7615, test_loss: 1.2083, test_f1: 0.5426
 epoch: 57, train_loss: 0.7727, test_loss: 1.1521, test_f1: 0.5679
 epoch: 58, train_loss: 0.7531, test_loss: 1.2670, test_f1: 0.5300
 epoch: 59, train_loss: 0.7565, test_loss: 1.1850, test_f1: 0.5243
 epoch: 60, train_loss: 0.7589, test_loss: 1.1204, test_f1: 0.5614
 epoch: 61, train_loss: 0.7600, test_loss: 1.1233, test_f1: 0.5934
 epoch: 62, train_loss: 0.7607, test_loss: 1.1667, test_f1: 0.5382
 epoch: 63, train_loss: 0.7509, test_loss: 1.0752, test_f1: 0.5371
 epoch: 64, train_loss: 0.7465, test_loss: 1.1177, test_f1: 0.5664
 epoch: 65, train_loss: 0.7604, test_loss: 1.1343, test_f1: 0.5766
 epoch: 66, train_loss: 0.7526, test_loss: 1.1602, test_f1: 0.5692
 epoch: 67, train_loss: 0.7453, test_loss: 1.0833, test_f1: 0.5864
 epoch: 68, train_loss: 0.7520, test_loss: 1.0355, test_f1: 0.6045
 epoch: 69, train_loss: 0.7224, test_loss: 1.2180, test_f1: 0.5734
 epoch: 70, train_loss: 0.7273, test_loss: 1.1455, test_f1: 0.5999
 epoch: 71, train_loss: 0.7251, test_loss: 1.1377, test_f1: 0.5993
 epoch: 72, train_loss: 0.7139, test_loss: 1.0945, test_f1: 0.5759
 epoch: 73, train_loss: 0.7330, test_loss: 1.2092, test_f1: 0.5729
 epoch: 74, train_loss: 0.7165, test_loss: 1.1994, test_f1: 0.5939
 epoch: 75, train_loss: 0.7142, test_loss: 1.3265, test_f1: 0.5566
 epoch: 76, train_loss: 0.7301, test_loss: 1.1722, test_f1: 0.5930
 epoch: 77, train_loss: 0.7093, test_loss: 1.0937, test_f1: 0.6061
 epoch: 78, train_loss: 0.7314, test_loss: 1.0931, test_f1: 0.5997
 epoch: 79, train_loss: 0.7321, test_loss: 1.0978, test_f1: 0.5909
 epoch: 80, train_loss: 0.7366, test_loss: 1.1588, test_f1: 0.5898
 epoch: 81, train_loss: 0.7199, test_loss: 1.2824, test_f1: 0.5537
 epoch: 82, train_loss: 0.7072, test_loss: 1.1125, test_f1: 0.5837
 epoch: 83, train_loss: 0.7055, test_loss: 1.1211, test_f1: 0.5897
 epoch: 84, train_loss: 0.6870, test_loss: 1.1690, test_f1: 0.6001
 epoch: 85, train_loss: 0.6965, test_loss: 1.1488, test_f1: 0.6320
 epoch: 86, train_loss: 0.7082, test_loss: 1.1745, test_f1: 0.5843
 epoch: 87, train_loss: 0.7035, test_loss: 1.1779, test_f1: 0.5875
 epoch: 88, train_loss: 0.7061, test_loss: 1.1963, test_f1: 0.5804
 epoch: 89, train_loss: 0.7149, test_loss: 1.1381, test_f1: 0.6048
 epoch: 90, train_loss: 0.7146, test_loss: 1.1393, test_f1: 0.5857
 epoch: 91, train_loss: 0.7111, test_loss: 1.1627, test_f1: 0.5958
 epoch: 92, train_loss: 0.7202, test_loss: 1.1295, test_f1: 0.6195
 epoch: 93, train_loss: 0.6970, test_loss: 1.1399, test_f1: 0.6078
 epoch: 94, train_loss: 0.6934, test_loss: 1.1075, test_f1: 0.5868
 epoch: 95, train_loss: 0.6956, test_loss: 1.1349, test_f1: 0.6151
 epoch: 96, train_loss: 0.6773, test_loss: 1.2926, test_f1: 0.5945
 epoch: 97, train_loss: 0.6950, test_loss: 1.2683, test_f1: 0.5850
 epoch: 98, train_loss: 0.6883, test_loss: 1.2157, test_f1: 0.6090
 epoch: 99, train_loss: 0.7080, test_loss: 1.1920, test_f1: 0.5981

Training completed in 288.66 seconds
Best F1: 0.6341 at epoch 93
Mean F1 across iterations: 0.6130  0.0158
========================FINAL RESULTS================================
FEGIN weighted F1: 0.6341  0.0158
python main.py --data ltspice_demos --representation component_net --model FEGIN --layers 3 --hiddens 16 --batch_size 256 --lr 0.01 --emb_size 250 --epochs 100 --save_appendix component_net_L3_H16_BS256_LR0.01_E250 --no_val
-----



STDERR:
  File "main.py", line 370, in <module>
    main()
  File "main.py", line 254, in main
    dataset = dataset_class(
  File "/home/philip/projects/ltspice_examples_code_repo/Circuit-Completion-Using-GNNs/component_classification_with_link_prediction_head/evaluation/FEGIN/kernel/circuit_datasets.py", line 15, in __init__
    self.data, self.slices = torch.load(self.processed_paths[0])
  File "/home/philip/.local/lib/python3.8/site-packages/torch/serialization.py", line 1040, in load
    warnings.warn(
  File "/usr/lib/python3.8/warnings.py", line 109, in _showwarnmsg
    sw(msg.message, msg.category, msg.filename, msg.lineno,
  File "main.py", line 47, in warn_with_traceback
    traceback.print_stack(file=log)
/home/philip/projects/ltspice_examples_code_repo/Circuit-Completion-Using-GNNs/component_classification_with_link_prediction_head/evaluation/FEGIN/kernel/circuit_datasets.py:15: FutureWarning: You are using `torch.load` with `weights_only=False` (the current default value), which uses the default pickle module implicitly. It is possible to construct malicious pickle data which will execute arbitrary code during unpickling (See https://github.com/pytorch/pytorch/blob/main/SECURITY.md#untrusted-models for more details). In a future release, the default value for `weights_only` will be flipped to `True`. This limits the functions that could be executed during unpickling. Arbitrary objects will no longer be allowed to be loaded via this mode unless they are explicitly allowlisted by the user via `torch.serialization.add_safe_globals`. We recommend you start setting `weights_only=True` for any use case where you don't have full control of the loaded file. Please open an issue on GitHub for any issues related to this experimental feature.
  self.data, self.slices = torch.load(self.processed_paths[0])
