STDOUT:
Results will be saved in /home/philip/projects/ltspice_examples_code_repo/Circuit-Completion-Using-GNNs/component_classification_with_link_prediction_head/evaluation/FEGIN/results/model_FEGIN_dataset_ltspice_examples
Command line input: python main.py --data ltspice_examples --representation component_pin_net --model FEGIN --layers 6 --hiddens 16 --batch_size 64 --lr 0.01 --emb_size 512 --epochs 100 --save_appendix component_pin_net_L6_H16_BS64_LR0.01_E512 --no_val
 is saved.
-----
ltspice_examples - FEGIN
Using 6 layers, 16 hidden units, h = 2
Loading component_pin_net representation dataset
ENTERED
Training FEGIN on component_pin_net representation
Train: 3558, Test: 846
##################ITERATION #0 ****************************************
 epoch: 0, train_loss: 1.2133, test_loss: 1.1495, test_f1: 0.3475
 epoch: 1, train_loss: 1.0511, test_loss: 1.0309, test_f1: 0.4552
 epoch: 2, train_loss: 1.0199, test_loss: 1.1884, test_f1: 0.4307
 epoch: 3, train_loss: 0.9948, test_loss: 1.0600, test_f1: 0.4693
 epoch: 4, train_loss: 0.9949, test_loss: 0.9833, test_f1: 0.4834
 epoch: 5, train_loss: 0.9733, test_loss: 1.0758, test_f1: 0.4883
 epoch: 6, train_loss: 0.9720, test_loss: 1.0599, test_f1: 0.4582
 epoch: 7, train_loss: 0.9700, test_loss: 0.9541, test_f1: 0.4839
 epoch: 8, train_loss: 0.9489, test_loss: 0.9516, test_f1: 0.4375
 epoch: 9, train_loss: 0.9431, test_loss: 1.0250, test_f1: 0.4739
 epoch: 10, train_loss: 0.9381, test_loss: 1.3505, test_f1: 0.3835
 epoch: 11, train_loss: 0.9420, test_loss: 0.9243, test_f1: 0.5044
 epoch: 12, train_loss: 0.9206, test_loss: 0.9485, test_f1: 0.4993
 epoch: 13, train_loss: 0.9317, test_loss: 0.9645, test_f1: 0.5069
 epoch: 14, train_loss: 0.9199, test_loss: 0.9993, test_f1: 0.4982
 epoch: 15, train_loss: 0.9063, test_loss: 0.9634, test_f1: 0.5127
 epoch: 16, train_loss: 0.9282, test_loss: 0.9736, test_f1: 0.4845
 epoch: 17, train_loss: 0.9178, test_loss: 0.9370, test_f1: 0.5129
 epoch: 18, train_loss: 0.9140, test_loss: 0.9390, test_f1: 0.4965
 epoch: 19, train_loss: 0.8958, test_loss: 1.0756, test_f1: 0.4752
 epoch: 20, train_loss: 0.8939, test_loss: 0.9681, test_f1: 0.5095
 epoch: 21, train_loss: 0.8979, test_loss: 0.9894, test_f1: 0.5106
 epoch: 22, train_loss: 0.8868, test_loss: 0.9064, test_f1: 0.5547
 epoch: 23, train_loss: 0.9028, test_loss: 0.9231, test_f1: 0.5233
 epoch: 24, train_loss: 0.8945, test_loss: 0.9615, test_f1: 0.5209
 epoch: 25, train_loss: 0.8847, test_loss: 0.9911, test_f1: 0.5042
 epoch: 26, train_loss: 0.8854, test_loss: 0.9266, test_f1: 0.5016
 epoch: 27, train_loss: 0.8975, test_loss: 0.8962, test_f1: 0.4957
 epoch: 28, train_loss: 0.8837, test_loss: 0.9493, test_f1: 0.5060
 epoch: 29, train_loss: 0.8728, test_loss: 0.9358, test_f1: 0.4848
 epoch: 30, train_loss: 0.8780, test_loss: 0.8951, test_f1: 0.5243
 epoch: 31, train_loss: 0.8655, test_loss: 0.9177, test_f1: 0.5847
 epoch: 32, train_loss: 0.8639, test_loss: 1.0226, test_f1: 0.4701
 epoch: 33, train_loss: 0.8588, test_loss: 0.8648, test_f1: 0.5368
 epoch: 34, train_loss: 0.8604, test_loss: 0.9838, test_f1: 0.5663
 epoch: 35, train_loss: 0.8639, test_loss: 0.8360, test_f1: 0.5262
 epoch: 36, train_loss: 0.8481, test_loss: 0.8724, test_f1: 0.5107
 epoch: 37, train_loss: 0.8584, test_loss: 0.8394, test_f1: 0.5437
 epoch: 38, train_loss: 0.8447, test_loss: 0.8962, test_f1: 0.5033
 epoch: 39, train_loss: 0.8456, test_loss: 0.8670, test_f1: 0.5191
 epoch: 40, train_loss: 0.8402, test_loss: 1.0365, test_f1: 0.5051
 epoch: 41, train_loss: 0.8389, test_loss: 0.8515, test_f1: 0.5208
 epoch: 42, train_loss: 0.8372, test_loss: 0.8376, test_f1: 0.5531
 epoch: 43, train_loss: 0.8412, test_loss: 0.9121, test_f1: 0.5116
 epoch: 44, train_loss: 0.8285, test_loss: 0.8206, test_f1: 0.5242
 epoch: 45, train_loss: 0.8163, test_loss: 0.8066, test_f1: 0.5506
 epoch: 46, train_loss: 0.8331, test_loss: 0.8745, test_f1: 0.5437
 epoch: 47, train_loss: 0.8294, test_loss: 0.8228, test_f1: 0.5370
 epoch: 48, train_loss: 0.8236, test_loss: 0.8276, test_f1: 0.5316
 epoch: 49, train_loss: 0.8280, test_loss: 0.8137, test_f1: 0.5367
 epoch: 50, train_loss: 0.8168, test_loss: 0.8124, test_f1: 0.5475
 epoch: 51, train_loss: 0.8105, test_loss: 0.8036, test_f1: 0.5576
 epoch: 52, train_loss: 0.7904, test_loss: 0.8094, test_f1: 0.5591
 epoch: 53, train_loss: 0.7844, test_loss: 0.7657, test_f1: 0.5605
 epoch: 54, train_loss: 0.7844, test_loss: 0.8115, test_f1: 0.5362
 epoch: 55, train_loss: 0.7676, test_loss: 0.9489, test_f1: 0.5283
 epoch: 56, train_loss: 0.7686, test_loss: 0.7693, test_f1: 0.5529
 epoch: 57, train_loss: 0.7638, test_loss: 0.7722, test_f1: 0.5976
 epoch: 58, train_loss: 0.7695, test_loss: 0.8198, test_f1: 0.5486
 epoch: 59, train_loss: 0.7543, test_loss: 0.7623, test_f1: 0.5831
 epoch: 60, train_loss: 0.7708, test_loss: 0.8166, test_f1: 0.5784
 epoch: 61, train_loss: 0.7566, test_loss: 0.8577, test_f1: 0.5792
 epoch: 62, train_loss: 0.7498, test_loss: 0.7890, test_f1: 0.5702
 epoch: 63, train_loss: 0.7574, test_loss: 0.8283, test_f1: 0.5723
 epoch: 64, train_loss: 0.7449, test_loss: 0.7989, test_f1: 0.5618
 epoch: 65, train_loss: 0.7432, test_loss: 0.7611, test_f1: 0.6100
 epoch: 66, train_loss: 0.7485, test_loss: 0.8067, test_f1: 0.5989
 epoch: 67, train_loss: 0.7383, test_loss: 0.8022, test_f1: 0.5810
 epoch: 68, train_loss: 0.7358, test_loss: 0.8080, test_f1: 0.5771
 epoch: 69, train_loss: 0.7447, test_loss: 0.7879, test_f1: 0.5769
 epoch: 70, train_loss: 0.7413, test_loss: 0.7167, test_f1: 0.5914
 epoch: 71, train_loss: 0.7325, test_loss: 0.8102, test_f1: 0.6009
 epoch: 72, train_loss: 0.7291, test_loss: 0.7576, test_f1: 0.6026
 epoch: 73, train_loss: 0.7353, test_loss: 0.8043, test_f1: 0.5985
 epoch: 74, train_loss: 0.7374, test_loss: 0.7613, test_f1: 0.6196
 epoch: 75, train_loss: 0.7208, test_loss: 0.7576, test_f1: 0.5909
 epoch: 76, train_loss: 0.7304, test_loss: 0.8423, test_f1: 0.5560
 epoch: 77, train_loss: 0.7416, test_loss: 0.7417, test_f1: 0.6070
 epoch: 78, train_loss: 0.7299, test_loss: 0.8516, test_f1: 0.5812
 epoch: 79, train_loss: 0.7369, test_loss: 0.8257, test_f1: 0.5563
 epoch: 80, train_loss: 0.7089, test_loss: 0.8300, test_f1: 0.5569
 epoch: 81, train_loss: 0.7270, test_loss: 0.7563, test_f1: 0.5666
 epoch: 82, train_loss: 0.7243, test_loss: 0.8193, test_f1: 0.6126
 epoch: 83, train_loss: 0.7136, test_loss: 0.7379, test_f1: 0.6262
 epoch: 84, train_loss: 0.7203, test_loss: 0.8472, test_f1: 0.6101
 epoch: 85, train_loss: 0.7160, test_loss: 0.7358, test_f1: 0.5792
 epoch: 86, train_loss: 0.7150, test_loss: 0.7360, test_f1: 0.6139
 epoch: 87, train_loss: 0.7128, test_loss: 0.8883, test_f1: 0.5976
 epoch: 88, train_loss: 0.7097, test_loss: 0.7612, test_f1: 0.6163
 epoch: 89, train_loss: 0.7136, test_loss: 0.7502, test_f1: 0.6378
 epoch: 90, train_loss: 0.7111, test_loss: 0.7625, test_f1: 0.6056
 epoch: 91, train_loss: 0.7219, test_loss: 0.7833, test_f1: 0.5997
 epoch: 92, train_loss: 0.6976, test_loss: 0.8660, test_f1: 0.6072
 epoch: 93, train_loss: 0.7088, test_loss: 0.7346, test_f1: 0.6236
 epoch: 94, train_loss: 0.7131, test_loss: 0.7612, test_f1: 0.6235
 epoch: 95, train_loss: 0.7107, test_loss: 0.8194, test_f1: 0.5551
 epoch: 96, train_loss: 0.7073, test_loss: 0.7787, test_f1: 0.6058
 epoch: 97, train_loss: 0.6886, test_loss: 0.7772, test_f1: 0.6208
 epoch: 98, train_loss: 0.6869, test_loss: 0.7657, test_f1: 0.6205
 epoch: 99, train_loss: 0.6898, test_loss: 0.7839, test_f1: 0.5853
##################ITERATION #1 ****************************************
 epoch: 0, train_loss: 1.1292, test_loss: 1.1364, test_f1: 0.3949
 epoch: 1, train_loss: 1.0354, test_loss: 1.1292, test_f1: 0.3595
 epoch: 2, train_loss: 1.0086, test_loss: 1.0543, test_f1: 0.4738
 epoch: 3, train_loss: 0.9958, test_loss: 1.0186, test_f1: 0.4711
 epoch: 4, train_loss: 0.9677, test_loss: 1.0522, test_f1: 0.4335
 epoch: 5, train_loss: 0.9705, test_loss: 0.9670, test_f1: 0.4765
 epoch: 6, train_loss: 0.9683, test_loss: 1.0109, test_f1: 0.4963
 epoch: 7, train_loss: 0.9710, test_loss: 1.0195, test_f1: 0.4580
 epoch: 8, train_loss: 0.9548, test_loss: 1.0102, test_f1: 0.4914
 epoch: 9, train_loss: 0.9532, test_loss: 0.9733, test_f1: 0.5068
 epoch: 10, train_loss: 0.9296, test_loss: 0.9514, test_f1: 0.4890
 epoch: 11, train_loss: 0.9429, test_loss: 1.2390, test_f1: 0.4124
 epoch: 12, train_loss: 0.9488, test_loss: 1.0395, test_f1: 0.5406
 epoch: 13, train_loss: 0.9429, test_loss: 1.0329, test_f1: 0.4837
 epoch: 14, train_loss: 0.9254, test_loss: 0.9506, test_f1: 0.5010
 epoch: 15, train_loss: 0.9270, test_loss: 1.0421, test_f1: 0.4371
 epoch: 16, train_loss: 0.9081, test_loss: 1.0169, test_f1: 0.5205
 epoch: 17, train_loss: 0.9094, test_loss: 0.9793, test_f1: 0.5172
 epoch: 18, train_loss: 0.9108, test_loss: 1.0098, test_f1: 0.4853
 epoch: 19, train_loss: 0.8933, test_loss: 0.9067, test_f1: 0.5016
 epoch: 20, train_loss: 0.8968, test_loss: 0.9245, test_f1: 0.5432
 epoch: 21, train_loss: 0.8826, test_loss: 0.8639, test_f1: 0.5645
 epoch: 22, train_loss: 0.8804, test_loss: 0.8802, test_f1: 0.5576
 epoch: 23, train_loss: 0.8689, test_loss: 0.9065, test_f1: 0.5139
 epoch: 24, train_loss: 0.8652, test_loss: 0.8515, test_f1: 0.5359
 epoch: 25, train_loss: 0.8540, test_loss: 0.8938, test_f1: 0.5905
 epoch: 26, train_loss: 0.8517, test_loss: 1.0825, test_f1: 0.4927
 epoch: 27, train_loss: 0.8438, test_loss: 0.8984, test_f1: 0.5380
 epoch: 28, train_loss: 0.8482, test_loss: 0.9010, test_f1: 0.5029
 epoch: 29, train_loss: 0.8611, test_loss: 0.8666, test_f1: 0.5728
 epoch: 30, train_loss: 0.8351, test_loss: 0.8621, test_f1: 0.5481
 epoch: 31, train_loss: 0.8826, test_loss: 0.8715, test_f1: 0.5481
 epoch: 32, train_loss: 0.8546, test_loss: 0.8502, test_f1: 0.5252
 epoch: 33, train_loss: 0.8403, test_loss: 0.8949, test_f1: 0.5962
 epoch: 34, train_loss: 0.8391, test_loss: 0.9052, test_f1: 0.5525
 epoch: 35, train_loss: 0.8343, test_loss: 0.8822, test_f1: 0.5658
 epoch: 36, train_loss: 0.8267, test_loss: 0.7700, test_f1: 0.6011
 epoch: 37, train_loss: 0.8281, test_loss: 0.8016, test_f1: 0.5345
 epoch: 38, train_loss: 0.8226, test_loss: 0.8764, test_f1: 0.5986
 epoch: 39, train_loss: 0.8374, test_loss: 0.9465, test_f1: 0.5527
 epoch: 40, train_loss: 0.8266, test_loss: 0.9220, test_f1: 0.4769
 epoch: 41, train_loss: 0.8266, test_loss: 0.8311, test_f1: 0.5701
 epoch: 42, train_loss: 0.8175, test_loss: 0.8716, test_f1: 0.5786
 epoch: 43, train_loss: 0.8090, test_loss: 0.8472, test_f1: 0.5547
 epoch: 44, train_loss: 0.8128, test_loss: 0.8998, test_f1: 0.5232
 epoch: 45, train_loss: 0.8271, test_loss: 0.8689, test_f1: 0.5535
 epoch: 46, train_loss: 0.8142, test_loss: 0.8974, test_f1: 0.5635
 epoch: 47, train_loss: 0.8067, test_loss: 0.9161, test_f1: 0.5745
 epoch: 48, train_loss: 0.8130, test_loss: 0.8412, test_f1: 0.5793
 epoch: 49, train_loss: 0.8024, test_loss: 0.8231, test_f1: 0.6072
 epoch: 50, train_loss: 0.8020, test_loss: 0.8811, test_f1: 0.5553
 epoch: 51, train_loss: 0.8025, test_loss: 0.8377, test_f1: 0.6170
 epoch: 52, train_loss: 0.7748, test_loss: 0.8390, test_f1: 0.5939
 epoch: 53, train_loss: 0.7667, test_loss: 0.8301, test_f1: 0.6398
 epoch: 54, train_loss: 0.7726, test_loss: 0.7993, test_f1: 0.6304
 epoch: 55, train_loss: 0.7644, test_loss: 0.8769, test_f1: 0.6079
 epoch: 56, train_loss: 0.7622, test_loss: 0.8565, test_f1: 0.6222
 epoch: 57, train_loss: 0.7473, test_loss: 0.8199, test_f1: 0.5828
 epoch: 58, train_loss: 0.7682, test_loss: 0.8658, test_f1: 0.5856
 epoch: 59, train_loss: 0.7623, test_loss: 0.8360, test_f1: 0.6152
 epoch: 60, train_loss: 0.7656, test_loss: 0.8673, test_f1: 0.6005
 epoch: 61, train_loss: 0.7506, test_loss: 0.8475, test_f1: 0.6113
 epoch: 62, train_loss: 0.7432, test_loss: 0.8794, test_f1: 0.6029
 epoch: 63, train_loss: 0.7553, test_loss: 0.8535, test_f1: 0.5885
 epoch: 64, train_loss: 0.7505, test_loss: 0.8043, test_f1: 0.6109
 epoch: 65, train_loss: 0.7510, test_loss: 0.8380, test_f1: 0.6001
 epoch: 66, train_loss: 0.7532, test_loss: 0.8034, test_f1: 0.6258
 epoch: 67, train_loss: 0.7404, test_loss: 0.8007, test_f1: 0.6270
 epoch: 68, train_loss: 0.7324, test_loss: 0.8220, test_f1: 0.6185
 epoch: 69, train_loss: 0.7425, test_loss: 0.8601, test_f1: 0.5997
 epoch: 70, train_loss: 0.7488, test_loss: 0.8184, test_f1: 0.6273
 epoch: 71, train_loss: 0.7414, test_loss: 0.8616, test_f1: 0.6193
 epoch: 72, train_loss: 0.7410, test_loss: 0.8762, test_f1: 0.5876
 epoch: 73, train_loss: 0.7408, test_loss: 0.8389, test_f1: 0.6226
 epoch: 74, train_loss: 0.7384, test_loss: 0.8838, test_f1: 0.6012
 epoch: 75, train_loss: 0.7372, test_loss: 0.8476, test_f1: 0.6222
 epoch: 76, train_loss: 0.7409, test_loss: 0.8222, test_f1: 0.6380
 epoch: 77, train_loss: 0.7432, test_loss: 0.8816, test_f1: 0.6221
 epoch: 78, train_loss: 0.7401, test_loss: 0.8455, test_f1: 0.6092
 epoch: 79, train_loss: 0.7291, test_loss: 0.9406, test_f1: 0.5962
 epoch: 80, train_loss: 0.7271, test_loss: 0.8791, test_f1: 0.6061
 epoch: 81, train_loss: 0.7302, test_loss: 0.7973, test_f1: 0.6330
 epoch: 82, train_loss: 0.7159, test_loss: 0.8763, test_f1: 0.6026
 epoch: 83, train_loss: 0.7230, test_loss: 0.9836, test_f1: 0.5961
 epoch: 84, train_loss: 0.7240, test_loss: 0.8508, test_f1: 0.6396
 epoch: 85, train_loss: 0.7254, test_loss: 0.8871, test_f1: 0.6137
 epoch: 86, train_loss: 0.7205, test_loss: 0.8496, test_f1: 0.6293
 epoch: 87, train_loss: 0.7165, test_loss: 0.8423, test_f1: 0.6663
 epoch: 88, train_loss: 0.7119, test_loss: 0.8156, test_f1: 0.6195
 epoch: 89, train_loss: 0.7198, test_loss: 0.8690, test_f1: 0.6619
 epoch: 90, train_loss: 0.7170, test_loss: 0.9101, test_f1: 0.6160
 epoch: 91, train_loss: 0.7124, test_loss: 0.9007, test_f1: 0.6635
 epoch: 92, train_loss: 0.7273, test_loss: 0.8098, test_f1: 0.6683
 epoch: 93, train_loss: 0.7108, test_loss: 0.8380, test_f1: 0.6479
 epoch: 94, train_loss: 0.7069, test_loss: 0.8420, test_f1: 0.6255
 epoch: 95, train_loss: 0.7111, test_loss: 0.8733, test_f1: 0.6522
 epoch: 96, train_loss: 0.7061, test_loss: 0.8625, test_f1: 0.6491
 epoch: 97, train_loss: 0.7181, test_loss: 0.9001, test_f1: 0.6575
 epoch: 98, train_loss: 0.7059, test_loss: 0.8440, test_f1: 0.6599
 epoch: 99, train_loss: 0.6898, test_loss: 0.9481, test_f1: 0.6332
##################ITERATION #2 ****************************************
 epoch: 0, train_loss: 1.1594, test_loss: 1.1164, test_f1: 0.3429
 epoch: 1, train_loss: 1.0584, test_loss: 1.0591, test_f1: 0.4384
 epoch: 2, train_loss: 1.0181, test_loss: 1.0813, test_f1: 0.4579
 epoch: 3, train_loss: 0.9934, test_loss: 0.9843, test_f1: 0.4657
 epoch: 4, train_loss: 0.9945, test_loss: 1.0383, test_f1: 0.4562
 epoch: 5, train_loss: 0.9836, test_loss: 0.9974, test_f1: 0.4711
 epoch: 6, train_loss: 0.9853, test_loss: 1.0276, test_f1: 0.4786
 epoch: 7, train_loss: 0.9675, test_loss: 0.9885, test_f1: 0.4936
 epoch: 8, train_loss: 0.9610, test_loss: 1.0023, test_f1: 0.4576
 epoch: 9, train_loss: 0.9499, test_loss: 1.0155, test_f1: 0.4747
 epoch: 10, train_loss: 0.9379, test_loss: 0.9943, test_f1: 0.4820
 epoch: 11, train_loss: 0.9532, test_loss: 0.9732, test_f1: 0.4807
 epoch: 12, train_loss: 0.9347, test_loss: 0.9488, test_f1: 0.5294
 epoch: 13, train_loss: 0.9427, test_loss: 0.9342, test_f1: 0.4638
 epoch: 14, train_loss: 0.9252, test_loss: 0.9584, test_f1: 0.5127
 epoch: 15, train_loss: 0.9185, test_loss: 0.9636, test_f1: 0.4928
 epoch: 16, train_loss: 0.9443, test_loss: 0.9992, test_f1: 0.4906
 epoch: 17, train_loss: 0.9334, test_loss: 1.0187, test_f1: 0.4826
 epoch: 18, train_loss: 0.9240, test_loss: 1.0907, test_f1: 0.4579
 epoch: 19, train_loss: 0.9243, test_loss: 0.9554, test_f1: 0.4970
 epoch: 20, train_loss: 0.9175, test_loss: 0.9607, test_f1: 0.4995
 epoch: 21, train_loss: 0.9048, test_loss: 0.9429, test_f1: 0.5026
 epoch: 22, train_loss: 0.8995, test_loss: 0.8522, test_f1: 0.5258
 epoch: 23, train_loss: 0.8990, test_loss: 0.9292, test_f1: 0.5359
 epoch: 24, train_loss: 0.8955, test_loss: 0.8720, test_f1: 0.5352
 epoch: 25, train_loss: 0.8885, test_loss: 0.9866, test_f1: 0.4398
 epoch: 26, train_loss: 0.8936, test_loss: 0.9471, test_f1: 0.5312
 epoch: 27, train_loss: 0.8818, test_loss: 0.9603, test_f1: 0.5511
 epoch: 28, train_loss: 0.8741, test_loss: 0.9595, test_f1: 0.5195
 epoch: 29, train_loss: 0.8744, test_loss: 0.9421, test_f1: 0.5172
 epoch: 30, train_loss: 0.8797, test_loss: 0.8346, test_f1: 0.5628
 epoch: 31, train_loss: 0.8592, test_loss: 0.8796, test_f1: 0.5944
 epoch: 32, train_loss: 0.8586, test_loss: 0.9122, test_f1: 0.5246
 epoch: 33, train_loss: 0.8555, test_loss: 0.9763, test_f1: 0.4805
 epoch: 34, train_loss: 0.8611, test_loss: 0.9277, test_f1: 0.5655
 epoch: 35, train_loss: 0.8343, test_loss: 0.9152, test_f1: 0.5620
 epoch: 36, train_loss: 0.8610, test_loss: 0.9797, test_f1: 0.5379
 epoch: 37, train_loss: 0.8462, test_loss: 0.8301, test_f1: 0.5797
 epoch: 38, train_loss: 0.8479, test_loss: 0.8181, test_f1: 0.5825
 epoch: 39, train_loss: 0.8406, test_loss: 0.9315, test_f1: 0.5764
 epoch: 40, train_loss: 0.8548, test_loss: 0.9803, test_f1: 0.5430
 epoch: 41, train_loss: 0.8423, test_loss: 0.8312, test_f1: 0.5716
 epoch: 42, train_loss: 0.8412, test_loss: 0.7871, test_f1: 0.6018
 epoch: 43, train_loss: 0.8395, test_loss: 0.8730, test_f1: 0.5754
 epoch: 44, train_loss: 0.8301, test_loss: 0.8406, test_f1: 0.5789
 epoch: 45, train_loss: 0.8203, test_loss: 0.8952, test_f1: 0.5674
 epoch: 46, train_loss: 0.8175, test_loss: 0.8774, test_f1: 0.6007
 epoch: 47, train_loss: 0.8027, test_loss: 0.7996, test_f1: 0.5858
 epoch: 48, train_loss: 0.8334, test_loss: 1.1320, test_f1: 0.4788
 epoch: 49, train_loss: 0.8244, test_loss: 0.7805, test_f1: 0.6194
 epoch: 50, train_loss: 0.8105, test_loss: 0.9083, test_f1: 0.5203
 epoch: 51, train_loss: 0.7907, test_loss: 0.8642, test_f1: 0.5906
 epoch: 52, train_loss: 0.7801, test_loss: 0.8299, test_f1: 0.6229
 epoch: 53, train_loss: 0.7848, test_loss: 0.8291, test_f1: 0.6363
 epoch: 54, train_loss: 0.7996, test_loss: 0.8405, test_f1: 0.6078
 epoch: 55, train_loss: 0.7785, test_loss: 0.8293, test_f1: 0.6409
 epoch: 56, train_loss: 0.7775, test_loss: 0.8458, test_f1: 0.6256
 epoch: 57, train_loss: 0.7733, test_loss: 0.8340, test_f1: 0.6159
 epoch: 58, train_loss: 0.7755, test_loss: 0.9344, test_f1: 0.6241
 epoch: 59, train_loss: 0.7717, test_loss: 0.8298, test_f1: 0.5901
 epoch: 60, train_loss: 0.7699, test_loss: 0.8589, test_f1: 0.6204
 epoch: 61, train_loss: 0.7495, test_loss: 0.7753, test_f1: 0.6290
 epoch: 62, train_loss: 0.7490, test_loss: 0.9159, test_f1: 0.6402
 epoch: 63, train_loss: 0.7625, test_loss: 1.0109, test_f1: 0.6148
 epoch: 64, train_loss: 0.7674, test_loss: 0.9089, test_f1: 0.5946
 epoch: 65, train_loss: 0.7641, test_loss: 0.8485, test_f1: 0.5855
 epoch: 66, train_loss: 0.7547, test_loss: 0.9437, test_f1: 0.6350
 epoch: 67, train_loss: 0.7637, test_loss: 0.8109, test_f1: 0.6064
 epoch: 68, train_loss: 0.7595, test_loss: 0.8639, test_f1: 0.6107
 epoch: 69, train_loss: 0.7398, test_loss: 0.8042, test_f1: 0.6185
 epoch: 70, train_loss: 0.7674, test_loss: 0.8013, test_f1: 0.5946
 epoch: 71, train_loss: 0.7539, test_loss: 0.8823, test_f1: 0.6057
 epoch: 72, train_loss: 0.7604, test_loss: 0.8817, test_f1: 0.6291
 epoch: 73, train_loss: 0.7594, test_loss: 0.8042, test_f1: 0.6064
 epoch: 74, train_loss: 0.7533, test_loss: 0.9058, test_f1: 0.6409
 epoch: 75, train_loss: 0.7324, test_loss: 0.8675, test_f1: 0.6281
 epoch: 76, train_loss: 0.7478, test_loss: 0.9809, test_f1: 0.6015
 epoch: 77, train_loss: 0.7470, test_loss: 0.9415, test_f1: 0.6145
 epoch: 78, train_loss: 0.7351, test_loss: 0.8076, test_f1: 0.6430
 epoch: 79, train_loss: 0.7269, test_loss: 0.9997, test_f1: 0.6256
 epoch: 80, train_loss: 0.7386, test_loss: 0.8986, test_f1: 0.6377
 epoch: 81, train_loss: 0.7320, test_loss: 0.8888, test_f1: 0.6429
 epoch: 82, train_loss: 0.7361, test_loss: 0.9094, test_f1: 0.6455
 epoch: 83, train_loss: 0.7195, test_loss: 0.8568, test_f1: 0.6320
 epoch: 84, train_loss: 0.7362, test_loss: 0.8088, test_f1: 0.6419
 epoch: 85, train_loss: 0.7472, test_loss: 0.8853, test_f1: 0.6200
 epoch: 86, train_loss: 0.7283, test_loss: 0.8617, test_f1: 0.6334
 epoch: 87, train_loss: 0.7459, test_loss: 0.9724, test_f1: 0.6249
 epoch: 88, train_loss: 0.7292, test_loss: 0.8837, test_f1: 0.6303
 epoch: 89, train_loss: 0.7464, test_loss: 0.8317, test_f1: 0.6333
 epoch: 90, train_loss: 0.7309, test_loss: 0.9399, test_f1: 0.6150
 epoch: 91, train_loss: 0.7077, test_loss: 0.9490, test_f1: 0.6089
 epoch: 92, train_loss: 0.7059, test_loss: 0.9158, test_f1: 0.6395
 epoch: 93, train_loss: 0.7042, test_loss: 0.8670, test_f1: 0.6362
 epoch: 94, train_loss: 0.7223, test_loss: 0.7824, test_f1: 0.6352
 epoch: 95, train_loss: 0.7018, test_loss: 0.8770, test_f1: 0.6266
 epoch: 96, train_loss: 0.7223, test_loss: 0.8325, test_f1: 0.6345
 epoch: 97, train_loss: 0.6999, test_loss: 0.8136, test_f1: 0.6312
 epoch: 98, train_loss: 0.6952, test_loss: 1.0277, test_f1: 0.6348
 epoch: 99, train_loss: 0.7020, test_loss: 0.8290, test_f1: 0.6203
##################ITERATION #3 ****************************************
 epoch: 0, train_loss: 1.2637, test_loss: 1.0304, test_f1: 0.4171
 epoch: 1, train_loss: 1.0266, test_loss: 1.0479, test_f1: 0.4383
 epoch: 2, train_loss: 1.0072, test_loss: 1.0103, test_f1: 0.4129
 epoch: 3, train_loss: 0.9971, test_loss: 0.9750, test_f1: 0.4913
 epoch: 4, train_loss: 0.9634, test_loss: 1.0233, test_f1: 0.4747
 epoch: 5, train_loss: 0.9621, test_loss: 0.9832, test_f1: 0.5244
 epoch: 6, train_loss: 0.9747, test_loss: 1.0116, test_f1: 0.4962
 epoch: 7, train_loss: 0.9750, test_loss: 0.9776, test_f1: 0.4762
 epoch: 8, train_loss: 0.9494, test_loss: 0.9802, test_f1: 0.4951
 epoch: 9, train_loss: 0.9381, test_loss: 0.9225, test_f1: 0.4951
 epoch: 10, train_loss: 0.9223, test_loss: 0.8799, test_f1: 0.5022
 epoch: 11, train_loss: 0.9121, test_loss: 0.9066, test_f1: 0.4926
 epoch: 12, train_loss: 0.9241, test_loss: 0.8728, test_f1: 0.5583
 epoch: 13, train_loss: 0.9147, test_loss: 0.9020, test_f1: 0.4941
 epoch: 14, train_loss: 0.9220, test_loss: 0.9224, test_f1: 0.5298
 epoch: 15, train_loss: 0.8953, test_loss: 0.9566, test_f1: 0.5275
 epoch: 16, train_loss: 0.8983, test_loss: 0.8920, test_f1: 0.5050
 epoch: 17, train_loss: 0.8998, test_loss: 1.0595, test_f1: 0.4693
 epoch: 18, train_loss: 0.9039, test_loss: 0.9266, test_f1: 0.4915
 epoch: 19, train_loss: 0.8756, test_loss: 1.0010, test_f1: 0.5008
 epoch: 20, train_loss: 0.8684, test_loss: 0.8917, test_f1: 0.5148
 epoch: 21, train_loss: 0.8723, test_loss: 0.9422, test_f1: 0.5110
 epoch: 22, train_loss: 0.8824, test_loss: 0.8181, test_f1: 0.5546
 epoch: 23, train_loss: 0.8691, test_loss: 0.9106, test_f1: 0.5313
 epoch: 24, train_loss: 0.8504, test_loss: 0.8159, test_f1: 0.5422
 epoch: 25, train_loss: 0.8629, test_loss: 0.9001, test_f1: 0.5410
 epoch: 26, train_loss: 0.8663, test_loss: 0.8724, test_f1: 0.5192
 epoch: 27, train_loss: 0.8518, test_loss: 0.8452, test_f1: 0.5226
 epoch: 28, train_loss: 0.8507, test_loss: 0.8660, test_f1: 0.5456
 epoch: 29, train_loss: 0.8568, test_loss: 0.8508, test_f1: 0.5682
 epoch: 30, train_loss: 0.8443, test_loss: 0.7833, test_f1: 0.5888
 epoch: 31, train_loss: 0.8455, test_loss: 0.8368, test_f1: 0.5998
 epoch: 32, train_loss: 0.8490, test_loss: 1.0251, test_f1: 0.4671
 epoch: 33, train_loss: 0.8494, test_loss: 0.8209, test_f1: 0.5683
 epoch: 34, train_loss: 0.8295, test_loss: 0.8287, test_f1: 0.5685
 epoch: 35, train_loss: 0.8441, test_loss: 0.8102, test_f1: 0.5595
 epoch: 36, train_loss: 0.8317, test_loss: 0.9795, test_f1: 0.5269
 epoch: 37, train_loss: 0.8694, test_loss: 0.9835, test_f1: 0.5194
 epoch: 38, train_loss: 0.8532, test_loss: 0.8273, test_f1: 0.5860
 epoch: 39, train_loss: 0.8454, test_loss: 0.8377, test_f1: 0.5907
 epoch: 40, train_loss: 0.8260, test_loss: 0.8230, test_f1: 0.5478
 epoch: 41, train_loss: 0.8248, test_loss: 0.7689, test_f1: 0.6243
 epoch: 42, train_loss: 0.8066, test_loss: 0.7623, test_f1: 0.5694
 epoch: 43, train_loss: 0.8164, test_loss: 0.8160, test_f1: 0.6112
 epoch: 44, train_loss: 0.8223, test_loss: 0.7749, test_f1: 0.6068
 epoch: 45, train_loss: 0.7924, test_loss: 0.7617, test_f1: 0.6340
 epoch: 46, train_loss: 0.8192, test_loss: 0.8541, test_f1: 0.5787
 epoch: 47, train_loss: 0.8200, test_loss: 0.7897, test_f1: 0.5746
 epoch: 48, train_loss: 0.8037, test_loss: 0.7441, test_f1: 0.6295
 epoch: 49, train_loss: 0.8059, test_loss: 0.7601, test_f1: 0.6014
 epoch: 50, train_loss: 0.8034, test_loss: 0.8013, test_f1: 0.5848
 epoch: 51, train_loss: 0.7866, test_loss: 0.7424, test_f1: 0.5876
 epoch: 52, train_loss: 0.7750, test_loss: 0.7619, test_f1: 0.6263
 epoch: 53, train_loss: 0.7677, test_loss: 0.7732, test_f1: 0.5760
 epoch: 54, train_loss: 0.7753, test_loss: 0.7400, test_f1: 0.6058
 epoch: 55, train_loss: 0.7773, test_loss: 0.7582, test_f1: 0.5698
 epoch: 56, train_loss: 0.7433, test_loss: 0.7388, test_f1: 0.6063
 epoch: 57, train_loss: 0.7583, test_loss: 0.7066, test_f1: 0.6109
 epoch: 58, train_loss: 0.7523, test_loss: 0.7469, test_f1: 0.6081
 epoch: 59, train_loss: 0.7587, test_loss: 0.7737, test_f1: 0.6283
 epoch: 60, train_loss: 0.7813, test_loss: 0.7502, test_f1: 0.5944
 epoch: 61, train_loss: 0.7568, test_loss: 0.7209, test_f1: 0.6054
 epoch: 62, train_loss: 0.7593, test_loss: 0.7873, test_f1: 0.5873
 epoch: 63, train_loss: 0.7462, test_loss: 0.7454, test_f1: 0.6070
 epoch: 64, train_loss: 0.7527, test_loss: 0.7587, test_f1: 0.5990
 epoch: 65, train_loss: 0.7410, test_loss: 0.7323, test_f1: 0.6061
 epoch: 66, train_loss: 0.7483, test_loss: 0.7624, test_f1: 0.6171
 epoch: 67, train_loss: 0.7467, test_loss: 0.7178, test_f1: 0.6192
 epoch: 68, train_loss: 0.7438, test_loss: 0.7092, test_f1: 0.6377
 epoch: 69, train_loss: 0.7370, test_loss: 0.7197, test_f1: 0.6116
 epoch: 70, train_loss: 0.7405, test_loss: 0.7599, test_f1: 0.6115
 epoch: 71, train_loss: 0.7280, test_loss: 0.7433, test_f1: 0.6132
 epoch: 72, train_loss: 0.7478, test_loss: 0.7458, test_f1: 0.5967
 epoch: 73, train_loss: 0.7318, test_loss: 0.7828, test_f1: 0.5986
 epoch: 74, train_loss: 0.7423, test_loss: 0.6969, test_f1: 0.6344
 epoch: 75, train_loss: 0.7228, test_loss: 0.7720, test_f1: 0.6099
 epoch: 76, train_loss: 0.7361, test_loss: 0.7669, test_f1: 0.6234
 epoch: 77, train_loss: 0.7329, test_loss: 0.7593, test_f1: 0.6241
 epoch: 78, train_loss: 0.7358, test_loss: 0.8556, test_f1: 0.5845
 epoch: 79, train_loss: 0.7275, test_loss: 0.8317, test_f1: 0.6085
 epoch: 80, train_loss: 0.7310, test_loss: 0.7250, test_f1: 0.6412
 epoch: 81, train_loss: 0.7268, test_loss: 0.7393, test_f1: 0.5964
 epoch: 82, train_loss: 0.7347, test_loss: 0.7519, test_f1: 0.6161
 epoch: 83, train_loss: 0.7502, test_loss: 0.8408, test_f1: 0.5928
 epoch: 84, train_loss: 0.7353, test_loss: 0.8208, test_f1: 0.5866
 epoch: 85, train_loss: 0.7210, test_loss: 0.7899, test_f1: 0.6068
 epoch: 86, train_loss: 0.7337, test_loss: 0.8045, test_f1: 0.6002
 epoch: 87, train_loss: 0.7211, test_loss: 0.7278, test_f1: 0.6103
 epoch: 88, train_loss: 0.7178, test_loss: 0.7425, test_f1: 0.6269
 epoch: 89, train_loss: 0.7449, test_loss: 0.7136, test_f1: 0.6497
 epoch: 90, train_loss: 0.7190, test_loss: 0.7332, test_f1: 0.6081
 epoch: 91, train_loss: 0.7190, test_loss: 0.7023, test_f1: 0.6162
 epoch: 92, train_loss: 0.7208, test_loss: 0.7834, test_f1: 0.6106
 epoch: 93, train_loss: 0.7139, test_loss: 0.8128, test_f1: 0.6377
 epoch: 94, train_loss: 0.6982, test_loss: 0.7390, test_f1: 0.6443
 epoch: 95, train_loss: 0.7123, test_loss: 0.8890, test_f1: 0.5689
 epoch: 96, train_loss: 0.6980, test_loss: 0.6849, test_f1: 0.6590
 epoch: 97, train_loss: 0.7153, test_loss: 0.7390, test_f1: 0.6247
 epoch: 98, train_loss: 0.7100, test_loss: 0.7453, test_f1: 0.6263
 epoch: 99, train_loss: 0.6995, test_loss: 0.8976, test_f1: 0.5854
##################ITERATION #4 ****************************************
 epoch: 0, train_loss: 1.1210, test_loss: 1.1980, test_f1: 0.3142
 epoch: 1, train_loss: 1.0290, test_loss: 1.0602, test_f1: 0.4371
 epoch: 2, train_loss: 0.9999, test_loss: 1.0146, test_f1: 0.4824
 epoch: 3, train_loss: 0.9765, test_loss: 0.9975, test_f1: 0.4850
 epoch: 4, train_loss: 0.9592, test_loss: 0.9708, test_f1: 0.4465
 epoch: 5, train_loss: 0.9579, test_loss: 0.9463, test_f1: 0.5106
 epoch: 6, train_loss: 0.9319, test_loss: 0.9611, test_f1: 0.4998
 epoch: 7, train_loss: 0.9308, test_loss: 0.8843, test_f1: 0.5371
 epoch: 8, train_loss: 0.9164, test_loss: 0.9000, test_f1: 0.5208
 epoch: 9, train_loss: 0.9001, test_loss: 0.9390, test_f1: 0.4448
 epoch: 10, train_loss: 0.9168, test_loss: 0.8890, test_f1: 0.5031
 epoch: 11, train_loss: 0.8981, test_loss: 0.8993, test_f1: 0.5160
 epoch: 12, train_loss: 0.8947, test_loss: 0.9105, test_f1: 0.5127
 epoch: 13, train_loss: 0.8772, test_loss: 0.9365, test_f1: 0.5058
 epoch: 14, train_loss: 0.8641, test_loss: 0.8757, test_f1: 0.5429
 epoch: 15, train_loss: 0.8609, test_loss: 0.9006, test_f1: 0.5145
 epoch: 16, train_loss: 0.8585, test_loss: 0.9311, test_f1: 0.5215
 epoch: 17, train_loss: 0.8666, test_loss: 1.0975, test_f1: 0.4834
 epoch: 18, train_loss: 0.8881, test_loss: 0.8566, test_f1: 0.5324
 epoch: 19, train_loss: 0.8575, test_loss: 0.8689, test_f1: 0.5626
 epoch: 20, train_loss: 0.8632, test_loss: 0.8736, test_f1: 0.5335
 epoch: 21, train_loss: 0.8675, test_loss: 0.8429, test_f1: 0.5626
 epoch: 22, train_loss: 0.8481, test_loss: 0.9082, test_f1: 0.5307
 epoch: 23, train_loss: 0.8494, test_loss: 0.7960, test_f1: 0.5407
 epoch: 24, train_loss: 0.8519, test_loss: 0.8509, test_f1: 0.5460
 epoch: 25, train_loss: 0.8390, test_loss: 0.9640, test_f1: 0.5106
 epoch: 26, train_loss: 0.8418, test_loss: 0.8316, test_f1: 0.5521
 epoch: 27, train_loss: 0.8384, test_loss: 0.8534, test_f1: 0.5224
 epoch: 28, train_loss: 0.8419, test_loss: 0.8515, test_f1: 0.5299
 epoch: 29, train_loss: 0.8443, test_loss: 0.8225, test_f1: 0.5637
 epoch: 30, train_loss: 0.8431, test_loss: 0.8537, test_f1: 0.5385
 epoch: 31, train_loss: 0.8406, test_loss: 1.1123, test_f1: 0.4444
 epoch: 32, train_loss: 0.8280, test_loss: 0.8155, test_f1: 0.6086
 epoch: 33, train_loss: 0.8176, test_loss: 0.8066, test_f1: 0.5501
 epoch: 34, train_loss: 0.8177, test_loss: 0.8080, test_f1: 0.5791
 epoch: 35, train_loss: 0.8073, test_loss: 0.8609, test_f1: 0.5994
 epoch: 36, train_loss: 0.8042, test_loss: 0.8230, test_f1: 0.5746
 epoch: 37, train_loss: 0.8114, test_loss: 0.8209, test_f1: 0.5605
 epoch: 38, train_loss: 0.8152, test_loss: 0.8180, test_f1: 0.5493
 epoch: 39, train_loss: 0.8162, test_loss: 0.8129, test_f1: 0.5868
 epoch: 40, train_loss: 0.8081, test_loss: 0.8139, test_f1: 0.5689
 epoch: 41, train_loss: 0.8085, test_loss: 0.8479, test_f1: 0.5543
 epoch: 42, train_loss: 0.8055, test_loss: 0.8613, test_f1: 0.5349
 epoch: 43, train_loss: 0.8074, test_loss: 0.8314, test_f1: 0.5657
 epoch: 44, train_loss: 0.8228, test_loss: 1.0576, test_f1: 0.4899
 epoch: 45, train_loss: 0.8246, test_loss: 0.8317, test_f1: 0.5619
 epoch: 46, train_loss: 0.8059, test_loss: 0.8536, test_f1: 0.5366
 epoch: 47, train_loss: 0.8138, test_loss: 0.9250, test_f1: 0.5147
 epoch: 48, train_loss: 0.8123, test_loss: 0.8516, test_f1: 0.5583
 epoch: 49, train_loss: 0.7857, test_loss: 0.8578, test_f1: 0.5446
 epoch: 50, train_loss: 0.7995, test_loss: 0.8045, test_f1: 0.5806
 epoch: 51, train_loss: 0.7737, test_loss: 0.7965, test_f1: 0.5864
 epoch: 52, train_loss: 0.7689, test_loss: 0.7963, test_f1: 0.6036
 epoch: 53, train_loss: 0.7564, test_loss: 0.7942, test_f1: 0.5845
 epoch: 54, train_loss: 0.7515, test_loss: 0.7791, test_f1: 0.6289
 epoch: 55, train_loss: 0.7465, test_loss: 0.8201, test_f1: 0.5778
 epoch: 56, train_loss: 0.7713, test_loss: 0.7761, test_f1: 0.6204
 epoch: 57, train_loss: 0.7423, test_loss: 0.7748, test_f1: 0.6088
 epoch: 58, train_loss: 0.7357, test_loss: 0.8217, test_f1: 0.6122
 epoch: 59, train_loss: 0.7384, test_loss: 0.7977, test_f1: 0.5918
 epoch: 60, train_loss: 0.7435, test_loss: 0.7669, test_f1: 0.6242
 epoch: 61, train_loss: 0.7321, test_loss: 0.8070, test_f1: 0.5984
 epoch: 62, train_loss: 0.7352, test_loss: 0.8079, test_f1: 0.6256
 epoch: 63, train_loss: 0.7224, test_loss: 0.8099, test_f1: 0.5987
 epoch: 64, train_loss: 0.7288, test_loss: 0.7878, test_f1: 0.6079
 epoch: 65, train_loss: 0.7416, test_loss: 0.8145, test_f1: 0.6071
 epoch: 66, train_loss: 0.7285, test_loss: 0.8006, test_f1: 0.6161
 epoch: 67, train_loss: 0.7123, test_loss: 0.7929, test_f1: 0.6177
 epoch: 68, train_loss: 0.7328, test_loss: 0.7952, test_f1: 0.6187
 epoch: 69, train_loss: 0.7295, test_loss: 0.8012, test_f1: 0.6276
 epoch: 70, train_loss: 0.7282, test_loss: 0.8086, test_f1: 0.6263
 epoch: 71, train_loss: 0.7208, test_loss: 0.8239, test_f1: 0.6282
 epoch: 72, train_loss: 0.7420, test_loss: 0.8094, test_f1: 0.6120
 epoch: 73, train_loss: 0.7316, test_loss: 0.7899, test_f1: 0.6051
 epoch: 74, train_loss: 0.7077, test_loss: 0.8352, test_f1: 0.6071
 epoch: 75, train_loss: 0.7261, test_loss: 0.7914, test_f1: 0.6420
 epoch: 76, train_loss: 0.7272, test_loss: 0.8301, test_f1: 0.6287
 epoch: 77, train_loss: 0.7162, test_loss: 0.7900, test_f1: 0.6269
 epoch: 78, train_loss: 0.7002, test_loss: 0.8071, test_f1: 0.6253
 epoch: 79, train_loss: 0.7122, test_loss: 0.7925, test_f1: 0.6200
 epoch: 80, train_loss: 0.7087, test_loss: 0.7756, test_f1: 0.6287
 epoch: 81, train_loss: 0.7074, test_loss: 0.7723, test_f1: 0.6743
 epoch: 82, train_loss: 0.7132, test_loss: 0.8385, test_f1: 0.5880
 epoch: 83, train_loss: 0.7208, test_loss: 0.7945, test_f1: 0.6134
 epoch: 84, train_loss: 0.6883, test_loss: 0.8024, test_f1: 0.6555
 epoch: 85, train_loss: 0.7125, test_loss: 0.8341, test_f1: 0.6120
 epoch: 86, train_loss: 0.7111, test_loss: 0.7892, test_f1: 0.6543
 epoch: 87, train_loss: 0.7144, test_loss: 0.8366, test_f1: 0.6437
 epoch: 88, train_loss: 0.6956, test_loss: 0.7870, test_f1: 0.6446
 epoch: 89, train_loss: 0.6850, test_loss: 0.8248, test_f1: 0.5907
 epoch: 90, train_loss: 0.7028, test_loss: 0.8175, test_f1: 0.6016
 epoch: 91, train_loss: 0.6893, test_loss: 0.8317, test_f1: 0.6047
 epoch: 92, train_loss: 0.6930, test_loss: 0.7942, test_f1: 0.6561
 epoch: 93, train_loss: 0.6973, test_loss: 0.8142, test_f1: 0.6047
 epoch: 94, train_loss: 0.6971, test_loss: 0.8100, test_f1: 0.6680
 epoch: 95, train_loss: 0.6977, test_loss: 0.8777, test_f1: 0.6239
 epoch: 96, train_loss: 0.7092, test_loss: 0.7961, test_f1: 0.6611
 epoch: 97, train_loss: 0.6923, test_loss: 0.8835, test_f1: 0.6217
 epoch: 98, train_loss: 0.6961, test_loss: 0.7867, test_f1: 0.6414
 epoch: 99, train_loss: 0.6910, test_loss: 0.7789, test_f1: 0.6739
##################ITERATION #5 ****************************************
 epoch: 0, train_loss: 1.1455, test_loss: 1.0394, test_f1: 0.4591
 epoch: 1, train_loss: 1.0451, test_loss: 1.0078, test_f1: 0.4463
 epoch: 2, train_loss: 1.0162, test_loss: 1.0268, test_f1: 0.4482
 epoch: 3, train_loss: 0.9986, test_loss: 1.0591, test_f1: 0.4433
 epoch: 4, train_loss: 0.9963, test_loss: 1.0467, test_f1: 0.4603
 epoch: 5, train_loss: 0.9764, test_loss: 0.9998, test_f1: 0.4778
 epoch: 6, train_loss: 0.9753, test_loss: 1.0006, test_f1: 0.4781
 epoch: 7, train_loss: 0.9672, test_loss: 1.0950, test_f1: 0.3989
 epoch: 8, train_loss: 0.9420, test_loss: 1.0192, test_f1: 0.4703
 epoch: 9, train_loss: 0.9548, test_loss: 1.0006, test_f1: 0.4758
 epoch: 10, train_loss: 0.9689, test_loss: 1.0140, test_f1: 0.4598
 epoch: 11, train_loss: 0.9372, test_loss: 0.9697, test_f1: 0.4890
 epoch: 12, train_loss: 0.9318, test_loss: 0.9788, test_f1: 0.4815
 epoch: 13, train_loss: 0.9246, test_loss: 0.9999, test_f1: 0.4434
 epoch: 14, train_loss: 0.9228, test_loss: 1.0129, test_f1: 0.4750
 epoch: 15, train_loss: 0.9168, test_loss: 1.0274, test_f1: 0.4658
 epoch: 16, train_loss: 0.9130, test_loss: 0.9122, test_f1: 0.5488
 epoch: 17, train_loss: 0.8940, test_loss: 0.9400, test_f1: 0.5327
 epoch: 18, train_loss: 0.9006, test_loss: 0.9226, test_f1: 0.5277
 epoch: 19, train_loss: 0.8902, test_loss: 0.9187, test_f1: 0.5015
 epoch: 20, train_loss: 0.8826, test_loss: 1.0696, test_f1: 0.4151
 epoch: 21, train_loss: 0.8839, test_loss: 0.9337, test_f1: 0.5383
 epoch: 22, train_loss: 0.8866, test_loss: 0.9731, test_f1: 0.5093
 epoch: 23, train_loss: 0.9198, test_loss: 1.0315, test_f1: 0.4725
 epoch: 24, train_loss: 0.8816, test_loss: 0.8991, test_f1: 0.5373
 epoch: 25, train_loss: 0.8723, test_loss: 0.9382, test_f1: 0.5025
 epoch: 26, train_loss: 0.8783, test_loss: 0.8890, test_f1: 0.5258
 epoch: 27, train_loss: 0.8638, test_loss: 0.9163, test_f1: 0.5140
 epoch: 28, train_loss: 0.8628, test_loss: 1.1801, test_f1: 0.4455
 epoch: 29, train_loss: 0.8610, test_loss: 0.8780, test_f1: 0.5355
 epoch: 30, train_loss: 0.8507, test_loss: 0.8813, test_f1: 0.5469
 epoch: 31, train_loss: 0.8388, test_loss: 0.9146, test_f1: 0.5484
 epoch: 32, train_loss: 0.8383, test_loss: 0.9589, test_f1: 0.5132
 epoch: 33, train_loss: 0.8610, test_loss: 0.8879, test_f1: 0.5418
 epoch: 34, train_loss: 0.8350, test_loss: 0.8605, test_f1: 0.5824
 epoch: 35, train_loss: 0.8532, test_loss: 0.8799, test_f1: 0.5414
 epoch: 36, train_loss: 0.8369, test_loss: 0.8800, test_f1: 0.5597
 epoch: 37, train_loss: 0.8517, test_loss: 0.8814, test_f1: 0.5150
 epoch: 38, train_loss: 0.8245, test_loss: 0.8677, test_f1: 0.5167
 epoch: 39, train_loss: 0.8326, test_loss: 0.8242, test_f1: 0.5537
 epoch: 40, train_loss: 0.8326, test_loss: 0.8437, test_f1: 0.5963
 epoch: 41, train_loss: 0.8520, test_loss: 0.9096, test_f1: 0.5308
 epoch: 42, train_loss: 0.8513, test_loss: 0.9725, test_f1: 0.4737
 epoch: 43, train_loss: 0.8339, test_loss: 0.8592, test_f1: 0.5289
 epoch: 44, train_loss: 0.8450, test_loss: 0.9178, test_f1: 0.5686
 epoch: 45, train_loss: 0.8397, test_loss: 0.8717, test_f1: 0.5267
 epoch: 46, train_loss: 0.8229, test_loss: 0.8921, test_f1: 0.5778
 epoch: 47, train_loss: 0.8218, test_loss: 0.8532, test_f1: 0.5768
 epoch: 48, train_loss: 0.8247, test_loss: 0.8755, test_f1: 0.5201
 epoch: 49, train_loss: 0.8081, test_loss: 0.8632, test_f1: 0.5700
 epoch: 50, train_loss: 0.8039, test_loss: 0.8871, test_f1: 0.5549
 epoch: 51, train_loss: 0.7937, test_loss: 0.8640, test_f1: 0.5582
 epoch: 52, train_loss: 0.7883, test_loss: 0.8442, test_f1: 0.5621
 epoch: 53, train_loss: 0.7780, test_loss: 0.8610, test_f1: 0.5239
 epoch: 54, train_loss: 0.7732, test_loss: 0.8323, test_f1: 0.5780
 epoch: 55, train_loss: 0.7661, test_loss: 0.8321, test_f1: 0.5891
 epoch: 56, train_loss: 0.7818, test_loss: 0.8404, test_f1: 0.5610
 epoch: 57, train_loss: 0.7715, test_loss: 0.8635, test_f1: 0.5642
 epoch: 58, train_loss: 0.7598, test_loss: 0.8456, test_f1: 0.5702
 epoch: 59, train_loss: 0.7730, test_loss: 0.8534, test_f1: 0.5531
 epoch: 60, train_loss: 0.7732, test_loss: 0.8493, test_f1: 0.5384
 epoch: 61, train_loss: 0.7766, test_loss: 0.8672, test_f1: 0.5759
 epoch: 62, train_loss: 0.7721, test_loss: 0.8708, test_f1: 0.5451
 epoch: 63, train_loss: 0.7633, test_loss: 0.8446, test_f1: 0.5607
 epoch: 64, train_loss: 0.7650, test_loss: 0.8479, test_f1: 0.5866
 epoch: 65, train_loss: 0.7626, test_loss: 0.8492, test_f1: 0.5673
 epoch: 66, train_loss: 0.7650, test_loss: 0.8638, test_f1: 0.5508
 epoch: 67, train_loss: 0.7608, test_loss: 0.8387, test_f1: 0.5712
 epoch: 68, train_loss: 0.7777, test_loss: 0.8320, test_f1: 0.5591
 epoch: 69, train_loss: 0.7489, test_loss: 0.8226, test_f1: 0.5747
 epoch: 70, train_loss: 0.7582, test_loss: 0.8324, test_f1: 0.5452
 epoch: 71, train_loss: 0.7714, test_loss: 0.8735, test_f1: 0.5642
 epoch: 72, train_loss: 0.7639, test_loss: 0.8323, test_f1: 0.5660
 epoch: 73, train_loss: 0.7582, test_loss: 0.8408, test_f1: 0.5604
 epoch: 74, train_loss: 0.7479, test_loss: 0.8605, test_f1: 0.5727
 epoch: 75, train_loss: 0.7612, test_loss: 0.8501, test_f1: 0.5653
 epoch: 76, train_loss: 0.7399, test_loss: 0.8040, test_f1: 0.5723
 epoch: 77, train_loss: 0.7568, test_loss: 0.8314, test_f1: 0.5495
 epoch: 78, train_loss: 0.7458, test_loss: 0.8403, test_f1: 0.5665
 epoch: 79, train_loss: 0.7457, test_loss: 0.8268, test_f1: 0.6191
 epoch: 80, train_loss: 0.7494, test_loss: 0.8280, test_f1: 0.5668
 epoch: 81, train_loss: 0.7488, test_loss: 0.8233, test_f1: 0.5894
 epoch: 82, train_loss: 0.7448, test_loss: 0.8069, test_f1: 0.6118
 epoch: 83, train_loss: 0.7397, test_loss: 0.8721, test_f1: 0.5467
 epoch: 84, train_loss: 0.7392, test_loss: 0.8548, test_f1: 0.5524
 epoch: 85, train_loss: 0.7573, test_loss: 0.8344, test_f1: 0.5802
 epoch: 86, train_loss: 0.7474, test_loss: 0.8394, test_f1: 0.5614
 epoch: 87, train_loss: 0.7339, test_loss: 0.8659, test_f1: 0.5765
 epoch: 88, train_loss: 0.7563, test_loss: 0.8321, test_f1: 0.5721
 epoch: 89, train_loss: 0.7515, test_loss: 0.8182, test_f1: 0.5950
 epoch: 90, train_loss: 0.7303, test_loss: 0.8754, test_f1: 0.5664
 epoch: 91, train_loss: 0.7342, test_loss: 0.8549, test_f1: 0.5705
 epoch: 92, train_loss: 0.7332, test_loss: 0.8275, test_f1: 0.5704
 epoch: 93, train_loss: 0.7313, test_loss: 0.8581, test_f1: 0.5519
 epoch: 94, train_loss: 0.7375, test_loss: 0.8183, test_f1: 0.5935
 epoch: 95, train_loss: 0.7352, test_loss: 0.8593, test_f1: 0.5867
 epoch: 96, train_loss: 0.7323, test_loss: 0.8747, test_f1: 0.5834
 epoch: 97, train_loss: 0.7568, test_loss: 0.8351, test_f1: 0.5650
 epoch: 98, train_loss: 0.7367, test_loss: 0.8315, test_f1: 0.5458
 epoch: 99, train_loss: 0.7347, test_loss: 0.8395, test_f1: 0.5698
##################ITERATION #6 ****************************************
 epoch: 0, train_loss: 1.1709, test_loss: 1.1514, test_f1: 0.3679
 epoch: 1, train_loss: 1.0419, test_loss: 1.0765, test_f1: 0.4414
 epoch: 2, train_loss: 1.0121, test_loss: 1.0597, test_f1: 0.4702
 epoch: 3, train_loss: 1.0006, test_loss: 1.0478, test_f1: 0.4768
 epoch: 4, train_loss: 0.9794, test_loss: 0.9856, test_f1: 0.4841
 epoch: 5, train_loss: 0.9821, test_loss: 1.0444, test_f1: 0.4963
 epoch: 6, train_loss: 0.9738, test_loss: 0.9849, test_f1: 0.4994
 epoch: 7, train_loss: 0.9536, test_loss: 1.0348, test_f1: 0.4880
 epoch: 8, train_loss: 0.9559, test_loss: 0.9889, test_f1: 0.5001
 epoch: 9, train_loss: 0.9447, test_loss: 1.0140, test_f1: 0.4837
 epoch: 10, train_loss: 0.9352, test_loss: 0.9175, test_f1: 0.5380
 epoch: 11, train_loss: 0.9412, test_loss: 0.9572, test_f1: 0.4768
 epoch: 12, train_loss: 0.9331, test_loss: 0.9303, test_f1: 0.5176
 epoch: 13, train_loss: 0.9265, test_loss: 1.0747, test_f1: 0.4968
 epoch: 14, train_loss: 0.9123, test_loss: 0.9518, test_f1: 0.5019
 epoch: 15, train_loss: 0.9102, test_loss: 0.9563, test_f1: 0.5569
 epoch: 16, train_loss: 0.8937, test_loss: 0.9085, test_f1: 0.5169
 epoch: 17, train_loss: 0.9022, test_loss: 0.9095, test_f1: 0.5306
 epoch: 18, train_loss: 0.8957, test_loss: 0.9687, test_f1: 0.5300
 epoch: 19, train_loss: 0.8929, test_loss: 0.9266, test_f1: 0.5556
 epoch: 20, train_loss: 0.8991, test_loss: 0.8295, test_f1: 0.5383
 epoch: 21, train_loss: 0.8778, test_loss: 0.9445, test_f1: 0.5631
 epoch: 22, train_loss: 0.8858, test_loss: 0.9111, test_f1: 0.5412
 epoch: 23, train_loss: 0.8930, test_loss: 0.9430, test_f1: 0.5672
 epoch: 24, train_loss: 0.8770, test_loss: 0.9429, test_f1: 0.5436
 epoch: 25, train_loss: 0.8591, test_loss: 0.8976, test_f1: 0.5600
 epoch: 26, train_loss: 0.8570, test_loss: 0.9943, test_f1: 0.5394
 epoch: 27, train_loss: 0.8578, test_loss: 0.8343, test_f1: 0.5720
 epoch: 28, train_loss: 0.8524, test_loss: 1.0258, test_f1: 0.5392
 epoch: 29, train_loss: 0.8565, test_loss: 0.9498, test_f1: 0.5337
 epoch: 30, train_loss: 0.8399, test_loss: 0.9004, test_f1: 0.5600
 epoch: 31, train_loss: 0.8378, test_loss: 0.9643, test_f1: 0.5248
 epoch: 32, train_loss: 0.8415, test_loss: 0.9558, test_f1: 0.5937
 epoch: 33, train_loss: 0.8515, test_loss: 1.0615, test_f1: 0.4827
 epoch: 34, train_loss: 0.8998, test_loss: 0.8950, test_f1: 0.5344
 epoch: 35, train_loss: 0.8800, test_loss: 0.9762, test_f1: 0.5376
 epoch: 36, train_loss: 0.8392, test_loss: 0.9383, test_f1: 0.5396
 epoch: 37, train_loss: 0.8682, test_loss: 0.8640, test_f1: 0.5717
 epoch: 38, train_loss: 0.8706, test_loss: 0.8339, test_f1: 0.5206
 epoch: 39, train_loss: 0.8519, test_loss: 1.2435, test_f1: 0.4510
 epoch: 40, train_loss: 0.8577, test_loss: 0.9833, test_f1: 0.5197
 epoch: 41, train_loss: 0.8577, test_loss: 0.8907, test_f1: 0.5687
 epoch: 42, train_loss: 0.8691, test_loss: 1.0378, test_f1: 0.4898
 epoch: 43, train_loss: 0.8643, test_loss: 0.9021, test_f1: 0.5587
 epoch: 44, train_loss: 0.8398, test_loss: 0.8734, test_f1: 0.5863
 epoch: 45, train_loss: 0.8317, test_loss: 0.9046, test_f1: 0.5359
 epoch: 46, train_loss: 0.8375, test_loss: 0.8892, test_f1: 0.5277
 epoch: 47, train_loss: 0.8012, test_loss: 0.8770, test_f1: 0.5306
 epoch: 48, train_loss: 0.8176, test_loss: 0.8625, test_f1: 0.5957
 epoch: 49, train_loss: 0.8121, test_loss: 0.8547, test_f1: 0.6021
 epoch: 50, train_loss: 0.8103, test_loss: 0.8481, test_f1: 0.5934
 epoch: 51, train_loss: 0.7966, test_loss: 0.8321, test_f1: 0.6301
 epoch: 52, train_loss: 0.7866, test_loss: 0.8511, test_f1: 0.6073
 epoch: 53, train_loss: 0.7880, test_loss: 0.8489, test_f1: 0.6112
 epoch: 54, train_loss: 0.7763, test_loss: 0.8520, test_f1: 0.6056
 epoch: 55, train_loss: 0.7783, test_loss: 0.8395, test_f1: 0.6138
 epoch: 56, train_loss: 0.7796, test_loss: 0.8201, test_f1: 0.6196
 epoch: 57, train_loss: 0.7655, test_loss: 0.8202, test_f1: 0.6298
 epoch: 58, train_loss: 0.7645, test_loss: 0.8319, test_f1: 0.6376
 epoch: 59, train_loss: 0.7637, test_loss: 0.8309, test_f1: 0.6274
 epoch: 60, train_loss: 0.7727, test_loss: 0.8311, test_f1: 0.6221
 epoch: 61, train_loss: 0.7596, test_loss: 0.8389, test_f1: 0.6255
 epoch: 62, train_loss: 0.7630, test_loss: 0.8278, test_f1: 0.6345
 epoch: 63, train_loss: 0.7605, test_loss: 0.8438, test_f1: 0.6417
 epoch: 64, train_loss: 0.7518, test_loss: 0.8201, test_f1: 0.6097
 epoch: 65, train_loss: 0.7518, test_loss: 0.7827, test_f1: 0.6268
 epoch: 66, train_loss: 0.7557, test_loss: 0.8400, test_f1: 0.6293
 epoch: 67, train_loss: 0.7399, test_loss: 0.8432, test_f1: 0.6145
 epoch: 68, train_loss: 0.7548, test_loss: 0.8267, test_f1: 0.6319
 epoch: 69, train_loss: 0.7645, test_loss: 0.8436, test_f1: 0.6516
 epoch: 70, train_loss: 0.7459, test_loss: 0.8036, test_f1: 0.6314
 epoch: 71, train_loss: 0.7593, test_loss: 0.7992, test_f1: 0.6436
 epoch: 72, train_loss: 0.7444, test_loss: 0.8219, test_f1: 0.6344
 epoch: 73, train_loss: 0.7431, test_loss: 0.8304, test_f1: 0.6524
 epoch: 74, train_loss: 0.7350, test_loss: 0.8527, test_f1: 0.6250
 epoch: 75, train_loss: 0.7627, test_loss: 0.8201, test_f1: 0.6256
 epoch: 76, train_loss: 0.7353, test_loss: 0.8399, test_f1: 0.6491
 epoch: 77, train_loss: 0.7346, test_loss: 0.8407, test_f1: 0.6604
 epoch: 78, train_loss: 0.7417, test_loss: 0.8057, test_f1: 0.6410
 epoch: 79, train_loss: 0.7227, test_loss: 0.8041, test_f1: 0.6694
 epoch: 80, train_loss: 0.7156, test_loss: 0.8485, test_f1: 0.6679
 epoch: 81, train_loss: 0.7248, test_loss: 0.8511, test_f1: 0.6358
 epoch: 82, train_loss: 0.7412, test_loss: 0.9048, test_f1: 0.6459
 epoch: 83, train_loss: 0.7313, test_loss: 0.8611, test_f1: 0.6308
 epoch: 84, train_loss: 0.7315, test_loss: 0.8469, test_f1: 0.6503
 epoch: 85, train_loss: 0.7179, test_loss: 0.8113, test_f1: 0.6636
 epoch: 86, train_loss: 0.7226, test_loss: 0.8349, test_f1: 0.6432
 epoch: 87, train_loss: 0.7206, test_loss: 0.8384, test_f1: 0.6646
 epoch: 88, train_loss: 0.7358, test_loss: 0.8091, test_f1: 0.6532
 epoch: 89, train_loss: 0.7048, test_loss: 0.8205, test_f1: 0.6687
 epoch: 90, train_loss: 0.7286, test_loss: 0.8350, test_f1: 0.6589
 epoch: 91, train_loss: 0.7389, test_loss: 0.8370, test_f1: 0.6493
 epoch: 92, train_loss: 0.7044, test_loss: 0.8739, test_f1: 0.6522
 epoch: 93, train_loss: 0.7159, test_loss: 0.8339, test_f1: 0.6415
 epoch: 94, train_loss: 0.6976, test_loss: 0.8275, test_f1: 0.6603
 epoch: 95, train_loss: 0.7093, test_loss: 0.8355, test_f1: 0.6505
 epoch: 96, train_loss: 0.6884, test_loss: 0.8211, test_f1: 0.6678
 epoch: 97, train_loss: 0.6929, test_loss: 0.8004, test_f1: 0.6402
 epoch: 98, train_loss: 0.7118, test_loss: 0.8127, test_f1: 0.6503
 epoch: 99, train_loss: 0.7061, test_loss: 0.8401, test_f1: 0.6403
##################ITERATION #7 ****************************************
 epoch: 0, train_loss: 1.1224, test_loss: 1.0340, test_f1: 0.4657
 epoch: 1, train_loss: 1.0038, test_loss: 0.9961, test_f1: 0.4720
 epoch: 2, train_loss: 1.0063, test_loss: 1.0104, test_f1: 0.4643
 epoch: 3, train_loss: 0.9807, test_loss: 1.0393, test_f1: 0.4683
 epoch: 4, train_loss: 0.9740, test_loss: 0.9991, test_f1: 0.4501
 epoch: 5, train_loss: 0.9669, test_loss: 1.0318, test_f1: 0.5162
 epoch: 6, train_loss: 0.9558, test_loss: 1.0036, test_f1: 0.4846
 epoch: 7, train_loss: 0.9323, test_loss: 0.9347, test_f1: 0.5044
 epoch: 8, train_loss: 0.9552, test_loss: 0.9993, test_f1: 0.5135
 epoch: 9, train_loss: 0.9378, test_loss: 1.0241, test_f1: 0.4899
 epoch: 10, train_loss: 0.9177, test_loss: 0.9648, test_f1: 0.5382
 epoch: 11, train_loss: 0.9328, test_loss: 0.9980, test_f1: 0.4882
 epoch: 12, train_loss: 0.9176, test_loss: 1.2135, test_f1: 0.3997
 epoch: 13, train_loss: 0.8981, test_loss: 0.9528, test_f1: 0.5170
 epoch: 14, train_loss: 0.9023, test_loss: 0.9929, test_f1: 0.4923
 epoch: 15, train_loss: 0.8924, test_loss: 0.9323, test_f1: 0.5042
 epoch: 16, train_loss: 0.8845, test_loss: 0.9257, test_f1: 0.5012
 epoch: 17, train_loss: 0.9097, test_loss: 0.9220, test_f1: 0.5194
 epoch: 18, train_loss: 0.8634, test_loss: 0.8941, test_f1: 0.5219
 epoch: 19, train_loss: 0.8728, test_loss: 0.9202, test_f1: 0.5429
 epoch: 20, train_loss: 0.8752, test_loss: 0.9203, test_f1: 0.5177
 epoch: 21, train_loss: 0.8694, test_loss: 0.9134, test_f1: 0.5332
 epoch: 22, train_loss: 0.8699, test_loss: 0.9867, test_f1: 0.4980
 epoch: 23, train_loss: 0.8544, test_loss: 0.9049, test_f1: 0.5360
 epoch: 24, train_loss: 0.8567, test_loss: 0.9215, test_f1: 0.5194
 epoch: 25, train_loss: 0.8574, test_loss: 0.9357, test_f1: 0.5326
 epoch: 26, train_loss: 0.8430, test_loss: 0.9055, test_f1: 0.5394
 epoch: 27, train_loss: 0.8367, test_loss: 0.9556, test_f1: 0.5522
 epoch: 28, train_loss: 0.8622, test_loss: 0.9312, test_f1: 0.5566
 epoch: 29, train_loss: 0.8638, test_loss: 0.9197, test_f1: 0.5303
 epoch: 30, train_loss: 0.8402, test_loss: 0.8983, test_f1: 0.5342
 epoch: 31, train_loss: 0.8485, test_loss: 0.9584, test_f1: 0.5133
 epoch: 32, train_loss: 0.8470, test_loss: 0.8843, test_f1: 0.5666
 epoch: 33, train_loss: 0.8568, test_loss: 0.9431, test_f1: 0.5512
 epoch: 34, train_loss: 0.8477, test_loss: 0.9291, test_f1: 0.5682
 epoch: 35, train_loss: 0.8286, test_loss: 0.9250, test_f1: 0.5675
 epoch: 36, train_loss: 0.8379, test_loss: 0.9302, test_f1: 0.6028
 epoch: 37, train_loss: 0.8307, test_loss: 0.8942, test_f1: 0.5456
 epoch: 38, train_loss: 0.8318, test_loss: 0.8815, test_f1: 0.5531
 epoch: 39, train_loss: 0.8215, test_loss: 0.8989, test_f1: 0.5452
 epoch: 40, train_loss: 0.8329, test_loss: 0.8639, test_f1: 0.5639
 epoch: 41, train_loss: 0.8187, test_loss: 0.8885, test_f1: 0.5563
 epoch: 42, train_loss: 0.8229, test_loss: 0.8565, test_f1: 0.5871
 epoch: 43, train_loss: 0.8430, test_loss: 0.9017, test_f1: 0.5486
 epoch: 44, train_loss: 0.8116, test_loss: 0.8447, test_f1: 0.5685
 epoch: 45, train_loss: 0.8116, test_loss: 0.8503, test_f1: 0.5797
 epoch: 46, train_loss: 0.8219, test_loss: 0.8828, test_f1: 0.5711
 epoch: 47, train_loss: 0.8202, test_loss: 0.9155, test_f1: 0.5565
 epoch: 48, train_loss: 0.8193, test_loss: 0.8727, test_f1: 0.5882
 epoch: 49, train_loss: 0.8215, test_loss: 0.9075, test_f1: 0.5388
 epoch: 50, train_loss: 0.7949, test_loss: 0.8694, test_f1: 0.5864
 epoch: 51, train_loss: 0.7937, test_loss: 0.9374, test_f1: 0.6140
 epoch: 52, train_loss: 0.7831, test_loss: 0.9092, test_f1: 0.6000
 epoch: 53, train_loss: 0.7749, test_loss: 0.8787, test_f1: 0.5915
 epoch: 54, train_loss: 0.7653, test_loss: 0.8763, test_f1: 0.6177
 epoch: 55, train_loss: 0.7742, test_loss: 0.8943, test_f1: 0.5890
 epoch: 56, train_loss: 0.7865, test_loss: 0.9027, test_f1: 0.5715
 epoch: 57, train_loss: 0.7676, test_loss: 0.8701, test_f1: 0.6110
 epoch: 58, train_loss: 0.7678, test_loss: 0.9008, test_f1: 0.5791
 epoch: 59, train_loss: 0.7557, test_loss: 0.8707, test_f1: 0.5869
 epoch: 60, train_loss: 0.7699, test_loss: 0.9003, test_f1: 0.5948
 epoch: 61, train_loss: 0.7783, test_loss: 0.8698, test_f1: 0.6445
 epoch: 62, train_loss: 0.7652, test_loss: 0.9081, test_f1: 0.5916
 epoch: 63, train_loss: 0.7637, test_loss: 0.9282, test_f1: 0.5791
 epoch: 64, train_loss: 0.7575, test_loss: 0.8953, test_f1: 0.5923
 epoch: 65, train_loss: 0.7606, test_loss: 0.8627, test_f1: 0.5928
 epoch: 66, train_loss: 0.7465, test_loss: 0.9277, test_f1: 0.6028
 epoch: 67, train_loss: 0.7500, test_loss: 0.8679, test_f1: 0.6116
 epoch: 68, train_loss: 0.7549, test_loss: 0.8908, test_f1: 0.6049
 epoch: 69, train_loss: 0.7524, test_loss: 0.8714, test_f1: 0.6153
 epoch: 70, train_loss: 0.7440, test_loss: 0.8857, test_f1: 0.5975
 epoch: 71, train_loss: 0.7561, test_loss: 0.9167, test_f1: 0.5885
 epoch: 72, train_loss: 0.7401, test_loss: 0.9189, test_f1: 0.5777
 epoch: 73, train_loss: 0.7451, test_loss: 0.9222, test_f1: 0.5908
 epoch: 74, train_loss: 0.7354, test_loss: 0.8789, test_f1: 0.5992
 epoch: 75, train_loss: 0.7326, test_loss: 0.9011, test_f1: 0.5953
 epoch: 76, train_loss: 0.7372, test_loss: 0.9075, test_f1: 0.6196
 epoch: 77, train_loss: 0.7547, test_loss: 0.9275, test_f1: 0.5967
 epoch: 78, train_loss: 0.7276, test_loss: 0.9381, test_f1: 0.6165
 epoch: 79, train_loss: 0.7497, test_loss: 0.9447, test_f1: 0.5858
 epoch: 80, train_loss: 0.7414, test_loss: 0.9056, test_f1: 0.6103
 epoch: 81, train_loss: 0.7489, test_loss: 0.8699, test_f1: 0.6208
 epoch: 82, train_loss: 0.7478, test_loss: 0.8913, test_f1: 0.6244
 epoch: 83, train_loss: 0.7402, test_loss: 0.9022, test_f1: 0.5929
 epoch: 84, train_loss: 0.7473, test_loss: 0.8961, test_f1: 0.6226
 epoch: 85, train_loss: 0.7440, test_loss: 0.8671, test_f1: 0.6246
 epoch: 86, train_loss: 0.7462, test_loss: 0.9349, test_f1: 0.6020
 epoch: 87, train_loss: 0.7215, test_loss: 0.8742, test_f1: 0.6155
 epoch: 88, train_loss: 0.7318, test_loss: 0.8928, test_f1: 0.6099
 epoch: 89, train_loss: 0.7249, test_loss: 0.9044, test_f1: 0.5967
 epoch: 90, train_loss: 0.7283, test_loss: 0.9070, test_f1: 0.6179
 epoch: 91, train_loss: 0.7204, test_loss: 0.9033, test_f1: 0.6218
 epoch: 92, train_loss: 0.7240, test_loss: 0.9593, test_f1: 0.5953
 epoch: 93, train_loss: 0.7210, test_loss: 0.9146, test_f1: 0.6142
 epoch: 94, train_loss: 0.7307, test_loss: 0.9157, test_f1: 0.5997
 epoch: 95, train_loss: 0.7277, test_loss: 0.9224, test_f1: 0.5773
 epoch: 96, train_loss: 0.7413, test_loss: 0.8970, test_f1: 0.6137
 epoch: 97, train_loss: 0.7270, test_loss: 0.9144, test_f1: 0.5745
 epoch: 98, train_loss: 0.7470, test_loss: 0.8789, test_f1: 0.6219
 epoch: 99, train_loss: 0.7145, test_loss: 0.9026, test_f1: 0.6191
##################ITERATION #8 ****************************************
 epoch: 0, train_loss: 1.1561, test_loss: 1.0785, test_f1: 0.4494
 epoch: 1, train_loss: 1.0145, test_loss: 0.9986, test_f1: 0.4767
 epoch: 2, train_loss: 1.0010, test_loss: 1.0624, test_f1: 0.4090
 epoch: 3, train_loss: 0.9830, test_loss: 1.1099, test_f1: 0.4383
 epoch: 4, train_loss: 0.9649, test_loss: 1.0057, test_f1: 0.4699
 epoch: 5, train_loss: 0.9965, test_loss: 1.0353, test_f1: 0.4508
 epoch: 6, train_loss: 0.9620, test_loss: 1.2394, test_f1: 0.4197
 epoch: 7, train_loss: 0.9477, test_loss: 1.0007, test_f1: 0.4867
 epoch: 8, train_loss: 0.9347, test_loss: 1.0201, test_f1: 0.4931
 epoch: 9, train_loss: 0.9506, test_loss: 1.0281, test_f1: 0.4995
 epoch: 10, train_loss: 0.9465, test_loss: 0.9723, test_f1: 0.5161
 epoch: 11, train_loss: 0.9475, test_loss: 0.9810, test_f1: 0.4789
 epoch: 12, train_loss: 0.9384, test_loss: 1.0216, test_f1: 0.4626
 epoch: 13, train_loss: 0.9431, test_loss: 0.9576, test_f1: 0.4952
 epoch: 14, train_loss: 0.9226, test_loss: 0.9742, test_f1: 0.4953
 epoch: 15, train_loss: 0.9181, test_loss: 0.9744, test_f1: 0.5047
 epoch: 16, train_loss: 0.9133, test_loss: 0.9751, test_f1: 0.5193
 epoch: 17, train_loss: 0.9051, test_loss: 0.9577, test_f1: 0.5413
 epoch: 18, train_loss: 0.8894, test_loss: 0.9467, test_f1: 0.5016
 epoch: 19, train_loss: 0.9025, test_loss: 0.9157, test_f1: 0.5144
 epoch: 20, train_loss: 0.9032, test_loss: 0.9931, test_f1: 0.4898
 epoch: 21, train_loss: 0.8950, test_loss: 0.9368, test_f1: 0.5114
 epoch: 22, train_loss: 0.9073, test_loss: 0.9377, test_f1: 0.4956
 epoch: 23, train_loss: 0.8897, test_loss: 1.0550, test_f1: 0.4665
 epoch: 24, train_loss: 0.8853, test_loss: 0.9502, test_f1: 0.5364
 epoch: 25, train_loss: 0.8786, test_loss: 0.9475, test_f1: 0.5082
 epoch: 26, train_loss: 0.8892, test_loss: 0.9507, test_f1: 0.5157
 epoch: 27, train_loss: 0.8968, test_loss: 0.9692, test_f1: 0.5629
 epoch: 28, train_loss: 0.8862, test_loss: 0.9333, test_f1: 0.5284
 epoch: 29, train_loss: 0.8711, test_loss: 0.9345, test_f1: 0.5422
 epoch: 30, train_loss: 0.8954, test_loss: 1.0242, test_f1: 0.4889
 epoch: 31, train_loss: 0.8949, test_loss: 1.0184, test_f1: 0.4824
 epoch: 32, train_loss: 0.9052, test_loss: 1.0112, test_f1: 0.5044
 epoch: 33, train_loss: 0.8679, test_loss: 0.9128, test_f1: 0.5306
 epoch: 34, train_loss: 0.8717, test_loss: 0.9293, test_f1: 0.5247
 epoch: 35, train_loss: 0.8752, test_loss: 0.9303, test_f1: 0.5034
 epoch: 36, train_loss: 0.8476, test_loss: 0.9850, test_f1: 0.4922
 epoch: 37, train_loss: 0.8614, test_loss: 0.8758, test_f1: 0.5724
 epoch: 38, train_loss: 0.8499, test_loss: 0.9218, test_f1: 0.5446
 epoch: 39, train_loss: 0.8499, test_loss: 0.9520, test_f1: 0.5699
 epoch: 40, train_loss: 0.8617, test_loss: 0.8870, test_f1: 0.5986
 epoch: 41, train_loss: 0.8433, test_loss: 0.8879, test_f1: 0.6052
 epoch: 42, train_loss: 0.8432, test_loss: 0.8916, test_f1: 0.5739
 epoch: 43, train_loss: 0.8490, test_loss: 0.9039, test_f1: 0.5837
 epoch: 44, train_loss: 0.8390, test_loss: 0.9621, test_f1: 0.5462
 epoch: 45, train_loss: 0.8460, test_loss: 0.9527, test_f1: 0.5743
 epoch: 46, train_loss: 0.8417, test_loss: 0.9983, test_f1: 0.5205
 epoch: 47, train_loss: 0.8277, test_loss: 0.8641, test_f1: 0.5767
 epoch: 48, train_loss: 0.8372, test_loss: 0.9406, test_f1: 0.5662
 epoch: 49, train_loss: 0.8269, test_loss: 0.8860, test_f1: 0.5879
 epoch: 50, train_loss: 0.8276, test_loss: 0.9058, test_f1: 0.6041
 epoch: 51, train_loss: 0.8204, test_loss: 0.9016, test_f1: 0.6200
 epoch: 52, train_loss: 0.7933, test_loss: 0.8661, test_f1: 0.5892
 epoch: 53, train_loss: 0.7900, test_loss: 0.8916, test_f1: 0.6158
 epoch: 54, train_loss: 0.7934, test_loss: 0.9028, test_f1: 0.5793
 epoch: 55, train_loss: 0.7884, test_loss: 0.9084, test_f1: 0.6004
 epoch: 56, train_loss: 0.8012, test_loss: 0.8839, test_f1: 0.6209
 epoch: 57, train_loss: 0.7945, test_loss: 0.8498, test_f1: 0.6070
 epoch: 58, train_loss: 0.7968, test_loss: 0.9152, test_f1: 0.5849
 epoch: 59, train_loss: 0.7990, test_loss: 0.8797, test_f1: 0.6132
 epoch: 60, train_loss: 0.7911, test_loss: 0.8676, test_f1: 0.5868
 epoch: 61, train_loss: 0.7797, test_loss: 0.8682, test_f1: 0.5979
 epoch: 62, train_loss: 0.7815, test_loss: 0.9029, test_f1: 0.5825
 epoch: 63, train_loss: 0.7763, test_loss: 0.8928, test_f1: 0.6006
 epoch: 64, train_loss: 0.7726, test_loss: 0.8659, test_f1: 0.6008
 epoch: 65, train_loss: 0.7802, test_loss: 0.9162, test_f1: 0.5807
 epoch: 66, train_loss: 0.7694, test_loss: 0.8524, test_f1: 0.5806
 epoch: 67, train_loss: 0.7790, test_loss: 0.8358, test_f1: 0.5963
 epoch: 68, train_loss: 0.7749, test_loss: 0.9853, test_f1: 0.5699
 epoch: 69, train_loss: 0.7647, test_loss: 0.8103, test_f1: 0.6376
 epoch: 70, train_loss: 0.7786, test_loss: 0.8426, test_f1: 0.6112
 epoch: 71, train_loss: 0.7638, test_loss: 0.8392, test_f1: 0.6237
 epoch: 72, train_loss: 0.7773, test_loss: 0.8437, test_f1: 0.5992
 epoch: 73, train_loss: 0.7603, test_loss: 0.8592, test_f1: 0.5795
 epoch: 74, train_loss: 0.7682, test_loss: 0.8734, test_f1: 0.5763
 epoch: 75, train_loss: 0.7673, test_loss: 0.8482, test_f1: 0.6018
 epoch: 76, train_loss: 0.7559, test_loss: 0.8488, test_f1: 0.6099
 epoch: 77, train_loss: 0.7581, test_loss: 0.8541, test_f1: 0.6162
 epoch: 78, train_loss: 0.7650, test_loss: 0.8493, test_f1: 0.6143
 epoch: 79, train_loss: 0.7501, test_loss: 0.8168, test_f1: 0.6082
 epoch: 80, train_loss: 0.7518, test_loss: 0.8532, test_f1: 0.5847
 epoch: 81, train_loss: 0.7590, test_loss: 0.8484, test_f1: 0.6082
 epoch: 82, train_loss: 0.7474, test_loss: 0.8469, test_f1: 0.6289
 epoch: 83, train_loss: 0.7423, test_loss: 0.8285, test_f1: 0.6201
 epoch: 84, train_loss: 0.7489, test_loss: 0.8638, test_f1: 0.5756
 epoch: 85, train_loss: 0.7467, test_loss: 0.8460, test_f1: 0.6464
 epoch: 86, train_loss: 0.7381, test_loss: 0.8594, test_f1: 0.5929
 epoch: 87, train_loss: 0.7525, test_loss: 0.8291, test_f1: 0.5960
 epoch: 88, train_loss: 0.7478, test_loss: 0.8499, test_f1: 0.6188
 epoch: 89, train_loss: 0.7366, test_loss: 0.8491, test_f1: 0.6314
 epoch: 90, train_loss: 0.7477, test_loss: 0.8573, test_f1: 0.5982
 epoch: 91, train_loss: 0.7120, test_loss: 0.8569, test_f1: 0.6075
 epoch: 92, train_loss: 0.7452, test_loss: 0.8299, test_f1: 0.6060
 epoch: 93, train_loss: 0.7494, test_loss: 0.8366, test_f1: 0.6351
 epoch: 94, train_loss: 0.7432, test_loss: 0.8413, test_f1: 0.6343
 epoch: 95, train_loss: 0.7366, test_loss: 0.8216, test_f1: 0.6549
 epoch: 96, train_loss: 0.7415, test_loss: 0.8117, test_f1: 0.6544
 epoch: 97, train_loss: 0.7212, test_loss: 0.8117, test_f1: 0.6187
 epoch: 98, train_loss: 0.7386, test_loss: 0.8677, test_f1: 0.6423
 epoch: 99, train_loss: 0.7444, test_loss: 0.8873, test_f1: 0.5957
##################ITERATION #9 ****************************************
 epoch: 0, train_loss: 1.1665, test_loss: 1.0265, test_f1: 0.4145
 epoch: 1, train_loss: 1.0232, test_loss: 1.0534, test_f1: 0.4257
 epoch: 2, train_loss: 1.0039, test_loss: 0.9654, test_f1: 0.4551
 epoch: 3, train_loss: 0.9839, test_loss: 0.9837, test_f1: 0.4773
 epoch: 4, train_loss: 0.9800, test_loss: 0.9896, test_f1: 0.4583
 epoch: 5, train_loss: 0.9626, test_loss: 0.9790, test_f1: 0.4579
 epoch: 6, train_loss: 0.9575, test_loss: 1.1166, test_f1: 0.4513
 epoch: 7, train_loss: 0.9372, test_loss: 0.9292, test_f1: 0.4796
 epoch: 8, train_loss: 0.9298, test_loss: 0.9595, test_f1: 0.4501
 epoch: 9, train_loss: 0.9290, test_loss: 0.9060, test_f1: 0.5127
 epoch: 10, train_loss: 0.9198, test_loss: 0.9080, test_f1: 0.5031
 epoch: 11, train_loss: 0.9178, test_loss: 0.9434, test_f1: 0.5119
 epoch: 12, train_loss: 0.9111, test_loss: 1.0222, test_f1: 0.4482
 epoch: 13, train_loss: 0.9250, test_loss: 0.9483, test_f1: 0.5147
 epoch: 14, train_loss: 0.9031, test_loss: 0.9252, test_f1: 0.5264
 epoch: 15, train_loss: 0.8959, test_loss: 0.9580, test_f1: 0.5467
 epoch: 16, train_loss: 0.8946, test_loss: 0.9318, test_f1: 0.5059
 epoch: 17, train_loss: 0.8883, test_loss: 0.9526, test_f1: 0.4835
 epoch: 18, train_loss: 0.8560, test_loss: 0.9873, test_f1: 0.5017
 epoch: 19, train_loss: 0.8753, test_loss: 0.8812, test_f1: 0.5451
 epoch: 20, train_loss: 0.8620, test_loss: 0.9631, test_f1: 0.5436
 epoch: 21, train_loss: 0.8691, test_loss: 0.8832, test_f1: 0.5925
 epoch: 22, train_loss: 0.8591, test_loss: 0.8786, test_f1: 0.5425
 epoch: 23, train_loss: 0.8501, test_loss: 0.8913, test_f1: 0.5223
 epoch: 24, train_loss: 0.8443, test_loss: 0.8726, test_f1: 0.4917
 epoch: 25, train_loss: 0.8445, test_loss: 1.0161, test_f1: 0.5309
 epoch: 26, train_loss: 0.8498, test_loss: 0.9708, test_f1: 0.5014
 epoch: 27, train_loss: 0.8382, test_loss: 0.9298, test_f1: 0.5861
 epoch: 28, train_loss: 0.8343, test_loss: 0.9998, test_f1: 0.5003
 epoch: 29, train_loss: 0.8263, test_loss: 0.8497, test_f1: 0.5802
 epoch: 30, train_loss: 0.8295, test_loss: 0.9251, test_f1: 0.5228
 epoch: 31, train_loss: 0.8219, test_loss: 0.8440, test_f1: 0.5725
 epoch: 32, train_loss: 0.8295, test_loss: 0.8671, test_f1: 0.6217
 epoch: 33, train_loss: 0.8253, test_loss: 0.8927, test_f1: 0.5964
 epoch: 34, train_loss: 0.8262, test_loss: 0.8885, test_f1: 0.6030
 epoch: 35, train_loss: 0.7943, test_loss: 0.8839, test_f1: 0.5756
 epoch: 36, train_loss: 0.8075, test_loss: 0.8572, test_f1: 0.5886
 epoch: 37, train_loss: 0.7894, test_loss: 0.8817, test_f1: 0.5942
 epoch: 38, train_loss: 0.8128, test_loss: 0.8862, test_f1: 0.5727
 epoch: 39, train_loss: 0.7996, test_loss: 0.8965, test_f1: 0.5624
 epoch: 40, train_loss: 0.8105, test_loss: 0.8934, test_f1: 0.5452
 epoch: 41, train_loss: 0.8005, test_loss: 0.8751, test_f1: 0.5748
 epoch: 42, train_loss: 0.8046, test_loss: 0.8862, test_f1: 0.5724
 epoch: 43, train_loss: 0.8021, test_loss: 0.8713, test_f1: 0.6057
 epoch: 44, train_loss: 0.7880, test_loss: 0.8459, test_f1: 0.5950
 epoch: 45, train_loss: 0.7668, test_loss: 0.8381, test_f1: 0.6262
 epoch: 46, train_loss: 0.7591, test_loss: 0.8379, test_f1: 0.6155
 epoch: 47, train_loss: 0.7834, test_loss: 0.8439, test_f1: 0.5873
 epoch: 48, train_loss: 0.7673, test_loss: 0.9220, test_f1: 0.6024
 epoch: 49, train_loss: 0.7587, test_loss: 0.8600, test_f1: 0.5788
 epoch: 50, train_loss: 0.7781, test_loss: 0.8482, test_f1: 0.5613
 epoch: 51, train_loss: 0.7411, test_loss: 0.8476, test_f1: 0.6018
 epoch: 52, train_loss: 0.7296, test_loss: 0.8265, test_f1: 0.5825
 epoch: 53, train_loss: 0.7225, test_loss: 0.8342, test_f1: 0.6205
 epoch: 54, train_loss: 0.7213, test_loss: 0.8123, test_f1: 0.6312
 epoch: 55, train_loss: 0.7106, test_loss: 0.8014, test_f1: 0.6495
 epoch: 56, train_loss: 0.7203, test_loss: 0.8637, test_f1: 0.6180
 epoch: 57, train_loss: 0.7110, test_loss: 0.8628, test_f1: 0.5905
 epoch: 58, train_loss: 0.7232, test_loss: 0.8063, test_f1: 0.6076
 epoch: 59, train_loss: 0.7025, test_loss: 0.8639, test_f1: 0.6015
 epoch: 60, train_loss: 0.7134, test_loss: 0.8424, test_f1: 0.6440
 epoch: 61, train_loss: 0.7039, test_loss: 0.8241, test_f1: 0.6379
 epoch: 62, train_loss: 0.6941, test_loss: 0.8319, test_f1: 0.5986
 epoch: 63, train_loss: 0.7148, test_loss: 0.7795, test_f1: 0.6371
 epoch: 64, train_loss: 0.6986, test_loss: 0.7921, test_f1: 0.6233
 epoch: 65, train_loss: 0.6870, test_loss: 0.8240, test_f1: 0.6542
 epoch: 66, train_loss: 0.6911, test_loss: 0.8313, test_f1: 0.6074
 epoch: 67, train_loss: 0.7192, test_loss: 0.7776, test_f1: 0.6383
 epoch: 68, train_loss: 0.6912, test_loss: 0.8374, test_f1: 0.6078
 epoch: 69, train_loss: 0.7001, test_loss: 0.7948, test_f1: 0.6532
 epoch: 70, train_loss: 0.6778, test_loss: 0.8981, test_f1: 0.5750
 epoch: 71, train_loss: 0.7084, test_loss: 0.7918, test_f1: 0.6593
 epoch: 72, train_loss: 0.6950, test_loss: 0.8127, test_f1: 0.6277
 epoch: 73, train_loss: 0.6851, test_loss: 0.8172, test_f1: 0.6511
 epoch: 74, train_loss: 0.6784, test_loss: 0.7973, test_f1: 0.6530
 epoch: 75, train_loss: 0.6964, test_loss: 0.7928, test_f1: 0.6446
 epoch: 76, train_loss: 0.6722, test_loss: 0.7815, test_f1: 0.6600
 epoch: 77, train_loss: 0.6817, test_loss: 0.7976, test_f1: 0.6467
 epoch: 78, train_loss: 0.6801, test_loss: 0.7847, test_f1: 0.6579
 epoch: 79, train_loss: 0.6732, test_loss: 0.9173, test_f1: 0.6127
 epoch: 80, train_loss: 0.6864, test_loss: 0.8069, test_f1: 0.6183
 epoch: 81, train_loss: 0.6870, test_loss: 0.8254, test_f1: 0.6513
 epoch: 82, train_loss: 0.6850, test_loss: 0.7853, test_f1: 0.6662
 epoch: 83, train_loss: 0.6855, test_loss: 0.8194, test_f1: 0.6358
 epoch: 84, train_loss: 0.6654, test_loss: 0.8106, test_f1: 0.6324
 epoch: 85, train_loss: 0.6898, test_loss: 0.7975, test_f1: 0.6410
 epoch: 86, train_loss: 0.6786, test_loss: 0.7881, test_f1: 0.6569
 epoch: 87, train_loss: 0.6745, test_loss: 0.8315, test_f1: 0.6242
 epoch: 88, train_loss: 0.6967, test_loss: 0.8094, test_f1: 0.6407
 epoch: 89, train_loss: 0.6574, test_loss: 0.8235, test_f1: 0.6372
 epoch: 90, train_loss: 0.6528, test_loss: 0.8317, test_f1: 0.6627
 epoch: 91, train_loss: 0.6738, test_loss: 0.8889, test_f1: 0.6013
 epoch: 92, train_loss: 0.6862, test_loss: 0.8297, test_f1: 0.6324
 epoch: 93, train_loss: 0.6623, test_loss: 0.8166, test_f1: 0.6280
 epoch: 94, train_loss: 0.6491, test_loss: 0.7983, test_f1: 0.6286
 epoch: 95, train_loss: 0.6524, test_loss: 0.7621, test_f1: 0.6603
 epoch: 96, train_loss: 0.6661, test_loss: 0.7732, test_f1: 0.6516
 epoch: 97, train_loss: 0.6675, test_loss: 0.8205, test_f1: 0.6411
 epoch: 98, train_loss: 0.6718, test_loss: 0.7887, test_f1: 0.6546
 epoch: 99, train_loss: 0.6673, test_loss: 0.7942, test_f1: 0.6734

Training completed in 820.47 seconds
Best F1: 0.6743 at epoch 81
Mean F1 across iterations: 0.6546  0.0170
========================FINAL RESULTS================================
FEGIN weighted F1: 0.6743  0.0170
python main.py --data ltspice_examples --representation component_pin_net --model FEGIN --layers 6 --hiddens 16 --batch_size 64 --lr 0.01 --emb_size 512 --epochs 100 --save_appendix component_pin_net_L6_H16_BS64_LR0.01_E512 --no_val
-----



STDERR:
  File "main.py", line 370, in <module>
    main()
  File "main.py", line 254, in main
    dataset = dataset_class(
  File "/home/philip/projects/ltspice_examples_code_repo/Circuit-Completion-Using-GNNs/component_classification_with_link_prediction_head/evaluation/FEGIN/kernel/circuit_datasets.py", line 15, in __init__
    self.data, self.slices = torch.load(self.processed_paths[0])
  File "/home/philip/.local/lib/python3.8/site-packages/torch/serialization.py", line 1040, in load
    warnings.warn(
  File "/usr/lib/python3.8/warnings.py", line 109, in _showwarnmsg
    sw(msg.message, msg.category, msg.filename, msg.lineno,
  File "main.py", line 47, in warn_with_traceback
    traceback.print_stack(file=log)
/home/philip/projects/ltspice_examples_code_repo/Circuit-Completion-Using-GNNs/component_classification_with_link_prediction_head/evaluation/FEGIN/kernel/circuit_datasets.py:15: FutureWarning: You are using `torch.load` with `weights_only=False` (the current default value), which uses the default pickle module implicitly. It is possible to construct malicious pickle data which will execute arbitrary code during unpickling (See https://github.com/pytorch/pytorch/blob/main/SECURITY.md#untrusted-models for more details). In a future release, the default value for `weights_only` will be flipped to `True`. This limits the functions that could be executed during unpickling. Arbitrary objects will no longer be allowed to be loaded via this mode unless they are explicitly allowlisted by the user via `torch.serialization.add_safe_globals`. We recommend you start setting `weights_only=True` for any use case where you don't have full control of the loaded file. Please open an issue on GitHub for any issues related to this experimental feature.
  self.data, self.slices = torch.load(self.processed_paths[0])
