STDOUT:
Results will be saved in /home/philip/projects/ltspice_examples_code_repo/Circuit-Completion-Using-GNNs/component_classification_with_link_prediction_head/evaluation/FEGIN/results/model_FEGIN_dataset_ltspice_examples
Command line input: python main.py --data ltspice_examples --representation component_component --model FEGIN --layers 4 --hiddens 16 --batch_size 32 --lr 0.01 --emb_size 512 --epochs 100 --save_appendix component_component_L4_H16_BS32_LR0.01_E512 --no_val
 is saved.
-----
ltspice_examples - FEGIN
Using 4 layers, 16 hidden units, h = 2
Loading component_component representation dataset
ENTERED
Training FEGIN on component_component representation
Train: 3556, Test: 845
##################ITERATION #0 ****************************************
 epoch: 0, train_loss: 1.2864, test_loss: 1.2791, test_f1: 0.2274
 epoch: 1, train_loss: 1.2150, test_loss: 1.1671, test_f1: 0.3651
 epoch: 2, train_loss: 1.1390, test_loss: 1.0210, test_f1: 0.4473
 epoch: 3, train_loss: 1.0669, test_loss: 1.0439, test_f1: 0.4527
 epoch: 4, train_loss: 1.0536, test_loss: 1.1530, test_f1: 0.4333
 epoch: 5, train_loss: 1.0293, test_loss: 1.1265, test_f1: 0.4878
 epoch: 6, train_loss: 1.0183, test_loss: 1.1179, test_f1: 0.4393
 epoch: 7, train_loss: 1.0529, test_loss: 1.0123, test_f1: 0.4871
 epoch: 8, train_loss: 1.0154, test_loss: 1.0429, test_f1: 0.4876
 epoch: 9, train_loss: 1.0182, test_loss: 1.0275, test_f1: 0.4454
 epoch: 10, train_loss: 1.0391, test_loss: 1.0925, test_f1: 0.4104
 epoch: 11, train_loss: 1.0435, test_loss: 0.9903, test_f1: 0.4634
 epoch: 12, train_loss: 0.9845, test_loss: 1.0685, test_f1: 0.4557
 epoch: 13, train_loss: 0.9987, test_loss: 0.9922, test_f1: 0.4693
 epoch: 14, train_loss: 0.9883, test_loss: 1.0187, test_f1: 0.4757
 epoch: 15, train_loss: 0.9838, test_loss: 1.0172, test_f1: 0.4444
 epoch: 16, train_loss: 0.9747, test_loss: 1.0124, test_f1: 0.4452
 epoch: 17, train_loss: 0.9711, test_loss: 1.0355, test_f1: 0.4752
 epoch: 18, train_loss: 0.9811, test_loss: 1.0118, test_f1: 0.4623
 epoch: 19, train_loss: 0.9647, test_loss: 1.0364, test_f1: 0.4667
 epoch: 20, train_loss: 0.9797, test_loss: 1.0014, test_f1: 0.4634
 epoch: 21, train_loss: 0.9701, test_loss: 1.0122, test_f1: 0.4632
 epoch: 22, train_loss: 0.9732, test_loss: 1.0104, test_f1: 0.4607
 epoch: 23, train_loss: 0.9587, test_loss: 1.0061, test_f1: 0.4549
 epoch: 24, train_loss: 0.9554, test_loss: 1.0303, test_f1: 0.4467
 epoch: 25, train_loss: 0.9543, test_loss: 1.0367, test_f1: 0.4225
 epoch: 26, train_loss: 0.9613, test_loss: 1.0146, test_f1: 0.4696
 epoch: 27, train_loss: 0.9497, test_loss: 1.0055, test_f1: 0.4974
 epoch: 28, train_loss: 0.9587, test_loss: 1.0029, test_f1: 0.4742
 epoch: 29, train_loss: 0.9536, test_loss: 0.9955, test_f1: 0.4721
 epoch: 30, train_loss: 0.9452, test_loss: 0.9739, test_f1: 0.5003
 epoch: 31, train_loss: 0.9649, test_loss: 1.0915, test_f1: 0.4460
 epoch: 32, train_loss: 0.9508, test_loss: 1.1058, test_f1: 0.4809
 epoch: 33, train_loss: 0.9420, test_loss: 1.0114, test_f1: 0.4705
 epoch: 34, train_loss: 0.9428, test_loss: 1.0078, test_f1: 0.4897
 epoch: 35, train_loss: 0.9373, test_loss: 0.9603, test_f1: 0.4739
 epoch: 36, train_loss: 0.9503, test_loss: 0.9667, test_f1: 0.5051
 epoch: 37, train_loss: 0.9440, test_loss: 0.9989, test_f1: 0.4440
 epoch: 38, train_loss: 0.9302, test_loss: 0.9285, test_f1: 0.4685
 epoch: 39, train_loss: 0.9424, test_loss: 1.0070, test_f1: 0.4801
 epoch: 40, train_loss: 0.9277, test_loss: 0.9954, test_f1: 0.4451
 epoch: 41, train_loss: 0.9238, test_loss: 0.9716, test_f1: 0.4694
 epoch: 42, train_loss: 0.9388, test_loss: 0.9810, test_f1: 0.4703
 epoch: 43, train_loss: 0.9292, test_loss: 0.9976, test_f1: 0.4582
 epoch: 44, train_loss: 0.9228, test_loss: 0.9794, test_f1: 0.4582
 epoch: 45, train_loss: 0.9184, test_loss: 0.9957, test_f1: 0.4700
 epoch: 46, train_loss: 0.9259, test_loss: 1.0683, test_f1: 0.4555
 epoch: 47, train_loss: 0.9237, test_loss: 0.9308, test_f1: 0.4860
 epoch: 48, train_loss: 0.9214, test_loss: 0.9384, test_f1: 0.4663
 epoch: 49, train_loss: 0.9414, test_loss: 0.9343, test_f1: 0.4596
 epoch: 50, train_loss: 0.9336, test_loss: 0.9367, test_f1: 0.5025
 epoch: 51, train_loss: 0.9189, test_loss: 0.9413, test_f1: 0.4904
 epoch: 52, train_loss: 0.9076, test_loss: 0.9749, test_f1: 0.4830
 epoch: 53, train_loss: 0.8981, test_loss: 0.9556, test_f1: 0.4826
 epoch: 54, train_loss: 0.8988, test_loss: 0.9649, test_f1: 0.4844
 epoch: 55, train_loss: 0.8952, test_loss: 0.9352, test_f1: 0.5020
 epoch: 56, train_loss: 0.9008, test_loss: 1.0244, test_f1: 0.4549
 epoch: 57, train_loss: 0.8935, test_loss: 0.9847, test_f1: 0.5023
 epoch: 58, train_loss: 0.8929, test_loss: 0.9784, test_f1: 0.4775
 epoch: 59, train_loss: 0.9031, test_loss: 0.9641, test_f1: 0.4777
 epoch: 60, train_loss: 0.8904, test_loss: 1.1226, test_f1: 0.4435
 epoch: 61, train_loss: 0.8846, test_loss: 0.9841, test_f1: 0.4801
 epoch: 62, train_loss: 0.8683, test_loss: 1.0026, test_f1: 0.5002
 epoch: 63, train_loss: 0.8827, test_loss: 0.9512, test_f1: 0.4970
 epoch: 64, train_loss: 0.8802, test_loss: 1.0104, test_f1: 0.4748
 epoch: 65, train_loss: 0.8761, test_loss: 0.9899, test_f1: 0.4843
 epoch: 66, train_loss: 0.9093, test_loss: 0.9621, test_f1: 0.4966
 epoch: 67, train_loss: 0.8849, test_loss: 0.9783, test_f1: 0.5058
 epoch: 68, train_loss: 0.8784, test_loss: 0.9948, test_f1: 0.4983
 epoch: 69, train_loss: 0.8705, test_loss: 0.9732, test_f1: 0.5312
 epoch: 70, train_loss: 0.8785, test_loss: 0.9322, test_f1: 0.5360
 epoch: 71, train_loss: 0.8733, test_loss: 0.9952, test_f1: 0.5063
 epoch: 72, train_loss: 0.8666, test_loss: 1.0005, test_f1: 0.4914
 epoch: 73, train_loss: 0.8761, test_loss: 0.9902, test_f1: 0.5604
 epoch: 74, train_loss: 0.8621, test_loss: 0.9984, test_f1: 0.5196
 epoch: 75, train_loss: 0.9087, test_loss: 0.9859, test_f1: 0.5194
 epoch: 76, train_loss: 0.8700, test_loss: 1.0232, test_f1: 0.5023
 epoch: 77, train_loss: 0.8579, test_loss: 1.0428, test_f1: 0.4634
 epoch: 78, train_loss: 0.8738, test_loss: 1.0008, test_f1: 0.4943
 epoch: 79, train_loss: 0.8794, test_loss: 0.9938, test_f1: 0.5159
 epoch: 80, train_loss: 0.8696, test_loss: 0.9829, test_f1: 0.4880
 epoch: 81, train_loss: 0.8746, test_loss: 1.0232, test_f1: 0.4944
 epoch: 82, train_loss: 0.8686, test_loss: 1.0026, test_f1: 0.4867
 epoch: 83, train_loss: 0.8618, test_loss: 0.9804, test_f1: 0.4809
 epoch: 84, train_loss: 0.8759, test_loss: 0.9771, test_f1: 0.5157
 epoch: 85, train_loss: 0.8630, test_loss: 0.9814, test_f1: 0.4988
 epoch: 86, train_loss: 0.8621, test_loss: 0.9862, test_f1: 0.5271
 epoch: 87, train_loss: 0.8576, test_loss: 0.9795, test_f1: 0.5290
 epoch: 88, train_loss: 0.8645, test_loss: 0.9650, test_f1: 0.5517
 epoch: 89, train_loss: 0.8604, test_loss: 0.9995, test_f1: 0.4874
 epoch: 90, train_loss: 0.8700, test_loss: 1.1133, test_f1: 0.4771
 epoch: 91, train_loss: 0.8600, test_loss: 1.0201, test_f1: 0.5386
 epoch: 92, train_loss: 0.8559, test_loss: 1.0058, test_f1: 0.5021
 epoch: 93, train_loss: 0.8567, test_loss: 0.9740, test_f1: 0.5158
 epoch: 94, train_loss: 0.8686, test_loss: 0.9755, test_f1: 0.5065
 epoch: 95, train_loss: 0.8599, test_loss: 0.9645, test_f1: 0.5429
 epoch: 96, train_loss: 0.8567, test_loss: 1.0949, test_f1: 0.4660
 epoch: 97, train_loss: 0.8634, test_loss: 1.0056, test_f1: 0.4939
 epoch: 98, train_loss: 0.8634, test_loss: 0.9881, test_f1: 0.5016
 epoch: 99, train_loss: 0.8639, test_loss: 0.9663, test_f1: 0.5508
##################ITERATION #1 ****************************************
 epoch: 0, train_loss: 1.2670, test_loss: 1.2645, test_f1: 0.3198
 epoch: 1, train_loss: 1.2169, test_loss: 1.1372, test_f1: 0.4473
 epoch: 2, train_loss: 1.1594, test_loss: 1.1070, test_f1: 0.3895
 epoch: 3, train_loss: 1.1406, test_loss: 1.1210, test_f1: 0.4323
 epoch: 4, train_loss: 1.1338, test_loss: 1.1048, test_f1: 0.4423
 epoch: 5, train_loss: 1.0861, test_loss: 0.9995, test_f1: 0.4905
 epoch: 6, train_loss: 1.0520, test_loss: 1.0641, test_f1: 0.4289
 epoch: 7, train_loss: 1.0377, test_loss: 1.0219, test_f1: 0.4653
 epoch: 8, train_loss: 1.0075, test_loss: 0.9669, test_f1: 0.4542
 epoch: 9, train_loss: 1.0040, test_loss: 1.0265, test_f1: 0.4482
 epoch: 10, train_loss: 0.9919, test_loss: 0.9916, test_f1: 0.4498
 epoch: 11, train_loss: 0.9945, test_loss: 1.0153, test_f1: 0.4504
 epoch: 12, train_loss: 0.9887, test_loss: 1.0011, test_f1: 0.4636
 epoch: 13, train_loss: 0.9905, test_loss: 1.0509, test_f1: 0.4579
 epoch: 14, train_loss: 0.9616, test_loss: 1.1443, test_f1: 0.4372
 epoch: 15, train_loss: 0.9796, test_loss: 0.9966, test_f1: 0.4704
 epoch: 16, train_loss: 0.9712, test_loss: 1.0255, test_f1: 0.4727
 epoch: 17, train_loss: 0.9993, test_loss: 1.0707, test_f1: 0.4360
 epoch: 18, train_loss: 0.9708, test_loss: 1.1325, test_f1: 0.4398
 epoch: 19, train_loss: 0.9707, test_loss: 1.0111, test_f1: 0.4508
 epoch: 20, train_loss: 0.9528, test_loss: 1.0558, test_f1: 0.4603
 epoch: 21, train_loss: 0.9621, test_loss: 1.0167, test_f1: 0.4796
 epoch: 22, train_loss: 0.9504, test_loss: 1.0421, test_f1: 0.4906
 epoch: 23, train_loss: 0.9689, test_loss: 1.0994, test_f1: 0.4845
 epoch: 24, train_loss: 0.9905, test_loss: 1.0134, test_f1: 0.4654
 epoch: 25, train_loss: 0.9739, test_loss: 1.0279, test_f1: 0.4812
 epoch: 26, train_loss: 0.9555, test_loss: 1.0165, test_f1: 0.4678
 epoch: 27, train_loss: 0.9529, test_loss: 1.0675, test_f1: 0.4576
 epoch: 28, train_loss: 0.9552, test_loss: 1.0989, test_f1: 0.4599
 epoch: 29, train_loss: 0.9473, test_loss: 1.0562, test_f1: 0.4578
 epoch: 30, train_loss: 0.9412, test_loss: 1.0626, test_f1: 0.4611
 epoch: 31, train_loss: 0.9361, test_loss: 0.9968, test_f1: 0.4868
 epoch: 32, train_loss: 0.9599, test_loss: 1.0488, test_f1: 0.4657
 epoch: 33, train_loss: 0.9323, test_loss: 1.1564, test_f1: 0.4717
 epoch: 34, train_loss: 0.9409, test_loss: 0.9784, test_f1: 0.5107
 epoch: 35, train_loss: 0.9330, test_loss: 0.9680, test_f1: 0.5090
 epoch: 36, train_loss: 0.9329, test_loss: 1.0462, test_f1: 0.4885
 epoch: 37, train_loss: 0.9253, test_loss: 1.0349, test_f1: 0.4872
 epoch: 38, train_loss: 0.9291, test_loss: 0.9784, test_f1: 0.5160
 epoch: 39, train_loss: 0.9442, test_loss: 1.0211, test_f1: 0.5050
 epoch: 40, train_loss: 0.9257, test_loss: 1.0337, test_f1: 0.5046
 epoch: 41, train_loss: 0.9284, test_loss: 1.0057, test_f1: 0.5143
 epoch: 42, train_loss: 0.9189, test_loss: 0.9886, test_f1: 0.5063
 epoch: 43, train_loss: 0.9257, test_loss: 1.0111, test_f1: 0.4911
 epoch: 44, train_loss: 0.9206, test_loss: 1.0446, test_f1: 0.5013
 epoch: 45, train_loss: 0.9345, test_loss: 0.9896, test_f1: 0.4921
 epoch: 46, train_loss: 0.9216, test_loss: 0.9983, test_f1: 0.5053
 epoch: 47, train_loss: 0.9070, test_loss: 1.0179, test_f1: 0.5278
 epoch: 48, train_loss: 0.9111, test_loss: 0.9986, test_f1: 0.4832
 epoch: 49, train_loss: 0.9287, test_loss: 0.9983, test_f1: 0.4654
 epoch: 50, train_loss: 0.9292, test_loss: 1.1688, test_f1: 0.4699
 epoch: 51, train_loss: 0.9024, test_loss: 0.9833, test_f1: 0.4927
 epoch: 52, train_loss: 0.9142, test_loss: 0.9824, test_f1: 0.4981
 epoch: 53, train_loss: 0.9027, test_loss: 0.9813, test_f1: 0.5143
 epoch: 54, train_loss: 0.9052, test_loss: 0.9813, test_f1: 0.5050
 epoch: 55, train_loss: 0.8987, test_loss: 0.9866, test_f1: 0.5226
 epoch: 56, train_loss: 0.8891, test_loss: 0.9702, test_f1: 0.5049
 epoch: 57, train_loss: 0.8764, test_loss: 1.0027, test_f1: 0.5003
 epoch: 58, train_loss: 0.8999, test_loss: 0.9933, test_f1: 0.5209
 epoch: 59, train_loss: 0.8953, test_loss: 0.9889, test_f1: 0.5245
 epoch: 60, train_loss: 0.8927, test_loss: 0.9951, test_f1: 0.4997
 epoch: 61, train_loss: 0.8820, test_loss: 0.9675, test_f1: 0.5184
 epoch: 62, train_loss: 0.8920, test_loss: 0.9957, test_f1: 0.5000
 epoch: 63, train_loss: 0.8826, test_loss: 0.9759, test_f1: 0.5197
 epoch: 64, train_loss: 0.8833, test_loss: 0.9474, test_f1: 0.5221
 epoch: 65, train_loss: 0.8902, test_loss: 0.9847, test_f1: 0.5106
 epoch: 66, train_loss: 0.8643, test_loss: 1.0019, test_f1: 0.5125
 epoch: 67, train_loss: 0.8763, test_loss: 0.9886, test_f1: 0.5149
 epoch: 68, train_loss: 0.8748, test_loss: 0.9839, test_f1: 0.5210
 epoch: 69, train_loss: 0.8664, test_loss: 1.0222, test_f1: 0.5084
 epoch: 70, train_loss: 0.8721, test_loss: 0.9600, test_f1: 0.5080
 epoch: 71, train_loss: 0.8660, test_loss: 0.9728, test_f1: 0.5229
 epoch: 72, train_loss: 0.8683, test_loss: 0.9781, test_f1: 0.5235
 epoch: 73, train_loss: 0.8650, test_loss: 1.0104, test_f1: 0.5172
 epoch: 74, train_loss: 0.8678, test_loss: 0.9806, test_f1: 0.5088
 epoch: 75, train_loss: 0.8635, test_loss: 1.0472, test_f1: 0.5012
 epoch: 76, train_loss: 0.8830, test_loss: 0.9906, test_f1: 0.5258
 epoch: 77, train_loss: 0.8617, test_loss: 0.9857, test_f1: 0.5215
 epoch: 78, train_loss: 0.8676, test_loss: 0.9467, test_f1: 0.5027
 epoch: 79, train_loss: 0.8581, test_loss: 0.9597, test_f1: 0.5274
 epoch: 80, train_loss: 0.8630, test_loss: 1.0052, test_f1: 0.5130
 epoch: 81, train_loss: 0.8580, test_loss: 1.0686, test_f1: 0.5037
 epoch: 82, train_loss: 0.8563, test_loss: 1.0339, test_f1: 0.5165
 epoch: 83, train_loss: 0.8614, test_loss: 1.0819, test_f1: 0.5008
 epoch: 84, train_loss: 0.8652, test_loss: 0.9793, test_f1: 0.5197
 epoch: 85, train_loss: 0.8507, test_loss: 1.0115, test_f1: 0.5264
 epoch: 86, train_loss: 0.8458, test_loss: 1.0440, test_f1: 0.5047
 epoch: 87, train_loss: 0.8832, test_loss: 0.9971, test_f1: 0.5074
 epoch: 88, train_loss: 0.8597, test_loss: 0.9965, test_f1: 0.5157
 epoch: 89, train_loss: 0.8629, test_loss: 0.9610, test_f1: 0.5311
 epoch: 90, train_loss: 0.8574, test_loss: 0.9337, test_f1: 0.5257
 epoch: 91, train_loss: 0.8507, test_loss: 0.9471, test_f1: 0.5217
 epoch: 92, train_loss: 0.8540, test_loss: 1.0178, test_f1: 0.5069
 epoch: 93, train_loss: 0.8605, test_loss: 0.9717, test_f1: 0.5278
 epoch: 94, train_loss: 0.8534, test_loss: 0.9305, test_f1: 0.5218
 epoch: 95, train_loss: 0.8603, test_loss: 1.0591, test_f1: 0.5124
 epoch: 96, train_loss: 0.8808, test_loss: 0.9630, test_f1: 0.5170
 epoch: 97, train_loss: 0.9434, test_loss: 0.9775, test_f1: 0.5230
 epoch: 98, train_loss: 0.9085, test_loss: 0.9548, test_f1: 0.5232
 epoch: 99, train_loss: 0.8896, test_loss: 0.9873, test_f1: 0.5172
##################ITERATION #2 ****************************************
 epoch: 0, train_loss: 1.2599, test_loss: 1.1468, test_f1: 0.3596
 epoch: 1, train_loss: 1.1851, test_loss: 1.1077, test_f1: 0.3457
 epoch: 2, train_loss: 1.1424, test_loss: 1.0792, test_f1: 0.3291
 epoch: 3, train_loss: 1.1094, test_loss: 1.0567, test_f1: 0.4132
 epoch: 4, train_loss: 1.1056, test_loss: 1.0799, test_f1: 0.4277
 epoch: 5, train_loss: 1.0827, test_loss: 1.0454, test_f1: 0.4395
 epoch: 6, train_loss: 1.0580, test_loss: 1.0410, test_f1: 0.4339
 epoch: 7, train_loss: 1.0462, test_loss: 1.0109, test_f1: 0.4326
 epoch: 8, train_loss: 1.0191, test_loss: 0.9787, test_f1: 0.4694
 epoch: 9, train_loss: 1.0165, test_loss: 0.9996, test_f1: 0.4693
 epoch: 10, train_loss: 1.0087, test_loss: 1.0242, test_f1: 0.4645
 epoch: 11, train_loss: 1.0009, test_loss: 1.0097, test_f1: 0.4890
 epoch: 12, train_loss: 0.9960, test_loss: 1.0005, test_f1: 0.4590
 epoch: 13, train_loss: 0.9717, test_loss: 1.0613, test_f1: 0.4602
 epoch: 14, train_loss: 0.9893, test_loss: 1.0229, test_f1: 0.4596
 epoch: 15, train_loss: 0.9675, test_loss: 0.9927, test_f1: 0.4744
 epoch: 16, train_loss: 0.9682, test_loss: 1.1054, test_f1: 0.4782
 epoch: 17, train_loss: 0.9727, test_loss: 1.0440, test_f1: 0.4863
 epoch: 18, train_loss: 0.9719, test_loss: 1.0280, test_f1: 0.4564
 epoch: 19, train_loss: 0.9608, test_loss: 0.9994, test_f1: 0.4278
 epoch: 20, train_loss: 0.9535, test_loss: 1.0109, test_f1: 0.5044
 epoch: 21, train_loss: 0.9565, test_loss: 1.1179, test_f1: 0.4573
 epoch: 22, train_loss: 0.9427, test_loss: 1.0094, test_f1: 0.4981
 epoch: 23, train_loss: 0.9595, test_loss: 0.9870, test_f1: 0.5116
 epoch: 24, train_loss: 0.9513, test_loss: 0.9991, test_f1: 0.4929
 epoch: 25, train_loss: 0.9440, test_loss: 0.9892, test_f1: 0.4846
 epoch: 26, train_loss: 0.9476, test_loss: 0.9623, test_f1: 0.5061
 epoch: 27, train_loss: 0.9432, test_loss: 0.9813, test_f1: 0.5050
 epoch: 28, train_loss: 0.9614, test_loss: 1.0539, test_f1: 0.4574
 epoch: 29, train_loss: 0.9268, test_loss: 0.9286, test_f1: 0.5082
 epoch: 30, train_loss: 0.9448, test_loss: 1.0688, test_f1: 0.4836
 epoch: 31, train_loss: 0.9289, test_loss: 0.9826, test_f1: 0.5168
 epoch: 32, train_loss: 0.9206, test_loss: 1.1601, test_f1: 0.4716
 epoch: 33, train_loss: 0.9156, test_loss: 0.9772, test_f1: 0.5055
 epoch: 34, train_loss: 0.9300, test_loss: 1.0434, test_f1: 0.5003
 epoch: 35, train_loss: 0.9294, test_loss: 1.0060, test_f1: 0.4891
 epoch: 36, train_loss: 0.9232, test_loss: 1.0058, test_f1: 0.5251
 epoch: 37, train_loss: 0.9209, test_loss: 1.1583, test_f1: 0.4588
 epoch: 38, train_loss: 0.9477, test_loss: 1.0366, test_f1: 0.4950
 epoch: 39, train_loss: 0.9106, test_loss: 0.9502, test_f1: 0.5330
 epoch: 40, train_loss: 0.9151, test_loss: 0.9872, test_f1: 0.5141
 epoch: 41, train_loss: 0.9166, test_loss: 0.9697, test_f1: 0.5199
 epoch: 42, train_loss: 0.9131, test_loss: 0.9906, test_f1: 0.4937
 epoch: 43, train_loss: 0.9250, test_loss: 1.0701, test_f1: 0.4817
 epoch: 44, train_loss: 0.9148, test_loss: 0.9816, test_f1: 0.4989
 epoch: 45, train_loss: 0.9038, test_loss: 1.0041, test_f1: 0.5069
 epoch: 46, train_loss: 0.9102, test_loss: 0.9677, test_f1: 0.5221
 epoch: 47, train_loss: 0.9110, test_loss: 1.0497, test_f1: 0.4800
 epoch: 48, train_loss: 0.9042, test_loss: 0.9904, test_f1: 0.4948
 epoch: 49, train_loss: 0.9072, test_loss: 1.1015, test_f1: 0.4788
 epoch: 50, train_loss: 0.9168, test_loss: 1.0157, test_f1: 0.5074
 epoch: 51, train_loss: 0.8972, test_loss: 0.9748, test_f1: 0.5082
 epoch: 52, train_loss: 0.8844, test_loss: 1.0020, test_f1: 0.5010
 epoch: 53, train_loss: 0.8880, test_loss: 0.9601, test_f1: 0.5172
 epoch: 54, train_loss: 0.8751, test_loss: 0.9685, test_f1: 0.5140
 epoch: 55, train_loss: 0.8828, test_loss: 0.9531, test_f1: 0.4961
 epoch: 56, train_loss: 0.8753, test_loss: 1.0761, test_f1: 0.4843
 epoch: 57, train_loss: 0.8852, test_loss: 0.9730, test_f1: 0.5252
 epoch: 58, train_loss: 0.8725, test_loss: 0.9939, test_f1: 0.5107
 epoch: 59, train_loss: 0.8824, test_loss: 0.9866, test_f1: 0.5149
 epoch: 60, train_loss: 0.8669, test_loss: 1.0414, test_f1: 0.5160
 epoch: 61, train_loss: 0.8712, test_loss: 0.9706, test_f1: 0.5035
 epoch: 62, train_loss: 0.8693, test_loss: 1.0064, test_f1: 0.5079
 epoch: 63, train_loss: 0.8698, test_loss: 0.9716, test_f1: 0.5125
 epoch: 64, train_loss: 0.8642, test_loss: 0.9801, test_f1: 0.5155
 epoch: 65, train_loss: 0.8691, test_loss: 0.9908, test_f1: 0.5194
 epoch: 66, train_loss: 0.8699, test_loss: 0.9872, test_f1: 0.5133
 epoch: 67, train_loss: 0.8572, test_loss: 0.9709, test_f1: 0.4976
 epoch: 68, train_loss: 0.8624, test_loss: 0.9890, test_f1: 0.5162
 epoch: 69, train_loss: 0.8658, test_loss: 1.0027, test_f1: 0.4960
 epoch: 70, train_loss: 0.8653, test_loss: 0.9901, test_f1: 0.5204
 epoch: 71, train_loss: 0.8713, test_loss: 0.9978, test_f1: 0.5126
 epoch: 72, train_loss: 0.8669, test_loss: 1.0843, test_f1: 0.4785
 epoch: 73, train_loss: 0.8728, test_loss: 0.9445, test_f1: 0.5134
 epoch: 74, train_loss: 0.8611, test_loss: 0.9648, test_f1: 0.5191
 epoch: 75, train_loss: 0.8579, test_loss: 1.0155, test_f1: 0.5012
 epoch: 76, train_loss: 0.8595, test_loss: 0.9639, test_f1: 0.5130
 epoch: 77, train_loss: 0.8553, test_loss: 0.9896, test_f1: 0.5112
 epoch: 78, train_loss: 0.8631, test_loss: 0.9763, test_f1: 0.5132
 epoch: 79, train_loss: 0.8562, test_loss: 0.9688, test_f1: 0.5051
 epoch: 80, train_loss: 0.8518, test_loss: 1.0220, test_f1: 0.4910
 epoch: 81, train_loss: 0.8599, test_loss: 0.9779, test_f1: 0.5157
 epoch: 82, train_loss: 0.8574, test_loss: 1.0663, test_f1: 0.5068
 epoch: 83, train_loss: 0.8564, test_loss: 0.9401, test_f1: 0.5112
 epoch: 84, train_loss: 0.8548, test_loss: 0.9751, test_f1: 0.5117
 epoch: 85, train_loss: 0.8409, test_loss: 0.9866, test_f1: 0.5165
 epoch: 86, train_loss: 0.8571, test_loss: 0.9943, test_f1: 0.5220
 epoch: 87, train_loss: 0.8541, test_loss: 0.9661, test_f1: 0.5225
 epoch: 88, train_loss: 0.8587, test_loss: 1.0332, test_f1: 0.4973
 epoch: 89, train_loss: 0.8515, test_loss: 0.9991, test_f1: 0.5007
 epoch: 90, train_loss: 0.8530, test_loss: 0.9443, test_f1: 0.5045
 epoch: 91, train_loss: 0.8621, test_loss: 1.0086, test_f1: 0.5286
 epoch: 92, train_loss: 0.8646, test_loss: 1.0598, test_f1: 0.4956
 epoch: 93, train_loss: 0.8561, test_loss: 0.9866, test_f1: 0.5250
 epoch: 94, train_loss: 0.8557, test_loss: 0.9975, test_f1: 0.5084
 epoch: 95, train_loss: 0.8571, test_loss: 1.0224, test_f1: 0.5025
 epoch: 96, train_loss: 0.8977, test_loss: 1.0009, test_f1: 0.5018
 epoch: 97, train_loss: 0.8479, test_loss: 1.0000, test_f1: 0.4922
 epoch: 98, train_loss: 0.8665, test_loss: 0.9352, test_f1: 0.5173
 epoch: 99, train_loss: 0.8559, test_loss: 0.9564, test_f1: 0.5075
##################ITERATION #3 ****************************************
 epoch: 0, train_loss: 1.2729, test_loss: 1.2384, test_f1: 0.2953
 epoch: 1, train_loss: 1.2213, test_loss: 1.1403, test_f1: 0.3322
 epoch: 2, train_loss: 1.1746, test_loss: 1.0818, test_f1: 0.4259
 epoch: 3, train_loss: 1.1207, test_loss: 1.0665, test_f1: 0.4520
 epoch: 4, train_loss: 1.0745, test_loss: 1.0534, test_f1: 0.4678
 epoch: 5, train_loss: 1.0663, test_loss: 1.0448, test_f1: 0.4685
 epoch: 6, train_loss: 1.0428, test_loss: 1.0259, test_f1: 0.4296
 epoch: 7, train_loss: 1.0180, test_loss: 1.0005, test_f1: 0.4393
 epoch: 8, train_loss: 1.0041, test_loss: 1.0020, test_f1: 0.4482
 epoch: 9, train_loss: 1.0158, test_loss: 1.0436, test_f1: 0.4627
 epoch: 10, train_loss: 0.9933, test_loss: 1.0138, test_f1: 0.4782
 epoch: 11, train_loss: 0.9805, test_loss: 1.0075, test_f1: 0.4730
 epoch: 12, train_loss: 0.9690, test_loss: 1.0152, test_f1: 0.4630
 epoch: 13, train_loss: 0.9793, test_loss: 0.9903, test_f1: 0.4468
 epoch: 14, train_loss: 1.0293, test_loss: 1.1831, test_f1: 0.4115
 epoch: 15, train_loss: 1.0345, test_loss: 0.9869, test_f1: 0.4928
 epoch: 16, train_loss: 0.9894, test_loss: 1.0389, test_f1: 0.4853
 epoch: 17, train_loss: 0.9690, test_loss: 1.0320, test_f1: 0.4691
 epoch: 18, train_loss: 0.9665, test_loss: 1.0418, test_f1: 0.4822
 epoch: 19, train_loss: 0.9695, test_loss: 1.0181, test_f1: 0.4684
 epoch: 20, train_loss: 0.9721, test_loss: 1.0066, test_f1: 0.4627
 epoch: 21, train_loss: 0.9549, test_loss: 1.0396, test_f1: 0.4591
 epoch: 22, train_loss: 0.9543, test_loss: 1.0165, test_f1: 0.5066
 epoch: 23, train_loss: 0.9459, test_loss: 1.0075, test_f1: 0.5030
 epoch: 24, train_loss: 0.9471, test_loss: 1.0124, test_f1: 0.4796
 epoch: 25, train_loss: 0.9970, test_loss: 1.0281, test_f1: 0.4845
 epoch: 26, train_loss: 1.0051, test_loss: 0.9764, test_f1: 0.4722
 epoch: 27, train_loss: 0.9633, test_loss: 1.0092, test_f1: 0.4899
 epoch: 28, train_loss: 0.9362, test_loss: 1.0445, test_f1: 0.4521
 epoch: 29, train_loss: 0.9642, test_loss: 0.9645, test_f1: 0.4843
 epoch: 30, train_loss: 0.9414, test_loss: 1.0006, test_f1: 0.4932
 epoch: 31, train_loss: 0.9339, test_loss: 1.0196, test_f1: 0.4942
 epoch: 32, train_loss: 0.9505, test_loss: 1.0164, test_f1: 0.5045
 epoch: 33, train_loss: 0.9417, test_loss: 1.0023, test_f1: 0.4779
 epoch: 34, train_loss: 0.9260, test_loss: 0.9903, test_f1: 0.4971
 epoch: 35, train_loss: 0.9491, test_loss: 1.0242, test_f1: 0.4758
 epoch: 36, train_loss: 0.9389, test_loss: 0.9764, test_f1: 0.5252
 epoch: 37, train_loss: 0.9354, test_loss: 0.9609, test_f1: 0.4883
 epoch: 38, train_loss: 0.9325, test_loss: 0.9991, test_f1: 0.4829
 epoch: 39, train_loss: 0.9125, test_loss: 0.9442, test_f1: 0.5108
 epoch: 40, train_loss: 0.9282, test_loss: 1.0101, test_f1: 0.5044
 epoch: 41, train_loss: 0.9165, test_loss: 1.0028, test_f1: 0.4823
 epoch: 42, train_loss: 0.9210, test_loss: 0.9895, test_f1: 0.5032
 epoch: 43, train_loss: 0.9131, test_loss: 1.0050, test_f1: 0.5052
 epoch: 44, train_loss: 0.9148, test_loss: 1.0389, test_f1: 0.4867
 epoch: 45, train_loss: 0.9294, test_loss: 1.0298, test_f1: 0.4622
 epoch: 46, train_loss: 0.9103, test_loss: 0.9955, test_f1: 0.5074
 epoch: 47, train_loss: 0.9127, test_loss: 0.9914, test_f1: 0.5018
 epoch: 48, train_loss: 0.9232, test_loss: 1.0012, test_f1: 0.4797
 epoch: 49, train_loss: 0.9074, test_loss: 0.9574, test_f1: 0.5039
 epoch: 50, train_loss: 0.9038, test_loss: 0.9698, test_f1: 0.5140
 epoch: 51, train_loss: 0.8979, test_loss: 0.9557, test_f1: 0.5078
 epoch: 52, train_loss: 0.8800, test_loss: 0.9676, test_f1: 0.5115
 epoch: 53, train_loss: 0.8868, test_loss: 0.9810, test_f1: 0.4985
 epoch: 54, train_loss: 0.8899, test_loss: 0.9724, test_f1: 0.5085
 epoch: 55, train_loss: 0.9682, test_loss: 0.9446, test_f1: 0.4974
 epoch: 56, train_loss: 0.9119, test_loss: 0.9564, test_f1: 0.5141
 epoch: 57, train_loss: 0.8964, test_loss: 0.9433, test_f1: 0.5122
 epoch: 58, train_loss: 0.8884, test_loss: 0.9250, test_f1: 0.5207
 epoch: 59, train_loss: 0.8897, test_loss: 0.9674, test_f1: 0.5106
 epoch: 60, train_loss: 0.8895, test_loss: 0.9527, test_f1: 0.5230
 epoch: 61, train_loss: 0.8783, test_loss: 0.9254, test_f1: 0.5187
 epoch: 62, train_loss: 0.8868, test_loss: 0.9698, test_f1: 0.5117
 epoch: 63, train_loss: 0.8700, test_loss: 0.9370, test_f1: 0.5196
 epoch: 64, train_loss: 0.8727, test_loss: 0.9375, test_f1: 0.5123
 epoch: 65, train_loss: 0.8711, test_loss: 0.9404, test_f1: 0.5148
 epoch: 66, train_loss: 0.8864, test_loss: 0.9473, test_f1: 0.5065
 epoch: 67, train_loss: 0.8808, test_loss: 0.9527, test_f1: 0.5262
 epoch: 68, train_loss: 0.8771, test_loss: 0.9387, test_f1: 0.5083
 epoch: 69, train_loss: 0.8670, test_loss: 0.9178, test_f1: 0.5243
 epoch: 70, train_loss: 0.8596, test_loss: 0.9114, test_f1: 0.5244
 epoch: 71, train_loss: 0.8714, test_loss: 0.9269, test_f1: 0.5214
 epoch: 72, train_loss: 0.8704, test_loss: 0.9289, test_f1: 0.5194
 epoch: 73, train_loss: 0.8681, test_loss: 0.9121, test_f1: 0.5116
 epoch: 74, train_loss: 0.8622, test_loss: 1.0064, test_f1: 0.4971
 epoch: 75, train_loss: 0.8620, test_loss: 0.9469, test_f1: 0.5265
 epoch: 76, train_loss: 0.8757, test_loss: 0.9449, test_f1: 0.5249
 epoch: 77, train_loss: 0.8798, test_loss: 0.9568, test_f1: 0.5167
 epoch: 78, train_loss: 0.8587, test_loss: 0.9396, test_f1: 0.5146
 epoch: 79, train_loss: 0.8618, test_loss: 0.9513, test_f1: 0.5262
 epoch: 80, train_loss: 0.8665, test_loss: 0.9483, test_f1: 0.4970
 epoch: 81, train_loss: 0.8645, test_loss: 0.9906, test_f1: 0.5013
 epoch: 82, train_loss: 0.8523, test_loss: 0.9502, test_f1: 0.5327
 epoch: 83, train_loss: 0.8635, test_loss: 0.9544, test_f1: 0.5171
 epoch: 84, train_loss: 0.8470, test_loss: 0.9732, test_f1: 0.5083
 epoch: 85, train_loss: 0.8696, test_loss: 0.9337, test_f1: 0.5203
 epoch: 86, train_loss: 0.8488, test_loss: 0.9210, test_f1: 0.5401
 epoch: 87, train_loss: 0.8659, test_loss: 0.9363, test_f1: 0.5152
 epoch: 88, train_loss: 0.8567, test_loss: 0.9500, test_f1: 0.5184
 epoch: 89, train_loss: 0.8725, test_loss: 0.9791, test_f1: 0.5196
 epoch: 90, train_loss: 0.8596, test_loss: 0.9340, test_f1: 0.5176
 epoch: 91, train_loss: 0.8595, test_loss: 0.9440, test_f1: 0.5082
 epoch: 92, train_loss: 0.8583, test_loss: 0.9680, test_f1: 0.5075
 epoch: 93, train_loss: 0.8517, test_loss: 0.9222, test_f1: 0.5291
 epoch: 94, train_loss: 0.8590, test_loss: 0.9602, test_f1: 0.5129
 epoch: 95, train_loss: 0.8697, test_loss: 0.9248, test_f1: 0.5232
 epoch: 96, train_loss: 0.8653, test_loss: 0.9493, test_f1: 0.5156
 epoch: 97, train_loss: 0.8537, test_loss: 0.9390, test_f1: 0.5214
 epoch: 98, train_loss: 0.8501, test_loss: 0.9547, test_f1: 0.5284
 epoch: 99, train_loss: 0.8440, test_loss: 0.9925, test_f1: 0.5141
##################ITERATION #4 ****************************************
 epoch: 0, train_loss: 1.2784, test_loss: 1.2602, test_f1: 0.2793
 epoch: 1, train_loss: 1.2186, test_loss: 1.1443, test_f1: 0.3379
 epoch: 2, train_loss: 1.1626, test_loss: 1.0873, test_f1: 0.4189
 epoch: 3, train_loss: 1.1259, test_loss: 1.1076, test_f1: 0.3434
 epoch: 4, train_loss: 1.1101, test_loss: 1.1613, test_f1: 0.3475
 epoch: 5, train_loss: 1.1304, test_loss: 1.0659, test_f1: 0.3809
 epoch: 6, train_loss: 1.0839, test_loss: 1.0498, test_f1: 0.4193
 epoch: 7, train_loss: 1.0863, test_loss: 1.1248, test_f1: 0.4295
 epoch: 8, train_loss: 1.0790, test_loss: 1.0924, test_f1: 0.3707
 epoch: 9, train_loss: 1.0763, test_loss: 1.1063, test_f1: 0.4082
 epoch: 10, train_loss: 1.0569, test_loss: 1.0105, test_f1: 0.4646
 epoch: 11, train_loss: 1.0452, test_loss: 1.0303, test_f1: 0.4473
 epoch: 12, train_loss: 1.0316, test_loss: 1.0411, test_f1: 0.4356
 epoch: 13, train_loss: 1.0146, test_loss: 1.0485, test_f1: 0.4498
 epoch: 14, train_loss: 1.0037, test_loss: 1.0727, test_f1: 0.4729
 epoch: 15, train_loss: 1.0055, test_loss: 1.0361, test_f1: 0.4751
 epoch: 16, train_loss: 1.0007, test_loss: 0.9811, test_f1: 0.4549
 epoch: 17, train_loss: 1.1909, test_loss: 1.0586, test_f1: 0.4539
 epoch: 18, train_loss: 1.0740, test_loss: 0.9833, test_f1: 0.4314
 epoch: 19, train_loss: 1.0193, test_loss: 1.0218, test_f1: 0.4703
 epoch: 20, train_loss: 1.0028, test_loss: 1.1283, test_f1: 0.4321
 epoch: 21, train_loss: 0.9826, test_loss: 1.0950, test_f1: 0.4467
 epoch: 22, train_loss: 0.9991, test_loss: 1.0614, test_f1: 0.4430
 epoch: 23, train_loss: 0.9820, test_loss: 1.0740, test_f1: 0.4766
 epoch: 24, train_loss: 0.9751, test_loss: 1.0374, test_f1: 0.4557
 epoch: 25, train_loss: 0.9841, test_loss: 1.0871, test_f1: 0.4794
 epoch: 26, train_loss: 0.9804, test_loss: 1.1411, test_f1: 0.4528
 epoch: 27, train_loss: 0.9735, test_loss: 1.1949, test_f1: 0.4704
 epoch: 28, train_loss: 0.9633, test_loss: 0.9629, test_f1: 0.4822
 epoch: 29, train_loss: 0.9667, test_loss: 1.0315, test_f1: 0.4374
 epoch: 30, train_loss: 0.9696, test_loss: 0.9834, test_f1: 0.4795
 epoch: 31, train_loss: 0.9636, test_loss: 0.9717, test_f1: 0.4663
 epoch: 32, train_loss: 0.9669, test_loss: 0.9826, test_f1: 0.4594
 epoch: 33, train_loss: 0.9576, test_loss: 0.9813, test_f1: 0.4993
 epoch: 34, train_loss: 0.9485, test_loss: 1.0019, test_f1: 0.4745
 epoch: 35, train_loss: 0.9534, test_loss: 1.0231, test_f1: 0.4467
 epoch: 36, train_loss: 0.9512, test_loss: 1.0181, test_f1: 0.4734
 epoch: 37, train_loss: 0.9449, test_loss: 1.0672, test_f1: 0.4778
 epoch: 38, train_loss: 0.9637, test_loss: 0.9993, test_f1: 0.4601
 epoch: 39, train_loss: 0.9579, test_loss: 1.0127, test_f1: 0.4280
 epoch: 40, train_loss: 0.9443, test_loss: 1.0321, test_f1: 0.4572
 epoch: 41, train_loss: 0.9405, test_loss: 1.0951, test_f1: 0.4588
 epoch: 42, train_loss: 0.9707, test_loss: 1.0706, test_f1: 0.4888
 epoch: 43, train_loss: 0.9815, test_loss: 1.0134, test_f1: 0.4704
 epoch: 44, train_loss: 0.9541, test_loss: 0.9830, test_f1: 0.4860
 epoch: 45, train_loss: 0.9416, test_loss: 0.9791, test_f1: 0.4796
 epoch: 46, train_loss: 0.9399, test_loss: 0.9527, test_f1: 0.5233
 epoch: 47, train_loss: 0.9263, test_loss: 0.9970, test_f1: 0.4993
 epoch: 48, train_loss: 0.9431, test_loss: 1.0316, test_f1: 0.4912
 epoch: 49, train_loss: 0.9360, test_loss: 1.0036, test_f1: 0.4767
 epoch: 50, train_loss: 0.9515, test_loss: 1.0922, test_f1: 0.4451
 epoch: 51, train_loss: 0.9271, test_loss: 1.1132, test_f1: 0.4776
 epoch: 52, train_loss: 0.9296, test_loss: 1.0343, test_f1: 0.4683
 epoch: 53, train_loss: 0.9152, test_loss: 1.0080, test_f1: 0.4797
 epoch: 54, train_loss: 0.9147, test_loss: 1.0467, test_f1: 0.4963
 epoch: 55, train_loss: 0.9164, test_loss: 1.0230, test_f1: 0.5179
 epoch: 56, train_loss: 0.9068, test_loss: 0.9917, test_f1: 0.5178
 epoch: 57, train_loss: 0.9066, test_loss: 1.0825, test_f1: 0.5114
 epoch: 58, train_loss: 0.9231, test_loss: 1.0470, test_f1: 0.4898
 epoch: 59, train_loss: 0.9050, test_loss: 0.9690, test_f1: 0.5137
 epoch: 60, train_loss: 0.9096, test_loss: 1.0129, test_f1: 0.5126
 epoch: 61, train_loss: 0.9094, test_loss: 0.9727, test_f1: 0.4965
 epoch: 62, train_loss: 0.9053, test_loss: 0.9941, test_f1: 0.5295
 epoch: 63, train_loss: 0.9155, test_loss: 0.9909, test_f1: 0.5142
 epoch: 64, train_loss: 0.9001, test_loss: 1.0807, test_f1: 0.5149
 epoch: 65, train_loss: 0.9112, test_loss: 1.0520, test_f1: 0.5002
 epoch: 66, train_loss: 0.8994, test_loss: 1.1062, test_f1: 0.5175
 epoch: 67, train_loss: 0.9219, test_loss: 0.9979, test_f1: 0.5303
 epoch: 68, train_loss: 0.8961, test_loss: 1.0204, test_f1: 0.5436
 epoch: 69, train_loss: 0.9123, test_loss: 1.1004, test_f1: 0.5180
 epoch: 70, train_loss: 0.9043, test_loss: 1.0473, test_f1: 0.5360
 epoch: 71, train_loss: 0.8968, test_loss: 1.0098, test_f1: 0.5326
 epoch: 72, train_loss: 0.9046, test_loss: 1.0273, test_f1: 0.5439
 epoch: 73, train_loss: 0.9106, test_loss: 1.0193, test_f1: 0.5269
 epoch: 74, train_loss: 0.9223, test_loss: 1.0281, test_f1: 0.5097
 epoch: 75, train_loss: 0.9059, test_loss: 1.0385, test_f1: 0.5257
 epoch: 76, train_loss: 0.8968, test_loss: 1.0358, test_f1: 0.5407
 epoch: 77, train_loss: 0.8964, test_loss: 1.0913, test_f1: 0.5152
 epoch: 78, train_loss: 0.8911, test_loss: 1.0542, test_f1: 0.5179
 epoch: 79, train_loss: 0.8957, test_loss: 1.0873, test_f1: 0.5197
 epoch: 80, train_loss: 0.8958, test_loss: 1.1329, test_f1: 0.5021
 epoch: 81, train_loss: 0.8884, test_loss: 1.1712, test_f1: 0.5288
 epoch: 82, train_loss: 0.8833, test_loss: 1.1266, test_f1: 0.5179
 epoch: 83, train_loss: 0.8927, test_loss: 1.1229, test_f1: 0.5169
 epoch: 84, train_loss: 0.9057, test_loss: 1.0954, test_f1: 0.5441
 epoch: 85, train_loss: 0.9038, test_loss: 1.0623, test_f1: 0.5097
 epoch: 86, train_loss: 0.9171, test_loss: 0.9801, test_f1: 0.5373
 epoch: 87, train_loss: 0.9128, test_loss: 0.9997, test_f1: 0.5105
 epoch: 88, train_loss: 0.9139, test_loss: 1.0989, test_f1: 0.5102
 epoch: 89, train_loss: 0.9148, test_loss: 0.9872, test_f1: 0.5005
 epoch: 90, train_loss: 0.9046, test_loss: 1.0108, test_f1: 0.5302
 epoch: 91, train_loss: 0.9011, test_loss: 1.0247, test_f1: 0.5316
 epoch: 92, train_loss: 0.8951, test_loss: 1.0507, test_f1: 0.5538
 epoch: 93, train_loss: 0.8949, test_loss: 1.0813, test_f1: 0.5108
 epoch: 94, train_loss: 0.8814, test_loss: 1.0441, test_f1: 0.5016
 epoch: 95, train_loss: 0.8949, test_loss: 1.0404, test_f1: 0.5322
 epoch: 96, train_loss: 0.8815, test_loss: 1.0634, test_f1: 0.5224
 epoch: 97, train_loss: 0.8882, test_loss: 1.0339, test_f1: 0.5263
 epoch: 98, train_loss: 0.8836, test_loss: 1.0787, test_f1: 0.5497
 epoch: 99, train_loss: 0.8945, test_loss: 0.9997, test_f1: 0.5341
##################ITERATION #5 ****************************************
 epoch: 0, train_loss: 1.2661, test_loss: 1.1966, test_f1: 0.2655
 epoch: 1, train_loss: 1.1811, test_loss: 1.1058, test_f1: 0.4125
 epoch: 2, train_loss: 1.1199, test_loss: 1.0131, test_f1: 0.4446
 epoch: 3, train_loss: 1.0742, test_loss: 1.0265, test_f1: 0.4686
 epoch: 4, train_loss: 1.0379, test_loss: 1.0273, test_f1: 0.4468
 epoch: 5, train_loss: 1.0130, test_loss: 1.0415, test_f1: 0.4897
 epoch: 6, train_loss: 1.0117, test_loss: 1.0235, test_f1: 0.4688
 epoch: 7, train_loss: 0.9953, test_loss: 1.0197, test_f1: 0.4688
 epoch: 8, train_loss: 0.9854, test_loss: 0.9545, test_f1: 0.4787
 epoch: 9, train_loss: 0.9896, test_loss: 1.0029, test_f1: 0.4840
 epoch: 10, train_loss: 0.9715, test_loss: 0.9700, test_f1: 0.5012
 epoch: 11, train_loss: 0.9805, test_loss: 1.0101, test_f1: 0.4572
 epoch: 12, train_loss: 0.9700, test_loss: 0.9732, test_f1: 0.4887
 epoch: 13, train_loss: 0.9648, test_loss: 0.9946, test_f1: 0.4539
 epoch: 14, train_loss: 0.9769, test_loss: 1.0776, test_f1: 0.4619
 epoch: 15, train_loss: 0.9746, test_loss: 1.0539, test_f1: 0.4469
 epoch: 16, train_loss: 0.9611, test_loss: 1.0076, test_f1: 0.4880
 epoch: 17, train_loss: 0.9540, test_loss: 1.0064, test_f1: 0.4646
 epoch: 18, train_loss: 0.9474, test_loss: 0.9829, test_f1: 0.4607
 epoch: 19, train_loss: 0.9570, test_loss: 1.0114, test_f1: 0.4614
 epoch: 20, train_loss: 0.9570, test_loss: 1.0490, test_f1: 0.4739
 epoch: 21, train_loss: 0.9416, test_loss: 0.9803, test_f1: 0.4816
 epoch: 22, train_loss: 0.9455, test_loss: 1.0060, test_f1: 0.5063
 epoch: 23, train_loss: 0.9413, test_loss: 1.0355, test_f1: 0.5075
 epoch: 24, train_loss: 0.9355, test_loss: 1.0578, test_f1: 0.4531
 epoch: 25, train_loss: 0.9273, test_loss: 1.0149, test_f1: 0.4867
 epoch: 26, train_loss: 0.9311, test_loss: 0.9953, test_f1: 0.5051
 epoch: 27, train_loss: 0.9614, test_loss: 1.0152, test_f1: 0.4966
 epoch: 28, train_loss: 0.9359, test_loss: 1.0352, test_f1: 0.4756
 epoch: 29, train_loss: 0.9396, test_loss: 1.1526, test_f1: 0.4805
 epoch: 30, train_loss: 0.9587, test_loss: 1.0421, test_f1: 0.4728
 epoch: 31, train_loss: 0.9305, test_loss: 0.9909, test_f1: 0.4980
 epoch: 32, train_loss: 0.9281, test_loss: 0.9910, test_f1: 0.4662
 epoch: 33, train_loss: 0.9239, test_loss: 1.1037, test_f1: 0.4685
 epoch: 34, train_loss: 0.9323, test_loss: 1.0322, test_f1: 0.5151
 epoch: 35, train_loss: 0.9241, test_loss: 1.0666, test_f1: 0.4568
 epoch: 36, train_loss: 0.9406, test_loss: 1.0294, test_f1: 0.4712
 epoch: 37, train_loss: 0.9445, test_loss: 0.9611, test_f1: 0.5251
 epoch: 38, train_loss: 0.9210, test_loss: 1.0663, test_f1: 0.4581
 epoch: 39, train_loss: 0.9118, test_loss: 0.9467, test_f1: 0.4885
 epoch: 40, train_loss: 0.9325, test_loss: 0.9396, test_f1: 0.5062
 epoch: 41, train_loss: 0.9159, test_loss: 0.9543, test_f1: 0.5254
 epoch: 42, train_loss: 0.9004, test_loss: 0.9595, test_f1: 0.5012
 epoch: 43, train_loss: 0.9263, test_loss: 1.0306, test_f1: 0.4521
 epoch: 44, train_loss: 0.9159, test_loss: 0.9992, test_f1: 0.4733
 epoch: 45, train_loss: 0.9068, test_loss: 1.0388, test_f1: 0.4722
 epoch: 46, train_loss: 0.9084, test_loss: 0.9679, test_f1: 0.5072
 epoch: 47, train_loss: 0.9133, test_loss: 0.9535, test_f1: 0.5291
 epoch: 48, train_loss: 0.9237, test_loss: 0.9562, test_f1: 0.5137
 epoch: 49, train_loss: 0.8981, test_loss: 0.9872, test_f1: 0.4829
 epoch: 50, train_loss: 0.9101, test_loss: 0.9731, test_f1: 0.4942
 epoch: 51, train_loss: 0.9016, test_loss: 1.0544, test_f1: 0.4929
 epoch: 52, train_loss: 0.8802, test_loss: 1.1171, test_f1: 0.5048
 epoch: 53, train_loss: 0.8725, test_loss: 1.1258, test_f1: 0.4905
 epoch: 54, train_loss: 0.8787, test_loss: 1.1235, test_f1: 0.5027
 epoch: 55, train_loss: 0.8726, test_loss: 1.0606, test_f1: 0.4980
 epoch: 56, train_loss: 0.8705, test_loss: 1.0935, test_f1: 0.5019
 epoch: 57, train_loss: 0.8686, test_loss: 1.0107, test_f1: 0.5150
 epoch: 58, train_loss: 0.8723, test_loss: 0.9835, test_f1: 0.5148
 epoch: 59, train_loss: 0.8590, test_loss: 1.0977, test_f1: 0.5000
 epoch: 60, train_loss: 0.8508, test_loss: 1.0937, test_f1: 0.5030
 epoch: 61, train_loss: 0.8593, test_loss: 1.1820, test_f1: 0.5078
 epoch: 62, train_loss: 0.8682, test_loss: 1.0569, test_f1: 0.5074
 epoch: 63, train_loss: 0.8575, test_loss: 1.1042, test_f1: 0.4840
 epoch: 64, train_loss: 0.8691, test_loss: 1.0371, test_f1: 0.4924
 epoch: 65, train_loss: 0.8565, test_loss: 1.0764, test_f1: 0.5024
 epoch: 66, train_loss: 0.8569, test_loss: 1.1389, test_f1: 0.4828
 epoch: 67, train_loss: 0.8693, test_loss: 0.9817, test_f1: 0.5134
 epoch: 68, train_loss: 0.8468, test_loss: 1.2242, test_f1: 0.4893
 epoch: 69, train_loss: 0.8492, test_loss: 1.2271, test_f1: 0.4999
 epoch: 70, train_loss: 0.8568, test_loss: 1.2475, test_f1: 0.4932
 epoch: 71, train_loss: 0.8672, test_loss: 1.1968, test_f1: 0.5080
 epoch: 72, train_loss: 0.8508, test_loss: 1.2308, test_f1: 0.5123
 epoch: 73, train_loss: 0.8471, test_loss: 1.1673, test_f1: 0.5004
 epoch: 74, train_loss: 0.8453, test_loss: 1.0032, test_f1: 0.5444
 epoch: 75, train_loss: 0.8414, test_loss: 1.1647, test_f1: 0.4942
 epoch: 76, train_loss: 0.8567, test_loss: 1.1855, test_f1: 0.5058
 epoch: 77, train_loss: 0.8341, test_loss: 1.0902, test_f1: 0.5090
 epoch: 78, train_loss: 0.8354, test_loss: 1.0449, test_f1: 0.5277
 epoch: 79, train_loss: 0.8384, test_loss: 1.0120, test_f1: 0.5141
 epoch: 80, train_loss: 0.8346, test_loss: 1.0500, test_f1: 0.4973
 epoch: 81, train_loss: 0.8360, test_loss: 1.1043, test_f1: 0.5065
 epoch: 82, train_loss: 0.8412, test_loss: 1.1646, test_f1: 0.5159
 epoch: 83, train_loss: 0.8410, test_loss: 1.0672, test_f1: 0.4971
 epoch: 84, train_loss: 0.8502, test_loss: 1.1157, test_f1: 0.5116
 epoch: 85, train_loss: 0.8466, test_loss: 1.1482, test_f1: 0.5240
 epoch: 86, train_loss: 0.8460, test_loss: 0.9682, test_f1: 0.5250
 epoch: 87, train_loss: 0.8375, test_loss: 1.0735, test_f1: 0.5169
 epoch: 88, train_loss: 0.8325, test_loss: 1.0436, test_f1: 0.5147
 epoch: 89, train_loss: 0.8408, test_loss: 1.0102, test_f1: 0.5371
 epoch: 90, train_loss: 0.8343, test_loss: 1.0822, test_f1: 0.5051
 epoch: 91, train_loss: 0.8230, test_loss: 1.2423, test_f1: 0.5021
 epoch: 92, train_loss: 0.8246, test_loss: 1.1350, test_f1: 0.4998
 epoch: 93, train_loss: 0.8269, test_loss: 1.0515, test_f1: 0.5147
 epoch: 94, train_loss: 0.8359, test_loss: 0.9301, test_f1: 0.5444
 epoch: 95, train_loss: 0.8349, test_loss: 0.9682, test_f1: 0.5279
 epoch: 96, train_loss: 0.8297, test_loss: 1.0176, test_f1: 0.5295
 epoch: 97, train_loss: 0.8252, test_loss: 1.0742, test_f1: 0.5052
 epoch: 98, train_loss: 0.8272, test_loss: 1.0846, test_f1: 0.5039
 epoch: 99, train_loss: 0.8212, test_loss: 0.9384, test_f1: 0.5278
##################ITERATION #6 ****************************************
 epoch: 0, train_loss: 1.2871, test_loss: 1.2379, test_f1: 0.3326
 epoch: 1, train_loss: 1.2158, test_loss: 1.1208, test_f1: 0.3453
 epoch: 2, train_loss: 1.1612, test_loss: 1.1250, test_f1: 0.3747
 epoch: 3, train_loss: 1.1157, test_loss: 1.0527, test_f1: 0.3661
 epoch: 4, train_loss: 1.1065, test_loss: 1.1142, test_f1: 0.3636
 epoch: 5, train_loss: 1.0964, test_loss: 1.1081, test_f1: 0.4473
 epoch: 6, train_loss: 1.0726, test_loss: 1.0137, test_f1: 0.4269
 epoch: 7, train_loss: 1.0542, test_loss: 1.0638, test_f1: 0.4124
 epoch: 8, train_loss: 1.0320, test_loss: 1.0849, test_f1: 0.4156
 epoch: 9, train_loss: 1.0294, test_loss: 1.0634, test_f1: 0.4598
 epoch: 10, train_loss: 1.0102, test_loss: 1.0435, test_f1: 0.4625
 epoch: 11, train_loss: 0.9889, test_loss: 1.0208, test_f1: 0.4791
 epoch: 12, train_loss: 0.9953, test_loss: 1.0095, test_f1: 0.4728
 epoch: 13, train_loss: 0.9918, test_loss: 1.0384, test_f1: 0.4443
 epoch: 14, train_loss: 0.9847, test_loss: 1.0282, test_f1: 0.4506
 epoch: 15, train_loss: 0.9811, test_loss: 0.9892, test_f1: 0.4668
 epoch: 16, train_loss: 0.9687, test_loss: 0.9976, test_f1: 0.4545
 epoch: 17, train_loss: 0.9749, test_loss: 1.0158, test_f1: 0.4631
 epoch: 18, train_loss: 0.9625, test_loss: 1.0914, test_f1: 0.4783
 epoch: 19, train_loss: 0.9622, test_loss: 1.0560, test_f1: 0.4802
 epoch: 20, train_loss: 0.9668, test_loss: 1.0587, test_f1: 0.4772
 epoch: 21, train_loss: 0.9736, test_loss: 1.0124, test_f1: 0.4897
 epoch: 22, train_loss: 0.9778, test_loss: 0.9878, test_f1: 0.4713
 epoch: 23, train_loss: 0.9605, test_loss: 0.9910, test_f1: 0.4897
 epoch: 24, train_loss: 0.9537, test_loss: 0.9881, test_f1: 0.4548
 epoch: 25, train_loss: 0.9531, test_loss: 0.9933, test_f1: 0.4712
 epoch: 26, train_loss: 0.9434, test_loss: 1.0701, test_f1: 0.4690
 epoch: 27, train_loss: 0.9564, test_loss: 0.9624, test_f1: 0.4797
 epoch: 28, train_loss: 0.9429, test_loss: 1.0102, test_f1: 0.4731
 epoch: 29, train_loss: 0.9540, test_loss: 1.0422, test_f1: 0.4748
 epoch: 30, train_loss: 0.9440, test_loss: 0.9646, test_f1: 0.4865
 epoch: 31, train_loss: 0.9516, test_loss: 0.9885, test_f1: 0.4784
 epoch: 32, train_loss: 0.9467, test_loss: 1.0160, test_f1: 0.4514
 epoch: 33, train_loss: 0.9353, test_loss: 0.9877, test_f1: 0.4610
 epoch: 34, train_loss: 0.9500, test_loss: 1.1006, test_f1: 0.4450
 epoch: 35, train_loss: 0.9574, test_loss: 0.9926, test_f1: 0.4554
 epoch: 36, train_loss: 0.9313, test_loss: 1.1554, test_f1: 0.4608
 epoch: 37, train_loss: 0.9374, test_loss: 0.9509, test_f1: 0.4666
 epoch: 38, train_loss: 0.9226, test_loss: 1.0678, test_f1: 0.5281
 epoch: 39, train_loss: 0.9307, test_loss: 1.0208, test_f1: 0.4752
 epoch: 40, train_loss: 0.9483, test_loss: 1.2110, test_f1: 0.4461
 epoch: 41, train_loss: 0.9328, test_loss: 0.9919, test_f1: 0.4656
 epoch: 42, train_loss: 0.9556, test_loss: 0.9889, test_f1: 0.4811
 epoch: 43, train_loss: 0.9457, test_loss: 1.0004, test_f1: 0.4913
 epoch: 44, train_loss: 0.9484, test_loss: 0.9890, test_f1: 0.4549
 epoch: 45, train_loss: 0.9466, test_loss: 1.0133, test_f1: 0.4558
 epoch: 46, train_loss: 0.9455, test_loss: 0.9519, test_f1: 0.4773
 epoch: 47, train_loss: 0.9164, test_loss: 0.9908, test_f1: 0.4615
 epoch: 48, train_loss: 0.9232, test_loss: 1.0773, test_f1: 0.4500
 epoch: 49, train_loss: 0.9166, test_loss: 1.0685, test_f1: 0.4644
 epoch: 50, train_loss: 0.9084, test_loss: 1.0106, test_f1: 0.4926
 epoch: 51, train_loss: 0.8896, test_loss: 1.1256, test_f1: 0.4433
 epoch: 52, train_loss: 0.8978, test_loss: 0.9599, test_f1: 0.4954
 epoch: 53, train_loss: 0.8936, test_loss: 0.9431, test_f1: 0.5012
 epoch: 54, train_loss: 0.9046, test_loss: 1.0937, test_f1: 0.4639
 epoch: 55, train_loss: 0.8883, test_loss: 1.0092, test_f1: 0.4830
 epoch: 56, train_loss: 0.8874, test_loss: 0.9389, test_f1: 0.4803
 epoch: 57, train_loss: 0.8920, test_loss: 0.9426, test_f1: 0.4969
 epoch: 58, train_loss: 0.8852, test_loss: 1.0156, test_f1: 0.4792
 epoch: 59, train_loss: 0.8848, test_loss: 0.9734, test_f1: 0.4817
 epoch: 60, train_loss: 0.8949, test_loss: 0.9679, test_f1: 0.4788
 epoch: 61, train_loss: 0.8830, test_loss: 1.0399, test_f1: 0.4806
 epoch: 62, train_loss: 0.8770, test_loss: 1.0038, test_f1: 0.4701
 epoch: 63, train_loss: 0.8786, test_loss: 1.1546, test_f1: 0.4604
 epoch: 64, train_loss: 0.8829, test_loss: 0.9949, test_f1: 0.4979
 epoch: 65, train_loss: 0.8870, test_loss: 0.9518, test_f1: 0.4966
 epoch: 66, train_loss: 0.8771, test_loss: 0.9868, test_f1: 0.4915
 epoch: 67, train_loss: 0.8822, test_loss: 0.9652, test_f1: 0.4885
 epoch: 68, train_loss: 0.9025, test_loss: 1.0443, test_f1: 0.4732
 epoch: 69, train_loss: 0.8781, test_loss: 1.0050, test_f1: 0.4920
 epoch: 70, train_loss: 0.8863, test_loss: 0.9714, test_f1: 0.4712
 epoch: 71, train_loss: 0.8740, test_loss: 0.9956, test_f1: 0.4938
 epoch: 72, train_loss: 0.8865, test_loss: 1.0036, test_f1: 0.5033
 epoch: 73, train_loss: 0.8837, test_loss: 0.9715, test_f1: 0.4936
 epoch: 74, train_loss: 0.8689, test_loss: 1.0864, test_f1: 0.4690
 epoch: 75, train_loss: 0.8700, test_loss: 1.0368, test_f1: 0.4959
 epoch: 76, train_loss: 0.8706, test_loss: 1.0395, test_f1: 0.4965
 epoch: 77, train_loss: 0.8884, test_loss: 0.9769, test_f1: 0.4981
 epoch: 78, train_loss: 0.8702, test_loss: 1.0747, test_f1: 0.4960
 epoch: 79, train_loss: 0.8663, test_loss: 0.9997, test_f1: 0.4943
 epoch: 80, train_loss: 0.8591, test_loss: 1.0283, test_f1: 0.5239
 epoch: 81, train_loss: 0.8704, test_loss: 0.9741, test_f1: 0.5024
 epoch: 82, train_loss: 0.8973, test_loss: 0.9591, test_f1: 0.4849
 epoch: 83, train_loss: 0.8748, test_loss: 0.9538, test_f1: 0.4964
 epoch: 84, train_loss: 0.8622, test_loss: 0.9518, test_f1: 0.4897
 epoch: 85, train_loss: 0.8619, test_loss: 1.0035, test_f1: 0.5196
 epoch: 86, train_loss: 0.8772, test_loss: 1.0151, test_f1: 0.5046
 epoch: 87, train_loss: 0.8647, test_loss: 0.9927, test_f1: 0.5187
 epoch: 88, train_loss: 0.9171, test_loss: 1.0223, test_f1: 0.4921
 epoch: 89, train_loss: 0.8950, test_loss: 1.0080, test_f1: 0.4886
 epoch: 90, train_loss: 0.8743, test_loss: 1.0912, test_f1: 0.4812
 epoch: 91, train_loss: 0.8691, test_loss: 1.0351, test_f1: 0.4754
 epoch: 92, train_loss: 0.8647, test_loss: 1.1911, test_f1: 0.4808
 epoch: 93, train_loss: 0.8554, test_loss: 1.0491, test_f1: 0.4936
 epoch: 94, train_loss: 0.8591, test_loss: 1.0516, test_f1: 0.4800
 epoch: 95, train_loss: 0.8539, test_loss: 1.0516, test_f1: 0.5037
 epoch: 96, train_loss: 0.8687, test_loss: 1.1345, test_f1: 0.4681
 epoch: 97, train_loss: 0.8511, test_loss: 1.0601, test_f1: 0.4786
 epoch: 98, train_loss: 0.8641, test_loss: 1.0257, test_f1: 0.4869
 epoch: 99, train_loss: 0.8451, test_loss: 1.0274, test_f1: 0.4777
##################ITERATION #7 ****************************************
 epoch: 0, train_loss: 1.2841, test_loss: 1.2551, test_f1: 0.3030
 epoch: 1, train_loss: 1.2303, test_loss: 1.1710, test_f1: 0.2998
 epoch: 2, train_loss: 1.1902, test_loss: 1.1346, test_f1: 0.3284
 epoch: 3, train_loss: 1.1617, test_loss: 1.0929, test_f1: 0.3719
 epoch: 4, train_loss: 1.1441, test_loss: 1.0566, test_f1: 0.4003
 epoch: 5, train_loss: 1.1205, test_loss: 1.0730, test_f1: 0.4246
 epoch: 6, train_loss: 1.1043, test_loss: 1.0437, test_f1: 0.4598
 epoch: 7, train_loss: 1.0853, test_loss: 1.0345, test_f1: 0.4533
 epoch: 8, train_loss: 1.0728, test_loss: 1.0733, test_f1: 0.4463
 epoch: 9, train_loss: 1.0565, test_loss: 1.0975, test_f1: 0.4668
 epoch: 10, train_loss: 1.0381, test_loss: 1.0354, test_f1: 0.4530
 epoch: 11, train_loss: 1.0313, test_loss: 1.0118, test_f1: 0.4723
 epoch: 12, train_loss: 1.0205, test_loss: 1.1533, test_f1: 0.4513
 epoch: 13, train_loss: 1.0291, test_loss: 1.0144, test_f1: 0.4485
 epoch: 14, train_loss: 1.0218, test_loss: 0.9940, test_f1: 0.4848
 epoch: 15, train_loss: 1.0273, test_loss: 1.0105, test_f1: 0.4567
 epoch: 16, train_loss: 0.9959, test_loss: 1.0017, test_f1: 0.4717
 epoch: 17, train_loss: 0.9995, test_loss: 0.9759, test_f1: 0.4867
 epoch: 18, train_loss: 0.9812, test_loss: 0.9877, test_f1: 0.4664
 epoch: 19, train_loss: 0.9723, test_loss: 0.9787, test_f1: 0.4816
 epoch: 20, train_loss: 0.9670, test_loss: 1.0126, test_f1: 0.4427
 epoch: 21, train_loss: 0.9640, test_loss: 0.9865, test_f1: 0.4751
 epoch: 22, train_loss: 0.9573, test_loss: 1.0283, test_f1: 0.4543
 epoch: 23, train_loss: 0.9655, test_loss: 1.0689, test_f1: 0.4359
 epoch: 24, train_loss: 0.9666, test_loss: 1.0235, test_f1: 0.4701
 epoch: 25, train_loss: 0.9504, test_loss: 1.0485, test_f1: 0.4391
 epoch: 26, train_loss: 0.9639, test_loss: 1.0848, test_f1: 0.4570
 epoch: 27, train_loss: 0.9664, test_loss: 1.0382, test_f1: 0.4524
 epoch: 28, train_loss: 0.9495, test_loss: 1.0177, test_f1: 0.4889
 epoch: 29, train_loss: 0.9381, test_loss: 0.9610, test_f1: 0.4503
 epoch: 30, train_loss: 0.9442, test_loss: 1.0224, test_f1: 0.4333
 epoch: 31, train_loss: 0.9595, test_loss: 0.9802, test_f1: 0.4724
 epoch: 32, train_loss: 0.9295, test_loss: 0.9933, test_f1: 0.4552
 epoch: 33, train_loss: 0.9464, test_loss: 0.9651, test_f1: 0.4981
 epoch: 34, train_loss: 0.9417, test_loss: 0.9706, test_f1: 0.4789
 epoch: 35, train_loss: 0.9361, test_loss: 0.9854, test_f1: 0.4662
 epoch: 36, train_loss: 0.9292, test_loss: 0.9940, test_f1: 0.4790
 epoch: 37, train_loss: 0.9246, test_loss: 0.9608, test_f1: 0.4662
 epoch: 38, train_loss: 0.9244, test_loss: 0.9534, test_f1: 0.5015
 epoch: 39, train_loss: 0.9247, test_loss: 1.0043, test_f1: 0.4918
 epoch: 40, train_loss: 0.9283, test_loss: 0.9718, test_f1: 0.5103
 epoch: 41, train_loss: 0.9224, test_loss: 0.9819, test_f1: 0.5044
 epoch: 42, train_loss: 0.9304, test_loss: 1.0183, test_f1: 0.4786
 epoch: 43, train_loss: 0.9318, test_loss: 1.0464, test_f1: 0.4798
 epoch: 44, train_loss: 0.9336, test_loss: 0.9946, test_f1: 0.4943
 epoch: 45, train_loss: 0.9164, test_loss: 1.0004, test_f1: 0.5066
 epoch: 46, train_loss: 0.9231, test_loss: 1.0217, test_f1: 0.4836
 epoch: 47, train_loss: 0.9237, test_loss: 0.9906, test_f1: 0.4921
 epoch: 48, train_loss: 0.9367, test_loss: 1.1027, test_f1: 0.4439
 epoch: 49, train_loss: 0.9349, test_loss: 0.9637, test_f1: 0.4973
 epoch: 50, train_loss: 0.9466, test_loss: 1.0081, test_f1: 0.4744
 epoch: 51, train_loss: 0.9072, test_loss: 0.9830, test_f1: 0.5044
 epoch: 52, train_loss: 0.8924, test_loss: 0.9850, test_f1: 0.5113
 epoch: 53, train_loss: 0.8954, test_loss: 0.9711, test_f1: 0.5251
 epoch: 54, train_loss: 0.8841, test_loss: 0.9969, test_f1: 0.4957
 epoch: 55, train_loss: 0.9071, test_loss: 0.9663, test_f1: 0.4901
 epoch: 56, train_loss: 0.8878, test_loss: 0.9875, test_f1: 0.4928
 epoch: 57, train_loss: 0.8934, test_loss: 0.9843, test_f1: 0.5037
 epoch: 58, train_loss: 0.8850, test_loss: 0.9732, test_f1: 0.5280
 epoch: 59, train_loss: 0.8901, test_loss: 1.0897, test_f1: 0.4606
 epoch: 60, train_loss: 0.8799, test_loss: 0.9749, test_f1: 0.5122
 epoch: 61, train_loss: 0.8807, test_loss: 0.9951, test_f1: 0.4968
 epoch: 62, train_loss: 0.8706, test_loss: 1.0392, test_f1: 0.4800
 epoch: 63, train_loss: 0.8841, test_loss: 1.0261, test_f1: 0.4925
 epoch: 64, train_loss: 0.8770, test_loss: 0.9731, test_f1: 0.4985
 epoch: 65, train_loss: 0.8760, test_loss: 0.9770, test_f1: 0.4988
 epoch: 66, train_loss: 0.8699, test_loss: 0.9616, test_f1: 0.5067
 epoch: 67, train_loss: 0.8861, test_loss: 0.9568, test_f1: 0.5180
 epoch: 68, train_loss: 0.8717, test_loss: 0.9894, test_f1: 0.5081
 epoch: 69, train_loss: 0.8706, test_loss: 0.9781, test_f1: 0.4987
 epoch: 70, train_loss: 0.8754, test_loss: 0.9992, test_f1: 0.4795
 epoch: 71, train_loss: 0.8759, test_loss: 1.0013, test_f1: 0.5173
 epoch: 72, train_loss: 0.8738, test_loss: 1.2897, test_f1: 0.5284
 epoch: 73, train_loss: 0.8705, test_loss: 1.1116, test_f1: 0.4476
 epoch: 74, train_loss: 0.8748, test_loss: 1.0118, test_f1: 0.5160
 epoch: 75, train_loss: 0.8726, test_loss: 1.0297, test_f1: 0.4771
 epoch: 76, train_loss: 0.8702, test_loss: 0.9990, test_f1: 0.4844
 epoch: 77, train_loss: 0.8648, test_loss: 1.1833, test_f1: 0.4761
 epoch: 78, train_loss: 0.8724, test_loss: 1.0750, test_f1: 0.4800
 epoch: 79, train_loss: 0.8592, test_loss: 0.9716, test_f1: 0.5099
 epoch: 80, train_loss: 0.8572, test_loss: 1.0676, test_f1: 0.4892
 epoch: 81, train_loss: 0.8713, test_loss: 0.9626, test_f1: 0.5172
 epoch: 82, train_loss: 0.8550, test_loss: 1.0138, test_f1: 0.5056
 epoch: 83, train_loss: 0.8567, test_loss: 0.9891, test_f1: 0.5038
 epoch: 84, train_loss: 0.8500, test_loss: 0.9585, test_f1: 0.5097
 epoch: 85, train_loss: 0.8607, test_loss: 0.9776, test_f1: 0.5043
 epoch: 86, train_loss: 0.8568, test_loss: 0.9709, test_f1: 0.4891
 epoch: 87, train_loss: 0.8580, test_loss: 1.1230, test_f1: 0.4868
 epoch: 88, train_loss: 0.8444, test_loss: 0.9932, test_f1: 0.4853
 epoch: 89, train_loss: 0.8471, test_loss: 1.0103, test_f1: 0.5006
 epoch: 90, train_loss: 0.8597, test_loss: 0.9791, test_f1: 0.5039
 epoch: 91, train_loss: 0.8382, test_loss: 1.0316, test_f1: 0.5012
 epoch: 92, train_loss: 0.8625, test_loss: 1.0848, test_f1: 0.4926
 epoch: 93, train_loss: 0.8481, test_loss: 1.0877, test_f1: 0.4850
 epoch: 94, train_loss: 0.8557, test_loss: 0.9806, test_f1: 0.5236
 epoch: 95, train_loss: 0.8446, test_loss: 0.9999, test_f1: 0.5328
 epoch: 96, train_loss: 0.8503, test_loss: 1.0081, test_f1: 0.4987
 epoch: 97, train_loss: 0.8532, test_loss: 1.0305, test_f1: 0.4815
 epoch: 98, train_loss: 0.8441, test_loss: 0.9849, test_f1: 0.4926
 epoch: 99, train_loss: 0.8455, test_loss: 0.9555, test_f1: 0.5156
##################ITERATION #8 ****************************************
 epoch: 0, train_loss: 1.2864, test_loss: 1.2448, test_f1: 0.3209
 epoch: 1, train_loss: 1.2408, test_loss: 1.1847, test_f1: 0.3215
 epoch: 2, train_loss: 1.1849, test_loss: 1.1546, test_f1: 0.4040
 epoch: 3, train_loss: 1.1514, test_loss: 1.0564, test_f1: 0.3811
 epoch: 4, train_loss: 1.1263, test_loss: 1.0625, test_f1: 0.4915
 epoch: 5, train_loss: 1.0961, test_loss: 1.0332, test_f1: 0.4898
 epoch: 6, train_loss: 1.0840, test_loss: 0.9983, test_f1: 0.4809
 epoch: 7, train_loss: 1.0788, test_loss: 1.0098, test_f1: 0.4554
 epoch: 8, train_loss: 1.0654, test_loss: 0.9723, test_f1: 0.4605
 epoch: 9, train_loss: 1.0394, test_loss: 1.0021, test_f1: 0.4727
 epoch: 10, train_loss: 1.0239, test_loss: 1.0054, test_f1: 0.4721
 epoch: 11, train_loss: 1.0145, test_loss: 1.0408, test_f1: 0.4702
 epoch: 12, train_loss: 0.9980, test_loss: 1.0197, test_f1: 0.4976
 epoch: 13, train_loss: 0.9940, test_loss: 0.9496, test_f1: 0.4663
 epoch: 14, train_loss: 1.0255, test_loss: 0.9840, test_f1: 0.4636
 epoch: 15, train_loss: 0.9994, test_loss: 0.9771, test_f1: 0.4580
 epoch: 16, train_loss: 0.9970, test_loss: 0.9220, test_f1: 0.4651
 epoch: 17, train_loss: 0.9813, test_loss: 0.9731, test_f1: 0.4642
 epoch: 18, train_loss: 0.9654, test_loss: 0.9918, test_f1: 0.4681
 epoch: 19, train_loss: 0.9676, test_loss: 0.9346, test_f1: 0.4574
 epoch: 20, train_loss: 0.9739, test_loss: 0.9537, test_f1: 0.4759
 epoch: 21, train_loss: 0.9794, test_loss: 0.9400, test_f1: 0.4637
 epoch: 22, train_loss: 0.9601, test_loss: 0.9826, test_f1: 0.4669
 epoch: 23, train_loss: 0.9630, test_loss: 0.9770, test_f1: 0.4705
 epoch: 24, train_loss: 0.9716, test_loss: 1.0128, test_f1: 0.4684
 epoch: 25, train_loss: 0.9469, test_loss: 0.9596, test_f1: 0.4702
 epoch: 26, train_loss: 0.9622, test_loss: 0.9514, test_f1: 0.4644
 epoch: 27, train_loss: 0.9683, test_loss: 0.9561, test_f1: 0.4534
 epoch: 28, train_loss: 0.9395, test_loss: 1.0351, test_f1: 0.4624
 epoch: 29, train_loss: 0.9429, test_loss: 1.0057, test_f1: 0.4557
 epoch: 30, train_loss: 0.9332, test_loss: 0.9736, test_f1: 0.4671
 epoch: 31, train_loss: 0.9533, test_loss: 0.9744, test_f1: 0.5111
 epoch: 32, train_loss: 0.9339, test_loss: 0.9934, test_f1: 0.4976
 epoch: 33, train_loss: 0.9449, test_loss: 0.9812, test_f1: 0.4938
 epoch: 34, train_loss: 0.9451, test_loss: 0.9188, test_f1: 0.5037
 epoch: 35, train_loss: 0.9411, test_loss: 0.9446, test_f1: 0.4692
 epoch: 36, train_loss: 0.9516, test_loss: 0.9429, test_f1: 0.4827
 epoch: 37, train_loss: 0.9424, test_loss: 0.9522, test_f1: 0.4742
 epoch: 38, train_loss: 0.9404, test_loss: 0.9725, test_f1: 0.4624
 epoch: 39, train_loss: 0.9258, test_loss: 1.0014, test_f1: 0.4778
 epoch: 40, train_loss: 0.9274, test_loss: 1.0818, test_f1: 0.4604
 epoch: 41, train_loss: 0.9317, test_loss: 0.9238, test_f1: 0.4760
 epoch: 42, train_loss: 0.9319, test_loss: 1.1813, test_f1: 0.4056
 epoch: 43, train_loss: 0.9589, test_loss: 1.1194, test_f1: 0.4709
 epoch: 44, train_loss: 0.9397, test_loss: 0.9967, test_f1: 0.4688
 epoch: 45, train_loss: 0.9175, test_loss: 1.0879, test_f1: 0.4613
 epoch: 46, train_loss: 0.9060, test_loss: 0.9893, test_f1: 0.5230
 epoch: 47, train_loss: 0.9276, test_loss: 0.9754, test_f1: 0.5155
 epoch: 48, train_loss: 0.9078, test_loss: 0.9393, test_f1: 0.4993
 epoch: 49, train_loss: 0.9330, test_loss: 0.9720, test_f1: 0.4782
 epoch: 50, train_loss: 0.9261, test_loss: 0.9813, test_f1: 0.4917
 epoch: 51, train_loss: 0.9083, test_loss: 1.0153, test_f1: 0.4706
 epoch: 52, train_loss: 0.8914, test_loss: 0.9806, test_f1: 0.4954
 epoch: 53, train_loss: 0.9037, test_loss: 0.9742, test_f1: 0.4704
 epoch: 54, train_loss: 0.8778, test_loss: 1.0012, test_f1: 0.4686
 epoch: 55, train_loss: 0.8796, test_loss: 0.9600, test_f1: 0.4835
 epoch: 56, train_loss: 0.9000, test_loss: 1.0523, test_f1: 0.4599
 epoch: 57, train_loss: 0.8852, test_loss: 0.9580, test_f1: 0.4910
 epoch: 58, train_loss: 0.8766, test_loss: 1.0481, test_f1: 0.4636
 epoch: 59, train_loss: 0.8823, test_loss: 0.9710, test_f1: 0.4955
 epoch: 60, train_loss: 0.8814, test_loss: 1.0445, test_f1: 0.4620
 epoch: 61, train_loss: 0.8895, test_loss: 0.9298, test_f1: 0.5024
 epoch: 62, train_loss: 0.8840, test_loss: 1.0137, test_f1: 0.4678
 epoch: 63, train_loss: 0.8795, test_loss: 1.0046, test_f1: 0.4874
 epoch: 64, train_loss: 0.8707, test_loss: 1.0909, test_f1: 0.4870
 epoch: 65, train_loss: 0.8753, test_loss: 0.9281, test_f1: 0.4934
 epoch: 66, train_loss: 0.9163, test_loss: 0.9288, test_f1: 0.5017
 epoch: 67, train_loss: 0.8878, test_loss: 0.9497, test_f1: 0.5099
 epoch: 68, train_loss: 0.8953, test_loss: 0.9600, test_f1: 0.4984
 epoch: 69, train_loss: 0.8863, test_loss: 0.9545, test_f1: 0.5071
 epoch: 70, train_loss: 0.8872, test_loss: 0.9599, test_f1: 0.4838
 epoch: 71, train_loss: 0.8840, test_loss: 0.9685, test_f1: 0.4991
 epoch: 72, train_loss: 0.8750, test_loss: 1.0882, test_f1: 0.4838
 epoch: 73, train_loss: 0.8676, test_loss: 0.9816, test_f1: 0.5160
 epoch: 74, train_loss: 0.8684, test_loss: 1.0771, test_f1: 0.4736
 epoch: 75, train_loss: 0.8781, test_loss: 0.9665, test_f1: 0.4827
 epoch: 76, train_loss: 0.8644, test_loss: 0.9582, test_f1: 0.4935
 epoch: 77, train_loss: 0.8822, test_loss: 0.9736, test_f1: 0.5181
 epoch: 78, train_loss: 0.8879, test_loss: 0.9779, test_f1: 0.4823
 epoch: 79, train_loss: 0.8566, test_loss: 1.0807, test_f1: 0.4823
 epoch: 80, train_loss: 0.8651, test_loss: 1.1172, test_f1: 0.4885
 epoch: 81, train_loss: 0.8737, test_loss: 0.9622, test_f1: 0.4868
 epoch: 82, train_loss: 0.8659, test_loss: 1.0471, test_f1: 0.4652
 epoch: 83, train_loss: 0.8709, test_loss: 1.0600, test_f1: 0.4705
 epoch: 84, train_loss: 0.8726, test_loss: 0.9637, test_f1: 0.4887
 epoch: 85, train_loss: 0.8581, test_loss: 1.0023, test_f1: 0.4883
 epoch: 86, train_loss: 0.8702, test_loss: 1.0904, test_f1: 0.4851
 epoch: 87, train_loss: 0.8615, test_loss: 1.0029, test_f1: 0.4844
 epoch: 88, train_loss: 0.8560, test_loss: 1.0008, test_f1: 0.5015
 epoch: 89, train_loss: 0.8612, test_loss: 1.0015, test_f1: 0.4808
 epoch: 90, train_loss: 0.8523, test_loss: 1.0556, test_f1: 0.4726
 epoch: 91, train_loss: 0.8598, test_loss: 1.0164, test_f1: 0.5072
 epoch: 92, train_loss: 0.8724, test_loss: 1.0550, test_f1: 0.4918
 epoch: 93, train_loss: 0.8535, test_loss: 1.1072, test_f1: 0.4695
 epoch: 94, train_loss: 0.8551, test_loss: 1.1016, test_f1: 0.4783
 epoch: 95, train_loss: 0.8491, test_loss: 1.0879, test_f1: 0.4710
 epoch: 96, train_loss: 0.8605, test_loss: 1.0420, test_f1: 0.4772
 epoch: 97, train_loss: 0.8528, test_loss: 0.9910, test_f1: 0.4989
 epoch: 98, train_loss: 0.8589, test_loss: 0.9866, test_f1: 0.5029
 epoch: 99, train_loss: 0.8497, test_loss: 1.1046, test_f1: 0.4822
##################ITERATION #9 ****************************************
 epoch: 0, train_loss: 1.2777, test_loss: 1.1991, test_f1: 0.3785
 epoch: 1, train_loss: 1.2188, test_loss: 1.1535, test_f1: 0.3668
 epoch: 2, train_loss: 1.1898, test_loss: 1.0858, test_f1: 0.4465
 epoch: 3, train_loss: 1.1612, test_loss: 1.0320, test_f1: 0.4757
 epoch: 4, train_loss: 1.1342, test_loss: 0.9804, test_f1: 0.4541
 epoch: 5, train_loss: 1.1011, test_loss: 0.9505, test_f1: 0.4741
 epoch: 6, train_loss: 1.0895, test_loss: 0.9731, test_f1: 0.4663
 epoch: 7, train_loss: 1.0739, test_loss: 0.9496, test_f1: 0.4501
 epoch: 8, train_loss: 1.0593, test_loss: 0.9221, test_f1: 0.4901
 epoch: 9, train_loss: 1.0462, test_loss: 0.9397, test_f1: 0.4515
 epoch: 10, train_loss: 1.0549, test_loss: 1.0118, test_f1: 0.4566
 epoch: 11, train_loss: 1.0312, test_loss: 0.9843, test_f1: 0.4436
 epoch: 12, train_loss: 1.0223, test_loss: 0.9766, test_f1: 0.4625
 epoch: 13, train_loss: 1.0065, test_loss: 1.0477, test_f1: 0.4678
 epoch: 14, train_loss: 1.0102, test_loss: 0.9880, test_f1: 0.4724
 epoch: 15, train_loss: 1.0064, test_loss: 1.0115, test_f1: 0.4735
 epoch: 16, train_loss: 0.9987, test_loss: 0.9956, test_f1: 0.4749
 epoch: 17, train_loss: 0.9913, test_loss: 1.0077, test_f1: 0.4882
 epoch: 18, train_loss: 0.9933, test_loss: 0.9927, test_f1: 0.4853
 epoch: 19, train_loss: 0.9737, test_loss: 0.9532, test_f1: 0.4621
 epoch: 20, train_loss: 0.9835, test_loss: 0.9742, test_f1: 0.4911
 epoch: 21, train_loss: 0.9733, test_loss: 0.9451, test_f1: 0.4583
 epoch: 22, train_loss: 0.9634, test_loss: 0.9651, test_f1: 0.4800
 epoch: 23, train_loss: 0.9770, test_loss: 1.0168, test_f1: 0.4693
 epoch: 24, train_loss: 0.9682, test_loss: 1.0553, test_f1: 0.4654
 epoch: 25, train_loss: 0.9589, test_loss: 1.0378, test_f1: 0.4870
 epoch: 26, train_loss: 0.9546, test_loss: 0.9883, test_f1: 0.4657
 epoch: 27, train_loss: 0.9533, test_loss: 1.0623, test_f1: 0.4503
 epoch: 28, train_loss: 0.9626, test_loss: 0.9813, test_f1: 0.4795
 epoch: 29, train_loss: 0.9732, test_loss: 0.9844, test_f1: 0.4671
 epoch: 30, train_loss: 0.9634, test_loss: 1.0931, test_f1: 0.4651
 epoch: 31, train_loss: 0.9550, test_loss: 1.0471, test_f1: 0.4720
 epoch: 32, train_loss: 0.9501, test_loss: 0.9725, test_f1: 0.4767
 epoch: 33, train_loss: 0.9694, test_loss: 0.9916, test_f1: 0.4829
 epoch: 34, train_loss: 0.9560, test_loss: 0.9656, test_f1: 0.4839
 epoch: 35, train_loss: 0.9604, test_loss: 1.0064, test_f1: 0.4827
 epoch: 36, train_loss: 0.9562, test_loss: 0.9859, test_f1: 0.4894
 epoch: 37, train_loss: 0.9582, test_loss: 1.0064, test_f1: 0.4770
 epoch: 38, train_loss: 0.9629, test_loss: 1.0357, test_f1: 0.4632
 epoch: 39, train_loss: 0.9490, test_loss: 1.1423, test_f1: 0.4604
 epoch: 40, train_loss: 0.9468, test_loss: 1.1203, test_f1: 0.4505
 epoch: 41, train_loss: 0.9534, test_loss: 0.9776, test_f1: 0.4754
 epoch: 42, train_loss: 0.9464, test_loss: 0.9760, test_f1: 0.4848
 epoch: 43, train_loss: 0.9499, test_loss: 0.9390, test_f1: 0.4872
 epoch: 44, train_loss: 0.9365, test_loss: 0.9886, test_f1: 0.4704
 epoch: 45, train_loss: 0.9331, test_loss: 0.9442, test_f1: 0.4731
 epoch: 46, train_loss: 0.9383, test_loss: 0.9505, test_f1: 0.4856
 epoch: 47, train_loss: 0.9525, test_loss: 0.9624, test_f1: 0.4663
 epoch: 48, train_loss: 0.9313, test_loss: 0.9521, test_f1: 0.5015
 epoch: 49, train_loss: 0.9438, test_loss: 0.9574, test_f1: 0.5092
 epoch: 50, train_loss: 0.9312, test_loss: 0.9714, test_f1: 0.4995
 epoch: 51, train_loss: 0.9199, test_loss: 0.9466, test_f1: 0.4994
 epoch: 52, train_loss: 0.9113, test_loss: 0.9553, test_f1: 0.4885
 epoch: 53, train_loss: 0.9088, test_loss: 0.9429, test_f1: 0.5000
 epoch: 54, train_loss: 0.9165, test_loss: 0.9342, test_f1: 0.5029
 epoch: 55, train_loss: 0.9225, test_loss: 0.9614, test_f1: 0.4914
 epoch: 56, train_loss: 0.9011, test_loss: 0.9430, test_f1: 0.4957
 epoch: 57, train_loss: 0.9087, test_loss: 0.9637, test_f1: 0.4995
 epoch: 58, train_loss: 0.9193, test_loss: 1.0182, test_f1: 0.4828
 epoch: 59, train_loss: 0.9048, test_loss: 0.9348, test_f1: 0.5043
 epoch: 60, train_loss: 0.9087, test_loss: 0.9454, test_f1: 0.5013
 epoch: 61, train_loss: 0.9052, test_loss: 0.9509, test_f1: 0.5028
 epoch: 62, train_loss: 0.8963, test_loss: 0.9647, test_f1: 0.4970
 epoch: 63, train_loss: 0.8982, test_loss: 0.9418, test_f1: 0.5005
 epoch: 64, train_loss: 0.9071, test_loss: 0.9624, test_f1: 0.5038
 epoch: 65, train_loss: 0.8941, test_loss: 0.9466, test_f1: 0.5032
 epoch: 66, train_loss: 0.9140, test_loss: 0.9922, test_f1: 0.4791
 epoch: 67, train_loss: 0.9049, test_loss: 0.9551, test_f1: 0.5164
 epoch: 68, train_loss: 0.8865, test_loss: 0.9920, test_f1: 0.4847
 epoch: 69, train_loss: 0.8783, test_loss: 0.9793, test_f1: 0.4981
 epoch: 70, train_loss: 0.9007, test_loss: 0.9836, test_f1: 0.5006
 epoch: 71, train_loss: 0.8997, test_loss: 0.9602, test_f1: 0.5121
 epoch: 72, train_loss: 0.8941, test_loss: 0.9640, test_f1: 0.4991
 epoch: 73, train_loss: 0.9105, test_loss: 0.9617, test_f1: 0.4811
 epoch: 74, train_loss: 0.8892, test_loss: 0.9671, test_f1: 0.5021
 epoch: 75, train_loss: 0.8908, test_loss: 0.9494, test_f1: 0.5100
 epoch: 76, train_loss: 0.8993, test_loss: 0.9457, test_f1: 0.5095
 epoch: 77, train_loss: 0.8938, test_loss: 0.9559, test_f1: 0.5144
 epoch: 78, train_loss: 0.8912, test_loss: 0.9748, test_f1: 0.5135
 epoch: 79, train_loss: 0.8807, test_loss: 0.9542, test_f1: 0.5085
 epoch: 80, train_loss: 0.9016, test_loss: 0.9669, test_f1: 0.5161
 epoch: 81, train_loss: 0.8916, test_loss: 0.9751, test_f1: 0.5069
 epoch: 82, train_loss: 0.8857, test_loss: 0.9639, test_f1: 0.5063
 epoch: 83, train_loss: 0.8882, test_loss: 0.9622, test_f1: 0.5118
 epoch: 84, train_loss: 0.8718, test_loss: 0.9514, test_f1: 0.5133
 epoch: 85, train_loss: 0.8906, test_loss: 0.9726, test_f1: 0.4996
 epoch: 86, train_loss: 0.8851, test_loss: 0.9868, test_f1: 0.5117
 epoch: 87, train_loss: 0.8877, test_loss: 0.9896, test_f1: 0.5231
 epoch: 88, train_loss: 0.8834, test_loss: 1.0078, test_f1: 0.5114
 epoch: 89, train_loss: 0.8671, test_loss: 0.9735, test_f1: 0.5098
 epoch: 90, train_loss: 0.8903, test_loss: 0.9738, test_f1: 0.5113
 epoch: 91, train_loss: 0.8878, test_loss: 0.9638, test_f1: 0.5069
 epoch: 92, train_loss: 0.8800, test_loss: 0.9727, test_f1: 0.4995
 epoch: 93, train_loss: 0.8724, test_loss: 1.0254, test_f1: 0.4973
 epoch: 94, train_loss: 0.8808, test_loss: 0.9851, test_f1: 0.4945
 epoch: 95, train_loss: 0.8833, test_loss: 0.9770, test_f1: 0.5063
 epoch: 96, train_loss: 0.8802, test_loss: 0.9523, test_f1: 0.5184
 epoch: 97, train_loss: 0.8736, test_loss: 0.9961, test_f1: 0.5094
 epoch: 98, train_loss: 0.8768, test_loss: 0.9486, test_f1: 0.5164
 epoch: 99, train_loss: 0.8800, test_loss: 0.9880, test_f1: 0.4986

Training completed in 1103.90 seconds
Best F1: 0.5604 at epoch 73
Mean F1 across iterations: 0.5370  0.0120
========================FINAL RESULTS================================
FEGIN weighted F1: 0.5604  0.0120
python main.py --data ltspice_examples --representation component_component --model FEGIN --layers 4 --hiddens 16 --batch_size 32 --lr 0.01 --emb_size 512 --epochs 100 --save_appendix component_component_L4_H16_BS32_LR0.01_E512 --no_val
-----



STDERR:
  File "main.py", line 370, in <module>
    main()
  File "main.py", line 254, in main
    dataset = dataset_class(
  File "/home/philip/projects/ltspice_examples_code_repo/Circuit-Completion-Using-GNNs/component_classification_with_link_prediction_head/evaluation/FEGIN/kernel/circuit_datasets.py", line 15, in __init__
    self.data, self.slices = torch.load(self.processed_paths[0])
  File "/home/philip/.local/lib/python3.8/site-packages/torch/serialization.py", line 1040, in load
    warnings.warn(
  File "/usr/lib/python3.8/warnings.py", line 109, in _showwarnmsg
    sw(msg.message, msg.category, msg.filename, msg.lineno,
  File "main.py", line 47, in warn_with_traceback
    traceback.print_stack(file=log)
/home/philip/projects/ltspice_examples_code_repo/Circuit-Completion-Using-GNNs/component_classification_with_link_prediction_head/evaluation/FEGIN/kernel/circuit_datasets.py:15: FutureWarning: You are using `torch.load` with `weights_only=False` (the current default value), which uses the default pickle module implicitly. It is possible to construct malicious pickle data which will execute arbitrary code during unpickling (See https://github.com/pytorch/pytorch/blob/main/SECURITY.md#untrusted-models for more details). In a future release, the default value for `weights_only` will be flipped to `True`. This limits the functions that could be executed during unpickling. Arbitrary objects will no longer be allowed to be loaded via this mode unless they are explicitly allowlisted by the user via `torch.serialization.add_safe_globals`. We recommend you start setting `weights_only=True` for any use case where you don't have full control of the loaded file. Please open an issue on GitHub for any issues related to this experimental feature.
  self.data, self.slices = torch.load(self.processed_paths[0])
