STDOUT:
Results will be saved in /home/philip/projects/ltspice_examples_code_repo/Circuit-Completion-Using-GNNs/component_classification_with_link_prediction_head/evaluation/FEGIN/results/model_FEGIN_dataset_ltspice_examples
Command line input: python main.py --data ltspice_examples --representation component_pin --model FEGIN --layers 6 --hiddens 32 --batch_size 32 --lr 0.01 --emb_size 512 --epochs 100 --save_appendix component_pin_L6_H32_BS32_LR0.01_E512 --no_val
 is saved.
-----
ltspice_examples - FEGIN
Using 6 layers, 32 hidden units, h = 2
Loading component_pin representation dataset
ENTERED
Training FEGIN on component_pin representation
Train: 3560, Test: 848
##################ITERATION #0 ****************************************
 epoch: 0, train_loss: 1.1723, test_loss: 1.4073, test_f1: 0.3041
 epoch: 1, train_loss: 1.0666, test_loss: 1.0546, test_f1: 0.3722
 epoch: 2, train_loss: 1.0508, test_loss: 1.1144, test_f1: 0.3561
 epoch: 3, train_loss: 1.0118, test_loss: 1.1041, test_f1: 0.4586
 epoch: 4, train_loss: 0.9950, test_loss: 0.9881, test_f1: 0.4877
 epoch: 5, train_loss: 0.9635, test_loss: 0.9315, test_f1: 0.4983
 epoch: 6, train_loss: 0.9626, test_loss: 25.7492, test_f1: 0.2256
 epoch: 7, train_loss: 0.9278, test_loss: 0.8361, test_f1: 0.5181
 epoch: 8, train_loss: 0.9145, test_loss: 0.9493, test_f1: 0.5025
 epoch: 9, train_loss: 0.9165, test_loss: 1.5144, test_f1: 0.4319
 epoch: 10, train_loss: 0.9144, test_loss: 1.0039, test_f1: 0.4155
 epoch: 11, train_loss: 0.9269, test_loss: 0.9266, test_f1: 0.4923
 epoch: 12, train_loss: 0.8972, test_loss: 0.8799, test_f1: 0.5300
 epoch: 13, train_loss: 0.8991, test_loss: 0.8788, test_f1: 0.5836
 epoch: 14, train_loss: 0.8691, test_loss: 0.8794, test_f1: 0.5115
 epoch: 15, train_loss: 0.8809, test_loss: 0.8213, test_f1: 0.5486
 epoch: 16, train_loss: 0.8647, test_loss: 0.8143, test_f1: 0.5436
 epoch: 17, train_loss: 0.8549, test_loss: 0.8367, test_f1: 0.5396
 epoch: 18, train_loss: 0.8498, test_loss: 0.9000, test_f1: 0.4811
 epoch: 19, train_loss: 0.8546, test_loss: 0.8828, test_f1: 0.5380
 epoch: 20, train_loss: 0.8503, test_loss: 0.8162, test_f1: 0.6064
 epoch: 21, train_loss: 0.8425, test_loss: 0.8449, test_f1: 0.5435
 epoch: 22, train_loss: 0.8527, test_loss: 0.7852, test_f1: 0.5884
 epoch: 23, train_loss: 0.8458, test_loss: 0.8552, test_f1: 0.5484
 epoch: 24, train_loss: 0.8418, test_loss: 0.8894, test_f1: 0.4811
 epoch: 25, train_loss: 0.8492, test_loss: 0.8453, test_f1: 0.5264
 epoch: 26, train_loss: 0.8453, test_loss: 0.8849, test_f1: 0.5425
 epoch: 27, train_loss: 0.8447, test_loss: 0.8066, test_f1: 0.6056
 epoch: 28, train_loss: 0.8372, test_loss: 0.8088, test_f1: 0.5502
 epoch: 29, train_loss: 0.8352, test_loss: 0.7972, test_f1: 0.5387
 epoch: 30, train_loss: 0.8164, test_loss: 0.8181, test_f1: 0.5321
 epoch: 31, train_loss: 0.8174, test_loss: 0.8211, test_f1: 0.5325
 epoch: 32, train_loss: 0.8212, test_loss: 0.8123, test_f1: 0.5464
 epoch: 33, train_loss: 0.8235, test_loss: 0.8626, test_f1: 0.5424
 epoch: 34, train_loss: 0.8024, test_loss: 0.8981, test_f1: 0.5442
 epoch: 35, train_loss: 0.8029, test_loss: 0.7988, test_f1: 0.6153
 epoch: 36, train_loss: 0.7979, test_loss: 0.7956, test_f1: 0.5628
 epoch: 37, train_loss: 0.8035, test_loss: 0.8234, test_f1: 0.5536
 epoch: 38, train_loss: 0.7908, test_loss: 0.8107, test_f1: 0.5653
 epoch: 39, train_loss: 0.7988, test_loss: 0.7719, test_f1: 0.5341
 epoch: 40, train_loss: 0.8025, test_loss: 0.8571, test_f1: 0.5449
 epoch: 41, train_loss: 0.8054, test_loss: 0.8255, test_f1: 0.5303
 epoch: 42, train_loss: 0.8012, test_loss: 0.7811, test_f1: 0.5529
 epoch: 43, train_loss: 0.7862, test_loss: 0.8617, test_f1: 0.5422
 epoch: 44, train_loss: 0.8050, test_loss: 0.7709, test_f1: 0.5607
 epoch: 45, train_loss: 0.7920, test_loss: 0.7954, test_f1: 0.5493
 epoch: 46, train_loss: 0.7715, test_loss: 0.7910, test_f1: 0.5536
 epoch: 47, train_loss: 0.7679, test_loss: 0.7732, test_f1: 0.6092
 epoch: 48, train_loss: 0.7881, test_loss: 0.7533, test_f1: 0.5869
 epoch: 49, train_loss: 0.7778, test_loss: 0.7388, test_f1: 0.5499
 epoch: 50, train_loss: 0.7731, test_loss: 0.8000, test_f1: 0.5675
 epoch: 51, train_loss: 0.7478, test_loss: 0.8334, test_f1: 0.5632
 epoch: 52, train_loss: 0.7163, test_loss: 0.7262, test_f1: 0.5998
 epoch: 53, train_loss: 0.7243, test_loss: 0.7618, test_f1: 0.5782
 epoch: 54, train_loss: 0.7279, test_loss: 0.7560, test_f1: 0.5893
 epoch: 55, train_loss: 0.7269, test_loss: 0.8119, test_f1: 0.6062
 epoch: 56, train_loss: 0.7185, test_loss: 0.7261, test_f1: 0.5835
 epoch: 57, train_loss: 0.7188, test_loss: 0.7191, test_f1: 0.6015
 epoch: 58, train_loss: 0.7063, test_loss: 0.7456, test_f1: 0.5820
 epoch: 59, train_loss: 0.7110, test_loss: 0.7335, test_f1: 0.5945
 epoch: 60, train_loss: 0.7140, test_loss: 0.7047, test_f1: 0.6438
 epoch: 61, train_loss: 0.7016, test_loss: 0.7521, test_f1: 0.6034
 epoch: 62, train_loss: 0.6922, test_loss: 0.7194, test_f1: 0.6093
 epoch: 63, train_loss: 0.7008, test_loss: 0.7262, test_f1: 0.6300
 epoch: 64, train_loss: 0.7032, test_loss: 0.7451, test_f1: 0.6127
 epoch: 65, train_loss: 0.7118, test_loss: 0.8034, test_f1: 0.5952
 epoch: 66, train_loss: 0.6908, test_loss: 0.6883, test_f1: 0.5916
 epoch: 67, train_loss: 0.7010, test_loss: 0.8071, test_f1: 0.5830
 epoch: 68, train_loss: 0.7004, test_loss: 0.7566, test_f1: 0.5745
 epoch: 69, train_loss: 0.7001, test_loss: 0.7575, test_f1: 0.6056
 epoch: 70, train_loss: 0.6899, test_loss: 0.8121, test_f1: 0.6212
 epoch: 71, train_loss: 0.6868, test_loss: 0.7253, test_f1: 0.5817
 epoch: 72, train_loss: 0.6804, test_loss: 0.7708, test_f1: 0.6118
 epoch: 73, train_loss: 0.6762, test_loss: 0.8612, test_f1: 0.5893
 epoch: 74, train_loss: 0.6777, test_loss: 0.6903, test_f1: 0.6556
 epoch: 75, train_loss: 0.7090, test_loss: 0.8112, test_f1: 0.5656
 epoch: 76, train_loss: 0.6830, test_loss: 0.7464, test_f1: 0.6169
 epoch: 77, train_loss: 0.6977, test_loss: 0.7610, test_f1: 0.6213
 epoch: 78, train_loss: 0.6843, test_loss: 0.7399, test_f1: 0.6802
 epoch: 79, train_loss: 0.6690, test_loss: 0.8079, test_f1: 0.6051
 epoch: 80, train_loss: 0.6889, test_loss: 0.7782, test_f1: 0.5949
 epoch: 81, train_loss: 0.6790, test_loss: 0.7950, test_f1: 0.6113
 epoch: 82, train_loss: 0.6788, test_loss: 0.8450, test_f1: 0.6310
 epoch: 83, train_loss: 0.6866, test_loss: 0.6938, test_f1: 0.6330
 epoch: 84, train_loss: 0.6903, test_loss: 0.7717, test_f1: 0.5943
 epoch: 85, train_loss: 0.6552, test_loss: 0.8476, test_f1: 0.6194
 epoch: 86, train_loss: 0.6641, test_loss: 0.7816, test_f1: 0.6318
 epoch: 87, train_loss: 0.6634, test_loss: 0.7977, test_f1: 0.6049
 epoch: 88, train_loss: 0.6540, test_loss: 0.7100, test_f1: 0.6203
 epoch: 89, train_loss: 0.6634, test_loss: 0.7312, test_f1: 0.6512
 epoch: 90, train_loss: 0.6563, test_loss: 0.8284, test_f1: 0.5988
 epoch: 91, train_loss: 0.6766, test_loss: 0.6761, test_f1: 0.6509
 epoch: 92, train_loss: 0.6594, test_loss: 0.7980, test_f1: 0.6653
 epoch: 93, train_loss: 0.6759, test_loss: 0.7699, test_f1: 0.6197
 epoch: 94, train_loss: 0.6507, test_loss: 0.7026, test_f1: 0.6421
 epoch: 95, train_loss: 0.6587, test_loss: 0.7258, test_f1: 0.6038
 epoch: 96, train_loss: 0.6576, test_loss: 0.6869, test_f1: 0.6547
 epoch: 97, train_loss: 0.6502, test_loss: 0.7221, test_f1: 0.6499
 epoch: 98, train_loss: 0.6496, test_loss: 0.7316, test_f1: 0.6709
 epoch: 99, train_loss: 0.6607, test_loss: 0.7992, test_f1: 0.6042
##################ITERATION #1 ****************************************
 epoch: 0, train_loss: 1.1533, test_loss: 1.0979, test_f1: 0.3410
 epoch: 1, train_loss: 1.0631, test_loss: 1.0909, test_f1: 0.4345
 epoch: 2, train_loss: 1.0189, test_loss: 1.0922, test_f1: 0.4570
 epoch: 3, train_loss: 1.0155, test_loss: 1.0374, test_f1: 0.4430
 epoch: 4, train_loss: 1.0032, test_loss: 1.2277, test_f1: 0.4075
 epoch: 5, train_loss: 0.9840, test_loss: 1.0771, test_f1: 0.4788
 epoch: 6, train_loss: 0.9832, test_loss: 1.0653, test_f1: 0.5003
 epoch: 7, train_loss: 0.9556, test_loss: 1.0840, test_f1: 0.4429
 epoch: 8, train_loss: 0.9581, test_loss: 1.0448, test_f1: 0.5280
 epoch: 9, train_loss: 0.9543, test_loss: 1.0120, test_f1: 0.5685
 epoch: 10, train_loss: 0.9184, test_loss: 0.9606, test_f1: 0.5021
 epoch: 11, train_loss: 0.9375, test_loss: 0.9779, test_f1: 0.4876
 epoch: 12, train_loss: 0.9345, test_loss: 1.1418, test_f1: 0.3879
 epoch: 13, train_loss: 0.9286, test_loss: 1.0561, test_f1: 0.4953
 epoch: 14, train_loss: 0.8945, test_loss: 0.9371, test_f1: 0.5760
 epoch: 15, train_loss: 0.9154, test_loss: 1.0173, test_f1: 0.5055
 epoch: 16, train_loss: 0.8884, test_loss: 0.9313, test_f1: 0.5266
 epoch: 17, train_loss: 0.8882, test_loss: 0.9055, test_f1: 0.5312
 epoch: 18, train_loss: 0.8867, test_loss: 0.9423, test_f1: 0.5349
 epoch: 19, train_loss: 0.8904, test_loss: 1.1133, test_f1: 0.4732
 epoch: 20, train_loss: 0.8987, test_loss: 1.0458, test_f1: 0.5046
 epoch: 21, train_loss: 0.8859, test_loss: 1.0385, test_f1: 0.4940
 epoch: 22, train_loss: 0.8689, test_loss: 0.8745, test_f1: 0.5373
 epoch: 23, train_loss: 0.8645, test_loss: 0.9007, test_f1: 0.5696
 epoch: 24, train_loss: 0.8405, test_loss: 0.9343, test_f1: 0.5162
 epoch: 25, train_loss: 0.8544, test_loss: 0.8774, test_f1: 0.5510
 epoch: 26, train_loss: 0.8531, test_loss: 0.8666, test_f1: 0.5583
 epoch: 27, train_loss: 0.8542, test_loss: 0.8966, test_f1: 0.5500
 epoch: 28, train_loss: 0.8307, test_loss: 0.9129, test_f1: 0.5541
 epoch: 29, train_loss: 0.8275, test_loss: 0.9194, test_f1: 0.5399
 epoch: 30, train_loss: 0.8247, test_loss: 0.9027, test_f1: 0.5349
 epoch: 31, train_loss: 0.8223, test_loss: 0.9756, test_f1: 0.5144
 epoch: 32, train_loss: 0.8193, test_loss: 0.8700, test_f1: 0.5733
 epoch: 33, train_loss: 0.8197, test_loss: 1.0013, test_f1: 0.5169
 epoch: 34, train_loss: 0.8115, test_loss: 0.9054, test_f1: 0.5789
 epoch: 35, train_loss: 0.8051, test_loss: 0.9417, test_f1: 0.5449
 epoch: 36, train_loss: 0.7956, test_loss: 0.9246, test_f1: 0.5491
 epoch: 37, train_loss: 0.7986, test_loss: 0.8500, test_f1: 0.5948
 epoch: 38, train_loss: 0.7962, test_loss: 0.9516, test_f1: 0.5233
 epoch: 39, train_loss: 0.7951, test_loss: 0.9198, test_f1: 0.5534
 epoch: 40, train_loss: 0.7814, test_loss: 0.9095, test_f1: 0.5590
 epoch: 41, train_loss: 0.8037, test_loss: 0.8127, test_f1: 0.5679
 epoch: 42, train_loss: 0.7775, test_loss: 1.0117, test_f1: 0.5156
 epoch: 43, train_loss: 0.7948, test_loss: 1.0374, test_f1: 0.5759
 epoch: 44, train_loss: 0.7928, test_loss: 1.0950, test_f1: 0.5037
 epoch: 45, train_loss: 0.8097, test_loss: 0.8857, test_f1: 0.5306
 epoch: 46, train_loss: 0.7861, test_loss: 0.9177, test_f1: 0.5849
 epoch: 47, train_loss: 0.7695, test_loss: 0.8934, test_f1: 0.5503
 epoch: 48, train_loss: 0.7740, test_loss: 1.0247, test_f1: 0.5560
 epoch: 49, train_loss: 0.7932, test_loss: 1.2460, test_f1: 0.5210
 epoch: 50, train_loss: 0.7885, test_loss: 0.9563, test_f1: 0.5086
 epoch: 51, train_loss: 0.7440, test_loss: 0.8767, test_f1: 0.5740
 epoch: 52, train_loss: 0.7409, test_loss: 0.9065, test_f1: 0.5548
 epoch: 53, train_loss: 0.7380, test_loss: 0.9048, test_f1: 0.5801
 epoch: 54, train_loss: 0.7232, test_loss: 0.8611, test_f1: 0.5803
 epoch: 55, train_loss: 0.7238, test_loss: 0.9029, test_f1: 0.5571
 epoch: 56, train_loss: 0.7170, test_loss: 0.8894, test_f1: 0.5694
 epoch: 57, train_loss: 0.7108, test_loss: 0.8826, test_f1: 0.5962
 epoch: 58, train_loss: 0.7118, test_loss: 0.9412, test_f1: 0.5937
 epoch: 59, train_loss: 0.7113, test_loss: 0.9125, test_f1: 0.5683
 epoch: 60, train_loss: 0.6965, test_loss: 0.9585, test_f1: 0.6111
 epoch: 61, train_loss: 0.6983, test_loss: 0.8750, test_f1: 0.5888
 epoch: 62, train_loss: 0.6962, test_loss: 0.9746, test_f1: 0.5598
 epoch: 63, train_loss: 0.7064, test_loss: 0.9426, test_f1: 0.6339
 epoch: 64, train_loss: 0.6943, test_loss: 0.9945, test_f1: 0.5579
 epoch: 65, train_loss: 0.6839, test_loss: 0.9906, test_f1: 0.5871
 epoch: 66, train_loss: 0.7064, test_loss: 0.9417, test_f1: 0.6059
 epoch: 67, train_loss: 0.6870, test_loss: 0.9491, test_f1: 0.5721
 epoch: 68, train_loss: 0.6915, test_loss: 0.9749, test_f1: 0.5549
 epoch: 69, train_loss: 0.6831, test_loss: 0.9649, test_f1: 0.5866
 epoch: 70, train_loss: 0.6989, test_loss: 0.9713, test_f1: 0.5729
 epoch: 71, train_loss: 0.6970, test_loss: 1.0116, test_f1: 0.6200
 epoch: 72, train_loss: 0.6741, test_loss: 0.9896, test_f1: 0.5867
 epoch: 73, train_loss: 0.6780, test_loss: 0.9749, test_f1: 0.6412
 epoch: 74, train_loss: 0.6761, test_loss: 1.0214, test_f1: 0.5644
 epoch: 75, train_loss: 0.6880, test_loss: 1.0497, test_f1: 0.6351
 epoch: 76, train_loss: 0.6734, test_loss: 1.0627, test_f1: 0.5819
 epoch: 77, train_loss: 0.6855, test_loss: 0.9159, test_f1: 0.6453
 epoch: 78, train_loss: 0.6684, test_loss: 0.9547, test_f1: 0.6414
 epoch: 79, train_loss: 0.6720, test_loss: 0.9802, test_f1: 0.6267
 epoch: 80, train_loss: 0.6735, test_loss: 0.9866, test_f1: 0.5903
 epoch: 81, train_loss: 0.6726, test_loss: 1.0365, test_f1: 0.5634
 epoch: 82, train_loss: 0.6839, test_loss: 0.9851, test_f1: 0.6098
 epoch: 83, train_loss: 0.6707, test_loss: 1.0294, test_f1: 0.6545
 epoch: 84, train_loss: 0.6792, test_loss: 1.0821, test_f1: 0.6235
 epoch: 85, train_loss: 0.6575, test_loss: 1.0186, test_f1: 0.6229
 epoch: 86, train_loss: 0.6508, test_loss: 1.0060, test_f1: 0.6191
 epoch: 87, train_loss: 0.6720, test_loss: 1.0433, test_f1: 0.6157
 epoch: 88, train_loss: 0.6825, test_loss: 0.9795, test_f1: 0.5806
 epoch: 89, train_loss: 0.6639, test_loss: 1.0772, test_f1: 0.5814
 epoch: 90, train_loss: 0.6604, test_loss: 0.9549, test_f1: 0.6219
 epoch: 91, train_loss: 0.6544, test_loss: 0.9605, test_f1: 0.6175
 epoch: 92, train_loss: 0.6710, test_loss: 0.9707, test_f1: 0.5777
 epoch: 93, train_loss: 0.6489, test_loss: 1.0747, test_f1: 0.6504
 epoch: 94, train_loss: 0.6497, test_loss: 1.0403, test_f1: 0.6063
 epoch: 95, train_loss: 0.6587, test_loss: 1.0418, test_f1: 0.6400
 epoch: 96, train_loss: 0.6453, test_loss: 1.0625, test_f1: 0.6417
 epoch: 97, train_loss: 0.6334, test_loss: 1.1326, test_f1: 0.5875
 epoch: 98, train_loss: 0.6263, test_loss: 1.0990, test_f1: 0.6484
 epoch: 99, train_loss: 0.6626, test_loss: 1.0991, test_f1: 0.6566
##################ITERATION #2 ****************************************
 epoch: 0, train_loss: 1.1280, test_loss: 1.0662, test_f1: 0.3436
 epoch: 1, train_loss: 1.0331, test_loss: 1.1039, test_f1: 0.3929
 epoch: 2, train_loss: 1.0056, test_loss: 1.0662, test_f1: 0.5262
 epoch: 3, train_loss: 0.9717, test_loss: 0.9671, test_f1: 0.5091
 epoch: 4, train_loss: 0.9438, test_loss: 1.0250, test_f1: 0.4716
 epoch: 5, train_loss: 0.9398, test_loss: 0.8847, test_f1: 0.5147
 epoch: 6, train_loss: 0.9320, test_loss: 1.0119, test_f1: 0.4584
 epoch: 7, train_loss: 0.9062, test_loss: 0.9033, test_f1: 0.5091
 epoch: 8, train_loss: 0.8980, test_loss: 0.9590, test_f1: 0.5051
 epoch: 9, train_loss: 0.8990, test_loss: 1.1273, test_f1: 0.4498
 epoch: 10, train_loss: 0.8900, test_loss: 0.9698, test_f1: 0.5084
 epoch: 11, train_loss: 0.8888, test_loss: 1.1022, test_f1: 0.4986
 epoch: 12, train_loss: 0.8615, test_loss: 1.3627, test_f1: 0.3978
 epoch: 13, train_loss: 0.8657, test_loss: 0.9726, test_f1: 0.4636
 epoch: 14, train_loss: 0.8672, test_loss: 0.8411, test_f1: 0.5431
 epoch: 15, train_loss: 0.8477, test_loss: 0.8497, test_f1: 0.5525
 epoch: 16, train_loss: 0.8434, test_loss: 0.8398, test_f1: 0.5175
 epoch: 17, train_loss: 0.8481, test_loss: 0.8526, test_f1: 0.5473
 epoch: 18, train_loss: 0.8504, test_loss: 0.9483, test_f1: 0.5506
 epoch: 19, train_loss: 0.8461, test_loss: 0.8874, test_f1: 0.5581
 epoch: 20, train_loss: 0.8318, test_loss: 0.8296, test_f1: 0.5638
 epoch: 21, train_loss: 0.8230, test_loss: 0.8622, test_f1: 0.5525
 epoch: 22, train_loss: 0.8356, test_loss: 0.8954, test_f1: 0.5317
 epoch: 23, train_loss: 0.8258, test_loss: 0.8366, test_f1: 0.5595
 epoch: 24, train_loss: 0.8249, test_loss: 0.9099, test_f1: 0.5002
 epoch: 25, train_loss: 0.8207, test_loss: 0.8689, test_f1: 0.5450
 epoch: 26, train_loss: 0.8127, test_loss: 0.9479, test_f1: 0.5472
 epoch: 27, train_loss: 0.8268, test_loss: 0.8484, test_f1: 0.5146
 epoch: 28, train_loss: 0.8117, test_loss: 1.1290, test_f1: 0.4794
 epoch: 29, train_loss: 0.8317, test_loss: 0.8856, test_f1: 0.5219
 epoch: 30, train_loss: 0.7982, test_loss: 0.9945, test_f1: 0.5264
 epoch: 31, train_loss: 0.7880, test_loss: 0.9172, test_f1: 0.5248
 epoch: 32, train_loss: 0.7844, test_loss: 0.9277, test_f1: 0.5164
 epoch: 33, train_loss: 0.7877, test_loss: 0.9837, test_f1: 0.5307
 epoch: 34, train_loss: 0.7872, test_loss: 0.9191, test_f1: 0.5378
 epoch: 35, train_loss: 0.7899, test_loss: 0.8894, test_f1: 0.5448
 epoch: 36, train_loss: 0.7633, test_loss: 0.9281, test_f1: 0.5459
 epoch: 37, train_loss: 0.7731, test_loss: 0.9087, test_f1: 0.5255
 epoch: 38, train_loss: 0.7668, test_loss: 1.0142, test_f1: 0.5226
 epoch: 39, train_loss: 0.7706, test_loss: 0.9155, test_f1: 0.5642
 epoch: 40, train_loss: 0.7627, test_loss: 0.8523, test_f1: 0.6020
 epoch: 41, train_loss: 0.7578, test_loss: 0.8770, test_f1: 0.5875
 epoch: 42, train_loss: 0.7610, test_loss: 0.9663, test_f1: 0.5288
 epoch: 43, train_loss: 0.7690, test_loss: 0.9626, test_f1: 0.5326
 epoch: 44, train_loss: 0.7558, test_loss: 0.8069, test_f1: 0.5616
 epoch: 45, train_loss: 0.7498, test_loss: 0.8746, test_f1: 0.6168
 epoch: 46, train_loss: 0.7919, test_loss: 0.8595, test_f1: 0.5406
 epoch: 47, train_loss: 0.7895, test_loss: 0.8800, test_f1: 0.5261
 epoch: 48, train_loss: 0.7543, test_loss: 0.8324, test_f1: 0.5573
 epoch: 49, train_loss: 0.7260, test_loss: 0.9021, test_f1: 0.5487
 epoch: 50, train_loss: 0.7409, test_loss: 0.9084, test_f1: 0.6058
 epoch: 51, train_loss: 0.7266, test_loss: 0.8749, test_f1: 0.5571
 epoch: 52, train_loss: 0.6973, test_loss: 0.8954, test_f1: 0.5656
 epoch: 53, train_loss: 0.6930, test_loss: 0.8775, test_f1: 0.5792
 epoch: 54, train_loss: 0.7018, test_loss: 0.8515, test_f1: 0.5659
 epoch: 55, train_loss: 0.6925, test_loss: 0.9155, test_f1: 0.5712
 epoch: 56, train_loss: 0.7007, test_loss: 0.8594, test_f1: 0.5875
 epoch: 57, train_loss: 0.6853, test_loss: 0.9075, test_f1: 0.5928
 epoch: 58, train_loss: 0.6594, test_loss: 0.8821, test_f1: 0.6163
 epoch: 59, train_loss: 0.6725, test_loss: 0.8934, test_f1: 0.5860
 epoch: 60, train_loss: 0.6805, test_loss: 0.8888, test_f1: 0.5967
 epoch: 61, train_loss: 0.6601, test_loss: 1.0005, test_f1: 0.5568
 epoch: 62, train_loss: 0.6815, test_loss: 0.7994, test_f1: 0.5644
 epoch: 63, train_loss: 0.6690, test_loss: 0.8877, test_f1: 0.6070
 epoch: 64, train_loss: 0.6619, test_loss: 0.8463, test_f1: 0.6084
 epoch: 65, train_loss: 0.6673, test_loss: 0.8657, test_f1: 0.5973
 epoch: 66, train_loss: 0.6588, test_loss: 0.9080, test_f1: 0.6022
 epoch: 67, train_loss: 0.6764, test_loss: 0.9736, test_f1: 0.5516
 epoch: 68, train_loss: 0.6678, test_loss: 0.8967, test_f1: 0.5974
 epoch: 69, train_loss: 0.6598, test_loss: 0.8499, test_f1: 0.5927
 epoch: 70, train_loss: 0.6600, test_loss: 0.9781, test_f1: 0.5523
 epoch: 71, train_loss: 0.6920, test_loss: 0.8826, test_f1: 0.6064
 epoch: 72, train_loss: 0.6691, test_loss: 0.8306, test_f1: 0.6370
 epoch: 73, train_loss: 0.6483, test_loss: 0.9514, test_f1: 0.6150
 epoch: 74, train_loss: 0.6605, test_loss: 0.9215, test_f1: 0.6152
 epoch: 75, train_loss: 0.6556, test_loss: 0.8874, test_f1: 0.6034
 epoch: 76, train_loss: 0.6556, test_loss: 0.8834, test_f1: 0.6377
 epoch: 77, train_loss: 0.6454, test_loss: 0.9311, test_f1: 0.6279
 epoch: 78, train_loss: 0.6550, test_loss: 0.8821, test_f1: 0.6395
 epoch: 79, train_loss: 0.6386, test_loss: 0.9370, test_f1: 0.6166
 epoch: 80, train_loss: 0.6480, test_loss: 0.8728, test_f1: 0.6241
 epoch: 81, train_loss: 0.6418, test_loss: 0.9534, test_f1: 0.6137
 epoch: 82, train_loss: 0.6228, test_loss: 0.9378, test_f1: 0.6259
 epoch: 83, train_loss: 0.6447, test_loss: 0.9323, test_f1: 0.6290
 epoch: 84, train_loss: 0.6319, test_loss: 0.9399, test_f1: 0.5955
 epoch: 85, train_loss: 0.6308, test_loss: 0.9526, test_f1: 0.6467
 epoch: 86, train_loss: 0.6366, test_loss: 1.0029, test_f1: 0.6041
 epoch: 87, train_loss: 0.6449, test_loss: 1.0278, test_f1: 0.6265
 epoch: 88, train_loss: 0.6418, test_loss: 0.9868, test_f1: 0.6145
 epoch: 89, train_loss: 0.6241, test_loss: 0.8821, test_f1: 0.6220
 epoch: 90, train_loss: 0.6253, test_loss: 0.8899, test_f1: 0.6620
 epoch: 91, train_loss: 0.6170, test_loss: 0.9603, test_f1: 0.6303
 epoch: 92, train_loss: 0.6267, test_loss: 0.8870, test_f1: 0.6264
 epoch: 93, train_loss: 0.6327, test_loss: 0.8568, test_f1: 0.6829
 epoch: 94, train_loss: 0.6238, test_loss: 0.9771, test_f1: 0.6366
 epoch: 95, train_loss: 0.6369, test_loss: 0.9173, test_f1: 0.6658
 epoch: 96, train_loss: 0.6300, test_loss: 1.0158, test_f1: 0.6560
 epoch: 97, train_loss: 0.6210, test_loss: 0.9731, test_f1: 0.5864
 epoch: 98, train_loss: 0.6395, test_loss: 0.8874, test_f1: 0.6410
 epoch: 99, train_loss: 0.6152, test_loss: 1.0608, test_f1: 0.6386
##################ITERATION #3 ****************************************
 epoch: 0, train_loss: 1.1361, test_loss: 1.1484, test_f1: 0.4318
 epoch: 1, train_loss: 1.0664, test_loss: 1.1011, test_f1: 0.3744
 epoch: 2, train_loss: 1.0414, test_loss: 1.0497, test_f1: 0.4348
 epoch: 3, train_loss: 1.0316, test_loss: 1.0232, test_f1: 0.4542
 epoch: 4, train_loss: 0.9911, test_loss: 1.0627, test_f1: 0.4695
 epoch: 5, train_loss: 0.9749, test_loss: 1.0805, test_f1: 0.4151
 epoch: 6, train_loss: 0.9632, test_loss: 0.9114, test_f1: 0.5070
 epoch: 7, train_loss: 0.9252, test_loss: 0.9744, test_f1: 0.4920
 epoch: 8, train_loss: 0.9110, test_loss: 0.8136, test_f1: 0.5527
 epoch: 9, train_loss: 0.9414, test_loss: 0.9189, test_f1: 0.5283
 epoch: 10, train_loss: 0.8944, test_loss: 0.9786, test_f1: 0.4578
 epoch: 11, train_loss: 0.9039, test_loss: 0.9058, test_f1: 0.5198
 epoch: 12, train_loss: 0.9082, test_loss: 0.8986, test_f1: 0.5136
 epoch: 13, train_loss: 0.8879, test_loss: 0.8917, test_f1: 0.5223
 epoch: 14, train_loss: 1.0295, test_loss: 0.9975, test_f1: 0.4304
 epoch: 15, train_loss: 0.9667, test_loss: 1.0058, test_f1: 0.4595
 epoch: 16, train_loss: 0.9444, test_loss: 0.9863, test_f1: 0.5049
 epoch: 17, train_loss: 0.9320, test_loss: 0.9478, test_f1: 0.4810
 epoch: 18, train_loss: 0.9038, test_loss: 0.9730, test_f1: 0.5469
 epoch: 19, train_loss: 0.9384, test_loss: 0.9086, test_f1: 0.5553
 epoch: 20, train_loss: 0.8856, test_loss: 0.9603, test_f1: 0.5207
 epoch: 21, train_loss: 0.9007, test_loss: 0.9755, test_f1: 0.5158
 epoch: 22, train_loss: 0.9028, test_loss: 0.9468, test_f1: 0.5163
 epoch: 23, train_loss: 0.8889, test_loss: 0.9284, test_f1: 0.5444
 epoch: 24, train_loss: 0.8722, test_loss: 0.9249, test_f1: 0.5345
 epoch: 25, train_loss: 0.8910, test_loss: 0.8968, test_f1: 0.5719
 epoch: 26, train_loss: 0.9061, test_loss: 1.0154, test_f1: 0.5033
 epoch: 27, train_loss: 0.8799, test_loss: 0.9612, test_f1: 0.5267
 epoch: 28, train_loss: 0.8675, test_loss: 0.9598, test_f1: 0.5320
 epoch: 29, train_loss: 0.8686, test_loss: 0.9873, test_f1: 0.5500
 epoch: 30, train_loss: 0.8650, test_loss: 0.9840, test_f1: 0.4988
 epoch: 31, train_loss: 0.8576, test_loss: 0.9281, test_f1: 0.5389
 epoch: 32, train_loss: 0.8378, test_loss: 1.0196, test_f1: 0.4774
 epoch: 33, train_loss: 0.8365, test_loss: 0.9303, test_f1: 0.5042
 epoch: 34, train_loss: 0.8426, test_loss: 0.8765, test_f1: 0.5438
 epoch: 35, train_loss: 0.8204, test_loss: 1.0290, test_f1: 0.5336
 epoch: 36, train_loss: 0.8066, test_loss: 0.9623, test_f1: 0.5191
 epoch: 37, train_loss: 0.8237, test_loss: 0.9861, test_f1: 0.4958
 epoch: 38, train_loss: 0.8287, test_loss: 0.9286, test_f1: 0.5242
 epoch: 39, train_loss: 0.8209, test_loss: 0.9519, test_f1: 0.5414
 epoch: 40, train_loss: 0.8476, test_loss: 0.9341, test_f1: 0.5010
 epoch: 41, train_loss: 0.8179, test_loss: 0.8934, test_f1: 0.5289
 epoch: 42, train_loss: 0.8159, test_loss: 0.9033, test_f1: 0.5410
 epoch: 43, train_loss: 0.8086, test_loss: 0.9043, test_f1: 0.5204
 epoch: 44, train_loss: 0.7951, test_loss: 0.8857, test_f1: 0.5438
 epoch: 45, train_loss: 0.8144, test_loss: 0.9150, test_f1: 0.5228
 epoch: 46, train_loss: 0.7871, test_loss: 0.9008, test_f1: 0.5577
 epoch: 47, train_loss: 0.7916, test_loss: 0.8707, test_f1: 0.5257
 epoch: 48, train_loss: 0.7819, test_loss: 0.8766, test_f1: 0.5700
 epoch: 49, train_loss: 0.8067, test_loss: 0.8543, test_f1: 0.5967
 epoch: 50, train_loss: 0.7874, test_loss: 0.9204, test_f1: 0.5503
 epoch: 51, train_loss: 0.7622, test_loss: 0.9101, test_f1: 0.5615
 epoch: 52, train_loss: 0.7280, test_loss: 0.9389, test_f1: 0.5854
 epoch: 53, train_loss: 0.7451, test_loss: 0.8709, test_f1: 0.5513
 epoch: 54, train_loss: 0.7338, test_loss: 0.9228, test_f1: 0.5523
 epoch: 55, train_loss: 0.7412, test_loss: 0.8651, test_f1: 0.5520
 epoch: 56, train_loss: 0.7407, test_loss: 0.8337, test_f1: 0.5460
 epoch: 57, train_loss: 0.7296, test_loss: 0.8735, test_f1: 0.5581
 epoch: 58, train_loss: 0.7299, test_loss: 0.8922, test_f1: 0.5350
 epoch: 59, train_loss: 0.7328, test_loss: 0.8856, test_f1: 0.5647
 epoch: 60, train_loss: 0.7318, test_loss: 0.8996, test_f1: 0.5516
 epoch: 61, train_loss: 0.7408, test_loss: 0.9249, test_f1: 0.5340
 epoch: 62, train_loss: 0.7320, test_loss: 0.9422, test_f1: 0.5367
 epoch: 63, train_loss: 0.7301, test_loss: 0.8954, test_f1: 0.5904
 epoch: 64, train_loss: 0.7167, test_loss: 0.9118, test_f1: 0.5741
 epoch: 65, train_loss: 0.7283, test_loss: 0.8794, test_f1: 0.5927
 epoch: 66, train_loss: 0.7231, test_loss: 0.8601, test_f1: 0.5692
 epoch: 67, train_loss: 0.7170, test_loss: 0.8444, test_f1: 0.5689
 epoch: 68, train_loss: 0.7139, test_loss: 0.8484, test_f1: 0.5734
 epoch: 69, train_loss: 0.7104, test_loss: 0.9243, test_f1: 0.5600
 epoch: 70, train_loss: 0.7498, test_loss: 0.9421, test_f1: 0.5769
 epoch: 71, train_loss: 0.7323, test_loss: 0.8829, test_f1: 0.5812
 epoch: 72, train_loss: 0.7169, test_loss: 0.8643, test_f1: 0.5737
 epoch: 73, train_loss: 0.7052, test_loss: 0.9361, test_f1: 0.5570
 epoch: 74, train_loss: 0.7276, test_loss: 0.9450, test_f1: 0.5525
 epoch: 75, train_loss: 0.7133, test_loss: 0.8653, test_f1: 0.5693
 epoch: 76, train_loss: 0.6992, test_loss: 0.9007, test_f1: 0.5774
 epoch: 77, train_loss: 0.7044, test_loss: 0.8983, test_f1: 0.5652
 epoch: 78, train_loss: 0.6945, test_loss: 0.9153, test_f1: 0.5788
 epoch: 79, train_loss: 0.7076, test_loss: 0.9130, test_f1: 0.5674
 epoch: 80, train_loss: 0.6936, test_loss: 0.9763, test_f1: 0.5572
 epoch: 81, train_loss: 0.6898, test_loss: 0.9056, test_f1: 0.5932
 epoch: 82, train_loss: 0.6996, test_loss: 1.0689, test_f1: 0.5287
 epoch: 83, train_loss: 0.7005, test_loss: 0.8402, test_f1: 0.5628
 epoch: 84, train_loss: 0.6964, test_loss: 0.9913, test_f1: 0.5432
 epoch: 85, train_loss: 0.6947, test_loss: 0.9189, test_f1: 0.5476
 epoch: 86, train_loss: 0.6774, test_loss: 0.9151, test_f1: 0.5744
 epoch: 87, train_loss: 0.7091, test_loss: 0.8870, test_f1: 0.5597
 epoch: 88, train_loss: 0.6889, test_loss: 0.9172, test_f1: 0.6184
 epoch: 89, train_loss: 0.6796, test_loss: 0.9501, test_f1: 0.6069
 epoch: 90, train_loss: 0.6819, test_loss: 0.9061, test_f1: 0.5395
 epoch: 91, train_loss: 0.6754, test_loss: 0.8993, test_f1: 0.6220
 epoch: 92, train_loss: 0.6752, test_loss: 0.9108, test_f1: 0.5537
 epoch: 93, train_loss: 0.6586, test_loss: 0.9559, test_f1: 0.5862
 epoch: 94, train_loss: 0.6792, test_loss: 1.0973, test_f1: 0.5945
 epoch: 95, train_loss: 0.6678, test_loss: 0.8834, test_f1: 0.5980
 epoch: 96, train_loss: 0.6682, test_loss: 0.9965, test_f1: 0.5452
 epoch: 97, train_loss: 0.6677, test_loss: 0.9963, test_f1: 0.5976
 epoch: 98, train_loss: 0.6752, test_loss: 1.0135, test_f1: 0.5523
 epoch: 99, train_loss: 0.6494, test_loss: 0.9261, test_f1: 0.5886
##################ITERATION #4 ****************************************
 epoch: 0, train_loss: 1.1349, test_loss: 1.0745, test_f1: 0.4400
 epoch: 1, train_loss: 1.0597, test_loss: 1.1250, test_f1: 0.4321
 epoch: 2, train_loss: 1.0305, test_loss: 1.0686, test_f1: 0.4791
 epoch: 3, train_loss: 1.0249, test_loss: 1.0567, test_f1: 0.4781
 epoch: 4, train_loss: 1.0232, test_loss: 1.0517, test_f1: 0.4626
 epoch: 5, train_loss: 0.9833, test_loss: 1.0553, test_f1: 0.4678
 epoch: 6, train_loss: 0.9780, test_loss: 1.0370, test_f1: 0.4354
 epoch: 7, train_loss: 0.9574, test_loss: 0.9824, test_f1: 0.5054
 epoch: 8, train_loss: 0.9571, test_loss: 1.0589, test_f1: 0.4452
 epoch: 9, train_loss: 0.9355, test_loss: 0.9886, test_f1: 0.4934
 epoch: 10, train_loss: 0.9335, test_loss: 0.9447, test_f1: 0.5003
 epoch: 11, train_loss: 0.9245, test_loss: 0.9114, test_f1: 0.5008
 epoch: 12, train_loss: 0.9096, test_loss: 1.0712, test_f1: 0.4792
 epoch: 13, train_loss: 0.9016, test_loss: 0.9273, test_f1: 0.4979
 epoch: 14, train_loss: 0.8947, test_loss: 0.8650, test_f1: 0.5567
 epoch: 15, train_loss: 0.9119, test_loss: 1.0242, test_f1: 0.4932
 epoch: 16, train_loss: 0.9296, test_loss: 0.8692, test_f1: 0.5159
 epoch: 17, train_loss: 0.8921, test_loss: 0.8833, test_f1: 0.5270
 epoch: 18, train_loss: 0.8809, test_loss: 0.8492, test_f1: 0.5467
 epoch: 19, train_loss: 0.8895, test_loss: 0.8222, test_f1: 0.5406
 epoch: 20, train_loss: 0.8612, test_loss: 0.9053, test_f1: 0.5492
 epoch: 21, train_loss: 0.8664, test_loss: 0.8733, test_f1: 0.5523
 epoch: 22, train_loss: 0.8651, test_loss: 0.8687, test_f1: 0.5429
 epoch: 23, train_loss: 0.8497, test_loss: 0.8617, test_f1: 0.5655
 epoch: 24, train_loss: 0.8554, test_loss: 0.8786, test_f1: 0.5521
 epoch: 25, train_loss: 0.8465, test_loss: 0.9482, test_f1: 0.5050
 epoch: 26, train_loss: 0.8480, test_loss: 0.8995, test_f1: 0.5257
 epoch: 27, train_loss: 0.8387, test_loss: 0.8899, test_f1: 0.5244
 epoch: 28, train_loss: 0.8254, test_loss: 0.8513, test_f1: 0.5388
 epoch: 29, train_loss: 0.8286, test_loss: 0.8110, test_f1: 0.5595
 epoch: 30, train_loss: 0.8334, test_loss: 0.8106, test_f1: 0.5626
 epoch: 31, train_loss: 0.8326, test_loss: 0.8510, test_f1: 0.5650
 epoch: 32, train_loss: 0.8149, test_loss: 0.8397, test_f1: 0.5183
 epoch: 33, train_loss: 0.8180, test_loss: 0.8188, test_f1: 0.5951
 epoch: 34, train_loss: 0.8007, test_loss: 0.8406, test_f1: 0.5592
 epoch: 35, train_loss: 0.8098, test_loss: 0.8217, test_f1: 0.5561
 epoch: 36, train_loss: 0.8097, test_loss: 0.8365, test_f1: 0.5416
 epoch: 37, train_loss: 0.8025, test_loss: 0.8121, test_f1: 0.5700
 epoch: 38, train_loss: 0.8083, test_loss: 0.8404, test_f1: 0.5587
 epoch: 39, train_loss: 0.7836, test_loss: 0.8291, test_f1: 0.5990
 epoch: 40, train_loss: 0.7912, test_loss: 0.8559, test_f1: 0.5373
 epoch: 41, train_loss: 0.7923, test_loss: 0.8384, test_f1: 0.5305
 epoch: 42, train_loss: 0.7890, test_loss: 0.8386, test_f1: 0.5698
 epoch: 43, train_loss: 0.7882, test_loss: 0.8026, test_f1: 0.5987
 epoch: 44, train_loss: 0.7849, test_loss: 0.7622, test_f1: 0.5743
 epoch: 45, train_loss: 0.7847, test_loss: 0.8162, test_f1: 0.5989
 epoch: 46, train_loss: 0.7896, test_loss: 0.8217, test_f1: 0.5438
 epoch: 47, train_loss: 0.7826, test_loss: 0.7699, test_f1: 0.5907
 epoch: 48, train_loss: 0.7707, test_loss: 0.8525, test_f1: 0.5452
 epoch: 49, train_loss: 0.7739, test_loss: 0.8534, test_f1: 0.5536
 epoch: 50, train_loss: 0.7705, test_loss: 0.7753, test_f1: 0.5762
 epoch: 51, train_loss: 0.7380, test_loss: 0.8093, test_f1: 0.5693
 epoch: 52, train_loss: 0.7389, test_loss: 0.8095, test_f1: 0.6317
 epoch: 53, train_loss: 0.7378, test_loss: 0.8342, test_f1: 0.5491
 epoch: 54, train_loss: 0.7201, test_loss: 0.8015, test_f1: 0.6020
 epoch: 55, train_loss: 0.7093, test_loss: 0.7967, test_f1: 0.6012
 epoch: 56, train_loss: 0.7191, test_loss: 0.8044, test_f1: 0.5700
 epoch: 57, train_loss: 0.7251, test_loss: 0.7601, test_f1: 0.6407
 epoch: 58, train_loss: 0.7269, test_loss: 0.8739, test_f1: 0.5632
 epoch: 59, train_loss: 0.7063, test_loss: 0.8610, test_f1: 0.5910
 epoch: 60, train_loss: 0.7237, test_loss: 0.8706, test_f1: 0.6073
 epoch: 61, train_loss: 0.7131, test_loss: 0.9429, test_f1: 0.5807
 epoch: 62, train_loss: 0.7106, test_loss: 0.8533, test_f1: 0.5905
 epoch: 63, train_loss: 0.7092, test_loss: 0.8654, test_f1: 0.6169
 epoch: 64, train_loss: 0.7101, test_loss: 0.8136, test_f1: 0.5835
 epoch: 65, train_loss: 0.6860, test_loss: 0.8376, test_f1: 0.6150
 epoch: 66, train_loss: 0.6931, test_loss: 0.8514, test_f1: 0.6044
 epoch: 67, train_loss: 0.7010, test_loss: 0.7900, test_f1: 0.5735
 epoch: 68, train_loss: 0.6975, test_loss: 0.8123, test_f1: 0.6114
 epoch: 69, train_loss: 0.7141, test_loss: 0.7840, test_f1: 0.5829
 epoch: 70, train_loss: 0.6819, test_loss: 0.8095, test_f1: 0.6303
 epoch: 71, train_loss: 0.6980, test_loss: 0.7991, test_f1: 0.5940
 epoch: 72, train_loss: 0.6823, test_loss: 0.7568, test_f1: 0.6298
 epoch: 73, train_loss: 0.6898, test_loss: 0.7851, test_f1: 0.5793
 epoch: 74, train_loss: 0.6869, test_loss: 0.8202, test_f1: 0.6488
 epoch: 75, train_loss: 0.6774, test_loss: 0.8368, test_f1: 0.5478
 epoch: 76, train_loss: 0.6821, test_loss: 0.8024, test_f1: 0.6179
 epoch: 77, train_loss: 0.6927, test_loss: 0.8667, test_f1: 0.6130
 epoch: 78, train_loss: 0.6749, test_loss: 0.8167, test_f1: 0.5862
 epoch: 79, train_loss: 0.6630, test_loss: 0.7983, test_f1: 0.6189
 epoch: 80, train_loss: 0.6626, test_loss: 0.8331, test_f1: 0.5874
 epoch: 81, train_loss: 0.6819, test_loss: 0.8639, test_f1: 0.6251
 epoch: 82, train_loss: 0.6773, test_loss: 0.7748, test_f1: 0.6144
 epoch: 83, train_loss: 0.6854, test_loss: 0.8318, test_f1: 0.5923
 epoch: 84, train_loss: 0.6892, test_loss: 0.7834, test_f1: 0.6264
 epoch: 85, train_loss: 0.6806, test_loss: 0.8501, test_f1: 0.6024
 epoch: 86, train_loss: 0.6817, test_loss: 0.7751, test_f1: 0.6296
 epoch: 87, train_loss: 0.6698, test_loss: 0.8408, test_f1: 0.5633
 epoch: 88, train_loss: 0.6852, test_loss: 0.9522, test_f1: 0.5983
 epoch: 89, train_loss: 0.7051, test_loss: 0.9083, test_f1: 0.6411
 epoch: 90, train_loss: 0.6569, test_loss: 0.9155, test_f1: 0.5856
 epoch: 91, train_loss: 0.6655, test_loss: 0.8863, test_f1: 0.6007
 epoch: 92, train_loss: 0.6624, test_loss: 0.8694, test_f1: 0.6214
 epoch: 93, train_loss: 0.6539, test_loss: 0.7876, test_f1: 0.6299
 epoch: 94, train_loss: 0.6553, test_loss: 0.7670, test_f1: 0.6560
 epoch: 95, train_loss: 0.6684, test_loss: 0.8669, test_f1: 0.6277
 epoch: 96, train_loss: 0.6579, test_loss: 0.9088, test_f1: 0.6266
 epoch: 97, train_loss: 0.6565, test_loss: 0.7437, test_f1: 0.6527
 epoch: 98, train_loss: 0.6599, test_loss: 0.8222, test_f1: 0.5954
 epoch: 99, train_loss: 0.6450, test_loss: 1.0102, test_f1: 0.5845
##################ITERATION #5 ****************************************
 epoch: 0, train_loss: 1.1428, test_loss: 1.2049, test_f1: 0.4022
 epoch: 1, train_loss: 1.0633, test_loss: 1.0662, test_f1: 0.4523
 epoch: 2, train_loss: 1.0346, test_loss: 1.0645, test_f1: 0.4400
 epoch: 3, train_loss: 1.0237, test_loss: 1.0021, test_f1: 0.4648
 epoch: 4, train_loss: 1.0001, test_loss: 1.0200, test_f1: 0.4581
 epoch: 5, train_loss: 0.9897, test_loss: 1.0300, test_f1: 0.4366
 epoch: 6, train_loss: 0.9705, test_loss: 0.9653, test_f1: 0.5070
 epoch: 7, train_loss: 0.9676, test_loss: 0.9416, test_f1: 0.5115
 epoch: 8, train_loss: 0.9530, test_loss: 0.9907, test_f1: 0.4801
 epoch: 9, train_loss: 0.9548, test_loss: 0.9290, test_f1: 0.4928
 epoch: 10, train_loss: 0.9390, test_loss: 0.9338, test_f1: 0.4763
 epoch: 11, train_loss: 0.9362, test_loss: 0.9554, test_f1: 0.4375
 epoch: 12, train_loss: 0.9229, test_loss: 0.9544, test_f1: 0.5151
 epoch: 13, train_loss: 0.9345, test_loss: 1.0433, test_f1: 0.4631
 epoch: 14, train_loss: 0.9166, test_loss: 0.8781, test_f1: 0.5052
 epoch: 15, train_loss: 0.9201, test_loss: 0.9012, test_f1: 0.5361
 epoch: 16, train_loss: 0.9096, test_loss: 0.9159, test_f1: 0.4975
 epoch: 17, train_loss: 0.8960, test_loss: 0.9139, test_f1: 0.5663
 epoch: 18, train_loss: 0.8915, test_loss: 0.9084, test_f1: 0.4923
 epoch: 19, train_loss: 0.8739, test_loss: 0.9785, test_f1: 0.5103
 epoch: 20, train_loss: 0.8720, test_loss: 1.0105, test_f1: 0.4988
 epoch: 21, train_loss: 0.8823, test_loss: 0.9407, test_f1: 0.4988
 epoch: 22, train_loss: 0.8745, test_loss: 1.1066, test_f1: 0.4278
 epoch: 23, train_loss: 0.8616, test_loss: 0.9376, test_f1: 0.5221
 epoch: 24, train_loss: 0.8635, test_loss: 0.8980, test_f1: 0.5127
 epoch: 25, train_loss: 0.8612, test_loss: 0.9070, test_f1: 0.5185
 epoch: 26, train_loss: 0.8509, test_loss: 0.8814, test_f1: 0.5686
 epoch: 27, train_loss: 0.8589, test_loss: 0.9366, test_f1: 0.5248
 epoch: 28, train_loss: 0.8475, test_loss: 0.9270, test_f1: 0.5149
 epoch: 29, train_loss: 0.8503, test_loss: 0.9363, test_f1: 0.5146
 epoch: 30, train_loss: 0.8345, test_loss: 0.9087, test_f1: 0.5314
 epoch: 31, train_loss: 0.8303, test_loss: 1.0400, test_f1: 0.4841
 epoch: 32, train_loss: 0.8491, test_loss: 1.1158, test_f1: 0.5008
 epoch: 33, train_loss: 0.8469, test_loss: 0.9340, test_f1: 0.4981
 epoch: 34, train_loss: 0.8263, test_loss: 0.8751, test_f1: 0.5341
 epoch: 35, train_loss: 0.8221, test_loss: 0.9029, test_f1: 0.5319
 epoch: 36, train_loss: 0.8264, test_loss: 0.9292, test_f1: 0.6157
 epoch: 37, train_loss: 0.8333, test_loss: 0.8524, test_f1: 0.5445
 epoch: 38, train_loss: 0.8313, test_loss: 0.9438, test_f1: 0.5237
 epoch: 39, train_loss: 0.8249, test_loss: 0.8807, test_f1: 0.5320
 epoch: 40, train_loss: 0.8085, test_loss: 0.9199, test_f1: 0.5005
 epoch: 41, train_loss: 0.8086, test_loss: 0.8831, test_f1: 0.5408
 epoch: 42, train_loss: 0.8055, test_loss: 0.8323, test_f1: 0.5862
 epoch: 43, train_loss: 0.7955, test_loss: 0.8846, test_f1: 0.5340
 epoch: 44, train_loss: 0.7976, test_loss: 0.8691, test_f1: 0.5136
 epoch: 45, train_loss: 0.7916, test_loss: 0.8767, test_f1: 0.5485
 epoch: 46, train_loss: 0.7865, test_loss: 0.9610, test_f1: 0.5478
 epoch: 47, train_loss: 0.7903, test_loss: 0.9264, test_f1: 0.5499
 epoch: 48, train_loss: 0.7727, test_loss: 0.8575, test_f1: 0.5712
 epoch: 49, train_loss: 0.7825, test_loss: 0.8767, test_f1: 0.5456
 epoch: 50, train_loss: 0.7753, test_loss: 0.8915, test_f1: 0.5355
 epoch: 51, train_loss: 0.7534, test_loss: 0.8895, test_f1: 0.5528
 epoch: 52, train_loss: 0.7328, test_loss: 0.8575, test_f1: 0.5552
 epoch: 53, train_loss: 0.7347, test_loss: 0.9094, test_f1: 0.5516
 epoch: 54, train_loss: 0.7296, test_loss: 0.8879, test_f1: 0.5684
 epoch: 55, train_loss: 0.7257, test_loss: 0.9553, test_f1: 0.5908
 epoch: 56, train_loss: 0.7092, test_loss: 0.8796, test_f1: 0.5915
 epoch: 57, train_loss: 0.7181, test_loss: 0.8971, test_f1: 0.5528
 epoch: 58, train_loss: 0.7140, test_loss: 0.9049, test_f1: 0.5666
 epoch: 59, train_loss: 0.7164, test_loss: 0.9080, test_f1: 0.5748
 epoch: 60, train_loss: 0.7164, test_loss: 0.9134, test_f1: 0.5501
 epoch: 61, train_loss: 0.6980, test_loss: 0.9491, test_f1: 0.5531
 epoch: 62, train_loss: 0.7202, test_loss: 0.8703, test_f1: 0.6182
 epoch: 63, train_loss: 0.6989, test_loss: 0.9010, test_f1: 0.6458
 epoch: 64, train_loss: 0.7027, test_loss: 0.9263, test_f1: 0.6003
 epoch: 65, train_loss: 0.6930, test_loss: 0.9703, test_f1: 0.5224
 epoch: 66, train_loss: 0.7025, test_loss: 1.0150, test_f1: 0.5121
 epoch: 67, train_loss: 0.6957, test_loss: 0.8784, test_f1: 0.5844
 epoch: 68, train_loss: 0.6959, test_loss: 0.8612, test_f1: 0.5638
 epoch: 69, train_loss: 0.7016, test_loss: 0.8745, test_f1: 0.5640
 epoch: 70, train_loss: 0.7005, test_loss: 0.8985, test_f1: 0.5588
 epoch: 71, train_loss: 0.6859, test_loss: 0.9243, test_f1: 0.5971
 epoch: 72, train_loss: 0.6934, test_loss: 0.8896, test_f1: 0.6026
 epoch: 73, train_loss: 0.6778, test_loss: 0.7694, test_f1: 0.6585
 epoch: 74, train_loss: 0.6787, test_loss: 0.9308, test_f1: 0.5676
 epoch: 75, train_loss: 0.6855, test_loss: 0.8775, test_f1: 0.5450
 epoch: 76, train_loss: 0.6806, test_loss: 0.9166, test_f1: 0.5618
 epoch: 77, train_loss: 0.6870, test_loss: 0.9560, test_f1: 0.5496
 epoch: 78, train_loss: 0.6718, test_loss: 0.9704, test_f1: 0.6327
 epoch: 79, train_loss: 0.6874, test_loss: 1.0358, test_f1: 0.5510
 epoch: 80, train_loss: 0.6773, test_loss: 0.8826, test_f1: 0.5921
 epoch: 81, train_loss: 0.6600, test_loss: 0.9863, test_f1: 0.6029
 epoch: 82, train_loss: 0.6713, test_loss: 0.8515, test_f1: 0.6268
 epoch: 83, train_loss: 0.6582, test_loss: 0.9253, test_f1: 0.5823
 epoch: 84, train_loss: 0.6506, test_loss: 0.9182, test_f1: 0.6053
 epoch: 85, train_loss: 0.6738, test_loss: 0.9243, test_f1: 0.6252
 epoch: 86, train_loss: 0.6754, test_loss: 0.8996, test_f1: 0.5917
 epoch: 87, train_loss: 0.6664, test_loss: 0.8529, test_f1: 0.6226
 epoch: 88, train_loss: 0.6664, test_loss: 1.0300, test_f1: 0.5290
 epoch: 89, train_loss: 0.6627, test_loss: 0.9569, test_f1: 0.5458
 epoch: 90, train_loss: 0.6687, test_loss: 0.9201, test_f1: 0.6022
 epoch: 91, train_loss: 0.6620, test_loss: 0.9503, test_f1: 0.6016
 epoch: 92, train_loss: 0.6535, test_loss: 1.0345, test_f1: 0.5550
 epoch: 93, train_loss: 0.6625, test_loss: 1.0420, test_f1: 0.5806
 epoch: 94, train_loss: 0.6670, test_loss: 0.9862, test_f1: 0.6189
 epoch: 95, train_loss: 0.6516, test_loss: 0.9307, test_f1: 0.5947
 epoch: 96, train_loss: 0.6584, test_loss: 0.9243, test_f1: 0.6000
 epoch: 97, train_loss: 0.6413, test_loss: 0.9431, test_f1: 0.6025
 epoch: 98, train_loss: 0.6412, test_loss: 0.9132, test_f1: 0.6404
 epoch: 99, train_loss: 0.6368, test_loss: 0.8812, test_f1: 0.6043
##################ITERATION #6 ****************************************
 epoch: 0, train_loss: 1.1530, test_loss: 1.1102, test_f1: 0.3474
 epoch: 1, train_loss: 1.0372, test_loss: 1.1051, test_f1: 0.4069
 epoch: 2, train_loss: 1.0044, test_loss: 1.3980, test_f1: 0.3814
 epoch: 3, train_loss: 1.0069, test_loss: 0.9979, test_f1: 0.4700
 epoch: 4, train_loss: 0.9943, test_loss: 1.1577, test_f1: 0.4187
 epoch: 5, train_loss: 0.9825, test_loss: 1.0559, test_f1: 0.4336
 epoch: 6, train_loss: 0.9714, test_loss: 0.9806, test_f1: 0.4745
 epoch: 7, train_loss: 0.9492, test_loss: 0.9729, test_f1: 0.4895
 epoch: 8, train_loss: 0.9382, test_loss: 1.0266, test_f1: 0.4986
 epoch: 9, train_loss: 0.9435, test_loss: 1.0217, test_f1: 0.4567
 epoch: 10, train_loss: 0.9110, test_loss: 0.9671, test_f1: 0.4444
 epoch: 11, train_loss: 0.9186, test_loss: 0.9730, test_f1: 0.5545
 epoch: 12, train_loss: 0.9086, test_loss: 1.0620, test_f1: 0.4907
 epoch: 13, train_loss: 0.9053, test_loss: 0.8947, test_f1: 0.5169
 epoch: 14, train_loss: 0.8754, test_loss: 0.8532, test_f1: 0.5287
 epoch: 15, train_loss: 0.8705, test_loss: 0.9141, test_f1: 0.5113
 epoch: 16, train_loss: 0.8794, test_loss: 0.9337, test_f1: 0.5157
 epoch: 17, train_loss: 0.8795, test_loss: 0.9009, test_f1: 0.5028
 epoch: 18, train_loss: 0.8673, test_loss: 0.9928, test_f1: 0.4968
 epoch: 19, train_loss: 0.8534, test_loss: 0.9203, test_f1: 0.5452
 epoch: 20, train_loss: 0.8470, test_loss: 0.8629, test_f1: 0.5499
 epoch: 21, train_loss: 0.8309, test_loss: 0.9287, test_f1: 0.4931
 epoch: 22, train_loss: 0.8267, test_loss: 0.8679, test_f1: 0.5538
 epoch: 23, train_loss: 0.8439, test_loss: 0.8958, test_f1: 0.6099
 epoch: 24, train_loss: 0.8302, test_loss: 0.8366, test_f1: 0.6479
 epoch: 25, train_loss: 0.8116, test_loss: 0.8619, test_f1: 0.5590
 epoch: 26, train_loss: 0.8274, test_loss: 0.8167, test_f1: 0.5662
 epoch: 27, train_loss: 0.8070, test_loss: 0.9529, test_f1: 0.5351
 epoch: 28, train_loss: 0.8179, test_loss: 0.9159, test_f1: 0.5713
 epoch: 29, train_loss: 0.7933, test_loss: 0.8675, test_f1: 0.5351
 epoch: 30, train_loss: 0.7994, test_loss: 0.8713, test_f1: 0.5127
 epoch: 31, train_loss: 0.7862, test_loss: 0.9319, test_f1: 0.5366
 epoch: 32, train_loss: 0.8042, test_loss: 0.9505, test_f1: 0.6073
 epoch: 33, train_loss: 0.8038, test_loss: 0.8609, test_f1: 0.5409
 epoch: 34, train_loss: 0.7961, test_loss: 0.8142, test_f1: 0.5638
 epoch: 35, train_loss: 0.7865, test_loss: 0.8705, test_f1: 0.5492
 epoch: 36, train_loss: 0.7742, test_loss: 0.8802, test_f1: 0.5482
 epoch: 37, train_loss: 0.7757, test_loss: 0.8470, test_f1: 0.5544
 epoch: 38, train_loss: 0.7643, test_loss: 0.8407, test_f1: 0.5618
 epoch: 39, train_loss: 0.7824, test_loss: 0.8396, test_f1: 0.6249
 epoch: 40, train_loss: 0.7779, test_loss: 0.8302, test_f1: 0.5685
 epoch: 41, train_loss: 0.7723, test_loss: 0.8982, test_f1: 0.5366
 epoch: 42, train_loss: 0.7619, test_loss: 0.9641, test_f1: 0.5284
 epoch: 43, train_loss: 0.7564, test_loss: 0.8270, test_f1: 0.5482
 epoch: 44, train_loss: 0.7578, test_loss: 0.8056, test_f1: 0.5744
 epoch: 45, train_loss: 0.7670, test_loss: 0.8014, test_f1: 0.6216
 epoch: 46, train_loss: 0.7558, test_loss: 0.8721, test_f1: 0.5941
 epoch: 47, train_loss: 0.7689, test_loss: 0.8940, test_f1: 0.5746
 epoch: 48, train_loss: 0.7515, test_loss: 0.8615, test_f1: 0.5961
 epoch: 49, train_loss: 0.7588, test_loss: 0.8032, test_f1: 0.5962
 epoch: 50, train_loss: 0.7301, test_loss: 0.9030, test_f1: 0.6095
 epoch: 51, train_loss: 0.7147, test_loss: 0.8401, test_f1: 0.5712
 epoch: 52, train_loss: 0.7033, test_loss: 0.8006, test_f1: 0.6283
 epoch: 53, train_loss: 0.6938, test_loss: 0.8601, test_f1: 0.5784
 epoch: 54, train_loss: 0.6919, test_loss: 0.8458, test_f1: 0.6412
 epoch: 55, train_loss: 0.6963, test_loss: 0.8011, test_f1: 0.6483
 epoch: 56, train_loss: 0.6845, test_loss: 0.8259, test_f1: 0.6212
 epoch: 57, train_loss: 0.6870, test_loss: 0.8186, test_f1: 0.6316
 epoch: 58, train_loss: 0.6830, test_loss: 0.8410, test_f1: 0.6234
 epoch: 59, train_loss: 0.6827, test_loss: 0.8276, test_f1: 0.6530
 epoch: 60, train_loss: 0.6794, test_loss: 0.7578, test_f1: 0.6510
 epoch: 61, train_loss: 0.6639, test_loss: 0.8098, test_f1: 0.6137
 epoch: 62, train_loss: 0.6727, test_loss: 0.8632, test_f1: 0.6247
 epoch: 63, train_loss: 0.6757, test_loss: 0.8373, test_f1: 0.6380
 epoch: 64, train_loss: 0.6729, test_loss: 0.8179, test_f1: 0.6035
 epoch: 65, train_loss: 0.6771, test_loss: 0.8797, test_f1: 0.6005
 epoch: 66, train_loss: 0.6768, test_loss: 0.7729, test_f1: 0.6327
 epoch: 67, train_loss: 0.6558, test_loss: 0.8156, test_f1: 0.6369
 epoch: 68, train_loss: 0.6628, test_loss: 0.8126, test_f1: 0.6163
 epoch: 69, train_loss: 0.6623, test_loss: 0.8220, test_f1: 0.6324
 epoch: 70, train_loss: 0.6395, test_loss: 0.7922, test_f1: 0.6098
 epoch: 71, train_loss: 0.6516, test_loss: 0.8209, test_f1: 0.6499
 epoch: 72, train_loss: 0.6661, test_loss: 0.8036, test_f1: 0.6173
 epoch: 73, train_loss: 0.6675, test_loss: 0.8082, test_f1: 0.6279
 epoch: 74, train_loss: 0.6513, test_loss: 0.7968, test_f1: 0.6274
 epoch: 75, train_loss: 0.6716, test_loss: 0.7421, test_f1: 0.6161
 epoch: 76, train_loss: 0.6499, test_loss: 0.8518, test_f1: 0.6380
 epoch: 77, train_loss: 0.6514, test_loss: 0.8130, test_f1: 0.6234
 epoch: 78, train_loss: 0.6565, test_loss: 0.8758, test_f1: 0.6356
 epoch: 79, train_loss: 0.6438, test_loss: 0.7783, test_f1: 0.6445
 epoch: 80, train_loss: 0.6454, test_loss: 0.8969, test_f1: 0.6195
 epoch: 81, train_loss: 0.6499, test_loss: 0.7811, test_f1: 0.5911
 epoch: 82, train_loss: 0.6384, test_loss: 0.7488, test_f1: 0.5987
 epoch: 83, train_loss: 0.6565, test_loss: 0.7464, test_f1: 0.6236
 epoch: 84, train_loss: 0.6387, test_loss: 0.8022, test_f1: 0.5995
 epoch: 85, train_loss: 0.6512, test_loss: 0.7227, test_f1: 0.6399
 epoch: 86, train_loss: 0.6233, test_loss: 0.7620, test_f1: 0.5880
 epoch: 87, train_loss: 0.6325, test_loss: 0.7501, test_f1: 0.6506
 epoch: 88, train_loss: 0.6267, test_loss: 0.7463, test_f1: 0.6410
 epoch: 89, train_loss: 0.6421, test_loss: 0.8184, test_f1: 0.6248
 epoch: 90, train_loss: 0.6367, test_loss: 0.8641, test_f1: 0.5843
 epoch: 91, train_loss: 0.6323, test_loss: 0.7541, test_f1: 0.6128
 epoch: 92, train_loss: 0.6208, test_loss: 0.7834, test_f1: 0.6156
 epoch: 93, train_loss: 0.6116, test_loss: 0.7494, test_f1: 0.6191
 epoch: 94, train_loss: 0.6377, test_loss: 0.8329, test_f1: 0.5775
 epoch: 95, train_loss: 0.6318, test_loss: 0.7951, test_f1: 0.6259
 epoch: 96, train_loss: 0.6342, test_loss: 0.8532, test_f1: 0.6149
 epoch: 97, train_loss: 0.6359, test_loss: 0.8482, test_f1: 0.6141
 epoch: 98, train_loss: 0.6184, test_loss: 0.7735, test_f1: 0.6251
 epoch: 99, train_loss: 0.6113, test_loss: 0.8170, test_f1: 0.6326
##################ITERATION #7 ****************************************
 epoch: 0, train_loss: 1.1557, test_loss: 1.2615, test_f1: 0.4156
 epoch: 1, train_loss: 1.0512, test_loss: 0.9721, test_f1: 0.4508
 epoch: 2, train_loss: 1.0231, test_loss: 0.9770, test_f1: 0.4927
 epoch: 3, train_loss: 0.9944, test_loss: 1.0588, test_f1: 0.4644
 epoch: 4, train_loss: 0.9908, test_loss: 1.0504, test_f1: 0.5185
 epoch: 5, train_loss: 0.9600, test_loss: 1.0039, test_f1: 0.4839
 epoch: 6, train_loss: 0.9537, test_loss: 1.1212, test_f1: 0.4056
 epoch: 7, train_loss: 0.9566, test_loss: 1.0785, test_f1: 0.5211
 epoch: 8, train_loss: 0.9260, test_loss: 1.1697, test_f1: 0.4175
 epoch: 9, train_loss: 0.9510, test_loss: 1.0521, test_f1: 0.4879
 epoch: 10, train_loss: 0.9061, test_loss: 1.0104, test_f1: 0.4586
 epoch: 11, train_loss: 0.9233, test_loss: 0.9712, test_f1: 0.4864
 epoch: 12, train_loss: 0.8931, test_loss: 0.9786, test_f1: 0.5055
 epoch: 13, train_loss: 0.8875, test_loss: 0.9331, test_f1: 0.5370
 epoch: 14, train_loss: 0.9184, test_loss: 0.9301, test_f1: 0.5136
 epoch: 15, train_loss: 0.9229, test_loss: 0.9767, test_f1: 0.4837
 epoch: 16, train_loss: 0.9001, test_loss: 0.9985, test_f1: 0.5187
 epoch: 17, train_loss: 0.8799, test_loss: 0.9252, test_f1: 0.5234
 epoch: 18, train_loss: 0.8819, test_loss: 0.8717, test_f1: 0.5234
 epoch: 19, train_loss: 0.8753, test_loss: 0.9316, test_f1: 0.4794
 epoch: 20, train_loss: 0.8604, test_loss: 0.9144, test_f1: 0.5258
 epoch: 21, train_loss: 0.8626, test_loss: 1.0757, test_f1: 0.5036
 epoch: 22, train_loss: 0.8666, test_loss: 0.8890, test_f1: 0.5423
 epoch: 23, train_loss: 0.8473, test_loss: 0.8549, test_f1: 0.5399
 epoch: 24, train_loss: 0.8370, test_loss: 0.8472, test_f1: 0.5473
 epoch: 25, train_loss: 0.8287, test_loss: 0.8759, test_f1: 0.5011
 epoch: 26, train_loss: 0.8292, test_loss: 0.8290, test_f1: 0.5212
 epoch: 27, train_loss: 0.8325, test_loss: 0.8843, test_f1: 0.5011
 epoch: 28, train_loss: 0.8280, test_loss: 0.8220, test_f1: 0.5364
 epoch: 29, train_loss: 0.8250, test_loss: 0.9994, test_f1: 0.4583
 epoch: 30, train_loss: 0.8219, test_loss: 0.8221, test_f1: 0.5290
 epoch: 31, train_loss: 0.8087, test_loss: 0.8643, test_f1: 0.5370
 epoch: 32, train_loss: 0.8004, test_loss: 0.8513, test_f1: 0.5891
 epoch: 33, train_loss: 0.8195, test_loss: 0.9195, test_f1: 0.4932
 epoch: 34, train_loss: 0.8106, test_loss: 0.9352, test_f1: 0.5191
 epoch: 35, train_loss: 0.8044, test_loss: 0.8707, test_f1: 0.5255
 epoch: 36, train_loss: 0.8052, test_loss: 0.8703, test_f1: 0.5346
 epoch: 37, train_loss: 0.8047, test_loss: 0.8948, test_f1: 0.5291
 epoch: 38, train_loss: 0.8053, test_loss: 0.8324, test_f1: 0.5858
 epoch: 39, train_loss: 0.7970, test_loss: 0.8880, test_f1: 0.5189
 epoch: 40, train_loss: 0.8115, test_loss: 0.8755, test_f1: 0.5254
 epoch: 41, train_loss: 0.7994, test_loss: 0.8578, test_f1: 0.5586
 epoch: 42, train_loss: 0.7969, test_loss: 0.8934, test_f1: 0.5060
 epoch: 43, train_loss: 0.7910, test_loss: 0.8337, test_f1: 0.5305
 epoch: 44, train_loss: 0.7909, test_loss: 0.8925, test_f1: 0.5405
 epoch: 45, train_loss: 0.7700, test_loss: 0.8899, test_f1: 0.5597
 epoch: 46, train_loss: 0.7911, test_loss: 0.8609, test_f1: 0.5888
 epoch: 47, train_loss: 0.7759, test_loss: 0.9296, test_f1: 0.4825
 epoch: 48, train_loss: 0.7640, test_loss: 0.9337, test_f1: 0.5428
 epoch: 49, train_loss: 0.7526, test_loss: 0.9065, test_f1: 0.5354
 epoch: 50, train_loss: 0.7556, test_loss: 0.9865, test_f1: 0.5147
 epoch: 51, train_loss: 0.7815, test_loss: 0.7856, test_f1: 0.5627
 epoch: 52, train_loss: 0.7325, test_loss: 0.7968, test_f1: 0.5733
 epoch: 53, train_loss: 0.7413, test_loss: 0.8276, test_f1: 0.5631
 epoch: 54, train_loss: 0.7271, test_loss: 0.8630, test_f1: 0.5616
 epoch: 55, train_loss: 0.7124, test_loss: 0.8808, test_f1: 0.5510
 epoch: 56, train_loss: 0.7138, test_loss: 0.8085, test_f1: 0.5814
 epoch: 57, train_loss: 0.7163, test_loss: 0.8568, test_f1: 0.5358
 epoch: 58, train_loss: 0.7112, test_loss: 0.7930, test_f1: 0.6066
 epoch: 59, train_loss: 0.7056, test_loss: 0.8015, test_f1: 0.6097
 epoch: 60, train_loss: 0.6969, test_loss: 0.8367, test_f1: 0.5578
 epoch: 61, train_loss: 0.7089, test_loss: 0.8233, test_f1: 0.5779
 epoch: 62, train_loss: 0.6985, test_loss: 0.8255, test_f1: 0.5634
 epoch: 63, train_loss: 0.7066, test_loss: 0.8551, test_f1: 0.5480
 epoch: 64, train_loss: 0.7113, test_loss: 0.8816, test_f1: 0.5428
 epoch: 65, train_loss: 0.6882, test_loss: 0.9053, test_f1: 0.5680
 epoch: 66, train_loss: 0.6928, test_loss: 0.8096, test_f1: 0.5656
 epoch: 67, train_loss: 0.6954, test_loss: 0.8291, test_f1: 0.5684
 epoch: 68, train_loss: 0.6869, test_loss: 0.8936, test_f1: 0.5363
 epoch: 69, train_loss: 0.6948, test_loss: 0.8296, test_f1: 0.5670
 epoch: 70, train_loss: 0.6857, test_loss: 0.8525, test_f1: 0.5704
 epoch: 71, train_loss: 0.6872, test_loss: 0.8204, test_f1: 0.5861
 epoch: 72, train_loss: 0.6905, test_loss: 0.8353, test_f1: 0.5522
 epoch: 73, train_loss: 0.6844, test_loss: 0.8810, test_f1: 0.5654
 epoch: 74, train_loss: 0.6740, test_loss: 0.7842, test_f1: 0.6089
 epoch: 75, train_loss: 0.6773, test_loss: 0.8861, test_f1: 0.6145
 epoch: 76, train_loss: 0.6902, test_loss: 0.8472, test_f1: 0.5872
 epoch: 77, train_loss: 0.6796, test_loss: 0.8993, test_f1: 0.5541
 epoch: 78, train_loss: 0.6762, test_loss: 0.8753, test_f1: 0.6271
 epoch: 79, train_loss: 0.6657, test_loss: 0.9067, test_f1: 0.5451
 epoch: 80, train_loss: 0.6788, test_loss: 0.9350, test_f1: 0.5980
 epoch: 81, train_loss: 0.6710, test_loss: 0.8955, test_f1: 0.5794
 epoch: 82, train_loss: 0.6577, test_loss: 0.9112, test_f1: 0.5739
 epoch: 83, train_loss: 0.6636, test_loss: 0.9967, test_f1: 0.5596
 epoch: 84, train_loss: 0.6664, test_loss: 0.8914, test_f1: 0.5888
 epoch: 85, train_loss: 0.6724, test_loss: 0.8520, test_f1: 0.5600
 epoch: 86, train_loss: 0.6544, test_loss: 0.9029, test_f1: 0.5632
 epoch: 87, train_loss: 0.6669, test_loss: 0.8969, test_f1: 0.5880
 epoch: 88, train_loss: 0.6737, test_loss: 0.8394, test_f1: 0.5933
 epoch: 89, train_loss: 0.6695, test_loss: 0.8708, test_f1: 0.5665
 epoch: 90, train_loss: 0.6530, test_loss: 0.8792, test_f1: 0.5640
 epoch: 91, train_loss: 0.6793, test_loss: 0.9906, test_f1: 0.5626
 epoch: 92, train_loss: 0.6525, test_loss: 0.8948, test_f1: 0.5648
 epoch: 93, train_loss: 0.6587, test_loss: 0.8491, test_f1: 0.5741
 epoch: 94, train_loss: 0.6537, test_loss: 0.8099, test_f1: 0.5853
 epoch: 95, train_loss: 0.6481, test_loss: 0.8091, test_f1: 0.5654
 epoch: 96, train_loss: 0.6593, test_loss: 0.8356, test_f1: 0.5680
 epoch: 97, train_loss: 0.6554, test_loss: 0.8889, test_f1: 0.5585
 epoch: 98, train_loss: 0.6561, test_loss: 0.8078, test_f1: 0.5707
 epoch: 99, train_loss: 0.6564, test_loss: 0.8482, test_f1: 0.5923
##################ITERATION #8 ****************************************
 epoch: 0, train_loss: 1.1453, test_loss: 1.0469, test_f1: 0.4555
 epoch: 1, train_loss: 1.0345, test_loss: 0.9944, test_f1: 0.4503
 epoch: 2, train_loss: 1.0101, test_loss: 1.0454, test_f1: 0.4489
 epoch: 3, train_loss: 0.9924, test_loss: 0.9845, test_f1: 0.4841
 epoch: 4, train_loss: 0.9682, test_loss: 0.9636, test_f1: 0.5197
 epoch: 5, train_loss: 0.9592, test_loss: 1.0139, test_f1: 0.4962
 epoch: 6, train_loss: 0.9332, test_loss: 0.9185, test_f1: 0.4958
 epoch: 7, train_loss: 0.9159, test_loss: 1.0600, test_f1: 0.4769
 epoch: 8, train_loss: 0.9028, test_loss: 0.9204, test_f1: 0.5046
 epoch: 9, train_loss: 0.8897, test_loss: 0.8831, test_f1: 0.5211
 epoch: 10, train_loss: 0.8789, test_loss: 1.1800, test_f1: 0.4995
 epoch: 11, train_loss: 0.8841, test_loss: 0.9561, test_f1: 0.5448
 epoch: 12, train_loss: 0.8879, test_loss: 1.1740, test_f1: 0.4962
 epoch: 13, train_loss: 0.8859, test_loss: 0.8989, test_f1: 0.5378
 epoch: 14, train_loss: 0.8843, test_loss: 0.9310, test_f1: 0.4984
 epoch: 15, train_loss: 0.8653, test_loss: 1.0171, test_f1: 0.4750
 epoch: 16, train_loss: 0.8514, test_loss: 0.8999, test_f1: 0.5259
 epoch: 17, train_loss: 0.8541, test_loss: 0.8900, test_f1: 0.5493
 epoch: 18, train_loss: 0.8563, test_loss: 0.9272, test_f1: 0.5239
 epoch: 19, train_loss: 0.8614, test_loss: 1.1409, test_f1: 0.4353
 epoch: 20, train_loss: 0.8477, test_loss: 0.8504, test_f1: 0.5323
 epoch: 21, train_loss: 0.8578, test_loss: 1.0268, test_f1: 0.5240
 epoch: 22, train_loss: 0.8515, test_loss: 0.8280, test_f1: 0.5613
 epoch: 23, train_loss: 0.8261, test_loss: 0.8224, test_f1: 0.5268
 epoch: 24, train_loss: 0.8228, test_loss: 0.8055, test_f1: 0.5308
 epoch: 25, train_loss: 0.8138, test_loss: 0.8006, test_f1: 0.5329
 epoch: 26, train_loss: 0.8027, test_loss: 0.8020, test_f1: 0.5534
 epoch: 27, train_loss: 0.8002, test_loss: 0.8183, test_f1: 0.5888
 epoch: 28, train_loss: 0.7995, test_loss: 0.8272, test_f1: 0.5683
 epoch: 29, train_loss: 0.8015, test_loss: 0.9081, test_f1: 0.5255
 epoch: 30, train_loss: 0.7832, test_loss: 0.8494, test_f1: 0.5665
 epoch: 31, train_loss: 0.8001, test_loss: 0.8319, test_f1: 0.5924
 epoch: 32, train_loss: 0.7964, test_loss: 0.8406, test_f1: 0.5404
 epoch: 33, train_loss: 0.7747, test_loss: 0.7669, test_f1: 0.6081
 epoch: 34, train_loss: 0.7848, test_loss: 0.8016, test_f1: 0.6036
 epoch: 35, train_loss: 0.7794, test_loss: 0.7735, test_f1: 0.5511
 epoch: 36, train_loss: 0.7772, test_loss: 0.7710, test_f1: 0.5778
 epoch: 37, train_loss: 0.7768, test_loss: 0.7791, test_f1: 0.5565
 epoch: 38, train_loss: 0.7838, test_loss: 0.8107, test_f1: 0.5470
 epoch: 39, train_loss: 0.7585, test_loss: 0.8237, test_f1: 0.5391
 epoch: 40, train_loss: 0.7570, test_loss: 0.7954, test_f1: 0.5626
 epoch: 41, train_loss: 0.7769, test_loss: 0.7944, test_f1: 0.5756
 epoch: 42, train_loss: 0.7504, test_loss: 0.7796, test_f1: 0.6010
 epoch: 43, train_loss: 0.7398, test_loss: 0.7728, test_f1: 0.5494
 epoch: 44, train_loss: 0.7706, test_loss: 0.8754, test_f1: 0.5240
 epoch: 45, train_loss: 0.7557, test_loss: 0.7780, test_f1: 0.5654
 epoch: 46, train_loss: 0.7191, test_loss: 0.8199, test_f1: 0.5205
 epoch: 47, train_loss: 0.7577, test_loss: 0.7805, test_f1: 0.5646
 epoch: 48, train_loss: 0.7410, test_loss: 0.8879, test_f1: 0.5350
 epoch: 49, train_loss: 0.7458, test_loss: 0.7756, test_f1: 0.5258
 epoch: 50, train_loss: 0.7412, test_loss: 0.8152, test_f1: 0.5434
 epoch: 51, train_loss: 0.7086, test_loss: 0.7739, test_f1: 0.5684
 epoch: 52, train_loss: 0.6854, test_loss: 0.7794, test_f1: 0.5780
 epoch: 53, train_loss: 0.6990, test_loss: 0.7547, test_f1: 0.6204
 epoch: 54, train_loss: 0.6866, test_loss: 0.7559, test_f1: 0.6396
 epoch: 55, train_loss: 0.6916, test_loss: 0.7397, test_f1: 0.6242
 epoch: 56, train_loss: 0.6893, test_loss: 0.8103, test_f1: 0.5715
 epoch: 57, train_loss: 0.6924, test_loss: 0.7958, test_f1: 0.6102
 epoch: 58, train_loss: 0.6731, test_loss: 0.7466, test_f1: 0.5834
 epoch: 59, train_loss: 0.6782, test_loss: 0.8083, test_f1: 0.6082
 epoch: 60, train_loss: 0.6813, test_loss: 0.7749, test_f1: 0.6214
 epoch: 61, train_loss: 0.6780, test_loss: 0.7523, test_f1: 0.6213
 epoch: 62, train_loss: 0.6786, test_loss: 0.8188, test_f1: 0.5772
 epoch: 63, train_loss: 0.6679, test_loss: 0.8434, test_f1: 0.5544
 epoch: 64, train_loss: 0.6718, test_loss: 0.7773, test_f1: 0.6133
 epoch: 65, train_loss: 0.6604, test_loss: 0.7758, test_f1: 0.5892
 epoch: 66, train_loss: 0.6641, test_loss: 0.7933, test_f1: 0.6186
 epoch: 67, train_loss: 0.6604, test_loss: 0.7640, test_f1: 0.5792
 epoch: 68, train_loss: 0.6616, test_loss: 0.7769, test_f1: 0.5685
 epoch: 69, train_loss: 0.6606, test_loss: 0.7789, test_f1: 0.6120
 epoch: 70, train_loss: 0.6518, test_loss: 0.7474, test_f1: 0.5965
 epoch: 71, train_loss: 0.6576, test_loss: 0.7712, test_f1: 0.5889
 epoch: 72, train_loss: 0.6551, test_loss: 0.8293, test_f1: 0.6129
 epoch: 73, train_loss: 0.6869, test_loss: 0.7515, test_f1: 0.6170
 epoch: 74, train_loss: 0.6489, test_loss: 0.7524, test_f1: 0.5766
 epoch: 75, train_loss: 0.6362, test_loss: 0.8660, test_f1: 0.6034
 epoch: 76, train_loss: 0.6332, test_loss: 0.7923, test_f1: 0.5651
 epoch: 77, train_loss: 0.6356, test_loss: 0.7797, test_f1: 0.5934
 epoch: 78, train_loss: 0.6446, test_loss: 0.9060, test_f1: 0.6127
 epoch: 79, train_loss: 0.6356, test_loss: 0.8935, test_f1: 0.5691
 epoch: 80, train_loss: 0.6437, test_loss: 0.7839, test_f1: 0.5852
 epoch: 81, train_loss: 0.6549, test_loss: 0.7510, test_f1: 0.6126
 epoch: 82, train_loss: 0.6138, test_loss: 0.7193, test_f1: 0.5912
 epoch: 83, train_loss: 0.6496, test_loss: 0.7475, test_f1: 0.6218
 epoch: 84, train_loss: 0.6310, test_loss: 0.7895, test_f1: 0.6578
 epoch: 85, train_loss: 0.6482, test_loss: 0.7489, test_f1: 0.6219
 epoch: 86, train_loss: 0.6349, test_loss: 0.7244, test_f1: 0.6276
 epoch: 87, train_loss: 0.6190, test_loss: 0.7699, test_f1: 0.6110
 epoch: 88, train_loss: 0.6266, test_loss: 0.7424, test_f1: 0.6276
 epoch: 89, train_loss: 0.6210, test_loss: 0.7354, test_f1: 0.6141
 epoch: 90, train_loss: 0.6235, test_loss: 0.8032, test_f1: 0.6425
 epoch: 91, train_loss: 0.6280, test_loss: 0.7919, test_f1: 0.6128
 epoch: 92, train_loss: 0.6173, test_loss: 0.8781, test_f1: 0.6395
 epoch: 93, train_loss: 0.6158, test_loss: 0.7791, test_f1: 0.6368
 epoch: 94, train_loss: 0.6183, test_loss: 0.7473, test_f1: 0.6102
 epoch: 95, train_loss: 0.6276, test_loss: 0.8068, test_f1: 0.6477
 epoch: 96, train_loss: 0.6117, test_loss: 0.7940, test_f1: 0.6318
 epoch: 97, train_loss: 0.6134, test_loss: 0.7819, test_f1: 0.6471
 epoch: 98, train_loss: 0.6183, test_loss: 0.8184, test_f1: 0.5901
 epoch: 99, train_loss: 0.6205, test_loss: 0.8169, test_f1: 0.5990
##################ITERATION #9 ****************************************
 epoch: 0, train_loss: 1.1272, test_loss: 1.1721, test_f1: 0.4397
 epoch: 1, train_loss: 1.0186, test_loss: 1.0833, test_f1: 0.5080
 epoch: 2, train_loss: 0.9867, test_loss: 1.0144, test_f1: 0.4796
 epoch: 3, train_loss: 0.9524, test_loss: 1.0425, test_f1: 0.5005
 epoch: 4, train_loss: 0.9508, test_loss: 0.9870, test_f1: 0.4776
 epoch: 5, train_loss: 0.9347, test_loss: 1.0796, test_f1: 0.4345
 epoch: 6, train_loss: 0.9092, test_loss: 0.9940, test_f1: 0.4524
 epoch: 7, train_loss: 0.9237, test_loss: 0.8953, test_f1: 0.4750
 epoch: 8, train_loss: 0.8986, test_loss: 1.0492, test_f1: 0.4658
 epoch: 9, train_loss: 0.8955, test_loss: 0.9679, test_f1: 0.5127
 epoch: 10, train_loss: 0.8886, test_loss: 1.0072, test_f1: 0.5003
 epoch: 11, train_loss: 0.8672, test_loss: 0.9707, test_f1: 0.4555
 epoch: 12, train_loss: 0.8677, test_loss: 0.9181, test_f1: 0.4988
 epoch: 13, train_loss: 0.8542, test_loss: 0.9343, test_f1: 0.5116
 epoch: 14, train_loss: 0.8586, test_loss: 0.9420, test_f1: 0.5270
 epoch: 15, train_loss: 0.8611, test_loss: 1.0015, test_f1: 0.5066
 epoch: 16, train_loss: 0.8536, test_loss: 0.8154, test_f1: 0.5272
 epoch: 17, train_loss: 0.8419, test_loss: 0.8873, test_f1: 0.5020
 epoch: 18, train_loss: 0.8390, test_loss: 0.9839, test_f1: 0.5007
 epoch: 19, train_loss: 0.8336, test_loss: 1.0171, test_f1: 0.5018
 epoch: 20, train_loss: 0.8509, test_loss: 1.0396, test_f1: 0.4679
 epoch: 21, train_loss: 0.8253, test_loss: 0.8994, test_f1: 0.5009
 epoch: 22, train_loss: 0.8113, test_loss: 1.0998, test_f1: 0.4934
 epoch: 23, train_loss: 0.8199, test_loss: 0.8925, test_f1: 0.5295
 epoch: 24, train_loss: 0.8116, test_loss: 0.8939, test_f1: 0.5257
 epoch: 25, train_loss: 0.7952, test_loss: 0.9014, test_f1: 0.4857
 epoch: 26, train_loss: 0.7918, test_loss: 0.9625, test_f1: 0.5236
 epoch: 27, train_loss: 0.8064, test_loss: 0.9138, test_f1: 0.5418
 epoch: 28, train_loss: 0.7956, test_loss: 0.9241, test_f1: 0.5362
 epoch: 29, train_loss: 0.7789, test_loss: 0.9021, test_f1: 0.5951
 epoch: 30, train_loss: 0.7839, test_loss: 0.9322, test_f1: 0.6014
 epoch: 31, train_loss: 0.7925, test_loss: 0.8777, test_f1: 0.5474
 epoch: 32, train_loss: 0.7696, test_loss: 0.8385, test_f1: 0.5444
 epoch: 33, train_loss: 0.7988, test_loss: 0.9679, test_f1: 0.5116
 epoch: 34, train_loss: 0.7757, test_loss: 0.9040, test_f1: 0.6210
 epoch: 35, train_loss: 0.7805, test_loss: 0.9507, test_f1: 0.5192
 epoch: 36, train_loss: 0.7796, test_loss: 0.8062, test_f1: 0.5182
 epoch: 37, train_loss: 0.7773, test_loss: 0.9663, test_f1: 0.5282
 epoch: 38, train_loss: 0.7677, test_loss: 0.9437, test_f1: 0.5434
 epoch: 39, train_loss: 0.7601, test_loss: 0.9049, test_f1: 0.5307
 epoch: 40, train_loss: 0.7713, test_loss: 0.9301, test_f1: 0.6246
 epoch: 41, train_loss: 0.7558, test_loss: 0.8965, test_f1: 0.5150
 epoch: 42, train_loss: 0.7574, test_loss: 0.9143, test_f1: 0.5244
 epoch: 43, train_loss: 0.7677, test_loss: 0.8505, test_f1: 0.5982
 epoch: 44, train_loss: 0.7642, test_loss: 0.8802, test_f1: 0.5931
 epoch: 45, train_loss: 0.7581, test_loss: 0.8363, test_f1: 0.6474
 epoch: 46, train_loss: 0.7416, test_loss: 0.8733, test_f1: 0.5997
 epoch: 47, train_loss: 0.7406, test_loss: 0.8798, test_f1: 0.6316
 epoch: 48, train_loss: 0.7444, test_loss: 0.9481, test_f1: 0.6046
 epoch: 49, train_loss: 0.7334, test_loss: 0.8799, test_f1: 0.5572
 epoch: 50, train_loss: 0.7729, test_loss: 0.9668, test_f1: 0.5058
 epoch: 51, train_loss: 0.7279, test_loss: 0.8667, test_f1: 0.6152
 epoch: 52, train_loss: 0.7101, test_loss: 0.8275, test_f1: 0.6273
 epoch: 53, train_loss: 0.7071, test_loss: 0.8561, test_f1: 0.6357
 epoch: 54, train_loss: 0.6955, test_loss: 0.9013, test_f1: 0.6234
 epoch: 55, train_loss: 0.7106, test_loss: 0.8874, test_f1: 0.6333
 epoch: 56, train_loss: 0.6752, test_loss: 0.8980, test_f1: 0.6095
 epoch: 57, train_loss: 0.6870, test_loss: 0.9509, test_f1: 0.6098
 epoch: 58, train_loss: 0.6875, test_loss: 0.8958, test_f1: 0.6352
 epoch: 59, train_loss: 0.6798, test_loss: 0.9393, test_f1: 0.5855
 epoch: 60, train_loss: 0.6815, test_loss: 0.9920, test_f1: 0.6155
 epoch: 61, train_loss: 0.6751, test_loss: 0.9324, test_f1: 0.6174
 epoch: 62, train_loss: 0.6737, test_loss: 0.9067, test_f1: 0.6103
 epoch: 63, train_loss: 0.6684, test_loss: 0.9606, test_f1: 0.6353
 epoch: 64, train_loss: 0.6778, test_loss: 0.8749, test_f1: 0.5729
 epoch: 65, train_loss: 0.6667, test_loss: 0.8573, test_f1: 0.6217
 epoch: 66, train_loss: 0.6577, test_loss: 0.9328, test_f1: 0.6325
 epoch: 67, train_loss: 0.6705, test_loss: 1.0277, test_f1: 0.6104
 epoch: 68, train_loss: 0.6688, test_loss: 0.8510, test_f1: 0.6392
 epoch: 69, train_loss: 0.6713, test_loss: 0.9031, test_f1: 0.6356
 epoch: 70, train_loss: 0.6581, test_loss: 0.9220, test_f1: 0.6345
 epoch: 71, train_loss: 0.6578, test_loss: 0.9194, test_f1: 0.5787
 epoch: 72, train_loss: 0.6788, test_loss: 0.9330, test_f1: 0.6388
 epoch: 73, train_loss: 0.6496, test_loss: 0.9722, test_f1: 0.6387
 epoch: 74, train_loss: 0.6519, test_loss: 0.9785, test_f1: 0.6301
 epoch: 75, train_loss: 0.6622, test_loss: 1.0044, test_f1: 0.6023
 epoch: 76, train_loss: 0.6498, test_loss: 0.9594, test_f1: 0.6197
 epoch: 77, train_loss: 0.6520, test_loss: 0.9248, test_f1: 0.6617
 epoch: 78, train_loss: 0.6499, test_loss: 0.9728, test_f1: 0.6255
 epoch: 79, train_loss: 0.6646, test_loss: 0.8854, test_f1: 0.6222
 epoch: 80, train_loss: 0.6583, test_loss: 0.9491, test_f1: 0.6459
 epoch: 81, train_loss: 0.6462, test_loss: 0.9770, test_f1: 0.6252
 epoch: 82, train_loss: 0.6394, test_loss: 0.9471, test_f1: 0.6340
 epoch: 83, train_loss: 0.6533, test_loss: 0.9204, test_f1: 0.6369
 epoch: 84, train_loss: 0.6252, test_loss: 0.8909, test_f1: 0.6665
 epoch: 85, train_loss: 0.6394, test_loss: 0.8778, test_f1: 0.6561
 epoch: 86, train_loss: 0.6315, test_loss: 0.9056, test_f1: 0.6625
 epoch: 87, train_loss: 0.6435, test_loss: 0.8855, test_f1: 0.6464
 epoch: 88, train_loss: 0.6423, test_loss: 0.8942, test_f1: 0.6609
 epoch: 89, train_loss: 0.6294, test_loss: 0.8874, test_f1: 0.6737
 epoch: 90, train_loss: 0.6199, test_loss: 0.9517, test_f1: 0.6809
 epoch: 91, train_loss: 0.6166, test_loss: 0.9722, test_f1: 0.6635
 epoch: 92, train_loss: 0.6204, test_loss: 1.0480, test_f1: 0.6460
 epoch: 93, train_loss: 0.6311, test_loss: 0.9788, test_f1: 0.6657
 epoch: 94, train_loss: 0.6325, test_loss: 0.9771, test_f1: 0.6489
 epoch: 95, train_loss: 0.6282, test_loss: 1.0242, test_f1: 0.6305
 epoch: 96, train_loss: 0.6454, test_loss: 0.9291, test_f1: 0.6518
 epoch: 97, train_loss: 0.6244, test_loss: 0.9032, test_f1: 0.6537
 epoch: 98, train_loss: 0.6220, test_loss: 0.9550, test_f1: 0.6351
 epoch: 99, train_loss: 0.6119, test_loss: 1.0143, test_f1: 0.6298

Training completed in 1423.64 seconds
Best F1: 0.6829 at epoch 93
Mean F1 across iterations: 0.6575  0.0198
========================FINAL RESULTS================================
FEGIN weighted F1: 0.6829  0.0198
python main.py --data ltspice_examples --representation component_pin --model FEGIN --layers 6 --hiddens 32 --batch_size 32 --lr 0.01 --emb_size 512 --epochs 100 --save_appendix component_pin_L6_H32_BS32_LR0.01_E512 --no_val
-----



STDERR:
  File "main.py", line 370, in <module>
    main()
  File "main.py", line 254, in main
    dataset = dataset_class(
  File "/home/philip/projects/ltspice_examples_code_repo/Circuit-Completion-Using-GNNs/component_classification_with_link_prediction_head/evaluation/FEGIN/kernel/circuit_datasets.py", line 15, in __init__
    self.data, self.slices = torch.load(self.processed_paths[0])
  File "/home/philip/.local/lib/python3.8/site-packages/torch/serialization.py", line 1040, in load
    warnings.warn(
  File "/usr/lib/python3.8/warnings.py", line 109, in _showwarnmsg
    sw(msg.message, msg.category, msg.filename, msg.lineno,
  File "main.py", line 47, in warn_with_traceback
    traceback.print_stack(file=log)
/home/philip/projects/ltspice_examples_code_repo/Circuit-Completion-Using-GNNs/component_classification_with_link_prediction_head/evaluation/FEGIN/kernel/circuit_datasets.py:15: FutureWarning: You are using `torch.load` with `weights_only=False` (the current default value), which uses the default pickle module implicitly. It is possible to construct malicious pickle data which will execute arbitrary code during unpickling (See https://github.com/pytorch/pytorch/blob/main/SECURITY.md#untrusted-models for more details). In a future release, the default value for `weights_only` will be flipped to `True`. This limits the functions that could be executed during unpickling. Arbitrary objects will no longer be allowed to be loaded via this mode unless they are explicitly allowlisted by the user via `torch.serialization.add_safe_globals`. We recommend you start setting `weights_only=True` for any use case where you don't have full control of the loaded file. Please open an issue on GitHub for any issues related to this experimental feature.
  self.data, self.slices = torch.load(self.processed_paths[0])
