STDOUT:
Results will be saved in /home/philip/projects/llm_inference_code_repo/Circuit-Completion-Using-GNNs/component_classification_with_link_prediction_head/evaluation/FEGIN/results/model_FEGIN_dataset_ltspice_examples
Command line input: python main.py --data ltspice_examples --representation component_net --model FEGIN --layers 2 --hiddens 128 --batch_size 32 --lr 0.0001 --emb_size 128 --epochs 100 --save_appendix component_net_L2_H128_BS32_LR0.0001_E128 --no_val
 is saved.
-----
ltspice_examples - FEGIN
Using 2 layers, 128 hidden units, h = 2
Loading component_net representation dataset
ENTERED
Training FEGIN on component_net representation
Train: 3558, Test: 846
##################ITERATION #0 ****************************************
 epoch: 0, train_loss: 1.3351, test_loss: 1.2652, test_f1: 0.2270
 epoch: 1, train_loss: 1.2429, test_loss: 1.2057, test_f1: 0.2903
 epoch: 2, train_loss: 1.1936, test_loss: 1.1434, test_f1: 0.3831
 epoch: 3, train_loss: 1.1414, test_loss: 1.0782, test_f1: 0.4446
 epoch: 4, train_loss: 1.0851, test_loss: 1.0295, test_f1: 0.4712
 epoch: 5, train_loss: 1.0424, test_loss: 0.9930, test_f1: 0.4803
 epoch: 6, train_loss: 1.0070, test_loss: 0.9679, test_f1: 0.4761
 epoch: 7, train_loss: 0.9917, test_loss: 0.9641, test_f1: 0.4826
 epoch: 8, train_loss: 0.9704, test_loss: 0.9416, test_f1: 0.5200
 epoch: 9, train_loss: 0.9543, test_loss: 0.9366, test_f1: 0.5047
 epoch: 10, train_loss: 0.9419, test_loss: 0.9165, test_f1: 0.4958
 epoch: 11, train_loss: 0.9323, test_loss: 0.8961, test_f1: 0.5190
 epoch: 12, train_loss: 0.9215, test_loss: 0.8885, test_f1: 0.5273
 epoch: 13, train_loss: 0.9140, test_loss: 0.8917, test_f1: 0.5435
 epoch: 14, train_loss: 0.9045, test_loss: 0.8736, test_f1: 0.5378
 epoch: 15, train_loss: 0.8944, test_loss: 0.9172, test_f1: 0.5365
 epoch: 16, train_loss: 0.8885, test_loss: 0.8868, test_f1: 0.5415
 epoch: 17, train_loss: 0.8854, test_loss: 0.8902, test_f1: 0.5452
 epoch: 18, train_loss: 0.8678, test_loss: 0.9101, test_f1: 0.5239
 epoch: 19, train_loss: 0.8664, test_loss: 0.8754, test_f1: 0.5486
 epoch: 20, train_loss: 0.8552, test_loss: 0.8835, test_f1: 0.5582
 epoch: 21, train_loss: 0.8580, test_loss: 0.9026, test_f1: 0.5336
 epoch: 22, train_loss: 0.8594, test_loss: 0.8861, test_f1: 0.5539
 epoch: 23, train_loss: 0.8404, test_loss: 0.8773, test_f1: 0.5332
 epoch: 24, train_loss: 0.8440, test_loss: 0.9014, test_f1: 0.5247
 epoch: 25, train_loss: 0.8389, test_loss: 0.9091, test_f1: 0.5401
 epoch: 26, train_loss: 0.8228, test_loss: 0.9107, test_f1: 0.5308
 epoch: 27, train_loss: 0.8163, test_loss: 0.9296, test_f1: 0.5378
 epoch: 28, train_loss: 0.8126, test_loss: 0.8749, test_f1: 0.5363
 epoch: 29, train_loss: 0.8146, test_loss: 0.9083, test_f1: 0.5485
 epoch: 30, train_loss: 0.8020, test_loss: 0.8954, test_f1: 0.5437
 epoch: 31, train_loss: 0.7943, test_loss: 0.8785, test_f1: 0.5558
 epoch: 32, train_loss: 0.8019, test_loss: 0.9073, test_f1: 0.5362
 epoch: 33, train_loss: 0.7914, test_loss: 0.9168, test_f1: 0.5551
 epoch: 34, train_loss: 0.7828, test_loss: 0.8966, test_f1: 0.5671
 epoch: 35, train_loss: 0.7824, test_loss: 0.8897, test_f1: 0.5684
 epoch: 36, train_loss: 0.7738, test_loss: 0.9134, test_f1: 0.5482
 epoch: 37, train_loss: 0.7669, test_loss: 0.8986, test_f1: 0.5846
 epoch: 38, train_loss: 0.7626, test_loss: 0.9038, test_f1: 0.5574
 epoch: 39, train_loss: 0.7481, test_loss: 0.9069, test_f1: 0.5694
 epoch: 40, train_loss: 0.7562, test_loss: 0.9076, test_f1: 0.5863
 epoch: 41, train_loss: 0.7528, test_loss: 0.8766, test_f1: 0.5863
 epoch: 42, train_loss: 0.7519, test_loss: 0.9320, test_f1: 0.5753
 epoch: 43, train_loss: 0.7466, test_loss: 0.8979, test_f1: 0.5840
 epoch: 44, train_loss: 0.7361, test_loss: 0.9260, test_f1: 0.5875
 epoch: 45, train_loss: 0.7385, test_loss: 0.9076, test_f1: 0.5942
 epoch: 46, train_loss: 0.7416, test_loss: 0.9116, test_f1: 0.6073
 epoch: 47, train_loss: 0.7358, test_loss: 0.9195, test_f1: 0.5654
 epoch: 48, train_loss: 0.7330, test_loss: 0.9384, test_f1: 0.5910
 epoch: 49, train_loss: 0.7233, test_loss: 0.9275, test_f1: 0.5863
 epoch: 50, train_loss: 0.7221, test_loss: 0.8934, test_f1: 0.6025
 epoch: 51, train_loss: 0.7060, test_loss: 0.9006, test_f1: 0.5959
 epoch: 52, train_loss: 0.7038, test_loss: 0.9212, test_f1: 0.5896
 epoch: 53, train_loss: 0.6914, test_loss: 0.9332, test_f1: 0.5902
 epoch: 54, train_loss: 0.6886, test_loss: 0.9524, test_f1: 0.5968
 epoch: 55, train_loss: 0.7033, test_loss: 0.9419, test_f1: 0.6097
 epoch: 56, train_loss: 0.6960, test_loss: 0.9281, test_f1: 0.6182
 epoch: 57, train_loss: 0.6877, test_loss: 0.9387, test_f1: 0.5969
 epoch: 58, train_loss: 0.6877, test_loss: 0.9458, test_f1: 0.6044
 epoch: 59, train_loss: 0.6852, test_loss: 0.9574, test_f1: 0.6050
 epoch: 60, train_loss: 0.6786, test_loss: 0.9574, test_f1: 0.5975
 epoch: 61, train_loss: 0.6794, test_loss: 0.9424, test_f1: 0.5963
 epoch: 62, train_loss: 0.6856, test_loss: 0.9605, test_f1: 0.6089
 epoch: 63, train_loss: 0.6715, test_loss: 0.9558, test_f1: 0.5810
 epoch: 64, train_loss: 0.6804, test_loss: 0.9374, test_f1: 0.6099
 epoch: 65, train_loss: 0.6637, test_loss: 0.9522, test_f1: 0.6016
 epoch: 66, train_loss: 0.6844, test_loss: 0.9442, test_f1: 0.6365
 epoch: 67, train_loss: 0.6724, test_loss: 0.9567, test_f1: 0.6400
 epoch: 68, train_loss: 0.6775, test_loss: 0.9595, test_f1: 0.6015
 epoch: 69, train_loss: 0.6715, test_loss: 0.9353, test_f1: 0.6289
 epoch: 70, train_loss: 0.6542, test_loss: 0.9448, test_f1: 0.6003
 epoch: 71, train_loss: 0.6664, test_loss: 0.9736, test_f1: 0.6083
 epoch: 72, train_loss: 0.6673, test_loss: 0.9361, test_f1: 0.5898
 epoch: 73, train_loss: 0.6625, test_loss: 0.9654, test_f1: 0.6081
 epoch: 74, train_loss: 0.6627, test_loss: 0.9948, test_f1: 0.6358
 epoch: 75, train_loss: 0.6612, test_loss: 0.9933, test_f1: 0.5969
 epoch: 76, train_loss: 0.6541, test_loss: 0.9548, test_f1: 0.6318
 epoch: 77, train_loss: 0.6502, test_loss: 0.9612, test_f1: 0.6478
 epoch: 78, train_loss: 0.6553, test_loss: 0.9762, test_f1: 0.6062
 epoch: 79, train_loss: 0.6431, test_loss: 0.9844, test_f1: 0.6275
 epoch: 80, train_loss: 0.6462, test_loss: 0.9861, test_f1: 0.6396
 epoch: 81, train_loss: 0.6460, test_loss: 0.9652, test_f1: 0.6413
 epoch: 82, train_loss: 0.6505, test_loss: 1.0034, test_f1: 0.6141
 epoch: 83, train_loss: 0.6472, test_loss: 0.9673, test_f1: 0.6426
 epoch: 84, train_loss: 0.6384, test_loss: 0.9721, test_f1: 0.6419
 epoch: 85, train_loss: 0.6302, test_loss: 0.9687, test_f1: 0.6416
 epoch: 86, train_loss: 0.6376, test_loss: 0.9549, test_f1: 0.6430
 epoch: 87, train_loss: 0.6349, test_loss: 0.9862, test_f1: 0.6348
 epoch: 88, train_loss: 0.6348, test_loss: 0.9784, test_f1: 0.6495
 epoch: 89, train_loss: 0.6343, test_loss: 0.9403, test_f1: 0.6679
 epoch: 90, train_loss: 0.6331, test_loss: 0.9951, test_f1: 0.6295
 epoch: 91, train_loss: 0.6252, test_loss: 0.9606, test_f1: 0.6458
 epoch: 92, train_loss: 0.6350, test_loss: 1.0002, test_f1: 0.6496
 epoch: 93, train_loss: 0.6254, test_loss: 1.0143, test_f1: 0.6460
 epoch: 94, train_loss: 0.6168, test_loss: 1.0140, test_f1: 0.6141
 epoch: 95, train_loss: 0.6324, test_loss: 0.9633, test_f1: 0.6450
 epoch: 96, train_loss: 0.6278, test_loss: 1.0154, test_f1: 0.6439
 epoch: 97, train_loss: 0.6107, test_loss: 0.9857, test_f1: 0.6564
 epoch: 98, train_loss: 0.6252, test_loss: 0.9876, test_f1: 0.6642
 epoch: 99, train_loss: 0.6231, test_loss: 0.9915, test_f1: 0.6385
##################ITERATION #1 ****************************************
 epoch: 0, train_loss: 1.2267, test_loss: 1.1049, test_f1: 0.3981
 epoch: 1, train_loss: 1.0999, test_loss: 1.0338, test_f1: 0.4628
 epoch: 2, train_loss: 1.0351, test_loss: 0.9843, test_f1: 0.4702
 epoch: 3, train_loss: 1.0014, test_loss: 0.9672, test_f1: 0.4945
 epoch: 4, train_loss: 0.9745, test_loss: 0.9343, test_f1: 0.4931
 epoch: 5, train_loss: 0.9607, test_loss: 0.9388, test_f1: 0.5048
 epoch: 6, train_loss: 0.9357, test_loss: 0.9258, test_f1: 0.5047
 epoch: 7, train_loss: 0.9350, test_loss: 0.9299, test_f1: 0.4850
 epoch: 8, train_loss: 0.9241, test_loss: 0.9056, test_f1: 0.5278
 epoch: 9, train_loss: 0.9099, test_loss: 0.9238, test_f1: 0.5224
 epoch: 10, train_loss: 0.8975, test_loss: 0.8940, test_f1: 0.5245
 epoch: 11, train_loss: 0.8882, test_loss: 0.8882, test_f1: 0.5347
 epoch: 12, train_loss: 0.8831, test_loss: 0.8817, test_f1: 0.5260
 epoch: 13, train_loss: 0.8688, test_loss: 0.8740, test_f1: 0.5545
 epoch: 14, train_loss: 0.8644, test_loss: 0.8796, test_f1: 0.5521
 epoch: 15, train_loss: 0.8641, test_loss: 0.8915, test_f1: 0.5433
 epoch: 16, train_loss: 0.8517, test_loss: 0.8769, test_f1: 0.5488
 epoch: 17, train_loss: 0.8409, test_loss: 0.8758, test_f1: 0.5518
 epoch: 18, train_loss: 0.8463, test_loss: 0.8953, test_f1: 0.5314
 epoch: 19, train_loss: 0.8264, test_loss: 0.8516, test_f1: 0.5555
 epoch: 20, train_loss: 0.8227, test_loss: 0.9011, test_f1: 0.5525
 epoch: 21, train_loss: 0.8223, test_loss: 0.8674, test_f1: 0.5567
 epoch: 22, train_loss: 0.8232, test_loss: 0.9096, test_f1: 0.5491
 epoch: 23, train_loss: 0.8046, test_loss: 0.9004, test_f1: 0.5342
 epoch: 24, train_loss: 0.7958, test_loss: 0.9018, test_f1: 0.5580
 epoch: 25, train_loss: 0.7960, test_loss: 0.8609, test_f1: 0.5681
 epoch: 26, train_loss: 0.7868, test_loss: 0.8869, test_f1: 0.5701
 epoch: 27, train_loss: 0.7880, test_loss: 0.8877, test_f1: 0.5435
 epoch: 28, train_loss: 0.7844, test_loss: 0.8936, test_f1: 0.5644
 epoch: 29, train_loss: 0.7736, test_loss: 0.8890, test_f1: 0.5837
 epoch: 30, train_loss: 0.7749, test_loss: 0.9299, test_f1: 0.5756
 epoch: 31, train_loss: 0.7612, test_loss: 0.8860, test_f1: 0.6145
 epoch: 32, train_loss: 0.7563, test_loss: 0.8560, test_f1: 0.6159
 epoch: 33, train_loss: 0.7384, test_loss: 0.8483, test_f1: 0.5978
 epoch: 34, train_loss: 0.7478, test_loss: 0.8747, test_f1: 0.6036
 epoch: 35, train_loss: 0.7299, test_loss: 0.8774, test_f1: 0.5950
 epoch: 36, train_loss: 0.7411, test_loss: 0.8853, test_f1: 0.6076
 epoch: 37, train_loss: 0.7368, test_loss: 0.8676, test_f1: 0.6367
 epoch: 38, train_loss: 0.7394, test_loss: 0.8705, test_f1: 0.6101
 epoch: 39, train_loss: 0.7360, test_loss: 0.9039, test_f1: 0.5881
 epoch: 40, train_loss: 0.7112, test_loss: 0.9242, test_f1: 0.5979
 epoch: 41, train_loss: 0.7205, test_loss: 0.9236, test_f1: 0.5998
 epoch: 42, train_loss: 0.7086, test_loss: 0.8853, test_f1: 0.6112
 epoch: 43, train_loss: 0.7074, test_loss: 0.8738, test_f1: 0.6261
 epoch: 44, train_loss: 0.7080, test_loss: 0.8753, test_f1: 0.6206
 epoch: 45, train_loss: 0.6900, test_loss: 0.8935, test_f1: 0.6314
 epoch: 46, train_loss: 0.7081, test_loss: 0.8616, test_f1: 0.6326
 epoch: 47, train_loss: 0.7039, test_loss: 0.8874, test_f1: 0.6387
 epoch: 48, train_loss: 0.6992, test_loss: 0.9162, test_f1: 0.6247
 epoch: 49, train_loss: 0.6869, test_loss: 0.9091, test_f1: 0.6078
 epoch: 50, train_loss: 0.6839, test_loss: 0.8999, test_f1: 0.6394
 epoch: 51, train_loss: 0.6796, test_loss: 0.8898, test_f1: 0.6430
 epoch: 52, train_loss: 0.6700, test_loss: 0.8477, test_f1: 0.6506
 epoch: 53, train_loss: 0.6547, test_loss: 0.9053, test_f1: 0.6432
 epoch: 54, train_loss: 0.6655, test_loss: 0.9013, test_f1: 0.6493
 epoch: 55, train_loss: 0.6535, test_loss: 0.8958, test_f1: 0.6584
 epoch: 56, train_loss: 0.6627, test_loss: 0.9204, test_f1: 0.6499
 epoch: 57, train_loss: 0.6524, test_loss: 0.9211, test_f1: 0.6305
 epoch: 58, train_loss: 0.6581, test_loss: 0.9266, test_f1: 0.6073
 epoch: 59, train_loss: 0.6514, test_loss: 0.9201, test_f1: 0.6367
 epoch: 60, train_loss: 0.6418, test_loss: 0.9004, test_f1: 0.6410
 epoch: 61, train_loss: 0.6519, test_loss: 0.9159, test_f1: 0.6292
 epoch: 62, train_loss: 0.6392, test_loss: 0.9305, test_f1: 0.6295
 epoch: 63, train_loss: 0.6436, test_loss: 0.8856, test_f1: 0.6274
 epoch: 64, train_loss: 0.6403, test_loss: 0.9031, test_f1: 0.6359
 epoch: 65, train_loss: 0.6355, test_loss: 0.9116, test_f1: 0.6487
 epoch: 66, train_loss: 0.6427, test_loss: 0.9215, test_f1: 0.6580
 epoch: 67, train_loss: 0.6287, test_loss: 0.9107, test_f1: 0.6532
 epoch: 68, train_loss: 0.6343, test_loss: 0.9057, test_f1: 0.6438
 epoch: 69, train_loss: 0.6226, test_loss: 0.9295, test_f1: 0.6465
 epoch: 70, train_loss: 0.6224, test_loss: 0.9424, test_f1: 0.6438
 epoch: 71, train_loss: 0.6264, test_loss: 0.9146, test_f1: 0.6694
 epoch: 72, train_loss: 0.6236, test_loss: 0.9049, test_f1: 0.6379
 epoch: 73, train_loss: 0.6218, test_loss: 0.9066, test_f1: 0.6522
 epoch: 74, train_loss: 0.6350, test_loss: 0.9570, test_f1: 0.6303
 epoch: 75, train_loss: 0.6338, test_loss: 0.9133, test_f1: 0.6559
 epoch: 76, train_loss: 0.6118, test_loss: 0.9314, test_f1: 0.6446
 epoch: 77, train_loss: 0.6358, test_loss: 0.9250, test_f1: 0.6434
 epoch: 78, train_loss: 0.6179, test_loss: 0.8952, test_f1: 0.6596
 epoch: 79, train_loss: 0.6105, test_loss: 0.9402, test_f1: 0.6470
 epoch: 80, train_loss: 0.6126, test_loss: 0.9426, test_f1: 0.6500
 epoch: 81, train_loss: 0.6146, test_loss: 0.9176, test_f1: 0.6740
 epoch: 82, train_loss: 0.5942, test_loss: 0.9172, test_f1: 0.6569
 epoch: 83, train_loss: 0.5990, test_loss: 0.9436, test_f1: 0.6513
 epoch: 84, train_loss: 0.6016, test_loss: 0.9217, test_f1: 0.6526
 epoch: 85, train_loss: 0.6040, test_loss: 0.9828, test_f1: 0.6411
 epoch: 86, train_loss: 0.5928, test_loss: 0.9404, test_f1: 0.6552
 epoch: 87, train_loss: 0.5968, test_loss: 0.9255, test_f1: 0.6478
 epoch: 88, train_loss: 0.6088, test_loss: 0.9680, test_f1: 0.6457
 epoch: 89, train_loss: 0.6028, test_loss: 0.9295, test_f1: 0.6771
 epoch: 90, train_loss: 0.5946, test_loss: 0.9392, test_f1: 0.6559
 epoch: 91, train_loss: 0.5850, test_loss: 0.9442, test_f1: 0.6809
 epoch: 92, train_loss: 0.5882, test_loss: 0.9279, test_f1: 0.6688
 epoch: 93, train_loss: 0.5876, test_loss: 0.9460, test_f1: 0.6825
 epoch: 94, train_loss: 0.5802, test_loss: 0.9682, test_f1: 0.6402
 epoch: 95, train_loss: 0.5874, test_loss: 0.9481, test_f1: 0.6501
 epoch: 96, train_loss: 0.5834, test_loss: 0.9535, test_f1: 0.6646
 epoch: 97, train_loss: 0.5844, test_loss: 0.9823, test_f1: 0.6568
 epoch: 98, train_loss: 0.5850, test_loss: 0.9520, test_f1: 0.6538
 epoch: 99, train_loss: 0.5795, test_loss: 0.9530, test_f1: 0.6747
##################ITERATION #2 ****************************************
 epoch: 0, train_loss: 1.2033, test_loss: 1.0649, test_f1: 0.4580
 epoch: 1, train_loss: 1.0777, test_loss: 0.9928, test_f1: 0.4631
 epoch: 2, train_loss: 1.0260, test_loss: 0.9591, test_f1: 0.4785
 epoch: 3, train_loss: 0.9997, test_loss: 0.9471, test_f1: 0.5085
 epoch: 4, train_loss: 0.9742, test_loss: 0.9328, test_f1: 0.5057
 epoch: 5, train_loss: 0.9602, test_loss: 0.9137, test_f1: 0.5239
 epoch: 6, train_loss: 0.9344, test_loss: 0.9063, test_f1: 0.5279
 epoch: 7, train_loss: 0.9288, test_loss: 0.9033, test_f1: 0.5290
 epoch: 8, train_loss: 0.9101, test_loss: 0.8661, test_f1: 0.5509
 epoch: 9, train_loss: 0.9030, test_loss: 0.8753, test_f1: 0.5656
 epoch: 10, train_loss: 0.8963, test_loss: 0.8769, test_f1: 0.5523
 epoch: 11, train_loss: 0.8822, test_loss: 0.8640, test_f1: 0.5580
 epoch: 12, train_loss: 0.8738, test_loss: 0.8745, test_f1: 0.5580
 epoch: 13, train_loss: 0.8663, test_loss: 0.8523, test_f1: 0.5617
 epoch: 14, train_loss: 0.8677, test_loss: 0.8598, test_f1: 0.5631
 epoch: 15, train_loss: 0.8420, test_loss: 0.8667, test_f1: 0.5504
 epoch: 16, train_loss: 0.8370, test_loss: 0.8758, test_f1: 0.5655
 epoch: 17, train_loss: 0.8314, test_loss: 0.8772, test_f1: 0.5586
 epoch: 18, train_loss: 0.8278, test_loss: 0.8470, test_f1: 0.5915
 epoch: 19, train_loss: 0.8187, test_loss: 0.8375, test_f1: 0.5803
 epoch: 20, train_loss: 0.8164, test_loss: 0.8296, test_f1: 0.5708
 epoch: 21, train_loss: 0.8029, test_loss: 0.8591, test_f1: 0.5768
 epoch: 22, train_loss: 0.7996, test_loss: 0.8567, test_f1: 0.5858
 epoch: 23, train_loss: 0.7964, test_loss: 0.9016, test_f1: 0.5702
 epoch: 24, train_loss: 0.7891, test_loss: 0.8579, test_f1: 0.5884
 epoch: 25, train_loss: 0.7790, test_loss: 0.8785, test_f1: 0.5907
 epoch: 26, train_loss: 0.7773, test_loss: 0.8778, test_f1: 0.6063
 epoch: 27, train_loss: 0.7661, test_loss: 0.8638, test_f1: 0.6212
 epoch: 28, train_loss: 0.7696, test_loss: 0.8967, test_f1: 0.5719
 epoch: 29, train_loss: 0.7639, test_loss: 0.8392, test_f1: 0.6087
 epoch: 30, train_loss: 0.7620, test_loss: 0.8707, test_f1: 0.6181
 epoch: 31, train_loss: 0.7413, test_loss: 0.8766, test_f1: 0.5856
 epoch: 32, train_loss: 0.7482, test_loss: 0.8876, test_f1: 0.5848
 epoch: 33, train_loss: 0.7407, test_loss: 0.9189, test_f1: 0.5786
 epoch: 34, train_loss: 0.7396, test_loss: 0.8984, test_f1: 0.6342
 epoch: 35, train_loss: 0.7385, test_loss: 0.8863, test_f1: 0.6106
 epoch: 36, train_loss: 0.7233, test_loss: 0.8545, test_f1: 0.6188
 epoch: 37, train_loss: 0.7223, test_loss: 0.8929, test_f1: 0.6350
 epoch: 38, train_loss: 0.7216, test_loss: 0.8480, test_f1: 0.6208
 epoch: 39, train_loss: 0.7233, test_loss: 0.8723, test_f1: 0.6208
 epoch: 40, train_loss: 0.7168, test_loss: 0.8945, test_f1: 0.6449
 epoch: 41, train_loss: 0.7120, test_loss: 0.8786, test_f1: 0.6672
 epoch: 42, train_loss: 0.7127, test_loss: 0.8895, test_f1: 0.6457
 epoch: 43, train_loss: 0.7094, test_loss: 0.8985, test_f1: 0.6299
 epoch: 44, train_loss: 0.7006, test_loss: 0.8834, test_f1: 0.6310
 epoch: 45, train_loss: 0.7011, test_loss: 0.9129, test_f1: 0.6274
 epoch: 46, train_loss: 0.6981, test_loss: 0.8790, test_f1: 0.6544
 epoch: 47, train_loss: 0.6928, test_loss: 0.9220, test_f1: 0.6192
 epoch: 48, train_loss: 0.6895, test_loss: 0.8947, test_f1: 0.6554
 epoch: 49, train_loss: 0.6879, test_loss: 0.9074, test_f1: 0.6383
 epoch: 50, train_loss: 0.6805, test_loss: 0.8957, test_f1: 0.6240
 epoch: 51, train_loss: 0.6684, test_loss: 0.8860, test_f1: 0.6512
 epoch: 52, train_loss: 0.6609, test_loss: 0.8884, test_f1: 0.6513
 epoch: 53, train_loss: 0.6586, test_loss: 0.8891, test_f1: 0.6556
 epoch: 54, train_loss: 0.6515, test_loss: 0.9079, test_f1: 0.6399
 epoch: 55, train_loss: 0.6439, test_loss: 0.8989, test_f1: 0.6788
 epoch: 56, train_loss: 0.6475, test_loss: 0.9081, test_f1: 0.6729
 epoch: 57, train_loss: 0.6344, test_loss: 0.9104, test_f1: 0.6287
 epoch: 58, train_loss: 0.6475, test_loss: 0.9112, test_f1: 0.6424
 epoch: 59, train_loss: 0.6402, test_loss: 0.9119, test_f1: 0.6459
 epoch: 60, train_loss: 0.6454, test_loss: 0.9071, test_f1: 0.6403
 epoch: 61, train_loss: 0.6420, test_loss: 0.9048, test_f1: 0.6690
 epoch: 62, train_loss: 0.6296, test_loss: 0.9271, test_f1: 0.6504
 epoch: 63, train_loss: 0.6385, test_loss: 0.9555, test_f1: 0.6456
 epoch: 64, train_loss: 0.6263, test_loss: 0.9465, test_f1: 0.6828
 epoch: 65, train_loss: 0.6185, test_loss: 0.9313, test_f1: 0.6581
 epoch: 66, train_loss: 0.6280, test_loss: 0.9158, test_f1: 0.6450
 epoch: 67, train_loss: 0.6254, test_loss: 0.9072, test_f1: 0.6818
 epoch: 68, train_loss: 0.6243, test_loss: 0.9174, test_f1: 0.6616
 epoch: 69, train_loss: 0.6212, test_loss: 0.8990, test_f1: 0.6733
 epoch: 70, train_loss: 0.6220, test_loss: 0.9457, test_f1: 0.6912
 epoch: 71, train_loss: 0.6141, test_loss: 0.9401, test_f1: 0.6806
 epoch: 72, train_loss: 0.6198, test_loss: 0.9539, test_f1: 0.6624
 epoch: 73, train_loss: 0.6255, test_loss: 0.9272, test_f1: 0.6493
 epoch: 74, train_loss: 0.6053, test_loss: 0.9222, test_f1: 0.6563
 epoch: 75, train_loss: 0.6022, test_loss: 0.9777, test_f1: 0.6620
 epoch: 76, train_loss: 0.6230, test_loss: 0.9292, test_f1: 0.6483
 epoch: 77, train_loss: 0.6123, test_loss: 0.9451, test_f1: 0.6557
 epoch: 78, train_loss: 0.6133, test_loss: 0.9347, test_f1: 0.6582
 epoch: 79, train_loss: 0.6149, test_loss: 0.9832, test_f1: 0.6580
 epoch: 80, train_loss: 0.6105, test_loss: 0.9273, test_f1: 0.6867
 epoch: 81, train_loss: 0.6023, test_loss: 0.9495, test_f1: 0.6562
 epoch: 82, train_loss: 0.6017, test_loss: 0.9424, test_f1: 0.6540
 epoch: 83, train_loss: 0.5939, test_loss: 0.9445, test_f1: 0.6757
 epoch: 84, train_loss: 0.5915, test_loss: 0.9373, test_f1: 0.6715
 epoch: 85, train_loss: 0.6037, test_loss: 0.9499, test_f1: 0.6831
 epoch: 86, train_loss: 0.6045, test_loss: 0.9615, test_f1: 0.6645
 epoch: 87, train_loss: 0.5929, test_loss: 0.9411, test_f1: 0.6789
 epoch: 88, train_loss: 0.5890, test_loss: 0.9715, test_f1: 0.6638
 epoch: 89, train_loss: 0.6089, test_loss: 0.9449, test_f1: 0.6767
 epoch: 90, train_loss: 0.5848, test_loss: 0.9408, test_f1: 0.7003
 epoch: 91, train_loss: 0.5698, test_loss: 0.9475, test_f1: 0.6750
 epoch: 92, train_loss: 0.5864, test_loss: 0.9386, test_f1: 0.6791
 epoch: 93, train_loss: 0.5755, test_loss: 0.9435, test_f1: 0.6960
 epoch: 94, train_loss: 0.5773, test_loss: 0.9317, test_f1: 0.7014
 epoch: 95, train_loss: 0.5674, test_loss: 0.9623, test_f1: 0.6803
 epoch: 96, train_loss: 0.5839, test_loss: 0.9724, test_f1: 0.7006
 epoch: 97, train_loss: 0.5758, test_loss: 0.9632, test_f1: 0.6931
 epoch: 98, train_loss: 0.5705, test_loss: 0.9493, test_f1: 0.6677
 epoch: 99, train_loss: 0.5665, test_loss: 0.9834, test_f1: 0.6817
##################ITERATION #3 ****************************************
 epoch: 0, train_loss: 1.1901, test_loss: 1.0393, test_f1: 0.4576
 epoch: 1, train_loss: 1.0839, test_loss: 0.9907, test_f1: 0.4444
 epoch: 2, train_loss: 1.0288, test_loss: 0.9658, test_f1: 0.4710
 epoch: 3, train_loss: 1.0043, test_loss: 0.9538, test_f1: 0.4867
 epoch: 4, train_loss: 0.9903, test_loss: 0.9561, test_f1: 0.4735
 epoch: 5, train_loss: 0.9691, test_loss: 0.9334, test_f1: 0.4962
 epoch: 6, train_loss: 0.9453, test_loss: 0.9435, test_f1: 0.5080
 epoch: 7, train_loss: 0.9423, test_loss: 0.9396, test_f1: 0.4918
 epoch: 8, train_loss: 0.9299, test_loss: 0.9297, test_f1: 0.5163
 epoch: 9, train_loss: 0.9206, test_loss: 0.9071, test_f1: 0.5169
 epoch: 10, train_loss: 0.8982, test_loss: 0.9111, test_f1: 0.5230
 epoch: 11, train_loss: 0.8967, test_loss: 0.8969, test_f1: 0.5515
 epoch: 12, train_loss: 0.8908, test_loss: 0.8890, test_f1: 0.5322
 epoch: 13, train_loss: 0.8765, test_loss: 0.9015, test_f1: 0.5391
 epoch: 14, train_loss: 0.8631, test_loss: 0.9176, test_f1: 0.5500
 epoch: 15, train_loss: 0.8632, test_loss: 0.9039, test_f1: 0.5628
 epoch: 16, train_loss: 0.8471, test_loss: 0.8910, test_f1: 0.5628
 epoch: 17, train_loss: 0.8455, test_loss: 0.8948, test_f1: 0.5478
 epoch: 18, train_loss: 0.8402, test_loss: 0.8936, test_f1: 0.5279
 epoch: 19, train_loss: 0.8305, test_loss: 0.8925, test_f1: 0.5516
 epoch: 20, train_loss: 0.8279, test_loss: 0.9001, test_f1: 0.5420
 epoch: 21, train_loss: 0.8197, test_loss: 0.8789, test_f1: 0.5616
 epoch: 22, train_loss: 0.8217, test_loss: 0.8966, test_f1: 0.5641
 epoch: 23, train_loss: 0.8196, test_loss: 0.8885, test_f1: 0.5517
 epoch: 24, train_loss: 0.8032, test_loss: 0.9198, test_f1: 0.5709
 epoch: 25, train_loss: 0.8156, test_loss: 0.9221, test_f1: 0.5482
 epoch: 26, train_loss: 0.7949, test_loss: 0.9128, test_f1: 0.5952
 epoch: 27, train_loss: 0.7874, test_loss: 0.8873, test_f1: 0.5935
 epoch: 28, train_loss: 0.7844, test_loss: 0.9136, test_f1: 0.5600
 epoch: 29, train_loss: 0.7819, test_loss: 0.9047, test_f1: 0.5863
 epoch: 30, train_loss: 0.7770, test_loss: 0.9034, test_f1: 0.5874
 epoch: 31, train_loss: 0.7815, test_loss: 0.9019, test_f1: 0.6038
 epoch: 32, train_loss: 0.7690, test_loss: 0.8978, test_f1: 0.5881
 epoch: 33, train_loss: 0.7654, test_loss: 0.9053, test_f1: 0.6130
 epoch: 34, train_loss: 0.7573, test_loss: 0.9030, test_f1: 0.5916
 epoch: 35, train_loss: 0.7509, test_loss: 0.8947, test_f1: 0.6235
 epoch: 36, train_loss: 0.7657, test_loss: 0.8945, test_f1: 0.5978
 epoch: 37, train_loss: 0.7540, test_loss: 0.8841, test_f1: 0.6442
 epoch: 38, train_loss: 0.7421, test_loss: 0.8989, test_f1: 0.5978
 epoch: 39, train_loss: 0.7411, test_loss: 0.8826, test_f1: 0.6271
 epoch: 40, train_loss: 0.7402, test_loss: 0.8945, test_f1: 0.5763
 epoch: 41, train_loss: 0.7288, test_loss: 0.9127, test_f1: 0.5686
 epoch: 42, train_loss: 0.7387, test_loss: 0.9102, test_f1: 0.5784
 epoch: 43, train_loss: 0.7395, test_loss: 0.8849, test_f1: 0.6165
 epoch: 44, train_loss: 0.7249, test_loss: 0.8960, test_f1: 0.6123
 epoch: 45, train_loss: 0.7296, test_loss: 0.9132, test_f1: 0.6203
 epoch: 46, train_loss: 0.7201, test_loss: 0.9098, test_f1: 0.5910
 epoch: 47, train_loss: 0.7066, test_loss: 0.9182, test_f1: 0.6353
 epoch: 48, train_loss: 0.6997, test_loss: 0.8967, test_f1: 0.6026
 epoch: 49, train_loss: 0.7056, test_loss: 0.8950, test_f1: 0.6243
 epoch: 50, train_loss: 0.7105, test_loss: 0.8967, test_f1: 0.6071
 epoch: 51, train_loss: 0.6875, test_loss: 0.9118, test_f1: 0.6130
 epoch: 52, train_loss: 0.6933, test_loss: 0.9193, test_f1: 0.6138
 epoch: 53, train_loss: 0.6778, test_loss: 0.9301, test_f1: 0.6231
 epoch: 54, train_loss: 0.6838, test_loss: 0.9313, test_f1: 0.6186
 epoch: 55, train_loss: 0.6893, test_loss: 0.9272, test_f1: 0.6301
 epoch: 56, train_loss: 0.6850, test_loss: 0.9421, test_f1: 0.6205
 epoch: 57, train_loss: 0.6717, test_loss: 0.9434, test_f1: 0.6165
 epoch: 58, train_loss: 0.6734, test_loss: 0.9381, test_f1: 0.6288
 epoch: 59, train_loss: 0.6661, test_loss: 0.9086, test_f1: 0.6286
 epoch: 60, train_loss: 0.6557, test_loss: 0.9147, test_f1: 0.6177
 epoch: 61, train_loss: 0.6715, test_loss: 0.9076, test_f1: 0.6254
 epoch: 62, train_loss: 0.6652, test_loss: 0.9135, test_f1: 0.6209
 epoch: 63, train_loss: 0.6608, test_loss: 0.8954, test_f1: 0.6354
 epoch: 64, train_loss: 0.6706, test_loss: 0.9322, test_f1: 0.6175
 epoch: 65, train_loss: 0.6603, test_loss: 0.9246, test_f1: 0.6170
 epoch: 66, train_loss: 0.6666, test_loss: 0.9193, test_f1: 0.6151
 epoch: 67, train_loss: 0.6576, test_loss: 0.9306, test_f1: 0.6289
 epoch: 68, train_loss: 0.6491, test_loss: 0.9446, test_f1: 0.6195
 epoch: 69, train_loss: 0.6501, test_loss: 0.9456, test_f1: 0.6337
 epoch: 70, train_loss: 0.6521, test_loss: 0.9536, test_f1: 0.6168
 epoch: 71, train_loss: 0.6538, test_loss: 0.9083, test_f1: 0.6457
 epoch: 72, train_loss: 0.6541, test_loss: 0.9358, test_f1: 0.6419
 epoch: 73, train_loss: 0.6521, test_loss: 0.9446, test_f1: 0.6219
 epoch: 74, train_loss: 0.6499, test_loss: 0.9704, test_f1: 0.6547
 epoch: 75, train_loss: 0.6432, test_loss: 0.9450, test_f1: 0.6410
 epoch: 76, train_loss: 0.6372, test_loss: 0.9584, test_f1: 0.6356
 epoch: 77, train_loss: 0.6327, test_loss: 0.9270, test_f1: 0.6506
 epoch: 78, train_loss: 0.6432, test_loss: 0.9446, test_f1: 0.6370
 epoch: 79, train_loss: 0.6408, test_loss: 0.9453, test_f1: 0.6743
 epoch: 80, train_loss: 0.6426, test_loss: 0.9235, test_f1: 0.6166
 epoch: 81, train_loss: 0.6404, test_loss: 0.9398, test_f1: 0.6250
 epoch: 82, train_loss: 0.6242, test_loss: 0.9911, test_f1: 0.6388
 epoch: 83, train_loss: 0.6206, test_loss: 0.9376, test_f1: 0.6557
 epoch: 84, train_loss: 0.6255, test_loss: 0.9443, test_f1: 0.6234
 epoch: 85, train_loss: 0.6335, test_loss: 0.9639, test_f1: 0.6446
 epoch: 86, train_loss: 0.6343, test_loss: 0.9802, test_f1: 0.6371
 epoch: 87, train_loss: 0.6227, test_loss: 0.9735, test_f1: 0.6433
 epoch: 88, train_loss: 0.6198, test_loss: 0.9723, test_f1: 0.6655
 epoch: 89, train_loss: 0.6337, test_loss: 0.9313, test_f1: 0.6585
 epoch: 90, train_loss: 0.6138, test_loss: 0.9270, test_f1: 0.6428
 epoch: 91, train_loss: 0.6233, test_loss: 0.9313, test_f1: 0.6514
 epoch: 92, train_loss: 0.6255, test_loss: 0.9291, test_f1: 0.6522
 epoch: 93, train_loss: 0.6184, test_loss: 0.9418, test_f1: 0.6398
 epoch: 94, train_loss: 0.6158, test_loss: 0.9395, test_f1: 0.6485
 epoch: 95, train_loss: 0.6044, test_loss: 0.9498, test_f1: 0.6544
 epoch: 96, train_loss: 0.6030, test_loss: 0.9498, test_f1: 0.6637
 epoch: 97, train_loss: 0.5918, test_loss: 0.9597, test_f1: 0.6423
 epoch: 98, train_loss: 0.6166, test_loss: 0.9618, test_f1: 0.6631
 epoch: 99, train_loss: 0.6081, test_loss: 0.9887, test_f1: 0.6670
##################ITERATION #4 ****************************************
 epoch: 0, train_loss: 1.1800, test_loss: 1.0213, test_f1: 0.4279
 epoch: 1, train_loss: 1.0564, test_loss: 0.9829, test_f1: 0.4707
 epoch: 2, train_loss: 1.0171, test_loss: 0.9628, test_f1: 0.4987
 epoch: 3, train_loss: 0.9963, test_loss: 0.9660, test_f1: 0.4849
 epoch: 4, train_loss: 0.9722, test_loss: 0.9602, test_f1: 0.5031
 epoch: 5, train_loss: 0.9530, test_loss: 0.9386, test_f1: 0.5240
 epoch: 6, train_loss: 0.9431, test_loss: 0.9407, test_f1: 0.5267
 epoch: 7, train_loss: 0.9236, test_loss: 0.9186, test_f1: 0.5100
 epoch: 8, train_loss: 0.9143, test_loss: 0.9090, test_f1: 0.5168
 epoch: 9, train_loss: 0.9010, test_loss: 0.9140, test_f1: 0.5165
 epoch: 10, train_loss: 0.8880, test_loss: 0.9054, test_f1: 0.5261
 epoch: 11, train_loss: 0.8868, test_loss: 0.9121, test_f1: 0.5349
 epoch: 12, train_loss: 0.8794, test_loss: 0.9078, test_f1: 0.5228
 epoch: 13, train_loss: 0.8679, test_loss: 0.8835, test_f1: 0.5401
 epoch: 14, train_loss: 0.8538, test_loss: 0.9008, test_f1: 0.5269
 epoch: 15, train_loss: 0.8631, test_loss: 0.9147, test_f1: 0.5375
 epoch: 16, train_loss: 0.8542, test_loss: 0.8964, test_f1: 0.5597
 epoch: 17, train_loss: 0.8318, test_loss: 0.8922, test_f1: 0.5551
 epoch: 18, train_loss: 0.8304, test_loss: 0.9098, test_f1: 0.5725
 epoch: 19, train_loss: 0.8372, test_loss: 0.8888, test_f1: 0.5465
 epoch: 20, train_loss: 0.8178, test_loss: 0.9222, test_f1: 0.5580
 epoch: 21, train_loss: 0.8129, test_loss: 0.9166, test_f1: 0.5668
 epoch: 22, train_loss: 0.8183, test_loss: 0.9243, test_f1: 0.5816
 epoch: 23, train_loss: 0.8016, test_loss: 0.9169, test_f1: 0.5833
 epoch: 24, train_loss: 0.8056, test_loss: 0.9045, test_f1: 0.5701
 epoch: 25, train_loss: 0.7879, test_loss: 0.9211, test_f1: 0.5648
 epoch: 26, train_loss: 0.7962, test_loss: 0.8929, test_f1: 0.5701
 epoch: 27, train_loss: 0.7851, test_loss: 0.9101, test_f1: 0.5650
 epoch: 28, train_loss: 0.7826, test_loss: 0.9271, test_f1: 0.5781
 epoch: 29, train_loss: 0.7848, test_loss: 0.8831, test_f1: 0.5928
 epoch: 30, train_loss: 0.7603, test_loss: 0.9057, test_f1: 0.5894
 epoch: 31, train_loss: 0.7606, test_loss: 0.9397, test_f1: 0.5818
 epoch: 32, train_loss: 0.7646, test_loss: 0.9298, test_f1: 0.5863
 epoch: 33, train_loss: 0.7569, test_loss: 0.9427, test_f1: 0.6117
 epoch: 34, train_loss: 0.7614, test_loss: 0.9317, test_f1: 0.6379
 epoch: 35, train_loss: 0.7494, test_loss: 0.9147, test_f1: 0.6228
 epoch: 36, train_loss: 0.7440, test_loss: 0.9156, test_f1: 0.5742
 epoch: 37, train_loss: 0.7430, test_loss: 0.9254, test_f1: 0.5859
 epoch: 38, train_loss: 0.7362, test_loss: 0.9011, test_f1: 0.6134
 epoch: 39, train_loss: 0.7281, test_loss: 0.9764, test_f1: 0.5836
 epoch: 40, train_loss: 0.7408, test_loss: 0.9203, test_f1: 0.5897
 epoch: 41, train_loss: 0.7295, test_loss: 0.9252, test_f1: 0.6176
 epoch: 42, train_loss: 0.7292, test_loss: 0.9332, test_f1: 0.6085
 epoch: 43, train_loss: 0.7230, test_loss: 0.9067, test_f1: 0.6048
 epoch: 44, train_loss: 0.7097, test_loss: 0.9254, test_f1: 0.6202
 epoch: 45, train_loss: 0.7110, test_loss: 0.9265, test_f1: 0.6015
 epoch: 46, train_loss: 0.7162, test_loss: 0.8825, test_f1: 0.6259
 epoch: 47, train_loss: 0.7091, test_loss: 0.8944, test_f1: 0.6275
 epoch: 48, train_loss: 0.6987, test_loss: 0.9310, test_f1: 0.6353
 epoch: 49, train_loss: 0.6859, test_loss: 0.9497, test_f1: 0.6147
 epoch: 50, train_loss: 0.7029, test_loss: 0.9244, test_f1: 0.6213
 epoch: 51, train_loss: 0.6857, test_loss: 0.9352, test_f1: 0.6312
 epoch: 52, train_loss: 0.6703, test_loss: 0.9246, test_f1: 0.6333
 epoch: 53, train_loss: 0.6745, test_loss: 0.9156, test_f1: 0.6209
 epoch: 54, train_loss: 0.6661, test_loss: 0.9252, test_f1: 0.6341
 epoch: 55, train_loss: 0.6767, test_loss: 0.9146, test_f1: 0.6473
 epoch: 56, train_loss: 0.6628, test_loss: 0.9216, test_f1: 0.6202
 epoch: 57, train_loss: 0.6568, test_loss: 0.9520, test_f1: 0.6280
 epoch: 58, train_loss: 0.6687, test_loss: 0.8998, test_f1: 0.6232
 epoch: 59, train_loss: 0.6571, test_loss: 0.9109, test_f1: 0.6441
 epoch: 60, train_loss: 0.6641, test_loss: 0.9070, test_f1: 0.6422
 epoch: 61, train_loss: 0.6566, test_loss: 0.9381, test_f1: 0.6235
 epoch: 62, train_loss: 0.6409, test_loss: 0.9169, test_f1: 0.6460
 epoch: 63, train_loss: 0.6456, test_loss: 0.9555, test_f1: 0.6565
 epoch: 64, train_loss: 0.6382, test_loss: 0.9525, test_f1: 0.6117
 epoch: 65, train_loss: 0.6476, test_loss: 0.9220, test_f1: 0.6550
 epoch: 66, train_loss: 0.6474, test_loss: 0.9344, test_f1: 0.6532
 epoch: 67, train_loss: 0.6457, test_loss: 0.9173, test_f1: 0.6280
 epoch: 68, train_loss: 0.6430, test_loss: 0.9260, test_f1: 0.6491
 epoch: 69, train_loss: 0.6342, test_loss: 0.9395, test_f1: 0.6403
 epoch: 70, train_loss: 0.6467, test_loss: 0.9511, test_f1: 0.6556
 epoch: 71, train_loss: 0.6414, test_loss: 0.9430, test_f1: 0.6639
 epoch: 72, train_loss: 0.6340, test_loss: 0.9131, test_f1: 0.6544
 epoch: 73, train_loss: 0.6346, test_loss: 0.9400, test_f1: 0.6506
 epoch: 74, train_loss: 0.6246, test_loss: 0.9555, test_f1: 0.6456
 epoch: 75, train_loss: 0.6311, test_loss: 0.9478, test_f1: 0.6512
 epoch: 76, train_loss: 0.6281, test_loss: 0.9396, test_f1: 0.6711
 epoch: 77, train_loss: 0.6218, test_loss: 0.9372, test_f1: 0.6608
 epoch: 78, train_loss: 0.6175, test_loss: 0.9580, test_f1: 0.6345
 epoch: 79, train_loss: 0.6187, test_loss: 0.9657, test_f1: 0.6516
 epoch: 80, train_loss: 0.6356, test_loss: 0.9614, test_f1: 0.6551
 epoch: 81, train_loss: 0.6237, test_loss: 0.9731, test_f1: 0.6384
 epoch: 82, train_loss: 0.6297, test_loss: 0.9385, test_f1: 0.6476
 epoch: 83, train_loss: 0.6294, test_loss: 0.9603, test_f1: 0.6597
 epoch: 84, train_loss: 0.6033, test_loss: 0.9514, test_f1: 0.6552
 epoch: 85, train_loss: 0.6209, test_loss: 0.9772, test_f1: 0.6560
 epoch: 86, train_loss: 0.6138, test_loss: 0.9392, test_f1: 0.6722
 epoch: 87, train_loss: 0.5994, test_loss: 0.9867, test_f1: 0.6549
 epoch: 88, train_loss: 0.6076, test_loss: 0.9957, test_f1: 0.6499
 epoch: 89, train_loss: 0.6022, test_loss: 0.9703, test_f1: 0.6440
 epoch: 90, train_loss: 0.5997, test_loss: 0.9636, test_f1: 0.6751
 epoch: 91, train_loss: 0.6046, test_loss: 0.9718, test_f1: 0.6742
 epoch: 92, train_loss: 0.5992, test_loss: 1.0032, test_f1: 0.6393
 epoch: 93, train_loss: 0.6126, test_loss: 1.0114, test_f1: 0.6610
 epoch: 94, train_loss: 0.5953, test_loss: 0.9946, test_f1: 0.6604
 epoch: 95, train_loss: 0.6001, test_loss: 0.9751, test_f1: 0.6583
 epoch: 96, train_loss: 0.6015, test_loss: 0.9837, test_f1: 0.6624
 epoch: 97, train_loss: 0.5964, test_loss: 0.9793, test_f1: 0.6749
 epoch: 98, train_loss: 0.5855, test_loss: 0.9964, test_f1: 0.6477
 epoch: 99, train_loss: 0.5910, test_loss: 0.9758, test_f1: 0.6761
##################ITERATION #5 ****************************************
 epoch: 0, train_loss: 1.2297, test_loss: 1.0291, test_f1: 0.4382
 epoch: 1, train_loss: 1.0631, test_loss: 0.9856, test_f1: 0.4448
 epoch: 2, train_loss: 1.0246, test_loss: 0.9552, test_f1: 0.4863
 epoch: 3, train_loss: 1.0069, test_loss: 0.9546, test_f1: 0.4753
 epoch: 4, train_loss: 0.9796, test_loss: 0.9349, test_f1: 0.5078
 epoch: 5, train_loss: 0.9649, test_loss: 0.9253, test_f1: 0.5104
 epoch: 6, train_loss: 0.9617, test_loss: 0.8970, test_f1: 0.5084
 epoch: 7, train_loss: 0.9349, test_loss: 0.9132, test_f1: 0.5264
 epoch: 8, train_loss: 0.9287, test_loss: 0.9220, test_f1: 0.4865
 epoch: 9, train_loss: 0.9142, test_loss: 0.9071, test_f1: 0.5217
 epoch: 10, train_loss: 0.9142, test_loss: 0.8792, test_f1: 0.5385
 epoch: 11, train_loss: 0.8924, test_loss: 0.8921, test_f1: 0.5382
 epoch: 12, train_loss: 0.8903, test_loss: 0.9012, test_f1: 0.5409
 epoch: 13, train_loss: 0.8904, test_loss: 0.8946, test_f1: 0.5226
 epoch: 14, train_loss: 0.8710, test_loss: 0.8765, test_f1: 0.5406
 epoch: 15, train_loss: 0.8729, test_loss: 0.8707, test_f1: 0.5442
 epoch: 16, train_loss: 0.8709, test_loss: 0.8757, test_f1: 0.5311
 epoch: 17, train_loss: 0.8588, test_loss: 0.8789, test_f1: 0.5383
 epoch: 18, train_loss: 0.8515, test_loss: 0.8847, test_f1: 0.5364
 epoch: 19, train_loss: 0.8387, test_loss: 0.8795, test_f1: 0.5496
 epoch: 20, train_loss: 0.8385, test_loss: 0.8932, test_f1: 0.5781
 epoch: 21, train_loss: 0.8300, test_loss: 0.8569, test_f1: 0.5430
 epoch: 22, train_loss: 0.8214, test_loss: 0.8721, test_f1: 0.5426
 epoch: 23, train_loss: 0.8243, test_loss: 0.8791, test_f1: 0.5624
 epoch: 24, train_loss: 0.8114, test_loss: 0.8772, test_f1: 0.5645
 epoch: 25, train_loss: 0.8184, test_loss: 0.8810, test_f1: 0.5550
 epoch: 26, train_loss: 0.8103, test_loss: 0.8860, test_f1: 0.5839
 epoch: 27, train_loss: 0.7979, test_loss: 0.8940, test_f1: 0.5575
 epoch: 28, train_loss: 0.7994, test_loss: 0.8963, test_f1: 0.5643
 epoch: 29, train_loss: 0.7911, test_loss: 0.8696, test_f1: 0.5952
 epoch: 30, train_loss: 0.7979, test_loss: 0.8721, test_f1: 0.5829
 epoch: 31, train_loss: 0.7951, test_loss: 0.8748, test_f1: 0.5898
 epoch: 32, train_loss: 0.7813, test_loss: 0.8909, test_f1: 0.5749
 epoch: 33, train_loss: 0.7844, test_loss: 0.8679, test_f1: 0.5678
 epoch: 34, train_loss: 0.7789, test_loss: 0.9020, test_f1: 0.5832
 epoch: 35, train_loss: 0.7711, test_loss: 0.8684, test_f1: 0.5970
 epoch: 36, train_loss: 0.7670, test_loss: 0.9040, test_f1: 0.5894
 epoch: 37, train_loss: 0.7494, test_loss: 0.8929, test_f1: 0.5960
 epoch: 38, train_loss: 0.7532, test_loss: 0.8883, test_f1: 0.6095
 epoch: 39, train_loss: 0.7555, test_loss: 0.8622, test_f1: 0.5951
 epoch: 40, train_loss: 0.7490, test_loss: 0.9133, test_f1: 0.6024
 epoch: 41, train_loss: 0.7412, test_loss: 0.8930, test_f1: 0.6155
 epoch: 42, train_loss: 0.7442, test_loss: 0.9070, test_f1: 0.5658
 epoch: 43, train_loss: 0.7304, test_loss: 0.9166, test_f1: 0.5885
 epoch: 44, train_loss: 0.7292, test_loss: 0.8933, test_f1: 0.6034
 epoch: 45, train_loss: 0.7294, test_loss: 0.8949, test_f1: 0.6083
 epoch: 46, train_loss: 0.7243, test_loss: 0.8980, test_f1: 0.6144
 epoch: 47, train_loss: 0.7324, test_loss: 0.9310, test_f1: 0.5839
 epoch: 48, train_loss: 0.7148, test_loss: 0.9028, test_f1: 0.6076
 epoch: 49, train_loss: 0.7151, test_loss: 0.8685, test_f1: 0.6268
 epoch: 50, train_loss: 0.7190, test_loss: 0.8939, test_f1: 0.6256
 epoch: 51, train_loss: 0.7031, test_loss: 0.8785, test_f1: 0.6449
 epoch: 52, train_loss: 0.6936, test_loss: 0.8826, test_f1: 0.6322
 epoch: 53, train_loss: 0.6960, test_loss: 0.9093, test_f1: 0.6043
 epoch: 54, train_loss: 0.6944, test_loss: 0.8906, test_f1: 0.6207
 epoch: 55, train_loss: 0.6873, test_loss: 0.8833, test_f1: 0.6082
 epoch: 56, train_loss: 0.6727, test_loss: 0.9157, test_f1: 0.6040
 epoch: 57, train_loss: 0.6767, test_loss: 0.9191, test_f1: 0.6002
 epoch: 58, train_loss: 0.6798, test_loss: 0.9013, test_f1: 0.6010
 epoch: 59, train_loss: 0.6817, test_loss: 0.9089, test_f1: 0.6063
 epoch: 60, train_loss: 0.6786, test_loss: 0.8941, test_f1: 0.6205
 epoch: 61, train_loss: 0.6776, test_loss: 0.9144, test_f1: 0.6080
 epoch: 62, train_loss: 0.6584, test_loss: 0.8969, test_f1: 0.6189
 epoch: 63, train_loss: 0.6748, test_loss: 0.8876, test_f1: 0.6228
 epoch: 64, train_loss: 0.6592, test_loss: 0.9158, test_f1: 0.5936
 epoch: 65, train_loss: 0.6633, test_loss: 0.9180, test_f1: 0.6170
 epoch: 66, train_loss: 0.6744, test_loss: 0.9279, test_f1: 0.5941
 epoch: 67, train_loss: 0.6600, test_loss: 0.9457, test_f1: 0.6201
 epoch: 68, train_loss: 0.6631, test_loss: 0.9060, test_f1: 0.6178
 epoch: 69, train_loss: 0.6595, test_loss: 0.9347, test_f1: 0.6001
 epoch: 70, train_loss: 0.6518, test_loss: 0.9077, test_f1: 0.6154
 epoch: 71, train_loss: 0.6529, test_loss: 0.9091, test_f1: 0.6027
 epoch: 72, train_loss: 0.6507, test_loss: 0.9314, test_f1: 0.6187
 epoch: 73, train_loss: 0.6700, test_loss: 0.9486, test_f1: 0.6185
 epoch: 74, train_loss: 0.6524, test_loss: 0.9653, test_f1: 0.6371
 epoch: 75, train_loss: 0.6541, test_loss: 0.9421, test_f1: 0.6131
 epoch: 76, train_loss: 0.6518, test_loss: 0.9549, test_f1: 0.6001
 epoch: 77, train_loss: 0.6387, test_loss: 0.9310, test_f1: 0.6202
 epoch: 78, train_loss: 0.6309, test_loss: 0.9550, test_f1: 0.6268
 epoch: 79, train_loss: 0.6485, test_loss: 0.9416, test_f1: 0.6219
 epoch: 80, train_loss: 0.6329, test_loss: 0.9422, test_f1: 0.5954
 epoch: 81, train_loss: 0.6390, test_loss: 0.9324, test_f1: 0.6177
 epoch: 82, train_loss: 0.6238, test_loss: 0.9362, test_f1: 0.6260
 epoch: 83, train_loss: 0.6364, test_loss: 0.9334, test_f1: 0.6450
 epoch: 84, train_loss: 0.6207, test_loss: 0.9227, test_f1: 0.6195
 epoch: 85, train_loss: 0.6389, test_loss: 0.9323, test_f1: 0.6159
 epoch: 86, train_loss: 0.6253, test_loss: 0.9425, test_f1: 0.6113
 epoch: 87, train_loss: 0.6251, test_loss: 0.9218, test_f1: 0.6152
 epoch: 88, train_loss: 0.6362, test_loss: 0.9249, test_f1: 0.6423
 epoch: 89, train_loss: 0.6426, test_loss: 0.9265, test_f1: 0.6487
 epoch: 90, train_loss: 0.6244, test_loss: 0.9422, test_f1: 0.6204
 epoch: 91, train_loss: 0.6171, test_loss: 0.9159, test_f1: 0.6384
 epoch: 92, train_loss: 0.6117, test_loss: 0.9453, test_f1: 0.6114
 epoch: 93, train_loss: 0.6167, test_loss: 0.9290, test_f1: 0.6578
 epoch: 94, train_loss: 0.6149, test_loss: 0.9445, test_f1: 0.6196
 epoch: 95, train_loss: 0.6146, test_loss: 0.9609, test_f1: 0.6095
 epoch: 96, train_loss: 0.6146, test_loss: 0.9597, test_f1: 0.6155
 epoch: 97, train_loss: 0.6162, test_loss: 0.9408, test_f1: 0.6140
 epoch: 98, train_loss: 0.6196, test_loss: 0.9699, test_f1: 0.6341
 epoch: 99, train_loss: 0.6206, test_loss: 0.9529, test_f1: 0.6476
##################ITERATION #6 ****************************************
 epoch: 0, train_loss: 1.2220, test_loss: 1.0177, test_f1: 0.4660
 epoch: 1, train_loss: 1.0509, test_loss: 0.9648, test_f1: 0.5151
 epoch: 2, train_loss: 1.0226, test_loss: 0.9585, test_f1: 0.4998
 epoch: 3, train_loss: 1.0007, test_loss: 0.9416, test_f1: 0.4982
 epoch: 4, train_loss: 0.9817, test_loss: 0.9231, test_f1: 0.5069
 epoch: 5, train_loss: 0.9649, test_loss: 0.9239, test_f1: 0.5212
 epoch: 6, train_loss: 0.9563, test_loss: 0.9046, test_f1: 0.5301
 epoch: 7, train_loss: 0.9522, test_loss: 0.9064, test_f1: 0.5377
 epoch: 8, train_loss: 0.9310, test_loss: 0.9057, test_f1: 0.5162
 epoch: 9, train_loss: 0.9118, test_loss: 0.8874, test_f1: 0.5243
 epoch: 10, train_loss: 0.9237, test_loss: 0.8843, test_f1: 0.5431
 epoch: 11, train_loss: 0.9015, test_loss: 0.8805, test_f1: 0.5488
 epoch: 12, train_loss: 0.8855, test_loss: 0.8598, test_f1: 0.5644
 epoch: 13, train_loss: 0.8895, test_loss: 0.8791, test_f1: 0.5625
 epoch: 14, train_loss: 0.8798, test_loss: 0.8732, test_f1: 0.5651
 epoch: 15, train_loss: 0.8747, test_loss: 0.8613, test_f1: 0.5363
 epoch: 16, train_loss: 0.8679, test_loss: 0.8627, test_f1: 0.5474
 epoch: 17, train_loss: 0.8627, test_loss: 0.8774, test_f1: 0.5426
 epoch: 18, train_loss: 0.8480, test_loss: 0.8537, test_f1: 0.5563
 epoch: 19, train_loss: 0.8417, test_loss: 0.8497, test_f1: 0.5581
 epoch: 20, train_loss: 0.8404, test_loss: 0.8706, test_f1: 0.5579
 epoch: 21, train_loss: 0.8217, test_loss: 0.8339, test_f1: 0.5626
 epoch: 22, train_loss: 0.8260, test_loss: 0.8349, test_f1: 0.5795
 epoch: 23, train_loss: 0.8237, test_loss: 0.8683, test_f1: 0.5825
 epoch: 24, train_loss: 0.8157, test_loss: 0.8655, test_f1: 0.5674
 epoch: 25, train_loss: 0.8113, test_loss: 0.8558, test_f1: 0.5914
 epoch: 26, train_loss: 0.7866, test_loss: 0.8495, test_f1: 0.5878
 epoch: 27, train_loss: 0.7970, test_loss: 0.8407, test_f1: 0.5929
 epoch: 28, train_loss: 0.7930, test_loss: 0.8775, test_f1: 0.5762
 epoch: 29, train_loss: 0.7853, test_loss: 0.8882, test_f1: 0.5656
 epoch: 30, train_loss: 0.7823, test_loss: 0.8454, test_f1: 0.6063
 epoch: 31, train_loss: 0.7838, test_loss: 0.8692, test_f1: 0.5794
 epoch: 32, train_loss: 0.7686, test_loss: 0.8704, test_f1: 0.5993
 epoch: 33, train_loss: 0.7647, test_loss: 0.8818, test_f1: 0.5898
 epoch: 34, train_loss: 0.7635, test_loss: 0.8924, test_f1: 0.5966
 epoch: 35, train_loss: 0.7670, test_loss: 0.8671, test_f1: 0.5839
 epoch: 36, train_loss: 0.7663, test_loss: 0.8644, test_f1: 0.5926
 epoch: 37, train_loss: 0.7413, test_loss: 0.8820, test_f1: 0.6276
 epoch: 38, train_loss: 0.7526, test_loss: 0.8780, test_f1: 0.6139
 epoch: 39, train_loss: 0.7356, test_loss: 0.8701, test_f1: 0.6193
 epoch: 40, train_loss: 0.7466, test_loss: 0.8576, test_f1: 0.5999
 epoch: 41, train_loss: 0.7543, test_loss: 0.8829, test_f1: 0.6524
 epoch: 42, train_loss: 0.7271, test_loss: 0.8558, test_f1: 0.6336
 epoch: 43, train_loss: 0.7418, test_loss: 0.8845, test_f1: 0.6426
 epoch: 44, train_loss: 0.7353, test_loss: 0.9146, test_f1: 0.5928
 epoch: 45, train_loss: 0.7220, test_loss: 0.8980, test_f1: 0.6327
 epoch: 46, train_loss: 0.7279, test_loss: 0.9008, test_f1: 0.6215
 epoch: 47, train_loss: 0.7218, test_loss: 0.8892, test_f1: 0.6164
 epoch: 48, train_loss: 0.7164, test_loss: 0.8689, test_f1: 0.6432
 epoch: 49, train_loss: 0.7048, test_loss: 0.8959, test_f1: 0.6115
 epoch: 50, train_loss: 0.7135, test_loss: 0.8883, test_f1: 0.6192
 epoch: 51, train_loss: 0.6961, test_loss: 0.8796, test_f1: 0.6206
 epoch: 52, train_loss: 0.6913, test_loss: 0.8932, test_f1: 0.6452
 epoch: 53, train_loss: 0.6923, test_loss: 0.8741, test_f1: 0.6248
 epoch: 54, train_loss: 0.6876, test_loss: 0.8823, test_f1: 0.6307
 epoch: 55, train_loss: 0.6795, test_loss: 0.8880, test_f1: 0.6289
 epoch: 56, train_loss: 0.6732, test_loss: 0.9026, test_f1: 0.6405
 epoch: 57, train_loss: 0.6787, test_loss: 0.8960, test_f1: 0.6069
 epoch: 58, train_loss: 0.6709, test_loss: 0.8841, test_f1: 0.6182
 epoch: 59, train_loss: 0.6823, test_loss: 0.8956, test_f1: 0.6503
 epoch: 60, train_loss: 0.6724, test_loss: 0.9178, test_f1: 0.6288
 epoch: 61, train_loss: 0.6578, test_loss: 0.9211, test_f1: 0.6138
 epoch: 62, train_loss: 0.6672, test_loss: 0.9044, test_f1: 0.6221
 epoch: 63, train_loss: 0.6612, test_loss: 0.9048, test_f1: 0.6215
 epoch: 64, train_loss: 0.6715, test_loss: 0.9100, test_f1: 0.6091
 epoch: 65, train_loss: 0.6682, test_loss: 0.9170, test_f1: 0.6473
 epoch: 66, train_loss: 0.6484, test_loss: 0.9171, test_f1: 0.6363
 epoch: 67, train_loss: 0.6551, test_loss: 0.9093, test_f1: 0.6253
 epoch: 68, train_loss: 0.6535, test_loss: 0.9045, test_f1: 0.6158
 epoch: 69, train_loss: 0.6460, test_loss: 0.9446, test_f1: 0.6115
 epoch: 70, train_loss: 0.6481, test_loss: 0.9207, test_f1: 0.6178
 epoch: 71, train_loss: 0.6537, test_loss: 0.9122, test_f1: 0.6061
 epoch: 72, train_loss: 0.6477, test_loss: 0.9284, test_f1: 0.6099
 epoch: 73, train_loss: 0.6411, test_loss: 0.9426, test_f1: 0.6648
 epoch: 74, train_loss: 0.6427, test_loss: 0.9271, test_f1: 0.6242
 epoch: 75, train_loss: 0.6411, test_loss: 0.9147, test_f1: 0.6353
 epoch: 76, train_loss: 0.6439, test_loss: 0.9201, test_f1: 0.6438
 epoch: 77, train_loss: 0.6412, test_loss: 0.9383, test_f1: 0.6129
 epoch: 78, train_loss: 0.6280, test_loss: 0.9530, test_f1: 0.6261
 epoch: 79, train_loss: 0.6257, test_loss: 0.9193, test_f1: 0.6246
 epoch: 80, train_loss: 0.6257, test_loss: 0.9494, test_f1: 0.6127
 epoch: 81, train_loss: 0.6345, test_loss: 0.9418, test_f1: 0.6521
 epoch: 82, train_loss: 0.6267, test_loss: 0.9254, test_f1: 0.6456
 epoch: 83, train_loss: 0.6200, test_loss: 0.9201, test_f1: 0.6228
 epoch: 84, train_loss: 0.6171, test_loss: 0.9555, test_f1: 0.6175
 epoch: 85, train_loss: 0.6114, test_loss: 0.9441, test_f1: 0.6114
 epoch: 86, train_loss: 0.6178, test_loss: 0.9615, test_f1: 0.6230
 epoch: 87, train_loss: 0.6161, test_loss: 0.9707, test_f1: 0.6337
 epoch: 88, train_loss: 0.6227, test_loss: 0.9416, test_f1: 0.6250
 epoch: 89, train_loss: 0.6142, test_loss: 0.9528, test_f1: 0.6484
 epoch: 90, train_loss: 0.6051, test_loss: 0.9441, test_f1: 0.6444
 epoch: 91, train_loss: 0.6144, test_loss: 0.9658, test_f1: 0.6370
 epoch: 92, train_loss: 0.6230, test_loss: 0.9535, test_f1: 0.6252
 epoch: 93, train_loss: 0.6082, test_loss: 0.9860, test_f1: 0.6251
 epoch: 94, train_loss: 0.5971, test_loss: 1.0076, test_f1: 0.6155
 epoch: 95, train_loss: 0.6118, test_loss: 0.9516, test_f1: 0.6277
 epoch: 96, train_loss: 0.6088, test_loss: 0.9548, test_f1: 0.6343
 epoch: 97, train_loss: 0.6040, test_loss: 0.9749, test_f1: 0.6189
 epoch: 98, train_loss: 0.6053, test_loss: 0.9647, test_f1: 0.6406
 epoch: 99, train_loss: 0.5878, test_loss: 0.9324, test_f1: 0.6268
##################ITERATION #7 ****************************************
 epoch: 0, train_loss: 1.3149, test_loss: 1.0057, test_f1: 0.4778
 epoch: 1, train_loss: 1.1197, test_loss: 0.9888, test_f1: 0.4612
 epoch: 2, train_loss: 1.0690, test_loss: 0.9534, test_f1: 0.4764
 epoch: 3, train_loss: 1.0363, test_loss: 0.9405, test_f1: 0.5086
 epoch: 4, train_loss: 1.0067, test_loss: 0.9301, test_f1: 0.5136
 epoch: 5, train_loss: 0.9844, test_loss: 0.9335, test_f1: 0.4874
 epoch: 6, train_loss: 0.9742, test_loss: 0.9201, test_f1: 0.5335
 epoch: 7, train_loss: 0.9552, test_loss: 0.9121, test_f1: 0.5191
 epoch: 8, train_loss: 0.9397, test_loss: 0.9143, test_f1: 0.5229
 epoch: 9, train_loss: 0.9304, test_loss: 0.9017, test_f1: 0.5567
 epoch: 10, train_loss: 0.9172, test_loss: 0.9015, test_f1: 0.5544
 epoch: 11, train_loss: 0.9225, test_loss: 0.9019, test_f1: 0.5173
 epoch: 12, train_loss: 0.9073, test_loss: 0.8966, test_f1: 0.5684
 epoch: 13, train_loss: 0.8939, test_loss: 0.8827, test_f1: 0.5587
 epoch: 14, train_loss: 0.8946, test_loss: 0.8804, test_f1: 0.5642
 epoch: 15, train_loss: 0.8880, test_loss: 0.8757, test_f1: 0.5681
 epoch: 16, train_loss: 0.8735, test_loss: 0.8716, test_f1: 0.5566
 epoch: 17, train_loss: 0.8842, test_loss: 0.8906, test_f1: 0.5693
 epoch: 18, train_loss: 0.8670, test_loss: 0.9018, test_f1: 0.5580
 epoch: 19, train_loss: 0.8584, test_loss: 0.8818, test_f1: 0.5933
 epoch: 20, train_loss: 0.8475, test_loss: 0.8807, test_f1: 0.5657
 epoch: 21, train_loss: 0.8474, test_loss: 0.9185, test_f1: 0.5664
 epoch: 22, train_loss: 0.8444, test_loss: 0.8806, test_f1: 0.5864
 epoch: 23, train_loss: 0.8512, test_loss: 0.8710, test_f1: 0.5808
 epoch: 24, train_loss: 0.8389, test_loss: 0.8619, test_f1: 0.5983
 epoch: 25, train_loss: 0.8254, test_loss: 0.8571, test_f1: 0.6052
 epoch: 26, train_loss: 0.8210, test_loss: 0.8489, test_f1: 0.5704
 epoch: 27, train_loss: 0.8151, test_loss: 0.8776, test_f1: 0.5677
 epoch: 28, train_loss: 0.8104, test_loss: 0.8680, test_f1: 0.6082
 epoch: 29, train_loss: 0.8049, test_loss: 0.8783, test_f1: 0.6012
 epoch: 30, train_loss: 0.8048, test_loss: 0.8641, test_f1: 0.5823
 epoch: 31, train_loss: 0.7932, test_loss: 0.8831, test_f1: 0.5854
 epoch: 32, train_loss: 0.7923, test_loss: 0.8433, test_f1: 0.5918
 epoch: 33, train_loss: 0.7981, test_loss: 0.8793, test_f1: 0.5659
 epoch: 34, train_loss: 0.7792, test_loss: 0.8341, test_f1: 0.5861
 epoch: 35, train_loss: 0.7771, test_loss: 0.8898, test_f1: 0.5787
 epoch: 36, train_loss: 0.7777, test_loss: 0.8548, test_f1: 0.5981
 epoch: 37, train_loss: 0.7631, test_loss: 0.8383, test_f1: 0.5949
 epoch: 38, train_loss: 0.7618, test_loss: 0.8507, test_f1: 0.5979
 epoch: 39, train_loss: 0.7622, test_loss: 0.9018, test_f1: 0.5889
 epoch: 40, train_loss: 0.7524, test_loss: 0.8968, test_f1: 0.6263
 epoch: 41, train_loss: 0.7436, test_loss: 0.8555, test_f1: 0.6243
 epoch: 42, train_loss: 0.7393, test_loss: 0.8616, test_f1: 0.6196
 epoch: 43, train_loss: 0.7517, test_loss: 0.8391, test_f1: 0.6206
 epoch: 44, train_loss: 0.7393, test_loss: 0.9118, test_f1: 0.6160
 epoch: 45, train_loss: 0.7430, test_loss: 0.8813, test_f1: 0.6292
 epoch: 46, train_loss: 0.7396, test_loss: 0.8769, test_f1: 0.5870
 epoch: 47, train_loss: 0.7292, test_loss: 0.8832, test_f1: 0.6058
 epoch: 48, train_loss: 0.7456, test_loss: 0.8679, test_f1: 0.6083
 epoch: 49, train_loss: 0.7349, test_loss: 0.8865, test_f1: 0.6150
 epoch: 50, train_loss: 0.7140, test_loss: 0.9035, test_f1: 0.6497
 epoch: 51, train_loss: 0.6932, test_loss: 0.8867, test_f1: 0.6019
 epoch: 52, train_loss: 0.7059, test_loss: 0.8798, test_f1: 0.6477
 epoch: 53, train_loss: 0.6930, test_loss: 0.8793, test_f1: 0.6405
 epoch: 54, train_loss: 0.6973, test_loss: 0.9068, test_f1: 0.6305
 epoch: 55, train_loss: 0.7018, test_loss: 0.8542, test_f1: 0.6455
 epoch: 56, train_loss: 0.6775, test_loss: 0.8565, test_f1: 0.6462
 epoch: 57, train_loss: 0.6969, test_loss: 0.8773, test_f1: 0.6193
 epoch: 58, train_loss: 0.6936, test_loss: 0.8805, test_f1: 0.6486
 epoch: 59, train_loss: 0.6849, test_loss: 0.9133, test_f1: 0.6457
 epoch: 60, train_loss: 0.6818, test_loss: 0.8997, test_f1: 0.6438
 epoch: 61, train_loss: 0.6826, test_loss: 0.8864, test_f1: 0.6315
 epoch: 62, train_loss: 0.6801, test_loss: 0.8749, test_f1: 0.6256
 epoch: 63, train_loss: 0.6756, test_loss: 0.8885, test_f1: 0.6252
 epoch: 64, train_loss: 0.6710, test_loss: 0.8828, test_f1: 0.6517
 epoch: 65, train_loss: 0.6671, test_loss: 0.8711, test_f1: 0.6212
 epoch: 66, train_loss: 0.6611, test_loss: 0.8953, test_f1: 0.6551
 epoch: 67, train_loss: 0.6653, test_loss: 0.9057, test_f1: 0.6628
 epoch: 68, train_loss: 0.6526, test_loss: 0.9142, test_f1: 0.6400
 epoch: 69, train_loss: 0.6601, test_loss: 0.8626, test_f1: 0.6281
 epoch: 70, train_loss: 0.6644, test_loss: 0.8980, test_f1: 0.6598
 epoch: 71, train_loss: 0.6693, test_loss: 0.8578, test_f1: 0.6564
 epoch: 72, train_loss: 0.6513, test_loss: 0.8833, test_f1: 0.6427
 epoch: 73, train_loss: 0.6497, test_loss: 0.9125, test_f1: 0.6500
 epoch: 74, train_loss: 0.6511, test_loss: 0.9108, test_f1: 0.6709
 epoch: 75, train_loss: 0.6373, test_loss: 0.9301, test_f1: 0.6605
 epoch: 76, train_loss: 0.6530, test_loss: 0.8535, test_f1: 0.6733
 epoch: 77, train_loss: 0.6432, test_loss: 0.9098, test_f1: 0.6668
 epoch: 78, train_loss: 0.6515, test_loss: 0.8792, test_f1: 0.6642
 epoch: 79, train_loss: 0.6294, test_loss: 0.9103, test_f1: 0.6516
 epoch: 80, train_loss: 0.6405, test_loss: 0.8888, test_f1: 0.6324
 epoch: 81, train_loss: 0.6410, test_loss: 0.9214, test_f1: 0.6660
 epoch: 82, train_loss: 0.6282, test_loss: 0.8693, test_f1: 0.6422
 epoch: 83, train_loss: 0.6312, test_loss: 0.8821, test_f1: 0.6686
 epoch: 84, train_loss: 0.6292, test_loss: 0.8872, test_f1: 0.6660
 epoch: 85, train_loss: 0.6296, test_loss: 0.9090, test_f1: 0.6458
 epoch: 86, train_loss: 0.6318, test_loss: 0.9093, test_f1: 0.6522
 epoch: 87, train_loss: 0.6411, test_loss: 0.9099, test_f1: 0.6510
 epoch: 88, train_loss: 0.6235, test_loss: 0.8921, test_f1: 0.6596
 epoch: 89, train_loss: 0.6163, test_loss: 0.9275, test_f1: 0.6345
 epoch: 90, train_loss: 0.6201, test_loss: 0.9012, test_f1: 0.6349
 epoch: 91, train_loss: 0.6265, test_loss: 0.9078, test_f1: 0.6409
 epoch: 92, train_loss: 0.6225, test_loss: 0.8730, test_f1: 0.6825
 epoch: 93, train_loss: 0.6173, test_loss: 0.9160, test_f1: 0.6512
 epoch: 94, train_loss: 0.6137, test_loss: 0.9285, test_f1: 0.6632
 epoch: 95, train_loss: 0.6134, test_loss: 0.9302, test_f1: 0.6535
 epoch: 96, train_loss: 0.6174, test_loss: 0.9114, test_f1: 0.6674
 epoch: 97, train_loss: 0.6105, test_loss: 0.8702, test_f1: 0.6740
 epoch: 98, train_loss: 0.6031, test_loss: 0.9035, test_f1: 0.6392
 epoch: 99, train_loss: 0.6060, test_loss: 0.9352, test_f1: 0.6479
##################ITERATION #8 ****************************************
 epoch: 0, train_loss: 1.2582, test_loss: 1.0020, test_f1: 0.4834
 epoch: 1, train_loss: 1.0873, test_loss: 0.9672, test_f1: 0.5192
 epoch: 2, train_loss: 1.0444, test_loss: 0.9456, test_f1: 0.4828
 epoch: 3, train_loss: 1.0192, test_loss: 0.9254, test_f1: 0.5044
 epoch: 4, train_loss: 0.9860, test_loss: 0.9138, test_f1: 0.4971
 epoch: 5, train_loss: 0.9631, test_loss: 0.9110, test_f1: 0.5203
 epoch: 6, train_loss: 0.9688, test_loss: 0.8981, test_f1: 0.5146
 epoch: 7, train_loss: 0.9504, test_loss: 0.8898, test_f1: 0.5277
 epoch: 8, train_loss: 0.9206, test_loss: 0.8959, test_f1: 0.5224
 epoch: 9, train_loss: 0.9285, test_loss: 0.8886, test_f1: 0.5219
 epoch: 10, train_loss: 0.9240, test_loss: 0.8985, test_f1: 0.5375
 epoch: 11, train_loss: 0.9098, test_loss: 0.8972, test_f1: 0.5462
 epoch: 12, train_loss: 0.8915, test_loss: 0.8799, test_f1: 0.5278
 epoch: 13, train_loss: 0.8949, test_loss: 0.8875, test_f1: 0.5224
 epoch: 14, train_loss: 0.8768, test_loss: 0.8627, test_f1: 0.5429
 epoch: 15, train_loss: 0.8750, test_loss: 0.8744, test_f1: 0.5500
 epoch: 16, train_loss: 0.8671, test_loss: 0.8669, test_f1: 0.5252
 epoch: 17, train_loss: 0.8707, test_loss: 0.8655, test_f1: 0.5527
 epoch: 18, train_loss: 0.8581, test_loss: 0.8767, test_f1: 0.5696
 epoch: 19, train_loss: 0.8413, test_loss: 0.8683, test_f1: 0.5530
 epoch: 20, train_loss: 0.8441, test_loss: 0.8561, test_f1: 0.5647
 epoch: 21, train_loss: 0.8312, test_loss: 0.8393, test_f1: 0.5741
 epoch: 22, train_loss: 0.8317, test_loss: 0.8385, test_f1: 0.5626
 epoch: 23, train_loss: 0.8422, test_loss: 0.8597, test_f1: 0.5630
 epoch: 24, train_loss: 0.8235, test_loss: 0.8625, test_f1: 0.5539
 epoch: 25, train_loss: 0.8243, test_loss: 0.8582, test_f1: 0.5873
 epoch: 26, train_loss: 0.8109, test_loss: 0.8849, test_f1: 0.5556
 epoch: 27, train_loss: 0.8070, test_loss: 0.8650, test_f1: 0.5789
 epoch: 28, train_loss: 0.8110, test_loss: 0.8642, test_f1: 0.5780
 epoch: 29, train_loss: 0.8060, test_loss: 0.8599, test_f1: 0.5770
 epoch: 30, train_loss: 0.8021, test_loss: 0.8801, test_f1: 0.5678
 epoch: 31, train_loss: 0.7847, test_loss: 0.8817, test_f1: 0.5799
 epoch: 32, train_loss: 0.7827, test_loss: 0.8468, test_f1: 0.5887
 epoch: 33, train_loss: 0.7848, test_loss: 0.8378, test_f1: 0.5833
 epoch: 34, train_loss: 0.7855, test_loss: 0.8478, test_f1: 0.5899
 epoch: 35, train_loss: 0.7721, test_loss: 0.8816, test_f1: 0.5925
 epoch: 36, train_loss: 0.7614, test_loss: 0.8603, test_f1: 0.5859
 epoch: 37, train_loss: 0.7652, test_loss: 0.8704, test_f1: 0.5829
 epoch: 38, train_loss: 0.7697, test_loss: 0.8647, test_f1: 0.5882
 epoch: 39, train_loss: 0.7528, test_loss: 0.8556, test_f1: 0.5832
 epoch: 40, train_loss: 0.7638, test_loss: 0.8456, test_f1: 0.6068
 epoch: 41, train_loss: 0.7596, test_loss: 0.8733, test_f1: 0.5944
 epoch: 42, train_loss: 0.7511, test_loss: 0.8521, test_f1: 0.5917
 epoch: 43, train_loss: 0.7480, test_loss: 0.8765, test_f1: 0.6067
 epoch: 44, train_loss: 0.7279, test_loss: 0.8636, test_f1: 0.6031
 epoch: 45, train_loss: 0.7379, test_loss: 0.8641, test_f1: 0.5916
 epoch: 46, train_loss: 0.7259, test_loss: 0.8836, test_f1: 0.5979
 epoch: 47, train_loss: 0.7307, test_loss: 0.8626, test_f1: 0.6080
 epoch: 48, train_loss: 0.7423, test_loss: 0.8734, test_f1: 0.6093
 epoch: 49, train_loss: 0.7332, test_loss: 0.8737, test_f1: 0.6107
 epoch: 50, train_loss: 0.7163, test_loss: 0.8515, test_f1: 0.6100
 epoch: 51, train_loss: 0.7052, test_loss: 0.8798, test_f1: 0.5997
 epoch: 52, train_loss: 0.6894, test_loss: 0.8760, test_f1: 0.5999
 epoch: 53, train_loss: 0.6994, test_loss: 0.8516, test_f1: 0.6300
 epoch: 54, train_loss: 0.6955, test_loss: 0.8514, test_f1: 0.6042
 epoch: 55, train_loss: 0.7104, test_loss: 0.8746, test_f1: 0.5990
 epoch: 56, train_loss: 0.6846, test_loss: 0.8572, test_f1: 0.5946
 epoch: 57, train_loss: 0.6928, test_loss: 0.8616, test_f1: 0.6064
 epoch: 58, train_loss: 0.6870, test_loss: 0.8502, test_f1: 0.6118
 epoch: 59, train_loss: 0.6829, test_loss: 0.8623, test_f1: 0.6092
 epoch: 60, train_loss: 0.6771, test_loss: 0.8874, test_f1: 0.6031
 epoch: 61, train_loss: 0.6788, test_loss: 0.8671, test_f1: 0.5958
 epoch: 62, train_loss: 0.6717, test_loss: 0.8751, test_f1: 0.5962
 epoch: 63, train_loss: 0.6826, test_loss: 0.8765, test_f1: 0.6291
 epoch: 64, train_loss: 0.6798, test_loss: 0.8679, test_f1: 0.5866
 epoch: 65, train_loss: 0.6789, test_loss: 0.8787, test_f1: 0.6050
 epoch: 66, train_loss: 0.6803, test_loss: 0.8723, test_f1: 0.6063
 epoch: 67, train_loss: 0.6752, test_loss: 0.8742, test_f1: 0.6088
 epoch: 68, train_loss: 0.6732, test_loss: 0.8920, test_f1: 0.6165
 epoch: 69, train_loss: 0.6553, test_loss: 0.8936, test_f1: 0.6366
 epoch: 70, train_loss: 0.6610, test_loss: 0.8879, test_f1: 0.6027
 epoch: 71, train_loss: 0.6598, test_loss: 0.8863, test_f1: 0.6268
 epoch: 72, train_loss: 0.6617, test_loss: 0.9012, test_f1: 0.6169
 epoch: 73, train_loss: 0.6586, test_loss: 0.8769, test_f1: 0.6173
 epoch: 74, train_loss: 0.6595, test_loss: 0.8871, test_f1: 0.6258
 epoch: 75, train_loss: 0.6599, test_loss: 0.8955, test_f1: 0.6368
 epoch: 76, train_loss: 0.6570, test_loss: 0.9077, test_f1: 0.6261
 epoch: 77, train_loss: 0.6462, test_loss: 0.8758, test_f1: 0.6017
 epoch: 78, train_loss: 0.6561, test_loss: 0.8609, test_f1: 0.6037
 epoch: 79, train_loss: 0.6379, test_loss: 0.8868, test_f1: 0.6146
 epoch: 80, train_loss: 0.6534, test_loss: 0.8796, test_f1: 0.6251
 epoch: 81, train_loss: 0.6406, test_loss: 0.9002, test_f1: 0.6242
 epoch: 82, train_loss: 0.6369, test_loss: 0.8820, test_f1: 0.6290
 epoch: 83, train_loss: 0.6444, test_loss: 0.8725, test_f1: 0.6157
 epoch: 84, train_loss: 0.6361, test_loss: 0.9246, test_f1: 0.6137
 epoch: 85, train_loss: 0.6256, test_loss: 0.9075, test_f1: 0.6356
 epoch: 86, train_loss: 0.6428, test_loss: 0.8872, test_f1: 0.6211
 epoch: 87, train_loss: 0.6342, test_loss: 0.8885, test_f1: 0.6125
 epoch: 88, train_loss: 0.6301, test_loss: 0.8850, test_f1: 0.6364
 epoch: 89, train_loss: 0.6211, test_loss: 0.8901, test_f1: 0.6457
 epoch: 90, train_loss: 0.6366, test_loss: 0.8725, test_f1: 0.6532
 epoch: 91, train_loss: 0.6257, test_loss: 0.8940, test_f1: 0.6420
 epoch: 92, train_loss: 0.6316, test_loss: 0.8962, test_f1: 0.6513
 epoch: 93, train_loss: 0.6189, test_loss: 0.8830, test_f1: 0.6386
 epoch: 94, train_loss: 0.6227, test_loss: 0.8999, test_f1: 0.6610
 epoch: 95, train_loss: 0.6131, test_loss: 0.8670, test_f1: 0.6419
 epoch: 96, train_loss: 0.6127, test_loss: 0.8983, test_f1: 0.6702
 epoch: 97, train_loss: 0.6138, test_loss: 0.8874, test_f1: 0.6519
 epoch: 98, train_loss: 0.6064, test_loss: 0.9037, test_f1: 0.6232
 epoch: 99, train_loss: 0.6089, test_loss: 0.8975, test_f1: 0.6354
##################ITERATION #9 ****************************************
 epoch: 0, train_loss: 1.3123, test_loss: 1.0104, test_f1: 0.4753
 epoch: 1, train_loss: 1.0859, test_loss: 0.9872, test_f1: 0.5005
 epoch: 2, train_loss: 1.0539, test_loss: 0.9830, test_f1: 0.5071
 epoch: 3, train_loss: 1.0307, test_loss: 0.9548, test_f1: 0.5026
 epoch: 4, train_loss: 0.9907, test_loss: 0.9453, test_f1: 0.5227
 epoch: 5, train_loss: 0.9752, test_loss: 0.9478, test_f1: 0.5164
 epoch: 6, train_loss: 0.9683, test_loss: 0.9384, test_f1: 0.5285
 epoch: 7, train_loss: 0.9632, test_loss: 0.9230, test_f1: 0.5565
 epoch: 8, train_loss: 0.9386, test_loss: 0.9277, test_f1: 0.5432
 epoch: 9, train_loss: 0.9305, test_loss: 0.9258, test_f1: 0.5195
 epoch: 10, train_loss: 0.9159, test_loss: 0.9063, test_f1: 0.5259
 epoch: 11, train_loss: 0.9118, test_loss: 0.9092, test_f1: 0.5248
 epoch: 12, train_loss: 0.8908, test_loss: 0.8892, test_f1: 0.5619
 epoch: 13, train_loss: 0.8861, test_loss: 0.9089, test_f1: 0.5617
 epoch: 14, train_loss: 0.8777, test_loss: 0.8845, test_f1: 0.5541
 epoch: 15, train_loss: 0.8655, test_loss: 0.8933, test_f1: 0.5718
 epoch: 16, train_loss: 0.8531, test_loss: 0.9036, test_f1: 0.5623
 epoch: 17, train_loss: 0.8534, test_loss: 0.9102, test_f1: 0.5693
 epoch: 18, train_loss: 0.8485, test_loss: 0.8870, test_f1: 0.5868
 epoch: 19, train_loss: 0.8345, test_loss: 0.8969, test_f1: 0.5951
 epoch: 20, train_loss: 0.8470, test_loss: 0.8678, test_f1: 0.5675
 epoch: 21, train_loss: 0.8387, test_loss: 0.8914, test_f1: 0.6001
 epoch: 22, train_loss: 0.8148, test_loss: 0.8848, test_f1: 0.5944
 epoch: 23, train_loss: 0.8089, test_loss: 0.8852, test_f1: 0.5904
 epoch: 24, train_loss: 0.8109, test_loss: 0.9135, test_f1: 0.5921
 epoch: 25, train_loss: 0.8064, test_loss: 0.8860, test_f1: 0.6039
 epoch: 26, train_loss: 0.7994, test_loss: 0.8815, test_f1: 0.6051
 epoch: 27, train_loss: 0.7995, test_loss: 0.8673, test_f1: 0.5891
 epoch: 28, train_loss: 0.7868, test_loss: 0.8860, test_f1: 0.6037
 epoch: 29, train_loss: 0.8006, test_loss: 0.8896, test_f1: 0.6183
 epoch: 30, train_loss: 0.7842, test_loss: 0.8723, test_f1: 0.6118
 epoch: 31, train_loss: 0.7712, test_loss: 0.8717, test_f1: 0.6035
 epoch: 32, train_loss: 0.7703, test_loss: 0.9082, test_f1: 0.6168
 epoch: 33, train_loss: 0.7647, test_loss: 0.8845, test_f1: 0.6316
 epoch: 34, train_loss: 0.7608, test_loss: 0.8990, test_f1: 0.5926
 epoch: 35, train_loss: 0.7660, test_loss: 0.8519, test_f1: 0.6109
 epoch: 36, train_loss: 0.7604, test_loss: 0.8733, test_f1: 0.6075
 epoch: 37, train_loss: 0.7462, test_loss: 0.8667, test_f1: 0.5891
 epoch: 38, train_loss: 0.7377, test_loss: 0.8801, test_f1: 0.6226
 epoch: 39, train_loss: 0.7446, test_loss: 0.9039, test_f1: 0.6042
 epoch: 40, train_loss: 0.7347, test_loss: 0.8853, test_f1: 0.6283
 epoch: 41, train_loss: 0.7370, test_loss: 0.8790, test_f1: 0.6222
 epoch: 42, train_loss: 0.7291, test_loss: 0.8930, test_f1: 0.6241
 epoch: 43, train_loss: 0.7257, test_loss: 0.8997, test_f1: 0.6214
 epoch: 44, train_loss: 0.7314, test_loss: 0.9147, test_f1: 0.6020
 epoch: 45, train_loss: 0.7297, test_loss: 0.9277, test_f1: 0.6453
 epoch: 46, train_loss: 0.7230, test_loss: 0.9150, test_f1: 0.6264
 epoch: 47, train_loss: 0.7257, test_loss: 0.9049, test_f1: 0.6227
 epoch: 48, train_loss: 0.7146, test_loss: 0.9050, test_f1: 0.6300
 epoch: 49, train_loss: 0.7087, test_loss: 0.8903, test_f1: 0.6216
 epoch: 50, train_loss: 0.7033, test_loss: 0.8983, test_f1: 0.6124
 epoch: 51, train_loss: 0.6773, test_loss: 0.8916, test_f1: 0.6216
 epoch: 52, train_loss: 0.6905, test_loss: 0.8882, test_f1: 0.6255
 epoch: 53, train_loss: 0.6872, test_loss: 0.8905, test_f1: 0.6273
 epoch: 54, train_loss: 0.6862, test_loss: 0.9012, test_f1: 0.6315
 epoch: 55, train_loss: 0.6849, test_loss: 0.9049, test_f1: 0.6029
 epoch: 56, train_loss: 0.6683, test_loss: 0.8974, test_f1: 0.6328
 epoch: 57, train_loss: 0.6827, test_loss: 0.9089, test_f1: 0.6141
 epoch: 58, train_loss: 0.6700, test_loss: 0.9015, test_f1: 0.6251
 epoch: 59, train_loss: 0.6544, test_loss: 0.9085, test_f1: 0.6398
 epoch: 60, train_loss: 0.6757, test_loss: 0.9203, test_f1: 0.6320
 epoch: 61, train_loss: 0.6702, test_loss: 0.9147, test_f1: 0.6328
 epoch: 62, train_loss: 0.6621, test_loss: 0.8852, test_f1: 0.6311
 epoch: 63, train_loss: 0.6674, test_loss: 0.9341, test_f1: 0.6406
 epoch: 64, train_loss: 0.6617, test_loss: 0.9202, test_f1: 0.6442
 epoch: 65, train_loss: 0.6588, test_loss: 0.9116, test_f1: 0.6371
 epoch: 66, train_loss: 0.6531, test_loss: 0.9213, test_f1: 0.6173
 epoch: 67, train_loss: 0.6661, test_loss: 0.9234, test_f1: 0.6269
 epoch: 68, train_loss: 0.6644, test_loss: 0.8948, test_f1: 0.6311
 epoch: 69, train_loss: 0.6554, test_loss: 0.9168, test_f1: 0.6534
 epoch: 70, train_loss: 0.6576, test_loss: 0.9137, test_f1: 0.6237
 epoch: 71, train_loss: 0.6500, test_loss: 0.9243, test_f1: 0.6420
 epoch: 72, train_loss: 0.6575, test_loss: 0.9312, test_f1: 0.6252
 epoch: 73, train_loss: 0.6529, test_loss: 0.9354, test_f1: 0.6316
 epoch: 74, train_loss: 0.6280, test_loss: 0.9316, test_f1: 0.6343
 epoch: 75, train_loss: 0.6400, test_loss: 0.9243, test_f1: 0.6326
 epoch: 76, train_loss: 0.6375, test_loss: 0.9213, test_f1: 0.6317
 epoch: 77, train_loss: 0.6377, test_loss: 0.9321, test_f1: 0.6387
 epoch: 78, train_loss: 0.6391, test_loss: 0.9351, test_f1: 0.6231
 epoch: 79, train_loss: 0.6261, test_loss: 0.9272, test_f1: 0.6511
 epoch: 80, train_loss: 0.6383, test_loss: 0.9327, test_f1: 0.6563
 epoch: 81, train_loss: 0.6318, test_loss: 0.9579, test_f1: 0.6444
 epoch: 82, train_loss: 0.6273, test_loss: 0.9383, test_f1: 0.6545
 epoch: 83, train_loss: 0.6330, test_loss: 0.9509, test_f1: 0.6414
 epoch: 84, train_loss: 0.6370, test_loss: 0.9278, test_f1: 0.6482
 epoch: 85, train_loss: 0.6351, test_loss: 0.9310, test_f1: 0.6629
 epoch: 86, train_loss: 0.6306, test_loss: 0.9365, test_f1: 0.6403
 epoch: 87, train_loss: 0.6302, test_loss: 0.9400, test_f1: 0.6339
 epoch: 88, train_loss: 0.6300, test_loss: 0.9250, test_f1: 0.6553
 epoch: 89, train_loss: 0.6183, test_loss: 0.9315, test_f1: 0.6390
 epoch: 90, train_loss: 0.6248, test_loss: 0.9267, test_f1: 0.6381
 epoch: 91, train_loss: 0.6192, test_loss: 0.9505, test_f1: 0.6255
 epoch: 92, train_loss: 0.6150, test_loss: 0.9583, test_f1: 0.6380
 epoch: 93, train_loss: 0.6096, test_loss: 0.9318, test_f1: 0.6579
 epoch: 94, train_loss: 0.6079, test_loss: 0.9368, test_f1: 0.6527
 epoch: 95, train_loss: 0.6095, test_loss: 0.9596, test_f1: 0.6567
 epoch: 96, train_loss: 0.6066, test_loss: 0.9596, test_f1: 0.6454
 epoch: 97, train_loss: 0.5994, test_loss: 0.9600, test_f1: 0.6293
 epoch: 98, train_loss: 0.6050, test_loss: 0.9723, test_f1: 0.6443
 epoch: 99, train_loss: 0.6011, test_loss: 0.9595, test_f1: 0.6564

Training completed in 1105.63 seconds
Best F1: 0.7014 at epoch 94
Mean F1 across iterations: 0.6740  0.0119
========================FINAL RESULTS================================
FEGIN weighted F1: 0.7014  0.0119
python main.py --data ltspice_examples --representation component_net --model FEGIN --layers 2 --hiddens 128 --batch_size 32 --lr 0.0001 --emb_size 128 --epochs 100 --save_appendix component_net_L2_H128_BS32_LR0.0001_E128 --no_val
-----



STDERR:
  File "main.py", line 370, in <module>
    main()
  File "main.py", line 254, in main
    dataset = dataset_class(
  File "/home/philip/projects/llm_inference_code_repo/Circuit-Completion-Using-GNNs/component_classification_with_link_prediction_head/evaluation/FEGIN/kernel/circuit_datasets.py", line 15, in __init__
    self.data, self.slices = torch.load(self.processed_paths[0])
  File "/home/philip/.local/lib/python3.8/site-packages/torch/serialization.py", line 1040, in load
    warnings.warn(
  File "/usr/lib/python3.8/warnings.py", line 109, in _showwarnmsg
    sw(msg.message, msg.category, msg.filename, msg.lineno,
  File "main.py", line 47, in warn_with_traceback
    traceback.print_stack(file=log)
/home/philip/projects/llm_inference_code_repo/Circuit-Completion-Using-GNNs/component_classification_with_link_prediction_head/evaluation/FEGIN/kernel/circuit_datasets.py:15: FutureWarning: You are using `torch.load` with `weights_only=False` (the current default value), which uses the default pickle module implicitly. It is possible to construct malicious pickle data which will execute arbitrary code during unpickling (See https://github.com/pytorch/pytorch/blob/main/SECURITY.md#untrusted-models for more details). In a future release, the default value for `weights_only` will be flipped to `True`. This limits the functions that could be executed during unpickling. Arbitrary objects will no longer be allowed to be loaded via this mode unless they are explicitly allowlisted by the user via `torch.serialization.add_safe_globals`. We recommend you start setting `weights_only=True` for any use case where you don't have full control of the loaded file. Please open an issue on GitHub for any issues related to this experimental feature.
  self.data, self.slices = torch.load(self.processed_paths[0])
