STDOUT:
Results will be saved in /home/philip/projects/ltspice_examples_code_repo/Circuit-Completion-Using-GNNs/component_classification_with_link_prediction_head/evaluation/FEGIN/results/model_FEGIN_dataset_ltspice_demos
Command line input: python main.py --data ltspice_demos --representation component_net --model FEGIN --layers 4 --hiddens 16 --batch_size 64 --lr 0.01 --emb_size 250 --epochs 100 --save_appendix component_net_L4_H16_BS64_LR0.01_E250 --no_val
 is saved.
-----
ltspice_demos - FEGIN
Using 4 layers, 16 hidden units, h = 2
Loading component_net representation dataset
ENTERED
Training FEGIN on component_net representation
Train: 1565, Test: 383
##################ITERATION #0 ****************************************
 epoch: 0, train_loss: 1.2919, test_loss: 1.4376, test_f1: 0.1365
 epoch: 1, train_loss: 1.1805, test_loss: 1.3040, test_f1: 0.2281
 epoch: 2, train_loss: 1.1412, test_loss: 1.2360, test_f1: 0.3710
 epoch: 3, train_loss: 1.0945, test_loss: 1.2359, test_f1: 0.4183
 epoch: 4, train_loss: 1.0382, test_loss: 1.0954, test_f1: 0.4525
 epoch: 5, train_loss: 1.0107, test_loss: 1.1151, test_f1: 0.4300
 epoch: 6, train_loss: 1.0003, test_loss: 1.0807, test_f1: 0.4880
 epoch: 7, train_loss: 0.9747, test_loss: 1.1042, test_f1: 0.4802
 epoch: 8, train_loss: 0.9804, test_loss: 1.0819, test_f1: 0.4736
 epoch: 9, train_loss: 0.9710, test_loss: 1.0507, test_f1: 0.5346
 epoch: 10, train_loss: 0.9445, test_loss: 1.1533, test_f1: 0.4773
 epoch: 11, train_loss: 0.9513, test_loss: 1.1642, test_f1: 0.3404
 epoch: 12, train_loss: 0.9532, test_loss: 1.1101, test_f1: 0.3348
 epoch: 13, train_loss: 0.9272, test_loss: 1.0955, test_f1: 0.4848
 epoch: 14, train_loss: 0.9777, test_loss: 1.0901, test_f1: 0.4718
 epoch: 15, train_loss: 0.9564, test_loss: 1.0811, test_f1: 0.4864
 epoch: 16, train_loss: 0.9302, test_loss: 1.1340, test_f1: 0.3718
 epoch: 17, train_loss: 0.9361, test_loss: 1.0782, test_f1: 0.5053
 epoch: 18, train_loss: 0.9375, test_loss: 1.0565, test_f1: 0.4984
 epoch: 19, train_loss: 0.9371, test_loss: 1.0435, test_f1: 0.4959
 epoch: 20, train_loss: 0.9202, test_loss: 1.0605, test_f1: 0.5147
 epoch: 21, train_loss: 0.9179, test_loss: 1.0833, test_f1: 0.5301
 epoch: 22, train_loss: 0.9130, test_loss: 1.0449, test_f1: 0.5401
 epoch: 23, train_loss: 0.9092, test_loss: 1.1320, test_f1: 0.3910
 epoch: 24, train_loss: 0.8975, test_loss: 1.1160, test_f1: 0.4716
 epoch: 25, train_loss: 0.9044, test_loss: 1.1786, test_f1: 0.4938
 epoch: 26, train_loss: 0.8888, test_loss: 1.0181, test_f1: 0.5607
 epoch: 27, train_loss: 0.9071, test_loss: 1.1513, test_f1: 0.4730
 epoch: 28, train_loss: 0.8946, test_loss: 1.0680, test_f1: 0.5380
 epoch: 29, train_loss: 0.8988, test_loss: 1.0338, test_f1: 0.5451
 epoch: 30, train_loss: 0.8958, test_loss: 1.1094, test_f1: 0.5050
 epoch: 31, train_loss: 0.8813, test_loss: 1.1489, test_f1: 0.5277
 epoch: 32, train_loss: 0.9041, test_loss: 1.0592, test_f1: 0.5210
 epoch: 33, train_loss: 0.8833, test_loss: 1.0535, test_f1: 0.5197
 epoch: 34, train_loss: 0.8922, test_loss: 1.0196, test_f1: 0.5218
 epoch: 35, train_loss: 0.8735, test_loss: 1.0455, test_f1: 0.5435
 epoch: 36, train_loss: 0.8710, test_loss: 1.0490, test_f1: 0.4954
 epoch: 37, train_loss: 0.8698, test_loss: 1.1377, test_f1: 0.5426
 epoch: 38, train_loss: 0.8680, test_loss: 1.0203, test_f1: 0.5646
 epoch: 39, train_loss: 0.8869, test_loss: 1.0201, test_f1: 0.5163
 epoch: 40, train_loss: 0.8613, test_loss: 1.0243, test_f1: 0.5551
 epoch: 41, train_loss: 0.8685, test_loss: 1.0942, test_f1: 0.5253
 epoch: 42, train_loss: 0.8627, test_loss: 1.0459, test_f1: 0.5312
 epoch: 43, train_loss: 0.8593, test_loss: 1.0897, test_f1: 0.5477
 epoch: 44, train_loss: 0.8611, test_loss: 1.0199, test_f1: 0.5161
 epoch: 45, train_loss: 0.8649, test_loss: 1.0658, test_f1: 0.5550
 epoch: 46, train_loss: 0.8633, test_loss: 1.0589, test_f1: 0.5229
 epoch: 47, train_loss: 0.8522, test_loss: 1.1195, test_f1: 0.5166
 epoch: 48, train_loss: 0.8469, test_loss: 1.0028, test_f1: 0.5738
 epoch: 49, train_loss: 0.8553, test_loss: 1.1740, test_f1: 0.5131
 epoch: 50, train_loss: 0.8350, test_loss: 1.0816, test_f1: 0.5478
 epoch: 51, train_loss: 0.8320, test_loss: 1.0813, test_f1: 0.5828
 epoch: 52, train_loss: 0.8205, test_loss: 1.0823, test_f1: 0.5699
 epoch: 53, train_loss: 0.8051, test_loss: 1.0782, test_f1: 0.5904
 epoch: 54, train_loss: 0.8262, test_loss: 1.1109, test_f1: 0.5408
 epoch: 55, train_loss: 0.8012, test_loss: 1.1180, test_f1: 0.5773
 epoch: 56, train_loss: 0.7708, test_loss: 1.1069, test_f1: 0.5864
 epoch: 57, train_loss: 0.7853, test_loss: 1.1349, test_f1: 0.5746
 epoch: 58, train_loss: 0.7847, test_loss: 1.2042, test_f1: 0.5338
 epoch: 59, train_loss: 0.7670, test_loss: 1.1186, test_f1: 0.5536
 epoch: 60, train_loss: 0.7819, test_loss: 1.0975, test_f1: 0.5703
 epoch: 61, train_loss: 0.7703, test_loss: 1.1670, test_f1: 0.5742
 epoch: 62, train_loss: 0.7692, test_loss: 1.2215, test_f1: 0.5295
 epoch: 63, train_loss: 0.7430, test_loss: 1.1178, test_f1: 0.5600
 epoch: 64, train_loss: 0.7443, test_loss: 1.2567, test_f1: 0.5486
 epoch: 65, train_loss: 0.7904, test_loss: 1.2395, test_f1: 0.5665
 epoch: 66, train_loss: 0.7634, test_loss: 1.0813, test_f1: 0.5822
 epoch: 67, train_loss: 0.7538, test_loss: 1.0651, test_f1: 0.5900
 epoch: 68, train_loss: 0.7570, test_loss: 1.1663, test_f1: 0.5639
 epoch: 69, train_loss: 0.7528, test_loss: 1.0873, test_f1: 0.5515
 epoch: 70, train_loss: 0.7640, test_loss: 1.0557, test_f1: 0.5610
 epoch: 71, train_loss: 0.7380, test_loss: 1.1018, test_f1: 0.5757
 epoch: 72, train_loss: 0.7406, test_loss: 1.1381, test_f1: 0.5758
 epoch: 73, train_loss: 0.7528, test_loss: 1.1974, test_f1: 0.5616
 epoch: 74, train_loss: 0.7440, test_loss: 1.2166, test_f1: 0.5417
 epoch: 75, train_loss: 0.7228, test_loss: 1.1584, test_f1: 0.5740
 epoch: 76, train_loss: 0.7459, test_loss: 1.2026, test_f1: 0.5602
 epoch: 77, train_loss: 0.7363, test_loss: 1.1142, test_f1: 0.5885
 epoch: 78, train_loss: 0.7190, test_loss: 1.1414, test_f1: 0.5804
 epoch: 79, train_loss: 0.7301, test_loss: 1.1016, test_f1: 0.5732
 epoch: 80, train_loss: 0.7199, test_loss: 1.1780, test_f1: 0.5986
 epoch: 81, train_loss: 0.7264, test_loss: 1.1502, test_f1: 0.6018
 epoch: 82, train_loss: 0.7276, test_loss: 1.1293, test_f1: 0.6190
 epoch: 83, train_loss: 0.7245, test_loss: 1.1678, test_f1: 0.5666
 epoch: 84, train_loss: 0.7204, test_loss: 1.1764, test_f1: 0.5814
 epoch: 85, train_loss: 0.7098, test_loss: 1.1404, test_f1: 0.5771
 epoch: 86, train_loss: 0.7266, test_loss: 1.2041, test_f1: 0.5960
 epoch: 87, train_loss: 0.7000, test_loss: 1.2454, test_f1: 0.5706
 epoch: 88, train_loss: 0.7074, test_loss: 1.2160, test_f1: 0.5735
 epoch: 89, train_loss: 0.6918, test_loss: 1.2724, test_f1: 0.5857
 epoch: 90, train_loss: 0.6829, test_loss: 1.2808, test_f1: 0.5950
 epoch: 91, train_loss: 0.7225, test_loss: 1.1194, test_f1: 0.5934
 epoch: 92, train_loss: 0.7058, test_loss: 1.2177, test_f1: 0.5819
 epoch: 93, train_loss: 0.6907, test_loss: 1.2156, test_f1: 0.5912
 epoch: 94, train_loss: 0.6921, test_loss: 1.2600, test_f1: 0.5757
 epoch: 95, train_loss: 0.7040, test_loss: 1.4305, test_f1: 0.5787
 epoch: 96, train_loss: 0.7108, test_loss: 1.1435, test_f1: 0.6257
 epoch: 97, train_loss: 0.6875, test_loss: 1.1341, test_f1: 0.6097
 epoch: 98, train_loss: 0.6767, test_loss: 1.1697, test_f1: 0.6070
 epoch: 99, train_loss: 0.6758, test_loss: 1.1058, test_f1: 0.5765
##################ITERATION #1 ****************************************
 epoch: 0, train_loss: 1.1564, test_loss: 1.1980, test_f1: 0.3828
 epoch: 1, train_loss: 1.0907, test_loss: 1.1115, test_f1: 0.4666
 epoch: 2, train_loss: 1.0706, test_loss: 1.1195, test_f1: 0.4364
 epoch: 3, train_loss: 1.0269, test_loss: 1.1126, test_f1: 0.4643
 epoch: 4, train_loss: 1.0245, test_loss: 1.0519, test_f1: 0.5148
 epoch: 5, train_loss: 1.0182, test_loss: 1.0386, test_f1: 0.5398
 epoch: 6, train_loss: 0.9786, test_loss: 1.1522, test_f1: 0.4866
 epoch: 7, train_loss: 0.9759, test_loss: 1.1100, test_f1: 0.5181
 epoch: 8, train_loss: 0.9766, test_loss: 1.1042, test_f1: 0.4997
 epoch: 9, train_loss: 0.9588, test_loss: 1.1415, test_f1: 0.4327
 epoch: 10, train_loss: 0.9768, test_loss: 1.0561, test_f1: 0.5329
 epoch: 11, train_loss: 0.9492, test_loss: 1.0537, test_f1: 0.5498
 epoch: 12, train_loss: 0.9295, test_loss: 1.0672, test_f1: 0.5404
 epoch: 13, train_loss: 0.9552, test_loss: 1.1009, test_f1: 0.4550
 epoch: 14, train_loss: 0.9311, test_loss: 1.0793, test_f1: 0.5606
 epoch: 15, train_loss: 0.9191, test_loss: 1.0798, test_f1: 0.5143
 epoch: 16, train_loss: 0.9203, test_loss: 1.0111, test_f1: 0.5345
 epoch: 17, train_loss: 0.9124, test_loss: 1.0713, test_f1: 0.5330
 epoch: 18, train_loss: 0.9064, test_loss: 1.0509, test_f1: 0.5421
 epoch: 19, train_loss: 0.9045, test_loss: 1.2279, test_f1: 0.5379
 epoch: 20, train_loss: 0.9026, test_loss: 1.1144, test_f1: 0.5161
 epoch: 21, train_loss: 0.8833, test_loss: 1.0612, test_f1: 0.5444
 epoch: 22, train_loss: 0.8784, test_loss: 1.1014, test_f1: 0.5467
 epoch: 23, train_loss: 0.8796, test_loss: 1.0618, test_f1: 0.5573
 epoch: 24, train_loss: 0.8587, test_loss: 1.0739, test_f1: 0.6104
 epoch: 25, train_loss: 0.8460, test_loss: 1.2010, test_f1: 0.5281
 epoch: 26, train_loss: 0.8890, test_loss: 1.0529, test_f1: 0.5912
 epoch: 27, train_loss: 0.8585, test_loss: 1.0827, test_f1: 0.5066
 epoch: 28, train_loss: 0.8569, test_loss: 1.0559, test_f1: 0.5414
 epoch: 29, train_loss: 0.8406, test_loss: 1.0469, test_f1: 0.5900
 epoch: 30, train_loss: 0.8383, test_loss: 1.1464, test_f1: 0.5341
 epoch: 31, train_loss: 0.8296, test_loss: 1.2256, test_f1: 0.5272
 epoch: 32, train_loss: 0.8438, test_loss: 1.1066, test_f1: 0.5455
 epoch: 33, train_loss: 0.8491, test_loss: 0.9784, test_f1: 0.5806
 epoch: 34, train_loss: 0.8183, test_loss: 1.1031, test_f1: 0.5307
 epoch: 35, train_loss: 0.8116, test_loss: 1.1263, test_f1: 0.5811
 epoch: 36, train_loss: 0.8299, test_loss: 1.0934, test_f1: 0.5366
 epoch: 37, train_loss: 0.8171, test_loss: 1.0437, test_f1: 0.5634
 epoch: 38, train_loss: 0.7879, test_loss: 1.3454, test_f1: 0.4966
 epoch: 39, train_loss: 0.7795, test_loss: 1.1535, test_f1: 0.5473
 epoch: 40, train_loss: 0.7935, test_loss: 1.1184, test_f1: 0.5718
 epoch: 41, train_loss: 0.7687, test_loss: 1.0906, test_f1: 0.6014
 epoch: 42, train_loss: 0.7886, test_loss: 1.1694, test_f1: 0.5693
 epoch: 43, train_loss: 0.7727, test_loss: 1.0929, test_f1: 0.5995
 epoch: 44, train_loss: 0.8053, test_loss: 1.1672, test_f1: 0.4804
 epoch: 45, train_loss: 0.8140, test_loss: 1.0978, test_f1: 0.5614
 epoch: 46, train_loss: 0.7874, test_loss: 1.1235, test_f1: 0.5195
 epoch: 47, train_loss: 0.7713, test_loss: 1.1277, test_f1: 0.5723
 epoch: 48, train_loss: 0.7829, test_loss: 1.0679, test_f1: 0.5960
 epoch: 49, train_loss: 0.7897, test_loss: 1.1175, test_f1: 0.5633
 epoch: 50, train_loss: 0.7835, test_loss: 1.3293, test_f1: 0.5489
 epoch: 51, train_loss: 0.7265, test_loss: 1.0604, test_f1: 0.5589
 epoch: 52, train_loss: 0.7181, test_loss: 1.1078, test_f1: 0.6149
 epoch: 53, train_loss: 0.7459, test_loss: 1.0603, test_f1: 0.5653
 epoch: 54, train_loss: 0.7279, test_loss: 1.1016, test_f1: 0.5797
 epoch: 55, train_loss: 0.7137, test_loss: 1.0998, test_f1: 0.5356
 epoch: 56, train_loss: 0.7081, test_loss: 1.1474, test_f1: 0.5880
 epoch: 57, train_loss: 0.7185, test_loss: 1.0389, test_f1: 0.5963
 epoch: 58, train_loss: 0.7088, test_loss: 1.2207, test_f1: 0.5797
 epoch: 59, train_loss: 0.7119, test_loss: 1.2016, test_f1: 0.5796
 epoch: 60, train_loss: 0.7089, test_loss: 1.1545, test_f1: 0.5597
 epoch: 61, train_loss: 0.7190, test_loss: 1.1367, test_f1: 0.5898
 epoch: 62, train_loss: 0.6808, test_loss: 1.0925, test_f1: 0.5895
 epoch: 63, train_loss: 0.6999, test_loss: 1.1443, test_f1: 0.5416
 epoch: 64, train_loss: 0.7037, test_loss: 1.2400, test_f1: 0.5856
 epoch: 65, train_loss: 0.6854, test_loss: 1.1946, test_f1: 0.5855
 epoch: 66, train_loss: 0.6895, test_loss: 1.1463, test_f1: 0.5990
 epoch: 67, train_loss: 0.6875, test_loss: 1.2334, test_f1: 0.5803
 epoch: 68, train_loss: 0.6767, test_loss: 1.2978, test_f1: 0.5803
 epoch: 69, train_loss: 0.6728, test_loss: 1.1457, test_f1: 0.5867
 epoch: 70, train_loss: 0.6924, test_loss: 1.1579, test_f1: 0.6006
 epoch: 71, train_loss: 0.6875, test_loss: 1.2055, test_f1: 0.5667
 epoch: 72, train_loss: 0.6426, test_loss: 1.1965, test_f1: 0.5624
 epoch: 73, train_loss: 0.6479, test_loss: 1.3580, test_f1: 0.5724
 epoch: 74, train_loss: 0.6876, test_loss: 1.1947, test_f1: 0.5753
 epoch: 75, train_loss: 0.6662, test_loss: 1.1183, test_f1: 0.5970
 epoch: 76, train_loss: 0.6789, test_loss: 1.2777, test_f1: 0.5695
 epoch: 77, train_loss: 0.6460, test_loss: 1.2410, test_f1: 0.6056
 epoch: 78, train_loss: 0.6510, test_loss: 1.2555, test_f1: 0.5945
 epoch: 79, train_loss: 0.6405, test_loss: 1.4140, test_f1: 0.5696
 epoch: 80, train_loss: 0.6723, test_loss: 1.2961, test_f1: 0.5952
 epoch: 81, train_loss: 0.6487, test_loss: 1.2505, test_f1: 0.5755
 epoch: 82, train_loss: 0.6409, test_loss: 1.2859, test_f1: 0.5874
 epoch: 83, train_loss: 0.6464, test_loss: 1.2308, test_f1: 0.5966
 epoch: 84, train_loss: 0.6358, test_loss: 1.2909, test_f1: 0.6259
 epoch: 85, train_loss: 0.6188, test_loss: 1.2623, test_f1: 0.5803
 epoch: 86, train_loss: 0.6367, test_loss: 1.3357, test_f1: 0.5927
 epoch: 87, train_loss: 0.6464, test_loss: 1.1692, test_f1: 0.5868
 epoch: 88, train_loss: 0.6335, test_loss: 1.2862, test_f1: 0.5924
 epoch: 89, train_loss: 0.6347, test_loss: 1.3877, test_f1: 0.5837
 epoch: 90, train_loss: 0.6178, test_loss: 1.3136, test_f1: 0.5986
 epoch: 91, train_loss: 0.6409, test_loss: 1.3295, test_f1: 0.6027
 epoch: 92, train_loss: 0.6232, test_loss: 1.3437, test_f1: 0.5833
 epoch: 93, train_loss: 0.6210, test_loss: 1.2190, test_f1: 0.5976
 epoch: 94, train_loss: 0.6181, test_loss: 1.3125, test_f1: 0.6099
 epoch: 95, train_loss: 0.6071, test_loss: 1.4147, test_f1: 0.6016
 epoch: 96, train_loss: 0.6051, test_loss: 1.3666, test_f1: 0.5733
 epoch: 97, train_loss: 0.5958, test_loss: 1.3233, test_f1: 0.5517
 epoch: 98, train_loss: 0.5864, test_loss: 1.4190, test_f1: 0.6178
 epoch: 99, train_loss: 0.5982, test_loss: 1.6256, test_f1: 0.5742
##################ITERATION #2 ****************************************
 epoch: 0, train_loss: 1.1903, test_loss: 1.2321, test_f1: 0.2281
 epoch: 1, train_loss: 1.0566, test_loss: 1.1590, test_f1: 0.3977
 epoch: 2, train_loss: 1.0369, test_loss: 1.0547, test_f1: 0.5183
 epoch: 3, train_loss: 0.9973, test_loss: 1.1232, test_f1: 0.5091
 epoch: 4, train_loss: 0.9768, test_loss: 1.1993, test_f1: 0.4680
 epoch: 5, train_loss: 0.9487, test_loss: 1.0103, test_f1: 0.5563
 epoch: 6, train_loss: 0.9285, test_loss: 1.1202, test_f1: 0.5166
 epoch: 7, train_loss: 0.9114, test_loss: 1.0271, test_f1: 0.5692
 epoch: 8, train_loss: 0.9320, test_loss: 1.0962, test_f1: 0.5316
 epoch: 9, train_loss: 0.9278, test_loss: 0.9934, test_f1: 0.5563
 epoch: 10, train_loss: 0.9088, test_loss: 1.1923, test_f1: 0.4336
 epoch: 11, train_loss: 0.9079, test_loss: 1.0194, test_f1: 0.5472
 epoch: 12, train_loss: 0.9073, test_loss: 0.9813, test_f1: 0.6149
 epoch: 13, train_loss: 0.8817, test_loss: 0.9705, test_f1: 0.5591
 epoch: 14, train_loss: 0.8762, test_loss: 1.0289, test_f1: 0.5540
 epoch: 15, train_loss: 0.8794, test_loss: 1.0335, test_f1: 0.5274
 epoch: 16, train_loss: 0.8664, test_loss: 1.0782, test_f1: 0.4903
 epoch: 17, train_loss: 0.8697, test_loss: 1.1143, test_f1: 0.5165
 epoch: 18, train_loss: 0.8767, test_loss: 1.2573, test_f1: 0.5035
 epoch: 19, train_loss: 0.8586, test_loss: 1.1817, test_f1: 0.5316
 epoch: 20, train_loss: 0.8793, test_loss: 1.0923, test_f1: 0.5693
 epoch: 21, train_loss: 0.8651, test_loss: 0.9391, test_f1: 0.5779
 epoch: 22, train_loss: 0.8564, test_loss: 0.9684, test_f1: 0.5909
 epoch: 23, train_loss: 0.8381, test_loss: 0.9493, test_f1: 0.5583
 epoch: 24, train_loss: 0.8310, test_loss: 1.0182, test_f1: 0.5670
 epoch: 25, train_loss: 0.8229, test_loss: 1.0068, test_f1: 0.5892
 epoch: 26, train_loss: 0.8316, test_loss: 1.0288, test_f1: 0.5332
 epoch: 27, train_loss: 0.8060, test_loss: 0.9730, test_f1: 0.5872
 epoch: 28, train_loss: 0.7956, test_loss: 1.0435, test_f1: 0.5658
 epoch: 29, train_loss: 0.7928, test_loss: 1.0683, test_f1: 0.5494
 epoch: 30, train_loss: 0.7983, test_loss: 1.0025, test_f1: 0.5662
 epoch: 31, train_loss: 0.7786, test_loss: 0.9787, test_f1: 0.6004
 epoch: 32, train_loss: 0.7871, test_loss: 1.0194, test_f1: 0.5547
 epoch: 33, train_loss: 0.7666, test_loss: 1.0935, test_f1: 0.5717
 epoch: 34, train_loss: 0.8059, test_loss: 0.9743, test_f1: 0.5913
 epoch: 35, train_loss: 0.8009, test_loss: 1.0022, test_f1: 0.5545
 epoch: 36, train_loss: 0.7836, test_loss: 0.9652, test_f1: 0.5894
 epoch: 37, train_loss: 0.7446, test_loss: 1.0105, test_f1: 0.6185
 epoch: 38, train_loss: 0.7568, test_loss: 1.1404, test_f1: 0.5490
 epoch: 39, train_loss: 0.7560, test_loss: 0.9577, test_f1: 0.6147
 epoch: 40, train_loss: 0.7774, test_loss: 0.9312, test_f1: 0.6270
 epoch: 41, train_loss: 0.7339, test_loss: 1.0340, test_f1: 0.5997
 epoch: 42, train_loss: 0.7454, test_loss: 1.0369, test_f1: 0.6001
 epoch: 43, train_loss: 0.7410, test_loss: 1.0905, test_f1: 0.5710
 epoch: 44, train_loss: 0.7316, test_loss: 1.0802, test_f1: 0.5842
 epoch: 45, train_loss: 0.7383, test_loss: 0.9985, test_f1: 0.6709
 epoch: 46, train_loss: 0.7356, test_loss: 1.0414, test_f1: 0.6237
 epoch: 47, train_loss: 0.7431, test_loss: 0.9918, test_f1: 0.6072
 epoch: 48, train_loss: 0.7219, test_loss: 1.1483, test_f1: 0.5099
 epoch: 49, train_loss: 0.7434, test_loss: 1.1143, test_f1: 0.5948
 epoch: 50, train_loss: 0.7263, test_loss: 1.2400, test_f1: 0.5751
 epoch: 51, train_loss: 0.7246, test_loss: 1.0239, test_f1: 0.6074
 epoch: 52, train_loss: 0.6819, test_loss: 1.0039, test_f1: 0.6262
 epoch: 53, train_loss: 0.6626, test_loss: 1.0636, test_f1: 0.6253
 epoch: 54, train_loss: 0.6752, test_loss: 1.0364, test_f1: 0.6400
 epoch: 55, train_loss: 0.6768, test_loss: 1.0863, test_f1: 0.5979
 epoch: 56, train_loss: 0.6784, test_loss: 1.1019, test_f1: 0.6369
 epoch: 57, train_loss: 0.6680, test_loss: 1.1092, test_f1: 0.6173
 epoch: 58, train_loss: 0.7077, test_loss: 1.0538, test_f1: 0.6146
 epoch: 59, train_loss: 0.6466, test_loss: 1.0601, test_f1: 0.6373
 epoch: 60, train_loss: 0.6623, test_loss: 1.0831, test_f1: 0.6193
 epoch: 61, train_loss: 0.6421, test_loss: 1.0968, test_f1: 0.6018
 epoch: 62, train_loss: 0.6351, test_loss: 1.0990, test_f1: 0.6199
 epoch: 63, train_loss: 0.6323, test_loss: 1.1571, test_f1: 0.6026
 epoch: 64, train_loss: 0.6535, test_loss: 1.1513, test_f1: 0.6163
 epoch: 65, train_loss: 0.6507, test_loss: 1.1206, test_f1: 0.6253
 epoch: 66, train_loss: 0.6686, test_loss: 1.0758, test_f1: 0.5791
 epoch: 67, train_loss: 0.6743, test_loss: 1.1524, test_f1: 0.6347
 epoch: 68, train_loss: 0.6478, test_loss: 1.1241, test_f1: 0.6001
 epoch: 69, train_loss: 0.6399, test_loss: 1.1137, test_f1: 0.6333
 epoch: 70, train_loss: 0.6384, test_loss: 1.1712, test_f1: 0.5565
 epoch: 71, train_loss: 0.6559, test_loss: 1.0352, test_f1: 0.6301
 epoch: 72, train_loss: 0.6243, test_loss: 1.1953, test_f1: 0.6178
 epoch: 73, train_loss: 0.6433, test_loss: 1.0758, test_f1: 0.6247
 epoch: 74, train_loss: 0.6227, test_loss: 1.1917, test_f1: 0.5734
 epoch: 75, train_loss: 0.6351, test_loss: 1.1498, test_f1: 0.6388
 epoch: 76, train_loss: 0.6245, test_loss: 1.1229, test_f1: 0.6348
 epoch: 77, train_loss: 0.6324, test_loss: 1.1668, test_f1: 0.6650
 epoch: 78, train_loss: 0.6186, test_loss: 1.1080, test_f1: 0.6517
 epoch: 79, train_loss: 0.6317, test_loss: 1.2628, test_f1: 0.6228
 epoch: 80, train_loss: 0.6081, test_loss: 1.1465, test_f1: 0.6114
 epoch: 81, train_loss: 0.6353, test_loss: 1.2635, test_f1: 0.5488
 epoch: 82, train_loss: 0.6356, test_loss: 1.2483, test_f1: 0.6112
 epoch: 83, train_loss: 0.6110, test_loss: 1.3258, test_f1: 0.5893
 epoch: 84, train_loss: 0.5979, test_loss: 1.2167, test_f1: 0.6070
 epoch: 85, train_loss: 0.5993, test_loss: 1.1134, test_f1: 0.6489
 epoch: 86, train_loss: 0.6187, test_loss: 1.2679, test_f1: 0.6297
 epoch: 87, train_loss: 0.6224, test_loss: 1.1407, test_f1: 0.6349
 epoch: 88, train_loss: 0.6119, test_loss: 1.2184, test_f1: 0.6446
 epoch: 89, train_loss: 0.5917, test_loss: 1.1686, test_f1: 0.6572
 epoch: 90, train_loss: 0.6102, test_loss: 1.2754, test_f1: 0.6436
 epoch: 91, train_loss: 0.6291, test_loss: 1.2163, test_f1: 0.5656
 epoch: 92, train_loss: 0.6076, test_loss: 1.1972, test_f1: 0.6333
 epoch: 93, train_loss: 0.5910, test_loss: 1.2505, test_f1: 0.6259
 epoch: 94, train_loss: 0.6021, test_loss: 1.1531, test_f1: 0.5984
 epoch: 95, train_loss: 0.6090, test_loss: 1.4665, test_f1: 0.6317
 epoch: 96, train_loss: 0.6011, test_loss: 1.1370, test_f1: 0.6418
 epoch: 97, train_loss: 0.6237, test_loss: 1.3545, test_f1: 0.6144
 epoch: 98, train_loss: 0.5975, test_loss: 1.2151, test_f1: 0.6191
 epoch: 99, train_loss: 0.5734, test_loss: 1.2269, test_f1: 0.5862
##################ITERATION #3 ****************************************
 epoch: 0, train_loss: 1.2299, test_loss: 1.2985, test_f1: 0.1428
 epoch: 1, train_loss: 1.0901, test_loss: 1.1388, test_f1: 0.4154
 epoch: 2, train_loss: 1.0662, test_loss: 1.2118, test_f1: 0.4307
 epoch: 3, train_loss: 1.0622, test_loss: 1.0741, test_f1: 0.4961
 epoch: 4, train_loss: 1.0068, test_loss: 1.0349, test_f1: 0.5002
 epoch: 5, train_loss: 1.0062, test_loss: 1.1112, test_f1: 0.4401
 epoch: 6, train_loss: 0.9781, test_loss: 1.0858, test_f1: 0.5123
 epoch: 7, train_loss: 0.9829, test_loss: 1.0296, test_f1: 0.5215
 epoch: 8, train_loss: 0.9529, test_loss: 1.1677, test_f1: 0.4856
 epoch: 9, train_loss: 0.9460, test_loss: 1.0350, test_f1: 0.5076
 epoch: 10, train_loss: 0.9328, test_loss: 1.1230, test_f1: 0.4696
 epoch: 11, train_loss: 0.9308, test_loss: 1.1093, test_f1: 0.5342
 epoch: 12, train_loss: 0.9407, test_loss: 1.0813, test_f1: 0.5147
 epoch: 13, train_loss: 0.9234, test_loss: 1.1334, test_f1: 0.5209
 epoch: 14, train_loss: 0.9105, test_loss: 1.0829, test_f1: 0.4862
 epoch: 15, train_loss: 0.9069, test_loss: 1.0554, test_f1: 0.5526
 epoch: 16, train_loss: 0.8949, test_loss: 1.0762, test_f1: 0.5469
 epoch: 17, train_loss: 0.9006, test_loss: 0.9960, test_f1: 0.5469
 epoch: 18, train_loss: 0.9105, test_loss: 1.0625, test_f1: 0.5523
 epoch: 19, train_loss: 0.9085, test_loss: 1.0942, test_f1: 0.5403
 epoch: 20, train_loss: 0.8927, test_loss: 1.0368, test_f1: 0.5161
 epoch: 21, train_loss: 0.8851, test_loss: 1.0671, test_f1: 0.5231
 epoch: 22, train_loss: 0.8936, test_loss: 1.0712, test_f1: 0.5577
 epoch: 23, train_loss: 0.8736, test_loss: 1.0367, test_f1: 0.5835
 epoch: 24, train_loss: 0.9068, test_loss: 1.0604, test_f1: 0.5719
 epoch: 25, train_loss: 0.8588, test_loss: 1.0336, test_f1: 0.5695
 epoch: 26, train_loss: 0.8856, test_loss: 1.0498, test_f1: 0.5570
 epoch: 27, train_loss: 0.8648, test_loss: 1.1592, test_f1: 0.5451
 epoch: 28, train_loss: 0.8605, test_loss: 1.0561, test_f1: 0.5777
 epoch: 29, train_loss: 0.8464, test_loss: 1.0716, test_f1: 0.5902
 epoch: 30, train_loss: 0.8384, test_loss: 1.0225, test_f1: 0.5971
 epoch: 31, train_loss: 0.8556, test_loss: 1.1365, test_f1: 0.5004
 epoch: 32, train_loss: 0.8484, test_loss: 1.0611, test_f1: 0.5661
 epoch: 33, train_loss: 0.8290, test_loss: 1.1674, test_f1: 0.5772
 epoch: 34, train_loss: 0.8288, test_loss: 1.2107, test_f1: 0.5009
 epoch: 35, train_loss: 0.8307, test_loss: 1.0870, test_f1: 0.6001
 epoch: 36, train_loss: 0.8277, test_loss: 1.1282, test_f1: 0.5747
 epoch: 37, train_loss: 0.8149, test_loss: 1.1354, test_f1: 0.5577
 epoch: 38, train_loss: 0.8112, test_loss: 1.0869, test_f1: 0.5369
 epoch: 39, train_loss: 0.8556, test_loss: 1.2116, test_f1: 0.5869
 epoch: 40, train_loss: 0.8383, test_loss: 1.0393, test_f1: 0.5951
 epoch: 41, train_loss: 0.8059, test_loss: 1.0381, test_f1: 0.6017
 epoch: 42, train_loss: 0.8354, test_loss: 1.2545, test_f1: 0.5123
 epoch: 43, train_loss: 0.8217, test_loss: 1.0479, test_f1: 0.5750
 epoch: 44, train_loss: 0.7863, test_loss: 1.0130, test_f1: 0.5913
 epoch: 45, train_loss: 0.7945, test_loss: 1.0897, test_f1: 0.6048
 epoch: 46, train_loss: 0.8180, test_loss: 1.1987, test_f1: 0.5345
 epoch: 47, train_loss: 0.7995, test_loss: 1.1472, test_f1: 0.6060
 epoch: 48, train_loss: 0.7891, test_loss: 1.1701, test_f1: 0.5146
 epoch: 49, train_loss: 0.7975, test_loss: 1.0327, test_f1: 0.5798
 epoch: 50, train_loss: 0.8015, test_loss: 1.2131, test_f1: 0.4796
 epoch: 51, train_loss: 0.7840, test_loss: 1.0926, test_f1: 0.5642
 epoch: 52, train_loss: 0.7611, test_loss: 1.0945, test_f1: 0.5879
 epoch: 53, train_loss: 0.7487, test_loss: 1.0753, test_f1: 0.5911
 epoch: 54, train_loss: 0.7370, test_loss: 1.1042, test_f1: 0.5837
 epoch: 55, train_loss: 0.7441, test_loss: 1.1019, test_f1: 0.5961
 epoch: 56, train_loss: 0.7258, test_loss: 1.1579, test_f1: 0.5797
 epoch: 57, train_loss: 0.7255, test_loss: 1.1707, test_f1: 0.6141
 epoch: 58, train_loss: 0.7050, test_loss: 1.2142, test_f1: 0.5747
 epoch: 59, train_loss: 0.7148, test_loss: 1.2359, test_f1: 0.5493
 epoch: 60, train_loss: 0.7113, test_loss: 1.0899, test_f1: 0.6042
 epoch: 61, train_loss: 0.7137, test_loss: 1.1114, test_f1: 0.6089
 epoch: 62, train_loss: 0.7180, test_loss: 1.1622, test_f1: 0.5519
 epoch: 63, train_loss: 0.7298, test_loss: 1.1843, test_f1: 0.6171
 epoch: 64, train_loss: 0.7295, test_loss: 1.1971, test_f1: 0.6114
 epoch: 65, train_loss: 0.7104, test_loss: 1.3079, test_f1: 0.5640
 epoch: 66, train_loss: 0.7274, test_loss: 1.1083, test_f1: 0.6317
 epoch: 67, train_loss: 0.7130, test_loss: 1.1444, test_f1: 0.5497
 epoch: 68, train_loss: 0.7259, test_loss: 1.2147, test_f1: 0.5986
 epoch: 69, train_loss: 0.7198, test_loss: 1.1888, test_f1: 0.5210
 epoch: 70, train_loss: 0.7080, test_loss: 1.1239, test_f1: 0.5931
 epoch: 71, train_loss: 0.7487, test_loss: 1.1618, test_f1: 0.5905
 epoch: 72, train_loss: 0.7154, test_loss: 1.1155, test_f1: 0.5922
 epoch: 73, train_loss: 0.6871, test_loss: 1.1397, test_f1: 0.6247
 epoch: 74, train_loss: 0.6962, test_loss: 1.2009, test_f1: 0.6036
 epoch: 75, train_loss: 0.6816, test_loss: 1.1215, test_f1: 0.5808
 epoch: 76, train_loss: 0.6835, test_loss: 1.3058, test_f1: 0.5957
 epoch: 77, train_loss: 0.7006, test_loss: 1.2227, test_f1: 0.5940
 epoch: 78, train_loss: 0.7059, test_loss: 1.1690, test_f1: 0.5992
 epoch: 79, train_loss: 0.6849, test_loss: 1.2070, test_f1: 0.6189
 epoch: 80, train_loss: 0.6773, test_loss: 1.2207, test_f1: 0.5994
 epoch: 81, train_loss: 0.6751, test_loss: 1.1906, test_f1: 0.6180
 epoch: 82, train_loss: 0.7081, test_loss: 1.2594, test_f1: 0.5759
 epoch: 83, train_loss: 0.7035, test_loss: 1.0869, test_f1: 0.6185
 epoch: 84, train_loss: 0.6847, test_loss: 1.1911, test_f1: 0.6161
 epoch: 85, train_loss: 0.6824, test_loss: 1.2039, test_f1: 0.5672
 epoch: 86, train_loss: 0.6816, test_loss: 1.2325, test_f1: 0.6172
 epoch: 87, train_loss: 0.6939, test_loss: 1.2304, test_f1: 0.5726
 epoch: 88, train_loss: 0.6877, test_loss: 1.1450, test_f1: 0.6141
 epoch: 89, train_loss: 0.6730, test_loss: 1.3173, test_f1: 0.5360
 epoch: 90, train_loss: 0.6716, test_loss: 1.2360, test_f1: 0.5982
 epoch: 91, train_loss: 0.6530, test_loss: 1.3105, test_f1: 0.5797
 epoch: 92, train_loss: 0.6513, test_loss: 1.2417, test_f1: 0.5692
 epoch: 93, train_loss: 0.6489, test_loss: 1.1888, test_f1: 0.6066
 epoch: 94, train_loss: 0.6629, test_loss: 1.1719, test_f1: 0.6076
 epoch: 95, train_loss: 0.6560, test_loss: 1.2305, test_f1: 0.6004
 epoch: 96, train_loss: 0.6735, test_loss: 1.2142, test_f1: 0.5962
 epoch: 97, train_loss: 0.6501, test_loss: 1.3083, test_f1: 0.5811
 epoch: 98, train_loss: 0.6512, test_loss: 1.2907, test_f1: 0.6306
 epoch: 99, train_loss: 0.6466, test_loss: 1.2679, test_f1: 0.6053
##################ITERATION #4 ****************************************
 epoch: 0, train_loss: 1.3267, test_loss: 1.2852, test_f1: 0.2722
 epoch: 1, train_loss: 1.1579, test_loss: 1.2153, test_f1: 0.3364
 epoch: 2, train_loss: 1.1136, test_loss: 1.1575, test_f1: 0.4198
 epoch: 3, train_loss: 1.0661, test_loss: 1.0867, test_f1: 0.4263
 epoch: 4, train_loss: 1.0233, test_loss: 1.0770, test_f1: 0.4858
 epoch: 5, train_loss: 1.0113, test_loss: 1.0462, test_f1: 0.5254
 epoch: 6, train_loss: 0.9901, test_loss: 1.0884, test_f1: 0.5394
 epoch: 7, train_loss: 0.9723, test_loss: 1.0887, test_f1: 0.4240
 epoch: 8, train_loss: 1.0022, test_loss: 1.0134, test_f1: 0.5054
 epoch: 9, train_loss: 0.9880, test_loss: 1.0352, test_f1: 0.5179
 epoch: 10, train_loss: 0.9460, test_loss: 1.0503, test_f1: 0.5142
 epoch: 11, train_loss: 0.9443, test_loss: 1.0562, test_f1: 0.5170
 epoch: 12, train_loss: 0.9627, test_loss: 1.1005, test_f1: 0.4271
 epoch: 13, train_loss: 0.9426, test_loss: 1.0138, test_f1: 0.5500
 epoch: 14, train_loss: 0.9583, test_loss: 1.0060, test_f1: 0.5207
 epoch: 15, train_loss: 0.9541, test_loss: 1.0420, test_f1: 0.5113
 epoch: 16, train_loss: 0.9539, test_loss: 1.0949, test_f1: 0.4989
 epoch: 17, train_loss: 0.9428, test_loss: 1.0136, test_f1: 0.5394
 epoch: 18, train_loss: 0.9446, test_loss: 0.9887, test_f1: 0.5379
 epoch: 19, train_loss: 0.9597, test_loss: 1.0809, test_f1: 0.5215
 epoch: 20, train_loss: 0.9197, test_loss: 1.0420, test_f1: 0.5478
 epoch: 21, train_loss: 0.9089, test_loss: 1.1946, test_f1: 0.4910
 epoch: 22, train_loss: 0.9123, test_loss: 1.2041, test_f1: 0.4808
 epoch: 23, train_loss: 0.9035, test_loss: 1.0539, test_f1: 0.5486
 epoch: 24, train_loss: 0.9215, test_loss: 1.0133, test_f1: 0.5705
 epoch: 25, train_loss: 0.9002, test_loss: 1.0571, test_f1: 0.4939
 epoch: 26, train_loss: 0.9097, test_loss: 1.2532, test_f1: 0.4660
 epoch: 27, train_loss: 0.9107, test_loss: 1.0886, test_f1: 0.5207
 epoch: 28, train_loss: 0.9034, test_loss: 1.0212, test_f1: 0.5641
 epoch: 29, train_loss: 0.8997, test_loss: 1.0004, test_f1: 0.5678
 epoch: 30, train_loss: 0.8857, test_loss: 1.0509, test_f1: 0.5385
 epoch: 31, train_loss: 0.9000, test_loss: 1.0363, test_f1: 0.5932
 epoch: 32, train_loss: 0.8938, test_loss: 1.4370, test_f1: 0.4765
 epoch: 33, train_loss: 0.8837, test_loss: 1.1982, test_f1: 0.5107
 epoch: 34, train_loss: 0.8972, test_loss: 1.0756, test_f1: 0.5700
 epoch: 35, train_loss: 0.8912, test_loss: 1.0216, test_f1: 0.5622
 epoch: 36, train_loss: 0.8712, test_loss: 0.9732, test_f1: 0.5621
 epoch: 37, train_loss: 0.9069, test_loss: 0.9965, test_f1: 0.5561
 epoch: 38, train_loss: 0.9124, test_loss: 1.0225, test_f1: 0.5627
 epoch: 39, train_loss: 0.8774, test_loss: 0.9871, test_f1: 0.5837
 epoch: 40, train_loss: 0.8842, test_loss: 1.0061, test_f1: 0.5732
 epoch: 41, train_loss: 0.8759, test_loss: 1.0825, test_f1: 0.5173
 epoch: 42, train_loss: 0.8979, test_loss: 1.0722, test_f1: 0.5299
 epoch: 43, train_loss: 0.8706, test_loss: 1.1268, test_f1: 0.5853
 epoch: 44, train_loss: 0.8673, test_loss: 0.9788, test_f1: 0.5976
 epoch: 45, train_loss: 0.8725, test_loss: 1.0886, test_f1: 0.5669
 epoch: 46, train_loss: 0.8665, test_loss: 1.1606, test_f1: 0.5472
 epoch: 47, train_loss: 0.8568, test_loss: 0.9995, test_f1: 0.5813
 epoch: 48, train_loss: 0.8455, test_loss: 1.0126, test_f1: 0.5405
 epoch: 49, train_loss: 0.8713, test_loss: 1.1438, test_f1: 0.5684
 epoch: 50, train_loss: 0.8658, test_loss: 0.9641, test_f1: 0.5843
 epoch: 51, train_loss: 0.8481, test_loss: 0.9910, test_f1: 0.5999
 epoch: 52, train_loss: 0.8130, test_loss: 1.0191, test_f1: 0.5940
 epoch: 53, train_loss: 0.8163, test_loss: 1.0509, test_f1: 0.5623
 epoch: 54, train_loss: 0.8311, test_loss: 1.0078, test_f1: 0.6244
 epoch: 55, train_loss: 0.8044, test_loss: 1.0349, test_f1: 0.5881
 epoch: 56, train_loss: 0.8007, test_loss: 1.0492, test_f1: 0.5787
 epoch: 57, train_loss: 0.7982, test_loss: 1.0445, test_f1: 0.6235
 epoch: 58, train_loss: 0.8132, test_loss: 1.0259, test_f1: 0.5837
 epoch: 59, train_loss: 0.8034, test_loss: 1.0602, test_f1: 0.5879
 epoch: 60, train_loss: 0.7897, test_loss: 1.0152, test_f1: 0.6014
 epoch: 61, train_loss: 0.8009, test_loss: 0.9963, test_f1: 0.6056
 epoch: 62, train_loss: 0.7957, test_loss: 1.1443, test_f1: 0.5373
 epoch: 63, train_loss: 0.8055, test_loss: 1.0641, test_f1: 0.5908
 epoch: 64, train_loss: 0.8055, test_loss: 1.0521, test_f1: 0.5854
 epoch: 65, train_loss: 0.7845, test_loss: 0.9915, test_f1: 0.6065
 epoch: 66, train_loss: 0.7826, test_loss: 1.0812, test_f1: 0.5578
 epoch: 67, train_loss: 0.7904, test_loss: 1.0438, test_f1: 0.5877
 epoch: 68, train_loss: 0.7827, test_loss: 0.9911, test_f1: 0.6024
 epoch: 69, train_loss: 0.7859, test_loss: 1.0148, test_f1: 0.5958
 epoch: 70, train_loss: 0.7664, test_loss: 1.0028, test_f1: 0.6102
 epoch: 71, train_loss: 0.7627, test_loss: 0.9921, test_f1: 0.5768
 epoch: 72, train_loss: 0.7782, test_loss: 1.0507, test_f1: 0.6105
 epoch: 73, train_loss: 0.7885, test_loss: 1.0671, test_f1: 0.5725
 epoch: 74, train_loss: 0.7845, test_loss: 1.0215, test_f1: 0.5859
 epoch: 75, train_loss: 0.7745, test_loss: 0.9825, test_f1: 0.6055
 epoch: 76, train_loss: 0.7653, test_loss: 1.0437, test_f1: 0.6168
 epoch: 77, train_loss: 0.7725, test_loss: 0.9978, test_f1: 0.6034
 epoch: 78, train_loss: 0.7554, test_loss: 0.9715, test_f1: 0.6132
 epoch: 79, train_loss: 0.7579, test_loss: 1.0097, test_f1: 0.6048
 epoch: 80, train_loss: 0.7471, test_loss: 1.0259, test_f1: 0.6239
 epoch: 81, train_loss: 0.7628, test_loss: 1.0649, test_f1: 0.6061
 epoch: 82, train_loss: 0.7623, test_loss: 1.0444, test_f1: 0.5828
 epoch: 83, train_loss: 0.7779, test_loss: 0.9694, test_f1: 0.5852
 epoch: 84, train_loss: 0.7572, test_loss: 0.9980, test_f1: 0.5769
 epoch: 85, train_loss: 0.7538, test_loss: 1.0081, test_f1: 0.5968
 epoch: 86, train_loss: 0.7630, test_loss: 1.0137, test_f1: 0.6039
 epoch: 87, train_loss: 0.7577, test_loss: 1.0075, test_f1: 0.6130
 epoch: 88, train_loss: 0.7553, test_loss: 1.0807, test_f1: 0.5294
 epoch: 89, train_loss: 0.7414, test_loss: 1.0089, test_f1: 0.6042
 epoch: 90, train_loss: 0.7221, test_loss: 1.0417, test_f1: 0.6015
 epoch: 91, train_loss: 0.7379, test_loss: 0.9896, test_f1: 0.6189
 epoch: 92, train_loss: 0.7225, test_loss: 1.0050, test_f1: 0.5993
 epoch: 93, train_loss: 0.7233, test_loss: 1.0414, test_f1: 0.6188
 epoch: 94, train_loss: 0.7224, test_loss: 1.0065, test_f1: 0.6059
 epoch: 95, train_loss: 0.7436, test_loss: 0.9838, test_f1: 0.6000
 epoch: 96, train_loss: 0.7269, test_loss: 1.0033, test_f1: 0.6202
 epoch: 97, train_loss: 0.7084, test_loss: 0.9932, test_f1: 0.6037
 epoch: 98, train_loss: 0.7219, test_loss: 1.1087, test_f1: 0.6208
 epoch: 99, train_loss: 0.7211, test_loss: 1.1210, test_f1: 0.5299
##################ITERATION #5 ****************************************
 epoch: 0, train_loss: 1.2190, test_loss: 1.2943, test_f1: 0.2281
 epoch: 1, train_loss: 1.0773, test_loss: 1.1570, test_f1: 0.4328
 epoch: 2, train_loss: 1.0238, test_loss: 1.0686, test_f1: 0.4591
 epoch: 3, train_loss: 0.9941, test_loss: 1.0964, test_f1: 0.4608
 epoch: 4, train_loss: 0.9766, test_loss: 1.0677, test_f1: 0.4615
 epoch: 5, train_loss: 0.9862, test_loss: 1.0650, test_f1: 0.5085
 epoch: 6, train_loss: 0.9612, test_loss: 1.1542, test_f1: 0.4981
 epoch: 7, train_loss: 0.9715, test_loss: 1.1234, test_f1: 0.5250
 epoch: 8, train_loss: 0.9619, test_loss: 1.0540, test_f1: 0.5101
 epoch: 9, train_loss: 0.9421, test_loss: 1.0332, test_f1: 0.5430
 epoch: 10, train_loss: 0.9358, test_loss: 1.1197, test_f1: 0.5029
 epoch: 11, train_loss: 0.9176, test_loss: 1.0912, test_f1: 0.4975
 epoch: 12, train_loss: 0.9070, test_loss: 1.0511, test_f1: 0.5251
 epoch: 13, train_loss: 0.9128, test_loss: 1.0617, test_f1: 0.5226
 epoch: 14, train_loss: 0.9158, test_loss: 1.0199, test_f1: 0.5399
 epoch: 15, train_loss: 0.9066, test_loss: 1.0936, test_f1: 0.5108
 epoch: 16, train_loss: 0.8958, test_loss: 1.0174, test_f1: 0.5701
 epoch: 17, train_loss: 0.8825, test_loss: 1.0681, test_f1: 0.5303
 epoch: 18, train_loss: 0.8872, test_loss: 1.0979, test_f1: 0.5262
 epoch: 19, train_loss: 0.8861, test_loss: 1.1342, test_f1: 0.5148
 epoch: 20, train_loss: 0.8871, test_loss: 1.0713, test_f1: 0.5368
 epoch: 21, train_loss: 0.8644, test_loss: 1.1042, test_f1: 0.5096
 epoch: 22, train_loss: 0.8647, test_loss: 1.1319, test_f1: 0.5697
 epoch: 23, train_loss: 0.8544, test_loss: 1.1411, test_f1: 0.5104
 epoch: 24, train_loss: 0.8619, test_loss: 1.2022, test_f1: 0.4656
 epoch: 25, train_loss: 0.8527, test_loss: 1.1964, test_f1: 0.5360
 epoch: 26, train_loss: 0.8719, test_loss: 1.2331, test_f1: 0.5265
 epoch: 27, train_loss: 0.8504, test_loss: 1.0551, test_f1: 0.5053
 epoch: 28, train_loss: 0.8707, test_loss: 1.0076, test_f1: 0.5592
 epoch: 29, train_loss: 0.8420, test_loss: 0.9829, test_f1: 0.5608
 epoch: 30, train_loss: 0.8558, test_loss: 1.0881, test_f1: 0.5458
 epoch: 31, train_loss: 0.8396, test_loss: 1.0751, test_f1: 0.5626
 epoch: 32, train_loss: 0.8272, test_loss: 1.1108, test_f1: 0.5374
 epoch: 33, train_loss: 0.8086, test_loss: 1.0973, test_f1: 0.5652
 epoch: 34, train_loss: 0.8232, test_loss: 1.1753, test_f1: 0.4437
 epoch: 35, train_loss: 0.8343, test_loss: 1.1342, test_f1: 0.5389
 epoch: 36, train_loss: 0.8399, test_loss: 1.3545, test_f1: 0.5271
 epoch: 37, train_loss: 0.8226, test_loss: 1.1076, test_f1: 0.4847
 epoch: 38, train_loss: 0.8112, test_loss: 1.1313, test_f1: 0.5393
 epoch: 39, train_loss: 0.8139, test_loss: 1.1203, test_f1: 0.5262
 epoch: 40, train_loss: 0.8125, test_loss: 1.1344, test_f1: 0.5189
 epoch: 41, train_loss: 0.7847, test_loss: 1.1045, test_f1: 0.5011
 epoch: 42, train_loss: 0.7798, test_loss: 1.1591, test_f1: 0.5863
 epoch: 43, train_loss: 0.7879, test_loss: 1.2509, test_f1: 0.5029
 epoch: 44, train_loss: 0.7816, test_loss: 1.1538, test_f1: 0.5402
 epoch: 45, train_loss: 0.7502, test_loss: 1.7433, test_f1: 0.5345
 epoch: 46, train_loss: 0.7611, test_loss: 1.2330, test_f1: 0.5849
 epoch: 47, train_loss: 0.7730, test_loss: 1.1283, test_f1: 0.5584
 epoch: 48, train_loss: 0.7580, test_loss: 1.4669, test_f1: 0.5092
 epoch: 49, train_loss: 0.7796, test_loss: 1.8144, test_f1: 0.5034
 epoch: 50, train_loss: 0.7685, test_loss: 1.3681, test_f1: 0.3834
 epoch: 51, train_loss: 0.7339, test_loss: 1.1417, test_f1: 0.5206
 epoch: 52, train_loss: 0.7400, test_loss: 1.0795, test_f1: 0.6057
 epoch: 53, train_loss: 0.7264, test_loss: 1.2341, test_f1: 0.5513
 epoch: 54, train_loss: 0.6913, test_loss: 1.0729, test_f1: 0.6004
 epoch: 55, train_loss: 0.7061, test_loss: 1.1228, test_f1: 0.5913
 epoch: 56, train_loss: 0.7000, test_loss: 1.1190, test_f1: 0.6101
 epoch: 57, train_loss: 0.7006, test_loss: 1.3780, test_f1: 0.5623
 epoch: 58, train_loss: 0.6985, test_loss: 1.3162, test_f1: 0.5580
 epoch: 59, train_loss: 0.7049, test_loss: 1.1481, test_f1: 0.6026
 epoch: 60, train_loss: 0.6918, test_loss: 1.1519, test_f1: 0.5870
 epoch: 61, train_loss: 0.6853, test_loss: 1.1526, test_f1: 0.5809
 epoch: 62, train_loss: 0.7028, test_loss: 1.1044, test_f1: 0.6047
 epoch: 63, train_loss: 0.7243, test_loss: 1.3591, test_f1: 0.5369
 epoch: 64, train_loss: 0.7089, test_loss: 1.2852, test_f1: 0.5598
 epoch: 65, train_loss: 0.6733, test_loss: 1.1741, test_f1: 0.6396
 epoch: 66, train_loss: 0.6583, test_loss: 1.2135, test_f1: 0.5484
 epoch: 67, train_loss: 0.6916, test_loss: 1.2128, test_f1: 0.6251
 epoch: 68, train_loss: 0.7030, test_loss: 1.3240, test_f1: 0.5408
 epoch: 69, train_loss: 0.6570, test_loss: 1.2196, test_f1: 0.6168
 epoch: 70, train_loss: 0.6419, test_loss: 1.3218, test_f1: 0.5771
 epoch: 71, train_loss: 0.6527, test_loss: 1.2632, test_f1: 0.6052
 epoch: 72, train_loss: 0.6581, test_loss: 1.1696, test_f1: 0.6084
 epoch: 73, train_loss: 0.6594, test_loss: 1.2270, test_f1: 0.5816
 epoch: 74, train_loss: 0.6552, test_loss: 1.2997, test_f1: 0.5979
 epoch: 75, train_loss: 0.6644, test_loss: 1.2279, test_f1: 0.5670
 epoch: 76, train_loss: 0.6462, test_loss: 1.3449, test_f1: 0.5685
 epoch: 77, train_loss: 0.6603, test_loss: 1.2283, test_f1: 0.5615
 epoch: 78, train_loss: 0.6624, test_loss: 1.2456, test_f1: 0.5464
 epoch: 79, train_loss: 0.6274, test_loss: 1.2394, test_f1: 0.5922
 epoch: 80, train_loss: 0.6323, test_loss: 1.2383, test_f1: 0.6017
 epoch: 81, train_loss: 0.6619, test_loss: 1.2304, test_f1: 0.5733
 epoch: 82, train_loss: 0.6494, test_loss: 1.2557, test_f1: 0.5636
 epoch: 83, train_loss: 0.6384, test_loss: 1.4375, test_f1: 0.5450
 epoch: 84, train_loss: 0.6488, test_loss: 1.2119, test_f1: 0.6011
 epoch: 85, train_loss: 0.6550, test_loss: 1.2879, test_f1: 0.5621
 epoch: 86, train_loss: 0.6240, test_loss: 1.2627, test_f1: 0.5854
 epoch: 87, train_loss: 0.6265, test_loss: 1.4018, test_f1: 0.5477
 epoch: 88, train_loss: 0.6292, test_loss: 1.2930, test_f1: 0.5913
 epoch: 89, train_loss: 0.6519, test_loss: 1.1898, test_f1: 0.5822
 epoch: 90, train_loss: 0.6269, test_loss: 1.1871, test_f1: 0.5794
 epoch: 91, train_loss: 0.6363, test_loss: 1.2966, test_f1: 0.5856
 epoch: 92, train_loss: 0.6400, test_loss: 1.3588, test_f1: 0.5568
 epoch: 93, train_loss: 0.6274, test_loss: 1.3082, test_f1: 0.5602
 epoch: 94, train_loss: 0.6443, test_loss: 1.2698, test_f1: 0.5841
 epoch: 95, train_loss: 0.6257, test_loss: 1.3837, test_f1: 0.5596
 epoch: 96, train_loss: 0.6357, test_loss: 1.4053, test_f1: 0.5656
 epoch: 97, train_loss: 0.6177, test_loss: 1.3011, test_f1: 0.5732
 epoch: 98, train_loss: 0.6177, test_loss: 1.2913, test_f1: 0.5452
 epoch: 99, train_loss: 0.6100, test_loss: 1.2574, test_f1: 0.5804
##################ITERATION #6 ****************************************
 epoch: 0, train_loss: 1.2370, test_loss: 1.2435, test_f1: 0.2926
 epoch: 1, train_loss: 1.1048, test_loss: 1.1845, test_f1: 0.4119
 epoch: 2, train_loss: 1.0439, test_loss: 1.1271, test_f1: 0.4543
 epoch: 3, train_loss: 1.0325, test_loss: 1.1154, test_f1: 0.4752
 epoch: 4, train_loss: 1.0249, test_loss: 1.1977, test_f1: 0.4773
 epoch: 5, train_loss: 0.9935, test_loss: 1.0191, test_f1: 0.5165
 epoch: 6, train_loss: 0.9693, test_loss: 1.0534, test_f1: 0.5105
 epoch: 7, train_loss: 0.9536, test_loss: 1.1036, test_f1: 0.5231
 epoch: 8, train_loss: 0.9444, test_loss: 1.0700, test_f1: 0.5229
 epoch: 9, train_loss: 0.9417, test_loss: 1.0600, test_f1: 0.5000
 epoch: 10, train_loss: 0.9637, test_loss: 1.0233, test_f1: 0.5384
 epoch: 11, train_loss: 0.9409, test_loss: 1.0108, test_f1: 0.5462
 epoch: 12, train_loss: 0.9422, test_loss: 1.0722, test_f1: 0.5084
 epoch: 13, train_loss: 0.9316, test_loss: 1.0211, test_f1: 0.5327
 epoch: 14, train_loss: 0.9153, test_loss: 1.0264, test_f1: 0.5468
 epoch: 15, train_loss: 0.9025, test_loss: 1.0596, test_f1: 0.5555
 epoch: 16, train_loss: 0.9174, test_loss: 1.0490, test_f1: 0.4850
 epoch: 17, train_loss: 0.9014, test_loss: 1.0309, test_f1: 0.5580
 epoch: 18, train_loss: 0.8773, test_loss: 1.1381, test_f1: 0.5512
 epoch: 19, train_loss: 0.9016, test_loss: 1.0053, test_f1: 0.5587
 epoch: 20, train_loss: 0.8800, test_loss: 1.0832, test_f1: 0.4870
 epoch: 21, train_loss: 0.8944, test_loss: 0.9861, test_f1: 0.5967
 epoch: 22, train_loss: 0.8632, test_loss: 0.9228, test_f1: 0.6208
 epoch: 23, train_loss: 0.8760, test_loss: 1.1127, test_f1: 0.5193
 epoch: 24, train_loss: 0.8658, test_loss: 1.1109, test_f1: 0.4962
 epoch: 25, train_loss: 0.8591, test_loss: 0.9781, test_f1: 0.5669
 epoch: 26, train_loss: 0.8328, test_loss: 1.0581, test_f1: 0.4834
 epoch: 27, train_loss: 0.8548, test_loss: 1.0565, test_f1: 0.4908
 epoch: 28, train_loss: 0.8367, test_loss: 1.0235, test_f1: 0.5786
 epoch: 29, train_loss: 0.8351, test_loss: 1.2184, test_f1: 0.5462
 epoch: 30, train_loss: 0.8458, test_loss: 1.0737, test_f1: 0.5056
 epoch: 31, train_loss: 0.8413, test_loss: 1.1838, test_f1: 0.5404
 epoch: 32, train_loss: 0.8365, test_loss: 1.0637, test_f1: 0.5275
 epoch: 33, train_loss: 0.7962, test_loss: 1.0216, test_f1: 0.5665
 epoch: 34, train_loss: 0.7917, test_loss: 0.9890, test_f1: 0.5874
 epoch: 35, train_loss: 0.8097, test_loss: 1.0845, test_f1: 0.5162
 epoch: 36, train_loss: 0.8055, test_loss: 1.0752, test_f1: 0.5155
 epoch: 37, train_loss: 0.8082, test_loss: 1.0400, test_f1: 0.5577
 epoch: 38, train_loss: 0.7876, test_loss: 1.1730, test_f1: 0.5510
 epoch: 39, train_loss: 0.8137, test_loss: 1.0023, test_f1: 0.5627
 epoch: 40, train_loss: 0.8030, test_loss: 1.2538, test_f1: 0.5226
 epoch: 41, train_loss: 0.8144, test_loss: 1.1076, test_f1: 0.5088
 epoch: 42, train_loss: 0.8541, test_loss: 1.0504, test_f1: 0.5731
 epoch: 43, train_loss: 0.7975, test_loss: 1.0416, test_f1: 0.5695
 epoch: 44, train_loss: 0.7750, test_loss: 1.0788, test_f1: 0.5904
 epoch: 45, train_loss: 0.8068, test_loss: 1.1035, test_f1: 0.5592
 epoch: 46, train_loss: 0.8298, test_loss: 1.0839, test_f1: 0.5752
 epoch: 47, train_loss: 0.7853, test_loss: 1.0425, test_f1: 0.5454
 epoch: 48, train_loss: 0.7806, test_loss: 1.0412, test_f1: 0.5185
 epoch: 49, train_loss: 0.7671, test_loss: 1.0496, test_f1: 0.5426
 epoch: 50, train_loss: 0.7553, test_loss: 1.0857, test_f1: 0.5812
 epoch: 51, train_loss: 0.7414, test_loss: 1.0639, test_f1: 0.5720
 epoch: 52, train_loss: 0.7268, test_loss: 1.0694, test_f1: 0.6094
 epoch: 53, train_loss: 0.7243, test_loss: 1.0887, test_f1: 0.5769
 epoch: 54, train_loss: 0.7206, test_loss: 1.0932, test_f1: 0.5509
 epoch: 55, train_loss: 0.7144, test_loss: 1.1129, test_f1: 0.5677
 epoch: 56, train_loss: 0.7041, test_loss: 1.1521, test_f1: 0.5181
 epoch: 57, train_loss: 0.7332, test_loss: 1.1346, test_f1: 0.5556
 epoch: 58, train_loss: 0.7177, test_loss: 1.0572, test_f1: 0.5973
 epoch: 59, train_loss: 0.7240, test_loss: 1.1609, test_f1: 0.5544
 epoch: 60, train_loss: 0.6877, test_loss: 1.0405, test_f1: 0.6260
 epoch: 61, train_loss: 0.6984, test_loss: 1.0693, test_f1: 0.5693
 epoch: 62, train_loss: 0.6874, test_loss: 1.0166, test_f1: 0.6045
 epoch: 63, train_loss: 0.6782, test_loss: 1.0959, test_f1: 0.6076
 epoch: 64, train_loss: 0.6588, test_loss: 1.1466, test_f1: 0.5531
 epoch: 65, train_loss: 0.6901, test_loss: 1.0778, test_f1: 0.6051
 epoch: 66, train_loss: 0.6932, test_loss: 1.1432, test_f1: 0.5883
 epoch: 67, train_loss: 0.6839, test_loss: 1.1975, test_f1: 0.5245
 epoch: 68, train_loss: 0.6939, test_loss: 1.1620, test_f1: 0.5303
 epoch: 69, train_loss: 0.7150, test_loss: 1.1258, test_f1: 0.5543
 epoch: 70, train_loss: 0.6785, test_loss: 1.1074, test_f1: 0.5982
 epoch: 71, train_loss: 0.6646, test_loss: 1.1609, test_f1: 0.5883
 epoch: 72, train_loss: 0.6654, test_loss: 1.3683, test_f1: 0.4920
 epoch: 73, train_loss: 0.6946, test_loss: 1.1303, test_f1: 0.5320
 epoch: 74, train_loss: 0.6842, test_loss: 1.1622, test_f1: 0.5645
 epoch: 75, train_loss: 0.6687, test_loss: 1.2152, test_f1: 0.6346
 epoch: 76, train_loss: 0.6720, test_loss: 1.1466, test_f1: 0.5400
 epoch: 77, train_loss: 0.6605, test_loss: 1.1646, test_f1: 0.5932
 epoch: 78, train_loss: 0.6476, test_loss: 1.1717, test_f1: 0.6043
 epoch: 79, train_loss: 0.6799, test_loss: 1.1998, test_f1: 0.5789
 epoch: 80, train_loss: 0.6425, test_loss: 1.1889, test_f1: 0.6036
 epoch: 81, train_loss: 0.6546, test_loss: 1.2587, test_f1: 0.5940
 epoch: 82, train_loss: 0.6497, test_loss: 1.2008, test_f1: 0.6002
 epoch: 83, train_loss: 0.6384, test_loss: 1.2387, test_f1: 0.5934
 epoch: 84, train_loss: 0.6401, test_loss: 1.2681, test_f1: 0.5809
 epoch: 85, train_loss: 0.6477, test_loss: 1.2980, test_f1: 0.5768
 epoch: 86, train_loss: 0.6202, test_loss: 1.1896, test_f1: 0.5909
 epoch: 87, train_loss: 0.6416, test_loss: 1.1088, test_f1: 0.5874
 epoch: 88, train_loss: 0.6273, test_loss: 1.4734, test_f1: 0.5328
 epoch: 89, train_loss: 0.6315, test_loss: 1.2279, test_f1: 0.5813
 epoch: 90, train_loss: 0.6290, test_loss: 1.2607, test_f1: 0.5913
 epoch: 91, train_loss: 0.6418, test_loss: 1.3298, test_f1: 0.5903
 epoch: 92, train_loss: 0.6330, test_loss: 1.1777, test_f1: 0.6165
 epoch: 93, train_loss: 0.6010, test_loss: 1.2767, test_f1: 0.5499
 epoch: 94, train_loss: 0.6194, test_loss: 1.2295, test_f1: 0.6126
 epoch: 95, train_loss: 0.6261, test_loss: 1.1926, test_f1: 0.5903
 epoch: 96, train_loss: 0.6178, test_loss: 1.2056, test_f1: 0.6220
 epoch: 97, train_loss: 0.5980, test_loss: 1.2028, test_f1: 0.6165
 epoch: 98, train_loss: 0.6227, test_loss: 1.3918, test_f1: 0.5667
 epoch: 99, train_loss: 0.6217, test_loss: 1.3725, test_f1: 0.5283
##################ITERATION #7 ****************************************
 epoch: 0, train_loss: 1.3054, test_loss: 1.2298, test_f1: 0.2722
 epoch: 1, train_loss: 1.0974, test_loss: 1.1430, test_f1: 0.4365
 epoch: 2, train_loss: 1.0670, test_loss: 1.2067, test_f1: 0.3850
 epoch: 3, train_loss: 1.0383, test_loss: 1.0550, test_f1: 0.4716
 epoch: 4, train_loss: 1.0092, test_loss: 1.0498, test_f1: 0.4921
 epoch: 5, train_loss: 1.0040, test_loss: 1.0938, test_f1: 0.4814
 epoch: 6, train_loss: 0.9833, test_loss: 1.1210, test_f1: 0.5200
 epoch: 7, train_loss: 0.9793, test_loss: 1.0440, test_f1: 0.4886
 epoch: 8, train_loss: 0.9602, test_loss: 1.0318, test_f1: 0.5065
 epoch: 9, train_loss: 0.9511, test_loss: 1.0409, test_f1: 0.4311
 epoch: 10, train_loss: 0.9586, test_loss: 1.0467, test_f1: 0.5644
 epoch: 11, train_loss: 0.9213, test_loss: 1.0036, test_f1: 0.5379
 epoch: 12, train_loss: 0.9420, test_loss: 1.1829, test_f1: 0.4470
 epoch: 13, train_loss: 0.9138, test_loss: 0.9806, test_f1: 0.5585
 epoch: 14, train_loss: 0.9257, test_loss: 1.0078, test_f1: 0.5077
 epoch: 15, train_loss: 0.9214, test_loss: 1.0432, test_f1: 0.5307
 epoch: 16, train_loss: 0.9101, test_loss: 1.1287, test_f1: 0.4792
 epoch: 17, train_loss: 0.9084, test_loss: 1.0616, test_f1: 0.5212
 epoch: 18, train_loss: 0.8863, test_loss: 1.0661, test_f1: 0.5205
 epoch: 19, train_loss: 0.8784, test_loss: 1.0380, test_f1: 0.5686
 epoch: 20, train_loss: 0.8841, test_loss: 1.0339, test_f1: 0.5514
 epoch: 21, train_loss: 0.8617, test_loss: 1.0728, test_f1: 0.4896
 epoch: 22, train_loss: 0.8670, test_loss: 1.2502, test_f1: 0.4034
 epoch: 23, train_loss: 0.8907, test_loss: 0.9992, test_f1: 0.5725
 epoch: 24, train_loss: 0.8762, test_loss: 1.0350, test_f1: 0.5484
 epoch: 25, train_loss: 0.8806, test_loss: 1.3817, test_f1: 0.5443
 epoch: 26, train_loss: 0.8823, test_loss: 1.0548, test_f1: 0.5483
 epoch: 27, train_loss: 0.8498, test_loss: 1.0857, test_f1: 0.5588
 epoch: 28, train_loss: 0.8491, test_loss: 1.0552, test_f1: 0.5349
 epoch: 29, train_loss: 0.8452, test_loss: 1.0848, test_f1: 0.5427
 epoch: 30, train_loss: 0.8381, test_loss: 1.0527, test_f1: 0.5590
 epoch: 31, train_loss: 0.8240, test_loss: 1.0652, test_f1: 0.5498
 epoch: 32, train_loss: 0.8702, test_loss: 1.1473, test_f1: 0.5372
 epoch: 33, train_loss: 0.8257, test_loss: 1.1519, test_f1: 0.5606
 epoch: 34, train_loss: 0.8114, test_loss: 1.0808, test_f1: 0.5011
 epoch: 35, train_loss: 0.7910, test_loss: 1.0919, test_f1: 0.5631
 epoch: 36, train_loss: 0.8049, test_loss: 0.9516, test_f1: 0.5859
 epoch: 37, train_loss: 0.7719, test_loss: 1.0005, test_f1: 0.5450
 epoch: 38, train_loss: 0.8116, test_loss: 1.1970, test_f1: 0.5205
 epoch: 39, train_loss: 0.8062, test_loss: 1.0207, test_f1: 0.5917
 epoch: 40, train_loss: 0.7601, test_loss: 1.0579, test_f1: 0.5168
 epoch: 41, train_loss: 0.7684, test_loss: 1.3069, test_f1: 0.5327
 epoch: 42, train_loss: 0.7566, test_loss: 1.0670, test_f1: 0.5807
 epoch: 43, train_loss: 0.7930, test_loss: 0.9908, test_f1: 0.6180
 epoch: 44, train_loss: 0.7633, test_loss: 1.1030, test_f1: 0.5586
 epoch: 45, train_loss: 0.7799, test_loss: 1.1173, test_f1: 0.5005
 epoch: 46, train_loss: 0.7909, test_loss: 1.0239, test_f1: 0.5944
 epoch: 47, train_loss: 0.7698, test_loss: 1.0522, test_f1: 0.5703
 epoch: 48, train_loss: 0.7547, test_loss: 1.0808, test_f1: 0.5247
 epoch: 49, train_loss: 0.7253, test_loss: 1.1537, test_f1: 0.5134
 epoch: 50, train_loss: 0.7585, test_loss: 1.1559, test_f1: 0.5066
 epoch: 51, train_loss: 0.7197, test_loss: 1.1495, test_f1: 0.5319
 epoch: 52, train_loss: 0.7023, test_loss: 1.0924, test_f1: 0.5661
 epoch: 53, train_loss: 0.7086, test_loss: 1.1186, test_f1: 0.5431
 epoch: 54, train_loss: 0.6779, test_loss: 1.1168, test_f1: 0.5871
 epoch: 55, train_loss: 0.6935, test_loss: 1.1133, test_f1: 0.5911
 epoch: 56, train_loss: 0.6973, test_loss: 1.1589, test_f1: 0.5583
 epoch: 57, train_loss: 0.6643, test_loss: 1.0911, test_f1: 0.5612
 epoch: 58, train_loss: 0.6831, test_loss: 1.1155, test_f1: 0.5622
 epoch: 59, train_loss: 0.6748, test_loss: 1.1405, test_f1: 0.5958
 epoch: 60, train_loss: 0.6860, test_loss: 1.0816, test_f1: 0.5917
 epoch: 61, train_loss: 0.6941, test_loss: 1.1765, test_f1: 0.5737
 epoch: 62, train_loss: 0.6987, test_loss: 1.2338, test_f1: 0.5584
 epoch: 63, train_loss: 0.6840, test_loss: 1.1093, test_f1: 0.5671
 epoch: 64, train_loss: 0.6763, test_loss: 1.1171, test_f1: 0.5573
 epoch: 65, train_loss: 0.6675, test_loss: 1.0769, test_f1: 0.5817
 epoch: 66, train_loss: 0.6645, test_loss: 1.1806, test_f1: 0.5953
 epoch: 67, train_loss: 0.6703, test_loss: 1.2057, test_f1: 0.5740
 epoch: 68, train_loss: 0.6432, test_loss: 1.1377, test_f1: 0.5886
 epoch: 69, train_loss: 0.6643, test_loss: 1.2374, test_f1: 0.5578
 epoch: 70, train_loss: 0.6479, test_loss: 1.1420, test_f1: 0.6118
 epoch: 71, train_loss: 0.6853, test_loss: 1.1337, test_f1: 0.5846
 epoch: 72, train_loss: 0.6673, test_loss: 1.1742, test_f1: 0.5866
 epoch: 73, train_loss: 0.6616, test_loss: 1.0794, test_f1: 0.5999
 epoch: 74, train_loss: 0.6615, test_loss: 1.1523, test_f1: 0.5950
 epoch: 75, train_loss: 0.6456, test_loss: 1.3549, test_f1: 0.5463
 epoch: 76, train_loss: 0.6538, test_loss: 1.1374, test_f1: 0.6132
 epoch: 77, train_loss: 0.6279, test_loss: 1.2357, test_f1: 0.5652
 epoch: 78, train_loss: 0.6485, test_loss: 1.2189, test_f1: 0.5830
 epoch: 79, train_loss: 0.6310, test_loss: 1.1493, test_f1: 0.5911
 epoch: 80, train_loss: 0.6257, test_loss: 1.2304, test_f1: 0.6165
 epoch: 81, train_loss: 0.6413, test_loss: 1.2033, test_f1: 0.5825
 epoch: 82, train_loss: 0.6353, test_loss: 1.2180, test_f1: 0.5684
 epoch: 83, train_loss: 0.6554, test_loss: 1.2675, test_f1: 0.5789
 epoch: 84, train_loss: 0.6284, test_loss: 1.2740, test_f1: 0.5906
 epoch: 85, train_loss: 0.6298, test_loss: 1.1378, test_f1: 0.6206
 epoch: 86, train_loss: 0.6058, test_loss: 1.3509, test_f1: 0.5913
 epoch: 87, train_loss: 0.6151, test_loss: 1.2309, test_f1: 0.5942
 epoch: 88, train_loss: 0.6236, test_loss: 1.2955, test_f1: 0.5697
 epoch: 89, train_loss: 0.6367, test_loss: 1.2290, test_f1: 0.5735
 epoch: 90, train_loss: 0.6292, test_loss: 1.1905, test_f1: 0.6118
 epoch: 91, train_loss: 0.6537, test_loss: 1.2229, test_f1: 0.5772
 epoch: 92, train_loss: 0.6437, test_loss: 1.2106, test_f1: 0.5658
 epoch: 93, train_loss: 0.6271, test_loss: 1.1359, test_f1: 0.5742
 epoch: 94, train_loss: 0.6087, test_loss: 1.2356, test_f1: 0.5851
 epoch: 95, train_loss: 0.6046, test_loss: 1.2359, test_f1: 0.5823
 epoch: 96, train_loss: 0.6147, test_loss: 1.2142, test_f1: 0.6190
 epoch: 97, train_loss: 0.6442, test_loss: 1.3414, test_f1: 0.5542
 epoch: 98, train_loss: 0.6127, test_loss: 1.1427, test_f1: 0.6069
 epoch: 99, train_loss: 0.6278, test_loss: 1.2003, test_f1: 0.5724
##################ITERATION #8 ****************************************
 epoch: 0, train_loss: 1.3664, test_loss: 1.3888, test_f1: 0.2597
 epoch: 1, train_loss: 1.1353, test_loss: 1.2321, test_f1: 0.4414
 epoch: 2, train_loss: 1.0739, test_loss: 1.1809, test_f1: 0.4321
 epoch: 3, train_loss: 1.0589, test_loss: 1.1957, test_f1: 0.3511
 epoch: 4, train_loss: 1.0350, test_loss: 1.1788, test_f1: 0.4295
 epoch: 5, train_loss: 1.0035, test_loss: 1.1653, test_f1: 0.4273
 epoch: 6, train_loss: 0.9994, test_loss: 1.1348, test_f1: 0.3843
 epoch: 7, train_loss: 0.9751, test_loss: 1.1421, test_f1: 0.4628
 epoch: 8, train_loss: 0.9789, test_loss: 1.1435, test_f1: 0.4485
 epoch: 9, train_loss: 0.9820, test_loss: 1.0734, test_f1: 0.4918
 epoch: 10, train_loss: 0.9646, test_loss: 1.1126, test_f1: 0.5179
 epoch: 11, train_loss: 0.9683, test_loss: 1.1251, test_f1: 0.4606
 epoch: 12, train_loss: 0.9695, test_loss: 1.1432, test_f1: 0.4933
 epoch: 13, train_loss: 0.9734, test_loss: 1.0504, test_f1: 0.4555
 epoch: 14, train_loss: 0.9343, test_loss: 1.0587, test_f1: 0.5223
 epoch: 15, train_loss: 0.9428, test_loss: 1.0804, test_f1: 0.4980
 epoch: 16, train_loss: 0.9451, test_loss: 1.1295, test_f1: 0.4704
 epoch: 17, train_loss: 0.9238, test_loss: 1.0476, test_f1: 0.5051
 epoch: 18, train_loss: 0.9230, test_loss: 1.0738, test_f1: 0.5107
 epoch: 19, train_loss: 0.9313, test_loss: 1.0878, test_f1: 0.5246
 epoch: 20, train_loss: 0.9218, test_loss: 1.0327, test_f1: 0.5296
 epoch: 21, train_loss: 0.8902, test_loss: 1.1031, test_f1: 0.4906
 epoch: 22, train_loss: 0.8888, test_loss: 1.0719, test_f1: 0.5530
 epoch: 23, train_loss: 0.9132, test_loss: 1.0128, test_f1: 0.5469
 epoch: 24, train_loss: 0.8938, test_loss: 1.0062, test_f1: 0.5431
 epoch: 25, train_loss: 0.8860, test_loss: 1.0792, test_f1: 0.5067
 epoch: 26, train_loss: 0.8789, test_loss: 1.1411, test_f1: 0.5300
 epoch: 27, train_loss: 0.8950, test_loss: 1.0862, test_f1: 0.5195
 epoch: 28, train_loss: 0.8817, test_loss: 1.0593, test_f1: 0.5428
 epoch: 29, train_loss: 0.8861, test_loss: 1.1518, test_f1: 0.5042
 epoch: 30, train_loss: 0.8835, test_loss: 1.0194, test_f1: 0.5320
 epoch: 31, train_loss: 0.8627, test_loss: 1.0610, test_f1: 0.5356
 epoch: 32, train_loss: 0.8480, test_loss: 1.0634, test_f1: 0.5558
 epoch: 33, train_loss: 0.8560, test_loss: 1.0891, test_f1: 0.5214
 epoch: 34, train_loss: 0.8821, test_loss: 1.2132, test_f1: 0.4624
 epoch: 35, train_loss: 0.8708, test_loss: 1.0554, test_f1: 0.5221
 epoch: 36, train_loss: 0.8542, test_loss: 0.9725, test_f1: 0.5746
 epoch: 37, train_loss: 0.8459, test_loss: 1.2081, test_f1: 0.5194
 epoch: 38, train_loss: 0.8390, test_loss: 1.1470, test_f1: 0.5129
 epoch: 39, train_loss: 0.8485, test_loss: 1.1414, test_f1: 0.5405
 epoch: 40, train_loss: 0.8381, test_loss: 1.0693, test_f1: 0.5536
 epoch: 41, train_loss: 0.8359, test_loss: 1.0396, test_f1: 0.5435
 epoch: 42, train_loss: 0.8305, test_loss: 1.0589, test_f1: 0.5426
 epoch: 43, train_loss: 0.8290, test_loss: 1.0675, test_f1: 0.5269
 epoch: 44, train_loss: 0.8339, test_loss: 1.0872, test_f1: 0.5213
 epoch: 45, train_loss: 0.8292, test_loss: 1.0178, test_f1: 0.5815
 epoch: 46, train_loss: 0.8245, test_loss: 1.0413, test_f1: 0.5495
 epoch: 47, train_loss: 0.7962, test_loss: 1.0265, test_f1: 0.5841
 epoch: 48, train_loss: 0.7919, test_loss: 1.0144, test_f1: 0.5610
 epoch: 49, train_loss: 0.7965, test_loss: 1.1343, test_f1: 0.5362
 epoch: 50, train_loss: 0.7622, test_loss: 1.0803, test_f1: 0.5402
 epoch: 51, train_loss: 0.7541, test_loss: 1.0979, test_f1: 0.5618
 epoch: 52, train_loss: 0.7482, test_loss: 1.0658, test_f1: 0.5469
 epoch: 53, train_loss: 0.7423, test_loss: 1.2528, test_f1: 0.5612
 epoch: 54, train_loss: 0.7427, test_loss: 1.1052, test_f1: 0.5778
 epoch: 55, train_loss: 0.7330, test_loss: 1.0863, test_f1: 0.5930
 epoch: 56, train_loss: 0.7333, test_loss: 1.1318, test_f1: 0.5734
 epoch: 57, train_loss: 0.7284, test_loss: 1.1389, test_f1: 0.5769
 epoch: 58, train_loss: 0.7250, test_loss: 1.1379, test_f1: 0.5636
 epoch: 59, train_loss: 0.7362, test_loss: 1.2920, test_f1: 0.5446
 epoch: 60, train_loss: 0.7357, test_loss: 1.1161, test_f1: 0.5332
 epoch: 61, train_loss: 0.7281, test_loss: 1.1761, test_f1: 0.5698
 epoch: 62, train_loss: 0.7065, test_loss: 1.0927, test_f1: 0.5938
 epoch: 63, train_loss: 0.6976, test_loss: 1.2524, test_f1: 0.5323
 epoch: 64, train_loss: 0.7370, test_loss: 1.1879, test_f1: 0.5545
 epoch: 65, train_loss: 0.7252, test_loss: 1.0866, test_f1: 0.6047
 epoch: 66, train_loss: 0.7158, test_loss: 1.2015, test_f1: 0.5910
 epoch: 67, train_loss: 0.6982, test_loss: 1.1352, test_f1: 0.6015
 epoch: 68, train_loss: 0.6933, test_loss: 1.1781, test_f1: 0.5624
 epoch: 69, train_loss: 0.7165, test_loss: 1.2954, test_f1: 0.5455
 epoch: 70, train_loss: 0.7110, test_loss: 1.2359, test_f1: 0.5664
 epoch: 71, train_loss: 0.6917, test_loss: 1.2282, test_f1: 0.5843
 epoch: 72, train_loss: 0.7075, test_loss: 1.2177, test_f1: 0.5699
 epoch: 73, train_loss: 0.6733, test_loss: 1.2142, test_f1: 0.5816
 epoch: 74, train_loss: 0.6801, test_loss: 1.2267, test_f1: 0.5855
 epoch: 75, train_loss: 0.6915, test_loss: 1.3562, test_f1: 0.5874
 epoch: 76, train_loss: 0.6879, test_loss: 1.4163, test_f1: 0.5803
 epoch: 77, train_loss: 0.6957, test_loss: 1.2939, test_f1: 0.5849
 epoch: 78, train_loss: 0.6955, test_loss: 1.1391, test_f1: 0.6112
 epoch: 79, train_loss: 0.6858, test_loss: 1.2607, test_f1: 0.5659
 epoch: 80, train_loss: 0.6664, test_loss: 1.1929, test_f1: 0.5663
 epoch: 81, train_loss: 0.6790, test_loss: 1.1889, test_f1: 0.5886
 epoch: 82, train_loss: 0.6716, test_loss: 1.1416, test_f1: 0.5998
 epoch: 83, train_loss: 0.6697, test_loss: 1.1987, test_f1: 0.6094
 epoch: 84, train_loss: 0.6626, test_loss: 1.2626, test_f1: 0.5797
 epoch: 85, train_loss: 0.6423, test_loss: 1.2174, test_f1: 0.5949
 epoch: 86, train_loss: 0.6566, test_loss: 1.2378, test_f1: 0.5957
 epoch: 87, train_loss: 0.6598, test_loss: 1.2047, test_f1: 0.5853
 epoch: 88, train_loss: 0.6817, test_loss: 1.1220, test_f1: 0.6226
 epoch: 89, train_loss: 0.6477, test_loss: 1.3283, test_f1: 0.6218
 epoch: 90, train_loss: 0.6702, test_loss: 1.1525, test_f1: 0.6360
 epoch: 91, train_loss: 0.6884, test_loss: 1.1909, test_f1: 0.6097
 epoch: 92, train_loss: 0.6585, test_loss: 1.2172, test_f1: 0.5922
 epoch: 93, train_loss: 0.6509, test_loss: 1.2214, test_f1: 0.5809
 epoch: 94, train_loss: 0.6481, test_loss: 1.4316, test_f1: 0.5581
 epoch: 95, train_loss: 0.6505, test_loss: 1.2783, test_f1: 0.6198
 epoch: 96, train_loss: 0.6264, test_loss: 1.1089, test_f1: 0.6173
 epoch: 97, train_loss: 0.6264, test_loss: 1.3362, test_f1: 0.5786
 epoch: 98, train_loss: 0.6136, test_loss: 1.2677, test_f1: 0.5871
 epoch: 99, train_loss: 0.6420, test_loss: 1.2823, test_f1: 0.5525
##################ITERATION #9 ****************************************
 epoch: 0, train_loss: 1.2408, test_loss: 1.2460, test_f1: 0.2281
 epoch: 1, train_loss: 1.0884, test_loss: 1.2628, test_f1: 0.3970
 epoch: 2, train_loss: 1.0486, test_loss: 1.0857, test_f1: 0.4230
 epoch: 3, train_loss: 1.0191, test_loss: 1.0543, test_f1: 0.4961
 epoch: 4, train_loss: 0.9696, test_loss: 1.0213, test_f1: 0.4698
 epoch: 5, train_loss: 0.9477, test_loss: 1.0331, test_f1: 0.4648
 epoch: 6, train_loss: 0.9284, test_loss: 1.0429, test_f1: 0.5159
 epoch: 7, train_loss: 0.9147, test_loss: 1.0686, test_f1: 0.4596
 epoch: 8, train_loss: 0.9062, test_loss: 0.9692, test_f1: 0.5581
 epoch: 9, train_loss: 0.8996, test_loss: 1.1861, test_f1: 0.4581
 epoch: 10, train_loss: 0.9121, test_loss: 1.0109, test_f1: 0.5145
 epoch: 11, train_loss: 0.8777, test_loss: 1.0331, test_f1: 0.5074
 epoch: 12, train_loss: 0.8565, test_loss: 1.0141, test_f1: 0.5423
 epoch: 13, train_loss: 0.8381, test_loss: 1.0766, test_f1: 0.5173
 epoch: 14, train_loss: 0.8406, test_loss: 1.0401, test_f1: 0.5337
 epoch: 15, train_loss: 0.8377, test_loss: 1.2085, test_f1: 0.5066
 epoch: 16, train_loss: 0.8578, test_loss: 1.0430, test_f1: 0.5227
 epoch: 17, train_loss: 0.8378, test_loss: 1.1321, test_f1: 0.5189
 epoch: 18, train_loss: 0.8231, test_loss: 1.0361, test_f1: 0.5315
 epoch: 19, train_loss: 0.8116, test_loss: 1.1051, test_f1: 0.5358
 epoch: 20, train_loss: 0.8098, test_loss: 1.0317, test_f1: 0.5881
 epoch: 21, train_loss: 0.7930, test_loss: 1.1081, test_f1: 0.5331
 epoch: 22, train_loss: 0.8199, test_loss: 1.1428, test_f1: 0.5109
 epoch: 23, train_loss: 0.8248, test_loss: 0.9503, test_f1: 0.5502
 epoch: 24, train_loss: 0.7939, test_loss: 1.0253, test_f1: 0.5623
 epoch: 25, train_loss: 0.7889, test_loss: 0.9776, test_f1: 0.5705
 epoch: 26, train_loss: 0.7904, test_loss: 1.0013, test_f1: 0.5582
 epoch: 27, train_loss: 0.7811, test_loss: 1.1068, test_f1: 0.5302
 epoch: 28, train_loss: 0.7715, test_loss: 1.1123, test_f1: 0.5358
 epoch: 29, train_loss: 0.7697, test_loss: 1.0431, test_f1: 0.5651
 epoch: 30, train_loss: 0.7593, test_loss: 1.1091, test_f1: 0.5837
 epoch: 31, train_loss: 0.7652, test_loss: 1.2286, test_f1: 0.5387
 epoch: 32, train_loss: 0.7646, test_loss: 1.0197, test_f1: 0.5811
 epoch: 33, train_loss: 0.7502, test_loss: 0.9741, test_f1: 0.5814
 epoch: 34, train_loss: 0.7671, test_loss: 1.0738, test_f1: 0.5552
 epoch: 35, train_loss: 0.7572, test_loss: 0.9711, test_f1: 0.6183
 epoch: 36, train_loss: 0.7703, test_loss: 1.1203, test_f1: 0.5143
 epoch: 37, train_loss: 0.7596, test_loss: 0.9572, test_f1: 0.5644
 epoch: 38, train_loss: 0.7508, test_loss: 1.0553, test_f1: 0.5784
 epoch: 39, train_loss: 0.7435, test_loss: 1.0954, test_f1: 0.5549
 epoch: 40, train_loss: 0.7317, test_loss: 1.1149, test_f1: 0.5644
 epoch: 41, train_loss: 0.7372, test_loss: 1.0280, test_f1: 0.5688
 epoch: 42, train_loss: 0.7432, test_loss: 0.9797, test_f1: 0.6174
 epoch: 43, train_loss: 0.7180, test_loss: 1.1418, test_f1: 0.5512
 epoch: 44, train_loss: 0.7540, test_loss: 1.2483, test_f1: 0.5002
 epoch: 45, train_loss: 0.7973, test_loss: 1.5138, test_f1: 0.4393
 epoch: 46, train_loss: 0.8377, test_loss: 1.0643, test_f1: 0.5559
 epoch: 47, train_loss: 0.9042, test_loss: 1.0933, test_f1: 0.5191
 epoch: 48, train_loss: 0.8273, test_loss: 1.0342, test_f1: 0.5292
 epoch: 49, train_loss: 0.7911, test_loss: 0.9591, test_f1: 0.6020
 epoch: 50, train_loss: 0.7829, test_loss: 1.0339, test_f1: 0.5890
 epoch: 51, train_loss: 0.7555, test_loss: 0.9906, test_f1: 0.6010
 epoch: 52, train_loss: 0.7433, test_loss: 1.0206, test_f1: 0.5732
 epoch: 53, train_loss: 0.7398, test_loss: 0.9452, test_f1: 0.6150
 epoch: 54, train_loss: 0.7228, test_loss: 0.9443, test_f1: 0.5902
 epoch: 55, train_loss: 0.7192, test_loss: 1.0925, test_f1: 0.5778
 epoch: 56, train_loss: 0.7269, test_loss: 1.0325, test_f1: 0.6145
 epoch: 57, train_loss: 0.7184, test_loss: 0.9979, test_f1: 0.6185
 epoch: 58, train_loss: 0.7043, test_loss: 0.9506, test_f1: 0.6174
 epoch: 59, train_loss: 0.6926, test_loss: 1.1013, test_f1: 0.5511
 epoch: 60, train_loss: 0.7091, test_loss: 1.0920, test_f1: 0.6014
 epoch: 61, train_loss: 0.7056, test_loss: 1.0441, test_f1: 0.6026
 epoch: 62, train_loss: 0.7024, test_loss: 0.9615, test_f1: 0.6043
 epoch: 63, train_loss: 0.7048, test_loss: 1.1288, test_f1: 0.5950
 epoch: 64, train_loss: 0.6911, test_loss: 1.0049, test_f1: 0.6355
 epoch: 65, train_loss: 0.6920, test_loss: 1.0983, test_f1: 0.5988
 epoch: 66, train_loss: 0.6911, test_loss: 1.0207, test_f1: 0.6131
 epoch: 67, train_loss: 0.6860, test_loss: 1.1409, test_f1: 0.5991
 epoch: 68, train_loss: 0.6771, test_loss: 1.0346, test_f1: 0.6286
 epoch: 69, train_loss: 0.7086, test_loss: 1.0309, test_f1: 0.6082
 epoch: 70, train_loss: 0.6916, test_loss: 1.0621, test_f1: 0.6279
 epoch: 71, train_loss: 0.6967, test_loss: 1.0543, test_f1: 0.5833
 epoch: 72, train_loss: 0.6833, test_loss: 1.0951, test_f1: 0.6042
 epoch: 73, train_loss: 0.6718, test_loss: 1.0402, test_f1: 0.6103
 epoch: 74, train_loss: 0.6627, test_loss: 1.0900, test_f1: 0.6227
 epoch: 75, train_loss: 0.6669, test_loss: 1.1489, test_f1: 0.6130
 epoch: 76, train_loss: 0.6740, test_loss: 1.0245, test_f1: 0.6034
 epoch: 77, train_loss: 0.6867, test_loss: 1.0781, test_f1: 0.6008
 epoch: 78, train_loss: 0.6679, test_loss: 1.0843, test_f1: 0.6254
 epoch: 79, train_loss: 0.6575, test_loss: 1.0634, test_f1: 0.6117
 epoch: 80, train_loss: 0.6386, test_loss: 1.1042, test_f1: 0.5681
 epoch: 81, train_loss: 0.6633, test_loss: 1.0033, test_f1: 0.6204
 epoch: 82, train_loss: 0.6610, test_loss: 1.1502, test_f1: 0.5986
 epoch: 83, train_loss: 0.6543, test_loss: 1.1348, test_f1: 0.6349
 epoch: 84, train_loss: 0.6279, test_loss: 1.1691, test_f1: 0.5867
 epoch: 85, train_loss: 0.6468, test_loss: 1.1558, test_f1: 0.6116
 epoch: 86, train_loss: 0.6795, test_loss: 1.1282, test_f1: 0.5216
 epoch: 87, train_loss: 0.6840, test_loss: 1.0603, test_f1: 0.6502
 epoch: 88, train_loss: 0.6635, test_loss: 1.1746, test_f1: 0.5703
 epoch: 89, train_loss: 0.6816, test_loss: 1.0150, test_f1: 0.5705
 epoch: 90, train_loss: 0.6590, test_loss: 1.0792, test_f1: 0.5820
 epoch: 91, train_loss: 0.6576, test_loss: 1.0367, test_f1: 0.6284
 epoch: 92, train_loss: 0.6485, test_loss: 1.0612, test_f1: 0.5963
 epoch: 93, train_loss: 0.6381, test_loss: 1.0743, test_f1: 0.5971
 epoch: 94, train_loss: 0.6362, test_loss: 1.1719, test_f1: 0.5747
 epoch: 95, train_loss: 0.6496, test_loss: 1.2381, test_f1: 0.5799
 epoch: 96, train_loss: 0.6278, test_loss: 1.1720, test_f1: 0.5699
 epoch: 97, train_loss: 0.6424, test_loss: 1.1039, test_f1: 0.6145
 epoch: 98, train_loss: 0.6271, test_loss: 1.1364, test_f1: 0.5880
 epoch: 99, train_loss: 0.6241, test_loss: 1.1793, test_f1: 0.5839

Training completed in 445.19 seconds
Best F1: 0.6709 at epoch 45
Mean F1 across iterations: 0.6359  0.0143
========================FINAL RESULTS================================
FEGIN weighted F1: 0.6709  0.0143
python main.py --data ltspice_demos --representation component_net --model FEGIN --layers 4 --hiddens 16 --batch_size 64 --lr 0.01 --emb_size 250 --epochs 100 --save_appendix component_net_L4_H16_BS64_LR0.01_E250 --no_val
-----



STDERR:
  File "main.py", line 370, in <module>
    main()
  File "main.py", line 254, in main
    dataset = dataset_class(
  File "/home/philip/projects/ltspice_examples_code_repo/Circuit-Completion-Using-GNNs/component_classification_with_link_prediction_head/evaluation/FEGIN/kernel/circuit_datasets.py", line 15, in __init__
    self.data, self.slices = torch.load(self.processed_paths[0])
  File "/home/philip/.local/lib/python3.8/site-packages/torch/serialization.py", line 1040, in load
    warnings.warn(
  File "/usr/lib/python3.8/warnings.py", line 109, in _showwarnmsg
    sw(msg.message, msg.category, msg.filename, msg.lineno,
  File "main.py", line 47, in warn_with_traceback
    traceback.print_stack(file=log)
/home/philip/projects/ltspice_examples_code_repo/Circuit-Completion-Using-GNNs/component_classification_with_link_prediction_head/evaluation/FEGIN/kernel/circuit_datasets.py:15: FutureWarning: You are using `torch.load` with `weights_only=False` (the current default value), which uses the default pickle module implicitly. It is possible to construct malicious pickle data which will execute arbitrary code during unpickling (See https://github.com/pytorch/pytorch/blob/main/SECURITY.md#untrusted-models for more details). In a future release, the default value for `weights_only` will be flipped to `True`. This limits the functions that could be executed during unpickling. Arbitrary objects will no longer be allowed to be loaded via this mode unless they are explicitly allowlisted by the user via `torch.serialization.add_safe_globals`. We recommend you start setting `weights_only=True` for any use case where you don't have full control of the loaded file. Please open an issue on GitHub for any issues related to this experimental feature.
  self.data, self.slices = torch.load(self.processed_paths[0])
