STDOUT:
Results will be saved in /home/philip/projects/ltspice_examples_code_repo/Circuit-Completion-Using-GNNs/component_classification_with_link_prediction_head/evaluation/FEGIN/results/model_FEGIN_dataset_ltspice_examples
Command line input: python main.py --data ltspice_examples --representation component_component --model FEGIN --layers 5 --hiddens 128 --batch_size 256 --lr 0.001 --emb_size 250 --epochs 100 --save_appendix component_component_L5_H128_BS256_LR0.001_E250 --no_val
 is saved.
-----
ltspice_examples - FEGIN
Using 5 layers, 128 hidden units, h = 2
Loading component_component representation dataset
ENTERED
Training FEGIN on component_component representation
Train: 3556, Test: 845
##################ITERATION #0 ****************************************
 epoch: 0, train_loss: 1.3146, test_loss: 1.2845, test_f1: 0.2589
 epoch: 1, train_loss: 1.1998, test_loss: 1.2085, test_f1: 0.3263
 epoch: 2, train_loss: 1.1419, test_loss: 1.1472, test_f1: 0.3481
 epoch: 3, train_loss: 1.0914, test_loss: 1.0826, test_f1: 0.4661
 epoch: 4, train_loss: 1.0428, test_loss: 0.9953, test_f1: 0.4702
 epoch: 5, train_loss: 1.0076, test_loss: 1.0935, test_f1: 0.4255
 epoch: 6, train_loss: 0.9659, test_loss: 1.0191, test_f1: 0.4789
 epoch: 7, train_loss: 0.9307, test_loss: 1.0897, test_f1: 0.4955
 epoch: 8, train_loss: 0.9165, test_loss: 0.9933, test_f1: 0.4889
 epoch: 9, train_loss: 0.8766, test_loss: 1.0437, test_f1: 0.4931
 epoch: 10, train_loss: 0.8541, test_loss: 1.0474, test_f1: 0.4861
 epoch: 11, train_loss: 0.8443, test_loss: 1.0992, test_f1: 0.4737
 epoch: 12, train_loss: 0.8211, test_loss: 1.1141, test_f1: 0.4768
 epoch: 13, train_loss: 0.8232, test_loss: 1.1326, test_f1: 0.4874
 epoch: 14, train_loss: 0.7954, test_loss: 1.0360, test_f1: 0.5239
 epoch: 15, train_loss: 0.7639, test_loss: 1.0635, test_f1: 0.5255
 epoch: 16, train_loss: 0.7397, test_loss: 1.3133, test_f1: 0.4764
 epoch: 17, train_loss: 0.7077, test_loss: 1.3223, test_f1: 0.5006
 epoch: 18, train_loss: 0.7363, test_loss: 1.2928, test_f1: 0.4944
 epoch: 19, train_loss: 0.7344, test_loss: 1.2697, test_f1: 0.5399
 epoch: 20, train_loss: 0.7231, test_loss: 1.2444, test_f1: 0.4934
 epoch: 21, train_loss: 0.6787, test_loss: 1.2061, test_f1: 0.5289
 epoch: 22, train_loss: 0.6819, test_loss: 1.2850, test_f1: 0.5040
 epoch: 23, train_loss: 0.6630, test_loss: 1.3301, test_f1: 0.5030
 epoch: 24, train_loss: 0.6515, test_loss: 1.5946, test_f1: 0.5191
 epoch: 25, train_loss: 0.6559, test_loss: 1.5180, test_f1: 0.4978
 epoch: 26, train_loss: 0.6443, test_loss: 1.4710, test_f1: 0.5161
 epoch: 27, train_loss: 0.6427, test_loss: 1.3557, test_f1: 0.5232
 epoch: 28, train_loss: 0.6049, test_loss: 1.3804, test_f1: 0.5090
 epoch: 29, train_loss: 0.5663, test_loss: 1.7741, test_f1: 0.4691
 epoch: 30, train_loss: 0.5688, test_loss: 1.6546, test_f1: 0.5191
 epoch: 31, train_loss: 0.5826, test_loss: 1.5444, test_f1: 0.5168
 epoch: 32, train_loss: 0.5510, test_loss: 1.6597, test_f1: 0.5304
 epoch: 33, train_loss: 0.5338, test_loss: 1.6368, test_f1: 0.5032
 epoch: 34, train_loss: 0.5313, test_loss: 1.5910, test_f1: 0.5195
 epoch: 35, train_loss: 0.5054, test_loss: 1.7584, test_f1: 0.4689
 epoch: 36, train_loss: 0.5229, test_loss: 1.6599, test_f1: 0.4988
 epoch: 37, train_loss: 0.5120, test_loss: 1.6541, test_f1: 0.5220
 epoch: 38, train_loss: 0.5041, test_loss: 1.7714, test_f1: 0.5242
 epoch: 39, train_loss: 0.4946, test_loss: 1.7399, test_f1: 0.5179
 epoch: 40, train_loss: 0.4964, test_loss: 1.7155, test_f1: 0.5349
 epoch: 41, train_loss: 0.4722, test_loss: 1.6676, test_f1: 0.5496
 epoch: 42, train_loss: 0.4688, test_loss: 1.9492, test_f1: 0.5273
 epoch: 43, train_loss: 0.4906, test_loss: 1.6198, test_f1: 0.5343
 epoch: 44, train_loss: 0.4698, test_loss: 1.8603, test_f1: 0.5191
 epoch: 45, train_loss: 0.4609, test_loss: 1.7211, test_f1: 0.5307
 epoch: 46, train_loss: 0.4556, test_loss: 1.7092, test_f1: 0.5109
 epoch: 47, train_loss: 0.4296, test_loss: 2.0896, test_f1: 0.4800
 epoch: 48, train_loss: 0.4259, test_loss: 1.8683, test_f1: 0.5339
 epoch: 49, train_loss: 0.3973, test_loss: 1.9589, test_f1: 0.5236
 epoch: 50, train_loss: 0.3964, test_loss: 2.2662, test_f1: 0.4997
 epoch: 51, train_loss: 0.3694, test_loss: 1.8684, test_f1: 0.5448
 epoch: 52, train_loss: 0.3462, test_loss: 2.1701, test_f1: 0.5346
 epoch: 53, train_loss: 0.3268, test_loss: 2.2568, test_f1: 0.5138
 epoch: 54, train_loss: 0.3251, test_loss: 2.3304, test_f1: 0.5132
 epoch: 55, train_loss: 0.2978, test_loss: 2.3473, test_f1: 0.5045
 epoch: 56, train_loss: 0.2944, test_loss: 2.3396, test_f1: 0.5308
 epoch: 57, train_loss: 0.3010, test_loss: 2.3696, test_f1: 0.5246
 epoch: 58, train_loss: 0.2809, test_loss: 2.2566, test_f1: 0.5415
 epoch: 59, train_loss: 0.2825, test_loss: 2.4588, test_f1: 0.5149
 epoch: 60, train_loss: 0.2887, test_loss: 2.4276, test_f1: 0.5213
 epoch: 61, train_loss: 0.2882, test_loss: 2.5961, test_f1: 0.5300
 epoch: 62, train_loss: 0.2853, test_loss: 2.6336, test_f1: 0.5271
 epoch: 63, train_loss: 0.2716, test_loss: 2.6048, test_f1: 0.5176
 epoch: 64, train_loss: 0.2683, test_loss: 2.6307, test_f1: 0.5309
 epoch: 65, train_loss: 0.2595, test_loss: 2.5367, test_f1: 0.5252
 epoch: 66, train_loss: 0.2583, test_loss: 2.7853, test_f1: 0.5334
 epoch: 67, train_loss: 0.2625, test_loss: 2.8500, test_f1: 0.5173
 epoch: 68, train_loss: 0.2649, test_loss: 2.9312, test_f1: 0.5211
 epoch: 69, train_loss: 0.2660, test_loss: 2.6930, test_f1: 0.5038
 epoch: 70, train_loss: 0.2720, test_loss: 2.7756, test_f1: 0.5506
 epoch: 71, train_loss: 0.2590, test_loss: 2.7963, test_f1: 0.5269
 epoch: 72, train_loss: 0.2559, test_loss: 2.4296, test_f1: 0.5325
 epoch: 73, train_loss: 0.2524, test_loss: 2.8347, test_f1: 0.5200
 epoch: 74, train_loss: 0.2274, test_loss: 2.7327, test_f1: 0.5357
 epoch: 75, train_loss: 0.2228, test_loss: 2.8799, test_f1: 0.5247
 epoch: 76, train_loss: 0.2309, test_loss: 2.9603, test_f1: 0.5126
 epoch: 77, train_loss: 0.2447, test_loss: 2.7583, test_f1: 0.5202
 epoch: 78, train_loss: 0.2300, test_loss: 2.9216, test_f1: 0.5425
 epoch: 79, train_loss: 0.2281, test_loss: 2.9997, test_f1: 0.5467
 epoch: 80, train_loss: 0.2227, test_loss: 2.9143, test_f1: 0.5419
 epoch: 81, train_loss: 0.2334, test_loss: 2.8916, test_f1: 0.5457
 epoch: 82, train_loss: 0.2246, test_loss: 2.9124, test_f1: 0.5560
 epoch: 83, train_loss: 0.2202, test_loss: 2.9620, test_f1: 0.5324
 epoch: 84, train_loss: 0.2199, test_loss: 2.9404, test_f1: 0.5351
 epoch: 85, train_loss: 0.2299, test_loss: 2.9908, test_f1: 0.5414
 epoch: 86, train_loss: 0.2077, test_loss: 3.1087, test_f1: 0.5480
 epoch: 87, train_loss: 0.1991, test_loss: 3.4213, test_f1: 0.5275
 epoch: 88, train_loss: 0.2025, test_loss: 3.2224, test_f1: 0.5131
 epoch: 89, train_loss: 0.2010, test_loss: 3.3397, test_f1: 0.5233
 epoch: 90, train_loss: 0.1993, test_loss: 3.1128, test_f1: 0.5413
 epoch: 91, train_loss: 0.1871, test_loss: 3.2223, test_f1: 0.5386
 epoch: 92, train_loss: 0.1878, test_loss: 3.2864, test_f1: 0.5630
 epoch: 93, train_loss: 0.1876, test_loss: 3.0328, test_f1: 0.5532
 epoch: 94, train_loss: 0.1952, test_loss: 3.2383, test_f1: 0.5305
 epoch: 95, train_loss: 0.2109, test_loss: 3.3053, test_f1: 0.5459
 epoch: 96, train_loss: 0.1908, test_loss: 3.2565, test_f1: 0.5414
 epoch: 97, train_loss: 0.1857, test_loss: 3.2309, test_f1: 0.5272
 epoch: 98, train_loss: 0.1858, test_loss: 3.3535, test_f1: 0.5218
 epoch: 99, train_loss: 0.1780, test_loss: 3.5022, test_f1: 0.5251
##################ITERATION #1 ****************************************
 epoch: 0, train_loss: 1.2428, test_loss: 1.2580, test_f1: 0.2378
 epoch: 1, train_loss: 1.1055, test_loss: 1.1646, test_f1: 0.4107
 epoch: 2, train_loss: 1.0575, test_loss: 1.0471, test_f1: 0.4582
 epoch: 3, train_loss: 1.0212, test_loss: 0.9965, test_f1: 0.5073
 epoch: 4, train_loss: 0.9750, test_loss: 1.0121, test_f1: 0.4887
 epoch: 5, train_loss: 0.9429, test_loss: 1.0258, test_f1: 0.4812
 epoch: 6, train_loss: 0.8825, test_loss: 0.9945, test_f1: 0.5146
 epoch: 7, train_loss: 0.8618, test_loss: 0.9761, test_f1: 0.5110
 epoch: 8, train_loss: 0.8630, test_loss: 1.0289, test_f1: 0.5242
 epoch: 9, train_loss: 0.8412, test_loss: 0.9672, test_f1: 0.5125
 epoch: 10, train_loss: 0.8131, test_loss: 1.1746, test_f1: 0.4650
 epoch: 11, train_loss: 0.7899, test_loss: 1.0999, test_f1: 0.4960
 epoch: 12, train_loss: 0.7705, test_loss: 1.1287, test_f1: 0.4865
 epoch: 13, train_loss: 0.7786, test_loss: 1.1561, test_f1: 0.4747
 epoch: 14, train_loss: 0.7495, test_loss: 1.0850, test_f1: 0.5237
 epoch: 15, train_loss: 0.7058, test_loss: 1.1845, test_f1: 0.5205
 epoch: 16, train_loss: 0.7118, test_loss: 1.1952, test_f1: 0.5206
 epoch: 17, train_loss: 0.7073, test_loss: 1.3079, test_f1: 0.4936
 epoch: 18, train_loss: 0.7032, test_loss: 1.1904, test_f1: 0.5130
 epoch: 19, train_loss: 0.6879, test_loss: 1.3453, test_f1: 0.4740
 epoch: 20, train_loss: 0.6845, test_loss: 1.1076, test_f1: 0.5303
 epoch: 21, train_loss: 0.6193, test_loss: 1.2746, test_f1: 0.5177
 epoch: 22, train_loss: 0.6055, test_loss: 1.3036, test_f1: 0.5225
 epoch: 23, train_loss: 0.6004, test_loss: 1.3303, test_f1: 0.5063
 epoch: 24, train_loss: 0.5962, test_loss: 1.2146, test_f1: 0.5369
 epoch: 25, train_loss: 0.5636, test_loss: 1.3673, test_f1: 0.4810
 epoch: 26, train_loss: 0.5587, test_loss: 1.7151, test_f1: 0.4938
 epoch: 27, train_loss: 0.5599, test_loss: 1.5511, test_f1: 0.5045
 epoch: 28, train_loss: 0.5601, test_loss: 1.4093, test_f1: 0.5198
 epoch: 29, train_loss: 0.5106, test_loss: 1.5021, test_f1: 0.5540
 epoch: 30, train_loss: 0.5203, test_loss: 1.4571, test_f1: 0.5280
 epoch: 31, train_loss: 0.5015, test_loss: 1.7351, test_f1: 0.5195
 epoch: 32, train_loss: 0.4659, test_loss: 1.5817, test_f1: 0.5181
 epoch: 33, train_loss: 0.4932, test_loss: 1.5537, test_f1: 0.5208
 epoch: 34, train_loss: 0.4674, test_loss: 1.6149, test_f1: 0.5124
 epoch: 35, train_loss: 0.4795, test_loss: 1.7775, test_f1: 0.5166
 epoch: 36, train_loss: 0.4757, test_loss: 1.7453, test_f1: 0.5216
 epoch: 37, train_loss: 0.4547, test_loss: 1.5649, test_f1: 0.5137
 epoch: 38, train_loss: 0.4474, test_loss: 1.7826, test_f1: 0.5038
 epoch: 39, train_loss: 0.4275, test_loss: 1.8517, test_f1: 0.5366
 epoch: 40, train_loss: 0.4261, test_loss: 1.8660, test_f1: 0.4926
 epoch: 41, train_loss: 0.4260, test_loss: 1.8090, test_f1: 0.5224
 epoch: 42, train_loss: 0.4386, test_loss: 1.6420, test_f1: 0.5413
 epoch: 43, train_loss: 0.4188, test_loss: 1.6457, test_f1: 0.5194
 epoch: 44, train_loss: 0.3759, test_loss: 1.7957, test_f1: 0.5336
 epoch: 45, train_loss: 0.3863, test_loss: 1.9845, test_f1: 0.5115
 epoch: 46, train_loss: 0.4145, test_loss: 1.9035, test_f1: 0.5064
 epoch: 47, train_loss: 0.4124, test_loss: 1.8226, test_f1: 0.5167
 epoch: 48, train_loss: 0.3965, test_loss: 2.1923, test_f1: 0.4954
 epoch: 49, train_loss: 0.3662, test_loss: 1.8918, test_f1: 0.5210
 epoch: 50, train_loss: 0.3702, test_loss: 1.7598, test_f1: 0.5285
 epoch: 51, train_loss: 0.3242, test_loss: 2.0493, test_f1: 0.5157
 epoch: 52, train_loss: 0.2982, test_loss: 2.1127, test_f1: 0.5249
 epoch: 53, train_loss: 0.2778, test_loss: 2.1176, test_f1: 0.5306
 epoch: 54, train_loss: 0.2583, test_loss: 2.2011, test_f1: 0.5239
 epoch: 55, train_loss: 0.2573, test_loss: 2.3555, test_f1: 0.5144
 epoch: 56, train_loss: 0.2674, test_loss: 2.3786, test_f1: 0.5084
 epoch: 57, train_loss: 0.2575, test_loss: 2.5149, test_f1: 0.5155
 epoch: 58, train_loss: 0.2336, test_loss: 2.3584, test_f1: 0.4850
 epoch: 59, train_loss: 0.2378, test_loss: 2.5482, test_f1: 0.5047
 epoch: 60, train_loss: 0.2417, test_loss: 2.6632, test_f1: 0.5192
 epoch: 61, train_loss: 0.2309, test_loss: 2.4898, test_f1: 0.5102
 epoch: 62, train_loss: 0.2293, test_loss: 2.5208, test_f1: 0.5299
 epoch: 63, train_loss: 0.2449, test_loss: 2.6946, test_f1: 0.5158
 epoch: 64, train_loss: 0.2458, test_loss: 2.4530, test_f1: 0.5233
 epoch: 65, train_loss: 0.2564, test_loss: 2.7503, test_f1: 0.5175
 epoch: 66, train_loss: 0.2474, test_loss: 2.4331, test_f1: 0.5190
 epoch: 67, train_loss: 0.2230, test_loss: 2.6254, test_f1: 0.5119
 epoch: 68, train_loss: 0.2162, test_loss: 2.5297, test_f1: 0.5170
 epoch: 69, train_loss: 0.2229, test_loss: 2.6035, test_f1: 0.5314
 epoch: 70, train_loss: 0.2081, test_loss: 2.6585, test_f1: 0.4961
 epoch: 71, train_loss: 0.2320, test_loss: 2.9077, test_f1: 0.4963
 epoch: 72, train_loss: 0.2382, test_loss: 2.4309, test_f1: 0.5119
 epoch: 73, train_loss: 0.2319, test_loss: 2.5361, test_f1: 0.5364
 epoch: 74, train_loss: 0.1920, test_loss: 2.5390, test_f1: 0.5260
 epoch: 75, train_loss: 0.2105, test_loss: 2.7598, test_f1: 0.4983
 epoch: 76, train_loss: 0.1927, test_loss: 2.6585, test_f1: 0.5273
 epoch: 77, train_loss: 0.1966, test_loss: 2.6690, test_f1: 0.5269
 epoch: 78, train_loss: 0.1905, test_loss: 2.9781, test_f1: 0.5069
 epoch: 79, train_loss: 0.1796, test_loss: 2.8407, test_f1: 0.5018
 epoch: 80, train_loss: 0.1949, test_loss: 2.8660, test_f1: 0.5144
 epoch: 81, train_loss: 0.2069, test_loss: 2.6372, test_f1: 0.5194
 epoch: 82, train_loss: 0.2051, test_loss: 3.0747, test_f1: 0.5255
 epoch: 83, train_loss: 0.1920, test_loss: 2.8319, test_f1: 0.5252
 epoch: 84, train_loss: 0.1798, test_loss: 2.7731, test_f1: 0.5301
 epoch: 85, train_loss: 0.1842, test_loss: 2.9244, test_f1: 0.5103
 epoch: 86, train_loss: 0.1756, test_loss: 2.7430, test_f1: 0.5527
 epoch: 87, train_loss: 0.1662, test_loss: 2.7513, test_f1: 0.5113
 epoch: 88, train_loss: 0.1756, test_loss: 3.0430, test_f1: 0.5136
 epoch: 89, train_loss: 0.1639, test_loss: 2.9680, test_f1: 0.5124
 epoch: 90, train_loss: 0.1588, test_loss: 2.9628, test_f1: 0.5244
 epoch: 91, train_loss: 0.1646, test_loss: 3.0546, test_f1: 0.5277
 epoch: 92, train_loss: 0.1580, test_loss: 3.2852, test_f1: 0.5013
 epoch: 93, train_loss: 0.1755, test_loss: 3.3065, test_f1: 0.5219
 epoch: 94, train_loss: 0.1796, test_loss: 3.1197, test_f1: 0.5224
 epoch: 95, train_loss: 0.1629, test_loss: 3.3102, test_f1: 0.4957
 epoch: 96, train_loss: 0.1726, test_loss: 3.3502, test_f1: 0.5183
 epoch: 97, train_loss: 0.1694, test_loss: 3.1801, test_f1: 0.5182
 epoch: 98, train_loss: 0.1630, test_loss: 3.0970, test_f1: 0.5211
 epoch: 99, train_loss: 0.1620, test_loss: 3.0662, test_f1: 0.5197
##################ITERATION #2 ****************************************
 epoch: 0, train_loss: 1.2627, test_loss: 1.2463, test_f1: 0.3288
 epoch: 1, train_loss: 1.1426, test_loss: 1.1706, test_f1: 0.3769
 epoch: 2, train_loss: 1.0699, test_loss: 1.1302, test_f1: 0.3841
 epoch: 3, train_loss: 1.0312, test_loss: 1.0693, test_f1: 0.4334
 epoch: 4, train_loss: 0.9786, test_loss: 1.0021, test_f1: 0.4671
 epoch: 5, train_loss: 0.9662, test_loss: 1.0541, test_f1: 0.4527
 epoch: 6, train_loss: 0.9251, test_loss: 1.0135, test_f1: 0.5193
 epoch: 7, train_loss: 0.9021, test_loss: 1.0015, test_f1: 0.5030
 epoch: 8, train_loss: 0.8897, test_loss: 1.0718, test_f1: 0.4625
 epoch: 9, train_loss: 0.8762, test_loss: 0.9672, test_f1: 0.5039
 epoch: 10, train_loss: 0.8559, test_loss: 1.0400, test_f1: 0.5130
 epoch: 11, train_loss: 0.8261, test_loss: 0.9994, test_f1: 0.5110
 epoch: 12, train_loss: 0.7924, test_loss: 1.0568, test_f1: 0.5174
 epoch: 13, train_loss: 0.8121, test_loss: 1.0912, test_f1: 0.5085
 epoch: 14, train_loss: 0.7940, test_loss: 1.0463, test_f1: 0.5011
 epoch: 15, train_loss: 0.7612, test_loss: 1.1416, test_f1: 0.5311
 epoch: 16, train_loss: 0.7530, test_loss: 1.1187, test_f1: 0.4847
 epoch: 17, train_loss: 0.7586, test_loss: 1.1360, test_f1: 0.5021
 epoch: 18, train_loss: 0.7400, test_loss: 1.0849, test_f1: 0.5408
 epoch: 19, train_loss: 0.7184, test_loss: 1.2527, test_f1: 0.5062
 epoch: 20, train_loss: 0.6907, test_loss: 1.1406, test_f1: 0.5171
 epoch: 21, train_loss: 0.6885, test_loss: 1.3569, test_f1: 0.4635
 epoch: 22, train_loss: 0.6898, test_loss: 1.3651, test_f1: 0.5217
 epoch: 23, train_loss: 0.6651, test_loss: 1.1767, test_f1: 0.5369
 epoch: 24, train_loss: 0.6421, test_loss: 1.3898, test_f1: 0.5041
 epoch: 25, train_loss: 0.6386, test_loss: 1.2619, test_f1: 0.5247
 epoch: 26, train_loss: 0.6404, test_loss: 1.4315, test_f1: 0.4758
 epoch: 27, train_loss: 0.6186, test_loss: 1.1598, test_f1: 0.5501
 epoch: 28, train_loss: 0.6025, test_loss: 1.3087, test_f1: 0.4895
 epoch: 29, train_loss: 0.5892, test_loss: 1.3302, test_f1: 0.5228
 epoch: 30, train_loss: 0.5912, test_loss: 1.5399, test_f1: 0.5122
 epoch: 31, train_loss: 0.5772, test_loss: 1.4142, test_f1: 0.5136
 epoch: 32, train_loss: 0.5742, test_loss: 1.3802, test_f1: 0.5353
 epoch: 33, train_loss: 0.5546, test_loss: 1.4365, test_f1: 0.4987
 epoch: 34, train_loss: 0.5625, test_loss: 1.4531, test_f1: 0.5175
 epoch: 35, train_loss: 0.5291, test_loss: 1.3748, test_f1: 0.5645
 epoch: 36, train_loss: 0.5202, test_loss: 1.7809, test_f1: 0.4915
 epoch: 37, train_loss: 0.5284, test_loss: 1.4196, test_f1: 0.5528
 epoch: 38, train_loss: 0.5661, test_loss: 1.6200, test_f1: 0.4975
 epoch: 39, train_loss: 0.5506, test_loss: 1.5558, test_f1: 0.5201
 epoch: 40, train_loss: 0.5343, test_loss: 1.3931, test_f1: 0.5245
 epoch: 41, train_loss: 0.4907, test_loss: 1.5085, test_f1: 0.5235
 epoch: 42, train_loss: 0.4562, test_loss: 1.6471, test_f1: 0.5227
 epoch: 43, train_loss: 0.4529, test_loss: 1.7005, test_f1: 0.5071
 epoch: 44, train_loss: 0.4845, test_loss: 1.8836, test_f1: 0.4963
 epoch: 45, train_loss: 0.4756, test_loss: 1.5263, test_f1: 0.5578
 epoch: 46, train_loss: 0.4740, test_loss: 1.6183, test_f1: 0.5525
 epoch: 47, train_loss: 0.4599, test_loss: 1.7290, test_f1: 0.5318
 epoch: 48, train_loss: 0.4737, test_loss: 1.8225, test_f1: 0.5257
 epoch: 49, train_loss: 0.4578, test_loss: 1.6754, test_f1: 0.5415
 epoch: 50, train_loss: 0.4292, test_loss: 1.8769, test_f1: 0.5149
 epoch: 51, train_loss: 0.4064, test_loss: 1.6562, test_f1: 0.5628
 epoch: 52, train_loss: 0.3784, test_loss: 1.7727, test_f1: 0.5606
 epoch: 53, train_loss: 0.3692, test_loss: 1.8829, test_f1: 0.5479
 epoch: 54, train_loss: 0.3413, test_loss: 1.8776, test_f1: 0.5333
 epoch: 55, train_loss: 0.3268, test_loss: 2.0302, test_f1: 0.5399
 epoch: 56, train_loss: 0.3238, test_loss: 2.2558, test_f1: 0.5238
 epoch: 57, train_loss: 0.3367, test_loss: 2.3799, test_f1: 0.5103
 epoch: 58, train_loss: 0.3104, test_loss: 2.0117, test_f1: 0.5503
 epoch: 59, train_loss: 0.3122, test_loss: 2.1605, test_f1: 0.5447
 epoch: 60, train_loss: 0.3019, test_loss: 2.1337, test_f1: 0.5362
 epoch: 61, train_loss: 0.2903, test_loss: 2.1493, test_f1: 0.5386
 epoch: 62, train_loss: 0.2846, test_loss: 2.2948, test_f1: 0.5491
 epoch: 63, train_loss: 0.2984, test_loss: 2.1811, test_f1: 0.5311
 epoch: 64, train_loss: 0.2837, test_loss: 2.1923, test_f1: 0.5499
 epoch: 65, train_loss: 0.2696, test_loss: 2.3871, test_f1: 0.5306
 epoch: 66, train_loss: 0.2622, test_loss: 2.3525, test_f1: 0.5351
 epoch: 67, train_loss: 0.2769, test_loss: 2.3063, test_f1: 0.5328
 epoch: 68, train_loss: 0.2766, test_loss: 2.5020, test_f1: 0.5221
 epoch: 69, train_loss: 0.2909, test_loss: 2.4192, test_f1: 0.5215
 epoch: 70, train_loss: 0.2690, test_loss: 2.2109, test_f1: 0.5637
 epoch: 71, train_loss: 0.2720, test_loss: 2.7033, test_f1: 0.5153
 epoch: 72, train_loss: 0.2728, test_loss: 2.5591, test_f1: 0.5294
 epoch: 73, train_loss: 0.2533, test_loss: 2.3717, test_f1: 0.5371
 epoch: 74, train_loss: 0.2451, test_loss: 2.6536, test_f1: 0.5220
 epoch: 75, train_loss: 0.2483, test_loss: 2.3244, test_f1: 0.5473
 epoch: 76, train_loss: 0.2484, test_loss: 2.6399, test_f1: 0.5086
 epoch: 77, train_loss: 0.2748, test_loss: 2.6021, test_f1: 0.5313
 epoch: 78, train_loss: 0.2879, test_loss: 2.2587, test_f1: 0.5478
 epoch: 79, train_loss: 0.2740, test_loss: 2.8785, test_f1: 0.5126
 epoch: 80, train_loss: 0.2575, test_loss: 2.5472, test_f1: 0.5421
 epoch: 81, train_loss: 0.2562, test_loss: 2.5074, test_f1: 0.5263
 epoch: 82, train_loss: 0.2639, test_loss: 2.7162, test_f1: 0.5189
 epoch: 83, train_loss: 0.2374, test_loss: 2.5959, test_f1: 0.5272
 epoch: 84, train_loss: 0.2440, test_loss: 2.6898, test_f1: 0.5346
 epoch: 85, train_loss: 0.2407, test_loss: 2.5205, test_f1: 0.5421
 epoch: 86, train_loss: 0.2470, test_loss: 2.5296, test_f1: 0.5423
 epoch: 87, train_loss: 0.2302, test_loss: 2.5627, test_f1: 0.5498
 epoch: 88, train_loss: 0.2293, test_loss: 2.5308, test_f1: 0.5364
 epoch: 89, train_loss: 0.2215, test_loss: 2.9462, test_f1: 0.5362
 epoch: 90, train_loss: 0.2130, test_loss: 2.6253, test_f1: 0.5415
 epoch: 91, train_loss: 0.2089, test_loss: 2.8473, test_f1: 0.5238
 epoch: 92, train_loss: 0.2075, test_loss: 2.9716, test_f1: 0.5375
 epoch: 93, train_loss: 0.2083, test_loss: 2.8868, test_f1: 0.5301
 epoch: 94, train_loss: 0.1988, test_loss: 2.9729, test_f1: 0.5275
 epoch: 95, train_loss: 0.2048, test_loss: 3.0748, test_f1: 0.5172
 epoch: 96, train_loss: 0.2238, test_loss: 2.8882, test_f1: 0.5381
 epoch: 97, train_loss: 0.2403, test_loss: 3.1990, test_f1: 0.5272
 epoch: 98, train_loss: 0.2466, test_loss: 2.8496, test_f1: 0.5432
 epoch: 99, train_loss: 0.2181, test_loss: 2.8883, test_f1: 0.5315
##################ITERATION #3 ****************************************
 epoch: 0, train_loss: 1.3042, test_loss: 1.2729, test_f1: 0.3964
 epoch: 1, train_loss: 1.1418, test_loss: 1.1782, test_f1: 0.3954
 epoch: 2, train_loss: 1.0918, test_loss: 1.1145, test_f1: 0.4167
 epoch: 3, train_loss: 1.0414, test_loss: 1.0527, test_f1: 0.4792
 epoch: 4, train_loss: 1.0086, test_loss: 1.0398, test_f1: 0.4705
 epoch: 5, train_loss: 0.9634, test_loss: 1.0478, test_f1: 0.4885
 epoch: 6, train_loss: 0.9281, test_loss: 1.0267, test_f1: 0.4789
 epoch: 7, train_loss: 0.9026, test_loss: 1.0662, test_f1: 0.4747
 epoch: 8, train_loss: 0.8889, test_loss: 1.0316, test_f1: 0.5022
 epoch: 9, train_loss: 0.8561, test_loss: 1.0236, test_f1: 0.5039
 epoch: 10, train_loss: 0.8450, test_loss: 1.0541, test_f1: 0.4990
 epoch: 11, train_loss: 0.8117, test_loss: 1.0227, test_f1: 0.5289
 epoch: 12, train_loss: 0.7827, test_loss: 1.1071, test_f1: 0.5059
 epoch: 13, train_loss: 0.7676, test_loss: 1.1595, test_f1: 0.4892
 epoch: 14, train_loss: 0.7590, test_loss: 1.2242, test_f1: 0.4726
 epoch: 15, train_loss: 0.7351, test_loss: 1.3431, test_f1: 0.4863
 epoch: 16, train_loss: 0.7274, test_loss: 1.2070, test_f1: 0.5219
 epoch: 17, train_loss: 0.7258, test_loss: 1.1273, test_f1: 0.5312
 epoch: 18, train_loss: 0.6906, test_loss: 1.3861, test_f1: 0.4719
 epoch: 19, train_loss: 0.6899, test_loss: 1.2785, test_f1: 0.5059
 epoch: 20, train_loss: 0.6905, test_loss: 1.2272, test_f1: 0.5208
 epoch: 21, train_loss: 0.6661, test_loss: 1.3000, test_f1: 0.5109
 epoch: 22, train_loss: 0.6282, test_loss: 1.3604, test_f1: 0.5482
 epoch: 23, train_loss: 0.6351, test_loss: 1.2795, test_f1: 0.5372
 epoch: 24, train_loss: 0.6218, test_loss: 1.2698, test_f1: 0.5197
 epoch: 25, train_loss: 0.6240, test_loss: 1.3274, test_f1: 0.5479
 epoch: 26, train_loss: 0.6105, test_loss: 1.3797, test_f1: 0.5408
 epoch: 27, train_loss: 0.5832, test_loss: 1.4465, test_f1: 0.4948
 epoch: 28, train_loss: 0.5774, test_loss: 1.5057, test_f1: 0.5265
 epoch: 29, train_loss: 0.5376, test_loss: 1.4862, test_f1: 0.5493
 epoch: 30, train_loss: 0.5569, test_loss: 1.4167, test_f1: 0.5266
 epoch: 31, train_loss: 0.5288, test_loss: 1.4657, test_f1: 0.5381
 epoch: 32, train_loss: 0.5214, test_loss: 1.4842, test_f1: 0.5337
 epoch: 33, train_loss: 0.4988, test_loss: 1.5250, test_f1: 0.5490
 epoch: 34, train_loss: 0.4845, test_loss: 1.6733, test_f1: 0.5481
 epoch: 35, train_loss: 0.4936, test_loss: 1.5564, test_f1: 0.5385
 epoch: 36, train_loss: 0.4853, test_loss: 1.7617, test_f1: 0.4951
 epoch: 37, train_loss: 0.4929, test_loss: 1.6584, test_f1: 0.5191
 epoch: 38, train_loss: 0.4877, test_loss: 1.7748, test_f1: 0.5181
 epoch: 39, train_loss: 0.4593, test_loss: 1.6123, test_f1: 0.5469
 epoch: 40, train_loss: 0.4620, test_loss: 1.8154, test_f1: 0.5209
 epoch: 41, train_loss: 0.4571, test_loss: 1.8099, test_f1: 0.5316
 epoch: 42, train_loss: 0.4377, test_loss: 1.6737, test_f1: 0.5357
 epoch: 43, train_loss: 0.4276, test_loss: 1.8187, test_f1: 0.5218
 epoch: 44, train_loss: 0.4289, test_loss: 1.6545, test_f1: 0.5494
 epoch: 45, train_loss: 0.4087, test_loss: 1.8548, test_f1: 0.5146
 epoch: 46, train_loss: 0.4086, test_loss: 1.9385, test_f1: 0.5249
 epoch: 47, train_loss: 0.4103, test_loss: 1.8855, test_f1: 0.5170
 epoch: 48, train_loss: 0.3777, test_loss: 1.8856, test_f1: 0.5355
 epoch: 49, train_loss: 0.3786, test_loss: 2.3174, test_f1: 0.5089
 epoch: 50, train_loss: 0.3921, test_loss: 2.1083, test_f1: 0.5224
 epoch: 51, train_loss: 0.3488, test_loss: 2.0043, test_f1: 0.5227
 epoch: 52, train_loss: 0.3030, test_loss: 2.1612, test_f1: 0.5232
 epoch: 53, train_loss: 0.2790, test_loss: 2.3135, test_f1: 0.5327
 epoch: 54, train_loss: 0.2770, test_loss: 2.4923, test_f1: 0.5130
 epoch: 55, train_loss: 0.2652, test_loss: 2.4775, test_f1: 0.5513
 epoch: 56, train_loss: 0.2778, test_loss: 2.4980, test_f1: 0.5250
 epoch: 57, train_loss: 0.2583, test_loss: 2.4751, test_f1: 0.5416
 epoch: 58, train_loss: 0.2711, test_loss: 2.4652, test_f1: 0.5319
 epoch: 59, train_loss: 0.2483, test_loss: 2.6471, test_f1: 0.5172
 epoch: 60, train_loss: 0.2645, test_loss: 2.4865, test_f1: 0.5286
 epoch: 61, train_loss: 0.2553, test_loss: 2.6503, test_f1: 0.5398
 epoch: 62, train_loss: 0.2619, test_loss: 2.6340, test_f1: 0.5066
 epoch: 63, train_loss: 0.2404, test_loss: 2.7494, test_f1: 0.5530
 epoch: 64, train_loss: 0.2562, test_loss: 2.4908, test_f1: 0.5226
 epoch: 65, train_loss: 0.2477, test_loss: 2.5618, test_f1: 0.5461
 epoch: 66, train_loss: 0.2522, test_loss: 2.6937, test_f1: 0.5386
 epoch: 67, train_loss: 0.2433, test_loss: 2.8455, test_f1: 0.5062
 epoch: 68, train_loss: 0.2251, test_loss: 2.6199, test_f1: 0.5340
 epoch: 69, train_loss: 0.2271, test_loss: 2.7958, test_f1: 0.5229
 epoch: 70, train_loss: 0.2309, test_loss: 2.6426, test_f1: 0.5571
 epoch: 71, train_loss: 0.2359, test_loss: 2.6330, test_f1: 0.5554
 epoch: 72, train_loss: 0.2307, test_loss: 2.4382, test_f1: 0.5510
 epoch: 73, train_loss: 0.2093, test_loss: 2.9698, test_f1: 0.5363
 epoch: 74, train_loss: 0.2021, test_loss: 2.7833, test_f1: 0.5374
 epoch: 75, train_loss: 0.2136, test_loss: 2.7217, test_f1: 0.5357
 epoch: 76, train_loss: 0.2310, test_loss: 2.6602, test_f1: 0.5353
 epoch: 77, train_loss: 0.2211, test_loss: 2.6431, test_f1: 0.5363
 epoch: 78, train_loss: 0.2037, test_loss: 2.8402, test_f1: 0.5333
 epoch: 79, train_loss: 0.2266, test_loss: 2.9440, test_f1: 0.5246
 epoch: 80, train_loss: 0.2247, test_loss: 2.7891, test_f1: 0.5268
 epoch: 81, train_loss: 0.2346, test_loss: 2.8338, test_f1: 0.5355
 epoch: 82, train_loss: 0.2108, test_loss: 2.8752, test_f1: 0.5329
 epoch: 83, train_loss: 0.2334, test_loss: 2.8765, test_f1: 0.5392
 epoch: 84, train_loss: 0.2282, test_loss: 2.7839, test_f1: 0.5386
 epoch: 85, train_loss: 0.1961, test_loss: 2.8067, test_f1: 0.5230
 epoch: 86, train_loss: 0.1849, test_loss: 2.9157, test_f1: 0.5365
 epoch: 87, train_loss: 0.1968, test_loss: 3.0139, test_f1: 0.5243
 epoch: 88, train_loss: 0.1808, test_loss: 3.0609, test_f1: 0.5371
 epoch: 89, train_loss: 0.1713, test_loss: 3.0574, test_f1: 0.5386
 epoch: 90, train_loss: 0.1767, test_loss: 3.3324, test_f1: 0.5098
 epoch: 91, train_loss: 0.1670, test_loss: 3.1313, test_f1: 0.5384
 epoch: 92, train_loss: 0.1843, test_loss: 3.0695, test_f1: 0.5349
 epoch: 93, train_loss: 0.1672, test_loss: 3.2468, test_f1: 0.5084
 epoch: 94, train_loss: 0.1772, test_loss: 3.0101, test_f1: 0.5583
 epoch: 95, train_loss: 0.1704, test_loss: 3.1446, test_f1: 0.5293
 epoch: 96, train_loss: 0.1768, test_loss: 3.3074, test_f1: 0.5328
 epoch: 97, train_loss: 0.1732, test_loss: 3.2201, test_f1: 0.5306
 epoch: 98, train_loss: 0.1785, test_loss: 3.1092, test_f1: 0.5412
 epoch: 99, train_loss: 0.1912, test_loss: 3.1392, test_f1: 0.5458
##################ITERATION #4 ****************************************
 epoch: 0, train_loss: 1.3302, test_loss: 1.2825, test_f1: 0.4118
 epoch: 1, train_loss: 1.1898, test_loss: 1.1611, test_f1: 0.4932
 epoch: 2, train_loss: 1.1097, test_loss: 1.0728, test_f1: 0.4776
 epoch: 3, train_loss: 1.0466, test_loss: 1.0323, test_f1: 0.5354
 epoch: 4, train_loss: 1.0168, test_loss: 1.0345, test_f1: 0.4788
 epoch: 5, train_loss: 0.9880, test_loss: 1.0575, test_f1: 0.4697
 epoch: 6, train_loss: 0.9580, test_loss: 0.9727, test_f1: 0.5136
 epoch: 7, train_loss: 0.9241, test_loss: 1.0056, test_f1: 0.4790
 epoch: 8, train_loss: 0.8998, test_loss: 1.0653, test_f1: 0.4941
 epoch: 9, train_loss: 0.8705, test_loss: 1.0572, test_f1: 0.5187
 epoch: 10, train_loss: 0.8530, test_loss: 1.0493, test_f1: 0.5264
 epoch: 11, train_loss: 0.8278, test_loss: 1.0164, test_f1: 0.5331
 epoch: 12, train_loss: 0.8301, test_loss: 1.1230, test_f1: 0.5279
 epoch: 13, train_loss: 0.8022, test_loss: 1.0322, test_f1: 0.5684
 epoch: 14, train_loss: 0.7608, test_loss: 1.1581, test_f1: 0.5033
 epoch: 15, train_loss: 0.7572, test_loss: 1.1778, test_f1: 0.5237
 epoch: 16, train_loss: 0.7515, test_loss: 1.2116, test_f1: 0.5073
 epoch: 17, train_loss: 0.7349, test_loss: 1.2269, test_f1: 0.5390
 epoch: 18, train_loss: 0.7304, test_loss: 1.0687, test_f1: 0.5341
 epoch: 19, train_loss: 0.7161, test_loss: 1.2588, test_f1: 0.5070
 epoch: 20, train_loss: 0.7024, test_loss: 1.2432, test_f1: 0.4937
 epoch: 21, train_loss: 0.7069, test_loss: 1.1700, test_f1: 0.5413
 epoch: 22, train_loss: 0.6661, test_loss: 1.4328, test_f1: 0.4720
 epoch: 23, train_loss: 0.6472, test_loss: 1.2923, test_f1: 0.5494
 epoch: 24, train_loss: 0.6342, test_loss: 1.4108, test_f1: 0.5094
 epoch: 25, train_loss: 0.6294, test_loss: 1.4334, test_f1: 0.5290
 epoch: 26, train_loss: 0.6175, test_loss: 1.3765, test_f1: 0.5399
 epoch: 27, train_loss: 0.6069, test_loss: 1.5147, test_f1: 0.5205
 epoch: 28, train_loss: 0.5971, test_loss: 1.3120, test_f1: 0.5374
 epoch: 29, train_loss: 0.5936, test_loss: 1.2833, test_f1: 0.5729
 epoch: 30, train_loss: 0.5808, test_loss: 1.6083, test_f1: 0.5222
 epoch: 31, train_loss: 0.5536, test_loss: 1.6811, test_f1: 0.4762
 epoch: 32, train_loss: 0.6051, test_loss: 1.3452, test_f1: 0.5442
 epoch: 33, train_loss: 0.5507, test_loss: 1.6028, test_f1: 0.5182
 epoch: 34, train_loss: 0.5392, test_loss: 1.6400, test_f1: 0.5353
 epoch: 35, train_loss: 0.5334, test_loss: 1.5615, test_f1: 0.5176
 epoch: 36, train_loss: 0.5239, test_loss: 1.3948, test_f1: 0.5361
 epoch: 37, train_loss: 0.5291, test_loss: 1.6858, test_f1: 0.5071
 epoch: 38, train_loss: 0.5235, test_loss: 1.6407, test_f1: 0.5120
 epoch: 39, train_loss: 0.5154, test_loss: 1.6899, test_f1: 0.5518
 epoch: 40, train_loss: 0.5024, test_loss: 1.7165, test_f1: 0.5084
 epoch: 41, train_loss: 0.4811, test_loss: 1.5755, test_f1: 0.5340
 epoch: 42, train_loss: 0.4636, test_loss: 1.8929, test_f1: 0.5093
 epoch: 43, train_loss: 0.4662, test_loss: 1.9078, test_f1: 0.5244
 epoch: 44, train_loss: 0.4702, test_loss: 1.9061, test_f1: 0.5145
 epoch: 45, train_loss: 0.4807, test_loss: 1.8272, test_f1: 0.5349
 epoch: 46, train_loss: 0.5002, test_loss: 1.5818, test_f1: 0.5653
 epoch: 47, train_loss: 0.5146, test_loss: 1.6904, test_f1: 0.5011
 epoch: 48, train_loss: 0.4995, test_loss: 1.8817, test_f1: 0.5106
 epoch: 49, train_loss: 0.4704, test_loss: 1.8312, test_f1: 0.5417
 epoch: 50, train_loss: 0.4455, test_loss: 1.5393, test_f1: 0.5362
 epoch: 51, train_loss: 0.4068, test_loss: 1.6741, test_f1: 0.5539
 epoch: 52, train_loss: 0.3684, test_loss: 1.7823, test_f1: 0.5501
 epoch: 53, train_loss: 0.3524, test_loss: 1.9340, test_f1: 0.5427
 epoch: 54, train_loss: 0.3584, test_loss: 1.8215, test_f1: 0.5370
 epoch: 55, train_loss: 0.3461, test_loss: 1.9751, test_f1: 0.5292
 epoch: 56, train_loss: 0.3476, test_loss: 2.0538, test_f1: 0.5390
 epoch: 57, train_loss: 0.3315, test_loss: 2.0567, test_f1: 0.5318
 epoch: 58, train_loss: 0.3109, test_loss: 2.0836, test_f1: 0.5229
 epoch: 59, train_loss: 0.3200, test_loss: 2.1889, test_f1: 0.5171
 epoch: 60, train_loss: 0.3267, test_loss: 2.2416, test_f1: 0.4946
 epoch: 61, train_loss: 0.3270, test_loss: 2.1814, test_f1: 0.5358
 epoch: 62, train_loss: 0.3279, test_loss: 2.1631, test_f1: 0.5133
 epoch: 63, train_loss: 0.3381, test_loss: 2.3651, test_f1: 0.5030
 epoch: 64, train_loss: 0.3241, test_loss: 2.1253, test_f1: 0.5002
 epoch: 65, train_loss: 0.2974, test_loss: 2.3997, test_f1: 0.5222
 epoch: 66, train_loss: 0.3060, test_loss: 2.3214, test_f1: 0.5393
 epoch: 67, train_loss: 0.3048, test_loss: 2.2951, test_f1: 0.5345
 epoch: 68, train_loss: 0.2963, test_loss: 2.3485, test_f1: 0.5517
 epoch: 69, train_loss: 0.2920, test_loss: 2.5406, test_f1: 0.5243
 epoch: 70, train_loss: 0.2918, test_loss: 2.4787, test_f1: 0.5495
 epoch: 71, train_loss: 0.2803, test_loss: 2.5374, test_f1: 0.5247
 epoch: 72, train_loss: 0.2804, test_loss: 2.3509, test_f1: 0.5374
 epoch: 73, train_loss: 0.2572, test_loss: 2.4519, test_f1: 0.5102
 epoch: 74, train_loss: 0.2589, test_loss: 2.4056, test_f1: 0.5557
 epoch: 75, train_loss: 0.2675, test_loss: 2.5716, test_f1: 0.5343
 epoch: 76, train_loss: 0.2780, test_loss: 2.6685, test_f1: 0.5458
 epoch: 77, train_loss: 0.3047, test_loss: 2.5056, test_f1: 0.5185
 epoch: 78, train_loss: 0.2882, test_loss: 2.4008, test_f1: 0.5160
 epoch: 79, train_loss: 0.2713, test_loss: 2.2030, test_f1: 0.5427
 epoch: 80, train_loss: 0.2468, test_loss: 2.7228, test_f1: 0.5267
 epoch: 81, train_loss: 0.2481, test_loss: 2.7289, test_f1: 0.5208
 epoch: 82, train_loss: 0.2538, test_loss: 2.7326, test_f1: 0.5412
 epoch: 83, train_loss: 0.2509, test_loss: 2.7353, test_f1: 0.5281
 epoch: 84, train_loss: 0.2448, test_loss: 2.5336, test_f1: 0.5167
 epoch: 85, train_loss: 0.2521, test_loss: 2.8434, test_f1: 0.5335
 epoch: 86, train_loss: 0.2389, test_loss: 2.7908, test_f1: 0.5293
 epoch: 87, train_loss: 0.2526, test_loss: 2.4866, test_f1: 0.5365
 epoch: 88, train_loss: 0.2315, test_loss: 2.7195, test_f1: 0.5251
 epoch: 89, train_loss: 0.2357, test_loss: 2.8605, test_f1: 0.5576
 epoch: 90, train_loss: 0.2146, test_loss: 2.7849, test_f1: 0.5222
 epoch: 91, train_loss: 0.2399, test_loss: 2.8637, test_f1: 0.5306
 epoch: 92, train_loss: 0.2542, test_loss: 2.6387, test_f1: 0.5512
 epoch: 93, train_loss: 0.2455, test_loss: 2.4111, test_f1: 0.5320
 epoch: 94, train_loss: 0.2509, test_loss: 2.6394, test_f1: 0.5340
 epoch: 95, train_loss: 0.2484, test_loss: 2.6401, test_f1: 0.5298
 epoch: 96, train_loss: 0.2251, test_loss: 2.7300, test_f1: 0.5061
 epoch: 97, train_loss: 0.2129, test_loss: 2.6779, test_f1: 0.5357
 epoch: 98, train_loss: 0.2061, test_loss: 2.8274, test_f1: 0.5363
 epoch: 99, train_loss: 0.2137, test_loss: 2.7626, test_f1: 0.5261
##################ITERATION #5 ****************************************
 epoch: 0, train_loss: 1.3922, test_loss: 1.3085, test_f1: 0.3137
 epoch: 1, train_loss: 1.2174, test_loss: 1.2313, test_f1: 0.3693
 epoch: 2, train_loss: 1.1502, test_loss: 1.1384, test_f1: 0.3997
 epoch: 3, train_loss: 1.0848, test_loss: 1.1049, test_f1: 0.4583
 epoch: 4, train_loss: 1.0480, test_loss: 1.0344, test_f1: 0.4705
 epoch: 5, train_loss: 1.0182, test_loss: 1.0159, test_f1: 0.4697
 epoch: 6, train_loss: 0.9791, test_loss: 1.0260, test_f1: 0.4728
 epoch: 7, train_loss: 0.9598, test_loss: 0.9760, test_f1: 0.5094
 epoch: 8, train_loss: 0.9228, test_loss: 1.0317, test_f1: 0.4909
 epoch: 9, train_loss: 0.8957, test_loss: 1.0126, test_f1: 0.4961
 epoch: 10, train_loss: 0.8737, test_loss: 1.0291, test_f1: 0.5030
 epoch: 11, train_loss: 0.8675, test_loss: 1.0322, test_f1: 0.4951
 epoch: 12, train_loss: 0.8421, test_loss: 1.1503, test_f1: 0.5036
 epoch: 13, train_loss: 0.8241, test_loss: 1.0295, test_f1: 0.5186
 epoch: 14, train_loss: 0.8129, test_loss: 1.0489, test_f1: 0.5082
 epoch: 15, train_loss: 0.7839, test_loss: 1.0763, test_f1: 0.5234
 epoch: 16, train_loss: 0.7587, test_loss: 1.0555, test_f1: 0.5428
 epoch: 17, train_loss: 0.7415, test_loss: 1.2230, test_f1: 0.5080
 epoch: 18, train_loss: 0.7391, test_loss: 1.1289, test_f1: 0.5431
 epoch: 19, train_loss: 0.7212, test_loss: 1.1804, test_f1: 0.5276
 epoch: 20, train_loss: 0.7026, test_loss: 1.1419, test_f1: 0.5575
 epoch: 21, train_loss: 0.7026, test_loss: 1.2749, test_f1: 0.5294
 epoch: 22, train_loss: 0.6744, test_loss: 1.1740, test_f1: 0.5038
 epoch: 23, train_loss: 0.6552, test_loss: 1.1729, test_f1: 0.5482
 epoch: 24, train_loss: 0.6454, test_loss: 1.2967, test_f1: 0.5222
 epoch: 25, train_loss: 0.6410, test_loss: 1.3084, test_f1: 0.5187
 epoch: 26, train_loss: 0.6363, test_loss: 1.2805, test_f1: 0.5418
 epoch: 27, train_loss: 0.6348, test_loss: 1.3300, test_f1: 0.5491
 epoch: 28, train_loss: 0.5986, test_loss: 1.3149, test_f1: 0.5206
 epoch: 29, train_loss: 0.6143, test_loss: 1.4143, test_f1: 0.5167
 epoch: 30, train_loss: 0.6024, test_loss: 1.5212, test_f1: 0.5016
 epoch: 31, train_loss: 0.5739, test_loss: 1.4198, test_f1: 0.5438
 epoch: 32, train_loss: 0.5697, test_loss: 1.3450, test_f1: 0.5319
 epoch: 33, train_loss: 0.5575, test_loss: 1.4493, test_f1: 0.5280
 epoch: 34, train_loss: 0.5334, test_loss: 1.3165, test_f1: 0.5574
 epoch: 35, train_loss: 0.5487, test_loss: 1.3779, test_f1: 0.5519
 epoch: 36, train_loss: 0.5524, test_loss: 1.4541, test_f1: 0.5585
 epoch: 37, train_loss: 0.5271, test_loss: 1.5849, test_f1: 0.5326
 epoch: 38, train_loss: 0.5226, test_loss: 1.6772, test_f1: 0.5397
 epoch: 39, train_loss: 0.5189, test_loss: 1.6093, test_f1: 0.5347
 epoch: 40, train_loss: 0.5003, test_loss: 1.4970, test_f1: 0.5269
 epoch: 41, train_loss: 0.4981, test_loss: 1.5706, test_f1: 0.5325
 epoch: 42, train_loss: 0.4907, test_loss: 1.5726, test_f1: 0.5631
 epoch: 43, train_loss: 0.4846, test_loss: 1.6927, test_f1: 0.5463
 epoch: 44, train_loss: 0.4817, test_loss: 1.5927, test_f1: 0.5489
 epoch: 45, train_loss: 0.4581, test_loss: 1.6209, test_f1: 0.5525
 epoch: 46, train_loss: 0.4795, test_loss: 1.6456, test_f1: 0.5560
 epoch: 47, train_loss: 0.4434, test_loss: 1.5806, test_f1: 0.5452
 epoch: 48, train_loss: 0.4323, test_loss: 1.8811, test_f1: 0.5602
 epoch: 49, train_loss: 0.4551, test_loss: 1.7896, test_f1: 0.5275
 epoch: 50, train_loss: 0.4486, test_loss: 1.7165, test_f1: 0.5423
 epoch: 51, train_loss: 0.3858, test_loss: 1.7917, test_f1: 0.5274
 epoch: 52, train_loss: 0.3574, test_loss: 1.7941, test_f1: 0.5612
 epoch: 53, train_loss: 0.3432, test_loss: 1.9217, test_f1: 0.5517
 epoch: 54, train_loss: 0.3488, test_loss: 1.9672, test_f1: 0.5586
 epoch: 55, train_loss: 0.3268, test_loss: 1.9466, test_f1: 0.5552
 epoch: 56, train_loss: 0.3109, test_loss: 2.0232, test_f1: 0.5515
 epoch: 57, train_loss: 0.3200, test_loss: 2.0163, test_f1: 0.5637
 epoch: 58, train_loss: 0.3155, test_loss: 2.1089, test_f1: 0.5314
 epoch: 59, train_loss: 0.3206, test_loss: 2.0957, test_f1: 0.5474
 epoch: 60, train_loss: 0.3188, test_loss: 2.2929, test_f1: 0.5469
 epoch: 61, train_loss: 0.3199, test_loss: 2.0485, test_f1: 0.5433
 epoch: 62, train_loss: 0.3155, test_loss: 2.0716, test_f1: 0.5372
 epoch: 63, train_loss: 0.3043, test_loss: 2.1732, test_f1: 0.5571
 epoch: 64, train_loss: 0.2946, test_loss: 2.0312, test_f1: 0.5574
 epoch: 65, train_loss: 0.2907, test_loss: 2.3635, test_f1: 0.5287
 epoch: 66, train_loss: 0.2936, test_loss: 2.2224, test_f1: 0.5515
 epoch: 67, train_loss: 0.2734, test_loss: 2.3791, test_f1: 0.5228
 epoch: 68, train_loss: 0.2867, test_loss: 2.2816, test_f1: 0.5352
 epoch: 69, train_loss: 0.2735, test_loss: 2.2969, test_f1: 0.5710
 epoch: 70, train_loss: 0.2603, test_loss: 2.4543, test_f1: 0.5607
 epoch: 71, train_loss: 0.2627, test_loss: 2.5415, test_f1: 0.5471
 epoch: 72, train_loss: 0.2689, test_loss: 2.4055, test_f1: 0.5628
 epoch: 73, train_loss: 0.2689, test_loss: 2.3832, test_f1: 0.5562
 epoch: 74, train_loss: 0.2746, test_loss: 2.3773, test_f1: 0.5401
 epoch: 75, train_loss: 0.2770, test_loss: 2.5627, test_f1: 0.5514
 epoch: 76, train_loss: 0.2621, test_loss: 2.3324, test_f1: 0.5487
 epoch: 77, train_loss: 0.2399, test_loss: 2.4997, test_f1: 0.5384
 epoch: 78, train_loss: 0.2467, test_loss: 2.5742, test_f1: 0.5616
 epoch: 79, train_loss: 0.2535, test_loss: 2.5548, test_f1: 0.5504
 epoch: 80, train_loss: 0.2655, test_loss: 2.5226, test_f1: 0.5421
 epoch: 81, train_loss: 0.2359, test_loss: 2.2857, test_f1: 0.5512
 epoch: 82, train_loss: 0.2389, test_loss: 2.4316, test_f1: 0.5417
 epoch: 83, train_loss: 0.2305, test_loss: 2.4200, test_f1: 0.5484
 epoch: 84, train_loss: 0.2430, test_loss: 2.6522, test_f1: 0.5313
 epoch: 85, train_loss: 0.2420, test_loss: 2.5989, test_f1: 0.5589
 epoch: 86, train_loss: 0.2438, test_loss: 2.5224, test_f1: 0.5750
 epoch: 87, train_loss: 0.2487, test_loss: 2.5845, test_f1: 0.5330
 epoch: 88, train_loss: 0.2326, test_loss: 2.6886, test_f1: 0.5516
 epoch: 89, train_loss: 0.2216, test_loss: 2.6997, test_f1: 0.5456
 epoch: 90, train_loss: 0.2122, test_loss: 2.6843, test_f1: 0.5282
 epoch: 91, train_loss: 0.2114, test_loss: 2.8713, test_f1: 0.5436
 epoch: 92, train_loss: 0.2048, test_loss: 2.7542, test_f1: 0.5393
 epoch: 93, train_loss: 0.2217, test_loss: 2.7128, test_f1: 0.5277
 epoch: 94, train_loss: 0.2275, test_loss: 2.8597, test_f1: 0.5376
 epoch: 95, train_loss: 0.1970, test_loss: 2.6535, test_f1: 0.5441
 epoch: 96, train_loss: 0.1997, test_loss: 2.9382, test_f1: 0.5409
 epoch: 97, train_loss: 0.1965, test_loss: 2.8736, test_f1: 0.5517
 epoch: 98, train_loss: 0.2063, test_loss: 3.1066, test_f1: 0.5400
 epoch: 99, train_loss: 0.2082, test_loss: 3.0891, test_f1: 0.5337
##################ITERATION #6 ****************************************
 epoch: 0, train_loss: 1.5013, test_loss: 1.2717, test_f1: 0.3130
 epoch: 1, train_loss: 1.1991, test_loss: 1.1667, test_f1: 0.4099
 epoch: 2, train_loss: 1.1110, test_loss: 1.0740, test_f1: 0.4651
 epoch: 3, train_loss: 1.0555, test_loss: 1.0129, test_f1: 0.5019
 epoch: 4, train_loss: 1.0239, test_loss: 0.9696, test_f1: 0.5299
 epoch: 5, train_loss: 0.9837, test_loss: 0.9878, test_f1: 0.5159
 epoch: 6, train_loss: 0.9529, test_loss: 0.9656, test_f1: 0.5266
 epoch: 7, train_loss: 0.9281, test_loss: 0.9692, test_f1: 0.5256
 epoch: 8, train_loss: 0.9151, test_loss: 1.0263, test_f1: 0.4882
 epoch: 9, train_loss: 0.8855, test_loss: 0.9536, test_f1: 0.5304
 epoch: 10, train_loss: 0.8630, test_loss: 1.1132, test_f1: 0.4546
 epoch: 11, train_loss: 0.8694, test_loss: 1.0005, test_f1: 0.5023
 epoch: 12, train_loss: 0.8247, test_loss: 1.0162, test_f1: 0.5066
 epoch: 13, train_loss: 0.8120, test_loss: 1.0678, test_f1: 0.5018
 epoch: 14, train_loss: 0.7789, test_loss: 1.0157, test_f1: 0.5210
 epoch: 15, train_loss: 0.7706, test_loss: 1.0290, test_f1: 0.5492
 epoch: 16, train_loss: 0.7491, test_loss: 1.0774, test_f1: 0.5182
 epoch: 17, train_loss: 0.7357, test_loss: 1.0304, test_f1: 0.5327
 epoch: 18, train_loss: 0.7282, test_loss: 1.1989, test_f1: 0.5204
 epoch: 19, train_loss: 0.7295, test_loss: 1.1030, test_f1: 0.5193
 epoch: 20, train_loss: 0.7010, test_loss: 1.1050, test_f1: 0.5240
 epoch: 21, train_loss: 0.6789, test_loss: 1.1774, test_f1: 0.5099
 epoch: 22, train_loss: 0.6887, test_loss: 1.2139, test_f1: 0.5016
 epoch: 23, train_loss: 0.6870, test_loss: 1.1544, test_f1: 0.5259
 epoch: 24, train_loss: 0.6484, test_loss: 1.1203, test_f1: 0.5319
 epoch: 25, train_loss: 0.6277, test_loss: 1.2311, test_f1: 0.5158
 epoch: 26, train_loss: 0.6203, test_loss: 1.2215, test_f1: 0.5485
 epoch: 27, train_loss: 0.6120, test_loss: 1.3435, test_f1: 0.5183
 epoch: 28, train_loss: 0.6051, test_loss: 1.2661, test_f1: 0.5318
 epoch: 29, train_loss: 0.5847, test_loss: 1.4270, test_f1: 0.5371
 epoch: 30, train_loss: 0.5850, test_loss: 1.3575, test_f1: 0.5138
 epoch: 31, train_loss: 0.5574, test_loss: 1.2738, test_f1: 0.5481
 epoch: 32, train_loss: 0.5578, test_loss: 1.5007, test_f1: 0.5179
 epoch: 33, train_loss: 0.5507, test_loss: 1.3206, test_f1: 0.5798
 epoch: 34, train_loss: 0.5367, test_loss: 1.3929, test_f1: 0.5391
 epoch: 35, train_loss: 0.5275, test_loss: 1.3603, test_f1: 0.5635
 epoch: 36, train_loss: 0.5496, test_loss: 1.3193, test_f1: 0.5686
 epoch: 37, train_loss: 0.5825, test_loss: 1.5843, test_f1: 0.5439
 epoch: 38, train_loss: 0.5535, test_loss: 1.3598, test_f1: 0.5304
 epoch: 39, train_loss: 0.4798, test_loss: 1.4352, test_f1: 0.5429
 epoch: 40, train_loss: 0.4724, test_loss: 1.5152, test_f1: 0.5351
 epoch: 41, train_loss: 0.4711, test_loss: 1.7780, test_f1: 0.5501
 epoch: 42, train_loss: 0.4784, test_loss: 1.4796, test_f1: 0.5614
 epoch: 43, train_loss: 0.4418, test_loss: 1.6855, test_f1: 0.5226
 epoch: 44, train_loss: 0.4668, test_loss: 1.7652, test_f1: 0.5155
 epoch: 45, train_loss: 0.4533, test_loss: 1.5570, test_f1: 0.5364
 epoch: 46, train_loss: 0.4658, test_loss: 1.5332, test_f1: 0.5344
 epoch: 47, train_loss: 0.4598, test_loss: 1.6796, test_f1: 0.5235
 epoch: 48, train_loss: 0.4207, test_loss: 1.8029, test_f1: 0.5158
 epoch: 49, train_loss: 0.4299, test_loss: 1.6491, test_f1: 0.5387
 epoch: 50, train_loss: 0.4106, test_loss: 1.6137, test_f1: 0.5172
 epoch: 51, train_loss: 0.3505, test_loss: 1.7116, test_f1: 0.5468
 epoch: 52, train_loss: 0.3355, test_loss: 1.7701, test_f1: 0.5454
 epoch: 53, train_loss: 0.3175, test_loss: 1.9326, test_f1: 0.5174
 epoch: 54, train_loss: 0.3021, test_loss: 1.9964, test_f1: 0.5287
 epoch: 55, train_loss: 0.3137, test_loss: 1.9524, test_f1: 0.5429
 epoch: 56, train_loss: 0.2957, test_loss: 2.0841, test_f1: 0.5254
 epoch: 57, train_loss: 0.2805, test_loss: 2.0771, test_f1: 0.5325
 epoch: 58, train_loss: 0.2914, test_loss: 2.1909, test_f1: 0.5359
 epoch: 59, train_loss: 0.2836, test_loss: 2.1847, test_f1: 0.5415
 epoch: 60, train_loss: 0.2882, test_loss: 2.1692, test_f1: 0.5162
 epoch: 61, train_loss: 0.2758, test_loss: 2.1225, test_f1: 0.5392
 epoch: 62, train_loss: 0.2734, test_loss: 2.3557, test_f1: 0.5167
 epoch: 63, train_loss: 0.2756, test_loss: 2.3272, test_f1: 0.5049
 epoch: 64, train_loss: 0.2886, test_loss: 2.3923, test_f1: 0.5339
 epoch: 65, train_loss: 0.2800, test_loss: 2.2232, test_f1: 0.5434
 epoch: 66, train_loss: 0.2774, test_loss: 2.3729, test_f1: 0.5284
 epoch: 67, train_loss: 0.2630, test_loss: 2.1548, test_f1: 0.5227
 epoch: 68, train_loss: 0.2763, test_loss: 2.3757, test_f1: 0.5026
 epoch: 69, train_loss: 0.2675, test_loss: 2.2124, test_f1: 0.5374
 epoch: 70, train_loss: 0.2541, test_loss: 2.3567, test_f1: 0.5224
 epoch: 71, train_loss: 0.2524, test_loss: 2.3992, test_f1: 0.5358
 epoch: 72, train_loss: 0.2619, test_loss: 2.3038, test_f1: 0.5389
 epoch: 73, train_loss: 0.2511, test_loss: 2.4330, test_f1: 0.5184
 epoch: 74, train_loss: 0.2461, test_loss: 2.3393, test_f1: 0.5310
 epoch: 75, train_loss: 0.2441, test_loss: 2.2249, test_f1: 0.5471
 epoch: 76, train_loss: 0.2342, test_loss: 2.4514, test_f1: 0.5234
 epoch: 77, train_loss: 0.2265, test_loss: 2.4069, test_f1: 0.5336
 epoch: 78, train_loss: 0.2301, test_loss: 2.4487, test_f1: 0.5225
 epoch: 79, train_loss: 0.2367, test_loss: 2.4581, test_f1: 0.5294
 epoch: 80, train_loss: 0.2210, test_loss: 2.4181, test_f1: 0.5567
 epoch: 81, train_loss: 0.2327, test_loss: 2.5142, test_f1: 0.5313
 epoch: 82, train_loss: 0.2314, test_loss: 2.6075, test_f1: 0.5373
 epoch: 83, train_loss: 0.2203, test_loss: 2.4505, test_f1: 0.5398
 epoch: 84, train_loss: 0.2242, test_loss: 2.6277, test_f1: 0.5155
 epoch: 85, train_loss: 0.2225, test_loss: 2.5877, test_f1: 0.5203
 epoch: 86, train_loss: 0.2109, test_loss: 2.5750, test_f1: 0.5337
 epoch: 87, train_loss: 0.2049, test_loss: 2.5918, test_f1: 0.5563
 epoch: 88, train_loss: 0.2055, test_loss: 2.7413, test_f1: 0.5214
 epoch: 89, train_loss: 0.1923, test_loss: 2.8705, test_f1: 0.5257
 epoch: 90, train_loss: 0.1931, test_loss: 2.5377, test_f1: 0.5313
 epoch: 91, train_loss: 0.1884, test_loss: 2.7532, test_f1: 0.5474
 epoch: 92, train_loss: 0.1930, test_loss: 2.8421, test_f1: 0.5312
 epoch: 93, train_loss: 0.2001, test_loss: 3.1274, test_f1: 0.5136
 epoch: 94, train_loss: 0.1800, test_loss: 2.8781, test_f1: 0.5228
 epoch: 95, train_loss: 0.2025, test_loss: 2.6227, test_f1: 0.5129
 epoch: 96, train_loss: 0.2298, test_loss: 2.7412, test_f1: 0.5261
 epoch: 97, train_loss: 0.2036, test_loss: 2.7400, test_f1: 0.5316
 epoch: 98, train_loss: 0.2141, test_loss: 2.7637, test_f1: 0.5245
 epoch: 99, train_loss: 0.2061, test_loss: 2.7040, test_f1: 0.5275
##################ITERATION #7 ****************************************
 epoch: 0, train_loss: 1.5286, test_loss: 1.3501, test_f1: 0.2729
 epoch: 1, train_loss: 1.2040, test_loss: 1.2698, test_f1: 0.3491
 epoch: 2, train_loss: 1.1177, test_loss: 1.1886, test_f1: 0.4399
 epoch: 3, train_loss: 1.0624, test_loss: 1.0901, test_f1: 0.4489
 epoch: 4, train_loss: 0.9979, test_loss: 0.9917, test_f1: 0.4890
 epoch: 5, train_loss: 0.9705, test_loss: 0.9779, test_f1: 0.4587
 epoch: 6, train_loss: 0.9432, test_loss: 0.9928, test_f1: 0.4817
 epoch: 7, train_loss: 0.9074, test_loss: 0.9667, test_f1: 0.4978
 epoch: 8, train_loss: 0.8894, test_loss: 1.0157, test_f1: 0.5161
 epoch: 9, train_loss: 0.8826, test_loss: 1.0630, test_f1: 0.5422
 epoch: 10, train_loss: 0.8604, test_loss: 1.0267, test_f1: 0.4819
 epoch: 11, train_loss: 0.8352, test_loss: 1.0888, test_f1: 0.5008
 epoch: 12, train_loss: 0.8054, test_loss: 1.2233, test_f1: 0.4554
 epoch: 13, train_loss: 0.7894, test_loss: 1.0087, test_f1: 0.5200
 epoch: 14, train_loss: 0.7624, test_loss: 1.0601, test_f1: 0.5457
 epoch: 15, train_loss: 0.7643, test_loss: 1.1829, test_f1: 0.5032
 epoch: 16, train_loss: 0.7439, test_loss: 1.2334, test_f1: 0.5318
 epoch: 17, train_loss: 0.7397, test_loss: 1.1427, test_f1: 0.5275
 epoch: 18, train_loss: 0.7214, test_loss: 1.1756, test_f1: 0.5240
 epoch: 19, train_loss: 0.7155, test_loss: 1.1858, test_f1: 0.5241
 epoch: 20, train_loss: 0.7009, test_loss: 1.2665, test_f1: 0.5021
 epoch: 21, train_loss: 0.6915, test_loss: 1.2186, test_f1: 0.5047
 epoch: 22, train_loss: 0.6873, test_loss: 1.1613, test_f1: 0.5395
 epoch: 23, train_loss: 0.6610, test_loss: 1.3469, test_f1: 0.5282
 epoch: 24, train_loss: 0.6387, test_loss: 1.3693, test_f1: 0.5115
 epoch: 25, train_loss: 0.6164, test_loss: 1.4180, test_f1: 0.5030
 epoch: 26, train_loss: 0.6087, test_loss: 1.3528, test_f1: 0.5161
 epoch: 27, train_loss: 0.6174, test_loss: 1.4035, test_f1: 0.5319
 epoch: 28, train_loss: 0.6136, test_loss: 1.4425, test_f1: 0.5239
 epoch: 29, train_loss: 0.5968, test_loss: 1.3795, test_f1: 0.5225
 epoch: 30, train_loss: 0.5820, test_loss: 1.7085, test_f1: 0.5315
 epoch: 31, train_loss: 0.5855, test_loss: 1.3909, test_f1: 0.5241
 epoch: 32, train_loss: 0.5674, test_loss: 1.5206, test_f1: 0.5293
 epoch: 33, train_loss: 0.5560, test_loss: 1.6482, test_f1: 0.5050
 epoch: 34, train_loss: 0.5403, test_loss: 1.5754, test_f1: 0.5171
 epoch: 35, train_loss: 0.5269, test_loss: 1.4768, test_f1: 0.5199
 epoch: 36, train_loss: 0.5133, test_loss: 1.4719, test_f1: 0.5246
 epoch: 37, train_loss: 0.5129, test_loss: 1.7082, test_f1: 0.5120
 epoch: 38, train_loss: 0.5111, test_loss: 1.5376, test_f1: 0.5389
 epoch: 39, train_loss: 0.5317, test_loss: 1.6395, test_f1: 0.5263
 epoch: 40, train_loss: 0.4825, test_loss: 1.6171, test_f1: 0.5350
 epoch: 41, train_loss: 0.4734, test_loss: 1.7920, test_f1: 0.5093
 epoch: 42, train_loss: 0.4793, test_loss: 1.6069, test_f1: 0.5238
 epoch: 43, train_loss: 0.4391, test_loss: 1.8811, test_f1: 0.5285
 epoch: 44, train_loss: 0.4749, test_loss: 1.8768, test_f1: 0.5380
 epoch: 45, train_loss: 0.4882, test_loss: 1.8339, test_f1: 0.5379
 epoch: 46, train_loss: 0.4723, test_loss: 1.8598, test_f1: 0.5177
 epoch: 47, train_loss: 0.4507, test_loss: 1.5794, test_f1: 0.5550
 epoch: 48, train_loss: 0.4580, test_loss: 1.7880, test_f1: 0.5606
 epoch: 49, train_loss: 0.4272, test_loss: 1.8462, test_f1: 0.5304
 epoch: 50, train_loss: 0.4230, test_loss: 1.8681, test_f1: 0.5239
 epoch: 51, train_loss: 0.3897, test_loss: 1.8988, test_f1: 0.5349
 epoch: 52, train_loss: 0.3489, test_loss: 2.1181, test_f1: 0.5426
 epoch: 53, train_loss: 0.3330, test_loss: 1.9939, test_f1: 0.5525
 epoch: 54, train_loss: 0.3158, test_loss: 2.2627, test_f1: 0.5305
 epoch: 55, train_loss: 0.3023, test_loss: 2.2281, test_f1: 0.5422
 epoch: 56, train_loss: 0.3254, test_loss: 2.3392, test_f1: 0.5286
 epoch: 57, train_loss: 0.3150, test_loss: 2.4509, test_f1: 0.5294
 epoch: 58, train_loss: 0.3100, test_loss: 2.2918, test_f1: 0.5520
 epoch: 59, train_loss: 0.2917, test_loss: 2.2847, test_f1: 0.5386
 epoch: 60, train_loss: 0.2844, test_loss: 2.3395, test_f1: 0.5340
 epoch: 61, train_loss: 0.2785, test_loss: 2.4299, test_f1: 0.5406
 epoch: 62, train_loss: 0.2830, test_loss: 2.3391, test_f1: 0.5438
 epoch: 63, train_loss: 0.2824, test_loss: 2.4935, test_f1: 0.5356
 epoch: 64, train_loss: 0.2984, test_loss: 2.3514, test_f1: 0.5154
 epoch: 65, train_loss: 0.2918, test_loss: 2.2874, test_f1: 0.5613
 epoch: 66, train_loss: 0.2867, test_loss: 2.5113, test_f1: 0.5328
 epoch: 67, train_loss: 0.2610, test_loss: 2.2875, test_f1: 0.5592
 epoch: 68, train_loss: 0.2632, test_loss: 2.5432, test_f1: 0.5213
 epoch: 69, train_loss: 0.2656, test_loss: 2.3810, test_f1: 0.5388
 epoch: 70, train_loss: 0.2611, test_loss: 2.6640, test_f1: 0.5404
 epoch: 71, train_loss: 0.2550, test_loss: 2.4543, test_f1: 0.5260
 epoch: 72, train_loss: 0.2809, test_loss: 2.3592, test_f1: 0.5305
 epoch: 73, train_loss: 0.2594, test_loss: 2.6804, test_f1: 0.5227
 epoch: 74, train_loss: 0.2366, test_loss: 2.3862, test_f1: 0.5364
 epoch: 75, train_loss: 0.2368, test_loss: 2.6478, test_f1: 0.5241
 epoch: 76, train_loss: 0.2434, test_loss: 2.6920, test_f1: 0.5496
 epoch: 77, train_loss: 0.2493, test_loss: 2.5691, test_f1: 0.5413
 epoch: 78, train_loss: 0.2381, test_loss: 2.6305, test_f1: 0.5289
 epoch: 79, train_loss: 0.2372, test_loss: 2.5114, test_f1: 0.5475
 epoch: 80, train_loss: 0.2090, test_loss: 2.5090, test_f1: 0.5383
 epoch: 81, train_loss: 0.2212, test_loss: 2.8723, test_f1: 0.4982
 epoch: 82, train_loss: 0.2274, test_loss: 2.7550, test_f1: 0.5242
 epoch: 83, train_loss: 0.2396, test_loss: 2.7680, test_f1: 0.5412
 epoch: 84, train_loss: 0.2123, test_loss: 2.7821, test_f1: 0.5443
 epoch: 85, train_loss: 0.2173, test_loss: 2.9100, test_f1: 0.5190
 epoch: 86, train_loss: 0.2231, test_loss: 2.9644, test_f1: 0.5481
 epoch: 87, train_loss: 0.2186, test_loss: 2.9730, test_f1: 0.5360
 epoch: 88, train_loss: 0.2026, test_loss: 2.9162, test_f1: 0.5374
 epoch: 89, train_loss: 0.2029, test_loss: 2.7739, test_f1: 0.5306
 epoch: 90, train_loss: 0.2138, test_loss: 2.8241, test_f1: 0.5522
 epoch: 91, train_loss: 0.2072, test_loss: 2.9351, test_f1: 0.5391
 epoch: 92, train_loss: 0.2087, test_loss: 2.8950, test_f1: 0.5308
 epoch: 93, train_loss: 0.2162, test_loss: 2.7971, test_f1: 0.5537
 epoch: 94, train_loss: 0.2320, test_loss: 2.6284, test_f1: 0.5249
 epoch: 95, train_loss: 0.2269, test_loss: 2.7205, test_f1: 0.5264
 epoch: 96, train_loss: 0.2000, test_loss: 2.7830, test_f1: 0.5261
 epoch: 97, train_loss: 0.1983, test_loss: 2.8427, test_f1: 0.5560
 epoch: 98, train_loss: 0.1870, test_loss: 2.9108, test_f1: 0.5433
 epoch: 99, train_loss: 0.1923, test_loss: 3.0234, test_f1: 0.5112
##################ITERATION #8 ****************************************
 epoch: 0, train_loss: 1.6032, test_loss: 1.3452, test_f1: 0.3078
 epoch: 1, train_loss: 1.2100, test_loss: 1.2278, test_f1: 0.3687
 epoch: 2, train_loss: 1.1230, test_loss: 1.1189, test_f1: 0.4773
 epoch: 3, train_loss: 1.0696, test_loss: 1.0642, test_f1: 0.4259
 epoch: 4, train_loss: 1.0241, test_loss: 1.0260, test_f1: 0.4731
 epoch: 5, train_loss: 1.0021, test_loss: 0.9997, test_f1: 0.4606
 epoch: 6, train_loss: 0.9744, test_loss: 0.9841, test_f1: 0.4647
 epoch: 7, train_loss: 0.9384, test_loss: 1.0189, test_f1: 0.4603
 epoch: 8, train_loss: 0.9122, test_loss: 1.0291, test_f1: 0.4862
 epoch: 9, train_loss: 0.9083, test_loss: 1.0157, test_f1: 0.4804
 epoch: 10, train_loss: 0.8920, test_loss: 1.0716, test_f1: 0.4885
 epoch: 11, train_loss: 0.8948, test_loss: 1.0277, test_f1: 0.4790
 epoch: 12, train_loss: 0.8605, test_loss: 1.0483, test_f1: 0.5018
 epoch: 13, train_loss: 0.8384, test_loss: 1.0815, test_f1: 0.5025
 epoch: 14, train_loss: 0.8130, test_loss: 1.1001, test_f1: 0.4823
 epoch: 15, train_loss: 0.7871, test_loss: 1.0820, test_f1: 0.4859
 epoch: 16, train_loss: 0.7695, test_loss: 1.0783, test_f1: 0.5099
 epoch: 17, train_loss: 0.7746, test_loss: 1.1636, test_f1: 0.4822
 epoch: 18, train_loss: 0.7522, test_loss: 1.2080, test_f1: 0.4969
 epoch: 19, train_loss: 0.7579, test_loss: 1.1916, test_f1: 0.4861
 epoch: 20, train_loss: 0.7377, test_loss: 1.0996, test_f1: 0.5438
 epoch: 21, train_loss: 0.7121, test_loss: 1.1631, test_f1: 0.5056
 epoch: 22, train_loss: 0.7212, test_loss: 1.2127, test_f1: 0.5282
 epoch: 23, train_loss: 0.6981, test_loss: 1.3522, test_f1: 0.4931
 epoch: 24, train_loss: 0.6916, test_loss: 1.0986, test_f1: 0.5435
 epoch: 25, train_loss: 0.6839, test_loss: 1.1998, test_f1: 0.5362
 epoch: 26, train_loss: 0.6682, test_loss: 1.3257, test_f1: 0.5036
 epoch: 27, train_loss: 0.6688, test_loss: 1.3282, test_f1: 0.4820
 epoch: 28, train_loss: 0.6703, test_loss: 1.1058, test_f1: 0.5461
 epoch: 29, train_loss: 0.6433, test_loss: 1.2802, test_f1: 0.4874
 epoch: 30, train_loss: 0.6388, test_loss: 1.2212, test_f1: 0.5219
 epoch: 31, train_loss: 0.6074, test_loss: 1.1998, test_f1: 0.5464
 epoch: 32, train_loss: 0.6285, test_loss: 1.4317, test_f1: 0.5195
 epoch: 33, train_loss: 0.6067, test_loss: 1.1262, test_f1: 0.5365
 epoch: 34, train_loss: 0.5884, test_loss: 1.2954, test_f1: 0.5185
 epoch: 35, train_loss: 0.5856, test_loss: 1.1965, test_f1: 0.5293
 epoch: 36, train_loss: 0.5549, test_loss: 1.5684, test_f1: 0.5240
 epoch: 37, train_loss: 0.5648, test_loss: 1.3333, test_f1: 0.5493
 epoch: 38, train_loss: 0.5645, test_loss: 1.3532, test_f1: 0.5400
 epoch: 39, train_loss: 0.5549, test_loss: 1.4092, test_f1: 0.5083
 epoch: 40, train_loss: 0.5397, test_loss: 1.3982, test_f1: 0.5113
 epoch: 41, train_loss: 0.5285, test_loss: 1.4709, test_f1: 0.4993
 epoch: 42, train_loss: 0.5405, test_loss: 1.3272, test_f1: 0.5167
 epoch: 43, train_loss: 0.5309, test_loss: 1.6093, test_f1: 0.4961
 epoch: 44, train_loss: 0.5429, test_loss: 1.2155, test_f1: 0.5288
 epoch: 45, train_loss: 0.5142, test_loss: 1.4261, test_f1: 0.5366
 epoch: 46, train_loss: 0.5182, test_loss: 1.4632, test_f1: 0.5350
 epoch: 47, train_loss: 0.5005, test_loss: 1.5754, test_f1: 0.5434
 epoch: 48, train_loss: 0.4863, test_loss: 1.6251, test_f1: 0.5151
 epoch: 49, train_loss: 0.4690, test_loss: 1.4410, test_f1: 0.5601
 epoch: 50, train_loss: 0.4782, test_loss: 1.7589, test_f1: 0.5174
 epoch: 51, train_loss: 0.4413, test_loss: 1.4641, test_f1: 0.5643
 epoch: 52, train_loss: 0.3856, test_loss: 1.6072, test_f1: 0.5399
 epoch: 53, train_loss: 0.3926, test_loss: 1.6424, test_f1: 0.5456
 epoch: 54, train_loss: 0.3729, test_loss: 1.6791, test_f1: 0.5132
 epoch: 55, train_loss: 0.3570, test_loss: 1.7002, test_f1: 0.5310
 epoch: 56, train_loss: 0.3510, test_loss: 1.7670, test_f1: 0.5620
 epoch: 57, train_loss: 0.3546, test_loss: 1.6850, test_f1: 0.5435
 epoch: 58, train_loss: 0.3593, test_loss: 1.7571, test_f1: 0.5559
 epoch: 59, train_loss: 0.3282, test_loss: 1.8454, test_f1: 0.5460
 epoch: 60, train_loss: 0.3334, test_loss: 1.8067, test_f1: 0.5179
 epoch: 61, train_loss: 0.3364, test_loss: 1.8929, test_f1: 0.5317
 epoch: 62, train_loss: 0.3206, test_loss: 1.9514, test_f1: 0.5409
 epoch: 63, train_loss: 0.3205, test_loss: 2.0116, test_f1: 0.5742
 epoch: 64, train_loss: 0.3219, test_loss: 1.9677, test_f1: 0.5315
 epoch: 65, train_loss: 0.3152, test_loss: 2.0471, test_f1: 0.5313
 epoch: 66, train_loss: 0.3113, test_loss: 1.9606, test_f1: 0.5318
 epoch: 67, train_loss: 0.3069, test_loss: 1.9398, test_f1: 0.5552
 epoch: 68, train_loss: 0.3159, test_loss: 1.9698, test_f1: 0.5420
 epoch: 69, train_loss: 0.2923, test_loss: 1.9543, test_f1: 0.5452
 epoch: 70, train_loss: 0.2968, test_loss: 2.0504, test_f1: 0.5312
 epoch: 71, train_loss: 0.2837, test_loss: 1.8948, test_f1: 0.5364
 epoch: 72, train_loss: 0.2950, test_loss: 2.2396, test_f1: 0.5342
 epoch: 73, train_loss: 0.2793, test_loss: 2.3562, test_f1: 0.5095
 epoch: 74, train_loss: 0.2885, test_loss: 2.2166, test_f1: 0.5161
 epoch: 75, train_loss: 0.2828, test_loss: 1.9905, test_f1: 0.5479
 epoch: 76, train_loss: 0.2689, test_loss: 2.3113, test_f1: 0.5164
 epoch: 77, train_loss: 0.2552, test_loss: 2.1703, test_f1: 0.5537
 epoch: 78, train_loss: 0.2687, test_loss: 2.1620, test_f1: 0.5488
 epoch: 79, train_loss: 0.2697, test_loss: 2.2694, test_f1: 0.5137
 epoch: 80, train_loss: 0.2621, test_loss: 2.2591, test_f1: 0.5439
 epoch: 81, train_loss: 0.2660, test_loss: 2.2381, test_f1: 0.5335
 epoch: 82, train_loss: 0.2634, test_loss: 2.1504, test_f1: 0.5344
 epoch: 83, train_loss: 0.2502, test_loss: 2.3388, test_f1: 0.5230
 epoch: 84, train_loss: 0.2413, test_loss: 2.1379, test_f1: 0.5446
 epoch: 85, train_loss: 0.2502, test_loss: 2.1927, test_f1: 0.5542
 epoch: 86, train_loss: 0.2865, test_loss: 2.1040, test_f1: 0.5389
 epoch: 87, train_loss: 0.2621, test_loss: 2.3683, test_f1: 0.5242
 epoch: 88, train_loss: 0.2531, test_loss: 2.2358, test_f1: 0.5400
 epoch: 89, train_loss: 0.2699, test_loss: 2.2555, test_f1: 0.5343
 epoch: 90, train_loss: 0.2441, test_loss: 2.3747, test_f1: 0.5339
 epoch: 91, train_loss: 0.2451, test_loss: 2.2836, test_f1: 0.5300
 epoch: 92, train_loss: 0.2465, test_loss: 2.1207, test_f1: 0.5605
 epoch: 93, train_loss: 0.2620, test_loss: 2.3845, test_f1: 0.5347
 epoch: 94, train_loss: 0.2258, test_loss: 2.3803, test_f1: 0.5399
 epoch: 95, train_loss: 0.2328, test_loss: 2.3124, test_f1: 0.5524
 epoch: 96, train_loss: 0.2204, test_loss: 2.3880, test_f1: 0.5569
 epoch: 97, train_loss: 0.2333, test_loss: 2.3543, test_f1: 0.5225
 epoch: 98, train_loss: 0.2188, test_loss: 2.4972, test_f1: 0.5487
 epoch: 99, train_loss: 0.2126, test_loss: 2.5571, test_f1: 0.5259
##################ITERATION #9 ****************************************
 epoch: 0, train_loss: 1.6144, test_loss: 1.3522, test_f1: 0.2909
 epoch: 1, train_loss: 1.2433, test_loss: 1.2254, test_f1: 0.3483
 epoch: 2, train_loss: 1.1380, test_loss: 1.1129, test_f1: 0.4100
 epoch: 3, train_loss: 1.0809, test_loss: 1.0537, test_f1: 0.4427
 epoch: 4, train_loss: 1.0531, test_loss: 1.0460, test_f1: 0.4472
 epoch: 5, train_loss: 1.0260, test_loss: 1.0142, test_f1: 0.4600
 epoch: 6, train_loss: 0.9878, test_loss: 1.0502, test_f1: 0.4413
 epoch: 7, train_loss: 0.9650, test_loss: 1.0093, test_f1: 0.4741
 epoch: 8, train_loss: 0.9419, test_loss: 1.0368, test_f1: 0.4488
 epoch: 9, train_loss: 0.9311, test_loss: 1.1230, test_f1: 0.4676
 epoch: 10, train_loss: 0.8997, test_loss: 1.0175, test_f1: 0.4868
 epoch: 11, train_loss: 0.8917, test_loss: 1.0214, test_f1: 0.4765
 epoch: 12, train_loss: 0.8603, test_loss: 1.1384, test_f1: 0.5065
 epoch: 13, train_loss: 0.8487, test_loss: 1.0146, test_f1: 0.4842
 epoch: 14, train_loss: 0.8205, test_loss: 1.1347, test_f1: 0.4956
 epoch: 15, train_loss: 0.8175, test_loss: 1.1212, test_f1: 0.5231
 epoch: 16, train_loss: 0.7953, test_loss: 1.0729, test_f1: 0.5069
 epoch: 17, train_loss: 0.7912, test_loss: 1.0155, test_f1: 0.5089
 epoch: 18, train_loss: 0.7772, test_loss: 1.1426, test_f1: 0.4970
 epoch: 19, train_loss: 0.7635, test_loss: 1.1712, test_f1: 0.4799
 epoch: 20, train_loss: 0.7494, test_loss: 1.1706, test_f1: 0.5285
 epoch: 21, train_loss: 0.7292, test_loss: 1.0669, test_f1: 0.5083
 epoch: 22, train_loss: 0.7369, test_loss: 1.3692, test_f1: 0.4632
 epoch: 23, train_loss: 0.7222, test_loss: 1.3393, test_f1: 0.4936
 epoch: 24, train_loss: 0.7090, test_loss: 1.0952, test_f1: 0.5089
 epoch: 25, train_loss: 0.6709, test_loss: 1.2098, test_f1: 0.5093
 epoch: 26, train_loss: 0.6690, test_loss: 1.1689, test_f1: 0.5207
 epoch: 27, train_loss: 0.6645, test_loss: 1.1900, test_f1: 0.5168
 epoch: 28, train_loss: 0.6728, test_loss: 1.3650, test_f1: 0.5076
 epoch: 29, train_loss: 0.6492, test_loss: 1.2441, test_f1: 0.5303
 epoch: 30, train_loss: 0.6407, test_loss: 1.2269, test_f1: 0.5098
 epoch: 31, train_loss: 0.6406, test_loss: 1.2844, test_f1: 0.5365
 epoch: 32, train_loss: 0.6071, test_loss: 1.2720, test_f1: 0.5330
 epoch: 33, train_loss: 0.6097, test_loss: 1.5569, test_f1: 0.4632
 epoch: 34, train_loss: 0.6163, test_loss: 1.5383, test_f1: 0.5100
 epoch: 35, train_loss: 0.6073, test_loss: 1.3532, test_f1: 0.5248
 epoch: 36, train_loss: 0.5631, test_loss: 1.7188, test_f1: 0.4924
 epoch: 37, train_loss: 0.5985, test_loss: 1.3094, test_f1: 0.5267
 epoch: 38, train_loss: 0.5705, test_loss: 1.5387, test_f1: 0.5096
 epoch: 39, train_loss: 0.5615, test_loss: 1.3420, test_f1: 0.5468
 epoch: 40, train_loss: 0.5935, test_loss: 1.2914, test_f1: 0.5441
 epoch: 41, train_loss: 0.5798, test_loss: 1.4250, test_f1: 0.5287
 epoch: 42, train_loss: 0.5599, test_loss: 1.3641, test_f1: 0.5395
 epoch: 43, train_loss: 0.5428, test_loss: 1.5569, test_f1: 0.5372
 epoch: 44, train_loss: 0.5184, test_loss: 1.5775, test_f1: 0.5241
 epoch: 45, train_loss: 0.5015, test_loss: 1.6561, test_f1: 0.5281
 epoch: 46, train_loss: 0.5047, test_loss: 1.4975, test_f1: 0.5176
 epoch: 47, train_loss: 0.5068, test_loss: 1.8590, test_f1: 0.4934
 epoch: 48, train_loss: 0.5089, test_loss: 1.4100, test_f1: 0.5161
 epoch: 49, train_loss: 0.5182, test_loss: 1.5386, test_f1: 0.5486
 epoch: 50, train_loss: 0.5072, test_loss: 1.6242, test_f1: 0.5365
 epoch: 51, train_loss: 0.4347, test_loss: 1.5606, test_f1: 0.5426
 epoch: 52, train_loss: 0.4198, test_loss: 1.6808, test_f1: 0.5373
 epoch: 53, train_loss: 0.4009, test_loss: 1.8495, test_f1: 0.5351
 epoch: 54, train_loss: 0.3892, test_loss: 1.9174, test_f1: 0.5441
 epoch: 55, train_loss: 0.3935, test_loss: 1.6977, test_f1: 0.5303
 epoch: 56, train_loss: 0.3807, test_loss: 1.7910, test_f1: 0.5236
 epoch: 57, train_loss: 0.3869, test_loss: 1.6136, test_f1: 0.5405
 epoch: 58, train_loss: 0.3642, test_loss: 1.7953, test_f1: 0.5438
 epoch: 59, train_loss: 0.3583, test_loss: 1.7896, test_f1: 0.5340
 epoch: 60, train_loss: 0.3559, test_loss: 2.0612, test_f1: 0.5272
 epoch: 61, train_loss: 0.3637, test_loss: 1.8490, test_f1: 0.5302
 epoch: 62, train_loss: 0.3571, test_loss: 1.8969, test_f1: 0.5465
 epoch: 63, train_loss: 0.3509, test_loss: 1.9444, test_f1: 0.5336
 epoch: 64, train_loss: 0.3454, test_loss: 1.9107, test_f1: 0.5327
 epoch: 65, train_loss: 0.3334, test_loss: 1.8912, test_f1: 0.5399
 epoch: 66, train_loss: 0.3160, test_loss: 1.9333, test_f1: 0.5430
 epoch: 67, train_loss: 0.3081, test_loss: 1.9541, test_f1: 0.5097
 epoch: 68, train_loss: 0.3078, test_loss: 2.1161, test_f1: 0.5505
 epoch: 69, train_loss: 0.3132, test_loss: 1.8582, test_f1: 0.5410
 epoch: 70, train_loss: 0.3166, test_loss: 1.9118, test_f1: 0.5413
 epoch: 71, train_loss: 0.3143, test_loss: 2.3507, test_f1: 0.5117
 epoch: 72, train_loss: 0.3446, test_loss: 1.9800, test_f1: 0.5475
 epoch: 73, train_loss: 0.3092, test_loss: 1.9514, test_f1: 0.5418
 epoch: 74, train_loss: 0.3096, test_loss: 2.0320, test_f1: 0.5423
 epoch: 75, train_loss: 0.3224, test_loss: 2.0397, test_f1: 0.5258
 epoch: 76, train_loss: 0.3319, test_loss: 2.2960, test_f1: 0.5186
 epoch: 77, train_loss: 0.3284, test_loss: 2.0543, test_f1: 0.5307
 epoch: 78, train_loss: 0.2906, test_loss: 2.0765, test_f1: 0.5410
 epoch: 79, train_loss: 0.2820, test_loss: 2.4517, test_f1: 0.5301
 epoch: 80, train_loss: 0.2847, test_loss: 1.9907, test_f1: 0.5457
 epoch: 81, train_loss: 0.2736, test_loss: 2.2918, test_f1: 0.5461
 epoch: 82, train_loss: 0.2598, test_loss: 2.2403, test_f1: 0.5318
 epoch: 83, train_loss: 0.2654, test_loss: 2.2638, test_f1: 0.5265
 epoch: 84, train_loss: 0.2787, test_loss: 2.4269, test_f1: 0.5460
 epoch: 85, train_loss: 0.2712, test_loss: 2.2568, test_f1: 0.5228
 epoch: 86, train_loss: 0.2816, test_loss: 2.4992, test_f1: 0.5170
 epoch: 87, train_loss: 0.2788, test_loss: 2.1058, test_f1: 0.5429
 epoch: 88, train_loss: 0.2747, test_loss: 2.3510, test_f1: 0.5518
 epoch: 89, train_loss: 0.2623, test_loss: 2.3219, test_f1: 0.5296
 epoch: 90, train_loss: 0.2828, test_loss: 2.2458, test_f1: 0.5305
 epoch: 91, train_loss: 0.2785, test_loss: 2.2068, test_f1: 0.5301
 epoch: 92, train_loss: 0.2756, test_loss: 2.2219, test_f1: 0.5300
 epoch: 93, train_loss: 0.2655, test_loss: 2.2830, test_f1: 0.5323
 epoch: 94, train_loss: 0.2570, test_loss: 2.3978, test_f1: 0.5370
 epoch: 95, train_loss: 0.2576, test_loss: 2.2981, test_f1: 0.5418
 epoch: 96, train_loss: 0.2736, test_loss: 2.2948, test_f1: 0.5459
 epoch: 97, train_loss: 0.2694, test_loss: 2.3201, test_f1: 0.5510
 epoch: 98, train_loss: 0.2575, test_loss: 2.2210, test_f1: 0.5393
 epoch: 99, train_loss: 0.2375, test_loss: 2.2864, test_f1: 0.5521

Training completed in 415.54 seconds
Best F1: 0.5798 at epoch 33
Mean F1 across iterations: 0.5655  0.0090
========================FINAL RESULTS================================
FEGIN weighted F1: 0.5798  0.0090
python main.py --data ltspice_examples --representation component_component --model FEGIN --layers 5 --hiddens 128 --batch_size 256 --lr 0.001 --emb_size 250 --epochs 100 --save_appendix component_component_L5_H128_BS256_LR0.001_E250 --no_val
-----



STDERR:
  File "main.py", line 370, in <module>
    main()
  File "main.py", line 254, in main
    dataset = dataset_class(
  File "/home/philip/projects/ltspice_examples_code_repo/Circuit-Completion-Using-GNNs/component_classification_with_link_prediction_head/evaluation/FEGIN/kernel/circuit_datasets.py", line 15, in __init__
    self.data, self.slices = torch.load(self.processed_paths[0])
  File "/home/philip/.local/lib/python3.8/site-packages/torch/serialization.py", line 1040, in load
    warnings.warn(
  File "/usr/lib/python3.8/warnings.py", line 109, in _showwarnmsg
    sw(msg.message, msg.category, msg.filename, msg.lineno,
  File "main.py", line 47, in warn_with_traceback
    traceback.print_stack(file=log)
/home/philip/projects/ltspice_examples_code_repo/Circuit-Completion-Using-GNNs/component_classification_with_link_prediction_head/evaluation/FEGIN/kernel/circuit_datasets.py:15: FutureWarning: You are using `torch.load` with `weights_only=False` (the current default value), which uses the default pickle module implicitly. It is possible to construct malicious pickle data which will execute arbitrary code during unpickling (See https://github.com/pytorch/pytorch/blob/main/SECURITY.md#untrusted-models for more details). In a future release, the default value for `weights_only` will be flipped to `True`. This limits the functions that could be executed during unpickling. Arbitrary objects will no longer be allowed to be loaded via this mode unless they are explicitly allowlisted by the user via `torch.serialization.add_safe_globals`. We recommend you start setting `weights_only=True` for any use case where you don't have full control of the loaded file. Please open an issue on GitHub for any issues related to this experimental feature.
  self.data, self.slices = torch.load(self.processed_paths[0])
