STDOUT:
Results will be saved in /home/philip/projects/ltspice_examples_code_repo/Circuit-Completion-Using-GNNs/component_classification_with_link_prediction_head/evaluation/FEGIN/results/model_FEGIN_dataset_ltspice_demos
Command line input: python main.py --data ltspice_demos --representation component_net --model FEGIN --layers 2 --hiddens 16 --batch_size 256 --lr 0.001 --emb_size 250 --epochs 100 --save_appendix component_net_L2_H16_BS256_LR0.001_E250 --no_val
 is saved.
-----
ltspice_demos - FEGIN
Using 2 layers, 16 hidden units, h = 2
Loading component_net representation dataset
ENTERED
Training FEGIN on component_net representation
Train: 1565, Test: 383
##################ITERATION #0 ****************************************
 epoch: 0, train_loss: 1.4174, test_loss: 1.4097, test_f1: 0.0507
 epoch: 1, train_loss: 1.4017, test_loss: 1.4030, test_f1: 0.0507
 epoch: 2, train_loss: 1.3920, test_loss: 1.3968, test_f1: 0.1370
 epoch: 3, train_loss: 1.3825, test_loss: 1.3908, test_f1: 0.1365
 epoch: 4, train_loss: 1.3739, test_loss: 1.3852, test_f1: 0.1365
 epoch: 5, train_loss: 1.3663, test_loss: 1.3795, test_f1: 0.1365
 epoch: 6, train_loss: 1.3556, test_loss: 1.3725, test_f1: 0.1365
 epoch: 7, train_loss: 1.3438, test_loss: 1.3638, test_f1: 0.1365
 epoch: 8, train_loss: 1.3313, test_loss: 1.3530, test_f1: 0.1365
 epoch: 9, train_loss: 1.3166, test_loss: 1.3400, test_f1: 0.1365
 epoch: 10, train_loss: 1.2997, test_loss: 1.3267, test_f1: 0.1365
 epoch: 11, train_loss: 1.2828, test_loss: 1.3123, test_f1: 0.1365
 epoch: 12, train_loss: 1.2642, test_loss: 1.2974, test_f1: 0.1430
 epoch: 13, train_loss: 1.2455, test_loss: 1.2838, test_f1: 0.2213
 epoch: 14, train_loss: 1.2293, test_loss: 1.2727, test_f1: 0.3372
 epoch: 15, train_loss: 1.2192, test_loss: 1.2648, test_f1: 0.3438
 epoch: 16, train_loss: 1.2062, test_loss: 1.2597, test_f1: 0.3279
 epoch: 17, train_loss: 1.1985, test_loss: 1.2547, test_f1: 0.3397
 epoch: 18, train_loss: 1.1944, test_loss: 1.2528, test_f1: 0.3229
 epoch: 19, train_loss: 1.1877, test_loss: 1.2516, test_f1: 0.3230
 epoch: 20, train_loss: 1.1743, test_loss: 1.2430, test_f1: 0.3230
 epoch: 21, train_loss: 1.1726, test_loss: 1.2364, test_f1: 0.3262
 epoch: 22, train_loss: 1.1671, test_loss: 1.2323, test_f1: 0.3242
 epoch: 23, train_loss: 1.1638, test_loss: 1.2277, test_f1: 0.3263
 epoch: 24, train_loss: 1.1610, test_loss: 1.2215, test_f1: 0.3268
 epoch: 25, train_loss: 1.1467, test_loss: 1.2133, test_f1: 0.3245
 epoch: 26, train_loss: 1.1510, test_loss: 1.2131, test_f1: 0.3250
 epoch: 27, train_loss: 1.1455, test_loss: 1.2070, test_f1: 0.3250
 epoch: 28, train_loss: 1.1402, test_loss: 1.1994, test_f1: 0.3269
 epoch: 29, train_loss: 1.1275, test_loss: 1.1987, test_f1: 0.3305
 epoch: 30, train_loss: 1.1268, test_loss: 1.2033, test_f1: 0.3311
 epoch: 31, train_loss: 1.1231, test_loss: 1.1978, test_f1: 0.3261
 epoch: 32, train_loss: 1.1177, test_loss: 1.1873, test_f1: 0.3270
 epoch: 33, train_loss: 1.1157, test_loss: 1.1829, test_f1: 0.3301
 epoch: 34, train_loss: 1.1065, test_loss: 1.1822, test_f1: 0.3345
 epoch: 35, train_loss: 1.1018, test_loss: 1.1734, test_f1: 0.3483
 epoch: 36, train_loss: 1.1029, test_loss: 1.1680, test_f1: 0.3534
 epoch: 37, train_loss: 1.0911, test_loss: 1.1637, test_f1: 0.3673
 epoch: 38, train_loss: 1.0878, test_loss: 1.1621, test_f1: 0.3874
 epoch: 39, train_loss: 1.0736, test_loss: 1.1687, test_f1: 0.4006
 epoch: 40, train_loss: 1.0819, test_loss: 1.1607, test_f1: 0.4128
 epoch: 41, train_loss: 1.0763, test_loss: 1.1534, test_f1: 0.4278
 epoch: 42, train_loss: 1.0709, test_loss: 1.1489, test_f1: 0.4335
 epoch: 43, train_loss: 1.0637, test_loss: 1.1520, test_f1: 0.4275
 epoch: 44, train_loss: 1.0580, test_loss: 1.1628, test_f1: 0.4255
 epoch: 45, train_loss: 1.0434, test_loss: 1.1692, test_f1: 0.4301
 epoch: 46, train_loss: 1.0449, test_loss: 1.1778, test_f1: 0.4269
 epoch: 47, train_loss: 1.0477, test_loss: 1.1675, test_f1: 0.4326
 epoch: 48, train_loss: 1.0408, test_loss: 1.1619, test_f1: 0.4177
 epoch: 49, train_loss: 1.0347, test_loss: 1.1541, test_f1: 0.4169
 epoch: 50, train_loss: 1.0386, test_loss: 1.1630, test_f1: 0.4193
 epoch: 51, train_loss: 1.0308, test_loss: 1.1546, test_f1: 0.4144
 epoch: 52, train_loss: 1.0374, test_loss: 1.1474, test_f1: 0.4197
 epoch: 53, train_loss: 1.0245, test_loss: 1.1372, test_f1: 0.4115
 epoch: 54, train_loss: 1.0192, test_loss: 1.1438, test_f1: 0.4147
 epoch: 55, train_loss: 1.0207, test_loss: 1.1556, test_f1: 0.4215
 epoch: 56, train_loss: 1.0266, test_loss: 1.1634, test_f1: 0.4274
 epoch: 57, train_loss: 1.0233, test_loss: 1.1559, test_f1: 0.4274
 epoch: 58, train_loss: 1.0209, test_loss: 1.1508, test_f1: 0.4262
 epoch: 59, train_loss: 1.0101, test_loss: 1.1541, test_f1: 0.4135
 epoch: 60, train_loss: 1.0177, test_loss: 1.1532, test_f1: 0.4203
 epoch: 61, train_loss: 1.0091, test_loss: 1.1553, test_f1: 0.4182
 epoch: 62, train_loss: 1.0172, test_loss: 1.1602, test_f1: 0.4179
 epoch: 63, train_loss: 1.0063, test_loss: 1.1676, test_f1: 0.4219
 epoch: 64, train_loss: 0.9993, test_loss: 1.1562, test_f1: 0.4151
 epoch: 65, train_loss: 1.0120, test_loss: 1.1589, test_f1: 0.4175
 epoch: 66, train_loss: 0.9994, test_loss: 1.1641, test_f1: 0.4203
 epoch: 67, train_loss: 1.0031, test_loss: 1.1601, test_f1: 0.4152
 epoch: 68, train_loss: 0.9983, test_loss: 1.1577, test_f1: 0.4333
 epoch: 69, train_loss: 1.0049, test_loss: 1.1479, test_f1: 0.4154
 epoch: 70, train_loss: 1.0028, test_loss: 1.1474, test_f1: 0.4199
 epoch: 71, train_loss: 0.9984, test_loss: 1.1491, test_f1: 0.4325
 epoch: 72, train_loss: 1.0020, test_loss: 1.1507, test_f1: 0.4314
 epoch: 73, train_loss: 1.0002, test_loss: 1.1578, test_f1: 0.4202
 epoch: 74, train_loss: 0.9899, test_loss: 1.1674, test_f1: 0.4254
 epoch: 75, train_loss: 0.9941, test_loss: 1.1595, test_f1: 0.4346
 epoch: 76, train_loss: 0.9906, test_loss: 1.1648, test_f1: 0.4315
 epoch: 77, train_loss: 0.9949, test_loss: 1.1569, test_f1: 0.4388
 epoch: 78, train_loss: 0.9949, test_loss: 1.1452, test_f1: 0.4406
 epoch: 79, train_loss: 0.9856, test_loss: 1.1486, test_f1: 0.4418
 epoch: 80, train_loss: 0.9891, test_loss: 1.1492, test_f1: 0.4258
 epoch: 81, train_loss: 0.9913, test_loss: 1.1394, test_f1: 0.4455
 epoch: 82, train_loss: 0.9966, test_loss: 1.1382, test_f1: 0.4203
 epoch: 83, train_loss: 0.9981, test_loss: 1.1510, test_f1: 0.4254
 epoch: 84, train_loss: 0.9892, test_loss: 1.1528, test_f1: 0.4474
 epoch: 85, train_loss: 0.9877, test_loss: 1.1554, test_f1: 0.4202
 epoch: 86, train_loss: 0.9815, test_loss: 1.1503, test_f1: 0.4202
 epoch: 87, train_loss: 0.9837, test_loss: 1.1499, test_f1: 0.4263
 epoch: 88, train_loss: 0.9840, test_loss: 1.1448, test_f1: 0.4286
 epoch: 89, train_loss: 0.9789, test_loss: 1.1481, test_f1: 0.4258
 epoch: 90, train_loss: 0.9822, test_loss: 1.1490, test_f1: 0.4268
 epoch: 91, train_loss: 0.9769, test_loss: 1.1440, test_f1: 0.4445
 epoch: 92, train_loss: 0.9886, test_loss: 1.1341, test_f1: 0.4638
 epoch: 93, train_loss: 0.9840, test_loss: 1.1364, test_f1: 0.4687
 epoch: 94, train_loss: 0.9810, test_loss: 1.1429, test_f1: 0.4566
 epoch: 95, train_loss: 0.9793, test_loss: 1.1374, test_f1: 0.4420
 epoch: 96, train_loss: 0.9847, test_loss: 1.1343, test_f1: 0.4420
 epoch: 97, train_loss: 0.9787, test_loss: 1.1350, test_f1: 0.4212
 epoch: 98, train_loss: 0.9702, test_loss: 1.1335, test_f1: 0.4258
 epoch: 99, train_loss: 0.9669, test_loss: 1.1351, test_f1: 0.4258
##################ITERATION #1 ****************************************
 epoch: 0, train_loss: 1.3486, test_loss: 1.3611, test_f1: 0.1365
 epoch: 1, train_loss: 1.3127, test_loss: 1.3556, test_f1: 0.1365
 epoch: 2, train_loss: 1.2936, test_loss: 1.3475, test_f1: 0.1365
 epoch: 3, train_loss: 1.2790, test_loss: 1.3394, test_f1: 0.1365
 epoch: 4, train_loss: 1.2593, test_loss: 1.3291, test_f1: 0.1365
 epoch: 5, train_loss: 1.2463, test_loss: 1.3147, test_f1: 0.1365
 epoch: 6, train_loss: 1.2340, test_loss: 1.2968, test_f1: 0.1365
 epoch: 7, train_loss: 1.2231, test_loss: 1.2774, test_f1: 0.1738
 epoch: 8, train_loss: 1.2157, test_loss: 1.2591, test_f1: 0.2009
 epoch: 9, train_loss: 1.1960, test_loss: 1.2460, test_f1: 0.2769
 epoch: 10, train_loss: 1.1871, test_loss: 1.2347, test_f1: 0.2696
 epoch: 11, train_loss: 1.1794, test_loss: 1.2252, test_f1: 0.2913
 epoch: 12, train_loss: 1.1688, test_loss: 1.2140, test_f1: 0.2609
 epoch: 13, train_loss: 1.1591, test_loss: 1.2058, test_f1: 0.2638
 epoch: 14, train_loss: 1.1503, test_loss: 1.2083, test_f1: 0.2644
 epoch: 15, train_loss: 1.1400, test_loss: 1.2135, test_f1: 0.2714
 epoch: 16, train_loss: 1.1297, test_loss: 1.2133, test_f1: 0.2942
 epoch: 17, train_loss: 1.1228, test_loss: 1.2030, test_f1: 0.3204
 epoch: 18, train_loss: 1.1161, test_loss: 1.2020, test_f1: 0.3215
 epoch: 19, train_loss: 1.1133, test_loss: 1.2078, test_f1: 0.3195
 epoch: 20, train_loss: 1.1002, test_loss: 1.2144, test_f1: 0.3160
 epoch: 21, train_loss: 1.0925, test_loss: 1.1939, test_f1: 0.3311
 epoch: 22, train_loss: 1.1007, test_loss: 1.1862, test_f1: 0.3301
 epoch: 23, train_loss: 1.0739, test_loss: 1.1942, test_f1: 0.3549
 epoch: 24, train_loss: 1.0838, test_loss: 1.1814, test_f1: 0.3554
 epoch: 25, train_loss: 1.0715, test_loss: 1.1763, test_f1: 0.3598
 epoch: 26, train_loss: 1.0767, test_loss: 1.1768, test_f1: 0.3626
 epoch: 27, train_loss: 1.0540, test_loss: 1.1747, test_f1: 0.3626
 epoch: 28, train_loss: 1.0602, test_loss: 1.1655, test_f1: 0.3630
 epoch: 29, train_loss: 1.0567, test_loss: 1.1795, test_f1: 0.3673
 epoch: 30, train_loss: 1.0539, test_loss: 1.1888, test_f1: 0.3590
 epoch: 31, train_loss: 1.0457, test_loss: 1.1880, test_f1: 0.3616
 epoch: 32, train_loss: 1.0344, test_loss: 1.1652, test_f1: 0.3644
 epoch: 33, train_loss: 1.0404, test_loss: 1.1532, test_f1: 0.3669
 epoch: 34, train_loss: 1.0246, test_loss: 1.1536, test_f1: 0.3677
 epoch: 35, train_loss: 1.0311, test_loss: 1.1646, test_f1: 0.3625
 epoch: 36, train_loss: 1.0301, test_loss: 1.1590, test_f1: 0.3563
 epoch: 37, train_loss: 1.0237, test_loss: 1.1816, test_f1: 0.3656
 epoch: 38, train_loss: 1.0312, test_loss: 1.1615, test_f1: 0.3702
 epoch: 39, train_loss: 1.0207, test_loss: 1.1696, test_f1: 0.3673
 epoch: 40, train_loss: 1.0213, test_loss: 1.1581, test_f1: 0.3623
 epoch: 41, train_loss: 1.0233, test_loss: 1.1546, test_f1: 0.3348
 epoch: 42, train_loss: 1.0153, test_loss: 1.1534, test_f1: 0.3522
 epoch: 43, train_loss: 1.0099, test_loss: 1.1540, test_f1: 0.3520
 epoch: 44, train_loss: 1.0033, test_loss: 1.1669, test_f1: 0.3522
 epoch: 45, train_loss: 1.0091, test_loss: 1.1397, test_f1: 0.3694
 epoch: 46, train_loss: 1.0066, test_loss: 1.1214, test_f1: 0.3684
 epoch: 47, train_loss: 1.0121, test_loss: 1.1222, test_f1: 0.3728
 epoch: 48, train_loss: 1.0027, test_loss: 1.1637, test_f1: 0.3693
 epoch: 49, train_loss: 1.0054, test_loss: 1.1453, test_f1: 0.3660
 epoch: 50, train_loss: 1.0060, test_loss: 1.1214, test_f1: 0.3617
 epoch: 51, train_loss: 0.9951, test_loss: 1.1346, test_f1: 0.3738
 epoch: 52, train_loss: 1.0014, test_loss: 1.1405, test_f1: 0.3735
 epoch: 53, train_loss: 0.9891, test_loss: 1.1390, test_f1: 0.3735
 epoch: 54, train_loss: 0.9825, test_loss: 1.1389, test_f1: 0.3766
 epoch: 55, train_loss: 0.9883, test_loss: 1.1457, test_f1: 0.3714
 epoch: 56, train_loss: 0.9731, test_loss: 1.1441, test_f1: 0.3755
 epoch: 57, train_loss: 0.9979, test_loss: 1.1332, test_f1: 0.3760
 epoch: 58, train_loss: 0.9948, test_loss: 1.1466, test_f1: 0.3693
 epoch: 59, train_loss: 0.9927, test_loss: 1.1299, test_f1: 0.3753
 epoch: 60, train_loss: 0.9867, test_loss: 1.1275, test_f1: 0.3723
 epoch: 61, train_loss: 0.9854, test_loss: 1.1238, test_f1: 0.3772
 epoch: 62, train_loss: 0.9825, test_loss: 1.1321, test_f1: 0.3755
 epoch: 63, train_loss: 0.9839, test_loss: 1.1434, test_f1: 0.3767
 epoch: 64, train_loss: 0.9853, test_loss: 1.1412, test_f1: 0.3720
 epoch: 65, train_loss: 0.9798, test_loss: 1.1332, test_f1: 0.3766
 epoch: 66, train_loss: 0.9806, test_loss: 1.1236, test_f1: 0.3758
 epoch: 67, train_loss: 0.9793, test_loss: 1.1327, test_f1: 0.3723
 epoch: 68, train_loss: 0.9800, test_loss: 1.1394, test_f1: 0.3760
 epoch: 69, train_loss: 0.9723, test_loss: 1.1291, test_f1: 0.3745
 epoch: 70, train_loss: 0.9755, test_loss: 1.1292, test_f1: 0.3745
 epoch: 71, train_loss: 0.9727, test_loss: 1.1267, test_f1: 0.3753
 epoch: 72, train_loss: 0.9689, test_loss: 1.1348, test_f1: 0.3798
 epoch: 73, train_loss: 0.9797, test_loss: 1.1277, test_f1: 0.3767
 epoch: 74, train_loss: 0.9787, test_loss: 1.1213, test_f1: 0.3881
 epoch: 75, train_loss: 0.9807, test_loss: 1.1197, test_f1: 0.4212
 epoch: 76, train_loss: 0.9741, test_loss: 1.1068, test_f1: 0.3846
 epoch: 77, train_loss: 0.9680, test_loss: 1.1172, test_f1: 0.3787
 epoch: 78, train_loss: 0.9673, test_loss: 1.1266, test_f1: 0.3806
 epoch: 79, train_loss: 0.9665, test_loss: 1.1224, test_f1: 0.3718
 epoch: 80, train_loss: 0.9614, test_loss: 1.1356, test_f1: 0.3779
 epoch: 81, train_loss: 0.9702, test_loss: 1.1302, test_f1: 0.3711
 epoch: 82, train_loss: 0.9694, test_loss: 1.1223, test_f1: 0.3780
 epoch: 83, train_loss: 0.9611, test_loss: 1.1295, test_f1: 0.3862
 epoch: 84, train_loss: 0.9694, test_loss: 1.1329, test_f1: 0.3876
 epoch: 85, train_loss: 0.9732, test_loss: 1.1199, test_f1: 0.3830
 epoch: 86, train_loss: 0.9572, test_loss: 1.1165, test_f1: 0.3846
 epoch: 87, train_loss: 0.9638, test_loss: 1.1257, test_f1: 0.3842
 epoch: 88, train_loss: 0.9612, test_loss: 1.1282, test_f1: 0.4171
 epoch: 89, train_loss: 0.9558, test_loss: 1.1287, test_f1: 0.4269
 epoch: 90, train_loss: 0.9504, test_loss: 1.1319, test_f1: 0.4226
 epoch: 91, train_loss: 0.9579, test_loss: 1.1315, test_f1: 0.3878
 epoch: 92, train_loss: 0.9583, test_loss: 1.1264, test_f1: 0.4031
 epoch: 93, train_loss: 0.9572, test_loss: 1.1329, test_f1: 0.3793
 epoch: 94, train_loss: 0.9516, test_loss: 1.1376, test_f1: 0.3857
 epoch: 95, train_loss: 0.9651, test_loss: 1.1294, test_f1: 0.4205
 epoch: 96, train_loss: 0.9597, test_loss: 1.1305, test_f1: 0.4171
 epoch: 97, train_loss: 0.9522, test_loss: 1.1363, test_f1: 0.3906
 epoch: 98, train_loss: 0.9619, test_loss: 1.1265, test_f1: 0.4015
 epoch: 99, train_loss: 0.9610, test_loss: 1.1443, test_f1: 0.3905
##################ITERATION #2 ****************************************
 epoch: 0, train_loss: 1.2891, test_loss: 1.3250, test_f1: 0.2281
 epoch: 1, train_loss: 1.2487, test_loss: 1.3191, test_f1: 0.1640
 epoch: 2, train_loss: 1.2245, test_loss: 1.3155, test_f1: 0.1365
 epoch: 3, train_loss: 1.2067, test_loss: 1.3137, test_f1: 0.2679
 epoch: 4, train_loss: 1.1860, test_loss: 1.3112, test_f1: 0.3107
 epoch: 5, train_loss: 1.1823, test_loss: 1.3043, test_f1: 0.2583
 epoch: 6, train_loss: 1.1629, test_loss: 1.2923, test_f1: 0.2720
 epoch: 7, train_loss: 1.1513, test_loss: 1.2743, test_f1: 0.3235
 epoch: 8, train_loss: 1.1443, test_loss: 1.2518, test_f1: 0.3288
 epoch: 9, train_loss: 1.1404, test_loss: 1.2338, test_f1: 0.3450
 epoch: 10, train_loss: 1.1337, test_loss: 1.2136, test_f1: 0.3579
 epoch: 11, train_loss: 1.1187, test_loss: 1.2091, test_f1: 0.3538
 epoch: 12, train_loss: 1.1138, test_loss: 1.1995, test_f1: 0.3785
 epoch: 13, train_loss: 1.1121, test_loss: 1.1945, test_f1: 0.3768
 epoch: 14, train_loss: 1.0964, test_loss: 1.1887, test_f1: 0.3823
 epoch: 15, train_loss: 1.1026, test_loss: 1.1886, test_f1: 0.4053
 epoch: 16, train_loss: 1.0870, test_loss: 1.1773, test_f1: 0.4158
 epoch: 17, train_loss: 1.0851, test_loss: 1.1789, test_f1: 0.4165
 epoch: 18, train_loss: 1.0903, test_loss: 1.1838, test_f1: 0.4135
 epoch: 19, train_loss: 1.0745, test_loss: 1.1811, test_f1: 0.3999
 epoch: 20, train_loss: 1.0750, test_loss: 1.1801, test_f1: 0.3927
 epoch: 21, train_loss: 1.0714, test_loss: 1.1862, test_f1: 0.4204
 epoch: 22, train_loss: 1.0619, test_loss: 1.1842, test_f1: 0.4332
 epoch: 23, train_loss: 1.0538, test_loss: 1.1754, test_f1: 0.4325
 epoch: 24, train_loss: 1.0608, test_loss: 1.1708, test_f1: 0.4142
 epoch: 25, train_loss: 1.0497, test_loss: 1.1710, test_f1: 0.4203
 epoch: 26, train_loss: 1.0486, test_loss: 1.1617, test_f1: 0.4146
 epoch: 27, train_loss: 1.0449, test_loss: 1.1651, test_f1: 0.4151
 epoch: 28, train_loss: 1.0370, test_loss: 1.1827, test_f1: 0.4190
 epoch: 29, train_loss: 1.0381, test_loss: 1.1789, test_f1: 0.4166
 epoch: 30, train_loss: 1.0302, test_loss: 1.2040, test_f1: 0.4427
 epoch: 31, train_loss: 1.0300, test_loss: 1.1975, test_f1: 0.4207
 epoch: 32, train_loss: 1.0213, test_loss: 1.1655, test_f1: 0.4275
 epoch: 33, train_loss: 1.0266, test_loss: 1.1677, test_f1: 0.4464
 epoch: 34, train_loss: 1.0056, test_loss: 1.1732, test_f1: 0.4371
 epoch: 35, train_loss: 1.0190, test_loss: 1.1471, test_f1: 0.4275
 epoch: 36, train_loss: 1.0076, test_loss: 1.1590, test_f1: 0.4417
 epoch: 37, train_loss: 1.0185, test_loss: 1.2082, test_f1: 0.4419
 epoch: 38, train_loss: 1.0034, test_loss: 1.1773, test_f1: 0.4462
 epoch: 39, train_loss: 1.0121, test_loss: 1.1548, test_f1: 0.4437
 epoch: 40, train_loss: 1.0070, test_loss: 1.1427, test_f1: 0.4230
 epoch: 41, train_loss: 1.0061, test_loss: 1.1601, test_f1: 0.4393
 epoch: 42, train_loss: 0.9959, test_loss: 1.1792, test_f1: 0.4340
 epoch: 43, train_loss: 0.9963, test_loss: 1.1893, test_f1: 0.4470
 epoch: 44, train_loss: 0.9927, test_loss: 1.1827, test_f1: 0.4472
 epoch: 45, train_loss: 0.9994, test_loss: 1.2201, test_f1: 0.4371
 epoch: 46, train_loss: 0.9942, test_loss: 1.2058, test_f1: 0.4476
 epoch: 47, train_loss: 0.9921, test_loss: 1.1920, test_f1: 0.4386
 epoch: 48, train_loss: 0.9760, test_loss: 1.1395, test_f1: 0.4357
 epoch: 49, train_loss: 0.9838, test_loss: 1.1314, test_f1: 0.4242
 epoch: 50, train_loss: 0.9748, test_loss: 1.1584, test_f1: 0.4240
 epoch: 51, train_loss: 0.9708, test_loss: 1.1677, test_f1: 0.4144
 epoch: 52, train_loss: 0.9757, test_loss: 1.1371, test_f1: 0.4202
 epoch: 53, train_loss: 0.9647, test_loss: 1.1419, test_f1: 0.4414
 epoch: 54, train_loss: 0.9663, test_loss: 1.1465, test_f1: 0.4429
 epoch: 55, train_loss: 0.9751, test_loss: 1.1546, test_f1: 0.4311
 epoch: 56, train_loss: 0.9667, test_loss: 1.1563, test_f1: 0.4369
 epoch: 57, train_loss: 0.9627, test_loss: 1.1637, test_f1: 0.4380
 epoch: 58, train_loss: 0.9662, test_loss: 1.1457, test_f1: 0.4385
 epoch: 59, train_loss: 0.9588, test_loss: 1.1337, test_f1: 0.4385
 epoch: 60, train_loss: 0.9646, test_loss: 1.1541, test_f1: 0.4404
 epoch: 61, train_loss: 0.9673, test_loss: 1.1568, test_f1: 0.4335
 epoch: 62, train_loss: 0.9607, test_loss: 1.1486, test_f1: 0.4330
 epoch: 63, train_loss: 0.9555, test_loss: 1.1434, test_f1: 0.4373
 epoch: 64, train_loss: 0.9596, test_loss: 1.1430, test_f1: 0.4326
 epoch: 65, train_loss: 0.9576, test_loss: 1.1449, test_f1: 0.4302
 epoch: 66, train_loss: 0.9497, test_loss: 1.1706, test_f1: 0.4345
 epoch: 67, train_loss: 0.9537, test_loss: 1.1668, test_f1: 0.4246
 epoch: 68, train_loss: 0.9641, test_loss: 1.1669, test_f1: 0.4383
 epoch: 69, train_loss: 0.9618, test_loss: 1.1681, test_f1: 0.4409
 epoch: 70, train_loss: 0.9501, test_loss: 1.1530, test_f1: 0.4305
 epoch: 71, train_loss: 0.9501, test_loss: 1.1275, test_f1: 0.4255
 epoch: 72, train_loss: 0.9579, test_loss: 1.1375, test_f1: 0.4389
 epoch: 73, train_loss: 0.9544, test_loss: 1.1203, test_f1: 0.4210
 epoch: 74, train_loss: 0.9496, test_loss: 1.1364, test_f1: 0.4401
 epoch: 75, train_loss: 0.9484, test_loss: 1.1396, test_f1: 0.4337
 epoch: 76, train_loss: 0.9446, test_loss: 1.1341, test_f1: 0.4206
 epoch: 77, train_loss: 0.9515, test_loss: 1.1316, test_f1: 0.4297
 epoch: 78, train_loss: 0.9508, test_loss: 1.1670, test_f1: 0.4246
 epoch: 79, train_loss: 0.9456, test_loss: 1.1529, test_f1: 0.4374
 epoch: 80, train_loss: 0.9542, test_loss: 1.1231, test_f1: 0.4319
 epoch: 81, train_loss: 0.9501, test_loss: 1.1440, test_f1: 0.4334
 epoch: 82, train_loss: 0.9295, test_loss: 1.1748, test_f1: 0.4303
 epoch: 83, train_loss: 0.9447, test_loss: 1.1731, test_f1: 0.4262
 epoch: 84, train_loss: 0.9452, test_loss: 1.1569, test_f1: 0.4203
 epoch: 85, train_loss: 0.9419, test_loss: 1.1393, test_f1: 0.4305
 epoch: 86, train_loss: 0.9387, test_loss: 1.1434, test_f1: 0.4468
 epoch: 87, train_loss: 0.9385, test_loss: 1.1595, test_f1: 0.4367
 epoch: 88, train_loss: 0.9365, test_loss: 1.1598, test_f1: 0.4427
 epoch: 89, train_loss: 0.9392, test_loss: 1.1460, test_f1: 0.4502
 epoch: 90, train_loss: 0.9319, test_loss: 1.1165, test_f1: 0.4378
 epoch: 91, train_loss: 0.9337, test_loss: 1.1367, test_f1: 0.4345
 epoch: 92, train_loss: 0.9353, test_loss: 1.1524, test_f1: 0.4209
 epoch: 93, train_loss: 0.9325, test_loss: 1.1407, test_f1: 0.4276
 epoch: 94, train_loss: 0.9316, test_loss: 1.1475, test_f1: 0.4148
 epoch: 95, train_loss: 0.9187, test_loss: 1.1489, test_f1: 0.4494
 epoch: 96, train_loss: 0.9365, test_loss: 1.1439, test_f1: 0.4382
 epoch: 97, train_loss: 0.9328, test_loss: 1.1521, test_f1: 0.4340
 epoch: 98, train_loss: 0.9236, test_loss: 1.1703, test_f1: 0.4356
 epoch: 99, train_loss: 0.9275, test_loss: 1.1233, test_f1: 0.4396
##################ITERATION #3 ****************************************
 epoch: 0, train_loss: 1.2831, test_loss: 1.3118, test_f1: 0.2281
 epoch: 1, train_loss: 1.2393, test_loss: 1.3094, test_f1: 0.2281
 epoch: 2, train_loss: 1.2270, test_loss: 1.3057, test_f1: 0.2281
 epoch: 3, train_loss: 1.2062, test_loss: 1.2988, test_f1: 0.2281
 epoch: 4, train_loss: 1.1975, test_loss: 1.2897, test_f1: 0.2281
 epoch: 5, train_loss: 1.1870, test_loss: 1.2780, test_f1: 0.2281
 epoch: 6, train_loss: 1.1803, test_loss: 1.2640, test_f1: 0.2336
 epoch: 7, train_loss: 1.1569, test_loss: 1.2504, test_f1: 0.2390
 epoch: 8, train_loss: 1.1472, test_loss: 1.2432, test_f1: 0.2828
 epoch: 9, train_loss: 1.1383, test_loss: 1.2356, test_f1: 0.2967
 epoch: 10, train_loss: 1.1366, test_loss: 1.2263, test_f1: 0.3005
 epoch: 11, train_loss: 1.1345, test_loss: 1.2214, test_f1: 0.3351
 epoch: 12, train_loss: 1.1231, test_loss: 1.2163, test_f1: 0.3566
 epoch: 13, train_loss: 1.1187, test_loss: 1.2105, test_f1: 0.3563
 epoch: 14, train_loss: 1.1151, test_loss: 1.2092, test_f1: 0.3612
 epoch: 15, train_loss: 1.0962, test_loss: 1.2032, test_f1: 0.3650
 epoch: 16, train_loss: 1.0969, test_loss: 1.1950, test_f1: 0.3787
 epoch: 17, train_loss: 1.0884, test_loss: 1.2073, test_f1: 0.3759
 epoch: 18, train_loss: 1.0859, test_loss: 1.1907, test_f1: 0.3832
 epoch: 19, train_loss: 1.0715, test_loss: 1.1842, test_f1: 0.3883
 epoch: 20, train_loss: 1.0727, test_loss: 1.1808, test_f1: 0.3857
 epoch: 21, train_loss: 1.0659, test_loss: 1.1686, test_f1: 0.3952
 epoch: 22, train_loss: 1.0659, test_loss: 1.1663, test_f1: 0.4148
 epoch: 23, train_loss: 1.0623, test_loss: 1.1825, test_f1: 0.4176
 epoch: 24, train_loss: 1.0528, test_loss: 1.1731, test_f1: 0.4249
 epoch: 25, train_loss: 1.0521, test_loss: 1.1824, test_f1: 0.4172
 epoch: 26, train_loss: 1.0410, test_loss: 1.1653, test_f1: 0.4174
 epoch: 27, train_loss: 1.0452, test_loss: 1.1561, test_f1: 0.4210
 epoch: 28, train_loss: 1.0307, test_loss: 1.1755, test_f1: 0.4126
 epoch: 29, train_loss: 1.0272, test_loss: 1.1690, test_f1: 0.4197
 epoch: 30, train_loss: 1.0236, test_loss: 1.1544, test_f1: 0.4313
 epoch: 31, train_loss: 1.0221, test_loss: 1.1858, test_f1: 0.4280
 epoch: 32, train_loss: 1.0172, test_loss: 1.1993, test_f1: 0.4308
 epoch: 33, train_loss: 1.0232, test_loss: 1.2338, test_f1: 0.4088
 epoch: 34, train_loss: 1.0100, test_loss: 1.1737, test_f1: 0.4152
 epoch: 35, train_loss: 1.0115, test_loss: 1.1545, test_f1: 0.4214
 epoch: 36, train_loss: 0.9973, test_loss: 1.1583, test_f1: 0.4184
 epoch: 37, train_loss: 1.0069, test_loss: 1.1800, test_f1: 0.4287
 epoch: 38, train_loss: 0.9903, test_loss: 1.1934, test_f1: 0.4307
 epoch: 39, train_loss: 0.9976, test_loss: 1.4451, test_f1: 0.3851
 epoch: 40, train_loss: 1.0128, test_loss: 1.2338, test_f1: 0.4190
 epoch: 41, train_loss: 1.0067, test_loss: 1.3646, test_f1: 0.3807
 epoch: 42, train_loss: 1.0001, test_loss: 1.2097, test_f1: 0.4322
 epoch: 43, train_loss: 1.0058, test_loss: 1.1697, test_f1: 0.4471
 epoch: 44, train_loss: 0.9856, test_loss: 1.1711, test_f1: 0.4414
 epoch: 45, train_loss: 0.9844, test_loss: 1.1714, test_f1: 0.4412
 epoch: 46, train_loss: 0.9869, test_loss: 1.1728, test_f1: 0.4460
 epoch: 47, train_loss: 0.9908, test_loss: 1.1747, test_f1: 0.4462
 epoch: 48, train_loss: 0.9821, test_loss: 1.1808, test_f1: 0.4493
 epoch: 49, train_loss: 0.9707, test_loss: 1.1922, test_f1: 0.4444
 epoch: 50, train_loss: 0.9778, test_loss: 1.1876, test_f1: 0.4459
 epoch: 51, train_loss: 0.9737, test_loss: 1.1808, test_f1: 0.4487
 epoch: 52, train_loss: 0.9709, test_loss: 1.1781, test_f1: 0.4397
 epoch: 53, train_loss: 0.9714, test_loss: 1.1842, test_f1: 0.4537
 epoch: 54, train_loss: 0.9686, test_loss: 1.1813, test_f1: 0.4494
 epoch: 55, train_loss: 0.9776, test_loss: 1.1933, test_f1: 0.4429
 epoch: 56, train_loss: 0.9761, test_loss: 1.1878, test_f1: 0.4459
 epoch: 57, train_loss: 0.9555, test_loss: 1.1857, test_f1: 0.4366
 epoch: 58, train_loss: 0.9588, test_loss: 1.1968, test_f1: 0.4518
 epoch: 59, train_loss: 0.9555, test_loss: 1.1889, test_f1: 0.4515
 epoch: 60, train_loss: 0.9621, test_loss: 1.1837, test_f1: 0.4469
 epoch: 61, train_loss: 0.9663, test_loss: 1.1819, test_f1: 0.4504
 epoch: 62, train_loss: 0.9609, test_loss: 1.1943, test_f1: 0.4450
 epoch: 63, train_loss: 0.9528, test_loss: 1.1800, test_f1: 0.4510
 epoch: 64, train_loss: 0.9484, test_loss: 1.1822, test_f1: 0.4552
 epoch: 65, train_loss: 0.9624, test_loss: 1.1932, test_f1: 0.4658
 epoch: 66, train_loss: 0.9683, test_loss: 1.2097, test_f1: 0.4510
 epoch: 67, train_loss: 0.9672, test_loss: 1.2331, test_f1: 0.4371
 epoch: 68, train_loss: 0.9676, test_loss: 1.2053, test_f1: 0.4453
 epoch: 69, train_loss: 0.9598, test_loss: 1.1983, test_f1: 0.4587
 epoch: 70, train_loss: 0.9540, test_loss: 1.2110, test_f1: 0.4548
 epoch: 71, train_loss: 0.9593, test_loss: 1.1975, test_f1: 0.4574
 epoch: 72, train_loss: 0.9541, test_loss: 1.1710, test_f1: 0.4457
 epoch: 73, train_loss: 0.9555, test_loss: 1.1706, test_f1: 0.4471
 epoch: 74, train_loss: 0.9545, test_loss: 1.1874, test_f1: 0.4495
 epoch: 75, train_loss: 0.9733, test_loss: 1.1673, test_f1: 0.4551
 epoch: 76, train_loss: 0.9469, test_loss: 1.1757, test_f1: 0.4530
 epoch: 77, train_loss: 0.9383, test_loss: 1.1861, test_f1: 0.4474
 epoch: 78, train_loss: 0.9429, test_loss: 1.1954, test_f1: 0.4448
 epoch: 79, train_loss: 0.9467, test_loss: 1.1894, test_f1: 0.4543
 epoch: 80, train_loss: 0.9500, test_loss: 1.1845, test_f1: 0.4493
 epoch: 81, train_loss: 0.9455, test_loss: 1.1793, test_f1: 0.4436
 epoch: 82, train_loss: 0.9438, test_loss: 1.1686, test_f1: 0.4447
 epoch: 83, train_loss: 0.9530, test_loss: 1.1794, test_f1: 0.4498
 epoch: 84, train_loss: 0.9378, test_loss: 1.1825, test_f1: 0.4481
 epoch: 85, train_loss: 0.9431, test_loss: 1.1723, test_f1: 0.4500
 epoch: 86, train_loss: 0.9291, test_loss: 1.1776, test_f1: 0.4438
 epoch: 87, train_loss: 0.9348, test_loss: 1.1712, test_f1: 0.4526
 epoch: 88, train_loss: 0.9436, test_loss: 1.1704, test_f1: 0.4578
 epoch: 89, train_loss: 0.9437, test_loss: 1.1738, test_f1: 0.4436
 epoch: 90, train_loss: 0.9407, test_loss: 1.1772, test_f1: 0.4692
 epoch: 91, train_loss: 0.9332, test_loss: 1.1774, test_f1: 0.4682
 epoch: 92, train_loss: 0.9398, test_loss: 1.2761, test_f1: 0.4285
 epoch: 93, train_loss: 0.9679, test_loss: 1.2024, test_f1: 0.4758
 epoch: 94, train_loss: 0.9306, test_loss: 1.2036, test_f1: 0.4832
 epoch: 95, train_loss: 0.9395, test_loss: 1.1750, test_f1: 0.4561
 epoch: 96, train_loss: 0.9421, test_loss: 1.1827, test_f1: 0.4451
 epoch: 97, train_loss: 0.9354, test_loss: 1.1981, test_f1: 0.4560
 epoch: 98, train_loss: 0.9317, test_loss: 1.2013, test_f1: 0.4639
 epoch: 99, train_loss: 0.9297, test_loss: 1.1960, test_f1: 0.4726
##################ITERATION #4 ****************************************
 epoch: 0, train_loss: 1.3674, test_loss: 1.3180, test_f1: 0.2281
 epoch: 1, train_loss: 1.2698, test_loss: 1.3127, test_f1: 0.2281
 epoch: 2, train_loss: 1.2408, test_loss: 1.3069, test_f1: 0.2281
 epoch: 3, train_loss: 1.2247, test_loss: 1.2984, test_f1: 0.2281
 epoch: 4, train_loss: 1.1961, test_loss: 1.2835, test_f1: 0.2281
 epoch: 5, train_loss: 1.1848, test_loss: 1.2665, test_f1: 0.2336
 epoch: 6, train_loss: 1.1752, test_loss: 1.2516, test_f1: 0.2336
 epoch: 7, train_loss: 1.1527, test_loss: 1.2392, test_f1: 0.2492
 epoch: 8, train_loss: 1.1370, test_loss: 1.2272, test_f1: 0.2526
 epoch: 9, train_loss: 1.1377, test_loss: 1.2192, test_f1: 0.2570
 epoch: 10, train_loss: 1.1141, test_loss: 1.2139, test_f1: 0.2556
 epoch: 11, train_loss: 1.1127, test_loss: 1.2058, test_f1: 0.2960
 epoch: 12, train_loss: 1.1168, test_loss: 1.1978, test_f1: 0.3037
 epoch: 13, train_loss: 1.0918, test_loss: 1.1910, test_f1: 0.3353
 epoch: 14, train_loss: 1.0823, test_loss: 1.1868, test_f1: 0.4003
 epoch: 15, train_loss: 1.0785, test_loss: 1.1793, test_f1: 0.4119
 epoch: 16, train_loss: 1.0809, test_loss: 1.1726, test_f1: 0.4226
 epoch: 17, train_loss: 1.0786, test_loss: 1.1732, test_f1: 0.4210
 epoch: 18, train_loss: 1.0618, test_loss: 1.1783, test_f1: 0.4236
 epoch: 19, train_loss: 1.0642, test_loss: 1.1727, test_f1: 0.4181
 epoch: 20, train_loss: 1.0534, test_loss: 1.1841, test_f1: 0.4420
 epoch: 21, train_loss: 1.0558, test_loss: 1.2041, test_f1: 0.4419
 epoch: 22, train_loss: 1.0661, test_loss: 1.1983, test_f1: 0.4453
 epoch: 23, train_loss: 1.0440, test_loss: 1.1927, test_f1: 0.4211
 epoch: 24, train_loss: 1.0465, test_loss: 1.1622, test_f1: 0.4185
 epoch: 25, train_loss: 1.0350, test_loss: 1.1707, test_f1: 0.4113
 epoch: 26, train_loss: 1.0273, test_loss: 1.1660, test_f1: 0.4213
 epoch: 27, train_loss: 1.0210, test_loss: 1.1607, test_f1: 0.4154
 epoch: 28, train_loss: 1.0240, test_loss: 1.1751, test_f1: 0.4353
 epoch: 29, train_loss: 1.0207, test_loss: 1.1714, test_f1: 0.4449
 epoch: 30, train_loss: 1.0179, test_loss: 1.1556, test_f1: 0.4284
 epoch: 31, train_loss: 1.0209, test_loss: 1.1560, test_f1: 0.4065
 epoch: 32, train_loss: 1.0133, test_loss: 1.1654, test_f1: 0.4179
 epoch: 33, train_loss: 1.0093, test_loss: 1.1585, test_f1: 0.4305
 epoch: 34, train_loss: 1.0123, test_loss: 1.1600, test_f1: 0.4398
 epoch: 35, train_loss: 1.0124, test_loss: 1.1520, test_f1: 0.4427
 epoch: 36, train_loss: 1.0105, test_loss: 1.1716, test_f1: 0.4374
 epoch: 37, train_loss: 1.0090, test_loss: 1.1690, test_f1: 0.4420
 epoch: 38, train_loss: 1.0038, test_loss: 1.1696, test_f1: 0.4399
 epoch: 39, train_loss: 0.9983, test_loss: 1.1731, test_f1: 0.4387
 epoch: 40, train_loss: 0.9931, test_loss: 1.1588, test_f1: 0.4424
 epoch: 41, train_loss: 1.0004, test_loss: 1.1525, test_f1: 0.4236
 epoch: 42, train_loss: 0.9836, test_loss: 1.1458, test_f1: 0.4182
 epoch: 43, train_loss: 0.9917, test_loss: 1.1501, test_f1: 0.4164
 epoch: 44, train_loss: 0.9828, test_loss: 1.1774, test_f1: 0.4434
 epoch: 45, train_loss: 0.9945, test_loss: 1.1664, test_f1: 0.4496
 epoch: 46, train_loss: 0.9803, test_loss: 1.1338, test_f1: 0.4472
 epoch: 47, train_loss: 0.9717, test_loss: 1.1738, test_f1: 0.4471
 epoch: 48, train_loss: 0.9712, test_loss: 1.1821, test_f1: 0.4403
 epoch: 49, train_loss: 0.9804, test_loss: 1.1626, test_f1: 0.4600
 epoch: 50, train_loss: 0.9761, test_loss: 1.1325, test_f1: 0.4311
 epoch: 51, train_loss: 0.9811, test_loss: 1.1453, test_f1: 0.4271
 epoch: 52, train_loss: 0.9689, test_loss: 1.1627, test_f1: 0.4293
 epoch: 53, train_loss: 0.9684, test_loss: 1.1659, test_f1: 0.4318
 epoch: 54, train_loss: 0.9678, test_loss: 1.1601, test_f1: 0.4353
 epoch: 55, train_loss: 0.9723, test_loss: 1.1470, test_f1: 0.4232
 epoch: 56, train_loss: 0.9658, test_loss: 1.1436, test_f1: 0.4198
 epoch: 57, train_loss: 0.9687, test_loss: 1.1404, test_f1: 0.4247
 epoch: 58, train_loss: 0.9611, test_loss: 1.1496, test_f1: 0.4300
 epoch: 59, train_loss: 0.9549, test_loss: 1.1544, test_f1: 0.4310
 epoch: 60, train_loss: 0.9631, test_loss: 1.1701, test_f1: 0.4488
 epoch: 61, train_loss: 0.9603, test_loss: 1.1620, test_f1: 0.4386
 epoch: 62, train_loss: 0.9594, test_loss: 1.1446, test_f1: 0.4378
 epoch: 63, train_loss: 0.9578, test_loss: 1.1530, test_f1: 0.4393
 epoch: 64, train_loss: 0.9544, test_loss: 1.1676, test_f1: 0.4398
 epoch: 65, train_loss: 0.9685, test_loss: 1.1772, test_f1: 0.4510
 epoch: 66, train_loss: 0.9531, test_loss: 1.1576, test_f1: 0.4349
 epoch: 67, train_loss: 0.9617, test_loss: 1.1508, test_f1: 0.4390
 epoch: 68, train_loss: 0.9547, test_loss: 1.1597, test_f1: 0.4415
 epoch: 69, train_loss: 0.9596, test_loss: 1.1706, test_f1: 0.4541
 epoch: 70, train_loss: 0.9543, test_loss: 1.1564, test_f1: 0.4435
 epoch: 71, train_loss: 0.9457, test_loss: 1.1439, test_f1: 0.4487
 epoch: 72, train_loss: 0.9464, test_loss: 1.1602, test_f1: 0.4443
 epoch: 73, train_loss: 0.9488, test_loss: 1.1741, test_f1: 0.4631
 epoch: 74, train_loss: 0.9477, test_loss: 1.1553, test_f1: 0.4382
 epoch: 75, train_loss: 0.9419, test_loss: 1.1474, test_f1: 0.4493
 epoch: 76, train_loss: 0.9460, test_loss: 1.1440, test_f1: 0.4456
 epoch: 77, train_loss: 0.9481, test_loss: 1.1605, test_f1: 0.4487
 epoch: 78, train_loss: 0.9450, test_loss: 1.1474, test_f1: 0.4615
 epoch: 79, train_loss: 0.9365, test_loss: 1.1643, test_f1: 0.4533
 epoch: 80, train_loss: 0.9402, test_loss: 1.1705, test_f1: 0.4614
 epoch: 81, train_loss: 0.9402, test_loss: 1.1546, test_f1: 0.4512
 epoch: 82, train_loss: 0.9403, test_loss: 1.1381, test_f1: 0.4656
 epoch: 83, train_loss: 0.9433, test_loss: 1.1421, test_f1: 0.4559
 epoch: 84, train_loss: 0.9336, test_loss: 1.1533, test_f1: 0.4348
 epoch: 85, train_loss: 0.9379, test_loss: 1.1564, test_f1: 0.4321
 epoch: 86, train_loss: 0.9343, test_loss: 1.1661, test_f1: 0.4387
 epoch: 87, train_loss: 0.9374, test_loss: 1.1673, test_f1: 0.4415
 epoch: 88, train_loss: 0.9265, test_loss: 1.1600, test_f1: 0.4399
 epoch: 89, train_loss: 0.9356, test_loss: 1.1653, test_f1: 0.4428
 epoch: 90, train_loss: 0.9403, test_loss: 1.1548, test_f1: 0.4590
 epoch: 91, train_loss: 0.9298, test_loss: 1.1669, test_f1: 0.4564
 epoch: 92, train_loss: 0.9368, test_loss: 1.1602, test_f1: 0.4487
 epoch: 93, train_loss: 0.9355, test_loss: 1.1708, test_f1: 0.4509
 epoch: 94, train_loss: 0.9198, test_loss: 1.1812, test_f1: 0.4743
 epoch: 95, train_loss: 0.9304, test_loss: 1.1787, test_f1: 0.4625
 epoch: 96, train_loss: 0.9196, test_loss: 1.1524, test_f1: 0.4515
 epoch: 97, train_loss: 0.9293, test_loss: 1.1630, test_f1: 0.4865
 epoch: 98, train_loss: 0.9301, test_loss: 1.1733, test_f1: 0.4760
 epoch: 99, train_loss: 0.9152, test_loss: 1.1628, test_f1: 0.4718
##################ITERATION #5 ****************************************
 epoch: 0, train_loss: 1.3349, test_loss: 1.3259, test_f1: 0.2281
 epoch: 1, train_loss: 1.2636, test_loss: 1.3237, test_f1: 0.2281
 epoch: 2, train_loss: 1.2426, test_loss: 1.3137, test_f1: 0.2281
 epoch: 3, train_loss: 1.2279, test_loss: 1.2975, test_f1: 0.2281
 epoch: 4, train_loss: 1.2139, test_loss: 1.2735, test_f1: 0.2281
 epoch: 5, train_loss: 1.1912, test_loss: 1.2524, test_f1: 0.2583
 epoch: 6, train_loss: 1.1780, test_loss: 1.2373, test_f1: 0.2641
 epoch: 7, train_loss: 1.1646, test_loss: 1.2224, test_f1: 0.3183
 epoch: 8, train_loss: 1.1533, test_loss: 1.2022, test_f1: 0.3337
 epoch: 9, train_loss: 1.1396, test_loss: 1.1862, test_f1: 0.3897
 epoch: 10, train_loss: 1.1349, test_loss: 1.1735, test_f1: 0.3967
 epoch: 11, train_loss: 1.1252, test_loss: 1.1639, test_f1: 0.4096
 epoch: 12, train_loss: 1.1130, test_loss: 1.1542, test_f1: 0.4243
 epoch: 13, train_loss: 1.1093, test_loss: 1.1520, test_f1: 0.4096
 epoch: 14, train_loss: 1.0886, test_loss: 1.1483, test_f1: 0.4040
 epoch: 15, train_loss: 1.0785, test_loss: 1.1438, test_f1: 0.4042
 epoch: 16, train_loss: 1.0672, test_loss: 1.1403, test_f1: 0.4066
 epoch: 17, train_loss: 1.0724, test_loss: 1.1384, test_f1: 0.4163
 epoch: 18, train_loss: 1.0656, test_loss: 1.1344, test_f1: 0.4134
 epoch: 19, train_loss: 1.0589, test_loss: 1.1329, test_f1: 0.4157
 epoch: 20, train_loss: 1.0537, test_loss: 1.1331, test_f1: 0.4017
 epoch: 21, train_loss: 1.0510, test_loss: 1.1311, test_f1: 0.4017
 epoch: 22, train_loss: 1.0426, test_loss: 1.1300, test_f1: 0.4016
 epoch: 23, train_loss: 1.0470, test_loss: 1.1253, test_f1: 0.4019
 epoch: 24, train_loss: 1.0310, test_loss: 1.1244, test_f1: 0.3981
 epoch: 25, train_loss: 1.0314, test_loss: 1.1264, test_f1: 0.4001
 epoch: 26, train_loss: 1.0179, test_loss: 1.1230, test_f1: 0.4067
 epoch: 27, train_loss: 1.0161, test_loss: 1.1264, test_f1: 0.4004
 epoch: 28, train_loss: 1.0310, test_loss: 1.1250, test_f1: 0.4004
 epoch: 29, train_loss: 1.0080, test_loss: 1.1276, test_f1: 0.4175
 epoch: 30, train_loss: 1.0072, test_loss: 1.1274, test_f1: 0.4236
 epoch: 31, train_loss: 1.0103, test_loss: 1.1168, test_f1: 0.4185
 epoch: 32, train_loss: 1.0123, test_loss: 1.1120, test_f1: 0.4100
 epoch: 33, train_loss: 1.0023, test_loss: 1.1112, test_f1: 0.4007
 epoch: 34, train_loss: 1.0153, test_loss: 1.1140, test_f1: 0.4277
 epoch: 35, train_loss: 0.9951, test_loss: 1.1081, test_f1: 0.4083
 epoch: 36, train_loss: 1.0057, test_loss: 1.1041, test_f1: 0.4086
 epoch: 37, train_loss: 0.9908, test_loss: 1.1024, test_f1: 0.4086
 epoch: 38, train_loss: 0.9943, test_loss: 1.1040, test_f1: 0.4108
 epoch: 39, train_loss: 0.9887, test_loss: 1.1098, test_f1: 0.4132
 epoch: 40, train_loss: 0.9942, test_loss: 1.1084, test_f1: 0.4025
 epoch: 41, train_loss: 0.9819, test_loss: 1.1147, test_f1: 0.4057
 epoch: 42, train_loss: 0.9921, test_loss: 1.1104, test_f1: 0.4213
 epoch: 43, train_loss: 0.9807, test_loss: 1.1079, test_f1: 0.4226
 epoch: 44, train_loss: 0.9838, test_loss: 1.1093, test_f1: 0.4200
 epoch: 45, train_loss: 0.9766, test_loss: 1.1142, test_f1: 0.4218
 epoch: 46, train_loss: 0.9808, test_loss: 1.1129, test_f1: 0.4188
 epoch: 47, train_loss: 0.9755, test_loss: 1.1097, test_f1: 0.4172
 epoch: 48, train_loss: 0.9682, test_loss: 1.1051, test_f1: 0.4255
 epoch: 49, train_loss: 0.9777, test_loss: 1.1104, test_f1: 0.4203
 epoch: 50, train_loss: 0.9617, test_loss: 1.1156, test_f1: 0.4230
 epoch: 51, train_loss: 0.9762, test_loss: 1.1133, test_f1: 0.4198
 epoch: 52, train_loss: 0.9729, test_loss: 1.1140, test_f1: 0.4187
 epoch: 53, train_loss: 0.9645, test_loss: 1.1107, test_f1: 0.4189
 epoch: 54, train_loss: 0.9661, test_loss: 1.1143, test_f1: 0.4247
 epoch: 55, train_loss: 0.9643, test_loss: 1.1142, test_f1: 0.4247
 epoch: 56, train_loss: 0.9676, test_loss: 1.1101, test_f1: 0.4251
 epoch: 57, train_loss: 0.9633, test_loss: 1.1065, test_f1: 0.4191
 epoch: 58, train_loss: 0.9570, test_loss: 1.1055, test_f1: 0.4324
 epoch: 59, train_loss: 0.9637, test_loss: 1.1034, test_f1: 0.4253
 epoch: 60, train_loss: 0.9607, test_loss: 1.0982, test_f1: 0.4248
 epoch: 61, train_loss: 0.9528, test_loss: 1.0944, test_f1: 0.4227
 epoch: 62, train_loss: 0.9612, test_loss: 1.0903, test_f1: 0.4237
 epoch: 63, train_loss: 0.9586, test_loss: 1.0944, test_f1: 0.4272
 epoch: 64, train_loss: 0.9693, test_loss: 1.0995, test_f1: 0.4211
 epoch: 65, train_loss: 0.9537, test_loss: 1.0936, test_f1: 0.4310
 epoch: 66, train_loss: 0.9541, test_loss: 1.0925, test_f1: 0.4248
 epoch: 67, train_loss: 0.9489, test_loss: 1.0983, test_f1: 0.4407
 epoch: 68, train_loss: 0.9541, test_loss: 1.0989, test_f1: 0.4289
 epoch: 69, train_loss: 0.9573, test_loss: 1.0928, test_f1: 0.4345
 epoch: 70, train_loss: 0.9487, test_loss: 1.0925, test_f1: 0.4323
 epoch: 71, train_loss: 0.9592, test_loss: 1.0909, test_f1: 0.4320
 epoch: 72, train_loss: 0.9554, test_loss: 1.0930, test_f1: 0.4214
 epoch: 73, train_loss: 0.9480, test_loss: 1.0947, test_f1: 0.4272
 epoch: 74, train_loss: 0.9525, test_loss: 1.1012, test_f1: 0.4244
 epoch: 75, train_loss: 0.9509, test_loss: 1.1049, test_f1: 0.4282
 epoch: 76, train_loss: 0.9397, test_loss: 1.1040, test_f1: 0.4224
 epoch: 77, train_loss: 0.9508, test_loss: 1.1074, test_f1: 0.4228
 epoch: 78, train_loss: 0.9468, test_loss: 1.1074, test_f1: 0.4228
 epoch: 79, train_loss: 0.9360, test_loss: 1.0992, test_f1: 0.4291
 epoch: 80, train_loss: 0.9444, test_loss: 1.0965, test_f1: 0.4328
 epoch: 81, train_loss: 0.9431, test_loss: 1.0925, test_f1: 0.4401
 epoch: 82, train_loss: 0.9454, test_loss: 1.0947, test_f1: 0.4300
 epoch: 83, train_loss: 0.9410, test_loss: 1.1003, test_f1: 0.4360
 epoch: 84, train_loss: 0.9391, test_loss: 1.1013, test_f1: 0.4346
 epoch: 85, train_loss: 0.9408, test_loss: 1.1029, test_f1: 0.4346
 epoch: 86, train_loss: 0.9487, test_loss: 1.1107, test_f1: 0.4260
 epoch: 87, train_loss: 0.9430, test_loss: 1.1082, test_f1: 0.4374
 epoch: 88, train_loss: 0.9438, test_loss: 1.1071, test_f1: 0.4403
 epoch: 89, train_loss: 0.9480, test_loss: 1.0983, test_f1: 0.4359
 epoch: 90, train_loss: 0.9374, test_loss: 1.1007, test_f1: 0.4354
 epoch: 91, train_loss: 0.9407, test_loss: 1.1042, test_f1: 0.4272
 epoch: 92, train_loss: 0.9315, test_loss: 1.1043, test_f1: 0.4351
 epoch: 93, train_loss: 0.9385, test_loss: 1.1012, test_f1: 0.4350
 epoch: 94, train_loss: 0.9342, test_loss: 1.1024, test_f1: 0.4413
 epoch: 95, train_loss: 0.9316, test_loss: 1.1062, test_f1: 0.4385
 epoch: 96, train_loss: 0.9294, test_loss: 1.1102, test_f1: 0.4399
 epoch: 97, train_loss: 0.9296, test_loss: 1.1173, test_f1: 0.4403
 epoch: 98, train_loss: 0.9193, test_loss: 1.1162, test_f1: 0.4399
 epoch: 99, train_loss: 0.9323, test_loss: 1.1076, test_f1: 0.4350
##################ITERATION #6 ****************************************
 epoch: 0, train_loss: 1.4366, test_loss: 1.3297, test_f1: 0.2281
 epoch: 1, train_loss: 1.2996, test_loss: 1.3159, test_f1: 0.2281
 epoch: 2, train_loss: 1.2749, test_loss: 1.3107, test_f1: 0.2281
 epoch: 3, train_loss: 1.2532, test_loss: 1.3049, test_f1: 0.2281
 epoch: 4, train_loss: 1.2325, test_loss: 1.2906, test_f1: 0.2281
 epoch: 5, train_loss: 1.2242, test_loss: 1.2736, test_f1: 0.2281
 epoch: 6, train_loss: 1.2072, test_loss: 1.2594, test_f1: 0.2583
 epoch: 7, train_loss: 1.1832, test_loss: 1.2489, test_f1: 0.2829
 epoch: 8, train_loss: 1.1922, test_loss: 1.2361, test_f1: 0.2829
 epoch: 9, train_loss: 1.1629, test_loss: 1.2097, test_f1: 0.2980
 epoch: 10, train_loss: 1.1458, test_loss: 1.1947, test_f1: 0.3194
 epoch: 11, train_loss: 1.1290, test_loss: 1.1858, test_f1: 0.3309
 epoch: 12, train_loss: 1.1096, test_loss: 1.1722, test_f1: 0.3444
 epoch: 13, train_loss: 1.0938, test_loss: 1.1634, test_f1: 0.3981
 epoch: 14, train_loss: 1.0962, test_loss: 1.1532, test_f1: 0.4096
 epoch: 15, train_loss: 1.0844, test_loss: 1.1422, test_f1: 0.4187
 epoch: 16, train_loss: 1.0824, test_loss: 1.1349, test_f1: 0.4187
 epoch: 17, train_loss: 1.0784, test_loss: 1.1270, test_f1: 0.4189
 epoch: 18, train_loss: 1.0641, test_loss: 1.1192, test_f1: 0.4212
 epoch: 19, train_loss: 1.0666, test_loss: 1.1219, test_f1: 0.4157
 epoch: 20, train_loss: 1.0536, test_loss: 1.1192, test_f1: 0.4253
 epoch: 21, train_loss: 1.0439, test_loss: 1.1186, test_f1: 0.4231
 epoch: 22, train_loss: 1.0535, test_loss: 1.1196, test_f1: 0.4273
 epoch: 23, train_loss: 1.0409, test_loss: 1.1107, test_f1: 0.4379
 epoch: 24, train_loss: 1.0426, test_loss: 1.1096, test_f1: 0.4302
 epoch: 25, train_loss: 1.0249, test_loss: 1.1069, test_f1: 0.4361
 epoch: 26, train_loss: 1.0224, test_loss: 1.1044, test_f1: 0.4355
 epoch: 27, train_loss: 1.0149, test_loss: 1.1025, test_f1: 0.4374
 epoch: 28, train_loss: 1.0139, test_loss: 1.1048, test_f1: 0.4294
 epoch: 29, train_loss: 1.0137, test_loss: 1.1030, test_f1: 0.4380
 epoch: 30, train_loss: 1.0126, test_loss: 1.0949, test_f1: 0.4347
 epoch: 31, train_loss: 1.0130, test_loss: 1.0888, test_f1: 0.4423
 epoch: 32, train_loss: 1.0056, test_loss: 1.0827, test_f1: 0.4430
 epoch: 33, train_loss: 1.0135, test_loss: 1.0772, test_f1: 0.4433
 epoch: 34, train_loss: 1.0111, test_loss: 1.0763, test_f1: 0.4316
 epoch: 35, train_loss: 0.9976, test_loss: 1.0738, test_f1: 0.4402
 epoch: 36, train_loss: 1.0043, test_loss: 1.0794, test_f1: 0.4307
 epoch: 37, train_loss: 0.9920, test_loss: 1.0770, test_f1: 0.4503
 epoch: 38, train_loss: 0.9930, test_loss: 1.0729, test_f1: 0.4380
 epoch: 39, train_loss: 0.9970, test_loss: 1.0671, test_f1: 0.4375
 epoch: 40, train_loss: 0.9929, test_loss: 1.0678, test_f1: 0.4341
 epoch: 41, train_loss: 0.9861, test_loss: 1.0679, test_f1: 0.4365
 epoch: 42, train_loss: 0.9904, test_loss: 1.0585, test_f1: 0.4302
 epoch: 43, train_loss: 0.9800, test_loss: 1.0493, test_f1: 0.4313
 epoch: 44, train_loss: 0.9774, test_loss: 1.0486, test_f1: 0.4405
 epoch: 45, train_loss: 0.9836, test_loss: 1.0771, test_f1: 0.4371
 epoch: 46, train_loss: 0.9836, test_loss: 1.0757, test_f1: 0.4358
 epoch: 47, train_loss: 0.9742, test_loss: 1.0559, test_f1: 0.4281
 epoch: 48, train_loss: 0.9756, test_loss: 1.0490, test_f1: 0.4293
 epoch: 49, train_loss: 0.9732, test_loss: 1.0570, test_f1: 0.4173
 epoch: 50, train_loss: 0.9640, test_loss: 1.0680, test_f1: 0.4333
 epoch: 51, train_loss: 0.9814, test_loss: 1.0693, test_f1: 0.4544
 epoch: 52, train_loss: 0.9697, test_loss: 1.0604, test_f1: 0.4387
 epoch: 53, train_loss: 0.9608, test_loss: 1.0514, test_f1: 0.4368
 epoch: 54, train_loss: 0.9645, test_loss: 1.0457, test_f1: 0.4387
 epoch: 55, train_loss: 0.9698, test_loss: 1.0503, test_f1: 0.4376
 epoch: 56, train_loss: 0.9538, test_loss: 1.0566, test_f1: 0.4279
 epoch: 57, train_loss: 0.9609, test_loss: 1.0562, test_f1: 0.4327
 epoch: 58, train_loss: 0.9578, test_loss: 1.0617, test_f1: 0.4466
 epoch: 59, train_loss: 0.9578, test_loss: 1.0657, test_f1: 0.4460
 epoch: 60, train_loss: 0.9636, test_loss: 1.0669, test_f1: 0.4524
 epoch: 61, train_loss: 0.9570, test_loss: 1.0554, test_f1: 0.4353
 epoch: 62, train_loss: 0.9562, test_loss: 1.0454, test_f1: 0.4443
 epoch: 63, train_loss: 0.9591, test_loss: 1.0456, test_f1: 0.4433
 epoch: 64, train_loss: 0.9475, test_loss: 1.0480, test_f1: 0.4378
 epoch: 65, train_loss: 0.9634, test_loss: 1.0535, test_f1: 0.4506
 epoch: 66, train_loss: 0.9518, test_loss: 1.0571, test_f1: 0.4563
 epoch: 67, train_loss: 0.9492, test_loss: 1.0539, test_f1: 0.4395
 epoch: 68, train_loss: 0.9549, test_loss: 1.0605, test_f1: 0.4427
 epoch: 69, train_loss: 0.9451, test_loss: 1.0514, test_f1: 0.4346
 epoch: 70, train_loss: 0.9543, test_loss: 1.0529, test_f1: 0.4428
 epoch: 71, train_loss: 0.9485, test_loss: 1.0555, test_f1: 0.4582
 epoch: 72, train_loss: 0.9477, test_loss: 1.0513, test_f1: 0.4450
 epoch: 73, train_loss: 0.9521, test_loss: 1.0533, test_f1: 0.4508
 epoch: 74, train_loss: 0.9540, test_loss: 1.0472, test_f1: 0.4518
 epoch: 75, train_loss: 0.9515, test_loss: 1.0446, test_f1: 0.4452
 epoch: 76, train_loss: 0.9471, test_loss: 1.0510, test_f1: 0.4508
 epoch: 77, train_loss: 0.9502, test_loss: 1.0457, test_f1: 0.4517
 epoch: 78, train_loss: 0.9472, test_loss: 1.0489, test_f1: 0.4501
 epoch: 79, train_loss: 0.9465, test_loss: 1.0550, test_f1: 0.4400
 epoch: 80, train_loss: 0.9471, test_loss: 1.0603, test_f1: 0.4404
 epoch: 81, train_loss: 0.9405, test_loss: 1.0520, test_f1: 0.4493
 epoch: 82, train_loss: 0.9355, test_loss: 1.0524, test_f1: 0.4452
 epoch: 83, train_loss: 0.9357, test_loss: 1.0600, test_f1: 0.4530
 epoch: 84, train_loss: 0.9508, test_loss: 1.0536, test_f1: 0.4460
 epoch: 85, train_loss: 0.9344, test_loss: 1.0523, test_f1: 0.4524
 epoch: 86, train_loss: 0.9426, test_loss: 1.0534, test_f1: 0.4501
 epoch: 87, train_loss: 0.9526, test_loss: 1.0663, test_f1: 0.4622
 epoch: 88, train_loss: 0.9387, test_loss: 1.0512, test_f1: 0.4512
 epoch: 89, train_loss: 0.9404, test_loss: 1.0514, test_f1: 0.4811
 epoch: 90, train_loss: 0.9444, test_loss: 1.0495, test_f1: 0.4804
 epoch: 91, train_loss: 0.9365, test_loss: 1.0462, test_f1: 0.4645
 epoch: 92, train_loss: 0.9511, test_loss: 1.0493, test_f1: 0.4521
 epoch: 93, train_loss: 0.9363, test_loss: 1.0545, test_f1: 0.4729
 epoch: 94, train_loss: 0.9346, test_loss: 1.0465, test_f1: 0.4750
 epoch: 95, train_loss: 0.9413, test_loss: 1.0478, test_f1: 0.4746
 epoch: 96, train_loss: 0.9398, test_loss: 1.0381, test_f1: 0.4778
 epoch: 97, train_loss: 0.9441, test_loss: 1.0344, test_f1: 0.4574
 epoch: 98, train_loss: 0.9352, test_loss: 1.0439, test_f1: 0.4543
 epoch: 99, train_loss: 0.9410, test_loss: 1.0399, test_f1: 0.4570
##################ITERATION #7 ****************************************
 epoch: 0, train_loss: 1.2811, test_loss: 1.3406, test_f1: 0.2281
 epoch: 1, train_loss: 1.2297, test_loss: 1.3383, test_f1: 0.2281
 epoch: 2, train_loss: 1.2144, test_loss: 1.3340, test_f1: 0.2281
 epoch: 3, train_loss: 1.2038, test_loss: 1.3317, test_f1: 0.2281
 epoch: 4, train_loss: 1.1922, test_loss: 1.3302, test_f1: 0.2281
 epoch: 5, train_loss: 1.1744, test_loss: 1.3256, test_f1: 0.2281
 epoch: 6, train_loss: 1.1582, test_loss: 1.3237, test_f1: 0.2289
 epoch: 7, train_loss: 1.1644, test_loss: 1.3083, test_f1: 0.2468
 epoch: 8, train_loss: 1.1600, test_loss: 1.2899, test_f1: 0.2777
 epoch: 9, train_loss: 1.1493, test_loss: 1.2693, test_f1: 0.2831
 epoch: 10, train_loss: 1.1358, test_loss: 1.2540, test_f1: 0.3361
 epoch: 11, train_loss: 1.1396, test_loss: 1.2373, test_f1: 0.3350
 epoch: 12, train_loss: 1.1273, test_loss: 1.2239, test_f1: 0.3455
 epoch: 13, train_loss: 1.1183, test_loss: 1.2145, test_f1: 0.3463
 epoch: 14, train_loss: 1.1096, test_loss: 1.2095, test_f1: 0.3448
 epoch: 15, train_loss: 1.1078, test_loss: 1.2024, test_f1: 0.3639
 epoch: 16, train_loss: 1.0982, test_loss: 1.1999, test_f1: 0.3670
 epoch: 17, train_loss: 1.0830, test_loss: 1.2015, test_f1: 0.3679
 epoch: 18, train_loss: 1.0908, test_loss: 1.1991, test_f1: 0.3703
 epoch: 19, train_loss: 1.0871, test_loss: 1.1952, test_f1: 0.3727
 epoch: 20, train_loss: 1.0743, test_loss: 1.1792, test_f1: 0.3863
 epoch: 21, train_loss: 1.0760, test_loss: 1.1723, test_f1: 0.3875
 epoch: 22, train_loss: 1.0738, test_loss: 1.1717, test_f1: 0.3643
 epoch: 23, train_loss: 1.0670, test_loss: 1.1858, test_f1: 0.3667
 epoch: 24, train_loss: 1.0693, test_loss: 1.1926, test_f1: 0.3757
 epoch: 25, train_loss: 1.0397, test_loss: 1.1619, test_f1: 0.4174
 epoch: 26, train_loss: 1.0481, test_loss: 1.1658, test_f1: 0.4186
 epoch: 27, train_loss: 1.0438, test_loss: 1.1866, test_f1: 0.3988
 epoch: 28, train_loss: 1.0344, test_loss: 1.1791, test_f1: 0.4162
 epoch: 29, train_loss: 1.0349, test_loss: 1.1622, test_f1: 0.4257
 epoch: 30, train_loss: 1.0326, test_loss: 1.1649, test_f1: 0.4197
 epoch: 31, train_loss: 1.0321, test_loss: 1.1627, test_f1: 0.4310
 epoch: 32, train_loss: 1.0390, test_loss: 1.1687, test_f1: 0.4230
 epoch: 33, train_loss: 1.0356, test_loss: 1.1676, test_f1: 0.4154
 epoch: 34, train_loss: 1.0287, test_loss: 1.1636, test_f1: 0.4198
 epoch: 35, train_loss: 1.0244, test_loss: 1.1578, test_f1: 0.4428
 epoch: 36, train_loss: 1.0196, test_loss: 1.1713, test_f1: 0.4471
 epoch: 37, train_loss: 1.0073, test_loss: 1.2029, test_f1: 0.4111
 epoch: 38, train_loss: 1.0037, test_loss: 1.2007, test_f1: 0.4217
 epoch: 39, train_loss: 1.0120, test_loss: 1.2056, test_f1: 0.4224
 epoch: 40, train_loss: 1.0080, test_loss: 1.1972, test_f1: 0.4402
 epoch: 41, train_loss: 1.0013, test_loss: 1.1851, test_f1: 0.4211
 epoch: 42, train_loss: 0.9869, test_loss: 1.1724, test_f1: 0.4438
 epoch: 43, train_loss: 0.9846, test_loss: 1.1901, test_f1: 0.4363
 epoch: 44, train_loss: 0.9860, test_loss: 1.1668, test_f1: 0.4443
 epoch: 45, train_loss: 0.9951, test_loss: 1.1495, test_f1: 0.4434
 epoch: 46, train_loss: 0.9907, test_loss: 1.1676, test_f1: 0.4456
 epoch: 47, train_loss: 0.9878, test_loss: 1.1833, test_f1: 0.4311
 epoch: 48, train_loss: 0.9876, test_loss: 1.2087, test_f1: 0.4049
 epoch: 49, train_loss: 0.9808, test_loss: 1.1835, test_f1: 0.3895
 epoch: 50, train_loss: 0.9723, test_loss: 1.1602, test_f1: 0.4444
 epoch: 51, train_loss: 0.9730, test_loss: 1.1663, test_f1: 0.4453
 epoch: 52, train_loss: 0.9669, test_loss: 1.1819, test_f1: 0.4371
 epoch: 53, train_loss: 0.9753, test_loss: 1.1807, test_f1: 0.4390
 epoch: 54, train_loss: 0.9701, test_loss: 1.1876, test_f1: 0.4445
 epoch: 55, train_loss: 0.9774, test_loss: 1.1883, test_f1: 0.4641
 epoch: 56, train_loss: 0.9640, test_loss: 1.2043, test_f1: 0.4481
 epoch: 57, train_loss: 0.9552, test_loss: 1.2047, test_f1: 0.4312
 epoch: 58, train_loss: 0.9742, test_loss: 1.2218, test_f1: 0.4469
 epoch: 59, train_loss: 0.9651, test_loss: 1.2159, test_f1: 0.4434
 epoch: 60, train_loss: 0.9588, test_loss: 1.1970, test_f1: 0.4248
 epoch: 61, train_loss: 0.9590, test_loss: 1.2092, test_f1: 0.4381
 epoch: 62, train_loss: 0.9527, test_loss: 1.2362, test_f1: 0.4429
 epoch: 63, train_loss: 0.9585, test_loss: 1.2570, test_f1: 0.4445
 epoch: 64, train_loss: 0.9636, test_loss: 1.2569, test_f1: 0.4483
 epoch: 65, train_loss: 0.9591, test_loss: 1.2373, test_f1: 0.4380
 epoch: 66, train_loss: 0.9554, test_loss: 1.2316, test_f1: 0.4421
 epoch: 67, train_loss: 0.9536, test_loss: 1.2387, test_f1: 0.4505
 epoch: 68, train_loss: 0.9533, test_loss: 1.2235, test_f1: 0.4446
 epoch: 69, train_loss: 0.9499, test_loss: 1.2171, test_f1: 0.4523
 epoch: 70, train_loss: 0.9570, test_loss: 1.2198, test_f1: 0.4557
 epoch: 71, train_loss: 0.9553, test_loss: 1.2269, test_f1: 0.4614
 epoch: 72, train_loss: 0.9615, test_loss: 1.2384, test_f1: 0.4225
 epoch: 73, train_loss: 0.9593, test_loss: 1.2327, test_f1: 0.4558
 epoch: 74, train_loss: 0.9458, test_loss: 1.2656, test_f1: 0.4568
 epoch: 75, train_loss: 0.9390, test_loss: 1.2396, test_f1: 0.4495
 epoch: 76, train_loss: 0.9449, test_loss: 1.2576, test_f1: 0.4576
 epoch: 77, train_loss: 0.9432, test_loss: 1.2652, test_f1: 0.4585
 epoch: 78, train_loss: 0.9542, test_loss: 1.2532, test_f1: 0.4432
 epoch: 79, train_loss: 0.9443, test_loss: 1.2616, test_f1: 0.4449
 epoch: 80, train_loss: 0.9364, test_loss: 1.2898, test_f1: 0.4409
 epoch: 81, train_loss: 0.9482, test_loss: 1.2660, test_f1: 0.4495
 epoch: 82, train_loss: 0.9355, test_loss: 1.2802, test_f1: 0.4463
 epoch: 83, train_loss: 0.9523, test_loss: 1.2612, test_f1: 0.4389
 epoch: 84, train_loss: 0.9395, test_loss: 1.2730, test_f1: 0.4459
 epoch: 85, train_loss: 0.9412, test_loss: 1.2766, test_f1: 0.4444
 epoch: 86, train_loss: 0.9464, test_loss: 1.2787, test_f1: 0.4367
 epoch: 87, train_loss: 0.9346, test_loss: 1.2572, test_f1: 0.4417
 epoch: 88, train_loss: 0.9508, test_loss: 1.3160, test_f1: 0.4512
 epoch: 89, train_loss: 0.9343, test_loss: 1.3135, test_f1: 0.4534
 epoch: 90, train_loss: 0.9372, test_loss: 1.2906, test_f1: 0.4382
 epoch: 91, train_loss: 0.9431, test_loss: 1.3005, test_f1: 0.4426
 epoch: 92, train_loss: 0.9321, test_loss: 1.2990, test_f1: 0.4497
 epoch: 93, train_loss: 0.9297, test_loss: 1.3297, test_f1: 0.4584
 epoch: 94, train_loss: 0.9354, test_loss: 1.3506, test_f1: 0.4495
 epoch: 95, train_loss: 0.9308, test_loss: 1.3803, test_f1: 0.4442
 epoch: 96, train_loss: 0.9345, test_loss: 1.3577, test_f1: 0.4600
 epoch: 97, train_loss: 0.9395, test_loss: 1.4084, test_f1: 0.4630
 epoch: 98, train_loss: 0.9279, test_loss: 1.4232, test_f1: 0.4788
 epoch: 99, train_loss: 0.9313, test_loss: 1.4558, test_f1: 0.4523
##################ITERATION #8 ****************************************
 epoch: 0, train_loss: 1.4159, test_loss: 1.3344, test_f1: 0.2281
 epoch: 1, train_loss: 1.2745, test_loss: 1.3429, test_f1: 0.2281
 epoch: 2, train_loss: 1.2406, test_loss: 1.3462, test_f1: 0.2281
 epoch: 3, train_loss: 1.2079, test_loss: 1.3404, test_f1: 0.2281
 epoch: 4, train_loss: 1.2057, test_loss: 1.3274, test_f1: 0.2465
 epoch: 5, train_loss: 1.1803, test_loss: 1.3133, test_f1: 0.2465
 epoch: 6, train_loss: 1.1699, test_loss: 1.2929, test_f1: 0.2724
 epoch: 7, train_loss: 1.1669, test_loss: 1.2765, test_f1: 0.3002
 epoch: 8, train_loss: 1.1606, test_loss: 1.2661, test_f1: 0.3324
 epoch: 9, train_loss: 1.1381, test_loss: 1.2481, test_f1: 0.3708
 epoch: 10, train_loss: 1.1259, test_loss: 1.2188, test_f1: 0.3777
 epoch: 11, train_loss: 1.1345, test_loss: 1.2112, test_f1: 0.3818
 epoch: 12, train_loss: 1.1245, test_loss: 1.2057, test_f1: 0.3856
 epoch: 13, train_loss: 1.1158, test_loss: 1.2001, test_f1: 0.3836
 epoch: 14, train_loss: 1.1220, test_loss: 1.1904, test_f1: 0.3788
 epoch: 15, train_loss: 1.1005, test_loss: 1.1759, test_f1: 0.3975
 epoch: 16, train_loss: 1.1014, test_loss: 1.1746, test_f1: 0.4004
 epoch: 17, train_loss: 1.0940, test_loss: 1.1768, test_f1: 0.4043
 epoch: 18, train_loss: 1.0810, test_loss: 1.1743, test_f1: 0.4072
 epoch: 19, train_loss: 1.0846, test_loss: 1.1605, test_f1: 0.3933
 epoch: 20, train_loss: 1.0816, test_loss: 1.1522, test_f1: 0.4073
 epoch: 21, train_loss: 1.0707, test_loss: 1.1494, test_f1: 0.4245
 epoch: 22, train_loss: 1.0738, test_loss: 1.1547, test_f1: 0.3949
 epoch: 23, train_loss: 1.0719, test_loss: 1.1558, test_f1: 0.4026
 epoch: 24, train_loss: 1.0706, test_loss: 1.1485, test_f1: 0.4044
 epoch: 25, train_loss: 1.0657, test_loss: 1.1445, test_f1: 0.4119
 epoch: 26, train_loss: 1.0617, test_loss: 1.1531, test_f1: 0.4251
 epoch: 27, train_loss: 1.0490, test_loss: 1.1612, test_f1: 0.4249
 epoch: 28, train_loss: 1.0508, test_loss: 1.1366, test_f1: 0.4045
 epoch: 29, train_loss: 1.0494, test_loss: 1.1219, test_f1: 0.4104
 epoch: 30, train_loss: 1.0501, test_loss: 1.1162, test_f1: 0.4109
 epoch: 31, train_loss: 1.0355, test_loss: 1.1176, test_f1: 0.4219
 epoch: 32, train_loss: 1.0343, test_loss: 1.1196, test_f1: 0.4316
 epoch: 33, train_loss: 1.0314, test_loss: 1.1177, test_f1: 0.4315
 epoch: 34, train_loss: 1.0238, test_loss: 1.1163, test_f1: 0.4301
 epoch: 35, train_loss: 1.0119, test_loss: 1.1025, test_f1: 0.4206
 epoch: 36, train_loss: 1.0201, test_loss: 1.1003, test_f1: 0.4109
 epoch: 37, train_loss: 1.0145, test_loss: 1.1034, test_f1: 0.4060
 epoch: 38, train_loss: 1.0158, test_loss: 1.0965, test_f1: 0.4113
 epoch: 39, train_loss: 1.0107, test_loss: 1.0947, test_f1: 0.4354
 epoch: 40, train_loss: 1.0022, test_loss: 1.0887, test_f1: 0.4449
 epoch: 41, train_loss: 1.0104, test_loss: 1.0879, test_f1: 0.4324
 epoch: 42, train_loss: 1.0061, test_loss: 1.0838, test_f1: 0.4152
 epoch: 43, train_loss: 1.0015, test_loss: 1.0851, test_f1: 0.4293
 epoch: 44, train_loss: 1.0029, test_loss: 1.0834, test_f1: 0.4363
 epoch: 45, train_loss: 0.9986, test_loss: 1.0799, test_f1: 0.4343
 epoch: 46, train_loss: 1.0103, test_loss: 1.0742, test_f1: 0.4226
 epoch: 47, train_loss: 1.0047, test_loss: 1.0703, test_f1: 0.4359
 epoch: 48, train_loss: 1.0025, test_loss: 1.0615, test_f1: 0.4181
 epoch: 49, train_loss: 1.0000, test_loss: 1.0620, test_f1: 0.4155
 epoch: 50, train_loss: 0.9952, test_loss: 1.0605, test_f1: 0.4188
 epoch: 51, train_loss: 0.9900, test_loss: 1.0569, test_f1: 0.4296
 epoch: 52, train_loss: 1.0017, test_loss: 1.0590, test_f1: 0.4252
 epoch: 53, train_loss: 0.9837, test_loss: 1.0625, test_f1: 0.4482
 epoch: 54, train_loss: 0.9934, test_loss: 1.0623, test_f1: 0.4464
 epoch: 55, train_loss: 0.9894, test_loss: 1.0637, test_f1: 0.4472
 epoch: 56, train_loss: 0.9877, test_loss: 1.0634, test_f1: 0.4492
 epoch: 57, train_loss: 0.9881, test_loss: 1.0589, test_f1: 0.4479
 epoch: 58, train_loss: 0.9774, test_loss: 1.0563, test_f1: 0.4401
 epoch: 59, train_loss: 0.9696, test_loss: 1.0563, test_f1: 0.4354
 epoch: 60, train_loss: 0.9875, test_loss: 1.0559, test_f1: 0.4367
 epoch: 61, train_loss: 0.9878, test_loss: 1.0559, test_f1: 0.4444
 epoch: 62, train_loss: 0.9777, test_loss: 1.0549, test_f1: 0.4428
 epoch: 63, train_loss: 0.9839, test_loss: 1.0586, test_f1: 0.4428
 epoch: 64, train_loss: 0.9760, test_loss: 1.0578, test_f1: 0.4498
 epoch: 65, train_loss: 0.9811, test_loss: 1.0515, test_f1: 0.4483
 epoch: 66, train_loss: 0.9828, test_loss: 1.0498, test_f1: 0.4422
 epoch: 67, train_loss: 0.9737, test_loss: 1.0471, test_f1: 0.4446
 epoch: 68, train_loss: 0.9702, test_loss: 1.0510, test_f1: 0.4580
 epoch: 69, train_loss: 0.9752, test_loss: 1.0585, test_f1: 0.4612
 epoch: 70, train_loss: 0.9747, test_loss: 1.0506, test_f1: 0.4618
 epoch: 71, train_loss: 0.9662, test_loss: 1.0530, test_f1: 0.4618
 epoch: 72, train_loss: 0.9689, test_loss: 1.0541, test_f1: 0.4613
 epoch: 73, train_loss: 0.9726, test_loss: 1.0479, test_f1: 0.4606
 epoch: 74, train_loss: 0.9791, test_loss: 1.0479, test_f1: 0.4784
 epoch: 75, train_loss: 0.9721, test_loss: 1.0484, test_f1: 0.4549
 epoch: 76, train_loss: 0.9679, test_loss: 1.0561, test_f1: 0.4514
 epoch: 77, train_loss: 0.9640, test_loss: 1.0500, test_f1: 0.4531
 epoch: 78, train_loss: 0.9739, test_loss: 1.0502, test_f1: 0.4526
 epoch: 79, train_loss: 0.9606, test_loss: 1.0443, test_f1: 0.4582
 epoch: 80, train_loss: 0.9645, test_loss: 1.0410, test_f1: 0.4555
 epoch: 81, train_loss: 0.9655, test_loss: 1.0407, test_f1: 0.4565
 epoch: 82, train_loss: 0.9592, test_loss: 1.0386, test_f1: 0.4569
 epoch: 83, train_loss: 0.9589, test_loss: 1.0464, test_f1: 0.4685
 epoch: 84, train_loss: 0.9627, test_loss: 1.0397, test_f1: 0.4594
 epoch: 85, train_loss: 0.9564, test_loss: 1.0444, test_f1: 0.4583
 epoch: 86, train_loss: 0.9611, test_loss: 1.0493, test_f1: 0.4643
 epoch: 87, train_loss: 0.9595, test_loss: 1.0518, test_f1: 0.4655
 epoch: 88, train_loss: 0.9579, test_loss: 1.0525, test_f1: 0.4558
 epoch: 89, train_loss: 0.9549, test_loss: 1.0501, test_f1: 0.4697
 epoch: 90, train_loss: 0.9657, test_loss: 1.0487, test_f1: 0.4615
 epoch: 91, train_loss: 0.9677, test_loss: 1.0399, test_f1: 0.4519
 epoch: 92, train_loss: 0.9601, test_loss: 1.0418, test_f1: 0.4598
 epoch: 93, train_loss: 0.9559, test_loss: 1.0434, test_f1: 0.4675
 epoch: 94, train_loss: 0.9572, test_loss: 1.0403, test_f1: 0.4648
 epoch: 95, train_loss: 0.9580, test_loss: 1.0539, test_f1: 0.4632
 epoch: 96, train_loss: 0.9618, test_loss: 1.0577, test_f1: 0.4421
 epoch: 97, train_loss: 0.9554, test_loss: 1.0500, test_f1: 0.4590
 epoch: 98, train_loss: 0.9589, test_loss: 1.0542, test_f1: 0.4432
 epoch: 99, train_loss: 0.9612, test_loss: 1.0477, test_f1: 0.4424
##################ITERATION #9 ****************************************
 epoch: 0, train_loss: 1.7714, test_loss: 1.4348, test_f1: 0.2539
 epoch: 1, train_loss: 1.4260, test_loss: 1.3919, test_f1: 0.2281
 epoch: 2, train_loss: 1.3561, test_loss: 1.3679, test_f1: 0.2281
 epoch: 3, train_loss: 1.3129, test_loss: 1.3440, test_f1: 0.2281
 epoch: 4, train_loss: 1.2691, test_loss: 1.3252, test_f1: 0.2281
 epoch: 5, train_loss: 1.2321, test_loss: 1.3064, test_f1: 0.2281
 epoch: 6, train_loss: 1.2012, test_loss: 1.2882, test_f1: 0.2343
 epoch: 7, train_loss: 1.1874, test_loss: 1.2551, test_f1: 0.2446
 epoch: 8, train_loss: 1.1706, test_loss: 1.2266, test_f1: 0.2540
 epoch: 9, train_loss: 1.1651, test_loss: 1.2117, test_f1: 0.3470
 epoch: 10, train_loss: 1.1413, test_loss: 1.2064, test_f1: 0.3588
 epoch: 11, train_loss: 1.1400, test_loss: 1.2018, test_f1: 0.3682
 epoch: 12, train_loss: 1.1164, test_loss: 1.1980, test_f1: 0.3794
 epoch: 13, train_loss: 1.1032, test_loss: 1.1980, test_f1: 0.3918
 epoch: 14, train_loss: 1.1160, test_loss: 1.1998, test_f1: 0.3930
 epoch: 15, train_loss: 1.1005, test_loss: 1.1966, test_f1: 0.3901
 epoch: 16, train_loss: 1.1044, test_loss: 1.1880, test_f1: 0.3928
 epoch: 17, train_loss: 1.0883, test_loss: 1.1815, test_f1: 0.4071
 epoch: 18, train_loss: 1.0998, test_loss: 1.1748, test_f1: 0.4069
 epoch: 19, train_loss: 1.0826, test_loss: 1.1645, test_f1: 0.4203
 epoch: 20, train_loss: 1.0752, test_loss: 1.1667, test_f1: 0.4163
 epoch: 21, train_loss: 1.0596, test_loss: 1.1787, test_f1: 0.4082
 epoch: 22, train_loss: 1.0665, test_loss: 1.1851, test_f1: 0.4071
 epoch: 23, train_loss: 1.0524, test_loss: 1.1643, test_f1: 0.4165
 epoch: 24, train_loss: 1.0633, test_loss: 1.1559, test_f1: 0.3961
 epoch: 25, train_loss: 1.0604, test_loss: 1.1720, test_f1: 0.3442
 epoch: 26, train_loss: 1.0577, test_loss: 1.1665, test_f1: 0.3730
 epoch: 27, train_loss: 1.0509, test_loss: 1.1934, test_f1: 0.3964
 epoch: 28, train_loss: 1.0374, test_loss: 1.2021, test_f1: 0.3951
 epoch: 29, train_loss: 1.0401, test_loss: 1.1669, test_f1: 0.4212
 epoch: 30, train_loss: 1.0430, test_loss: 1.1735, test_f1: 0.4207
 epoch: 31, train_loss: 1.0284, test_loss: 1.1741, test_f1: 0.4255
 epoch: 32, train_loss: 1.0407, test_loss: 1.1791, test_f1: 0.4355
 epoch: 33, train_loss: 1.0177, test_loss: 1.1718, test_f1: 0.4417
 epoch: 34, train_loss: 1.0242, test_loss: 1.1561, test_f1: 0.4176
 epoch: 35, train_loss: 1.0305, test_loss: 1.1582, test_f1: 0.4185
 epoch: 36, train_loss: 1.0241, test_loss: 1.1641, test_f1: 0.4097
 epoch: 37, train_loss: 1.0109, test_loss: 1.1800, test_f1: 0.3286
 epoch: 38, train_loss: 1.0134, test_loss: 1.1600, test_f1: 0.3997
 epoch: 39, train_loss: 1.0183, test_loss: 1.1649, test_f1: 0.3686
 epoch: 40, train_loss: 1.0112, test_loss: 1.1860, test_f1: 0.3581
 epoch: 41, train_loss: 1.0022, test_loss: 1.1712, test_f1: 0.4065
 epoch: 42, train_loss: 0.9945, test_loss: 1.1589, test_f1: 0.4135
 epoch: 43, train_loss: 1.0058, test_loss: 1.1670, test_f1: 0.4354
 epoch: 44, train_loss: 0.9999, test_loss: 1.1904, test_f1: 0.4408
 epoch: 45, train_loss: 0.9945, test_loss: 1.1641, test_f1: 0.4438
 epoch: 46, train_loss: 0.9870, test_loss: 1.1613, test_f1: 0.3858
 epoch: 47, train_loss: 0.9960, test_loss: 1.1593, test_f1: 0.4349
 epoch: 48, train_loss: 1.0099, test_loss: 1.1506, test_f1: 0.4430
 epoch: 49, train_loss: 1.0068, test_loss: 1.1861, test_f1: 0.3913
 epoch: 50, train_loss: 1.0107, test_loss: 1.1798, test_f1: 0.4051
 epoch: 51, train_loss: 0.9982, test_loss: 1.1760, test_f1: 0.4261
 epoch: 52, train_loss: 0.9946, test_loss: 1.1606, test_f1: 0.4082
 epoch: 53, train_loss: 1.0005, test_loss: 1.1696, test_f1: 0.4341
 epoch: 54, train_loss: 0.9904, test_loss: 1.1695, test_f1: 0.4412
 epoch: 55, train_loss: 0.9850, test_loss: 1.1775, test_f1: 0.4488
 epoch: 56, train_loss: 0.9928, test_loss: 1.1826, test_f1: 0.4484
 epoch: 57, train_loss: 0.9912, test_loss: 1.1735, test_f1: 0.4545
 epoch: 58, train_loss: 0.9930, test_loss: 1.1641, test_f1: 0.4412
 epoch: 59, train_loss: 0.9908, test_loss: 1.1658, test_f1: 0.4368
 epoch: 60, train_loss: 0.9900, test_loss: 1.1641, test_f1: 0.4441
 epoch: 61, train_loss: 0.9746, test_loss: 1.1575, test_f1: 0.4404
 epoch: 62, train_loss: 0.9796, test_loss: 1.1775, test_f1: 0.4346
 epoch: 63, train_loss: 0.9784, test_loss: 1.1701, test_f1: 0.4255
 epoch: 64, train_loss: 0.9736, test_loss: 1.1632, test_f1: 0.4378
 epoch: 65, train_loss: 0.9647, test_loss: 1.1576, test_f1: 0.4420
 epoch: 66, train_loss: 0.9603, test_loss: 1.1619, test_f1: 0.4586
 epoch: 67, train_loss: 0.9777, test_loss: 1.1780, test_f1: 0.4564
 epoch: 68, train_loss: 0.9829, test_loss: 1.1656, test_f1: 0.4515
 epoch: 69, train_loss: 0.9614, test_loss: 1.1635, test_f1: 0.4502
 epoch: 70, train_loss: 0.9724, test_loss: 1.1631, test_f1: 0.4396
 epoch: 71, train_loss: 0.9659, test_loss: 1.1532, test_f1: 0.4465
 epoch: 72, train_loss: 0.9723, test_loss: 1.1674, test_f1: 0.4462
 epoch: 73, train_loss: 0.9721, test_loss: 1.1929, test_f1: 0.4446
 epoch: 74, train_loss: 0.9643, test_loss: 1.1792, test_f1: 0.4559
 epoch: 75, train_loss: 0.9667, test_loss: 1.1645, test_f1: 0.4568
 epoch: 76, train_loss: 0.9612, test_loss: 1.1380, test_f1: 0.4527
 epoch: 77, train_loss: 0.9539, test_loss: 1.1314, test_f1: 0.4561
 epoch: 78, train_loss: 0.9611, test_loss: 1.1574, test_f1: 0.4566
 epoch: 79, train_loss: 0.9621, test_loss: 1.1714, test_f1: 0.4404
 epoch: 80, train_loss: 0.9594, test_loss: 1.1558, test_f1: 0.4474
 epoch: 81, train_loss: 0.9589, test_loss: 1.1680, test_f1: 0.4428
 epoch: 82, train_loss: 0.9706, test_loss: 1.1637, test_f1: 0.4523
 epoch: 83, train_loss: 0.9645, test_loss: 1.1730, test_f1: 0.4420
 epoch: 84, train_loss: 0.9638, test_loss: 1.1881, test_f1: 0.4427
 epoch: 85, train_loss: 0.9553, test_loss: 1.1849, test_f1: 0.4422
 epoch: 86, train_loss: 0.9592, test_loss: 1.1676, test_f1: 0.4451
 epoch: 87, train_loss: 0.9509, test_loss: 1.1657, test_f1: 0.4422
 epoch: 88, train_loss: 0.9637, test_loss: 1.1772, test_f1: 0.4468
 epoch: 89, train_loss: 0.9605, test_loss: 1.1698, test_f1: 0.4442
 epoch: 90, train_loss: 0.9577, test_loss: 1.1940, test_f1: 0.4388
 epoch: 91, train_loss: 0.9612, test_loss: 1.1980, test_f1: 0.4353
 epoch: 92, train_loss: 0.9556, test_loss: 1.1682, test_f1: 0.4522
 epoch: 93, train_loss: 0.9478, test_loss: 1.1841, test_f1: 0.4486
 epoch: 94, train_loss: 0.9480, test_loss: 1.2476, test_f1: 0.4402
 epoch: 95, train_loss: 0.9649, test_loss: 1.2283, test_f1: 0.4584
 epoch: 96, train_loss: 0.9564, test_loss: 1.1980, test_f1: 0.4564
 epoch: 97, train_loss: 0.9417, test_loss: 1.1831, test_f1: 0.4530
 epoch: 98, train_loss: 0.9454, test_loss: 1.1697, test_f1: 0.4457
 epoch: 99, train_loss: 0.9490, test_loss: 1.1744, test_f1: 0.4536

Training completed in 337.25 seconds
Best F1: 0.4865 at epoch 97
Mean F1 across iterations: 0.4654  0.0193
========================FINAL RESULTS================================
FEGIN weighted F1: 0.4865  0.0193
python main.py --data ltspice_demos --representation component_net --model FEGIN --layers 2 --hiddens 16 --batch_size 256 --lr 0.001 --emb_size 250 --epochs 100 --save_appendix component_net_L2_H16_BS256_LR0.001_E250 --no_val
-----



STDERR:
  File "main.py", line 370, in <module>
    main()
  File "main.py", line 254, in main
    dataset = dataset_class(
  File "/home/philip/projects/ltspice_examples_code_repo/Circuit-Completion-Using-GNNs/component_classification_with_link_prediction_head/evaluation/FEGIN/kernel/circuit_datasets.py", line 15, in __init__
    self.data, self.slices = torch.load(self.processed_paths[0])
  File "/home/philip/.local/lib/python3.8/site-packages/torch/serialization.py", line 1040, in load
    warnings.warn(
  File "/usr/lib/python3.8/warnings.py", line 109, in _showwarnmsg
    sw(msg.message, msg.category, msg.filename, msg.lineno,
  File "main.py", line 47, in warn_with_traceback
    traceback.print_stack(file=log)
/home/philip/projects/ltspice_examples_code_repo/Circuit-Completion-Using-GNNs/component_classification_with_link_prediction_head/evaluation/FEGIN/kernel/circuit_datasets.py:15: FutureWarning: You are using `torch.load` with `weights_only=False` (the current default value), which uses the default pickle module implicitly. It is possible to construct malicious pickle data which will execute arbitrary code during unpickling (See https://github.com/pytorch/pytorch/blob/main/SECURITY.md#untrusted-models for more details). In a future release, the default value for `weights_only` will be flipped to `True`. This limits the functions that could be executed during unpickling. Arbitrary objects will no longer be allowed to be loaded via this mode unless they are explicitly allowlisted by the user via `torch.serialization.add_safe_globals`. We recommend you start setting `weights_only=True` for any use case where you don't have full control of the loaded file. Please open an issue on GitHub for any issues related to this experimental feature.
  self.data, self.slices = torch.load(self.processed_paths[0])
