STDOUT:
Results will be saved in /home/philip/projects/ltspice_examples_code_repo/Circuit-Completion-Using-GNNs/component_classification_with_link_prediction_head/evaluation/FEGIN/results/model_FEGIN_dataset_ltspice_demos
Command line input: python main.py --data ltspice_demos --representation component_pin --model FEGIN --layers 3 --hiddens 64 --batch_size 128 --lr 0.01 --emb_size 250 --epochs 100 --save_appendix component_pin_L3_H64_BS128_LR0.01_E250 --no_val
 is saved.
-----
ltspice_demos - FEGIN
Using 3 layers, 64 hidden units, h = 2
Loading component_pin representation dataset
ENTERED
Training FEGIN on component_pin representation
Train: 1565, Test: 383
##################ITERATION #0 ****************************************
 epoch: 0, train_loss: 1.2446, test_loss: 1.3165, test_f1: 0.2795
 epoch: 1, train_loss: 1.1446, test_loss: 1.3055, test_f1: 0.3442
 epoch: 2, train_loss: 1.0492, test_loss: 1.3180, test_f1: 0.3361
 epoch: 3, train_loss: 0.9774, test_loss: 1.2491, test_f1: 0.3792
 epoch: 4, train_loss: 0.9202, test_loss: 1.1713, test_f1: 0.4690
 epoch: 5, train_loss: 0.8679, test_loss: 7.4902, test_f1: 0.1490
 epoch: 6, train_loss: 0.8981, test_loss: 1.1089, test_f1: 0.5219
 epoch: 7, train_loss: 0.8189, test_loss: 1.1969, test_f1: 0.3594
 epoch: 8, train_loss: 0.8087, test_loss: 0.9957, test_f1: 0.5807
 epoch: 9, train_loss: 0.7973, test_loss: 1.3068, test_f1: 0.4623
 epoch: 10, train_loss: 0.7741, test_loss: 0.9713, test_f1: 0.5168
 epoch: 11, train_loss: 0.7751, test_loss: 1.1806, test_f1: 0.5825
 epoch: 12, train_loss: 0.7657, test_loss: 1.0212, test_f1: 0.5749
 epoch: 13, train_loss: 0.8173, test_loss: 0.9589, test_f1: 0.5905
 epoch: 14, train_loss: 0.7421, test_loss: 1.2221, test_f1: 0.5650
 epoch: 15, train_loss: 0.7226, test_loss: 1.0530, test_f1: 0.6189
 epoch: 16, train_loss: 0.7084, test_loss: 0.9668, test_f1: 0.6108
 epoch: 17, train_loss: 0.7047, test_loss: 1.2277, test_f1: 0.5836
 epoch: 18, train_loss: 0.6906, test_loss: 1.3442, test_f1: 0.5486
 epoch: 19, train_loss: 0.7013, test_loss: 1.2414, test_f1: 0.5743
 epoch: 20, train_loss: 0.8081, test_loss: 1.6044, test_f1: 0.2455
 epoch: 21, train_loss: 0.8098, test_loss: 1.4438, test_f1: 0.3315
 epoch: 22, train_loss: 0.7632, test_loss: 1.0706, test_f1: 0.4692
 epoch: 23, train_loss: 0.7256, test_loss: 1.3278, test_f1: 0.4292
 epoch: 24, train_loss: 0.7119, test_loss: 1.1477, test_f1: 0.5557
 epoch: 25, train_loss: 0.7164, test_loss: 1.0016, test_f1: 0.5810
 epoch: 26, train_loss: 0.6889, test_loss: 1.0371, test_f1: 0.6138
 epoch: 27, train_loss: 0.6889, test_loss: 1.1971, test_f1: 0.5363
 epoch: 28, train_loss: 0.6720, test_loss: 1.0119, test_f1: 0.5288
 epoch: 29, train_loss: 0.6641, test_loss: 1.2957, test_f1: 0.5881
 epoch: 30, train_loss: 0.6432, test_loss: 1.0831, test_f1: 0.5333
 epoch: 31, train_loss: 0.6375, test_loss: 1.1208, test_f1: 0.4356
 epoch: 32, train_loss: 0.6428, test_loss: 1.1943, test_f1: 0.5427
 epoch: 33, train_loss: 0.6422, test_loss: 1.2224, test_f1: 0.5351
 epoch: 34, train_loss: 0.6276, test_loss: 1.0208, test_f1: 0.6022
 epoch: 35, train_loss: 0.6264, test_loss: 1.3545, test_f1: 0.5643
 epoch: 36, train_loss: 0.6197, test_loss: 1.0514, test_f1: 0.5978
 epoch: 37, train_loss: 0.6180, test_loss: 1.0213, test_f1: 0.5753
 epoch: 38, train_loss: 0.5743, test_loss: 1.1530, test_f1: 0.6276
 epoch: 39, train_loss: 0.5479, test_loss: 1.3102, test_f1: 0.5898
 epoch: 40, train_loss: 0.5460, test_loss: 1.2133, test_f1: 0.5837
 epoch: 41, train_loss: 0.5418, test_loss: 1.1855, test_f1: 0.6111
 epoch: 42, train_loss: 0.5610, test_loss: 1.3468, test_f1: 0.5247
 epoch: 43, train_loss: 0.5545, test_loss: 1.4823, test_f1: 0.5877
 epoch: 44, train_loss: 0.5232, test_loss: 1.3513, test_f1: 0.5511
 epoch: 45, train_loss: 0.5547, test_loss: 1.6839, test_f1: 0.6199
 epoch: 46, train_loss: 0.5273, test_loss: 1.5763, test_f1: 0.5548
 epoch: 47, train_loss: 0.5215, test_loss: 1.2506, test_f1: 0.5945
 epoch: 48, train_loss: 0.5138, test_loss: 1.1561, test_f1: 0.5861
 epoch: 49, train_loss: 0.4887, test_loss: 2.4825, test_f1: 0.5948
 epoch: 50, train_loss: 0.4751, test_loss: 1.3422, test_f1: 0.6056
 epoch: 51, train_loss: 0.4629, test_loss: 1.4584, test_f1: 0.6202
 epoch: 52, train_loss: 0.4337, test_loss: 1.3800, test_f1: 0.5843
 epoch: 53, train_loss: 0.4194, test_loss: 1.8092, test_f1: 0.5950
 epoch: 54, train_loss: 0.3906, test_loss: 1.8720, test_f1: 0.6210
 epoch: 55, train_loss: 0.3969, test_loss: 1.8990, test_f1: 0.5623
 epoch: 56, train_loss: 0.3926, test_loss: 1.4098, test_f1: 0.6152
 epoch: 57, train_loss: 0.3606, test_loss: 2.9049, test_f1: 0.5864
 epoch: 58, train_loss: 0.3747, test_loss: 2.0784, test_f1: 0.5752
 epoch: 59, train_loss: 0.4006, test_loss: 2.3947, test_f1: 0.5926
 epoch: 60, train_loss: 0.3639, test_loss: 1.8985, test_f1: 0.5736
 epoch: 61, train_loss: 0.3960, test_loss: 1.6066, test_f1: 0.6121
 epoch: 62, train_loss: 0.3678, test_loss: 2.2904, test_f1: 0.6252
 epoch: 63, train_loss: 0.4028, test_loss: 2.4930, test_f1: 0.5808
 epoch: 64, train_loss: 0.3984, test_loss: 1.9721, test_f1: 0.5996
 epoch: 65, train_loss: 0.3437, test_loss: 1.7818, test_f1: 0.5884
 epoch: 66, train_loss: 0.3814, test_loss: 2.0442, test_f1: 0.6304
 epoch: 67, train_loss: 0.3471, test_loss: 1.8639, test_f1: 0.6192
 epoch: 68, train_loss: 0.3140, test_loss: 2.6369, test_f1: 0.6100
 epoch: 69, train_loss: 0.3239, test_loss: 1.8581, test_f1: 0.6165
 epoch: 70, train_loss: 0.3167, test_loss: 3.0865, test_f1: 0.5976
 epoch: 71, train_loss: 0.3375, test_loss: 2.0841, test_f1: 0.5783
 epoch: 72, train_loss: 0.3062, test_loss: 2.4080, test_f1: 0.5789
 epoch: 73, train_loss: 0.3022, test_loss: 3.2317, test_f1: 0.5749
 epoch: 74, train_loss: 0.2833, test_loss: 2.3542, test_f1: 0.6366
 epoch: 75, train_loss: 0.2913, test_loss: 3.3445, test_f1: 0.6137
 epoch: 76, train_loss: 0.3089, test_loss: 2.2908, test_f1: 0.6189
 epoch: 77, train_loss: 0.3180, test_loss: 2.1017, test_f1: 0.5661
 epoch: 78, train_loss: 0.3039, test_loss: 2.6262, test_f1: 0.6320
 epoch: 79, train_loss: 0.3166, test_loss: 2.2898, test_f1: 0.5828
 epoch: 80, train_loss: 0.3259, test_loss: 2.5528, test_f1: 0.6229
 epoch: 81, train_loss: 0.2804, test_loss: 3.0877, test_f1: 0.6136
 epoch: 82, train_loss: 0.2780, test_loss: 2.1804, test_f1: 0.5979
 epoch: 83, train_loss: 0.2736, test_loss: 2.3646, test_f1: 0.5859
 epoch: 84, train_loss: 0.2622, test_loss: 2.6864, test_f1: 0.6178
 epoch: 85, train_loss: 0.2528, test_loss: 2.3966, test_f1: 0.6105
 epoch: 86, train_loss: 0.2739, test_loss: 2.7773, test_f1: 0.6136
 epoch: 87, train_loss: 0.2764, test_loss: 2.4964, test_f1: 0.6028
 epoch: 88, train_loss: 0.2716, test_loss: 3.3106, test_f1: 0.6170
 epoch: 89, train_loss: 0.2729, test_loss: 2.6120, test_f1: 0.6282
 epoch: 90, train_loss: 0.3033, test_loss: 4.5653, test_f1: 0.6175
 epoch: 91, train_loss: 0.3330, test_loss: 2.2176, test_f1: 0.6102
 epoch: 92, train_loss: 0.2979, test_loss: 2.3995, test_f1: 0.5628
 epoch: 93, train_loss: 0.2781, test_loss: 2.5441, test_f1: 0.6212
 epoch: 94, train_loss: 0.2709, test_loss: 3.1510, test_f1: 0.6353
 epoch: 95, train_loss: 0.2590, test_loss: 2.4260, test_f1: 0.5410
 epoch: 96, train_loss: 0.2186, test_loss: 3.1281, test_f1: 0.6287
 epoch: 97, train_loss: 0.2115, test_loss: 2.8779, test_f1: 0.5985
 epoch: 98, train_loss: 0.2265, test_loss: 3.8112, test_f1: 0.6377
 epoch: 99, train_loss: 0.2413, test_loss: 2.0349, test_f1: 0.6193
##################ITERATION #1 ****************************************
 epoch: 0, train_loss: 1.1710, test_loss: 1.3842, test_f1: 0.3561
 epoch: 1, train_loss: 0.9791, test_loss: 1.4232, test_f1: 0.3423
 epoch: 2, train_loss: 0.9340, test_loss: 1.2372, test_f1: 0.3981
 epoch: 3, train_loss: 0.8953, test_loss: 0.9824, test_f1: 0.4946
 epoch: 4, train_loss: 0.8522, test_loss: 1.2365, test_f1: 0.4288
 epoch: 5, train_loss: 0.8116, test_loss: 1.0253, test_f1: 0.5310
 epoch: 6, train_loss: 0.8103, test_loss: 1.1356, test_f1: 0.5021
 epoch: 7, train_loss: 0.7754, test_loss: 0.9807, test_f1: 0.5019
 epoch: 8, train_loss: 0.7653, test_loss: 0.9868, test_f1: 0.6003
 epoch: 9, train_loss: 0.7683, test_loss: 2.2492, test_f1: 0.3582
 epoch: 10, train_loss: 0.7756, test_loss: 1.1267, test_f1: 0.5749
 epoch: 11, train_loss: 0.7636, test_loss: 0.9960, test_f1: 0.5554
 epoch: 12, train_loss: 0.7570, test_loss: 1.0631, test_f1: 0.5343
 epoch: 13, train_loss: 0.7253, test_loss: 0.9852, test_f1: 0.5852
 epoch: 14, train_loss: 0.7127, test_loss: 0.9588, test_f1: 0.6045
 epoch: 15, train_loss: 0.7052, test_loss: 1.2520, test_f1: 0.5351
 epoch: 16, train_loss: 0.6972, test_loss: 0.9701, test_f1: 0.5224
 epoch: 17, train_loss: 0.7172, test_loss: 1.1409, test_f1: 0.4956
 epoch: 18, train_loss: 0.7063, test_loss: 1.3226, test_f1: 0.4271
 epoch: 19, train_loss: 0.7093, test_loss: 1.2100, test_f1: 0.5450
 epoch: 20, train_loss: 0.6714, test_loss: 0.9968, test_f1: 0.6516
 epoch: 21, train_loss: 0.6472, test_loss: 1.0217, test_f1: 0.5665
 epoch: 22, train_loss: 0.6315, test_loss: 1.1277, test_f1: 0.5973
 epoch: 23, train_loss: 0.5997, test_loss: 0.9873, test_f1: 0.6112
 epoch: 24, train_loss: 0.5883, test_loss: 1.1810, test_f1: 0.6522
 epoch: 25, train_loss: 0.6200, test_loss: 1.1495, test_f1: 0.5885
 epoch: 26, train_loss: 0.6236, test_loss: 1.1971, test_f1: 0.5991
 epoch: 27, train_loss: 0.6158, test_loss: 1.1667, test_f1: 0.6053
 epoch: 28, train_loss: 0.5877, test_loss: 1.3764, test_f1: 0.6322
 epoch: 29, train_loss: 0.5833, test_loss: 1.0500, test_f1: 0.6270
 epoch: 30, train_loss: 0.5448, test_loss: 1.2769, test_f1: 0.6514
 epoch: 31, train_loss: 0.5522, test_loss: 1.0879, test_f1: 0.6272
 epoch: 32, train_loss: 0.5692, test_loss: 1.4122, test_f1: 0.5301
 epoch: 33, train_loss: 0.5987, test_loss: 1.3657, test_f1: 0.5796
 epoch: 34, train_loss: 0.6035, test_loss: 1.4860, test_f1: 0.5783
 epoch: 35, train_loss: 0.5508, test_loss: 1.3224, test_f1: 0.6482
 epoch: 36, train_loss: 0.5329, test_loss: 1.0994, test_f1: 0.6691
 epoch: 37, train_loss: 0.5506, test_loss: 1.3079, test_f1: 0.5851
 epoch: 38, train_loss: 0.5474, test_loss: 1.2122, test_f1: 0.6076
 epoch: 39, train_loss: 0.5355, test_loss: 1.3798, test_f1: 0.5084
 epoch: 40, train_loss: 0.5537, test_loss: 1.4537, test_f1: 0.5324
 epoch: 41, train_loss: 0.5435, test_loss: 1.0913, test_f1: 0.6098
 epoch: 42, train_loss: 0.5153, test_loss: 1.2653, test_f1: 0.5300
 epoch: 43, train_loss: 0.5152, test_loss: 1.3033, test_f1: 0.5490
 epoch: 44, train_loss: 0.5160, test_loss: 1.0519, test_f1: 0.6318
 epoch: 45, train_loss: 0.4983, test_loss: 1.4017, test_f1: 0.5298
 epoch: 46, train_loss: 0.4817, test_loss: 1.9458, test_f1: 0.5201
 epoch: 47, train_loss: 0.5009, test_loss: 1.4091, test_f1: 0.6075
 epoch: 48, train_loss: 0.4990, test_loss: 1.2652, test_f1: 0.5639
 epoch: 49, train_loss: 0.4802, test_loss: 1.2715, test_f1: 0.6489
 epoch: 50, train_loss: 0.4353, test_loss: 1.3516, test_f1: 0.6331
 epoch: 51, train_loss: 0.4104, test_loss: 1.2379, test_f1: 0.6567
 epoch: 52, train_loss: 0.3921, test_loss: 1.2211, test_f1: 0.6422
 epoch: 53, train_loss: 0.3848, test_loss: 1.4653, test_f1: 0.5842
 epoch: 54, train_loss: 0.3664, test_loss: 1.5787, test_f1: 0.6243
 epoch: 55, train_loss: 0.3680, test_loss: 1.3875, test_f1: 0.6191
 epoch: 56, train_loss: 0.3592, test_loss: 1.5160, test_f1: 0.6226
 epoch: 57, train_loss: 0.3338, test_loss: 1.6557, test_f1: 0.5711
 epoch: 58, train_loss: 0.3063, test_loss: 1.6344, test_f1: 0.6083
 epoch: 59, train_loss: 0.3345, test_loss: 1.5763, test_f1: 0.5953
 epoch: 60, train_loss: 0.3443, test_loss: 1.8976, test_f1: 0.6186
 epoch: 61, train_loss: 0.3295, test_loss: 1.7079, test_f1: 0.5883
 epoch: 62, train_loss: 0.3165, test_loss: 1.5638, test_f1: 0.6573
 epoch: 63, train_loss: 0.3299, test_loss: 1.7877, test_f1: 0.5804
 epoch: 64, train_loss: 0.2795, test_loss: 1.8172, test_f1: 0.6248
 epoch: 65, train_loss: 0.2848, test_loss: 1.8953, test_f1: 0.6229
 epoch: 66, train_loss: 0.3451, test_loss: 1.8243, test_f1: 0.6249
 epoch: 67, train_loss: 0.3066, test_loss: 1.8103, test_f1: 0.6159
 epoch: 68, train_loss: 0.2879, test_loss: 1.9843, test_f1: 0.6150
 epoch: 69, train_loss: 0.3420, test_loss: 2.1240, test_f1: 0.5828
 epoch: 70, train_loss: 0.3198, test_loss: 1.6862, test_f1: 0.6035
 epoch: 71, train_loss: 0.3269, test_loss: 1.6451, test_f1: 0.6209
 epoch: 72, train_loss: 0.2999, test_loss: 1.8792, test_f1: 0.6404
 epoch: 73, train_loss: 0.2658, test_loss: 1.8353, test_f1: 0.6275
 epoch: 74, train_loss: 0.3061, test_loss: 1.7599, test_f1: 0.6584
 epoch: 75, train_loss: 0.2824, test_loss: 1.9755, test_f1: 0.6428
 epoch: 76, train_loss: 0.2461, test_loss: 1.9262, test_f1: 0.6444
 epoch: 77, train_loss: 0.2805, test_loss: 1.9082, test_f1: 0.6411
 epoch: 78, train_loss: 0.3070, test_loss: 1.9160, test_f1: 0.6109
 epoch: 79, train_loss: 0.3165, test_loss: 1.7416, test_f1: 0.5946
 epoch: 80, train_loss: 0.3193, test_loss: 1.7535, test_f1: 0.6145
 epoch: 81, train_loss: 0.2754, test_loss: 1.7489, test_f1: 0.6607
 epoch: 82, train_loss: 0.2563, test_loss: 1.8025, test_f1: 0.6580
 epoch: 83, train_loss: 0.2360, test_loss: 1.8982, test_f1: 0.6310
 epoch: 84, train_loss: 0.2601, test_loss: 1.8344, test_f1: 0.6861
 epoch: 85, train_loss: 0.2289, test_loss: 2.3183, test_f1: 0.6188
 epoch: 86, train_loss: 0.2668, test_loss: 2.1458, test_f1: 0.6122
 epoch: 87, train_loss: 0.2177, test_loss: 2.1110, test_f1: 0.6463
 epoch: 88, train_loss: 0.2404, test_loss: 2.0220, test_f1: 0.6476
 epoch: 89, train_loss: 0.2189, test_loss: 2.2232, test_f1: 0.6113
 epoch: 90, train_loss: 0.2445, test_loss: 2.1589, test_f1: 0.6096
 epoch: 91, train_loss: 0.2177, test_loss: 2.2969, test_f1: 0.6031
 epoch: 92, train_loss: 0.3031, test_loss: 2.4927, test_f1: 0.6207
 epoch: 93, train_loss: 0.2541, test_loss: 1.8552, test_f1: 0.6466
 epoch: 94, train_loss: 0.2649, test_loss: 1.9128, test_f1: 0.6476
 epoch: 95, train_loss: 0.2668, test_loss: 1.8674, test_f1: 0.6240
 epoch: 96, train_loss: 0.2414, test_loss: 2.0193, test_f1: 0.6105
 epoch: 97, train_loss: 0.2131, test_loss: 2.1225, test_f1: 0.5982
 epoch: 98, train_loss: 0.2185, test_loss: 2.0037, test_f1: 0.6641
 epoch: 99, train_loss: 0.1980, test_loss: 2.1875, test_f1: 0.6585
##################ITERATION #2 ****************************************
 epoch: 0, train_loss: 1.2325, test_loss: 1.4113, test_f1: 0.3031
 epoch: 1, train_loss: 1.0039, test_loss: 1.2672, test_f1: 0.4769
 epoch: 2, train_loss: 0.9243, test_loss: 1.1093, test_f1: 0.5028
 epoch: 3, train_loss: 0.8965, test_loss: 1.0679, test_f1: 0.5176
 epoch: 4, train_loss: 0.8467, test_loss: 1.1164, test_f1: 0.5216
 epoch: 5, train_loss: 0.8324, test_loss: 1.0481, test_f1: 0.5344
 epoch: 6, train_loss: 0.8140, test_loss: 1.0235, test_f1: 0.5646
 epoch: 7, train_loss: 0.8449, test_loss: 1.0759, test_f1: 0.4968
 epoch: 8, train_loss: 0.7983, test_loss: 0.9482, test_f1: 0.5635
 epoch: 9, train_loss: 0.7749, test_loss: 1.2856, test_f1: 0.5185
 epoch: 10, train_loss: 0.7575, test_loss: 1.3232, test_f1: 0.4516
 epoch: 11, train_loss: 0.7729, test_loss: 1.0897, test_f1: 0.4799
 epoch: 12, train_loss: 0.7130, test_loss: 1.2690, test_f1: 0.5823
 epoch: 13, train_loss: 0.7093, test_loss: 1.2409, test_f1: 0.5534
 epoch: 14, train_loss: 0.7020, test_loss: 1.0084, test_f1: 0.5905
 epoch: 15, train_loss: 0.6821, test_loss: 1.1383, test_f1: 0.6019
 epoch: 16, train_loss: 0.7341, test_loss: 1.0926, test_f1: 0.6136
 epoch: 17, train_loss: 0.6769, test_loss: 1.0573, test_f1: 0.5563
 epoch: 18, train_loss: 0.6742, test_loss: 1.1553, test_f1: 0.5406
 epoch: 19, train_loss: 0.6501, test_loss: 1.0381, test_f1: 0.5697
 epoch: 20, train_loss: 0.6511, test_loss: 1.5511, test_f1: 0.4499
 epoch: 21, train_loss: 0.6746, test_loss: 1.1745, test_f1: 0.6127
 epoch: 22, train_loss: 0.7159, test_loss: 1.2795, test_f1: 0.4381
 epoch: 23, train_loss: 0.6891, test_loss: 1.2061, test_f1: 0.4683
 epoch: 24, train_loss: 0.6434, test_loss: 1.1332, test_f1: 0.6091
 epoch: 25, train_loss: 0.6459, test_loss: 1.0770, test_f1: 0.6205
 epoch: 26, train_loss: 0.6383, test_loss: 1.3951, test_f1: 0.4864
 epoch: 27, train_loss: 0.6254, test_loss: 5.0007, test_f1: 0.3797
 epoch: 28, train_loss: 0.6409, test_loss: 1.2802, test_f1: 0.4993
 epoch: 29, train_loss: 0.6636, test_loss: 1.3964, test_f1: 0.6279
 epoch: 30, train_loss: 0.6120, test_loss: 1.1000, test_f1: 0.5803
 epoch: 31, train_loss: 0.5982, test_loss: 1.2646, test_f1: 0.5571
 epoch: 32, train_loss: 0.5784, test_loss: 1.0512, test_f1: 0.6190
 epoch: 33, train_loss: 0.5752, test_loss: 1.2910, test_f1: 0.5580
 epoch: 34, train_loss: 0.6053, test_loss: 1.4578, test_f1: 0.6327
 epoch: 35, train_loss: 0.5863, test_loss: 1.1381, test_f1: 0.6203
 epoch: 36, train_loss: 0.5754, test_loss: 1.1347, test_f1: 0.6152
 epoch: 37, train_loss: 0.5662, test_loss: 1.4243, test_f1: 0.5869
 epoch: 38, train_loss: 0.5458, test_loss: 1.3737, test_f1: 0.5422
 epoch: 39, train_loss: 0.5440, test_loss: 1.0860, test_f1: 0.6033
 epoch: 40, train_loss: 0.5627, test_loss: 1.1539, test_f1: 0.6129
 epoch: 41, train_loss: 0.5298, test_loss: 1.1996, test_f1: 0.6162
 epoch: 42, train_loss: 0.5034, test_loss: 1.6091, test_f1: 0.6075
 epoch: 43, train_loss: 0.5093, test_loss: 1.3927, test_f1: 0.6096
 epoch: 44, train_loss: 0.5340, test_loss: 1.5104, test_f1: 0.5265
 epoch: 45, train_loss: 0.4893, test_loss: 1.4415, test_f1: 0.6028
 epoch: 46, train_loss: 0.4680, test_loss: 1.5319, test_f1: 0.6447
 epoch: 47, train_loss: 0.5138, test_loss: 1.4149, test_f1: 0.6605
 epoch: 48, train_loss: 0.4667, test_loss: 1.3108, test_f1: 0.5794
 epoch: 49, train_loss: 0.4830, test_loss: 1.4578, test_f1: 0.5503
 epoch: 50, train_loss: 0.4722, test_loss: 1.4726, test_f1: 0.5596
 epoch: 51, train_loss: 0.4420, test_loss: 1.3471, test_f1: 0.6473
 epoch: 52, train_loss: 0.4014, test_loss: 1.7285, test_f1: 0.6315
 epoch: 53, train_loss: 0.3948, test_loss: 1.4227, test_f1: 0.6649
 epoch: 54, train_loss: 0.3933, test_loss: 1.7500, test_f1: 0.6347
 epoch: 55, train_loss: 0.3723, test_loss: 1.5270, test_f1: 0.6431
 epoch: 56, train_loss: 0.3512, test_loss: 1.9122, test_f1: 0.6051
 epoch: 57, train_loss: 0.3523, test_loss: 1.6895, test_f1: 0.6236
 epoch: 58, train_loss: 0.3473, test_loss: 1.6548, test_f1: 0.6460
 epoch: 59, train_loss: 0.3323, test_loss: 1.6670, test_f1: 0.6541
 epoch: 60, train_loss: 0.4230, test_loss: 1.7332, test_f1: 0.5804
 epoch: 61, train_loss: 0.3795, test_loss: 1.9498, test_f1: 0.6445
 epoch: 62, train_loss: 0.3339, test_loss: 1.8097, test_f1: 0.5926
 epoch: 63, train_loss: 0.3294, test_loss: 1.7126, test_f1: 0.6267
 epoch: 64, train_loss: 0.3344, test_loss: 2.2622, test_f1: 0.5964
 epoch: 65, train_loss: 0.3385, test_loss: 1.6532, test_f1: 0.6799
 epoch: 66, train_loss: 0.3156, test_loss: 1.8830, test_f1: 0.6133
 epoch: 67, train_loss: 0.2937, test_loss: 2.0671, test_f1: 0.5936
 epoch: 68, train_loss: 0.3056, test_loss: 2.3323, test_f1: 0.6552
 epoch: 69, train_loss: 0.2936, test_loss: 2.0691, test_f1: 0.6026
 epoch: 70, train_loss: 0.3261, test_loss: 1.9669, test_f1: 0.6402
 epoch: 71, train_loss: 0.2884, test_loss: 1.9532, test_f1: 0.6553
 epoch: 72, train_loss: 0.2564, test_loss: 2.1494, test_f1: 0.5932
 epoch: 73, train_loss: 0.2537, test_loss: 2.3870, test_f1: 0.6456
 epoch: 74, train_loss: 0.2754, test_loss: 2.1373, test_f1: 0.6448
 epoch: 75, train_loss: 0.3661, test_loss: 2.2770, test_f1: 0.6122
 epoch: 76, train_loss: 0.3180, test_loss: 1.6884, test_f1: 0.6637
 epoch: 77, train_loss: 0.3261, test_loss: 2.3635, test_f1: 0.6018
 epoch: 78, train_loss: 0.3612, test_loss: 1.7467, test_f1: 0.6117
 epoch: 79, train_loss: 0.3682, test_loss: 1.6802, test_f1: 0.6144
 epoch: 80, train_loss: 0.2854, test_loss: 2.0627, test_f1: 0.6039
 epoch: 81, train_loss: 0.2961, test_loss: 2.2470, test_f1: 0.6376
 epoch: 82, train_loss: 0.2861, test_loss: 2.0689, test_f1: 0.6336
 epoch: 83, train_loss: 0.3075, test_loss: 1.8414, test_f1: 0.5846
 epoch: 84, train_loss: 0.2636, test_loss: 2.1875, test_f1: 0.6219
 epoch: 85, train_loss: 0.2428, test_loss: 1.9517, test_f1: 0.6380
 epoch: 86, train_loss: 0.2266, test_loss: 2.3686, test_f1: 0.6696
 epoch: 87, train_loss: 0.2025, test_loss: 2.2841, test_f1: 0.6581
 epoch: 88, train_loss: 0.2311, test_loss: 2.3255, test_f1: 0.6722
 epoch: 89, train_loss: 0.2024, test_loss: 2.2917, test_f1: 0.6266
 epoch: 90, train_loss: 0.2364, test_loss: 2.2057, test_f1: 0.6176
 epoch: 91, train_loss: 0.2173, test_loss: 2.4140, test_f1: 0.6076
 epoch: 92, train_loss: 0.2491, test_loss: 2.3103, test_f1: 0.6504
 epoch: 93, train_loss: 0.2731, test_loss: 2.0705, test_f1: 0.6457
 epoch: 94, train_loss: 0.2709, test_loss: 1.8881, test_f1: 0.6762
 epoch: 95, train_loss: 0.2570, test_loss: 1.9133, test_f1: 0.6296
 epoch: 96, train_loss: 0.2340, test_loss: 2.1262, test_f1: 0.6240
 epoch: 97, train_loss: 0.1947, test_loss: 2.2594, test_f1: 0.6277
 epoch: 98, train_loss: 0.1805, test_loss: 2.4003, test_f1: 0.6304
 epoch: 99, train_loss: 0.1938, test_loss: 2.3478, test_f1: 0.6499
##################ITERATION #3 ****************************************
 epoch: 0, train_loss: 1.3016, test_loss: 1.4659, test_f1: 0.3446
 epoch: 1, train_loss: 1.0076, test_loss: 1.2264, test_f1: 0.4048
 epoch: 2, train_loss: 0.9550, test_loss: 1.2827, test_f1: 0.3710
 epoch: 3, train_loss: 0.9201, test_loss: 0.9853, test_f1: 0.5598
 epoch: 4, train_loss: 0.8811, test_loss: 0.9891, test_f1: 0.5850
 epoch: 5, train_loss: 0.8430, test_loss: 0.9639, test_f1: 0.5404
 epoch: 6, train_loss: 0.8773, test_loss: 1.1636, test_f1: 0.4322
 epoch: 7, train_loss: 0.8122, test_loss: 1.0094, test_f1: 0.5839
 epoch: 8, train_loss: 0.8136, test_loss: 1.0219, test_f1: 0.5729
 epoch: 9, train_loss: 0.8435, test_loss: 1.0521, test_f1: 0.5455
 epoch: 10, train_loss: 0.7723, test_loss: 1.0292, test_f1: 0.5756
 epoch: 11, train_loss: 0.7855, test_loss: 1.1660, test_f1: 0.6447
 epoch: 12, train_loss: 0.7952, test_loss: 1.0350, test_f1: 0.5501
 epoch: 13, train_loss: 0.8039, test_loss: 1.3077, test_f1: 0.4621
 epoch: 14, train_loss: 0.7510, test_loss: 1.0483, test_f1: 0.5963
 epoch: 15, train_loss: 0.7456, test_loss: 0.9167, test_f1: 0.6237
 epoch: 16, train_loss: 0.7067, test_loss: 0.9915, test_f1: 0.6335
 epoch: 17, train_loss: 0.7043, test_loss: 1.1036, test_f1: 0.6055
 epoch: 18, train_loss: 0.6840, test_loss: 1.0243, test_f1: 0.5793
 epoch: 19, train_loss: 0.6596, test_loss: 1.0263, test_f1: 0.5792
 epoch: 20, train_loss: 0.6551, test_loss: 1.1257, test_f1: 0.6088
 epoch: 21, train_loss: 0.6816, test_loss: 1.4018, test_f1: 0.4525
 epoch: 22, train_loss: 0.6764, test_loss: 1.1263, test_f1: 0.5434
 epoch: 23, train_loss: 0.6743, test_loss: 1.3690, test_f1: 0.5782
 epoch: 24, train_loss: 0.6639, test_loss: 1.1680, test_f1: 0.5837
 epoch: 25, train_loss: 0.6594, test_loss: 1.1634, test_f1: 0.5722
 epoch: 26, train_loss: 0.6365, test_loss: 1.3136, test_f1: 0.5791
 epoch: 27, train_loss: 0.6063, test_loss: 1.0844, test_f1: 0.5991
 epoch: 28, train_loss: 0.6332, test_loss: 1.0073, test_f1: 0.5630
 epoch: 29, train_loss: 0.6144, test_loss: 1.0629, test_f1: 0.6581
 epoch: 30, train_loss: 0.5874, test_loss: 1.4921, test_f1: 0.5918
 epoch: 31, train_loss: 0.6012, test_loss: 1.2426, test_f1: 0.5759
 epoch: 32, train_loss: 0.5832, test_loss: 1.3875, test_f1: 0.5957
 epoch: 33, train_loss: 0.5504, test_loss: 1.2027, test_f1: 0.6167
 epoch: 34, train_loss: 0.5757, test_loss: 1.2922, test_f1: 0.6187
 epoch: 35, train_loss: 0.5506, test_loss: 1.1020, test_f1: 0.6327
 epoch: 36, train_loss: 0.5475, test_loss: 1.0943, test_f1: 0.6422
 epoch: 37, train_loss: 0.5457, test_loss: 1.2294, test_f1: 0.5607
 epoch: 38, train_loss: 0.5565, test_loss: 1.4602, test_f1: 0.5768
 epoch: 39, train_loss: 0.5774, test_loss: 1.1819, test_f1: 0.5533
 epoch: 40, train_loss: 0.5903, test_loss: 1.3352, test_f1: 0.5872
 epoch: 41, train_loss: 0.6100, test_loss: 1.4971, test_f1: 0.5113
 epoch: 42, train_loss: 0.5874, test_loss: 1.1863, test_f1: 0.6272
 epoch: 43, train_loss: 0.5922, test_loss: 1.2104, test_f1: 0.6004
 epoch: 44, train_loss: 0.6000, test_loss: 1.0838, test_f1: 0.5796
 epoch: 45, train_loss: 0.5964, test_loss: 1.1622, test_f1: 0.6163
 epoch: 46, train_loss: 0.5695, test_loss: 1.2088, test_f1: 0.6536
 epoch: 47, train_loss: 0.5278, test_loss: 1.3899, test_f1: 0.5682
 epoch: 48, train_loss: 0.5177, test_loss: 1.2347, test_f1: 0.6037
 epoch: 49, train_loss: 0.5110, test_loss: 1.2292, test_f1: 0.6073
 epoch: 50, train_loss: 0.4855, test_loss: 1.4611, test_f1: 0.6319
 epoch: 51, train_loss: 0.4629, test_loss: 1.3742, test_f1: 0.6420
 epoch: 52, train_loss: 0.4446, test_loss: 1.5455, test_f1: 0.6064
 epoch: 53, train_loss: 0.4240, test_loss: 1.5409, test_f1: 0.6440
 epoch: 54, train_loss: 0.3926, test_loss: 1.7101, test_f1: 0.6344
 epoch: 55, train_loss: 0.4017, test_loss: 1.6651, test_f1: 0.6400
 epoch: 56, train_loss: 0.4054, test_loss: 1.7627, test_f1: 0.6363
 epoch: 57, train_loss: 0.4007, test_loss: 1.5840, test_f1: 0.6256
 epoch: 58, train_loss: 0.3830, test_loss: 1.4951, test_f1: 0.6284
 epoch: 59, train_loss: 0.3677, test_loss: 2.0323, test_f1: 0.6290
 epoch: 60, train_loss: 0.3679, test_loss: 1.8254, test_f1: 0.6317
 epoch: 61, train_loss: 0.3555, test_loss: 1.9557, test_f1: 0.5613
 epoch: 62, train_loss: 0.3436, test_loss: 2.1653, test_f1: 0.6131
 epoch: 63, train_loss: 0.3544, test_loss: 1.9106, test_f1: 0.6366
 epoch: 64, train_loss: 0.3264, test_loss: 2.1669, test_f1: 0.6161
 epoch: 65, train_loss: 0.3538, test_loss: 2.2207, test_f1: 0.6101
 epoch: 66, train_loss: 0.3382, test_loss: 1.6864, test_f1: 0.6357
 epoch: 67, train_loss: 0.3725, test_loss: 2.0973, test_f1: 0.6132
 epoch: 68, train_loss: 0.4222, test_loss: 2.1207, test_f1: 0.6152
 epoch: 69, train_loss: 0.3604, test_loss: 1.7053, test_f1: 0.5908
 epoch: 70, train_loss: 0.3506, test_loss: 1.8277, test_f1: 0.6258
 epoch: 71, train_loss: 0.3259, test_loss: 2.0622, test_f1: 0.6233
 epoch: 72, train_loss: 0.3387, test_loss: 2.1963, test_f1: 0.5663
 epoch: 73, train_loss: 0.3282, test_loss: 2.1562, test_f1: 0.6323
 epoch: 74, train_loss: 0.3694, test_loss: 1.7236, test_f1: 0.6451
 epoch: 75, train_loss: 0.3021, test_loss: 1.8652, test_f1: 0.6044
 epoch: 76, train_loss: 0.2991, test_loss: 2.2263, test_f1: 0.5937
 epoch: 77, train_loss: 0.3265, test_loss: 2.0825, test_f1: 0.6318
 epoch: 78, train_loss: 0.3469, test_loss: 1.9462, test_f1: 0.5960
 epoch: 79, train_loss: 0.3003, test_loss: 2.2235, test_f1: 0.6049
 epoch: 80, train_loss: 0.3029, test_loss: 1.9539, test_f1: 0.6457
 epoch: 81, train_loss: 0.3097, test_loss: 2.3115, test_f1: 0.5943
 epoch: 82, train_loss: 0.2997, test_loss: 2.0436, test_f1: 0.6201
 epoch: 83, train_loss: 0.2879, test_loss: 2.5688, test_f1: 0.6031
 epoch: 84, train_loss: 0.2519, test_loss: 2.4119, test_f1: 0.6040
 epoch: 85, train_loss: 0.2900, test_loss: 2.1339, test_f1: 0.6302
 epoch: 86, train_loss: 0.3536, test_loss: 2.1199, test_f1: 0.6673
 epoch: 87, train_loss: 0.3277, test_loss: 2.3344, test_f1: 0.6111
 epoch: 88, train_loss: 0.3045, test_loss: 2.1102, test_f1: 0.6143
 epoch: 89, train_loss: 0.2704, test_loss: 2.5751, test_f1: 0.6418
 epoch: 90, train_loss: 0.2843, test_loss: 2.0596, test_f1: 0.6197
 epoch: 91, train_loss: 0.2744, test_loss: 2.3839, test_f1: 0.6367
 epoch: 92, train_loss: 0.2674, test_loss: 2.7109, test_f1: 0.6032
 epoch: 93, train_loss: 0.2884, test_loss: 2.4080, test_f1: 0.6005
 epoch: 94, train_loss: 0.2695, test_loss: 2.2474, test_f1: 0.6499
 epoch: 95, train_loss: 0.2632, test_loss: 2.5716, test_f1: 0.5840
 epoch: 96, train_loss: 0.3039, test_loss: 2.6270, test_f1: 0.5667
 epoch: 97, train_loss: 0.2478, test_loss: 2.6333, test_f1: 0.6053
 epoch: 98, train_loss: 0.2650, test_loss: 2.4689, test_f1: 0.6323
 epoch: 99, train_loss: 0.2377, test_loss: 2.4744, test_f1: 0.6216
##################ITERATION #4 ****************************************
 epoch: 0, train_loss: 1.3182, test_loss: 1.5359, test_f1: 0.3432
 epoch: 1, train_loss: 0.9542, test_loss: 1.5132, test_f1: 0.2718
 epoch: 2, train_loss: 0.8726, test_loss: 1.4201, test_f1: 0.4222
 epoch: 3, train_loss: 0.8537, test_loss: 1.0203, test_f1: 0.5238
 epoch: 4, train_loss: 0.8071, test_loss: 0.9793, test_f1: 0.6323
 epoch: 5, train_loss: 0.7897, test_loss: 1.2139, test_f1: 0.4514
 epoch: 6, train_loss: 0.7549, test_loss: 1.1439, test_f1: 0.6135
 epoch: 7, train_loss: 0.7863, test_loss: 1.1437, test_f1: 0.5684
 epoch: 8, train_loss: 0.7913, test_loss: 0.9897, test_f1: 0.5595
 epoch: 9, train_loss: 0.7582, test_loss: 1.0632, test_f1: 0.4630
 epoch: 10, train_loss: 0.7279, test_loss: 1.0140, test_f1: 0.6265
 epoch: 11, train_loss: 0.7394, test_loss: 0.9818, test_f1: 0.5939
 epoch: 12, train_loss: 0.7318, test_loss: 1.0198, test_f1: 0.5265
 epoch: 13, train_loss: 0.7218, test_loss: 1.2592, test_f1: 0.4662
 epoch: 14, train_loss: 0.7621, test_loss: 0.9684, test_f1: 0.5495
 epoch: 15, train_loss: 0.7227, test_loss: 1.1016, test_f1: 0.6093
 epoch: 16, train_loss: 0.6827, test_loss: 1.1234, test_f1: 0.5887
 epoch: 17, train_loss: 0.6788, test_loss: 1.0326, test_f1: 0.5897
 epoch: 18, train_loss: 0.6729, test_loss: 1.3755, test_f1: 0.5035
 epoch: 19, train_loss: 0.6301, test_loss: 1.0223, test_f1: 0.6002
 epoch: 20, train_loss: 0.6629, test_loss: 0.9809, test_f1: 0.6268
 epoch: 21, train_loss: 0.6808, test_loss: 1.0882, test_f1: 0.6118
 epoch: 22, train_loss: 0.6743, test_loss: 1.2344, test_f1: 0.5573
 epoch: 23, train_loss: 0.6232, test_loss: 1.1876, test_f1: 0.6120
 epoch: 24, train_loss: 0.6370, test_loss: 2.0109, test_f1: 0.5432
 epoch: 25, train_loss: 0.6260, test_loss: 1.1645, test_f1: 0.5666
 epoch: 26, train_loss: 0.6461, test_loss: 1.0475, test_f1: 0.6007
 epoch: 27, train_loss: 0.5972, test_loss: 1.2057, test_f1: 0.5213
 epoch: 28, train_loss: 0.6276, test_loss: 1.0011, test_f1: 0.6373
 epoch: 29, train_loss: 0.6024, test_loss: 1.0368, test_f1: 0.6484
 epoch: 30, train_loss: 0.5630, test_loss: 1.7151, test_f1: 0.4667
 epoch: 31, train_loss: 0.5668, test_loss: 1.4361, test_f1: 0.5644
 epoch: 32, train_loss: 0.5841, test_loss: 1.2624, test_f1: 0.5918
 epoch: 33, train_loss: 0.5734, test_loss: 1.1556, test_f1: 0.6354
 epoch: 34, train_loss: 0.5493, test_loss: 1.1102, test_f1: 0.6077
 epoch: 35, train_loss: 0.5862, test_loss: 1.3623, test_f1: 0.6175
 epoch: 36, train_loss: 0.5643, test_loss: 1.3505, test_f1: 0.5714
 epoch: 37, train_loss: 0.5405, test_loss: 1.1439, test_f1: 0.6513
 epoch: 38, train_loss: 0.5371, test_loss: 1.7982, test_f1: 0.5314
 epoch: 39, train_loss: 0.5118, test_loss: 1.3849, test_f1: 0.5943
 epoch: 40, train_loss: 0.5635, test_loss: 1.2317, test_f1: 0.5833
 epoch: 41, train_loss: 0.5580, test_loss: 1.1452, test_f1: 0.5651
 epoch: 42, train_loss: 0.5513, test_loss: 1.1316, test_f1: 0.6163
 epoch: 43, train_loss: 0.5691, test_loss: 1.5054, test_f1: 0.6373
 epoch: 44, train_loss: 0.5643, test_loss: 1.1407, test_f1: 0.6019
 epoch: 45, train_loss: 0.5605, test_loss: 1.2909, test_f1: 0.5769
 epoch: 46, train_loss: 0.5641, test_loss: 1.1669, test_f1: 0.6123
 epoch: 47, train_loss: 0.5149, test_loss: 1.6752, test_f1: 0.5210
 epoch: 48, train_loss: 0.5044, test_loss: 1.2418, test_f1: 0.6057
 epoch: 49, train_loss: 0.5531, test_loss: 1.3341, test_f1: 0.6413
 epoch: 50, train_loss: 0.5112, test_loss: 1.1844, test_f1: 0.5962
 epoch: 51, train_loss: 0.4686, test_loss: 1.4371, test_f1: 0.6488
 epoch: 52, train_loss: 0.4202, test_loss: 1.5608, test_f1: 0.6361
 epoch: 53, train_loss: 0.4338, test_loss: 1.2489, test_f1: 0.6516
 epoch: 54, train_loss: 0.4307, test_loss: 1.9346, test_f1: 0.6004
 epoch: 55, train_loss: 0.3994, test_loss: 1.5209, test_f1: 0.6370
 epoch: 56, train_loss: 0.4242, test_loss: 1.8734, test_f1: 0.5839
 epoch: 57, train_loss: 0.4046, test_loss: 1.3910, test_f1: 0.6292
 epoch: 58, train_loss: 0.3975, test_loss: 1.5629, test_f1: 0.5989
 epoch: 59, train_loss: 0.4232, test_loss: 2.1213, test_f1: 0.6098
 epoch: 60, train_loss: 0.4087, test_loss: 1.4899, test_f1: 0.6041
 epoch: 61, train_loss: 0.4045, test_loss: 1.9922, test_f1: 0.5956
 epoch: 62, train_loss: 0.3536, test_loss: 1.4164, test_f1: 0.5863
 epoch: 63, train_loss: 0.3780, test_loss: 1.6009, test_f1: 0.6009
 epoch: 64, train_loss: 0.3623, test_loss: 1.9448, test_f1: 0.6092
 epoch: 65, train_loss: 0.3593, test_loss: 1.9561, test_f1: 0.5897
 epoch: 66, train_loss: 0.3703, test_loss: 1.7716, test_f1: 0.5983
 epoch: 67, train_loss: 0.3888, test_loss: 1.3722, test_f1: 0.5822
 epoch: 68, train_loss: 0.3749, test_loss: 1.6716, test_f1: 0.6002
 epoch: 69, train_loss: 0.3971, test_loss: 1.7388, test_f1: 0.5588
 epoch: 70, train_loss: 0.4122, test_loss: 1.5381, test_f1: 0.5888
 epoch: 71, train_loss: 0.3798, test_loss: 1.6804, test_f1: 0.5828
 epoch: 72, train_loss: 0.3754, test_loss: 1.6516, test_f1: 0.6084
 epoch: 73, train_loss: 0.3437, test_loss: 1.7207, test_f1: 0.5850
 epoch: 74, train_loss: 0.3342, test_loss: 1.8313, test_f1: 0.5626
 epoch: 75, train_loss: 0.3436, test_loss: 2.0641, test_f1: 0.5480
 epoch: 76, train_loss: 0.3434, test_loss: 2.3074, test_f1: 0.5601
 epoch: 77, train_loss: 0.3348, test_loss: 1.6410, test_f1: 0.6294
 epoch: 78, train_loss: 0.3577, test_loss: 1.4233, test_f1: 0.6339
 epoch: 79, train_loss: 0.3594, test_loss: 1.5881, test_f1: 0.6289
 epoch: 80, train_loss: 0.3912, test_loss: 2.0843, test_f1: 0.5485
 epoch: 81, train_loss: 0.3658, test_loss: 1.7913, test_f1: 0.6219
 epoch: 82, train_loss: 0.3411, test_loss: 1.8304, test_f1: 0.5653
 epoch: 83, train_loss: 0.3226, test_loss: 1.5887, test_f1: 0.5664
 epoch: 84, train_loss: 0.3347, test_loss: 1.8854, test_f1: 0.6193
 epoch: 85, train_loss: 0.3339, test_loss: 1.8676, test_f1: 0.5938
 epoch: 86, train_loss: 0.3358, test_loss: 1.9003, test_f1: 0.5852
 epoch: 87, train_loss: 0.3136, test_loss: 2.1224, test_f1: 0.6115
 epoch: 88, train_loss: 0.2765, test_loss: 2.1819, test_f1: 0.6202
 epoch: 89, train_loss: 0.2771, test_loss: 2.5129, test_f1: 0.5492
 epoch: 90, train_loss: 0.3034, test_loss: 2.0338, test_f1: 0.5982
 epoch: 91, train_loss: 0.2958, test_loss: 2.1283, test_f1: 0.5840
 epoch: 92, train_loss: 0.2985, test_loss: 2.5180, test_f1: 0.6001
 epoch: 93, train_loss: 0.2901, test_loss: 2.0803, test_f1: 0.5984
 epoch: 94, train_loss: 0.2812, test_loss: 2.2747, test_f1: 0.6164
 epoch: 95, train_loss: 0.2718, test_loss: 1.8511, test_f1: 0.5508
 epoch: 96, train_loss: 0.3067, test_loss: 1.8407, test_f1: 0.5916
 epoch: 97, train_loss: 0.3148, test_loss: 1.8850, test_f1: 0.5775
 epoch: 98, train_loss: 0.2845, test_loss: 1.7608, test_f1: 0.6187
 epoch: 99, train_loss: 0.2884, test_loss: 2.3949, test_f1: 0.6171
##################ITERATION #5 ****************************************
 epoch: 0, train_loss: 1.3223, test_loss: 1.4959, test_f1: 0.1795
 epoch: 1, train_loss: 1.0151, test_loss: 1.2391, test_f1: 0.4477
 epoch: 2, train_loss: 0.9123, test_loss: 1.1189, test_f1: 0.4123
 epoch: 3, train_loss: 0.8954, test_loss: 1.0187, test_f1: 0.5424
 epoch: 4, train_loss: 0.8278, test_loss: 0.9657, test_f1: 0.5976
 epoch: 5, train_loss: 0.7982, test_loss: 1.0624, test_f1: 0.5446
 epoch: 6, train_loss: 0.7875, test_loss: 1.0629, test_f1: 0.5454
 epoch: 7, train_loss: 0.7905, test_loss: 1.0097, test_f1: 0.5356
 epoch: 8, train_loss: 0.7519, test_loss: 0.9909, test_f1: 0.5630
 epoch: 9, train_loss: 0.7494, test_loss: 1.0840, test_f1: 0.5701
 epoch: 10, train_loss: 0.7439, test_loss: 0.8595, test_f1: 0.6413
 epoch: 11, train_loss: 0.7266, test_loss: 0.9516, test_f1: 0.6301
 epoch: 12, train_loss: 0.7156, test_loss: 1.0021, test_f1: 0.6161
 epoch: 13, train_loss: 0.7100, test_loss: 1.0834, test_f1: 0.6206
 epoch: 14, train_loss: 0.6929, test_loss: 0.9621, test_f1: 0.5886
 epoch: 15, train_loss: 0.6981, test_loss: 1.0823, test_f1: 0.5925
 epoch: 16, train_loss: 0.6936, test_loss: 1.7509, test_f1: 0.3765
 epoch: 17, train_loss: 0.7047, test_loss: 1.0019, test_f1: 0.6632
 epoch: 18, train_loss: 0.6944, test_loss: 1.0527, test_f1: 0.5968
 epoch: 19, train_loss: 0.7007, test_loss: 1.4384, test_f1: 0.4610
 epoch: 20, train_loss: 0.6761, test_loss: 1.2085, test_f1: 0.5361
 epoch: 21, train_loss: 0.6305, test_loss: 0.9903, test_f1: 0.5589
 epoch: 22, train_loss: 0.6424, test_loss: 1.0426, test_f1: 0.6717
 epoch: 23, train_loss: 0.6074, test_loss: 1.0020, test_f1: 0.5962
 epoch: 24, train_loss: 0.6085, test_loss: 1.0342, test_f1: 0.6019
 epoch: 25, train_loss: 0.5977, test_loss: 1.1258, test_f1: 0.5737
 epoch: 26, train_loss: 0.6040, test_loss: 1.3352, test_f1: 0.5197
 epoch: 27, train_loss: 0.5911, test_loss: 1.1825, test_f1: 0.5975
 epoch: 28, train_loss: 0.5984, test_loss: 1.3343, test_f1: 0.5640
 epoch: 29, train_loss: 0.5771, test_loss: 1.1431, test_f1: 0.5763
 epoch: 30, train_loss: 0.5704, test_loss: 1.2228, test_f1: 0.6080
 epoch: 31, train_loss: 0.5908, test_loss: 1.2946, test_f1: 0.5718
 epoch: 32, train_loss: 0.5983, test_loss: 1.0791, test_f1: 0.5945
 epoch: 33, train_loss: 0.5811, test_loss: 1.1605, test_f1: 0.5258
 epoch: 34, train_loss: 0.5593, test_loss: 1.8353, test_f1: 0.4948
 epoch: 35, train_loss: 0.6196, test_loss: 1.2270, test_f1: 0.5774
 epoch: 36, train_loss: 0.5623, test_loss: 1.2188, test_f1: 0.6200
 epoch: 37, train_loss: 0.5864, test_loss: 1.1073, test_f1: 0.5971
 epoch: 38, train_loss: 0.5718, test_loss: 1.0883, test_f1: 0.5841
 epoch: 39, train_loss: 0.5284, test_loss: 1.4376, test_f1: 0.6119
 epoch: 40, train_loss: 0.5456, test_loss: 1.5064, test_f1: 0.6010
 epoch: 41, train_loss: 0.5213, test_loss: 1.2258, test_f1: 0.6859
 epoch: 42, train_loss: 0.5299, test_loss: 1.4846, test_f1: 0.5811
 epoch: 43, train_loss: 0.5149, test_loss: 1.4292, test_f1: 0.5952
 epoch: 44, train_loss: 0.5180, test_loss: 1.4536, test_f1: 0.6349
 epoch: 45, train_loss: 0.5195, test_loss: 1.1954, test_f1: 0.6387
 epoch: 46, train_loss: 0.5507, test_loss: 1.1710, test_f1: 0.6344
 epoch: 47, train_loss: 0.4972, test_loss: 1.2334, test_f1: 0.5711
 epoch: 48, train_loss: 0.4798, test_loss: 1.3909, test_f1: 0.6361
 epoch: 49, train_loss: 0.4713, test_loss: 1.2522, test_f1: 0.6602
 epoch: 50, train_loss: 0.4769, test_loss: 1.4748, test_f1: 0.6757
 epoch: 51, train_loss: 0.4586, test_loss: 1.4780, test_f1: 0.6077
 epoch: 52, train_loss: 0.4680, test_loss: 1.7179, test_f1: 0.5906
 epoch: 53, train_loss: 0.4340, test_loss: 1.2795, test_f1: 0.6234
 epoch: 54, train_loss: 0.3961, test_loss: 1.2935, test_f1: 0.6467
 epoch: 55, train_loss: 0.3917, test_loss: 1.2496, test_f1: 0.6557
 epoch: 56, train_loss: 0.3780, test_loss: 1.4855, test_f1: 0.6352
 epoch: 57, train_loss: 0.4149, test_loss: 1.4423, test_f1: 0.6099
 epoch: 58, train_loss: 0.3920, test_loss: 1.4885, test_f1: 0.5935
 epoch: 59, train_loss: 0.3705, test_loss: 1.3988, test_f1: 0.6273
 epoch: 60, train_loss: 0.3568, test_loss: 1.4428, test_f1: 0.6024
 epoch: 61, train_loss: 0.3922, test_loss: 1.3832, test_f1: 0.6314
 epoch: 62, train_loss: 0.3655, test_loss: 1.4704, test_f1: 0.6376
 epoch: 63, train_loss: 0.3500, test_loss: 1.6222, test_f1: 0.6357
 epoch: 64, train_loss: 0.3592, test_loss: 1.4789, test_f1: 0.6518
 epoch: 65, train_loss: 0.3255, test_loss: 1.5681, test_f1: 0.6379
 epoch: 66, train_loss: 0.3524, test_loss: 1.9322, test_f1: 0.6071
 epoch: 67, train_loss: 0.3155, test_loss: 1.5217, test_f1: 0.6238
 epoch: 68, train_loss: 0.3823, test_loss: 1.5782, test_f1: 0.5998
 epoch: 69, train_loss: 0.3540, test_loss: 2.4045, test_f1: 0.5662
 epoch: 70, train_loss: 0.3391, test_loss: 1.7407, test_f1: 0.5930
 epoch: 71, train_loss: 0.3422, test_loss: 1.8311, test_f1: 0.5917
 epoch: 72, train_loss: 0.3567, test_loss: 1.6388, test_f1: 0.6404
 epoch: 73, train_loss: 0.3095, test_loss: 1.5763, test_f1: 0.5889
 epoch: 74, train_loss: 0.3259, test_loss: 1.9732, test_f1: 0.5726
 epoch: 75, train_loss: 0.3375, test_loss: 1.6377, test_f1: 0.6305
 epoch: 76, train_loss: 0.3357, test_loss: 1.8271, test_f1: 0.6103
 epoch: 77, train_loss: 0.3802, test_loss: 1.8257, test_f1: 0.5780
 epoch: 78, train_loss: 0.3969, test_loss: 1.4806, test_f1: 0.6142
 epoch: 79, train_loss: 0.3168, test_loss: 1.6249, test_f1: 0.6423
 epoch: 80, train_loss: 0.3197, test_loss: 1.7445, test_f1: 0.6486
 epoch: 81, train_loss: 0.3155, test_loss: 1.6973, test_f1: 0.6428
 epoch: 82, train_loss: 0.3199, test_loss: 1.5362, test_f1: 0.6257
 epoch: 83, train_loss: 0.2984, test_loss: 1.5399, test_f1: 0.6180
 epoch: 84, train_loss: 0.3030, test_loss: 1.6568, test_f1: 0.6480
 epoch: 85, train_loss: 0.3629, test_loss: 1.6857, test_f1: 0.6319
 epoch: 86, train_loss: 0.3769, test_loss: 1.3568, test_f1: 0.6217
 epoch: 87, train_loss: 0.3524, test_loss: 1.4124, test_f1: 0.6022
 epoch: 88, train_loss: 0.3281, test_loss: 1.5543, test_f1: 0.6195
 epoch: 89, train_loss: 0.3044, test_loss: 1.4134, test_f1: 0.6299
 epoch: 90, train_loss: 0.3003, test_loss: 1.8404, test_f1: 0.6134
 epoch: 91, train_loss: 0.2942, test_loss: 1.5632, test_f1: 0.6327
 epoch: 92, train_loss: 0.2785, test_loss: 1.4914, test_f1: 0.6613
 epoch: 93, train_loss: 0.2800, test_loss: 1.7167, test_f1: 0.6381
 epoch: 94, train_loss: 0.2627, test_loss: 1.6640, test_f1: 0.6484
 epoch: 95, train_loss: 0.2452, test_loss: 1.6946, test_f1: 0.6308
 epoch: 96, train_loss: 0.2565, test_loss: 1.6306, test_f1: 0.6320
 epoch: 97, train_loss: 0.2463, test_loss: 1.6440, test_f1: 0.6368
 epoch: 98, train_loss: 0.2888, test_loss: 1.6515, test_f1: 0.6488
 epoch: 99, train_loss: 0.2563, test_loss: 1.7674, test_f1: 0.6473
##################ITERATION #6 ****************************************
 epoch: 0, train_loss: 1.3341, test_loss: 1.2889, test_f1: 0.3618
 epoch: 1, train_loss: 1.0516, test_loss: 1.1299, test_f1: 0.4328
 epoch: 2, train_loss: 0.9296, test_loss: 1.0659, test_f1: 0.4666
 epoch: 3, train_loss: 0.8880, test_loss: 1.1473, test_f1: 0.4349
 epoch: 4, train_loss: 0.8967, test_loss: 1.0791, test_f1: 0.4802
 epoch: 5, train_loss: 0.8372, test_loss: 1.0437, test_f1: 0.5301
 epoch: 6, train_loss: 0.7974, test_loss: 1.4468, test_f1: 0.3485
 epoch: 7, train_loss: 0.8063, test_loss: 1.1111, test_f1: 0.4833
 epoch: 8, train_loss: 0.8140, test_loss: 1.0674, test_f1: 0.4927
 epoch: 9, train_loss: 0.8194, test_loss: 1.2402, test_f1: 0.5048
 epoch: 10, train_loss: 0.7717, test_loss: 1.0183, test_f1: 0.6068
 epoch: 11, train_loss: 0.7294, test_loss: 1.1185, test_f1: 0.5812
 epoch: 12, train_loss: 0.7122, test_loss: 1.8491, test_f1: 0.4420
 epoch: 13, train_loss: 0.7227, test_loss: 1.1333, test_f1: 0.5922
 epoch: 14, train_loss: 0.7106, test_loss: 1.2107, test_f1: 0.4681
 epoch: 15, train_loss: 0.7162, test_loss: 1.0257, test_f1: 0.5473
 epoch: 16, train_loss: 0.6888, test_loss: 1.3918, test_f1: 0.5267
 epoch: 17, train_loss: 0.7050, test_loss: 2.0338, test_f1: 0.4460
 epoch: 18, train_loss: 0.8275, test_loss: 1.0214, test_f1: 0.5489
 epoch: 19, train_loss: 0.7775, test_loss: 1.1043, test_f1: 0.5851
 epoch: 20, train_loss: 0.7162, test_loss: 0.9788, test_f1: 0.6170
 epoch: 21, train_loss: 0.7006, test_loss: 0.9380, test_f1: 0.6525
 epoch: 22, train_loss: 0.6690, test_loss: 1.1256, test_f1: 0.5871
 epoch: 23, train_loss: 0.6612, test_loss: 1.2146, test_f1: 0.5449
 epoch: 24, train_loss: 0.6773, test_loss: 1.0754, test_f1: 0.5784
 epoch: 25, train_loss: 0.6492, test_loss: 1.3689, test_f1: 0.5767
 epoch: 26, train_loss: 0.7039, test_loss: 1.4126, test_f1: 0.5623
 epoch: 27, train_loss: 0.6917, test_loss: 1.2361, test_f1: 0.6055
 epoch: 28, train_loss: 0.7469, test_loss: 1.0686, test_f1: 0.5732
 epoch: 29, train_loss: 0.7216, test_loss: 1.0068, test_f1: 0.5974
 epoch: 30, train_loss: 0.6801, test_loss: 1.1037, test_f1: 0.5901
 epoch: 31, train_loss: 0.6435, test_loss: 1.4371, test_f1: 0.6273
 epoch: 32, train_loss: 0.6430, test_loss: 1.1657, test_f1: 0.6574
 epoch: 33, train_loss: 0.6363, test_loss: 1.1672, test_f1: 0.6215
 epoch: 34, train_loss: 0.6497, test_loss: 1.0833, test_f1: 0.6170
 epoch: 35, train_loss: 0.6207, test_loss: 1.0086, test_f1: 0.6570
 epoch: 36, train_loss: 0.6145, test_loss: 1.1249, test_f1: 0.6132
 epoch: 37, train_loss: 0.6135, test_loss: 1.3565, test_f1: 0.5901
 epoch: 38, train_loss: 0.6252, test_loss: 1.0324, test_f1: 0.6142
 epoch: 39, train_loss: 0.5977, test_loss: 1.3541, test_f1: 0.4907
 epoch: 40, train_loss: 0.6005, test_loss: 1.3330, test_f1: 0.6439
 epoch: 41, train_loss: 0.5621, test_loss: 3.7801, test_f1: 0.4244
 epoch: 42, train_loss: 0.6080, test_loss: 1.3742, test_f1: 0.6439
 epoch: 43, train_loss: 0.5740, test_loss: 1.0087, test_f1: 0.6582
 epoch: 44, train_loss: 0.5743, test_loss: 1.3366, test_f1: 0.5474
 epoch: 45, train_loss: 0.5399, test_loss: 1.3998, test_f1: 0.6308
 epoch: 46, train_loss: 0.5648, test_loss: 1.6160, test_f1: 0.5892
 epoch: 47, train_loss: 0.5523, test_loss: 1.1337, test_f1: 0.6401
 epoch: 48, train_loss: 0.5835, test_loss: 1.2758, test_f1: 0.6449
 epoch: 49, train_loss: 0.5478, test_loss: 1.4072, test_f1: 0.6585
 epoch: 50, train_loss: 0.5087, test_loss: 1.9610, test_f1: 0.5850
 epoch: 51, train_loss: 0.5207, test_loss: 1.2985, test_f1: 0.6634
 epoch: 52, train_loss: 0.5062, test_loss: 1.4854, test_f1: 0.6545
 epoch: 53, train_loss: 0.4654, test_loss: 1.3366, test_f1: 0.6653
 epoch: 54, train_loss: 0.4392, test_loss: 1.5091, test_f1: 0.6662
 epoch: 55, train_loss: 0.4171, test_loss: 1.8478, test_f1: 0.6416
 epoch: 56, train_loss: 0.4500, test_loss: 1.9410, test_f1: 0.6276
 epoch: 57, train_loss: 0.4817, test_loss: 1.4945, test_f1: 0.5380
 epoch: 58, train_loss: 0.4823, test_loss: 2.1277, test_f1: 0.6547
 epoch: 59, train_loss: 0.5043, test_loss: 1.8167, test_f1: 0.6038
 epoch: 60, train_loss: 0.4684, test_loss: 1.6019, test_f1: 0.6328
 epoch: 61, train_loss: 0.4323, test_loss: 1.6927, test_f1: 0.6614
 epoch: 62, train_loss: 0.4402, test_loss: 1.7546, test_f1: 0.6333
 epoch: 63, train_loss: 0.4419, test_loss: 1.3853, test_f1: 0.6413
 epoch: 64, train_loss: 0.3970, test_loss: 1.9553, test_f1: 0.6502
 epoch: 65, train_loss: 0.4116, test_loss: 1.6535, test_f1: 0.6019
 epoch: 66, train_loss: 0.4246, test_loss: 1.7918, test_f1: 0.6111
 epoch: 67, train_loss: 0.4291, test_loss: 1.7721, test_f1: 0.6281
 epoch: 68, train_loss: 0.4299, test_loss: 1.9503, test_f1: 0.6343
 epoch: 69, train_loss: 0.3951, test_loss: 2.2335, test_f1: 0.5753
 epoch: 70, train_loss: 0.4092, test_loss: 1.6313, test_f1: 0.6413
 epoch: 71, train_loss: 0.3783, test_loss: 1.8136, test_f1: 0.6343
 epoch: 72, train_loss: 0.3677, test_loss: 1.9996, test_f1: 0.6593
 epoch: 73, train_loss: 0.3620, test_loss: 1.8313, test_f1: 0.6183
 epoch: 74, train_loss: 0.3854, test_loss: 2.1858, test_f1: 0.6243
 epoch: 75, train_loss: 0.3489, test_loss: 2.1894, test_f1: 0.6439
 epoch: 76, train_loss: 0.3197, test_loss: 2.0006, test_f1: 0.6268
 epoch: 77, train_loss: 0.3420, test_loss: 2.2108, test_f1: 0.6670
 epoch: 78, train_loss: 0.3248, test_loss: 2.2475, test_f1: 0.6029
 epoch: 79, train_loss: 0.3432, test_loss: 2.0737, test_f1: 0.6643
 epoch: 80, train_loss: 0.3499, test_loss: 1.8144, test_f1: 0.6787
 epoch: 81, train_loss: 0.3950, test_loss: 1.6241, test_f1: 0.6795
 epoch: 82, train_loss: 0.3627, test_loss: 2.1891, test_f1: 0.6772
 epoch: 83, train_loss: 0.3491, test_loss: 2.4131, test_f1: 0.6565
 epoch: 84, train_loss: 0.3390, test_loss: 2.7754, test_f1: 0.5874
 epoch: 85, train_loss: 0.4265, test_loss: 1.8651, test_f1: 0.6367
 epoch: 86, train_loss: 0.4136, test_loss: 2.2035, test_f1: 0.6551
 epoch: 87, train_loss: 0.3654, test_loss: 1.7131, test_f1: 0.6559
 epoch: 88, train_loss: 0.3289, test_loss: 2.1634, test_f1: 0.6630
 epoch: 89, train_loss: 0.3063, test_loss: 2.4439, test_f1: 0.6406
 epoch: 90, train_loss: 0.3175, test_loss: 2.3248, test_f1: 0.6433
 epoch: 91, train_loss: 0.3220, test_loss: 2.4026, test_f1: 0.6465
 epoch: 92, train_loss: 0.3657, test_loss: 2.2159, test_f1: 0.6488
 epoch: 93, train_loss: 0.3378, test_loss: 2.3668, test_f1: 0.6396
 epoch: 94, train_loss: 0.3344, test_loss: 2.2466, test_f1: 0.6448
 epoch: 95, train_loss: 0.3510, test_loss: 2.2628, test_f1: 0.6419
 epoch: 96, train_loss: 0.3415, test_loss: 1.9445, test_f1: 0.6163
 epoch: 97, train_loss: 0.3530, test_loss: 1.7040, test_f1: 0.6722
 epoch: 98, train_loss: 0.3065, test_loss: 2.6866, test_f1: 0.6122
 epoch: 99, train_loss: 0.3232, test_loss: 2.4554, test_f1: 0.5932
##################ITERATION #7 ****************************************
 epoch: 0, train_loss: 1.3531, test_loss: 1.3096, test_f1: 0.3119
 epoch: 1, train_loss: 1.0372, test_loss: 1.1844, test_f1: 0.4631
 epoch: 2, train_loss: 0.9246, test_loss: 1.0980, test_f1: 0.5396
 epoch: 3, train_loss: 0.8791, test_loss: 1.1338, test_f1: 0.5484
 epoch: 4, train_loss: 0.8444, test_loss: 1.7175, test_f1: 0.4284
 epoch: 5, train_loss: 0.8214, test_loss: 1.0299, test_f1: 0.5480
 epoch: 6, train_loss: 0.8067, test_loss: 1.0755, test_f1: 0.5467
 epoch: 7, train_loss: 0.7786, test_loss: 0.9842, test_f1: 0.5952
 epoch: 8, train_loss: 0.7854, test_loss: 0.9636, test_f1: 0.5998
 epoch: 9, train_loss: 0.7993, test_loss: 1.0546, test_f1: 0.5797
 epoch: 10, train_loss: 0.7916, test_loss: 1.0258, test_f1: 0.5617
 epoch: 11, train_loss: 0.7827, test_loss: 1.0494, test_f1: 0.5488
 epoch: 12, train_loss: 0.7449, test_loss: 1.2923, test_f1: 0.4988
 epoch: 13, train_loss: 0.7576, test_loss: 1.0161, test_f1: 0.6112
 epoch: 14, train_loss: 0.7364, test_loss: 1.1404, test_f1: 0.5352
 epoch: 15, train_loss: 0.7679, test_loss: 1.2800, test_f1: 0.5106
 epoch: 16, train_loss: 0.7490, test_loss: 1.0641, test_f1: 0.6091
 epoch: 17, train_loss: 0.7127, test_loss: 0.9973, test_f1: 0.6312
 epoch: 18, train_loss: 0.7017, test_loss: 1.1973, test_f1: 0.6143
 epoch: 19, train_loss: 0.6998, test_loss: 1.0901, test_f1: 0.6185
 epoch: 20, train_loss: 0.6721, test_loss: 1.2013, test_f1: 0.5127
 epoch: 21, train_loss: 0.6667, test_loss: 1.1455, test_f1: 0.6043
 epoch: 22, train_loss: 0.6968, test_loss: 1.4644, test_f1: 0.5288
 epoch: 23, train_loss: 0.7031, test_loss: 1.0776, test_f1: 0.5849
 epoch: 24, train_loss: 0.6765, test_loss: 1.1024, test_f1: 0.5758
 epoch: 25, train_loss: 0.7001, test_loss: 1.0903, test_f1: 0.5685
 epoch: 26, train_loss: 0.6751, test_loss: 1.8988, test_f1: 0.5468
 epoch: 27, train_loss: 0.6857, test_loss: 1.1305, test_f1: 0.6054
 epoch: 28, train_loss: 0.6742, test_loss: 1.0815, test_f1: 0.6133
 epoch: 29, train_loss: 0.6505, test_loss: 1.3151, test_f1: 0.5588
 epoch: 30, train_loss: 0.6237, test_loss: 1.3167, test_f1: 0.5830
 epoch: 31, train_loss: 0.6378, test_loss: 1.1004, test_f1: 0.5955
 epoch: 32, train_loss: 0.6403, test_loss: 1.1314, test_f1: 0.5910
 epoch: 33, train_loss: 0.6337, test_loss: 1.2276, test_f1: 0.5681
 epoch: 34, train_loss: 0.6591, test_loss: 1.0664, test_f1: 0.6234
 epoch: 35, train_loss: 0.6158, test_loss: 1.1231, test_f1: 0.6161
 epoch: 36, train_loss: 0.6598, test_loss: 1.5842, test_f1: 0.5251
 epoch: 37, train_loss: 0.6327, test_loss: 1.6052, test_f1: 0.4993
 epoch: 38, train_loss: 0.6408, test_loss: 1.7509, test_f1: 0.5562
 epoch: 39, train_loss: 0.6442, test_loss: 1.2565, test_f1: 0.5809
 epoch: 40, train_loss: 0.6302, test_loss: 1.8412, test_f1: 0.4252
 epoch: 41, train_loss: 0.6085, test_loss: 1.7751, test_f1: 0.4995
 epoch: 42, train_loss: 0.5918, test_loss: 1.2874, test_f1: 0.5795
 epoch: 43, train_loss: 0.5620, test_loss: 1.4361, test_f1: 0.5577
 epoch: 44, train_loss: 0.5459, test_loss: 1.6136, test_f1: 0.6045
 epoch: 45, train_loss: 0.5457, test_loss: 1.4700, test_f1: 0.5382
 epoch: 46, train_loss: 0.5735, test_loss: 1.3828, test_f1: 0.6339
 epoch: 47, train_loss: 0.5791, test_loss: 1.2661, test_f1: 0.5708
 epoch: 48, train_loss: 0.5393, test_loss: 1.7853, test_f1: 0.4764
 epoch: 49, train_loss: 0.5366, test_loss: 1.2044, test_f1: 0.6049
 epoch: 50, train_loss: 0.5142, test_loss: 1.3570, test_f1: 0.6030
 epoch: 51, train_loss: 0.4899, test_loss: 1.8811, test_f1: 0.5728
 epoch: 52, train_loss: 0.4729, test_loss: 1.7136, test_f1: 0.6247
 epoch: 53, train_loss: 0.4384, test_loss: 1.7199, test_f1: 0.6163
 epoch: 54, train_loss: 0.4414, test_loss: 1.9547, test_f1: 0.6215
 epoch: 55, train_loss: 0.4609, test_loss: 1.9890, test_f1: 0.5499
 epoch: 56, train_loss: 0.4338, test_loss: 1.5425, test_f1: 0.5854
 epoch: 57, train_loss: 0.4368, test_loss: 1.7148, test_f1: 0.5757
 epoch: 58, train_loss: 0.4197, test_loss: 1.8919, test_f1: 0.6146
 epoch: 59, train_loss: 0.4089, test_loss: 1.9204, test_f1: 0.6482
 epoch: 60, train_loss: 0.4037, test_loss: 2.2622, test_f1: 0.6201
 epoch: 61, train_loss: 0.4268, test_loss: 1.7490, test_f1: 0.6210
 epoch: 62, train_loss: 0.4250, test_loss: 1.9967, test_f1: 0.6185
 epoch: 63, train_loss: 0.4121, test_loss: 2.0932, test_f1: 0.5901
 epoch: 64, train_loss: 0.4204, test_loss: 2.3323, test_f1: 0.5091
 epoch: 65, train_loss: 0.4508, test_loss: 2.2061, test_f1: 0.5946
 epoch: 66, train_loss: 0.4172, test_loss: 1.9575, test_f1: 0.6186
 epoch: 67, train_loss: 0.3886, test_loss: 1.7936, test_f1: 0.6417
 epoch: 68, train_loss: 0.3806, test_loss: 2.4629, test_f1: 0.6165
 epoch: 69, train_loss: 0.3702, test_loss: 2.4173, test_f1: 0.6474
 epoch: 70, train_loss: 0.3996, test_loss: 1.7976, test_f1: 0.5613
 epoch: 71, train_loss: 0.3528, test_loss: 2.2455, test_f1: 0.5931
 epoch: 72, train_loss: 0.3531, test_loss: 2.4807, test_f1: 0.6097
 epoch: 73, train_loss: 0.3513, test_loss: 2.3734, test_f1: 0.6390
 epoch: 74, train_loss: 0.3620, test_loss: 2.5497, test_f1: 0.6313
 epoch: 75, train_loss: 0.3354, test_loss: 2.5394, test_f1: 0.5936
 epoch: 76, train_loss: 0.3179, test_loss: 2.3904, test_f1: 0.6080
 epoch: 77, train_loss: 0.3311, test_loss: 2.4180, test_f1: 0.6159
 epoch: 78, train_loss: 0.3199, test_loss: 2.2758, test_f1: 0.6062
 epoch: 79, train_loss: 0.3225, test_loss: 2.8794, test_f1: 0.5971
 epoch: 80, train_loss: 0.3331, test_loss: 2.5344, test_f1: 0.6044
 epoch: 81, train_loss: 0.3341, test_loss: 2.2481, test_f1: 0.6278
 epoch: 82, train_loss: 0.3213, test_loss: 2.7756, test_f1: 0.6268
 epoch: 83, train_loss: 0.3589, test_loss: 2.1826, test_f1: 0.6357
 epoch: 84, train_loss: 0.3476, test_loss: 2.6061, test_f1: 0.6053
 epoch: 85, train_loss: 0.3871, test_loss: 1.9578, test_f1: 0.5818
 epoch: 86, train_loss: 0.3455, test_loss: 1.9891, test_f1: 0.5812
 epoch: 87, train_loss: 0.3381, test_loss: 2.3120, test_f1: 0.6022
 epoch: 88, train_loss: 0.3501, test_loss: 2.1344, test_f1: 0.5317
 epoch: 89, train_loss: 0.3048, test_loss: 3.2612, test_f1: 0.6350
 epoch: 90, train_loss: 0.2864, test_loss: 2.5010, test_f1: 0.6095
 epoch: 91, train_loss: 0.2994, test_loss: 2.3302, test_f1: 0.6064
 epoch: 92, train_loss: 0.3270, test_loss: 2.5370, test_f1: 0.5872
 epoch: 93, train_loss: 0.3281, test_loss: 2.5905, test_f1: 0.5982
 epoch: 94, train_loss: 0.2987, test_loss: 2.9077, test_f1: 0.5969
 epoch: 95, train_loss: 0.2906, test_loss: 2.8473, test_f1: 0.5962
 epoch: 96, train_loss: 0.2689, test_loss: 2.5869, test_f1: 0.6258
 epoch: 97, train_loss: 0.2881, test_loss: 2.6641, test_f1: 0.6470
 epoch: 98, train_loss: 0.2742, test_loss: 3.1311, test_f1: 0.5799
 epoch: 99, train_loss: 0.2640, test_loss: 3.0168, test_f1: 0.6324
##################ITERATION #8 ****************************************
 epoch: 0, train_loss: 1.3664, test_loss: 1.6202, test_f1: 0.1377
 epoch: 1, train_loss: 1.0346, test_loss: 1.3492, test_f1: 0.3445
 epoch: 2, train_loss: 0.9356, test_loss: 1.1351, test_f1: 0.4708
 epoch: 3, train_loss: 0.9025, test_loss: 1.0371, test_f1: 0.5091
 epoch: 4, train_loss: 0.8630, test_loss: 1.0304, test_f1: 0.5581
 epoch: 5, train_loss: 0.8292, test_loss: 2.8069, test_f1: 0.4401
 epoch: 6, train_loss: 0.7852, test_loss: 0.9361, test_f1: 0.5848
 epoch: 7, train_loss: 0.7686, test_loss: 1.1168, test_f1: 0.5799
 epoch: 8, train_loss: 0.7787, test_loss: 0.9949, test_f1: 0.6070
 epoch: 9, train_loss: 0.7771, test_loss: 1.0318, test_f1: 0.5363
 epoch: 10, train_loss: 0.7572, test_loss: 1.4842, test_f1: 0.4887
 epoch: 11, train_loss: 0.7552, test_loss: 1.1328, test_f1: 0.5476
 epoch: 12, train_loss: 0.7896, test_loss: 1.0331, test_f1: 0.5738
 epoch: 13, train_loss: 0.7499, test_loss: 0.9670, test_f1: 0.6267
 epoch: 14, train_loss: 0.7225, test_loss: 0.9844, test_f1: 0.5694
 epoch: 15, train_loss: 0.6891, test_loss: 1.1909, test_f1: 0.5295
 epoch: 16, train_loss: 0.6835, test_loss: 1.0698, test_f1: 0.5906
 epoch: 17, train_loss: 0.6647, test_loss: 1.2792, test_f1: 0.5852
 epoch: 18, train_loss: 0.6486, test_loss: 1.1399, test_f1: 0.6059
 epoch: 19, train_loss: 0.6592, test_loss: 1.2152, test_f1: 0.6113
 epoch: 20, train_loss: 0.7321, test_loss: 1.0846, test_f1: 0.5781
 epoch: 21, train_loss: 0.7041, test_loss: 1.2057, test_f1: 0.6249
 epoch: 22, train_loss: 0.6466, test_loss: 1.6716, test_f1: 0.5611
 epoch: 23, train_loss: 0.6160, test_loss: 1.2101, test_f1: 0.6234
 epoch: 24, train_loss: 0.6244, test_loss: 1.1649, test_f1: 0.6209
 epoch: 25, train_loss: 0.6149, test_loss: 1.2763, test_f1: 0.6207
 epoch: 26, train_loss: 0.6115, test_loss: 1.3756, test_f1: 0.6422
 epoch: 27, train_loss: 0.5956, test_loss: 0.8983, test_f1: 0.6688
 epoch: 28, train_loss: 0.5989, test_loss: 1.0292, test_f1: 0.6293
 epoch: 29, train_loss: 0.5839, test_loss: 1.1417, test_f1: 0.5086
 epoch: 30, train_loss: 0.5918, test_loss: 1.0137, test_f1: 0.6280
 epoch: 31, train_loss: 0.5782, test_loss: 1.1662, test_f1: 0.5856
 epoch: 32, train_loss: 0.5631, test_loss: 1.1011, test_f1: 0.6756
 epoch: 33, train_loss: 0.5402, test_loss: 1.4084, test_f1: 0.5476
 epoch: 34, train_loss: 0.5673, test_loss: 0.9253, test_f1: 0.6465
 epoch: 35, train_loss: 0.5657, test_loss: 1.1963, test_f1: 0.5802
 epoch: 36, train_loss: 0.5598, test_loss: 1.1933, test_f1: 0.5886
 epoch: 37, train_loss: 0.5635, test_loss: 1.4536, test_f1: 0.5719
 epoch: 38, train_loss: 0.5667, test_loss: 1.2650, test_f1: 0.5838
 epoch: 39, train_loss: 0.5356, test_loss: 1.1396, test_f1: 0.6357
 epoch: 40, train_loss: 0.5021, test_loss: 1.0755, test_f1: 0.6439
 epoch: 41, train_loss: 0.5205, test_loss: 1.3789, test_f1: 0.5553
 epoch: 42, train_loss: 0.5362, test_loss: 1.1190, test_f1: 0.6292
 epoch: 43, train_loss: 0.4917, test_loss: 1.2183, test_f1: 0.6368
 epoch: 44, train_loss: 0.5776, test_loss: 1.5028, test_f1: 0.5742
 epoch: 45, train_loss: 0.5675, test_loss: 1.1768, test_f1: 0.6260
 epoch: 46, train_loss: 0.5258, test_loss: 1.3979, test_f1: 0.5864
 epoch: 47, train_loss: 0.4822, test_loss: 1.4573, test_f1: 0.5499
 epoch: 48, train_loss: 0.4879, test_loss: 1.3544, test_f1: 0.6314
 epoch: 49, train_loss: 0.4589, test_loss: 1.3096, test_f1: 0.5935
 epoch: 50, train_loss: 0.4459, test_loss: 1.1325, test_f1: 0.6190
 epoch: 51, train_loss: 0.4478, test_loss: 1.5894, test_f1: 0.6003
 epoch: 52, train_loss: 0.4200, test_loss: 1.5153, test_f1: 0.5944
 epoch: 53, train_loss: 0.4070, test_loss: 1.5164, test_f1: 0.5966
 epoch: 54, train_loss: 0.3986, test_loss: 1.4579, test_f1: 0.6610
 epoch: 55, train_loss: 0.3814, test_loss: 1.3050, test_f1: 0.6136
 epoch: 56, train_loss: 0.3816, test_loss: 1.5675, test_f1: 0.6078
 epoch: 57, train_loss: 0.3812, test_loss: 1.7732, test_f1: 0.5689
 epoch: 58, train_loss: 0.3512, test_loss: 1.3850, test_f1: 0.6422
 epoch: 59, train_loss: 0.3556, test_loss: 1.5952, test_f1: 0.6166
 epoch: 60, train_loss: 0.3645, test_loss: 1.4049, test_f1: 0.6563
 epoch: 61, train_loss: 0.3462, test_loss: 2.0619, test_f1: 0.5565
 epoch: 62, train_loss: 0.3921, test_loss: 1.4027, test_f1: 0.6238
 epoch: 63, train_loss: 0.3557, test_loss: 1.5807, test_f1: 0.6706
 epoch: 64, train_loss: 0.3908, test_loss: 1.2647, test_f1: 0.6272
 epoch: 65, train_loss: 0.3738, test_loss: 1.4042, test_f1: 0.6370
 epoch: 66, train_loss: 0.3706, test_loss: 1.4191, test_f1: 0.6133
 epoch: 67, train_loss: 0.3404, test_loss: 1.3749, test_f1: 0.6447
 epoch: 68, train_loss: 0.3439, test_loss: 1.2827, test_f1: 0.6375
 epoch: 69, train_loss: 0.3195, test_loss: 1.6090, test_f1: 0.6261
 epoch: 70, train_loss: 0.2953, test_loss: 1.3863, test_f1: 0.6800
 epoch: 71, train_loss: 0.3037, test_loss: 1.3988, test_f1: 0.6353
 epoch: 72, train_loss: 0.2968, test_loss: 1.4946, test_f1: 0.6610
 epoch: 73, train_loss: 0.3038, test_loss: 1.7412, test_f1: 0.6073
 epoch: 74, train_loss: 0.3071, test_loss: 1.6326, test_f1: 0.6289
 epoch: 75, train_loss: 0.3071, test_loss: 1.7339, test_f1: 0.6096
 epoch: 76, train_loss: 0.3087, test_loss: 1.7257, test_f1: 0.6314
 epoch: 77, train_loss: 0.2989, test_loss: 1.7773, test_f1: 0.6248
 epoch: 78, train_loss: 0.2943, test_loss: 1.6887, test_f1: 0.6362
 epoch: 79, train_loss: 0.2966, test_loss: 1.7704, test_f1: 0.6020
 epoch: 80, train_loss: 0.2986, test_loss: 1.7504, test_f1: 0.6144
 epoch: 81, train_loss: 0.2896, test_loss: 1.7246, test_f1: 0.6078
 epoch: 82, train_loss: 0.2643, test_loss: 1.8880, test_f1: 0.6312
 epoch: 83, train_loss: 0.2710, test_loss: 1.9106, test_f1: 0.6544
 epoch: 84, train_loss: 0.2511, test_loss: 1.8389, test_f1: 0.6390
 epoch: 85, train_loss: 0.2692, test_loss: 1.7630, test_f1: 0.6118
 epoch: 86, train_loss: 0.3113, test_loss: 1.9881, test_f1: 0.5955
 epoch: 87, train_loss: 0.3186, test_loss: 1.9296, test_f1: 0.5999
 epoch: 88, train_loss: 0.2728, test_loss: 1.7769, test_f1: 0.6127
 epoch: 89, train_loss: 0.2314, test_loss: 1.7364, test_f1: 0.6114
 epoch: 90, train_loss: 0.2599, test_loss: 1.6594, test_f1: 0.6210
 epoch: 91, train_loss: 0.2571, test_loss: 1.7705, test_f1: 0.6463
 epoch: 92, train_loss: 0.2344, test_loss: 1.9791, test_f1: 0.6225
 epoch: 93, train_loss: 0.2529, test_loss: 2.4951, test_f1: 0.5839
 epoch: 94, train_loss: 0.2663, test_loss: 1.7561, test_f1: 0.6118
 epoch: 95, train_loss: 0.2612, test_loss: 2.2888, test_f1: 0.6340
 epoch: 96, train_loss: 0.2889, test_loss: 1.7611, test_f1: 0.6160
 epoch: 97, train_loss: 0.2760, test_loss: 1.9742, test_f1: 0.6030
 epoch: 98, train_loss: 0.3075, test_loss: 1.5330, test_f1: 0.6585
 epoch: 99, train_loss: 0.2604, test_loss: 1.7793, test_f1: 0.6067
##################ITERATION #9 ****************************************
 epoch: 0, train_loss: 1.2631, test_loss: 1.6195, test_f1: 0.3866
 epoch: 1, train_loss: 1.0015, test_loss: 1.4223, test_f1: 0.2786
 epoch: 2, train_loss: 0.9117, test_loss: 1.1091, test_f1: 0.4210
 epoch: 3, train_loss: 0.8604, test_loss: 1.2430, test_f1: 0.4576
 epoch: 4, train_loss: 0.8262, test_loss: 1.0738, test_f1: 0.5265
 epoch: 5, train_loss: 0.7982, test_loss: 1.1702, test_f1: 0.5516
 epoch: 6, train_loss: 0.7927, test_loss: 1.0692, test_f1: 0.5496
 epoch: 7, train_loss: 0.7812, test_loss: 1.1755, test_f1: 0.4844
 epoch: 8, train_loss: 0.7973, test_loss: 1.1065, test_f1: 0.5239
 epoch: 9, train_loss: 0.7684, test_loss: 1.3033, test_f1: 0.4846
 epoch: 10, train_loss: 0.7621, test_loss: 1.3817, test_f1: 0.5037
 epoch: 11, train_loss: 0.7584, test_loss: 1.1769, test_f1: 0.5074
 epoch: 12, train_loss: 0.7532, test_loss: 1.1688, test_f1: 0.6099
 epoch: 13, train_loss: 0.7380, test_loss: 1.0868, test_f1: 0.5815
 epoch: 14, train_loss: 0.7433, test_loss: 1.5645, test_f1: 0.4397
 epoch: 15, train_loss: 0.7255, test_loss: 1.4618, test_f1: 0.5098
 epoch: 16, train_loss: 0.7340, test_loss: 1.2360, test_f1: 0.5331
 epoch: 17, train_loss: 0.6929, test_loss: 1.5187, test_f1: 0.4444
 epoch: 18, train_loss: 0.6754, test_loss: 1.0993, test_f1: 0.5211
 epoch: 19, train_loss: 0.6892, test_loss: 1.7194, test_f1: 0.5486
 epoch: 20, train_loss: 0.6679, test_loss: 1.0247, test_f1: 0.5929
 epoch: 21, train_loss: 0.6437, test_loss: 1.2778, test_f1: 0.5414
 epoch: 22, train_loss: 0.6261, test_loss: 1.1441, test_f1: 0.5197
 epoch: 23, train_loss: 0.6304, test_loss: 1.3484, test_f1: 0.5598
 epoch: 24, train_loss: 0.6454, test_loss: 1.3588, test_f1: 0.5777
 epoch: 25, train_loss: 0.6548, test_loss: 1.2137, test_f1: 0.5533
 epoch: 26, train_loss: 0.6338, test_loss: 1.2584, test_f1: 0.5516
 epoch: 27, train_loss: 0.6126, test_loss: 1.1738, test_f1: 0.6117
 epoch: 28, train_loss: 0.5710, test_loss: 1.5729, test_f1: 0.5176
 epoch: 29, train_loss: 0.5849, test_loss: 1.2114, test_f1: 0.5446
 epoch: 30, train_loss: 0.5735, test_loss: 1.2630, test_f1: 0.5513
 epoch: 31, train_loss: 0.5640, test_loss: 1.0763, test_f1: 0.6178
 epoch: 32, train_loss: 0.5680, test_loss: 1.2034, test_f1: 0.6073
 epoch: 33, train_loss: 0.6277, test_loss: 2.8705, test_f1: 0.4304
 epoch: 34, train_loss: 0.6284, test_loss: 1.3325, test_f1: 0.4873
 epoch: 35, train_loss: 0.5778, test_loss: 1.0431, test_f1: 0.6380
 epoch: 36, train_loss: 0.5878, test_loss: 1.0860, test_f1: 0.5732
 epoch: 37, train_loss: 0.5713, test_loss: 1.0675, test_f1: 0.6273
 epoch: 38, train_loss: 0.5415, test_loss: 1.1781, test_f1: 0.5967
 epoch: 39, train_loss: 0.5524, test_loss: 1.8906, test_f1: 0.5300
 epoch: 40, train_loss: 0.5232, test_loss: 1.2219, test_f1: 0.5408
 epoch: 41, train_loss: 0.5395, test_loss: 1.3080, test_f1: 0.5963
 epoch: 42, train_loss: 0.5129, test_loss: 1.1395, test_f1: 0.6270
 epoch: 43, train_loss: 0.4777, test_loss: 1.0683, test_f1: 0.6492
 epoch: 44, train_loss: 0.4757, test_loss: 1.4489, test_f1: 0.6073
 epoch: 45, train_loss: 0.5050, test_loss: 1.4333, test_f1: 0.5695
 epoch: 46, train_loss: 0.6588, test_loss: 1.0780, test_f1: 0.5834
 epoch: 47, train_loss: 0.6932, test_loss: 1.0727, test_f1: 0.5669
 epoch: 48, train_loss: 0.6447, test_loss: 0.9556, test_f1: 0.6185
 epoch: 49, train_loss: 0.5969, test_loss: 0.9676, test_f1: 0.6585
 epoch: 50, train_loss: 0.5546, test_loss: 0.9943, test_f1: 0.6642
 epoch: 51, train_loss: 0.5081, test_loss: 1.0111, test_f1: 0.6376
 epoch: 52, train_loss: 0.4900, test_loss: 1.1176, test_f1: 0.6298
 epoch: 53, train_loss: 0.4557, test_loss: 1.1655, test_f1: 0.6312
 epoch: 54, train_loss: 0.4608, test_loss: 1.2798, test_f1: 0.6247
 epoch: 55, train_loss: 0.4739, test_loss: 1.3324, test_f1: 0.6333
 epoch: 56, train_loss: 0.4375, test_loss: 1.1729, test_f1: 0.6500
 epoch: 57, train_loss: 0.4288, test_loss: 1.4782, test_f1: 0.5977
 epoch: 58, train_loss: 0.4184, test_loss: 1.4175, test_f1: 0.6299
 epoch: 59, train_loss: 0.3960, test_loss: 1.3149, test_f1: 0.6244
 epoch: 60, train_loss: 0.3997, test_loss: 1.4132, test_f1: 0.6031
 epoch: 61, train_loss: 0.3946, test_loss: 1.3782, test_f1: 0.6332
 epoch: 62, train_loss: 0.3910, test_loss: 1.4414, test_f1: 0.6044
 epoch: 63, train_loss: 0.3953, test_loss: 1.4059, test_f1: 0.6362
 epoch: 64, train_loss: 0.3539, test_loss: 1.4449, test_f1: 0.6269
 epoch: 65, train_loss: 0.3559, test_loss: 1.4328, test_f1: 0.6304
 epoch: 66, train_loss: 0.4093, test_loss: 1.6116, test_f1: 0.5850
 epoch: 67, train_loss: 0.3712, test_loss: 1.7001, test_f1: 0.6039
 epoch: 68, train_loss: 0.3504, test_loss: 1.7643, test_f1: 0.6105
 epoch: 69, train_loss: 0.3417, test_loss: 1.6017, test_f1: 0.6383
 epoch: 70, train_loss: 0.3829, test_loss: 1.5542, test_f1: 0.6550
 epoch: 71, train_loss: 0.3654, test_loss: 1.7077, test_f1: 0.5438
 epoch: 72, train_loss: 0.3518, test_loss: 1.5895, test_f1: 0.6358
 epoch: 73, train_loss: 0.3400, test_loss: 1.5139, test_f1: 0.6284
 epoch: 74, train_loss: 0.2902, test_loss: 1.6452, test_f1: 0.6669
 epoch: 75, train_loss: 0.3604, test_loss: 1.5497, test_f1: 0.6253
 epoch: 76, train_loss: 0.3374, test_loss: 1.5432, test_f1: 0.6340
 epoch: 77, train_loss: 0.3483, test_loss: 1.7167, test_f1: 0.6448
 epoch: 78, train_loss: 0.3024, test_loss: 1.5635, test_f1: 0.6252
 epoch: 79, train_loss: 0.3241, test_loss: 1.8198, test_f1: 0.6310
 epoch: 80, train_loss: 0.3283, test_loss: 1.6947, test_f1: 0.6350
 epoch: 81, train_loss: 0.3419, test_loss: 1.4058, test_f1: 0.6546
 epoch: 82, train_loss: 0.2927, test_loss: 1.4499, test_f1: 0.6758
 epoch: 83, train_loss: 0.3150, test_loss: 1.8630, test_f1: 0.6431
 epoch: 84, train_loss: 0.2779, test_loss: 1.8510, test_f1: 0.6067
 epoch: 85, train_loss: 0.2862, test_loss: 1.9732, test_f1: 0.6092
 epoch: 86, train_loss: 0.2872, test_loss: 1.8735, test_f1: 0.6673
 epoch: 87, train_loss: 0.3341, test_loss: 1.6683, test_f1: 0.6441
 epoch: 88, train_loss: 0.3042, test_loss: 1.6041, test_f1: 0.6723
 epoch: 89, train_loss: 0.2964, test_loss: 1.8086, test_f1: 0.6564
 epoch: 90, train_loss: 0.2677, test_loss: 1.7694, test_f1: 0.6491
 epoch: 91, train_loss: 0.2661, test_loss: 1.9963, test_f1: 0.5858
 epoch: 92, train_loss: 0.2999, test_loss: 1.6483, test_f1: 0.6407
 epoch: 93, train_loss: 0.2943, test_loss: 1.8713, test_f1: 0.6315
 epoch: 94, train_loss: 0.2671, test_loss: 1.8882, test_f1: 0.6380
 epoch: 95, train_loss: 0.2841, test_loss: 1.6657, test_f1: 0.6405
 epoch: 96, train_loss: 0.2919, test_loss: 1.7936, test_f1: 0.6381
 epoch: 97, train_loss: 0.3047, test_loss: 1.8271, test_f1: 0.6604
 epoch: 98, train_loss: 0.2601, test_loss: 1.7142, test_f1: 0.6530
 epoch: 99, train_loss: 0.2400, test_loss: 1.7371, test_f1: 0.6655

Training completed in 338.72 seconds
Best F1: 0.6861 at epoch 84
Mean F1 across iterations: 0.6692  0.0164
========================FINAL RESULTS================================
FEGIN weighted F1: 0.6861  0.0164
python main.py --data ltspice_demos --representation component_pin --model FEGIN --layers 3 --hiddens 64 --batch_size 128 --lr 0.01 --emb_size 250 --epochs 100 --save_appendix component_pin_L3_H64_BS128_LR0.01_E250 --no_val
-----



STDERR:
  File "main.py", line 370, in <module>
    main()
  File "main.py", line 254, in main
    dataset = dataset_class(
  File "/home/philip/projects/ltspice_examples_code_repo/Circuit-Completion-Using-GNNs/component_classification_with_link_prediction_head/evaluation/FEGIN/kernel/circuit_datasets.py", line 15, in __init__
    self.data, self.slices = torch.load(self.processed_paths[0])
  File "/home/philip/.local/lib/python3.8/site-packages/torch/serialization.py", line 1040, in load
    warnings.warn(
  File "/usr/lib/python3.8/warnings.py", line 109, in _showwarnmsg
    sw(msg.message, msg.category, msg.filename, msg.lineno,
  File "main.py", line 47, in warn_with_traceback
    traceback.print_stack(file=log)
/home/philip/projects/ltspice_examples_code_repo/Circuit-Completion-Using-GNNs/component_classification_with_link_prediction_head/evaluation/FEGIN/kernel/circuit_datasets.py:15: FutureWarning: You are using `torch.load` with `weights_only=False` (the current default value), which uses the default pickle module implicitly. It is possible to construct malicious pickle data which will execute arbitrary code during unpickling (See https://github.com/pytorch/pytorch/blob/main/SECURITY.md#untrusted-models for more details). In a future release, the default value for `weights_only` will be flipped to `True`. This limits the functions that could be executed during unpickling. Arbitrary objects will no longer be allowed to be loaded via this mode unless they are explicitly allowlisted by the user via `torch.serialization.add_safe_globals`. We recommend you start setting `weights_only=True` for any use case where you don't have full control of the loaded file. Please open an issue on GitHub for any issues related to this experimental feature.
  self.data, self.slices = torch.load(self.processed_paths[0])
