STDOUT:
Results will be saved in /home/philip/projects/ltspice_examples_code_repo/Circuit-Completion-Using-GNNs/component_classification_with_link_prediction_head/evaluation/FEGIN/results/model_FEGIN_dataset_ltspice_demos
Command line input: python main.py --data ltspice_demos --representation component_net --model FEGIN --layers 3 --hiddens 64 --batch_size 128 --lr 0.01 --emb_size 250 --epochs 100 --save_appendix component_net_L3_H64_BS128_LR0.01_E250 --no_val
 is saved.
-----
ltspice_demos - FEGIN
Using 3 layers, 64 hidden units, h = 2
Loading component_net representation dataset
ENTERED
Training FEGIN on component_net representation
Train: 1565, Test: 383
##################ITERATION #0 ****************************************
 epoch: 0, train_loss: 1.2241, test_loss: 1.5526, test_f1: 0.2281
 epoch: 1, train_loss: 1.1325, test_loss: 1.2571, test_f1: 0.2281
 epoch: 2, train_loss: 1.1097, test_loss: 1.4307, test_f1: 0.2617
 epoch: 3, train_loss: 1.0417, test_loss: 1.0643, test_f1: 0.3744
 epoch: 4, train_loss: 0.9987, test_loss: 1.1574, test_f1: 0.5083
 epoch: 5, train_loss: 0.9755, test_loss: 1.1801, test_f1: 0.4376
 epoch: 6, train_loss: 0.9559, test_loss: 1.2338, test_f1: 0.4868
 epoch: 7, train_loss: 0.9295, test_loss: 1.0548, test_f1: 0.5357
 epoch: 8, train_loss: 0.9054, test_loss: 1.0597, test_f1: 0.5489
 epoch: 9, train_loss: 0.9004, test_loss: 1.0541, test_f1: 0.5231
 epoch: 10, train_loss: 0.8684, test_loss: 1.0139, test_f1: 0.5918
 epoch: 11, train_loss: 0.8483, test_loss: 1.1201, test_f1: 0.4594
 epoch: 12, train_loss: 0.8390, test_loss: 1.0512, test_f1: 0.6375
 epoch: 13, train_loss: 0.8368, test_loss: 1.0217, test_f1: 0.6169
 epoch: 14, train_loss: 0.7960, test_loss: 1.3087, test_f1: 0.5026
 epoch: 15, train_loss: 0.8218, test_loss: 1.1620, test_f1: 0.5511
 epoch: 16, train_loss: 0.8133, test_loss: 1.3276, test_f1: 0.4481
 epoch: 17, train_loss: 0.7795, test_loss: 1.5683, test_f1: 0.4396
 epoch: 18, train_loss: 0.7690, test_loss: 1.2834, test_f1: 0.4050
 epoch: 19, train_loss: 0.7499, test_loss: 1.1073, test_f1: 0.6264
 epoch: 20, train_loss: 0.7773, test_loss: 1.1469, test_f1: 0.6173
 epoch: 21, train_loss: 0.7351, test_loss: 1.1636, test_f1: 0.6074
 epoch: 22, train_loss: 0.7223, test_loss: 1.2550, test_f1: 0.6100
 epoch: 23, train_loss: 0.6951, test_loss: 1.0976, test_f1: 0.6399
 epoch: 24, train_loss: 0.6559, test_loss: 1.2564, test_f1: 0.5723
 epoch: 25, train_loss: 0.8004, test_loss: 1.9738, test_f1: 0.3969
 epoch: 26, train_loss: 0.7672, test_loss: 1.0758, test_f1: 0.5880
 epoch: 27, train_loss: 0.6896, test_loss: 1.2383, test_f1: 0.5471
 epoch: 28, train_loss: 0.6764, test_loss: 1.1754, test_f1: 0.5967
 epoch: 29, train_loss: 0.6775, test_loss: 1.0733, test_f1: 0.6590
 epoch: 30, train_loss: 0.6609, test_loss: 1.0732, test_f1: 0.5965
 epoch: 31, train_loss: 0.6373, test_loss: 1.1344, test_f1: 0.6163
 epoch: 32, train_loss: 0.6284, test_loss: 1.2278, test_f1: 0.6204
 epoch: 33, train_loss: 0.6708, test_loss: 1.3410, test_f1: 0.6141
 epoch: 34, train_loss: 0.6889, test_loss: 1.2416, test_f1: 0.5278
 epoch: 35, train_loss: 0.6216, test_loss: 1.4127, test_f1: 0.6069
 epoch: 36, train_loss: 0.6052, test_loss: 1.0867, test_f1: 0.6425
 epoch: 37, train_loss: 0.6015, test_loss: 1.4324, test_f1: 0.5628
 epoch: 38, train_loss: 0.5809, test_loss: 1.5051, test_f1: 0.5542
 epoch: 39, train_loss: 0.5625, test_loss: 1.2682, test_f1: 0.6273
 epoch: 40, train_loss: 0.5987, test_loss: 1.3293, test_f1: 0.6213
 epoch: 41, train_loss: 0.6131, test_loss: 1.3309, test_f1: 0.5801
 epoch: 42, train_loss: 0.5803, test_loss: 1.0853, test_f1: 0.6540
 epoch: 43, train_loss: 0.6079, test_loss: 1.1370, test_f1: 0.6013
 epoch: 44, train_loss: 0.5695, test_loss: 1.3586, test_f1: 0.5946
 epoch: 45, train_loss: 0.5960, test_loss: 1.1832, test_f1: 0.6503
 epoch: 46, train_loss: 0.5601, test_loss: 1.2387, test_f1: 0.6320
 epoch: 47, train_loss: 0.5424, test_loss: 1.8267, test_f1: 0.5891
 epoch: 48, train_loss: 0.5178, test_loss: 1.3384, test_f1: 0.6369
 epoch: 49, train_loss: 0.5635, test_loss: 1.3322, test_f1: 0.5730
 epoch: 50, train_loss: 0.5389, test_loss: 1.4706, test_f1: 0.6153
 epoch: 51, train_loss: 0.5027, test_loss: 1.4095, test_f1: 0.6201
 epoch: 52, train_loss: 0.4749, test_loss: 1.5502, test_f1: 0.6115
 epoch: 53, train_loss: 0.4670, test_loss: 1.4486, test_f1: 0.6033
 epoch: 54, train_loss: 0.4537, test_loss: 1.5360, test_f1: 0.6237
 epoch: 55, train_loss: 0.4117, test_loss: 1.7601, test_f1: 0.6244
 epoch: 56, train_loss: 0.4067, test_loss: 1.6408, test_f1: 0.6423
 epoch: 57, train_loss: 0.3946, test_loss: 1.5209, test_f1: 0.6362
 epoch: 58, train_loss: 0.4011, test_loss: 1.6066, test_f1: 0.6544
 epoch: 59, train_loss: 0.4296, test_loss: 1.8552, test_f1: 0.6217
 epoch: 60, train_loss: 0.4010, test_loss: 1.6739, test_f1: 0.6433
 epoch: 61, train_loss: 0.4027, test_loss: 2.0175, test_f1: 0.6349
 epoch: 62, train_loss: 0.3641, test_loss: 1.6949, test_f1: 0.6454
 epoch: 63, train_loss: 0.3823, test_loss: 2.1968, test_f1: 0.6178
 epoch: 64, train_loss: 0.3587, test_loss: 1.7593, test_f1: 0.6409
 epoch: 65, train_loss: 0.3881, test_loss: 1.6912, test_f1: 0.6243
 epoch: 66, train_loss: 0.3707, test_loss: 2.1296, test_f1: 0.6368
 epoch: 67, train_loss: 0.3723, test_loss: 2.0530, test_f1: 0.6122
 epoch: 68, train_loss: 0.3886, test_loss: 1.7893, test_f1: 0.6070
 epoch: 69, train_loss: 0.3997, test_loss: 1.9598, test_f1: 0.6303
 epoch: 70, train_loss: 0.3810, test_loss: 2.2223, test_f1: 0.5651
 epoch: 71, train_loss: 0.3850, test_loss: 1.8599, test_f1: 0.6250
 epoch: 72, train_loss: 0.3544, test_loss: 2.3698, test_f1: 0.6223
 epoch: 73, train_loss: 0.4404, test_loss: 1.8859, test_f1: 0.6378
 epoch: 74, train_loss: 0.4238, test_loss: 2.0082, test_f1: 0.6167
 epoch: 75, train_loss: 0.4128, test_loss: 1.9751, test_f1: 0.6276
 epoch: 76, train_loss: 0.3846, test_loss: 1.5620, test_f1: 0.6562
 epoch: 77, train_loss: 0.3342, test_loss: 1.7940, test_f1: 0.6395
 epoch: 78, train_loss: 0.3509, test_loss: 2.0004, test_f1: 0.6565
 epoch: 79, train_loss: 0.3279, test_loss: 2.3592, test_f1: 0.6012
 epoch: 80, train_loss: 0.3567, test_loss: 2.0232, test_f1: 0.6553
 epoch: 81, train_loss: 0.3178, test_loss: 2.0845, test_f1: 0.5937
 epoch: 82, train_loss: 0.3267, test_loss: 2.0482, test_f1: 0.5953
 epoch: 83, train_loss: 0.3044, test_loss: 2.2821, test_f1: 0.6359
 epoch: 84, train_loss: 0.3576, test_loss: 2.1516, test_f1: 0.6355
 epoch: 85, train_loss: 0.3238, test_loss: 1.9543, test_f1: 0.6234
 epoch: 86, train_loss: 0.3214, test_loss: 2.0640, test_f1: 0.6470
 epoch: 87, train_loss: 0.3155, test_loss: 2.1225, test_f1: 0.6233
 epoch: 88, train_loss: 0.2876, test_loss: 2.3233, test_f1: 0.6310
 epoch: 89, train_loss: 0.2897, test_loss: 2.2834, test_f1: 0.6241
 epoch: 90, train_loss: 0.2798, test_loss: 2.2797, test_f1: 0.6488
 epoch: 91, train_loss: 0.2964, test_loss: 2.1257, test_f1: 0.6313
 epoch: 92, train_loss: 0.2719, test_loss: 2.2493, test_f1: 0.6559
 epoch: 93, train_loss: 0.3132, test_loss: 2.1272, test_f1: 0.6333
 epoch: 94, train_loss: 0.2739, test_loss: 2.3725, test_f1: 0.6502
 epoch: 95, train_loss: 0.2821, test_loss: 3.0296, test_f1: 0.6275
 epoch: 96, train_loss: 0.3025, test_loss: 2.6119, test_f1: 0.6497
 epoch: 97, train_loss: 0.3156, test_loss: 2.1446, test_f1: 0.5919
 epoch: 98, train_loss: 0.3549, test_loss: 1.8335, test_f1: 0.6176
 epoch: 99, train_loss: 0.3395, test_loss: 2.4323, test_f1: 0.6164
##################ITERATION #1 ****************************************
 epoch: 0, train_loss: 1.2043, test_loss: 1.5234, test_f1: 0.2281
 epoch: 1, train_loss: 1.0662, test_loss: 1.1984, test_f1: 0.4123
 epoch: 2, train_loss: 0.9750, test_loss: 1.2345, test_f1: 0.3314
 epoch: 3, train_loss: 0.9315, test_loss: 1.0929, test_f1: 0.5093
 epoch: 4, train_loss: 0.9125, test_loss: 1.1938, test_f1: 0.4882
 epoch: 5, train_loss: 0.8965, test_loss: 1.0888, test_f1: 0.5347
 epoch: 6, train_loss: 0.8614, test_loss: 1.0859, test_f1: 0.5476
 epoch: 7, train_loss: 0.8906, test_loss: 1.0918, test_f1: 0.5277
 epoch: 8, train_loss: 0.8395, test_loss: 1.3234, test_f1: 0.4653
 epoch: 9, train_loss: 0.8647, test_loss: 1.2609, test_f1: 0.3990
 epoch: 10, train_loss: 0.8493, test_loss: 1.3731, test_f1: 0.4296
 epoch: 11, train_loss: 0.8284, test_loss: 1.2130, test_f1: 0.5405
 epoch: 12, train_loss: 0.8379, test_loss: 1.6804, test_f1: 0.4428
 epoch: 13, train_loss: 0.8157, test_loss: 1.1841, test_f1: 0.4581
 epoch: 14, train_loss: 0.8017, test_loss: 1.0455, test_f1: 0.5536
 epoch: 15, train_loss: 0.8025, test_loss: 2.0116, test_f1: 0.3354
 epoch: 16, train_loss: 0.8230, test_loss: 1.0577, test_f1: 0.5747
 epoch: 17, train_loss: 0.7852, test_loss: 1.2518, test_f1: 0.5660
 epoch: 18, train_loss: 0.7770, test_loss: 1.2471, test_f1: 0.5476
 epoch: 19, train_loss: 0.7754, test_loss: 1.3327, test_f1: 0.5701
 epoch: 20, train_loss: 0.7370, test_loss: 1.1484, test_f1: 0.5508
 epoch: 21, train_loss: 0.7274, test_loss: 1.2127, test_f1: 0.5811
 epoch: 22, train_loss: 0.6954, test_loss: 1.2095, test_f1: 0.5455
 epoch: 23, train_loss: 0.6832, test_loss: 1.3081, test_f1: 0.5323
 epoch: 24, train_loss: 0.6626, test_loss: 1.4778, test_f1: 0.5499
 epoch: 25, train_loss: 0.6714, test_loss: 1.1488, test_f1: 0.5891
 epoch: 26, train_loss: 0.6840, test_loss: 1.6271, test_f1: 0.5510
 epoch: 27, train_loss: 0.6580, test_loss: 1.3000, test_f1: 0.5602
 epoch: 28, train_loss: 0.6329, test_loss: 1.4408, test_f1: 0.5028
 epoch: 29, train_loss: 0.6394, test_loss: 1.4822, test_f1: 0.5678
 epoch: 30, train_loss: 0.6444, test_loss: 1.8035, test_f1: 0.5595
 epoch: 31, train_loss: 0.6224, test_loss: 1.5082, test_f1: 0.5674
 epoch: 32, train_loss: 0.6153, test_loss: 2.1016, test_f1: 0.3963
 epoch: 33, train_loss: 0.6619, test_loss: 1.6065, test_f1: 0.5208
 epoch: 34, train_loss: 0.6307, test_loss: 1.4532, test_f1: 0.4963
 epoch: 35, train_loss: 0.6533, test_loss: 1.4072, test_f1: 0.5431
 epoch: 36, train_loss: 0.5942, test_loss: 1.5479, test_f1: 0.5650
 epoch: 37, train_loss: 0.5604, test_loss: 1.3959, test_f1: 0.5510
 epoch: 38, train_loss: 0.6066, test_loss: 1.2915, test_f1: 0.5483
 epoch: 39, train_loss: 0.6009, test_loss: 1.6718, test_f1: 0.5579
 epoch: 40, train_loss: 0.5465, test_loss: 1.6045, test_f1: 0.5969
 epoch: 41, train_loss: 0.5676, test_loss: 1.4785, test_f1: 0.5826
 epoch: 42, train_loss: 0.5326, test_loss: 1.7488, test_f1: 0.5431
 epoch: 43, train_loss: 0.5839, test_loss: 1.5991, test_f1: 0.5190
 epoch: 44, train_loss: 0.6292, test_loss: 1.4181, test_f1: 0.5409
 epoch: 45, train_loss: 0.5953, test_loss: 1.4947, test_f1: 0.5975
 epoch: 46, train_loss: 0.5327, test_loss: 1.7768, test_f1: 0.5616
 epoch: 47, train_loss: 0.5122, test_loss: 1.6610, test_f1: 0.5707
 epoch: 48, train_loss: 0.5412, test_loss: 1.7864, test_f1: 0.5757
 epoch: 49, train_loss: 0.5320, test_loss: 1.7535, test_f1: 0.5595
 epoch: 50, train_loss: 0.5588, test_loss: 1.7444, test_f1: 0.5759
 epoch: 51, train_loss: 0.5547, test_loss: 1.5628, test_f1: 0.5843
 epoch: 52, train_loss: 0.5404, test_loss: 2.1399, test_f1: 0.5159
 epoch: 53, train_loss: 0.4791, test_loss: 1.6743, test_f1: 0.6017
 epoch: 54, train_loss: 0.4479, test_loss: 1.7924, test_f1: 0.6037
 epoch: 55, train_loss: 0.4255, test_loss: 1.7257, test_f1: 0.5996
 epoch: 56, train_loss: 0.4186, test_loss: 1.7734, test_f1: 0.6209
 epoch: 57, train_loss: 0.4254, test_loss: 2.0539, test_f1: 0.6169
 epoch: 58, train_loss: 0.4008, test_loss: 2.1478, test_f1: 0.5268
 epoch: 59, train_loss: 0.4310, test_loss: 2.7735, test_f1: 0.5641
 epoch: 60, train_loss: 0.4085, test_loss: 2.0787, test_f1: 0.5968
 epoch: 61, train_loss: 0.4042, test_loss: 2.2308, test_f1: 0.5670
 epoch: 62, train_loss: 0.3886, test_loss: 2.3275, test_f1: 0.6074
 epoch: 63, train_loss: 0.4095, test_loss: 2.2675, test_f1: 0.5545
 epoch: 64, train_loss: 0.4358, test_loss: 2.1288, test_f1: 0.5797
 epoch: 65, train_loss: 0.3837, test_loss: 2.0128, test_f1: 0.6088
 epoch: 66, train_loss: 0.4234, test_loss: 2.1788, test_f1: 0.5711
 epoch: 67, train_loss: 0.4065, test_loss: 2.2168, test_f1: 0.5500
 epoch: 68, train_loss: 0.3756, test_loss: 2.0287, test_f1: 0.6571
 epoch: 69, train_loss: 0.3539, test_loss: 2.3765, test_f1: 0.6004
 epoch: 70, train_loss: 0.4004, test_loss: 2.8097, test_f1: 0.5191
 epoch: 71, train_loss: 0.3631, test_loss: 2.6678, test_f1: 0.5659
 epoch: 72, train_loss: 0.3862, test_loss: 2.0486, test_f1: 0.5984
 epoch: 73, train_loss: 0.3639, test_loss: 2.4980, test_f1: 0.5762
 epoch: 74, train_loss: 0.3415, test_loss: 2.6127, test_f1: 0.6133
 epoch: 75, train_loss: 0.3510, test_loss: 2.6323, test_f1: 0.5755
 epoch: 76, train_loss: 0.3387, test_loss: 2.5179, test_f1: 0.5713
 epoch: 77, train_loss: 0.3538, test_loss: 2.3371, test_f1: 0.5897
 epoch: 78, train_loss: 0.3495, test_loss: 2.9160, test_f1: 0.5850
 epoch: 79, train_loss: 0.3555, test_loss: 2.6806, test_f1: 0.6082
 epoch: 80, train_loss: 0.3599, test_loss: 2.6876, test_f1: 0.5618
 epoch: 81, train_loss: 0.3656, test_loss: 2.8304, test_f1: 0.5288
 epoch: 82, train_loss: 0.3754, test_loss: 3.1784, test_f1: 0.5251
 epoch: 83, train_loss: 0.3315, test_loss: 2.4140, test_f1: 0.6045
 epoch: 84, train_loss: 0.3414, test_loss: 2.4161, test_f1: 0.6210
 epoch: 85, train_loss: 0.3401, test_loss: 3.4842, test_f1: 0.5052
 epoch: 86, train_loss: 0.3460, test_loss: 2.6367, test_f1: 0.6070
 epoch: 87, train_loss: 0.3389, test_loss: 3.2152, test_f1: 0.5547
 epoch: 88, train_loss: 0.3218, test_loss: 3.0325, test_f1: 0.6069
 epoch: 89, train_loss: 0.3537, test_loss: 2.2593, test_f1: 0.5452
 epoch: 90, train_loss: 0.3229, test_loss: 3.0408, test_f1: 0.5746
 epoch: 91, train_loss: 0.3388, test_loss: 3.3005, test_f1: 0.5435
 epoch: 92, train_loss: 0.3413, test_loss: 2.9711, test_f1: 0.6007
 epoch: 93, train_loss: 0.2990, test_loss: 2.6591, test_f1: 0.5877
 epoch: 94, train_loss: 0.3386, test_loss: 2.5331, test_f1: 0.5955
 epoch: 95, train_loss: 0.3074, test_loss: 2.5198, test_f1: 0.5836
 epoch: 96, train_loss: 0.3187, test_loss: 2.8807, test_f1: 0.5843
 epoch: 97, train_loss: 0.3313, test_loss: 2.7648, test_f1: 0.5531
 epoch: 98, train_loss: 0.2726, test_loss: 2.4547, test_f1: 0.5811
 epoch: 99, train_loss: 0.3008, test_loss: 2.9449, test_f1: 0.6044
##################ITERATION #2 ****************************************
 epoch: 0, train_loss: 1.2649, test_loss: 1.3131, test_f1: 0.2354
 epoch: 1, train_loss: 1.0337, test_loss: 1.2435, test_f1: 0.3856
 epoch: 2, train_loss: 0.9850, test_loss: 1.0822, test_f1: 0.4981
 epoch: 3, train_loss: 0.9555, test_loss: 1.1289, test_f1: 0.4253
 epoch: 4, train_loss: 0.9503, test_loss: 1.1228, test_f1: 0.4917
 epoch: 5, train_loss: 0.9332, test_loss: 1.0484, test_f1: 0.5257
 epoch: 6, train_loss: 0.9109, test_loss: 0.9989, test_f1: 0.5281
 epoch: 7, train_loss: 0.8955, test_loss: 1.0682, test_f1: 0.4755
 epoch: 8, train_loss: 0.8954, test_loss: 1.1093, test_f1: 0.5402
 epoch: 9, train_loss: 0.8618, test_loss: 1.0395, test_f1: 0.5636
 epoch: 10, train_loss: 0.8535, test_loss: 1.1615, test_f1: 0.4896
 epoch: 11, train_loss: 0.8471, test_loss: 1.0453, test_f1: 0.5525
 epoch: 12, train_loss: 0.8603, test_loss: 1.1109, test_f1: 0.5221
 epoch: 13, train_loss: 0.8557, test_loss: 1.1474, test_f1: 0.4954
 epoch: 14, train_loss: 0.8213, test_loss: 1.1359, test_f1: 0.5465
 epoch: 15, train_loss: 0.7796, test_loss: 1.0214, test_f1: 0.5397
 epoch: 16, train_loss: 0.8176, test_loss: 0.9676, test_f1: 0.6256
 epoch: 17, train_loss: 0.7865, test_loss: 1.1342, test_f1: 0.5909
 epoch: 18, train_loss: 0.7635, test_loss: 1.2111, test_f1: 0.5822
 epoch: 19, train_loss: 0.7364, test_loss: 1.1036, test_f1: 0.5449
 epoch: 20, train_loss: 0.7400, test_loss: 1.1873, test_f1: 0.5559
 epoch: 21, train_loss: 0.7481, test_loss: 1.1661, test_f1: 0.5720
 epoch: 22, train_loss: 0.7413, test_loss: 1.2931, test_f1: 0.4828
 epoch: 23, train_loss: 0.7552, test_loss: 1.1822, test_f1: 0.5428
 epoch: 24, train_loss: 0.7279, test_loss: 1.2188, test_f1: 0.5641
 epoch: 25, train_loss: 0.6973, test_loss: 1.2060, test_f1: 0.5750
 epoch: 26, train_loss: 0.6800, test_loss: 1.1587, test_f1: 0.5796
 epoch: 27, train_loss: 0.6682, test_loss: 1.4222, test_f1: 0.4585
 epoch: 28, train_loss: 0.6774, test_loss: 1.1852, test_f1: 0.5781
 epoch: 29, train_loss: 0.7003, test_loss: 1.2509, test_f1: 0.5811
 epoch: 30, train_loss: 0.7054, test_loss: 1.7725, test_f1: 0.5439
 epoch: 31, train_loss: 0.6551, test_loss: 1.2477, test_f1: 0.5843
 epoch: 32, train_loss: 0.6259, test_loss: 1.3405, test_f1: 0.5407
 epoch: 33, train_loss: 0.6175, test_loss: 1.7817, test_f1: 0.4814
 epoch: 34, train_loss: 0.6243, test_loss: 1.5345, test_f1: 0.5643
 epoch: 35, train_loss: 0.6437, test_loss: 1.4274, test_f1: 0.4979
 epoch: 36, train_loss: 0.6554, test_loss: 1.5750, test_f1: 0.5747
 epoch: 37, train_loss: 0.6320, test_loss: 1.4383, test_f1: 0.5911
 epoch: 38, train_loss: 0.6209, test_loss: 1.5968, test_f1: 0.5804
 epoch: 39, train_loss: 0.6262, test_loss: 1.5626, test_f1: 0.5828
 epoch: 40, train_loss: 0.5979, test_loss: 1.4093, test_f1: 0.5618
 epoch: 41, train_loss: 0.6041, test_loss: 1.4974, test_f1: 0.5755
 epoch: 42, train_loss: 0.5875, test_loss: 1.3675, test_f1: 0.5542
 epoch: 43, train_loss: 0.5765, test_loss: 1.5298, test_f1: 0.5870
 epoch: 44, train_loss: 0.5835, test_loss: 1.3936, test_f1: 0.5623
 epoch: 45, train_loss: 0.5720, test_loss: 2.1521, test_f1: 0.5187
 epoch: 46, train_loss: 0.5687, test_loss: 1.7827, test_f1: 0.5685
 epoch: 47, train_loss: 0.5359, test_loss: 1.6828, test_f1: 0.6089
 epoch: 48, train_loss: 0.5593, test_loss: 1.7111, test_f1: 0.5413
 epoch: 49, train_loss: 0.5559, test_loss: 1.4788, test_f1: 0.5751
 epoch: 50, train_loss: 0.5390, test_loss: 1.5980, test_f1: 0.5927
 epoch: 51, train_loss: 0.4940, test_loss: 1.5059, test_f1: 0.6013
 epoch: 52, train_loss: 0.4887, test_loss: 1.6260, test_f1: 0.5808
 epoch: 53, train_loss: 0.4866, test_loss: 1.5096, test_f1: 0.5606
 epoch: 54, train_loss: 0.4963, test_loss: 1.6812, test_f1: 0.5822
 epoch: 55, train_loss: 0.4623, test_loss: 1.5895, test_f1: 0.6062
 epoch: 56, train_loss: 0.4438, test_loss: 1.7961, test_f1: 0.6039
 epoch: 57, train_loss: 0.4074, test_loss: 1.8310, test_f1: 0.5737
 epoch: 58, train_loss: 0.4258, test_loss: 2.0698, test_f1: 0.6033
 epoch: 59, train_loss: 0.5087, test_loss: 1.7068, test_f1: 0.6071
 epoch: 60, train_loss: 0.4997, test_loss: 1.5530, test_f1: 0.5550
 epoch: 61, train_loss: 0.4529, test_loss: 1.7718, test_f1: 0.5855
 epoch: 62, train_loss: 0.4511, test_loss: 1.6510, test_f1: 0.5911
 epoch: 63, train_loss: 0.4115, test_loss: 1.9858, test_f1: 0.5686
 epoch: 64, train_loss: 0.4448, test_loss: 1.9875, test_f1: 0.5804
 epoch: 65, train_loss: 0.3955, test_loss: 2.1596, test_f1: 0.6246
 epoch: 66, train_loss: 0.4061, test_loss: 2.1460, test_f1: 0.5532
 epoch: 67, train_loss: 0.4394, test_loss: 1.8211, test_f1: 0.5919
 epoch: 68, train_loss: 0.4277, test_loss: 1.9444, test_f1: 0.5784
 epoch: 69, train_loss: 0.4171, test_loss: 2.0385, test_f1: 0.5898
 epoch: 70, train_loss: 0.4360, test_loss: 1.8896, test_f1: 0.6175
 epoch: 71, train_loss: 0.4772, test_loss: 1.7866, test_f1: 0.5992
 epoch: 72, train_loss: 0.4752, test_loss: 1.8684, test_f1: 0.5751
 epoch: 73, train_loss: 0.4511, test_loss: 2.0102, test_f1: 0.5881
 epoch: 74, train_loss: 0.3986, test_loss: 2.1189, test_f1: 0.6008
 epoch: 75, train_loss: 0.3674, test_loss: 2.0880, test_f1: 0.6094
 epoch: 76, train_loss: 0.3795, test_loss: 2.0894, test_f1: 0.6115
 epoch: 77, train_loss: 0.3856, test_loss: 2.1239, test_f1: 0.5744
 epoch: 78, train_loss: 0.3657, test_loss: 2.2389, test_f1: 0.5892
 epoch: 79, train_loss: 0.3616, test_loss: 2.1593, test_f1: 0.6108
 epoch: 80, train_loss: 0.3926, test_loss: 1.8567, test_f1: 0.6054
 epoch: 81, train_loss: 0.3936, test_loss: 2.0754, test_f1: 0.6161
 epoch: 82, train_loss: 0.3669, test_loss: 1.9903, test_f1: 0.5955
 epoch: 83, train_loss: 0.3741, test_loss: 2.2014, test_f1: 0.6081
 epoch: 84, train_loss: 0.3748, test_loss: 2.5292, test_f1: 0.5908
 epoch: 85, train_loss: 0.3584, test_loss: 2.1748, test_f1: 0.6062
 epoch: 86, train_loss: 0.3416, test_loss: 2.0599, test_f1: 0.5925
 epoch: 87, train_loss: 0.3443, test_loss: 2.0408, test_f1: 0.6308
 epoch: 88, train_loss: 0.3578, test_loss: 2.1633, test_f1: 0.6387
 epoch: 89, train_loss: 0.3340, test_loss: 2.0867, test_f1: 0.6281
 epoch: 90, train_loss: 0.4004, test_loss: 1.9174, test_f1: 0.6281
 epoch: 91, train_loss: 0.3732, test_loss: 2.0575, test_f1: 0.6460
 epoch: 92, train_loss: 0.3775, test_loss: 1.9959, test_f1: 0.6738
 epoch: 93, train_loss: 0.3647, test_loss: 1.8150, test_f1: 0.6478
 epoch: 94, train_loss: 0.3587, test_loss: 2.1762, test_f1: 0.5762
 epoch: 95, train_loss: 0.3475, test_loss: 2.1724, test_f1: 0.6076
 epoch: 96, train_loss: 0.3227, test_loss: 2.0778, test_f1: 0.6420
 epoch: 97, train_loss: 0.3197, test_loss: 2.5092, test_f1: 0.6415
 epoch: 98, train_loss: 0.3006, test_loss: 2.2471, test_f1: 0.6068
 epoch: 99, train_loss: 0.3318, test_loss: 2.7033, test_f1: 0.5848
##################ITERATION #3 ****************************************
 epoch: 0, train_loss: 1.3158, test_loss: 1.8552, test_f1: 0.1368
 epoch: 1, train_loss: 1.0597, test_loss: 1.2727, test_f1: 0.2872
 epoch: 2, train_loss: 1.0123, test_loss: 1.1551, test_f1: 0.4327
 epoch: 3, train_loss: 0.9674, test_loss: 1.1081, test_f1: 0.4756
 epoch: 4, train_loss: 0.9422, test_loss: 1.0295, test_f1: 0.5312
 epoch: 5, train_loss: 0.9188, test_loss: 1.0799, test_f1: 0.5100
 epoch: 6, train_loss: 0.9155, test_loss: 1.1094, test_f1: 0.5232
 epoch: 7, train_loss: 0.8942, test_loss: 1.0350, test_f1: 0.5470
 epoch: 8, train_loss: 0.8840, test_loss: 0.9724, test_f1: 0.5730
 epoch: 9, train_loss: 0.8662, test_loss: 1.0381, test_f1: 0.5585
 epoch: 10, train_loss: 0.8618, test_loss: 1.0142, test_f1: 0.5260
 epoch: 11, train_loss: 0.8541, test_loss: 0.9982, test_f1: 0.5813
 epoch: 12, train_loss: 0.8613, test_loss: 1.0193, test_f1: 0.5286
 epoch: 13, train_loss: 0.8465, test_loss: 0.9808, test_f1: 0.5979
 epoch: 14, train_loss: 0.8098, test_loss: 1.1734, test_f1: 0.5197
 epoch: 15, train_loss: 0.8024, test_loss: 1.0408, test_f1: 0.5658
 epoch: 16, train_loss: 0.7811, test_loss: 1.0669, test_f1: 0.5428
 epoch: 17, train_loss: 0.7825, test_loss: 1.1195, test_f1: 0.5257
 epoch: 18, train_loss: 0.7242, test_loss: 1.1150, test_f1: 0.5687
 epoch: 19, train_loss: 0.7398, test_loss: 1.0912, test_f1: 0.5860
 epoch: 20, train_loss: 0.7428, test_loss: 1.2378, test_f1: 0.5621
 epoch: 21, train_loss: 0.7106, test_loss: 1.2985, test_f1: 0.5085
 epoch: 22, train_loss: 0.7120, test_loss: 1.1034, test_f1: 0.5847
 epoch: 23, train_loss: 0.7199, test_loss: 1.1662, test_f1: 0.5312
 epoch: 24, train_loss: 0.7226, test_loss: 1.0474, test_f1: 0.5705
 epoch: 25, train_loss: 0.7020, test_loss: 1.2615, test_f1: 0.5815
 epoch: 26, train_loss: 0.6908, test_loss: 1.1720, test_f1: 0.5823
 epoch: 27, train_loss: 0.6777, test_loss: 1.2549, test_f1: 0.4371
 epoch: 28, train_loss: 0.6596, test_loss: 1.1689, test_f1: 0.5680
 epoch: 29, train_loss: 0.6738, test_loss: 1.0570, test_f1: 0.6326
 epoch: 30, train_loss: 0.6588, test_loss: 1.5110, test_f1: 0.5055
 epoch: 31, train_loss: 0.6380, test_loss: 1.0480, test_f1: 0.6085
 epoch: 32, train_loss: 0.6883, test_loss: 1.4025, test_f1: 0.5851
 epoch: 33, train_loss: 0.6440, test_loss: 1.6194, test_f1: 0.4861
 epoch: 34, train_loss: 0.6207, test_loss: 1.1245, test_f1: 0.5705
 epoch: 35, train_loss: 0.6216, test_loss: 1.3368, test_f1: 0.6077
 epoch: 36, train_loss: 0.5885, test_loss: 1.3130, test_f1: 0.5974
 epoch: 37, train_loss: 0.5914, test_loss: 1.5944, test_f1: 0.5386
 epoch: 38, train_loss: 0.5903, test_loss: 1.5629, test_f1: 0.5547
 epoch: 39, train_loss: 0.6009, test_loss: 1.6619, test_f1: 0.4233
 epoch: 40, train_loss: 0.6090, test_loss: 1.4558, test_f1: 0.5513
 epoch: 41, train_loss: 0.5782, test_loss: 1.4971, test_f1: 0.6083
 epoch: 42, train_loss: 0.5593, test_loss: 1.6517, test_f1: 0.5475
 epoch: 43, train_loss: 0.5350, test_loss: 1.4350, test_f1: 0.5163
 epoch: 44, train_loss: 0.5337, test_loss: 1.7202, test_f1: 0.5866
 epoch: 45, train_loss: 0.5876, test_loss: 1.3258, test_f1: 0.6152
 epoch: 46, train_loss: 0.5586, test_loss: 1.3741, test_f1: 0.6116
 epoch: 47, train_loss: 0.5326, test_loss: 1.4948, test_f1: 0.5474
 epoch: 48, train_loss: 0.5034, test_loss: 1.3607, test_f1: 0.6096
 epoch: 49, train_loss: 0.5275, test_loss: 2.2196, test_f1: 0.4951
 epoch: 50, train_loss: 0.5272, test_loss: 1.4507, test_f1: 0.6048
 epoch: 51, train_loss: 0.4852, test_loss: 1.4172, test_f1: 0.5766
 epoch: 52, train_loss: 0.4482, test_loss: 1.4072, test_f1: 0.6405
 epoch: 53, train_loss: 0.4339, test_loss: 1.6995, test_f1: 0.6025
 epoch: 54, train_loss: 0.4787, test_loss: 1.8406, test_f1: 0.5931
 epoch: 55, train_loss: 0.4508, test_loss: 1.5617, test_f1: 0.6013
 epoch: 56, train_loss: 0.4331, test_loss: 1.7465, test_f1: 0.6036
 epoch: 57, train_loss: 0.4123, test_loss: 1.5866, test_f1: 0.6071
 epoch: 58, train_loss: 0.4143, test_loss: 1.7682, test_f1: 0.6235
 epoch: 59, train_loss: 0.4262, test_loss: 1.6184, test_f1: 0.6240
 epoch: 60, train_loss: 0.4241, test_loss: 1.7219, test_f1: 0.6311
 epoch: 61, train_loss: 0.4249, test_loss: 1.7303, test_f1: 0.6464
 epoch: 62, train_loss: 0.3739, test_loss: 1.7173, test_f1: 0.6100
 epoch: 63, train_loss: 0.3512, test_loss: 1.7977, test_f1: 0.6447
 epoch: 64, train_loss: 0.3848, test_loss: 1.5990, test_f1: 0.5540
 epoch: 65, train_loss: 0.3692, test_loss: 1.8131, test_f1: 0.6200
 epoch: 66, train_loss: 0.3588, test_loss: 1.7968, test_f1: 0.5791
 epoch: 67, train_loss: 0.3696, test_loss: 2.1600, test_f1: 0.6222
 epoch: 68, train_loss: 0.3708, test_loss: 2.6033, test_f1: 0.5201
 epoch: 69, train_loss: 0.3656, test_loss: 1.8660, test_f1: 0.6194
 epoch: 70, train_loss: 0.3452, test_loss: 1.8785, test_f1: 0.6059
 epoch: 71, train_loss: 0.3514, test_loss: 2.0001, test_f1: 0.6144
 epoch: 72, train_loss: 0.3376, test_loss: 1.8348, test_f1: 0.6300
 epoch: 73, train_loss: 0.3154, test_loss: 1.9628, test_f1: 0.5947
 epoch: 74, train_loss: 0.3552, test_loss: 2.0874, test_f1: 0.5546
 epoch: 75, train_loss: 0.3011, test_loss: 2.4561, test_f1: 0.5925
 epoch: 76, train_loss: 0.2902, test_loss: 2.4008, test_f1: 0.6332
 epoch: 77, train_loss: 0.3083, test_loss: 2.7236, test_f1: 0.5898
 epoch: 78, train_loss: 0.3489, test_loss: 1.9734, test_f1: 0.6160
 epoch: 79, train_loss: 0.3391, test_loss: 2.1920, test_f1: 0.5906
 epoch: 80, train_loss: 0.3583, test_loss: 2.1940, test_f1: 0.6320
 epoch: 81, train_loss: 0.3238, test_loss: 2.0900, test_f1: 0.6078
 epoch: 82, train_loss: 0.3650, test_loss: 2.0811, test_f1: 0.5997
 epoch: 83, train_loss: 0.3648, test_loss: 2.5055, test_f1: 0.5164
 epoch: 84, train_loss: 0.3206, test_loss: 2.0500, test_f1: 0.5675
 epoch: 85, train_loss: 0.2965, test_loss: 2.1785, test_f1: 0.5862
 epoch: 86, train_loss: 0.2944, test_loss: 2.4686, test_f1: 0.6291
 epoch: 87, train_loss: 0.3020, test_loss: 2.1766, test_f1: 0.6010
 epoch: 88, train_loss: 0.2819, test_loss: 2.1342, test_f1: 0.5937
 epoch: 89, train_loss: 0.2815, test_loss: 2.3910, test_f1: 0.5965
 epoch: 90, train_loss: 0.2601, test_loss: 2.4312, test_f1: 0.6031
 epoch: 91, train_loss: 0.2794, test_loss: 2.8210, test_f1: 0.5667
 epoch: 92, train_loss: 0.2904, test_loss: 2.6028, test_f1: 0.5639
 epoch: 93, train_loss: 0.3032, test_loss: 2.6272, test_f1: 0.6131
 epoch: 94, train_loss: 0.3179, test_loss: 2.8581, test_f1: 0.6087
 epoch: 95, train_loss: 0.2863, test_loss: 2.1728, test_f1: 0.5758
 epoch: 96, train_loss: 0.3177, test_loss: 2.4085, test_f1: 0.6196
 epoch: 97, train_loss: 0.3022, test_loss: 2.4532, test_f1: 0.6014
 epoch: 98, train_loss: 0.2811, test_loss: 2.5341, test_f1: 0.6070
 epoch: 99, train_loss: 0.2593, test_loss: 3.0051, test_f1: 0.5586
##################ITERATION #4 ****************************************
 epoch: 0, train_loss: 1.4082, test_loss: 1.3984, test_f1: 0.2108
 epoch: 1, train_loss: 1.0953, test_loss: 1.1841, test_f1: 0.4164
 epoch: 2, train_loss: 1.0044, test_loss: 1.0868, test_f1: 0.4649
 epoch: 3, train_loss: 0.9690, test_loss: 1.0268, test_f1: 0.4987
 epoch: 4, train_loss: 0.9518, test_loss: 1.0856, test_f1: 0.4896
 epoch: 5, train_loss: 0.9101, test_loss: 1.1700, test_f1: 0.5093
 epoch: 6, train_loss: 0.9003, test_loss: 0.9988, test_f1: 0.5299
 epoch: 7, train_loss: 0.8948, test_loss: 1.0485, test_f1: 0.5378
 epoch: 8, train_loss: 0.8973, test_loss: 0.9695, test_f1: 0.5237
 epoch: 9, train_loss: 0.8700, test_loss: 1.0651, test_f1: 0.5145
 epoch: 10, train_loss: 0.8569, test_loss: 1.0468, test_f1: 0.5300
 epoch: 11, train_loss: 0.8519, test_loss: 1.2223, test_f1: 0.3778
 epoch: 12, train_loss: 0.8662, test_loss: 1.2580, test_f1: 0.4054
 epoch: 13, train_loss: 0.8554, test_loss: 1.1269, test_f1: 0.5533
 epoch: 14, train_loss: 0.8336, test_loss: 1.1283, test_f1: 0.5372
 epoch: 15, train_loss: 0.8339, test_loss: 1.0662, test_f1: 0.5505
 epoch: 16, train_loss: 0.8385, test_loss: 1.0570, test_f1: 0.5833
 epoch: 17, train_loss: 0.7928, test_loss: 1.0318, test_f1: 0.5655
 epoch: 18, train_loss: 0.8119, test_loss: 1.0481, test_f1: 0.5735
 epoch: 19, train_loss: 0.7657, test_loss: 1.0068, test_f1: 0.5452
 epoch: 20, train_loss: 0.7432, test_loss: 1.0340, test_f1: 0.5797
 epoch: 21, train_loss: 0.7236, test_loss: 1.1450, test_f1: 0.5309
 epoch: 22, train_loss: 0.7393, test_loss: 1.0594, test_f1: 0.5696
 epoch: 23, train_loss: 0.7183, test_loss: 1.1551, test_f1: 0.5520
 epoch: 24, train_loss: 0.7092, test_loss: 1.1864, test_f1: 0.5126
 epoch: 25, train_loss: 0.7003, test_loss: 1.1267, test_f1: 0.5566
 epoch: 26, train_loss: 0.6605, test_loss: 1.2331, test_f1: 0.5903
 epoch: 27, train_loss: 0.6663, test_loss: 1.1672, test_f1: 0.5771
 epoch: 28, train_loss: 0.6647, test_loss: 1.1240, test_f1: 0.6038
 epoch: 29, train_loss: 0.6789, test_loss: 1.1568, test_f1: 0.5961
 epoch: 30, train_loss: 0.6652, test_loss: 1.1030, test_f1: 0.6352
 epoch: 31, train_loss: 0.6483, test_loss: 1.2713, test_f1: 0.5285
 epoch: 32, train_loss: 0.6432, test_loss: 1.2124, test_f1: 0.5932
 epoch: 33, train_loss: 0.6608, test_loss: 1.1700, test_f1: 0.5622
 epoch: 34, train_loss: 0.6465, test_loss: 1.0826, test_f1: 0.6321
 epoch: 35, train_loss: 0.6361, test_loss: 1.4953, test_f1: 0.5220
 epoch: 36, train_loss: 0.6827, test_loss: 1.2737, test_f1: 0.5508
 epoch: 37, train_loss: 0.6545, test_loss: 1.1851, test_f1: 0.5640
 epoch: 38, train_loss: 0.6185, test_loss: 1.1470, test_f1: 0.6002
 epoch: 39, train_loss: 0.6081, test_loss: 1.4288, test_f1: 0.5085
 epoch: 40, train_loss: 0.6017, test_loss: 1.4497, test_f1: 0.5517
 epoch: 41, train_loss: 0.5765, test_loss: 1.7480, test_f1: 0.4843
 epoch: 42, train_loss: 0.6144, test_loss: 1.2931, test_f1: 0.5815
 epoch: 43, train_loss: 0.5822, test_loss: 1.3372, test_f1: 0.5893
 epoch: 44, train_loss: 0.5720, test_loss: 1.0990, test_f1: 0.6443
 epoch: 45, train_loss: 0.5625, test_loss: 1.6948, test_f1: 0.5761
 epoch: 46, train_loss: 0.5776, test_loss: 1.3588, test_f1: 0.5814
 epoch: 47, train_loss: 0.5920, test_loss: 1.3289, test_f1: 0.5676
 epoch: 48, train_loss: 0.5441, test_loss: 1.2396, test_f1: 0.6211
 epoch: 49, train_loss: 0.5138, test_loss: 1.5087, test_f1: 0.5727
 epoch: 50, train_loss: 0.5124, test_loss: 1.8745, test_f1: 0.4944
 epoch: 51, train_loss: 0.4781, test_loss: 1.6474, test_f1: 0.6145
 epoch: 52, train_loss: 0.4564, test_loss: 1.4081, test_f1: 0.6482
 epoch: 53, train_loss: 0.4744, test_loss: 1.3993, test_f1: 0.6101
 epoch: 54, train_loss: 0.4494, test_loss: 1.3810, test_f1: 0.6028
 epoch: 55, train_loss: 0.4449, test_loss: 1.5155, test_f1: 0.6103
 epoch: 56, train_loss: 0.4576, test_loss: 1.4420, test_f1: 0.6395
 epoch: 57, train_loss: 0.4542, test_loss: 1.5820, test_f1: 0.6155
 epoch: 58, train_loss: 0.4631, test_loss: 1.5931, test_f1: 0.5929
 epoch: 59, train_loss: 0.4399, test_loss: 1.5951, test_f1: 0.5800
 epoch: 60, train_loss: 0.4474, test_loss: 1.4950, test_f1: 0.6337
 epoch: 61, train_loss: 0.4357, test_loss: 1.5299, test_f1: 0.6308
 epoch: 62, train_loss: 0.4270, test_loss: 1.7998, test_f1: 0.6116
 epoch: 63, train_loss: 0.4186, test_loss: 1.7407, test_f1: 0.6377
 epoch: 64, train_loss: 0.4371, test_loss: 1.5796, test_f1: 0.5970
 epoch: 65, train_loss: 0.4040, test_loss: 1.8345, test_f1: 0.5962
 epoch: 66, train_loss: 0.3811, test_loss: 1.8483, test_f1: 0.5562
 epoch: 67, train_loss: 0.3708, test_loss: 1.6367, test_f1: 0.6145
 epoch: 68, train_loss: 0.3989, test_loss: 1.9134, test_f1: 0.5916
 epoch: 69, train_loss: 0.3725, test_loss: 2.0762, test_f1: 0.5966
 epoch: 70, train_loss: 0.4262, test_loss: 1.5916, test_f1: 0.6378
 epoch: 71, train_loss: 0.3894, test_loss: 1.6435, test_f1: 0.6413
 epoch: 72, train_loss: 0.3906, test_loss: 1.6338, test_f1: 0.5761
 epoch: 73, train_loss: 0.4208, test_loss: 1.7813, test_f1: 0.6213
 epoch: 74, train_loss: 0.3730, test_loss: 1.8836, test_f1: 0.6026
 epoch: 75, train_loss: 0.3578, test_loss: 2.0525, test_f1: 0.5508
 epoch: 76, train_loss: 0.4007, test_loss: 1.9619, test_f1: 0.6010
 epoch: 77, train_loss: 0.4040, test_loss: 2.0031, test_f1: 0.5839
 epoch: 78, train_loss: 0.3892, test_loss: 1.7918, test_f1: 0.5579
 epoch: 79, train_loss: 0.3561, test_loss: 1.9190, test_f1: 0.5869
 epoch: 80, train_loss: 0.3864, test_loss: 1.9654, test_f1: 0.6254
 epoch: 81, train_loss: 0.3613, test_loss: 1.7425, test_f1: 0.5896
 epoch: 82, train_loss: 0.3266, test_loss: 1.7774, test_f1: 0.6057
 epoch: 83, train_loss: 0.4008, test_loss: 2.1846, test_f1: 0.6080
 epoch: 84, train_loss: 0.3789, test_loss: 2.0165, test_f1: 0.6111
 epoch: 85, train_loss: 0.3766, test_loss: 2.1851, test_f1: 0.5551
 epoch: 86, train_loss: 0.3598, test_loss: 2.3966, test_f1: 0.5972
 epoch: 87, train_loss: 0.3401, test_loss: 2.0171, test_f1: 0.5801
 epoch: 88, train_loss: 0.3351, test_loss: 2.0852, test_f1: 0.5986
 epoch: 89, train_loss: 0.3319, test_loss: 2.2484, test_f1: 0.6217
 epoch: 90, train_loss: 0.3178, test_loss: 1.7771, test_f1: 0.6317
 epoch: 91, train_loss: 0.3061, test_loss: 1.9955, test_f1: 0.5776
 epoch: 92, train_loss: 0.3230, test_loss: 1.9724, test_f1: 0.6346
 epoch: 93, train_loss: 0.3157, test_loss: 2.0129, test_f1: 0.5980
 epoch: 94, train_loss: 0.3592, test_loss: 2.0393, test_f1: 0.5907
 epoch: 95, train_loss: 0.3603, test_loss: 2.4396, test_f1: 0.6237
 epoch: 96, train_loss: 0.3144, test_loss: 2.0925, test_f1: 0.5976
 epoch: 97, train_loss: 0.3063, test_loss: 1.9654, test_f1: 0.5736
 epoch: 98, train_loss: 0.2986, test_loss: 2.1924, test_f1: 0.6328
 epoch: 99, train_loss: 0.3292, test_loss: 2.2222, test_f1: 0.6190
##################ITERATION #5 ****************************************
 epoch: 0, train_loss: 1.3902, test_loss: 1.5348, test_f1: 0.1365
 epoch: 1, train_loss: 1.0714, test_loss: 1.1523, test_f1: 0.3989
 epoch: 2, train_loss: 0.9978, test_loss: 1.0839, test_f1: 0.4818
 epoch: 3, train_loss: 0.9560, test_loss: 1.0507, test_f1: 0.4898
 epoch: 4, train_loss: 0.9497, test_loss: 1.1230, test_f1: 0.4768
 epoch: 5, train_loss: 0.9240, test_loss: 1.0369, test_f1: 0.5148
 epoch: 6, train_loss: 0.9006, test_loss: 1.1527, test_f1: 0.5122
 epoch: 7, train_loss: 0.8932, test_loss: 1.1133, test_f1: 0.4858
 epoch: 8, train_loss: 0.9058, test_loss: 1.0429, test_f1: 0.5086
 epoch: 9, train_loss: 0.8848, test_loss: 0.9696, test_f1: 0.5472
 epoch: 10, train_loss: 0.8551, test_loss: 1.0709, test_f1: 0.5628
 epoch: 11, train_loss: 0.8610, test_loss: 1.0265, test_f1: 0.5427
 epoch: 12, train_loss: 0.8476, test_loss: 1.1726, test_f1: 0.4701
 epoch: 13, train_loss: 0.8499, test_loss: 1.2192, test_f1: 0.4595
 epoch: 14, train_loss: 0.8250, test_loss: 1.0574, test_f1: 0.5960
 epoch: 15, train_loss: 0.8107, test_loss: 1.0415, test_f1: 0.5775
 epoch: 16, train_loss: 0.7662, test_loss: 1.2265, test_f1: 0.5055
 epoch: 17, train_loss: 0.7794, test_loss: 1.2531, test_f1: 0.4705
 epoch: 18, train_loss: 0.7629, test_loss: 1.1425, test_f1: 0.5958
 epoch: 19, train_loss: 0.7410, test_loss: 1.3946, test_f1: 0.5153
 epoch: 20, train_loss: 0.7603, test_loss: 1.3321, test_f1: 0.5763
 epoch: 21, train_loss: 0.7178, test_loss: 1.2743, test_f1: 0.5392
 epoch: 22, train_loss: 0.7057, test_loss: 1.3153, test_f1: 0.5169
 epoch: 23, train_loss: 0.6912, test_loss: 1.3270, test_f1: 0.5351
 epoch: 24, train_loss: 0.6918, test_loss: 1.3125, test_f1: 0.5355
 epoch: 25, train_loss: 0.6942, test_loss: 1.1625, test_f1: 0.5726
 epoch: 26, train_loss: 0.7002, test_loss: 1.0044, test_f1: 0.5668
 epoch: 27, train_loss: 0.6915, test_loss: 1.3626, test_f1: 0.5372
 epoch: 28, train_loss: 0.6751, test_loss: 1.3306, test_f1: 0.5641
 epoch: 29, train_loss: 0.6354, test_loss: 1.3048, test_f1: 0.5558
 epoch: 30, train_loss: 0.6327, test_loss: 1.2433, test_f1: 0.6141
 epoch: 31, train_loss: 0.6261, test_loss: 1.1580, test_f1: 0.5791
 epoch: 32, train_loss: 0.6202, test_loss: 1.1888, test_f1: 0.6213
 epoch: 33, train_loss: 0.5705, test_loss: 1.4766, test_f1: 0.4696
 epoch: 34, train_loss: 0.6017, test_loss: 1.2012, test_f1: 0.5689
 epoch: 35, train_loss: 0.5888, test_loss: 1.2753, test_f1: 0.5946
 epoch: 36, train_loss: 0.5555, test_loss: 1.2415, test_f1: 0.6009
 epoch: 37, train_loss: 0.6029, test_loss: 1.2975, test_f1: 0.5762
 epoch: 38, train_loss: 0.5970, test_loss: 1.2297, test_f1: 0.5951
 epoch: 39, train_loss: 0.5757, test_loss: 1.1410, test_f1: 0.6086
 epoch: 40, train_loss: 0.5701, test_loss: 1.2731, test_f1: 0.5624
 epoch: 41, train_loss: 0.5975, test_loss: 1.3244, test_f1: 0.5750
 epoch: 42, train_loss: 0.6023, test_loss: 1.3254, test_f1: 0.5837
 epoch: 43, train_loss: 0.5467, test_loss: 1.2675, test_f1: 0.5467
 epoch: 44, train_loss: 0.5775, test_loss: 1.2904, test_f1: 0.5912
 epoch: 45, train_loss: 0.5426, test_loss: 1.3517, test_f1: 0.5901
 epoch: 46, train_loss: 0.5176, test_loss: 1.2897, test_f1: 0.5642
 epoch: 47, train_loss: 0.5530, test_loss: 1.4019, test_f1: 0.5827
 epoch: 48, train_loss: 0.5587, test_loss: 1.2346, test_f1: 0.5977
 epoch: 49, train_loss: 0.5286, test_loss: 1.2491, test_f1: 0.5489
 epoch: 50, train_loss: 0.5210, test_loss: 1.3564, test_f1: 0.5824
 epoch: 51, train_loss: 0.4728, test_loss: 1.3164, test_f1: 0.6311
 epoch: 52, train_loss: 0.4367, test_loss: 1.4511, test_f1: 0.5880
 epoch: 53, train_loss: 0.4046, test_loss: 1.6465, test_f1: 0.6005
 epoch: 54, train_loss: 0.3935, test_loss: 1.6079, test_f1: 0.5837
 epoch: 55, train_loss: 0.3790, test_loss: 1.4555, test_f1: 0.6432
 epoch: 56, train_loss: 0.3738, test_loss: 1.7075, test_f1: 0.5830
 epoch: 57, train_loss: 0.4145, test_loss: 1.8049, test_f1: 0.5716
 epoch: 58, train_loss: 0.4017, test_loss: 1.6692, test_f1: 0.5836
 epoch: 59, train_loss: 0.3664, test_loss: 1.5878, test_f1: 0.5971
 epoch: 60, train_loss: 0.3599, test_loss: 1.7492, test_f1: 0.5925
 epoch: 61, train_loss: 0.3811, test_loss: 2.2165, test_f1: 0.5714
 epoch: 62, train_loss: 0.3811, test_loss: 1.7871, test_f1: 0.5569
 epoch: 63, train_loss: 0.3674, test_loss: 2.0648, test_f1: 0.5997
 epoch: 64, train_loss: 0.3548, test_loss: 1.7425, test_f1: 0.5823
 epoch: 65, train_loss: 0.3874, test_loss: 2.1341, test_f1: 0.5619
 epoch: 66, train_loss: 0.4073, test_loss: 1.7148, test_f1: 0.5601
 epoch: 67, train_loss: 0.3593, test_loss: 1.8012, test_f1: 0.5841
 epoch: 68, train_loss: 0.3586, test_loss: 1.8596, test_f1: 0.5796
 epoch: 69, train_loss: 0.3363, test_loss: 1.9433, test_f1: 0.5888
 epoch: 70, train_loss: 0.3394, test_loss: 1.9440, test_f1: 0.5227
 epoch: 71, train_loss: 0.3234, test_loss: 1.7734, test_f1: 0.6164
 epoch: 72, train_loss: 0.3341, test_loss: 2.2942, test_f1: 0.5664
 epoch: 73, train_loss: 0.3243, test_loss: 2.4431, test_f1: 0.5320
 epoch: 74, train_loss: 0.3187, test_loss: 2.3565, test_f1: 0.5640
 epoch: 75, train_loss: 0.2966, test_loss: 2.2836, test_f1: 0.4961
 epoch: 76, train_loss: 0.2971, test_loss: 2.3392, test_f1: 0.5875
 epoch: 77, train_loss: 0.3301, test_loss: 2.1998, test_f1: 0.5365
 epoch: 78, train_loss: 0.3383, test_loss: 1.9628, test_f1: 0.6220
 epoch: 79, train_loss: 0.3066, test_loss: 2.5213, test_f1: 0.5648
 epoch: 80, train_loss: 0.2801, test_loss: 1.8896, test_f1: 0.5550
 epoch: 81, train_loss: 0.2917, test_loss: 2.3943, test_f1: 0.5835
 epoch: 82, train_loss: 0.2570, test_loss: 2.3348, test_f1: 0.5720
 epoch: 83, train_loss: 0.2664, test_loss: 2.1972, test_f1: 0.5702
 epoch: 84, train_loss: 0.2864, test_loss: 1.8889, test_f1: 0.5988
 epoch: 85, train_loss: 0.2608, test_loss: 2.6744, test_f1: 0.5552
 epoch: 86, train_loss: 0.2678, test_loss: 2.2318, test_f1: 0.6084
 epoch: 87, train_loss: 0.2571, test_loss: 2.4818, test_f1: 0.5639
 epoch: 88, train_loss: 0.2521, test_loss: 2.0559, test_f1: 0.5940
 epoch: 89, train_loss: 0.2743, test_loss: 2.2103, test_f1: 0.5507
 epoch: 90, train_loss: 0.3100, test_loss: 2.1479, test_f1: 0.5899
 epoch: 91, train_loss: 0.2453, test_loss: 2.1894, test_f1: 0.5976
 epoch: 92, train_loss: 0.2482, test_loss: 2.3018, test_f1: 0.5803
 epoch: 93, train_loss: 0.2917, test_loss: 2.3736, test_f1: 0.5563
 epoch: 94, train_loss: 0.2923, test_loss: 2.7201, test_f1: 0.5516
 epoch: 95, train_loss: 0.2931, test_loss: 2.2875, test_f1: 0.5875
 epoch: 96, train_loss: 0.4188, test_loss: 2.2757, test_f1: 0.5160
 epoch: 97, train_loss: 0.3536, test_loss: 2.3282, test_f1: 0.6062
 epoch: 98, train_loss: 0.3017, test_loss: 2.1746, test_f1: 0.6103
 epoch: 99, train_loss: 0.2667, test_loss: 2.4178, test_f1: 0.5513
##################ITERATION #6 ****************************************
 epoch: 0, train_loss: 1.4955, test_loss: 1.4459, test_f1: 0.1502
 epoch: 1, train_loss: 1.1405, test_loss: 1.3561, test_f1: 0.2288
 epoch: 2, train_loss: 1.0327, test_loss: 1.2021, test_f1: 0.3682
 epoch: 3, train_loss: 1.0018, test_loss: 1.0930, test_f1: 0.4838
 epoch: 4, train_loss: 0.9545, test_loss: 1.1039, test_f1: 0.4920
 epoch: 5, train_loss: 0.9121, test_loss: 1.0195, test_f1: 0.5204
 epoch: 6, train_loss: 0.8933, test_loss: 1.4151, test_f1: 0.3755
 epoch: 7, train_loss: 0.8815, test_loss: 1.0057, test_f1: 0.5392
 epoch: 8, train_loss: 0.8600, test_loss: 1.0755, test_f1: 0.5757
 epoch: 9, train_loss: 0.8801, test_loss: 1.2036, test_f1: 0.5532
 epoch: 10, train_loss: 0.8807, test_loss: 1.0725, test_f1: 0.5149
 epoch: 11, train_loss: 0.8632, test_loss: 1.1844, test_f1: 0.5026
 epoch: 12, train_loss: 0.8545, test_loss: 1.1050, test_f1: 0.5325
 epoch: 13, train_loss: 0.8619, test_loss: 1.1134, test_f1: 0.4384
 epoch: 14, train_loss: 0.8360, test_loss: 1.1909, test_f1: 0.5034
 epoch: 15, train_loss: 0.8126, test_loss: 1.1078, test_f1: 0.5440
 epoch: 16, train_loss: 0.7873, test_loss: 1.2112, test_f1: 0.5418
 epoch: 17, train_loss: 0.7732, test_loss: 1.1260, test_f1: 0.5773
 epoch: 18, train_loss: 0.7501, test_loss: 1.1492, test_f1: 0.5694
 epoch: 19, train_loss: 0.7306, test_loss: 1.0572, test_f1: 0.5621
 epoch: 20, train_loss: 0.7497, test_loss: 1.2563, test_f1: 0.4170
 epoch: 21, train_loss: 0.7695, test_loss: 1.1587, test_f1: 0.5995
 epoch: 22, train_loss: 0.7250, test_loss: 1.1003, test_f1: 0.6205
 epoch: 23, train_loss: 0.7181, test_loss: 1.1880, test_f1: 0.5238
 epoch: 24, train_loss: 0.6953, test_loss: 1.2280, test_f1: 0.5056
 epoch: 25, train_loss: 0.7156, test_loss: 1.1667, test_f1: 0.6458
 epoch: 26, train_loss: 0.6937, test_loss: 1.1920, test_f1: 0.6073
 epoch: 27, train_loss: 0.6983, test_loss: 1.0888, test_f1: 0.5999
 epoch: 28, train_loss: 0.6659, test_loss: 1.3492, test_f1: 0.5639
 epoch: 29, train_loss: 0.6539, test_loss: 1.1939, test_f1: 0.6104
 epoch: 30, train_loss: 0.6307, test_loss: 1.3840, test_f1: 0.5755
 epoch: 31, train_loss: 0.6251, test_loss: 1.4798, test_f1: 0.5258
 epoch: 32, train_loss: 0.6248, test_loss: 1.3184, test_f1: 0.5908
 epoch: 33, train_loss: 0.6351, test_loss: 1.2293, test_f1: 0.6107
 epoch: 34, train_loss: 0.6224, test_loss: 1.5264, test_f1: 0.5719
 epoch: 35, train_loss: 0.6023, test_loss: 1.3395, test_f1: 0.5990
 epoch: 36, train_loss: 0.6080, test_loss: 1.3419, test_f1: 0.5990
 epoch: 37, train_loss: 0.6248, test_loss: 1.1461, test_f1: 0.5886
 epoch: 38, train_loss: 0.6431, test_loss: 1.3332, test_f1: 0.5914
 epoch: 39, train_loss: 0.6187, test_loss: 1.4301, test_f1: 0.5853
 epoch: 40, train_loss: 0.6325, test_loss: 1.6443, test_f1: 0.5046
 epoch: 41, train_loss: 0.5979, test_loss: 1.2930, test_f1: 0.5871
 epoch: 42, train_loss: 0.5811, test_loss: 1.2311, test_f1: 0.6002
 epoch: 43, train_loss: 0.5300, test_loss: 1.2498, test_f1: 0.6024
 epoch: 44, train_loss: 0.5624, test_loss: 1.6342, test_f1: 0.5371
 epoch: 45, train_loss: 0.5646, test_loss: 1.7573, test_f1: 0.5388
 epoch: 46, train_loss: 0.5664, test_loss: 1.6845, test_f1: 0.5864
 epoch: 47, train_loss: 0.5663, test_loss: 1.5628, test_f1: 0.6316
 epoch: 48, train_loss: 0.5857, test_loss: 1.3961, test_f1: 0.5862
 epoch: 49, train_loss: 0.5636, test_loss: 1.2770, test_f1: 0.6020
 epoch: 50, train_loss: 0.5047, test_loss: 1.5044, test_f1: 0.6100
 epoch: 51, train_loss: 0.4904, test_loss: 1.4921, test_f1: 0.6239
 epoch: 52, train_loss: 0.4902, test_loss: 1.4995, test_f1: 0.6193
 epoch: 53, train_loss: 0.4524, test_loss: 1.4668, test_f1: 0.6311
 epoch: 54, train_loss: 0.4656, test_loss: 1.7925, test_f1: 0.5869
 epoch: 55, train_loss: 0.4409, test_loss: 1.6064, test_f1: 0.5752
 epoch: 56, train_loss: 0.4360, test_loss: 1.6090, test_f1: 0.6010
 epoch: 57, train_loss: 0.4344, test_loss: 1.6251, test_f1: 0.6047
 epoch: 58, train_loss: 0.4262, test_loss: 1.8453, test_f1: 0.6314
 epoch: 59, train_loss: 0.4298, test_loss: 1.6841, test_f1: 0.6137
 epoch: 60, train_loss: 0.4410, test_loss: 1.7581, test_f1: 0.6115
 epoch: 61, train_loss: 0.4658, test_loss: 1.4957, test_f1: 0.5944
 epoch: 62, train_loss: 0.4446, test_loss: 1.6463, test_f1: 0.5669
 epoch: 63, train_loss: 0.4460, test_loss: 1.8267, test_f1: 0.5943
 epoch: 64, train_loss: 0.4417, test_loss: 2.0703, test_f1: 0.5740
 epoch: 65, train_loss: 0.4303, test_loss: 2.1185, test_f1: 0.5580
 epoch: 66, train_loss: 0.4130, test_loss: 1.7732, test_f1: 0.6311
 epoch: 67, train_loss: 0.3885, test_loss: 1.6421, test_f1: 0.6352
 epoch: 68, train_loss: 0.4228, test_loss: 1.8768, test_f1: 0.5827
 epoch: 69, train_loss: 0.3727, test_loss: 1.6108, test_f1: 0.6157
 epoch: 70, train_loss: 0.3582, test_loss: 1.7909, test_f1: 0.6177
 epoch: 71, train_loss: 0.3810, test_loss: 1.9522, test_f1: 0.6184
 epoch: 72, train_loss: 0.3670, test_loss: 1.8570, test_f1: 0.5933
 epoch: 73, train_loss: 0.3702, test_loss: 1.9889, test_f1: 0.6318
 epoch: 74, train_loss: 0.3424, test_loss: 2.2038, test_f1: 0.6190
 epoch: 75, train_loss: 0.3435, test_loss: 2.2321, test_f1: 0.6056
 epoch: 76, train_loss: 0.3621, test_loss: 1.8277, test_f1: 0.6294
 epoch: 77, train_loss: 0.3928, test_loss: 1.7998, test_f1: 0.5410
 epoch: 78, train_loss: 0.4246, test_loss: 2.0170, test_f1: 0.6176
 epoch: 79, train_loss: 0.3598, test_loss: 1.7424, test_f1: 0.6056
 epoch: 80, train_loss: 0.3578, test_loss: 1.8593, test_f1: 0.6202
 epoch: 81, train_loss: 0.3518, test_loss: 2.2231, test_f1: 0.6028
 epoch: 82, train_loss: 0.3515, test_loss: 2.0382, test_f1: 0.6151
 epoch: 83, train_loss: 0.3718, test_loss: 2.2049, test_f1: 0.5898
 epoch: 84, train_loss: 0.3451, test_loss: 2.1248, test_f1: 0.6383
 epoch: 85, train_loss: 0.3652, test_loss: 2.0091, test_f1: 0.6004
 epoch: 86, train_loss: 0.3691, test_loss: 1.8610, test_f1: 0.5958
 epoch: 87, train_loss: 0.3659, test_loss: 1.9941, test_f1: 0.5253
 epoch: 88, train_loss: 0.3511, test_loss: 2.1475, test_f1: 0.6156
 epoch: 89, train_loss: 0.3359, test_loss: 1.9386, test_f1: 0.5928
 epoch: 90, train_loss: 0.3196, test_loss: 2.1803, test_f1: 0.6217
 epoch: 91, train_loss: 0.2939, test_loss: 2.0704, test_f1: 0.6136
 epoch: 92, train_loss: 0.3316, test_loss: 2.4557, test_f1: 0.5978
 epoch: 93, train_loss: 0.3473, test_loss: 1.9541, test_f1: 0.6059
 epoch: 94, train_loss: 0.3700, test_loss: 2.0275, test_f1: 0.6051
 epoch: 95, train_loss: 0.3180, test_loss: 2.1360, test_f1: 0.6269
 epoch: 96, train_loss: 0.3247, test_loss: 1.8804, test_f1: 0.5859
 epoch: 97, train_loss: 0.3007, test_loss: 2.4937, test_f1: 0.6107
 epoch: 98, train_loss: 0.3222, test_loss: 2.2072, test_f1: 0.6413
 epoch: 99, train_loss: 0.2979, test_loss: 2.2851, test_f1: 0.6268
##################ITERATION #7 ****************************************
 epoch: 0, train_loss: 1.3688, test_loss: 1.2785, test_f1: 0.3199
 epoch: 1, train_loss: 1.0342, test_loss: 1.2062, test_f1: 0.3900
 epoch: 2, train_loss: 0.9928, test_loss: 1.0828, test_f1: 0.4709
 epoch: 3, train_loss: 0.9536, test_loss: 1.0606, test_f1: 0.4158
 epoch: 4, train_loss: 0.9475, test_loss: 1.0896, test_f1: 0.4890
 epoch: 5, train_loss: 0.9583, test_loss: 0.9995, test_f1: 0.5279
 epoch: 6, train_loss: 0.9156, test_loss: 1.0009, test_f1: 0.5391
 epoch: 7, train_loss: 0.9045, test_loss: 1.0281, test_f1: 0.5078
 epoch: 8, train_loss: 0.8758, test_loss: 1.0703, test_f1: 0.4983
 epoch: 9, train_loss: 0.8481, test_loss: 1.0991, test_f1: 0.4931
 epoch: 10, train_loss: 0.8597, test_loss: 1.1180, test_f1: 0.4975
 epoch: 11, train_loss: 0.8777, test_loss: 1.2147, test_f1: 0.4595
 epoch: 12, train_loss: 0.8919, test_loss: 1.0669, test_f1: 0.5306
 epoch: 13, train_loss: 0.8149, test_loss: 1.0540, test_f1: 0.4840
 epoch: 14, train_loss: 0.8058, test_loss: 0.9931, test_f1: 0.5321
 epoch: 15, train_loss: 0.7872, test_loss: 1.0372, test_f1: 0.5387
 epoch: 16, train_loss: 0.7534, test_loss: 1.0481, test_f1: 0.5256
 epoch: 17, train_loss: 0.7672, test_loss: 1.0714, test_f1: 0.5149
 epoch: 18, train_loss: 0.7580, test_loss: 1.1067, test_f1: 0.5652
 epoch: 19, train_loss: 0.7626, test_loss: 1.0480, test_f1: 0.5167
 epoch: 20, train_loss: 0.7414, test_loss: 0.9829, test_f1: 0.6175
 epoch: 21, train_loss: 0.6814, test_loss: 1.0902, test_f1: 0.5507
 epoch: 22, train_loss: 0.6722, test_loss: 1.0683, test_f1: 0.5644
 epoch: 23, train_loss: 0.6912, test_loss: 1.0029, test_f1: 0.5924
 epoch: 24, train_loss: 0.6635, test_loss: 1.1989, test_f1: 0.5655
 epoch: 25, train_loss: 0.6921, test_loss: 1.2513, test_f1: 0.5841
 epoch: 26, train_loss: 0.6702, test_loss: 1.0789, test_f1: 0.5980
 epoch: 27, train_loss: 0.6340, test_loss: 1.2137, test_f1: 0.5783
 epoch: 28, train_loss: 0.6466, test_loss: 1.1757, test_f1: 0.5755
 epoch: 29, train_loss: 0.6475, test_loss: 1.0770, test_f1: 0.6033
 epoch: 30, train_loss: 0.5976, test_loss: 1.1013, test_f1: 0.5756
 epoch: 31, train_loss: 0.5938, test_loss: 1.4337, test_f1: 0.5447
 epoch: 32, train_loss: 0.5801, test_loss: 1.0974, test_f1: 0.5833
 epoch: 33, train_loss: 0.5654, test_loss: 1.1439, test_f1: 0.5806
 epoch: 34, train_loss: 0.5751, test_loss: 1.6165, test_f1: 0.4873
 epoch: 35, train_loss: 0.5627, test_loss: 1.1735, test_f1: 0.6235
 epoch: 36, train_loss: 0.5726, test_loss: 1.2856, test_f1: 0.5426
 epoch: 37, train_loss: 0.5331, test_loss: 1.1260, test_f1: 0.6162
 epoch: 38, train_loss: 0.5595, test_loss: 1.1904, test_f1: 0.5874
 epoch: 39, train_loss: 0.6113, test_loss: 1.2846, test_f1: 0.5408
 epoch: 40, train_loss: 0.5726, test_loss: 1.1674, test_f1: 0.6045
 epoch: 41, train_loss: 0.5361, test_loss: 1.2954, test_f1: 0.6114
 epoch: 42, train_loss: 0.5336, test_loss: 1.0868, test_f1: 0.5926
 epoch: 43, train_loss: 0.5187, test_loss: 1.3000, test_f1: 0.5835
 epoch: 44, train_loss: 0.5286, test_loss: 1.0970, test_f1: 0.6243
 epoch: 45, train_loss: 0.5509, test_loss: 1.6756, test_f1: 0.4965
 epoch: 46, train_loss: 0.6142, test_loss: 1.1885, test_f1: 0.5289
 epoch: 47, train_loss: 0.5435, test_loss: 1.2135, test_f1: 0.6291
 epoch: 48, train_loss: 0.5319, test_loss: 1.1813, test_f1: 0.5989
 epoch: 49, train_loss: 0.4934, test_loss: 1.3409, test_f1: 0.5981
 epoch: 50, train_loss: 0.5054, test_loss: 1.3402, test_f1: 0.5864
 epoch: 51, train_loss: 0.4645, test_loss: 1.1762, test_f1: 0.6125
 epoch: 52, train_loss: 0.4354, test_loss: 1.2917, test_f1: 0.5919
 epoch: 53, train_loss: 0.4237, test_loss: 1.1987, test_f1: 0.6538
 epoch: 54, train_loss: 0.4192, test_loss: 1.1917, test_f1: 0.6235
 epoch: 55, train_loss: 0.3993, test_loss: 1.3305, test_f1: 0.6353
 epoch: 56, train_loss: 0.4142, test_loss: 1.3987, test_f1: 0.6244
 epoch: 57, train_loss: 0.3846, test_loss: 1.5106, test_f1: 0.6053
 epoch: 58, train_loss: 0.3783, test_loss: 1.2793, test_f1: 0.6102
 epoch: 59, train_loss: 0.3512, test_loss: 1.3594, test_f1: 0.6054
 epoch: 60, train_loss: 0.3708, test_loss: 1.5524, test_f1: 0.6188
 epoch: 61, train_loss: 0.3992, test_loss: 1.4572, test_f1: 0.6237
 epoch: 62, train_loss: 0.3888, test_loss: 1.5726, test_f1: 0.5249
 epoch: 63, train_loss: 0.3865, test_loss: 1.3618, test_f1: 0.6416
 epoch: 64, train_loss: 0.3573, test_loss: 1.4353, test_f1: 0.6087
 epoch: 65, train_loss: 0.3305, test_loss: 1.5689, test_f1: 0.6547
 epoch: 66, train_loss: 0.3486, test_loss: 1.7382, test_f1: 0.5887
 epoch: 67, train_loss: 0.3325, test_loss: 1.5835, test_f1: 0.6320
 epoch: 68, train_loss: 0.3765, test_loss: 1.6316, test_f1: 0.5904
 epoch: 69, train_loss: 0.3611, test_loss: 1.6014, test_f1: 0.5967
 epoch: 70, train_loss: 0.3631, test_loss: 1.6196, test_f1: 0.6043
 epoch: 71, train_loss: 0.3406, test_loss: 1.4814, test_f1: 0.6326
 epoch: 72, train_loss: 0.3441, test_loss: 1.5577, test_f1: 0.5730
 epoch: 73, train_loss: 0.3239, test_loss: 1.7914, test_f1: 0.6326
 epoch: 74, train_loss: 0.3089, test_loss: 1.6278, test_f1: 0.5813
 epoch: 75, train_loss: 0.3359, test_loss: 1.7323, test_f1: 0.6122
 epoch: 76, train_loss: 0.3355, test_loss: 1.6546, test_f1: 0.6283
 epoch: 77, train_loss: 0.3309, test_loss: 1.6579, test_f1: 0.5975
 epoch: 78, train_loss: 0.3214, test_loss: 1.7379, test_f1: 0.6221
 epoch: 79, train_loss: 0.3446, test_loss: 1.7980, test_f1: 0.5958
 epoch: 80, train_loss: 0.3210, test_loss: 1.6685, test_f1: 0.6633
 epoch: 81, train_loss: 0.3395, test_loss: 1.7378, test_f1: 0.5583
 epoch: 82, train_loss: 0.3582, test_loss: 1.6165, test_f1: 0.5850
 epoch: 83, train_loss: 0.3256, test_loss: 1.7715, test_f1: 0.6095
 epoch: 84, train_loss: 0.2868, test_loss: 1.7019, test_f1: 0.6451
 epoch: 85, train_loss: 0.2811, test_loss: 1.6369, test_f1: 0.5995
 epoch: 86, train_loss: 0.2982, test_loss: 1.8357, test_f1: 0.6311
 epoch: 87, train_loss: 0.3664, test_loss: 1.7723, test_f1: 0.6081
 epoch: 88, train_loss: 0.3420, test_loss: 1.6968, test_f1: 0.6231
 epoch: 89, train_loss: 0.3221, test_loss: 1.7888, test_f1: 0.6295
 epoch: 90, train_loss: 0.3251, test_loss: 1.6394, test_f1: 0.5993
 epoch: 91, train_loss: 0.2887, test_loss: 1.7984, test_f1: 0.6069
 epoch: 92, train_loss: 0.2726, test_loss: 1.6958, test_f1: 0.6115
 epoch: 93, train_loss: 0.2450, test_loss: 1.8420, test_f1: 0.6245
 epoch: 94, train_loss: 0.2608, test_loss: 1.7460, test_f1: 0.6102
 epoch: 95, train_loss: 0.2406, test_loss: 1.9015, test_f1: 0.6467
 epoch: 96, train_loss: 0.2454, test_loss: 2.0690, test_f1: 0.5871
 epoch: 97, train_loss: 0.2690, test_loss: 1.9535, test_f1: 0.5548
 epoch: 98, train_loss: 0.2369, test_loss: 1.9333, test_f1: 0.6096
 epoch: 99, train_loss: 0.2220, test_loss: 1.9315, test_f1: 0.6268
##################ITERATION #8 ****************************************
 epoch: 0, train_loss: 1.5859, test_loss: 1.5949, test_f1: 0.3155
 epoch: 1, train_loss: 1.1087, test_loss: 1.3328, test_f1: 0.3302
 epoch: 2, train_loss: 0.9827, test_loss: 1.1095, test_f1: 0.4722
 epoch: 3, train_loss: 0.9643, test_loss: 1.0974, test_f1: 0.4560
 epoch: 4, train_loss: 0.9344, test_loss: 1.0429, test_f1: 0.5026
 epoch: 5, train_loss: 0.9128, test_loss: 1.0951, test_f1: 0.4867
 epoch: 6, train_loss: 0.9187, test_loss: 1.0853, test_f1: 0.5206
 epoch: 7, train_loss: 0.8929, test_loss: 1.1334, test_f1: 0.5254
 epoch: 8, train_loss: 0.8741, test_loss: 1.1204, test_f1: 0.4880
 epoch: 9, train_loss: 0.8659, test_loss: 1.0456, test_f1: 0.5929
 epoch: 10, train_loss: 0.8443, test_loss: 1.1343, test_f1: 0.5058
 epoch: 11, train_loss: 0.8264, test_loss: 1.0162, test_f1: 0.5708
 epoch: 12, train_loss: 0.8185, test_loss: 1.2725, test_f1: 0.4343
 epoch: 13, train_loss: 0.8015, test_loss: 1.1198, test_f1: 0.4975
 epoch: 14, train_loss: 0.8133, test_loss: 1.0962, test_f1: 0.5688
 epoch: 15, train_loss: 0.7829, test_loss: 1.4639, test_f1: 0.4001
 epoch: 16, train_loss: 0.7729, test_loss: 1.2740, test_f1: 0.5068
 epoch: 17, train_loss: 0.7459, test_loss: 0.9970, test_f1: 0.5683
 epoch: 18, train_loss: 0.7275, test_loss: 1.1175, test_f1: 0.5356
 epoch: 19, train_loss: 0.7127, test_loss: 1.2855, test_f1: 0.5102
 epoch: 20, train_loss: 0.7122, test_loss: 1.1738, test_f1: 0.5325
 epoch: 21, train_loss: 0.7118, test_loss: 1.1433, test_f1: 0.5538
 epoch: 22, train_loss: 0.6896, test_loss: 1.4054, test_f1: 0.4991
 epoch: 23, train_loss: 0.6920, test_loss: 1.2956, test_f1: 0.5115
 epoch: 24, train_loss: 0.7123, test_loss: 1.0532, test_f1: 0.5607
 epoch: 25, train_loss: 0.6891, test_loss: 1.0646, test_f1: 0.5787
 epoch: 26, train_loss: 0.6590, test_loss: 1.1065, test_f1: 0.5871
 epoch: 27, train_loss: 0.6379, test_loss: 1.4017, test_f1: 0.5035
 epoch: 28, train_loss: 0.6735, test_loss: 1.0922, test_f1: 0.5743
 epoch: 29, train_loss: 0.6509, test_loss: 1.1981, test_f1: 0.5444
 epoch: 30, train_loss: 0.6183, test_loss: 1.2048, test_f1: 0.5089
 epoch: 31, train_loss: 0.5797, test_loss: 1.2908, test_f1: 0.6106
 epoch: 32, train_loss: 0.5907, test_loss: 1.4206, test_f1: 0.4943
 epoch: 33, train_loss: 0.6210, test_loss: 1.3358, test_f1: 0.6262
 epoch: 34, train_loss: 0.6280, test_loss: 1.3154, test_f1: 0.5601
 epoch: 35, train_loss: 0.6049, test_loss: 1.1305, test_f1: 0.5935
 epoch: 36, train_loss: 0.5992, test_loss: 1.1525, test_f1: 0.6248
 epoch: 37, train_loss: 0.5824, test_loss: 1.1691, test_f1: 0.6099
 epoch: 38, train_loss: 0.5801, test_loss: 1.1844, test_f1: 0.6336
 epoch: 39, train_loss: 0.5543, test_loss: 1.2306, test_f1: 0.6056
 epoch: 40, train_loss: 0.5541, test_loss: 1.3866, test_f1: 0.5752
 epoch: 41, train_loss: 0.6282, test_loss: 1.1387, test_f1: 0.6006
 epoch: 42, train_loss: 0.6369, test_loss: 1.2849, test_f1: 0.5960
 epoch: 43, train_loss: 0.5924, test_loss: 1.2899, test_f1: 0.6134
 epoch: 44, train_loss: 0.5791, test_loss: 1.5804, test_f1: 0.5712
 epoch: 45, train_loss: 0.5618, test_loss: 1.2015, test_f1: 0.6497
 epoch: 46, train_loss: 0.5561, test_loss: 1.2631, test_f1: 0.5703
 epoch: 47, train_loss: 0.5498, test_loss: 1.3080, test_f1: 0.5928
 epoch: 48, train_loss: 0.5243, test_loss: 1.5425, test_f1: 0.5684
 epoch: 49, train_loss: 0.5552, test_loss: 1.3049, test_f1: 0.5820
 epoch: 50, train_loss: 0.5230, test_loss: 1.2455, test_f1: 0.5538
 epoch: 51, train_loss: 0.5058, test_loss: 1.3512, test_f1: 0.6007
 epoch: 52, train_loss: 0.4696, test_loss: 1.3202, test_f1: 0.6530
 epoch: 53, train_loss: 0.4627, test_loss: 1.4823, test_f1: 0.5816
 epoch: 54, train_loss: 0.4304, test_loss: 1.5113, test_f1: 0.5756
 epoch: 55, train_loss: 0.4445, test_loss: 1.6531, test_f1: 0.5956
 epoch: 56, train_loss: 0.4147, test_loss: 1.4481, test_f1: 0.6452
 epoch: 57, train_loss: 0.4123, test_loss: 1.5348, test_f1: 0.5854
 epoch: 58, train_loss: 0.4293, test_loss: 1.3272, test_f1: 0.6095
 epoch: 59, train_loss: 0.4163, test_loss: 1.6320, test_f1: 0.5948
 epoch: 60, train_loss: 0.4206, test_loss: 1.7278, test_f1: 0.6173
 epoch: 61, train_loss: 0.4152, test_loss: 1.6396, test_f1: 0.5969
 epoch: 62, train_loss: 0.4108, test_loss: 1.4633, test_f1: 0.6195
 epoch: 63, train_loss: 0.4123, test_loss: 1.6292, test_f1: 0.6176
 epoch: 64, train_loss: 0.4002, test_loss: 1.5814, test_f1: 0.5906
 epoch: 65, train_loss: 0.3697, test_loss: 1.6773, test_f1: 0.5866
 epoch: 66, train_loss: 0.4014, test_loss: 1.5973, test_f1: 0.5922
 epoch: 67, train_loss: 0.3893, test_loss: 1.6897, test_f1: 0.6008
 epoch: 68, train_loss: 0.3811, test_loss: 1.7059, test_f1: 0.6069
 epoch: 69, train_loss: 0.3883, test_loss: 1.9488, test_f1: 0.5877
 epoch: 70, train_loss: 0.3748, test_loss: 1.7196, test_f1: 0.5985
 epoch: 71, train_loss: 0.3555, test_loss: 2.0049, test_f1: 0.6065
 epoch: 72, train_loss: 0.3525, test_loss: 1.8231, test_f1: 0.6279
 epoch: 73, train_loss: 0.3325, test_loss: 1.7832, test_f1: 0.6401
 epoch: 74, train_loss: 0.3522, test_loss: 1.9514, test_f1: 0.5935
 epoch: 75, train_loss: 0.3239, test_loss: 1.8927, test_f1: 0.5912
 epoch: 76, train_loss: 0.3392, test_loss: 1.9052, test_f1: 0.6356
 epoch: 77, train_loss: 0.3609, test_loss: 1.9222, test_f1: 0.6037
 epoch: 78, train_loss: 0.3406, test_loss: 1.6779, test_f1: 0.6218
 epoch: 79, train_loss: 0.3667, test_loss: 1.8045, test_f1: 0.6188
 epoch: 80, train_loss: 0.3882, test_loss: 1.9695, test_f1: 0.5841
 epoch: 81, train_loss: 0.3713, test_loss: 1.9940, test_f1: 0.6144
 epoch: 82, train_loss: 0.3306, test_loss: 2.0339, test_f1: 0.5871
 epoch: 83, train_loss: 0.3241, test_loss: 1.7918, test_f1: 0.6143
 epoch: 84, train_loss: 0.2869, test_loss: 1.9841, test_f1: 0.6395
 epoch: 85, train_loss: 0.3184, test_loss: 2.0519, test_f1: 0.6031
 epoch: 86, train_loss: 0.2989, test_loss: 2.4253, test_f1: 0.6145
 epoch: 87, train_loss: 0.3251, test_loss: 2.0242, test_f1: 0.5776
 epoch: 88, train_loss: 0.3276, test_loss: 2.0488, test_f1: 0.5963
 epoch: 89, train_loss: 0.3157, test_loss: 2.0691, test_f1: 0.6037
 epoch: 90, train_loss: 0.2957, test_loss: 1.9622, test_f1: 0.6282
 epoch: 91, train_loss: 0.3368, test_loss: 2.1167, test_f1: 0.6097
 epoch: 92, train_loss: 0.3624, test_loss: 2.2448, test_f1: 0.5751
 epoch: 93, train_loss: 0.2941, test_loss: 2.3692, test_f1: 0.5820
 epoch: 94, train_loss: 0.2865, test_loss: 2.1317, test_f1: 0.6171
 epoch: 95, train_loss: 0.3101, test_loss: 2.2633, test_f1: 0.6061
 epoch: 96, train_loss: 0.2864, test_loss: 2.1773, test_f1: 0.6016
 epoch: 97, train_loss: 0.2812, test_loss: 2.2657, test_f1: 0.6124
 epoch: 98, train_loss: 0.3146, test_loss: 2.3368, test_f1: 0.6414
 epoch: 99, train_loss: 0.3058, test_loss: 2.4269, test_f1: 0.5975
##################ITERATION #9 ****************************************
 epoch: 0, train_loss: 1.4182, test_loss: 1.8109, test_f1: 0.3346
 epoch: 1, train_loss: 1.1010, test_loss: 1.4012, test_f1: 0.2691
 epoch: 2, train_loss: 0.9609, test_loss: 1.1148, test_f1: 0.4800
 epoch: 3, train_loss: 0.9560, test_loss: 1.0752, test_f1: 0.5392
 epoch: 4, train_loss: 0.9216, test_loss: 1.0886, test_f1: 0.4860
 epoch: 5, train_loss: 0.8944, test_loss: 1.0373, test_f1: 0.5121
 epoch: 6, train_loss: 0.8878, test_loss: 1.0566, test_f1: 0.5644
 epoch: 7, train_loss: 0.8871, test_loss: 1.1240, test_f1: 0.4455
 epoch: 8, train_loss: 0.8750, test_loss: 1.0651, test_f1: 0.5126
 epoch: 9, train_loss: 0.8564, test_loss: 1.0570, test_f1: 0.6143
 epoch: 10, train_loss: 0.8344, test_loss: 1.0502, test_f1: 0.5862
 epoch: 11, train_loss: 0.8057, test_loss: 1.1313, test_f1: 0.5485
 epoch: 12, train_loss: 0.7954, test_loss: 1.2696, test_f1: 0.5284
 epoch: 13, train_loss: 0.7808, test_loss: 1.1214, test_f1: 0.5631
 epoch: 14, train_loss: 0.7664, test_loss: 1.2639, test_f1: 0.4810
 epoch: 15, train_loss: 0.7587, test_loss: 1.2259, test_f1: 0.4878
 epoch: 16, train_loss: 0.7586, test_loss: 1.2676, test_f1: 0.4825
 epoch: 17, train_loss: 0.7653, test_loss: 1.1729, test_f1: 0.5522
 epoch: 18, train_loss: 0.7561, test_loss: 1.1686, test_f1: 0.4567
 epoch: 19, train_loss: 0.7168, test_loss: 1.2799, test_f1: 0.5288
 epoch: 20, train_loss: 0.7241, test_loss: 1.3154, test_f1: 0.4933
 epoch: 21, train_loss: 0.7523, test_loss: 1.3180, test_f1: 0.4925
 epoch: 22, train_loss: 0.6948, test_loss: 1.0975, test_f1: 0.5618
 epoch: 23, train_loss: 0.6822, test_loss: 1.3172, test_f1: 0.5312
 epoch: 24, train_loss: 0.6624, test_loss: 1.2861, test_f1: 0.5520
 epoch: 25, train_loss: 0.6552, test_loss: 1.3062, test_f1: 0.5955
 epoch: 26, train_loss: 0.6250, test_loss: 1.2872, test_f1: 0.5554
 epoch: 27, train_loss: 0.6570, test_loss: 1.2839, test_f1: 0.5839
 epoch: 28, train_loss: 0.6818, test_loss: 1.2065, test_f1: 0.5601
 epoch: 29, train_loss: 0.6216, test_loss: 1.2418, test_f1: 0.6037
 epoch: 30, train_loss: 0.6270, test_loss: 1.6210, test_f1: 0.4207
 epoch: 31, train_loss: 0.6366, test_loss: 1.8617, test_f1: 0.4006
 epoch: 32, train_loss: 0.6369, test_loss: 1.2991, test_f1: 0.5233
 epoch: 33, train_loss: 0.6011, test_loss: 1.3589, test_f1: 0.5004
 epoch: 34, train_loss: 0.5496, test_loss: 1.3546, test_f1: 0.6153
 epoch: 35, train_loss: 0.6327, test_loss: 1.3086, test_f1: 0.5789
 epoch: 36, train_loss: 0.6059, test_loss: 1.6725, test_f1: 0.5067
 epoch: 37, train_loss: 0.5887, test_loss: 1.3374, test_f1: 0.5871
 epoch: 38, train_loss: 0.5933, test_loss: 1.5522, test_f1: 0.5449
 epoch: 39, train_loss: 0.5844, test_loss: 1.7344, test_f1: 0.5365
 epoch: 40, train_loss: 0.5523, test_loss: 1.4577, test_f1: 0.5908
 epoch: 41, train_loss: 0.5441, test_loss: 1.6509, test_f1: 0.5216
 epoch: 42, train_loss: 0.5203, test_loss: 1.4727, test_f1: 0.5885
 epoch: 43, train_loss: 0.5066, test_loss: 1.4404, test_f1: 0.5653
 epoch: 44, train_loss: 0.5109, test_loss: 1.4267, test_f1: 0.6063
 epoch: 45, train_loss: 0.5609, test_loss: 1.3135, test_f1: 0.5604
 epoch: 46, train_loss: 0.5647, test_loss: 1.5492, test_f1: 0.5742
 epoch: 47, train_loss: 0.5212, test_loss: 1.7679, test_f1: 0.5035
 epoch: 48, train_loss: 0.5706, test_loss: 1.4773, test_f1: 0.5531
 epoch: 49, train_loss: 0.5589, test_loss: 1.6095, test_f1: 0.4597
 epoch: 50, train_loss: 0.5723, test_loss: 1.2384, test_f1: 0.5803
 epoch: 51, train_loss: 0.5310, test_loss: 1.5903, test_f1: 0.5651
 epoch: 52, train_loss: 0.5122, test_loss: 1.5114, test_f1: 0.5737
 epoch: 53, train_loss: 0.4516, test_loss: 1.4662, test_f1: 0.6113
 epoch: 54, train_loss: 0.4306, test_loss: 1.6880, test_f1: 0.6024
 epoch: 55, train_loss: 0.4201, test_loss: 1.5691, test_f1: 0.6194
 epoch: 56, train_loss: 0.4194, test_loss: 1.6053, test_f1: 0.5897
 epoch: 57, train_loss: 0.4101, test_loss: 1.6930, test_f1: 0.5894
 epoch: 58, train_loss: 0.3898, test_loss: 1.7388, test_f1: 0.6275
 epoch: 59, train_loss: 0.4235, test_loss: 1.6452, test_f1: 0.6088
 epoch: 60, train_loss: 0.4111, test_loss: 1.6510, test_f1: 0.6357
 epoch: 61, train_loss: 0.3937, test_loss: 1.7421, test_f1: 0.6225
 epoch: 62, train_loss: 0.4100, test_loss: 1.7371, test_f1: 0.6135
 epoch: 63, train_loss: 0.3926, test_loss: 1.7534, test_f1: 0.6222
 epoch: 64, train_loss: 0.3945, test_loss: 1.7315, test_f1: 0.6273
 epoch: 65, train_loss: 0.3712, test_loss: 1.6626, test_f1: 0.6266
 epoch: 66, train_loss: 0.3664, test_loss: 1.8562, test_f1: 0.6072
 epoch: 67, train_loss: 0.3960, test_loss: 1.7203, test_f1: 0.6216
 epoch: 68, train_loss: 0.3915, test_loss: 1.7351, test_f1: 0.6212
 epoch: 69, train_loss: 0.3791, test_loss: 1.8186, test_f1: 0.6010
 epoch: 70, train_loss: 0.3724, test_loss: 1.8875, test_f1: 0.6145
 epoch: 71, train_loss: 0.3669, test_loss: 1.9203, test_f1: 0.6215
 epoch: 72, train_loss: 0.3377, test_loss: 1.6484, test_f1: 0.5986
 epoch: 73, train_loss: 0.3849, test_loss: 1.6305, test_f1: 0.6118
 epoch: 74, train_loss: 0.3792, test_loss: 1.6632, test_f1: 0.6253
 epoch: 75, train_loss: 0.3389, test_loss: 1.7753, test_f1: 0.6376
 epoch: 76, train_loss: 0.3527, test_loss: 1.7334, test_f1: 0.6243
 epoch: 77, train_loss: 0.3835, test_loss: 2.0461, test_f1: 0.5929
 epoch: 78, train_loss: 0.3642, test_loss: 2.0013, test_f1: 0.5943
 epoch: 79, train_loss: 0.3409, test_loss: 1.8586, test_f1: 0.5664
 epoch: 80, train_loss: 0.3481, test_loss: 1.8130, test_f1: 0.6225
 epoch: 81, train_loss: 0.3072, test_loss: 1.8277, test_f1: 0.6378
 epoch: 82, train_loss: 0.3284, test_loss: 1.7841, test_f1: 0.6185
 epoch: 83, train_loss: 0.3287, test_loss: 1.9153, test_f1: 0.6207
 epoch: 84, train_loss: 0.3809, test_loss: 1.9137, test_f1: 0.6342
 epoch: 85, train_loss: 0.3279, test_loss: 1.8429, test_f1: 0.6245
 epoch: 86, train_loss: 0.3186, test_loss: 2.1636, test_f1: 0.5984
 epoch: 87, train_loss: 0.3045, test_loss: 1.9793, test_f1: 0.6036
 epoch: 88, train_loss: 0.2893, test_loss: 1.9939, test_f1: 0.6136
 epoch: 89, train_loss: 0.2851, test_loss: 2.1663, test_f1: 0.6136
 epoch: 90, train_loss: 0.2839, test_loss: 2.2914, test_f1: 0.6071
 epoch: 91, train_loss: 0.2876, test_loss: 2.1389, test_f1: 0.6058
 epoch: 92, train_loss: 0.3122, test_loss: 2.3542, test_f1: 0.5795
 epoch: 93, train_loss: 0.3123, test_loss: 1.9481, test_f1: 0.5976
 epoch: 94, train_loss: 0.3120, test_loss: 2.1866, test_f1: 0.6408
 epoch: 95, train_loss: 0.2840, test_loss: 2.1268, test_f1: 0.5962
 epoch: 96, train_loss: 0.3034, test_loss: 2.1328, test_f1: 0.6039
 epoch: 97, train_loss: 0.2939, test_loss: 2.1396, test_f1: 0.6084
 epoch: 98, train_loss: 0.2513, test_loss: 2.2054, test_f1: 0.6013
 epoch: 99, train_loss: 0.2904, test_loss: 2.0765, test_f1: 0.6117

Training completed in 425.27 seconds
Best F1: 0.6738 at epoch 92
Mean F1 across iterations: 0.6531  0.0098
========================FINAL RESULTS================================
FEGIN weighted F1: 0.6738  0.0098
python main.py --data ltspice_demos --representation component_net --model FEGIN --layers 3 --hiddens 64 --batch_size 128 --lr 0.01 --emb_size 250 --epochs 100 --save_appendix component_net_L3_H64_BS128_LR0.01_E250 --no_val
-----



STDERR:
  File "main.py", line 370, in <module>
    main()
  File "main.py", line 254, in main
    dataset = dataset_class(
  File "/home/philip/projects/ltspice_examples_code_repo/Circuit-Completion-Using-GNNs/component_classification_with_link_prediction_head/evaluation/FEGIN/kernel/circuit_datasets.py", line 15, in __init__
    self.data, self.slices = torch.load(self.processed_paths[0])
  File "/home/philip/.local/lib/python3.8/site-packages/torch/serialization.py", line 1040, in load
    warnings.warn(
  File "/usr/lib/python3.8/warnings.py", line 109, in _showwarnmsg
    sw(msg.message, msg.category, msg.filename, msg.lineno,
  File "main.py", line 47, in warn_with_traceback
    traceback.print_stack(file=log)
/home/philip/projects/ltspice_examples_code_repo/Circuit-Completion-Using-GNNs/component_classification_with_link_prediction_head/evaluation/FEGIN/kernel/circuit_datasets.py:15: FutureWarning: You are using `torch.load` with `weights_only=False` (the current default value), which uses the default pickle module implicitly. It is possible to construct malicious pickle data which will execute arbitrary code during unpickling (See https://github.com/pytorch/pytorch/blob/main/SECURITY.md#untrusted-models for more details). In a future release, the default value for `weights_only` will be flipped to `True`. This limits the functions that could be executed during unpickling. Arbitrary objects will no longer be allowed to be loaded via this mode unless they are explicitly allowlisted by the user via `torch.serialization.add_safe_globals`. We recommend you start setting `weights_only=True` for any use case where you don't have full control of the loaded file. Please open an issue on GitHub for any issues related to this experimental feature.
  self.data, self.slices = torch.load(self.processed_paths[0])
