STDOUT:
Results will be saved in /home/philip/projects/ltspice_examples_code_repo/Circuit-Completion-Using-GNNs/component_classification_with_link_prediction_head/evaluation/FEGIN/results/model_FEGIN_dataset_ltspice_demos
Command line input: python main.py --data ltspice_demos --representation component_pin --model FEGIN --layers 2 --hiddens 128 --batch_size 32 --lr 0.0001 --emb_size 250 --epochs 100 --save_appendix component_pin_L2_H128_BS32_LR0.0001_E250 --no_val
 is saved.
-----
ltspice_demos - FEGIN
Using 2 layers, 128 hidden units, h = 2
Loading component_pin representation dataset
ENTERED
Training FEGIN on component_pin representation
Train: 1565, Test: 383
##################ITERATION #0 ****************************************
 epoch: 0, train_loss: 1.3518, test_loss: 1.3472, test_f1: 0.3381
 epoch: 1, train_loss: 1.3004, test_loss: 1.3038, test_f1: 0.2850
 epoch: 2, train_loss: 1.2428, test_loss: 1.2569, test_f1: 0.2872
 epoch: 3, train_loss: 1.1858, test_loss: 1.2238, test_f1: 0.4206
 epoch: 4, train_loss: 1.1399, test_loss: 1.1912, test_f1: 0.4522
 epoch: 5, train_loss: 1.1033, test_loss: 1.1475, test_f1: 0.4535
 epoch: 6, train_loss: 1.0567, test_loss: 1.1178, test_f1: 0.4518
 epoch: 7, train_loss: 1.0257, test_loss: 1.0892, test_f1: 0.4567
 epoch: 8, train_loss: 1.0036, test_loss: 1.0670, test_f1: 0.4536
 epoch: 9, train_loss: 0.9811, test_loss: 1.0527, test_f1: 0.4489
 epoch: 10, train_loss: 0.9652, test_loss: 1.0425, test_f1: 0.4611
 epoch: 11, train_loss: 0.9479, test_loss: 1.0142, test_f1: 0.4555
 epoch: 12, train_loss: 0.9272, test_loss: 1.0206, test_f1: 0.4864
 epoch: 13, train_loss: 0.9065, test_loss: 0.9980, test_f1: 0.5247
 epoch: 14, train_loss: 0.8895, test_loss: 0.9903, test_f1: 0.5426
 epoch: 15, train_loss: 0.8754, test_loss: 0.9761, test_f1: 0.5706
 epoch: 16, train_loss: 0.8573, test_loss: 0.9595, test_f1: 0.5823
 epoch: 17, train_loss: 0.8435, test_loss: 0.9651, test_f1: 0.5986
 epoch: 18, train_loss: 0.8256, test_loss: 0.9705, test_f1: 0.5995
 epoch: 19, train_loss: 0.7982, test_loss: 0.9598, test_f1: 0.6052
 epoch: 20, train_loss: 0.7909, test_loss: 0.9633, test_f1: 0.6146
 epoch: 21, train_loss: 0.7733, test_loss: 0.9423, test_f1: 0.6200
 epoch: 22, train_loss: 0.7594, test_loss: 0.9412, test_f1: 0.6115
 epoch: 23, train_loss: 0.7502, test_loss: 0.9581, test_f1: 0.6122
 epoch: 24, train_loss: 0.7320, test_loss: 0.9503, test_f1: 0.6338
 epoch: 25, train_loss: 0.7117, test_loss: 0.9590, test_f1: 0.6025
 epoch: 26, train_loss: 0.7119, test_loss: 0.9555, test_f1: 0.6020
 epoch: 27, train_loss: 0.6977, test_loss: 0.9600, test_f1: 0.6300
 epoch: 28, train_loss: 0.6840, test_loss: 0.9878, test_f1: 0.5914
 epoch: 29, train_loss: 0.6882, test_loss: 0.9735, test_f1: 0.5988
 epoch: 30, train_loss: 0.6718, test_loss: 0.9785, test_f1: 0.6131
 epoch: 31, train_loss: 0.6628, test_loss: 1.0149, test_f1: 0.5960
 epoch: 32, train_loss: 0.6605, test_loss: 1.0095, test_f1: 0.5892
 epoch: 33, train_loss: 0.6544, test_loss: 0.9911, test_f1: 0.6096
 epoch: 34, train_loss: 0.6397, test_loss: 1.0049, test_f1: 0.5905
 epoch: 35, train_loss: 0.6239, test_loss: 1.0247, test_f1: 0.5981
 epoch: 36, train_loss: 0.6341, test_loss: 1.0289, test_f1: 0.5810
 epoch: 37, train_loss: 0.6247, test_loss: 0.9673, test_f1: 0.6176
 epoch: 38, train_loss: 0.6341, test_loss: 1.0224, test_f1: 0.5937
 epoch: 39, train_loss: 0.6095, test_loss: 1.0279, test_f1: 0.6001
 epoch: 40, train_loss: 0.5967, test_loss: 1.0438, test_f1: 0.5895
 epoch: 41, train_loss: 0.6037, test_loss: 1.0293, test_f1: 0.5645
 epoch: 42, train_loss: 0.5818, test_loss: 1.0597, test_f1: 0.5873
 epoch: 43, train_loss: 0.5675, test_loss: 1.0310, test_f1: 0.5675
 epoch: 44, train_loss: 0.5751, test_loss: 1.0654, test_f1: 0.5931
 epoch: 45, train_loss: 0.5786, test_loss: 1.0317, test_f1: 0.5884
 epoch: 46, train_loss: 0.5590, test_loss: 1.0254, test_f1: 0.5943
 epoch: 47, train_loss: 0.5785, test_loss: 1.0234, test_f1: 0.6316
 epoch: 48, train_loss: 0.5529, test_loss: 1.0235, test_f1: 0.6039
 epoch: 49, train_loss: 0.5399, test_loss: 1.0489, test_f1: 0.6016
 epoch: 50, train_loss: 0.5507, test_loss: 1.2008, test_f1: 0.5458
 epoch: 51, train_loss: 0.5097, test_loss: 1.0489, test_f1: 0.6111
 epoch: 52, train_loss: 0.5135, test_loss: 1.1318, test_f1: 0.5718
 epoch: 53, train_loss: 0.5087, test_loss: 1.1040, test_f1: 0.5934
 epoch: 54, train_loss: 0.4953, test_loss: 1.0438, test_f1: 0.6086
 epoch: 55, train_loss: 0.5062, test_loss: 1.0990, test_f1: 0.6121
 epoch: 56, train_loss: 0.5089, test_loss: 1.0493, test_f1: 0.6165
 epoch: 57, train_loss: 0.4906, test_loss: 1.1042, test_f1: 0.5860
 epoch: 58, train_loss: 0.4859, test_loss: 1.0993, test_f1: 0.6129
 epoch: 59, train_loss: 0.4970, test_loss: 1.1042, test_f1: 0.5848
 epoch: 60, train_loss: 0.4792, test_loss: 1.1617, test_f1: 0.5852
 epoch: 61, train_loss: 0.4645, test_loss: 1.1857, test_f1: 0.6128
 epoch: 62, train_loss: 0.4737, test_loss: 1.1883, test_f1: 0.5932
 epoch: 63, train_loss: 0.4680, test_loss: 1.2031, test_f1: 0.5798
 epoch: 64, train_loss: 0.4714, test_loss: 1.1775, test_f1: 0.5808
 epoch: 65, train_loss: 0.4738, test_loss: 1.1342, test_f1: 0.6099
 epoch: 66, train_loss: 0.4465, test_loss: 1.1974, test_f1: 0.6012
 epoch: 67, train_loss: 0.4648, test_loss: 1.1534, test_f1: 0.6148
 epoch: 68, train_loss: 0.4494, test_loss: 1.1807, test_f1: 0.6034
 epoch: 69, train_loss: 0.4471, test_loss: 1.2259, test_f1: 0.6188
 epoch: 70, train_loss: 0.4490, test_loss: 1.2104, test_f1: 0.6247
 epoch: 71, train_loss: 0.4441, test_loss: 1.2763, test_f1: 0.5983
 epoch: 72, train_loss: 0.4428, test_loss: 1.1229, test_f1: 0.6368
 epoch: 73, train_loss: 0.4354, test_loss: 1.2000, test_f1: 0.6303
 epoch: 74, train_loss: 0.4376, test_loss: 1.3322, test_f1: 0.5593
 epoch: 75, train_loss: 0.4301, test_loss: 1.3067, test_f1: 0.5680
 epoch: 76, train_loss: 0.4160, test_loss: 1.2858, test_f1: 0.6093
 epoch: 77, train_loss: 0.4284, test_loss: 1.3368, test_f1: 0.5884
 epoch: 78, train_loss: 0.4258, test_loss: 1.2989, test_f1: 0.5709
 epoch: 79, train_loss: 0.4112, test_loss: 1.2426, test_f1: 0.6148
 epoch: 80, train_loss: 0.4171, test_loss: 1.2952, test_f1: 0.6042
 epoch: 81, train_loss: 0.4181, test_loss: 1.3544, test_f1: 0.5917
 epoch: 82, train_loss: 0.4034, test_loss: 1.2806, test_f1: 0.5983
 epoch: 83, train_loss: 0.4122, test_loss: 1.4177, test_f1: 0.5628
 epoch: 84, train_loss: 0.4073, test_loss: 1.3309, test_f1: 0.6056
 epoch: 85, train_loss: 0.4163, test_loss: 1.3480, test_f1: 0.5974
 epoch: 86, train_loss: 0.4000, test_loss: 1.3323, test_f1: 0.5928
 epoch: 87, train_loss: 0.3822, test_loss: 1.4087, test_f1: 0.5771
 epoch: 88, train_loss: 0.4104, test_loss: 1.3126, test_f1: 0.5926
 epoch: 89, train_loss: 0.4107, test_loss: 1.3299, test_f1: 0.6091
 epoch: 90, train_loss: 0.4013, test_loss: 1.2829, test_f1: 0.6116
 epoch: 91, train_loss: 0.3826, test_loss: 1.3757, test_f1: 0.5741
 epoch: 92, train_loss: 0.3743, test_loss: 1.3135, test_f1: 0.6007
 epoch: 93, train_loss: 0.3694, test_loss: 1.3551, test_f1: 0.6006
 epoch: 94, train_loss: 0.3695, test_loss: 1.4025, test_f1: 0.6003
 epoch: 95, train_loss: 0.3689, test_loss: 1.3288, test_f1: 0.6383
 epoch: 96, train_loss: 0.3839, test_loss: 1.4359, test_f1: 0.5829
 epoch: 97, train_loss: 0.3728, test_loss: 1.4493, test_f1: 0.6170
 epoch: 98, train_loss: 0.3617, test_loss: 1.3181, test_f1: 0.5958
 epoch: 99, train_loss: 0.3694, test_loss: 1.4313, test_f1: 0.6054
##################ITERATION #1 ****************************************
 epoch: 0, train_loss: 1.2553, test_loss: 1.2931, test_f1: 0.2576
 epoch: 1, train_loss: 1.1774, test_loss: 1.2265, test_f1: 0.4225
 epoch: 2, train_loss: 1.1307, test_loss: 1.1834, test_f1: 0.4329
 epoch: 3, train_loss: 1.0706, test_loss: 1.1368, test_f1: 0.4281
 epoch: 4, train_loss: 1.0274, test_loss: 1.0960, test_f1: 0.5067
 epoch: 5, train_loss: 0.9865, test_loss: 1.0533, test_f1: 0.5285
 epoch: 6, train_loss: 0.9527, test_loss: 1.0340, test_f1: 0.5467
 epoch: 7, train_loss: 0.9196, test_loss: 1.0148, test_f1: 0.5446
 epoch: 8, train_loss: 0.9078, test_loss: 1.0076, test_f1: 0.5872
 epoch: 9, train_loss: 0.8764, test_loss: 0.9977, test_f1: 0.5881
 epoch: 10, train_loss: 0.8588, test_loss: 0.9895, test_f1: 0.5936
 epoch: 11, train_loss: 0.8416, test_loss: 0.9782, test_f1: 0.6086
 epoch: 12, train_loss: 0.8299, test_loss: 0.9844, test_f1: 0.5794
 epoch: 13, train_loss: 0.7975, test_loss: 0.9739, test_f1: 0.5825
 epoch: 14, train_loss: 0.7815, test_loss: 0.9836, test_f1: 0.5950
 epoch: 15, train_loss: 0.7759, test_loss: 0.9668, test_f1: 0.5841
 epoch: 16, train_loss: 0.7519, test_loss: 0.9764, test_f1: 0.5861
 epoch: 17, train_loss: 0.7389, test_loss: 1.0185, test_f1: 0.5864
 epoch: 18, train_loss: 0.7399, test_loss: 1.0034, test_f1: 0.5861
 epoch: 19, train_loss: 0.7205, test_loss: 1.0099, test_f1: 0.5759
 epoch: 20, train_loss: 0.7086, test_loss: 1.0102, test_f1: 0.5952
 epoch: 21, train_loss: 0.7067, test_loss: 0.9712, test_f1: 0.5932
 epoch: 22, train_loss: 0.6720, test_loss: 1.0032, test_f1: 0.5935
 epoch: 23, train_loss: 0.6750, test_loss: 1.0294, test_f1: 0.6178
 epoch: 24, train_loss: 0.6617, test_loss: 1.0697, test_f1: 0.5902
 epoch: 25, train_loss: 0.6608, test_loss: 1.0524, test_f1: 0.5860
 epoch: 26, train_loss: 0.6357, test_loss: 1.0165, test_f1: 0.5986
 epoch: 27, train_loss: 0.6447, test_loss: 1.0359, test_f1: 0.5696
 epoch: 28, train_loss: 0.6308, test_loss: 1.0107, test_f1: 0.6121
 epoch: 29, train_loss: 0.6117, test_loss: 1.0754, test_f1: 0.6307
 epoch: 30, train_loss: 0.6037, test_loss: 0.9991, test_f1: 0.6080
 epoch: 31, train_loss: 0.5923, test_loss: 1.0823, test_f1: 0.6235
 epoch: 32, train_loss: 0.5896, test_loss: 1.0585, test_f1: 0.5791
 epoch: 33, train_loss: 0.5868, test_loss: 1.0306, test_f1: 0.5826
 epoch: 34, train_loss: 0.5748, test_loss: 1.0456, test_f1: 0.6080
 epoch: 35, train_loss: 0.5870, test_loss: 1.1026, test_f1: 0.6077
 epoch: 36, train_loss: 0.5686, test_loss: 1.0492, test_f1: 0.6106
 epoch: 37, train_loss: 0.5624, test_loss: 1.1625, test_f1: 0.5880
 epoch: 38, train_loss: 0.5360, test_loss: 1.0911, test_f1: 0.5977
 epoch: 39, train_loss: 0.5432, test_loss: 1.0930, test_f1: 0.5883
 epoch: 40, train_loss: 0.5348, test_loss: 1.1415, test_f1: 0.5986
 epoch: 41, train_loss: 0.5218, test_loss: 1.2381, test_f1: 0.5868
 epoch: 42, train_loss: 0.5044, test_loss: 1.1388, test_f1: 0.5805
 epoch: 43, train_loss: 0.4950, test_loss: 1.1787, test_f1: 0.5902
 epoch: 44, train_loss: 0.5128, test_loss: 1.1864, test_f1: 0.6074
 epoch: 45, train_loss: 0.4974, test_loss: 1.2056, test_f1: 0.5961
 epoch: 46, train_loss: 0.4961, test_loss: 1.2850, test_f1: 0.5826
 epoch: 47, train_loss: 0.4711, test_loss: 1.2563, test_f1: 0.5921
 epoch: 48, train_loss: 0.4724, test_loss: 1.3368, test_f1: 0.5995
 epoch: 49, train_loss: 0.4722, test_loss: 1.2617, test_f1: 0.6180
 epoch: 50, train_loss: 0.4605, test_loss: 1.3758, test_f1: 0.5931
 epoch: 51, train_loss: 0.4426, test_loss: 1.3022, test_f1: 0.6198
 epoch: 52, train_loss: 0.4456, test_loss: 1.3392, test_f1: 0.6161
 epoch: 53, train_loss: 0.4293, test_loss: 1.3298, test_f1: 0.6153
 epoch: 54, train_loss: 0.4338, test_loss: 1.3139, test_f1: 0.6136
 epoch: 55, train_loss: 0.4427, test_loss: 1.3120, test_f1: 0.6012
 epoch: 56, train_loss: 0.4192, test_loss: 1.3727, test_f1: 0.6140
 epoch: 57, train_loss: 0.4374, test_loss: 1.3904, test_f1: 0.6095
 epoch: 58, train_loss: 0.4161, test_loss: 1.3782, test_f1: 0.5883
 epoch: 59, train_loss: 0.3955, test_loss: 1.3590, test_f1: 0.6024
 epoch: 60, train_loss: 0.4113, test_loss: 1.3278, test_f1: 0.6260
 epoch: 61, train_loss: 0.4003, test_loss: 1.3403, test_f1: 0.6247
 epoch: 62, train_loss: 0.3875, test_loss: 1.4030, test_f1: 0.6065
 epoch: 63, train_loss: 0.3855, test_loss: 1.3763, test_f1: 0.5976
 epoch: 64, train_loss: 0.3940, test_loss: 1.4275, test_f1: 0.5980
 epoch: 65, train_loss: 0.3934, test_loss: 1.4793, test_f1: 0.6191
 epoch: 66, train_loss: 0.3772, test_loss: 1.4986, test_f1: 0.6087
 epoch: 67, train_loss: 0.3769, test_loss: 1.4527, test_f1: 0.6040
 epoch: 68, train_loss: 0.3746, test_loss: 1.4352, test_f1: 0.6050
 epoch: 69, train_loss: 0.3792, test_loss: 1.4268, test_f1: 0.6217
 epoch: 70, train_loss: 0.3807, test_loss: 1.4971, test_f1: 0.6084
 epoch: 71, train_loss: 0.3744, test_loss: 1.4926, test_f1: 0.6034
 epoch: 72, train_loss: 0.3687, test_loss: 1.5845, test_f1: 0.5855
 epoch: 73, train_loss: 0.3630, test_loss: 1.5516, test_f1: 0.5827
 epoch: 74, train_loss: 0.3616, test_loss: 1.5667, test_f1: 0.6150
 epoch: 75, train_loss: 0.3573, test_loss: 1.5835, test_f1: 0.5981
 epoch: 76, train_loss: 0.3459, test_loss: 1.5864, test_f1: 0.6095
 epoch: 77, train_loss: 0.3465, test_loss: 1.5931, test_f1: 0.5755
 epoch: 78, train_loss: 0.3369, test_loss: 1.6436, test_f1: 0.5948
 epoch: 79, train_loss: 0.3416, test_loss: 1.5900, test_f1: 0.5954
 epoch: 80, train_loss: 0.3276, test_loss: 1.6498, test_f1: 0.5950
 epoch: 81, train_loss: 0.3346, test_loss: 1.6360, test_f1: 0.5987
 epoch: 82, train_loss: 0.3408, test_loss: 1.7239, test_f1: 0.5751
 epoch: 83, train_loss: 0.3460, test_loss: 1.6966, test_f1: 0.5828
 epoch: 84, train_loss: 0.3237, test_loss: 1.7034, test_f1: 0.6006
 epoch: 85, train_loss: 0.3248, test_loss: 1.6833, test_f1: 0.5874
 epoch: 86, train_loss: 0.3319, test_loss: 1.7128, test_f1: 0.5759
 epoch: 87, train_loss: 0.3147, test_loss: 1.7373, test_f1: 0.5935
 epoch: 88, train_loss: 0.3299, test_loss: 1.6144, test_f1: 0.6044
 epoch: 89, train_loss: 0.3239, test_loss: 1.6887, test_f1: 0.5945
 epoch: 90, train_loss: 0.3115, test_loss: 1.6929, test_f1: 0.5928
 epoch: 91, train_loss: 0.3039, test_loss: 1.7216, test_f1: 0.5774
 epoch: 92, train_loss: 0.3065, test_loss: 1.7834, test_f1: 0.5832
 epoch: 93, train_loss: 0.2984, test_loss: 1.7835, test_f1: 0.5959
 epoch: 94, train_loss: 0.2970, test_loss: 1.9589, test_f1: 0.5932
 epoch: 95, train_loss: 0.2898, test_loss: 1.8469, test_f1: 0.5693
 epoch: 96, train_loss: 0.2952, test_loss: 1.7498, test_f1: 0.5995
 epoch: 97, train_loss: 0.3048, test_loss: 1.7432, test_f1: 0.5880
 epoch: 98, train_loss: 0.3077, test_loss: 1.7078, test_f1: 0.6107
 epoch: 99, train_loss: 0.3005, test_loss: 1.8250, test_f1: 0.5943
##################ITERATION #2 ****************************************
 epoch: 0, train_loss: 1.2193, test_loss: 1.2584, test_f1: 0.3555
 epoch: 1, train_loss: 1.1234, test_loss: 1.1672, test_f1: 0.4461
 epoch: 2, train_loss: 1.0776, test_loss: 1.1307, test_f1: 0.4358
 epoch: 3, train_loss: 1.0356, test_loss: 1.0944, test_f1: 0.5126
 epoch: 4, train_loss: 0.9968, test_loss: 1.0558, test_f1: 0.5054
 epoch: 5, train_loss: 0.9641, test_loss: 1.0207, test_f1: 0.5497
 epoch: 6, train_loss: 0.9282, test_loss: 0.9895, test_f1: 0.5564
 epoch: 7, train_loss: 0.9146, test_loss: 0.9701, test_f1: 0.5817
 epoch: 8, train_loss: 0.8856, test_loss: 0.9664, test_f1: 0.5957
 epoch: 9, train_loss: 0.8662, test_loss: 0.9523, test_f1: 0.5822
 epoch: 10, train_loss: 0.8436, test_loss: 0.9442, test_f1: 0.6099
 epoch: 11, train_loss: 0.8249, test_loss: 0.9448, test_f1: 0.6123
 epoch: 12, train_loss: 0.8062, test_loss: 0.9411, test_f1: 0.6174
 epoch: 13, train_loss: 0.7976, test_loss: 0.9460, test_f1: 0.6249
 epoch: 14, train_loss: 0.7773, test_loss: 0.9348, test_f1: 0.6357
 epoch: 15, train_loss: 0.7451, test_loss: 0.9415, test_f1: 0.6080
 epoch: 16, train_loss: 0.7490, test_loss: 0.9425, test_f1: 0.6575
 epoch: 17, train_loss: 0.7269, test_loss: 0.9676, test_f1: 0.5938
 epoch: 18, train_loss: 0.7142, test_loss: 0.9854, test_f1: 0.6167
 epoch: 19, train_loss: 0.7027, test_loss: 0.9880, test_f1: 0.5878
 epoch: 20, train_loss: 0.6911, test_loss: 1.0017, test_f1: 0.6383
 epoch: 21, train_loss: 0.6984, test_loss: 0.9872, test_f1: 0.6008
 epoch: 22, train_loss: 0.6758, test_loss: 1.0480, test_f1: 0.6236
 epoch: 23, train_loss: 0.6654, test_loss: 0.9966, test_f1: 0.6279
 epoch: 24, train_loss: 0.6562, test_loss: 1.0202, test_f1: 0.6560
 epoch: 25, train_loss: 0.6473, test_loss: 1.0397, test_f1: 0.6314
 epoch: 26, train_loss: 0.6461, test_loss: 1.0307, test_f1: 0.6191
 epoch: 27, train_loss: 0.6195, test_loss: 1.1010, test_f1: 0.6407
 epoch: 28, train_loss: 0.6231, test_loss: 1.0535, test_f1: 0.6472
 epoch: 29, train_loss: 0.6201, test_loss: 1.0804, test_f1: 0.6193
 epoch: 30, train_loss: 0.6009, test_loss: 1.0620, test_f1: 0.6254
 epoch: 31, train_loss: 0.5902, test_loss: 1.0793, test_f1: 0.6378
 epoch: 32, train_loss: 0.5867, test_loss: 1.0985, test_f1: 0.6062
 epoch: 33, train_loss: 0.5659, test_loss: 1.1016, test_f1: 0.6298
 epoch: 34, train_loss: 0.5678, test_loss: 1.1336, test_f1: 0.6201
 epoch: 35, train_loss: 0.5619, test_loss: 1.2061, test_f1: 0.6138
 epoch: 36, train_loss: 0.5500, test_loss: 1.1098, test_f1: 0.6430
 epoch: 37, train_loss: 0.5497, test_loss: 1.1738, test_f1: 0.6070
 epoch: 38, train_loss: 0.5356, test_loss: 1.2459, test_f1: 0.5977
 epoch: 39, train_loss: 0.5222, test_loss: 1.2130, test_f1: 0.6160
 epoch: 40, train_loss: 0.5383, test_loss: 1.2177, test_f1: 0.6113
 epoch: 41, train_loss: 0.5089, test_loss: 1.2714, test_f1: 0.6163
 epoch: 42, train_loss: 0.5138, test_loss: 1.1686, test_f1: 0.6078
 epoch: 43, train_loss: 0.4984, test_loss: 1.2702, test_f1: 0.6199
 epoch: 44, train_loss: 0.5051, test_loss: 1.2973, test_f1: 0.6137
 epoch: 45, train_loss: 0.5015, test_loss: 1.3334, test_f1: 0.6272
 epoch: 46, train_loss: 0.4949, test_loss: 1.1994, test_f1: 0.6445
 epoch: 47, train_loss: 0.4689, test_loss: 1.2801, test_f1: 0.6082
 epoch: 48, train_loss: 0.4704, test_loss: 1.2507, test_f1: 0.6275
 epoch: 49, train_loss: 0.4773, test_loss: 1.2453, test_f1: 0.6127
 epoch: 50, train_loss: 0.4659, test_loss: 1.2115, test_f1: 0.6252
 epoch: 51, train_loss: 0.4569, test_loss: 1.2216, test_f1: 0.6183
 epoch: 52, train_loss: 0.4225, test_loss: 1.3147, test_f1: 0.6262
 epoch: 53, train_loss: 0.4227, test_loss: 1.2920, test_f1: 0.6302
 epoch: 54, train_loss: 0.4315, test_loss: 1.3187, test_f1: 0.6254
 epoch: 55, train_loss: 0.4213, test_loss: 1.3961, test_f1: 0.6271
 epoch: 56, train_loss: 0.4268, test_loss: 1.2795, test_f1: 0.6250
 epoch: 57, train_loss: 0.4011, test_loss: 1.2672, test_f1: 0.6162
 epoch: 58, train_loss: 0.3969, test_loss: 1.3020, test_f1: 0.6240
 epoch: 59, train_loss: 0.4099, test_loss: 1.4410, test_f1: 0.6328
 epoch: 60, train_loss: 0.3948, test_loss: 1.3374, test_f1: 0.6300
 epoch: 61, train_loss: 0.3974, test_loss: 1.3962, test_f1: 0.6344
 epoch: 62, train_loss: 0.3914, test_loss: 1.3768, test_f1: 0.6369
 epoch: 63, train_loss: 0.3889, test_loss: 1.3846, test_f1: 0.6292
 epoch: 64, train_loss: 0.4032, test_loss: 1.3562, test_f1: 0.6469
 epoch: 65, train_loss: 0.3772, test_loss: 1.3987, test_f1: 0.6335
 epoch: 66, train_loss: 0.3661, test_loss: 1.3428, test_f1: 0.6362
 epoch: 67, train_loss: 0.3789, test_loss: 1.4297, test_f1: 0.6442
 epoch: 68, train_loss: 0.3795, test_loss: 1.4949, test_f1: 0.6121
 epoch: 69, train_loss: 0.3777, test_loss: 1.3917, test_f1: 0.6178
 epoch: 70, train_loss: 0.3738, test_loss: 1.4023, test_f1: 0.6214
 epoch: 71, train_loss: 0.3700, test_loss: 1.4328, test_f1: 0.6494
 epoch: 72, train_loss: 0.3468, test_loss: 1.5302, test_f1: 0.6280
 epoch: 73, train_loss: 0.3618, test_loss: 1.5033, test_f1: 0.6318
 epoch: 74, train_loss: 0.3453, test_loss: 1.4076, test_f1: 0.6474
 epoch: 75, train_loss: 0.3501, test_loss: 1.4863, test_f1: 0.6318
 epoch: 76, train_loss: 0.3396, test_loss: 1.4102, test_f1: 0.6356
 epoch: 77, train_loss: 0.3337, test_loss: 1.5026, test_f1: 0.6387
 epoch: 78, train_loss: 0.3466, test_loss: 1.5102, test_f1: 0.6263
 epoch: 79, train_loss: 0.3528, test_loss: 1.4901, test_f1: 0.6153
 epoch: 80, train_loss: 0.3467, test_loss: 1.5407, test_f1: 0.6380
 epoch: 81, train_loss: 0.3246, test_loss: 1.5924, test_f1: 0.6477
 epoch: 82, train_loss: 0.3392, test_loss: 1.5849, test_f1: 0.6523
 epoch: 83, train_loss: 0.3320, test_loss: 1.5974, test_f1: 0.6336
 epoch: 84, train_loss: 0.3325, test_loss: 1.5001, test_f1: 0.6408
 epoch: 85, train_loss: 0.3280, test_loss: 1.5060, test_f1: 0.6497
 epoch: 86, train_loss: 0.3217, test_loss: 1.6435, test_f1: 0.6312
 epoch: 87, train_loss: 0.3222, test_loss: 1.5770, test_f1: 0.6444
 epoch: 88, train_loss: 0.3127, test_loss: 1.5716, test_f1: 0.6446
 epoch: 89, train_loss: 0.2816, test_loss: 1.5856, test_f1: 0.6351
 epoch: 90, train_loss: 0.2937, test_loss: 1.6251, test_f1: 0.6346
 epoch: 91, train_loss: 0.3023, test_loss: 1.5576, test_f1: 0.6442
 epoch: 92, train_loss: 0.3330, test_loss: 1.6516, test_f1: 0.6447
 epoch: 93, train_loss: 0.2964, test_loss: 1.6062, test_f1: 0.6504
 epoch: 94, train_loss: 0.2800, test_loss: 1.6085, test_f1: 0.6461
 epoch: 95, train_loss: 0.2847, test_loss: 1.7581, test_f1: 0.6268
 epoch: 96, train_loss: 0.3029, test_loss: 1.6742, test_f1: 0.6296
 epoch: 97, train_loss: 0.2967, test_loss: 1.7182, test_f1: 0.6324
 epoch: 98, train_loss: 0.2772, test_loss: 1.6795, test_f1: 0.6302
 epoch: 99, train_loss: 0.2977, test_loss: 1.6989, test_f1: 0.6026
##################ITERATION #3 ****************************************
 epoch: 0, train_loss: 1.2061, test_loss: 1.2382, test_f1: 0.3212
 epoch: 1, train_loss: 1.0926, test_loss: 1.1178, test_f1: 0.4983
 epoch: 2, train_loss: 1.0358, test_loss: 1.0820, test_f1: 0.5229
 epoch: 3, train_loss: 0.9907, test_loss: 1.0415, test_f1: 0.5314
 epoch: 4, train_loss: 0.9473, test_loss: 1.0151, test_f1: 0.5589
 epoch: 5, train_loss: 0.9048, test_loss: 0.9978, test_f1: 0.5904
 epoch: 6, train_loss: 0.8744, test_loss: 0.9862, test_f1: 0.5964
 epoch: 7, train_loss: 0.8439, test_loss: 1.0028, test_f1: 0.5545
 epoch: 8, train_loss: 0.8304, test_loss: 0.9365, test_f1: 0.6047
 epoch: 9, train_loss: 0.7973, test_loss: 0.9720, test_f1: 0.5806
 epoch: 10, train_loss: 0.7783, test_loss: 0.9786, test_f1: 0.5706
 epoch: 11, train_loss: 0.7747, test_loss: 0.9933, test_f1: 0.5751
 epoch: 12, train_loss: 0.7465, test_loss: 0.9923, test_f1: 0.5784
 epoch: 13, train_loss: 0.7449, test_loss: 0.9552, test_f1: 0.5982
 epoch: 14, train_loss: 0.7220, test_loss: 0.9961, test_f1: 0.5865
 epoch: 15, train_loss: 0.7067, test_loss: 0.9944, test_f1: 0.5978
 epoch: 16, train_loss: 0.7276, test_loss: 0.9795, test_f1: 0.5595
 epoch: 17, train_loss: 0.6871, test_loss: 0.9948, test_f1: 0.5814
 epoch: 18, train_loss: 0.6735, test_loss: 1.0106, test_f1: 0.5609
 epoch: 19, train_loss: 0.6768, test_loss: 1.1206, test_f1: 0.5692
 epoch: 20, train_loss: 0.6721, test_loss: 0.9602, test_f1: 0.5972
 epoch: 21, train_loss: 0.6765, test_loss: 0.9510, test_f1: 0.6083
 epoch: 22, train_loss: 0.6518, test_loss: 1.0599, test_f1: 0.5578
 epoch: 23, train_loss: 0.6556, test_loss: 1.0030, test_f1: 0.5714
 epoch: 24, train_loss: 0.6407, test_loss: 0.9834, test_f1: 0.6156
 epoch: 25, train_loss: 0.6191, test_loss: 0.9703, test_f1: 0.5843
 epoch: 26, train_loss: 0.6242, test_loss: 0.9515, test_f1: 0.6198
 epoch: 27, train_loss: 0.6125, test_loss: 1.0243, test_f1: 0.6047
 epoch: 28, train_loss: 0.5855, test_loss: 1.0275, test_f1: 0.5755
 epoch: 29, train_loss: 0.5896, test_loss: 1.0155, test_f1: 0.6091
 epoch: 30, train_loss: 0.5838, test_loss: 1.0898, test_f1: 0.5671
 epoch: 31, train_loss: 0.5872, test_loss: 1.0672, test_f1: 0.5802
 epoch: 32, train_loss: 0.5575, test_loss: 1.0691, test_f1: 0.5846
 epoch: 33, train_loss: 0.5646, test_loss: 1.0007, test_f1: 0.5919
 epoch: 34, train_loss: 0.5566, test_loss: 1.0412, test_f1: 0.6169
 epoch: 35, train_loss: 0.5531, test_loss: 1.0582, test_f1: 0.5931
 epoch: 36, train_loss: 0.5641, test_loss: 1.1287, test_f1: 0.5866
 epoch: 37, train_loss: 0.5429, test_loss: 1.0572, test_f1: 0.6149
 epoch: 38, train_loss: 0.5368, test_loss: 1.1052, test_f1: 0.5749
 epoch: 39, train_loss: 0.5424, test_loss: 1.0971, test_f1: 0.6147
 epoch: 40, train_loss: 0.5141, test_loss: 1.1349, test_f1: 0.6130
 epoch: 41, train_loss: 0.5176, test_loss: 1.1425, test_f1: 0.5650
 epoch: 42, train_loss: 0.5019, test_loss: 1.1231, test_f1: 0.6216
 epoch: 43, train_loss: 0.5134, test_loss: 1.1622, test_f1: 0.5880
 epoch: 44, train_loss: 0.5089, test_loss: 1.1482, test_f1: 0.5598
 epoch: 45, train_loss: 0.4763, test_loss: 1.2022, test_f1: 0.5914
 epoch: 46, train_loss: 0.4695, test_loss: 1.2316, test_f1: 0.5680
 epoch: 47, train_loss: 0.4778, test_loss: 1.1969, test_f1: 0.5826
 epoch: 48, train_loss: 0.4762, test_loss: 1.2143, test_f1: 0.5971
 epoch: 49, train_loss: 0.4709, test_loss: 1.1526, test_f1: 0.5911
 epoch: 50, train_loss: 0.4681, test_loss: 1.4600, test_f1: 0.5608
 epoch: 51, train_loss: 0.4536, test_loss: 1.2651, test_f1: 0.6006
 epoch: 52, train_loss: 0.4541, test_loss: 1.2820, test_f1: 0.6221
 epoch: 53, train_loss: 0.4461, test_loss: 1.2023, test_f1: 0.6039
 epoch: 54, train_loss: 0.4288, test_loss: 1.2436, test_f1: 0.6226
 epoch: 55, train_loss: 0.4241, test_loss: 1.1834, test_f1: 0.6134
 epoch: 56, train_loss: 0.4123, test_loss: 1.2614, test_f1: 0.5863
 epoch: 57, train_loss: 0.4157, test_loss: 1.3042, test_f1: 0.6245
 epoch: 58, train_loss: 0.4164, test_loss: 1.2903, test_f1: 0.6048
 epoch: 59, train_loss: 0.4121, test_loss: 1.2939, test_f1: 0.6065
 epoch: 60, train_loss: 0.4210, test_loss: 1.3208, test_f1: 0.6338
 epoch: 61, train_loss: 0.3927, test_loss: 1.3410, test_f1: 0.6188
 epoch: 62, train_loss: 0.3991, test_loss: 1.3141, test_f1: 0.6166
 epoch: 63, train_loss: 0.4158, test_loss: 1.3659, test_f1: 0.6099
 epoch: 64, train_loss: 0.3923, test_loss: 1.3059, test_f1: 0.6143
 epoch: 65, train_loss: 0.4022, test_loss: 1.3092, test_f1: 0.6339
 epoch: 66, train_loss: 0.3897, test_loss: 1.4304, test_f1: 0.6299
 epoch: 67, train_loss: 0.3822, test_loss: 1.4289, test_f1: 0.5877
 epoch: 68, train_loss: 0.3678, test_loss: 1.4158, test_f1: 0.5853
 epoch: 69, train_loss: 0.3708, test_loss: 1.3932, test_f1: 0.6197
 epoch: 70, train_loss: 0.3712, test_loss: 1.5377, test_f1: 0.6010
 epoch: 71, train_loss: 0.3850, test_loss: 1.4018, test_f1: 0.6124
 epoch: 72, train_loss: 0.3550, test_loss: 1.3966, test_f1: 0.6060
 epoch: 73, train_loss: 0.3739, test_loss: 1.4839, test_f1: 0.6087
 epoch: 74, train_loss: 0.3820, test_loss: 1.5766, test_f1: 0.5781
 epoch: 75, train_loss: 0.3590, test_loss: 1.4765, test_f1: 0.6250
 epoch: 76, train_loss: 0.3623, test_loss: 1.5306, test_f1: 0.6139
 epoch: 77, train_loss: 0.3641, test_loss: 1.4463, test_f1: 0.6341
 epoch: 78, train_loss: 0.3545, test_loss: 1.4547, test_f1: 0.6082
 epoch: 79, train_loss: 0.3577, test_loss: 1.4930, test_f1: 0.6158
 epoch: 80, train_loss: 0.3596, test_loss: 1.6141, test_f1: 0.6217
 epoch: 81, train_loss: 0.3440, test_loss: 1.5267, test_f1: 0.6051
 epoch: 82, train_loss: 0.3307, test_loss: 1.5707, test_f1: 0.5964
 epoch: 83, train_loss: 0.3463, test_loss: 1.6863, test_f1: 0.5717
 epoch: 84, train_loss: 0.3309, test_loss: 1.6071, test_f1: 0.5806
 epoch: 85, train_loss: 0.3092, test_loss: 1.6206, test_f1: 0.5889
 epoch: 86, train_loss: 0.3191, test_loss: 1.5830, test_f1: 0.6077
 epoch: 87, train_loss: 0.3320, test_loss: 1.5368, test_f1: 0.6358
 epoch: 88, train_loss: 0.3305, test_loss: 1.5991, test_f1: 0.6130
 epoch: 89, train_loss: 0.3139, test_loss: 1.6715, test_f1: 0.5935
 epoch: 90, train_loss: 0.3328, test_loss: 1.6166, test_f1: 0.6088
 epoch: 91, train_loss: 0.3028, test_loss: 1.7231, test_f1: 0.5978
 epoch: 92, train_loss: 0.3354, test_loss: 1.6404, test_f1: 0.5987
 epoch: 93, train_loss: 0.3127, test_loss: 1.6455, test_f1: 0.6054
 epoch: 94, train_loss: 0.3110, test_loss: 1.6606, test_f1: 0.6070
 epoch: 95, train_loss: 0.3087, test_loss: 1.6782, test_f1: 0.6018
 epoch: 96, train_loss: 0.3168, test_loss: 1.6739, test_f1: 0.6057
 epoch: 97, train_loss: 0.3108, test_loss: 1.7428, test_f1: 0.5699
 epoch: 98, train_loss: 0.3012, test_loss: 1.7197, test_f1: 0.6061
 epoch: 99, train_loss: 0.2818, test_loss: 1.6516, test_f1: 0.6101
##################ITERATION #4 ****************************************
 epoch: 0, train_loss: 1.1911, test_loss: 1.2083, test_f1: 0.3734
 epoch: 1, train_loss: 1.0785, test_loss: 1.1005, test_f1: 0.5103
 epoch: 2, train_loss: 1.0041, test_loss: 1.0595, test_f1: 0.5250
 epoch: 3, train_loss: 0.9777, test_loss: 1.0318, test_f1: 0.5395
 epoch: 4, train_loss: 0.9445, test_loss: 0.9943, test_f1: 0.5629
 epoch: 5, train_loss: 0.9182, test_loss: 0.9972, test_f1: 0.5299
 epoch: 6, train_loss: 0.8927, test_loss: 0.9664, test_f1: 0.5588
 epoch: 7, train_loss: 0.8773, test_loss: 0.9547, test_f1: 0.5727
 epoch: 8, train_loss: 0.8367, test_loss: 0.9582, test_f1: 0.5635
 epoch: 9, train_loss: 0.8195, test_loss: 0.9724, test_f1: 0.5362
 epoch: 10, train_loss: 0.8083, test_loss: 0.9629, test_f1: 0.5513
 epoch: 11, train_loss: 0.7903, test_loss: 0.9637, test_f1: 0.5631
 epoch: 12, train_loss: 0.7668, test_loss: 0.9710, test_f1: 0.5536
 epoch: 13, train_loss: 0.7530, test_loss: 0.9947, test_f1: 0.5609
 epoch: 14, train_loss: 0.7367, test_loss: 1.0242, test_f1: 0.5481
 epoch: 15, train_loss: 0.7348, test_loss: 0.9764, test_f1: 0.5719
 epoch: 16, train_loss: 0.7231, test_loss: 0.9776, test_f1: 0.5927
 epoch: 17, train_loss: 0.6857, test_loss: 1.0191, test_f1: 0.6127
 epoch: 18, train_loss: 0.7024, test_loss: 1.0453, test_f1: 0.6177
 epoch: 19, train_loss: 0.6904, test_loss: 1.0351, test_f1: 0.5793
 epoch: 20, train_loss: 0.6731, test_loss: 1.0927, test_f1: 0.5695
 epoch: 21, train_loss: 0.6624, test_loss: 1.0617, test_f1: 0.5888
 epoch: 22, train_loss: 0.6524, test_loss: 1.1437, test_f1: 0.5698
 epoch: 23, train_loss: 0.6527, test_loss: 1.0344, test_f1: 0.6061
 epoch: 24, train_loss: 0.6311, test_loss: 1.0878, test_f1: 0.5948
 epoch: 25, train_loss: 0.6210, test_loss: 1.1494, test_f1: 0.5985
 epoch: 26, train_loss: 0.6191, test_loss: 1.0735, test_f1: 0.6092
 epoch: 27, train_loss: 0.6016, test_loss: 1.1346, test_f1: 0.6075
 epoch: 28, train_loss: 0.5981, test_loss: 1.2078, test_f1: 0.5869
 epoch: 29, train_loss: 0.5915, test_loss: 1.1501, test_f1: 0.5898
 epoch: 30, train_loss: 0.5737, test_loss: 1.2081, test_f1: 0.5814
 epoch: 31, train_loss: 0.5833, test_loss: 1.1800, test_f1: 0.5722
 epoch: 32, train_loss: 0.5647, test_loss: 1.1905, test_f1: 0.5851
 epoch: 33, train_loss: 0.5543, test_loss: 1.1807, test_f1: 0.5832
 epoch: 34, train_loss: 0.5477, test_loss: 1.1780, test_f1: 0.5900
 epoch: 35, train_loss: 0.5426, test_loss: 1.2976, test_f1: 0.6003
 epoch: 36, train_loss: 0.5394, test_loss: 1.2465, test_f1: 0.5702
 epoch: 37, train_loss: 0.5539, test_loss: 1.3820, test_f1: 0.5899
 epoch: 38, train_loss: 0.5341, test_loss: 1.2907, test_f1: 0.6064
 epoch: 39, train_loss: 0.5287, test_loss: 1.3318, test_f1: 0.5884
 epoch: 40, train_loss: 0.5291, test_loss: 1.2270, test_f1: 0.6013
 epoch: 41, train_loss: 0.5241, test_loss: 1.3576, test_f1: 0.5752
 epoch: 42, train_loss: 0.4822, test_loss: 1.3981, test_f1: 0.5812
 epoch: 43, train_loss: 0.5015, test_loss: 1.3835, test_f1: 0.5943
 epoch: 44, train_loss: 0.4743, test_loss: 1.3922, test_f1: 0.5347
 epoch: 45, train_loss: 0.4866, test_loss: 1.4297, test_f1: 0.5544
 epoch: 46, train_loss: 0.4935, test_loss: 1.4218, test_f1: 0.5773
 epoch: 47, train_loss: 0.4742, test_loss: 1.4441, test_f1: 0.6001
 epoch: 48, train_loss: 0.4704, test_loss: 1.7178, test_f1: 0.5525
 epoch: 49, train_loss: 0.4406, test_loss: 1.4285, test_f1: 0.5999
 epoch: 50, train_loss: 0.4704, test_loss: 1.4103, test_f1: 0.5963
 epoch: 51, train_loss: 0.4424, test_loss: 1.4052, test_f1: 0.5878
 epoch: 52, train_loss: 0.4259, test_loss: 1.6005, test_f1: 0.5599
 epoch: 53, train_loss: 0.4195, test_loss: 1.5540, test_f1: 0.5653
 epoch: 54, train_loss: 0.4181, test_loss: 1.5606, test_f1: 0.5764
 epoch: 55, train_loss: 0.4104, test_loss: 1.5581, test_f1: 0.5831
 epoch: 56, train_loss: 0.4033, test_loss: 1.5570, test_f1: 0.6048
 epoch: 57, train_loss: 0.3994, test_loss: 1.5780, test_f1: 0.5624
 epoch: 58, train_loss: 0.4300, test_loss: 1.5987, test_f1: 0.5860
 epoch: 59, train_loss: 0.4078, test_loss: 1.5986, test_f1: 0.6069
 epoch: 60, train_loss: 0.3932, test_loss: 1.6002, test_f1: 0.5978
 epoch: 61, train_loss: 0.3829, test_loss: 1.6755, test_f1: 0.5807
 epoch: 62, train_loss: 0.3718, test_loss: 1.7484, test_f1: 0.5507
 epoch: 63, train_loss: 0.3924, test_loss: 1.6883, test_f1: 0.5571
 epoch: 64, train_loss: 0.4004, test_loss: 1.6729, test_f1: 0.5963
 epoch: 65, train_loss: 0.3724, test_loss: 1.5986, test_f1: 0.5941
 epoch: 66, train_loss: 0.3871, test_loss: 1.6807, test_f1: 0.5971
 epoch: 67, train_loss: 0.3623, test_loss: 1.7054, test_f1: 0.5960
 epoch: 68, train_loss: 0.3838, test_loss: 1.7051, test_f1: 0.5894
 epoch: 69, train_loss: 0.3626, test_loss: 1.7025, test_f1: 0.5746
 epoch: 70, train_loss: 0.3565, test_loss: 1.7747, test_f1: 0.5594
 epoch: 71, train_loss: 0.3520, test_loss: 1.8240, test_f1: 0.5691
 epoch: 72, train_loss: 0.3761, test_loss: 1.8209, test_f1: 0.5764
 epoch: 73, train_loss: 0.3446, test_loss: 1.7610, test_f1: 0.5919
 epoch: 74, train_loss: 0.3572, test_loss: 1.8161, test_f1: 0.5857
 epoch: 75, train_loss: 0.3585, test_loss: 1.9003, test_f1: 0.5512
 epoch: 76, train_loss: 0.3425, test_loss: 1.8096, test_f1: 0.5903
 epoch: 77, train_loss: 0.3379, test_loss: 1.9938, test_f1: 0.5601
 epoch: 78, train_loss: 0.3353, test_loss: 1.7851, test_f1: 0.5911
 epoch: 79, train_loss: 0.3300, test_loss: 2.1332, test_f1: 0.5592
 epoch: 80, train_loss: 0.3338, test_loss: 1.9008, test_f1: 0.5768
 epoch: 81, train_loss: 0.3355, test_loss: 1.9758, test_f1: 0.5674
 epoch: 82, train_loss: 0.3255, test_loss: 1.9200, test_f1: 0.5878
 epoch: 83, train_loss: 0.3316, test_loss: 1.9115, test_f1: 0.5869
 epoch: 84, train_loss: 0.3164, test_loss: 2.0019, test_f1: 0.5829
 epoch: 85, train_loss: 0.3243, test_loss: 2.0612, test_f1: 0.5848
 epoch: 86, train_loss: 0.3170, test_loss: 2.0512, test_f1: 0.5865
 epoch: 87, train_loss: 0.3095, test_loss: 1.9695, test_f1: 0.5755
 epoch: 88, train_loss: 0.3107, test_loss: 2.0711, test_f1: 0.5773
 epoch: 89, train_loss: 0.3021, test_loss: 1.9217, test_f1: 0.5992
 epoch: 90, train_loss: 0.3002, test_loss: 1.9372, test_f1: 0.6034
 epoch: 91, train_loss: 0.2964, test_loss: 1.9716, test_f1: 0.5938
 epoch: 92, train_loss: 0.2978, test_loss: 2.1553, test_f1: 0.5841
 epoch: 93, train_loss: 0.2917, test_loss: 2.1441, test_f1: 0.5616
 epoch: 94, train_loss: 0.3084, test_loss: 2.1971, test_f1: 0.5840
 epoch: 95, train_loss: 0.2946, test_loss: 2.0564, test_f1: 0.5935
 epoch: 96, train_loss: 0.2894, test_loss: 2.2278, test_f1: 0.5732
 epoch: 97, train_loss: 0.2883, test_loss: 2.1443, test_f1: 0.5708
 epoch: 98, train_loss: 0.2699, test_loss: 2.0254, test_f1: 0.6029
 epoch: 99, train_loss: 0.2728, test_loss: 2.0729, test_f1: 0.5953
##################ITERATION #5 ****************************************
 epoch: 0, train_loss: 1.1862, test_loss: 1.2618, test_f1: 0.2544
 epoch: 1, train_loss: 1.0686, test_loss: 1.0972, test_f1: 0.4880
 epoch: 2, train_loss: 1.0188, test_loss: 1.0748, test_f1: 0.5288
 epoch: 3, train_loss: 0.9966, test_loss: 1.0379, test_f1: 0.5535
 epoch: 4, train_loss: 0.9454, test_loss: 1.0268, test_f1: 0.5544
 epoch: 5, train_loss: 0.9244, test_loss: 1.0333, test_f1: 0.5545
 epoch: 6, train_loss: 0.8963, test_loss: 1.0234, test_f1: 0.5727
 epoch: 7, train_loss: 0.8717, test_loss: 1.0201, test_f1: 0.5664
 epoch: 8, train_loss: 0.8537, test_loss: 1.0208, test_f1: 0.5804
 epoch: 9, train_loss: 0.8339, test_loss: 1.0177, test_f1: 0.5957
 epoch: 10, train_loss: 0.8333, test_loss: 1.0090, test_f1: 0.5739
 epoch: 11, train_loss: 0.8019, test_loss: 1.0160, test_f1: 0.5769
 epoch: 12, train_loss: 0.8035, test_loss: 1.0106, test_f1: 0.5966
 epoch: 13, train_loss: 0.7716, test_loss: 0.9874, test_f1: 0.6066
 epoch: 14, train_loss: 0.7693, test_loss: 1.0133, test_f1: 0.5952
 epoch: 15, train_loss: 0.7494, test_loss: 1.0770, test_f1: 0.5211
 epoch: 16, train_loss: 0.7319, test_loss: 0.9891, test_f1: 0.6151
 epoch: 17, train_loss: 0.7261, test_loss: 1.0126, test_f1: 0.6138
 epoch: 18, train_loss: 0.7175, test_loss: 0.9877, test_f1: 0.6064
 epoch: 19, train_loss: 0.7079, test_loss: 1.0139, test_f1: 0.6193
 epoch: 20, train_loss: 0.6972, test_loss: 1.0319, test_f1: 0.6329
 epoch: 21, train_loss: 0.6832, test_loss: 1.0429, test_f1: 0.6122
 epoch: 22, train_loss: 0.6793, test_loss: 1.0138, test_f1: 0.6085
 epoch: 23, train_loss: 0.6843, test_loss: 0.9911, test_f1: 0.6419
 epoch: 24, train_loss: 0.6676, test_loss: 0.9807, test_f1: 0.6266
 epoch: 25, train_loss: 0.6737, test_loss: 1.0782, test_f1: 0.5732
 epoch: 26, train_loss: 0.6529, test_loss: 0.9602, test_f1: 0.6765
 epoch: 27, train_loss: 0.6377, test_loss: 0.9899, test_f1: 0.6351
 epoch: 28, train_loss: 0.6380, test_loss: 1.0295, test_f1: 0.6574
 epoch: 29, train_loss: 0.6130, test_loss: 1.0113, test_f1: 0.6225
 epoch: 30, train_loss: 0.6323, test_loss: 1.0072, test_f1: 0.6733
 epoch: 31, train_loss: 0.6072, test_loss: 1.0129, test_f1: 0.6589
 epoch: 32, train_loss: 0.5833, test_loss: 1.0308, test_f1: 0.6937
 epoch: 33, train_loss: 0.5880, test_loss: 1.0146, test_f1: 0.6280
 epoch: 34, train_loss: 0.5877, test_loss: 1.0289, test_f1: 0.6535
 epoch: 35, train_loss: 0.5532, test_loss: 1.0543, test_f1: 0.6541
 epoch: 36, train_loss: 0.5881, test_loss: 1.0827, test_f1: 0.6201
 epoch: 37, train_loss: 0.5704, test_loss: 1.0737, test_f1: 0.6183
 epoch: 38, train_loss: 0.5519, test_loss: 1.0306, test_f1: 0.6182
 epoch: 39, train_loss: 0.5587, test_loss: 1.0388, test_f1: 0.6625
 epoch: 40, train_loss: 0.5315, test_loss: 1.1131, test_f1: 0.6147
 epoch: 41, train_loss: 0.5604, test_loss: 1.1375, test_f1: 0.6367
 epoch: 42, train_loss: 0.5277, test_loss: 1.0756, test_f1: 0.6285
 epoch: 43, train_loss: 0.5406, test_loss: 1.1124, test_f1: 0.6231
 epoch: 44, train_loss: 0.5269, test_loss: 1.0636, test_f1: 0.6690
 epoch: 45, train_loss: 0.5232, test_loss: 1.1369, test_f1: 0.6456
 epoch: 46, train_loss: 0.5178, test_loss: 1.0740, test_f1: 0.6291
 epoch: 47, train_loss: 0.4854, test_loss: 1.1374, test_f1: 0.6227
 epoch: 48, train_loss: 0.4978, test_loss: 1.1647, test_f1: 0.6240
 epoch: 49, train_loss: 0.4956, test_loss: 1.0269, test_f1: 0.6883
 epoch: 50, train_loss: 0.4950, test_loss: 1.1034, test_f1: 0.6423
 epoch: 51, train_loss: 0.4555, test_loss: 1.1377, test_f1: 0.6657
 epoch: 52, train_loss: 0.4613, test_loss: 1.2034, test_f1: 0.6657
 epoch: 53, train_loss: 0.4515, test_loss: 1.1909, test_f1: 0.6242
 epoch: 54, train_loss: 0.4334, test_loss: 1.2157, test_f1: 0.6202
 epoch: 55, train_loss: 0.4560, test_loss: 1.1983, test_f1: 0.6273
 epoch: 56, train_loss: 0.4387, test_loss: 1.1916, test_f1: 0.6041
 epoch: 57, train_loss: 0.4187, test_loss: 1.1914, test_f1: 0.6289
 epoch: 58, train_loss: 0.4586, test_loss: 1.1872, test_f1: 0.6224
 epoch: 59, train_loss: 0.4318, test_loss: 1.2212, test_f1: 0.6168
 epoch: 60, train_loss: 0.4093, test_loss: 1.2517, test_f1: 0.6294
 epoch: 61, train_loss: 0.4291, test_loss: 1.2457, test_f1: 0.6239
 epoch: 62, train_loss: 0.4054, test_loss: 1.2261, test_f1: 0.6574
 epoch: 63, train_loss: 0.4276, test_loss: 1.3022, test_f1: 0.6051
 epoch: 64, train_loss: 0.4116, test_loss: 1.2551, test_f1: 0.6553
 epoch: 65, train_loss: 0.4081, test_loss: 1.2950, test_f1: 0.6426
 epoch: 66, train_loss: 0.4223, test_loss: 1.3041, test_f1: 0.6001
 epoch: 67, train_loss: 0.4114, test_loss: 1.2967, test_f1: 0.6281
 epoch: 68, train_loss: 0.3875, test_loss: 1.2395, test_f1: 0.6316
 epoch: 69, train_loss: 0.3983, test_loss: 1.2731, test_f1: 0.6183
 epoch: 70, train_loss: 0.3965, test_loss: 1.2709, test_f1: 0.6095
 epoch: 71, train_loss: 0.3787, test_loss: 1.2298, test_f1: 0.6769
 epoch: 72, train_loss: 0.3899, test_loss: 1.3256, test_f1: 0.6286
 epoch: 73, train_loss: 0.3861, test_loss: 1.3909, test_f1: 0.6105
 epoch: 74, train_loss: 0.3877, test_loss: 1.3715, test_f1: 0.6135
 epoch: 75, train_loss: 0.3724, test_loss: 1.3303, test_f1: 0.6227
 epoch: 76, train_loss: 0.3911, test_loss: 1.3712, test_f1: 0.6300
 epoch: 77, train_loss: 0.3803, test_loss: 1.4185, test_f1: 0.6388
 epoch: 78, train_loss: 0.3867, test_loss: 1.4073, test_f1: 0.6613
 epoch: 79, train_loss: 0.3745, test_loss: 1.3146, test_f1: 0.6438
 epoch: 80, train_loss: 0.3759, test_loss: 1.4531, test_f1: 0.6620
 epoch: 81, train_loss: 0.3458, test_loss: 1.4003, test_f1: 0.6604
 epoch: 82, train_loss: 0.3792, test_loss: 1.3500, test_f1: 0.6672
 epoch: 83, train_loss: 0.3407, test_loss: 1.3792, test_f1: 0.6336
 epoch: 84, train_loss: 0.3420, test_loss: 1.3798, test_f1: 0.6449
 epoch: 85, train_loss: 0.3287, test_loss: 1.3916, test_f1: 0.6393
 epoch: 86, train_loss: 0.3288, test_loss: 1.3927, test_f1: 0.6474
 epoch: 87, train_loss: 0.3319, test_loss: 1.4192, test_f1: 0.6369
 epoch: 88, train_loss: 0.3321, test_loss: 1.4023, test_f1: 0.6442
 epoch: 89, train_loss: 0.3529, test_loss: 1.4438, test_f1: 0.6625
 epoch: 90, train_loss: 0.3445, test_loss: 1.5247, test_f1: 0.6214
 epoch: 91, train_loss: 0.3313, test_loss: 1.4718, test_f1: 0.6582
 epoch: 92, train_loss: 0.3348, test_loss: 1.4573, test_f1: 0.6333
 epoch: 93, train_loss: 0.3547, test_loss: 1.4598, test_f1: 0.6479
 epoch: 94, train_loss: 0.3034, test_loss: 1.4843, test_f1: 0.6483
 epoch: 95, train_loss: 0.3171, test_loss: 1.4526, test_f1: 0.6710
 epoch: 96, train_loss: 0.3126, test_loss: 1.5181, test_f1: 0.6486
 epoch: 97, train_loss: 0.3060, test_loss: 1.4572, test_f1: 0.6765
 epoch: 98, train_loss: 0.3061, test_loss: 1.5002, test_f1: 0.6363
 epoch: 99, train_loss: 0.3021, test_loss: 1.4233, test_f1: 0.6688
##################ITERATION #6 ****************************************
 epoch: 0, train_loss: 1.2250, test_loss: 1.2319, test_f1: 0.3895
 epoch: 1, train_loss: 1.0711, test_loss: 1.1200, test_f1: 0.5227
 epoch: 2, train_loss: 1.0396, test_loss: 1.0921, test_f1: 0.5388
 epoch: 3, train_loss: 0.9837, test_loss: 1.0656, test_f1: 0.5337
 epoch: 4, train_loss: 0.9680, test_loss: 1.0138, test_f1: 0.5407
 epoch: 5, train_loss: 0.9245, test_loss: 1.0164, test_f1: 0.5394
 epoch: 6, train_loss: 0.9012, test_loss: 0.9952, test_f1: 0.5730
 epoch: 7, train_loss: 0.8849, test_loss: 0.9876, test_f1: 0.5552
 epoch: 8, train_loss: 0.8743, test_loss: 0.9817, test_f1: 0.5886
 epoch: 9, train_loss: 0.8321, test_loss: 0.9663, test_f1: 0.6107
 epoch: 10, train_loss: 0.8169, test_loss: 0.9797, test_f1: 0.5997
 epoch: 11, train_loss: 0.8151, test_loss: 0.9404, test_f1: 0.6103
 epoch: 12, train_loss: 0.8047, test_loss: 0.9616, test_f1: 0.6321
 epoch: 13, train_loss: 0.7965, test_loss: 0.9661, test_f1: 0.6334
 epoch: 14, train_loss: 0.7810, test_loss: 0.9506, test_f1: 0.6142
 epoch: 15, train_loss: 0.7625, test_loss: 0.9781, test_f1: 0.6218
 epoch: 16, train_loss: 0.7455, test_loss: 0.9603, test_f1: 0.6107
 epoch: 17, train_loss: 0.7272, test_loss: 0.9431, test_f1: 0.6288
 epoch: 18, train_loss: 0.7194, test_loss: 0.9539, test_f1: 0.6093
 epoch: 19, train_loss: 0.7037, test_loss: 0.9380, test_f1: 0.6327
 epoch: 20, train_loss: 0.7084, test_loss: 0.9497, test_f1: 0.6125
 epoch: 21, train_loss: 0.6939, test_loss: 0.9962, test_f1: 0.6300
 epoch: 22, train_loss: 0.6842, test_loss: 0.9781, test_f1: 0.6200
 epoch: 23, train_loss: 0.6874, test_loss: 0.9535, test_f1: 0.6093
 epoch: 24, train_loss: 0.6615, test_loss: 0.9214, test_f1: 0.6407
 epoch: 25, train_loss: 0.6621, test_loss: 0.9742, test_f1: 0.6005
 epoch: 26, train_loss: 0.6547, test_loss: 0.9215, test_f1: 0.6096
 epoch: 27, train_loss: 0.6436, test_loss: 1.0137, test_f1: 0.6097
 epoch: 28, train_loss: 0.6217, test_loss: 0.9831, test_f1: 0.5927
 epoch: 29, train_loss: 0.6433, test_loss: 1.0054, test_f1: 0.6058
 epoch: 30, train_loss: 0.6074, test_loss: 0.9665, test_f1: 0.6570
 epoch: 31, train_loss: 0.6023, test_loss: 1.0217, test_f1: 0.6018
 epoch: 32, train_loss: 0.5894, test_loss: 0.9896, test_f1: 0.6120
 epoch: 33, train_loss: 0.5970, test_loss: 1.0009, test_f1: 0.6096
 epoch: 34, train_loss: 0.5708, test_loss: 1.0531, test_f1: 0.6002
 epoch: 35, train_loss: 0.5604, test_loss: 1.0360, test_f1: 0.5969
 epoch: 36, train_loss: 0.5781, test_loss: 1.0705, test_f1: 0.6178
 epoch: 37, train_loss: 0.5666, test_loss: 0.9990, test_f1: 0.6491
 epoch: 38, train_loss: 0.5477, test_loss: 1.0268, test_f1: 0.6123
 epoch: 39, train_loss: 0.5577, test_loss: 1.1692, test_f1: 0.6020
 epoch: 40, train_loss: 0.5614, test_loss: 1.1015, test_f1: 0.6189
 epoch: 41, train_loss: 0.5468, test_loss: 1.1658, test_f1: 0.5897
 epoch: 42, train_loss: 0.5379, test_loss: 1.1307, test_f1: 0.6641
 epoch: 43, train_loss: 0.5364, test_loss: 1.1639, test_f1: 0.6054
 epoch: 44, train_loss: 0.5273, test_loss: 1.1295, test_f1: 0.6902
 epoch: 45, train_loss: 0.5239, test_loss: 1.1828, test_f1: 0.6089
 epoch: 46, train_loss: 0.5049, test_loss: 1.1117, test_f1: 0.6617
 epoch: 47, train_loss: 0.5046, test_loss: 1.1387, test_f1: 0.6323
 epoch: 48, train_loss: 0.5147, test_loss: 1.2042, test_f1: 0.6102
 epoch: 49, train_loss: 0.4869, test_loss: 1.3090, test_f1: 0.6051
 epoch: 50, train_loss: 0.4791, test_loss: 1.1970, test_f1: 0.6149
 epoch: 51, train_loss: 0.4699, test_loss: 1.2137, test_f1: 0.5984
 epoch: 52, train_loss: 0.4514, test_loss: 1.1698, test_f1: 0.6456
 epoch: 53, train_loss: 0.4614, test_loss: 1.1560, test_f1: 0.6443
 epoch: 54, train_loss: 0.4502, test_loss: 1.1688, test_f1: 0.6632
 epoch: 55, train_loss: 0.4783, test_loss: 1.1675, test_f1: 0.6402
 epoch: 56, train_loss: 0.4329, test_loss: 1.1889, test_f1: 0.6527
 epoch: 57, train_loss: 0.4292, test_loss: 1.2622, test_f1: 0.6582
 epoch: 58, train_loss: 0.4445, test_loss: 1.2714, test_f1: 0.6500
 epoch: 59, train_loss: 0.4364, test_loss: 1.2624, test_f1: 0.6609
 epoch: 60, train_loss: 0.4197, test_loss: 1.2168, test_f1: 0.6401
 epoch: 61, train_loss: 0.4257, test_loss: 1.2406, test_f1: 0.6483
 epoch: 62, train_loss: 0.4264, test_loss: 1.2311, test_f1: 0.6741
 epoch: 63, train_loss: 0.4247, test_loss: 1.2658, test_f1: 0.6407
 epoch: 64, train_loss: 0.4264, test_loss: 1.2402, test_f1: 0.6353
 epoch: 65, train_loss: 0.3993, test_loss: 1.2233, test_f1: 0.6461
 epoch: 66, train_loss: 0.4239, test_loss: 1.2481, test_f1: 0.6259
 epoch: 67, train_loss: 0.3920, test_loss: 1.2163, test_f1: 0.6404
 epoch: 68, train_loss: 0.3899, test_loss: 1.2264, test_f1: 0.6487
 epoch: 69, train_loss: 0.3920, test_loss: 1.2352, test_f1: 0.6379
 epoch: 70, train_loss: 0.4005, test_loss: 1.2343, test_f1: 0.6428
 epoch: 71, train_loss: 0.3802, test_loss: 1.3296, test_f1: 0.6205
 epoch: 72, train_loss: 0.4283, test_loss: 1.3846, test_f1: 0.6132
 epoch: 73, train_loss: 0.4049, test_loss: 1.3744, test_f1: 0.6472
 epoch: 74, train_loss: 0.3882, test_loss: 1.3362, test_f1: 0.6561
 epoch: 75, train_loss: 0.3907, test_loss: 1.2762, test_f1: 0.6639
 epoch: 76, train_loss: 0.3910, test_loss: 1.3826, test_f1: 0.6395
 epoch: 77, train_loss: 0.3872, test_loss: 1.3181, test_f1: 0.6454
 epoch: 78, train_loss: 0.3869, test_loss: 1.2591, test_f1: 0.6685
 epoch: 79, train_loss: 0.3829, test_loss: 1.2998, test_f1: 0.6562
 epoch: 80, train_loss: 0.3915, test_loss: 1.3974, test_f1: 0.6350
 epoch: 81, train_loss: 0.3640, test_loss: 1.3745, test_f1: 0.6311
 epoch: 82, train_loss: 0.4063, test_loss: 1.3239, test_f1: 0.6506
 epoch: 83, train_loss: 0.3720, test_loss: 1.3888, test_f1: 0.6475
 epoch: 84, train_loss: 0.3588, test_loss: 1.3684, test_f1: 0.6506
 epoch: 85, train_loss: 0.3687, test_loss: 1.3327, test_f1: 0.6457
 epoch: 86, train_loss: 0.3555, test_loss: 1.4173, test_f1: 0.6625
 epoch: 87, train_loss: 0.3620, test_loss: 1.4749, test_f1: 0.6688
 epoch: 88, train_loss: 0.3521, test_loss: 1.4803, test_f1: 0.6105
 epoch: 89, train_loss: 0.3515, test_loss: 1.4646, test_f1: 0.6515
 epoch: 90, train_loss: 0.3567, test_loss: 1.4645, test_f1: 0.6314
 epoch: 91, train_loss: 0.3320, test_loss: 1.5295, test_f1: 0.6365
 epoch: 92, train_loss: 0.3401, test_loss: 1.5046, test_f1: 0.6453
 epoch: 93, train_loss: 0.3328, test_loss: 1.5722, test_f1: 0.6301
 epoch: 94, train_loss: 0.3284, test_loss: 1.5139, test_f1: 0.6427
 epoch: 95, train_loss: 0.3361, test_loss: 1.5276, test_f1: 0.6301
 epoch: 96, train_loss: 0.3427, test_loss: 1.4854, test_f1: 0.6358
 epoch: 97, train_loss: 0.3372, test_loss: 1.5434, test_f1: 0.6528
 epoch: 98, train_loss: 0.3361, test_loss: 1.5724, test_f1: 0.6147
 epoch: 99, train_loss: 0.3312, test_loss: 1.5294, test_f1: 0.6506
##################ITERATION #7 ****************************************
 epoch: 0, train_loss: 1.2278, test_loss: 1.2689, test_f1: 0.2479
 epoch: 1, train_loss: 1.0635, test_loss: 1.1390, test_f1: 0.5456
 epoch: 2, train_loss: 1.0057, test_loss: 1.0992, test_f1: 0.5531
 epoch: 3, train_loss: 0.9778, test_loss: 1.0439, test_f1: 0.5591
 epoch: 4, train_loss: 0.9630, test_loss: 1.0913, test_f1: 0.5300
 epoch: 5, train_loss: 0.9411, test_loss: 1.0579, test_f1: 0.5274
 epoch: 6, train_loss: 0.9087, test_loss: 1.0752, test_f1: 0.5416
 epoch: 7, train_loss: 0.8769, test_loss: 1.0368, test_f1: 0.5631
 epoch: 8, train_loss: 0.8513, test_loss: 1.0656, test_f1: 0.5469
 epoch: 9, train_loss: 0.8534, test_loss: 1.0368, test_f1: 0.5618
 epoch: 10, train_loss: 0.8259, test_loss: 1.0416, test_f1: 0.5342
 epoch: 11, train_loss: 0.8047, test_loss: 1.0252, test_f1: 0.5748
 epoch: 12, train_loss: 0.7746, test_loss: 1.0007, test_f1: 0.5570
 epoch: 13, train_loss: 0.7630, test_loss: 1.0574, test_f1: 0.5469
 epoch: 14, train_loss: 0.7521, test_loss: 1.0243, test_f1: 0.6051
 epoch: 15, train_loss: 0.7472, test_loss: 0.9968, test_f1: 0.6085
 epoch: 16, train_loss: 0.7289, test_loss: 1.0583, test_f1: 0.5905
 epoch: 17, train_loss: 0.7257, test_loss: 1.0970, test_f1: 0.6002
 epoch: 18, train_loss: 0.7193, test_loss: 1.0568, test_f1: 0.5748
 epoch: 19, train_loss: 0.7041, test_loss: 1.0636, test_f1: 0.5887
 epoch: 20, train_loss: 0.6886, test_loss: 1.1106, test_f1: 0.5812
 epoch: 21, train_loss: 0.6788, test_loss: 1.1121, test_f1: 0.6017
 epoch: 22, train_loss: 0.6736, test_loss: 1.1107, test_f1: 0.5762
 epoch: 23, train_loss: 0.6740, test_loss: 1.1073, test_f1: 0.5765
 epoch: 24, train_loss: 0.6610, test_loss: 1.0772, test_f1: 0.6065
 epoch: 25, train_loss: 0.6618, test_loss: 1.1518, test_f1: 0.5608
 epoch: 26, train_loss: 0.6263, test_loss: 1.1344, test_f1: 0.5717
 epoch: 27, train_loss: 0.6294, test_loss: 1.0954, test_f1: 0.5951
 epoch: 28, train_loss: 0.6250, test_loss: 1.2068, test_f1: 0.5780
 epoch: 29, train_loss: 0.6049, test_loss: 1.1671, test_f1: 0.6106
 epoch: 30, train_loss: 0.6065, test_loss: 1.1088, test_f1: 0.6416
 epoch: 31, train_loss: 0.5974, test_loss: 1.2052, test_f1: 0.6076
 epoch: 32, train_loss: 0.6246, test_loss: 1.1465, test_f1: 0.6091
 epoch: 33, train_loss: 0.5833, test_loss: 1.1877, test_f1: 0.6325
 epoch: 34, train_loss: 0.5825, test_loss: 1.2495, test_f1: 0.6372
 epoch: 35, train_loss: 0.5603, test_loss: 1.1931, test_f1: 0.6384
 epoch: 36, train_loss: 0.5677, test_loss: 1.2287, test_f1: 0.6122
 epoch: 37, train_loss: 0.5420, test_loss: 1.1600, test_f1: 0.6326
 epoch: 38, train_loss: 0.5447, test_loss: 1.2010, test_f1: 0.6220
 epoch: 39, train_loss: 0.5368, test_loss: 1.1932, test_f1: 0.6523
 epoch: 40, train_loss: 0.5425, test_loss: 1.2146, test_f1: 0.6601
 epoch: 41, train_loss: 0.5263, test_loss: 1.2308, test_f1: 0.6278
 epoch: 42, train_loss: 0.5208, test_loss: 1.3132, test_f1: 0.5885
 epoch: 43, train_loss: 0.5131, test_loss: 1.1784, test_f1: 0.6258
 epoch: 44, train_loss: 0.5174, test_loss: 1.2505, test_f1: 0.6298
 epoch: 45, train_loss: 0.5077, test_loss: 1.2519, test_f1: 0.6288
 epoch: 46, train_loss: 0.5060, test_loss: 1.2958, test_f1: 0.6132
 epoch: 47, train_loss: 0.5048, test_loss: 1.3545, test_f1: 0.6052
 epoch: 48, train_loss: 0.4933, test_loss: 1.3675, test_f1: 0.5954
 epoch: 49, train_loss: 0.4775, test_loss: 1.3251, test_f1: 0.6353
 epoch: 50, train_loss: 0.4862, test_loss: 1.3350, test_f1: 0.6375
 epoch: 51, train_loss: 0.4605, test_loss: 1.3578, test_f1: 0.6394
 epoch: 52, train_loss: 0.4659, test_loss: 1.3353, test_f1: 0.6243
 epoch: 53, train_loss: 0.4386, test_loss: 1.4296, test_f1: 0.6317
 epoch: 54, train_loss: 0.4354, test_loss: 1.3592, test_f1: 0.6450
 epoch: 55, train_loss: 0.4417, test_loss: 1.4130, test_f1: 0.6439
 epoch: 56, train_loss: 0.4325, test_loss: 1.4381, test_f1: 0.6291
 epoch: 57, train_loss: 0.4317, test_loss: 1.4144, test_f1: 0.6292
 epoch: 58, train_loss: 0.4148, test_loss: 1.4470, test_f1: 0.6498
 epoch: 59, train_loss: 0.4341, test_loss: 1.4645, test_f1: 0.6329
 epoch: 60, train_loss: 0.4088, test_loss: 1.4606, test_f1: 0.6442
 epoch: 61, train_loss: 0.3987, test_loss: 1.4210, test_f1: 0.6466
 epoch: 62, train_loss: 0.4066, test_loss: 1.4752, test_f1: 0.6446
 epoch: 63, train_loss: 0.4149, test_loss: 1.4749, test_f1: 0.6485
 epoch: 64, train_loss: 0.4125, test_loss: 1.4734, test_f1: 0.6500
 epoch: 65, train_loss: 0.3970, test_loss: 1.4202, test_f1: 0.6431
 epoch: 66, train_loss: 0.3824, test_loss: 1.5089, test_f1: 0.6471
 epoch: 67, train_loss: 0.4077, test_loss: 1.5654, test_f1: 0.6310
 epoch: 68, train_loss: 0.3773, test_loss: 1.5047, test_f1: 0.6406
 epoch: 69, train_loss: 0.4034, test_loss: 1.5826, test_f1: 0.6290
 epoch: 70, train_loss: 0.3826, test_loss: 1.6129, test_f1: 0.6474
 epoch: 71, train_loss: 0.3758, test_loss: 1.6125, test_f1: 0.6260
 epoch: 72, train_loss: 0.3861, test_loss: 1.5650, test_f1: 0.6564
 epoch: 73, train_loss: 0.3790, test_loss: 1.4949, test_f1: 0.6596
 epoch: 74, train_loss: 0.3849, test_loss: 1.5633, test_f1: 0.6547
 epoch: 75, train_loss: 0.3747, test_loss: 1.5746, test_f1: 0.6473
 epoch: 76, train_loss: 0.3656, test_loss: 1.6107, test_f1: 0.6497
 epoch: 77, train_loss: 0.3549, test_loss: 1.6187, test_f1: 0.6374
 epoch: 78, train_loss: 0.3547, test_loss: 1.6894, test_f1: 0.6474
 epoch: 79, train_loss: 0.3510, test_loss: 1.5885, test_f1: 0.6513
 epoch: 80, train_loss: 0.3586, test_loss: 1.6767, test_f1: 0.6318
 epoch: 81, train_loss: 0.3427, test_loss: 1.6732, test_f1: 0.6433
 epoch: 82, train_loss: 0.3545, test_loss: 1.5971, test_f1: 0.6357
 epoch: 83, train_loss: 0.3334, test_loss: 1.6565, test_f1: 0.6607
 epoch: 84, train_loss: 0.3509, test_loss: 1.7006, test_f1: 0.6646
 epoch: 85, train_loss: 0.3297, test_loss: 1.6751, test_f1: 0.6414
 epoch: 86, train_loss: 0.3555, test_loss: 1.7186, test_f1: 0.6364
 epoch: 87, train_loss: 0.3249, test_loss: 1.7806, test_f1: 0.6321
 epoch: 88, train_loss: 0.3353, test_loss: 1.7916, test_f1: 0.6466
 epoch: 89, train_loss: 0.3368, test_loss: 1.8674, test_f1: 0.6449
 epoch: 90, train_loss: 0.3347, test_loss: 1.8579, test_f1: 0.6244
 epoch: 91, train_loss: 0.3243, test_loss: 1.8674, test_f1: 0.6364
 epoch: 92, train_loss: 0.3413, test_loss: 1.7773, test_f1: 0.6312
 epoch: 93, train_loss: 0.3230, test_loss: 1.8358, test_f1: 0.6548
 epoch: 94, train_loss: 0.3189, test_loss: 1.9262, test_f1: 0.6270
 epoch: 95, train_loss: 0.3135, test_loss: 1.8726, test_f1: 0.6263
 epoch: 96, train_loss: 0.3424, test_loss: 1.8747, test_f1: 0.6283
 epoch: 97, train_loss: 0.3042, test_loss: 1.8336, test_f1: 0.6511
 epoch: 98, train_loss: 0.3179, test_loss: 1.9035, test_f1: 0.6449
 epoch: 99, train_loss: 0.3260, test_loss: 1.8350, test_f1: 0.6489
##################ITERATION #8 ****************************************
 epoch: 0, train_loss: 1.2989, test_loss: 1.2408, test_f1: 0.3167
 epoch: 1, train_loss: 1.1006, test_loss: 1.0998, test_f1: 0.4587
 epoch: 2, train_loss: 1.0245, test_loss: 1.0641, test_f1: 0.4675
 epoch: 3, train_loss: 1.0167, test_loss: 1.0439, test_f1: 0.5195
 epoch: 4, train_loss: 0.9534, test_loss: 1.0199, test_f1: 0.5201
 epoch: 5, train_loss: 0.9362, test_loss: 1.0262, test_f1: 0.5520
 epoch: 6, train_loss: 0.9058, test_loss: 1.0199, test_f1: 0.5583
 epoch: 7, train_loss: 0.8869, test_loss: 1.0441, test_f1: 0.5385
 epoch: 8, train_loss: 0.8788, test_loss: 1.0238, test_f1: 0.5420
 epoch: 9, train_loss: 0.8453, test_loss: 1.0085, test_f1: 0.5241
 epoch: 10, train_loss: 0.8272, test_loss: 0.9840, test_f1: 0.5763
 epoch: 11, train_loss: 0.8071, test_loss: 1.0120, test_f1: 0.5497
 epoch: 12, train_loss: 0.8140, test_loss: 1.0298, test_f1: 0.5873
 epoch: 13, train_loss: 0.7906, test_loss: 0.9871, test_f1: 0.5902
 epoch: 14, train_loss: 0.7924, test_loss: 1.0225, test_f1: 0.5738
 epoch: 15, train_loss: 0.7725, test_loss: 0.9953, test_f1: 0.6052
 epoch: 16, train_loss: 0.7425, test_loss: 1.0004, test_f1: 0.6065
 epoch: 17, train_loss: 0.7446, test_loss: 1.0336, test_f1: 0.5940
 epoch: 18, train_loss: 0.7102, test_loss: 1.0445, test_f1: 0.6172
 epoch: 19, train_loss: 0.7282, test_loss: 1.0134, test_f1: 0.6072
 epoch: 20, train_loss: 0.7381, test_loss: 1.0188, test_f1: 0.6204
 epoch: 21, train_loss: 0.6990, test_loss: 1.0181, test_f1: 0.5917
 epoch: 22, train_loss: 0.7012, test_loss: 1.0293, test_f1: 0.5922
 epoch: 23, train_loss: 0.6797, test_loss: 1.0017, test_f1: 0.5866
 epoch: 24, train_loss: 0.6916, test_loss: 1.0474, test_f1: 0.6048
 epoch: 25, train_loss: 0.6717, test_loss: 1.0478, test_f1: 0.5879
 epoch: 26, train_loss: 0.6573, test_loss: 1.0010, test_f1: 0.6280
 epoch: 27, train_loss: 0.6593, test_loss: 1.0416, test_f1: 0.5890
 epoch: 28, train_loss: 0.6430, test_loss: 1.0038, test_f1: 0.5855
 epoch: 29, train_loss: 0.6220, test_loss: 1.0757, test_f1: 0.6290
 epoch: 30, train_loss: 0.6163, test_loss: 1.0231, test_f1: 0.6236
 epoch: 31, train_loss: 0.6113, test_loss: 1.0920, test_f1: 0.6006
 epoch: 32, train_loss: 0.6081, test_loss: 1.0582, test_f1: 0.6034
 epoch: 33, train_loss: 0.5898, test_loss: 1.0511, test_f1: 0.6121
 epoch: 34, train_loss: 0.6091, test_loss: 1.0676, test_f1: 0.6086
 epoch: 35, train_loss: 0.5792, test_loss: 1.1002, test_f1: 0.6009
 epoch: 36, train_loss: 0.5794, test_loss: 1.0962, test_f1: 0.6159
 epoch: 37, train_loss: 0.5739, test_loss: 1.1313, test_f1: 0.5960
 epoch: 38, train_loss: 0.5570, test_loss: 1.0979, test_f1: 0.5646
 epoch: 39, train_loss: 0.5622, test_loss: 1.1213, test_f1: 0.5889
 epoch: 40, train_loss: 0.5461, test_loss: 1.1660, test_f1: 0.5804
 epoch: 41, train_loss: 0.5458, test_loss: 1.1227, test_f1: 0.6020
 epoch: 42, train_loss: 0.5622, test_loss: 1.0902, test_f1: 0.6321
 epoch: 43, train_loss: 0.5185, test_loss: 1.1039, test_f1: 0.5939
 epoch: 44, train_loss: 0.5184, test_loss: 1.1911, test_f1: 0.6100
 epoch: 45, train_loss: 0.5289, test_loss: 1.2163, test_f1: 0.5785
 epoch: 46, train_loss: 0.5143, test_loss: 1.1688, test_f1: 0.6026
 epoch: 47, train_loss: 0.5126, test_loss: 1.1814, test_f1: 0.6024
 epoch: 48, train_loss: 0.5049, test_loss: 1.1964, test_f1: 0.6054
 epoch: 49, train_loss: 0.4966, test_loss: 1.1997, test_f1: 0.5903
 epoch: 50, train_loss: 0.4882, test_loss: 1.2807, test_f1: 0.6127
 epoch: 51, train_loss: 0.4658, test_loss: 1.1768, test_f1: 0.5939
 epoch: 52, train_loss: 0.4547, test_loss: 1.1948, test_f1: 0.5980
 epoch: 53, train_loss: 0.4496, test_loss: 1.2119, test_f1: 0.5905
 epoch: 54, train_loss: 0.4468, test_loss: 1.2473, test_f1: 0.5930
 epoch: 55, train_loss: 0.4417, test_loss: 1.2496, test_f1: 0.5947
 epoch: 56, train_loss: 0.4591, test_loss: 1.2360, test_f1: 0.6142
 epoch: 57, train_loss: 0.4275, test_loss: 1.3064, test_f1: 0.6165
 epoch: 58, train_loss: 0.4188, test_loss: 1.2903, test_f1: 0.6118
 epoch: 59, train_loss: 0.4360, test_loss: 1.3044, test_f1: 0.6239
 epoch: 60, train_loss: 0.4452, test_loss: 1.3165, test_f1: 0.5947
 epoch: 61, train_loss: 0.4271, test_loss: 1.3087, test_f1: 0.5786
 epoch: 62, train_loss: 0.4139, test_loss: 1.3747, test_f1: 0.5858
 epoch: 63, train_loss: 0.4141, test_loss: 1.3442, test_f1: 0.6032
 epoch: 64, train_loss: 0.4096, test_loss: 1.3814, test_f1: 0.5949
 epoch: 65, train_loss: 0.4038, test_loss: 1.3728, test_f1: 0.6162
 epoch: 66, train_loss: 0.3944, test_loss: 1.4198, test_f1: 0.5920
 epoch: 67, train_loss: 0.4117, test_loss: 1.3892, test_f1: 0.6055
 epoch: 68, train_loss: 0.4011, test_loss: 1.4002, test_f1: 0.5895
 epoch: 69, train_loss: 0.3953, test_loss: 1.3259, test_f1: 0.6073
 epoch: 70, train_loss: 0.4024, test_loss: 1.3872, test_f1: 0.6241
 epoch: 71, train_loss: 0.3703, test_loss: 1.3801, test_f1: 0.5948
 epoch: 72, train_loss: 0.3918, test_loss: 1.3711, test_f1: 0.6040
 epoch: 73, train_loss: 0.3682, test_loss: 1.4663, test_f1: 0.5736
 epoch: 74, train_loss: 0.3879, test_loss: 1.4074, test_f1: 0.6101
 epoch: 75, train_loss: 0.3897, test_loss: 1.4180, test_f1: 0.6035
 epoch: 76, train_loss: 0.3665, test_loss: 1.4240, test_f1: 0.6037
 epoch: 77, train_loss: 0.3645, test_loss: 1.4299, test_f1: 0.5985
 epoch: 78, train_loss: 0.3894, test_loss: 1.4984, test_f1: 0.5920
 epoch: 79, train_loss: 0.3655, test_loss: 1.4413, test_f1: 0.6038
 epoch: 80, train_loss: 0.3586, test_loss: 1.5068, test_f1: 0.5811
 epoch: 81, train_loss: 0.3408, test_loss: 1.5660, test_f1: 0.5915
 epoch: 82, train_loss: 0.3747, test_loss: 1.4814, test_f1: 0.5952
 epoch: 83, train_loss: 0.3475, test_loss: 1.5229, test_f1: 0.6115
 epoch: 84, train_loss: 0.3670, test_loss: 1.5001, test_f1: 0.6049
 epoch: 85, train_loss: 0.3573, test_loss: 1.4669, test_f1: 0.6038
 epoch: 86, train_loss: 0.3459, test_loss: 1.6079, test_f1: 0.5999
 epoch: 87, train_loss: 0.3503, test_loss: 1.4625, test_f1: 0.6049
 epoch: 88, train_loss: 0.3365, test_loss: 1.5683, test_f1: 0.6004
 epoch: 89, train_loss: 0.3731, test_loss: 1.5359, test_f1: 0.6063
 epoch: 90, train_loss: 0.3391, test_loss: 1.6196, test_f1: 0.6125
 epoch: 91, train_loss: 0.3408, test_loss: 1.5880, test_f1: 0.5776
 epoch: 92, train_loss: 0.3563, test_loss: 1.5953, test_f1: 0.6136
 epoch: 93, train_loss: 0.3361, test_loss: 1.6620, test_f1: 0.5863
 epoch: 94, train_loss: 0.3381, test_loss: 1.6332, test_f1: 0.5892
 epoch: 95, train_loss: 0.3296, test_loss: 1.5309, test_f1: 0.6271
 epoch: 96, train_loss: 0.2973, test_loss: 1.5925, test_f1: 0.6298
 epoch: 97, train_loss: 0.3358, test_loss: 1.6657, test_f1: 0.6118
 epoch: 98, train_loss: 0.3115, test_loss: 1.6294, test_f1: 0.6128
 epoch: 99, train_loss: 0.3409, test_loss: 1.5857, test_f1: 0.6270
##################ITERATION #9 ****************************************
 epoch: 0, train_loss: 1.2559, test_loss: 1.2677, test_f1: 0.3271
 epoch: 1, train_loss: 1.0398, test_loss: 1.1036, test_f1: 0.5385
 epoch: 2, train_loss: 0.9833, test_loss: 1.0373, test_f1: 0.5809
 epoch: 3, train_loss: 0.9428, test_loss: 1.0164, test_f1: 0.5938
 epoch: 4, train_loss: 0.9223, test_loss: 1.0075, test_f1: 0.5607
 epoch: 5, train_loss: 0.8949, test_loss: 0.9919, test_f1: 0.5795
 epoch: 6, train_loss: 0.8864, test_loss: 0.9844, test_f1: 0.5639
 epoch: 7, train_loss: 0.8517, test_loss: 1.0085, test_f1: 0.5667
 epoch: 8, train_loss: 0.8421, test_loss: 0.9598, test_f1: 0.6039
 epoch: 9, train_loss: 0.8272, test_loss: 0.9887, test_f1: 0.5766
 epoch: 10, train_loss: 0.8014, test_loss: 0.9761, test_f1: 0.5671
 epoch: 11, train_loss: 0.7992, test_loss: 0.9570, test_f1: 0.5898
 epoch: 12, train_loss: 0.7608, test_loss: 0.9561, test_f1: 0.5925
 epoch: 13, train_loss: 0.7532, test_loss: 0.9898, test_f1: 0.5955
 epoch: 14, train_loss: 0.7572, test_loss: 0.9641, test_f1: 0.5766
 epoch: 15, train_loss: 0.7340, test_loss: 0.9850, test_f1: 0.5920
 epoch: 16, train_loss: 0.7296, test_loss: 0.9658, test_f1: 0.5969
 epoch: 17, train_loss: 0.7295, test_loss: 1.0148, test_f1: 0.5991
 epoch: 18, train_loss: 0.6807, test_loss: 0.9710, test_f1: 0.6074
 epoch: 19, train_loss: 0.6805, test_loss: 0.9949, test_f1: 0.6079
 epoch: 20, train_loss: 0.6659, test_loss: 0.9875, test_f1: 0.5986
 epoch: 21, train_loss: 0.6363, test_loss: 1.0222, test_f1: 0.6002
 epoch: 22, train_loss: 0.6363, test_loss: 0.9805, test_f1: 0.6245
 epoch: 23, train_loss: 0.6290, test_loss: 1.0154, test_f1: 0.6258
 epoch: 24, train_loss: 0.6305, test_loss: 1.0443, test_f1: 0.6150
 epoch: 25, train_loss: 0.6247, test_loss: 1.0157, test_f1: 0.6193
 epoch: 26, train_loss: 0.6041, test_loss: 1.0213, test_f1: 0.6259
 epoch: 27, train_loss: 0.6006, test_loss: 1.0631, test_f1: 0.6122
 epoch: 28, train_loss: 0.5888, test_loss: 1.0449, test_f1: 0.6346
 epoch: 29, train_loss: 0.5844, test_loss: 1.0367, test_f1: 0.6022
 epoch: 30, train_loss: 0.5646, test_loss: 1.0328, test_f1: 0.6329
 epoch: 31, train_loss: 0.5750, test_loss: 1.0664, test_f1: 0.5955
 epoch: 32, train_loss: 0.5526, test_loss: 1.1388, test_f1: 0.6062
 epoch: 33, train_loss: 0.5580, test_loss: 1.0549, test_f1: 0.6132
 epoch: 34, train_loss: 0.5411, test_loss: 1.1386, test_f1: 0.6087
 epoch: 35, train_loss: 0.5565, test_loss: 1.1037, test_f1: 0.5795
 epoch: 36, train_loss: 0.5311, test_loss: 1.0577, test_f1: 0.6206
 epoch: 37, train_loss: 0.5178, test_loss: 1.0946, test_f1: 0.5881
 epoch: 38, train_loss: 0.4959, test_loss: 1.1413, test_f1: 0.6120
 epoch: 39, train_loss: 0.5116, test_loss: 1.1331, test_f1: 0.6223
 epoch: 40, train_loss: 0.4929, test_loss: 1.1739, test_f1: 0.6128
 epoch: 41, train_loss: 0.4839, test_loss: 1.2176, test_f1: 0.5979
 epoch: 42, train_loss: 0.4901, test_loss: 1.2427, test_f1: 0.6078
 epoch: 43, train_loss: 0.4763, test_loss: 1.1503, test_f1: 0.6152
 epoch: 44, train_loss: 0.4789, test_loss: 1.1937, test_f1: 0.6055
 epoch: 45, train_loss: 0.4556, test_loss: 1.2358, test_f1: 0.6016
 epoch: 46, train_loss: 0.4404, test_loss: 1.1585, test_f1: 0.6288
 epoch: 47, train_loss: 0.4573, test_loss: 1.1763, test_f1: 0.5832
 epoch: 48, train_loss: 0.4425, test_loss: 1.1745, test_f1: 0.6156
 epoch: 49, train_loss: 0.4337, test_loss: 1.2536, test_f1: 0.6160
 epoch: 50, train_loss: 0.4121, test_loss: 1.2377, test_f1: 0.6426
 epoch: 51, train_loss: 0.3998, test_loss: 1.2409, test_f1: 0.6276
 epoch: 52, train_loss: 0.4310, test_loss: 1.2806, test_f1: 0.6270
 epoch: 53, train_loss: 0.3879, test_loss: 1.2412, test_f1: 0.6437
 epoch: 54, train_loss: 0.3994, test_loss: 1.1956, test_f1: 0.6345
 epoch: 55, train_loss: 0.3821, test_loss: 1.2766, test_f1: 0.6203
 epoch: 56, train_loss: 0.3869, test_loss: 1.2925, test_f1: 0.6290
 epoch: 57, train_loss: 0.3838, test_loss: 1.2975, test_f1: 0.6041
 epoch: 58, train_loss: 0.3653, test_loss: 1.3488, test_f1: 0.6106
 epoch: 59, train_loss: 0.3710, test_loss: 1.3506, test_f1: 0.5985
 epoch: 60, train_loss: 0.3602, test_loss: 1.3578, test_f1: 0.6004
 epoch: 61, train_loss: 0.3606, test_loss: 1.3761, test_f1: 0.6020
 epoch: 62, train_loss: 0.3591, test_loss: 1.3630, test_f1: 0.6123
 epoch: 63, train_loss: 0.3511, test_loss: 1.3563, test_f1: 0.6096
 epoch: 64, train_loss: 0.3501, test_loss: 1.3667, test_f1: 0.5987
 epoch: 65, train_loss: 0.3643, test_loss: 1.4166, test_f1: 0.6300
 epoch: 66, train_loss: 0.3472, test_loss: 1.3552, test_f1: 0.6230
 epoch: 67, train_loss: 0.3368, test_loss: 1.4143, test_f1: 0.6011
 epoch: 68, train_loss: 0.3411, test_loss: 1.3553, test_f1: 0.6175
 epoch: 69, train_loss: 0.3240, test_loss: 1.4966, test_f1: 0.6043
 epoch: 70, train_loss: 0.3556, test_loss: 1.3668, test_f1: 0.6022
 epoch: 71, train_loss: 0.3221, test_loss: 1.4419, test_f1: 0.6066
 epoch: 72, train_loss: 0.3379, test_loss: 1.4298, test_f1: 0.5913
 epoch: 73, train_loss: 0.3270, test_loss: 1.3708, test_f1: 0.6232
 epoch: 74, train_loss: 0.3122, test_loss: 1.4084, test_f1: 0.5963
 epoch: 75, train_loss: 0.3172, test_loss: 1.4502, test_f1: 0.6071
 epoch: 76, train_loss: 0.3173, test_loss: 1.5314, test_f1: 0.6014
 epoch: 77, train_loss: 0.3111, test_loss: 1.4346, test_f1: 0.6031
 epoch: 78, train_loss: 0.3075, test_loss: 1.4809, test_f1: 0.5899
 epoch: 79, train_loss: 0.3007, test_loss: 1.4523, test_f1: 0.6067
 epoch: 80, train_loss: 0.3037, test_loss: 1.4707, test_f1: 0.6148
 epoch: 81, train_loss: 0.3013, test_loss: 1.4919, test_f1: 0.6099
 epoch: 82, train_loss: 0.2990, test_loss: 1.4900, test_f1: 0.6171
 epoch: 83, train_loss: 0.3045, test_loss: 1.5072, test_f1: 0.6200
 epoch: 84, train_loss: 0.3124, test_loss: 1.5639, test_f1: 0.5963
 epoch: 85, train_loss: 0.3008, test_loss: 1.6517, test_f1: 0.5919
 epoch: 86, train_loss: 0.3058, test_loss: 1.5209, test_f1: 0.5920
 epoch: 87, train_loss: 0.3048, test_loss: 1.6166, test_f1: 0.5890
 epoch: 88, train_loss: 0.2807, test_loss: 1.5670, test_f1: 0.6203
 epoch: 89, train_loss: 0.2915, test_loss: 1.5995, test_f1: 0.5994
 epoch: 90, train_loss: 0.2930, test_loss: 1.5834, test_f1: 0.5978
 epoch: 91, train_loss: 0.2822, test_loss: 1.5518, test_f1: 0.6212
 epoch: 92, train_loss: 0.2713, test_loss: 1.5645, test_f1: 0.6108
 epoch: 93, train_loss: 0.2862, test_loss: 1.6198, test_f1: 0.6123
 epoch: 94, train_loss: 0.2663, test_loss: 1.6311, test_f1: 0.6087
 epoch: 95, train_loss: 0.2712, test_loss: 1.6325, test_f1: 0.6029
 epoch: 96, train_loss: 0.2782, test_loss: 1.5627, test_f1: 0.6047
 epoch: 97, train_loss: 0.2836, test_loss: 1.7055, test_f1: 0.5782
 epoch: 98, train_loss: 0.2742, test_loss: 1.5354, test_f1: 0.6168
 epoch: 99, train_loss: 0.2623, test_loss: 1.6178, test_f1: 0.6099

Training completed in 514.43 seconds
Best F1: 0.6937 at epoch 32
Mean F1 across iterations: 0.6504  0.0243
========================FINAL RESULTS================================
FEGIN weighted F1: 0.6937  0.0243
python main.py --data ltspice_demos --representation component_pin --model FEGIN --layers 2 --hiddens 128 --batch_size 32 --lr 0.0001 --emb_size 250 --epochs 100 --save_appendix component_pin_L2_H128_BS32_LR0.0001_E250 --no_val
-----



STDERR:
  File "main.py", line 370, in <module>
    main()
  File "main.py", line 254, in main
    dataset = dataset_class(
  File "/home/philip/projects/ltspice_examples_code_repo/Circuit-Completion-Using-GNNs/component_classification_with_link_prediction_head/evaluation/FEGIN/kernel/circuit_datasets.py", line 15, in __init__
    self.data, self.slices = torch.load(self.processed_paths[0])
  File "/home/philip/.local/lib/python3.8/site-packages/torch/serialization.py", line 1040, in load
    warnings.warn(
  File "/usr/lib/python3.8/warnings.py", line 109, in _showwarnmsg
    sw(msg.message, msg.category, msg.filename, msg.lineno,
  File "main.py", line 47, in warn_with_traceback
    traceback.print_stack(file=log)
/home/philip/projects/ltspice_examples_code_repo/Circuit-Completion-Using-GNNs/component_classification_with_link_prediction_head/evaluation/FEGIN/kernel/circuit_datasets.py:15: FutureWarning: You are using `torch.load` with `weights_only=False` (the current default value), which uses the default pickle module implicitly. It is possible to construct malicious pickle data which will execute arbitrary code during unpickling (See https://github.com/pytorch/pytorch/blob/main/SECURITY.md#untrusted-models for more details). In a future release, the default value for `weights_only` will be flipped to `True`. This limits the functions that could be executed during unpickling. Arbitrary objects will no longer be allowed to be loaded via this mode unless they are explicitly allowlisted by the user via `torch.serialization.add_safe_globals`. We recommend you start setting `weights_only=True` for any use case where you don't have full control of the loaded file. Please open an issue on GitHub for any issues related to this experimental feature.
  self.data, self.slices = torch.load(self.processed_paths[0])
