STDOUT:
Results will be saved in /home/philip/projects/ltspice_examples_code_repo/Circuit-Completion-Using-GNNs/component_classification_with_link_prediction_head/evaluation/FEGIN/results/model_FEGIN_dataset_ltspice_examples
Command line input: python main.py --data ltspice_examples --representation component_pin_net --model FEGIN --layers 2 --hiddens 64 --batch_size 256 --lr 0.01 --emb_size 128 --epochs 100 --save_appendix component_pin_net_L2_H64_BS256_LR0.01_E128 --no_val
 is saved.
-----
ltspice_examples - FEGIN
Using 2 layers, 64 hidden units, h = 2
Loading component_pin_net representation dataset
ENTERED
Training FEGIN on component_pin_net representation
Train: 3558, Test: 846
##################ITERATION #0 ****************************************
 epoch: 0, train_loss: 1.2062, test_loss: 1.4593, test_f1: 0.2270
 epoch: 1, train_loss: 1.0068, test_loss: 1.4603, test_f1: 0.2446
 epoch: 2, train_loss: 0.9754, test_loss: 1.2188, test_f1: 0.3884
 epoch: 3, train_loss: 0.9588, test_loss: 0.9764, test_f1: 0.4395
 epoch: 4, train_loss: 0.9335, test_loss: 0.9680, test_f1: 0.4959
 epoch: 5, train_loss: 0.9271, test_loss: 0.9489, test_f1: 0.4579
 epoch: 6, train_loss: 0.9054, test_loss: 0.9130, test_f1: 0.5052
 epoch: 7, train_loss: 0.8868, test_loss: 1.0865, test_f1: 0.4994
 epoch: 8, train_loss: 0.8647, test_loss: 1.2259, test_f1: 0.4151
 epoch: 9, train_loss: 0.8571, test_loss: 0.9705, test_f1: 0.4861
 epoch: 10, train_loss: 0.8361, test_loss: 0.8868, test_f1: 0.5746
 epoch: 11, train_loss: 0.8412, test_loss: 0.9480, test_f1: 0.5112
 epoch: 12, train_loss: 0.8160, test_loss: 0.9302, test_f1: 0.4783
 epoch: 13, train_loss: 0.8084, test_loss: 0.9878, test_f1: 0.5192
 epoch: 14, train_loss: 0.7851, test_loss: 0.9445, test_f1: 0.5724
 epoch: 15, train_loss: 0.7842, test_loss: 0.8297, test_f1: 0.5974
 epoch: 16, train_loss: 0.7615, test_loss: 0.9622, test_f1: 0.5477
 epoch: 17, train_loss: 0.7525, test_loss: 0.8959, test_f1: 0.5524
 epoch: 18, train_loss: 0.7390, test_loss: 0.9198, test_f1: 0.5625
 epoch: 19, train_loss: 0.7428, test_loss: 0.9197, test_f1: 0.5749
 epoch: 20, train_loss: 0.7158, test_loss: 0.9424, test_f1: 0.6265
 epoch: 21, train_loss: 0.7127, test_loss: 0.9761, test_f1: 0.5647
 epoch: 22, train_loss: 0.6783, test_loss: 0.8409, test_f1: 0.6206
 epoch: 23, train_loss: 0.6662, test_loss: 0.8126, test_f1: 0.6324
 epoch: 24, train_loss: 0.6704, test_loss: 0.9004, test_f1: 0.6340
 epoch: 25, train_loss: 0.6542, test_loss: 1.1091, test_f1: 0.5350
 epoch: 26, train_loss: 0.6596, test_loss: 0.8411, test_f1: 0.6365
 epoch: 27, train_loss: 0.6303, test_loss: 0.8873, test_f1: 0.6057
 epoch: 28, train_loss: 0.6395, test_loss: 0.9740, test_f1: 0.6101
 epoch: 29, train_loss: 0.6216, test_loss: 0.8695, test_f1: 0.6228
 epoch: 30, train_loss: 0.6141, test_loss: 0.9719, test_f1: 0.6066
 epoch: 31, train_loss: 0.5834, test_loss: 0.9793, test_f1: 0.6631
 epoch: 32, train_loss: 0.5757, test_loss: 1.0193, test_f1: 0.5358
 epoch: 33, train_loss: 0.5885, test_loss: 1.0722, test_f1: 0.5900
 epoch: 34, train_loss: 0.5725, test_loss: 0.9054, test_f1: 0.6459
 epoch: 35, train_loss: 0.5917, test_loss: 0.8235, test_f1: 0.6271
 epoch: 36, train_loss: 0.5770, test_loss: 0.8635, test_f1: 0.6526
 epoch: 37, train_loss: 0.5530, test_loss: 1.0248, test_f1: 0.5992
 epoch: 38, train_loss: 0.5437, test_loss: 1.0644, test_f1: 0.6310
 epoch: 39, train_loss: 0.5348, test_loss: 0.8441, test_f1: 0.6514
 epoch: 40, train_loss: 0.5321, test_loss: 0.8461, test_f1: 0.6643
 epoch: 41, train_loss: 0.5334, test_loss: 0.8834, test_f1: 0.6462
 epoch: 42, train_loss: 0.5281, test_loss: 1.0154, test_f1: 0.6257
 epoch: 43, train_loss: 0.5171, test_loss: 1.0782, test_f1: 0.6432
 epoch: 44, train_loss: 0.5059, test_loss: 1.0876, test_f1: 0.5963
 epoch: 45, train_loss: 0.5189, test_loss: 0.9227, test_f1: 0.6423
 epoch: 46, train_loss: 0.5130, test_loss: 0.9013, test_f1: 0.6553
 epoch: 47, train_loss: 0.5171, test_loss: 1.1766, test_f1: 0.6205
 epoch: 48, train_loss: 0.4899, test_loss: 0.9841, test_f1: 0.6304
 epoch: 49, train_loss: 0.4698, test_loss: 1.0345, test_f1: 0.6492
 epoch: 50, train_loss: 0.4660, test_loss: 1.2049, test_f1: 0.6535
 epoch: 51, train_loss: 0.4431, test_loss: 0.8583, test_f1: 0.6686
 epoch: 52, train_loss: 0.4203, test_loss: 0.9461, test_f1: 0.6721
 epoch: 53, train_loss: 0.3989, test_loss: 0.9379, test_f1: 0.6425
 epoch: 54, train_loss: 0.3958, test_loss: 1.0003, test_f1: 0.6596
 epoch: 55, train_loss: 0.3867, test_loss: 1.2010, test_f1: 0.6492
 epoch: 56, train_loss: 0.3863, test_loss: 0.9789, test_f1: 0.6504
 epoch: 57, train_loss: 0.4059, test_loss: 0.9570, test_f1: 0.6854
 epoch: 58, train_loss: 0.3719, test_loss: 0.9691, test_f1: 0.6690
 epoch: 59, train_loss: 0.3657, test_loss: 1.0031, test_f1: 0.6761
 epoch: 60, train_loss: 0.3495, test_loss: 1.0459, test_f1: 0.6639
 epoch: 61, train_loss: 0.3617, test_loss: 0.9972, test_f1: 0.6514
 epoch: 62, train_loss: 0.3563, test_loss: 1.0565, test_f1: 0.6839
 epoch: 63, train_loss: 0.3577, test_loss: 1.0332, test_f1: 0.6605
 epoch: 64, train_loss: 0.3423, test_loss: 1.0018, test_f1: 0.6978
 epoch: 65, train_loss: 0.3374, test_loss: 1.1813, test_f1: 0.6380
 epoch: 66, train_loss: 0.3535, test_loss: 1.1438, test_f1: 0.6389
 epoch: 67, train_loss: 0.3551, test_loss: 1.3247, test_f1: 0.6218
 epoch: 68, train_loss: 0.3277, test_loss: 1.1008, test_f1: 0.6613
 epoch: 69, train_loss: 0.3371, test_loss: 1.0976, test_f1: 0.6550
 epoch: 70, train_loss: 0.3384, test_loss: 1.2117, test_f1: 0.6337
 epoch: 71, train_loss: 0.3502, test_loss: 1.1259, test_f1: 0.6623
 epoch: 72, train_loss: 0.3249, test_loss: 0.9029, test_f1: 0.6615
 epoch: 73, train_loss: 0.3331, test_loss: 1.3461, test_f1: 0.6336
 epoch: 74, train_loss: 0.3289, test_loss: 1.3378, test_f1: 0.6466
 epoch: 75, train_loss: 0.3419, test_loss: 0.9720, test_f1: 0.6785
 epoch: 76, train_loss: 0.3058, test_loss: 0.9743, test_f1: 0.6652
 epoch: 77, train_loss: 0.3115, test_loss: 1.1157, test_f1: 0.6582
 epoch: 78, train_loss: 0.3376, test_loss: 1.1180, test_f1: 0.6753
 epoch: 79, train_loss: 0.3171, test_loss: 0.9653, test_f1: 0.6514
 epoch: 80, train_loss: 0.3127, test_loss: 1.0913, test_f1: 0.6750
 epoch: 81, train_loss: 0.3154, test_loss: 1.1875, test_f1: 0.6514
 epoch: 82, train_loss: 0.2972, test_loss: 1.1863, test_f1: 0.6934
 epoch: 83, train_loss: 0.3122, test_loss: 1.1217, test_f1: 0.6848
 epoch: 84, train_loss: 0.3122, test_loss: 1.3724, test_f1: 0.6824
 epoch: 85, train_loss: 0.3236, test_loss: 1.2226, test_f1: 0.6496
 epoch: 86, train_loss: 0.2981, test_loss: 1.2273, test_f1: 0.6466
 epoch: 87, train_loss: 0.2920, test_loss: 1.1927, test_f1: 0.6640
 epoch: 88, train_loss: 0.2973, test_loss: 1.0352, test_f1: 0.6852
 epoch: 89, train_loss: 0.3158, test_loss: 1.2383, test_f1: 0.6325
 epoch: 90, train_loss: 0.2905, test_loss: 1.0692, test_f1: 0.6882
 epoch: 91, train_loss: 0.2913, test_loss: 1.0979, test_f1: 0.6692
 epoch: 92, train_loss: 0.2689, test_loss: 1.1407, test_f1: 0.6772
 epoch: 93, train_loss: 0.2750, test_loss: 1.3695, test_f1: 0.6540
 epoch: 94, train_loss: 0.2734, test_loss: 1.1004, test_f1: 0.7007
 epoch: 95, train_loss: 0.2704, test_loss: 1.0834, test_f1: 0.6876
 epoch: 96, train_loss: 0.2917, test_loss: 1.1479, test_f1: 0.6733
 epoch: 97, train_loss: 0.2820, test_loss: 0.9911, test_f1: 0.6904
 epoch: 98, train_loss: 0.3093, test_loss: 1.0827, test_f1: 0.6665
 epoch: 99, train_loss: 0.2798, test_loss: 1.1120, test_f1: 0.6748
##################ITERATION #1 ****************************************
 epoch: 0, train_loss: 1.2166, test_loss: 1.4203, test_f1: 0.2392
 epoch: 1, train_loss: 1.0110, test_loss: 1.2695, test_f1: 0.2368
 epoch: 2, train_loss: 0.9670, test_loss: 0.9806, test_f1: 0.4238
 epoch: 3, train_loss: 0.9282, test_loss: 0.9868, test_f1: 0.4544
 epoch: 4, train_loss: 0.9176, test_loss: 0.9268, test_f1: 0.5054
 epoch: 5, train_loss: 0.8947, test_loss: 0.9074, test_f1: 0.5632
 epoch: 6, train_loss: 0.8587, test_loss: 0.9291, test_f1: 0.5577
 epoch: 7, train_loss: 0.8424, test_loss: 0.9277, test_f1: 0.5857
 epoch: 8, train_loss: 0.8286, test_loss: 0.8753, test_f1: 0.5766
 epoch: 9, train_loss: 0.7994, test_loss: 0.9473, test_f1: 0.5282
 epoch: 10, train_loss: 0.8017, test_loss: 0.9796, test_f1: 0.5217
 epoch: 11, train_loss: 0.7891, test_loss: 0.8846, test_f1: 0.6292
 epoch: 12, train_loss: 0.7615, test_loss: 1.2182, test_f1: 0.4171
 epoch: 13, train_loss: 0.7569, test_loss: 0.8410, test_f1: 0.6180
 epoch: 14, train_loss: 0.7298, test_loss: 0.9034, test_f1: 0.6095
 epoch: 15, train_loss: 0.7309, test_loss: 0.8431, test_f1: 0.6174
 epoch: 16, train_loss: 0.7292, test_loss: 1.0540, test_f1: 0.5656
 epoch: 17, train_loss: 0.7054, test_loss: 0.9102, test_f1: 0.6236
 epoch: 18, train_loss: 0.6876, test_loss: 0.8102, test_f1: 0.6238
 epoch: 19, train_loss: 0.6702, test_loss: 0.8673, test_f1: 0.6306
 epoch: 20, train_loss: 0.6555, test_loss: 0.9219, test_f1: 0.6396
 epoch: 21, train_loss: 0.6526, test_loss: 1.0099, test_f1: 0.5641
 epoch: 22, train_loss: 0.6558, test_loss: 0.9678, test_f1: 0.5506
 epoch: 23, train_loss: 0.6456, test_loss: 1.2724, test_f1: 0.5490
 epoch: 24, train_loss: 0.6492, test_loss: 0.9503, test_f1: 0.5916
 epoch: 25, train_loss: 0.6504, test_loss: 0.7862, test_f1: 0.6474
 epoch: 26, train_loss: 0.6122, test_loss: 1.4452, test_f1: 0.5203
 epoch: 27, train_loss: 0.6254, test_loss: 0.8968, test_f1: 0.5768
 epoch: 28, train_loss: 0.6227, test_loss: 1.0564, test_f1: 0.6051
 epoch: 29, train_loss: 0.5973, test_loss: 0.9420, test_f1: 0.5927
 epoch: 30, train_loss: 0.6214, test_loss: 1.0367, test_f1: 0.6455
 epoch: 31, train_loss: 0.5813, test_loss: 1.0321, test_f1: 0.6203
 epoch: 32, train_loss: 0.5820, test_loss: 0.9076, test_f1: 0.6192
 epoch: 33, train_loss: 0.5823, test_loss: 0.9720, test_f1: 0.6366
 epoch: 34, train_loss: 0.5739, test_loss: 1.1957, test_f1: 0.6188
 epoch: 35, train_loss: 0.5831, test_loss: 0.8504, test_f1: 0.6362
 epoch: 36, train_loss: 0.5600, test_loss: 0.9606, test_f1: 0.6444
 epoch: 37, train_loss: 0.5519, test_loss: 1.0411, test_f1: 0.6355
 epoch: 38, train_loss: 0.5504, test_loss: 1.1647, test_f1: 0.6170
 epoch: 39, train_loss: 0.5344, test_loss: 0.9116, test_f1: 0.6542
 epoch: 40, train_loss: 0.5473, test_loss: 0.9057, test_f1: 0.6219
 epoch: 41, train_loss: 0.5461, test_loss: 1.0147, test_f1: 0.5930
 epoch: 42, train_loss: 0.5170, test_loss: 0.9165, test_f1: 0.6361
 epoch: 43, train_loss: 0.5034, test_loss: 1.2002, test_f1: 0.6525
 epoch: 44, train_loss: 0.5117, test_loss: 1.2638, test_f1: 0.6391
 epoch: 45, train_loss: 0.5343, test_loss: 1.1708, test_f1: 0.6152
 epoch: 46, train_loss: 0.5102, test_loss: 1.1448, test_f1: 0.5972
 epoch: 47, train_loss: 0.5533, test_loss: 1.1801, test_f1: 0.5689
 epoch: 48, train_loss: 0.5366, test_loss: 1.1762, test_f1: 0.6231
 epoch: 49, train_loss: 0.4859, test_loss: 1.0987, test_f1: 0.6267
 epoch: 50, train_loss: 0.4818, test_loss: 1.3262, test_f1: 0.6356
 epoch: 51, train_loss: 0.4417, test_loss: 1.1596, test_f1: 0.6762
 epoch: 52, train_loss: 0.4359, test_loss: 1.2152, test_f1: 0.6532
 epoch: 53, train_loss: 0.4264, test_loss: 1.1840, test_f1: 0.6689
 epoch: 54, train_loss: 0.4002, test_loss: 1.2351, test_f1: 0.6696
 epoch: 55, train_loss: 0.4132, test_loss: 1.2873, test_f1: 0.6671
 epoch: 56, train_loss: 0.3916, test_loss: 1.3100, test_f1: 0.6596
 epoch: 57, train_loss: 0.3877, test_loss: 1.3040, test_f1: 0.6370
 epoch: 58, train_loss: 0.3738, test_loss: 1.3367, test_f1: 0.6711
 epoch: 59, train_loss: 0.3807, test_loss: 1.4588, test_f1: 0.6583
 epoch: 60, train_loss: 0.3695, test_loss: 1.4233, test_f1: 0.6773
 epoch: 61, train_loss: 0.3817, test_loss: 1.4211, test_f1: 0.6802
 epoch: 62, train_loss: 0.3684, test_loss: 1.2522, test_f1: 0.6645
 epoch: 63, train_loss: 0.3661, test_loss: 1.4626, test_f1: 0.6509
 epoch: 64, train_loss: 0.3544, test_loss: 1.4699, test_f1: 0.6417
 epoch: 65, train_loss: 0.3635, test_loss: 1.3887, test_f1: 0.6529
 epoch: 66, train_loss: 0.3568, test_loss: 1.5768, test_f1: 0.6573
 epoch: 67, train_loss: 0.3508, test_loss: 1.4797, test_f1: 0.6554
 epoch: 68, train_loss: 0.3733, test_loss: 1.4629, test_f1: 0.6336
 epoch: 69, train_loss: 0.3657, test_loss: 1.5311, test_f1: 0.6593
 epoch: 70, train_loss: 0.3378, test_loss: 1.5728, test_f1: 0.6766
 epoch: 71, train_loss: 0.3394, test_loss: 1.6007, test_f1: 0.6491
 epoch: 72, train_loss: 0.3585, test_loss: 1.4760, test_f1: 0.6455
 epoch: 73, train_loss: 0.3367, test_loss: 1.5966, test_f1: 0.6494
 epoch: 74, train_loss: 0.3278, test_loss: 1.5194, test_f1: 0.6287
 epoch: 75, train_loss: 0.3364, test_loss: 1.4375, test_f1: 0.6611
 epoch: 76, train_loss: 0.3216, test_loss: 1.4487, test_f1: 0.6552
 epoch: 77, train_loss: 0.3355, test_loss: 1.5183, test_f1: 0.6538
 epoch: 78, train_loss: 0.3173, test_loss: 1.6092, test_f1: 0.6398
 epoch: 79, train_loss: 0.3263, test_loss: 1.4277, test_f1: 0.6708
 epoch: 80, train_loss: 0.3111, test_loss: 1.4822, test_f1: 0.6678
 epoch: 81, train_loss: 0.3240, test_loss: 1.4121, test_f1: 0.6821
 epoch: 82, train_loss: 0.3144, test_loss: 1.5178, test_f1: 0.6645
 epoch: 83, train_loss: 0.2968, test_loss: 1.2936, test_f1: 0.6563
 epoch: 84, train_loss: 0.2938, test_loss: 1.4372, test_f1: 0.6631
 epoch: 85, train_loss: 0.3195, test_loss: 1.4746, test_f1: 0.6365
 epoch: 86, train_loss: 0.3040, test_loss: 1.6704, test_f1: 0.6347
 epoch: 87, train_loss: 0.3187, test_loss: 1.7211, test_f1: 0.6611
 epoch: 88, train_loss: 0.3240, test_loss: 1.4760, test_f1: 0.6553
 epoch: 89, train_loss: 0.3165, test_loss: 1.7233, test_f1: 0.6338
 epoch: 90, train_loss: 0.3072, test_loss: 1.3530, test_f1: 0.6433
 epoch: 91, train_loss: 0.3257, test_loss: 1.5244, test_f1: 0.6669
 epoch: 92, train_loss: 0.2976, test_loss: 1.6649, test_f1: 0.6164
 epoch: 93, train_loss: 0.2683, test_loss: 1.5762, test_f1: 0.6767
 epoch: 94, train_loss: 0.2708, test_loss: 1.7789, test_f1: 0.6789
 epoch: 95, train_loss: 0.2885, test_loss: 1.5906, test_f1: 0.6508
 epoch: 96, train_loss: 0.2831, test_loss: 1.7868, test_f1: 0.6526
 epoch: 97, train_loss: 0.2925, test_loss: 1.8453, test_f1: 0.6565
 epoch: 98, train_loss: 0.2884, test_loss: 1.5764, test_f1: 0.6671
 epoch: 99, train_loss: 0.2718, test_loss: 1.5747, test_f1: 0.6827
##################ITERATION #2 ****************************************
 epoch: 0, train_loss: 1.3694, test_loss: 1.6989, test_f1: 0.2270
 epoch: 1, train_loss: 1.0099, test_loss: 1.2232, test_f1: 0.3287
 epoch: 2, train_loss: 0.9470, test_loss: 1.0621, test_f1: 0.3911
 epoch: 3, train_loss: 0.9161, test_loss: 0.9502, test_f1: 0.4859
 epoch: 4, train_loss: 0.9180, test_loss: 0.9287, test_f1: 0.5269
 epoch: 5, train_loss: 0.8721, test_loss: 0.8986, test_f1: 0.5121
 epoch: 6, train_loss: 0.8671, test_loss: 0.8882, test_f1: 0.5350
 epoch: 7, train_loss: 0.8262, test_loss: 0.9422, test_f1: 0.5210
 epoch: 8, train_loss: 0.8263, test_loss: 0.9692, test_f1: 0.5033
 epoch: 9, train_loss: 0.8281, test_loss: 1.0184, test_f1: 0.5040
 epoch: 10, train_loss: 0.8146, test_loss: 0.8490, test_f1: 0.6108
 epoch: 11, train_loss: 0.8164, test_loss: 0.9962, test_f1: 0.5329
 epoch: 12, train_loss: 0.7813, test_loss: 0.8744, test_f1: 0.5234
 epoch: 13, train_loss: 0.7642, test_loss: 0.8485, test_f1: 0.5639
 epoch: 14, train_loss: 0.7440, test_loss: 0.8250, test_f1: 0.5604
 epoch: 15, train_loss: 0.7375, test_loss: 0.8615, test_f1: 0.5672
 epoch: 16, train_loss: 0.7273, test_loss: 0.8758, test_f1: 0.5942
 epoch: 17, train_loss: 0.7116, test_loss: 0.8528, test_f1: 0.6107
 epoch: 18, train_loss: 0.7067, test_loss: 0.8422, test_f1: 0.6261
 epoch: 19, train_loss: 0.7045, test_loss: 0.7770, test_f1: 0.6819
 epoch: 20, train_loss: 0.7055, test_loss: 0.8889, test_f1: 0.5931
 epoch: 21, train_loss: 0.6843, test_loss: 0.7840, test_f1: 0.6448
 epoch: 22, train_loss: 0.6963, test_loss: 0.7774, test_f1: 0.6385
 epoch: 23, train_loss: 0.6881, test_loss: 0.8183, test_f1: 0.6741
 epoch: 24, train_loss: 0.6468, test_loss: 0.8555, test_f1: 0.6133
 epoch: 25, train_loss: 0.6591, test_loss: 0.7824, test_f1: 0.6336
 epoch: 26, train_loss: 0.6461, test_loss: 0.9121, test_f1: 0.5804
 epoch: 27, train_loss: 0.6247, test_loss: 0.9454, test_f1: 0.5866
 epoch: 28, train_loss: 0.6096, test_loss: 0.8004, test_f1: 0.6322
 epoch: 29, train_loss: 0.6208, test_loss: 0.8534, test_f1: 0.6198
 epoch: 30, train_loss: 0.6232, test_loss: 0.8948, test_f1: 0.6034
 epoch: 31, train_loss: 0.5991, test_loss: 0.8220, test_f1: 0.6472
 epoch: 32, train_loss: 0.6080, test_loss: 1.1506, test_f1: 0.5497
 epoch: 33, train_loss: 0.6212, test_loss: 0.8673, test_f1: 0.6162
 epoch: 34, train_loss: 0.5918, test_loss: 0.9215, test_f1: 0.6276
 epoch: 35, train_loss: 0.5986, test_loss: 0.9648, test_f1: 0.5997
 epoch: 36, train_loss: 0.5920, test_loss: 0.9119, test_f1: 0.6278
 epoch: 37, train_loss: 0.5790, test_loss: 0.8336, test_f1: 0.6691
 epoch: 38, train_loss: 0.5309, test_loss: 0.7638, test_f1: 0.6674
 epoch: 39, train_loss: 0.5478, test_loss: 0.8202, test_f1: 0.6933
 epoch: 40, train_loss: 0.5464, test_loss: 0.8762, test_f1: 0.6463
 epoch: 41, train_loss: 0.5521, test_loss: 0.7919, test_f1: 0.6890
 epoch: 42, train_loss: 0.5482, test_loss: 0.9860, test_f1: 0.6094
 epoch: 43, train_loss: 0.5523, test_loss: 1.1598, test_f1: 0.5911
 epoch: 44, train_loss: 0.5282, test_loss: 0.9015, test_f1: 0.6724
 epoch: 45, train_loss: 0.5305, test_loss: 0.9185, test_f1: 0.6679
 epoch: 46, train_loss: 0.5127, test_loss: 0.9096, test_f1: 0.6286
 epoch: 47, train_loss: 0.5008, test_loss: 0.9551, test_f1: 0.6170
 epoch: 48, train_loss: 0.4880, test_loss: 0.9735, test_f1: 0.6667
 epoch: 49, train_loss: 0.4945, test_loss: 1.0041, test_f1: 0.6355
 epoch: 50, train_loss: 0.4995, test_loss: 1.0603, test_f1: 0.6246
 epoch: 51, train_loss: 0.4691, test_loss: 0.9430, test_f1: 0.6967
 epoch: 52, train_loss: 0.4369, test_loss: 0.9726, test_f1: 0.6659
 epoch: 53, train_loss: 0.4360, test_loss: 1.1468, test_f1: 0.6036
 epoch: 54, train_loss: 0.4056, test_loss: 1.0053, test_f1: 0.6676
 epoch: 55, train_loss: 0.4134, test_loss: 0.9468, test_f1: 0.6783
 epoch: 56, train_loss: 0.4018, test_loss: 1.0439, test_f1: 0.6771
 epoch: 57, train_loss: 0.4075, test_loss: 0.9577, test_f1: 0.6788
 epoch: 58, train_loss: 0.3979, test_loss: 1.1114, test_f1: 0.6623
 epoch: 59, train_loss: 0.3781, test_loss: 1.0101, test_f1: 0.6655
 epoch: 60, train_loss: 0.4057, test_loss: 0.9547, test_f1: 0.6605
 epoch: 61, train_loss: 0.4142, test_loss: 1.0821, test_f1: 0.6467
 epoch: 62, train_loss: 0.3805, test_loss: 1.1443, test_f1: 0.6590
 epoch: 63, train_loss: 0.3839, test_loss: 1.1429, test_f1: 0.6483
 epoch: 64, train_loss: 0.3776, test_loss: 1.0514, test_f1: 0.7005
 epoch: 65, train_loss: 0.3635, test_loss: 1.0628, test_f1: 0.6784
 epoch: 66, train_loss: 0.3684, test_loss: 1.0607, test_f1: 0.6854
 epoch: 67, train_loss: 0.3538, test_loss: 1.0494, test_f1: 0.6816
 epoch: 68, train_loss: 0.3856, test_loss: 1.1482, test_f1: 0.6133
 epoch: 69, train_loss: 0.3852, test_loss: 1.1003, test_f1: 0.6693
 epoch: 70, train_loss: 0.3745, test_loss: 1.0736, test_f1: 0.6453
 epoch: 71, train_loss: 0.3498, test_loss: 0.9481, test_f1: 0.6806
 epoch: 72, train_loss: 0.3697, test_loss: 1.1451, test_f1: 0.6739
 epoch: 73, train_loss: 0.3660, test_loss: 1.1560, test_f1: 0.6611
 epoch: 74, train_loss: 0.3621, test_loss: 1.1799, test_f1: 0.6628
 epoch: 75, train_loss: 0.3443, test_loss: 1.0520, test_f1: 0.6444
 epoch: 76, train_loss: 0.3637, test_loss: 1.1234, test_f1: 0.6573
 epoch: 77, train_loss: 0.3431, test_loss: 1.1052, test_f1: 0.6600
 epoch: 78, train_loss: 0.3616, test_loss: 1.1182, test_f1: 0.6537
 epoch: 79, train_loss: 0.3525, test_loss: 1.2686, test_f1: 0.6350
 epoch: 80, train_loss: 0.3360, test_loss: 1.0961, test_f1: 0.7076
 epoch: 81, train_loss: 0.3380, test_loss: 1.2567, test_f1: 0.6840
 epoch: 82, train_loss: 0.3495, test_loss: 1.1782, test_f1: 0.6867
 epoch: 83, train_loss: 0.3263, test_loss: 1.1812, test_f1: 0.6544
 epoch: 84, train_loss: 0.3173, test_loss: 1.2362, test_f1: 0.6728
 epoch: 85, train_loss: 0.3365, test_loss: 1.2622, test_f1: 0.6748
 epoch: 86, train_loss: 0.3700, test_loss: 1.1555, test_f1: 0.6480
 epoch: 87, train_loss: 0.3514, test_loss: 1.1160, test_f1: 0.6524
 epoch: 88, train_loss: 0.3375, test_loss: 1.2581, test_f1: 0.6715
 epoch: 89, train_loss: 0.3238, test_loss: 1.2589, test_f1: 0.6855
 epoch: 90, train_loss: 0.3144, test_loss: 1.2697, test_f1: 0.6755
 epoch: 91, train_loss: 0.3003, test_loss: 1.2351, test_f1: 0.6577
 epoch: 92, train_loss: 0.3121, test_loss: 1.2343, test_f1: 0.6571
 epoch: 93, train_loss: 0.3066, test_loss: 1.2423, test_f1: 0.6583
 epoch: 94, train_loss: 0.3029, test_loss: 1.2460, test_f1: 0.6468
 epoch: 95, train_loss: 0.3197, test_loss: 1.2463, test_f1: 0.6550
 epoch: 96, train_loss: 0.3085, test_loss: 1.2036, test_f1: 0.6511
 epoch: 97, train_loss: 0.3220, test_loss: 1.2135, test_f1: 0.6812
 epoch: 98, train_loss: 0.2887, test_loss: 1.2065, test_f1: 0.6782
 epoch: 99, train_loss: 0.3090, test_loss: 1.2242, test_f1: 0.6508
##################ITERATION #3 ****************************************
 epoch: 0, train_loss: 1.4237, test_loss: 1.2225, test_f1: 0.2270
 epoch: 1, train_loss: 1.0500, test_loss: 1.0815, test_f1: 0.3895
 epoch: 2, train_loss: 0.9998, test_loss: 1.0325, test_f1: 0.3608
 epoch: 3, train_loss: 0.9831, test_loss: 1.0021, test_f1: 0.4094
 epoch: 4, train_loss: 0.9504, test_loss: 0.9890, test_f1: 0.4832
 epoch: 5, train_loss: 0.9219, test_loss: 0.9745, test_f1: 0.4648
 epoch: 6, train_loss: 0.9097, test_loss: 0.9609, test_f1: 0.5057
 epoch: 7, train_loss: 0.9107, test_loss: 0.9511, test_f1: 0.5283
 epoch: 8, train_loss: 0.8910, test_loss: 0.8523, test_f1: 0.5593
 epoch: 9, train_loss: 0.8564, test_loss: 0.9606, test_f1: 0.5022
 epoch: 10, train_loss: 0.8430, test_loss: 0.9578, test_f1: 0.5417
 epoch: 11, train_loss: 0.8276, test_loss: 0.9141, test_f1: 0.5236
 epoch: 12, train_loss: 0.8303, test_loss: 0.9150, test_f1: 0.5617
 epoch: 13, train_loss: 0.8118, test_loss: 0.9368, test_f1: 0.5429
 epoch: 14, train_loss: 0.8149, test_loss: 1.0901, test_f1: 0.4577
 epoch: 15, train_loss: 0.7838, test_loss: 1.1776, test_f1: 0.5253
 epoch: 16, train_loss: 0.8095, test_loss: 0.9037, test_f1: 0.5840
 epoch: 17, train_loss: 0.7791, test_loss: 1.0674, test_f1: 0.5249
 epoch: 18, train_loss: 0.7712, test_loss: 0.8986, test_f1: 0.5751
 epoch: 19, train_loss: 0.7387, test_loss: 0.8438, test_f1: 0.6056
 epoch: 20, train_loss: 0.7300, test_loss: 0.8886, test_f1: 0.6173
 epoch: 21, train_loss: 0.7261, test_loss: 0.8661, test_f1: 0.5999
 epoch: 22, train_loss: 0.7169, test_loss: 0.8891, test_f1: 0.5918
 epoch: 23, train_loss: 0.7148, test_loss: 0.8351, test_f1: 0.6307
 epoch: 24, train_loss: 0.7020, test_loss: 0.8106, test_f1: 0.6565
 epoch: 25, train_loss: 0.6924, test_loss: 0.8870, test_f1: 0.6213
 epoch: 26, train_loss: 0.6807, test_loss: 0.8326, test_f1: 0.6113
 epoch: 27, train_loss: 0.6890, test_loss: 0.7713, test_f1: 0.6283
 epoch: 28, train_loss: 0.6757, test_loss: 0.9739, test_f1: 0.5679
 epoch: 29, train_loss: 0.6586, test_loss: 0.7406, test_f1: 0.6485
 epoch: 30, train_loss: 0.6485, test_loss: 1.0713, test_f1: 0.5448
 epoch: 31, train_loss: 0.6441, test_loss: 0.8773, test_f1: 0.6428
 epoch: 32, train_loss: 0.6520, test_loss: 1.0963, test_f1: 0.5364
 epoch: 33, train_loss: 0.6383, test_loss: 0.8311, test_f1: 0.6308
 epoch: 34, train_loss: 0.6391, test_loss: 0.8433, test_f1: 0.6451
 epoch: 35, train_loss: 0.6085, test_loss: 0.9088, test_f1: 0.6197
 epoch: 36, train_loss: 0.6168, test_loss: 0.9899, test_f1: 0.6058
 epoch: 37, train_loss: 0.5889, test_loss: 0.8791, test_f1: 0.6584
 epoch: 38, train_loss: 0.5899, test_loss: 0.8075, test_f1: 0.6585
 epoch: 39, train_loss: 0.5836, test_loss: 0.9225, test_f1: 0.6388
 epoch: 40, train_loss: 0.5721, test_loss: 0.9343, test_f1: 0.6509
 epoch: 41, train_loss: 0.5587, test_loss: 0.9479, test_f1: 0.6452
 epoch: 42, train_loss: 0.5926, test_loss: 0.8268, test_f1: 0.6648
 epoch: 43, train_loss: 0.5853, test_loss: 0.8856, test_f1: 0.6398
 epoch: 44, train_loss: 0.5746, test_loss: 0.8722, test_f1: 0.6373
 epoch: 45, train_loss: 0.5575, test_loss: 1.1991, test_f1: 0.5400
 epoch: 46, train_loss: 0.5595, test_loss: 0.9381, test_f1: 0.6480
 epoch: 47, train_loss: 0.5446, test_loss: 0.9061, test_f1: 0.6496
 epoch: 48, train_loss: 0.5393, test_loss: 0.8397, test_f1: 0.6579
 epoch: 49, train_loss: 0.5592, test_loss: 0.9344, test_f1: 0.6683
 epoch: 50, train_loss: 0.5283, test_loss: 0.9723, test_f1: 0.6117
 epoch: 51, train_loss: 0.5097, test_loss: 0.9050, test_f1: 0.6583
 epoch: 52, train_loss: 0.4799, test_loss: 0.8660, test_f1: 0.6756
 epoch: 53, train_loss: 0.4718, test_loss: 0.9051, test_f1: 0.6731
 epoch: 54, train_loss: 0.4574, test_loss: 1.0451, test_f1: 0.6041
 epoch: 55, train_loss: 0.4534, test_loss: 0.8632, test_f1: 0.6822
 epoch: 56, train_loss: 0.4268, test_loss: 0.9325, test_f1: 0.6861
 epoch: 57, train_loss: 0.4261, test_loss: 1.0026, test_f1: 0.6528
 epoch: 58, train_loss: 0.4174, test_loss: 0.9666, test_f1: 0.6685
 epoch: 59, train_loss: 0.4233, test_loss: 0.9822, test_f1: 0.6418
 epoch: 60, train_loss: 0.4287, test_loss: 0.9023, test_f1: 0.6679
 epoch: 61, train_loss: 0.4431, test_loss: 0.8361, test_f1: 0.6614
 epoch: 62, train_loss: 0.4262, test_loss: 0.9450, test_f1: 0.6517
 epoch: 63, train_loss: 0.4193, test_loss: 0.8644, test_f1: 0.6893
 epoch: 64, train_loss: 0.4068, test_loss: 0.8767, test_f1: 0.6606
 epoch: 65, train_loss: 0.4075, test_loss: 0.9491, test_f1: 0.6395
 epoch: 66, train_loss: 0.4182, test_loss: 0.8546, test_f1: 0.6793
 epoch: 67, train_loss: 0.4125, test_loss: 1.0017, test_f1: 0.6619
 epoch: 68, train_loss: 0.4139, test_loss: 0.9400, test_f1: 0.6717
 epoch: 69, train_loss: 0.4051, test_loss: 0.9181, test_f1: 0.6901
 epoch: 70, train_loss: 0.4000, test_loss: 0.8328, test_f1: 0.7031
 epoch: 71, train_loss: 0.3863, test_loss: 0.9288, test_f1: 0.6951
 epoch: 72, train_loss: 0.4024, test_loss: 0.9672, test_f1: 0.6480
 epoch: 73, train_loss: 0.4054, test_loss: 0.8298, test_f1: 0.6916
 epoch: 74, train_loss: 0.3837, test_loss: 0.9286, test_f1: 0.7045
 epoch: 75, train_loss: 0.3946, test_loss: 1.0162, test_f1: 0.6616
 epoch: 76, train_loss: 0.3731, test_loss: 0.9606, test_f1: 0.6586
 epoch: 77, train_loss: 0.3921, test_loss: 0.9553, test_f1: 0.6615
 epoch: 78, train_loss: 0.3684, test_loss: 1.0155, test_f1: 0.6686
 epoch: 79, train_loss: 0.3744, test_loss: 1.0631, test_f1: 0.6633
 epoch: 80, train_loss: 0.3690, test_loss: 1.0100, test_f1: 0.6909
 epoch: 81, train_loss: 0.3794, test_loss: 0.9602, test_f1: 0.6799
 epoch: 82, train_loss: 0.3596, test_loss: 1.0480, test_f1: 0.6736
 epoch: 83, train_loss: 0.3881, test_loss: 0.9918, test_f1: 0.6685
 epoch: 84, train_loss: 0.3770, test_loss: 0.9840, test_f1: 0.6871
 epoch: 85, train_loss: 0.3362, test_loss: 1.0305, test_f1: 0.6785
 epoch: 86, train_loss: 0.3653, test_loss: 0.9786, test_f1: 0.6649
 epoch: 87, train_loss: 0.3639, test_loss: 1.1096, test_f1: 0.6479
 epoch: 88, train_loss: 0.3548, test_loss: 1.1218, test_f1: 0.6585
 epoch: 89, train_loss: 0.3568, test_loss: 1.1198, test_f1: 0.6311
 epoch: 90, train_loss: 0.3747, test_loss: 1.0673, test_f1: 0.6671
 epoch: 91, train_loss: 0.3360, test_loss: 1.0343, test_f1: 0.6670
 epoch: 92, train_loss: 0.3408, test_loss: 0.9178, test_f1: 0.6629
 epoch: 93, train_loss: 0.3491, test_loss: 0.9711, test_f1: 0.6747
 epoch: 94, train_loss: 0.3536, test_loss: 0.9869, test_f1: 0.6589
 epoch: 95, train_loss: 0.3388, test_loss: 0.8393, test_f1: 0.6970
 epoch: 96, train_loss: 0.3414, test_loss: 0.9197, test_f1: 0.6781
 epoch: 97, train_loss: 0.3163, test_loss: 1.1022, test_f1: 0.6515
 epoch: 98, train_loss: 0.3116, test_loss: 1.0494, test_f1: 0.6923
 epoch: 99, train_loss: 0.3233, test_loss: 0.9855, test_f1: 0.7024
##################ITERATION #4 ****************************************
 epoch: 0, train_loss: 1.2966, test_loss: 1.5216, test_f1: 0.2804
 epoch: 1, train_loss: 0.9842, test_loss: 1.3496, test_f1: 0.2666
 epoch: 2, train_loss: 0.9501, test_loss: 1.1173, test_f1: 0.3381
 epoch: 3, train_loss: 0.9236, test_loss: 0.9465, test_f1: 0.5399
 epoch: 4, train_loss: 0.8939, test_loss: 0.9394, test_f1: 0.5562
 epoch: 5, train_loss: 0.8767, test_loss: 1.0508, test_f1: 0.5014
 epoch: 6, train_loss: 0.8601, test_loss: 0.8562, test_f1: 0.5311
 epoch: 7, train_loss: 0.8650, test_loss: 0.9211, test_f1: 0.5116
 epoch: 8, train_loss: 0.8389, test_loss: 1.2679, test_f1: 0.4608
 epoch: 9, train_loss: 0.8235, test_loss: 0.8419, test_f1: 0.5757
 epoch: 10, train_loss: 0.7941, test_loss: 0.9700, test_f1: 0.5688
 epoch: 11, train_loss: 0.7837, test_loss: 0.9065, test_f1: 0.5916
 epoch: 12, train_loss: 0.7650, test_loss: 0.9605, test_f1: 0.5466
 epoch: 13, train_loss: 0.7616, test_loss: 0.9417, test_f1: 0.5902
 epoch: 14, train_loss: 0.7635, test_loss: 0.9819, test_f1: 0.5474
 epoch: 15, train_loss: 0.7605, test_loss: 1.0362, test_f1: 0.5314
 epoch: 16, train_loss: 0.7567, test_loss: 1.3177, test_f1: 0.4909
 epoch: 17, train_loss: 0.7152, test_loss: 0.8503, test_f1: 0.6402
 epoch: 18, train_loss: 0.7176, test_loss: 0.9768, test_f1: 0.6053
 epoch: 19, train_loss: 0.6981, test_loss: 0.9976, test_f1: 0.5759
 epoch: 20, train_loss: 0.6908, test_loss: 1.0736, test_f1: 0.5350
 epoch: 21, train_loss: 0.6897, test_loss: 0.9012, test_f1: 0.5980
 epoch: 22, train_loss: 0.6936, test_loss: 0.9844, test_f1: 0.5952
 epoch: 23, train_loss: 0.6612, test_loss: 1.0084, test_f1: 0.5836
 epoch: 24, train_loss: 0.6542, test_loss: 0.9783, test_f1: 0.5681
 epoch: 25, train_loss: 0.6583, test_loss: 0.9809, test_f1: 0.6366
 epoch: 26, train_loss: 0.6231, test_loss: 1.1379, test_f1: 0.5724
 epoch: 27, train_loss: 0.6354, test_loss: 1.4932, test_f1: 0.4517
 epoch: 28, train_loss: 0.6563, test_loss: 1.0245, test_f1: 0.5652
 epoch: 29, train_loss: 0.6302, test_loss: 1.0002, test_f1: 0.6239
 epoch: 30, train_loss: 0.6363, test_loss: 1.0105, test_f1: 0.5774
 epoch: 31, train_loss: 0.6514, test_loss: 1.0076, test_f1: 0.5924
 epoch: 32, train_loss: 0.6178, test_loss: 1.1115, test_f1: 0.6055
 epoch: 33, train_loss: 0.6057, test_loss: 1.0985, test_f1: 0.6207
 epoch: 34, train_loss: 0.6144, test_loss: 1.0195, test_f1: 0.5896
 epoch: 35, train_loss: 0.6040, test_loss: 0.9716, test_f1: 0.6294
 epoch: 36, train_loss: 0.5712, test_loss: 0.9310, test_f1: 0.6581
 epoch: 37, train_loss: 0.5669, test_loss: 1.0219, test_f1: 0.6104
 epoch: 38, train_loss: 0.5705, test_loss: 1.0449, test_f1: 0.6256
 epoch: 39, train_loss: 0.5523, test_loss: 1.0830, test_f1: 0.6426
 epoch: 40, train_loss: 0.5261, test_loss: 1.0468, test_f1: 0.6913
 epoch: 41, train_loss: 0.5420, test_loss: 1.0464, test_f1: 0.6148
 epoch: 42, train_loss: 0.5724, test_loss: 1.2334, test_f1: 0.5883
 epoch: 43, train_loss: 0.5557, test_loss: 1.1830, test_f1: 0.6103
 epoch: 44, train_loss: 0.5298, test_loss: 1.1345, test_f1: 0.6152
 epoch: 45, train_loss: 0.5186, test_loss: 1.1005, test_f1: 0.6414
 epoch: 46, train_loss: 0.5088, test_loss: 1.1431, test_f1: 0.6046
 epoch: 47, train_loss: 0.5233, test_loss: 1.0153, test_f1: 0.6516
 epoch: 48, train_loss: 0.5005, test_loss: 1.2301, test_f1: 0.5966
 epoch: 49, train_loss: 0.5137, test_loss: 1.4214, test_f1: 0.5764
 epoch: 50, train_loss: 0.5279, test_loss: 1.1270, test_f1: 0.6498
 epoch: 51, train_loss: 0.4906, test_loss: 1.1378, test_f1: 0.6586
 epoch: 52, train_loss: 0.4512, test_loss: 1.1451, test_f1: 0.5930
 epoch: 53, train_loss: 0.4494, test_loss: 1.0875, test_f1: 0.6678
 epoch: 54, train_loss: 0.4428, test_loss: 1.1023, test_f1: 0.6680
 epoch: 55, train_loss: 0.4333, test_loss: 1.2382, test_f1: 0.6296
 epoch: 56, train_loss: 0.4196, test_loss: 1.2016, test_f1: 0.6595
 epoch: 57, train_loss: 0.4320, test_loss: 1.2045, test_f1: 0.6453
 epoch: 58, train_loss: 0.3969, test_loss: 1.1537, test_f1: 0.6678
 epoch: 59, train_loss: 0.4092, test_loss: 1.2421, test_f1: 0.6732
 epoch: 60, train_loss: 0.3993, test_loss: 1.2990, test_f1: 0.6485
 epoch: 61, train_loss: 0.3983, test_loss: 1.3381, test_f1: 0.6269
 epoch: 62, train_loss: 0.3977, test_loss: 1.2574, test_f1: 0.6577
 epoch: 63, train_loss: 0.3855, test_loss: 1.3390, test_f1: 0.6543
 epoch: 64, train_loss: 0.4056, test_loss: 1.2486, test_f1: 0.6457
 epoch: 65, train_loss: 0.3906, test_loss: 1.3505, test_f1: 0.6161
 epoch: 66, train_loss: 0.3860, test_loss: 1.3870, test_f1: 0.6287
 epoch: 67, train_loss: 0.4039, test_loss: 1.2936, test_f1: 0.6194
 epoch: 68, train_loss: 0.4045, test_loss: 1.2296, test_f1: 0.6664
 epoch: 69, train_loss: 0.3988, test_loss: 1.3118, test_f1: 0.6411
 epoch: 70, train_loss: 0.3971, test_loss: 1.4535, test_f1: 0.6230
 epoch: 71, train_loss: 0.4096, test_loss: 1.3497, test_f1: 0.6592
 epoch: 72, train_loss: 0.4080, test_loss: 1.2912, test_f1: 0.6250
 epoch: 73, train_loss: 0.3876, test_loss: 1.2825, test_f1: 0.6698
 epoch: 74, train_loss: 0.3781, test_loss: 1.3073, test_f1: 0.6404
 epoch: 75, train_loss: 0.3880, test_loss: 1.2907, test_f1: 0.6621
 epoch: 76, train_loss: 0.3687, test_loss: 1.3909, test_f1: 0.6100
 epoch: 77, train_loss: 0.3680, test_loss: 1.3135, test_f1: 0.6425
 epoch: 78, train_loss: 0.3729, test_loss: 1.2640, test_f1: 0.6515
 epoch: 79, train_loss: 0.3501, test_loss: 1.4543, test_f1: 0.6150
 epoch: 80, train_loss: 0.3559, test_loss: 1.4959, test_f1: 0.6152
 epoch: 81, train_loss: 0.3588, test_loss: 1.5044, test_f1: 0.6309
 epoch: 82, train_loss: 0.3704, test_loss: 1.2915, test_f1: 0.6591
 epoch: 83, train_loss: 0.3426, test_loss: 1.3479, test_f1: 0.6256
 epoch: 84, train_loss: 0.3325, test_loss: 1.3105, test_f1: 0.6347
 epoch: 85, train_loss: 0.3554, test_loss: 1.2746, test_f1: 0.6582
 epoch: 86, train_loss: 0.3832, test_loss: 1.4780, test_f1: 0.6313
 epoch: 87, train_loss: 0.3678, test_loss: 1.5335, test_f1: 0.6610
 epoch: 88, train_loss: 0.3527, test_loss: 1.6864, test_f1: 0.6236
 epoch: 89, train_loss: 0.3570, test_loss: 1.4289, test_f1: 0.6305
 epoch: 90, train_loss: 0.3481, test_loss: 1.3817, test_f1: 0.6428
 epoch: 91, train_loss: 0.3435, test_loss: 1.4530, test_f1: 0.6470
 epoch: 92, train_loss: 0.3218, test_loss: 1.4534, test_f1: 0.6098
 epoch: 93, train_loss: 0.3494, test_loss: 1.2543, test_f1: 0.6572
 epoch: 94, train_loss: 0.3113, test_loss: 1.3010, test_f1: 0.6748
 epoch: 95, train_loss: 0.3385, test_loss: 1.3386, test_f1: 0.6487
 epoch: 96, train_loss: 0.3299, test_loss: 1.4281, test_f1: 0.6606
 epoch: 97, train_loss: 0.3331, test_loss: 1.5693, test_f1: 0.6397
 epoch: 98, train_loss: 0.3078, test_loss: 1.4437, test_f1: 0.6341
 epoch: 99, train_loss: 0.3249, test_loss: 1.5074, test_f1: 0.6725
##################ITERATION #5 ****************************************
 epoch: 0, train_loss: 1.4503, test_loss: 1.3288, test_f1: 0.2270
 epoch: 1, train_loss: 1.0153, test_loss: 1.1145, test_f1: 0.3672
 epoch: 2, train_loss: 0.9771, test_loss: 1.0076, test_f1: 0.4157
 epoch: 3, train_loss: 0.9498, test_loss: 0.9563, test_f1: 0.4635
 epoch: 4, train_loss: 0.9260, test_loss: 0.9896, test_f1: 0.4875
 epoch: 5, train_loss: 0.9051, test_loss: 1.0225, test_f1: 0.4416
 epoch: 6, train_loss: 0.8787, test_loss: 0.9623, test_f1: 0.5133
 epoch: 7, train_loss: 0.8616, test_loss: 0.9863, test_f1: 0.4567
 epoch: 8, train_loss: 0.8601, test_loss: 1.0743, test_f1: 0.5319
 epoch: 9, train_loss: 0.8573, test_loss: 0.9119, test_f1: 0.4966
 epoch: 10, train_loss: 0.8362, test_loss: 0.9303, test_f1: 0.5393
 epoch: 11, train_loss: 0.8100, test_loss: 0.9034, test_f1: 0.5537
 epoch: 12, train_loss: 0.8032, test_loss: 0.8992, test_f1: 0.5284
 epoch: 13, train_loss: 0.7833, test_loss: 0.8931, test_f1: 0.5829
 epoch: 14, train_loss: 0.7677, test_loss: 0.9059, test_f1: 0.5491
 epoch: 15, train_loss: 0.7725, test_loss: 0.8744, test_f1: 0.5342
 epoch: 16, train_loss: 0.7713, test_loss: 0.8864, test_f1: 0.5726
 epoch: 17, train_loss: 0.7527, test_loss: 0.9329, test_f1: 0.5590
 epoch: 18, train_loss: 0.7402, test_loss: 1.1287, test_f1: 0.5202
 epoch: 19, train_loss: 0.7491, test_loss: 0.8575, test_f1: 0.5802
 epoch: 20, train_loss: 0.7419, test_loss: 0.9352, test_f1: 0.5738
 epoch: 21, train_loss: 0.7293, test_loss: 0.7836, test_f1: 0.5592
 epoch: 22, train_loss: 0.7238, test_loss: 0.9088, test_f1: 0.6084
 epoch: 23, train_loss: 0.7061, test_loss: 0.9500, test_f1: 0.5907
 epoch: 24, train_loss: 0.7065, test_loss: 0.9245, test_f1: 0.5618
 epoch: 25, train_loss: 0.7027, test_loss: 1.6013, test_f1: 0.4680
 epoch: 26, train_loss: 0.7074, test_loss: 0.8593, test_f1: 0.5968
 epoch: 27, train_loss: 0.6896, test_loss: 0.8347, test_f1: 0.5705
 epoch: 28, train_loss: 0.7030, test_loss: 0.8801, test_f1: 0.6119
 epoch: 29, train_loss: 0.6751, test_loss: 0.8371, test_f1: 0.6628
 epoch: 30, train_loss: 0.6833, test_loss: 0.8953, test_f1: 0.5874
 epoch: 31, train_loss: 0.6636, test_loss: 0.8493, test_f1: 0.6145
 epoch: 32, train_loss: 0.6480, test_loss: 0.8906, test_f1: 0.6039
 epoch: 33, train_loss: 0.6399, test_loss: 0.8135, test_f1: 0.6267
 epoch: 34, train_loss: 0.6475, test_loss: 0.9143, test_f1: 0.6303
 epoch: 35, train_loss: 0.6157, test_loss: 1.0315, test_f1: 0.6075
 epoch: 36, train_loss: 0.6313, test_loss: 0.8958, test_f1: 0.6516
 epoch: 37, train_loss: 0.6241, test_loss: 0.8522, test_f1: 0.6362
 epoch: 38, train_loss: 0.6106, test_loss: 0.9188, test_f1: 0.6199
 epoch: 39, train_loss: 0.6035, test_loss: 0.8500, test_f1: 0.6771
 epoch: 40, train_loss: 0.5940, test_loss: 0.8992, test_f1: 0.6428
 epoch: 41, train_loss: 0.5956, test_loss: 0.7624, test_f1: 0.6766
 epoch: 42, train_loss: 0.5751, test_loss: 0.8311, test_f1: 0.6575
 epoch: 43, train_loss: 0.5808, test_loss: 0.8352, test_f1: 0.6498
 epoch: 44, train_loss: 0.5825, test_loss: 0.8782, test_f1: 0.6483
 epoch: 45, train_loss: 0.5643, test_loss: 0.9481, test_f1: 0.5948
 epoch: 46, train_loss: 0.5597, test_loss: 0.8658, test_f1: 0.6642
 epoch: 47, train_loss: 0.5470, test_loss: 0.8949, test_f1: 0.6441
 epoch: 48, train_loss: 0.5596, test_loss: 1.0816, test_f1: 0.6209
 epoch: 49, train_loss: 0.5765, test_loss: 1.0445, test_f1: 0.5861
 epoch: 50, train_loss: 0.5438, test_loss: 1.1421, test_f1: 0.6508
 epoch: 51, train_loss: 0.5332, test_loss: 0.8702, test_f1: 0.6613
 epoch: 52, train_loss: 0.4844, test_loss: 0.9053, test_f1: 0.6835
 epoch: 53, train_loss: 0.4869, test_loss: 0.9264, test_f1: 0.6760
 epoch: 54, train_loss: 0.4951, test_loss: 1.0405, test_f1: 0.6492
 epoch: 55, train_loss: 0.4899, test_loss: 0.9606, test_f1: 0.6816
 epoch: 56, train_loss: 0.4658, test_loss: 0.9430, test_f1: 0.6703
 epoch: 57, train_loss: 0.4701, test_loss: 0.9749, test_f1: 0.6722
 epoch: 58, train_loss: 0.4414, test_loss: 1.0345, test_f1: 0.6561
 epoch: 59, train_loss: 0.4446, test_loss: 1.1225, test_f1: 0.6324
 epoch: 60, train_loss: 0.4703, test_loss: 1.0057, test_f1: 0.6691
 epoch: 61, train_loss: 0.4584, test_loss: 1.0726, test_f1: 0.6558
 epoch: 62, train_loss: 0.4379, test_loss: 0.9826, test_f1: 0.6578
 epoch: 63, train_loss: 0.4349, test_loss: 1.0590, test_f1: 0.6307
 epoch: 64, train_loss: 0.4550, test_loss: 1.0983, test_f1: 0.6613
 epoch: 65, train_loss: 0.4563, test_loss: 0.9461, test_f1: 0.6402
 epoch: 66, train_loss: 0.4443, test_loss: 1.0850, test_f1: 0.6376
 epoch: 67, train_loss: 0.4502, test_loss: 1.0664, test_f1: 0.6791
 epoch: 68, train_loss: 0.4363, test_loss: 1.0203, test_f1: 0.6666
 epoch: 69, train_loss: 0.4152, test_loss: 1.0410, test_f1: 0.6655
 epoch: 70, train_loss: 0.4172, test_loss: 1.0957, test_f1: 0.6588
 epoch: 71, train_loss: 0.4187, test_loss: 1.2149, test_f1: 0.6627
 epoch: 72, train_loss: 0.4174, test_loss: 1.0985, test_f1: 0.6625
 epoch: 73, train_loss: 0.4277, test_loss: 1.1295, test_f1: 0.6738
 epoch: 74, train_loss: 0.4485, test_loss: 1.0538, test_f1: 0.6731
 epoch: 75, train_loss: 0.4040, test_loss: 1.1787, test_f1: 0.6286
 epoch: 76, train_loss: 0.3960, test_loss: 1.0825, test_f1: 0.6508
 epoch: 77, train_loss: 0.4288, test_loss: 1.2103, test_f1: 0.6505
 epoch: 78, train_loss: 0.4143, test_loss: 1.1220, test_f1: 0.6523
 epoch: 79, train_loss: 0.4025, test_loss: 1.1600, test_f1: 0.6615
 epoch: 80, train_loss: 0.4012, test_loss: 1.1772, test_f1: 0.6565
 epoch: 81, train_loss: 0.3987, test_loss: 1.2311, test_f1: 0.6649
 epoch: 82, train_loss: 0.3840, test_loss: 1.3327, test_f1: 0.6559
 epoch: 83, train_loss: 0.3738, test_loss: 1.1971, test_f1: 0.6669
 epoch: 84, train_loss: 0.3917, test_loss: 1.2100, test_f1: 0.6895
 epoch: 85, train_loss: 0.3643, test_loss: 1.2018, test_f1: 0.6664
 epoch: 86, train_loss: 0.3809, test_loss: 1.1363, test_f1: 0.6512
 epoch: 87, train_loss: 0.3810, test_loss: 1.1811, test_f1: 0.6557
 epoch: 88, train_loss: 0.3590, test_loss: 1.3999, test_f1: 0.6468
 epoch: 89, train_loss: 0.3862, test_loss: 1.1766, test_f1: 0.6537
 epoch: 90, train_loss: 0.4100, test_loss: 1.5485, test_f1: 0.6175
 epoch: 91, train_loss: 0.3660, test_loss: 1.2515, test_f1: 0.6481
 epoch: 92, train_loss: 0.3477, test_loss: 1.2078, test_f1: 0.7096
 epoch: 93, train_loss: 0.3627, test_loss: 1.3203, test_f1: 0.6426
 epoch: 94, train_loss: 0.3609, test_loss: 1.2265, test_f1: 0.6829
 epoch: 95, train_loss: 0.3575, test_loss: 1.3696, test_f1: 0.6233
 epoch: 96, train_loss: 0.3919, test_loss: 1.4187, test_f1: 0.6387
 epoch: 97, train_loss: 0.3638, test_loss: 1.3734, test_f1: 0.6623
 epoch: 98, train_loss: 0.3576, test_loss: 1.3912, test_f1: 0.6657
 epoch: 99, train_loss: 0.3470, test_loss: 1.2593, test_f1: 0.6504
##################ITERATION #6 ****************************************
 epoch: 0, train_loss: 1.5327, test_loss: 2.0950, test_f1: 0.2270
 epoch: 1, train_loss: 1.0567, test_loss: 1.3764, test_f1: 0.2848
 epoch: 2, train_loss: 0.9942, test_loss: 1.0116, test_f1: 0.4348
 epoch: 3, train_loss: 0.9615, test_loss: 0.9624, test_f1: 0.5227
 epoch: 4, train_loss: 0.9424, test_loss: 1.0151, test_f1: 0.5287
 epoch: 5, train_loss: 0.9193, test_loss: 0.8996, test_f1: 0.5273
 epoch: 6, train_loss: 0.9106, test_loss: 0.9606, test_f1: 0.5443
 epoch: 7, train_loss: 0.8935, test_loss: 0.9038, test_f1: 0.5121
 epoch: 8, train_loss: 0.8826, test_loss: 0.9157, test_f1: 0.5160
 epoch: 9, train_loss: 0.8592, test_loss: 0.9566, test_f1: 0.5272
 epoch: 10, train_loss: 0.8555, test_loss: 0.8540, test_f1: 0.5652
 epoch: 11, train_loss: 0.8545, test_loss: 0.8884, test_f1: 0.5419
 epoch: 12, train_loss: 0.8270, test_loss: 0.9251, test_f1: 0.5548
 epoch: 13, train_loss: 0.8177, test_loss: 0.9028, test_f1: 0.5543
 epoch: 14, train_loss: 0.7916, test_loss: 0.8713, test_f1: 0.5628
 epoch: 15, train_loss: 0.7974, test_loss: 0.9004, test_f1: 0.5359
 epoch: 16, train_loss: 0.7827, test_loss: 0.8075, test_f1: 0.5703
 epoch: 17, train_loss: 0.7744, test_loss: 0.8441, test_f1: 0.5706
 epoch: 18, train_loss: 0.7500, test_loss: 0.8792, test_f1: 0.5652
 epoch: 19, train_loss: 0.7540, test_loss: 0.8294, test_f1: 0.5792
 epoch: 20, train_loss: 0.7374, test_loss: 0.8835, test_f1: 0.5858
 epoch: 21, train_loss: 0.7358, test_loss: 0.8123, test_f1: 0.6091
 epoch: 22, train_loss: 0.7434, test_loss: 0.9451, test_f1: 0.6110
 epoch: 23, train_loss: 0.7221, test_loss: 0.9172, test_f1: 0.5821
 epoch: 24, train_loss: 0.7131, test_loss: 0.8160, test_f1: 0.6450
 epoch: 25, train_loss: 0.6967, test_loss: 0.8211, test_f1: 0.6206
 epoch: 26, train_loss: 0.6856, test_loss: 1.0771, test_f1: 0.5119
 epoch: 27, train_loss: 0.6921, test_loss: 0.8213, test_f1: 0.6042
 epoch: 28, train_loss: 0.6853, test_loss: 0.8585, test_f1: 0.6358
 epoch: 29, train_loss: 0.6603, test_loss: 1.0815, test_f1: 0.5481
 epoch: 30, train_loss: 0.6480, test_loss: 1.0530, test_f1: 0.5242
 epoch: 31, train_loss: 0.6569, test_loss: 0.9165, test_f1: 0.5956
 epoch: 32, train_loss: 0.6375, test_loss: 0.8240, test_f1: 0.6051
 epoch: 33, train_loss: 0.6361, test_loss: 0.9297, test_f1: 0.5983
 epoch: 34, train_loss: 0.6416, test_loss: 0.9257, test_f1: 0.6208
 epoch: 35, train_loss: 0.6272, test_loss: 0.9328, test_f1: 0.6245
 epoch: 36, train_loss: 0.6054, test_loss: 0.9371, test_f1: 0.6261
 epoch: 37, train_loss: 0.6378, test_loss: 1.0184, test_f1: 0.6531
 epoch: 38, train_loss: 0.6159, test_loss: 0.8424, test_f1: 0.6456
 epoch: 39, train_loss: 0.6017, test_loss: 0.9216, test_f1: 0.6100
 epoch: 40, train_loss: 0.6061, test_loss: 0.9343, test_f1: 0.5922
 epoch: 41, train_loss: 0.6098, test_loss: 1.1353, test_f1: 0.5594
 epoch: 42, train_loss: 0.5991, test_loss: 1.2728, test_f1: 0.5539
 epoch: 43, train_loss: 0.5819, test_loss: 0.8835, test_f1: 0.6498
 epoch: 44, train_loss: 0.5977, test_loss: 0.9398, test_f1: 0.6038
 epoch: 45, train_loss: 0.5673, test_loss: 0.9768, test_f1: 0.6690
 epoch: 46, train_loss: 0.5518, test_loss: 1.0441, test_f1: 0.6170
 epoch: 47, train_loss: 0.5469, test_loss: 0.8657, test_f1: 0.6793
 epoch: 48, train_loss: 0.5528, test_loss: 0.8484, test_f1: 0.6538
 epoch: 49, train_loss: 0.5551, test_loss: 0.7958, test_f1: 0.6800
 epoch: 50, train_loss: 0.5422, test_loss: 0.9455, test_f1: 0.6618
 epoch: 51, train_loss: 0.5324, test_loss: 0.7947, test_f1: 0.6527
 epoch: 52, train_loss: 0.5055, test_loss: 0.7912, test_f1: 0.6986
 epoch: 53, train_loss: 0.4816, test_loss: 0.9365, test_f1: 0.6651
 epoch: 54, train_loss: 0.4809, test_loss: 0.9188, test_f1: 0.6883
 epoch: 55, train_loss: 0.4702, test_loss: 0.8121, test_f1: 0.6834
 epoch: 56, train_loss: 0.4504, test_loss: 0.8948, test_f1: 0.7087
 epoch: 57, train_loss: 0.4592, test_loss: 1.0263, test_f1: 0.6605
 epoch: 58, train_loss: 0.4661, test_loss: 1.0315, test_f1: 0.6385
 epoch: 59, train_loss: 0.4910, test_loss: 0.8708, test_f1: 0.6611
 epoch: 60, train_loss: 0.4444, test_loss: 0.8110, test_f1: 0.7045
 epoch: 61, train_loss: 0.4482, test_loss: 0.8496, test_f1: 0.6880
 epoch: 62, train_loss: 0.4402, test_loss: 0.8794, test_f1: 0.6523
 epoch: 63, train_loss: 0.4253, test_loss: 1.0831, test_f1: 0.6431
 epoch: 64, train_loss: 0.4362, test_loss: 0.9092, test_f1: 0.6734
 epoch: 65, train_loss: 0.4547, test_loss: 0.8222, test_f1: 0.6969
 epoch: 66, train_loss: 0.4537, test_loss: 0.7777, test_f1: 0.6791
 epoch: 67, train_loss: 0.4549, test_loss: 0.9175, test_f1: 0.6436
 epoch: 68, train_loss: 0.4295, test_loss: 0.8276, test_f1: 0.6668
 epoch: 69, train_loss: 0.4353, test_loss: 0.8072, test_f1: 0.6847
 epoch: 70, train_loss: 0.4057, test_loss: 0.8998, test_f1: 0.6691
 epoch: 71, train_loss: 0.4115, test_loss: 0.8124, test_f1: 0.6912
 epoch: 72, train_loss: 0.4071, test_loss: 0.8215, test_f1: 0.7054
 epoch: 73, train_loss: 0.4378, test_loss: 1.0352, test_f1: 0.6515
 epoch: 74, train_loss: 0.4336, test_loss: 0.9915, test_f1: 0.6668
 epoch: 75, train_loss: 0.4235, test_loss: 0.8902, test_f1: 0.6796
 epoch: 76, train_loss: 0.4133, test_loss: 0.9817, test_f1: 0.6898
 epoch: 77, train_loss: 0.4094, test_loss: 0.9770, test_f1: 0.6527
 epoch: 78, train_loss: 0.4210, test_loss: 0.9792, test_f1: 0.6519
 epoch: 79, train_loss: 0.4164, test_loss: 1.0300, test_f1: 0.6331
 epoch: 80, train_loss: 0.4018, test_loss: 0.9284, test_f1: 0.6845
 epoch: 81, train_loss: 0.3889, test_loss: 1.0816, test_f1: 0.6758
 epoch: 82, train_loss: 0.3879, test_loss: 0.8282, test_f1: 0.7106
 epoch: 83, train_loss: 0.3711, test_loss: 1.5410, test_f1: 0.6590
 epoch: 84, train_loss: 0.3821, test_loss: 1.1395, test_f1: 0.6645
 epoch: 85, train_loss: 0.3739, test_loss: 0.9088, test_f1: 0.7063
 epoch: 86, train_loss: 0.3822, test_loss: 1.1379, test_f1: 0.6687
 epoch: 87, train_loss: 0.3688, test_loss: 1.0710, test_f1: 0.6958
 epoch: 88, train_loss: 0.3800, test_loss: 1.0101, test_f1: 0.6582
 epoch: 89, train_loss: 0.3742, test_loss: 1.3575, test_f1: 0.6318
 epoch: 90, train_loss: 0.3664, test_loss: 1.0797, test_f1: 0.6588
 epoch: 91, train_loss: 0.3851, test_loss: 1.0049, test_f1: 0.6662
 epoch: 92, train_loss: 0.3659, test_loss: 0.9049, test_f1: 0.7002
 epoch: 93, train_loss: 0.3776, test_loss: 1.3856, test_f1: 0.6822
 epoch: 94, train_loss: 0.3748, test_loss: 1.2036, test_f1: 0.6576
 epoch: 95, train_loss: 0.3829, test_loss: 1.1540, test_f1: 0.6455
 epoch: 96, train_loss: 0.3686, test_loss: 1.1095, test_f1: 0.6428
 epoch: 97, train_loss: 0.4003, test_loss: 1.1217, test_f1: 0.6294
 epoch: 98, train_loss: 0.3727, test_loss: 1.1039, test_f1: 0.6403
 epoch: 99, train_loss: 0.3710, test_loss: 0.9256, test_f1: 0.6935
##################ITERATION #7 ****************************************
 epoch: 0, train_loss: 1.3857, test_loss: 1.6175, test_f1: 0.2270
 epoch: 1, train_loss: 1.0151, test_loss: 1.4114, test_f1: 0.2392
 epoch: 2, train_loss: 0.9859, test_loss: 1.0244, test_f1: 0.4401
 epoch: 3, train_loss: 0.9500, test_loss: 1.0169, test_f1: 0.4606
 epoch: 4, train_loss: 0.9307, test_loss: 1.0198, test_f1: 0.4337
 epoch: 5, train_loss: 0.9038, test_loss: 0.9999, test_f1: 0.4991
 epoch: 6, train_loss: 0.8864, test_loss: 0.9451, test_f1: 0.5314
 epoch: 7, train_loss: 0.8652, test_loss: 0.9296, test_f1: 0.5359
 epoch: 8, train_loss: 0.8689, test_loss: 0.9156, test_f1: 0.5139
 epoch: 9, train_loss: 0.8312, test_loss: 0.9240, test_f1: 0.5079
 epoch: 10, train_loss: 0.8292, test_loss: 0.8658, test_f1: 0.5404
 epoch: 11, train_loss: 0.8120, test_loss: 0.8913, test_f1: 0.5285
 epoch: 12, train_loss: 0.7954, test_loss: 0.8799, test_f1: 0.5948
 epoch: 13, train_loss: 0.7730, test_loss: 0.9907, test_f1: 0.5477
 epoch: 14, train_loss: 0.7618, test_loss: 0.8502, test_f1: 0.5743
 epoch: 15, train_loss: 0.7502, test_loss: 0.8661, test_f1: 0.6092
 epoch: 16, train_loss: 0.7446, test_loss: 0.8217, test_f1: 0.6064
 epoch: 17, train_loss: 0.7419, test_loss: 0.8447, test_f1: 0.5939
 epoch: 18, train_loss: 0.7284, test_loss: 0.7731, test_f1: 0.6142
 epoch: 19, train_loss: 0.7315, test_loss: 0.8521, test_f1: 0.6296
 epoch: 20, train_loss: 0.7146, test_loss: 0.9539, test_f1: 0.5863
 epoch: 21, train_loss: 0.6901, test_loss: 1.0973, test_f1: 0.5231
 epoch: 22, train_loss: 0.7031, test_loss: 0.8188, test_f1: 0.6033
 epoch: 23, train_loss: 0.7090, test_loss: 0.8347, test_f1: 0.6400
 epoch: 24, train_loss: 0.6853, test_loss: 0.8045, test_f1: 0.6199
 epoch: 25, train_loss: 0.6690, test_loss: 0.9041, test_f1: 0.5815
 epoch: 26, train_loss: 0.6559, test_loss: 0.9526, test_f1: 0.6168
 epoch: 27, train_loss: 0.6667, test_loss: 0.8648, test_f1: 0.5978
 epoch: 28, train_loss: 0.6504, test_loss: 0.8142, test_f1: 0.6315
 epoch: 29, train_loss: 0.6581, test_loss: 0.8676, test_f1: 0.6454
 epoch: 30, train_loss: 0.6300, test_loss: 0.8697, test_f1: 0.6166
 epoch: 31, train_loss: 0.6381, test_loss: 0.8012, test_f1: 0.6301
 epoch: 32, train_loss: 0.6474, test_loss: 0.8415, test_f1: 0.6493
 epoch: 33, train_loss: 0.6427, test_loss: 0.8686, test_f1: 0.6103
 epoch: 34, train_loss: 0.6332, test_loss: 0.9289, test_f1: 0.6432
 epoch: 35, train_loss: 0.6329, test_loss: 0.8855, test_f1: 0.6400
 epoch: 36, train_loss: 0.6179, test_loss: 0.9289, test_f1: 0.6639
 epoch: 37, train_loss: 0.6130, test_loss: 1.0213, test_f1: 0.6048
 epoch: 38, train_loss: 0.5888, test_loss: 0.8855, test_f1: 0.6410
 epoch: 39, train_loss: 0.5810, test_loss: 0.8683, test_f1: 0.6601
 epoch: 40, train_loss: 0.5670, test_loss: 1.4195, test_f1: 0.5416
 epoch: 41, train_loss: 0.5717, test_loss: 0.9487, test_f1: 0.6585
 epoch: 42, train_loss: 0.5528, test_loss: 1.1468, test_f1: 0.6022
 epoch: 43, train_loss: 0.5615, test_loss: 1.0864, test_f1: 0.5981
 epoch: 44, train_loss: 0.5611, test_loss: 1.2066, test_f1: 0.5436
 epoch: 45, train_loss: 0.5665, test_loss: 0.8429, test_f1: 0.6718
 epoch: 46, train_loss: 0.5419, test_loss: 0.9508, test_f1: 0.6377
 epoch: 47, train_loss: 0.5384, test_loss: 1.1129, test_f1: 0.5386
 epoch: 48, train_loss: 0.5368, test_loss: 1.1071, test_f1: 0.6631
 epoch: 49, train_loss: 0.5305, test_loss: 0.9657, test_f1: 0.6372
 epoch: 50, train_loss: 0.5250, test_loss: 1.1136, test_f1: 0.6382
 epoch: 51, train_loss: 0.5060, test_loss: 0.9859, test_f1: 0.7080
 epoch: 52, train_loss: 0.4611, test_loss: 0.9282, test_f1: 0.6995
 epoch: 53, train_loss: 0.4535, test_loss: 0.9796, test_f1: 0.6895
 epoch: 54, train_loss: 0.4259, test_loss: 0.9751, test_f1: 0.7040
 epoch: 55, train_loss: 0.4330, test_loss: 1.0499, test_f1: 0.6919
 epoch: 56, train_loss: 0.4324, test_loss: 1.0141, test_f1: 0.6935
 epoch: 57, train_loss: 0.4452, test_loss: 1.0984, test_f1: 0.6972
 epoch: 58, train_loss: 0.4094, test_loss: 0.9927, test_f1: 0.7038
 epoch: 59, train_loss: 0.4106, test_loss: 1.1864, test_f1: 0.6947
 epoch: 60, train_loss: 0.4102, test_loss: 1.0909, test_f1: 0.6682
 epoch: 61, train_loss: 0.4076, test_loss: 1.0970, test_f1: 0.6821
 epoch: 62, train_loss: 0.4014, test_loss: 1.0905, test_f1: 0.7086
 epoch: 63, train_loss: 0.3991, test_loss: 1.1240, test_f1: 0.6933
 epoch: 64, train_loss: 0.3861, test_loss: 1.2097, test_f1: 0.6828
 epoch: 65, train_loss: 0.4021, test_loss: 1.1380, test_f1: 0.7060
 epoch: 66, train_loss: 0.3927, test_loss: 1.3081, test_f1: 0.6826
 epoch: 67, train_loss: 0.3893, test_loss: 1.1987, test_f1: 0.7029
 epoch: 68, train_loss: 0.3925, test_loss: 1.1752, test_f1: 0.6977
 epoch: 69, train_loss: 0.3828, test_loss: 1.1919, test_f1: 0.7067
 epoch: 70, train_loss: 0.3934, test_loss: 1.4553, test_f1: 0.6470
 epoch: 71, train_loss: 0.3734, test_loss: 1.2151, test_f1: 0.7075
 epoch: 72, train_loss: 0.3590, test_loss: 1.2774, test_f1: 0.6574
 epoch: 73, train_loss: 0.3750, test_loss: 1.2297, test_f1: 0.7127
 epoch: 74, train_loss: 0.3981, test_loss: 1.1509, test_f1: 0.7180
 epoch: 75, train_loss: 0.3744, test_loss: 1.3273, test_f1: 0.6336
 epoch: 76, train_loss: 0.3705, test_loss: 1.3576, test_f1: 0.6606
 epoch: 77, train_loss: 0.3590, test_loss: 1.3880, test_f1: 0.6800
 epoch: 78, train_loss: 0.3767, test_loss: 1.3788, test_f1: 0.6594
 epoch: 79, train_loss: 0.3983, test_loss: 1.3628, test_f1: 0.5953
 epoch: 80, train_loss: 0.3664, test_loss: 1.2035, test_f1: 0.7005
 epoch: 81, train_loss: 0.3589, test_loss: 1.3515, test_f1: 0.6934
 epoch: 82, train_loss: 0.3376, test_loss: 1.4142, test_f1: 0.6932
 epoch: 83, train_loss: 0.3384, test_loss: 1.6109, test_f1: 0.6438
 epoch: 84, train_loss: 0.3346, test_loss: 1.2045, test_f1: 0.7037
 epoch: 85, train_loss: 0.3377, test_loss: 1.4159, test_f1: 0.6955
 epoch: 86, train_loss: 0.3368, test_loss: 1.6640, test_f1: 0.6378
 epoch: 87, train_loss: 0.3275, test_loss: 1.2638, test_f1: 0.7122
 epoch: 88, train_loss: 0.3126, test_loss: 1.4673, test_f1: 0.6877
 epoch: 89, train_loss: 0.3369, test_loss: 1.4296, test_f1: 0.6859
 epoch: 90, train_loss: 0.3466, test_loss: 1.5239, test_f1: 0.6584
 epoch: 91, train_loss: 0.3300, test_loss: 1.5555, test_f1: 0.6576
 epoch: 92, train_loss: 0.3404, test_loss: 1.4519, test_f1: 0.6674
 epoch: 93, train_loss: 0.3463, test_loss: 1.4074, test_f1: 0.6893
 epoch: 94, train_loss: 0.3410, test_loss: 1.2473, test_f1: 0.6967
 epoch: 95, train_loss: 0.3161, test_loss: 1.2684, test_f1: 0.6905
 epoch: 96, train_loss: 0.3145, test_loss: 1.3964, test_f1: 0.7165
 epoch: 97, train_loss: 0.3164, test_loss: 1.3848, test_f1: 0.6717
 epoch: 98, train_loss: 0.3186, test_loss: 1.6245, test_f1: 0.6584
 epoch: 99, train_loss: 0.2960, test_loss: 1.7820, test_f1: 0.6490
##################ITERATION #8 ****************************************
 epoch: 0, train_loss: 1.7715, test_loss: 1.2499, test_f1: 0.2270
 epoch: 1, train_loss: 1.0394, test_loss: 1.1194, test_f1: 0.3863
 epoch: 2, train_loss: 0.9701, test_loss: 1.0471, test_f1: 0.3697
 epoch: 3, train_loss: 0.9340, test_loss: 1.0246, test_f1: 0.4613
 epoch: 4, train_loss: 0.9016, test_loss: 0.9588, test_f1: 0.5178
 epoch: 5, train_loss: 0.8662, test_loss: 0.9117, test_f1: 0.5541
 epoch: 6, train_loss: 0.8391, test_loss: 0.8712, test_f1: 0.5580
 epoch: 7, train_loss: 0.8175, test_loss: 0.8961, test_f1: 0.5428
 epoch: 8, train_loss: 0.8095, test_loss: 0.9013, test_f1: 0.5398
 epoch: 9, train_loss: 0.7803, test_loss: 0.8442, test_f1: 0.5704
 epoch: 10, train_loss: 0.7731, test_loss: 0.8449, test_f1: 0.5646
 epoch: 11, train_loss: 0.7748, test_loss: 0.8208, test_f1: 0.5918
 epoch: 12, train_loss: 0.7478, test_loss: 0.9382, test_f1: 0.5430
 epoch: 13, train_loss: 0.7370, test_loss: 0.8748, test_f1: 0.5821
 epoch: 14, train_loss: 0.7250, test_loss: 0.8248, test_f1: 0.6169
 epoch: 15, train_loss: 0.7270, test_loss: 0.9688, test_f1: 0.6187
 epoch: 16, train_loss: 0.7077, test_loss: 0.8457, test_f1: 0.6174
 epoch: 17, train_loss: 0.7106, test_loss: 0.8119, test_f1: 0.6010
 epoch: 18, train_loss: 0.6927, test_loss: 0.8185, test_f1: 0.6063
 epoch: 19, train_loss: 0.6747, test_loss: 0.8655, test_f1: 0.6098
 epoch: 20, train_loss: 0.6627, test_loss: 0.8193, test_f1: 0.6104
 epoch: 21, train_loss: 0.6666, test_loss: 0.8174, test_f1: 0.6264
 epoch: 22, train_loss: 0.6514, test_loss: 0.8991, test_f1: 0.6219
 epoch: 23, train_loss: 0.6314, test_loss: 0.7621, test_f1: 0.6477
 epoch: 24, train_loss: 0.6261, test_loss: 0.8202, test_f1: 0.6333
 epoch: 25, train_loss: 0.6171, test_loss: 0.8112, test_f1: 0.6445
 epoch: 26, train_loss: 0.6290, test_loss: 0.7440, test_f1: 0.6395
 epoch: 27, train_loss: 0.5993, test_loss: 0.9473, test_f1: 0.6438
 epoch: 28, train_loss: 0.6115, test_loss: 0.8722, test_f1: 0.6412
 epoch: 29, train_loss: 0.5892, test_loss: 0.8133, test_f1: 0.6547
 epoch: 30, train_loss: 0.5899, test_loss: 0.8871, test_f1: 0.6270
 epoch: 31, train_loss: 0.5939, test_loss: 0.8677, test_f1: 0.6387
 epoch: 32, train_loss: 0.5799, test_loss: 0.7435, test_f1: 0.6717
 epoch: 33, train_loss: 0.5703, test_loss: 0.7755, test_f1: 0.6456
 epoch: 34, train_loss: 0.5633, test_loss: 0.8267, test_f1: 0.6464
 epoch: 35, train_loss: 0.5527, test_loss: 0.7925, test_f1: 0.6551
 epoch: 36, train_loss: 0.5676, test_loss: 0.8760, test_f1: 0.6498
 epoch: 37, train_loss: 0.5697, test_loss: 1.1003, test_f1: 0.6231
 epoch: 38, train_loss: 0.5455, test_loss: 0.9782, test_f1: 0.5998
 epoch: 39, train_loss: 0.5387, test_loss: 0.7911, test_f1: 0.6611
 epoch: 40, train_loss: 0.5309, test_loss: 0.9097, test_f1: 0.6359
 epoch: 41, train_loss: 0.5425, test_loss: 0.8730, test_f1: 0.6715
 epoch: 42, train_loss: 0.5196, test_loss: 0.8182, test_f1: 0.6547
 epoch: 43, train_loss: 0.5187, test_loss: 0.8028, test_f1: 0.6886
 epoch: 44, train_loss: 0.5134, test_loss: 0.8016, test_f1: 0.6735
 epoch: 45, train_loss: 0.5430, test_loss: 0.9019, test_f1: 0.6534
 epoch: 46, train_loss: 0.5087, test_loss: 0.8862, test_f1: 0.6305
 epoch: 47, train_loss: 0.4958, test_loss: 0.8191, test_f1: 0.6685
 epoch: 48, train_loss: 0.5077, test_loss: 0.8521, test_f1: 0.6830
 epoch: 49, train_loss: 0.4921, test_loss: 0.9219, test_f1: 0.6222
 epoch: 50, train_loss: 0.4786, test_loss: 0.8019, test_f1: 0.6819
 epoch: 51, train_loss: 0.4735, test_loss: 0.8379, test_f1: 0.6841
 epoch: 52, train_loss: 0.4383, test_loss: 0.7734, test_f1: 0.6926
 epoch: 53, train_loss: 0.4164, test_loss: 0.8622, test_f1: 0.6920
 epoch: 54, train_loss: 0.4057, test_loss: 0.8229, test_f1: 0.6902
 epoch: 55, train_loss: 0.4136, test_loss: 0.8073, test_f1: 0.6658
 epoch: 56, train_loss: 0.4189, test_loss: 0.8957, test_f1: 0.6687
 epoch: 57, train_loss: 0.4202, test_loss: 0.9145, test_f1: 0.6734
 epoch: 58, train_loss: 0.4215, test_loss: 0.9600, test_f1: 0.6745
 epoch: 59, train_loss: 0.4112, test_loss: 0.8300, test_f1: 0.7087
 epoch: 60, train_loss: 0.3874, test_loss: 0.9134, test_f1: 0.6903
 epoch: 61, train_loss: 0.3937, test_loss: 0.9149, test_f1: 0.6820
 epoch: 62, train_loss: 0.3871, test_loss: 0.8861, test_f1: 0.6958
 epoch: 63, train_loss: 0.3916, test_loss: 0.9402, test_f1: 0.6519
 epoch: 64, train_loss: 0.3845, test_loss: 0.8915, test_f1: 0.7038
 epoch: 65, train_loss: 0.3895, test_loss: 0.9825, test_f1: 0.7246
 epoch: 66, train_loss: 0.3831, test_loss: 1.0177, test_f1: 0.6704
 epoch: 67, train_loss: 0.4009, test_loss: 0.9166, test_f1: 0.6762
 epoch: 68, train_loss: 0.3780, test_loss: 0.9076, test_f1: 0.6929
 epoch: 69, train_loss: 0.3612, test_loss: 1.0288, test_f1: 0.6868
 epoch: 70, train_loss: 0.3778, test_loss: 0.8701, test_f1: 0.7130
 epoch: 71, train_loss: 0.3795, test_loss: 1.1221, test_f1: 0.6707
 epoch: 72, train_loss: 0.3576, test_loss: 0.9962, test_f1: 0.6858
 epoch: 73, train_loss: 0.3584, test_loss: 0.9827, test_f1: 0.6550
 epoch: 74, train_loss: 0.3767, test_loss: 1.0156, test_f1: 0.6734
 epoch: 75, train_loss: 0.3766, test_loss: 0.8979, test_f1: 0.6870
 epoch: 76, train_loss: 0.3605, test_loss: 0.9874, test_f1: 0.7077
 epoch: 77, train_loss: 0.3669, test_loss: 1.0048, test_f1: 0.6702
 epoch: 78, train_loss: 0.3636, test_loss: 1.0410, test_f1: 0.6771
 epoch: 79, train_loss: 0.3710, test_loss: 1.0042, test_f1: 0.6952
 epoch: 80, train_loss: 0.3811, test_loss: 1.0197, test_f1: 0.6847
 epoch: 81, train_loss: 0.3652, test_loss: 1.1052, test_f1: 0.6857
 epoch: 82, train_loss: 0.3661, test_loss: 0.9951, test_f1: 0.6788
 epoch: 83, train_loss: 0.3328, test_loss: 1.1592, test_f1: 0.6903
 epoch: 84, train_loss: 0.3322, test_loss: 1.0563, test_f1: 0.6767
 epoch: 85, train_loss: 0.3576, test_loss: 1.0732, test_f1: 0.6773
 epoch: 86, train_loss: 0.3407, test_loss: 1.1397, test_f1: 0.6733
 epoch: 87, train_loss: 0.3475, test_loss: 1.0254, test_f1: 0.6877
 epoch: 88, train_loss: 0.3212, test_loss: 1.0325, test_f1: 0.6859
 epoch: 89, train_loss: 0.3219, test_loss: 1.0956, test_f1: 0.6804
 epoch: 90, train_loss: 0.3303, test_loss: 1.1147, test_f1: 0.6944
 epoch: 91, train_loss: 0.3083, test_loss: 1.1108, test_f1: 0.6775
 epoch: 92, train_loss: 0.3081, test_loss: 1.3607, test_f1: 0.6757
 epoch: 93, train_loss: 0.3265, test_loss: 1.1187, test_f1: 0.6854
 epoch: 94, train_loss: 0.3273, test_loss: 1.1027, test_f1: 0.6794
 epoch: 95, train_loss: 0.3211, test_loss: 1.2016, test_f1: 0.6904
 epoch: 96, train_loss: 0.3224, test_loss: 1.0302, test_f1: 0.6921
 epoch: 97, train_loss: 0.3250, test_loss: 1.1994, test_f1: 0.6738
 epoch: 98, train_loss: 0.3159, test_loss: 1.1852, test_f1: 0.7020
 epoch: 99, train_loss: 0.3097, test_loss: 1.2362, test_f1: 0.6755
##################ITERATION #9 ****************************************
 epoch: 0, train_loss: 1.5628, test_loss: 1.6460, test_f1: 0.2500
 epoch: 1, train_loss: 1.0517, test_loss: 1.1947, test_f1: 0.3318
 epoch: 2, train_loss: 0.9783, test_loss: 1.0197, test_f1: 0.4339
 epoch: 3, train_loss: 0.9460, test_loss: 0.9920, test_f1: 0.4500
 epoch: 4, train_loss: 0.9273, test_loss: 0.9869, test_f1: 0.4370
 epoch: 5, train_loss: 0.9026, test_loss: 0.9183, test_f1: 0.5379
 epoch: 6, train_loss: 0.8760, test_loss: 0.9313, test_f1: 0.5229
 epoch: 7, train_loss: 0.8399, test_loss: 0.8912, test_f1: 0.5736
 epoch: 8, train_loss: 0.8378, test_loss: 0.8385, test_f1: 0.5675
 epoch: 9, train_loss: 0.8179, test_loss: 0.8322, test_f1: 0.5627
 epoch: 10, train_loss: 0.8077, test_loss: 1.0244, test_f1: 0.5283
 epoch: 11, train_loss: 0.7925, test_loss: 0.8241, test_f1: 0.5915
 epoch: 12, train_loss: 0.7724, test_loss: 0.8474, test_f1: 0.5971
 epoch: 13, train_loss: 0.7474, test_loss: 0.8136, test_f1: 0.6220
 epoch: 14, train_loss: 0.7462, test_loss: 0.8733, test_f1: 0.5702
 epoch: 15, train_loss: 0.7481, test_loss: 0.9739, test_f1: 0.5486
 epoch: 16, train_loss: 0.7194, test_loss: 0.9229, test_f1: 0.5938
 epoch: 17, train_loss: 0.7034, test_loss: 0.9475, test_f1: 0.5933
 epoch: 18, train_loss: 0.6940, test_loss: 1.0246, test_f1: 0.5708
 epoch: 19, train_loss: 0.6805, test_loss: 0.8070, test_f1: 0.6366
 epoch: 20, train_loss: 0.7031, test_loss: 0.8378, test_f1: 0.6138
 epoch: 21, train_loss: 0.6732, test_loss: 0.9119, test_f1: 0.6338
 epoch: 22, train_loss: 0.6560, test_loss: 1.1046, test_f1: 0.5676
 epoch: 23, train_loss: 0.6428, test_loss: 0.9175, test_f1: 0.6329
 epoch: 24, train_loss: 0.6396, test_loss: 0.8872, test_f1: 0.5791
 epoch: 25, train_loss: 0.6508, test_loss: 0.8594, test_f1: 0.6341
 epoch: 26, train_loss: 0.6320, test_loss: 1.0123, test_f1: 0.6048
 epoch: 27, train_loss: 0.6451, test_loss: 0.9679, test_f1: 0.6150
 epoch: 28, train_loss: 0.6457, test_loss: 1.0144, test_f1: 0.5717
 epoch: 29, train_loss: 0.6305, test_loss: 0.9246, test_f1: 0.6474
 epoch: 30, train_loss: 0.6114, test_loss: 0.9428, test_f1: 0.6137
 epoch: 31, train_loss: 0.5955, test_loss: 0.9443, test_f1: 0.5794
 epoch: 32, train_loss: 0.5925, test_loss: 1.0928, test_f1: 0.6130
 epoch: 33, train_loss: 0.6082, test_loss: 1.0609, test_f1: 0.5998
 epoch: 34, train_loss: 0.5770, test_loss: 0.9158, test_f1: 0.6272
 epoch: 35, train_loss: 0.5439, test_loss: 0.9924, test_f1: 0.6053
 epoch: 36, train_loss: 0.5619, test_loss: 1.1571, test_f1: 0.5914
 epoch: 37, train_loss: 0.5696, test_loss: 0.9465, test_f1: 0.6539
 epoch: 38, train_loss: 0.5498, test_loss: 0.9702, test_f1: 0.6377
 epoch: 39, train_loss: 0.5380, test_loss: 0.9547, test_f1: 0.6633
 epoch: 40, train_loss: 0.5568, test_loss: 1.0975, test_f1: 0.6146
 epoch: 41, train_loss: 0.5842, test_loss: 0.9732, test_f1: 0.6089
 epoch: 42, train_loss: 0.5404, test_loss: 0.9720, test_f1: 0.6639
 epoch: 43, train_loss: 0.5102, test_loss: 1.0451, test_f1: 0.6249
 epoch: 44, train_loss: 0.5047, test_loss: 1.0315, test_f1: 0.6665
 epoch: 45, train_loss: 0.4952, test_loss: 1.1623, test_f1: 0.6497
 epoch: 46, train_loss: 0.5018, test_loss: 1.0216, test_f1: 0.6402
 epoch: 47, train_loss: 0.5013, test_loss: 1.2764, test_f1: 0.6283
 epoch: 48, train_loss: 0.5056, test_loss: 0.9904, test_f1: 0.6705
 epoch: 49, train_loss: 0.5012, test_loss: 1.0863, test_f1: 0.6434
 epoch: 50, train_loss: 0.4997, test_loss: 1.0505, test_f1: 0.6553
 epoch: 51, train_loss: 0.4879, test_loss: 0.9791, test_f1: 0.6557
 epoch: 52, train_loss: 0.4466, test_loss: 1.0284, test_f1: 0.6601
 epoch: 53, train_loss: 0.4344, test_loss: 1.1968, test_f1: 0.6323
 epoch: 54, train_loss: 0.4128, test_loss: 1.0864, test_f1: 0.6653
 epoch: 55, train_loss: 0.4171, test_loss: 1.0824, test_f1: 0.6796
 epoch: 56, train_loss: 0.3979, test_loss: 1.0999, test_f1: 0.6622
 epoch: 57, train_loss: 0.3973, test_loss: 1.1896, test_f1: 0.6478
 epoch: 58, train_loss: 0.4130, test_loss: 1.0494, test_f1: 0.6652
 epoch: 59, train_loss: 0.3967, test_loss: 1.1076, test_f1: 0.6636
 epoch: 60, train_loss: 0.3750, test_loss: 1.1937, test_f1: 0.6514
 epoch: 61, train_loss: 0.3893, test_loss: 1.1529, test_f1: 0.6818
 epoch: 62, train_loss: 0.3686, test_loss: 1.1669, test_f1: 0.6566
 epoch: 63, train_loss: 0.3848, test_loss: 1.2833, test_f1: 0.6623
 epoch: 64, train_loss: 0.3703, test_loss: 1.1595, test_f1: 0.6701
 epoch: 65, train_loss: 0.3407, test_loss: 1.3369, test_f1: 0.6853
 epoch: 66, train_loss: 0.3537, test_loss: 1.0964, test_f1: 0.6830
 epoch: 67, train_loss: 0.3434, test_loss: 1.1820, test_f1: 0.6867
 epoch: 68, train_loss: 0.3477, test_loss: 1.3005, test_f1: 0.6379
 epoch: 69, train_loss: 0.3359, test_loss: 1.2291, test_f1: 0.6872
 epoch: 70, train_loss: 0.3353, test_loss: 1.3121, test_f1: 0.6553
 epoch: 71, train_loss: 0.3378, test_loss: 1.2450, test_f1: 0.6533
 epoch: 72, train_loss: 0.3398, test_loss: 1.2236, test_f1: 0.6752
 epoch: 73, train_loss: 0.3568, test_loss: 1.2123, test_f1: 0.6759
 epoch: 74, train_loss: 0.3594, test_loss: 1.2923, test_f1: 0.6771
 epoch: 75, train_loss: 0.3240, test_loss: 1.2518, test_f1: 0.6886
 epoch: 76, train_loss: 0.3269, test_loss: 1.3395, test_f1: 0.6760
 epoch: 77, train_loss: 0.3500, test_loss: 1.4652, test_f1: 0.6670
 epoch: 78, train_loss: 0.3338, test_loss: 1.4119, test_f1: 0.6474
 epoch: 79, train_loss: 0.3215, test_loss: 1.2769, test_f1: 0.6379
 epoch: 80, train_loss: 0.3341, test_loss: 1.2195, test_f1: 0.6730
 epoch: 81, train_loss: 0.3024, test_loss: 1.3137, test_f1: 0.6712
 epoch: 82, train_loss: 0.3339, test_loss: 1.3796, test_f1: 0.6737
 epoch: 83, train_loss: 0.3653, test_loss: 1.3449, test_f1: 0.6808
 epoch: 84, train_loss: 0.3206, test_loss: 1.3726, test_f1: 0.6712
 epoch: 85, train_loss: 0.2996, test_loss: 1.4649, test_f1: 0.6767
 epoch: 86, train_loss: 0.3080, test_loss: 1.3120, test_f1: 0.6578
 epoch: 87, train_loss: 0.3230, test_loss: 1.4653, test_f1: 0.6661
 epoch: 88, train_loss: 0.3370, test_loss: 1.4616, test_f1: 0.6233
 epoch: 89, train_loss: 0.3330, test_loss: 1.4904, test_f1: 0.6949
 epoch: 90, train_loss: 0.3087, test_loss: 1.5054, test_f1: 0.6620
 epoch: 91, train_loss: 0.3020, test_loss: 1.5264, test_f1: 0.6888
 epoch: 92, train_loss: 0.2962, test_loss: 1.4097, test_f1: 0.6770
 epoch: 93, train_loss: 0.3024, test_loss: 1.4307, test_f1: 0.6587
 epoch: 94, train_loss: 0.2963, test_loss: 1.6018, test_f1: 0.6320
 epoch: 95, train_loss: 0.2854, test_loss: 1.3520, test_f1: 0.6750
 epoch: 96, train_loss: 0.3018, test_loss: 1.4125, test_f1: 0.6788
 epoch: 97, train_loss: 0.2755, test_loss: 1.4489, test_f1: 0.6754
 epoch: 98, train_loss: 0.3062, test_loss: 1.4029, test_f1: 0.7134
 epoch: 99, train_loss: 0.2883, test_loss: 1.4390, test_f1: 0.6784

Training completed in 406.80 seconds
Best F1: 0.7246 at epoch 65
Mean F1 across iterations: 0.7063  0.0117
========================FINAL RESULTS================================
FEGIN weighted F1: 0.7246  0.0117
python main.py --data ltspice_examples --representation component_pin_net --model FEGIN --layers 2 --hiddens 64 --batch_size 256 --lr 0.01 --emb_size 128 --epochs 100 --save_appendix component_pin_net_L2_H64_BS256_LR0.01_E128 --no_val
-----



STDERR:
  File "main.py", line 370, in <module>
    main()
  File "main.py", line 254, in main
    dataset = dataset_class(
  File "/home/philip/projects/ltspice_examples_code_repo/Circuit-Completion-Using-GNNs/component_classification_with_link_prediction_head/evaluation/FEGIN/kernel/circuit_datasets.py", line 15, in __init__
    self.data, self.slices = torch.load(self.processed_paths[0])
  File "/home/philip/.local/lib/python3.8/site-packages/torch/serialization.py", line 1040, in load
    warnings.warn(
  File "/usr/lib/python3.8/warnings.py", line 109, in _showwarnmsg
    sw(msg.message, msg.category, msg.filename, msg.lineno,
  File "main.py", line 47, in warn_with_traceback
    traceback.print_stack(file=log)
/home/philip/projects/ltspice_examples_code_repo/Circuit-Completion-Using-GNNs/component_classification_with_link_prediction_head/evaluation/FEGIN/kernel/circuit_datasets.py:15: FutureWarning: You are using `torch.load` with `weights_only=False` (the current default value), which uses the default pickle module implicitly. It is possible to construct malicious pickle data which will execute arbitrary code during unpickling (See https://github.com/pytorch/pytorch/blob/main/SECURITY.md#untrusted-models for more details). In a future release, the default value for `weights_only` will be flipped to `True`. This limits the functions that could be executed during unpickling. Arbitrary objects will no longer be allowed to be loaded via this mode unless they are explicitly allowlisted by the user via `torch.serialization.add_safe_globals`. We recommend you start setting `weights_only=True` for any use case where you don't have full control of the loaded file. Please open an issue on GitHub for any issues related to this experimental feature.
  self.data, self.slices = torch.load(self.processed_paths[0])
